      -----------------------------------------------------------      
     |                   =====================                   |     
     |                           x T B                           |     
     |                   =====================                   |     
     |                         S. Grimme                         |     
     |          Mulliken Center for Theoretical Chemistry        |     
     |                    University of Bonn                     |     
     |                Version 6.2 RC2 (SAW190805)                |     
      -----------------------------------------------------------      

   This program is distributed in the hope that it will be useful,
   but WITHOUT ANY WARRANTY; without even the implied warranty of
   MERCHANTABILITY or FITNESS FOR A PARTICULAR PURPOSE.
   
   FOR NON-COMMERCIAL, ACADEMIA USE ONLY.
   
   Cite this work as:
   * S. Grimme, C. Bannwarth, P. Shushkov, J. Chem. Theory Comput., 2017,
     13, 1989-2009. DOI: 10.1021/acs.jctc.7b00118
   * C. Bannwarth, S. Ehlert and S. Grimme., J. Chem. Theory Comput., 2019,
     15, 1652-1671. DOI: 10.1021/acs.jctc.8b01176
   * P. Pracht, E. Caldeweyher, S. Ehlert, S. Grimme, ChemRxiv, 2019, preprint.
     DOI: 10.26434/chemrxiv.8326202.v1
   
   for DFT-D4:
   * E. Caldeweyher, C. Bannwarth and S. Grimme, J. Chem. Phys., 2017,
     147, 034112. DOI: 10.1063/1.4993215
   * E. Caldeweyher, S. Ehlert, A. Hansen, H. Neugebauer, S. Spicher,
     C. Bannwarth and S. Grimme, J. Chem. Phys., 2019, 150, 154122.
     DOI: 10.1063/1.5090222
   
   for sTDA-xTB:
   * S. Grimme and C. Bannwarth, J. Chem. Phys., 2016, 145, 054103.
     DOI: 10.1063/1.4959605
   
   in the mass-spec context:
   * V. Asgeirsson, C. Bauer and S. Grimme, Chem. Sci., 2017, 8, 4879.
     DOI: 10.1039/c7sc00601b
   
   for metadynamics refer to:
   * S. Grimme, J. Chem. Theory Comput., 2019, 155, 2847-2862
     DOI: 10.1021/acs.jctc.9b00143
   
   with help from (in alphabetical order)
   C. Bannwarth, F. Bohle, G. Brandenburg, E. Caldeweyher, M. Checinski,
   S. Dohm, S. Ehlert, S. Ehrlich, F. März, H. Neugebauer, J. Pisarek,
   P. Pracht, P. Shushkov, and S. Spicher.
   
 * started run on 2021/05/19 at 10:58:07.066     

           -------------------------------------------------
          |                Calculation Setup                |
           -------------------------------------------------

          program call               : /ihome/ghutchison/geoffh/xtb/xtb 10.xyz -opt
          hostname                   : smp-n58
          coordinate file            : 10.xyz
          omp threads                :                     1
          number of atoms            :                    16
          number of electrons        :                    46
          charge                     :                     0
          spin                       :                   0.0
          first test random number   :      0.38423058654163


########################################################################
# WARNING! Please study the warnings concerning your input carefully
#  - the use of '-opt' is discouraged, please use '--opt' next time
########################################################################

           ------------------------------------------------- 
          |                 G F N 2 - x T B                 |
          | Geometry, Frequencies, Noncovalent interactions |
          |            JCTC 2019 parametrisation            |
           ------------------------------------------------- 
             KAB for C  - Si     :                1.0500
             KAB for H  - Pd     :                0.9500
             k(s)              :                1.8500
             k(p)              :                2.2300
             k(d)              :                2.2300
             k(f)              :                2.0000
             kEN (H0ij)        :               -2.0000
             D4 a1             :                0.5200
             D4 a2             :                5.0000
             D4 s6             :                1.0000
             D4 s8             :                2.7000
             D4 s9             :                5.0000
             alphaj            :                2.0000

  Z AO/shell   Hii/eV     exponent
  1     Wed Apr 25 08:07:45 CEST 2018   EN: 2.200 GM2: 0.406  GM3: 0.0800  RAES: 1.40
     1s    -10.707211    1.230000
  6     Wed Apr 25 08:07:45 CEST 2018   EN: 2.550 GM2: 0.538  GM3: 0.1500  RAES: 3.00
     2s    -13.970922    2.096432
     2p    -10.063292    1.800000
  7     Wed Apr 25 08:07:45 CEST 2018   EN: 3.040 GM2: 0.461  GM3:-0.0640  RAES: 1.90
     2s    -16.686243    2.339881
     2p    -12.523956    2.014332
 16     Tue Apr 24 11:44:34 CEST 2018   EN: 2.580 GM2: 0.340  GM3:-0.0502  RAES: 3.10
     3s    -20.029654    1.981333
     3p    -11.377694    2.025643
     3d     -0.420282    1.702555

           ------------------------------------------------- 
          |        Self-Consistent Charge Iterations        |
           ------------------------------------------------- 

          ...................................................
          :                      SETUP                      :
          :.................................................:
          :  # basis functions                  52          :
          :  # atomic orbitals                  50          :
          :  # shells                           26          :
          :  # electrons                        46          :
          :  max. iterations                   250          :
          :  Hamiltonian                  GFN2-xTB          :
          :  restarted?                      false          :
          :  GBSA solvation                  false          :
          :  PC potential                    false          :
          :  electronic temp.          300.0000000     K    :
          :  accuracy                    1.0000000          :
          :  -> integral cutoff          0.2500000E+02      :
          :  -> integral neglect         0.1000000E-07      :
          :  -> SCF convergence          0.1000000E-05 Eh   :
          :  -> wf. convergence          0.1000000E-03 e    :
          :  Broyden damping             0.4000000          :
          ...................................................

 iter      E             dE          RMSdq      gap      omega  full diag
   1    -25.1278342 -0.251278E+02  0.518E+00    2.72       0.0  T
   2    -25.1660521 -0.382179E-01  0.297E+00    2.62       1.0  T
   3    -25.1679721 -0.192008E-02  0.795E-01    2.33       1.0  T
   4    -25.1686665 -0.694357E-03  0.329E-01    2.26       1.0  T
   5    -25.1687203 -0.537585E-04  0.140E-01    2.27       1.0  T
   6    -25.1687464 -0.261204E-04  0.246E-02    2.27       1.0  T
   7    -25.1687469 -0.478516E-06  0.118E-02    2.27       2.1  T
   8    -25.1687471 -0.202303E-06  0.324E-03    2.27       7.7  T
   9    -25.1687471 -0.537371E-08  0.111E-03    2.27      22.6  T
  10    -25.1687471 -0.326649E-08  0.431E-04    2.27      58.0  T
  11    -25.1687471 -0.192735E-09  0.187E-04    2.27     133.4  T

   *** convergence criteria satisfied after 11 iterations ***

         #    Occupation            Energy/Eh            Energy/eV
      -------------------------------------------------------------
         1        2.0000           -0.7339836             -19.9727
       ...           ...                  ...                  ...
        17        2.0000           -0.4823554             -13.1256
        18        2.0000           -0.4692261             -12.7683
        19        2.0000           -0.4661510             -12.6846
        20        2.0000           -0.4402366             -11.9794
        21        2.0000           -0.4123848             -11.2216
        22        2.0000           -0.3632274              -9.8839
        23        2.0000           -0.3230230              -8.7899 (HOMO)
        24                         -0.2395981              -6.5198 (LUMO)
        25                         -0.2138943              -5.8204
        26                         -0.1471703              -4.0047
        27                         -0.1435723              -3.9068
        28                         -0.0550942              -1.4992
       ...                                ...                  ...
        50                          0.5392708              14.6743
      -------------------------------------------------------------
                  HL-Gap            0.0834249 Eh            2.2701 eV
             Fermi-level           -0.2813105 Eh           -7.6548 eV

 SCC (total)                   0 d,  0 h,  0 min,  0.022 sec
 SCC setup                      ...        0 min,  0.000 sec (  1.045%)
 Dispersion                     ...        0 min,  0.000 sec (  0.700%)
 integral evaluation            ...        0 min,  0.005 sec ( 23.806%)
 zeroth order Hamiltonian       ...        0 min,  0.000 sec (  0.469%)
 iterations                     ...        0 min,  0.009 sec ( 40.274%)
 molecular gradient             ...        0 min,  0.007 sec ( 32.450%)
 printout                       ...        0 min,  0.000 sec (  1.032%)

         :::::::::::::::::::::::::::::::::::::::::::::::::::::
         ::                     SUMMARY                     ::
         :::::::::::::::::::::::::::::::::::::::::::::::::::::
         :: total energy             -24.948073076113 Eh    ::
         :: gradient norm              0.087368466865 Eh/a0 ::
         :: HOMO-LUMO gap              2.270106993684 eV    ::
         ::.................................................::
         :: SCC energy               -25.168747069063 Eh    ::
         :: -> isotropic ES            0.017698571311 Eh    ::
         :: -> anisotropic ES          0.000743823980 Eh    ::
         :: -> anisotropic XC          0.026226264856 Eh    ::
         :: -> dispersion             -0.015662716055 Eh    ::
         :: repulsion energy           0.220629710009 Eh    ::
         :: add. restraining           0.000000000000 Eh    ::
         :::::::::::::::::::::::::::::::::::::::::::::::::::::

      ----------------------------------------------------------- 
     |                   =====================                   |
     |                        A N C O P T                        |
     |                   =====================                   |
     |               Approximate Normal Coordinate               |
     |                Rational Function Optimizer                |
      ----------------------------------------------------------- 

          ...................................................
          :                      SETUP                      :
          :.................................................:
          :   optimization level            normal          :
          :   max. optcycles                   200          :
          :   ANC micro-cycles                  20          :
          :   degrees of freedom                42          :
          :.................................................:
          :   RF solver                   davidson          :
          :   input Hessian                  false          :
          :   write xtbopt.log                true          :
          :   linear?                        false          :
          :   energy convergence         0.5000000E-05 Eh   :
          :   grad. convergence          0.1000000E-02 Eh/α :
          :   maximium RF displ.         2.0000000          :
          :   Hlow (freq-cutoff)         0.5000000E-02      :
          :   Hmax (freq-cutoff)         5.0000000          :
          :   S6 in model hess.         20.0000000          :
          ...................................................

generating ANC from model Hessian ...
Using Lindh-Hessian (1995)
 Shifting diagonal of input Hessian by   0.000000000000000E+000
 Lowest  eigenvalues of input Hessian
   -0.000000   -0.000000   -0.000000    0.000000    0.000000    0.000000
    0.007599    0.010990    0.017652    0.018513    0.029868    0.033879
    0.046032    0.048535    0.054033    0.056550    0.057257    0.063368
 Highest eigenvalues
    1.197568    1.217632    1.345190    1.363172    1.544999    1.591257
 

........................................................................
.............................. CYCLE    1 ..............................
........................................................................
   1    -25.1687471 -0.251687E+02  0.679E-05    2.27       0.0  T
   2    -25.1687471 -0.171241E-11  0.433E-05    2.27     576.8  T
   3    -25.1687471 -0.465405E-12  0.162E-05    2.27    1543.5  T
     SCC iter.                  ...        0 min,  0.002 sec
     gradient                   ...        0 min,  0.007 sec
 * total energy  :   -24.9480731 Eh     change       -0.1881624E-07 Eh
   gradient norm :     0.0873681 Eh/α   predicted     0.0000000E+00 (-100.00%)
   displ. norm   :     0.2938885 α      lambda       -0.9322136E-02
   maximum displ.:     0.1781986 α      in ANC's #4, #1, #7, ...

........................................................................
.............................. CYCLE    2 ..............................
........................................................................
   1    -25.1767252 -0.251767E+02  0.585E-01    2.37       0.0  T
   2    -25.1768317 -0.106547E-03  0.260E-01    2.38       1.0  T
   3    -25.1768492 -0.174991E-04  0.628E-02    2.38       1.0  T
   4    -25.1768500 -0.747850E-06  0.220E-02    2.38       1.1  T
   5    -25.1768518 -0.180981E-05  0.568E-03    2.38       4.4  T
   6    -25.1768518 -0.109184E-07  0.242E-03    2.38      10.3  T
     SCC iter.                  ...        0 min,  0.004 sec
     gradient                   ...        0 min,  0.007 sec
 * total energy  :   -24.9545985 Eh     change       -0.6525361E-02 Eh
   gradient norm :     0.0498280 Eh/α   predicted    -0.5063647E-02 ( -22.40%)
   displ. norm   :     0.2875222 α      lambda       -0.4457318E-02
   maximum displ.:     0.1868030 α      in ANC's #1, #4, #2, ...

........................................................................
.............................. CYCLE    3 ..............................
........................................................................
   1    -25.1791513 -0.251792E+02  0.641E-01    2.38       0.0  T
   2    -25.1792898 -0.138544E-03  0.264E-01    2.39       1.0  T
   3    -25.1793107 -0.209174E-04  0.638E-02    2.39       1.0  T
   4    -25.1793114 -0.693924E-06  0.227E-02    2.39       1.1  T
   5    -25.1793133 -0.186757E-05  0.682E-03    2.39       3.7  T
   6    -25.1793133 -0.147565E-07  0.256E-03    2.39       9.8  T
   7    -25.1793133 -0.698668E-08  0.937E-04    2.39      26.7  T
     SCC iter.                  ...        0 min,  0.005 sec
     gradient                   ...        0 min,  0.008 sec
 * total energy  :   -24.9572944 Eh     change       -0.2695913E-02 Eh
   gradient norm :     0.0146689 Eh/α   predicted    -0.2412902E-02 ( -10.50%)
   displ. norm   :     0.2280905 α      lambda       -0.9252401E-03
   maximum displ.:     0.2026383 α      in ANC's #1, #2, #3, ...

........................................................................
.............................. CYCLE    4 ..............................
........................................................................
   1    -25.1785376 -0.251785E+02  0.474E-01    2.35       0.0  T
   2    -25.1786091 -0.714964E-04  0.191E-01    2.35       1.0  T
   3    -25.1786204 -0.113261E-04  0.384E-02    2.36       1.0  T
   4    -25.1786206 -0.196007E-06  0.117E-02    2.36       2.1  T
   5    -25.1786211 -0.465936E-06  0.425E-03    2.36       5.9  T
   6    -25.1786211 -0.104117E-07  0.127E-03    2.36      19.7  T
   7    -25.1786211 -0.130888E-08  0.551E-04    2.36      45.3  T
     SCC iter.                  ...        0 min,  0.005 sec
     gradient                   ...        0 min,  0.008 sec
 * total energy  :   -24.9579056 Eh     change       -0.6111967E-03 Eh
   gradient norm :     0.0049343 Eh/α   predicted    -0.4866873E-03 ( -20.37%)
   displ. norm   :     0.1961542 α      lambda       -0.3677270E-03
   maximum displ.:     0.1639344 α      in ANC's #1, #2, #6, ...

........................................................................
.............................. CYCLE    5 ..............................
........................................................................
   1    -25.1779400 -0.251779E+02  0.373E-01    2.33       0.0  T
   2    -25.1779798 -0.397717E-04  0.162E-01    2.34       1.0  T
   3    -25.1779871 -0.730064E-05  0.289E-02    2.34       1.0  T
   4    -25.1779872 -0.124865E-06  0.909E-03    2.34       2.7  T
   5    -25.1779874 -0.161226E-06  0.390E-03    2.34       6.4  T
   6    -25.1779874 -0.892972E-08  0.109E-03    2.34      22.9  T
   7    -25.1779874 -0.230335E-08  0.499E-04    2.34      50.1  T
     SCC iter.                  ...        0 min,  0.005 sec
     gradient                   ...        0 min,  0.008 sec
 * total energy  :   -24.9581615 Eh     change       -0.2559714E-03 Eh
   gradient norm :     0.0061471 Eh/α   predicted    -0.1909393E-03 ( -25.41%)
   displ. norm   :     0.1525165 α      lambda       -0.1907134E-03
   maximum displ.:     0.1186142 α      in ANC's #1, #2, #4, ...

........................................................................
.............................. CYCLE    6 ..............................
........................................................................
   1    -25.1783406 -0.251783E+02  0.295E-01    2.33       0.0  T
   2    -25.1783632 -0.225924E-04  0.132E-01    2.34       1.0  T
   3    -25.1783678 -0.454126E-05  0.209E-02    2.34       1.2  T
   4    -25.1783678 -0.315057E-07  0.665E-03    2.34       3.8  T
   5    -25.1783679 -0.846527E-07  0.310E-03    2.34       8.1  T
   6    -25.1783679 -0.901655E-08  0.694E-04    2.34      36.0  T
   7    -25.1783679 -0.479535E-09  0.354E-04    2.34      70.7  T
     SCC iter.                  ...        0 min,  0.005 sec
     gradient                   ...        0 min,  0.008 sec
 * total energy  :   -24.9583057 Eh     change       -0.1441798E-03 Eh
   gradient norm :     0.0057036 Eh/α   predicted    -0.9757319E-04 ( -32.33%)
   displ. norm   :     0.1536097 α      lambda       -0.1550428E-03
   maximum displ.:     0.1162072 α      in ANC's #1, #2, #26, ...

........................................................................
.............................. CYCLE    7 ..............................
........................................................................
   1    -25.1791502 -0.251792E+02  0.286E-01    2.35       0.0  T
   2    -25.1791720 -0.218300E-04  0.130E-01    2.35       1.0  T
   3    -25.1791764 -0.441686E-05  0.206E-02    2.35       1.2  T
   4    -25.1791765 -0.244138E-07  0.816E-03    2.35       3.1  T
   5    -25.1791767 -0.178918E-06  0.311E-03    2.35       8.0  T
   6    -25.1791767 -0.567703E-08  0.689E-04    2.35      36.3  T
   7    -25.1791767 -0.304350E-09  0.323E-04    2.35      77.3  T
     SCC iter.                  ...        0 min,  0.005 sec
     gradient                   ...        0 min,  0.008 sec
 * total energy  :   -24.9584107 Eh     change       -0.1050256E-03 Eh
   gradient norm :     0.0035078 Eh/α   predicted    -0.7934940E-04 ( -24.45%)
   displ. norm   :     0.0866959 α      lambda       -0.5669971E-04
   maximum displ.:     0.0632887 α      in ANC's #2, #1, #26, ...

........................................................................
.............................. CYCLE    8 ..............................
........................................................................
   1    -25.1799976 -0.251800E+02  0.171E-01    2.35       0.0  T
   2    -25.1800053 -0.768311E-05  0.790E-02    2.35       1.0  T
   3    -25.1800069 -0.162503E-05  0.115E-02    2.35       2.2  T
   4    -25.1800069 -0.167418E-07  0.515E-03    2.35       4.9  T
   5    -25.1800070 -0.664175E-07  0.160E-03    2.35      15.6  T
   6    -25.1800070 -0.125105E-08  0.402E-04    2.35      62.2  T
   7    -25.1800070 -0.113911E-09  0.177E-04    2.35     141.2  T
     SCC iter.                  ...        0 min,  0.004 sec
     gradient                   ...        0 min,  0.007 sec
 * total energy  :   -24.9584479 Eh     change       -0.3712231E-04 Eh
   gradient norm :     0.0017452 Eh/α   predicted    -0.2856297E-04 ( -23.06%)
   displ. norm   :     0.0745223 α      lambda       -0.2179124E-04
   maximum displ.:     0.0677636 α      in ANC's #2, #1, #5, ...

........................................................................
.............................. CYCLE    9 ..............................
........................................................................
   1    -25.1804879 -0.251805E+02  0.168E-01    2.36       0.0  T
   2    -25.1804949 -0.697637E-05  0.768E-02    2.36       1.0  T
   3    -25.1804965 -0.155102E-05  0.103E-02    2.36       2.4  T
   4    -25.1804965 -0.156254E-07  0.491E-03    2.36       5.1  T
   5    -25.1804965 -0.514391E-07  0.114E-03    2.36      21.9  T
   6    -25.1804965 -0.881190E-09  0.490E-04    2.36      51.0  T
   7    -25.1804965 -0.851905E-10  0.136E-04    2.36     184.3  T
     SCC iter.                  ...        0 min,  0.004 sec
     gradient                   ...        0 min,  0.007 sec
 * total energy  :   -24.9584680 Eh     change       -0.2016461E-04 Eh
   gradient norm :     0.0014931 Eh/α   predicted    -0.1092253E-04 ( -45.83%)
   displ. norm   :     0.0523812 α      lambda       -0.1346533E-04
   maximum displ.:     0.0402990 α      in ANC's #2, #1, #5, ...

........................................................................
.............................. CYCLE   10 ..............................
........................................................................
   1    -25.1806683 -0.251807E+02  0.142E-01    2.35       0.0  T
   2    -25.1806738 -0.550226E-05  0.601E-02    2.35       1.0  T
   3    -25.1806749 -0.108028E-05  0.850E-03    2.35       2.9  T
   4    -25.1806749 -0.101676E-07  0.276E-03    2.35       9.0  T
   5    -25.1806749 -0.473187E-08  0.989E-04    2.35      25.3  T
   6    -25.1806749 -0.771500E-09  0.376E-04    2.35      66.5  T
     SCC iter.                  ...        0 min,  0.004 sec
     gradient                   ...        0 min,  0.008 sec
 * total energy  :   -24.9584835 Eh     change       -0.1544745E-04 Eh
   gradient norm :     0.0014723 Eh/α   predicted    -0.6741637E-05 ( -56.36%)
   displ. norm   :     0.0889778 α      lambda       -0.1827698E-04
   maximum displ.:     0.0707720 α      in ANC's #2, #1, #5, ...

........................................................................
.............................. CYCLE   11 ..............................
........................................................................
   1    -25.1801740 -0.251802E+02  0.256E-01    2.35       0.0  T
   2    -25.1801923 -0.182633E-04  0.109E-01    2.35       1.0  T
   3    -25.1801959 -0.361932E-05  0.146E-02    2.35       1.7  T
   4    -25.1801960 -0.353232E-07  0.593E-03    2.35       4.2  T
   5    -25.1801960 -0.161081E-07  0.177E-03    2.35      14.1  T
   6    -25.1801960 -0.446533E-08  0.756E-04    2.35      33.1  T
   7    -25.1801960 -0.837378E-09  0.221E-04    2.35     112.9  T
     SCC iter.                  ...        0 min,  0.004 sec
     gradient                   ...        0 min,  0.008 sec
 * total energy  :   -24.9585031 Eh     change       -0.1962664E-04 Eh
   gradient norm :     0.0014140 Eh/α   predicted    -0.9169938E-05 ( -53.28%)
   displ. norm   :     0.1593771 α      lambda       -0.2455078E-04
   maximum displ.:     0.1210866 α      in ANC's #2, #1, #5, ...

........................................................................
.............................. CYCLE   12 ..............................
........................................................................
   1    -25.1799799 -0.251800E+02  0.490E-01    2.34       0.0  T
   2    -25.1800490 -0.690332E-04  0.210E-01    2.34       1.0  T
   3    -25.1800629 -0.139666E-04  0.269E-02    2.34       1.0  T
   4    -25.1800631 -0.130390E-06  0.112E-02    2.34       2.2  T
   5    -25.1800631 -0.553938E-07  0.301E-03    2.34       8.3  T
   6    -25.1800631 -0.132418E-07  0.135E-03    2.34      18.5  T
   7    -25.1800631 -0.269444E-08  0.387E-04    2.34      64.7  T
   8    -25.1800631 -0.256719E-10  0.119E-04    2.34     209.5  T
     SCC iter.                  ...        0 min,  0.004 sec
     gradient                   ...        0 min,  0.007 sec
 * total energy  :   -24.9585297 Eh     change       -0.2656958E-04 Eh
   gradient norm :     0.0019840 Eh/α   predicted    -0.1241348E-04 ( -53.28%)
   displ. norm   :     0.2151270 α      lambda       -0.3042200E-04
   maximum displ.:     0.1513815 α      in ANC's #2, #5, #1, ...

........................................................................
.............................. CYCLE   13 ..............................
........................................................................
   1    -25.1793132 -0.251793E+02  0.681E-01    2.35       0.0  T
   2    -25.1794535 -0.140348E-03  0.290E-01    2.35       1.0  T
   3    -25.1794820 -0.284441E-04  0.370E-02    2.35       1.0  T
   4    -25.1794823 -0.298311E-06  0.165E-02    2.35       1.5  T
   5    -25.1794824 -0.119149E-06  0.399E-03    2.35       6.3  T
   6    -25.1794824 -0.298335E-07  0.188E-03    2.35      13.3  T
   7    -25.1794824 -0.381208E-08  0.525E-04    2.35      47.6  T
   8    -25.1794824 -0.654019E-10  0.174E-04    2.35     143.7  T
     SCC iter.                  ...        0 min,  0.005 sec
     gradient                   ...        0 min,  0.007 sec
 * total energy  :   -24.9585628 Eh     change       -0.3312391E-04 Eh
   gradient norm :     0.0029803 Eh/α   predicted    -0.1552303E-04 ( -53.14%)
   displ. norm   :     0.1691178 α      lambda       -0.4679529E-04
   maximum displ.:     0.1029756 α      in ANC's #5, #2, #1, ...

........................................................................
.............................. CYCLE   14 ..............................
........................................................................
   1    -25.1792435 -0.251792E+02  0.561E-01    2.36       0.0  T
   2    -25.1793451 -0.101545E-03  0.238E-01    2.36       1.0  T
   3    -25.1793656 -0.205257E-04  0.304E-02    2.36       1.0  T
   4    -25.1793658 -0.238230E-06  0.140E-02    2.36       1.8  T
   5    -25.1793659 -0.849926E-07  0.312E-03    2.36       8.0  T
   6    -25.1793659 -0.197278E-07  0.154E-03    2.36      16.2  T
   7    -25.1793659 -0.225097E-08  0.429E-04    2.36      58.2  T
   8    -25.1793659 -0.577671E-10  0.147E-04    2.36     170.1  T
     SCC iter.                  ...        0 min,  0.005 sec
     gradient                   ...        0 min,  0.007 sec
 * total energy  :   -24.9585992 Eh     change       -0.3644290E-04 Eh
   gradient norm :     0.0042743 Eh/α   predicted    -0.2406784E-04 ( -33.96%)
   displ. norm   :     0.2210964 α      lambda       -0.8372320E-04
   maximum displ.:     0.1512557 α      in ANC's #5, #2, #1, ...

........................................................................
.............................. CYCLE   15 ..............................
........................................................................
   1    -25.1787816 -0.251788E+02  0.748E-01    2.39       0.0  T
   2    -25.1789730 -0.191414E-03  0.318E-01    2.40       1.0  T
   3    -25.1790120 -0.390242E-04  0.410E-02    2.40       1.0  T
   4    -25.1790125 -0.465300E-06  0.189E-02    2.40       1.3  T
   5    -25.1790127 -0.197898E-06  0.409E-03    2.40       6.1  T
   6    -25.1790127 -0.374100E-07  0.212E-03    2.40      11.8  T
   7    -25.1790127 -0.307721E-08  0.526E-04    2.40      47.5  T
     SCC iter.                  ...        0 min,  0.004 sec
     gradient                   ...        0 min,  0.007 sec
 * total energy  :   -24.9586541 Eh     change       -0.5487553E-04 Eh
   gradient norm :     0.0069506 Eh/α   predicted    -0.4390716E-04 ( -19.99%)
   displ. norm   :     0.0856671 α      lambda       -0.1127361E-03
   maximum displ.:     0.0731607 α      in ANC's #5, #17, #1, ...

........................................................................
.............................. CYCLE   16 ..............................
........................................................................
   1    -25.1808327 -0.251808E+02  0.297E-01    2.43       0.0  T
   2    -25.1808653 -0.325929E-04  0.128E-01    2.43       1.0  T
   3    -25.1808721 -0.683835E-05  0.174E-02    2.43       1.4  T
   4    -25.1808722 -0.554083E-07  0.675E-03    2.43       3.7  T
   5    -25.1808722 -0.856468E-07  0.155E-03    2.43      16.1  T
   6    -25.1808722 -0.300706E-08  0.859E-04    2.43      29.1  T
     SCC iter.                  ...        0 min,  0.004 sec
     gradient                   ...        0 min,  0.007 sec
 * total energy  :   -24.9587123 Eh     change       -0.5821845E-04 Eh
   gradient norm :     0.0062413 Eh/α   predicted    -0.5678077E-04 (  -2.47%)
   displ. norm   :     0.3140589 α      lambda       -0.1704285E-03
   maximum displ.:     0.2260395 α      in ANC's #5, #2, #1, ...

........................................................................
.............................. CYCLE   17 ..............................
........................................................................
   1    -25.1775530 -0.251776E+02  0.109E+00    2.47       0.0  T
   2    -25.1780053 -0.452371E-03  0.464E-01    2.47       1.0  T
   3    -25.1780968 -0.914478E-04  0.605E-02    2.48       1.0  T
   4    -25.1780976 -0.866539E-06  0.274E-02    2.48       1.0  T
   5    -25.1780980 -0.331636E-06  0.606E-03    2.48       4.1  T
   6    -25.1780980 -0.743310E-07  0.323E-03    2.48       7.7  T
   7    -25.1780981 -0.826248E-08  0.774E-04    2.48      32.3  T
   8    -25.1780981 -0.385242E-09  0.287E-04    2.48      87.0  T
     SCC iter.                  ...        0 min,  0.005 sec
     gradient                   ...        0 min,  0.007 sec
 * total energy  :   -24.9587662 Eh     change       -0.5386274E-04 Eh
   gradient norm :     0.0095689 Eh/α   predicted    -0.9361899E-04 (  73.81%)
   displ. norm   :     0.1215635 α      lambda       -0.2005830E-03
   maximum displ.:     0.0747599 α      in ANC's #2, #5, #1, ...

........................................................................
.............................. CYCLE   18 ..............................
........................................................................
   1    -25.1799449 -0.251799E+02  0.342E-01    2.47       0.0  T
   2    -25.1799855 -0.405884E-04  0.152E-01    2.47       1.0  T
   3    -25.1799942 -0.867729E-05  0.240E-02    2.47       1.0  T
   4    -25.1799943 -0.946616E-07  0.101E-02    2.47       2.5  T
   5    -25.1799944 -0.134029E-06  0.254E-03    2.47       9.8  T
   6    -25.1799944 -0.757206E-08  0.136E-03    2.47      18.4  T
     SCC iter.                  ...        0 min,  0.004 sec
     gradient                   ...        0 min,  0.008 sec
 * total energy  :   -24.9588330 Eh     change       -0.6677594E-04 Eh
   gradient norm :     0.0048403 Eh/α   predicted    -0.1017720E-03 (  52.41%)
   displ. norm   :     0.1223355 α      lambda       -0.1279167E-03
   maximum displ.:     0.0878793 α      in ANC's #1, #5, #2, ...

........................................................................
.............................. CYCLE   19 ..............................
........................................................................
   1    -25.1808748 -0.251809E+02  0.376E-01    2.48       0.0  T
   2    -25.1809285 -0.536653E-04  0.157E-01    2.48       1.0  T
   3    -25.1809386 -0.101518E-04  0.229E-02    2.48       1.1  T
   4    -25.1809388 -0.180348E-06  0.108E-02    2.48       2.3  T
   5    -25.1809389 -0.708423E-07  0.271E-03    2.48       9.2  T
   6    -25.1809389 -0.178031E-07  0.124E-03    2.48      20.1  T
     SCC iter.                  ...        0 min,  0.004 sec
     gradient                   ...        0 min,  0.007 sec
 * total energy  :   -24.9589106 Eh     change       -0.7765323E-04 Eh
   gradient norm :     0.0043728 Eh/α   predicted    -0.6491560E-04 ( -16.40%)
   displ. norm   :     0.1799301 α      lambda       -0.9542787E-04
   maximum displ.:     0.1349246 α      in ANC's #5, #1, #10, ...

........................................................................
.............................. CYCLE   20 ..............................
........................................................................
   1    -25.1799074 -0.251799E+02  0.615E-01    2.50       0.0  T
   2    -25.1800605 -0.153031E-03  0.258E-01    2.50       1.0  T
   3    -25.1800905 -0.300023E-04  0.362E-02    2.50       1.0  T
   4    -25.1800909 -0.393489E-06  0.167E-02    2.50       1.5  T
   5    -25.1800910 -0.158749E-06  0.408E-03    2.50       6.1  T
   6    -25.1800911 -0.391180E-07  0.205E-03    2.50      12.2  T
   7    -25.1800911 -0.326417E-08  0.640E-04    2.50      39.1  T
     SCC iter.                  ...        0 min,  0.005 sec
     gradient                   ...        0 min,  0.008 sec
 * total energy  :   -24.9589599 Eh     change       -0.4926982E-04 Eh
   gradient norm :     0.0050575 Eh/α   predicted    -0.4925685E-04 (  -0.03%)
   displ. norm   :     0.0430013 α      lambda       -0.5481969E-04
   maximum displ.:     0.0330792 α      in ANC's #2, #1, #23, ...
 * RMSD in coord.:     0.4196635 α      energy gain  -0.1088682E-01 Eh

generating ANC from model Hessian ...
Using Lindh-Hessian (1995)
 Shifting diagonal of input Hessian by   0.000000000000000E+000
 Lowest  eigenvalues of input Hessian
   -0.000000    0.000000    0.000000    0.000000    0.000000    0.000000
    0.008059    0.010935    0.018395    0.019080    0.024234    0.035130
    0.045323    0.048377    0.053775    0.056172    0.059422    0.062144
 Highest eigenvalues
    1.191073    1.221205    1.312231    1.336253    1.409374    1.431666
 

........................................................................
.............................. CYCLE   21 ..............................
........................................................................
   1    -25.1803065 -0.251803E+02  0.927E-02    2.51       0.0  T
   2    -25.1803093 -0.283956E-05  0.433E-02    2.51       1.0  T
   3    -25.1803099 -0.529365E-06  0.770E-03    2.51       3.2  T
   4    -25.1803099 -0.116449E-07  0.362E-03    2.51       6.9  T
   5    -25.1803099 -0.274837E-08  0.953E-04    2.51      26.2  T
   6    -25.1803099 -0.383622E-09  0.360E-04    2.51      69.4  T
     SCC iter.                  ...        0 min,  0.004 sec
     gradient                   ...        0 min,  0.008 sec
 * total energy  :   -24.9589955 Eh     change       -0.3564779E-04 Eh
   gradient norm :     0.0025351 Eh/α   predicted     0.0000000E+00 (-100.00%)
   displ. norm   :     0.0221471 α      lambda       -0.1508498E-04
   maximum displ.:     0.0186065 α      in ANC's #1, #2, #6, ...

........................................................................
.............................. CYCLE   22 ..............................
........................................................................
   1    -25.1803380 -0.251803E+02  0.337E-02    2.50       0.0  T
   2    -25.1803386 -0.551562E-06  0.147E-02    2.50       1.7  T
   3    -25.1803386 -0.723853E-07  0.343E-03    2.50       7.3  T
   4    -25.1803386 -0.454216E-08  0.150E-03    2.50      16.7  T
   5    -25.1803386 -0.128981E-08  0.317E-04    2.50      79.0  T
   6    -25.1803386 -0.328424E-09  0.168E-04    2.50     149.2  T
     SCC iter.                  ...        0 min,  0.004 sec
     gradient                   ...        0 min,  0.008 sec
 * total energy  :   -24.9590064 Eh     change       -0.1086425E-04 Eh
   gradient norm :     0.0013420 Eh/α   predicted    -0.7547705E-05 ( -30.53%)
   displ. norm   :     0.0334871 α      lambda       -0.7583852E-05
   maximum displ.:     0.0294737 α      in ANC's #1, #5, #2, ...

........................................................................
.............................. CYCLE   23 ..............................
........................................................................
   1    -25.1803581 -0.251804E+02  0.586E-02    2.50       0.0  T
   2    -25.1803595 -0.143846E-05  0.256E-02    2.50       1.0  T
   3    -25.1803598 -0.241385E-06  0.527E-03    2.50       4.7  T
   4    -25.1803598 -0.116698E-07  0.232E-03    2.50      10.8  T
   5    -25.1803598 -0.466591E-08  0.567E-04    2.50      44.1  T
   6    -25.1803598 -0.721052E-09  0.294E-04    2.50      85.0  T
     SCC iter.                  ...        0 min,  0.004 sec
     gradient                   ...        0 min,  0.007 sec
 * total energy  :   -24.9590123 Eh     change       -0.5860971E-05 Eh
   gradient norm :     0.0007723 Eh/α   predicted    -0.3794233E-05 ( -35.26%)
   displ. norm   :     0.0215004 α      lambda       -0.2809250E-05
   maximum displ.:     0.0180689 α      in ANC's #1, #5, #11, ...

........................................................................
.............................. CYCLE   24 ..............................
........................................................................
   1    -25.1803411 -0.251803E+02  0.586E-02    2.51       0.0  T
   2    -25.1803424 -0.130658E-05  0.246E-02    2.51       1.0  T
   3    -25.1803427 -0.260884E-06  0.369E-03    2.51       6.8  T
   4    -25.1803427 -0.291975E-08  0.151E-03    2.51      16.5  T
   5    -25.1803427 -0.397125E-08  0.443E-04    2.51      56.4  T
   6    -25.1803427 -0.233758E-09  0.212E-04    2.51     118.1  T
     SCC iter.                  ...        0 min,  0.004 sec
     gradient                   ...        0 min,  0.007 sec
 * total energy  :   -24.9590157 Eh     change       -0.3415392E-05 Eh
   gradient norm :     0.0006020 Eh/α   predicted    -0.1404399E-05 ( -58.88%)
   displ. norm   :     0.0509173 α      lambda       -0.5631999E-05
   maximum displ.:     0.0386976 α      in ANC's #1, #5, #2, ...

   *** GEOMETRY OPTIMIZATION CONVERGED AFTER 24 ITERATIONS ***

------------------------------------------------------------------------
 total energy gain   :        -0.0109426 Eh       -6.8666 kcal/mol
 total RMSD          :         0.4202875 a0        0.2224 Å
 total power (kW/mol):        -1.1970755 (step)  -68.5607 (real)
------------------------------------------------------------------------

 ANCopt (total)                0 d,  0 h,  0 min,  0.419 sec
 optimizer setup                ...        0 min,  0.000 sec (  0.028%)
 model hessian                  ...        0 min,  0.012 sec (  2.799%)
 ANC generation                 ...        0 min,  0.001 sec (  0.160%)
 coordinate transformation      ...        0 min,  0.000 sec (  0.067%)
 single point calculation       ...        0 min,  0.400 sec ( 95.381%)
 optimization log               ...        0 min,  0.002 sec (  0.366%)
 hessian update                 ...        0 min,  0.000 sec (  0.052%)
 rational function              ...        0 min,  0.003 sec (  0.830%)

================
 final structure:
================
$coord
   -1.48848711947520    2.12397091244935    0.87657507504068      N 
    0.10437753609109    1.33476391526053   -1.22506254127305      C 
    2.85267442530382    2.06997020281374   -0.79200470524976      C 
    4.52678905990878   -0.69516177191559    0.44781540582740      S 
    1.61958143975299   -2.43467356015388    0.95734140369833      C 
   -0.16051353989653   -1.56167363532975   -1.13554949316315      C 
   -2.79481640076634   -2.14958025249914   -0.64665800547875      N 
   -4.33424421029085    0.55266969393333    0.37164502607713      S 
   -1.81104453235358    4.01216583578980    0.92044758007930      H 
   -0.57614894016443    2.05979740518595   -3.05259961963115      H 
    3.00457688756813    3.59725732062708    0.58046361473203      H 
    3.78337721744131    2.62039232575516   -2.54116456764542      H 
    0.86125369218965   -1.93378048951487    2.81033971422014      H 
    2.03260465241096   -4.44661458023399    0.87784098631903      H 
    0.39023341274576   -2.40720935473838   -2.94475788050401      H 
   -2.96307682330409   -3.53860558520374    0.66655426108013      H 
$end
           -------------------------------------------------
          |                Final Singlepoint                |
           -------------------------------------------------

          ...................................................
          :                      SETUP                      :
          :.................................................:
          :  # basis functions                  52          :
          :  # atomic orbitals                  50          :
          :  # shells                           26          :
          :  # electrons                        46          :
          :  max. iterations                   250          :
          :  Hamiltonian                  GFN2-xTB          :
          :  restarted?                      false          :
          :  GBSA solvation                  false          :
          :  PC potential                    false          :
          :  electronic temp.          300.0000000     K    :
          :  accuracy                    1.0000000          :
          :  -> integral cutoff          0.2500000E+02      :
          :  -> integral neglect         0.1000000E-07      :
          :  -> SCF convergence          0.1000000E-05 Eh   :
          :  -> wf. convergence          0.1000000E-03 e    :
          :  Broyden damping             0.4000000          :
          ...................................................

 iter      E             dE          RMSdq      gap      omega  full diag
   1    -25.1803427 -0.251803E+02  0.615E-05    2.51       0.0  T
   2    -25.1803427 -0.387956E-11  0.260E-05    2.51     963.0  T
   3    -25.1803427 -0.447642E-12  0.140E-05    2.51    1780.1  T

   *** convergence criteria satisfied after 3 iterations ***

         #    Occupation            Energy/Eh            Energy/eV
      -------------------------------------------------------------
         1        2.0000           -0.7324806             -19.9318
       ...           ...                  ...                  ...
        17        2.0000           -0.4771456             -12.9838
        18        2.0000           -0.4707671             -12.8102
        19        2.0000           -0.4615125             -12.5584
        20        2.0000           -0.4308785             -11.7248
        21        2.0000           -0.4097330             -11.1494
        22        2.0000           -0.3649228              -9.9301
        23        2.0000           -0.3446243              -9.3777 (HOMO)
        24                         -0.2525098              -6.8711 (LUMO)
        25                         -0.2181459              -5.9361
        26                         -0.1684035              -4.5825
        27                         -0.1404609              -3.8221
        28                         -0.0324101              -0.8819
       ...                                ...                  ...
        50                          0.4184095              11.3855
      -------------------------------------------------------------
                  HL-Gap            0.0921144 Eh            2.5066 eV
             Fermi-level           -0.2985670 Eh           -8.1244 eV

 SCC (total)                   0 d,  0 h,  0 min,  0.016 sec
 SCC setup                      ...        0 min,  0.000 sec (  0.874%)
 Dispersion                     ...        0 min,  0.000 sec (  0.455%)
 integral evaluation            ...        0 min,  0.005 sec ( 31.109%)
 zeroth order Hamiltonian       ...        0 min,  0.000 sec (  0.561%)
 iterations                     ...        0 min,  0.003 sec ( 15.620%)
 molecular gradient             ...        0 min,  0.008 sec ( 49.513%)
 printout                       ...        0 min,  0.000 sec (  1.579%)

         :::::::::::::::::::::::::::::::::::::::::::::::::::::
         ::                     SUMMARY                     ::
         :::::::::::::::::::::::::::::::::::::::::::::::::::::
         :: total energy             -24.959015680264 Eh    ::
         :: gradient norm              0.000601683556 Eh/a0 ::
         :: HOMO-LUMO gap              2.506561241634 eV    ::
         ::.................................................::
         :: SCC energy               -25.180342715913 Eh    ::
         :: -> isotropic ES            0.017279124635 Eh    ::
         :: -> anisotropic ES         -0.000675742353 Eh    ::
         :: -> anisotropic XC          0.025098726233 Eh    ::
         :: -> dispersion             -0.015643465561 Eh    ::
         :: repulsion energy           0.221285274300 Eh    ::
         :: add. restraining           0.000000000000 Eh    ::
         :::::::::::::::::::::::::::::::::::::::::::::::::::::

           -------------------------------------------------
          |                Property Printout                |
           -------------------------------------------------

    * Orbital Energies and Occupations

         #    Occupation            Energy/Eh            Energy/eV
      -------------------------------------------------------------
         1        2.0000           -0.7324806             -19.9318
       ...           ...                  ...                  ...
        11        2.0000           -0.5373053             -14.6208
        12        2.0000           -0.5227278             -14.2241
        13        2.0000           -0.5172261             -14.0744
        14        2.0000           -0.5009574             -13.6317
        15        2.0000           -0.5000225             -13.6063
        16        2.0000           -0.4871493             -13.2560
        17        2.0000           -0.4771456             -12.9838
        18        2.0000           -0.4707671             -12.8102
        19        2.0000           -0.4615125             -12.5584
        20        2.0000           -0.4308785             -11.7248
        21        2.0000           -0.4097330             -11.1494
        22        2.0000           -0.3649228              -9.9301
        23        2.0000           -0.3446243              -9.3777 (HOMO)
        24                         -0.2525098              -6.8711 (LUMO)
        25                         -0.2181459              -5.9361
        26                         -0.1684035              -4.5825
        27                         -0.1404609              -3.8221
        28                         -0.0324101              -0.8819
        29                         -0.0238832              -0.6499
        30                         -0.0013419              -0.0365
        31                          0.0033459               0.0910
        32                          0.0076252               0.2075
        33                          0.0121267               0.3300
        34                          0.0417515               1.1361
       ...                                ...                  ...
        50                          0.4184095              11.3855
      -------------------------------------------------------------
                  HL-Gap            0.0921144 Eh            2.5066 eV
             Fermi-level           -0.2985670 Eh           -8.1244 eV

     #   Z        covCN         q      C6AA      α(0)
     1   7 N      2.697    -0.241    26.286     7.615
     2   6 C      4.060     0.070    19.338     6.246
     3   6 C      3.799    -0.019    20.909     6.511
     4  16 S      2.076    -0.195   149.351    20.569
     5   6 C      3.805    -0.014    20.822     6.496
     6   6 C      4.024     0.067    19.393     6.256
     7   7 N      2.685    -0.238    26.228     7.606
     8  16 S      2.177    -0.020   141.895    20.049
     9   1 H      0.861     0.157     1.352     1.821
    10   1 H      0.923     0.018     2.758     2.597
    11   1 H      0.925     0.058     2.224     2.332
    12   1 H      0.925     0.052     2.296     2.370
    13   1 H      0.924     0.056     2.242     2.342
    14   1 H      0.925     0.049     2.327     2.385
    15   1 H      0.924     0.041     2.431     2.438
    16   1 H      0.861     0.158     1.345     1.817

 Mol. C6AA /au·bohr⁶  :       4058.984891
 Mol. C8AA /au·bohr⁸  :     124402.555963
 Mol. α(0) /au        :         99.449390


Wiberg/Mayer (AO) data.
largest (>0.10) Wiberg bond orders for each atom
          total WBO             WBO to atom ...
     1  N   3.119        S    8 1.102    C    2 1.001    H    9 0.946
     2  C   3.982        N    1 1.001    C    3 0.997    C    6 0.972    H   10 0.959
     3  C   3.984        C    2 0.997    S    4 0.982    H   12 0.978    H   11 0.975
     4  S   2.070        C    5 0.993    C    3 0.982
     5  C   3.981        S    4 0.993    C    6 0.992    H   14 0.975    H   13 0.974
     6  C   3.981        N    7 1.003    C    5 0.992    C    2 0.972    H   15 0.958
     7  N   3.130        S    8 1.093    C    6 1.003    H   16 0.949
     8  S   2.296        N    1 1.102    N    7 1.093
     9  H   0.975        N    1 0.946
    10  H   1.000        C    2 0.959
    11  H   0.997        C    3 0.975
    12  H   0.997        C    3 0.978
    13  H   0.997        C    5 0.974
    14  H   0.998        C    5 0.975
    15  H   0.998        C    6 0.958
    16  H   0.975        N    7 0.949

molecular dipole:
                 x           y           z       tot (Debye)
 q only:       -0.079       0.134      -0.136
   full:       -0.163       0.301      -0.210       1.021
molecular quadrupole (traceless):
                xx          xy          yy          xz          yz          zz
 q only:       -6.720       1.530       6.025      -1.830      -1.493       0.695
  q+dip:      -15.455       2.243      10.808      -2.990      -2.952       4.646
   full:      -13.955       2.515      11.674      -3.266      -3.180       2.281

           -------------------------------------------------
          |                Geometry Summary                 |
           -------------------------------------------------

      molecular mass/u    :      148.2406000
   center of mass at/Å    :        0.0142044      -0.0430856       0.0015020
  moments of inertia/u·Å² :        0.1440718E+03   0.4738921E+03   0.5542781E+03
rotational constants/cm⁻¹ :        0.1170086E+00   0.3557273E-01   0.3041367E-01

 * 13 selected distances

     #   Z        #   Z                                     value/Å
     1   7 N      2   6 C                                 1.4566267
     2   6 C      3   6 C                                 1.5228176
     2   6 C      6   6 C                                 1.5398540 (max)
     5   6 C      6   6 C                                 1.5255602
     6   6 C      7   7 N                                 1.4515479
     1   7 N      9   1 H                                 1.0139302 (min)
     2   6 C     10   1 H                                 1.1009789
     3   6 C     11   1 H                                 1.0895591
     3   6 C     12   1 H                                 1.0881939
     5   6 C     13   1 H                                 1.0921528
     5   6 C     14   1 H                                 1.0876897
     6   6 C     15   1 H                                 1.0962387
     7   7 N     16   1 H                                 1.0154454

 * 4 distinct bonds (by element types)

   Z      Z             #   av. dist./Å        max./Å        min./Å
   1 H    6 C           6     1.0924689     1.1009789     1.0876897
   6 C    6 C           3     1.5294106     1.5398540     1.5228176
   1 H    7 N           2     1.0146878     1.0154454     1.0139302
   6 C    7 N           2     1.4540873     1.4566267     1.4515479


optimized geometry written to: xtbopt.xyz


           -------------------------------------------------
          | TOTAL ENERGY              -24.959015680264 Eh   |
          | GRADIENT NORM               0.000601683556 Eh/α |
          | HOMO-LUMO GAP               2.506561241634 eV   |
           -------------------------------------------------

------------------------------------------------------------------------
 * finished run on 2021/05/19 at 10:58:07.540     
------------------------------------------------------------------------
 total:
 * wall-time:     0 d,  0 h,  0 min,  0.473 sec
 *  cpu-time:     0 d,  0 h,  0 min,  0.473 sec
 * ratio c/w:     0.999 speedup
 SCF:
 * wall-time:     0 d,  0 h,  0 min,  0.022 sec
 *  cpu-time:     0 d,  0 h,  0 min,  0.022 sec
 * ratio c/w:     1.000 speedup
 ANC optimizer:
 * wall-time:     0 d,  0 h,  0 min,  0.436 sec
 *  cpu-time:     0 d,  0 h,  0 min,  0.436 sec
 * ratio c/w:     1.000 speedup

