      -----------------------------------------------------------      
     |                   =====================                   |     
     |                           x T B                           |     
     |                   =====================                   |     
     |                         S. Grimme                         |     
     |          Mulliken Center for Theoretical Chemistry        |     
     |                    University of Bonn                     |     
     |                Version 6.2 RC2 (SAW190805)                |     
      -----------------------------------------------------------      

   This program is distributed in the hope that it will be useful,
   but WITHOUT ANY WARRANTY; without even the implied warranty of
   MERCHANTABILITY or FITNESS FOR A PARTICULAR PURPOSE.
   
   FOR NON-COMMERCIAL, ACADEMIA USE ONLY.
   
   Cite this work as:
   * S. Grimme, C. Bannwarth, P. Shushkov, J. Chem. Theory Comput., 2017,
     13, 1989-2009. DOI: 10.1021/acs.jctc.7b00118
   * C. Bannwarth, S. Ehlert and S. Grimme., J. Chem. Theory Comput., 2019,
     15, 1652-1671. DOI: 10.1021/acs.jctc.8b01176
   * P. Pracht, E. Caldeweyher, S. Ehlert, S. Grimme, ChemRxiv, 2019, preprint.
     DOI: 10.26434/chemrxiv.8326202.v1
   
   for DFT-D4:
   * E. Caldeweyher, C. Bannwarth and S. Grimme, J. Chem. Phys., 2017,
     147, 034112. DOI: 10.1063/1.4993215
   * E. Caldeweyher, S. Ehlert, A. Hansen, H. Neugebauer, S. Spicher,
     C. Bannwarth and S. Grimme, J. Chem. Phys., 2019, 150, 154122.
     DOI: 10.1063/1.5090222
   
   for sTDA-xTB:
   * S. Grimme and C. Bannwarth, J. Chem. Phys., 2016, 145, 054103.
     DOI: 10.1063/1.4959605
   
   in the mass-spec context:
   * V. Asgeirsson, C. Bauer and S. Grimme, Chem. Sci., 2017, 8, 4879.
     DOI: 10.1039/c7sc00601b
   
   for metadynamics refer to:
   * S. Grimme, J. Chem. Theory Comput., 2019, 155, 2847-2862
     DOI: 10.1021/acs.jctc.9b00143
   
   with help from (in alphabetical order)
   C. Bannwarth, F. Bohle, G. Brandenburg, E. Caldeweyher, M. Checinski,
   S. Dohm, S. Ehlert, S. Ehrlich, F. März, H. Neugebauer, J. Pisarek,
   P. Pracht, P. Shushkov, and S. Spicher.
   
 * started run on 2021/05/19 at 11:00:35.176     

           -------------------------------------------------
          |                Calculation Setup                |
           -------------------------------------------------

          program call               : /ihome/ghutchison/geoffh/xtb/xtb 1007.xyz -opt
          hostname                   : smp-n144
          coordinate file            : 1007.xyz
          omp threads                :                     1
          number of atoms            :                    18
          number of electrons        :                    54
          charge                     :                     0
          spin                       :                   0.0
          first test random number   :      0.53853877204274


########################################################################
# WARNING! Please study the warnings concerning your input carefully
#  - the use of '-opt' is discouraged, please use '--opt' next time
########################################################################

           ------------------------------------------------- 
          |                 G F N 2 - x T B                 |
          | Geometry, Frequencies, Noncovalent interactions |
          |            JCTC 2019 parametrisation            |
           ------------------------------------------------- 
             KAB for C  - Si     :                1.0500
             KAB for H  - Pd     :                0.9500
             k(s)              :                1.8500
             k(p)              :                2.2300
             k(d)              :                2.2300
             k(f)              :                2.0000
             kEN (H0ij)        :               -2.0000
             D4 a1             :                0.5200
             D4 a2             :                5.0000
             D4 s6             :                1.0000
             D4 s8             :                2.7000
             D4 s9             :                5.0000
             alphaj            :                2.0000

  Z AO/shell   Hii/eV     exponent
  1     Wed Apr 25 08:07:45 CEST 2018   EN: 2.200 GM2: 0.406  GM3: 0.0800  RAES: 1.40
     1s    -10.707211    1.230000
  6     Wed Apr 25 08:07:45 CEST 2018   EN: 2.550 GM2: 0.538  GM3: 0.1500  RAES: 3.00
     2s    -13.970922    2.096432
     2p    -10.063292    1.800000
  8     Wed Apr 25 08:07:45 CEST 2018   EN: 3.440 GM2: 0.452  GM3:-0.0517  RAES: 1.80
     2s    -20.229985    2.439742
     2p    -15.503117    2.137023
 16     Tue Apr 24 11:44:34 CEST 2018   EN: 2.580 GM2: 0.340  GM3:-0.0502  RAES: 3.10
     3s    -20.029654    1.981333
     3p    -11.377694    2.025643
     3d     -0.420282    1.702555

           ------------------------------------------------- 
          |        Self-Consistent Charge Iterations        |
           ------------------------------------------------- 

          ...................................................
          :                      SETUP                      :
          :.................................................:
          :  # basis functions                  54          :
          :  # atomic orbitals                  53          :
          :  # shells                           29          :
          :  # electrons                        54          :
          :  max. iterations                   250          :
          :  Hamiltonian                  GFN2-xTB          :
          :  restarted?                      false          :
          :  GBSA solvation                  false          :
          :  PC potential                    false          :
          :  electronic temp.          300.0000000     K    :
          :  accuracy                    1.0000000          :
          :  -> integral cutoff          0.2500000E+02      :
          :  -> integral neglect         0.1000000E-07      :
          :  -> SCF convergence          0.1000000E-05 Eh   :
          :  -> wf. convergence          0.1000000E-03 e    :
          :  Broyden damping             0.4000000          :
          ...................................................

 iter      E             dE          RMSdq      gap      omega  full diag
   1    -30.6585238 -0.306585E+02  0.517E+00    3.42       0.0  T
   2    -30.7090534 -0.505296E-01  0.276E+00    2.78       1.0  T
   3    -30.7045724  0.448097E-02  0.155E+00    3.05       1.0  T
   4    -30.7142628 -0.969036E-02  0.593E-01    2.84       1.0  T
   5    -30.7178718 -0.360907E-02  0.210E-01    2.86       1.0  T
   6    -30.7181150 -0.243112E-03  0.602E-02    2.87       1.0  T
   7    -30.7181331 -0.181380E-04  0.298E-02    2.86       1.0  T
   8    -30.7181376 -0.449196E-05  0.152E-02    2.86       1.6  T
   9    -30.7181390 -0.144955E-05  0.677E-03    2.86       3.5  T
  10    -30.7181393 -0.218769E-06  0.155E-03    2.86      15.2  T
  11    -30.7181393 -0.777371E-08  0.852E-04    2.86      27.7  T
  12    -30.7181393 -0.119917E-08  0.270E-04    2.86      87.4  T

   *** convergence criteria satisfied after 12 iterations ***

         #    Occupation            Energy/Eh            Energy/eV
      -------------------------------------------------------------
         1        2.0000           -0.7423418             -20.2001
       ...           ...                  ...                  ...
        21        2.0000           -0.4653014             -12.6615
        22        2.0000           -0.4640042             -12.6262
        23        2.0000           -0.4515369             -12.2869
        24        2.0000           -0.4395397             -11.9605
        25        2.0000           -0.4243425             -11.5469
        26        2.0000           -0.4146945             -11.2844
        27        2.0000           -0.3884674             -10.5707 (HOMO)
        28                         -0.2832142              -7.7067 (LUMO)
        29                         -0.2505307              -6.8173
        30                         -0.2282467              -6.2109
        31                         -0.1791692              -4.8754
        32                         -0.1452030              -3.9512
       ...                                ...                  ...
        53                          0.7178574              19.5339
      -------------------------------------------------------------
                  HL-Gap            0.1052531 Eh            2.8641 eV
             Fermi-level           -0.3358408 Eh           -9.1387 eV

 SCC (total)                   0 d,  0 h,  0 min,  0.024 sec
 SCC setup                      ...        0 min,  0.000 sec (  0.993%)
 Dispersion                     ...        0 min,  0.000 sec (  0.892%)
 integral evaluation            ...        0 min,  0.006 sec ( 22.578%)
 zeroth order Hamiltonian       ...        0 min,  0.000 sec (  0.453%)
 iterations                     ...        0 min,  0.010 sec ( 40.920%)
 molecular gradient             ...        0 min,  0.008 sec ( 32.640%)
 printout                       ...        0 min,  0.000 sec (  1.313%)

         :::::::::::::::::::::::::::::::::::::::::::::::::::::
         ::                     SUMMARY                     ::
         :::::::::::::::::::::::::::::::::::::::::::::::::::::
         :: total energy             -30.369327469406 Eh    ::
         :: gradient norm              0.064537737661 Eh/a0 ::
         :: HOMO-LUMO gap              2.864083964311 eV    ::
         ::.................................................::
         :: SCC energy               -30.718139260592 Eh    ::
         :: -> isotropic ES            0.046976160230 Eh    ::
         :: -> anisotropic ES          0.001160075855 Eh    ::
         :: -> anisotropic XC          0.012133228226 Eh    ::
         :: -> dispersion             -0.013361193028 Eh    ::
         :: repulsion energy           0.348809164378 Eh    ::
         :: add. restraining           0.000000000000 Eh    ::
         :::::::::::::::::::::::::::::::::::::::::::::::::::::

      ----------------------------------------------------------- 
     |                   =====================                   |
     |                        A N C O P T                        |
     |                   =====================                   |
     |               Approximate Normal Coordinate               |
     |                Rational Function Optimizer                |
      ----------------------------------------------------------- 

          ...................................................
          :                      SETUP                      :
          :.................................................:
          :   optimization level            normal          :
          :   max. optcycles                   200          :
          :   ANC micro-cycles                  20          :
          :   degrees of freedom                48          :
          :.................................................:
          :   RF solver                   davidson          :
          :   input Hessian                  false          :
          :   write xtbopt.log                true          :
          :   linear?                        false          :
          :   energy convergence         0.5000000E-05 Eh   :
          :   grad. convergence          0.1000000E-02 Eh/α :
          :   maximium RF displ.         2.0000000          :
          :   Hlow (freq-cutoff)         0.5000000E-02      :
          :   Hmax (freq-cutoff)         5.0000000          :
          :   S6 in model hess.         20.0000000          :
          ...................................................

generating ANC from model Hessian ...
Using Lindh-Hessian (1995)
 Shifting diagonal of input Hessian by   3.680929279387623E-003
 Lowest  eigenvalues of input Hessian
   -0.000000   -0.000000   -0.000000    0.000000    0.000000    0.000000
    0.005000    0.005100    0.006232    0.010515    0.012586    0.015679
    0.016481    0.024787    0.028967    0.031904    0.039800    0.045236
 Highest eigenvalues
    1.462254    1.502693    1.649940    1.858625    1.939825    2.331727
 

........................................................................
.............................. CYCLE    1 ..............................
........................................................................
   1    -30.7181393 -0.307181E+02  0.108E-04    2.86       0.0  T
   2    -30.7181393 -0.630855E-10  0.607E-05    2.86     388.6  T
   3    -30.7181393 -0.119940E-10  0.378E-05    2.86     623.8  T
     SCC iter.                  ...        0 min,  0.003 sec
     gradient                   ...        0 min,  0.008 sec
 * total energy  :   -30.3693275 Eh     change       -0.3179288E-09 Eh
   gradient norm :     0.0645374 Eh/α   predicted     0.0000000E+00 (-100.00%)
   displ. norm   :     0.2213049 α      lambda       -0.7579656E-02
   maximum displ.:     0.1464370 α      in ANC's #12, #22, #4, ...

........................................................................
.............................. CYCLE    2 ..............................
........................................................................
   1    -30.7376900 -0.307377E+02  0.237E-01    2.89       0.0  T
   2    -30.7377512 -0.612610E-04  0.128E-01    2.86       1.0  T
   3    -30.7377461  0.514802E-05  0.508E-02    2.87       1.0  T
   4    -30.7377604 -0.143601E-04  0.175E-02    2.87       1.4  T
   5    -30.7377605 -0.717251E-07  0.121E-02    2.86       1.9  T
   6    -30.7377622 -0.167017E-05  0.285E-03    2.87       8.3  T
   7    -30.7377622 -0.365959E-07  0.110E-03    2.87      21.5  T
     SCC iter.                  ...        0 min,  0.005 sec
     gradient                   ...        0 min,  0.007 sec
 * total energy  :   -30.3740491 Eh     change       -0.4721590E-02 Eh
   gradient norm :     0.0193323 Eh/α   predicted    -0.3975437E-02 ( -15.80%)
   displ. norm   :     0.1722598 α      lambda       -0.1319182E-02
   maximum displ.:     0.0731034 α      in ANC's #12, #4, #11, ...

........................................................................
.............................. CYCLE    3 ..............................
........................................................................
   1    -30.7423737 -0.307424E+02  0.162E-01    2.86       0.0  T
   2    -30.7423877 -0.140022E-04  0.908E-02    2.85       1.0  T
   3    -30.7423849  0.273439E-05  0.300E-02    2.86       1.0  T
   4    -30.7423905 -0.559017E-05  0.115E-02    2.85       2.0  T
   5    -30.7423905  0.161528E-07  0.782E-03    2.85       3.0  T
   6    -30.7423912 -0.683433E-06  0.132E-03    2.85      17.9  T
   7    -30.7423912 -0.629282E-08  0.803E-04    2.85      29.3  T
     SCC iter.                  ...        0 min,  0.005 sec
     gradient                   ...        0 min,  0.007 sec
 * total energy  :   -30.3747776 Eh     change       -0.7284931E-03 Eh
   gradient norm :     0.0117973 Eh/α   predicted    -0.6791605E-03 (  -6.77%)
   displ. norm   :     0.1526756 α      lambda       -0.5182618E-03
   maximum displ.:     0.1013278 α      in ANC's #4, #12, #7, ...

........................................................................
.............................. CYCLE    4 ..............................
........................................................................
   1    -30.7417075 -0.307417E+02  0.181E-01    2.84       0.0  T
   2    -30.7417228 -0.153269E-04  0.101E-01    2.84       1.0  T
   3    -30.7417228  0.305972E-07  0.266E-02    2.84       1.0  T
   4    -30.7417252 -0.243629E-05  0.120E-02    2.84       2.0  T
   5    -30.7417252 -0.431638E-08  0.546E-03    2.84       4.3  T
   6    -30.7417255 -0.301457E-06  0.197E-03    2.84      12.0  T
   7    -30.7417256 -0.493555E-07  0.701E-04    2.84      33.6  T
     SCC iter.                  ...        0 min,  0.005 sec
     gradient                   ...        0 min,  0.007 sec
 * total energy  :   -30.3750163 Eh     change       -0.2387875E-03 Eh
   gradient norm :     0.0062014 Eh/α   predicted    -0.2651715E-03 (  11.05%)
   displ. norm   :     0.1105530 α      lambda       -0.2110996E-03
   maximum displ.:     0.0807991 α      in ANC's #4, #7, #9, ...

........................................................................
.............................. CYCLE    5 ..............................
........................................................................
   1    -30.7405950 -0.307406E+02  0.119E-01    2.83       0.0  T
   2    -30.7405993 -0.426473E-05  0.681E-02    2.83       1.0  T
   3    -30.7405997 -0.439329E-06  0.148E-02    2.83       1.6  T
   4    -30.7406003 -0.567493E-06  0.666E-03    2.83       3.5  T
   5    -30.7406003 -0.734901E-07  0.122E-03    2.83      19.4  T
   6    -30.7406004 -0.575849E-08  0.620E-04    2.83      38.0  T
     SCC iter.                  ...        0 min,  0.005 sec
     gradient                   ...        0 min,  0.007 sec
 * total energy  :   -30.3751508 Eh     change       -0.1344984E-03 Eh
   gradient norm :     0.0056033 Eh/α   predicted    -0.1068390E-03 ( -20.56%)
   displ. norm   :     0.1115137 α      lambda       -0.1263634E-03
   maximum displ.:     0.0858270 α      in ANC's #4, #7, #6, ...

........................................................................
.............................. CYCLE    6 ..............................
........................................................................
   1    -30.7405093 -0.307405E+02  0.115E-01    2.84       0.0  T
   2    -30.7405115 -0.217696E-05  0.659E-02    2.84       1.0  T
   3    -30.7405111  0.335511E-06  0.140E-02    2.84       1.7  T
   4    -30.7405114 -0.298017E-06  0.933E-03    2.84       2.5  T
   5    -30.7405123 -0.834811E-06  0.259E-03    2.83       9.1  T
   6    -30.7405123 -0.618922E-07  0.738E-04    2.84      31.9  T
     SCC iter.                  ...        0 min,  0.005 sec
     gradient                   ...        0 min,  0.007 sec
 * total energy  :   -30.3752320 Eh     change       -0.8115563E-04 Eh
   gradient norm :     0.0057316 Eh/α   predicted    -0.6396707E-04 ( -21.18%)
   displ. norm   :     0.1077058 α      lambda       -0.8803958E-04
   maximum displ.:     0.0889879 α      in ANC's #4, #7, #9, ...

........................................................................
.............................. CYCLE    7 ..............................
........................................................................
   1    -30.7408505 -0.307409E+02  0.127E-01    2.84       0.0  T
   2    -30.7408532 -0.267221E-05  0.699E-02    2.84       1.0  T
   3    -30.7408528  0.334003E-06  0.168E-02    2.84       1.4  T
   4    -30.7408527  0.109408E-06  0.121E-02    2.84       1.9  T
   5    -30.7408542 -0.153391E-05  0.161E-03    2.84      14.7  T
   6    -30.7408543 -0.114368E-07  0.859E-04    2.84      27.4  T
     SCC iter.                  ...        0 min,  0.005 sec
     gradient                   ...        0 min,  0.007 sec
 * total energy  :   -30.3753019 Eh     change       -0.6987571E-04 Eh
   gradient norm :     0.0050746 Eh/α   predicted    -0.4453130E-04 ( -36.27%)
   displ. norm   :     0.1434135 α      lambda       -0.9993115E-04
   maximum displ.:     0.1190326 α      in ANC's #4, #7, #9, ...

........................................................................
.............................. CYCLE    8 ..............................
........................................................................
   1    -30.7413238 -0.307413E+02  0.168E-01    2.84       0.0  T
   2    -30.7413286 -0.474053E-05  0.932E-02    2.84       1.0  T
   3    -30.7413282  0.409211E-06  0.220E-02    2.84       1.1  T
   4    -30.7413284 -0.232817E-06  0.147E-02    2.84       1.6  T
   5    -30.7413304 -0.199275E-05  0.294E-03    2.84       8.0  T
   6    -30.7413305 -0.820998E-07  0.119E-03    2.84      19.8  T
     SCC iter.                  ...        0 min,  0.005 sec
     gradient                   ...        0 min,  0.007 sec
 * total energy  :   -30.3753742 Eh     change       -0.7234625E-04 Eh
   gradient norm :     0.0026186 Eh/α   predicted    -0.5099395E-04 ( -29.51%)
   displ. norm   :     0.1187724 α      lambda       -0.4720533E-04
   maximum displ.:     0.0988477 α      in ANC's #4, #7, #3, ...

........................................................................
.............................. CYCLE    9 ..............................
........................................................................
   1    -30.7414888 -0.307415E+02  0.138E-01    2.83       0.0  T
   2    -30.7414917 -0.290236E-05  0.774E-02    2.84       1.0  T
   3    -30.7414920 -0.352196E-06  0.165E-02    2.84       1.4  T
   4    -30.7414918  0.221793E-06  0.107E-02    2.84       2.2  T
   5    -30.7414929 -0.106726E-05  0.220E-03    2.84      10.7  T
   6    -30.7414929 -0.511284E-07  0.838E-04    2.84      28.1  T
   7    -30.7414929  0.881013E-09  0.491E-04    2.84      48.0  T
     SCC iter.                  ...        0 min,  0.005 sec
     gradient                   ...        0 min,  0.008 sec
 * total energy  :   -30.3754065 Eh     change       -0.3227896E-04 Eh
   gradient norm :     0.0017969 Eh/α   predicted    -0.2393522E-04 ( -25.85%)
   displ. norm   :     0.1194117 α      lambda       -0.1964481E-04
   maximum displ.:     0.0941473 α      in ANC's #4, #7, #3, ...

........................................................................
.............................. CYCLE   10 ..............................
........................................................................
   1    -30.7420683 -0.307421E+02  0.135E-01    2.84       0.0  T
   2    -30.7420710 -0.273099E-05  0.754E-02    2.84       1.0  T
   3    -30.7420703  0.749291E-06  0.183E-02    2.84       1.3  T
   4    -30.7420714 -0.110437E-05  0.110E-02    2.84       2.1  T
   5    -30.7420722 -0.850350E-06  0.201E-03    2.84      11.7  T
   6    -30.7420722 -0.358314E-07  0.771E-04    2.84      30.6  T
   7    -30.7420722  0.111067E-08  0.446E-04    2.84      52.9  T
     SCC iter.                  ...        0 min,  0.005 sec
     gradient                   ...        0 min,  0.008 sec
 * total energy  :   -30.3754206 Eh     change       -0.1410040E-04 Eh
   gradient norm :     0.0016315 Eh/α   predicted    -0.9885386E-05 ( -29.89%)
   displ. norm   :     0.0343003 α      lambda       -0.6222171E-05
   maximum displ.:     0.0174332 α      in ANC's #3, #1, #2, ...

........................................................................
.............................. CYCLE   11 ..............................
........................................................................
   1    -30.7420503 -0.307421E+02  0.281E-02    2.84       0.0  T
   2    -30.7420508 -0.515834E-06  0.162E-02    2.84       1.5  T
   3    -30.7420506  0.138474E-06  0.560E-03    2.84       4.2  T
   4    -30.7420508 -0.117912E-06  0.283E-03    2.84       8.3  T
   5    -30.7420509 -0.990523E-07  0.946E-04    2.84      24.9  T
   6    -30.7420509 -0.352183E-08  0.325E-04    2.84      72.5  T
     SCC iter.                  ...        0 min,  0.005 sec
     gradient                   ...        0 min,  0.008 sec
 * total energy  :   -30.3754257 Eh     change       -0.5150735E-05 Eh
   gradient norm :     0.0010706 Eh/α   predicted    -0.3111309E-05 ( -39.59%)
   displ. norm   :     0.0408367 α      lambda       -0.5797197E-05
   maximum displ.:     0.0259045 α      in ANC's #1, #2, #3, ...

........................................................................
.............................. CYCLE   12 ..............................
........................................................................
   1    -30.7422847 -0.307423E+02  0.318E-02    2.84       0.0  T
   2    -30.7422851 -0.347612E-06  0.165E-02    2.84       1.4  T
   3    -30.7422850  0.698473E-07  0.521E-03    2.84       4.5  T
   4    -30.7422851 -0.135245E-06  0.263E-03    2.84       9.0  T
   5    -30.7422851 -0.577216E-09  0.165E-03    2.84      14.3  T
   6    -30.7422852 -0.329698E-07  0.357E-04    2.84      66.0  T
   7    -30.7422852  0.848388E-10  0.215E-04    2.84     109.6  T
     SCC iter.                  ...        0 min,  0.005 sec
     gradient                   ...        0 min,  0.008 sec
 * total energy  :   -30.3754308 Eh     change       -0.5025245E-05 Eh
   gradient norm :     0.0010938 Eh/α   predicted    -0.2899167E-05 ( -42.31%)
   displ. norm   :     0.0562159 α      lambda       -0.5272916E-05
   maximum displ.:     0.0333484 α      in ANC's #1, #2, #3, ...

........................................................................
.............................. CYCLE   13 ..............................
........................................................................
   1    -30.7416874 -0.307417E+02  0.430E-02    2.84       0.0  T
   2    -30.7416878 -0.381337E-06  0.247E-02    2.84       1.0  T
   3    -30.7416871  0.711060E-06  0.863E-03    2.84       2.7  T
   4    -30.7416879 -0.842176E-06  0.336E-03    2.84       7.0  T
   5    -30.7416880 -0.502410E-07  0.132E-03    2.84      17.9  T
   6    -30.7416880 -0.967411E-08  0.494E-04    2.84      47.7  T
   7    -30.7416880 -0.895600E-09  0.314E-04    2.84      75.0  T
     SCC iter.                  ...        0 min,  0.005 sec
     gradient                   ...        0 min,  0.008 sec
 * total energy  :   -30.3754344 Eh     change       -0.3630662E-05 Eh
   gradient norm :     0.0017020 Eh/α   predicted    -0.2639525E-05 ( -27.30%)
   displ. norm   :     0.0437394 α      lambda       -0.5200513E-05
   maximum displ.:     0.0290239 α      in ANC's #1, #2, #3, ...

........................................................................
.............................. CYCLE   14 ..............................
........................................................................
   1    -30.7417722 -0.307418E+02  0.313E-02    2.84       0.0  T
   2    -30.7417724 -0.230929E-06  0.162E-02    2.84       1.5  T
   3    -30.7417723  0.106072E-06  0.451E-03    2.84       5.2  T
   4    -30.7417724 -0.131370E-06  0.267E-03    2.84       8.8  T
   5    -30.7417724 -0.410551E-07  0.780E-04    2.84      30.2  T
   6    -30.7417725 -0.440727E-08  0.326E-04    2.84      72.3  T
     SCC iter.                  ...        0 min,  0.005 sec
     gradient                   ...        0 min,  0.008 sec
 * total energy  :   -30.3754400 Eh     change       -0.5630320E-05 Eh
   gradient norm :     0.0008122 Eh/α   predicted    -0.2600959E-05 ( -53.80%)
   displ. norm   :     0.0634906 α      lambda       -0.5123986E-05
   maximum displ.:     0.0466996 α      in ANC's #1, #2, #3, ...

........................................................................
.............................. CYCLE   15 ..............................
........................................................................
   1    -30.7421682 -0.307422E+02  0.467E-02    2.84       0.0  T
   2    -30.7421685 -0.386205E-06  0.245E-02    2.84       1.0  T
   3    -30.7421678  0.718579E-06  0.883E-03    2.84       2.7  T
   4    -30.7421687 -0.858444E-06  0.387E-03    2.84       6.1  T
   5    -30.7421687 -0.575130E-07  0.881E-04    2.84      26.8  T
   6    -30.7421687 -0.628967E-08  0.452E-04    2.84      52.1  T
     SCC iter.                  ...        0 min,  0.005 sec
     gradient                   ...        0 min,  0.008 sec
 * total energy  :   -30.3754456 Eh     change       -0.5537744E-05 Eh
   gradient norm :     0.0008031 Eh/α   predicted    -0.2565658E-05 ( -53.67%)
   displ. norm   :     0.0608851 α      lambda       -0.3780921E-05
   maximum displ.:     0.0415965 α      in ANC's #1, #2, #3, ...

........................................................................
.............................. CYCLE   16 ..............................
........................................................................
   1    -30.7420372 -0.307420E+02  0.465E-02    2.84       0.0  T
   2    -30.7420376 -0.342639E-06  0.252E-02    2.84       1.0  T
   3    -30.7420371  0.438529E-06  0.754E-03    2.84       3.1  T
   4    -30.7420376 -0.500048E-06  0.383E-03    2.84       6.1  T
   5    -30.7420377 -0.882739E-07  0.831E-04    2.84      28.4  T
   6    -30.7420377 -0.525457E-08  0.405E-04    2.84      58.2  T
     SCC iter.                  ...        0 min,  0.005 sec
     gradient                   ...        0 min,  0.008 sec
 * total energy  :   -30.3754502 Eh     change       -0.4662069E-05 Eh
   gradient norm :     0.0008358 Eh/α   predicted    -0.1895022E-05 ( -59.35%)
   displ. norm   :     0.0559203 α      lambda       -0.3559952E-05
   maximum displ.:     0.0408147 α      in ANC's #1, #2, #3, ...

   *** GEOMETRY OPTIMIZATION CONVERGED AFTER 16 ITERATIONS ***

------------------------------------------------------------------------
 total energy gain   :        -0.0061228 Eh       -3.8421 kcal/mol
 total RMSD          :         0.2610086 a0        0.1381 Å
 total power (kW/mol):        -1.0047070 (step)  -53.2821 (real)
------------------------------------------------------------------------

 ANCopt (total)                0 d,  0 h,  0 min,  0.302 sec
 optimizer setup                ...        0 min,  0.000 sec (  0.047%)
 model hessian                  ...        0 min,  0.002 sec (  0.617%)
 ANC generation                 ...        0 min,  0.000 sec (  0.163%)
 coordinate transformation      ...        0 min,  0.000 sec (  0.069%)
 single point calculation       ...        0 min,  0.294 sec ( 97.313%)
 optimization log               ...        0 min,  0.001 sec (  0.413%)
 hessian update                 ...        0 min,  0.000 sec (  0.060%)
 rational function              ...        0 min,  0.003 sec (  0.986%)

================
 final structure:
================
$coord
    0.69457379580492    1.95197362698468    0.73709918604223      C 
    2.14483744850815   -0.78166571102142    2.34136778891885      S 
   -0.98955351575554   -1.62706572741257    1.79211905654713      C 
   -1.75033833813115    0.51703203230805    0.64247487634040      C 
   -4.18572524613351    1.26579614055031   -0.39083954245223      C 
   -6.07744608812135   -0.01196857978326   -0.33114581313505      O 
   -4.04259867345842    3.57615888012680   -1.44748644182638      O 
   -6.30938512785563    4.59595093965107   -2.49910580777950      C 
   -7.53054226745173    6.40978150699368   -0.70313591955908      C 
   -8.17579755203876    8.74217528196700   -1.29931727217828      C 
    1.57366537937008    2.33781017224323   -1.07711434368345      H 
    0.69874627499455    3.63137291435578    1.91757618394627      H 
   -1.90051240441717   -3.37012011874057    2.27520532499080      H 
   -7.60533150734007    3.02439943063515   -2.89945402477884      H 
   -5.76652615909575    5.53323717106508   -4.25659777362892      H 
   -7.86216355871070    5.66234955495855    1.17004215229126      H 
   -7.85050458149220    9.50085806419170   -3.16130105257445      H 
   -9.07653358016054    9.98099425170530    0.03821012903655      H 
$end
           -------------------------------------------------
          |                Final Singlepoint                |
           -------------------------------------------------

          ...................................................
          :                      SETUP                      :
          :.................................................:
          :  # basis functions                  54          :
          :  # atomic orbitals                  53          :
          :  # shells                           29          :
          :  # electrons                        54          :
          :  max. iterations                   250          :
          :  Hamiltonian                  GFN2-xTB          :
          :  restarted?                      false          :
          :  GBSA solvation                  false          :
          :  PC potential                    false          :
          :  electronic temp.          300.0000000     K    :
          :  accuracy                    1.0000000          :
          :  -> integral cutoff          0.2500000E+02      :
          :  -> integral neglect         0.1000000E-07      :
          :  -> SCF convergence          0.1000000E-05 Eh   :
          :  -> wf. convergence          0.1000000E-03 e    :
          :  Broyden damping             0.4000000          :
          ...................................................

 iter      E             dE          RMSdq      gap      omega  full diag
   1    -30.7420377 -0.307420E+02  0.199E-04    2.84       0.0  T
   2    -30.7420377 -0.352394E-10  0.905E-05    2.84     260.6  T
   3    -30.7420377 -0.786038E-10  0.889E-05    2.84     265.2  T

   *** convergence criteria satisfied after 3 iterations ***

         #    Occupation            Energy/Eh            Energy/eV
      -------------------------------------------------------------
         1        2.0000           -0.7440040             -20.2454
       ...           ...                  ...                  ...
        21        2.0000           -0.4662601             -12.6876
        22        2.0000           -0.4634422             -12.6109
        23        2.0000           -0.4513840             -12.2828
        24        2.0000           -0.4377038             -11.9105
        25        2.0000           -0.4237216             -11.5301
        26        2.0000           -0.4155616             -11.3080
        27        2.0000           -0.3887272             -10.5778 (HOMO)
        28                         -0.2843705              -7.7381 (LUMO)
        29                         -0.2513642              -6.8400
        30                         -0.2225273              -6.0553
        31                         -0.1713796              -4.6635
        32                         -0.1462535              -3.9798
       ...                                ...                  ...
        53                          0.7286670              19.8280
      -------------------------------------------------------------
                  HL-Gap            0.1043567 Eh            2.8397 eV
             Fermi-level           -0.3365488 Eh           -9.1580 eV

 SCC (total)                   0 d,  0 h,  0 min,  0.017 sec
 SCC setup                      ...        0 min,  0.000 sec (  0.941%)
 Dispersion                     ...        0 min,  0.000 sec (  0.750%)
 integral evaluation            ...        0 min,  0.005 sec ( 31.174%)
 zeroth order Hamiltonian       ...        0 min,  0.000 sec (  0.574%)
 iterations                     ...        0 min,  0.003 sec ( 17.088%)
 molecular gradient             ...        0 min,  0.008 sec ( 47.501%)
 printout                       ...        0 min,  0.000 sec (  1.684%)

         :::::::::::::::::::::::::::::::::::::::::::::::::::::
         ::                     SUMMARY                     ::
         :::::::::::::::::::::::::::::::::::::::::::::::::::::
         :: total energy             -30.375450238649 Eh    ::
         :: gradient norm              0.000834714477 Eh/a0 ::
         :: HOMO-LUMO gap              2.839689946939 eV    ::
         ::.................................................::
         :: SCC energy               -30.742037709995 Eh    ::
         :: -> isotropic ES            0.047656379044 Eh    ::
         :: -> anisotropic ES          0.000438776018 Eh    ::
         :: -> anisotropic XC          0.011233544162 Eh    ::
         :: -> dispersion             -0.013482914610 Eh    ::
         :: repulsion energy           0.366592875792 Eh    ::
         :: add. restraining           0.000000000000 Eh    ::
         :::::::::::::::::::::::::::::::::::::::::::::::::::::

           -------------------------------------------------
          |                Property Printout                |
           -------------------------------------------------

    * Orbital Energies and Occupations

         #    Occupation            Energy/Eh            Energy/eV
      -------------------------------------------------------------
         1        2.0000           -0.7440040             -20.2454
       ...           ...                  ...                  ...
        15        2.0000           -0.5282511             -14.3744
        16        2.0000           -0.5145540             -14.0017
        17        2.0000           -0.5123084             -13.9406
        18        2.0000           -0.4964088             -13.5080
        19        2.0000           -0.4758817             -12.9494
        20        2.0000           -0.4735561             -12.8861
        21        2.0000           -0.4662601             -12.6876
        22        2.0000           -0.4634422             -12.6109
        23        2.0000           -0.4513840             -12.2828
        24        2.0000           -0.4377038             -11.9105
        25        2.0000           -0.4237216             -11.5301
        26        2.0000           -0.4155616             -11.3080
        27        2.0000           -0.3887272             -10.5778 (HOMO)
        28                         -0.2843705              -7.7381 (LUMO)
        29                         -0.2513642              -6.8400
        30                         -0.2225273              -6.0553
        31                         -0.1713796              -4.6635
        32                         -0.1462535              -3.9798
        33                         -0.0206681              -0.5624
        34                         -0.0159191              -0.4332
        35                          0.0174031               0.4736
        36                          0.0224382               0.6106
        37                          0.0408891               1.1126
        38                          0.1021109               2.7786
       ...                                ...                  ...
        53                          0.7286670              19.8280
      -------------------------------------------------------------
                  HL-Gap            0.1043567 Eh            2.8397 eV
             Fermi-level           -0.3365488 Eh           -9.1580 eV

     #   Z        covCN         q      C6AA      α(0)
     1   6 C      3.979    -0.013    20.737     6.470
     2  16 S      2.443    -0.061   143.576    20.167
     3   6 C      3.068     0.013    27.648     8.622
     4   6 C      3.444    -0.040    23.986     7.426
     5   6 C      2.715     0.351    21.032     7.507
     6   8 O      0.857    -0.422    22.125     6.306
     7   8 O      1.705    -0.276    18.576     5.819
     8   6 C      3.702     0.075    19.471     6.309
     9   6 C      2.884    -0.033    28.813     8.800
    10   6 C      2.837    -0.089    30.223     9.009
    11   1 H      0.925     0.073     2.051     2.240
    12   1 H      0.925     0.073     2.054     2.241
    13   1 H      0.926     0.069     2.099     2.266
    14   1 H      0.923     0.071     2.070     2.250
    15   1 H      0.924     0.057     2.230     2.335
    16   1 H      0.925     0.052     2.294     2.368
    17   1 H      0.926     0.046     2.367     2.406
    18   1 H      0.926     0.051     2.305     2.374

 Mol. C6AA /au·bohr⁶  :       4514.484076
 Mol. C8AA /au·bohr⁸  :     122755.391811
 Mol. α(0) /au        :        104.915794


Wiberg/Mayer (AO) data.
largest (>0.10) Wiberg bond orders for each atom
          total WBO             WBO to atom ...
     1  C   3.973        C    4 1.019    S    2 0.989    H   12 0.963    H   11 0.963
     2  S   2.357        C    3 1.150    C    1 0.989    C    4 0.113
     3  C   3.959        C    4 1.703    S    2 1.150    H   13 0.967
     4  C   3.974        C    3 1.703    C    5 1.047    C    1 1.019    S    2 0.113
     5  C   3.929        O    6 1.694    O    7 1.102    C    4 1.047
     6  O   2.030        C    5 1.694    O    7 0.167
     7  O   2.292        C    5 1.102    C    8 0.937    O    6 0.167
     8  C   3.926        C    9 1.012    H   15 0.967    H   14 0.949    O    7 0.937
     9  C   3.987        C   10 1.984    C    8 1.012    H   16 0.964
    10  C   3.989        C    9 1.984    H   18 0.976    H   17 0.974
    11  H   0.995        C    1 0.963
    12  H   0.995        C    1 0.963
    13  H   0.995        C    3 0.967
    14  H   0.995        C    8 0.949
    15  H   0.996        C    8 0.967
    16  H   0.997        C    9 0.964
    17  H   0.998        C   10 0.974
    18  H   0.996        C   10 0.976

molecular dipole:
                 x           y           z       tot (Debye)
 q only:        0.548       0.784      -0.119
   full:        0.349       0.909      -0.278       2.573
molecular quadrupole (traceless):
                xx          xy          yy          xz          yz          zz
 q only:       -6.451      -7.493       5.936       1.803      -2.433       0.515
  q+dip:      -10.363      -6.670       7.642      -0.654      -2.267       2.721
   full:       -9.467      -6.728       6.906      -0.168      -1.829       2.561

           -------------------------------------------------
          |                Geometry Summary                 |
           -------------------------------------------------

      molecular mass/u    :      156.1990000
   center of mass at/Å    :       -1.5940154       1.1215802       0.0674147
  moments of inertia/u·Å² :        0.1577803E+03   0.1021206E+04   0.1121182E+04
rotational constants/cm⁻¹ :        0.1068424E+00   0.1650757E-01   0.1503559E-01

 * 16 selected distances

     #   Z        #   Z                                     value/Å
     2  16 S      3   6 C                                 1.7423343 (max)
     1   6 C      4   6 C                                 1.5009996
     3   6 C      4   6 C                                 1.3488967
     4   6 C      5   6 C                                 1.4549484
     5   6 C      6   8 O                                 1.2084321
     5   6 C      7   8 O                                 1.3465210
     7   8 O      8   6 C                                 1.4282101
     9   6 C     10   6 C                                 1.3188991
     1   6 C     11   1 H                                 1.0861732
     1   6 C     12   1 H                                 1.0862870
     3   6 C     13   1 H                                 1.0716927 (min)
     8   6 C     14   1 H                                 1.0985406
     8   6 C     15   1 H                                 1.0924633
     9   6 C     16   1 H                                 1.0815719
    10   6 C     17   1 H                                 1.0778080
    10   6 C     18   1 H                                 1.0760631

 * 4 distinct bonds (by element types)

   Z      Z             #   av. dist./Å        max./Å        min./Å
   1 H    6 C           8     1.0838250     1.0985406     1.0716927
   6 C    6 C           4     1.4059359     1.5009996     1.3188991
   6 C    8 O           3     1.3277211     1.4282101     1.2084321
   6 C   16 S           1     1.7423343     1.7423343     1.7423343


optimized geometry written to: xtbopt.xyz


           -------------------------------------------------
          | TOTAL ENERGY              -30.375450238649 Eh   |
          | GRADIENT NORM               0.000834714477 Eh/α |
          | HOMO-LUMO GAP               2.839689946939 eV   |
           -------------------------------------------------

------------------------------------------------------------------------
 * finished run on 2021/05/19 at 11:00:35.538     
------------------------------------------------------------------------
 total:
 * wall-time:     0 d,  0 h,  0 min,  0.361 sec
 *  cpu-time:     0 d,  0 h,  0 min,  0.360 sec
 * ratio c/w:     0.996 speedup
 SCF:
 * wall-time:     0 d,  0 h,  0 min,  0.025 sec
 *  cpu-time:     0 d,  0 h,  0 min,  0.025 sec
 * ratio c/w:     0.998 speedup
 ANC optimizer:
 * wall-time:     0 d,  0 h,  0 min,  0.319 sec
 *  cpu-time:     0 d,  0 h,  0 min,  0.318 sec
 * ratio c/w:     0.998 speedup

