      -----------------------------------------------------------      
     |                   =====================                   |     
     |                           x T B                           |     
     |                   =====================                   |     
     |                         S. Grimme                         |     
     |          Mulliken Center for Theoretical Chemistry        |     
     |                    University of Bonn                     |     
     |                Version 6.2 RC2 (SAW190805)                |     
      -----------------------------------------------------------      

   This program is distributed in the hope that it will be useful,
   but WITHOUT ANY WARRANTY; without even the implied warranty of
   MERCHANTABILITY or FITNESS FOR A PARTICULAR PURPOSE.
   
   FOR NON-COMMERCIAL, ACADEMIA USE ONLY.
   
   Cite this work as:
   * S. Grimme, C. Bannwarth, P. Shushkov, J. Chem. Theory Comput., 2017,
     13, 1989-2009. DOI: 10.1021/acs.jctc.7b00118
   * C. Bannwarth, S. Ehlert and S. Grimme., J. Chem. Theory Comput., 2019,
     15, 1652-1671. DOI: 10.1021/acs.jctc.8b01176
   * P. Pracht, E. Caldeweyher, S. Ehlert, S. Grimme, ChemRxiv, 2019, preprint.
     DOI: 10.26434/chemrxiv.8326202.v1
   
   for DFT-D4:
   * E. Caldeweyher, C. Bannwarth and S. Grimme, J. Chem. Phys., 2017,
     147, 034112. DOI: 10.1063/1.4993215
   * E. Caldeweyher, S. Ehlert, A. Hansen, H. Neugebauer, S. Spicher,
     C. Bannwarth and S. Grimme, J. Chem. Phys., 2019, 150, 154122.
     DOI: 10.1063/1.5090222
   
   for sTDA-xTB:
   * S. Grimme and C. Bannwarth, J. Chem. Phys., 2016, 145, 054103.
     DOI: 10.1063/1.4959605
   
   in the mass-spec context:
   * V. Asgeirsson, C. Bauer and S. Grimme, Chem. Sci., 2017, 8, 4879.
     DOI: 10.1039/c7sc00601b
   
   for metadynamics refer to:
   * S. Grimme, J. Chem. Theory Comput., 2019, 155, 2847-2862
     DOI: 10.1021/acs.jctc.9b00143
   
   with help from (in alphabetical order)
   C. Bannwarth, F. Bohle, G. Brandenburg, E. Caldeweyher, M. Checinski,
   S. Dohm, S. Ehlert, S. Ehrlich, F. März, H. Neugebauer, J. Pisarek,
   P. Pracht, P. Shushkov, and S. Spicher.
   
 * started run on 2021/05/19 at 11:00:39.533     

           -------------------------------------------------
          |                Calculation Setup                |
           -------------------------------------------------

          program call               : /ihome/ghutchison/geoffh/xtb/xtb 1013.xyz -opt
          hostname                   : smp-n144
          coordinate file            : 1013.xyz
          omp threads                :                     1
          number of atoms            :                    24
          number of electrons        :                    64
          charge                     :                     0
          spin                       :                   0.0
          first test random number   :      0.56363963750627


########################################################################
# WARNING! Please study the warnings concerning your input carefully
#  - the use of '-opt' is discouraged, please use '--opt' next time
########################################################################

           ------------------------------------------------- 
          |                 G F N 2 - x T B                 |
          | Geometry, Frequencies, Noncovalent interactions |
          |            JCTC 2019 parametrisation            |
           ------------------------------------------------- 
             KAB for C  - Si     :                1.0500
             KAB for H  - Pd     :                0.9500
             k(s)              :                1.8500
             k(p)              :                2.2300
             k(d)              :                2.2300
             k(f)              :                2.0000
             kEN (H0ij)        :               -2.0000
             D4 a1             :                0.5200
             D4 a2             :                5.0000
             D4 s6             :                1.0000
             D4 s8             :                2.7000
             D4 s9             :                5.0000
             alphaj            :                2.0000

  Z AO/shell   Hii/eV     exponent
  1     Wed Apr 25 08:07:45 CEST 2018   EN: 2.200 GM2: 0.406  GM3: 0.0800  RAES: 1.40
     1s    -10.707211    1.230000
  6     Wed Apr 25 08:07:45 CEST 2018   EN: 2.550 GM2: 0.538  GM3: 0.1500  RAES: 3.00
     2s    -13.970922    2.096432
     2p    -10.063292    1.800000
 16     Tue Apr 24 11:44:34 CEST 2018   EN: 2.580 GM2: 0.340  GM3:-0.0502  RAES: 3.10
     3s    -20.029654    1.981333
     3p    -11.377694    2.025643
     3d     -0.420282    1.702555

           ------------------------------------------------- 
          |        Self-Consistent Charge Iterations        |
           ------------------------------------------------- 

          ...................................................
          :                      SETUP                      :
          :.................................................:
          :  # basis functions                  72          :
          :  # atomic orbitals                  70          :
          :  # shells                           38          :
          :  # electrons                        64          :
          :  max. iterations                   250          :
          :  Hamiltonian                  GFN2-xTB          :
          :  restarted?                      false          :
          :  GBSA solvation                  false          :
          :  PC potential                    false          :
          :  electronic temp.          300.0000000     K    :
          :  accuracy                    1.0000000          :
          :  -> integral cutoff          0.2500000E+02      :
          :  -> integral neglect         0.1000000E-07      :
          :  -> SCF convergence          0.1000000E-05 Eh   :
          :  -> wf. convergence          0.1000000E-03 e    :
          :  Broyden damping             0.4000000          :
          ...................................................

 iter      E             dE          RMSdq      gap      omega  full diag
   1    -34.4649118 -0.344649E+02  0.391E+00    3.09       0.0  T
   2    -34.4965942 -0.316824E-01  0.203E+00    3.05       1.0  T
   3    -34.4945818  0.201233E-02  0.822E-01    3.04       1.0  T
   4    -34.4967556 -0.217376E-02  0.433E-01    3.02       1.0  T
   5    -34.4989806 -0.222503E-02  0.136E-01    3.03       1.0  T
   6    -34.4990120 -0.313496E-04  0.560E-02    3.02       1.0  T
   7    -34.4990506 -0.386288E-04  0.203E-02    3.03       1.0  T
   8    -34.4990512 -0.604383E-06  0.831E-03    3.03       2.5  T
   9    -34.4990513 -0.114995E-06  0.293E-03    3.03       7.0  T
  10    -34.4990513  0.260104E-07  0.210E-03    3.03       9.7  T
  11    -34.4990513 -0.519973E-07  0.566E-04    3.03      36.1  T
  12    -34.4990513 -0.154308E-08  0.216E-04    3.03      94.4  T

   *** convergence criteria satisfied after 12 iterations ***

         #    Occupation            Energy/Eh            Energy/eV
      -------------------------------------------------------------
         1        2.0000           -0.7274957             -19.7962
       ...           ...                  ...                  ...
        26        2.0000           -0.4415480             -12.0151
        27        2.0000           -0.4406077             -11.9895
        28        2.0000           -0.4351799             -11.8418
        29        2.0000           -0.4290520             -11.6751
        30        2.0000           -0.4035199             -10.9803
        31        2.0000           -0.3850661             -10.4782
        32        2.0000           -0.3659323              -9.9575 (HOMO)
        33                         -0.2545646              -6.9271 (LUMO)
        34                         -0.2187013              -5.9512
        35                         -0.2012164              -5.4754
        36                         -0.1879311              -5.1139
        37                         -0.1688786              -4.5954
       ...                                ...                  ...
        70                          0.6763861              18.4054
      -------------------------------------------------------------
                  HL-Gap            0.1113677 Eh            3.0305 eV
             Fermi-level           -0.3102485 Eh           -8.4423 eV

 SCC (total)                   0 d,  0 h,  0 min,  0.040 sec
 SCC setup                      ...        0 min,  0.000 sec (  0.763%)
 Dispersion                     ...        0 min,  0.000 sec (  0.813%)
 integral evaluation            ...        0 min,  0.009 sec ( 23.454%)
 zeroth order Hamiltonian       ...        0 min,  0.000 sec (  0.453%)
 iterations                     ...        0 min,  0.015 sec ( 36.786%)
 molecular gradient             ...        0 min,  0.015 sec ( 36.636%)
 printout                       ...        0 min,  0.000 sec (  0.936%)

         :::::::::::::::::::::::::::::::::::::::::::::::::::::
         ::                     SUMMARY                     ::
         :::::::::::::::::::::::::::::::::::::::::::::::::::::
         :: total energy             -34.023142027854 Eh    ::
         :: gradient norm              0.056002737451 Eh/a0 ::
         :: HOMO-LUMO gap              3.030469007028 eV    ::
         ::.................................................::
         :: SCC energy               -34.499051344547 Eh    ::
         :: -> isotropic ES            0.002798070531 Eh    ::
         :: -> anisotropic ES          0.003412123729 Eh    ::
         :: -> anisotropic XC          0.015781121007 Eh    ::
         :: -> dispersion             -0.025232437942 Eh    ::
         :: repulsion energy           0.475798460490 Eh    ::
         :: add. restraining           0.000000000000 Eh    ::
         :::::::::::::::::::::::::::::::::::::::::::::::::::::

      ----------------------------------------------------------- 
     |                   =====================                   |
     |                        A N C O P T                        |
     |                   =====================                   |
     |               Approximate Normal Coordinate               |
     |                Rational Function Optimizer                |
      ----------------------------------------------------------- 

          ...................................................
          :                      SETUP                      :
          :.................................................:
          :   optimization level            normal          :
          :   max. optcycles                   200          :
          :   ANC micro-cycles                  20          :
          :   degrees of freedom                66          :
          :.................................................:
          :   RF solver                   davidson          :
          :   input Hessian                  false          :
          :   write xtbopt.log                true          :
          :   linear?                        false          :
          :   energy convergence         0.5000000E-05 Eh   :
          :   grad. convergence          0.1000000E-02 Eh/α :
          :   maximium RF displ.         2.0000000          :
          :   Hlow (freq-cutoff)         0.5000000E-02      :
          :   Hmax (freq-cutoff)         5.0000000          :
          :   S6 in model hess.         20.0000000          :
          ...................................................

generating ANC from model Hessian ...
Using Lindh-Hessian (1995)
 Shifting diagonal of input Hessian by   4.098946506440624E-003
 Lowest  eigenvalues of input Hessian
   -0.000000   -0.000000   -0.000000    0.000000    0.000000    0.000000
    0.005000    0.006145    0.006739    0.009587    0.010319    0.011051
    0.012562    0.014801    0.019256    0.021291    0.022549    0.038404
 Highest eigenvalues
    1.449921    1.630276    1.666130    1.801947    1.802423    1.857516
 

........................................................................
.............................. CYCLE    1 ..............................
........................................................................
   1    -34.4990513 -0.344991E+02  0.427E-05    3.03       0.0  T
   2    -34.4990513 -0.594014E-11  0.253E-05    3.03     806.5  T
   3    -34.4990513 -0.525091E-11  0.160E-05    3.03    1274.3  T
     SCC iter.                  ...        0 min,  0.004 sec
     gradient                   ...        0 min,  0.014 sec
 * total energy  :   -34.0231420 Eh     change        0.3771233E-07 Eh
   gradient norm :     0.0560020 Eh/α   predicted     0.0000000E+00 (-100.00%)
   displ. norm   :     0.1742879 α      lambda       -0.5336030E-02
   maximum displ.:     0.0965789 α      in ANC's #28, #11, #42, ...

........................................................................
.............................. CYCLE    2 ..............................
........................................................................
   1    -34.5174902 -0.345175E+02  0.150E-01    3.10       0.0  T
   2    -34.5175114 -0.211966E-04  0.910E-02    3.10       1.0  T
   3    -34.5175015  0.989116E-05  0.602E-02    3.10       1.0  T
   4    -34.5175424 -0.409276E-04  0.107E-02    3.10       1.9  T
   5    -34.5175432 -0.778439E-06  0.425E-03    3.10       4.8  T
   6    -34.5175433 -0.573759E-07  0.118E-03    3.10      17.3  T
     SCC iter.                  ...        0 min,  0.007 sec
     gradient                   ...        0 min,  0.014 sec
 * total energy  :   -34.0264847 Eh     change       -0.3342726E-02 Eh
   gradient norm :     0.0211906 Eh/α   predicted    -0.2749079E-02 ( -17.76%)
   displ. norm   :     0.0902407 α      lambda       -0.6728919E-03
   maximum displ.:     0.0460158 α      in ANC's #1, #8, #11, ...

........................................................................
.............................. CYCLE    3 ..............................
........................................................................
   1    -34.5230314 -0.345230E+02  0.721E-02    3.11       0.0  T
   2    -34.5230364 -0.497711E-05  0.460E-02    3.11       1.0  T
   3    -34.5230392 -0.283774E-05  0.292E-02    3.11       1.0  T
   4    -34.5230472 -0.799628E-05  0.498E-03    3.11       4.1  T
   5    -34.5230473 -0.775091E-07  0.223E-03    3.11       9.2  T
   6    -34.5230473 -0.122435E-07  0.691E-04    3.11      29.5  T
     SCC iter.                  ...        0 min,  0.007 sec
     gradient                   ...        0 min,  0.014 sec
 * total energy  :   -34.0268809 Eh     change       -0.3961625E-03 Eh
   gradient norm :     0.0071062 Eh/α   predicted    -0.3392245E-03 ( -14.37%)
   displ. norm   :     0.0703895 α      lambda       -0.1073867E-03
   maximum displ.:     0.0546190 α      in ANC's #1, #2, #8, ...

........................................................................
.............................. CYCLE    4 ..............................
........................................................................
   1    -34.5230587 -0.345231E+02  0.368E-02    3.11       0.0  T
   2    -34.5230595 -0.774108E-06  0.224E-02    3.11       1.0  T
   3    -34.5230585  0.948486E-06  0.150E-02    3.11       1.4  T
   4    -34.5230613 -0.273396E-05  0.225E-03    3.11       9.1  T
   5    -34.5230613 -0.851543E-08  0.902E-04    3.11      22.6  T
     SCC iter.                  ...        0 min,  0.006 sec
     gradient                   ...        0 min,  0.014 sec
 * total energy  :   -34.0269591 Eh     change       -0.7819770E-04 Eh
   gradient norm :     0.0027490 Eh/α   predicted    -0.5398457E-04 ( -30.96%)
   displ. norm   :     0.0955266 α      lambda       -0.6908464E-04
   maximum displ.:     0.0753411 α      in ANC's #1, #2, #6, ...

........................................................................
.............................. CYCLE    5 ..............................
........................................................................
   1    -34.5222833 -0.345223E+02  0.400E-02    3.10       0.0  T
   2    -34.5222837 -0.407589E-06  0.236E-02    3.10       1.0  T
   3    -34.5222810  0.265540E-05  0.151E-02    3.10       1.4  T
   4    -34.5222846 -0.358433E-05  0.191E-03    3.10      10.7  T
   5    -34.5222846 -0.428669E-08  0.630E-04    3.10      32.4  T
   6    -34.5222846 -0.310810E-08  0.250E-04    3.10      81.8  T
     SCC iter.                  ...        0 min,  0.007 sec
     gradient                   ...        0 min,  0.014 sec
 * total energy  :   -34.0270085 Eh     change       -0.4944728E-04 Eh
   gradient norm :     0.0023654 Eh/α   predicted    -0.3486520E-04 ( -29.49%)
   displ. norm   :     0.0865666 α      lambda       -0.3661466E-04
   maximum displ.:     0.0654555 α      in ANC's #1, #2, #6, ...

........................................................................
.............................. CYCLE    6 ..............................
........................................................................
   1    -34.5218348 -0.345218E+02  0.327E-02    3.10       0.0  T
   2    -34.5218349 -0.110352E-06  0.191E-02    3.10       1.1  T
   3    -34.5218339  0.100677E-05  0.784E-03    3.10       2.6  T
   4    -34.5218350 -0.114986E-05  0.113E-03    3.10      18.0  T
   5    -34.5218350 -0.164700E-08  0.252E-04    3.10      81.2  T
   6    -34.5218350 -0.317712E-09  0.764E-05    3.10     267.1  T
     SCC iter.                  ...        0 min,  0.007 sec
     gradient                   ...        0 min,  0.014 sec
 * total energy  :   -34.0270404 Eh     change       -0.3189451E-04 Eh
   gradient norm :     0.0030479 Eh/α   predicted    -0.1847775E-04 ( -42.07%)
   displ. norm   :     0.1013171 α      lambda       -0.4286198E-04
   maximum displ.:     0.0723329 α      in ANC's #1, #2, #6, ...

........................................................................
.............................. CYCLE    7 ..............................
........................................................................
   1    -34.5216469 -0.345216E+02  0.374E-02    3.11       0.0  T
   2    -34.5216470 -0.112716E-06  0.219E-02    3.11       1.0  T
   3    -34.5216470  0.155181E-07  0.219E-03    3.11       9.3  T
   4    -34.5216470 -0.282650E-07  0.119E-03    3.11      17.1  T
   5    -34.5216470 -0.155349E-07  0.502E-04    3.11      40.7  T
   6    -34.5216470 -0.176814E-08  0.183E-04    3.11     111.3  T
     SCC iter.                  ...        0 min,  0.007 sec
     gradient                   ...        0 min,  0.014 sec
 * total energy  :   -34.0270798 Eh     change       -0.3936956E-04 Eh
   gradient norm :     0.0028161 Eh/α   predicted    -0.2165158E-04 ( -45.00%)
   displ. norm   :     0.1582873 α      lambda       -0.6465428E-04
   maximum displ.:     0.1104370 α      in ANC's #1, #2, #6, ...

........................................................................
.............................. CYCLE    8 ..............................
........................................................................
   1    -34.5216598 -0.345217E+02  0.580E-02    3.11       0.0  T
   2    -34.5216601 -0.253382E-06  0.340E-02    3.11       1.0  T
   3    -34.5216600  0.410124E-07  0.333E-03    3.11       6.1  T
   4    -34.5216601 -0.693098E-07  0.238E-03    3.11       8.6  T
   5    -34.5216601 -0.505094E-07  0.726E-04    3.11      28.1  T
   6    -34.5216601 -0.297594E-08  0.387E-04    3.11      52.8  T
     SCC iter.                  ...        0 min,  0.007 sec
     gradient                   ...        0 min,  0.014 sec
 * total energy  :   -34.0271379 Eh     change       -0.5810969E-04 Eh
   gradient norm :     0.0024236 Eh/α   predicted    -0.3313851E-04 ( -42.97%)
   displ. norm   :     0.2394449 α      lambda       -0.8449562E-04
   maximum displ.:     0.1671859 α      in ANC's #2, #1, #8, ...

........................................................................
.............................. CYCLE    9 ..............................
........................................................................
   1    -34.5216623 -0.345217E+02  0.858E-02    3.11       0.0  T
   2    -34.5216628 -0.460360E-06  0.504E-02    3.11       1.0  T
   3    -34.5216628 -0.316308E-07  0.430E-03    3.11       4.7  T
   4    -34.5216628 -0.265211E-07  0.347E-03    3.11       5.9  T
   5    -34.5216629 -0.113942E-06  0.978E-04    3.11      20.9  T
   6    -34.5216629 -0.420453E-08  0.583E-04    3.11      35.0  T
     SCC iter.                  ...        0 min,  0.007 sec
     gradient                   ...        0 min,  0.014 sec
 * total energy  :   -34.0272095 Eh     change       -0.7158315E-04 Eh
   gradient norm :     0.0025217 Eh/α   predicted    -0.4467163E-04 ( -37.59%)
   displ. norm   :     0.2947280 α      lambda       -0.8171822E-04
   maximum displ.:     0.2071729 α      in ANC's #2, #1, #8, ...

........................................................................
.............................. CYCLE   10 ..............................
........................................................................
   1    -34.5216253 -0.345216E+02  0.104E-01    3.12       0.0  T
   2    -34.5216260 -0.674381E-06  0.610E-02    3.12       1.0  T
   3    -34.5216262 -0.229182E-06  0.524E-03    3.12       3.9  T
   4    -34.5216262  0.526965E-08  0.212E-03    3.12       9.6  T
   5    -34.5216262 -0.364102E-07  0.102E-03    3.12      19.9  T
   6    -34.5216262  0.282704E-09  0.605E-04    3.12      33.7  T
   7    -34.5216262 -0.292012E-08  0.208E-04    3.12      98.3  T
     SCC iter.                  ...        0 min,  0.008 sec
     gradient                   ...        0 min,  0.015 sec
 * total energy  :   -34.0272719 Eh     change       -0.6240277E-04 Eh
   gradient norm :     0.0027948 Eh/α   predicted    -0.4441547E-04 ( -28.82%)
   displ. norm   :     0.2182095 α      lambda       -0.4804347E-04
   maximum displ.:     0.1575868 α      in ANC's #2, #1, #8, ...

........................................................................
.............................. CYCLE   11 ..............................
........................................................................
   1    -34.5221728 -0.345222E+02  0.764E-02    3.12       0.0  T
   2    -34.5221732 -0.403497E-06  0.448E-02    3.12       1.0  T
   3    -34.5221732 -0.788158E-07  0.471E-03    3.12       4.3  T
   4    -34.5221732  0.516379E-07  0.271E-03    3.12       7.5  T
   5    -34.5221733 -0.121806E-06  0.918E-04    3.12      22.2  T
   6    -34.5221733 -0.228991E-08  0.482E-04    3.12      42.4  T
     SCC iter.                  ...        0 min,  0.007 sec
     gradient                   ...        0 min,  0.015 sec
 * total energy  :   -34.0273083 Eh     change       -0.3644256E-04 Eh
   gradient norm :     0.0022247 Eh/α   predicted    -0.2517906E-04 ( -30.91%)
   displ. norm   :     0.1523077 α      lambda       -0.2967061E-04
   maximum displ.:     0.1175795 α      in ANC's #2, #1, #8, ...

........................................................................
.............................. CYCLE   12 ..............................
........................................................................
   1    -34.5228420 -0.345228E+02  0.544E-02    3.11       0.0  T
   2    -34.5228423 -0.250944E-06  0.319E-02    3.11       1.0  T
   3    -34.5228421  0.191700E-06  0.523E-03    3.11       3.9  T
   4    -34.5228424 -0.270458E-06  0.202E-03    3.11      10.1  T
   5    -34.5228424 -0.178185E-07  0.683E-04    3.11      29.9  T
   6    -34.5228424 -0.153310E-08  0.361E-04    3.11      56.6  T
     SCC iter.                  ...        0 min,  0.007 sec
     gradient                   ...        0 min,  0.015 sec
 * total energy  :   -34.0273312 Eh     change       -0.2284505E-04 Eh
   gradient norm :     0.0012677 Eh/α   predicted    -0.1518103E-04 ( -33.55%)
   displ. norm   :     0.1822520 α      lambda       -0.1945708E-04
   maximum displ.:     0.1541253 α      in ANC's #2, #1, #11, ...

........................................................................
.............................. CYCLE   13 ..............................
........................................................................
   1    -34.5230337 -0.345230E+02  0.683E-02    3.11       0.0  T
   2    -34.5230341 -0.339290E-06  0.401E-02    3.11       1.0  T
   3    -34.5230332  0.829574E-06  0.841E-03    3.11       2.4  T
   4    -34.5230343 -0.101337E-05  0.244E-03    3.11       8.4  T
   5    -34.5230343 -0.392493E-08  0.669E-04    3.11      30.5  T
   6    -34.5230343 -0.123673E-08  0.404E-04    3.11      50.5  T
     SCC iter.                  ...        0 min,  0.007 sec
     gradient                   ...        0 min,  0.015 sec
 * total energy  :   -34.0273530 Eh     change       -0.2184314E-04 Eh
   gradient norm :     0.0007795 Eh/α   predicted    -0.9873478E-05 ( -54.80%)
   displ. norm   :     0.0666654 α      lambda       -0.1146404E-04
   maximum displ.:     0.0621916 α      in ANC's #2, #7, #11, ...

........................................................................
.............................. CYCLE   14 ..............................
........................................................................
   1    -34.5234880 -0.345235E+02  0.279E-02    3.11       0.0  T
   2    -34.5234880 -0.434169E-07  0.164E-02    3.11       1.2  T
   3    -34.5234880  0.491771E-07  0.239E-03    3.11       8.5  T
   4    -34.5234880 -0.675228E-07  0.834E-04    3.11      24.5  T
   5    -34.5234880 -0.595811E-09  0.291E-04    3.11      70.3  T
     SCC iter.                  ...        0 min,  0.006 sec
     gradient                   ...        0 min,  0.014 sec
 * total energy  :   -34.0273679 Eh     change       -0.1489543E-04 Eh
   gradient norm :     0.0010340 Eh/α   predicted    -0.5746682E-05 ( -61.42%)
   displ. norm   :     0.2166420 α      lambda       -0.3424951E-04
   maximum displ.:     0.2036092 α      in ANC's #2, #7, #11, ...

........................................................................
.............................. CYCLE   15 ..............................
........................................................................
   1    -34.5226505 -0.345227E+02  0.882E-02    3.12       0.0  T
   2    -34.5226509 -0.383755E-06  0.522E-02    3.12       1.0  T
   3    -34.5226499  0.965340E-06  0.885E-03    3.12       2.3  T
   4    -34.5226511 -0.117722E-05  0.240E-03    3.12       8.5  T
   5    -34.5226511 -0.225067E-08  0.872E-04    3.12      23.4  T
   6    -34.5226511 -0.313540E-08  0.465E-04    3.12      43.9  T
     SCC iter.                  ...        0 min,  0.007 sec
     gradient                   ...        0 min,  0.015 sec
 * total energy  :   -34.0274111 Eh     change       -0.4322582E-04 Eh
   gradient norm :     0.0015528 Eh/α   predicted    -0.1748356E-04 ( -59.55%)
   displ. norm   :     0.1875757 α      lambda       -0.2790598E-04
   maximum displ.:     0.1729569 α      in ANC's #2, #1, #7, ...

........................................................................
.............................. CYCLE   16 ..............................
........................................................................
   1    -34.5223338 -0.345223E+02  0.758E-02    3.12       0.0  T
   2    -34.5223341 -0.269142E-06  0.448E-02    3.12       1.0  T
   3    -34.5223341 -0.671781E-07  0.386E-03    3.12       5.3  T
   4    -34.5223341  0.341413E-07  0.225E-03    3.12       9.1  T
   5    -34.5223342 -0.825130E-07  0.912E-04    3.12      22.4  T
   6    -34.5223342 -0.179904E-08  0.426E-04    3.12      47.9  T
     SCC iter.                  ...        0 min,  0.007 sec
     gradient                   ...        0 min,  0.015 sec
 * total energy  :   -34.0274474 Eh     change       -0.3628221E-04 Eh
   gradient norm :     0.0015176 Eh/α   predicted    -0.1418540E-04 ( -60.90%)
   displ. norm   :     0.5123266 α      lambda       -0.6488539E-04
   maximum displ.:     0.4751949 α      in ANC's #2, #1, #7, ...

........................................................................
.............................. CYCLE   17 ..............................
........................................................................
   1    -34.5197966 -0.345198E+02  0.206E-01    3.12       0.0  T
   2    -34.5197992 -0.253869E-05  0.122E-01    3.12       1.0  T
   3    -34.5197995 -0.345507E-06  0.116E-02    3.12       1.8  T
   4    -34.5197995  0.249821E-07  0.640E-03    3.12       3.2  T
   5    -34.5198000 -0.557622E-06  0.310E-03    3.12       6.6  T
   6    -34.5198001 -0.370017E-07  0.135E-03    3.12      15.1  T
   7    -34.5198001 -0.212765E-09  0.641E-04    3.12      31.8  T
   8    -34.5198001 -0.417342E-08  0.211E-04    3.12      96.7  T
     SCC iter.                  ...        0 min,  0.009 sec
     gradient                   ...        0 min,  0.015 sec
 * total energy  :   -34.0274776 Eh     change       -0.3020890E-04 Eh
   gradient norm :     0.0052345 Eh/α   predicted    -0.3622870E-04 (  19.93%)
   displ. norm   :     0.0651130 α      lambda       -0.5087033E-04
   maximum displ.:     0.0592549 α      in ANC's #2, #6, #7, ...

........................................................................
.............................. CYCLE   18 ..............................
........................................................................
   1    -34.5218045 -0.345218E+02  0.289E-02    3.12       0.0  T
   2    -34.5218047 -0.211605E-06  0.166E-02    3.12       1.2  T
   3    -34.5218045  0.232817E-06  0.433E-03    3.12       4.7  T
   4    -34.5218048 -0.267591E-06  0.134E-03    3.12      15.2  T
   5    -34.5218048 -0.139324E-07  0.463E-04    3.12      44.1  T
     SCC iter.                  ...        0 min,  0.006 sec
     gradient                   ...        0 min,  0.014 sec
 * total energy  :   -34.0275106 Eh     change       -0.3292539E-04 Eh
   gradient norm :     0.0022981 Eh/α   predicted    -0.2554277E-04 ( -22.42%)
   displ. norm   :     0.0590015 α      lambda       -0.2031930E-04
   maximum displ.:     0.0445603 α      in ANC's #2, #1, #42, ...

........................................................................
.............................. CYCLE   19 ..............................
........................................................................
   1    -34.5229550 -0.345230E+02  0.226E-02    3.12       0.0  T
   2    -34.5229551 -0.646595E-07  0.134E-02    3.12       1.5  T
   3    -34.5229551  0.393706E-07  0.196E-03    3.12      10.4  T
   4    -34.5229551 -0.474377E-07  0.125E-03    3.12      16.4  T
   5    -34.5229551 -0.128273E-07  0.416E-04    3.12      49.1  T
   6    -34.5229551 -0.160021E-09  0.207E-04    3.12      98.6  T
     SCC iter.                  ...        0 min,  0.007 sec
     gradient                   ...        0 min,  0.015 sec
 * total energy  :   -34.0275255 Eh     change       -0.1495948E-04 Eh
   gradient norm :     0.0008575 Eh/α   predicted    -0.1019661E-04 ( -31.84%)
   displ. norm   :     0.1776995 α      lambda       -0.1781122E-04
   maximum displ.:     0.1537045 α      in ANC's #2, #1, #6, ...

........................................................................
.............................. CYCLE   20 ..............................
........................................................................
   1    -34.5236668 -0.345237E+02  0.719E-02    3.12       0.0  T
   2    -34.5236671 -0.246487E-06  0.424E-02    3.12       1.0  T
   3    -34.5236671 -0.198666E-07  0.359E-03    3.12       5.7  T
   4    -34.5236671 -0.158173E-07  0.275E-03    3.12       7.4  T
   5    -34.5236672 -0.741585E-07  0.831E-04    3.12      24.6  T
   6    -34.5236672 -0.240970E-08  0.530E-04    3.12      38.5  T
     SCC iter.                  ...        0 min,  0.007 sec
     gradient                   ...        0 min,  0.015 sec
 * total energy  :   -34.0275453 Eh     change       -0.1979993E-04 Eh
   gradient norm :     0.0009597 Eh/α   predicted    -0.9031128E-05 ( -54.39%)
   displ. norm   :     0.3515015 α      lambda       -0.2504247E-04
   maximum displ.:     0.3110812 α      in ANC's #2, #1, #6, ...
 * RMSD in coord.:     0.5515558 α      energy gain  -0.4403283E-02 Eh

generating ANC from model Hessian ...
Using Lindh-Hessian (1995)
 Shifting diagonal of input Hessian by   4.060358950651348E-003
 Lowest  eigenvalues of input Hessian
   -0.000000   -0.000000    0.000000    0.000000    0.000000    0.000000
    0.005000    0.006187    0.007043    0.009570    0.010466    0.010766
    0.013256    0.015252    0.019760    0.022372    0.024469    0.040806
 Highest eigenvalues
    1.431081    1.657519    1.726523    1.849070    1.854607    1.930300
 

........................................................................
.............................. CYCLE   21 ..............................
........................................................................
   1    -34.5222146 -0.345222E+02  0.144E-01    3.12       0.0  T
   2    -34.5222156 -0.100076E-05  0.850E-02    3.12       1.0  T
   3    -34.5222154  0.145579E-06  0.837E-03    3.12       2.4  T
   4    -34.5222159 -0.460370E-06  0.353E-03    3.12       5.8  T
   5    -34.5222160 -0.554080E-07  0.181E-03    3.12      11.3  T
   6    -34.5222160 -0.171678E-07  0.848E-04    3.12      24.1  T
   7    -34.5222160 -0.817884E-09  0.390E-04    3.12      52.4  T
     SCC iter.                  ...        0 min,  0.008 sec
     gradient                   ...        0 min,  0.015 sec
 * total energy  :   -34.0275589 Eh     change       -0.1355450E-04 Eh
   gradient norm :     0.0022902 Eh/α   predicted     0.0000000E+00 (-100.00%)
   displ. norm   :     0.0190627 α      lambda       -0.1811365E-04
   maximum displ.:     0.0145452 α      in ANC's #6, #5, #22, ...

........................................................................
.............................. CYCLE   22 ..............................
........................................................................
   1    -34.5230185 -0.345230E+02  0.108E-02    3.12       0.0  T
   2    -34.5230186 -0.732429E-07  0.595E-03    3.12       3.4  T
   3    -34.5230186  0.663059E-08  0.142E-03    3.12      14.4  T
   4    -34.5230186 -0.739634E-08  0.769E-04    3.12      26.6  T
   5    -34.5230186 -0.615724E-08  0.289E-04    3.12      70.5  T
     SCC iter.                  ...        0 min,  0.006 sec
     gradient                   ...        0 min,  0.015 sec
 * total energy  :   -34.0275698 Eh     change       -0.1096006E-04 Eh
   gradient norm :     0.0006488 Eh/α   predicted    -0.9060914E-05 ( -17.33%)
   displ. norm   :     0.0285460 α      lambda        0.6805357E-05
   maximum displ.:     0.0218173 α      in ANC's #6, #5, #22, ...

........................................................................
.............................. CYCLE   23 ..............................
........................................................................
   1    -34.5241919 -0.345242E+02  0.162E-02    3.12       0.0  T
   2    -34.5241921 -0.161812E-06  0.894E-03    3.12       2.3  T
   3    -34.5241921  0.745938E-08  0.200E-03    3.12      10.2  T
   4    -34.5241921 -0.135515E-07  0.998E-04    3.12      20.4  T
   5    -34.5241921 -0.838906E-08  0.411E-04    3.12      49.6  T
     SCC iter.                  ...        0 min,  0.006 sec
     gradient                   ...        0 min,  0.015 sec
 * total energy  :   -34.0275596 Eh     change        0.1027370E-04 Eh
   gradient norm :     0.0023758 Eh/α   predicted     0.3403773E-05 ( -66.87%)
   displ. norm   :     0.0102605 α      lambda       -0.1676525E-04
   maximum displ.:     0.0048768 α      in ANC's #22, #12, #6, ...

........................................................................
.............................. CYCLE   24 ..............................
........................................................................
   1    -34.5235881 -0.345236E+02  0.993E-03    3.12       0.0  T
   2    -34.5235881 -0.618645E-07  0.504E-03    3.12       4.1  T
   3    -34.5235881  0.114628E-07  0.145E-03    3.12      14.1  T
   4    -34.5235881 -0.173368E-07  0.758E-04    3.12      26.9  T
   5    -34.5235882 -0.416208E-08  0.277E-04    3.12      73.6  T
     SCC iter.                  ...        0 min,  0.006 sec
     gradient                   ...        0 min,  0.015 sec
 * total energy  :   -34.0275710 Eh     change       -0.1140126E-04 Eh
   gradient norm :     0.0009671 Eh/α   predicted    -0.8385454E-05 ( -26.45%)
   displ. norm   :     0.0147553 α      lambda       -0.4425771E-05
   maximum displ.:     0.0061315 α      in ANC's #6, #7, #8, ...

........................................................................
.............................. CYCLE   25 ..............................
........................................................................
   1    -34.5229152 -0.345229E+02  0.821E-03    3.12       0.0  T
   2    -34.5229152 -0.386091E-07  0.471E-03    3.12       4.3  T
   3    -34.5229152  0.321574E-07  0.161E-03    3.12      12.6  T
   4    -34.5229152 -0.362410E-07  0.507E-04    3.12      40.3  T
   5    -34.5229152 -0.298851E-08  0.161E-04    3.12     126.7  T
     SCC iter.                  ...        0 min,  0.006 sec
     gradient                   ...        0 min,  0.015 sec
 * total energy  :   -34.0275732 Eh     change       -0.2262922E-05 Eh
   gradient norm :     0.0004913 Eh/α   predicted    -0.2219731E-05 (  -1.91%)
   displ. norm   :     0.0147626 α      lambda        0.8734831E-05
   maximum displ.:     0.0061311 α      in ANC's #6, #7, #8, ...

   *** GEOMETRY OPTIMIZATION CONVERGED AFTER 25 ITERATIONS ***

------------------------------------------------------------------------
 total energy gain   :        -0.0044312 Eh       -2.7806 kcal/mol
 total RMSD          :         0.5536716 a0        0.2930 Å
 total power (kW/mol):        -0.4653633 (step)  -14.6347 (real)
------------------------------------------------------------------------

 ANCopt (total)                0 d,  0 h,  0 min,  0.795 sec
 optimizer setup                ...        0 min,  0.000 sec (  0.018%)
 model hessian                  ...        0 min,  0.009 sec (  1.085%)
 ANC generation                 ...        0 min,  0.001 sec (  0.164%)
 coordinate transformation      ...        0 min,  0.000 sec (  0.051%)
 single point calculation       ...        0 min,  0.777 sec ( 97.696%)
 optimization log               ...        0 min,  0.002 sec (  0.307%)
 hessian update                 ...        0 min,  0.000 sec (  0.041%)
 rational function              ...        0 min,  0.004 sec (  0.445%)

================
 final structure:
================
$coord
   -3.84544149833088   -2.15466353285530   -0.03707287690008      C 
   -3.84852919749133    1.12207075188033   -0.07034195136427      S 
   -0.58195664088127    1.14452616639349   -0.01108467483390      C 
    0.36689625724182   -1.29489094913996    0.02821729770499      C 
   -1.50489288016680   -3.21046303452282    0.01987928334914      C 
   -0.94153469356242   -5.97822936102295    0.01316962778598      C 
    0.12361443805319   -6.80655940530682   -2.54232610788264      C 
    3.63300205171124   -1.27248923339357    0.10851769477451      S 
    3.62969564292658    2.00427821061472    0.09082515864193      C 
    1.28925175769550    3.06018205695536    0.03117936959625      C 
    0.72900068739811    5.82747095702949   -0.04411367973594      C 
   -0.21873205133899    6.61628595691519   -2.65755960891408      C 
   -5.62900306950738   -3.11646251130711   -0.05476102102789      H 
   -2.66677125145209   -7.03026947751575    0.42835858365575      H 
    0.44588607463849   -6.38224693676968    1.48953688639681      H 
   -1.24024855767696   -6.44403625742985   -4.03783152124700      H 
    0.55276259969430   -8.81579035411359   -2.51595310310906      H 
    1.84973565808335   -5.77392433972149   -2.96592204122915      H 
    5.41269586081588    2.96627292687139    0.13439657532809      H 
    2.43448130001743    6.88530620025121    0.43230557272547      H 
   -0.72320708093757    6.25517676166945    1.36124016407917      H 
    1.20493750224212    6.21602607377078   -4.08554859974226      H 
   -0.63261930189439    8.62836590268199   -2.68737171994420      H 
   -1.93270767828300    5.58859726271984   -3.13597987006957      H 
$end
           -------------------------------------------------
          |                Final Singlepoint                |
           -------------------------------------------------

          ...................................................
          :                      SETUP                      :
          :.................................................:
          :  # basis functions                  72          :
          :  # atomic orbitals                  70          :
          :  # shells                           38          :
          :  # electrons                        64          :
          :  max. iterations                   250          :
          :  Hamiltonian                  GFN2-xTB          :
          :  restarted?                      false          :
          :  GBSA solvation                  false          :
          :  PC potential                    false          :
          :  electronic temp.          300.0000000     K    :
          :  accuracy                    1.0000000          :
          :  -> integral cutoff          0.2500000E+02      :
          :  -> integral neglect         0.1000000E-07      :
          :  -> SCF convergence          0.1000000E-05 Eh   :
          :  -> wf. convergence          0.1000000E-03 e    :
          :  Broyden damping             0.4000000          :
          ...................................................

 iter      E             dE          RMSdq      gap      omega  full diag
   1    -34.5229152 -0.345229E+02  0.779E-05    3.12       0.0  T
   2    -34.5229152 -0.119726E-10  0.443E-05    3.12     461.1  T
   3    -34.5229152 -0.212452E-10  0.280E-05    3.12     727.8  T

   *** convergence criteria satisfied after 3 iterations ***

         #    Occupation            Energy/Eh            Energy/eV
      -------------------------------------------------------------
         1        2.0000           -0.7272677             -19.7900
       ...           ...                  ...                  ...
        26        2.0000           -0.4407304             -11.9929
        27        2.0000           -0.4404043             -11.9840
        28        2.0000           -0.4386462             -11.9362
        29        2.0000           -0.4343226             -11.8185
        30        2.0000           -0.4071947             -11.0803
        31        2.0000           -0.3809110             -10.3651
        32        2.0000           -0.3693821             -10.0514 (HOMO)
        33                         -0.2546019              -6.9281 (LUMO)
        34                         -0.2159777              -5.8771
        35                         -0.1966188              -5.3503
        36                         -0.1893502              -5.1525
        37                         -0.1661941              -4.5224
       ...                                ...                  ...
        70                          0.6996734              19.0391
      -------------------------------------------------------------
                  HL-Gap            0.1147802 Eh            3.1233 eV
             Fermi-level           -0.3119920 Eh           -8.4897 eV

 SCC (total)                   0 d,  0 h,  0 min,  0.029 sec
 SCC setup                      ...        0 min,  0.000 sec (  0.690%)
 Dispersion                     ...        0 min,  0.000 sec (  0.686%)
 integral evaluation            ...        0 min,  0.009 sec ( 31.742%)
 zeroth order Hamiltonian       ...        0 min,  0.000 sec (  0.568%)
 iterations                     ...        0 min,  0.004 sec ( 14.541%)
 molecular gradient             ...        0 min,  0.015 sec ( 50.458%)
 printout                       ...        0 min,  0.000 sec (  1.147%)

         :::::::::::::::::::::::::::::::::::::::::::::::::::::
         ::                     SUMMARY                     ::
         :::::::::::::::::::::::::::::::::::::::::::::::::::::
         :: total energy             -34.027573200464 Eh    ::
         :: gradient norm              0.000490994716 Eh/a0 ::
         :: HOMO-LUMO gap              3.123328285836 eV    ::
         ::.................................................::
         :: SCC energy               -34.522915245651 Eh    ::
         :: -> isotropic ES            0.003004862380 Eh    ::
         :: -> anisotropic ES          0.002843581582 Eh    ::
         :: -> anisotropic XC          0.015709607323 Eh    ::
         :: -> dispersion             -0.025589923600 Eh    ::
         :: repulsion energy           0.495219144117 Eh    ::
         :: add. restraining           0.000000000000 Eh    ::
         :::::::::::::::::::::::::::::::::::::::::::::::::::::

           -------------------------------------------------
          |                Property Printout                |
           -------------------------------------------------

    * Orbital Energies and Occupations

         #    Occupation            Energy/Eh            Energy/eV
      -------------------------------------------------------------
         1        2.0000           -0.7272677             -19.7900
       ...           ...                  ...                  ...
        20        2.0000           -0.4733517             -12.8806
        21        2.0000           -0.4715733             -12.8322
        22        2.0000           -0.4653402             -12.6626
        23        2.0000           -0.4589036             -12.4874
        24        2.0000           -0.4499864             -12.2448
        25        2.0000           -0.4436298             -12.0718
        26        2.0000           -0.4407304             -11.9929
        27        2.0000           -0.4404043             -11.9840
        28        2.0000           -0.4386462             -11.9362
        29        2.0000           -0.4343226             -11.8185
        30        2.0000           -0.4071947             -11.0803
        31        2.0000           -0.3809110             -10.3651
        32        2.0000           -0.3693821             -10.0514 (HOMO)
        33                         -0.2546019              -6.9281 (LUMO)
        34                         -0.2159777              -5.8771
        35                         -0.1966188              -5.3503
        36                         -0.1893502              -5.1525
        37                         -0.1661941              -4.5224
        38                         -0.1293527              -3.5199
        39                         -0.1099370              -2.9915
        40                         -0.0175596              -0.4778
        41                          0.0104958               0.2856
        42                          0.0221848               0.6037
        43                          0.0261486               0.7115
       ...                                ...                  ...
        70                          0.6996734              19.0391
      -------------------------------------------------------------
                  HL-Gap            0.1147802 Eh            3.1233 eV
             Fermi-level           -0.3119920 Eh           -8.4897 eV

     #   Z        covCN         q      C6AA      α(0)
     1   6 C      2.961    -0.031    28.781     8.799
     2  16 S      2.252    -0.060   143.553    20.165
     3   6 C      3.209     0.008    27.215     8.493
     4   6 C      3.210     0.008    27.215     8.493
     5   6 C      3.108    -0.007    28.047     8.677
     6   6 C      3.804    -0.051    21.489     6.600
     7   6 C      3.754    -0.099    22.456     6.757
     8  16 S      2.252    -0.060   143.553    20.165
     9   6 C      2.961    -0.031    28.781     8.800
    10   6 C      3.108    -0.007    28.046     8.677
    11   6 C      3.804    -0.051    21.489     6.600
    12   6 C      3.754    -0.099    22.457     6.757
    13   1 H      0.926     0.041     2.431     2.438
    14   1 H      0.924     0.036     2.501     2.473
    15   1 H      0.924     0.045     2.385     2.415
    16   1 H      0.925     0.037     2.493     2.469
    17   1 H      0.925     0.038     2.471     2.458
    18   1 H      0.925     0.044     2.396     2.420
    19   1 H      0.926     0.041     2.431     2.438
    20   1 H      0.924     0.036     2.501     2.473
    21   1 H      0.924     0.045     2.385     2.415
    22   1 H      0.925     0.037     2.492     2.469
    23   1 H      0.925     0.038     2.471     2.458
    24   1 H      0.925     0.044     2.396     2.420

 Mol. C6AA /au·bohr⁶  :       8663.814941
 Mol. C8AA /au·bohr⁸  :     253704.402968
 Mol. α(0) /au        :        148.331655


Wiberg/Mayer (AO) data.
largest (>0.10) Wiberg bond orders for each atom
          total WBO             WBO to atom ...
     1  C   3.943        C    5 1.612    S    2 1.152    H   13 0.970
     2  S   2.567        C    1 1.152    C    3 1.116
     3  C   3.945        C    4 1.404    C   10 1.218    S    2 1.116
     4  C   3.945        C    3 1.404    C    5 1.218    S    8 1.116
     5  C   3.985        C    1 1.612    C    4 1.218    C    6 1.009
     6  C   3.997        C    5 1.009    C    7 1.002    H   14 0.977    H   15 0.967
     7  C   3.995        C    6 1.002    H   16 0.989    H   18 0.986    H   17 0.986
     8  S   2.567        C    9 1.152    C    4 1.116
     9  C   3.943        C   10 1.612    S    8 1.152    H   19 0.970
    10  C   3.985        C    9 1.612    C    3 1.218    C   11 1.009
    11  C   3.997        C   10 1.009    C   12 1.002    H   20 0.977    H   21 0.967
    12  C   3.995        C   11 1.002    H   22 0.989    H   24 0.987    H   23 0.986
    13  H   0.998        C    1 0.970
    14  H   0.998        C    6 0.977
    15  H   0.998        C    6 0.967
    16  H   0.999        C    7 0.989
    17  H   0.997        C    7 0.986
    18  H   0.998        C    7 0.986
    19  H   0.998        C    9 0.970
    20  H   0.998        C   11 0.977
    21  H   0.998        C   11 0.967
    22  H   0.999        C   12 0.989
    23  H   0.997        C   12 0.986
    24  H   0.998        C   12 0.987

molecular dipole:
                 x           y           z       tot (Debye)
 q only:        0.002      -0.001      -0.090
   full:        0.002      -0.001      -0.059       0.151
molecular quadrupole (traceless):
                xx          xy          yy          xz          yz          zz
 q only:       -3.089       1.902       5.282      -0.021      -0.010      -2.193
  q+dip:       -2.086       6.112       5.530      -0.007       0.064      -3.444
   full:       -3.298       6.108       5.578      -0.059       0.073      -2.280

           -------------------------------------------------
          |                Geometry Summary                 |
           -------------------------------------------------

      molecular mass/u    :      196.3248000
   center of mass at/Å    :       -0.0520238      -0.0414203      -0.2045821
  moments of inertia/u·Å² :        0.4430046E+03   0.8672098E+03   0.1196324E+04
rotational constants/cm⁻¹ :        0.3805295E-01   0.1943893E-01   0.1409119E-01

 * 25 selected distances

     #   Z        #   Z                                     value/Å
     1   6 C      2  16 S                                 1.7340634 (max)
     2  16 S      3   6 C                                 1.7289211
     3   6 C      4   6 C                                 1.3852545
     1   6 C      5   6 C                                 1.3590817
     4   6 C      5   6 C                                 1.4172747
     5   6 C      6   6 C                                 1.4946750
     6   6 C      7   6 C                                 1.5292428
     4   6 C      8  16 S                                 1.7289118
     8  16 S      9   6 C                                 1.7340170
     3   6 C     10   6 C                                 1.4172612
     9   6 C     10   6 C                                 1.3590863
    10   6 C     11   6 C                                 1.4946273
    11   6 C     12   6 C                                 1.5291782
     1   6 C     13   1 H                                 1.0723464
     6   6 C     14   1 H                                 1.0916468
     6   6 C     15   1 H                                 1.0932125
     7   6 C     16   1 H                                 1.0881101
     7   6 C     17   1 H                                 1.0873109
     7   6 C     18   1 H                                 1.0877474
     9   6 C     19   1 H                                 1.0723411 (min)
    11   6 C     20   1 H                                 1.0915241
    11   6 C     21   1 H                                 1.0930885
    12   6 C     22   1 H                                 1.0878674
    12   6 C     23   1 H                                 1.0871544
    12   6 C     24   1 H                                 1.0874229

 * 3 distinct bonds (by element types)

   Z      Z             #   av. dist./Å        max./Å        min./Å
   1 H    6 C          12     1.0866477     1.0932125     1.0723411
   6 C    6 C           9     1.4428535     1.5292428     1.3590817
   6 C   16 S           4     1.7314783     1.7340634     1.7289118


optimized geometry written to: xtbopt.xyz


           -------------------------------------------------
          | TOTAL ENERGY              -34.027573200464 Eh   |
          | GRADIENT NORM               0.000490994716 Eh/α |
          | HOMO-LUMO GAP               3.123328285836 eV   |
           -------------------------------------------------

------------------------------------------------------------------------
 * finished run on 2021/05/19 at 11:00:40.419     
------------------------------------------------------------------------
 total:
 * wall-time:     0 d,  0 h,  0 min,  0.886 sec
 *  cpu-time:     0 d,  0 h,  0 min,  0.883 sec
 * ratio c/w:     0.997 speedup
 SCF:
 * wall-time:     0 d,  0 h,  0 min,  0.040 sec
 *  cpu-time:     0 d,  0 h,  0 min,  0.040 sec
 * ratio c/w:     0.998 speedup
 ANC optimizer:
 * wall-time:     0 d,  0 h,  0 min,  0.824 sec
 *  cpu-time:     0 d,  0 h,  0 min,  0.822 sec
 * ratio c/w:     0.998 speedup

