      -----------------------------------------------------------      
     |                   =====================                   |     
     |                           x T B                           |     
     |                   =====================                   |     
     |                         S. Grimme                         |     
     |          Mulliken Center for Theoretical Chemistry        |     
     |                    University of Bonn                     |     
     |                Version 6.2 RC2 (SAW190805)                |     
      -----------------------------------------------------------      

   This program is distributed in the hope that it will be useful,
   but WITHOUT ANY WARRANTY; without even the implied warranty of
   MERCHANTABILITY or FITNESS FOR A PARTICULAR PURPOSE.
   
   FOR NON-COMMERCIAL, ACADEMIA USE ONLY.
   
   Cite this work as:
   * S. Grimme, C. Bannwarth, P. Shushkov, J. Chem. Theory Comput., 2017,
     13, 1989-2009. DOI: 10.1021/acs.jctc.7b00118
   * C. Bannwarth, S. Ehlert and S. Grimme., J. Chem. Theory Comput., 2019,
     15, 1652-1671. DOI: 10.1021/acs.jctc.8b01176
   * P. Pracht, E. Caldeweyher, S. Ehlert, S. Grimme, ChemRxiv, 2019, preprint.
     DOI: 10.26434/chemrxiv.8326202.v1
   
   for DFT-D4:
   * E. Caldeweyher, C. Bannwarth and S. Grimme, J. Chem. Phys., 2017,
     147, 034112. DOI: 10.1063/1.4993215
   * E. Caldeweyher, S. Ehlert, A. Hansen, H. Neugebauer, S. Spicher,
     C. Bannwarth and S. Grimme, J. Chem. Phys., 2019, 150, 154122.
     DOI: 10.1063/1.5090222
   
   for sTDA-xTB:
   * S. Grimme and C. Bannwarth, J. Chem. Phys., 2016, 145, 054103.
     DOI: 10.1063/1.4959605
   
   in the mass-spec context:
   * V. Asgeirsson, C. Bauer and S. Grimme, Chem. Sci., 2017, 8, 4879.
     DOI: 10.1039/c7sc00601b
   
   for metadynamics refer to:
   * S. Grimme, J. Chem. Theory Comput., 2019, 155, 2847-2862
     DOI: 10.1021/acs.jctc.9b00143
   
   with help from (in alphabetical order)
   C. Bannwarth, F. Bohle, G. Brandenburg, E. Caldeweyher, M. Checinski,
   S. Dohm, S. Ehlert, S. Ehrlich, F. März, H. Neugebauer, J. Pisarek,
   P. Pracht, P. Shushkov, and S. Spicher.
   
 * started run on 2021/05/19 at 11:00:43.488     

           -------------------------------------------------
          |                Calculation Setup                |
           -------------------------------------------------

          program call               : /ihome/ghutchison/geoffh/xtb/xtb 1015.xyz -opt
          hostname                   : smp-n144
          coordinate file            : 1015.xyz
          omp threads                :                     1
          number of atoms            :                    17
          number of electrons        :                    58
          charge                     :                     0
          spin                       :                   0.0
          first test random number   :      0.10705168503308


########################################################################
# WARNING! Please study the warnings concerning your input carefully
#  - the use of '-opt' is discouraged, please use '--opt' next time
########################################################################

           ------------------------------------------------- 
          |                 G F N 2 - x T B                 |
          | Geometry, Frequencies, Noncovalent interactions |
          |            JCTC 2019 parametrisation            |
           ------------------------------------------------- 
             KAB for C  - Si     :                1.0500
             KAB for H  - Pd     :                0.9500
             k(s)              :                1.8500
             k(p)              :                2.2300
             k(d)              :                2.2300
             k(f)              :                2.0000
             kEN (H0ij)        :               -2.0000
             D4 a1             :                0.5200
             D4 a2             :                5.0000
             D4 s6             :                1.0000
             D4 s8             :                2.7000
             D4 s9             :                5.0000
             alphaj            :                2.0000

  Z AO/shell   Hii/eV     exponent
  1     Wed Apr 25 08:07:45 CEST 2018   EN: 2.200 GM2: 0.406  GM3: 0.0800  RAES: 1.40
     1s    -10.707211    1.230000
  6     Wed Apr 25 08:07:45 CEST 2018   EN: 2.550 GM2: 0.538  GM3: 0.1500  RAES: 3.00
     2s    -13.970922    2.096432
     2p    -10.063292    1.800000
  8     Wed Apr 25 08:07:45 CEST 2018   EN: 3.440 GM2: 0.452  GM3:-0.0517  RAES: 1.80
     2s    -20.229985    2.439742
     2p    -15.503117    2.137023
 16     Tue Apr 24 11:44:34 CEST 2018   EN: 2.580 GM2: 0.340  GM3:-0.0502  RAES: 3.10
     3s    -20.029654    1.981333
     3p    -11.377694    2.025643
     3d     -0.420282    1.702555

           ------------------------------------------------- 
          |        Self-Consistent Charge Iterations        |
           ------------------------------------------------- 

          ...................................................
          :                      SETUP                      :
          :.................................................:
          :  # basis functions                  68          :
          :  # atomic orbitals                  65          :
          :  # shells                           31          :
          :  # electrons                        58          :
          :  max. iterations                   250          :
          :  Hamiltonian                  GFN2-xTB          :
          :  restarted?                      false          :
          :  GBSA solvation                  false          :
          :  PC potential                    false          :
          :  electronic temp.          300.0000000     K    :
          :  accuracy                    1.0000000          :
          :  -> integral cutoff          0.2500000E+02      :
          :  -> integral neglect         0.1000000E-07      :
          :  -> SCF convergence          0.1000000E-05 Eh   :
          :  -> wf. convergence          0.1000000E-03 e    :
          :  Broyden damping             0.4000000          :
          ...................................................

 iter      E             dE          RMSdq      gap      omega  full diag
   1    -32.0809885 -0.320810E+02  0.548E+00    3.31       0.0  T
   2    -32.1220784 -0.410899E-01  0.292E+00    2.17       1.0  T
   3    -32.1191349  0.294351E-02  0.162E+00    2.40       1.0  T
   4    -32.1350848 -0.159499E-01  0.374E-01    2.01       1.0  T
   5    -32.1351070 -0.222318E-04  0.132E-01    2.07       1.0  T
   6    -32.1351489 -0.419211E-04  0.346E-02    2.06       1.0  T
   7    -32.1351507 -0.177887E-05  0.171E-02    2.05       1.4  T
   8    -32.1351507  0.694475E-07  0.117E-02    2.05       2.1  T
   9    -32.1351517 -0.105598E-05  0.341E-03    2.05       7.1  T
  10    -32.1351518 -0.606418E-07  0.176E-03    2.05      13.8  T
  11    -32.1351518  0.937973E-09  0.959E-04    2.05      25.3  T
  12    -32.1351518 -0.789733E-08  0.491E-04    2.05      49.4  T

   *** convergence criteria satisfied after 12 iterations ***

         #    Occupation            Energy/Eh            Energy/eV
      -------------------------------------------------------------
         1        2.0000           -0.7535655             -20.5056
       ...           ...                  ...                  ...
        23        2.0000           -0.4809246             -13.0866
        24        2.0000           -0.4628374             -12.5944
        25        2.0000           -0.4314392             -11.7401
        26        2.0000           -0.4254641             -11.5775
        27        2.0000           -0.4191787             -11.4064
        28        2.0000           -0.3817689             -10.3885
        29        2.0000           -0.3774670             -10.2714 (HOMO)
        30                         -0.3020557              -8.2194 (LUMO)
        31                         -0.2737114              -7.4481
        32                         -0.2440693              -6.6415
        33                         -0.2290564              -6.2329
        34                         -0.2037786              -5.5451
       ...                                ...                  ...
        65                          0.6550960              17.8261
      -------------------------------------------------------------
                  HL-Gap            0.0754113 Eh            2.0520 eV
             Fermi-level           -0.3397613 Eh           -9.2454 eV

 SCC (total)                   0 d,  0 h,  0 min,  0.036 sec
 SCC setup                      ...        0 min,  0.000 sec (  0.771%)
 Dispersion                     ...        0 min,  0.000 sec (  0.574%)
 integral evaluation            ...        0 min,  0.009 sec ( 24.849%)
 zeroth order Hamiltonian       ...        0 min,  0.000 sec (  0.577%)
 iterations                     ...        0 min,  0.013 sec ( 35.847%)
 molecular gradient             ...        0 min,  0.013 sec ( 36.317%)
 printout                       ...        0 min,  0.000 sec (  0.915%)

         :::::::::::::::::::::::::::::::::::::::::::::::::::::
         ::                     SUMMARY                     ::
         :::::::::::::::::::::::::::::::::::::::::::::::::::::
         :: total energy             -31.806310554207 Eh    ::
         :: gradient norm              0.075896213656 Eh/a0 ::
         :: HOMO-LUMO gap              2.052046627673 eV    ::
         ::.................................................::
         :: SCC energy               -32.135151774149 Eh    ::
         :: -> isotropic ES            0.027518955914 Eh    ::
         :: -> anisotropic ES          0.001663374573 Eh    ::
         :: -> anisotropic XC          0.014377320950 Eh    ::
         :: -> dispersion             -0.022176306434 Eh    ::
         :: repulsion energy           0.328712951872 Eh    ::
         :: add. restraining           0.000000000000 Eh    ::
         :::::::::::::::::::::::::::::::::::::::::::::::::::::

      ----------------------------------------------------------- 
     |                   =====================                   |
     |                        A N C O P T                        |
     |                   =====================                   |
     |               Approximate Normal Coordinate               |
     |                Rational Function Optimizer                |
      ----------------------------------------------------------- 

          ...................................................
          :                      SETUP                      :
          :.................................................:
          :   optimization level            normal          :
          :   max. optcycles                   200          :
          :   ANC micro-cycles                  20          :
          :   degrees of freedom                45          :
          :.................................................:
          :   RF solver                   davidson          :
          :   input Hessian                  false          :
          :   write xtbopt.log                true          :
          :   linear?                        false          :
          :   energy convergence         0.5000000E-05 Eh   :
          :   grad. convergence          0.1000000E-02 Eh/α :
          :   maximium RF displ.         2.0000000          :
          :   Hlow (freq-cutoff)         0.5000000E-02      :
          :   Hmax (freq-cutoff)         5.0000000          :
          :   S6 in model hess.         20.0000000          :
          ...................................................

generating ANC from model Hessian ...
Using Lindh-Hessian (1995)
 Shifting diagonal of input Hessian by   1.467924960169034E-003
 Lowest  eigenvalues of input Hessian
   -0.000000    0.000000    0.000000    0.000000    0.000000    0.000000
    0.005000    0.005110    0.009883    0.016565    0.020464    0.023107
    0.023774    0.034399    0.037584    0.045099    0.059362    0.063016
 Highest eigenvalues
    1.357376    1.487131    1.650310    1.740537    1.813595    2.013004
 

........................................................................
.............................. CYCLE    1 ..............................
........................................................................
   1    -32.1351518 -0.321352E+02  0.158E-04    2.05       0.0  T
   2    -32.1351518 -0.141696E-09  0.906E-05    2.05     267.8  T
   3    -32.1351518 -0.370761E-10  0.579E-05    2.05     418.9  T
     SCC iter.                  ...        0 min,  0.004 sec
     gradient                   ...        0 min,  0.013 sec
 * total energy  :   -31.8063105 Eh     change        0.1740807E-07 Eh
   gradient norm :     0.0758957 Eh/α   predicted     0.0000000E+00 (-100.00%)
   displ. norm   :     0.2492523 α      lambda       -0.6667132E-02
   maximum displ.:     0.1373846 α      in ANC's #8, #2, #7, ...

........................................................................
.............................. CYCLE    2 ..............................
........................................................................
   1    -32.1536307 -0.321536E+02  0.742E-01    2.31       0.0  T
   2    -32.1538379 -0.207256E-03  0.341E-01    2.22       1.0  T
   3    -32.1538397 -0.176758E-05  0.676E-02    2.21       1.0  T
   4    -32.1538657 -0.259869E-04  0.378E-02    2.21       1.0  T
   5    -32.1538687 -0.299013E-05  0.185E-02    2.21       1.3  T
   6    -32.1538714 -0.275993E-05  0.625E-03    2.21       3.9  T
   7    -32.1538716 -0.169059E-06  0.201E-03    2.21      12.1  T
   8    -32.1538716 -0.131322E-07  0.129E-03    2.21      18.7  T
     SCC iter.                  ...        0 min,  0.008 sec
     gradient                   ...        0 min,  0.012 sec
 * total energy  :   -31.8104365 Eh     change       -0.4125946E-02 Eh
   gradient norm :     0.0247592 Eh/α   predicted    -0.3540670E-02 ( -14.19%)
   displ. norm   :     0.1709867 α      lambda       -0.1555604E-02
   maximum displ.:     0.1268095 α      in ANC's #2, #14, #9, ...

........................................................................
.............................. CYCLE    3 ..............................
........................................................................
   1    -32.1612631 -0.321613E+02  0.492E-01    2.29       0.0  T
   2    -32.1613441 -0.810356E-04  0.231E-01    2.26       1.0  T
   3    -32.1613218  0.222506E-04  0.658E-02    2.26       1.0  T
   4    -32.1613624 -0.405101E-04  0.314E-02    2.26       1.0  T
   5    -32.1613656 -0.321044E-05  0.164E-02    2.26       1.5  T
   6    -32.1613672 -0.163902E-05  0.313E-03    2.26       7.8  T
   7    -32.1613672 -0.173912E-07  0.159E-03    2.26      15.3  T
     SCC iter.                  ...        0 min,  0.007 sec
     gradient                   ...        0 min,  0.012 sec
 * total energy  :   -31.8113515 Eh     change       -0.9149982E-03 Eh
   gradient norm :     0.0114610 Eh/α   predicted    -0.8005413E-03 ( -12.51%)
   displ. norm   :     0.2039551 α      lambda       -0.6193864E-03
   maximum displ.:     0.1717742 α      in ANC's #2, #7, #9, ...

........................................................................
.............................. CYCLE    4 ..............................
........................................................................
   1    -32.1597213 -0.321597E+02  0.338E-01    2.22       0.0  T
   2    -32.1597517 -0.304125E-04  0.171E-01    2.24       1.0  T
   3    -32.1597314  0.203818E-04  0.580E-02    2.23       1.0  T
   4    -32.1597622 -0.307907E-04  0.288E-02    2.24       1.0  T
   5    -32.1597652 -0.307800E-05  0.120E-02    2.24       2.0  T
   6    -32.1597661 -0.875208E-06  0.322E-03    2.24       7.5  T
   7    -32.1597661 -0.351261E-07  0.156E-03    2.24      15.5  T
   8    -32.1597661 -0.408334E-08  0.730E-04    2.24      33.2  T
     SCC iter.                  ...        0 min,  0.008 sec
     gradient                   ...        0 min,  0.012 sec
 * total energy  :   -31.8117674 Eh     change       -0.4159203E-03 Eh
   gradient norm :     0.0062265 Eh/α   predicted    -0.3225730E-03 ( -22.44%)
   displ. norm   :     0.1731732 α      lambda       -0.2874649E-03
   maximum displ.:     0.1461513 α      in ANC's #2, #4, #7, ...

........................................................................
.............................. CYCLE    5 ..............................
........................................................................
   1    -32.1581305 -0.321581E+02  0.227E-01    2.21       0.0  T
   2    -32.1581444 -0.139091E-04  0.119E-01    2.23       1.0  T
   3    -32.1581427  0.169785E-05  0.335E-02    2.23       1.0  T
   4    -32.1581464 -0.364173E-05  0.190E-02    2.23       1.3  T
   5    -32.1581486 -0.220933E-05  0.758E-03    2.23       3.2  T
   6    -32.1581490 -0.431456E-06  0.242E-03    2.23      10.0  T
   7    -32.1581490 -0.169697E-07  0.117E-03    2.23      20.8  T
     SCC iter.                  ...        0 min,  0.007 sec
     gradient                   ...        0 min,  0.012 sec
 * total energy  :   -31.8119595 Eh     change       -0.1921373E-03 Eh
   gradient norm :     0.0088706 Eh/α   predicted    -0.1480447E-03 ( -22.95%)
   displ. norm   :     0.1138014 α      lambda       -0.1499620E-03
   maximum displ.:     0.0988059 α      in ANC's #2, #4, #8, ...

........................................................................
.............................. CYCLE    6 ..............................
........................................................................
   1    -32.1582229 -0.321582E+02  0.142E-01    2.23       0.0  T
   2    -32.1582281 -0.526619E-05  0.758E-02    2.23       1.0  T
   3    -32.1582285 -0.385168E-06  0.193E-02    2.24       1.3  T
   4    -32.1582293 -0.784544E-06  0.104E-02    2.23       2.3  T
   5    -32.1582295 -0.215298E-06  0.470E-03    2.23       5.2  T
   6    -32.1582298 -0.281041E-06  0.156E-03    2.23      15.5  T
   7    -32.1582298 -0.685964E-08  0.738E-04    2.23      32.9  T
     SCC iter.                  ...        0 min,  0.007 sec
     gradient                   ...        0 min,  0.012 sec
 * total energy  :   -31.8120712 Eh     change       -0.1117017E-03 Eh
   gradient norm :     0.0079213 Eh/α   predicted    -0.7595368E-04 ( -32.00%)
   displ. norm   :     0.1288009 α      lambda       -0.1230520E-03
   maximum displ.:     0.1089179 α      in ANC's #2, #4, #7, ...

........................................................................
.............................. CYCLE    7 ..............................
........................................................................
   1    -32.1591581 -0.321592E+02  0.150E-01    2.24       0.0  T
   2    -32.1591633 -0.517488E-05  0.802E-02    2.24       1.0  T
   3    -32.1591629  0.363390E-06  0.214E-02    2.24       1.1  T
   4    -32.1591646 -0.167500E-05  0.121E-02    2.24       2.0  T
   5    -32.1591651 -0.446065E-06  0.518E-03    2.24       4.7  T
   6    -32.1591654 -0.335125E-06  0.152E-03    2.24      15.9  T
   7    -32.1591654 -0.233933E-08  0.632E-04    2.24      38.4  T
     SCC iter.                  ...        0 min,  0.007 sec
     gradient                   ...        0 min,  0.012 sec
 * total energy  :   -31.8121548 Eh     change       -0.8359009E-04 Eh
   gradient norm :     0.0055410 Eh/α   predicted    -0.6254898E-04 ( -25.17%)
   displ. norm   :     0.0822409 α      lambda       -0.4940033E-04
   maximum displ.:     0.0676829 α      in ANC's #2, #4, #7, ...

........................................................................
.............................. CYCLE    8 ..............................
........................................................................
   1    -32.1597711 -0.321598E+02  0.988E-02    2.24       0.0  T
   2    -32.1597732 -0.207607E-05  0.543E-02    2.24       1.0  T
   3    -32.1597737 -0.556050E-06  0.126E-02    2.24       1.9  T
   4    -32.1597739 -0.223432E-06  0.639E-03    2.24       3.8  T
   5    -32.1597740 -0.733242E-07  0.214E-03    2.24      11.3  T
   6    -32.1597741 -0.471599E-07  0.104E-03    2.24      23.3  T
     SCC iter.                  ...        0 min,  0.006 sec
     gradient                   ...        0 min,  0.012 sec
 * total energy  :   -31.8121863 Eh     change       -0.3150266E-04 Eh
   gradient norm :     0.0037638 Eh/α   predicted    -0.2486872E-04 ( -21.06%)
   displ. norm   :     0.0312705 α      lambda       -0.1973034E-04
   maximum displ.:     0.0177803 α      in ANC's #2, #1, #3, ...

........................................................................
.............................. CYCLE    9 ..............................
........................................................................
   1    -32.1606575 -0.321607E+02  0.441E-02    2.26       0.0  T
   2    -32.1606589 -0.131643E-05  0.218E-02    2.26       1.1  T
   3    -32.1606588  0.862059E-07  0.666E-03    2.26       3.6  T
   4    -32.1606590 -0.184820E-06  0.366E-03    2.26       6.6  T
   5    -32.1606590 -0.682217E-07  0.163E-03    2.26      14.8  T
   6    -32.1606590 -0.164663E-07  0.656E-04    2.26      37.0  T
   7    -32.1606591 -0.172500E-08  0.240E-04    2.26     101.1  T
     SCC iter.                  ...        0 min,  0.007 sec
     gradient                   ...        0 min,  0.013 sec
 * total energy  :   -31.8121944 Eh     change       -0.8034788E-05 Eh
   gradient norm :     0.0022930 Eh/α   predicted    -0.9872916E-05 (  22.88%)
   displ. norm   :     0.0278932 α      lambda       -0.1034289E-04
   maximum displ.:     0.0135171 α      in ANC's #2, #1, #7, ...

........................................................................
.............................. CYCLE   10 ..............................
........................................................................
   1    -32.1602462 -0.321602E+02  0.432E-02    2.25       0.0  T
   2    -32.1602468 -0.546697E-06  0.227E-02    2.25       1.1  T
   3    -32.1602465  0.309606E-06  0.747E-03    2.25       3.2  T
   4    -32.1602469 -0.474262E-06  0.404E-03    2.25       6.0  T
   5    -32.1602470 -0.698151E-07  0.118E-03    2.25      20.6  T
   6    -32.1602470 -0.886897E-08  0.469E-04    2.25      51.7  T
   7    -32.1602470 -0.100127E-08  0.197E-04    2.25     123.4  T
     SCC iter.                  ...        0 min,  0.007 sec
     gradient                   ...        0 min,  0.013 sec
 * total energy  :   -31.8121990 Eh     change       -0.4642483E-05 Eh
   gradient norm :     0.0006576 Eh/α   predicted    -0.5175712E-05 (  11.49%)
   displ. norm   :     0.0255463 α      lambda       -0.2752210E-05
   maximum displ.:     0.0201250 α      in ANC's #2, #1, #3, ...

   *** GEOMETRY OPTIMIZATION CONVERGED AFTER 10 ITERATIONS ***

------------------------------------------------------------------------
 total energy gain   :        -0.0058885 Eh       -3.6951 kcal/mol
 total RMSD          :         0.2451797 a0        0.1297 Å
 total power (kW/mol):        -1.5460140 (step)  -52.6959 (real)
------------------------------------------------------------------------

 ANCopt (total)                0 d,  0 h,  0 min,  0.293 sec
 optimizer setup                ...        0 min,  0.000 sec (  0.048%)
 model hessian                  ...        0 min,  0.003 sec (  1.051%)
 ANC generation                 ...        0 min,  0.000 sec (  0.166%)
 coordinate transformation      ...        0 min,  0.000 sec (  0.045%)
 single point calculation       ...        0 min,  0.286 sec ( 97.519%)
 optimization log               ...        0 min,  0.001 sec (  0.277%)
 hessian update                 ...        0 min,  0.000 sec (  0.038%)
 rational function              ...        0 min,  0.002 sec (  0.632%)

================
 final structure:
================
$coord
   -3.35350510055378    2.21296619309470    0.48994462491316      C 
   -5.27031578434664   -0.15950926302685    1.59864254539262      S 
   -3.20389486686928   -2.43071571384301    0.54764150139407      C 
   -1.16489917194395   -1.40354037229530   -0.62165270811586      C 
   -1.25263783716086    1.29011017343367   -0.65586526975915      C 
    1.07865271108414    3.15998003405255   -2.13491027849805      S 
    3.78491133163823    2.57110289227905   -0.00839699572757      C 
    3.43350600377480    0.11656691190823    1.38244955210751      C 
    2.66449858573697    0.05776607890456    3.52444378617226      O 
    3.99587130023921   -2.26194171717405   -0.06926643121753      C 
    1.27078733418683   -3.16244485252487   -2.06419065347967      S 
   -3.88902768517910    4.15166607992861    0.71592627018648      H 
   -3.61460276338069   -4.39356219814004    0.82035717139770      H 
    3.85940438209885    4.13069782846636    1.33685529164387      H 
    5.44642935292197    2.56427595976433   -1.21950354891441      H 
    4.31479595190547   -3.81725974723141    1.24401621329629      H 
    5.58332398485450   -2.04899818816213   -1.35861838782723      H 
$end
           -------------------------------------------------
          |                Final Singlepoint                |
           -------------------------------------------------

          ...................................................
          :                      SETUP                      :
          :.................................................:
          :  # basis functions                  68          :
          :  # atomic orbitals                  65          :
          :  # shells                           31          :
          :  # electrons                        58          :
          :  max. iterations                   250          :
          :  Hamiltonian                  GFN2-xTB          :
          :  restarted?                      false          :
          :  GBSA solvation                  false          :
          :  PC potential                    false          :
          :  electronic temp.          300.0000000     K    :
          :  accuracy                    1.0000000          :
          :  -> integral cutoff          0.2500000E+02      :
          :  -> integral neglect         0.1000000E-07      :
          :  -> SCF convergence          0.1000000E-05 Eh   :
          :  -> wf. convergence          0.1000000E-03 e    :
          :  Broyden damping             0.4000000          :
          ...................................................

 iter      E             dE          RMSdq      gap      omega  full diag
   1    -32.1602470 -0.321602E+02  0.716E-05    2.25       0.0  T
   2    -32.1602470 -0.129106E-10  0.458E-05    2.25     529.0  T
   3    -32.1602470 -0.215508E-10  0.246E-05    2.25     986.5  T

   *** convergence criteria satisfied after 3 iterations ***

         #    Occupation            Energy/Eh            Energy/eV
      -------------------------------------------------------------
         1        2.0000           -0.7524359             -20.4748
       ...           ...                  ...                  ...
        23        2.0000           -0.4796139             -13.0510
        24        2.0000           -0.4623225             -12.5804
        25        2.0000           -0.4299102             -11.6985
        26        2.0000           -0.4219564             -11.4820
        27        2.0000           -0.4188854             -11.3985
        28        2.0000           -0.3805197             -10.3545
        29        2.0000           -0.3790361             -10.3141 (HOMO)
        30                         -0.2963265              -8.0635 (LUMO)
        31                         -0.2713826              -7.3847
        32                         -0.2455983              -6.6831
        33                         -0.2279264              -6.2022
        34                         -0.2037680              -5.5448
       ...                                ...                  ...
        65                          0.6721521              18.2902
      -------------------------------------------------------------
                  HL-Gap            0.0827096 Eh            2.2506 eV
             Fermi-level           -0.3376813 Eh           -9.1888 eV

 SCC (total)                   0 d,  0 h,  0 min,  0.026 sec
 SCC setup                      ...        0 min,  0.000 sec (  0.601%)
 Dispersion                     ...        0 min,  0.000 sec (  0.429%)
 integral evaluation            ...        0 min,  0.009 sec ( 33.315%)
 zeroth order Hamiltonian       ...        0 min,  0.000 sec (  0.560%)
 iterations                     ...        0 min,  0.004 sec ( 13.736%)
 molecular gradient             ...        0 min,  0.013 sec ( 50.004%)
 printout                       ...        0 min,  0.000 sec (  1.164%)

         :::::::::::::::::::::::::::::::::::::::::::::::::::::
         ::                     SUMMARY                     ::
         :::::::::::::::::::::::::::::::::::::::::::::::::::::
         :: total energy             -31.812199011690 Eh    ::
         :: gradient norm              0.000657419391 Eh/a0 ::
         :: HOMO-LUMO gap              2.250643096201 eV    ::
         ::.................................................::
         :: SCC energy               -32.160247014612 Eh    ::
         :: -> isotropic ES            0.027138557232 Eh    ::
         :: -> anisotropic ES          0.001014585035 Eh    ::
         :: -> anisotropic XC          0.014523418643 Eh    ::
         :: -> dispersion             -0.022770147887 Eh    ::
         :: repulsion energy           0.347929834435 Eh    ::
         :: add. restraining           0.000000000000 Eh    ::
         :::::::::::::::::::::::::::::::::::::::::::::::::::::

           -------------------------------------------------
          |                Property Printout                |
           -------------------------------------------------

    * Orbital Energies and Occupations

         #    Occupation            Energy/Eh            Energy/eV
      -------------------------------------------------------------
         1        2.0000           -0.7524359             -20.4748
       ...           ...                  ...                  ...
        17        2.0000           -0.5114586             -13.9175
        18        2.0000           -0.5069450             -13.7947
        19        2.0000           -0.5013343             -13.6420
        20        2.0000           -0.4984323             -13.5630
        21        2.0000           -0.4945204             -13.4566
        22        2.0000           -0.4819516             -13.1146
        23        2.0000           -0.4796139             -13.0510
        24        2.0000           -0.4623225             -12.5804
        25        2.0000           -0.4299102             -11.6985
        26        2.0000           -0.4219564             -11.4820
        27        2.0000           -0.4188854             -11.3985
        28        2.0000           -0.3805197             -10.3545
        29        2.0000           -0.3790361             -10.3141 (HOMO)
        30                         -0.2963265              -8.0635 (LUMO)
        31                         -0.2713826              -7.3847
        32                         -0.2455983              -6.6831
        33                         -0.2279264              -6.2022
        34                         -0.2037680              -5.5448
        35                         -0.1856549              -5.0519
        36                         -0.1577783              -4.2934
        37                         -0.1415955              -3.8530
        38                         -0.1275934              -3.4720
        39                         -0.0189994              -0.5170
        40                         -0.0178956              -0.4870
       ...                                ...                  ...
        65                          0.6721521              18.2902
      -------------------------------------------------------------
                  HL-Gap            0.0827096 Eh            2.2506 eV
             Fermi-level           -0.3376813 Eh           -9.1888 eV

     #   Z        covCN         q      C6AA      α(0)
     1   6 C      2.968    -0.028    28.702     8.788
     2  16 S      2.319     0.030   139.820    19.902
     3   6 C      2.969    -0.028    28.706     8.788
     4   6 C      3.187     0.030    26.867     8.457
     5   6 C      3.187     0.030    26.878     8.459
     6  16 S      2.035    -0.143   147.083    20.412
     7   6 C      3.794    -0.036    21.223     6.560
     8   6 C      2.878     0.245    22.916     7.848
     9   8 O      0.857    -0.342    20.562     6.080
    10   6 C      3.794    -0.036    21.222     6.560
    11  16 S      2.033    -0.142   147.015    20.407
    12   1 H      0.926     0.067     2.116     2.275
    13   1 H      0.926     0.067     2.115     2.274
    14   1 H      0.925     0.073     2.054     2.241
    15   1 H      0.925     0.070     2.081     2.256
    16   1 H      0.925     0.074     2.045     2.236
    17   1 H      0.925     0.069     2.092     2.262

 Mol. C6AA /au·bohr⁶  :       7083.473380
 Mol. C8AA /au·bohr⁸  :     240728.748809
 Mol. α(0) /au        :        135.803943


Wiberg/Mayer (AO) data.
largest (>0.10) Wiberg bond orders for each atom
          total WBO             WBO to atom ...
     1  C   3.952        C    5 1.596    S    2 1.198    H   12 0.967    C    3 0.101
     2  S   2.673        C    1 1.198    C    3 1.197
     3  C   3.952        C    4 1.595    S    2 1.197    H   13 0.967    C    1 0.101
     4  C   3.962        C    3 1.595    C    5 1.204    S   11 1.013
     5  C   3.962        C    1 1.596    C    4 1.204    S    6 1.011
     6  S   2.167        C    5 1.011    C    7 0.937
     7  C   3.980        C    8 0.997    H   14 0.971    H   15 0.963    S    6 0.937
     8  C   3.927        O    9 1.854    C   10 0.998    C    7 0.997
     9  O   2.095        C    8 1.854
    10  C   3.980        C    8 0.998    H   16 0.970    H   17 0.966    S   11 0.936
    11  S   2.171        C    4 1.013    C   10 0.936
    12  H   0.995        C    1 0.967
    13  H   0.995        C    3 0.967
    14  H   0.994        C    7 0.971
    15  H   0.994        C    7 0.963
    16  H   0.994        C   10 0.970
    17  H   0.995        C   10 0.966

molecular dipole:
                 x           y           z       tot (Debye)
 q only:        0.133       0.032      -0.174
   full:        0.494       0.059       0.066       1.274
molecular quadrupole (traceless):
                xx          xy          yy          xz          yz          zz
 q only:        9.064       0.354       0.318      -3.096      -0.015      -9.382
  q+dip:        9.402       0.278       2.846      -2.791      -0.056     -12.247
   full:       11.029       0.441       1.227      -1.013       0.042     -12.256

           -------------------------------------------------
          |                Geometry Summary                 |
           -------------------------------------------------

      molecular mass/u    :      202.3038000
   center of mass at/Å    :       -0.0322347      -0.0066482      -0.0330646
  moments of inertia/u·Å² :        0.4477663E+03   0.7352313E+03   0.8670055E+03
rotational constants/cm⁻¹ :        0.3764828E-01   0.2292834E-01   0.1944351E-01

 * 12 selected distances

     #   Z        #   Z                                     value/Å
     1   6 C      2  16 S                                 1.7173424
     2  16 S      3   6 C                                 1.7174291 (max)
     3   6 C      4   6 C                                 1.3574033
     1   6 C      5   6 C                                 1.3572326
     4   6 C      5   6 C                                 1.4262895
     8   6 C      9   8 O                                 1.2047321
     1   6 C     12   1 H                                 1.0710330
     3   6 C     13   1 H                                 1.0709561 (min)
     7   6 C     14   1 H                                 1.0906174
     7   6 C     15   1 H                                 1.0880311
    10   6 C     16   1 H                                 1.0903413
    10   6 C     17   1 H                                 1.0880712

 * 4 distinct bonds (by element types)

   Z      Z             #   av. dist./Å        max./Å        min./Å
   1 H    6 C           6     1.0831750     1.0906174     1.0709561
   6 C    6 C           3     1.3803084     1.4262895     1.3572326
   6 C    8 O           1     1.2047321     1.2047321     1.2047321
   6 C   16 S           2     1.7173857     1.7174291     1.7173424


optimized geometry written to: xtbopt.xyz


           -------------------------------------------------
          | TOTAL ENERGY              -31.812199011690 Eh   |
          | GRADIENT NORM               0.000657419391 Eh/α |
          | HOMO-LUMO GAP               2.250643096201 eV   |
           -------------------------------------------------

------------------------------------------------------------------------
 * finished run on 2021/05/19 at 11:00:43.865     
------------------------------------------------------------------------
 total:
 * wall-time:     0 d,  0 h,  0 min,  0.377 sec
 *  cpu-time:     0 d,  0 h,  0 min,  0.375 sec
 * ratio c/w:     0.995 speedup
 SCF:
 * wall-time:     0 d,  0 h,  0 min,  0.036 sec
 *  cpu-time:     0 d,  0 h,  0 min,  0.036 sec
 * ratio c/w:     0.997 speedup
 ANC optimizer:
 * wall-time:     0 d,  0 h,  0 min,  0.320 sec
 *  cpu-time:     0 d,  0 h,  0 min,  0.319 sec
 * ratio c/w:     0.998 speedup

