      -----------------------------------------------------------      
     |                   =====================                   |     
     |                           x T B                           |     
     |                   =====================                   |     
     |                         S. Grimme                         |     
     |          Mulliken Center for Theoretical Chemistry        |     
     |                    University of Bonn                     |     
     |                Version 6.2 RC2 (SAW190805)                |     
      -----------------------------------------------------------      

   This program is distributed in the hope that it will be useful,
   but WITHOUT ANY WARRANTY; without even the implied warranty of
   MERCHANTABILITY or FITNESS FOR A PARTICULAR PURPOSE.
   
   FOR NON-COMMERCIAL, ACADEMIA USE ONLY.
   
   Cite this work as:
   * S. Grimme, C. Bannwarth, P. Shushkov, J. Chem. Theory Comput., 2017,
     13, 1989-2009. DOI: 10.1021/acs.jctc.7b00118
   * C. Bannwarth, S. Ehlert and S. Grimme., J. Chem. Theory Comput., 2019,
     15, 1652-1671. DOI: 10.1021/acs.jctc.8b01176
   * P. Pracht, E. Caldeweyher, S. Ehlert, S. Grimme, ChemRxiv, 2019, preprint.
     DOI: 10.26434/chemrxiv.8326202.v1
   
   for DFT-D4:
   * E. Caldeweyher, C. Bannwarth and S. Grimme, J. Chem. Phys., 2017,
     147, 034112. DOI: 10.1063/1.4993215
   * E. Caldeweyher, S. Ehlert, A. Hansen, H. Neugebauer, S. Spicher,
     C. Bannwarth and S. Grimme, J. Chem. Phys., 2019, 150, 154122.
     DOI: 10.1063/1.5090222
   
   for sTDA-xTB:
   * S. Grimme and C. Bannwarth, J. Chem. Phys., 2016, 145, 054103.
     DOI: 10.1063/1.4959605
   
   in the mass-spec context:
   * V. Asgeirsson, C. Bauer and S. Grimme, Chem. Sci., 2017, 8, 4879.
     DOI: 10.1039/c7sc00601b
   
   for metadynamics refer to:
   * S. Grimme, J. Chem. Theory Comput., 2019, 155, 2847-2862
     DOI: 10.1021/acs.jctc.9b00143
   
   with help from (in alphabetical order)
   C. Bannwarth, F. Bohle, G. Brandenburg, E. Caldeweyher, M. Checinski,
   S. Dohm, S. Ehlert, S. Ehrlich, F. März, H. Neugebauer, J. Pisarek,
   P. Pracht, P. Shushkov, and S. Spicher.
   
 * started run on 2021/05/19 at 10:58:31.904     

           -------------------------------------------------
          |                Calculation Setup                |
           -------------------------------------------------

          program call               : /ihome/ghutchison/geoffh/xtb/xtb 102.xyz -opt
          hostname                   : smp-n83
          coordinate file            : 102.xyz
          omp threads                :                     1
          number of atoms            :                    29
          number of electrons        :                    72
          charge                     :                     0
          spin                       :                   0.0
          first test random number   :      0.98780223678946


########################################################################
# WARNING! Please study the warnings concerning your input carefully
#  - the use of '-opt' is discouraged, please use '--opt' next time
########################################################################

           ------------------------------------------------- 
          |                 G F N 2 - x T B                 |
          | Geometry, Frequencies, Noncovalent interactions |
          |            JCTC 2019 parametrisation            |
           ------------------------------------------------- 
             KAB for C  - Si     :                1.0500
             KAB for H  - Pd     :                0.9500
             k(s)              :                1.8500
             k(p)              :                2.2300
             k(d)              :                2.2300
             k(f)              :                2.0000
             kEN (H0ij)        :               -2.0000
             D4 a1             :                0.5200
             D4 a2             :                5.0000
             D4 s6             :                1.0000
             D4 s8             :                2.7000
             D4 s9             :                5.0000
             alphaj            :                2.0000

  Z AO/shell   Hii/eV     exponent
  1     Wed Apr 25 08:07:45 CEST 2018   EN: 2.200 GM2: 0.406  GM3: 0.0800  RAES: 1.40
     1s    -10.707211    1.230000
  6     Wed Apr 25 08:07:45 CEST 2018   EN: 2.550 GM2: 0.538  GM3: 0.1500  RAES: 3.00
     2s    -13.970922    2.096432
     2p    -10.063292    1.800000
  7     Wed Apr 25 08:07:45 CEST 2018   EN: 3.040 GM2: 0.461  GM3:-0.0640  RAES: 1.90
     2s    -16.686243    2.339881
     2p    -12.523956    2.014332
 16     Tue Apr 24 11:44:34 CEST 2018   EN: 2.580 GM2: 0.340  GM3:-0.0502  RAES: 3.10
     3s    -20.029654    1.981333
     3p    -11.377694    2.025643
     3d     -0.420282    1.702555

           ------------------------------------------------- 
          |        Self-Consistent Charge Iterations        |
           ------------------------------------------------- 

          ...................................................
          :                      SETUP                      :
          :.................................................:
          :  # basis functions                  74          :
          :  # atomic orbitals                  73          :
          :  # shells                           43          :
          :  # electrons                        72          :
          :  max. iterations                   250          :
          :  Hamiltonian                  GFN2-xTB          :
          :  restarted?                      false          :
          :  GBSA solvation                  false          :
          :  PC potential                    false          :
          :  electronic temp.          300.0000000     K    :
          :  accuracy                    1.0000000          :
          :  -> integral cutoff          0.2500000E+02      :
          :  -> integral neglect         0.1000000E-07      :
          :  -> SCF convergence          0.1000000E-05 Eh   :
          :  -> wf. convergence          0.1000000E-03 e    :
          :  Broyden damping             0.4000000          :
          ...................................................

 iter      E             dE          RMSdq      gap      omega  full diag
   1    -39.0928540 -0.390929E+02  0.347E+00    2.52       0.0  T
   2    -39.1510299 -0.581758E-01  0.222E+00    3.13       1.0  T
   3    -39.1506678  0.362102E-03  0.132E+00    2.92       1.0  T
   4    -39.1646877 -0.140200E-01  0.536E-01    2.92       1.0  T
   5    -39.1694139 -0.472616E-02  0.132E-01    2.95       1.0  T
   6    -39.1694422 -0.282977E-04  0.576E-02    2.94       1.0  T
   7    -39.1694539 -0.117597E-04  0.319E-02    2.94       1.0  T
   8    -39.1694697 -0.157757E-04  0.110E-02    2.94       1.7  T
   9    -39.1694698 -0.919479E-07  0.423E-03    2.94       4.4  T
  10    -39.1694699 -0.153209E-06  0.237E-03    2.94       7.8  T
  11    -39.1694700 -0.752245E-07  0.793E-04    2.94      23.4  T
  12    -39.1694700 -0.121623E-08  0.284E-04    2.94      65.3  T

   *** convergence criteria satisfied after 12 iterations ***

         #    Occupation            Energy/Eh            Energy/eV
      -------------------------------------------------------------
         1        2.0000           -0.7117793             -19.3685
       ...           ...                  ...                  ...
        30        2.0000           -0.4406196             -11.9899
        31        2.0000           -0.4369276             -11.8894
        32        2.0000           -0.4308546             -11.7241
        33        2.0000           -0.4148961             -11.2899
        34        2.0000           -0.3875664             -10.5462
        35        2.0000           -0.3440792              -9.3629
        36        2.0000           -0.3299215              -8.9776 (HOMO)
        37                         -0.2217431              -6.0339 (LUMO)
        38                         -0.1850638              -5.0358
        39                         -0.1798611              -4.8943
        40                         -0.1380320              -3.7560
        41                         -0.0940735              -2.5599
       ...                                ...                  ...
        73                          0.6987935              19.0151
      -------------------------------------------------------------
                  HL-Gap            0.1081784 Eh            2.9437 eV
             Fermi-level           -0.2758323 Eh           -7.5058 eV

 SCC (total)                   0 d,  0 h,  0 min,  0.044 sec
 SCC setup                      ...        0 min,  0.000 sec (  0.781%)
 Dispersion                     ...        0 min,  0.000 sec (  0.956%)
 integral evaluation            ...        0 min,  0.010 sec ( 23.460%)
 zeroth order Hamiltonian       ...        0 min,  0.000 sec (  0.474%)
 iterations                     ...        0 min,  0.016 sec ( 37.316%)
 molecular gradient             ...        0 min,  0.016 sec ( 35.951%)
 printout                       ...        0 min,  0.000 sec (  0.942%)

         :::::::::::::::::::::::::::::::::::::::::::::::::::::
         ::                     SUMMARY                     ::
         :::::::::::::::::::::::::::::::::::::::::::::::::::::
         :: total energy             -38.625565907255 Eh    ::
         :: gradient norm              0.056187604033 Eh/a0 ::
         :: HOMO-LUMO gap              2.943683780130 eV    ::
         ::.................................................::
         :: SCC energy               -39.169470021684 Eh    ::
         :: -> isotropic ES            0.012467070445 Eh    ::
         :: -> anisotropic ES          0.008230642165 Eh    ::
         :: -> anisotropic XC          0.021551383457 Eh    ::
         :: -> dispersion             -0.027288824726 Eh    ::
         :: repulsion energy           0.543607739006 Eh    ::
         :: add. restraining           0.000000000000 Eh    ::
         :::::::::::::::::::::::::::::::::::::::::::::::::::::

      ----------------------------------------------------------- 
     |                   =====================                   |
     |                        A N C O P T                        |
     |                   =====================                   |
     |               Approximate Normal Coordinate               |
     |                Rational Function Optimizer                |
      ----------------------------------------------------------- 

          ...................................................
          :                      SETUP                      :
          :.................................................:
          :   optimization level            normal          :
          :   max. optcycles                   200          :
          :   ANC micro-cycles                  20          :
          :   degrees of freedom                81          :
          :.................................................:
          :   RF solver                   davidson          :
          :   input Hessian                  false          :
          :   write xtbopt.log                true          :
          :   linear?                        false          :
          :   energy convergence         0.5000000E-05 Eh   :
          :   grad. convergence          0.1000000E-02 Eh/α :
          :   maximium RF displ.         2.0000000          :
          :   Hlow (freq-cutoff)         0.5000000E-02      :
          :   Hmax (freq-cutoff)         5.0000000          :
          :   S6 in model hess.         20.0000000          :
          ...................................................

generating ANC from model Hessian ...
Using Lindh-Hessian (1995)
 Shifting diagonal of input Hessian by   4.400647099289477E-003
 Lowest  eigenvalues of input Hessian
   -0.000000   -0.000000   -0.000000   -0.000000    0.000000    0.000000
    0.005000    0.005514    0.006582    0.006910    0.007530    0.008539
    0.009767    0.010828    0.011354    0.012199    0.017844    0.019988
 Highest eigenvalues
    1.563873    1.691771    1.800791    1.917531    2.052034    2.117164
 

........................................................................
.............................. CYCLE    1 ..............................
........................................................................
   1    -39.1694700 -0.391695E+02  0.961E-05    2.94       0.0  T
   2    -39.1694700 -0.312923E-10  0.571E-05    2.94     325.0  T
   3    -39.1694700 -0.337508E-11  0.356E-05    2.94     522.1  T
     SCC iter.                  ...        0 min,  0.005 sec
     gradient                   ...        0 min,  0.016 sec
 * total energy  :   -38.6255659 Eh     change       -0.2621506E-07 Eh
   gradient norm :     0.0561864 Eh/α   predicted     0.0000000E+00 (-100.00%)
   displ. norm   :     0.3222181 α      lambda       -0.7132469E-02
   maximum displ.:     0.1795263 α      in ANC's #17, #11, #3, ...

........................................................................
.............................. CYCLE    2 ..............................
........................................................................
   1    -39.1943082 -0.391943E+02  0.164E-01    3.00       0.0  T
   2    -39.1943519 -0.436920E-04  0.933E-02    2.98       1.0  T
   3    -39.1943462  0.565843E-05  0.636E-02    2.99       1.0  T
   4    -39.1944025 -0.562607E-04  0.136E-02    2.98       1.4  T
   5    -39.1944034 -0.936716E-06  0.671E-03    2.98       2.8  T
   6    -39.1944037 -0.333447E-06  0.299E-03    2.98       6.2  T
   7    -39.1944039 -0.146671E-06  0.832E-04    2.98      22.3  T
     SCC iter.                  ...        0 min,  0.009 sec
     gradient                   ...        0 min,  0.015 sec
 * total energy  :   -38.6303337 Eh     change       -0.4767761E-02 Eh
   gradient norm :     0.0239945 Eh/α   predicted    -0.3936539E-02 ( -17.43%)
   displ. norm   :     0.2445062 α      lambda       -0.1665592E-02
   maximum displ.:     0.1425988 α      in ANC's #3, #17, #11, ...

........................................................................
.............................. CYCLE    3 ..............................
........................................................................
   1    -39.2044870 -0.392045E+02  0.103E-01    3.00       0.0  T
   2    -39.2045023 -0.153625E-04  0.595E-02    2.99       1.0  T
   3    -39.2044943  0.803475E-05  0.391E-02    3.00       1.0  T
   4    -39.2045181 -0.237774E-04  0.856E-03    2.99       2.2  T
   5    -39.2045185 -0.454552E-06  0.392E-03    2.99       4.7  T
   6    -39.2045186 -0.103518E-06  0.194E-03    2.99       9.6  T
     SCC iter.                  ...        0 min,  0.008 sec
     gradient                   ...        0 min,  0.015 sec
 * total energy  :   -38.6313430 Eh     change       -0.1009333E-02 Eh
   gradient norm :     0.0060182 Eh/α   predicted    -0.8825877E-03 ( -12.56%)
   displ. norm   :     0.1938608 α      lambda       -0.3774005E-03
   maximum displ.:     0.1409677 α      in ANC's #3, #4, #1, ...

........................................................................
.............................. CYCLE    4 ..............................
........................................................................
   1    -39.2050534 -0.392051E+02  0.826E-02    2.99       0.0  T
   2    -39.2050550 -0.166368E-05  0.474E-02    2.99       1.0  T
   3    -39.2050526  0.240032E-05  0.125E-02    2.99       1.5  T
   4    -39.2050556 -0.293059E-05  0.415E-03    2.99       4.5  T
   5    -39.2050557 -0.156696E-06  0.147E-03    2.99      12.7  T
   6    -39.2050557 -0.673581E-08  0.665E-04    2.99      27.9  T
     SCC iter.                  ...        0 min,  0.008 sec
     gradient                   ...        0 min,  0.015 sec
 * total energy  :   -38.6316436 Eh     change       -0.3005826E-03 Eh
   gradient norm :     0.0042184 Eh/α   predicted    -0.1957925E-03 ( -34.86%)
   displ. norm   :     0.2723723 α      lambda       -0.3769172E-03
   maximum displ.:     0.1809975 α      in ANC's #3, #4, #1, ...

........................................................................
.............................. CYCLE    5 ..............................
........................................................................
   1    -39.2032552 -0.392033E+02  0.131E-01    2.99       0.0  T
   2    -39.2032597 -0.446833E-05  0.754E-02    2.99       1.0  T
   3    -39.2032433  0.164017E-04  0.292E-02    2.99       1.0  T
   4    -39.2032625 -0.191616E-04  0.439E-03    2.99       4.2  T
   5    -39.2032626 -0.150937E-06  0.202E-03    2.99       9.2  T
   6    -39.2032626  0.163369E-08  0.109E-03    2.99      17.0  T
     SCC iter.                  ...        0 min,  0.008 sec
     gradient                   ...        0 min,  0.015 sec
 * total energy  :   -38.6319354 Eh     change       -0.2917767E-03 Eh
   gradient norm :     0.0053925 Eh/α   predicted    -0.2024406E-03 ( -30.62%)
   displ. norm   :     0.2778930 α      lambda       -0.2678094E-03
   maximum displ.:     0.1791365 α      in ANC's #3, #1, #4, ...

........................................................................
.............................. CYCLE    6 ..............................
........................................................................
   1    -39.2018235 -0.392018E+02  0.137E-01    2.99       0.0  T
   2    -39.2018281 -0.452283E-05  0.787E-02    2.99       1.0  T
   3    -39.2018098  0.182172E-04  0.299E-02    2.99       1.0  T
   4    -39.2018310 -0.211991E-04  0.454E-03    2.99       4.1  T
   5    -39.2018312 -0.137515E-06  0.198E-03    2.99       9.4  T
   6    -39.2018312 -0.106472E-08  0.964E-04    2.99      19.3  T
     SCC iter.                  ...        0 min,  0.008 sec
     gradient                   ...        0 min,  0.015 sec
 * total energy  :   -38.6321376 Eh     change       -0.2022222E-03 Eh
   gradient norm :     0.0054726 Eh/α   predicted    -0.1442465E-03 ( -28.67%)
   displ. norm   :     0.2506485 α      lambda       -0.1920831E-03
   maximum displ.:     0.1605203 α      in ANC's #3, #1, #4, ...

........................................................................
.............................. CYCLE    7 ..............................
........................................................................
   1    -39.2019964 -0.392020E+02  0.123E-01    3.00       0.0  T
   2    -39.2019996 -0.323174E-05  0.697E-02    2.99       1.0  T
   3    -39.2019919  0.773914E-05  0.196E-02    3.00       1.0  T
   4    -39.2020012 -0.934731E-05  0.487E-03    2.99       3.8  T
   5    -39.2020014 -0.154183E-06  0.148E-03    2.99      12.6  T
   6    -39.2020014 -0.463979E-08  0.486E-04    2.99      38.2  T
     SCC iter.                  ...        0 min,  0.008 sec
     gradient                   ...        0 min,  0.015 sec
 * total energy  :   -38.6322843 Eh     change       -0.1466990E-03 Eh
   gradient norm :     0.0042078 Eh/α   predicted    -0.1020755E-03 ( -30.42%)
   displ. norm   :     0.2619781 α      lambda       -0.1656470E-03
   maximum displ.:     0.1626458 α      in ANC's #3, #1, #4, ...

........................................................................
.............................. CYCLE    8 ..............................
........................................................................
   1    -39.2030517 -0.392031E+02  0.131E-01    3.00       0.0  T
   2    -39.2030559 -0.425780E-05  0.734E-02    3.00       1.0  T
   3    -39.2030500  0.593170E-05  0.186E-02    3.00       1.0  T
   4    -39.2030577 -0.771717E-05  0.662E-03    3.00       2.8  T
   5    -39.2030580 -0.282823E-06  0.168E-03    3.00      11.1  T
   6    -39.2030580 -0.356142E-07  0.768E-04    3.00      24.2  T
     SCC iter.                  ...        0 min,  0.008 sec
     gradient                   ...        0 min,  0.015 sec
 * total energy  :   -38.6324022 Eh     change       -0.1178743E-03 Eh
   gradient norm :     0.0031104 Eh/α   predicted    -0.8851289E-04 ( -24.91%)
   displ. norm   :     0.2512667 α      lambda       -0.1252732E-03
   maximum displ.:     0.1494877 α      in ANC's #1, #3, #4, ...

........................................................................
.............................. CYCLE    9 ..............................
........................................................................
   1    -39.2040644 -0.392041E+02  0.132E-01    3.00       0.0  T
   2    -39.2040699 -0.554148E-05  0.730E-02    2.99       1.0  T
   3    -39.2040615  0.839710E-05  0.227E-02    3.00       1.0  T
   4    -39.2040727 -0.111835E-04  0.694E-03    3.00       2.7  T
   5    -39.2040729 -0.191099E-06  0.162E-03    3.00      11.5  T
   6    -39.2040729 -0.350676E-07  0.778E-04    3.00      23.9  T
   7    -39.2040729 -0.839636E-08  0.306E-04    3.00      60.7  T
     SCC iter.                  ...        0 min,  0.009 sec
     gradient                   ...        0 min,  0.016 sec
 * total energy  :   -38.6324862 Eh     change       -0.8403568E-04 Eh
   gradient norm :     0.0036556 Eh/α   predicted    -0.6659559E-04 ( -20.75%)
   displ. norm   :     0.2145860 α      lambda       -0.1001220E-03
   maximum displ.:     0.1387210 α      in ANC's #1, #3, #4, ...

........................................................................
.............................. CYCLE   10 ..............................
........................................................................
   1    -39.2053056 -0.392053E+02  0.117E-01    3.00       0.0  T
   2    -39.2053113 -0.571889E-05  0.628E-02    2.99       1.0  T
   3    -39.2053043  0.702779E-05  0.218E-02    3.00       1.0  T
   4    -39.2053141 -0.988173E-05  0.639E-03    3.00       2.9  T
   5    -39.2053143 -0.130832E-06  0.133E-03    3.00      13.9  T
   6    -39.2053143 -0.153046E-07  0.723E-04    3.00      25.7  T
   7    -39.2053143 -0.644223E-08  0.300E-04    3.00      62.0  T
     SCC iter.                  ...        0 min,  0.009 sec
     gradient                   ...        0 min,  0.016 sec
 * total energy  :   -38.6325641 Eh     change       -0.7788853E-04 Eh
   gradient norm :     0.0036630 Eh/α   predicted    -0.5236701E-04 ( -32.77%)
   displ. norm   :     0.2536408 α      lambda       -0.1155071E-03
   maximum displ.:     0.1667687 α      in ANC's #1, #4, #3, ...

........................................................................
.............................. CYCLE   11 ..............................
........................................................................
   1    -39.2055102 -0.392055E+02  0.138E-01    3.00       0.0  T
   2    -39.2055180 -0.779943E-05  0.738E-02    2.99       1.0  T
   3    -39.2055111  0.689716E-05  0.225E-02    3.00       1.0  T
   4    -39.2055215 -0.103844E-04  0.745E-03    2.99       2.5  T
   5    -39.2055217 -0.201895E-06  0.159E-03    2.99      11.7  T
   6    -39.2055217 -0.286662E-07  0.867E-04    2.99      21.4  T
   7    -39.2055217 -0.798701E-08  0.384E-04    2.99      48.4  T
     SCC iter.                  ...        0 min,  0.009 sec
     gradient                   ...        0 min,  0.016 sec
 * total energy  :   -38.6326620 Eh     change       -0.9792926E-04 Eh
   gradient norm :     0.0034225 Eh/α   predicted    -0.6147509E-04 ( -37.23%)
   displ. norm   :     0.3458720 α      lambda       -0.1656083E-03
   maximum displ.:     0.2223838 α      in ANC's #1, #4, #5, ...

........................................................................
.............................. CYCLE   12 ..............................
........................................................................
   1    -39.2054558 -0.392055E+02  0.182E-01    3.00       0.0  T
   2    -39.2054697 -0.138226E-04  0.977E-02    2.99       1.0  T
   3    -39.2054610  0.869111E-05  0.273E-02    3.00       1.0  T
   4    -39.2054755 -0.145280E-04  0.932E-03    2.99       2.0  T
   5    -39.2054758 -0.292753E-06  0.238E-03    2.99       7.8  T
   6    -39.2054759 -0.673365E-07  0.128E-03    2.99      14.5  T
   7    -39.2054759 -0.161286E-07  0.541E-04    2.99      34.3  T
   8    -39.2054759 -0.774314E-09  0.236E-04    2.99      78.8  T
     SCC iter.                  ...        0 min,  0.010 sec
     gradient                   ...        0 min,  0.016 sec
 * total energy  :   -38.6327925 Eh     change       -0.1304260E-03 Eh
   gradient norm :     0.0040886 Eh/α   predicted    -0.9271059E-04 ( -28.92%)
   displ. norm   :     0.3581567 α      lambda       -0.1523663E-03
   maximum displ.:     0.2357874 α      in ANC's #1, #4, #5, ...

........................................................................
.............................. CYCLE   13 ..............................
........................................................................
   1    -39.2036949 -0.392037E+02  0.175E-01    2.99       0.0  T
   2    -39.2037065 -0.115232E-04  0.949E-02    2.99       1.0  T
   3    -39.2037023  0.416709E-05  0.221E-02    2.99       1.0  T
   4    -39.2037110 -0.871163E-05  0.884E-03    2.99       2.1  T
   5    -39.2037114 -0.372730E-06  0.224E-03    2.99       8.3  T
   6    -39.2037114 -0.673132E-07  0.115E-03    2.99      16.2  T
     SCC iter.                  ...        0 min,  0.008 sec
     gradient                   ...        0 min,  0.015 sec
 * total energy  :   -38.6328994 Eh     change       -0.1069338E-03 Eh
   gradient norm :     0.0041749 Eh/α   predicted    -0.8596130E-04 ( -19.61%)
   displ. norm   :     0.3581209 α      lambda        0.3165434E-05
   maximum displ.:     0.2357331 α      in ANC's #1, #4, #5, ...

........................................................................
.............................. CYCLE   14 ..............................
........................................................................
   1    -39.2002619 -0.392003E+02  0.174E-01    2.99       0.0  T
   2    -39.2002733 -0.114271E-04  0.947E-02    2.99       1.0  T
   3    -39.2002651  0.820274E-05  0.252E-02    2.99       1.0  T
   4    -39.2002783 -0.132657E-04  0.889E-03    2.99       2.1  T
   5    -39.2002787 -0.363189E-06  0.197E-03    2.99       9.4  T
   6    -39.2002787 -0.410079E-07  0.107E-03    2.99      17.4  T
     SCC iter.                  ...        0 min,  0.008 sec
     gradient                   ...        0 min,  0.015 sec
 * total energy  :   -38.6328872 Eh     change        0.1217282E-04 Eh
   gradient norm :     0.0072330 Eh/α   predicted     0.1785693E-05 ( -85.33%)
   displ. norm   :     0.1108212 α      lambda       -0.1525187E-03
   maximum displ.:     0.0703608 α      in ANC's #3, #4, #1, ...

........................................................................
.............................. CYCLE   15 ..............................
........................................................................
   1    -39.2047025 -0.392047E+02  0.751E-02    2.98       0.0  T
   2    -39.2047045 -0.201591E-05  0.406E-02    2.99       1.0  T
   3    -39.2046997  0.487589E-05  0.157E-02    2.98       1.2  T
   4    -39.2047058 -0.609720E-05  0.426E-03    2.99       4.4  T
   5    -39.2047058 -0.775961E-07  0.128E-03    2.99      14.6  T
   6    -39.2047059 -0.183725E-07  0.470E-04    2.99      39.5  T
     SCC iter.                  ...        0 min,  0.008 sec
     gradient                   ...        0 min,  0.015 sec
 * total energy  :   -38.6329759 Eh     change       -0.8872009E-04 Eh
   gradient norm :     0.0044900 Eh/α   predicted    -0.7719750E-04 ( -12.99%)
   displ. norm   :     0.0916430 α      lambda       -0.8209045E-04
   maximum displ.:     0.0576007 α      in ANC's #1, #4, #8, ...

........................................................................
.............................. CYCLE   16 ..............................
........................................................................
   1    -39.2055584 -0.392056E+02  0.448E-02    2.99       0.0  T
   2    -39.2055593 -0.894026E-06  0.251E-02    2.99       1.0  T
   3    -39.2055558  0.353359E-05  0.142E-02    2.99       1.3  T
   4    -39.2055602 -0.441143E-05  0.230E-03    2.99       8.1  T
   5    -39.2055602 -0.166462E-07  0.968E-04    2.99      19.2  T
   6    -39.2055602 -0.494381E-08  0.423E-04    2.99      44.0  T
     SCC iter.                  ...        0 min,  0.008 sec
     gradient                   ...        0 min,  0.015 sec
 * total energy  :   -38.6330379 Eh     change       -0.6197073E-04 Eh
   gradient norm :     0.0026995 Eh/α   predicted    -0.4139197E-04 ( -33.21%)
   displ. norm   :     0.3348744 α      lambda       -0.1480843E-03
   maximum displ.:     0.2511159 α      in ANC's #1, #4, #5, ...

........................................................................
.............................. CYCLE   17 ..............................
........................................................................
   1    -39.2063698 -0.392064E+02  0.129E-01    2.99       0.0  T
   2    -39.2063743 -0.454589E-05  0.717E-02    2.99       1.0  T
   3    -39.2063618  0.125173E-04  0.277E-02    2.99       1.0  T
   4    -39.2063775 -0.156393E-04  0.579E-03    2.99       3.2  T
   5    -39.2063775 -0.472399E-07  0.159E-03    2.99      11.7  T
   6    -39.2063775 -0.157890E-07  0.686E-04    2.99      27.1  T
   7    -39.2063775 -0.399985E-08  0.348E-04    2.99      53.4  T
     SCC iter.                  ...        0 min,  0.009 sec
     gradient                   ...        0 min,  0.016 sec
 * total energy  :   -38.6331517 Eh     change       -0.1137817E-03 Eh
   gradient norm :     0.0034408 Eh/α   predicted    -0.8234919E-04 ( -27.63%)
   displ. norm   :     0.2674874 α      lambda       -0.1027967E-03
   maximum displ.:     0.2026846 α      in ANC's #1, #4, #5, ...

........................................................................
.............................. CYCLE   18 ..............................
........................................................................
   1    -39.2055525 -0.392056E+02  0.110E-01    2.99       0.0  T
   2    -39.2055558 -0.334616E-05  0.609E-02    2.99       1.0  T
   3    -39.2055494  0.643975E-05  0.209E-02    2.99       1.0  T
   4    -39.2055578 -0.841117E-05  0.516E-03    2.99       3.6  T
   5    -39.2055579 -0.432551E-07  0.121E-03    2.99      15.4  T
   6    -39.2055579 -0.103553E-07  0.604E-04    2.99      30.7  T
   7    -39.2055579 -0.370646E-08  0.297E-04    2.99      62.5  T
     SCC iter.                  ...        0 min,  0.009 sec
     gradient                   ...        0 min,  0.016 sec
 * total energy  :   -38.6332397 Eh     change       -0.8795981E-04 Eh
   gradient norm :     0.0040451 Eh/α   predicted    -0.5507872E-04 ( -37.38%)
   displ. norm   :     0.2714375 α      lambda       -0.1136787E-03
   maximum displ.:     0.2039184 α      in ANC's #1, #4, #5, ...

........................................................................
.............................. CYCLE   19 ..............................
........................................................................
   1    -39.2049299 -0.392049E+02  0.128E-01    2.99       0.0  T
   2    -39.2049343 -0.444326E-05  0.693E-02    2.99       1.0  T
   3    -39.2049286  0.569891E-05  0.208E-02    2.99       1.0  T
   4    -39.2049365 -0.786635E-05  0.638E-03    2.99       2.9  T
   5    -39.2049366 -0.120933E-06  0.113E-03    2.99      16.5  T
   6    -39.2049366 -0.762483E-08  0.582E-04    2.99      31.9  T
     SCC iter.                  ...        0 min,  0.008 sec
     gradient                   ...        0 min,  0.015 sec
 * total energy  :   -38.6333367 Eh     change       -0.9709444E-04 Eh
   gradient norm :     0.0041181 Eh/α   predicted    -0.6103233E-04 ( -37.14%)
   displ. norm   :     0.3785411 α      lambda       -0.1484599E-03
   maximum displ.:     0.2841637 α      in ANC's #1, #4, #5, ...

........................................................................
.............................. CYCLE   20 ..............................
........................................................................
   1    -39.2039937 -0.392040E+02  0.191E-01    2.99       0.0  T
   2    -39.2040039 -0.102031E-04  0.103E-01    2.98       1.0  T
   3    -39.2039947  0.916080E-05  0.281E-02    2.99       1.0  T
   4    -39.2040083 -0.135303E-04  0.966E-03    2.98       1.9  T
   5    -39.2040086 -0.374971E-06  0.187E-03    2.98       9.9  T
   6    -39.2040087 -0.299130E-07  0.951E-04    2.98      19.5  T
     SCC iter.                  ...        0 min,  0.008 sec
     gradient                   ...        0 min,  0.015 sec
 * total energy  :   -38.6334546 Eh     change       -0.1178657E-03 Eh
   gradient norm :     0.0040567 Eh/α   predicted    -0.8486966E-04 ( -27.99%)
   displ. norm   :     0.4123350 α      lambda       -0.1508919E-03
   maximum displ.:     0.3094086 α      in ANC's #1, #3, #5, ...
 * RMSD in coord.:     0.7679469 α      energy gain  -0.7888708E-02 Eh

generating ANC from model Hessian ...
Using Lindh-Hessian (1995)
 Shifting diagonal of input Hessian by   4.347370054845628E-003
 Lowest  eigenvalues of input Hessian
   -0.000000   -0.000000   -0.000000    0.000000    0.000000    0.000000
    0.005000    0.005632    0.006086    0.007224    0.007726    0.009052
    0.010311    0.011225    0.011746    0.012916    0.017948    0.020813
 Highest eigenvalues
    1.627455    1.792379    1.865439    1.976429    2.082549    2.174646
 

........................................................................
.............................. CYCLE   21 ..............................
........................................................................
   1    -39.2035881 -0.392036E+02  0.232E-01    2.99       0.0  T
   2    -39.2036031 -0.150317E-04  0.125E-01    2.98       1.0  T
   3    -39.2035944  0.871267E-05  0.300E-02    2.98       1.0  T
   4    -39.2036088 -0.143938E-04  0.117E-02    2.98       1.6  T
   5    -39.2036095 -0.776435E-06  0.235E-03    2.98       7.9  T
   6    -39.2036096 -0.530221E-07  0.118E-03    2.98      15.8  T
   7    -39.2036096 -0.149976E-07  0.528E-04    2.98      35.1  T
   8    -39.2036096 -0.125898E-08  0.172E-04    2.98     108.0  T
     SCC iter.                  ...        0 min,  0.010 sec
     gradient                   ...        0 min,  0.016 sec
 * total energy  :   -38.6335681 Eh     change       -0.1134578E-03 Eh
   gradient norm :     0.0044225 Eh/α   predicted     0.0000000E+00 (-100.00%)
   displ. norm   :     0.0740592 α      lambda       -0.8398210E-04
   maximum displ.:     0.0470536 α      in ANC's #2, #4, #3, ...

........................................................................
.............................. CYCLE   22 ..............................
........................................................................
   1    -39.2057104 -0.392057E+02  0.405E-02    2.98       0.0  T
   2    -39.2057111 -0.664981E-06  0.213E-02    2.98       1.0  T
   3    -39.2057101  0.104714E-05  0.855E-03    2.98       2.2  T
   4    -39.2057114 -0.137444E-05  0.247E-03    2.98       7.5  T
   5    -39.2057114 -0.107251E-07  0.101E-03    2.98      18.5  T
     SCC iter.                  ...        0 min,  0.007 sec
     gradient                   ...        0 min,  0.015 sec
 * total energy  :   -38.6336335 Eh     change       -0.6540493E-04 Eh
   gradient norm :     0.0020382 Eh/α   predicted    -0.4222299E-04 ( -35.44%)
   displ. norm   :     0.0875426 α      lambda       -0.6478824E-04
   maximum displ.:     0.0488882 α      in ANC's #2, #4, #3, ...

........................................................................
.............................. CYCLE   23 ..............................
........................................................................
   1    -39.2072208 -0.392072E+02  0.563E-02    2.98       0.0  T
   2    -39.2072221 -0.133757E-05  0.294E-02    2.98       1.0  T
   3    -39.2072211  0.944327E-06  0.936E-03    2.98       2.0  T
   4    -39.2072226 -0.144996E-05  0.328E-03    2.98       5.7  T
   5    -39.2072226 -0.340399E-07  0.121E-03    2.98      15.4  T
   6    -39.2072227 -0.185535E-07  0.426E-04    2.98      43.6  T
   7    -39.2072227 -0.324650E-08  0.180E-04    2.98     103.1  T
     SCC iter.                  ...        0 min,  0.009 sec
     gradient                   ...        0 min,  0.016 sec
 * total energy  :   -38.6336866 Eh     change       -0.5309699E-04 Eh
   gradient norm :     0.0020194 Eh/α   predicted    -0.3264667E-04 ( -38.52%)
   displ. norm   :     0.2199811 α      lambda       -0.1294851E-03
   maximum displ.:     0.1264254 α      in ANC's #2, #4, #3, ...

........................................................................
.............................. CYCLE   24 ..............................
........................................................................
   1    -39.2085197 -0.392085E+02  0.152E-01    2.99       0.0  T
   2    -39.2085289 -0.918343E-05  0.799E-02    2.98       1.0  T
   3    -39.2085253  0.366165E-05  0.213E-02    2.99       1.0  T
   4    -39.2085322 -0.694228E-05  0.826E-03    2.98       2.2  T
   5    -39.2085325 -0.312362E-06  0.269E-03    2.98       6.9  T
   6    -39.2085326 -0.917524E-07  0.980E-04    2.98      18.9  T
   7    -39.2085326 -0.129367E-07  0.455E-04    2.98      40.8  T
     SCC iter.                  ...        0 min,  0.009 sec
     gradient                   ...        0 min,  0.016 sec
 * total energy  :   -38.6337951 Eh     change       -0.1085731E-03 Eh
   gradient norm :     0.0052705 Eh/α   predicted    -0.6787687E-04 ( -37.48%)
   displ. norm   :     0.4817222 α      lambda       -0.2763092E-03
   maximum displ.:     0.2805492 α      in ANC's #2, #4, #3, ...

........................................................................
.............................. CYCLE   25 ..............................
........................................................................
   1    -39.2074014 -0.392074E+02  0.358E-01    2.99       0.0  T
   2    -39.2074540 -0.525620E-04  0.189E-01    2.98       1.0  T
   3    -39.2074402  0.138199E-04  0.438E-02    2.99       1.0  T
   4    -39.2074721 -0.319393E-04  0.187E-02    2.98       1.0  T
   5    -39.2074745 -0.243150E-05  0.465E-03    2.98       4.0  T
   6    -39.2074748 -0.222464E-06  0.218E-03    2.98       8.5  T
   7    -39.2074748 -0.621627E-07  0.956E-04    2.98      19.4  T
     SCC iter.                  ...        0 min,  0.009 sec
     gradient                   ...        0 min,  0.015 sec
 * total energy  :   -38.6340121 Eh     change       -0.2169445E-03 Eh
   gradient norm :     0.0131435 Eh/α   predicted    -0.1702155E-03 ( -21.54%)
   displ. norm   :     0.4204035 α      lambda       -0.3254236E-03
   maximum displ.:     0.2561211 α      in ANC's #2, #4, #3, ...

........................................................................
.............................. CYCLE   26 ..............................
........................................................................
   1    -39.2041067 -0.392041E+02  0.341E-01    3.00       0.0  T
   2    -39.2041596 -0.528737E-04  0.181E-01    2.98       1.0  T
   3    -39.2041175  0.420835E-04  0.514E-02    2.99       1.0  T
   4    -39.2041815 -0.639888E-04  0.181E-02    2.98       1.0  T
   5    -39.2041835 -0.205329E-05  0.583E-03    2.98       3.2  T
   6    -39.2041841 -0.590240E-06  0.245E-03    2.98       7.6  T
   7    -39.2041842 -0.776679E-07  0.900E-04    2.98      20.6  T
     SCC iter.                  ...        0 min,  0.009 sec
     gradient                   ...        0 min,  0.015 sec
 * total energy  :   -38.6342163 Eh     change       -0.2042404E-03 Eh
   gradient norm :     0.0211800 Eh/α   predicted    -0.1914765E-03 (  -6.25%)
   displ. norm   :     0.2493648 α      lambda       -0.7924526E-03
   maximum displ.:     0.1661898 α      in ANC's #2, #5, #1, ...

........................................................................
.............................. CYCLE   27 ..............................
........................................................................
   1    -39.2037657 -0.392038E+02  0.244E-01    2.99       0.0  T
   2    -39.2037987 -0.329408E-04  0.133E-01    2.97       1.0  T
   3    -39.2037215  0.771715E-04  0.598E-02    2.98       1.0  T
   4    -39.2038210 -0.994764E-04  0.113E-02    2.97       1.6  T
   5    -39.2038218 -0.834364E-06  0.509E-03    2.97       3.6  T
   6    -39.2038221 -0.235307E-06  0.217E-03    2.97       8.5  T
     SCC iter.                  ...        0 min,  0.008 sec
     gradient                   ...        0 min,  0.015 sec
 * total energy  :   -38.6348426 Eh     change       -0.6262606E-03 Eh
   gradient norm :     0.0165680 Eh/α   predicted    -0.4208656E-03 ( -32.80%)
   displ. norm   :     0.2675085 α      lambda       -0.1027742E-02
   maximum displ.:     0.1751676 α      in ANC's #2, #5, #6, ...

........................................................................
.............................. CYCLE   28 ..............................
........................................................................
   1    -39.2057306 -0.392057E+02  0.234E-01    2.98       0.0  T
   2    -39.2057673 -0.366680E-04  0.130E-01    2.97       1.0  T
   3    -39.2056712  0.960908E-04  0.692E-02    2.98       1.0  T
   4    -39.2057946 -0.123403E-03  0.103E-02    2.97       1.8  T
   5    -39.2057958 -0.117393E-05  0.491E-03    2.97       3.8  T
   6    -39.2057959 -0.110680E-06  0.204E-03    2.97       9.1  T
   7    -39.2057959 -0.461203E-07  0.833E-04    2.97      22.3  T
     SCC iter.                  ...        0 min,  0.009 sec
     gradient                   ...        0 min,  0.015 sec
 * total energy  :   -38.6353154 Eh     change       -0.4727789E-03 Eh
   gradient norm :     0.0087383 Eh/α   predicted    -0.5506459E-03 (  16.47%)
   displ. norm   :     0.4059463 α      lambda       -0.4330074E-03
   maximum displ.:     0.2865167 α      in ANC's #2, #5, #4, ...

........................................................................
.............................. CYCLE   29 ..............................
........................................................................
   1    -39.1986642 -0.391987E+02  0.346E-01    2.98       0.0  T
   2    -39.1987295 -0.653057E-04  0.184E-01    2.95       1.0  T
   3    -39.1985905  0.139019E-03  0.845E-02    2.97       1.0  T
   4    -39.1987721 -0.181592E-03  0.197E-02    2.95       1.0  T
   5    -39.1987739 -0.175765E-05  0.905E-03    2.95       2.1  T
   6    -39.1987749 -0.108634E-05  0.321E-03    2.95       5.8  T
   7    -39.1987751 -0.142468E-06  0.120E-03    2.95      15.5  T
   8    -39.1987751 -0.331198E-08  0.536E-04    2.95      34.6  T
     SCC iter.                  ...        0 min,  0.010 sec
     gradient                   ...        0 min,  0.015 sec
 * total energy  :   -38.6352758 Eh     change        0.3953095E-04 Eh
   gradient norm :     0.0143113 Eh/α   predicted    -0.2521954E-03 (-737.97%)
   displ. norm   :     0.2077314 α      lambda       -0.5501250E-03
   maximum displ.:     0.1157260 α      in ANC's #2, #4, #3, ...

........................................................................
.............................. CYCLE   30 ..............................
........................................................................
   1    -39.2046929 -0.392047E+02  0.189E-01    2.95       0.0  T
   2    -39.2047184 -0.255336E-04  0.106E-01    2.97       1.0  T
   3    -39.2046479  0.705309E-04  0.620E-02    2.96       1.0  T
   4    -39.2047442 -0.963460E-04  0.104E-02    2.97       1.8  T
   5    -39.2047450 -0.727431E-06  0.532E-03    2.97       3.5  T
   6    -39.2047452 -0.283588E-06  0.207E-03    2.97       9.0  T
   7    -39.2047453 -0.484944E-07  0.780E-04    2.97      23.8  T
     SCC iter.                  ...        0 min,  0.009 sec
     gradient                   ...        0 min,  0.015 sec
 * total energy  :   -38.6355581 Eh     change       -0.2822713E-03 Eh
   gradient norm :     0.0041620 Eh/α   predicted    -0.2869337E-03 (   1.65%)
   displ. norm   :     0.0952275 α      lambda       -0.7910539E-04
   maximum displ.:     0.0574770 α      in ANC's #2, #5, #6, ...

........................................................................
.............................. CYCLE   31 ..............................
........................................................................
   1    -39.2055999 -0.392056E+02  0.395E-02    2.98       0.0  T
   2    -39.2056003 -0.401597E-06  0.222E-02    2.97       1.0  T
   3    -39.2055998  0.459575E-06  0.562E-03    2.98       3.3  T
   4    -39.2056004 -0.619744E-06  0.177E-03    2.98      10.5  T
   5    -39.2056005 -0.189130E-07  0.869E-04    2.97      21.4  T
     SCC iter.                  ...        0 min,  0.007 sec
     gradient                   ...        0 min,  0.015 sec
 * total energy  :   -38.6356229 Eh     change       -0.6474700E-04 Eh
   gradient norm :     0.0022129 Eh/α   predicted    -0.3991156E-04 ( -38.36%)
   displ. norm   :     0.1832652 α      lambda       -0.1073283E-03
   maximum displ.:     0.1002697 α      in ANC's #5, #2, #3, ...

........................................................................
.............................. CYCLE   32 ..............................
........................................................................
   1    -39.2067475 -0.392067E+02  0.923E-02    2.98       0.0  T
   2    -39.2067496 -0.215619E-05  0.493E-02    2.98       1.0  T
   3    -39.2067488  0.820825E-06  0.103E-02    2.98       1.8  T
   4    -39.2067501 -0.129560E-05  0.540E-03    2.98       3.4  T
   5    -39.2067504 -0.261500E-06  0.176E-03    2.98      10.6  T
   6    -39.2067504 -0.545751E-07  0.614E-04    2.98      30.3  T
   7    -39.2067504 -0.215524E-08  0.391E-04    2.98      47.5  T
     SCC iter.                  ...        0 min,  0.009 sec
     gradient                   ...        0 min,  0.016 sec
 * total energy  :   -38.6356988 Eh     change       -0.7589744E-04 Eh
   gradient norm :     0.0024646 Eh/α   predicted    -0.5546714E-04 ( -26.92%)
   displ. norm   :     0.1496849 α      lambda       -0.5555515E-04
   maximum displ.:     0.0954786 α      in ANC's #2, #5, #3, ...

........................................................................
.............................. CYCLE   33 ..............................
........................................................................
   1    -39.2063436 -0.392063E+02  0.810E-02    2.99       0.0  T
   2    -39.2063458 -0.222287E-05  0.439E-02    2.98       1.0  T
   3    -39.2063379  0.793549E-05  0.192E-02    2.99       1.0  T
   4    -39.2063477 -0.984284E-05  0.445E-03    2.98       4.2  T
   5    -39.2063478 -0.380524E-07  0.211E-03    2.98       8.8  T
   6    -39.2063479 -0.763215E-07  0.566E-04    2.98      32.8  T
   7    -39.2063479 -0.321767E-08  0.297E-04    2.98      62.5  T
     SCC iter.                  ...        0 min,  0.009 sec
     gradient                   ...        0 min,  0.016 sec
 * total energy  :   -38.6357391 Eh     change       -0.4038972E-04 Eh
   gradient norm :     0.0036782 Eh/α   predicted    -0.2840413E-04 ( -29.67%)
   displ. norm   :     0.1371878 α      lambda       -0.3931791E-04
   maximum displ.:     0.0810522 α      in ANC's #2, #5, #3, ...

........................................................................
.............................. CYCLE   34 ..............................
........................................................................
   1    -39.2060957 -0.392061E+02  0.828E-02    2.99       0.0  T
   2    -39.2060978 -0.214228E-05  0.431E-02    2.99       1.0  T
   3    -39.2060922  0.565361E-05  0.166E-02    2.99       1.1  T
   4    -39.2060993 -0.714617E-05  0.478E-03    2.99       3.9  T
   5    -39.2060994 -0.624993E-07  0.163E-03    2.99      11.4  T
   6    -39.2060994 -0.489474E-07  0.512E-04    2.99      36.3  T
   7    -39.2060994 -0.253407E-08  0.267E-04    2.99      69.6  T
     SCC iter.                  ...        0 min,  0.009 sec
     gradient                   ...        0 min,  0.016 sec
 * total energy  :   -38.6357692 Eh     change       -0.3010055E-04 Eh
   gradient norm :     0.0031500 Eh/α   predicted    -0.2003383E-04 ( -33.44%)
   displ. norm   :     0.1399437 α      lambda       -0.3809955E-04
   maximum displ.:     0.0816083 α      in ANC's #2, #5, #3, ...

........................................................................
.............................. CYCLE   35 ..............................
........................................................................
   1    -39.2055873 -0.392056E+02  0.859E-02    2.99       0.0  T
   2    -39.2055898 -0.253810E-05  0.446E-02    2.99       1.0  T
   3    -39.2055829  0.698274E-05  0.184E-02    2.99       1.0  T
   4    -39.2055917 -0.887556E-05  0.483E-03    2.99       3.8  T
   5    -39.2055918 -0.571411E-07  0.146E-03    2.99      12.7  T
   6    -39.2055918 -0.365118E-07  0.502E-04    2.99      37.0  T
   7    -39.2055918 -0.319264E-08  0.228E-04    2.99      81.3  T
     SCC iter.                  ...        0 min,  0.009 sec
     gradient                   ...        0 min,  0.016 sec
 * total energy  :   -38.6357991 Eh     change       -0.2989308E-04 Eh
   gradient norm :     0.0028128 Eh/α   predicted    -0.1942387E-04 ( -35.02%)
   displ. norm   :     0.1716322 α      lambda       -0.4429809E-04
   maximum displ.:     0.0930486 α      in ANC's #2, #3, #5, ...

........................................................................
.............................. CYCLE   36 ..............................
........................................................................
   1    -39.2052099 -0.392052E+02  0.107E-01    3.00       0.0  T
   2    -39.2052140 -0.408588E-05  0.553E-02    2.99       1.0  T
   3    -39.2052055  0.853869E-05  0.210E-02    3.00       1.0  T
   4    -39.2052165 -0.110809E-04  0.589E-03    2.99       3.2  T
   5    -39.2052167 -0.114243E-06  0.140E-03    3.00      13.2  T
   6    -39.2052167 -0.255803E-07  0.587E-04    3.00      31.6  T
   7    -39.2052167 -0.466842E-08  0.273E-04    3.00      68.1  T
     SCC iter.                  ...        0 min,  0.009 sec
     gradient                   ...        0 min,  0.016 sec
 * total energy  :   -38.6358309 Eh     change       -0.3180348E-04 Eh
   gradient norm :     0.0022088 Eh/α   predicted    -0.2280745E-04 ( -28.29%)
   displ. norm   :     0.1336900 α      lambda       -0.3063256E-04
   maximum displ.:     0.0708887 α      in ANC's #3, #2, #5, ...

........................................................................
.............................. CYCLE   37 ..............................
........................................................................
   1    -39.2051265 -0.392051E+02  0.810E-02    3.00       0.0  T
   2    -39.2051291 -0.257015E-05  0.421E-02    3.00       1.0  T
   3    -39.2051259  0.324256E-05  0.137E-02    3.00       1.4  T
   4    -39.2051303 -0.444532E-05  0.444E-03    3.00       4.2  T
   5    -39.2051304 -0.998312E-07  0.102E-03    3.00      18.3  T
   6    -39.2051304 -0.121904E-07  0.371E-04    3.00      50.0  T
   7    -39.2051304 -0.137459E-08  0.194E-04    3.00      95.8  T
     SCC iter.                  ...        0 min,  0.009 sec
     gradient                   ...        0 min,  0.016 sec
 * total energy  :   -38.6358527 Eh     change       -0.2179656E-04 Eh
   gradient norm :     0.0017977 Eh/α   predicted    -0.1559051E-04 ( -28.47%)
   displ. norm   :     0.1341359 α      lambda       -0.2083919E-04
   maximum displ.:     0.0655942 α      in ANC's #2, #3, #4, ...

........................................................................
.............................. CYCLE   38 ..............................
........................................................................
   1    -39.2053632 -0.392054E+02  0.729E-02    3.00       0.0  T
   2    -39.2053652 -0.204946E-05  0.388E-02    3.00       1.0  T
   3    -39.2053652  0.400341E-09  0.703E-03    3.00       2.6  T
   4    -39.2053657 -0.452191E-06  0.407E-03    3.00       4.6  T
   5    -39.2053659 -0.226920E-06  0.961E-04    3.00      19.3  T
   6    -39.2053659 -0.144397E-07  0.266E-04    3.00      69.8  T
     SCC iter.                  ...        0 min,  0.008 sec
     gradient                   ...        0 min,  0.016 sec
 * total energy  :   -38.6358711 Eh     change       -0.1838583E-04 Eh
   gradient norm :     0.0014300 Eh/α   predicted    -0.1050795E-04 ( -42.85%)
   displ. norm   :     0.0461193 α      lambda       -0.9301333E-05
   maximum displ.:     0.0334515 α      in ANC's #4, #2, #5, ...

........................................................................
.............................. CYCLE   39 ..............................
........................................................................
   1    -39.2055271 -0.392055E+02  0.233E-02    3.00       0.0  T
   2    -39.2055272 -0.154462E-06  0.131E-02    3.00       1.4  T
   3    -39.2055263  0.984019E-06  0.703E-03    3.00       2.6  T
   4    -39.2055274 -0.118459E-05  0.115E-03    3.00      16.1  T
   5    -39.2055274 -0.530113E-08  0.402E-04    3.00      46.2  T
   6    -39.2055274 -0.532332E-09  0.142E-04    3.00     130.9  T
     SCC iter.                  ...        0 min,  0.008 sec
     gradient                   ...        0 min,  0.016 sec
 * total energy  :   -38.6358818 Eh     change       -0.1064812E-04 Eh
   gradient norm :     0.0009625 Eh/α   predicted    -0.4655574E-05 ( -56.28%)
   displ. norm   :     0.0672417 α      lambda       -0.8928720E-05
   maximum displ.:     0.0432899 α      in ANC's #4, #2, #10, ...

........................................................................
.............................. CYCLE   40 ..............................
........................................................................
   1    -39.2055609 -0.392056E+02  0.267E-02    3.00       0.0  T
   2    -39.2055610 -0.167357E-06  0.154E-02    3.00       1.2  T
   3    -39.2055602  0.815608E-06  0.600E-03    3.00       3.1  T
   4    -39.2055612 -0.946207E-06  0.109E-03    3.00      17.0  T
   5    -39.2055612 -0.671458E-08  0.464E-04    3.00      40.0  T
   6    -39.2055612 -0.671292E-09  0.179E-04    3.00     103.8  T
     SCC iter.                  ...        0 min,  0.008 sec
     gradient                   ...        0 min,  0.016 sec
 * total energy  :   -38.6358912 Eh     change       -0.9395303E-05 Eh
   gradient norm :     0.0008072 Eh/α   predicted    -0.4476765E-05 ( -52.35%)
   displ. norm   :     0.0747562 α      lambda       -0.6092631E-05
   maximum displ.:     0.0511769 α      in ANC's #2, #4, #1, ...

........................................................................
.............................. CYCLE   41 ..............................
........................................................................
   1    -39.2054971 -0.392055E+02  0.277E-02    3.00       0.0  T
   2    -39.2054973 -0.195159E-06  0.156E-02    3.00       1.2  T
   3    -39.2054971  0.205479E-06  0.381E-03    3.00       4.9  T
   4    -39.2054974 -0.275532E-06  0.160E-03    3.00      11.6  T
   5    -39.2054974 -0.141143E-07  0.475E-04    3.00      39.1  T
   6    -39.2054974 -0.410719E-08  0.191E-04    3.00      97.4  T
     SCC iter.                  ...        0 min,  0.008 sec
     gradient                   ...        0 min,  0.016 sec
 * total energy  :   -38.6358970 Eh     change       -0.5842522E-05 Eh
   gradient norm :     0.0007650 Eh/α   predicted    -0.3058359E-05 ( -47.65%)
   displ. norm   :     0.0744107 α      lambda       -0.4756470E-05
   maximum displ.:     0.0535678 α      in ANC's #2, #4, #1, ...

........................................................................
.............................. CYCLE   42 ..............................
........................................................................
   1    -39.2054922 -0.392055E+02  0.307E-02    3.00       0.0  T
   2    -39.2054924 -0.238922E-06  0.164E-02    3.00       1.1  T
   3    -39.2054922  0.172693E-06  0.418E-03    3.00       4.4  T
   4    -39.2054925 -0.249909E-06  0.192E-03    3.00       9.6  T
   5    -39.2054925 -0.224563E-07  0.397E-04    3.00      46.7  T
   6    -39.2054925 -0.246243E-08  0.162E-04    3.00     114.4  T
     SCC iter.                  ...        0 min,  0.008 sec
     gradient                   ...        0 min,  0.016 sec
 * total energy  :   -38.6359017 Eh     change       -0.4711287E-05 Eh
   gradient norm :     0.0007523 Eh/α   predicted    -0.2388513E-05 ( -49.30%)
   displ. norm   :     0.0649571 α      lambda       -0.3297419E-05
   maximum displ.:     0.0478330 α      in ANC's #2, #1, #3, ...

   *** GEOMETRY OPTIMIZATION CONVERGED AFTER 42 ITERATIONS ***

------------------------------------------------------------------------
 total energy gain   :        -0.0103358 Eh       -6.4858 kcal/mol
 total RMSD          :         0.9997197 a0        0.5290 Å
 total power (kW/mol):        -0.6461115 (step)  -18.0923 (real)
------------------------------------------------------------------------

 ANCopt (total)                0 d,  0 h,  0 min,  1.500 sec
 optimizer setup                ...        0 min,  0.000 sec (  0.011%)
 model hessian                  ...        0 min,  0.022 sec (  1.447%)
 ANC generation                 ...        0 min,  0.002 sec (  0.122%)
 coordinate transformation      ...        0 min,  0.001 sec (  0.061%)
 single point calculation       ...        0 min,  1.456 sec ( 97.050%)
 optimization log               ...        0 min,  0.005 sec (  0.319%)
 hessian update                 ...        0 min,  0.001 sec (  0.045%)
 rational function              ...        0 min,  0.012 sec (  0.774%)

================
 final structure:
================
$coord
    2.78297523890387    0.00608068061100   -1.09865698676416      N 
    0.77348413158043   -1.83031603603549   -1.30785295252692      C 
   -0.75768158563855   -2.14313502643708    1.12457051273856      C 
    4.84982531309193   -0.45450479240076    0.42466185154061      C 
    5.79993937719504   -2.75828455198421    1.07564446243180      C 
    8.61708215606744   -2.53395983686663    2.71145943129576      S 
    8.50353133065420    0.70235204899004    2.59188171874427      C 
    6.42924861374582    1.56627898804386    1.34064952214640      C 
    5.88688705548235    4.13521861640547    0.97702325049856      N 
    7.57722404803100    5.58249740020175   -0.60767980426144      C 
    7.03259329435372    5.20324406517893   -3.42074291753015      C 
    3.52959431348515    5.01768752207702    1.61692936169852      C 
    2.45748600077725    7.18935364011334    0.93184410221142      C 
    2.16499923422176    1.81266243515136   -0.98329274566461      H 
    1.61077542831119   -3.63868482859763   -1.85101690794990      H 
   -0.46413636967826   -1.21229585669981   -2.84256497360552      H 
    0.46890159907821   -2.75194579202032    2.65817719587252      H 
   -2.23360069190020   -3.54603185017653    0.86411536673724      H 
   -1.63290777655025   -0.35859747004014    1.65349629936737      H 
    5.07767802991636   -4.59868113583969    0.65027243615168      H 
    9.98123236106862    1.79076915098697    3.44754342065164      H 
    9.50910796038609    4.97951046915622   -0.19357988819794      H 
    7.39780170488702    7.57571993243900   -0.09935778138435      H 
    7.19004443659679    3.21101840682579   -3.90302792686262      H 
    8.37405255083095    6.26790031489854   -4.55411982718160      H 
    5.13174886890509    5.83464217737961   -3.87706752116338      H 
    2.54765015483972    3.77094384273090    2.91346980817054      H 
    3.32774349951906    8.52431912826199   -0.32581311541336      H 
    0.64466269694166    7.70792368516830    1.68401043249186      H 
$end
           -------------------------------------------------
          |                Final Singlepoint                |
           -------------------------------------------------

          ...................................................
          :                      SETUP                      :
          :.................................................:
          :  # basis functions                  74          :
          :  # atomic orbitals                  73          :
          :  # shells                           43          :
          :  # electrons                        72          :
          :  max. iterations                   250          :
          :  Hamiltonian                  GFN2-xTB          :
          :  restarted?                      false          :
          :  GBSA solvation                  false          :
          :  PC potential                    false          :
          :  electronic temp.          300.0000000     K    :
          :  accuracy                    1.0000000          :
          :  -> integral cutoff          0.2500000E+02      :
          :  -> integral neglect         0.1000000E-07      :
          :  -> SCF convergence          0.1000000E-05 Eh   :
          :  -> wf. convergence          0.1000000E-03 e    :
          :  Broyden damping             0.4000000          :
          ...................................................

 iter      E             dE          RMSdq      gap      omega  full diag
   1    -39.2054925 -0.392055E+02  0.725E-05    3.00       0.0  T
   2    -39.2054925 -0.122782E-10  0.327E-05    3.00     568.7  T
   3    -39.2054925 -0.148574E-10  0.310E-05    3.00     598.5  T

   *** convergence criteria satisfied after 3 iterations ***

         #    Occupation            Energy/Eh            Energy/eV
      -------------------------------------------------------------
         1        2.0000           -0.7186667             -19.5559
       ...           ...                  ...                  ...
        30        2.0000           -0.4410168             -12.0007
        31        2.0000           -0.4343836             -11.8202
        32        2.0000           -0.4318873             -11.7523
        33        2.0000           -0.4187859             -11.3957
        34        2.0000           -0.3876165             -10.5476
        35        2.0000           -0.3496546              -9.5146
        36        2.0000           -0.3398775              -9.2485 (HOMO)
        37                         -0.2296771              -6.2498 (LUMO)
        38                         -0.1933537              -5.2614
        39                         -0.1799722              -4.8973
        40                         -0.1471160              -4.0032
        41                         -0.1052504              -2.8640
       ...                                ...                  ...
        73                          0.7031912              19.1348
      -------------------------------------------------------------
                  HL-Gap            0.1102004 Eh            2.9987 eV
             Fermi-level           -0.2847773 Eh           -7.7492 eV

 SCC (total)                   0 d,  0 h,  0 min,  0.032 sec
 SCC setup                      ...        0 min,  0.000 sec (  0.758%)
 Dispersion                     ...        0 min,  0.000 sec (  0.742%)
 integral evaluation            ...        0 min,  0.010 sec ( 31.222%)
 zeroth order Hamiltonian       ...        0 min,  0.000 sec (  0.592%)
 iterations                     ...        0 min,  0.005 sec ( 14.924%)
 molecular gradient             ...        0 min,  0.016 sec ( 50.397%)
 printout                       ...        0 min,  0.000 sec (  1.206%)

         :::::::::::::::::::::::::::::::::::::::::::::::::::::
         ::                     SUMMARY                     ::
         :::::::::::::::::::::::::::::::::::::::::::::::::::::
         :: total energy             -38.635901730823 Eh    ::
         :: gradient norm              0.000752078585 Eh/a0 ::
         :: HOMO-LUMO gap              2.998706108468 eV    ::
         ::.................................................::
         :: SCC energy               -39.205492500990 Eh    ::
         :: -> isotropic ES            0.013034014807 Eh    ::
         :: -> anisotropic ES          0.006960425174 Eh    ::
         :: -> anisotropic XC          0.022152629549 Eh    ::
         :: -> dispersion             -0.028564715732 Eh    ::
         :: repulsion energy           0.569172245053 Eh    ::
         :: add. restraining           0.000000000000 Eh    ::
         :::::::::::::::::::::::::::::::::::::::::::::::::::::

           -------------------------------------------------
          |                Property Printout                |
           -------------------------------------------------

    * Orbital Energies and Occupations

         #    Occupation            Energy/Eh            Energy/eV
      -------------------------------------------------------------
         1        2.0000           -0.7186667             -19.5559
       ...           ...                  ...                  ...
        24        2.0000           -0.4701379             -12.7931
        25        2.0000           -0.4655856             -12.6692
        26        2.0000           -0.4602658             -12.5245
        27        2.0000           -0.4564129             -12.4196
        28        2.0000           -0.4534690             -12.3395
        29        2.0000           -0.4437401             -12.0748
        30        2.0000           -0.4410168             -12.0007
        31        2.0000           -0.4343836             -11.8202
        32        2.0000           -0.4318873             -11.7523
        33        2.0000           -0.4187859             -11.3957
        34        2.0000           -0.3876165             -10.5476
        35        2.0000           -0.3496546              -9.5146
        36        2.0000           -0.3398775              -9.2485 (HOMO)
        37                         -0.2296771              -6.2498 (LUMO)
        38                         -0.1933537              -5.2614
        39                         -0.1799722              -4.8973
        40                         -0.1471160              -4.0032
        41                         -0.1052504              -2.8640
        42                          0.0008305               0.0226
        43                          0.0262138               0.7133
        44                          0.0364303               0.9913
        45                          0.0413055               1.1240
        46                          0.0472914               1.2869
        47                          0.0962498               2.6191
       ...                                ...                  ...
        73                          0.7031912              19.1348
      -------------------------------------------------------------
                  HL-Gap            0.1102004 Eh            2.9987 eV
             Fermi-level           -0.2847773 Eh           -7.7492 eV

     #   Z        covCN         q      C6AA      α(0)
     1   7 N      2.684    -0.205    25.455     7.493
     2   6 C      3.738     0.011    20.474     6.457
     3   6 C      3.751    -0.111    22.690     6.793
     4   6 C      3.077     0.048    26.843     8.494
     5   6 C      2.937    -0.060    29.485     8.905
     6  16 S      2.283    -0.067   143.840    20.186
     7   6 C      2.932    -0.040    28.983     8.829
     8   6 C      3.121     0.026    27.240     8.548
     9   7 N      2.737    -0.091    23.025     7.127
    10   6 C      3.747     0.005    20.557     6.467
    11   6 C      3.751    -0.110    22.664     6.789
    12   6 C      2.841     0.019    27.588     8.608
    13   6 C      2.837    -0.143    31.674     9.223
    14   1 H      0.860     0.162     1.321     1.801
    15   1 H      0.924     0.043     2.409     2.427
    16   1 H      0.924     0.038     2.477     2.461
    17   1 H      0.925     0.042     2.424     2.435
    18   1 H      0.925     0.039     2.457     2.451
    19   1 H      0.925     0.036     2.496     2.471
    20   1 H      0.927     0.036     2.504     2.474
    21   1 H      0.926     0.040     2.444     2.445
    22   1 H      0.924     0.039     2.463     2.454
    23   1 H      0.924     0.047     2.359     2.402
    24   1 H      0.925     0.043     2.410     2.428
    25   1 H      0.925     0.039     2.462     2.454
    26   1 H      0.925     0.044     2.401     2.423
    27   1 H      0.925     0.026     2.648     2.545
    28   1 H      0.926     0.023     2.685     2.563
    29   1 H      0.926     0.021     2.719     2.578

 Mol. C6AA /au·bohr⁶  :       9441.481964
 Mol. C8AA /au·bohr⁸  :     238263.156056
 Mol. α(0) /au        :        152.730104


Wiberg/Mayer (AO) data.
largest (>0.10) Wiberg bond orders for each atom
          total WBO             WBO to atom ...
     1  N   3.291        C    4 1.132    C    2 1.006    H   14 0.932    C    5 0.103
     2  C   3.981        N    1 1.006    C    3 1.005    H   16 0.975    H   15 0.971
     3  C   3.996        C    2 1.005    H   19 0.988    H   17 0.987    H   18 0.986
     4  C   3.973        C    5 1.542    C    8 1.155    N    1 1.132
     5  C   3.916        C    4 1.542    S    6 1.146    H   20 0.970    C    7 0.108    N    1 0.103
     6  S   2.595        C    7 1.185    C    5 1.146    C    8 0.102
     7  C   3.944        C    8 1.583    S    6 1.185    H   21 0.970    C    5 0.108
     8  C   3.963        C    7 1.583    C    4 1.155    N    9 1.034    S    6 0.102
     9  N   3.444        C   12 1.146    C    8 1.034    C   10 0.986    C   13 0.147
    10  C   3.979        C   11 1.006    N    9 0.986    H   22 0.973    H   23 0.969
    11  C   3.996        C   10 1.006    H   24 0.987    H   26 0.986    H   25 0.985
    12  C   3.970        C   13 1.802    N    9 1.146    H   27 0.959
    13  C   3.961        C   12 1.802    H   29 0.979    H   28 0.974    N    9 0.147
    14  H   0.974        N    1 0.932
    15  H   0.998        C    2 0.971
    16  H   0.998        C    2 0.975
    17  H   0.998        C    3 0.987
    18  H   0.998        C    3 0.986
    19  H   0.999        C    3 0.988
    20  H   0.998        C    5 0.970
    21  H   0.998        C    7 0.970
    22  H   0.998        C   10 0.973
    23  H   0.997        C   10 0.969
    24  H   0.998        C   11 0.987
    25  H   0.998        C   11 0.985
    26  H   0.998        C   11 0.986
    27  H   0.999        C   12 0.959
    28  H   0.999        C   13 0.974
    29  H   0.999        C   13 0.979

molecular dipole:
                 x           y           z       tot (Debye)
 q only:       -0.303       0.057      -0.430
   full:       -0.570       0.311      -0.419       1.964
molecular quadrupole (traceless):
                xx          xy          yy          xz          yz          zz
 q only:       -0.463       6.451      -0.292      -3.634      -1.096       0.755
  q+dip:       -2.659       9.116       3.045      -4.606      -0.493      -0.386
   full:       -2.631       9.885       2.234      -4.966      -0.090       0.397

           -------------------------------------------------
          |                Geometry Summary                 |
           -------------------------------------------------

      molecular mass/u    :      196.3098000
   center of mass at/Å    :        2.7282767       0.6186905       0.3388660
  moments of inertia/u·Å² :        0.6477206E+03   0.8296301E+03   0.1216782E+04
rotational constants/cm⁻¹ :        0.2602609E-01   0.2031946E-01   0.1385428E-01

 * 29 selected distances

     #   Z        #   Z                                     value/Å
     1   7 N      2   6 C                                 1.4447770
     2   6 C      3   6 C                                 1.5299546
     1   7 N      4   6 C                                 1.3803828
     4   6 C      5   6 C                                 1.3629675
     5   6 C      6  16 S                                 1.7279486 (max)
     6  16 S      7   6 C                                 1.7148044
     4   6 C      8   6 C                                 1.4411877
     7   6 C      8   6 C                                 1.3609839
     8   6 C      9   7 N                                 1.4026523
     9   7 N     10   6 C                                 1.4456459
    10   6 C     11   6 C                                 1.5294761
     9   7 N     12   6 C                                 1.3743397
    12   6 C     13   6 C                                 1.3318974
     1   7 N     14   1 H                                 1.0122292 (min)
     2   6 C     15   1 H                                 1.0930145
     2   6 C     16   1 H                                 1.0933620
     3   6 C     17   1 H                                 1.0879846
     3   6 C     18   1 H                                 1.0863345
     3   6 C     19   1 H                                 1.0884030
     5   6 C     20   1 H                                 1.0701506
     7   6 C     21   1 H                                 1.0715557
    10   6 C     22   1 H                                 1.0931382
    10   6 C     23   1 H                                 1.0926607
    11   6 C     24   1 H                                 1.0878876
    11   6 C     25   1 H                                 1.0867540
    11   6 C     26   1 H                                 1.0870833
    12   6 C     27   1 H                                 1.0844392
    13   6 C     28   1 H                                 1.0742667
    13   6 C     29   1 H                                 1.0742425

 * 5 distinct bonds (by element types)

   Z      Z             #   av. dist./Å        max./Å        min./Å
   1 H    6 C          15     1.0847518     1.0933620     1.0701506
   6 C    6 C           6     1.4260779     1.5299546     1.3318974
   1 H    7 N           1     1.0122292     1.0122292     1.0122292
   6 C    7 N           5     1.4095596     1.4456459     1.3743397
   6 C   16 S           2     1.7213765     1.7279486     1.7148044


optimized geometry written to: xtbopt.xyz


           -------------------------------------------------
          | TOTAL ENERGY              -38.635901730823 Eh   |
          | GRADIENT NORM               0.000752078585 Eh/α |
          | HOMO-LUMO GAP               2.998706108468 eV   |
           -------------------------------------------------

------------------------------------------------------------------------
 * finished run on 2021/05/19 at 10:58:33.504     
------------------------------------------------------------------------
 total:
 * wall-time:     0 d,  0 h,  0 min,  1.600 sec
 *  cpu-time:     0 d,  0 h,  0 min,  1.596 sec
 * ratio c/w:     0.998 speedup
 SCF:
 * wall-time:     0 d,  0 h,  0 min,  0.044 sec
 *  cpu-time:     0 d,  0 h,  0 min,  0.044 sec
 * ratio c/w:     1.000 speedup
 ANC optimizer:
 * wall-time:     0 d,  0 h,  0 min,  1.532 sec
 *  cpu-time:     0 d,  0 h,  0 min,  1.529 sec
 * ratio c/w:     0.998 speedup

