      -----------------------------------------------------------      
     |                   =====================                   |     
     |                           x T B                           |     
     |                   =====================                   |     
     |                         S. Grimme                         |     
     |          Mulliken Center for Theoretical Chemistry        |     
     |                    University of Bonn                     |     
     |                Version 6.2 RC2 (SAW190805)                |     
      -----------------------------------------------------------      

   This program is distributed in the hope that it will be useful,
   but WITHOUT ANY WARRANTY; without even the implied warranty of
   MERCHANTABILITY or FITNESS FOR A PARTICULAR PURPOSE.
   
   FOR NON-COMMERCIAL, ACADEMIA USE ONLY.
   
   Cite this work as:
   * S. Grimme, C. Bannwarth, P. Shushkov, J. Chem. Theory Comput., 2017,
     13, 1989-2009. DOI: 10.1021/acs.jctc.7b00118
   * C. Bannwarth, S. Ehlert and S. Grimme., J. Chem. Theory Comput., 2019,
     15, 1652-1671. DOI: 10.1021/acs.jctc.8b01176
   * P. Pracht, E. Caldeweyher, S. Ehlert, S. Grimme, ChemRxiv, 2019, preprint.
     DOI: 10.26434/chemrxiv.8326202.v1
   
   for DFT-D4:
   * E. Caldeweyher, C. Bannwarth and S. Grimme, J. Chem. Phys., 2017,
     147, 034112. DOI: 10.1063/1.4993215
   * E. Caldeweyher, S. Ehlert, A. Hansen, H. Neugebauer, S. Spicher,
     C. Bannwarth and S. Grimme, J. Chem. Phys., 2019, 150, 154122.
     DOI: 10.1063/1.5090222
   
   for sTDA-xTB:
   * S. Grimme and C. Bannwarth, J. Chem. Phys., 2016, 145, 054103.
     DOI: 10.1063/1.4959605
   
   in the mass-spec context:
   * V. Asgeirsson, C. Bauer and S. Grimme, Chem. Sci., 2017, 8, 4879.
     DOI: 10.1039/c7sc00601b
   
   for metadynamics refer to:
   * S. Grimme, J. Chem. Theory Comput., 2019, 155, 2847-2862
     DOI: 10.1021/acs.jctc.9b00143
   
   with help from (in alphabetical order)
   C. Bannwarth, F. Bohle, G. Brandenburg, E. Caldeweyher, M. Checinski,
   S. Dohm, S. Ehlert, S. Ehrlich, F. März, H. Neugebauer, J. Pisarek,
   P. Pracht, P. Shushkov, and S. Spicher.
   
 * started run on 2021/05/19 at 11:00:45.376     

           -------------------------------------------------
          |                Calculation Setup                |
           -------------------------------------------------

          program call               : /ihome/ghutchison/geoffh/xtb/xtb 1021.xyz -opt
          hostname                   : smp-n144
          coordinate file            : 1021.xyz
          omp threads                :                     1
          number of atoms            :                    22
          number of electrons        :                    78
          charge                     :                     0
          spin                       :                   0.0
          first test random number   :      0.05108916682311


########################################################################
# WARNING! Please study the warnings concerning your input carefully
#  - the use of '-opt' is discouraged, please use '--opt' next time
########################################################################

           ------------------------------------------------- 
          |                 G F N 2 - x T B                 |
          | Geometry, Frequencies, Noncovalent interactions |
          |            JCTC 2019 parametrisation            |
           ------------------------------------------------- 
             KAB for C  - Si     :                1.0500
             KAB for H  - Pd     :                0.9500
             k(s)              :                1.8500
             k(p)              :                2.2300
             k(d)              :                2.2300
             k(f)              :                2.0000
             kEN (H0ij)        :               -2.0000
             D4 a1             :                0.5200
             D4 a2             :                5.0000
             D4 s6             :                1.0000
             D4 s8             :                2.7000
             D4 s9             :                5.0000
             alphaj            :                2.0000

  Z AO/shell   Hii/eV     exponent
  1     Wed Apr 25 08:07:45 CEST 2018   EN: 2.200 GM2: 0.406  GM3: 0.0800  RAES: 1.40
     1s    -10.707211    1.230000
  6     Wed Apr 25 08:07:45 CEST 2018   EN: 2.550 GM2: 0.538  GM3: 0.1500  RAES: 3.00
     2s    -13.970922    2.096432
     2p    -10.063292    1.800000
  8     Wed Apr 25 08:07:45 CEST 2018   EN: 3.440 GM2: 0.452  GM3:-0.0517  RAES: 1.80
     2s    -20.229985    2.439742
     2p    -15.503117    2.137023

           ------------------------------------------------- 
          |        Self-Consistent Charge Iterations        |
           ------------------------------------------------- 

          ...................................................
          :                      SETUP                      :
          :.................................................:
          :  # basis functions                  70          :
          :  # atomic orbitals                  70          :
          :  # shells                           38          :
          :  # electrons                        78          :
          :  max. iterations                   250          :
          :  Hamiltonian                  GFN2-xTB          :
          :  restarted?                      false          :
          :  GBSA solvation                  false          :
          :  PC potential                    false          :
          :  electronic temp.          300.0000000     K    :
          :  accuracy                    1.0000000          :
          :  -> integral cutoff          0.2500000E+02      :
          :  -> integral neglect         0.1000000E-07      :
          :  -> SCF convergence          0.1000000E-05 Eh   :
          :  -> wf. convergence          0.1000000E-03 e    :
          :  Broyden damping             0.4000000          :
          ...................................................

 iter      E             dE          RMSdq      gap      omega  full diag
   1    -45.4784324 -0.454784E+02  0.602E+00    2.16       0.0  T
   2    -45.5527024 -0.742700E-01  0.312E+00    1.70       1.0  T
   3    -45.5530563 -0.353916E-03  0.199E+00    1.96       1.0  T
   4    -45.5724340 -0.193777E-01  0.211E-01    1.81       1.0  T
   5    -45.5732470 -0.813024E-03  0.793E-02    1.83       1.0  T
   6    -45.5732465  0.497312E-06  0.406E-02    1.83       1.0  T
   7    -45.5732615 -0.150068E-04  0.901E-03    1.83       2.4  T
   8    -45.5732616 -0.802049E-07  0.441E-03    1.83       4.8  T
   9    -45.5732619 -0.296014E-06  0.107E-03    1.83      20.0  T
  10    -45.5732619 -0.130221E-07  0.669E-04    1.83      31.9  T
  11    -45.5732619 -0.324371E-08  0.613E-05    1.83     348.0  T

   *** convergence criteria satisfied after 11 iterations ***

         #    Occupation            Energy/Eh            Energy/eV
      -------------------------------------------------------------
         1        2.0000           -0.7452104             -20.2782
       ...           ...                  ...                  ...
        33        2.0000           -0.4885750             -13.2948
        34        2.0000           -0.4706227             -12.8063
        35        2.0000           -0.4689052             -12.7596
        36        2.0000           -0.4408851             -11.9971
        37        2.0000           -0.4352836             -11.8447
        38        2.0000           -0.4342729             -11.8172
        39        2.0000           -0.4235340             -11.5249 (HOMO)
        40                         -0.3563215              -9.6960 (LUMO)
        41                         -0.3269639              -8.8971
        42                         -0.3105548              -8.4506
        43                         -0.2610074              -7.1024
        44                         -0.2295670              -6.2468
       ...                                ...                  ...
        70                          0.6820046              18.5583
      -------------------------------------------------------------
                  HL-Gap            0.0672125 Eh            1.8289 eV
             Fermi-level           -0.3899277 Eh          -10.6105 eV

 SCC (total)                   0 d,  0 h,  0 min,  0.038 sec
 SCC setup                      ...        0 min,  0.000 sec (  0.789%)
 Dispersion                     ...        0 min,  0.000 sec (  1.010%)
 integral evaluation            ...        0 min,  0.009 sec ( 25.063%)
 zeroth order Hamiltonian       ...        0 min,  0.000 sec (  0.452%)
 iterations                     ...        0 min,  0.013 sec ( 35.280%)
 molecular gradient             ...        0 min,  0.014 sec ( 36.301%)
 printout                       ...        0 min,  0.000 sec (  0.965%)

         :::::::::::::::::::::::::::::::::::::::::::::::::::::
         ::                     SUMMARY                     ::
         :::::::::::::::::::::::::::::::::::::::::::::::::::::
         :: total energy             -44.987327744928 Eh    ::
         :: gradient norm              0.080506674749 Eh/a0 ::
         :: HOMO-LUMO gap              1.828946294845 eV    ::
         ::.................................................::
         :: SCC energy               -45.573261938896 Eh    ::
         :: -> isotropic ES            0.093791782093 Eh    ::
         :: -> anisotropic ES         -0.001448393708 Eh    ::
         :: -> anisotropic XC          0.009694593559 Eh    ::
         :: -> dispersion             -0.023505176416 Eh    ::
         :: repulsion energy           0.585917141474 Eh    ::
         :: add. restraining           0.000000000000 Eh    ::
         :::::::::::::::::::::::::::::::::::::::::::::::::::::

      ----------------------------------------------------------- 
     |                   =====================                   |
     |                        A N C O P T                        |
     |                   =====================                   |
     |               Approximate Normal Coordinate               |
     |                Rational Function Optimizer                |
      ----------------------------------------------------------- 

          ...................................................
          :                      SETUP                      :
          :.................................................:
          :   optimization level            normal          :
          :   max. optcycles                   200          :
          :   ANC micro-cycles                  20          :
          :   degrees of freedom                60          :
          :.................................................:
          :   RF solver                   davidson          :
          :   input Hessian                  false          :
          :   write xtbopt.log                true          :
          :   linear?                        false          :
          :   energy convergence         0.5000000E-05 Eh   :
          :   grad. convergence          0.1000000E-02 Eh/α :
          :   maximium RF displ.         2.0000000          :
          :   Hlow (freq-cutoff)         0.5000000E-02      :
          :   Hmax (freq-cutoff)         5.0000000          :
          :   S6 in model hess.         20.0000000          :
          ...................................................

generating ANC from model Hessian ...
Using Lindh-Hessian (1995)
 Shifting diagonal of input Hessian by   2.499981413081922E-003
 Lowest  eigenvalues of input Hessian
   -0.000000   -0.000000    0.000000    0.000000    0.000000    0.000000
    0.005000    0.006382    0.011631    0.013368    0.016364    0.019107
    0.024821    0.034922    0.042418    0.047757    0.056594    0.060054
 Highest eigenvalues
    1.965755    2.049380    2.207843    2.216918    2.220402    2.241772
 

........................................................................
.............................. CYCLE    1 ..............................
........................................................................
   1    -45.5732619 -0.455733E+02  0.298E-05    1.83       0.0  T
   2    -45.5732619 -0.287059E-11  0.167E-05    1.83    1279.2  T
   3    -45.5732619 -0.106581E-11  0.984E-06    1.83    2166.8  T
     SCC iter.                  ...        0 min,  0.004 sec
     gradient                   ...        0 min,  0.013 sec
 * total energy  :   -44.9873277 Eh     change       -0.1117904E-08 Eh
   gradient norm :     0.0805068 Eh/α   predicted     0.0000000E+00 (-100.00%)
   displ. norm   :     0.2011265 α      lambda       -0.7329348E-02
   maximum displ.:     0.1322634 α      in ANC's #28, #9, #1, ...

........................................................................
.............................. CYCLE    2 ..............................
........................................................................
   1    -45.5795982 -0.455796E+02  0.236E-01    1.84       0.0  T
   2    -45.5797731 -0.174935E-03  0.143E-01    1.85       1.0  T
   3    -45.5797787 -0.557692E-05  0.603E-02    1.85       1.0  T
   4    -45.5797849 -0.621460E-05  0.855E-03    1.85       2.5  T
   5    -45.5797855 -0.539682E-06  0.327E-03    1.85       6.5  T
   6    -45.5797855 -0.527587E-07  0.104E-03    1.85      20.5  T
     SCC iter.                  ...        0 min,  0.007 sec
     gradient                   ...        0 min,  0.013 sec
 * total energy  :   -44.9923588 Eh     change       -0.5031012E-02 Eh
   gradient norm :     0.0319960 Eh/α   predicted    -0.3812919E-02 ( -24.21%)
   displ. norm   :     0.1674671 α      lambda       -0.2007390E-02
   maximum displ.:     0.1296585 α      in ANC's #9, #28, #1, ...

........................................................................
.............................. CYCLE    3 ..............................
........................................................................
   1    -45.5822582 -0.455823E+02  0.165E-01    1.87       0.0  T
   2    -45.5823238 -0.655486E-04  0.994E-02    1.88       1.0  T
   3    -45.5823248 -0.104863E-05  0.384E-02    1.87       1.0  T
   4    -45.5823284 -0.360407E-05  0.562E-03    1.87       3.8  T
   5    -45.5823287 -0.315767E-06  0.275E-03    1.87       7.7  T
     SCC iter.                  ...        0 min,  0.006 sec
     gradient                   ...        0 min,  0.013 sec
 * total energy  :   -44.9934191 Eh     change       -0.1060355E-02 Eh
   gradient norm :     0.0037655 Eh/α   predicted    -0.1031846E-02 (  -2.69%)
   displ. norm   :     0.0647572 α      lambda       -0.7972016E-04
   maximum displ.:     0.0553427 α      in ANC's #1, #3, #9, ...

........................................................................
.............................. CYCLE    4 ..............................
........................................................................
   1    -45.5814881 -0.455815E+02  0.415E-02    1.88       0.0  T
   2    -45.5814885 -0.364552E-06  0.254E-02    1.88       1.0  T
   3    -45.5814883  0.186450E-06  0.489E-03    1.88       4.4  T
   4    -45.5814887 -0.391019E-06  0.133E-03    1.88      16.0  T
   5    -45.5814887 -0.120654E-08  0.645E-04    1.88      33.1  T
   6    -45.5814887 -0.377129E-08  0.207E-04    1.88     102.9  T
     SCC iter.                  ...        0 min,  0.007 sec
     gradient                   ...        0 min,  0.013 sec
 * total energy  :   -44.9934684 Eh     change       -0.4927534E-04 Eh
   gradient norm :     0.0020154 Eh/α   predicted    -0.4003274E-04 ( -18.76%)
   displ. norm   :     0.0543066 α      lambda       -0.3299580E-04
   maximum displ.:     0.0495240 α      in ANC's #1, #5, #20, ...

........................................................................
.............................. CYCLE    5 ..............................
........................................................................
   1    -45.5811372 -0.455811E+02  0.298E-02    1.88       0.0  T
   2    -45.5811374 -0.174770E-06  0.180E-02    1.88       1.2  T
   3    -45.5811373  0.672802E-07  0.287E-03    1.88       7.4  T
   4    -45.5811374 -0.144644E-06  0.923E-04    1.87      23.1  T
   5    -45.5811374 -0.294682E-08  0.494E-04    1.88      43.2  T
     SCC iter.                  ...        0 min,  0.006 sec
     gradient                   ...        0 min,  0.013 sec
 * total energy  :   -44.9934928 Eh     change       -0.2442190E-04 Eh
   gradient norm :     0.0014531 Eh/α   predicted    -0.1655048E-04 ( -32.23%)
   displ. norm   :     0.0718452 α      lambda       -0.1931570E-04
   maximum displ.:     0.0662342 α      in ANC's #1, #3, #5, ...

........................................................................
.............................. CYCLE    6 ..............................
........................................................................
   1    -45.5814133 -0.455814E+02  0.364E-02    1.87       0.0  T
   2    -45.5814136 -0.200646E-06  0.220E-02    1.87       1.0  T
   3    -45.5814136 -0.725714E-07  0.197E-03    1.87      10.8  T
   4    -45.5814137 -0.301186E-07  0.107E-03    1.87      20.0  T
   5    -45.5814137 -0.162020E-08  0.490E-04    1.87      43.5  T
   6    -45.5814137 -0.212261E-08  0.152E-04    1.87     140.2  T
     SCC iter.                  ...        0 min,  0.007 sec
     gradient                   ...        0 min,  0.013 sec
 * total energy  :   -44.9935152 Eh     change       -0.2242379E-04 Eh
   gradient norm :     0.0012445 Eh/α   predicted    -0.9682174E-05 ( -56.82%)
   displ. norm   :     0.0567811 α      lambda       -0.1261749E-04
   maximum displ.:     0.0515376 α      in ANC's #1, #3, #8, ...

........................................................................
.............................. CYCLE    7 ..............................
........................................................................
   1    -45.5816160 -0.455816E+02  0.293E-02    1.87       0.0  T
   2    -45.5816161 -0.107768E-06  0.177E-02    1.87       1.2  T
   3    -45.5816162 -0.320150E-07  0.163E-03    1.87      13.1  T
   4    -45.5816162 -0.288388E-07  0.857E-04    1.87      24.9  T
   5    -45.5816162 -0.178265E-08  0.372E-04    1.87      57.4  T
     SCC iter.                  ...        0 min,  0.006 sec
     gradient                   ...        0 min,  0.013 sec
 * total energy  :   -44.9935306 Eh     change       -0.1540684E-04 Eh
   gradient norm :     0.0006335 Eh/α   predicted    -0.6318335E-05 ( -58.99%)
   displ. norm   :     0.0555461 α      lambda       -0.8457493E-05
   maximum displ.:     0.0480778 α      in ANC's #1, #3, #8, ...

........................................................................
.............................. CYCLE    8 ..............................
........................................................................
   1    -45.5816205 -0.455816E+02  0.275E-02    1.87       0.0  T
   2    -45.5816205 -0.675575E-07  0.165E-02    1.87       1.3  T
   3    -45.5816206 -0.321604E-07  0.110E-03    1.87      19.3  T
   4    -45.5816206 -0.632792E-08  0.674E-04    1.87      31.6  T
   5    -45.5816206 -0.219668E-08  0.210E-04    1.87     101.6  T
     SCC iter.                  ...        0 min,  0.006 sec
     gradient                   ...        0 min,  0.013 sec
 * total energy  :   -44.9935413 Eh     change       -0.1061871E-04 Eh
   gradient norm :     0.0005849 Eh/α   predicted    -0.4235743E-05 ( -60.11%)
   displ. norm   :     0.0627118 α      lambda       -0.7727083E-05
   maximum displ.:     0.0524782 α      in ANC's #1, #3, #5, ...

........................................................................
.............................. CYCLE    9 ..............................
........................................................................
   1    -45.5816305 -0.455816E+02  0.317E-02    1.87       0.0  T
   2    -45.5816306 -0.102160E-06  0.190E-02    1.87       1.1  T
   3    -45.5816307 -0.590663E-07  0.126E-03    1.87      17.0  T
   4    -45.5816307 -0.195875E-08  0.759E-04    1.87      28.1  T
   5    -45.5816307 -0.450586E-08  0.243E-04    1.87      87.8  T
     SCC iter.                  ...        0 min,  0.006 sec
     gradient                   ...        0 min,  0.013 sec
 * total energy  :   -44.9935510 Eh     change       -0.9703371E-05 Eh
   gradient norm :     0.0006655 Eh/α   predicted    -0.3874619E-05 ( -60.07%)
   displ. norm   :     0.1187186 α      lambda       -0.1195805E-04
   maximum displ.:     0.0924205 α      in ANC's #1, #3, #5, ...

........................................................................
.............................. CYCLE   10 ..............................
........................................................................
   1    -45.5815127 -0.455815E+02  0.596E-02    1.87       0.0  T
   2    -45.5815130 -0.325004E-06  0.356E-02    1.87       1.0  T
   3    -45.5815132 -0.178091E-06  0.213E-03    1.87      10.0  T
   4    -45.5815132 -0.446953E-08  0.124E-03    1.87      17.3  T
   5    -45.5815132 -0.113740E-07  0.506E-04    1.87      42.2  T
   6    -45.5815132 -0.263270E-08  0.238E-04    1.87      89.6  T
     SCC iter.                  ...        0 min,  0.007 sec
     gradient                   ...        0 min,  0.013 sec
 * total energy  :   -44.9935631 Eh     change       -0.1209731E-04 Eh
   gradient norm :     0.0010582 Eh/α   predicted    -0.6019816E-05 ( -50.24%)
   displ. norm   :     0.1288318 α      lambda       -0.9991813E-05
   maximum displ.:     0.1001960 α      in ANC's #1, #3, #5, ...

........................................................................
.............................. CYCLE   11 ..............................
........................................................................
   1    -45.5813024 -0.455813E+02  0.675E-02    1.87       0.0  T
   2    -45.5813029 -0.522687E-06  0.405E-02    1.87       1.0  T
   3    -45.5813032 -0.319605E-06  0.271E-03    1.87       7.9  T
   4    -45.5813032 -0.124947E-07  0.151E-03    1.87      14.1  T
   5    -45.5813032 -0.686059E-08  0.600E-04    1.87      35.5  T
   6    -45.5813032 -0.470568E-08  0.273E-04    1.87      78.1  T
     SCC iter.                  ...        0 min,  0.007 sec
     gradient                   ...        0 min,  0.013 sec
 * total energy  :   -44.9935713 Eh     change       -0.8268946E-05 Eh
   gradient norm :     0.0011933 Eh/α   predicted    -0.5035282E-05 ( -39.11%)
   displ. norm   :     0.0405111 α      lambda       -0.4662493E-05
   maximum displ.:     0.0245832 α      in ANC's #1, #5, #7, ...

........................................................................
.............................. CYCLE   12 ..............................
........................................................................
   1    -45.5816914 -0.455817E+02  0.248E-02    1.87       0.0  T
   2    -45.5816915 -0.106374E-06  0.150E-02    1.87       1.4  T
   3    -45.5816916 -0.608251E-07  0.130E-03    1.87      16.4  T
   4    -45.5816916 -0.853370E-08  0.814E-04    1.87      26.2  T
   5    -45.5816916 -0.109875E-08  0.407E-04    1.87      52.4  T
     SCC iter.                  ...        0 min,  0.006 sec
     gradient                   ...        0 min,  0.013 sec
 * total energy  :   -44.9935765 Eh     change       -0.5128094E-05 Eh
   gradient norm :     0.0006090 Eh/α   predicted    -0.2334471E-05 ( -54.48%)
   displ. norm   :     0.0398653 α      lambda       -0.1866385E-05
   maximum displ.:     0.0236540 α      in ANC's #5, #1, #7, ...

........................................................................
.............................. CYCLE   13 ..............................
........................................................................
   1    -45.5820433 -0.455820E+02  0.247E-02    1.87       0.0  T
   2    -45.5820434 -0.105652E-06  0.150E-02    1.87       1.4  T
   3    -45.5820435 -0.662790E-07  0.124E-03    1.87      17.2  T
   4    -45.5820435 -0.533004E-08  0.773E-04    1.87      27.6  T
   5    -45.5820435 -0.673623E-09  0.338E-04    1.87      63.1  T
     SCC iter.                  ...        0 min,  0.006 sec
     gradient                   ...        0 min,  0.013 sec
 * total energy  :   -44.9935782 Eh     change       -0.1696421E-05 Eh
   gradient norm :     0.0010505 Eh/α   predicted    -0.9364871E-06 ( -44.80%)
   displ. norm   :     0.0662218 α      lambda       -0.4186572E-05
   maximum displ.:     0.0427474 α      in ANC's #5, #1, #3, ...

........................................................................
.............................. CYCLE   14 ..............................
........................................................................
   1    -45.5817682 -0.455818E+02  0.388E-02    1.87       0.0  T
   2    -45.5817684 -0.207311E-06  0.234E-02    1.87       1.0  T
   3    -45.5817685 -0.111581E-06  0.180E-03    1.87      11.9  T
   4    -45.5817685 -0.169049E-07  0.114E-03    1.87      18.7  T
   5    -45.5817685 -0.327711E-08  0.570E-04    1.87      37.4  T
   6    -45.5817685 -0.450982E-08  0.153E-04    1.87     139.5  T
     SCC iter.                  ...        0 min,  0.007 sec
     gradient                   ...        0 min,  0.013 sec
 * total energy  :   -44.9935819 Eh     change       -0.3752029E-05 Eh
   gradient norm :     0.0004349 Eh/α   predicted    -0.2101561E-05 ( -43.99%)
   displ. norm   :     0.0260074 α      lambda       -0.1924255E-05
   maximum displ.:     0.0162543 α      in ANC's #5, #3, #1, ...

   *** GEOMETRY OPTIMIZATION CONVERGED AFTER 14 ITERATIONS ***

------------------------------------------------------------------------
 total energy gain   :        -0.0062542 Eh       -3.9245 kcal/mol
 total RMSD          :         0.1863030 a0        0.0986 Å
 total power (kW/mol):        -1.1728783 (step)  -39.2269 (real)
------------------------------------------------------------------------

 ANCopt (total)                0 d,  0 h,  0 min,  0.419 sec
 optimizer setup                ...        0 min,  0.000 sec (  0.034%)
 model hessian                  ...        0 min,  0.003 sec (  0.771%)
 ANC generation                 ...        0 min,  0.001 sec (  0.148%)
 coordinate transformation      ...        0 min,  0.000 sec (  0.053%)
 single point calculation       ...        0 min,  0.410 sec ( 97.985%)
 optimization log               ...        0 min,  0.001 sec (  0.309%)
 hessian update                 ...        0 min,  0.000 sec (  0.042%)
 rational function              ...        0 min,  0.002 sec (  0.446%)

================
 final structure:
================
$coord
   -0.03372779132035   -2.70142818033898   -0.04614634288640      C 
   -2.26491006269138   -1.32621666846652    0.02013884906533      C 
   -4.89563434509353   -2.30104585121609    0.10655926009280      C 
   -5.53292804028830   -4.47923211646355    0.15470282427149      O 
   -6.62012355816043   -0.00904634986720    0.12702459218857      C 
   -4.90404130238795    2.28922432570809    0.10428663370147      C 
   -5.54927544332538    4.46513458824013    0.15084656046197      O 
   -2.26977300171164    1.32396954691602    0.01933359646062      C 
   -0.04365147160154    2.70729900332836   -0.04757135875146      C 
    2.18761797787523    1.33206535068673   -0.11106511954637      C 
    2.19247729491560   -1.31805931858232   -0.11034703415715      C 
    4.82743014892169   -2.28316604989144   -0.18000607684695      C 
    5.47386314189854   -4.45914350724021   -0.20246208179296      O 
    6.54313418826024    0.01494888339438   -0.21516291786628      C 
    4.81896316524305    2.30681370739081   -0.18165932699398      C 
    5.45740949261703    4.48514833797979   -0.20492300073547      O 
   -0.02997157729150   -4.74087037772721   -0.04470959798543      H 
   -7.84606978185838   -0.01060429943901    1.78677846337798      H 
   -7.86434376174509   -0.01207016572498   -1.52007371500612      H 
   -0.04737554580927    4.74672936043058   -0.04810443689480      H 
    7.74836771012344    0.01660488152090   -1.89043843358533      H 
    7.80785506409408    0.01778139668213    1.41534774244972      H 
$end
           -------------------------------------------------
          |                Final Singlepoint                |
           -------------------------------------------------

          ...................................................
          :                      SETUP                      :
          :.................................................:
          :  # basis functions                  70          :
          :  # atomic orbitals                  70          :
          :  # shells                           38          :
          :  # electrons                        78          :
          :  max. iterations                   250          :
          :  Hamiltonian                  GFN2-xTB          :
          :  restarted?                      false          :
          :  GBSA solvation                  false          :
          :  PC potential                    false          :
          :  electronic temp.          300.0000000     K    :
          :  accuracy                    1.0000000          :
          :  -> integral cutoff          0.2500000E+02      :
          :  -> integral neglect         0.1000000E-07      :
          :  -> SCF convergence          0.1000000E-05 Eh   :
          :  -> wf. convergence          0.1000000E-03 e    :
          :  Broyden damping             0.4000000          :
          ...................................................

 iter      E             dE          RMSdq      gap      omega  full diag
   1    -45.5817685 -0.455818E+02  0.742E-05    1.87       0.0  T
   2    -45.5817685 -0.437907E-10  0.379E-05    1.87     562.5  T
   3    -45.5817685 -0.301625E-10  0.211E-05    1.87    1011.8  T

   *** convergence criteria satisfied after 3 iterations ***

         #    Occupation            Energy/Eh            Energy/eV
      -------------------------------------------------------------
         1        2.0000           -0.7473265             -20.3358
       ...           ...                  ...                  ...
        33        2.0000           -0.4870380             -13.2530
        34        2.0000           -0.4681298             -12.7385
        35        2.0000           -0.4672724             -12.7151
        36        2.0000           -0.4404956             -11.9865
        37        2.0000           -0.4347657             -11.8306
        38        2.0000           -0.4328452             -11.7783
        39        2.0000           -0.4204826             -11.4419 (HOMO)
        40                         -0.3517267              -9.5710 (LUMO)
        41                         -0.3218542              -8.7581
        42                         -0.3058755              -8.3233
        43                         -0.2582672              -7.0278
        44                         -0.2280803              -6.2064
       ...                                ...                  ...
        70                          0.7015372              19.0898
      -------------------------------------------------------------
                  HL-Gap            0.0687559 Eh            1.8709 eV
             Fermi-level           -0.3861047 Eh          -10.5064 eV

 SCC (total)                   0 d,  0 h,  0 min,  0.028 sec
 SCC setup                      ...        0 min,  0.000 sec (  0.756%)
 Dispersion                     ...        0 min,  0.000 sec (  0.773%)
 integral evaluation            ...        0 min,  0.009 sec ( 33.166%)
 zeroth order Hamiltonian       ...        0 min,  0.000 sec (  0.544%)
 iterations                     ...        0 min,  0.004 sec ( 14.604%)
 molecular gradient             ...        0 min,  0.013 sec ( 48.798%)
 printout                       ...        0 min,  0.000 sec (  1.166%)

         :::::::::::::::::::::::::::::::::::::::::::::::::::::
         ::                     SUMMARY                     ::
         :::::::::::::::::::::::::::::::::::::::::::::::::::::
         :: total energy             -44.993581907840 Eh    ::
         :: gradient norm              0.000434924659 Eh/a0 ::
         :: HOMO-LUMO gap              1.870943775447 eV    ::
         ::.................................................::
         :: SCC energy               -45.581768531358 Eh    ::
         :: -> isotropic ES            0.089674064041 Eh    ::
         :: -> anisotropic ES         -0.000925010408 Eh    ::
         :: -> anisotropic XC          0.009621787773 Eh    ::
         :: -> dispersion             -0.023357500964 Eh    ::
         :: repulsion energy           0.588178321038 Eh    ::
         :: add. restraining           0.000000000000 Eh    ::
         :::::::::::::::::::::::::::::::::::::::::::::::::::::

           -------------------------------------------------
          |                Property Printout                |
           -------------------------------------------------

    * Orbital Energies and Occupations

         #    Occupation            Energy/Eh            Energy/eV
      -------------------------------------------------------------
         1        2.0000           -0.7473265             -20.3358
       ...           ...                  ...                  ...
        27        2.0000           -0.5316645             -14.4673
        28        2.0000           -0.5308585             -14.4454
        29        2.0000           -0.5222938             -14.2123
        30        2.0000           -0.5179111             -14.0931
        31        2.0000           -0.5062369             -13.7754
        32        2.0000           -0.5040729             -13.7165
        33        2.0000           -0.4870380             -13.2530
        34        2.0000           -0.4681298             -12.7385
        35        2.0000           -0.4672724             -12.7151
        36        2.0000           -0.4404956             -11.9865
        37        2.0000           -0.4347657             -11.8306
        38        2.0000           -0.4328452             -11.7783
        39        2.0000           -0.4204826             -11.4419 (HOMO)
        40                         -0.3517267              -9.5710 (LUMO)
        41                         -0.3218542              -8.7581
        42                         -0.3058755              -8.3233
        43                         -0.2582672              -7.0278
        44                         -0.2280803              -6.2064
        45                         -0.2046375              -5.5685
        46                         -0.1170057              -3.1839
        47                         -0.0005543              -0.0151
        48                          0.0385949               1.0502
        49                          0.0735439               2.0012
        50                          0.0776590               2.1132
       ...                                ...                  ...
        70                          0.7015372              19.0898
      -------------------------------------------------------------
                  HL-Gap            0.0687559 Eh            1.8709 eV
             Fermi-level           -0.3861047 Eh          -10.5064 eV

     #   Z        covCN         q      C6AA      α(0)
     1   6 C      2.908     0.001    28.015     8.679
     2   6 C      3.016    -0.006    28.162     8.705
     3   6 C      2.846     0.238    23.025     7.864
     4   8 O      0.856    -0.321    20.166     6.021
     5   6 C      3.830    -0.124    22.846     6.801
     6   6 C      2.846     0.238    23.025     7.864
     7   8 O      0.856    -0.321    20.166     6.021
     8   6 C      3.016    -0.006    28.161     8.705
     9   6 C      2.908     0.001    28.015     8.679
    10   6 C      3.016    -0.006    28.161     8.705
    11   6 C      3.016    -0.006    28.161     8.705
    12   6 C      2.846     0.238    23.025     7.864
    13   8 O      0.856    -0.321    20.166     6.021
    14   6 C      3.830    -0.124    22.846     6.801
    15   6 C      2.846     0.238    23.025     7.864
    16   8 O      0.856    -0.321    20.166     6.021
    17   1 H      0.926     0.091     1.869     2.138
    18   1 H      0.924     0.105     1.741     2.064
    19   1 H      0.924     0.105     1.737     2.061
    20   1 H      0.926     0.091     1.869     2.138
    21   1 H      0.924     0.105     1.740     2.063
    22   1 H      0.924     0.105     1.738     2.062

 Mol. C6AA /au·bohr⁶  :       7446.937230
 Mol. C8AA /au·bohr⁸  :     187601.016009
 Mol. α(0) /au        :        133.842956


Wiberg/Mayer (AO) data.
largest (>0.10) Wiberg bond orders for each atom
          total WBO             WBO to atom ...
     1  C   3.982        C    2 1.403    C   11 1.403    H   17 0.960
     2  C   3.985        C    1 1.403    C    8 1.326    C    3 1.008
     3  C   3.930        O    4 1.861    C    2 1.008    C    5 0.983
     4  O   2.106        C    3 1.861
     5  C   3.994        C    6 0.983    C    3 0.983    H   18 0.929    H   19 0.927
     6  C   3.930        O    7 1.861    C    8 1.008    C    5 0.983
     7  O   2.106        C    6 1.861
     8  C   3.985        C    9 1.403    C    2 1.326    C    6 1.008
     9  C   3.982        C    8 1.403    C   10 1.403    H   20 0.960
    10  C   3.985        C    9 1.403    C   11 1.326    C   15 1.008
    11  C   3.985        C    1 1.403    C   10 1.326    C   12 1.008
    12  C   3.930        O   13 1.861    C   11 1.008    C   14 0.983
    13  O   2.106        C   12 1.861
    14  C   3.994        C   12 0.983    C   15 0.983    H   21 0.928    H   22 0.928
    15  C   3.930        O   16 1.861    C   10 1.008    C   14 0.983
    16  O   2.106        C   15 1.861
    17  H   0.991        C    1 0.960
    18  H   0.987        C    5 0.929
    19  H   0.987        C    5 0.927
    20  H   0.991        C    9 0.960
    21  H   0.987        C   14 0.928
    22  H   0.987        C   14 0.928

molecular dipole:
                 x           y           z       tot (Debye)
 q only:       -0.001      -0.000      -0.022
   full:       -0.001      -0.000      -0.026       0.067
molecular quadrupole (traceless):
                xx          xy          yy          xz          yz          zz
 q only:        6.225       0.042     -16.414       0.438       0.010      10.189
  q+dip:        9.220       0.056     -20.925       0.462       0.011      11.705
   full:        6.289       0.056     -23.687       0.712       0.014      17.398

           -------------------------------------------------
          |                Geometry Summary                 |
           -------------------------------------------------

      molecular mass/u    :      214.1770000
   center of mass at/Å    :       -0.0202604       0.0015638      -0.0200475
  moments of inertia/u·Å² :        0.5179168E+03   0.1292179E+04   0.1803896E+04
rotational constants/cm⁻¹ :        0.3254892E-01   0.1304589E-01   0.9345123E-02

 * 16 selected distances

     #   Z        #   Z                                     value/Å
     1   6 C      2   6 C                                 1.3873908
     3   6 C      4   8 O                                 1.2012390
     6   6 C      7   8 O                                 1.2012534
     2   6 C      8   6 C                                 1.4024207 (max)
     8   6 C      9   6 C                                 1.3873827
     9   6 C     10   6 C                                 1.3873997
     1   6 C     11   6 C                                 1.3873954
    10   6 C     11   6 C                                 1.4023881
    12   6 C     13   8 O                                 1.2012741
    15   6 C     16   8 O                                 1.2012786
     1   6 C     17   1 H                                 1.0792285
     5   6 C     18   1 H                                 1.0919185
     5   6 C     19   1 H                                 1.0923411
     9   6 C     20   1 H                                 1.0792220 (min)
    14   6 C     21   1 H                                 1.0920991
    14   6 C     22   1 H                                 1.0919649

 * 3 distinct bonds (by element types)

   Z      Z             #   av. dist./Å        max./Å        min./Å
   1 H    6 C           6     1.0877957     1.0923411     1.0792220
   6 C    6 C           6     1.3923962     1.4024207     1.3873827
   6 C    8 O           4     1.2012613     1.2012786     1.2012390


optimized geometry written to: xtbopt.xyz


           -------------------------------------------------
          | TOTAL ENERGY              -44.993581907840 Eh   |
          | GRADIENT NORM               0.000434924659 Eh/α |
          | HOMO-LUMO GAP               1.870943775447 eV   |
           -------------------------------------------------

------------------------------------------------------------------------
 * finished run on 2021/05/19 at 11:00:45.882     
------------------------------------------------------------------------
 total:
 * wall-time:     0 d,  0 h,  0 min,  0.507 sec
 *  cpu-time:     0 d,  0 h,  0 min,  0.504 sec
 * ratio c/w:     0.995 speedup
 SCF:
 * wall-time:     0 d,  0 h,  0 min,  0.038 sec
 *  cpu-time:     0 d,  0 h,  0 min,  0.038 sec
 * ratio c/w:     0.998 speedup
 ANC optimizer:
 * wall-time:     0 d,  0 h,  0 min,  0.447 sec
 *  cpu-time:     0 d,  0 h,  0 min,  0.446 sec
 * ratio c/w:     0.998 speedup

