      -----------------------------------------------------------      
     |                   =====================                   |     
     |                           x T B                           |     
     |                   =====================                   |     
     |                         S. Grimme                         |     
     |          Mulliken Center for Theoretical Chemistry        |     
     |                    University of Bonn                     |     
     |                Version 6.2 RC2 (SAW190805)                |     
      -----------------------------------------------------------      

   This program is distributed in the hope that it will be useful,
   but WITHOUT ANY WARRANTY; without even the implied warranty of
   MERCHANTABILITY or FITNESS FOR A PARTICULAR PURPOSE.
   
   FOR NON-COMMERCIAL, ACADEMIA USE ONLY.
   
   Cite this work as:
   * S. Grimme, C. Bannwarth, P. Shushkov, J. Chem. Theory Comput., 2017,
     13, 1989-2009. DOI: 10.1021/acs.jctc.7b00118
   * C. Bannwarth, S. Ehlert and S. Grimme., J. Chem. Theory Comput., 2019,
     15, 1652-1671. DOI: 10.1021/acs.jctc.8b01176
   * P. Pracht, E. Caldeweyher, S. Ehlert, S. Grimme, ChemRxiv, 2019, preprint.
     DOI: 10.26434/chemrxiv.8326202.v1
   
   for DFT-D4:
   * E. Caldeweyher, C. Bannwarth and S. Grimme, J. Chem. Phys., 2017,
     147, 034112. DOI: 10.1063/1.4993215
   * E. Caldeweyher, S. Ehlert, A. Hansen, H. Neugebauer, S. Spicher,
     C. Bannwarth and S. Grimme, J. Chem. Phys., 2019, 150, 154122.
     DOI: 10.1063/1.5090222
   
   for sTDA-xTB:
   * S. Grimme and C. Bannwarth, J. Chem. Phys., 2016, 145, 054103.
     DOI: 10.1063/1.4959605
   
   in the mass-spec context:
   * V. Asgeirsson, C. Bauer and S. Grimme, Chem. Sci., 2017, 8, 4879.
     DOI: 10.1039/c7sc00601b
   
   for metadynamics refer to:
   * S. Grimme, J. Chem. Theory Comput., 2019, 155, 2847-2862
     DOI: 10.1021/acs.jctc.9b00143
   
   with help from (in alphabetical order)
   C. Bannwarth, F. Bohle, G. Brandenburg, E. Caldeweyher, M. Checinski,
   S. Dohm, S. Ehlert, S. Ehrlich, F. März, H. Neugebauer, J. Pisarek,
   P. Pracht, P. Shushkov, and S. Spicher.
   
 * started run on 2021/05/19 at 11:00:46.857     

           -------------------------------------------------
          |                Calculation Setup                |
           -------------------------------------------------

          program call               : /ihome/ghutchison/geoffh/xtb/xtb 1024.xyz -opt
          hostname                   : smp-n144
          coordinate file            : 1024.xyz
          omp threads                :                     1
          number of atoms            :                    20
          number of electrons        :                    50
          charge                     :                     0
          spin                       :                   0.0
          first test random number   :      0.53121428431627


########################################################################
# WARNING! Please study the warnings concerning your input carefully
#  - the use of '-opt' is discouraged, please use '--opt' next time
########################################################################

           ------------------------------------------------- 
          |                 G F N 2 - x T B                 |
          | Geometry, Frequencies, Noncovalent interactions |
          |            JCTC 2019 parametrisation            |
           ------------------------------------------------- 
             KAB for C  - Si     :                1.0500
             KAB for H  - Pd     :                0.9500
             k(s)              :                1.8500
             k(p)              :                2.2300
             k(d)              :                2.2300
             k(f)              :                2.0000
             kEN (H0ij)        :               -2.0000
             D4 a1             :                0.5200
             D4 a2             :                5.0000
             D4 s6             :                1.0000
             D4 s8             :                2.7000
             D4 s9             :                5.0000
             alphaj            :                2.0000

  Z AO/shell   Hii/eV     exponent
  1     Wed Apr 25 08:07:45 CEST 2018   EN: 2.200 GM2: 0.406  GM3: 0.0800  RAES: 1.40
     1s    -10.707211    1.230000
  6     Wed Apr 25 08:07:45 CEST 2018   EN: 2.550 GM2: 0.538  GM3: 0.1500  RAES: 3.00
     2s    -13.970922    2.096432
     2p    -10.063292    1.800000

           ------------------------------------------------- 
          |        Self-Consistent Charge Iterations        |
           ------------------------------------------------- 

          ...................................................
          :                      SETUP                      :
          :.................................................:
          :  # basis functions                  50          :
          :  # atomic orbitals                  50          :
          :  # shells                           30          :
          :  # electrons                        50          :
          :  max. iterations                   250          :
          :  Hamiltonian                  GFN2-xTB          :
          :  restarted?                      false          :
          :  GBSA solvation                  false          :
          :  PC potential                    false          :
          :  electronic temp.          300.0000000     K    :
          :  accuracy                    1.0000000          :
          :  -> integral cutoff          0.2500000E+02      :
          :  -> integral neglect         0.1000000E-07      :
          :  -> SCF convergence          0.1000000E-05 Eh   :
          :  -> wf. convergence          0.1000000E-03 e    :
          :  Broyden damping             0.4000000          :
          ...................................................

 iter      E             dE          RMSdq      gap      omega  full diag
   1    -26.7199588 -0.267200E+02  0.503E+00    1.07       0.0  T
   2    -26.4988533  0.221105E+00  0.518E+00    1.00       1.0  T
   3    -26.7186732 -0.219820E+00  0.335E+00    1.19       1.0  T
   4    -26.7994414 -0.807682E-01  0.929E-01    0.71       1.0  T
   5    -26.8033363 -0.389490E-02  0.517E-01    0.67       1.0  T
   6    -26.8053155 -0.197926E-02  0.229E-01    0.64       1.0  T
   7    -26.8056749 -0.359412E-03  0.853E-02    0.63       1.0  T
   8    -26.8056937 -0.187467E-04  0.359E-02    0.63       1.0  T
   9    -26.8057046 -0.108655E-04  0.113E-02    0.63       2.0  T
  10    -26.8057052 -0.653692E-06  0.952E-03    0.63       2.3  T
  11    -26.8057060 -0.759093E-06  0.299E-03    0.63       7.5  T
  12    -26.8057060 -0.610185E-07  0.848E-04    0.63      26.4  T
  13    -26.8057060 -0.294924E-08  0.346E-04    0.63      64.6  T

   *** convergence criteria satisfied after 13 iterations ***

         #    Occupation            Energy/Eh            Energy/eV
      -------------------------------------------------------------
         1        2.0000           -0.6474569             -17.6182
       ...           ...                  ...                  ...
        19        2.0000           -0.4425945             -12.0436
        20        2.0000           -0.4363207             -11.8729
        21        2.0000           -0.4289109             -11.6713
        22        2.0000           -0.4247775             -11.5588
        23        2.0000           -0.4085236             -11.1165
        24        2.0000           -0.3531887              -9.6108
        25        2.0000           -0.3098153              -8.4305 (HOMO)
        26        0.0000           -0.2868078              -7.8044 (LUMO)
        27                         -0.2327847              -6.3344
        28                         -0.1545880              -4.2066
        29                         -0.1385679              -3.7706
        30                          0.0820361               2.2323
       ...                                ...                  ...
        50                          1.0579611              28.7886
      -------------------------------------------------------------
                  HL-Gap            0.0230075 Eh            0.6261 eV
             Fermi-level           -0.2983116 Eh           -8.1175 eV

 SCC (total)                   0 d,  0 h,  0 min,  0.024 sec
 SCC setup                      ...        0 min,  0.000 sec (  1.030%)
 Dispersion                     ...        0 min,  0.000 sec (  1.117%)
 integral evaluation            ...        0 min,  0.005 sec ( 19.584%)
 zeroth order Hamiltonian       ...        0 min,  0.000 sec (  0.454%)
 iterations                     ...        0 min,  0.010 sec ( 41.487%)
 molecular gradient             ...        0 min,  0.008 sec ( 34.679%)
 printout                       ...        0 min,  0.000 sec (  1.424%)

         :::::::::::::::::::::::::::::::::::::::::::::::::::::
         ::                     SUMMARY                     ::
         :::::::::::::::::::::::::::::::::::::::::::::::::::::
         :: total energy             -26.307795679801 Eh    ::
         :: gradient norm              0.073480632580 Eh/a0 ::
         :: HOMO-LUMO gap              0.626065139337 eV    ::
         ::.................................................::
         :: SCC energy               -26.805706036925 Eh    ::
         :: -> isotropic ES            0.004606266255 Eh    ::
         :: -> anisotropic ES          0.004133027466 Eh    ::
         :: -> anisotropic XC          0.018805076945 Eh    ::
         :: -> dispersion             -0.016787497513 Eh    ::
         :: repulsion energy           0.497793047813 Eh    ::
         :: add. restraining           0.000000000000 Eh    ::
         :::::::::::::::::::::::::::::::::::::::::::::::::::::

      ----------------------------------------------------------- 
     |                   =====================                   |
     |                        A N C O P T                        |
     |                   =====================                   |
     |               Approximate Normal Coordinate               |
     |                Rational Function Optimizer                |
      ----------------------------------------------------------- 

          ...................................................
          :                      SETUP                      :
          :.................................................:
          :   optimization level            normal          :
          :   max. optcycles                   200          :
          :   ANC micro-cycles                  20          :
          :   degrees of freedom                54          :
          :.................................................:
          :   RF solver                   davidson          :
          :   input Hessian                  false          :
          :   write xtbopt.log                true          :
          :   linear?                        false          :
          :   energy convergence         0.5000000E-05 Eh   :
          :   grad. convergence          0.1000000E-02 Eh/α :
          :   maximium RF displ.         2.0000000          :
          :   Hlow (freq-cutoff)         0.5000000E-02      :
          :   Hmax (freq-cutoff)         5.0000000          :
          :   S6 in model hess.         20.0000000          :
          ...................................................

generating ANC from model Hessian ...
Using Lindh-Hessian (1995)
 Shifting diagonal of input Hessian by   4.218624973354994E-003
 Lowest  eigenvalues of input Hessian
   -0.000000   -0.000000   -0.000000   -0.000000    0.000000    0.000000
    0.005000    0.005742    0.006021    0.010466    0.013555    0.017923
    0.022815    0.028783    0.033013    0.047572    0.048532    0.049702
 Highest eigenvalues
    1.382994    1.533430    1.659235    1.807948    1.881841    2.387299
 

........................................................................
.............................. CYCLE    1 ..............................
........................................................................
   1    -26.8057060 -0.268057E+02  0.109E-04    0.63       0.0  T
   2    -26.8057060  0.759652E-09  0.246E-04    0.63      90.8  T
   3    -26.8057060 -0.817799E-09  0.652E-05    0.63     342.8  T
     SCC iter.                  ...        0 min,  0.003 sec
     gradient                   ...        0 min,  0.008 sec
 * total energy  :   -26.3077957 Eh     change        0.5744869E-08 Eh
   gradient norm :     0.0734824 Eh/α   predicted     0.0000000E+00 (-100.00%)
   displ. norm   :     0.8521378 α      lambda       -0.4470341E-01
   maximum displ.:     0.7646055 α      in ANC's #1, #2, #6, ...

........................................................................
.............................. CYCLE    2 ..............................
........................................................................
   1    -26.8127052 -0.268127E+02  0.117E+00    1.70       0.0  T
   2    -26.7981798  0.145254E-01  0.128E+00    1.87       1.0  T
   3    -26.8213444 -0.231646E-01  0.462E-01    1.72       1.0  T
   4    -26.8223025 -0.958139E-03  0.547E-02    1.73       1.0  T
   5    -26.8223383 -0.357911E-04  0.249E-02    1.73       1.0  T
   6    -26.8223467 -0.833374E-05  0.818E-03    1.73       2.7  T
   7    -26.8223471 -0.398493E-06  0.313E-03    1.73       7.2  T
   8    -26.8223471 -0.167547E-07  0.163E-03    1.73      13.8  T
     SCC iter.                  ...        0 min,  0.005 sec
     gradient                   ...        0 min,  0.008 sec
 * total energy  :   -26.3420667 Eh     change       -0.3427101E-01 Eh
   gradient norm :     0.0576823 Eh/α   predicted    -0.3858217E-01 (  12.58%)
   displ. norm   :     0.6915861 α      lambda       -0.2372273E-01
   maximum displ.:     0.5446807 α      in ANC's #1, #7, #5, ...

........................................................................
.............................. CYCLE    3 ..............................
........................................................................
   1    -26.8265708 -0.268266E+02  0.647E-01    2.44       0.0  T
   2    -26.8259096  0.661192E-03  0.486E-01    2.47       1.0  T
   3    -26.8269789 -0.106934E-02  0.329E-01    2.44       1.0  T
   4    -26.8277935 -0.814605E-03  0.445E-02    2.45       1.0  T
   5    -26.8278084 -0.148846E-04  0.238E-02    2.45       1.0  T
   6    -26.8278146 -0.615569E-05  0.774E-03    2.45       2.9  T
   7    -26.8278150 -0.483840E-06  0.280E-03    2.45       8.0  T
   8    -26.8278151 -0.483418E-07  0.157E-03    2.45      14.3  T
     SCC iter.                  ...        0 min,  0.005 sec
     gradient                   ...        0 min,  0.008 sec
 * total energy  :   -26.3546654 Eh     change       -0.1259868E-01 Eh
   gradient norm :     0.0727560 Eh/α   predicted    -0.1753456E-01 (  39.18%)
   displ. norm   :     0.6200661 α      lambda       -0.2420753E-01
   maximum displ.:     0.2773775 α      in ANC's #1, #5, #6, ...

........................................................................
.............................. CYCLE    4 ..............................
........................................................................
   1    -26.8471224 -0.268471E+02  0.548E-01    2.80       0.0  T
   2    -26.8472434 -0.120950E-03  0.337E-01    2.80       1.0  T
   3    -26.8466116  0.631789E-03  0.274E-01    2.80       1.0  T
   4    -26.8475263 -0.914727E-03  0.425E-02    2.80       1.0  T
   5    -26.8475267 -0.408506E-06  0.234E-02    2.80       1.0  T
   6    -26.8475332 -0.643232E-05  0.599E-03    2.80       3.7  T
   7    -26.8475336 -0.465499E-06  0.172E-03    2.80      13.0  T
   8    -26.8475336  0.962864E-09  0.112E-03    2.80      19.9  T
     SCC iter.                  ...        0 min,  0.005 sec
     gradient                   ...        0 min,  0.008 sec
 * total energy  :   -26.3635603 Eh     change       -0.8894958E-02 Eh
   gradient norm :     0.0814229 Eh/α   predicted    -0.1675745E-01 (  88.39%)
   displ. norm   :     0.3643639 α      lambda       -0.1818863E-01
   maximum displ.:     0.2004251 α      in ANC's #5, #3, #26, ...

........................................................................
.............................. CYCLE    5 ..............................
........................................................................
   1    -26.8720800 -0.268721E+02  0.310E-01    2.98       0.0  T
   2    -26.8720837 -0.370429E-05  0.183E-01    2.99       1.0  T
   3    -26.8720185  0.651670E-04  0.166E-01    2.99       1.0  T
   4    -26.8722567 -0.238180E-03  0.174E-02    2.99       1.3  T
   5    -26.8722566  0.842314E-07  0.837E-03    2.99       2.7  T
   6    -26.8722572 -0.604145E-06  0.301E-03    2.99       7.4  T
   7    -26.8722574 -0.124427E-06  0.110E-03    2.99      20.3  T
     SCC iter.                  ...        0 min,  0.005 sec
     gradient                   ...        0 min,  0.008 sec
 * total energy  :   -26.3766549 Eh     change       -0.1309459E-01 Eh
   gradient norm :     0.0372203 Eh/α   predicted    -0.1030169E-01 ( -21.33%)
   displ. norm   :     0.6277295 α      lambda       -0.1358532E-01
   maximum displ.:     0.4137999 α      in ANC's #1, #5, #2, ...

........................................................................
.............................. CYCLE    6 ..............................
........................................................................
   1    -26.8793167 -0.268793E+02  0.395E-01    3.27       0.0  T
   2    -26.8793688 -0.520915E-04  0.232E-01    3.27       1.0  T
   3    -26.8790960  0.272869E-03  0.160E-01    3.27       1.0  T
   4    -26.8794283 -0.332324E-03  0.190E-02    3.27       1.2  T
   5    -26.8794301 -0.183705E-05  0.106E-02    3.27       2.1  T
   6    -26.8794317 -0.161896E-05  0.361E-03    3.27       6.2  T
   7    -26.8794318 -0.762309E-07  0.127E-03    3.27      17.6  T
     SCC iter.                  ...        0 min,  0.005 sec
     gradient                   ...        0 min,  0.008 sec
 * total energy  :   -26.3846585 Eh     change       -0.8003564E-02 Eh
   gradient norm :     0.0529120 Eh/α   predicted    -0.9469273E-02 (  18.31%)
   displ. norm   :     0.5672606 α      lambda       -0.1389456E-01
   maximum displ.:     0.2126273 α      in ANC's #27, #3, #35, ...

........................................................................
.............................. CYCLE    7 ..............................
........................................................................
   1    -26.8968487 -0.268968E+02  0.397E-01    3.33       0.0  T
   2    -26.8969321 -0.833685E-04  0.238E-01    3.33       1.0  T
   3    -26.8966586  0.273491E-03  0.142E-01    3.32       1.0  T
   4    -26.8969952 -0.336574E-03  0.228E-02    3.33       1.0  T
   5    -26.8969978 -0.259746E-05  0.130E-02    3.33       1.7  T
   6    -26.8969999 -0.217959E-05  0.447E-03    3.33       5.0  T
   7    -26.8970000 -0.837226E-07  0.178E-03    3.33      12.6  T
     SCC iter.                  ...        0 min,  0.005 sec
     gradient                   ...        0 min,  0.008 sec
 * total energy  :   -26.3884456 Eh     change       -0.3787151E-02 Eh
   gradient norm :     0.0852326 Eh/α   predicted    -0.9182818E-02 ( 142.47%)
   displ. norm   :     0.4794456 α      lambda       -0.1744370E-01
   maximum displ.:     0.2449968 α      in ANC's #1, #2, #35, ...

........................................................................
.............................. CYCLE    8 ..............................
........................................................................
   1    -26.8975114 -0.268975E+02  0.361E-01    3.36       0.0  T
   2    -26.8976417 -0.130255E-03  0.208E-01    3.36       1.0  T
   3    -26.8975364  0.105268E-03  0.118E-01    3.36       1.0  T
   4    -26.8976866 -0.150164E-03  0.327E-02    3.36       1.0  T
   5    -26.8976885 -0.196755E-05  0.163E-02    3.36       1.4  T
   6    -26.8976923 -0.372848E-05  0.572E-03    3.36       3.9  T
   7    -26.8976926 -0.369086E-06  0.145E-03    3.36      15.5  T
     SCC iter.                  ...        0 min,  0.005 sec
     gradient                   ...        0 min,  0.008 sec
 * total energy  :   -26.3927706 Eh     change       -0.4324981E-02 Eh
   gradient norm :     0.0674785 Eh/α   predicted    -0.1072674E-01 ( 148.02%)
   displ. norm   :     0.2952508 α      lambda       -0.8486364E-02
   maximum displ.:     0.1747897 α      in ANC's #3, #1, #5, ...

........................................................................
.............................. CYCLE    9 ..............................
........................................................................
   1    -26.8855831 -0.268856E+02  0.231E-01    3.36       0.0  T
   2    -26.8856362 -0.530736E-04  0.134E-01    3.36       1.0  T
   3    -26.8855715  0.646856E-04  0.982E-02    3.36       1.0  T
   4    -26.8856748 -0.103273E-03  0.197E-02    3.36       1.1  T
   5    -26.8856749 -0.145809E-06  0.877E-03    3.36       2.5  T
   6    -26.8856758 -0.851905E-06  0.346E-03    3.36       6.5  T
   7    -26.8856760 -0.194368E-06  0.888E-04    3.36      25.2  T
     SCC iter.                  ...        0 min,  0.005 sec
     gradient                   ...        0 min,  0.008 sec
 * total energy  :   -26.3952444 Eh     change       -0.2473757E-02 Eh
   gradient norm :     0.0376163 Eh/α   predicted    -0.4613078E-02 (  86.48%)
   displ. norm   :     0.2458211 α      lambda       -0.3698989E-02
   maximum displ.:     0.1317468 α      in ANC's #2, #1, #3, ...

........................................................................
.............................. CYCLE   10 ..............................
........................................................................
   1    -26.8998165 -0.268998E+02  0.170E-01    3.36       0.0  T
   2    -26.8998328 -0.163090E-04  0.958E-02    3.36       1.0  T
   3    -26.8998003  0.325370E-04  0.812E-02    3.36       1.0  T
   4    -26.8998628 -0.624733E-04  0.854E-03    3.36       2.6  T
   5    -26.8998629 -0.144800E-06  0.414E-03    3.36       5.4  T
   6    -26.8998630 -0.992674E-07  0.213E-03    3.36      10.5  T
     SCC iter.                  ...        0 min,  0.004 sec
     gradient                   ...        0 min,  0.008 sec
 * total energy  :   -26.3971408 Eh     change       -0.1896465E-02 Eh
   gradient norm :     0.0204015 Eh/α   predicted    -0.1961259E-02 (   3.42%)
   displ. norm   :     0.3626322 α      lambda       -0.2199868E-02
   maximum displ.:     0.2610130 α      in ANC's #3, #2, #35, ...

........................................................................
.............................. CYCLE   11 ..............................
........................................................................
   1    -26.9007767 -0.269008E+02  0.193E-01    3.39       0.0  T
   2    -26.9007819 -0.515939E-05  0.115E-01    3.39       1.0  T
   3    -26.9007527  0.291561E-04  0.399E-02    3.38       1.0  T
   4    -26.9007858 -0.330983E-04  0.658E-03    3.39       3.4  T
   5    -26.9007859 -0.104171E-06  0.421E-03    3.39       5.3  T
   6    -26.9007861 -0.174270E-06  0.100E-03    3.39      22.3  T
     SCC iter.                  ...        0 min,  0.004 sec
     gradient                   ...        0 min,  0.008 sec
 * total energy  :   -26.3986532 Eh     change       -0.1512351E-02 Eh
   gradient norm :     0.0137722 Eh/α   predicted    -0.1244586E-02 ( -17.71%)
   displ. norm   :     0.4804310 α      lambda       -0.1732235E-02
   maximum displ.:     0.3456380 α      in ANC's #3, #2, #35, ...

........................................................................
.............................. CYCLE   12 ..............................
........................................................................
   1    -26.9004941 -0.269005E+02  0.255E-01    3.40       0.0  T
   2    -26.9004964 -0.236310E-05  0.150E-01    3.40       1.0  T
   3    -26.9004756  0.208297E-04  0.363E-02    3.40       1.0  T
   4    -26.9004985 -0.228940E-04  0.307E-03    3.40       7.3  T
   5    -26.9004986 -0.102805E-06  0.137E-03    3.40      16.4  T
   6    -26.9004986 -0.212542E-08  0.907E-04    3.40      24.7  T
     SCC iter.                  ...        0 min,  0.004 sec
     gradient                   ...        0 min,  0.008 sec
 * total energy  :   -26.4000225 Eh     change       -0.1369373E-02 Eh
   gradient norm :     0.0139342 Eh/α   predicted    -0.1066035E-02 ( -22.15%)
   displ. norm   :     0.6001861 α      lambda       -0.2004837E-02
   maximum displ.:     0.4807071 α      in ANC's #3, #2, #6, ...

........................................................................
.............................. CYCLE   13 ..............................
........................................................................
   1    -26.9015796 -0.269016E+02  0.300E-01    3.40       0.0  T
   2    -26.9015835 -0.395465E-05  0.176E-01    3.41       1.0  T
   3    -26.9015634  0.201831E-04  0.325E-02    3.40       1.0  T
   4    -26.9015862 -0.228314E-04  0.401E-03    3.40       5.6  T
   5    -26.9015863 -0.144533E-06  0.208E-03    3.40      10.8  T
   6    -26.9015863 -0.119944E-07  0.111E-03    3.40      20.2  T
     SCC iter.                  ...        0 min,  0.004 sec
     gradient                   ...        0 min,  0.008 sec
 * total energy  :   -26.4015220 Eh     change       -0.1499409E-02 Eh
   gradient norm :     0.0140373 Eh/α   predicted    -0.1363517E-02 (  -9.06%)
   displ. norm   :     0.6386700 α      lambda       -0.1955465E-02
   maximum displ.:     0.4250332 α      in ANC's #3, #2, #6, ...

........................................................................
.............................. CYCLE   14 ..............................
........................................................................
   1    -26.9011853 -0.269012E+02  0.352E-01    3.41       0.0  T
   2    -26.9011907 -0.546825E-05  0.207E-01    3.41       1.0  T
   3    -26.9011675  0.232515E-04  0.358E-02    3.41       1.0  T
   4    -26.9011941 -0.266631E-04  0.603E-03    3.41       3.7  T
   5    -26.9011943 -0.169531E-06  0.350E-03    3.41       6.4  T
   6    -26.9011944 -0.345588E-07  0.170E-03    3.41      13.2  T
   7    -26.9011944 -0.323951E-07  0.387E-04    3.41      57.9  T
     SCC iter.                  ...        0 min,  0.005 sec
     gradient                   ...        0 min,  0.008 sec
 * total energy  :   -26.4029485 Eh     change       -0.1426567E-02 Eh
   gradient norm :     0.0184262 Eh/α   predicted    -0.1376553E-02 (  -3.51%)
   displ. norm   :     0.5781321 α      lambda       -0.1830305E-02
   maximum displ.:     0.4018222 α      in ANC's #3, #2, #6, ...

........................................................................
.............................. CYCLE   15 ..............................
........................................................................
   1    -26.9077387 -0.269077E+02  0.292E-01    3.41       0.0  T
   2    -26.9077420 -0.332443E-05  0.171E-01    3.41       1.0  T
   3    -26.9077110  0.309689E-04  0.462E-02    3.41       1.0  T
   4    -26.9077457 -0.346688E-04  0.399E-03    3.41       5.6  T
   5    -26.9077457 -0.329188E-07  0.211E-03    3.41      10.6  T
   6    -26.9077457 -0.653811E-08  0.798E-04    3.41      28.0  T
     SCC iter.                  ...        0 min,  0.004 sec
     gradient                   ...        0 min,  0.008 sec
 * total energy  :   -26.4042795 Eh     change       -0.1331018E-02 Eh
   gradient norm :     0.0127806 Eh/α   predicted    -0.1221033E-02 (  -8.26%)
   displ. norm   :     0.6840351 α      lambda       -0.1559521E-02
   maximum displ.:     0.5147400 α      in ANC's #3, #2, #5, ...

........................................................................
.............................. CYCLE   16 ..............................
........................................................................
   1    -26.8971704 -0.268972E+02  0.349E-01    3.40       0.0  T
   2    -26.8971805 -0.100981E-04  0.207E-01    3.41       1.0  T
   3    -26.8970800  0.100506E-03  0.723E-02    3.40       1.0  T
   4    -26.8971913 -0.111238E-03  0.751E-03    3.41       3.0  T
   5    -26.8971917 -0.431397E-06  0.372E-03    3.41       6.0  T
   6    -26.8971918 -0.120748E-06  0.180E-03    3.41      12.5  T
   7    -26.8971918 -0.194265E-07  0.724E-04    3.41      30.9  T
     SCC iter.                  ...        0 min,  0.005 sec
     gradient                   ...        0 min,  0.008 sec
 * total energy  :   -26.4051859 Eh     change       -0.9063902E-03 Eh
   gradient norm :     0.0194272 Eh/α   predicted    -0.1144620E-02 (  26.28%)
   displ. norm   :     0.3789607 α      lambda       -0.1252727E-02
   maximum displ.:     0.2147627 α      in ANC's #3, #2, #6, ...

........................................................................
.............................. CYCLE   17 ..............................
........................................................................
   1    -26.9041268 -0.269041E+02  0.213E-01    3.43       0.0  T
   2    -26.9041300 -0.314610E-05  0.125E-01    3.43       1.0  T
   3    -26.9041219  0.804152E-05  0.210E-02    3.43       1.1  T
   4    -26.9041311 -0.918092E-05  0.409E-03    3.43       5.5  T
   5    -26.9041313 -0.183283E-06  0.192E-03    3.43      11.6  T
   6    -26.9041313 -0.138837E-07  0.113E-03    3.43      19.7  T
     SCC iter.                  ...        0 min,  0.004 sec
     gradient                   ...        0 min,  0.008 sec
 * total energy  :   -26.4059923 Eh     change       -0.8063669E-03 Eh
   gradient norm :     0.0206060 Eh/α   predicted    -0.7163216E-03 ( -11.17%)
   displ. norm   :     0.3867924 α      lambda       -0.1024030E-02
   maximum displ.:     0.2690999 α      in ANC's #3, #2, #7, ...

........................................................................
.............................. CYCLE   18 ..............................
........................................................................
   1    -26.9107733 -0.269108E+02  0.214E-01    3.40       0.0  T
   2    -26.9107755 -0.222911E-05  0.126E-01    3.40       1.0  T
   3    -26.9107343  0.412205E-04  0.519E-02    3.40       1.0  T
   4    -26.9107803 -0.459543E-04  0.296E-03    3.40       7.5  T
   5    -26.9107803 -0.645235E-07  0.162E-03    3.40      13.8  T
   6    -26.9107804 -0.798467E-08  0.922E-04    3.40      24.2  T
     SCC iter.                  ...        0 min,  0.004 sec
     gradient                   ...        0 min,  0.008 sec
 * total energy  :   -26.4067634 Eh     change       -0.7711288E-03 Eh
   gradient norm :     0.0176582 Eh/α   predicted    -0.5886175E-03 ( -23.67%)
   displ. norm   :     0.6748724 α      lambda       -0.1486504E-02
   maximum displ.:     0.4799247 α      in ANC's #3, #2, #6, ...

........................................................................
.............................. CYCLE   19 ..............................
........................................................................
   1    -26.9096661 -0.269097E+02  0.385E-01    3.42       0.0  T
   2    -26.9096696 -0.348563E-05  0.227E-01    3.42       1.0  T
   3    -26.9096455  0.241477E-04  0.394E-02    3.42       1.0  T
   4    -26.9096728 -0.273641E-04  0.399E-03    3.42       5.6  T
   5    -26.9096728 -0.174235E-07  0.231E-03    3.42       9.7  T
   6    -26.9096729 -0.245140E-07  0.108E-03    3.42      20.7  T
     SCC iter.                  ...        0 min,  0.004 sec
     gradient                   ...        0 min,  0.008 sec
 * total energy  :   -26.4078670 Eh     change       -0.1103546E-02 Eh
   gradient norm :     0.0161245 Eh/α   predicted    -0.1081777E-02 (  -1.97%)
   displ. norm   :     0.5117425 α      lambda       -0.1981646E-02
   maximum displ.:     0.2468910 α      in ANC's #3, #2, #4, ...

........................................................................
.............................. CYCLE   20 ..............................
........................................................................
   1    -26.9225436 -0.269225E+02  0.333E-01    3.47       0.0  T
   2    -26.9225586 -0.149773E-04  0.197E-01    3.47       1.0  T
   3    -26.9224584  0.100130E-03  0.752E-02    3.47       1.0  T
   4    -26.9225713 -0.112873E-03  0.820E-03    3.47       2.7  T
   5    -26.9225717 -0.413352E-06  0.448E-03    3.47       5.0  T
   6    -26.9225719 -0.147718E-06  0.187E-03    3.47      11.9  T
   7    -26.9225719 -0.211904E-07  0.633E-04    3.47      35.3  T
     SCC iter.                  ...        0 min,  0.005 sec
     gradient                   ...        0 min,  0.008 sec
 * total energy  :   -26.4085102 Eh     change       -0.6432423E-03 Eh
   gradient norm :     0.0282015 Eh/α   predicted    -0.1250301E-02 (  94.37%)
   displ. norm   :     0.5295894 α      lambda       -0.1748335E-02
   maximum displ.:     0.4038268 α      in ANC's #3, #2, #5, ...
 * RMSD in coord.:     1.6414836 α      energy gain  -0.1007145E+00 Eh

generating ANC from model Hessian ...
Using Lindh-Hessian (1995)
 Shifting diagonal of input Hessian by   4.353855781577389E-003
 Lowest  eigenvalues of input Hessian
   -0.000000   -0.000000   -0.000000    0.000000    0.000000    0.000000
    0.005000    0.005189    0.005487    0.009470    0.010622    0.016877
    0.019217    0.024740    0.032511    0.040335    0.045823    0.048809
 Highest eigenvalues
    1.393296    1.548929    1.664432    1.792109    1.874315    2.430553
 

........................................................................
.............................. CYCLE   21 ..............................
........................................................................
   1    -26.9062773 -0.269063E+02  0.315E-01    3.40       0.0  T
   2    -26.9062910 -0.136939E-04  0.187E-01    3.41       1.0  T
   3    -26.9061639  0.127138E-03  0.881E-02    3.41       1.0  T
   4    -26.9063062 -0.142334E-03  0.755E-03    3.41       3.0  T
   5    -26.9063069 -0.692532E-06  0.335E-03    3.41       6.7  T
   6    -26.9063069 -0.222565E-07  0.184E-03    3.41      12.1  T
   7    -26.9063070 -0.346085E-07  0.585E-04    3.41      38.2  T
   8    -26.9063070 -0.177042E-08  0.281E-04    3.41      79.6  T
     SCC iter.                  ...        0 min,  0.006 sec
     gradient                   ...        0 min,  0.008 sec
 * total energy  :   -26.4093706 Eh     change       -0.8604079E-03 Eh
   gradient norm :     0.0166940 Eh/α   predicted     0.0000000E+00 (-100.00%)
   displ. norm   :     0.2731209 α      lambda       -0.1229357E-02
   maximum displ.:     0.1902445 α      in ANC's #1, #5, #4, ...

........................................................................
.............................. CYCLE   22 ..............................
........................................................................
   1    -26.9088856 -0.269089E+02  0.317E-01    3.42       0.0  T
   2    -26.9088911 -0.547915E-05  0.193E-01    3.42       1.0  T
   3    -26.9088632  0.279374E-04  0.417E-02    3.42       1.0  T
   4    -26.9088948 -0.316476E-04  0.541E-03    3.42       4.1  T
   5    -26.9088949 -0.111164E-06  0.324E-03    3.42       6.9  T
   6    -26.9088950 -0.365676E-07  0.161E-03    3.42      13.9  T
   7    -26.9088950 -0.273492E-07  0.447E-04    3.42      50.0  T
     SCC iter.                  ...        0 min,  0.005 sec
     gradient                   ...        0 min,  0.008 sec
 * total energy  :   -26.4079577 Eh     change        0.1412903E-02 Eh
   gradient norm :     0.0225392 Eh/α   predicted    -0.6605311E-03 (-146.75%)
   displ. norm   :     0.2779297 α      lambda       -0.4437282E-02
   maximum displ.:     0.1871090 α      in ANC's #3, #1, #7, ...

........................................................................
.............................. CYCLE   23 ..............................
........................................................................
   1    -26.9234396 -0.269234E+02  0.269E-01    3.43       0.0  T
   2    -26.9234434 -0.387020E-05  0.163E-01    3.43       1.0  T
   3    -26.9234357  0.777979E-05  0.243E-02    3.43       1.0  T
   4    -26.9234452 -0.950657E-05  0.567E-03    3.43       3.9  T
   5    -26.9234453 -0.137495E-06  0.276E-03    3.43       8.1  T
   6    -26.9234454 -0.385981E-07  0.122E-03    3.43      18.3  T
     SCC iter.                  ...        0 min,  0.004 sec
     gradient                   ...        0 min,  0.008 sec
 * total energy  :   -26.4098181 Eh     change       -0.1860349E-02 Eh
   gradient norm :     0.0137248 Eh/α   predicted    -0.2390024E-02 (  28.47%)
   displ. norm   :     0.1417818 α      lambda       -0.6724034E-03
   maximum displ.:     0.1082178 α      in ANC's #3, #10, #8, ...

........................................................................
.............................. CYCLE   24 ..............................
........................................................................
   1    -26.9138211 -0.269138E+02  0.118E-01    3.42       0.0  T
   2    -26.9138227 -0.161720E-05  0.711E-02    3.42       1.0  T
   3    -26.9137990  0.237116E-04  0.420E-02    3.42       1.0  T
   4    -26.9138261 -0.271174E-04  0.304E-03    3.42       7.4  T
   5    -26.9138262 -0.877586E-07  0.144E-03    3.42      15.5  T
   6    -26.9138262 -0.287202E-08  0.952E-04    3.42      23.5  T
     SCC iter.                  ...        0 min,  0.004 sec
     gradient                   ...        0 min,  0.008 sec
 * total energy  :   -26.4100852 Eh     change       -0.2671580E-03 Eh
   gradient norm :     0.0042236 Eh/α   predicted    -0.3429671E-03 (  28.38%)
   displ. norm   :     0.1730499 α      lambda       -0.2331014E-03
   maximum displ.:     0.1336718 α      in ANC's #3, #5, #4, ...

........................................................................
.............................. CYCLE   25 ..............................
........................................................................
   1    -26.9144876 -0.269145E+02  0.109E-01    3.42       0.0  T
   2    -26.9144879 -0.282070E-06  0.640E-02    3.42       1.0  T
   3    -26.9144871  0.821768E-06  0.676E-03    3.42       3.3  T
   4    -26.9144881 -0.991633E-06  0.121E-03    3.42      18.5  T
   5    -26.9144881 -0.527175E-08  0.708E-04    3.42      31.6  T
     SCC iter.                  ...        0 min,  0.004 sec
     gradient                   ...        0 min,  0.008 sec
 * total energy  :   -26.4102832 Eh     change       -0.1979325E-03 Eh
   gradient norm :     0.0023675 Eh/α   predicted    -0.1200417E-03 ( -39.35%)
   displ. norm   :     0.5695941 α      lambda       -0.5209370E-03
   maximum displ.:     0.4802495 α      in ANC's #3, #5, #4, ...

........................................................................
.............................. CYCLE   26 ..............................
........................................................................
   1    -26.9128432 -0.269128E+02  0.331E-01    3.42       0.0  T
   2    -26.9128457 -0.253777E-05  0.194E-01    3.42       1.0  T
   3    -26.9128320  0.137209E-04  0.279E-02    3.42       1.0  T
   4    -26.9128478 -0.157832E-04  0.267E-03    3.42       8.4  T
   5    -26.9128478 -0.367063E-07  0.161E-03    3.42      13.9  T
   6    -26.9128479 -0.124875E-07  0.770E-04    3.42      29.0  T
   7    -26.9128479 -0.341049E-08  0.248E-04    3.42      90.3  T
     SCC iter.                  ...        0 min,  0.005 sec
     gradient                   ...        0 min,  0.008 sec
 * total energy  :   -26.4106796 Eh     change       -0.3964365E-03 Eh
   gradient norm :     0.0067561 Eh/α   predicted    -0.3449787E-03 ( -12.98%)
   displ. norm   :     0.5349781 α      lambda       -0.3686050E-03
   maximum displ.:     0.4491049 α      in ANC's #3, #5, #4, ...

........................................................................
.............................. CYCLE   27 ..............................
........................................................................
   1    -26.9108451 -0.269108E+02  0.314E-01    3.42       0.0  T
   2    -26.9108470 -0.192376E-05  0.184E-01    3.42       1.0  T
   3    -26.9108413  0.569091E-05  0.191E-02    3.42       1.2  T
   4    -26.9108482 -0.693478E-05  0.208E-03    3.42      10.8  T
   5    -26.9108483 -0.229970E-07  0.117E-03    3.42      19.1  T
   6    -26.9108483  0.668528E-09  0.632E-04    3.42      35.4  T
     SCC iter.                  ...        0 min,  0.004 sec
     gradient                   ...        0 min,  0.008 sec
 * total energy  :   -26.4109604 Eh     change       -0.2807966E-03 Eh
   gradient norm :     0.0090944 Eh/α   predicted    -0.2370536E-03 ( -15.58%)
   displ. norm   :     0.4535459 α      lambda       -0.3675831E-03
   maximum displ.:     0.3775237 α      in ANC's #3, #5, #4, ...

........................................................................
.............................. CYCLE   28 ..............................
........................................................................
   1    -26.9131021 -0.269131E+02  0.264E-01    3.42       0.0  T
   2    -26.9131033 -0.124366E-05  0.155E-01    3.42       1.0  T
   3    -26.9131014  0.188370E-05  0.122E-02    3.42       1.8  T
   4    -26.9131041 -0.262656E-05  0.195E-03    3.42      11.4  T
   5    -26.9131041 -0.118441E-07  0.970E-04    3.42      23.1  T
     SCC iter.                  ...        0 min,  0.004 sec
     gradient                   ...        0 min,  0.008 sec
 * total energy  :   -26.4112465 Eh     change       -0.2861441E-03 Eh
   gradient norm :     0.0064638 Eh/α   predicted    -0.2216001E-03 ( -22.56%)
   displ. norm   :     0.4449765 α      lambda       -0.2881687E-03
   maximum displ.:     0.3758071 α      in ANC's #3, #5, #4, ...

........................................................................
.............................. CYCLE   29 ..............................
........................................................................
   1    -26.9149550 -0.269150E+02  0.261E-01    3.42       0.0  T
   2    -26.9149563 -0.129580E-05  0.153E-01    3.42       1.0  T
   3    -26.9149554  0.875633E-06  0.905E-03    3.42       2.5  T
   4    -26.9149570 -0.152497E-05  0.221E-03    3.42      10.1  T
   5    -26.9149570 -0.204936E-07  0.875E-04    3.42      25.5  T
     SCC iter.                  ...        0 min,  0.004 sec
     gradient                   ...        0 min,  0.008 sec
 * total energy  :   -26.4114568 Eh     change       -0.2103052E-03 Eh
   gradient norm :     0.0032780 Eh/α   predicted    -0.1726174E-03 ( -17.92%)
   displ. norm   :     0.4123929 α      lambda       -0.1537680E-03
   maximum displ.:     0.3349044 α      in ANC's #3, #5, #4, ...

........................................................................
.............................. CYCLE   30 ..............................
........................................................................
   1    -26.9156258 -0.269156E+02  0.240E-01    3.42       0.0  T
   2    -26.9156269 -0.109729E-05  0.141E-01    3.42       1.0  T
   3    -26.9156249  0.201421E-05  0.113E-02    3.42       2.0  T
   4    -26.9156276 -0.270122E-05  0.173E-03    3.42      12.9  T
   5    -26.9156276 -0.116288E-08  0.102E-03    3.42      21.9  T
   6    -26.9156276 -0.917072E-08  0.373E-04    3.42      59.9  T
   7    -26.9156276 -0.105859E-08  0.108E-04    3.42     207.5  T
     SCC iter.                  ...        0 min,  0.005 sec
     gradient                   ...        0 min,  0.008 sec
 * total energy  :   -26.4115648 Eh     change       -0.1079097E-03 Eh
   gradient norm :     0.0028335 Eh/α   predicted    -0.8996570E-04 ( -16.63%)
   displ. norm   :     0.3691439 α      lambda       -0.9370266E-04
   maximum displ.:     0.3078170 α      in ANC's #3, #5, #4, ...

........................................................................
.............................. CYCLE   31 ..............................
........................................................................
   1    -26.9153832 -0.269154E+02  0.210E-01    3.42       0.0  T
   2    -26.9153840 -0.822237E-06  0.123E-01    3.42       1.0  T
   3    -26.9153827  0.124809E-05  0.921E-03    3.42       2.4  T
   4    -26.9153845 -0.175821E-05  0.171E-03    3.42      13.1  T
   5    -26.9153845  0.227739E-08  0.109E-03    3.42      20.5  T
   6    -26.9153845 -0.118950E-07  0.268E-04    3.42      83.5  T
   7    -26.9153845 -0.411855E-09  0.922E-05    3.42     242.6  T
     SCC iter.                  ...        0 min,  0.005 sec
     gradient                   ...        0 min,  0.008 sec
 * total energy  :   -26.4116173 Eh     change       -0.5256098E-04 Eh
   gradient norm :     0.0036765 Eh/α   predicted    -0.5323915E-04 (   1.29%)
   displ. norm   :     0.2400016 α      lambda       -0.1034848E-03
   maximum displ.:     0.1674664 α      in ANC's #3, #5, #6, ...

........................................................................
.............................. CYCLE   32 ..............................
........................................................................
   1    -26.9223746 -0.269224E+02  0.143E-01    3.42       0.0  T
   2    -26.9223761 -0.156394E-05  0.843E-02    3.42       1.0  T
   3    -26.9223560  0.201713E-04  0.351E-02    3.42       1.0  T
   4    -26.9223786 -0.226945E-04  0.214E-03    3.42      10.4  T
   5    -26.9223787 -0.422791E-07  0.130E-03    3.42      17.2  T
   6    -26.9223787 -0.195871E-07  0.402E-04    3.42      55.6  T
   7    -26.9223787 -0.946763E-10  0.203E-04    3.42     110.1  T
     SCC iter.                  ...        0 min,  0.005 sec
     gradient                   ...        0 min,  0.008 sec
 * total energy  :   -26.4115917 Eh     change        0.2565005E-04 Eh
   gradient norm :     0.0075731 Eh/α   predicted    -0.5472480E-04 (-313.35%)
   displ. norm   :     0.1969445 α      lambda       -0.1387339E-03
   maximum displ.:     0.1646025 α      in ANC's #3, #5, #4, ...

........................................................................
.............................. CYCLE   33 ..............................
........................................................................
   1    -26.9155379 -0.269155E+02  0.118E-01    3.42       0.0  T
   2    -26.9155387 -0.753983E-06  0.698E-02    3.42       1.0  T
   3    -26.9155238  0.149001E-04  0.312E-02    3.42       1.0  T
   4    -26.9155404 -0.165859E-04  0.128E-03    3.42      17.5  T
   5    -26.9155404 -0.119011E-07  0.686E-04    3.42      32.6  T
   6    -26.9155404 -0.169237E-08  0.390E-04    3.42      57.3  T
     SCC iter.                  ...        0 min,  0.004 sec
     gradient                   ...        0 min,  0.008 sec
 * total energy  :   -26.4116411 Eh     change       -0.4939792E-04 Eh
   gradient norm :     0.0052652 Eh/α   predicted    -0.7206300E-04 (  45.88%)
   displ. norm   :     0.1704082 α      lambda       -0.5488433E-04
   maximum displ.:     0.1248327 α      in ANC's #3, #5, #4, ...

........................................................................
.............................. CYCLE   34 ..............................
........................................................................
   1    -26.9173867 -0.269174E+02  0.114E-01    3.42       0.0  T
   2    -26.9173877 -0.103733E-05  0.682E-02    3.42       1.0  T
   3    -26.9173784  0.934138E-05  0.222E-02    3.42       1.0  T
   4    -26.9173890 -0.105827E-04  0.129E-03    3.42      17.3  T
   5    -26.9173890 -0.993501E-08  0.746E-04    3.42      30.0  T
   6    -26.9173890 -0.232010E-08  0.371E-04    3.42      60.3  T
     SCC iter.                  ...        0 min,  0.004 sec
     gradient                   ...        0 min,  0.008 sec
 * total energy  :   -26.4116392 Eh     change        0.1896914E-05 Eh
   gradient norm :     0.0052267 Eh/α   predicted    -0.2824106E-04 (*******%)
   displ. norm   :     0.0650771 α      lambda       -0.3497502E-04
   maximum displ.:     0.0436139 α      in ANC's #3, #5, #4, ...

........................................................................
.............................. CYCLE   35 ..............................
........................................................................
   1    -26.9174791 -0.269175E+02  0.462E-02    3.42       0.0  T
   2    -26.9174794 -0.245258E-06  0.277E-02    3.42       1.0  T
   3    -26.9174774  0.199379E-05  0.102E-02    3.42       2.2  T
   4    -26.9174796 -0.228136E-05  0.648E-04    3.42      34.5  T
   5    -26.9174797 -0.136347E-08  0.408E-04    3.42      54.8  T
     SCC iter.                  ...        0 min,  0.004 sec
     gradient                   ...        0 min,  0.008 sec
 * total energy  :   -26.4116566 Eh     change       -0.1741144E-04 Eh
   gradient norm :     0.0008696 Eh/α   predicted    -0.1756495E-04 (   0.88%)
   displ. norm   :     0.0982033 α      lambda       -0.2520646E-05
   maximum displ.:     0.0773027 α      in ANC's #3, #5, #6, ...

........................................................................
.............................. CYCLE   36 ..............................
........................................................................
   1    -26.9172082 -0.269172E+02  0.577E-02    3.42       0.0  T
   2    -26.9172082 -0.641326E-07  0.339E-02    3.42       1.0  T
   3    -26.9172080  0.215814E-06  0.371E-03    3.42       6.0  T
   4    -26.9172083 -0.263334E-06  0.391E-04    3.42      57.2  T
   5    -26.9172083 -0.304837E-09  0.245E-04    3.42      91.3  T
     SCC iter.                  ...        0 min,  0.004 sec
     gradient                   ...        0 min,  0.008 sec
 * total energy  :   -26.4116567 Eh     change       -0.9624747E-07 Eh
   gradient norm :     0.0012484 Eh/α   predicted    -0.1268688E-05 (1218.15%)
   displ. norm   :     0.0981567 α      lambda        0.1086942E-04
   maximum displ.:     0.0773013 α      in ANC's #3, #5, #6, ...

........................................................................
.............................. CYCLE   37 ..............................
........................................................................
   1    -26.9167957 -0.269168E+02  0.576E-02    3.42       0.0  T
   2    -26.9167958 -0.654018E-07  0.338E-02    3.42       1.0  T
   3    -26.9167955  0.233423E-06  0.382E-03    3.42       5.9  T
   4    -26.9167958 -0.282864E-06  0.398E-04    3.42      56.2  T
   5    -26.9167958 -0.382865E-09  0.242E-04    3.42      92.4  T
     SCC iter.                  ...        0 min,  0.004 sec
     gradient                   ...        0 min,  0.008 sec
 * total energy  :   -26.4116481 Eh     change        0.8548310E-05 Eh
   gradient norm :     0.0028080 Eh/α   predicted     0.5456311E-05 ( -36.17%)
   displ. norm   :     0.0731786 α      lambda       -0.1342671E-04
   maximum displ.:     0.0561863 α      in ANC's #3, #6, #5, ...

........................................................................
.............................. CYCLE   38 ..............................
........................................................................
   1    -26.9170617 -0.269171E+02  0.437E-02    3.42       0.0  T
   2    -26.9170618 -0.507228E-07  0.257E-02    3.42       1.0  T
   3    -26.9170615  0.300368E-06  0.410E-03    3.42       5.4  T
   4    -26.9170618 -0.345547E-06  0.386E-04    3.42      57.9  T
   5    -26.9170618 -0.536652E-09  0.236E-04    3.42      94.9  T
     SCC iter.                  ...        0 min,  0.004 sec
     gradient                   ...        0 min,  0.008 sec
 * total energy  :   -26.4116570 Eh     change       -0.8841922E-05 Eh
   gradient norm :     0.0009568 Eh/α   predicted    -0.6752130E-05 ( -23.64%)
   displ. norm   :     0.1098084 α      lambda        0.2178272E-06
   maximum displ.:     0.0842794 α      in ANC's #3, #6, #5, ...

........................................................................
.............................. CYCLE   39 ..............................
........................................................................
   1    -26.9173079 -0.269173E+02  0.656E-02    3.42       0.0  T
   2    -26.9173080 -0.113144E-06  0.387E-02    3.42       1.0  T
   3    -26.9173074  0.622832E-06  0.584E-03    3.42       3.8  T
   4    -26.9173081 -0.720937E-06  0.554E-04    3.42      40.4  T
   5    -26.9173081 -0.719353E-09  0.341E-04    3.42      65.5  T
     SCC iter.                  ...        0 min,  0.004 sec
     gradient                   ...        0 min,  0.008 sec
 * total energy  :   -26.4116540 Eh     change        0.2966468E-05 Eh
   gradient norm :     0.0019061 Eh/α   predicted     0.1070332E-06 ( -96.39%)
   displ. norm   :     0.0281174 α      lambda       -0.6081679E-05
   maximum displ.:     0.0174200 α      in ANC's #3, #6, #2, ...

........................................................................
.............................. CYCLE   40 ..............................
........................................................................
   1    -26.9176544 -0.269177E+02  0.187E-02    3.42       0.0  T
   2    -26.9176544 -0.378045E-07  0.112E-02    3.42       2.0  T
   3    -26.9176541  0.320691E-06  0.404E-03    3.42       5.5  T
   4    -26.9176545 -0.360748E-06  0.375E-04    3.42      59.6  T
   5    -26.9176545 -0.783750E-09  0.206E-04    3.42     108.5  T
     SCC iter.                  ...        0 min,  0.004 sec
     gradient                   ...        0 min,  0.008 sec
 * total energy  :   -26.4116581 Eh     change       -0.4109533E-05 Eh
   gradient norm :     0.0004074 Eh/α   predicted    -0.3045488E-05 ( -25.89%)
   displ. norm   :     0.0317259 α      lambda       -0.9440541E-06
   maximum displ.:     0.0245008 α      in ANC's #3, #4, #5, ...

   *** GEOMETRY OPTIMIZATION CONVERGED AFTER 40 ITERATIONS ***

------------------------------------------------------------------------
 total energy gain   :        -0.1038624 Eh      -65.1747 kcal/mol
 total RMSD          :         2.2937691 a0        1.2138 Å
 total power (kW/mol):        -6.8172693 (step) -377.1140 (real)
------------------------------------------------------------------------

 ANCopt (total)                0 d,  0 h,  0 min,  0.723 sec
 optimizer setup                ...        0 min,  0.000 sec (  0.020%)
 model hessian                  ...        0 min,  0.011 sec (  1.456%)
 ANC generation                 ...        0 min,  0.001 sec (  0.149%)
 coordinate transformation      ...        0 min,  0.001 sec (  0.078%)
 single point calculation       ...        0 min,  0.690 sec ( 95.455%)
 optimization log               ...        0 min,  0.003 sec (  0.466%)
 hessian update                 ...        0 min,  0.000 sec (  0.066%)
 rational function              ...        0 min,  0.014 sec (  1.991%)

================
 final structure:
================
$coord
    3.11160203814567   -2.76520099131000    3.55641719257533      C 
    4.43850333531798   -1.48856309982770    1.94222105763868      C 
    5.76843341177084   -0.20660329384638    0.33251338240807      C 
    6.62738102705700   -1.19369518697192   -2.23634724235765      C 
    8.03696309007980    1.02025911874976   -3.24587917497519      C 
    8.07161683174987    2.99724778372370   -1.65213318514863      C 
    6.68472553440238    2.49394092214149    0.74807244002981      C 
    9.47132634988391    5.05519654369548   -2.76928960888875      C 
   10.28428178314464    4.31040076073905   -5.05446605114032      C 
    9.44991911542223    1.64876065273860   -5.59544072671492      C 
    1.07227425202417   -2.72110247212845    3.54891588546888      H 
    3.98190770640278   -3.93311156380941    4.98440838295342      H 
    5.01237013482810   -1.71874395010770   -3.41636722933189      H 
    7.81701929874459   -2.87325124004287   -2.03513209038907      H 
    5.10000912123320    3.78933669474066    1.03348511051050      H 
    7.90609231045714    2.62500359288169    2.41004242250057      H 
    9.78727699969274    6.86084770721260   -1.89226038577299      H 
   11.38080448682095    5.39600379816131   -6.37542956245183      H 
   11.06213609910178    0.39994747300441   -5.90967273775571      H 
    8.26515548569350    1.55595956369099   -7.28217522550118      H 
$end
           -------------------------------------------------
          |                Final Singlepoint                |
           -------------------------------------------------

          ...................................................
          :                      SETUP                      :
          :.................................................:
          :  # basis functions                  50          :
          :  # atomic orbitals                  50          :
          :  # shells                           30          :
          :  # electrons                        50          :
          :  max. iterations                   250          :
          :  Hamiltonian                  GFN2-xTB          :
          :  restarted?                      false          :
          :  GBSA solvation                  false          :
          :  PC potential                    false          :
          :  electronic temp.          300.0000000     K    :
          :  accuracy                    1.0000000          :
          :  -> integral cutoff          0.2500000E+02      :
          :  -> integral neglect         0.1000000E-07      :
          :  -> SCF convergence          0.1000000E-05 Eh   :
          :  -> wf. convergence          0.1000000E-03 e    :
          :  Broyden damping             0.4000000          :
          ...................................................

 iter      E             dE          RMSdq      gap      omega  full diag
   1    -26.9176545 -0.269177E+02  0.106E-04    3.42       0.0  T
   2    -26.9176545 -0.189146E-10  0.464E-05    3.42     482.0  T
   3    -26.9176545 -0.214371E-10  0.477E-05    3.42     468.4  T

   *** convergence criteria satisfied after 3 iterations ***

         #    Occupation            Energy/Eh            Energy/eV
      -------------------------------------------------------------
         1        2.0000           -0.6456213             -17.5682
       ...           ...                  ...                  ...
        19        2.0000           -0.4448394             -12.1047
        20        2.0000           -0.4327288             -11.7751
        21        2.0000           -0.4246366             -11.5549
        22        2.0000           -0.4161589             -11.3243
        23        2.0000           -0.3907380             -10.6325
        24        2.0000           -0.3766233             -10.2484
        25        2.0000           -0.3533700              -9.6157 (HOMO)
        26                         -0.2277079              -6.1962 (LUMO)
        27                         -0.1910021              -5.1974
        28                         -0.1784188              -4.8550
        29                         -0.1357628              -3.6943
        30                          0.0648490               1.7646
       ...                                ...                  ...
        50                          1.1078173              30.1452
      -------------------------------------------------------------
                  HL-Gap            0.1256621 Eh            3.4194 eV
             Fermi-level           -0.2905389 Eh           -7.9060 eV

 SCC (total)                   0 d,  0 h,  0 min,  0.016 sec
 SCC setup                      ...        0 min,  0.000 sec (  0.985%)
 Dispersion                     ...        0 min,  0.000 sec (  0.947%)
 integral evaluation            ...        0 min,  0.005 sec ( 28.582%)
 zeroth order Hamiltonian       ...        0 min,  0.000 sec (  0.557%)
 iterations                     ...        0 min,  0.003 sec ( 17.116%)
 molecular gradient             ...        0 min,  0.008 sec ( 49.925%)
 printout                       ...        0 min,  0.000 sec (  1.591%)

         :::::::::::::::::::::::::::::::::::::::::::::::::::::
         ::                     SUMMARY                     ::
         :::::::::::::::::::::::::::::::::::::::::::::::::::::
         :: total energy             -26.411658097099 Eh    ::
         :: gradient norm              0.000406965039 Eh/a0 ::
         :: HOMO-LUMO gap              3.419439280781 eV    ::
         ::.................................................::
         :: SCC energy               -26.917654458733 Eh    ::
         :: -> isotropic ES            0.003701214871 Eh    ::
         :: -> anisotropic ES          0.003944450918 Eh    ::
         :: -> anisotropic XC          0.018393825331 Eh    ::
         :: -> dispersion             -0.016113051038 Eh    ::
         :: repulsion energy           0.506005914266 Eh    ::
         :: add. restraining           0.000000000000 Eh    ::
         :::::::::::::::::::::::::::::::::::::::::::::::::::::

           -------------------------------------------------
          |                Property Printout                |
           -------------------------------------------------

    * Orbital Energies and Occupations

         #    Occupation            Energy/Eh            Energy/eV
      -------------------------------------------------------------
         1        2.0000           -0.6456213             -17.5682
       ...           ...                  ...                  ...
        13        2.0000           -0.4923286             -13.3969
        14        2.0000           -0.4791069             -13.0372
        15        2.0000           -0.4752722             -12.9328
        16        2.0000           -0.4702217             -12.7954
        17        2.0000           -0.4642315             -12.6324
        18        2.0000           -0.4472238             -12.1696
        19        2.0000           -0.4448394             -12.1047
        20        2.0000           -0.4327288             -11.7751
        21        2.0000           -0.4246366             -11.5549
        22        2.0000           -0.4161589             -11.3243
        23        2.0000           -0.3907380             -10.6325
        24        2.0000           -0.3766233             -10.2484
        25        2.0000           -0.3533700              -9.6157 (HOMO)
        26                         -0.2277079              -6.1962 (LUMO)
        27                         -0.1910021              -5.1974
        28                         -0.1784188              -4.8550
        29                         -0.1357628              -3.6943
        30                          0.0648490               1.7646
        31                          0.0725298               1.9736
        32                          0.0965543               2.6274
        33                          0.1209937               3.2924
        34                          0.1575331               4.2867
        35                          0.1588868               4.3235
        36                          0.1619654               4.4073
       ...                                ...                  ...
        50                          1.1078173              30.1452
      -------------------------------------------------------------
                  HL-Gap            0.1256621 Eh            3.4194 eV
             Fermi-level           -0.2905389 Eh           -7.9060 eV

     #   Z        covCN         q      C6AA      α(0)
     1   6 C      2.833    -0.097    30.422     9.039
     2   6 C      1.969    -0.035    32.010     9.137
     3   6 C      3.005    -0.002    28.067     8.691
     4   6 C      3.833    -0.054    21.512     6.599
     5   6 C      3.113    -0.017    28.267     8.709
     6   6 C      3.126    -0.012    28.119     8.683
     7   6 C      3.834    -0.054    21.517     6.599
     8   6 C      2.988    -0.045    29.102     8.849
     9   6 C      3.014    -0.050    29.227     8.868
    10   6 C      3.880    -0.063    21.663     6.617
    11   1 H      0.926     0.046     2.372     2.408
    12   1 H      0.926     0.046     2.372     2.408
    13   1 H      0.924     0.042     2.423     2.434
    14   1 H      0.924     0.042     2.423     2.434
    15   1 H      0.924     0.042     2.420     2.433
    16   1 H      0.924     0.042     2.419     2.432
    17   1 H      0.926     0.025     2.665     2.553
    18   1 H      0.926     0.024     2.668     2.554
    19   1 H      0.924     0.060     2.199     2.319
    20   1 H      0.924     0.060     2.199     2.319

 Mol. C6AA /au·bohr⁶  :       4527.130230
 Mol. C8AA /au·bohr⁸  :     110449.823496
 Mol. α(0) /au        :        106.086728


Wiberg/Mayer (AO) data.
largest (>0.10) Wiberg bond orders for each atom
          total WBO             WBO to atom ...
     1  C   3.984        C    2 1.976    H   11 0.949    H   12 0.949
     2  C   3.978        C    1 1.976    C    3 1.910
     3  C   3.980        C    2 1.910    C    7 0.970    C    4 0.969
     4  C   3.999        C    5 1.024    C    3 0.969    H   13 0.954    H   14 0.953
     5  C   3.981        C    6 1.712    C   10 1.030    C    4 1.024    C    9 0.122
     6  C   3.982        C    5 1.712    C    8 1.132    C    7 1.017
     7  C   3.998        C    6 1.017    C    3 0.970    H   15 0.956    H   16 0.956
     8  C   3.988        C    9 1.801    C    6 1.132    H   17 0.972
     9  C   3.986        C    8 1.801    C   10 1.032    H   18 0.973    C    5 0.122
    10  C   3.997        C    9 1.032    C    5 1.030    H   19 0.936    H   20 0.936
    11  H   0.998        C    1 0.949
    12  H   0.998        C    1 0.949
    13  H   0.998        C    4 0.954
    14  H   0.998        C    4 0.953
    15  H   0.998        C    7 0.956
    16  H   0.998        C    7 0.956
    17  H   0.999        C    8 0.972
    18  H   0.999        C    9 0.973
    19  H   0.996        C   10 0.936
    20  H   0.996        C   10 0.936

molecular dipole:
                 x           y           z       tot (Debye)
 q only:        0.039      -0.160      -0.213
   full:        0.040      -0.194      -0.243       0.796
molecular quadrupole (traceless):
                xx          xy          yy          xz          yz          zz
 q only:       -0.431      -2.212      -1.827      -3.233       1.249       2.258
  q+dip:       -1.249      -1.484      -2.241      -5.444       0.673       3.489
   full:       -0.623      -2.416      -2.247      -4.117       1.157       2.870

           -------------------------------------------------
          |                Geometry Summary                 |
           -------------------------------------------------

      molecular mass/u    :      130.1890000
   center of mass at/Å    :        3.8048597       0.6180211      -0.7434222
  moments of inertia/u·Å² :        0.1136129E+03   0.6392570E+03   0.7400919E+03
rotational constants/cm⁻¹ :        0.1483778E+00   0.2637066E-01   0.2277776E-01

 * 18 selected distances

     #   Z        #   Z                                     value/Å
     1   6 C      2   6 C                                 1.2957930
     2   6 C      3   6 C                                 1.2965700
     4   6 C      5   6 C                                 1.4880771
     5   6 C      6   6 C                                 1.3439135
     6   6 C      7   6 C                                 1.4909068 (max)
     6   6 C      8   6 C                                 1.4436338
     8   6 C      9   6 C                                 1.3426562
     5   6 C     10   6 C                                 1.4884749
     1   6 C     11   1 H                                 1.0794255
     1   6 C     12   1 H                                 1.0793927
     4   6 C     13   1 H                                 1.0943078
     4   6 C     14   1 H                                 1.0943400
     7   6 C     15   1 H                                 1.0935979
     7   6 C     16   1 H                                 1.0936263
     8   6 C     17   1 H                                 1.0753347
     9   6 C     18   1 H                                 1.0748736 (min)
    10   6 C     19   1 H                                 1.0918916
    10   6 C     20   1 H                                 1.0918698

 * 2 distinct bonds (by element types)

   Z      Z             #   av. dist./Å        max./Å        min./Å
   1 H    6 C          10     1.0868660     1.0943400     1.0748736
   6 C    6 C           8     1.3987532     1.4909068     1.2957930


optimized geometry written to: xtbopt.xyz


           -------------------------------------------------
          | TOTAL ENERGY              -26.411658097099 Eh   |
          | GRADIENT NORM               0.000406965039 Eh/α |
          | HOMO-LUMO GAP               3.419439280781 eV   |
           -------------------------------------------------

------------------------------------------------------------------------
 * finished run on 2021/05/19 at 11:00:47.638     
------------------------------------------------------------------------
 total:
 * wall-time:     0 d,  0 h,  0 min,  0.781 sec
 *  cpu-time:     0 d,  0 h,  0 min,  0.777 sec
 * ratio c/w:     0.996 speedup
 SCF:
 * wall-time:     0 d,  0 h,  0 min,  0.024 sec
 *  cpu-time:     0 d,  0 h,  0 min,  0.024 sec
 * ratio c/w:     0.997 speedup
 ANC optimizer:
 * wall-time:     0 d,  0 h,  0 min,  0.739 sec
 *  cpu-time:     0 d,  0 h,  0 min,  0.738 sec
 * ratio c/w:     0.998 speedup

