      -----------------------------------------------------------      
     |                   =====================                   |     
     |                           x T B                           |     
     |                   =====================                   |     
     |                         S. Grimme                         |     
     |          Mulliken Center for Theoretical Chemistry        |     
     |                    University of Bonn                     |     
     |                Version 6.2 RC2 (SAW190805)                |     
      -----------------------------------------------------------      

   This program is distributed in the hope that it will be useful,
   but WITHOUT ANY WARRANTY; without even the implied warranty of
   MERCHANTABILITY or FITNESS FOR A PARTICULAR PURPOSE.
   
   FOR NON-COMMERCIAL, ACADEMIA USE ONLY.
   
   Cite this work as:
   * S. Grimme, C. Bannwarth, P. Shushkov, J. Chem. Theory Comput., 2017,
     13, 1989-2009. DOI: 10.1021/acs.jctc.7b00118
   * C. Bannwarth, S. Ehlert and S. Grimme., J. Chem. Theory Comput., 2019,
     15, 1652-1671. DOI: 10.1021/acs.jctc.8b01176
   * P. Pracht, E. Caldeweyher, S. Ehlert, S. Grimme, ChemRxiv, 2019, preprint.
     DOI: 10.26434/chemrxiv.8326202.v1
   
   for DFT-D4:
   * E. Caldeweyher, C. Bannwarth and S. Grimme, J. Chem. Phys., 2017,
     147, 034112. DOI: 10.1063/1.4993215
   * E. Caldeweyher, S. Ehlert, A. Hansen, H. Neugebauer, S. Spicher,
     C. Bannwarth and S. Grimme, J. Chem. Phys., 2019, 150, 154122.
     DOI: 10.1063/1.5090222
   
   for sTDA-xTB:
   * S. Grimme and C. Bannwarth, J. Chem. Phys., 2016, 145, 054103.
     DOI: 10.1063/1.4959605
   
   in the mass-spec context:
   * V. Asgeirsson, C. Bauer and S. Grimme, Chem. Sci., 2017, 8, 4879.
     DOI: 10.1039/c7sc00601b
   
   for metadynamics refer to:
   * S. Grimme, J. Chem. Theory Comput., 2019, 155, 2847-2862
     DOI: 10.1021/acs.jctc.9b00143
   
   with help from (in alphabetical order)
   C. Bannwarth, F. Bohle, G. Brandenburg, E. Caldeweyher, M. Checinski,
   S. Dohm, S. Ehlert, S. Ehrlich, F. März, H. Neugebauer, J. Pisarek,
   P. Pracht, P. Shushkov, and S. Spicher.
   
 * started run on 2021/05/19 at 11:00:48.979     

           -------------------------------------------------
          |                Calculation Setup                |
           -------------------------------------------------

          program call               : /ihome/ghutchison/geoffh/xtb/xtb 1029.xyz -opt
          hostname                   : smp-n144
          coordinate file            : 1029.xyz
          omp threads                :                     1
          number of atoms            :                    28
          number of electrons        :                    76
          charge                     :                     0
          spin                       :                   0.0
          first test random number   :      0.03487656636374


########################################################################
# WARNING! Please study the warnings concerning your input carefully
#  - the use of '-opt' is discouraged, please use '--opt' next time
########################################################################

           ------------------------------------------------- 
          |                 G F N 2 - x T B                 |
          | Geometry, Frequencies, Noncovalent interactions |
          |            JCTC 2019 parametrisation            |
           ------------------------------------------------- 
             KAB for C  - Si     :                1.0500
             KAB for H  - Pd     :                0.9500
             k(s)              :                1.8500
             k(p)              :                2.2300
             k(d)              :                2.2300
             k(f)              :                2.0000
             kEN (H0ij)        :               -2.0000
             D4 a1             :                0.5200
             D4 a2             :                5.0000
             D4 s6             :                1.0000
             D4 s8             :                2.7000
             D4 s9             :                5.0000
             alphaj            :                2.0000

  Z AO/shell   Hii/eV     exponent
  1     Wed Apr 25 08:07:45 CEST 2018   EN: 2.200 GM2: 0.406  GM3: 0.0800  RAES: 1.40
     1s    -10.707211    1.230000
  6     Wed Apr 25 08:07:45 CEST 2018   EN: 2.550 GM2: 0.538  GM3: 0.1500  RAES: 3.00
     2s    -13.970922    2.096432
     2p    -10.063292    1.800000

           ------------------------------------------------- 
          |        Self-Consistent Charge Iterations        |
           ------------------------------------------------- 

          ...................................................
          :                      SETUP                      :
          :.................................................:
          :  # basis functions                  76          :
          :  # atomic orbitals                  76          :
          :  # shells                           44          :
          :  # electrons                        76          :
          :  max. iterations                   250          :
          :  Hamiltonian                  GFN2-xTB          :
          :  restarted?                      false          :
          :  GBSA solvation                  false          :
          :  PC potential                    false          :
          :  electronic temp.          300.0000000     K    :
          :  accuracy                    1.0000000          :
          :  -> integral cutoff          0.2500000E+02      :
          :  -> integral neglect         0.1000000E-07      :
          :  -> SCF convergence          0.1000000E-05 Eh   :
          :  -> wf. convergence          0.1000000E-03 e    :
          :  Broyden damping             0.4000000          :
          ...................................................

 iter      E             dE          RMSdq      gap      omega  full diag
   1    -41.0624848 -0.410625E+02  0.498E+00    1.89       0.0  T
   2    -41.0855083 -0.230235E-01  0.298E+00    1.87       1.0  T
   3    -41.0717924  0.137159E-01  0.820E-01    1.88       1.0  T
   4    -41.0869004 -0.151079E-01  0.299E-01    1.88       1.0  T
   5    -41.0891847 -0.228432E-02  0.749E-02    1.87       1.0  T
   6    -41.0892709 -0.862437E-04  0.329E-02    1.88       1.0  T
   7    -41.0892643  0.667443E-05  0.292E-02    1.88       1.0  T
   8    -41.0892804 -0.161530E-04  0.835E-03    1.88       2.3  T
   9    -41.0892816 -0.121198E-05  0.347E-03    1.88       5.4  T
  10    -41.0892819 -0.258541E-06  0.491E-04    1.88      38.5  T
  11    -41.0892819  0.398494E-09  0.289E-04    1.88      65.4  T

   *** convergence criteria satisfied after 11 iterations ***

         #    Occupation            Energy/Eh            Energy/eV
      -------------------------------------------------------------
         1        2.0000           -0.6491441             -17.6641
       ...           ...                  ...                  ...
        32        2.0000           -0.4239962             -11.5375
        33        2.0000           -0.4172111             -11.3529
        34        2.0000           -0.4069683             -11.0742
        35        2.0000           -0.4011283             -10.9153
        36        2.0000           -0.4001727             -10.8893
        37        2.0000           -0.3996682             -10.8755
        38        2.0000           -0.3529578              -9.6045 (HOMO)
        39                         -0.2840217              -7.7286 (LUMO)
        40                         -0.2254836              -6.1357
        41                         -0.2234259              -6.0797
        42                         -0.2137285              -5.8158
        43                         -0.1788143              -4.8658
       ...                                ...                  ...
        76                          0.6957101              18.9312
      -------------------------------------------------------------
                  HL-Gap            0.0689362 Eh            1.8758 eV
             Fermi-level           -0.3184897 Eh           -8.6665 eV

 SCC (total)                   0 d,  0 h,  0 min,  0.045 sec
 SCC setup                      ...        0 min,  0.000 sec (  0.740%)
 Dispersion                     ...        0 min,  0.001 sec (  1.156%)
 integral evaluation            ...        0 min,  0.011 sec ( 23.676%)
 zeroth order Hamiltonian       ...        0 min,  0.000 sec (  0.491%)
 iterations                     ...        0 min,  0.016 sec ( 35.424%)
 molecular gradient             ...        0 min,  0.017 sec ( 37.442%)
 printout                       ...        0 min,  0.000 sec (  0.951%)

         :::::::::::::::::::::::::::::::::::::::::::::::::::::
         ::                     SUMMARY                     ::
         :::::::::::::::::::::::::::::::::::::::::::::::::::::
         :: total energy             -40.330103183399 Eh    ::
         :: gradient norm              0.097285596648 Eh/a0 ::
         :: HOMO-LUMO gap              1.875848969836 eV    ::
         ::.................................................::
         :: SCC energy               -41.089281877480 Eh    ::
         :: -> isotropic ES            0.001913525191 Eh    ::
         :: -> anisotropic ES          0.005080825963 Eh    ::
         :: -> anisotropic XC          0.028416681973 Eh    ::
         :: -> dispersion             -0.031424995794 Eh    ::
         :: repulsion energy           0.759085888809 Eh    ::
         :: add. restraining           0.000000000000 Eh    ::
         :::::::::::::::::::::::::::::::::::::::::::::::::::::

      ----------------------------------------------------------- 
     |                   =====================                   |
     |                        A N C O P T                        |
     |                   =====================                   |
     |               Approximate Normal Coordinate               |
     |                Rational Function Optimizer                |
      ----------------------------------------------------------- 

          ...................................................
          :                      SETUP                      :
          :.................................................:
          :   optimization level            normal          :
          :   max. optcycles                   200          :
          :   ANC micro-cycles                  20          :
          :   degrees of freedom                78          :
          :.................................................:
          :   RF solver                   davidson          :
          :   input Hessian                  false          :
          :   write xtbopt.log                true          :
          :   linear?                        false          :
          :   energy convergence         0.5000000E-05 Eh   :
          :   grad. convergence          0.1000000E-02 Eh/α :
          :   maximium RF displ.         2.0000000          :
          :   Hlow (freq-cutoff)         0.5000000E-02      :
          :   Hmax (freq-cutoff)         5.0000000          :
          :   S6 in model hess.         20.0000000          :
          ...................................................

generating ANC from model Hessian ...
Using Lindh-Hessian (1995)
 Shifting diagonal of input Hessian by   3.557246127443441E-003
 Lowest  eigenvalues of input Hessian
   -0.000000   -0.000000   -0.000000   -0.000000    0.000000    0.000000
    0.005000    0.005850    0.006044    0.006636    0.009035    0.013706
    0.013841    0.015354    0.017691    0.021101    0.024048    0.024170
 Highest eigenvalues
    1.848318    1.871843    1.938692    1.947134    2.013134    2.090731
 

........................................................................
.............................. CYCLE    1 ..............................
........................................................................
   1    -41.0892819 -0.410893E+02  0.809E-05    1.88       0.0  T
   2    -41.0892819  0.146230E-10  0.633E-05    1.88     298.5  T
   3    -41.0892819 -0.769944E-10  0.396E-05    1.88     477.5  T
     SCC iter.                  ...        0 min,  0.005 sec
     gradient                   ...        0 min,  0.017 sec
 * total energy  :   -40.3301032 Eh     change        0.1779961E-07 Eh
   gradient norm :     0.0972865 Eh/α   predicted     0.0000000E+00 (-100.00%)
   displ. norm   :     0.2890911 α      lambda       -0.9914047E-02
   maximum displ.:     0.1997696 α      in ANC's #15, #8, #7, ...

........................................................................
.............................. CYCLE    2 ..............................
........................................................................
   1    -41.1266648 -0.411267E+02  0.141E-01    2.07       0.0  T
   2    -41.1266933 -0.285229E-04  0.856E-02    2.07       1.0  T
   3    -41.1266689  0.244027E-04  0.485E-02    2.07       1.0  T
   4    -41.1266984 -0.295669E-04  0.194E-02    2.07       1.0  T
   5    -41.1267090 -0.105647E-04  0.402E-03    2.07       4.7  T
   6    -41.1267091 -0.984178E-07  0.227E-03    2.07       8.3  T
   7    -41.1267092 -0.598756E-07  0.883E-04    2.07      21.4  T
     SCC iter.                  ...        0 min,  0.009 sec
     gradient                   ...        0 min,  0.016 sec
 * total energy  :   -40.3368678 Eh     change       -0.6764620E-02 Eh
   gradient norm :     0.0407632 Eh/α   predicted    -0.5371309E-02 ( -20.60%)
   displ. norm   :     0.2263999 α      lambda       -0.2586336E-02
   maximum displ.:     0.1494175 α      in ANC's #8, #15, #7, ...

........................................................................
.............................. CYCLE    3 ..............................
........................................................................
   1    -41.1423275 -0.411423E+02  0.104E-01    2.20       0.0  T
   2    -41.1423386 -0.110705E-04  0.620E-02    2.20       1.0  T
   3    -41.1423284  0.102652E-04  0.299E-02    2.20       1.0  T
   4    -41.1423428 -0.144730E-04  0.727E-03    2.20       2.6  T
   5    -41.1423442 -0.134111E-05  0.233E-03    2.20       8.1  T
   6    -41.1423442 -0.237021E-07  0.136E-03    2.20      13.9  T
     SCC iter.                  ...        0 min,  0.008 sec
     gradient                   ...        0 min,  0.016 sec
 * total energy  :   -40.3383005 Eh     change       -0.1432718E-02 Eh
   gradient norm :     0.0076146 Eh/α   predicted    -0.1359480E-02 (  -5.11%)
   displ. norm   :     0.0963121 α      lambda       -0.2387088E-03
   maximum displ.:     0.0624768 α      in ANC's #8, #5, #7, ...

........................................................................
.............................. CYCLE    4 ..............................
........................................................................
   1    -41.1407548 -0.411408E+02  0.490E-02    2.21       0.0  T
   2    -41.1407552 -0.447845E-06  0.291E-02    2.21       1.0  T
   3    -41.1407524  0.281225E-05  0.975E-03    2.21       1.9  T
   4    -41.1407554 -0.298759E-05  0.278E-03    2.21       6.8  T
   5    -41.1407556 -0.171675E-06  0.785E-04    2.21      24.1  T
     SCC iter.                  ...        0 min,  0.007 sec
     gradient                   ...        0 min,  0.016 sec
 * total energy  :   -40.3384433 Eh     change       -0.1428256E-03 Eh
   gradient norm :     0.0043141 Eh/α   predicted    -0.1204902E-03 ( -15.64%)
   displ. norm   :     0.0961545 α      lambda       -0.1206864E-03
   maximum displ.:     0.0554397 α      in ANC's #2, #8, #4, ...

........................................................................
.............................. CYCLE    5 ..............................
........................................................................
   1    -41.1387345 -0.411387E+02  0.453E-02    2.21       0.0  T
   2    -41.1387345 -0.508271E-07  0.270E-02    2.21       1.0  T
   3    -41.1387264  0.814537E-05  0.166E-02    2.21       1.1  T
   4    -41.1387351 -0.878642E-05  0.175E-03    2.21      10.8  T
   5    -41.1387352 -0.598148E-07  0.621E-04    2.21      30.4  T
   6    -41.1387352  0.578098E-10  0.339E-04    2.21      55.7  T
     SCC iter.                  ...        0 min,  0.008 sec
     gradient                   ...        0 min,  0.016 sec
 * total energy  :   -40.3384908 Eh     change       -0.4742493E-04 Eh
   gradient norm :     0.0027893 Eh/α   predicted    -0.6090286E-04 (  28.42%)
   displ. norm   :     0.0374778 α      lambda       -0.3509469E-04
   maximum displ.:     0.0239104 α      in ANC's #2, #5, #4, ...

........................................................................
.............................. CYCLE    6 ..............................
........................................................................
   1    -41.1389781 -0.411390E+02  0.237E-02    2.21       0.0  T
   2    -41.1389782 -0.290030E-07  0.142E-02    2.21       1.3  T
   3    -41.1389773  0.858566E-06  0.555E-03    2.21       3.4  T
   4    -41.1389782 -0.915043E-06  0.816E-04    2.21      23.2  T
   5    -41.1389782 -0.144519E-07  0.291E-04    2.21      65.0  T
     SCC iter.                  ...        0 min,  0.007 sec
     gradient                   ...        0 min,  0.017 sec
 * total energy  :   -40.3385170 Eh     change       -0.2619862E-04 Eh
   gradient norm :     0.0013410 Eh/α   predicted    -0.1757301E-04 ( -32.92%)
   displ. norm   :     0.1420895 α      lambda       -0.4309124E-04
   maximum displ.:     0.1034086 α      in ANC's #2, #5, #4, ...

........................................................................
.............................. CYCLE    7 ..............................
........................................................................
   1    -41.1395264 -0.411395E+02  0.811E-02    2.20       0.0  T
   2    -41.1395266 -0.223081E-06  0.479E-02    2.20       1.0  T
   3    -41.1395230  0.359873E-05  0.116E-02    2.20       1.6  T
   4    -41.1395269 -0.388797E-05  0.161E-03    2.20      11.7  T
   5    -41.1395269 -0.563909E-07  0.650E-04    2.20      29.1  T
   6    -41.1395269 -0.124167E-08  0.321E-04    2.20      58.8  T
     SCC iter.                  ...        0 min,  0.008 sec
     gradient                   ...        0 min,  0.017 sec
 * total energy  :   -40.3385632 Eh     change       -0.4619982E-04 Eh
   gradient norm :     0.0030662 Eh/α   predicted    -0.2174383E-04 ( -52.94%)
   displ. norm   :     0.1235521 α      lambda       -0.4687986E-04
   maximum displ.:     0.0910614 α      in ANC's #2, #5, #4, ...

........................................................................
.............................. CYCLE    8 ..............................
........................................................................
   1    -41.1395132 -0.411395E+02  0.691E-02    2.19       0.0  T
   2    -41.1395134 -0.148657E-06  0.406E-02    2.19       1.0  T
   3    -41.1395128  0.535023E-06  0.493E-03    2.19       3.8  T
   4    -41.1395135 -0.637706E-06  0.732E-04    2.19      25.8  T
   5    -41.1395135 -0.104602E-07  0.392E-04    2.19      48.3  T
     SCC iter.                  ...        0 min,  0.007 sec
     gradient                   ...        0 min,  0.017 sec
 * total energy  :   -40.3386068 Eh     change       -0.4362569E-04 Eh
   gradient norm :     0.0034917 Eh/α   predicted    -0.2379854E-04 ( -45.45%)
   displ. norm   :     0.1804445 α      lambda       -0.7832328E-04
   maximum displ.:     0.1289741 α      in ANC's #2, #5, #4, ...

........................................................................
.............................. CYCLE    9 ..............................
........................................................................
   1    -41.1393637 -0.411394E+02  0.102E-01    2.19       0.0  T
   2    -41.1393640 -0.341765E-06  0.599E-02    2.19       1.0  T
   3    -41.1393635  0.552288E-06  0.543E-03    2.19       3.5  T
   4    -41.1393642 -0.757228E-06  0.744E-04    2.19      25.4  T
   5    -41.1393642 -0.403029E-08  0.468E-04    2.19      40.4  T
     SCC iter.                  ...        0 min,  0.007 sec
     gradient                   ...        0 min,  0.017 sec
 * total energy  :   -40.3386741 Eh     change       -0.6728314E-04 Eh
   gradient norm :     0.0027900 Eh/α   predicted    -0.4044074E-04 ( -39.89%)
   displ. norm   :     0.2192345 α      lambda       -0.8155319E-04
   maximum displ.:     0.1622578 α      in ANC's #2, #5, #4, ...

........................................................................
.............................. CYCLE   10 ..............................
........................................................................
   1    -41.1386795 -0.411387E+02  0.126E-01    2.18       0.0  T
   2    -41.1386800 -0.503963E-06  0.742E-02    2.18       1.0  T
   3    -41.1386794  0.631695E-06  0.624E-03    2.18       3.0  T
   4    -41.1386803 -0.904179E-06  0.909E-04    2.18      20.8  T
   5    -41.1386803 -0.931222E-08  0.621E-04    2.18      30.4  T
     SCC iter.                  ...        0 min,  0.007 sec
     gradient                   ...        0 min,  0.017 sec
 * total energy  :   -40.3387339 Eh     change       -0.5979768E-04 Eh
   gradient norm :     0.0028789 Eh/α   predicted    -0.4273931E-04 ( -28.53%)
   displ. norm   :     0.1569683 α      lambda       -0.5252195E-04
   maximum displ.:     0.1277108 α      in ANC's #2, #5, #1, ...

........................................................................
.............................. CYCLE   11 ..............................
........................................................................
   1    -41.1389774 -0.411390E+02  0.892E-02    2.17       0.0  T
   2    -41.1389777 -0.269738E-06  0.524E-02    2.17       1.0  T
   3    -41.1389773  0.428296E-06  0.490E-03    2.17       3.9  T
   4    -41.1389778 -0.571346E-06  0.724E-04    2.17      26.1  T
   5    -41.1389778 -0.607667E-08  0.414E-04    2.17      45.7  T
     SCC iter.                  ...        0 min,  0.007 sec
     gradient                   ...        0 min,  0.017 sec
 * total energy  :   -40.3387693 Eh     change       -0.3547311E-04 Eh
   gradient norm :     0.0020595 Eh/α   predicted    -0.2690898E-04 ( -24.14%)
   displ. norm   :     0.1159919 α      lambda       -0.2639216E-04
   maximum displ.:     0.0990275 α      in ANC's #2, #5, #1, ...

........................................................................
.............................. CYCLE   12 ..............................
........................................................................
   1    -41.1387498 -0.411387E+02  0.687E-02    2.17       0.0  T
   2    -41.1387499 -0.105988E-06  0.404E-02    2.17       1.0  T
   3    -41.1387483  0.155703E-05  0.769E-03    2.17       2.5  T
   4    -41.1387500 -0.170219E-05  0.860E-04    2.17      22.0  T
   5    -41.1387500 -0.138934E-07  0.363E-04    2.17      52.1  T
   6    -41.1387500 -0.441290E-09  0.177E-04    2.17     107.0  T
     SCC iter.                  ...        0 min,  0.008 sec
     gradient                   ...        0 min,  0.017 sec
 * total energy  :   -40.3387887 Eh     change       -0.1936543E-04 Eh
   gradient norm :     0.0017870 Eh/α   predicted    -0.1337798E-04 ( -30.92%)
   displ. norm   :     0.1628064 α      lambda       -0.3073356E-04
   maximum displ.:     0.1479249 α      in ANC's #2, #5, #4, ...

........................................................................
.............................. CYCLE   13 ..............................
........................................................................
   1    -41.1398624 -0.411399E+02  0.935E-02    2.16       0.0  T
   2    -41.1398626 -0.199856E-06  0.551E-02    2.16       1.0  T
   3    -41.1398574  0.515237E-05  0.135E-02    2.16       1.4  T
   4    -41.1398630 -0.555097E-05  0.137E-03    2.16      13.8  T
   5    -41.1398630 -0.326485E-07  0.602E-04    2.16      31.4  T
   6    -41.1398630 -0.229647E-08  0.293E-04    2.16      64.5  T
     SCC iter.                  ...        0 min,  0.008 sec
     gradient                   ...        0 min,  0.017 sec
 * total energy  :   -40.3388045 Eh     change       -0.1580446E-04 Eh
   gradient norm :     0.0025943 Eh/α   predicted    -0.1555279E-04 (  -1.59%)
   displ. norm   :     0.1295151 α      lambda       -0.2395815E-04
   maximum displ.:     0.1117170 α      in ANC's #2, #5, #3, ...

........................................................................
.............................. CYCLE   14 ..............................
........................................................................
   1    -41.1385781 -0.411386E+02  0.772E-02    2.15       0.0  T
   2    -41.1385783 -0.157876E-06  0.454E-02    2.15       1.0  T
   3    -41.1385761  0.220185E-05  0.927E-03    2.15       2.0  T
   4    -41.1385785 -0.240948E-05  0.108E-03    2.15      17.4  T
   5    -41.1385785 -0.248471E-07  0.423E-04    2.15      44.7  T
   6    -41.1385785 -0.788518E-09  0.202E-04    2.15      93.4  T
     SCC iter.                  ...        0 min,  0.008 sec
     gradient                   ...        0 min,  0.017 sec
 * total energy  :   -40.3388108 Eh     change       -0.6323954E-05 Eh
   gradient norm :     0.0015671 Eh/α   predicted    -0.1218221E-04 (  92.64%)
   displ. norm   :     0.1009637 α      lambda       -0.1512907E-04
   maximum displ.:     0.0788973 α      in ANC's #2, #5, #1, ...

........................................................................
.............................. CYCLE   15 ..............................
........................................................................
   1    -41.1397504 -0.411398E+02  0.618E-02    2.16       0.0  T
   2    -41.1397505 -0.102069E-06  0.364E-02    2.16       1.0  T
   3    -41.1397483  0.218040E-05  0.924E-03    2.16       2.0  T
   4    -41.1397507 -0.236070E-05  0.104E-03    2.16      18.2  T
   5    -41.1397507 -0.232009E-07  0.402E-04    2.16      47.0  T
   6    -41.1397507 -0.910362E-09  0.215E-04    2.16      87.8  T
     SCC iter.                  ...        0 min,  0.008 sec
     gradient                   ...        0 min,  0.017 sec
 * total energy  :   -40.3388186 Eh     change       -0.7752027E-05 Eh
   gradient norm :     0.0018017 Eh/α   predicted    -0.7599464E-05 (  -1.97%)
   displ. norm   :     0.0277372 α      lambda       -0.6871998E-05
   maximum displ.:     0.0168959 α      in ANC's #4, #1, #10, ...

........................................................................
.............................. CYCLE   16 ..............................
........................................................................
   1    -41.1395245 -0.411395E+02  0.134E-02    2.16       0.0  T
   2    -41.1395245 -0.410534E-07  0.788E-03    2.16       2.4  T
   3    -41.1395245  0.439112E-07  0.155E-03    2.16      12.2  T
   4    -41.1395245 -0.557884E-07  0.368E-04    2.16      51.4  T
   5    -41.1395245 -0.105992E-08  0.168E-04    2.16     112.2  T
     SCC iter.                  ...        0 min,  0.007 sec
     gradient                   ...        0 min,  0.017 sec
 * total energy  :   -40.3388225 Eh     change       -0.3898155E-05 Eh
   gradient norm :     0.0011675 Eh/α   predicted    -0.3437725E-05 ( -11.81%)
   displ. norm   :     0.0608486 α      lambda       -0.4646194E-05
   maximum displ.:     0.0506825 α      in ANC's #2, #4, #5, ...

........................................................................
.............................. CYCLE   17 ..............................
........................................................................
   1    -41.1391310 -0.411391E+02  0.318E-02    2.16       0.0  T
   2    -41.1391310 -0.452449E-07  0.187E-02    2.16       1.0  T
   3    -41.1391308  0.231171E-06  0.309E-03    2.16       6.1  T
   4    -41.1391310 -0.260970E-06  0.415E-04    2.16      45.5  T
   5    -41.1391310 -0.273126E-08  0.231E-04    2.16      81.8  T
     SCC iter.                  ...        0 min,  0.007 sec
     gradient                   ...        0 min,  0.017 sec
 * total energy  :   -40.3388261 Eh     change       -0.3624017E-05 Eh
   gradient norm :     0.0006277 Eh/α   predicted    -0.2327256E-05 ( -35.78%)
   displ. norm   :     0.0178861 α      lambda       -0.1198675E-05
   maximum displ.:     0.0109816 α      in ANC's #1, #2, #4, ...

   *** GEOMETRY OPTIMIZATION CONVERGED AFTER 17 ITERATIONS ***

------------------------------------------------------------------------
 total energy gain   :        -0.0087229 Eh       -5.4737 kcal/mol
 total RMSD          :         0.2708183 a0        0.1433 Å
 total power (kW/mol):        -1.3471775 (step)  -37.5593 (real)
------------------------------------------------------------------------

 ANCopt (total)                0 d,  0 h,  0 min,  0.610 sec
 optimizer setup                ...        0 min,  0.000 sec (  0.024%)
 model hessian                  ...        0 min,  0.005 sec (  0.821%)
 ANC generation                 ...        0 min,  0.001 sec (  0.140%)
 coordinate transformation      ...        0 min,  0.000 sec (  0.054%)
 single point calculation       ...        0 min,  0.597 sec ( 97.925%)
 optimization log               ...        0 min,  0.002 sec (  0.312%)
 hessian update                 ...        0 min,  0.000 sec (  0.040%)
 rational function              ...        0 min,  0.003 sec (  0.509%)

================
 final structure:
================
$coord
    4.73377623110636    2.53016005157571   -0.01202915852301      C 
    2.34424250247853    1.31244320243759    0.02815576900300      C 
    0.06542668737728    2.67501025225854    0.12097955544803      C 
    0.16357830745533    5.44948581044947    0.25760431199196      C 
   -0.85914065433865    6.98918522393326   -1.42790418994747      C 
   -2.26024112186409    1.39220862381685    0.10560200404057      C 
   -2.28912101960649   -1.30763012177686   -0.04130130390495      C 
   -0.02038940478967   -2.63089218877858   -0.13449986252603      C 
    2.29369575501954   -1.38471982527401   -0.09150512303194      C 
    4.61148618706309   -2.72726040502474   -0.19005789207658      C 
    6.86277418057799   -1.48630277280305   -0.19331874116304      C 
    6.91965518435221    1.17602690218770   -0.11186879883182      C 
   -4.64585253688269   -2.58563243118943   -0.08136625081262      C 
   -6.86095171375398   -1.28949253863817    0.04968206503292      C 
   -6.83903073887658    1.36652782464028    0.26162808710650      C 
   -4.61618091784647    2.66138294618527    0.29562911821547      C 
    4.79762547621094    4.56911350304930    0.01903555066436      H 
    1.18502258235274    6.21900634077896    1.85881774149004      H 
   -1.84117000798262    6.28023790742513   -3.06652518902036      H 
   -0.72767814593666    9.01336102924964   -1.25388131611717      H 
   -0.05641868318265   -4.67086389869389   -0.24605437978011      H 
    4.54261720655633   -4.76713614207323   -0.26973103503447      H 
    8.62098013814623   -2.52098702867703   -0.26953809154739      H 
    8.72267017981960    2.13334276902569   -0.13854830037317      H 
   -4.63384907613382   -4.62407118605332   -0.21085913593710      H 
   -8.64807415799662   -2.27565093647920    0.01636420878749      H 
   -8.61277710209676    2.36687478045390    0.40844385329018      H 
   -4.62009392585021    4.69207230590043    0.48670428514770      H 
$end
           -------------------------------------------------
          |                Final Singlepoint                |
           -------------------------------------------------

          ...................................................
          :                      SETUP                      :
          :.................................................:
          :  # basis functions                  76          :
          :  # atomic orbitals                  76          :
          :  # shells                           44          :
          :  # electrons                        76          :
          :  max. iterations                   250          :
          :  Hamiltonian                  GFN2-xTB          :
          :  restarted?                      false          :
          :  GBSA solvation                  false          :
          :  PC potential                    false          :
          :  electronic temp.          300.0000000     K    :
          :  accuracy                    1.0000000          :
          :  -> integral cutoff          0.2500000E+02      :
          :  -> integral neglect         0.1000000E-07      :
          :  -> SCF convergence          0.1000000E-05 Eh   :
          :  -> wf. convergence          0.1000000E-03 e    :
          :  Broyden damping             0.4000000          :
          ...................................................

 iter      E             dE          RMSdq      gap      omega  full diag
   1    -41.1391310 -0.411391E+02  0.126E-04    2.16       0.0  T
   2    -41.1391310 -0.233769E-11  0.555E-05    2.16     340.3  T
   3    -41.1391310  0.267022E-10  0.728E-05    2.16     259.7  T

   *** convergence criteria satisfied after 3 iterations ***

         #    Occupation            Energy/Eh            Energy/eV
      -------------------------------------------------------------
         1        2.0000           -0.6499898             -17.6871
       ...           ...                  ...                  ...
        32        2.0000           -0.4239717             -11.5369
        33        2.0000           -0.4165098             -11.3338
        34        2.0000           -0.4059689             -11.0470
        35        2.0000           -0.4035855             -10.9821
        36        2.0000           -0.4020553             -10.9405
        37        2.0000           -0.3962018             -10.7812
        38        2.0000           -0.3575631              -9.7298 (HOMO)
        39                         -0.2783071              -7.5731 (LUMO)
        40                         -0.2282637              -6.2114
        41                         -0.2180041              -5.9322
        42                         -0.2120646              -5.7706
        43                         -0.1701608              -4.6303
       ...                                ...                  ...
        76                          0.7203609              19.6020
      -------------------------------------------------------------
                  HL-Gap            0.0792560 Eh            2.1567 eV
             Fermi-level           -0.3179351 Eh           -8.6515 eV

 SCC (total)                   0 d,  0 h,  0 min,  0.033 sec
 SCC setup                      ...        0 min,  0.000 sec (  0.700%)
 Dispersion                     ...        0 min,  0.000 sec (  0.837%)
 integral evaluation            ...        0 min,  0.010 sec ( 31.704%)
 zeroth order Hamiltonian       ...        0 min,  0.000 sec (  0.566%)
 iterations                     ...        0 min,  0.005 sec ( 14.116%)
 molecular gradient             ...        0 min,  0.017 sec ( 50.756%)
 printout                       ...        0 min,  0.000 sec (  1.165%)

         :::::::::::::::::::::::::::::::::::::::::::::::::::::
         ::                     SUMMARY                     ::
         :::::::::::::::::::::::::::::::::::::::::::::::::::::
         :: total energy             -40.338826106969 Eh    ::
         :: gradient norm              0.000627409569 Eh/a0 ::
         :: HOMO-LUMO gap              2.156665143293 eV    ::
         ::.................................................::
         :: SCC energy               -41.139131039316 Eh    ::
         :: -> isotropic ES            0.001981124612 Eh    ::
         :: -> anisotropic ES          0.004696932116 Eh    ::
         :: -> anisotropic XC          0.027067218298 Eh    ::
         :: -> dispersion             -0.031717706558 Eh    ::
         :: repulsion energy           0.800216293741 Eh    ::
         :: add. restraining           0.000000000000 Eh    ::
         :::::::::::::::::::::::::::::::::::::::::::::::::::::

           -------------------------------------------------
          |                Property Printout                |
           -------------------------------------------------

    * Orbital Energies and Occupations

         #    Occupation            Energy/Eh            Energy/eV
      -------------------------------------------------------------
         1        2.0000           -0.6499898             -17.6871
       ...           ...                  ...                  ...
        26        2.0000           -0.4630086             -12.5991
        27        2.0000           -0.4556497             -12.3989
        28        2.0000           -0.4458082             -12.1311
        29        2.0000           -0.4416522             -12.0180
        30        2.0000           -0.4341833             -11.8147
        31        2.0000           -0.4306287             -11.7180
        32        2.0000           -0.4239717             -11.5369
        33        2.0000           -0.4165098             -11.3338
        34        2.0000           -0.4059689             -11.0470
        35        2.0000           -0.4035855             -10.9821
        36        2.0000           -0.4020553             -10.9405
        37        2.0000           -0.3962018             -10.7812
        38        2.0000           -0.3575631              -9.7298 (HOMO)
        39                         -0.2783071              -7.5731 (LUMO)
        40                         -0.2282637              -6.2114
        41                         -0.2180041              -5.9322
        42                         -0.2120646              -5.7706
        43                         -0.1701608              -4.6303
        44                         -0.1649454              -4.4884
        45                         -0.0963021              -2.6205
        46                         -0.0400802              -1.0906
        47                          0.0893519               2.4314
        48                          0.1193973               3.2490
        49                          0.1247019               3.3933
       ...                                ...                  ...
        76                          0.7203609              19.6020
      -------------------------------------------------------------
                  HL-Gap            0.0792560 Eh            2.1567 eV
             Fermi-level           -0.3179351 Eh           -8.6515 eV

     #   Z        covCN         q      C6AA      α(0)
     1   6 C      2.916    -0.035    28.871     8.811
     2   6 C      2.985     0.005    27.894     8.664
     3   6 C      2.972     0.002    27.971     8.675
     4   6 C      2.894    -0.024    28.604     8.769
     5   6 C      2.838    -0.086    30.149     8.998
     6   6 C      2.983     0.008    27.843     8.656
     7   6 C      2.982     0.011    27.758     8.642
     8   6 C      2.923    -0.046    29.152     8.854
     9   6 C      2.982     0.011    27.761     8.643
    10   6 C      2.919    -0.035    28.873     8.811
    11   6 C      2.914    -0.030    28.746     8.792
    12   6 C      2.915    -0.031    28.766     8.795
    13   6 C      2.919    -0.036    28.886     8.813
    14   6 C      2.914    -0.030    28.745     8.792
    15   6 C      2.915    -0.031    28.776     8.796
    16   6 C      2.916    -0.035    28.876     8.812
    17   1 H      0.926     0.031     2.569     2.507
    18   1 H      0.925     0.039     2.465     2.455
    19   1 H      0.926     0.040     2.449     2.447
    20   1 H      0.926     0.035     2.512     2.478
    21   1 H      0.925     0.031     2.577     2.510
    22   1 H      0.926     0.030     2.588     2.516
    23   1 H      0.926     0.028     2.608     2.526
    24   1 H      0.926     0.028     2.615     2.529
    25   1 H      0.926     0.030     2.591     2.517
    26   1 H      0.926     0.028     2.610     2.527
    27   1 H      0.926     0.028     2.618     2.530
    28   1 H      0.926     0.033     2.539     2.492

 Mol. C6AA /au·bohr⁶  :      10973.256151
 Mol. C8AA /au·bohr⁸  :     277596.899241
 Mol. α(0) /au        :        170.357676


Wiberg/Mayer (AO) data.
largest (>0.10) Wiberg bond orders for each atom
          total WBO             WBO to atom ...
     1  C   3.986        C   12 1.592    C    2 1.248    H   17 0.965    C   10 0.119
     2  C   3.989        C    3 1.324    C    1 1.248    C    9 1.206
     3  C   3.988        C    6 1.328    C    2 1.324    C    4 1.048    C    8 0.128
     4  C   3.991        C    5 1.942    C    3 1.048    H   18 0.953
     5  C   3.988        C    4 1.942    H   20 0.977    H   19 0.976
     6  C   3.989        C    3 1.328    C   16 1.247    C    7 1.203
     7  C   3.990        C    8 1.374    C   13 1.239    C    6 1.203
     8  C   3.991        C    7 1.374    C    9 1.369    H   21 0.966    C    3 0.128
     9  C   3.990        C    8 1.369    C   10 1.240    C    2 1.206
    10  C   3.984        C   11 1.596    C    9 1.240    H   22 0.968    C    1 0.119
    11  C   3.980        C   10 1.596    C   12 1.283    H   23 0.971
    12  C   3.980        C    1 1.592    C   11 1.283    H   24 0.971
    13  C   3.984        C   14 1.598    C    7 1.239    H   25 0.968    C   16 0.119
    14  C   3.980        C   13 1.598    C   15 1.281    H   26 0.971
    15  C   3.980        C   16 1.594    C   14 1.281    H   27 0.971
    16  C   3.986        C   15 1.594    C    6 1.247    H   28 0.965    C   13 0.119
    17  H   0.999        C    1 0.965
    18  H   0.998        C    4 0.953
    19  H   0.998        C    5 0.976
    20  H   0.998        C    5 0.977
    21  H   0.998        C    8 0.966
    22  H   0.999        C   10 0.968
    23  H   0.998        C   11 0.971
    24  H   0.999        C   12 0.971
    25  H   0.998        C   13 0.968
    26  H   0.998        C   14 0.971
    27  H   0.999        C   15 0.971
    28  H   0.998        C   16 0.965

molecular dipole:
                 x           y           z       tot (Debye)
 q only:        0.011       0.068       0.023
   full:        0.027       0.075       0.022       0.210
molecular quadrupole (traceless):
                xx          xy          yy          xz          yz          zz
 q only:        0.666       0.057       2.045       0.224       0.369      -2.711
  q+dip:        4.133       0.204       6.746       0.982       1.031     -10.879
   full:        1.586       0.231       3.647       0.491       0.679      -5.232

           -------------------------------------------------
          |                Geometry Summary                 |
           -------------------------------------------------

      molecular mass/u    :      204.2708000
   center of mass at/Å    :       -0.0156492       0.4206163      -0.0431964
  moments of inertia/u·Å² :        0.5086442E+03   0.1123029E+04   0.1609743E+04
rotational constants/cm⁻¹ :        0.3314229E-01   0.1501087E-01   0.1047225E-01

 * 29 selected distances

     #   Z        #   Z                                     value/Å
     1   6 C      2   6 C                                 1.4193715
     2   6 C      3   6 C                                 1.4058803
     4   6 C      5   6 C                                 1.3237438
     3   6 C      6   6 C                                 1.4055158
     6   6 C      7   6 C                                 1.4308883 (max)
     7   6 C      8   6 C                                 1.3907249
     2   6 C      9   6 C                                 1.4289317
     8   6 C      9   6 C                                 1.3910201
     9   6 C     10   6 C                                 1.4183807
    10   6 C     11   6 C                                 1.3603339
     1   6 C     12   6 C                                 1.3617152
    11   6 C     12   6 C                                 1.4098248
     7   6 C     13   6 C                                 1.4188543
    13   6 C     14   6 C                                 1.3598740
    14   6 C     15   6 C                                 1.4100212
     6   6 C     16   6 C                                 1.4196718
    15   6 C     16   6 C                                 1.3614228
     1   6 C     17   1 H                                 1.0796219
     4   6 C     18   1 H                                 1.0844125
     5   6 C     19   1 H                                 1.0782844
     5   6 C     20   1 H                                 1.0773475 (min)
     8   6 C     21   1 H                                 1.0812876
    10   6 C     22   1 H                                 1.0808935
    11   6 C     23   1 H                                 1.0803085
    12   6 C     24   1 H                                 1.0803551
    13   6 C     25   1 H                                 1.0808884
    14   6 C     26   1 H                                 1.0802769
    15   6 C     27   1 H                                 1.0804065
    16   6 C     28   1 H                                 1.0793432

 * 2 distinct bonds (by element types)

   Z      Z             #   av. dist./Å        max./Å        min./Å
   1 H    6 C          12     1.0802855     1.0844125     1.0773475
   6 C    6 C          17     1.3950691     1.4308883     1.3237438


optimized geometry written to: xtbopt.xyz


           -------------------------------------------------
          | TOTAL ENERGY              -40.338826106969 Eh   |
          | GRADIENT NORM               0.000627409569 Eh/α |
          | HOMO-LUMO GAP               2.156665143293 eV   |
           -------------------------------------------------

------------------------------------------------------------------------
 * finished run on 2021/05/19 at 11:00:49.691     
------------------------------------------------------------------------
 total:
 * wall-time:     0 d,  0 h,  0 min,  0.712 sec
 *  cpu-time:     0 d,  0 h,  0 min,  0.709 sec
 * ratio c/w:     0.996 speedup
 SCF:
 * wall-time:     0 d,  0 h,  0 min,  0.045 sec
 *  cpu-time:     0 d,  0 h,  0 min,  0.045 sec
 * ratio c/w:     0.998 speedup
 ANC optimizer:
 * wall-time:     0 d,  0 h,  0 min,  0.643 sec
 *  cpu-time:     0 d,  0 h,  0 min,  0.642 sec
 * ratio c/w:     0.998 speedup

