      -----------------------------------------------------------      
     |                   =====================                   |     
     |                           x T B                           |     
     |                   =====================                   |     
     |                         S. Grimme                         |     
     |          Mulliken Center for Theoretical Chemistry        |     
     |                    University of Bonn                     |     
     |                Version 6.2 RC2 (SAW190805)                |     
      -----------------------------------------------------------      

   This program is distributed in the hope that it will be useful,
   but WITHOUT ANY WARRANTY; without even the implied warranty of
   MERCHANTABILITY or FITNESS FOR A PARTICULAR PURPOSE.
   
   FOR NON-COMMERCIAL, ACADEMIA USE ONLY.
   
   Cite this work as:
   * S. Grimme, C. Bannwarth, P. Shushkov, J. Chem. Theory Comput., 2017,
     13, 1989-2009. DOI: 10.1021/acs.jctc.7b00118
   * C. Bannwarth, S. Ehlert and S. Grimme., J. Chem. Theory Comput., 2019,
     15, 1652-1671. DOI: 10.1021/acs.jctc.8b01176
   * P. Pracht, E. Caldeweyher, S. Ehlert, S. Grimme, ChemRxiv, 2019, preprint.
     DOI: 10.26434/chemrxiv.8326202.v1
   
   for DFT-D4:
   * E. Caldeweyher, C. Bannwarth and S. Grimme, J. Chem. Phys., 2017,
     147, 034112. DOI: 10.1063/1.4993215
   * E. Caldeweyher, S. Ehlert, A. Hansen, H. Neugebauer, S. Spicher,
     C. Bannwarth and S. Grimme, J. Chem. Phys., 2019, 150, 154122.
     DOI: 10.1063/1.5090222
   
   for sTDA-xTB:
   * S. Grimme and C. Bannwarth, J. Chem. Phys., 2016, 145, 054103.
     DOI: 10.1063/1.4959605
   
   in the mass-spec context:
   * V. Asgeirsson, C. Bauer and S. Grimme, Chem. Sci., 2017, 8, 4879.
     DOI: 10.1039/c7sc00601b
   
   for metadynamics refer to:
   * S. Grimme, J. Chem. Theory Comput., 2019, 155, 2847-2862
     DOI: 10.1021/acs.jctc.9b00143
   
   with help from (in alphabetical order)
   C. Bannwarth, F. Bohle, G. Brandenburg, E. Caldeweyher, M. Checinski,
   S. Dohm, S. Ehlert, S. Ehrlich, F. März, H. Neugebauer, J. Pisarek,
   P. Pracht, P. Shushkov, and S. Spicher.
   
 * started run on 2021/05/19 at 11:00:49.714     

           -------------------------------------------------
          |                Calculation Setup                |
           -------------------------------------------------

          program call               : /ihome/ghutchison/geoffh/xtb/xtb 1030.xyz -opt
          hostname                   : smp-n144
          coordinate file            : 1030.xyz
          omp threads                :                     1
          number of atoms            :                    25
          number of electrons        :                    66
          charge                     :                     0
          spin                       :                   0.0
          first test random number   :      0.28226357465256


########################################################################
# WARNING! Please study the warnings concerning your input carefully
#  - the use of '-opt' is discouraged, please use '--opt' next time
########################################################################

           ------------------------------------------------- 
          |                 G F N 2 - x T B                 |
          | Geometry, Frequencies, Noncovalent interactions |
          |            JCTC 2019 parametrisation            |
           ------------------------------------------------- 
             KAB for C  - Si     :                1.0500
             KAB for H  - Pd     :                0.9500
             k(s)              :                1.8500
             k(p)              :                2.2300
             k(d)              :                2.2300
             k(f)              :                2.0000
             kEN (H0ij)        :               -2.0000
             D4 a1             :                0.5200
             D4 a2             :                5.0000
             D4 s6             :                1.0000
             D4 s8             :                2.7000
             D4 s9             :                5.0000
             alphaj            :                2.0000

  Z AO/shell   Hii/eV     exponent
  1     Wed Apr 25 08:07:45 CEST 2018   EN: 2.200 GM2: 0.406  GM3: 0.0800  RAES: 1.40
     1s    -10.707211    1.230000
  6     Wed Apr 25 08:07:45 CEST 2018   EN: 2.550 GM2: 0.538  GM3: 0.1500  RAES: 3.00
     2s    -13.970922    2.096432
     2p    -10.063292    1.800000
  7     Wed Apr 25 08:07:45 CEST 2018   EN: 3.040 GM2: 0.461  GM3:-0.0640  RAES: 1.90
     2s    -16.686243    2.339881
     2p    -12.523956    2.014332
  8     Wed Apr 25 08:07:45 CEST 2018   EN: 3.440 GM2: 0.452  GM3:-0.0517  RAES: 1.80
     2s    -20.229985    2.439742
     2p    -15.503117    2.137023
 16     Tue Apr 24 11:44:34 CEST 2018   EN: 2.580 GM2: 0.340  GM3:-0.0502  RAES: 3.10
     3s    -20.029654    1.981333
     3p    -11.377694    2.025643
     3d     -0.420282    1.702555

           ------------------------------------------------- 
          |        Self-Consistent Charge Iterations        |
           ------------------------------------------------- 

          ...................................................
          :                      SETUP                      :
          :.................................................:
          :  # basis functions                  67          :
          :  # atomic orbitals                  66          :
          :  # shells                           38          :
          :  # electrons                        66          :
          :  max. iterations                   250          :
          :  Hamiltonian                  GFN2-xTB          :
          :  restarted?                      false          :
          :  GBSA solvation                  false          :
          :  PC potential                    false          :
          :  electronic temp.          300.0000000     K    :
          :  accuracy                    1.0000000          :
          :  -> integral cutoff          0.2500000E+02      :
          :  -> integral neglect         0.1000000E-07      :
          :  -> SCF convergence          0.1000000E-05 Eh   :
          :  -> wf. convergence          0.1000000E-03 e    :
          :  Broyden damping             0.4000000          :
          ...................................................

 iter      E             dE          RMSdq      gap      omega  full diag
   1    -36.5029479 -0.365029E+02  0.383E+00    3.20       0.0  T
   2    -36.5451017 -0.421538E-01  0.210E+00    3.49       1.0  T
   3    -36.5400581  0.504360E-02  0.953E-01    3.67       1.0  T
   4    -36.5464331 -0.637499E-02  0.460E-01    3.38       1.0  T
   5    -36.5495487 -0.311561E-02  0.114E-01    3.40       1.0  T
   6    -36.5496176 -0.689127E-04  0.494E-02    3.40       1.0  T
   7    -36.5496320 -0.144661E-04  0.252E-02    3.40       1.0  T
   8    -36.5496379 -0.584027E-05  0.110E-02    3.40       1.8  T
   9    -36.5496387 -0.811226E-06  0.477E-03    3.40       4.2  T
  10    -36.5496388 -0.141240E-06  0.158E-03    3.40      12.7  T
  11    -36.5496389 -0.212809E-07  0.644E-04    3.40      31.1  T
  12    -36.5496389 -0.928530E-09  0.241E-04    3.40      82.8  T

   *** convergence criteria satisfied after 12 iterations ***

         #    Occupation            Energy/Eh            Energy/eV
      -------------------------------------------------------------
         1        2.0000           -0.7292991             -19.8452
       ...           ...                  ...                  ...
        27        2.0000           -0.4429789             -12.0541
        28        2.0000           -0.4390855             -11.9481
        29        2.0000           -0.4262667             -11.5993
        30        2.0000           -0.3995143             -10.8713
        31        2.0000           -0.3909172             -10.6374
        32        2.0000           -0.3857260             -10.4961
        33        2.0000           -0.3684556             -10.0262 (HOMO)
        34                         -0.2436562              -6.6302 (LUMO)
        35                         -0.1974775              -5.3736
        36                         -0.1816594              -4.9432
        37                         -0.1111981              -3.0259
        38                         -0.0015633              -0.0425
       ...                                ...                  ...
        66                          0.6644271              18.0800
      -------------------------------------------------------------
                  HL-Gap            0.1247994 Eh            3.3960 eV
             Fermi-level           -0.3060559 Eh           -8.3282 eV

 SCC (total)                   0 d,  0 h,  0 min,  0.037 sec
 SCC setup                      ...        0 min,  0.000 sec (  1.023%)
 Dispersion                     ...        0 min,  0.000 sec (  0.914%)
 integral evaluation            ...        0 min,  0.008 sec ( 21.872%)
 zeroth order Hamiltonian       ...        0 min,  0.000 sec (  0.460%)
 iterations                     ...        0 min,  0.014 sec ( 38.401%)
 molecular gradient             ...        0 min,  0.013 sec ( 36.175%)
 printout                       ...        0 min,  0.000 sec (  1.009%)

         :::::::::::::::::::::::::::::::::::::::::::::::::::::
         ::                     SUMMARY                     ::
         :::::::::::::::::::::::::::::::::::::::::::::::::::::
         :: total energy             -36.116150207959 Eh    ::
         :: gradient norm              0.050954852842 Eh/a0 ::
         :: HOMO-LUMO gap              3.395964747632 eV    ::
         ::.................................................::
         :: SCC energy               -36.549638861736 Eh    ::
         :: -> isotropic ES            0.030863574315 Eh    ::
         :: -> anisotropic ES          0.005400705657 Eh    ::
         :: -> anisotropic XC          0.015573483950 Eh    ::
         :: -> dispersion             -0.024565289139 Eh    ::
         :: repulsion energy           0.433230018248 Eh    ::
         :: add. restraining           0.000000000000 Eh    ::
         :::::::::::::::::::::::::::::::::::::::::::::::::::::

      ----------------------------------------------------------- 
     |                   =====================                   |
     |                        A N C O P T                        |
     |                   =====================                   |
     |               Approximate Normal Coordinate               |
     |                Rational Function Optimizer                |
      ----------------------------------------------------------- 

          ...................................................
          :                      SETUP                      :
          :.................................................:
          :   optimization level            normal          :
          :   max. optcycles                   200          :
          :   ANC micro-cycles                  20          :
          :   degrees of freedom                69          :
          :.................................................:
          :   RF solver                   davidson          :
          :   input Hessian                  false          :
          :   write xtbopt.log                true          :
          :   linear?                        false          :
          :   energy convergence         0.5000000E-05 Eh   :
          :   grad. convergence          0.1000000E-02 Eh/α :
          :   maximium RF displ.         2.0000000          :
          :   Hlow (freq-cutoff)         0.5000000E-02      :
          :   Hmax (freq-cutoff)         5.0000000          :
          :   S6 in model hess.         20.0000000          :
          ...................................................

generating ANC from model Hessian ...
Using Lindh-Hessian (1995)
 Shifting diagonal of input Hessian by   3.383667920892595E-003
 Lowest  eigenvalues of input Hessian
   -0.000000   -0.000000    0.000000    0.000000    0.000000    0.000000
    0.005000    0.006026    0.007584    0.008670    0.009774    0.012282
    0.015605    0.019569    0.020837    0.023104    0.023686    0.029644
 Highest eigenvalues
    1.394935    1.485630    1.497676    1.635462    1.737006    1.804150
 

........................................................................
.............................. CYCLE    1 ..............................
........................................................................
   1    -36.5496389 -0.365496E+02  0.874E-05    3.40       0.0  T
   2    -36.5496389 -0.114255E-10  0.559E-05    3.40     358.0  T
   3    -36.5496389  0.619593E-11  0.321E-05    3.40     623.7  T
     SCC iter.                  ...        0 min,  0.004 sec
     gradient                   ...        0 min,  0.013 sec
 * total energy  :   -36.1161502 Eh     change       -0.1874989E-07 Eh
   gradient norm :     0.0509559 Eh/α   predicted     0.0000000E+00 (-100.00%)
   displ. norm   :     0.2827285 α      lambda       -0.6285011E-02
   maximum displ.:     0.1114345 α      in ANC's #8, #11, #7, ...

........................................................................
.............................. CYCLE    2 ..............................
........................................................................
   1    -36.5708562 -0.365709E+02  0.224E-01    3.47       0.0  T
   2    -36.5708884 -0.322225E-04  0.120E-01    3.49       1.0  T
   3    -36.5708670  0.214422E-04  0.429E-02    3.50       1.0  T
   4    -36.5708938 -0.267888E-04  0.199E-02    3.51       1.0  T
   5    -36.5708984 -0.460719E-05  0.556E-03    3.50       3.6  T
   6    -36.5708985 -0.950778E-07  0.151E-03    3.50      13.2  T
     SCC iter.                  ...        0 min,  0.007 sec
     gradient                   ...        0 min,  0.013 sec
 * total energy  :   -36.1199434 Eh     change       -0.3793170E-02 Eh
   gradient norm :     0.0181510 Eh/α   predicted    -0.3393709E-02 ( -10.53%)
   displ. norm   :     0.1512456 α      lambda       -0.8811943E-03
   maximum displ.:     0.0664103 α      in ANC's #5, #8, #11, ...

........................................................................
.............................. CYCLE    3 ..............................
........................................................................
   1    -36.5778365 -0.365778E+02  0.142E-01    3.49       0.0  T
   2    -36.5778518 -0.152576E-04  0.715E-02    3.49       1.0  T
   3    -36.5778426  0.921694E-05  0.287E-02    3.48       1.0  T
   4    -36.5778555 -0.128850E-04  0.126E-02    3.49       1.6  T
   5    -36.5778569 -0.141747E-05  0.389E-03    3.49       5.1  T
   6    -36.5778569 -0.188877E-07  0.823E-04    3.49      24.3  T
   7    -36.5778569 -0.203030E-09  0.546E-04    3.49      36.6  T
     SCC iter.                  ...        0 min,  0.008 sec
     gradient                   ...        0 min,  0.013 sec
 * total energy  :   -36.1204599 Eh     change       -0.5164729E-03 Eh
   gradient norm :     0.0059599 Eh/α   predicted    -0.4506793E-03 ( -12.74%)
   displ. norm   :     0.1177242 α      lambda       -0.1944908E-03
   maximum displ.:     0.0708927 α      in ANC's #5, #8, #1, ...

........................................................................
.............................. CYCLE    4 ..............................
........................................................................
   1    -36.5777379 -0.365777E+02  0.730E-02    3.47       0.0  T
   2    -36.5777403 -0.246718E-05  0.423E-02    3.47       1.0  T
   3    -36.5777367  0.360694E-05  0.152E-02    3.47       1.3  T
   4    -36.5777411 -0.433499E-05  0.483E-03    3.47       4.1  T
   5    -36.5777413 -0.269979E-06  0.146E-03    3.47      13.7  T
   6    -36.5777413 -0.380719E-08  0.566E-04    3.47      35.3  T
     SCC iter.                  ...        0 min,  0.007 sec
     gradient                   ...        0 min,  0.013 sec
 * total energy  :   -36.1205987 Eh     change       -0.1387849E-03 Eh
   gradient norm :     0.0029195 Eh/α   predicted    -0.9860106E-04 ( -28.95%)
   displ. norm   :     0.1261611 α      lambda       -0.1144074E-03
   maximum displ.:     0.0808891 α      in ANC's #5, #1, #8, ...

........................................................................
.............................. CYCLE    5 ..............................
........................................................................
   1    -36.5765463 -0.365765E+02  0.897E-02    3.45       0.0  T
   2    -36.5765486 -0.231815E-05  0.503E-02    3.45       1.0  T
   3    -36.5765477  0.927909E-06  0.120E-02    3.45       1.7  T
   4    -36.5765489 -0.119838E-05  0.676E-03    3.46       3.0  T
   5    -36.5765494 -0.478531E-06  0.174E-03    3.46      11.5  T
   6    -36.5765494 -0.203346E-07  0.711E-04    3.46      28.1  T
   7    -36.5765494 -0.542749E-08  0.367E-04    3.46      54.5  T
     SCC iter.                  ...        0 min,  0.008 sec
     gradient                   ...        0 min,  0.013 sec
 * total energy  :   -36.1206701 Eh     change       -0.7147744E-04 Eh
   gradient norm :     0.0021172 Eh/α   predicted    -0.5812698E-04 ( -18.68%)
   displ. norm   :     0.0686252 α      lambda       -0.3008431E-04
   maximum displ.:     0.0449332 α      in ANC's #1, #5, #8, ...

........................................................................
.............................. CYCLE    6 ..............................
........................................................................
   1    -36.5764216 -0.365764E+02  0.455E-02    3.45       0.0  T
   2    -36.5764220 -0.416907E-06  0.264E-02    3.45       1.0  T
   3    -36.5764221 -0.559339E-07  0.429E-03    3.45       4.7  T
   4    -36.5764221 -0.140348E-07  0.261E-03    3.45       7.7  T
   5    -36.5764222 -0.868542E-07  0.676E-04    3.45      29.6  T
   6    -36.5764222 -0.510403E-08  0.268E-04    3.45      74.6  T
     SCC iter.                  ...        0 min,  0.007 sec
     gradient                   ...        0 min,  0.013 sec
 * total energy  :   -36.1206917 Eh     change       -0.2160375E-04 Eh
   gradient norm :     0.0017915 Eh/α   predicted    -0.1512114E-04 ( -30.01%)
   displ. norm   :     0.0891275 α      lambda       -0.1979565E-04
   maximum displ.:     0.0651715 α      in ANC's #1, #5, #7, ...

........................................................................
.............................. CYCLE    7 ..............................
........................................................................
   1    -36.5767997 -0.365768E+02  0.646E-02    3.46       0.0  T
   2    -36.5768009 -0.116482E-05  0.362E-02    3.46       1.0  T
   3    -36.5768005  0.364098E-06  0.826E-03    3.46       2.4  T
   4    -36.5768011 -0.595923E-06  0.456E-03    3.46       4.4  T
   5    -36.5768013 -0.189182E-06  0.883E-04    3.46      22.7  T
   6    -36.5768013 -0.591620E-08  0.425E-04    3.46      47.1  T
     SCC iter.                  ...        0 min,  0.007 sec
     gradient                   ...        0 min,  0.013 sec
 * total energy  :   -36.1207104 Eh     change       -0.1863493E-04 Eh
   gradient norm :     0.0011789 Eh/α   predicted    -0.9933647E-05 ( -46.69%)
   displ. norm   :     0.0413552 α      lambda       -0.7429130E-05
   maximum displ.:     0.0366650 α      in ANC's #1, #2, #9, ...

........................................................................
.............................. CYCLE    8 ..............................
........................................................................
   1    -36.5770928 -0.365771E+02  0.283E-02    3.46       0.0  T
   2    -36.5770930 -0.255871E-06  0.152E-02    3.46       1.3  T
   3    -36.5770930  0.130142E-07  0.321E-03    3.46       6.2  T
   4    -36.5770931 -0.382182E-07  0.194E-03    3.46      10.3  T
   5    -36.5770931 -0.413941E-07  0.491E-04    3.46      40.7  T
   6    -36.5770931 -0.259934E-08  0.150E-04    3.46     133.4  T
     SCC iter.                  ...        0 min,  0.007 sec
     gradient                   ...        0 min,  0.013 sec
 * total energy  :   -36.1207184 Eh     change       -0.8062209E-05 Eh
   gradient norm :     0.0007660 Eh/α   predicted    -0.3719104E-05 ( -53.87%)
   displ. norm   :     0.0337310 α      lambda       -0.4818397E-05
   maximum displ.:     0.0299499 α      in ANC's #1, #2, #3, ...

........................................................................
.............................. CYCLE    9 ..............................
........................................................................
   1    -36.5771373 -0.365771E+02  0.231E-02    3.46       0.0  T
   2    -36.5771374 -0.173742E-06  0.121E-02    3.46       1.7  T
   3    -36.5771375 -0.253986E-07  0.230E-03    3.46       8.7  T
   4    -36.5771374  0.268693E-08  0.142E-03    3.46      14.0  T
   5    -36.5771375 -0.200186E-07  0.394E-04    3.46      50.7  T
   6    -36.5771375 -0.255472E-08  0.927E-05    3.46     215.7  T
     SCC iter.                  ...        0 min,  0.007 sec
     gradient                   ...        0 min,  0.013 sec
 * total energy  :   -36.1207239 Eh     change       -0.5445465E-05 Eh
   gradient norm :     0.0006005 Eh/α   predicted    -0.2413188E-05 ( -55.68%)
   displ. norm   :     0.0299504 α      lambda       -0.3231620E-05
   maximum displ.:     0.0258817 α      in ANC's #1, #5, #2, ...

........................................................................
.............................. CYCLE   10 ..............................
........................................................................
   1    -36.5770322 -0.365770E+02  0.184E-02    3.46       0.0  T
   2    -36.5770323 -0.950822E-07  0.996E-03    3.46       2.0  T
   3    -36.5770323 -0.394689E-08  0.193E-03    3.46      10.4  T
   4    -36.5770323 -0.836166E-08  0.121E-03    3.46      16.6  T
   5    -36.5770323 -0.161155E-07  0.239E-04    3.46      83.8  T
   6    -36.5770323 -0.856858E-09  0.896E-05    3.46     223.1  T
     SCC iter.                  ...        0 min,  0.007 sec
     gradient                   ...        0 min,  0.013 sec
 * total energy  :   -36.1207279 Eh     change       -0.4033576E-05 Eh
   gradient norm :     0.0005306 Eh/α   predicted    -0.1616768E-05 ( -59.92%)
   displ. norm   :     0.0308712 α      lambda       -0.1453195E-05
   maximum displ.:     0.0269425 α      in ANC's #1, #5, #2, ...

   *** GEOMETRY OPTIMIZATION CONVERGED AFTER 10 ITERATIONS ***

------------------------------------------------------------------------
 total energy gain   :        -0.0045777 Eh       -2.8726 kcal/mol
 total RMSD          :         0.1433168 a0        0.0758 Å
 total power (kW/mol):        -1.2018761 (step)  -40.0416 (real)
------------------------------------------------------------------------

 ANCopt (total)                0 d,  0 h,  0 min,  0.300 sec
 optimizer setup                ...        0 min,  0.000 sec (  0.049%)
 model hessian                  ...        0 min,  0.011 sec (  3.799%)
 ANC generation                 ...        0 min,  0.001 sec (  0.251%)
 coordinate transformation      ...        0 min,  0.000 sec (  0.058%)
 single point calculation       ...        0 min,  0.285 sec ( 94.807%)
 optimization log               ...        0 min,  0.001 sec (  0.347%)
 hessian update                 ...        0 min,  0.000 sec (  0.044%)
 rational function              ...        0 min,  0.001 sec (  0.421%)

================
 final structure:
================
$coord
    3.04258266326891    2.38300340719373    0.25882739163021      C 
    5.27438992530849    0.03338459211862    0.44860765460608      S 
    2.95722030508330   -2.24391329395556    0.37884999489060      C 
    0.59938444934823   -1.23360752057379    0.21588528418709      C 
    0.65201863680875    1.45624092289392    0.14353079480155      C 
   -1.69019257765230    3.05948663431903    0.12030871298627      C 
   -1.88027268852555    4.32537137644812    2.56531308988392      N 
   -3.99794813135677    1.43072888508772   -0.57395544773321      C 
   -4.02730225882849   -1.05432526778163    0.88921253202112      C 
   -1.82092061458633   -2.71371105414403    0.03418707051932      C 
   -2.35908511006536   -3.46925037014616   -2.48858301735997      O 
   -0.76206844496181   -5.34608196114028   -3.45624307725808      C 
    3.62025542292437    4.32270296387116    0.26509513819652      H 
    3.48459405047152   -4.19688703622792    0.49842623268062      H 
   -1.47771465286694    4.56840923737622   -1.28748793361195      H 
   -2.00365464816682    3.03253617720112    3.97602673316608      H 
   -3.45716468103156    5.41430324626511    2.62495162335901      H 
   -3.94139733624953    0.98927916300093   -2.58566605194640      H 
   -5.72269927836011    2.50146431541181   -0.19242693884640      H 
   -5.78635895543108   -2.06291872434733    0.52296504757143      H 
   -3.87363367304775   -0.71780602738078    2.92012070460137      H 
   -1.68575915850065   -4.42038430237908    1.22926126283551      H 
   -1.51653380326779   -5.84331149182308   -5.30400570663606      H 
   -0.75639180550242   -7.02642356339825   -2.23876330781677      H 
    1.18409458127979   -4.66977384707268   -3.67174512642724      H 
$end
           -------------------------------------------------
          |                Final Singlepoint                |
           -------------------------------------------------

          ...................................................
          :                      SETUP                      :
          :.................................................:
          :  # basis functions                  67          :
          :  # atomic orbitals                  66          :
          :  # shells                           38          :
          :  # electrons                        66          :
          :  max. iterations                   250          :
          :  Hamiltonian                  GFN2-xTB          :
          :  restarted?                      false          :
          :  GBSA solvation                  false          :
          :  PC potential                    false          :
          :  electronic temp.          300.0000000     K    :
          :  accuracy                    1.0000000          :
          :  -> integral cutoff          0.2500000E+02      :
          :  -> integral neglect         0.1000000E-07      :
          :  -> SCF convergence          0.1000000E-05 Eh   :
          :  -> wf. convergence          0.1000000E-03 e    :
          :  Broyden damping             0.4000000          :
          ...................................................

 iter      E             dE          RMSdq      gap      omega  full diag
   1    -36.5770323 -0.365770E+02  0.552E-05    3.46       0.0  T
   2    -36.5770323 -0.788702E-11  0.251E-05    3.46     795.7  T
   3    -36.5770323 -0.176286E-10  0.195E-05    3.46    1027.7  T

   *** convergence criteria satisfied after 3 iterations ***

         #    Occupation            Energy/Eh            Energy/eV
      -------------------------------------------------------------
         1        2.0000           -0.7280552             -19.8114
       ...           ...                  ...                  ...
        27        2.0000           -0.4413462             -12.0096
        28        2.0000           -0.4401618             -11.9774
        29        2.0000           -0.4263744             -11.6022
        30        2.0000           -0.3991115             -10.8604
        31        2.0000           -0.3917104             -10.6590
        32        2.0000           -0.3877334             -10.5508
        33        2.0000           -0.3694888             -10.0543 (HOMO)
        34                         -0.2422294              -6.5914 (LUMO)
        35                         -0.1991158              -5.4182
        36                         -0.1741444              -4.7387
        37                         -0.1115129              -3.0344
        38                          0.0016338               0.0445
       ...                                ...                  ...
        66                          0.6856012              18.6562
      -------------------------------------------------------------
                  HL-Gap            0.1272594 Eh            3.4629 eV
             Fermi-level           -0.3058591 Eh           -8.3228 eV

 SCC (total)                   0 d,  0 h,  0 min,  0.026 sec
 SCC setup                      ...        0 min,  0.000 sec (  0.714%)
 Dispersion                     ...        0 min,  0.000 sec (  0.729%)
 integral evaluation            ...        0 min,  0.008 sec ( 29.918%)
 zeroth order Hamiltonian       ...        0 min,  0.000 sec (  0.591%)
 iterations                     ...        0 min,  0.004 sec ( 15.272%)
 molecular gradient             ...        0 min,  0.013 sec ( 51.245%)
 printout                       ...        0 min,  0.000 sec (  1.304%)

         :::::::::::::::::::::::::::::::::::::::::::::::::::::
         ::                     SUMMARY                     ::
         :::::::::::::::::::::::::::::::::::::::::::::::::::::
         :: total energy             -36.120727913785 Eh    ::
         :: gradient norm              0.000530300441 Eh/a0 ::
         :: HOMO-LUMO gap              3.462905430998 eV    ::
         ::.................................................::
         :: SCC energy               -36.577032289865 Eh    ::
         :: -> isotropic ES            0.030159752863 Eh    ::
         :: -> anisotropic ES          0.004583680795 Eh    ::
         :: -> anisotropic XC          0.014873742972 Eh    ::
         :: -> dispersion             -0.024887631494 Eh    ::
         :: repulsion energy           0.456044960432 Eh    ::
         :: add. restraining           0.000000000000 Eh    ::
         :::::::::::::::::::::::::::::::::::::::::::::::::::::

           -------------------------------------------------
          |                Property Printout                |
           -------------------------------------------------

    * Orbital Energies and Occupations

         #    Occupation            Energy/Eh            Energy/eV
      -------------------------------------------------------------
         1        2.0000           -0.7280552             -19.8114
       ...           ...                  ...                  ...
        21        2.0000           -0.4792980             -13.0424
        22        2.0000           -0.4732604             -12.8781
        23        2.0000           -0.4693687             -12.7722
        24        2.0000           -0.4675907             -12.7238
        25        2.0000           -0.4608924             -12.5415
        26        2.0000           -0.4472042             -12.1690
        27        2.0000           -0.4413462             -12.0096
        28        2.0000           -0.4401618             -11.9774
        29        2.0000           -0.4263744             -11.6022
        30        2.0000           -0.3991115             -10.8604
        31        2.0000           -0.3917104             -10.6590
        32        2.0000           -0.3877334             -10.5508
        33        2.0000           -0.3694888             -10.0543 (HOMO)
        34                         -0.2422294              -6.5914 (LUMO)
        35                         -0.1991158              -5.4182
        36                         -0.1741444              -4.7387
        37                         -0.1115129              -3.0344
        38                          0.0016338               0.0445
        39                          0.0276708               0.7530
        40                          0.0336872               0.9167
        41                          0.0413565               1.1254
        42                          0.0593848               1.6159
        43                          0.0802125               2.1827
        44                          0.0884332               2.4064
       ...                                ...                  ...
        66                          0.6856012              18.6562
      -------------------------------------------------------------
                  HL-Gap            0.1272594 Eh            3.4629 eV
             Fermi-level           -0.3058591 Eh           -8.3228 eV

     #   Z        covCN         q      C6AA      α(0)
     1   6 C      2.942    -0.026    28.640     8.777
     2  16 S      2.297    -0.029   142.232    20.072
     3   6 C      2.941    -0.032    28.789     8.800
     4   6 C      3.166    -0.023    28.215     8.680
     5   6 C      3.173    -0.010    27.862     8.621
     6   6 C      3.787     0.055    19.662     6.316
     7   7 N      2.634    -0.345    28.884     7.982
     8   6 C      3.807    -0.067    21.787     6.645
     9   6 C      3.807    -0.055    21.556     6.609
    10   6 C      3.751     0.120    18.681     6.164
    11   8 O      1.701    -0.317    19.284     5.929
    12   6 C      3.644     0.044    20.162     6.454
    13   1 H      0.927     0.051     2.301     2.372
    14   1 H      0.926     0.040     2.445     2.445
    15   1 H      0.924     0.035     2.517     2.481
    16   1 H      0.860     0.138     1.489     1.911
    17   1 H      0.860     0.139     1.482     1.907
    18   1 H      0.924     0.053     2.285     2.364
    19   1 H      0.924     0.029     2.596     2.520
    20   1 H      0.924     0.047     2.363     2.404
    21   1 H      0.924     0.032     2.561     2.503
    22   1 H      0.922     0.010     2.898     2.662
    23   1 H      0.925     0.057     2.238     2.339
    24   1 H      0.923     0.023     2.682     2.561
    25   1 H      0.924     0.029     2.598     2.521

 Mol. C6AA /au·bohr⁶  :       7253.893534
 Mol. C8AA /au·bohr⁸  :     186774.646778
 Mol. α(0) /au        :        132.038890


Wiberg/Mayer (AO) data.
largest (>0.10) Wiberg bond orders for each atom
          total WBO             WBO to atom ...
     1  C   3.948        C    5 1.612    S    2 1.190    H   13 0.970    C    3 0.116
     2  S   2.634        C    1 1.190    C    3 1.189
     3  C   3.947        C    4 1.605    S    2 1.189    H   14 0.970    C    1 0.116
     4  C   3.984        C    3 1.605    C    5 1.224    C   10 0.982
     5  C   3.985        C    1 1.612    C    4 1.224    C    6 0.989
     6  C   3.986        N    7 1.006    C    5 0.989    C    8 0.981    H   15 0.959
     7  N   3.009        C    6 1.006    H   17 0.965    H   16 0.964
     8  C   3.996        C    9 1.010    C    6 0.981    H   19 0.975    H   18 0.974
     9  C   3.997        C    8 1.010    C   10 0.988    H   20 0.974    H   21 0.974
    10  C   3.955        C    9 0.988    C    4 0.982    O   11 0.959    H   22 0.955
    11  O   2.079        C   12 1.001    C   10 0.959
    12  C   3.956        O   11 1.001    H   23 0.979    H   24 0.976    H   25 0.974
    13  H   0.997        C    1 0.970
    14  H   0.998        C    3 0.970
    15  H   0.999        C    6 0.959
    16  H   0.981        N    7 0.964
    17  H   0.980        N    7 0.965
    18  H   0.997        C    8 0.974
    19  H   0.998        C    8 0.975
    20  H   0.997        C    9 0.974
    21  H   0.999        C    9 0.974
    22  H   1.000        C   10 0.955
    23  H   0.996        C   12 0.979
    24  H   0.999        C   12 0.976
    25  H   0.999        C   12 0.974

molecular dipole:
                 x           y           z       tot (Debye)
 q only:       -0.135      -0.090       0.137
   full:       -0.593      -0.378       0.217       1.871
molecular quadrupole (traceless):
                xx          xy          yy          xz          yz          zz
 q only:       -1.272      -3.016       1.957      -2.893       0.146      -0.685
  q+dip:       -2.633      -4.164       3.871      -4.774      -2.147      -1.238
   full:       -3.440      -4.741       3.582      -5.031      -1.518      -0.142

           -------------------------------------------------
          |                Geometry Summary                 |
           -------------------------------------------------

      molecular mass/u    :      183.2678000
   center of mass at/Å    :        0.0643576      -0.1536626      -0.0481206
  moments of inertia/u·Å² :        0.5114072E+03   0.5886053E+03   0.9965805E+03
rotational constants/cm⁻¹ :        0.3296323E-01   0.2863996E-01   0.1691547E-01

 * 24 selected distances

     #   Z        #   Z                                     value/Å
     1   6 C      2  16 S                                 1.7178050
     2  16 S      3   6 C                                 1.7196410 (max)
     3   6 C      4   6 C                                 1.3601673
     1   6 C      5   6 C                                 1.3581392
     4   6 C      5   6 C                                 1.4241939
     6   6 C      7   7 N                                 1.4604373
     6   6 C      8   6 C                                 1.5392229
     8   6 C      9   6 C                                 1.5261252
     9   6 C     10   6 C                                 1.5293818
    10   6 C     11   8 O                                 1.4223778
    11   8 O     12   6 C                                 1.4010037
     1   6 C     13   1 H                                 1.0710029
     3   6 C     14   1 H                                 1.0723550
     6   6 C     15   1 H                                 1.0978210
     7   7 N     16   1 H                                 1.0146909
     7   7 N     17   1 H                                 1.0145748 (min)
     8   6 C     18   1 H                                 1.0902921
     8   6 C     19   1 H                                 1.0930816
     9   6 C     20   1 H                                 1.0903721
     9   6 C     21   1 H                                 1.0923951
    10   6 C     22   1 H                                 1.1048538
    12   6 C     23   1 H                                 1.0884447
    12   6 C     24   1 H                                 1.0980699
    12   6 C     25   1 H                                 1.0962254

 * 6 distinct bonds (by element types)

   Z      Z             #   av. dist./Å        max./Å        min./Å
   1 H    6 C          11     1.0904467     1.1048538     1.0710029
   6 C    6 C           6     1.4562050     1.5392229     1.3581392
   1 H    7 N           2     1.0146328     1.0146909     1.0145748
   6 C    7 N           1     1.4604373     1.4604373     1.4604373
   6 C    8 O           2     1.4116908     1.4223778     1.4010037
   6 C   16 S           2     1.7187230     1.7196410     1.7178050


optimized geometry written to: xtbopt.xyz


           -------------------------------------------------
          | TOTAL ENERGY              -36.120727913785 Eh   |
          | GRADIENT NORM               0.000530300441 Eh/α |
          | HOMO-LUMO GAP               3.462905430998 eV   |
           -------------------------------------------------

------------------------------------------------------------------------
 * finished run on 2021/05/19 at 11:00:50.099     
------------------------------------------------------------------------
 total:
 * wall-time:     0 d,  0 h,  0 min,  0.384 sec
 *  cpu-time:     0 d,  0 h,  0 min,  0.383 sec
 * ratio c/w:     0.996 speedup
 SCF:
 * wall-time:     0 d,  0 h,  0 min,  0.037 sec
 *  cpu-time:     0 d,  0 h,  0 min,  0.037 sec
 * ratio c/w:     0.997 speedup
 ANC optimizer:
 * wall-time:     0 d,  0 h,  0 min,  0.327 sec
 *  cpu-time:     0 d,  0 h,  0 min,  0.326 sec
 * ratio c/w:     0.998 speedup

