      -----------------------------------------------------------      
     |                   =====================                   |     
     |                           x T B                           |     
     |                   =====================                   |     
     |                         S. Grimme                         |     
     |          Mulliken Center for Theoretical Chemistry        |     
     |                    University of Bonn                     |     
     |                Version 6.2 RC2 (SAW190805)                |     
      -----------------------------------------------------------      

   This program is distributed in the hope that it will be useful,
   but WITHOUT ANY WARRANTY; without even the implied warranty of
   MERCHANTABILITY or FITNESS FOR A PARTICULAR PURPOSE.
   
   FOR NON-COMMERCIAL, ACADEMIA USE ONLY.
   
   Cite this work as:
   * S. Grimme, C. Bannwarth, P. Shushkov, J. Chem. Theory Comput., 2017,
     13, 1989-2009. DOI: 10.1021/acs.jctc.7b00118
   * C. Bannwarth, S. Ehlert and S. Grimme., J. Chem. Theory Comput., 2019,
     15, 1652-1671. DOI: 10.1021/acs.jctc.8b01176
   * P. Pracht, E. Caldeweyher, S. Ehlert, S. Grimme, ChemRxiv, 2019, preprint.
     DOI: 10.26434/chemrxiv.8326202.v1
   
   for DFT-D4:
   * E. Caldeweyher, C. Bannwarth and S. Grimme, J. Chem. Phys., 2017,
     147, 034112. DOI: 10.1063/1.4993215
   * E. Caldeweyher, S. Ehlert, A. Hansen, H. Neugebauer, S. Spicher,
     C. Bannwarth and S. Grimme, J. Chem. Phys., 2019, 150, 154122.
     DOI: 10.1063/1.5090222
   
   for sTDA-xTB:
   * S. Grimme and C. Bannwarth, J. Chem. Phys., 2016, 145, 054103.
     DOI: 10.1063/1.4959605
   
   in the mass-spec context:
   * V. Asgeirsson, C. Bauer and S. Grimme, Chem. Sci., 2017, 8, 4879.
     DOI: 10.1039/c7sc00601b
   
   for metadynamics refer to:
   * S. Grimme, J. Chem. Theory Comput., 2019, 155, 2847-2862
     DOI: 10.1021/acs.jctc.9b00143
   
   with help from (in alphabetical order)
   C. Bannwarth, F. Bohle, G. Brandenburg, E. Caldeweyher, M. Checinski,
   S. Dohm, S. Ehlert, S. Ehrlich, F. März, H. Neugebauer, J. Pisarek,
   P. Pracht, P. Shushkov, and S. Spicher.
   
 * started run on 2021/05/19 at 11:00:50.121     

           -------------------------------------------------
          |                Calculation Setup                |
           -------------------------------------------------

          program call               : /ihome/ghutchison/geoffh/xtb/xtb 1031.xyz -opt
          hostname                   : smp-n144
          coordinate file            : 1031.xyz
          omp threads                :                     1
          number of atoms            :                    27
          number of electrons        :                    90
          charge                     :                     0
          spin                       :                   0.0
          first test random number   :      0.48257632973557


########################################################################
# WARNING! Please study the warnings concerning your input carefully
#  - the use of '-opt' is discouraged, please use '--opt' next time
########################################################################

           ------------------------------------------------- 
          |                 G F N 2 - x T B                 |
          | Geometry, Frequencies, Noncovalent interactions |
          |            JCTC 2019 parametrisation            |
           ------------------------------------------------- 
             KAB for C  - Si     :                1.0500
             KAB for H  - Pd     :                0.9500
             k(s)              :                1.8500
             k(p)              :                2.2300
             k(d)              :                2.2300
             k(f)              :                2.0000
             kEN (H0ij)        :               -2.0000
             D4 a1             :                0.5200
             D4 a2             :                5.0000
             D4 s6             :                1.0000
             D4 s8             :                2.7000
             D4 s9             :                5.0000
             alphaj            :                2.0000

  Z AO/shell   Hii/eV     exponent
  1     Wed Apr 25 08:07:45 CEST 2018   EN: 2.200 GM2: 0.406  GM3: 0.0800  RAES: 1.40
     1s    -10.707211    1.230000
  6     Wed Apr 25 08:07:45 CEST 2018   EN: 2.550 GM2: 0.538  GM3: 0.1500  RAES: 3.00
     2s    -13.970922    2.096432
     2p    -10.063292    1.800000
  7     Wed Apr 25 08:07:45 CEST 2018   EN: 3.040 GM2: 0.461  GM3:-0.0640  RAES: 1.90
     2s    -16.686243    2.339881
     2p    -12.523956    2.014332
  9     Mon Apr 23 13:58:50 CEST 2018   EN: 3.980 GM2: 0.532  GM3: 0.1426  RAES: 2.40
     2s    -23.458179    2.416361
     2p    -15.746583    2.308399
 16     Tue Apr 24 11:44:34 CEST 2018   EN: 2.580 GM2: 0.340  GM3:-0.0502  RAES: 3.10
     3s    -20.029654    1.981333
     3p    -11.377694    2.025643
     3d     -0.420282    1.702555

           ------------------------------------------------- 
          |        Self-Consistent Charge Iterations        |
           ------------------------------------------------- 

          ...................................................
          :                      SETUP                      :
          :.................................................:
          :  # basis functions                  84          :
          :  # atomic orbitals                  83          :
          :  # shells                           45          :
          :  # electrons                        90          :
          :  max. iterations                   250          :
          :  Hamiltonian                  GFN2-xTB          :
          :  restarted?                      false          :
          :  GBSA solvation                  false          :
          :  PC potential                    false          :
          :  electronic temp.          300.0000000     K    :
          :  accuracy                    1.0000000          :
          :  -> integral cutoff          0.2500000E+02      :
          :  -> integral neglect         0.1000000E-07      :
          :  -> SCF convergence          0.1000000E-05 Eh   :
          :  -> wf. convergence          0.1000000E-03 e    :
          :  Broyden damping             0.4000000          :
          ...................................................

 iter      E             dE          RMSdq      gap      omega  full diag
   1    -51.5224914 -0.515225E+02  0.467E+00    3.07       0.0  T
   2    -51.5703578 -0.478664E-01  0.299E+00    3.07       1.0  T
   3    -51.4788805  0.914773E-01  0.262E+00    3.09       1.0  T
   4    -51.6037672 -0.124887E+00  0.100E+00    3.07       1.0  T
   5    -51.6220927 -0.183255E-01  0.215E-01    2.99       1.0  T
   6    -51.6222766 -0.183903E-03  0.120E-01    3.03       1.0  T
   7    -51.6225187 -0.242033E-03  0.330E-02    3.05       1.0  T
   8    -51.6225241 -0.542409E-05  0.155E-02    3.05       1.2  T
   9    -51.6225254 -0.130844E-05  0.831E-03    3.05       2.3  T
  10    -51.6225262 -0.820486E-06  0.297E-03    3.05       6.5  T
  11    -51.6225263 -0.602480E-07  0.142E-03    3.05      13.5  T
  12    -51.6225263 -0.106644E-07  0.514E-04    3.05      37.5  T
  13    -51.6225263 -0.194888E-08  0.288E-04    3.05      66.8  T

   *** convergence criteria satisfied after 13 iterations ***

         #    Occupation            Energy/Eh            Energy/eV
      -------------------------------------------------------------
         1        2.0000           -0.8916146             -24.2621
       ...           ...                  ...                  ...
        39        2.0000           -0.4640272             -12.6268
        40        2.0000           -0.4569280             -12.4336
        41        2.0000           -0.4497396             -12.2380
        42        2.0000           -0.4437770             -12.0758
        43        2.0000           -0.4374583             -11.9038
        44        2.0000           -0.4005912             -10.9006
        45        2.0000           -0.3854064             -10.4874 (HOMO)
        46                         -0.2733004              -7.4369 (LUMO)
        47                         -0.2709428              -7.3727
        48                         -0.2672345              -7.2718
        49                         -0.2163619              -5.8875
        50                         -0.2082723              -5.6674
       ...                                ...                  ...
        83                          0.6542503              17.8031
      -------------------------------------------------------------
                  HL-Gap            0.1121060 Eh            3.0506 eV
             Fermi-level           -0.3293534 Eh           -8.9622 eV

 SCC (total)                   0 d,  0 h,  0 min,  0.054 sec
 SCC setup                      ...        0 min,  0.000 sec (  0.658%)
 Dispersion                     ...        0 min,  0.000 sec (  0.789%)
 integral evaluation            ...        0 min,  0.013 sec ( 23.867%)
 zeroth order Hamiltonian       ...        0 min,  0.000 sec (  0.454%)
 iterations                     ...        0 min,  0.021 sec ( 37.963%)
 molecular gradient             ...        0 min,  0.019 sec ( 35.399%)
 printout                       ...        0 min,  0.000 sec (  0.769%)

         :::::::::::::::::::::::::::::::::::::::::::::::::::::
         ::                     SUMMARY                     ::
         :::::::::::::::::::::::::::::::::::::::::::::::::::::
         :: total energy             -51.084545563591 Eh    ::
         :: gradient norm              0.270470733988 Eh/a0 ::
         :: HOMO-LUMO gap              3.050559449339 eV    ::
         ::.................................................::
         :: SCC energy               -51.622526286547 Eh    ::
         :: -> isotropic ES            0.051673000631 Eh    ::
         :: -> anisotropic ES          0.003445052621 Eh    ::
         :: -> anisotropic XC          0.014467317038 Eh    ::
         :: -> dispersion             -0.030158932895 Eh    ::
         :: repulsion energy           0.537573892103 Eh    ::
         :: add. restraining           0.000000000000 Eh    ::
         :::::::::::::::::::::::::::::::::::::::::::::::::::::

      ----------------------------------------------------------- 
     |                   =====================                   |
     |                        A N C O P T                        |
     |                   =====================                   |
     |               Approximate Normal Coordinate               |
     |                Rational Function Optimizer                |
      ----------------------------------------------------------- 

          ...................................................
          :                      SETUP                      :
          :.................................................:
          :   optimization level            normal          :
          :   max. optcycles                   200          :
          :   ANC micro-cycles                  20          :
          :   degrees of freedom                75          :
          :.................................................:
          :   RF solver                   davidson          :
          :   input Hessian                  false          :
          :   write xtbopt.log                true          :
          :   linear?                        false          :
          :   energy convergence         0.5000000E-05 Eh   :
          :   grad. convergence          0.1000000E-02 Eh/α :
          :   maximium RF displ.         2.0000000          :
          :   Hlow (freq-cutoff)         0.5000000E-02      :
          :   Hmax (freq-cutoff)         5.0000000          :
          :   S6 in model hess.         20.0000000          :
          ...................................................

generating ANC from model Hessian ...
Using Lindh-Hessian (1995)
 Shifting diagonal of input Hessian by   4.187993534828734E-003
 Lowest  eigenvalues of input Hessian
   -0.000000   -0.000000   -0.000000    0.000000    0.000000    0.000000
    0.005000    0.005873    0.006631    0.008101    0.008993    0.009862
    0.012170    0.013586    0.013946    0.018581    0.022494    0.028819
 Highest eigenvalues
    1.673134    1.710486    1.783037    1.833574    1.959062    1.974390
 

........................................................................
.............................. CYCLE    1 ..............................
........................................................................
   1    -51.6225263 -0.516225E+02  0.178E-04    3.05       0.0  T
   2    -51.6225263  0.183839E-09  0.180E-04    3.05     106.6  T
   3    -51.6225263 -0.742453E-09  0.674E-05    3.05     285.7  T
     SCC iter.                  ...        0 min,  0.005 sec
     gradient                   ...        0 min,  0.019 sec
 * total energy  :   -51.0845456 Eh     change        0.5724047E-08 Eh
   gradient norm :     0.2704680 Eh/α   predicted     0.0000000E+00 (-100.00%)
   displ. norm   :     0.2873321 α      lambda       -0.5552051E-01
   maximum displ.:     0.1333605 α      in ANC's #32, #74, #52, ...

........................................................................
.............................. CYCLE    2 ..............................
........................................................................
   1    -51.7304363 -0.517304E+02  0.437E-01    3.13       0.0  T
   2    -51.7306734 -0.237126E-03  0.260E-01    3.13       1.0  T
   3    -51.7303159  0.357432E-03  0.193E-01    3.13       1.0  T
   4    -51.7309056 -0.589691E-03  0.305E-02    3.13       1.0  T
   5    -51.7309227 -0.170287E-04  0.108E-02    3.13       1.8  T
   6    -51.7309230 -0.341592E-06  0.374E-03    3.13       5.1  T
   7    -51.7309231 -0.109352E-06  0.231E-03    3.13       8.3  T
     SCC iter.                  ...        0 min,  0.010 sec
     gradient                   ...        0 min,  0.018 sec
 * total energy  :   -51.1164664 Eh     change       -0.3192088E-01 Eh
   gradient norm :     0.0428562 Eh/α   predicted    -0.3005214E-01 (  -5.85%)
   displ. norm   :     0.2954707 α      lambda       -0.3297289E-02
   maximum displ.:     0.2312185 α      in ANC's #4, #13, #32, ...

........................................................................
.............................. CYCLE    3 ..............................
........................................................................
   1    -51.7386346 -0.517386E+02  0.214E-01    3.14       0.0  T
   2    -51.7386521 -0.175107E-04  0.131E-01    3.15       1.0  T
   3    -51.7385280  0.124077E-03  0.884E-02    3.14       1.0  T
   4    -51.7387059 -0.177805E-03  0.139E-02    3.14       1.4  T
   5    -51.7387069 -0.103851E-05  0.507E-03    3.15       3.8  T
   6    -51.7387071 -0.218248E-06  0.208E-03    3.15       9.2  T
     SCC iter.                  ...        0 min,  0.009 sec
     gradient                   ...        0 min,  0.018 sec
 * total energy  :   -51.1187398 Eh     change       -0.2273381E-02 Eh
   gradient norm :     0.0130123 Eh/α   predicted    -0.1792598E-02 ( -21.15%)
   displ. norm   :     0.3780621 α      lambda       -0.1728903E-02
   maximum displ.:     0.2966128 α      in ANC's #4, #2, #5, ...

........................................................................
.............................. CYCLE    4 ..............................
........................................................................
   1    -51.7405797 -0.517406E+02  0.331E-01    3.15       0.0  T
   2    -51.7406123 -0.326379E-04  0.186E-01    3.15       1.0  T
   3    -51.7405149  0.974033E-04  0.676E-02    3.15       1.0  T
   4    -51.7406342 -0.119329E-03  0.135E-02    3.15       1.4  T
   5    -51.7406352 -0.975534E-06  0.478E-03    3.15       4.0  T
   6    -51.7406354 -0.190791E-06  0.225E-03    3.15       8.6  T
   7    -51.7406355 -0.686339E-07  0.102E-03    3.15      18.8  T
     SCC iter.                  ...        0 min,  0.010 sec
     gradient                   ...        0 min,  0.018 sec
 * total energy  :   -51.1193983 Eh     change       -0.6585197E-03 Eh
   gradient norm :     0.0231051 Eh/α   predicted    -0.9880120E-03 (  50.04%)
   displ. norm   :     0.3343858 α      lambda       -0.1824725E-02
   maximum displ.:     0.2988431 α      in ANC's #4, #5, #16, ...

........................................................................
.............................. CYCLE    5 ..............................
........................................................................
   1    -51.7449793 -0.517450E+02  0.296E-01    3.14       0.0  T
   2    -51.7450062 -0.268568E-04  0.165E-01    3.14       1.0  T
   3    -51.7449615  0.446338E-04  0.502E-02    3.14       1.0  T
   4    -51.7450213 -0.597717E-04  0.103E-02    3.14       1.9  T
   5    -51.7450217 -0.451553E-06  0.404E-03    3.14       4.8  T
   6    -51.7450219 -0.113541E-06  0.161E-03    3.14      12.0  T
     SCC iter.                  ...        0 min,  0.009 sec
     gradient                   ...        0 min,  0.018 sec
 * total energy  :   -51.1202844 Eh     change       -0.8860830E-03 Eh
   gradient norm :     0.0152060 Eh/α   predicted    -0.1014391E-02 (  14.48%)
   displ. norm   :     0.1972295 α      lambda       -0.6514503E-03
   maximum displ.:     0.1697697 α      in ANC's #4, #8, #2, ...

........................................................................
.............................. CYCLE    6 ..............................
........................................................................
   1    -51.7418690 -0.517419E+02  0.140E-01    3.13       0.0  T
   2    -51.7418730 -0.397562E-05  0.787E-02    3.13       1.0  T
   3    -51.7418327  0.403008E-04  0.442E-02    3.13       1.0  T
   4    -51.7418803 -0.476727E-04  0.629E-03    3.13       3.1  T
   5    -51.7418803  0.281143E-08  0.284E-03    3.13       6.8  T
   6    -51.7418805 -0.165607E-06  0.821E-04    3.13      23.4  T
     SCC iter.                  ...        0 min,  0.009 sec
     gradient                   ...        0 min,  0.018 sec
 * total energy  :   -51.1208351 Eh     change       -0.5506736E-03 Eh
   gradient norm :     0.0106572 Eh/α   predicted    -0.3383955E-03 ( -38.55%)
   displ. norm   :     0.3639958 α      lambda       -0.9634102E-03
   maximum displ.:     0.2939032 α      in ANC's #4, #8, #2, ...

........................................................................
.............................. CYCLE    7 ..............................
........................................................................
   1    -51.7413345 -0.517413E+02  0.241E-01    3.11       0.0  T
   2    -51.7413482 -0.136509E-04  0.136E-01    3.11       1.0  T
   3    -51.7412957  0.524568E-04  0.497E-02    3.11       1.0  T
   4    -51.7413593 -0.636142E-04  0.111E-02    3.11       1.7  T
   5    -51.7413596 -0.253149E-06  0.499E-03    3.11       3.9  T
   6    -51.7413600 -0.437203E-06  0.158E-03    3.11      12.2  T
   7    -51.7413600 -0.199467E-07  0.756E-04    3.11      25.4  T
     SCC iter.                  ...        0 min,  0.011 sec
     gradient                   ...        0 min,  0.018 sec
 * total energy  :   -51.1215063 Eh     change       -0.6712132E-03 Eh
   gradient norm :     0.0076067 Eh/α   predicted    -0.5455292E-03 ( -18.72%)
   displ. norm   :     0.3586069 α      lambda       -0.5604707E-03
   maximum displ.:     0.3080497 α      in ANC's #4, #8, #2, ...

........................................................................
.............................. CYCLE    8 ..............................
........................................................................
   1    -51.7360444 -0.517360E+02  0.246E-01    3.10       0.0  T
   2    -51.7360592 -0.147260E-04  0.138E-01    3.10       1.0  T
   3    -51.7360330  0.261944E-04  0.388E-02    3.10       1.0  T
   4    -51.7360674 -0.344092E-04  0.114E-02    3.10       1.7  T
   5    -51.7360679 -0.512987E-06  0.443E-03    3.10       4.3  T
   6    -51.7360682 -0.344306E-06  0.168E-03    3.10      11.4  T
   7    -51.7360683 -0.276203E-07  0.748E-04    3.10      25.7  T
     SCC iter.                  ...        0 min,  0.011 sec
     gradient                   ...        0 min,  0.018 sec
 * total energy  :   -51.1218455 Eh     change       -0.3392427E-03 Eh
   gradient norm :     0.0179222 Eh/α   predicted    -0.3162756E-03 (  -6.77%)
   displ. norm   :     0.3120659 α      lambda       -0.5147386E-03
   maximum displ.:     0.2672847 α      in ANC's #4, #8, #5, ...

........................................................................
.............................. CYCLE    9 ..............................
........................................................................
   1    -51.7399033 -0.517399E+02  0.196E-01    3.09       0.0  T
   2    -51.7399118 -0.851014E-05  0.109E-01    3.09       1.0  T
   3    -51.7399059  0.585231E-05  0.248E-02    3.09       1.0  T
   4    -51.7399148 -0.885380E-05  0.118E-02    3.09       1.6  T
   5    -51.7399159 -0.112362E-05  0.267E-03    3.09       7.2  T
   6    -51.7399160 -0.127847E-06  0.120E-03    3.09      16.1  T
     SCC iter.                  ...        0 min,  0.009 sec
     gradient                   ...        0 min,  0.018 sec
 * total energy  :   -51.1221963 Eh     change       -0.3507300E-03 Eh
   gradient norm :     0.0092908 Eh/α   predicted    -0.2824358E-03 ( -19.47%)
   displ. norm   :     0.2700301 α      lambda       -0.4271390E-03
   maximum displ.:     0.2173097 α      in ANC's #4, #8, #3, ...

........................................................................
.............................. CYCLE   10 ..............................
........................................................................
   1    -51.7442054 -0.517442E+02  0.186E-01    3.08       0.0  T
   2    -51.7442146 -0.921185E-05  0.103E-01    3.08       1.0  T
   3    -51.7442034  0.112131E-04  0.286E-02    3.08       1.0  T
   4    -51.7442183 -0.149741E-04  0.113E-02    3.08       1.7  T
   5    -51.7442192 -0.906879E-06  0.257E-03    3.08       7.5  T
   6    -51.7442193 -0.848420E-07  0.113E-03    3.08      17.1  T
     SCC iter.                  ...        0 min,  0.009 sec
     gradient                   ...        0 min,  0.018 sec
 * total energy  :   -51.1224529 Eh     change       -0.2566675E-03 Eh
   gradient norm :     0.0061039 Eh/α   predicted    -0.2291438E-03 ( -10.72%)
   displ. norm   :     0.2487275 α      lambda       -0.2567203E-03
   maximum displ.:     0.1757204 α      in ANC's #4, #8, #5, ...

........................................................................
.............................. CYCLE   11 ..............................
........................................................................
   1    -51.7458992 -0.517459E+02  0.176E-01    3.08       0.0  T
   2    -51.7459073 -0.815149E-05  0.968E-02    3.08       1.0  T
   3    -51.7458979  0.943604E-05  0.271E-02    3.08       1.0  T
   4    -51.7459106 -0.127616E-04  0.119E-02    3.08       1.6  T
   5    -51.7459116 -0.100135E-05  0.242E-03    3.08       7.9  T
   6    -51.7459118 -0.104595E-06  0.107E-03    3.08      18.1  T
     SCC iter.                  ...        0 min,  0.009 sec
     gradient                   ...        0 min,  0.018 sec
 * total energy  :   -51.1225820 Eh     change       -0.1290267E-03 Eh
   gradient norm :     0.0064975 Eh/α   predicted    -0.1363081E-03 (   5.64%)
   displ. norm   :     0.1667596 α      lambda       -0.1264743E-03
   maximum displ.:     0.0914042 α      in ANC's #4, #8, #3, ...

........................................................................
.............................. CYCLE   12 ..............................
........................................................................
   1    -51.7449087 -0.517449E+02  0.109E-01    3.07       0.0  T
   2    -51.7449119 -0.324761E-05  0.615E-02    3.07       1.0  T
   3    -51.7449128 -0.881165E-06  0.984E-03    3.07       2.0  T
   4    -51.7449127  0.311559E-07  0.655E-03    3.07       2.9  T
   5    -51.7449134 -0.651391E-06  0.138E-03    3.07      14.0  T
   6    -51.7449134 -0.247658E-07  0.597E-04    3.07      32.2  T
     SCC iter.                  ...        0 min,  0.009 sec
     gradient                   ...        0 min,  0.018 sec
 * total energy  :   -51.1226703 Eh     change       -0.8836032E-04 Eh
   gradient norm :     0.0052402 Eh/α   predicted    -0.6499687E-04 ( -26.44%)
   displ. norm   :     0.1641877 α      lambda       -0.1398495E-03
   maximum displ.:     0.0816570 α      in ANC's #3, #8, #6, ...

........................................................................
.............................. CYCLE   13 ..............................
........................................................................
   1    -51.7476866 -0.517477E+02  0.993E-02    3.07       0.0  T
   2    -51.7476900 -0.340476E-05  0.547E-02    3.07       1.0  T
   3    -51.7476901 -0.119927E-06  0.110E-02    3.07       1.7  T
   4    -51.7476908 -0.660874E-06  0.609E-03    3.07       3.2  T
   5    -51.7476911 -0.340659E-06  0.227E-03    3.07       8.5  T
   6    -51.7476912 -0.923195E-07  0.638E-04    3.07      30.1  T
     SCC iter.                  ...        0 min,  0.009 sec
     gradient                   ...        0 min,  0.018 sec
 * total energy  :   -51.1227336 Eh     change       -0.6321914E-04 Eh
   gradient norm :     0.0069169 Eh/α   predicted    -0.7181023E-04 (  13.59%)
   displ. norm   :     0.1791206 α      lambda       -0.9151625E-04
   maximum displ.:     0.0901275 α      in ANC's #8, #4, #3, ...

........................................................................
.............................. CYCLE   14 ..............................
........................................................................
   1    -51.7433230 -0.517433E+02  0.132E-01    3.06       0.0  T
   2    -51.7433282 -0.524000E-05  0.731E-02    3.06       1.0  T
   3    -51.7433190  0.924807E-05  0.250E-02    3.06       1.0  T
   4    -51.7433312 -0.122302E-04  0.852E-03    3.06       2.3  T
   5    -51.7433316 -0.407323E-06  0.180E-03    3.06      10.7  T
   6    -51.7433316 -0.340510E-07  0.821E-04    3.06      23.4  T
     SCC iter.                  ...        0 min,  0.009 sec
     gradient                   ...        0 min,  0.018 sec
 * total energy  :   -51.1227628 Eh     change       -0.2927907E-04 Eh
   gradient norm :     0.0056280 Eh/α   predicted    -0.4722783E-04 (  61.30%)
   displ. norm   :     0.0657235 α      lambda       -0.4200910E-04
   maximum displ.:     0.0491036 α      in ANC's #4, #2, #8, ...

........................................................................
.............................. CYCLE   15 ..............................
........................................................................
   1    -51.7453032 -0.517453E+02  0.480E-02    3.06       0.0  T
   2    -51.7453038 -0.609702E-06  0.264E-02    3.07       1.0  T
   3    -51.7453034  0.410847E-06  0.614E-03    3.07       3.1  T
   4    -51.7453040 -0.604535E-06  0.270E-03    3.07       7.1  T
   5    -51.7453040 -0.710633E-07  0.757E-04    3.07      25.4  T
     SCC iter.                  ...        0 min,  0.008 sec
     gradient                   ...        0 min,  0.018 sec
 * total energy  :   -51.1227881 Eh     change       -0.2525623E-04 Eh
   gradient norm :     0.0016941 Eh/α   predicted    -0.2109778E-04 ( -16.47%)
   displ. norm   :     0.0984545 α      lambda        0.1492098E-04
   maximum displ.:     0.0736486 α      in ANC's #4, #2, #8, ...

........................................................................
.............................. CYCLE   16 ..............................
........................................................................
   1    -51.7479823 -0.517480E+02  0.721E-02    3.07       0.0  T
   2    -51.7479837 -0.137308E-05  0.397E-02    3.07       1.0  T
   3    -51.7479831  0.577148E-06  0.835E-03    3.07       2.3  T
   4    -51.7479841 -0.959138E-06  0.409E-03    3.07       4.7  T
   5    -51.7479843 -0.179969E-06  0.112E-03    3.07      17.2  T
   6    -51.7479843 -0.141551E-07  0.395E-04    3.07      48.7  T
   7    -51.7479843 -0.564299E-09  0.229E-04    3.07      84.2  T
     SCC iter.                  ...        0 min,  0.011 sec
     gradient                   ...        0 min,  0.019 sec
 * total energy  :   -51.1227677 Eh     change        0.2043347E-04 Eh
   gradient norm :     0.0071041 Eh/α   predicted     0.7491610E-05 ( -63.34%)
   displ. norm   :     0.0690382 α      lambda       -0.4485275E-04
   maximum displ.:     0.0353099 α      in ANC's #8, #4, #3, ...

........................................................................
.............................. CYCLE   17 ..............................
........................................................................
   1    -51.7470428 -0.517470E+02  0.500E-02    3.07       0.0  T
   2    -51.7470437 -0.856062E-06  0.281E-02    3.07       1.0  T
   3    -51.7470432  0.489796E-06  0.751E-03    3.07       2.6  T
   4    -51.7470440 -0.818850E-06  0.340E-03    3.07       5.7  T
   5    -51.7470441 -0.986463E-07  0.905E-04    3.07      21.3  T
   6    -51.7470441 -0.100362E-07  0.315E-04    3.07      61.1  T
     SCC iter.                  ...        0 min,  0.009 sec
     gradient                   ...        0 min,  0.018 sec
 * total energy  :   -51.1228002 Eh     change       -0.3252974E-04 Eh
   gradient norm :     0.0041525 Eh/α   predicted    -0.2253414E-04 ( -30.73%)
   displ. norm   :     0.1032880 α      lambda       -0.3784544E-04
   maximum displ.:     0.0533872 α      in ANC's #8, #4, #3, ...

........................................................................
.............................. CYCLE   18 ..............................
........................................................................
   1    -51.7447245 -0.517447E+02  0.700E-02    3.06       0.0  T
   2    -51.7447259 -0.138513E-05  0.397E-02    3.06       1.0  T
   3    -51.7447246  0.125962E-05  0.105E-02    3.06       1.8  T
   4    -51.7447266 -0.196941E-05  0.413E-03    3.06       4.7  T
   5    -51.7447267 -0.118673E-06  0.761E-04    3.06      25.3  T
   6    -51.7447267 -0.424971E-08  0.396E-04    3.06      48.6  T
     SCC iter.                  ...        0 min,  0.009 sec
     gradient                   ...        0 min,  0.018 sec
 * total energy  :   -51.1228189 Eh     change       -0.1871236E-04 Eh
   gradient norm :     0.0025088 Eh/α   predicted    -0.1912559E-04 (   2.21%)
   displ. norm   :     0.0525751 α      lambda       -0.1827010E-04
   maximum displ.:     0.0311226 α      in ANC's #8, #6, #3, ...

........................................................................
.............................. CYCLE   19 ..............................
........................................................................
   1    -51.7449243 -0.517449E+02  0.332E-02    3.07       0.0  T
   2    -51.7449248 -0.444416E-06  0.198E-02    3.07       1.0  T
   3    -51.7449248 -0.283722E-07  0.341E-03    3.07       5.6  T
   4    -51.7449249 -0.150568E-06  0.177E-03    3.07      10.9  T
   5    -51.7449250 -0.347359E-07  0.738E-04    3.07      26.1  T
   6    -51.7449250 -0.585656E-08  0.183E-04    3.07     105.4  T
     SCC iter.                  ...        0 min,  0.009 sec
     gradient                   ...        0 min,  0.019 sec
 * total energy  :   -51.1228328 Eh     change       -0.1392846E-04 Eh
   gradient norm :     0.0030675 Eh/α   predicted    -0.9164326E-05 ( -34.20%)
   displ. norm   :     0.1469816 α      lambda       -0.5296627E-04
   maximum displ.:     0.0892389 α      in ANC's #6, #3, #8, ...

........................................................................
.............................. CYCLE   20 ..............................
........................................................................
   1    -51.7454335 -0.517454E+02  0.933E-02    3.07       0.0  T
   2    -51.7454352 -0.167050E-05  0.546E-02    3.07       1.0  T
   3    -51.7454356 -0.471032E-06  0.641E-03    3.07       3.0  T
   4    -51.7454358 -0.167605E-06  0.416E-03    3.07       4.6  T
   5    -51.7454361 -0.263819E-06  0.105E-03    3.07      18.4  T
   6    -51.7454361 -0.147994E-07  0.467E-04    3.07      41.2  T
   7    -51.7454361 -0.194987E-09  0.247E-04    3.07      78.0  T
     SCC iter.                  ...        0 min,  0.011 sec
     gradient                   ...        0 min,  0.019 sec
 * total energy  :   -51.1228734 Eh     change       -0.4061052E-04 Eh
   gradient norm :     0.0033853 Eh/α   predicted    -0.2705895E-04 ( -33.37%)
   displ. norm   :     0.2385962 α      lambda       -0.6776782E-04
   maximum displ.:     0.1257288 α      in ANC's #6, #3, #8, ...
 * RMSD in coord.:     0.5701178 α      energy gain  -0.3832787E-01 Eh

generating ANC from model Hessian ...
Using Lindh-Hessian (1995)
 Shifting diagonal of input Hessian by   3.993974629590448E-003
 Lowest  eigenvalues of input Hessian
   -0.000000   -0.000000   -0.000000    0.000000    0.000000    0.000000
    0.005000    0.006477    0.007662    0.008555    0.009329    0.011554
    0.013271    0.013564    0.015775    0.020170    0.024369    0.024529
 Highest eigenvalues
    1.691597    1.719114    1.833508    1.887887    2.022760    2.560858
 

........................................................................
.............................. CYCLE   21 ..............................
........................................................................
   1    -51.7447776 -0.517448E+02  0.148E-01    3.08       0.0  T
   2    -51.7447818 -0.415947E-05  0.878E-02    3.08       1.0  T
   3    -51.7447813  0.493010E-06  0.134E-02    3.08       1.4  T
   4    -51.7447842 -0.292185E-05  0.546E-03    3.08       3.5  T
   5    -51.7447844 -0.178392E-06  0.160E-03    3.08      12.1  T
   6    -51.7447844 -0.297848E-07  0.738E-04    3.08      26.1  T
   7    -51.7447844 -0.313916E-08  0.386E-04    3.08      49.9  T
     SCC iter.                  ...        0 min,  0.010 sec
     gradient                   ...        0 min,  0.019 sec
 * total energy  :   -51.1229133 Eh     change       -0.3986331E-04 Eh
   gradient norm :     0.0035080 Eh/α   predicted     0.0000000E+00 (-100.00%)
   displ. norm   :     0.0310277 α      lambda       -0.2600730E-04
   maximum displ.:     0.0190148 α      in ANC's #2, #3, #5, ...

........................................................................
.............................. CYCLE   22 ..............................
........................................................................
   1    -51.7455391 -0.517455E+02  0.236E-02    3.08       0.0  T
   2    -51.7455394 -0.355742E-06  0.129E-02    3.08       1.5  T
   3    -51.7455392  0.214565E-06  0.393E-03    3.08       4.9  T
   4    -51.7455395 -0.282073E-06  0.164E-03    3.08      11.7  T
   5    -51.7455395 -0.323293E-07  0.650E-04    3.08      29.6  T
   6    -51.7455395 -0.202274E-08  0.243E-04    3.08      79.1  T
     SCC iter.                  ...        0 min,  0.009 sec
     gradient                   ...        0 min,  0.019 sec
 * total energy  :   -51.1229323 Eh     change       -0.1905077E-04 Eh
   gradient norm :     0.0015305 Eh/α   predicted    -0.1301627E-04 ( -31.68%)
   displ. norm   :     0.0535698 α      lambda       -0.1341142E-04
   maximum displ.:     0.0304813 α      in ANC's #2, #5, #3, ...

........................................................................
.............................. CYCLE   23 ..............................
........................................................................
   1    -51.7460647 -0.517461E+02  0.373E-02    3.08       0.0  T
   2    -51.7460655 -0.745048E-06  0.210E-02    3.08       1.0  T
   3    -51.7460650  0.499228E-06  0.553E-03    3.08       3.5  T
   4    -51.7460656 -0.670506E-06  0.210E-03    3.08       9.2  T
   5    -51.7460657 -0.598945E-07  0.861E-04    3.08      22.4  T
   6    -51.7460657 -0.259121E-08  0.369E-04    3.08      52.2  T
     SCC iter.                  ...        0 min,  0.009 sec
     gradient                   ...        0 min,  0.019 sec
 * total energy  :   -51.1229419 Eh     change       -0.9502798E-05 Eh
   gradient norm :     0.0013050 Eh/α   predicted    -0.6715081E-05 ( -29.34%)
   displ. norm   :     0.0266348 α      lambda       -0.3881808E-05
   maximum displ.:     0.0203104 α      in ANC's #2, #5, #3, ...

........................................................................
.............................. CYCLE   24 ..............................
........................................................................
   1    -51.7459717 -0.517460E+02  0.238E-02    3.08       0.0  T
   2    -51.7459719 -0.177987E-06  0.127E-02    3.08       1.5  T
   3    -51.7459718  0.481973E-07  0.250E-03    3.08       7.7  T
   4    -51.7459719 -0.101425E-06  0.129E-03    3.08      14.9  T
   5    -51.7459719 -0.166048E-07  0.404E-04    3.08      47.7  T
   6    -51.7459719 -0.279640E-08  0.149E-04    3.08     129.5  T
     SCC iter.                  ...        0 min,  0.009 sec
     gradient                   ...        0 min,  0.019 sec
 * total energy  :   -51.1229460 Eh     change       -0.4167710E-05 Eh
   gradient norm :     0.0009230 Eh/α   predicted    -0.1942555E-05 ( -53.39%)
   displ. norm   :     0.0572446 α      lambda       -0.8024967E-05
   maximum displ.:     0.0399713 α      in ANC's #2, #4, #7, ...

   *** GEOMETRY OPTIMIZATION CONVERGED AFTER 24 ITERATIONS ***

------------------------------------------------------------------------
 total energy gain   :        -0.0384005 Eh      -24.0966 kcal/mol
 total RMSD          :         0.5827176 a0        0.3084 Å
 total power (kW/mol):        -4.2008493 (step)  -97.7280 (real)
------------------------------------------------------------------------

 ANCopt (total)                0 d,  0 h,  0 min,  1.032 sec
 optimizer setup                ...        0 min,  0.000 sec (  0.016%)
 model hessian                  ...        0 min,  0.027 sec (  2.594%)
 ANC generation                 ...        0 min,  0.002 sec (  0.154%)
 coordinate transformation      ...        0 min,  0.000 sec (  0.044%)
 single point calculation       ...        0 min,  0.992 sec ( 96.187%)
 optimization log               ...        0 min,  0.003 sec (  0.256%)
 hessian update                 ...        0 min,  0.000 sec (  0.033%)
 rational function              ...        0 min,  0.006 sec (  0.575%)

================
 final structure:
================
$coord
    3.02922062059124   -1.81256300174154    2.19478355274533      C 
    5.31694189268646    0.42932845989566    1.77254529400818      S 
    3.17269014414277    2.48607982315352    0.35921099741947      C 
    0.79881646740301    1.42748239599559    0.28319082520470      C 
    0.73096711610847   -1.03608644685094    1.33578601888817      C 
   -1.63039000690053   -2.58793273683573    1.54775219734446      C 
   -3.73124874386564   -1.58424706516851   -0.17002540441238      C 
   -3.30407345913016   -2.41823996925416   -2.89560554676215      C 
   -3.68826411304175   -4.91403409845950   -3.14037635688745      F 
   -4.91936633470190   -1.28676006637468   -4.49879409283010      F 
   -0.98626740339295   -1.97204868330739   -3.79316966432636      F 
   -3.94233348612404    1.30972408534518    0.04651443023490      C 
   -4.50180187810971    1.95270642008197    2.64551692238609      C 
   -4.92557307234622    2.46898170618556    4.69775881849611      N 
   -1.50962776186060    2.66521517426158   -0.78500598694391      C 
    4.13125187149159    4.89655469033636   -0.46921658059426      C 
    3.04462476857034    6.53314377031654   -2.03748423174817      C 
    3.49637323614202   -3.58337006683960    3.05917834612670      H 
   -2.30353561963989   -2.52407967527395    3.50253404249698      H 
   -1.22683255404969   -4.56187903667173    1.09437692523584      H 
   -5.53971418876009   -2.43822577472096    0.37494764801500      H 
   -5.52505380154085    1.98018038547320   -1.11324212946160      H 
   -1.59279662765800    4.63630794941409   -0.16877657268421      H 
   -1.40938807399015    2.65503916000205   -2.85057106856050      H 
    5.98111073853735    5.34115375088151    0.28625490211667      H 
    1.25478686040300    6.20679509704204   -2.93623130618597      H 
    3.97425020608220    8.28015541021679   -2.50678907431281      H 
$end
           -------------------------------------------------
          |                Final Singlepoint                |
           -------------------------------------------------

          ...................................................
          :                      SETUP                      :
          :.................................................:
          :  # basis functions                  84          :
          :  # atomic orbitals                  83          :
          :  # shells                           45          :
          :  # electrons                        90          :
          :  max. iterations                   250          :
          :  Hamiltonian                  GFN2-xTB          :
          :  restarted?                      false          :
          :  GBSA solvation                  false          :
          :  PC potential                    false          :
          :  electronic temp.          300.0000000     K    :
          :  accuracy                    1.0000000          :
          :  -> integral cutoff          0.2500000E+02      :
          :  -> integral neglect         0.1000000E-07      :
          :  -> SCF convergence          0.1000000E-05 Eh   :
          :  -> wf. convergence          0.1000000E-03 e    :
          :  Broyden damping             0.4000000          :
          ...................................................

 iter      E             dE          RMSdq      gap      omega  full diag
   1    -51.7459719 -0.517460E+02  0.451E-05    3.08       0.0  T
   2    -51.7459719 -0.417089E-11  0.212E-05    3.08     908.0  T
   3    -51.7459719 -0.364508E-11  0.200E-05    3.08     960.7  T

   *** convergence criteria satisfied after 3 iterations ***

         #    Occupation            Energy/Eh            Energy/eV
      -------------------------------------------------------------
         1        2.0000           -0.8919364             -24.2708
       ...           ...                  ...                  ...
        39        2.0000           -0.4673627             -12.7176
        40        2.0000           -0.4567720             -12.4294
        41        2.0000           -0.4443523             -12.0914
        42        2.0000           -0.4418663             -12.0238
        43        2.0000           -0.4396775             -11.9642
        44        2.0000           -0.4009197             -10.9096
        45        2.0000           -0.3855264             -10.4907 (HOMO)
        46                         -0.2722222              -7.4075 (LUMO)
        47                         -0.2297532              -6.2519
        48                         -0.2251198              -6.1258
        49                         -0.2125745              -5.7844
        50                         -0.2071339              -5.6364
       ...                                ...                  ...
        83                          1.1246185              30.6024
      -------------------------------------------------------------
                  HL-Gap            0.1133043 Eh            3.0832 eV
             Fermi-level           -0.3288743 Eh           -8.9491 eV

 SCC (total)                   0 d,  0 h,  0 min,  0.038 sec
 SCC setup                      ...        0 min,  0.000 sec (  0.620%)
 Dispersion                     ...        0 min,  0.000 sec (  0.642%)
 integral evaluation            ...        0 min,  0.013 sec ( 32.766%)
 zeroth order Hamiltonian       ...        0 min,  0.000 sec (  0.608%)
 iterations                     ...        0 min,  0.005 sec ( 13.881%)
 molecular gradient             ...        0 min,  0.019 sec ( 50.388%)
 printout                       ...        0 min,  0.000 sec (  0.962%)

         :::::::::::::::::::::::::::::::::::::::::::::::::::::
         ::                     SUMMARY                     ::
         :::::::::::::::::::::::::::::::::::::::::::::::::::::
         :: total energy             -51.122946023046 Eh    ::
         :: gradient norm              0.000923439301 Eh/a0 ::
         :: HOMO-LUMO gap              3.083166487765 eV    ::
         ::.................................................::
         :: SCC energy               -51.745971931057 Eh    ::
         :: -> isotropic ES            0.051893147719 Eh    ::
         :: -> anisotropic ES          0.002627612997 Eh    ::
         :: -> anisotropic XC          0.011938213974 Eh    ::
         :: -> dispersion             -0.031049991232 Eh    ::
         :: repulsion energy           0.622586398743 Eh    ::
         :: add. restraining           0.000000000000 Eh    ::
         :::::::::::::::::::::::::::::::::::::::::::::::::::::

           -------------------------------------------------
          |                Property Printout                |
           -------------------------------------------------

    * Orbital Energies and Occupations

         #    Occupation            Energy/Eh            Energy/eV
      -------------------------------------------------------------
         1        2.0000           -0.8919364             -24.2708
       ...           ...                  ...                  ...
        33        2.0000           -0.4968198             -13.5192
        34        2.0000           -0.4949589             -13.4685
        35        2.0000           -0.4905393             -13.3483
        36        2.0000           -0.4818378             -13.1115
        37        2.0000           -0.4788214             -13.0294
        38        2.0000           -0.4691895             -12.7673
        39        2.0000           -0.4673627             -12.7176
        40        2.0000           -0.4567720             -12.4294
        41        2.0000           -0.4443523             -12.0914
        42        2.0000           -0.4418663             -12.0238
        43        2.0000           -0.4396775             -11.9642
        44        2.0000           -0.4009197             -10.9096
        45        2.0000           -0.3855264             -10.4907 (HOMO)
        46                         -0.2722222              -7.4075 (LUMO)
        47                         -0.2297532              -6.2519
        48                         -0.2251198              -6.1258
        49                         -0.2125745              -5.7844
        50                         -0.2071339              -5.6364
        51                         -0.1594174              -4.3380
        52                         -0.1230637              -3.3487
        53                         -0.0142554              -0.3879
        54                         -0.0035211              -0.0958
        55                          0.0040248               0.1095
        56                          0.0150183               0.4087
       ...                                ...                  ...
        83                          1.1246185              30.6024
      -------------------------------------------------------------
                  HL-Gap            0.1133043 Eh            3.0832 eV
             Fermi-level           -0.3288743 Eh           -8.9491 eV

     #   Z        covCN         q      C6AA      α(0)
     1   6 C      2.937    -0.033    28.818     8.804
     2  16 S      2.349    -0.015   141.693    20.034
     3   6 C      2.987     0.014    27.692     8.632
     4   6 C      3.156    -0.014    28.042     8.659
     5   6 C      3.166    -0.010    27.909     8.633
     6   6 C      3.809    -0.056    21.577     6.612
     7   6 C      3.866    -0.026    21.002     6.517
     8   6 C      3.332     0.486    17.346     6.605
     9   9 F      0.791    -0.209    11.327     3.976
    10   9 F      0.791    -0.212    11.360     3.981
    11   9 F      0.791    -0.198    11.215     3.956
    12   6 C      3.859    -0.008    20.680     6.467
    13   6 C      1.911     0.116    28.247     8.583
    14   7 N      0.911    -0.219    25.786     7.344
    15   6 C      3.814    -0.048    21.421     6.587
    16   6 C      2.939    -0.030    28.742     8.793
    17   6 C      2.837    -0.092    30.294     9.020
    18   1 H      0.926     0.048     2.350     2.397
    19   1 H      0.924     0.063     2.169     2.303
    20   1 H      0.924     0.057     2.237     2.339
    21   1 H      0.924     0.064     2.156     2.296
    22   1 H      0.924     0.072     2.064     2.247
    23   1 H      0.924     0.058     2.222     2.331
    24   1 H      0.924     0.058     2.222     2.331
    25   1 H      0.925     0.048     2.348     2.396
    26   1 H      0.926     0.042     2.419     2.432
    27   1 H      0.926     0.046     2.374     2.409

 Mol. C6AA /au·bohr⁶  :      10319.480673
 Mol. C8AA /au·bohr⁸  :     271868.697868
 Mol. α(0) /au        :        156.686899


Wiberg/Mayer (AO) data.
largest (>0.10) Wiberg bond orders for each atom
          total WBO             WBO to atom ...
     1  C   3.949        C    5 1.572    S    2 1.206    H   18 0.970    C    3 0.103
     2  S   2.627        C    1 1.206    C    3 1.138
     3  C   3.948        C    4 1.495    S    2 1.138    C   16 1.132    C    1 0.103
     4  C   3.983        C    3 1.495    C    5 1.254    C   15 1.012
     5  C   3.983        C    1 1.572    C    4 1.254    C    6 1.006
     6  C   3.991        C    5 1.006    C    7 0.990    H   20 0.966    H   19 0.958
     7  C   3.982        C    6 0.990    C   12 0.961    H   21 0.960    C    8 0.943
     8  C   3.825        F   11 0.957    F    9 0.946    C    7 0.943    F   10 0.942
     9  F   1.068        C    8 0.946
    10  F   1.066        C    8 0.942
    11  F   1.083        C    8 0.957
    12  C   3.993        C   13 1.033    C   15 0.965    C    7 0.961    H   22 0.937
    13  C   3.945        N   14 2.862    C   12 1.033
    14  N   3.013        C   13 2.862
    15  C   3.993        C    4 1.012    C   12 0.965    H   23 0.961    H   24 0.955
    16  C   3.991        C   17 1.865    C    3 1.132    H   25 0.962
    17  C   3.991        C   16 1.865    H   27 0.977    H   26 0.973
    18  H   0.997        C    1 0.970
    19  H   0.996        C    6 0.958
    20  H   0.996        C    6 0.966
    21  H   0.995        C    7 0.960
    22  H   0.994        C   12 0.937
    23  H   0.996        C   15 0.961
    24  H   0.997        C   15 0.955
    25  H   0.997        C   16 0.962
    26  H   0.998        C   17 0.973
    27  H   0.997        C   17 0.977

molecular dipole:
                 x           y           z       tot (Debye)
 q only:        0.247       0.303       0.246
   full:       -0.066       0.083      -0.224       0.629
molecular quadrupole (traceless):
                xx          xy          yy          xz          yz          zz
 q only:        2.608       0.822       4.960       1.168      -9.653      -7.568
  q+dip:        1.555       1.663       7.574       4.388     -12.969      -9.129
   full:        1.910       1.599       8.207       4.190     -12.887     -10.117

           -------------------------------------------------
          |                Geometry Summary                 |
           -------------------------------------------------

      molecular mass/u    :      257.2729000
   center of mass at/Å    :       -0.2638882       0.1055303      -0.1463442
  moments of inertia/u·Å² :        0.8339679E+03   0.1549416E+04   0.1643999E+04
rotational constants/cm⁻¹ :        0.2021377E-01   0.1087999E-01   0.1025404E-01

 * 25 selected distances

     #   Z        #   Z                                     value/Å
     1   6 C      2  16 S                                 1.7096628
     2  16 S      3   6 C                                 1.7411102 (max)
     3   6 C      4   6 C                                 1.3760322
     1   6 C      5   6 C                                 1.3618232
     4   6 C      5   6 C                                 1.4181291
     6   6 C      7   6 C                                 1.5311204
     7   6 C      8   6 C                                 1.5251702
     8   6 C      9   9 F                                 1.3425367
     8   6 C     10   9 F                                 1.3449466
     8   6 C     11   9 F                                 1.3363096
     7   6 C     12   6 C                                 1.5397617
    13   6 C     14   7 N                                 1.1420694
     4   6 C     15   6 C                                 1.4969209
    12   6 C     15   6 C                                 1.5379715
    16   6 C     17   6 C                                 1.3301885
     1   6 C     18   1 H                                 1.0716548 (min)
     6   6 C     19   1 H                                 1.0945625
     6   6 C     20   1 H                                 1.0928339
     7   6 C     21   1 H                                 1.0969198
    12   6 C     22   1 H                                 1.0972680
    15   6 C     23   1 H                                 1.0937292
    15   6 C     24   1 H                                 1.0943497
    16   6 C     25   1 H                                 1.0832484
    17   6 C     26   1 H                                 1.0738217
    17   6 C     27   1 H                                 1.0762612

 * 5 distinct bonds (by element types)

   Z      Z             #   av. dist./Å        max./Å        min./Å
   1 H    6 C          10     1.0874649     1.0972680     1.0716548
   6 C    6 C           9     1.4574575     1.5397617     1.3301885
   6 C    7 N           1     1.1420694     1.1420694     1.1420694
   6 C    9 F           3     1.3412643     1.3449466     1.3363096
   6 C   16 S           2     1.7253865     1.7411102     1.7096628


optimized geometry written to: xtbopt.xyz


           -------------------------------------------------
          | TOTAL ENERGY              -51.122946023046 Eh   |
          | GRADIENT NORM               0.000923439301 Eh/α |
          | HOMO-LUMO GAP               3.083166487765 eV   |
           -------------------------------------------------

------------------------------------------------------------------------
 * finished run on 2021/05/19 at 11:00:51.272     
------------------------------------------------------------------------
 total:
 * wall-time:     0 d,  0 h,  0 min,  1.151 sec
 *  cpu-time:     0 d,  0 h,  0 min,  1.147 sec
 * ratio c/w:     0.996 speedup
 SCF:
 * wall-time:     0 d,  0 h,  0 min,  0.055 sec
 *  cpu-time:     0 d,  0 h,  0 min,  0.054 sec
 * ratio c/w:     0.998 speedup
 ANC optimizer:
 * wall-time:     0 d,  0 h,  0 min,  1.071 sec
 *  cpu-time:     0 d,  0 h,  0 min,  1.068 sec
 * ratio c/w:     0.998 speedup

