      -----------------------------------------------------------      
     |                   =====================                   |     
     |                           x T B                           |     
     |                   =====================                   |     
     |                         S. Grimme                         |     
     |          Mulliken Center for Theoretical Chemistry        |     
     |                    University of Bonn                     |     
     |                Version 6.2 RC2 (SAW190805)                |     
      -----------------------------------------------------------      

   This program is distributed in the hope that it will be useful,
   but WITHOUT ANY WARRANTY; without even the implied warranty of
   MERCHANTABILITY or FITNESS FOR A PARTICULAR PURPOSE.
   
   FOR NON-COMMERCIAL, ACADEMIA USE ONLY.
   
   Cite this work as:
   * S. Grimme, C. Bannwarth, P. Shushkov, J. Chem. Theory Comput., 2017,
     13, 1989-2009. DOI: 10.1021/acs.jctc.7b00118
   * C. Bannwarth, S. Ehlert and S. Grimme., J. Chem. Theory Comput., 2019,
     15, 1652-1671. DOI: 10.1021/acs.jctc.8b01176
   * P. Pracht, E. Caldeweyher, S. Ehlert, S. Grimme, ChemRxiv, 2019, preprint.
     DOI: 10.26434/chemrxiv.8326202.v1
   
   for DFT-D4:
   * E. Caldeweyher, C. Bannwarth and S. Grimme, J. Chem. Phys., 2017,
     147, 034112. DOI: 10.1063/1.4993215
   * E. Caldeweyher, S. Ehlert, A. Hansen, H. Neugebauer, S. Spicher,
     C. Bannwarth and S. Grimme, J. Chem. Phys., 2019, 150, 154122.
     DOI: 10.1063/1.5090222
   
   for sTDA-xTB:
   * S. Grimme and C. Bannwarth, J. Chem. Phys., 2016, 145, 054103.
     DOI: 10.1063/1.4959605
   
   in the mass-spec context:
   * V. Asgeirsson, C. Bauer and S. Grimme, Chem. Sci., 2017, 8, 4879.
     DOI: 10.1039/c7sc00601b
   
   for metadynamics refer to:
   * S. Grimme, J. Chem. Theory Comput., 2019, 155, 2847-2862
     DOI: 10.1021/acs.jctc.9b00143
   
   with help from (in alphabetical order)
   C. Bannwarth, F. Bohle, G. Brandenburg, E. Caldeweyher, M. Checinski,
   S. Dohm, S. Ehlert, S. Ehrlich, F. März, H. Neugebauer, J. Pisarek,
   P. Pracht, P. Shushkov, and S. Spicher.
   
 * started run on 2021/05/19 at 10:58:34.240     

           -------------------------------------------------
          |                Calculation Setup                |
           -------------------------------------------------

          program call               : /ihome/ghutchison/geoffh/xtb/xtb 104.xyz -opt
          hostname                   : smp-n83
          coordinate file            : 104.xyz
          omp threads                :                     1
          number of atoms            :                    26
          number of electrons        :                    62
          charge                     :                     0
          spin                       :                   0.0
          first test random number   :      0.17033861460107


########################################################################
# WARNING! Please study the warnings concerning your input carefully
#  - the use of '-opt' is discouraged, please use '--opt' next time
########################################################################

           ------------------------------------------------- 
          |                 G F N 2 - x T B                 |
          | Geometry, Frequencies, Noncovalent interactions |
          |            JCTC 2019 parametrisation            |
           ------------------------------------------------- 
             KAB for C  - Si     :                1.0500
             KAB for H  - Pd     :                0.9500
             k(s)              :                1.8500
             k(p)              :                2.2300
             k(d)              :                2.2300
             k(f)              :                2.0000
             kEN (H0ij)        :               -2.0000
             D4 a1             :                0.5200
             D4 a2             :                5.0000
             D4 s6             :                1.0000
             D4 s8             :                2.7000
             D4 s9             :                5.0000
             alphaj            :                2.0000

  Z AO/shell   Hii/eV     exponent
  1     Wed Apr 25 08:07:45 CEST 2018   EN: 2.200 GM2: 0.406  GM3: 0.0800  RAES: 1.40
     1s    -10.707211    1.230000
  6     Wed Apr 25 08:07:45 CEST 2018   EN: 2.550 GM2: 0.538  GM3: 0.1500  RAES: 3.00
     2s    -13.970922    2.096432
     2p    -10.063292    1.800000

           ------------------------------------------------- 
          |        Self-Consistent Charge Iterations        |
           ------------------------------------------------- 

          ...................................................
          :                      SETUP                      :
          :.................................................:
          :  # basis functions                  62          :
          :  # atomic orbitals                  62          :
          :  # shells                           38          :
          :  # electrons                        62          :
          :  max. iterations                   250          :
          :  Hamiltonian                  GFN2-xTB          :
          :  restarted?                      false          :
          :  GBSA solvation                  false          :
          :  PC potential                    false          :
          :  electronic temp.          300.0000000     K    :
          :  accuracy                    1.0000000          :
          :  -> integral cutoff          0.2500000E+02      :
          :  -> integral neglect         0.1000000E-07      :
          :  -> SCF convergence          0.1000000E-05 Eh   :
          :  -> wf. convergence          0.1000000E-03 e    :
          :  Broyden damping             0.4000000          :
          ...................................................

 iter      E             dE          RMSdq      gap      omega  full diag
   1    -33.3350745 -0.333351E+02  0.405E+00    3.02       0.0  T
   2    -33.3637694 -0.286949E-01  0.237E+00    3.01       1.0  T
   3    -33.3593935  0.437589E-02  0.745E-01    2.98       1.0  T
   4    -33.3644115 -0.501799E-02  0.346E-01    3.00       1.0  T
   5    -33.3666887 -0.227724E-02  0.107E-01    2.99       1.0  T
   6    -33.3668950 -0.206276E-03  0.431E-02    2.99       1.0  T
   7    -33.3669075 -0.125358E-04  0.267E-02    2.99       1.0  T
   8    -33.3669144 -0.681717E-05  0.852E-03    2.99       2.3  T
   9    -33.3669154 -0.104594E-05  0.120E-03    2.99      16.4  T
  10    -33.3669154 -0.167244E-07  0.614E-04    2.99      32.0  T
  11    -33.3669154 -0.294814E-08  0.142E-04    2.99     137.8  T

   *** convergence criteria satisfied after 11 iterations ***

         #    Occupation            Energy/Eh            Energy/eV
      -------------------------------------------------------------
         1        2.0000           -0.6368748             -17.3302
       ...           ...                  ...                  ...
        25        2.0000           -0.4402230             -11.9791
        26        2.0000           -0.4305572             -11.7161
        27        2.0000           -0.4178857             -11.3712
        28        2.0000           -0.4112295             -11.1901
        29        2.0000           -0.4009730             -10.9110
        30        2.0000           -0.3815831             -10.3834
        31        2.0000           -0.3665439              -9.9742 (HOMO)
        32                         -0.2565616              -6.9814 (LUMO)
        33                         -0.2155517              -5.8655
        34                         -0.2015675              -5.4849
        35                         -0.1387871              -3.7766
        36                         -0.0853594              -2.3227
       ...                                ...                  ...
        62                          0.6664752              18.1357
      -------------------------------------------------------------
                  HL-Gap            0.1099822 Eh            2.9928 eV
             Fermi-level           -0.3115527 Eh           -8.4778 eV

 SCC (total)                   0 d,  0 h,  0 min,  0.032 sec
 SCC setup                      ...        0 min,  0.000 sec (  0.953%)
 Dispersion                     ...        0 min,  0.000 sec (  1.192%)
 integral evaluation            ...        0 min,  0.007 sec ( 22.768%)
 zeroth order Hamiltonian       ...        0 min,  0.000 sec (  0.456%)
 iterations                     ...        0 min,  0.012 sec ( 37.980%)
 molecular gradient             ...        0 min,  0.011 sec ( 35.347%)
 printout                       ...        0 min,  0.000 sec (  1.146%)

         :::::::::::::::::::::::::::::::::::::::::::::::::::::
         ::                     SUMMARY                     ::
         :::::::::::::::::::::::::::::::::::::::::::::::::::::
         :: total energy             -32.778849614247 Eh    ::
         :: gradient norm              0.035665890586 Eh/a0 ::
         :: HOMO-LUMO gap              2.992768827507 eV    ::
         ::.................................................::
         :: SCC energy               -33.366915427580 Eh    ::
         :: -> isotropic ES            0.003808894677 Eh    ::
         :: -> anisotropic ES          0.006909736024 Eh    ::
         :: -> anisotropic XC          0.024340861693 Eh    ::
         :: -> dispersion             -0.021590653672 Eh    ::
         :: repulsion energy           0.588077936872 Eh    ::
         :: add. restraining           0.000000000000 Eh    ::
         :::::::::::::::::::::::::::::::::::::::::::::::::::::

      ----------------------------------------------------------- 
     |                   =====================                   |
     |                        A N C O P T                        |
     |                   =====================                   |
     |               Approximate Normal Coordinate               |
     |                Rational Function Optimizer                |
      ----------------------------------------------------------- 

          ...................................................
          :                      SETUP                      :
          :.................................................:
          :   optimization level            normal          :
          :   max. optcycles                   200          :
          :   ANC micro-cycles                  20          :
          :   degrees of freedom                72          :
          :.................................................:
          :   RF solver                   davidson          :
          :   input Hessian                  false          :
          :   write xtbopt.log                true          :
          :   linear?                        false          :
          :   energy convergence         0.5000000E-05 Eh   :
          :   grad. convergence          0.1000000E-02 Eh/α :
          :   maximium RF displ.         2.0000000          :
          :   Hlow (freq-cutoff)         0.5000000E-02      :
          :   Hmax (freq-cutoff)         5.0000000          :
          :   S6 in model hess.         20.0000000          :
          ...................................................

generating ANC from model Hessian ...
Using Lindh-Hessian (1995)
 Shifting diagonal of input Hessian by   3.930553846322240E-003
 Lowest  eigenvalues of input Hessian
   -0.000000   -0.000000    0.000000    0.000000    0.000000    0.000000
    0.005000    0.005494    0.005905    0.006201    0.010542    0.011433
    0.011989    0.013444    0.013695    0.016198    0.017036    0.019298
 Highest eigenvalues
    1.643006    1.749814    1.809253    1.895305    1.926523    2.035299
 

........................................................................
.............................. CYCLE    1 ..............................
........................................................................
   1    -33.3669154 -0.333669E+02  0.506E-05    2.99       0.0  T
   2    -33.3669154 -0.832756E-11  0.292E-05    2.99     671.3  T
   3    -33.3669154 -0.323297E-11  0.188E-05    2.99    1043.3  T
     SCC iter.                  ...        0 min,  0.004 sec
     gradient                   ...        0 min,  0.011 sec
 * total energy  :   -32.7788496 Eh     change       -0.2754501E-07 Eh
   gradient norm :     0.0356658 Eh/α   predicted     0.0000000E+00 (-100.00%)
   displ. norm   :     0.2093100 α      lambda       -0.3906095E-02
   maximum displ.:     0.1009927 α      in ANC's #9, #17, #14, ...

........................................................................
.............................. CYCLE    2 ..............................
........................................................................
   1    -33.3970408 -0.333970E+02  0.102E-01    3.01       0.0  T
   2    -33.3970477 -0.688761E-05  0.621E-02    3.01       1.0  T
   3    -33.3970287  0.189714E-04  0.323E-02    3.01       1.0  T
   4    -33.3970500 -0.212772E-04  0.683E-03    3.01       2.9  T
   5    -33.3970510 -0.105184E-05  0.226E-03    3.01       8.7  T
   6    -33.3970511 -0.840724E-07  0.948E-04    3.01      20.7  T
     SCC iter.                  ...        0 min,  0.006 sec
     gradient                   ...        0 min,  0.011 sec
 * total energy  :   -32.7812616 Eh     change       -0.2411919E-02 Eh
   gradient norm :     0.0111407 Eh/α   predicted    -0.2038612E-02 ( -15.48%)
   displ. norm   :     0.1247691 α      lambda       -0.4399565E-03
   maximum displ.:     0.0825927 α      in ANC's #9, #7, #14, ...

........................................................................
.............................. CYCLE    3 ..............................
........................................................................
   1    -33.4054963 -0.334055E+02  0.600E-02    3.00       0.0  T
   2    -33.4054970 -0.731512E-06  0.356E-02    3.00       1.0  T
   3    -33.4054928  0.419104E-05  0.142E-02    3.00       1.4  T
   4    -33.4054975 -0.468467E-05  0.219E-03    3.00       8.9  T
   5    -33.4054976 -0.991811E-07  0.917E-04    3.00      21.4  T
   6    -33.4054976 -0.840738E-08  0.443E-04    3.00      44.3  T
     SCC iter.                  ...        0 min,  0.006 sec
     gradient                   ...        0 min,  0.011 sec
 * total energy  :   -32.7815221 Eh     change       -0.2605741E-03 Eh
   gradient norm :     0.0035721 Eh/α   predicted    -0.2234031E-03 ( -14.27%)
   displ. norm   :     0.0958673 α      lambda       -0.9866454E-04
   maximum displ.:     0.0592330 α      in ANC's #7, #9, #3, ...

........................................................................
.............................. CYCLE    4 ..............................
........................................................................
   1    -33.4059682 -0.334060E+02  0.506E-02    2.98       0.0  T
   2    -33.4059684 -0.172583E-06  0.299E-02    2.98       1.0  T
   3    -33.4059675  0.942282E-06  0.604E-03    2.98       3.2  T
   4    -33.4059685 -0.104137E-05  0.110E-03    2.98      17.8  T
   5    -33.4059685 -0.220737E-07  0.403E-04    2.98      48.6  T
   6    -33.4059685 -0.119643E-08  0.187E-04    2.98     104.7  T
     SCC iter.                  ...        0 min,  0.006 sec
     gradient                   ...        0 min,  0.011 sec
 * total energy  :   -32.7815990 Eh     change       -0.7688626E-04 Eh
   gradient norm :     0.0023586 Eh/α   predicted    -0.4978901E-04 ( -35.24%)
   displ. norm   :     0.1864942 α      lambda       -0.1373423E-03
   maximum displ.:     0.1210537 α      in ANC's #7, #9, #3, ...

........................................................................
.............................. CYCLE    5 ..............................
........................................................................
   1    -33.4045127 -0.334045E+02  0.101E-01    2.95       0.0  T
   2    -33.4045132 -0.455891E-06  0.597E-02    2.95       1.0  T
   3    -33.4045094  0.373775E-05  0.122E-02    2.95       1.6  T
   4    -33.4045135 -0.408695E-05  0.161E-03    2.95      12.1  T
   5    -33.4045135 -0.455006E-07  0.603E-04    2.95      32.5  T
   6    -33.4045136 -0.308603E-08  0.299E-04    2.95      65.6  T
     SCC iter.                  ...        0 min,  0.006 sec
     gradient                   ...        0 min,  0.011 sec
 * total energy  :   -32.7816921 Eh     change       -0.9305381E-04 Eh
   gradient norm :     0.0044612 Eh/α   predicted    -0.7105968E-04 ( -23.64%)
   displ. norm   :     0.1864458 α      lambda        0.2619952E-04
   maximum displ.:     0.1210542 α      in ANC's #7, #9, #3, ...

........................................................................
.............................. CYCLE    6 ..............................
........................................................................
   1    -33.4019871 -0.334020E+02  0.101E-01    2.92       0.0  T
   2    -33.4019878 -0.678537E-06  0.595E-02    2.92       1.0  T
   3    -33.4019848  0.298493E-05  0.109E-02    2.92       1.8  T
   4    -33.4019880 -0.325469E-05  0.212E-03    2.92       9.2  T
   5    -33.4019881 -0.851795E-07  0.677E-04    2.92      28.9  T
   6    -33.4019881 -0.506400E-08  0.334E-04    2.92      58.7  T
     SCC iter.                  ...        0 min,  0.006 sec
     gradient                   ...        0 min,  0.011 sec
 * total energy  :   -32.7816717 Eh     change        0.2037611E-04 Eh
   gradient norm :     0.0094850 Eh/α   predicted     0.1355435E-04 ( -33.48%)
   displ. norm   :     0.0612403 α      lambda       -0.1331284E-03
   maximum displ.:     0.0367526 α      in ANC's #9, #7, #6, ...

........................................................................
.............................. CYCLE    7 ..............................
........................................................................
   1    -33.4033902 -0.334034E+02  0.342E-02    2.94       0.0  T
   2    -33.4033906 -0.386511E-06  0.203E-02    2.94       1.0  T
   3    -33.4033901  0.527225E-06  0.508E-03    2.94       3.9  T
   4    -33.4033907 -0.597072E-06  0.119E-03    2.94      16.4  T
   5    -33.4033907 -0.266785E-07  0.387E-04    2.94      50.7  T
     SCC iter.                  ...        0 min,  0.005 sec
     gradient                   ...        0 min,  0.011 sec
 * total energy  :   -32.7817534 Eh     change       -0.8165331E-04 Eh
   gradient norm :     0.0047619 Eh/α   predicted    -0.6681964E-04 ( -18.17%)
   displ. norm   :     0.0668522 α      lambda       -0.7211566E-04
   maximum displ.:     0.0380916 α      in ANC's #3, #7, #8, ...

........................................................................
.............................. CYCLE    8 ..............................
........................................................................
   1    -33.4043817 -0.334044E+02  0.333E-02    2.94       0.0  T
   2    -33.4043820 -0.210811E-06  0.197E-02    2.94       1.0  T
   3    -33.4043814  0.507612E-06  0.480E-03    2.94       4.1  T
   4    -33.4043820 -0.578368E-06  0.854E-04    2.94      23.0  T
   5    -33.4043820 -0.119256E-07  0.401E-04    2.94      48.9  T
     SCC iter.                  ...        0 min,  0.006 sec
     gradient                   ...        0 min,  0.011 sec
 * total energy  :   -32.7818041 Eh     change       -0.5071387E-04 Eh
   gradient norm :     0.0015476 Eh/α   predicted    -0.3621944E-04 ( -28.58%)
   displ. norm   :     0.2839209 α      lambda       -0.8223052E-04
   maximum displ.:     0.1741059 α      in ANC's #7, #3, #8, ...

........................................................................
.............................. CYCLE    9 ..............................
........................................................................
   1    -33.4033042 -0.334033E+02  0.150E-01    2.93       0.0  T
   2    -33.4033049 -0.748194E-06  0.887E-02    2.93       1.0  T
   3    -33.4033005  0.439939E-05  0.142E-02    2.93       1.4  T
   4    -33.4033055 -0.498032E-05  0.195E-03    2.93      10.1  T
   5    -33.4033056 -0.617495E-07  0.953E-04    2.93      20.6  T
   6    -33.4033056 -0.628223E-08  0.379E-04    2.93      51.7  T
     SCC iter.                  ...        0 min,  0.006 sec
     gradient                   ...        0 min,  0.011 sec
 * total energy  :   -32.7818645 Eh     change       -0.6042705E-04 Eh
   gradient norm :     0.0034063 Eh/α   predicted    -0.4258929E-04 ( -29.52%)
   displ. norm   :     0.0623190 α      lambda       -0.2996676E-04
   maximum displ.:     0.0400046 α      in ANC's #3, #7, #6, ...

........................................................................
.............................. CYCLE   10 ..............................
........................................................................
   1    -33.4036834 -0.334037E+02  0.344E-02    2.92       0.0  T
   2    -33.4036835 -0.446938E-07  0.203E-02    2.92       1.0  T
   3    -33.4036834  0.634246E-07  0.182E-03    2.92      10.8  T
   4    -33.4036835 -0.821805E-07  0.454E-04    2.92      43.2  T
   5    -33.4036835 -0.271127E-08  0.231E-04    2.92      84.8  T
     SCC iter.                  ...        0 min,  0.005 sec
     gradient                   ...        0 min,  0.011 sec
 * total energy  :   -32.7818855 Eh     change       -0.2095718E-04 Eh
   gradient norm :     0.0019056 Eh/α   predicted    -0.1504206E-04 ( -28.22%)
   displ. norm   :     0.0985743 α      lambda       -0.1852729E-04
   maximum displ.:     0.0643633 α      in ANC's #3, #6, #1, ...

........................................................................
.............................. CYCLE   11 ..............................
........................................................................
   1    -33.4046792 -0.334047E+02  0.545E-02    2.92       0.0  T
   2    -33.4046793 -0.128827E-06  0.321E-02    2.92       1.0  T
   3    -33.4046791  0.201156E-06  0.300E-03    2.92       6.5  T
   4    -33.4046794 -0.258271E-06  0.663E-04    2.92      29.6  T
   5    -33.4046794 -0.538981E-08  0.380E-04    2.92      51.6  T
     SCC iter.                  ...        0 min,  0.005 sec
     gradient                   ...        0 min,  0.011 sec
 * total energy  :   -32.7818991 Eh     change       -0.1361852E-04 Eh
   gradient norm :     0.0010783 Eh/α   predicted    -0.9306932E-05 ( -31.66%)
   displ. norm   :     0.0446896 α      lambda       -0.4653682E-05
   maximum displ.:     0.0294067 α      in ANC's #3, #6, #1, ...

........................................................................
.............................. CYCLE   12 ..............................
........................................................................
   1    -33.4045455 -0.334045E+02  0.261E-02    2.92       0.0  T
   2    -33.4045455 -0.197365E-07  0.154E-02    2.92       1.3  T
   3    -33.4045455  0.444649E-07  0.135E-03    2.92      14.5  T
   4    -33.4045455 -0.564827E-07  0.261E-04    2.92      75.3  T
   5    -33.4045455 -0.385000E-09  0.167E-04    2.92     117.6  T
     SCC iter.                  ...        0 min,  0.005 sec
     gradient                   ...        0 min,  0.011 sec
 * total energy  :   -32.7819039 Eh     change       -0.4803192E-05 Eh
   gradient norm :     0.0006283 Eh/α   predicted    -0.2329541E-05 ( -51.50%)
   displ. norm   :     0.0463312 α      lambda       -0.4322232E-05
   maximum displ.:     0.0274648 α      in ANC's #3, #1, #6, ...

   *** GEOMETRY OPTIMIZATION CONVERGED AFTER 12 ITERATIONS ***

------------------------------------------------------------------------
 total energy gain   :        -0.0030543 Eh       -1.9166 kcal/mol
 total RMSD          :         0.2126926 a0        0.1126 Å
 total power (kW/mol):        -0.6682461 (step)  -26.1902 (real)
------------------------------------------------------------------------

 ANCopt (total)                0 d,  0 h,  0 min,  0.306 sec
 optimizer setup                ...        0 min,  0.000 sec (  0.053%)
 model hessian                  ...        0 min,  0.004 sec (  1.378%)
 ANC generation                 ...        0 min,  0.001 sec (  0.267%)
 coordinate transformation      ...        0 min,  0.000 sec (  0.076%)
 single point calculation       ...        0 min,  0.297 sec ( 96.880%)
 optimization log               ...        0 min,  0.001 sec (  0.426%)
 hessian update                 ...        0 min,  0.000 sec (  0.059%)
 rational function              ...        0 min,  0.002 sec (  0.603%)

================
 final structure:
================
$coord
    1.52807877377120    2.45671911364542    0.08964435293328      C 
    2.64802165016540    0.08956613122373   -0.03908718871851      C 
    5.46208784592433   -0.20728650337753   -0.18829982105513      C 
    1.09904315718516   -2.02269520013526   -0.01224859176549      C 
   -1.52360654805638   -1.83296241362277    0.14156846643455      C 
   -2.63034335606685    0.57713198404618    0.28124734652412      C 
   -1.07307093158705    2.68119531092517    0.24564682160208      C 
   -5.44284592896471    0.90120220951361    0.42183636698165      C 
   -3.08521001122533   -4.09503321458208    0.18735756557549      C 
   -2.49369339977648   -6.31009447015949   -0.88962706916799      C 
   -4.10388338091191   -8.50200897068934   -0.78336583433407      C 
   -3.57401069731556  -10.68409987503532   -1.91629748488025      C 
    2.69008549357240    4.13587925871482    0.07230296048479      H 
    6.39320315806206    1.62331194925242   -0.22270608342141      H 
    5.98735041992133   -1.24441289091252   -1.88721364301269      H 
    6.15715322945048   -1.26718827684788    1.43434265910202      H 
    1.95609808744962   -3.87494476676737   -0.06659452610563      H 
   -1.91061350942515    4.54259845979085    0.34003849775218      H 
   -6.17360454450315    0.15733775453057    2.19895283348472      H 
   -6.37267147210659   -0.09661168840758   -1.11930044646365      H 
   -5.94198332461915    2.89094321520970    0.30737963581890      H 
   -4.88034884860371   -3.93602515123506    1.15519343221491      H 
   -0.75653242714544   -6.51953230476324   -1.94584607843683      H 
   -5.83323738342597   -8.30383641227548    0.29452605930141      H 
   -1.86951961443628  -10.93396159148483   -3.00340748164178      H 
   -4.81620618847884  -12.29048146133782   -1.80103608168670      H 
$end
           -------------------------------------------------
          |                Final Singlepoint                |
           -------------------------------------------------

          ...................................................
          :                      SETUP                      :
          :.................................................:
          :  # basis functions                  62          :
          :  # atomic orbitals                  62          :
          :  # shells                           38          :
          :  # electrons                        62          :
          :  max. iterations                   250          :
          :  Hamiltonian                  GFN2-xTB          :
          :  restarted?                      false          :
          :  GBSA solvation                  false          :
          :  PC potential                    false          :
          :  electronic temp.          300.0000000     K    :
          :  accuracy                    1.0000000          :
          :  -> integral cutoff          0.2500000E+02      :
          :  -> integral neglect         0.1000000E-07      :
          :  -> SCF convergence          0.1000000E-05 Eh   :
          :  -> wf. convergence          0.1000000E-03 e    :
          :  Broyden damping             0.4000000          :
          ...................................................

 iter      E             dE          RMSdq      gap      omega  full diag
   1    -33.4045455 -0.334045E+02  0.727E-05    2.92       0.0  T
   2    -33.4045455 -0.321165E-11  0.397E-05    2.92     493.9  T
   3    -33.4045455 -0.297717E-10  0.331E-05    2.92     591.6  T

   *** convergence criteria satisfied after 3 iterations ***

         #    Occupation            Energy/Eh            Energy/eV
      -------------------------------------------------------------
         1        2.0000           -0.6404469             -17.4274
       ...           ...                  ...                  ...
        25        2.0000           -0.4418908             -12.0245
        26        2.0000           -0.4295461             -11.6885
        27        2.0000           -0.4159843             -11.3195
        28        2.0000           -0.4116665             -11.2020
        29        2.0000           -0.4050148             -11.0210
        30        2.0000           -0.3839259             -10.4472
        31        2.0000           -0.3655883              -9.9482 (HOMO)
        32                         -0.2584603              -7.0331 (LUMO)
        33                         -0.2113933              -5.7523
        34                         -0.1967929              -5.3550
        35                         -0.1350138              -3.6739
        36                         -0.0747658              -2.0345
       ...                                ...                  ...
        62                          0.6987685              19.0145
      -------------------------------------------------------------
                  HL-Gap            0.1071281 Eh            2.9151 eV
             Fermi-level           -0.3120243 Eh           -8.4906 eV

 SCC (total)                   0 d,  0 h,  0 min,  0.023 sec
 SCC setup                      ...        0 min,  0.000 sec (  0.822%)
 Dispersion                     ...        0 min,  0.000 sec (  0.983%)
 integral evaluation            ...        0 min,  0.007 sec ( 30.877%)
 zeroth order Hamiltonian       ...        0 min,  0.000 sec (  0.549%)
 iterations                     ...        0 min,  0.004 sec ( 16.128%)
 molecular gradient             ...        0 min,  0.011 sec ( 48.946%)
 printout                       ...        0 min,  0.000 sec (  1.497%)

         :::::::::::::::::::::::::::::::::::::::::::::::::::::
         ::                     SUMMARY                     ::
         :::::::::::::::::::::::::::::::::::::::::::::::::::::
         :: total energy             -32.781903881916 Eh    ::
         :: gradient norm              0.000628138479 Eh/a0 ::
         :: HOMO-LUMO gap              2.915102692026 eV    ::
         ::.................................................::
         :: SCC energy               -33.404545534618 Eh    ::
         :: -> isotropic ES            0.003979306256 Eh    ::
         :: -> anisotropic ES          0.006442330437 Eh    ::
         :: -> anisotropic XC          0.023083231971 Eh    ::
         :: -> dispersion             -0.021760407677 Eh    ::
         :: repulsion energy           0.622663065790 Eh    ::
         :: add. restraining           0.000000000000 Eh    ::
         :::::::::::::::::::::::::::::::::::::::::::::::::::::

           -------------------------------------------------
          |                Property Printout                |
           -------------------------------------------------

    * Orbital Energies and Occupations

         #    Occupation            Energy/Eh            Energy/eV
      -------------------------------------------------------------
         1        2.0000           -0.6404469             -17.4274
       ...           ...                  ...                  ...
        19        2.0000           -0.4693480             -12.7716
        20        2.0000           -0.4645574             -12.6412
        21        2.0000           -0.4567103             -12.4277
        22        2.0000           -0.4534584             -12.3392
        23        2.0000           -0.4510578             -12.2739
        24        2.0000           -0.4430023             -12.0547
        25        2.0000           -0.4418908             -12.0245
        26        2.0000           -0.4295461             -11.6885
        27        2.0000           -0.4159843             -11.3195
        28        2.0000           -0.4116665             -11.2020
        29        2.0000           -0.4050148             -11.0210
        30        2.0000           -0.3839259             -10.4472
        31        2.0000           -0.3655883              -9.9482 (HOMO)
        32                         -0.2584603              -7.0331 (LUMO)
        33                         -0.2113933              -5.7523
        34                         -0.1967929              -5.3550
        35                         -0.1350138              -3.6739
        36                         -0.0747658              -2.0345
        37                          0.0986049               2.6832
        38                          0.1020543               2.7770
        39                          0.1173804               3.1941
        40                          0.1306918               3.5563
        41                          0.1461999               3.9783
        42                          0.1603458               4.3632
       ...                                ...                  ...
        62                          0.6987685              19.0145
      -------------------------------------------------------------
                  HL-Gap            0.1071281 Eh            2.9151 eV
             Fermi-level           -0.3120243 Eh           -8.4906 eV

     #   Z        covCN         q      C6AA      α(0)
     1   6 C      2.923    -0.043    29.058     8.840
     2   6 C      2.964     0.012    27.745     8.640
     3   6 C      3.758    -0.108    22.612     6.780
     4   6 C      2.931    -0.047    29.170     8.857
     5   6 C      2.974     0.003    27.952     8.672
     6   6 C      2.970     0.007    27.854     8.657
     7   6 C      2.922    -0.042    29.046     8.838
     8   6 C      3.757    -0.105    22.563     6.772
     9   6 C      2.904    -0.038    28.952     8.823
    10   6 C      2.899    -0.037    28.924     8.818
    11   6 C      2.894    -0.026    28.653     8.776
    12   6 C      2.841    -0.089    30.213     9.008
    13   1 H      0.926     0.027     2.633     2.538
    14   1 H      0.925     0.039     2.460     2.453
    15   1 H      0.925     0.043     2.404     2.425
    16   1 H      0.925     0.044     2.399     2.422
    17   1 H      0.926     0.032     2.558     2.501
    18   1 H      0.925     0.027     2.633     2.537
    19   1 H      0.924     0.043     2.405     2.425
    20   1 H      0.925     0.044     2.401     2.423
    21   1 H      0.925     0.039     2.467     2.456
    22   1 H      0.925     0.038     2.476     2.461
    23   1 H      0.925     0.036     2.501     2.473
    24   1 H      0.925     0.031     2.572     2.508
    25   1 H      0.926     0.037     2.492     2.469
    26   1 H      0.926     0.033     2.539     2.492

 Mol. C6AA /au·bohr⁶  :       7254.807354
 Mol. C8AA /au·bohr⁸  :     173104.045624
 Mol. α(0) /au        :        136.063832


Wiberg/Mayer (AO) data.
largest (>0.10) Wiberg bond orders for each atom
          total WBO             WBO to atom ...
     1  C   3.982        C    7 1.432    C    2 1.406    H   13 0.969
     2  C   3.989        C    4 1.421    C    1 1.406    C    3 1.023
     3  C   3.996        C    2 1.023    H   14 0.986    H   15 0.974    H   16 0.973
     4  C   3.978        C    2 1.421    C    5 1.385    H   17 0.966    C    7 0.101
     5  C   3.989        C    4 1.385    C    6 1.334    C    9 1.101
     6  C   3.976        C    7 1.433    C    5 1.334    C    8 1.026
     7  C   3.991        C    6 1.433    C    1 1.432    H   18 0.968    C    4 0.101
     8  C   3.997        C    6 1.026    H   21 0.985    H   20 0.975    H   19 0.969
     9  C   3.991        C   10 1.759    C    5 1.101    H   22 0.958    C   12 0.131
    10  C   3.991        C    9 1.759    C   11 1.140    H   23 0.961
    11  C   3.991        C   12 1.863    C   10 1.140    H   24 0.964
    12  C   3.955        C   11 1.863    H   26 0.980    H   25 0.977    C    9 0.131
    13  H   0.999        C    1 0.969
    14  H   0.998        C    3 0.986
    15  H   0.998        C    3 0.974
    16  H   0.998        C    3 0.973
    17  H   0.999        C    4 0.966
    18  H   0.998        C    7 0.968
    19  H   0.997        C    8 0.969
    20  H   0.997        C    8 0.975
    21  H   0.998        C    8 0.985
    22  H   0.998        C    9 0.958
    23  H   0.999        C   10 0.961
    24  H   0.999        C   11 0.964
    25  H   0.999        C   12 0.977
    26  H   0.998        C   12 0.980

molecular dipole:
                 x           y           z       tot (Debye)
 q only:        0.020       0.088       0.032
   full:        0.010       0.072       0.032       0.201
molecular quadrupole (traceless):
                xx          xy          yy          xz          yz          zz
 q only:        3.563      -0.959      -1.747      -0.961       0.039      -1.816
  q+dip:        5.015      -0.664       1.431      -3.076       1.470      -6.446
   full:        4.070      -0.835      -0.745      -1.786       0.517      -3.325

           -------------------------------------------------
          |                Geometry Summary                 |
           -------------------------------------------------

      molecular mass/u    :      158.2426000
   center of mass at/Å    :       -0.5815722      -1.2007658      -0.1131756
  moments of inertia/u·Å² :        0.3446510E+03   0.9447727E+03   0.1272212E+04
rotational constants/cm⁻¹ :        0.4891218E-01   0.1784306E-01   0.1325065E-01

 * 22 selected distances

     #   Z        #   Z                                     value/Å
     1   6 C      2   6 C                                 1.3874395
     2   6 C      4   6 C                                 1.3861720
     4   6 C      5   6 C                                 1.3938523
     5   6 C      6   6 C                                 1.4053549 (max)
     1   6 C      7   6 C                                 1.3840496
     6   6 C      7   6 C                                 1.3853379
     9   6 C     10   6 C                                 1.3404264
    11   6 C     12   6 C                                 1.3309434
     1   6 C     13   1 H                                 1.0806286
     3   6 C     14   1 H                                 1.0869731
     3   6 C     15   1 H                                 1.0893651
     3   6 C     16   1 H                                 1.0895754
     4   6 C     17   1 H                                 1.0803935
     7   6 C     18   1 H                                 1.0812853
     8   6 C     19   1 H                                 1.0903473
     8   6 C     20   1 H                                 1.0890400
     8   6 C     21   1 H                                 1.0872381
     9   6 C     22   1 H                                 1.0824894
    10   6 C     23   1 H                                 1.0815419
    11   6 C     24   1 H                                 1.0834300
    12   6 C     25   1 H                                 1.0779548
    12   6 C     26   1 H                                 1.0762998 (min)

 * 2 distinct bonds (by element types)

   Z      Z             #   av. dist./Å        max./Å        min./Å
   1 H    6 C          14     1.0840402     1.0903473     1.0762998
   6 C    6 C           8     1.3766970     1.4053549     1.3309434


optimized geometry written to: xtbopt.xyz


           -------------------------------------------------
          | TOTAL ENERGY              -32.781903881916 Eh   |
          | GRADIENT NORM               0.000628138479 Eh/α |
          | HOMO-LUMO GAP               2.915102692026 eV   |
           -------------------------------------------------

------------------------------------------------------------------------
 * finished run on 2021/05/19 at 10:58:34.623     
------------------------------------------------------------------------
 total:
 * wall-time:     0 d,  0 h,  0 min,  0.384 sec
 *  cpu-time:     0 d,  0 h,  0 min,  0.383 sec
 * ratio c/w:     0.997 speedup
 SCF:
 * wall-time:     0 d,  0 h,  0 min,  0.033 sec
 *  cpu-time:     0 d,  0 h,  0 min,  0.033 sec
 * ratio c/w:     1.000 speedup
 ANC optimizer:
 * wall-time:     0 d,  0 h,  0 min,  0.330 sec
 *  cpu-time:     0 d,  0 h,  0 min,  0.330 sec
 * ratio c/w:     1.000 speedup

