      -----------------------------------------------------------      
     |                   =====================                   |     
     |                           x T B                           |     
     |                   =====================                   |     
     |                         S. Grimme                         |     
     |          Mulliken Center for Theoretical Chemistry        |     
     |                    University of Bonn                     |     
     |                Version 6.2 RC2 (SAW190805)                |     
      -----------------------------------------------------------      

   This program is distributed in the hope that it will be useful,
   but WITHOUT ANY WARRANTY; without even the implied warranty of
   MERCHANTABILITY or FITNESS FOR A PARTICULAR PURPOSE.
   
   FOR NON-COMMERCIAL, ACADEMIA USE ONLY.
   
   Cite this work as:
   * S. Grimme, C. Bannwarth, P. Shushkov, J. Chem. Theory Comput., 2017,
     13, 1989-2009. DOI: 10.1021/acs.jctc.7b00118
   * C. Bannwarth, S. Ehlert and S. Grimme., J. Chem. Theory Comput., 2019,
     15, 1652-1671. DOI: 10.1021/acs.jctc.8b01176
   * P. Pracht, E. Caldeweyher, S. Ehlert, S. Grimme, ChemRxiv, 2019, preprint.
     DOI: 10.26434/chemrxiv.8326202.v1
   
   for DFT-D4:
   * E. Caldeweyher, C. Bannwarth and S. Grimme, J. Chem. Phys., 2017,
     147, 034112. DOI: 10.1063/1.4993215
   * E. Caldeweyher, S. Ehlert, A. Hansen, H. Neugebauer, S. Spicher,
     C. Bannwarth and S. Grimme, J. Chem. Phys., 2019, 150, 154122.
     DOI: 10.1063/1.5090222
   
   for sTDA-xTB:
   * S. Grimme and C. Bannwarth, J. Chem. Phys., 2016, 145, 054103.
     DOI: 10.1063/1.4959605
   
   in the mass-spec context:
   * V. Asgeirsson, C. Bauer and S. Grimme, Chem. Sci., 2017, 8, 4879.
     DOI: 10.1039/c7sc00601b
   
   for metadynamics refer to:
   * S. Grimme, J. Chem. Theory Comput., 2019, 155, 2847-2862
     DOI: 10.1021/acs.jctc.9b00143
   
   with help from (in alphabetical order)
   C. Bannwarth, F. Bohle, G. Brandenburg, E. Caldeweyher, M. Checinski,
   S. Dohm, S. Ehlert, S. Ehrlich, F. März, H. Neugebauer, J. Pisarek,
   P. Pracht, P. Shushkov, and S. Spicher.
   
 * started run on 2021/05/19 at 11:01:00.353     

           -------------------------------------------------
          |                Calculation Setup                |
           -------------------------------------------------

          program call               : /ihome/ghutchison/geoffh/xtb/xtb 1040.xyz -opt
          hostname                   : smp-n144
          coordinate file            : 1040.xyz
          omp threads                :                     1
          number of atoms            :                    21
          number of electrons        :                    66
          charge                     :                     0
          spin                       :                   0.0
          first test random number   :      0.88320176446445


########################################################################
# WARNING! Please study the warnings concerning your input carefully
#  - the use of '-opt' is discouraged, please use '--opt' next time
########################################################################

           ------------------------------------------------- 
          |                 G F N 2 - x T B                 |
          | Geometry, Frequencies, Noncovalent interactions |
          |            JCTC 2019 parametrisation            |
           ------------------------------------------------- 
             KAB for C  - Si     :                1.0500
             KAB for H  - Pd     :                0.9500
             k(s)              :                1.8500
             k(p)              :                2.2300
             k(d)              :                2.2300
             k(f)              :                2.0000
             kEN (H0ij)        :               -2.0000
             D4 a1             :                0.5200
             D4 a2             :                5.0000
             D4 s6             :                1.0000
             D4 s8             :                2.7000
             D4 s9             :                5.0000
             alphaj            :                2.0000

  Z AO/shell   Hii/eV     exponent
  1     Wed Apr 25 08:07:45 CEST 2018   EN: 2.200 GM2: 0.406  GM3: 0.0800  RAES: 1.40
     1s    -10.707211    1.230000
  6     Wed Apr 25 08:07:45 CEST 2018   EN: 2.550 GM2: 0.538  GM3: 0.1500  RAES: 3.00
     2s    -13.970922    2.096432
     2p    -10.063292    1.800000
  8     Wed Apr 25 08:07:45 CEST 2018   EN: 3.440 GM2: 0.452  GM3:-0.0517  RAES: 1.80
     2s    -20.229985    2.439742
     2p    -15.503117    2.137023
 16     Tue Apr 24 11:44:34 CEST 2018   EN: 2.580 GM2: 0.340  GM3:-0.0502  RAES: 3.10
     3s    -20.029654    1.981333
     3p    -11.377694    2.025643
     3d     -0.420282    1.702555

           ------------------------------------------------- 
          |        Self-Consistent Charge Iterations        |
           ------------------------------------------------- 

          ...................................................
          :                      SETUP                      :
          :.................................................:
          :  # basis functions                  66          :
          :  # atomic orbitals                  65          :
          :  # shells                           35          :
          :  # electrons                        66          :
          :  max. iterations                   250          :
          :  Hamiltonian                  GFN2-xTB          :
          :  restarted?                      false          :
          :  GBSA solvation                  false          :
          :  PC potential                    false          :
          :  electronic temp.          300.0000000     K    :
          :  accuracy                    1.0000000          :
          :  -> integral cutoff          0.2500000E+02      :
          :  -> integral neglect         0.1000000E-07      :
          :  -> SCF convergence          0.1000000E-05 Eh   :
          :  -> wf. convergence          0.1000000E-03 e    :
          :  Broyden damping             0.4000000          :
          ...................................................

 iter      E             dE          RMSdq      gap      omega  full diag
   1    -37.2208326 -0.372208E+02  0.516E+00    2.83       0.0  T
   2    -37.2812397 -0.604071E-01  0.273E+00    2.42       1.0  T
   3    -37.2833883 -0.214859E-02  0.167E+00    2.68       1.0  T
   4    -37.2946993 -0.113110E-01  0.394E-01    2.52       1.0  T
   5    -37.2968493 -0.214996E-02  0.158E-01    2.56       1.0  T
   6    -37.2970825 -0.233142E-03  0.592E-02    2.57       1.0  T
   7    -37.2971035 -0.210170E-04  0.251E-02    2.56       1.0  T
   8    -37.2971102 -0.674253E-05  0.124E-02    2.56       1.8  T
   9    -37.2971110 -0.800254E-06  0.436E-03    2.56       5.0  T
  10    -37.2971111 -0.690450E-07  0.211E-03    2.56      10.3  T
  11    -37.2971111 -0.471736E-07  0.105E-03    2.56      20.8  T
  12    -37.2971111 -0.618495E-08  0.553E-04    2.56      39.5  T
  13    -37.2971111 -0.110549E-08  0.117E-04    2.56     187.0  T

   *** convergence criteria satisfied after 13 iterations ***

         #    Occupation            Energy/Eh            Energy/eV
      -------------------------------------------------------------
         1        2.0000           -0.7605648             -20.6960
       ...           ...                  ...                  ...
        27        2.0000           -0.4556925             -12.4000
        28        2.0000           -0.4538739             -12.3505
        29        2.0000           -0.4439361             -12.0801
        30        2.0000           -0.4270765             -11.6213
        31        2.0000           -0.4097974             -11.1512
        32        2.0000           -0.4049830             -11.0201
        33        2.0000           -0.3969432             -10.8014 (HOMO)
        34                         -0.3028657              -8.2414 (LUMO)
        35                         -0.2970333              -8.0827
        36                         -0.2354593              -6.4072
        37                         -0.2243442              -6.1047
        38                         -0.2057000              -5.5974
       ...                                ...                  ...
        65                          0.6747625              18.3612
      -------------------------------------------------------------
                  HL-Gap            0.0940775 Eh            2.5600 eV
             Fermi-level           -0.3499045 Eh           -9.5214 eV

 SCC (total)                   0 d,  0 h,  0 min,  0.036 sec
 SCC setup                      ...        0 min,  0.000 sec (  0.787%)
 Dispersion                     ...        0 min,  0.000 sec (  0.874%)
 integral evaluation            ...        0 min,  0.008 sec ( 22.707%)
 zeroth order Hamiltonian       ...        0 min,  0.000 sec (  0.456%)
 iterations                     ...        0 min,  0.014 sec ( 39.294%)
 molecular gradient             ...        0 min,  0.012 sec ( 34.722%)
 printout                       ...        0 min,  0.000 sec (  1.015%)

         :::::::::::::::::::::::::::::::::::::::::::::::::::::
         ::                     SUMMARY                     ::
         :::::::::::::::::::::::::::::::::::::::::::::::::::::
         :: total energy             -36.816106514261 Eh    ::
         :: gradient norm              0.063121635329 Eh/a0 ::
         :: HOMO-LUMO gap              2.559979722707 eV    ::
         ::.................................................::
         :: SCC energy               -37.297111133613 Eh    ::
         :: -> isotropic ES            0.057816649453 Eh    ::
         :: -> anisotropic ES          0.000926574140 Eh    ::
         :: -> anisotropic XC          0.013224453812 Eh    ::
         :: -> dispersion             -0.022212398871 Eh    ::
         :: repulsion energy           0.480879425622 Eh    ::
         :: add. restraining           0.000000000000 Eh    ::
         :::::::::::::::::::::::::::::::::::::::::::::::::::::

      ----------------------------------------------------------- 
     |                   =====================                   |
     |                        A N C O P T                        |
     |                   =====================                   |
     |               Approximate Normal Coordinate               |
     |                Rational Function Optimizer                |
      ----------------------------------------------------------- 

          ...................................................
          :                      SETUP                      :
          :.................................................:
          :   optimization level            normal          :
          :   max. optcycles                   200          :
          :   ANC micro-cycles                  20          :
          :   degrees of freedom                57          :
          :.................................................:
          :   RF solver                   davidson          :
          :   input Hessian                  false          :
          :   write xtbopt.log                true          :
          :   linear?                        false          :
          :   energy convergence         0.5000000E-05 Eh   :
          :   grad. convergence          0.1000000E-02 Eh/α :
          :   maximium RF displ.         2.0000000          :
          :   Hlow (freq-cutoff)         0.5000000E-02      :
          :   Hmax (freq-cutoff)         5.0000000          :
          :   S6 in model hess.         20.0000000          :
          ...................................................

generating ANC from model Hessian ...
Using Lindh-Hessian (1995)
 Shifting diagonal of input Hessian by   2.977294506484192E-003
 Lowest  eigenvalues of input Hessian
   -0.000000   -0.000000   -0.000000   -0.000000   -0.000000   -0.000000
    0.005000    0.006364    0.008870    0.009833    0.012462    0.018950
    0.021578    0.026948    0.029558    0.041018    0.045341    0.048833
 Highest eigenvalues
    1.621490    1.809203    1.894885    1.976503    2.093397    2.155761
 

........................................................................
.............................. CYCLE    1 ..............................
........................................................................
   1    -37.2971111 -0.372971E+02  0.531E-05    2.56       0.0  T
   2    -37.2971111 -0.994760E-11  0.313E-05    2.56     697.8  T
   3    -37.2971111 -0.324718E-11  0.214E-05    2.56    1018.9  T
     SCC iter.                  ...        0 min,  0.004 sec
     gradient                   ...        0 min,  0.012 sec
 * total energy  :   -36.8161065 Eh     change       -0.9512640E-08 Eh
   gradient norm :     0.0631204 Eh/α   predicted     0.0000000E+00 (-100.00%)
   displ. norm   :     0.2051635 α      lambda       -0.4557901E-02
   maximum displ.:     0.1137715 α      in ANC's #13, #15, #2, ...

........................................................................
.............................. CYCLE    2 ..............................
........................................................................
   1    -37.3143711 -0.373144E+02  0.166E-01    2.58       0.0  T
   2    -37.3144471 -0.759964E-04  0.944E-02    2.61       1.0  T
   3    -37.3144293  0.177404E-04  0.584E-02    2.60       1.0  T
   4    -37.3144721 -0.427388E-04  0.248E-02    2.61       1.0  T
   5    -37.3144776 -0.551379E-05  0.699E-03    2.61       3.1  T
   6    -37.3144779 -0.297248E-06  0.280E-03    2.61       7.8  T
   7    -37.3144779 -0.461792E-07  0.136E-03    2.61      16.1  T
     SCC iter.                  ...        0 min,  0.007 sec
     gradient                   ...        0 min,  0.012 sec
 * total energy  :   -36.8189429 Eh     change       -0.2836398E-02 Eh
   gradient norm :     0.0219857 Eh/α   predicted    -0.2374901E-02 ( -16.27%)
   displ. norm   :     0.1389633 α      lambda       -0.8414204E-03
   maximum displ.:     0.0799382 α      in ANC's #2, #4, #3, ...

........................................................................
.............................. CYCLE    3 ..............................
........................................................................
   1    -37.3203775 -0.373204E+02  0.132E-01    2.60       0.0  T
   2    -37.3204069 -0.294251E-04  0.703E-02    2.63       1.0  T
   3    -37.3203895  0.174657E-04  0.417E-02    2.62       1.0  T
   4    -37.3204169 -0.273783E-04  0.158E-02    2.62       1.4  T
   5    -37.3204190 -0.214538E-05  0.561E-03    2.62       3.9  T
   6    -37.3204191 -0.108220E-06  0.228E-03    2.62       9.6  T
     SCC iter.                  ...        0 min,  0.006 sec
     gradient                   ...        0 min,  0.012 sec
 * total energy  :   -36.8193964 Eh     change       -0.4534933E-03 Eh
   gradient norm :     0.0049620 Eh/α   predicted    -0.4288347E-03 (  -5.44%)
   displ. norm   :     0.0896200 α      lambda       -0.1944480E-03
   maximum displ.:     0.0519805 α      in ANC's #2, #4, #6, ...

........................................................................
.............................. CYCLE    4 ..............................
........................................................................
   1    -37.3198501 -0.373199E+02  0.887E-02    2.61       0.0  T
   2    -37.3198538 -0.370889E-05  0.520E-02    2.62       1.0  T
   3    -37.3198408  0.129201E-04  0.365E-02    2.62       1.0  T
   4    -37.3198599 -0.190378E-04  0.629E-03    2.62       3.5  T
   5    -37.3198600 -0.158573E-06  0.280E-03    2.62       7.8  T
   6    -37.3198601 -0.533560E-07  0.117E-03    2.62      18.6  T
     SCC iter.                  ...        0 min,  0.006 sec
     gradient                   ...        0 min,  0.012 sec
 * total energy  :   -36.8194875 Eh     change       -0.9106414E-04 Eh
   gradient norm :     0.0046799 Eh/α   predicted    -0.9800599E-04 (   7.62%)
   displ. norm   :     0.0828309 α      lambda       -0.8736642E-04
   maximum displ.:     0.0575153 α      in ANC's #2, #4, #6, ...

........................................................................
.............................. CYCLE    5 ..............................
........................................................................
   1    -37.3181557 -0.373182E+02  0.622E-02    2.61       0.0  T
   2    -37.3181564 -0.664030E-06  0.351E-02    2.61       1.0  T
   3    -37.3181546  0.171028E-05  0.116E-02    2.61       1.9  T
   4    -37.3181567 -0.202831E-05  0.373E-03    2.61       5.8  T
   5    -37.3181567 -0.471265E-07  0.139E-03    2.61      15.7  T
   6    -37.3181567 -0.225583E-07  0.433E-04    2.61      50.4  T
     SCC iter.                  ...        0 min,  0.006 sec
     gradient                   ...        0 min,  0.012 sec
 * total energy  :   -36.8195567 Eh     change       -0.6926022E-04 Eh
   gradient norm :     0.0032217 Eh/α   predicted    -0.4398392E-04 ( -36.49%)
   displ. norm   :     0.1770205 α      lambda       -0.1365317E-03
   maximum displ.:     0.1107656 α      in ANC's #2, #6, #4, ...

........................................................................
.............................. CYCLE    6 ..............................
........................................................................
   1    -37.3159358 -0.373159E+02  0.132E-01    2.60       0.0  T
   2    -37.3159384 -0.254558E-05  0.746E-02    2.60       1.0  T
   3    -37.3159355  0.290763E-05  0.180E-02    2.60       1.2  T
   4    -37.3159391 -0.357554E-05  0.766E-03    2.60       2.8  T
   5    -37.3159394 -0.346418E-06  0.199E-03    2.60      11.0  T
   6    -37.3159394 -0.410236E-07  0.742E-04    2.60      29.4  T
   7    -37.3159394 -0.140199E-08  0.475E-04    2.60      45.9  T
     SCC iter.                  ...        0 min,  0.007 sec
     gradient                   ...        0 min,  0.012 sec
 * total energy  :   -36.8196620 Eh     change       -0.1052793E-03 Eh
   gradient norm :     0.0040274 Eh/α   predicted    -0.7040858E-04 ( -33.12%)
   displ. norm   :     0.3069598 α      lambda       -0.1867039E-03
   maximum displ.:     0.1823474 α      in ANC's #2, #6, #1, ...

........................................................................
.............................. CYCLE    7 ..............................
........................................................................
   1    -37.3130046 -0.373130E+02  0.207E-01    2.58       0.0  T
   2    -37.3130087 -0.410612E-05  0.120E-01    2.57       1.0  T
   3    -37.3130032  0.552153E-05  0.237E-02    2.57       1.0  T
   4    -37.3130101 -0.692568E-05  0.954E-03    2.57       2.3  T
   5    -37.3130107 -0.578955E-06  0.262E-03    2.57       8.3  T
   6    -37.3130108 -0.549421E-07  0.110E-03    2.57      19.8  T
     SCC iter.                  ...        0 min,  0.006 sec
     gradient                   ...        0 min,  0.012 sec
 * total energy  :   -36.8197950 Eh     change       -0.1329948E-03 Eh
   gradient norm :     0.0086216 Eh/α   predicted    -0.1021492E-03 ( -23.19%)
   displ. norm   :     0.3217643 α      lambda       -0.2371428E-03
   maximum displ.:     0.2018375 α      in ANC's #6, #2, #1, ...

........................................................................
.............................. CYCLE    8 ..............................
........................................................................
   1    -37.3112596 -0.373113E+02  0.201E-01    2.56       0.0  T
   2    -37.3112628 -0.316586E-05  0.118E-01    2.56       1.0  T
   3    -37.3112633 -0.466642E-06  0.110E-02    2.56       2.0  T
   4    -37.3112636 -0.388867E-06  0.670E-03    2.56       3.3  T
   5    -37.3112640 -0.407118E-06  0.279E-03    2.56       7.8  T
   6    -37.3112641 -0.852954E-07  0.108E-03    2.56      20.2  T
     SCC iter.                  ...        0 min,  0.006 sec
     gradient                   ...        0 min,  0.012 sec
 * total energy  :   -36.8199923 Eh     change       -0.1972415E-03 Eh
   gradient norm :     0.0123073 Eh/α   predicted    -0.1308482E-03 ( -33.66%)
   displ. norm   :     0.5268162 α      lambda       -0.6670004E-03
   maximum displ.:     0.3690878 α      in ANC's #6, #2, #5, ...

........................................................................
.............................. CYCLE    9 ..............................
........................................................................
   1    -37.3108376 -0.373108E+02  0.304E-01    2.55       0.0  T
   2    -37.3108460 -0.835978E-05  0.180E-01    2.55       1.0  T
   3    -37.3108307  0.152992E-04  0.351E-02    2.55       1.0  T
   4    -37.3108501 -0.194019E-04  0.955E-03    2.55       2.3  T
   5    -37.3108506 -0.545420E-06  0.429E-03    2.55       5.1  T
   6    -37.3108507 -0.475108E-07  0.174E-03    2.55      12.6  T
   7    -37.3108507 -0.520803E-08  0.103E-03    2.55      21.1  T
     SCC iter.                  ...        0 min,  0.007 sec
     gradient                   ...        0 min,  0.012 sec
 * total energy  :   -36.8204962 Eh     change       -0.5039688E-03 Eh
   gradient norm :     0.0183815 Eh/α   predicted    -0.4260700E-03 ( -15.46%)
   displ. norm   :     0.3550832 α      lambda       -0.9551015E-03
   maximum displ.:     0.2539000 α      in ANC's #6, #5, #1, ...

........................................................................
.............................. CYCLE   10 ..............................
........................................................................
   1    -37.3193562 -0.373194E+02  0.202E-01    2.57       0.0  T
   2    -37.3193650 -0.886409E-05  0.119E-01    2.57       1.0  T
   3    -37.3193264  0.386877E-04  0.547E-02    2.57       1.0  T
   4    -37.3193711 -0.447559E-04  0.905E-03    2.57       2.4  T
   5    -37.3193714 -0.332171E-06  0.393E-03    2.57       5.6  T
   6    -37.3193715 -0.337084E-07  0.186E-03    2.57      11.8  T
   7    -37.3193715 -0.346077E-07  0.951E-04    2.57      22.9  T
     SCC iter.                  ...        0 min,  0.007 sec
     gradient                   ...        0 min,  0.012 sec
 * total energy  :   -36.8211266 Eh     change       -0.6303806E-03 Eh
   gradient norm :     0.0182706 Eh/α   predicted    -0.5377629E-03 ( -14.69%)
   displ. norm   :     0.6195954 α      lambda       -0.1322220E-02
   maximum displ.:     0.3897536 α      in ANC's #6, #2, #5, ...

........................................................................
.............................. CYCLE   11 ..............................
........................................................................
   1    -37.3138715 -0.373139E+02  0.338E-01    2.58       0.0  T
   2    -37.3138921 -0.206163E-04  0.201E-01    2.59       1.0  T
   3    -37.3138521  0.400277E-04  0.508E-02    2.59       1.0  T
   4    -37.3138986 -0.465149E-04  0.140E-02    2.59       1.6  T
   5    -37.3139008 -0.220765E-05  0.616E-03    2.59       3.5  T
   6    -37.3139010 -0.157914E-06  0.290E-03    2.59       7.5  T
   7    -37.3139010 -0.209311E-07  0.127E-03    2.59      17.1  T
     SCC iter.                  ...        0 min,  0.007 sec
     gradient                   ...        0 min,  0.012 sec
 * total energy  :   -36.8220012 Eh     change       -0.8745875E-03 Eh
   gradient norm :     0.0214498 Eh/α   predicted    -0.9149104E-03 (   4.61%)
   displ. norm   :     0.2968420 α      lambda       -0.2695239E-02
   maximum displ.:     0.1007575 α      in ANC's #15, #2, #33, ...

........................................................................
.............................. CYCLE   12 ..............................
........................................................................
   1    -37.3320518 -0.373321E+02  0.255E-01    2.62       0.0  T
   2    -37.3321966 -0.144815E-03  0.134E-01    2.64       1.0  T
   3    -37.3321647  0.319625E-04  0.751E-02    2.64       1.0  T
   4    -37.3322171 -0.524867E-04  0.341E-02    2.65       1.0  T
   5    -37.3322296 -0.124522E-04  0.112E-02    2.64       2.0  T
   6    -37.3322300 -0.395164E-06  0.323E-03    2.64       6.8  T
   7    -37.3322301 -0.564198E-07  0.120E-03    2.64      18.2  T
     SCC iter.                  ...        0 min,  0.007 sec
     gradient                   ...        0 min,  0.012 sec
 * total energy  :   -36.8210273 Eh     change        0.9738421E-03 Eh
   gradient norm :     0.0416419 Eh/α   predicted    -0.1466367E-02 (-250.58%)
   displ. norm   :     0.3375775 α      lambda       -0.4408528E-02
   maximum displ.:     0.2661216 α      in ANC's #6, #1, #4, ...

........................................................................
.............................. CYCLE   13 ..............................
........................................................................
   1    -37.3189914 -0.373190E+02  0.215E-01    2.61       0.0  T
   2    -37.3190406 -0.491704E-04  0.120E-01    2.62       1.0  T
   3    -37.3190030  0.375071E-04  0.666E-02    2.61       1.0  T
   4    -37.3190501 -0.470639E-04  0.207E-02    2.61       1.1  T
   5    -37.3190548 -0.465072E-05  0.634E-03    2.61       3.4  T
   6    -37.3190549 -0.119894E-06  0.218E-03    2.61      10.0  T
   7    -37.3190549 -0.291346E-07  0.110E-03    2.61      19.8  T
     SCC iter.                  ...        0 min,  0.007 sec
     gradient                   ...        0 min,  0.012 sec
 * total energy  :   -36.8233121 Eh     change       -0.2284742E-02 Eh
   gradient norm :     0.0193802 Eh/α   predicted    -0.2455464E-02 (   7.47%)
   displ. norm   :     0.4133397 α      lambda       -0.1213194E-02
   maximum displ.:     0.2482634 α      in ANC's #6, #5, #1, ...

........................................................................
.............................. CYCLE   14 ..............................
........................................................................
   1    -37.3144926 -0.373145E+02  0.226E-01    2.64       0.0  T
   2    -37.3145035 -0.109262E-04  0.133E-01    2.64       1.0  T
   3    -37.3144657  0.378327E-04  0.493E-02    2.64       1.0  T
   4    -37.3145096 -0.439075E-04  0.122E-02    2.64       1.8  T
   5    -37.3145104 -0.774849E-06  0.479E-03    2.64       4.6  T
   6    -37.3145105 -0.959085E-07  0.188E-03    2.64      11.6  T
   7    -37.3145105 -0.248798E-07  0.104E-03    2.64      20.9  T
     SCC iter.                  ...        0 min,  0.007 sec
     gradient                   ...        0 min,  0.012 sec
 * total energy  :   -36.8236911 Eh     change       -0.3790285E-03 Eh
   gradient norm :     0.0243692 Eh/α   predicted    -0.7102347E-03 (  87.38%)
   displ. norm   :     0.1988330 α      lambda       -0.9600184E-03
   maximum displ.:     0.1041481 α      in ANC's #6, #1, #4, ...

........................................................................
.............................. CYCLE   15 ..............................
........................................................................
   1    -37.3168842 -0.373169E+02  0.114E-01    2.63       0.0  T
   2    -37.3168934 -0.918812E-05  0.679E-02    2.63       1.0  T
   3    -37.3168854  0.799617E-05  0.243E-02    2.63       1.0  T
   4    -37.3168936 -0.819219E-05  0.930E-03    2.63       2.3  T
   5    -37.3168951 -0.144905E-05  0.228E-03    2.63       9.6  T
   6    -37.3168951 -0.208278E-07  0.960E-04    2.63      22.7  T
     SCC iter.                  ...        0 min,  0.006 sec
     gradient                   ...        0 min,  0.012 sec
 * total energy  :   -36.8243747 Eh     change       -0.6835880E-03 Eh
   gradient norm :     0.0138932 Eh/α   predicted    -0.4989863E-03 ( -27.00%)
   displ. norm   :     0.2114361 α      lambda       -0.1232097E-02
   maximum displ.:     0.0994930 α      in ANC's #1, #4, #3, ...

........................................................................
.............................. CYCLE   16 ..............................
........................................................................
   1    -37.3314912 -0.373315E+02  0.115E-01    2.64       0.0  T
   2    -37.3315028 -0.115995E-04  0.651E-02    2.64       1.0  T
   3    -37.3314944  0.836372E-05  0.281E-02    2.64       1.0  T
   4    -37.3315048 -0.103848E-04  0.984E-03    2.64       2.2  T
   5    -37.3315057 -0.899595E-06  0.351E-03    2.64       6.2  T
   6    -37.3315058 -0.377876E-07  0.149E-03    2.64      14.7  T
   7    -37.3315058 -0.236041E-07  0.644E-04    2.64      33.9  T
     SCC iter.                  ...        0 min,  0.007 sec
     gradient                   ...        0 min,  0.012 sec
 * total energy  :   -36.8245988 Eh     change       -0.2240564E-03 Eh
   gradient norm :     0.0192055 Eh/α   predicted    -0.6435894E-03 ( 187.24%)
   displ. norm   :     0.5655034 α      lambda       -0.1464214E-02
   maximum displ.:     0.3402444 α      in ANC's #6, #1, #2, ...

........................................................................
.............................. CYCLE   17 ..............................
........................................................................
   1    -37.3204228 -0.373204E+02  0.291E-01    2.63       0.0  T
   2    -37.3204466 -0.238771E-04  0.171E-01    2.64       1.0  T
   3    -37.3204296  0.170296E-04  0.385E-02    2.63       1.0  T
   4    -37.3204490 -0.193683E-04  0.164E-02    2.64       1.3  T
   5    -37.3204525 -0.350781E-05  0.612E-03    2.64       3.6  T
   6    -37.3204527 -0.237043E-06  0.283E-03    2.64       7.7  T
   7    -37.3204527 -0.264225E-07  0.109E-03    2.64      20.1  T
     SCC iter.                  ...        0 min,  0.007 sec
     gradient                   ...        0 min,  0.012 sec
 * total energy  :   -36.8254165 Eh     change       -0.8176909E-03 Eh
   gradient norm :     0.0161195 Eh/α   predicted    -0.9662315E-03 (  18.17%)
   displ. norm   :     0.2020549 α      lambda       -0.4484385E-03
   maximum displ.:     0.1083733 α      in ANC's #1, #5, #6, ...

........................................................................
.............................. CYCLE   18 ..............................
........................................................................
   1    -37.3204216 -0.373204E+02  0.104E-01    2.65       0.0  T
   2    -37.3204265 -0.486084E-05  0.593E-02    2.65       1.0  T
   3    -37.3204212  0.523927E-05  0.219E-02    2.65       1.0  T
   4    -37.3204272 -0.594016E-05  0.759E-03    2.65       2.9  T
   5    -37.3204277 -0.557971E-06  0.256E-03    2.65       8.5  T
   6    -37.3204278 -0.198764E-07  0.807E-04    2.65      27.1  T
     SCC iter.                  ...        0 min,  0.006 sec
     gradient                   ...        0 min,  0.012 sec
 * total energy  :   -36.8256380 Eh     change       -0.2215214E-03 Eh
   gradient norm :     0.0125168 Eh/α   predicted    -0.2333777E-03 (   5.35%)
   displ. norm   :     0.2266459 α      lambda       -0.5991777E-03
   maximum displ.:     0.1097309 α      in ANC's #4, #1, #15, ...

........................................................................
.............................. CYCLE   19 ..............................
........................................................................
   1    -37.3245352 -0.373245E+02  0.132E-01    2.67       0.0  T
   2    -37.3245423 -0.706457E-05  0.736E-02    2.67       1.0  T
   3    -37.3245353  0.703680E-05  0.256E-02    2.67       1.0  T
   4    -37.3245438 -0.857609E-05  0.899E-03    2.67       2.4  T
   5    -37.3245443 -0.455300E-06  0.365E-03    2.67       6.0  T
   6    -37.3245444 -0.864773E-07  0.104E-03    2.67      21.0  T
   7    -37.3245444 -0.104666E-07  0.489E-04    2.67      44.6  T
     SCC iter.                  ...        0 min,  0.007 sec
     gradient                   ...        0 min,  0.012 sec
 * total energy  :   -36.8257120 Eh     change       -0.7406355E-04 Eh
   gradient norm :     0.0163000 Eh/α   predicted    -0.3149943E-03 ( 325.30%)
   displ. norm   :     0.2354345 α      lambda       -0.7679788E-03
   maximum displ.:     0.1691148 α      in ANC's #1, #6, #2, ...

........................................................................
.............................. CYCLE   20 ..............................
........................................................................
   1    -37.3244296 -0.373244E+02  0.147E-01    2.65       0.0  T
   2    -37.3244475 -0.179225E-04  0.865E-02    2.65       1.0  T
   3    -37.3244437  0.381925E-05  0.234E-02    2.65       1.0  T
   4    -37.3244481 -0.445518E-05  0.109E-02    2.65       2.0  T
   5    -37.3244497 -0.158697E-05  0.461E-03    2.65       4.7  T
   6    -37.3244499 -0.163972E-06  0.214E-03    2.65      10.2  T
   7    -37.3244499 -0.220578E-07  0.767E-04    2.65      28.5  T
     SCC iter.                  ...        0 min,  0.007 sec
     gradient                   ...        0 min,  0.012 sec
 * total energy  :   -36.8260072 Eh     change       -0.2951433E-03 Eh
   gradient norm :     0.0133306 Eh/α   predicted    -0.4052742E-03 (  37.31%)
   displ. norm   :     0.1955921 α      lambda       -0.4273702E-03
   maximum displ.:     0.1397449 α      in ANC's #1, #6, #7, ...
 * RMSD in coord.:     1.0224121 α      energy gain  -0.9900669E-02 Eh

generating ANC from model Hessian ...
Using Lindh-Hessian (1995)
 Shifting diagonal of input Hessian by   3.234869892858366E-003
 Lowest  eigenvalues of input Hessian
   -0.000000   -0.000000    0.000000    0.000000    0.000000    0.000000
    0.005000    0.006684    0.008516    0.010126    0.012882    0.020039
    0.021541    0.025222    0.033213    0.038469    0.043035    0.046285
 Highest eigenvalues
    1.629993    1.836611    1.914105    2.021218    2.196710    2.237091
 

........................................................................
.............................. CYCLE   21 ..............................
........................................................................
   1    -37.3258667 -0.373259E+02  0.101E-01    2.67       0.0  T
   2    -37.3258759 -0.922872E-05  0.580E-02    2.67       1.0  T
   3    -37.3258685  0.739513E-05  0.292E-02    2.67       1.0  T
   4    -37.3258777 -0.921882E-05  0.746E-03    2.67       2.9  T
   5    -37.3258781 -0.432020E-06  0.357E-03    2.67       6.1  T
   6    -37.3258782 -0.899226E-07  0.142E-03    2.67      15.4  T
   7    -37.3258782 -0.357265E-08  0.603E-04    2.67      36.2  T
   8    -37.3258782 -0.236288E-08  0.347E-04    2.67      62.8  T
     SCC iter.                  ...        0 min,  0.008 sec
     gradient                   ...        0 min,  0.013 sec
 * total energy  :   -36.8260690 Eh     change       -0.6177531E-04 Eh
   gradient norm :     0.0112101 Eh/α   predicted     0.0000000E+00 (-100.00%)
   displ. norm   :     0.1462814 α      lambda       -0.4347031E-03
   maximum displ.:     0.1284059 α      in ANC's #1, #2, #6, ...

........................................................................
.............................. CYCLE   22 ..............................
........................................................................
   1    -37.3245052 -0.373245E+02  0.114E-01    2.66       0.0  T
   2    -37.3245074 -0.220548E-05  0.663E-02    2.66       1.0  T
   3    -37.3244866  0.208768E-04  0.436E-02    2.66       1.0  T
   4    -37.3245118 -0.252750E-04  0.519E-03    2.66       4.2  T
   5    -37.3245118 -0.172281E-07  0.229E-03    2.66       9.5  T
   6    -37.3245119 -0.313401E-07  0.109E-03    2.66      20.0  T
     SCC iter.                  ...        0 min,  0.006 sec
     gradient                   ...        0 min,  0.012 sec
 * total energy  :   -36.8263240 Eh     change       -0.2550732E-03 Eh
   gradient norm :     0.0029704 Eh/α   predicted    -0.2220167E-03 ( -12.96%)
   displ. norm   :     0.0806176 α      lambda       -0.8696655E-04
   maximum displ.:     0.0605109 α      in ANC's #1, #2, #3, ...

........................................................................
.............................. CYCLE   23 ..............................
........................................................................
   1    -37.3242078 -0.373242E+02  0.503E-02    2.66       0.0  T
   2    -37.3242085 -0.726127E-06  0.284E-02    2.66       1.0  T
   3    -37.3242076  0.944909E-06  0.102E-02    2.66       2.1  T
   4    -37.3242088 -0.120694E-05  0.357E-03    2.66       6.1  T
   5    -37.3242089 -0.640315E-07  0.127E-03    2.66      17.2  T
   6    -37.3242089 -0.117660E-07  0.496E-04    2.66      44.0  T
   7    -37.3242089 -0.116607E-08  0.241E-04    2.66      90.6  T
     SCC iter.                  ...        0 min,  0.007 sec
     gradient                   ...        0 min,  0.013 sec
 * total energy  :   -36.8263861 Eh     change       -0.6209417E-04 Eh
   gradient norm :     0.0018543 Eh/α   predicted    -0.4377085E-04 ( -29.51%)
   displ. norm   :     0.1518805 α      lambda       -0.6504667E-04
   maximum displ.:     0.1202880 α      in ANC's #1, #3, #2, ...

........................................................................
.............................. CYCLE   24 ..............................
........................................................................
   1    -37.3240734 -0.373241E+02  0.897E-02    2.66       0.0  T
   2    -37.3240749 -0.150962E-05  0.531E-02    2.66       1.0  T
   3    -37.3240705  0.442885E-05  0.196E-02    2.66       1.1  T
   4    -37.3240759 -0.545085E-05  0.461E-03    2.66       4.7  T
   5    -37.3240760 -0.997542E-07  0.205E-03    2.66      10.7  T
   6    -37.3240760 -0.202422E-07  0.935E-04    2.66      23.3  T
   7    -37.3240760 -0.256090E-08  0.433E-04    2.66      50.4  T
     SCC iter.                  ...        0 min,  0.007 sec
     gradient                   ...        0 min,  0.013 sec
 * total energy  :   -36.8264551 Eh     change       -0.6900365E-04 Eh
   gradient norm :     0.0035922 Eh/α   predicted    -0.3285903E-04 ( -52.38%)
   displ. norm   :     0.0966636 α      lambda       -0.6027335E-04
   maximum displ.:     0.0811481 α      in ANC's #1, #3, #2, ...

........................................................................
.............................. CYCLE   25 ..............................
........................................................................
   1    -37.3241690 -0.373242E+02  0.584E-02    2.66       0.0  T
   2    -37.3241696 -0.641605E-06  0.352E-02    2.66       1.0  T
   3    -37.3241697 -0.223005E-07  0.570E-03    2.66       3.8  T
   4    -37.3241700 -0.325482E-06  0.261E-03    2.66       8.4  T
   5    -37.3241700 -0.198336E-07  0.146E-03    2.66      15.0  T
   6    -37.3241700 -0.188772E-07  0.518E-04    2.66      42.2  T
   7    -37.3241700 -0.637208E-09  0.224E-04    2.66      97.3  T
     SCC iter.                  ...        0 min,  0.007 sec
     gradient                   ...        0 min,  0.013 sec
 * total energy  :   -36.8265064 Eh     change       -0.5131525E-04 Eh
   gradient norm :     0.0029553 Eh/α   predicted    -0.3041881E-04 ( -40.72%)
   displ. norm   :     0.1153023 α      lambda       -0.6987945E-04
   maximum displ.:     0.0967815 α      in ANC's #1, #3, #6, ...

........................................................................
.............................. CYCLE   26 ..............................
........................................................................
   1    -37.3243214 -0.373243E+02  0.762E-02    2.66       0.0  T
   2    -37.3243225 -0.114181E-05  0.459E-02    2.66       1.0  T
   3    -37.3243215  0.106729E-05  0.114E-02    2.66       1.9  T
   4    -37.3243232 -0.172666E-05  0.398E-03    2.66       5.5  T
   5    -37.3243233 -0.836240E-07  0.191E-03    2.66      11.4  T
   6    -37.3243233 -0.214321E-07  0.671E-04    2.66      32.5  T
   7    -37.3243233 -0.786869E-09  0.316E-04    2.66      69.0  T
     SCC iter.                  ...        0 min,  0.007 sec
     gradient                   ...        0 min,  0.013 sec
 * total energy  :   -36.8265655 Eh     change       -0.5902202E-04 Eh
   gradient norm :     0.0019935 Eh/α   predicted    -0.3540906E-04 ( -40.01%)
   displ. norm   :     0.2039685 α      lambda       -0.6587827E-04
   maximum displ.:     0.1712208 α      in ANC's #1, #3, #6, ...

........................................................................
.............................. CYCLE   27 ..............................
........................................................................
   1    -37.3238920 -0.373239E+02  0.132E-01    2.65       0.0  T
   2    -37.3238954 -0.344986E-05  0.794E-02    2.65       1.0  T
   3    -37.3238917  0.369687E-05  0.201E-02    2.65       1.1  T
   4    -37.3238973 -0.555926E-05  0.628E-03    2.65       3.5  T
   5    -37.3238976 -0.280683E-06  0.318E-03    2.65       6.9  T
   6    -37.3238976 -0.349774E-07  0.109E-03    2.65      19.9  T
   7    -37.3238976 -0.438803E-08  0.398E-04    2.65      54.9  T
   8    -37.3238976 -0.625931E-09  0.191E-04    2.65     114.2  T
     SCC iter.                  ...        0 min,  0.008 sec
     gradient                   ...        0 min,  0.013 sec
 * total energy  :   -36.8266419 Eh     change       -0.7638624E-04 Eh
   gradient norm :     0.0031864 Eh/α   predicted    -0.3354897E-04 ( -56.08%)
   displ. norm   :     0.1135968 α      lambda       -0.4979729E-04
   maximum displ.:     0.0945313 α      in ANC's #1, #3, #4, ...

........................................................................
.............................. CYCLE   28 ..............................
........................................................................
   1    -37.3237974 -0.373238E+02  0.695E-02    2.66       0.0  T
   2    -37.3237981 -0.653564E-06  0.412E-02    2.65       1.0  T
   3    -37.3237972  0.853246E-06  0.962E-03    2.66       2.3  T
   4    -37.3237985 -0.123829E-05  0.330E-03    2.66       6.6  T
   5    -37.3237985 -0.471100E-07  0.161E-03    2.66      13.6  T
   6    -37.3237986 -0.212782E-07  0.531E-04    2.66      41.1  T
   7    -37.3237986  0.891518E-10  0.297E-04    2.66      73.6  T
     SCC iter.                  ...        0 min,  0.007 sec
     gradient                   ...        0 min,  0.013 sec
 * total energy  :   -36.8266851 Eh     change       -0.4323235E-04 Eh
   gradient norm :     0.0025115 Eh/α   predicted    -0.2522248E-04 ( -41.66%)
   displ. norm   :     0.1507206 α      lambda       -0.6492513E-04
   maximum displ.:     0.1242360 α      in ANC's #1, #3, #4, ...

........................................................................
.............................. CYCLE   29 ..............................
........................................................................
   1    -37.3237189 -0.373237E+02  0.909E-02    2.66       0.0  T
   2    -37.3237199 -0.968626E-06  0.537E-02    2.66       1.0  T
   3    -37.3237188  0.108804E-05  0.110E-02    2.66       2.0  T
   4    -37.3237204 -0.161514E-05  0.401E-03    2.66       5.4  T
   5    -37.3237205 -0.737761E-07  0.187E-03    2.66      11.6  T
   6    -37.3237205 -0.280728E-07  0.662E-04    2.66      33.0  T
   7    -37.3237205 -0.426070E-09  0.391E-04    2.66      55.8  T
     SCC iter.                  ...        0 min,  0.007 sec
     gradient                   ...        0 min,  0.013 sec
 * total energy  :   -36.8267426 Eh     change       -0.5752093E-04 Eh
   gradient norm :     0.0020966 Eh/α   predicted    -0.3320692E-04 ( -42.27%)
   displ. norm   :     0.2114282 α      lambda       -0.8177590E-04
   maximum displ.:     0.1723225 α      in ANC's #1, #3, #4, ...

........................................................................
.............................. CYCLE   30 ..............................
........................................................................
   1    -37.3231355 -0.373231E+02  0.125E-01    2.66       0.0  T
   2    -37.3231371 -0.159591E-05  0.734E-02    2.66       1.0  T
   3    -37.3231357  0.135513E-05  0.134E-02    2.66       1.6  T
   4    -37.3231379 -0.211097E-05  0.554E-03    2.66       3.9  T
   5    -37.3231380 -0.156080E-06  0.204E-03    2.66      10.7  T
   6    -37.3231380 -0.367860E-07  0.827E-04    2.66      26.4  T
   7    -37.3231380 -0.282952E-09  0.487E-04    2.66      44.8  T
     SCC iter.                  ...        0 min,  0.007 sec
     gradient                   ...        0 min,  0.012 sec
 * total energy  :   -36.8268113 Eh     change       -0.6868171E-04 Eh
   gradient norm :     0.0025264 Eh/α   predicted    -0.4271676E-04 ( -37.80%)
   displ. norm   :     0.2454469 α      lambda       -0.8497891E-04
   maximum displ.:     0.2041608 α      in ANC's #1, #3, #4, ...

........................................................................
.............................. CYCLE   31 ..............................
........................................................................
   1    -37.3226735 -0.373227E+02  0.142E-01    2.67       0.0  T
   2    -37.3226753 -0.183509E-05  0.829E-02    2.67       1.0  T
   3    -37.3226746  0.716664E-06  0.123E-02    2.67       1.8  T
   4    -37.3226759 -0.134731E-05  0.643E-03    2.67       3.4  T
   5    -37.3226762 -0.281838E-06  0.187E-03    2.67      11.7  T
   6    -37.3226763 -0.346250E-07  0.837E-04    2.67      26.1  T
   7    -37.3226763 -0.641840E-09  0.486E-04    2.67      44.9  T
     SCC iter.                  ...        0 min,  0.007 sec
     gradient                   ...        0 min,  0.012 sec
 * total energy  :   -36.8268767 Eh     change       -0.6544010E-04 Eh
   gradient norm :     0.0033098 Eh/α   predicted    -0.4505182E-04 ( -31.16%)
   displ. norm   :     0.2547763 α      lambda       -0.8011602E-04
   maximum displ.:     0.2193170 α      in ANC's #1, #2, #4, ...

........................................................................
.............................. CYCLE   32 ..............................
........................................................................
   1    -37.3226658 -0.373227E+02  0.146E-01    2.68       0.0  T
   2    -37.3226677 -0.183767E-05  0.850E-02    2.68       1.0  T
   3    -37.3226675  0.124926E-06  0.110E-02    2.68       2.0  T
   4    -37.3226681 -0.511139E-06  0.691E-03    2.68       3.2  T
   5    -37.3226685 -0.442984E-06  0.140E-03    2.68      15.6  T
   6    -37.3226685 -0.143328E-07  0.742E-04    2.68      29.4  T
   7    -37.3226685 -0.685120E-09  0.384E-04    2.68      56.8  T
     SCC iter.                  ...        0 min,  0.007 sec
     gradient                   ...        0 min,  0.012 sec
 * total energy  :   -36.8269342 Eh     change       -0.5743869E-04 Eh
   gradient norm :     0.0031191 Eh/α   predicted    -0.4266156E-04 ( -25.73%)
   displ. norm   :     0.1848652 α      lambda       -0.5708809E-04
   maximum displ.:     0.1606165 α      in ANC's #1, #2, #6, ...

........................................................................
.............................. CYCLE   33 ..............................
........................................................................
   1    -37.3238193 -0.373238E+02  0.104E-01    2.69       0.0  T
   2    -37.3238203 -0.100371E-05  0.597E-02    2.69       1.0  T
   3    -37.3238204 -0.152218E-06  0.637E-03    2.69       3.4  T
   4    -37.3238204  0.289174E-07  0.372E-03    2.69       5.9  T
   5    -37.3238206 -0.171041E-06  0.115E-03    2.69      19.0  T
   6    -37.3238206 -0.188364E-07  0.404E-04    2.69      54.0  T
   7    -37.3238206 -0.747306E-09  0.219E-04    2.69      99.5  T
     SCC iter.                  ...        0 min,  0.007 sec
     gradient                   ...        0 min,  0.012 sec
 * total energy  :   -36.8269743 Eh     change       -0.4014165E-04 Eh
   gradient norm :     0.0023644 Eh/α   predicted    -0.2952050E-04 ( -26.46%)
   displ. norm   :     0.3292280 α      lambda       -0.5519264E-04
   maximum displ.:     0.2827727 α      in ANC's #1, #2, #3, ...

........................................................................
.............................. CYCLE   34 ..............................
........................................................................
   1    -37.3214031 -0.373214E+02  0.193E-01    2.68       0.0  T
   2    -37.3214063 -0.318442E-05  0.112E-01    2.68       1.0  T
   3    -37.3213975  0.873155E-05  0.274E-02    2.68       1.0  T
   4    -37.3214080 -0.104664E-04  0.870E-03    2.68       2.5  T
   5    -37.3214083 -0.275967E-06  0.189E-03    2.68      11.6  T
   6    -37.3214083 -0.307128E-07  0.971E-04    2.68      22.5  T
   7    -37.3214083 -0.272627E-08  0.589E-04    2.68      37.0  T
     SCC iter.                  ...        0 min,  0.007 sec
     gradient                   ...        0 min,  0.012 sec
 * total energy  :   -36.8269696 Eh     change        0.4663411E-05 Eh
   gradient norm :     0.0060747 Eh/α   predicted    -0.3058824E-04 (-755.92%)
   displ. norm   :     0.1026254 α      lambda       -0.9750648E-04
   maximum displ.:     0.0741904 α      in ANC's #1, #4, #3, ...

........................................................................
.............................. CYCLE   35 ..............................
........................................................................
   1    -37.3245551 -0.373246E+02  0.631E-02    2.69       0.0  T
   2    -37.3245559 -0.835225E-06  0.369E-02    2.69       1.0  T
   3    -37.3245517  0.423340E-05  0.186E-02    2.69       1.2  T
   4    -37.3245566 -0.495533E-05  0.319E-03    2.69       6.8  T
   5    -37.3245567 -0.347125E-07  0.132E-03    2.69      16.5  T
   6    -37.3245567 -0.457707E-08  0.527E-04    2.69      41.4  T
     SCC iter.                  ...        0 min,  0.006 sec
     gradient                   ...        0 min,  0.012 sec
 * total energy  :   -36.8270125 Eh     change       -0.4282621E-04 Eh
   gradient norm :     0.0015337 Eh/α   predicted    -0.4927578E-04 (  15.06%)
   displ. norm   :     0.1018582 α      lambda       -0.1595188E-04
   maximum displ.:     0.0754516 α      in ANC's #1, #2, #3, ...

........................................................................
.............................. CYCLE   36 ..............................
........................................................................
   1    -37.3247192 -0.373247E+02  0.579E-02    2.70       0.0  T
   2    -37.3247203 -0.102214E-05  0.337E-02    2.70       1.0  T
   3    -37.3247200  0.247790E-06  0.603E-03    2.70       3.6  T
   4    -37.3247204 -0.378179E-06  0.279E-03    2.70       7.8  T
   5    -37.3247205 -0.636798E-07  0.138E-03    2.70      15.8  T
   6    -37.3247205 -0.191204E-07  0.506E-04    2.70      43.2  T
   7    -37.3247205 -0.118068E-08  0.219E-04    2.70      99.6  T
     SCC iter.                  ...        0 min,  0.007 sec
     gradient                   ...        0 min,  0.012 sec
 * total energy  :   -36.8270241 Eh     change       -0.1159048E-04 Eh
   gradient norm :     0.0037195 Eh/α   predicted    -0.8013997E-05 ( -30.86%)
   displ. norm   :     0.1266943 α      lambda       -0.2206816E-04
   maximum displ.:     0.0997824 α      in ANC's #1, #2, #4, ...

........................................................................
.............................. CYCLE   37 ..............................
........................................................................
   1    -37.3240619 -0.373241E+02  0.817E-02    2.70       0.0  T
   2    -37.3240627 -0.760406E-06  0.469E-02    2.70       1.0  T
   3    -37.3240622  0.502345E-06  0.843E-03    2.70       2.6  T
   4    -37.3240629 -0.653855E-06  0.459E-03    2.70       4.8  T
   5    -37.3240630 -0.192031E-06  0.885E-04    2.70      24.7  T
   6    -37.3240631 -0.555308E-08  0.464E-04    2.70      47.0  T
     SCC iter.                  ...        0 min,  0.006 sec
     gradient                   ...        0 min,  0.013 sec
 * total energy  :   -36.8270378 Eh     change       -0.1376149E-04 Eh
   gradient norm :     0.0027289 Eh/α   predicted    -0.1121532E-04 ( -18.50%)
   displ. norm   :     0.0757977 α      lambda       -0.2134947E-04
   maximum displ.:     0.0445174 α      in ANC's #2, #4, #1, ...

........................................................................
.............................. CYCLE   38 ..............................
........................................................................
   1    -37.3238544 -0.373239E+02  0.556E-02    2.70       0.0  T
   2    -37.3238550 -0.675191E-06  0.320E-02    2.70       1.0  T
   3    -37.3238547  0.374224E-06  0.783E-03    2.70       2.8  T
   4    -37.3238553 -0.620869E-06  0.380E-03    2.70       5.7  T
   5    -37.3238554 -0.745905E-07  0.154E-03    2.70      14.2  T
   6    -37.3238554 -0.312554E-07  0.489E-04    2.70      44.6  T
   7    -37.3238554 -0.862386E-10  0.284E-04    2.70      77.0  T
     SCC iter.                  ...        0 min,  0.007 sec
     gradient                   ...        0 min,  0.012 sec
 * total energy  :   -36.8270526 Eh     change       -0.1474359E-04 Eh
   gradient norm :     0.0013627 Eh/α   predicted    -0.1073936E-04 ( -27.16%)
   displ. norm   :     0.1670171 α      lambda       -0.2756194E-04
   maximum displ.:     0.1073055 α      in ANC's #4, #2, #5, ...

........................................................................
.............................. CYCLE   39 ..............................
........................................................................
   1    -37.3242846 -0.373243E+02  0.126E-01    2.70       0.0  T
   2    -37.3242884 -0.376085E-05  0.747E-02    2.70       1.0  T
   3    -37.3242805  0.788056E-05  0.268E-02    2.70       1.0  T
   4    -37.3242908 -0.103635E-04  0.779E-03    2.70       2.8  T
   5    -37.3242911 -0.258099E-06  0.294E-03    2.70       7.4  T
   6    -37.3242911 -0.399453E-07  0.117E-03    2.70      18.6  T
   7    -37.3242911 -0.336939E-08  0.613E-04    2.70      35.6  T
   8    -37.3242911 -0.187447E-08  0.225E-04    2.70      97.0  T
     SCC iter.                  ...        0 min,  0.008 sec
     gradient                   ...        0 min,  0.013 sec
 * total energy  :   -36.8270704 Eh     change       -0.1778888E-04 Eh
   gradient norm :     0.0030088 Eh/α   predicted    -0.1395295E-04 ( -21.56%)
   displ. norm   :     0.0412960 α      lambda       -0.1471461E-04
   maximum displ.:     0.0326930 α      in ANC's #2, #4, #3, ...

........................................................................
.............................. CYCLE   40 ..............................
........................................................................
   1    -37.3241535 -0.373242E+02  0.270E-02    2.70       0.0  T
   2    -37.3241536 -0.157040E-06  0.159E-02    2.70       1.4  T
   3    -37.3241535  0.167821E-06  0.398E-03    2.70       5.5  T
   4    -37.3241537 -0.243286E-06  0.158E-03    2.70      13.8  T
   5    -37.3241537 -0.119005E-07  0.655E-04    2.70      33.3  T
   6    -37.3241537 -0.447616E-08  0.258E-04    2.70      84.7  T
     SCC iter.                  ...        0 min,  0.006 sec
     gradient                   ...        0 min,  0.013 sec
 * total energy  :   -36.8270813 Eh     change       -0.1094115E-04 Eh
   gradient norm :     0.0018645 Eh/α   predicted    -0.7374265E-05 ( -32.60%)
   displ. norm   :     0.0870580 α      lambda       -0.1305593E-04
   maximum displ.:     0.0514229 α      in ANC's #2, #1, #5, ...

........................................................................
.............................. CYCLE   41 ..............................
........................................................................
   1    -37.3242426 -0.373242E+02  0.537E-02    2.71       0.0  T
   2    -37.3242433 -0.654553E-06  0.323E-02    2.71       1.0  T
   3    -37.3242413  0.201211E-05  0.117E-02    2.71       1.9  T
   4    -37.3242438 -0.247307E-05  0.250E-03    2.71       8.7  T
   5    -37.3242438 -0.274200E-07  0.137E-03    2.71      15.9  T
   6    -37.3242438 -0.732130E-08  0.613E-04    2.71      35.6  T
   7    -37.3242438 -0.257769E-08  0.304E-04    2.71      71.8  T
     SCC iter.                  ...        0 min,  0.007 sec
     gradient                   ...        0 min,  0.013 sec
 * total energy  :   -36.8270900 Eh     change       -0.8696378E-05 Eh
   gradient norm :     0.0017358 Eh/α   predicted    -0.6551890E-05 ( -24.66%)
   displ. norm   :     0.0299682 α      lambda       -0.3149460E-05
   maximum displ.:     0.0213785 α      in ANC's #2, #5, #4, ...

........................................................................
.............................. CYCLE   42 ..............................
........................................................................
   1    -37.3241812 -0.373242E+02  0.232E-02    2.71       0.0  T
   2    -37.3241813 -0.154294E-06  0.132E-02    2.71       1.7  T
   3    -37.3241812  0.176396E-06  0.428E-03    2.71       5.1  T
   4    -37.3241814 -0.223005E-06  0.178E-03    2.71      12.3  T
   5    -37.3241814 -0.203449E-07  0.593E-04    2.71      36.8  T
   6    -37.3241814 -0.243448E-08  0.218E-04    2.71     100.2  T
     SCC iter.                  ...        0 min,  0.006 sec
     gradient                   ...        0 min,  0.012 sec
 * total energy  :   -36.8270936 Eh     change       -0.3581389E-05 Eh
   gradient norm :     0.0009162 Eh/α   predicted    -0.1577988E-05 ( -55.94%)
   displ. norm   :     0.0452578 α      lambda       -0.4880759E-05
   maximum displ.:     0.0277671 α      in ANC's #1, #2, #3, ...

   *** GEOMETRY OPTIMIZATION CONVERGED AFTER 42 ITERATIONS ***

------------------------------------------------------------------------
 total energy gain   :        -0.0109871 Eh       -6.8945 kcal/mol
 total RMSD          :         1.3510347 a0        0.7149 Å
 total power (kW/mol):        -0.6868220 (step)  -24.2504 (real)
------------------------------------------------------------------------

 ANCopt (total)                0 d,  0 h,  0 min,  1.190 sec
 optimizer setup                ...        0 min,  0.000 sec (  0.012%)
 model hessian                  ...        0 min,  0.008 sec (  0.647%)
 ANC generation                 ...        0 min,  0.001 sec (  0.100%)
 coordinate transformation      ...        0 min,  0.001 sec (  0.053%)
 single point calculation       ...        0 min,  1.163 sec ( 97.798%)
 optimization log               ...        0 min,  0.004 sec (  0.308%)
 hessian update                 ...        0 min,  0.001 sec (  0.043%)
 rational function              ...        0 min,  0.010 sec (  0.833%)

================
 final structure:
================
$coord
    2.85304973871287   -2.41346471090420    0.13210424784592      C 
    5.14038882366167   -0.16169596037878    0.34896017530553      S 
    2.92599378311277    2.28574596390880    0.26216839192106      C 
    0.49695102406397    1.32101552622651    0.11371944674821      C 
    0.48589805148130   -1.38969088773244    0.03182436685867      C 
   -1.79365185000522   -2.94879408531951   -0.25137378506299      C 
   -1.74448540817954   -5.23466280060818   -0.25744673384109      O 
   -4.19181035378045   -1.43683352167477   -0.59252291073761      C 
   -4.12400907366137    1.02011654309668    0.91501036308008      C 
   -1.92070074037524    2.68034729848308    0.13840595974074      C 
   -2.22249970774940    4.88598359303173   -0.38523686637446      O 
    4.00290434113262    4.78230599667446    0.45167549492995      C 
    2.84936783385464    6.99483375239224    0.13472729437123      C 
    3.32163750399811   -4.38391795908948    0.07242345112644      H 
   -5.80655711200321   -2.59926447841397   -0.05112912010781      H 
   -4.37120093003784   -1.01161384582090   -2.60901415158131      H 
   -3.92126730100416    0.59099841730065    2.92700976611821      H 
   -5.86939288238197    2.08624202369137    0.65155827846314      H 
    6.01147621638689    4.74826815598391    0.86066059446636      H 
    0.87300563927435    7.13847314856101   -0.31727204678989      H 
    3.89150331299431    8.73125426218624    0.33099667021643      H 
$end
           -------------------------------------------------
          |                Final Singlepoint                |
           -------------------------------------------------

          ...................................................
          :                      SETUP                      :
          :.................................................:
          :  # basis functions                  66          :
          :  # atomic orbitals                  65          :
          :  # shells                           35          :
          :  # electrons                        66          :
          :  max. iterations                   250          :
          :  Hamiltonian                  GFN2-xTB          :
          :  restarted?                      false          :
          :  GBSA solvation                  false          :
          :  PC potential                    false          :
          :  electronic temp.          300.0000000     K    :
          :  accuracy                    1.0000000          :
          :  -> integral cutoff          0.2500000E+02      :
          :  -> integral neglect         0.1000000E-07      :
          :  -> SCF convergence          0.1000000E-05 Eh   :
          :  -> wf. convergence          0.1000000E-03 e    :
          :  Broyden damping             0.4000000          :
          ...................................................

 iter      E             dE          RMSdq      gap      omega  full diag
   1    -37.3241814 -0.373242E+02  0.738E-05    2.71       0.0  T
   2    -37.3241814 -0.103952E-10  0.425E-05    2.71     513.5  T
   3    -37.3241814 -0.214726E-10  0.303E-05    2.71     719.7  T

   *** convergence criteria satisfied after 3 iterations ***

         #    Occupation            Energy/Eh            Energy/eV
      -------------------------------------------------------------
         1        2.0000           -0.7579533             -20.6250
       ...           ...                  ...                  ...
        27        2.0000           -0.4638334             -12.6215
        28        2.0000           -0.4571080             -12.4385
        29        2.0000           -0.4478575             -12.1868
        30        2.0000           -0.4258719             -11.5886
        31        2.0000           -0.4062261             -11.0540
        32        2.0000           -0.4040434             -10.9946
        33        2.0000           -0.4032019             -10.9717 (HOMO)
        34                         -0.3036737              -8.2634 (LUMO)
        35                         -0.2943593              -8.0099
        36                         -0.2387603              -6.4970
        37                         -0.2252877              -6.1304
        38                         -0.1934312              -5.2635
       ...                                ...                  ...
        65                          0.7006181              19.0648
      -------------------------------------------------------------
                  HL-Gap            0.0995282 Eh            2.7083 eV
             Fermi-level           -0.3534378 Eh           -9.6175 eV

 SCC (total)                   0 d,  0 h,  0 min,  0.025 sec
 SCC setup                      ...        0 min,  0.000 sec (  0.735%)
 Dispersion                     ...        0 min,  0.000 sec (  0.682%)
 integral evaluation            ...        0 min,  0.008 sec ( 31.807%)
 zeroth order Hamiltonian       ...        0 min,  0.000 sec (  0.578%)
 iterations                     ...        0 min,  0.004 sec ( 14.896%)
 molecular gradient             ...        0 min,  0.012 sec ( 49.769%)
 printout                       ...        0 min,  0.000 sec (  1.304%)

         :::::::::::::::::::::::::::::::::::::::::::::::::::::
         ::                     SUMMARY                     ::
         :::::::::::::::::::::::::::::::::::::::::::::::::::::
         :: total energy             -36.827093573588 Eh    ::
         :: gradient norm              0.000918283843 Eh/a0 ::
         :: HOMO-LUMO gap              2.708299087421 eV    ::
         ::.................................................::
         :: SCC energy               -37.324181405473 Eh    ::
         :: -> isotropic ES            0.051970369276 Eh    ::
         :: -> anisotropic ES         -0.000568468764 Eh    ::
         :: -> anisotropic XC          0.012618268465 Eh    ::
         :: -> dispersion             -0.022427058888 Eh    ::
         :: repulsion energy           0.496973188217 Eh    ::
         :: add. restraining           0.000000000000 Eh    ::
         :::::::::::::::::::::::::::::::::::::::::::::::::::::

           -------------------------------------------------
          |                Property Printout                |
           -------------------------------------------------

    * Orbital Energies and Occupations

         #    Occupation            Energy/Eh            Energy/eV
      -------------------------------------------------------------
         1        2.0000           -0.7579533             -20.6250
       ...           ...                  ...                  ...
        21        2.0000           -0.5064097             -13.7801
        22        2.0000           -0.5027274             -13.6799
        23        2.0000           -0.4934257             -13.4268
        24        2.0000           -0.4880143             -13.2795
        25        2.0000           -0.4787024             -13.0262
        26        2.0000           -0.4748841             -12.9223
        27        2.0000           -0.4638334             -12.6215
        28        2.0000           -0.4571080             -12.4385
        29        2.0000           -0.4478575             -12.1868
        30        2.0000           -0.4258719             -11.5886
        31        2.0000           -0.4062261             -11.0540
        32        2.0000           -0.4040434             -10.9946
        33        2.0000           -0.4032019             -10.9717 (HOMO)
        34                         -0.3036737              -8.2634 (LUMO)
        35                         -0.2943593              -8.0099
        36                         -0.2387603              -6.4970
        37                         -0.2252877              -6.1304
        38                         -0.1934312              -5.2635
        39                         -0.1409147              -3.8345
        40                         -0.1394361              -3.7942
        41                         -0.0241874              -0.6582
        42                          0.0071045               0.1933
        43                          0.0135158               0.3678
        44                          0.0686181               1.8672
       ...                                ...                  ...
        65                          0.7006181              19.0648
      -------------------------------------------------------------
                  HL-Gap            0.0995282 Eh            2.7083 eV
             Fermi-level           -0.3534378 Eh           -9.6175 eV

     #   Z        covCN         q      C6AA      α(0)
     1   6 C      2.928    -0.009    28.235     8.714
     2  16 S      2.362     0.032   139.738    19.896
     3   6 C      2.979     0.038    27.151     8.547
     4   6 C      3.137    -0.038    28.705     8.769
     5   6 C      3.172    -0.031    28.375     8.701
     6   6 C      2.820     0.234    23.109     7.877
     7   8 O      0.857    -0.366    21.005     6.145
     8   6 C      3.807    -0.081    22.044     6.684
     9   6 C      3.808    -0.083    22.075     6.688
    10   6 C      2.818     0.237    23.043     7.865
    11   8 O      0.857    -0.367    21.029     6.148
    12   6 C      2.956    -0.030    28.743     8.794
    13   6 C      2.837    -0.080    30.002     8.976
    14   1 H      0.926     0.076     2.018     2.221
    15   1 H      0.924     0.070     2.082     2.257
    16   1 H      0.924     0.069     2.093     2.262
    17   1 H      0.924     0.062     2.179     2.309
    18   1 H      0.924     0.068     2.109     2.271
    19   1 H      0.925     0.048     2.349     2.397
    20   1 H      0.926     0.096     1.822     2.111
    21   1 H      0.926     0.054     2.270     2.356

 Mol. C6AA /au·bohr⁶  :       6965.470132
 Mol. C8AA /au·bohr⁸  :     191705.303608
 Mol. α(0) /au        :        131.987730


Wiberg/Mayer (AO) data.
largest (>0.10) Wiberg bond orders for each atom
          total WBO             WBO to atom ...
     1  C   3.959        C    5 1.544    S    2 1.235    H   14 0.965
     2  S   2.689        C    1 1.235    C    3 1.149
     3  C   3.953        C    4 1.464    S    2 1.149    C   12 1.139
     4  C   3.982        C    3 1.464    C    5 1.190    C   10 1.054
     5  C   3.983        C    1 1.544    C    4 1.190    C    6 1.040
     6  C   3.932        O    7 1.812    C    5 1.040    C    8 0.986
     7  O   2.062        C    6 1.812
     8  C   3.995        C    9 0.989    C    6 0.986    H   15 0.966    H   16 0.944
     9  C   3.995        C    8 0.989    C   10 0.980    H   18 0.972    H   17 0.952
    10  C   3.933        O   11 1.799    C    4 1.054    C    9 0.980
    11  O   2.076        C   10 1.799
    12  C   3.989        C   13 1.852    C    3 1.139    H   19 0.960
    13  C   3.975        C   12 1.852    H   21 0.976    H   20 0.955
    14  H   0.993        C    1 0.965
    15  H   0.993        C    8 0.966
    16  H   0.995        C    8 0.944
    17  H   0.996        C    9 0.952
    18  H   0.994        C    9 0.972
    19  H   0.997        C   12 0.960
    20  H   0.991        C   13 0.955
    21  H   0.997        C   13 0.976

molecular dipole:
                 x           y           z       tot (Debye)
 q only:        0.612       0.463       0.247
   full:        0.425       0.361       0.271       1.576
molecular quadrupole (traceless):
                xx          xy          yy          xz          yz          zz
 q only:        9.542       2.553     -11.071      -0.265       1.039       1.529
  q+dip:       10.906       2.441     -13.011       0.007       1.089       2.105
   full:        8.846       2.632     -14.191      -0.453       1.571       5.344

           -------------------------------------------------
          |                Geometry Summary                 |
           -------------------------------------------------

      molecular mass/u    :      192.2320000
   center of mass at/Å    :        0.3150301       0.3730754       0.0518316
  moments of inertia/u·Å² :        0.4873253E+03   0.7228539E+03   0.1190071E+04
rotational constants/cm⁻¹ :        0.3459216E-01   0.2332094E-01   0.1416523E-01

 * 17 selected distances

     #   Z        #   Z                                     value/Å
     1   6 C      2  16 S                                 1.7023896
     2  16 S      3   6 C                                 1.7471707 (max)
     3   6 C      4   6 C                                 1.3852917
     1   6 C      5   6 C                                 1.3658080
     4   6 C      5   6 C                                 1.4351106
     6   6 C      7   8 O                                 1.2099138
     8   6 C      9   6 C                                 1.5258170
    10   6 C     11   8 O                                 1.2101991
    12   6 C     13   6 C                                 1.3310025
     1   6 C     14   1 H                                 1.0722628 (min)
     8   6 C     15   1 H                                 1.0911527
     8   6 C     16   1 H                                 1.0946719
     9   6 C     17   1 H                                 1.0939245
     9   6 C     18   1 H                                 1.0912342
    12   6 C     19   1 H                                 1.0848506
    13   6 C     20   1 H                                 1.0755381
    13   6 C     21   1 H                                 1.0766806

 * 4 distinct bonds (by element types)

   Z      Z             #   av. dist./Å        max./Å        min./Å
   1 H    6 C           8     1.0850394     1.0946719     1.0722628
   6 C    6 C           5     1.4086060     1.5258170     1.3310025
   6 C    8 O           2     1.2100564     1.2101991     1.2099138
   6 C   16 S           2     1.7247801     1.7471707     1.7023896


optimized geometry written to: xtbopt.xyz


           -------------------------------------------------
          | TOTAL ENERGY              -36.827093573588 Eh   |
          | GRADIENT NORM               0.000918283843 Eh/α |
          | HOMO-LUMO GAP               2.708299087421 eV   |
           -------------------------------------------------

------------------------------------------------------------------------
 * finished run on 2021/05/19 at 11:01:01.625     
------------------------------------------------------------------------
 total:
 * wall-time:     0 d,  0 h,  0 min,  1.272 sec
 *  cpu-time:     0 d,  0 h,  0 min,  1.267 sec
 * ratio c/w:     0.997 speedup
 SCF:
 * wall-time:     0 d,  0 h,  0 min,  0.036 sec
 *  cpu-time:     0 d,  0 h,  0 min,  0.036 sec
 * ratio c/w:     0.998 speedup
 ANC optimizer:
 * wall-time:     0 d,  0 h,  0 min,  1.215 sec
 *  cpu-time:     0 d,  0 h,  0 min,  1.212 sec
 * ratio c/w:     0.998 speedup

