      -----------------------------------------------------------      
     |                   =====================                   |     
     |                           x T B                           |     
     |                   =====================                   |     
     |                         S. Grimme                         |     
     |          Mulliken Center for Theoretical Chemistry        |     
     |                    University of Bonn                     |     
     |                Version 6.2 RC2 (SAW190805)                |     
      -----------------------------------------------------------      

   This program is distributed in the hope that it will be useful,
   but WITHOUT ANY WARRANTY; without even the implied warranty of
   MERCHANTABILITY or FITNESS FOR A PARTICULAR PURPOSE.
   
   FOR NON-COMMERCIAL, ACADEMIA USE ONLY.
   
   Cite this work as:
   * S. Grimme, C. Bannwarth, P. Shushkov, J. Chem. Theory Comput., 2017,
     13, 1989-2009. DOI: 10.1021/acs.jctc.7b00118
   * C. Bannwarth, S. Ehlert and S. Grimme., J. Chem. Theory Comput., 2019,
     15, 1652-1671. DOI: 10.1021/acs.jctc.8b01176
   * P. Pracht, E. Caldeweyher, S. Ehlert, S. Grimme, ChemRxiv, 2019, preprint.
     DOI: 10.26434/chemrxiv.8326202.v1
   
   for DFT-D4:
   * E. Caldeweyher, C. Bannwarth and S. Grimme, J. Chem. Phys., 2017,
     147, 034112. DOI: 10.1063/1.4993215
   * E. Caldeweyher, S. Ehlert, A. Hansen, H. Neugebauer, S. Spicher,
     C. Bannwarth and S. Grimme, J. Chem. Phys., 2019, 150, 154122.
     DOI: 10.1063/1.5090222
   
   for sTDA-xTB:
   * S. Grimme and C. Bannwarth, J. Chem. Phys., 2016, 145, 054103.
     DOI: 10.1063/1.4959605
   
   in the mass-spec context:
   * V. Asgeirsson, C. Bauer and S. Grimme, Chem. Sci., 2017, 8, 4879.
     DOI: 10.1039/c7sc00601b
   
   for metadynamics refer to:
   * S. Grimme, J. Chem. Theory Comput., 2019, 155, 2847-2862
     DOI: 10.1021/acs.jctc.9b00143
   
   with help from (in alphabetical order)
   C. Bannwarth, F. Bohle, G. Brandenburg, E. Caldeweyher, M. Checinski,
   S. Dohm, S. Ehlert, S. Ehrlich, F. März, H. Neugebauer, J. Pisarek,
   P. Pracht, P. Shushkov, and S. Spicher.
   
 * started run on 2021/05/19 at 11:01:01.644     

           -------------------------------------------------
          |                Calculation Setup                |
           -------------------------------------------------

          program call               : /ihome/ghutchison/geoffh/xtb/xtb 1041.xyz -opt
          hostname                   : smp-n144
          coordinate file            : 1041.xyz
          omp threads                :                     1
          number of atoms            :                    21
          number of electrons        :                    70
          charge                     :                     0
          spin                       :                   0.0
          first test random number   :      0.05108916682311


########################################################################
# WARNING! Please study the warnings concerning your input carefully
#  - the use of '-opt' is discouraged, please use '--opt' next time
########################################################################

           ------------------------------------------------- 
          |                 G F N 2 - x T B                 |
          | Geometry, Frequencies, Noncovalent interactions |
          |            JCTC 2019 parametrisation            |
           ------------------------------------------------- 
             KAB for C  - Si     :                1.0500
             KAB for H  - Pd     :                0.9500
             k(s)              :                1.8500
             k(p)              :                2.2300
             k(d)              :                2.2300
             k(f)              :                2.0000
             kEN (H0ij)        :               -2.0000
             D4 a1             :                0.5200
             D4 a2             :                5.0000
             D4 s6             :                1.0000
             D4 s8             :                2.7000
             D4 s9             :                5.0000
             alphaj            :                2.0000

  Z AO/shell   Hii/eV     exponent
  1     Wed Apr 25 08:07:45 CEST 2018   EN: 2.200 GM2: 0.406  GM3: 0.0800  RAES: 1.40
     1s    -10.707211    1.230000
  6     Wed Apr 25 08:07:45 CEST 2018   EN: 2.550 GM2: 0.538  GM3: 0.1500  RAES: 3.00
     2s    -13.970922    2.096432
     2p    -10.063292    1.800000
  7     Wed Apr 25 08:07:45 CEST 2018   EN: 3.040 GM2: 0.461  GM3:-0.0640  RAES: 1.90
     2s    -16.686243    2.339881
     2p    -12.523956    2.014332
  8     Wed Apr 25 08:07:45 CEST 2018   EN: 3.440 GM2: 0.452  GM3:-0.0517  RAES: 1.80
     2s    -20.229985    2.439742
     2p    -15.503117    2.137023
 16     Tue Apr 24 11:44:34 CEST 2018   EN: 2.580 GM2: 0.340  GM3:-0.0502  RAES: 3.10
     3s    -20.029654    1.981333
     3p    -11.377694    2.025643
     3d     -0.420282    1.702555

           ------------------------------------------------- 
          |        Self-Consistent Charge Iterations        |
           ------------------------------------------------- 

          ...................................................
          :                      SETUP                      :
          :.................................................:
          :  # basis functions                  69          :
          :  # atomic orbitals                  68          :
          :  # shells                           36          :
          :  # electrons                        70          :
          :  max. iterations                   250          :
          :  Hamiltonian                  GFN2-xTB          :
          :  restarted?                      false          :
          :  GBSA solvation                  false          :
          :  PC potential                    false          :
          :  electronic temp.          300.0000000     K    :
          :  accuracy                    1.0000000          :
          :  -> integral cutoff          0.2500000E+02      :
          :  -> integral neglect         0.1000000E-07      :
          :  -> SCF convergence          0.1000000E-05 Eh   :
          :  -> wf. convergence          0.1000000E-03 e    :
          :  Broyden damping             0.4000000          :
          ...................................................

 iter      E             dE          RMSdq      gap      omega  full diag
   1    -39.4955707 -0.394956E+02  0.558E+00    1.87       0.0  T
   2    -39.6274571 -0.131886E+00  0.288E+00    1.72       1.0  T
   3    -39.6249477  0.250945E-02  0.147E+00    1.63       1.0  T
   4    -39.6055431  0.194045E-01  0.122E+00    1.57       1.0  T
   5    -39.6307318 -0.251887E-01  0.275E-01    1.55       1.0  T
   6    -39.6320968 -0.136501E-02  0.951E-02    1.54       1.0  T
   7    -39.6321384 -0.415962E-04  0.454E-02    1.56       1.0  T
   8    -39.6321620 -0.236162E-04  0.173E-02    1.56       1.3  T
   9    -39.6321642 -0.212963E-05  0.996E-03    1.55       2.2  T
  10    -39.6321645 -0.296953E-06  0.436E-03    1.55       5.0  T
  11    -39.6321647 -0.264443E-06  0.134E-03    1.55      16.3  T
  12    -39.6321647 -0.121666E-07  0.607E-04    1.55      36.0  T
  13    -39.6321647 -0.201895E-08  0.260E-04    1.55      84.0  T

   *** convergence criteria satisfied after 13 iterations ***

         #    Occupation            Energy/Eh            Energy/eV
      -------------------------------------------------------------
         1        2.0000           -0.7626289             -20.7522
       ...           ...                  ...                  ...
        29        2.0000           -0.4614454             -12.5566
        30        2.0000           -0.4567733             -12.4294
        31        2.0000           -0.4498914             -12.2422
        32        2.0000           -0.4375538             -11.9064
        33        2.0000           -0.4342342             -11.8161
        34        2.0000           -0.4233061             -11.5187
        35        2.0000           -0.3848910             -10.4734 (HOMO)
        36                         -0.3277756              -8.9192 (LUMO)
        37                         -0.2998262              -8.1587
        38                         -0.2529927              -6.8843
        39                         -0.2321653              -6.3175
        40                         -0.2201737              -5.9912
       ...                                ...                  ...
        68                          0.7042460              19.1635
      -------------------------------------------------------------
                  HL-Gap            0.0571154 Eh            1.5542 eV
             Fermi-level           -0.3563333 Eh           -9.6963 eV

 SCC (total)                   0 d,  0 h,  0 min,  0.038 sec
 SCC setup                      ...        0 min,  0.000 sec (  0.759%)
 Dispersion                     ...        0 min,  0.000 sec (  0.849%)
 integral evaluation            ...        0 min,  0.009 sec ( 23.556%)
 zeroth order Hamiltonian       ...        0 min,  0.000 sec (  0.472%)
 iterations                     ...        0 min,  0.014 sec ( 38.190%)
 molecular gradient             ...        0 min,  0.013 sec ( 35.068%)
 printout                       ...        0 min,  0.000 sec (  0.971%)

         :::::::::::::::::::::::::::::::::::::::::::::::::::::
         ::                     SUMMARY                     ::
         :::::::::::::::::::::::::::::::::::::::::::::::::::::
         :: total energy             -39.131318527608 Eh    ::
         :: gradient norm              0.096654520833 Eh/a0 ::
         :: HOMO-LUMO gap              1.554189342538 eV    ::
         ::.................................................::
         :: SCC energy               -39.632164729543 Eh    ::
         :: -> isotropic ES            0.050895075364 Eh    ::
         :: -> anisotropic ES          0.006890585200 Eh    ::
         :: -> anisotropic XC          0.013131432321 Eh    ::
         :: -> dispersion             -0.023757647461 Eh    ::
         :: repulsion energy           0.500771193078 Eh    ::
         :: add. restraining           0.000000000000 Eh    ::
         :::::::::::::::::::::::::::::::::::::::::::::::::::::

      ----------------------------------------------------------- 
     |                   =====================                   |
     |                        A N C O P T                        |
     |                   =====================                   |
     |               Approximate Normal Coordinate               |
     |                Rational Function Optimizer                |
      ----------------------------------------------------------- 

          ...................................................
          :                      SETUP                      :
          :.................................................:
          :   optimization level            normal          :
          :   max. optcycles                   200          :
          :   ANC micro-cycles                  20          :
          :   degrees of freedom                57          :
          :.................................................:
          :   RF solver                   davidson          :
          :   input Hessian                  false          :
          :   write xtbopt.log                true          :
          :   linear?                        false          :
          :   energy convergence         0.5000000E-05 Eh   :
          :   grad. convergence          0.1000000E-02 Eh/α :
          :   maximium RF displ.         2.0000000          :
          :   Hlow (freq-cutoff)         0.5000000E-02      :
          :   Hmax (freq-cutoff)         5.0000000          :
          :   S6 in model hess.         20.0000000          :
          ...................................................

generating ANC from model Hessian ...
Using Lindh-Hessian (1995)
 Shifting diagonal of input Hessian by   3.632538951419023E-003
 Lowest  eigenvalues of input Hessian
   -0.000000    0.000000    0.000000    0.000000    0.000000    0.000000
    0.005000    0.007600    0.008920    0.009544    0.013088    0.017007
    0.017152    0.018358    0.023292    0.025066    0.031986    0.045447
 Highest eigenvalues
    1.797515    1.852234    1.979737    2.012966    2.095633    2.453304
 

........................................................................
.............................. CYCLE    1 ..............................
........................................................................
   1    -39.6321647 -0.396322E+02  0.101E-04    1.55       0.0  T
   2    -39.6321647 -0.159375E-10  0.563E-05    1.55     387.7  T
   3    -39.6321647 -0.525091E-11  0.454E-05    1.55     480.8  T
     SCC iter.                  ...        0 min,  0.004 sec
     gradient                   ...        0 min,  0.013 sec
 * total energy  :   -39.1313185 Eh     change        0.2751364E-08 Eh
   gradient norm :     0.0966553 Eh/α   predicted     0.0000000E+00 (-100.00%)
   displ. norm   :     0.2920609 α      lambda       -0.1487198E-01
   maximum displ.:     0.1817297 α      in ANC's #17, #24, #8, ...

........................................................................
.............................. CYCLE    2 ..............................
........................................................................
   1    -39.6686246 -0.396686E+02  0.332E-01    1.70       0.0  T
   2    -39.6687337 -0.109158E-03  0.200E-01    1.66       1.0  T
   3    -39.6683900  0.343741E-03  0.171E-01    1.67       1.0  T
   4    -39.6688619 -0.471922E-03  0.518E-02    1.66       1.0  T
   5    -39.6688966 -0.347049E-04  0.201E-02    1.66       1.1  T
   6    -39.6689033 -0.667550E-05  0.588E-03    1.66       3.7  T
   7    -39.6689034 -0.823580E-07  0.342E-03    1.66       6.4  T
   8    -39.6689035 -0.108579E-06  0.121E-03    1.66      18.0  T
     SCC iter.                  ...        0 min,  0.008 sec
     gradient                   ...        0 min,  0.012 sec
 * total energy  :   -39.1413722 Eh     change       -0.1005364E-01 Eh
   gradient norm :     0.0421368 Eh/α   predicted    -0.8070279E-02 ( -19.73%)
   displ. norm   :     0.2918597 α      lambda       -0.4915207E-02
   maximum displ.:     0.1391861 α      in ANC's #6, #8, #17, ...

........................................................................
.............................. CYCLE    3 ..............................
........................................................................
   1    -39.6850742 -0.396851E+02  0.441E-01    1.74       0.0  T
   2    -39.6851972 -0.123046E-03  0.258E-01    1.73       1.0  T
   3    -39.6849133  0.283947E-03  0.140E-01    1.74       1.0  T
   4    -39.6852262 -0.312937E-03  0.507E-02    1.73       1.0  T
   5    -39.6852757 -0.495157E-04  0.138E-02    1.73       1.6  T
   6    -39.6852778 -0.202504E-05  0.717E-03    1.73       3.0  T
   7    -39.6852780 -0.266437E-06  0.324E-03    1.73       6.7  T
   8    -39.6852781 -0.447149E-07  0.136E-03    1.73      16.1  T
     SCC iter.                  ...        0 min,  0.008 sec
     gradient                   ...        0 min,  0.012 sec
 * total energy  :   -39.1431839 Eh     change       -0.1811733E-02 Eh
   gradient norm :     0.0237250 Eh/α   predicted    -0.2666947E-02 (  47.20%)
   displ. norm   :     0.2432334 α      lambda       -0.2636021E-02
   maximum displ.:     0.1790417 α      in ANC's #8, #2, #9, ...

........................................................................
.............................. CYCLE    4 ..............................
........................................................................
   1    -39.6856211 -0.396856E+02  0.453E-01    1.70       0.0  T
   2    -39.6858095 -0.188467E-03  0.262E-01    1.72       1.0  T
   3    -39.6857269  0.826956E-04  0.123E-01    1.73       1.0  T
   4    -39.6858510 -0.124160E-03  0.397E-02    1.72       1.0  T
   5    -39.6858803 -0.293324E-04  0.131E-02    1.72       1.7  T
   6    -39.6858815 -0.119517E-05  0.749E-03    1.72       2.9  T
   7    -39.6858820 -0.446286E-06  0.279E-03    1.72       7.8  T
   8    -39.6858820 -0.357714E-07  0.929E-04    1.72      23.5  T
     SCC iter.                  ...        0 min,  0.008 sec
     gradient                   ...        0 min,  0.012 sec
 * total energy  :   -39.1440086 Eh     change       -0.8246557E-03 Eh
   gradient norm :     0.0234248 Eh/α   predicted    -0.1395988E-02 (  69.28%)
   displ. norm   :     0.1039917 α      lambda       -0.9479167E-03
   maximum displ.:     0.0648553 α      in ANC's #6, #2, #17, ...

........................................................................
.............................. CYCLE    5 ..............................
........................................................................
   1    -39.6813769 -0.396814E+02  0.174E-01    1.69       0.0  T
   2    -39.6814189 -0.419613E-04  0.101E-01    1.70       1.0  T
   3    -39.6813988  0.201380E-04  0.617E-02    1.70       1.0  T
   4    -39.6814211 -0.223790E-04  0.301E-02    1.70       1.0  T
   5    -39.6814404 -0.192439E-04  0.542E-03    1.70       4.0  T
   6    -39.6814406 -0.174893E-06  0.314E-03    1.70       7.0  T
   7    -39.6814406 -0.798985E-07  0.125E-03    1.70      17.4  T
     SCC iter.                  ...        0 min,  0.007 sec
     gradient                   ...        0 min,  0.012 sec
 * total energy  :   -39.1446062 Eh     change       -0.5976021E-03 Eh
   gradient norm :     0.0123833 Eh/α   predicted    -0.4790883E-03 ( -19.83%)
   displ. norm   :     0.1396807 α      lambda       -0.4352492E-03
   maximum displ.:     0.0719441 α      in ANC's #2, #8, #6, ...

........................................................................
.............................. CYCLE    6 ..............................
........................................................................
   1    -39.6801462 -0.396801E+02  0.211E-01    1.68       0.0  T
   2    -39.6801622 -0.160276E-04  0.121E-01    1.69       1.0  T
   3    -39.6801276  0.346534E-04  0.504E-02    1.69       1.0  T
   4    -39.6801656 -0.380366E-04  0.164E-02    1.69       1.3  T
   5    -39.6801710 -0.536548E-05  0.522E-03    1.69       4.2  T
   6    -39.6801711 -0.119905E-06  0.293E-03    1.69       7.4  T
   7    -39.6801712 -0.827470E-07  0.954E-04    1.69      22.9  T
     SCC iter.                  ...        0 min,  0.008 sec
     gradient                   ...        0 min,  0.012 sec
 * total energy  :   -39.1449437 Eh     change       -0.3374982E-03 Eh
   gradient norm :     0.0126416 Eh/α   predicted    -0.2218733E-03 ( -34.26%)
   displ. norm   :     0.2523775 α      lambda       -0.6758264E-03
   maximum displ.:     0.1401471 α      in ANC's #8, #6, #2, ...

........................................................................
.............................. CYCLE    7 ..............................
........................................................................
   1    -39.6794141 -0.396794E+02  0.388E-01    1.65       0.0  T
   2    -39.6794474 -0.333002E-04  0.222E-01    1.67       1.0  T
   3    -39.6793127  0.134668E-03  0.904E-02    1.67       1.0  T
   4    -39.6794646 -0.151859E-03  0.211E-02    1.67       1.0  T
   5    -39.6794719 -0.728494E-05  0.929E-03    1.67       2.3  T
   6    -39.6794725 -0.591097E-06  0.431E-03    1.67       5.1  T
   7    -39.6794726 -0.115234E-06  0.158E-03    1.67      13.8  T
   8    -39.6794726 -0.825982E-08  0.497E-04    1.67      43.9  T
     SCC iter.                  ...        0 min,  0.008 sec
     gradient                   ...        0 min,  0.012 sec
 * total energy  :   -39.1454157 Eh     change       -0.4720227E-03 Eh
   gradient norm :     0.0142185 Eh/α   predicted    -0.3594371E-03 ( -23.85%)
   displ. norm   :     0.2190924 α      lambda       -0.6481935E-03
   maximum displ.:     0.1155741 α      in ANC's #8, #2, #6, ...

........................................................................
.............................. CYCLE    8 ..............................
........................................................................
   1    -39.6813867 -0.396814E+02  0.321E-01    1.66       0.0  T
   2    -39.6814162 -0.294935E-04  0.184E-01    1.66       1.0  T
   3    -39.6813946  0.215370E-04  0.438E-02    1.67       1.0  T
   4    -39.6814239 -0.292486E-04  0.156E-02    1.66       1.4  T
   5    -39.6814267 -0.278003E-05  0.953E-03    1.66       2.3  T
   6    -39.6814280 -0.132552E-05  0.392E-03    1.66       5.6  T
   7    -39.6814281 -0.594741E-07  0.133E-03    1.66      16.4  T
   8    -39.6814281 -0.122441E-07  0.437E-04    1.66      49.9  T
     SCC iter.                  ...        0 min,  0.008 sec
     gradient                   ...        0 min,  0.012 sec
 * total energy  :   -39.1458278 Eh     change       -0.4120974E-03 Eh
   gradient norm :     0.0076141 Eh/α   predicted    -0.3396547E-03 ( -17.58%)
   displ. norm   :     0.4530002 α      lambda       -0.8041188E-03
   maximum displ.:     0.2730007 α      in ANC's #8, #6, #2, ...

........................................................................
.............................. CYCLE    9 ..............................
........................................................................
   1    -39.6756481 -0.396756E+02  0.702E-01    1.49       0.0  T
   2    -39.6760541 -0.406047E-03  0.395E-01    1.56       1.0  T
   3    -39.6751793  0.874789E-03  0.235E-01    1.57       1.0  T
   4    -39.6761349 -0.955527E-03  0.715E-02    1.57       1.0  T
   5    -39.6762110 -0.760911E-04  0.305E-02    1.57       1.0  T
   6    -39.6762256 -0.146830E-04  0.104E-02    1.57       2.1  T
   7    -39.6762259 -0.287921E-06  0.472E-03    1.57       4.6  T
   8    -39.6762260 -0.560654E-07  0.129E-03    1.57      16.9  T
   9    -39.6762260 -0.619561E-08  0.777E-04    1.57      28.1  T
     SCC iter.                  ...        0 min,  0.009 sec
     gradient                   ...        0 min,  0.012 sec
 * total energy  :   -39.1450272 Eh     change        0.8005454E-03 Eh
   gradient norm :     0.0448829 Eh/α   predicted    -0.4845668E-03 (-160.53%)
   displ. norm   :     0.2126039 α      lambda       -0.3053994E-02
   maximum displ.:     0.1419183 α      in ANC's #8, #6, #2, ...

........................................................................
.............................. CYCLE   10 ..............................
........................................................................
   1    -39.6847367 -0.396847E+02  0.373E-01    1.71       0.0  T
   2    -39.6850365 -0.299798E-03  0.203E-01    1.67       1.0  T
   3    -39.6847674  0.269062E-03  0.144E-01    1.66       1.0  T
   4    -39.6850656 -0.298141E-03  0.594E-02    1.66       1.0  T
   5    -39.6851113 -0.457586E-04  0.203E-02    1.66       1.1  T
   6    -39.6851181 -0.678867E-05  0.606E-03    1.66       3.6  T
   7    -39.6851182 -0.111397E-06  0.294E-03    1.66       7.4  T
   8    -39.6851183 -0.141113E-07  0.956E-04    1.66      22.8  T
     SCC iter.                  ...        0 min,  0.008 sec
     gradient                   ...        0 min,  0.012 sec
 * total energy  :   -39.1462219 Eh     change       -0.1194629E-02 Eh
   gradient norm :     0.0064928 Eh/α   predicted    -0.1596021E-02 (  33.60%)
   displ. norm   :     0.0762521 α      lambda       -0.2077664E-03
   maximum displ.:     0.0340645 α      in ANC's #4, #8, #2, ...

........................................................................
.............................. CYCLE   11 ..............................
........................................................................
   1    -39.6835475 -0.396835E+02  0.102E-01    1.64       0.0  T
   2    -39.6835531 -0.556501E-05  0.581E-02    1.65       1.0  T
   3    -39.6835460  0.703965E-05  0.233E-02    1.65       1.0  T
   4    -39.6835535 -0.751475E-05  0.904E-03    1.65       2.4  T
   5    -39.6835550 -0.145372E-05  0.324E-03    1.65       6.7  T
   6    -39.6835551 -0.130490E-06  0.144E-03    1.65      15.1  T
   7    -39.6835551 -0.103188E-07  0.696E-04    1.65      31.3  T
     SCC iter.                  ...        0 min,  0.008 sec
     gradient                   ...        0 min,  0.012 sec
 * total energy  :   -39.1463595 Eh     change       -0.1376577E-03 Eh
   gradient norm :     0.0034319 Eh/α   predicted    -0.1044859E-03 ( -24.10%)
   displ. norm   :     0.1907372 α      lambda       -0.2071791E-03
   maximum displ.:     0.0936132 α      in ANC's #6, #8, #4, ...

........................................................................
.............................. CYCLE   12 ..............................
........................................................................
   1    -39.6816783 -0.396817E+02  0.272E-01    1.61       0.0  T
   2    -39.6817029 -0.246233E-04  0.155E-01    1.63       1.0  T
   3    -39.6816628  0.400855E-04  0.524E-02    1.63       1.0  T
   4    -39.6817103 -0.474946E-04  0.158E-02    1.63       1.4  T
   5    -39.6817135 -0.322312E-05  0.864E-03    1.63       2.5  T
   6    -39.6817145 -0.971927E-06  0.348E-03    1.63       6.3  T
   7    -39.6817145 -0.503183E-07  0.128E-03    1.63      17.1  T
   8    -39.6817145 -0.648907E-08  0.470E-04    1.63      46.4  T
   9    -39.6817145 -0.656925E-09  0.232E-04    1.63      94.2  T
     SCC iter.                  ...        0 min,  0.009 sec
     gradient                   ...        0 min,  0.013 sec
 * total energy  :   -39.1464817 Eh     change       -0.1221792E-03 Eh
   gradient norm :     0.0096399 Eh/α   predicted    -0.1073591E-03 ( -12.13%)
   displ. norm   :     0.0858378 α      lambda       -0.1011091E-03
   maximum displ.:     0.0367072 α      in ANC's #4, #8, #6, ...

........................................................................
.............................. CYCLE   13 ..............................
........................................................................
   1    -39.6817754 -0.396818E+02  0.118E-01    1.63       0.0  T
   2    -39.6817797 -0.428699E-05  0.676E-02    1.63       1.0  T
   3    -39.6817771  0.252674E-05  0.166E-02    1.63       1.3  T
   4    -39.6817813 -0.421876E-05  0.475E-03    1.63       4.6  T
   5    -39.6817815 -0.186939E-06  0.305E-03    1.63       7.1  T
   6    -39.6817816 -0.767143E-07  0.159E-03    1.63      13.8  T
   7    -39.6817816 -0.259548E-07  0.634E-04    1.63      34.4  T
     SCC iter.                  ...        0 min,  0.007 sec
     gradient                   ...        0 min,  0.012 sec
 * total energy  :   -39.1465598 Eh     change       -0.7810818E-04 Eh
   gradient norm :     0.0078641 Eh/α   predicted    -0.5092832E-04 ( -34.80%)
   displ. norm   :     0.1793921 α      lambda       -0.2185352E-03
   maximum displ.:     0.0872391 α      in ANC's #6, #2, #8, ...

........................................................................
.............................. CYCLE   14 ..............................
........................................................................
   1    -39.6828642 -0.396829E+02  0.245E-01    1.64       0.0  T
   2    -39.6828960 -0.318001E-04  0.141E-01    1.64       1.0  T
   3    -39.6828537  0.422806E-04  0.586E-02    1.63       1.0  T
   4    -39.6828979 -0.441883E-04  0.256E-02    1.64       1.0  T
   5    -39.6829106 -0.126611E-04  0.640E-03    1.64       3.4  T
   6    -39.6829108 -0.179635E-06  0.355E-03    1.63       6.2  T
   7    -39.6829109 -0.104553E-06  0.149E-03    1.64      14.7  T
   8    -39.6829109 -0.157602E-07  0.475E-04    1.64      45.9  T
     SCC iter.                  ...        0 min,  0.008 sec
     gradient                   ...        0 min,  0.012 sec
 * total energy  :   -39.1466609 Eh     change       -0.1010858E-03 Eh
   gradient norm :     0.0080370 Eh/α   predicted    -0.1127948E-03 (  11.58%)
   displ. norm   :     0.1455034 α      lambda       -0.1257454E-03
   maximum displ.:     0.0758851 α      in ANC's #8, #2, #6, ...

........................................................................
.............................. CYCLE   15 ..............................
........................................................................
   1    -39.6824514 -0.396825E+02  0.202E-01    1.62       0.0  T
   2    -39.6824702 -0.188239E-04  0.116E-01    1.62       1.0  T
   3    -39.6824344  0.357736E-04  0.509E-02    1.63       1.0  T
   4    -39.6824731 -0.387023E-04  0.195E-02    1.63       1.1  T
   5    -39.6824805 -0.742891E-05  0.510E-03    1.63       4.3  T
   6    -39.6824807 -0.138069E-06  0.294E-03    1.63       7.4  T
   7    -39.6824807 -0.603756E-07  0.937E-04    1.63      23.3  T
     SCC iter.                  ...        0 min,  0.008 sec
     gradient                   ...        0 min,  0.012 sec
 * total energy  :   -39.1467343 Eh     change       -0.7340028E-04 Eh
   gradient norm :     0.0049960 Eh/α   predicted    -0.6420575E-04 ( -12.53%)
   displ. norm   :     0.0486379 α      lambda       -0.7721537E-04
   maximum displ.:     0.0195423 α      in ANC's #4, #8, #3, ...

........................................................................
.............................. CYCLE   16 ..............................
........................................................................
   1    -39.6843016 -0.396843E+02  0.635E-02    1.65       0.0  T
   2    -39.6843211 -0.194554E-04  0.343E-02    1.64       1.0  T
   3    -39.6843226 -0.151160E-05  0.198E-02    1.64       1.1  T
   4    -39.6843225  0.120323E-06  0.112E-02    1.64       1.9  T
   5    -39.6843241 -0.163812E-05  0.530E-03    1.64       4.1  T
   6    -39.6843246 -0.495624E-06  0.159E-03    1.64      13.7  T
   7    -39.6843246 -0.217061E-07  0.892E-04    1.64      24.5  T
     SCC iter.                  ...        0 min,  0.008 sec
     gradient                   ...        0 min,  0.012 sec
 * total energy  :   -39.1467217 Eh     change        0.1256869E-04 Eh
   gradient norm :     0.0093406 Eh/α   predicted    -0.3870280E-04 (-407.93%)
   displ. norm   :     0.1268504 α      lambda       -0.1180529E-03
   maximum displ.:     0.0613686 α      in ANC's #8, #6, #2, ...

........................................................................
.............................. CYCLE   17 ..............................
........................................................................
   1    -39.6828681 -0.396829E+02  0.176E-01    1.61       0.0  T
   2    -39.6828873 -0.191335E-04  0.100E-01    1.62       1.0  T
   3    -39.6828732  0.140438E-04  0.359E-02    1.62       1.0  T
   4    -39.6828889 -0.157090E-04  0.148E-02    1.62       1.5  T
   5    -39.6828928 -0.389044E-05  0.611E-03    1.62       3.6  T
   6    -39.6828933 -0.510018E-06  0.257E-03    1.62       8.5  T
   7    -39.6828934 -0.263049E-07  0.134E-03    1.62      16.3  T
     SCC iter.                  ...        0 min,  0.008 sec
     gradient                   ...        0 min,  0.012 sec
 * total energy  :   -39.1467898 Eh     change       -0.6805661E-04 Eh
   gradient norm :     0.0041489 Eh/α   predicted    -0.5997610E-04 ( -11.87%)
   displ. norm   :     0.0322563 α      lambda       -0.2361301E-04
   maximum displ.:     0.0181196 α      in ANC's #1, #6, #8, ...

........................................................................
.............................. CYCLE   18 ..............................
........................................................................
   1    -39.6830551 -0.396831E+02  0.402E-02    1.62       0.0  T
   2    -39.6830573 -0.222464E-05  0.232E-02    1.63       1.0  T
   3    -39.6830570  0.348299E-06  0.119E-02    1.62       1.8  T
   4    -39.6830578 -0.860599E-06  0.435E-03    1.63       5.0  T
   5    -39.6830582 -0.358563E-06  0.126E-03    1.62      17.3  T
   6    -39.6830582 -0.114363E-07  0.775E-04    1.62      28.2  T
     SCC iter.                  ...        0 min,  0.007 sec
     gradient                   ...        0 min,  0.012 sec
 * total energy  :   -39.1468054 Eh     change       -0.1558871E-04 Eh
   gradient norm :     0.0024877 Eh/α   predicted    -0.1182356E-04 ( -24.15%)
   displ. norm   :     0.0934803 α      lambda       -0.2486774E-04
   maximum displ.:     0.0439464 α      in ANC's #8, #6, #1, ...

........................................................................
.............................. CYCLE   19 ..............................
........................................................................
   1    -39.6829141 -0.396829E+02  0.122E-01    1.62       0.0  T
   2    -39.6829178 -0.368152E-05  0.704E-02    1.62       1.0  T
   3    -39.6829155  0.230807E-05  0.152E-02    1.62       1.4  T
   4    -39.6829194 -0.388856E-05  0.539E-03    1.62       4.1  T
   5    -39.6829198 -0.399041E-06  0.276E-03    1.62       7.9  T
   6    -39.6829198 -0.401077E-07  0.119E-03    1.62      18.4  T
   7    -39.6829198 -0.133079E-07  0.382E-04    1.62      57.1  T
   8    -39.6829198 -0.148228E-08  0.916E-05    1.62     238.2  T
     SCC iter.                  ...        0 min,  0.008 sec
     gradient                   ...        0 min,  0.013 sec
 * total energy  :   -39.1468232 Eh     change       -0.1784702E-04 Eh
   gradient norm :     0.0036710 Eh/α   predicted    -0.1254458E-04 ( -29.71%)
   displ. norm   :     0.0982288 α      lambda       -0.4208642E-04
   maximum displ.:     0.0439507 α      in ANC's #1, #8, #3, ...

........................................................................
.............................. CYCLE   20 ..............................
........................................................................
   1    -39.6833717 -0.396834E+02  0.114E-01    1.63       0.0  T
   2    -39.6833758 -0.408575E-05  0.655E-02    1.63       1.0  T
   3    -39.6833759 -0.107165E-06  0.920E-03    1.63       2.4  T
   4    -39.6833762 -0.305018E-06  0.748E-03    1.63       2.9  T
   5    -39.6833773 -0.107694E-05  0.202E-03    1.63      10.8  T
   6    -39.6833773 -0.785796E-08  0.102E-03    1.63      21.3  T
   7    -39.6833773 -0.842179E-08  0.323E-04    1.63      67.6  T
   8    -39.6833773 -0.156796E-08  0.109E-04    1.63     199.5  T
     SCC iter.                  ...        0 min,  0.009 sec
     gradient                   ...        0 min,  0.013 sec
 * total energy  :   -39.1468472 Eh     change       -0.2398069E-04 Eh
   gradient norm :     0.0028157 Eh/α   predicted    -0.2125015E-04 ( -11.39%)
   displ. norm   :     0.2051357 α      lambda       -0.4115931E-04
   maximum displ.:     0.0953872 α      in ANC's #8, #1, #39, ...
 * RMSD in coord.:     0.5407134 α      energy gain  -0.1552867E-01 Eh

generating ANC from model Hessian ...
Using Lindh-Hessian (1995)
 Shifting diagonal of input Hessian by   3.612876622557661E-003
 Lowest  eigenvalues of input Hessian
   -0.000000   -0.000000   -0.000000    0.000000    0.000000    0.000000
    0.005000    0.007683    0.009193    0.009825    0.013709    0.017705
    0.018197    0.020149    0.025217    0.027113    0.034852    0.046556
 Highest eigenvalues
    1.842346    1.951706    2.019231    2.079704    2.201127    2.599364
 

........................................................................
.............................. CYCLE   21 ..............................
........................................................................
   1    -39.6821224 -0.396821E+02  0.262E-01    1.61       0.0  T
   2    -39.6821438 -0.214149E-04  0.151E-01    1.61       1.0  T
   3    -39.6820854  0.584792E-04  0.572E-02    1.62       1.0  T
   4    -39.6821533 -0.679519E-04  0.136E-02    1.62       1.6  T
   5    -39.6821558 -0.244522E-05  0.619E-03    1.61       3.5  T
   6    -39.6821560 -0.271031E-06  0.326E-03    1.61       6.7  T
   7    -39.6821561 -0.361663E-07  0.108E-03    1.61      20.1  T
   8    -39.6821561 -0.114180E-07  0.269E-04    1.61      81.1  T
   9    -39.6821561 -0.186567E-09  0.124E-04    1.61     175.6  T
     SCC iter.                  ...        0 min,  0.009 sec
     gradient                   ...        0 min,  0.013 sec
 * total energy  :   -39.1468376 Eh     change        0.9604971E-05 Eh
   gradient norm :     0.0075060 Eh/α   predicted     0.0000000E+00 (-100.00%)
   displ. norm   :     0.0185442 α      lambda       -0.5276598E-04
   maximum displ.:     0.0105534 α      in ANC's #2, #9, #5, ...

........................................................................
.............................. CYCLE   22 ..............................
........................................................................
   1    -39.6828663 -0.396829E+02  0.257E-02    1.63       0.0  T
   2    -39.6828693 -0.295492E-05  0.136E-02    1.62       1.6  T
   3    -39.6828683  0.997338E-06  0.105E-02    1.62       2.1  T
   4    -39.6828697 -0.139476E-05  0.529E-03    1.62       4.1  T
   5    -39.6828699 -0.258610E-06  0.182E-03    1.62      12.0  T
   6    -39.6828700 -0.491087E-07  0.565E-04    1.62      38.6  T
     SCC iter.                  ...        0 min,  0.007 sec
     gradient                   ...        0 min,  0.012 sec
 * total energy  :   -39.1468713 Eh     change       -0.3368920E-04 Eh
   gradient norm :     0.0026965 Eh/α   predicted    -0.2639326E-04 ( -21.66%)
   displ. norm   :     0.0180062 α      lambda       -0.1655631E-04
   maximum displ.:     0.0126433 α      in ANC's #2, #3, #14, ...

........................................................................
.............................. CYCLE   23 ..............................
........................................................................
   1    -39.6832993 -0.396833E+02  0.245E-02    1.63       0.0  T
   2    -39.6833004 -0.108124E-05  0.138E-02    1.63       1.6  T
   3    -39.6832988  0.154081E-05  0.104E-02    1.63       2.1  T
   4    -39.6833006 -0.175779E-05  0.369E-03    1.63       5.9  T
   5    -39.6833007 -0.144001E-06  0.142E-03    1.63      15.3  T
   6    -39.6833007 -0.294530E-07  0.462E-04    1.63      47.2  T
   7    -39.6833007 -0.762185E-09  0.209E-04    1.63     104.2  T
     SCC iter.                  ...        0 min,  0.008 sec
     gradient                   ...        0 min,  0.013 sec
 * total energy  :   -39.1468739 Eh     change       -0.2602297E-05 Eh
   gradient norm :     0.0018708 Eh/α   predicted    -0.8281428E-05 ( 218.24%)
   displ. norm   :     0.0165117 α      lambda       -0.9787959E-05
   maximum displ.:     0.0095091 α      in ANC's #2, #7, #4, ...

........................................................................
.............................. CYCLE   24 ..............................
........................................................................
   1    -39.6832725 -0.396833E+02  0.245E-02    1.63       0.0  T
   2    -39.6832726 -0.133875E-06  0.144E-02    1.63       1.5  T
   3    -39.6832725  0.828409E-07  0.294E-03    1.63       7.4  T
   4    -39.6832727 -0.124563E-06  0.142E-03    1.63      15.4  T
   5    -39.6832727 -0.259391E-07  0.714E-04    1.63      30.6  T
   6    -39.6832727 -0.580626E-08  0.343E-04    1.63      63.6  T
     SCC iter.                  ...        0 min,  0.007 sec
     gradient                   ...        0 min,  0.013 sec
 * total energy  :   -39.1468777 Eh     change       -0.3800375E-05 Eh
   gradient norm :     0.0011883 Eh/α   predicted    -0.4901613E-05 (  28.98%)
   displ. norm   :     0.0095009 α      lambda       -0.3155127E-05
   maximum displ.:     0.0063762 α      in ANC's #2, #3, #8, ...

........................................................................
.............................. CYCLE   25 ..............................
........................................................................
   1    -39.6831411 -0.396831E+02  0.105E-02    1.63       0.0  T
   2    -39.6831412 -0.916228E-07  0.608E-03    1.63       3.6  T
   3    -39.6831411  0.141276E-06  0.300E-03    1.63       7.3  T
   4    -39.6831412 -0.132204E-06  0.133E-03    1.63      16.4  T
   5    -39.6831412 -0.320851E-07  0.300E-04    1.63      72.8  T
   6    -39.6831412 -0.805734E-09  0.165E-04    1.63     132.0  T
     SCC iter.                  ...        0 min,  0.007 sec
     gradient                   ...        0 min,  0.013 sec
 * total energy  :   -39.1468803 Eh     change       -0.2641511E-05 Eh
   gradient norm :     0.0002997 Eh/α   predicted    -0.1580252E-05 ( -40.18%)
   displ. norm   :     0.0152477 α      lambda       -0.1119362E-05
   maximum displ.:     0.0109178 α      in ANC's #2, #3, #7, ...

   *** GEOMETRY OPTIMIZATION CONVERGED AFTER 25 ITERATIONS ***

------------------------------------------------------------------------
 total energy gain   :        -0.0155618 Eh       -9.7652 kcal/mol
 total RMSD          :         0.5384661 a0        0.2849 Å
 total power (kW/mol):        -1.6342994 (step)  -53.8439 (real)
------------------------------------------------------------------------

 ANCopt (total)                0 d,  0 h,  0 min,  0.759 sec
 optimizer setup                ...        0 min,  0.000 sec (  0.019%)
 model hessian                  ...        0 min,  0.006 sec (  0.726%)
 ANC generation                 ...        0 min,  0.001 sec (  0.160%)
 coordinate transformation      ...        0 min,  0.000 sec (  0.050%)
 single point calculation       ...        0 min,  0.741 sec ( 97.611%)
 optimization log               ...        0 min,  0.002 sec (  0.294%)
 hessian update                 ...        0 min,  0.000 sec (  0.040%)
 rational function              ...        0 min,  0.007 sec (  0.898%)

================
 final structure:
================
$coord
   -3.05538212097508    2.40786652071992   -0.07344315102944      C 
   -5.08647673902071   -0.09012393851262   -0.10545120652462      S 
   -2.67933024845151   -2.28820460871622   -0.11474524273372      C 
   -0.33497142662882   -1.08191051022394   -0.02294961257689      C 
   -0.57414561707894    1.63975704616478   -0.02522365052497      C 
    1.68606627584266    3.10685381811666    0.03874058255649      C 
    1.61912091863087    5.80615748212596   -0.00093464209207      N 
   -0.42800111596065    6.85421195848053   -0.05993305376877      O 
    3.62763426237416    6.92564916815665    0.02222747797255      O 
    3.99740560647210    1.93057150679047    0.16057274341287      C 
    4.18912876232502   -0.70882442333686    0.27282605743169      C 
    2.07370259943644   -2.19434781847222    0.19410111224759      C 
   -3.34051967221238   -4.92319761168564   -0.24850576189329      C 
   -1.93960944737749   -6.77311443026351   -1.22046297094869      C 
   -3.77827918057231    4.29662915076277   -0.10039877683063      H 
    5.67777661705040    3.08693360336400    0.20757943916045      H 
    6.03436897679006   -1.55881371251847    0.43851042490026      H 
    2.23201682060920   -4.21901450403492    0.34762831845994      H 
   -5.21814948552060   -5.35485914864513    0.44296406009652      H 
   -0.12055236617460   -6.44737148788462   -2.06604945523579      H 
   -2.62006001433292   -8.68865408145517   -1.24899884222209      H 
$end
           -------------------------------------------------
          |                Final Singlepoint                |
           -------------------------------------------------

          ...................................................
          :                      SETUP                      :
          :.................................................:
          :  # basis functions                  69          :
          :  # atomic orbitals                  68          :
          :  # shells                           36          :
          :  # electrons                        70          :
          :  max. iterations                   250          :
          :  Hamiltonian                  GFN2-xTB          :
          :  restarted?                      false          :
          :  GBSA solvation                  false          :
          :  PC potential                    false          :
          :  electronic temp.          300.0000000     K    :
          :  accuracy                    1.0000000          :
          :  -> integral cutoff          0.2500000E+02      :
          :  -> integral neglect         0.1000000E-07      :
          :  -> SCF convergence          0.1000000E-05 Eh   :
          :  -> wf. convergence          0.1000000E-03 e    :
          :  Broyden damping             0.4000000          :
          ...................................................

 iter      E             dE          RMSdq      gap      omega  full diag
   1    -39.6831412 -0.396831E+02  0.589E-05    1.63       0.0  T
   2    -39.6831412 -0.779465E-11  0.297E-05    1.63     735.5  T
   3    -39.6831412 -0.390799E-11  0.272E-05    1.63     803.0  T

   *** convergence criteria satisfied after 3 iterations ***

         #    Occupation            Energy/Eh            Energy/eV
      -------------------------------------------------------------
         1        2.0000           -0.7618255             -20.7303
       ...           ...                  ...                  ...
        29        2.0000           -0.4603768             -12.5275
        30        2.0000           -0.4535320             -12.3412
        31        2.0000           -0.4414975             -12.0138
        32        2.0000           -0.4391728             -11.9505
        33        2.0000           -0.4277309             -11.6392
        34        2.0000           -0.4248827             -11.5616
        35        2.0000           -0.3869823             -10.5303 (HOMO)
        36                         -0.3271016              -8.9009 (LUMO)
        37                         -0.2882130              -7.8427
        38                         -0.2428303              -6.6077
        39                         -0.2247894              -6.1168
        40                         -0.2191073              -5.9622
       ...                                ...                  ...
        68                          0.7088525              19.2889
      -------------------------------------------------------------
                  HL-Gap            0.0598807 Eh            1.6294 eV
             Fermi-level           -0.3570419 Eh           -9.7156 eV

 SCC (total)                   0 d,  0 h,  0 min,  0.026 sec
 SCC setup                      ...        0 min,  0.000 sec (  0.655%)
 Dispersion                     ...        0 min,  0.000 sec (  0.688%)
 integral evaluation            ...        0 min,  0.009 sec ( 32.444%)
 zeroth order Hamiltonian       ...        0 min,  0.000 sec (  0.575%)
 iterations                     ...        0 min,  0.004 sec ( 14.649%)
 molecular gradient             ...        0 min,  0.013 sec ( 49.509%)
 printout                       ...        0 min,  0.000 sec (  1.245%)

         :::::::::::::::::::::::::::::::::::::::::::::::::::::
         ::                     SUMMARY                     ::
         :::::::::::::::::::::::::::::::::::::::::::::::::::::
         :: total energy             -39.146880329312 Eh    ::
         :: gradient norm              0.000299534591 Eh/a0 ::
         :: HOMO-LUMO gap              1.629436575176 eV    ::
         ::.................................................::
         :: SCC energy               -39.683141237475 Eh    ::
         :: -> isotropic ES            0.053149167983 Eh    ::
         :: -> anisotropic ES          0.006426572659 Eh    ::
         :: -> anisotropic XC          0.010065058364 Eh    ::
         :: -> dispersion             -0.023869120784 Eh    ::
         :: repulsion energy           0.536196337359 Eh    ::
         :: add. restraining           0.000000000000 Eh    ::
         :::::::::::::::::::::::::::::::::::::::::::::::::::::

           -------------------------------------------------
          |                Property Printout                |
           -------------------------------------------------

    * Orbital Energies and Occupations

         #    Occupation            Energy/Eh            Energy/eV
      -------------------------------------------------------------
         1        2.0000           -0.7618255             -20.7303
       ...           ...                  ...                  ...
        23        2.0000           -0.4917339             -13.3808
        24        2.0000           -0.4861547             -13.2289
        25        2.0000           -0.4783805             -13.0174
        26        2.0000           -0.4728645             -12.8673
        27        2.0000           -0.4683540             -12.7446
        28        2.0000           -0.4618195             -12.5667
        29        2.0000           -0.4603768             -12.5275
        30        2.0000           -0.4535320             -12.3412
        31        2.0000           -0.4414975             -12.0138
        32        2.0000           -0.4391728             -11.9505
        33        2.0000           -0.4277309             -11.6392
        34        2.0000           -0.4248827             -11.5616
        35        2.0000           -0.3869823             -10.5303 (HOMO)
        36                         -0.3271016              -8.9009 (LUMO)
        37                         -0.2882130              -7.8427
        38                         -0.2428303              -6.6077
        39                         -0.2247894              -6.1168
        40                         -0.2191073              -5.9622
        41                         -0.1900298              -5.1710
        42                         -0.1352225              -3.6796
        43                         -0.1118936              -3.0448
        44                         -0.0213621              -0.5813
        45                         -0.0044446              -0.1209
        46                          0.0089266               0.2429
       ...                                ...                  ...
        68                          0.7088525              19.2889
      -------------------------------------------------------------
                  HL-Gap            0.0598807 Eh            1.6294 eV
             Fermi-level           -0.3570419 Eh           -9.7156 eV

     #   Z        covCN         q      C6AA      α(0)
     1   6 C      2.923    -0.035    28.861     8.810
     2  16 S      2.353     0.049   139.058    19.847
     3   6 C      2.975     0.014    27.697     8.633
     4   6 C      3.167    -0.002    27.720     8.603
     5   6 C      3.170     0.005    27.545     8.575
     6   6 C      2.902    -0.005    28.145     8.699
     7   7 N      2.761     0.534    13.651     5.487
     8   8 O      0.929    -0.404    21.723     6.251
     9   8 O      0.930    -0.399    21.617     6.235
    10   6 C      2.918    -0.018    28.448     8.746
    11   6 C      2.915    -0.030    28.757     8.794
    12   6 C      2.910    -0.019    28.480     8.751
    13   6 C      2.938    -0.029    28.726     8.790
    14   6 C      2.838    -0.087    30.159     9.000
    15   1 H      0.927     0.089     1.886     2.148
    16   1 H      0.926     0.080     1.974     2.197
    17   1 H      0.926     0.051     2.309     2.376
    18   1 H      0.926     0.054     2.274     2.358
    19   1 H      0.925     0.050     2.315     2.379
    20   1 H      0.926     0.049     2.334     2.389
    21   1 H      0.926     0.051     2.312     2.378

 Mol. C6AA /au·bohr⁶  :       7800.914849
 Mol. C8AA /au·bohr⁸  :     215033.327257
 Mol. α(0) /au        :        141.445287


Wiberg/Mayer (AO) data.
largest (>0.10) Wiberg bond orders for each atom
          total WBO             WBO to atom ...
     1  C   3.943        C    5 1.477    S    2 1.241    H   15 0.959    C    3 0.121
     2  S   2.744        C    1 1.241    C    3 1.204
     3  C   3.945        C    4 1.359    S    2 1.204    C   13 1.138    C    1 0.121
     4  C   3.987        C    3 1.359    C   12 1.270    C    5 1.151
     5  C   3.987        C    1 1.477    C    6 1.183    C    4 1.151
     6  C   3.954        C   10 1.490    C    5 1.183    N    7 0.994
     7  N   3.907        O    9 1.430    O    8 1.425    C    6 0.994
     8  O   1.914        N    7 1.425    O    9 0.342
     9  O   1.909        N    7 1.430    O    8 0.342
    10  C   3.984        C    6 1.490    C   11 1.321    H   16 0.959
    11  C   3.991        C   12 1.543    C   10 1.321    H   17 0.969
    12  C   3.990        C   11 1.543    C    4 1.270    H   18 0.962
    13  C   3.989        C   14 1.855    C    3 1.138    H   19 0.959
    14  C   3.978        C   13 1.855    H   21 0.977    H   20 0.972
    15  H   0.991        C    1 0.959
    16  H   0.992        C   10 0.959
    17  H   0.996        C   11 0.969
    18  H   0.996        C   12 0.962
    19  H   0.996        C   13 0.959
    20  H   0.998        C   14 0.972
    21  H   0.997        C   14 0.977

molecular dipole:
                 x           y           z       tot (Debye)
 q only:       -0.428      -2.493       0.015
   full:       -0.212      -2.491       0.022       6.355
molecular quadrupole (traceless):
                xx          xy          yy          xz          yz          zz
 q only:       10.342      -5.210     -16.033       0.095       0.524       5.691
  q+dip:        9.947      -5.988     -14.262      -0.563       0.722       4.315
   full:        7.951      -5.977     -15.994      -0.238       0.580       8.043

           -------------------------------------------------
          |                Geometry Summary                 |
           -------------------------------------------------

      molecular mass/u    :      205.2308000
   center of mass at/Å    :       -0.2235741       0.4464806      -0.0476292
  moments of inertia/u·Å² :        0.4185342E+03   0.1084604E+04   0.1492948E+04
rotational constants/cm⁻¹ :        0.4027779E-01   0.1554267E-01   0.1129151E-01

 * 20 selected distances

     #   Z        #   Z                                     value/Å
     1   6 C      2  16 S                                 1.7037804
     2  16 S      3   6 C                                 1.7249879 (max)
     3   6 C      4   6 C                                 1.3960244
     1   6 C      5   6 C                                 1.3747259
     4   6 C      5   6 C                                 1.4457955
     5   6 C      6   6 C                                 1.4263288
     7   7 N      8   8 O                                 1.2174076
     7   7 N      9   8 O                                 1.2168689
     6   6 C     10   6 C                                 1.3739028
    10   6 C     11   6 C                                 1.4016476
     4   6 C     12   6 C                                 1.4086792
    11   6 C     12   6 C                                 1.3685147
    13   6 C     14   6 C                                 1.3313244
     1   6 C     15   1 H                                 1.0702904 (min)
    10   6 C     16   1 H                                 1.0797070
    11   6 C     17   1 H                                 1.0786451
    12   6 C     18   1 H                                 1.0777444
    13   6 C     19   1 H                                 1.0831931
    14   6 C     20   1 H                                 1.0754275
    14   6 C     21   1 H                                 1.0758213

 * 4 distinct bonds (by element types)

   Z      Z             #   av. dist./Å        max./Å        min./Å
   1 H    6 C           7     1.0772613     1.0831931     1.0702904
   6 C    6 C           9     1.3918826     1.4457955     1.3313244
   7 N    8 O           2     1.2171382     1.2174076     1.2168689
   6 C   16 S           2     1.7143842     1.7249879     1.7037804


optimized geometry written to: xtbopt.xyz


           -------------------------------------------------
          | TOTAL ENERGY              -39.146880329312 Eh   |
          | GRADIENT NORM               0.000299534591 Eh/α |
          | HOMO-LUMO GAP               1.629436575176 eV   |
           -------------------------------------------------

------------------------------------------------------------------------
 * finished run on 2021/05/19 at 11:01:02.488     
------------------------------------------------------------------------
 total:
 * wall-time:     0 d,  0 h,  0 min,  0.844 sec
 *  cpu-time:     0 d,  0 h,  0 min,  0.842 sec
 * ratio c/w:     0.997 speedup
 SCF:
 * wall-time:     0 d,  0 h,  0 min,  0.038 sec
 *  cpu-time:     0 d,  0 h,  0 min,  0.038 sec
 * ratio c/w:     0.998 speedup
 ANC optimizer:
 * wall-time:     0 d,  0 h,  0 min,  0.786 sec
 *  cpu-time:     0 d,  0 h,  0 min,  0.784 sec
 * ratio c/w:     0.998 speedup

