      -----------------------------------------------------------      
     |                   =====================                   |     
     |                           x T B                           |     
     |                   =====================                   |     
     |                         S. Grimme                         |     
     |          Mulliken Center for Theoretical Chemistry        |     
     |                    University of Bonn                     |     
     |                Version 6.2 RC2 (SAW190805)                |     
      -----------------------------------------------------------      

   This program is distributed in the hope that it will be useful,
   but WITHOUT ANY WARRANTY; without even the implied warranty of
   MERCHANTABILITY or FITNESS FOR A PARTICULAR PURPOSE.
   
   FOR NON-COMMERCIAL, ACADEMIA USE ONLY.
   
   Cite this work as:
   * S. Grimme, C. Bannwarth, P. Shushkov, J. Chem. Theory Comput., 2017,
     13, 1989-2009. DOI: 10.1021/acs.jctc.7b00118
   * C. Bannwarth, S. Ehlert and S. Grimme., J. Chem. Theory Comput., 2019,
     15, 1652-1671. DOI: 10.1021/acs.jctc.8b01176
   * P. Pracht, E. Caldeweyher, S. Ehlert, S. Grimme, ChemRxiv, 2019, preprint.
     DOI: 10.26434/chemrxiv.8326202.v1
   
   for DFT-D4:
   * E. Caldeweyher, C. Bannwarth and S. Grimme, J. Chem. Phys., 2017,
     147, 034112. DOI: 10.1063/1.4993215
   * E. Caldeweyher, S. Ehlert, A. Hansen, H. Neugebauer, S. Spicher,
     C. Bannwarth and S. Grimme, J. Chem. Phys., 2019, 150, 154122.
     DOI: 10.1063/1.5090222
   
   for sTDA-xTB:
   * S. Grimme and C. Bannwarth, J. Chem. Phys., 2016, 145, 054103.
     DOI: 10.1063/1.4959605
   
   in the mass-spec context:
   * V. Asgeirsson, C. Bauer and S. Grimme, Chem. Sci., 2017, 8, 4879.
     DOI: 10.1039/c7sc00601b
   
   for metadynamics refer to:
   * S. Grimme, J. Chem. Theory Comput., 2019, 155, 2847-2862
     DOI: 10.1021/acs.jctc.9b00143
   
   with help from (in alphabetical order)
   C. Bannwarth, F. Bohle, G. Brandenburg, E. Caldeweyher, M. Checinski,
   S. Dohm, S. Ehlert, S. Ehrlich, F. März, H. Neugebauer, J. Pisarek,
   P. Pracht, P. Shushkov, and S. Spicher.
   
 * started run on 2021/05/19 at 11:01:10.294     

           -------------------------------------------------
          |                Calculation Setup                |
           -------------------------------------------------

          program call               : /ihome/ghutchison/geoffh/xtb/xtb 1047.xyz -opt
          hostname                   : smp-n144
          coordinate file            : 1047.xyz
          omp threads                :                     1
          number of atoms            :                    15
          number of electrons        :                    42
          charge                     :                     0
          spin                       :                   0.0
          first test random number   :      0.08195081910389


########################################################################
# WARNING! Please study the warnings concerning your input carefully
#  - the use of '-opt' is discouraged, please use '--opt' next time
########################################################################

           ------------------------------------------------- 
          |                 G F N 2 - x T B                 |
          | Geometry, Frequencies, Noncovalent interactions |
          |            JCTC 2019 parametrisation            |
           ------------------------------------------------- 
             KAB for C  - Si     :                1.0500
             KAB for H  - Pd     :                0.9500
             k(s)              :                1.8500
             k(p)              :                2.2300
             k(d)              :                2.2300
             k(f)              :                2.0000
             kEN (H0ij)        :               -2.0000
             D4 a1             :                0.5200
             D4 a2             :                5.0000
             D4 s6             :                1.0000
             D4 s8             :                2.7000
             D4 s9             :                5.0000
             alphaj            :                2.0000

  Z AO/shell   Hii/eV     exponent
  1     Wed Apr 25 08:07:45 CEST 2018   EN: 2.200 GM2: 0.406  GM3: 0.0800  RAES: 1.40
     1s    -10.707211    1.230000
  6     Wed Apr 25 08:07:45 CEST 2018   EN: 2.550 GM2: 0.538  GM3: 0.1500  RAES: 3.00
     2s    -13.970922    2.096432
     2p    -10.063292    1.800000
  7     Wed Apr 25 08:07:45 CEST 2018   EN: 3.040 GM2: 0.461  GM3:-0.0640  RAES: 1.90
     2s    -16.686243    2.339881
     2p    -12.523956    2.014332
 16     Tue Apr 24 11:44:34 CEST 2018   EN: 2.580 GM2: 0.340  GM3:-0.0502  RAES: 3.10
     3s    -20.029654    1.981333
     3p    -11.377694    2.025643
     3d     -0.420282    1.702555

           ------------------------------------------------- 
          |        Self-Consistent Charge Iterations        |
           ------------------------------------------------- 

          ...................................................
          :                      SETUP                      :
          :.................................................:
          :  # basis functions                  45          :
          :  # atomic orbitals                  44          :
          :  # shells                           24          :
          :  # electrons                        42          :
          :  max. iterations                   250          :
          :  Hamiltonian                  GFN2-xTB          :
          :  restarted?                      false          :
          :  GBSA solvation                  false          :
          :  PC potential                    false          :
          :  electronic temp.          300.0000000     K    :
          :  accuracy                    1.0000000          :
          :  -> integral cutoff          0.2500000E+02      :
          :  -> integral neglect         0.1000000E-07      :
          :  -> SCF convergence          0.1000000E-05 Eh   :
          :  -> wf. convergence          0.1000000E-03 e    :
          :  Broyden damping             0.4000000          :
          ...................................................

 iter      E             dE          RMSdq      gap      omega  full diag
   1    -22.8168665 -0.228169E+02  0.436E+00    2.79       0.0  T
   2    -22.8570254 -0.401589E-01  0.309E+00    3.05       1.0  T
   3    -22.8682172 -0.111918E-01  0.165E+00    3.11       1.0  T
   4    -22.8767150 -0.849773E-02  0.674E-01    3.02       1.0  T
   5    -22.8790773 -0.236231E-02  0.224E-01    3.02       1.0  T
   6    -22.8793842 -0.306960E-03  0.100E-01    3.04       1.0  T
   7    -22.8794500 -0.657348E-04  0.363E-02    3.03       1.0  T
   8    -22.8794550 -0.499237E-05  0.171E-02    3.03       1.5  T
   9    -22.8794556 -0.623521E-06  0.995E-03    3.03       2.6  T
  10    -22.8794559 -0.282164E-06  0.384E-03    3.03       6.7  T
  11    -22.8794560 -0.949977E-07  0.160E-03    3.03      16.2  T
  12    -22.8794560 -0.516431E-08  0.501E-04    3.03      51.5  T
  13    -22.8794560 -0.225135E-09  0.218E-04    3.03     118.2  T

   *** convergence criteria satisfied after 13 iterations ***

         #    Occupation            Energy/Eh            Energy/eV
      -------------------------------------------------------------
         1        2.0000           -0.7303266             -19.8732
       ...           ...                  ...                  ...
        15        2.0000           -0.4608026             -12.5391
        16        2.0000           -0.4601101             -12.5202
        17        2.0000           -0.4489580             -12.2168
        18        2.0000           -0.4420553             -12.0289
        19        2.0000           -0.4045732             -11.0090
        20        2.0000           -0.3916380             -10.6570
        21        2.0000           -0.3470818              -9.4446 (HOMO)
        22                         -0.2356507              -6.4124 (LUMO)
        23                         -0.2009725              -5.4687
        24                         -0.1878706              -5.1122
        25                         -0.1531790              -4.1682
        26                         -0.1174785              -3.1968
       ...                                ...                  ...
        44                          0.6869975              18.6942
      -------------------------------------------------------------
                  HL-Gap            0.1114310 Eh            3.0322 eV
             Fermi-level           -0.2913662 Eh           -7.9285 eV

 SCC (total)                   0 d,  0 h,  0 min,  0.019 sec
 SCC setup                      ...        0 min,  0.000 sec (  1.169%)
 Dispersion                     ...        0 min,  0.000 sec (  0.882%)
 integral evaluation            ...        0 min,  0.004 sec ( 20.572%)
 zeroth order Hamiltonian       ...        0 min,  0.000 sec (  0.453%)
 iterations                     ...        0 min,  0.008 sec ( 43.068%)
 molecular gradient             ...        0 min,  0.006 sec ( 31.889%)
 printout                       ...        0 min,  0.000 sec (  1.687%)

         :::::::::::::::::::::::::::::::::::::::::::::::::::::
         ::                     SUMMARY                     ::
         :::::::::::::::::::::::::::::::::::::::::::::::::::::
         :: total energy             -22.536918199021 Eh    ::
         :: gradient norm              0.051767871313 Eh/a0 ::
         :: HOMO-LUMO gap              3.032192617396 eV    ::
         ::.................................................::
         :: SCC energy               -22.879455976444 Eh    ::
         :: -> isotropic ES            0.006796486223 Eh    ::
         :: -> anisotropic ES          0.003425262774 Eh    ::
         :: -> anisotropic XC          0.013577001106 Eh    ::
         :: -> dispersion             -0.012080866700 Eh    ::
         :: repulsion energy           0.342562091756 Eh    ::
         :: add. restraining           0.000000000000 Eh    ::
         :::::::::::::::::::::::::::::::::::::::::::::::::::::

      ----------------------------------------------------------- 
     |                   =====================                   |
     |                        A N C O P T                        |
     |                   =====================                   |
     |               Approximate Normal Coordinate               |
     |                Rational Function Optimizer                |
      ----------------------------------------------------------- 

          ...................................................
          :                      SETUP                      :
          :.................................................:
          :   optimization level            normal          :
          :   max. optcycles                   200          :
          :   ANC micro-cycles                  20          :
          :   degrees of freedom                39          :
          :.................................................:
          :   RF solver                   davidson          :
          :   input Hessian                  false          :
          :   write xtbopt.log                true          :
          :   linear?                        false          :
          :   energy convergence         0.5000000E-05 Eh   :
          :   grad. convergence          0.1000000E-02 Eh/α :
          :   maximium RF displ.         2.0000000          :
          :   Hlow (freq-cutoff)         0.5000000E-02      :
          :   Hmax (freq-cutoff)         5.0000000          :
          :   S6 in model hess.         20.0000000          :
          ...................................................

generating ANC from model Hessian ...
Using Lindh-Hessian (1995)
 Shifting diagonal of input Hessian by   1.866566793443292E-003
 Lowest  eigenvalues of input Hessian
   -0.000000   -0.000000    0.000000    0.000000    0.000000    0.000000
    0.005000    0.006085    0.009264    0.016459    0.018555    0.022159
    0.036239    0.044348    0.051644    0.053837    0.062140    0.093763
 Highest eigenvalues
    1.602868    1.670135    1.783631    1.853830    1.969538    2.258879
 

........................................................................
.............................. CYCLE    1 ..............................
........................................................................
   1    -22.8794560 -0.228795E+02  0.413E-05    3.03       0.0  T
   2    -22.8794560 -0.788702E-12  0.242E-05    3.03    1068.6  T
   3    -22.8794560  0.108002E-11  0.147E-05    3.03    1759.9  T
     SCC iter.                  ...        0 min,  0.002 sec
     gradient                   ...        0 min,  0.006 sec
 * total energy  :   -22.5369182 Eh     change       -0.1277383E-07 Eh
   gradient norm :     0.0517692 Eh/α   predicted     0.0000000E+00 (-100.00%)
   displ. norm   :     0.1233165 α      lambda       -0.2905096E-02
   maximum displ.:     0.0847846 α      in ANC's #7, #3, #16, ...

........................................................................
.............................. CYCLE    2 ..............................
........................................................................
   1    -22.8953789 -0.228954E+02  0.210E-01    3.07       0.0  T
   2    -22.8954322 -0.532979E-04  0.104E-01    3.06       1.0  T
   3    -22.8954261  0.612583E-05  0.576E-02    3.06       1.0  T
   4    -22.8954621 -0.360322E-04  0.191E-02    3.06       1.4  T
   5    -22.8954633 -0.122326E-05  0.101E-02    3.06       2.6  T
   6    -22.8954637 -0.346057E-06  0.386E-03    3.06       6.7  T
   7    -22.8954638 -0.122392E-06  0.627E-04    3.06      41.2  T
     SCC iter.                  ...        0 min,  0.004 sec
     gradient                   ...        0 min,  0.006 sec
 * total energy  :   -22.5388515 Eh     change       -0.1933255E-02 Eh
   gradient norm :     0.0230696 Eh/α   predicted    -0.1474635E-02 ( -23.72%)
   displ. norm   :     0.0722777 α      lambda       -0.7024814E-03
   maximum displ.:     0.0513115 α      in ANC's #7, #3, #12, ...

........................................................................
.............................. CYCLE    3 ..............................
........................................................................
   1    -22.9000547 -0.229001E+02  0.136E-01    3.08       0.0  T
   2    -22.9000801 -0.253605E-04  0.689E-02    3.08       1.0  T
   3    -22.9000785  0.159567E-05  0.384E-02    3.08       1.0  T
   4    -22.9000929 -0.144578E-04  0.135E-02    3.08       1.9  T
   5    -22.9000936 -0.703548E-06  0.660E-03    3.08       3.9  T
   6    -22.9000938 -0.146665E-06  0.251E-03    3.08      10.3  T
   7    -22.9000938 -0.589050E-07  0.452E-04    3.08      57.1  T
     SCC iter.                  ...        0 min,  0.004 sec
     gradient                   ...        0 min,  0.006 sec
 * total energy  :   -22.5392635 Eh     change       -0.4120390E-03 Eh
   gradient norm :     0.0070090 Eh/α   predicted    -0.3530751E-03 ( -14.31%)
   displ. norm   :     0.0273991 α      lambda       -0.9322786E-04
   maximum displ.:     0.0142354 α      in ANC's #3, #7, #12, ...

........................................................................
.............................. CYCLE    4 ..............................
........................................................................
   1    -22.8989923 -0.228990E+02  0.420E-02    3.08       0.0  T
   2    -22.8989944 -0.213235E-05  0.210E-02    3.08       1.2  T
   3    -22.8989940  0.385858E-06  0.128E-02    3.08       2.0  T
   4    -22.8989953 -0.131073E-05  0.395E-03    3.08       6.5  T
   5    -22.8989954 -0.534234E-07  0.163E-03    3.08      15.9  T
   6    -22.8989954 -0.682045E-08  0.662E-04    3.08      39.0  T
     SCC iter.                  ...        0 min,  0.003 sec
     gradient                   ...        0 min,  0.006 sec
 * total energy  :   -22.5393251 Eh     change       -0.6163174E-04 Eh
   gradient norm :     0.0029030 Eh/α   predicted    -0.4664754E-04 ( -24.31%)
   displ. norm   :     0.0165248 α      lambda       -0.2447996E-04
   maximum displ.:     0.0082345 α      in ANC's #3, #15, #12, ...

........................................................................
.............................. CYCLE    5 ..............................
........................................................................
   1    -22.8978851 -0.228979E+02  0.208E-02    3.08       0.0  T
   2    -22.8978856 -0.472598E-06  0.102E-02    3.08       2.5  T
   3    -22.8978855  0.950683E-07  0.702E-03    3.08       3.7  T
   4    -22.8978858 -0.326635E-06  0.187E-03    3.08      13.8  T
   5    -22.8978858 -0.100011E-07  0.533E-04    3.08      48.4  T
   6    -22.8978858 -0.413248E-09  0.301E-04    3.08      85.8  T
     SCC iter.                  ...        0 min,  0.003 sec
     gradient                   ...        0 min,  0.006 sec
 * total energy  :   -22.5393391 Eh     change       -0.1392680E-04 Eh
   gradient norm :     0.0010284 Eh/α   predicted    -0.1224356E-04 ( -12.09%)
   displ. norm   :     0.0075240 α      lambda       -0.1926816E-05
   maximum displ.:     0.0037396 α      in ANC's #10, #7, #12, ...

........................................................................
.............................. CYCLE    6 ..............................
........................................................................
   1    -22.8977412 -0.228977E+02  0.873E-03    3.08       0.0  T
   2    -22.8977413 -0.872143E-07  0.475E-03    3.08       5.4  T
   3    -22.8977413  0.374456E-08  0.315E-03    3.08       8.2  T
   4    -22.8977413 -0.675627E-07  0.891E-04    3.08      29.0  T
   5    -22.8977413 -0.197801E-08  0.399E-04    3.08      64.7  T
     SCC iter.                  ...        0 min,  0.003 sec
     gradient                   ...        0 min,  0.006 sec
 * total energy  :   -22.5393404 Eh     change       -0.1353379E-05 Eh
   gradient norm :     0.0003350 Eh/α   predicted    -0.9645176E-06 ( -28.73%)
   displ. norm   :     0.0029083 α      lambda       -0.2861137E-06
   maximum displ.:     0.0014352 α      in ANC's #4, #9, #7, ...

   *** GEOMETRY OPTIMIZATION CONVERGED AFTER 6 ITERATIONS ***

------------------------------------------------------------------------
 total energy gain   :        -0.0024222 Eh       -1.5200 kcal/mol
 total RMSD          :         0.0551004 a0        0.0292 Å
 total power (kW/mol):        -1.0599224 (step)  -76.4725 (real)
------------------------------------------------------------------------

 ANCopt (total)                0 d,  0 h,  0 min,  0.083 sec
 optimizer setup                ...        0 min,  0.000 sec (  0.169%)
 model hessian                  ...        0 min,  0.001 sec (  1.420%)
 ANC generation                 ...        0 min,  0.000 sec (  0.469%)
 coordinate transformation      ...        0 min,  0.000 sec (  0.095%)
 single point calculation       ...        0 min,  0.079 sec ( 95.432%)
 optimization log               ...        0 min,  0.000 sec (  0.548%)
 hessian update                 ...        0 min,  0.000 sec (  0.076%)
 rational function              ...        0 min,  0.001 sec (  1.264%)

================
 final structure:
================
$coord
    0.00792818458864    2.38668297732488   -0.51727294798291      C 
   -2.01890175048720   -0.17441773720442   -0.39615247164446      S 
    0.49816516149902   -2.21334720031441    0.21092687673614      C 
    2.73791321947748   -0.93210111507583    0.30203547089545      C 
    2.43491779006875    1.68959200612458   -0.11616931220836      C 
   -0.00526175150462   -4.73291727713202    0.51398186841558      N 
    1.73265668706924   -6.59949619008825    1.00140248843737      C 
    1.13091767853466   -9.02113326424714    1.27951293180849      C 
   -0.75437547589917    4.22599152777676   -0.87838691974660      H 
    4.53988017907249   -1.79827419952786    0.65056541873579      H 
    3.98798073682508    3.00102649030486   -0.11445600696642      H 
   -1.82918500212296   -5.27257187393057    0.36662349876343      H 
    3.66019995677203   -5.95204071496318    1.14673065394357      H 
   -0.79138966951498   -9.67131963565408    1.13662635006984      H 
    2.55127637819451  -10.41642631099016    1.65974643850584      H 
$end
           -------------------------------------------------
          |                Final Singlepoint                |
           -------------------------------------------------

          ...................................................
          :                      SETUP                      :
          :.................................................:
          :  # basis functions                  45          :
          :  # atomic orbitals                  44          :
          :  # shells                           24          :
          :  # electrons                        42          :
          :  max. iterations                   250          :
          :  Hamiltonian                  GFN2-xTB          :
          :  restarted?                      false          :
          :  GBSA solvation                  false          :
          :  PC potential                    false          :
          :  electronic temp.          300.0000000     K    :
          :  accuracy                    1.0000000          :
          :  -> integral cutoff          0.2500000E+02      :
          :  -> integral neglect         0.1000000E-07      :
          :  -> SCF convergence          0.1000000E-05 Eh   :
          :  -> wf. convergence          0.1000000E-03 e    :
          :  Broyden damping             0.4000000          :
          ...................................................

 iter      E             dE          RMSdq      gap      omega  full diag
   1    -22.8977413 -0.228977E+02  0.211E-04    3.08       0.0  T
   2    -22.8977413 -0.279350E-10  0.804E-05    3.08     321.2  T
   3    -22.8977413 -0.190035E-10  0.971E-05    3.08     266.0  T

   *** convergence criteria satisfied after 3 iterations ***

         #    Occupation            Energy/Eh            Energy/eV
      -------------------------------------------------------------
         1        2.0000           -0.7275106             -19.7966
       ...           ...                  ...                  ...
        15        2.0000           -0.4634487             -12.6111
        16        2.0000           -0.4607191             -12.5368
        17        2.0000           -0.4481302             -12.1942
        18        2.0000           -0.4433113             -12.0631
        19        2.0000           -0.4057257             -11.0404
        20        2.0000           -0.3914565             -10.6521
        21        2.0000           -0.3484723              -9.4824 (HOMO)
        22                         -0.2351273              -6.3981 (LUMO)
        23                         -0.2054103              -5.5895
        24                         -0.1856685              -5.0523
        25                         -0.1491490              -4.0586
        26                         -0.1182246              -3.2171
       ...                                ...                  ...
        44                          0.7039668              19.1559
      -------------------------------------------------------------
                  HL-Gap            0.1133450 Eh            3.0843 eV
             Fermi-level           -0.2917998 Eh           -7.9403 eV

 SCC (total)                   0 d,  0 h,  0 min,  0.012 sec
 SCC setup                      ...        0 min,  0.000 sec (  1.043%)
 Dispersion                     ...        0 min,  0.000 sec (  0.736%)
 integral evaluation            ...        0 min,  0.004 sec ( 29.979%)
 zeroth order Hamiltonian       ...        0 min,  0.000 sec (  0.615%)
 iterations                     ...        0 min,  0.002 sec ( 17.567%)
 molecular gradient             ...        0 min,  0.006 sec ( 47.724%)
 printout                       ...        0 min,  0.000 sec (  1.966%)

         :::::::::::::::::::::::::::::::::::::::::::::::::::::
         ::                     SUMMARY                     ::
         :::::::::::::::::::::::::::::::::::::::::::::::::::::
         :: total energy             -22.539340409013 Eh    ::
         :: gradient norm              0.000334316556 Eh/a0 ::
         :: HOMO-LUMO gap              3.084273800010 eV    ::
         ::.................................................::
         :: SCC energy               -22.897741333986 Eh    ::
         :: -> isotropic ES            0.006896480683 Eh    ::
         :: -> anisotropic ES          0.003054941945 Eh    ::
         :: -> anisotropic XC          0.013446044839 Eh    ::
         :: -> dispersion             -0.012110785920 Eh    ::
         :: repulsion energy           0.358423712928 Eh    ::
         :: add. restraining           0.000000000000 Eh    ::
         :::::::::::::::::::::::::::::::::::::::::::::::::::::

           -------------------------------------------------
          |                Property Printout                |
           -------------------------------------------------

    * Orbital Energies and Occupations

         #    Occupation            Energy/Eh            Energy/eV
      -------------------------------------------------------------
         1        2.0000           -0.7275106             -19.7966
       ...           ...                  ...                  ...
         9        2.0000           -0.5371137             -14.6156
        10        2.0000           -0.5193153             -14.1313
        11        2.0000           -0.5152202             -14.0199
        12        2.0000           -0.4963249             -13.5057
        13        2.0000           -0.4722950             -12.8518
        14        2.0000           -0.4635883             -12.6149
        15        2.0000           -0.4634487             -12.6111
        16        2.0000           -0.4607191             -12.5368
        17        2.0000           -0.4481302             -12.1942
        18        2.0000           -0.4433113             -12.0631
        19        2.0000           -0.4057257             -11.0404
        20        2.0000           -0.3914565             -10.6521
        21        2.0000           -0.3484723              -9.4824 (HOMO)
        22                         -0.2351273              -6.3981 (LUMO)
        23                         -0.2054103              -5.5895
        24                         -0.1856685              -5.0523
        25                         -0.1491490              -4.0586
        26                         -0.1182246              -3.2171
        27                         -0.0196436              -0.5345
        28                          0.0341454               0.9291
        29                          0.0368278               1.0021
        30                          0.0525728               1.4306
        31                          0.1102395               2.9998
        32                          0.1425317               3.8785
       ...                                ...                  ...
        44                          0.7039668              19.1559
      -------------------------------------------------------------
                  HL-Gap            0.1133450 Eh            3.0843 eV
             Fermi-level           -0.2917998 Eh           -7.9403 eV

     #   Z        covCN         q      C6AA      α(0)
     1   6 C      2.933    -0.029    28.717     8.789
     2  16 S      2.330    -0.084   144.560    20.236
     3   6 C      2.926     0.082    26.162     8.388
     4   6 C      3.097    -0.081    29.890     8.960
     5   6 C      3.115    -0.043    28.897     8.805
     6   7 N      2.728    -0.130    23.815     7.248
     7   6 C      2.825     0.023    27.481     8.590
     8   6 C      2.841    -0.134    31.405     9.184
     9   1 H      0.927     0.038     2.472     2.459
    10   1 H      0.926     0.032     2.564     2.504
    11   1 H      0.926     0.034     2.533     2.489
    12   1 H      0.860     0.174     1.251     1.752
    13   1 H      0.926     0.046     2.373     2.409
    14   1 H      0.926     0.031     2.567     2.505
    15   1 H      0.926     0.040     2.450     2.447

 Mol. C6AA /au·bohr⁶  :       3552.366137
 Mol. C8AA /au·bohr⁸  :     100218.151129
 Mol. α(0) /au        :         96.764942


Wiberg/Mayer (AO) data.
largest (>0.10) Wiberg bond orders for each atom
          total WBO             WBO to atom ...
     1  C   3.915        C    5 1.643    S    2 1.139    H    9 0.971
     2  S   2.532        C    1 1.139    C    3 1.124
     3  C   3.939        C    4 1.518    N    6 1.147    S    2 1.124
     4  C   3.970        C    3 1.518    C    5 1.265    H   10 0.962
     5  C   3.989        C    1 1.643    C    4 1.265    H   11 0.965
     6  N   3.485        C    3 1.147    C    7 1.134    H   12 0.937    C    8 0.104
     7  C   3.963        C    8 1.830    N    6 1.134    H   13 0.958
     8  C   3.959        C    7 1.830    H   15 0.978    H   14 0.975    N    6 0.104
     9  H   0.998        C    1 0.971
    10  H   0.999        C    4 0.962
    11  H   0.999        C    5 0.965
    12  H   0.970        N    6 0.937
    13  H   0.998        C    7 0.958
    14  H   0.999        C    8 0.975
    15  H   0.997        C    8 0.978

molecular dipole:
                 x           y           z       tot (Debye)
 q only:       -0.049      -0.268       0.033
   full:        0.125      -0.177       0.041       0.561
molecular quadrupole (traceless):
                xx          xy          yy          xz          yz          zz
 q only:        0.347       1.329       1.371       0.080      -0.220      -1.718
  q+dip:        1.926       2.269       2.464       0.439      -0.694      -4.390
   full:        0.848       1.948       2.140       0.171      -0.473      -2.988

           -------------------------------------------------
          |                Geometry Summary                 |
           -------------------------------------------------

      molecular mass/u    :      125.1880000
   center of mass at/Å    :        0.2082184      -1.1599549       0.1033361
  moments of inertia/u·Å² :        0.1040425E+03   0.4894222E+03   0.5934647E+03
rotational constants/cm⁻¹ :        0.1620264E+00   0.3444395E-01   0.2840545E-01

 * 15 selected distances

     #   Z        #   Z                                     value/Å
     1   6 C      2  16 S                                 1.7295231
     2  16 S      3   6 C                                 1.7439907 (max)
     3   6 C      4   6 C                                 1.3662988
     1   6 C      5   6 C                                 1.3529872
     4   6 C      5   6 C                                 1.4140005
     3   6 C      6   7 N                                 1.3690783
     6   7 N      7   6 C                                 1.3740336
     7   6 C      8   6 C                                 1.3286208
     1   6 C      9   1 H                                 1.0707920
     4   6 C     10   1 H                                 1.0739579
     5   6 C     11   1 H                                 1.0756584
     6   7 N     12   1 H                                 1.0095556 (min)
     7   6 C     13   1 H                                 1.0787615
     8   6 C     14   1 H                                 1.0765115
     8   6 C     15   1 H                                 1.0726567

 * 5 distinct bonds (by element types)

   Z      Z             #   av. dist./Å        max./Å        min./Å
   1 H    6 C           6     1.0747230     1.0787615     1.0707920
   6 C    6 C           4     1.3654768     1.4140005     1.3286208
   1 H    7 N           1     1.0095556     1.0095556     1.0095556
   6 C    7 N           2     1.3715559     1.3740336     1.3690783
   6 C   16 S           2     1.7367569     1.7439907     1.7295231


optimized geometry written to: xtbopt.xyz


           -------------------------------------------------
          | TOTAL ENERGY              -22.539340409013 Eh   |
          | GRADIENT NORM               0.000334316556 Eh/α |
          | HOMO-LUMO GAP               3.084273800010 eV   |
           -------------------------------------------------

------------------------------------------------------------------------
 * finished run on 2021/05/19 at 11:01:10.424     
------------------------------------------------------------------------
 total:
 * wall-time:     0 d,  0 h,  0 min,  0.130 sec
 *  cpu-time:     0 d,  0 h,  0 min,  0.130 sec
 * ratio c/w:     0.993 speedup
 SCF:
 * wall-time:     0 d,  0 h,  0 min,  0.019 sec
 *  cpu-time:     0 d,  0 h,  0 min,  0.019 sec
 * ratio c/w:     0.997 speedup
 ANC optimizer:
 * wall-time:     0 d,  0 h,  0 min,  0.096 sec
 *  cpu-time:     0 d,  0 h,  0 min,  0.096 sec
 * ratio c/w:     0.998 speedup

