      -----------------------------------------------------------      
     |                   =====================                   |     
     |                           x T B                           |     
     |                   =====================                   |     
     |                         S. Grimme                         |     
     |          Mulliken Center for Theoretical Chemistry        |     
     |                    University of Bonn                     |     
     |                Version 6.2 RC2 (SAW190805)                |     
      -----------------------------------------------------------      

   This program is distributed in the hope that it will be useful,
   but WITHOUT ANY WARRANTY; without even the implied warranty of
   MERCHANTABILITY or FITNESS FOR A PARTICULAR PURPOSE.
   
   FOR NON-COMMERCIAL, ACADEMIA USE ONLY.
   
   Cite this work as:
   * S. Grimme, C. Bannwarth, P. Shushkov, J. Chem. Theory Comput., 2017,
     13, 1989-2009. DOI: 10.1021/acs.jctc.7b00118
   * C. Bannwarth, S. Ehlert and S. Grimme., J. Chem. Theory Comput., 2019,
     15, 1652-1671. DOI: 10.1021/acs.jctc.8b01176
   * P. Pracht, E. Caldeweyher, S. Ehlert, S. Grimme, ChemRxiv, 2019, preprint.
     DOI: 10.26434/chemrxiv.8326202.v1
   
   for DFT-D4:
   * E. Caldeweyher, C. Bannwarth and S. Grimme, J. Chem. Phys., 2017,
     147, 034112. DOI: 10.1063/1.4993215
   * E. Caldeweyher, S. Ehlert, A. Hansen, H. Neugebauer, S. Spicher,
     C. Bannwarth and S. Grimme, J. Chem. Phys., 2019, 150, 154122.
     DOI: 10.1063/1.5090222
   
   for sTDA-xTB:
   * S. Grimme and C. Bannwarth, J. Chem. Phys., 2016, 145, 054103.
     DOI: 10.1063/1.4959605
   
   in the mass-spec context:
   * V. Asgeirsson, C. Bauer and S. Grimme, Chem. Sci., 2017, 8, 4879.
     DOI: 10.1039/c7sc00601b
   
   for metadynamics refer to:
   * S. Grimme, J. Chem. Theory Comput., 2019, 155, 2847-2862
     DOI: 10.1021/acs.jctc.9b00143
   
   with help from (in alphabetical order)
   C. Bannwarth, F. Bohle, G. Brandenburg, E. Caldeweyher, M. Checinski,
   S. Dohm, S. Ehlert, S. Ehrlich, F. März, H. Neugebauer, J. Pisarek,
   P. Pracht, P. Shushkov, and S. Spicher.
   
 * started run on 2021/05/19 at 11:01:10.815     

           -------------------------------------------------
          |                Calculation Setup                |
           -------------------------------------------------

          program call               : /ihome/ghutchison/geoffh/xtb/xtb 1049.xyz -opt
          hostname                   : smp-n144
          coordinate file            : 1049.xyz
          omp threads                :                     1
          number of atoms            :                    30
          number of electrons        :                    84
          charge                     :                     0
          spin                       :                   0.0
          first test random number   :      0.52232609521491


########################################################################
# WARNING! Please study the warnings concerning your input carefully
#  - the use of '-opt' is discouraged, please use '--opt' next time
########################################################################

           ------------------------------------------------- 
          |                 G F N 2 - x T B                 |
          | Geometry, Frequencies, Noncovalent interactions |
          |            JCTC 2019 parametrisation            |
           ------------------------------------------------- 
             KAB for C  - Si     :                1.0500
             KAB for H  - Pd     :                0.9500
             k(s)              :                1.8500
             k(p)              :                2.2300
             k(d)              :                2.2300
             k(f)              :                2.0000
             kEN (H0ij)        :               -2.0000
             D4 a1             :                0.5200
             D4 a2             :                5.0000
             D4 s6             :                1.0000
             D4 s8             :                2.7000
             D4 s9             :                5.0000
             alphaj            :                2.0000

  Z AO/shell   Hii/eV     exponent
  1     Wed Apr 25 08:07:45 CEST 2018   EN: 2.200 GM2: 0.406  GM3: 0.0800  RAES: 1.40
     1s    -10.707211    1.230000
  6     Wed Apr 25 08:07:45 CEST 2018   EN: 2.550 GM2: 0.538  GM3: 0.1500  RAES: 3.00
     2s    -13.970922    2.096432
     2p    -10.063292    1.800000
  7     Wed Apr 25 08:07:45 CEST 2018   EN: 3.040 GM2: 0.461  GM3:-0.0640  RAES: 1.90
     2s    -16.686243    2.339881
     2p    -12.523956    2.014332
 16     Tue Apr 24 11:44:34 CEST 2018   EN: 2.580 GM2: 0.340  GM3:-0.0502  RAES: 3.10
     3s    -20.029654    1.981333
     3p    -11.377694    2.025643
     3d     -0.420282    1.702555

           ------------------------------------------------- 
          |        Self-Consistent Charge Iterations        |
           ------------------------------------------------- 

          ...................................................
          :                      SETUP                      :
          :.................................................:
          :  # basis functions                  90          :
          :  # atomic orbitals                  88          :
          :  # shells                           48          :
          :  # electrons                        84          :
          :  max. iterations                   250          :
          :  Hamiltonian                  GFN2-xTB          :
          :  restarted?                      false          :
          :  GBSA solvation                  false          :
          :  PC potential                    false          :
          :  electronic temp.          300.0000000     K    :
          :  accuracy                    1.0000000          :
          :  -> integral cutoff          0.2500000E+02      :
          :  -> integral neglect         0.1000000E-07      :
          :  -> SCF convergence          0.1000000E-05 Eh   :
          :  -> wf. convergence          0.1000000E-03 e    :
          :  Broyden damping             0.4000000          :
          ...................................................

 iter      E             dE          RMSdq      gap      omega  full diag
   1    -45.7199794 -0.457200E+02  0.420E+00    2.22       0.0  T
   2    -45.7779584 -0.579790E-01  0.241E+00    2.47       1.0  T
   3    -45.7773745  0.583853E-03  0.103E+00    2.19       1.0  T
   4    -45.7861051 -0.873061E-02  0.409E-01    2.29       1.0  T
   5    -45.7877810 -0.167586E-02  0.190E-01    2.26       1.0  T
   6    -45.7879581 -0.177071E-03  0.923E-02    2.27       1.0  T
   7    -45.7881129 -0.154831E-03  0.363E-02    2.28       1.0  T
   8    -45.7881344 -0.214842E-04  0.212E-02    2.28       1.0  T
   9    -45.7881357 -0.136425E-05  0.937E-03    2.28       1.9  T
  10    -45.7881365 -0.728305E-06  0.485E-03    2.28       3.8  T
  11    -45.7881366 -0.162603E-06  0.205E-03    2.28       8.9  T
  12    -45.7881367 -0.228541E-07  0.775E-04    2.28      23.6  T
  13    -45.7881367 -0.134968E-08  0.260E-04    2.28      70.3  T

   *** convergence criteria satisfied after 13 iterations ***

         #    Occupation            Energy/Eh            Energy/eV
      -------------------------------------------------------------
         1        2.0000           -0.7350594             -20.0020
       ...           ...                  ...                  ...
        36        2.0000           -0.4264680             -11.6048
        37        2.0000           -0.4220756             -11.4853
        38        2.0000           -0.4168718             -11.3437
        39        2.0000           -0.3975121             -10.8169
        40        2.0000           -0.3894508             -10.5975
        41        2.0000           -0.3759161             -10.2292
        42        2.0000           -0.3440043              -9.3608 (HOMO)
        43                         -0.2602489              -7.0817 (LUMO)
        44                         -0.2289275              -6.2294
        45                         -0.2285172              -6.2183
        46                         -0.1974020              -5.3716
        47                         -0.1954949              -5.3197
       ...                                ...                  ...
        88                          0.7108360              19.3428
      -------------------------------------------------------------
                  HL-Gap            0.0837554 Eh            2.2791 eV
             Fermi-level           -0.3021266 Eh           -8.2213 eV

 SCC (total)                   0 d,  0 h,  0 min,  0.060 sec
 SCC setup                      ...        0 min,  0.000 sec (  0.627%)
 Dispersion                     ...        0 min,  0.000 sec (  0.786%)
 integral evaluation            ...        0 min,  0.015 sec ( 24.092%)
 zeroth order Hamiltonian       ...        0 min,  0.000 sec (  0.472%)
 iterations                     ...        0 min,  0.022 sec ( 36.566%)
 molecular gradient             ...        0 min,  0.022 sec ( 36.634%)
 printout                       ...        0 min,  0.000 sec (  0.730%)

         :::::::::::::::::::::::::::::::::::::::::::::::::::::
         ::                     SUMMARY                     ::
         :::::::::::::::::::::::::::::::::::::::::::::::::::::
         :: total energy             -45.184488110249 Eh    ::
         :: gradient norm              0.130098655599 Eh/a0 ::
         :: HOMO-LUMO gap              2.279099706010 eV    ::
         ::.................................................::
         :: SCC energy               -45.788136661086 Eh    ::
         :: -> isotropic ES            0.017512623268 Eh    ::
         :: -> anisotropic ES          0.009820828519 Eh    ::
         :: -> anisotropic XC          0.025645978137 Eh    ::
         :: -> dispersion             -0.035164093181 Eh    ::
         :: repulsion energy           0.603273356467 Eh    ::
         :: add. restraining           0.000000000000 Eh    ::
         :::::::::::::::::::::::::::::::::::::::::::::::::::::

      ----------------------------------------------------------- 
     |                   =====================                   |
     |                        A N C O P T                        |
     |                   =====================                   |
     |               Approximate Normal Coordinate               |
     |                Rational Function Optimizer                |
      ----------------------------------------------------------- 

          ...................................................
          :                      SETUP                      :
          :.................................................:
          :   optimization level            normal          :
          :   max. optcycles                   200          :
          :   ANC micro-cycles                  20          :
          :   degrees of freedom                84          :
          :.................................................:
          :   RF solver                   davidson          :
          :   input Hessian                  false          :
          :   write xtbopt.log                true          :
          :   linear?                        false          :
          :   energy convergence         0.5000000E-05 Eh   :
          :   grad. convergence          0.1000000E-02 Eh/α :
          :   maximium RF displ.         2.0000000          :
          :   Hlow (freq-cutoff)         0.5000000E-02      :
          :   Hmax (freq-cutoff)         5.0000000          :
          :   S6 in model hess.         20.0000000          :
          ...................................................

generating ANC from model Hessian ...
Using Lindh-Hessian (1995)
 Shifting diagonal of input Hessian by   4.291552716302082E-003
 Lowest  eigenvalues of input Hessian
   -0.000000   -0.000000   -0.000000    0.000000    0.000000    0.000000
    0.005000    0.006238    0.006576    0.006740    0.008591    0.009648
    0.010517    0.011508    0.013627    0.018091    0.018816    0.019487
 Highest eigenvalues
    1.695737    1.760661    1.852695    1.881102    2.071277    2.156699
 

........................................................................
.............................. CYCLE    1 ..............................
........................................................................
   1    -45.7881367 -0.457881E+02  0.128E-04    2.28       0.0  T
   2    -45.7881367 -0.691074E-10  0.987E-05    2.28     184.9  T
   3    -45.7881367 -0.171852E-09  0.528E-05    2.28     345.5  T
     SCC iter.                  ...        0 min,  0.006 sec
     gradient                   ...        0 min,  0.022 sec
 * total energy  :   -45.1844881 Eh     change       -0.2603825E-07 Eh
   gradient norm :     0.1300978 Eh/α   predicted     0.0000000E+00 (-100.00%)
   displ. norm   :     0.3012513 α      lambda       -0.2180991E-01
   maximum displ.:     0.1404896 α      in ANC's #14, #19, #26, ...

........................................................................
.............................. CYCLE    2 ..............................
........................................................................
   1    -45.8183218 -0.458183E+02  0.288E-01    2.38       0.0  T
   2    -45.8188209 -0.499051E-03  0.194E-01    2.38       1.0  T
   3    -45.8190867 -0.265838E-03  0.977E-02    2.39       1.0  T
   4    -45.8191308 -0.440223E-04  0.371E-02    2.39       1.0  T
   5    -45.8191505 -0.197074E-04  0.138E-02    2.39       1.3  T
   6    -45.8191535 -0.300347E-05  0.587E-03    2.39       3.1  T
   7    -45.8191537 -0.253039E-06  0.230E-03    2.39       7.9  T
     SCC iter.                  ...        0 min,  0.011 sec
     gradient                   ...        0 min,  0.020 sec
 * total energy  :   -45.1997762 Eh     change       -0.1528803E-01 Eh
   gradient norm :     0.0537276 Eh/α   predicted    -0.1189469E-01 ( -22.20%)
   displ. norm   :     0.3187059 α      lambda       -0.7334146E-02
   maximum displ.:     0.1868849 α      in ANC's #14, #13, #9, ...

........................................................................
.............................. CYCLE    3 ..............................
........................................................................
   1    -45.8361142 -0.458361E+02  0.234E-01    2.44       0.0  T
   2    -45.8363743 -0.260039E-03  0.148E-01    2.44       1.0  T
   3    -45.8364453 -0.709865E-04  0.773E-02    2.44       1.0  T
   4    -45.8364880 -0.427538E-04  0.284E-02    2.45       1.0  T
   5    -45.8364993 -0.112570E-04  0.102E-02    2.45       1.8  T
   6    -45.8365005 -0.123449E-05  0.479E-03    2.44       3.8  T
   7    -45.8365007 -0.215546E-06  0.174E-03    2.45      10.5  T
     SCC iter.                  ...        0 min,  0.011 sec
     gradient                   ...        0 min,  0.020 sec
 * total energy  :   -45.2040633 Eh     change       -0.4287086E-02 Eh
   gradient norm :     0.0137601 Eh/α   predicted    -0.4039558E-02 (  -5.77%)
   displ. norm   :     0.2126739 α      lambda       -0.9945085E-03
   maximum displ.:     0.1067253 α      in ANC's #14, #8, #13, ...

........................................................................
.............................. CYCLE    4 ..............................
........................................................................
   1    -45.8364893 -0.458365E+02  0.112E-01    2.43       0.0  T
   2    -45.8365024 -0.130606E-04  0.645E-02    2.44       1.0  T
   3    -45.8364954  0.694924E-05  0.262E-02    2.43       1.0  T
   4    -45.8365065 -0.111053E-04  0.924E-03    2.44       2.0  T
   5    -45.8365071 -0.573594E-06  0.405E-03    2.43       4.5  T
   6    -45.8365072 -0.130878E-06  0.197E-03    2.44       9.3  T
   7    -45.8365073 -0.431963E-07  0.828E-04    2.44      22.0  T
     SCC iter.                  ...        0 min,  0.012 sec
     gradient                   ...        0 min,  0.021 sec
 * total energy  :   -45.2047584 Eh     change       -0.6950968E-03 Eh
   gradient norm :     0.0099277 Eh/α   predicted    -0.5197462E-03 ( -25.23%)
   displ. norm   :     0.1873609 α      lambda       -0.4336374E-03
   maximum displ.:     0.0726870 α      in ANC's #8, #2, #14, ...

........................................................................
.............................. CYCLE    5 ..............................
........................................................................
   1    -45.8356694 -0.458357E+02  0.970E-02    2.43       0.0  T
   2    -45.8356739 -0.445172E-05  0.552E-02    2.43       1.0  T
   3    -45.8356679  0.592591E-05  0.184E-02    2.42       1.0  T
   4    -45.8356759 -0.792396E-05  0.703E-03    2.43       2.6  T
   5    -45.8356762 -0.334642E-06  0.248E-03    2.43       7.4  T
   6    -45.8356762 -0.579998E-07  0.107E-03    2.43      17.1  T
     SCC iter.                  ...        0 min,  0.010 sec
     gradient                   ...        0 min,  0.021 sec
 * total energy  :   -45.2050268 Eh     change       -0.2684053E-03 Eh
   gradient norm :     0.0051810 Eh/α   predicted    -0.2244312E-03 ( -16.38%)
   displ. norm   :     0.1055360 α      lambda       -0.1100321E-03
   maximum displ.:     0.0568992 α      in ANC's #2, #1, #4, ...

........................................................................
.............................. CYCLE    6 ..............................
........................................................................
   1    -45.8360777 -0.458361E+02  0.556E-02    2.43       0.0  T
   2    -45.8360794 -0.170417E-05  0.314E-02    2.43       1.0  T
   3    -45.8360770  0.244729E-05  0.106E-02    2.43       1.7  T
   4    -45.8360803 -0.334457E-05  0.278E-03    2.43       6.6  T
   5    -45.8360803 -0.185551E-07  0.133E-03    2.43      13.8  T
   6    -45.8360804 -0.296825E-07  0.469E-04    2.43      38.9  T
     SCC iter.                  ...        0 min,  0.010 sec
     gradient                   ...        0 min,  0.021 sec
 * total energy  :   -45.2051142 Eh     change       -0.8746684E-04 Eh
   gradient norm :     0.0040491 Eh/α   predicted    -0.5563066E-04 ( -36.40%)
   displ. norm   :     0.1895907 α      lambda       -0.1691883E-03
   maximum displ.:     0.1045422 α      in ANC's #1, #2, #4, ...

........................................................................
.............................. CYCLE    7 ..............................
........................................................................
   1    -45.8366701 -0.458367E+02  0.116E-01    2.44       0.0  T
   2    -45.8366784 -0.832683E-05  0.647E-02    2.43       1.0  T
   3    -45.8366710  0.737843E-05  0.198E-02    2.44       1.0  T
   4    -45.8366823 -0.112560E-04  0.466E-03    2.43       3.9  T
   5    -45.8366824 -0.777966E-07  0.232E-03    2.43       7.9  T
   6    -45.8366825 -0.820240E-07  0.819E-04    2.43      22.3  T
     SCC iter.                  ...        0 min,  0.010 sec
     gradient                   ...        0 min,  0.021 sec
 * total energy  :   -45.2052518 Eh     change       -0.1375961E-03 Eh
   gradient norm :     0.0055831 Eh/α   predicted    -0.8765812E-04 ( -36.29%)
   displ. norm   :     0.3571861 α      lambda       -0.2897074E-03
   maximum displ.:     0.1946840 α      in ANC's #1, #2, #4, ...

........................................................................
.............................. CYCLE    8 ..............................
........................................................................
   1    -45.8357335 -0.458357E+02  0.252E-01    2.45       0.0  T
   2    -45.8357740 -0.404794E-04  0.139E-01    2.44       1.0  T
   3    -45.8357389  0.350941E-04  0.442E-02    2.45       1.0  T
   4    -45.8357936 -0.546520E-04  0.929E-03    2.44       2.0  T
   5    -45.8357937 -0.142983E-06  0.502E-03    2.44       3.6  T
   6    -45.8357941 -0.413737E-06  0.158E-03    2.44      11.6  T
   7    -45.8357941 -0.197024E-07  0.711E-04    2.44      25.7  T
     SCC iter.                  ...        0 min,  0.011 sec
     gradient                   ...        0 min,  0.021 sec
 * total energy  :   -45.2054621 Eh     change       -0.2102348E-03 Eh
   gradient norm :     0.0115343 Eh/α   predicted    -0.1633389E-03 ( -22.31%)
   displ. norm   :     0.2754687 α      lambda       -0.2499282E-03
   maximum displ.:     0.1507545 α      in ANC's #1, #2, #4, ...

........................................................................
.............................. CYCLE    9 ..............................
........................................................................
   1    -45.8347159 -0.458347E+02  0.221E-01    2.46       0.0  T
   2    -45.8347513 -0.354640E-04  0.122E-01    2.44       1.0  T
   3    -45.8347119  0.394457E-04  0.472E-02    2.46       1.0  T
   4    -45.8347705 -0.585713E-04  0.831E-03    2.44       2.2  T
   5    -45.8347706 -0.110701E-06  0.477E-03    2.44       3.8  T
   6    -45.8347709 -0.324664E-06  0.149E-03    2.44      12.3  T
   7    -45.8347709 -0.184113E-07  0.700E-04    2.44      26.1  T
     SCC iter.                  ...        0 min,  0.011 sec
     gradient                   ...        0 min,  0.021 sec
 * total energy  :   -45.2056226 Eh     change       -0.1605283E-03 Eh
   gradient norm :     0.0141327 Eh/α   predicted    -0.1344473E-03 ( -16.25%)
   displ. norm   :     0.1115555 α      lambda       -0.3287527E-03
   maximum displ.:     0.0424030 α      in ANC's #1, #14, #4, ...

........................................................................
.............................. CYCLE   10 ..............................
........................................................................
   1    -45.8368166 -0.458368E+02  0.111E-01    2.45       0.0  T
   2    -45.8368268 -0.101492E-04  0.604E-02    2.44       1.0  T
   3    -45.8368163  0.104212E-04  0.270E-02    2.45       1.0  T
   4    -45.8368325 -0.161280E-04  0.546E-03    2.44       3.3  T
   5    -45.8368325 -0.519509E-07  0.288E-03    2.44       6.3  T
   6    -45.8368326 -0.967364E-07  0.106E-03    2.44      17.3  T
     SCC iter.                  ...        0 min,  0.010 sec
     gradient                   ...        0 min,  0.021 sec
 * total energy  :   -45.2058124 Eh     change       -0.1897910E-03 Eh
   gradient norm :     0.0079857 Eh/α   predicted    -0.1664225E-03 ( -12.31%)
   displ. norm   :     0.1117132 α      lambda        0.1741624E-03
   maximum displ.:     0.0428354 α      in ANC's #1, #14, #4, ...

........................................................................
.............................. CYCLE   11 ..............................
........................................................................
   1    -45.8383709 -0.458384E+02  0.111E-01    2.45       0.0  T
   2    -45.8383815 -0.105805E-04  0.606E-02    2.44       1.0  T
   3    -45.8383705  0.109756E-04  0.281E-02    2.45       1.0  T
   4    -45.8383876 -0.170976E-04  0.557E-03    2.44       3.3  T
   5    -45.8383876 -0.599728E-07  0.298E-03    2.44       6.1  T
   6    -45.8383877 -0.101194E-06  0.108E-03    2.44      16.9  T
     SCC iter.                  ...        0 min,  0.010 sec
     gradient                   ...        0 min,  0.021 sec
 * total energy  :   -45.2057253 Eh     change        0.8702554E-04 Eh
   gradient norm :     0.0133588 Eh/α   predicted     0.8816691E-04 (   1.31%)
   displ. norm   :     0.0926617 α      lambda       -0.3299785E-03
   maximum displ.:     0.0568760 α      in ANC's #5, #9, #1, ...

........................................................................
.............................. CYCLE   12 ..............................
........................................................................
   1    -45.8356394 -0.458356E+02  0.742E-02    2.44       0.0  T
   2    -45.8356457 -0.629014E-05  0.394E-02    2.44       1.0  T
   3    -45.8356430  0.271095E-05  0.141E-02    2.44       1.3  T
   4    -45.8356474 -0.445402E-05  0.499E-03    2.44       3.7  T
   5    -45.8356478 -0.318754E-06  0.193E-03    2.44       9.5  T
   6    -45.8356478 -0.155564E-07  0.878E-04    2.44      20.8  T
     SCC iter.                  ...        0 min,  0.010 sec
     gradient                   ...        0 min,  0.021 sec
 * total energy  :   -45.2059054 Eh     change       -0.1800177E-03 Eh
   gradient norm :     0.0065327 Eh/α   predicted    -0.1664089E-03 (  -7.56%)
   displ. norm   :     0.1322867 α      lambda       -0.8033819E-04
   maximum displ.:     0.0804975 α      in ANC's #1, #2, #4, ...

........................................................................
.............................. CYCLE   13 ..............................
........................................................................
   1    -45.8359303 -0.458359E+02  0.933E-02    2.43       0.0  T
   2    -45.8359374 -0.707693E-05  0.513E-02    2.44       1.0  T
   3    -45.8359311  0.624895E-05  0.196E-02    2.43       1.0  T
   4    -45.8359406 -0.947666E-05  0.439E-03    2.44       4.2  T
   5    -45.8359407 -0.117349E-06  0.225E-03    2.44       8.1  T
   6    -45.8359408 -0.604998E-07  0.841E-04    2.44      21.7  T
     SCC iter.                  ...        0 min,  0.010 sec
     gradient                   ...        0 min,  0.021 sec
 * total energy  :   -45.2059390 Eh     change       -0.3362228E-04 Eh
   gradient norm :     0.0029677 Eh/α   predicted    -0.4088148E-04 (  21.59%)
   displ. norm   :     0.0526085 α      lambda       -0.4637463E-04
   maximum displ.:     0.0340180 α      in ANC's #5, #3, #4, ...

........................................................................
.............................. CYCLE   14 ..............................
........................................................................
   1    -45.8353046 -0.458353E+02  0.647E-02    2.44       0.0  T
   2    -45.8353080 -0.346485E-05  0.341E-02    2.44       1.0  T
   3    -45.8353049  0.312714E-05  0.151E-02    2.44       1.2  T
   4    -45.8353099 -0.502082E-05  0.329E-03    2.44       5.5  T
   5    -45.8353099 -0.117686E-08  0.177E-03    2.44      10.3  T
   6    -45.8353100 -0.500907E-07  0.535E-04    2.44      34.1  T
   7    -45.8353100 -0.291416E-08  0.294E-04    2.44      62.2  T
     SCC iter.                  ...        0 min,  0.011 sec
     gradient                   ...        0 min,  0.022 sec
 * total energy  :   -45.2059741 Eh     change       -0.3510909E-04 Eh
   gradient norm :     0.0030319 Eh/α   predicted    -0.2325576E-04 ( -33.76%)
   displ. norm   :     0.0755565 α      lambda       -0.4321356E-04
   maximum displ.:     0.0442280 α      in ANC's #5, #3, #1, ...

........................................................................
.............................. CYCLE   15 ..............................
........................................................................
   1    -45.8350053 -0.458350E+02  0.764E-02    2.44       0.0  T
   2    -45.8350104 -0.506685E-05  0.405E-02    2.44       1.0  T
   3    -45.8350052  0.519526E-05  0.189E-02    2.45       1.0  T
   4    -45.8350134 -0.821728E-05  0.403E-03    2.44       4.5  T
   5    -45.8350134  0.937703E-08  0.214E-03    2.44       8.5  T
   6    -45.8350134 -0.805071E-07  0.614E-04    2.44      29.7  T
   7    -45.8350135 -0.344883E-08  0.340E-04    2.44      53.8  T
     SCC iter.                  ...        0 min,  0.011 sec
     gradient                   ...        0 min,  0.022 sec
 * total energy  :   -45.2060019 Eh     change       -0.2779357E-04 Eh
   gradient norm :     0.0035494 Eh/α   predicted    -0.2173039E-04 ( -21.82%)
   displ. norm   :     0.0631539 α      lambda       -0.2207054E-04
   maximum displ.:     0.0356938 α      in ANC's #2, #1, #5, ...

........................................................................
.............................. CYCLE   16 ..............................
........................................................................
   1    -45.8351199 -0.458351E+02  0.375E-02    2.44       0.0  T
   2    -45.8351209 -0.106116E-05  0.197E-02    2.44       1.0  T
   3    -45.8351197  0.120438E-05  0.844E-03    2.44       2.2  T
   4    -45.8351215 -0.178875E-05  0.219E-03    2.44       8.4  T
   5    -45.8351215  0.231858E-08  0.923E-04    2.44      19.8  T
   6    -45.8351215 -0.181316E-07  0.239E-04    2.44      76.5  T
     SCC iter.                  ...        0 min,  0.010 sec
     gradient                   ...        0 min,  0.022 sec
 * total energy  :   -45.2060199 Eh     change       -0.1796387E-04 Eh
   gradient norm :     0.0031888 Eh/α   predicted    -0.1108247E-04 ( -38.31%)
   displ. norm   :     0.1044799 α      lambda       -0.3390240E-04
   maximum displ.:     0.0617574 α      in ANC's #1, #2, #5, ...

........................................................................
.............................. CYCLE   17 ..............................
........................................................................
   1    -45.8353149 -0.458353E+02  0.526E-02    2.45       0.0  T
   2    -45.8353166 -0.175422E-05  0.279E-02    2.44       1.0  T
   3    -45.8353148  0.186481E-05  0.104E-02    2.45       1.8  T
   4    -45.8353175 -0.269341E-05  0.313E-03    2.44       5.8  T
   5    -45.8353175 -0.133748E-07  0.112E-03    2.44      16.3  T
   6    -45.8353175 -0.272598E-07  0.309E-04    2.44      59.0  T
   7    -45.8353175 -0.118865E-08  0.141E-04    2.44     129.2  T
     SCC iter.                  ...        0 min,  0.012 sec
     gradient                   ...        0 min,  0.022 sec
 * total energy  :   -45.2060441 Eh     change       -0.2423964E-04 Eh
   gradient norm :     0.0022254 Eh/α   predicted    -0.1713704E-04 ( -29.30%)
   displ. norm   :     0.0829708 α      lambda       -0.1620587E-04
   maximum displ.:     0.0512842 α      in ANC's #1, #2, #4, ...

........................................................................
.............................. CYCLE   18 ..............................
........................................................................
   1    -45.8353742 -0.458354E+02  0.367E-02    2.44       0.0  T
   2    -45.8353749 -0.703731E-06  0.198E-02    2.44       1.0  T
   3    -45.8353745  0.410560E-06  0.558E-03    2.44       3.3  T
   4    -45.8353751 -0.635017E-06  0.219E-03    2.44       8.4  T
   5    -45.8353751 -0.348865E-07  0.722E-04    2.44      25.3  T
   6    -45.8353751 -0.817171E-08  0.239E-04    2.44      76.4  T
     SCC iter.                  ...        0 min,  0.010 sec
     gradient                   ...        0 min,  0.022 sec
 * total energy  :   -45.2060547 Eh     change       -0.1064963E-04 Eh
   gradient norm :     0.0012599 Eh/α   predicted    -0.8160226E-05 ( -23.38%)
   displ. norm   :     0.1249038 α      lambda        0.2536872E-05
   maximum displ.:     0.0776472 α      in ANC's #1, #2, #4, ...

........................................................................
.............................. CYCLE   19 ..............................
........................................................................
   1    -45.8352890 -0.458353E+02  0.554E-02    2.45       0.0  T
   2    -45.8352905 -0.159001E-05  0.298E-02    2.44       1.0  T
   3    -45.8352896  0.928364E-06  0.843E-03    2.44       2.2  T
   4    -45.8352911 -0.143581E-05  0.330E-03    2.44       5.5  T
   5    -45.8352911 -0.768258E-07  0.111E-03    2.44      16.4  T
   6    -45.8352912 -0.201054E-07  0.361E-04    2.44      50.6  T
   7    -45.8352912 -0.176311E-08  0.180E-04    2.44     101.4  T
     SCC iter.                  ...        0 min,  0.011 sec
     gradient                   ...        0 min,  0.022 sec
 * total energy  :   -45.2060493 Eh     change        0.5411083E-05 Eh
   gradient norm :     0.0017757 Eh/α   predicted     0.1276079E-05 ( -76.42%)
   displ. norm   :     0.0842740 α      lambda       -0.1114702E-04
   maximum displ.:     0.0485947 α      in ANC's #2, #1, #5, ...

........................................................................
.............................. CYCLE   20 ..............................
........................................................................
   1    -45.8354895 -0.458355E+02  0.462E-02    2.44       0.0  T
   2    -45.8354907 -0.123747E-05  0.241E-02    2.44       1.0  T
   3    -45.8354898  0.934144E-06  0.779E-03    2.44       2.3  T
   4    -45.8354912 -0.143485E-05  0.277E-03    2.44       6.6  T
   5    -45.8354912 -0.216151E-07  0.876E-04    2.44      20.8  T
   6    -45.8354913 -0.170121E-07  0.252E-04    2.44      72.5  T
     SCC iter.                  ...        0 min,  0.010 sec
     gradient                   ...        0 min,  0.022 sec
 * total energy  :   -45.2060588 Eh     change       -0.9426618E-05 Eh
   gradient norm :     0.0005620 Eh/α   predicted    -0.5596079E-05 ( -40.64%)
   displ. norm   :     0.0157676 α      lambda       -0.1583840E-05
   maximum displ.:     0.0082029 α      in ANC's #5, #9, #4, ...
 * RMSD in coord.:     0.2506982 α      energy gain  -0.2157065E-01 Eh

generating ANC from model Hessian ...
Using Lindh-Hessian (1995)
 Shifting diagonal of input Hessian by   4.163153988441125E-003
 Lowest  eigenvalues of input Hessian
   -0.000000   -0.000000   -0.000000   -0.000000   -0.000000    0.000000
    0.005000    0.006342    0.006574    0.006873    0.008766    0.009982
    0.010827    0.011789    0.014681    0.018101    0.019105    0.020016
 Highest eigenvalues
    1.711981    1.805447    1.875128    1.972516    2.051808    2.140271
 

........................................................................
.............................. CYCLE   21 ..............................
........................................................................
   1    -45.8353098 -0.458353E+02  0.130E-02    2.44       0.0  T
   2    -45.8353099 -0.896297E-07  0.627E-03    2.44       2.9  T
   3    -45.8353099  0.176271E-08  0.135E-03    2.44      13.6  T
   4    -45.8353100 -0.214580E-07  0.735E-04    2.44      24.9  T
   5    -45.8353100 -0.431182E-08  0.186E-04    2.44      98.1  T
     SCC iter.                  ...        0 min,  0.009 sec
     gradient                   ...        0 min,  0.022 sec
 * total energy  :   -45.2060606 Eh     change       -0.1851172E-05 Eh
   gradient norm :     0.0003719 Eh/α   predicted     0.0000000E+00 (-100.00%)
   displ. norm   :     0.0157191 α      lambda       -0.1094621E-05
   maximum displ.:     0.0095265 α      in ANC's #4, #3, #5, ...

   *** GEOMETRY OPTIMIZATION CONVERGED AFTER 21 ITERATIONS ***

------------------------------------------------------------------------
 total energy gain   :        -0.0215725 Eh      -13.5369 kcal/mol
 total RMSD          :         0.2506982 a0        0.1327 Å
 total power (kW/mol):        -2.6970760 (step)  -56.3484 (real)
------------------------------------------------------------------------

 ANCopt (total)                0 d,  0 h,  0 min,  1.005 sec
 optimizer setup                ...        0 min,  0.000 sec (  0.015%)
 model hessian                  ...        0 min,  0.019 sec (  1.927%)
 ANC generation                 ...        0 min,  0.002 sec (  0.186%)
 coordinate transformation      ...        0 min,  0.000 sec (  0.042%)
 single point calculation       ...        0 min,  0.976 sec ( 97.083%)
 optimization log               ...        0 min,  0.002 sec (  0.247%)
 hessian update                 ...        0 min,  0.000 sec (  0.031%)
 rational function              ...        0 min,  0.003 sec (  0.339%)

================
 final structure:
================
$coord
    5.92428452313866   -1.30005264038313    0.00924250672333      C 
    5.23306778371886    1.00135490724881   -0.01006402163500      N 
    2.66376519950390    1.24310957990749    0.00152831414070      C 
    1.36777372820389   -1.09673967336717    0.02406867945051      C 
    3.51361492446736   -3.57726359197794    0.04347889964490      S 
   -1.23206752666106   -1.11397414470331    0.00450850652721      C 
   -2.54079476040068    1.17101502797158   -0.01946762857012      C 
   -1.27653493842635    3.50131027715841   -0.00137998696945      C 
    1.35132378964271    3.53945193427656   -0.02040506159119      C 
    2.89177262383352    5.92443654243566    0.03296533230889      C 
    3.43283326313613    6.72421462569223    2.75854807785670      C 
   -2.83048301538436    5.88858075920428   -0.03250113109750      C 
   -3.55237663725211    6.63368482006714   -2.73328699115516      C 
   -5.13856650314434    0.88674196601047    0.07476788333004      N 
   -6.02055914232655   -1.66042879906328   -0.29201868897935      C 
   -3.26531613226848   -3.74918304889340    0.00263471115539      S 
    7.86061952640365   -1.89672664623997    0.00431763699484      H 
    1.93187439569078    7.44488885848238   -0.97125609992242      H 
    4.68527464990035    5.54950269618624   -0.90923405548434      H 
    1.68488133856054    7.03742416435627    3.79518962214702      H 
    4.53609157410466    8.45784000676647    2.78734540105762      H 
    4.49809913256439    5.25174325460334    3.71535630692547      H 
   -1.77639568572163    7.42968249190710    0.83092675893647      H 
   -4.53583071787892    5.60675089610865    1.09622696246299      H 
   -1.86414575786006    7.00237705832612   -3.84554264128643      H 
   -4.71529140469557    8.32885048264762   -2.72612596675533      H 
   -4.60006853358002    5.12962608694377   -3.66635273261260      H 
   -6.20582995991317    2.24700909137077   -0.72440145806160      H 
   -6.87546725805484   -1.96395840548356   -2.16041930570876      H 
   -7.38672074736142   -2.18737836315399    1.16868939370142      H 
$end
           -------------------------------------------------
          |                Final Singlepoint                |
           -------------------------------------------------

          ...................................................
          :                      SETUP                      :
          :.................................................:
          :  # basis functions                  90          :
          :  # atomic orbitals                  88          :
          :  # shells                           48          :
          :  # electrons                        84          :
          :  max. iterations                   250          :
          :  Hamiltonian                  GFN2-xTB          :
          :  restarted?                      false          :
          :  GBSA solvation                  false          :
          :  PC potential                    false          :
          :  electronic temp.          300.0000000     K    :
          :  accuracy                    1.0000000          :
          :  -> integral cutoff          0.2500000E+02      :
          :  -> integral neglect         0.1000000E-07      :
          :  -> SCF convergence          0.1000000E-05 Eh   :
          :  -> wf. convergence          0.1000000E-03 e    :
          :  Broyden damping             0.4000000          :
          ...................................................

 iter      E             dE          RMSdq      gap      omega  full diag
   1    -45.8353100 -0.458353E+02  0.915E-05    2.44       0.0  T
   2    -45.8353100 -0.165556E-10  0.358E-05    2.44     509.9  T
   3    -45.8353100 -0.568434E-13  0.359E-05    2.44     508.3  T

   *** convergence criteria satisfied after 3 iterations ***

         #    Occupation            Energy/Eh            Energy/eV
      -------------------------------------------------------------
         1        2.0000           -0.7281166             -19.8131
       ...           ...                  ...                  ...
        36        2.0000           -0.4307782             -11.7221
        37        2.0000           -0.4218883             -11.4802
        38        2.0000           -0.4180466             -11.3756
        39        2.0000           -0.3996411             -10.8748
        40        2.0000           -0.3905943             -10.6286
        41        2.0000           -0.3786469             -10.3035
        42        2.0000           -0.3461772              -9.4200 (HOMO)
        43                         -0.2564378              -6.9780 (LUMO)
        44                         -0.2297004              -6.2505
        45                         -0.2245537              -6.1104
        46                         -0.1997409              -5.4352
        47                         -0.1925839              -5.2405
       ...                                ...                  ...
        88                          0.6774781              18.4351
      -------------------------------------------------------------
                  HL-Gap            0.0897394 Eh            2.4419 eV
             Fermi-level           -0.3013075 Eh           -8.1990 eV

 SCC (total)                   0 d,  0 h,  0 min,  0.043 sec
 SCC setup                      ...        0 min,  0.000 sec (  0.586%)
 Dispersion                     ...        0 min,  0.000 sec (  0.620%)
 integral evaluation            ...        0 min,  0.014 sec ( 32.861%)
 zeroth order Hamiltonian       ...        0 min,  0.000 sec (  0.587%)
 iterations                     ...        0 min,  0.006 sec ( 13.054%)
 molecular gradient             ...        0 min,  0.022 sec ( 51.192%)
 printout                       ...        0 min,  0.000 sec (  0.979%)

         :::::::::::::::::::::::::::::::::::::::::::::::::::::
         ::                     SUMMARY                     ::
         :::::::::::::::::::::::::::::::::::::::::::::::::::::
         :: total energy             -45.206060614806 Eh    ::
         :: gradient norm              0.000372175948 Eh/a0 ::
         :: HOMO-LUMO gap              2.441933391618 eV    ::
         ::.................................................::
         :: SCC energy               -45.835309955290 Eh    ::
         :: -> isotropic ES            0.016886867645 Eh    ::
         :: -> anisotropic ES          0.007883262307 Eh    ::
         :: -> anisotropic XC          0.025519004433 Eh    ::
         :: -> dispersion             -0.035496583394 Eh    ::
         :: repulsion energy           0.628855105518 Eh    ::
         :: add. restraining           0.000000000000 Eh    ::
         :::::::::::::::::::::::::::::::::::::::::::::::::::::

           -------------------------------------------------
          |                Property Printout                |
           -------------------------------------------------

    * Orbital Energies and Occupations

         #    Occupation            Energy/Eh            Energy/eV
      -------------------------------------------------------------
         1        2.0000           -0.7281166             -19.8131
       ...           ...                  ...                  ...
        30        2.0000           -0.4711440             -12.8205
        31        2.0000           -0.4674089             -12.7188
        32        2.0000           -0.4592677             -12.4973
        33        2.0000           -0.4487295             -12.2106
        34        2.0000           -0.4453005             -12.1172
        35        2.0000           -0.4377412             -11.9115
        36        2.0000           -0.4307782             -11.7221
        37        2.0000           -0.4218883             -11.4802
        38        2.0000           -0.4180466             -11.3756
        39        2.0000           -0.3996411             -10.8748
        40        2.0000           -0.3905943             -10.6286
        41        2.0000           -0.3786469             -10.3035
        42        2.0000           -0.3461772              -9.4200 (HOMO)
        43                         -0.2564378              -6.9780 (LUMO)
        44                         -0.2297004              -6.2505
        45                         -0.2245537              -6.1104
        46                         -0.1997409              -5.4352
        47                         -0.1925839              -5.2405
        48                         -0.1349172              -3.6713
        49                         -0.1173736              -3.1939
        50                         -0.1088070              -2.9608
        51                         -0.0364271              -0.9912
        52                         -0.0090326              -0.2458
        53                         -0.0040994              -0.1115
       ...                                ...                  ...
        88                          0.6774781              18.4351
      -------------------------------------------------------------
                  HL-Gap            0.0897394 Eh            2.4419 eV
             Fermi-level           -0.3013075 Eh           -8.1990 eV

     #   Z        covCN         q      C6AA      α(0)
     1   6 C      2.980     0.082    26.160     8.390
     2   7 N      1.929    -0.218    26.591     7.646
     3   6 C      3.209     0.053    26.213     8.336
     4   6 C      3.010     0.010    27.779     8.646
     5  16 S      2.201    -0.073   144.084    20.203
     6   6 C      2.995     0.013    27.711     8.635
     7   6 C      3.037     0.056    26.710     8.477
     8   6 C      2.969    -0.028    28.692     8.786
     9   6 C      2.969    -0.004    28.129     8.700
    10   6 C      3.807    -0.058    21.605     6.617
    11   6 C      3.753    -0.098    22.433     6.754
    12   6 C      3.806    -0.058    21.613     6.618
    13   6 C      3.752    -0.097    22.415     6.751
    14   7 N      2.752    -0.192    25.168     7.451
    15   6 C      3.746     0.061    19.613     6.317
    16  16 S      2.121    -0.147   147.253    20.424
    17   1 H      0.926     0.051     2.302     2.372
    18   1 H      0.925     0.040     2.454     2.450
    19   1 H      0.924     0.059     2.213     2.326
    20   1 H      0.925     0.033     2.550     2.497
    21   1 H      0.925     0.038     2.482     2.464
    22   1 H      0.925     0.043     2.403     2.424
    23   1 H      0.925     0.049     2.333     2.389
    24   1 H      0.924     0.035     2.513     2.479
    25   1 H      0.925     0.039     2.461     2.453
    26   1 H      0.925     0.036     2.501     2.473
    27   1 H      0.925     0.027     2.631     2.536
    28   1 H      0.860     0.164     1.308     1.792
    29   1 H      0.923     0.033     2.539     2.492
    30   1 H      0.924     0.051     2.308     2.376

 Mol. C6AA /au·bohr⁶  :      13300.376788
 Mol. C8AA /au·bohr⁸  :     374089.387036
 Mol. α(0) /au        :        182.273140


Wiberg/Mayer (AO) data.
largest (>0.10) Wiberg bond orders for each atom
          total WBO             WBO to atom ...
     1  C   3.947        N    2 1.713    S    5 1.114    H   17 0.964
     2  N   3.143        C    1 1.713    C    3 1.187    S    5 0.178
     3  C   3.970        C    9 1.305    C    4 1.252    N    2 1.187
     4  C   3.953        C    6 1.369    C    3 1.252    S    5 1.115
     5  S   2.574        C    4 1.115    C    1 1.114    N    2 0.178
     6  C   3.952        C    4 1.369    C    7 1.324    S   16 1.030
     7  C   3.967        C    6 1.324    C    8 1.307    N   14 1.127
     8  C   3.981        C    9 1.427    C    7 1.307    C   12 1.007
     9  C   3.987        C    8 1.427    C    3 1.305    C   10 1.012
    10  C   3.995        C    9 1.012    C   11 0.999    H   18 0.970    H   19 0.970
    11  C   3.994        C   10 0.999    H   22 0.988    H   20 0.987    H   21 0.986
    12  C   3.996        C    8 1.007    C   13 1.003    H   24 0.971    H   23 0.970
    13  C   3.995        C   12 1.003    H   25 0.987    H   27 0.986    H   26 0.986
    14  N   3.282        C    7 1.127    C   15 1.021    H   28 0.934
    15  C   3.974        N   14 1.021    S   16 0.981    H   29 0.970    H   30 0.970
    16  S   2.220        C    6 1.030    C   15 0.981
    17  H   0.997        C    1 0.964
    18  H   0.998        C   10 0.970
    19  H   0.996        C   10 0.970
    20  H   0.999        C   11 0.987
    21  H   0.997        C   11 0.986
    22  H   0.998        C   11 0.988
    23  H   0.997        C   12 0.970
    24  H   0.998        C   12 0.971
    25  H   0.998        C   13 0.987
    26  H   0.998        C   13 0.986
    27  H   0.999        C   13 0.986
    28  H   0.972        N   14 0.934
    29  H   0.997        C   15 0.970
    30  H   0.996        C   15 0.970

molecular dipole:
                 x           y           z       tot (Debye)
 q only:       -0.844       0.984      -0.141
   full:       -1.221       1.122      -0.340       4.303
molecular quadrupole (traceless):
                xx          xy          yy          xz          yz          zz
 q only:        5.725      -2.990      -1.185       1.709      -0.191      -4.540
  q+dip:        9.391      -6.577      -4.773       3.068      -0.774      -4.619
   full:        8.815      -6.567      -5.402       3.462      -0.747      -3.413

           -------------------------------------------------
          |                Geometry Summary                 |
           -------------------------------------------------

      molecular mass/u    :      250.3760000
   center of mass at/Å    :       -0.0030232       0.4423158      -0.0051879
  moments of inertia/u·Å² :        0.1029576E+04   0.1055981E+04   0.1955746E+04
rotational constants/cm⁻¹ :        0.1637337E-01   0.1596396E-01   0.8619542E-02

 * 28 selected distances

     #   Z        #   Z                                     value/Å
     1   6 C      2   7 N                                 1.2716373
     2   7 N      3   6 C                                 1.3656358
     3   6 C      4   6 C                                 1.4154870
     1   6 C      5  16 S                                 1.7549380 (max)
     4   6 C      5  16 S                                 1.7356700
     4   6 C      6   6 C                                 1.3758460
     6   6 C      7   6 C                                 1.3935074
     7   6 C      8   6 C                                 1.4029642
     3   6 C      9   6 C                                 1.3996885
     8   6 C      9   6 C                                 1.3907860
    10   6 C     11   6 C                                 1.5301545
    12   6 C     13   6 C                                 1.5310109
     7   6 C     14   7 N                                 1.3837869
    14   7 N     15   6 C                                 1.4395686
     1   6 C     17   1 H                                 1.0722126
    10   6 C     18   1 H                                 1.0898535
    10   6 C     19   1 H                                 1.0902804
    11   6 C     20   1 H                                 1.0881076
    11   6 C     21   1 H                                 1.0875159
    11   6 C     22   1 H                                 1.0868695
    12   6 C     23   1 H                                 1.0885631
    12   6 C     24   1 H                                 1.0924231
    13   6 C     25   1 H                                 1.0874780
    13   6 C     26   1 H                                 1.0878434
    13   6 C     27   1 H                                 1.0884165
    14   7 N     28   1 H                                 1.0079472 (min)
    15   6 C     29   1 H                                 1.0990999
    15   6 C     30   1 H                                 1.0944815

 * 5 distinct bonds (by element types)

   Z      Z             #   av. dist./Å        max./Å        min./Å
   1 H    6 C          13     1.0887034     1.0990999     1.0722126
   6 C    6 C           8     1.4299306     1.5310109     1.3758460
   1 H    7 N           1     1.0079472     1.0079472     1.0079472
   6 C    7 N           4     1.3651571     1.4395686     1.2716373
   6 C   16 S           2     1.7453040     1.7549380     1.7356700


optimized geometry written to: xtbopt.xyz


           -------------------------------------------------
          | TOTAL ENERGY              -45.206060614806 Eh   |
          | GRADIENT NORM               0.000372175948 Eh/α |
          | HOMO-LUMO GAP               2.441933391618 eV   |
           -------------------------------------------------

------------------------------------------------------------------------
 * finished run on 2021/05/19 at 11:01:11.951     
------------------------------------------------------------------------
 total:
 * wall-time:     0 d,  0 h,  0 min,  1.136 sec
 *  cpu-time:     0 d,  0 h,  0 min,  1.132 sec
 * ratio c/w:     0.997 speedup
 SCF:
 * wall-time:     0 d,  0 h,  0 min,  0.061 sec
 *  cpu-time:     0 d,  0 h,  0 min,  0.060 sec
 * ratio c/w:     0.998 speedup
 ANC optimizer:
 * wall-time:     0 d,  0 h,  0 min,  1.049 sec
 *  cpu-time:     0 d,  0 h,  0 min,  1.046 sec
 * ratio c/w:     0.998 speedup

