      -----------------------------------------------------------      
     |                   =====================                   |     
     |                           x T B                           |     
     |                   =====================                   |     
     |                         S. Grimme                         |     
     |          Mulliken Center for Theoretical Chemistry        |     
     |                    University of Bonn                     |     
     |                Version 6.2 RC2 (SAW190805)                |     
      -----------------------------------------------------------      

   This program is distributed in the hope that it will be useful,
   but WITHOUT ANY WARRANTY; without even the implied warranty of
   MERCHANTABILITY or FITNESS FOR A PARTICULAR PURPOSE.
   
   FOR NON-COMMERCIAL, ACADEMIA USE ONLY.
   
   Cite this work as:
   * S. Grimme, C. Bannwarth, P. Shushkov, J. Chem. Theory Comput., 2017,
     13, 1989-2009. DOI: 10.1021/acs.jctc.7b00118
   * C. Bannwarth, S. Ehlert and S. Grimme., J. Chem. Theory Comput., 2019,
     15, 1652-1671. DOI: 10.1021/acs.jctc.8b01176
   * P. Pracht, E. Caldeweyher, S. Ehlert, S. Grimme, ChemRxiv, 2019, preprint.
     DOI: 10.26434/chemrxiv.8326202.v1
   
   for DFT-D4:
   * E. Caldeweyher, C. Bannwarth and S. Grimme, J. Chem. Phys., 2017,
     147, 034112. DOI: 10.1063/1.4993215
   * E. Caldeweyher, S. Ehlert, A. Hansen, H. Neugebauer, S. Spicher,
     C. Bannwarth and S. Grimme, J. Chem. Phys., 2019, 150, 154122.
     DOI: 10.1063/1.5090222
   
   for sTDA-xTB:
   * S. Grimme and C. Bannwarth, J. Chem. Phys., 2016, 145, 054103.
     DOI: 10.1063/1.4959605
   
   in the mass-spec context:
   * V. Asgeirsson, C. Bauer and S. Grimme, Chem. Sci., 2017, 8, 4879.
     DOI: 10.1039/c7sc00601b
   
   for metadynamics refer to:
   * S. Grimme, J. Chem. Theory Comput., 2019, 155, 2847-2862
     DOI: 10.1021/acs.jctc.9b00143
   
   with help from (in alphabetical order)
   C. Bannwarth, F. Bohle, G. Brandenburg, E. Caldeweyher, M. Checinski,
   S. Dohm, S. Ehlert, S. Ehrlich, F. März, H. Neugebauer, J. Pisarek,
   P. Pracht, P. Shushkov, and S. Spicher.
   
 * started run on 2021/05/19 at 11:01:18.170     

           -------------------------------------------------
          |                Calculation Setup                |
           -------------------------------------------------

          program call               : /ihome/ghutchison/geoffh/xtb/xtb 1051.xyz -opt
          hostname                   : smp-n144
          coordinate file            : 1051.xyz
          omp threads                :                     1
          number of atoms            :                    24
          number of electrons        :                    66
          charge                     :                     0
          spin                       :                   0.0
          first test random number   :      0.97002593495520


########################################################################
# WARNING! Please study the warnings concerning your input carefully
#  - the use of '-opt' is discouraged, please use '--opt' next time
########################################################################

           ------------------------------------------------- 
          |                 G F N 2 - x T B                 |
          | Geometry, Frequencies, Noncovalent interactions |
          |            JCTC 2019 parametrisation            |
           ------------------------------------------------- 
             KAB for C  - Si     :                1.0500
             KAB for H  - Pd     :                0.9500
             k(s)              :                1.8500
             k(p)              :                2.2300
             k(d)              :                2.2300
             k(f)              :                2.0000
             kEN (H0ij)        :               -2.0000
             D4 a1             :                0.5200
             D4 a2             :                5.0000
             D4 s6             :                1.0000
             D4 s8             :                2.7000
             D4 s9             :                5.0000
             alphaj            :                2.0000

  Z AO/shell   Hii/eV     exponent
  1     Wed Apr 25 08:07:45 CEST 2018   EN: 2.200 GM2: 0.406  GM3: 0.0800  RAES: 1.40
     1s    -10.707211    1.230000
  6     Wed Apr 25 08:07:45 CEST 2018   EN: 2.550 GM2: 0.538  GM3: 0.1500  RAES: 3.00
     2s    -13.970922    2.096432
     2p    -10.063292    1.800000
  7     Wed Apr 25 08:07:45 CEST 2018   EN: 3.040 GM2: 0.461  GM3:-0.0640  RAES: 1.90
     2s    -16.686243    2.339881
     2p    -12.523956    2.014332
 16     Tue Apr 24 11:44:34 CEST 2018   EN: 2.580 GM2: 0.340  GM3:-0.0502  RAES: 3.10
     3s    -20.029654    1.981333
     3p    -11.377694    2.025643
     3d     -0.420282    1.702555

           ------------------------------------------------- 
          |        Self-Consistent Charge Iterations        |
           ------------------------------------------------- 

          ...................................................
          :                      SETUP                      :
          :.................................................:
          :  # basis functions                  72          :
          :  # atomic orbitals                  70          :
          :  # shells                           38          :
          :  # electrons                        66          :
          :  max. iterations                   250          :
          :  Hamiltonian                  GFN2-xTB          :
          :  restarted?                      false          :
          :  GBSA solvation                  false          :
          :  PC potential                    false          :
          :  electronic temp.          300.0000000     K    :
          :  accuracy                    1.0000000          :
          :  -> integral cutoff          0.2500000E+02      :
          :  -> integral neglect         0.1000000E-07      :
          :  -> SCF convergence          0.1000000E-05 Eh   :
          :  -> wf. convergence          0.1000000E-03 e    :
          :  Broyden damping             0.4000000          :
          ...................................................

 iter      E             dE          RMSdq      gap      omega  full diag
   1    -35.8256720 -0.358257E+02  0.413E+00    1.36       0.0  T
   2    -35.8472005 -0.215285E-01  0.349E+00    0.87       1.0  T
   3    -35.9165078 -0.693073E-01  0.176E+00    1.42       1.0  T
   4    -35.9277349 -0.112271E-01  0.450E-01    1.04       1.0  T
   5    -35.9284683 -0.733410E-03  0.307E-01    1.05       1.0  T
   6    -35.9290942 -0.625908E-03  0.127E-01    1.03       1.0  T
   7    -35.9292791 -0.184902E-03  0.501E-02    1.02       1.0  T
   8    -35.9292906 -0.115118E-04  0.182E-02    1.03       1.1  T
   9    -35.9292918 -0.116504E-05  0.101E-02    1.02       2.0  T
  10    -35.9292921 -0.320030E-06  0.345E-03    1.02       5.9  T
  11    -35.9292921 -0.111237E-07  0.116E-03    1.02      17.6  T
  12    -35.9292922 -0.582156E-08  0.503E-04    1.02      40.6  T
  13    -35.9292922 -0.402210E-09  0.186E-04    1.02     109.6  T

   *** convergence criteria satisfied after 13 iterations ***

         #    Occupation            Energy/Eh            Energy/eV
      -------------------------------------------------------------
         1        2.0000           -0.7489653             -20.3804
       ...           ...                  ...                  ...
        27        2.0000           -0.4508194             -12.2674
        28        2.0000           -0.4454688             -12.1218
        29        2.0000           -0.4320341             -11.7562
        30        2.0000           -0.3993778             -10.8676
        31        2.0000           -0.3947154             -10.7408
        32        2.0000           -0.3633976              -9.8886
        33        2.0000           -0.3475389              -9.4570 (HOMO)
        34                         -0.3099614              -8.4345 (LUMO)
        35                         -0.2412270              -6.5641
        36                         -0.1848244              -5.0293
        37                         -0.1808065              -4.9200
        38                         -0.1286879              -3.5018
       ...                                ...                  ...
        70                          0.5953114              16.1992
      -------------------------------------------------------------
                  HL-Gap            0.0375775 Eh            1.0225 eV
             Fermi-level           -0.3287502 Eh           -8.9457 eV

 SCC (total)                   0 d,  0 h,  0 min,  0.041 sec
 SCC setup                      ...        0 min,  0.000 sec (  0.735%)
 Dispersion                     ...        0 min,  0.000 sec (  0.752%)
 integral evaluation            ...        0 min,  0.009 sec ( 22.820%)
 zeroth order Hamiltonian       ...        0 min,  0.000 sec (  0.459%)
 iterations                     ...        0 min,  0.016 sec ( 38.053%)
 molecular gradient             ...        0 min,  0.015 sec ( 36.133%)
 printout                       ...        0 min,  0.000 sec (  0.915%)

         :::::::::::::::::::::::::::::::::::::::::::::::::::::
         ::                     SUMMARY                     ::
         :::::::::::::::::::::::::::::::::::::::::::::::::::::
         :: total energy             -35.545111094289 Eh    ::
         :: gradient norm              0.069782986829 Eh/a0 ::
         :: HOMO-LUMO gap              1.022535759412 eV    ::
         ::.................................................::
         :: SCC energy               -35.929292150965 Eh    ::
         :: -> isotropic ES            0.020741016744 Eh    ::
         :: -> anisotropic ES          0.007928987310 Eh    ::
         :: -> anisotropic XC          0.023640392436 Eh    ::
         :: -> dispersion             -0.026073375996 Eh    ::
         :: repulsion energy           0.383911908213 Eh    ::
         :: add. restraining           0.000000000000 Eh    ::
         :::::::::::::::::::::::::::::::::::::::::::::::::::::

      ----------------------------------------------------------- 
     |                   =====================                   |
     |                        A N C O P T                        |
     |                   =====================                   |
     |               Approximate Normal Coordinate               |
     |                Rational Function Optimizer                |
      ----------------------------------------------------------- 

          ...................................................
          :                      SETUP                      :
          :.................................................:
          :   optimization level            normal          :
          :   max. optcycles                   200          :
          :   ANC micro-cycles                  20          :
          :   degrees of freedom                66          :
          :.................................................:
          :   RF solver                   davidson          :
          :   input Hessian                  false          :
          :   write xtbopt.log                true          :
          :   linear?                        false          :
          :   energy convergence         0.5000000E-05 Eh   :
          :   grad. convergence          0.1000000E-02 Eh/α :
          :   maximium RF displ.         2.0000000          :
          :   Hlow (freq-cutoff)         0.5000000E-02      :
          :   Hmax (freq-cutoff)         5.0000000          :
          :   S6 in model hess.         20.0000000          :
          ...................................................

generating ANC from model Hessian ...
Using Lindh-Hessian (1995)
 Shifting diagonal of input Hessian by   2.967567627163343E-003
 Lowest  eigenvalues of input Hessian
   -0.000000   -0.000000    0.000000    0.000000    0.000000    0.000000
    0.005000    0.006585    0.007447    0.009353    0.011829    0.013353
    0.018010    0.019533    0.021549    0.025011    0.027167    0.030750
 Highest eigenvalues
    1.309574    1.333650    1.380310    1.558543    1.655799    2.032280
 

........................................................................
.............................. CYCLE    1 ..............................
........................................................................
   1    -35.9292922 -0.359293E+02  0.578E-05    1.02       0.0  T
   2    -35.9292922 -0.409983E-11  0.329E-05    1.02     620.8  T
   3    -35.9292922  0.128608E-11  0.231E-05    1.02     882.1  T
     SCC iter.                  ...        0 min,  0.004 sec
     gradient                   ...        0 min,  0.015 sec
 * total energy  :   -35.5451111 Eh     change        0.8466692E-08 Eh
   gradient norm :     0.0697836 Eh/α   predicted     0.0000000E+00 (-100.00%)
   displ. norm   :     0.3610072 α      lambda       -0.1272612E-01
   maximum displ.:     0.1417860 α      in ANC's #4, #12, #25, ...

........................................................................
.............................. CYCLE    2 ..............................
........................................................................
   1    -35.9610885 -0.359611E+02  0.428E-01    1.12       0.0  T
   2    -35.9611628 -0.743941E-04  0.223E-01    1.11       1.0  T
   3    -35.9608433  0.319571E-03  0.171E-01    1.17       1.0  T
   4    -35.9612943 -0.451008E-03  0.331E-02    1.13       1.0  T
   5    -35.9612948 -0.533468E-06  0.151E-02    1.13       1.4  T
   6    -35.9612959 -0.111763E-05  0.646E-03    1.13       3.2  T
   7    -35.9612965 -0.561160E-06  0.218E-03    1.13       9.4  T
   8    -35.9612965 -0.883117E-08  0.934E-04    1.13      21.9  T
     SCC iter.                  ...        0 min,  0.009 sec
     gradient                   ...        0 min,  0.014 sec
 * total energy  :   -35.5537804 Eh     change       -0.8669308E-02 Eh
   gradient norm :     0.0322775 Eh/α   predicted    -0.7192333E-02 ( -17.04%)
   displ. norm   :     0.3261549 α      lambda       -0.3755572E-02
   maximum displ.:     0.1777829 α      in ANC's #4, #12, #6, ...

........................................................................
.............................. CYCLE    3 ..............................
........................................................................
   1    -35.9764241 -0.359764E+02  0.423E-01    1.19       0.0  T
   2    -35.9764977 -0.736554E-04  0.205E-01    1.17       1.0  T
   3    -35.9763127  0.185031E-03  0.123E-01    1.22       1.0  T
   4    -35.9765558 -0.243121E-03  0.279E-02    1.18       1.0  T
   5    -35.9765563 -0.494951E-06  0.110E-02    1.18       1.9  T
   6    -35.9765568 -0.458314E-06  0.270E-03    1.19       7.5  T
   7    -35.9765568 -0.204634E-07  0.157E-03    1.19      13.0  T
     SCC iter.                  ...        0 min,  0.008 sec
     gradient                   ...        0 min,  0.014 sec
 * total energy  :   -35.5559464 Eh     change       -0.2166029E-02 Eh
   gradient norm :     0.0087113 Eh/α   predicted    -0.2077560E-02 (  -4.08%)
   displ. norm   :     0.2463061 α      lambda       -0.7775895E-03
   maximum displ.:     0.1655635 α      in ANC's #4, #6, #2, ...

........................................................................
.............................. CYCLE    4 ..............................
........................................................................
   1    -35.9757098 -0.359757E+02  0.426E-01    1.19       0.0  T
   2    -35.9757823 -0.725066E-04  0.192E-01    1.20       1.0  T
   3    -35.9757932 -0.109727E-04  0.368E-02    1.20       1.0  T
   4    -35.9757942 -0.952635E-06  0.235E-02    1.20       1.0  T
   5    -35.9757967 -0.255627E-05  0.110E-02    1.20       1.9  T
   6    -35.9757980 -0.129700E-05  0.255E-03    1.20       8.0  T
   7    -35.9757981 -0.311375E-07  0.146E-03    1.20      14.0  T
     SCC iter.                  ...        0 min,  0.008 sec
     gradient                   ...        0 min,  0.014 sec
 * total energy  :   -35.5564447 Eh     change       -0.4983012E-03 Eh
   gradient norm :     0.0093514 Eh/α   predicted    -0.4123825E-03 ( -17.24%)
   displ. norm   :     0.2513290 α      lambda       -0.5223567E-03
   maximum displ.:     0.1349067 α      in ANC's #2, #1, #4, ...

........................................................................
.............................. CYCLE    5 ..............................
........................................................................
   1    -35.9755748 -0.359756E+02  0.346E-01    1.23       0.0  T
   2    -35.9756238 -0.490246E-04  0.163E-01    1.22       1.0  T
   3    -35.9756286 -0.472311E-05  0.346E-02    1.23       1.0  T
   4    -35.9756305 -0.198235E-05  0.228E-02    1.22       1.0  T
   5    -35.9756345 -0.399905E-05  0.109E-02    1.23       1.9  T
   6    -35.9756350 -0.412285E-06  0.276E-03    1.23       7.4  T
   7    -35.9756350 -0.386396E-07  0.153E-03    1.23      13.4  T
     SCC iter.                  ...        0 min,  0.008 sec
     gradient                   ...        0 min,  0.014 sec
 * total energy  :   -35.5567839 Eh     change       -0.3392187E-03 Eh
   gradient norm :     0.0063427 Eh/α   predicted    -0.2776826E-03 ( -18.14%)
   displ. norm   :     0.2265987 α      lambda       -0.3099210E-03
   maximum displ.:     0.1464726 α      in ANC's #2, #1, #4, ...

........................................................................
.............................. CYCLE    6 ..............................
........................................................................
   1    -35.9750600 -0.359751E+02  0.252E-01    1.25       0.0  T
   2    -35.9750836 -0.236391E-04  0.122E-01    1.25       1.0  T
   3    -35.9750850 -0.141114E-05  0.269E-02    1.25       1.0  T
   4    -35.9750872 -0.219600E-05  0.176E-02    1.25       1.2  T
   5    -35.9750898 -0.255892E-05  0.319E-03    1.25       6.4  T
   6    -35.9750898 -0.308389E-07  0.170E-03    1.25      12.0  T
   7    -35.9750898  0.399488E-08  0.104E-03    1.25      19.6  T
     SCC iter.                  ...        0 min,  0.008 sec
     gradient                   ...        0 min,  0.014 sec
 * total energy  :   -35.5570082 Eh     change       -0.2242308E-03 Eh
   gradient norm :     0.0056354 Eh/α   predicted    -0.1629204E-03 ( -27.34%)
   displ. norm   :     0.2125900 α      lambda       -0.2235867E-03
   maximum displ.:     0.1501739 α      in ANC's #2, #1, #4, ...

........................................................................
.............................. CYCLE    7 ..............................
........................................................................
   1    -35.9758682 -0.359759E+02  0.199E-01    1.28       0.0  T
   2    -35.9758817 -0.134547E-04  0.977E-02    1.27       1.0  T
   3    -35.9758834 -0.174009E-05  0.193E-02    1.28       1.1  T
   4    -35.9758832  0.215310E-06  0.129E-02    1.27       1.6  T
   5    -35.9758847 -0.156498E-05  0.537E-03    1.27       3.8  T
   6    -35.9758849 -0.130091E-06  0.135E-03    1.27      15.2  T
   7    -35.9758849 -0.434569E-08  0.806E-04    1.27      25.3  T
     SCC iter.                  ...        0 min,  0.008 sec
     gradient                   ...        0 min,  0.014 sec
 * total energy  :   -35.5571771 Eh     change       -0.1689725E-03 Eh
   gradient norm :     0.0051310 Eh/α   predicted    -0.1168544E-03 ( -30.84%)
   displ. norm   :     0.2115568 α      lambda       -0.1652695E-03
   maximum displ.:     0.1488749 α      in ANC's #2, #1, #4, ...

........................................................................
.............................. CYCLE    8 ..............................
........................................................................
   1    -35.9760696 -0.359761E+02  0.179E-01    1.28       0.0  T
   2    -35.9760792 -0.960995E-05  0.914E-02    1.28       1.0  T
   3    -35.9760803 -0.100525E-05  0.180E-02    1.28       1.1  T
   4    -35.9760802  0.831790E-08  0.121E-02    1.28       1.7  T
   5    -35.9760818 -0.154626E-05  0.195E-03    1.28      10.5  T
   6    -35.9760818 -0.686884E-08  0.121E-03    1.28      16.8  T
     SCC iter.                  ...        0 min,  0.007 sec
     gradient                   ...        0 min,  0.014 sec
 * total energy  :   -35.5573004 Eh     change       -0.1232982E-03 Eh
   gradient norm :     0.0034495 Eh/α   predicted    -0.8633342E-04 ( -29.98%)
   displ. norm   :     0.2009564 α      lambda       -0.1252224E-03
   maximum displ.:     0.1396537 α      in ANC's #2, #1, #4, ...

........................................................................
.............................. CYCLE    9 ..............................
........................................................................
   1    -35.9771976 -0.359772E+02  0.134E-01    1.29       0.0  T
   2    -35.9772010 -0.342513E-05  0.723E-02    1.29       1.0  T
   3    -35.9771948  0.615852E-05  0.225E-02    1.29       1.0  T
   4    -35.9772024 -0.753991E-05  0.841E-03    1.29       2.4  T
   5    -35.9772027 -0.302506E-06  0.250E-03    1.29       8.2  T
   6    -35.9772027 -0.575371E-07  0.982E-04    1.29      20.8  T
   7    -35.9772027 -0.946437E-08  0.396E-04    1.29      51.5  T
     SCC iter.                  ...        0 min,  0.008 sec
     gradient                   ...        0 min,  0.015 sec
 * total energy  :   -35.5573888 Eh     change       -0.8839178E-04 Eh
   gradient norm :     0.0042417 Eh/α   predicted    -0.6514231E-04 ( -26.30%)
   displ. norm   :     0.1975210 α      lambda       -0.9401749E-04
   maximum displ.:     0.1345641 α      in ANC's #1, #2, #4, ...

........................................................................
.............................. CYCLE   10 ..............................
........................................................................
   1    -35.9771631 -0.359772E+02  0.123E-01    1.29       0.0  T
   2    -35.9771656 -0.245214E-05  0.690E-02    1.29       1.0  T
   3    -35.9771648  0.777163E-06  0.120E-02    1.29       1.7  T
   4    -35.9771660 -0.122686E-05  0.616E-03    1.29       3.3  T
   5    -35.9771664 -0.362631E-06  0.144E-03    1.29      14.2  T
   6    -35.9771664 -0.112062E-07  0.689E-04    1.29      29.6  T
     SCC iter.                  ...        0 min,  0.007 sec
     gradient                   ...        0 min,  0.014 sec
 * total energy  :   -35.5574548 Eh     change       -0.6599958E-04 Eh
   gradient norm :     0.0041490 Eh/α   predicted    -0.4884460E-04 ( -25.99%)
   displ. norm   :     0.1885714 α      lambda       -0.8074282E-04
   maximum displ.:     0.1358181 α      in ANC's #1, #2, #3, ...

........................................................................
.............................. CYCLE   11 ..............................
........................................................................
   1    -35.9768388 -0.359768E+02  0.115E-01    1.29       0.0  T
   2    -35.9768406 -0.184206E-05  0.648E-02    1.29       1.0  T
   3    -35.9768408 -0.206888E-06  0.851E-03    1.29       2.4  T
   4    -35.9768407  0.184117E-06  0.597E-03    1.29       3.4  T
   5    -35.9768411 -0.493931E-06  0.193E-03    1.29      10.6  T
   6    -35.9768412 -0.178908E-07  0.620E-04    1.29      32.9  T
     SCC iter.                  ...        0 min,  0.007 sec
     gradient                   ...        0 min,  0.014 sec
 * total energy  :   -35.5575128 Eh     change       -0.5794307E-04 Eh
   gradient norm :     0.0041872 Eh/α   predicted    -0.4180899E-04 ( -27.84%)
   displ. norm   :     0.1666008 α      lambda       -0.8531229E-04
   maximum displ.:     0.1231738 α      in ANC's #1, #2, #3, ...

........................................................................
.............................. CYCLE   12 ..............................
........................................................................
   1    -35.9775617 -0.359776E+02  0.155E-01    1.30       0.0  T
   2    -35.9775692 -0.752429E-05  0.779E-02    1.30       1.0  T
   3    -35.9775699 -0.662753E-06  0.165E-02    1.30       1.2  T
   4    -35.9775699  0.136119E-07  0.106E-02    1.30       1.9  T
   5    -35.9775710 -0.113367E-05  0.229E-03    1.30       8.9  T
   6    -35.9775711 -0.462602E-07  0.907E-04    1.30      22.5  T
     SCC iter.                  ...        0 min,  0.007 sec
     gradient                   ...        0 min,  0.014 sec
 * total energy  :   -35.5575749 Eh     change       -0.6207514E-04 Eh
   gradient norm :     0.0032215 Eh/α   predicted    -0.4385330E-04 ( -29.35%)
   displ. norm   :     0.1764885 α      lambda       -0.8052659E-04
   maximum displ.:     0.1264071 α      in ANC's #1, #3, #6, ...

........................................................................
.............................. CYCLE   13 ..............................
........................................................................
   1    -35.9764267 -0.359764E+02  0.170E-01    1.30       0.0  T
   2    -35.9764357 -0.905507E-05  0.850E-02    1.30       1.0  T
   3    -35.9764311  0.462795E-05  0.252E-02    1.29       1.0  T
   4    -35.9764379 -0.674239E-05  0.130E-02    1.30       1.6  T
   5    -35.9764387 -0.818758E-06  0.320E-03    1.30       6.4  T
   6    -35.9764388 -0.989618E-07  0.141E-03    1.30      14.4  T
   7    -35.9764388 -0.106152E-07  0.697E-04    1.30      29.3  T
   8    -35.9764388 -0.189102E-08  0.231E-04    1.30      88.2  T
     SCC iter.                  ...        0 min,  0.009 sec
     gradient                   ...        0 min,  0.015 sec
 * total energy  :   -35.5576271 Eh     change       -0.5228003E-04 Eh
   gradient norm :     0.0031408 Eh/α   predicted    -0.4152126E-04 ( -20.58%)
   displ. norm   :     0.1027282 α      lambda       -0.5528613E-04
   maximum displ.:     0.0552766 α      in ANC's #3, #1, #6, ...

........................................................................
.............................. CYCLE   14 ..............................
........................................................................
   1    -35.9771802 -0.359772E+02  0.135E-01    1.30       0.0  T
   2    -35.9771875 -0.727402E-05  0.635E-02    1.30       1.0  T
   3    -35.9771864  0.115071E-05  0.168E-02    1.29       1.2  T
   4    -35.9771891 -0.278635E-05  0.929E-03    1.30       2.2  T
   5    -35.9771895 -0.356594E-06  0.236E-03    1.29       8.6  T
   6    -35.9771895 -0.517032E-07  0.117E-03    1.30      17.5  T
   7    -35.9771896 -0.110077E-07  0.418E-04    1.30      48.8  T
   8    -35.9771896 -0.234799E-09  0.160E-04    1.30     127.9  T
     SCC iter.                  ...        0 min,  0.009 sec
     gradient                   ...        0 min,  0.015 sec
 * total energy  :   -35.5576557 Eh     change       -0.2861211E-04 Eh
   gradient norm :     0.0031547 Eh/α   predicted    -0.2793532E-04 (  -2.37%)
   displ. norm   :     0.1036818 α      lambda       -0.3417245E-04
   maximum displ.:     0.0717157 α      in ANC's #3, #1, #4, ...

........................................................................
.............................. CYCLE   15 ..............................
........................................................................
   1    -35.9763375 -0.359763E+02  0.917E-02    1.30       0.0  T
   2    -35.9763399 -0.246231E-05  0.462E-02    1.30       1.0  T
   3    -35.9763401 -0.218206E-06  0.960E-03    1.30       2.1  T
   4    -35.9763400  0.184583E-06  0.674E-03    1.30       3.0  T
   5    -35.9763405 -0.525455E-06  0.152E-03    1.30      13.5  T
   6    -35.9763405 -0.631569E-08  0.601E-04    1.30      33.9  T
   7    -35.9763405 -0.127007E-08  0.364E-04    1.30      56.0  T
     SCC iter.                  ...        0 min,  0.008 sec
     gradient                   ...        0 min,  0.015 sec
 * total energy  :   -35.5576732 Eh     change       -0.1745711E-04 Eh
   gradient norm :     0.0025180 Eh/α   predicted    -0.1727530E-04 (  -1.04%)
   displ. norm   :     0.0449204 α      lambda       -0.2359657E-04
   maximum displ.:     0.0303489 α      in ANC's #2, #6, #3, ...

........................................................................
.............................. CYCLE   16 ..............................
........................................................................
   1    -35.9769505 -0.359770E+02  0.356E-02    1.30       0.0  T
   2    -35.9769511 -0.531052E-06  0.179E-02    1.30       1.1  T
   3    -35.9769503  0.809243E-06  0.812E-03    1.30       2.5  T
   4    -35.9769513 -0.104518E-05  0.292E-03    1.30       7.0  T
   5    -35.9769513 -0.352431E-07  0.128E-03    1.30      16.0  T
   6    -35.9769513 -0.133893E-08  0.516E-04    1.30      39.5  T
   7    -35.9769513 -0.352163E-08  0.182E-04    1.30     112.2  T
     SCC iter.                  ...        0 min,  0.008 sec
     gradient                   ...        0 min,  0.015 sec
 * total energy  :   -35.5576898 Eh     change       -0.1662463E-04 Eh
   gradient norm :     0.0020678 Eh/α   predicted    -0.1182580E-04 ( -28.87%)
   displ. norm   :     0.0624243 α      lambda       -0.2124476E-04
   maximum displ.:     0.0352831 α      in ANC's #1, #6, #3, ...

........................................................................
.............................. CYCLE   17 ..............................
........................................................................
   1    -35.9770706 -0.359771E+02  0.535E-02    1.30       0.0  T
   2    -35.9770717 -0.119037E-05  0.269E-02    1.30       1.0  T
   3    -35.9770702  0.155522E-05  0.113E-02    1.30       1.8  T
   4    -35.9770722 -0.205943E-05  0.401E-03    1.30       5.1  T
   5    -35.9770723 -0.479032E-07  0.161E-03    1.30      12.7  T
   6    -35.9770723 -0.109120E-07  0.698E-04    1.30      29.2  T
   7    -35.9770723 -0.640684E-08  0.198E-04    1.30     103.3  T
     SCC iter.                  ...        0 min,  0.008 sec
     gradient                   ...        0 min,  0.015 sec
 * total energy  :   -35.5577016 Eh     change       -0.1176514E-04 Eh
   gradient norm :     0.0020778 Eh/α   predicted    -0.1066453E-04 (  -9.35%)
   displ. norm   :     0.0584581 α      lambda       -0.1194819E-04
   maximum displ.:     0.0381338 α      in ANC's #1, #3, #4, ...

........................................................................
.............................. CYCLE   18 ..............................
........................................................................
   1    -35.9772449 -0.359772E+02  0.357E-02    1.29       0.0  T
   2    -35.9772452 -0.308504E-06  0.191E-02    1.29       1.1  T
   3    -35.9772453 -0.528336E-07  0.338E-03    1.29       6.0  T
   4    -35.9772453  0.399495E-08  0.158E-03    1.29      13.0  T
   5    -35.9772453 -0.160303E-07  0.538E-04    1.29      37.9  T
   6    -35.9772453 -0.574230E-08  0.132E-04    1.29     154.9  T
     SCC iter.                  ...        0 min,  0.007 sec
     gradient                   ...        0 min,  0.015 sec
 * total energy  :   -35.5577072 Eh     change       -0.5561848E-05 Eh
   gradient norm :     0.0016105 Eh/α   predicted    -0.5998214E-05 (   7.85%)
   displ. norm   :     0.0395103 α      lambda       -0.4720329E-05
   maximum displ.:     0.0322325 α      in ANC's #1, #3, #2, ...

........................................................................
.............................. CYCLE   19 ..............................
........................................................................
   1    -35.9772468 -0.359772E+02  0.299E-02    1.30       0.0  T
   2    -35.9772471 -0.260479E-06  0.161E-02    1.29       1.3  T
   3    -35.9772469  0.180427E-06  0.482E-03    1.29       4.2  T
   4    -35.9772471 -0.225628E-06  0.211E-03    1.29       9.7  T
   5    -35.9772471 -0.329441E-07  0.652E-04    1.29      31.3  T
   6    -35.9772471 -0.338645E-08  0.103E-04    1.29     199.0  T
     SCC iter.                  ...        0 min,  0.007 sec
     gradient                   ...        0 min,  0.015 sec
 * total energy  :   -35.5577111 Eh     change       -0.3983008E-05 Eh
   gradient norm :     0.0007140 Eh/α   predicted    -0.2362853E-05 ( -40.68%)
   displ. norm   :     0.0184776 α      lambda       -0.1001346E-05
   maximum displ.:     0.0137073 α      in ANC's #1, #3, #9, ...

   *** GEOMETRY OPTIMIZATION CONVERGED AFTER 19 ITERATIONS ***

------------------------------------------------------------------------
 total energy gain   :        -0.0126000 Eh       -7.9066 kcal/mol
 total RMSD          :         0.4671463 a0        0.2472 Å
 total power (kW/mol):        -1.7411268 (step)  -52.5126 (real)
------------------------------------------------------------------------

 ANCopt (total)                0 d,  0 h,  0 min,  0.630 sec
 optimizer setup                ...        0 min,  0.000 sec (  0.024%)
 model hessian                  ...        0 min,  0.012 sec (  1.885%)
 ANC generation                 ...        0 min,  0.001 sec (  0.106%)
 coordinate transformation      ...        0 min,  0.000 sec (  0.051%)
 single point calculation       ...        0 min,  0.610 sec ( 96.751%)
 optimization log               ...        0 min,  0.002 sec (  0.307%)
 hessian update                 ...        0 min,  0.000 sec (  0.042%)
 rational function              ...        0 min,  0.004 sec (  0.648%)

================
 final structure:
================
$coord
   -2.17410429842618    2.14487874577196    0.04561948143698      N 
    0.28610883082017    1.11756405328021    0.65504900576624      C 
    2.48386460606281    2.86696802726181    0.08551252820715      C 
    5.25526803709282    0.79906766391627    0.15731629116210      S 
    3.56487427129149   -1.96519816064649   -0.48428847959050      C 
    4.88129696053639   -4.71100902730870   -0.82481044545471      S 
    0.82099359679509   -1.34329134116755   -0.82844783427477      C 
   -1.05223514531916   -3.23036462715879   -0.19104446945602      N 
   -3.52816319276504   -2.27982284826323   -0.90629556135950      C 
   -4.11732409540212    0.22950994081868    0.44612095343870      C 
   -0.78966284396487   -4.49420379677180    2.08859866589477      C 
   -2.59359281836044   -5.49737858304011    3.51565368887389      C 
   -2.20139275451352    2.72643306764827   -1.78705388069823      H 
    0.27206214383625    0.64996831374139    2.67812062818745      H 
    2.73508625578462    4.35798689413738    1.47490780413504      H 
    2.33626575181914    3.69151832001458   -1.79878823105876      H 
    0.58781095841516   -0.93459640743059   -2.86448035428865      H 
   -4.94646455163744   -3.69902407217399   -0.45817800977274      H 
   -3.53074035123468   -1.99340401317193   -2.95813440252408      H 
   -4.23003793201942   -0.11149462400569    2.48128174484812      H 
   -5.91906064124098    0.99441430646423   -0.19809595868714      H 
    1.16238859958640   -4.74758653959292    2.63148377248193      H 
   -4.58028068612516   -5.35599903875584    3.11618736266240      H 
   -2.08808708609205   -6.56996658877143    5.16277850269851      H 
$end
           -------------------------------------------------
          |                Final Singlepoint                |
           -------------------------------------------------

          ...................................................
          :                      SETUP                      :
          :.................................................:
          :  # basis functions                  72          :
          :  # atomic orbitals                  70          :
          :  # shells                           38          :
          :  # electrons                        66          :
          :  max. iterations                   250          :
          :  Hamiltonian                  GFN2-xTB          :
          :  restarted?                      false          :
          :  GBSA solvation                  false          :
          :  PC potential                    false          :
          :  electronic temp.          300.0000000     K    :
          :  accuracy                    1.0000000          :
          :  -> integral cutoff          0.2500000E+02      :
          :  -> integral neglect         0.1000000E-07      :
          :  -> SCF convergence          0.1000000E-05 Eh   :
          :  -> wf. convergence          0.1000000E-03 e    :
          :  Broyden damping             0.4000000          :
          ...................................................

 iter      E             dE          RMSdq      gap      omega  full diag
   1    -35.9772471 -0.359772E+02  0.516E-05    1.29       0.0  T
   2    -35.9772471 -0.225242E-11  0.234E-05    1.29     870.7  T
   3    -35.9772471 -0.404299E-11  0.208E-05    1.29     983.6  T

   *** convergence criteria satisfied after 3 iterations ***

         #    Occupation            Energy/Eh            Energy/eV
      -------------------------------------------------------------
         1        2.0000           -0.7502311             -20.4148
       ...           ...                  ...                  ...
        27        2.0000           -0.4549005             -12.3785
        28        2.0000           -0.4458243             -12.1315
        29        2.0000           -0.4341588             -11.8141
        30        2.0000           -0.3986044             -10.8466
        31        2.0000           -0.3947562             -10.7419
        32        2.0000           -0.3639700              -9.9041
        33        2.0000           -0.3492780              -9.5043 (HOMO)
        34                         -0.3016963              -8.2096 (LUMO)
        35                         -0.2382627              -6.4835
        36                         -0.1850016              -5.0341
        37                         -0.1759952              -4.7891
        38                         -0.1221888              -3.3249
       ...                                ...                  ...
        70                          0.6959993              18.9391
      -------------------------------------------------------------
                  HL-Gap            0.0475817 Eh            1.2948 eV
             Fermi-level           -0.3254871 Eh           -8.8570 eV

 SCC (total)                   0 d,  0 h,  0 min,  0.029 sec
 SCC setup                      ...        0 min,  0.000 sec (  0.684%)
 Dispersion                     ...        0 min,  0.000 sec (  0.629%)
 integral evaluation            ...        0 min,  0.009 sec ( 31.311%)
 zeroth order Hamiltonian       ...        0 min,  0.000 sec (  0.576%)
 iterations                     ...        0 min,  0.004 sec ( 14.218%)
 molecular gradient             ...        0 min,  0.015 sec ( 51.245%)
 printout                       ...        0 min,  0.000 sec (  1.167%)

         :::::::::::::::::::::::::::::::::::::::::::::::::::::
         ::                     SUMMARY                     ::
         :::::::::::::::::::::::::::::::::::::::::::::::::::::
         :: total energy             -35.557711134398 Eh    ::
         :: gradient norm              0.000714645589 Eh/a0 ::
         :: HOMO-LUMO gap              1.294762944978 eV    ::
         ::.................................................::
         :: SCC energy               -35.977247145884 Eh    ::
         :: -> isotropic ES            0.020457948738 Eh    ::
         :: -> anisotropic ES          0.007184019144 Eh    ::
         :: -> anisotropic XC          0.023747382909 Eh    ::
         :: -> dispersion             -0.026983868428 Eh    ::
         :: repulsion energy           0.419265743340 Eh    ::
         :: add. restraining           0.000000000000 Eh    ::
         :::::::::::::::::::::::::::::::::::::::::::::::::::::

           -------------------------------------------------
          |                Property Printout                |
           -------------------------------------------------

    * Orbital Energies and Occupations

         #    Occupation            Energy/Eh            Energy/eV
      -------------------------------------------------------------
         1        2.0000           -0.7502311             -20.4148
       ...           ...                  ...                  ...
        21        2.0000           -0.4925544             -13.4031
        22        2.0000           -0.4860528             -13.2262
        23        2.0000           -0.4793053             -13.0426
        24        2.0000           -0.4786081             -13.0236
        25        2.0000           -0.4706307             -12.8065
        26        2.0000           -0.4633622             -12.6087
        27        2.0000           -0.4549005             -12.3785
        28        2.0000           -0.4458243             -12.1315
        29        2.0000           -0.4341588             -11.8141
        30        2.0000           -0.3986044             -10.8466
        31        2.0000           -0.3947562             -10.7419
        32        2.0000           -0.3639700              -9.9041
        33        2.0000           -0.3492780              -9.5043 (HOMO)
        34                         -0.3016963              -8.2096 (LUMO)
        35                         -0.2382627              -6.4835
        36                         -0.1850016              -5.0341
        37                         -0.1759952              -4.7891
        38                         -0.1221888              -3.3249
        39                         -0.0411506              -1.1198
        40                         -0.0334139              -0.9092
        41                         -0.0220497              -0.6000
        42                         -0.0007302              -0.0199
        43                          0.0026000               0.0708
        44                          0.0067728               0.1843
       ...                                ...                  ...
        70                          0.6959993              18.9391
      -------------------------------------------------------------
                  HL-Gap            0.0475817 Eh            1.2948 eV
             Fermi-level           -0.3254871 Eh           -8.8570 eV

     #   Z        covCN         q      C6AA      α(0)
     1   7 N      2.678    -0.263    26.807     7.690
     2   6 C      3.907     0.050    19.684     6.306
     3   6 C      3.804    -0.027    21.062     6.534
     4  16 S      2.289    -0.059   143.492    20.161
     5   6 C      2.935     0.093    25.925     8.350
     6  16 S      1.165    -0.242   149.599    20.680
     7   6 C      3.946     0.043    19.790     6.321
     8   7 N      2.733    -0.120    23.617     7.218
     9   6 C      3.769    -0.005    20.706     6.485
    10   6 C      3.753     0.003    20.592     6.471
    11   6 C      2.836     0.021    27.520     8.597
    12   6 C      2.836    -0.133    31.389     9.181
    13   1 H      0.860     0.139     1.477     1.904
    14   1 H      0.923     0.045     2.380     2.412
    15   1 H      0.925     0.071     2.078     2.254
    16   1 H      0.924     0.057     2.230     2.335
    17   1 H      0.922     0.048     2.343     2.394
    18   1 H      0.925     0.059     2.208     2.324
    19   1 H      0.924     0.034     2.534     2.489
    20   1 H      0.924     0.049     2.330     2.387
    21   1 H      0.924     0.044     2.392     2.418
    22   1 H      0.926     0.037     2.486     2.465
    23   1 H      0.926     0.023     2.683     2.561
    24   1 H      0.926     0.032     2.562     2.503

 Mol. C6AA /au·bohr⁶  :       8231.478232
 Mol. C8AA /au·bohr⁸  :     235898.038384
 Mol. α(0) /au        :        142.442647


Wiberg/Mayer (AO) data.
largest (>0.10) Wiberg bond orders for each atom
          total WBO             WBO to atom ...
     1  N   3.079        C    2 1.012    C   10 1.006    H   13 0.953
     2  C   3.986        N    1 1.012    C    3 0.998    H   14 0.960    C    7 0.941
     3  C   3.975        C    2 0.998    S    4 0.983    H   15 0.973    H   16 0.971
     4  S   2.472        C    5 1.170    C    3 0.983    S    6 0.233
     5  C   3.959        S    6 1.718    S    4 1.170    C    7 1.006
     6  S   2.058        C    5 1.718    S    4 0.233
     7  C   3.986        C    5 1.006    N    8 0.991    C    2 0.941    H   17 0.927
     8  N   3.338        C   11 1.119    C    7 0.991    C    9 0.991    C   12 0.131
     9  C   3.981        N    8 0.991    C   10 0.984    H   19 0.970    H   18 0.965
    10  C   3.982        N    1 1.006    C    9 0.984    H   21 0.973    H   20 0.972
    11  C   3.968        C   12 1.846    N    8 1.119    H   22 0.956
    12  C   3.973        C   11 1.846    H   24 0.977    H   23 0.973    N    8 0.131
    13  H   0.981        N    1 0.953
    14  H   0.998        C    2 0.960
    15  H   0.995        C    3 0.973
    16  H   0.997        C    3 0.971
    17  H   0.997        C    7 0.927
    18  H   0.996        C    9 0.965
    19  H   0.999        C    9 0.970
    20  H   0.998        C   10 0.972
    21  H   0.997        C   10 0.973
    22  H   0.999        C   11 0.956
    23  H   0.999        C   12 0.973
    24  H   0.999        C   12 0.977

molecular dipole:
                 x           y           z       tot (Debye)
 q only:       -1.095       1.429      -0.210
   full:       -1.351       1.560      -0.431       5.360
molecular quadrupole (traceless):
                xx          xy          yy          xz          yz          zz
 q only:       -0.932       8.644      -3.979       2.854      -0.860       4.911
  q+dip:       -3.612      11.090      -7.278       3.673      -3.613      10.890
   full:       -3.635      10.600      -6.283       3.670      -3.352       9.917

           -------------------------------------------------
          |                Geometry Summary                 |
           -------------------------------------------------

      molecular mass/u    :      200.3162000
   center of mass at/Å    :        0.5619098      -0.7613797       0.1030675
  moments of inertia/u·Å² :        0.5079612E+03   0.7382931E+03   0.1094909E+04
rotational constants/cm⁻¹ :        0.3318685E-01   0.2283325E-01   0.1539638E-01

 * 23 selected distances

     #   Z        #   Z                                     value/Å
     1   7 N      2   6 C                                 1.4472227
     2   6 C      3   6 C                                 1.5167107
     4  16 S      5   6 C                                 1.7479081 (max)
     5   6 C      6  16 S                                 1.6214255
     2   6 C      7   6 C                                 1.5466715
     7   6 C      8   7 N                                 1.4469215
     8   7 N      9   6 C                                 1.4535849
     1   7 N     10   6 C                                 1.4593345
     9   6 C     10   6 C                                 1.5403415
     8   7 N     11   6 C                                 1.3863037
    11   6 C     12   6 C                                 1.3279091
     1   7 N     13   1 H                                 1.0175683 (min)
     2   6 C     14   1 H                                 1.0988123
     3   6 C     15   1 H                                 1.0866406
     3   6 C     16   1 H                                 1.0912166
     7   6 C     17   1 H                                 1.1058202
     9   6 C     18   1 H                                 1.0879092
     9   6 C     19   1 H                                 1.0963149
    10   6 C     20   1 H                                 1.0936019
    10   6 C     21   1 H                                 1.0904581
    11   6 C     22   1 H                                 1.0805369
    12   6 C     23   1 H                                 1.0749582
    12   6 C     24   1 H                                 1.0739823

 * 5 distinct bonds (by element types)

   Z      Z             #   av. dist./Å        max./Å        min./Å
   1 H    6 C          11     1.0891138     1.1058202     1.0739823
   6 C    6 C           4     1.4829082     1.5466715     1.3279091
   1 H    7 N           1     1.0175683     1.0175683     1.0175683
   6 C    7 N           5     1.4386734     1.4593345     1.3863037
   6 C   16 S           2     1.6846668     1.7479081     1.6214255


optimized geometry written to: xtbopt.xyz


           -------------------------------------------------
          | TOTAL ENERGY              -35.557711134398 Eh   |
          | GRADIENT NORM               0.000714645589 Eh/α |
          | HOMO-LUMO GAP               1.294762944978 eV   |
           -------------------------------------------------

------------------------------------------------------------------------
 * finished run on 2021/05/19 at 11:01:18.894     
------------------------------------------------------------------------
 total:
 * wall-time:     0 d,  0 h,  0 min,  0.723 sec
 *  cpu-time:     0 d,  0 h,  0 min,  0.720 sec
 * ratio c/w:     0.995 speedup
 SCF:
 * wall-time:     0 d,  0 h,  0 min,  0.041 sec
 *  cpu-time:     0 d,  0 h,  0 min,  0.041 sec
 * ratio c/w:     0.997 speedup
 ANC optimizer:
 * wall-time:     0 d,  0 h,  0 min,  0.660 sec
 *  cpu-time:     0 d,  0 h,  0 min,  0.658 sec
 * ratio c/w:     0.998 speedup

