      -----------------------------------------------------------      
     |                   =====================                   |     
     |                           x T B                           |     
     |                   =====================                   |     
     |                         S. Grimme                         |     
     |          Mulliken Center for Theoretical Chemistry        |     
     |                    University of Bonn                     |     
     |                Version 6.2 RC2 (SAW190805)                |     
      -----------------------------------------------------------      

   This program is distributed in the hope that it will be useful,
   but WITHOUT ANY WARRANTY; without even the implied warranty of
   MERCHANTABILITY or FITNESS FOR A PARTICULAR PURPOSE.
   
   FOR NON-COMMERCIAL, ACADEMIA USE ONLY.
   
   Cite this work as:
   * S. Grimme, C. Bannwarth, P. Shushkov, J. Chem. Theory Comput., 2017,
     13, 1989-2009. DOI: 10.1021/acs.jctc.7b00118
   * C. Bannwarth, S. Ehlert and S. Grimme., J. Chem. Theory Comput., 2019,
     15, 1652-1671. DOI: 10.1021/acs.jctc.8b01176
   * P. Pracht, E. Caldeweyher, S. Ehlert, S. Grimme, ChemRxiv, 2019, preprint.
     DOI: 10.26434/chemrxiv.8326202.v1
   
   for DFT-D4:
   * E. Caldeweyher, C. Bannwarth and S. Grimme, J. Chem. Phys., 2017,
     147, 034112. DOI: 10.1063/1.4993215
   * E. Caldeweyher, S. Ehlert, A. Hansen, H. Neugebauer, S. Spicher,
     C. Bannwarth and S. Grimme, J. Chem. Phys., 2019, 150, 154122.
     DOI: 10.1063/1.5090222
   
   for sTDA-xTB:
   * S. Grimme and C. Bannwarth, J. Chem. Phys., 2016, 145, 054103.
     DOI: 10.1063/1.4959605
   
   in the mass-spec context:
   * V. Asgeirsson, C. Bauer and S. Grimme, Chem. Sci., 2017, 8, 4879.
     DOI: 10.1039/c7sc00601b
   
   for metadynamics refer to:
   * S. Grimme, J. Chem. Theory Comput., 2019, 155, 2847-2862
     DOI: 10.1021/acs.jctc.9b00143
   
   with help from (in alphabetical order)
   C. Bannwarth, F. Bohle, G. Brandenburg, E. Caldeweyher, M. Checinski,
   S. Dohm, S. Ehlert, S. Ehrlich, F. März, H. Neugebauer, J. Pisarek,
   P. Pracht, P. Shushkov, and S. Spicher.
   
 * started run on 2021/05/19 at 10:58:35.503     

           -------------------------------------------------
          |                Calculation Setup                |
           -------------------------------------------------

          program call               : /ihome/ghutchison/geoffh/xtb/xtb 106.xyz -opt
          hostname                   : smp-n83
          coordinate file            : 106.xyz
          omp threads                :                     1
          number of atoms            :                    24
          number of electrons        :                    74
          charge                     :                     0
          spin                       :                   0.0
          first test random number   :      0.77860129260510


########################################################################
# WARNING! Please study the warnings concerning your input carefully
#  - the use of '-opt' is discouraged, please use '--opt' next time
########################################################################

           ------------------------------------------------- 
          |                 G F N 2 - x T B                 |
          | Geometry, Frequencies, Noncovalent interactions |
          |            JCTC 2019 parametrisation            |
           ------------------------------------------------- 
             KAB for C  - Si     :                1.0500
             KAB for H  - Pd     :                0.9500
             k(s)              :                1.8500
             k(p)              :                2.2300
             k(d)              :                2.2300
             k(f)              :                2.0000
             kEN (H0ij)        :               -2.0000
             D4 a1             :                0.5200
             D4 a2             :                5.0000
             D4 s6             :                1.0000
             D4 s8             :                2.7000
             D4 s9             :                5.0000
             alphaj            :                2.0000

  Z AO/shell   Hii/eV     exponent
  1     Wed Apr 25 08:07:45 CEST 2018   EN: 2.200 GM2: 0.406  GM3: 0.0800  RAES: 1.40
     1s    -10.707211    1.230000
  6     Wed Apr 25 08:07:45 CEST 2018   EN: 2.550 GM2: 0.538  GM3: 0.1500  RAES: 3.00
     2s    -13.970922    2.096432
     2p    -10.063292    1.800000
  7     Wed Apr 25 08:07:45 CEST 2018   EN: 3.040 GM2: 0.461  GM3:-0.0640  RAES: 1.90
     2s    -16.686243    2.339881
     2p    -12.523956    2.014332
  8     Wed Apr 25 08:07:45 CEST 2018   EN: 3.440 GM2: 0.452  GM3:-0.0517  RAES: 1.80
     2s    -20.229985    2.439742
     2p    -15.503117    2.137023
 16     Tue Apr 24 11:44:34 CEST 2018   EN: 2.580 GM2: 0.340  GM3:-0.0502  RAES: 3.10
     3s    -20.029654    1.981333
     3p    -11.377694    2.025643
     3d     -0.420282    1.702555

           ------------------------------------------------- 
          |        Self-Consistent Charge Iterations        |
           ------------------------------------------------- 

          ...................................................
          :                      SETUP                      :
          :.................................................:
          :  # basis functions                  72          :
          :  # atomic orbitals                  71          :
          :  # shells                           39          :
          :  # electrons                        74          :
          :  max. iterations                   250          :
          :  Hamiltonian                  GFN2-xTB          :
          :  restarted?                      false          :
          :  GBSA solvation                  false          :
          :  PC potential                    false          :
          :  electronic temp.          300.0000000     K    :
          :  accuracy                    1.0000000          :
          :  -> integral cutoff          0.2500000E+02      :
          :  -> integral neglect         0.1000000E-07      :
          :  -> SCF convergence          0.1000000E-05 Eh   :
          :  -> wf. convergence          0.1000000E-03 e    :
          :  Broyden damping             0.4000000          :
          ...................................................

 iter      E             dE          RMSdq      gap      omega  full diag
   1    -41.9981579 -0.419982E+02  0.433E+00    2.63       0.0  T
   2    -42.0660331 -0.678752E-01  0.265E+00    2.93       1.0  T
   3    -42.0663525 -0.319410E-03  0.153E+00    2.85       1.0  T
   4    -42.0777009 -0.113484E-01  0.619E-01    2.76       1.0  T
   5    -42.0829966 -0.529573E-02  0.137E-01    2.75       1.0  T
   6    -42.0830556 -0.590542E-04  0.729E-02    2.77       1.0  T
   7    -42.0831025 -0.468562E-04  0.289E-02    2.77       1.0  T
   8    -42.0831113 -0.875438E-05  0.145E-02    2.77       1.4  T
   9    -42.0831127 -0.149020E-05  0.530E-03    2.77       3.8  T
  10    -42.0831128 -0.436848E-07  0.187E-03    2.77      10.9  T
  11    -42.0831128 -0.187292E-07  0.894E-04    2.77      22.8  T
  12    -42.0831128 -0.304927E-08  0.469E-04    2.77      43.5  T

   *** convergence criteria satisfied after 12 iterations ***

         #    Occupation            Energy/Eh            Energy/eV
      -------------------------------------------------------------
         1        2.0000           -0.7476494             -20.3446
       ...           ...                  ...                  ...
        31        2.0000           -0.4661549             -12.6847
        32        2.0000           -0.4489628             -12.2169
        33        2.0000           -0.4464471             -12.1484
        34        2.0000           -0.4309383             -11.7264
        35        2.0000           -0.4176862             -11.3658
        36        2.0000           -0.3867259             -10.5233
        37        2.0000           -0.3597553              -9.7894 (HOMO)
        38                         -0.2578892              -7.0175 (LUMO)
        39                         -0.2304630              -6.2712
        40                         -0.2142724              -5.8306
        41                         -0.2010616              -5.4712
        42                         -0.1589411              -4.3250
       ...                                ...                  ...
        71                          0.6653780              18.1059
      -------------------------------------------------------------
                  HL-Gap            0.1018661 Eh            2.7719 eV
             Fermi-level           -0.3088223 Eh           -8.4035 eV

 SCC (total)                   0 d,  0 h,  0 min,  0.041 sec
 SCC setup                      ...        0 min,  0.000 sec (  0.765%)
 Dispersion                     ...        0 min,  0.000 sec (  0.833%)
 integral evaluation            ...        0 min,  0.010 sec ( 24.581%)
 zeroth order Hamiltonian       ...        0 min,  0.000 sec (  0.463%)
 iterations                     ...        0 min,  0.015 sec ( 37.038%)
 molecular gradient             ...        0 min,  0.015 sec ( 35.282%)
 printout                       ...        0 min,  0.000 sec (  0.917%)

         :::::::::::::::::::::::::::::::::::::::::::::::::::::
         ::                     SUMMARY                     ::
         :::::::::::::::::::::::::::::::::::::::::::::::::::::
         :: total energy             -41.598634446652 Eh    ::
         :: gradient norm              0.064659950679 Eh/a0 ::
         :: HOMO-LUMO gap              2.771917106293 eV    ::
         ::.................................................::
         :: SCC energy               -42.083112805712 Eh    ::
         :: -> isotropic ES            0.061295894621 Eh    ::
         :: -> anisotropic ES          0.004677229854 Eh    ::
         :: -> anisotropic XC          0.012143508039 Eh    ::
         :: -> dispersion             -0.025375507984 Eh    ::
         :: repulsion energy           0.484334426465 Eh    ::
         :: add. restraining           0.000000000000 Eh    ::
         :::::::::::::::::::::::::::::::::::::::::::::::::::::

      ----------------------------------------------------------- 
     |                   =====================                   |
     |                        A N C O P T                        |
     |                   =====================                   |
     |               Approximate Normal Coordinate               |
     |                Rational Function Optimizer                |
      ----------------------------------------------------------- 

          ...................................................
          :                      SETUP                      :
          :.................................................:
          :   optimization level            normal          :
          :   max. optcycles                   200          :
          :   ANC micro-cycles                  20          :
          :   degrees of freedom                66          :
          :.................................................:
          :   RF solver                   davidson          :
          :   input Hessian                  false          :
          :   write xtbopt.log                true          :
          :   linear?                        false          :
          :   energy convergence         0.5000000E-05 Eh   :
          :   grad. convergence          0.1000000E-02 Eh/α :
          :   maximium RF displ.         2.0000000          :
          :   Hlow (freq-cutoff)         0.5000000E-02      :
          :   Hmax (freq-cutoff)         5.0000000          :
          :   S6 in model hess.         20.0000000          :
          ...................................................

generating ANC from model Hessian ...
Using Lindh-Hessian (1995)
 Shifting diagonal of input Hessian by   3.438817200200409E-003
 Lowest  eigenvalues of input Hessian
   -0.000000   -0.000000   -0.000000   -0.000000    0.000000    0.000000
    0.005000    0.007171    0.008165    0.008510    0.010342    0.012812
    0.014072    0.016300    0.021034    0.024552    0.027583    0.035694
 Highest eigenvalues
    1.790579    1.833571    1.972799    2.020918    2.130440    2.380493
 

........................................................................
.............................. CYCLE    1 ..............................
........................................................................
   1    -42.0831128 -0.420831E+02  0.242E-04    2.77       0.0  T
   2    -42.0831128 -0.197034E-09  0.180E-04    2.77     113.7  T
   3    -42.0831128 -0.357126E-09  0.104E-04    2.77     196.9  T
     SCC iter.                  ...        0 min,  0.004 sec
     gradient                   ...        0 min,  0.014 sec
 * total energy  :   -41.5986345 Eh     change       -0.2921706E-07 Eh
   gradient norm :     0.0646624 Eh/α   predicted     0.0000000E+00 (-100.00%)
   displ. norm   :     0.3520581 α      lambda       -0.9761862E-02
   maximum displ.:     0.1393794 α      in ANC's #20, #5, #6, ...

........................................................................
.............................. CYCLE    2 ..............................
........................................................................
   1    -42.1164605 -0.421165E+02  0.314E-01    2.81       0.0  T
   2    -42.1165718 -0.111301E-03  0.175E-01    2.83       1.0  T
   3    -42.1164709  0.100870E-03  0.108E-01    2.82       1.0  T
   4    -42.1166370 -0.166070E-03  0.260E-02    2.82       1.0  T
   5    -42.1166417 -0.468405E-05  0.112E-02    2.82       1.8  T
   6    -42.1166422 -0.587650E-06  0.490E-03    2.82       4.2  T
   7    -42.1166425 -0.267511E-06  0.215E-03    2.82       9.5  T
     SCC iter.                  ...        0 min,  0.008 sec
     gradient                   ...        0 min,  0.014 sec
 * total energy  :   -41.6048926 Eh     change       -0.6258166E-02 Eh
   gradient norm :     0.0232248 Eh/α   predicted    -0.5485910E-02 ( -12.34%)
   displ. norm   :     0.3386487 α      lambda       -0.2721522E-02
   maximum displ.:     0.1513118 α      in ANC's #5, #7, #8, ...

........................................................................
.............................. CYCLE    3 ..............................
........................................................................
   1    -42.1297459 -0.421297E+02  0.258E-01    2.82       0.0  T
   2    -42.1297851 -0.391744E-04  0.154E-01    2.82       1.0  T
   3    -42.1297038  0.812725E-04  0.824E-02    2.82       1.0  T
   4    -42.1298094 -0.105601E-03  0.168E-02    2.83       1.2  T
   5    -42.1298120 -0.261838E-05  0.744E-03    2.82       2.7  T
   6    -42.1298121 -0.116777E-06  0.365E-03    2.82       5.6  T
   7    -42.1298123 -0.131101E-06  0.160E-03    2.82      12.8  T
     SCC iter.                  ...        0 min,  0.008 sec
     gradient                   ...        0 min,  0.014 sec
 * total energy  :   -41.6064523 Eh     change       -0.1559640E-02 Eh
   gradient norm :     0.0133628 Eh/α   predicted    -0.1516817E-02 (  -2.75%)
   displ. norm   :     0.3107261 α      lambda       -0.1123331E-02
   maximum displ.:     0.1439657 α      in ANC's #6, #5, #7, ...

........................................................................
.............................. CYCLE    4 ..............................
........................................................................
   1    -42.1290815 -0.421291E+02  0.221E-01    2.81       0.0  T
   2    -42.1290915 -0.998704E-05  0.128E-01    2.82       1.0  T
   3    -42.1290920 -0.545235E-06  0.152E-02    2.82       1.3  T
   4    -42.1290947 -0.264555E-05  0.850E-03    2.82       2.4  T
   5    -42.1290953 -0.685371E-06  0.328E-03    2.82       6.2  T
   6    -42.1290954 -0.438496E-07  0.109E-03    2.82      18.8  T
   7    -42.1290954 -0.846840E-08  0.579E-04    2.82      35.3  T
     SCC iter.                  ...        0 min,  0.008 sec
     gradient                   ...        0 min,  0.014 sec
 * total energy  :   -41.6072685 Eh     change       -0.8162518E-03 Eh
   gradient norm :     0.0119787 Eh/α   predicted    -0.6158979E-03 ( -24.55%)
   displ. norm   :     0.4370394 α      lambda       -0.1126400E-02
   maximum displ.:     0.1978238 α      in ANC's #4, #7, #1, ...

........................................................................
.............................. CYCLE    5 ..............................
........................................................................
   1    -42.1239296 -0.421239E+02  0.302E-01    2.81       0.0  T
   2    -42.1239598 -0.301947E-04  0.174E-01    2.81       1.0  T
   3    -42.1239292  0.306649E-04  0.497E-02    2.81       1.0  T
   4    -42.1239722 -0.429992E-04  0.146E-02    2.81       1.4  T
   5    -42.1239734 -0.118437E-05  0.625E-03    2.81       3.3  T
   6    -42.1239734 -0.787897E-07  0.297E-03    2.81       6.9  T
   7    -42.1239735 -0.977746E-07  0.125E-03    2.81      16.3  T
     SCC iter.                  ...        0 min,  0.008 sec
     gradient                   ...        0 min,  0.014 sec
 * total energy  :   -41.6080863 Eh     change       -0.8177401E-03 Eh
   gradient norm :     0.0151864 Eh/α   predicted    -0.6707920E-03 ( -17.97%)
   displ. norm   :     0.3580037 α      lambda       -0.8218699E-03
   maximum displ.:     0.1838688 α      in ANC's #1, #4, #7, ...

........................................................................
.............................. CYCLE    6 ..............................
........................................................................
   1    -42.1231515 -0.421232E+02  0.260E-01    2.81       0.0  T
   2    -42.1231756 -0.241574E-04  0.147E-01    2.81       1.0  T
   3    -42.1231235  0.521486E-04  0.593E-02    2.82       1.0  T
   4    -42.1231904 -0.669520E-04  0.129E-02    2.81       1.6  T
   5    -42.1231909 -0.411474E-06  0.587E-03    2.81       3.5  T
   6    -42.1231910 -0.153059E-06  0.283E-03    2.81       7.2  T
   7    -42.1231911 -0.988662E-07  0.114E-03    2.81      17.9  T
     SCC iter.                  ...        0 min,  0.008 sec
     gradient                   ...        0 min,  0.014 sec
 * total energy  :   -41.6086852 Eh     change       -0.5989160E-03 Eh
   gradient norm :     0.0157151 Eh/α   predicted    -0.4636053E-03 ( -22.59%)
   displ. norm   :     0.3297762 α      lambda       -0.6906230E-03
   maximum displ.:     0.1782823 α      in ANC's #1, #4, #7, ...

........................................................................
.............................. CYCLE    7 ..............................
........................................................................
   1    -42.1244345 -0.421244E+02  0.267E-01    2.82       0.0  T
   2    -42.1244600 -0.254577E-04  0.152E-01    2.81       1.0  T
   3    -42.1244354  0.245548E-04  0.461E-02    2.82       1.0  T
   4    -42.1244715 -0.360702E-04  0.148E-02    2.82       1.4  T
   5    -42.1244725 -0.103203E-05  0.596E-03    2.82       3.4  T
   6    -42.1244725 -0.446767E-07  0.297E-03    2.82       6.9  T
   7    -42.1244726 -0.103968E-06  0.125E-03    2.82      16.3  T
     SCC iter.                  ...        0 min,  0.008 sec
     gradient                   ...        0 min,  0.014 sec
 * total energy  :   -41.6091812 Eh     change       -0.4960245E-03 Eh
   gradient norm :     0.0160924 Eh/α   predicted    -0.3828685E-03 ( -22.81%)
   displ. norm   :     0.3113689 α      lambda       -0.7015713E-03
   maximum displ.:     0.1905536 α      in ANC's #1, #4, #7, ...

........................................................................
.............................. CYCLE    8 ..............................
........................................................................
   1    -42.1313244 -0.421313E+02  0.239E-01    2.83       0.0  T
   2    -42.1313492 -0.247933E-04  0.133E-01    2.82       1.0  T
   3    -42.1313105  0.386282E-04  0.523E-02    2.83       1.0  T
   4    -42.1313607 -0.501241E-04  0.123E-02    2.83       1.7  T
   5    -42.1313615 -0.804053E-06  0.560E-03    2.83       3.6  T
   6    -42.1313616 -0.151008E-06  0.266E-03    2.83       7.7  T
   7    -42.1313617 -0.786281E-07  0.107E-03    2.83      19.1  T
     SCC iter.                  ...        0 min,  0.008 sec
     gradient                   ...        0 min,  0.014 sec
 * total energy  :   -41.6095075 Eh     change       -0.3263289E-03 Eh
   gradient norm :     0.0119330 Eh/α   predicted    -0.3847976E-03 (  17.92%)
   displ. norm   :     0.3820351 α      lambda       -0.5777246E-03
   maximum displ.:     0.1952896 α      in ANC's #1, #7, #5, ...

........................................................................
.............................. CYCLE    9 ..............................
........................................................................
   1    -42.1272818 -0.421273E+02  0.312E-01    2.82       0.0  T
   2    -42.1273148 -0.330135E-04  0.179E-01    2.82       1.0  T
   3    -42.1273169 -0.208010E-05  0.306E-02    2.82       1.0  T
   4    -42.1273269 -0.100019E-04  0.156E-02    2.82       1.3  T
   5    -42.1273281 -0.120067E-05  0.786E-03    2.82       2.6  T
   6    -42.1273287 -0.604440E-06  0.242E-03    2.82       8.4  T
   7    -42.1273287 -0.119771E-07  0.113E-03    2.82      18.1  T
     SCC iter.                  ...        0 min,  0.008 sec
     gradient                   ...        0 min,  0.014 sec
 * total energy  :   -41.6097437 Eh     change       -0.2361293E-03 Eh
   gradient norm :     0.0149335 Eh/α   predicted    -0.3310225E-03 (  40.19%)
   displ. norm   :     0.0858885 α      lambda       -0.2596721E-03
   maximum displ.:     0.0485186 α      in ANC's #7, #4, #9, ...

........................................................................
.............................. CYCLE   10 ..............................
........................................................................
   1    -42.1321667 -0.421322E+02  0.666E-02    2.82       0.0  T
   2    -42.1321725 -0.580047E-05  0.376E-02    2.82       1.0  T
   3    -42.1321680  0.447518E-05  0.222E-02    2.82       1.0  T
   4    -42.1321746 -0.662405E-05  0.488E-03    2.82       4.2  T
   5    -42.1321748 -0.157687E-06  0.203E-03    2.82      10.1  T
   6    -42.1321748 -0.126319E-07  0.113E-03    2.82      18.1  T
     SCC iter.                  ...        0 min,  0.007 sec
     gradient                   ...        0 min,  0.014 sec
 * total energy  :   -41.6098789 Eh     change       -0.1352678E-03 Eh
   gradient norm :     0.0081813 Eh/α   predicted    -0.1307995E-03 (  -3.30%)
   displ. norm   :     0.1461834 α      lambda       -0.2384861E-03
   maximum displ.:     0.0806706 α      in ANC's #1, #4, #2, ...

........................................................................
.............................. CYCLE   11 ..............................
........................................................................
   1    -42.1317341 -0.421317E+02  0.104E-01    2.82       0.0  T
   2    -42.1317395 -0.534421E-05  0.587E-02    2.82       1.0  T
   3    -42.1317324  0.712630E-05  0.224E-02    2.82       1.0  T
   4    -42.1317415 -0.913777E-05  0.487E-03    2.82       4.2  T
   5    -42.1317417 -0.195062E-06  0.233E-03    2.82       8.7  T
   6    -42.1317417 -0.136628E-07  0.121E-03    2.82      16.9  T
     SCC iter.                  ...        0 min,  0.007 sec
     gradient                   ...        0 min,  0.014 sec
 * total energy  :   -41.6099690 Eh     change       -0.9003026E-04 Eh
   gradient norm :     0.0068232 Eh/α   predicted    -0.1217919E-03 (  35.28%)
   displ. norm   :     0.1817302 α      lambda       -0.1749367E-03
   maximum displ.:     0.1195832 α      in ANC's #1, #5, #8, ...

........................................................................
.............................. CYCLE   12 ..............................
........................................................................
   1    -42.1308148 -0.421308E+02  0.151E-01    2.82       0.0  T
   2    -42.1308217 -0.691700E-05  0.864E-02    2.82       1.0  T
   3    -42.1308173  0.436280E-05  0.203E-02    2.82       1.0  T
   4    -42.1308251 -0.778839E-05  0.733E-03    2.82       2.8  T
   5    -42.1308253 -0.191909E-06  0.317E-03    2.82       6.4  T
   6    -42.1308253 -0.572449E-07  0.136E-03    2.82      15.0  T
   7    -42.1308254 -0.163963E-07  0.666E-04    2.82      30.7  T
     SCC iter.                  ...        0 min,  0.008 sec
     gradient                   ...        0 min,  0.014 sec
 * total energy  :   -41.6100745 Eh     change       -0.1055257E-03 Eh
   gradient norm :     0.0050508 Eh/α   predicted    -0.9035828E-04 ( -14.37%)
   displ. norm   :     0.1803232 α      lambda       -0.1348995E-03
   maximum displ.:     0.1239452 α      in ANC's #1, #5, #3, ...

........................................................................
.............................. CYCLE   13 ..............................
........................................................................
   1    -42.1303511 -0.421304E+02  0.157E-01    2.82       0.0  T
   2    -42.1303606 -0.942658E-05  0.887E-02    2.82       1.0  T
   3    -42.1303596  0.932914E-06  0.185E-02    2.82       1.1  T
   4    -42.1303636 -0.395601E-05  0.873E-03    2.82       2.3  T
   5    -42.1303642 -0.576400E-06  0.374E-03    2.82       5.5  T
   6    -42.1303642 -0.470671E-07  0.131E-03    2.82      15.6  T
   7    -42.1303642 -0.674258E-08  0.705E-04    2.82      28.9  T
     SCC iter.                  ...        0 min,  0.008 sec
     gradient                   ...        0 min,  0.014 sec
 * total energy  :   -41.6101215 Eh     change       -0.4698030E-04 Eh
   gradient norm :     0.0091806 Eh/α   predicted    -0.6964381E-04 (  48.24%)
   displ. norm   :     0.0606351 α      lambda       -0.1095901E-03
   maximum displ.:     0.0353633 α      in ANC's #1, #3, #7, ...

........................................................................
.............................. CYCLE   14 ..............................
........................................................................
   1    -42.1307007 -0.421307E+02  0.493E-02    2.82       0.0  T
   2    -42.1307035 -0.288724E-05  0.269E-02    2.82       1.0  T
   3    -42.1307018  0.178454E-05  0.144E-02    2.82       1.4  T
   4    -42.1307046 -0.284556E-05  0.359E-03    2.82       5.7  T
   5    -42.1307048 -0.147608E-06  0.141E-03    2.82      14.5  T
   6    -42.1307048 -0.351821E-08  0.715E-04    2.82      28.6  T
     SCC iter.                  ...        0 min,  0.007 sec
     gradient                   ...        0 min,  0.014 sec
 * total energy  :   -41.6101937 Eh     change       -0.7226439E-04 Eh
   gradient norm :     0.0057339 Eh/α   predicted    -0.5499872E-04 ( -23.89%)
   displ. norm   :     0.1534688 α      lambda       -0.1034956E-03
   maximum displ.:     0.1214985 α      in ANC's #1, #3, #5, ...

........................................................................
.............................. CYCLE   15 ..............................
........................................................................
   1    -42.1301752 -0.421302E+02  0.121E-01    2.82       0.0  T
   2    -42.1301799 -0.473886E-05  0.672E-02    2.82       1.0  T
   3    -42.1301740  0.592845E-05  0.218E-02    2.82       1.0  T
   4    -42.1301823 -0.836391E-05  0.562E-03    2.82       3.6  T
   5    -42.1301825 -0.122943E-06  0.220E-03    2.82       9.3  T
   6    -42.1301825 -0.217227E-07  0.102E-03    2.82      20.0  T
     SCC iter.                  ...        0 min,  0.007 sec
     gradient                   ...        0 min,  0.014 sec
 * total energy  :   -41.6102487 Eh     change       -0.5495967E-04 Eh
   gradient norm :     0.0041768 Eh/α   predicted    -0.5297862E-04 (  -3.60%)
   displ. norm   :     0.1298504 α      lambda       -0.7564160E-04
   maximum displ.:     0.0929005 α      in ANC's #1, #3, #4, ...

........................................................................
.............................. CYCLE   16 ..............................
........................................................................
   1    -42.1309375 -0.421309E+02  0.950E-02    2.82       0.0  T
   2    -42.1309414 -0.389610E-05  0.533E-02    2.83       1.0  T
   3    -42.1309399  0.153169E-05  0.129E-02    2.82       1.6  T
   4    -42.1309428 -0.291077E-05  0.429E-03    2.83       4.8  T
   5    -42.1309429 -0.138565E-06  0.211E-03    2.83       9.7  T
   6    -42.1309430 -0.225980E-07  0.829E-04    2.83      24.6  T
     SCC iter.                  ...        0 min,  0.007 sec
     gradient                   ...        0 min,  0.014 sec
 * total energy  :   -41.6102925 Eh     change       -0.4384896E-04 Eh
   gradient norm :     0.0052576 Eh/α   predicted    -0.3846696E-04 ( -12.27%)
   displ. norm   :     0.1688011 α      lambda       -0.7761562E-04
   maximum displ.:     0.1222789 α      in ANC's #1, #3, #5, ...

........................................................................
.............................. CYCLE   17 ..............................
........................................................................
   1    -42.1302710 -0.421303E+02  0.126E-01    2.82       0.0  T
   2    -42.1302780 -0.707189E-05  0.714E-02    2.82       1.0  T
   3    -42.1302757  0.237112E-05  0.163E-02    2.82       1.3  T
   4    -42.1302800 -0.437619E-05  0.655E-03    2.82       3.1  T
   5    -42.1302805 -0.431552E-06  0.300E-03    2.82       6.8  T
   6    -42.1302805 -0.798508E-10  0.135E-03    2.82      15.1  T
     SCC iter.                  ...        0 min,  0.007 sec
     gradient                   ...        0 min,  0.014 sec
 * total energy  :   -41.6103392 Eh     change       -0.4660404E-04 Eh
   gradient norm :     0.0053752 Eh/α   predicted    -0.3991576E-04 ( -14.35%)
   displ. norm   :     0.1361084 α      lambda       -0.6943903E-04
   maximum displ.:     0.1055810 α      in ANC's #1, #4, #2, ...

........................................................................
.............................. CYCLE   18 ..............................
........................................................................
   1    -42.1307852 -0.421308E+02  0.897E-02    2.82       0.0  T
   2    -42.1307883 -0.303652E-05  0.505E-02    2.82       1.0  T
   3    -42.1307853  0.291113E-05  0.155E-02    2.82       1.3  T
   4    -42.1307896 -0.426385E-05  0.366E-03    2.82       5.6  T
   5    -42.1307897 -0.647075E-07  0.159E-03    2.82      12.8  T
   6    -42.1307897 -0.115269E-08  0.605E-04    2.82      33.7  T
     SCC iter.                  ...        0 min,  0.007 sec
     gradient                   ...        0 min,  0.014 sec
 * total energy  :   -41.6103906 Eh     change       -0.5149374E-04 Eh
   gradient norm :     0.0040344 Eh/α   predicted    -0.3536506E-04 ( -31.32%)
   displ. norm   :     0.1940626 α      lambda       -0.7363247E-04
   maximum displ.:     0.1505225 α      in ANC's #1, #4, #2, ...

........................................................................
.............................. CYCLE   19 ..............................
........................................................................
   1    -42.1308202 -0.421308E+02  0.125E-01    2.82       0.0  T
   2    -42.1308263 -0.606278E-05  0.695E-02    2.82       1.0  T
   3    -42.1308265 -0.217004E-06  0.117E-02    2.82       1.7  T
   4    -42.1308281 -0.160814E-05  0.558E-03    2.82       3.7  T
   5    -42.1308283 -0.250756E-06  0.227E-03    2.82       9.0  T
   6    -42.1308284 -0.204170E-07  0.719E-04    2.82      28.4  T
     SCC iter.                  ...        0 min,  0.008 sec
     gradient                   ...        0 min,  0.014 sec
 * total energy  :   -41.6104402 Eh     change       -0.4957484E-04 Eh
   gradient norm :     0.0033756 Eh/α   predicted    -0.3822168E-04 ( -22.90%)
   displ. norm   :     0.1532256 α      lambda       -0.4761822E-04
   maximum displ.:     0.1110402 α      in ANC's #1, #4, #2, ...

........................................................................
.............................. CYCLE   20 ..............................
........................................................................
   1    -42.1308174 -0.421308E+02  0.100E-01    2.81       0.0  T
   2    -42.1308208 -0.338922E-05  0.542E-02    2.81       1.0  T
   3    -42.1308213 -0.558650E-06  0.859E-03    2.81       2.4  T
   4    -42.1308217 -0.342193E-06  0.515E-03    2.81       4.0  T
   5    -42.1308219 -0.254198E-06  0.129E-03    2.81      15.8  T
   6    -42.1308219 -0.114622E-07  0.578E-04    2.81      35.3  T
   7    -42.1308219 -0.193512E-08  0.322E-04    2.81      63.4  T
     SCC iter.                  ...        0 min,  0.008 sec
     gradient                   ...        0 min,  0.015 sec
 * total energy  :   -41.6104720 Eh     change       -0.3177633E-04 Eh
   gradient norm :     0.0026972 Eh/α   predicted    -0.2437482E-04 ( -23.29%)
   displ. norm   :     0.1811865 α      lambda       -0.4177681E-04
   maximum displ.:     0.1434837 α      in ANC's #1, #5, #2, ...
 * RMSD in coord.:     0.7081674 α      energy gain  -0.1183755E-01 Eh

generating ANC from model Hessian ...
Using Lindh-Hessian (1995)
 Shifting diagonal of input Hessian by   3.123828241485991E-003
 Lowest  eigenvalues of input Hessian
   -0.000000   -0.000000   -0.000000   -0.000000   -0.000000   -0.000000
    0.005000    0.007239    0.008420    0.008688    0.010307    0.012340
    0.015635    0.015848    0.023000    0.024584    0.030070    0.037426
 Highest eigenvalues
    1.860843    1.920568    2.060606    2.131889    2.197541    2.512644
 

........................................................................
.............................. CYCLE   21 ..............................
........................................................................
   1    -42.1300875 -0.421301E+02  0.114E-01    2.81       0.0  T
   2    -42.1300921 -0.461803E-05  0.636E-02    2.81       1.0  T
   3    -42.1300918  0.337567E-06  0.116E-02    2.81       1.8  T
   4    -42.1300938 -0.196455E-05  0.551E-03    2.81       3.7  T
   5    -42.1300940 -0.222576E-06  0.222E-03    2.81       9.2  T
   6    -42.1300940 -0.257592E-07  0.797E-04    2.81      25.6  T
   7    -42.1300940 -0.319030E-08  0.448E-04    2.81      45.6  T
     SCC iter.                  ...        0 min,  0.008 sec
     gradient                   ...        0 min,  0.015 sec
 * total energy  :   -41.6104950 Eh     change       -0.2300312E-04 Eh
   gradient norm :     0.0036987 Eh/α   predicted     0.0000000E+00 (-100.00%)
   displ. norm   :     0.0324861 α      lambda       -0.3307755E-04
   maximum displ.:     0.0195276 α      in ANC's #2, #1, #3, ...

........................................................................
.............................. CYCLE   22 ..............................
........................................................................
   1    -42.1307293 -0.421307E+02  0.309E-02    2.81       0.0  T
   2    -42.1307303 -0.931964E-06  0.175E-02    2.81       1.2  T
   3    -42.1307296  0.616677E-06  0.831E-03    2.81       2.5  T
   4    -42.1307305 -0.816195E-06  0.240E-03    2.81       8.5  T
   5    -42.1307305 -0.663368E-07  0.886E-04    2.81      23.1  T
   6    -42.1307305 -0.220673E-08  0.291E-04    2.81      70.2  T
     SCC iter.                  ...        0 min,  0.007 sec
     gradient                   ...        0 min,  0.015 sec
 * total energy  :   -41.6105190 Eh     change       -0.2400560E-04 Eh
   gradient norm :     0.0016972 Eh/α   predicted    -0.1655747E-04 ( -31.03%)
   displ. norm   :     0.0605798 α      lambda       -0.2094819E-04
   maximum displ.:     0.0398929 α      in ANC's #2, #3, #4, ...

........................................................................
.............................. CYCLE   23 ..............................
........................................................................
   1    -42.1313925 -0.421314E+02  0.546E-02    2.81       0.0  T
   2    -42.1313946 -0.203881E-05  0.315E-02    2.81       1.0  T
   3    -42.1313927  0.182635E-05  0.129E-02    2.81       1.6  T
   4    -42.1313950 -0.231887E-05  0.335E-03    2.81       6.1  T
   5    -42.1313952 -0.143298E-06  0.131E-03    2.81      15.5  T
   6    -42.1313952 -0.307368E-08  0.487E-04    2.81      41.9  T
   7    -42.1313952 -0.138814E-08  0.215E-04    2.81      94.8  T
     SCC iter.                  ...        0 min,  0.008 sec
     gradient                   ...        0 min,  0.015 sec
 * total energy  :   -41.6105320 Eh     change       -0.1300529E-04 Eh
   gradient norm :     0.0017850 Eh/α   predicted    -0.1049151E-04 ( -19.33%)
   displ. norm   :     0.0264526 α      lambda       -0.6734049E-05
   maximum displ.:     0.0185855 α      in ANC's #2, #1, #4, ...

........................................................................
.............................. CYCLE   24 ..............................
........................................................................
   1    -42.1311010 -0.421311E+02  0.205E-02    2.81       0.0  T
   2    -42.1311012 -0.212972E-06  0.117E-02    2.81       1.7  T
   3    -42.1311010  0.202931E-06  0.408E-03    2.81       5.0  T
   4    -42.1311013 -0.256971E-06  0.122E-03    2.81      16.7  T
   5    -42.1311013 -0.118127E-07  0.493E-04    2.81      41.4  T
   6    -42.1311013 -0.230749E-09  0.222E-04    2.81      91.9  T
     SCC iter.                  ...        0 min,  0.007 sec
     gradient                   ...        0 min,  0.015 sec
 * total energy  :   -41.6105382 Eh     change       -0.6211362E-05 Eh
   gradient norm :     0.0009630 Eh/α   predicted    -0.3372500E-05 ( -45.70%)
   displ. norm   :     0.0313353 α      lambda       -0.4344043E-05
   maximum displ.:     0.0216494 α      in ANC's #2, #4, #1, ...

........................................................................
.............................. CYCLE   25 ..............................
........................................................................
   1    -42.1308926 -0.421309E+02  0.229E-02    2.81       0.0  T
   2    -42.1308929 -0.368013E-06  0.128E-02    2.81       1.6  T
   3    -42.1308928  0.116159E-06  0.352E-03    2.81       5.8  T
   4    -42.1308930 -0.172040E-06  0.143E-03    2.81      14.3  T
   5    -42.1308930 -0.257118E-07  0.562E-04    2.81      36.3  T
   6    -42.1308930 -0.797151E-09  0.204E-04    2.81      99.9  T
     SCC iter.                  ...        0 min,  0.007 sec
     gradient                   ...        0 min,  0.014 sec
 * total energy  :   -41.6105422 Eh     change       -0.3940796E-05 Eh
   gradient norm :     0.0005129 Eh/α   predicted    -0.2176752E-05 ( -44.76%)
   displ. norm   :     0.0290250 α      lambda       -0.1894989E-05
   maximum displ.:     0.0195384 α      in ANC's #2, #1, #4, ...

   *** GEOMETRY OPTIMIZATION CONVERGED AFTER 25 ITERATIONS ***

------------------------------------------------------------------------
 total energy gain   :        -0.0119077 Eh       -7.4722 kcal/mol
 total RMSD          :         0.7114216 a0        0.3765 Å
 total power (kW/mol):        -1.2505484 (step)  -37.6217 (real)
------------------------------------------------------------------------

 ANCopt (total)                0 d,  0 h,  0 min,  0.831 sec
 optimizer setup                ...        0 min,  0.000 sec (  0.020%)
 model hessian                  ...        0 min,  0.013 sec (  1.521%)
 ANC generation                 ...        0 min,  0.001 sec (  0.159%)
 coordinate transformation      ...        0 min,  0.000 sec (  0.056%)
 single point calculation       ...        0 min,  0.805 sec ( 96.879%)
 optimization log               ...        0 min,  0.002 sec (  0.300%)
 hessian update                 ...        0 min,  0.000 sec (  0.041%)
 rational function              ...        0 min,  0.007 sec (  0.834%)

================
 final structure:
================
$coord
    3.21166049801051    2.25909634071095   -0.07471459241476      C 
    5.50063839638678   -0.05321638856187   -0.10140688770500      S 
    3.24855288506909   -2.39161135645268   -0.12212947809114      C 
    0.85585979076589   -1.42902300395014   -0.07759398481076      C 
    0.81766827799108    1.29022862899971   -0.09232428958105      C 
   -1.42867420710260    2.61083266278904   -0.11524910396340      N 
   -3.74040686590537    1.16756765628284    0.13758993688909      C 
   -3.48356334834427   -1.36048636578139   -1.23195066518422      C 
   -1.41496473490985   -2.77637090506153   -0.12601089197273      N 
   -1.94075575031434   -5.00495270539925    1.11435863999343      C 
   -3.96422923071192   -6.01940919542583    0.94844215136802      O 
   -0.07324944660921   -5.96309914771126    2.52647386168478      O 
   -1.49373236470465    5.21301896833033   -0.26273980131788      C 
   -3.47051096269200    6.68648142472603    0.21168165991922      C 
    3.80638541642654    4.19020659002256   -0.03221583965178      H 
    3.84202006182126   -4.32379135405373   -0.26216685064766      H 
   -5.27943781609173    2.24651638057318   -0.70957436949326      H 
   -4.18328512087710    0.82998087769916    2.13741024562412      H 
   -3.09824400619422   -1.04320487449289   -3.23958697836865      H 
   -5.19555312984649   -2.48917212518261   -1.02743287897489      H 
    1.34830060982128   -4.81891883111503    2.68685244055565      H 
    0.27518997691478    6.03968001898592   -0.85409174795172      H 
   -5.26906198568717    5.99432336922370    0.85216377542973      H 
   -3.31468452886355    8.69452429635214   -0.03272079376647      H 
$end
           -------------------------------------------------
          |                Final Singlepoint                |
           -------------------------------------------------

          ...................................................
          :                      SETUP                      :
          :.................................................:
          :  # basis functions                  72          :
          :  # atomic orbitals                  71          :
          :  # shells                           39          :
          :  # electrons                        74          :
          :  max. iterations                   250          :
          :  Hamiltonian                  GFN2-xTB          :
          :  restarted?                      false          :
          :  GBSA solvation                  false          :
          :  PC potential                    false          :
          :  electronic temp.          300.0000000     K    :
          :  accuracy                    1.0000000          :
          :  -> integral cutoff          0.2500000E+02      :
          :  -> integral neglect         0.1000000E-07      :
          :  -> SCF convergence          0.1000000E-05 Eh   :
          :  -> wf. convergence          0.1000000E-03 e    :
          :  Broyden damping             0.4000000          :
          ...................................................

 iter      E             dE          RMSdq      gap      omega  full diag
   1    -42.1308930 -0.421309E+02  0.964E-05    2.81       0.0  T
   2    -42.1308930 -0.496669E-11  0.479E-05    2.81     426.1  T
   3    -42.1308930 -0.410623E-10  0.408E-05    2.81     500.3  T

   *** convergence criteria satisfied after 3 iterations ***

         #    Occupation            Energy/Eh            Energy/eV
      -------------------------------------------------------------
         1        2.0000           -0.7476078             -20.3434
       ...           ...                  ...                  ...
        31        2.0000           -0.4654691             -12.6661
        32        2.0000           -0.4518453             -12.2953
        33        2.0000           -0.4433257             -12.0635
        34        2.0000           -0.4286514             -11.6642
        35        2.0000           -0.4213318             -11.4650
        36        2.0000           -0.3912692             -10.6470
        37        2.0000           -0.3624066              -9.8616 (HOMO)
        38                         -0.2592851              -7.0555 (LUMO)
        39                         -0.2194183              -5.9707
        40                         -0.2185083              -5.9459
        41                         -0.1959281              -5.3315
        42                         -0.1549657              -4.2168
       ...                                ...                  ...
        71                          0.6895985              18.7649
      -------------------------------------------------------------
                  HL-Gap            0.1031215 Eh            2.8061 eV
             Fermi-level           -0.3108458 Eh           -8.4585 eV

 SCC (total)                   0 d,  0 h,  0 min,  0.029 sec
 SCC setup                      ...        0 min,  0.000 sec (  0.709%)
 Dispersion                     ...        0 min,  0.000 sec (  0.688%)
 integral evaluation            ...        0 min,  0.010 sec ( 33.340%)
 zeroth order Hamiltonian       ...        0 min,  0.000 sec (  0.569%)
 iterations                     ...        0 min,  0.004 sec ( 14.188%)
 molecular gradient             ...        0 min,  0.014 sec ( 49.114%)
 printout                       ...        0 min,  0.000 sec (  1.234%)

         :::::::::::::::::::::::::::::::::::::::::::::::::::::
         ::                     SUMMARY                     ::
         :::::::::::::::::::::::::::::::::::::::::::::::::::::
         :: total energy             -41.610542162992 Eh    ::
         :: gradient norm              0.000512694261 Eh/a0 ::
         :: HOMO-LUMO gap              2.806078616048 eV    ::
         ::.................................................::
         :: SCC energy               -42.130893003228 Eh    ::
         :: -> isotropic ES            0.061481318445 Eh    ::
         :: -> anisotropic ES          0.003987703635 Eh    ::
         :: -> anisotropic XC          0.011023494873 Eh    ::
         :: -> dispersion             -0.025908744496 Eh    ::
         :: repulsion energy           0.520173899415 Eh    ::
         :: add. restraining           0.000000000000 Eh    ::
         :::::::::::::::::::::::::::::::::::::::::::::::::::::

           -------------------------------------------------
          |                Property Printout                |
           -------------------------------------------------

    * Orbital Energies and Occupations

         #    Occupation            Energy/Eh            Energy/eV
      -------------------------------------------------------------
         1        2.0000           -0.7476078             -20.3434
       ...           ...                  ...                  ...
        25        2.0000           -0.4990209             -13.5791
        26        2.0000           -0.4875617             -13.2672
        27        2.0000           -0.4842861             -13.1781
        28        2.0000           -0.4813988             -13.0995
        29        2.0000           -0.4760329             -12.9535
        30        2.0000           -0.4717787             -12.8378
        31        2.0000           -0.4654691             -12.6661
        32        2.0000           -0.4518453             -12.2953
        33        2.0000           -0.4433257             -12.0635
        34        2.0000           -0.4286514             -11.6642
        35        2.0000           -0.4213318             -11.4650
        36        2.0000           -0.3912692             -10.6470
        37        2.0000           -0.3624066              -9.8616 (HOMO)
        38                         -0.2592851              -7.0555 (LUMO)
        39                         -0.2194183              -5.9707
        40                         -0.2185083              -5.9459
        41                         -0.1959281              -5.3315
        42                         -0.1549657              -4.2168
        43                         -0.1300823              -3.5397
        44                         -0.0348943              -0.9495
        45                         -0.0029695              -0.0808
        46                          0.0078948               0.2148
        47                          0.0159330               0.4336
        48                          0.0236284               0.6430
       ...                                ...                  ...
        71                          0.6895985              18.7649
      -------------------------------------------------------------
                  HL-Gap            0.1031215 Eh            2.8061 eV
             Fermi-level           -0.3108458 Eh           -8.4585 eV

     #   Z        covCN         q      C6AA      α(0)
     1   6 C      2.937    -0.058    29.446     8.900
     2  16 S      2.285    -0.026   142.143    20.066
     3   6 C      2.927    -0.063    29.563     8.917
     4   6 C      3.121     0.034    27.066     8.520
     5   6 C      3.097     0.038    27.040     8.522
     6   7 N      2.739    -0.058    22.365     7.024
     7   6 C      3.755    -0.006    20.730     6.492
     8   6 C      3.767    -0.001    20.628     6.473
     9   7 N      2.738    -0.129    23.802     7.246
    10   6 C      2.635     0.402    20.230     7.357
    11   8 O      0.858    -0.423    22.145     6.309
    12   8 O      1.660    -0.388    20.609     6.128
    13   6 C      2.838     0.012    27.737     8.631
    14   6 C      2.838    -0.130    31.303     9.169
    15   1 H      0.927     0.047     2.359     2.402
    16   1 H      0.926     0.053     2.279     2.361
    17   1 H      0.924     0.067     2.120     2.277
    18   1 H      0.923     0.049     2.332     2.388
    19   1 H      0.924     0.056     2.247     2.344
    20   1 H      0.924     0.087     1.904     2.158
    21   1 H      0.804     0.322     0.659     1.275
    22   1 H      0.926     0.041     2.437     2.441
    23   1 H      0.926     0.034     2.530     2.487
    24   1 H      0.926     0.040     2.452     2.448

 Mol. C6AA /au·bohr⁶  :       8226.923554
 Mol. C8AA /au·bohr⁸  :     216236.852878
 Mol. α(0) /au        :        142.336619


Wiberg/Mayer (AO) data.
largest (>0.10) Wiberg bond orders for each atom
          total WBO             WBO to atom ...
     1  C   3.926        C    5 1.525    S    2 1.166    H   15 0.967    C    3 0.106
     2  S   2.609        C    3 1.184    C    1 1.166
     3  C   3.939        C    4 1.548    S    2 1.184    H   16 0.964    C    1 0.106
     4  C   3.956        C    3 1.548    C    5 1.158    N    9 1.052
     5  C   3.968        C    1 1.525    C    4 1.158    N    6 1.115
     6  N   3.511        C   13 1.120    C    5 1.115    C    7 0.989    C   14 0.103
     7  C   3.978        C    8 0.996    N    6 0.989    H   18 0.966    H   17 0.964
     8  C   3.966        C    7 0.996    N    9 0.979    H   19 0.969    H   20 0.962
     9  N   3.475        C   10 1.123    C    4 1.052    C    8 0.979    O   11 0.145
    10  C   3.941        O   11 1.671    N    9 1.123    O   12 1.093
    11  O   2.013        C   10 1.671    N    9 0.145    O   12 0.129
    12  O   2.166        C   10 1.093    H   21 0.851    O   11 0.129
    13  C   3.965        C   14 1.839    N    6 1.120    H   22 0.956
    14  C   3.967        C   13 1.839    H   24 0.977    H   23 0.973    N    6 0.103
    15  H   0.997        C    1 0.967
    16  H   0.997        C    3 0.964
    17  H   0.994        C    7 0.964
    18  H   0.998        C    7 0.966
    19  H   0.997        C    8 0.969
    20  H   0.991        C    8 0.962
    21  H   0.896        O   12 0.851
    22  H   0.998        C   13 0.956
    23  H   0.999        C   14 0.973
    24  H   0.998        C   14 0.977

molecular dipole:
                 x           y           z       tot (Debye)
 q only:        0.502       1.391      -0.304
   full:        0.541       1.628      -0.321       4.435
molecular quadrupole (traceless):
                xx          xy          yy          xz          yz          zz
 q only:        4.665     -11.512     -10.896       4.047       3.012       6.230
  q+dip:        2.552     -13.825     -10.777       3.002       3.808       8.225
   full:        1.875     -13.890     -10.980       3.528       4.171       9.105

           -------------------------------------------------
          |                Geometry Summary                 |
           -------------------------------------------------

      molecular mass/u    :      210.2502000
   center of mass at/Å    :       -0.0435137      -0.2593959       0.1099953
  moments of inertia/u·Å² :        0.6569246E+03   0.8605925E+03   0.1449658E+04
rotational constants/cm⁻¹ :        0.2566144E-01   0.1958840E-01   0.1162870E-01

 * 25 selected distances

     #   Z        #   Z                                     value/Å
     1   6 C      2  16 S                                 1.7218132 (max)
     2  16 S      3   6 C                                 1.7180267
     3   6 C      4   6 C                                 1.3649840
     1   6 C      5   6 C                                 1.3666932
     4   6 C      5   6 C                                 1.4391292
     5   6 C      6   7 N                                 1.3789688
     6   7 N      7   6 C                                 1.4483466
     7   6 C      8   6 C                                 1.5275421
     4   6 C      9   7 N                                 1.3975024
     8   6 C      9   7 N                                 1.4498812
     9   7 N     10   6 C                                 1.3780521
    10   6 C     11   8 O                                 1.2010220
    10   6 C     12   8 O                                 1.3386923
     6   7 N     13   6 C                                 1.3796575
    13   6 C     14   6 C                                 1.3286271
     1   6 C     15   1 H                                 1.0694999
     3   6 C     16   1 H                                 1.0721728
     7   6 C     17   1 H                                 1.0909826
     7   6 C     18   1 H                                 1.0985224
     8   6 C     19   1 H                                 1.0947374
     8   6 C     20   1 H                                 1.0904992
    12   8 O     21   1 H                                 0.9693734 (min)
    13   6 C     22   1 H                                 1.0795932
    14   6 C     23   1 H                                 1.0746450
    14   6 C     24   1 H                                 1.0736237

 * 6 distinct bonds (by element types)

   Z      Z             #   av. dist./Å        max./Å        min./Å
   1 H    6 C           9     1.0826974     1.0985224     1.0694999
   6 C    6 C           5     1.4053951     1.5275421     1.3286271
   6 C    7 N           6     1.4054014     1.4498812     1.3780521
   1 H    8 O           1     0.9693734     0.9693734     0.9693734
   6 C    8 O           2     1.2698572     1.3386923     1.2010220
   6 C   16 S           2     1.7199200     1.7218132     1.7180267


optimized geometry written to: xtbopt.xyz


           -------------------------------------------------
          | TOTAL ENERGY              -41.610542162992 Eh   |
          | GRADIENT NORM               0.000512694261 Eh/α |
          | HOMO-LUMO GAP               2.806078616048 eV   |
           -------------------------------------------------

------------------------------------------------------------------------
 * finished run on 2021/05/19 at 10:58:36.429     
------------------------------------------------------------------------
 total:
 * wall-time:     0 d,  0 h,  0 min,  0.925 sec
 *  cpu-time:     0 d,  0 h,  0 min,  0.924 sec
 * ratio c/w:     0.999 speedup
 SCF:
 * wall-time:     0 d,  0 h,  0 min,  0.041 sec
 *  cpu-time:     0 d,  0 h,  0 min,  0.041 sec
 * ratio c/w:     1.000 speedup
 ANC optimizer:
 * wall-time:     0 d,  0 h,  0 min,  0.861 sec
 *  cpu-time:     0 d,  0 h,  0 min,  0.861 sec
 * ratio c/w:     1.000 speedup

