      -----------------------------------------------------------      
     |                   =====================                   |     
     |                           x T B                           |     
     |                   =====================                   |     
     |                         S. Grimme                         |     
     |          Mulliken Center for Theoretical Chemistry        |     
     |                    University of Bonn                     |     
     |                Version 6.2 RC2 (SAW190805)                |     
      -----------------------------------------------------------      

   This program is distributed in the hope that it will be useful,
   but WITHOUT ANY WARRANTY; without even the implied warranty of
   MERCHANTABILITY or FITNESS FOR A PARTICULAR PURPOSE.
   
   FOR NON-COMMERCIAL, ACADEMIA USE ONLY.
   
   Cite this work as:
   * S. Grimme, C. Bannwarth, P. Shushkov, J. Chem. Theory Comput., 2017,
     13, 1989-2009. DOI: 10.1021/acs.jctc.7b00118
   * C. Bannwarth, S. Ehlert and S. Grimme., J. Chem. Theory Comput., 2019,
     15, 1652-1671. DOI: 10.1021/acs.jctc.8b01176
   * P. Pracht, E. Caldeweyher, S. Ehlert, S. Grimme, ChemRxiv, 2019, preprint.
     DOI: 10.26434/chemrxiv.8326202.v1
   
   for DFT-D4:
   * E. Caldeweyher, C. Bannwarth and S. Grimme, J. Chem. Phys., 2017,
     147, 034112. DOI: 10.1063/1.4993215
   * E. Caldeweyher, S. Ehlert, A. Hansen, H. Neugebauer, S. Spicher,
     C. Bannwarth and S. Grimme, J. Chem. Phys., 2019, 150, 154122.
     DOI: 10.1063/1.5090222
   
   for sTDA-xTB:
   * S. Grimme and C. Bannwarth, J. Chem. Phys., 2016, 145, 054103.
     DOI: 10.1063/1.4959605
   
   in the mass-spec context:
   * V. Asgeirsson, C. Bauer and S. Grimme, Chem. Sci., 2017, 8, 4879.
     DOI: 10.1039/c7sc00601b
   
   for metadynamics refer to:
   * S. Grimme, J. Chem. Theory Comput., 2019, 155, 2847-2862
     DOI: 10.1021/acs.jctc.9b00143
   
   with help from (in alphabetical order)
   C. Bannwarth, F. Bohle, G. Brandenburg, E. Caldeweyher, M. Checinski,
   S. Dohm, S. Ehlert, S. Ehrlich, F. März, H. Neugebauer, J. Pisarek,
   P. Pracht, P. Shushkov, and S. Spicher.
   
 * started run on 2021/05/19 at 10:58:37.123     

           -------------------------------------------------
          |                Calculation Setup                |
           -------------------------------------------------

          program call               : /ihome/ghutchison/geoffh/xtb/xtb 108.xyz -opt
          hostname                   : smp-n83
          coordinate file            : 108.xyz
          omp threads                :                     1
          number of atoms            :                    25
          number of electrons        :                    71
          charge                     :                     0
          spin                       :                   0.5
          first test random number   :      0.22630113234538


########################################################################
# WARNING! Please study the warnings concerning your input carefully
#  - the use of '-opt' is discouraged, please use '--opt' next time
########################################################################

           ------------------------------------------------- 
          |                 G F N 2 - x T B                 |
          | Geometry, Frequencies, Noncovalent interactions |
          |            JCTC 2019 parametrisation            |
           ------------------------------------------------- 
             KAB for C  - Si     :                1.0500
             KAB for H  - Pd     :                0.9500
             k(s)              :                1.8500
             k(p)              :                2.2300
             k(d)              :                2.2300
             k(f)              :                2.0000
             kEN (H0ij)        :               -2.0000
             D4 a1             :                0.5200
             D4 a2             :                5.0000
             D4 s6             :                1.0000
             D4 s8             :                2.7000
             D4 s9             :                5.0000
             alphaj            :                2.0000

  Z AO/shell   Hii/eV     exponent
  1     Wed Apr 25 08:07:45 CEST 2018   EN: 2.200 GM2: 0.406  GM3: 0.0800  RAES: 1.40
     1s    -10.707211    1.230000
  6     Wed Apr 25 08:07:45 CEST 2018   EN: 2.550 GM2: 0.538  GM3: 0.1500  RAES: 3.00
     2s    -13.970922    2.096432
     2p    -10.063292    1.800000
  7     Wed Apr 25 08:07:45 CEST 2018   EN: 3.040 GM2: 0.461  GM3:-0.0640  RAES: 1.90
     2s    -16.686243    2.339881
     2p    -12.523956    2.014332
  8     Wed Apr 25 08:07:45 CEST 2018   EN: 3.440 GM2: 0.452  GM3:-0.0517  RAES: 1.80
     2s    -20.229985    2.439742
     2p    -15.503117    2.137023
 16     Tue Apr 24 11:44:34 CEST 2018   EN: 2.580 GM2: 0.340  GM3:-0.0502  RAES: 3.10
     3s    -20.029654    1.981333
     3p    -11.377694    2.025643
     3d     -0.420282    1.702555

           ------------------------------------------------- 
          |        Self-Consistent Charge Iterations        |
           ------------------------------------------------- 

          ...................................................
          :                      SETUP                      :
          :.................................................:
          :  # basis functions                  76          :
          :  # atomic orbitals                  74          :
          :  # shells                           40          :
          :  # electrons                        71          :
          :  max. iterations                   250          :
          :  Hamiltonian                  GFN2-xTB          :
          :  restarted?                      false          :
          :  GBSA solvation                  false          :
          :  PC potential                    false          :
          :  electronic temp.          300.0000000     K    :
          :  accuracy                    1.0000000          :
          :  -> integral cutoff          0.2500000E+02      :
          :  -> integral neglect         0.1000000E-07      :
          :  -> SCF convergence          0.1000000E-05 Eh   :
          :  -> wf. convergence          0.1000000E-03 e    :
          :  Broyden damping             0.4000000          :
          ...................................................

 iter      E             dE          RMSdq      gap      omega  full diag
   1    -39.1288959 -0.391289E+02  0.461E+00    1.61       0.0  T
   2    -39.1892682 -0.603724E-01  0.274E+00    1.39       1.0  T
   3    -39.1909676 -0.169943E-02  0.125E+00    1.44       1.0  T
   4    -39.1960523 -0.508464E-02  0.445E-01    1.41       1.0  T
   5    -39.1973156 -0.126328E-02  0.179E-01    1.41       1.0  T
   6    -39.1974085 -0.929755E-04  0.671E-02    1.41       1.0  T
   7    -39.1974512 -0.426889E-04  0.366E-02    1.41       1.0  T
   8    -39.1974638 -0.126087E-04  0.170E-02    1.41       1.2  T
   9    -39.1974647 -0.837862E-06  0.596E-03    1.41       3.4  T
  10    -39.1974648 -0.145216E-06  0.289E-03    1.41       6.9  T
  11    -39.1974649 -0.369492E-07  0.164E-03    1.41      12.2  T
  12    -39.1974649 -0.362218E-07  0.599E-04    1.41      33.4  T
  13    -39.1974649 -0.385114E-09  0.247E-04    1.41      81.1  T

   *** convergence criteria satisfied after 13 iterations ***

         #    Occupation            Energy/Eh            Energy/eV
      -------------------------------------------------------------
         1        2.0000           -0.7494026             -20.3923
       ...           ...                  ...                  ...
        30        2.0000           -0.4298018             -11.6955
        31        2.0000           -0.4189742             -11.4009
        32        2.0000           -0.4044696             -11.0062
        33        2.0000           -0.3849417             -10.4748
        34        2.0000           -0.3803846             -10.3508
        35        2.0000           -0.3468604              -9.4386
        36        1.0000           -0.2768774              -7.5342 (HOMO)
        37                         -0.2250573              -6.1241 (LUMO)
        38                         -0.2192758              -5.9668
        39                         -0.1953608              -5.3160
        40                         -0.1746870              -4.7535
        41                         -0.1401494              -3.8137
       ...                                ...                  ...
        74                          0.6890347              18.7496
      -------------------------------------------------------------
                  HL-Gap            0.0518201 Eh            1.4101 eV
             Fermi-level           -0.2814181 Eh           -7.6578 eV

 SCC (total)                   0 d,  0 h,  0 min,  0.046 sec
 SCC setup                      ...        0 min,  0.000 sec (  0.747%)
 Dispersion                     ...        0 min,  0.000 sec (  0.752%)
 integral evaluation            ...        0 min,  0.011 sec ( 24.066%)
 zeroth order Hamiltonian       ...        0 min,  0.000 sec (  0.453%)
 iterations                     ...        0 min,  0.017 sec ( 37.785%)
 molecular gradient             ...        0 min,  0.016 sec ( 35.169%)
 printout                       ...        0 min,  0.000 sec (  0.907%)

         :::::::::::::::::::::::::::::::::::::::::::::::::::::
         ::                     SUMMARY                     ::
         :::::::::::::::::::::::::::::::::::::::::::::::::::::
         :: total energy             -38.732015620418 Eh    ::
         :: gradient norm              0.119416379495 Eh/a0 ::
         :: HOMO-LUMO gap              1.410095726461 eV    ::
         ::.................................................::
         :: SCC energy               -39.197464901984 Eh    ::
         :: -> isotropic ES            0.029607769258 Eh    ::
         :: -> anisotropic ES          0.005901069568 Eh    ::
         :: -> anisotropic XC          0.019145303444 Eh    ::
         :: -> dispersion             -0.027477281927 Eh    ::
         :: repulsion energy           0.465269615930 Eh    ::
         :: add. restraining           0.000000000000 Eh    ::
         :::::::::::::::::::::::::::::::::::::::::::::::::::::

      ----------------------------------------------------------- 
     |                   =====================                   |
     |                        A N C O P T                        |
     |                   =====================                   |
     |               Approximate Normal Coordinate               |
     |                Rational Function Optimizer                |
      ----------------------------------------------------------- 

          ...................................................
          :                      SETUP                      :
          :.................................................:
          :   optimization level            normal          :
          :   max. optcycles                   200          :
          :   ANC micro-cycles                  20          :
          :   degrees of freedom                69          :
          :.................................................:
          :   RF solver                   davidson          :
          :   input Hessian                  false          :
          :   write xtbopt.log                true          :
          :   linear?                        false          :
          :   energy convergence         0.5000000E-05 Eh   :
          :   grad. convergence          0.1000000E-02 Eh/α :
          :   maximium RF displ.         2.0000000          :
          :   Hlow (freq-cutoff)         0.5000000E-02      :
          :   Hmax (freq-cutoff)         5.0000000          :
          :   S6 in model hess.         20.0000000          :
          ...................................................

generating ANC from model Hessian ...
Using Lindh-Hessian (1995)
 Shifting diagonal of input Hessian by   3.866706955306445E-003
 Lowest  eigenvalues of input Hessian
   -0.000000   -0.000000   -0.000000    0.000000    0.000000    0.000000
    0.005000    0.006002    0.006347    0.007604    0.008084    0.009986
    0.013354    0.014068    0.018195    0.019087    0.023608    0.028654
 Highest eigenvalues
    1.571866    1.617072    1.682398    1.787861    1.945037    2.016758
 

........................................................................
.............................. CYCLE    1 ..............................
........................................................................
   1    -39.1974649 -0.391975E+02  0.132E-04    1.41       0.0  T
   2    -39.1974649 -0.521041E-10  0.865E-05    1.41     231.2  T
   3    -39.1974649 -0.566800E-10  0.632E-05    1.41     316.3  T
     SCC iter.                  ...        0 min,  0.005 sec
     gradient                   ...        0 min,  0.016 sec
 * total energy  :   -38.7320156 Eh     change        0.1898642E-07 Eh
   gradient norm :     0.1194167 Eh/α   predicted     0.0000000E+00 (-100.00%)
   displ. norm   :     0.3517628 α      lambda       -0.1612763E-01
   maximum displ.:     0.1584523 α      in ANC's #10, #8, #22, ...

........................................................................
.............................. CYCLE    2 ..............................
........................................................................
   1    -39.2108601 -0.392109E+02  0.461E-01    1.67       0.0  T
   2    -39.2110652 -0.205167E-03  0.219E-01    1.67       1.0  T
   3    -39.2109349  0.130302E-03  0.124E-01    1.67       1.0  T
   4    -39.2111623 -0.227399E-03  0.379E-02    1.67       1.0  T
   5    -39.2111646 -0.225364E-05  0.188E-02    1.67       1.1  T
   6    -39.2111673 -0.271752E-05  0.744E-03    1.67       2.7  T
   7    -39.2111681 -0.767361E-06  0.234E-03    1.67       8.5  T
   8    -39.2111681 -0.763201E-09  0.139E-03    1.67      14.4  T
     SCC iter.                  ...        0 min,  0.010 sec
     gradient                   ...        0 min,  0.015 sec
 * total energy  :   -38.7440279 Eh     change       -0.1201234E-01 Eh
   gradient norm :     0.0627741 Eh/α   predicted    -0.9061617E-02 ( -24.56%)
   displ. norm   :     0.3479284 α      lambda       -0.9024851E-02
   maximum displ.:     0.1609357 α      in ANC's #10, #8, #12, ...

........................................................................
.............................. CYCLE    3 ..............................
........................................................................
   1    -39.2221687 -0.392222E+02  0.446E-01    1.90       0.0  T
   2    -39.2224722 -0.303522E-03  0.224E-01    1.91       1.0  T
   3    -39.2223906  0.815659E-04  0.124E-01    1.91       1.0  T
   4    -39.2225737 -0.183021E-03  0.438E-02    1.91       1.0  T
   5    -39.2225901 -0.164714E-04  0.216E-02    1.91       1.0  T
   6    -39.2225913 -0.113873E-05  0.930E-03    1.91       2.1  T
   7    -39.2225930 -0.172644E-05  0.272E-03    1.91       7.4  T
   8    -39.2225930 -0.246709E-07  0.186E-03    1.91      10.7  T
     SCC iter.                  ...        0 min,  0.010 sec
     gradient                   ...        0 min,  0.015 sec
 * total energy  :   -38.7493642 Eh     change       -0.5336277E-02 Eh
   gradient norm :     0.0228918 Eh/α   predicted    -0.5058678E-02 (  -5.20%)
   displ. norm   :     0.2358316 α      lambda       -0.1460509E-02
   maximum displ.:     0.1106567 α      in ANC's #10, #1, #2, ...

........................................................................
.............................. CYCLE    4 ..............................
........................................................................
   1    -39.2223951 -0.392224E+02  0.230E-01    1.96       0.0  T
   2    -39.2224627 -0.676666E-04  0.120E-01    1.96       1.0  T
   3    -39.2224565  0.624773E-05  0.465E-02    1.96       1.0  T
   4    -39.2224732 -0.166609E-04  0.192E-02    1.96       1.0  T
   5    -39.2224754 -0.225411E-05  0.105E-02    1.96       1.9  T
   6    -39.2224762 -0.800974E-06  0.349E-03    1.96       5.7  T
   7    -39.2224764 -0.226140E-06  0.127E-03    1.96      15.7  T
     SCC iter.                  ...        0 min,  0.009 sec
     gradient                   ...        0 min,  0.015 sec
 * total energy  :   -38.7504006 Eh     change       -0.1036349E-02 Eh
   gradient norm :     0.0203127 Eh/α   predicted    -0.7708755E-03 ( -25.62%)
   displ. norm   :     0.3175233 α      lambda       -0.1249353E-02
   maximum displ.:     0.1777899 α      in ANC's #1, #2, #10, ...

........................................................................
.............................. CYCLE    5 ..............................
........................................................................
   1    -39.2208852 -0.392209E+02  0.283E-01    1.96       0.0  T
   2    -39.2209802 -0.949491E-04  0.148E-01    1.96       1.0  T
   3    -39.2209788  0.138155E-05  0.518E-02    1.96       1.0  T
   4    -39.2209962 -0.173512E-04  0.189E-02    1.96       1.1  T
   5    -39.2209958  0.340464E-06  0.103E-02    1.96       1.9  T
   6    -39.2209976 -0.174743E-05  0.298E-03    1.96       6.7  T
   7    -39.2209977 -0.942635E-07  0.144E-03    1.96      13.9  T
     SCC iter.                  ...        0 min,  0.009 sec
     gradient                   ...        0 min,  0.015 sec
 * total energy  :   -38.7512022 Eh     change       -0.8016227E-03 Eh
   gradient norm :     0.0157905 Eh/α   predicted    -0.6876575E-03 ( -14.22%)
   displ. norm   :     0.2403407 α      lambda       -0.6346822E-03
   maximum displ.:     0.1656249 α      in ANC's #1, #2, #7, ...

........................................................................
.............................. CYCLE    6 ..............................
........................................................................
   1    -39.2216800 -0.392217E+02  0.210E-01    1.94       0.0  T
   2    -39.2217344 -0.544355E-04  0.109E-01    1.95       1.0  T
   3    -39.2217326  0.177581E-05  0.403E-02    1.95       1.0  T
   4    -39.2217444 -0.117241E-04  0.150E-02    1.95       1.3  T
   5    -39.2217440  0.392076E-06  0.839E-03    1.95       2.4  T
   6    -39.2217451 -0.109118E-05  0.221E-03    1.95       9.1  T
   7    -39.2217451 -0.530480E-07  0.988E-04    1.95      20.2  T
     SCC iter.                  ...        0 min,  0.009 sec
     gradient                   ...        0 min,  0.015 sec
 * total energy  :   -38.7516484 Eh     change       -0.4462508E-03 Eh
   gradient norm :     0.0099254 Eh/α   predicted    -0.3356819E-03 ( -24.78%)
   displ. norm   :     0.2389725 α      lambda       -0.4403860E-03
   maximum displ.:     0.1644800 α      in ANC's #1, #2, #7, ...

........................................................................
.............................. CYCLE    7 ..............................
........................................................................
   1    -39.2231478 -0.392231E+02  0.202E-01    1.93       0.0  T
   2    -39.2231932 -0.453431E-04  0.104E-01    1.93       1.0  T
   3    -39.2231910  0.210517E-05  0.382E-02    1.93       1.0  T
   4    -39.2232018 -0.107843E-04  0.141E-02    1.93       1.4  T
   5    -39.2232009  0.938759E-06  0.908E-03    1.93       2.2  T
   6    -39.2232023 -0.138904E-05  0.227E-03    1.93       8.8  T
   7    -39.2232023 -0.567079E-07  0.905E-04    1.93      22.1  T
     SCC iter.                  ...        0 min,  0.009 sec
     gradient                   ...        0 min,  0.015 sec
 * total energy  :   -38.7519588 Eh     change       -0.3103910E-03 Eh
   gradient norm :     0.0065364 Eh/α   predicted    -0.2327839E-03 ( -25.00%)
   displ. norm   :     0.2269007 α      lambda       -0.2528238E-03
   maximum displ.:     0.1511431 α      in ANC's #1, #2, #4, ...

........................................................................
.............................. CYCLE    8 ..............................
........................................................................
   1    -39.2235330 -0.392235E+02  0.198E-01    1.92       0.0  T
   2    -39.2235578 -0.248038E-04  0.100E-01    1.92       1.0  T
   3    -39.2235545  0.331077E-05  0.326E-02    1.91       1.0  T
   4    -39.2235630 -0.858471E-05  0.136E-02    1.92       1.5  T
   5    -39.2235621  0.899231E-06  0.945E-03    1.92       2.1  T
   6    -39.2235637 -0.152257E-05  0.154E-03    1.92      13.0  T
   7    -39.2235637 -0.106552E-07  0.772E-04    1.92      25.9  T
     SCC iter.                  ...        0 min,  0.009 sec
     gradient                   ...        0 min,  0.015 sec
 * total energy  :   -38.7521385 Eh     change       -0.1796754E-03 Eh
   gradient norm :     0.0058107 Eh/α   predicted    -0.1329255E-03 ( -26.02%)
   displ. norm   :     0.1872979 α      lambda       -0.1571045E-03
   maximum displ.:     0.1201742 α      in ANC's #1, #2, #4, ...

........................................................................
.............................. CYCLE    9 ..............................
........................................................................
   1    -39.2238603 -0.392239E+02  0.160E-01    1.92       0.0  T
   2    -39.2238725 -0.121709E-04  0.796E-02    1.92       1.0  T
   3    -39.2238721  0.407062E-06  0.228E-02    1.92       1.0  T
   4    -39.2238753 -0.317161E-05  0.102E-02    1.92       2.0  T
   5    -39.2238749  0.327176E-06  0.468E-03    1.92       4.3  T
   6    -39.2238754 -0.440572E-06  0.104E-03    1.92      19.3  T
   7    -39.2238754 -0.429541E-08  0.678E-04    1.92      29.5  T
     SCC iter.                  ...        0 min,  0.009 sec
     gradient                   ...        0 min,  0.015 sec
 * total energy  :   -38.7522477 Eh     change       -0.1092380E-03 Eh
   gradient norm :     0.0053695 Eh/α   predicted    -0.8131485E-04 ( -25.56%)
   displ. norm   :     0.1748240 α      lambda       -0.1037317E-03
   maximum displ.:     0.1096587 α      in ANC's #1, #2, #4, ...

........................................................................
.............................. CYCLE   10 ..............................
........................................................................
   1    -39.2231410 -0.392231E+02  0.145E-01    1.92       0.0  T
   2    -39.2231480 -0.699989E-05  0.710E-02    1.92       1.0  T
   3    -39.2231487 -0.739264E-06  0.161E-02    1.92       1.2  T
   4    -39.2231492 -0.513884E-06  0.883E-03    1.92       2.3  T
   5    -39.2231496 -0.419305E-06  0.277E-03    1.92       7.2  T
   6    -39.2231498 -0.136226E-06  0.897E-04    1.92      22.3  T
     SCC iter.                  ...        0 min,  0.008 sec
     gradient                   ...        0 min,  0.015 sec
 * total energy  :   -38.7523230 Eh     change       -0.7523761E-04 Eh
   gradient norm :     0.0049692 Eh/α   predicted    -0.5345618E-04 ( -28.95%)
   displ. norm   :     0.1665277 α      lambda       -0.1009529E-03
   maximum displ.:     0.1032532 α      in ANC's #1, #2, #3, ...

........................................................................
.............................. CYCLE   11 ..............................
........................................................................
   1    -39.2233668 -0.392234E+02  0.132E-01    1.93       0.0  T
   2    -39.2233732 -0.643936E-05  0.641E-02    1.93       1.0  T
   3    -39.2233712  0.201608E-05  0.191E-02    1.93       1.0  T
   4    -39.2233740 -0.275219E-05  0.116E-02    1.93       1.7  T
   5    -39.2233751 -0.116476E-05  0.276E-03    1.93       7.2  T
   6    -39.2233752 -0.962105E-07  0.931E-04    1.93      21.5  T
     SCC iter.                  ...        0 min,  0.008 sec
     gradient                   ...        0 min,  0.015 sec
 * total energy  :   -38.7523989 Eh     change       -0.7587052E-04 Eh
   gradient norm :     0.0050900 Eh/α   predicted    -0.5188008E-04 ( -31.62%)
   displ. norm   :     0.2092551 α      lambda       -0.1123142E-03
   maximum displ.:     0.1328450 α      in ANC's #1, #2, #3, ...

........................................................................
.............................. CYCLE   12 ..............................
........................................................................
   1    -39.2229404 -0.392229E+02  0.164E-01    1.94       0.0  T
   2    -39.2229535 -0.131914E-04  0.793E-02    1.94       1.0  T
   3    -39.2229524  0.113009E-05  0.232E-02    1.94       1.0  T
   4    -39.2229550 -0.256960E-05  0.144E-02    1.94       1.4  T
   5    -39.2229564 -0.144774E-05  0.659E-03    1.94       3.0  T
   6    -39.2229570 -0.547998E-06  0.129E-03    1.94      15.5  T
   7    -39.2229570 -0.134445E-07  0.654E-04    1.94      30.6  T
     SCC iter.                  ...        0 min,  0.009 sec
     gradient                   ...        0 min,  0.015 sec
 * total energy  :   -38.7524825 Eh     change       -0.8363008E-04 Eh
   gradient norm :     0.0045085 Eh/α   predicted    -0.5861808E-04 ( -29.91%)
   displ. norm   :     0.1798815 α      lambda       -0.9785512E-04
   maximum displ.:     0.1193202 α      in ANC's #1, #2, #3, ...

........................................................................
.............................. CYCLE   13 ..............................
........................................................................
   1    -39.2238594 -0.392239E+02  0.144E-01    1.95       0.0  T
   2    -39.2238741 -0.147203E-04  0.700E-02    1.95       1.0  T
   3    -39.2238726  0.150702E-05  0.243E-02    1.95       1.0  T
   4    -39.2238762 -0.365823E-05  0.134E-02    1.95       1.5  T
   5    -39.2238773 -0.102907E-05  0.719E-03    1.95       2.8  T
   6    -39.2238779 -0.594837E-06  0.135E-03    1.95      14.9  T
   7    -39.2238779 -0.187037E-07  0.632E-04    1.95      31.6  T
     SCC iter.                  ...        0 min,  0.009 sec
     gradient                   ...        0 min,  0.015 sec
 * total energy  :   -38.7525493 Eh     change       -0.6682795E-04 Eh
   gradient norm :     0.0031829 Eh/α   predicted    -0.5051327E-04 ( -24.41%)
   displ. norm   :     0.1372689 α      lambda       -0.4551704E-04
   maximum displ.:     0.0967462 α      in ANC's #1, #2, #5, ...

........................................................................
.............................. CYCLE   14 ..............................
........................................................................
   1    -39.2237308 -0.392237E+02  0.110E-01    1.95       0.0  T
   2    -39.2237375 -0.667723E-05  0.526E-02    1.95       1.0  T
   3    -39.2237376 -0.367503E-07  0.156E-02    1.95       1.3  T
   4    -39.2237387 -0.109438E-05  0.864E-03    1.95       2.3  T
   5    -39.2237389 -0.211752E-06  0.411E-03    1.95       4.9  T
   6    -39.2237391 -0.239682E-06  0.105E-03    1.95      19.0  T
   7    -39.2237391 -0.133563E-07  0.488E-04    1.95      41.0  T
   8    -39.2237391 -0.625818E-09  0.190E-04    1.95     105.1  T
     SCC iter.                  ...        0 min,  0.010 sec
     gradient                   ...        0 min,  0.016 sec
 * total energy  :   -38.7525793 Eh     change       -0.3000618E-04 Eh
   gradient norm :     0.0024214 Eh/α   predicted    -0.2318798E-04 ( -22.72%)
   displ. norm   :     0.0585913 α      lambda       -0.2480019E-04
   maximum displ.:     0.0467672 α      in ANC's #1, #6, #8, ...

........................................................................
.............................. CYCLE   15 ..............................
........................................................................
   1    -39.2249484 -0.392249E+02  0.486E-02    1.95       0.0  T
   2    -39.2249503 -0.190921E-05  0.242E-02    1.95       1.0  T
   3    -39.2249503  0.304122E-07  0.892E-03    1.95       2.2  T
   4    -39.2249507 -0.436161E-06  0.379E-03    1.95       5.3  T
   5    -39.2249508 -0.494665E-07  0.141E-03    1.95      14.1  T
   6    -39.2249508 -0.176252E-07  0.393E-04    1.95      50.9  T
   7    -39.2249508 -0.121953E-08  0.227E-04    1.95      88.1  T
     SCC iter.                  ...        0 min,  0.009 sec
     gradient                   ...        0 min,  0.016 sec
 * total energy  :   -38.7525917 Eh     change       -0.1242984E-04 Eh
   gradient norm :     0.0017707 Eh/α   predicted    -0.1244446E-04 (   0.12%)
   displ. norm   :     0.0848535 α      lambda       -0.1015923E-04
   maximum displ.:     0.0676643 α      in ANC's #1, #2, #5, ...

........................................................................
.............................. CYCLE   16 ..............................
........................................................................
   1    -39.2241114 -0.392241E+02  0.659E-02    1.95       0.0  T
   2    -39.2241129 -0.149453E-05  0.319E-02    1.95       1.0  T
   3    -39.2241131 -0.180192E-06  0.737E-03    1.95       2.7  T
   4    -39.2241129  0.182875E-06  0.492E-03    1.95       4.1  T
   5    -39.2241133 -0.357074E-06  0.109E-03    1.95      18.4  T
   6    -39.2241133 -0.129588E-07  0.531E-04    1.95      37.6  T
   7    -39.2241133 -0.212484E-08  0.226E-04    1.95      88.3  T
     SCC iter.                  ...        0 min,  0.009 sec
     gradient                   ...        0 min,  0.016 sec
 * total energy  :   -38.7525977 Eh     change       -0.5986249E-05 Eh
   gradient norm :     0.0013625 Eh/α   predicted    -0.5098385E-05 ( -14.83%)
   displ. norm   :     0.0282623 α      lambda       -0.4648758E-05
   maximum displ.:     0.0204190 α      in ANC's #2, #3, #8, ...

........................................................................
.............................. CYCLE   17 ..............................
........................................................................
   1    -39.2244834 -0.392245E+02  0.226E-02    1.95       0.0  T
   2    -39.2244836 -0.208141E-06  0.112E-02    1.95       1.8  T
   3    -39.2244835  0.641424E-07  0.356E-03    1.95       5.6  T
   4    -39.2244836 -0.969667E-07  0.191E-03    1.95      10.5  T
   5    -39.2244837 -0.173973E-07  0.887E-04    1.95      22.5  T
   6    -39.2244837 -0.116260E-07  0.193E-04    1.95     103.5  T
     SCC iter.                  ...        0 min,  0.008 sec
     gradient                   ...        0 min,  0.016 sec
 * total energy  :   -38.7526021 Eh     change       -0.4358437E-05 Eh
   gradient norm :     0.0006749 Eh/α   predicted    -0.2329581E-05 ( -46.55%)
   displ. norm   :     0.0288075 α      lambda       -0.2506340E-05
   maximum displ.:     0.0237116 α      in ANC's #1, #2, #5, ...

   *** GEOMETRY OPTIMIZATION CONVERGED AFTER 17 ITERATIONS ***

------------------------------------------------------------------------
 total energy gain   :        -0.0205865 Eh      -12.9182 kcal/mol
 total RMSD          :         0.4960267 a0        0.2625 Å
 total power (kW/mol):        -3.1793982 (step)  -88.5282 (real)
------------------------------------------------------------------------

 ANCopt (total)                0 d,  0 h,  0 min,  0.611 sec
 optimizer setup                ...        0 min,  0.000 sec (  0.025%)
 model hessian                  ...        0 min,  0.005 sec (  0.754%)
 ANC generation                 ...        0 min,  0.001 sec (  0.124%)
 coordinate transformation      ...        0 min,  0.000 sec (  0.056%)
 single point calculation       ...        0 min,  0.598 sec ( 97.919%)
 optimization log               ...        0 min,  0.002 sec (  0.294%)
 hessian update                 ...        0 min,  0.000 sec (  0.039%)
 rational function              ...        0 min,  0.004 sec (  0.612%)

================
 final structure:
================
$coord
    2.99255426918617    1.91748734587145    0.93028138643007      C 
    3.03354597813027   -0.65531039855755    0.47901567026682      C 
    5.21859928323647   -1.99132241746215    0.72625176171143      O 
    5.17402081394445   -4.46321378471779   -0.26758492572618      C 
    2.97883271657274   -6.01881264653988    0.74149201627760      C 
    0.02377663462541   -4.85719698871767   -0.59896215940063      S 
    0.63188630020628   -1.63057700735159   -0.12344505462570      C 
   -1.25789911218832    0.20263926507711   -0.19631938699555      C 
    0.04982388601929    3.18489900707039    0.47197292878842      S 
    0.23147969550428    4.27178112334322   -2.80880190724366      N 
    1.24704409737930    6.78718563563843   -3.08511036615099      C 
   -3.89038250900087   -0.14643013403465   -0.57017108168737      C 
   -5.65071090767074    1.66502846713030   -0.44403141362638      C 
    4.53153021797397    3.02955828295999    1.61880511673735      H 
    6.97553154059411   -5.30004935521041    0.30262528073847      H 
    5.08198328511896   -4.39896845088943   -2.34224366417175      H 
    2.86980398340020   -5.88103398752893    2.79542516001505      H 
    3.14443166775883   -7.98721278023766    0.17385638970566      H 
   -1.54643764862503    4.15073187441508   -3.52119526238144      H 
    3.11156032396336    6.82192260659710   -2.21228847835291      H 
    0.07910243468890    8.27009292419090   -2.22755861189265      H 
    1.45546307281490    7.19402855142593   -5.09431907072078      H 
   -4.43193200966788   -2.07199111086965   -1.00556940624318      H 
   -5.16405386637191    3.59202294739196    0.00550381870065      H 
   -7.61718405368838    1.26401923695175   -0.74709315402407      H 
$end
           -------------------------------------------------
          |                Final Singlepoint                |
           -------------------------------------------------

          ...................................................
          :                      SETUP                      :
          :.................................................:
          :  # basis functions                  76          :
          :  # atomic orbitals                  74          :
          :  # shells                           40          :
          :  # electrons                        71          :
          :  max. iterations                   250          :
          :  Hamiltonian                  GFN2-xTB          :
          :  restarted?                      false          :
          :  GBSA solvation                  false          :
          :  PC potential                    false          :
          :  electronic temp.          300.0000000     K    :
          :  accuracy                    1.0000000          :
          :  -> integral cutoff          0.2500000E+02      :
          :  -> integral neglect         0.1000000E-07      :
          :  -> SCF convergence          0.1000000E-05 Eh   :
          :  -> wf. convergence          0.1000000E-03 e    :
          :  Broyden damping             0.4000000          :
          ...................................................

 iter      E             dE          RMSdq      gap      omega  full diag
   1    -39.2244837 -0.392245E+02  0.102E-04    1.95       0.0  T
   2    -39.2244837 -0.132090E-10  0.415E-05    1.95     481.9  T
   3    -39.2244837 -0.148006E-10  0.437E-05    1.95     457.6  T

   *** convergence criteria satisfied after 3 iterations ***

         #    Occupation            Energy/Eh            Energy/eV
      -------------------------------------------------------------
         1        2.0000           -0.7450031             -20.2726
       ...           ...                  ...                  ...
        30        2.0000           -0.4348265             -11.8322
        31        2.0000           -0.4265965             -11.6083
        32        2.0000           -0.4090079             -11.1297
        33        2.0000           -0.3850374             -10.4774
        34        2.0000           -0.3770612             -10.2604
        35        2.0000           -0.3494046              -9.5078
        36        1.0000           -0.2970568              -8.0833 (HOMO)
        37                         -0.2253749              -6.1328 (LUMO)
        38                         -0.2123881              -5.7794
        39                         -0.2028118              -5.5188
        40                         -0.1733210              -4.7163
        41                         -0.1441684              -3.9230
       ...                                ...                  ...
        74                          0.6682270              18.1834
      -------------------------------------------------------------
                  HL-Gap            0.0716819 Eh            1.9506 eV
             Fermi-level           -0.2922233 Eh           -7.9518 eV

 SCC (total)                   0 d,  0 h,  0 min,  0.032 sec
 SCC setup                      ...        0 min,  0.000 sec (  0.678%)
 Dispersion                     ...        0 min,  0.000 sec (  0.622%)
 integral evaluation            ...        0 min,  0.011 sec ( 33.603%)
 zeroth order Hamiltonian       ...        0 min,  0.000 sec (  0.579%)
 iterations                     ...        0 min,  0.005 sec ( 13.957%)
 molecular gradient             ...        0 min,  0.016 sec ( 49.266%)
 printout                       ...        0 min,  0.000 sec (  1.143%)

         :::::::::::::::::::::::::::::::::::::::::::::::::::::
         ::                     SUMMARY                     ::
         :::::::::::::::::::::::::::::::::::::::::::::::::::::
         :: total energy             -38.752602085682 Eh    ::
         :: gradient norm              0.000673646408 Eh/a0 ::
         :: HOMO-LUMO gap              1.950564257279 eV    ::
         ::.................................................::
         :: SCC energy               -39.224483663018 Eh    ::
         :: -> isotropic ES            0.028787861266 Eh    ::
         :: -> anisotropic ES          0.004817938888 Eh    ::
         :: -> anisotropic XC          0.019154271618 Eh    ::
         :: -> dispersion             -0.027265905251 Eh    ::
         :: repulsion energy           0.471737935126 Eh    ::
         :: add. restraining           0.000000000000 Eh    ::
         :::::::::::::::::::::::::::::::::::::::::::::::::::::

           -------------------------------------------------
          |                Property Printout                |
           -------------------------------------------------

    * Orbital Energies and Occupations

         #    Occupation            Energy/Eh            Energy/eV
      -------------------------------------------------------------
         1        2.0000           -0.7450031             -20.2726
       ...           ...                  ...                  ...
        24        2.0000           -0.4722916             -12.8517
        25        2.0000           -0.4698271             -12.7846
        26        2.0000           -0.4666950             -12.6994
        27        2.0000           -0.4597266             -12.5098
        28        2.0000           -0.4477670             -12.1844
        29        2.0000           -0.4463646             -12.1462
        30        2.0000           -0.4348265             -11.8322
        31        2.0000           -0.4265965             -11.6083
        32        2.0000           -0.4090079             -11.1297
        33        2.0000           -0.3850374             -10.4774
        34        2.0000           -0.3770612             -10.2604
        35        2.0000           -0.3494046              -9.5078
        36        1.0000           -0.2970568              -8.0833 (HOMO)
        37                         -0.2253749              -6.1328 (LUMO)
        38                         -0.2123881              -5.7794
        39                         -0.2028118              -5.5188
        40                         -0.1733210              -4.7163
        41                         -0.1441684              -3.9230
        42                         -0.1270442              -3.4570
        43                         -0.0494523              -1.3457
        44                         -0.0194200              -0.5284
        45                         -0.0099647              -0.2712
        46                          0.0017941               0.0488
        47                          0.0166436               0.4529
       ...                                ...                  ...
        74                          0.6682270              18.1834
      -------------------------------------------------------------
                  HL-Gap            0.0716819 Eh            1.9506 eV
             Fermi-level           -0.2922233 Eh           -7.9518 eV

     #   Z        covCN         q      C6AA      α(0)
     1   6 C      2.929    -0.113    30.852     9.109
     2   6 C      3.070     0.129    25.104     8.215
     3   8 O      1.704    -0.273    18.520     5.810
     4   6 C      3.749     0.088    19.180     6.246
     5   6 C      3.794    -0.017    20.877     6.507
     6  16 S      2.042    -0.153   147.502    20.441
     7   6 C      3.130    -0.007    27.983     8.660
     8   6 C      3.011    -0.037    28.907     8.819
     9  16 S      3.231     0.201   133.115    19.418
    10   7 N      2.669    -0.288    27.415     7.776
    11   6 C      3.718    -0.023    21.101     6.562
    12   6 C      2.915    -0.031    28.785     8.798
    13   6 C      2.841    -0.111    30.809     9.096
    14   1 H      0.927     0.050     2.314     2.379
    15   1 H      0.924     0.054     2.275     2.359
    16   1 H      0.923     0.043     2.415     2.430
    17   1 H      0.925     0.057     2.231     2.336
    18   1 H      0.925     0.055     2.255     2.348
    19   1 H      0.860     0.155     1.370     1.834
    20   1 H      0.925     0.046     2.367     2.406
    21   1 H      0.924     0.021     2.725     2.581
    22   1 H      0.924     0.050     2.319     2.382
    23   1 H      0.925     0.046     2.365     2.405
    24   1 H      0.926     0.024     2.678     2.559
    25   1 H      0.926     0.032     2.553     2.498

 Mol. C6AA /au·bohr⁶  :       9396.052940
 Mol. C8AA /au·bohr⁸  :     267969.295183
 Mol. α(0) /au        :        153.975861

(R)spin-density population

 Mulliken population n(s)   n(p)   n(d)
     1 C   0.1024  -0.000  0.102  0.000
     2 C   0.1107   0.000  0.111  0.000
     3 O   0.0274   0.000  0.027  0.000
     4 C   0.0011  -0.000  0.001  0.000
     5 C   0.0021   0.000  0.002  0.000
     6 S   0.0549   0.000  0.046  0.009
     7 C   0.1234   0.000  0.123  0.000
     8 C   0.1305   0.001  0.129  0.000
     9 S   0.1674   0.003  0.077  0.087
    10 N   0.1506   0.021  0.130  0.000
    11 C   0.0054   0.000  0.005  0.000
    12 C   0.0028   0.000  0.003  0.000
    13 C   0.1075   0.000  0.107  0.000
    14 H   0.0006   0.001  0.000  0.000
    15 H   0.0000   0.000  0.000  0.000
    16 H   0.0013   0.001  0.000  0.000
    17 H   0.0005   0.001  0.000  0.000
    18 H   0.0000   0.000  0.000  0.000
    19 H   0.0024   0.002  0.000  0.000
    20 H   0.0006   0.001  0.000  0.000
    21 H   0.0015   0.001  0.000  0.000
    22 H   0.0068   0.007  0.000  0.000
    23 H   0.0001   0.000  0.000  0.000
    24 H   0.0000   0.000  0.000  0.000
    25 H   0.0000   0.000  0.000  0.000

Wiberg/Mayer (AO) data.
largest (>0.10) Wiberg bond orders for each atom
          total WBO             WBO to atom ...
     1  C   3.768        C    2 1.417    S    9 1.158    H   14 0.967
     2  C   3.821        C    1 1.417    C    7 1.246    O    3 1.049
     3  O   2.197        C    2 1.049    C    4 0.975
     4  C   3.950        C    5 1.005    O    3 0.975    H   16 0.967    H   15 0.965
     5  C   3.982        C    4 1.005    S    6 0.989    H   17 0.974    H   18 0.973
     6  S   2.231        C    7 1.042    C    5 0.989
     7  C   3.819        C    8 1.351    C    2 1.246    S    6 1.042
     8  C   3.770        C    7 1.351    C   12 1.202    S    9 1.022
     9  S   3.283        C    1 1.158    C    8 1.022    N   10 0.897
    10  N   2.976        C   11 1.033    H   19 0.948    S    9 0.897
    11  C   3.978        N   10 1.033    H   20 0.983    H   21 0.978    H   22 0.971
    12  C   3.988        C   13 1.777    C    8 1.202    H   23 0.952
    13  C   3.877        C   12 1.777    H   25 0.980    H   24 0.972
    14  H   0.997        C    1 0.967
    15  H   0.996        C    4 0.965
    16  H   0.997        C    4 0.967
    17  H   0.996        C    5 0.974
    18  H   0.996        C    5 0.973
    19  H   0.974        N   10 0.948
    20  H   0.997        C   11 0.983
    21  H   0.998        C   11 0.978
    22  H   0.990        C   11 0.971
    23  H   0.997        C   12 0.952
    24  H   0.999        C   13 0.972
    25  H   0.998        C   13 0.980

molecular dipole:
                 x           y           z       tot (Debye)
 q only:        0.308       0.191       0.013
   full:        0.482       0.237      -0.036       1.369
molecular quadrupole (traceless):
                xx          xy          yy          xz          yz          zz
 q only:       -4.503      -5.382       7.886      -0.582      -1.990      -3.383
  q+dip:       -3.671      -8.539       8.306       0.493      -3.909      -4.635
   full:       -4.191      -8.378       8.590       0.676      -4.575      -4.400

           -------------------------------------------------
          |                Geometry Summary                 |
           -------------------------------------------------

      molecular mass/u    :      214.3199000
   center of mass at/Å    :        0.3970752      -0.1111548      -0.1842022
  moments of inertia/u·Å² :        0.4956173E+03   0.1035129E+04   0.1391564E+04
rotational constants/cm⁻¹ :        0.3401341E-01   0.1628554E-01   0.1211416E-01

 * 23 selected distances

     #   Z        #   Z                                     value/Å
     1   6 C      2   6 C                                 1.3824202
     2   6 C      3   8 O                                 1.3615919
     3   8 O      4   6 C                                 1.4100311
     4   6 C      5   6 C                                 1.5205883
     2   6 C      7   6 C                                 1.4082552
     7   6 C      8   6 C                                 1.3937851
     1   6 C      9  16 S                                 1.7127728
     8   6 C      9  16 S                                 1.7591166 (max)
    10   7 N     11   6 C                                 1.4429158
     8   6 C     12   6 C                                 1.4191014
    12   6 C     13   6 C                                 1.3383111
     1   6 C     14   1 H                                 1.0687827
     4   6 C     15   1 H                                 1.0936027
     4   6 C     16   1 H                                 1.0994678
     5   6 C     17   1 H                                 1.0908642
     5   6 C     18   1 H                                 1.0876147
    10   7 N     19   1 H                                 1.0155720 (min)
    11   6 C     20   1 H                                 1.0895714
    11   6 C     21   1 H                                 1.0971335
    11   6 C     22   1 H                                 1.0903979
    12   6 C     23   1 H                                 1.0832806
    13   6 C     24   1 H                                 1.0783049
    13   6 C     25   1 H                                 1.0740697

 * 6 distinct bonds (by element types)

   Z      Z             #   av. dist./Å        max./Å        min./Å
   1 H    6 C          11     1.0866445     1.0994678     1.0687827
   6 C    6 C           6     1.4104102     1.5205883     1.3383111
   1 H    7 N           1     1.0155720     1.0155720     1.0155720
   6 C    7 N           1     1.4429158     1.4429158     1.4429158
   6 C    8 O           2     1.3858115     1.4100311     1.3615919
   6 C   16 S           2     1.7359447     1.7591166     1.7127728


optimized geometry written to: xtbopt.xyz


           -------------------------------------------------
          | TOTAL ENERGY              -38.752602085682 Eh   |
          | GRADIENT NORM               0.000673646408 Eh/α |
          | HOMO-LUMO GAP               1.950564257279 eV   |
           -------------------------------------------------

------------------------------------------------------------------------
 * finished run on 2021/05/19 at 10:58:37.837     
------------------------------------------------------------------------
 total:
 * wall-time:     0 d,  0 h,  0 min,  0.714 sec
 *  cpu-time:     0 d,  0 h,  0 min,  0.713 sec
 * ratio c/w:     0.999 speedup
 SCF:
 * wall-time:     0 d,  0 h,  0 min,  0.046 sec
 *  cpu-time:     0 d,  0 h,  0 min,  0.046 sec
 * ratio c/w:     1.000 speedup
 ANC optimizer:
 * wall-time:     0 d,  0 h,  0 min,  0.643 sec
 *  cpu-time:     0 d,  0 h,  0 min,  0.643 sec
 * ratio c/w:     1.000 speedup

