      -----------------------------------------------------------      
     |                   =====================                   |     
     |                           x T B                           |     
     |                   =====================                   |     
     |                         S. Grimme                         |     
     |          Mulliken Center for Theoretical Chemistry        |     
     |                    University of Bonn                     |     
     |                Version 6.2 RC2 (SAW190805)                |     
      -----------------------------------------------------------      

   This program is distributed in the hope that it will be useful,
   but WITHOUT ANY WARRANTY; without even the implied warranty of
   MERCHANTABILITY or FITNESS FOR A PARTICULAR PURPOSE.
   
   FOR NON-COMMERCIAL, ACADEMIA USE ONLY.
   
   Cite this work as:
   * S. Grimme, C. Bannwarth, P. Shushkov, J. Chem. Theory Comput., 2017,
     13, 1989-2009. DOI: 10.1021/acs.jctc.7b00118
   * C. Bannwarth, S. Ehlert and S. Grimme., J. Chem. Theory Comput., 2019,
     15, 1652-1671. DOI: 10.1021/acs.jctc.8b01176
   * P. Pracht, E. Caldeweyher, S. Ehlert, S. Grimme, ChemRxiv, 2019, preprint.
     DOI: 10.26434/chemrxiv.8326202.v1
   
   for DFT-D4:
   * E. Caldeweyher, C. Bannwarth and S. Grimme, J. Chem. Phys., 2017,
     147, 034112. DOI: 10.1063/1.4993215
   * E. Caldeweyher, S. Ehlert, A. Hansen, H. Neugebauer, S. Spicher,
     C. Bannwarth and S. Grimme, J. Chem. Phys., 2019, 150, 154122.
     DOI: 10.1063/1.5090222
   
   for sTDA-xTB:
   * S. Grimme and C. Bannwarth, J. Chem. Phys., 2016, 145, 054103.
     DOI: 10.1063/1.4959605
   
   in the mass-spec context:
   * V. Asgeirsson, C. Bauer and S. Grimme, Chem. Sci., 2017, 8, 4879.
     DOI: 10.1039/c7sc00601b
   
   for metadynamics refer to:
   * S. Grimme, J. Chem. Theory Comput., 2019, 155, 2847-2862
     DOI: 10.1021/acs.jctc.9b00143
   
   with help from (in alphabetical order)
   C. Bannwarth, F. Bohle, G. Brandenburg, E. Caldeweyher, M. Checinski,
   S. Dohm, S. Ehlert, S. Ehrlich, F. März, H. Neugebauer, J. Pisarek,
   P. Pracht, P. Shushkov, and S. Spicher.
   
 * started run on 2021/05/19 at 10:58:37.855     

           -------------------------------------------------
          |                Calculation Setup                |
           -------------------------------------------------

          program call               : /ihome/ghutchison/geoffh/xtb/xtb 109.xyz -opt
          hostname                   : smp-n83
          coordinate file            : 109.xyz
          omp threads                :                     1
          number of atoms            :                    22
          number of electrons        :                    80
          charge                     :                     0
          spin                       :                   0.0
          first test random number   :      0.94648877040089


########################################################################
# WARNING! Please study the warnings concerning your input carefully
#  - the use of '-opt' is discouraged, please use '--opt' next time
########################################################################

           ------------------------------------------------- 
          |                 G F N 2 - x T B                 |
          | Geometry, Frequencies, Noncovalent interactions |
          |            JCTC 2019 parametrisation            |
           ------------------------------------------------- 
             KAB for C  - Si     :                1.0500
             KAB for H  - Pd     :                0.9500
             k(s)              :                1.8500
             k(p)              :                2.2300
             k(d)              :                2.2300
             k(f)              :                2.0000
             kEN (H0ij)        :               -2.0000
             D4 a1             :                0.5200
             D4 a2             :                5.0000
             D4 s6             :                1.0000
             D4 s8             :                2.7000
             D4 s9             :                5.0000
             alphaj            :                2.0000

  Z AO/shell   Hii/eV     exponent
  1     Wed Apr 25 08:07:45 CEST 2018   EN: 2.200 GM2: 0.406  GM3: 0.0800  RAES: 1.40
     1s    -10.707211    1.230000
  6     Wed Apr 25 08:07:45 CEST 2018   EN: 2.550 GM2: 0.538  GM3: 0.1500  RAES: 3.00
     2s    -13.970922    2.096432
     2p    -10.063292    1.800000
  7     Wed Apr 25 08:07:45 CEST 2018   EN: 3.040 GM2: 0.461  GM3:-0.0640  RAES: 1.90
     2s    -16.686243    2.339881
     2p    -12.523956    2.014332
  8     Wed Apr 25 08:07:45 CEST 2018   EN: 3.440 GM2: 0.452  GM3:-0.0517  RAES: 1.80
     2s    -20.229985    2.439742
     2p    -15.503117    2.137023

           ------------------------------------------------- 
          |        Self-Consistent Charge Iterations        |
           ------------------------------------------------- 

          ...................................................
          :                      SETUP                      :
          :.................................................:
          :  # basis functions                  70          :
          :  # atomic orbitals                  70          :
          :  # shells                           38          :
          :  # electrons                        80          :
          :  max. iterations                   250          :
          :  Hamiltonian                  GFN2-xTB          :
          :  restarted?                      false          :
          :  GBSA solvation                  false          :
          :  PC potential                    false          :
          :  electronic temp.          300.0000000     K    :
          :  accuracy                    1.0000000          :
          :  -> integral cutoff          0.2500000E+02      :
          :  -> integral neglect         0.1000000E-07      :
          :  -> SCF convergence          0.1000000E-05 Eh   :
          :  -> wf. convergence          0.1000000E-03 e    :
          :  Broyden damping             0.4000000          :
          ...................................................

 iter      E             dE          RMSdq      gap      omega  full diag
   1    -46.5856632 -0.465857E+02  0.661E+00    1.62       0.0  T
   2    -46.8367537 -0.251090E+00  0.313E+00    1.39       1.0  T
   3    -46.8368442 -0.905550E-04  0.169E+00    1.44       1.0  T
   4    -46.8220324  0.148118E-01  0.115E+00    1.38       1.0  T
   5    -46.8414738 -0.194414E-01  0.117E-01    1.35       1.0  T
   6    -46.8415828 -0.108993E-03  0.650E-02    1.37       1.0  T
   7    -46.8415965 -0.136802E-04  0.385E-02    1.37       1.0  T
   8    -46.8416144 -0.179646E-04  0.140E-02    1.37       1.5  T
   9    -46.8416150 -0.574136E-06  0.697E-03    1.37       3.1  T
  10    -46.8416153 -0.301954E-06  0.341E-03    1.37       6.2  T
  11    -46.8416155 -0.171173E-06  0.152E-03    1.37      14.0  T
  12    -46.8416155 -0.272773E-07  0.555E-04    1.37      38.4  T
  13    -46.8416155 -0.508933E-09  0.314E-04    1.37      67.9  T

   *** convergence criteria satisfied after 13 iterations ***

         #    Occupation            Energy/Eh            Energy/eV
      -------------------------------------------------------------
         1        2.0000           -0.7799360             -21.2231
       ...           ...                  ...                  ...
        34        2.0000           -0.4742407             -12.9047
        35        2.0000           -0.4664146             -12.6918
        36        2.0000           -0.4657109             -12.6726
        37        2.0000           -0.4576117             -12.4522
        38        2.0000           -0.4544933             -12.3674
        39        2.0000           -0.4466120             -12.1529
        40        2.0000           -0.4443770             -12.0921 (HOMO)
        41                         -0.3939887             -10.7210 (LUMO)
        42                         -0.3384364              -9.2093
        43                         -0.3262480              -8.8777
        44                         -0.2615264              -7.1165
        45                         -0.1995865              -5.4310
       ...                                ...                  ...
        70                          0.7140431              19.4301
      -------------------------------------------------------------
                  HL-Gap            0.0503883 Eh            1.3711 eV
             Fermi-level           -0.4191394 Eh          -11.4054 eV

 SCC (total)                   0 d,  0 h,  0 min,  0.039 sec
 SCC setup                      ...        0 min,  0.000 sec (  0.803%)
 Dispersion                     ...        0 min,  0.000 sec (  0.921%)
 integral evaluation            ...        0 min,  0.010 sec ( 25.493%)
 zeroth order Hamiltonian       ...        0 min,  0.000 sec (  0.403%)
 iterations                     ...        0 min,  0.015 sec ( 38.904%)
 molecular gradient             ...        0 min,  0.013 sec ( 32.333%)
 printout                       ...        0 min,  0.000 sec (  1.006%)

         :::::::::::::::::::::::::::::::::::::::::::::::::::::
         ::                     SUMMARY                     ::
         :::::::::::::::::::::::::::::::::::::::::::::::::::::
         :: total energy             -46.295872133724 Eh    ::
         :: gradient norm              0.092291426225 Eh/a0 ::
         :: HOMO-LUMO gap              1.371134847959 eV    ::
         ::.................................................::
         :: SCC energy               -46.841615497710 Eh    ::
         :: -> isotropic ES            0.100494104976 Eh    ::
         :: -> anisotropic ES          0.011493915304 Eh    ::
         :: -> anisotropic XC          0.007386916772 Eh    ::
         :: -> dispersion             -0.021829204990 Eh    ::
         :: repulsion energy           0.545872332115 Eh    ::
         :: add. restraining           0.000000000000 Eh    ::
         :::::::::::::::::::::::::::::::::::::::::::::::::::::

      ----------------------------------------------------------- 
     |                   =====================                   |
     |                        A N C O P T                        |
     |                   =====================                   |
     |               Approximate Normal Coordinate               |
     |                Rational Function Optimizer                |
      ----------------------------------------------------------- 

          ...................................................
          :                      SETUP                      :
          :.................................................:
          :   optimization level            normal          :
          :   max. optcycles                   200          :
          :   ANC micro-cycles                  20          :
          :   degrees of freedom                60          :
          :.................................................:
          :   RF solver                   davidson          :
          :   input Hessian                  false          :
          :   write xtbopt.log                true          :
          :   linear?                        false          :
          :   energy convergence         0.5000000E-05 Eh   :
          :   grad. convergence          0.1000000E-02 Eh/α :
          :   maximium RF displ.         2.0000000          :
          :   Hlow (freq-cutoff)         0.5000000E-02      :
          :   Hmax (freq-cutoff)         5.0000000          :
          :   S6 in model hess.         20.0000000          :
          ...................................................

generating ANC from model Hessian ...
Using Lindh-Hessian (1995)
 Shifting diagonal of input Hessian by   4.045041015060724E-003
 Lowest  eigenvalues of input Hessian
   -0.000000   -0.000000   -0.000000    0.000000    0.000000    0.000000
    0.005000    0.006363    0.007717    0.009670    0.014609    0.014932
    0.019749    0.020636    0.022089    0.028555    0.032482    0.033240
 Highest eigenvalues
    1.877848    2.100291    2.116845    2.130978    2.486595    2.487362
 

........................................................................
.............................. CYCLE    1 ..............................
........................................................................
   1    -46.8416155 -0.468416E+02  0.909E-05    1.37       0.0  T
   2    -46.8416155  0.640910E-11  0.885E-05    1.37     241.0  T
   3    -46.8416155 -0.152589E-09  0.229E-05    1.37     932.8  T
     SCC iter.                  ...        0 min,  0.004 sec
     gradient                   ...        0 min,  0.012 sec
 * total energy  :   -46.2958721 Eh     change        0.2308319E-07 Eh
   gradient norm :     0.0922926 Eh/α   predicted     0.0000000E+00 (-100.00%)
   displ. norm   :     0.1888547 α      lambda       -0.8780858E-02
   maximum displ.:     0.1272884 α      in ANC's #9, #25, #13, ...

........................................................................
.............................. CYCLE    2 ..............................
........................................................................
   1    -46.8549716 -0.468550E+02  0.215E-01    1.33       0.0  T
   2    -46.8553680 -0.396393E-03  0.898E-02    1.32       1.0  T
   3    -46.8553706 -0.266150E-05  0.528E-02    1.32       1.0  T
   4    -46.8553420  0.286673E-04  0.435E-02    1.32       1.0  T
   5    -46.8553762 -0.342511E-04  0.767E-03    1.32       2.8  T
   6    -46.8553766 -0.341364E-06  0.547E-03    1.32       3.9  T
   7    -46.8553768 -0.291154E-06  0.193E-03    1.32      11.0  T
     SCC iter.                  ...        0 min,  0.008 sec
     gradient                   ...        0 min,  0.012 sec
 * total energy  :   -46.3016457 Eh     change       -0.5773631E-02 Eh
   gradient norm :     0.0314662 Eh/α   predicted    -0.4547019E-02 ( -21.25%)
   displ. norm   :     0.1206415 α      lambda       -0.1472125E-02
   maximum displ.:     0.1054067 α      in ANC's #9, #21, #48, ...

........................................................................
.............................. CYCLE    3 ..............................
........................................................................
   1    -46.8601724 -0.468602E+02  0.118E-01    1.32       0.0  T
   2    -46.8602450 -0.725945E-04  0.585E-02    1.31       1.0  T
   3    -46.8602443  0.711271E-06  0.332E-02    1.31       1.0  T
   4    -46.8602356  0.869581E-05  0.238E-02    1.31       1.0  T
   5    -46.8602475 -0.118830E-04  0.331E-03    1.31       6.4  T
   6    -46.8602476 -0.496203E-07  0.242E-03    1.31       8.8  T
   7    -46.8602476 -0.492227E-07  0.132E-03    1.31      16.2  T
     SCC iter.                  ...        0 min,  0.008 sec
     gradient                   ...        0 min,  0.012 sec
 * total energy  :   -46.3024496 Eh     change       -0.8038362E-03 Eh
   gradient norm :     0.0090601 Eh/α   predicted    -0.7467766E-03 (  -7.10%)
   displ. norm   :     0.0632619 α      lambda       -0.1486399E-03
   maximum displ.:     0.0571982 α      in ANC's #9, #13, #21, ...

........................................................................
.............................. CYCLE    4 ..............................
........................................................................
   1    -46.8597733 -0.468598E+02  0.637E-02    1.32       0.0  T
   2    -46.8597735 -0.176178E-06  0.389E-02    1.32       1.0  T
   3    -46.8597600  0.135177E-04  0.277E-02    1.32       1.0  T
   4    -46.8597754 -0.153964E-04  0.203E-03    1.32      10.5  T
   5    -46.8597754 -0.360308E-07  0.980E-04    1.32      21.8  T
   6    -46.8597754 -0.402316E-09  0.525E-04    1.32      40.6  T
     SCC iter.                  ...        0 min,  0.007 sec
     gradient                   ...        0 min,  0.012 sec
 * total energy  :   -46.3025548 Eh     change       -0.1052103E-03 Eh
   gradient norm :     0.0047737 Eh/α   predicted    -0.7462041E-04 ( -29.08%)
   displ. norm   :     0.0853662 α      lambda       -0.1200067E-03
   maximum displ.:     0.0723647 α      in ANC's #9, #13, #14, ...

........................................................................
.............................. CYCLE    5 ..............................
........................................................................
   1    -46.8588802 -0.468589E+02  0.965E-02    1.33       0.0  T
   2    -46.8588821 -0.193885E-05  0.588E-02    1.33       1.0  T
   3    -46.8588559  0.262420E-04  0.383E-02    1.33       1.0  T
   4    -46.8588857 -0.298534E-04  0.463E-03    1.33       4.6  T
   5    -46.8588860 -0.274963E-06  0.185E-03    1.33      11.5  T
   6    -46.8588860 -0.165795E-07  0.101E-03    1.33      21.1  T
     SCC iter.                  ...        0 min,  0.007 sec
     gradient                   ...        0 min,  0.012 sec
 * total energy  :   -46.3025622 Eh     change       -0.7449897E-05 Eh
   gradient norm :     0.0046350 Eh/α   predicted    -0.6044204E-04 ( 711.31%)
   displ. norm   :     0.0234808 α      lambda       -0.7532071E-04
   maximum displ.:     0.0112705 α      in ANC's #9, #15, #16, ...

........................................................................
.............................. CYCLE    6 ..............................
........................................................................
   1    -46.8592422 -0.468592E+02  0.422E-02    1.33       0.0  T
   2    -46.8592426 -0.360940E-06  0.252E-02    1.33       1.0  T
   3    -46.8592413  0.122177E-05  0.921E-03    1.33       2.3  T
   4    -46.8592429 -0.153271E-05  0.170E-03    1.33      12.5  T
   5    -46.8592429 -0.742642E-08  0.125E-03    1.33      17.1  T
     SCC iter.                  ...        0 min,  0.006 sec
     gradient                   ...        0 min,  0.012 sec
 * total energy  :   -46.3025956 Eh     change       -0.3332829E-04 Eh
   gradient norm :     0.0012714 Eh/α   predicted    -0.3768537E-04 (  13.07%)
   displ. norm   :     0.0133364 α      lambda       -0.3691721E-05
   maximum displ.:     0.0107265 α      in ANC's #9, #13, #6, ...

........................................................................
.............................. CYCLE    7 ..............................
........................................................................
   1    -46.8595532 -0.468596E+02  0.165E-02    1.33       0.0  T
   2    -46.8595533 -0.800900E-07  0.100E-02    1.33       2.1  T
   3    -46.8595524  0.930349E-06  0.768E-03    1.33       2.8  T
   4    -46.8595534 -0.107848E-05  0.111E-03    1.33      19.1  T
   5    -46.8595534  0.190607E-08  0.103E-03    1.33      20.6  T
   6    -46.8595535 -0.224158E-07  0.223E-04    1.33      95.6  T
   7    -46.8595535  0.981757E-10  0.117E-04    1.33     182.7  T
     SCC iter.                  ...        0 min,  0.008 sec
     gradient                   ...        0 min,  0.013 sec
 * total energy  :   -46.3025967 Eh     change       -0.1112927E-05 Eh
   gradient norm :     0.0007087 Eh/α   predicted    -0.1848260E-05 (  66.07%)
   displ. norm   :     0.0091304 α      lambda       -0.1265316E-05
   maximum displ.:     0.0071984 α      in ANC's #9, #13, #2, ...

   *** GEOMETRY OPTIMIZATION CONVERGED AFTER 7 ITERATIONS ***

------------------------------------------------------------------------
 total energy gain   :        -0.0067245 Eh       -4.2197 kcal/mol
 total RMSD          :         0.0836877 a0        0.0443 Å
 total power (kW/mol):        -2.5221845 (step)  -84.2923 (real)
------------------------------------------------------------------------

 ANCopt (total)                0 d,  0 h,  0 min,  0.209 sec
 optimizer setup                ...        0 min,  0.000 sec (  0.076%)
 model hessian                  ...        0 min,  0.003 sec (  1.393%)
 ANC generation                 ...        0 min,  0.001 sec (  0.302%)
 coordinate transformation      ...        0 min,  0.000 sec (  0.057%)
 single point calculation       ...        0 min,  0.203 sec ( 97.053%)
 optimization log               ...        0 min,  0.001 sec (  0.330%)
 hessian update                 ...        0 min,  0.000 sec (  0.045%)
 rational function              ...        0 min,  0.001 sec (  0.502%)

================
 final structure:
================
$coord
    2.28622435020428    0.54489114165953   -0.01253063668354      C 
    1.49952727380963   -1.88797141321239   -0.00629802025628      C 
    3.07809309799397   -4.06528738889556    0.00054600994391      N 
    5.34460055136258   -3.71772226856060   -0.00151850908227      O 
    2.04912548383909   -6.11282966503918    0.00927205563478      O 
   -1.26589933932288   -1.98479186998743   -0.00823094286672      C 
   -2.13038065974751    0.40335987107019   -0.01728275562180      C 
    0.02584903341670    2.12067508840158   -0.02079378177950      C 
   -0.02819332847994    4.69218425609017   -0.02726846524468      C 
    2.12782790113436    6.40973779494178   -0.02084862016665      C 
    1.26308205739313    8.79781416666116   -0.02868221836266      C 
   -1.50231350479669    8.70068451473315   -0.04114464122121      C 
   -3.08124860030110   10.87771889045148   -0.05456940018134      N 
   -5.34768055857024   10.52968646395415   -0.06088870975241      O 
   -2.05267996721059   12.92547483108481   -0.05514363811362      O 
   -2.28875734021002    6.26773498225388   -0.03917941220174      C 
    4.20237209948957    1.20171667968769   -0.01358157201950      H 
   -2.31897429477301   -3.71739467667050   -0.00283776239332      H 
   -4.06548987881690    1.00092693340623   -0.02028685655495      H 
    4.06300504028246    5.81245307228121   -0.01028437096518      H 
    2.31594602224064   10.53055291570740   -0.02652997578480      H 
   -4.20481907465158    5.61071852799515   -0.04728718694706      H 
$end
           -------------------------------------------------
          |                Final Singlepoint                |
           -------------------------------------------------

          ...................................................
          :                      SETUP                      :
          :.................................................:
          :  # basis functions                  70          :
          :  # atomic orbitals                  70          :
          :  # shells                           38          :
          :  # electrons                        80          :
          :  max. iterations                   250          :
          :  Hamiltonian                  GFN2-xTB          :
          :  restarted?                      false          :
          :  GBSA solvation                  false          :
          :  PC potential                    false          :
          :  electronic temp.          300.0000000     K    :
          :  accuracy                    1.0000000          :
          :  -> integral cutoff          0.2500000E+02      :
          :  -> integral neglect         0.1000000E-07      :
          :  -> SCF convergence          0.1000000E-05 Eh   :
          :  -> wf. convergence          0.1000000E-03 e    :
          :  Broyden damping             0.4000000          :
          ...................................................

 iter      E             dE          RMSdq      gap      omega  full diag
   1    -46.8595535 -0.468596E+02  0.665E-05    1.33       0.0  T
   2    -46.8595535 -0.596856E-12  0.334E-05    1.33     637.7  T
   3    -46.8595535 -0.860467E-11  0.343E-05    1.33     621.9  T

   *** convergence criteria satisfied after 3 iterations ***

         #    Occupation            Energy/Eh            Energy/eV
      -------------------------------------------------------------
         1        2.0000           -0.7877903             -21.4369
       ...           ...                  ...                  ...
        34        2.0000           -0.4706331             -12.8066
        35        2.0000           -0.4662286             -12.6867
        36        2.0000           -0.4654341             -12.6651
        37        2.0000           -0.4556480             -12.3988
        38        2.0000           -0.4528346             -12.3223
        39        2.0000           -0.4449519             -12.1078
        40        2.0000           -0.4428328             -12.0501 (HOMO)
        41                         -0.3940059             -10.7214 (LUMO)
        42                         -0.3301804              -8.9847
        43                         -0.3173740              -8.6362
        44                         -0.2567973              -6.9878
        45                         -0.1986163              -5.4046
       ...                                ...                  ...
        70                          0.6967036              18.9583
      -------------------------------------------------------------
                  HL-Gap            0.0488269 Eh            1.3286 eV
             Fermi-level           -0.4183712 Eh          -11.3845 eV

 SCC (total)                   0 d,  0 h,  0 min,  0.027 sec
 SCC setup                      ...        0 min,  0.000 sec (  0.753%)
 Dispersion                     ...        0 min,  0.000 sec (  0.749%)
 integral evaluation            ...        0 min,  0.010 sec ( 35.753%)
 zeroth order Hamiltonian       ...        0 min,  0.000 sec (  0.502%)
 iterations                     ...        0 min,  0.004 sec ( 14.784%)
 molecular gradient             ...        0 min,  0.012 sec ( 45.953%)
 printout                       ...        0 min,  0.000 sec (  1.321%)

         :::::::::::::::::::::::::::::::::::::::::::::::::::::
         ::                     SUMMARY                     ::
         :::::::::::::::::::::::::::::::::::::::::::::::::::::
         :: total energy             -46.302596673076 Eh    ::
         :: gradient norm              0.000708063772 Eh/a0 ::
         :: HOMO-LUMO gap              1.328646815843 eV    ::
         ::.................................................::
         :: SCC energy               -46.859553455091 Eh    ::
         :: -> isotropic ES            0.100854089738 Eh    ::
         :: -> anisotropic ES          0.014928413595 Eh    ::
         :: -> anisotropic XC          0.004428368859 Eh    ::
         :: -> dispersion             -0.021837993873 Eh    ::
         :: repulsion energy           0.557093781697 Eh    ::
         :: add. restraining           0.000000000000 Eh    ::
         :::::::::::::::::::::::::::::::::::::::::::::::::::::

           -------------------------------------------------
          |                Property Printout                |
           -------------------------------------------------

    * Orbital Energies and Occupations

         #    Occupation            Energy/Eh            Energy/eV
      -------------------------------------------------------------
         1        2.0000           -0.7877903             -21.4369
       ...           ...                  ...                  ...
        28        2.0000           -0.5161740             -14.0458
        29        2.0000           -0.5085917             -13.8395
        30        2.0000           -0.5058239             -13.7642
        31        2.0000           -0.4897173             -13.3259
        32        2.0000           -0.4843770             -13.1806
        33        2.0000           -0.4843758             -13.1805
        34        2.0000           -0.4706331             -12.8066
        35        2.0000           -0.4662286             -12.6867
        36        2.0000           -0.4654341             -12.6651
        37        2.0000           -0.4556480             -12.3988
        38        2.0000           -0.4528346             -12.3223
        39        2.0000           -0.4449519             -12.1078
        40        2.0000           -0.4428328             -12.0501 (HOMO)
        41                         -0.3940059             -10.7214 (LUMO)
        42                         -0.3301804              -8.9847
        43                         -0.3173740              -8.6362
        44                         -0.2567973              -6.9878
        45                         -0.1986163              -5.4046
        46                         -0.1972413              -5.3672
        47                         -0.1629905              -4.4352
        48                         -0.0334693              -0.9107
        49                         -0.0113285              -0.3083
        50                          0.0294481               0.8013
        51                          0.0437676               1.1910
       ...                                ...                  ...
        70                          0.6967036              18.9583
      -------------------------------------------------------------
                  HL-Gap            0.0488269 Eh            1.3286 eV
             Fermi-level           -0.4183712 Eh          -11.3845 eV

     #   Z        covCN         q      C6AA      α(0)
     1   6 C      2.977    -0.026    28.648     8.780
     2   6 C      3.038     0.013    27.681     8.630
     3   7 N      2.757     0.551    13.469     5.451
     4   8 O      0.932    -0.383    21.317     6.192
     5   8 O      0.931    -0.374    21.126     6.164
     6   6 C      3.006    -0.021    28.509     8.759
     7   6 C      2.998    -0.043    29.066     8.844
     8   6 C      3.095     0.046    26.846     8.492
     9   6 C      3.095     0.046    26.846     8.492
    10   6 C      2.998    -0.043    29.066     8.844
    11   6 C      3.006    -0.021    28.509     8.759
    12   6 C      3.038     0.013    27.681     8.630
    13   7 N      2.757     0.551    13.469     5.451
    14   8 O      0.932    -0.383    21.317     6.192
    15   8 O      0.931    -0.374    21.126     6.164
    16   6 C      2.977    -0.026    28.648     8.780
    17   1 H      0.926     0.087     1.909     2.160
    18   1 H      0.926     0.083     1.945     2.181
    19   1 H      0.926     0.066     2.126     2.280
    20   1 H      0.926     0.066     2.126     2.280
    21   1 H      0.926     0.083     1.945     2.181
    22   1 H      0.926     0.087     1.909     2.160

 Mol. C6AA /au·bohr⁶  :       7576.831677
 Mol. C8AA /au·bohr⁸  :     185670.341870
 Mol. α(0) /au        :        135.863522


Wiberg/Mayer (AO) data.
largest (>0.10) Wiberg bond orders for each atom
          total WBO             WBO to atom ...
     1  C   3.981        C    2 1.660    C    8 1.096    H   17 0.964
     2  C   3.925        C    1 1.660    C    6 1.068    N    3 0.990
     3  N   3.916        O    5 1.446    O    4 1.441    C    2 0.990
     4  O   1.928        N    3 1.441    O    5 0.370
     5  O   1.927        N    3 1.446    O    4 0.370
     6  C   3.938        C    7 1.768    C    2 1.068    H   18 0.967
     7  C   3.984        C    6 1.768    C    8 1.099    H   19 0.968
     8  C   3.971        C    9 1.549    C    7 1.099    C    1 1.096
     9  C   3.971        C    8 1.549    C   10 1.099    C   16 1.096
    10  C   3.984        C   11 1.768    C    9 1.099    H   20 0.968
    11  C   3.938        C   10 1.768    C   12 1.068    H   21 0.967
    12  C   3.925        C   16 1.660    C   11 1.068    N   13 0.990
    13  N   3.916        O   15 1.446    O   14 1.441    C   12 0.990
    14  O   1.928        N   13 1.441    O   15 0.370
    15  O   1.927        N   13 1.446    O   14 0.370
    16  C   3.981        C   12 1.660    C    9 1.096    H   22 0.964
    17  H   0.992        C    1 0.964
    18  H   0.992        C    6 0.967
    19  H   0.995        C    7 0.968
    20  H   0.995        C   10 0.968
    21  H   0.992        C   11 0.967
    22  H   0.992        C   16 0.964

molecular dipole:
                 x           y           z       tot (Debye)
 q only:        0.000       0.000       0.002
   full:        0.000       0.000       0.002       0.006
molecular quadrupole (traceless):
                xx          xy          yy          xz          yz          zz
 q only:        9.155      30.241     -31.990      -0.101       0.233      22.836
  q+dip:        9.526      30.961     -31.890      -0.093       0.237      22.364
   full:        7.645      31.082     -35.305      -0.112       0.260      27.660

           -------------------------------------------------
          |                Geometry Summary                 |
           -------------------------------------------------

      molecular mass/u    :      218.1684000
   center of mass at/Å    :       -0.0007638       1.8025491      -0.0128079
  moments of inertia/u·Å² :        0.2410710E+03   0.2491284E+04   0.2732352E+04
rotational constants/cm⁻¹ :        0.6992809E-01   0.6766645E-02   0.6169641E-02

 * 17 selected distances

     #   Z        #   Z                                     value/Å
     1   6 C      2   6 C                                 1.3530548
     2   6 C      3   7 N                                 1.4231447
     3   7 N      4   8 O                                 1.2134049
     3   7 N      5   8 O                                 1.2126452
     6   6 C      7   6 C                                 1.3440143
     8   6 C      9   6 C                                 1.3610890
    10   6 C     11   6 C                                 1.3440223
    12   6 C     13   7 N                                 1.4231519 (max)
    13   7 N     14   8 O                                 1.2134071
    13   7 N     15   8 O                                 1.2126427
    12   6 C     16   6 C                                 1.3530537
     1   6 C     17   1 H                                 1.0718999
     6   6 C     18   1 H                                 1.0729268
     7   6 C     19   1 H                                 1.0717300 (min)
    10   6 C     20   1 H                                 1.0717337
    11   6 C     21   1 H                                 1.0729271
    16   6 C     22   1 H                                 1.0718980

 * 4 distinct bonds (by element types)

   Z      Z             #   av. dist./Å        max./Å        min./Å
   1 H    6 C           6     1.0721859     1.0729271     1.0717300
   6 C    6 C           5     1.3510468     1.3610890     1.3440143
   6 C    7 N           2     1.4231483     1.4231519     1.4231447
   7 N    8 O           4     1.2130250     1.2134071     1.2126427


optimized geometry written to: xtbopt.xyz


           -------------------------------------------------
          | TOTAL ENERGY              -46.302596673076 Eh   |
          | GRADIENT NORM               0.000708063772 Eh/α |
          | HOMO-LUMO GAP               1.328646815843 eV   |
           -------------------------------------------------

------------------------------------------------------------------------
 * finished run on 2021/05/19 at 10:58:38.154     
------------------------------------------------------------------------
 total:
 * wall-time:     0 d,  0 h,  0 min,  0.299 sec
 *  cpu-time:     0 d,  0 h,  0 min,  0.298 sec
 * ratio c/w:     0.997 speedup
 SCF:
 * wall-time:     0 d,  0 h,  0 min,  0.039 sec
 *  cpu-time:     0 d,  0 h,  0 min,  0.039 sec
 * ratio c/w:     1.000 speedup
 ANC optimizer:
 * wall-time:     0 d,  0 h,  0 min,  0.237 sec
 *  cpu-time:     0 d,  0 h,  0 min,  0.237 sec
 * ratio c/w:     1.000 speedup

