      -----------------------------------------------------------      
     |                   =====================                   |     
     |                           x T B                           |     
     |                   =====================                   |     
     |                         S. Grimme                         |     
     |          Mulliken Center for Theoretical Chemistry        |     
     |                    University of Bonn                     |     
     |                Version 6.2 RC2 (SAW190805)                |     
      -----------------------------------------------------------      

   This program is distributed in the hope that it will be useful,
   but WITHOUT ANY WARRANTY; without even the implied warranty of
   MERCHANTABILITY or FITNESS FOR A PARTICULAR PURPOSE.
   
   FOR NON-COMMERCIAL, ACADEMIA USE ONLY.
   
   Cite this work as:
   * S. Grimme, C. Bannwarth, P. Shushkov, J. Chem. Theory Comput., 2017,
     13, 1989-2009. DOI: 10.1021/acs.jctc.7b00118
   * C. Bannwarth, S. Ehlert and S. Grimme., J. Chem. Theory Comput., 2019,
     15, 1652-1671. DOI: 10.1021/acs.jctc.8b01176
   * P. Pracht, E. Caldeweyher, S. Ehlert, S. Grimme, ChemRxiv, 2019, preprint.
     DOI: 10.26434/chemrxiv.8326202.v1
   
   for DFT-D4:
   * E. Caldeweyher, C. Bannwarth and S. Grimme, J. Chem. Phys., 2017,
     147, 034112. DOI: 10.1063/1.4993215
   * E. Caldeweyher, S. Ehlert, A. Hansen, H. Neugebauer, S. Spicher,
     C. Bannwarth and S. Grimme, J. Chem. Phys., 2019, 150, 154122.
     DOI: 10.1063/1.5090222
   
   for sTDA-xTB:
   * S. Grimme and C. Bannwarth, J. Chem. Phys., 2016, 145, 054103.
     DOI: 10.1063/1.4959605
   
   in the mass-spec context:
   * V. Asgeirsson, C. Bauer and S. Grimme, Chem. Sci., 2017, 8, 4879.
     DOI: 10.1039/c7sc00601b
   
   for metadynamics refer to:
   * S. Grimme, J. Chem. Theory Comput., 2019, 155, 2847-2862
     DOI: 10.1021/acs.jctc.9b00143
   
   with help from (in alphabetical order)
   C. Bannwarth, F. Bohle, G. Brandenburg, E. Caldeweyher, M. Checinski,
   S. Dohm, S. Ehlert, S. Ehrlich, F. März, H. Neugebauer, J. Pisarek,
   P. Pracht, P. Shushkov, and S. Spicher.
   
 * started run on 2021/05/19 at 10:58:39.628     

           -------------------------------------------------
          |                Calculation Setup                |
           -------------------------------------------------

          program call               : /ihome/ghutchison/geoffh/xtb/xtb 114.xyz -opt
          hostname                   : smp-n83
          coordinate file            : 114.xyz
          omp threads                :                     1
          number of atoms            :                    26
          number of electrons        :                    64
          charge                     :                     0
          spin                       :                   0.0
          first test random number   :      0.94492506902601


########################################################################
# WARNING! Please study the warnings concerning your input carefully
#  - the use of '-opt' is discouraged, please use '--opt' next time
########################################################################

           ------------------------------------------------- 
          |                 G F N 2 - x T B                 |
          | Geometry, Frequencies, Noncovalent interactions |
          |            JCTC 2019 parametrisation            |
           ------------------------------------------------- 
             KAB for C  - Si     :                1.0500
             KAB for H  - Pd     :                0.9500
             k(s)              :                1.8500
             k(p)              :                2.2300
             k(d)              :                2.2300
             k(f)              :                2.0000
             kEN (H0ij)        :               -2.0000
             D4 a1             :                0.5200
             D4 a2             :                5.0000
             D4 s6             :                1.0000
             D4 s8             :                2.7000
             D4 s9             :                5.0000
             alphaj            :                2.0000

  Z AO/shell   Hii/eV     exponent
  1     Wed Apr 25 08:07:45 CEST 2018   EN: 2.200 GM2: 0.406  GM3: 0.0800  RAES: 1.40
     1s    -10.707211    1.230000
  6     Wed Apr 25 08:07:45 CEST 2018   EN: 2.550 GM2: 0.538  GM3: 0.1500  RAES: 3.00
     2s    -13.970922    2.096432
     2p    -10.063292    1.800000
 16     Tue Apr 24 11:44:34 CEST 2018   EN: 2.580 GM2: 0.340  GM3:-0.0502  RAES: 3.10
     3s    -20.029654    1.981333
     3p    -11.377694    2.025643
     3d     -0.420282    1.702555

           ------------------------------------------------- 
          |        Self-Consistent Charge Iterations        |
           ------------------------------------------------- 

          ...................................................
          :                      SETUP                      :
          :.................................................:
          :  # basis functions                  68          :
          :  # atomic orbitals                  67          :
          :  # shells                           39          :
          :  # electrons                        64          :
          :  max. iterations                   250          :
          :  Hamiltonian                  GFN2-xTB          :
          :  restarted?                      false          :
          :  GBSA solvation                  false          :
          :  PC potential                    false          :
          :  electronic temp.          300.0000000     K    :
          :  accuracy                    1.0000000          :
          :  -> integral cutoff          0.2500000E+02      :
          :  -> integral neglect         0.1000000E-07      :
          :  -> SCF convergence          0.1000000E-05 Eh   :
          :  -> wf. convergence          0.1000000E-03 e    :
          :  Broyden damping             0.4000000          :
          ...................................................

 iter      E             dE          RMSdq      gap      omega  full diag
   1    -34.3879841 -0.343880E+02  0.356E+00    3.07       0.0  T
   2    -34.4277167 -0.397326E-01  0.199E+00    3.11       1.0  T
   3    -34.4265885  0.112827E-02  0.754E-01    3.09       1.0  T
   4    -34.4272307 -0.642178E-03  0.412E-01    3.09       1.0  T
   5    -34.4302679 -0.303720E-02  0.113E-01    3.09       1.0  T
   6    -34.4303311 -0.632849E-04  0.419E-02    3.09       1.0  T
   7    -34.4303516 -0.204307E-04  0.191E-02    3.09       1.0  T
   8    -34.4303537 -0.216939E-05  0.107E-02    3.09       1.8  T
   9    -34.4303546 -0.836373E-06  0.352E-03    3.09       5.6  T
  10    -34.4303546 -0.661296E-07  0.166E-03    3.09      11.8  T
  11    -34.4303547 -0.172292E-07  0.612E-04    3.09      32.1  T
  12    -34.4303547 -0.791040E-09  0.357E-04    3.09      55.0  T

   *** convergence criteria satisfied after 12 iterations ***

         #    Occupation            Energy/Eh            Energy/eV
      -------------------------------------------------------------
         1        2.0000           -0.7225728             -19.6622
       ...           ...                  ...                  ...
        26        2.0000           -0.4368800             -11.8881
        27        2.0000           -0.4304925             -11.7143
        28        2.0000           -0.4242953             -11.5457
        29        2.0000           -0.4174753             -11.3601
        30        2.0000           -0.4149649             -11.2918
        31        2.0000           -0.3789379             -10.3114
        32        2.0000           -0.3657570              -9.9528 (HOMO)
        33                         -0.2522738              -6.8647 (LUMO)
        34                         -0.1989752              -5.4144
        35                         -0.1885147              -5.1297
        36                         -0.1525913              -4.1522
        37                         -0.1024936              -2.7890
       ...                                ...                  ...
        67                          0.6710160              18.2593
      -------------------------------------------------------------
                  HL-Gap            0.1134832 Eh            3.0880 eV
             Fermi-level           -0.3090154 Eh           -8.4087 eV

 SCC (total)                   0 d,  0 h,  0 min,  0.038 sec
 SCC setup                      ...        0 min,  0.000 sec (  0.841%)
 Dispersion                     ...        0 min,  0.000 sec (  0.986%)
 integral evaluation            ...        0 min,  0.009 sec ( 22.909%)
 zeroth order Hamiltonian       ...        0 min,  0.000 sec (  0.471%)
 iterations                     ...        0 min,  0.015 sec ( 37.760%)
 molecular gradient             ...        0 min,  0.014 sec ( 35.875%)
 printout                       ...        0 min,  0.000 sec (  1.022%)

         :::::::::::::::::::::::::::::::::::::::::::::::::::::
         ::                     SUMMARY                     ::
         :::::::::::::::::::::::::::::::::::::::::::::::::::::
         :: total energy             -33.920468015290 Eh    ::
         :: gradient norm              0.049957290421 Eh/a0 ::
         :: HOMO-LUMO gap              3.088035194359 eV    ::
         ::.................................................::
         :: SCC energy               -34.430354661916 Eh    ::
         :: -> isotropic ES            0.003307502876 Eh    ::
         :: -> anisotropic ES          0.005721721792 Eh    ::
         :: -> anisotropic XC          0.019373415148 Eh    ::
         :: -> dispersion             -0.025743790195 Eh    ::
         :: repulsion energy           0.509668121782 Eh    ::
         :: add. restraining           0.000000000000 Eh    ::
         :::::::::::::::::::::::::::::::::::::::::::::::::::::

      ----------------------------------------------------------- 
     |                   =====================                   |
     |                        A N C O P T                        |
     |                   =====================                   |
     |               Approximate Normal Coordinate               |
     |                Rational Function Optimizer                |
      ----------------------------------------------------------- 

          ...................................................
          :                      SETUP                      :
          :.................................................:
          :   optimization level            normal          :
          :   max. optcycles                   200          :
          :   ANC micro-cycles                  20          :
          :   degrees of freedom                72          :
          :.................................................:
          :   RF solver                   davidson          :
          :   input Hessian                  false          :
          :   write xtbopt.log                true          :
          :   linear?                        false          :
          :   energy convergence         0.5000000E-05 Eh   :
          :   grad. convergence          0.1000000E-02 Eh/α :
          :   maximium RF displ.         2.0000000          :
          :   Hlow (freq-cutoff)         0.5000000E-02      :
          :   Hmax (freq-cutoff)         5.0000000          :
          :   S6 in model hess.         20.0000000          :
          ...................................................

generating ANC from model Hessian ...
Using Lindh-Hessian (1995)
 Shifting diagonal of input Hessian by   3.840724999322203E-003
 Lowest  eigenvalues of input Hessian
   -0.000000   -0.000000   -0.000000    0.000000    0.000000    0.000000
    0.005000    0.007042    0.007892    0.009138    0.010809    0.011350
    0.012317    0.014097    0.018529    0.022074    0.026165    0.029729
 Highest eigenvalues
    1.411987    1.526177    1.614378    1.770226    1.819076    1.973270
 

........................................................................
.............................. CYCLE    1 ..............................
........................................................................
   1    -34.4303547 -0.344304E+02  0.189E-04    3.09       0.0  T
   2    -34.4303547 -0.126477E-10  0.171E-04    3.09     114.8  T
   3    -34.4303547 -0.441574E-09  0.737E-05    3.09     266.2  T
     SCC iter.                  ...        0 min,  0.004 sec
     gradient                   ...        0 min,  0.014 sec
 * total energy  :   -33.9204681 Eh     change       -0.3779044E-07 Eh
   gradient norm :     0.0499580 Eh/α   predicted     0.0000000E+00 (-100.00%)
   displ. norm   :     0.2629163 α      lambda       -0.5041100E-02
   maximum displ.:     0.1071377 α      in ANC's #14, #9, #6, ...

........................................................................
.............................. CYCLE    2 ..............................
........................................................................
   1    -34.4523490 -0.344523E+02  0.205E-01    3.14       0.0  T
   2    -34.4523797 -0.306962E-04  0.108E-01    3.14       1.0  T
   3    -34.4523271  0.526520E-04  0.638E-02    3.14       1.0  T
   4    -34.4524207 -0.936337E-04  0.191E-02    3.14       1.0  T
   5    -34.4524219 -0.118138E-05  0.913E-03    3.14       2.1  T
   6    -34.4524230 -0.109200E-05  0.229E-03    3.14       8.6  T
   7    -34.4524231 -0.976119E-07  0.672E-04    3.14      29.2  T
     SCC iter.                  ...        0 min,  0.008 sec
     gradient                   ...        0 min,  0.013 sec
 * total energy  :   -33.9237849 Eh     change       -0.3316875E-02 Eh
   gradient norm :     0.0181898 Eh/α   predicted    -0.2694799E-02 ( -18.75%)
   displ. norm   :     0.2167757 α      lambda       -0.1153384E-02
   maximum displ.:     0.1040602 α      in ANC's #6, #3, #9, ...

........................................................................
.............................. CYCLE    3 ..............................
........................................................................
   1    -34.4604274 -0.344604E+02  0.163E-01    3.15       0.0  T
   2    -34.4604424 -0.149491E-04  0.848E-02    3.15       1.0  T
   3    -34.4604090  0.334384E-04  0.453E-02    3.15       1.0  T
   4    -34.4604559 -0.469176E-04  0.139E-02    3.15       1.4  T
   5    -34.4604566 -0.706147E-06  0.586E-03    3.15       3.3  T
   6    -34.4604570 -0.436865E-06  0.179E-03    3.15      11.0  T
   7    -34.4604571 -0.617829E-07  0.533E-04    3.15      36.8  T
     SCC iter.                  ...        0 min,  0.008 sec
     gradient                   ...        0 min,  0.013 sec
 * total energy  :   -33.9244729 Eh     change       -0.6879609E-03 Eh
   gradient norm :     0.0048533 Eh/α   predicted    -0.6037961E-03 ( -12.23%)
   displ. norm   :     0.1651298 α      lambda       -0.2758712E-03
   maximum displ.:     0.0952182 α      in ANC's #3, #6, #9, ...

........................................................................
.............................. CYCLE    4 ..............................
........................................................................
   1    -34.4600266 -0.344600E+02  0.972E-02    3.14       0.0  T
   2    -34.4600284 -0.182457E-05  0.548E-02    3.14       1.0  T
   3    -34.4600243  0.410812E-05  0.154E-02    3.14       1.3  T
   4    -34.4600289 -0.464265E-05  0.581E-03    3.14       3.4  T
   5    -34.4600292 -0.320118E-06  0.157E-03    3.14      12.5  T
   6    -34.4600293 -0.261477E-07  0.603E-04    3.14      32.5  T
     SCC iter.                  ...        0 min,  0.007 sec
     gradient                   ...        0 min,  0.013 sec
 * total energy  :   -33.9246731 Eh     change       -0.2001867E-03 Eh
   gradient norm :     0.0046784 Eh/α   predicted    -0.1416970E-03 ( -29.22%)
   displ. norm   :     0.2076568 α      lambda       -0.2263116E-03
   maximum displ.:     0.1320215 α      in ANC's #3, #1, #6, ...

........................................................................
.............................. CYCLE    5 ..............................
........................................................................
   1    -34.4579441 -0.344579E+02  0.126E-01    3.12       0.0  T
   2    -34.4579465 -0.239429E-05  0.702E-02    3.12       1.0  T
   3    -34.4579462  0.261086E-06  0.111E-02    3.12       1.8  T
   4    -34.4579465 -0.249039E-06  0.698E-03    3.12       2.8  T
   5    -34.4579471 -0.647734E-06  0.152E-03    3.12      12.9  T
   6    -34.4579472 -0.320903E-07  0.355E-04    3.12      55.2  T
     SCC iter.                  ...        0 min,  0.007 sec
     gradient                   ...        0 min,  0.013 sec
 * total energy  :   -33.9248162 Eh     change       -0.1431676E-03 Eh
   gradient norm :     0.0041365 Eh/α   predicted    -0.1180356E-03 ( -17.55%)
   displ. norm   :     0.1250790 α      lambda       -0.1028934E-03
   maximum displ.:     0.0858336 α      in ANC's #3, #1, #2, ...

........................................................................
.............................. CYCLE    6 ..............................
........................................................................
   1    -34.4575788 -0.344576E+02  0.768E-02    3.10       0.0  T
   2    -34.4575794 -0.643096E-06  0.444E-02    3.10       1.0  T
   3    -34.4575743  0.515779E-05  0.166E-02    3.10       1.2  T
   4    -34.4575801 -0.584619E-05  0.304E-03    3.10       6.4  T
   5    -34.4575801 -0.171308E-07  0.100E-03    3.10      19.5  T
   6    -34.4575801 -0.144975E-07  0.297E-04    3.10      66.1  T
     SCC iter.                  ...        0 min,  0.007 sec
     gradient                   ...        0 min,  0.013 sec
 * total energy  :   -33.9248817 Eh     change       -0.6548575E-04 Eh
   gradient norm :     0.0029972 Eh/α   predicted    -0.5225932E-04 ( -20.20%)
   displ. norm   :     0.0975097 α      lambda       -0.6566130E-04
   maximum displ.:     0.0690425 α      in ANC's #3, #1, #4, ...

........................................................................
.............................. CYCLE    7 ..............................
........................................................................
   1    -34.4582786 -0.344583E+02  0.561E-02    3.10       0.0  T
   2    -34.4582791 -0.473134E-06  0.320E-02    3.10       1.0  T
   3    -34.4582756  0.344474E-05  0.140E-02    3.10       1.4  T
   4    -34.4582796 -0.396110E-05  0.259E-03    3.10       7.6  T
   5    -34.4582796 -0.183977E-07  0.774E-04    3.10      25.3  T
   6    -34.4582796 -0.739617E-08  0.316E-04    3.10      62.1  T
     SCC iter.                  ...        0 min,  0.007 sec
     gradient                   ...        0 min,  0.014 sec
 * total energy  :   -33.9249293 Eh     change       -0.4761560E-04 Eh
   gradient norm :     0.0023090 Eh/α   predicted    -0.3314304E-04 ( -30.39%)
   displ. norm   :     0.1036882 α      lambda       -0.4738781E-04
   maximum displ.:     0.0673662 α      in ANC's #3, #4, #1, ...

........................................................................
.............................. CYCLE    8 ..............................
........................................................................
   1    -34.4589736 -0.344590E+02  0.599E-02    3.09       0.0  T
   2    -34.4589742 -0.585302E-06  0.340E-02    3.09       1.0  T
   3    -34.4589712  0.303183E-05  0.139E-02    3.09       1.4  T
   4    -34.4589746 -0.346662E-05  0.282E-03    3.09       7.0  T
   5    -34.4589747 -0.303610E-07  0.709E-04    3.09      27.7  T
   6    -34.4589747 -0.293824E-08  0.333E-04    3.09      58.8  T
     SCC iter.                  ...        0 min,  0.007 sec
     gradient                   ...        0 min,  0.014 sec
 * total energy  :   -33.9249632 Eh     change       -0.3388640E-04 Eh
   gradient norm :     0.0018012 Eh/α   predicted    -0.2394884E-04 ( -29.33%)
   displ. norm   :     0.1358859 α      lambda       -0.2588826E-04
   maximum displ.:     0.0813301 α      in ANC's #3, #4, #1, ...

........................................................................
.............................. CYCLE    9 ..............................
........................................................................
   1    -34.4591524 -0.344592E+02  0.770E-02    3.09       0.0  T
   2    -34.4591532 -0.798001E-06  0.437E-02    3.09       1.0  T
   3    -34.4591499  0.321864E-05  0.144E-02    3.09       1.4  T
   4    -34.4591536 -0.369107E-05  0.360E-03    3.09       5.4  T
   5    -34.4591537 -0.438112E-07  0.958E-04    3.09      20.5  T
   6    -34.4591537 -0.150179E-07  0.319E-04    3.09      61.4  T
     SCC iter.                  ...        0 min,  0.007 sec
     gradient                   ...        0 min,  0.014 sec
 * total energy  :   -33.9249843 Eh     change       -0.2109885E-04 Eh
   gradient norm :     0.0014892 Eh/α   predicted    -0.1305125E-04 ( -38.14%)
   displ. norm   :     0.0272571 α      lambda       -0.6804409E-05
   maximum displ.:     0.0195497 α      in ANC's #4, #9, #5, ...

........................................................................
.............................. CYCLE   10 ..............................
........................................................................
   1    -34.4593178 -0.344593E+02  0.140E-02    3.09       0.0  T
   2    -34.4593178 -0.293601E-07  0.839E-03    3.09       2.3  T
   3    -34.4593174  0.404533E-06  0.437E-03    3.09       4.5  T
   4    -34.4593178 -0.466030E-06  0.533E-04    3.09      36.8  T
   5    -34.4593178  0.342993E-09  0.326E-04    3.09      60.1  T
     SCC iter.                  ...        0 min,  0.006 sec
     gradient                   ...        0 min,  0.014 sec
 * total energy  :   -33.9249906 Eh     change       -0.6244456E-05 Eh
   gradient norm :     0.0007038 Eh/α   predicted    -0.3403775E-05 ( -45.49%)
   displ. norm   :     0.0543710 α      lambda       -0.6180622E-05
   maximum displ.:     0.0347888 α      in ANC's #4, #2, #5, ...

........................................................................
.............................. CYCLE   11 ..............................
........................................................................
   1    -34.4586725 -0.344587E+02  0.298E-02    3.08       0.0  T
   2    -34.4586726 -0.102821E-06  0.173E-02    3.08       1.1  T
   3    -34.4586722  0.375732E-06  0.413E-03    3.08       4.7  T
   4    -34.4586726 -0.424116E-06  0.108E-03    3.08      18.2  T
   5    -34.4586726 -0.106446E-07  0.336E-04    3.08      58.3  T
   6    -34.4586726 -0.715893E-09  0.174E-04    3.08     112.7  T
     SCC iter.                  ...        0 min,  0.007 sec
     gradient                   ...        0 min,  0.014 sec
 * total energy  :   -33.9249951 Eh     change       -0.4525471E-05 Eh
   gradient norm :     0.0010017 Eh/α   predicted    -0.3098626E-05 ( -31.53%)
   displ. norm   :     0.0306039 α      lambda       -0.3382568E-05
   maximum displ.:     0.0208397 α      in ANC's #2, #4, #3, ...

........................................................................
.............................. CYCLE   12 ..............................
........................................................................
   1    -34.4588064 -0.344588E+02  0.156E-02    3.08       0.0  T
   2    -34.4588064 -0.397544E-07  0.887E-03    3.08       2.2  T
   3    -34.4588063  0.112798E-06  0.273E-03    3.08       7.2  T
   4    -34.4588064 -0.132263E-06  0.800E-04    3.08      24.5  T
   5    -34.4588064 -0.193893E-08  0.235E-04    3.08      83.5  T
     SCC iter.                  ...        0 min,  0.006 sec
     gradient                   ...        0 min,  0.014 sec
 * total energy  :   -33.9249990 Eh     change       -0.3871516E-05 Eh
   gradient norm :     0.0006580 Eh/α   predicted    -0.1692971E-05 ( -56.27%)
   displ. norm   :     0.0796943 α      lambda       -0.6161347E-05
   maximum displ.:     0.0633318 α      in ANC's #2, #4, #3, ...

   *** GEOMETRY OPTIMIZATION CONVERGED AFTER 12 ITERATIONS ***

------------------------------------------------------------------------
 total energy gain   :        -0.0045310 Eh       -2.8432 kcal/mol
 total RMSD          :         0.2170282 a0        0.1148 Å
 total power (kW/mol):        -0.9913352 (step)  -32.0150 (real)
------------------------------------------------------------------------

 ANCopt (total)                0 d,  0 h,  0 min,  0.372 sec
 optimizer setup                ...        0 min,  0.000 sec (  0.043%)
 model hessian                  ...        0 min,  0.011 sec (  3.050%)
 ANC generation                 ...        0 min,  0.001 sec (  0.212%)
 coordinate transformation      ...        0 min,  0.000 sec (  0.062%)
 single point calculation       ...        0 min,  0.355 sec ( 95.491%)
 optimization log               ...        0 min,  0.001 sec (  0.359%)
 hessian update                 ...        0 min,  0.000 sec (  0.047%)
 rational function              ...        0 min,  0.002 sec (  0.508%)

================
 final structure:
================
$coord
    2.90195623557713   -2.42218545803273   -0.01608881994797      C 
    5.21200139423495   -0.15152436211122   -0.01796550957929      S 
    2.95474740849431    2.24950646161609    0.13087565695978      C 
    0.55286615149355    1.26031381323365    0.13944392762730      C 
    0.53306001529825   -1.42271002124052    0.05707583746346      C 
   -1.83625557627271   -2.98634238301676   -0.01182193377958      C 
   -2.11826830749179   -4.23505155700891   -2.61064295150081      C 
   -4.13608561499312   -1.35526831829174    0.64719136473042      C 
   -4.06662181061738    1.16973746375844   -0.73901274505863      C 
   -1.84452439128893    2.75685248083498    0.19227206576304      C 
    3.87202798868839    4.81298663686063    0.19964738951994      C 
    2.63109209234680    6.85636618897203    0.97679479527365      C 
    3.43024927880599   -4.37779199124691   -0.06179338340789      H 
   -1.67108266946218   -4.50016351613977    1.39460782458060      H 
   -2.21885891033668   -2.82001395293705   -4.09664548049433      H 
   -3.82717957113385   -5.37629560525452   -2.67270020028051      H 
   -0.50672457016773   -5.44994181623450   -2.99559944887329      H 
   -4.15785526440239   -0.99712404911108    2.68097767032394      H 
   -5.85958749621546   -2.38312746397921    0.16849062813702      H 
   -5.82675926033762    2.19765821310493   -0.41732317072750      H 
   -3.88803989236733    0.85039443323613   -2.76837054716261      H 
   -2.21747398725633    3.36700488889406    2.13517864025630      H 
   -1.63707582003822    4.45021264259441   -0.97078781375084      H 
    5.81424962204605    5.00947863510722   -0.42118898303568      H 
    0.73781334777395    6.79381664082876    1.70700072815294      H 
    3.52077927456392    8.68535952775316    0.93919351912432      H 
$end
           -------------------------------------------------
          |                Final Singlepoint                |
           -------------------------------------------------

          ...................................................
          :                      SETUP                      :
          :.................................................:
          :  # basis functions                  68          :
          :  # atomic orbitals                  67          :
          :  # shells                           39          :
          :  # electrons                        64          :
          :  max. iterations                   250          :
          :  Hamiltonian                  GFN2-xTB          :
          :  restarted?                      false          :
          :  GBSA solvation                  false          :
          :  PC potential                    false          :
          :  electronic temp.          300.0000000     K    :
          :  accuracy                    1.0000000          :
          :  -> integral cutoff          0.2500000E+02      :
          :  -> integral neglect         0.1000000E-07      :
          :  -> SCF convergence          0.1000000E-05 Eh   :
          :  -> wf. convergence          0.1000000E-03 e    :
          :  Broyden damping             0.4000000          :
          ...................................................

 iter      E             dE          RMSdq      gap      omega  full diag
   1    -34.4588064 -0.344588E+02  0.154E-04    3.08       0.0  T
   2    -34.4588064 -0.313207E-10  0.643E-05    3.08     304.9  T
   3    -34.4588064 -0.891092E-10  0.647E-05    3.08     302.9  T

   *** convergence criteria satisfied after 3 iterations ***

         #    Occupation            Energy/Eh            Energy/eV
      -------------------------------------------------------------
         1        2.0000           -0.7211064             -19.6223
       ...           ...                  ...                  ...
        26        2.0000           -0.4355251             -11.8512
        27        2.0000           -0.4328215             -11.7777
        28        2.0000           -0.4242355             -11.5440
        29        2.0000           -0.4202609             -11.4359
        30        2.0000           -0.4142540             -11.2724
        31        2.0000           -0.3805169             -10.3544
        32        2.0000           -0.3669121              -9.9842 (HOMO)
        33                         -0.2536965              -6.9034 (LUMO)
        34                         -0.1974457              -5.3728
        35                         -0.1888484              -5.1388
        36                         -0.1416839              -3.8554
        37                         -0.1064273              -2.8960
       ...                                ...                  ...
        67                          0.6876969              18.7132
      -------------------------------------------------------------
                  HL-Gap            0.1132156 Eh            3.0808 eV
             Fermi-level           -0.3103043 Eh           -8.4438 eV

 SCC (total)                   0 d,  0 h,  0 min,  0.027 sec
 SCC setup                      ...        0 min,  0.000 sec (  0.734%)
 Dispersion                     ...        0 min,  0.000 sec (  0.764%)
 integral evaluation            ...        0 min,  0.008 sec ( 30.763%)
 zeroth order Hamiltonian       ...        0 min,  0.000 sec (  0.646%)
 iterations                     ...        0 min,  0.004 sec ( 15.174%)
 molecular gradient             ...        0 min,  0.014 sec ( 50.436%)
 printout                       ...        0 min,  0.000 sec (  1.268%)

         :::::::::::::::::::::::::::::::::::::::::::::::::::::
         ::                     SUMMARY                     ::
         :::::::::::::::::::::::::::::::::::::::::::::::::::::
         :: total energy             -33.924998983562 Eh    ::
         :: gradient norm              0.000657061288 Eh/a0 ::
         :: HOMO-LUMO gap              3.080752563539 eV    ::
         ::.................................................::
         :: SCC energy               -34.458806437108 Eh    ::
         :: -> isotropic ES            0.003542686960 Eh    ::
         :: -> anisotropic ES          0.005149983398 Eh    ::
         :: -> anisotropic XC          0.018839909151 Eh    ::
         :: -> dispersion             -0.025941769500 Eh    ::
         :: repulsion energy           0.533596599285 Eh    ::
         :: add. restraining           0.000000000000 Eh    ::
         :::::::::::::::::::::::::::::::::::::::::::::::::::::

           -------------------------------------------------
          |                Property Printout                |
           -------------------------------------------------

    * Orbital Energies and Occupations

         #    Occupation            Energy/Eh            Energy/eV
      -------------------------------------------------------------
         1        2.0000           -0.7211064             -19.6223
       ...           ...                  ...                  ...
        20        2.0000           -0.4733286             -12.8799
        21        2.0000           -0.4645061             -12.6399
        22        2.0000           -0.4605872             -12.5332
        23        2.0000           -0.4556389             -12.3986
        24        2.0000           -0.4492502             -12.2247
        25        2.0000           -0.4413744             -12.0104
        26        2.0000           -0.4355251             -11.8512
        27        2.0000           -0.4328215             -11.7777
        28        2.0000           -0.4242355             -11.5440
        29        2.0000           -0.4202609             -11.4359
        30        2.0000           -0.4142540             -11.2724
        31        2.0000           -0.3805169             -10.3544
        32        2.0000           -0.3669121              -9.9842 (HOMO)
        33                         -0.2536965              -6.9034 (LUMO)
        34                         -0.1974457              -5.3728
        35                         -0.1888484              -5.1388
        36                         -0.1416839              -3.8554
        37                         -0.1064273              -2.8960
        38                          0.0043388               0.1181
        39                          0.0391117               1.0643
        40                          0.0411890               1.1208
        41                          0.0829273               2.2566
        42                          0.0901981               2.4544
        43                          0.1055835               2.8731
       ...                                ...                  ...
        67                          0.6876969              18.7132
      -------------------------------------------------------------
                  HL-Gap            0.1132156 Eh            3.0808 eV
             Fermi-level           -0.3103043 Eh           -8.4438 eV

     #   Z        covCN         q      C6AA      α(0)
     1   6 C      2.938    -0.030    28.737     8.792
     2  16 S      2.332    -0.062   143.635    20.171
     3   6 C      2.986     0.012    27.748     8.641
     4   6 C      3.152    -0.010    27.984     8.652
     5   6 C      3.162    -0.009    27.919     8.637
     6   6 C      3.855    -0.011    20.743     6.477
     7   6 C      3.756    -0.102    22.493     6.762
     8   6 C      3.809    -0.057    21.591     6.614
     9   6 C      3.806    -0.053    21.516     6.603
    10   6 C      3.807    -0.052    21.507     6.602
    11   6 C      2.936    -0.030    28.737     8.792
    12   6 C      2.838    -0.095    30.377     9.032
    13   1 H      0.926     0.036     2.499     2.472
    14   1 H      0.924     0.030     2.584     2.514
    15   1 H      0.925     0.038     2.478     2.462
    16   1 H      0.925     0.035     2.515     2.480
    17   1 H      0.925     0.035     2.516     2.481
    18   1 H      0.924     0.032     2.555     2.500
    19   1 H      0.924     0.031     2.568     2.506
    20   1 H      0.924     0.028     2.616     2.529
    21   1 H      0.924     0.036     2.504     2.474
    22   1 H      0.924     0.039     2.458     2.452
    23   1 H      0.924     0.040     2.444     2.445
    24   1 H      0.925     0.040     2.447     2.446
    25   1 H      0.926     0.040     2.444     2.445
    26   1 H      0.926     0.037     2.486     2.466

 Mol. C6AA /au·bohr⁶  :       7975.036787
 Mol. C8AA /au·bohr⁸  :     209326.409185
 Mol. α(0) /au        :        140.445959


Wiberg/Mayer (AO) data.
largest (>0.10) Wiberg bond orders for each atom
          total WBO             WBO to atom ...
     1  C   3.945        C    5 1.583    S    2 1.191    H   13 0.970    C    3 0.104
     2  S   2.601        C    1 1.191    C    3 1.122
     3  C   3.944        C    4 1.505    C   11 1.131    S    2 1.122    C    1 0.104
     4  C   3.985        C    3 1.505    C    5 1.244    C   10 1.012
     5  C   3.985        C    1 1.583    C    4 1.244    C    6 0.995
     6  C   3.996        C    5 0.995    C    8 0.995    C    7 0.994    H   14 0.961
     7  C   3.996        C    6 0.994    H   17 0.986    H   16 0.985    H   15 0.985
     8  C   3.998        C    9 1.010    C    6 0.995    H   18 0.978    H   19 0.976
     9  C   3.998        C    8 1.010    C   10 1.004    H   20 0.977    H   21 0.975
    10  C   3.999        C    4 1.012    C    9 1.004    H   23 0.965    H   22 0.957
    11  C   3.991        C   12 1.865    C    3 1.131    H   24 0.962
    12  C   3.991        C   11 1.865    H   26 0.978    H   25 0.973
    13  H   0.998        C    1 0.970
    14  H   0.999        C    6 0.961
    15  H   0.999        C    7 0.985
    16  H   0.998        C    7 0.985
    17  H   0.999        C    7 0.986
    18  H   0.999        C    8 0.978
    19  H   0.998        C    8 0.976
    20  H   0.998        C    9 0.977
    21  H   0.999        C    9 0.975
    22  H   0.998        C   10 0.957
    23  H   0.998        C   10 0.965
    24  H   0.998        C   11 0.962
    25  H   0.998        C   12 0.973
    26  H   0.998        C   12 0.978

molecular dipole:
                 x           y           z       tot (Debye)
 q only:       -0.510      -0.036      -0.042
   full:       -0.744      -0.085      -0.022       1.905
molecular quadrupole (traceless):
                xx          xy          yy          xz          yz          zz
 q only:       -1.207       0.072       1.992      -0.163       0.302      -0.785
  q+dip:       -2.942      -0.296       4.653      -1.102       0.418      -1.711
   full:       -3.711      -0.177       4.156      -0.536       0.313      -0.445

           -------------------------------------------------
          |                Geometry Summary                 |
           -------------------------------------------------

      molecular mass/u    :      178.2916000
   center of mass at/Å    :        0.4213625       0.2401700      -0.0546713
  moments of inertia/u·Å² :        0.3982001E+03   0.7154531E+03   0.1048696E+04
rotational constants/cm⁻¹ :        0.4233457E-01   0.2356218E-01   0.1607486E-01

 * 25 selected distances

     #   Z        #   Z                                     value/Å
     1   6 C      2  16 S                                 1.7140944
     2  16 S      3   6 C                                 1.7456673 (max)
     3   6 C      4   6 C                                 1.3745993
     1   6 C      5   6 C                                 1.3611251
     4   6 C      5   6 C                                 1.4205028
     6   6 C      7   6 C                                 1.5330327
     6   6 C      8   6 C                                 1.5322327
     8   6 C      9   6 C                                 1.5247324
     4   6 C     10   6 C                                 1.4957942
     9   6 C     10   6 C                                 1.5267422
    11   6 C     12   6 C                                 1.3302552
     1   6 C     13   1 H                                 1.0722311 (min)
     6   6 C     14   1 H                                 1.0969401
     7   6 C     15   1 H                                 1.0871539
     7   6 C     16   1 H                                 1.0879281
     7   6 C     17   1 H                                 1.0872272
     8   6 C     18   1 H                                 1.0928539
     8   6 C     19   1 H                                 1.0917105
     9   6 C     20   1 H                                 1.0919774
     9   6 C     21   1 H                                 1.0912046
    10   6 C     22   1 H                                 1.0955712
    10   6 C     23   1 H                                 1.0926212
    11   6 C     24   1 H                                 1.0840092
    12   6 C     25   1 H                                 1.0743234
    12   6 C     26   1 H                                 1.0764789

 * 3 distinct bonds (by element types)

   Z      Z             #   av. dist./Å        max./Å        min./Å
   1 H    6 C          14     1.0873022     1.0969401     1.0722311
   6 C    6 C           9     1.4554463     1.5330327     1.3302552
   6 C   16 S           2     1.7298809     1.7456673     1.7140944


optimized geometry written to: xtbopt.xyz


           -------------------------------------------------
          | TOTAL ENERGY              -33.924998983562 Eh   |
          | GRADIENT NORM               0.000657061288 Eh/α |
          | HOMO-LUMO GAP               3.080752563539 eV   |
           -------------------------------------------------

------------------------------------------------------------------------
 * finished run on 2021/05/19 at 10:58:40.088     
------------------------------------------------------------------------
 total:
 * wall-time:     0 d,  0 h,  0 min,  0.460 sec
 *  cpu-time:     0 d,  0 h,  0 min,  0.459 sec
 * ratio c/w:     0.998 speedup
 SCF:
 * wall-time:     0 d,  0 h,  0 min,  0.039 sec
 *  cpu-time:     0 d,  0 h,  0 min,  0.039 sec
 * ratio c/w:     1.000 speedup
 ANC optimizer:
 * wall-time:     0 d,  0 h,  0 min,  0.400 sec
 *  cpu-time:     0 d,  0 h,  0 min,  0.400 sec
 * ratio c/w:     1.000 speedup

