      -----------------------------------------------------------      
     |                   =====================                   |     
     |                           x T B                           |     
     |                   =====================                   |     
     |                         S. Grimme                         |     
     |          Mulliken Center for Theoretical Chemistry        |     
     |                    University of Bonn                     |     
     |                Version 6.2 RC2 (SAW190805)                |     
      -----------------------------------------------------------      

   This program is distributed in the hope that it will be useful,
   but WITHOUT ANY WARRANTY; without even the implied warranty of
   MERCHANTABILITY or FITNESS FOR A PARTICULAR PURPOSE.
   
   FOR NON-COMMERCIAL, ACADEMIA USE ONLY.
   
   Cite this work as:
   * S. Grimme, C. Bannwarth, P. Shushkov, J. Chem. Theory Comput., 2017,
     13, 1989-2009. DOI: 10.1021/acs.jctc.7b00118
   * C. Bannwarth, S. Ehlert and S. Grimme., J. Chem. Theory Comput., 2019,
     15, 1652-1671. DOI: 10.1021/acs.jctc.8b01176
   * P. Pracht, E. Caldeweyher, S. Ehlert, S. Grimme, ChemRxiv, 2019, preprint.
     DOI: 10.26434/chemrxiv.8326202.v1
   
   for DFT-D4:
   * E. Caldeweyher, C. Bannwarth and S. Grimme, J. Chem. Phys., 2017,
     147, 034112. DOI: 10.1063/1.4993215
   * E. Caldeweyher, S. Ehlert, A. Hansen, H. Neugebauer, S. Spicher,
     C. Bannwarth and S. Grimme, J. Chem. Phys., 2019, 150, 154122.
     DOI: 10.1063/1.5090222
   
   for sTDA-xTB:
   * S. Grimme and C. Bannwarth, J. Chem. Phys., 2016, 145, 054103.
     DOI: 10.1063/1.4959605
   
   in the mass-spec context:
   * V. Asgeirsson, C. Bauer and S. Grimme, Chem. Sci., 2017, 8, 4879.
     DOI: 10.1039/c7sc00601b
   
   for metadynamics refer to:
   * S. Grimme, J. Chem. Theory Comput., 2019, 155, 2847-2862
     DOI: 10.1021/acs.jctc.9b00143
   
   with help from (in alphabetical order)
   C. Bannwarth, F. Bohle, G. Brandenburg, E. Caldeweyher, M. Checinski,
   S. Dohm, S. Ehlert, S. Ehrlich, F. März, H. Neugebauer, J. Pisarek,
   P. Pracht, P. Shushkov, and S. Spicher.
   
 * started run on 2021/05/19 at 10:58:43.147     

           -------------------------------------------------
          |                Calculation Setup                |
           -------------------------------------------------

          program call               : /ihome/ghutchison/geoffh/xtb/xtb 117.xyz -opt
          hostname                   : smp-n83
          coordinate file            : 117.xyz
          omp threads                :                     1
          number of atoms            :                    20
          number of electrons        :                    60
          charge                     :                     0
          spin                       :                   0.0
          first test random number   :      0.49878900656340


########################################################################
# WARNING! Please study the warnings concerning your input carefully
#  - the use of '-opt' is discouraged, please use '--opt' next time
########################################################################

           ------------------------------------------------- 
          |                 G F N 2 - x T B                 |
          | Geometry, Frequencies, Noncovalent interactions |
          |            JCTC 2019 parametrisation            |
           ------------------------------------------------- 
             KAB for C  - Si     :                1.0500
             KAB for H  - Pd     :                0.9500
             k(s)              :                1.8500
             k(p)              :                2.2300
             k(d)              :                2.2300
             k(f)              :                2.0000
             kEN (H0ij)        :               -2.0000
             D4 a1             :                0.5200
             D4 a2             :                5.0000
             D4 s6             :                1.0000
             D4 s8             :                2.7000
             D4 s9             :                5.0000
             alphaj            :                2.0000

  Z AO/shell   Hii/eV     exponent
  1     Wed Apr 25 08:07:45 CEST 2018   EN: 2.200 GM2: 0.406  GM3: 0.0800  RAES: 1.40
     1s    -10.707211    1.230000
  6     Wed Apr 25 08:07:45 CEST 2018   EN: 2.550 GM2: 0.538  GM3: 0.1500  RAES: 3.00
     2s    -13.970922    2.096432
     2p    -10.063292    1.800000
 16     Tue Apr 24 11:44:34 CEST 2018   EN: 2.580 GM2: 0.340  GM3:-0.0502  RAES: 3.10
     3s    -20.029654    1.981333
     3p    -11.377694    2.025643
     3d     -0.420282    1.702555

           ------------------------------------------------- 
          |        Self-Consistent Charge Iterations        |
           ------------------------------------------------- 

          ...................................................
          :                      SETUP                      :
          :.................................................:
          :  # basis functions                  68          :
          :  # atomic orbitals                  66          :
          :  # shells                           34          :
          :  # electrons                        60          :
          :  max. iterations                   250          :
          :  Hamiltonian                  GFN2-xTB          :
          :  restarted?                      false          :
          :  GBSA solvation                  false          :
          :  PC potential                    false          :
          :  electronic temp.          300.0000000     K    :
          :  accuracy                    1.0000000          :
          :  -> integral cutoff          0.2500000E+02      :
          :  -> integral neglect         0.1000000E-07      :
          :  -> SCF convergence          0.1000000E-05 Eh   :
          :  -> wf. convergence          0.1000000E-03 e    :
          :  Broyden damping             0.4000000          :
          ...................................................

 iter      E             dE          RMSdq      gap      omega  full diag
   1    -32.3843248 -0.323843E+02  0.479E+00    1.91       0.0  T
   2    -32.4010240 -0.166992E-01  0.272E+00    1.91       1.0  T
   3    -32.3878394  0.131846E-01  0.115E+00    1.89       1.0  T
   4    -32.3994568 -0.116174E-01  0.578E-01    1.86       1.0  T
   5    -32.4032215 -0.376477E-02  0.282E-01    1.89       1.0  T
   6    -32.4042430 -0.102150E-02  0.106E-01    1.88       1.0  T
   7    -32.4043677 -0.124674E-03  0.377E-02    1.88       1.0  T
   8    -32.4043826 -0.148610E-04  0.150E-02    1.88       1.5  T
   9    -32.4043834 -0.886222E-06  0.741E-03    1.88       3.0  T
  10    -32.4043834  0.216455E-07  0.390E-03    1.88       5.7  T
  11    -32.4043836 -0.188871E-06  0.117E-03    1.88      19.0  T
  12    -32.4043836 -0.742376E-08  0.623E-04    1.88      35.9  T
  13    -32.4043836 -0.107581E-08  0.283E-04    1.88      79.2  T

   *** convergence criteria satisfied after 13 iterations ***

         #    Occupation            Energy/Eh            Energy/eV
      -------------------------------------------------------------
         1        2.0000           -0.7370575             -20.0564
       ...           ...                  ...                  ...
        24        2.0000           -0.4404871             -11.9863
        25        2.0000           -0.4372538             -11.8983
        26        2.0000           -0.4347420             -11.8299
        27        2.0000           -0.4214882             -11.4693
        28        2.0000           -0.4089068             -11.1269
        29        2.0000           -0.3781274             -10.2894
        30        2.0000           -0.3577354              -9.7345 (HOMO)
        31                         -0.2885625              -7.8522 (LUMO)
        32                         -0.2352378              -6.4011
        33                         -0.2116895              -5.7604
        34                         -0.2072086              -5.6384
        35                         -0.1987032              -5.4070
       ...                                ...                  ...
        66                          0.7353843              20.0108
      -------------------------------------------------------------
                  HL-Gap            0.0691729 Eh            1.8823 eV
             Fermi-level           -0.3231489 Eh           -8.7933 eV

 SCC (total)                   0 d,  0 h,  0 min,  0.037 sec
 SCC setup                      ...        0 min,  0.000 sec (  0.756%)
 Dispersion                     ...        0 min,  0.000 sec (  0.623%)
 integral evaluation            ...        0 min,  0.009 sec ( 24.289%)
 zeroth order Hamiltonian       ...        0 min,  0.000 sec (  0.466%)
 iterations                     ...        0 min,  0.014 sec ( 38.644%)
 molecular gradient             ...        0 min,  0.013 sec ( 34.077%)
 printout                       ...        0 min,  0.000 sec (  1.000%)

         :::::::::::::::::::::::::::::::::::::::::::::::::::::
         ::                     SUMMARY                     ::
         :::::::::::::::::::::::::::::::::::::::::::::::::::::
         :: total energy             -31.920974553357 Eh    ::
         :: gradient norm              0.102766684736 Eh/a0 ::
         :: HOMO-LUMO gap              1.882290899494 eV    ::
         ::.................................................::
         :: SCC energy               -32.404383621942 Eh    ::
         :: -> isotropic ES            0.004588882273 Eh    ::
         :: -> anisotropic ES          0.002104279518 Eh    ::
         :: -> anisotropic XC          0.018828682521 Eh    ::
         :: -> dispersion             -0.022872278112 Eh    ::
         :: repulsion energy           0.483367843735 Eh    ::
         :: add. restraining           0.000000000000 Eh    ::
         :::::::::::::::::::::::::::::::::::::::::::::::::::::

      ----------------------------------------------------------- 
     |                   =====================                   |
     |                        A N C O P T                        |
     |                   =====================                   |
     |               Approximate Normal Coordinate               |
     |                Rational Function Optimizer                |
      ----------------------------------------------------------- 

          ...................................................
          :                      SETUP                      :
          :.................................................:
          :   optimization level            normal          :
          :   max. optcycles                   200          :
          :   ANC micro-cycles                  20          :
          :   degrees of freedom                54          :
          :.................................................:
          :   RF solver                   davidson          :
          :   input Hessian                  false          :
          :   write xtbopt.log                true          :
          :   linear?                        false          :
          :   energy convergence         0.5000000E-05 Eh   :
          :   grad. convergence          0.1000000E-02 Eh/α :
          :   maximium RF displ.         2.0000000          :
          :   Hlow (freq-cutoff)         0.5000000E-02      :
          :   Hmax (freq-cutoff)         5.0000000          :
          :   S6 in model hess.         20.0000000          :
          ...................................................

generating ANC from model Hessian ...
Using Lindh-Hessian (1995)
 Shifting diagonal of input Hessian by   3.771017846943893E-003
 Lowest  eigenvalues of input Hessian
   -0.000000   -0.000000   -0.000000   -0.000000    0.000000    0.000000
    0.005000    0.006821    0.008473    0.010006    0.011916    0.013876
    0.016471    0.019109    0.022183    0.026754    0.031198    0.038596
 Highest eigenvalues
    1.619072    1.707189    1.846425    1.901878    1.990855    2.042746
 

........................................................................
.............................. CYCLE    1 ..............................
........................................................................
   1    -32.4043836 -0.324044E+02  0.125E-04    1.88       0.0  T
   2    -32.4043836  0.817124E-12  0.947E-05    1.88     236.1  T
   3    -32.4043836 -0.103292E-09  0.558E-05    1.88     400.9  T
     SCC iter.                  ...        0 min,  0.004 sec
     gradient                   ...        0 min,  0.013 sec
 * total energy  :   -31.9209746 Eh     change       -0.1159187E-07 Eh
   gradient norm :     0.1027666 Eh/α   predicted     0.0000000E+00 (-100.00%)
   displ. norm   :     0.2998885 α      lambda       -0.1680094E-01
   maximum displ.:     0.1256087 α      in ANC's #25, #12, #24, ...

........................................................................
.............................. CYCLE    2 ..............................
........................................................................
   1    -32.4358201 -0.324358E+02  0.276E-01    1.96       0.0  T
   2    -32.4358981 -0.779622E-04  0.173E-01    1.96       1.0  T
   3    -32.4358394  0.586486E-04  0.104E-01    1.96       1.0  T
   4    -32.4359955 -0.156066E-03  0.305E-02    1.96       1.0  T
   5    -32.4360015 -0.602094E-05  0.181E-02    1.96       1.2  T
   6    -32.4360054 -0.389877E-05  0.900E-03    1.96       2.5  T
   7    -32.4360065 -0.103616E-05  0.252E-03    1.96       8.9  T
   8    -32.4360065 -0.618705E-07  0.111E-03    1.96      20.2  T
     SCC iter.                  ...        0 min,  0.008 sec
     gradient                   ...        0 min,  0.012 sec
 * total energy  :   -31.9325166 Eh     change       -0.1154208E-01 Eh
   gradient norm :     0.0484171 Eh/α   predicted    -0.9155953E-02 ( -20.67%)
   displ. norm   :     0.2193999 α      lambda       -0.4406740E-02
   maximum displ.:     0.1218745 α      in ANC's #2, #25, #5, ...

........................................................................
.............................. CYCLE    3 ..............................
........................................................................
   1    -32.4488852 -0.324489E+02  0.209E-01    2.03       0.0  T
   2    -32.4489253 -0.401482E-04  0.129E-01    2.03       1.0  T
   3    -32.4488800  0.453579E-04  0.787E-02    2.03       1.0  T
   4    -32.4489622 -0.822788E-04  0.238E-02    2.03       1.0  T
   5    -32.4489700 -0.775251E-05  0.109E-02    2.03       2.1  T
   6    -32.4489712 -0.124827E-05  0.478E-03    2.03       4.7  T
   7    -32.4489715 -0.258569E-06  0.156E-03    2.03      14.3  T
     SCC iter.                  ...        0 min,  0.007 sec
     gradient                   ...        0 min,  0.012 sec
 * total energy  :   -31.9349186 Eh     change       -0.2401939E-02 Eh
   gradient norm :     0.0117309 Eh/α   predicted    -0.2309438E-02 (  -3.85%)
   displ. norm   :     0.1651641 α      lambda       -0.4671434E-03
   maximum displ.:     0.1420331 α      in ANC's #2, #5, #3, ...

........................................................................
.............................. CYCLE    4 ..............................
........................................................................
   1    -32.4472111 -0.324472E+02  0.132E-01    2.03       0.0  T
   2    -32.4472146 -0.347571E-05  0.745E-02    2.03       1.0  T
   3    -32.4472056  0.893467E-05  0.253E-02    2.03       1.0  T
   4    -32.4472156 -0.995505E-05  0.886E-03    2.03       2.5  T
   5    -32.4472159 -0.317003E-06  0.603E-03    2.03       3.7  T
   6    -32.4472165 -0.532727E-06  0.111E-03    2.03      20.1  T
   7    -32.4472165 -0.128635E-07  0.558E-04    2.03      40.1  T
     SCC iter.                  ...        0 min,  0.007 sec
     gradient                   ...        0 min,  0.012 sec
 * total energy  :   -31.9352769 Eh     change       -0.3582756E-03 Eh
   gradient norm :     0.0050270 Eh/α   predicted    -0.2399435E-03 ( -33.03%)
   displ. norm   :     0.2051342 α      lambda       -0.3372437E-03
   maximum displ.:     0.1710556 α      in ANC's #2, #5, #3, ...

........................................................................
.............................. CYCLE    5 ..............................
........................................................................
   1    -32.4457405 -0.324457E+02  0.162E-01    2.02       0.0  T
   2    -32.4457437 -0.318895E-05  0.909E-02    2.02       1.0  T
   3    -32.4457318  0.119113E-04  0.290E-02    2.02       1.0  T
   4    -32.4457446 -0.127321E-04  0.108E-02    2.03       2.1  T
   5    -32.4457450 -0.439890E-06  0.624E-03    2.02       3.6  T
   6    -32.4457456 -0.600522E-06  0.132E-03    2.03      17.0  T
   7    -32.4457456 -0.270602E-07  0.603E-04    2.03      37.1  T
     SCC iter.                  ...        0 min,  0.007 sec
     gradient                   ...        0 min,  0.012 sec
 * total energy  :   -31.9355178 Eh     change       -0.2409234E-03 Eh
   gradient norm :     0.0051257 Eh/α   predicted    -0.1757180E-03 ( -27.06%)
   displ. norm   :     0.1545855 α      lambda       -0.1702823E-03
   maximum displ.:     0.1295388 α      in ANC's #2, #5, #3, ...

........................................................................
.............................. CYCLE    6 ..............................
........................................................................
   1    -32.4459417 -0.324459E+02  0.126E-01    2.02       0.0  T
   2    -32.4459430 -0.127735E-05  0.723E-02    2.02       1.0  T
   3    -32.4459365  0.647618E-05  0.210E-02    2.02       1.1  T
   4    -32.4459434 -0.687467E-05  0.695E-03    2.02       3.2  T
   5    -32.4459436 -0.181113E-06  0.397E-03    2.02       5.6  T
   6    -32.4459438 -0.225460E-06  0.862E-04    2.02      26.0  T
   7    -32.4459438 -0.133209E-07  0.329E-04    2.02      68.0  T
     SCC iter.                  ...        0 min,  0.007 sec
     gradient                   ...        0 min,  0.012 sec
 * total energy  :   -31.9356434 Eh     change       -0.1256102E-03 Eh
   gradient norm :     0.0062737 Eh/α   predicted    -0.8718435E-04 ( -30.59%)
   displ. norm   :     0.1568159 α      lambda       -0.1590383E-03
   maximum displ.:     0.1320696 α      in ANC's #2, #4, #5, ...

........................................................................
.............................. CYCLE    7 ..............................
........................................................................
   1    -32.4466642 -0.324467E+02  0.125E-01    2.01       0.0  T
   2    -32.4466656 -0.135095E-05  0.708E-02    2.01       1.0  T
   3    -32.4466520  0.135885E-04  0.294E-02    2.01       1.0  T
   4    -32.4466666 -0.145697E-04  0.755E-03    2.01       3.0  T
   5    -32.4466667 -0.148043E-06  0.448E-03    2.01       5.0  T
   6    -32.4466670 -0.282883E-06  0.854E-04    2.01      26.2  T
   7    -32.4466670 -0.131537E-07  0.323E-04    2.01      69.2  T
     SCC iter.                  ...        0 min,  0.007 sec
     gradient                   ...        0 min,  0.012 sec
 * total energy  :   -31.9357617 Eh     change       -0.1182682E-03 Eh
   gradient norm :     0.0050824 Eh/α   predicted    -0.8147515E-04 ( -31.11%)
   displ. norm   :     0.2043036 α      lambda       -0.1643477E-03
   maximum displ.:     0.1665828 α      in ANC's #2, #4, #5, ...

........................................................................
.............................. CYCLE    8 ..............................
........................................................................
   1    -32.4473795 -0.324474E+02  0.169E-01    1.99       0.0  T
   2    -32.4473825 -0.299340E-05  0.953E-02    1.99       1.0  T
   3    -32.4473545  0.280160E-04  0.427E-02    1.99       1.0  T
   4    -32.4473846 -0.300538E-04  0.112E-02    1.99       2.0  T
   5    -32.4473850 -0.422337E-06  0.663E-03    1.99       3.4  T
   6    -32.4473856 -0.617053E-06  0.121E-03    1.99      18.4  T
   7    -32.4473856 -0.255288E-07  0.408E-04    1.99      54.8  T
     SCC iter.                  ...        0 min,  0.007 sec
     gradient                   ...        0 min,  0.012 sec
 * total energy  :   -31.9358749 Eh     change       -0.1132694E-03 Eh
   gradient norm :     0.0035219 Eh/α   predicted    -0.8561620E-04 ( -24.41%)
   displ. norm   :     0.1617154 α      lambda       -0.9548017E-04
   maximum displ.:     0.1217972 α      in ANC's #2, #4, #3, ...

........................................................................
.............................. CYCLE    9 ..............................
........................................................................
   1    -32.4477275 -0.324477E+02  0.130E-01    1.98       0.0  T
   2    -32.4477294 -0.187834E-05  0.721E-02    1.98       1.0  T
   3    -32.4477121  0.172659E-04  0.335E-02    1.98       1.0  T
   4    -32.4477307 -0.185706E-04  0.903E-03    1.98       2.5  T
   5    -32.4477309 -0.220052E-06  0.469E-03    1.98       4.8  T
   6    -32.4477313 -0.364588E-06  0.736E-04    1.98      30.4  T
   7    -32.4477313 -0.735098E-08  0.300E-04    1.98      74.6  T
     SCC iter.                  ...        0 min,  0.007 sec
     gradient                   ...        0 min,  0.012 sec
 * total energy  :   -31.9359425 Eh     change       -0.6752712E-04 Eh
   gradient norm :     0.0031027 Eh/α   predicted    -0.4898899E-04 ( -27.45%)
   displ. norm   :     0.1412203 α      lambda       -0.6490605E-04
   maximum displ.:     0.0904600 α      in ANC's #2, #4, #3, ...

........................................................................
.............................. CYCLE   10 ..............................
........................................................................
   1    -32.4480164 -0.324480E+02  0.107E-01    1.98       0.0  T
   2    -32.4480177 -0.125934E-05  0.588E-02    1.98       1.0  T
   3    -32.4480028  0.148467E-04  0.313E-02    1.98       1.0  T
   4    -32.4480189 -0.160724E-04  0.755E-03    1.98       3.0  T
   5    -32.4480190 -0.695242E-07  0.437E-03    1.98       5.1  T
   6    -32.4480193 -0.331962E-06  0.717E-04    1.98      31.2  T
   7    -32.4480193 -0.583530E-08  0.310E-04    1.98      72.1  T
     SCC iter.                  ...        0 min,  0.007 sec
     gradient                   ...        0 min,  0.012 sec
 * total energy  :   -31.9359863 Eh     change       -0.4382597E-04 Eh
   gradient norm :     0.0025754 Eh/α   predicted    -0.3310580E-04 ( -24.46%)
   displ. norm   :     0.1416186 α      lambda       -0.3936663E-04
   maximum displ.:     0.0943721 α      in ANC's #4, #2, #3, ...

........................................................................
.............................. CYCLE   11 ..............................
........................................................................
   1    -32.4471274 -0.324471E+02  0.993E-02    1.97       0.0  T
   2    -32.4471281 -0.673497E-06  0.562E-02    1.97       1.0  T
   3    -32.4471160  0.120837E-04  0.272E-02    1.97       1.0  T
   4    -32.4471289 -0.129402E-04  0.577E-03    1.97       3.9  T
   5    -32.4471290 -0.791679E-07  0.278E-03    1.97       8.0  T
   6    -32.4471291 -0.137654E-06  0.559E-04    1.97      40.0  T
   7    -32.4471291 -0.246938E-08  0.285E-04    1.97      78.3  T
     SCC iter.                  ...        0 min,  0.007 sec
     gradient                   ...        0 min,  0.012 sec
 * total energy  :   -31.9360071 Eh     change       -0.2086214E-04 Eh
   gradient norm :     0.0025782 Eh/α   predicted    -0.2007898E-04 (  -3.75%)
   displ. norm   :     0.0545506 α      lambda       -0.2492440E-04
   maximum displ.:     0.0369660 α      in ANC's #3, #4, #1, ...

........................................................................
.............................. CYCLE   12 ..............................
........................................................................
   1    -32.4481064 -0.324481E+02  0.353E-02    1.98       0.0  T
   2    -32.4481066 -0.142949E-06  0.194E-02    1.98       1.2  T
   3    -32.4481038  0.274799E-05  0.134E-02    1.98       1.7  T
   4    -32.4481069 -0.303233E-05  0.250E-03    1.98       9.0  T
   5    -32.4481069 -0.432451E-08  0.150E-03    1.98      14.9  T
   6    -32.4481069 -0.291930E-07  0.375E-04    1.98      59.6  T
   7    -32.4481069 -0.115952E-08  0.185E-04    1.98     121.1  T
     SCC iter.                  ...        0 min,  0.007 sec
     gradient                   ...        0 min,  0.012 sec
 * total energy  :   -31.9360169 Eh     change       -0.9746802E-05 Eh
   gradient norm :     0.0015270 Eh/α   predicted    -0.1250266E-04 (  28.27%)
   displ. norm   :     0.0716427 α      lambda       -0.1152475E-04
   maximum displ.:     0.0428233 α      in ANC's #4, #2, #1, ...

........................................................................
.............................. CYCLE   13 ..............................
........................................................................
   1    -32.4476306 -0.324476E+02  0.450E-02    1.97       0.0  T
   2    -32.4476308 -0.222411E-06  0.255E-02    1.97       1.0  T
   3    -32.4476298  0.101477E-05  0.875E-03    1.97       2.6  T
   4    -32.4476309 -0.108394E-05  0.272E-03    1.97       8.2  T
   5    -32.4476309 -0.233877E-07  0.167E-03    1.97      13.4  T
   6    -32.4476310 -0.450905E-07  0.363E-04    1.97      61.6  T
   7    -32.4476310 -0.148164E-08  0.145E-04    1.97     154.6  T
     SCC iter.                  ...        0 min,  0.007 sec
     gradient                   ...        0 min,  0.012 sec
 * total energy  :   -31.9360202 Eh     change       -0.3291684E-05 Eh
   gradient norm :     0.0020769 Eh/α   predicted    -0.5781668E-05 (  75.64%)
   displ. norm   :     0.0143635 α      lambda       -0.7233751E-05
   maximum displ.:     0.0069097 α      in ANC's #1, #3, #4, ...

........................................................................
.............................. CYCLE   14 ..............................
........................................................................
   1    -32.4476641 -0.324477E+02  0.175E-02    1.97       0.0  T
   2    -32.4476643 -0.119715E-06  0.840E-03    1.97       2.7  T
   3    -32.4476642  0.908545E-07  0.278E-03    1.97       8.1  T
   4    -32.4476643 -0.113004E-06  0.141E-03    1.97      15.9  T
   5    -32.4476643 -0.113982E-07  0.650E-04    1.97      34.4  T
   6    -32.4476643 -0.419752E-08  0.195E-04    1.97     114.5  T
     SCC iter.                  ...        0 min,  0.006 sec
     gradient                   ...        0 min,  0.012 sec
 * total energy  :   -31.9360249 Eh     change       -0.4725788E-05 Eh
   gradient norm :     0.0008894 Eh/α   predicted    -0.3619365E-05 ( -23.41%)
   displ. norm   :     0.0281610 α      lambda       -0.3688909E-05
   maximum displ.:     0.0184474 α      in ANC's #2, #1, #9, ...

   *** GEOMETRY OPTIMIZATION CONVERGED AFTER 14 ITERATIONS ***

------------------------------------------------------------------------
 total energy gain   :        -0.0150504 Eh       -9.4442 kcal/mol
 total RMSD          :         0.3428679 a0        0.1814 Å
 total power (kW/mol):        -2.8224784 (step)  -97.6607 (real)
------------------------------------------------------------------------

 ANCopt (total)                0 d,  0 h,  0 min,  0.405 sec
 optimizer setup                ...        0 min,  0.000 sec (  0.037%)
 model hessian                  ...        0 min,  0.002 sec (  0.599%)
 ANC generation                 ...        0 min,  0.001 sec (  0.152%)
 coordinate transformation      ...        0 min,  0.000 sec (  0.051%)
 single point calculation       ...        0 min,  0.397 sec ( 98.099%)
 optimization log               ...        0 min,  0.001 sec (  0.303%)
 hessian update                 ...        0 min,  0.000 sec (  0.043%)
 rational function              ...        0 min,  0.002 sec (  0.502%)

================
 final structure:
================
$coord
   -2.89998267192781    2.40234226154410   -0.11048019413805      C 
   -5.09632474870183    0.04845717965650   -0.16053505721249      S 
   -2.82672807058104   -2.30671152784785   -0.00776993888861      C 
   -0.41647496092276   -1.25525564902675    0.01189056567346      C 
   -0.47471522256186    1.46340810910250   -0.02459319837211      C 
    1.80205383947488    2.86404464025751    0.01881476797980      C 
    4.04336423065366    1.59417132813704    0.04396366864989      C 
    6.98951123593462    3.16831584645664    0.11575112368892      S 
    4.12016560415373   -1.08577361630037   -0.02910654098429      C 
    1.96216485585713   -2.47817487656148   -0.04948128757263      C 
   -3.68338102636388   -4.88393378215945    0.10891718201804      C 
   -2.44064448277685   -6.83543566671171    1.09890888489982      C 
   -3.48825000030229    4.33976419551958   -0.13673543311428      H 
    1.71549555656349    4.90377097581261    0.01829421706578      H 
    6.05036072587026    5.50210134798346    0.18206407385480      H 
    5.94654106442443   -1.99262145558166   -0.08156519429371      H 
    2.05448149184698   -4.50915394676793   -0.16337644249998      H 
   -5.57537279264658   -5.17507565471321   -0.62241599291093      H 
   -0.61466300404583   -6.64595730466778    1.97026557792971      H 
   -3.25649251846639   -8.69761958124342    1.10444309606738      H 
$end
           -------------------------------------------------
          |                Final Singlepoint                |
           -------------------------------------------------

          ...................................................
          :                      SETUP                      :
          :.................................................:
          :  # basis functions                  68          :
          :  # atomic orbitals                  66          :
          :  # shells                           34          :
          :  # electrons                        60          :
          :  max. iterations                   250          :
          :  Hamiltonian                  GFN2-xTB          :
          :  restarted?                      false          :
          :  GBSA solvation                  false          :
          :  PC potential                    false          :
          :  electronic temp.          300.0000000     K    :
          :  accuracy                    1.0000000          :
          :  -> integral cutoff          0.2500000E+02      :
          :  -> integral neglect         0.1000000E-07      :
          :  -> SCF convergence          0.1000000E-05 Eh   :
          :  -> wf. convergence          0.1000000E-03 e    :
          :  Broyden damping             0.4000000          :
          ...................................................

 iter      E             dE          RMSdq      gap      omega  full diag
   1    -32.4476643 -0.324477E+02  0.110E-04    1.97       0.0  T
   2    -32.4476643 -0.913758E-11  0.455E-05    1.97     491.6  T
   3    -32.4476643  0.954259E-11  0.531E-05    1.97     421.3  T

   *** convergence criteria satisfied after 3 iterations ***

         #    Occupation            Energy/Eh            Energy/eV
      -------------------------------------------------------------
         1        2.0000           -0.7386303             -20.0992
       ...           ...                  ...                  ...
        24        2.0000           -0.4441821             -12.0868
        25        2.0000           -0.4392959             -11.9538
        26        2.0000           -0.4274385             -11.6312
        27        2.0000           -0.4248866             -11.5618
        28        2.0000           -0.4095530             -11.1445
        29        2.0000           -0.3798933             -10.3374
        30        2.0000           -0.3601791              -9.8010 (HOMO)
        31                         -0.2876397              -7.8271 (LUMO)
        32                         -0.2309680              -6.2850
        33                         -0.2089225              -5.6851
        34                         -0.2064799              -5.6186
        35                         -0.1999243              -5.4402
       ...                                ...                  ...
        66                          0.7301235              19.8677
      -------------------------------------------------------------
                  HL-Gap            0.0725394 Eh            1.9739 eV
             Fermi-level           -0.3239094 Eh           -8.8140 eV

 SCC (total)                   0 d,  0 h,  0 min,  0.026 sec
 SCC setup                      ...        0 min,  0.000 sec (  0.617%)
 Dispersion                     ...        0 min,  0.000 sec (  0.486%)
 integral evaluation            ...        0 min,  0.009 sec ( 34.064%)
 zeroth order Hamiltonian       ...        0 min,  0.000 sec (  0.574%)
 iterations                     ...        0 min,  0.004 sec ( 14.710%)
 molecular gradient             ...        0 min,  0.012 sec ( 47.993%)
 printout                       ...        0 min,  0.000 sec (  1.336%)

         :::::::::::::::::::::::::::::::::::::::::::::::::::::
         ::                     SUMMARY                     ::
         :::::::::::::::::::::::::::::::::::::::::::::::::::::
         :: total energy             -31.936024921368 Eh    ::
         :: gradient norm              0.000889644136 Eh/a0 ::
         :: HOMO-LUMO gap              1.973897790224 eV    ::
         ::.................................................::
         :: SCC energy               -32.447664300351 Eh    ::
         :: -> isotropic ES            0.004558117470 Eh    ::
         :: -> anisotropic ES          0.002811456140 Eh    ::
         :: -> anisotropic XC          0.017386963749 Eh    ::
         :: -> dispersion             -0.022880824365 Eh    ::
         :: repulsion energy           0.511607919790 Eh    ::
         :: add. restraining           0.000000000000 Eh    ::
         :::::::::::::::::::::::::::::::::::::::::::::::::::::

           -------------------------------------------------
          |                Property Printout                |
           -------------------------------------------------

    * Orbital Energies and Occupations

         #    Occupation            Energy/Eh            Energy/eV
      -------------------------------------------------------------
         1        2.0000           -0.7386303             -20.0992
       ...           ...                  ...                  ...
        18        2.0000           -0.4854688             -13.2103
        19        2.0000           -0.4824357             -13.1277
        20        2.0000           -0.4749943             -12.9253
        21        2.0000           -0.4690538             -12.7636
        22        2.0000           -0.4577104             -12.4549
        23        2.0000           -0.4498751             -12.2417
        24        2.0000           -0.4441821             -12.0868
        25        2.0000           -0.4392959             -11.9538
        26        2.0000           -0.4274385             -11.6312
        27        2.0000           -0.4248866             -11.5618
        28        2.0000           -0.4095530             -11.1445
        29        2.0000           -0.3798933             -10.3374
        30        2.0000           -0.3601791              -9.8010 (HOMO)
        31                         -0.2876397              -7.8271 (LUMO)
        32                         -0.2309680              -6.2850
        33                         -0.2089225              -5.6851
        34                         -0.2064799              -5.6186
        35                         -0.1999243              -5.4402
        36                         -0.1754062              -4.7730
        37                         -0.1215416              -3.3073
        38                         -0.1190530              -3.2396
        39                         -0.0981826              -2.6717
        40                         -0.0197957              -0.5387
        41                         -0.0158245              -0.4306
       ...                                ...                  ...
        66                          0.7301235              19.8677
      -------------------------------------------------------------
                  HL-Gap            0.0725394 Eh            1.9739 eV
             Fermi-level           -0.3239094 Eh           -8.8140 eV

     #   Z        covCN         q      C6AA      α(0)
     1   6 C      2.925    -0.038    28.938     8.822
     2  16 S      2.349    -0.002   141.124    19.994
     3   6 C      2.977     0.014    27.704     8.634
     4   6 C      3.163    -0.007    27.852     8.626
     5   6 C      3.178     0.002    27.571     8.573
     6   6 C      2.946    -0.053    29.328     8.882
     7   6 C      2.964     0.057    26.714     8.478
     8  16 S      1.988    -0.235   151.122    20.690
     9   6 C      2.968    -0.037    28.906     8.819
    10   6 C      2.909    -0.031    28.782     8.797
    11   6 C      2.938    -0.029    28.728     8.790
    12   6 C      2.838    -0.090    30.253     9.014
    13   1 H      0.926     0.043     2.405     2.425
    14   1 H      0.926     0.028     2.609     2.526
    15   1 H      0.923     0.164     1.299     1.783
    16   1 H      0.926     0.043     2.407     2.426
    17   1 H      0.926     0.042     2.427     2.436
    18   1 H      0.925     0.042     2.418     2.432
    19   1 H      0.926     0.044     2.394     2.419
    20   1 H      0.926     0.042     2.417     2.431

 Mol. C6AA /au·bohr⁶  :       8019.959682
 Mol. C8AA /au·bohr⁸  :     247842.698348
 Mol. α(0) /au        :        146.997524


Wiberg/Mayer (AO) data.
largest (>0.10) Wiberg bond orders for each atom
          total WBO             WBO to atom ...
     1  C   3.940        C    5 1.447    S    2 1.238    H   13 0.970    C    3 0.130
     2  S   2.701        C    1 1.238    C    3 1.174
     3  C   3.943        C    4 1.383    S    2 1.174    C   11 1.140    C    1 0.130
     4  C   3.987        C    3 1.383    C   10 1.232    C    5 1.163
     5  C   3.988        C    1 1.447    C    6 1.221    C    4 1.163
     6  C   3.982        C    7 1.546    C    5 1.221    H   14 0.965    C   10 0.107
     7  C   3.958        C    6 1.546    C    9 1.232    S    8 1.045
     8  S   2.166        C    7 1.045    H   15 0.957
     9  C   3.990        C   10 1.611    C    7 1.232    H   16 0.968
    10  C   3.992        C    9 1.611    C    4 1.232    H   17 0.962    C    6 0.107
    11  C   3.990        C   12 1.854    C    3 1.140    H   18 0.961
    12  C   3.985        C   11 1.854    H   20 0.978    H   19 0.972
    13  H   0.997        C    1 0.970
    14  H   0.999        C    6 0.965
    15  H   0.973        S    8 0.957
    16  H   0.997        C    9 0.968
    17  H   0.998        C   10 0.962
    18  H   0.997        C   11 0.961
    19  H   0.998        C   12 0.972
    20  H   0.998        C   12 0.978

molecular dipole:
                 x           y           z       tot (Debye)
 q only:       -0.479       0.034       0.001
   full:       -0.486       0.145       0.003       1.290
molecular quadrupole (traceless):
                xx          xy          yy          xz          yz          zz
 q only:       -5.525       0.417       7.034       0.262      -0.086      -1.509
  q+dip:       -9.220      -1.272      12.941       0.936      -0.385      -3.721
   full:      -10.704      -0.949      11.979       0.392      -0.112      -1.275

           -------------------------------------------------
          |                Geometry Summary                 |
           -------------------------------------------------

      molecular mass/u    :      192.2932000
   center of mass at/Å    :        0.1479738      -0.0980060       0.0374196
  moments of inertia/u·Å² :        0.3296554E+03   0.1148083E+04   0.1470790E+04
rotational constants/cm⁻¹ :        0.5113714E-01   0.1468328E-01   0.1146161E-01

 * 19 selected distances

     #   Z        #   Z                                     value/Å
     1   6 C      2  16 S                                 1.7038521
     2  16 S      3   6 C                                 1.7327001 (max)
     3   6 C      4   6 C                                 1.3915718
     1   6 C      5   6 C                                 1.3769693
     4   6 C      5   6 C                                 1.4391146
     5   6 C      6   6 C                                 1.4147299
     6   6 C      7   6 C                                 1.3632538
     7   6 C      9   6 C                                 1.4192750
     4   6 C     10   6 C                                 1.4157075
     9   6 C     10   6 C                                 1.3590858
    11   6 C     12   6 C                                 1.3316814
     1   6 C     13   1 H                                 1.0715482 (min)
     6   6 C     14   1 H                                 1.0803483
     8  16 S     15   1 H                                 1.3316939
     9   6 C     16   1 H                                 1.0794142
    10   6 C     17   1 H                                 1.0775445
    11   6 C     18   1 H                                 1.0843931
    12   6 C     19   1 H                                 1.0753336
    12   6 C     20   1 H                                 1.0758536

 * 4 distinct bonds (by element types)

   Z      Z             #   av. dist./Å        max./Å        min./Å
   1 H    6 C           7     1.0777765     1.0843931     1.0715482
   6 C    6 C           9     1.3901543     1.4391146     1.3316814
   1 H   16 S           1     1.3316939     1.3316939     1.3316939
   6 C   16 S           2     1.7182761     1.7327001     1.7038521


optimized geometry written to: xtbopt.xyz


           -------------------------------------------------
          | TOTAL ENERGY              -31.936024921368 Eh   |
          | GRADIENT NORM               0.000889644136 Eh/α |
          | HOMO-LUMO GAP               1.973897790224 eV   |
           -------------------------------------------------

------------------------------------------------------------------------
 * finished run on 2021/05/19 at 10:58:43.637     
------------------------------------------------------------------------
 total:
 * wall-time:     0 d,  0 h,  0 min,  0.490 sec
 *  cpu-time:     0 d,  0 h,  0 min,  0.489 sec
 * ratio c/w:     0.998 speedup
 SCF:
 * wall-time:     0 d,  0 h,  0 min,  0.037 sec
 *  cpu-time:     0 d,  0 h,  0 min,  0.037 sec
 * ratio c/w:     1.000 speedup
 ANC optimizer:
 * wall-time:     0 d,  0 h,  0 min,  0.431 sec
 *  cpu-time:     0 d,  0 h,  0 min,  0.431 sec
 * ratio c/w:     1.000 speedup

