      -----------------------------------------------------------      
     |                   =====================                   |     
     |                           x T B                           |     
     |                   =====================                   |     
     |                         S. Grimme                         |     
     |          Mulliken Center for Theoretical Chemistry        |     
     |                    University of Bonn                     |     
     |                Version 6.2 RC2 (SAW190805)                |     
      -----------------------------------------------------------      

   This program is distributed in the hope that it will be useful,
   but WITHOUT ANY WARRANTY; without even the implied warranty of
   MERCHANTABILITY or FITNESS FOR A PARTICULAR PURPOSE.
   
   FOR NON-COMMERCIAL, ACADEMIA USE ONLY.
   
   Cite this work as:
   * S. Grimme, C. Bannwarth, P. Shushkov, J. Chem. Theory Comput., 2017,
     13, 1989-2009. DOI: 10.1021/acs.jctc.7b00118
   * C. Bannwarth, S. Ehlert and S. Grimme., J. Chem. Theory Comput., 2019,
     15, 1652-1671. DOI: 10.1021/acs.jctc.8b01176
   * P. Pracht, E. Caldeweyher, S. Ehlert, S. Grimme, ChemRxiv, 2019, preprint.
     DOI: 10.26434/chemrxiv.8326202.v1
   
   for DFT-D4:
   * E. Caldeweyher, C. Bannwarth and S. Grimme, J. Chem. Phys., 2017,
     147, 034112. DOI: 10.1063/1.4993215
   * E. Caldeweyher, S. Ehlert, A. Hansen, H. Neugebauer, S. Spicher,
     C. Bannwarth and S. Grimme, J. Chem. Phys., 2019, 150, 154122.
     DOI: 10.1063/1.5090222
   
   for sTDA-xTB:
   * S. Grimme and C. Bannwarth, J. Chem. Phys., 2016, 145, 054103.
     DOI: 10.1063/1.4959605
   
   in the mass-spec context:
   * V. Asgeirsson, C. Bauer and S. Grimme, Chem. Sci., 2017, 8, 4879.
     DOI: 10.1039/c7sc00601b
   
   for metadynamics refer to:
   * S. Grimme, J. Chem. Theory Comput., 2019, 155, 2847-2862
     DOI: 10.1021/acs.jctc.9b00143
   
   with help from (in alphabetical order)
   C. Bannwarth, F. Bohle, G. Brandenburg, E. Caldeweyher, M. Checinski,
   S. Dohm, S. Ehlert, S. Ehrlich, F. März, H. Neugebauer, J. Pisarek,
   P. Pracht, P. Shushkov, and S. Spicher.
   
 * started run on 2021/05/19 at 10:58:09.353     

           -------------------------------------------------
          |                Calculation Setup                |
           -------------------------------------------------

          program call               : /ihome/ghutchison/geoffh/xtb/xtb 12.xyz -opt
          hostname                   : smp-n58
          coordinate file            : 12.xyz
          omp threads                :                     1
          number of atoms            :                    30
          number of electrons        :                    74
          charge                     :                     0
          spin                       :                   0.0
          first test random number   :      0.79061680808776


########################################################################
# WARNING! Please study the warnings concerning your input carefully
#  - the use of '-opt' is discouraged, please use '--opt' next time
########################################################################

           ------------------------------------------------- 
          |                 G F N 2 - x T B                 |
          | Geometry, Frequencies, Noncovalent interactions |
          |            JCTC 2019 parametrisation            |
           ------------------------------------------------- 
             KAB for C  - Si     :                1.0500
             KAB for H  - Pd     :                0.9500
             k(s)              :                1.8500
             k(p)              :                2.2300
             k(d)              :                2.2300
             k(f)              :                2.0000
             kEN (H0ij)        :               -2.0000
             D4 a1             :                0.5200
             D4 a2             :                5.0000
             D4 s6             :                1.0000
             D4 s8             :                2.7000
             D4 s9             :                5.0000
             alphaj            :                2.0000

  Z AO/shell   Hii/eV     exponent
  1     Wed Apr 25 08:07:45 CEST 2018   EN: 2.200 GM2: 0.406  GM3: 0.0800  RAES: 1.40
     1s    -10.707211    1.230000
  6     Wed Apr 25 08:07:45 CEST 2018   EN: 2.550 GM2: 0.538  GM3: 0.1500  RAES: 3.00
     2s    -13.970922    2.096432
     2p    -10.063292    1.800000
 16     Tue Apr 24 11:44:34 CEST 2018   EN: 2.580 GM2: 0.340  GM3:-0.0502  RAES: 3.10
     3s    -20.029654    1.981333
     3p    -11.377694    2.025643
     3d     -0.420282    1.702555

           ------------------------------------------------- 
          |        Self-Consistent Charge Iterations        |
           ------------------------------------------------- 

          ...................................................
          :                      SETUP                      :
          :.................................................:
          :  # basis functions                  78          :
          :  # atomic orbitals                  77          :
          :  # shells                           45          :
          :  # electrons                        74          :
          :  max. iterations                   250          :
          :  Hamiltonian                  GFN2-xTB          :
          :  restarted?                      false          :
          :  GBSA solvation                  false          :
          :  PC potential                    false          :
          :  electronic temp.          300.0000000     K    :
          :  accuracy                    1.0000000          :
          :  -> integral cutoff          0.2500000E+02      :
          :  -> integral neglect         0.1000000E-07      :
          :  -> SCF convergence          0.1000000E-05 Eh   :
          :  -> wf. convergence          0.1000000E-03 e    :
          :  Broyden damping             0.4000000          :
          ...................................................

 iter      E             dE          RMSdq      gap      omega  full diag
   1    -39.7500725 -0.397501E+02  0.389E+00    3.50       0.0  T
   2    -39.7854234 -0.353510E-01  0.227E+00    3.38       1.0  T
   3    -39.7776952  0.772826E-02  0.911E-01    3.28       1.0  T
   4    -39.7837497 -0.605450E-02  0.529E-01    3.42       1.0  T
   5    -39.7889180 -0.516827E-02  0.127E-01    3.46       1.0  T
   6    -39.7890396 -0.121610E-03  0.728E-02    3.45       1.0  T
   7    -39.7891233 -0.837568E-04  0.279E-02    3.45       1.0  T
   8    -39.7891291 -0.582004E-05  0.933E-03    3.44       2.0  T
   9    -39.7891295 -0.336076E-06  0.428E-03    3.44       4.3  T
  10    -39.7891296 -0.871916E-07  0.226E-03    3.44       8.1  T
  11    -39.7891297 -0.957119E-07  0.686E-04    3.44      26.6  T
  12    -39.7891297 -0.659334E-09  0.310E-04    3.44      58.8  T

   *** convergence criteria satisfied after 12 iterations ***

         #    Occupation            Energy/Eh            Energy/eV
      -------------------------------------------------------------
         1        2.0000           -0.7218175             -19.6417
       ...           ...                  ...                  ...
        31        2.0000           -0.4334953             -11.7960
        32        2.0000           -0.4207548             -11.4493
        33        2.0000           -0.4188178             -11.3966
        34        2.0000           -0.4162502             -11.3267
        35        2.0000           -0.3818501             -10.3907
        36        2.0000           -0.3774312             -10.2704
        37        2.0000           -0.3749011             -10.2016 (HOMO)
        38                         -0.2483281              -6.7574 (LUMO)
        39                         -0.2344717              -6.3803
        40                         -0.1901078              -5.1731
        41                         -0.1637826              -4.4568
        42                         -0.1486947              -4.0462
       ...                                ...                  ...
        77                          0.6762573              18.4019
      -------------------------------------------------------------
                  HL-Gap            0.1265729 Eh            3.4442 eV
             Fermi-level           -0.3116146 Eh           -8.4795 eV

 SCC (total)                   0 d,  0 h,  0 min,  0.046 sec
 SCC setup                      ...        0 min,  0.000 sec (  0.693%)
 Dispersion                     ...        0 min,  0.000 sec (  1.037%)
 integral evaluation            ...        0 min,  0.011 sec ( 23.451%)
 zeroth order Hamiltonian       ...        0 min,  0.000 sec (  0.421%)
 iterations                     ...        0 min,  0.017 sec ( 37.962%)
 molecular gradient             ...        0 min,  0.016 sec ( 35.454%)
 printout                       ...        0 min,  0.000 sec (  0.877%)

         :::::::::::::::::::::::::::::::::::::::::::::::::::::
         ::                     SUMMARY                     ::
         :::::::::::::::::::::::::::::::::::::::::::::::::::::
         :: total energy             -39.189530798854 Eh    ::
         :: gradient norm              0.046722770320 Eh/a0 ::
         :: HOMO-LUMO gap              3.444224931864 eV    ::
         ::.................................................::
         :: SCC energy               -39.789129658344 Eh    ::
         :: -> isotropic ES            0.003957527217 Eh    ::
         :: -> anisotropic ES          0.006358207804 Eh    ::
         :: -> anisotropic XC          0.024242217949 Eh    ::
         :: -> dispersion             -0.031864329011 Eh    ::
         :: repulsion energy           0.599183398224 Eh    ::
         :: add. restraining           0.000000000000 Eh    ::
         :::::::::::::::::::::::::::::::::::::::::::::::::::::

      ----------------------------------------------------------- 
     |                   =====================                   |
     |                        A N C O P T                        |
     |                   =====================                   |
     |               Approximate Normal Coordinate               |
     |                Rational Function Optimizer                |
      ----------------------------------------------------------- 

          ...................................................
          :                      SETUP                      :
          :.................................................:
          :   optimization level            normal          :
          :   max. optcycles                   200          :
          :   ANC micro-cycles                  20          :
          :   degrees of freedom                84          :
          :.................................................:
          :   RF solver                   davidson          :
          :   input Hessian                  false          :
          :   write xtbopt.log                true          :
          :   linear?                        false          :
          :   energy convergence         0.5000000E-05 Eh   :
          :   grad. convergence          0.1000000E-02 Eh/α :
          :   maximium RF displ.         2.0000000          :
          :   Hlow (freq-cutoff)         0.5000000E-02      :
          :   Hmax (freq-cutoff)         5.0000000          :
          :   S6 in model hess.         20.0000000          :
          ...................................................

generating ANC from model Hessian ...
Using Lindh-Hessian (1995)
 Shifting diagonal of input Hessian by   4.281740561383468E-003
 Lowest  eigenvalues of input Hessian
   -0.000000   -0.000000   -0.000000    0.000000    0.000000    0.000000
    0.005000    0.005596    0.006588    0.006963    0.008284    0.009120
    0.011349    0.012228    0.012959    0.014161    0.015734    0.017775
 Highest eigenvalues
    1.580157    1.645754    1.744085    1.754229    1.820188    1.962953
 

........................................................................
.............................. CYCLE    1 ..............................
........................................................................
   1    -39.7891297 -0.397891E+02  0.148E-04    3.44       0.0  T
   2    -39.7891297 -0.401528E-10  0.113E-04    3.44     160.9  T
   3    -39.7891297 -0.208416E-09  0.615E-05    3.44     297.1  T
     SCC iter.                  ...        0 min,  0.004 sec
     gradient                   ...        0 min,  0.016 sec
 * total energy  :   -39.1895308 Eh     change       -0.1536618E-07 Eh
   gradient norm :     0.0467218 Eh/α   predicted     0.0000000E+00 (-100.00%)
   displ. norm   :     0.3363438 α      lambda       -0.6504069E-02
   maximum displ.:     0.1407837 α      in ANC's #7, #11, #29, ...

........................................................................
.............................. CYCLE    2 ..............................
........................................................................
   1    -39.8237571 -0.398238E+02  0.172E-01    3.52       0.0  T
   2    -39.8237978 -0.406359E-04  0.888E-02    3.54       1.0  T
   3    -39.8237775  0.202204E-04  0.427E-02    3.54       1.0  T
   4    -39.8238062 -0.287025E-04  0.187E-02    3.53       1.0  T
   5    -39.8238104 -0.420159E-05  0.736E-03    3.54       2.5  T
   6    -39.8238105 -0.105117E-06  0.396E-03    3.54       4.6  T
   7    -39.8238109 -0.355620E-06  0.616E-04    3.54      29.7  T
     SCC iter.                  ...        0 min,  0.009 sec
     gradient                   ...        0 min,  0.016 sec
 * total energy  :   -39.1936730 Eh     change       -0.4142146E-02 Eh
   gradient norm :     0.0158768 Eh/α   predicted    -0.3619945E-02 ( -12.61%)
   displ. norm   :     0.2849770 α      lambda       -0.1334254E-02
   maximum displ.:     0.1452122 α      in ANC's #7, #6, #2, ...

........................................................................
.............................. CYCLE    3 ..............................
........................................................................
   1    -39.8357377 -0.398357E+02  0.109E-01    3.57       0.0  T
   2    -39.8357505 -0.128035E-04  0.573E-02    3.57       1.0  T
   3    -39.8357388  0.116525E-04  0.314E-02    3.57       1.0  T
   4    -39.8357544 -0.155368E-04  0.115E-02    3.57       1.6  T
   5    -39.8357558 -0.147196E-05  0.481E-03    3.57       3.8  T
   6    -39.8357561 -0.206179E-06  0.197E-03    3.57       9.3  T
   7    -39.8357561 -0.821326E-07  0.372E-04    3.57      49.0  T
     SCC iter.                  ...        0 min,  0.010 sec
     gradient                   ...        0 min,  0.017 sec
 * total energy  :   -39.1945405 Eh     change       -0.8675831E-03 Eh
   gradient norm :     0.0056223 Eh/α   predicted    -0.7213083E-03 ( -16.86%)
   displ. norm   :     0.2956683 α      lambda       -0.6295458E-03
   maximum displ.:     0.1238580 α      in ANC's #6, #3, #2, ...

........................................................................
.............................. CYCLE    4 ..............................
........................................................................
   1    -39.8372329 -0.398372E+02  0.964E-02    3.58       0.0  T
   2    -39.8372372 -0.436877E-05  0.548E-02    3.58       1.0  T
   3    -39.8372265  0.107514E-04  0.253E-02    3.58       1.0  T
   4    -39.8372388 -0.123040E-04  0.722E-03    3.58       2.5  T
   5    -39.8372395 -0.652868E-06  0.302E-03    3.58       6.0  T
   6    -39.8372396 -0.106024E-06  0.124E-03    3.58      14.7  T
   7    -39.8372396 -0.265146E-07  0.395E-04    3.58      46.2  T
     SCC iter.                  ...        0 min,  0.010 sec
     gradient                   ...        0 min,  0.016 sec
 * total energy  :   -39.1949965 Eh     change       -0.4559308E-03 Eh
   gradient norm :     0.0054834 Eh/α   predicted    -0.3422951E-03 ( -24.92%)
   displ. norm   :     0.3923065 α      lambda       -0.6320295E-03
   maximum displ.:     0.1891076 α      in ANC's #3, #2, #1, ...

........................................................................
.............................. CYCLE    5 ..............................
........................................................................
   1    -39.8344724 -0.398345E+02  0.124E-01    3.58       0.0  T
   2    -39.8344757 -0.331135E-05  0.721E-02    3.58       1.0  T
   3    -39.8344685  0.724239E-05  0.193E-02    3.58       1.0  T
   4    -39.8344766 -0.812665E-05  0.613E-03    3.57       3.0  T
   5    -39.8344770 -0.461958E-06  0.257E-03    3.58       7.1  T
   6    -39.8344771 -0.265817E-07  0.146E-03    3.58      12.5  T
     SCC iter.                  ...        0 min,  0.008 sec
     gradient                   ...        0 min,  0.016 sec
 * total energy  :   -39.1954288 Eh     change       -0.4323453E-03 Eh
   gradient norm :     0.0077136 Eh/α   predicted    -0.3646538E-03 ( -15.66%)
   displ. norm   :     0.3308158 α      lambda       -0.4324604E-03
   maximum displ.:     0.1657623 α      in ANC's #3, #1, #4, ...

........................................................................
.............................. CYCLE    6 ..............................
........................................................................
   1    -39.8320139 -0.398320E+02  0.107E-01    3.58       0.0  T
   2    -39.8320157 -0.183399E-05  0.604E-02    3.57       1.0  T
   3    -39.8320157 -0.354311E-07  0.886E-03    3.57       2.1  T
   4    -39.8320156  0.717481E-07  0.555E-03    3.57       3.3  T
   5    -39.8320162 -0.577223E-06  0.118E-03    3.57      15.5  T
   6    -39.8320162 -0.118374E-07  0.679E-04    3.57      26.9  T
     SCC iter.                  ...        0 min,  0.008 sec
     gradient                   ...        0 min,  0.017 sec
 * total energy  :   -39.1957337 Eh     change       -0.3048569E-03 Eh
   gradient norm :     0.0072246 Eh/α   predicted    -0.2398950E-03 ( -21.31%)
   displ. norm   :     0.2673217 α      lambda       -0.3109410E-03
   maximum displ.:     0.1503859 α      in ANC's #1, #4, #3, ...

........................................................................
.............................. CYCLE    7 ..............................
........................................................................
   1    -39.8322610 -0.398323E+02  0.108E-01    3.57       0.0  T
   2    -39.8322642 -0.320362E-05  0.578E-02    3.57       1.0  T
   3    -39.8322624  0.172371E-05  0.133E-02    3.57       1.4  T
   4    -39.8322646 -0.214524E-05  0.757E-03    3.57       2.4  T
   5    -39.8322651 -0.542412E-06  0.212E-03    3.57       8.6  T
   6    -39.8322652 -0.610315E-07  0.974E-04    3.57      18.8  T
     SCC iter.                  ...        0 min,  0.008 sec
     gradient                   ...        0 min,  0.016 sec
 * total energy  :   -39.1959527 Eh     change       -0.2190191E-03 Eh
   gradient norm :     0.0045628 Eh/α   predicted    -0.1665850E-03 ( -23.94%)
   displ. norm   :     0.2457027 α      lambda       -0.2052513E-03
   maximum displ.:     0.1553313 α      in ANC's #1, #4, #3, ...

........................................................................
.............................. CYCLE    8 ..............................
........................................................................
   1    -39.8335165 -0.398335E+02  0.110E-01    3.57       0.0  T
   2    -39.8335203 -0.381732E-05  0.580E-02    3.57       1.0  T
   3    -39.8335180  0.232542E-05  0.142E-02    3.57       1.3  T
   4    -39.8335210 -0.301666E-05  0.761E-03    3.57       2.4  T
   5    -39.8335216 -0.568069E-06  0.154E-03    3.57      11.9  T
   6    -39.8335216 -0.969779E-08  0.831E-04    3.57      22.0  T
     SCC iter.                  ...        0 min,  0.007 sec
     gradient                   ...        0 min,  0.016 sec
 * total energy  :   -39.1960861 Eh     change       -0.1334394E-03 Eh
   gradient norm :     0.0033875 Eh/α   predicted    -0.1088216E-03 ( -18.45%)
   displ. norm   :     0.1933293 α      lambda       -0.1243270E-03
   maximum displ.:     0.1306388 α      in ANC's #1, #4, #3, ...

........................................................................
.............................. CYCLE    9 ..............................
........................................................................
   1    -39.8347351 -0.398347E+02  0.912E-02    3.57       0.0  T
   2    -39.8347375 -0.240232E-05  0.481E-02    3.57       1.0  T
   3    -39.8347365  0.103228E-05  0.106E-02    3.57       1.7  T
   4    -39.8347378 -0.132989E-05  0.612E-03    3.57       3.0  T
   5    -39.8347383 -0.443475E-06  0.107E-03    3.57      17.1  T
   6    -39.8347383 -0.636346E-08  0.466E-04    3.57      39.2  T
   7    -39.8347383 -0.305113E-08  0.271E-04    3.57      67.5  T
     SCC iter.                  ...        0 min,  0.008 sec
     gradient                   ...        0 min,  0.016 sec
 * total energy  :   -39.1961690 Eh     change       -0.8288521E-04 Eh
   gradient norm :     0.0026227 Eh/α   predicted    -0.6449056E-04 ( -22.19%)
   displ. norm   :     0.1255065 α      lambda       -0.7309379E-04
   maximum displ.:     0.0964352 α      in ANC's #1, #3, #4, ...

........................................................................
.............................. CYCLE   10 ..............................
........................................................................
   1    -39.8357291 -0.398357E+02  0.623E-02    3.57       0.0  T
   2    -39.8357301 -0.107575E-05  0.331E-02    3.57       1.0  T
   3    -39.8357298  0.351791E-06  0.692E-03    3.57       2.6  T
   4    -39.8357302 -0.400946E-06  0.428E-03    3.57       4.3  T
   5    -39.8357304 -0.237949E-06  0.112E-03    3.57      16.2  T
   6    -39.8357304 -0.127622E-07  0.542E-04    3.57      33.7  T
   7    -39.8357305 -0.594838E-08  0.186E-04    3.57      98.0  T
     SCC iter.                  ...        0 min,  0.009 sec
     gradient                   ...        0 min,  0.017 sec
 * total energy  :   -39.1962256 Eh     change       -0.5652995E-04 Eh
   gradient norm :     0.0022288 Eh/α   predicted    -0.3712719E-04 ( -34.32%)
   displ. norm   :     0.1213206 α      lambda       -0.6180308E-04
   maximum displ.:     0.0910824 α      in ANC's #1, #2, #3, ...

........................................................................
.............................. CYCLE   11 ..............................
........................................................................
   1    -39.8356101 -0.398356E+02  0.558E-02    3.57       0.0  T
   2    -39.8356106 -0.554463E-06  0.307E-02    3.57       1.0  T
   3    -39.8356104  0.239503E-06  0.601E-03    3.57       3.0  T
   4    -39.8356106 -0.231656E-06  0.372E-03    3.57       4.9  T
   5    -39.8356108 -0.184632E-06  0.671E-04    3.57      27.2  T
   6    -39.8356108 -0.593393E-08  0.348E-04    3.57      52.4  T
     SCC iter.                  ...        0 min,  0.007 sec
     gradient                   ...        0 min,  0.017 sec
 * total energy  :   -39.1962729 Eh     change       -0.4736980E-04 Eh
   gradient norm :     0.0018064 Eh/α   predicted    -0.3135816E-04 ( -33.80%)
   displ. norm   :     0.1604536 α      lambda       -0.4348987E-04
   maximum displ.:     0.1180167 α      in ANC's #1, #2, #5, ...

........................................................................
.............................. CYCLE   12 ..............................
........................................................................
   1    -39.8354666 -0.398355E+02  0.635E-02    3.57       0.0  T
   2    -39.8354672 -0.578764E-06  0.360E-02    3.57       1.0  T
   3    -39.8354671  0.116816E-06  0.541E-03    3.57       3.4  T
   4    -39.8354672 -0.101847E-06  0.351E-03    3.57       5.2  T
   5    -39.8354674 -0.181601E-06  0.964E-04    3.57      18.9  T
   6    -39.8354674 -0.112188E-07  0.427E-04    3.57      42.7  T
     SCC iter.                  ...        0 min,  0.008 sec
     gradient                   ...        0 min,  0.016 sec
 * total energy  :   -39.1963140 Eh     change       -0.4103874E-04 Eh
   gradient norm :     0.0021598 Eh/α   predicted    -0.2199920E-04 ( -46.39%)
   displ. norm   :     0.0636444 α      lambda       -0.2332554E-04
   maximum displ.:     0.0495747 α      in ANC's #1, #2, #8, ...

........................................................................
.............................. CYCLE   13 ..............................
........................................................................
   1    -39.8349357 -0.398349E+02  0.235E-02    3.58       0.0  T
   2    -39.8349358 -0.768288E-07  0.136E-02    3.58       1.3  T
   3    -39.8349357  0.411185E-07  0.182E-03    3.57      10.0  T
   4    -39.8349358 -0.484739E-07  0.102E-03    3.57      17.9  T
   5    -39.8349358 -0.151428E-07  0.367E-04    3.57      49.7  T
   6    -39.8349358 -0.154195E-09  0.217E-04    3.57      84.2  T
     SCC iter.                  ...        0 min,  0.008 sec
     gradient                   ...        0 min,  0.016 sec
 * total energy  :   -39.1963326 Eh     change       -0.1863077E-04 Eh
   gradient norm :     0.0014962 Eh/α   predicted    -0.1171469E-04 ( -37.12%)
   displ. norm   :     0.1111152 α      lambda       -0.2748363E-04
   maximum displ.:     0.0845695 α      in ANC's #1, #4, #2, ...

........................................................................
.............................. CYCLE   14 ..............................
........................................................................
   1    -39.8349824 -0.398350E+02  0.396E-02    3.57       0.0  T
   2    -39.8349827 -0.270015E-06  0.225E-02    3.58       1.0  T
   3    -39.8349824  0.239552E-06  0.422E-03    3.57       4.3  T
   4    -39.8349827 -0.266215E-06  0.225E-03    3.57       8.1  T
   5    -39.8349827 -0.667852E-07  0.650E-04    3.57      28.1  T
   6    -39.8349828 -0.134749E-08  0.332E-04    3.57      54.9  T
     SCC iter.                  ...        0 min,  0.008 sec
     gradient                   ...        0 min,  0.018 sec
 * total energy  :   -39.1963625 Eh     change       -0.2993523E-04 Eh
   gradient norm :     0.0012174 Eh/α   predicted    -0.1381815E-04 ( -53.84%)
   displ. norm   :     0.0929842 α      lambda       -0.1633280E-04
   maximum displ.:     0.0739304 α      in ANC's #1, #4, #5, ...

........................................................................
.............................. CYCLE   15 ..............................
........................................................................
   1    -39.8350451 -0.398350E+02  0.352E-02    3.57       0.0  T
   2    -39.8350453 -0.208209E-06  0.197E-02    3.57       1.0  T
   3    -39.8350452  0.112092E-06  0.373E-03    3.57       4.9  T
   4    -39.8350453 -0.112719E-06  0.229E-03    3.57       8.0  T
   5    -39.8350454 -0.673759E-07  0.559E-04    3.57      32.7  T
   6    -39.8350454 -0.380452E-08  0.254E-04    3.57      72.0  T
     SCC iter.                  ...        0 min,  0.008 sec
     gradient                   ...        0 min,  0.017 sec
 * total energy  :   -39.1963809 Eh     change       -0.1837838E-04 Eh
   gradient norm :     0.0011335 Eh/α   predicted    -0.8199027E-05 ( -55.39%)
   displ. norm   :     0.0735506 α      lambda       -0.1114858E-04
   maximum displ.:     0.0604432 α      in ANC's #1, #4, #5, ...

........................................................................
.............................. CYCLE   16 ..............................
........................................................................
   1    -39.8355629 -0.398356E+02  0.283E-02    3.57       0.0  T
   2    -39.8355631 -0.164139E-06  0.159E-02    3.57       1.2  T
   3    -39.8355628  0.276101E-06  0.414E-03    3.57       4.4  T
   4    -39.8355632 -0.321713E-06  0.170E-03    3.57      10.7  T
   5    -39.8355632 -0.174745E-07  0.689E-04    3.57      26.5  T
   6    -39.8355632 -0.707254E-08  0.282E-04    3.57      64.8  T
     SCC iter.                  ...        0 min,  0.007 sec
     gradient                   ...        0 min,  0.017 sec
 * total energy  :   -39.1963927 Eh     change       -0.1184533E-04 Eh
   gradient norm :     0.0010143 Eh/α   predicted    -0.5591845E-05 ( -52.79%)
   displ. norm   :     0.0540731 α      lambda       -0.7459880E-05
   maximum displ.:     0.0464386 α      in ANC's #1, #5, #4, ...

........................................................................
.............................. CYCLE   17 ..............................
........................................................................
   1    -39.8356151 -0.398356E+02  0.214E-02    3.57       0.0  T
   2    -39.8356152 -0.914939E-07  0.120E-02    3.57       1.5  T
   3    -39.8356151  0.121527E-06  0.274E-03    3.57       6.7  T
   4    -39.8356152 -0.144350E-06  0.121E-03    3.57      15.1  T
   5    -39.8356152 -0.108632E-07  0.474E-04    3.57      38.5  T
   6    -39.8356153 -0.322559E-08  0.198E-04    3.57      92.2  T
     SCC iter.                  ...        0 min,  0.008 sec
     gradient                   ...        0 min,  0.017 sec
 * total energy  :   -39.1964016 Eh     change       -0.8881336E-05 Eh
   gradient norm :     0.0006009 Eh/α   predicted    -0.3738569E-05 ( -57.91%)
   displ. norm   :     0.0551534 α      lambda       -0.1846303E-05
   maximum displ.:     0.0476928 α      in ANC's #1, #5, #4, ...

........................................................................
.............................. CYCLE   18 ..............................
........................................................................
   1    -39.8356128 -0.398356E+02  0.217E-02    3.57       0.0  T
   2    -39.8356129 -0.920708E-07  0.122E-02    3.57       1.5  T
   3    -39.8356127  0.127418E-06  0.280E-03    3.57       6.5  T
   4    -39.8356129 -0.150742E-06  0.122E-03    3.57      15.0  T
   5    -39.8356129 -0.108673E-07  0.485E-04    3.57      37.6  T
   6    -39.8356129 -0.348876E-08  0.198E-04    3.57      92.2  T
     SCC iter.                  ...        0 min,  0.008 sec
     gradient                   ...        0 min,  0.016 sec
 * total energy  :   -39.1964060 Eh     change       -0.4402655E-05 Eh
   gradient norm :     0.0009858 Eh/α   predicted    -0.9279049E-06 ( -78.92%)
   displ. norm   :     0.0334537 α      lambda       -0.4937689E-05
   maximum displ.:     0.0254546 α      in ANC's #1, #2, #6, ...

   *** GEOMETRY OPTIMIZATION CONVERGED AFTER 18 ITERATIONS ***

------------------------------------------------------------------------
 total energy gain   :        -0.0068752 Eh       -4.3143 kcal/mol
 total RMSD          :         0.4430186 a0        0.2344 Å
 total power (kW/mol):        -1.0028291 (step)  -27.0810 (real)
------------------------------------------------------------------------

 ANCopt (total)                0 d,  0 h,  0 min,  0.667 sec
 optimizer setup                ...        0 min,  0.000 sec (  0.023%)
 model hessian                  ...        0 min,  0.019 sec (  2.859%)
 ANC generation                 ...        0 min,  0.001 sec (  0.142%)
 coordinate transformation      ...        0 min,  0.000 sec (  0.052%)
 single point calculation       ...        0 min,  0.640 sec ( 96.054%)
 optimization log               ...        0 min,  0.002 sec (  0.292%)
 hessian update                 ...        0 min,  0.000 sec (  0.038%)
 rational function              ...        0 min,  0.002 sec (  0.369%)

================
 final structure:
================
$coord
    2.66443294130451    2.55884726647473    0.05083867557306      C 
    4.98346081788597    0.39532691684955    0.77465937642502      S 
    2.75870597817253   -1.96275320860275    1.03778134115494      C 
    0.37587396733975   -1.11772605561187    0.58976036609618      C 
    0.32319825576235    1.50983336226095    0.01082358377537      C 
   -2.07580059518493    2.84189434349760   -0.65348065629202      C 
   -4.36594147571405    1.46207021939170    0.45359465671879      C 
   -4.47125259963605    1.80348228569730    3.31754098308945      C 
   -4.30986550754012   -1.35798489541566   -0.29496393531355      C 
   -1.96975137254249   -2.68394946718668    0.78571054361271      C 
   -4.55502526188969   -1.61372674698552   -3.12838383028673      C 
   -2.57385783166042   -1.94493252142341   -4.64979285895326      C 
   -7.07345213541016   -1.44802689674011   -4.24052375166460      C 
   -9.25864991632542   -1.14046028161475   -3.04489315822585      C 
    3.18184065928461    4.48340863333347   -0.31167232899286      H 
    3.35262091991109   -3.83997155370418    1.51464672423378      H 
   -2.25385706706347    2.89795159980950   -2.71384584600260      H 
   -2.02192308946936    4.79195644827424    0.01997179584121      H 
   -6.07397353341307    2.29766152077692   -0.36567601570876      H 
   -2.69848378489075    1.24169805431808    4.18989438283992      H 
   -5.99207569648646    0.68301538001918    4.13121632433187      H 
   -4.81001553018710    3.77817195946954    3.77901910704055      H 
   -5.96249765229336   -2.27137131523619    0.55052261672327      H 
   -1.70091986896847   -4.49793974325051   -0.16380603969728      H 
   -2.30689427882471   -3.09890842928336    2.78382433353675      H 
   -0.66442959552412   -2.07021589189536   -3.96508094068706      H 
   -2.80967253714124   -2.09700756912625   -6.66748885595926      H 
   -7.09578000287343   -1.60524010191848   -6.28228981350704      H 
   -9.41848425030305   -0.96949953591351   -1.02400173811465      H 
  -11.01114170297731   -1.04790435660323   -4.07441904061924      H 
$end
           -------------------------------------------------
          |                Final Singlepoint                |
           -------------------------------------------------

          ...................................................
          :                      SETUP                      :
          :.................................................:
          :  # basis functions                  78          :
          :  # atomic orbitals                  77          :
          :  # shells                           45          :
          :  # electrons                        74          :
          :  max. iterations                   250          :
          :  Hamiltonian                  GFN2-xTB          :
          :  restarted?                      false          :
          :  GBSA solvation                  false          :
          :  PC potential                    false          :
          :  electronic temp.          300.0000000     K    :
          :  accuracy                    1.0000000          :
          :  -> integral cutoff          0.2500000E+02      :
          :  -> integral neglect         0.1000000E-07      :
          :  -> SCF convergence          0.1000000E-05 Eh   :
          :  -> wf. convergence          0.1000000E-03 e    :
          :  Broyden damping             0.4000000          :
          ...................................................

 iter      E             dE          RMSdq      gap      omega  full diag
   1    -39.8356129 -0.398356E+02  0.875E-05    3.57       0.0  T
   2    -39.8356129 -0.360956E-11  0.433E-05    3.57     421.8  T
   3    -39.8356129  0.162430E-10  0.480E-05    3.57     380.5  T

   *** convergence criteria satisfied after 3 iterations ***

         #    Occupation            Energy/Eh            Energy/eV
      -------------------------------------------------------------
         1        2.0000           -0.7209562             -19.6182
       ...           ...                  ...                  ...
        31        2.0000           -0.4353596             -11.8467
        32        2.0000           -0.4218161             -11.4782
        33        2.0000           -0.4186657             -11.3925
        34        2.0000           -0.4155289             -11.3071
        35        2.0000           -0.3837420             -10.4422
        36        2.0000           -0.3788462             -10.3089
        37        2.0000           -0.3773417             -10.2680 (HOMO)
        38                         -0.2460581              -6.6956 (LUMO)
        39                         -0.2333319              -6.3493
        40                         -0.1930137              -5.2522
        41                         -0.1586025              -4.3158
        42                         -0.1447358              -3.9385
       ...                                ...                  ...
        77                          0.6941520              18.8888
      -------------------------------------------------------------
                  HL-Gap            0.1312836 Eh            3.5724 eV
             Fermi-level           -0.3116999 Eh           -8.4818 eV

 SCC (total)                   0 d,  0 h,  0 min,  0.031 sec
 SCC setup                      ...        0 min,  0.000 sec (  0.698%)
 Dispersion                     ...        0 min,  0.000 sec (  0.746%)
 integral evaluation            ...        0 min,  0.010 sec ( 32.689%)
 zeroth order Hamiltonian       ...        0 min,  0.000 sec (  0.550%)
 iterations                     ...        0 min,  0.004 sec ( 13.054%)
 molecular gradient             ...        0 min,  0.016 sec ( 51.001%)
 printout                       ...        0 min,  0.000 sec (  1.123%)

         :::::::::::::::::::::::::::::::::::::::::::::::::::::
         ::                     SUMMARY                     ::
         :::::::::::::::::::::::::::::::::::::::::::::::::::::
         :: total energy             -39.196406042745 Eh    ::
         :: gradient norm              0.000986175592 Eh/a0 ::
         :: HOMO-LUMO gap              3.572409541100 eV    ::
         ::.................................................::
         :: SCC energy               -39.835612904374 Eh    ::
         :: -> isotropic ES            0.004160640582 Eh    ::
         :: -> anisotropic ES          0.005527005693 Eh    ::
         :: -> anisotropic XC          0.023525574655 Eh    ::
         :: -> dispersion             -0.032905869049 Eh    ::
         :: repulsion energy           0.638787583725 Eh    ::
         :: add. restraining           0.000000000000 Eh    ::
         :::::::::::::::::::::::::::::::::::::::::::::::::::::

           -------------------------------------------------
          |                Property Printout                |
           -------------------------------------------------

    * Orbital Energies and Occupations

         #    Occupation            Energy/Eh            Energy/eV
      -------------------------------------------------------------
         1        2.0000           -0.7209562             -19.6182
       ...           ...                  ...                  ...
        25        2.0000           -0.4629435             -12.5973
        26        2.0000           -0.4558917             -12.4054
        27        2.0000           -0.4493519             -12.2275
        28        2.0000           -0.4490798             -12.2201
        29        2.0000           -0.4447386             -12.1020
        30        2.0000           -0.4412073             -12.0059
        31        2.0000           -0.4353596             -11.8467
        32        2.0000           -0.4218161             -11.4782
        33        2.0000           -0.4186657             -11.3925
        34        2.0000           -0.4155289             -11.3071
        35        2.0000           -0.3837420             -10.4422
        36        2.0000           -0.3788462             -10.3089
        37        2.0000           -0.3773417             -10.2680 (HOMO)
        38                         -0.2460581              -6.6956 (LUMO)
        39                         -0.2333319              -6.3493
        40                         -0.1930137              -5.2522
        41                         -0.1586025              -4.3158
        42                         -0.1447358              -3.9385
        43                         -0.1054568              -2.8696
        44                          0.0070226               0.1911
        45                          0.0388956               1.0584
        46                          0.0435061               1.1839
        47                          0.0612636               1.6671
        48                          0.0767013               2.0871
       ...                                ...                  ...
        77                          0.6941520              18.8888
      -------------------------------------------------------------
                  HL-Gap            0.1312836 Eh            3.5724 eV
             Fermi-level           -0.3116999 Eh           -8.4818 eV

     #   Z        covCN         q      C6AA      α(0)
     1   6 C      2.941    -0.034    28.850     8.809
     2  16 S      2.291    -0.057   143.403    20.155
     3   6 C      2.941    -0.036    28.895     8.816
     4   6 C      3.162    -0.004    27.799     8.618
     5   6 C      3.164    -0.004    27.772     8.613
     6   6 C      3.809    -0.058    21.606     6.617
     7   6 C      3.857    -0.009    20.695     6.470
     8   6 C      3.754    -0.103    22.523     6.767
     9   6 C      3.860    -0.024    20.953     6.510
    10   6 C      3.807    -0.056    21.571     6.612
    11   6 C      2.945     0.014    27.690     8.631
    12   6 C      2.852    -0.094    30.362     9.031
    13   6 C      2.902    -0.032    28.808     8.801
    14   6 C      2.836    -0.089    30.215     9.008
    15   1 H      0.926     0.035     2.510     2.477
    16   1 H      0.926     0.035     2.519     2.482
    17   1 H      0.924     0.042     2.428     2.437
    18   1 H      0.924     0.037     2.491     2.468
    19   1 H      0.924     0.029     2.596     2.520
    20   1 H      0.925     0.041     2.429     2.437
    21   1 H      0.925     0.032     2.563     2.504
    22   1 H      0.925     0.033     2.539     2.492
    23   1 H      0.924     0.039     2.457     2.451
    24   1 H      0.924     0.040     2.449     2.447
    25   1 H      0.924     0.042     2.427     2.436
    26   1 H      0.926     0.042     2.425     2.435
    27   1 H      0.926     0.032     2.556     2.500
    28   1 H      0.925     0.034     2.526     2.485
    29   1 H      0.926     0.037     2.493     2.469
    30   1 H      0.926     0.034     2.530     2.487

 Mol. C6AA /au·bohr⁶  :      10648.205244
 Mol. C8AA /au·bohr⁸  :     276982.999074
 Mol. α(0) /au        :        162.984239


Wiberg/Mayer (AO) data.
largest (>0.10) Wiberg bond orders for each atom
          total WBO             WBO to atom ...
     1  C   3.942        C    5 1.609    S    2 1.179    H   15 0.971    C    3 0.120
     2  S   2.616        C    3 1.180    C    1 1.179
     3  C   3.941        C    4 1.606    S    2 1.180    H   16 0.971    C    1 0.120
     4  C   3.986        C    3 1.606    C    5 1.216    C   10 1.009
     5  C   3.986        C    1 1.609    C    4 1.216    C    6 1.010
     6  C   3.998        C    5 1.010    C    7 0.993    H   18 0.969    H   17 0.956
     7  C   3.995        C    8 1.008    C    6 0.993    C    9 0.967    H   19 0.967
     8  C   3.996        C    7 1.008    H   21 0.986    H   22 0.986    H   20 0.985
     9  C   3.995        C   11 0.997    C   10 0.991    C    7 0.967    H   23 0.956
    10  C   3.998        C    4 1.009    C    9 0.991    H   24 0.966    H   25 0.960
    11  C   3.988        C   12 1.845    C   13 1.093    C    9 0.997
    12  C   3.991        C   11 1.845    H   27 0.975    H   26 0.973    C   14 0.134
    13  C   3.991        C   14 1.896    C   11 1.093    H   28 0.963
    14  C   3.992        C   13 1.896    H   30 0.978    H   29 0.972    C   12 0.134
    15  H   0.999        C    1 0.971
    16  H   0.999        C    3 0.971
    17  H   0.998        C    6 0.956
    18  H   0.998        C    6 0.969
    19  H   0.998        C    7 0.967
    20  H   0.998        C    8 0.985
    21  H   0.999        C    8 0.986
    22  H   0.998        C    8 0.986
    23  H   0.998        C    9 0.956
    24  H   0.998        C   10 0.966
    25  H   0.998        C   10 0.960
    26  H   0.998        C   12 0.973
    27  H   0.998        C   12 0.975
    28  H   0.998        C   13 0.963
    29  H   0.999        C   14 0.972
    30  H   0.998        C   14 0.978

molecular dipole:
                 x           y           z       tot (Debye)
 q only:       -0.478      -0.002       0.080
   full:       -0.740      -0.005       0.035       1.882
molecular quadrupole (traceless):
                xx          xy          yy          xz          yz          zz
 q only:       -1.489      -0.515       1.440      -1.298      -0.774       0.049
  q+dip:       -2.271      -1.146       1.305      -1.742      -1.167       0.966
   full:       -3.711      -0.871       2.797      -1.570      -1.190       0.914

           -------------------------------------------------
          |                Geometry Summary                 |
           -------------------------------------------------

      molecular mass/u    :      204.3294000
   center of mass at/Å    :       -0.8125130      -0.0668581      -0.2619111
  moments of inertia/u·Å² :        0.3889950E+03   0.1261211E+04   0.1381151E+04
rotational constants/cm⁻¹ :        0.4333637E-01   0.1336623E-01   0.1220549E-01

 * 28 selected distances

     #   Z        #   Z                                     value/Å
     1   6 C      2  16 S                                 1.7214639 (max)
     2  16 S      3   6 C                                 1.7211940
     3   6 C      4   6 C                                 1.3587271
     1   6 C      5   6 C                                 1.3577714
     4   6 C      5   6 C                                 1.4240681
     5   6 C      6   6 C                                 1.4940130
     6   6 C      7   6 C                                 1.5313512
     7   6 C      8   6 C                                 1.5272831
     4   6 C     10   6 C                                 1.4961228
     9   6 C     10   6 C                                 1.5338998
    11   6 C     12   6 C                                 1.3334224
    13   6 C     14   6 C                                 1.3281421
     1   6 C     15   1 H                                 1.0719023 (min)
     3   6 C     16   1 H                                 1.0720358
     6   6 C     17   1 H                                 1.0947642
     6   6 C     18   1 H                                 1.0921048
     7   6 C     19   1 H                                 1.0956386
     8   6 C     20   1 H                                 1.0869810
     8   6 C     21   1 H                                 1.0884105
     8   6 C     22   1 H                                 1.0879866
     9   6 C     23   1 H                                 1.0948107
    10   6 C     24   1 H                                 1.0927751
    10   6 C     25   1 H                                 1.0945549
    12   6 C     26   1 H                                 1.0754729
    12   6 C     27   1 H                                 1.0779943
    13   6 C     28   1 H                                 1.0837187
    14   6 C     29   1 H                                 1.0765574
    14   6 C     30   1 H                                 1.0766797

 * 3 distinct bonds (by element types)

   Z      Z             #   av. dist./Å        max./Å        min./Å
   1 H    6 C          16     1.0851492     1.0956386     1.0719023
   6 C    6 C          10     1.4384801     1.5338998     1.3281421
   6 C   16 S           2     1.7213290     1.7214639     1.7211940


optimized geometry written to: xtbopt.xyz


           -------------------------------------------------
          | TOTAL ENERGY              -39.196406042745 Eh   |
          | GRADIENT NORM               0.000986175592 Eh/α |
          | HOMO-LUMO GAP               3.572409541100 eV   |
           -------------------------------------------------

------------------------------------------------------------------------
 * finished run on 2021/05/19 at 10:58:10.119     
------------------------------------------------------------------------
 total:
 * wall-time:     0 d,  0 h,  0 min,  0.765 sec
 *  cpu-time:     0 d,  0 h,  0 min,  0.765 sec
 * ratio c/w:     1.000 speedup
 SCF:
 * wall-time:     0 d,  0 h,  0 min,  0.046 sec
 *  cpu-time:     0 d,  0 h,  0 min,  0.046 sec
 * ratio c/w:     1.000 speedup
 ANC optimizer:
 * wall-time:     0 d,  0 h,  0 min,  0.698 sec
 *  cpu-time:     0 d,  0 h,  0 min,  0.698 sec
 * ratio c/w:     1.000 speedup

