      -----------------------------------------------------------      
     |                   =====================                   |     
     |                           x T B                           |     
     |                   =====================                   |     
     |                         S. Grimme                         |     
     |          Mulliken Center for Theoretical Chemistry        |     
     |                    University of Bonn                     |     
     |                Version 6.2 RC2 (SAW190805)                |     
      -----------------------------------------------------------      

   This program is distributed in the hope that it will be useful,
   but WITHOUT ANY WARRANTY; without even the implied warranty of
   MERCHANTABILITY or FITNESS FOR A PARTICULAR PURPOSE.
   
   FOR NON-COMMERCIAL, ACADEMIA USE ONLY.
   
   Cite this work as:
   * S. Grimme, C. Bannwarth, P. Shushkov, J. Chem. Theory Comput., 2017,
     13, 1989-2009. DOI: 10.1021/acs.jctc.7b00118
   * C. Bannwarth, S. Ehlert and S. Grimme., J. Chem. Theory Comput., 2019,
     15, 1652-1671. DOI: 10.1021/acs.jctc.8b01176
   * P. Pracht, E. Caldeweyher, S. Ehlert, S. Grimme, ChemRxiv, 2019, preprint.
     DOI: 10.26434/chemrxiv.8326202.v1
   
   for DFT-D4:
   * E. Caldeweyher, C. Bannwarth and S. Grimme, J. Chem. Phys., 2017,
     147, 034112. DOI: 10.1063/1.4993215
   * E. Caldeweyher, S. Ehlert, A. Hansen, H. Neugebauer, S. Spicher,
     C. Bannwarth and S. Grimme, J. Chem. Phys., 2019, 150, 154122.
     DOI: 10.1063/1.5090222
   
   for sTDA-xTB:
   * S. Grimme and C. Bannwarth, J. Chem. Phys., 2016, 145, 054103.
     DOI: 10.1063/1.4959605
   
   in the mass-spec context:
   * V. Asgeirsson, C. Bauer and S. Grimme, Chem. Sci., 2017, 8, 4879.
     DOI: 10.1039/c7sc00601b
   
   for metadynamics refer to:
   * S. Grimme, J. Chem. Theory Comput., 2019, 155, 2847-2862
     DOI: 10.1021/acs.jctc.9b00143
   
   with help from (in alphabetical order)
   C. Bannwarth, F. Bohle, G. Brandenburg, E. Caldeweyher, M. Checinski,
   S. Dohm, S. Ehlert, S. Ehrlich, F. März, H. Neugebauer, J. Pisarek,
   P. Pracht, P. Shushkov, and S. Spicher.
   
 * started run on 2021/05/19 at 10:58:46.113     

           -------------------------------------------------
          |                Calculation Setup                |
           -------------------------------------------------

          program call               : /ihome/ghutchison/geoffh/xtb/xtb 120.xyz -opt
          hostname                   : smp-n83
          coordinate file            : 120.xyz
          omp threads                :                     1
          number of atoms            :                    29
          number of electrons        :                    70
          charge                     :                     0
          spin                       :                   0.0
          first test random number   :      0.91562711812011


########################################################################
# WARNING! Please study the warnings concerning your input carefully
#  - the use of '-opt' is discouraged, please use '--opt' next time
########################################################################

           ------------------------------------------------- 
          |                 G F N 2 - x T B                 |
          | Geometry, Frequencies, Noncovalent interactions |
          |            JCTC 2019 parametrisation            |
           ------------------------------------------------- 
             KAB for C  - Si     :                1.0500
             KAB for H  - Pd     :                0.9500
             k(s)              :                1.8500
             k(p)              :                2.2300
             k(d)              :                2.2300
             k(f)              :                2.0000
             kEN (H0ij)        :               -2.0000
             D4 a1             :                0.5200
             D4 a2             :                5.0000
             D4 s6             :                1.0000
             D4 s8             :                2.7000
             D4 s9             :                5.0000
             alphaj            :                2.0000

  Z AO/shell   Hii/eV     exponent
  1     Wed Apr 25 08:07:45 CEST 2018   EN: 2.200 GM2: 0.406  GM3: 0.0800  RAES: 1.40
     1s    -10.707211    1.230000
  6     Wed Apr 25 08:07:45 CEST 2018   EN: 2.550 GM2: 0.538  GM3: 0.1500  RAES: 3.00
     2s    -13.970922    2.096432
     2p    -10.063292    1.800000
 16     Tue Apr 24 11:44:34 CEST 2018   EN: 2.580 GM2: 0.340  GM3:-0.0502  RAES: 3.10
     3s    -20.029654    1.981333
     3p    -11.377694    2.025643
     3d     -0.420282    1.702555

           ------------------------------------------------- 
          |        Self-Consistent Charge Iterations        |
           ------------------------------------------------- 

          ...................................................
          :                      SETUP                      :
          :.................................................:
          :  # basis functions                  74          :
          :  # atomic orbitals                  73          :
          :  # shells                           43          :
          :  # electrons                        70          :
          :  max. iterations                   250          :
          :  Hamiltonian                  GFN2-xTB          :
          :  restarted?                      false          :
          :  GBSA solvation                  false          :
          :  PC potential                    false          :
          :  electronic temp.          300.0000000     K    :
          :  accuracy                    1.0000000          :
          :  -> integral cutoff          0.2500000E+02      :
          :  -> integral neglect         0.1000000E-07      :
          :  -> SCF convergence          0.1000000E-05 Eh   :
          :  -> wf. convergence          0.1000000E-03 e    :
          :  Broyden damping             0.4000000          :
          ...................................................

 iter      E             dE          RMSdq      gap      omega  full diag
   1    -37.5875494 -0.375875E+02  0.356E+00    2.95       0.0  T
   2    -37.6327155 -0.451661E-01  0.201E+00    3.02       1.0  T
   3    -37.6307214  0.199408E-02  0.793E-01    2.98       1.0  T
   4    -37.6321385 -0.141705E-02  0.431E-01    3.00       1.0  T
   5    -37.6359205 -0.378204E-02  0.113E-01    2.99       1.0  T
   6    -37.6360015 -0.809834E-04  0.362E-02    2.99       1.0  T
   7    -37.6360157 -0.142119E-04  0.173E-02    2.99       1.1  T
   8    -37.6360165 -0.720639E-06  0.980E-03    2.99       1.9  T
   9    -37.6360177 -0.122968E-05  0.423E-03    2.99       4.4  T
  10    -37.6360178 -0.155947E-06  0.193E-03    2.99       9.6  T
  11    -37.6360179 -0.307114E-07  0.702E-04    2.99      26.5  T
  12    -37.6360179 -0.986788E-09  0.437E-04    2.99      42.5  T

   *** convergence criteria satisfied after 12 iterations ***

         #    Occupation            Energy/Eh            Energy/eV
      -------------------------------------------------------------
         1        2.0000           -0.7225624             -19.6619
       ...           ...                  ...                  ...
        29        2.0000           -0.4341511             -11.8139
        30        2.0000           -0.4280554             -11.6480
        31        2.0000           -0.4217959             -11.4777
        32        2.0000           -0.4199383             -11.4271
        33        2.0000           -0.4109920             -11.1837
        34        2.0000           -0.3792617             -10.3202
        35        2.0000           -0.3652782              -9.9397 (HOMO)
        36                         -0.2554624              -6.9515 (LUMO)
        37                         -0.1957717              -5.3272
        38                         -0.1901715              -5.1748
        39                         -0.1467958              -3.9945
        40                         -0.1049930              -2.8570
       ...                                ...                  ...
        73                          0.6719244              18.2840
      -------------------------------------------------------------
                  HL-Gap            0.1098158 Eh            2.9882 eV
             Fermi-level           -0.3103703 Eh           -8.4456 eV

 SCC (total)                   0 d,  0 h,  0 min,  0.045 sec
 SCC setup                      ...        0 min,  0.000 sec (  0.748%)
 Dispersion                     ...        0 min,  0.000 sec (  0.942%)
 integral evaluation            ...        0 min,  0.010 sec ( 23.142%)
 zeroth order Hamiltonian       ...        0 min,  0.000 sec (  0.456%)
 iterations                     ...        0 min,  0.017 sec ( 36.753%)
 molecular gradient             ...        0 min,  0.017 sec ( 36.842%)
 printout                       ...        0 min,  0.000 sec (  0.997%)

         :::::::::::::::::::::::::::::::::::::::::::::::::::::
         ::                     SUMMARY                     ::
         :::::::::::::::::::::::::::::::::::::::::::::::::::::
         :: total energy             -37.084534074186 Eh    ::
         :: gradient norm              0.048281427925 Eh/a0 ::
         :: HOMO-LUMO gap              2.988241297582 eV    ::
         ::.................................................::
         :: SCC energy               -37.636017868928 Eh    ::
         :: -> isotropic ES            0.003921753930 Eh    ::
         :: -> anisotropic ES          0.006814711588 Eh    ::
         :: -> anisotropic XC          0.021143733808 Eh    ::
         :: -> dispersion             -0.029792028875 Eh    ::
         :: repulsion energy           0.551121975126 Eh    ::
         :: add. restraining           0.000000000000 Eh    ::
         :::::::::::::::::::::::::::::::::::::::::::::::::::::

      ----------------------------------------------------------- 
     |                   =====================                   |
     |                        A N C O P T                        |
     |                   =====================                   |
     |               Approximate Normal Coordinate               |
     |                Rational Function Optimizer                |
      ----------------------------------------------------------- 

          ...................................................
          :                      SETUP                      :
          :.................................................:
          :   optimization level            normal          :
          :   max. optcycles                   200          :
          :   ANC micro-cycles                  20          :
          :   degrees of freedom                81          :
          :.................................................:
          :   RF solver                   davidson          :
          :   input Hessian                  false          :
          :   write xtbopt.log                true          :
          :   linear?                        false          :
          :   energy convergence         0.5000000E-05 Eh   :
          :   grad. convergence          0.1000000E-02 Eh/α :
          :   maximium RF displ.         2.0000000          :
          :   Hlow (freq-cutoff)         0.5000000E-02      :
          :   Hmax (freq-cutoff)         5.0000000          :
          :   S6 in model hess.         20.0000000          :
          ...................................................

generating ANC from model Hessian ...
Using Lindh-Hessian (1995)
 Shifting diagonal of input Hessian by   3.823851470419047E-003
 Lowest  eigenvalues of input Hessian
   -0.000000   -0.000000   -0.000000   -0.000000    0.000000    0.000000
    0.005000    0.006228    0.007093    0.008470    0.008888    0.009575
    0.011537    0.012326    0.012514    0.014715    0.015163    0.019505
 Highest eigenvalues
    1.408838    1.485830    1.607606    1.765555    1.806085    1.986487
 

........................................................................
.............................. CYCLE    1 ..............................
........................................................................
   1    -37.6360179 -0.376360E+02  0.189E-04    2.99       0.0  T
   2    -37.6360179 -0.692211E-10  0.151E-04    2.99     122.7  T
   3    -37.6360179 -0.243183E-09  0.864E-05    2.99     214.8  T
     SCC iter.                  ...        0 min,  0.005 sec
     gradient                   ...        0 min,  0.016 sec
 * total energy  :   -37.0845341 Eh     change       -0.2940308E-07 Eh
   gradient norm :     0.0482828 Eh/α   predicted     0.0000000E+00 (-100.00%)
   displ. norm   :     0.3154864 α      lambda       -0.6484896E-02
   maximum displ.:     0.1296767 α      in ANC's #16, #9, #20, ...

........................................................................
.............................. CYCLE    2 ..............................
........................................................................
   1    -37.6613869 -0.376614E+02  0.234E-01    3.03       0.0  T
   2    -37.6614252 -0.383250E-04  0.121E-01    3.03       1.0  T
   3    -37.6613505  0.747466E-04  0.653E-02    3.03       1.0  T
   4    -37.6614624 -0.111859E-03  0.206E-02    3.03       1.0  T
   5    -37.6614641 -0.173056E-05  0.761E-03    3.03       2.4  T
   6    -37.6614648 -0.752223E-06  0.243E-03    3.03       7.7  T
   7    -37.6614650 -0.128162E-06  0.825E-04    3.03      22.5  T
     SCC iter.                  ...        0 min,  0.009 sec
     gradient                   ...        0 min,  0.016 sec
 * total energy  :   -37.0887461 Eh     change       -0.4212007E-02 Eh
   gradient norm :     0.0187270 Eh/α   predicted    -0.3565184E-02 ( -15.36%)
   displ. norm   :     0.1991629 α      lambda       -0.1264438E-02
   maximum displ.:     0.0888671 α      in ANC's #9, #10, #3, ...

........................................................................
.............................. CYCLE    3 ..............................
........................................................................
   1    -37.6716351 -0.376716E+02  0.126E-01    3.04       0.0  T
   2    -37.6716484 -0.132811E-04  0.664E-02    3.04       1.0  T
   3    -37.6716283  0.200668E-04  0.380E-02    3.04       1.0  T
   4    -37.6716620 -0.336611E-04  0.115E-02    3.04       1.6  T
   5    -37.6716625 -0.528295E-06  0.460E-03    3.04       4.0  T
   6    -37.6716628 -0.253161E-06  0.160E-03    3.04      11.6  T
   7    -37.6716628 -0.495612E-07  0.523E-04    3.04      35.5  T
     SCC iter.                  ...        0 min,  0.009 sec
     gradient                   ...        0 min,  0.016 sec
 * total energy  :   -37.0894315 Eh     change       -0.6853491E-03 Eh
   gradient norm :     0.0046879 Eh/α   predicted    -0.6573013E-03 (  -4.09%)
   displ. norm   :     0.0987194 α      lambda       -0.1444563E-03
   maximum displ.:     0.0601816 α      in ANC's #3, #9, #10, ...

........................................................................
.............................. CYCLE    4 ..............................
........................................................................
   1    -37.6711498 -0.376711E+02  0.447E-02    3.04       0.0  T
   2    -37.6711502 -0.464003E-06  0.262E-02    3.04       1.0  T
   3    -37.6711470  0.328105E-05  0.133E-02    3.04       1.4  T
   4    -37.6711508 -0.379897E-05  0.207E-03    3.04       9.0  T
   5    -37.6711508 -0.220745E-07  0.819E-04    3.04      22.7  T
   6    -37.6711508 -0.103104E-07  0.334E-04    3.04      55.5  T
     SCC iter.                  ...        0 min,  0.008 sec
     gradient                   ...        0 min,  0.016 sec
 * total energy  :   -37.0895153 Eh     change       -0.8386761E-04 Eh
   gradient norm :     0.0025887 Eh/α   predicted    -0.7293789E-04 ( -13.03%)
   displ. norm   :     0.0966478 α      lambda       -0.8329220E-04
   maximum displ.:     0.0642372 α      in ANC's #3, #2, #1, ...

........................................................................
.............................. CYCLE    5 ..............................
........................................................................
   1    -37.6699882 -0.376700E+02  0.507E-02    3.03       0.0  T
   2    -37.6699887 -0.481296E-06  0.288E-02    3.04       1.0  T
   3    -37.6699870  0.163218E-05  0.997E-03    3.04       1.9  T
   4    -37.6699889 -0.186302E-05  0.278E-03    3.04       6.7  T
   5    -37.6699889 -0.430859E-07  0.675E-04    3.04      27.5  T
   6    -37.6699889 -0.710317E-08  0.256E-04    3.04      72.6  T
     SCC iter.                  ...        0 min,  0.008 sec
     gradient                   ...        0 min,  0.016 sec
 * total energy  :   -37.0895697 Eh     change       -0.5434794E-04 Eh
   gradient norm :     0.0019589 Eh/α   predicted    -0.4203596E-04 ( -22.65%)
   displ. norm   :     0.1449554 α      lambda       -0.5196347E-04
   maximum displ.:     0.0962582 α      in ANC's #3, #2, #1, ...

........................................................................
.............................. CYCLE    6 ..............................
........................................................................
   1    -37.6690338 -0.376690E+02  0.724E-02    3.03       0.0  T
   2    -37.6690343 -0.527695E-06  0.418E-02    3.03       1.0  T
   3    -37.6690330  0.130769E-05  0.853E-03    3.03       2.2  T
   4    -37.6690345 -0.151851E-05  0.280E-03    3.03       6.6  T
   5    -37.6690346 -0.605617E-07  0.692E-04    3.03      26.8  T
   6    -37.6690346 -0.858223E-08  0.268E-04    3.03      69.3  T
     SCC iter.                  ...        0 min,  0.008 sec
     gradient                   ...        0 min,  0.016 sec
 * total energy  :   -37.0896252 Eh     change       -0.5554184E-04 Eh
   gradient norm :     0.0027012 Eh/α   predicted    -0.2622454E-04 ( -52.78%)
   displ. norm   :     0.1154817 α      lambda       -0.5409231E-04
   maximum displ.:     0.0692457 α      in ANC's #3, #2, #1, ...

........................................................................
.............................. CYCLE    7 ..............................
........................................................................
   1    -37.6693043 -0.376693E+02  0.611E-02    3.03       0.0  T
   2    -37.6693049 -0.596417E-06  0.344E-02    3.03       1.0  T
   3    -37.6693041  0.815434E-06  0.773E-03    3.03       2.4  T
   4    -37.6693051 -0.984793E-06  0.323E-03    3.03       5.7  T
   5    -37.6693052 -0.831677E-07  0.446E-04    3.03      41.6  T
   6    -37.6693052 -0.338930E-08  0.161E-04    3.03     115.3  T
     SCC iter.                  ...        0 min,  0.008 sec
     gradient                   ...        0 min,  0.017 sec
 * total energy  :   -37.0896715 Eh     change       -0.4628391E-04 Eh
   gradient norm :     0.0025858 Eh/α   predicted    -0.2740873E-04 ( -40.78%)
   displ. norm   :     0.2278748 α      lambda       -0.9251138E-04
   maximum displ.:     0.1398513 α      in ANC's #2, #3, #1, ...

........................................................................
.............................. CYCLE    8 ..............................
........................................................................
   1    -37.6695300 -0.376695E+02  0.113E-01    3.02       0.0  T
   2    -37.6695314 -0.143162E-05  0.649E-02    3.02       1.0  T
   3    -37.6695291  0.232098E-05  0.127E-02    3.02       1.5  T
   4    -37.6695319 -0.279924E-05  0.480E-03    3.02       3.9  T
   5    -37.6695321 -0.156610E-06  0.993E-04    3.02      18.7  T
   6    -37.6695321 -0.208410E-07  0.334E-04    3.02      55.6  T
     SCC iter.                  ...        0 min,  0.008 sec
     gradient                   ...        0 min,  0.017 sec
 * total energy  :   -37.0897407 Eh     change       -0.6917625E-04 Eh
   gradient norm :     0.0030460 Eh/α   predicted    -0.4865834E-04 ( -29.66%)
   displ. norm   :     0.1964493 α      lambda       -0.6482526E-04
   maximum displ.:     0.1330280 α      in ANC's #2, #3, #1, ...

........................................................................
.............................. CYCLE    9 ..............................
........................................................................
   1    -37.6698932 -0.376699E+02  0.972E-02    3.02       0.0  T
   2    -37.6698945 -0.132896E-05  0.549E-02    3.02       1.0  T
   3    -37.6698936  0.874532E-06  0.997E-03    3.02       1.9  T
   4    -37.6698947 -0.105584E-05  0.520E-03    3.02       3.6  T
   5    -37.6698950 -0.286059E-06  0.739E-04    3.02      25.1  T
   6    -37.6698950 -0.128760E-07  0.256E-04    3.02      72.6  T
     SCC iter.                  ...        0 min,  0.008 sec
     gradient                   ...        0 min,  0.017 sec
 * total energy  :   -37.0897907 Eh     change       -0.5001267E-04 Eh
   gradient norm :     0.0027181 Eh/α   predicted    -0.3366553E-04 ( -32.69%)
   displ. norm   :     0.1610605 α      lambda       -0.5459558E-04
   maximum displ.:     0.1210938 α      in ANC's #2, #3, #1, ...

........................................................................
.............................. CYCLE   10 ..............................
........................................................................
   1    -37.6706619 -0.376707E+02  0.771E-02    3.02       0.0  T
   2    -37.6706628 -0.866439E-06  0.437E-02    3.02       1.0  T
   3    -37.6706617  0.101338E-05  0.882E-03    3.02       2.1  T
   4    -37.6706629 -0.116170E-05  0.415E-03    3.02       4.5  T
   5    -37.6706631 -0.187603E-06  0.706E-04    3.02      26.3  T
   6    -37.6706631 -0.807888E-08  0.294E-04    3.02      63.1  T
     SCC iter.                  ...        0 min,  0.021 sec
     gradient                   ...        0 min,  0.017 sec
 * total energy  :   -37.0898318 Eh     change       -0.4111592E-04 Eh
   gradient norm :     0.0012789 Eh/α   predicted    -0.2800621E-04 ( -31.88%)
   displ. norm   :     0.2686695 α      lambda       -0.3760388E-04
   maximum displ.:     0.1999748 α      in ANC's #2, #3, #1, ...

........................................................................
.............................. CYCLE   11 ..............................
........................................................................
   1    -37.6696366 -0.376696E+02  0.122E-01    3.01       0.0  T
   2    -37.6696385 -0.191232E-05  0.696E-02    3.01       1.0  T
   3    -37.6696378  0.738862E-06  0.100E-02    3.01       1.8  T
   4    -37.6696387 -0.885479E-06  0.592E-03    3.01       3.1  T
   5    -37.6696392 -0.493279E-06  0.926E-04    3.01      20.1  T
   6    -37.6696392 -0.153095E-07  0.361E-04    3.01      51.4  T
     SCC iter.                  ...        0 min,  0.008 sec
     gradient                   ...        0 min,  0.017 sec
 * total energy  :   -37.0898590 Eh     change       -0.2722307E-04 Eh
   gradient norm :     0.0028442 Eh/α   predicted    -0.1940640E-04 ( -28.71%)
   displ. norm   :     0.0678403 α      lambda       -0.3167962E-04
   maximum displ.:     0.0614037 α      in ANC's #2, #9, #7, ...

........................................................................
.............................. CYCLE   12 ..............................
........................................................................
   1    -37.6708970 -0.376709E+02  0.261E-02    3.02       0.0  T
   2    -37.6708971 -0.132640E-06  0.152E-02    3.02       1.2  T
   3    -37.6708964  0.688099E-06  0.583E-03    3.02       3.2  T
   4    -37.6708972 -0.769685E-06  0.121E-03    3.02      15.4  T
   5    -37.6708972 -0.966670E-08  0.447E-04    3.02      41.5  T
   6    -37.6708972 -0.134307E-09  0.233E-04    3.02      79.7  T
     SCC iter.                  ...        0 min,  0.008 sec
     gradient                   ...        0 min,  0.017 sec
 * total energy  :   -37.0898748 Eh     change       -0.1578967E-04 Eh
   gradient norm :     0.0016607 Eh/α   predicted    -0.1591357E-04 (   0.78%)
   displ. norm   :     0.1236836 α      lambda       -0.1571795E-04
   maximum displ.:     0.1003367 α      in ANC's #2, #3, #1, ...

........................................................................
.............................. CYCLE   13 ..............................
........................................................................
   1    -37.6706119 -0.376706E+02  0.541E-02    3.01       0.0  T
   2    -37.6706122 -0.321660E-06  0.314E-02    3.01       1.0  T
   3    -37.6706120  0.199947E-06  0.472E-03    3.01       3.9  T
   4    -37.6706123 -0.274526E-06  0.216E-03    3.01       8.6  T
   5    -37.6706123 -0.463338E-07  0.498E-04    3.01      37.3  T
   6    -37.6706123 -0.238931E-08  0.235E-04    3.01      79.0  T
     SCC iter.                  ...        0 min,  0.008 sec
     gradient                   ...        0 min,  0.016 sec
 * total energy  :   -37.0898820 Eh     change       -0.7162593E-05 Eh
   gradient norm :     0.0024141 Eh/α   predicted    -0.7914179E-05 (  10.49%)
   displ. norm   :     0.0432068 α      lambda       -0.1267518E-04
   maximum displ.:     0.0344377 α      in ANC's #2, #3, #9, ...

........................................................................
.............................. CYCLE   14 ..............................
........................................................................
   1    -37.6706879 -0.376707E+02  0.161E-02    3.01       0.0  T
   2    -37.6706879 -0.384622E-07  0.944E-03    3.01       2.0  T
   3    -37.6706876  0.278771E-06  0.355E-03    3.01       5.2  T
   4    -37.6706879 -0.313450E-06  0.411E-04    3.01      45.2  T
   5    -37.6706879 -0.443578E-09  0.197E-04    3.01      94.3  T
     SCC iter.                  ...        0 min,  0.007 sec
     gradient                   ...        0 min,  0.016 sec
 * total energy  :   -37.0898916 Eh     change       -0.9569893E-05 Eh
   gradient norm :     0.0011617 Eh/α   predicted    -0.6350207E-05 ( -33.64%)
   displ. norm   :     0.1026929 α      lambda       -0.1014085E-04
   maximum displ.:     0.0813700 α      in ANC's #2, #3, #9, ...

........................................................................
.............................. CYCLE   15 ..............................
........................................................................
   1    -37.6707625 -0.376708E+02  0.400E-02    3.01       0.0  T
   2    -37.6707627 -0.197229E-06  0.232E-02    3.01       1.0  T
   3    -37.6707620  0.701433E-06  0.604E-03    3.01       3.1  T
   4    -37.6707628 -0.806118E-06  0.144E-03    3.01      12.9  T
   5    -37.6707628 -0.126231E-07  0.480E-04    3.01      38.7  T
   6    -37.6707628 -0.247140E-08  0.184E-04    3.01     101.0  T
     SCC iter.                  ...        0 min,  0.008 sec
     gradient                   ...        0 min,  0.016 sec
 * total energy  :   -37.0898974 Eh     change       -0.5861750E-05 Eh
   gradient norm :     0.0011041 Eh/α   predicted    -0.5095415E-05 ( -13.07%)
   displ. norm   :     0.0198548 α      lambda       -0.2730651E-05
   maximum displ.:     0.0108599 α      in ANC's #2, #8, #9, ...

........................................................................
.............................. CYCLE   16 ..............................
........................................................................
   1    -37.6709978 -0.376710E+02  0.831E-03    3.02       0.0  T
   2    -37.6709979 -0.117769E-07  0.486E-03    3.02       3.8  T
   3    -37.6709977  0.108732E-06  0.251E-03    3.02       7.4  T
   4    -37.6709979 -0.124548E-06  0.267E-04    3.02      69.4  T
   5    -37.6709979 -0.745359E-10  0.146E-04    3.02     127.3  T
     SCC iter.                  ...        0 min,  0.007 sec
     gradient                   ...        0 min,  0.017 sec
 * total energy  :   -37.0898994 Eh     change       -0.2007196E-05 Eh
   gradient norm :     0.0010371 Eh/α   predicted    -0.1365934E-05 ( -31.95%)
   displ. norm   :     0.0219142 α      lambda       -0.2337906E-05
   maximum displ.:     0.0125424 α      in ANC's #2, #9, #8, ...

........................................................................
.............................. CYCLE   17 ..............................
........................................................................
   1    -37.6706575 -0.376707E+02  0.127E-02    3.01       0.0  T
   2    -37.6706575 -0.507562E-07  0.717E-03    3.01       2.6  T
   3    -37.6706574  0.154184E-06  0.278E-03    3.01       6.7  T
   4    -37.6706575 -0.176697E-06  0.807E-04    3.01      23.0  T
   5    -37.6706575 -0.397289E-08  0.238E-04    3.01      78.2  T
     SCC iter.                  ...        0 min,  0.007 sec
     gradient                   ...        0 min,  0.016 sec
 * total energy  :   -37.0899002 Eh     change       -0.7823144E-06 Eh
   gradient norm :     0.0007998 Eh/α   predicted    -0.1173982E-05 (  50.07%)
   displ. norm   :     0.0138933 α      lambda       -0.9955548E-06
   maximum displ.:     0.0094087 α      in ANC's #2, #9, #8, ...

   *** GEOMETRY OPTIMIZATION CONVERGED AFTER 17 ITERATIONS ***

------------------------------------------------------------------------
 total energy gain   :        -0.0053661 Eh       -3.3673 kcal/mol
 total RMSD          :         0.3189463 a0        0.1688 Å
 total power (kW/mol):        -0.8287510 (step)  -21.6943 (real)
------------------------------------------------------------------------

 ANCopt (total)                0 d,  0 h,  0 min,  0.649 sec
 optimizer setup                ...        0 min,  0.000 sec (  0.024%)
 model hessian                  ...        0 min,  0.016 sec (  2.398%)
 ANC generation                 ...        0 min,  0.001 sec (  0.142%)
 coordinate transformation      ...        0 min,  0.000 sec (  0.061%)
 single point calculation       ...        0 min,  0.626 sec ( 96.347%)
 optimization log               ...        0 min,  0.002 sec (  0.306%)
 hessian update                 ...        0 min,  0.000 sec (  0.042%)
 rational function              ...        0 min,  0.003 sec (  0.493%)

================
 final structure:
================
$coord
    2.92109453471290   -2.37649242209600    0.11278488684544      C 
    5.24352819537631   -0.12755139876768    0.10533592311889      S 
    3.00728863845450    2.30274356872738    0.07588038717924      C 
    0.59286326922849    1.32988920658739    0.08071186111299      C 
    0.56006233083995   -1.35418588480579    0.08992179624207      C 
   -1.80139297977714   -2.92314194806591   -0.03739047143442      C 
   -2.07482645139497   -4.04870625808432   -2.69334825362464      C 
   -4.10564890458209   -1.33645815923392    0.69622568324932      C 
   -4.07023680829792    1.23378860360599   -0.60363356261270      C 
   -1.80388877604092    2.84160278180461    0.21264530219418      C 
   -2.14986098878971    3.87384225592544    2.89890258248984      C 
    4.04030590022209    4.82219705194524    0.00645413069111      C 
    2.85602366486806    7.03904145218358   -0.10589696594484      C 
    3.42904166988854   -4.33823905549539    0.13350262380260      H 
   -1.62390217224100   -4.50055640759614    1.29523347694332      H 
   -2.17288829056379   -2.56536995579933   -4.11095355918258      H 
   -3.78184981479287   -5.18805686600531   -2.81371183370761      H 
   -0.45975457800047   -5.24123539071806   -3.13060474512583      H 
   -4.12847544492173   -1.07244627352691    2.74136812407552      H 
   -5.82633457454199   -2.35296675339838    0.18250369359577      H 
   -5.80931531502537    2.25631208772230   -0.16760973103398      H 
   -4.00453793156463    0.96340193115164   -2.64781946782254      H 
   -1.66631711405654    4.44240356162120   -1.09148220854637      H 
   -2.29533542446262    2.33626548927289    4.25289344097916      H 
   -3.85772482474573    5.01340212886305    3.01230398205996      H 
   -0.54309669606381    5.03603064486690    3.43462902888735      H 
    6.08824072414782    4.83296965966417    0.02896795917886      H 
    0.83863099084547    7.24928043541433   -0.14541144920186      H 
    3.93019584691863    8.76639318546971   -0.17236617479167      H 
$end
           -------------------------------------------------
          |                Final Singlepoint                |
           -------------------------------------------------

          ...................................................
          :                      SETUP                      :
          :.................................................:
          :  # basis functions                  74          :
          :  # atomic orbitals                  73          :
          :  # shells                           43          :
          :  # electrons                        70          :
          :  max. iterations                   250          :
          :  Hamiltonian                  GFN2-xTB          :
          :  restarted?                      false          :
          :  GBSA solvation                  false          :
          :  PC potential                    false          :
          :  electronic temp.          300.0000000     K    :
          :  accuracy                    1.0000000          :
          :  -> integral cutoff          0.2500000E+02      :
          :  -> integral neglect         0.1000000E-07      :
          :  -> SCF convergence          0.1000000E-05 Eh   :
          :  -> wf. convergence          0.1000000E-03 e    :
          :  Broyden damping             0.4000000          :
          ...................................................

 iter      E             dE          RMSdq      gap      omega  full diag
   1    -37.6706575 -0.376707E+02  0.168E-04    3.01       0.0  T
   2    -37.6706575 -0.684963E-11  0.121E-04    3.01     153.1  T
   3    -37.6706575 -0.360117E-09  0.429E-05    3.01     432.6  T

   *** convergence criteria satisfied after 3 iterations ***

         #    Occupation            Energy/Eh            Energy/eV
      -------------------------------------------------------------
         1        2.0000           -0.7213252             -19.6283
       ...           ...                  ...                  ...
        29        2.0000           -0.4340585             -11.8113
        30        2.0000           -0.4271136             -11.6224
        31        2.0000           -0.4226389             -11.5006
        32        2.0000           -0.4196577             -11.4195
        33        2.0000           -0.4106875             -11.1754
        34        2.0000           -0.3810665             -10.3693
        35        2.0000           -0.3664205              -9.9708 (HOMO)
        36                         -0.2556921              -6.9577 (LUMO)
        37                         -0.1961622              -5.3378
        38                         -0.1896172              -5.1597
        39                         -0.1389375              -3.7807
        40                         -0.1071512              -2.9157
       ...                                ...                  ...
        73                          0.6943591              18.8945
      -------------------------------------------------------------
                  HL-Gap            0.1107283 Eh            3.0131 eV
             Fermi-level           -0.3110563 Eh           -8.4643 eV

 SCC (total)                   0 d,  0 h,  0 min,  0.032 sec
 SCC setup                      ...        0 min,  0.000 sec (  0.758%)
 Dispersion                     ...        0 min,  0.000 sec (  0.759%)
 integral evaluation            ...        0 min,  0.010 sec ( 31.341%)
 zeroth order Hamiltonian       ...        0 min,  0.000 sec (  0.588%)
 iterations                     ...        0 min,  0.005 sec ( 14.177%)
 molecular gradient             ...        0 min,  0.016 sec ( 50.951%)
 printout                       ...        0 min,  0.000 sec (  1.233%)

         :::::::::::::::::::::::::::::::::::::::::::::::::::::
         ::                     SUMMARY                     ::
         :::::::::::::::::::::::::::::::::::::::::::::::::::::
         :: total energy             -37.089900207283 Eh    ::
         :: gradient norm              0.000799748131 Eh/a0 ::
         :: HOMO-LUMO gap              3.013071674448 eV    ::
         ::.................................................::
         :: SCC energy               -37.670657533850 Eh    ::
         :: -> isotropic ES            0.004169576744 Eh    ::
         :: -> anisotropic ES          0.006283650807 Eh    ::
         :: -> anisotropic XC          0.020516043479 Eh    ::
         :: -> dispersion             -0.030213971893 Eh    ::
         :: repulsion energy           0.580394288148 Eh    ::
         :: add. restraining           0.000000000000 Eh    ::
         :::::::::::::::::::::::::::::::::::::::::::::::::::::

           -------------------------------------------------
          |                Property Printout                |
           -------------------------------------------------

    * Orbital Energies and Occupations

         #    Occupation            Energy/Eh            Energy/eV
      -------------------------------------------------------------
         1        2.0000           -0.7213252             -19.6283
       ...           ...                  ...                  ...
        23        2.0000           -0.4650173             -12.6538
        24        2.0000           -0.4632414             -12.6054
        25        2.0000           -0.4528875             -12.3237
        26        2.0000           -0.4519113             -12.2971
        27        2.0000           -0.4421009             -12.0302
        28        2.0000           -0.4389298             -11.9439
        29        2.0000           -0.4340585             -11.8113
        30        2.0000           -0.4271136             -11.6224
        31        2.0000           -0.4226389             -11.5006
        32        2.0000           -0.4196577             -11.4195
        33        2.0000           -0.4106875             -11.1754
        34        2.0000           -0.3810665             -10.3693
        35        2.0000           -0.3664205              -9.9708 (HOMO)
        36                         -0.2556921              -6.9577 (LUMO)
        37                         -0.1961622              -5.3378
        38                         -0.1896172              -5.1597
        39                         -0.1389375              -3.7807
        40                         -0.1071512              -2.9157
        41                          0.0048536               0.1321
        42                          0.0392465               1.0680
        43                          0.0417142               1.1351
        44                          0.0793301               2.1587
        45                          0.0853872               2.3235
        46                          0.0939808               2.5573
       ...                                ...                  ...
        73                          0.6943591              18.8945
      -------------------------------------------------------------
                  HL-Gap            0.1107283 Eh            3.0131 eV
             Fermi-level           -0.3110563 Eh           -8.4643 eV

     #   Z        covCN         q      C6AA      α(0)
     1   6 C      2.936    -0.029    28.728     8.790
     2  16 S      2.349    -0.062   143.616    20.170
     3   6 C      2.984     0.013    27.714     8.636
     4   6 C      3.153    -0.012    28.022     8.657
     5   6 C      3.167    -0.009    27.878     8.628
     6   6 C      3.856    -0.011    20.744     6.478
     7   6 C      3.756    -0.101    22.487     6.761
     8   6 C      3.807    -0.056    21.578     6.613
     9   6 C      3.807    -0.057    21.588     6.614
    10   6 C      3.855    -0.010    20.711     6.473
    11   6 C      3.757    -0.102    22.495     6.762
    12   6 C      2.950    -0.030    28.738     8.792
    13   6 C      2.836    -0.096    30.400     9.036
    14   1 H      0.926     0.036     2.504     2.474
    15   1 H      0.924     0.029     2.604     2.524
    16   1 H      0.925     0.038     2.481     2.463
    17   1 H      0.925     0.035     2.513     2.479
    18   1 H      0.925     0.035     2.522     2.484
    19   1 H      0.924     0.034     2.537     2.491
    20   1 H      0.924     0.031     2.579     2.511
    21   1 H      0.924     0.030     2.580     2.512
    22   1 H      0.924     0.033     2.543     2.494
    23   1 H      0.924     0.034     2.532     2.488
    24   1 H      0.925     0.037     2.494     2.470
    25   1 H      0.925     0.033     2.538     2.491
    26   1 H      0.925     0.040     2.449     2.447
    27   1 H      0.925     0.040     2.450     2.448
    28   1 H      0.926     0.041     2.429     2.437
    29   1 H      0.926     0.036     2.505     2.475

 Mol. C6AA /au·bohr⁶  :       9438.605017
 Mol. C8AA /au·bohr⁸  :     243677.036739
 Mol. α(0) /au        :        152.097182


Wiberg/Mayer (AO) data.
largest (>0.10) Wiberg bond orders for each atom
          total WBO             WBO to atom ...
     1  C   3.946        C    5 1.577    S    2 1.196    H   14 0.970    C    3 0.103
     2  S   2.608        C    1 1.196    C    3 1.122
     3  C   3.943        C    4 1.498    C   12 1.137    S    2 1.122    C    1 0.103
     4  C   3.985        C    3 1.498    C    5 1.249    C   10 0.999
     5  C   3.984        C    1 1.577    C    4 1.249    C    6 0.995
     6  C   3.996        C    5 0.995    C    8 0.994    C    7 0.993    H   15 0.963
     7  C   3.996        C    6 0.993    H   18 0.987    H   17 0.985    H   16 0.985
     8  C   3.998        C    9 1.011    C    6 0.994    H   20 0.975    H   19 0.974
     9  C   3.998        C    8 1.011    C   10 0.993    H   21 0.975    H   22 0.975
    10  C   3.996        C    4 0.999    C    9 0.993    C   11 0.991    H   23 0.955
    11  C   3.996        C   10 0.991    H   25 0.985    H   24 0.984    H   26 0.984
    12  C   3.991        C   13 1.857    C    3 1.137    H   27 0.963
    13  C   3.991        C   12 1.857    H   29 0.978    H   28 0.969
    14  H   0.998        C    1 0.970
    15  H   0.999        C    6 0.963
    16  H   0.999        C    7 0.985
    17  H   0.998        C    7 0.985
    18  H   0.999        C    7 0.987
    19  H   0.999        C    8 0.974
    20  H   0.998        C    8 0.975
    21  H   0.998        C    9 0.975
    22  H   0.999        C    9 0.975
    23  H   0.999        C   10 0.955
    24  H   0.999        C   11 0.984
    25  H   0.998        C   11 0.985
    26  H   0.998        C   11 0.984
    27  H   0.998        C   12 0.963
    28  H   0.998        C   13 0.969
    29  H   0.998        C   13 0.978

molecular dipole:
                 x           y           z       tot (Debye)
 q only:       -0.500      -0.027       0.002
   full:       -0.724      -0.095      -0.008       1.857
molecular quadrupole (traceless):
                xx          xy          yy          xz          yz          zz
 q only:       -1.194      -0.080       1.824      -0.027       0.465      -0.630
  q+dip:       -2.323      -0.506       4.799      -0.036      -0.342      -2.476
   full:       -3.410      -0.340       4.119      -0.071       0.051      -0.709

           -------------------------------------------------
          |                Geometry Summary                 |
           -------------------------------------------------

      molecular mass/u    :      192.3184000
   center of mass at/Å    :        0.3348392       0.4090116       0.0357484
  moments of inertia/u·Å² :        0.5159317E+03   0.7542822E+03   0.1139560E+04
rotational constants/cm⁻¹ :        0.3267416E-01   0.2234924E-01   0.1479311E-01

 * 27 selected distances

     #   Z        #   Z                                     value/Å
     1   6 C      2  16 S                                 1.7107646
     2  16 S      3   6 C                                 1.7477251 (max)
     3   6 C      4   6 C                                 1.3774799
     1   6 C      5   6 C                                 1.3615502
     4   6 C      5   6 C                                 1.4204659
     6   6 C      7   6 C                                 1.5333154
     6   6 C      8   6 C                                 1.5305352
     8   6 C      9   6 C                                 1.5242745
     9   6 C     10   6 C                                 1.5325791
    10   6 C     11   6 C                                 1.5338103
    12   6 C     13   6 C                                 1.3313353
     1   6 C     14   1 H                                 1.0724021 (min)
     6   6 C     15   1 H                                 1.0967671
     7   6 C     16   1 H                                 1.0870063
     7   6 C     17   1 H                                 1.0879112
     7   6 C     18   1 H                                 1.0872985
     8   6 C     19   1 H                                 1.0912901
     8   6 C     20   1 H                                 1.0919479
     9   6 C     21   1 H                                 1.0922179
     9   6 C     22   1 H                                 1.0917122
    10   6 C     23   1 H                                 1.0950566
    11   6 C     24   1 H                                 1.0868889
    11   6 C     25   1 H                                 1.0881325
    11   6 C     26   1 H                                 1.0869894
    12   6 C     27   1 H                                 1.0838010
    13   6 C     28   1 H                                 1.0735434
    13   6 C     29   1 H                                 1.0769775

 * 3 distinct bonds (by element types)

   Z      Z             #   av. dist./Å        max./Å        min./Å
   1 H    6 C          16     1.0868714     1.0967671     1.0724021
   6 C    6 C           9     1.4605940     1.5338103     1.3313353
   6 C   16 S           2     1.7292448     1.7477251     1.7107646


optimized geometry written to: xtbopt.xyz


           -------------------------------------------------
          | TOTAL ENERGY              -37.089900207283 Eh   |
          | GRADIENT NORM               0.000799748131 Eh/α |
          | HOMO-LUMO GAP               3.013071674448 eV   |
           -------------------------------------------------

------------------------------------------------------------------------
 * finished run on 2021/05/19 at 10:58:46.864     
------------------------------------------------------------------------
 total:
 * wall-time:     0 d,  0 h,  0 min,  0.751 sec
 *  cpu-time:     0 d,  0 h,  0 min,  0.724 sec
 * ratio c/w:     0.964 speedup
 SCF:
 * wall-time:     0 d,  0 h,  0 min,  0.045 sec
 *  cpu-time:     0 d,  0 h,  0 min,  0.045 sec
 * ratio c/w:     1.000 speedup
 ANC optimizer:
 * wall-time:     0 d,  0 h,  0 min,  0.682 sec
 *  cpu-time:     0 d,  0 h,  0 min,  0.656 sec
 * ratio c/w:     0.962 speedup

