      -----------------------------------------------------------      
     |                   =====================                   |     
     |                           x T B                           |     
     |                   =====================                   |     
     |                         S. Grimme                         |     
     |          Mulliken Center for Theoretical Chemistry        |     
     |                    University of Bonn                     |     
     |                Version 6.2 RC2 (SAW190805)                |     
      -----------------------------------------------------------      

   This program is distributed in the hope that it will be useful,
   but WITHOUT ANY WARRANTY; without even the implied warranty of
   MERCHANTABILITY or FITNESS FOR A PARTICULAR PURPOSE.
   
   FOR NON-COMMERCIAL, ACADEMIA USE ONLY.
   
   Cite this work as:
   * S. Grimme, C. Bannwarth, P. Shushkov, J. Chem. Theory Comput., 2017,
     13, 1989-2009. DOI: 10.1021/acs.jctc.7b00118
   * C. Bannwarth, S. Ehlert and S. Grimme., J. Chem. Theory Comput., 2019,
     15, 1652-1671. DOI: 10.1021/acs.jctc.8b01176
   * P. Pracht, E. Caldeweyher, S. Ehlert, S. Grimme, ChemRxiv, 2019, preprint.
     DOI: 10.26434/chemrxiv.8326202.v1
   
   for DFT-D4:
   * E. Caldeweyher, C. Bannwarth and S. Grimme, J. Chem. Phys., 2017,
     147, 034112. DOI: 10.1063/1.4993215
   * E. Caldeweyher, S. Ehlert, A. Hansen, H. Neugebauer, S. Spicher,
     C. Bannwarth and S. Grimme, J. Chem. Phys., 2019, 150, 154122.
     DOI: 10.1063/1.5090222
   
   for sTDA-xTB:
   * S. Grimme and C. Bannwarth, J. Chem. Phys., 2016, 145, 054103.
     DOI: 10.1063/1.4959605
   
   in the mass-spec context:
   * V. Asgeirsson, C. Bauer and S. Grimme, Chem. Sci., 2017, 8, 4879.
     DOI: 10.1039/c7sc00601b
   
   for metadynamics refer to:
   * S. Grimme, J. Chem. Theory Comput., 2019, 155, 2847-2862
     DOI: 10.1021/acs.jctc.9b00143
   
   with help from (in alphabetical order)
   C. Bannwarth, F. Bohle, G. Brandenburg, E. Caldeweyher, M. Checinski,
   S. Dohm, S. Ehlert, S. Ehrlich, F. März, H. Neugebauer, J. Pisarek,
   P. Pracht, P. Shushkov, and S. Spicher.
   
 * started run on 2021/05/19 at 10:58:52.395     

           -------------------------------------------------
          |                Calculation Setup                |
           -------------------------------------------------

          program call               : /ihome/ghutchison/geoffh/xtb/xtb 127.xyz -opt
          hostname                   : smp-n83
          coordinate file            : 127.xyz
          omp threads                :                     1
          number of atoms            :                    20
          number of electrons        :                    66
          charge                     :                     0
          spin                       :                   0.0
          first test random number   :      0.46636365337340


########################################################################
# WARNING! Please study the warnings concerning your input carefully
#  - the use of '-opt' is discouraged, please use '--opt' next time
########################################################################

           ------------------------------------------------- 
          |                 G F N 2 - x T B                 |
          | Geometry, Frequencies, Noncovalent interactions |
          |            JCTC 2019 parametrisation            |
           ------------------------------------------------- 
             KAB for C  - Si     :                1.0500
             KAB for H  - Pd     :                0.9500
             k(s)              :                1.8500
             k(p)              :                2.2300
             k(d)              :                2.2300
             k(f)              :                2.0000
             kEN (H0ij)        :               -2.0000
             D4 a1             :                0.5200
             D4 a2             :                5.0000
             D4 s6             :                1.0000
             D4 s8             :                2.7000
             D4 s9             :                5.0000
             alphaj            :                2.0000

  Z AO/shell   Hii/eV     exponent
  1     Wed Apr 25 08:07:45 CEST 2018   EN: 2.200 GM2: 0.406  GM3: 0.0800  RAES: 1.40
     1s    -10.707211    1.230000
  6     Wed Apr 25 08:07:45 CEST 2018   EN: 2.550 GM2: 0.538  GM3: 0.1500  RAES: 3.00
     2s    -13.970922    2.096432
     2p    -10.063292    1.800000
  7     Wed Apr 25 08:07:45 CEST 2018   EN: 3.040 GM2: 0.461  GM3:-0.0640  RAES: 1.90
     2s    -16.686243    2.339881
     2p    -12.523956    2.014332
  8     Wed Apr 25 08:07:45 CEST 2018   EN: 3.440 GM2: 0.452  GM3:-0.0517  RAES: 1.80
     2s    -20.229985    2.439742
     2p    -15.503117    2.137023

           ------------------------------------------------- 
          |        Self-Consistent Charge Iterations        |
           ------------------------------------------------- 

          ...................................................
          :                      SETUP                      :
          :.................................................:
          :  # basis functions                  62          :
          :  # atomic orbitals                  62          :
          :  # shells                           34          :
          :  # electrons                        66          :
          :  max. iterations                   250          :
          :  Hamiltonian                  GFN2-xTB          :
          :  restarted?                      false          :
          :  GBSA solvation                  false          :
          :  PC potential                    false          :
          :  electronic temp.          300.0000000     K    :
          :  accuracy                    1.0000000          :
          :  -> integral cutoff          0.2500000E+02      :
          :  -> integral neglect         0.1000000E-07      :
          :  -> SCF convergence          0.1000000E-05 Eh   :
          :  -> wf. convergence          0.1000000E-03 e    :
          :  Broyden damping             0.4000000          :
          ...................................................

 iter      E             dE          RMSdq      gap      omega  full diag
   1    -36.9266954 -0.369267E+02  0.559E+00    1.25       0.0  T
   2    -36.9589580 -0.322626E-01  0.337E+00    1.15       1.0  T
   3    -36.9192307  0.397273E-01  0.236E+00    1.15       1.0  T
   4    -36.9629137 -0.436831E-01  0.913E-01    1.11       1.0  T
   5    -36.9773506 -0.144368E-01  0.359E-01    1.19       1.0  T
   6    -36.9795222 -0.217161E-02  0.143E-01    1.16       1.0  T
   7    -36.9797781 -0.255908E-03  0.583E-02    1.16       1.0  T
   8    -36.9798222 -0.441031E-04  0.287E-02    1.17       1.0  T
   9    -36.9798286 -0.641442E-05  0.829E-03    1.16       2.7  T
  10    -36.9798292 -0.597461E-06  0.324E-03    1.16       6.9  T
  11    -36.9798292 -0.137528E-07  0.137E-03    1.17      16.3  T
  12    -36.9798292 -0.162937E-07  0.708E-04    1.17      31.6  T
  13    -36.9798292 -0.158830E-08  0.318E-04    1.17      70.4  T

   *** convergence criteria satisfied after 13 iterations ***

         #    Occupation            Energy/Eh            Energy/eV
      -------------------------------------------------------------
         1        2.0000           -0.7224603             -19.6591
       ...           ...                  ...                  ...
        27        2.0000           -0.4578627             -12.4591
        28        2.0000           -0.4447698             -12.1028
        29        2.0000           -0.4418320             -12.0229
        30        2.0000           -0.4189810             -11.4011
        31        2.0000           -0.4143508             -11.2751
        32        2.0000           -0.4100503             -11.1580
        33        2.0000           -0.4051905             -11.0258 (HOMO)
        34                         -0.3623752              -9.8607 (LUMO)
        35                         -0.3129285              -8.5152
        36                         -0.2604276              -7.0866
        37                         -0.2261894              -6.1549
        38                         -0.1784140              -4.8549
       ...                                ...                  ...
        62                          0.8022949              21.8316
      -------------------------------------------------------------
                  HL-Gap            0.0428152 Eh            1.1651 eV
             Fermi-level           -0.3837800 Eh          -10.4432 eV

 SCC (total)                   0 d,  0 h,  0 min,  0.034 sec
 SCC setup                      ...        0 min,  0.000 sec (  0.817%)
 Dispersion                     ...        0 min,  0.000 sec (  0.976%)
 integral evaluation            ...        0 min,  0.008 sec ( 23.386%)
 zeroth order Hamiltonian       ...        0 min,  0.000 sec (  0.478%)
 iterations                     ...        0 min,  0.013 sec ( 39.493%)
 molecular gradient             ...        0 min,  0.011 sec ( 33.687%)
 printout                       ...        0 min,  0.000 sec (  0.999%)

         :::::::::::::::::::::::::::::::::::::::::::::::::::::
         ::                     SUMMARY                     ::
         :::::::::::::::::::::::::::::::::::::::::::::::::::::
         :: total energy             -36.385846191107 Eh    ::
         :: gradient norm              0.121749695312 Eh/a0 ::
         :: HOMO-LUMO gap              1.165061883263 eV    ::
         ::.................................................::
         :: SCC energy               -36.979829240555 Eh    ::
         :: -> isotropic ES            0.040115511459 Eh    ::
         :: -> anisotropic ES          0.003451344723 Eh    ::
         :: -> anisotropic XC          0.026785862909 Eh    ::
         :: -> dispersion             -0.020377540912 Eh    ::
         :: repulsion energy           0.594033006730 Eh    ::
         :: add. restraining           0.000000000000 Eh    ::
         :::::::::::::::::::::::::::::::::::::::::::::::::::::

      ----------------------------------------------------------- 
     |                   =====================                   |
     |                        A N C O P T                        |
     |                   =====================                   |
     |               Approximate Normal Coordinate               |
     |                Rational Function Optimizer                |
      ----------------------------------------------------------- 

          ...................................................
          :                      SETUP                      :
          :.................................................:
          :   optimization level            normal          :
          :   max. optcycles                   200          :
          :   ANC micro-cycles                  20          :
          :   degrees of freedom                54          :
          :.................................................:
          :   RF solver                   davidson          :
          :   input Hessian                  false          :
          :   write xtbopt.log                true          :
          :   linear?                        false          :
          :   energy convergence         0.5000000E-05 Eh   :
          :   grad. convergence          0.1000000E-02 Eh/α :
          :   maximium RF displ.         2.0000000          :
          :   Hlow (freq-cutoff)         0.5000000E-02      :
          :   Hmax (freq-cutoff)         5.0000000          :
          :   S6 in model hess.         20.0000000          :
          ...................................................

generating ANC from model Hessian ...
Using Lindh-Hessian (1995)
 Shifting diagonal of input Hessian by   3.012429545419209E-003
 Lowest  eigenvalues of input Hessian
   -0.000000   -0.000000    0.000000    0.000000    0.000000    0.000000
    0.005000    0.007291    0.009558    0.010736    0.015198    0.015742
    0.028843    0.030544    0.038608    0.047853    0.049692    0.068533
 Highest eigenvalues
    1.928227    2.032446    2.063209    2.186341    2.313368    2.389912
 

........................................................................
.............................. CYCLE    1 ..............................
........................................................................
   1    -36.9798292 -0.369798E+02  0.888E-05    1.17       0.0  T
   2    -36.9798292  0.251248E-10  0.784E-05    1.17     285.1  T
   3    -36.9798292 -0.117105E-09  0.393E-05    1.17     569.7  T
     SCC iter.                  ...        0 min,  0.004 sec
     gradient                   ...        0 min,  0.011 sec
 * total energy  :   -36.3858462 Eh     change        0.1015201E-07 Eh
   gradient norm :     0.1217504 Eh/α   predicted     0.0000000E+00 (-100.00%)
   displ. norm   :     0.2592319 α      lambda       -0.1903008E-01
   maximum displ.:     0.1352368 α      in ANC's #22, #19, #8, ...

........................................................................
.............................. CYCLE    2 ..............................
........................................................................
   1    -36.9743665 -0.369744E+02  0.219E-01    1.10       0.0  T
   2    -36.9744108 -0.442372E-04  0.159E-01    1.10       1.0  T
   3    -36.9744169 -0.609474E-05  0.107E-01    1.10       1.0  T
   4    -36.9745450 -0.128141E-03  0.417E-02    1.10       1.0  T
   5    -36.9745646 -0.196453E-04  0.228E-02    1.10       1.0  T
   6    -36.9745734 -0.874143E-05  0.103E-02    1.10       2.2  T
   7    -36.9745748 -0.140554E-05  0.328E-03    1.10       6.8  T
   8    -36.9745749 -0.895972E-07  0.128E-03    1.10      17.5  T
     SCC iter.                  ...        0 min,  0.008 sec
     gradient                   ...        0 min,  0.010 sec
 * total energy  :   -36.3981744 Eh     change       -0.1232823E-01 Eh
   gradient norm :     0.0446402 Eh/α   predicted    -0.1015446E-01 ( -17.63%)
   displ. norm   :     0.1502715 α      lambda       -0.3194761E-02
   maximum displ.:     0.0833509 α      in ANC's #3, #10, #22, ...

........................................................................
.............................. CYCLE    3 ..............................
........................................................................
   1    -36.9721110 -0.369721E+02  0.108E-01    1.07       0.0  T
   2    -36.9721209 -0.992240E-05  0.742E-02    1.07       1.0  T
   3    -36.9721111  0.979378E-05  0.498E-02    1.07       1.0  T
   4    -36.9721429 -0.317834E-04  0.204E-02    1.07       1.1  T
   5    -36.9721499 -0.702235E-05  0.588E-03    1.07       3.8  T
   6    -36.9721500 -0.584566E-07  0.372E-03    1.07       6.0  T
   7    -36.9721501 -0.136238E-06  0.246E-03    1.07       9.1  T
     SCC iter.                  ...        0 min,  0.007 sec
     gradient                   ...        0 min,  0.010 sec
 * total energy  :   -36.4000207 Eh     change       -0.1846327E-02 Eh
   gradient norm :     0.0158944 Eh/α   predicted    -0.1633452E-02 ( -11.53%)
   displ. norm   :     0.0846350 α      lambda       -0.3087229E-03
   maximum displ.:     0.0681273 α      in ANC's #3, #10, #2, ...

........................................................................
.............................. CYCLE    4 ..............................
........................................................................
   1    -36.9711762 -0.369712E+02  0.429E-02    1.06       0.0  T
   2    -36.9711760  0.225567E-06  0.277E-02    1.06       1.0  T
   3    -36.9711669  0.910825E-05  0.275E-02    1.06       1.0  T
   4    -36.9711785 -0.116766E-04  0.101E-02    1.06       2.2  T
   5    -36.9711805 -0.192810E-05  0.216E-03    1.06      10.4  T
   6    -36.9711806 -0.921388E-07  0.798E-04    1.06      28.0  T
     SCC iter.                  ...        0 min,  0.006 sec
     gradient                   ...        0 min,  0.011 sec
 * total energy  :   -36.4002341 Eh     change       -0.2133466E-03 Eh
   gradient norm :     0.0081142 Eh/α   predicted    -0.1554686E-03 ( -27.13%)
   displ. norm   :     0.0775715 α      lambda       -0.1268275E-03
   maximum displ.:     0.0612435 α      in ANC's #3, #2, #1, ...

........................................................................
.............................. CYCLE    5 ..............................
........................................................................
   1    -36.9712941 -0.369713E+02  0.423E-02    1.06       0.0  T
   2    -36.9712928  0.130346E-05  0.272E-02    1.06       1.0  T
   3    -36.9712811  0.116639E-04  0.306E-02    1.06       1.0  T
   4    -36.9712967 -0.156254E-04  0.681E-03    1.06       3.3  T
   5    -36.9712975 -0.771627E-06  0.244E-03    1.06       9.2  T
   6    -36.9712976 -0.108535E-06  0.670E-04    1.06      33.4  T
     SCC iter.                  ...        0 min,  0.006 sec
     gradient                   ...        0 min,  0.010 sec
 * total energy  :   -36.4003086 Eh     change       -0.7456250E-04 Eh
   gradient norm :     0.0020697 Eh/α   predicted    -0.6379610E-04 ( -14.44%)
   displ. norm   :     0.0331454 α      lambda       -0.1413153E-04
   maximum displ.:     0.0203373 α      in ANC's #3, #1, #2, ...

........................................................................
.............................. CYCLE    6 ..............................
........................................................................
   1    -36.9717346 -0.369717E+02  0.181E-02    1.06       0.0  T
   2    -36.9717344  0.145077E-06  0.111E-02    1.06       2.0  T
   3    -36.9717316  0.284162E-05  0.130E-02    1.06       1.7  T
   4    -36.9717348 -0.317285E-05  0.202E-03    1.06      11.1  T
   5    -36.9717348 -0.767092E-07  0.918E-04    1.06      24.4  T
   6    -36.9717348 -0.166662E-07  0.261E-04    1.06      85.8  T
     SCC iter.                  ...        0 min,  0.006 sec
     gradient                   ...        0 min,  0.011 sec
 * total energy  :   -36.4003182 Eh     change       -0.9516317E-05 Eh
   gradient norm :     0.0010444 Eh/α   predicted    -0.7073827E-05 ( -25.67%)
   displ. norm   :     0.0501134 α      lambda       -0.7253956E-05
   maximum displ.:     0.0307582 α      in ANC's #1, #2, #3, ...

........................................................................
.............................. CYCLE    7 ..............................
........................................................................
   1    -36.9721435 -0.369721E+02  0.287E-02    1.06       0.0  T
   2    -36.9721434  0.704244E-07  0.170E-02    1.06       1.3  T
   3    -36.9721392  0.420120E-05  0.146E-02    1.05       1.5  T
   4    -36.9721436 -0.442700E-05  0.210E-03    1.06      10.7  T
   5    -36.9721437 -0.916486E-07  0.803E-04    1.06      27.8  T
   6    -36.9721438 -0.107423E-07  0.350E-04    1.06      63.9  T
     SCC iter.                  ...        0 min,  0.006 sec
     gradient                   ...        0 min,  0.011 sec
 * total energy  :   -36.4003249 Eh     change       -0.6687809E-05 Eh
   gradient norm :     0.0014440 Eh/α   predicted    -0.3634701E-05 ( -45.65%)
   displ. norm   :     0.0413569 α      lambda       -0.5018765E-05
   maximum displ.:     0.0293244 α      in ANC's #1, #2, #3, ...

........................................................................
.............................. CYCLE    8 ..............................
........................................................................
   1    -36.9720807 -0.369721E+02  0.215E-02    1.05       0.0  T
   2    -36.9720807 -0.309931E-07  0.127E-02    1.05       1.8  T
   3    -36.9720800  0.688895E-06  0.554E-03    1.05       4.0  T
   4    -36.9720807 -0.690559E-06  0.134E-03    1.05      16.6  T
   5    -36.9720807 -0.396824E-07  0.361E-04    1.05      61.9  T
   6    -36.9720807 -0.170586E-08  0.187E-04    1.05     119.8  T
     SCC iter.                  ...        0 min,  0.006 sec
     gradient                   ...        0 min,  0.011 sec
 * total energy  :   -36.4003302 Eh     change       -0.5327974E-05 Eh
   gradient norm :     0.0011050 Eh/α   predicted    -0.2511487E-05 ( -52.86%)
   displ. norm   :     0.0424122 α      lambda        0.1054115E-06
   maximum displ.:     0.0307949 α      in ANC's #1, #2, #3, ...

........................................................................
.............................. CYCLE    9 ..............................
........................................................................
   1    -36.9719733 -0.369720E+02  0.220E-02    1.05       0.0  T
   2    -36.9719733 -0.288664E-07  0.130E-02    1.05       1.7  T
   3    -36.9719725  0.796301E-06  0.600E-03    1.05       3.7  T
   4    -36.9719733 -0.804904E-06  0.128E-03    1.05      17.5  T
   5    -36.9719734 -0.359453E-07  0.346E-04    1.05      64.7  T
   6    -36.9719734 -0.142109E-08  0.173E-04    1.05     129.4  T
     SCC iter.                  ...        0 min,  0.006 sec
     gradient                   ...        0 min,  0.011 sec
 * total energy  :   -36.4003311 Eh     change       -0.9603265E-06 Eh
   gradient norm :     0.0014761 Eh/α   predicted     0.4794297E-07 (-104.99%)
   displ. norm   :     0.0315487 α      lambda       -0.6540582E-05
   maximum displ.:     0.0214855 α      in ANC's #1, #2, #9, ...

........................................................................
.............................. CYCLE   10 ..............................
........................................................................
   1    -36.9717313 -0.369717E+02  0.203E-02    1.05       0.0  T
   2    -36.9717312  0.379485E-07  0.122E-02    1.05       1.8  T
   3    -36.9717288  0.243476E-05  0.110E-02    1.05       2.0  T
   4    -36.9717313 -0.254074E-05  0.135E-03    1.05      16.6  T
   5    -36.9717314 -0.355926E-07  0.600E-04    1.05      37.3  T
   6    -36.9717314 -0.651693E-08  0.196E-04    1.05     114.1  T
     SCC iter.                  ...        0 min,  0.006 sec
     gradient                   ...        0 min,  0.011 sec
 * total energy  :   -36.4003366 Eh     change       -0.5414819E-05 Eh
   gradient norm :     0.0013471 Eh/α   predicted    -0.3273479E-05 ( -39.55%)
   displ. norm   :     0.0396144 α      lambda       -0.4527443E-05
   maximum displ.:     0.0289159 α      in ANC's #1, #2, #3, ...

........................................................................
.............................. CYCLE   11 ..............................
........................................................................
   1    -36.9716762 -0.369717E+02  0.231E-02    1.06       0.0  T
   2    -36.9716763 -0.292741E-07  0.137E-02    1.06       1.6  T
   3    -36.9716754  0.893914E-06  0.633E-03    1.06       3.5  T
   4    -36.9716763 -0.949894E-06  0.970E-04    1.06      23.0  T
   5    -36.9716764 -0.160367E-07  0.358E-04    1.06      62.5  T
     SCC iter.                  ...        0 min,  0.005 sec
     gradient                   ...        0 min,  0.011 sec
 * total energy  :   -36.4003411 Eh     change       -0.4530582E-05 Eh
   gradient norm :     0.0008904 Eh/α   predicted    -0.2267509E-05 ( -49.95%)
   displ. norm   :     0.0479087 α      lambda       -0.4093592E-05
   maximum displ.:     0.0357924 α      in ANC's #1, #2, #3, ...

   *** GEOMETRY OPTIMIZATION CONVERGED AFTER 11 ITERATIONS ***

------------------------------------------------------------------------
 total energy gain   :        -0.0144949 Eh       -9.0957 kcal/mol
 total RMSD          :         0.1343368 a0        0.0711 Å
 total power (kW/mol):        -3.4596670 (step) -134.6506 (real)
------------------------------------------------------------------------

 ANCopt (total)                0 d,  0 h,  0 min,  0.283 sec
 optimizer setup                ...        0 min,  0.000 sec (  0.053%)
 model hessian                  ...        0 min,  0.002 sec (  0.767%)
 ANC generation                 ...        0 min,  0.001 sec (  0.215%)
 coordinate transformation      ...        0 min,  0.000 sec (  0.061%)
 single point calculation       ...        0 min,  0.276 sec ( 97.731%)
 optimization log               ...        0 min,  0.001 sec (  0.346%)
 hessian update                 ...        0 min,  0.000 sec (  0.052%)
 rational function              ...        0 min,  0.001 sec (  0.519%)

================
 final structure:
================
$coord
    5.25939942980127   -0.79717802825897   -0.67902966168911      C 
    3.32059132592165   -2.29252260274294   -0.54520122267215      N 
    1.27357677242628   -0.74013148263268   -0.24966541071130      C 
    2.07774368383577    1.92973794065929   -0.19149788076685      C 
   -0.12043723659207    3.60768030040837    0.11581913130335      C 
   -0.17855874271060    5.88632059190852    0.25263007775931      O 
   -2.24897994745870    1.79138622787683    0.21205883792303      C 
   -1.28776365269686   -0.83859657209113   -0.01305336404032      C 
   -3.24008666094913   -2.51494352501215    0.05976567521201      N 
   -5.26682779564427   -1.13703594530985    0.29842296399652      C 
   -4.78810198896648    1.57500613905510    0.40176897988752      C 
    4.64538885776144    1.91079015771586   -0.48149300485583      C 
    6.36421151870367    4.00864418224511   -0.57836028828182      C 
    8.84861931659584    3.81151236808673   -0.93919468334836      C 
    7.12503459850194   -1.57099724166569   -0.91456576609484      H 
   -7.10066982108781   -2.01158457761391    0.40405041581625      H 
   -6.20634157628632    3.00955191777204    0.58958855948612      H 
    5.49065303854276    5.84214886435273   -0.33965381275621      H 
    9.77561326770161    2.01723287103868   -1.19080149710325      H 
   10.03920736025596    5.45864777271377   -1.00208112505149      H 
$end
           -------------------------------------------------
          |                Final Singlepoint                |
           -------------------------------------------------

          ...................................................
          :                      SETUP                      :
          :.................................................:
          :  # basis functions                  62          :
          :  # atomic orbitals                  62          :
          :  # shells                           34          :
          :  # electrons                        66          :
          :  max. iterations                   250          :
          :  Hamiltonian                  GFN2-xTB          :
          :  restarted?                      false          :
          :  GBSA solvation                  false          :
          :  PC potential                    false          :
          :  electronic temp.          300.0000000     K    :
          :  accuracy                    1.0000000          :
          :  -> integral cutoff          0.2500000E+02      :
          :  -> integral neglect         0.1000000E-07      :
          :  -> SCF convergence          0.1000000E-05 Eh   :
          :  -> wf. convergence          0.1000000E-03 e    :
          :  Broyden damping             0.4000000          :
          ...................................................

 iter      E             dE          RMSdq      gap      omega  full diag
   1    -36.9716764 -0.369717E+02  0.302E-04    1.06       0.0  T
   2    -36.9716763  0.253471E-08  0.362E-04    1.06      61.7  T
   3    -36.9716764 -0.343505E-08  0.146E-04    1.06     152.8  T

   *** convergence criteria satisfied after 3 iterations ***

         #    Occupation            Energy/Eh            Energy/eV
      -------------------------------------------------------------
         1        2.0000           -0.7218081             -19.6414
       ...           ...                  ...                  ...
        27        2.0000           -0.4579887             -12.4625
        28        2.0000           -0.4440426             -12.0830
        29        2.0000           -0.4383681             -11.9286
        30        2.0000           -0.4160087             -11.3202
        31        2.0000           -0.4130126             -11.2386
        32        2.0000           -0.4104402             -11.1686
        33        2.0000           -0.4030659             -10.9680 (HOMO)
        34                         -0.3642612              -9.9121 (LUMO)
        35                         -0.3151122              -8.5746
        36                         -0.2571355              -6.9970
        37                         -0.2223400              -6.0502
        38                         -0.1758666              -4.7856
       ...                                ...                  ...
        62                          0.7614443              20.7200
      -------------------------------------------------------------
                  HL-Gap            0.0388047 Eh            1.0559 eV
             Fermi-level           -0.3836633 Eh          -10.4400 eV

 SCC (total)                   0 d,  0 h,  0 min,  0.024 sec
 SCC setup                      ...        0 min,  0.000 sec (  0.722%)
 Dispersion                     ...        0 min,  0.000 sec (  0.838%)
 integral evaluation            ...        0 min,  0.008 sec ( 32.571%)
 zeroth order Hamiltonian       ...        0 min,  0.000 sec (  0.561%)
 iterations                     ...        0 min,  0.003 sec ( 14.722%)
 molecular gradient             ...        0 min,  0.011 sec ( 48.849%)
 printout                       ...        0 min,  0.000 sec (  1.512%)

         :::::::::::::::::::::::::::::::::::::::::::::::::::::
         ::                     SUMMARY                     ::
         :::::::::::::::::::::::::::::::::::::::::::::::::::::
         :: total energy             -36.400341074651 Eh    ::
         :: gradient norm              0.000891887331 Eh/a0 ::
         :: HOMO-LUMO gap              1.055930436419 eV    ::
         ::.................................................::
         :: SCC energy               -36.971676352166 Eh    ::
         :: -> isotropic ES            0.040567577752 Eh    ::
         :: -> anisotropic ES          0.002435460619 Eh    ::
         :: -> anisotropic XC          0.026987671347 Eh    ::
         :: -> dispersion             -0.020789461957 Eh    ::
         :: repulsion energy           0.571390344608 Eh    ::
         :: add. restraining           0.000000000000 Eh    ::
         :::::::::::::::::::::::::::::::::::::::::::::::::::::

           -------------------------------------------------
          |                Property Printout                |
           -------------------------------------------------

    * Orbital Energies and Occupations

         #    Occupation            Energy/Eh            Energy/eV
      -------------------------------------------------------------
         1        2.0000           -0.7218081             -19.6414
       ...           ...                  ...                  ...
        21        2.0000           -0.5135934             -13.9756
        22        2.0000           -0.5121168             -13.9354
        23        2.0000           -0.4976125             -13.5407
        24        2.0000           -0.4807053             -13.0807
        25        2.0000           -0.4735828             -12.8868
        26        2.0000           -0.4731904             -12.8762
        27        2.0000           -0.4579887             -12.4625
        28        2.0000           -0.4440426             -12.0830
        29        2.0000           -0.4383681             -11.9286
        30        2.0000           -0.4160087             -11.3202
        31        2.0000           -0.4130126             -11.2386
        32        2.0000           -0.4104402             -11.1686
        33        2.0000           -0.4030659             -10.9680 (HOMO)
        34                         -0.3642612              -9.9121 (LUMO)
        35                         -0.3151122              -8.5746
        36                         -0.2571355              -6.9970
        37                         -0.2223400              -6.0502
        38                         -0.1758666              -4.7856
        39                         -0.1469819              -3.9996
        40                         -0.1252726              -3.4088
        41                          0.0053557               0.1457
        42                          0.0568064               1.5458
        43                          0.0589545               1.6042
        44                          0.0787957               2.1441
       ...                                ...                  ...
        62                          0.7614443              20.7200
      -------------------------------------------------------------
                  HL-Gap            0.0388047 Eh            1.0559 eV
             Fermi-level           -0.3836633 Eh          -10.4400 eV

     #   Z        covCN         q      C6AA      α(0)
     1   6 C      3.177     0.083    25.777     8.291
     2   7 N      1.852    -0.215    26.525     7.633
     3   6 C      3.258     0.100    24.732     8.039
     4   6 C      3.166    -0.045    28.747     8.761
     5   6 C      2.835     0.236    23.069     7.871
     6   8 O      0.856    -0.351    20.732     6.105
     7   6 C      3.169    -0.030    28.376     8.703
     8   6 C      3.272     0.097    24.622     7.999
     9   7 N      1.854    -0.216    26.544     7.636
    10   6 C      3.189     0.083    25.685     8.267
    11   6 C      2.987    -0.028    28.701     8.788
    12   6 C      3.035     0.017    27.602     8.617
    13   6 C      2.889    -0.022    28.552     8.760
    14   6 C      2.841    -0.072    29.787     8.944
    15   1 H      0.926     0.064     2.152     2.294
    16   1 H      0.926     0.063     2.165     2.301
    17   1 H      0.926     0.060     2.194     2.316
    18   1 H      0.925     0.066     2.131     2.283
    19   1 H      0.926     0.054     2.272     2.357
    20   1 H      0.926     0.057     2.239     2.340

 Mol. C6AA /au·bohr⁶  :       6500.023294
 Mol. C8AA /au·bohr⁸  :     164619.705009
 Mol. α(0) /au        :        128.306454


Wiberg/Mayer (AO) data.
largest (>0.10) Wiberg bond orders for each atom
          total WBO             WBO to atom ...
     1  C   3.882        N    2 1.655    C   12 1.083    H   15 0.963    C    8 0.107
     2  N   3.053        C    1 1.655    C    3 1.188
     3  C   3.972        C    8 1.469    N    2 1.188    C    4 1.040    C   10 0.106
     4  C   3.980        C   12 1.546    C    5 1.042    C    3 1.040    C   14 0.110
     5  C   3.946        O    6 1.785    C    4 1.042    C    7 1.019
     6  O   2.085        C    5 1.785
     7  C   3.972        C   11 1.670    C    5 1.019    C    8 1.015    N    9 0.103
     8  C   3.948        C    3 1.469    N    9 1.212    C    7 1.015    C    1 0.107
     9  N   3.051        C   10 1.617    C    8 1.212    C    7 0.103
    10  C   3.869        N    9 1.617    C   11 1.132    H   16 0.965    C    3 0.106
    11  C   3.960        C    7 1.670    C   10 1.132    H   17 0.970
    12  C   3.961        C    4 1.546    C   13 1.138    C    1 1.083
    13  C   3.987        C   14 1.846    C   12 1.138    H   18 0.961
    14  C   3.939        C   13 1.846    H   20 0.977    H   19 0.974    C    4 0.110
    15  H   0.995        C    1 0.963
    16  H   0.995        C   10 0.965
    17  H   0.996        C   11 0.970
    18  H   0.996        C   13 0.961
    19  H   0.997        C   14 0.974
    20  H   0.996        C   14 0.977

molecular dipole:
                 x           y           z       tot (Debye)
 q only:        0.519      -0.256      -0.092
   full:        0.481       0.220      -0.074       1.358
molecular quadrupole (traceless):
                xx          xy          yy          xz          yz          zz
 q only:       18.581       4.432     -15.283      -2.134      -1.148      -3.298
  q+dip:       26.440       3.963     -20.438      -3.281      -1.301      -6.003
   full:       22.783       4.054     -22.669      -2.283      -1.764      -0.114

           -------------------------------------------------
          |                Geometry Summary                 |
           -------------------------------------------------

      molecular mass/u    :      182.1812000
   center of mass at/Å    :        0.5658006       0.6428473      -0.0886045
  moments of inertia/u·Å² :        0.3067733E+03   0.9603732E+03   0.1266913E+04
rotational constants/cm⁻¹ :        0.5495143E-01   0.1755321E-01   0.1330606E-01

 * 16 selected distances

     #   Z        #   Z                                     value/Å
     1   6 C      2   7 N                                 1.2976115
     2   7 N      3   6 C                                 1.3684659
     5   6 C      6   8 O                                 1.2083675
     3   6 C      8   6 C                                 1.3621711
     8   6 C      9   7 N                                 1.3622596
     9   7 N     10   6 C                                 1.3030302
     7   6 C     11   6 C                                 1.3522473
     4   6 C     12   6 C                                 1.3674147
    12   6 C     13   6 C                                 1.4360828 (max)
    13   6 C     14   6 C                                 1.3325756
     1   6 C     15   1 H                                 1.0760489
    10   6 C     16   1 H                                 1.0765824
    11   6 C     17   1 H                                 1.0721034 (min)
    13   6 C     18   1 H                                 1.0821416
    14   6 C     19   1 H                                 1.0769846
    14   6 C     20   1 H                                 1.0760022

 * 4 distinct bonds (by element types)

   Z      Z             #   av. dist./Å        max./Å        min./Å
   1 H    6 C           6     1.0766438     1.0821416     1.0721034
   6 C    6 C           5     1.3700983     1.4360828     1.3325756
   6 C    7 N           4     1.3328418     1.3684659     1.2976115
   6 C    8 O           1     1.2083675     1.2083675     1.2083675


optimized geometry written to: xtbopt.xyz


           -------------------------------------------------
          | TOTAL ENERGY              -36.400341074651 Eh   |
          | GRADIENT NORM               0.000891887331 Eh/α |
          | HOMO-LUMO GAP               1.055930436419 eV   |
           -------------------------------------------------

------------------------------------------------------------------------
 * finished run on 2021/05/19 at 10:58:52.757     
------------------------------------------------------------------------
 total:
 * wall-time:     0 d,  0 h,  0 min,  0.362 sec
 *  cpu-time:     0 d,  0 h,  0 min,  0.361 sec
 * ratio c/w:     0.997 speedup
 SCF:
 * wall-time:     0 d,  0 h,  0 min,  0.034 sec
 *  cpu-time:     0 d,  0 h,  0 min,  0.034 sec
 * ratio c/w:     0.999 speedup
 ANC optimizer:
 * wall-time:     0 d,  0 h,  0 min,  0.307 sec
 *  cpu-time:     0 d,  0 h,  0 min,  0.307 sec
 * ratio c/w:     1.000 speedup

