      -----------------------------------------------------------      
     |                   =====================                   |     
     |                           x T B                           |     
     |                   =====================                   |     
     |                         S. Grimme                         |     
     |          Mulliken Center for Theoretical Chemistry        |     
     |                    University of Bonn                     |     
     |                Version 6.2 RC2 (SAW190805)                |     
      -----------------------------------------------------------      

   This program is distributed in the hope that it will be useful,
   but WITHOUT ANY WARRANTY; without even the implied warranty of
   MERCHANTABILITY or FITNESS FOR A PARTICULAR PURPOSE.
   
   FOR NON-COMMERCIAL, ACADEMIA USE ONLY.
   
   Cite this work as:
   * S. Grimme, C. Bannwarth, P. Shushkov, J. Chem. Theory Comput., 2017,
     13, 1989-2009. DOI: 10.1021/acs.jctc.7b00118
   * C. Bannwarth, S. Ehlert and S. Grimme., J. Chem. Theory Comput., 2019,
     15, 1652-1671. DOI: 10.1021/acs.jctc.8b01176
   * P. Pracht, E. Caldeweyher, S. Ehlert, S. Grimme, ChemRxiv, 2019, preprint.
     DOI: 10.26434/chemrxiv.8326202.v1
   
   for DFT-D4:
   * E. Caldeweyher, C. Bannwarth and S. Grimme, J. Chem. Phys., 2017,
     147, 034112. DOI: 10.1063/1.4993215
   * E. Caldeweyher, S. Ehlert, A. Hansen, H. Neugebauer, S. Spicher,
     C. Bannwarth and S. Grimme, J. Chem. Phys., 2019, 150, 154122.
     DOI: 10.1063/1.5090222
   
   for sTDA-xTB:
   * S. Grimme and C. Bannwarth, J. Chem. Phys., 2016, 145, 054103.
     DOI: 10.1063/1.4959605
   
   in the mass-spec context:
   * V. Asgeirsson, C. Bauer and S. Grimme, Chem. Sci., 2017, 8, 4879.
     DOI: 10.1039/c7sc00601b
   
   for metadynamics refer to:
   * S. Grimme, J. Chem. Theory Comput., 2019, 155, 2847-2862
     DOI: 10.1021/acs.jctc.9b00143
   
   with help from (in alphabetical order)
   C. Bannwarth, F. Bohle, G. Brandenburg, E. Caldeweyher, M. Checinski,
   S. Dohm, S. Ehlert, S. Ehrlich, F. März, H. Neugebauer, J. Pisarek,
   P. Pracht, P. Shushkov, and S. Spicher.
   
 * started run on 2021/05/19 at 10:58:52.774     

           -------------------------------------------------
          |                Calculation Setup                |
           -------------------------------------------------

          program call               : /ihome/ghutchison/geoffh/xtb/xtb 128.xyz -opt
          hostname                   : smp-n83
          coordinate file            : 128.xyz
          omp threads                :                     1
          number of atoms            :                    29
          number of electrons        :                    70
          charge                     :                     0
          spin                       :                   0.0
          first test random number   :      0.02755207863726


########################################################################
# WARNING! Please study the warnings concerning your input carefully
#  - the use of '-opt' is discouraged, please use '--opt' next time
########################################################################

           ------------------------------------------------- 
          |                 G F N 2 - x T B                 |
          | Geometry, Frequencies, Noncovalent interactions |
          |            JCTC 2019 parametrisation            |
           ------------------------------------------------- 
             KAB for C  - Si     :                1.0500
             KAB for H  - Pd     :                0.9500
             k(s)              :                1.8500
             k(p)              :                2.2300
             k(d)              :                2.2300
             k(f)              :                2.0000
             kEN (H0ij)        :               -2.0000
             D4 a1             :                0.5200
             D4 a2             :                5.0000
             D4 s6             :                1.0000
             D4 s8             :                2.7000
             D4 s9             :                5.0000
             alphaj            :                2.0000

  Z AO/shell   Hii/eV     exponent
  1     Wed Apr 25 08:07:45 CEST 2018   EN: 2.200 GM2: 0.406  GM3: 0.0800  RAES: 1.40
     1s    -10.707211    1.230000
  6     Wed Apr 25 08:07:45 CEST 2018   EN: 2.550 GM2: 0.538  GM3: 0.1500  RAES: 3.00
     2s    -13.970922    2.096432
     2p    -10.063292    1.800000
 16     Tue Apr 24 11:44:34 CEST 2018   EN: 2.580 GM2: 0.340  GM3:-0.0502  RAES: 3.10
     3s    -20.029654    1.981333
     3p    -11.377694    2.025643
     3d     -0.420282    1.702555

           ------------------------------------------------- 
          |        Self-Consistent Charge Iterations        |
           ------------------------------------------------- 

          ...................................................
          :                      SETUP                      :
          :.................................................:
          :  # basis functions                  74          :
          :  # atomic orbitals                  73          :
          :  # shells                           43          :
          :  # electrons                        70          :
          :  max. iterations                   250          :
          :  Hamiltonian                  GFN2-xTB          :
          :  restarted?                      false          :
          :  GBSA solvation                  false          :
          :  PC potential                    false          :
          :  electronic temp.          300.0000000     K    :
          :  accuracy                    1.0000000          :
          :  -> integral cutoff          0.2500000E+02      :
          :  -> integral neglect         0.1000000E-07      :
          :  -> SCF convergence          0.1000000E-05 Eh   :
          :  -> wf. convergence          0.1000000E-03 e    :
          :  Broyden damping             0.4000000          :
          ...................................................

 iter      E             dE          RMSdq      gap      omega  full diag
   1    -37.5889627 -0.375890E+02  0.364E+00    2.64       0.0  T
   2    -37.6308882 -0.419255E-01  0.205E+00    2.65       1.0  T
   3    -37.6285039  0.238427E-02  0.778E-01    2.65       1.0  T
   4    -37.6302096 -0.170569E-02  0.449E-01    2.66       1.0  T
   5    -37.6342318 -0.402214E-02  0.107E-01    2.65       1.0  T
   6    -37.6342861 -0.543198E-04  0.476E-02    2.65       1.0  T
   7    -37.6343178 -0.316636E-04  0.230E-02    2.65       1.0  T
   8    -37.6343235 -0.569775E-05  0.118E-02    2.65       1.6  T
   9    -37.6343245 -0.109554E-05  0.481E-03    2.65       3.9  T
  10    -37.6343247 -0.190858E-06  0.223E-03    2.65       8.3  T
  11    -37.6343248 -0.294589E-07  0.120E-03    2.65      15.4  T
  12    -37.6343248 -0.169422E-07  0.501E-04    2.65      37.1  T
  13    -37.6343248 -0.115213E-08  0.217E-04    2.65      85.6  T

   *** convergence criteria satisfied after 13 iterations ***

         #    Occupation            Energy/Eh            Energy/eV
      -------------------------------------------------------------
         1        2.0000           -0.7224486             -19.6588
       ...           ...                  ...                  ...
        29        2.0000           -0.4342577             -11.8168
        30        2.0000           -0.4309206             -11.7259
        31        2.0000           -0.4270667             -11.6211
        32        2.0000           -0.4216962             -11.4749
        33        2.0000           -0.4004860             -10.8978
        34        2.0000           -0.3796304             -10.3303
        35        2.0000           -0.3605103              -9.8100 (HOMO)
        36                         -0.2629936              -7.1564 (LUMO)
        37                         -0.2153301              -5.8594
        38                         -0.1895439              -5.1578
        39                         -0.1724553              -4.6927
        40                         -0.1368390              -3.7236
       ...                                ...                  ...
        73                          0.6692297              18.2107
      -------------------------------------------------------------
                  HL-Gap            0.0975167 Eh            2.6536 eV
             Fermi-level           -0.3117519 Eh           -8.4832 eV

 SCC (total)                   0 d,  0 h,  0 min,  0.045 sec
 SCC setup                      ...        0 min,  0.000 sec (  0.751%)
 Dispersion                     ...        0 min,  0.000 sec (  0.967%)
 integral evaluation            ...        0 min,  0.010 sec ( 22.724%)
 zeroth order Hamiltonian       ...        0 min,  0.000 sec (  0.431%)
 iterations                     ...        0 min,  0.018 sec ( 40.136%)
 molecular gradient             ...        0 min,  0.015 sec ( 33.966%)
 printout                       ...        0 min,  0.000 sec (  0.910%)

         :::::::::::::::::::::::::::::::::::::::::::::::::::::
         ::                     SUMMARY                     ::
         :::::::::::::::::::::::::::::::::::::::::::::::::::::
         :: total energy             -37.045923900483 Eh    ::
         :: gradient norm              0.052912455421 Eh/a0 ::
         :: HOMO-LUMO gap              2.653564337026 eV    ::
         ::.................................................::
         :: SCC energy               -37.634324787484 Eh    ::
         :: -> isotropic ES            0.003927982382 Eh    ::
         :: -> anisotropic ES          0.006566435594 Eh    ::
         :: -> anisotropic XC          0.023480992138 Eh    ::
         :: -> dispersion             -0.026447229418 Eh    ::
         :: repulsion energy           0.588280529818 Eh    ::
         :: add. restraining           0.000000000000 Eh    ::
         :::::::::::::::::::::::::::::::::::::::::::::::::::::

      ----------------------------------------------------------- 
     |                   =====================                   |
     |                        A N C O P T                        |
     |                   =====================                   |
     |               Approximate Normal Coordinate               |
     |                Rational Function Optimizer                |
      ----------------------------------------------------------- 

          ...................................................
          :                      SETUP                      :
          :.................................................:
          :   optimization level            normal          :
          :   max. optcycles                   200          :
          :   ANC micro-cycles                  20          :
          :   degrees of freedom                81          :
          :.................................................:
          :   RF solver                   davidson          :
          :   input Hessian                  false          :
          :   write xtbopt.log                true          :
          :   linear?                        false          :
          :   energy convergence         0.5000000E-05 Eh   :
          :   grad. convergence          0.1000000E-02 Eh/α :
          :   maximium RF displ.         2.0000000          :
          :   Hlow (freq-cutoff)         0.5000000E-02      :
          :   Hmax (freq-cutoff)         5.0000000          :
          :   S6 in model hess.         20.0000000          :
          ...................................................

generating ANC from model Hessian ...
Using Lindh-Hessian (1995)
 Shifting diagonal of input Hessian by   4.417364798242921E-003
 Lowest  eigenvalues of input Hessian
   -0.000000   -0.000000    0.000000    0.000000    0.000000    0.000000
    0.005000    0.005420    0.006081    0.006456    0.007038    0.008006
    0.009310    0.010142    0.011812    0.013379    0.013610    0.017573
 Highest eigenvalues
    1.581438    1.662514    1.700782    1.780622    1.851408    2.058079
 

........................................................................
.............................. CYCLE    1 ..............................
........................................................................
   1    -37.6343248 -0.376343E+02  0.123E-04    2.65       0.0  T
   2    -37.6343248 -0.594085E-10  0.979E-05    2.65     189.8  T
   3    -37.6343248 -0.227587E-09  0.410E-05    2.65     453.3  T
     SCC iter.                  ...        0 min,  0.005 sec
     gradient                   ...        0 min,  0.016 sec
 * total energy  :   -37.0459239 Eh     change       -0.2870415E-07 Eh
   gradient norm :     0.0529122 Eh/α   predicted     0.0000000E+00 (-100.00%)
   displ. norm   :     0.2920676 α      lambda       -0.5425192E-02
   maximum displ.:     0.1093371 α      in ANC's #7, #9, #4, ...

........................................................................
.............................. CYCLE    2 ..............................
........................................................................
   1    -37.6568078 -0.376568E+02  0.293E-01    2.64       0.0  T
   2    -37.6568785 -0.706445E-04  0.147E-01    2.65       1.0  T
   3    -37.6567703  0.108198E-03  0.779E-02    2.64       1.0  T
   4    -37.6569317 -0.161435E-03  0.249E-02    2.65       1.0  T
   5    -37.6569348 -0.310703E-05  0.124E-02    2.65       1.5  T
   6    -37.6569360 -0.117646E-05  0.451E-03    2.65       4.1  T
   7    -37.6569364 -0.449833E-06  0.115E-03    2.65      16.1  T
     SCC iter.                  ...        0 min,  0.009 sec
     gradient                   ...        0 min,  0.015 sec
 * total energy  :   -37.0495449 Eh     change       -0.3620998E-02 Eh
   gradient norm :     0.0197956 Eh/α   predicted    -0.2943990E-02 ( -18.70%)
   displ. norm   :     0.3066173 α      lambda       -0.1529830E-02
   maximum displ.:     0.1393217 α      in ANC's #7, #8, #4, ...

........................................................................
.............................. CYCLE    3 ..............................
........................................................................
   1    -37.6661265 -0.376661E+02  0.203E-01    2.63       0.0  T
   2    -37.6661519 -0.253433E-04  0.109E-01    2.63       1.0  T
   3    -37.6660998  0.520969E-04  0.540E-02    2.63       1.0  T
   4    -37.6661688 -0.690164E-04  0.170E-02    2.63       1.1  T
   5    -37.6661708 -0.202473E-05  0.713E-03    2.63       2.6  T
   6    -37.6661714 -0.535278E-06  0.270E-03    2.63       6.9  T
   7    -37.6661715 -0.161406E-06  0.651E-04    2.63      28.5  T
     SCC iter.                  ...        0 min,  0.009 sec
     gradient                   ...        0 min,  0.015 sec
 * total energy  :   -37.0505948 Eh     change       -0.1049840E-02 Eh
   gradient norm :     0.0064157 Eh/α   predicted    -0.8368283E-03 ( -20.29%)
   displ. norm   :     0.3537892 α      lambda       -0.8387275E-03
   maximum displ.:     0.1775796 α      in ANC's #4, #8, #7, ...

........................................................................
.............................. CYCLE    4 ..............................
........................................................................
   1    -37.6664307 -0.376664E+02  0.217E-01    2.60       0.0  T
   2    -37.6664435 -0.127471E-04  0.121E-01    2.60       1.0  T
   3    -37.6664146  0.289068E-04  0.373E-02    2.60       1.0  T
   4    -37.6664481 -0.335466E-04  0.134E-02    2.60       1.4  T
   5    -37.6664499 -0.179088E-05  0.392E-03    2.60       4.7  T
   6    -37.6664501 -0.162303E-06  0.153E-03    2.60      12.2  T
   7    -37.6664501 -0.460308E-07  0.483E-04    2.60      38.5  T
     SCC iter.                  ...        0 min,  0.009 sec
     gradient                   ...        0 min,  0.015 sec
 * total energy  :   -37.0512289 Eh     change       -0.6340935E-03 Eh
   gradient norm :     0.0100738 Eh/α   predicted    -0.4718551E-03 ( -25.59%)
   displ. norm   :     0.4062847 α      lambda       -0.7361129E-03
   maximum displ.:     0.2185153 α      in ANC's #4, #8, #7, ...

........................................................................
.............................. CYCLE    5 ..............................
........................................................................
   1    -37.6634213 -0.376634E+02  0.237E-01    2.56       0.0  T
   2    -37.6634303 -0.896514E-05  0.134E-01    2.56       1.0  T
   3    -37.6634214  0.885660E-05  0.248E-02    2.56       1.0  T
   4    -37.6634305 -0.904359E-05  0.136E-02    2.56       1.4  T
   5    -37.6634331 -0.259190E-05  0.387E-03    2.56       4.8  T
   6    -37.6634333 -0.241980E-06  0.163E-03    2.56      11.4  T
   7    -37.6634334 -0.587155E-07  0.443E-04    2.56      41.9  T
     SCC iter.                  ...        0 min,  0.009 sec
     gradient                   ...        0 min,  0.015 sec
 * total energy  :   -37.0517242 Eh     change       -0.4953692E-03 Eh
   gradient norm :     0.0133498 Eh/α   predicted    -0.4288121E-03 ( -13.44%)
   displ. norm   :     0.3419907 α      lambda       -0.6312288E-03
   maximum displ.:     0.2028483 α      in ANC's #4, #1, #8, ...

........................................................................
.............................. CYCLE    6 ..............................
........................................................................
   1    -37.6622103 -0.376622E+02  0.197E-01    2.53       0.0  T
   2    -37.6622145 -0.418436E-05  0.113E-01    2.53       1.0  T
   3    -37.6622105  0.406878E-05  0.185E-02    2.53       1.0  T
   4    -37.6622143 -0.383073E-05  0.107E-02    2.53       1.7  T
   5    -37.6622159 -0.164458E-05  0.226E-03    2.53       8.2  T
   6    -37.6622160 -0.878911E-07  0.672E-04    2.53      27.6  T
     SCC iter.                  ...        0 min,  0.008 sec
     gradient                   ...        0 min,  0.015 sec
 * total energy  :   -37.0521012 Eh     change       -0.3769231E-03 Eh
   gradient norm :     0.0116374 Eh/α   predicted    -0.3525285E-03 (  -6.47%)
   displ. norm   :     0.2901921 α      lambda       -0.5632834E-03
   maximum displ.:     0.1968378 α      in ANC's #4, #1, #8, ...

........................................................................
.............................. CYCLE    7 ..............................
........................................................................
   1    -37.6642315 -0.376642E+02  0.151E-01    2.52       0.0  T
   2    -37.6642352 -0.362322E-05  0.856E-02    2.52       1.0  T
   3    -37.6642301  0.511368E-05  0.178E-02    2.52       1.0  T
   4    -37.6642360 -0.598323E-05  0.744E-03    2.52       2.5  T
   5    -37.6642365 -0.506605E-06  0.209E-03    2.52       8.9  T
   6    -37.6642366 -0.763528E-07  0.820E-04    2.52      22.7  T
     SCC iter.                  ...        0 min,  0.008 sec
     gradient                   ...        0 min,  0.015 sec
 * total energy  :   -37.0524982 Eh     change       -0.3970846E-03 Eh
   gradient norm :     0.0086121 Eh/α   predicted    -0.3053603E-03 ( -23.10%)
   displ. norm   :     0.3810897 α      lambda       -0.5074166E-03
   maximum displ.:     0.2601616 α      in ANC's #4, #1, #8, ...

........................................................................
.............................. CYCLE    8 ..............................
........................................................................
   1    -37.6648858 -0.376649E+02  0.205E-01    2.50       0.0  T
   2    -37.6648920 -0.621151E-05  0.117E-01    2.50       1.0  T
   3    -37.6648837  0.834805E-05  0.232E-02    2.50       1.0  T
   4    -37.6648919 -0.826222E-05  0.119E-02    2.50       1.6  T
   5    -37.6648937 -0.180355E-05  0.389E-03    2.50       4.8  T
   6    -37.6648940 -0.308068E-06  0.116E-03    2.50      16.0  T
   7    -37.6648941 -0.271527E-07  0.353E-04    2.50      52.6  T
     SCC iter.                  ...        0 min,  0.009 sec
     gradient                   ...        0 min,  0.015 sec
 * total energy  :   -37.0528775 Eh     change       -0.3792634E-03 Eh
   gradient norm :     0.0083436 Eh/α   predicted    -0.2905565E-03 ( -23.39%)
   displ. norm   :     0.4023166 α      lambda       -0.5049260E-03
   maximum displ.:     0.2663704 α      in ANC's #4, #1, #6, ...

........................................................................
.............................. CYCLE    9 ..............................
........................................................................
   1    -37.6692710 -0.376693E+02  0.210E-01    2.50       0.0  T
   2    -37.6692805 -0.950657E-05  0.118E-01    2.50       1.0  T
   3    -37.6692687  0.117828E-04  0.274E-02    2.50       1.0  T
   4    -37.6692802 -0.114855E-04  0.139E-02    2.50       1.3  T
   5    -37.6692828 -0.262730E-05  0.466E-03    2.50       4.0  T
   6    -37.6692832 -0.384714E-06  0.159E-03    2.50      11.7  T
   7    -37.6692833 -0.537797E-07  0.321E-04    2.50      57.8  T
     SCC iter.                  ...        0 min,  0.009 sec
     gradient                   ...        0 min,  0.015 sec
 * total energy  :   -37.0531884 Eh     change       -0.3108900E-03 Eh
   gradient norm :     0.0097792 Eh/α   predicted    -0.2933314E-03 (  -5.65%)
   displ. norm   :     0.5649695 α      lambda       -0.4792895E-03
   maximum displ.:     0.4016606 α      in ANC's #4, #1, #2, ...

........................................................................
.............................. CYCLE   10 ..............................
........................................................................
   1    -37.6608707 -0.376609E+02  0.288E-01    2.46       0.0  T
   2    -37.6608784 -0.768316E-05  0.165E-01    2.46       1.0  T
   3    -37.6608490  0.294438E-04  0.395E-02    2.46       1.0  T
   4    -37.6608811 -0.320755E-04  0.133E-02    2.46       1.4  T
   5    -37.6608827 -0.158966E-05  0.273E-03    2.46       6.8  T
   6    -37.6608828 -0.119577E-06  0.964E-04    2.46      19.3  T
     SCC iter.                  ...        0 min,  0.008 sec
     gradient                   ...        0 min,  0.015 sec
 * total energy  :   -37.0531844 Eh     change        0.4002828E-05 Eh
   gradient norm :     0.0166934 Eh/α   predicted    -0.3161380E-03 (*******%)
   displ. norm   :     0.1268853 α      lambda       -0.6454760E-03
   maximum displ.:     0.0703706 α      in ANC's #4, #5, #3, ...

........................................................................
.............................. CYCLE   11 ..............................
........................................................................
   1    -37.6683220 -0.376683E+02  0.747E-02    2.48       0.0  T
   2    -37.6683231 -0.105762E-05  0.424E-02    2.49       1.0  T
   3    -37.6683129  0.102166E-04  0.229E-02    2.48       1.0  T
   4    -37.6683244 -0.115205E-04  0.420E-03    2.48       4.4  T
   5    -37.6683244  0.186873E-08  0.239E-03    2.48       7.8  T
   6    -37.6683245 -0.107604E-06  0.470E-04    2.48      39.6  T
     SCC iter.                  ...        0 min,  0.008 sec
     gradient                   ...        0 min,  0.015 sec
 * total energy  :   -37.0535023 Eh     change       -0.3179331E-03 Eh
   gradient norm :     0.0072357 Eh/α   predicted    -0.3279379E-03 (   3.15%)
   displ. norm   :     0.1718446 α      lambda       -0.2492941E-03
   maximum displ.:     0.1086988 α      in ANC's #1, #4, #2, ...

........................................................................
.............................. CYCLE   12 ..............................
........................................................................
   1    -37.6689750 -0.376690E+02  0.110E-01    2.47       0.0  T
   2    -37.6689777 -0.267911E-05  0.634E-02    2.47       1.0  T
   3    -37.6689595  0.182567E-04  0.286E-02    2.47       1.0  T
   4    -37.6689795 -0.199966E-04  0.569E-03    2.47       3.3  T
   5    -37.6689797 -0.248677E-06  0.221E-03    2.47       8.4  T
   6    -37.6689797 -0.268111E-07  0.106E-03    2.47      17.6  T
     SCC iter.                  ...        0 min,  0.008 sec
     gradient                   ...        0 min,  0.015 sec
 * total energy  :   -37.0535747 Eh     change       -0.7237464E-04 Eh
   gradient norm :     0.0130981 Eh/α   predicted    -0.1283292E-03 (  77.31%)
   displ. norm   :     0.2379718 α      lambda       -0.2326193E-03
   maximum displ.:     0.1584579 α      in ANC's #4, #1, #6, ...

........................................................................
.............................. CYCLE   13 ..............................
........................................................................
   1    -37.6690393 -0.376690E+02  0.115E-01    2.47       0.0  T
   2    -37.6690413 -0.201160E-05  0.655E-02    2.47       1.0  T
   3    -37.6690342  0.706301E-05  0.188E-02    2.47       1.0  T
   4    -37.6690420 -0.771914E-05  0.616E-03    2.47       3.0  T
   5    -37.6690423 -0.328161E-06  0.156E-03    2.47      11.9  T
   6    -37.6690423 -0.363781E-07  0.633E-04    2.47      29.3  T
     SCC iter.                  ...        0 min,  0.008 sec
     gradient                   ...        0 min,  0.015 sec
 * total energy  :   -37.0537380 Eh     change       -0.1633041E-03 Eh
   gradient norm :     0.0063666 Eh/α   predicted    -0.1228971E-03 ( -24.74%)
   displ. norm   :     0.4156517 α      lambda       -0.2227502E-03
   maximum displ.:     0.2599491 α      in ANC's #4, #1, #6, ...

........................................................................
.............................. CYCLE   14 ..............................
........................................................................
   1    -37.6640622 -0.376641E+02  0.204E-01    2.45       0.0  T
   2    -37.6640682 -0.594764E-05  0.116E-01    2.45       1.0  T
   3    -37.6640643  0.393218E-05  0.176E-02    2.45       1.1  T
   4    -37.6640682 -0.396175E-05  0.955E-03    2.45       1.9  T
   5    -37.6640696 -0.141637E-05  0.324E-03    2.45       5.7  T
   6    -37.6640698 -0.123099E-06  0.145E-03    2.45      12.8  T
   7    -37.6640698 -0.497421E-07  0.283E-04    2.45      65.6  T
     SCC iter.                  ...        0 min,  0.009 sec
     gradient                   ...        0 min,  0.015 sec
 * total energy  :   -37.0537969 Eh     change       -0.5891355E-04 Eh
   gradient norm :     0.0069540 Eh/α   predicted    -0.1306177E-03 ( 121.71%)
   displ. norm   :     0.1141438 α      lambda       -0.1882348E-03
   maximum displ.:     0.0646785 α      in ANC's #1, #9, #4, ...

........................................................................
.............................. CYCLE   15 ..............................
........................................................................
   1    -37.6678424 -0.376678E+02  0.575E-02    2.45       0.0  T
   2    -37.6678436 -0.114386E-05  0.323E-02    2.45       1.0  T
   3    -37.6678426  0.926682E-06  0.790E-03    2.45       2.4  T
   4    -37.6678436 -0.931605E-06  0.385E-03    2.45       4.8  T
   5    -37.6678438 -0.239167E-06  0.116E-03    2.45      16.0  T
   6    -37.6678438 -0.599486E-08  0.529E-04    2.45      35.1  T
     SCC iter.                  ...        0 min,  0.008 sec
     gradient                   ...        0 min,  0.015 sec
 * total energy  :   -37.0538994 Eh     change       -0.1024500E-03 Eh
   gradient norm :     0.0051552 Eh/α   predicted    -0.9534423E-04 (  -6.94%)
   displ. norm   :     0.0897817 α      lambda       -0.8580563E-04
   maximum displ.:     0.0619342 α      in ANC's #1, #2, #4, ...

........................................................................
.............................. CYCLE   16 ..............................
........................................................................
   1    -37.6694531 -0.376695E+02  0.468E-02    2.45       0.0  T
   2    -37.6694535 -0.455798E-06  0.270E-02    2.45       1.0  T
   3    -37.6694491  0.440064E-05  0.148E-02    2.45       1.3  T
   4    -37.6694541 -0.491216E-05  0.243E-03    2.45       7.6  T
   5    -37.6694541 -0.308057E-08  0.135E-03    2.45      13.8  T
   6    -37.6694541 -0.276794E-07  0.427E-04    2.45      43.5  T
     SCC iter.                  ...        0 min,  0.008 sec
     gradient                   ...        0 min,  0.015 sec
 * total energy  :   -37.0539483 Eh     change       -0.4891772E-04 Eh
   gradient norm :     0.0037789 Eh/α   predicted    -0.4324926E-04 ( -11.59%)
   displ. norm   :     0.2644004 α      lambda       -0.9275817E-04
   maximum displ.:     0.1808803 α      in ANC's #1, #4, #2, ...

........................................................................
.............................. CYCLE   17 ..............................
........................................................................
   1    -37.6684334 -0.376684E+02  0.133E-01    2.44       0.0  T
   2    -37.6684349 -0.149564E-05  0.761E-02    2.44       1.0  T
   3    -37.6684291  0.580334E-05  0.178E-02    2.44       1.0  T
   4    -37.6684355 -0.639450E-05  0.572E-03    2.44       3.2  T
   5    -37.6684357 -0.247632E-06  0.127E-03    2.44      14.6  T
   6    -37.6684358 -0.271298E-07  0.495E-04    2.44      37.5  T
   7    -37.6684358 -0.526769E-08  0.193E-04    2.44      96.4  T
     SCC iter.                  ...        0 min,  0.009 sec
     gradient                   ...        0 min,  0.016 sec
 * total energy  :   -37.0540064 Eh     change       -0.5813465E-04 Eh
   gradient norm :     0.0055365 Eh/α   predicted    -0.4962542E-04 ( -14.64%)
   displ. norm   :     0.2192511 α      lambda       -0.1061505E-03
   maximum displ.:     0.1554032 α      in ANC's #1, #2, #4, ...

........................................................................
.............................. CYCLE   18 ..............................
........................................................................
   1    -37.6695109 -0.376695E+02  0.108E-01    2.45       0.0  T
   2    -37.6695125 -0.159986E-05  0.614E-02    2.45       1.0  T
   3    -37.6695109  0.160491E-05  0.108E-02    2.45       1.7  T
   4    -37.6695127 -0.178826E-05  0.518E-03    2.45       3.6  T
   5    -37.6695131 -0.346492E-06  0.125E-03    2.45      14.9  T
   6    -37.6695131 -0.221737E-07  0.532E-04    2.45      34.9  T
     SCC iter.                  ...        0 min,  0.008 sec
     gradient                   ...        0 min,  0.015 sec
 * total energy  :   -37.0540621 Eh     change       -0.5566036E-04 Eh
   gradient norm :     0.0062222 Eh/α   predicted    -0.5562896E-04 (  -0.06%)
   displ. norm   :     0.2402253 α      lambda       -0.1087137E-03
   maximum displ.:     0.1594738 α      in ANC's #1, #2, #4, ...

........................................................................
.............................. CYCLE   19 ..............................
........................................................................
   1    -37.6680042 -0.376680E+02  0.113E-01    2.44       0.0  T
   2    -37.6680053 -0.109669E-05  0.651E-02    2.44       1.0  T
   3    -37.6680041  0.124624E-05  0.950E-03    2.44       2.0  T
   4    -37.6680053 -0.119362E-05  0.552E-03    2.44       3.4  T
   5    -37.6680057 -0.456470E-06  0.131E-03    2.44      14.1  T
   6    -37.6680057 -0.336722E-07  0.452E-04    2.44      41.1  T
     SCC iter.                  ...        0 min,  0.008 sec
     gradient                   ...        0 min,  0.015 sec
 * total energy  :   -37.0541335 Eh     change       -0.7142779E-04 Eh
   gradient norm :     0.0052122 Eh/α   predicted    -0.5749772E-04 ( -19.50%)
   displ. norm   :     0.2243929 α      lambda       -0.1437870E-03
   maximum displ.:     0.1113731 α      in ANC's #2, #1, #5, ...

........................................................................
.............................. CYCLE   20 ..............................
........................................................................
   1    -37.6695056 -0.376695E+02  0.955E-02    2.45       0.0  T
   2    -37.6695068 -0.126910E-05  0.549E-02    2.45       1.0  T
   3    -37.6694981  0.872457E-05  0.203E-02    2.45       1.0  T
   4    -37.6695075 -0.937987E-05  0.574E-03    2.45       3.2  T
   5    -37.6695078 -0.288379E-06  0.181E-03    2.45      10.3  T
   6    -37.6695078 -0.428808E-07  0.753E-04    2.45      24.7  T
     SCC iter.                  ...        0 min,  0.008 sec
     gradient                   ...        0 min,  0.015 sec
 * total energy  :   -37.0542057 Eh     change       -0.7222886E-04 Eh
   gradient norm :     0.0057221 Eh/α   predicted    -0.7551786E-04 (   4.55%)
   displ. norm   :     0.3323524 α      lambda       -0.1341180E-03
   maximum displ.:     0.2283750 α      in ANC's #1, #2, #5, ...
 * RMSD in coord.:     0.8443002 α      energy gain  -0.8281832E-02 Eh

generating ANC from model Hessian ...
Using Lindh-Hessian (1995)
 Shifting diagonal of input Hessian by   4.393322927836342E-003
 Lowest  eigenvalues of input Hessian
   -0.000000   -0.000000   -0.000000    0.000000    0.000000    0.000000
    0.005000    0.005870    0.006301    0.006351    0.007185    0.007905
    0.009915    0.010402    0.012155    0.013655    0.013675    0.018613
 Highest eigenvalues
    1.614658    1.723764    1.747884    1.861212    1.896110    2.092499
 

........................................................................
.............................. CYCLE   21 ..............................
........................................................................
   1    -37.6662520 -0.376663E+02  0.153E-01    2.43       0.0  T
   2    -37.6662539 -0.190166E-05  0.881E-02    2.43       1.0  T
   3    -37.6662483  0.554782E-05  0.187E-02    2.43       1.0  T
   4    -37.6662545 -0.615985E-05  0.683E-03    2.43       2.7  T
   5    -37.6662547 -0.256120E-06  0.258E-03    2.43       7.2  T
   6    -37.6662549 -0.173285E-06  0.517E-04    2.43      35.9  T
   7    -37.6662549 -0.324957E-08  0.271E-04    2.43      68.4  T
     SCC iter.                  ...        0 min,  0.009 sec
     gradient                   ...        0 min,  0.015 sec
 * total energy  :   -37.0542307 Eh     change       -0.2500588E-04 Eh
   gradient norm :     0.0070433 Eh/α   predicted     0.0000000E+00 (-100.00%)
   displ. norm   :     0.0591568 α      lambda       -0.1227199E-03
   maximum displ.:     0.0303011 α      in ANC's #5, #2, #11, ...

........................................................................
.............................. CYCLE   22 ..............................
........................................................................
   1    -37.6688025 -0.376688E+02  0.271E-02    2.44       0.0  T
   2    -37.6688027 -0.230384E-06  0.156E-02    2.44       1.2  T
   3    -37.6688016  0.106091E-05  0.774E-03    2.44       2.4  T
   4    -37.6688028 -0.119405E-05  0.180E-03    2.44      10.3  T
   5    -37.6688029 -0.175035E-07  0.992E-04    2.44      18.7  T
     SCC iter.                  ...        0 min,  0.007 sec
     gradient                   ...        0 min,  0.015 sec
 * total energy  :   -37.0543061 Eh     change       -0.7533946E-04 Eh
   gradient norm :     0.0022438 Eh/α   predicted    -0.6157890E-04 ( -18.26%)
   displ. norm   :     0.0384182 α      lambda       -0.2396878E-04
   maximum displ.:     0.0230434 α      in ANC's #5, #2, #11, ...

........................................................................
.............................. CYCLE   23 ..............................
........................................................................
   1    -37.6695712 -0.376696E+02  0.179E-02    2.44       0.0  T
   2    -37.6695713 -0.101578E-06  0.102E-02    2.44       1.8  T
   3    -37.6695709  0.421456E-06  0.479E-03    2.44       3.9  T
   4    -37.6695713 -0.465708E-06  0.146E-03    2.44      12.7  T
   5    -37.6695714 -0.174295E-07  0.641E-04    2.44      29.0  T
   6    -37.6695714 -0.732383E-08  0.177E-04    2.44     104.6  T
     SCC iter.                  ...        0 min,  0.008 sec
     gradient                   ...        0 min,  0.015 sec
 * total energy  :   -37.0543197 Eh     change       -0.1362481E-04 Eh
   gradient norm :     0.0011231 Eh/α   predicted    -0.1200406E-04 ( -11.90%)
   displ. norm   :     0.0617444 α      lambda       -0.1254569E-04
   maximum displ.:     0.0397314 α      in ANC's #5, #2, #11, ...

........................................................................
.............................. CYCLE   24 ..............................
........................................................................
   1    -37.6695940 -0.376696E+02  0.276E-02    2.44       0.0  T
   2    -37.6695941 -0.164835E-06  0.157E-02    2.44       1.2  T
   3    -37.6695933  0.855618E-06  0.655E-03    2.44       2.8  T
   4    -37.6695942 -0.927949E-06  0.190E-03    2.44       9.7  T
   5    -37.6695942 -0.360699E-07  0.766E-04    2.44      24.2  T
   6    -37.6695942 -0.848069E-08  0.263E-04    2.44      70.6  T
     SCC iter.                  ...        0 min,  0.008 sec
     gradient                   ...        0 min,  0.015 sec
 * total energy  :   -37.0543301 Eh     change       -0.1042152E-04 Eh
   gradient norm :     0.0015594 Eh/α   predicted    -0.6288881E-05 ( -39.65%)
   displ. norm   :     0.0584726 α      lambda       -0.1037394E-04
   maximum displ.:     0.0379141 α      in ANC's #5, #2, #3, ...

........................................................................
.............................. CYCLE   25 ..............................
........................................................................
   1    -37.6690342 -0.376690E+02  0.250E-02    2.44       0.0  T
   2    -37.6690343 -0.904438E-07  0.142E-02    2.44       1.3  T
   3    -37.6690340  0.288068E-06  0.389E-03    2.44       4.8  T
   4    -37.6690343 -0.314473E-06  0.147E-03    2.44      12.7  T
   5    -37.6690343 -0.201321E-07  0.463E-04    2.44      40.1  T
   6    -37.6690343 -0.290341E-08  0.179E-04    2.44     104.0  T
     SCC iter.                  ...        0 min,  0.008 sec
     gradient                   ...        0 min,  0.015 sec
 * total energy  :   -37.0543420 Eh     change       -0.1185538E-04 Eh
   gradient norm :     0.0012042 Eh/α   predicted    -0.5195998E-05 ( -56.17%)
   displ. norm   :     0.0823244 α      lambda       -0.1113694E-04
   maximum displ.:     0.0523433 α      in ANC's #5, #2, #3, ...

........................................................................
.............................. CYCLE   26 ..............................
........................................................................
   1    -37.6687697 -0.376688E+02  0.336E-02    2.44       0.0  T
   2    -37.6687698 -0.110116E-06  0.194E-02    2.44       1.0  T
   3    -37.6687697  0.139875E-06  0.315E-03    2.44       5.9  T
   4    -37.6687699 -0.142794E-06  0.166E-03    2.44      11.2  T
   5    -37.6687699 -0.379798E-07  0.338E-04    2.44      54.9  T
   6    -37.6687699 -0.171109E-08  0.161E-04    2.44     115.5  T
     SCC iter.                  ...        0 min,  0.008 sec
     gradient                   ...        0 min,  0.016 sec
 * total energy  :   -37.0543545 Eh     change       -0.1247978E-04 Eh
   gradient norm :     0.0012233 Eh/α   predicted    -0.5590237E-05 ( -55.21%)
   displ. norm   :     0.0974321 α      lambda       -0.9869342E-05
   maximum displ.:     0.0628020 α      in ANC's #5, #2, #3, ...

........................................................................
.............................. CYCLE   27 ..............................
........................................................................
   1    -37.6688579 -0.376689E+02  0.383E-02    2.44       0.0  T
   2    -37.6688580 -0.135978E-06  0.222E-02    2.44       1.0  T
   3    -37.6688578  0.207544E-06  0.359E-03    2.44       5.2  T
   4    -37.6688580 -0.206617E-06  0.190E-03    2.44       9.8  T
   5    -37.6688581 -0.501887E-07  0.508E-04    2.44      36.5  T
   6    -37.6688581 -0.488608E-08  0.171E-04    2.44     108.4  T
     SCC iter.                  ...        0 min,  0.008 sec
     gradient                   ...        0 min,  0.016 sec
 * total energy  :   -37.0543660 Eh     change       -0.1153246E-04 Eh
   gradient norm :     0.0010290 Eh/α   predicted    -0.4956130E-05 ( -57.02%)
   displ. norm   :     0.1080262 α      lambda       -0.8983887E-05
   maximum displ.:     0.0701017 α      in ANC's #5, #2, #3, ...

........................................................................
.............................. CYCLE   28 ..............................
........................................................................
   1    -37.6689738 -0.376690E+02  0.410E-02    2.44       0.0  T
   2    -37.6689740 -0.149995E-06  0.238E-02    2.44       1.0  T
   3    -37.6689737  0.301185E-06  0.412E-03    2.44       4.5  T
   4    -37.6689740 -0.320861E-06  0.191E-03    2.44       9.7  T
   5    -37.6689740 -0.406106E-07  0.608E-04    2.44      30.6  T
   6    -37.6689741 -0.755792E-08  0.184E-04    2.44     101.2  T
     SCC iter.                  ...        0 min,  0.008 sec
     gradient                   ...        0 min,  0.015 sec
 * total energy  :   -37.0543761 Eh     change       -0.1006856E-04 Eh
   gradient norm :     0.0005943 Eh/α   predicted    -0.4517252E-05 ( -55.14%)
   displ. norm   :     0.0962193 α      lambda       -0.5737833E-05
   maximum displ.:     0.0628725 α      in ANC's #5, #2, #3, ...

........................................................................
.............................. CYCLE   29 ..............................
........................................................................
   1    -37.6691647 -0.376692E+02  0.358E-02    2.44       0.0  T
   2    -37.6691648 -0.919293E-07  0.209E-02    2.44       1.0  T
   3    -37.6691647  0.986634E-07  0.273E-03    2.44       6.8  T
   4    -37.6691648 -0.102358E-06  0.153E-03    2.44      12.1  T
   5    -37.6691648 -0.324735E-07  0.346E-04    2.44      53.7  T
   6    -37.6691648 -0.221421E-08  0.154E-04    2.44     120.7  T
     SCC iter.                  ...        0 min,  0.008 sec
     gradient                   ...        0 min,  0.015 sec
 * total energy  :   -37.0543820 Eh     change       -0.5892208E-05 Eh
   gradient norm :     0.0004397 Eh/α   predicted    -0.2884260E-05 ( -51.05%)
   displ. norm   :     0.0642763 α      lambda       -0.2486442E-05
   maximum displ.:     0.0418728 α      in ANC's #2, #5, #3, ...

........................................................................
.............................. CYCLE   30 ..............................
........................................................................
   1    -37.6692777 -0.376693E+02  0.236E-02    2.44       0.0  T
   2    -37.6692778 -0.416238E-07  0.138E-02    2.44       1.3  T
   3    -37.6692778 -0.226274E-08  0.128E-03    2.44      14.5  T
   4    -37.6692778  0.150836E-08  0.812E-04    2.44      22.9  T
   5    -37.6692778 -0.134250E-07  0.170E-04    2.44     109.5  T
     SCC iter.                  ...        0 min,  0.007 sec
     gradient                   ...        0 min,  0.015 sec
 * total energy  :   -37.0543846 Eh     change       -0.2609637E-05 Eh
   gradient norm :     0.0003538 Eh/α   predicted    -0.1248437E-05 ( -52.16%)
   displ. norm   :     0.0502276 α      lambda       -0.1538103E-05
   maximum displ.:     0.0324112 α      in ANC's #2, #5, #1, ...

   *** GEOMETRY OPTIMIZATION CONVERGED AFTER 30 ITERATIONS ***

------------------------------------------------------------------------
 total energy gain   :        -0.0084607 Eh       -5.3091 kcal/mol
 total RMSD          :         0.8574258 a0        0.4537 Å
 total power (kW/mol):        -0.7404489 (step)  -21.1810 (real)
------------------------------------------------------------------------

 ANCopt (total)                0 d,  0 h,  0 min,  1.049 sec
 optimizer setup                ...        0 min,  0.000 sec (  0.016%)
 model hessian                  ...        0 min,  0.016 sec (  1.535%)
 ANC generation                 ...        0 min,  0.002 sec (  0.171%)
 coordinate transformation      ...        0 min,  0.001 sec (  0.066%)
 single point calculation       ...        0 min,  1.016 sec ( 96.860%)
 optimization log               ...        0 min,  0.003 sec (  0.329%)
 hessian update                 ...        0 min,  0.000 sec (  0.045%)
 rational function              ...        0 min,  0.008 sec (  0.791%)

================
 final structure:
================
$coord
    1.54236786294803    2.66916365049627   -0.46676432766024      C 
   -1.01384587560174    0.79966922140415   -1.15246818424478      S 
    0.86762900324424   -1.90601799722034   -1.05544037682681      C 
    3.34139881481519   -1.30742129667192   -0.49578482393702      C 
    3.72175003167420    1.33182953978407   -0.17677300420082      C 
    6.18716920586954    2.55487934835906    0.49149013021397      C 
    6.58225527742737    2.59375871463359    3.35535818523275      C 
    5.42207596253174   -3.22483032603366   -0.37214508538299      C 
    6.43945121497145   -3.81396989344197   -3.01498884594813      C 
   -0.19008551684859   -4.34484538261325   -1.52885673524155      C 
   -2.60565641311498   -4.78314169420493   -2.18876397660884      C 
   -3.60628704916381   -7.26086305121723   -2.65993434764646      C 
   -5.99183088030825   -7.70041904904785   -3.33401452222249      C 
    1.29018374929534    4.67483595677210   -0.32386422717500      H 
    6.19180078278564    4.49290851257601   -0.21720603405221      H 
    7.74263281794884    1.54545386689637   -0.41063765466581      H 
    5.08935533938854    3.67583453819226    4.26302210406444      H 
    8.39064624401053    3.45429215567800    3.81769855667501      H 
    6.54793710726072    0.68685735872058    4.12183423512193      H 
    4.72625180457260   -4.96185016759461    0.49766524131890      H 
    6.95585849471645   -2.51072770454745    0.80421145776356      H 
    4.94447910615602   -4.56586534232778   -4.20843837675206      H 
    7.95691723481436   -5.19649370216134   -2.90827710818417      H 
    7.16813693396337   -2.10760279644808   -3.90036911219400      H 
    1.09177524235839   -5.92752800760061   -1.34032922241426      H 
   -3.89571810170225   -3.20861676200683   -2.39486374645890      H 
   -2.30140210604703   -8.82302631959556   -2.44311625897366      H 
   -7.32625602896926   -6.17978796847647   -3.56324725522513      H 
   -6.68843560704432   -9.58009581637714   -3.67599951507239      H 
$end
           -------------------------------------------------
          |                Final Singlepoint                |
           -------------------------------------------------

          ...................................................
          :                      SETUP                      :
          :.................................................:
          :  # basis functions                  74          :
          :  # atomic orbitals                  73          :
          :  # shells                           43          :
          :  # electrons                        70          :
          :  max. iterations                   250          :
          :  Hamiltonian                  GFN2-xTB          :
          :  restarted?                      false          :
          :  GBSA solvation                  false          :
          :  PC potential                    false          :
          :  electronic temp.          300.0000000     K    :
          :  accuracy                    1.0000000          :
          :  -> integral cutoff          0.2500000E+02      :
          :  -> integral neglect         0.1000000E-07      :
          :  -> SCF convergence          0.1000000E-05 Eh   :
          :  -> wf. convergence          0.1000000E-03 e    :
          :  Broyden damping             0.4000000          :
          ...................................................

 iter      E             dE          RMSdq      gap      omega  full diag
   1    -37.6692778 -0.376693E+02  0.124E-04    2.44       0.0  T
   2    -37.6692778  0.476561E-10  0.833E-05    2.44     222.9  T
   3    -37.6692778 -0.190354E-09  0.516E-05    2.44     360.2  T

   *** convergence criteria satisfied after 3 iterations ***

         #    Occupation            Energy/Eh            Energy/eV
      -------------------------------------------------------------
         1        2.0000           -0.7206590             -19.6101
       ...           ...                  ...                  ...
        29        2.0000           -0.4354872             -11.8502
        30        2.0000           -0.4319495             -11.7539
        31        2.0000           -0.4290465             -11.6749
        32        2.0000           -0.4219546             -11.4820
        33        2.0000           -0.4069124             -11.0726
        34        2.0000           -0.3817299             -10.3874
        35        2.0000           -0.3580330              -9.7426 (HOMO)
        36                         -0.2684100              -7.3038 (LUMO)
        37                         -0.2100192              -5.7149
        38                         -0.1938772              -5.2757
        39                         -0.1641407              -4.4665
        40                         -0.1224907              -3.3331
       ...                                ...                  ...
        73                          0.6833434              18.5947
      -------------------------------------------------------------
                  HL-Gap            0.0896230 Eh            2.4388 eV
             Fermi-level           -0.3132215 Eh           -8.5232 eV

 SCC (total)                   0 d,  0 h,  0 min,  0.031 sec
 SCC setup                      ...        0 min,  0.000 sec (  0.736%)
 Dispersion                     ...        0 min,  0.000 sec (  0.797%)
 integral evaluation            ...        0 min,  0.010 sec ( 32.058%)
 zeroth order Hamiltonian       ...        0 min,  0.000 sec (  0.546%)
 iterations                     ...        0 min,  0.005 sec ( 14.524%)
 molecular gradient             ...        0 min,  0.016 sec ( 49.906%)
 printout                       ...        0 min,  0.000 sec (  1.272%)

         :::::::::::::::::::::::::::::::::::::::::::::::::::::
         ::                     SUMMARY                     ::
         :::::::::::::::::::::::::::::::::::::::::::::::::::::
         :: total energy             -37.054384587560 Eh    ::
         :: gradient norm              0.000354609333 Eh/a0 ::
         :: HOMO-LUMO gap              2.438766885980 eV    ::
         ::.................................................::
         :: SCC energy               -37.669277796268 Eh    ::
         :: -> isotropic ES            0.004184684717 Eh    ::
         :: -> anisotropic ES          0.006025704699 Eh    ::
         :: -> anisotropic XC          0.022786265303 Eh    ::
         :: -> dispersion             -0.026810345012 Eh    ::
         :: repulsion energy           0.614817904014 Eh    ::
         :: add. restraining           0.000000000000 Eh    ::
         :::::::::::::::::::::::::::::::::::::::::::::::::::::

           -------------------------------------------------
          |                Property Printout                |
           -------------------------------------------------

    * Orbital Energies and Occupations

         #    Occupation            Energy/Eh            Energy/eV
      -------------------------------------------------------------
         1        2.0000           -0.7206590             -19.6101
       ...           ...                  ...                  ...
        23        2.0000           -0.4649795             -12.6527
        24        2.0000           -0.4621545             -12.5759
        25        2.0000           -0.4514766             -12.2853
        26        2.0000           -0.4488999             -12.2152
        27        2.0000           -0.4439994             -12.0818
        28        2.0000           -0.4433703             -12.0647
        29        2.0000           -0.4354872             -11.8502
        30        2.0000           -0.4319495             -11.7539
        31        2.0000           -0.4290465             -11.6749
        32        2.0000           -0.4219546             -11.4820
        33        2.0000           -0.4069124             -11.0726
        34        2.0000           -0.3817299             -10.3874
        35        2.0000           -0.3580330              -9.7426 (HOMO)
        36                         -0.2684100              -7.3038 (LUMO)
        37                         -0.2100192              -5.7149
        38                         -0.1938772              -5.2757
        39                         -0.1641407              -4.4665
        40                         -0.1224907              -3.3331
        41                         -0.1094194              -2.9775
        42                          0.0036525               0.0994
        43                          0.0407399               1.1086
        44                          0.0426818               1.1614
        45                          0.0910895               2.4787
        46                          0.1112674               3.0277
       ...                                ...                  ...
        73                          0.6833434              18.5947
      -------------------------------------------------------------
                  HL-Gap            0.0896230 Eh            2.4388 eV
             Fermi-level           -0.3132215 Eh           -8.5232 eV

     #   Z        covCN         q      C6AA      α(0)
     1   6 C      2.941    -0.029    28.727     8.790
     2  16 S      2.300    -0.060   143.548    20.165
     3   6 C      2.988     0.016    27.653     8.626
     4   6 C      3.148    -0.016    28.131     8.676
     5   6 C      3.146    -0.009    27.986     8.655
     6   6 C      3.804    -0.053    21.516     6.603
     7   6 C      3.753    -0.098    22.422     6.752
     8   6 C      3.804    -0.051    21.484     6.599
     9   6 C      3.753    -0.097    22.410     6.750
    10   6 C      2.930    -0.040    29.000     8.831
    11   6 C      2.902    -0.037    28.920     8.818
    12   6 C      2.894    -0.025    28.638     8.774
    13   6 C      2.842    -0.089    30.212     9.008
    14   1 H      0.926     0.038     2.469     2.457
    15   1 H      0.924     0.033     2.539     2.492
    16   1 H      0.924     0.040     2.445     2.445
    17   1 H      0.925     0.036     2.505     2.475
    18   1 H      0.925     0.035     2.517     2.481
    19   1 H      0.925     0.036     2.505     2.475
    20   1 H      0.924     0.034     2.534     2.489
    21   1 H      0.924     0.041     2.436     2.441
    22   1 H      0.925     0.037     2.493     2.469
    23   1 H      0.925     0.034     2.527     2.486
    24   1 H      0.925     0.034     2.523     2.484
    25   1 H      0.925     0.040     2.442     2.444
    26   1 H      0.925     0.043     2.405     2.425
    27   1 H      0.925     0.032     2.565     2.504
    28   1 H      0.926     0.039     2.460     2.453
    29   1 H      0.926     0.035     2.522     2.484

 Mol. C6AA /au·bohr⁶  :       9736.744351
 Mol. C8AA /au·bohr⁸  :     252053.936158
 Mol. α(0) /au        :        156.553285


Wiberg/Mayer (AO) data.
largest (>0.10) Wiberg bond orders for each atom
          total WBO             WBO to atom ...
     1  C   3.929        C    5 1.578    S    2 1.188    H   14 0.970
     2  S   2.591        C    1 1.188    C    3 1.115
     3  C   3.947        C    4 1.480    C   10 1.173    S    2 1.115
     4  C   3.955        C    3 1.480    C    5 1.250    C    8 1.011
     5  C   3.983        C    1 1.578    C    4 1.250    C    6 1.007
     6  C   3.997        C    5 1.007    C    7 1.002    H   15 0.975    H   16 0.970
     7  C   3.996        C    6 1.002    H   17 0.989    H   19 0.987    H   18 0.986
     8  C   3.998        C    4 1.011    C    9 1.000    H   21 0.970    H   20 0.969
     9  C   3.995        C    8 1.000    H   24 0.988    H   22 0.988    H   23 0.986
    10  C   3.991        C   11 1.703    C    3 1.173    H   25 0.953    C   13 0.122
    11  C   3.990        C   10 1.703    C   12 1.154    H   26 0.958
    12  C   3.991        C   13 1.847    C   11 1.154    H   27 0.964
    13  C   3.932        C   12 1.847    H   29 0.980    H   28 0.977    C   10 0.122
    14  H   0.998        C    1 0.970
    15  H   0.999        C    6 0.975
    16  H   0.998        C    6 0.970
    17  H   0.999        C    7 0.989
    18  H   0.998        C    7 0.986
    19  H   0.999        C    7 0.987
    20  H   0.998        C    8 0.969
    21  H   0.997        C    8 0.970
    22  H   0.999        C    9 0.988
    23  H   0.997        C    9 0.986
    24  H   0.999        C    9 0.988
    25  H   0.998        C   10 0.953
    26  H   0.998        C   11 0.958
    27  H   0.999        C   12 0.964
    28  H   0.998        C   13 0.977
    29  H   0.998        C   13 0.980

molecular dipole:
                 x           y           z       tot (Debye)
 q only:        0.509      -0.032       0.096
   full:        0.780      -0.045       0.147       2.021
molecular quadrupole (traceless):
                xx          xy          yy          xz          yz          zz
 q only:        2.666      -0.642       0.041       0.388       0.547      -2.707
  q+dip:        4.309      -0.782       3.336       1.397       0.877      -7.646
   full:        2.686      -0.561       2.114       0.372       0.756      -4.799

           -------------------------------------------------
          |                Geometry Summary                 |
           -------------------------------------------------

      molecular mass/u    :      192.3184000
   center of mass at/Å    :        0.7608643      -0.8577917      -0.5129178
  moments of inertia/u·Å² :        0.3992168E+03   0.1342429E+04   0.1628321E+04
rotational constants/cm⁻¹ :        0.4222676E-01   0.1255756E-01   0.1035277E-01

 * 26 selected distances

     #   Z        #   Z                                     value/Å
     1   6 C      2  16 S                                 1.7146836
     2  16 S      3   6 C                                 1.7446891 (max)
     3   6 C      4   6 C                                 1.3790190
     1   6 C      5   6 C                                 1.3617721
     4   6 C      5   6 C                                 1.4211223
     6   6 C      7   6 C                                 1.5299854
     8   6 C      9   6 C                                 1.5306640
     3   6 C     10   6 C                                 1.4288533
    10   6 C     11   6 C                                 1.3452519
    12   6 C     13   6 C                                 1.3322675
     1   6 C     14   1 H                                 1.0723825 (min)
     6   6 C     15   1 H                                 1.0919825
     6   6 C     16   1 H                                 1.0912145
     7   6 C     17   1 H                                 1.0875194
     7   6 C     18   1 H                                 1.0876562
     7   6 C     19   1 H                                 1.0877053
     8   6 C     20   1 H                                 1.0919505
     8   6 C     21   1 H                                 1.0904450
     9   6 C     22   1 H                                 1.0876633
     9   6 C     23   1 H                                 1.0877731
     9   6 C     24   1 H                                 1.0879156
    10   6 C     25   1 H                                 1.0823705
    11   6 C     26   1 H                                 1.0826642
    12   6 C     27   1 H                                 1.0832103
    13   6 C     28   1 H                                 1.0774388
    13   6 C     29   1 H                                 1.0761177

 * 3 distinct bonds (by element types)

   Z      Z             #   av. dist./Å        max./Å        min./Å
   1 H    6 C          16     1.0853756     1.0919825     1.0723825
   6 C    6 C           8     1.4161169     1.5306640     1.3322675
   6 C   16 S           2     1.7296864     1.7446891     1.7146836


optimized geometry written to: xtbopt.xyz


           -------------------------------------------------
          | TOTAL ENERGY              -37.054384587560 Eh   |
          | GRADIENT NORM               0.000354609333 Eh/α |
          | HOMO-LUMO GAP               2.438766885980 eV   |
           -------------------------------------------------

------------------------------------------------------------------------
 * finished run on 2021/05/19 at 10:58:53.929     
------------------------------------------------------------------------
 total:
 * wall-time:     0 d,  0 h,  0 min,  1.155 sec
 *  cpu-time:     0 d,  0 h,  0 min,  1.148 sec
 * ratio c/w:     0.994 speedup
 SCF:
 * wall-time:     0 d,  0 h,  0 min,  0.046 sec
 *  cpu-time:     0 d,  0 h,  0 min,  0.045 sec
 * ratio c/w:     0.999 speedup
 ANC optimizer:
 * wall-time:     0 d,  0 h,  0 min,  1.080 sec
 *  cpu-time:     0 d,  0 h,  0 min,  1.080 sec
 * ratio c/w:     1.000 speedup

