      -----------------------------------------------------------      
     |                   =====================                   |     
     |                           x T B                           |     
     |                   =====================                   |     
     |                         S. Grimme                         |     
     |          Mulliken Center for Theoretical Chemistry        |     
     |                    University of Bonn                     |     
     |                Version 6.2 RC2 (SAW190805)                |     
      -----------------------------------------------------------      

   This program is distributed in the hope that it will be useful,
   but WITHOUT ANY WARRANTY; without even the implied warranty of
   MERCHANTABILITY or FITNESS FOR A PARTICULAR PURPOSE.
   
   FOR NON-COMMERCIAL, ACADEMIA USE ONLY.
   
   Cite this work as:
   * S. Grimme, C. Bannwarth, P. Shushkov, J. Chem. Theory Comput., 2017,
     13, 1989-2009. DOI: 10.1021/acs.jctc.7b00118
   * C. Bannwarth, S. Ehlert and S. Grimme., J. Chem. Theory Comput., 2019,
     15, 1652-1671. DOI: 10.1021/acs.jctc.8b01176
   * P. Pracht, E. Caldeweyher, S. Ehlert, S. Grimme, ChemRxiv, 2019, preprint.
     DOI: 10.26434/chemrxiv.8326202.v1
   
   for DFT-D4:
   * E. Caldeweyher, C. Bannwarth and S. Grimme, J. Chem. Phys., 2017,
     147, 034112. DOI: 10.1063/1.4993215
   * E. Caldeweyher, S. Ehlert, A. Hansen, H. Neugebauer, S. Spicher,
     C. Bannwarth and S. Grimme, J. Chem. Phys., 2019, 150, 154122.
     DOI: 10.1063/1.5090222
   
   for sTDA-xTB:
   * S. Grimme and C. Bannwarth, J. Chem. Phys., 2016, 145, 054103.
     DOI: 10.1063/1.4959605
   
   in the mass-spec context:
   * V. Asgeirsson, C. Bauer and S. Grimme, Chem. Sci., 2017, 8, 4879.
     DOI: 10.1039/c7sc00601b
   
   for metadynamics refer to:
   * S. Grimme, J. Chem. Theory Comput., 2019, 155, 2847-2862
     DOI: 10.1021/acs.jctc.9b00143
   
   with help from (in alphabetical order)
   C. Bannwarth, F. Bohle, G. Brandenburg, E. Caldeweyher, M. Checinski,
   S. Dohm, S. Ehlert, S. Ehrlich, F. März, H. Neugebauer, J. Pisarek,
   P. Pracht, P. Shushkov, and S. Spicher.
   
 * started run on 2021/05/19 at 10:58:54.424     

           -------------------------------------------------
          |                Calculation Setup                |
           -------------------------------------------------

          program call               : /ihome/ghutchison/geoffh/xtb/xtb 130.xyz -opt
          hostname                   : smp-n83
          coordinate file            : 130.xyz
          omp threads                :                     1
          number of atoms            :                    14
          number of electrons        :                    40
          charge                     :                     0
          spin                       :                   0.0
          first test random number   :      0.11593979776599


########################################################################
# WARNING! Please study the warnings concerning your input carefully
#  - the use of '-opt' is discouraged, please use '--opt' next time
########################################################################

           ------------------------------------------------- 
          |                 G F N 2 - x T B                 |
          | Geometry, Frequencies, Noncovalent interactions |
          |            JCTC 2019 parametrisation            |
           ------------------------------------------------- 
             KAB for C  - Si     :                1.0500
             KAB for H  - Pd     :                0.9500
             k(s)              :                1.8500
             k(p)              :                2.2300
             k(d)              :                2.2300
             k(f)              :                2.0000
             kEN (H0ij)        :               -2.0000
             D4 a1             :                0.5200
             D4 a2             :                5.0000
             D4 s6             :                1.0000
             D4 s8             :                2.7000
             D4 s9             :                5.0000
             alphaj            :                2.0000

  Z AO/shell   Hii/eV     exponent
  1     Wed Apr 25 08:07:45 CEST 2018   EN: 2.200 GM2: 0.406  GM3: 0.0800  RAES: 1.40
     1s    -10.707211    1.230000
  6     Wed Apr 25 08:07:45 CEST 2018   EN: 2.550 GM2: 0.538  GM3: 0.1500  RAES: 3.00
     2s    -13.970922    2.096432
     2p    -10.063292    1.800000
  7     Wed Apr 25 08:07:45 CEST 2018   EN: 3.040 GM2: 0.461  GM3:-0.0640  RAES: 1.90
     2s    -16.686243    2.339881
     2p    -12.523956    2.014332

           ------------------------------------------------- 
          |        Self-Consistent Charge Iterations        |
           ------------------------------------------------- 

          ...................................................
          :                      SETUP                      :
          :.................................................:
          :  # basis functions                  38          :
          :  # atomic orbitals                  38          :
          :  # shells                           22          :
          :  # electrons                        40          :
          :  max. iterations                   250          :
          :  Hamiltonian                  GFN2-xTB          :
          :  restarted?                      false          :
          :  GBSA solvation                  false          :
          :  PC potential                    false          :
          :  electronic temp.          300.0000000     K    :
          :  accuracy                    1.0000000          :
          :  -> integral cutoff          0.2500000E+02      :
          :  -> integral neglect         0.1000000E-07      :
          :  -> SCF convergence          0.1000000E-05 Eh   :
          :  -> wf. convergence          0.1000000E-03 e    :
          :  Broyden damping             0.4000000          :
          ...................................................

 iter      E             dE          RMSdq      gap      omega  full diag
   1    -21.9925739 -0.219926E+02  0.373E+00    4.07       0.0  T
   2    -22.0774887 -0.849148E-01  0.281E+00    3.99       1.0  T
   3    -22.0924026 -0.149139E-01  0.165E+00    4.07       1.0  T
   4    -22.0894691  0.293350E-02  0.736E-01    4.02       1.0  T
   5    -22.0935691 -0.410005E-02  0.100E-01    4.05       1.0  T
   6    -22.0935892 -0.200398E-04  0.327E-02    4.05       1.0  T
   7    -22.0935906 -0.140758E-05  0.126E-02    4.05       2.1  T
   8    -22.0935913 -0.721760E-06  0.473E-03    4.05       5.7  T
   9    -22.0935914 -0.154897E-06  0.155E-03    4.05      17.2  T
  10    -22.0935915 -0.114729E-07  0.167E-04    4.05     160.4  T
  11    -22.0935915 -0.152848E-09  0.675E-05    4.05     396.1  T

   *** convergence criteria satisfied after 11 iterations ***

         #    Occupation            Energy/Eh            Energy/eV
      -------------------------------------------------------------
         1        2.0000           -0.6603186             -17.9682
       ...           ...                  ...                  ...
        14        2.0000           -0.4633594             -12.6087
        15        2.0000           -0.4596544             -12.5078
        16        2.0000           -0.4403664             -11.9830
        17        2.0000           -0.4224641             -11.4958
        18        2.0000           -0.3944067             -10.7324
        19        2.0000           -0.3572669              -9.7217
        20        2.0000           -0.3408679              -9.2755 (HOMO)
        21                         -0.1920784              -5.2267 (LUMO)
        22                         -0.1394150              -3.7937
        23                         -0.0937253              -2.5504
        24                          0.0062620               0.1704
        25                          0.0369514               1.0055
       ...                                ...                  ...
        38                          0.6976550              18.9842
      -------------------------------------------------------------
                  HL-Gap            0.1487895 Eh            4.0488 eV
             Fermi-level           -0.2664732 Eh           -7.2511 eV

 SCC (total)                   0 d,  0 h,  0 min,  0.015 sec
 SCC setup                      ...        0 min,  0.000 sec (  1.164%)
 Dispersion                     ...        0 min,  0.000 sec (  0.924%)
 integral evaluation            ...        0 min,  0.003 sec ( 19.750%)
 zeroth order Hamiltonian       ...        0 min,  0.000 sec (  0.543%)
 iterations                     ...        0 min,  0.006 sec ( 42.365%)
 molecular gradient             ...        0 min,  0.005 sec ( 32.802%)
 printout                       ...        0 min,  0.000 sec (  2.055%)

         :::::::::::::::::::::::::::::::::::::::::::::::::::::
         ::                     SUMMARY                     ::
         :::::::::::::::::::::::::::::::::::::::::::::::::::::
         :: total energy             -21.734832856984 Eh    ::
         :: gradient norm              0.059608506283 Eh/a0 ::
         :: HOMO-LUMO gap              4.048767881499 eV    ::
         ::.................................................::
         :: SCC energy               -22.093591458586 Eh    ::
         :: -> isotropic ES            0.007833461215 Eh    ::
         :: -> anisotropic ES          0.006303081790 Eh    ::
         :: -> anisotropic XC          0.011107825241 Eh    ::
         :: -> dispersion             -0.011014740773 Eh    ::
         :: repulsion energy           0.358746362276 Eh    ::
         :: add. restraining           0.000000000000 Eh    ::
         :::::::::::::::::::::::::::::::::::::::::::::::::::::

      ----------------------------------------------------------- 
     |                   =====================                   |
     |                        A N C O P T                        |
     |                   =====================                   |
     |               Approximate Normal Coordinate               |
     |                Rational Function Optimizer                |
      ----------------------------------------------------------- 

          ...................................................
          :                      SETUP                      :
          :.................................................:
          :   optimization level            normal          :
          :   max. optcycles                   200          :
          :   ANC micro-cycles                  20          :
          :   degrees of freedom                36          :
          :.................................................:
          :   RF solver                   davidson          :
          :   input Hessian                  false          :
          :   write xtbopt.log                true          :
          :   linear?                        false          :
          :   energy convergence         0.5000000E-05 Eh   :
          :   grad. convergence          0.1000000E-02 Eh/α :
          :   maximium RF displ.         2.0000000          :
          :   Hlow (freq-cutoff)         0.5000000E-02      :
          :   Hmax (freq-cutoff)         5.0000000          :
          :   S6 in model hess.         20.0000000          :
          ...................................................

generating ANC from model Hessian ...
Using Lindh-Hessian (1995)
 Shifting diagonal of input Hessian by   0.000000000000000E+000
 Lowest  eigenvalues of input Hessian
   -0.000000   -0.000000   -0.000000   -0.000000    0.000000    0.000000
    0.010748    0.012499    0.021174    0.030729    0.047405    0.057143
    0.080072    0.103614    0.108283    0.113535    0.133994    0.135758
 Highest eigenvalues
    1.795618    1.886118    2.034184    2.097262    2.103308    2.246850
 

........................................................................
.............................. CYCLE    1 ..............................
........................................................................
   1    -22.0935915 -0.220936E+02  0.680E-06    4.05       0.0  T
   2    -22.0935915 -0.355271E-14  0.406E-06    4.05    6574.7  T
   3    -22.0935915  0.142109E-13  0.495E-07    4.05   53946.0  T
     SCC iter.                  ...        0 min,  0.002 sec
     gradient                   ...        0 min,  0.005 sec
 * total energy  :   -21.7348329 Eh     change       -0.1726015E-09 Eh
   gradient norm :     0.0596085 Eh/α   predicted     0.0000000E+00 (-100.00%)
   displ. norm   :     0.0997978 α      lambda       -0.3365262E-02
   maximum displ.:     0.0671310 α      in ANC's #15, #7, #29, ...

........................................................................
.............................. CYCLE    2 ..............................
........................................................................
   1    -22.1022821 -0.221023E+02  0.104E-01    4.08       0.0  T
   2    -22.1023038 -0.217708E-04  0.622E-02    4.07       1.0  T
   3    -22.1023048 -0.930766E-06  0.274E-02    4.07       1.0  T
   4    -22.1023070 -0.226030E-05  0.447E-03    4.07       6.0  T
   5    -22.1023071 -0.106015E-06  0.165E-03    4.07      16.2  T
     SCC iter.                  ...        0 min,  0.003 sec
     gradient                   ...        0 min,  0.005 sec
 * total energy  :   -21.7370802 Eh     change       -0.2247322E-02 Eh
   gradient norm :     0.0223620 Eh/α   predicted    -0.1699389E-02 ( -24.38%)
   displ. norm   :     0.0661634 α      lambda       -0.7818814E-03
   maximum displ.:     0.0417215 α      in ANC's #7, #15, #9, ...

........................................................................
.............................. CYCLE    3 ..............................
........................................................................
   1    -22.1051520 -0.221052E+02  0.617E-02    4.08       0.0  T
   2    -22.1051593 -0.733757E-05  0.334E-02    4.07       1.0  T
   3    -22.1051595 -0.183797E-06  0.150E-02    4.07       1.8  T
   4    -22.1051597 -0.148948E-06  0.325E-03    4.07       8.2  T
   5    -22.1051598 -0.990709E-07  0.135E-03    4.07      19.9  T
     SCC iter.                  ...        0 min,  0.003 sec
     gradient                   ...        0 min,  0.005 sec
 * total energy  :   -21.7375388 Eh     change       -0.4586592E-03 Eh
   gradient norm :     0.0071921 Eh/α   predicted    -0.3926538E-03 ( -14.39%)
   displ. norm   :     0.0240223 α      lambda       -0.8629518E-04
   maximum displ.:     0.0138081 α      in ANC's #7, #9, #22, ...

........................................................................
.............................. CYCLE    4 ..............................
........................................................................
   1    -22.1046341 -0.221046E+02  0.284E-02    4.06       0.0  T
   2    -22.1046362 -0.217341E-05  0.143E-02    4.06       1.9  T
   3    -22.1046364 -0.174235E-06  0.821E-03    4.06       3.3  T
   4    -22.1046366 -0.172570E-06  0.216E-03    4.06      12.4  T
   5    -22.1046366 -0.436595E-07  0.810E-04    4.06      33.0  T
     SCC iter.                  ...        0 min,  0.003 sec
     gradient                   ...        0 min,  0.005 sec
 * total energy  :   -21.7375957 Eh     change       -0.5685617E-04 Eh
   gradient norm :     0.0041174 Eh/α   predicted    -0.4317322E-04 ( -24.07%)
   displ. norm   :     0.0145567 α      lambda       -0.2830375E-04
   maximum displ.:     0.0084098 α      in ANC's #9, #22, #7, ...

........................................................................
.............................. CYCLE    5 ..............................
........................................................................
   1    -22.1041583 -0.221042E+02  0.208E-02    4.06       0.0  T
   2    -22.1041597 -0.137857E-05  0.115E-02    4.06       2.3  T
   3    -22.1041600 -0.295151E-06  0.653E-03    4.06       4.1  T
   4    -22.1041601 -0.119481E-06  0.156E-03    4.06      17.1  T
   5    -22.1041602 -0.219733E-07  0.576E-04    4.06      46.4  T
     SCC iter.                  ...        0 min,  0.003 sec
     gradient                   ...        0 min,  0.005 sec
 * total energy  :   -21.7376122 Eh     change       -0.1649048E-04 Eh
   gradient norm :     0.0022417 Eh/α   predicted    -0.1415329E-04 ( -14.17%)
   displ. norm   :     0.0061579 α      lambda       -0.5059259E-05
   maximum displ.:     0.0046283 α      in ANC's #3, #9, #22, ...

........................................................................
.............................. CYCLE    6 ..............................
........................................................................
   1    -22.1041393 -0.221041E+02  0.837E-03    4.06       0.0  T
   2    -22.1041394 -0.172923E-06  0.507E-03    4.06       5.3  T
   3    -22.1041395 -0.392962E-07  0.276E-03    4.06       9.7  T
   4    -22.1041395 -0.275808E-07  0.567E-04    4.06      47.2  T
   5    -22.1041395 -0.304751E-08  0.190E-04    4.06     140.7  T
     SCC iter.                  ...        0 min,  0.003 sec
     gradient                   ...        0 min,  0.005 sec
 * total energy  :   -21.7376151 Eh     change       -0.2932951E-05 Eh
   gradient norm :     0.0011001 Eh/α   predicted    -0.2528999E-05 ( -13.77%)
   displ. norm   :     0.0042246 α      lambda       -0.1259722E-05
   maximum displ.:     0.0032630 α      in ANC's #3, #9, #35, ...

........................................................................
.............................. CYCLE    7 ..............................
........................................................................
   1    -22.1042804 -0.221043E+02  0.608E-03    4.06       0.0  T
   2    -22.1042805 -0.890713E-07  0.333E-03    4.06       8.0  T
   3    -22.1042805 -0.361232E-08  0.171E-03    4.06      15.6  T
   4    -22.1042805 -0.107592E-07  0.593E-04    4.06      45.1  T
   5    -22.1042805 -0.247433E-08  0.119E-04    4.06     224.4  T
     SCC iter.                  ...        0 min,  0.003 sec
     gradient                   ...        0 min,  0.005 sec
 * total energy  :   -21.7376158 Eh     change       -0.6596797E-06 Eh
   gradient norm :     0.0004687 Eh/α   predicted    -0.6300042E-06 (  -4.50%)
   displ. norm   :     0.0020232 α      lambda       -0.2254615E-06
   maximum displ.:     0.0019053 α      in ANC's #3, #16, #29, ...

   *** GEOMETRY OPTIMIZATION CONVERGED AFTER 7 ITERATIONS ***

------------------------------------------------------------------------
 total energy gain   :        -0.0027829 Eh       -1.7463 kcal/mol
 total RMSD          :         0.0514533 a0        0.0272 Å
 total power (kW/mol):        -1.0437938 (step)  -92.5490 (real)
------------------------------------------------------------------------

 ANCopt (total)                0 d,  0 h,  0 min,  0.079 sec
 optimizer setup                ...        0 min,  0.000 sec (  0.189%)
 model hessian                  ...        0 min,  0.002 sec (  2.138%)
 ANC generation                 ...        0 min,  0.000 sec (  0.461%)
 coordinate transformation      ...        0 min,  0.000 sec (  0.113%)
 single point calculation       ...        0 min,  0.074 sec ( 94.265%)
 optimization log               ...        0 min,  0.001 sec (  0.638%)
 hessian update                 ...        0 min,  0.000 sec (  0.093%)
 rational function              ...        0 min,  0.001 sec (  1.454%)

================
 final structure:
================
$coord
   -3.96214246998925    0.14758429150022    0.00520184086617      C 
   -2.53383359117282   -2.01204450536620    0.00528706819452      N 
   -0.05106820228174   -1.32204165392367    0.00149199451120      C 
    2.44391379761421   -2.24970403066412   -0.00033929673924      C 
    3.96214247078198   -0.14758429108440   -0.00520184083218      C 
    2.53383359075632    2.01204450493227   -0.00528706819550      N 
    0.05106820313817    1.32204165420087   -0.00149199453430      C 
   -2.44391379796427    2.24970403049866    0.00033929673404      C 
   -5.98675092104336    0.04368251202012    0.00844818126303      H 
   -3.22089760261171   -3.78202236815815    0.00773446036918      H 
    3.06425937262178   -4.17796869835166    0.00116317940592      H 
    5.98675092123754   -0.04368251229003   -0.00844818120400      H 
    3.22089760182387    3.78202236826314   -0.00773446039871      H 
   -3.06425937291072    4.17796869842296   -0.00116317944012      H 
$end
           -------------------------------------------------
          |                Final Singlepoint                |
           -------------------------------------------------

          ...................................................
          :                      SETUP                      :
          :.................................................:
          :  # basis functions                  38          :
          :  # atomic orbitals                  38          :
          :  # shells                           22          :
          :  # electrons                        40          :
          :  max. iterations                   250          :
          :  Hamiltonian                  GFN2-xTB          :
          :  restarted?                      false          :
          :  GBSA solvation                  false          :
          :  PC potential                    false          :
          :  electronic temp.          300.0000000     K    :
          :  accuracy                    1.0000000          :
          :  -> integral cutoff          0.2500000E+02      :
          :  -> integral neglect         0.1000000E-07      :
          :  -> SCF convergence          0.1000000E-05 Eh   :
          :  -> wf. convergence          0.1000000E-03 e    :
          :  Broyden damping             0.4000000          :
          ...................................................

 iter      E             dE          RMSdq      gap      omega  full diag
   1    -22.1042805 -0.221043E+02  0.324E-05    4.06       0.0  T
   2    -22.1042805 -0.908784E-11  0.162E-05    4.06    1652.1  T
   3    -22.1042805 -0.213518E-11  0.739E-06    4.06    3614.9  T

   *** convergence criteria satisfied after 3 iterations ***

         #    Occupation            Energy/Eh            Energy/eV
      -------------------------------------------------------------
         1        2.0000           -0.6586450             -17.9226
       ...           ...                  ...                  ...
        14        2.0000           -0.4628035             -12.5935
        15        2.0000           -0.4591290             -12.4935
        16        2.0000           -0.4398124             -11.9679
        17        2.0000           -0.4195883             -11.4176
        18        2.0000           -0.3965682             -10.7912
        19        2.0000           -0.3554801              -9.6731
        20        2.0000           -0.3390364              -9.2256 (HOMO)
        21                         -0.1898951              -5.1673 (LUMO)
        22                         -0.1331899              -3.6243
        23                         -0.0992881              -2.7018
        24                          0.0118929               0.3236
        25                          0.0471755               1.2837
       ...                                ...                  ...
        38                          0.7182190              19.5437
      -------------------------------------------------------------
                  HL-Gap            0.1491413 Eh            4.0583 eV
             Fermi-level           -0.2644658 Eh           -7.1965 eV

 SCC (total)                   0 d,  0 h,  0 min,  0.010 sec
 SCC setup                      ...        0 min,  0.000 sec (  1.232%)
 Dispersion                     ...        0 min,  0.000 sec (  0.776%)
 integral evaluation            ...        0 min,  0.003 sec ( 27.796%)
 zeroth order Hamiltonian       ...        0 min,  0.000 sec (  0.642%)
 iterations                     ...        0 min,  0.002 sec ( 18.857%)
 molecular gradient             ...        0 min,  0.005 sec ( 47.846%)
 printout                       ...        0 min,  0.000 sec (  2.360%)

         :::::::::::::::::::::::::::::::::::::::::::::::::::::
         ::                     SUMMARY                     ::
         :::::::::::::::::::::::::::::::::::::::::::::::::::::
         :: total energy             -21.737615786812 Eh    ::
         :: gradient norm              0.000467894907 Eh/a0 ::
         :: HOMO-LUMO gap              4.058340945971 eV    ::
         ::.................................................::
         :: SCC energy               -22.104280510015 Eh    ::
         :: -> isotropic ES            0.007740628542 Eh    ::
         :: -> anisotropic ES          0.006168668994 Eh    ::
         :: -> anisotropic XC          0.010430134770 Eh    ::
         :: -> dispersion             -0.011041873565 Eh    ::
         :: repulsion energy           0.366652467303 Eh    ::
         :: add. restraining           0.000000000000 Eh    ::
         :::::::::::::::::::::::::::::::::::::::::::::::::::::

           -------------------------------------------------
          |                Property Printout                |
           -------------------------------------------------

    * Orbital Energies and Occupations

         #    Occupation            Energy/Eh            Energy/eV
      -------------------------------------------------------------
         1        2.0000           -0.6586450             -17.9226
       ...           ...                  ...                  ...
         8        2.0000           -0.5493904             -14.9497
         9        2.0000           -0.5313882             -14.4598
        10        2.0000           -0.5097699             -13.8715
        11        2.0000           -0.4901988             -13.3390
        12        2.0000           -0.4855696             -13.2130
        13        2.0000           -0.4709422             -12.8150
        14        2.0000           -0.4628035             -12.5935
        15        2.0000           -0.4591290             -12.4935
        16        2.0000           -0.4398124             -11.9679
        17        2.0000           -0.4195883             -11.4176
        18        2.0000           -0.3965682             -10.7912
        19        2.0000           -0.3554801              -9.6731
        20        2.0000           -0.3390364              -9.2256 (HOMO)
        21                         -0.1898951              -5.1673 (LUMO)
        22                         -0.1331899              -3.6243
        23                         -0.0992881              -2.7018
        24                          0.0118929               0.3236
        25                          0.0471755               1.2837
        26                          0.1359101               3.6983
        27                          0.1384293               3.7669
        28                          0.1669497               4.5429
        29                          0.2004603               5.4548
        30                          0.2187309               5.9520
        31                          0.2708120               7.3692
       ...                                ...                  ...
        38                          0.7182190              19.5437
      -------------------------------------------------------------
                  HL-Gap            0.1491413 Eh            4.0583 eV
             Fermi-level           -0.2644658 Eh           -7.1965 eV

     #   Z        covCN         q      C6AA      α(0)
     1   6 C      3.073    -0.014    28.275     8.719
     2   7 N      2.776    -0.102    23.229     7.158
     3   6 C      3.252     0.009    26.763     8.372
     4   6 C      3.000    -0.086    30.133     9.005
     5   6 C      3.073    -0.014    28.275     8.719
     6   7 N      2.776    -0.102    23.229     7.158
     7   6 C      3.252     0.009    26.763     8.372
     8   6 C      3.000    -0.086    30.133     9.005
     9   1 H      0.926     0.023     2.690     2.565
    10   1 H      0.860     0.151     1.397     1.852
    11   1 H      0.926     0.019     2.755     2.595
    12   1 H      0.926     0.023     2.690     2.565
    13   1 H      0.860     0.151     1.397     1.852
    14   1 H      0.926     0.019     2.755     2.595

 Mol. C6AA /au·bohr⁶  :       2552.126772
 Mol. C8AA /au·bohr⁸  :      61563.570457
 Mol. α(0) /au        :         80.531046


Wiberg/Mayer (AO) data.
largest (>0.10) Wiberg bond orders for each atom
          total WBO             WBO to atom ...
     1  C   3.944        C    8 1.563    N    2 1.209    H    9 0.972
     2  N   3.537        C    1 1.209    C    3 1.165    H   10 0.951
     3  C   3.945        C    7 1.312    C    4 1.264    N    2 1.165
     4  C   3.969        C    5 1.563    C    3 1.264    H   11 0.974
     5  C   3.944        C    4 1.563    N    6 1.209    H   12 0.972
     6  N   3.537        C    5 1.209    C    7 1.165    H   13 0.951
     7  C   3.945        C    3 1.312    C    8 1.264    N    6 1.165
     8  C   3.969        C    1 1.563    C    7 1.264    H   14 0.974
     9  H   0.999        C    1 0.972
    10  H   0.977        N    2 0.951
    11  H   0.999        C    4 0.974
    12  H   0.999        C    5 0.972
    13  H   0.977        N    6 0.951
    14  H   0.999        C    8 0.974

molecular dipole:
                 x           y           z       tot (Debye)
 q only:        0.000       0.000      -0.000
   full:        0.000       0.000      -0.000       0.000
molecular quadrupole (traceless):
                xx          xy          yy          xz          yz          zz
 q only:        0.705       4.657       2.119      -0.009      -0.010      -2.824
  q+dip:        2.267       7.097       4.981      -0.020      -0.022      -7.248
   full:        1.568       6.786       4.151      -0.017      -0.018      -5.719

           -------------------------------------------------
          |                Geometry Summary                 |
           -------------------------------------------------

      molecular mass/u    :      106.1268000
   center of mass at/Å    :        0.0000000       0.0000000       0.0000000
  moments of inertia/u·Å² :        0.9562816E+02   0.2275570E+03   0.3231851E+03
rotational constants/cm⁻¹ :        0.1762831E+00   0.7408093E-01   0.5216092E-01

 * 15 selected distances

     #   Z        #   Z                                     value/Å
     1   6 C      2   7 N                                 1.3701566
     2   7 N      3   6 C                                 1.3636193
     3   6 C      4   6 C                                 1.4085955
     4   6 C      5   6 C                                 1.3721873
     5   6 C      6   7 N                                 1.3701566
     3   6 C      7   6 C                                 1.4002332
     6   7 N      7   6 C                                 1.3636193
     1   6 C      8   6 C                                 1.3721873
     7   6 C      8   6 C                                 1.4085955 (max)
     1   6 C      9   1 H                                 1.0727880
     2   7 N     10   1 H                                 1.0047242 (min)
     4   6 C     11   1 H                                 1.0718989
     5   6 C     12   1 H                                 1.0727880
     6   7 N     13   1 H                                 1.0047242
     8   6 C     14   1 H                                 1.0718989

 * 4 distinct bonds (by element types)

   Z      Z             #   av. dist./Å        max./Å        min./Å
   1 H    6 C           4     1.0723435     1.0727880     1.0718989
   6 C    6 C           5     1.3923598     1.4085955     1.3721873
   1 H    7 N           2     1.0047242     1.0047242     1.0047242
   6 C    7 N           4     1.3668880     1.3701566     1.3636193


optimized geometry written to: xtbopt.xyz


           -------------------------------------------------
          | TOTAL ENERGY              -21.737615786812 Eh   |
          | GRADIENT NORM               0.000467894907 Eh/α |
          | HOMO-LUMO GAP               4.058340945971 eV   |
           -------------------------------------------------

------------------------------------------------------------------------
 * finished run on 2021/05/19 at 10:58:54.544     
------------------------------------------------------------------------
 total:
 * wall-time:     0 d,  0 h,  0 min,  0.120 sec
 *  cpu-time:     0 d,  0 h,  0 min,  0.120 sec
 * ratio c/w:     0.995 speedup
 SCF:
 * wall-time:     0 d,  0 h,  0 min,  0.015 sec
 *  cpu-time:     0 d,  0 h,  0 min,  0.015 sec
 * ratio c/w:     1.000 speedup
 ANC optimizer:
 * wall-time:     0 d,  0 h,  0 min,  0.090 sec
 *  cpu-time:     0 d,  0 h,  0 min,  0.090 sec
 * ratio c/w:     1.000 speedup

