      -----------------------------------------------------------      
     |                   =====================                   |     
     |                           x T B                           |     
     |                   =====================                   |     
     |                         S. Grimme                         |     
     |          Mulliken Center for Theoretical Chemistry        |     
     |                    University of Bonn                     |     
     |                Version 6.2 RC2 (SAW190805)                |     
      -----------------------------------------------------------      

   This program is distributed in the hope that it will be useful,
   but WITHOUT ANY WARRANTY; without even the implied warranty of
   MERCHANTABILITY or FITNESS FOR A PARTICULAR PURPOSE.
   
   FOR NON-COMMERCIAL, ACADEMIA USE ONLY.
   
   Cite this work as:
   * S. Grimme, C. Bannwarth, P. Shushkov, J. Chem. Theory Comput., 2017,
     13, 1989-2009. DOI: 10.1021/acs.jctc.7b00118
   * C. Bannwarth, S. Ehlert and S. Grimme., J. Chem. Theory Comput., 2019,
     15, 1652-1671. DOI: 10.1021/acs.jctc.8b01176
   * P. Pracht, E. Caldeweyher, S. Ehlert, S. Grimme, ChemRxiv, 2019, preprint.
     DOI: 10.26434/chemrxiv.8326202.v1
   
   for DFT-D4:
   * E. Caldeweyher, C. Bannwarth and S. Grimme, J. Chem. Phys., 2017,
     147, 034112. DOI: 10.1063/1.4993215
   * E. Caldeweyher, S. Ehlert, A. Hansen, H. Neugebauer, S. Spicher,
     C. Bannwarth and S. Grimme, J. Chem. Phys., 2019, 150, 154122.
     DOI: 10.1063/1.5090222
   
   for sTDA-xTB:
   * S. Grimme and C. Bannwarth, J. Chem. Phys., 2016, 145, 054103.
     DOI: 10.1063/1.4959605
   
   in the mass-spec context:
   * V. Asgeirsson, C. Bauer and S. Grimme, Chem. Sci., 2017, 8, 4879.
     DOI: 10.1039/c7sc00601b
   
   for metadynamics refer to:
   * S. Grimme, J. Chem. Theory Comput., 2019, 155, 2847-2862
     DOI: 10.1021/acs.jctc.9b00143
   
   with help from (in alphabetical order)
   C. Bannwarth, F. Bohle, G. Brandenburg, E. Caldeweyher, M. Checinski,
   S. Dohm, S. Ehlert, S. Ehrlich, F. März, H. Neugebauer, J. Pisarek,
   P. Pracht, P. Shushkov, and S. Spicher.
   
 * started run on 2021/05/19 at 10:58:54.607     

           -------------------------------------------------
          |                Calculation Setup                |
           -------------------------------------------------

          program call               : /ihome/ghutchison/geoffh/xtb/xtb 131.xyz -opt
          hostname                   : smp-n83
          coordinate file            : 131.xyz
          omp threads                :                     1
          number of atoms            :                    24
          number of electrons        :                    78
          charge                     :                     0
          spin                       :                   0.0
          first test random number   :      0.25872641009825


########################################################################
# WARNING! Please study the warnings concerning your input carefully
#  - the use of '-opt' is discouraged, please use '--opt' next time
########################################################################

           ------------------------------------------------- 
          |                 G F N 2 - x T B                 |
          | Geometry, Frequencies, Noncovalent interactions |
          |            JCTC 2019 parametrisation            |
           ------------------------------------------------- 
             KAB for C  - Si     :                1.0500
             KAB for H  - Pd     :                0.9500
             k(s)              :                1.8500
             k(p)              :                2.2300
             k(d)              :                2.2300
             k(f)              :                2.0000
             kEN (H0ij)        :               -2.0000
             D4 a1             :                0.5200
             D4 a2             :                5.0000
             D4 s6             :                1.0000
             D4 s8             :                2.7000
             D4 s9             :                5.0000
             alphaj            :                2.0000

  Z AO/shell   Hii/eV     exponent
  1     Wed Apr 25 08:07:45 CEST 2018   EN: 2.200 GM2: 0.406  GM3: 0.0800  RAES: 1.40
     1s    -10.707211    1.230000
  6     Wed Apr 25 08:07:45 CEST 2018   EN: 2.550 GM2: 0.538  GM3: 0.1500  RAES: 3.00
     2s    -13.970922    2.096432
     2p    -10.063292    1.800000
  7     Wed Apr 25 08:07:45 CEST 2018   EN: 3.040 GM2: 0.461  GM3:-0.0640  RAES: 1.90
     2s    -16.686243    2.339881
     2p    -12.523956    2.014332
  9     Mon Apr 23 13:58:50 CEST 2018   EN: 3.980 GM2: 0.532  GM3: 0.1426  RAES: 2.40
     2s    -23.458179    2.416361
     2p    -15.746583    2.308399

           ------------------------------------------------- 
          |        Self-Consistent Charge Iterations        |
           ------------------------------------------------- 

          ...................................................
          :                      SETUP                      :
          :.................................................:
          :  # basis functions                  69          :
          :  # atomic orbitals                  69          :
          :  # shells                           39          :
          :  # electrons                        78          :
          :  max. iterations                   250          :
          :  Hamiltonian                  GFN2-xTB          :
          :  restarted?                      false          :
          :  GBSA solvation                  false          :
          :  PC potential                    false          :
          :  electronic temp.          300.0000000     K    :
          :  accuracy                    1.0000000          :
          :  -> integral cutoff          0.2500000E+02      :
          :  -> integral neglect         0.1000000E-07      :
          :  -> SCF convergence          0.1000000E-05 Eh   :
          :  -> wf. convergence          0.1000000E-03 e    :
          :  Broyden damping             0.4000000          :
          ...................................................

 iter      E             dE          RMSdq      gap      omega  full diag
   1    -44.6134592 -0.446135E+02  0.421E+00    2.68       0.0  T
   2    -44.6781598 -0.647006E-01  0.285E+00    2.49       1.0  T
   3    -44.6862289 -0.806905E-02  0.144E+00    2.58       1.0  T
   4    -44.6996112 -0.133823E-01  0.380E-01    2.52       1.0  T
   5    -44.7021121 -0.250091E-02  0.158E-01    2.49       1.0  T
   6    -44.7023197 -0.207626E-03  0.651E-02    2.50       1.0  T
   7    -44.7023626 -0.428524E-04  0.330E-02    2.51       1.0  T
   8    -44.7023743 -0.117460E-04  0.124E-02    2.51       1.6  T
   9    -44.7023753 -0.101637E-05  0.484E-03    2.51       4.2  T
  10    -44.7023754 -0.596367E-07  0.133E-03    2.51      15.3  T
  11    -44.7023754 -0.224870E-07  0.477E-04    2.51      42.8  T
  12    -44.7023754 -0.343363E-09  0.282E-04    2.51      72.4  T

   *** convergence criteria satisfied after 12 iterations ***

         #    Occupation            Energy/Eh            Energy/eV
      -------------------------------------------------------------
         1        2.0000           -0.8265155             -22.4906
       ...           ...                  ...                  ...
        33        2.0000           -0.4648171             -12.6483
        34        2.0000           -0.4447556             -12.1024
        35        2.0000           -0.4334958             -11.7960
        36        2.0000           -0.4249159             -11.5626
        37        2.0000           -0.4239790             -11.5371
        38        2.0000           -0.4135115             -11.2522
        39        2.0000           -0.3935110             -10.7080 (HOMO)
        40                         -0.3014174              -8.2020 (LUMO)
        41                         -0.2456928              -6.6856
        42                         -0.2313654              -6.2958
        43                         -0.1915528              -5.2124
        44                         -0.1093642              -2.9760
       ...                                ...                  ...
        69                          0.6268289              17.0569
      -------------------------------------------------------------
                  HL-Gap            0.0920936 Eh            2.5060 eV
             Fermi-level           -0.3474642 Eh           -9.4550 eV

 SCC (total)                   0 d,  0 h,  0 min,  0.040 sec
 SCC setup                      ...        0 min,  0.000 sec (  0.796%)
 Dispersion                     ...        0 min,  0.000 sec (  0.896%)
 integral evaluation            ...        0 min,  0.010 sec ( 24.117%)
 zeroth order Hamiltonian       ...        0 min,  0.000 sec (  0.452%)
 iterations                     ...        0 min,  0.015 sec ( 37.790%)
 molecular gradient             ...        0 min,  0.014 sec ( 34.812%)
 printout                       ...        0 min,  0.000 sec (  0.997%)

         :::::::::::::::::::::::::::::::::::::::::::::::::::::
         ::                     SUMMARY                     ::
         :::::::::::::::::::::::::::::::::::::::::::::::::::::
         :: total energy             -44.196245569132 Eh    ::
         :: gradient norm              0.083885033856 Eh/a0 ::
         :: HOMO-LUMO gap              2.505993493785 eV    ::
         ::.................................................::
         :: SCC energy               -44.702375432341 Eh    ::
         :: -> isotropic ES            0.035068779231 Eh    ::
         :: -> anisotropic ES          0.002135297232 Eh    ::
         :: -> anisotropic XC          0.017874681417 Eh    ::
         :: -> dispersion             -0.022370301592 Eh    ::
         :: repulsion energy           0.506112166734 Eh    ::
         :: add. restraining           0.000000000000 Eh    ::
         :::::::::::::::::::::::::::::::::::::::::::::::::::::

      ----------------------------------------------------------- 
     |                   =====================                   |
     |                        A N C O P T                        |
     |                   =====================                   |
     |               Approximate Normal Coordinate               |
     |                Rational Function Optimizer                |
      ----------------------------------------------------------- 

          ...................................................
          :                      SETUP                      :
          :.................................................:
          :   optimization level            normal          :
          :   max. optcycles                   200          :
          :   ANC micro-cycles                  20          :
          :   degrees of freedom                66          :
          :.................................................:
          :   RF solver                   davidson          :
          :   input Hessian                  false          :
          :   write xtbopt.log                true          :
          :   linear?                        false          :
          :   energy convergence         0.5000000E-05 Eh   :
          :   grad. convergence          0.1000000E-02 Eh/α :
          :   maximium RF displ.         2.0000000          :
          :   Hlow (freq-cutoff)         0.5000000E-02      :
          :   Hmax (freq-cutoff)         5.0000000          :
          :   S6 in model hess.         20.0000000          :
          ...................................................

generating ANC from model Hessian ...
Using Lindh-Hessian (1995)
 Shifting diagonal of input Hessian by   3.445958138816280E-003
 Lowest  eigenvalues of input Hessian
   -0.000000   -0.000000    0.000000    0.000000    0.000000    0.000000
    0.005000    0.005490    0.007562    0.007883    0.008685    0.012111
    0.012961    0.019583    0.023085    0.023234    0.029634    0.037330
 Highest eigenvalues
    1.826152    1.864314    1.944499    1.981718    2.017843    2.122939
 

........................................................................
.............................. CYCLE    1 ..............................
........................................................................
   1    -44.7023754 -0.447024E+02  0.105E-04    2.51       0.0  T
   2    -44.7023754 -0.161222E-10  0.834E-05    2.51     244.9  T
   3    -44.7023754 -0.100577E-09  0.387E-05    2.51     528.0  T
     SCC iter.                  ...        0 min,  0.004 sec
     gradient                   ...        0 min,  0.013 sec
 * total energy  :   -44.1962456 Eh     change        0.9133863E-08 Eh
   gradient norm :     0.0838840 Eh/α   predicted     0.0000000E+00 (-100.00%)
   displ. norm   :     0.2166515 α      lambda       -0.1098342E-01
   maximum displ.:     0.0704811 α      in ANC's #18, #9, #21, ...

........................................................................
.............................. CYCLE    2 ..............................
........................................................................
   1    -44.7423417 -0.447423E+02  0.286E-01    2.69       0.0  T
   2    -44.7427487 -0.406916E-03  0.123E-01    2.65       1.0  T
   3    -44.7427698 -0.211412E-04  0.601E-02    2.66       1.0  T
   4    -44.7427720 -0.216146E-05  0.196E-02    2.65       1.0  T
   5    -44.7427783 -0.633557E-05  0.866E-03    2.65       2.4  T
   6    -44.7427790 -0.654441E-06  0.381E-03    2.65       5.4  T
   7    -44.7427791 -0.124599E-06  0.644E-04    2.65      31.7  T
     SCC iter.                  ...        0 min,  0.008 sec
     gradient                   ...        0 min,  0.013 sec
 * total energy  :   -44.2034697 Eh     change       -0.7224109E-02 Eh
   gradient norm :     0.0311616 Eh/α   predicted    -0.5749480E-02 ( -20.41%)
   displ. norm   :     0.1600547 α      lambda       -0.1941521E-02
   maximum displ.:     0.0790161 α      in ANC's #3, #9, #5, ...

........................................................................
.............................. CYCLE    3 ..............................
........................................................................
   1    -44.7584871 -0.447585E+02  0.148E-01    2.76       0.0  T
   2    -44.7586285 -0.141355E-03  0.660E-02    2.74       1.0  T
   3    -44.7586357 -0.719275E-05  0.364E-02    2.74       1.0  T
   4    -44.7586337  0.198386E-05  0.184E-02    2.74       1.1  T
   5    -44.7586399 -0.621434E-05  0.427E-03    2.74       4.8  T
   6    -44.7586401 -0.205294E-06  0.180E-03    2.74      11.3  T
   7    -44.7586401 -0.109088E-07  0.517E-04    2.74      39.4  T
     SCC iter.                  ...        0 min,  0.008 sec
     gradient                   ...        0 min,  0.013 sec
 * total energy  :   -44.2044848 Eh     change       -0.1015107E-02 Eh
   gradient norm :     0.0080230 Eh/α   predicted    -0.9956477E-03 (  -1.92%)
   displ. norm   :     0.1038383 α      lambda       -0.1987645E-03
   maximum displ.:     0.0641491 α      in ANC's #5, #3, #4, ...

........................................................................
.............................. CYCLE    4 ..............................
........................................................................
   1    -44.7579974 -0.447580E+02  0.655E-02    2.75       0.0  T
   2    -44.7580014 -0.394442E-05  0.380E-02    2.75       1.0  T
   3    -44.7579967  0.470298E-05  0.188E-02    2.75       1.1  T
   4    -44.7580025 -0.581563E-05  0.488E-03    2.75       4.2  T
   5    -44.7580029 -0.408188E-06  0.135E-03    2.75      15.1  T
   6    -44.7580029 -0.787846E-08  0.533E-04    2.75      38.3  T
     SCC iter.                  ...        0 min,  0.007 sec
     gradient                   ...        0 min,  0.012 sec
 * total energy  :   -44.2046178 Eh     change       -0.1330163E-03 Eh
   gradient norm :     0.0042266 Eh/α   predicted    -0.1004624E-03 ( -24.47%)
   displ. norm   :     0.1671869 α      lambda       -0.1952136E-03
   maximum displ.:     0.1190965 α      in ANC's #3, #5, #4, ...

........................................................................
.............................. CYCLE    5 ..............................
........................................................................
   1    -44.7556717 -0.447557E+02  0.933E-02    2.75       0.0  T
   2    -44.7556758 -0.410046E-05  0.543E-02    2.75       1.0  T
   3    -44.7556682  0.753959E-05  0.203E-02    2.75       1.0  T
   4    -44.7556771 -0.889731E-05  0.487E-03    2.75       4.2  T
   5    -44.7556775 -0.359869E-06  0.177E-03    2.75      11.6  T
   6    -44.7556775 -0.111334E-07  0.594E-04    2.75      34.4  T
     SCC iter.                  ...        0 min,  0.007 sec
     gradient                   ...        0 min,  0.013 sec
 * total energy  :   -44.2047318 Eh     change       -0.1139894E-03 Eh
   gradient norm :     0.0046158 Eh/α   predicted    -0.1003404E-03 ( -11.97%)
   displ. norm   :     0.0979016 α      lambda       -0.7442925E-04
   maximum displ.:     0.0722492 α      in ANC's #3, #5, #4, ...

........................................................................
.............................. CYCLE    6 ..............................
........................................................................
   1    -44.7553138 -0.447553E+02  0.579E-02    2.74       0.0  T
   2    -44.7553143 -0.449044E-06  0.342E-02    2.74       1.0  T
   3    -44.7553128  0.146294E-05  0.820E-03    2.74       2.5  T
   4    -44.7553145 -0.171551E-05  0.142E-03    2.74      14.4  T
   5    -44.7553145 -0.993979E-08  0.774E-04    2.74      26.4  T
     SCC iter.                  ...        0 min,  0.006 sec
     gradient                   ...        0 min,  0.012 sec
 * total energy  :   -44.2047925 Eh     change       -0.6074550E-04 Eh
   gradient norm :     0.0044156 Eh/α   predicted    -0.3757307E-04 ( -38.15%)
   displ. norm   :     0.1607066 α      lambda       -0.1112769E-03
   maximum displ.:     0.1204513 α      in ANC's #3, #5, #2, ...

........................................................................
.............................. CYCLE    7 ..............................
........................................................................
   1    -44.7558296 -0.447558E+02  0.926E-02    2.73       0.0  T
   2    -44.7558313 -0.173670E-05  0.546E-02    2.73       1.0  T
   3    -44.7558298  0.156875E-05  0.946E-03    2.73       2.2  T
   4    -44.7558318 -0.207774E-05  0.270E-03    2.73       7.6  T
   5    -44.7558319 -0.770552E-07  0.132E-03    2.73      15.5  T
     SCC iter.                  ...        0 min,  0.006 sec
     gradient                   ...        0 min,  0.013 sec
 * total energy  :   -44.2048786 Eh     change       -0.8605640E-04 Eh
   gradient norm :     0.0028652 Eh/α   predicted    -0.5707549E-04 ( -33.68%)
   displ. norm   :     0.1772856 α      lambda       -0.8753696E-04
   maximum displ.:     0.1400749 α      in ANC's #3, #5, #2, ...

........................................................................
.............................. CYCLE    8 ..............................
........................................................................
   1    -44.7562308 -0.447562E+02  0.102E-01    2.72       0.0  T
   2    -44.7562321 -0.126186E-05  0.603E-02    2.72       1.0  T
   3    -44.7562315  0.631669E-06  0.748E-03    2.72       2.7  T
   4    -44.7562325 -0.106349E-05  0.256E-03    2.72       8.0  T
   5    -44.7562326 -0.496876E-07  0.135E-03    2.72      15.1  T
   6    -44.7562326 -0.152395E-07  0.393E-04    2.72      51.9  T
   7    -44.7562326 -0.144599E-08  0.163E-04    2.72     125.4  T
     SCC iter.                  ...        0 min,  0.008 sec
     gradient                   ...        0 min,  0.014 sec
 * total energy  :   -44.2049465 Eh     change       -0.6792361E-04 Eh
   gradient norm :     0.0023806 Eh/α   predicted    -0.4514505E-04 ( -33.54%)
   displ. norm   :     0.1692527 α      lambda       -0.7103277E-04
   maximum displ.:     0.1369274 α      in ANC's #3, #1, #5, ...

........................................................................
.............................. CYCLE    9 ..............................
........................................................................
   1    -44.7567510 -0.447568E+02  0.998E-02    2.71       0.0  T
   2    -44.7567523 -0.129312E-05  0.586E-02    2.71       1.0  T
   3    -44.7567523 -0.746561E-08  0.569E-03    2.71       3.6  T
   4    -44.7567528 -0.459530E-06  0.255E-03    2.71       8.0  T
   5    -44.7567528 -0.260923E-07  0.116E-03    2.71      17.5  T
   6    -44.7567528 -0.204827E-07  0.306E-04    2.71      66.7  T
   7    -44.7567528 -0.908422E-09  0.153E-04    2.71     133.0  T
     SCC iter.                  ...        0 min,  0.008 sec
     gradient                   ...        0 min,  0.013 sec
 * total energy  :   -44.2050014 Eh     change       -0.5487539E-04 Eh
   gradient norm :     0.0027559 Eh/α   predicted    -0.3653546E-04 ( -33.42%)
   displ. norm   :     0.1815588 α      lambda       -0.6308697E-04
   maximum displ.:     0.1477514 α      in ANC's #3, #1, #5, ...

........................................................................
.............................. CYCLE   10 ..............................
........................................................................
   1    -44.7567317 -0.447567E+02  0.107E-01    2.70       0.0  T
   2    -44.7567335 -0.172189E-05  0.625E-02    2.70       1.0  T
   3    -44.7567327  0.777560E-06  0.937E-03    2.70       2.2  T
   4    -44.7567342 -0.149429E-05  0.301E-03    2.70       6.8  T
   5    -44.7567342 -0.249463E-07  0.109E-03    2.70      18.7  T
   6    -44.7567342 -0.165448E-07  0.291E-04    2.70      70.1  T
   7    -44.7567342 -0.410161E-09  0.153E-04    2.70     133.4  T
     SCC iter.                  ...        0 min,  0.008 sec
     gradient                   ...        0 min,  0.014 sec
 * total energy  :   -44.2050496 Eh     change       -0.4822547E-04 Eh
   gradient norm :     0.0032253 Eh/α   predicted    -0.3259018E-04 ( -32.42%)
   displ. norm   :     0.2323395 α      lambda       -0.7043826E-04
   maximum displ.:     0.1889432 α      in ANC's #3, #1, #2, ...

........................................................................
.............................. CYCLE   11 ..............................
........................................................................
   1    -44.7565407 -0.447565E+02  0.139E-01    2.69       0.0  T
   2    -44.7565442 -0.345424E-05  0.809E-02    2.69       1.0  T
   3    -44.7565442 -0.403119E-07  0.901E-03    2.69       2.3  T
   4    -44.7565454 -0.117234E-05  0.420E-03    2.69       4.9  T
   5    -44.7565455 -0.116301E-06  0.115E-03    2.69      17.8  T
   6    -44.7565455 -0.151326E-07  0.411E-04    2.69      49.7  T
   7    -44.7565455 -0.135353E-08  0.203E-04    2.69     100.7  T
     SCC iter.                  ...        0 min,  0.008 sec
     gradient                   ...        0 min,  0.014 sec
 * total energy  :   -44.2050971 Eh     change       -0.4744485E-04 Eh
   gradient norm :     0.0037926 Eh/α   predicted    -0.3712536E-04 ( -21.75%)
   displ. norm   :     0.1512632 α      lambda       -0.4551245E-04
   maximum displ.:     0.1155506 α      in ANC's #3, #1, #40, ...

........................................................................
.............................. CYCLE   12 ..............................
........................................................................
   1    -44.7569473 -0.447569E+02  0.910E-02    2.70       0.0  T
   2    -44.7569494 -0.209516E-05  0.524E-02    2.70       1.0  T
   3    -44.7569494 -0.110208E-07  0.675E-03    2.70       3.0  T
   4    -44.7569502 -0.718178E-06  0.308E-03    2.70       6.6  T
   5    -44.7569502 -0.558615E-07  0.949E-04    2.70      21.5  T
   6    -44.7569502 -0.126987E-07  0.282E-04    2.70      72.3  T
     SCC iter.                  ...        0 min,  0.007 sec
     gradient                   ...        0 min,  0.013 sec
 * total energy  :   -44.2051288 Eh     change       -0.3178532E-04 Eh
   gradient norm :     0.0019108 Eh/α   predicted    -0.2327898E-04 ( -26.76%)
   displ. norm   :     0.3692065 α      lambda       -0.4549043E-04
   maximum displ.:     0.2793410 α      in ANC's #3, #1, #5, ...

........................................................................
.............................. CYCLE   13 ..............................
........................................................................
   1    -44.7532533 -0.447533E+02  0.215E-01    2.69       0.0  T
   2    -44.7532629 -0.960685E-05  0.125E-01    2.69       1.0  T
   3    -44.7532578  0.514985E-05  0.219E-02    2.69       1.0  T
   4    -44.7532668 -0.909260E-05  0.670E-03    2.69       3.0  T
   5    -44.7532669 -0.797606E-07  0.248E-03    2.69       8.2  T
   6    -44.7532670 -0.106190E-06  0.563E-04    2.69      36.3  T
   7    -44.7532670 -0.324326E-08  0.265E-04    2.69      77.1  T
     SCC iter.                  ...        0 min,  0.008 sec
     gradient                   ...        0 min,  0.013 sec
 * total energy  :   -44.2050876 Eh     change        0.4122154E-04 Eh
   gradient norm :     0.0080228 Eh/α   predicted    -0.2412805E-04 (-158.53%)
   displ. norm   :     0.0996787 α      lambda       -0.1565397E-03
   maximum displ.:     0.0760627 α      in ANC's #3, #5, #2, ...

........................................................................
.............................. CYCLE   14 ..............................
........................................................................
   1    -44.7564766 -0.447565E+02  0.516E-02    2.70       0.0  T
   2    -44.7564772 -0.620727E-06  0.306E-02    2.70       1.0  T
   3    -44.7564746  0.261503E-05  0.134E-02    2.70       1.5  T
   4    -44.7564776 -0.304939E-05  0.165E-03    2.70      12.4  T
   5    -44.7564777 -0.140945E-07  0.925E-04    2.70      22.1  T
   6    -44.7564777 -0.565941E-08  0.417E-04    2.70      49.0  T
     SCC iter.                  ...        0 min,  0.007 sec
     gradient                   ...        0 min,  0.013 sec
 * total energy  :   -44.2051667 Eh     change       -0.7905669E-04 Eh
   gradient norm :     0.0032602 Eh/α   predicted    -0.7904936E-04 (  -0.01%)
   displ. norm   :     0.0370809 α      lambda       -0.2338234E-04
   maximum displ.:     0.0258325 α      in ANC's #3, #1, #2, ...

........................................................................
.............................. CYCLE   15 ..............................
........................................................................
   1    -44.7569828 -0.447570E+02  0.294E-02    2.70       0.0  T
   2    -44.7569833 -0.448564E-06  0.171E-02    2.70       1.2  T
   3    -44.7569827  0.536727E-06  0.581E-03    2.70       3.5  T
   4    -44.7569834 -0.700322E-06  0.137E-03    2.70      14.9  T
   5    -44.7569834 -0.137536E-07  0.653E-04    2.70      31.3  T
   6    -44.7569834 -0.258315E-08  0.264E-04    2.70      77.4  T
     SCC iter.                  ...        0 min,  0.007 sec
     gradient                   ...        0 min,  0.013 sec
 * total energy  :   -44.2051751 Eh     change       -0.8432099E-05 Eh
   gradient norm :     0.0031574 Eh/α   predicted    -0.1171205E-04 (  38.90%)
   displ. norm   :     0.0391134 α      lambda       -0.1415534E-04
   maximum displ.:     0.0261192 α      in ANC's #1, #3, #2, ...

........................................................................
.............................. CYCLE   16 ..............................
........................................................................
   1    -44.7569545 -0.447570E+02  0.253E-02    2.70       0.0  T
   2    -44.7569547 -0.184712E-06  0.148E-02    2.70       1.4  T
   3    -44.7569546  0.119952E-06  0.289E-03    2.70       7.1  T
   4    -44.7569547 -0.167352E-06  0.813E-04    2.70      25.1  T
   5    -44.7569548 -0.698400E-08  0.371E-04    2.70      55.0  T
     SCC iter.                  ...        0 min,  0.006 sec
     gradient                   ...        0 min,  0.014 sec
 * total energy  :   -44.2051841 Eh     change       -0.8991695E-05 Eh
   gradient norm :     0.0012774 Eh/α   predicted    -0.7089572E-05 ( -21.15%)
   displ. norm   :     0.1334776 α      lambda       -0.1816878E-04
   maximum displ.:     0.0813980 α      in ANC's #1, #2, #3, ...

........................................................................
.............................. CYCLE   17 ..............................
........................................................................
   1    -44.7566446 -0.447566E+02  0.737E-02    2.69       0.0  T
   2    -44.7566452 -0.646358E-06  0.432E-02    2.69       1.0  T
   3    -44.7566450  0.224988E-06  0.484E-03    2.69       4.2  T
   4    -44.7566454 -0.461648E-06  0.167E-03    2.69      12.2  T
   5    -44.7566455 -0.167517E-07  0.805E-04    2.69      25.3  T
   6    -44.7566455 -0.622921E-08  0.235E-04    2.69      86.8  T
     SCC iter.                  ...        0 min,  0.007 sec
     gradient                   ...        0 min,  0.013 sec
 * total energy  :   -44.2051958 Eh     change       -0.1172901E-04 Eh
   gradient norm :     0.0023769 Eh/α   predicted    -0.9157092E-05 ( -21.93%)
   displ. norm   :     0.0406725 α      lambda       -0.1049134E-04
   maximum displ.:     0.0239416 α      in ANC's #2, #1, #3, ...

........................................................................
.............................. CYCLE   18 ..............................
........................................................................
   1    -44.7566293 -0.447566E+02  0.205E-02    2.69       0.0  T
   2    -44.7566293 -0.413581E-07  0.121E-02    2.69       1.7  T
   3    -44.7566293  0.512106E-07  0.202E-03    2.69      10.1  T
   4    -44.7566293 -0.710110E-07  0.435E-04    2.69      46.9  T
   5    -44.7566294 -0.472319E-09  0.227E-04    2.69      89.8  T
     SCC iter.                  ...        0 min,  0.006 sec
     gradient                   ...        0 min,  0.013 sec
 * total energy  :   -44.2052037 Eh     change       -0.7875449E-05 Eh
   gradient norm :     0.0014150 Eh/α   predicted    -0.5257268E-05 ( -33.24%)
   displ. norm   :     0.0875964 α      lambda       -0.1001608E-04
   maximum displ.:     0.0499971 α      in ANC's #2, #1, #3, ...

........................................................................
.............................. CYCLE   19 ..............................
........................................................................
   1    -44.7566236 -0.447566E+02  0.426E-02    2.70       0.0  T
   2    -44.7566238 -0.148846E-06  0.251E-02    2.70       1.0  T
   3    -44.7566238 -0.927493E-09  0.180E-03    2.70      11.4  T
   4    -44.7566238 -0.596756E-07  0.764E-04    2.70      26.7  T
   5    -44.7566238 -0.256454E-08  0.436E-04    2.70      46.9  T
     SCC iter.                  ...        0 min,  0.006 sec
     gradient                   ...        0 min,  0.014 sec
 * total energy  :   -44.2052099 Eh     change       -0.6162811E-05 Eh
   gradient norm :     0.0022404 Eh/α   predicted    -0.5025684E-05 ( -18.45%)
   displ. norm   :     0.0585352 α      lambda        0.1590306E-04
   maximum displ.:     0.0333300 α      in ANC's #2, #1, #3, ...

........................................................................
.............................. CYCLE   20 ..............................
........................................................................
   1    -44.7564995 -0.447565E+02  0.284E-02    2.70       0.0  T
   2    -44.7564996 -0.714803E-07  0.168E-02    2.70       1.2  T
   3    -44.7564996  0.707185E-08  0.137E-03    2.70      14.9  T
   4    -44.7564996 -0.347590E-07  0.550E-04    2.70      37.1  T
   5    -44.7564996 -0.172358E-08  0.314E-04    2.70      65.0  T
     SCC iter.                  ...        0 min,  0.006 sec
     gradient                   ...        0 min,  0.013 sec
 * total energy  :   -44.2052036 Eh     change        0.6282598E-05 Eh
   gradient norm :     0.0040721 Eh/α   predicted     0.7978236E-05 (  26.99%)
   displ. norm   :     0.0541352 α      lambda       -0.1577991E-04
   maximum displ.:     0.0359015 α      in ANC's #2, #1, #5, ...
 * RMSD in coord.:     0.3965125 α      energy gain  -0.8958012E-02 Eh

generating ANC from model Hessian ...
Using Lindh-Hessian (1995)
 Shifting diagonal of input Hessian by   3.212194471623845E-003
 Lowest  eigenvalues of input Hessian
   -0.000000   -0.000000   -0.000000    0.000000    0.000000    0.000000
    0.005000    0.005487    0.007272    0.008367    0.008862    0.012415
    0.013763    0.021389    0.022771    0.025153    0.035437    0.041128
 Highest eigenvalues
    1.930893    1.955675    2.089287    2.134937    2.155479    2.273879
 

........................................................................
.............................. CYCLE   21 ..............................
........................................................................
   1    -44.7566226 -0.447566E+02  0.273E-02    2.69       0.0  T
   2    -44.7566228 -0.106028E-06  0.161E-02    2.69       1.3  T
   3    -44.7566227  0.509173E-07  0.233E-03    2.69       8.8  T
   4    -44.7566228 -0.892008E-07  0.754E-04    2.69      27.1  T
   5    -44.7566228 -0.346763E-08  0.363E-04    2.69      56.3  T
     SCC iter.                  ...        0 min,  0.006 sec
     gradient                   ...        0 min,  0.013 sec
 * total energy  :   -44.2052123 Eh     change       -0.8724280E-05 Eh
   gradient norm :     0.0012769 Eh/α   predicted     0.0000000E+00 (-100.00%)
   displ. norm   :     0.0159326 α      lambda       -0.2667816E-05
   maximum displ.:     0.0104257 α      in ANC's #3, #5, #4, ...

........................................................................
.............................. CYCLE   22 ..............................
........................................................................
   1    -44.7568773 -0.447569E+02  0.842E-03    2.69       0.0  T
   2    -44.7568774 -0.266487E-07  0.504E-03    2.69       4.0  T
   3    -44.7568773  0.898455E-07  0.258E-03    2.69       7.9  T
   4    -44.7568774 -0.107749E-06  0.333E-04    2.69      61.4  T
   5    -44.7568774 -0.557705E-09  0.193E-04    2.69     105.8  T
     SCC iter.                  ...        0 min,  0.006 sec
     gradient                   ...        0 min,  0.013 sec
 * total energy  :   -44.2052143 Eh     change       -0.1972565E-05 Eh
   gradient norm :     0.0002827 Eh/α   predicted    -0.1342530E-05 ( -31.94%)
   displ. norm   :     0.0075133 α      lambda       -0.4902474E-06
   maximum displ.:     0.0045011 α      in ANC's #3, #5, #4, ...

   *** GEOMETRY OPTIMIZATION CONVERGED AFTER 22 ITERATIONS ***

------------------------------------------------------------------------
 total energy gain   :        -0.0089687 Eh       -5.6279 kcal/mol
 total RMSD          :         0.3983498 a0        0.2108 Å
 total power (kW/mol):        -1.0703338 (step)  -34.5998 (real)
------------------------------------------------------------------------

 ANCopt (total)                0 d,  0 h,  0 min,  0.681 sec
 optimizer setup                ...        0 min,  0.000 sec (  0.022%)
 model hessian                  ...        0 min,  0.008 sec (  1.112%)
 ANC generation                 ...        0 min,  0.001 sec (  0.194%)
 coordinate transformation      ...        0 min,  0.000 sec (  0.065%)
 single point calculation       ...        0 min,  0.662 sec ( 97.272%)
 optimization log               ...        0 min,  0.002 sec (  0.327%)
 hessian update                 ...        0 min,  0.000 sec (  0.044%)
 rational function              ...        0 min,  0.005 sec (  0.756%)

================
 final structure:
================
$coord
   -1.74657839526250    2.97263579857509    0.06502154156246      C 
   -3.93459914585807    1.60613078876561    0.21590925571555      C 
   -6.16415262494116    2.82729518086571    0.28329831671482      F 
   -3.99843293791672   -1.06248670617339    0.30680300206034      C 
   -6.30684285913579   -2.12221992056607    0.44920672137137      F 
   -1.84343303014971   -2.53844886023451    0.25080801270372      C 
    0.42950721675115   -1.14033401745910    0.09385054174651      C 
    0.48516108885407    1.55676625279721    0.00348790986261      C 
    2.91732865785189    2.25684158998846   -0.14595193334150      N 
    4.15843301560862    0.12902039120957   -0.14341831132624      N 
    6.86931279461258    0.07339415237405   -0.20290833222045      C 
    7.93571116435534    0.21735320751327    2.47207046192606      C 
    2.83256454279565   -1.94146823852740   -0.00466008637567      N 
   -1.69970416987460   -5.27853041918422    0.33002786339232      C 
   -3.60830111662853   -6.89765111017243    0.54433612365571      C 
   -1.75200462962623    5.00486671017891   -0.00193143159661      H 
    7.49981786755781    1.69007063676921   -1.31786522522179      H 
    7.43291640961011   -1.68894395760060   -1.11402407910876      H 
    7.33121041360154    1.95764617900264    3.38114168070809      H 
    9.98674285882331    0.18081485645307    2.40662323874833      H 
    7.27863169952499   -1.37936927401360    3.58552126052748      H 
    0.22072676451834   -5.96873100739084    0.20064080954311      H 
   -5.55062940213257   -6.32015079954675    0.68490321477220      H 
   -3.26363544270573   -8.90257253327772    0.58359082775293      H 
$end
           -------------------------------------------------
          |                Final Singlepoint                |
           -------------------------------------------------

          ...................................................
          :                      SETUP                      :
          :.................................................:
          :  # basis functions                  69          :
          :  # atomic orbitals                  69          :
          :  # shells                           39          :
          :  # electrons                        78          :
          :  max. iterations                   250          :
          :  Hamiltonian                  GFN2-xTB          :
          :  restarted?                      false          :
          :  GBSA solvation                  false          :
          :  PC potential                    false          :
          :  electronic temp.          300.0000000     K    :
          :  accuracy                    1.0000000          :
          :  -> integral cutoff          0.2500000E+02      :
          :  -> integral neglect         0.1000000E-07      :
          :  -> SCF convergence          0.1000000E-05 Eh   :
          :  -> wf. convergence          0.1000000E-03 e    :
          :  Broyden damping             0.4000000          :
          ...................................................

 iter      E             dE          RMSdq      gap      omega  full diag
   1    -44.7568774 -0.447569E+02  0.912E-05    2.69       0.0  T
   2    -44.7568774 -0.185025E-10  0.396E-05    2.69     515.2  T
   3    -44.7568774 -0.265601E-10  0.403E-05    2.69     506.9  T

   *** convergence criteria satisfied after 3 iterations ***

         #    Occupation            Energy/Eh            Energy/eV
      -------------------------------------------------------------
         1        2.0000           -0.8251982             -22.4548
       ...           ...                  ...                  ...
        33        2.0000           -0.4672293             -12.7140
        34        2.0000           -0.4400178             -11.9735
        35        2.0000           -0.4363987             -11.8750
        36        2.0000           -0.4209366             -11.4543
        37        2.0000           -0.4182989             -11.3825
        38        2.0000           -0.4156771             -11.3112
        39        2.0000           -0.3935726             -10.7097 (HOMO)
        40                         -0.2945752              -8.0158 (LUMO)
        41                         -0.2411768              -6.5628
        42                         -0.2244957              -6.1088
        43                         -0.1798174              -4.8931
        44                         -0.0922233              -2.5095
       ...                                ...                  ...
        69                          0.6686020              18.1936
      -------------------------------------------------------------
                  HL-Gap            0.0989974 Eh            2.6939 eV
             Fermi-level           -0.3440739 Eh           -9.3627 eV

 SCC (total)                   0 d,  0 h,  0 min,  0.028 sec
 SCC setup                      ...        0 min,  0.000 sec (  0.709%)
 Dispersion                     ...        0 min,  0.000 sec (  0.748%)
 integral evaluation            ...        0 min,  0.009 sec ( 33.576%)
 zeroth order Hamiltonian       ...        0 min,  0.000 sec (  0.579%)
 iterations                     ...        0 min,  0.004 sec ( 14.794%)
 molecular gradient             ...        0 min,  0.013 sec ( 48.023%)
 printout                       ...        0 min,  0.000 sec (  1.352%)

         :::::::::::::::::::::::::::::::::::::::::::::::::::::
         ::                     SUMMARY                     ::
         :::::::::::::::::::::::::::::::::::::::::::::::::::::
         :: total energy             -44.205214270306 Eh    ::
         :: gradient norm              0.000282995668 Eh/a0 ::
         :: HOMO-LUMO gap              2.693856118789 eV    ::
         ::.................................................::
         :: SCC energy               -44.756877382902 Eh    ::
         :: -> isotropic ES            0.037062265953 Eh    ::
         :: -> anisotropic ES          0.001817768803 Eh    ::
         :: -> anisotropic XC          0.017802965195 Eh    ::
         :: -> dispersion             -0.022613357257 Eh    ::
         :: repulsion energy           0.551655109504 Eh    ::
         :: add. restraining           0.000000000000 Eh    ::
         :::::::::::::::::::::::::::::::::::::::::::::::::::::

           -------------------------------------------------
          |                Property Printout                |
           -------------------------------------------------

    * Orbital Energies and Occupations

         #    Occupation            Energy/Eh            Energy/eV
      -------------------------------------------------------------
         1        2.0000           -0.8251982             -22.4548
       ...           ...                  ...                  ...
        27        2.0000           -0.4911023             -13.3636
        28        2.0000           -0.4852570             -13.2045
        29        2.0000           -0.4786894             -13.0258
        30        2.0000           -0.4737427             -12.8912
        31        2.0000           -0.4705082             -12.8032
        32        2.0000           -0.4680570             -12.7365
        33        2.0000           -0.4672293             -12.7140
        34        2.0000           -0.4400178             -11.9735
        35        2.0000           -0.4363987             -11.8750
        36        2.0000           -0.4209366             -11.4543
        37        2.0000           -0.4182989             -11.3825
        38        2.0000           -0.4156771             -11.3112
        39        2.0000           -0.3935726             -10.7097 (HOMO)
        40                         -0.2945752              -8.0158 (LUMO)
        41                         -0.2411768              -6.5628
        42                         -0.2244957              -6.1088
        43                         -0.1798174              -4.8931
        44                         -0.0922233              -2.5095
        45                         -0.0158755              -0.4320
        46                          0.0313340               0.8526
        47                          0.0414762               1.1286
        48                          0.0876551               2.3852
        49                          0.0887405               2.4148
        50                          0.1124931               3.0611
       ...                                ...                  ...
        69                          0.6686020              18.1936
      -------------------------------------------------------------
                  HL-Gap            0.0989974 Eh            2.6939 eV
             Fermi-level           -0.3440739 Eh           -9.3627 eV

     #   Z        covCN         q      C6AA      α(0)
     1   6 C      2.905    -0.067    29.672     8.932
     2   6 C      2.788     0.151    24.714     8.143
     3   9 F      0.787    -0.204    11.272     3.966
     4   6 C      2.789     0.142    24.886     8.172
     5   9 F      0.787    -0.200    11.239     3.960
     6   6 C      2.958    -0.012    28.301     8.726
     7   6 C      3.171     0.049    26.527     8.414
     8   6 C      3.167     0.056    26.407     8.397
     9   7 N      1.985    -0.244    27.184     7.732
    10   7 N      3.276     0.229    17.505     6.214
    11   6 C      3.746    -0.025    21.091     6.551
    12   6 C      3.753    -0.114    22.747     6.801
    13   7 N      1.987    -0.244    27.180     7.732
    14   6 C      2.894    -0.022    28.561     8.762
    15   6 C      2.837    -0.078    29.944     8.967
    16   1 H      0.926     0.077     2.015     2.220
    17   1 H      0.924     0.079     1.992     2.207
    18   1 H      0.924     0.078     1.995     2.209
    19   1 H      0.925     0.061     2.193     2.316
    20   1 H      0.925     0.060     2.202     2.321
    21   1 H      0.925     0.059     2.208     2.324
    22   1 H      0.925     0.057     2.231     2.336
    23   1 H      0.926     0.067     2.116     2.275
    24   1 H      0.926     0.046     2.369     2.407

 Mol. C6AA /au·bohr⁶  :       7295.220883
 Mol. C8AA /au·bohr⁸  :     173300.986845
 Mol. α(0) /au        :        132.081784


Wiberg/Mayer (AO) data.
largest (>0.10) Wiberg bond orders for each atom
          total WBO             WBO to atom ...
     1  C   3.946        C    2 1.500    C    8 1.262    H   16 0.962    C    6 0.101
     2  C   3.889        C    1 1.500    C    4 1.254    F    3 0.973
     3  F   1.106        C    2 0.973
     4  C   3.885        C    6 1.428    C    2 1.254    F    5 0.973
     5  F   1.114        C    4 0.973
     6  C   3.984        C    4 1.428    C    7 1.213    C   14 1.106    C    1 0.101
     7  C   3.977        N   13 1.348    C    6 1.213    C    8 1.207
     8  C   3.978        N    9 1.337    C    1 1.262    C    7 1.207
     9  N   2.984        C    8 1.337    N   10 1.295    N   13 0.221
    10  N   3.764        N    9 1.295    N   13 1.294    C   11 0.981
    11  C   3.960        C   12 0.999    N   10 0.981    H   18 0.967    H   17 0.966
    12  C   3.983        C   11 0.999    H   21 0.986    H   19 0.985    H   20 0.982
    13  N   2.990        C    7 1.348    N   10 1.294    N    9 0.221
    14  C   3.989        C   15 1.881    C    6 1.106    H   22 0.962
    15  C   3.941        C   14 1.881    H   24 0.978    H   23 0.972
    16  H   0.994        C    1 0.962
    17  H   0.992        C   11 0.966
    18  H   0.993        C   11 0.967
    19  H   0.996        C   12 0.985
    20  H   0.996        C   12 0.982
    21  H   0.996        C   12 0.986
    22  H   0.996        C   14 0.962
    23  H   0.995        C   15 0.972
    24  H   0.997        C   15 0.978

molecular dipole:
                 x           y           z       tot (Debye)
 q only:        2.328      -0.363       0.056
   full:        2.064      -0.307       0.030       5.305
molecular quadrupole (traceless):
                xx          xy          yy          xz          yz          zz
 q only:        1.317       2.517      -0.045       1.914      -0.188      -1.272
  q+dip:       -0.862       2.264       1.778       1.052      -0.258      -0.915
   full:       -1.761       2.158      -0.662       1.511      -0.043       2.423

           -------------------------------------------------
          |                Geometry Summary                 |
           -------------------------------------------------

      molecular mass/u    :      209.1980000
   center of mass at/Å    :       -0.2076261      -0.3084483       0.1701650
  moments of inertia/u·Å² :        0.4785711E+03   0.1234043E+04   0.1660200E+04
rotational constants/cm⁻¹ :        0.3522493E-01   0.1366049E-01   0.1015398E-01

 * 22 selected distances

     #   Z        #   Z                                     value/Å
     1   6 C      2   6 C                                 1.3674434
     2   6 C      4   6 C                                 1.4133943
     4   6 C      6   6 C                                 1.3825230
     6   6 C      7   6 C                                 1.4145590
     1   6 C      8   6 C                                 1.3989844
     7   6 C      8   6 C                                 1.4283486
     8   6 C      9   7 N                                 1.3416368
     9   7 N     10   7 N                                 1.3035355
    10   7 N     11   6 C                                 1.4351832
    11   6 C     12   6 C                                 1.5257788 (max)
     7   6 C     13   7 N                                 1.3414623
    10   7 N     13   7 N                                 1.3031203
    14   6 C     15   6 C                                 1.3293015
     1   6 C     16   1 H                                 1.0759977
    11   6 C     17   1 H                                 1.0914797
    11   6 C     18   1 H                                 1.0913909
    12   6 C     19   1 H                                 1.0871278
    12   6 C     20   1 H                                 1.0860839
    12   6 C     21   1 H                                 1.0872048
    14   6 C     22   1 H                                 1.0820572
    15   6 C     23   1 H                                 1.0748820 (min)
    15   6 C     24   1 H                                 1.0767223

 * 4 distinct bonds (by element types)

   Z      Z             #   av. dist./Å        max./Å        min./Å
   1 H    6 C           9     1.0836607     1.0914797     1.0748820
   6 C    6 C           8     1.4075416     1.5257788     1.3293015
   6 C    7 N           3     1.3727607     1.4351832     1.3414623
   7 N    7 N           2     1.3033279     1.3035355     1.3031203


optimized geometry written to: xtbopt.xyz


           -------------------------------------------------
          | TOTAL ENERGY              -44.205214270306 Eh   |
          | GRADIENT NORM               0.000282995668 Eh/α |
          | HOMO-LUMO GAP               2.693856118789 eV   |
           -------------------------------------------------

------------------------------------------------------------------------
 * finished run on 2021/05/19 at 10:58:55.392     
------------------------------------------------------------------------
 total:
 * wall-time:     0 d,  0 h,  0 min,  0.784 sec
 *  cpu-time:     0 d,  0 h,  0 min,  0.771 sec
 * ratio c/w:     0.983 speedup
 SCF:
 * wall-time:     0 d,  0 h,  0 min,  0.040 sec
 *  cpu-time:     0 d,  0 h,  0 min,  0.040 sec
 * ratio c/w:     1.000 speedup
 ANC optimizer:
 * wall-time:     0 d,  0 h,  0 min,  0.709 sec
 *  cpu-time:     0 d,  0 h,  0 min,  0.709 sec
 * ratio c/w:     1.000 speedup

