      -----------------------------------------------------------      
     |                   =====================                   |     
     |                           x T B                           |     
     |                   =====================                   |     
     |                         S. Grimme                         |     
     |          Mulliken Center for Theoretical Chemistry        |     
     |                    University of Bonn                     |     
     |                Version 6.2 RC2 (SAW190805)                |     
      -----------------------------------------------------------      

   This program is distributed in the hope that it will be useful,
   but WITHOUT ANY WARRANTY; without even the implied warranty of
   MERCHANTABILITY or FITNESS FOR A PARTICULAR PURPOSE.
   
   FOR NON-COMMERCIAL, ACADEMIA USE ONLY.
   
   Cite this work as:
   * S. Grimme, C. Bannwarth, P. Shushkov, J. Chem. Theory Comput., 2017,
     13, 1989-2009. DOI: 10.1021/acs.jctc.7b00118
   * C. Bannwarth, S. Ehlert and S. Grimme., J. Chem. Theory Comput., 2019,
     15, 1652-1671. DOI: 10.1021/acs.jctc.8b01176
   * P. Pracht, E. Caldeweyher, S. Ehlert, S. Grimme, ChemRxiv, 2019, preprint.
     DOI: 10.26434/chemrxiv.8326202.v1
   
   for DFT-D4:
   * E. Caldeweyher, C. Bannwarth and S. Grimme, J. Chem. Phys., 2017,
     147, 034112. DOI: 10.1063/1.4993215
   * E. Caldeweyher, S. Ehlert, A. Hansen, H. Neugebauer, S. Spicher,
     C. Bannwarth and S. Grimme, J. Chem. Phys., 2019, 150, 154122.
     DOI: 10.1063/1.5090222
   
   for sTDA-xTB:
   * S. Grimme and C. Bannwarth, J. Chem. Phys., 2016, 145, 054103.
     DOI: 10.1063/1.4959605
   
   in the mass-spec context:
   * V. Asgeirsson, C. Bauer and S. Grimme, Chem. Sci., 2017, 8, 4879.
     DOI: 10.1039/c7sc00601b
   
   for metadynamics refer to:
   * S. Grimme, J. Chem. Theory Comput., 2019, 155, 2847-2862
     DOI: 10.1021/acs.jctc.9b00143
   
   with help from (in alphabetical order)
   C. Bannwarth, F. Bohle, G. Brandenburg, E. Caldeweyher, M. Checinski,
   S. Dohm, S. Ehlert, S. Ehrlich, F. März, H. Neugebauer, J. Pisarek,
   P. Pracht, P. Shushkov, and S. Spicher.
   
 * started run on 2021/05/19 at 10:59:04.336     

           -------------------------------------------------
          |                Calculation Setup                |
           -------------------------------------------------

          program call               : /ihome/ghutchison/geoffh/xtb/xtb 140.xyz -opt
          hostname                   : smp-n83
          coordinate file            : 140.xyz
          omp threads                :                     1
          number of atoms            :                    25
          number of electrons        :                    60
          charge                     :                     0
          spin                       :                   0.0
          first test random number   :      0.54742696067844


########################################################################
# WARNING! Please study the warnings concerning your input carefully
#  - the use of '-opt' is discouraged, please use '--opt' next time
########################################################################

           ------------------------------------------------- 
          |                 G F N 2 - x T B                 |
          | Geometry, Frequencies, Noncovalent interactions |
          |            JCTC 2019 parametrisation            |
           ------------------------------------------------- 
             KAB for C  - Si     :                1.0500
             KAB for H  - Pd     :                0.9500
             k(s)              :                1.8500
             k(p)              :                2.2300
             k(d)              :                2.2300
             k(f)              :                2.0000
             kEN (H0ij)        :               -2.0000
             D4 a1             :                0.5200
             D4 a2             :                5.0000
             D4 s6             :                1.0000
             D4 s8             :                2.7000
             D4 s9             :                5.0000
             alphaj            :                2.0000

  Z AO/shell   Hii/eV     exponent
  1     Wed Apr 25 08:07:45 CEST 2018   EN: 2.200 GM2: 0.406  GM3: 0.0800  RAES: 1.40
     1s    -10.707211    1.230000
  6     Wed Apr 25 08:07:45 CEST 2018   EN: 2.550 GM2: 0.538  GM3: 0.1500  RAES: 3.00
     2s    -13.970922    2.096432
     2p    -10.063292    1.800000
 16     Tue Apr 24 11:44:34 CEST 2018   EN: 2.580 GM2: 0.340  GM3:-0.0502  RAES: 3.10
     3s    -20.029654    1.981333
     3p    -11.377694    2.025643
     3d     -0.420282    1.702555

           ------------------------------------------------- 
          |        Self-Consistent Charge Iterations        |
           ------------------------------------------------- 

          ...................................................
          :                      SETUP                      :
          :.................................................:
          :  # basis functions                  64          :
          :  # atomic orbitals                  63          :
          :  # shells                           37          :
          :  # electrons                        60          :
          :  max. iterations                   250          :
          :  Hamiltonian                  GFN2-xTB          :
          :  restarted?                      false          :
          :  GBSA solvation                  false          :
          :  PC potential                    false          :
          :  electronic temp.          300.0000000     K    :
          :  accuracy                    1.0000000          :
          :  -> integral cutoff          0.2500000E+02      :
          :  -> integral neglect         0.1000000E-07      :
          :  -> SCF convergence          0.1000000E-05 Eh   :
          :  -> wf. convergence          0.1000000E-03 e    :
          :  Broyden damping             0.4000000          :
          ...................................................

 iter      E             dE          RMSdq      gap      omega  full diag
   1    -32.1965853 -0.321966E+02  0.356E+00    3.39       0.0  T
   2    -32.2345942 -0.380089E-01  0.201E+00    3.41       1.0  T
   3    -32.2282919  0.630232E-02  0.937E-01    3.41       1.0  T
   4    -32.2350186 -0.672672E-02  0.524E-01    3.39       1.0  T
   5    -32.2389981 -0.397949E-02  0.139E-01    3.40       1.0  T
   6    -32.2390711 -0.730066E-04  0.889E-02    3.40       1.0  T
   7    -32.2392063 -0.135144E-03  0.220E-02    3.40       1.0  T
   8    -32.2392104 -0.417649E-05  0.111E-02    3.40       1.8  T
   9    -32.2392108 -0.379679E-06  0.351E-03    3.40       5.7  T
  10    -32.2392109 -0.349255E-07  0.193E-03    3.40      10.4  T
  11    -32.2392109 -0.369605E-07  0.835E-04    3.40      24.0  T
  12    -32.2392109 -0.746554E-08  0.325E-04    3.40      61.6  T

   *** convergence criteria satisfied after 12 iterations ***

         #    Occupation            Energy/Eh            Energy/eV
      -------------------------------------------------------------
         1        2.0000           -0.7232023             -19.6793
       ...           ...                  ...                  ...
        24        2.0000           -0.4394992             -11.9594
        25        2.0000           -0.4341160             -11.8129
        26        2.0000           -0.4303023             -11.7091
        27        2.0000           -0.4224353             -11.4950
        28        2.0000           -0.4117085             -11.2032
        29        2.0000           -0.3750206             -10.2048
        30        2.0000           -0.3676593             -10.0045 (HOMO)
        31                         -0.2427907              -6.6067 (LUMO)
        32                         -0.2133774              -5.8063
        33                         -0.1905225              -5.1844
        34                         -0.1419651              -3.8631
        35                         -0.1048359              -2.8527
       ...                                ...                  ...
        63                          0.6814638              18.5436
      -------------------------------------------------------------
                  HL-Gap            0.1248686 Eh            3.3978 eV
             Fermi-level           -0.3052250 Eh           -8.3056 eV

 SCC (total)                   0 d,  0 h,  0 min,  0.034 sec
 SCC setup                      ...        0 min,  0.000 sec (  0.837%)
 Dispersion                     ...        0 min,  0.000 sec (  1.020%)
 integral evaluation            ...        0 min,  0.008 sec ( 22.520%)
 zeroth order Hamiltonian       ...        0 min,  0.000 sec (  0.448%)
 iterations                     ...        0 min,  0.013 sec ( 38.443%)
 molecular gradient             ...        0 min,  0.012 sec ( 35.526%)
 printout                       ...        0 min,  0.000 sec (  1.052%)

         :::::::::::::::::::::::::::::::::::::::::::::::::::::
         ::                     SUMMARY                     ::
         :::::::::::::::::::::::::::::::::::::::::::::::::::::
         :: total energy             -31.755406167043 Eh    ::
         :: gradient norm              0.055657897993 Eh/a0 ::
         :: HOMO-LUMO gap              3.397848749927 eV    ::
         ::.................................................::
         :: SCC energy               -32.239210898412 Eh    ::
         :: -> isotropic ES            0.003713611714 Eh    ::
         :: -> anisotropic ES          0.005867947540 Eh    ::
         :: -> anisotropic XC          0.019151020781 Eh    ::
         :: -> dispersion             -0.022863775963 Eh    ::
         :: repulsion energy           0.483635290085 Eh    ::
         :: add. restraining           0.000000000000 Eh    ::
         :::::::::::::::::::::::::::::::::::::::::::::::::::::

      ----------------------------------------------------------- 
     |                   =====================                   |
     |                        A N C O P T                        |
     |                   =====================                   |
     |               Approximate Normal Coordinate               |
     |                Rational Function Optimizer                |
      ----------------------------------------------------------- 

          ...................................................
          :                      SETUP                      :
          :.................................................:
          :   optimization level            normal          :
          :   max. optcycles                   200          :
          :   ANC micro-cycles                  20          :
          :   degrees of freedom                69          :
          :.................................................:
          :   RF solver                   davidson          :
          :   input Hessian                  false          :
          :   write xtbopt.log                true          :
          :   linear?                        false          :
          :   energy convergence         0.5000000E-05 Eh   :
          :   grad. convergence          0.1000000E-02 Eh/α :
          :   maximium RF displ.         2.0000000          :
          :   Hlow (freq-cutoff)         0.5000000E-02      :
          :   Hmax (freq-cutoff)         5.0000000          :
          :   S6 in model hess.         20.0000000          :
          ...................................................

generating ANC from model Hessian ...
Using Lindh-Hessian (1995)
 Shifting diagonal of input Hessian by   4.167644368772122E-003
 Lowest  eigenvalues of input Hessian
   -0.000000   -0.000000    0.000000    0.000000    0.000000    0.000000
    0.005000    0.006136    0.006723    0.007177    0.009205    0.009823
    0.011087    0.012149    0.013312    0.016593    0.021468    0.022831
 Highest eigenvalues
    1.404851    1.520264    1.641363    1.734776    1.756849    1.984076
 

........................................................................
.............................. CYCLE    1 ..............................
........................................................................
   1    -32.2392109 -0.322392E+02  0.112E-04    3.40       0.0  T
   2    -32.2392109 -0.292886E-10  0.643E-05    3.40     311.2  T
   3    -32.2392109  0.703437E-12  0.433E-05    3.40     461.4  T
     SCC iter.                  ...        0 min,  0.004 sec
     gradient                   ...        0 min,  0.012 sec
 * total energy  :   -31.7554062 Eh     change       -0.1382442E-07 Eh
   gradient norm :     0.0556558 Eh/α   predicted     0.0000000E+00 (-100.00%)
   displ. norm   :     0.3016775 α      lambda       -0.5173234E-02
   maximum displ.:     0.1451559 α      in ANC's #15, #2, #5, ...

........................................................................
.............................. CYCLE    2 ..............................
........................................................................
   1    -32.2604750 -0.322605E+02  0.172E-01    3.47       0.0  T
   2    -32.2604996 -0.245635E-04  0.823E-02    3.47       1.0  T
   3    -32.2604860  0.136372E-04  0.391E-02    3.47       1.0  T
   4    -32.2605062 -0.202120E-04  0.164E-02    3.47       1.2  T
   5    -32.2605080 -0.181365E-05  0.621E-03    3.47       3.2  T
   6    -32.2605082 -0.187498E-06  0.189E-03    3.47      10.6  T
   7    -32.2605082 -0.563663E-07  0.112E-03    3.47      17.9  T
     SCC iter.                  ...        0 min,  0.007 sec
     gradient                   ...        0 min,  0.012 sec
 * total energy  :   -31.7588080 Eh     change       -0.3401866E-02 Eh
   gradient norm :     0.0224219 Eh/α   predicted    -0.2822039E-02 ( -17.04%)
   displ. norm   :     0.2766743 α      lambda       -0.1396366E-02
   maximum displ.:     0.1343551 α      in ANC's #2, #5, #4, ...

........................................................................
.............................. CYCLE    3 ..............................
........................................................................
   1    -32.2694710 -0.322695E+02  0.143E-01    3.53       0.0  T
   2    -32.2694851 -0.140950E-04  0.731E-02    3.53       1.0  T
   3    -32.2694725  0.125859E-04  0.354E-02    3.53       1.0  T
   4    -32.2694890 -0.164627E-04  0.135E-02    3.53       1.5  T
   5    -32.2694904 -0.139286E-05  0.438E-03    3.53       4.6  T
   6    -32.2694905 -0.768671E-07  0.170E-03    3.53      11.8  T
     SCC iter.                  ...        0 min,  0.006 sec
     gradient                   ...        0 min,  0.012 sec
 * total energy  :   -31.7597314 Eh     change       -0.9233610E-03 Eh
   gradient norm :     0.0063426 Eh/α   predicted    -0.7516354E-03 ( -18.60%)
   displ. norm   :     0.3333961 α      lambda       -0.7952088E-03
   maximum displ.:     0.1896249 α      in ANC's #4, #2, #5, ...

........................................................................
.............................. CYCLE    4 ..............................
........................................................................
   1    -32.2706011 -0.322706E+02  0.164E-01    3.55       0.0  T
   2    -32.2706089 -0.787997E-05  0.927E-02    3.55       1.0  T
   3    -32.2705923  0.166530E-04  0.342E-02    3.55       1.0  T
   4    -32.2706114 -0.191191E-04  0.993E-03    3.55       2.0  T
   5    -32.2706123 -0.893404E-06  0.246E-03    3.55       8.1  T
   6    -32.2706123 -0.217890E-07  0.107E-03    3.55      18.7  T
     SCC iter.                  ...        0 min,  0.007 sec
     gradient                   ...        0 min,  0.012 sec
 * total energy  :   -31.7603039 Eh     change       -0.5724444E-03 Eh
   gradient norm :     0.0100799 Eh/α   predicted    -0.4417999E-03 ( -22.82%)
   displ. norm   :     0.3976070 α      lambda       -0.7451021E-03
   maximum displ.:     0.2224601 α      in ANC's #4, #2, #1, ...

........................................................................
.............................. CYCLE    5 ..............................
........................................................................
   1    -32.2673033 -0.322673E+02  0.201E-01    3.57       0.0  T
   2    -32.2673079 -0.464048E-05  0.116E-01    3.57       1.0  T
   3    -32.2672965  0.114105E-04  0.268E-02    3.57       1.0  T
   4    -32.2673093 -0.128298E-04  0.843E-03    3.57       2.4  T
   5    -32.2673100 -0.615485E-06  0.189E-03    3.57      10.6  T
   6    -32.2673100 -0.800452E-08  0.105E-03    3.57      19.0  T
     SCC iter.                  ...        0 min,  0.007 sec
     gradient                   ...        0 min,  0.012 sec
 * total energy  :   -31.7608577 Eh     change       -0.5538463E-03 Eh
   gradient norm :     0.0123405 Eh/α   predicted    -0.4314491E-03 ( -22.10%)
   displ. norm   :     0.3943123 α      lambda       -0.6515972E-03
   maximum displ.:     0.2302528 α      in ANC's #4, #2, #1, ...

........................................................................
.............................. CYCLE    6 ..............................
........................................................................
   1    -32.2647615 -0.322648E+02  0.193E-01    3.58       0.0  T
   2    -32.2647638 -0.235636E-05  0.112E-01    3.58       1.0  T
   3    -32.2647637  0.150374E-06  0.948E-03    3.58       2.1  T
   4    -32.2647639 -0.253814E-06  0.620E-03    3.58       3.2  T
   5    -32.2647645 -0.573528E-06  0.179E-03    3.58      11.2  T
   6    -32.2647646 -0.460905E-07  0.604E-04    3.58      33.1  T
     SCC iter.                  ...        0 min,  0.006 sec
     gradient                   ...        0 min,  0.012 sec
 * total energy  :   -31.7613670 Eh     change       -0.5093199E-03 Eh
   gradient norm :     0.0112184 Eh/α   predicted    -0.3764579E-03 ( -26.09%)
   displ. norm   :     0.4299717 α      lambda       -0.6969689E-03
   maximum displ.:     0.2488528 α      in ANC's #4, #2, #1, ...

........................................................................
.............................. CYCLE    7 ..............................
........................................................................
   1    -32.2651045 -0.322651E+02  0.199E-01    3.60       0.0  T
   2    -32.2651075 -0.301482E-05  0.117E-01    3.60       1.0  T
   3    -32.2651027  0.477018E-05  0.176E-02    3.60       1.1  T
   4    -32.2651080 -0.529312E-05  0.730E-03    3.60       2.7  T
   5    -32.2651086 -0.567425E-06  0.243E-03    3.60       8.2  T
   6    -32.2651086 -0.437204E-07  0.998E-04    3.60      20.0  T
     SCC iter.                  ...        0 min,  0.006 sec
     gradient                   ...        0 min,  0.012 sec
 * total energy  :   -31.7618938 Eh     change       -0.5267580E-03 Eh
   gradient norm :     0.0090936 Eh/α   predicted    -0.4129120E-03 ( -21.61%)
   displ. norm   :     0.4081480 α      lambda       -0.5493713E-03
   maximum displ.:     0.2308685 α      in ANC's #4, #1, #2, ...

........................................................................
.............................. CYCLE    8 ..............................
........................................................................
   1    -32.2672855 -0.322673E+02  0.178E-01    3.62       0.0  T
   2    -32.2672886 -0.306855E-05  0.104E-01    3.62       1.0  T
   3    -32.2672803  0.827026E-05  0.214E-02    3.62       1.0  T
   4    -32.2672893 -0.896631E-05  0.752E-03    3.62       2.7  T
   5    -32.2672899 -0.646725E-06  0.250E-03    3.62       8.0  T
   6    -32.2672900 -0.337168E-07  0.116E-03    3.62      17.3  T
     SCC iter.                  ...        0 min,  0.006 sec
     gradient                   ...        0 min,  0.012 sec
 * total energy  :   -31.7623090 Eh     change       -0.4152219E-03 Eh
   gradient norm :     0.0076145 Eh/α   predicted    -0.3204457E-03 ( -22.83%)
   displ. norm   :     0.3778949 α      lambda       -0.4369415E-03
   maximum displ.:     0.2153321 α      in ANC's #1, #4, #2, ...

........................................................................
.............................. CYCLE    9 ..............................
........................................................................
   1    -32.2717057 -0.322717E+02  0.159E-01    3.63       0.0  T
   2    -32.2717096 -0.387609E-05  0.930E-02    3.63       1.0  T
   3    -32.2717029  0.673390E-05  0.197E-02    3.63       1.0  T
   4    -32.2717099 -0.706436E-05  0.800E-03    3.63       2.5  T
   5    -32.2717108 -0.839431E-06  0.245E-03    3.63       8.2  T
   6    -32.2717108 -0.129869E-07  0.145E-03    3.63      13.8  T
     SCC iter.                  ...        0 min,  0.007 sec
     gradient                   ...        0 min,  0.012 sec
 * total energy  :   -31.7626150 Eh     change       -0.3059873E-03 Eh
   gradient norm :     0.0073704 Eh/α   predicted    -0.2496740E-03 ( -18.40%)
   displ. norm   :     0.4861811 α      lambda       -0.3859030E-03
   maximum displ.:     0.2679835 α      in ANC's #1, #4, #2, ...

........................................................................
.............................. CYCLE   10 ..............................
........................................................................
   1    -32.2687914 -0.322688E+02  0.203E-01    3.65       0.0  T
   2    -32.2687951 -0.368440E-05  0.119E-01    3.65       1.0  T
   3    -32.2687873  0.778044E-05  0.206E-02    3.65       1.0  T
   4    -32.2687961 -0.876454E-05  0.736E-03    3.65       2.7  T
   5    -32.2687967 -0.556439E-06  0.219E-03    3.65       9.1  T
   6    -32.2687967 -0.117363E-07  0.112E-03    3.65      17.8  T
     SCC iter.                  ...        0 min,  0.006 sec
     gradient                   ...        0 min,  0.012 sec
 * total energy  :   -31.7627703 Eh     change       -0.1553569E-03 Eh
   gradient norm :     0.0108387 Eh/α   predicted    -0.2385628E-03 (  53.56%)
   displ. norm   :     0.1925605 α      lambda       -0.4758758E-03
   maximum displ.:     0.1228298 α      in ANC's #1, #3, #5, ...

........................................................................
.............................. CYCLE   11 ..............................
........................................................................
   1    -32.2772501 -0.322773E+02  0.827E-02    3.65       0.0  T
   2    -32.2772547 -0.462762E-05  0.474E-02    3.65       1.0  T
   3    -32.2772518  0.297033E-05  0.153E-02    3.65       1.3  T
   4    -32.2772545 -0.277382E-05  0.644E-03    3.65       3.1  T
   5    -32.2772553 -0.738393E-06  0.139E-03    3.65      14.4  T
   6    -32.2772553  0.171644E-08  0.814E-04    3.65      24.6  T
     SCC iter.                  ...        0 min,  0.007 sec
     gradient                   ...        0 min,  0.012 sec
 * total energy  :   -31.7628795 Eh     change       -0.1091315E-03 Eh
   gradient norm :     0.0110602 Eh/α   predicted    -0.2467645E-03 ( 126.12%)
   displ. norm   :     0.2854004 α      lambda       -0.5760914E-03
   maximum displ.:     0.1539490 α      in ANC's #1, #3, #6, ...

........................................................................
.............................. CYCLE   12 ..............................
........................................................................
   1    -32.2773970 -0.322774E+02  0.118E-01    3.65       0.0  T
   2    -32.2774002 -0.319081E-05  0.694E-02    3.65       1.0  T
   3    -32.2773911  0.905032E-05  0.224E-02    3.65       1.0  T
   4    -32.2774012 -0.100560E-04  0.382E-03    3.65       5.2  T
   5    -32.2774013 -0.156519E-06  0.193E-03    3.65      10.4  T
   6    -32.2774013 -0.991975E-08  0.104E-03    3.65      19.3  T
     SCC iter.                  ...        0 min,  0.007 sec
     gradient                   ...        0 min,  0.012 sec
 * total energy  :   -31.7631113 Eh     change       -0.2318145E-03 Eh
   gradient norm :     0.0112520 Eh/α   predicted    -0.3115131E-03 (  34.38%)
   displ. norm   :     0.2256694 α      lambda       -0.2611820E-03
   maximum displ.:     0.1349234 α      in ANC's #1, #3, #4, ...

........................................................................
.............................. CYCLE   13 ..............................
........................................................................
   1    -32.2724019 -0.322724E+02  0.944E-02    3.64       0.0  T
   2    -32.2724026 -0.691361E-06  0.557E-02    3.64       1.0  T
   3    -32.2724000  0.262383E-05  0.120E-02    3.64       1.7  T
   4    -32.2724030 -0.297243E-05  0.221E-03    3.64       9.0  T
   5    -32.2724030 -0.319812E-07  0.101E-03    3.64      19.7  T
     SCC iter.                  ...        0 min,  0.006 sec
     gradient                   ...        0 min,  0.012 sec
 * total energy  :   -31.7632763 Eh     change       -0.1649637E-03 Eh
   gradient norm :     0.0084206 Eh/α   predicted    -0.1372422E-03 ( -16.80%)
   displ. norm   :     0.1577425 α      lambda       -0.2955957E-03
   maximum displ.:     0.1048656 α      in ANC's #3, #1, #42, ...

........................................................................
.............................. CYCLE   14 ..............................
........................................................................
   1    -32.2717717 -0.322718E+02  0.746E-02    3.64       0.0  T
   2    -32.2717734 -0.173682E-05  0.423E-02    3.64       1.0  T
   3    -32.2717711  0.232335E-05  0.128E-02    3.64       1.6  T
   4    -32.2717737 -0.257743E-05  0.454E-03    3.64       4.4  T
   5    -32.2717739 -0.244550E-06  0.134E-03    3.64      15.0  T
   6    -32.2717739 -0.168485E-08  0.719E-04    3.64      27.8  T
     SCC iter.                  ...        0 min,  0.007 sec
     gradient                   ...        0 min,  0.012 sec
 * total energy  :   -31.7634729 Eh     change       -0.1966954E-03 Eh
   gradient norm :     0.0045630 Eh/α   predicted    -0.1514773E-03 ( -22.99%)
   displ. norm   :     0.4190593 α      lambda       -0.3779357E-03
   maximum displ.:     0.2805991 α      in ANC's #3, #1, #6, ...

........................................................................
.............................. CYCLE   15 ..............................
........................................................................
   1    -32.2697642 -0.322698E+02  0.180E-01    3.63       0.0  T
   2    -32.2697678 -0.353665E-05  0.106E-01    3.63       1.0  T
   3    -32.2697606  0.715978E-05  0.205E-02    3.63       1.0  T
   4    -32.2697682 -0.756596E-05  0.684E-03    3.63       2.9  T
   5    -32.2697689 -0.716480E-06  0.218E-03    3.63       9.2  T
   6    -32.2697689 -0.100007E-07  0.103E-03    3.63      19.4  T
     SCC iter.                  ...        0 min,  0.007 sec
     gradient                   ...        0 min,  0.012 sec
 * total energy  :   -31.7637503 Eh     change       -0.2773339E-03 Eh
   gradient norm :     0.0076936 Eh/α   predicted    -0.2221533E-03 ( -19.90%)
   displ. norm   :     0.4537423 α      lambda       -0.5087801E-03
   maximum displ.:     0.2953157 α      in ANC's #3, #1, #6, ...

........................................................................
.............................. CYCLE   16 ..............................
........................................................................
   1    -32.2699923 -0.322700E+02  0.231E-01    3.59       0.0  T
   2    -32.2699980 -0.565060E-05  0.135E-01    3.59       1.0  T
   3    -32.2699908  0.718043E-05  0.200E-02    3.59       1.0  T
   4    -32.2699983 -0.748314E-05  0.848E-03    3.59       2.4  T
   5    -32.2699995 -0.116928E-05  0.251E-03    3.59       8.0  T
   6    -32.2699995 -0.216262E-07  0.101E-03    3.59      19.7  T
     SCC iter.                  ...        0 min,  0.006 sec
     gradient                   ...        0 min,  0.012 sec
 * total energy  :   -31.7640857 Eh     change       -0.3354190E-03 Eh
   gradient norm :     0.0095910 Eh/α   predicted    -0.3067675E-03 (  -8.54%)
   displ. norm   :     0.5443775 α      lambda       -0.4742527E-03
   maximum displ.:     0.3516707 α      in ANC's #3, #1, #6, ...

........................................................................
.............................. CYCLE   17 ..............................
........................................................................
   1    -32.2658087 -0.322658E+02  0.255E-01    3.56       0.0  T
   2    -32.2658174 -0.866251E-05  0.150E-01    3.56       1.0  T
   3    -32.2658019  0.154254E-04  0.293E-02    3.56       1.0  T
   4    -32.2658186 -0.166493E-04  0.818E-03    3.56       2.4  T
   5    -32.2658196 -0.103287E-05  0.287E-03    3.56       7.0  T
   6    -32.2658196 -0.195579E-07  0.148E-03    3.56      13.5  T
     SCC iter.                  ...        0 min,  0.006 sec
     gradient                   ...        0 min,  0.012 sec
 * total energy  :   -31.7642307 Eh     change       -0.1449916E-03 Eh
   gradient norm :     0.0148332 Eh/α   predicted    -0.3073998E-03 ( 112.01%)
   displ. norm   :     0.2928568 α      lambda       -0.8602800E-03
   maximum displ.:     0.1738716 α      in ANC's #4, #6, #8, ...

........................................................................
.............................. CYCLE   18 ..............................
........................................................................
   1    -32.2757693 -0.322758E+02  0.208E-01    3.54       0.0  T
   2    -32.2757826 -0.132361E-04  0.118E-01    3.54       1.0  T
   3    -32.2757743  0.832615E-05  0.256E-02    3.54       1.0  T
   4    -32.2757829 -0.863649E-05  0.114E-02    3.54       1.8  T
   5    -32.2757849 -0.200790E-05  0.283E-03    3.54       7.1  T
   6    -32.2757849  0.549239E-08  0.128E-03    3.54      15.6  T
     SCC iter.                  ...        0 min,  0.006 sec
     gradient                   ...        0 min,  0.012 sec
 * total energy  :   -31.7645309 Eh     change       -0.3002130E-03 Eh
   gradient norm :     0.0095913 Eh/α   predicted    -0.4670326E-03 (  55.57%)
   displ. norm   :     0.1443488 α      lambda       -0.3106731E-03
   maximum displ.:     0.0733551 α      in ANC's #1, #2, #3, ...

........................................................................
.............................. CYCLE   19 ..............................
........................................................................
   1    -32.2750270 -0.322750E+02  0.741E-02    3.54       0.0  T
   2    -32.2750295 -0.246057E-05  0.420E-02    3.54       1.0  T
   3    -32.2750289  0.605630E-06  0.948E-03    3.54       2.1  T
   4    -32.2750295 -0.645575E-06  0.549E-03    3.54       3.6  T
   5    -32.2750299 -0.399519E-06  0.187E-03    3.54      10.7  T
   6    -32.2750300 -0.141362E-07  0.787E-04    3.54      25.4  T
     SCC iter.                  ...        0 min,  0.006 sec
     gradient                   ...        0 min,  0.012 sec
 * total energy  :   -31.7646408 Eh     change       -0.1098635E-03 Eh
   gradient norm :     0.0064716 Eh/α   predicted    -0.1585753E-03 (  44.34%)
   displ. norm   :     0.2593106 α      lambda       -0.1858300E-03
   maximum displ.:     0.1736461 α      in ANC's #3, #1, #6, ...

........................................................................
.............................. CYCLE   20 ..............................
........................................................................
   1    -32.2698413 -0.322698E+02  0.126E-01    3.51       0.0  T
   2    -32.2698435 -0.214140E-05  0.745E-02    3.51       1.0  T
   3    -32.2698266  0.168509E-04  0.286E-02    3.51       1.0  T
   4    -32.2698451 -0.184767E-04  0.274E-03    3.51       7.3  T
   5    -32.2698452 -0.652336E-07  0.137E-03    3.51      14.6  T
   6    -32.2698452 -0.178677E-07  0.742E-04    3.51      27.0  T
     SCC iter.                  ...        0 min,  0.006 sec
     gradient                   ...        0 min,  0.012 sec
 * total energy  :   -31.7646899 Eh     change       -0.4909692E-04 Eh
   gradient norm :     0.0070024 Eh/α   predicted    -0.9916416E-04 ( 101.98%)
   displ. norm   :     0.1924598 α      lambda        0.1157235E-05
   maximum displ.:     0.1027261 α      in ANC's #3, #6, #1, ...
 * RMSD in coord.:     0.9645801 α      energy gain  -0.9283699E-02 Eh

generating ANC from model Hessian ...
Using Lindh-Hessian (1995)
 Shifting diagonal of input Hessian by   4.119238138565427E-003
 Lowest  eigenvalues of input Hessian
   -0.000000   -0.000000    0.000000    0.000000    0.000000    0.000000
    0.005000    0.006272    0.006655    0.007567    0.009758    0.010039
    0.011028    0.012169    0.013710    0.017580    0.020693    0.023600
 Highest eigenvalues
    1.442965    1.538114    1.678155    1.801662    1.845796    2.017118
 

........................................................................
.............................. CYCLE   21 ..............................
........................................................................
   1    -32.2704721 -0.322705E+02  0.103E-01    3.49       0.0  T
   2    -32.2704742 -0.211970E-05  0.600E-02    3.49       1.0  T
   3    -32.2704704  0.382481E-05  0.146E-02    3.49       1.4  T
   4    -32.2704744 -0.401540E-05  0.503E-03    3.49       4.0  T
   5    -32.2704748 -0.411497E-06  0.166E-03    3.49      12.0  T
   6    -32.2704748 -0.159635E-07  0.863E-04    3.49      23.2  T
   7    -32.2704748 -0.129502E-07  0.251E-04    3.49      79.5  T
     SCC iter.                  ...        0 min,  0.007 sec
     gradient                   ...        0 min,  0.012 sec
 * total energy  :   -31.7647167 Eh     change       -0.2686579E-04 Eh
   gradient norm :     0.0084069 Eh/α   predicted     0.0000000E+00 (-100.00%)
   displ. norm   :     0.0572150 α      lambda       -0.1617161E-03
   maximum displ.:     0.0274714 α      in ANC's #2, #4, #3, ...

........................................................................
.............................. CYCLE   22 ..............................
........................................................................
   1    -32.2738512 -0.322739E+02  0.303E-02    3.50       0.0  T
   2    -32.2738518 -0.624093E-06  0.167E-02    3.50       1.2  T
   3    -32.2738517  0.108325E-06  0.450E-03    3.50       4.4  T
   4    -32.2738518 -0.107191E-06  0.229E-03    3.50       8.7  T
   5    -32.2738519 -0.806406E-07  0.682E-04    3.50      29.3  T
     SCC iter.                  ...        0 min,  0.006 sec
     gradient                   ...        0 min,  0.012 sec
 * total energy  :   -31.7648165 Eh     change       -0.9973183E-04 Eh
   gradient norm :     0.0026014 Eh/α   predicted    -0.8112349E-04 ( -18.66%)
   displ. norm   :     0.0408797 α      lambda       -0.2503089E-04
   maximum displ.:     0.0183303 α      in ANC's #2, #3, #6, ...

........................................................................
.............................. CYCLE   23 ..............................
........................................................................
   1    -32.2747210 -0.322747E+02  0.230E-02    3.51       0.0  T
   2    -32.2747212 -0.221771E-06  0.125E-02    3.51       1.6  T
   3    -32.2747211  0.127807E-06  0.360E-03    3.51       5.6  T
   4    -32.2747212 -0.138917E-06  0.184E-03    3.51      10.9  T
   5    -32.2747213 -0.418582E-07  0.503E-04    3.51      39.8  T
   6    -32.2747213 -0.775245E-09  0.236E-04    3.51      84.8  T
     SCC iter.                  ...        0 min,  0.007 sec
     gradient                   ...        0 min,  0.012 sec
 * total energy  :   -31.7648344 Eh     change       -0.1789935E-04 Eh
   gradient norm :     0.0010565 Eh/α   predicted    -0.1253684E-04 ( -29.96%)
   displ. norm   :     0.0957476 α      lambda       -0.1935339E-04
   maximum displ.:     0.0465762 α      in ANC's #2, #3, #6, ...

........................................................................
.............................. CYCLE   24 ..............................
........................................................................
   1    -32.2749685 -0.322750E+02  0.458E-02    3.51       0.0  T
   2    -32.2749690 -0.544354E-06  0.260E-02    3.51       1.0  T
   3    -32.2749683  0.746870E-06  0.711E-03    3.51       2.8  T
   4    -32.2749690 -0.752265E-06  0.323E-03    3.51       6.2  T
   5    -32.2749692 -0.152274E-06  0.947E-04    3.51      21.1  T
   6    -32.2749692 -0.420155E-08  0.529E-04    3.51      37.8  T
     SCC iter.                  ...        0 min,  0.007 sec
     gradient                   ...        0 min,  0.012 sec
 * total energy  :   -31.7648539 Eh     change       -0.1949222E-04 Eh
   gradient norm :     0.0019632 Eh/α   predicted    -0.9716714E-05 ( -50.15%)
   displ. norm   :     0.0955901 α      lambda        0.1335924E-05
   maximum displ.:     0.0465749 α      in ANC's #2, #3, #6, ...

........................................................................
.............................. CYCLE   25 ..............................
........................................................................
   1    -32.2749956 -0.322750E+02  0.458E-02    3.52       0.0  T
   2    -32.2749961 -0.557120E-06  0.260E-02    3.52       1.0  T
   3    -32.2749954  0.698149E-06  0.695E-03    3.52       2.9  T
   4    -32.2749961 -0.696896E-06  0.321E-03    3.52       6.2  T
   5    -32.2749963 -0.153516E-06  0.922E-04    3.52      21.7  T
   6    -32.2749963 -0.333075E-08  0.525E-04    3.52      38.1  T
     SCC iter.                  ...        0 min,  0.006 sec
     gradient                   ...        0 min,  0.012 sec
 * total energy  :   -31.7648550 Eh     change       -0.1131861E-05 Eh
   gradient norm :     0.0040444 Eh/α   predicted     0.6666154E-06 (-158.90%)
   displ. norm   :     0.0178790 α      lambda       -0.1488333E-04
   maximum displ.:     0.0096094 α      in ANC's #2, #3, #5, ...

........................................................................
.............................. CYCLE   26 ..............................
........................................................................
   1    -32.2746465 -0.322746E+02  0.130E-02    3.52       0.0  T
   2    -32.2746466 -0.876611E-07  0.664E-03    3.52       3.0  T
   3    -32.2746465  0.558587E-07  0.225E-03    3.52       8.9  T
   4    -32.2746466 -0.724641E-07  0.108E-03    3.52      18.5  T
     SCC iter.                  ...        0 min,  0.005 sec
     gradient                   ...        0 min,  0.012 sec
 * total energy  :   -31.7648671 Eh     change       -0.1210438E-04 Eh
   gradient norm :     0.0026978 Eh/α   predicted    -0.7444233E-05 ( -38.50%)
   displ. norm   :     0.0529497 α      lambda       -0.2150941E-04
   maximum displ.:     0.0320576 α      in ANC's #2, #3, #5, ...

........................................................................
.............................. CYCLE   27 ..............................
........................................................................
   1    -32.2741680 -0.322742E+02  0.319E-02    3.52       0.0  T
   2    -32.2741685 -0.494099E-06  0.167E-02    3.52       1.2  T
   3    -32.2741681  0.382748E-06  0.564E-03    3.52       3.5  T
   4    -32.2741685 -0.462373E-06  0.267E-03    3.52       7.5  T
   5    -32.2741686 -0.733221E-07  0.709E-04    3.52      28.2  T
   6    -32.2741686 -0.643517E-09  0.236E-04    3.52      84.8  T
     SCC iter.                  ...        0 min,  0.006 sec
     gradient                   ...        0 min,  0.012 sec
 * total energy  :   -31.7648793 Eh     change       -0.1220553E-04 Eh
   gradient norm :     0.0009973 Eh/α   predicted    -0.1078565E-04 ( -11.63%)
   displ. norm   :     0.0562151 α      lambda       -0.4721202E-05
   maximum displ.:     0.0376335 α      in ANC's #2, #3, #4, ...

........................................................................
.............................. CYCLE   28 ..............................
........................................................................
   1    -32.2741968 -0.322742E+02  0.300E-02    3.52       0.0  T
   2    -32.2741970 -0.229877E-06  0.163E-02    3.52       1.2  T
   3    -32.2741968  0.231048E-06  0.430E-03    3.52       4.6  T
   4    -32.2741971 -0.274651E-06  0.207E-03    3.52       9.7  T
   5    -32.2741971 -0.385522E-07  0.384E-04    3.52      52.1  T
   6    -32.2741971 -0.462521E-09  0.111E-04    3.52     180.0  T
     SCC iter.                  ...        0 min,  0.007 sec
     gradient                   ...        0 min,  0.012 sec
 * total energy  :   -31.7648834 Eh     change       -0.4096014E-05 Eh
   gradient norm :     0.0010311 Eh/α   predicted    -0.2364875E-05 ( -42.26%)
   displ. norm   :     0.0561956 α      lambda        0.3780736E-05
   maximum displ.:     0.0376337 α      in ANC's #2, #3, #4, ...

........................................................................
.............................. CYCLE   29 ..............................
........................................................................
   1    -32.2741597 -0.322742E+02  0.300E-02    3.52       0.0  T
   2    -32.2741599 -0.226134E-06  0.163E-02    3.52       1.2  T
   3    -32.2741596  0.234674E-06  0.431E-03    3.52       4.6  T
   4    -32.2741599 -0.278655E-06  0.206E-03    3.52       9.7  T
   5    -32.2741600 -0.380070E-07  0.384E-04    3.52      52.1  T
   6    -32.2741600 -0.470756E-09  0.121E-04    3.52     164.8  T
     SCC iter.                  ...        0 min,  0.007 sec
     gradient                   ...        0 min,  0.012 sec
 * total energy  :   -31.7648815 Eh     change        0.1929705E-05 Eh
   gradient norm :     0.0017087 Eh/α   predicted     0.1890794E-05 (  -2.02%)
   displ. norm   :     0.0140299 α      lambda       -0.7319984E-05
   maximum displ.:     0.0058152 α      in ANC's #18, #4, #2, ...

........................................................................
.............................. CYCLE   30 ..............................
........................................................................
   1    -32.2744842 -0.322745E+02  0.960E-03    3.52       0.0  T
   2    -32.2744842 -0.114486E-07  0.571E-03    3.52       3.5  T
   3    -32.2744842  0.655378E-07  0.183E-03    3.52      10.9  T
   4    -32.2744842 -0.721122E-07  0.372E-04    3.52      53.8  T
   5    -32.2744842 -0.888186E-09  0.171E-04    3.52     116.9  T
     SCC iter.                  ...        0 min,  0.006 sec
     gradient                   ...        0 min,  0.012 sec
 * total energy  :   -31.7648880 Eh     change       -0.6496242E-05 Eh
   gradient norm :     0.0007570 Eh/α   predicted    -0.3661850E-05 ( -43.63%)
   displ. norm   :     0.0196497 α      lambda       -0.2256694E-05
   maximum displ.:     0.0152526 α      in ANC's #2, #5, #4, ...

........................................................................
.............................. CYCLE   31 ..............................
........................................................................
   1    -32.2746883 -0.322747E+02  0.933E-03    3.52       0.0  T
   2    -32.2746884 -0.322265E-07  0.515E-03    3.52       3.9  T
   3    -32.2746883  0.358141E-07  0.166E-03    3.52      12.0  T
   4    -32.2746884 -0.392698E-07  0.736E-04    3.52      27.2  T
   5    -32.2746884 -0.663156E-08  0.173E-04    3.52     115.5  T
     SCC iter.                  ...        0 min,  0.006 sec
     gradient                   ...        0 min,  0.012 sec
 * total energy  :   -31.7648902 Eh     change       -0.2229875E-05 Eh
   gradient norm :     0.0003617 Eh/α   predicted    -0.1130431E-05 ( -49.31%)
   displ. norm   :     0.0234648 α      lambda       -0.1461962E-05
   maximum displ.:     0.0187035 α      in ANC's #2, #5, #4, ...

   *** GEOMETRY OPTIMIZATION CONVERGED AFTER 31 ITERATIONS ***

------------------------------------------------------------------------
 total energy gain   :        -0.0094840 Eh       -5.9513 kcal/mol
 total RMSD          :         1.0206295 a0        0.5401 Å
 total power (kW/mol):        -0.8032354 (step)  -29.2832 (real)
------------------------------------------------------------------------

 ANCopt (total)                0 d,  0 h,  0 min,  0.850 sec
 optimizer setup                ...        0 min,  0.000 sec (  0.018%)
 model hessian                  ...        0 min,  0.015 sec (  1.706%)
 ANC generation                 ...        0 min,  0.002 sec (  0.177%)
 coordinate transformation      ...        0 min,  0.001 sec (  0.074%)
 single point calculation       ...        0 min,  0.821 sec ( 96.516%)
 optimization log               ...        0 min,  0.003 sec (  0.369%)
 hessian update                 ...        0 min,  0.000 sec (  0.051%)
 rational function              ...        0 min,  0.007 sec (  0.860%)

================
 final structure:
================
$coord
    0.41314228706885    2.21307991137158    0.21915959396391      C 
   -1.54395699624748   -0.37804588652877    0.17846059001234      S 
    1.01455421012939   -2.38663197700464    0.47643258245891      C 
    0.62733310664722   -5.17804843956681    0.48514171523760      C 
    1.39970258515807   -6.35719518069473   -2.04010066405469      C 
    3.25689272140142   -1.08680351764993    0.53747186295815      C 
    2.89650796607192    1.59230338720479    0.40229199684855      C 
    4.94220189014455    3.54680473909631    0.50788952813795      C 
    5.49356305764146    4.64168948079265   -2.11003205494366      C 
    5.66732964126918   -2.39500795799762    0.79741457432709      C 
    7.80539916939390   -1.80470110560078   -0.36738338105528      C 
   -0.39918578959946    4.06673999821137    0.12029959608327      H 
   -1.36102843519156   -5.58511346015048    0.85468121737582      H 
    1.74767405008860   -6.02665841461072    2.00124440878247      H 
    0.26961557610856   -5.57241497596517   -3.56637197852359      H 
    1.11817033795813   -8.39180949382374   -1.99357939906786      H 
    3.37999696628470   -5.97035894876408   -2.42951964293732      H 
    6.65228689180568    2.70820100042079    1.29591844736292      H 
    4.34471270754954    5.07998443554210    1.75613437647528      H 
    6.01034419914503    3.15419815226669   -3.43127524887450      H 
    7.03635709435604    5.99626057373316   -2.01000417164378      H 
    3.82979370521484    5.59538084120026   -2.84890210652441      H 
    5.62515553683415   -4.02414769205311    2.03866768793961      H 
    7.94337186319725   -0.27029011936033   -1.69274226185662      H 
    9.50556403405124   -2.88243485033905   -0.06417231870666      H 
$end
           -------------------------------------------------
          |                Final Singlepoint                |
           -------------------------------------------------

          ...................................................
          :                      SETUP                      :
          :.................................................:
          :  # basis functions                  64          :
          :  # atomic orbitals                  63          :
          :  # shells                           37          :
          :  # electrons                        60          :
          :  max. iterations                   250          :
          :  Hamiltonian                  GFN2-xTB          :
          :  restarted?                      false          :
          :  GBSA solvation                  false          :
          :  PC potential                    false          :
          :  electronic temp.          300.0000000     K    :
          :  accuracy                    1.0000000          :
          :  -> integral cutoff          0.2500000E+02      :
          :  -> integral neglect         0.1000000E-07      :
          :  -> SCF convergence          0.1000000E-05 Eh   :
          :  -> wf. convergence          0.1000000E-03 e    :
          :  Broyden damping             0.4000000          :
          ...................................................

 iter      E             dE          RMSdq      gap      omega  full diag
   1    -32.2746884 -0.322747E+02  0.798E-05    3.52       0.0  T
   2    -32.2746884 -0.127187E-11  0.451E-05    3.52     443.8  T
   3    -32.2746884 -0.207478E-10  0.313E-05    3.52     639.2  T

   *** convergence criteria satisfied after 3 iterations ***

         #    Occupation            Energy/Eh            Energy/eV
      -------------------------------------------------------------
         1        2.0000           -0.7215194             -19.6335
       ...           ...                  ...                  ...
        24        2.0000           -0.4412979             -12.0083
        25        2.0000           -0.4336897             -11.8013
        26        2.0000           -0.4303079             -11.7093
        27        2.0000           -0.4223258             -11.4921
        28        2.0000           -0.4150158             -11.2932
        29        2.0000           -0.3781767             -10.2907
        30        2.0000           -0.3703541             -10.0778 (HOMO)
        31                         -0.2411089              -6.5609 (LUMO)
        32                         -0.2104996              -5.7280
        33                         -0.1934351              -5.2636
        34                         -0.1370975              -3.7306
        35                         -0.1068489              -2.9075
       ...                                ...                  ...
        63                          0.6891825              18.7536
      -------------------------------------------------------------
                  HL-Gap            0.1292452 Eh            3.5169 eV
             Fermi-level           -0.3057315 Eh           -8.3194 eV

 SCC (total)                   0 d,  0 h,  0 min,  0.025 sec
 SCC setup                      ...        0 min,  0.000 sec (  0.781%)
 Dispersion                     ...        0 min,  0.000 sec (  0.837%)
 integral evaluation            ...        0 min,  0.007 sec ( 30.412%)
 zeroth order Hamiltonian       ...        0 min,  0.000 sec (  0.602%)
 iterations                     ...        0 min,  0.004 sec ( 16.046%)
 molecular gradient             ...        0 min,  0.012 sec ( 49.645%)
 printout                       ...        0 min,  0.000 sec (  1.471%)

         :::::::::::::::::::::::::::::::::::::::::::::::::::::
         ::                     SUMMARY                     ::
         :::::::::::::::::::::::::::::::::::::::::::::::::::::
         :: total energy             -31.764890212071 Eh    ::
         :: gradient norm              0.000361945906 Eh/a0 ::
         :: HOMO-LUMO gap              3.516940652903 eV    ::
         ::.................................................::
         :: SCC energy               -32.274688360954 Eh    ::
         :: -> isotropic ES            0.003885084154 Eh    ::
         :: -> anisotropic ES          0.005282201818 Eh    ::
         :: -> anisotropic XC          0.018697281344 Eh    ::
         :: -> dispersion             -0.023336986291 Eh    ::
         :: repulsion energy           0.509576419727 Eh    ::
         :: add. restraining           0.000000000000 Eh    ::
         :::::::::::::::::::::::::::::::::::::::::::::::::::::

           -------------------------------------------------
          |                Property Printout                |
           -------------------------------------------------

    * Orbital Energies and Occupations

         #    Occupation            Energy/Eh            Energy/eV
      -------------------------------------------------------------
         1        2.0000           -0.7215194             -19.6335
       ...           ...                  ...                  ...
        18        2.0000           -0.4718935             -12.8409
        19        2.0000           -0.4710387             -12.8176
        20        2.0000           -0.4683962             -12.7457
        21        2.0000           -0.4557607             -12.4019
        22        2.0000           -0.4514257             -12.2839
        23        2.0000           -0.4476692             -12.1817
        24        2.0000           -0.4412979             -12.0083
        25        2.0000           -0.4336897             -11.8013
        26        2.0000           -0.4303079             -11.7093
        27        2.0000           -0.4223258             -11.4921
        28        2.0000           -0.4150158             -11.2932
        29        2.0000           -0.3781767             -10.2907
        30        2.0000           -0.3703541             -10.0778 (HOMO)
        31                         -0.2411089              -6.5609 (LUMO)
        32                         -0.2104996              -5.7280
        33                         -0.1934351              -5.2636
        34                         -0.1370975              -3.7306
        35                         -0.1068489              -2.9075
        36                          0.0019793               0.0539
        37                          0.0339832               0.9247
        38                          0.0412491               1.1224
        39                          0.0874439               2.3795
        40                          0.1190532               3.2396
        41                          0.1277142               3.4753
       ...                                ...                  ...
        63                          0.6891825              18.7536
      -------------------------------------------------------------
                  HL-Gap            0.1292452 Eh            3.5169 eV
             Fermi-level           -0.3057315 Eh           -8.3194 eV

     #   Z        covCN         q      C6AA      α(0)
     1   6 C      2.941    -0.032    28.810     8.803
     2  16 S      2.302    -0.063   143.669    20.174
     3   6 C      2.990     0.015    27.679     8.630
     4   6 C      3.827    -0.052    21.482     6.595
     5   6 C      3.753    -0.100    22.464     6.759
     6   6 C      3.157    -0.019    28.165     8.677
     7   6 C      3.146    -0.006    27.913     8.643
     8   6 C      3.805    -0.054    21.536     6.607
     9   6 C      3.753    -0.096    22.392     6.748
    10   6 C      2.892    -0.024    28.597     8.768
    11   6 C      2.838    -0.091    30.286     9.019
    12   1 H      0.926     0.037     2.490     2.468
    13   1 H      0.924     0.043     2.407     2.426
    14   1 H      0.924     0.041     2.436     2.441
    15   1 H      0.925     0.040     2.453     2.449
    16   1 H      0.925     0.038     2.471     2.458
    17   1 H      0.925     0.040     2.451     2.448
    18   1 H      0.924     0.044     2.400     2.422
    19   1 H      0.924     0.033     2.539     2.492
    20   1 H      0.925     0.035     2.513     2.479
    21   1 H      0.925     0.034     2.529     2.487
    22   1 H      0.925     0.035     2.518     2.481
    23   1 H      0.925     0.030     2.581     2.512
    24   1 H      0.926     0.042     2.416     2.431
    25   1 H      0.926     0.030     2.589     2.516

 Mol. C6AA /au·bohr⁶  :       7181.464668
 Mol. C8AA /au·bohr⁸  :     187661.218060
 Mol. α(0) /au        :        133.933682


Wiberg/Mayer (AO) data.
largest (>0.10) Wiberg bond orders for each atom
          total WBO             WBO to atom ...
     1  C   3.940        C    7 1.617    S    2 1.171    H   12 0.970    C    3 0.108
     2  S   2.613        C    1 1.171    C    3 1.167
     3  C   3.946        C    6 1.533    S    2 1.167    C    4 1.027    C    1 0.108
     4  C   3.997        C    3 1.027    C    5 0.999    H   13 0.975    H   14 0.961
     5  C   3.996        C    4 0.999    H   15 0.988    H   17 0.987    H   16 0.986
     6  C   3.983        C    3 1.533    C    7 1.199    C   10 1.072
     7  C   3.985        C    1 1.617    C    6 1.199    C    8 1.009
     8  C   3.997        C    7 1.009    C    9 1.003    H   19 0.972    H   18 0.970
     9  C   3.997        C    8 1.003    H   22 0.988    H   21 0.987    H   20 0.985
    10  C   3.992        C   11 1.915    C    6 1.072    H   23 0.957
    11  C   3.992        C   10 1.915    H   25 0.978    H   24 0.972
    12  H   0.998        C    1 0.970
    13  H   0.998        C    4 0.975
    14  H   0.998        C    4 0.961
    15  H   0.998        C    5 0.988
    16  H   0.998        C    5 0.986
    17  H   0.998        C    5 0.987
    18  H   0.998        C    8 0.970
    19  H   0.999        C    8 0.972
    20  H   0.999        C    9 0.985
    21  H   0.998        C    9 0.987
    22  H   0.999        C    9 0.988
    23  H   0.999        C   10 0.957
    24  H   0.998        C   11 0.972
    25  H   0.998        C   11 0.978

molecular dipole:
                 x           y           z       tot (Debye)
 q only:        0.203      -0.123      -0.033
   full:        0.438      -0.058      -0.009       1.122
molecular quadrupole (traceless):
                xx          xy          yy          xz          yz          zz
 q only:       -1.129       0.916       2.979      -0.262      -0.229      -1.850
  q+dip:       -0.061      -0.248       4.302      -0.064      -1.585      -4.241
   full:       -1.434       0.024       4.252      -0.009      -0.878      -2.817

           -------------------------------------------------
          |                Geometry Summary                 |
           -------------------------------------------------

      molecular mass/u    :      166.2806000
   center of mass at/Å    :        1.3022902      -0.3532244      -0.0555001
  moments of inertia/u·Å² :        0.4010617E+03   0.6193312E+03   0.9171784E+03
rotational constants/cm⁻¹ :        0.4203252E-01   0.2721909E-01   0.1837988E-01

 * 22 selected distances

     #   Z        #   Z                                     value/Å
     1   6 C      2  16 S                                 1.7184682
     2  16 S      3   6 C                                 1.7284897 (max)
     4   6 C      5   6 C                                 1.5303922
     3   6 C      6   6 C                                 1.3719232
     1   6 C      7   6 C                                 1.3580390
     6   6 C      7   6 C                                 1.4322791
     8   6 C      9   6 C                                 1.5297054
    10   6 C     11   6 C                                 1.3257509
     1   6 C     12   1 H                                 1.0722476 (min)
     4   6 C     13   1 H                                 1.0916765
     4   6 C     14   1 H                                 1.0939862
     5   6 C     15   1 H                                 1.0873892
     5   6 C     16   1 H                                 1.0872088
     5   6 C     17   1 H                                 1.0874374
     8   6 C     18   1 H                                 1.0907519
     8   6 C     19   1 H                                 1.0929462
     9   6 C     20   1 H                                 1.0877620
     9   6 C     21   1 H                                 1.0877241
     9   6 C     22   1 H                                 1.0875313
    10   6 C     23   1 H                                 1.0840496
    11   6 C     24   1 H                                 1.0754191
    11   6 C     25   1 H                                 1.0772374

 * 3 distinct bonds (by element types)

   Z      Z             #   av. dist./Å        max./Å        min./Å
   1 H    6 C          14     1.0859548     1.0939862     1.0722476
   6 C    6 C           6     1.4246816     1.5303922     1.3257509
   6 C   16 S           2     1.7234789     1.7284897     1.7184682


optimized geometry written to: xtbopt.xyz


           -------------------------------------------------
          | TOTAL ENERGY              -31.764890212071 Eh   |
          | GRADIENT NORM               0.000361945906 Eh/α |
          | HOMO-LUMO GAP               3.516940652903 eV   |
           -------------------------------------------------

------------------------------------------------------------------------
 * finished run on 2021/05/19 at 10:59:05.278     
------------------------------------------------------------------------
 total:
 * wall-time:     0 d,  0 h,  0 min,  0.942 sec
 *  cpu-time:     0 d,  0 h,  0 min,  0.929 sec
 * ratio c/w:     0.986 speedup
 SCF:
 * wall-time:     0 d,  0 h,  0 min,  0.035 sec
 *  cpu-time:     0 d,  0 h,  0 min,  0.035 sec
 * ratio c/w:     1.000 speedup
 ANC optimizer:
 * wall-time:     0 d,  0 h,  0 min,  0.876 sec
 *  cpu-time:     0 d,  0 h,  0 min,  0.875 sec
 * ratio c/w:     1.000 speedup

