      -----------------------------------------------------------      
     |                   =====================                   |     
     |                           x T B                           |     
     |                   =====================                   |     
     |                         S. Grimme                         |     
     |          Mulliken Center for Theoretical Chemistry        |     
     |                    University of Bonn                     |     
     |                Version 6.2 RC2 (SAW190805)                |     
      -----------------------------------------------------------      

   This program is distributed in the hope that it will be useful,
   but WITHOUT ANY WARRANTY; without even the implied warranty of
   MERCHANTABILITY or FITNESS FOR A PARTICULAR PURPOSE.
   
   FOR NON-COMMERCIAL, ACADEMIA USE ONLY.
   
   Cite this work as:
   * S. Grimme, C. Bannwarth, P. Shushkov, J. Chem. Theory Comput., 2017,
     13, 1989-2009. DOI: 10.1021/acs.jctc.7b00118
   * C. Bannwarth, S. Ehlert and S. Grimme., J. Chem. Theory Comput., 2019,
     15, 1652-1671. DOI: 10.1021/acs.jctc.8b01176
   * P. Pracht, E. Caldeweyher, S. Ehlert, S. Grimme, ChemRxiv, 2019, preprint.
     DOI: 10.26434/chemrxiv.8326202.v1
   
   for DFT-D4:
   * E. Caldeweyher, C. Bannwarth and S. Grimme, J. Chem. Phys., 2017,
     147, 034112. DOI: 10.1063/1.4993215
   * E. Caldeweyher, S. Ehlert, A. Hansen, H. Neugebauer, S. Spicher,
     C. Bannwarth and S. Grimme, J. Chem. Phys., 2019, 150, 154122.
     DOI: 10.1063/1.5090222
   
   for sTDA-xTB:
   * S. Grimme and C. Bannwarth, J. Chem. Phys., 2016, 145, 054103.
     DOI: 10.1063/1.4959605
   
   in the mass-spec context:
   * V. Asgeirsson, C. Bauer and S. Grimme, Chem. Sci., 2017, 8, 4879.
     DOI: 10.1039/c7sc00601b
   
   for metadynamics refer to:
   * S. Grimme, J. Chem. Theory Comput., 2019, 155, 2847-2862
     DOI: 10.1021/acs.jctc.9b00143
   
   with help from (in alphabetical order)
   C. Bannwarth, F. Bohle, G. Brandenburg, E. Caldeweyher, M. Checinski,
   S. Dohm, S. Ehlert, S. Ehrlich, F. März, H. Neugebauer, J. Pisarek,
   P. Pracht, P. Shushkov, and S. Spicher.
   
 * started run on 2021/05/19 at 10:59:05.492     

           -------------------------------------------------
          |                Calculation Setup                |
           -------------------------------------------------

          program call               : /ihome/ghutchison/geoffh/xtb/xtb 142.xyz -opt
          hostname                   : smp-n83
          coordinate file            : 142.xyz
          omp threads                :                     1
          number of atoms            :                    24
          number of electrons        :                    88
          charge                     :                     0
          spin                       :                   0.0
          first test random number   :      0.53121428431627


########################################################################
# WARNING! Please study the warnings concerning your input carefully
#  - the use of '-opt' is discouraged, please use '--opt' next time
########################################################################

           ------------------------------------------------- 
          |                 G F N 2 - x T B                 |
          | Geometry, Frequencies, Noncovalent interactions |
          |            JCTC 2019 parametrisation            |
           ------------------------------------------------- 
             KAB for C  - Si     :                1.0500
             KAB for H  - Pd     :                0.9500
             k(s)              :                1.8500
             k(p)              :                2.2300
             k(d)              :                2.2300
             k(f)              :                2.0000
             kEN (H0ij)        :               -2.0000
             D4 a1             :                0.5200
             D4 a2             :                5.0000
             D4 s6             :                1.0000
             D4 s8             :                2.7000
             D4 s9             :                5.0000
             alphaj            :                2.0000

  Z AO/shell   Hii/eV     exponent
  1     Wed Apr 25 08:07:45 CEST 2018   EN: 2.200 GM2: 0.406  GM3: 0.0800  RAES: 1.40
     1s    -10.707211    1.230000
  6     Wed Apr 25 08:07:45 CEST 2018   EN: 2.550 GM2: 0.538  GM3: 0.1500  RAES: 3.00
     2s    -13.970922    2.096432
     2p    -10.063292    1.800000
  8     Wed Apr 25 08:07:45 CEST 2018   EN: 3.440 GM2: 0.452  GM3:-0.0517  RAES: 1.80
     2s    -20.229985    2.439742
     2p    -15.503117    2.137023
  9     Mon Apr 23 13:58:50 CEST 2018   EN: 3.980 GM2: 0.532  GM3: 0.1426  RAES: 2.40
     2s    -23.458179    2.416361
     2p    -15.746583    2.308399
 16     Tue Apr 24 11:44:34 CEST 2018   EN: 2.580 GM2: 0.340  GM3:-0.0502  RAES: 3.10
     3s    -20.029654    1.981333
     3p    -11.377694    2.025643
     3d     -0.420282    1.702555

           ------------------------------------------------- 
          |        Self-Consistent Charge Iterations        |
           ------------------------------------------------- 

          ...................................................
          :                      SETUP                      :
          :.................................................:
          :  # basis functions                  81          :
          :  # atomic orbitals                  80          :
          :  # shells                           42          :
          :  # electrons                        88          :
          :  max. iterations                   250          :
          :  Hamiltonian                  GFN2-xTB          :
          :  restarted?                      false          :
          :  GBSA solvation                  false          :
          :  PC potential                    false          :
          :  electronic temp.          300.0000000     K    :
          :  accuracy                    1.0000000          :
          :  -> integral cutoff          0.2500000E+02      :
          :  -> integral neglect         0.1000000E-07      :
          :  -> SCF convergence          0.1000000E-05 Eh   :
          :  -> wf. convergence          0.1000000E-03 e    :
          :  Broyden damping             0.4000000          :
          ...................................................

 iter      E             dE          RMSdq      gap      omega  full diag
   1    -51.1720397 -0.511720E+02  0.508E+00    1.72       0.0  T
   2    -51.2419672 -0.699275E-01  0.286E+00    1.43       1.0  T
   3    -51.2353581  0.660911E-02  0.158E+00    1.56       1.0  T
   4    -51.2455237 -0.101656E-01  0.602E-01    1.39       1.0  T
   5    -51.2528403 -0.731663E-02  0.258E-01    1.37       1.0  T
   6    -51.2542132 -0.137291E-02  0.850E-02    1.41       1.0  T
   7    -51.2542900 -0.767857E-04  0.290E-02    1.41       1.0  T
   8    -51.2542966 -0.655061E-05  0.151E-02    1.41       1.3  T
   9    -51.2542987 -0.212396E-05  0.606E-03    1.41       3.4  T
  10    -51.2542989 -0.186333E-06  0.301E-03    1.41       6.8  T
  11    -51.2542990 -0.114443E-06  0.111E-03    1.41      18.5  T
  12    -51.2542990 -0.922196E-08  0.562E-04    1.41      36.3  T
  13    -51.2542990 -0.194803E-08  0.292E-04    1.41      70.0  T

   *** convergence criteria satisfied after 13 iterations ***

         #    Occupation            Energy/Eh            Energy/eV
      -------------------------------------------------------------
         1        2.0000           -0.8838070             -24.0496
       ...           ...                  ...                  ...
        38        2.0000           -0.4651985             -12.6587
        39        2.0000           -0.4588297             -12.4854
        40        2.0000           -0.4553177             -12.3898
        41        2.0000           -0.4394892             -11.9591
        42        2.0000           -0.4336075             -11.7991
        43        2.0000           -0.4219282             -11.4813
        44        2.0000           -0.3854000             -10.4873 (HOMO)
        45                         -0.3337166              -9.0809 (LUMO)
        46                         -0.2945836              -8.0160
        47                         -0.2488691              -6.7721
        48                         -0.2309985              -6.2858
        49                         -0.2176732              -5.9232
       ...                                ...                  ...
        80                          0.7063333              19.2203
      -------------------------------------------------------------
                  HL-Gap            0.0516834 Eh            1.4064 eV
             Fermi-level           -0.3595583 Eh           -9.7841 eV

 SCC (total)                   0 d,  0 h,  0 min,  0.050 sec
 SCC setup                      ...        0 min,  0.000 sec (  0.659%)
 Dispersion                     ...        0 min,  0.000 sec (  0.751%)
 integral evaluation            ...        0 min,  0.013 sec ( 26.098%)
 zeroth order Hamiltonian       ...        0 min,  0.000 sec (  0.431%)
 iterations                     ...        0 min,  0.019 sec ( 37.337%)
 molecular gradient             ...        0 min,  0.017 sec ( 33.821%)
 printout                       ...        0 min,  0.000 sec (  0.796%)

         :::::::::::::::::::::::::::::::::::::::::::::::::::::
         ::                     SUMMARY                     ::
         :::::::::::::::::::::::::::::::::::::::::::::::::::::
         :: total energy             -50.705748822745 Eh    ::
         :: gradient norm              0.110842153986 Eh/a0 ::
         :: HOMO-LUMO gap              1.406376050891 eV    ::
         ::.................................................::
         :: SCC energy               -51.254298992853 Eh    ::
         :: -> isotropic ES            0.064772706370 Eh    ::
         :: -> anisotropic ES          0.000827575396 Eh    ::
         :: -> anisotropic XC         -0.001668222151 Eh    ::
         :: -> dispersion             -0.027234425798 Eh    ::
         :: repulsion energy           0.548525487358 Eh    ::
         :: add. restraining           0.000000000000 Eh    ::
         :::::::::::::::::::::::::::::::::::::::::::::::::::::

      ----------------------------------------------------------- 
     |                   =====================                   |
     |                        A N C O P T                        |
     |                   =====================                   |
     |               Approximate Normal Coordinate               |
     |                Rational Function Optimizer                |
      ----------------------------------------------------------- 

          ...................................................
          :                      SETUP                      :
          :.................................................:
          :   optimization level            normal          :
          :   max. optcycles                   200          :
          :   ANC micro-cycles                  20          :
          :   degrees of freedom                66          :
          :.................................................:
          :   RF solver                   davidson          :
          :   input Hessian                  false          :
          :   write xtbopt.log                true          :
          :   linear?                        false          :
          :   energy convergence         0.5000000E-05 Eh   :
          :   grad. convergence          0.1000000E-02 Eh/α :
          :   maximium RF displ.         2.0000000          :
          :   Hlow (freq-cutoff)         0.5000000E-02      :
          :   Hmax (freq-cutoff)         5.0000000          :
          :   S6 in model hess.         20.0000000          :
          ...................................................

generating ANC from model Hessian ...
Using Lindh-Hessian (1995)
 Shifting diagonal of input Hessian by   4.151852147094513E-003
 Lowest  eigenvalues of input Hessian
   -0.000000   -0.000000   -0.000000    0.000000    0.000000    0.000000
    0.005000    0.006597    0.007603    0.008332    0.008948    0.011856
    0.012681    0.015003    0.021196    0.022073    0.023828    0.026024
 Highest eigenvalues
    1.708940    1.791926    1.905209    1.950476    2.033766    2.099472
 

........................................................................
.............................. CYCLE    1 ..............................
........................................................................
   1    -51.2542990 -0.512543E+02  0.143E-04    1.41       0.0  T
   2    -51.2542990  0.660805E-12  0.960E-05    1.41     212.5  T
   3    -51.2542990  0.100812E-09  0.958E-05    1.41     213.1  T
     SCC iter.                  ...        0 min,  0.005 sec
     gradient                   ...        0 min,  0.017 sec
 * total energy  :   -50.7057489 Eh     change       -0.3576946E-07 Eh
   gradient norm :     0.1108430 Eh/α   predicted     0.0000000E+00 (-100.00%)
   displ. norm   :     0.3125888 α      lambda       -0.1808802E-01
   maximum displ.:     0.1131845 α      in ANC's #17, #29, #16, ...

........................................................................
.............................. CYCLE    2 ..............................
........................................................................
   1    -51.2938983 -0.512939E+02  0.302E-01    1.51       0.0  T
   2    -51.2939804 -0.820695E-04  0.179E-01    1.48       1.0  T
   3    -51.2938003  0.180077E-03  0.113E-01    1.50       1.0  T
   4    -51.2940217 -0.221412E-03  0.432E-02    1.49       1.0  T
   5    -51.2940559 -0.342145E-04  0.176E-02    1.49       1.2  T
   6    -51.2940601 -0.416844E-05  0.672E-03    1.49       3.0  T
   7    -51.2940606 -0.510565E-06  0.252E-03    1.49       8.1  T
   8    -51.2940607 -0.780791E-07  0.109E-03    1.49      18.7  T
     SCC iter.                  ...        0 min,  0.010 sec
     gradient                   ...        0 min,  0.016 sec
 * total energy  :   -50.7184437 Eh     change       -0.1269481E-01 Eh
   gradient norm :     0.0525297 Eh/α   predicted    -0.9927721E-02 ( -21.80%)
   displ. norm   :     0.2878526 α      lambda       -0.6257039E-02
   maximum displ.:     0.1158977 α      in ANC's #3, #17, #11, ...

........................................................................
.............................. CYCLE    3 ..............................
........................................................................
   1    -51.3133324 -0.513133E+02  0.266E-01    1.56       0.0  T
   2    -51.3133792 -0.468142E-04  0.160E-01    1.55       1.0  T
   3    -51.3132425  0.136751E-03  0.939E-02    1.56       1.0  T
   4    -51.3134110 -0.168511E-03  0.261E-02    1.55       1.0  T
   5    -51.3134228 -0.118081E-04  0.125E-02    1.55       1.6  T
   6    -51.3134252 -0.247340E-05  0.484E-03    1.55       4.2  T
   7    -51.3134255 -0.241002E-06  0.195E-03    1.55      10.5  T
     SCC iter.                  ...        0 min,  0.009 sec
     gradient                   ...        0 min,  0.016 sec
 * total energy  :   -50.7220451 Eh     change       -0.3601420E-02 Eh
   gradient norm :     0.0127007 Eh/α   predicted    -0.3387747E-02 (  -5.93%)
   displ. norm   :     0.2317977 α      lambda       -0.9506462E-03
   maximum displ.:     0.1629506 α      in ANC's #3, #7, #5, ...

........................................................................
.............................. CYCLE    4 ..............................
........................................................................
   1    -51.3124798 -0.513125E+02  0.168E-01    1.55       0.0  T
   2    -51.3124889 -0.910412E-05  0.985E-02    1.55       1.0  T
   3    -51.3124539  0.349661E-04  0.449E-02    1.55       1.0  T
   4    -51.3124935 -0.396003E-04  0.126E-02    1.55       1.6  T
   5    -51.3124949 -0.132337E-05  0.815E-03    1.55       2.5  T
   6    -51.3124959 -0.103972E-05  0.252E-03    1.55       8.1  T
   7    -51.3124960 -0.706465E-07  0.111E-03    1.55      18.4  T
     SCC iter.                  ...        0 min,  0.010 sec
     gradient                   ...        0 min,  0.016 sec
 * total energy  :   -50.7227642 Eh     change       -0.7191446E-03 Eh
   gradient norm :     0.0077953 Eh/α   predicted    -0.5008676E-03 ( -30.35%)
   displ. norm   :     0.3477471 α      lambda       -0.9203375E-03
   maximum displ.:     0.2437444 α      in ANC's #3, #5, #7, ...

........................................................................
.............................. CYCLE    5 ..............................
........................................................................
   1    -51.3098181 -0.513098E+02  0.245E-01    1.53       0.0  T
   2    -51.3098349 -0.168200E-04  0.144E-01    1.54       1.0  T
   3    -51.3097797  0.551637E-04  0.547E-02    1.54       1.0  T
   4    -51.3098409 -0.611564E-04  0.179E-02    1.54       1.1  T
   5    -51.3098445 -0.361714E-05  0.101E-02    1.54       2.0  T
   6    -51.3098459 -0.137219E-05  0.342E-03    1.54       6.0  T
   7    -51.3098460 -0.116589E-06  0.143E-03    1.54      14.3  T
   8    -51.3098460 -0.506761E-08  0.672E-04    1.54      30.4  T
     SCC iter.                  ...        0 min,  0.011 sec
     gradient                   ...        0 min,  0.016 sec
 * total energy  :   -50.7234501 Eh     change       -0.6858768E-03 Eh
   gradient norm :     0.0114639 Eh/α   predicted    -0.5158264E-03 ( -24.79%)
   displ. norm   :     0.3683132 α      lambda       -0.7566453E-03
   maximum displ.:     0.2709732 α      in ANC's #3, #8, #6, ...

........................................................................
.............................. CYCLE    6 ..............................
........................................................................
   1    -51.3081606 -0.513082E+02  0.244E-01    1.52       0.0  T
   2    -51.3081768 -0.162139E-04  0.144E-01    1.53       1.0  T
   3    -51.3081266  0.502057E-04  0.512E-02    1.52       1.0  T
   4    -51.3081832 -0.566492E-04  0.174E-02    1.53       1.2  T
   5    -51.3081867 -0.347459E-05  0.966E-03    1.53       2.1  T
   6    -51.3081879 -0.118903E-05  0.360E-03    1.53       5.7  T
   7    -51.3081880 -0.143063E-06  0.150E-03    1.53      13.6  T
   8    -51.3081880 -0.223729E-09  0.880E-04    1.53      23.2  T
     SCC iter.                  ...        0 min,  0.011 sec
     gradient                   ...        0 min,  0.016 sec
 * total energy  :   -50.7240120 Eh     change       -0.5618999E-03 Eh
   gradient norm :     0.0146991 Eh/α   predicted    -0.4296446E-03 ( -23.54%)
   displ. norm   :     0.3859099 α      lambda       -0.8231255E-03
   maximum displ.:     0.2977714 α      in ANC's #3, #8, #6, ...

........................................................................
.............................. CYCLE    7 ..............................
........................................................................
   1    -51.3083556 -0.513084E+02  0.258E-01    1.50       0.0  T
   2    -51.3083706 -0.149782E-04  0.154E-01    1.51       1.0  T
   3    -51.3082828  0.877790E-04  0.633E-02    1.50       1.0  T
   4    -51.3083807 -0.979254E-04  0.168E-02    1.51       1.2  T
   5    -51.3083833 -0.255078E-05  0.104E-02    1.51       2.0  T
   6    -51.3083847 -0.143840E-05  0.364E-03    1.51       5.6  T
   7    -51.3083848 -0.935500E-07  0.175E-03    1.51      11.7  T
   8    -51.3083848 -0.110082E-07  0.921E-04    1.51      22.2  T
     SCC iter.                  ...        0 min,  0.011 sec
     gradient                   ...        0 min,  0.016 sec
 * total energy  :   -50.7245679 Eh     change       -0.5558827E-03 Eh
   gradient norm :     0.0148204 Eh/α   predicted    -0.4728561E-03 ( -14.94%)
   displ. norm   :     0.3494265 α      lambda       -0.8191405E-03
   maximum displ.:     0.2972183 α      in ANC's #3, #8, #5, ...

........................................................................
.............................. CYCLE    8 ..............................
........................................................................
   1    -51.3114268 -0.513114E+02  0.209E-01    1.50       0.0  T
   2    -51.3114366 -0.974226E-05  0.125E-01    1.50       1.0  T
   3    -51.3114030  0.335933E-04  0.411E-02    1.50       1.0  T
   4    -51.3114398 -0.368431E-04  0.144E-02    1.50       1.4  T
   5    -51.3114429 -0.309105E-05  0.752E-03    1.50       2.7  T
   6    -51.3114435 -0.565465E-06  0.333E-03    1.50       6.1  T
   7    -51.3114436 -0.114129E-06  0.136E-03    1.50      15.1  T
   8    -51.3114436 -0.748699E-08  0.746E-04    1.50      27.3  T
     SCC iter.                  ...        0 min,  0.011 sec
     gradient                   ...        0 min,  0.016 sec
 * total energy  :   -50.7250722 Eh     change       -0.5042813E-03 Eh
   gradient norm :     0.0084157 Eh/α   predicted    -0.4595798E-03 (  -8.86%)
   displ. norm   :     0.2910695 α      lambda       -0.4050349E-03
   maximum displ.:     0.2484988 α      in ANC's #3, #11, #8, ...

........................................................................
.............................. CYCLE    9 ..............................
........................................................................
   1    -51.3126110 -0.513126E+02  0.180E-01    1.49       0.0  T
   2    -51.3126188 -0.780580E-05  0.107E-01    1.49       1.0  T
   3    -51.3125888  0.299777E-04  0.384E-02    1.49       1.0  T
   4    -51.3126231 -0.343470E-04  0.948E-03    1.49       2.2  T
   5    -51.3126242 -0.103745E-05  0.627E-03    1.49       3.3  T
   6    -51.3126247 -0.507415E-06  0.294E-03    1.49       6.9  T
   7    -51.3126248 -0.576727E-07  0.112E-03    1.49      18.3  T
     SCC iter.                  ...        0 min,  0.009 sec
     gradient                   ...        0 min,  0.016 sec
 * total energy  :   -50.7253479 Eh     change       -0.2756859E-03 Eh
   gradient norm :     0.0066858 Eh/α   predicted    -0.2196759E-03 ( -20.32%)
   displ. norm   :     0.3028377 α      lambda       -0.2712362E-03
   maximum displ.:     0.2554139 α      in ANC's #3, #11, #7, ...

........................................................................
.............................. CYCLE   10 ..............................
........................................................................
   1    -51.3128524 -0.513129E+02  0.183E-01    1.48       0.0  T
   2    -51.3128590 -0.663631E-05  0.109E-01    1.49       1.0  T
   3    -51.3128524  0.659907E-05  0.236E-02    1.49       1.0  T
   4    -51.3128624 -0.998131E-05  0.919E-03    1.49       2.2  T
   5    -51.3128625 -0.141657E-06  0.675E-03    1.49       3.0  T
   6    -51.3128634 -0.828595E-06  0.213E-03    1.49       9.6  T
   7    -51.3128634 -0.552533E-07  0.894E-04    1.49      22.8  T
     SCC iter.                  ...        0 min,  0.009 sec
     gradient                   ...        0 min,  0.016 sec
 * total energy  :   -50.7255215 Eh     change       -0.1736492E-03 Eh
   gradient norm :     0.0058763 Eh/α   predicted    -0.1480564E-03 ( -14.74%)
   displ. norm   :     0.2272660 α      lambda       -0.1943312E-03
   maximum displ.:     0.1936744 α      in ANC's #3, #11, #6, ...

........................................................................
.............................. CYCLE   11 ..............................
........................................................................
   1    -51.3152253 -0.513152E+02  0.143E-01    1.48       0.0  T
   2    -51.3152353 -0.100861E-04  0.844E-02    1.49       1.0  T
   3    -51.3152186  0.167912E-04  0.314E-02    1.49       1.0  T
   4    -51.3152378 -0.192757E-04  0.106E-02    1.49       1.9  T
   5    -51.3152392 -0.135828E-05  0.628E-03    1.49       3.2  T
   6    -51.3152397 -0.483540E-06  0.322E-03    1.49       6.3  T
   7    -51.3152398 -0.153684E-06  0.965E-04    1.49      21.2  T
   8    -51.3152398 -0.308878E-08  0.552E-04    1.49      37.0  T
     SCC iter.                  ...        0 min,  0.010 sec
     gradient                   ...        0 min,  0.016 sec
 * total energy  :   -50.7255942 Eh     change       -0.7265294E-04 Eh
   gradient norm :     0.0060805 Eh/α   predicted    -0.1021860E-03 (  40.65%)
   displ. norm   :     0.2745720 α      lambda       -0.1903114E-03
   maximum displ.:     0.2385440 α      in ANC's #3, #11, #8, ...

........................................................................
.............................. CYCLE   12 ..............................
........................................................................
   1    -51.3120467 -0.513120E+02  0.157E-01    1.49       0.0  T
   2    -51.3120525 -0.586470E-05  0.921E-02    1.49       1.0  T
   3    -51.3120343  0.182145E-04  0.289E-02    1.49       1.0  T
   4    -51.3120546 -0.202433E-04  0.101E-02    1.49       2.0  T
   5    -51.3120556 -0.107754E-05  0.611E-03    1.49       3.3  T
   6    -51.3120562 -0.544722E-06  0.228E-03    1.49       8.9  T
   7    -51.3120563 -0.668433E-07  0.835E-04    1.49      24.4  T
     SCC iter.                  ...        0 min,  0.009 sec
     gradient                   ...        0 min,  0.016 sec
 * total energy  :   -50.7256261 Eh     change       -0.3197442E-04 Eh
   gradient norm :     0.0080785 Eh/α   predicted    -0.1023331E-03 ( 220.05%)
   displ. norm   :     0.0987596 α      lambda       -0.1808473E-03
   maximum displ.:     0.0568000 α      in ANC's #3, #1, #5, ...

........................................................................
.............................. CYCLE   13 ..............................
........................................................................
   1    -51.3162959 -0.513163E+02  0.649E-02    1.51       0.0  T
   2    -51.3163011 -0.517876E-05  0.408E-02    1.50       1.0  T
   3    -51.3162868  0.142448E-04  0.362E-02    1.50       1.0  T
   4    -51.3163085 -0.216356E-04  0.112E-02    1.50       1.8  T
   5    -51.3163105 -0.205250E-05  0.350E-03    1.50       5.8  T
   6    -51.3163107 -0.178628E-06  0.152E-03    1.50      13.4  T
   7    -51.3163107 -0.138303E-07  0.717E-04    1.50      28.5  T
     SCC iter.                  ...        0 min,  0.009 sec
     gradient                   ...        0 min,  0.016 sec
 * total energy  :   -50.7256572 Eh     change       -0.3109958E-04 Eh
   gradient norm :     0.0112463 Eh/α   predicted    -0.9130959E-04 ( 193.60%)
   displ. norm   :     0.0948548 α      lambda       -0.2181313E-03
   maximum displ.:     0.0429925 α      in ANC's #4, #3, #2, ...

........................................................................
.............................. CYCLE   14 ..............................
........................................................................
   1    -51.3124251 -0.513124E+02  0.953E-02    1.46       0.0  T
   2    -51.3124459 -0.207978E-04  0.643E-02    1.48       1.0  T
   3    -51.3124528 -0.692204E-05  0.488E-02    1.48       1.0  T
   4    -51.3124829 -0.300795E-04  0.215E-02    1.48       1.0  T
   5    -51.3124895 -0.664317E-05  0.698E-03    1.48       2.9  T
   6    -51.3124901 -0.570904E-06  0.306E-03    1.48       6.7  T
   7    -51.3124902 -0.794055E-07  0.126E-03    1.48      16.2  T
   8    -51.3124902 -0.671520E-08  0.578E-04    1.48      35.3  T
     SCC iter.                  ...        0 min,  0.011 sec
     gradient                   ...        0 min,  0.016 sec
 * total energy  :   -50.7256215 Eh     change        0.3570011E-04 Eh
   gradient norm :     0.0137570 Eh/α   predicted    -0.1100483E-03 (-408.26%)
   displ. norm   :     0.0745889 α      lambda       -0.2486063E-03
   maximum displ.:     0.0437274 α      in ANC's #2, #6, #8, ...

........................................................................
.............................. CYCLE   15 ..............................
........................................................................
   1    -51.3145268 -0.513145E+02  0.660E-02    1.50       0.0  T
   2    -51.3145342 -0.739020E-05  0.414E-02    1.49       1.0  T
   3    -51.3145208  0.134135E-04  0.351E-02    1.49       1.0  T
   4    -51.3145419 -0.210855E-04  0.125E-02    1.49       1.6  T
   5    -51.3145444 -0.250788E-05  0.409E-03    1.49       5.0  T
   6    -51.3145446 -0.184931E-06  0.185E-03    1.49      11.0  T
   7    -51.3145446 -0.311096E-07  0.723E-04    1.49      28.2  T
     SCC iter.                  ...        0 min,  0.010 sec
     gradient                   ...        0 min,  0.016 sec
 * total energy  :   -50.7257366 Eh     change       -0.1150889E-03 Eh
   gradient norm :     0.0026845 Eh/α   predicted    -0.1250007E-03 (   8.61%)
   displ. norm   :     0.1266095 α      lambda       -0.5347556E-04
   maximum displ.:     0.1028906 α      in ANC's #3, #1, #8, ...

........................................................................
.............................. CYCLE   16 ..............................
........................................................................
   1    -51.3139594 -0.513140E+02  0.745E-02    1.49       0.0  T
   2    -51.3139615 -0.212998E-05  0.438E-02    1.49       1.0  T
   3    -51.3139542  0.726498E-05  0.199E-02    1.49       1.0  T
   4    -51.3139620 -0.773661E-05  0.676E-03    1.49       3.0  T
   5    -51.3139626 -0.654548E-06  0.292E-03    1.49       7.0  T
   6    -51.3139627 -0.758812E-07  0.130E-03    1.49      15.7  T
   7    -51.3139627 -0.307396E-07  0.376E-04    1.49      54.3  T
   8    -51.3139627 -0.729180E-09  0.212E-04    1.49      96.4  T
     SCC iter.                  ...        0 min,  0.011 sec
     gradient                   ...        0 min,  0.017 sec
 * total energy  :   -50.7257569 Eh     change       -0.2025940E-04 Eh
   gradient norm :     0.0036770 Eh/α   predicted    -0.2717048E-04 (  34.11%)
   displ. norm   :     0.0494663 α      lambda       -0.2830477E-04
   maximum displ.:     0.0400195 α      in ANC's #1, #3, #4, ...

........................................................................
.............................. CYCLE   17 ..............................
........................................................................
   1    -51.3142671 -0.513143E+02  0.263E-02    1.49       0.0  T
   2    -51.3142674 -0.256249E-06  0.156E-02    1.49       1.3  T
   3    -51.3142650  0.242154E-05  0.110E-02    1.49       1.9  T
   4    -51.3142676 -0.263341E-05  0.264E-03    1.49       7.7  T
   5    -51.3142677 -0.743978E-07  0.128E-03    1.49      16.0  T
   6    -51.3142677 -0.171718E-07  0.471E-04    1.49      43.3  T
   7    -51.3142677 -0.357961E-08  0.156E-04    1.49     131.1  T
     SCC iter.                  ...        0 min,  0.009 sec
     gradient                   ...        0 min,  0.017 sec
 * total energy  :   -50.7257787 Eh     change       -0.2179031E-04 Eh
   gradient norm :     0.0030255 Eh/α   predicted    -0.1418868E-04 ( -34.89%)
   displ. norm   :     0.1361476 α      lambda       -0.5677115E-04
   maximum displ.:     0.1003266 α      in ANC's #1, #3, #4, ...

........................................................................
.............................. CYCLE   18 ..............................
........................................................................
   1    -51.3143449 -0.513143E+02  0.809E-02    1.48       0.0  T
   2    -51.3143473 -0.234173E-05  0.463E-02    1.49       1.0  T
   3    -51.3143416  0.567149E-05  0.180E-02    1.48       1.1  T
   4    -51.3143477 -0.612594E-05  0.771E-03    1.49       2.6  T
   5    -51.3143482 -0.455728E-06  0.454E-03    1.48       4.5  T
   6    -51.3143485 -0.358274E-06  0.114E-03    1.49      17.9  T
   7    -51.3143486 -0.203074E-07  0.346E-04    1.48      59.0  T
   8    -51.3143486 -0.443592E-09  0.186E-04    1.48     109.9  T
     SCC iter.                  ...        0 min,  0.010 sec
     gradient                   ...        0 min,  0.017 sec
 * total energy  :   -50.7257996 Eh     change       -0.2096417E-04 Eh
   gradient norm :     0.0033377 Eh/α   predicted    -0.2891322E-04 (  37.92%)
   displ. norm   :     0.1257903 α      lambda       -0.4494895E-04
   maximum displ.:     0.0890875 α      in ANC's #1, #3, #2, ...

........................................................................
.............................. CYCLE   19 ..............................
........................................................................
   1    -51.3142959 -0.513143E+02  0.635E-02    1.48       0.0  T
   2    -51.3142968 -0.922940E-06  0.369E-02    1.49       1.0  T
   3    -51.3142909  0.590214E-05  0.166E-02    1.48       1.2  T
   4    -51.3142974 -0.644724E-05  0.482E-03    1.49       4.2  T
   5    -51.3142975 -0.144314E-06  0.185E-03    1.49      11.0  T
   6    -51.3142976 -0.360635E-07  0.740E-04    1.49      27.6  T
   7    -51.3142976 -0.801232E-08  0.276E-04    1.49      73.9  T
     SCC iter.                  ...        0 min,  0.010 sec
     gradient                   ...        0 min,  0.017 sec
 * total energy  :   -50.7258254 Eh     change       -0.2578828E-04 Eh
   gradient norm :     0.0033211 Eh/α   predicted    -0.2283477E-04 ( -11.45%)
   displ. norm   :     0.0452147 α      lambda       -0.1616528E-04
   maximum displ.:     0.0396883 α      in ANC's #1, #3, #2, ...

........................................................................
.............................. CYCLE   20 ..............................
........................................................................
   1    -51.3147052 -0.513147E+02  0.230E-02    1.49       0.0  T
   2    -51.3147054 -0.201557E-06  0.131E-02    1.49       1.6  T
   3    -51.3147039  0.142329E-05  0.858E-03    1.49       2.4  T
   4    -51.3147055 -0.155259E-05  0.244E-03    1.49       8.4  T
   5    -51.3147056 -0.675518E-07  0.118E-03    1.49      17.3  T
   6    -51.3147056 -0.129127E-07  0.401E-04    1.49      51.0  T
   7    -51.3147056 -0.289713E-08  0.125E-04    1.49     162.9  T
     SCC iter.                  ...        0 min,  0.009 sec
     gradient                   ...        0 min,  0.017 sec
 * total energy  :   -50.7258380 Eh     change       -0.1257349E-04 Eh
   gradient norm :     0.0027929 Eh/α   predicted    -0.8100658E-05 ( -35.57%)
   displ. norm   :     0.1080386 α      lambda       -0.2583673E-04
   maximum displ.:     0.0916731 α      in ANC's #1, #3, #5, ...
 * RMSD in coord.:     0.6628884 α      energy gain  -0.2008918E-01 Eh

generating ANC from model Hessian ...
Using Lindh-Hessian (1995)
 Shifting diagonal of input Hessian by   4.243940523910287E-003
 Lowest  eigenvalues of input Hessian
   -0.000000   -0.000000   -0.000000    0.000000    0.000000    0.000000
    0.005000    0.007517    0.007604    0.008016    0.009149    0.013027
    0.013387    0.015953    0.022325    0.023748    0.024478    0.026760
 Highest eigenvalues
    1.765417    1.870085    1.955225    1.996112    2.088481    2.235329
 

........................................................................
.............................. CYCLE   21 ..............................
........................................................................
   1    -51.3145925 -0.513146E+02  0.514E-02    1.49       0.0  T
   2    -51.3145931 -0.635182E-06  0.290E-02    1.49       1.0  T
   3    -51.3145925  0.575924E-06  0.758E-03    1.49       2.7  T
   4    -51.3145931 -0.610294E-06  0.446E-03    1.49       4.6  T
   5    -51.3145933 -0.181085E-06  0.201E-03    1.49      10.1  T
   6    -51.3145934 -0.796368E-07  0.446E-04    1.49      45.8  T
   7    -51.3145934 -0.299065E-08  0.227E-04    1.49      89.7  T
     SCC iter.                  ...        0 min,  0.009 sec
     gradient                   ...        0 min,  0.017 sec
 * total energy  :   -50.7258558 Eh     change       -0.1775086E-04 Eh
   gradient norm :     0.0020539 Eh/α   predicted     0.0000000E+00 (-100.00%)
   displ. norm   :     0.0343794 α      lambda       -0.1463964E-04
   maximum displ.:     0.0223743 α      in ANC's #1, #2, #4, ...

........................................................................
.............................. CYCLE   22 ..............................
........................................................................
   1    -51.3144447 -0.513144E+02  0.199E-02    1.49       0.0  T
   2    -51.3144448 -0.103899E-06  0.115E-02    1.49       1.8  T
   3    -51.3144447  0.138098E-06  0.292E-03    1.49       7.0  T
   4    -51.3144448 -0.150432E-06  0.145E-03    1.49      14.0  T
   5    -51.3144448 -0.260550E-07  0.794E-04    1.49      25.7  T
   6    -51.3144449 -0.103145E-07  0.212E-04    1.49      96.1  T
     SCC iter.                  ...        0 min,  0.009 sec
     gradient                   ...        0 min,  0.017 sec
 * total energy  :   -50.7258667 Eh     change       -0.1089914E-04 Eh
   gradient norm :     0.0007998 Eh/α   predicted    -0.7328983E-05 ( -32.76%)
   displ. norm   :     0.0424945 α      lambda       -0.6734757E-05
   maximum displ.:     0.0256030 α      in ANC's #1, #2, #4, ...

........................................................................
.............................. CYCLE   23 ..............................
........................................................................
   1    -51.3144274 -0.513144E+02  0.285E-02    1.49       0.0  T
   2    -51.3144276 -0.237437E-06  0.160E-02    1.49       1.3  T
   3    -51.3144276 -0.132388E-07  0.312E-03    1.49       6.6  T
   4    -51.3144276 -0.713836E-08  0.208E-03    1.49       9.8  T
   5    -51.3144277 -0.456997E-07  0.113E-03    1.49      18.1  T
   6    -51.3144277 -0.290591E-07  0.260E-04    1.49      78.5  T
   7    -51.3144277 -0.943359E-09  0.116E-04    1.49     175.8  T
     SCC iter.                  ...        0 min,  0.010 sec
     gradient                   ...        0 min,  0.017 sec
 * total energy  :   -50.7258733 Eh     change       -0.6679421E-05 Eh
   gradient norm :     0.0006909 Eh/α   predicted    -0.3371593E-05 ( -49.52%)
   displ. norm   :     0.0389851 α      lambda       -0.3820426E-05
   maximum displ.:     0.0272910 α      in ANC's #1, #2, #3, ...

........................................................................
.............................. CYCLE   24 ..............................
........................................................................
   1    -51.3145118 -0.513145E+02  0.233E-02    1.49       0.0  T
   2    -51.3145119 -0.121958E-06  0.136E-02    1.49       1.5  T
   3    -51.3145118  0.159830E-06  0.335E-03    1.49       6.1  T
   4    -51.3145120 -0.188274E-06  0.177E-03    1.49      11.5  T
   5    -51.3145120 -0.380973E-07  0.674E-04    1.49      30.3  T
   6    -51.3145120 -0.924723E-08  0.159E-04    1.49     128.4  T
     SCC iter.                  ...        0 min,  0.008 sec
     gradient                   ...        0 min,  0.017 sec
 * total energy  :   -50.7258768 Eh     change       -0.3496521E-05 Eh
   gradient norm :     0.0006897 Eh/α   predicted    -0.1912154E-05 ( -45.31%)
   displ. norm   :     0.0357988 α      lambda       -0.3117874E-05
   maximum displ.:     0.0266464 α      in ANC's #1, #2, #5, ...

   *** GEOMETRY OPTIMIZATION CONVERGED AFTER 24 ITERATIONS ***

------------------------------------------------------------------------
 total energy gain   :        -0.0201280 Eh      -12.6305 kcal/mol
 total RMSD          :         0.6610891 a0        0.3498 Å
 total power (kW/mol):        -2.2019194 (step)  -55.0433 (real)
------------------------------------------------------------------------

 ANCopt (total)                0 d,  0 h,  0 min,  0.960 sec
 optimizer setup                ...        0 min,  0.000 sec (  0.017%)
 model hessian                  ...        0 min,  0.006 sec (  0.648%)
 ANC generation                 ...        0 min,  0.001 sec (  0.141%)
 coordinate transformation      ...        0 min,  0.000 sec (  0.049%)
 single point calculation       ...        0 min,  0.941 sec ( 98.062%)
 optimization log               ...        0 min,  0.002 sec (  0.249%)
 hessian update                 ...        0 min,  0.000 sec (  0.034%)
 rational function              ...        0 min,  0.006 sec (  0.643%)

================
 final structure:
================
$coord
   -3.31933213252703    1.63895678513247    0.11935265864857      C 
   -5.11808467675404   -1.03619113426231    0.18158741958240      S 
   -2.52053812138647   -2.99767532002187    0.02593528770925      C 
   -0.30061151444297   -1.56702646848230   -0.06902735562492      C 
   -0.78252427424020    1.11373077549006   -0.01943324239844      C 
    1.30473880739023    2.84586584366204   -0.12900127580841      C 
    0.79736261956349    5.53860597608741   -0.10885226613922      C 
   -1.25219724043800    6.53542529702160    0.09023419115773      O 
    3.12587179160025    7.32378188238784   -0.39300069997512      C 
    4.43112564337372    6.89299191936604   -2.53303608857255      F 
    2.40957713497099    9.73254131844006   -0.44928372558106      F 
    4.77788243189332    7.08944887408469    1.52616710379588      F 
    3.72156393537002    1.85542314508683   -0.25561848710345      C 
    4.15687749453192   -0.75472224111176   -0.28223047297964      C 
    2.20064564632323   -2.44932683922428   -0.19765782711967      C 
   -2.74770856188503   -5.69540319018598   -0.00026299606948      C 
   -4.92604422479796   -6.95865918889683    0.05691643280941      C 
   -4.21556999441029    3.45076389086615    0.18731369572200      H 
    5.35028782080864    3.07507298902043   -0.32886309317170      H 
    6.08051094843858   -1.42418690601621   -0.37558710327238      H 
    2.57311298750656   -4.45425204204150   -0.22726309053036      H 
   -0.98187920321461   -6.72095263922137   -0.07840411607172      H 
   -6.71627791232192   -5.99213895336102    0.12567514129009      H 
   -4.97762568981422   -8.98930899704209    0.02761155179884      H 
$end
           -------------------------------------------------
          |                Final Singlepoint                |
           -------------------------------------------------

          ...................................................
          :                      SETUP                      :
          :.................................................:
          :  # basis functions                  81          :
          :  # atomic orbitals                  80          :
          :  # shells                           42          :
          :  # electrons                        88          :
          :  max. iterations                   250          :
          :  Hamiltonian                  GFN2-xTB          :
          :  restarted?                      false          :
          :  GBSA solvation                  false          :
          :  PC potential                    false          :
          :  electronic temp.          300.0000000     K    :
          :  accuracy                    1.0000000          :
          :  -> integral cutoff          0.2500000E+02      :
          :  -> integral neglect         0.1000000E-07      :
          :  -> SCF convergence          0.1000000E-05 Eh   :
          :  -> wf. convergence          0.1000000E-03 e    :
          :  Broyden damping             0.4000000          :
          ...................................................

 iter      E             dE          RMSdq      gap      omega  full diag
   1    -51.3145120 -0.513145E+02  0.796E-05    1.49       0.0  T
   2    -51.3145120 -0.106581E-10  0.413E-05    1.49     494.1  T
   3    -51.3145120 -0.342055E-10  0.348E-05    1.49     585.8  T

   *** convergence criteria satisfied after 3 iterations ***

         #    Occupation            Energy/Eh            Energy/eV
      -------------------------------------------------------------
         1        2.0000           -0.8827482             -24.0208
       ...           ...                  ...                  ...
        38        2.0000           -0.4651489             -12.6573
        39        2.0000           -0.4644224             -12.6376
        40        2.0000           -0.4557245             -12.4009
        41        2.0000           -0.4441543             -12.0861
        42        2.0000           -0.4255927             -11.5810
        43        2.0000           -0.4252953             -11.5729
        44        2.0000           -0.3873582             -10.5406 (HOMO)
        45                         -0.3327358              -9.0542 (LUMO)
        46                         -0.2894841              -7.8773
        47                         -0.2384564              -6.4887
        48                         -0.2247149              -6.1148
        49                         -0.2185005              -5.9457
       ...                                ...                  ...
        80                          0.7093509              19.3024
      -------------------------------------------------------------
                  HL-Gap            0.0546224 Eh            1.4864 eV
             Fermi-level           -0.3600470 Eh           -9.7974 eV

 SCC (total)                   0 d,  0 h,  0 min,  0.035 sec
 SCC setup                      ...        0 min,  0.000 sec (  0.582%)
 Dispersion                     ...        0 min,  0.000 sec (  0.634%)
 integral evaluation            ...        0 min,  0.013 sec ( 35.823%)
 zeroth order Hamiltonian       ...        0 min,  0.000 sec (  0.540%)
 iterations                     ...        0 min,  0.005 sec ( 13.295%)
 molecular gradient             ...        0 min,  0.017 sec ( 47.915%)
 printout                       ...        0 min,  0.000 sec (  1.069%)

         :::::::::::::::::::::::::::::::::::::::::::::::::::::
         ::                     SUMMARY                     ::
         :::::::::::::::::::::::::::::::::::::::::::::::::::::
         :: total energy             -50.725876833344 Eh    ::
         :: gradient norm              0.000689955698 Eh/a0 ::
         :: HOMO-LUMO gap              1.486351490793 eV    ::
         ::.................................................::
         :: SCC energy               -51.314512012637 Eh    ::
         :: -> isotropic ES            0.064061585151 Eh    ::
         :: -> anisotropic ES          0.000055255800 Eh    ::
         :: -> anisotropic XC         -0.004298086699 Eh    ::
         :: -> dispersion             -0.027396722631 Eh    ::
         :: repulsion energy           0.588639962485 Eh    ::
         :: add. restraining           0.000000000000 Eh    ::
         :::::::::::::::::::::::::::::::::::::::::::::::::::::

           -------------------------------------------------
          |                Property Printout                |
           -------------------------------------------------

    * Orbital Energies and Occupations

         #    Occupation            Energy/Eh            Energy/eV
      -------------------------------------------------------------
         1        2.0000           -0.8827482             -24.0208
       ...           ...                  ...                  ...
        32        2.0000           -0.5110510             -13.9064
        33        2.0000           -0.4977350             -13.5441
        34        2.0000           -0.4934295             -13.4269
        35        2.0000           -0.4884149             -13.2904
        36        2.0000           -0.4775750             -12.9955
        37        2.0000           -0.4725876             -12.8598
        38        2.0000           -0.4651489             -12.6573
        39        2.0000           -0.4644224             -12.6376
        40        2.0000           -0.4557245             -12.4009
        41        2.0000           -0.4441543             -12.0861
        42        2.0000           -0.4255927             -11.5810
        43        2.0000           -0.4252953             -11.5729
        44        2.0000           -0.3873582             -10.5406 (HOMO)
        45                         -0.3327358              -9.0542 (LUMO)
        46                         -0.2894841              -7.8773
        47                         -0.2384564              -6.4887
        48                         -0.2247149              -6.1148
        49                         -0.2185005              -5.9457
        50                         -0.1826465              -4.9701
        51                         -0.1401838              -3.8146
        52                         -0.1113141              -3.0290
        53                         -0.0231383              -0.6296
        54                         -0.0072753              -0.1980
        55                          0.0098091               0.2669
       ...                                ...                  ...
        80                          0.7093509              19.3024
      -------------------------------------------------------------
                  HL-Gap            0.0546224 Eh            1.4864 eV
             Fermi-level           -0.3600470 Eh           -9.7974 eV

     #   Z        covCN         q      C6AA      α(0)
     1   6 C      2.927    -0.035    28.861     8.810
     2  16 S      2.329     0.056   138.779    19.827
     3   6 C      2.977     0.014    27.700     8.633
     4   6 C      3.172    -0.003    27.705     8.598
     5   6 C      3.167     0.009    27.461     8.563
     6   6 C      2.959    -0.018    28.463     8.751
     7   6 C      2.817     0.200    23.755     7.986
     8   8 O      0.857    -0.326    20.260     6.035
     9   6 C      3.325     0.464    17.735     6.693
    10   9 F      0.790    -0.206    11.298     3.971
    11   9 F      0.791    -0.182    11.049     3.926
    12   9 F      0.790    -0.205    11.292     3.969
    13   6 C      2.917    -0.015    28.379     8.736
    14   6 C      2.914    -0.028    28.704     8.785
    15   6 C      2.910    -0.013    28.333     8.728
    16   6 C      2.920    -0.030    28.747     8.792
    17   6 C      2.841    -0.084    30.104     8.992
    18   1 H      0.927     0.085     1.930     2.172
    19   1 H      0.926     0.063     2.168     2.303
    20   1 H      0.926     0.051     2.301     2.372
    21   1 H      0.926     0.049     2.327     2.386
    22   1 H      0.925     0.048     2.339     2.392
    23   1 H      0.926     0.054     2.270     2.356
    24   1 H      0.926     0.052     2.294     2.368

 Mol. C6AA /au·bohr⁶  :       9751.550722
 Mol. C8AA /au·bohr⁸  :     264439.345138
 Mol. α(0) /au        :        156.144608


Wiberg/Mayer (AO) data.
largest (>0.10) Wiberg bond orders for each atom
          total WBO             WBO to atom ...
     1  C   3.946        C    5 1.490    S    2 1.236    H   18 0.960    C    3 0.115
     2  S   2.747        C    1 1.236    C    3 1.202
     3  C   3.952        C    4 1.342    S    2 1.202    C   16 1.161    C    1 0.115
     4  C   3.988        C    3 1.342    C   15 1.281    C    5 1.157
     5  C   3.988        C    1 1.490    C    6 1.160    C    4 1.157
     6  C   3.978        C   13 1.454    C    5 1.160    C    7 1.113
     7  C   3.940        O    8 1.795    C    6 1.113    C    9 0.872
     8  O   2.095        C    7 1.795
     9  C   3.815        F   11 0.974    F   12 0.944    F   10 0.944    C    7 0.872
    10  F   1.072        C    9 0.944
    11  F   1.099        C    9 0.974
    12  F   1.073        C    9 0.944
    13  C   3.987        C    6 1.454    C   14 1.342    H   19 0.965
    14  C   3.975        C   15 1.524    C   13 1.342    H   20 0.969
    15  C   3.989        C   14 1.524    C    4 1.281    H   21 0.964
    16  C   3.991        C   17 1.837    C    3 1.161    H   22 0.955
    17  C   3.957        C   16 1.837    H   24 0.978    H   23 0.972
    18  H   0.992        C    1 0.960
    19  H   0.995        C   13 0.965
    20  H   0.996        C   14 0.969
    21  H   0.997        C   15 0.964
    22  H   0.997        C   16 0.955
    23  H   0.997        C   17 0.972
    24  H   0.997        C   17 0.978

molecular dipole:
                 x           y           z       tot (Debye)
 q only:       -0.508      -2.615       0.044
   full:       -0.112      -2.548       0.022       6.483
molecular quadrupole (traceless):
                xx          xy          yy          xz          yz          zz
 q only:        9.913      -3.808     -14.529       0.194       0.871       4.617
  q+dip:       10.874      -3.429     -11.985      -0.041       0.819       1.110
   full:        8.113      -3.697     -13.921       0.390       0.832       5.807

           -------------------------------------------------
          |                Geometry Summary                 |
           -------------------------------------------------

      molecular mass/u    :      256.2419000
   center of mass at/Å    :        0.0872225       1.0313127      -0.0745979
  moments of inertia/u·Å² :        0.4704707E+03   0.2172695E+04   0.2553795E+04
rotational constants/cm⁻¹ :        0.3583142E-01   0.7758859E-02   0.6601011E-02

 * 23 selected distances

     #   Z        #   Z                                     value/Å
     1   6 C      2  16 S                                 1.7062008
     2  16 S      3   6 C                                 1.7244113 (max)
     3   6 C      4   6 C                                 1.3984552
     1   6 C      5   6 C                                 1.3728574
     4   6 C      5   6 C                                 1.4415743
     5   6 C      6   6 C                                 1.4364959
     7   6 C      8   8 O                                 1.2106461
     9   6 C     10   9 F                                 1.3459235
     9   6 C     11   9 F                                 1.3301592
     9   6 C     12   9 F                                 1.3457401
     6   6 C     13   6 C                                 1.3837811
    13   6 C     14   6 C                                 1.4003779
     4   6 C     15   6 C                                 1.4051910
    14   6 C     15   6 C                                 1.3703219
     3   6 C     16   6 C                                 1.4326958
    16   6 C     17   6 C                                 1.3328789
     1   6 C     18   1 H                                 1.0702610 (min)
    13   6 C     19   1 H                                 1.0774512
    14   6 C     20   1 H                                 1.0789591
    15   6 C     21   1 H                                 1.0792276
    16   6 C     22   1 H                                 1.0813891
    17   6 C     23   1 H                                 1.0772138
    17   6 C     24   1 H                                 1.0750322

 * 5 distinct bonds (by element types)

   Z      Z             #   av. dist./Å        max./Å        min./Å
   1 H    6 C           7     1.0770763     1.0813891     1.0702610
   6 C    6 C          10     1.3974629     1.4415743     1.3328789
   6 C    8 O           1     1.2106461     1.2106461     1.2106461
   6 C    9 F           3     1.3406076     1.3459235     1.3301592
   6 C   16 S           2     1.7153060     1.7244113     1.7062008


optimized geometry written to: xtbopt.xyz


           -------------------------------------------------
          | TOTAL ENERGY              -50.725876833344 Eh   |
          | GRADIENT NORM               0.000689955698 Eh/α |
          | HOMO-LUMO GAP               1.486351490793 eV   |
           -------------------------------------------------

------------------------------------------------------------------------
 * finished run on 2021/05/19 at 10:59:06.563     
------------------------------------------------------------------------
 total:
 * wall-time:     0 d,  0 h,  0 min,  1.071 sec
 *  cpu-time:     0 d,  0 h,  0 min,  1.071 sec
 * ratio c/w:     0.999 speedup
 SCF:
 * wall-time:     0 d,  0 h,  0 min,  0.050 sec
 *  cpu-time:     0 d,  0 h,  0 min,  0.050 sec
 * ratio c/w:     1.000 speedup
 ANC optimizer:
 * wall-time:     0 d,  0 h,  0 min,  0.996 sec
 *  cpu-time:     0 d,  0 h,  0 min,  0.995 sec
 * ratio c/w:     1.000 speedup

