      -----------------------------------------------------------      
     |                   =====================                   |     
     |                           x T B                           |     
     |                   =====================                   |     
     |                         S. Grimme                         |     
     |          Mulliken Center for Theoretical Chemistry        |     
     |                    University of Bonn                     |     
     |                Version 6.2 RC2 (SAW190805)                |     
      -----------------------------------------------------------      

   This program is distributed in the hope that it will be useful,
   but WITHOUT ANY WARRANTY; without even the implied warranty of
   MERCHANTABILITY or FITNESS FOR A PARTICULAR PURPOSE.
   
   FOR NON-COMMERCIAL, ACADEMIA USE ONLY.
   
   Cite this work as:
   * S. Grimme, C. Bannwarth, P. Shushkov, J. Chem. Theory Comput., 2017,
     13, 1989-2009. DOI: 10.1021/acs.jctc.7b00118
   * C. Bannwarth, S. Ehlert and S. Grimme., J. Chem. Theory Comput., 2019,
     15, 1652-1671. DOI: 10.1021/acs.jctc.8b01176
   * P. Pracht, E. Caldeweyher, S. Ehlert, S. Grimme, ChemRxiv, 2019, preprint.
     DOI: 10.26434/chemrxiv.8326202.v1
   
   for DFT-D4:
   * E. Caldeweyher, C. Bannwarth and S. Grimme, J. Chem. Phys., 2017,
     147, 034112. DOI: 10.1063/1.4993215
   * E. Caldeweyher, S. Ehlert, A. Hansen, H. Neugebauer, S. Spicher,
     C. Bannwarth and S. Grimme, J. Chem. Phys., 2019, 150, 154122.
     DOI: 10.1063/1.5090222
   
   for sTDA-xTB:
   * S. Grimme and C. Bannwarth, J. Chem. Phys., 2016, 145, 054103.
     DOI: 10.1063/1.4959605
   
   in the mass-spec context:
   * V. Asgeirsson, C. Bauer and S. Grimme, Chem. Sci., 2017, 8, 4879.
     DOI: 10.1039/c7sc00601b
   
   for metadynamics refer to:
   * S. Grimme, J. Chem. Theory Comput., 2019, 155, 2847-2862
     DOI: 10.1021/acs.jctc.9b00143
   
   with help from (in alphabetical order)
   C. Bannwarth, F. Bohle, G. Brandenburg, E. Caldeweyher, M. Checinski,
   S. Dohm, S. Ehlert, S. Ehrlich, F. März, H. Neugebauer, J. Pisarek,
   P. Pracht, P. Shushkov, and S. Spicher.
   
 * started run on 2021/05/19 at 10:59:08.218     

           -------------------------------------------------
          |                Calculation Setup                |
           -------------------------------------------------

          program call               : /ihome/ghutchison/geoffh/xtb/xtb 147.xyz -opt
          hostname                   : smp-n83
          coordinate file            : 147.xyz
          omp threads                :                     1
          number of atoms            :                    27
          number of electrons        :                    80
          charge                     :                     0
          spin                       :                   0.0
          first test random number   :      0.36176318104838


########################################################################
# WARNING! Please study the warnings concerning your input carefully
#  - the use of '-opt' is discouraged, please use '--opt' next time
########################################################################

           ------------------------------------------------- 
          |                 G F N 2 - x T B                 |
          | Geometry, Frequencies, Noncovalent interactions |
          |            JCTC 2019 parametrisation            |
           ------------------------------------------------- 
             KAB for C  - Si     :                1.0500
             KAB for H  - Pd     :                0.9500
             k(s)              :                1.8500
             k(p)              :                2.2300
             k(d)              :                2.2300
             k(f)              :                2.0000
             kEN (H0ij)        :               -2.0000
             D4 a1             :                0.5200
             D4 a2             :                5.0000
             D4 s6             :                1.0000
             D4 s8             :                2.7000
             D4 s9             :                5.0000
             alphaj            :                2.0000

  Z AO/shell   Hii/eV     exponent
  1     Wed Apr 25 08:07:45 CEST 2018   EN: 2.200 GM2: 0.406  GM3: 0.0800  RAES: 1.40
     1s    -10.707211    1.230000
  6     Wed Apr 25 08:07:45 CEST 2018   EN: 2.550 GM2: 0.538  GM3: 0.1500  RAES: 3.00
     2s    -13.970922    2.096432
     2p    -10.063292    1.800000
  8     Wed Apr 25 08:07:45 CEST 2018   EN: 3.440 GM2: 0.452  GM3:-0.0517  RAES: 1.80
     2s    -20.229985    2.439742
     2p    -15.503117    2.137023
 16     Tue Apr 24 11:44:34 CEST 2018   EN: 2.580 GM2: 0.340  GM3:-0.0502  RAES: 3.10
     3s    -20.029654    1.981333
     3p    -11.377694    2.025643
     3d     -0.420282    1.702555

           ------------------------------------------------- 
          |        Self-Consistent Charge Iterations        |
           ------------------------------------------------- 

          ...................................................
          :                      SETUP                      :
          :.................................................:
          :  # basis functions                  78          :
          :  # atomic orbitals                  77          :
          :  # shells                           43          :
          :  # electrons                        80          :
          :  max. iterations                   250          :
          :  Hamiltonian                  GFN2-xTB          :
          :  restarted?                      false          :
          :  GBSA solvation                  false          :
          :  PC potential                    false          :
          :  electronic temp.          300.0000000     K    :
          :  accuracy                    1.0000000          :
          :  -> integral cutoff          0.2500000E+02      :
          :  -> integral neglect         0.1000000E-07      :
          :  -> SCF convergence          0.1000000E-05 Eh   :
          :  -> wf. convergence          0.1000000E-03 e    :
          :  Broyden damping             0.4000000          :
          ...................................................

 iter      E             dE          RMSdq      gap      omega  full diag
   1    -45.5500432 -0.455500E+02  0.443E+00    3.04       0.0  T
   2    -45.6060255 -0.559823E-01  0.242E+00    3.06       1.0  T
   3    -45.6044035  0.162195E-02  0.122E+00    3.03       1.0  T
   4    -45.6138447 -0.944121E-02  0.319E-01    3.05       1.0  T
   5    -45.6150690 -0.122423E-02  0.161E-01    3.05       1.0  T
   6    -45.6154667 -0.397764E-03  0.544E-02    3.05       1.0  T
   7    -45.6154868 -0.200560E-04  0.232E-02    3.06       1.0  T
   8    -45.6154923 -0.553854E-05  0.136E-02    3.05       1.4  T
   9    -45.6154940 -0.170185E-05  0.479E-03    3.05       4.0  T
  10    -45.6154942 -0.138609E-06  0.207E-03    3.05       9.3  T
  11    -45.6154942 -0.280063E-07  0.808E-04    3.05      23.8  T
  12    -45.6154942 -0.454344E-08  0.454E-04    3.05      42.4  T

   *** convergence criteria satisfied after 12 iterations ***

         #    Occupation            Energy/Eh            Energy/eV
      -------------------------------------------------------------
         1        2.0000           -0.7517594             -20.4564
       ...           ...                  ...                  ...
        34        2.0000           -0.4548978             -12.3784
        35        2.0000           -0.4526519             -12.3173
        36        2.0000           -0.4422900             -12.0353
        37        2.0000           -0.4250490             -11.5662
        38        2.0000           -0.4195224             -11.4158
        39        2.0000           -0.4075535             -11.0901
        40        2.0000           -0.3956615             -10.7665 (HOMO)
        41                         -0.2834048              -7.7118 (LUMO)
        42                         -0.2470795              -6.7234
        43                         -0.2284179              -6.2156
        44                         -0.2170115              -5.9052
        45                         -0.1865321              -5.0758
       ...                                ...                  ...
        77                          0.6436784              17.5154
      -------------------------------------------------------------
                  HL-Gap            0.1122567 Eh            3.0547 eV
             Fermi-level           -0.3395331 Eh           -9.2392 eV

 SCC (total)                   0 d,  0 h,  0 min,  0.048 sec
 SCC setup                      ...        0 min,  0.000 sec (  0.709%)
 Dispersion                     ...        0 min,  0.000 sec (  0.858%)
 integral evaluation            ...        0 min,  0.012 sec ( 24.156%)
 zeroth order Hamiltonian       ...        0 min,  0.000 sec (  0.495%)
 iterations                     ...        0 min,  0.018 sec ( 36.319%)
 molecular gradient             ...        0 min,  0.018 sec ( 36.415%)
 printout                       ...        0 min,  0.000 sec (  0.929%)

         :::::::::::::::::::::::::::::::::::::::::::::::::::::
         ::                     SUMMARY                     ::
         :::::::::::::::::::::::::::::::::::::::::::::::::::::
         :: total energy             -45.090118316146 Eh    ::
         :: gradient norm              0.073151530589 Eh/a0 ::
         :: HOMO-LUMO gap              3.054660182575 eV    ::
         ::.................................................::
         :: SCC energy               -45.615494199781 Eh    ::
         :: -> isotropic ES            0.074006117047 Eh    ::
         :: -> anisotropic ES          0.004908950726 Eh    ::
         :: -> anisotropic XC          0.011402377302 Eh    ::
         :: -> dispersion             -0.029572504872 Eh    ::
         :: repulsion energy           0.525008986838 Eh    ::
         :: add. restraining           0.000000000000 Eh    ::
         :::::::::::::::::::::::::::::::::::::::::::::::::::::

      ----------------------------------------------------------- 
     |                   =====================                   |
     |                        A N C O P T                        |
     |                   =====================                   |
     |               Approximate Normal Coordinate               |
     |                Rational Function Optimizer                |
      ----------------------------------------------------------- 

          ...................................................
          :                      SETUP                      :
          :.................................................:
          :   optimization level            normal          :
          :   max. optcycles                   200          :
          :   ANC micro-cycles                  20          :
          :   degrees of freedom                75          :
          :.................................................:
          :   RF solver                   davidson          :
          :   input Hessian                  false          :
          :   write xtbopt.log                true          :
          :   linear?                        false          :
          :   energy convergence         0.5000000E-05 Eh   :
          :   grad. convergence          0.1000000E-02 Eh/α :
          :   maximium RF displ.         2.0000000          :
          :   Hlow (freq-cutoff)         0.5000000E-02      :
          :   Hmax (freq-cutoff)         5.0000000          :
          :   S6 in model hess.         20.0000000          :
          ...................................................

generating ANC from model Hessian ...
Using Lindh-Hessian (1995)
 Shifting diagonal of input Hessian by   4.068762810241621E-003
 Lowest  eigenvalues of input Hessian
   -0.000000   -0.000000   -0.000000   -0.000000    0.000000    0.000000
    0.005000    0.006631    0.007033    0.008265    0.008923    0.010373
    0.011458    0.012181    0.016130    0.017762    0.023809    0.025527
 Highest eigenvalues
    1.607094    1.669914    1.767173    1.818644    1.974764    2.219371
 

........................................................................
.............................. CYCLE    1 ..............................
........................................................................
   1    -45.6154942 -0.456155E+02  0.266E-04    3.05       0.0  T
   2    -45.6154942 -0.828067E-10  0.229E-04    3.05      84.1  T
   3    -45.6154942 -0.947772E-09  0.965E-05    3.05     199.3  T
     SCC iter.                  ...        0 min,  0.005 sec
     gradient                   ...        0 min,  0.017 sec
 * total energy  :   -45.0901183 Eh     change        0.1393219E-07 Eh
   gradient norm :     0.0731541 Eh/α   predicted     0.0000000E+00 (-100.00%)
   displ. norm   :     0.2626538 α      lambda       -0.8357207E-02
   maximum displ.:     0.0713953 α      in ANC's #4, #30, #13, ...

........................................................................
.............................. CYCLE    2 ..............................
........................................................................
   1    -45.6436029 -0.456436E+02  0.252E-01    3.09       0.0  T
   2    -45.6436631 -0.601596E-04  0.138E-01    3.09       1.0  T
   3    -45.6435813  0.817651E-04  0.750E-02    3.10       1.0  T
   4    -45.6436982 -0.116828E-03  0.260E-02    3.10       1.0  T
   5    -45.6437025 -0.430387E-05  0.115E-02    3.10       1.7  T
   6    -45.6437035 -0.108488E-05  0.370E-03    3.10       5.2  T
   7    -45.6437038 -0.235643E-06  0.152E-03    3.10      12.7  T
     SCC iter.                  ...        0 min,  0.009 sec
     gradient                   ...        0 min,  0.016 sec
 * total energy  :   -45.0953663 Eh     change       -0.5247972E-02 Eh
   gradient norm :     0.0224441 Eh/α   predicted    -0.4466883E-02 ( -14.88%)
   displ. norm   :     0.1955720 α      lambda       -0.1611235E-02
   maximum displ.:     0.0938252 α      in ANC's #8, #3, #2, ...

........................................................................
.............................. CYCLE    3 ..............................
........................................................................
   1    -45.6533694 -0.456534E+02  0.163E-01    3.11       0.0  T
   2    -45.6533847 -0.153581E-04  0.942E-02    3.11       1.0  T
   3    -45.6533420  0.427697E-04  0.540E-02    3.11       1.0  T
   4    -45.6534000 -0.580721E-04  0.158E-02    3.12       1.2  T
   5    -45.6534010 -0.992925E-06  0.666E-03    3.11       2.9  T
   6    -45.6534016 -0.582326E-06  0.242E-03    3.12       8.0  T
   7    -45.6534017 -0.868740E-07  0.104E-03    3.12      18.4  T
     SCC iter.                  ...        0 min,  0.009 sec
     gradient                   ...        0 min,  0.016 sec
 * total energy  :   -45.0961937 Eh     change       -0.8274399E-03 Eh
   gradient norm :     0.0102565 Eh/α   predicted    -0.8364476E-03 (   1.09%)
   displ. norm   :     0.1665985 α      lambda       -0.5378979E-03
   maximum displ.:     0.0808747 α      in ANC's #4, #3, #8, ...

........................................................................
.............................. CYCLE    4 ..............................
........................................................................
   1    -45.6533441 -0.456533E+02  0.104E-01    3.12       0.0  T
   2    -45.6533479 -0.376822E-05  0.629E-02    3.12       1.0  T
   3    -45.6533358  0.121005E-04  0.255E-02    3.12       1.0  T
   4    -45.6533501 -0.142864E-04  0.671E-03    3.12       2.9  T
   5    -45.6533506 -0.496259E-06  0.286E-03    3.12       6.7  T
   6    -45.6533506 -0.479687E-07  0.115E-03    3.12      16.7  T
     SCC iter.                  ...        0 min,  0.008 sec
     gradient                   ...        0 min,  0.016 sec
 * total energy  :   -45.0964563 Eh     change       -0.2625482E-03 Eh
   gradient norm :     0.0071542 Eh/α   predicted    -0.2764137E-03 (   5.28%)
   displ. norm   :     0.1306405 α      lambda       -0.2126197E-03
   maximum displ.:     0.0767317 α      in ANC's #3, #2, #7, ...

........................................................................
.............................. CYCLE    5 ..............................
........................................................................
   1    -45.6508206 -0.456508E+02  0.759E-02    3.12       0.0  T
   2    -45.6508227 -0.213638E-05  0.453E-02    3.12       1.0  T
   3    -45.6508217  0.102707E-05  0.107E-02    3.12       1.8  T
   4    -45.6508235 -0.177283E-05  0.406E-03    3.12       4.7  T
   5    -45.6508236 -0.698950E-07  0.233E-03    3.12       8.3  T
   6    -45.6508236 -0.681383E-07  0.712E-04    3.12      27.0  T
     SCC iter.                  ...        0 min,  0.009 sec
     gradient                   ...        0 min,  0.016 sec
 * total energy  :   -45.0966154 Eh     change       -0.1591663E-03 Eh
   gradient norm :     0.0042098 Eh/α   predicted    -0.1081279E-03 ( -32.07%)
   displ. norm   :     0.1816797 α      lambda       -0.1769886E-03
   maximum displ.:     0.1161780 α      in ANC's #3, #2, #7, ...

........................................................................
.............................. CYCLE    6 ..............................
........................................................................
   1    -45.6493713 -0.456494E+02  0.103E-01    3.12       0.0  T
   2    -45.6493733 -0.193363E-05  0.612E-02    3.12       1.0  T
   3    -45.6493720  0.128800E-05  0.117E-02    3.12       1.6  T
   4    -45.6493740 -0.199829E-05  0.541E-03    3.12       3.6  T
   5    -45.6493742 -0.233331E-06  0.214E-03    3.12       9.0  T
   6    -45.6493743 -0.574838E-07  0.732E-04    3.12      26.3  T
     SCC iter.                  ...        0 min,  0.008 sec
     gradient                   ...        0 min,  0.017 sec
 * total energy  :   -45.0967420 Eh     change       -0.1266148E-03 Eh
   gradient norm :     0.0045327 Eh/α   predicted    -0.9141628E-04 ( -27.80%)
   displ. norm   :     0.1716456 α      lambda       -0.1136604E-03
   maximum displ.:     0.1162304 α      in ANC's #3, #2, #7, ...

........................................................................
.............................. CYCLE    7 ..............................
........................................................................
   1    -45.6493292 -0.456493E+02  0.952E-02    3.11       0.0  T
   2    -45.6493304 -0.120703E-05  0.563E-02    3.11       1.0  T
   3    -45.6493269  0.348176E-05  0.151E-02    3.11       1.3  T
   4    -45.6493312 -0.423323E-05  0.446E-03    3.11       4.3  T
   5    -45.6493312 -0.952692E-07  0.115E-03    3.11      16.8  T
   6    -45.6493313 -0.956299E-08  0.573E-04    3.11      33.6  T
     SCC iter.                  ...        0 min,  0.008 sec
     gradient                   ...        0 min,  0.017 sec
 * total energy  :   -45.0968367 Eh     change       -0.9463902E-04 Eh
   gradient norm :     0.0045560 Eh/α   predicted    -0.5850733E-04 ( -38.18%)
   displ. norm   :     0.2414780 α      lambda       -0.1578442E-03
   maximum displ.:     0.1644754 α      in ANC's #3, #2, #7, ...

........................................................................
.............................. CYCLE    8 ..............................
........................................................................
   1    -45.6500822 -0.456501E+02  0.133E-01    3.11       0.0  T
   2    -45.6500846 -0.239230E-05  0.789E-02    3.11       1.0  T
   3    -45.6500740  0.105521E-04  0.252E-02    3.11       1.0  T
   4    -45.6500863 -0.123303E-04  0.592E-03    3.11       3.3  T
   5    -45.6500865 -0.111816E-06  0.181E-03    3.11      10.6  T
   6    -45.6500865 -0.368784E-07  0.855E-04    3.11      22.5  T
     SCC iter.                  ...        0 min,  0.008 sec
     gradient                   ...        0 min,  0.016 sec
 * total energy  :   -45.0969713 Eh     change       -0.1346406E-03 Eh
   gradient norm :     0.0036702 Eh/α   predicted    -0.8352435E-04 ( -37.96%)
   displ. norm   :     0.3395567 α      lambda       -0.2030081E-03
   maximum displ.:     0.2332985 α      in ANC's #3, #2, #7, ...

........................................................................
.............................. CYCLE    9 ..............................
........................................................................
   1    -45.6505352 -0.456505E+02  0.190E-01    3.10       0.0  T
   2    -45.6505404 -0.526093E-05  0.112E-01    3.10       1.0  T
   3    -45.6505197  0.207256E-04  0.357E-02    3.10       1.0  T
   4    -45.6505441 -0.243647E-04  0.903E-03    3.10       2.1  T
   5    -45.6505443 -0.231824E-06  0.290E-03    3.10       6.6  T
   6    -45.6505444 -0.122275E-06  0.128E-03    3.10      15.0  T
   7    -45.6505444 -0.105793E-07  0.759E-04    3.10      25.4  T
   8    -45.6505444 -0.349113E-08  0.266E-04    3.10      72.4  T
     SCC iter.                  ...        0 min,  0.024 sec
     gradient                   ...        0 min,  0.017 sec
 * total energy  :   -45.0971412 Eh     change       -0.1698769E-03 Eh
   gradient norm :     0.0034108 Eh/α   predicted    -0.1132088E-03 ( -33.36%)
   displ. norm   :     0.3809604 α      lambda       -0.2064896E-03
   maximum displ.:     0.2646544 α      in ANC's #3, #7, #2, ...

........................................................................
.............................. CYCLE   10 ..............................
........................................................................
   1    -45.6508562 -0.456509E+02  0.210E-01    3.08       0.0  T
   2    -45.6508627 -0.647709E-05  0.123E-01    3.08       1.0  T
   3    -45.6508396  0.231061E-04  0.381E-02    3.08       1.0  T
   4    -45.6508669 -0.272605E-04  0.101E-02    3.08       1.9  T
   5    -45.6508672 -0.327494E-06  0.327E-03    3.08       5.9  T
   6    -45.6508674 -0.158669E-06  0.140E-03    3.08      13.7  T
   7    -45.6508674 -0.105856E-07  0.839E-04    3.08      22.9  T
   8    -45.6508674 -0.486135E-08  0.309E-04    3.08      62.3  T
     SCC iter.                  ...        0 min,  0.011 sec
     gradient                   ...        0 min,  0.017 sec
 * total energy  :   -45.0973088 Eh     change       -0.1675993E-03 Eh
   gradient norm :     0.0044077 Eh/α   predicted    -0.1182390E-03 ( -29.45%)
   displ. norm   :     0.4001652 α      lambda       -0.1907845E-03
   maximum displ.:     0.2798007 α      in ANC's #3, #1, #7, ...

........................................................................
.............................. CYCLE   11 ..............................
........................................................................
   1    -45.6504176 -0.456504E+02  0.219E-01    3.07       0.0  T
   2    -45.6504241 -0.651101E-05  0.130E-01    3.07       1.0  T
   3    -45.6503928  0.312436E-04  0.431E-02    3.07       1.0  T
   4    -45.6504295 -0.366132E-04  0.978E-03    3.07       2.0  T
   5    -45.6504296 -0.178966E-06  0.362E-03    3.07       5.3  T
   6    -45.6504298 -0.200757E-06  0.157E-03    3.07      12.3  T
   7    -45.6504299 -0.135005E-07  0.923E-04    3.07      20.9  T
     SCC iter.                  ...        0 min,  0.009 sec
     gradient                   ...        0 min,  0.016 sec
 * total energy  :   -45.0974633 Eh     change       -0.1545082E-03 Eh
   gradient norm :     0.0054494 Eh/α   predicted    -0.1106681E-03 ( -28.37%)
   displ. norm   :     0.4520652 α      lambda       -0.2553270E-03
   maximum displ.:     0.3197523 α      in ANC's #3, #1, #6, ...

........................................................................
.............................. CYCLE   12 ..............................
........................................................................
   1    -45.6515024 -0.456515E+02  0.240E-01    3.05       0.0  T
   2    -45.6515101 -0.777266E-05  0.142E-01    3.05       1.0  T
   3    -45.6514810  0.291602E-04  0.423E-02    3.05       1.0  T
   4    -45.6515151 -0.341639E-04  0.107E-02    3.05       1.8  T
   5    -45.6515156 -0.473728E-06  0.333E-03    3.05       5.8  T
   6    -45.6515157 -0.120735E-06  0.151E-03    3.05      12.8  T
   7    -45.6515157 -0.555427E-08  0.899E-04    3.05      21.4  T
     SCC iter.                  ...        0 min,  0.010 sec
     gradient                   ...        0 min,  0.017 sec
 * total energy  :   -45.0976445 Eh     change       -0.1811542E-03 Eh
   gradient norm :     0.0096873 Eh/α   predicted    -0.1537600E-03 ( -15.12%)
   displ. norm   :     0.5507901 α      lambda       -0.2982437E-03
   maximum displ.:     0.3979666 α      in ANC's #3, #1, #7, ...

........................................................................
.............................. CYCLE   13 ..............................
........................................................................
   1    -45.6481514 -0.456482E+02  0.300E-01    3.03       0.0  T
   2    -45.6481626 -0.111998E-04  0.179E-01    3.03       1.0  T
   3    -45.6480672  0.954113E-04  0.737E-02    3.03       1.0  T
   4    -45.6481771 -0.109898E-03  0.116E-02    3.03       1.7  T
   5    -45.6481771 -0.451935E-07  0.508E-03    3.03       3.8  T
   6    -45.6481775 -0.354165E-06  0.234E-03    3.03       8.2  T
   7    -45.6481775 -0.328185E-07  0.130E-03    3.03      14.9  T
     SCC iter.                  ...        0 min,  0.010 sec
     gradient                   ...        0 min,  0.017 sec
 * total energy  :   -45.0978331 Eh     change       -0.1886100E-03 Eh
   gradient norm :     0.0099586 Eh/α   predicted    -0.1943645E-03 (   3.05%)
   displ. norm   :     0.2620486 α      lambda       -0.3865814E-03
   maximum displ.:     0.1624102 α      in ANC's #3, #1, #2, ...

........................................................................
.............................. CYCLE   14 ..............................
........................................................................
   1    -45.6534614 -0.456535E+02  0.146E-01    3.03       0.0  T
   2    -45.6534675 -0.609790E-05  0.867E-02    3.03       1.0  T
   3    -45.6534544  0.131752E-04  0.289E-02    3.03       1.0  T
   4    -45.6534699 -0.155169E-04  0.673E-03    3.03       2.9  T
   5    -45.6534703 -0.456895E-06  0.308E-03    3.03       6.3  T
   6    -45.6534704 -0.305071E-07  0.123E-03    3.03      15.6  T
   7    -45.6534704 -0.196800E-08  0.705E-04    3.03      27.3  T
     SCC iter.                  ...        0 min,  0.010 sec
     gradient                   ...        0 min,  0.016 sec
 * total energy  :   -45.0980115 Eh     change       -0.1784005E-03 Eh
   gradient norm :     0.0090464 Eh/α   predicted    -0.2065682E-03 (  15.79%)
   displ. norm   :     0.3581482 α      lambda       -0.3401441E-03
   maximum displ.:     0.2544456 α      in ANC's #3, #1, #7, ...

........................................................................
.............................. CYCLE   15 ..............................
........................................................................
   1    -45.6499944 -0.456500E+02  0.211E-01    3.02       0.0  T
   2    -45.6500026 -0.819364E-05  0.127E-01    3.02       1.0  T
   3    -45.6499759  0.266499E-04  0.390E-02    3.02       1.0  T
   4    -45.6500072 -0.312620E-04  0.721E-03    3.02       2.7  T
   5    -45.6500076 -0.383093E-06  0.360E-03    3.02       5.3  T
   6    -45.6500076 -0.545188E-07  0.152E-03    3.02      12.6  T
   7    -45.6500076 -0.261664E-08  0.749E-04    3.02      25.7  T
     SCC iter.                  ...        0 min,  0.010 sec
     gradient                   ...        0 min,  0.016 sec
 * total energy  :   -45.0981536 Eh     change       -0.1421088E-03 Eh
   gradient norm :     0.0096454 Eh/α   predicted    -0.1918895E-03 (  35.03%)
   displ. norm   :     0.1254895 α      lambda       -0.2084679E-03
   maximum displ.:     0.0750783 α      in ANC's #3, #5, #7, ...

........................................................................
.............................. CYCLE   16 ..............................
........................................................................
   1    -45.6533036 -0.456533E+02  0.846E-02    3.03       0.0  T
   2    -45.6533062 -0.258694E-05  0.508E-02    3.03       1.0  T
   3    -45.6533020  0.417076E-05  0.166E-02    3.03       1.2  T
   4    -45.6533071 -0.504115E-05  0.458E-03    3.03       4.2  T
   5    -45.6533073 -0.195120E-06  0.200E-03    3.03       9.6  T
   6    -45.6533073 -0.205818E-07  0.819E-04    3.03      23.5  T
     SCC iter.                  ...        0 min,  0.008 sec
     gradient                   ...        0 min,  0.016 sec
 * total energy  :   -45.0982286 Eh     change       -0.7503468E-04 Eh
   gradient norm :     0.0080152 Eh/α   predicted    -0.1058805E-03 (  41.11%)
   displ. norm   :     0.1201736 α      lambda       -0.1277899E-03
   maximum displ.:     0.0794206 α      in ANC's #1, #3, #5, ...

........................................................................
.............................. CYCLE   17 ..............................
........................................................................
   1    -45.6522356 -0.456522E+02  0.722E-02    3.02       0.0  T
   2    -45.6522370 -0.135280E-05  0.415E-02    3.02       1.0  T
   3    -45.6522312  0.576195E-05  0.191E-02    3.02       1.0  T
   4    -45.6522380 -0.680503E-05  0.387E-03    3.02       5.0  T
   5    -45.6522380 -0.178279E-07  0.171E-03    3.02      11.3  T
   6    -45.6522381 -0.429258E-07  0.631E-04    3.02      30.5  T
     SCC iter.                  ...        0 min,  0.008 sec
     gradient                   ...        0 min,  0.017 sec
 * total energy  :   -45.0983039 Eh     change       -0.7529363E-04 Eh
   gradient norm :     0.0055691 Eh/α   predicted    -0.6482207E-04 ( -13.91%)
   displ. norm   :     0.1822571 α      lambda       -0.1506905E-03
   maximum displ.:     0.0931708 α      in ANC's #2, #5, #3, ...

........................................................................
.............................. CYCLE   18 ..............................
........................................................................
   1    -45.6518375 -0.456518E+02  0.114E-01    3.02       0.0  T
   2    -45.6518437 -0.619198E-05  0.628E-02    3.02       1.0  T
   3    -45.6518369  0.674193E-05  0.223E-02    3.02       1.0  T
   4    -45.6518452 -0.827981E-05  0.880E-03    3.02       2.2  T
   5    -45.6518457 -0.516539E-06  0.304E-03    3.02       6.3  T
   6    -45.6518458 -0.103431E-06  0.968E-04    3.02      19.9  T
   7    -45.6518458 -0.107997E-07  0.487E-04    3.02      39.5  T
     SCC iter.                  ...        0 min,  0.009 sec
     gradient                   ...        0 min,  0.016 sec
 * total energy  :   -45.0983285 Eh     change       -0.2460593E-04 Eh
   gradient norm :     0.0081730 Eh/α   predicted    -0.7784925E-04 ( 216.38%)
   displ. norm   :     0.1279028 α      lambda       -0.1403399E-03
   maximum displ.:     0.0913136 α      in ANC's #1, #3, #2, ...

........................................................................
.............................. CYCLE   19 ..............................
........................................................................
   1    -45.6507443 -0.456507E+02  0.697E-02    3.01       0.0  T
   2    -45.6507452 -0.949544E-06  0.418E-02    3.01       1.0  T
   3    -45.6507442  0.100270E-05  0.807E-03    3.01       2.4  T
   4    -45.6507456 -0.134427E-05  0.282E-03    3.01       6.8  T
   5    -45.6507456 -0.601841E-07  0.127E-03    3.01      15.1  T
     SCC iter.                  ...        0 min,  0.007 sec
     gradient                   ...        0 min,  0.017 sec
 * total energy  :   -45.0984204 Eh     change       -0.9186141E-04 Eh
   gradient norm :     0.0052703 Eh/α   predicted    -0.7131794E-04 ( -22.36%)
   displ. norm   :     0.1115536 α      lambda       -0.1151270E-03
   maximum displ.:     0.0658418 α      in ANC's #1, #2, #5, ...

........................................................................
.............................. CYCLE   20 ..............................
........................................................................
   1    -45.6516913 -0.456517E+02  0.720E-02    3.01       0.0  T
   2    -45.6516928 -0.150282E-05  0.425E-02    3.01       1.0  T
   3    -45.6516928  0.363068E-07  0.745E-03    3.01       2.6  T
   4    -45.6516932 -0.446648E-06  0.424E-03    3.01       4.5  T
   5    -45.6516934 -0.141482E-06  0.186E-03    3.01      10.3  T
   6    -45.6516934 -0.451395E-07  0.596E-04    3.01      32.3  T
     SCC iter.                  ...        0 min,  0.008 sec
     gradient                   ...        0 min,  0.016 sec
 * total energy  :   -45.0984905 Eh     change       -0.7009799E-04 Eh
   gradient norm :     0.0038955 Eh/α   predicted    -0.5828161E-04 ( -16.86%)
   displ. norm   :     0.2582776 α      lambda       -0.1394190E-03
   maximum displ.:     0.1649574 α      in ANC's #2, #1, #5, ...
 * RMSD in coord.:     0.6495439 α      energy gain  -0.8372158E-02 Eh

generating ANC from model Hessian ...
Using Lindh-Hessian (1995)
 Shifting diagonal of input Hessian by   3.783450047799412E-003
 Lowest  eigenvalues of input Hessian
   -0.000000   -0.000000   -0.000000    0.000000    0.000000    0.000000
    0.005000    0.006838    0.007651    0.008611    0.009168    0.010796
    0.011404    0.013512    0.016791    0.018396    0.024816    0.026549
 Highest eigenvalues
    1.676097    1.732671    1.818956    1.872795    2.013527    2.337762
 

........................................................................
.............................. CYCLE   21 ..............................
........................................................................
   1    -45.6501071 -0.456501E+02  0.144E-01    3.00       0.0  T
   2    -45.6501097 -0.259878E-05  0.848E-02    3.00       1.0  T
   3    -45.6500963  0.133941E-04  0.284E-02    3.00       1.0  T
   4    -45.6501119 -0.156522E-04  0.621E-03    3.00       3.1  T
   5    -45.6501120 -0.676626E-07  0.228E-03    3.00       8.5  T
   6    -45.6501121 -0.547010E-07  0.919E-04    3.00      20.9  T
   7    -45.6501121 -0.324775E-08  0.560E-04    3.00      34.3  T
     SCC iter.                  ...        0 min,  0.009 sec
     gradient                   ...        0 min,  0.017 sec
 * total energy  :   -45.0985697 Eh     change       -0.7920463E-04 Eh
   gradient norm :     0.0069074 Eh/α   predicted     0.0000000E+00 (-100.00%)
   displ. norm   :     0.0800269 α      lambda       -0.1480767E-03
   maximum displ.:     0.0499605 α      in ANC's #2, #6, #1, ...

........................................................................
.............................. CYCLE   22 ..............................
........................................................................
   1    -45.6516528 -0.456517E+02  0.587E-02    3.01       0.0  T
   2    -45.6516537 -0.830974E-06  0.337E-02    3.01       1.0  T
   3    -45.6516532  0.523802E-06  0.745E-03    3.01       2.6  T
   4    -45.6516538 -0.631224E-06  0.391E-03    3.01       4.9  T
   5    -45.6516540 -0.164449E-06  0.963E-04    3.01      20.0  T
   6    -45.6516540 -0.966151E-08  0.414E-04    3.01      46.5  T
     SCC iter.                  ...        0 min,  0.008 sec
     gradient                   ...        0 min,  0.017 sec
 * total energy  :   -45.0986671 Eh     change       -0.9739648E-04 Eh
   gradient norm :     0.0023689 Eh/α   predicted    -0.7451524E-04 ( -23.49%)
   displ. norm   :     0.0997247 α      lambda       -0.9171871E-04
   maximum displ.:     0.0572475 α      in ANC's #2, #6, #5, ...

........................................................................
.............................. CYCLE   23 ..............................
........................................................................
   1    -45.6526815 -0.456527E+02  0.730E-02    3.01       0.0  T
   2    -45.6526829 -0.137261E-05  0.408E-02    3.01       1.0  T
   3    -45.6526815  0.137854E-05  0.107E-02    3.01       1.8  T
   4    -45.6526832 -0.168888E-05  0.506E-03    3.01       3.8  T
   5    -45.6526834 -0.200338E-06  0.124E-03    3.01      15.5  T
   6    -45.6526834 -0.226144E-07  0.496E-04    3.01      38.8  T
   7    -45.6526834 -0.272118E-08  0.243E-04    3.01      79.3  T
     SCC iter.                  ...        0 min,  0.009 sec
     gradient                   ...        0 min,  0.018 sec
 * total energy  :   -45.0987217 Eh     change       -0.5457946E-04 Eh
   gradient norm :     0.0025448 Eh/α   predicted    -0.4632261E-04 ( -15.13%)
   displ. norm   :     0.0998317 α      lambda       -0.5151174E-04
   maximum displ.:     0.0658542 α      in ANC's #2, #5, #3, ...

........................................................................
.............................. CYCLE   24 ..............................
........................................................................
   1    -45.6524547 -0.456525E+02  0.632E-02    3.01       0.0  T
   2    -45.6524554 -0.654723E-06  0.363E-02    3.01       1.0  T
   3    -45.6524540  0.133715E-05  0.921E-03    3.01       2.1  T
   4    -45.6524556 -0.161900E-05  0.336E-03    3.01       5.7  T
   5    -45.6524557 -0.529527E-07  0.102E-03    3.01      18.8  T
   6    -45.6524557 -0.178990E-07  0.354E-04    3.01      54.3  T
   7    -45.6524557 -0.909587E-09  0.195E-04    3.01      98.7  T
     SCC iter.                  ...        0 min,  0.010 sec
     gradient                   ...        0 min,  0.018 sec
 * total energy  :   -45.0987657 Eh     change       -0.4402601E-04 Eh
   gradient norm :     0.0028539 Eh/α   predicted    -0.2601311E-04 ( -40.91%)
   displ. norm   :     0.1654681 α      lambda       -0.7798181E-04
   maximum displ.:     0.1080373 α      in ANC's #2, #5, #3, ...

........................................................................
.............................. CYCLE   25 ..............................
........................................................................
   1    -45.6515845 -0.456516E+02  0.938E-02    3.01       0.0  T
   2    -45.6515855 -0.103613E-05  0.542E-02    3.01       1.0  T
   3    -45.6515829  0.256791E-05  0.126E-02    3.00       1.5  T
   4    -45.6515860 -0.308727E-05  0.417E-03    3.01       4.6  T
   5    -45.6515861 -0.604516E-07  0.139E-03    3.01      13.9  T
   6    -45.6515861 -0.361239E-07  0.436E-04    3.01      44.2  T
   7    -45.6515861 -0.117792E-08  0.262E-04    3.01      73.6  T
     SCC iter.                  ...        0 min,  0.009 sec
     gradient                   ...        0 min,  0.017 sec
 * total energy  :   -45.0988288 Eh     change       -0.6309268E-04 Eh
   gradient norm :     0.0023038 Eh/α   predicted    -0.4006281E-04 ( -36.50%)
   displ. norm   :     0.1729660 α      lambda       -0.6579395E-04
   maximum displ.:     0.1169465 α      in ANC's #2, #3, #5, ...

........................................................................
.............................. CYCLE   26 ..............................
........................................................................
   1    -45.6508728 -0.456509E+02  0.931E-02    3.00       0.0  T
   2    -45.6508736 -0.821132E-06  0.543E-02    3.00       1.0  T
   3    -45.6508721  0.148408E-05  0.100E-02    3.00       1.9  T
   4    -45.6508740 -0.186465E-05  0.352E-03    3.00       5.5  T
   5    -45.6508741 -0.530235E-07  0.119E-03    3.00      16.1  T
   6    -45.6508741 -0.241711E-07  0.424E-04    3.00      45.4  T
   7    -45.6508741 -0.844913E-09  0.261E-04    3.00      73.9  T
     SCC iter.                  ...        0 min,  0.010 sec
     gradient                   ...        0 min,  0.017 sec
 * total energy  :   -45.0988796 Eh     change       -0.5078721E-04 Eh
   gradient norm :     0.0033274 Eh/α   predicted    -0.3388167E-04 ( -33.29%)
   displ. norm   :     0.1417078 α      lambda       -0.5722053E-04
   maximum displ.:     0.1006760 α      in ANC's #2, #3, #5, ...

........................................................................
.............................. CYCLE   27 ..............................
........................................................................
   1    -45.6508845 -0.456509E+02  0.768E-02    3.00       0.0  T
   2    -45.6508852 -0.656205E-06  0.444E-02    3.00       1.0  T
   3    -45.6508849  0.283306E-06  0.666E-03    3.00       2.9  T
   4    -45.6508853 -0.396142E-06  0.367E-03    3.00       5.2  T
   5    -45.6508854 -0.137237E-06  0.812E-04    3.00      23.7  T
   6    -45.6508855 -0.975676E-08  0.331E-04    3.00      58.2  T
     SCC iter.                  ...        0 min,  0.008 sec
     gradient                   ...        0 min,  0.017 sec
 * total energy  :   -45.0989276 Eh     change       -0.4807795E-04 Eh
   gradient norm :     0.0037331 Eh/α   predicted    -0.2918833E-04 ( -39.29%)
   displ. norm   :     0.1996955 α      lambda       -0.9426577E-04
   maximum displ.:     0.1500214 α      in ANC's #2, #3, #5, ...

........................................................................
.............................. CYCLE   28 ..............................
........................................................................
   1    -45.6513683 -0.456514E+02  0.111E-01    3.00       0.0  T
   2    -45.6513699 -0.162786E-05  0.642E-02    3.00       1.0  T
   3    -45.6513697  0.225478E-06  0.942E-03    3.00       2.0  T
   4    -45.6513701 -0.442245E-06  0.596E-03    3.00       3.2  T
   5    -45.6513705 -0.429610E-06  0.131E-03    3.00      14.7  T
   6    -45.6513706 -0.209290E-07  0.620E-04    3.00      31.1  T
   7    -45.6513706 -0.463153E-09  0.346E-04    3.00      55.6  T
     SCC iter.                  ...        0 min,  0.009 sec
     gradient                   ...        0 min,  0.018 sec
 * total energy  :   -45.0990026 Eh     change       -0.7499533E-04 Eh
   gradient norm :     0.0036147 Eh/α   predicted    -0.4901453E-04 ( -34.64%)
   displ. norm   :     0.2700351 α      lambda       -0.1065269E-03
   maximum displ.:     0.2072926 α      in ANC's #2, #5, #3, ...

........................................................................
.............................. CYCLE   29 ..............................
........................................................................
   1    -45.6512472 -0.456512E+02  0.146E-01    3.00       0.0  T
   2    -45.6512498 -0.265847E-05  0.844E-02    3.00       1.0  T
   3    -45.6512467  0.311534E-05  0.167E-02    3.00       1.2  T
   4    -45.6512506 -0.387964E-05  0.768E-03    3.00       2.5  T
   5    -45.6512511 -0.482820E-06  0.171E-03    3.00      11.2  T
   6    -45.6512511 -0.402307E-07  0.794E-04    3.00      24.2  T
   7    -45.6512511 -0.266900E-08  0.450E-04    3.00      42.7  T
     SCC iter.                  ...        0 min,  0.009 sec
     gradient                   ...        0 min,  0.017 sec
 * total energy  :   -45.0990810 Eh     change       -0.7835793E-04 Eh
   gradient norm :     0.0038154 Eh/α   predicted    -0.5714830E-04 ( -27.07%)
   displ. norm   :     0.2786425 α      lambda       -0.9963219E-04
   maximum displ.:     0.2235363 α      in ANC's #2, #1, #5, ...

........................................................................
.............................. CYCLE   30 ..............................
........................................................................
   1    -45.6513941 -0.456514E+02  0.154E-01    3.00       0.0  T
   2    -45.6513974 -0.331347E-05  0.890E-02    3.00       1.0  T
   3    -45.6513948  0.257974E-05  0.173E-02    3.00       1.1  T
   4    -45.6513983 -0.354521E-05  0.875E-03    3.00       2.2  T
   5    -45.6513990 -0.696663E-06  0.166E-03    3.00      11.6  T
   6    -45.6513991 -0.226223E-07  0.979E-04    3.00      19.7  T
   7    -45.6513991 -0.338351E-08  0.483E-04    3.00      39.9  T
     SCC iter.                  ...        0 min,  0.009 sec
     gradient                   ...        0 min,  0.017 sec
 * total energy  :   -45.0991509 Eh     change       -0.6986320E-04 Eh
   gradient norm :     0.0031908 Eh/α   predicted    -0.5368422E-04 ( -23.16%)
   displ. norm   :     0.2401187 α      lambda       -0.6290230E-04
   maximum displ.:     0.1937305 α      in ANC's #2, #1, #5, ...

........................................................................
.............................. CYCLE   31 ..............................
........................................................................
   1    -45.6519242 -0.456519E+02  0.124E-01    3.00       0.0  T
   2    -45.6519261 -0.181417E-05  0.718E-02    3.00       1.0  T
   3    -45.6519205  0.559410E-05  0.193E-02    3.00       1.0  T
   4    -45.6519272 -0.669600E-05  0.590E-03    3.00       3.3  T
   5    -45.6519273 -0.161211E-06  0.119E-03    3.00      16.2  T
   6    -45.6519273 -0.104561E-07  0.678E-04    3.00      28.4  T
   7    -45.6519273 -0.454840E-09  0.340E-04    3.00      56.6  T
     SCC iter.                  ...        0 min,  0.010 sec
     gradient                   ...        0 min,  0.017 sec
 * total energy  :   -45.0991957 Eh     change       -0.4483803E-04 Eh
   gradient norm :     0.0021452 Eh/α   predicted    -0.3326780E-04 ( -25.80%)
   displ. norm   :     0.2045256 α      lambda       -0.3652525E-04
   maximum displ.:     0.1623814 α      in ANC's #2, #1, #5, ...

........................................................................
.............................. CYCLE   32 ..............................
........................................................................
   1    -45.6520483 -0.456520E+02  0.106E-01    3.01       0.0  T
   2    -45.6520498 -0.147792E-05  0.615E-02    3.01       1.0  T
   3    -45.6520463  0.350931E-05  0.157E-02    3.01       1.2  T
   4    -45.6520506 -0.429254E-05  0.509E-03    3.01       3.8  T
   5    -45.6520507 -0.132226E-06  0.123E-03    3.01      15.6  T
   6    -45.6520507 -0.124340E-07  0.660E-04    3.01      29.2  T
   7    -45.6520507 -0.206023E-08  0.375E-04    3.01      51.4  T
     SCC iter.                  ...        0 min,  0.009 sec
     gradient                   ...        0 min,  0.018 sec
 * total energy  :   -45.0992199 Eh     change       -0.2419823E-04 Eh
   gradient norm :     0.0017396 Eh/α   predicted    -0.1902675E-04 ( -21.37%)
   displ. norm   :     0.1441266 α      lambda       -0.2589007E-04
   maximum displ.:     0.1080188 α      in ANC's #2, #1, #5, ...

........................................................................
.............................. CYCLE   33 ..............................
........................................................................
   1    -45.6562885 -0.456563E+02  0.693E-02    3.02       0.0  T
   2    -45.6562896 -0.110053E-05  0.410E-02    3.02       1.0  T
   3    -45.6562882  0.141756E-05  0.992E-03    3.02       1.9  T
   4    -45.6562900 -0.179225E-05  0.371E-03    3.02       5.2  T
   5    -45.6562901 -0.115792E-06  0.153E-03    3.02      12.5  T
   6    -45.6562901 -0.182051E-07  0.589E-04    3.02      32.7  T
   7    -45.6562901 -0.264752E-08  0.321E-04    3.02      59.9  T
     SCC iter.                  ...        0 min,  0.009 sec
     gradient                   ...        0 min,  0.018 sec
 * total energy  :   -45.0991698 Eh     change        0.5007227E-04 Eh
   gradient norm :     0.0066819 Eh/α   predicted    -0.1306526E-04 (-126.09%)
   displ. norm   :     0.1206148 α      lambda       -0.8960972E-04
   maximum displ.:     0.0872282 α      in ANC's #2, #5, #1, ...

........................................................................
.............................. CYCLE   34 ..............................
........................................................................
   1    -45.6537014 -0.456537E+02  0.618E-02    3.02       0.0  T
   2    -45.6537020 -0.511907E-06  0.362E-02    3.02       1.0  T
   3    -45.6536986  0.337621E-05  0.141E-02    3.02       1.4  T
   4    -45.6537024 -0.383828E-05  0.214E-03    3.02       9.0  T
   5    -45.6537024 -0.606838E-08  0.860E-04    3.02      22.4  T
   6    -45.6537024 -0.603971E-08  0.413E-04    3.02      46.6  T
     SCC iter.                  ...        0 min,  0.008 sec
     gradient                   ...        0 min,  0.017 sec
 * total energy  :   -45.0992247 Eh     change       -0.5487970E-04 Eh
   gradient norm :     0.0020890 Eh/α   predicted    -0.4545632E-04 ( -17.17%)
   displ. norm   :     0.0596531 α      lambda       -0.2382686E-04
   maximum displ.:     0.0444065 α      in ANC's #2, #4, #5, ...

........................................................................
.............................. CYCLE   35 ..............................
........................................................................
   1    -45.6525302 -0.456525E+02  0.287E-02    3.01       0.0  T
   2    -45.6525304 -0.213930E-06  0.170E-02    3.01       1.1  T
   3    -45.6525288  0.163076E-05  0.108E-02    3.01       1.8  T
   4    -45.6525308 -0.195827E-05  0.129E-03    3.01      14.9  T
   5    -45.6525308 -0.443143E-08  0.711E-04    3.01      27.1  T
   6    -45.6525308 -0.409521E-08  0.289E-04    3.01      66.6  T
     SCC iter.                  ...        0 min,  0.008 sec
     gradient                   ...        0 min,  0.017 sec
 * total energy  :   -45.0992276 Eh     change       -0.2857121E-05 Eh
   gradient norm :     0.0027432 Eh/α   predicted    -0.1195996E-04 ( 318.60%)
   displ. norm   :     0.0238554 α      lambda       -0.1432455E-04
   maximum displ.:     0.0165844 α      in ANC's #2, #11, #5, ...

........................................................................
.............................. CYCLE   36 ..............................
........................................................................
   1    -45.6527465 -0.456527E+02  0.124E-02    3.01       0.0  T
   2    -45.6527466 -0.441299E-07  0.723E-03    3.01       2.7  T
   3    -45.6527463  0.251055E-06  0.415E-03    3.01       4.6  T
   4    -45.6527466 -0.299118E-06  0.555E-04    3.01      34.7  T
   5    -45.6527466  0.149015E-09  0.269E-04    3.01      71.6  T
     SCC iter.                  ...        0 min,  0.007 sec
     gradient                   ...        0 min,  0.017 sec
 * total energy  :   -45.0992346 Eh     change       -0.7027987E-05 Eh
   gradient norm :     0.0006325 Eh/α   predicted    -0.7167360E-05 (   1.98%)
   displ. norm   :     0.0339827 α      lambda       -0.1505881E-05
   maximum displ.:     0.0239353 α      in ANC's #2, #1, #5, ...

........................................................................
.............................. CYCLE   37 ..............................
........................................................................
   1    -45.6528538 -0.456529E+02  0.178E-02    3.01       0.0  T
   2    -45.6528538 -0.290778E-07  0.107E-02    3.01       1.8  T
   3    -45.6528536  0.259369E-06  0.377E-03    3.01       5.1  T
   4    -45.6528539 -0.294893E-06  0.453E-04    3.01      42.5  T
   5    -45.6528539 -0.690278E-09  0.279E-04    3.01      68.9  T
     SCC iter.                  ...        0 min,  0.007 sec
     gradient                   ...        0 min,  0.017 sec
 * total energy  :   -45.0992358 Eh     change       -0.1196778E-05 Eh
   gradient norm :     0.0007223 Eh/α   predicted    -0.7554448E-06 ( -36.88%)
   displ. norm   :     0.0341140 α      lambda       -0.1644139E-05
   maximum displ.:     0.0206829 α      in ANC's #1, #2, #3, ...

   *** GEOMETRY OPTIMIZATION CONVERGED AFTER 37 ITERATIONS ***

------------------------------------------------------------------------
 total energy gain   :        -0.0091175 Eh       -5.7213 kcal/mol
 total RMSD          :         0.7096945 a0        0.3756 Å
 total power (kW/mol):        -0.6469703 (step)  -16.3373 (real)
------------------------------------------------------------------------

 ANCopt (total)                0 d,  0 h,  0 min,  1.465 sec
 optimizer setup                ...        0 min,  0.000 sec (  0.011%)
 model hessian                  ...        0 min,  0.029 sec (  1.956%)
 ANC generation                 ...        0 min,  0.002 sec (  0.111%)
 coordinate transformation      ...        0 min,  0.001 sec (  0.054%)
 single point calculation       ...        0 min,  1.418 sec ( 96.797%)
 optimization log               ...        0 min,  0.004 sec (  0.275%)
 hessian update                 ...        0 min,  0.001 sec (  0.038%)
 rational function              ...        0 min,  0.009 sec (  0.602%)

================
 final structure:
================
$coord
    2.83251599574359   -2.39339701424706   -0.02707472515982      C 
    5.08074396401037   -0.07311478914188    0.07618785786744      S 
    2.77589271212964    2.28740192313147    0.09059385115526      C 
    0.39069262827601    1.24660645633428   -0.00383122693813      C 
    0.43581147767578   -1.44011186003587   -0.05271318306462      C 
   -1.90018399523301   -3.02806425266277   -0.18678135405553      C 
   -2.40846498905378   -4.03695818313202   -2.85687162613638      C 
   -3.83298395424153   -5.74472243915534   -3.25555955225029      O 
   -1.20707570837119   -2.85601285154394   -4.74842194006930      O 
   -4.21492682288764   -1.48919964632564    0.65166558071505      C 
   -4.29072365982000    1.04036512690307   -0.72317364991855      C 
   -2.05556212572755    2.69891041594952    0.06533558475451      C 
   -2.57177861674899    3.58601356154168    2.54037088647351      O 
    3.69542381061639    4.85366196879241    0.15801135186782      C 
    2.39580311535137    6.99348351754257    0.40307348471330      C 
    3.38917374025978   -4.34145623435853   -0.04398122147920      H 
   -1.71236002969713   -4.69029226580074    1.02950362146538      H 
   -0.09110402363441   -1.54177529285509   -4.12210694727685      H 
   -4.10649201147820   -1.13426292081212    2.67944818348592      H 
   -5.92249537894619   -2.57364898779181    0.26104618369895      H 
   -6.01353580867326    2.05103108372348   -0.21949047874994      H 
   -4.27310039219759    0.76446014641430   -2.76709249505123      H 
   -1.92448669334177    4.31607332443248   -1.24674192489131      H 
   -1.06884634143577    4.35050159151488    3.22977259349878      H 
    5.73318442783966    4.97162412398829   -0.00315728926783      H 
    0.37654787842695    7.09420893266015    0.59633665281160      H 
    3.36801841282961    8.78029925795264    0.39962447858684      H 
$end
           -------------------------------------------------
          |                Final Singlepoint                |
           -------------------------------------------------

          ...................................................
          :                      SETUP                      :
          :.................................................:
          :  # basis functions                  78          :
          :  # atomic orbitals                  77          :
          :  # shells                           43          :
          :  # electrons                        80          :
          :  max. iterations                   250          :
          :  Hamiltonian                  GFN2-xTB          :
          :  restarted?                      false          :
          :  GBSA solvation                  false          :
          :  PC potential                    false          :
          :  electronic temp.          300.0000000     K    :
          :  accuracy                    1.0000000          :
          :  -> integral cutoff          0.2500000E+02      :
          :  -> integral neglect         0.1000000E-07      :
          :  -> SCF convergence          0.1000000E-05 Eh   :
          :  -> wf. convergence          0.1000000E-03 e    :
          :  Broyden damping             0.4000000          :
          ...................................................

 iter      E             dE          RMSdq      gap      omega  full diag
   1    -45.6528539 -0.456529E+02  0.125E-04    3.01       0.0  T
   2    -45.6528539 -0.486793E-10  0.662E-05    3.01     290.9  T
   3    -45.6528539 -0.112422E-09  0.444E-05    3.01     433.4  T

   *** convergence criteria satisfied after 3 iterations ***

         #    Occupation            Energy/Eh            Energy/eV
      -------------------------------------------------------------
         1        2.0000           -0.7515548             -20.4508
       ...           ...                  ...                  ...
        34        2.0000           -0.4567993             -12.4301
        35        2.0000           -0.4534907             -12.3401
        36        2.0000           -0.4438085             -12.0766
        37        2.0000           -0.4252838             -11.5726
        38        2.0000           -0.4217830             -11.4773
        39        2.0000           -0.4095954             -11.1457
        40        2.0000           -0.3971532             -10.8071 (HOMO)
        41                         -0.2864592              -7.7950 (LUMO)
        42                         -0.2383491              -6.4858
        43                         -0.2234451              -6.0802
        44                         -0.2225023              -6.0546
        45                         -0.1728938              -4.7047
       ...                                ...                  ...
        77                          0.6666597              18.1407
      -------------------------------------------------------------
                  HL-Gap            0.1106940 Eh            3.0121 eV
             Fermi-level           -0.3418062 Eh           -9.3010 eV

 SCC (total)                   0 d,  0 h,  0 min,  0.035 sec
 SCC setup                      ...        0 min,  0.000 sec (  0.657%)
 Dispersion                     ...        0 min,  0.000 sec (  0.689%)
 integral evaluation            ...        0 min,  0.011 sec ( 32.884%)
 zeroth order Hamiltonian       ...        0 min,  0.000 sec (  0.588%)
 iterations                     ...        0 min,  0.005 sec ( 13.451%)
 molecular gradient             ...        0 min,  0.017 sec ( 50.503%)
 printout                       ...        0 min,  0.000 sec (  1.080%)

         :::::::::::::::::::::::::::::::::::::::::::::::::::::
         ::                     SUMMARY                     ::
         :::::::::::::::::::::::::::::::::::::::::::::::::::::
         :: total energy             -45.099235764074 Eh    ::
         :: gradient norm              0.000722636779 Eh/a0 ::
         :: HOMO-LUMO gap              3.012136354961 eV    ::
         ::.................................................::
         :: SCC energy               -45.652853871099 Eh    ::
         :: -> isotropic ES            0.073253660992 Eh    ::
         :: -> anisotropic ES          0.003894844840 Eh    ::
         :: -> anisotropic XC          0.010376914011 Eh    ::
         :: -> dispersion             -0.029986475900 Eh    ::
         :: repulsion energy           0.553285231421 Eh    ::
         :: add. restraining           0.000000000000 Eh    ::
         :::::::::::::::::::::::::::::::::::::::::::::::::::::

           -------------------------------------------------
          |                Property Printout                |
           -------------------------------------------------

    * Orbital Energies and Occupations

         #    Occupation            Energy/Eh            Energy/eV
      -------------------------------------------------------------
         1        2.0000           -0.7515548             -20.4508
       ...           ...                  ...                  ...
        28        2.0000           -0.4944257             -13.4540
        29        2.0000           -0.4817808             -13.1099
        30        2.0000           -0.4805177             -13.0756
        31        2.0000           -0.4678678             -12.7313
        32        2.0000           -0.4665235             -12.6947
        33        2.0000           -0.4589212             -12.4879
        34        2.0000           -0.4567993             -12.4301
        35        2.0000           -0.4534907             -12.3401
        36        2.0000           -0.4438085             -12.0766
        37        2.0000           -0.4252838             -11.5726
        38        2.0000           -0.4217830             -11.4773
        39        2.0000           -0.4095954             -11.1457
        40        2.0000           -0.3971532             -10.8071 (HOMO)
        41                         -0.2864592              -7.7950 (LUMO)
        42                         -0.2383491              -6.4858
        43                         -0.2234451              -6.0802
        44                         -0.2225023              -6.0546
        45                         -0.1728938              -4.7047
        46                         -0.1356836              -3.6921
        47                         -0.0226170              -0.6154
        48                          0.0112860               0.3071
        49                          0.0131674               0.3583
        50                          0.0432527               1.1770
        51                          0.0599359               1.6309
       ...                                ...                  ...
        77                          0.6666597              18.1407
      -------------------------------------------------------------
                  HL-Gap            0.1106940 Eh            3.0121 eV
             Fermi-level           -0.3418062 Eh           -9.3010 eV

     #   Z        covCN         q      C6AA      α(0)
     1   6 C      2.934    -0.037    28.916     8.819
     2  16 S      2.341    -0.019   141.843    20.045
     3   6 C      2.983     0.008    27.830     8.653
     4   6 C      3.146    -0.037    28.656     8.758
     5   6 C      3.162    -0.017    28.107     8.666
     6   6 C      3.857    -0.057    21.565     6.604
     7   6 C      2.692     0.357    20.933     7.488
     8   8 O      0.856    -0.367    21.030     6.148
     9   8 O      1.659    -0.372    20.312     6.084
    10   6 C      3.811    -0.056    21.567     6.610
    11   6 C      3.806    -0.063    21.714     6.634
    12   6 C      3.729     0.123    18.673     6.169
    13   8 O      1.656    -0.444    21.727     6.292
    14   6 C      2.943    -0.033    28.823     8.805
    15   6 C      2.836    -0.094    30.354     9.029
    16   1 H      0.926     0.050     2.326     2.385
    17   1 H      0.924     0.067     2.113     2.273
    18   1 H      0.804     0.321     0.660     1.276
    19   1 H      0.924     0.065     2.146     2.291
    20   1 H      0.924     0.054     2.275     2.359
    21   1 H      0.925     0.062     2.173     2.305
    22   1 H      0.924     0.036     2.498     2.472
    23   1 H      0.923     0.018     2.765     2.600
    24   1 H      0.805     0.292     0.747     1.358
    25   1 H      0.925     0.048     2.349     2.397
    26   1 H      0.926     0.049     2.328     2.386
    27   1 H      0.926     0.048     2.351     2.398

 Mol. C6AA /au·bohr⁶  :       9477.094686
 Mol. C8AA /au·bohr⁸  :     248559.619790
 Mol. α(0) /au        :        151.304122


Wiberg/Mayer (AO) data.
largest (>0.10) Wiberg bond orders for each atom
          total WBO             WBO to atom ...
     1  C   3.949        C    5 1.559    S    2 1.210    H   16 0.969
     2  S   2.636        C    1 1.210    C    3 1.137
     3  C   3.948        C    4 1.498    S    2 1.137    C   14 1.133
     4  C   3.982        C    3 1.498    C    5 1.245    C   12 0.985
     5  C   3.985        C    1 1.559    C    4 1.245    C    6 1.002
     6  C   3.994        C    5 1.002    C   10 0.970    H   17 0.948    C    7 0.932
     7  C   3.915        O    8 1.797    O    9 1.130    C    6 0.932
     8  O   2.079        C    7 1.797    O    9 0.164
     9  O   2.208        C    7 1.130    H   18 0.856    O    8 0.164
    10  C   3.991        C   11 1.012    H   20 0.974    H   19 0.972    C    6 0.970
    11  C   3.995        C   10 1.012    C   12 0.991    H   22 0.975    H   21 0.971
    12  C   3.959        C   11 0.991    C    4 0.985    O   13 0.977    H   23 0.949
    13  O   1.961        C   12 0.977    H   24 0.893
    14  C   3.990        C   15 1.863    C    3 1.133    H   25 0.962
    15  C   3.990        C   14 1.863    H   27 0.976    H   26 0.967
    16  H   0.997        C    1 0.969
    17  H   0.995        C    6 0.948
    18  H   0.897        O    9 0.856
    19  H   0.996        C   10 0.972
    20  H   0.996        C   10 0.974
    21  H   0.995        C   11 0.971
    22  H   0.999        C   11 0.975
    23  H   0.999        C   12 0.949
    24  H   0.915        O   13 0.893
    25  H   0.997        C   14 0.962
    26  H   0.998        C   15 0.967
    27  H   0.997        C   15 0.976

molecular dipole:
                 x           y           z       tot (Debye)
 q only:        0.969       1.191       0.580
   full:        1.243       1.421       0.705       5.122
molecular quadrupole (traceless):
                xx          xy          yy          xz          yz          zz
 q only:        1.965      -4.872      -1.350      -4.076      -9.402      -0.615
  q+dip:        0.858      -6.887       1.601      -3.985     -11.805      -2.459
   full:        0.131      -7.043       0.880      -4.027     -11.746      -1.011

           -------------------------------------------------
          |                Geometry Summary                 |
           -------------------------------------------------

      molecular mass/u    :      224.2740000
   center of mass at/Å    :        0.0014420       0.0388828      -0.2713177
  moments of inertia/u·Å² :        0.5924355E+03   0.1117971E+04   0.1487385E+04
rotational constants/cm⁻¹ :        0.2845480E-01   0.1507878E-01   0.1133374E-01

 * 25 selected distances

     #   Z        #   Z                                     value/Å
     1   6 C      2  16 S                                 1.7105528
     2  16 S      3   6 C                                 1.7458508 (max)
     3   6 C      4   6 C                                 1.3780319
     1   6 C      5   6 C                                 1.3649904
     4   6 C      5   6 C                                 1.4221860
     5   6 C      6   6 C                                 1.4964064
     7   6 C      8   8 O                                 1.1955970
     7   6 C      9   8 O                                 1.3403895
     6   6 C     10   6 C                                 1.5363586
    10   6 C     11   6 C                                 1.5240513
    11   6 C     12   6 C                                 1.5308199
    12   6 C     13   8 O                                 1.4178822
    14   6 C     15   6 C                                 1.3311628
     1   6 C     16   1 H                                 1.0721670
     6   6 C     17   1 H                                 1.0944671
     9   8 O     18   1 H                                 0.9707026
    10   6 C     19   1 H                                 1.0908807
    10   6 C     20   1 H                                 1.0902085
    11   6 C     21   1 H                                 1.0900569
    11   6 C     22   1 H                                 1.0914450
    12   6 C     23   1 H                                 1.1041869
    13   8 O     24   1 H                                 0.9639922 (min)
    14   6 C     25   1 H                                 1.0835037
    15   6 C     26   1 H                                 1.0747495
    15   6 C     27   1 H                                 1.0764466

 * 5 distinct bonds (by element types)

   Z      Z             #   av. dist./Å        max./Å        min./Å
   1 H    6 C          10     1.0868112     1.1041869     1.0721670
   6 C    6 C           8     1.4480009     1.5363586     1.3311628
   1 H    8 O           2     0.9673474     0.9707026     0.9639922
   6 C    8 O           3     1.3179562     1.4178822     1.1955970
   6 C   16 S           2     1.7282018     1.7458508     1.7105528


optimized geometry written to: xtbopt.xyz


           -------------------------------------------------
          | TOTAL ENERGY              -45.099235764074 Eh   |
          | GRADIENT NORM               0.000722636779 Eh/α |
          | HOMO-LUMO GAP               3.012136354961 eV   |
           -------------------------------------------------

------------------------------------------------------------------------
 * finished run on 2021/05/19 at 10:59:09.792     
------------------------------------------------------------------------
 total:
 * wall-time:     0 d,  0 h,  0 min,  1.574 sec
 *  cpu-time:     0 d,  0 h,  0 min,  1.560 sec
 * ratio c/w:     0.991 speedup
 SCF:
 * wall-time:     0 d,  0 h,  0 min,  0.048 sec
 *  cpu-time:     0 d,  0 h,  0 min,  0.048 sec
 * ratio c/w:     1.000 speedup
 ANC optimizer:
 * wall-time:     0 d,  0 h,  0 min,  1.500 sec
 *  cpu-time:     0 d,  0 h,  0 min,  1.487 sec
 * ratio c/w:     0.991 speedup

