      -----------------------------------------------------------      
     |                   =====================                   |     
     |                           x T B                           |     
     |                   =====================                   |     
     |                         S. Grimme                         |     
     |          Mulliken Center for Theoretical Chemistry        |     
     |                    University of Bonn                     |     
     |                Version 6.2 RC2 (SAW190805)                |     
      -----------------------------------------------------------      

   This program is distributed in the hope that it will be useful,
   but WITHOUT ANY WARRANTY; without even the implied warranty of
   MERCHANTABILITY or FITNESS FOR A PARTICULAR PURPOSE.
   
   FOR NON-COMMERCIAL, ACADEMIA USE ONLY.
   
   Cite this work as:
   * S. Grimme, C. Bannwarth, P. Shushkov, J. Chem. Theory Comput., 2017,
     13, 1989-2009. DOI: 10.1021/acs.jctc.7b00118
   * C. Bannwarth, S. Ehlert and S. Grimme., J. Chem. Theory Comput., 2019,
     15, 1652-1671. DOI: 10.1021/acs.jctc.8b01176
   * P. Pracht, E. Caldeweyher, S. Ehlert, S. Grimme, ChemRxiv, 2019, preprint.
     DOI: 10.26434/chemrxiv.8326202.v1
   
   for DFT-D4:
   * E. Caldeweyher, C. Bannwarth and S. Grimme, J. Chem. Phys., 2017,
     147, 034112. DOI: 10.1063/1.4993215
   * E. Caldeweyher, S. Ehlert, A. Hansen, H. Neugebauer, S. Spicher,
     C. Bannwarth and S. Grimme, J. Chem. Phys., 2019, 150, 154122.
     DOI: 10.1063/1.5090222
   
   for sTDA-xTB:
   * S. Grimme and C. Bannwarth, J. Chem. Phys., 2016, 145, 054103.
     DOI: 10.1063/1.4959605
   
   in the mass-spec context:
   * V. Asgeirsson, C. Bauer and S. Grimme, Chem. Sci., 2017, 8, 4879.
     DOI: 10.1039/c7sc00601b
   
   for metadynamics refer to:
   * S. Grimme, J. Chem. Theory Comput., 2019, 155, 2847-2862
     DOI: 10.1021/acs.jctc.9b00143
   
   with help from (in alphabetical order)
   C. Bannwarth, F. Bohle, G. Brandenburg, E. Caldeweyher, M. Checinski,
   S. Dohm, S. Ehlert, S. Ehrlich, F. März, H. Neugebauer, J. Pisarek,
   P. Pracht, P. Shushkov, and S. Spicher.
   
 * started run on 2021/05/19 at 10:58:11.433     

           -------------------------------------------------
          |                Calculation Setup                |
           -------------------------------------------------

          program call               : /ihome/ghutchison/geoffh/xtb/xtb 15.xyz -opt
          hostname                   : smp-n58
          coordinate file            : 15.xyz
          omp threads                :                     1
          number of atoms            :                    21
          number of electrons        :                    66
          charge                     :                     0
          spin                       :                   0.0
          first test random number   :      0.28695460240875


########################################################################
# WARNING! Please study the warnings concerning your input carefully
#  - the use of '-opt' is discouraged, please use '--opt' next time
########################################################################

           ------------------------------------------------- 
          |                 G F N 2 - x T B                 |
          | Geometry, Frequencies, Noncovalent interactions |
          |            JCTC 2019 parametrisation            |
           ------------------------------------------------- 
             KAB for C  - Si     :                1.0500
             KAB for H  - Pd     :                0.9500
             k(s)              :                1.8500
             k(p)              :                2.2300
             k(d)              :                2.2300
             k(f)              :                2.0000
             kEN (H0ij)        :               -2.0000
             D4 a1             :                0.5200
             D4 a2             :                5.0000
             D4 s6             :                1.0000
             D4 s8             :                2.7000
             D4 s9             :                5.0000
             alphaj            :                2.0000

  Z AO/shell   Hii/eV     exponent
  1     Wed Apr 25 08:07:45 CEST 2018   EN: 2.200 GM2: 0.406  GM3: 0.0800  RAES: 1.40
     1s    -10.707211    1.230000
  6     Wed Apr 25 08:07:45 CEST 2018   EN: 2.550 GM2: 0.538  GM3: 0.1500  RAES: 3.00
     2s    -13.970922    2.096432
     2p    -10.063292    1.800000
  8     Wed Apr 25 08:07:45 CEST 2018   EN: 3.440 GM2: 0.452  GM3:-0.0517  RAES: 1.80
     2s    -20.229985    2.439742
     2p    -15.503117    2.137023
 16     Tue Apr 24 11:44:34 CEST 2018   EN: 2.580 GM2: 0.340  GM3:-0.0502  RAES: 3.10
     3s    -20.029654    1.981333
     3p    -11.377694    2.025643
     3d     -0.420282    1.702555

           ------------------------------------------------- 
          |        Self-Consistent Charge Iterations        |
           ------------------------------------------------- 

          ...................................................
          :                      SETUP                      :
          :.................................................:
          :  # basis functions                  66          :
          :  # atomic orbitals                  65          :
          :  # shells                           35          :
          :  # electrons                        66          :
          :  max. iterations                   250          :
          :  Hamiltonian                  GFN2-xTB          :
          :  restarted?                      false          :
          :  GBSA solvation                  false          :
          :  PC potential                    false          :
          :  electronic temp.          300.0000000     K    :
          :  accuracy                    1.0000000          :
          :  -> integral cutoff          0.2500000E+02      :
          :  -> integral neglect         0.1000000E-07      :
          :  -> SCF convergence          0.1000000E-05 Eh   :
          :  -> wf. convergence          0.1000000E-03 e    :
          :  Broyden damping             0.4000000          :
          ...................................................

 iter      E             dE          RMSdq      gap      omega  full diag
   1    -37.2243093 -0.372243E+02  0.484E+00    2.51       0.0  T
   2    -37.2607076 -0.363983E-01  0.255E+00    2.00       1.0  T
   3    -37.2551638  0.554381E-02  0.166E+00    2.30       1.0  T
   4    -37.2750974 -0.199337E-01  0.284E-01    1.94       1.0  T
   5    -37.2753940 -0.296565E-03  0.160E-01    2.00       1.0  T
   6    -37.2757107 -0.316660E-03  0.528E-02    2.00       1.0  T
   7    -37.2757237 -0.129868E-04  0.217E-02    2.00       1.0  T
   8    -37.2757259 -0.225632E-05  0.136E-02    2.00       1.6  T
   9    -37.2757273 -0.139149E-05  0.209E-03    2.00      10.4  T
  10    -37.2757273 -0.109845E-07  0.121E-03    2.00      18.1  T
  11    -37.2757273 -0.188957E-08  0.533E-04    2.00      40.9  T
  12    -37.2757273 -0.387212E-08  0.280E-04    2.00      77.8  T

   *** convergence criteria satisfied after 12 iterations ***

         #    Occupation            Energy/Eh            Energy/eV
      -------------------------------------------------------------
         1        2.0000           -0.7485006             -20.3677
       ...           ...                  ...                  ...
        27        2.0000           -0.4692984             -12.7703
        28        2.0000           -0.4577970             -12.4573
        29        2.0000           -0.4511672             -12.2769
        30        2.0000           -0.4433383             -12.0638
        31        2.0000           -0.4074572             -11.0875
        32        2.0000           -0.3987164             -10.8496
        33        2.0000           -0.3923494             -10.6764 (HOMO)
        34                         -0.3189369              -8.6787 (LUMO)
        35                         -0.2782303              -7.5710
        36                         -0.2440146              -6.6400
        37                         -0.2234778              -6.0811
        38                         -0.2134896              -5.8093
       ...                                ...                  ...
        65                          0.6551717              17.8281
      -------------------------------------------------------------
                  HL-Gap            0.0734126 Eh            1.9977 eV
             Fermi-level           -0.3556431 Eh           -9.6775 eV

 SCC (total)                   0 d,  0 h,  0 min,  0.033 sec
 SCC setup                      ...        0 min,  0.000 sec (  0.766%)
 Dispersion                     ...        0 min,  0.000 sec (  0.815%)
 integral evaluation            ...        0 min,  0.008 sec ( 23.855%)
 zeroth order Hamiltonian       ...        0 min,  0.000 sec (  0.424%)
 iterations                     ...        0 min,  0.012 sec ( 35.985%)
 molecular gradient             ...        0 min,  0.012 sec ( 37.172%)
 printout                       ...        0 min,  0.000 sec (  0.855%)

         :::::::::::::::::::::::::::::::::::::::::::::::::::::
         ::                     SUMMARY                     ::
         :::::::::::::::::::::::::::::::::::::::::::::::::::::
         :: total energy             -36.800031354514 Eh    ::
         :: gradient norm              0.082249150288 Eh/a0 ::
         :: HOMO-LUMO gap              1.997657500925 eV    ::
         ::.................................................::
         :: SCC energy               -37.275727322932 Eh    ::
         :: -> isotropic ES            0.046742926091 Eh    ::
         :: -> anisotropic ES          0.001384034196 Eh    ::
         :: -> anisotropic XC          0.013657383616 Eh    ::
         :: -> dispersion             -0.021974007148 Eh    ::
         :: repulsion energy           0.475570777973 Eh    ::
         :: add. restraining           0.000000000000 Eh    ::
         :::::::::::::::::::::::::::::::::::::::::::::::::::::

      ----------------------------------------------------------- 
     |                   =====================                   |
     |                        A N C O P T                        |
     |                   =====================                   |
     |               Approximate Normal Coordinate               |
     |                Rational Function Optimizer                |
      ----------------------------------------------------------- 

          ...................................................
          :                      SETUP                      :
          :.................................................:
          :   optimization level            normal          :
          :   max. optcycles                   200          :
          :   ANC micro-cycles                  20          :
          :   degrees of freedom                57          :
          :.................................................:
          :   RF solver                   davidson          :
          :   input Hessian                  false          :
          :   write xtbopt.log                true          :
          :   linear?                        false          :
          :   energy convergence         0.5000000E-05 Eh   :
          :   grad. convergence          0.1000000E-02 Eh/α :
          :   maximium RF displ.         2.0000000          :
          :   Hlow (freq-cutoff)         0.5000000E-02      :
          :   Hmax (freq-cutoff)         5.0000000          :
          :   S6 in model hess.         20.0000000          :
          ...................................................

generating ANC from model Hessian ...
Using Lindh-Hessian (1995)
 Shifting diagonal of input Hessian by   3.237380086769906E-003
 Lowest  eigenvalues of input Hessian
   -0.000000   -0.000000   -0.000000    0.000000    0.000000    0.000000
    0.005000    0.007191    0.008964    0.010472    0.012134    0.018794
    0.020160    0.024899    0.029031    0.038422    0.040775    0.044780
 Highest eigenvalues
    1.640763    1.777109    1.824648    1.974954    2.078325    2.082710
 

........................................................................
.............................. CYCLE    1 ..............................
........................................................................
   1    -37.2757273 -0.372757E+02  0.118E-04    2.00       0.0  T
   2    -37.2757273 -0.656968E-10  0.855E-05    2.00     255.3  T
   3    -37.2757273 -0.473932E-10  0.520E-05    2.00     419.9  T
     SCC iter.                  ...        0 min,  0.003 sec
     gradient                   ...        0 min,  0.011 sec
 * total energy  :   -36.8000314 Eh     change       -0.2148158E-07 Eh
   gradient norm :     0.0822482 Eh/α   predicted     0.0000000E+00 (-100.00%)
   displ. norm   :     0.1856974 α      lambda       -0.6702597E-02
   maximum displ.:     0.0680861 α      in ANC's #2, #23, #3, ...

........................................................................
.............................. CYCLE    2 ..............................
........................................................................
   1    -37.3007519 -0.373008E+02  0.248E-01    2.20       0.0  T
   2    -37.3008151 -0.632246E-04  0.142E-01    2.17       1.0  T
   3    -37.3007543  0.608302E-04  0.854E-02    2.17       1.0  T
   4    -37.3008570 -0.102713E-03  0.260E-02    2.16       1.0  T
   5    -37.3008609 -0.388857E-05  0.116E-02    2.16       1.9  T
   6    -37.3008616 -0.726543E-06  0.496E-03    2.16       4.4  T
   7    -37.3008620 -0.386484E-06  0.147E-03    2.16      14.8  T
     SCC iter.                  ...        0 min,  0.006 sec
     gradient                   ...        0 min,  0.011 sec
 * total energy  :   -36.8042312 Eh     change       -0.4199793E-02 Eh
   gradient norm :     0.0238864 Eh/α   predicted    -0.3466874E-02 ( -17.45%)
   displ. norm   :     0.2254160 α      lambda       -0.1562917E-02
   maximum displ.:     0.1372560 α      in ANC's #7, #4, #2, ...

........................................................................
.............................. CYCLE    3 ..............................
........................................................................
   1    -37.3088936 -0.373089E+02  0.184E-01    2.25       0.0  T
   2    -37.3089149 -0.212881E-04  0.106E-01    2.24       1.0  T
   3    -37.3088791  0.357301E-04  0.557E-02    2.23       1.0  T
   4    -37.3089263 -0.471943E-04  0.173E-02    2.23       1.3  T
   5    -37.3089285 -0.219343E-05  0.770E-03    2.23       2.8  T
   6    -37.3089289 -0.435017E-06  0.254E-03    2.23       8.6  T
   7    -37.3089290 -0.838339E-07  0.106E-03    2.23      20.6  T
     SCC iter.                  ...        0 min,  0.006 sec
     gradient                   ...        0 min,  0.010 sec
 * total energy  :   -36.8051682 Eh     change       -0.9370746E-03 Eh
   gradient norm :     0.0083758 Eh/α   predicted    -0.8211671E-03 ( -12.37%)
   displ. norm   :     0.2279263 α      lambda       -0.6440094E-03
   maximum displ.:     0.1354271 α      in ANC's #7, #4, #2, ...

........................................................................
.............................. CYCLE    4 ..............................
........................................................................
   1    -37.3074391 -0.373074E+02  0.192E-01    2.26       0.0  T
   2    -37.3074455 -0.643821E-05  0.115E-01    2.27       1.0  T
   3    -37.3074311  0.144343E-04  0.322E-02    2.27       1.0  T
   4    -37.3074495 -0.184518E-04  0.106E-02    2.27       2.1  T
   5    -37.3074502 -0.668619E-06  0.482E-03    2.27       4.5  T
   6    -37.3074503 -0.143353E-06  0.220E-03    2.27       9.9  T
   7    -37.3074504 -0.379290E-07  0.110E-03    2.27      19.9  T
     SCC iter.                  ...        0 min,  0.006 sec
     gradient                   ...        0 min,  0.010 sec
 * total energy  :   -36.8056839 Eh     change       -0.5156819E-03 Eh
   gradient norm :     0.0091748 Eh/α   predicted    -0.3387355E-03 ( -34.31%)
   displ. norm   :     0.4446394 α      lambda       -0.9597054E-03
   maximum displ.:     0.2854026 α      in ANC's #7, #4, #2, ...

........................................................................
.............................. CYCLE    5 ..............................
........................................................................
   1    -37.3008228 -0.373008E+02  0.372E-01    2.30       0.0  T
   2    -37.3008449 -0.221044E-04  0.223E-01    2.32       1.0  T
   3    -37.3008535 -0.853634E-05  0.261E-02    2.32       1.0  T
   4    -37.3008561 -0.264025E-05  0.154E-02    2.32       1.4  T
   5    -37.3008571 -0.998195E-06  0.848E-03    2.32       2.6  T
   6    -37.3008578 -0.702725E-06  0.294E-03    2.32       7.4  T
   7    -37.3008578 -0.847918E-08  0.159E-03    2.32      13.8  T
     SCC iter.                  ...        0 min,  0.006 sec
     gradient                   ...        0 min,  0.010 sec
 * total energy  :   -36.8062960 Eh     change       -0.6121136E-03 Eh
   gradient norm :     0.0184559 Eh/α   predicted    -0.5747226E-03 (  -6.11%)
   displ. norm   :     0.2172696 α      lambda       -0.4876758E-03
   maximum displ.:     0.1411176 α      in ANC's #7, #2, #1, ...

........................................................................
.............................. CYCLE    6 ..............................
........................................................................
   1    -37.3007223 -0.373007E+02  0.182E-01    2.36       0.0  T
   2    -37.3007277 -0.546064E-05  0.110E-01    2.36       1.0  T
   3    -37.3007157  0.120150E-04  0.300E-02    2.36       1.0  T
   4    -37.3007317 -0.159726E-04  0.782E-03    2.36       2.8  T
   5    -37.3007318 -0.138083E-06  0.467E-03    2.36       4.7  T
   6    -37.3007320 -0.178047E-06  0.169E-03    2.36      12.9  T
   7    -37.3007320 -0.560795E-08  0.784E-04    2.36      27.8  T
     SCC iter.                  ...        0 min,  0.006 sec
     gradient                   ...        0 min,  0.010 sec
 * total energy  :   -36.8066752 Eh     change       -0.3791407E-03 Eh
   gradient norm :     0.0163897 Eh/α   predicted    -0.2553524E-03 ( -32.65%)
   displ. norm   :     0.2837118 α      lambda       -0.8703307E-03
   maximum displ.:     0.1779591 α      in ANC's #7, #1, #2, ...

........................................................................
.............................. CYCLE    7 ..............................
........................................................................
   1    -37.3060682 -0.373061E+02  0.244E-01    2.45       0.0  T
   2    -37.3060864 -0.182346E-04  0.147E-01    2.44       1.0  T
   3    -37.3060309  0.555006E-04  0.639E-02    2.45       1.0  T
   4    -37.3060998 -0.689477E-04  0.142E-02    2.45       1.5  T
   5    -37.3061011 -0.122208E-05  0.766E-03    2.44       2.8  T
   6    -37.3061015 -0.401407E-06  0.299E-03    2.44       7.3  T
   7    -37.3061015 -0.331919E-07  0.153E-03    2.44      14.2  T
     SCC iter.                  ...        0 min,  0.006 sec
     gradient                   ...        0 min,  0.010 sec
 * total energy  :   -36.8071765 Eh     change       -0.5013137E-03 Eh
   gradient norm :     0.0082925 Eh/α   predicted    -0.4701932E-03 (  -6.21%)
   displ. norm   :     0.2573361 α      lambda       -0.3183380E-03
   maximum displ.:     0.1919931 α      in ANC's #7, #4, #1, ...

........................................................................
.............................. CYCLE    8 ..............................
........................................................................
   1    -37.3056201 -0.373056E+02  0.231E-01    2.49       0.0  T
   2    -37.3056292 -0.914698E-05  0.140E-01    2.50       1.0  T
   3    -37.3056158  0.134671E-04  0.364E-02    2.50       1.0  T
   4    -37.3056355 -0.197448E-04  0.110E-02    2.50       2.0  T
   5    -37.3056358 -0.318580E-06  0.579E-03    2.50       3.8  T
   6    -37.3056361 -0.242006E-06  0.224E-03    2.50       9.8  T
   7    -37.3056361 -0.422278E-08  0.113E-03    2.50      19.3  T
     SCC iter.                  ...        0 min,  0.007 sec
     gradient                   ...        0 min,  0.011 sec
 * total energy  :   -36.8073543 Eh     change       -0.1778261E-03 Eh
   gradient norm :     0.0115876 Eh/α   predicted    -0.1697137E-03 (  -4.56%)
   displ. norm   :     0.0815072 α      lambda       -0.1626067E-03
   maximum displ.:     0.0550237 α      in ANC's #3, #7, #5, ...

........................................................................
.............................. CYCLE    9 ..............................
........................................................................
   1    -37.3097846 -0.373098E+02  0.693E-02    2.55       0.0  T
   2    -37.3097886 -0.401332E-05  0.407E-02    2.54       1.0  T
   3    -37.3097866  0.199006E-05  0.166E-02    2.54       1.3  T
   4    -37.3097895 -0.281109E-05  0.567E-03    2.54       3.9  T
   5    -37.3097897 -0.257411E-06  0.275E-03    2.54       7.9  T
   6    -37.3097898 -0.491067E-07  0.113E-03    2.54      19.3  T
     SCC iter.                  ...        0 min,  0.006 sec
     gradient                   ...        0 min,  0.010 sec
 * total energy  :   -36.8074286 Eh     change       -0.7430419E-04 Eh
   gradient norm :     0.0054344 Eh/α   predicted    -0.8186656E-04 (  10.18%)
   displ. norm   :     0.1840034 α      lambda       -0.1723387E-03
   maximum displ.:     0.1206176 α      in ANC's #7, #4, #2, ...

........................................................................
.............................. CYCLE   10 ..............................
........................................................................
   1    -37.3085836 -0.373086E+02  0.179E-01    2.58       0.0  T
   2    -37.3085946 -0.109434E-04  0.108E-01    2.58       1.0  T
   3    -37.3085906  0.392948E-05  0.260E-02    2.59       1.0  T
   4    -37.3085983 -0.768791E-05  0.101E-02    2.59       2.2  T
   5    -37.3085988 -0.479237E-06  0.537E-03    2.59       4.1  T
   6    -37.3085991 -0.282845E-06  0.234E-03    2.59       9.3  T
   7    -37.3085991 -0.194921E-07  0.800E-04    2.59      27.3  T
     SCC iter.                  ...        0 min,  0.007 sec
     gradient                   ...        0 min,  0.011 sec
 * total energy  :   -36.8074657 Eh     change       -0.3706820E-04 Eh
   gradient norm :     0.0100082 Eh/α   predicted    -0.8908880E-04 ( 140.34%)
   displ. norm   :     0.0454248 α      lambda       -0.1035321E-03
   maximum displ.:     0.0246802 α      in ANC's #1, #4, #6, ...

........................................................................
.............................. CYCLE   11 ..............................
........................................................................
   1    -37.3083699 -0.373084E+02  0.480E-02    2.58       0.0  T
   2    -37.3083748 -0.484892E-05  0.290E-02    2.58       1.0  T
   3    -37.3083743  0.468501E-06  0.125E-02    2.58       1.8  T
   4    -37.3083754 -0.113938E-05  0.321E-03    2.58       6.8  T
   5    -37.3083755 -0.387969E-07  0.163E-03    2.58      13.4  T
   6    -37.3083755 -0.211736E-07  0.933E-04    2.58      23.4  T
     SCC iter.                  ...        0 min,  0.006 sec
     gradient                   ...        0 min,  0.011 sec
 * total energy  :   -36.8075054 Eh     change       -0.3968552E-04 Eh
   gradient norm :     0.0062877 Eh/α   predicted    -0.5187839E-04 (  30.72%)
   displ. norm   :     0.0656961 α      lambda       -0.6503185E-04
   maximum displ.:     0.0343255 α      in ANC's #7, #1, #4, ...

........................................................................
.............................. CYCLE   12 ..............................
........................................................................
   1    -37.3098021 -0.373098E+02  0.514E-02    2.59       0.0  T
   2    -37.3098035 -0.139891E-05  0.301E-02    2.58       1.0  T
   3    -37.3098034  0.623148E-07  0.659E-03    2.58       3.3  T
   4    -37.3098037 -0.287911E-06  0.292E-03    2.58       7.5  T
   5    -37.3098037 -0.383403E-07  0.159E-03    2.58      13.7  T
     SCC iter.                  ...        0 min,  0.005 sec
     gradient                   ...        0 min,  0.012 sec
 * total energy  :   -36.8075190 Eh     change       -0.1360246E-04 Eh
   gradient norm :     0.0035333 Eh/α   predicted    -0.3265748E-04 ( 140.09%)
   displ. norm   :     0.0648998 α      lambda       -0.3994960E-04
   maximum displ.:     0.0427661 α      in ANC's #7, #2, #3, ...

........................................................................
.............................. CYCLE   13 ..............................
........................................................................
   1    -37.3087381 -0.373087E+02  0.588E-02    2.59       0.0  T
   2    -37.3087387 -0.547498E-06  0.355E-02    2.60       1.0  T
   3    -37.3087386  0.446724E-07  0.576E-03    2.60       3.8  T
   4    -37.3087390 -0.371359E-06  0.275E-03    2.60       7.9  T
   5    -37.3087390 -0.342805E-07  0.107E-03    2.60      20.4  T
   6    -37.3087390 -0.942753E-08  0.524E-04    2.60      41.6  T
   7    -37.3087390 -0.815980E-09  0.226E-04    2.60      96.4  T
     SCC iter.                  ...        0 min,  0.007 sec
     gradient                   ...        0 min,  0.012 sec
 * total energy  :   -36.8075452 Eh     change       -0.2626984E-04 Eh
   gradient norm :     0.0013161 Eh/α   predicted    -0.2006228E-04 ( -23.63%)
   displ. norm   :     0.1140645 α      lambda       -0.2480504E-04
   maximum displ.:     0.0666426 α      in ANC's #7, #2, #5, ...

........................................................................
.............................. CYCLE   14 ..............................
........................................................................
   1    -37.3080454 -0.373080E+02  0.107E-01    2.62       0.0  T
   2    -37.3080475 -0.209018E-05  0.654E-02    2.62       1.0  T
   3    -37.3080474  0.509744E-07  0.106E-02    2.63       2.1  T
   4    -37.3080487 -0.131163E-05  0.478E-03    2.62       4.6  T
   5    -37.3080488 -0.992862E-07  0.245E-03    2.62       8.9  T
   6    -37.3080489 -0.412417E-07  0.965E-04    2.62      22.6  T
   7    -37.3080489 -0.283981E-08  0.411E-04    2.62      53.1  T
     SCC iter.                  ...        0 min,  0.006 sec
     gradient                   ...        0 min,  0.011 sec
 * total energy  :   -36.8075591 Eh     change       -0.1385905E-04 Eh
   gradient norm :     0.0040601 Eh/α   predicted    -0.1247852E-04 (  -9.96%)
   displ. norm   :     0.0395834 α      lambda       -0.1946326E-04
   maximum displ.:     0.0285175 α      in ANC's #1, #4, #2, ...

........................................................................
.............................. CYCLE   15 ..............................
........................................................................
   1    -37.3083341 -0.373083E+02  0.231E-02    2.63       0.0  T
   2    -37.3083343 -0.159331E-06  0.137E-02    2.63       1.6  T
   3    -37.3083342  0.933111E-07  0.321E-03    2.63       6.8  T
   4    -37.3083343 -0.119916E-06  0.109E-03    2.63      20.0  T
   5    -37.3083343 -0.913232E-08  0.505E-04    2.63      43.2  T
     SCC iter.                  ...        0 min,  0.005 sec
     gradient                   ...        0 min,  0.010 sec
 * total energy  :   -36.8075720 Eh     change       -0.1285496E-04 Eh
   gradient norm :     0.0019981 Eh/α   predicted    -0.9748561E-05 ( -24.17%)
   displ. norm   :     0.0750917 α      lambda       -0.1429730E-04
   maximum displ.:     0.0590375 α      in ANC's #1, #4, #5, ...

........................................................................
.............................. CYCLE   16 ..............................
........................................................................
   1    -37.3090056 -0.373090E+02  0.428E-02    2.63       0.0  T
   2    -37.3090058 -0.217233E-06  0.256E-02    2.63       1.0  T
   3    -37.3090054  0.373769E-06  0.554E-03    2.63       3.9  T
   4    -37.3090059 -0.481213E-06  0.157E-03    2.63      13.9  T
   5    -37.3090059 -0.793606E-08  0.849E-04    2.63      25.7  T
   6    -37.3090059 -0.789689E-08  0.280E-04    2.63      77.9  T
     SCC iter.                  ...        0 min,  0.005 sec
     gradient                   ...        0 min,  0.011 sec
 * total energy  :   -36.8075817 Eh     change       -0.9729243E-05 Eh
   gradient norm :     0.0023408 Eh/α   predicted    -0.7169531E-05 ( -26.31%)
   displ. norm   :     0.0178807 α      lambda       -0.5261665E-05
   maximum displ.:     0.0129668 α      in ANC's #1, #5, #4, ...

........................................................................
.............................. CYCLE   17 ..............................
........................................................................
   1    -37.3089958 -0.373090E+02  0.127E-02    2.63       0.0  T
   2    -37.3089958 -0.243170E-07  0.772E-03    2.63       2.8  T
   3    -37.3089958 -0.939257E-08  0.759E-04    2.63      28.7  T
   4    -37.3089958 -0.304799E-08  0.443E-04    2.63      49.3  T
     SCC iter.                  ...        0 min,  0.004 sec
     gradient                   ...        0 min,  0.011 sec
 * total energy  :   -36.8075860 Eh     change       -0.4315316E-05 Eh
   gradient norm :     0.0017955 Eh/α   predicted    -0.2632800E-05 ( -38.99%)
   displ. norm   :     0.0772305 α      lambda       -0.1146410E-04
   maximum displ.:     0.0523550 α      in ANC's #1, #7, #4, ...

........................................................................
.............................. CYCLE   18 ..............................
........................................................................
   1    -37.3084567 -0.373085E+02  0.633E-02    2.63       0.0  T
   2    -37.3084574 -0.709586E-06  0.386E-02    2.64       1.0  T
   3    -37.3084576 -0.234047E-06  0.453E-03    2.64       4.8  T
   4    -37.3084578 -0.165020E-06  0.250E-03    2.64       8.7  T
   5    -37.3084578 -0.301884E-07  0.120E-03    2.64      18.1  T
   6    -37.3084578 -0.106108E-07  0.523E-04    2.64      41.7  T
   7    -37.3084578 -0.661146E-09  0.252E-04    2.64      86.6  T
     SCC iter.                  ...        0 min,  0.007 sec
     gradient                   ...        0 min,  0.011 sec
 * total energy  :   -36.8075925 Eh     change       -0.6517784E-05 Eh
   gradient norm :     0.0026051 Eh/α   predicted    -0.5763236E-05 ( -11.58%)
   displ. norm   :     0.0096088 α      lambda       -0.3624391E-05
   maximum displ.:     0.0058459 α      in ANC's #2, #4, #7, ...

........................................................................
.............................. CYCLE   19 ..............................
........................................................................
   1    -37.3086671 -0.373087E+02  0.890E-03    2.64       0.0  T
   2    -37.3086672 -0.426351E-07  0.521E-03    2.64       4.2  T
   3    -37.3086672  0.125836E-07  0.150E-03    2.64      14.5  T
   4    -37.3086672 -0.218275E-07  0.630E-04    2.64      34.7  T
   5    -37.3086672 -0.195730E-08  0.342E-04    2.64      63.8  T
     SCC iter.                  ...        0 min,  0.005 sec
     gradient                   ...        0 min,  0.011 sec
 * total energy  :   -36.8075954 Eh     change       -0.2869573E-05 Eh
   gradient norm :     0.0014368 Eh/α   predicted    -0.1814414E-05 ( -36.77%)
   displ. norm   :     0.0324536 α      lambda       -0.6277973E-05
   maximum displ.:     0.0246776 α      in ANC's #4, #11, #8, ...

........................................................................
.............................. CYCLE   20 ..............................
........................................................................
   1    -37.3089713 -0.373090E+02  0.311E-02    2.64       0.0  T
   2    -37.3089716 -0.301171E-06  0.182E-02    2.64       1.2  T
   3    -37.3089715  0.133156E-06  0.499E-03    2.64       4.4  T
   4    -37.3089718 -0.238243E-06  0.241E-03    2.64       9.1  T
   5    -37.3089718 -0.326884E-07  0.896E-04    2.64      24.3  T
   6    -37.3089718 -0.560222E-08  0.354E-04    2.64      61.6  T
     SCC iter.                  ...        0 min,  0.006 sec
     gradient                   ...        0 min,  0.012 sec
 * total energy  :   -36.8075993 Eh     change       -0.3894260E-05 Eh
   gradient norm :     0.0013787 Eh/α   predicted    -0.3144889E-05 ( -19.24%)
   displ. norm   :     0.0176765 α      lambda       -0.1676934E-05
   maximum displ.:     0.0094510 α      in ANC's #4, #7, #5, ...
 * RMSD in coord.:     0.4160642 α      energy gain  -0.7567935E-02 Eh

generating ANC from model Hessian ...
Using Lindh-Hessian (1995)
 Shifting diagonal of input Hessian by   3.137370520708960E-003
 Lowest  eigenvalues of input Hessian
   -0.000000   -0.000000    0.000000    0.000000    0.000000    0.000000
    0.005000    0.007266    0.009053    0.010552    0.012746    0.019179
    0.022572    0.024832    0.030614    0.037998    0.039263    0.044443
 Highest eigenvalues
    1.674696    1.830924    1.878458    2.018892    2.135357    2.236483
 

........................................................................
.............................. CYCLE   21 ..............................
........................................................................
   1    -37.3088995 -0.373089E+02  0.165E-02    2.64       0.0  T
   2    -37.3088995 -0.581237E-07  0.999E-03    2.64       2.2  T
   3    -37.3088995 -0.103863E-07  0.152E-03    2.64      14.4  T
   4    -37.3088996 -0.179427E-07  0.809E-04    2.64      27.0  T
   5    -37.3088996 -0.326118E-08  0.397E-04    2.64      54.9  T
     SCC iter.                  ...        0 min,  0.005 sec
     gradient                   ...        0 min,  0.011 sec
 * total energy  :   -36.8076010 Eh     change       -0.1661570E-05 Eh
   gradient norm :     0.0007237 Eh/α   predicted     0.0000000E+00 (-100.00%)
   displ. norm   :     0.0178998 α      lambda       -0.1463486E-05
   maximum displ.:     0.0140143 α      in ANC's #1, #2, #4, ...

   *** GEOMETRY OPTIMIZATION CONVERGED AFTER 21 ITERATIONS ***

------------------------------------------------------------------------
 total energy gain   :        -0.0075696 Eh       -4.7500 kcal/mol
 total RMSD          :         0.4160642 a0        0.2202 Å
 total power (kW/mol):        -0.9463797 (step)  -36.8898 (real)
------------------------------------------------------------------------

 ANCopt (total)                0 d,  0 h,  0 min,  0.539 sec
 optimizer setup                ...        0 min,  0.000 sec (  0.023%)
 model hessian                  ...        0 min,  0.009 sec (  1.649%)
 ANC generation                 ...        0 min,  0.001 sec (  0.185%)
 coordinate transformation      ...        0 min,  0.000 sec (  0.051%)
 single point calculation       ...        0 min,  0.521 sec ( 96.792%)
 optimization log               ...        0 min,  0.002 sec (  0.310%)
 hessian update                 ...        0 min,  0.000 sec (  0.039%)
 rational function              ...        0 min,  0.004 sec (  0.742%)

================
 final structure:
================
$coord
    2.85611841099416   -2.45705435784320   -0.23809500012595      C 
    5.18054446571662   -0.20591963327186   -0.25792480319185      S 
    2.96878625557737    2.21651612658409    0.02337785452639      C 
    0.55708977170924    1.25083972657982    0.09737601416534      C 
    0.50489863663795   -1.42770597945316   -0.05676509604988      C 
   -1.89602980404355   -2.94179208053477   -0.02848666912940      C 
   -4.08997268998884   -1.30977914787284    0.78787938989816      C 
   -5.59872016051023   -1.86184316430149    2.38947105017077      O 
   -4.04700974292137    1.19804124469465   -0.62271521848265      C 
   -5.51312132318886    1.78782563769084   -2.24954805197455      O 
   -1.82695472930441    2.78283417824210    0.22734346222867      C 
    3.91159868152777    4.77149108431747    0.12326976619323      C 
    2.70332538962139    6.80670804451447    0.96879630936814      C 
    3.35026284687488   -4.41691587995771   -0.36490698257583      H 
   -1.73510337753086   -4.58471216499585    1.21211088704029      H 
   -2.30576990436330   -3.61946678906421   -1.94266401787059      H 
   -2.18834807539583    3.35635609293786    2.18461268125287      H 
   -1.68660176718698    4.47570848745511   -0.94662380358546      H 
    5.83951656615520    4.96315527345043   -0.53492136594505      H 
    0.82487217069924    6.75148188045202    1.73528213150479      H 
    3.61246708043110    8.62567305148483    0.95473145650518      H 
$end
           -------------------------------------------------
          |                Final Singlepoint                |
           -------------------------------------------------

          ...................................................
          :                      SETUP                      :
          :.................................................:
          :  # basis functions                  66          :
          :  # atomic orbitals                  65          :
          :  # shells                           35          :
          :  # electrons                        66          :
          :  max. iterations                   250          :
          :  Hamiltonian                  GFN2-xTB          :
          :  restarted?                      false          :
          :  GBSA solvation                  false          :
          :  PC potential                    false          :
          :  electronic temp.          300.0000000     K    :
          :  accuracy                    1.0000000          :
          :  -> integral cutoff          0.2500000E+02      :
          :  -> integral neglect         0.1000000E-07      :
          :  -> SCF convergence          0.1000000E-05 Eh   :
          :  -> wf. convergence          0.1000000E-03 e    :
          :  Broyden damping             0.4000000          :
          ...................................................

 iter      E             dE          RMSdq      gap      omega  full diag
   1    -37.3088996 -0.373089E+02  0.205E-04    2.64       0.0  T
   2    -37.3088996 -0.410765E-10  0.768E-05    2.64     284.2  T
   3    -37.3088996 -0.250822E-11  0.935E-05    2.64     233.3  T

   *** convergence criteria satisfied after 3 iterations ***

         #    Occupation            Energy/Eh            Energy/eV
      -------------------------------------------------------------
         1        2.0000           -0.7472233             -20.3330
       ...           ...                  ...                  ...
        27        2.0000           -0.4693002             -12.7703
        28        2.0000           -0.4594502             -12.5023
        29        2.0000           -0.4492411             -12.2245
        30        2.0000           -0.4480327             -12.1916
        31        2.0000           -0.4080985             -11.1049
        32        2.0000           -0.3971520             -10.8071
        33        2.0000           -0.3923392             -10.6761 (HOMO)
        34                         -0.2951504              -8.0315 (LUMO)
        35                         -0.2789453              -7.5905
        36                         -0.2627871              -7.1508
        37                         -0.2209509              -6.0124
        38                         -0.2139930              -5.8230
       ...                                ...                  ...
        65                          0.6763270              18.4038
      -------------------------------------------------------------
                  HL-Gap            0.0971888 Eh            2.6446 eV
             Fermi-level           -0.3437448 Eh           -9.3538 eV

 SCC (total)                   0 d,  0 h,  0 min,  0.024 sec
 SCC setup                      ...        0 min,  0.000 sec (  0.794%)
 Dispersion                     ...        0 min,  0.000 sec (  0.756%)
 integral evaluation            ...        0 min,  0.008 sec ( 32.464%)
 zeroth order Hamiltonian       ...        0 min,  0.000 sec (  0.545%)
 iterations                     ...        0 min,  0.004 sec ( 15.392%)
 molecular gradient             ...        0 min,  0.012 sec ( 48.731%)
 printout                       ...        0 min,  0.000 sec (  1.145%)

         :::::::::::::::::::::::::::::::::::::::::::::::::::::
         ::                     SUMMARY                     ::
         :::::::::::::::::::::::::::::::::::::::::::::::::::::
         :: total energy             -36.807600963303 Eh    ::
         :: gradient norm              0.000724861639 Eh/a0 ::
         :: HOMO-LUMO gap              2.644641229844 eV    ::
         ::.................................................::
         :: SCC energy               -37.308899557626 Eh    ::
         :: -> isotropic ES            0.044884544647 Eh    ::
         :: -> anisotropic ES          0.001264932090 Eh    ::
         :: -> anisotropic XC          0.013431489392 Eh    ::
         :: -> dispersion             -0.022280596154 Eh    ::
         :: repulsion energy           0.501159467123 Eh    ::
         :: add. restraining           0.000000000000 Eh    ::
         :::::::::::::::::::::::::::::::::::::::::::::::::::::

           -------------------------------------------------
          |                Property Printout                |
           -------------------------------------------------

    * Orbital Energies and Occupations

         #    Occupation            Energy/Eh            Energy/eV
      -------------------------------------------------------------
         1        2.0000           -0.7472233             -20.3330
       ...           ...                  ...                  ...
        21        2.0000           -0.5175126             -14.0822
        22        2.0000           -0.5061807             -13.7739
        23        2.0000           -0.5004390             -13.6176
        24        2.0000           -0.4913440             -13.3702
        25        2.0000           -0.4873854             -13.2624
        26        2.0000           -0.4781804             -13.0120
        27        2.0000           -0.4693002             -12.7703
        28        2.0000           -0.4594502             -12.5023
        29        2.0000           -0.4492411             -12.2245
        30        2.0000           -0.4480327             -12.1916
        31        2.0000           -0.4080985             -11.1049
        32        2.0000           -0.3971520             -10.8071
        33        2.0000           -0.3923392             -10.6761 (HOMO)
        34                         -0.2951504              -8.0315 (LUMO)
        35                         -0.2789453              -7.5905
        36                         -0.2627871              -7.1508
        37                         -0.2209509              -6.0124
        38                         -0.2139930              -5.8230
        39                         -0.1682646              -4.5787
        40                         -0.1307852              -3.5588
        41                         -0.0187629              -0.5106
        42                          0.0162385               0.4419
        43                          0.0186696               0.5080
        44                          0.0399050               1.0859
       ...                                ...                  ...
        65                          0.6763270              18.4038
      -------------------------------------------------------------
                  HL-Gap            0.0971888 Eh            2.6446 eV
             Fermi-level           -0.3437448 Eh           -9.3538 eV

     #   Z        covCN         q      C6AA      α(0)
     1   6 C      2.936    -0.033    28.816     8.804
     2  16 S      2.344    -0.013   141.582    20.027
     3   6 C      2.986     0.016    27.652     8.626
     4   6 C      3.159    -0.015    28.074     8.662
     5   6 C      3.165    -0.010    27.920     8.635
     6   6 C      3.810    -0.083    22.077     6.688
     7   6 C      2.818     0.226    23.247     7.900
     8   8 O      0.856    -0.314    20.041     6.002
     9   6 C      2.819     0.226    23.255     7.901
    10   8 O      0.856    -0.313    20.020     5.999
    11   6 C      3.809    -0.080    22.016     6.679
    12   6 C      2.935    -0.030    28.749     8.793
    13   6 C      2.838    -0.090    30.246     9.013
    14   1 H      0.926     0.052     2.298     2.371
    15   1 H      0.924     0.077     2.014     2.219
    16   1 H      0.924     0.081     1.965     2.192
    17   1 H      0.924     0.079     1.994     2.208
    18   1 H      0.924     0.080     1.976     2.198
    19   1 H      0.925     0.049     2.329     2.386
    20   1 H      0.926     0.046     2.364     2.404
    21   1 H      0.926     0.049     2.335     2.390

 Mol. C6AA /au·bohr⁶  :       6971.628797
 Mol. C8AA /au·bohr⁸  :     191959.954569
 Mol. α(0) /au        :        132.098327


Wiberg/Mayer (AO) data.
largest (>0.10) Wiberg bond orders for each atom
          total WBO             WBO to atom ...
     1  C   3.949        C    5 1.577    S    2 1.202    H   14 0.969    C    3 0.101
     2  S   2.621        C    1 1.202    C    3 1.136
     3  C   3.949        C    4 1.501    S    2 1.136    C   12 1.128    C    1 0.101
     4  C   3.980        C    3 1.501    C    5 1.249    C   11 0.992
     5  C   3.982        C    1 1.577    C    4 1.249    C    6 0.990
     6  C   3.994        C    5 0.990    C    7 0.977    H   15 0.959    H   16 0.928
     7  C   3.918        O    8 1.899    C    6 0.977    C    9 0.923
     8  O   2.108        C    7 1.899
     9  C   3.917        O   10 1.901    C   11 0.973    C    7 0.923
    10  O   2.109        C    9 1.901
    11  C   3.994        C    4 0.992    C    9 0.973    H   18 0.956    H   17 0.928
    12  C   3.990        C   13 1.869    C    3 1.128    H   19 0.961
    13  C   3.990        C   12 1.869    H   21 0.977    H   20 0.973
    14  H   0.997        C    1 0.969
    15  H   0.994        C    6 0.959
    16  H   0.993        C    6 0.928
    17  H   0.994        C   11 0.928
    18  H   0.993        C   11 0.956
    19  H   0.997        C   12 0.961
    20  H   0.998        C   13 0.973
    21  H   0.997        C   13 0.977

molecular dipole:
                 x           y           z       tot (Debye)
 q only:        1.509       0.108       0.007
   full:        1.394       0.031       0.025       3.545
molecular quadrupole (traceless):
                xx          xy          yy          xz          yz          zz
 q only:      -11.462       0.822      11.419      -0.070       4.270       0.043
  q+dip:      -15.433       0.543      15.870      -0.693       5.597      -0.437
   full:      -15.919       0.608      14.821      -0.136       6.138       1.098

           -------------------------------------------------
          |                Geometry Summary                 |
           -------------------------------------------------

      molecular mass/u    :      192.2320000
   center of mass at/Å    :        0.0379395       0.3817841       0.0321617
  moments of inertia/u·Å² :        0.4340055E+03   0.9078172E+03   0.1222618E+04
rotational constants/cm⁻¹ :        0.3884198E-01   0.1856941E-01   0.1378814E-01

 * 16 selected distances

     #   Z        #   Z                                     value/Å
     1   6 C      2  16 S                                 1.7123572
     2  16 S      3   6 C                                 1.7422072 (max)
     3   6 C      4   6 C                                 1.3752793
     1   6 C      5   6 C                                 1.3616085
     4   6 C      5   6 C                                 1.4200391
     7   6 C      8   8 O                                 1.2004500
     9   6 C     10   8 O                                 1.2001845
    12   6 C     13   6 C                                 1.3300097
     1   6 C     14   1 H                                 1.0716744 (min)
     6   6 C     15   1 H                                 1.0927435
     6   6 C     16   1 H                                 1.0962025
    11   6 C     17   1 H                                 1.0961042
    11   6 C     18   1 H                                 1.0926865
    12   6 C     19   1 H                                 1.0827875
    13   6 C     20   1 H                                 1.0740000
    13   6 C     21   1 H                                 1.0761142

 * 4 distinct bonds (by element types)

   Z      Z             #   av. dist./Å        max./Å        min./Å
   1 H    6 C           8     1.0852891     1.0962025     1.0716744
   6 C    6 C           4     1.3717342     1.4200391     1.3300097
   6 C    8 O           2     1.2003172     1.2004500     1.2001845
   6 C   16 S           2     1.7272822     1.7422072     1.7123572


optimized geometry written to: xtbopt.xyz


           -------------------------------------------------
          | TOTAL ENERGY              -36.807600963303 Eh   |
          | GRADIENT NORM               0.000724861639 Eh/α |
          | HOMO-LUMO GAP               2.644641229844 eV   |
           -------------------------------------------------

------------------------------------------------------------------------
 * finished run on 2021/05/19 at 10:58:12.048     
------------------------------------------------------------------------
 total:
 * wall-time:     0 d,  0 h,  0 min,  0.615 sec
 *  cpu-time:     0 d,  0 h,  0 min,  0.614 sec
 * ratio c/w:     1.000 speedup
 SCF:
 * wall-time:     0 d,  0 h,  0 min,  0.033 sec
 *  cpu-time:     0 d,  0 h,  0 min,  0.033 sec
 * ratio c/w:     1.000 speedup
 ANC optimizer:
 * wall-time:     0 d,  0 h,  0 min,  0.563 sec
 *  cpu-time:     0 d,  0 h,  0 min,  0.563 sec
 * ratio c/w:     1.000 speedup

