      -----------------------------------------------------------      
     |                   =====================                   |     
     |                           x T B                           |     
     |                   =====================                   |     
     |                         S. Grimme                         |     
     |          Mulliken Center for Theoretical Chemistry        |     
     |                    University of Bonn                     |     
     |                Version 6.2 RC2 (SAW190805)                |     
      -----------------------------------------------------------      

   This program is distributed in the hope that it will be useful,
   but WITHOUT ANY WARRANTY; without even the implied warranty of
   MERCHANTABILITY or FITNESS FOR A PARTICULAR PURPOSE.
   
   FOR NON-COMMERCIAL, ACADEMIA USE ONLY.
   
   Cite this work as:
   * S. Grimme, C. Bannwarth, P. Shushkov, J. Chem. Theory Comput., 2017,
     13, 1989-2009. DOI: 10.1021/acs.jctc.7b00118
   * C. Bannwarth, S. Ehlert and S. Grimme., J. Chem. Theory Comput., 2019,
     15, 1652-1671. DOI: 10.1021/acs.jctc.8b01176
   * P. Pracht, E. Caldeweyher, S. Ehlert, S. Grimme, ChemRxiv, 2019, preprint.
     DOI: 10.26434/chemrxiv.8326202.v1
   
   for DFT-D4:
   * E. Caldeweyher, C. Bannwarth and S. Grimme, J. Chem. Phys., 2017,
     147, 034112. DOI: 10.1063/1.4993215
   * E. Caldeweyher, S. Ehlert, A. Hansen, H. Neugebauer, S. Spicher,
     C. Bannwarth and S. Grimme, J. Chem. Phys., 2019, 150, 154122.
     DOI: 10.1063/1.5090222
   
   for sTDA-xTB:
   * S. Grimme and C. Bannwarth, J. Chem. Phys., 2016, 145, 054103.
     DOI: 10.1063/1.4959605
   
   in the mass-spec context:
   * V. Asgeirsson, C. Bauer and S. Grimme, Chem. Sci., 2017, 8, 4879.
     DOI: 10.1039/c7sc00601b
   
   for metadynamics refer to:
   * S. Grimme, J. Chem. Theory Comput., 2019, 155, 2847-2862
     DOI: 10.1021/acs.jctc.9b00143
   
   with help from (in alphabetical order)
   C. Bannwarth, F. Bohle, G. Brandenburg, E. Caldeweyher, M. Checinski,
   S. Dohm, S. Ehlert, S. Ehrlich, F. März, H. Neugebauer, J. Pisarek,
   P. Pracht, P. Shushkov, and S. Spicher.
   
 * started run on 2021/05/19 at 10:59:15.051     

           -------------------------------------------------
          |                Calculation Setup                |
           -------------------------------------------------

          program call               : /ihome/ghutchison/geoffh/xtb/xtb 161.xyz -opt
          hostname                   : smp-n83
          coordinate file            : 161.xyz
          omp threads                :                     1
          number of atoms            :                    15
          number of electrons        :                    68
          charge                     :                     0
          spin                       :                   0.0
          first test random number   :      0.77703766713301


########################################################################
# WARNING! Please study the warnings concerning your input carefully
#  - the use of '-opt' is discouraged, please use '--opt' next time
########################################################################

           ------------------------------------------------- 
          |                 G F N 2 - x T B                 |
          | Geometry, Frequencies, Noncovalent interactions |
          |            JCTC 2019 parametrisation            |
           ------------------------------------------------- 
             KAB for C  - Si     :                1.0500
             KAB for H  - Pd     :                0.9500
             k(s)              :                1.8500
             k(p)              :                2.2300
             k(d)              :                2.2300
             k(f)              :                2.0000
             kEN (H0ij)        :               -2.0000
             D4 a1             :                0.5200
             D4 a2             :                5.0000
             D4 s6             :                1.0000
             D4 s8             :                2.7000
             D4 s9             :                5.0000
             alphaj            :                2.0000

  Z AO/shell   Hii/eV     exponent
  1     Wed Apr 25 08:07:45 CEST 2018   EN: 2.200 GM2: 0.406  GM3: 0.0800  RAES: 1.40
     1s    -10.707211    1.230000
  6     Wed Apr 25 08:07:45 CEST 2018   EN: 2.550 GM2: 0.538  GM3: 0.1500  RAES: 3.00
     2s    -13.970922    2.096432
     2p    -10.063292    1.800000
  9     Mon Apr 23 13:58:50 CEST 2018   EN: 3.980 GM2: 0.532  GM3: 0.1426  RAES: 2.40
     2s    -23.458179    2.416361
     2p    -15.746583    2.308399
 16     Tue Apr 24 11:44:34 CEST 2018   EN: 2.580 GM2: 0.340  GM3:-0.0502  RAES: 3.10
     3s    -20.029654    1.981333
     3p    -11.377694    2.025643
     3d     -0.420282    1.702555

           ------------------------------------------------- 
          |        Self-Consistent Charge Iterations        |
           ------------------------------------------------- 

          ...................................................
          :                      SETUP                      :
          :.................................................:
          :  # basis functions                  60          :
          :  # atomic orbitals                  59          :
          :  # shells                           29          :
          :  # electrons                        68          :
          :  max. iterations                   250          :
          :  Hamiltonian                  GFN2-xTB          :
          :  restarted?                      false          :
          :  GBSA solvation                  false          :
          :  PC potential                    false          :
          :  electronic temp.          300.0000000     K    :
          :  accuracy                    1.0000000          :
          :  -> integral cutoff          0.2500000E+02      :
          :  -> integral neglect         0.1000000E-07      :
          :  -> SCF convergence          0.1000000E-05 Eh   :
          :  -> wf. convergence          0.1000000E-03 e    :
          :  Broyden damping             0.4000000          :
          ...................................................

 iter      E             dE          RMSdq      gap      omega  full diag
   1    -40.6216664 -0.406217E+02  0.455E+00    2.12       0.0  T
   2    -40.6370891 -0.154227E-01  0.254E+00    2.17       1.0  T
   3    -40.6343266  0.276251E-02  0.896E-01    2.15       1.0  T
   4    -40.6390288 -0.470222E-02  0.276E-01    2.18       1.0  T
   5    -40.6396424 -0.613591E-03  0.115E-01    2.18       1.0  T
   6    -40.6397034 -0.610129E-04  0.413E-02    2.18       1.0  T
   7    -40.6397088 -0.541097E-05  0.162E-02    2.18       1.6  T
   8    -40.6397090 -0.159129E-06  0.712E-03    2.18       3.6  T
   9    -40.6397090 -0.253016E-07  0.318E-03    2.18       8.1  T
  10    -40.6397091 -0.934171E-07  0.852E-04    2.18      30.3  T
  11    -40.6397091 -0.425835E-09  0.199E-04    2.18     129.9  T

   *** convergence criteria satisfied after 11 iterations ***

         #    Occupation            Energy/Eh            Energy/eV
      -------------------------------------------------------------
         1        2.0000           -0.8543906             -23.2492
       ...           ...                  ...                  ...
        28        2.0000           -0.4999311             -13.6038
        29        2.0000           -0.4886787             -13.2976
        30        2.0000           -0.4760812             -12.9548
        31        2.0000           -0.4721938             -12.8490
        32        2.0000           -0.4653069             -12.6616
        33        2.0000           -0.4370341             -11.8923
        34        2.0000           -0.4037442             -10.9864 (HOMO)
        35                         -0.3235585              -8.8045 (LUMO)
        36                         -0.2541327              -6.9153
        37                         -0.2470806              -6.7234
        38                         -0.2357757              -6.4158
        39                         -0.1572440              -4.2788
       ...                                ...                  ...
        59                          0.7034710              19.1424
      -------------------------------------------------------------
                  HL-Gap            0.0801858 Eh            2.1820 eV
             Fermi-level           -0.3636514 Eh           -9.8955 eV

 SCC (total)                   0 d,  0 h,  0 min,  0.029 sec
 SCC setup                      ...        0 min,  0.000 sec (  0.870%)
 Dispersion                     ...        0 min,  0.000 sec (  0.637%)
 integral evaluation            ...        0 min,  0.008 sec ( 26.088%)
 zeroth order Hamiltonian       ...        0 min,  0.000 sec (  0.493%)
 iterations                     ...        0 min,  0.010 sec ( 36.167%)
 molecular gradient             ...        0 min,  0.010 sec ( 34.385%)
 printout                       ...        0 min,  0.000 sec (  1.169%)

         :::::::::::::::::::::::::::::::::::::::::::::::::::::
         ::                     SUMMARY                     ::
         :::::::::::::::::::::::::::::::::::::::::::::::::::::
         :: total energy             -40.281439668714 Eh    ::
         :: gradient norm              0.090673390379 Eh/a0 ::
         :: HOMO-LUMO gap              2.181965779327 eV    ::
         ::.................................................::
         :: SCC energy               -40.639709085418 Eh    ::
         :: -> isotropic ES            0.038783987781 Eh    ::
         :: -> anisotropic ES          0.001951574023 Eh    ::
         :: -> anisotropic XC         -0.012127257057 Eh    ::
         :: -> dispersion             -0.016252156285 Eh    ::
         :: repulsion energy           0.358224923338 Eh    ::
         :: add. restraining           0.000000000000 Eh    ::
         :::::::::::::::::::::::::::::::::::::::::::::::::::::

      ----------------------------------------------------------- 
     |                   =====================                   |
     |                        A N C O P T                        |
     |                   =====================                   |
     |               Approximate Normal Coordinate               |
     |                Rational Function Optimizer                |
      ----------------------------------------------------------- 

          ...................................................
          :                      SETUP                      :
          :.................................................:
          :   optimization level            normal          :
          :   max. optcycles                   200          :
          :   ANC micro-cycles                  20          :
          :   degrees of freedom                39          :
          :.................................................:
          :   RF solver                   davidson          :
          :   input Hessian                  false          :
          :   write xtbopt.log                true          :
          :   linear?                        false          :
          :   energy convergence         0.5000000E-05 Eh   :
          :   grad. convergence          0.1000000E-02 Eh/α :
          :   maximium RF displ.         2.0000000          :
          :   Hlow (freq-cutoff)         0.5000000E-02      :
          :   Hmax (freq-cutoff)         5.0000000          :
          :   S6 in model hess.         20.0000000          :
          ...................................................

generating ANC from model Hessian ...
Using Lindh-Hessian (1995)
 Shifting diagonal of input Hessian by   0.000000000000000E+000
 Lowest  eigenvalues of input Hessian
   -0.000000   -0.000000   -0.000000    0.000000    0.000000    0.000000
    0.007140    0.008690    0.017724    0.021066    0.021853    0.038239
    0.051255    0.067250    0.071004    0.086131    0.097921    0.103239
 Highest eigenvalues
    1.792261    1.799087    1.888252    1.954633    2.129890    2.167976
 

........................................................................
.............................. CYCLE    1 ..............................
........................................................................
   1    -40.6397091 -0.406397E+02  0.551E-05    2.18       0.0  T
   2    -40.6397091 -0.139693E-10  0.237E-05    2.18    1088.4  T
   3    -40.6397091 -0.873968E-12  0.153E-05    2.18    1685.3  T
     SCC iter.                  ...        0 min,  0.003 sec
     gradient                   ...        0 min,  0.010 sec
 * total energy  :   -40.2814397 Eh     change        0.1004349E-07 Eh
   gradient norm :     0.0906734 Eh/α   predicted     0.0000000E+00 (-100.00%)
   displ. norm   :     0.2424211 α      lambda       -0.1172003E-01
   maximum displ.:     0.1555886 α      in ANC's #8, #16, #17, ...

........................................................................
.............................. CYCLE    2 ..............................
........................................................................
   1    -40.6572293 -0.406572E+02  0.223E-01    2.28       0.0  T
   2    -40.6572989 -0.696167E-04  0.134E-01    2.27       1.0  T
   3    -40.6573065 -0.764146E-05  0.755E-02    2.27       1.0  T
   4    -40.6573430 -0.365006E-04  0.204E-02    2.27       1.3  T
   5    -40.6573452 -0.222672E-05  0.661E-03    2.27       3.9  T
   6    -40.6573457 -0.465746E-06  0.207E-03    2.27      12.5  T
   7    -40.6573457 -0.153392E-07  0.920E-04    2.27      28.1  T
     SCC iter.                  ...        0 min,  0.006 sec
     gradient                   ...        0 min,  0.009 sec
 * total energy  :   -40.2895857 Eh     change       -0.8146029E-02 Eh
   gradient norm :     0.0477980 Eh/α   predicted    -0.6204402E-02 ( -23.84%)
   displ. norm   :     0.1400491 α      lambda       -0.3565810E-02
   maximum displ.:     0.0976527 α      in ANC's #16, #8, #17, ...

........................................................................
.............................. CYCLE    3 ..............................
........................................................................
   1    -40.6667496 -0.406667E+02  0.189E-01    2.38       0.0  T
   2    -40.6668062 -0.566058E-04  0.112E-01    2.38       1.0  T
   3    -40.6668168 -0.105977E-04  0.619E-02    2.38       1.0  T
   4    -40.6668411 -0.242819E-04  0.177E-02    2.38       1.5  T
   5    -40.6668417 -0.604588E-06  0.643E-03    2.38       4.0  T
   6    -40.6668422 -0.511338E-06  0.159E-03    2.38      16.3  T
   7    -40.6668422 -0.941060E-08  0.409E-04    2.38      63.1  T
     SCC iter.                  ...        0 min,  0.006 sec
     gradient                   ...        0 min,  0.009 sec
 * total energy  :   -40.2915018 Eh     change       -0.1916125E-02 Eh
   gradient norm :     0.0135651 Eh/α   predicted    -0.1817876E-02 (  -5.13%)
   displ. norm   :     0.0312840 α      lambda       -0.1827848E-03
   maximum displ.:     0.0190402 α      in ANC's #12, #4, #16, ...

........................................................................
.............................. CYCLE    4 ..............................
........................................................................
   1    -40.6658912 -0.406659E+02  0.628E-02    2.39       0.0  T
   2    -40.6658959 -0.472699E-05  0.338E-02    2.39       1.0  T
   3    -40.6658951  0.777483E-06  0.179E-02    2.39       1.4  T
   4    -40.6658978 -0.273486E-05  0.602E-03    2.39       4.3  T
   5    -40.6658979 -0.558736E-07  0.227E-03    2.39      11.4  T
   6    -40.6658980 -0.557683E-07  0.658E-04    2.39      39.2  T
     SCC iter.                  ...        0 min,  0.005 sec
     gradient                   ...        0 min,  0.009 sec
 * total energy  :   -40.2916234 Eh     change       -0.1215634E-03 Eh
   gradient norm :     0.0061237 Eh/α   predicted    -0.9148075E-04 ( -24.75%)
   displ. norm   :     0.0235968 α      lambda       -0.5653871E-04
   maximum displ.:     0.0115901 α      in ANC's #4, #12, #8, ...

........................................................................
.............................. CYCLE    5 ..............................
........................................................................
   1    -40.6653530 -0.406654E+02  0.488E-02    2.39       0.0  T
   2    -40.6653555 -0.247316E-05  0.259E-02    2.39       1.0  T
   3    -40.6653548  0.661943E-06  0.139E-02    2.39       1.9  T
   4    -40.6653566 -0.178341E-05  0.459E-03    2.39       5.6  T
   5    -40.6653567 -0.428040E-07  0.168E-03    2.39      15.4  T
   6    -40.6653567 -0.234075E-07  0.466E-04    2.39      55.4  T
     SCC iter.                  ...        0 min,  0.005 sec
     gradient                   ...        0 min,  0.009 sec
 * total energy  :   -40.2916489 Eh     change       -0.2549953E-04 Eh
   gradient norm :     0.0012889 Eh/α   predicted    -0.2828408E-04 (  10.92%)
   displ. norm   :     0.0180888 α      lambda       -0.6333804E-05
   maximum displ.:     0.0130430 α      in ANC's #4, #3, #7, ...

........................................................................
.............................. CYCLE    6 ..............................
........................................................................
   1    -40.6655199 -0.406655E+02  0.534E-02    2.39       0.0  T
   2    -40.6655207 -0.836672E-06  0.252E-02    2.39       1.0  T
   3    -40.6655205  0.163571E-06  0.670E-03    2.39       3.9  T
   4    -40.6655209 -0.386907E-06  0.332E-03    2.39       7.8  T
   5    -40.6655210 -0.237589E-07  0.599E-04    2.39      43.1  T
   6    -40.6655210 -0.103674E-08  0.181E-04    2.39     143.0  T
     SCC iter.                  ...        0 min,  0.005 sec
     gradient                   ...        0 min,  0.010 sec
 * total energy  :   -40.2916497 Eh     change       -0.8103788E-06 Eh
   gradient norm :     0.0006179 Eh/α   predicted    -0.3167179E-05 ( 290.83%)
   displ. norm   :     0.0093958 α      lambda       -0.2909416E-05
   maximum displ.:     0.0066293 α      in ANC's #4, #3, #7, ...

   *** GEOMETRY OPTIMIZATION CONVERGED AFTER 6 ITERATIONS ***

------------------------------------------------------------------------
 total energy gain   :        -0.0102100 Eh       -6.4069 kcal/mol
 total RMSD          :         0.0975433 a0        0.0516 Å
 total power (kW/mol):        -4.4677329 (step) -194.0397 (real)
------------------------------------------------------------------------

 ANCopt (total)                0 d,  0 h,  0 min,  0.138 sec
 optimizer setup                ...        0 min,  0.000 sec (  0.101%)
 model hessian                  ...        0 min,  0.001 sec (  1.011%)
 ANC generation                 ...        0 min,  0.000 sec (  0.308%)
 coordinate transformation      ...        0 min,  0.000 sec (  0.060%)
 single point calculation       ...        0 min,  0.134 sec ( 97.037%)
 optimization log               ...        0 min,  0.000 sec (  0.337%)
 hessian update                 ...        0 min,  0.000 sec (  0.048%)
 rational function              ...        0 min,  0.001 sec (  0.772%)

================
 final structure:
================
$coord
   -2.89987734803875   -2.33191038043276    0.31078392355819      C 
   -5.11094924579073    0.00000014204403    0.47700182143345      S 
   -2.89987732420893    2.33191032435503    0.31078392191342      C 
   -0.49319073456618    1.36026935679902    0.14136903499550      C 
   -0.49319072519562   -1.36026935628403    0.14136903458414      C 
    1.83951404655448   -2.66749622590692   -0.02404541125027      C 
    1.82840478457111   -5.20103268080856   -0.02428612010379      F 
    4.04984401133423   -1.34646216231886   -0.18128465553559      C 
    6.27684395091457   -2.53272081395265   -0.34111315324829      F 
    4.04984400316562    1.34646219358809   -0.18128465467813      C 
    6.27684404796370    2.53272089289287   -0.34111315384090      F 
    1.83951400924967    2.66749622440627   -0.02404540954245      C 
    1.82840472240451    5.20103252174837   -0.02428611919517      F 
   -3.44269169183876   -4.28151288449210    0.34776374598712      H 
   -3.44269168154289    4.28151284836221    0.34776374530591      H 
$end
           -------------------------------------------------
          |                Final Singlepoint                |
           -------------------------------------------------

          ...................................................
          :                      SETUP                      :
          :.................................................:
          :  # basis functions                  60          :
          :  # atomic orbitals                  59          :
          :  # shells                           29          :
          :  # electrons                        68          :
          :  max. iterations                   250          :
          :  Hamiltonian                  GFN2-xTB          :
          :  restarted?                      false          :
          :  GBSA solvation                  false          :
          :  PC potential                    false          :
          :  electronic temp.          300.0000000     K    :
          :  accuracy                    1.0000000          :
          :  -> integral cutoff          0.2500000E+02      :
          :  -> integral neglect         0.1000000E-07      :
          :  -> SCF convergence          0.1000000E-05 Eh   :
          :  -> wf. convergence          0.1000000E-03 e    :
          :  Broyden damping             0.4000000          :
          ...................................................

 iter      E             dE          RMSdq      gap      omega  full diag
   1    -40.6655210 -0.406655E+02  0.982E-05    2.39       0.0  T
   2    -40.6655210  0.942890E-11  0.643E-05    2.39     401.6  T
   3    -40.6655210 -0.614904E-10  0.411E-05    2.39     629.0  T

   *** convergence criteria satisfied after 3 iterations ***

         #    Occupation            Energy/Eh            Energy/eV
      -------------------------------------------------------------
         1        2.0000           -0.8516296             -23.1740
       ...           ...                  ...                  ...
        28        2.0000           -0.4970045             -13.5242
        29        2.0000           -0.4924846             -13.4012
        30        2.0000           -0.4781174             -13.0102
        31        2.0000           -0.4746831             -12.9168
        32        2.0000           -0.4618354             -12.5672
        33        2.0000           -0.4391449             -11.9497
        34        2.0000           -0.4073922             -11.0857 (HOMO)
        35                         -0.3195344              -8.6950 (LUMO)
        36                         -0.2521726              -6.8620
        37                         -0.2437715              -6.6334
        38                         -0.2357128              -6.4141
        39                         -0.1536197              -4.1802
       ...                                ...                  ...
        59                          0.6997749              19.0418
      -------------------------------------------------------------
                  HL-Gap            0.0878578 Eh            2.3907 eV
             Fermi-level           -0.3634633 Eh           -9.8903 eV

 SCC (total)                   0 d,  0 h,  0 min,  0.021 sec
 SCC setup                      ...        0 min,  0.000 sec (  0.743%)
 Dispersion                     ...        0 min,  0.000 sec (  0.457%)
 integral evaluation            ...        0 min,  0.007 sec ( 34.257%)
 zeroth order Hamiltonian       ...        0 min,  0.000 sec (  0.560%)
 iterations                     ...        0 min,  0.003 sec ( 14.824%)
 molecular gradient             ...        0 min,  0.010 sec ( 47.461%)
 printout                       ...        0 min,  0.000 sec (  1.446%)

         :::::::::::::::::::::::::::::::::::::::::::::::::::::
         ::                     SUMMARY                     ::
         :::::::::::::::::::::::::::::::::::::::::::::::::::::
         :: total energy             -40.291649677837 Eh    ::
         :: gradient norm              0.000617880222 Eh/a0 ::
         :: HOMO-LUMO gap              2.390733629779 eV    ::
         ::.................................................::
         :: SCC energy               -40.665520951370 Eh    ::
         :: -> isotropic ES            0.040021547472 Eh    ::
         :: -> anisotropic ES          0.002204855290 Eh    ::
         :: -> anisotropic XC         -0.013017106958 Eh    ::
         :: -> dispersion             -0.016240294884 Eh    ::
         :: repulsion energy           0.373828656636 Eh    ::
         :: add. restraining           0.000000000000 Eh    ::
         :::::::::::::::::::::::::::::::::::::::::::::::::::::

           -------------------------------------------------
          |                Property Printout                |
           -------------------------------------------------

    * Orbital Energies and Occupations

         #    Occupation            Energy/Eh            Energy/eV
      -------------------------------------------------------------
         1        2.0000           -0.8516296             -23.1740
       ...           ...                  ...                  ...
        22        2.0000           -0.5393436             -14.6763
        23        2.0000           -0.5285148             -14.3816
        24        2.0000           -0.5278679             -14.3640
        25        2.0000           -0.5250128             -14.2863
        26        2.0000           -0.5124561             -13.9446
        27        2.0000           -0.5098411             -13.8735
        28        2.0000           -0.4970045             -13.5242
        29        2.0000           -0.4924846             -13.4012
        30        2.0000           -0.4781174             -13.0102
        31        2.0000           -0.4746831             -12.9168
        32        2.0000           -0.4618354             -12.5672
        33        2.0000           -0.4391449             -11.9497
        34        2.0000           -0.4073922             -11.0857 (HOMO)
        35                         -0.3195344              -8.6950 (LUMO)
        36                         -0.2521726              -6.8620
        37                         -0.2437715              -6.6334
        38                         -0.2357128              -6.4141
        39                         -0.1536197              -4.1802
        40                         -0.1389154              -3.7801
        41                         -0.0386981              -1.0530
        42                         -0.0103167              -0.2807
        43                         -0.0094452              -0.2570
        44                         -0.0078452              -0.2135
        45                          0.0035349               0.0962
       ...                                ...                  ...
        59                          0.6997749              19.0418
      -------------------------------------------------------------
                  HL-Gap            0.0878578 Eh            2.3907 eV
             Fermi-level           -0.3634633 Eh           -9.8903 eV

     #   Z        covCN         q      C6AA      α(0)
     1   6 C      2.929    -0.031    28.763     8.795
     2  16 S      2.325     0.104   136.877    19.691
     3   6 C      2.929    -0.031    28.763     8.795
     4   6 C      3.187    -0.020    28.013     8.635
     5   6 C      3.187    -0.020    28.013     8.635
     6   6 C      2.767     0.142    24.895     8.171
     7   9 F      0.787    -0.185    11.078     3.932
     8   6 C      2.773     0.135    25.039     8.195
     9   9 F      0.787    -0.172    10.950     3.909
    10   6 C      2.773     0.135    25.039     8.195
    11   9 F      0.787    -0.172    10.950     3.909
    12   6 C      2.767     0.142    24.895     8.171
    13   9 F      0.787    -0.185    11.078     3.932
    14   1 H      0.926     0.078     1.999     2.211
    15   1 H      0.926     0.078     1.999     2.211

 Mol. C6AA /au·bohr⁶  :       4710.228992
 Mol. C8AA /au·bohr⁸  :     134398.466359
 Mol. α(0) /au        :        107.388236


Wiberg/Mayer (AO) data.
largest (>0.10) Wiberg bond orders for each atom
          total WBO             WBO to atom ...
     1  C   3.948        C    5 1.467    S    2 1.265    H   14 0.967    C    3 0.140
     2  S   2.767        C    1 1.265    C    3 1.265
     3  C   3.948        C    4 1.467    S    2 1.265    H   15 0.967    C    1 0.140
     4  C   3.984        C    3 1.467    C   12 1.186    C    5 1.152
     5  C   3.984        C    1 1.467    C    6 1.186    C    4 1.152
     6  C   3.894        C    8 1.488    C    5 1.186    F    7 0.985
     7  F   1.129        C    6 0.985
     8  C   3.897        C    6 1.488    C   10 1.191    F    9 0.994
     9  F   1.136        C    8 0.994
    10  C   3.897        C   12 1.488    C    8 1.191    F   11 0.994
    11  F   1.136        C   10 0.994
    12  C   3.894        C   10 1.488    C    4 1.186    F   13 0.985
    13  F   1.129        C   12 0.985
    14  H   0.993        C    1 0.967
    15  H   0.993        C    3 0.967

molecular dipole:
                 x           y           z       tot (Debye)
 q only:       -2.093       0.000       0.150
   full:       -1.863       0.000       0.134       4.747
molecular quadrupole (traceless):
                xx          xy          yy          xz          yz          zz
 q only:       -1.745      -0.000      -4.555       0.239       0.000       6.300
  q+dip:       -4.153       0.000      -4.353       0.613      -0.000       8.506
   full:       -5.535       0.000      -4.677       0.830      -0.000      10.211

           -------------------------------------------------
          |                Geometry Summary                 |
           -------------------------------------------------

      molecular mass/u    :      206.1574000
   center of mass at/Å    :        0.5060375       0.0000000       0.0206347
  moments of inertia/u·Å² :        0.4755132E+03   0.8387660E+03   0.1314279E+04
rotational constants/cm⁻¹ :        0.3545145E-01   0.2009814E-01   0.1282653E-01

 * 14 selected distances

     #   Z        #   Z                                     value/Å
     1   6 C      2  16 S                                 1.7027896 (max)
     2  16 S      3   6 C                                 1.7027895
     3   6 C      4   6 C                                 1.3763623
     1   6 C      5   6 C                                 1.3763623
     4   6 C      5   6 C                                 1.4396472
     5   6 C      6   6 C                                 1.4177325
     6   6 C      8   6 C                                 1.3651762
     8   6 C      9   9 F                                 1.3379170
     8   6 C     10   6 C                                 1.4250343
    10   6 C     11   9 F                                 1.3379171
     4   6 C     12   6 C                                 1.4177325
    10   6 C     12   6 C                                 1.3651762
     1   6 C     14   1 H                                 1.0711056 (min)
     3   6 C     15   1 H                                 1.0711056

 * 4 distinct bonds (by element types)

   Z      Z             #   av. dist./Å        max./Å        min./Å
   1 H    6 C           2     1.0711056     1.0711056     1.0711056
   6 C    6 C           8     1.3979029     1.4396472     1.3651762
   6 C    9 F           2     1.3379171     1.3379171     1.3379170
   6 C   16 S           2     1.7027896     1.7027896     1.7027895


optimized geometry written to: xtbopt.xyz


           -------------------------------------------------
          | TOTAL ENERGY              -40.291649677837 Eh   |
          | GRADIENT NORM               0.000617880222 Eh/α |
          | HOMO-LUMO GAP               2.390733629779 eV   |
           -------------------------------------------------

------------------------------------------------------------------------
 * finished run on 2021/05/19 at 10:59:15.259     
------------------------------------------------------------------------
 total:
 * wall-time:     0 d,  0 h,  0 min,  0.209 sec
 *  cpu-time:     0 d,  0 h,  0 min,  0.208 sec
 * ratio c/w:     0.997 speedup
 SCF:
 * wall-time:     0 d,  0 h,  0 min,  0.029 sec
 *  cpu-time:     0 d,  0 h,  0 min,  0.029 sec
 * ratio c/w:     1.000 speedup
 ANC optimizer:
 * wall-time:     0 d,  0 h,  0 min,  0.160 sec
 *  cpu-time:     0 d,  0 h,  0 min,  0.160 sec
 * ratio c/w:     1.000 speedup

