      -----------------------------------------------------------      
     |                   =====================                   |     
     |                           x T B                           |     
     |                   =====================                   |     
     |                         S. Grimme                         |     
     |          Mulliken Center for Theoretical Chemistry        |     
     |                    University of Bonn                     |     
     |                Version 6.2 RC2 (SAW190805)                |     
      -----------------------------------------------------------      

   This program is distributed in the hope that it will be useful,
   but WITHOUT ANY WARRANTY; without even the implied warranty of
   MERCHANTABILITY or FITNESS FOR A PARTICULAR PURPOSE.
   
   FOR NON-COMMERCIAL, ACADEMIA USE ONLY.
   
   Cite this work as:
   * S. Grimme, C. Bannwarth, P. Shushkov, J. Chem. Theory Comput., 2017,
     13, 1989-2009. DOI: 10.1021/acs.jctc.7b00118
   * C. Bannwarth, S. Ehlert and S. Grimme., J. Chem. Theory Comput., 2019,
     15, 1652-1671. DOI: 10.1021/acs.jctc.8b01176
   * P. Pracht, E. Caldeweyher, S. Ehlert, S. Grimme, ChemRxiv, 2019, preprint.
     DOI: 10.26434/chemrxiv.8326202.v1
   
   for DFT-D4:
   * E. Caldeweyher, C. Bannwarth and S. Grimme, J. Chem. Phys., 2017,
     147, 034112. DOI: 10.1063/1.4993215
   * E. Caldeweyher, S. Ehlert, A. Hansen, H. Neugebauer, S. Spicher,
     C. Bannwarth and S. Grimme, J. Chem. Phys., 2019, 150, 154122.
     DOI: 10.1063/1.5090222
   
   for sTDA-xTB:
   * S. Grimme and C. Bannwarth, J. Chem. Phys., 2016, 145, 054103.
     DOI: 10.1063/1.4959605
   
   in the mass-spec context:
   * V. Asgeirsson, C. Bauer and S. Grimme, Chem. Sci., 2017, 8, 4879.
     DOI: 10.1039/c7sc00601b
   
   for metadynamics refer to:
   * S. Grimme, J. Chem. Theory Comput., 2019, 155, 2847-2862
     DOI: 10.1021/acs.jctc.9b00143
   
   with help from (in alphabetical order)
   C. Bannwarth, F. Bohle, G. Brandenburg, E. Caldeweyher, M. Checinski,
   S. Dohm, S. Ehlert, S. Ehrlich, F. März, H. Neugebauer, J. Pisarek,
   P. Pracht, P. Shushkov, and S. Spicher.
   
 * started run on 2021/05/19 at 10:59:16.322     

           -------------------------------------------------
          |                Calculation Setup                |
           -------------------------------------------------

          program call               : /ihome/ghutchison/geoffh/xtb/xtb 165.xyz -opt
          hostname                   : smp-n83
          coordinate file            : 165.xyz
          omp threads                :                     1
          number of atoms            :                    31
          number of electrons        :                    70
          charge                     :                     0
          spin                       :                   0.0
          first test random number   :      0.17766310232755


########################################################################
# WARNING! Please study the warnings concerning your input carefully
#  - the use of '-opt' is discouraged, please use '--opt' next time
########################################################################

           ------------------------------------------------- 
          |                 G F N 2 - x T B                 |
          | Geometry, Frequencies, Noncovalent interactions |
          |            JCTC 2019 parametrisation            |
           ------------------------------------------------- 
             KAB for C  - Si     :                1.0500
             KAB for H  - Pd     :                0.9500
             k(s)              :                1.8500
             k(p)              :                2.2300
             k(d)              :                2.2300
             k(f)              :                2.0000
             kEN (H0ij)        :               -2.0000
             D4 a1             :                0.5200
             D4 a2             :                5.0000
             D4 s6             :                1.0000
             D4 s8             :                2.7000
             D4 s9             :                5.0000
             alphaj            :                2.0000

  Z AO/shell   Hii/eV     exponent
  1     Wed Apr 25 08:07:45 CEST 2018   EN: 2.200 GM2: 0.406  GM3: 0.0800  RAES: 1.40
     1s    -10.707211    1.230000
  6     Wed Apr 25 08:07:45 CEST 2018   EN: 2.550 GM2: 0.538  GM3: 0.1500  RAES: 3.00
     2s    -13.970922    2.096432
     2p    -10.063292    1.800000

           ------------------------------------------------- 
          |        Self-Consistent Charge Iterations        |
           ------------------------------------------------- 

          ...................................................
          :                      SETUP                      :
          :.................................................:
          :  # basis functions                  70          :
          :  # atomic orbitals                  70          :
          :  # shells                           44          :
          :  # electrons                        70          :
          :  max. iterations                   250          :
          :  Hamiltonian                  GFN2-xTB          :
          :  restarted?                      false          :
          :  GBSA solvation                  false          :
          :  PC potential                    false          :
          :  electronic temp.          300.0000000     K    :
          :  accuracy                    1.0000000          :
          :  -> integral cutoff          0.2500000E+02      :
          :  -> integral neglect         0.1000000E-07      :
          :  -> SCF convergence          0.1000000E-05 Eh   :
          :  -> wf. convergence          0.1000000E-03 e    :
          :  Broyden damping             0.4000000          :
          ...................................................

 iter      E             dE          RMSdq      gap      omega  full diag
   1    -37.5628564 -0.375629E+02  0.387E+00    4.50       0.0  T
   2    -37.6081469 -0.452906E-01  0.226E+00    4.50       1.0  T
   3    -37.5974483  0.106986E-01  0.101E+00    4.48       1.0  T
   4    -37.6073817 -0.993338E-02  0.482E-01    4.47       1.0  T
   5    -37.6125857 -0.520396E-02  0.865E-02    4.50       1.0  T
   6    -37.6126613 -0.756326E-04  0.465E-02    4.51       1.0  T
   7    -37.6126806 -0.192354E-04  0.211E-02    4.50       1.0  T
   8    -37.6126818 -0.123226E-05  0.266E-03    4.51       6.7  T
   9    -37.6126819 -0.104450E-06  0.118E-03    4.51      15.3  T
  10    -37.6126819 -0.676422E-08  0.657E-04    4.51      27.3  T
  11    -37.6126819 -0.580008E-08  0.153E-04    4.51     117.6  T

   *** convergence criteria satisfied after 11 iterations ***

         #    Occupation            Energy/Eh            Energy/eV
      -------------------------------------------------------------
         1        2.0000           -0.6334536             -17.2372
       ...           ...                  ...                  ...
        29        2.0000           -0.4308048             -11.7228
        30        2.0000           -0.4250471             -11.5661
        31        2.0000           -0.4161800             -11.3248
        32        2.0000           -0.4035161             -10.9802
        33        2.0000           -0.3834503             -10.4342
        34        2.0000           -0.3807264             -10.3601
        35        2.0000           -0.3800322             -10.3412 (HOMO)
        36                         -0.2144695              -5.8360 (LUMO)
        37                         -0.2127581              -5.7894
        38                         -0.1993334              -5.4241
        39                         -0.0943097              -2.5663
        40                          0.0713595               1.9418
       ...                                ...                  ...
        70                          0.6234479              16.9649
      -------------------------------------------------------------
                  HL-Gap            0.1655626 Eh            4.5052 eV
             Fermi-level           -0.2972509 Eh           -8.0886 eV

 SCC (total)                   0 d,  0 h,  0 min,  0.041 sec
 SCC setup                      ...        0 min,  0.000 sec (  0.839%)
 Dispersion                     ...        0 min,  0.000 sec (  1.173%)
 integral evaluation            ...        0 min,  0.009 sec ( 22.796%)
 zeroth order Hamiltonian       ...        0 min,  0.000 sec (  0.465%)
 iterations                     ...        0 min,  0.015 sec ( 35.539%)
 molecular gradient             ...        0 min,  0.016 sec ( 38.032%)
 printout                       ...        0 min,  0.000 sec (  1.022%)

         :::::::::::::::::::::::::::::::::::::::::::::::::::::
         ::                     SUMMARY                     ::
         :::::::::::::::::::::::::::::::::::::::::::::::::::::
         :: total energy             -36.990414045774 Eh    ::
         :: gradient norm              0.047856612844 Eh/a0 ::
         :: HOMO-LUMO gap              4.505188392304 eV    ::
         ::.................................................::
         :: SCC energy               -37.612681899593 Eh    ::
         :: -> isotropic ES            0.004503433569 Eh    ::
         :: -> anisotropic ES          0.009337376774 Eh    ::
         :: -> anisotropic XC          0.024875807154 Eh    ::
         :: -> dispersion             -0.027866740502 Eh    ::
         :: repulsion energy           0.621914147905 Eh    ::
         :: add. restraining           0.000000000000 Eh    ::
         :::::::::::::::::::::::::::::::::::::::::::::::::::::

      ----------------------------------------------------------- 
     |                   =====================                   |
     |                        A N C O P T                        |
     |                   =====================                   |
     |               Approximate Normal Coordinate               |
     |                Rational Function Optimizer                |
      ----------------------------------------------------------- 

          ...................................................
          :                      SETUP                      :
          :.................................................:
          :   optimization level            normal          :
          :   max. optcycles                   200          :
          :   ANC micro-cycles                  20          :
          :   degrees of freedom                87          :
          :.................................................:
          :   RF solver                   davidson          :
          :   input Hessian                  false          :
          :   write xtbopt.log                true          :
          :   linear?                        false          :
          :   energy convergence         0.5000000E-05 Eh   :
          :   grad. convergence          0.1000000E-02 Eh/α :
          :   maximium RF displ.         2.0000000          :
          :   Hlow (freq-cutoff)         0.5000000E-02      :
          :   Hmax (freq-cutoff)         5.0000000          :
          :   S6 in model hess.         20.0000000          :
          ...................................................

generating ANC from model Hessian ...
Using Lindh-Hessian (1995)
 Shifting diagonal of input Hessian by   4.425023371848353E-003
 Lowest  eigenvalues of input Hessian
   -0.000000    0.000000    0.000000    0.000000    0.000000    0.000000
    0.005000    0.005461    0.006154    0.006511    0.007517    0.008300
    0.009273    0.009785    0.011904    0.014071    0.014611    0.017017
 Highest eigenvalues
    1.512463    1.565697    1.767338    1.839012    1.907361    1.936302
 

........................................................................
.............................. CYCLE    1 ..............................
........................................................................
   1    -37.6126819 -0.376127E+02  0.761E-05    4.51       0.0  T
   2    -37.6126819 -0.495319E-10  0.443E-05    4.51     405.6  T
   3    -37.6126819 -0.248690E-10  0.275E-05    4.51     653.9  T
     SCC iter.                  ...        0 min,  0.005 sec
     gradient                   ...        0 min,  0.016 sec
 * total energy  :   -36.9904140 Eh     change        0.9601784E-08 Eh
   gradient norm :     0.0478566 Eh/α   predicted     0.0000000E+00 (-100.00%)
   displ. norm   :     0.2678912 α      lambda       -0.5543966E-02
   maximum displ.:     0.1115572 α      in ANC's #10, #13, #8, ...

........................................................................
.............................. CYCLE    2 ..............................
........................................................................
   1    -37.6449554 -0.376450E+02  0.108E-01    4.64       0.0  T
   2    -37.6449692 -0.138428E-04  0.648E-02    4.64       1.0  T
   3    -37.6449632  0.606687E-05  0.211E-02    4.64       1.0  T
   4    -37.6449706 -0.739836E-05  0.462E-03    4.64       3.9  T
   5    -37.6449711 -0.520985E-06  0.108E-03    4.64      16.6  T
   6    -37.6449711 -0.448331E-09  0.510E-04    4.64      35.2  T
     SCC iter.                  ...        0 min,  0.008 sec
     gradient                   ...        0 min,  0.015 sec
 * total energy  :   -36.9939357 Eh     change       -0.3521637E-02 Eh
   gradient norm :     0.0134361 Eh/α   predicted    -0.2970922E-02 ( -15.64%)
   displ. norm   :     0.2080805 α      lambda       -0.8779250E-03
   maximum displ.:     0.1075696 α      in ANC's #10, #8, #13, ...

........................................................................
.............................. CYCLE    3 ..............................
........................................................................
   1    -37.6548889 -0.376549E+02  0.662E-02    4.68       0.0  T
   2    -37.6548924 -0.352774E-05  0.392E-02    4.68       1.0  T
   3    -37.6548891  0.333263E-05  0.129E-02    4.68       1.4  T
   4    -37.6548931 -0.395238E-05  0.274E-03    4.68       6.6  T
   5    -37.6548932 -0.174060E-06  0.100E-03    4.68      17.9  T
   6    -37.6548932 -0.153004E-07  0.577E-04    4.68      31.1  T
     SCC iter.                  ...        0 min,  0.008 sec
     gradient                   ...        0 min,  0.015 sec
 * total energy  :   -36.9944704 Eh     change       -0.5347728E-03 Eh
   gradient norm :     0.0041860 Eh/α   predicted    -0.4579688E-03 ( -14.36%)
   displ. norm   :     0.1314111 α      lambda       -0.1722867E-03
   maximum displ.:     0.0574689 α      in ANC's #8, #13, #10, ...

........................................................................
.............................. CYCLE    4 ..............................
........................................................................
   1    -37.6554217 -0.376554E+02  0.451E-02    4.68       0.0  T
   2    -37.6554223 -0.631303E-06  0.267E-02    4.68       1.0  T
   3    -37.6554213  0.102323E-05  0.633E-03    4.68       2.8  T
   4    -37.6554225 -0.122002E-05  0.925E-04    4.68      19.4  T
   5    -37.6554225 -0.112531E-07  0.432E-04    4.68      41.6  T
     SCC iter.                  ...        0 min,  0.007 sec
     gradient                   ...        0 min,  0.015 sec
 * total energy  :   -36.9945898 Eh     change       -0.1193903E-03 Eh
   gradient norm :     0.0026768 Eh/α   predicted    -0.8763244E-04 ( -26.60%)
   displ. norm   :     0.1157491 α      lambda       -0.7993694E-04
   maximum displ.:     0.0670366 α      in ANC's #1, #6, #13, ...

........................................................................
.............................. CYCLE    5 ..............................
........................................................................
   1    -37.6546048 -0.376546E+02  0.396E-02    4.67       0.0  T
   2    -37.6546050 -0.204565E-06  0.234E-02    4.67       1.0  T
   3    -37.6546045  0.526741E-06  0.492E-03    4.67       3.7  T
   4    -37.6546051 -0.623475E-06  0.687E-04    4.67      26.2  T
   5    -37.6546051 -0.904670E-09  0.478E-04    4.67      37.6  T
     SCC iter.                  ...        0 min,  0.007 sec
     gradient                   ...        0 min,  0.015 sec
 * total energy  :   -36.9946441 Eh     change       -0.5430048E-04 Eh
   gradient norm :     0.0014896 Eh/α   predicted    -0.4050498E-04 ( -25.41%)
   displ. norm   :     0.1245941 α      lambda       -0.3451555E-04
   maximum displ.:     0.0913464 α      in ANC's #1, #6, #5, ...

........................................................................
.............................. CYCLE    6 ..............................
........................................................................
   1    -37.6539580 -0.376540E+02  0.404E-02    4.67       0.0  T
   2    -37.6539581 -0.914467E-07  0.239E-02    4.67       1.0  T
   3    -37.6539580  0.137595E-06  0.279E-03    4.67       6.4  T
   4    -37.6539582 -0.180956E-06  0.589E-04    4.67      30.5  T
   5    -37.6539582 -0.502055E-09  0.368E-04    4.67      48.8  T
     SCC iter.                  ...        0 min,  0.007 sec
     gradient                   ...        0 min,  0.015 sec
 * total energy  :   -36.9946810 Eh     change       -0.3685012E-04 Eh
   gradient norm :     0.0017502 Eh/α   predicted    -0.1737933E-04 ( -52.84%)
   displ. norm   :     0.0900760 α      lambda       -0.2480660E-04
   maximum displ.:     0.0697746 α      in ANC's #1, #5, #12, ...

........................................................................
.............................. CYCLE    7 ..............................
........................................................................
   1    -37.6542261 -0.376542E+02  0.275E-02    4.67       0.0  T
   2    -37.6542261 -0.565146E-07  0.163E-02    4.67       1.1  T
   3    -37.6542260  0.108421E-06  0.210E-03    4.67       8.5  T
   4    -37.6542262 -0.133688E-06  0.338E-04    4.67      53.1  T
   5    -37.6542262 -0.374577E-09  0.217E-04    4.67      82.9  T
     SCC iter.                  ...        0 min,  0.007 sec
     gradient                   ...        0 min,  0.015 sec
 * total energy  :   -36.9947119 Eh     change       -0.3089742E-04 Eh
   gradient norm :     0.0013451 Eh/α   predicted    -0.1245458E-04 ( -59.69%)
   displ. norm   :     0.1072376 α      lambda       -0.2427744E-04
   maximum displ.:     0.0822725 α      in ANC's #1, #5, #12, ...

........................................................................
.............................. CYCLE    8 ..............................
........................................................................
   1    -37.6545413 -0.376545E+02  0.324E-02    4.67       0.0  T
   2    -37.6545414 -0.689807E-07  0.192E-02    4.67       1.0  T
   3    -37.6545411  0.292265E-06  0.363E-03    4.67       5.0  T
   4    -37.6545414 -0.337941E-06  0.484E-04    4.67      37.1  T
   5    -37.6545414 -0.164689E-08  0.310E-04    4.67      57.9  T
     SCC iter.                  ...        0 min,  0.007 sec
     gradient                   ...        0 min,  0.016 sec
 * total energy  :   -36.9947406 Eh     change       -0.2874221E-04 Eh
   gradient norm :     0.0008295 Eh/α   predicted    -0.1220178E-04 ( -57.55%)
   displ. norm   :     0.1075445 α      lambda       -0.1845184E-04
   maximum displ.:     0.0832794 α      in ANC's #1, #5, #12, ...

........................................................................
.............................. CYCLE    9 ..............................
........................................................................
   1    -37.6547158 -0.376547E+02  0.342E-02    4.67       0.0  T
   2    -37.6547159 -0.456655E-07  0.203E-02    4.67       1.0  T
   3    -37.6547157  0.165975E-06  0.284E-03    4.67       6.3  T
   4    -37.6547159 -0.197131E-06  0.415E-04    4.67      43.3  T
   5    -37.6547159 -0.844821E-09  0.252E-04    4.67      71.3  T
     SCC iter.                  ...        0 min,  0.007 sec
     gradient                   ...        0 min,  0.016 sec
 * total energy  :   -36.9947620 Eh     change       -0.2136069E-04 Eh
   gradient norm :     0.0009301 Eh/α   predicted    -0.9274587E-05 ( -56.58%)
   displ. norm   :     0.0996520 α      lambda       -0.1430346E-04
   maximum displ.:     0.0771999 α      in ANC's #1, #5, #12, ...

........................................................................
.............................. CYCLE   10 ..............................
........................................................................
   1    -37.6548020 -0.376548E+02  0.306E-02    4.67       0.0  T
   2    -37.6548020 -0.363127E-07  0.181E-02    4.67       1.0  T
   3    -37.6548020 -0.269773E-08  0.800E-04    4.67      22.5  T
   4    -37.6548020 -0.104202E-07  0.401E-04    4.67      44.8  T
     SCC iter.                  ...        0 min,  0.006 sec
     gradient                   ...        0 min,  0.015 sec
 * total energy  :   -36.9947797 Eh     change       -0.1774185E-04 Eh
   gradient norm :     0.0007300 Eh/α   predicted    -0.7187170E-05 ( -59.49%)
   displ. norm   :     0.0931980 α      lambda       -0.1128342E-04
   maximum displ.:     0.0726251 α      in ANC's #1, #5, #12, ...

........................................................................
.............................. CYCLE   11 ..............................
........................................................................
   1    -37.6547509 -0.376548E+02  0.296E-02    4.67       0.0  T
   2    -37.6547510 -0.408686E-07  0.175E-02    4.67       1.0  T
   3    -37.6547509  0.390958E-07  0.158E-03    4.67      11.4  T
   4    -37.6547510 -0.547001E-07  0.368E-04    4.67      48.8  T
   5    -37.6547510 -0.133151E-08  0.196E-04    4.67      91.8  T
     SCC iter.                  ...        0 min,  0.007 sec
     gradient                   ...        0 min,  0.015 sec
 * total energy  :   -36.9947937 Eh     change       -0.1399656E-04 Eh
   gradient norm :     0.0004563 Eh/α   predicted    -0.5664390E-05 ( -59.53%)
   displ. norm   :     0.0941938 α      lambda       -0.5669907E-05
   maximum displ.:     0.0739014 α      in ANC's #1, #5, #12, ...

........................................................................
.............................. CYCLE   12 ..............................
........................................................................
   1    -37.6545715 -0.376546E+02  0.297E-02    4.67       0.0  T
   2    -37.6545715 -0.411330E-07  0.176E-02    4.67       1.0  T
   3    -37.6545715  0.603709E-07  0.185E-03    4.67       9.7  T
   4    -37.6545716 -0.783742E-07  0.368E-04    4.67      48.9  T
   5    -37.6545716 -0.102995E-08  0.201E-04    4.67      89.3  T
     SCC iter.                  ...        0 min,  0.007 sec
     gradient                   ...        0 min,  0.015 sec
 * total energy  :   -36.9948022 Eh     change       -0.8455891E-05 Eh
   gradient norm :     0.0005199 Eh/α   predicted    -0.2849773E-05 ( -66.30%)
   displ. norm   :     0.0931566 α      lambda        0.1291603E-05
   maximum displ.:     0.0725733 α      in ANC's #1, #5, #12, ...

........................................................................
.............................. CYCLE   13 ..............................
........................................................................
   1    -37.6542747 -0.376543E+02  0.295E-02    4.67       0.0  T
   2    -37.6542748 -0.398221E-07  0.174E-02    4.67       1.0  T
   3    -37.6542747  0.663020E-07  0.190E-03    4.67       9.4  T
   4    -37.6542748 -0.846744E-07  0.361E-04    4.67      49.7  T
   5    -37.6542748 -0.860396E-09  0.196E-04    4.67      91.7  T
     SCC iter.                  ...        0 min,  0.007 sec
     gradient                   ...        0 min,  0.016 sec
 * total energy  :   -36.9948046 Eh     change       -0.2372627E-05 Eh
   gradient norm :     0.0008847 Eh/α   predicted     0.6443660E-06 (-127.16%)
   displ. norm   :     0.0933407 α      lambda        0.8124964E-05
   maximum displ.:     0.0728125 α      in ANC's #1, #5, #12, ...

   *** GEOMETRY OPTIMIZATION CONVERGED AFTER 13 ITERATIONS ***

------------------------------------------------------------------------
 total energy gain   :        -0.0043905 Eh       -2.7551 kcal/mol
 total RMSD          :         0.2057420 a0        0.1089 Å
 total power (kW/mol):        -0.8867137 (step)  -26.6497 (real)
------------------------------------------------------------------------

 ANCopt (total)                0 d,  0 h,  0 min,  0.433 sec
 optimizer setup                ...        0 min,  0.000 sec (  0.038%)
 model hessian                  ...        0 min,  0.011 sec (  2.536%)
 ANC generation                 ...        0 min,  0.001 sec (  0.229%)
 coordinate transformation      ...        0 min,  0.000 sec (  0.070%)
 single point calculation       ...        0 min,  0.416 sec ( 96.135%)
 optimization log               ...        0 min,  0.002 sec (  0.380%)
 hessian update                 ...        0 min,  0.000 sec (  0.048%)
 rational function              ...        0 min,  0.002 sec (  0.364%)

================
 final structure:
================
$coord
    2.45380662381337   -0.20897782589972    0.06913849101357      C 
    1.17828135610256    2.06932854162044    0.13297553888205      C 
   -1.44378339690633    2.14071480668707    0.09387569527678      C 
   -2.77998984538089    4.64939228398143    0.13434315212000      C 
   -3.06305076101949    5.71992391917736   -2.53521946897717      C 
   -2.79794661602164   -0.11991102836481   -0.02852494931824      C 
   -1.51840527790861   -2.42721234666542   -0.04494309602862      C 
    1.10439799069318   -2.44426996732194   -0.00662056486700      C 
   -2.93665151081375   -4.88874804436134   -0.14876368923738      C 
   -3.24150768484918   -5.80026933086592   -2.87490715215412      C 
   -5.59332326336762   -0.07718810216483   -0.08537281051088      C 
   -6.95372227551743    0.01261029467746   -2.18143253619242      C 
   -9.77221759249762    0.04967938443764   -2.27024138871673      C 
    4.49505418387352   -0.24312992754492    0.09583146270140      H 
    2.22307734264887    3.82261279833508    0.22408467968083      H 
   -1.69649499193792    5.98059044637629    1.28179504181785      H 
   -4.65007912982238    4.43748937967443    0.97835729496941      H 
   -1.22232097486080    5.90072448273139   -3.43207717927748      H 
   -3.95128919579068    7.57311714757150   -2.47603705947790      H 
   -4.22438596459687    4.47209502056887   -3.68102071439686      H 
    2.09117908379246   -4.23285393206494   -0.02819727538298      H 
   -4.80370489879838   -4.66153172159935    0.69925305434314      H 
   -1.90338377910826   -6.31628629993672    0.92809215487525      H 
   -4.35511970169484   -4.45259049925298   -3.95461025375942      H 
   -4.19197390626440   -7.62337552009594   -2.92055012664788      H 
   -1.40294033375107   -5.99268112771270   -3.77506524685678      H 
   -6.52554682043536   -0.13338727911739    1.74121792832536      H 
   -6.01393891214143    0.06443858629964   -3.99990127696213      H 
  -10.57210693376357   -0.07520190760417   -0.38103060722292      H 
  -10.47064783725386   -1.52765077600542   -3.39576423349779      H 
  -10.43575787129864    1.78701210169944   -3.15824247967628      H 
$end
           -------------------------------------------------
          |                Final Singlepoint                |
           -------------------------------------------------

          ...................................................
          :                      SETUP                      :
          :.................................................:
          :  # basis functions                  70          :
          :  # atomic orbitals                  70          :
          :  # shells                           44          :
          :  # electrons                        70          :
          :  max. iterations                   250          :
          :  Hamiltonian                  GFN2-xTB          :
          :  restarted?                      false          :
          :  GBSA solvation                  false          :
          :  PC potential                    false          :
          :  electronic temp.          300.0000000     K    :
          :  accuracy                    1.0000000          :
          :  -> integral cutoff          0.2500000E+02      :
          :  -> integral neglect         0.1000000E-07      :
          :  -> SCF convergence          0.1000000E-05 Eh   :
          :  -> wf. convergence          0.1000000E-03 e    :
          :  Broyden damping             0.4000000          :
          ...................................................

 iter      E             dE          RMSdq      gap      omega  full diag
   1    -37.6542748 -0.376543E+02  0.890E-05    4.67       0.0  T
   2    -37.6542748 -0.456524E-10  0.365E-05    4.67     491.9  T
   3    -37.6542748 -0.430447E-10  0.328E-05    4.67     547.8  T

   *** convergence criteria satisfied after 3 iterations ***

         #    Occupation            Energy/Eh            Energy/eV
      -------------------------------------------------------------
         1        2.0000           -0.6378752             -17.3575
       ...           ...                  ...                  ...
        29        2.0000           -0.4313709             -11.7382
        30        2.0000           -0.4277837             -11.6406
        31        2.0000           -0.4150707             -11.2946
        32        2.0000           -0.4039798             -10.9928
        33        2.0000           -0.3858345             -10.4991
        34        2.0000           -0.3826516             -10.4125
        35        2.0000           -0.3818880             -10.3917 (HOMO)
        36                         -0.2103107              -5.7228 (LUMO)
        37                         -0.2099560              -5.7132
        38                         -0.1951696              -5.3108
        39                         -0.0859832              -2.3397
        40                          0.0873928               2.3781
       ...                                ...                  ...
        70                          0.6649578              18.0944
      -------------------------------------------------------------
                  HL-Gap            0.1715773 Eh            4.6689 eV
             Fermi-level           -0.2960994 Eh           -8.0573 eV

 SCC (total)                   0 d,  0 h,  0 min,  0.031 sec
 SCC setup                      ...        0 min,  0.000 sec (  0.789%)
 Dispersion                     ...        0 min,  0.000 sec (  0.871%)
 integral evaluation            ...        0 min,  0.009 sec ( 30.224%)
 zeroth order Hamiltonian       ...        0 min,  0.000 sec (  0.560%)
 iterations                     ...        0 min,  0.005 sec ( 14.813%)
 molecular gradient             ...        0 min,  0.016 sec ( 51.278%)
 printout                       ...        0 min,  0.000 sec (  1.268%)

         :::::::::::::::::::::::::::::::::::::::::::::::::::::
         ::                     SUMMARY                     ::
         :::::::::::::::::::::::::::::::::::::::::::::::::::::
         :: total energy             -36.994804535216 Eh    ::
         :: gradient norm              0.000884595097 Eh/a0 ::
         :: HOMO-LUMO gap              4.668856925392 eV    ::
         ::.................................................::
         :: SCC energy               -37.654274796650 Eh    ::
         :: -> isotropic ES            0.004779717826 Eh    ::
         :: -> anisotropic ES          0.008608257797 Eh    ::
         :: -> anisotropic XC          0.023978754134 Eh    ::
         :: -> dispersion             -0.028247840545 Eh    ::
         :: repulsion energy           0.659105633862 Eh    ::
         :: add. restraining           0.000000000000 Eh    ::
         :::::::::::::::::::::::::::::::::::::::::::::::::::::

           -------------------------------------------------
          |                Property Printout                |
           -------------------------------------------------

    * Orbital Energies and Occupations

         #    Occupation            Energy/Eh            Energy/eV
      -------------------------------------------------------------
         1        2.0000           -0.6378752             -17.3575
       ...           ...                  ...                  ...
        23        2.0000           -0.4659840             -12.6801
        24        2.0000           -0.4575551             -12.4507
        25        2.0000           -0.4452926             -12.1170
        26        2.0000           -0.4450238             -12.1097
        27        2.0000           -0.4438322             -12.0773
        28        2.0000           -0.4392541             -11.9527
        29        2.0000           -0.4313709             -11.7382
        30        2.0000           -0.4277837             -11.6406
        31        2.0000           -0.4150707             -11.2946
        32        2.0000           -0.4039798             -10.9928
        33        2.0000           -0.3858345             -10.4991
        34        2.0000           -0.3826516             -10.4125
        35        2.0000           -0.3818880             -10.3917 (HOMO)
        36                         -0.2103107              -5.7228 (LUMO)
        37                         -0.2099560              -5.7132
        38                         -0.1951696              -5.3108
        39                         -0.0859832              -2.3397
        40                          0.0873928               2.3781
        41                          0.0962579               2.6193
        42                          0.1250139               3.4018
        43                          0.1322004               3.5974
        44                          0.1371669               3.7325
        45                          0.1410461               3.8381
        46                          0.1455139               3.9596
       ...                                ...                  ...
        70                          0.6649578              18.0944
      -------------------------------------------------------------
                  HL-Gap            0.1715773 Eh            4.6689 eV
             Fermi-level           -0.2960994 Eh           -8.0573 eV

     #   Z        covCN         q      C6AA      α(0)
     1   6 C      2.916    -0.037    28.914     8.818
     2   6 C      2.925    -0.044    29.081     8.844
     3   6 C      2.973     0.005    27.906     8.665
     4   6 C      3.806    -0.057    21.588     6.614
     5   6 C      3.753    -0.097    22.412     6.751
     6   6 C      2.981    -0.002    28.067     8.690
     7   6 C      2.973     0.005    27.907     8.665
     8   6 C      2.925    -0.044    29.081     8.844
     9   6 C      3.806    -0.057    21.589     6.614
    10   6 C      3.753    -0.097    22.409     6.751
    11   6 C      2.897    -0.039    28.971     8.825
    12   6 C      2.889    -0.033    28.822     8.802
    13   6 C      3.755    -0.101    22.490     6.762
    14   1 H      0.926     0.025     2.656     2.548
    15   1 H      0.926     0.026     2.639     2.540
    16   1 H      0.924     0.033     2.540     2.492
    17   1 H      0.924     0.035     2.516     2.480
    18   1 H      0.925     0.035     2.518     2.481
    19   1 H      0.925     0.032     2.553     2.499
    20   1 H      0.925     0.036     2.502     2.474
    21   1 H      0.926     0.026     2.638     2.540
    22   1 H      0.924     0.035     2.515     2.480
    23   1 H      0.924     0.033     2.540     2.492
    24   1 H      0.925     0.036     2.505     2.475
    25   1 H      0.925     0.032     2.552     2.498
    26   1 H      0.925     0.035     2.518     2.481
    27   1 H      0.925     0.030     2.586     2.515
    28   1 H      0.925     0.025     2.652     2.547
    29   1 H      0.925     0.037     2.493     2.469
    30   1 H      0.925     0.041     2.432     2.439
    31   1 H      0.924     0.042     2.427     2.436

 Mol. C6AA /au·bohr⁶  :       8999.337690
 Mol. C8AA /au·bohr⁸  :     207627.819514
 Mol. α(0) /au        :        148.530813


Wiberg/Mayer (AO) data.
largest (>0.10) Wiberg bond orders for each atom
          total WBO             WBO to atom ...
     1  C   3.992        C    2 1.441    C    8 1.440    H   14 0.971    C    6 0.105
     2  C   3.991        C    1 1.441    C    3 1.414    H   15 0.969    C    7 0.106
     3  C   3.988        C    2 1.414    C    6 1.382    C    4 1.011    C    8 0.106
     4  C   3.997        C    3 1.011    C    5 1.002    H   16 0.974    H   17 0.972
     5  C   3.997        C    4 1.002    H   18 0.988    H   19 0.987    H   20 0.986
     6  C   3.989        C    3 1.382    C    7 1.381    C   11 1.017    C    1 0.105
     7  C   3.988        C    8 1.415    C    6 1.381    C    9 1.011    C    2 0.106
     8  C   3.991        C    1 1.440    C    7 1.415    H   21 0.969    C    3 0.106
     9  C   3.997        C    7 1.011    C   10 1.002    H   23 0.974    H   22 0.972
    10  C   3.997        C    9 1.002    H   26 0.988    H   25 0.987    H   24 0.986
    11  C   3.991        C   12 1.921    C    6 1.017    H   27 0.950
    12  C   3.989        C   11 1.921    C   13 1.037    H   28 0.965
    13  C   3.996        C   12 1.037    H   29 0.986    H   30 0.972    H   31 0.971
    14  H   0.998        C    1 0.971
    15  H   0.998        C    2 0.969
    16  H   0.999        C    4 0.974
    17  H   0.999        C    4 0.972
    18  H   0.999        C    5 0.988
    19  H   0.998        C    5 0.987
    20  H   0.999        C    5 0.986
    21  H   0.998        C    8 0.969
    22  H   0.999        C    9 0.972
    23  H   0.999        C    9 0.974
    24  H   0.999        C   10 0.986
    25  H   0.998        C   10 0.987
    26  H   0.999        C   10 0.988
    27  H   0.999        C   11 0.950
    28  H   0.999        C   12 0.965
    29  H   0.999        C   13 0.986
    30  H   0.998        C   13 0.972
    31  H   0.998        C   13 0.971

molecular dipole:
                 x           y           z       tot (Debye)
 q only:       -0.318       0.007      -0.073
   full:       -0.354       0.009      -0.097       0.934
molecular quadrupole (traceless):
                xx          xy          yy          xz          yz          zz
 q only:        2.175       0.007      -0.009       0.983       0.062      -2.166
  q+dip:        5.067      -0.030       0.327       1.124       0.157      -5.393
   full:        3.401      -0.011      -0.081       1.059       0.091      -3.320

           -------------------------------------------------
          |                Geometry Summary                 |
           -------------------------------------------------

      molecular mass/u    :      174.2852000
   center of mass at/Å    :       -1.4965871      -0.0520537      -0.4326957
  moments of inertia/u·Å² :        0.6105122E+03   0.6321021E+03   0.1128973E+04
rotational constants/cm⁻¹ :        0.2761228E-01   0.2666916E-01   0.1493183E-01

 * 27 selected distances

     #   Z        #   Z                                     value/Å
     1   6 C      2   6 C                                 1.3821275
     2   6 C      3   6 C                                 1.3882054
     4   6 C      5   6 C                                 1.5293796
     3   6 C      6   6 C                                 1.3959822
     6   6 C      7   6 C                                 1.3961793
     1   6 C      8   6 C                                 1.3822748
     7   6 C      8   6 C                                 1.3881053
     9   6 C     10   6 C                                 1.5296488 (max)
    11   6 C     12   6 C                                 1.3231776
     1   6 C     14   1 H                                 1.0804253 (min)
     2   6 C     15   1 H                                 1.0811164
     4   6 C     16   1 H                                 1.0925550
     4   6 C     17   1 H                                 1.0915038
     5   6 C     18   1 H                                 1.0877558
     5   6 C     19   1 H                                 1.0879446
     5   6 C     20   1 H                                 1.0868941
     8   6 C     21   1 H                                 1.0810296
     9   6 C     22   1 H                                 1.0917798
     9   6 C     23   1 H                                 1.0928665
    10   6 C     24   1 H                                 1.0873439
    10   6 C     25   1 H                                 1.0882522
    10   6 C     26   1 H                                 1.0880529
    11   6 C     27   1 H                                 1.0856046
    12   6 C     28   1 H                                 1.0835488
    13   6 C     29   1 H                                 1.0876538
    13   6 C     30   1 H                                 1.0899737
    13   6 C     31   1 H                                 1.0905619

 * 2 distinct bonds (by element types)

   Z      Z             #   av. dist./Å        max./Å        min./Å
   1 H    6 C          18     1.0874924     1.0928665     1.0804253
   6 C    6 C           9     1.4127867     1.5296488     1.3231776


optimized geometry written to: xtbopt.xyz


           -------------------------------------------------
          | TOTAL ENERGY              -36.994804535216 Eh   |
          | GRADIENT NORM               0.000884595097 Eh/α |
          | HOMO-LUMO GAP               4.668856925392 eV   |
           -------------------------------------------------

------------------------------------------------------------------------
 * finished run on 2021/05/19 at 10:59:16.849     
------------------------------------------------------------------------
 total:
 * wall-time:     0 d,  0 h,  0 min,  0.527 sec
 *  cpu-time:     0 d,  0 h,  0 min,  0.527 sec
 * ratio c/w:     0.999 speedup
 SCF:
 * wall-time:     0 d,  0 h,  0 min,  0.041 sec
 *  cpu-time:     0 d,  0 h,  0 min,  0.041 sec
 * ratio c/w:     0.999 speedup
 ANC optimizer:
 * wall-time:     0 d,  0 h,  0 min,  0.464 sec
 *  cpu-time:     0 d,  0 h,  0 min,  0.464 sec
 * ratio c/w:     1.000 speedup

