      -----------------------------------------------------------      
     |                   =====================                   |     
     |                           x T B                           |     
     |                   =====================                   |     
     |                         S. Grimme                         |     
     |          Mulliken Center for Theoretical Chemistry        |     
     |                    University of Bonn                     |     
     |                Version 6.2 RC2 (SAW190805)                |     
      -----------------------------------------------------------      

   This program is distributed in the hope that it will be useful,
   but WITHOUT ANY WARRANTY; without even the implied warranty of
   MERCHANTABILITY or FITNESS FOR A PARTICULAR PURPOSE.
   
   FOR NON-COMMERCIAL, ACADEMIA USE ONLY.
   
   Cite this work as:
   * S. Grimme, C. Bannwarth, P. Shushkov, J. Chem. Theory Comput., 2017,
     13, 1989-2009. DOI: 10.1021/acs.jctc.7b00118
   * C. Bannwarth, S. Ehlert and S. Grimme., J. Chem. Theory Comput., 2019,
     15, 1652-1671. DOI: 10.1021/acs.jctc.8b01176
   * P. Pracht, E. Caldeweyher, S. Ehlert, S. Grimme, ChemRxiv, 2019, preprint.
     DOI: 10.26434/chemrxiv.8326202.v1
   
   for DFT-D4:
   * E. Caldeweyher, C. Bannwarth and S. Grimme, J. Chem. Phys., 2017,
     147, 034112. DOI: 10.1063/1.4993215
   * E. Caldeweyher, S. Ehlert, A. Hansen, H. Neugebauer, S. Spicher,
     C. Bannwarth and S. Grimme, J. Chem. Phys., 2019, 150, 154122.
     DOI: 10.1063/1.5090222
   
   for sTDA-xTB:
   * S. Grimme and C. Bannwarth, J. Chem. Phys., 2016, 145, 054103.
     DOI: 10.1063/1.4959605
   
   in the mass-spec context:
   * V. Asgeirsson, C. Bauer and S. Grimme, Chem. Sci., 2017, 8, 4879.
     DOI: 10.1039/c7sc00601b
   
   for metadynamics refer to:
   * S. Grimme, J. Chem. Theory Comput., 2019, 155, 2847-2862
     DOI: 10.1021/acs.jctc.9b00143
   
   with help from (in alphabetical order)
   C. Bannwarth, F. Bohle, G. Brandenburg, E. Caldeweyher, M. Checinski,
   S. Dohm, S. Ehlert, S. Ehrlich, F. März, H. Neugebauer, J. Pisarek,
   P. Pracht, P. Shushkov, and S. Spicher.
   
 * started run on 2021/05/19 at 10:59:17.984     

           -------------------------------------------------
          |                Calculation Setup                |
           -------------------------------------------------

          program call               : /ihome/ghutchison/geoffh/xtb/xtb 171.xyz -opt
          hostname                   : smp-n83
          coordinate file            : 171.xyz
          omp threads                :                     1
          number of atoms            :                    30
          number of electrons        :                    94
          charge                     :                     0
          spin                       :                   0.0
          first test random number   :      0.48257632973557


########################################################################
# WARNING! Please study the warnings concerning your input carefully
#  - the use of '-opt' is discouraged, please use '--opt' next time
########################################################################

           ------------------------------------------------- 
          |                 G F N 2 - x T B                 |
          | Geometry, Frequencies, Noncovalent interactions |
          |            JCTC 2019 parametrisation            |
           ------------------------------------------------- 
             KAB for C  - Si     :                1.0500
             KAB for H  - Pd     :                0.9500
             k(s)              :                1.8500
             k(p)              :                2.2300
             k(d)              :                2.2300
             k(f)              :                2.0000
             kEN (H0ij)        :               -2.0000
             D4 a1             :                0.5200
             D4 a2             :                5.0000
             D4 s6             :                1.0000
             D4 s8             :                2.7000
             D4 s9             :                5.0000
             alphaj            :                2.0000

  Z AO/shell   Hii/eV     exponent
  1     Wed Apr 25 08:07:45 CEST 2018   EN: 2.200 GM2: 0.406  GM3: 0.0800  RAES: 1.40
     1s    -10.707211    1.230000
  6     Wed Apr 25 08:07:45 CEST 2018   EN: 2.550 GM2: 0.538  GM3: 0.1500  RAES: 3.00
     2s    -13.970922    2.096432
     2p    -10.063292    1.800000
  8     Wed Apr 25 08:07:45 CEST 2018   EN: 3.440 GM2: 0.452  GM3:-0.0517  RAES: 1.80
     2s    -20.229985    2.439742
     2p    -15.503117    2.137023
  9     Mon Apr 23 13:58:50 CEST 2018   EN: 3.980 GM2: 0.532  GM3: 0.1426  RAES: 2.40
     2s    -23.458179    2.416361
     2p    -15.746583    2.308399
 16     Tue Apr 24 11:44:34 CEST 2018   EN: 2.580 GM2: 0.340  GM3:-0.0502  RAES: 3.10
     3s    -20.029654    1.981333
     3p    -11.377694    2.025643
     3d     -0.420282    1.702555

           ------------------------------------------------- 
          |        Self-Consistent Charge Iterations        |
           ------------------------------------------------- 

          ...................................................
          :                      SETUP                      :
          :.................................................:
          :  # basis functions                  87          :
          :  # atomic orbitals                  86          :
          :  # shells                           48          :
          :  # electrons                        94          :
          :  max. iterations                   250          :
          :  Hamiltonian                  GFN2-xTB          :
          :  restarted?                      false          :
          :  GBSA solvation                  false          :
          :  PC potential                    false          :
          :  electronic temp.          300.0000000     K    :
          :  accuracy                    1.0000000          :
          :  -> integral cutoff          0.2500000E+02      :
          :  -> integral neglect         0.1000000E-07      :
          :  -> SCF convergence          0.1000000E-05 Eh   :
          :  -> wf. convergence          0.1000000E-03 e    :
          :  Broyden damping             0.4000000          :
          ...................................................

 iter      E             dE          RMSdq      gap      omega  full diag
   1    -54.2436024 -0.542436E+02  0.426E+00    3.11       0.0  T
   2    -54.3451619 -0.101559E+00  0.238E+00    3.15       1.0  T
   3    -54.3442491  0.912735E-03  0.113E+00    3.17       1.0  T
   4    -54.3474808 -0.323171E-02  0.512E-01    3.15       1.0  T
   5    -54.3540144 -0.653353E-02  0.139E-01    3.15       1.0  T
   6    -54.3541616 -0.147237E-03  0.617E-02    3.15       1.0  T
   7    -54.3541989 -0.373398E-04  0.294E-02    3.15       1.0  T
   8    -54.3542155 -0.165810E-04  0.109E-02    3.15       1.7  T
   9    -54.3542158 -0.264632E-06  0.425E-03    3.15       4.3  T
  10    -54.3542159 -0.887649E-07  0.176E-03    3.15      10.4  T
  11    -54.3542159 -0.321390E-07  0.650E-04    3.15      28.1  T
  12    -54.3542159 -0.245161E-08  0.320E-04    3.15      57.0  T

   *** convergence criteria satisfied after 12 iterations ***

         #    Occupation            Energy/Eh            Energy/eV
      -------------------------------------------------------------
         1        2.0000           -0.8752033             -23.8155
       ...           ...                  ...                  ...
        41        2.0000           -0.4558834             -12.4052
        42        2.0000           -0.4480239             -12.1914
        43        2.0000           -0.4411569             -12.0045
        44        2.0000           -0.4351479             -11.8410
        45        2.0000           -0.4081617             -11.1066
        46        2.0000           -0.4040073             -10.9936
        47        2.0000           -0.3890693             -10.5871 (HOMO)
        48                         -0.2731861              -7.4338 (LUMO)
        49                         -0.2230137              -6.0685
        50                         -0.2104945              -5.7278
        51                         -0.1823554              -4.9621
        52                         -0.1204335              -3.2772
       ...                                ...                  ...
        86                          0.6470310              17.6066
      -------------------------------------------------------------
                  HL-Gap            0.1158833 Eh            3.1533 eV
             Fermi-level           -0.3311277 Eh           -9.0104 eV

 SCC (total)                   0 d,  0 h,  0 min,  0.071 sec
 SCC setup                      ...        0 min,  0.000 sec (  0.539%)
 Dispersion                     ...        0 min,  0.000 sec (  0.660%)
 integral evaluation            ...        0 min,  0.028 sec ( 38.872%)
 zeroth order Hamiltonian       ...        0 min,  0.000 sec (  0.382%)
 iterations                     ...        0 min,  0.021 sec ( 29.105%)
 molecular gradient             ...        0 min,  0.021 sec ( 29.738%)
 printout                       ...        0 min,  0.000 sec (  0.626%)

         :::::::::::::::::::::::::::::::::::::::::::::::::::::
         ::                     SUMMARY                     ::
         :::::::::::::::::::::::::::::::::::::::::::::::::::::
         :: total energy             -53.822744495317 Eh    ::
         :: gradient norm              0.061675141571 Eh/a0 ::
         :: HOMO-LUMO gap              3.153344560001 eV    ::
         ::.................................................::
         :: SCC energy               -54.354215914676 Eh    ::
         :: -> isotropic ES            0.061713326534 Eh    ::
         :: -> anisotropic ES          0.002264132326 Eh    ::
         :: -> anisotropic XC         -0.002677654962 Eh    ::
         :: -> dispersion             -0.032788550859 Eh    ::
         :: repulsion energy           0.530987541721 Eh    ::
         :: add. restraining           0.000000000000 Eh    ::
         :::::::::::::::::::::::::::::::::::::::::::::::::::::

      ----------------------------------------------------------- 
     |                   =====================                   |
     |                        A N C O P T                        |
     |                   =====================                   |
     |               Approximate Normal Coordinate               |
     |                Rational Function Optimizer                |
      ----------------------------------------------------------- 

          ...................................................
          :                      SETUP                      :
          :.................................................:
          :   optimization level            normal          :
          :   max. optcycles                   200          :
          :   ANC micro-cycles                  20          :
          :   degrees of freedom                84          :
          :.................................................:
          :   RF solver                   davidson          :
          :   input Hessian                  false          :
          :   write xtbopt.log                true          :
          :   linear?                        false          :
          :   energy convergence         0.5000000E-05 Eh   :
          :   grad. convergence          0.1000000E-02 Eh/α :
          :   maximium RF displ.         2.0000000          :
          :   Hlow (freq-cutoff)         0.5000000E-02      :
          :   Hmax (freq-cutoff)         5.0000000          :
          :   S6 in model hess.         20.0000000          :
          ...................................................

generating ANC from model Hessian ...
Using Lindh-Hessian (1995)
 Shifting diagonal of input Hessian by   4.132650119222078E-003
 Lowest  eigenvalues of input Hessian
   -0.000000   -0.000000   -0.000000   -0.000000    0.000000    0.000000
    0.005000    0.005513    0.006535    0.007650    0.008686    0.009096
    0.009942    0.012075    0.013410    0.013814    0.015921    0.020156
 Highest eigenvalues
    1.601744    1.646119    1.681459    1.762080    1.806480    1.973320
 

........................................................................
.............................. CYCLE    1 ..............................
........................................................................
   1    -54.3542159 -0.543542E+02  0.929E-05    3.15       0.0  T
   2    -54.3542159 -0.166764E-10  0.615E-05    3.15     296.8  T
   3    -54.3542159  0.979838E-11  0.408E-05    3.15     447.2  T
     SCC iter.                  ...        0 min,  0.006 sec
     gradient                   ...        0 min,  0.021 sec
 * total energy  :   -53.8227445 Eh     change        0.1916926E-07 Eh
   gradient norm :     0.0616755 Eh/α   predicted     0.0000000E+00 (-100.00%)
   displ. norm   :     0.2966676 α      lambda       -0.8719581E-02
   maximum displ.:     0.1180243 α      in ANC's #9, #8, #20, ...

........................................................................
.............................. CYCLE    2 ..............................
........................................................................
   1    -54.3796216 -0.543796E+02  0.234E-01    3.21       0.0  T
   2    -54.3796582 -0.365584E-04  0.132E-01    3.22       1.0  T
   3    -54.3795401  0.118100E-03  0.756E-02    3.21       1.0  T
   4    -54.3797003 -0.160164E-03  0.222E-02    3.21       1.0  T
   5    -54.3797025 -0.224363E-05  0.102E-02    3.22       1.8  T
   6    -54.3797043 -0.175724E-05  0.296E-03    3.21       6.2  T
   7    -54.3797044 -0.158577E-06  0.920E-04    3.21      19.8  T
     SCC iter.                  ...        0 min,  0.011 sec
     gradient                   ...        0 min,  0.020 sec
 * total energy  :   -53.8285150 Eh     change       -0.5770497E-02 Eh
   gradient norm :     0.0232090 Eh/α   predicted    -0.4743506E-02 ( -17.80%)
   displ. norm   :     0.2267221 α      lambda       -0.1827482E-02
   maximum displ.:     0.1158206 α      in ANC's #8, #7, #9, ...

........................................................................
.............................. CYCLE    3 ..............................
........................................................................
   1    -54.3900987 -0.543901E+02  0.124E-01    3.25       0.0  T
   2    -54.3901160 -0.173161E-04  0.721E-02    3.25       1.0  T
   3    -54.3900878  0.281708E-04  0.441E-02    3.25       1.0  T
   4    -54.3901332 -0.453152E-04  0.129E-02    3.25       1.4  T
   5    -54.3901341 -0.984053E-06  0.590E-03    3.25       3.1  T
   6    -54.3901348 -0.604260E-06  0.175E-03    3.25      10.4  T
     SCC iter.                  ...        0 min,  0.010 sec
     gradient                   ...        0 min,  0.020 sec
 * total energy  :   -53.8295567 Eh     change       -0.1041715E-02 Eh
   gradient norm :     0.0055177 Eh/α   predicted    -0.9607118E-03 (  -7.78%)
   displ. norm   :     0.1570918 α      lambda       -0.2874278E-03
   maximum displ.:     0.0954394 α      in ANC's #8, #7, #3, ...

........................................................................
.............................. CYCLE    4 ..............................
........................................................................
   1    -54.3903956 -0.543904E+02  0.837E-02    3.25       0.0  T
   2    -54.3903988 -0.321344E-05  0.477E-02    3.25       1.0  T
   3    -54.3903942  0.465620E-05  0.168E-02    3.25       1.1  T
   4    -54.3903999 -0.570797E-05  0.696E-03    3.25       2.6  T
   5    -54.3904004 -0.551658E-06  0.179E-03    3.25      10.2  T
   6    -54.3904004 -0.223666E-07  0.841E-04    3.25      21.7  T
     SCC iter.                  ...        0 min,  0.010 sec
     gradient                   ...        0 min,  0.020 sec
 * total energy  :   -53.8297734 Eh     change       -0.2166833E-03 Eh
   gradient norm :     0.0037381 Eh/α   predicted    -0.1472692E-03 ( -32.03%)
   displ. norm   :     0.2643351 α      lambda       -0.3267365E-03
   maximum displ.:     0.1537590 α      in ANC's #8, #7, #3, ...

........................................................................
.............................. CYCLE    5 ..............................
........................................................................
   1    -54.3887814 -0.543888E+02  0.155E-01    3.25       0.0  T
   2    -54.3887902 -0.876955E-05  0.860E-02    3.25       1.0  T
   3    -54.3887887  0.140604E-05  0.208E-02    3.25       1.0  T
   4    -54.3887917 -0.294500E-05  0.128E-02    3.25       1.4  T
   5    -54.3887940 -0.229257E-05  0.215E-03    3.25       8.5  T
   6    -54.3887940 -0.498096E-07  0.840E-04    3.25      21.7  T
   7    -54.3887940 -0.715549E-08  0.480E-04    3.25      38.1  T
     SCC iter.                  ...        0 min,  0.011 sec
     gradient                   ...        0 min,  0.021 sec
 * total energy  :   -53.8299886 Eh     change       -0.2152222E-03 Eh
   gradient norm :     0.0056160 Eh/α   predicted    -0.1747849E-03 ( -18.79%)
   displ. norm   :     0.2150700 α      lambda       -0.1788096E-03
   maximum displ.:     0.1134130 α      in ANC's #8, #7, #2, ...

........................................................................
.............................. CYCLE    6 ..............................
........................................................................
   1    -54.3878898 -0.543879E+02  0.124E-01    3.24       0.0  T
   2    -54.3878950 -0.518085E-05  0.695E-02    3.24       1.0  T
   3    -54.3878966 -0.163933E-05  0.131E-02    3.24       1.4  T
   4    -54.3878959  0.708254E-06  0.857E-03    3.24       2.1  T
   5    -54.3878974 -0.144842E-05  0.160E-03    3.24      11.4  T
   6    -54.3878974 -0.479896E-07  0.515E-04    3.24      35.5  T
     SCC iter.                  ...        0 min,  0.010 sec
     gradient                   ...        0 min,  0.020 sec
 * total energy  :   -53.8301079 Eh     change       -0.1193390E-03 Eh
   gradient norm :     0.0065204 Eh/α   predicted    -0.9354088E-04 ( -21.62%)
   displ. norm   :     0.1797721 α      lambda       -0.1382409E-03
   maximum displ.:     0.0867800 α      in ANC's #2, #8, #7, ...

........................................................................
.............................. CYCLE    7 ..............................
........................................................................
   1    -54.3883524 -0.543884E+02  0.988E-02    3.23       0.0  T
   2    -54.3883560 -0.364785E-05  0.557E-02    3.23       1.0  T
   3    -54.3883560 -0.486382E-07  0.120E-02    3.23       1.5  T
   4    -54.3883566 -0.597347E-06  0.788E-03    3.23       2.3  T
   5    -54.3883577 -0.107223E-05  0.118E-03    3.23      15.5  T
   6    -54.3883577 -0.191890E-07  0.487E-04    3.23      37.5  T
     SCC iter.                  ...        0 min,  0.010 sec
     gradient                   ...        0 min,  0.020 sec
 * total energy  :   -53.8302145 Eh     change       -0.1065653E-03 Eh
   gradient norm :     0.0052421 Eh/α   predicted    -0.7135738E-04 ( -33.04%)
   displ. norm   :     0.2003295 α      lambda       -0.1509831E-03
   maximum displ.:     0.1215739 α      in ANC's #2, #8, #3, ...

........................................................................
.............................. CYCLE    8 ..............................
........................................................................
   1    -54.3896695 -0.543897E+02  0.985E-02    3.22       0.0  T
   2    -54.3896739 -0.436845E-05  0.574E-02    3.22       1.0  T
   3    -54.3896712  0.265585E-05  0.151E-02    3.22       1.2  T
   4    -54.3896753 -0.409878E-05  0.696E-03    3.22       2.6  T
   5    -54.3896759 -0.600427E-06  0.182E-03    3.22      10.0  T
   6    -54.3896760 -0.375275E-07  0.660E-04    3.22      27.7  T
     SCC iter.                  ...        0 min,  0.010 sec
     gradient                   ...        0 min,  0.020 sec
 * total energy  :   -53.8303196 Eh     change       -0.1051214E-03 Eh
   gradient norm :     0.0029173 Eh/α   predicted    -0.7852153E-04 ( -25.30%)
   displ. norm   :     0.1754418 α      lambda       -0.7329307E-04
   maximum displ.:     0.1156285 α      in ANC's #2, #8, #5, ...

........................................................................
.............................. CYCLE    9 ..............................
........................................................................
   1    -54.3898785 -0.543899E+02  0.864E-02    3.21       0.0  T
   2    -54.3898813 -0.276827E-05  0.513E-02    3.21       1.0  T
   3    -54.3898816 -0.286199E-06  0.905E-03    3.21       2.0  T
   4    -54.3898823 -0.767970E-06  0.525E-03    3.21       3.5  T
   5    -54.3898827 -0.410543E-06  0.125E-03    3.21      14.6  T
   6    -54.3898828 -0.240992E-07  0.484E-04    3.21      37.7  T
   7    -54.3898828 -0.145560E-08  0.251E-04    3.21      72.9  T
     SCC iter.                  ...        0 min,  0.011 sec
     gradient                   ...        0 min,  0.021 sec
 * total energy  :   -53.8303733 Eh     change       -0.5372861E-04 Eh
   gradient norm :     0.0030990 Eh/α   predicted    -0.3777561E-04 ( -29.69%)
   displ. norm   :     0.1212408 α      lambda       -0.5708132E-04
   maximum displ.:     0.0970152 α      in ANC's #2, #8, #4, ...

........................................................................
.............................. CYCLE   10 ..............................
........................................................................
   1    -54.3908937 -0.543909E+02  0.552E-02    3.21       0.0  T
   2    -54.3908950 -0.128491E-05  0.333E-02    3.21       1.0  T
   3    -54.3908949  0.447929E-07  0.576E-03    3.21       3.2  T
   4    -54.3908954 -0.487418E-06  0.257E-03    3.21       7.1  T
   5    -54.3908955 -0.790357E-07  0.127E-03    3.21      14.4  T
   6    -54.3908955 -0.237252E-07  0.356E-04    3.21      51.4  T
   7    -54.3908955 -0.109644E-08  0.192E-04    3.21      94.9  T
     SCC iter.                  ...        0 min,  0.011 sec
     gradient                   ...        0 min,  0.021 sec
 * total energy  :   -53.8304121 Eh     change       -0.3871302E-04 Eh
   gradient norm :     0.0024154 Eh/α   predicted    -0.2896535E-04 ( -25.18%)
   displ. norm   :     0.1402500 α      lambda       -0.4342089E-04
   maximum displ.:     0.1018772 α      in ANC's #2, #8, #4, ...

........................................................................
.............................. CYCLE   11 ..............................
........................................................................
   1    -54.3903019 -0.543903E+02  0.705E-02    3.21       0.0  T
   2    -54.3903037 -0.177525E-05  0.432E-02    3.21       1.0  T
   3    -54.3903040 -0.281071E-06  0.560E-03    3.21       3.3  T
   4    -54.3903047 -0.704250E-06  0.250E-03    3.21       7.3  T
   5    -54.3903048 -0.687190E-07  0.927E-04    3.21      19.7  T
   6    -54.3903048 -0.970125E-08  0.342E-04    3.21      53.3  T
     SCC iter.                  ...        0 min,  0.010 sec
     gradient                   ...        0 min,  0.021 sec
 * total energy  :   -53.8304408 Eh     change       -0.2877245E-04 Eh
   gradient norm :     0.0023309 Eh/α   predicted    -0.2214239E-04 ( -23.04%)
   displ. norm   :     0.0803377 α      lambda       -0.2626464E-04
   maximum displ.:     0.0674338 α      in ANC's #2, #8, #4, ...

........................................................................
.............................. CYCLE   12 ..............................
........................................................................
   1    -54.3903250 -0.543903E+02  0.402E-02    3.21       0.0  T
   2    -54.3903255 -0.531691E-06  0.246E-02    3.21       1.0  T
   3    -54.3903253  0.268458E-06  0.448E-03    3.21       4.1  T
   4    -54.3903258 -0.498785E-06  0.169E-03    3.21      10.8  T
   5    -54.3903258 -0.401217E-07  0.667E-04    3.21      27.4  T
   6    -54.3903258 -0.263345E-08  0.292E-04    3.21      62.5  T
     SCC iter.                  ...        0 min,  0.010 sec
     gradient                   ...        0 min,  0.021 sec
 * total energy  :   -53.8304599 Eh     change       -0.1904679E-04 Eh
   gradient norm :     0.0013978 Eh/α   predicted    -0.1321910E-04 ( -30.60%)
   displ. norm   :     0.1169913 α      lambda       -0.1644963E-04
   maximum displ.:     0.0957313 α      in ANC's #2, #8, #4, ...

........................................................................
.............................. CYCLE   13 ..............................
........................................................................
   1    -54.3902368 -0.543902E+02  0.610E-02    3.21       0.0  T
   2    -54.3902379 -0.108911E-05  0.370E-02    3.21       1.0  T
   3    -54.3902380 -0.822176E-07  0.530E-03    3.21       3.4  T
   4    -54.3902384 -0.375010E-06  0.299E-03    3.21       6.1  T
   5    -54.3902385 -0.148839E-06  0.739E-04    3.21      24.7  T
   6    -54.3902385 -0.359078E-08  0.356E-04    3.21      51.3  T
     SCC iter.                  ...        0 min,  0.010 sec
     gradient                   ...        0 min,  0.021 sec
 * total energy  :   -53.8304732 Eh     change       -0.1333078E-04 Eh
   gradient norm :     0.0011993 Eh/α   predicted    -0.8277758E-05 ( -37.90%)
   displ. norm   :     0.0380984 α      lambda       -0.6308956E-05
   maximum displ.:     0.0301820 α      in ANC's #2, #6, #3, ...

........................................................................
.............................. CYCLE   14 ..............................
........................................................................
   1    -54.3901268 -0.543901E+02  0.193E-02    3.22       0.0  T
   2    -54.3901269 -0.130519E-06  0.117E-02    3.22       1.6  T
   3    -54.3901269  0.395000E-08  0.168E-03    3.22      10.9  T
   4    -54.3901269 -0.343345E-07  0.848E-04    3.22      21.5  T
   5    -54.3901269 -0.848593E-08  0.411E-04    3.22      44.4  T
     SCC iter.                  ...        0 min,  0.008 sec
     gradient                   ...        0 min,  0.021 sec
 * total energy  :   -53.8304783 Eh     change       -0.5095261E-05 Eh
   gradient norm :     0.0010107 Eh/α   predicted    -0.3159079E-05 ( -38.00%)
   displ. norm   :     0.0471031 α      lambda       -0.5452535E-05
   maximum displ.:     0.0296297 α      in ANC's #2, #8, #5, ...

........................................................................
.............................. CYCLE   15 ..............................
........................................................................
   1    -54.3903286 -0.543903E+02  0.223E-02    3.22       0.0  T
   2    -54.3903288 -0.181037E-06  0.131E-02    3.22       1.4  T
   3    -54.3903287  0.945365E-07  0.289E-03    3.22       6.3  T
   4    -54.3903289 -0.146334E-06  0.142E-03    3.22      12.8  T
   5    -54.3903289 -0.273989E-07  0.449E-04    3.22      40.7  T
   6    -54.3903289 -0.238586E-08  0.131E-04    3.22     139.6  T
     SCC iter.                  ...        0 min,  0.010 sec
     gradient                   ...        0 min,  0.021 sec
 * total energy  :   -53.8304831 Eh     change       -0.4838126E-05 Eh
   gradient norm :     0.0006927 Eh/α   predicted    -0.2730056E-05 ( -43.57%)
   displ. norm   :     0.0312217 α      lambda       -0.2033212E-05
   maximum displ.:     0.0176097 α      in ANC's #2, #6, #5, ...

   *** GEOMETRY OPTIMIZATION CONVERGED AFTER 15 ITERATIONS ***

------------------------------------------------------------------------
 total energy gain   :        -0.0077386 Eh       -4.8561 kcal/mol
 total RMSD          :         0.3206356 a0        0.1697 Å
 total power (kW/mol):        -1.3545215 (step)  -28.7489 (real)
------------------------------------------------------------------------

 ANCopt (total)                0 d,  0 h,  0 min,  0.707 sec
 optimizer setup                ...        0 min,  0.000 sec (  0.023%)
 model hessian                  ...        0 min,  0.014 sec (  2.046%)
 ANC generation                 ...        0 min,  0.001 sec (  0.141%)
 coordinate transformation      ...        0 min,  0.000 sec (  0.048%)
 single point calculation       ...        0 min,  0.685 sec ( 96.949%)
 optimization log               ...        0 min,  0.002 sec (  0.262%)
 hessian update                 ...        0 min,  0.000 sec (  0.035%)
 rational function              ...        0 min,  0.003 sec (  0.358%)

================
 final structure:
================
$coord
    3.36628661411767   -2.40888685494972   -2.12791522595469      C 
    5.05748996585721    0.27074754676929   -1.48675678431039      S 
    2.34972414454590    1.83721028467077   -0.44454799333661      C 
    0.27608692624361    0.28465368334119   -0.57153832051289      C 
    0.87314170432105   -2.14580425431031   -1.55248885367109      C 
   -1.08200666328271   -4.14943412939994   -2.04371777775056      C 
   -1.42106721225911   -4.40921744759386   -4.90166069751781      C 
    0.67392439021406   -5.31201219492432   -6.02139637450284      F 
   -3.28274848135928   -6.02323957193458   -5.51224841284145      F 
   -1.95920139839203   -2.22886064708417   -6.07225429875587      F 
   -3.59709157173143   -3.55928034158052   -0.73474663728257      C 
   -4.28170105505622   -0.76400710180134   -0.91055958423767      C 
   -2.30917360406845    0.80642607492646    0.50209453691604      C 
   -2.42937785711336    0.05998329162031    3.08467031464339      O 
   -1.13915297106974    1.64653111428237    4.76801440671470      C 
    2.65528145380972    4.44934220654598    0.31917228377256      C 
    1.00951665479769    6.30749705064876   -0.04414727861464      C 
    4.30506096258487   -4.02144286306332   -2.91592351545589      H 
   -0.38130283163061   -5.99700233947037   -1.42032254802682      H 
   -3.41785438627730   -4.03819159410644    1.26115987076048      H 
   -5.09340596708770   -4.71769268751363   -1.55317168744233      H 
   -6.11748352525884   -0.46387317219151   -0.02570098584595      H 
   -4.37877188941694   -0.13301113935482   -2.86851311353092      H 
   -2.77322666704734    2.82424148926048    0.36844684217980      H 
   -1.52751035374877    0.91645211985477    6.65184013954751      H 
   -1.81543610355292    3.60079855311620    4.62867211994807      H 
    0.90437909792282    1.63040458018249    4.43459557928612      H 
    4.47396742919126    4.87185598728033    1.15882129336522      H 
   -0.77455439355315    6.02613652618428   -0.97789605571583      H 
    1.42448392504208    8.20507478972638    0.55766236908728      H 
$end
           -------------------------------------------------
          |                Final Singlepoint                |
           -------------------------------------------------

          ...................................................
          :                      SETUP                      :
          :.................................................:
          :  # basis functions                  87          :
          :  # atomic orbitals                  86          :
          :  # shells                           48          :
          :  # electrons                        94          :
          :  max. iterations                   250          :
          :  Hamiltonian                  GFN2-xTB          :
          :  restarted?                      false          :
          :  GBSA solvation                  false          :
          :  PC potential                    false          :
          :  electronic temp.          300.0000000     K    :
          :  accuracy                    1.0000000          :
          :  -> integral cutoff          0.2500000E+02      :
          :  -> integral neglect         0.1000000E-07      :
          :  -> SCF convergence          0.1000000E-05 Eh   :
          :  -> wf. convergence          0.1000000E-03 e    :
          :  Broyden damping             0.4000000          :
          ...................................................

 iter      E             dE          RMSdq      gap      omega  full diag
   1    -54.3903289 -0.543903E+02  0.668E-05    3.22       0.0  T
   2    -54.3903289 -0.226592E-10  0.355E-05    3.22     514.3  T
   3    -54.3903289 -0.465192E-10  0.207E-05    3.22     883.2  T

   *** convergence criteria satisfied after 3 iterations ***

         #    Occupation            Energy/Eh            Energy/eV
      -------------------------------------------------------------
         1        2.0000           -0.8779209             -23.8894
       ...           ...                  ...                  ...
        41        2.0000           -0.4575567             -12.4508
        42        2.0000           -0.4485944             -12.2069
        43        2.0000           -0.4407392             -11.9931
        44        2.0000           -0.4363005             -11.8723
        45        2.0000           -0.4079202             -11.1001
        46        2.0000           -0.4044858             -11.0066
        47        2.0000           -0.3902518             -10.6193 (HOMO)
        48                         -0.2719953              -7.4014 (LUMO)
        49                         -0.2205548              -6.0016
        50                         -0.2107141              -5.7338
        51                         -0.1745956              -4.7510
        52                         -0.1225695              -3.3353
       ...                                ...                  ...
        86                          0.6635805              18.0569
      -------------------------------------------------------------
                  HL-Gap            0.1182565 Eh            3.2179 eV
             Fermi-level           -0.3311236 Eh           -9.0103 eV

 SCC (total)                   0 d,  0 h,  0 min,  0.042 sec
 SCC setup                      ...        0 min,  0.000 sec (  0.606%)
 Dispersion                     ...        0 min,  0.000 sec (  0.698%)
 integral evaluation            ...        0 min,  0.014 sec ( 33.879%)
 zeroth order Hamiltonian       ...        0 min,  0.000 sec (  0.589%)
 iterations                     ...        0 min,  0.006 sec ( 13.127%)
 molecular gradient             ...        0 min,  0.021 sec ( 50.011%)
 printout                       ...        0 min,  0.000 sec (  0.964%)

         :::::::::::::::::::::::::::::::::::::::::::::::::::::
         ::                     SUMMARY                     ::
         :::::::::::::::::::::::::::::::::::::::::::::::::::::
         :: total energy             -53.830483154515 Eh    ::
         :: gradient norm              0.000692445318 Eh/a0 ::
         :: HOMO-LUMO gap              3.217923351412 eV    ::
         ::.................................................::
         :: SCC energy               -54.390328885852 Eh    ::
         :: -> isotropic ES            0.061351849507 Eh    ::
         :: -> anisotropic ES          0.001071028800 Eh    ::
         :: -> anisotropic XC         -0.004633518575 Eh    ::
         :: -> dispersion             -0.033461469474 Eh    ::
         :: repulsion energy           0.559346017693 Eh    ::
         :: add. restraining           0.000000000000 Eh    ::
         :::::::::::::::::::::::::::::::::::::::::::::::::::::

           -------------------------------------------------
          |                Property Printout                |
           -------------------------------------------------

    * Orbital Energies and Occupations

         #    Occupation            Energy/Eh            Energy/eV
      -------------------------------------------------------------
         1        2.0000           -0.8779209             -23.8894
       ...           ...                  ...                  ...
        35        2.0000           -0.4921584             -13.3923
        36        2.0000           -0.4888766             -13.3030
        37        2.0000           -0.4770904             -12.9823
        38        2.0000           -0.4732325             -12.8773
        39        2.0000           -0.4626370             -12.5890
        40        2.0000           -0.4606012             -12.5336
        41        2.0000           -0.4575567             -12.4508
        42        2.0000           -0.4485944             -12.2069
        43        2.0000           -0.4407392             -11.9931
        44        2.0000           -0.4363005             -11.8723
        45        2.0000           -0.4079202             -11.1001
        46        2.0000           -0.4044858             -11.0066
        47        2.0000           -0.3902518             -10.6193 (HOMO)
        48                         -0.2719953              -7.4014 (LUMO)
        49                         -0.2205548              -6.0016
        50                         -0.2107141              -5.7338
        51                         -0.1745956              -4.7510
        52                         -0.1225695              -3.3353
        53                         -0.0135341              -0.3683
        54                          0.0075168               0.2045
        55                          0.0166254               0.4524
        56                          0.0224978               0.6122
        57                          0.0284996               0.7755
        58                          0.0359165               0.9773
       ...                                ...                  ...
        86                          0.6635805              18.0569
      -------------------------------------------------------------
                  HL-Gap            0.1182565 Eh            3.2179 eV
             Fermi-level           -0.3311236 Eh           -9.0103 eV

     #   Z        covCN         q      C6AA      α(0)
     1   6 C      2.934    -0.032    28.796     8.801
     2  16 S      2.343    -0.012   141.530    20.023
     3   6 C      2.988     0.016    27.639     8.624
     4   6 C      3.150    -0.024    28.318     8.704
     5   6 C      3.175    -0.010    27.851     8.619
     6   6 C      3.858    -0.034    21.145     6.540
     7   6 C      3.336     0.483    17.324     6.592
     8   9 F      0.791    -0.212    11.357     3.981
     9   9 F      0.791    -0.209    11.332     3.976
    10   9 F      0.791    -0.206    11.293     3.970
    11   6 C      3.808    -0.061    21.671     6.627
    12   6 C      3.807    -0.065    21.734     6.636
    13   6 C      3.751     0.117    18.722     6.171
    14   8 O      1.701    -0.314    19.247     5.923
    15   6 C      3.644     0.043    20.192     6.459
    16   6 C      2.936    -0.029    28.715     8.788
    17   6 C      2.838    -0.087    30.181     9.003
    18   1 H      0.926     0.056     2.249     2.345
    19   1 H      0.924     0.065     2.138     2.286
    20   1 H      0.924     0.073     2.050     2.239
    21   1 H      0.924     0.053     2.286     2.364
    22   1 H      0.925     0.057     2.235     2.338
    23   1 H      0.925     0.052     2.290     2.366
    24   1 H      0.923     0.025     2.664     2.552
    25   1 H      0.925     0.059     2.206     2.323
    26   1 H      0.924     0.027     2.633     2.537
    27   1 H      0.924     0.028     2.612     2.527
    28   1 H      0.925     0.048     2.341     2.393
    29   1 H      0.926     0.043     2.405     2.425
    30   1 H      0.926     0.048     2.348     2.396

 Mol. C6AA /au·bohr⁶  :      10971.702874
 Mol. C8AA /au·bohr⁸  :     279558.357461
 Mol. α(0) /au        :        160.529787


Wiberg/Mayer (AO) data.
largest (>0.10) Wiberg bond orders for each atom
          total WBO             WBO to atom ...
     1  C   3.951        C    5 1.588    S    2 1.204    H   18 0.968    C    3 0.101
     2  S   2.627        C    1 1.204    C    3 1.134
     3  C   3.950        C    4 1.526    S    2 1.134    C   16 1.102    C    1 0.101
     4  C   3.981        C    3 1.526    C    5 1.239    C   13 0.980
     5  C   3.980        C    1 1.588    C    4 1.239    C    6 0.988
     6  C   3.979        C   11 0.990    C    5 0.988    H   19 0.954    C    7 0.933
     7  C   3.819        F   10 0.951    F    9 0.945    F    8 0.944    C    6 0.933
     8  F   1.067        C    7 0.944
     9  F   1.070        C    7 0.945
    10  F   1.076        C    7 0.951
    11  C   3.989        C   12 1.010    C    6 0.990    H   21 0.974    H   20 0.971
    12  C   3.995        C   11 1.010    C   13 0.988    H   23 0.974    H   22 0.973
    13  C   3.956        C   12 0.988    C    4 0.980    O   14 0.958    H   24 0.953
    14  O   2.083        C   15 1.000    C   13 0.958
    15  C   3.954        O   14 1.000    H   25 0.978    H   26 0.976    H   27 0.974
    16  C   3.991        C   17 1.895    C    3 1.102    H   28 0.959
    17  C   3.990        C   16 1.895    H   30 0.976    H   29 0.972
    18  H   0.996        C    1 0.968
    19  H   0.996        C    6 0.954
    20  H   0.995        C   11 0.971
    21  H   0.996        C   11 0.974
    22  H   0.995        C   12 0.973
    23  H   0.997        C   12 0.974
    24  H   0.999        C   13 0.953
    25  H   0.996        C   15 0.978
    26  H   0.999        C   15 0.976
    27  H   0.999        C   15 0.974
    28  H   0.997        C   16 0.959
    29  H   0.998        C   17 0.972
    30  H   0.997        C   17 0.976

molecular dipole:
                 x           y           z       tot (Debye)
 q only:        0.120       0.669       1.175
   full:        0.007       0.628       1.125       3.273
molecular quadrupole (traceless):
                xx          xy          yy          xz          yz          zz
 q only:        4.543      -0.849       4.384      -0.799      -5.902      -8.927
  q+dip:        2.341      -3.307       7.632       0.135      -4.685      -9.973
   full:        1.497      -2.885       7.130       0.021      -4.834      -8.627

           -------------------------------------------------
          |                Geometry Summary                 |
           -------------------------------------------------

      molecular mass/u    :      262.2893000
   center of mass at/Å    :       -0.0372039      -0.5337723      -0.8401268
  moments of inertia/u·Å² :        0.7768296E+03   0.1462402E+04   0.1870301E+04
rotational constants/cm⁻¹ :        0.2170055E-01   0.1152736E-01   0.9013325E-02

 * 28 selected distances

     #   Z        #   Z                                     value/Å
     1   6 C      2  16 S                                 1.7107813
     2  16 S      3   6 C                                 1.7448412 (max)
     3   6 C      4   6 C                                 1.3724506
     1   6 C      5   6 C                                 1.3611381
     4   6 C      5   6 C                                 1.4224797
     6   6 C      7   6 C                                 1.5291563
     7   6 C      8   9 F                                 1.3447597
     7   6 C      9   9 F                                 1.3432914
     7   6 C     10   9 F                                 1.3401704
     6   6 C     11   6 C                                 1.5325451
    11   6 C     12   6 C                                 1.5257524
    12   6 C     13   6 C                                 1.5293787
    13   6 C     14   8 O                                 1.4240005
    14   8 O     15   6 C                                 1.4016168
    16   6 C     17   6 C                                 1.3275160
     1   6 C     18   1 H                                 1.0718408 (min)
     6   6 C     19   1 H                                 1.0964466
    11   6 C     20   1 H                                 1.0903010
    11   6 C     21   1 H                                 1.0910161
    12   6 C     22   1 H                                 1.0900477
    12   6 C     23   1 H                                 1.0897918
    13   6 C     24   1 H                                 1.0979358
    15   6 C     25   1 H                                 1.0886960
    15   6 C     26   1 H                                 1.0968067
    15   6 C     27   1 H                                 1.0957230
    16   6 C     28   1 H                                 1.0833471
    17   6 C     29   1 H                                 1.0759307
    17   6 C     30   1 H                                 1.0760887

 * 5 distinct bonds (by element types)

   Z      Z             #   av. dist./Å        max./Å        min./Å
   1 H    6 C          13     1.0879978     1.0979358     1.0718408
   6 C    6 C           8     1.4500521     1.5325451     1.3275160
   6 C    8 O           2     1.4128087     1.4240005     1.4016168
   6 C    9 F           3     1.3427405     1.3447597     1.3401704
   6 C   16 S           2     1.7278113     1.7448412     1.7107813


optimized geometry written to: xtbopt.xyz


           -------------------------------------------------
          | TOTAL ENERGY              -53.830483154515 Eh   |
          | GRADIENT NORM               0.000692445318 Eh/α |
          | HOMO-LUMO GAP               3.217923351412 eV   |
           -------------------------------------------------

------------------------------------------------------------------------
 * finished run on 2021/05/19 at 10:59:18.844     
------------------------------------------------------------------------
 total:
 * wall-time:     0 d,  0 h,  0 min,  0.860 sec
 *  cpu-time:     0 d,  0 h,  0 min,  0.834 sec
 * ratio c/w:     0.970 speedup
 SCF:
 * wall-time:     0 d,  0 h,  0 min,  0.071 sec
 *  cpu-time:     0 d,  0 h,  0 min,  0.058 sec
 * ratio c/w:     0.817 speedup
 ANC optimizer:
 * wall-time:     0 d,  0 h,  0 min,  0.749 sec
 *  cpu-time:     0 d,  0 h,  0 min,  0.749 sec
 * ratio c/w:     1.000 speedup

