      -----------------------------------------------------------      
     |                   =====================                   |     
     |                           x T B                           |     
     |                   =====================                   |     
     |                         S. Grimme                         |     
     |          Mulliken Center for Theoretical Chemistry        |     
     |                    University of Bonn                     |     
     |                Version 6.2 RC2 (SAW190805)                |     
      -----------------------------------------------------------      

   This program is distributed in the hope that it will be useful,
   but WITHOUT ANY WARRANTY; without even the implied warranty of
   MERCHANTABILITY or FITNESS FOR A PARTICULAR PURPOSE.
   
   FOR NON-COMMERCIAL, ACADEMIA USE ONLY.
   
   Cite this work as:
   * S. Grimme, C. Bannwarth, P. Shushkov, J. Chem. Theory Comput., 2017,
     13, 1989-2009. DOI: 10.1021/acs.jctc.7b00118
   * C. Bannwarth, S. Ehlert and S. Grimme., J. Chem. Theory Comput., 2019,
     15, 1652-1671. DOI: 10.1021/acs.jctc.8b01176
   * P. Pracht, E. Caldeweyher, S. Ehlert, S. Grimme, ChemRxiv, 2019, preprint.
     DOI: 10.26434/chemrxiv.8326202.v1
   
   for DFT-D4:
   * E. Caldeweyher, C. Bannwarth and S. Grimme, J. Chem. Phys., 2017,
     147, 034112. DOI: 10.1063/1.4993215
   * E. Caldeweyher, S. Ehlert, A. Hansen, H. Neugebauer, S. Spicher,
     C. Bannwarth and S. Grimme, J. Chem. Phys., 2019, 150, 154122.
     DOI: 10.1063/1.5090222
   
   for sTDA-xTB:
   * S. Grimme and C. Bannwarth, J. Chem. Phys., 2016, 145, 054103.
     DOI: 10.1063/1.4959605
   
   in the mass-spec context:
   * V. Asgeirsson, C. Bauer and S. Grimme, Chem. Sci., 2017, 8, 4879.
     DOI: 10.1039/c7sc00601b
   
   for metadynamics refer to:
   * S. Grimme, J. Chem. Theory Comput., 2019, 155, 2847-2862
     DOI: 10.1021/acs.jctc.9b00143
   
   with help from (in alphabetical order)
   C. Bannwarth, F. Bohle, G. Brandenburg, E. Caldeweyher, M. Checinski,
   S. Dohm, S. Ehlert, S. Ehrlich, F. März, H. Neugebauer, J. Pisarek,
   P. Pracht, P. Shushkov, and S. Spicher.
   
 * started run on 2021/05/19 at 10:59:19.593     

           -------------------------------------------------
          |                Calculation Setup                |
           -------------------------------------------------

          program call               : /ihome/ghutchison/geoffh/xtb/xtb 174.xyz -opt
          hostname                   : smp-n83
          coordinate file            : 174.xyz
          omp threads                :                     1
          number of atoms            :                    26
          number of electrons        :                    90
          charge                     :                     0
          spin                       :                   0.0
          first test random number   :      0.80946294488588


########################################################################
# WARNING! Please study the warnings concerning your input carefully
#  - the use of '-opt' is discouraged, please use '--opt' next time
########################################################################

           ------------------------------------------------- 
          |                 G F N 2 - x T B                 |
          | Geometry, Frequencies, Noncovalent interactions |
          |            JCTC 2019 parametrisation            |
           ------------------------------------------------- 
             KAB for C  - Si     :                1.0500
             KAB for H  - Pd     :                0.9500
             k(s)              :                1.8500
             k(p)              :                2.2300
             k(d)              :                2.2300
             k(f)              :                2.0000
             kEN (H0ij)        :               -2.0000
             D4 a1             :                0.5200
             D4 a2             :                5.0000
             D4 s6             :                1.0000
             D4 s8             :                2.7000
             D4 s9             :                5.0000
             alphaj            :                2.0000

  Z AO/shell   Hii/eV     exponent
  1     Wed Apr 25 08:07:45 CEST 2018   EN: 2.200 GM2: 0.406  GM3: 0.0800  RAES: 1.40
     1s    -10.707211    1.230000
  6     Wed Apr 25 08:07:45 CEST 2018   EN: 2.550 GM2: 0.538  GM3: 0.1500  RAES: 3.00
     2s    -13.970922    2.096432
     2p    -10.063292    1.800000
  7     Wed Apr 25 08:07:45 CEST 2018   EN: 3.040 GM2: 0.461  GM3:-0.0640  RAES: 1.90
     2s    -16.686243    2.339881
     2p    -12.523956    2.014332
  8     Wed Apr 25 08:07:45 CEST 2018   EN: 3.440 GM2: 0.452  GM3:-0.0517  RAES: 1.80
     2s    -20.229985    2.439742
     2p    -15.503117    2.137023

           ------------------------------------------------- 
          |        Self-Consistent Charge Iterations        |
           ------------------------------------------------- 

          ...................................................
          :                      SETUP                      :
          :.................................................:
          :  # basis functions                  80          :
          :  # atomic orbitals                  80          :
          :  # shells                           44          :
          :  # electrons                        90          :
          :  max. iterations                   250          :
          :  Hamiltonian                  GFN2-xTB          :
          :  restarted?                      false          :
          :  GBSA solvation                  false          :
          :  PC potential                    false          :
          :  electronic temp.          300.0000000     K    :
          :  accuracy                    1.0000000          :
          :  -> integral cutoff          0.2500000E+02      :
          :  -> integral neglect         0.1000000E-07      :
          :  -> SCF convergence          0.1000000E-05 Eh   :
          :  -> wf. convergence          0.1000000E-03 e    :
          :  Broyden damping             0.4000000          :
          ...................................................

 iter      E             dE          RMSdq      gap      omega  full diag
   1    -51.9540564 -0.519541E+02  0.636E+00    1.47       0.0  T
   2    -52.2074581 -0.253402E+00  0.310E+00    1.26       1.0  T
   3    -52.2077472 -0.289108E-03  0.163E+00    1.27       1.0  T
   4    -52.1934461  0.143011E-01  0.101E+00    1.19       1.0  T
   5    -52.2121836 -0.187375E-01  0.124E-01    1.19       1.0  T
   6    -52.2122450 -0.613607E-04  0.871E-02    1.20       1.0  T
   7    -52.2123355 -0.904654E-04  0.486E-02    1.21       1.0  T
   8    -52.2123750 -0.394827E-04  0.190E-02    1.20       1.0  T
   9    -52.2123777 -0.275434E-05  0.111E-02    1.20       1.8  T
  10    -52.2123791 -0.138200E-05  0.293E-03    1.20       6.7  T
  11    -52.2123792 -0.824840E-07  0.118E-03    1.20      16.6  T
  12    -52.2123792 -0.934559E-08  0.565E-04    1.20      34.7  T
  13    -52.2123792  0.515435E-09  0.302E-04    1.20      65.0  T

   *** convergence criteria satisfied after 13 iterations ***

         #    Occupation            Energy/Eh            Energy/eV
      -------------------------------------------------------------
         1        2.0000           -0.7764160             -21.1274
       ...           ...                  ...                  ...
        39        2.0000           -0.4632283             -12.6051
        40        2.0000           -0.4608524             -12.5404
        41        2.0000           -0.4570236             -12.4362
        42        2.0000           -0.4526867             -12.3182
        43        2.0000           -0.4444951             -12.0953
        44        2.0000           -0.4405499             -11.9880
        45        2.0000           -0.4309079             -11.7256 (HOMO)
        46                         -0.3866572             -10.5215 (LUMO)
        47                         -0.3340799              -9.0908
        48                         -0.3229951              -8.7891
        49                         -0.2665787              -7.2540
        50                         -0.2477090              -6.7405
       ...                                ...                  ...
        80                          0.7008239              19.0704
      -------------------------------------------------------------
                  HL-Gap            0.0442507 Eh            1.2041 eV
             Fermi-level           -0.4087826 Eh          -11.1235 eV

 SCC (total)                   0 d,  0 h,  0 min,  0.050 sec
 SCC setup                      ...        0 min,  0.000 sec (  0.728%)
 Dispersion                     ...        0 min,  0.000 sec (  0.915%)
 integral evaluation            ...        0 min,  0.013 sec ( 25.632%)
 zeroth order Hamiltonian       ...        0 min,  0.000 sec (  0.444%)
 iterations                     ...        0 min,  0.019 sec ( 37.652%)
 molecular gradient             ...        0 min,  0.017 sec ( 33.631%)
 printout                       ...        0 min,  0.000 sec (  0.888%)

         :::::::::::::::::::::::::::::::::::::::::::::::::::::
         ::                     SUMMARY                     ::
         :::::::::::::::::::::::::::::::::::::::::::::::::::::
         :: total energy             -51.571810932080 Eh    ::
         :: gradient norm              0.094478178126 Eh/a0 ::
         :: HOMO-LUMO gap              1.204123490332 eV    ::
         ::.................................................::
         :: SCC energy               -52.212379182877 Eh    ::
         :: -> isotropic ES            0.101135557863 Eh    ::
         :: -> anisotropic ES          0.011152930413 Eh    ::
         :: -> anisotropic XC          0.012354553871 Eh    ::
         :: -> dispersion             -0.027970044583 Eh    ::
         :: repulsion energy           0.640572705081 Eh    ::
         :: add. restraining           0.000000000000 Eh    ::
         :::::::::::::::::::::::::::::::::::::::::::::::::::::

      ----------------------------------------------------------- 
     |                   =====================                   |
     |                        A N C O P T                        |
     |                   =====================                   |
     |               Approximate Normal Coordinate               |
     |                Rational Function Optimizer                |
      ----------------------------------------------------------- 

          ...................................................
          :                      SETUP                      :
          :.................................................:
          :   optimization level            normal          :
          :   max. optcycles                   200          :
          :   ANC micro-cycles                  20          :
          :   degrees of freedom                72          :
          :.................................................:
          :   RF solver                   davidson          :
          :   input Hessian                  false          :
          :   write xtbopt.log                true          :
          :   linear?                        false          :
          :   energy convergence         0.5000000E-05 Eh   :
          :   grad. convergence          0.1000000E-02 Eh/α :
          :   maximium RF displ.         2.0000000          :
          :   Hlow (freq-cutoff)         0.5000000E-02      :
          :   Hmax (freq-cutoff)         5.0000000          :
          :   S6 in model hess.         20.0000000          :
          ...................................................

generating ANC from model Hessian ...
Using Lindh-Hessian (1995)
 Shifting diagonal of input Hessian by   4.250888492619715E-003
 Lowest  eigenvalues of input Hessian
   -0.000000   -0.000000   -0.000000    0.000000    0.000000    0.000000
    0.005000    0.005354    0.006583    0.007951    0.008306    0.011222
    0.011763    0.014889    0.015251    0.020101    0.020845    0.021273
 Highest eigenvalues
    1.983052    2.067215    2.105110    2.118484    2.460018    2.486417
 

........................................................................
.............................. CYCLE    1 ..............................
........................................................................
   1    -52.2123792 -0.522124E+02  0.747E-05    1.20       0.0  T
   2    -52.2123792  0.100329E-10  0.649E-05    1.20     302.0  T
   3    -52.2123792 -0.933014E-10  0.264E-05    1.20     743.2  T
     SCC iter.                  ...        0 min,  0.005 sec
     gradient                   ...        0 min,  0.017 sec
 * total energy  :   -51.5718109 Eh     change        0.9282516E-08 Eh
   gradient norm :     0.0944787 Eh/α   predicted     0.0000000E+00 (-100.00%)
   displ. norm   :     0.2172445 α      lambda       -0.1031650E-01
   maximum displ.:     0.0635577 α      in ANC's #27, #20, #21, ...

........................................................................
.............................. CYCLE    2 ..............................
........................................................................
   1    -52.2320530 -0.522321E+02  0.299E-01    1.15       0.0  T
   2    -52.2324556 -0.402668E-03  0.159E-01    1.14       1.0  T
   3    -52.2324261  0.295046E-04  0.883E-02    1.15       1.0  T
   4    -52.2324172  0.888009E-05  0.595E-02    1.14       1.0  T
   5    -52.2324832 -0.659198E-04  0.159E-02    1.15       1.2  T
   6    -52.2324880 -0.481222E-05  0.663E-03    1.15       3.0  T
   7    -52.2324883 -0.358578E-06  0.410E-03    1.15       4.8  T
   8    -52.2324884 -0.113751E-06  0.164E-03    1.15      11.9  T
     SCC iter.                  ...        0 min,  0.011 sec
     gradient                   ...        0 min,  0.015 sec
 * total energy  :   -51.5781045 Eh     change       -0.6293591E-02 Eh
   gradient norm :     0.0352973 Eh/α   predicted    -0.5401695E-02 ( -14.17%)
   displ. norm   :     0.2647539 α      lambda       -0.4303806E-02
   maximum displ.:     0.1064102 α      in ANC's #3, #5, #12, ...

........................................................................
.............................. CYCLE    3 ..............................
........................................................................
   1    -52.2443631 -0.522444E+02  0.374E-01    1.11       0.0  T
   2    -52.2446025 -0.239317E-03  0.211E-01    1.11       1.0  T
   3    -52.2445573  0.451206E-04  0.801E-02    1.10       1.0  T
   4    -52.2445768 -0.194423E-04  0.471E-02    1.10       1.0  T
   5    -52.2446291 -0.522844E-04  0.148E-02    1.11       1.3  T
   6    -52.2446326 -0.351007E-05  0.723E-03    1.10       2.7  T
   7    -52.2446329 -0.339513E-06  0.468E-03    1.10       4.2  T
   8    -52.2446332 -0.245139E-06  0.139E-03    1.10      14.1  T
     SCC iter.                  ...        0 min,  0.010 sec
     gradient                   ...        0 min,  0.015 sec
 * total energy  :   -51.5784356 Eh     change       -0.3310670E-03 Eh
   gradient norm :     0.0335560 Eh/α   predicted    -0.2302743E-02 ( 595.55%)
   displ. norm   :     0.1636283 α      lambda       -0.2665411E-02
   maximum displ.:     0.0713311 α      in ANC's #8, #3, #21, ...

........................................................................
.............................. CYCLE    4 ..............................
........................................................................
   1    -52.2414688 -0.522415E+02  0.264E-01    1.12       0.0  T
   2    -52.2415530 -0.842651E-04  0.149E-01    1.12       1.0  T
   3    -52.2414985  0.545372E-04  0.839E-02    1.12       1.0  T
   4    -52.2415697 -0.711600E-04  0.289E-02    1.12       1.0  T
   5    -52.2415862 -0.165659E-04  0.877E-03    1.12       2.2  T
   6    -52.2415869 -0.654680E-06  0.546E-03    1.12       3.6  T
   7    -52.2415872 -0.296920E-06  0.320E-03    1.12       6.1  T
     SCC iter.                  ...        0 min,  0.009 sec
     gradient                   ...        0 min,  0.015 sec
 * total energy  :   -51.5798906 Eh     change       -0.1455033E-02 Eh
   gradient norm :     0.0109270 Eh/α   predicted    -0.1368390E-02 (  -5.95%)
   displ. norm   :     0.1754288 α      lambda       -0.6459216E-03
   maximum displ.:     0.0796376 α      in ANC's #3, #8, #10, ...

........................................................................
.............................. CYCLE    5 ..............................
........................................................................
   1    -52.2380899 -0.522381E+02  0.199E-01    1.12       0.0  T
   2    -52.2381109 -0.210111E-04  0.118E-01    1.12       1.0  T
   3    -52.2379694  0.141496E-03  0.906E-02    1.12       1.0  T
   4    -52.2381411 -0.171693E-03  0.970E-03    1.12       2.0  T
   5    -52.2381416 -0.471473E-06  0.597E-03    1.12       3.3  T
   6    -52.2381421 -0.496481E-06  0.297E-03    1.12       6.6  T
   7    -52.2381421 -0.387865E-08  0.203E-03    1.12       9.7  T
     SCC iter.                  ...        0 min,  0.009 sec
     gradient                   ...        0 min,  0.015 sec
 * total energy  :   -51.5802185 Eh     change       -0.3278569E-03 Eh
   gradient norm :     0.0116540 Eh/α   predicted    -0.3329044E-03 (   1.54%)
   displ. norm   :     0.2109700 α      lambda       -0.4419570E-03
   maximum displ.:     0.1248821 α      in ANC's #3, #5, #8, ...

........................................................................
.............................. CYCLE    6 ..............................
........................................................................
   1    -52.2374504 -0.522375E+02  0.187E-01    1.11       0.0  T
   2    -52.2374584 -0.801970E-05  0.108E-01    1.12       1.0  T
   3    -52.2373638  0.946197E-04  0.700E-02    1.12       1.0  T
   4    -52.2374724 -0.108619E-03  0.722E-03    1.12       2.7  T
   5    -52.2374729 -0.546912E-06  0.418E-03    1.12       4.7  T
   6    -52.2374730 -0.654353E-07  0.288E-03    1.12       6.8  T
   7    -52.2374731 -0.988479E-07  0.131E-03    1.12      15.0  T
     SCC iter.                  ...        0 min,  0.009 sec
     gradient                   ...        0 min,  0.015 sec
 * total energy  :   -51.5805695 Eh     change       -0.3510759E-03 Eh
   gradient norm :     0.0134002 Eh/α   predicted    -0.2308145E-03 ( -34.26%)
   displ. norm   :     0.3639843 α      lambda       -0.7379340E-03
   maximum displ.:     0.2182585 α      in ANC's #3, #5, #2, ...

........................................................................
.............................. CYCLE    7 ..............................
........................................................................
   1    -52.2379160 -0.522379E+02  0.268E-01    1.10       0.0  T
   2    -52.2379486 -0.325487E-04  0.156E-01    1.11       1.0  T
   3    -52.2378170  0.131554E-03  0.898E-02    1.11       1.0  T
   4    -52.2379665 -0.149504E-03  0.204E-02    1.11       1.0  T
   5    -52.2379748 -0.832963E-05  0.604E-03    1.11       3.2  T
   6    -52.2379749 -0.913958E-07  0.464E-03    1.11       4.2  T
   7    -52.2379752 -0.326418E-06  0.215E-03    1.11       9.1  T
   8    -52.2379753 -0.257466E-07  0.984E-04    1.11      19.9  T
     SCC iter.                  ...        0 min,  0.011 sec
     gradient                   ...        0 min,  0.015 sec
 * total energy  :   -51.5810654 Eh     change       -0.4958911E-03 Eh
   gradient norm :     0.0121007 Eh/α   predicted    -0.4178534E-03 ( -15.74%)
   displ. norm   :     0.4319212 α      lambda       -0.6368941E-03
   maximum displ.:     0.2177630 α      in ANC's #3, #5, #2, ...

........................................................................
.............................. CYCLE    8 ..............................
........................................................................
   1    -52.2353659 -0.522354E+02  0.357E-01    1.08       0.0  T
   2    -52.2353915 -0.256096E-04  0.209E-01    1.09       1.0  T
   3    -52.2349769  0.414631E-03  0.150E-01    1.08       1.0  T
   4    -52.2354465 -0.469606E-03  0.159E-02    1.09       1.2  T
   5    -52.2354481 -0.160481E-05  0.119E-02    1.09       1.7  T
   6    -52.2354509 -0.274382E-05  0.486E-03    1.09       4.0  T
   7    -52.2354510 -0.985062E-07  0.275E-03    1.09       7.1  T
   8    -52.2354511 -0.111902E-06  0.822E-04    1.09      23.9  T
     SCC iter.                  ...        0 min,  0.011 sec
     gradient                   ...        0 min,  0.015 sec
 * total energy  :   -51.5814337 Eh     change       -0.3682889E-03 Eh
   gradient norm :     0.0176660 Eh/α   predicted    -0.3778583E-03 (   2.60%)
   displ. norm   :     0.2803403 α      lambda       -0.6317075E-03
   maximum displ.:     0.1366148 α      in ANC's #5, #2, #1, ...

........................................................................
.............................. CYCLE    9 ..............................
........................................................................
   1    -52.2384042 -0.522384E+02  0.192E-01    1.08       0.0  T
   2    -52.2384173 -0.130283E-04  0.112E-01    1.08       1.0  T
   3    -52.2383636  0.536340E-04  0.554E-02    1.07       1.0  T
   4    -52.2384204 -0.567868E-04  0.148E-02    1.08       1.3  T
   5    -52.2384247 -0.431264E-05  0.576E-03    1.08       3.4  T
   6    -52.2384253 -0.620656E-06  0.277E-03    1.08       7.1  T
   7    -52.2384254 -0.779325E-07  0.141E-03    1.08      13.9  T
     SCC iter.                  ...        0 min,  0.010 sec
     gradient                   ...        0 min,  0.016 sec
 * total energy  :   -51.5819103 Eh     change       -0.4765793E-03 Eh
   gradient norm :     0.0094383 Eh/α   predicted    -0.3406778E-03 ( -28.52%)
   displ. norm   :     0.5184327 α      lambda       -0.7241196E-03
   maximum displ.:     0.2789808 α      in ANC's #5, #2, #1, ...

........................................................................
.............................. CYCLE   10 ..............................
........................................................................
   1    -52.2364718 -0.522365E+02  0.377E-01    1.05       0.0  T
   2    -52.2365096 -0.377766E-04  0.222E-01    1.06       1.0  T
   3    -52.2360443  0.465318E-03  0.159E-01    1.06       1.0  T
   4    -52.2365674 -0.523119E-03  0.278E-02    1.06       1.0  T
   5    -52.2365810 -0.135715E-04  0.107E-02    1.06       1.8  T
   6    -52.2365823 -0.133273E-05  0.689E-03    1.06       2.8  T
   7    -52.2365830 -0.673308E-06  0.251E-03    1.06       7.8  T
   8    -52.2365830 -0.144381E-07  0.120E-03    1.06      16.3  T
     SCC iter.                  ...        0 min,  0.011 sec
     gradient                   ...        0 min,  0.015 sec
 * total energy  :   -51.5823316 Eh     change       -0.4213084E-03 Eh
   gradient norm :     0.0188382 Eh/α   predicted    -0.4593763E-03 (   9.04%)
   displ. norm   :     0.3791068 α      lambda       -0.8860398E-03
   maximum displ.:     0.2147150 α      in ANC's #1, #2, #5, ...

........................................................................
.............................. CYCLE   11 ..............................
........................................................................
   1    -52.2425386 -0.522425E+02  0.233E-01    1.06       0.0  T
   2    -52.2426221 -0.834983E-04  0.136E-01    1.06       1.0  T
   3    -52.2425196  0.102455E-03  0.794E-02    1.05       1.0  T
   4    -52.2426227 -0.103132E-03  0.319E-02    1.06       1.0  T
   5    -52.2426422 -0.194936E-04  0.133E-02    1.06       1.5  T
   6    -52.2426463 -0.410643E-05  0.486E-03    1.06       4.0  T
   7    -52.2426467 -0.335167E-06  0.244E-03    1.06       8.0  T
   8    -52.2426467 -0.686929E-08  0.126E-03    1.06      15.6  T
     SCC iter.                  ...        0 min,  0.011 sec
     gradient                   ...        0 min,  0.016 sec
 * total energy  :   -51.5824390 Eh     change       -0.1073575E-03 Eh
   gradient norm :     0.0251620 Eh/α   predicted    -0.5066916E-03 ( 371.97%)
   displ. norm   :     0.2967243 α      lambda       -0.1046376E-02
   maximum displ.:     0.1611374 α      in ANC's #1, #5, #8, ...

........................................................................
.............................. CYCLE   12 ..............................
........................................................................
   1    -52.2380271 -0.522380E+02  0.273E-01    1.04       0.0  T
   2    -52.2381566 -0.129493E-03  0.156E-01    1.05       1.0  T
   3    -52.2380786  0.780060E-04  0.103E-01    1.04       1.0  T
   4    -52.2381552 -0.765905E-04  0.528E-02    1.05       1.0  T
   5    -52.2382140 -0.588253E-04  0.119E-02    1.05       1.6  T
   6    -52.2382162 -0.224631E-05  0.665E-03    1.05       3.0  T
   7    -52.2382170 -0.712403E-06  0.300E-03    1.05       6.5  T
   8    -52.2382169  0.309089E-07  0.196E-03    1.05      10.0  T
     SCC iter.                  ...        0 min,  0.011 sec
     gradient                   ...        0 min,  0.016 sec
 * total energy  :   -51.5829374 Eh     change       -0.4984687E-03 Eh
   gradient norm :     0.0125037 Eh/α   predicted    -0.5692597E-03 (  14.20%)
   displ. norm   :     0.2499634 α      lambda       -0.3774375E-03
   maximum displ.:     0.1340057 α      in ANC's #5, #2, #1, ...

........................................................................
.............................. CYCLE   13 ..............................
........................................................................
   1    -52.2366756 -0.522367E+02  0.181E-01    1.04       0.0  T
   2    -52.2367215 -0.458780E-04  0.109E-01    1.05       1.0  T
   3    -52.2366820  0.394609E-04  0.731E-02    1.04       1.0  T
   4    -52.2367358 -0.537606E-04  0.336E-02    1.05       1.0  T
   5    -52.2367608 -0.249934E-04  0.606E-03    1.04       3.2  T
   6    -52.2367611 -0.291306E-06  0.418E-03    1.05       4.7  T
   7    -52.2367613 -0.230323E-06  0.188E-03    1.04      10.4  T
   8    -52.2367613 -0.826528E-08  0.112E-03    1.05      17.5  T
     SCC iter.                  ...        0 min,  0.011 sec
     gradient                   ...        0 min,  0.015 sec
 * total energy  :   -51.5831196 Eh     change       -0.1821241E-03 Eh
   gradient norm :     0.0139493 Eh/α   predicted    -0.2005155E-03 (  10.10%)
   displ. norm   :     0.1148539 α      lambda       -0.3495322E-03
   maximum displ.:     0.0719335 α      in ANC's #1, #3, #2, ...

........................................................................
.............................. CYCLE   14 ..............................
........................................................................
   1    -52.2427330 -0.522427E+02  0.843E-02    1.05       0.0  T
   2    -52.2427491 -0.161231E-04  0.494E-02    1.06       1.0  T
   3    -52.2427293  0.198147E-04  0.387E-02    1.05       1.0  T
   4    -52.2427558 -0.264646E-04  0.110E-02    1.06       1.8  T
   5    -52.2427569 -0.117533E-05  0.317E-03    1.06       6.2  T
   6    -52.2427571 -0.164626E-06  0.149E-03    1.06      13.2  T
   7    -52.2427571 -0.983645E-08  0.104E-03    1.06      18.9  T
     SCC iter.                  ...        0 min,  0.010 sec
     gradient                   ...        0 min,  0.015 sec
 * total energy  :   -51.5832765 Eh     change       -0.1569596E-03 Eh
   gradient norm :     0.0094570 Eh/α   predicted    -0.1770734E-03 (  12.81%)
   displ. norm   :     0.4595431 α      lambda       -0.3791128E-03
   maximum displ.:     0.2798940 α      in ANC's #1, #5, #2, ...

........................................................................
.............................. CYCLE   15 ..............................
........................................................................
   1    -52.2351505 -0.522352E+02  0.294E-01    1.04       0.0  T
   2    -52.2351734 -0.229222E-04  0.174E-01    1.05       1.0  T
   3    -52.2349224  0.251006E-03  0.116E-01    1.04       1.0  T
   4    -52.2351994 -0.277027E-03  0.217E-02    1.05       1.0  T
   5    -52.2352083 -0.890948E-05  0.753E-03    1.05       2.6  T
   6    -52.2352090 -0.667906E-06  0.476E-03    1.05       4.1  T
   7    -52.2352093 -0.275011E-06  0.228E-03    1.05       8.6  T
   8    -52.2352093 -0.374881E-07  0.121E-03    1.05      16.2  T
     SCC iter.                  ...        0 min,  0.011 sec
     gradient                   ...        0 min,  0.015 sec
 * total energy  :   -51.5833224 Eh     change       -0.4591629E-04 Eh
   gradient norm :     0.0137294 Eh/α   predicted    -0.2295902E-03 ( 400.02%)
   displ. norm   :     0.1499502 α      lambda       -0.5082273E-03
   maximum displ.:     0.0865842 α      in ANC's #1, #2, #6, ...

........................................................................
.............................. CYCLE   16 ..............................
........................................................................
   1    -52.2387276 -0.522387E+02  0.112E-01    1.05       0.0  T
   2    -52.2387420 -0.143302E-04  0.655E-02    1.05       1.0  T
   3    -52.2387187  0.232730E-04  0.425E-02    1.05       1.0  T
   4    -52.2387411 -0.224388E-04  0.185E-02    1.05       1.1  T
   5    -52.2387489 -0.773567E-05  0.442E-03    1.05       4.4  T
   6    -52.2387491 -0.248764E-06  0.265E-03    1.05       7.4  T
   7    -52.2387492 -0.117831E-06  0.121E-03    1.05      16.2  T
     SCC iter.                  ...        0 min,  0.009 sec
     gradient                   ...        0 min,  0.016 sec
 * total energy  :   -51.5834736 Eh     change       -0.1512066E-03 Eh
   gradient norm :     0.0113759 Eh/α   predicted    -0.2598294E-03 (  71.84%)
   displ. norm   :     0.0640698 α      lambda       -0.2283216E-03
   maximum displ.:     0.0287848 α      in ANC's #6, #1, #4, ...

........................................................................
.............................. CYCLE   17 ..............................
........................................................................
   1    -52.2422324 -0.522422E+02  0.735E-02    1.05       0.0  T
   2    -52.2422536 -0.211911E-04  0.425E-02    1.05       1.0  T
   3    -52.2422552 -0.163377E-05  0.238E-02    1.05       1.0  T
   4    -52.2422543  0.929309E-06  0.131E-02    1.05       1.5  T
   5    -52.2422580 -0.369293E-05  0.527E-03    1.05       3.7  T
   6    -52.2422586 -0.613373E-06  0.160E-03    1.05      12.3  T
   7    -52.2422586 -0.160700E-07  0.104E-03    1.05      18.9  T
     SCC iter.                  ...        0 min,  0.009 sec
     gradient                   ...        0 min,  0.015 sec
 * total energy  :   -51.5835564 Eh     change       -0.8271529E-04 Eh
   gradient norm :     0.0053542 Eh/α   predicted    -0.1146331E-03 (  38.59%)
   displ. norm   :     0.1819780 α      lambda       -0.1124599E-03
   maximum displ.:     0.1087302 α      in ANC's #1, #2, #5, ...

........................................................................
.............................. CYCLE   18 ..............................
........................................................................
   1    -52.2398678 -0.522399E+02  0.126E-01    1.04       0.0  T
   2    -52.2398744 -0.661843E-05  0.735E-02    1.05       1.0  T
   3    -52.2398488  0.255812E-04  0.347E-02    1.05       1.0  T
   4    -52.2398759 -0.271092E-04  0.930E-03    1.05       2.1  T
   5    -52.2398775 -0.154356E-05  0.411E-03    1.05       4.8  T
   6    -52.2398778 -0.329688E-06  0.181E-03    1.05      10.8  T
   7    -52.2398778 -0.256985E-07  0.102E-03    1.05      19.1  T
     SCC iter.                  ...        0 min,  0.009 sec
     gradient                   ...        0 min,  0.016 sec
 * total energy  :   -51.5836160 Eh     change       -0.5965140E-04 Eh
   gradient norm :     0.0042803 Eh/α   predicted    -0.5809250E-04 (  -2.61%)
   displ. norm   :     0.1206076 α      lambda       -0.5414378E-04
   maximum displ.:     0.0758596 α      in ANC's #1, #2, #5, ...

........................................................................
.............................. CYCLE   19 ..............................
........................................................................
   1    -52.2398740 -0.522399E+02  0.761E-02    1.04       0.0  T
   2    -52.2398759 -0.190934E-05  0.445E-02    1.05       1.0  T
   3    -52.2398699  0.601569E-05  0.193E-02    1.04       1.0  T
   4    -52.2398767 -0.678096E-05  0.531E-03    1.05       3.7  T
   5    -52.2398773 -0.548564E-06  0.165E-03    1.04      11.9  T
   6    -52.2398773 -0.373153E-08  0.122E-03    1.05      16.1  T
     SCC iter.                  ...        0 min,  0.008 sec
     gradient                   ...        0 min,  0.016 sec
 * total energy  :   -51.5836521 Eh     change       -0.3611641E-04 Eh
   gradient norm :     0.0036135 Eh/α   predicted    -0.2746686E-04 ( -23.95%)
   displ. norm   :     0.1626274 α      lambda       -0.5034522E-04
   maximum displ.:     0.0963080 α      in ANC's #1, #2, #3, ...

........................................................................
.............................. CYCLE   20 ..............................
........................................................................
   1    -52.2406280 -0.522406E+02  0.102E-01    1.04       0.0  T
   2    -52.2406307 -0.268498E-05  0.597E-02    1.04       1.0  T
   3    -52.2406213  0.947477E-05  0.231E-02    1.04       1.0  T
   4    -52.2406316 -0.103668E-04  0.654E-03    1.04       3.0  T
   5    -52.2406325 -0.847965E-06  0.213E-03    1.04       9.2  T
   6    -52.2406325  0.761817E-08  0.161E-03    1.04      12.2  T
   7    -52.2406325 -0.474608E-07  0.602E-04    1.04      32.6  T
   8    -52.2406325 -0.403285E-08  0.249E-04    1.04      78.8  T
     SCC iter.                  ...        0 min,  0.011 sec
     gradient                   ...        0 min,  0.017 sec
 * total energy  :   -51.5836792 Eh     change       -0.2706296E-04 Eh
   gradient norm :     0.0034689 Eh/α   predicted    -0.2584348E-04 (  -4.51%)
   displ. norm   :     0.1045392 α      lambda       -0.3259554E-04
   maximum displ.:     0.0562155 α      in ANC's #1, #3, #2, ...
 * RMSD in coord.:     0.7993899 α      energy gain  -0.1186826E-01 Eh

generating ANC from model Hessian ...
Using Lindh-Hessian (1995)
 Shifting diagonal of input Hessian by   4.192155957407970E-003
 Lowest  eigenvalues of input Hessian
   -0.000000   -0.000000    0.000000    0.000000    0.000000    0.000000
    0.005000    0.005373    0.006576    0.008266    0.008776    0.010808
    0.012377    0.015210    0.015661    0.020870    0.021917    0.022086
 Highest eigenvalues
    2.006389    2.060416    2.241326    2.251708    2.639305    2.656133
 

........................................................................
.............................. CYCLE   21 ..............................
........................................................................
   1    -52.2414049 -0.522414E+02  0.647E-02    1.04       0.0  T
   2    -52.2414071 -0.219186E-05  0.383E-02    1.04       1.0  T
   3    -52.2413979  0.916341E-05  0.212E-02    1.04       1.0  T
   4    -52.2414067 -0.880762E-05  0.840E-03    1.04       2.3  T
   5    -52.2414085 -0.184707E-05  0.167E-03    1.04      11.8  T
   6    -52.2414086 -0.192454E-07  0.115E-03    1.04      17.0  T
   7    -52.2414086 -0.190550E-07  0.528E-04    1.04      37.1  T
   8    -52.2414086 -0.979476E-09  0.288E-04    1.04      68.1  T
     SCC iter.                  ...        0 min,  0.011 sec
     gradient                   ...        0 min,  0.017 sec
 * total energy  :   -51.5836817 Eh     change       -0.2484029E-05 Eh
   gradient norm :     0.0038728 Eh/α   predicted     0.0000000E+00 (-100.00%)
   displ. norm   :     0.0253252 α      lambda       -0.2531447E-04
   maximum displ.:     0.0121337 α      in ANC's #1, #11, #5, ...

........................................................................
.............................. CYCLE   22 ..............................
........................................................................
   1    -52.2413549 -0.522414E+02  0.236E-02    1.04       0.0  T
   2    -52.2413551 -0.171066E-06  0.143E-02    1.04       1.4  T
   3    -52.2413527  0.237499E-05  0.108E-02    1.04       1.8  T
   4    -52.2413554 -0.270368E-05  0.192E-03    1.04      10.2  T
   5    -52.2413555 -0.629634E-07  0.581E-04    1.04      33.8  T
   6    -52.2413555  0.827178E-09  0.414E-04    1.04      47.3  T
     SCC iter.                  ...        0 min,  0.008 sec
     gradient                   ...        0 min,  0.017 sec
 * total energy  :   -51.5836958 Eh     change       -0.1408248E-04 Eh
   gradient norm :     0.0013792 Eh/α   predicted    -0.1266583E-04 ( -10.06%)
   displ. norm   :     0.0385549 α      lambda        0.1775484E-04
   maximum displ.:     0.0193802 α      in ANC's #1, #11, #5, ...

........................................................................
.............................. CYCLE   23 ..............................
........................................................................
   1    -52.2412036 -0.522412E+02  0.357E-02    1.04       0.0  T
   2    -52.2412040 -0.405385E-06  0.216E-02    1.04       1.0  T
   3    -52.2411986  0.537119E-05  0.164E-02    1.04       1.2  T
   4    -52.2412047 -0.611664E-05  0.300E-03    1.04       6.5  T
   5    -52.2412049 -0.154536E-06  0.905E-04    1.04      21.7  T
   6    -52.2412049  0.409189E-08  0.729E-04    1.04      26.9  T
     SCC iter.                  ...        0 min,  0.008 sec
     gradient                   ...        0 min,  0.017 sec
 * total energy  :   -51.5836749 Eh     change        0.2088920E-04 Eh
   gradient norm :     0.0040208 Eh/α   predicted     0.8880171E-05 ( -57.49%)
   displ. norm   :     0.0191788 α      lambda       -0.3889366E-04
   maximum displ.:     0.0076584 α      in ANC's #17, #13, #19, ...

........................................................................
.............................. CYCLE   24 ..............................
........................................................................
   1    -52.2412347 -0.522412E+02  0.230E-02    1.04       0.0  T
   2    -52.2412347  0.306117E-08  0.142E-02    1.04       1.4  T
   3    -52.2412314  0.331277E-05  0.124E-02    1.04       1.6  T
   4    -52.2412351 -0.378114E-05  0.113E-03    1.04      17.4  T
   5    -52.2412352 -0.142946E-07  0.697E-04    1.04      28.1  T
   6    -52.2412352 -0.208763E-08  0.471E-04    1.04      41.6  T
     SCC iter.                  ...        0 min,  0.008 sec
     gradient                   ...        0 min,  0.015 sec
 * total energy  :   -51.5836980 Eh     change       -0.2317177E-04 Eh
   gradient norm :     0.0022957 Eh/α   predicted    -0.1945552E-04 ( -16.04%)
   displ. norm   :     0.0225330 α      lambda       -0.1989434E-04
   maximum displ.:     0.0122704 α      in ANC's #13, #12, #17, ...

........................................................................
.............................. CYCLE   25 ..............................
........................................................................
   1    -52.2412761 -0.522413E+02  0.179E-02    1.04       0.0  T
   2    -52.2412760  0.379194E-07  0.110E-02    1.04       1.8  T
   3    -52.2412738  0.222593E-05  0.101E-02    1.04       1.9  T
   4    -52.2412764 -0.260080E-05  0.142E-03    1.04      13.9  T
   5    -52.2412764 -0.354335E-07  0.726E-04    1.04      27.0  T
   6    -52.2412764 -0.899287E-08  0.334E-04    1.04      58.7  T
     SCC iter.                  ...        0 min,  0.008 sec
     gradient                   ...        0 min,  0.017 sec
 * total energy  :   -51.5837025 Eh     change       -0.4503351E-05 Eh
   gradient norm :     0.0010754 Eh/α   predicted    -0.9954647E-05 ( 121.05%)
   displ. norm   :     0.0212098 α      lambda       -0.8052401E-05
   maximum displ.:     0.0106126 α      in ANC's #11, #10, #1, ...

........................................................................
.............................. CYCLE   26 ..............................
........................................................................
   1    -52.2413077 -0.522413E+02  0.224E-02    1.04       0.0  T
   2    -52.2413078 -0.916646E-07  0.131E-02    1.04       1.5  T
   3    -52.2413066  0.123496E-05  0.691E-03    1.04       2.8  T
   4    -52.2413080 -0.137023E-05  0.870E-04    1.04      22.5  T
   5    -52.2413080 -0.526394E-08  0.602E-04    1.04      32.6  T
   6    -52.2413080 -0.987285E-09  0.383E-04    1.04      51.3  T
     SCC iter.                  ...        0 min,  0.008 sec
     gradient                   ...        0 min,  0.017 sec
 * total energy  :   -51.5837076 Eh     change       -0.5066605E-05 Eh
   gradient norm :     0.0007467 Eh/α   predicted    -0.4027369E-05 ( -20.51%)
   displ. norm   :     0.0249143 α      lambda       -0.3880006E-05
   maximum displ.:     0.0133951 α      in ANC's #11, #1, #10, ...

........................................................................
.............................. CYCLE   27 ..............................
........................................................................
   1    -52.2413132 -0.522413E+02  0.283E-02    1.04       0.0  T
   2    -52.2413134 -0.196248E-06  0.164E-02    1.04       1.2  T
   3    -52.2413132  0.194776E-06  0.352E-03    1.04       5.6  T
   4    -52.2413135 -0.312481E-06  0.929E-04    1.04      21.1  T
   5    -52.2413135 -0.343058E-08  0.626E-04    1.04      31.3  T
     SCC iter.                  ...        0 min,  0.007 sec
     gradient                   ...        0 min,  0.017 sec
 * total energy  :   -51.5837114 Eh     change       -0.3767259E-05 Eh
   gradient norm :     0.0006763 Eh/α   predicted    -0.1943556E-05 ( -48.41%)
   displ. norm   :     0.0626061 α      lambda       -0.6829246E-05
   maximum displ.:     0.0283795 α      in ANC's #11, #1, #10, ...

   *** GEOMETRY OPTIMIZATION CONVERGED AFTER 27 ITERATIONS ***

------------------------------------------------------------------------
 total energy gain   :        -0.0119004 Eh       -7.4676 kcal/mol
 total RMSD          :         0.8016961 a0        0.4242 Å
 total power (kW/mol):        -1.1572081 (step)  -29.2958 (real)
------------------------------------------------------------------------

 ANCopt (total)                0 d,  0 h,  0 min,  1.067 sec
 optimizer setup                ...        0 min,  0.000 sec (  0.015%)
 model hessian                  ...        0 min,  0.009 sec (  0.833%)
 ANC generation                 ...        0 min,  0.002 sec (  0.143%)
 coordinate transformation      ...        0 min,  0.001 sec (  0.052%)
 single point calculation       ...        0 min,  1.043 sec ( 97.788%)
 optimization log               ...        0 min,  0.003 sec (  0.268%)
 hessian update                 ...        0 min,  0.000 sec (  0.035%)
 rational function              ...        0 min,  0.008 sec (  0.707%)

================
 final structure:
================
$coord
    2.27737729823468    0.51088980914984   -0.41880518801144      C 
    1.65033894132369   -1.94310417066283   -0.04890703190224      C 
    3.31381583909770   -4.04524880518074   -0.21497833531900      N 
    2.42338047790519   -6.12732028294473    0.14700405100910      O 
    5.51225501987038   -3.61164908159678   -0.70988553572636      O 
   -1.02662919774158   -2.13694348107746    0.59070356827297      C 
   -2.01801147001495    0.20232942235753    0.53314923259558      C 
   -0.02412822721614    1.99447047726464   -0.11862303240380      C 
   -0.13088291216270    4.56255625290788   -0.33174464285834      C 
    2.05442716404114    6.21169493817938   -0.28585216002621      C 
    1.26375387778553    8.60040797202022    0.10838788583503      C 
   -1.48368484017502    8.61870098401939    0.15319245852761      C 
   -2.87964446191821   10.88076962293718    0.42067056661032      N 
   -5.17715860288959   10.76477232813503    0.36774483809244      O 
   -1.67963888853108   12.81920817779175    0.70824447671559      O 
   -2.38956410009035    6.21359960423630   -0.20816729929074      C 
   -4.97488427801698    5.48332021617246   -0.60113106694933      C 
   -5.70633942127998    3.67466984101321   -2.19874386805047      C 
    4.10078462935997    1.22087198466527   -0.94180594705136      H 
   -1.94403729150879   -3.88919333154641    1.03594589035105      H 
   -3.91958756820644    0.72634624865806    0.98998858062759      H 
    3.97447590152851    5.57415033390337   -0.37069848062861      H 
    2.38451966831541   10.27506531447080    0.34247826017142      H 
   -6.37094617595553    6.64184721429989    0.34488560389718      H 
   -4.37865022429057    2.61649477521874   -3.32362565867554      H 
   -7.67641493331234    3.25336837819776   -2.47497882160447      H 
$end
           -------------------------------------------------
          |                Final Singlepoint                |
           -------------------------------------------------

          ...................................................
          :                      SETUP                      :
          :.................................................:
          :  # basis functions                  80          :
          :  # atomic orbitals                  80          :
          :  # shells                           44          :
          :  # electrons                        90          :
          :  max. iterations                   250          :
          :  Hamiltonian                  GFN2-xTB          :
          :  restarted?                      false          :
          :  GBSA solvation                  false          :
          :  PC potential                    false          :
          :  electronic temp.          300.0000000     K    :
          :  accuracy                    1.0000000          :
          :  -> integral cutoff          0.2500000E+02      :
          :  -> integral neglect         0.1000000E-07      :
          :  -> SCF convergence          0.1000000E-05 Eh   :
          :  -> wf. convergence          0.1000000E-03 e    :
          :  Broyden damping             0.4000000          :
          ...................................................

 iter      E             dE          RMSdq      gap      omega  full diag
   1    -52.2413135 -0.522413E+02  0.463E-04    1.04       0.0  T
   2    -52.2413135  0.347347E-08  0.472E-04    1.04      41.5  T
   3    -52.2413135 -0.609240E-08  0.191E-04    1.04     102.8  T

   *** convergence criteria satisfied after 3 iterations ***

         #    Occupation            Energy/Eh            Energy/eV
      -------------------------------------------------------------
         1        2.0000           -0.7833491             -21.3160
       ...           ...                  ...                  ...
        39        2.0000           -0.4631350             -12.6025
        40        2.0000           -0.4614616             -12.5570
        41        2.0000           -0.4548944             -12.3783
        42        2.0000           -0.4504149             -12.2564
        43        2.0000           -0.4435898             -12.0707
        44        2.0000           -0.4386873             -11.9373
        45        2.0000           -0.4257671             -11.5857 (HOMO)
        46                         -0.3875316             -10.5453 (LUMO)
        47                         -0.3284356              -8.9372
        48                         -0.3140329              -8.5453
        49                         -0.2731832              -7.4337
        50                         -0.2350337              -6.3956
       ...                                ...                  ...
        80                          0.6878511              18.7174
      -------------------------------------------------------------
                  HL-Gap            0.0382355 Eh            1.0404 eV
             Fermi-level           -0.4066493 Eh          -11.0655 eV

 SCC (total)                   0 d,  0 h,  0 min,  0.036 sec
 SCC setup                      ...        0 min,  0.000 sec (  0.669%)
 Dispersion                     ...        0 min,  0.000 sec (  0.727%)
 integral evaluation            ...        0 min,  0.013 sec ( 35.842%)
 zeroth order Hamiltonian       ...        0 min,  0.000 sec (  0.530%)
 iterations                     ...        0 min,  0.005 sec ( 14.110%)
 molecular gradient             ...        0 min,  0.017 sec ( 46.859%)
 printout                       ...        0 min,  0.000 sec (  1.120%)

         :::::::::::::::::::::::::::::::::::::::::::::::::::::
         ::                     SUMMARY                     ::
         :::::::::::::::::::::::::::::::::::::::::::::::::::::
         :: total energy             -51.583711371978 Eh    ::
         :: gradient norm              0.000674180824 Eh/a0 ::
         :: HOMO-LUMO gap              1.040439949250 eV    ::
         ::.................................................::
         :: SCC energy               -52.241313532323 Eh    ::
         :: -> isotropic ES            0.103537463737 Eh    ::
         :: -> anisotropic ES          0.013058226712 Eh    ::
         :: -> anisotropic XC          0.008955743424 Eh    ::
         :: -> dispersion             -0.028309220654 Eh    ::
         :: repulsion energy           0.657605313485 Eh    ::
         :: add. restraining           0.000000000000 Eh    ::
         :::::::::::::::::::::::::::::::::::::::::::::::::::::

           -------------------------------------------------
          |                Property Printout                |
           -------------------------------------------------

    * Orbital Energies and Occupations

         #    Occupation            Energy/Eh            Energy/eV
      -------------------------------------------------------------
         1        2.0000           -0.7833491             -21.3160
       ...           ...                  ...                  ...
        33        2.0000           -0.4995008             -13.5921
        34        2.0000           -0.4917750             -13.3819
        35        2.0000           -0.4808463             -13.0845
        36        2.0000           -0.4803284             -13.0704
        37        2.0000           -0.4758377             -12.9482
        38        2.0000           -0.4697466             -12.7825
        39        2.0000           -0.4631350             -12.6025
        40        2.0000           -0.4614616             -12.5570
        41        2.0000           -0.4548944             -12.3783
        42        2.0000           -0.4504149             -12.2564
        43        2.0000           -0.4435898             -12.0707
        44        2.0000           -0.4386873             -11.9373
        45        2.0000           -0.4257671             -11.5857 (HOMO)
        46                         -0.3875316             -10.5453 (LUMO)
        47                         -0.3284356              -8.9372
        48                         -0.3140329              -8.5453
        49                         -0.2731832              -7.4337
        50                         -0.2350337              -6.3956
        51                         -0.1924181              -5.2360
        52                         -0.1847958              -5.0285
        53                         -0.1591252              -4.3300
        54                         -0.0295526              -0.8042
        55                         -0.0027686              -0.0753
        56                          0.0390543               1.0627
       ...                                ...                  ...
        80                          0.6878511              18.7174
      -------------------------------------------------------------
                  HL-Gap            0.0382355 Eh            1.0404 eV
             Fermi-level           -0.4066493 Eh          -11.0655 eV

     #   Z        covCN         q      C6AA      α(0)
     1   6 C      2.982    -0.029    28.724     8.791
     2   6 C      3.036     0.011    27.741     8.639
     3   7 N      2.757     0.549    13.490     5.455
     4   8 O      0.931    -0.377    21.196     6.174
     5   8 O      0.931    -0.386    21.377     6.201
     6   6 C      3.006    -0.026    28.627     8.777
     7   6 C      3.000    -0.046    29.132     8.854
     8   6 C      3.090     0.042    26.946     8.509
     9   6 C      3.086     0.041    26.986     8.516
    10   6 C      2.991    -0.048    29.186     8.862
    11   6 C      3.006    -0.018    28.445     8.749
    12   6 C      3.026    -0.007    28.170     8.706
    13   7 N      2.757     0.544    13.542     5.466
    14   8 O      0.930    -0.402    21.681     6.245
    15   8 O      0.933    -0.387    21.378     6.201
    16   6 C      3.026     0.029    27.321     8.574
    17   6 C      2.889    -0.021    28.531     8.757
    18   6 C      2.841    -0.067    29.668     8.926
    19   1 H      0.926     0.084     1.942     2.179
    20   1 H      0.926     0.079     1.991     2.207
    21   1 H      0.926     0.062     2.172     2.304
    22   1 H      0.926     0.064     2.147     2.291
    23   1 H      0.926     0.084     1.938     2.177
    24   1 H      0.925     0.096     1.819     2.109
    25   1 H      0.926     0.061     2.187     2.313
    26   1 H      0.926     0.068     2.112     2.272

 Mol. C6AA /au·bohr⁶  :      10168.090176
 Mol. C8AA /au·bohr⁸  :     249404.616561
 Mol. α(0) /au        :        158.253249


Wiberg/Mayer (AO) data.
largest (>0.10) Wiberg bond orders for each atom
          total WBO             WBO to atom ...
     1  C   3.981        C    2 1.644    C    8 1.104    H   19 0.964
     2  C   3.931        C    1 1.644    C    6 1.078    N    3 0.993
     3  N   3.915        O    4 1.444    O    5 1.439    C    2 0.993
     4  O   1.923        N    3 1.444    O    5 0.367
     5  O   1.924        N    3 1.439    O    4 0.367
     6  C   3.950        C    7 1.761    C    2 1.078    H   20 0.967
     7  C   3.984        C    6 1.761    C    8 1.099    H   21 0.964
     8  C   3.972        C    9 1.541    C    1 1.104    C    7 1.099
     9  C   3.969        C    8 1.541    C   10 1.133    C   16 1.042
    10  C   3.982        C   11 1.712    C    9 1.133    H   22 0.967
    11  C   3.931        C   10 1.712    C   12 1.101    H   23 0.965
    12  C   3.940        C   16 1.526    C   11 1.101    N   13 1.017
    13  N   3.915        O   15 1.431    O   14 1.419    C   12 1.017
    14  O   1.911        N   13 1.419    O   15 0.349
    15  O   1.903        N   13 1.431    O   14 0.349
    16  C   3.982        C   12 1.526    C   17 1.147    C    9 1.042
    17  C   3.985        C   18 1.825    C   16 1.147    H   24 0.940
    18  C   3.965        C   17 1.825    H   26 0.976    H   25 0.972
    19  H   0.993        C    1 0.964
    20  H   0.993        C    6 0.967
    21  H   0.995        C    7 0.964
    22  H   0.995        C   10 0.967
    23  H   0.992        C   11 0.965
    24  H   0.989        C   17 0.940
    25  H   0.996        C   18 0.972
    26  H   0.995        C   18 0.976

molecular dipole:
                 x           y           z       tot (Debye)
 q only:       -0.688      -0.207      -0.240
   full:       -0.641      -0.199      -0.240       1.810
molecular quadrupole (traceless):
                xx          xy          yy          xz          yz          zz
 q only:       15.224      27.239     -39.205       2.988      -4.869      23.981
  q+dip:       15.549      28.023     -39.189       2.753      -3.946      23.640
   full:       13.556      28.296     -42.249       3.553      -4.855      28.693

           -------------------------------------------------
          |                Geometry Summary                 |
           -------------------------------------------------

      molecular mass/u    :      244.2062000
   center of mass at/Å    :       -0.2531218       1.8381089      -0.0591390
  moments of inertia/u·Å² :        0.4197621E+03   0.2592588E+04   0.2954536E+04
rotational constants/cm⁻¹ :        0.4015996E-01   0.6502240E-02   0.5705679E-02

 * 20 selected distances

     #   Z        #   Z                                     value/Å
     1   6 C      2   6 C                                 1.3545375
     2   6 C      3   7 N                                 1.4212865 (max)
     3   7 N      4   8 O                                 1.2135280
     3   7 N      5   8 O                                 1.2143525
     6   6 C      7   6 C                                 1.3448131
     8   6 C      9   6 C                                 1.3648139
    10   6 C     11   6 C                                 1.3477449
    12   6 C     13   7 N                                 1.4137258
    13   7 N     14   8 O                                 1.2176629
    13   7 N     15   8 O                                 1.2159863
    12   6 C     16   6 C                                 1.3733869
    17   6 C     18   6 C                                 1.3343884
     1   6 C     19   1 H                                 1.0718183
     6   6 C     20   1 H                                 1.0728419
     7   6 C     21   1 H                                 1.0714092 (min)
    10   6 C     22   1 H                                 1.0715348
    11   6 C     23   1 H                                 1.0735116
    17   6 C     24   1 H                                 1.0826973
    18   6 C     25   1 H                                 1.0777370
    18   6 C     26   1 H                                 1.0760658

 * 4 distinct bonds (by element types)

   Z      Z             #   av. dist./Å        max./Å        min./Å
   1 H    6 C           8     1.0747020     1.0826973     1.0714092
   6 C    6 C           6     1.3532808     1.3733869     1.3343884
   6 C    7 N           2     1.4175061     1.4212865     1.4137258
   7 N    8 O           4     1.2153824     1.2176629     1.2135280


optimized geometry written to: xtbopt.xyz


           -------------------------------------------------
          | TOTAL ENERGY              -51.583711371978 Eh   |
          | GRADIENT NORM               0.000674180824 Eh/α |
          | HOMO-LUMO GAP               1.040439949250 eV   |
           -------------------------------------------------

------------------------------------------------------------------------
 * finished run on 2021/05/19 at 10:59:20.772     
------------------------------------------------------------------------
 total:
 * wall-time:     0 d,  0 h,  0 min,  1.179 sec
 *  cpu-time:     0 d,  0 h,  0 min,  1.179 sec
 * ratio c/w:     0.999 speedup
 SCF:
 * wall-time:     0 d,  0 h,  0 min,  0.050 sec
 *  cpu-time:     0 d,  0 h,  0 min,  0.050 sec
 * ratio c/w:     1.000 speedup
 ANC optimizer:
 * wall-time:     0 d,  0 h,  0 min,  1.103 sec
 *  cpu-time:     0 d,  0 h,  0 min,  1.103 sec
 * ratio c/w:     1.000 speedup

