      -----------------------------------------------------------      
     |                   =====================                   |     
     |                           x T B                           |     
     |                   =====================                   |     
     |                         S. Grimme                         |     
     |          Mulliken Center for Theoretical Chemistry        |     
     |                    University of Bonn                     |     
     |                Version 6.2 RC2 (SAW190805)                |     
      -----------------------------------------------------------      

   This program is distributed in the hope that it will be useful,
   but WITHOUT ANY WARRANTY; without even the implied warranty of
   MERCHANTABILITY or FITNESS FOR A PARTICULAR PURPOSE.
   
   FOR NON-COMMERCIAL, ACADEMIA USE ONLY.
   
   Cite this work as:
   * S. Grimme, C. Bannwarth, P. Shushkov, J. Chem. Theory Comput., 2017,
     13, 1989-2009. DOI: 10.1021/acs.jctc.7b00118
   * C. Bannwarth, S. Ehlert and S. Grimme., J. Chem. Theory Comput., 2019,
     15, 1652-1671. DOI: 10.1021/acs.jctc.8b01176
   * P. Pracht, E. Caldeweyher, S. Ehlert, S. Grimme, ChemRxiv, 2019, preprint.
     DOI: 10.26434/chemrxiv.8326202.v1
   
   for DFT-D4:
   * E. Caldeweyher, C. Bannwarth and S. Grimme, J. Chem. Phys., 2017,
     147, 034112. DOI: 10.1063/1.4993215
   * E. Caldeweyher, S. Ehlert, A. Hansen, H. Neugebauer, S. Spicher,
     C. Bannwarth and S. Grimme, J. Chem. Phys., 2019, 150, 154122.
     DOI: 10.1063/1.5090222
   
   for sTDA-xTB:
   * S. Grimme and C. Bannwarth, J. Chem. Phys., 2016, 145, 054103.
     DOI: 10.1063/1.4959605
   
   in the mass-spec context:
   * V. Asgeirsson, C. Bauer and S. Grimme, Chem. Sci., 2017, 8, 4879.
     DOI: 10.1039/c7sc00601b
   
   for metadynamics refer to:
   * S. Grimme, J. Chem. Theory Comput., 2019, 155, 2847-2862
     DOI: 10.1021/acs.jctc.9b00143
   
   with help from (in alphabetical order)
   C. Bannwarth, F. Bohle, G. Brandenburg, E. Caldeweyher, M. Checinski,
   S. Dohm, S. Ehlert, S. Ehrlich, F. März, H. Neugebauer, J. Pisarek,
   P. Pracht, P. Shushkov, and S. Spicher.
   
 * started run on 2021/05/19 at 10:58:13.194     

           -------------------------------------------------
          |                Calculation Setup                |
           -------------------------------------------------

          program call               : /ihome/ghutchison/geoffh/xtb/xtb 18.xyz -opt
          hostname                   : smp-n58
          coordinate file            : 18.xyz
          omp threads                :                     1
          number of atoms            :                    25
          number of electrons        :                    72
          charge                     :                     0
          spin                       :                   0.0
          first test random number   :      0.97628058771782


########################################################################
# WARNING! Please study the warnings concerning your input carefully
#  - the use of '-opt' is discouraged, please use '--opt' next time
########################################################################

           ------------------------------------------------- 
          |                 G F N 2 - x T B                 |
          | Geometry, Frequencies, Noncovalent interactions |
          |            JCTC 2019 parametrisation            |
           ------------------------------------------------- 
             KAB for C  - Si     :                1.0500
             KAB for H  - Pd     :                0.9500
             k(s)              :                1.8500
             k(p)              :                2.2300
             k(d)              :                2.2300
             k(f)              :                2.0000
             kEN (H0ij)        :               -2.0000
             D4 a1             :                0.5200
             D4 a2             :                5.0000
             D4 s6             :                1.0000
             D4 s8             :                2.7000
             D4 s9             :                5.0000
             alphaj            :                2.0000

  Z AO/shell   Hii/eV     exponent
  1     Wed Apr 25 08:07:45 CEST 2018   EN: 2.200 GM2: 0.406  GM3: 0.0800  RAES: 1.40
     1s    -10.707211    1.230000
  6     Wed Apr 25 08:07:45 CEST 2018   EN: 2.550 GM2: 0.538  GM3: 0.1500  RAES: 3.00
     2s    -13.970922    2.096432
     2p    -10.063292    1.800000
  7     Wed Apr 25 08:07:45 CEST 2018   EN: 3.040 GM2: 0.461  GM3:-0.0640  RAES: 1.90
     2s    -16.686243    2.339881
     2p    -12.523956    2.014332
 16     Tue Apr 24 11:44:34 CEST 2018   EN: 2.580 GM2: 0.340  GM3:-0.0502  RAES: 3.10
     3s    -20.029654    1.981333
     3p    -11.377694    2.025643
     3d     -0.420282    1.702555

           ------------------------------------------------- 
          |        Self-Consistent Charge Iterations        |
           ------------------------------------------------- 

          ...................................................
          :                      SETUP                      :
          :.................................................:
          :  # basis functions                  79          :
          :  # atomic orbitals                  77          :
          :  # shells                           41          :
          :  # electrons                        72          :
          :  max. iterations                   250          :
          :  Hamiltonian                  GFN2-xTB          :
          :  restarted?                      false          :
          :  GBSA solvation                  false          :
          :  PC potential                    false          :
          :  electronic temp.          300.0000000     K    :
          :  accuracy                    1.0000000          :
          :  -> integral cutoff          0.2500000E+02      :
          :  -> integral neglect         0.1000000E-07      :
          :  -> SCF convergence          0.1000000E-05 Eh   :
          :  -> wf. convergence          0.1000000E-03 e    :
          :  Broyden damping             0.4000000          :
          ...................................................

 iter      E             dE          RMSdq      gap      omega  full diag
   1    -39.0750970 -0.390751E+02  0.459E+00    3.08       0.0  T
   2    -39.1138942 -0.387972E-01  0.252E+00    2.63       1.0  T
   3    -39.1030660  0.108282E-01  0.111E+00    2.52       1.0  T
   4    -39.1168255 -0.137595E-01  0.532E-01    2.53       1.0  T
   5    -39.1198891 -0.306359E-02  0.181E-01    2.54       1.0  T
   6    -39.1199995 -0.110407E-03  0.764E-02    2.55       1.0  T
   7    -39.1200574 -0.579442E-04  0.237E-02    2.54       1.0  T
   8    -39.1200641 -0.666848E-05  0.132E-02    2.55       1.5  T
   9    -39.1200653 -0.124401E-05  0.480E-03    2.55       4.2  T
  10    -39.1200655 -0.138948E-06  0.201E-03    2.55      10.0  T
  11    -39.1200655 -0.115986E-07  0.105E-03    2.55      19.0  T
  12    -39.1200655 -0.102954E-07  0.513E-04    2.55      39.0  T
  13    -39.1200655 -0.698002E-09  0.182E-04    2.55     110.1  T

   *** convergence criteria satisfied after 13 iterations ***

         #    Occupation            Energy/Eh            Energy/eV
      -------------------------------------------------------------
         1        2.0000           -0.7324161             -19.9301
       ...           ...                  ...                  ...
        30        2.0000           -0.4546525             -12.3717
        31        2.0000           -0.4389180             -11.9436
        32        2.0000           -0.4313690             -11.7381
        33        2.0000           -0.4131005             -11.2410
        34        2.0000           -0.3845299             -10.4636
        35        2.0000           -0.3820850             -10.3971
        36        2.0000           -0.3632297              -9.8840 (HOMO)
        37                         -0.2696826              -7.3384 (LUMO)
        38                         -0.2423449              -6.5945
        39                         -0.2097979              -5.7089
        40                         -0.2018365              -5.4923
        41                         -0.1967640              -5.3542
       ...                                ...                  ...
        77                          0.6879185              18.7192
      -------------------------------------------------------------
                  HL-Gap            0.0935471 Eh            2.5455 eV
             Fermi-level           -0.3164562 Eh           -8.6112 eV

 SCC (total)                   0 d,  0 h,  0 min,  0.045 sec
 SCC setup                      ...        0 min,  0.000 sec (  0.700%)
 Dispersion                     ...        0 min,  0.000 sec (  0.821%)
 integral evaluation            ...        0 min,  0.011 sec ( 24.256%)
 zeroth order Hamiltonian       ...        0 min,  0.000 sec (  0.477%)
 iterations                     ...        0 min,  0.017 sec ( 38.582%)
 molecular gradient             ...        0 min,  0.015 sec ( 34.332%)
 printout                       ...        0 min,  0.000 sec (  0.729%)

         :::::::::::::::::::::::::::::::::::::::::::::::::::::
         ::                     SUMMARY                     ::
         :::::::::::::::::::::::::::::::::::::::::::::::::::::
         :: total energy             -38.595059180547 Eh    ::
         :: gradient norm              0.080504525264 Eh/a0 ::
         :: HOMO-LUMO gap              2.545546980844 eV    ::
         ::.................................................::
         :: SCC energy               -39.120065490991 Eh    ::
         :: -> isotropic ES            0.014449847857 Eh    ::
         :: -> anisotropic ES          0.003897692060 Eh    ::
         :: -> anisotropic XC          0.023118139851 Eh    ::
         :: -> dispersion             -0.028816304095 Eh    ::
         :: repulsion energy           0.524798089435 Eh    ::
         :: add. restraining           0.000000000000 Eh    ::
         :::::::::::::::::::::::::::::::::::::::::::::::::::::

      ----------------------------------------------------------- 
     |                   =====================                   |
     |                        A N C O P T                        |
     |                   =====================                   |
     |               Approximate Normal Coordinate               |
     |                Rational Function Optimizer                |
      ----------------------------------------------------------- 

          ...................................................
          :                      SETUP                      :
          :.................................................:
          :   optimization level            normal          :
          :   max. optcycles                   200          :
          :   ANC micro-cycles                  20          :
          :   degrees of freedom                69          :
          :.................................................:
          :   RF solver                   davidson          :
          :   input Hessian                  false          :
          :   write xtbopt.log                true          :
          :   linear?                        false          :
          :   energy convergence         0.5000000E-05 Eh   :
          :   grad. convergence          0.1000000E-02 Eh/α :
          :   maximium RF displ.         2.0000000          :
          :   Hlow (freq-cutoff)         0.5000000E-02      :
          :   Hmax (freq-cutoff)         5.0000000          :
          :   S6 in model hess.         20.0000000          :
          ...................................................

generating ANC from model Hessian ...
Using Lindh-Hessian (1995)
 Shifting diagonal of input Hessian by   3.007733804107168E-003
 Lowest  eigenvalues of input Hessian
   -0.000000   -0.000000    0.000000    0.000000    0.000000    0.000000
    0.005000    0.005156    0.005887    0.008629    0.008842    0.012240
    0.014942    0.016625    0.020318    0.027076    0.035582    0.038031
 Highest eigenvalues
    1.634102    1.667652    1.747655    1.892464    1.958569    2.053507
 

........................................................................
.............................. CYCLE    1 ..............................
........................................................................
   1    -39.1200655 -0.391201E+02  0.668E-05    2.55       0.0  T
   2    -39.1200655 -0.152198E-10  0.425E-05    2.55     470.2  T
   3    -39.1200655 -0.804334E-11  0.286E-05    2.55     699.8  T
     SCC iter.                  ...        0 min,  0.004 sec
     gradient                   ...        0 min,  0.017 sec
 * total energy  :   -38.5950592 Eh     change       -0.7714561E-08 Eh
   gradient norm :     0.0805047 Eh/α   predicted     0.0000000E+00 (-100.00%)
   displ. norm   :     0.2444664 α      lambda       -0.7452480E-02
   maximum displ.:     0.1088465 α      in ANC's #12, #9, #15, ...

........................................................................
.............................. CYCLE    2 ..............................
........................................................................
   1    -39.1431642 -0.391432E+02  0.242E-01    2.66       0.0  T
   2    -39.1432350 -0.707854E-04  0.121E-01    2.65       1.0  T
   3    -39.1432033  0.316775E-04  0.679E-02    2.65       1.0  T
   4    -39.1432628 -0.594904E-04  0.250E-02    2.65       1.0  T
   5    -39.1432670 -0.420611E-05  0.103E-02    2.65       2.0  T
   6    -39.1432675 -0.487349E-06  0.400E-03    2.65       5.0  T
   7    -39.1432677 -0.207819E-06  0.162E-03    2.65      12.4  T
     SCC iter.                  ...        0 min,  0.009 sec
     gradient                   ...        0 min,  0.016 sec
 * total energy  :   -38.6000572 Eh     change       -0.4997992E-02 Eh
   gradient norm :     0.0357145 Eh/α   predicted    -0.3948948E-02 ( -20.99%)
   displ. norm   :     0.1601688 α      lambda       -0.1926547E-02
   maximum displ.:     0.0865333 α      in ANC's #9, #6, #5, ...

........................................................................
.............................. CYCLE    3 ..............................
........................................................................
   1    -39.1537315 -0.391537E+02  0.166E-01    2.71       0.0  T
   2    -39.1537687 -0.371659E-04  0.863E-02    2.72       1.0  T
   3    -39.1537529  0.157282E-04  0.485E-02    2.72       1.0  T
   4    -39.1537847 -0.317561E-04  0.171E-02    2.72       1.2  T
   5    -39.1537865 -0.177157E-05  0.680E-03    2.72       2.9  T
   6    -39.1537867 -0.265408E-06  0.288E-03    2.72       6.9  T
   7    -39.1537868 -0.895178E-07  0.126E-03    2.72      15.9  T
     SCC iter.                  ...        0 min,  0.009 sec
     gradient                   ...        0 min,  0.014 sec
 * total energy  :   -38.6011330 Eh     change       -0.1075773E-02 Eh
   gradient norm :     0.0085435 Eh/α   predicted    -0.9879987E-03 (  -8.16%)
   displ. norm   :     0.0786838 α      lambda       -0.1859531E-03
   maximum displ.:     0.0394167 α      in ANC's #5, #1, #6, ...

........................................................................
.............................. CYCLE    4 ..............................
........................................................................
   1    -39.1525332 -0.391525E+02  0.505E-02    2.72       0.0  T
   2    -39.1525353 -0.208768E-05  0.269E-02    2.72       1.0  T
   3    -39.1525338  0.149390E-05  0.111E-02    2.72       1.8  T
   4    -39.1525359 -0.203956E-05  0.441E-03    2.72       4.5  T
   5    -39.1525360 -0.156373E-06  0.126E-03    2.72      15.9  T
   6    -39.1525360 -0.801911E-08  0.692E-04    2.72      28.9  T
     SCC iter.                  ...        0 min,  0.007 sec
     gradient                   ...        0 min,  0.014 sec
 * total energy  :   -38.6012576 Eh     change       -0.1246573E-03 Eh
   gradient norm :     0.0037804 Eh/α   predicted    -0.9359273E-04 ( -24.92%)
   displ. norm   :     0.0712431 α      lambda       -0.5925088E-04
   maximum displ.:     0.0463167 α      in ANC's #1, #2, #5, ...

........................................................................
.............................. CYCLE    5 ..............................
........................................................................
   1    -39.1513237 -0.391513E+02  0.438E-02    2.72       0.0  T
   2    -39.1513247 -0.105536E-05  0.226E-02    2.72       1.0  T
   3    -39.1513245  0.208485E-06  0.594E-03    2.72       3.4  T
   4    -39.1513249 -0.320522E-06  0.334E-03    2.72       6.0  T
   5    -39.1513250 -0.116868E-06  0.884E-04    2.72      22.6  T
   6    -39.1513250 -0.358652E-08  0.372E-04    2.72      53.7  T
     SCC iter.                  ...        0 min,  0.007 sec
     gradient                   ...        0 min,  0.016 sec
 * total energy  :   -38.6012952 Eh     change       -0.3756743E-04 Eh
   gradient norm :     0.0015025 Eh/α   predicted    -0.2978313E-04 ( -20.72%)
   displ. norm   :     0.0812918 α      lambda       -0.1910374E-04
   maximum displ.:     0.0571491 α      in ANC's #1, #2, #5, ...

........................................................................
.............................. CYCLE    6 ..............................
........................................................................
   1    -39.1508696 -0.391509E+02  0.516E-02    2.72       0.0  T
   2    -39.1508705 -0.947719E-06  0.265E-02    2.72       1.0  T
   3    -39.1508706 -0.947535E-07  0.490E-03    2.72       4.1  T
   4    -39.1508706  0.953012E-08  0.309E-03    2.72       6.5  T
   5    -39.1508707 -0.129525E-06  0.776E-04    2.72      25.8  T
   6    -39.1508707 -0.718782E-08  0.269E-04    2.72      74.3  T
     SCC iter.                  ...        0 min,  0.007 sec
     gradient                   ...        0 min,  0.015 sec
 * total energy  :   -38.6013170 Eh     change       -0.2179331E-04 Eh
   gradient norm :     0.0018933 Eh/α   predicted    -0.9582498E-05 ( -56.03%)
   displ. norm   :     0.0934688 α      lambda       -0.2078081E-04
   maximum displ.:     0.0627329 α      in ANC's #1, #2, #4, ...

........................................................................
.............................. CYCLE    7 ..............................
........................................................................
   1    -39.1511678 -0.391512E+02  0.604E-02    2.72       0.0  T
   2    -39.1511690 -0.112691E-05  0.310E-02    2.72       1.0  T
   3    -39.1511690 -0.794218E-07  0.574E-03    2.72       3.5  T
   4    -39.1511691 -0.216281E-07  0.370E-03    2.72       5.4  T
   5    -39.1511693 -0.207208E-06  0.576E-04    2.72      34.7  T
   6    -39.1511693 -0.339244E-08  0.315E-04    2.72      63.4  T
     SCC iter.                  ...        0 min,  0.008 sec
     gradient                   ...        0 min,  0.016 sec
 * total energy  :   -38.6013430 Eh     change       -0.2601451E-04 Eh
   gradient norm :     0.0019617 Eh/α   predicted    -0.1043120E-04 ( -59.90%)
   displ. norm   :     0.1400329 α      lambda       -0.2497085E-04
   maximum displ.:     0.0927046 α      in ANC's #1, #2, #4, ...

........................................................................
.............................. CYCLE    8 ..............................
........................................................................
   1    -39.1514478 -0.391514E+02  0.871E-02    2.72       0.0  T
   2    -39.1514502 -0.235665E-05  0.445E-02    2.72       1.0  T
   3    -39.1514506 -0.396265E-06  0.792E-03    2.72       2.5  T
   4    -39.1514503  0.262986E-06  0.493E-03    2.72       4.1  T
   5    -39.1514508 -0.469871E-06  0.709E-04    2.72      28.2  T
   6    -39.1514508 -0.281007E-08  0.459E-04    2.72      43.6  T
     SCC iter.                  ...        0 min,  0.007 sec
     gradient                   ...        0 min,  0.016 sec
 * total energy  :   -38.6013738 Eh     change       -0.3077607E-04 Eh
   gradient norm :     0.0016497 Eh/α   predicted    -0.1259818E-04 ( -59.07%)
   displ. norm   :     0.1821461 α      lambda       -0.2602711E-04
   maximum displ.:     0.1186022 α      in ANC's #1, #2, #6, ...

........................................................................
.............................. CYCLE    9 ..............................
........................................................................
   1    -39.1515316 -0.391515E+02  0.116E-01    2.72       0.0  T
   2    -39.1515361 -0.447668E-05  0.581E-02    2.72       1.0  T
   3    -39.1515371 -0.972159E-06  0.101E-02    2.72       2.0  T
   4    -39.1515367  0.403832E-06  0.484E-03    2.72       4.1  T
   5    -39.1515372 -0.515738E-06  0.883E-04    2.72      22.6  T
   6    -39.1515372 -0.354375E-08  0.534E-04    2.72      37.4  T
     SCC iter.                  ...        0 min,  0.007 sec
     gradient                   ...        0 min,  0.015 sec
 * total energy  :   -38.6014053 Eh     change       -0.3153490E-04 Eh
   gradient norm :     0.0013416 Eh/α   predicted    -0.1320652E-04 ( -58.12%)
   displ. norm   :     0.2728119 α      lambda       -0.3258151E-04
   maximum displ.:     0.1730954 α      in ANC's #2, #1, #6, ...

........................................................................
.............................. CYCLE   10 ..............................
........................................................................
   1    -39.1512248 -0.391512E+02  0.175E-01    2.72       0.0  T
   2    -39.1512352 -0.103959E-04  0.873E-02    2.72       1.0  T
   3    -39.1512376 -0.236065E-05  0.152E-02    2.72       1.3  T
   4    -39.1512373  0.289114E-06  0.452E-03    2.72       4.4  T
   5    -39.1512377 -0.368609E-06  0.133E-03    2.72      15.0  T
   6    -39.1512377 -0.129196E-07  0.726E-04    2.72      27.5  T
   7    -39.1512377 -0.120421E-08  0.294E-04    2.72      68.1  T
     SCC iter.                  ...        0 min,  0.008 sec
     gradient                   ...        0 min,  0.017 sec
 * total energy  :   -38.6014408 Eh     change       -0.3545984E-04 Eh
   gradient norm :     0.0019358 Eh/α   predicted    -0.1683208E-04 ( -52.53%)
   displ. norm   :     0.3133794 α      lambda       -0.3392181E-04
   maximum displ.:     0.1952129 α      in ANC's #2, #1, #3, ...

........................................................................
.............................. CYCLE   11 ..............................
........................................................................
   1    -39.1508332 -0.391508E+02  0.208E-01    2.73       0.0  T
   2    -39.1508482 -0.149452E-04  0.102E-01    2.72       1.0  T
   3    -39.1508515 -0.332709E-05  0.178E-02    2.72       1.1  T
   4    -39.1508509  0.638129E-06  0.616E-03    2.72       3.2  T
   5    -39.1508516 -0.775322E-06  0.144E-03    2.72      13.9  T
   6    -39.1508516 -0.124753E-07  0.776E-04    2.72      25.8  T
   7    -39.1508516 -0.131473E-08  0.306E-04    2.72      65.4  T
     SCC iter.                  ...        0 min,  0.008 sec
     gradient                   ...        0 min,  0.015 sec
 * total energy  :   -38.6014748 Eh     change       -0.3402312E-04 Eh
   gradient norm :     0.0029822 Eh/α   predicted    -0.1770505E-04 ( -47.96%)
   displ. norm   :     0.1226689 α      lambda       -0.3590126E-04
   maximum displ.:     0.0708416 α      in ANC's #2, #3, #1, ...

........................................................................
.............................. CYCLE   12 ..............................
........................................................................
   1    -39.1515400 -0.391515E+02  0.789E-02    2.72       0.0  T
   2    -39.1515420 -0.207574E-05  0.391E-02    2.72       1.0  T
   3    -39.1515425 -0.445136E-06  0.708E-03    2.72       2.8  T
   4    -39.1515424  0.113887E-06  0.261E-03    2.72       7.7  T
   5    -39.1515425 -0.138783E-06  0.526E-04    2.72      38.0  T
   6    -39.1515425 -0.156239E-08  0.274E-04    2.72      73.0  T
     SCC iter.                  ...        0 min,  0.007 sec
     gradient                   ...        0 min,  0.015 sec
 * total energy  :   -38.6015051 Eh     change       -0.3030233E-04 Eh
   gradient norm :     0.0021686 Eh/α   predicted    -0.1822560E-04 ( -39.85%)
   displ. norm   :     0.2828008 α      lambda       -0.6782966E-04
   maximum displ.:     0.1572377 α      in ANC's #2, #3, #1, ...

........................................................................
.............................. CYCLE   13 ..............................
........................................................................
   1    -39.1512919 -0.391513E+02  0.186E-01    2.72       0.0  T
   2    -39.1513031 -0.111925E-04  0.925E-02    2.72       1.0  T
   3    -39.1513056 -0.245241E-05  0.165E-02    2.72       1.2  T
   4    -39.1513052  0.384868E-06  0.483E-03    2.72       4.1  T
   5    -39.1513057 -0.492304E-06  0.117E-03    2.72      17.1  T
   6    -39.1513057 -0.132001E-07  0.591E-04    2.72      33.8  T
   7    -39.1513057 -0.135804E-08  0.173E-04    2.72     115.3  T
     SCC iter.                  ...        0 min,  0.009 sec
     gradient                   ...        0 min,  0.017 sec
 * total energy  :   -38.6015640 Eh     change       -0.5894903E-04 Eh
   gradient norm :     0.0023675 Eh/α   predicted    -0.3662884E-04 ( -37.86%)
   displ. norm   :     0.3496450 α      lambda       -0.1088204E-03
   maximum displ.:     0.2007532 α      in ANC's #3, #2, #4, ...

........................................................................
.............................. CYCLE   14 ..............................
........................................................................
   1    -39.1508413 -0.391508E+02  0.227E-01    2.73       0.0  T
   2    -39.1508569 -0.156135E-04  0.114E-01    2.73       1.0  T
   3    -39.1508601 -0.314944E-05  0.208E-02    2.73       1.0  T
   4    -39.1508587  0.139357E-05  0.897E-03    2.72       2.2  T
   5    -39.1508605 -0.184223E-05  0.145E-03    2.73      13.8  T
   6    -39.1508606 -0.218205E-07  0.716E-04    2.73      27.9  T
   7    -39.1508606 -0.132029E-08  0.257E-04    2.73      77.8  T
     SCC iter.                  ...        0 min,  0.009 sec
     gradient                   ...        0 min,  0.016 sec
 * total energy  :   -38.6016474 Eh     change       -0.8336930E-04 Eh
   gradient norm :     0.0039596 Eh/α   predicted    -0.6106785E-04 ( -26.75%)
   displ. norm   :     0.2964338 α      lambda       -0.1062801E-03
   maximum displ.:     0.1969359 α      in ANC's #3, #4, #2, ...

........................................................................
.............................. CYCLE   15 ..............................
........................................................................
   1    -39.1509795 -0.391510E+02  0.175E-01    2.73       0.0  T
   2    -39.1509880 -0.843632E-05  0.902E-02    2.73       1.0  T
   3    -39.1509890 -0.981417E-06  0.175E-02    2.73       1.1  T
   4    -39.1509878  0.111538E-05  0.103E-02    2.72       1.9  T
   5    -39.1509900 -0.220744E-05  0.110E-03    2.73      18.2  T
   6    -39.1509901 -0.114544E-07  0.590E-04    2.73      33.9  T
   7    -39.1509901 -0.128146E-08  0.221E-04    2.73      90.7  T
     SCC iter.                  ...        0 min,  0.008 sec
     gradient                   ...        0 min,  0.016 sec
 * total energy  :   -38.6017180 Eh     change       -0.7061293E-04 Eh
   gradient norm :     0.0048477 Eh/α   predicted    -0.5781063E-04 ( -18.13%)
   displ. norm   :     0.1571169 α      lambda       -0.6799271E-04
   maximum displ.:     0.1034387 α      in ANC's #3, #4, #6, ...

........................................................................
.............................. CYCLE   16 ..............................
........................................................................
   1    -39.1515574 -0.391516E+02  0.895E-02    2.73       0.0  T
   2    -39.1515596 -0.225268E-05  0.466E-02    2.73       1.0  T
   3    -39.1515590  0.665988E-06  0.108E-02    2.73       1.9  T
   4    -39.1515600 -0.988159E-06  0.598E-03    2.73       3.3  T
   5    -39.1515603 -0.370642E-06  0.725E-04    2.73      27.6  T
   6    -39.1515603 -0.562036E-08  0.342E-04    2.73      58.5  T
     SCC iter.                  ...        0 min,  0.007 sec
     gradient                   ...        0 min,  0.014 sec
 * total energy  :   -38.6017694 Eh     change       -0.5137799E-04 Eh
   gradient norm :     0.0034022 Eh/α   predicted    -0.3484864E-04 ( -32.17%)
   displ. norm   :     0.2560041 α      lambda       -0.7426177E-04
   maximum displ.:     0.1537246 α      in ANC's #3, #4, #6, ...

........................................................................
.............................. CYCLE   17 ..............................
........................................................................
   1    -39.1504449 -0.391504E+02  0.157E-01    2.73       0.0  T
   2    -39.1504525 -0.754538E-05  0.797E-02    2.73       1.0  T
   3    -39.1504517  0.782422E-06  0.174E-02    2.73       1.1  T
   4    -39.1504532 -0.148817E-05  0.103E-02    2.73       1.9  T
   5    -39.1504545 -0.131452E-05  0.127E-03    2.73      15.7  T
   6    -39.1504545 -0.152291E-07  0.591E-04    2.73      33.9  T
   7    -39.1504545 -0.152102E-08  0.346E-04    2.73      57.7  T
     SCC iter.                  ...        0 min,  0.008 sec
     gradient                   ...        0 min,  0.015 sec
 * total energy  :   -38.6018073 Eh     change       -0.3787212E-04 Eh
   gradient norm :     0.0035961 Eh/α   predicted    -0.3957181E-04 (   4.49%)
   displ. norm   :     0.3132511 α      lambda       -0.1875231E-03
   maximum displ.:     0.1722553 α      in ANC's #1, #2, #4, ...

........................................................................
.............................. CYCLE   18 ..............................
........................................................................
   1    -39.1554523 -0.391555E+02  0.130E-01    2.74       0.0  T
   2    -39.1554569 -0.460125E-05  0.729E-02    2.73       1.0  T
   3    -39.1554476  0.932912E-05  0.232E-02    2.73       1.0  T
   4    -39.1554587 -0.111466E-04  0.729E-03    2.73       2.7  T
   5    -39.1554591 -0.394165E-06  0.252E-03    2.73       7.9  T
   6    -39.1554592 -0.403656E-07  0.700E-04    2.73      28.6  T
   7    -39.1554592 -0.380922E-09  0.392E-04    2.73      51.0  T
     SCC iter.                  ...        0 min,  0.008 sec
     gradient                   ...        0 min,  0.015 sec
 * total energy  :   -38.6017625 Eh     change        0.4479091E-04 Eh
   gradient norm :     0.0096919 Eh/α   predicted    -0.1029872E-03 (-329.93%)
   displ. norm   :     0.0864687 α      lambda       -0.1884672E-03
   maximum displ.:     0.0623317 α      in ANC's #1, #2, #6, ...

........................................................................
.............................. CYCLE   19 ..............................
........................................................................
   1    -39.1529120 -0.391529E+02  0.587E-02    2.73       0.0  T
   2    -39.1529136 -0.159481E-05  0.285E-02    2.73       1.0  T
   3    -39.1529128  0.753030E-06  0.898E-03    2.73       2.2  T
   4    -39.1529140 -0.118225E-05  0.401E-03    2.73       5.0  T
   5    -39.1529141 -0.805903E-07  0.155E-03    2.73      12.9  T
   6    -39.1529141 -0.244051E-07  0.306E-04    2.73      65.4  T
     SCC iter.                  ...        0 min,  0.007 sec
     gradient                   ...        0 min,  0.014 sec
 * total energy  :   -38.6018653 Eh     change       -0.1028526E-03 Eh
   gradient norm :     0.0031815 Eh/α   predicted    -0.9494129E-04 (  -7.69%)
   displ. norm   :     0.0778450 α      lambda       -0.2870115E-04
   maximum displ.:     0.0527256 α      in ANC's #3, #4, #1, ...

........................................................................
.............................. CYCLE   20 ..............................
........................................................................
   1    -39.1521994 -0.391522E+02  0.395E-02    2.73       0.0  T
   2    -39.1521999 -0.502159E-06  0.218E-02    2.73       1.0  T
   3    -39.1521991  0.790631E-06  0.682E-03    2.73       2.9  T
   4    -39.1522001 -0.981461E-06  0.245E-03    2.73       8.2  T
   5    -39.1522002 -0.358247E-07  0.668E-04    2.73      29.9  T
   6    -39.1522002 -0.391525E-08  0.249E-04    2.73      80.5  T
     SCC iter.                  ...        0 min,  0.007 sec
     gradient                   ...        0 min,  0.015 sec
 * total energy  :   -38.6018839 Eh     change       -0.1857361E-04 Eh
   gradient norm :     0.0012569 Eh/α   predicted    -0.1444211E-04 ( -22.24%)
   displ. norm   :     0.1168744 α      lambda       -0.2563478E-04
   maximum displ.:     0.0810140 α      in ANC's #2, #5, #3, ...
 * RMSD in coord.:     0.4700939 α      energy gain  -0.6824718E-02 Eh

generating ANC from model Hessian ...
Using Lindh-Hessian (1995)
 Shifting diagonal of input Hessian by   2.938068500655091E-003
 Lowest  eigenvalues of input Hessian
   -0.000000   -0.000000   -0.000000    0.000000    0.000000    0.000000
    0.005000    0.005253    0.006007    0.008636    0.009213    0.012577
    0.015303    0.017298    0.021058    0.028245    0.036240    0.038086
 Highest eigenvalues
    1.628808    1.724617    1.826286    1.967186    1.986741    2.154172
 

........................................................................
.............................. CYCLE   21 ..............................
........................................................................
   1    -39.1518406 -0.391518E+02  0.607E-02    2.73       0.0  T
   2    -39.1518413 -0.715412E-06  0.339E-02    2.73       1.0  T
   3    -39.1518406  0.712627E-06  0.733E-03    2.73       2.7  T
   4    -39.1518415 -0.848790E-06  0.356E-03    2.73       5.6  T
   5    -39.1518416 -0.122976E-06  0.884E-04    2.73      22.6  T
   6    -39.1518416 -0.108693E-07  0.292E-04    2.73      68.5  T
     SCC iter.                  ...        0 min,  0.008 sec
     gradient                   ...        0 min,  0.016 sec
 * total energy  :   -38.6019103 Eh     change       -0.2642118E-04 Eh
   gradient norm :     0.0013270 Eh/α   predicted     0.0000000E+00 (-100.00%)
   displ. norm   :     0.0517683 α      lambda       -0.9824376E-05
   maximum displ.:     0.0458661 α      in ANC's #2, #5, #3, ...

........................................................................
.............................. CYCLE   22 ..............................
........................................................................
   1    -39.1522068 -0.391522E+02  0.329E-02    2.73       0.0  T
   2    -39.1522071 -0.312343E-06  0.169E-02    2.73       1.2  T
   3    -39.1522071  0.197734E-07  0.338E-03    2.73       5.9  T
   4    -39.1522071 -0.646087E-07  0.201E-03    2.73       9.9  T
   5    -39.1522072 -0.429878E-07  0.292E-04    2.73      68.6  T
   6    -39.1522072 -0.138728E-08  0.112E-04    2.73     179.3  T
     SCC iter.                  ...        0 min,  0.007 sec
     gradient                   ...        0 min,  0.015 sec
 * total energy  :   -38.6019215 Eh     change       -0.1116554E-04 Eh
   gradient norm :     0.0003870 Eh/α   predicted    -0.4918131E-05 ( -55.95%)
   displ. norm   :     0.0352695 α      lambda       -0.4549009E-05
   maximum displ.:     0.0250776 α      in ANC's #2, #5, #7, ...

........................................................................
.............................. CYCLE   23 ..............................
........................................................................
   1    -39.1521980 -0.391522E+02  0.233E-02    2.73       0.0  T
   2    -39.1521981 -0.147078E-06  0.120E-02    2.73       1.7  T
   3    -39.1521981 -0.140388E-07  0.220E-03    2.73       9.1  T
   4    -39.1521981  0.330999E-09  0.140E-03    2.73      14.3  T
   5    -39.1521982 -0.255645E-07  0.208E-04    2.73      96.1  T
   6    -39.1521982 -0.471147E-09  0.911E-05    2.73     219.5  T
     SCC iter.                  ...        0 min,  0.007 sec
     gradient                   ...        0 min,  0.017 sec
 * total energy  :   -38.6019272 Eh     change       -0.5720773E-05 Eh
   gradient norm :     0.0003921 Eh/α   predicted    -0.2275892E-05 ( -60.22%)
   displ. norm   :     0.0616254 α      lambda       -0.6006055E-05
   maximum displ.:     0.0420631 α      in ANC's #2, #5, #1, ...

........................................................................
.............................. CYCLE   24 ..............................
........................................................................
   1    -39.1520659 -0.391521E+02  0.378E-02    2.73       0.0  T
   2    -39.1520663 -0.336279E-06  0.198E-02    2.73       1.0  T
   3    -39.1520663 -0.517684E-07  0.344E-03    2.73       5.8  T
   4    -39.1520663  0.382627E-07  0.226E-03    2.73       8.9  T
   5    -39.1520664 -0.753704E-07  0.279E-04    2.73      71.6  T
   6    -39.1520664 -0.798828E-09  0.143E-04    2.73     139.9  T
     SCC iter.                  ...        0 min,  0.008 sec
     gradient                   ...        0 min,  0.017 sec
 * total energy  :   -38.6019343 Eh     change       -0.7076371E-05 Eh
   gradient norm :     0.0004839 Eh/α   predicted    -0.3011329E-05 ( -57.45%)
   displ. norm   :     0.0632472 α      lambda       -0.4306610E-05
   maximum displ.:     0.0432628 α      in ANC's #2, #5, #1, ...

........................................................................
.............................. CYCLE   25 ..............................
........................................................................
   1    -39.1520891 -0.391521E+02  0.316E-02    2.73       0.0  T
   2    -39.1520893 -0.180117E-06  0.173E-02    2.73       1.2  T
   3    -39.1520893 -0.315607E-07  0.271E-03    2.73       7.4  T
   4    -39.1520893  0.332530E-07  0.169E-03    2.73      11.8  T
   5    -39.1520894 -0.501678E-07  0.200E-04    2.73     100.1  T
   6    -39.1520894 -0.307622E-09  0.115E-04    2.73     173.7  T
     SCC iter.                  ...        0 min,  0.007 sec
     gradient                   ...        0 min,  0.015 sec
 * total energy  :   -38.6019392 Eh     change       -0.4946390E-05 Eh
   gradient norm :     0.0004135 Eh/α   predicted    -0.2157604E-05 ( -56.38%)
   displ. norm   :     0.0477229 α      lambda       -0.2516595E-05
   maximum displ.:     0.0333455 α      in ANC's #2, #1, #5, ...

   *** GEOMETRY OPTIMIZATION CONVERGED AFTER 25 ITERATIONS ***

------------------------------------------------------------------------
 total energy gain   :        -0.0068800 Eh       -4.3173 kcal/mol
 total RMSD          :         0.4610047 a0        0.2440 Å
 total power (kW/mol):        -0.7225426 (step)  -20.4408 (real)
------------------------------------------------------------------------

 ANCopt (total)                0 d,  0 h,  0 min,  0.884 sec
 optimizer setup                ...        0 min,  0.000 sec (  0.016%)
 model hessian                  ...        0 min,  0.013 sec (  1.464%)
 ANC generation                 ...        0 min,  0.001 sec (  0.148%)
 coordinate transformation      ...        0 min,  0.000 sec (  0.047%)
 single point calculation       ...        0 min,  0.861 sec ( 97.409%)
 optimization log               ...        0 min,  0.002 sec (  0.261%)
 hessian update                 ...        0 min,  0.000 sec (  0.033%)
 rational function              ...        0 min,  0.004 sec (  0.464%)

================
 final structure:
================
$coord
    6.39751991784467    0.26042007435186   -0.01487066029700      C 
    4.66774300740371    2.13390653580565   -0.10762629934273      C 
    2.14132021949646    1.21512531659290    0.00697941080199      C 
    2.08184973509332   -1.44118788154753    0.18737943169352      C 
    5.09532376617091   -2.73624906662153    0.21704314856100      S 
    0.00980888701857   -2.83174307407869    0.32432046768819      N 
   -2.12629429480508   -1.57667111416913    0.28127573323005      C 
   -2.34711058319632    1.07411096647787    0.13116164703497      C 
   -0.18233869922727    2.51999811048896   -0.00711507101410      C 
   -0.22929423587289    5.35455049320734   -0.05723663020957      C 
    0.14347717684257    6.41519733704632    2.60702698048681      C 
   -5.02881507094038    1.98673422446226    0.25513771579287      C 
   -6.73116350508107   -0.24835150899664   -0.39662789218031      C 
   -5.02535503957911   -3.14788369904733    0.44734724291507      S 
    8.41593898244830    0.43567526098854   -0.06554015964154      H 
    5.15792712996446    4.10032991681630   -0.24975619426850      H 
   -2.02590774320861    6.02462486578372   -0.81343008406633      H 
    1.27799788114334    6.04362169856636   -1.28479544929460      H 
   -1.36539085696746    5.78169830265885    3.85086917522536      H 
    0.13785908763458    8.46955810645861    2.56411299753257      H 
    1.93396795043166    5.77705008534187    3.38923339454093      H 
   -5.37731775808324    3.54671613645494   -1.04725099930574      H 
   -5.42559976912813    2.65488969344334    2.17206438641898      H 
   -7.11226481203942   -0.34386134437989   -2.42004914123857      H 
   -8.51352807435767   -0.22964423181582    0.62513317819036      H 
$end
           -------------------------------------------------
          |                Final Singlepoint                |
           -------------------------------------------------

          ...................................................
          :                      SETUP                      :
          :.................................................:
          :  # basis functions                  79          :
          :  # atomic orbitals                  77          :
          :  # shells                           41          :
          :  # electrons                        72          :
          :  max. iterations                   250          :
          :  Hamiltonian                  GFN2-xTB          :
          :  restarted?                      false          :
          :  GBSA solvation                  false          :
          :  PC potential                    false          :
          :  electronic temp.          300.0000000     K    :
          :  accuracy                    1.0000000          :
          :  -> integral cutoff          0.2500000E+02      :
          :  -> integral neglect         0.1000000E-07      :
          :  -> SCF convergence          0.1000000E-05 Eh   :
          :  -> wf. convergence          0.1000000E-03 e    :
          :  Broyden damping             0.4000000          :
          ...................................................

 iter      E             dE          RMSdq      gap      omega  full diag
   1    -39.1520894 -0.391521E+02  0.356E-05    2.73       0.0  T
   2    -39.1520894 -0.465405E-11  0.210E-05    2.73     954.4  T
   3    -39.1520894 -0.198241E-11  0.143E-05    2.73    1401.5  T

   *** convergence criteria satisfied after 3 iterations ***

         #    Occupation            Energy/Eh            Energy/eV
      -------------------------------------------------------------
         1        2.0000           -0.7292238             -19.8432
       ...           ...                  ...                  ...
        30        2.0000           -0.4549759             -12.3805
        31        2.0000           -0.4406546             -11.9908
        32        2.0000           -0.4318168             -11.7503
        33        2.0000           -0.4122133             -11.2169
        34        2.0000           -0.3863613             -10.5134
        35        2.0000           -0.3786298             -10.3030
        36        2.0000           -0.3640978              -9.9076 (HOMO)
        37                         -0.2637632              -7.1774 (LUMO)
        38                         -0.2426257              -6.6022
        39                         -0.2137862              -5.8174
        40                         -0.2030037              -5.5240
        41                         -0.1978349              -5.3834
       ...                                ...                  ...
        77                          0.6939690              18.8839
      -------------------------------------------------------------
                  HL-Gap            0.1003346 Eh            2.7302 eV
             Fermi-level           -0.3139305 Eh           -8.5425 eV

 SCC (total)                   0 d,  0 h,  0 min,  0.031 sec
 SCC setup                      ...        0 min,  0.000 sec (  0.582%)
 Dispersion                     ...        0 min,  0.000 sec (  0.591%)
 integral evaluation            ...        0 min,  0.010 sec ( 33.793%)
 zeroth order Hamiltonian       ...        0 min,  0.000 sec (  0.617%)
 iterations                     ...        0 min,  0.004 sec ( 14.030%)
 molecular gradient             ...        0 min,  0.015 sec ( 49.300%)
 printout                       ...        0 min,  0.000 sec (  0.950%)

         :::::::::::::::::::::::::::::::::::::::::::::::::::::
         ::                     SUMMARY                     ::
         :::::::::::::::::::::::::::::::::::::::::::::::::::::
         :: total energy             -38.601939223543 Eh    ::
         :: gradient norm              0.000413550305 Eh/a0 ::
         :: HOMO-LUMO gap              2.730244307457 eV    ::
         ::.................................................::
         :: SCC energy               -39.152089359535 Eh    ::
         :: -> isotropic ES            0.014042882029 Eh    ::
         :: -> anisotropic ES          0.003181856806 Eh    ::
         :: -> anisotropic XC          0.022745805441 Eh    ::
         :: -> dispersion             -0.029092771538 Eh    ::
         :: repulsion energy           0.549933314054 Eh    ::
         :: add. restraining           0.000000000000 Eh    ::
         :::::::::::::::::::::::::::::::::::::::::::::::::::::

           -------------------------------------------------
          |                Property Printout                |
           -------------------------------------------------

    * Orbital Energies and Occupations

         #    Occupation            Energy/Eh            Energy/eV
      -------------------------------------------------------------
         1        2.0000           -0.7292238             -19.8432
       ...           ...                  ...                  ...
        24        2.0000           -0.4819266             -13.1139
        25        2.0000           -0.4742679             -12.9055
        26        2.0000           -0.4685232             -12.7492
        27        2.0000           -0.4620832             -12.5739
        28        2.0000           -0.4591666             -12.4946
        29        2.0000           -0.4584470             -12.4750
        30        2.0000           -0.4549759             -12.3805
        31        2.0000           -0.4406546             -11.9908
        32        2.0000           -0.4318168             -11.7503
        33        2.0000           -0.4122133             -11.2169
        34        2.0000           -0.3863613             -10.5134
        35        2.0000           -0.3786298             -10.3030
        36        2.0000           -0.3640978              -9.9076 (HOMO)
        37                         -0.2637632              -7.1774 (LUMO)
        38                         -0.2426257              -6.6022
        39                         -0.2137862              -5.8174
        40                         -0.2030037              -5.5240
        41                         -0.1978349              -5.3834
        42                         -0.1328271              -3.6144
        43                         -0.1172601              -3.1908
        44                         -0.1081765              -2.9436
        45                         -0.0166533              -0.4532
        46                         -0.0037347              -0.1016
        47                          0.0014474               0.0394
       ...                                ...                  ...
        77                          0.6939690              18.8839
      -------------------------------------------------------------
                  HL-Gap            0.1003346 Eh            2.7302 eV
             Fermi-level           -0.3139305 Eh           -8.5425 eV

     #   Z        covCN         q      C6AA      α(0)
     1   6 C      2.939    -0.018    28.451     8.748
     2   6 C      3.067    -0.051    29.193     8.860
     3   6 C      3.144    -0.025    28.368     8.715
     4   6 C      3.031     0.113    25.488     8.281
     5  16 S      2.252    -0.031   142.328    20.079
     6   7 N      1.907    -0.259    27.573     7.785
     7   6 C      3.002     0.129    25.167     8.229
     8   6 C      3.070    -0.026    28.571     8.764
     9   6 C      2.973     0.011    27.757     8.642
    10   6 C      3.805    -0.055    21.557     6.610
    11   6 C      3.754    -0.097    22.413     6.751
    12   6 C      3.864    -0.052    21.459     6.588
    13   6 C      3.803    -0.014    20.821     6.496
    14  16 S      2.130    -0.123   146.235    20.353
    15   1 H      0.926     0.051     2.306     2.374
    16   1 H      0.926     0.042     2.418     2.432
    17   1 H      0.924     0.037     2.487     2.466
    18   1 H      0.924     0.044     2.396     2.421
    19   1 H      0.925     0.036     2.506     2.476
    20   1 H      0.925     0.040     2.451     2.448
    21   1 H      0.925     0.041     2.435     2.440
    22   1 H      0.924     0.048     2.344     2.394
    23   1 H      0.924     0.051     2.307     2.375
    24   1 H      0.925     0.051     2.304     2.374
    25   1 H      0.925     0.056     2.252     2.347

 Mol. C6AA /au·bohr⁶  :      10280.150714
 Mol. C8AA /au·bohr⁸  :     300655.861683
 Mol. α(0) /au        :        161.448681


Wiberg/Mayer (AO) data.
largest (>0.10) Wiberg bond orders for each atom
          total WBO             WBO to atom ...
     1  C   3.938        C    2 1.674    S    5 1.154    H   15 0.970
     2  C   3.985        C    1 1.674    C    3 1.200    H   16 0.961
     3  C   3.985        C    4 1.279    C    9 1.278    C    2 1.200
     4  C   3.959        N    6 1.364    C    3 1.279    S    5 1.115
     5  S   2.560        C    1 1.154    C    4 1.115
     6  N   3.077        C    7 1.431    C    4 1.364
     7  C   3.964        N    6 1.431    C    8 1.275    S   14 1.071
     8  C   3.984        C    9 1.471    C    7 1.275    C   12 1.012
     9  C   3.987        C    8 1.471    C    3 1.278    C   10 1.012
    10  C   3.997        C    9 1.012    C   11 0.998    H   17 0.971    H   18 0.970
    11  C   3.994        C   10 0.998    H   19 0.988    H   21 0.987    H   20 0.986
    12  C   3.996        C    8 1.012    C   13 1.008    H   22 0.961    H   23 0.960
    13  C   3.977        C   12 1.008    S   14 0.985    H   24 0.978    H   25 0.978
    14  S   2.281        C    7 1.071    C   13 0.985
    15  H   0.997        C    1 0.970
    16  H   0.998        C    2 0.961
    17  H   0.998        C   10 0.971
    18  H   0.997        C   10 0.970
    19  H   0.999        C   11 0.988
    20  H   0.997        C   11 0.986
    21  H   0.998        C   11 0.987
    22  H   0.997        C   12 0.961
    23  H   0.996        C   12 0.960
    24  H   0.997        C   13 0.978
    25  H   0.996        C   13 0.978

molecular dipole:
                 x           y           z       tot (Debye)
 q only:       -0.280       1.422      -0.095
   full:       -0.341       2.159      -0.186       5.576
molecular quadrupole (traceless):
                xx          xy          yy          xz          yz          zz
 q only:        6.639      -2.579      -3.456       0.742       1.140      -3.184
  q+dip:        7.679      -3.193      -5.782       0.693       1.359      -1.897
   full:        7.123      -3.074      -6.620       1.055       1.544      -0.503

           -------------------------------------------------
          |                Geometry Summary                 |
           -------------------------------------------------

      molecular mass/u    :      221.3346000
   center of mass at/Å    :       -0.0602212       0.0640902       0.1608425
  moments of inertia/u·Å² :        0.5991333E+03   0.1085286E+04   0.1623498E+04
rotational constants/cm⁻¹ :        0.2813670E-01   0.1553289E-01   0.1038353E-01

 * 24 selected distances

     #   Z        #   Z                                     value/Å
     1   6 C      2   6 C                                 1.3502508
     2   6 C      3   6 C                                 1.4238808
     3   6 C      4   6 C                                 1.4092499
     1   6 C      5  16 S                                 1.7333706
     4   6 C      5  16 S                                 1.7357570
     4   6 C      6   7 N                                 1.3224933
     6   7 N      7   6 C                                 1.3112491
     7   6 C      8   6 C                                 1.4098319
     3   6 C      9   6 C                                 1.4102631
     8   6 C      9   6 C                                 1.3795142
    10   6 C     11   6 C                                 1.5302495
    12   6 C     13   6 C                                 1.5262335
     7   6 C     14  16 S                                 1.7471540 (max)
     1   6 C     15   1 H                                 1.0724554 (min)
     2   6 C     16   1 H                                 1.0750640
    10   6 C     17   1 H                                 1.0907534
    10   6 C     18   1 H                                 1.0913951
    11   6 C     19   1 H                                 1.0877325
    11   6 C     20   1 H                                 1.0873622
    11   6 C     21   1 H                                 1.0877053
    12   6 C     22   1 H                                 1.0910827
    12   6 C     23   1 H                                 1.0945757
    13   6 C     24   1 H                                 1.0907464
    13   6 C     25   1 H                                 1.0872203

 * 4 distinct bonds (by element types)

   Z      Z             #   av. dist./Å        max./Å        min./Å
   1 H    6 C          11     1.0869175     1.0945757     1.0724554
   6 C    6 C           8     1.4299342     1.5302495     1.3502508
   6 C    7 N           2     1.3168712     1.3224933     1.3112491
   6 C   16 S           3     1.7387605     1.7471540     1.7333706


optimized geometry written to: xtbopt.xyz


           -------------------------------------------------
          | TOTAL ENERGY              -38.601939223543 Eh   |
          | GRADIENT NORM               0.000413550305 Eh/α |
          | HOMO-LUMO GAP               2.730244307457 eV   |
           -------------------------------------------------

------------------------------------------------------------------------
 * finished run on 2021/05/19 at 10:58:14.176     
------------------------------------------------------------------------
 total:
 * wall-time:     0 d,  0 h,  0 min,  0.982 sec
 *  cpu-time:     0 d,  0 h,  0 min,  0.982 sec
 * ratio c/w:     1.000 speedup
 SCF:
 * wall-time:     0 d,  0 h,  0 min,  0.045 sec
 *  cpu-time:     0 d,  0 h,  0 min,  0.045 sec
 * ratio c/w:     1.000 speedup
 ANC optimizer:
 * wall-time:     0 d,  0 h,  0 min,  0.915 sec
 *  cpu-time:     0 d,  0 h,  0 min,  0.915 sec
 * ratio c/w:     1.000 speedup

