      -----------------------------------------------------------      
     |                   =====================                   |     
     |                           x T B                           |     
     |                   =====================                   |     
     |                         S. Grimme                         |     
     |          Mulliken Center for Theoretical Chemistry        |     
     |                    University of Bonn                     |     
     |                Version 6.2 RC2 (SAW190805)                |     
      -----------------------------------------------------------      

   This program is distributed in the hope that it will be useful,
   but WITHOUT ANY WARRANTY; without even the implied warranty of
   MERCHANTABILITY or FITNESS FOR A PARTICULAR PURPOSE.
   
   FOR NON-COMMERCIAL, ACADEMIA USE ONLY.
   
   Cite this work as:
   * S. Grimme, C. Bannwarth, P. Shushkov, J. Chem. Theory Comput., 2017,
     13, 1989-2009. DOI: 10.1021/acs.jctc.7b00118
   * C. Bannwarth, S. Ehlert and S. Grimme., J. Chem. Theory Comput., 2019,
     15, 1652-1671. DOI: 10.1021/acs.jctc.8b01176
   * P. Pracht, E. Caldeweyher, S. Ehlert, S. Grimme, ChemRxiv, 2019, preprint.
     DOI: 10.26434/chemrxiv.8326202.v1
   
   for DFT-D4:
   * E. Caldeweyher, C. Bannwarth and S. Grimme, J. Chem. Phys., 2017,
     147, 034112. DOI: 10.1063/1.4993215
   * E. Caldeweyher, S. Ehlert, A. Hansen, H. Neugebauer, S. Spicher,
     C. Bannwarth and S. Grimme, J. Chem. Phys., 2019, 150, 154122.
     DOI: 10.1063/1.5090222
   
   for sTDA-xTB:
   * S. Grimme and C. Bannwarth, J. Chem. Phys., 2016, 145, 054103.
     DOI: 10.1063/1.4959605
   
   in the mass-spec context:
   * V. Asgeirsson, C. Bauer and S. Grimme, Chem. Sci., 2017, 8, 4879.
     DOI: 10.1039/c7sc00601b
   
   for metadynamics refer to:
   * S. Grimme, J. Chem. Theory Comput., 2019, 155, 2847-2862
     DOI: 10.1021/acs.jctc.9b00143
   
   with help from (in alphabetical order)
   C. Bannwarth, F. Bohle, G. Brandenburg, E. Caldeweyher, M. Checinski,
   S. Dohm, S. Ehlert, S. Ehrlich, F. März, H. Neugebauer, J. Pisarek,
   P. Pracht, P. Shushkov, and S. Spicher.
   
 * started run on 2021/05/19 at 10:59:25.334     

           -------------------------------------------------
          |                Calculation Setup                |
           -------------------------------------------------

          program call               : /ihome/ghutchison/geoffh/xtb/xtb 183.xyz -opt
          hostname                   : smp-n83
          coordinate file            : 183.xyz
          omp threads                :                     1
          number of atoms            :                    24
          number of electrons        :                    68
          charge                     :                     0
          spin                       :                   0.0
          first test random number   :      0.24827459599047


########################################################################
# WARNING! Please study the warnings concerning your input carefully
#  - the use of '-opt' is discouraged, please use '--opt' next time
########################################################################

           ------------------------------------------------- 
          |                 G F N 2 - x T B                 |
          | Geometry, Frequencies, Noncovalent interactions |
          |            JCTC 2019 parametrisation            |
           ------------------------------------------------- 
             KAB for C  - Si     :                1.0500
             KAB for H  - Pd     :                0.9500
             k(s)              :                1.8500
             k(p)              :                2.2300
             k(d)              :                2.2300
             k(f)              :                2.0000
             kEN (H0ij)        :               -2.0000
             D4 a1             :                0.5200
             D4 a2             :                5.0000
             D4 s6             :                1.0000
             D4 s8             :                2.7000
             D4 s9             :                5.0000
             alphaj            :                2.0000

  Z AO/shell   Hii/eV     exponent
  1     Wed Apr 25 08:07:45 CEST 2018   EN: 2.200 GM2: 0.406  GM3: 0.0800  RAES: 1.40
     1s    -10.707211    1.230000
  6     Wed Apr 25 08:07:45 CEST 2018   EN: 2.550 GM2: 0.538  GM3: 0.1500  RAES: 3.00
     2s    -13.970922    2.096432
     2p    -10.063292    1.800000
  7     Wed Apr 25 08:07:45 CEST 2018   EN: 3.040 GM2: 0.461  GM3:-0.0640  RAES: 1.90
     2s    -16.686243    2.339881
     2p    -12.523956    2.014332
  8     Wed Apr 25 08:07:45 CEST 2018   EN: 3.440 GM2: 0.452  GM3:-0.0517  RAES: 1.80
     2s    -20.229985    2.439742
     2p    -15.503117    2.137023
 16     Tue Apr 24 11:44:34 CEST 2018   EN: 2.580 GM2: 0.340  GM3:-0.0502  RAES: 3.10
     3s    -20.029654    1.981333
     3p    -11.377694    2.025643
     3d     -0.420282    1.702555

           ------------------------------------------------- 
          |        Self-Consistent Charge Iterations        |
           ------------------------------------------------- 

          ...................................................
          :                      SETUP                      :
          :.................................................:
          :  # basis functions                  69          :
          :  # atomic orbitals                  68          :
          :  # shells                           38          :
          :  # electrons                        68          :
          :  max. iterations                   250          :
          :  Hamiltonian                  GFN2-xTB          :
          :  restarted?                      false          :
          :  GBSA solvation                  false          :
          :  PC potential                    false          :
          :  electronic temp.          300.0000000     K    :
          :  accuracy                    1.0000000          :
          :  -> integral cutoff          0.2500000E+02      :
          :  -> integral neglect         0.1000000E-07      :
          :  -> SCF convergence          0.1000000E-05 Eh   :
          :  -> wf. convergence          0.1000000E-03 e    :
          :  Broyden damping             0.4000000          :
          ...................................................

 iter      E             dE          RMSdq      gap      omega  full diag
   1    -37.5769603 -0.375770E+02  0.469E+00    3.81       0.0  T
   2    -37.5770357 -0.754083E-04  0.303E+00    3.79       1.0  T
   3    -37.4628704  0.114165E+00  0.284E+00    3.87       1.0  T
   4    -37.6213291 -0.158459E+00  0.763E-01    3.81       1.0  T
   5    -37.6284964 -0.716729E-02  0.260E-01    3.81       1.0  T
   6    -37.6292416 -0.745285E-03  0.129E-01    3.82       1.0  T
   7    -37.6294200 -0.178402E-03  0.338E-02    3.82       1.0  T
   8    -37.6294247 -0.462509E-05  0.177E-02    3.82       1.2  T
   9    -37.6294266 -0.194996E-05  0.851E-03    3.82       2.4  T
  10    -37.6294276 -0.959621E-06  0.235E-03    3.82       8.7  T
  11    -37.6294276 -0.223422E-07  0.702E-04    3.82      29.1  T
  12    -37.6294276 -0.356369E-08  0.269E-04    3.82      75.8  T

   *** convergence criteria satisfied after 12 iterations ***

         #    Occupation            Energy/Eh            Energy/eV
      -------------------------------------------------------------
         1        2.0000           -0.7425838             -20.2067
       ...           ...                  ...                  ...
        28        2.0000           -0.4525576             -12.3147
        29        2.0000           -0.4451119             -12.1121
        30        2.0000           -0.4410923             -12.0027
        31        2.0000           -0.4306646             -11.7190
        32        2.0000           -0.4100628             -11.1584
        33        2.0000           -0.4038356             -10.9889
        34        2.0000           -0.3993865             -10.8679 (HOMO)
        35                         -0.2588362              -7.0433 (LUMO)
        36                         -0.2516293              -6.8472
        37                         -0.2494016              -6.7866
        38                         -0.2096515              -5.7049
        39                         -0.1948255              -5.3015
       ...                                ...                  ...
        68                          0.6510056              17.7148
      -------------------------------------------------------------
                  HL-Gap            0.1405502 Eh            3.8246 eV
             Fermi-level           -0.3291113 Eh           -8.9556 eV

 SCC (total)                   0 d,  0 h,  0 min,  0.039 sec
 SCC setup                      ...        0 min,  0.000 sec (  0.841%)
 Dispersion                     ...        0 min,  0.000 sec (  0.910%)
 integral evaluation            ...        0 min,  0.009 sec ( 23.785%)
 zeroth order Hamiltonian       ...        0 min,  0.000 sec (  0.500%)
 iterations                     ...        0 min,  0.014 sec ( 37.252%)
 molecular gradient             ...        0 min,  0.014 sec ( 35.525%)
 printout                       ...        0 min,  0.000 sec (  1.042%)

         :::::::::::::::::::::::::::::::::::::::::::::::::::::
         ::                     SUMMARY                     ::
         :::::::::::::::::::::::::::::::::::::::::::::::::::::
         :: total energy             -37.182898552695 Eh    ::
         :: gradient norm              0.264970214182 Eh/a0 ::
         :: HOMO-LUMO gap              3.824566947423 eV    ::
         ::.................................................::
         :: SCC energy               -37.629427602631 Eh    ::
         :: -> isotropic ES            0.027634502623 Eh    ::
         :: -> anisotropic ES          0.004553887960 Eh    ::
         :: -> anisotropic XC          0.027345685821 Eh    ::
         :: -> dispersion             -0.024491095971 Eh    ::
         :: repulsion energy           0.446272915763 Eh    ::
         :: add. restraining           0.000000000000 Eh    ::
         :::::::::::::::::::::::::::::::::::::::::::::::::::::

      ----------------------------------------------------------- 
     |                   =====================                   |
     |                        A N C O P T                        |
     |                   =====================                   |
     |               Approximate Normal Coordinate               |
     |                Rational Function Optimizer                |
      ----------------------------------------------------------- 

          ...................................................
          :                      SETUP                      :
          :.................................................:
          :   optimization level            normal          :
          :   max. optcycles                   200          :
          :   ANC micro-cycles                  20          :
          :   degrees of freedom                66          :
          :.................................................:
          :   RF solver                   davidson          :
          :   input Hessian                  false          :
          :   write xtbopt.log                true          :
          :   linear?                        false          :
          :   energy convergence         0.5000000E-05 Eh   :
          :   grad. convergence          0.1000000E-02 Eh/α :
          :   maximium RF displ.         2.0000000          :
          :   Hlow (freq-cutoff)         0.5000000E-02      :
          :   Hmax (freq-cutoff)         5.0000000          :
          :   S6 in model hess.         20.0000000          :
          ...................................................

generating ANC from model Hessian ...
Using Lindh-Hessian (1995)
 Shifting diagonal of input Hessian by   3.912568429655605E-003
 Lowest  eigenvalues of input Hessian
   -0.000000   -0.000000   -0.000000   -0.000000   -0.000000    0.000000
    0.005000    0.005855    0.007310    0.008148    0.009529    0.010334
    0.014524    0.018464    0.023118    0.023372    0.024894    0.029222
 Highest eigenvalues
    1.486379    1.494299    1.623952    1.736921    1.800464    1.959462
 

........................................................................
.............................. CYCLE    1 ..............................
........................................................................
   1    -37.6294276 -0.376294E+02  0.942E-05    3.82       0.0  T
   2    -37.6294276  0.801776E-10  0.904E-05    3.82     225.8  T
   3    -37.6294276 -0.141227E-09  0.502E-05    3.82     406.8  T
     SCC iter.                  ...        0 min,  0.004 sec
     gradient                   ...        0 min,  0.014 sec
 * total energy  :   -37.1828985 Eh     change        0.2940401E-07 Eh
   gradient norm :     0.2649718 Eh/α   predicted     0.0000000E+00 (-100.00%)
   displ. norm   :     0.3041994 α      lambda       -0.5366859E-01
   maximum displ.:     0.1137861 α      in ANC's #66, #29, #31, ...

........................................................................
.............................. CYCLE    2 ..............................
........................................................................
   1    -37.7379019 -0.377379E+02  0.451E-01    3.89       0.0  T
   2    -37.7381313 -0.229320E-03  0.264E-01    3.89       1.0  T
   3    -37.7377755  0.355757E-03  0.198E-01    3.89       1.0  T
   4    -37.7383298 -0.554316E-03  0.325E-02    3.90       1.0  T
   5    -37.7383465 -0.166784E-04  0.114E-02    3.89       1.8  T
   6    -37.7383472 -0.679492E-06  0.494E-03    3.89       4.1  T
   7    -37.7383475 -0.291393E-06  0.253E-03    3.89       8.1  T
     SCC iter.                  ...        0 min,  0.008 sec
     gradient                   ...        0 min,  0.013 sec
 * total energy  :   -37.2139010 Eh     change       -0.3100243E-01 Eh
   gradient norm :     0.0401909 Eh/α   predicted    -0.2931747E-01 (  -5.43%)
   displ. norm   :     0.2430360 α      lambda       -0.3101109E-02
   maximum displ.:     0.1134368 α      in ANC's #6, #15, #5, ...

........................................................................
.............................. CYCLE    3 ..............................
........................................................................
   1    -37.7490829 -0.377491E+02  0.167E-01    3.91       0.0  T
   2    -37.7490975 -0.146221E-04  0.108E-01    3.92       1.0  T
   3    -37.7490908  0.671679E-05  0.695E-02    3.91       1.0  T
   4    -37.7491643 -0.734964E-04  0.166E-02    3.91       1.2  T
   5    -37.7491658 -0.153292E-05  0.621E-03    3.91       3.3  T
   6    -37.7491660 -0.237327E-06  0.224E-03    3.91       9.1  T
   7    -37.7491661 -0.938583E-07  0.561E-04    3.91      36.4  T
     SCC iter.                  ...        0 min,  0.008 sec
     gradient                   ...        0 min,  0.013 sec
 * total energy  :   -37.2158447 Eh     change       -0.1943726E-02 Eh
   gradient norm :     0.0113379 Eh/α   predicted    -0.1642145E-02 ( -15.52%)
   displ. norm   :     0.2600880 α      lambda       -0.8115654E-03
   maximum displ.:     0.1246029 α      in ANC's #1, #6, #2, ...

........................................................................
.............................. CYCLE    4 ..............................
........................................................................
   1    -37.7507419 -0.377507E+02  0.326E-01    3.91       0.0  T
   2    -37.7507707 -0.287653E-04  0.181E-01    3.91       1.0  T
   3    -37.7506869  0.837511E-04  0.668E-02    3.91       1.0  T
   4    -37.7507895 -0.102571E-03  0.104E-02    3.91       2.0  T
   5    -37.7507904 -0.930171E-06  0.380E-03    3.91       5.4  T
   6    -37.7507905 -0.434049E-07  0.137E-03    3.91      14.9  T
   7    -37.7507905 -0.546338E-08  0.556E-04    3.91      36.7  T
     SCC iter.                  ...        0 min,  0.008 sec
     gradient                   ...        0 min,  0.013 sec
 * total energy  :   -37.2159749 Eh     change       -0.1302015E-03 Eh
   gradient norm :     0.0196450 Eh/α   predicted    -0.4332327E-03 ( 232.74%)
   displ. norm   :     0.2057967 α      lambda       -0.1059077E-02
   maximum displ.:     0.1354573 α      in ANC's #8, #5, #9, ...

........................................................................
.............................. CYCLE    5 ..............................
........................................................................
   1    -37.7573278 -0.377573E+02  0.201E-01    3.91       0.0  T
   2    -37.7573375 -0.970158E-05  0.114E-01    3.91       1.0  T
   3    -37.7572930  0.444198E-04  0.486E-02    3.91       1.0  T
   4    -37.7573457 -0.526368E-04  0.803E-03    3.91       2.5  T
   5    -37.7573459 -0.229340E-06  0.346E-03    3.91       5.9  T
   6    -37.7573459 -0.293039E-07  0.157E-03    3.91      13.0  T
   7    -37.7573460 -0.269687E-07  0.600E-04    3.91      34.0  T
     SCC iter.                  ...        0 min,  0.008 sec
     gradient                   ...        0 min,  0.013 sec
 * total energy  :   -37.2163345 Eh     change       -0.3595704E-03 Eh
   gradient norm :     0.0102785 Eh/α   predicted    -0.5519657E-03 (  53.51%)
   displ. norm   :     0.0906338 α      lambda       -0.3526481E-03
   maximum displ.:     0.0443295 α      in ANC's #1, #5, #6, ...

........................................................................
.............................. CYCLE    6 ..............................
........................................................................
   1    -37.7520278 -0.377520E+02  0.102E-01    3.90       0.0  T
   2    -37.7520300 -0.220533E-05  0.564E-02    3.90       1.0  T
   3    -37.7520048  0.252086E-04  0.415E-02    3.91       1.0  T
   4    -37.7520394 -0.346681E-04  0.592E-03    3.91       3.4  T
   5    -37.7520395 -0.490810E-07  0.232E-03    3.91       8.8  T
   6    -37.7520395 -0.611838E-07  0.854E-04    3.91      23.9  T
     SCC iter.                  ...        0 min,  0.007 sec
     gradient                   ...        0 min,  0.013 sec
 * total energy  :   -37.2165620 Eh     change       -0.2275385E-03 Eh
   gradient norm :     0.0040018 Eh/α   predicted    -0.1777733E-03 ( -21.87%)
   displ. norm   :     0.1782645 α      lambda       -0.2057962E-03
   maximum displ.:     0.0926449 α      in ANC's #1, #5, #2, ...

........................................................................
.............................. CYCLE    7 ..............................
........................................................................
   1    -37.7498984 -0.377499E+02  0.158E-01    3.90       0.0  T
   2    -37.7499035 -0.517372E-05  0.877E-02    3.90       1.0  T
   3    -37.7498872  0.163959E-04  0.300E-02    3.90       1.0  T
   4    -37.7499073 -0.201297E-04  0.671E-03    3.90       3.0  T
   5    -37.7499073  0.208171E-08  0.293E-03    3.90       7.0  T
   6    -37.7499074 -0.145063E-06  0.931E-04    3.90      21.9  T
     SCC iter.                  ...        0 min,  0.007 sec
     gradient                   ...        0 min,  0.013 sec
 * total energy  :   -37.2167048 Eh     change       -0.1428262E-03 Eh
   gradient norm :     0.0058508 Eh/α   predicted    -0.1061705E-03 ( -25.66%)
   displ. norm   :     0.1977900 α      lambda       -0.1341418E-03
   maximum displ.:     0.1008605 α      in ANC's #5, #1, #2, ...

........................................................................
.............................. CYCLE    8 ..............................
........................................................................
   1    -37.7499524 -0.377500E+02  0.147E-01    3.90       0.0  T
   2    -37.7499570 -0.463992E-05  0.810E-02    3.90       1.0  T
   3    -37.7499542  0.283186E-05  0.171E-02    3.90       1.2  T
   4    -37.7499585 -0.425706E-05  0.829E-03    3.90       2.5  T
   5    -37.7499590 -0.492244E-06  0.242E-03    3.90       8.4  T
   6    -37.7499591 -0.910965E-07  0.928E-04    3.90      22.0  T
     SCC iter.                  ...        0 min,  0.007 sec
     gradient                   ...        0 min,  0.013 sec
 * total energy  :   -37.2168009 Eh     change       -0.9607739E-04 Eh
   gradient norm :     0.0043725 Eh/α   predicted    -0.6969916E-04 ( -27.46%)
   displ. norm   :     0.1835584 α      lambda       -0.9943406E-04
   maximum displ.:     0.1004652 α      in ANC's #1, #5, #2, ...

........................................................................
.............................. CYCLE    9 ..............................
........................................................................
   1    -37.7515818 -0.377516E+02  0.125E-01    3.90       0.0  T
   2    -37.7515850 -0.318650E-05  0.686E-02    3.90       1.0  T
   3    -37.7515854 -0.368225E-06  0.998E-03    3.90       2.0  T
   4    -37.7515856 -0.249035E-06  0.630E-03    3.90       3.2  T
   5    -37.7515861 -0.464260E-06  0.128E-03    3.90      16.0  T
   6    -37.7515861 -0.144756E-07  0.705E-04    3.90      28.9  T
     SCC iter.                  ...        0 min,  0.007 sec
     gradient                   ...        0 min,  0.013 sec
 * total energy  :   -37.2168712 Eh     change       -0.7031576E-04 Eh
   gradient norm :     0.0020971 Eh/α   predicted    -0.5139350E-04 ( -26.91%)
   displ. norm   :     0.1729710 α      lambda       -0.6833596E-04
   maximum displ.:     0.1090108 α      in ANC's #1, #2, #5, ...

........................................................................
.............................. CYCLE   10 ..............................
........................................................................
   1    -37.7526368 -0.377526E+02  0.125E-01    3.90       0.0  T
   2    -37.7526403 -0.348099E-05  0.677E-02    3.90       1.0  T
   3    -37.7526394  0.874124E-06  0.129E-02    3.90       1.6  T
   4    -37.7526410 -0.159808E-05  0.741E-03    3.90       2.8  T
   5    -37.7526415 -0.537183E-06  0.125E-03    3.90      16.3  T
   6    -37.7526416 -0.192993E-07  0.706E-04    3.90      28.9  T
   7    -37.7526416 -0.346414E-08  0.310E-04    3.90      65.8  T
     SCC iter.                  ...        0 min,  0.008 sec
     gradient                   ...        0 min,  0.014 sec
 * total energy  :   -37.2169206 Eh     change       -0.4937045E-04 Eh
   gradient norm :     0.0019729 Eh/α   predicted    -0.3519362E-04 ( -28.72%)
   displ. norm   :     0.2614309 α      lambda       -0.6081206E-04
   maximum displ.:     0.1667281 α      in ANC's #1, #3, #6, ...

........................................................................
.............................. CYCLE   11 ..............................
........................................................................
   1    -37.7545287 -0.377545E+02  0.162E-01    3.90       0.0  T
   2    -37.7545340 -0.529559E-05  0.887E-02    3.90       1.0  T
   3    -37.7545329  0.111266E-05  0.161E-02    3.90       1.3  T
   4    -37.7545350 -0.204925E-05  0.934E-03    3.90       2.2  T
   5    -37.7545358 -0.884851E-06  0.183E-03    3.90      11.1  T
   6    -37.7545359 -0.431044E-07  0.964E-04    3.90      21.2  T
   7    -37.7545359 -0.826028E-08  0.499E-04    3.90      40.9  T
     SCC iter.                  ...        0 min,  0.008 sec
     gradient                   ...        0 min,  0.014 sec
 * total energy  :   -37.2169679 Eh     change       -0.4731037E-04 Eh
   gradient norm :     0.0041524 Eh/α   predicted    -0.3133523E-04 ( -33.77%)
   displ. norm   :     0.1180944 α      lambda       -0.3600821E-04
   maximum displ.:     0.0946808 α      in ANC's #1, #3, #6, ...

........................................................................
.............................. CYCLE   12 ..............................
........................................................................
   1    -37.7524643 -0.377525E+02  0.866E-02    3.90       0.0  T
   2    -37.7524659 -0.158583E-05  0.476E-02    3.90       1.0  T
   3    -37.7524659 -0.641059E-07  0.686E-03    3.90       3.0  T
   4    -37.7524663 -0.380423E-06  0.384E-03    3.90       5.3  T
   5    -37.7524665 -0.164462E-06  0.784E-04    3.90      26.0  T
   6    -37.7524665 -0.325981E-08  0.473E-04    3.90      43.2  T
     SCC iter.                  ...        0 min,  0.007 sec
     gradient                   ...        0 min,  0.013 sec
 * total energy  :   -37.2169833 Eh     change       -0.1537747E-04 Eh
   gradient norm :     0.0047949 Eh/α   predicted    -0.1825750E-04 (  18.73%)
   displ. norm   :     0.0734087 α      lambda       -0.3101212E-04
   maximum displ.:     0.0434776 α      in ANC's #5, #2, #3, ...

........................................................................
.............................. CYCLE   13 ..............................
........................................................................
   1    -37.7530990 -0.377531E+02  0.461E-02    3.90       0.0  T
   2    -37.7530995 -0.463156E-06  0.253E-02    3.90       1.0  T
   3    -37.7530993  0.181043E-06  0.552E-03    3.90       3.7  T
   4    -37.7530995 -0.202047E-06  0.340E-03    3.90       6.0  T
   5    -37.7530996 -0.132353E-06  0.654E-04    3.90      31.2  T
   6    -37.7530996 -0.506883E-08  0.304E-04    3.90      67.1  T
     SCC iter.                  ...        0 min,  0.007 sec
     gradient                   ...        0 min,  0.013 sec
 * total energy  :   -37.2170032 Eh     change       -0.1994531E-04 Eh
   gradient norm :     0.0018790 Eh/α   predicted    -0.1559256E-04 ( -21.82%)
   displ. norm   :     0.1011476 α      lambda       -0.1624427E-04
   maximum displ.:     0.0588251 α      in ANC's #1, #3, #2, ...

........................................................................
.............................. CYCLE   14 ..............................
........................................................................
   1    -37.7524923 -0.377525E+02  0.594E-02    3.90       0.0  T
   2    -37.7524931 -0.755114E-06  0.326E-02    3.90       1.0  T
   3    -37.7524910  0.207168E-05  0.118E-02    3.90       1.7  T
   4    -37.7524934 -0.243000E-05  0.436E-03    3.90       4.7  T
   5    -37.7524935 -0.891915E-07  0.829E-04    3.90      24.6  T
   6    -37.7524935 -0.108187E-07  0.315E-04    3.90      64.7  T
     SCC iter.                  ...        0 min,  0.007 sec
     gradient                   ...        0 min,  0.014 sec
 * total energy  :   -37.2170140 Eh     change       -0.1078634E-04 Eh
   gradient norm :     0.0016645 Eh/α   predicted    -0.8161574E-05 ( -24.33%)
   displ. norm   :     0.0424398 α      lambda       -0.6873408E-05
   maximum displ.:     0.0313789 α      in ANC's #1, #2, #4, ...

........................................................................
.............................. CYCLE   15 ..............................
........................................................................
   1    -37.7525723 -0.377526E+02  0.320E-02    3.90       0.0  T
   2    -37.7525726 -0.262709E-06  0.173E-02    3.90       1.2  T
   3    -37.7525722  0.359247E-06  0.511E-03    3.90       4.0  T
   4    -37.7525727 -0.448105E-06  0.218E-03    3.90       9.4  T
   5    -37.7525727 -0.320136E-07  0.463E-04    3.90      44.1  T
   6    -37.7525727 -0.220641E-08  0.197E-04    3.90     103.7  T
     SCC iter.                  ...        0 min,  0.007 sec
     gradient                   ...        0 min,  0.014 sec
 * total energy  :   -37.2170211 Eh     change       -0.7092546E-05 Eh
   gradient norm :     0.0007691 Eh/α   predicted    -0.3443992E-05 ( -51.44%)
   displ. norm   :     0.0687949 α      lambda       -0.7190021E-05
   maximum displ.:     0.0511009 α      in ANC's #1, #2, #4, ...

........................................................................
.............................. CYCLE   16 ..............................
........................................................................
   1    -37.7527901 -0.377528E+02  0.435E-02    3.90       0.0  T
   2    -37.7527905 -0.356458E-06  0.241E-02    3.90       1.0  T
   3    -37.7527904  0.664175E-07  0.422E-03    3.90       4.8  T
   4    -37.7527905 -0.152177E-06  0.222E-03    3.90       9.2  T
   5    -37.7527906 -0.412255E-07  0.419E-04    3.90      48.7  T
   6    -37.7527906 -0.194466E-08  0.184E-04    3.90     110.8  T
     SCC iter.                  ...        0 min,  0.007 sec
     gradient                   ...        0 min,  0.014 sec
 * total energy  :   -37.2170273 Eh     change       -0.6204475E-05 Eh
   gradient norm :     0.0009541 Eh/α   predicted    -0.3607489E-05 ( -41.86%)
   displ. norm   :     0.0559936 α      lambda       -0.2444056E-05
   maximum displ.:     0.0415804 α      in ANC's #1, #2, #3, ...

........................................................................
.............................. CYCLE   17 ..............................
........................................................................
   1    -37.7528290 -0.377528E+02  0.342E-02    3.90       0.0  T
   2    -37.7528292 -0.201878E-06  0.193E-02    3.90       1.1  T
   3    -37.7528292  0.613179E-07  0.340E-03    3.90       6.0  T
   4    -37.7528293 -0.118150E-06  0.179E-03    3.90      11.4  T
   5    -37.7528293 -0.217530E-07  0.430E-04    3.90      47.4  T
   6    -37.7528293 -0.292694E-08  0.194E-04    3.90     105.3  T
     SCC iter.                  ...        0 min,  0.007 sec
     gradient                   ...        0 min,  0.014 sec
 * total energy  :   -37.2170296 Eh     change       -0.2268897E-05 Eh
   gradient norm :     0.0006719 Eh/α   predicted    -0.1225944E-05 ( -45.97%)
   displ. norm   :     0.0265469 α      lambda       -0.9908530E-06
   maximum displ.:     0.0187387 α      in ANC's #2, #1, #5, ...

   *** GEOMETRY OPTIMIZATION CONVERGED AFTER 17 ITERATIONS ***

------------------------------------------------------------------------
 total energy gain   :        -0.0341310 Eh      -21.4175 kcal/mol
 total RMSD          :         0.3346170 a0        0.1771 Å
 total power (kW/mol):        -5.2712337 (step) -169.3304 (real)
------------------------------------------------------------------------

 ANCopt (total)                0 d,  0 h,  0 min,  0.529 sec
 optimizer setup                ...        0 min,  0.000 sec (  0.031%)
 model hessian                  ...        0 min,  0.009 sec (  1.620%)
 ANC generation                 ...        0 min,  0.001 sec (  0.138%)
 coordinate transformation      ...        0 min,  0.000 sec (  0.061%)
 single point calculation       ...        0 min,  0.514 sec ( 97.029%)
 optimization log               ...        0 min,  0.002 sec (  0.323%)
 hessian update                 ...        0 min,  0.000 sec (  0.042%)
 rational function              ...        0 min,  0.003 sec (  0.552%)

================
 final structure:
================
$coord
    3.01537522148150    1.94921331218902   -0.31901215684424      C 
    5.24404864558252   -0.41076503892380   -0.28278748752991      S 
    2.92475012198089   -2.66746139405248    0.01890182861196      C 
    0.56602487666245   -1.64950610751999    0.08525781848086      C 
    0.62488779344612    1.03213558234233   -0.11677988795835      C 
   -1.72470019129648    2.62569642247646    0.05295693557809      C 
   -1.75784748626207    3.76324606232737    2.54165696154238      C 
   -1.76449817164866    4.62487145593641    4.52278313887463      N 
   -4.10823219394813    1.01691186701174   -0.33355125492580      C 
   -3.96723552783058   -1.39398358797256    1.24212903495083      C 
   -1.87209788589519   -3.10590306258005    0.22104786420486      C 
   -2.67300383890293   -3.93576227810200   -2.20655100209612      O 
   -1.20629482684740   -5.86692509831817   -3.27218268508759      C 
    3.60625307862647    3.88108741017583   -0.47305311111310      H 
    3.45630206696752   -4.61721216524890    0.16275245237450      H 
   -1.65518267291526    4.16303314712635   -1.33560265809107      H 
   -4.25831489809662    0.49166470595975   -2.32143596609724      H 
   -5.77412173782351    2.11577496887998    0.18928483176665      H 
   -5.75596219358959   -2.40844174539147    1.12413058364384      H 
   -3.58369276423732   -0.94108248578350    3.21817013172423      H 
   -1.62258284086173   -4.76788854371013    1.45605933889295      H 
   -2.16721122705430   -6.42687181747653   -5.00271334583275      H 
   -1.07350151660792   -7.49787066254861   -1.99837491631114      H 
    0.70664842773444   -5.21860203360431   -3.73258978040184      H 
$end
           -------------------------------------------------
          |                Final Singlepoint                |
           -------------------------------------------------

          ...................................................
          :                      SETUP                      :
          :.................................................:
          :  # basis functions                  69          :
          :  # atomic orbitals                  68          :
          :  # shells                           38          :
          :  # electrons                        68          :
          :  max. iterations                   250          :
          :  Hamiltonian                  GFN2-xTB          :
          :  restarted?                      false          :
          :  GBSA solvation                  false          :
          :  PC potential                    false          :
          :  electronic temp.          300.0000000     K    :
          :  accuracy                    1.0000000          :
          :  -> integral cutoff          0.2500000E+02      :
          :  -> integral neglect         0.1000000E-07      :
          :  -> SCF convergence          0.1000000E-05 Eh   :
          :  -> wf. convergence          0.1000000E-03 e    :
          :  Broyden damping             0.4000000          :
          ...................................................

 iter      E             dE          RMSdq      gap      omega  full diag
   1    -37.7528293 -0.377528E+02  0.754E-05    3.90       0.0  T
   2    -37.7528293 -0.118234E-10  0.396E-05    3.90     515.7  T
   3    -37.7528293 -0.197105E-10  0.322E-05    3.90     633.4  T

   *** convergence criteria satisfied after 3 iterations ***

         #    Occupation            Energy/Eh            Energy/eV
      -------------------------------------------------------------
         1        2.0000           -0.7407762             -20.1575
       ...           ...                  ...                  ...
        28        2.0000           -0.4573743             -12.4458
        29        2.0000           -0.4467985             -12.1580
        30        2.0000           -0.4424387             -12.0394
        31        2.0000           -0.4283818             -11.6569
        32        2.0000           -0.4090649             -11.1312
        33        2.0000           -0.4040625             -10.9951
        34        2.0000           -0.3994186             -10.8687 (HOMO)
        35                         -0.2559993              -6.9661 (LUMO)
        36                         -0.2160192              -5.8782
        37                         -0.2094922              -5.7006
        38                         -0.2062073              -5.6112
        39                         -0.1785208              -4.8578
       ...                                ...                  ...
        68                          1.1368827              30.9362
      -------------------------------------------------------------
                  HL-Gap            0.1434193 Eh            3.9026 eV
             Fermi-level           -0.3277090 Eh           -8.9174 eV

 SCC (total)                   0 d,  0 h,  0 min,  0.028 sec
 SCC setup                      ...        0 min,  0.000 sec (  0.746%)
 Dispersion                     ...        0 min,  0.000 sec (  0.711%)
 integral evaluation            ...        0 min,  0.009 sec ( 32.007%)
 zeroth order Hamiltonian       ...        0 min,  0.000 sec (  0.594%)
 iterations                     ...        0 min,  0.004 sec ( 14.859%)
 molecular gradient             ...        0 min,  0.014 sec ( 49.673%)
 printout                       ...        0 min,  0.000 sec (  1.228%)

         :::::::::::::::::::::::::::::::::::::::::::::::::::::
         ::                     SUMMARY                     ::
         :::::::::::::::::::::::::::::::::::::::::::::::::::::
         :: total energy             -37.217029584743 Eh    ::
         :: gradient norm              0.000670068664 Eh/a0 ::
         :: HOMO-LUMO gap              3.902636699612 eV    ::
         ::.................................................::
         :: SCC energy               -37.752829318785 Eh    ::
         :: -> isotropic ES            0.027246180295 Eh    ::
         :: -> anisotropic ES          0.003103105704 Eh    ::
         :: -> anisotropic XC          0.025368933265 Eh    ::
         :: -> dispersion             -0.025239526607 Eh    ::
         :: repulsion energy           0.535537416704 Eh    ::
         :: add. restraining           0.000000000000 Eh    ::
         :::::::::::::::::::::::::::::::::::::::::::::::::::::

           -------------------------------------------------
          |                Property Printout                |
           -------------------------------------------------

    * Orbital Energies and Occupations

         #    Occupation            Energy/Eh            Energy/eV
      -------------------------------------------------------------
         1        2.0000           -0.7407762             -20.1575
       ...           ...                  ...                  ...
        22        2.0000           -0.4890310             -13.3072
        23        2.0000           -0.4840880             -13.1727
        24        2.0000           -0.4798596             -13.0576
        25        2.0000           -0.4756244             -12.9424
        26        2.0000           -0.4725744             -12.8594
        27        2.0000           -0.4578049             -12.4575
        28        2.0000           -0.4573743             -12.4458
        29        2.0000           -0.4467985             -12.1580
        30        2.0000           -0.4424387             -12.0394
        31        2.0000           -0.4283818             -11.6569
        32        2.0000           -0.4090649             -11.1312
        33        2.0000           -0.4040625             -10.9951
        34        2.0000           -0.3994186             -10.8687 (HOMO)
        35                         -0.2559993              -6.9661 (LUMO)
        36                         -0.2160192              -5.8782
        37                         -0.2094922              -5.7006
        38                         -0.2062073              -5.6112
        39                         -0.1785208              -4.8578
        40                         -0.1236090              -3.3636
        41                         -0.0104804              -0.2852
        42                          0.0187397               0.5099
        43                          0.0218710               0.5951
        44                          0.0314989               0.8571
        45                          0.0711007               1.9347
       ...                                ...                  ...
        68                          1.1368827              30.9362
      -------------------------------------------------------------
                  HL-Gap            0.1434193 Eh            3.9026 eV
             Fermi-level           -0.3277090 Eh           -8.9174 eV

     #   Z        covCN         q      C6AA      α(0)
     1   6 C      2.939    -0.032    28.796     8.801
     2  16 S      2.297    -0.013   141.574    20.026
     3   6 C      2.943    -0.030    28.758     8.795
     4   6 C      3.162    -0.021    28.184     8.678
     5   6 C      3.192    -0.000    27.525     8.556
     6   6 C      3.860    -0.007    20.655     6.463
     7   6 C      1.921     0.116    28.248     8.583
     8   7 N      0.911    -0.238    26.227     7.407
     9   6 C      3.814    -0.050    21.451     6.592
    10   6 C      3.808    -0.059    21.623     6.619
    11   6 C      3.751     0.120    18.675     6.163
    12   8 O      1.701    -0.316    19.271     5.927
    13   6 C      3.644     0.043    20.183     6.458
    14   1 H      0.926     0.046     2.373     2.409
    15   1 H      0.926     0.045     2.379     2.412
    16   1 H      0.924     0.064     2.156     2.296
    17   1 H      0.924     0.062     2.173     2.305
    18   1 H      0.924     0.042     2.422     2.434
    19   1 H      0.925     0.054     2.274     2.358
    20   1 H      0.924     0.044     2.397     2.421
    21   1 H      0.923     0.015     2.810     2.621
    22   1 H      0.925     0.059     2.213     2.326
    23   1 H      0.924     0.026     2.650     2.546
    24   1 H      0.924     0.029     2.601     2.522

 Mol. C6AA /au·bohr⁶  :       7654.713686
 Mol. C8AA /au·bohr⁸  :     202543.789292
 Mol. α(0) /au        :        135.720217


Wiberg/Mayer (AO) data.
largest (>0.10) Wiberg bond orders for each atom
          total WBO             WBO to atom ...
     1  C   3.948        C    5 1.604    S    2 1.193    H   14 0.971    C    3 0.114
     2  S   2.642        C    3 1.193    C    1 1.193
     3  C   3.949        C    4 1.604    S    2 1.193    H   15 0.970    C    1 0.114
     4  C   3.984        C    3 1.604    C    5 1.223    C   11 0.981
     5  C   3.983        C    1 1.604    C    4 1.223    C    6 0.967
     6  C   3.996        C    7 1.023    C    5 0.967    C    9 0.967    H   16 0.932
     7  C   3.942        N    8 2.848    C    6 1.023
     8  N   3.011        C    7 2.848
     9  C   3.994        C   10 1.011    H   18 0.976    H   17 0.972    C    6 0.967
    10  C   3.996        C    9 1.011    C   11 0.989    H   20 0.975    H   19 0.973
    11  C   3.956        C   10 0.989    C    4 0.981    O   12 0.960    H   21 0.955
    12  O   2.080        C   13 0.999    C   11 0.960
    13  C   3.954        O   12 0.999    H   22 0.978    H   23 0.976    H   24 0.975
    14  H   0.998        C    1 0.971
    15  H   0.997        C    3 0.970
    16  H   0.996        C    6 0.932
    17  H   0.996        C    9 0.972
    18  H   0.997        C    9 0.976
    19  H   0.996        C   10 0.973
    20  H   0.998        C   10 0.975
    21  H   0.999        C   11 0.955
    22  H   0.996        C   13 0.978
    23  H   0.999        C   13 0.976
    24  H   0.999        C   13 0.975

molecular dipole:
                 x           y           z       tot (Debye)
 q only:        0.051      -0.591      -0.713
   full:       -0.019      -0.840      -1.031       3.379
molecular quadrupole (traceless):
                xx          xy          yy          xz          yz          zz
 q only:        1.852      -0.548       2.306       0.443      -5.701      -4.158
  q+dip:        0.091       0.258       5.919       1.357     -10.253      -6.010
   full:        0.330      -0.060       6.172       1.371     -10.560      -6.502

           -------------------------------------------------
          |                Geometry Summary                 |
           -------------------------------------------------

      molecular mass/u    :      193.2630000
   center of mass at/Å    :       -0.0212713      -0.2309879       0.0318822
  moments of inertia/u·Å² :        0.6014768E+03   0.6682341E+03   0.1140238E+04
rotational constants/cm⁻¹ :        0.2802707E-01   0.2522714E-01   0.1478432E-01

 * 22 selected distances

     #   Z        #   Z                                     value/Å
     1   6 C      2  16 S                                 1.7178137
     2  16 S      3   6 C                                 1.7198538 (max)
     3   6 C      4   6 C                                 1.3599156
     1   6 C      5   6 C                                 1.3591060
     4   6 C      5   6 C                                 1.4234265
     7   6 C      8   7 N                                 1.1432315
     6   6 C      9   6 C                                 1.5354168
     9   6 C     10   6 C                                 1.5259279
    10   6 C     11   6 C                                 1.5303086
    11   6 C     12   8 O                                 1.4222325
    12   8 O     13   6 C                                 1.4016902
     1   6 C     14   1 H                                 1.0721558
     3   6 C     15   1 H                                 1.0721252 (min)
     6   6 C     16   1 H                                 1.0968575
     9   6 C     17   1 H                                 1.0909391
     9   6 C     18   1 H                                 1.0917025
    10   6 C     19   1 H                                 1.0899757
    10   6 C     20   1 H                                 1.0918201
    11   6 C     21   1 H                                 1.1036495
    13   6 C     22   1 H                                 1.0885675
    13   6 C     23   1 H                                 1.0973513
    13   6 C     24   1 H                                 1.0962593

 * 5 distinct bonds (by element types)

   Z      Z             #   av. dist./Å        max./Å        min./Å
   1 H    6 C          11     1.0901276     1.1036495     1.0721252
   6 C    6 C           6     1.4556836     1.5354168     1.3591060
   6 C    7 N           1     1.1432315     1.1432315     1.1432315
   6 C    8 O           2     1.4119613     1.4222325     1.4016902
   6 C   16 S           2     1.7188337     1.7198538     1.7178137


optimized geometry written to: xtbopt.xyz


           -------------------------------------------------
          | TOTAL ENERGY              -37.217029584743 Eh   |
          | GRADIENT NORM               0.000670068664 Eh/α |
          | HOMO-LUMO GAP               3.902636699612 eV   |
           -------------------------------------------------

------------------------------------------------------------------------
 * finished run on 2021/05/19 at 10:59:25.954     
------------------------------------------------------------------------
 total:
 * wall-time:     0 d,  0 h,  0 min,  0.619 sec
 *  cpu-time:     0 d,  0 h,  0 min,  0.619 sec
 * ratio c/w:     0.999 speedup
 SCF:
 * wall-time:     0 d,  0 h,  0 min,  0.039 sec
 *  cpu-time:     0 d,  0 h,  0 min,  0.039 sec
 * ratio c/w:     1.000 speedup
 ANC optimizer:
 * wall-time:     0 d,  0 h,  0 min,  0.558 sec
 *  cpu-time:     0 d,  0 h,  0 min,  0.558 sec
 * ratio c/w:     1.000 speedup

