      -----------------------------------------------------------      
     |                   =====================                   |     
     |                           x T B                           |     
     |                   =====================                   |     
     |                         S. Grimme                         |     
     |          Mulliken Center for Theoretical Chemistry        |     
     |                    University of Bonn                     |     
     |                Version 6.2 RC2 (SAW190805)                |     
      -----------------------------------------------------------      

   This program is distributed in the hope that it will be useful,
   but WITHOUT ANY WARRANTY; without even the implied warranty of
   MERCHANTABILITY or FITNESS FOR A PARTICULAR PURPOSE.
   
   FOR NON-COMMERCIAL, ACADEMIA USE ONLY.
   
   Cite this work as:
   * S. Grimme, C. Bannwarth, P. Shushkov, J. Chem. Theory Comput., 2017,
     13, 1989-2009. DOI: 10.1021/acs.jctc.7b00118
   * C. Bannwarth, S. Ehlert and S. Grimme., J. Chem. Theory Comput., 2019,
     15, 1652-1671. DOI: 10.1021/acs.jctc.8b01176
   * P. Pracht, E. Caldeweyher, S. Ehlert, S. Grimme, ChemRxiv, 2019, preprint.
     DOI: 10.26434/chemrxiv.8326202.v1
   
   for DFT-D4:
   * E. Caldeweyher, C. Bannwarth and S. Grimme, J. Chem. Phys., 2017,
     147, 034112. DOI: 10.1063/1.4993215
   * E. Caldeweyher, S. Ehlert, A. Hansen, H. Neugebauer, S. Spicher,
     C. Bannwarth and S. Grimme, J. Chem. Phys., 2019, 150, 154122.
     DOI: 10.1063/1.5090222
   
   for sTDA-xTB:
   * S. Grimme and C. Bannwarth, J. Chem. Phys., 2016, 145, 054103.
     DOI: 10.1063/1.4959605
   
   in the mass-spec context:
   * V. Asgeirsson, C. Bauer and S. Grimme, Chem. Sci., 2017, 8, 4879.
     DOI: 10.1039/c7sc00601b
   
   for metadynamics refer to:
   * S. Grimme, J. Chem. Theory Comput., 2019, 155, 2847-2862
     DOI: 10.1021/acs.jctc.9b00143
   
   with help from (in alphabetical order)
   C. Bannwarth, F. Bohle, G. Brandenburg, E. Caldeweyher, M. Checinski,
   S. Dohm, S. Ehlert, S. Ehrlich, F. März, H. Neugebauer, J. Pisarek,
   P. Pracht, P. Shushkov, and S. Spicher.
   
 * started run on 2021/05/19 at 10:59:26.673     

           -------------------------------------------------
          |                Calculation Setup                |
           -------------------------------------------------

          program call               : /ihome/ghutchison/geoffh/xtb/xtb 185.xyz -opt
          hostname                   : smp-n83
          coordinate file            : 185.xyz
          omp threads                :                     1
          number of atoms            :                    26
          number of electrons        :                    66
          charge                     :                     0
          spin                       :                   0.0
          first test random number   :      0.79168664258596


########################################################################
# WARNING! Please study the warnings concerning your input carefully
#  - the use of '-opt' is discouraged, please use '--opt' next time
########################################################################

           ------------------------------------------------- 
          |                 G F N 2 - x T B                 |
          | Geometry, Frequencies, Noncovalent interactions |
          |            JCTC 2019 parametrisation            |
           ------------------------------------------------- 
             KAB for C  - Si     :                1.0500
             KAB for H  - Pd     :                0.9500
             k(s)              :                1.8500
             k(p)              :                2.2300
             k(d)              :                2.2300
             k(f)              :                2.0000
             kEN (H0ij)        :               -2.0000
             D4 a1             :                0.5200
             D4 a2             :                5.0000
             D4 s6             :                1.0000
             D4 s8             :                2.7000
             D4 s9             :                5.0000
             alphaj            :                2.0000

  Z AO/shell   Hii/eV     exponent
  1     Wed Apr 25 08:07:45 CEST 2018   EN: 2.200 GM2: 0.406  GM3: 0.0800  RAES: 1.40
     1s    -10.707211    1.230000
  6     Wed Apr 25 08:07:45 CEST 2018   EN: 2.550 GM2: 0.538  GM3: 0.1500  RAES: 3.00
     2s    -13.970922    2.096432
     2p    -10.063292    1.800000
  8     Wed Apr 25 08:07:45 CEST 2018   EN: 3.440 GM2: 0.452  GM3:-0.0517  RAES: 1.80
     2s    -20.229985    2.439742
     2p    -15.503117    2.137023

           ------------------------------------------------- 
          |        Self-Consistent Charge Iterations        |
           ------------------------------------------------- 

          ...................................................
          :                      SETUP                      :
          :.................................................:
          :  # basis functions                  62          :
          :  # atomic orbitals                  62          :
          :  # shells                           38          :
          :  # electrons                        66          :
          :  max. iterations                   250          :
          :  Hamiltonian                  GFN2-xTB          :
          :  restarted?                      false          :
          :  GBSA solvation                  false          :
          :  PC potential                    false          :
          :  electronic temp.          300.0000000     K    :
          :  accuracy                    1.0000000          :
          :  -> integral cutoff          0.2500000E+02      :
          :  -> integral neglect         0.1000000E-07      :
          :  -> SCF convergence          0.1000000E-05 Eh   :
          :  -> wf. convergence          0.1000000E-03 e    :
          :  Broyden damping             0.4000000          :
          ...................................................

 iter      E             dE          RMSdq      gap      omega  full diag
   1    -37.0901551 -0.370902E+02  0.426E+00    4.20       0.0  T
   2    -37.1538198 -0.636647E-01  0.245E+00    4.13       1.0  T
   3    -37.1514561  0.236374E-02  0.120E+00    4.10       1.0  T
   4    -37.1596645 -0.820839E-02  0.391E-01    4.11       1.0  T
   5    -37.1609696 -0.130515E-02  0.796E-02    4.13       1.0  T
   6    -37.1609836 -0.140042E-04  0.452E-02    4.12       1.0  T
   7    -37.1609904 -0.677279E-05  0.158E-02    4.13       1.2  T
   8    -37.1609929 -0.254694E-05  0.509E-03    4.12       3.9  T
   9    -37.1609931 -0.194454E-06  0.175E-03    4.12      11.2  T
  10    -37.1609932 -0.381764E-07  0.842E-04    4.13      23.3  T
  11    -37.1609932 -0.328146E-08  0.277E-04    4.13      70.8  T

   *** convergence criteria satisfied after 11 iterations ***

         #    Occupation            Energy/Eh            Energy/eV
      -------------------------------------------------------------
         1        2.0000           -0.7053696             -19.1941
       ...           ...                  ...                  ...
        27        2.0000           -0.4519424             -12.2980
        28        2.0000           -0.4440873             -12.0842
        29        2.0000           -0.4345623             -11.8250
        30        2.0000           -0.4212047             -11.4616
        31        2.0000           -0.4193676             -11.4116
        32        2.0000           -0.3834652             -10.4346
        33        2.0000           -0.3701163             -10.0714 (HOMO)
        34                         -0.2185230              -5.9463 (LUMO)
        35                         -0.2086141              -5.6767
        36                         -0.0893776              -2.4321
        37                          0.0124272               0.3382
        38                          0.0297964               0.8108
       ...                                ...                  ...
        62                          0.6526468              17.7594
      -------------------------------------------------------------
                  HL-Gap            0.1515933 Eh            4.1251 eV
             Fermi-level           -0.2943196 Eh           -8.0088 eV

 SCC (total)                   0 d,  0 h,  0 min,  0.032 sec
 SCC setup                      ...        0 min,  0.000 sec (  0.933%)
 Dispersion                     ...        0 min,  0.000 sec (  1.142%)
 integral evaluation            ...        0 min,  0.007 sec ( 23.090%)
 zeroth order Hamiltonian       ...        0 min,  0.000 sec (  0.441%)
 iterations                     ...        0 min,  0.012 sec ( 37.835%)
 molecular gradient             ...        0 min,  0.011 sec ( 35.218%)
 printout                       ...        0 min,  0.000 sec (  1.170%)

         :::::::::::::::::::::::::::::::::::::::::::::::::::::
         ::                     SUMMARY                     ::
         :::::::::::::::::::::::::::::::::::::::::::::::::::::
         :: total energy             -36.673490193125 Eh    ::
         :: gradient norm              0.040427710455 Eh/a0 ::
         :: HOMO-LUMO gap              4.125062956861 eV    ::
         ::.................................................::
         :: SCC energy               -37.160993172590 Eh    ::
         :: -> isotropic ES            0.033369082356 Eh    ::
         :: -> anisotropic ES          0.006522877200 Eh    ::
         :: -> anisotropic XC          0.012911799361 Eh    ::
         :: -> dispersion             -0.019446756902 Eh    ::
         :: repulsion energy           0.487549774518 Eh    ::
         :: add. restraining           0.000000000000 Eh    ::
         :::::::::::::::::::::::::::::::::::::::::::::::::::::

      ----------------------------------------------------------- 
     |                   =====================                   |
     |                        A N C O P T                        |
     |                   =====================                   |
     |               Approximate Normal Coordinate               |
     |                Rational Function Optimizer                |
      ----------------------------------------------------------- 

          ...................................................
          :                      SETUP                      :
          :.................................................:
          :   optimization level            normal          :
          :   max. optcycles                   200          :
          :   ANC micro-cycles                  20          :
          :   degrees of freedom                72          :
          :.................................................:
          :   RF solver                   davidson          :
          :   input Hessian                  false          :
          :   write xtbopt.log                true          :
          :   linear?                        false          :
          :   energy convergence         0.5000000E-05 Eh   :
          :   grad. convergence          0.1000000E-02 Eh/α :
          :   maximium RF displ.         2.0000000          :
          :   Hlow (freq-cutoff)         0.5000000E-02      :
          :   Hmax (freq-cutoff)         5.0000000          :
          :   S6 in model hess.         20.0000000          :
          ...................................................

generating ANC from model Hessian ...
Using Lindh-Hessian (1995)
 Shifting diagonal of input Hessian by   3.944752821758564E-003
 Lowest  eigenvalues of input Hessian
    0.000000    0.000000    0.000000    0.000000    0.000000    0.000000
    0.005000    0.005709    0.006018    0.006631    0.007490    0.009429
    0.013631    0.014759    0.016851    0.020082    0.021255    0.024142
 Highest eigenvalues
    1.527045    1.711273    1.744798    1.871697    2.023932    2.082984
 

........................................................................
.............................. CYCLE    1 ..............................
........................................................................
   1    -37.1609932 -0.371610E+02  0.819E-05    4.13       0.0  T
   2    -37.1609932 -0.403091E-10  0.494E-05    4.13     397.2  T
   3    -37.1609932 -0.234479E-10  0.312E-05    4.13     628.5  T
     SCC iter.                  ...        0 min,  0.004 sec
     gradient                   ...        0 min,  0.011 sec
 * total energy  :   -36.6734902 Eh     change        0.1961692E-07 Eh
   gradient norm :     0.0404300 Eh/α   predicted     0.0000000E+00 (-100.00%)
   displ. norm   :     0.2159130 α      lambda       -0.3599138E-02
   maximum displ.:     0.1434436 α      in ANC's #2, #5, #43, ...

........................................................................
.............................. CYCLE    2 ..............................
........................................................................
   1    -37.1795630 -0.371796E+02  0.160E-01    4.20       0.0  T
   2    -37.1795718 -0.875643E-05  0.959E-02    4.20       1.0  T
   3    -37.1795531  0.187526E-04  0.396E-02    4.20       1.0  T
   4    -37.1795775 -0.244364E-04  0.418E-03    4.20       4.7  T
   5    -37.1795775 -0.271276E-07  0.186E-03    4.20      10.5  T
   6    -37.1795775 -0.668368E-08  0.641E-04    4.20      30.6  T
     SCC iter.                  ...        0 min,  0.006 sec
     gradient                   ...        0 min,  0.011 sec
 * total energy  :   -36.6758471 Eh     change       -0.2356971E-02 Eh
   gradient norm :     0.0149241 Eh/α   predicted    -0.1883468E-02 ( -20.09%)
   displ. norm   :     0.2061940 α      lambda       -0.8320163E-03
   maximum displ.:     0.1464496 α      in ANC's #2, #5, #4, ...

........................................................................
.............................. CYCLE    3 ..............................
........................................................................
   1    -37.1856809 -0.371857E+02  0.131E-01    4.22       0.0  T
   2    -37.1856898 -0.891601E-05  0.791E-02    4.22       1.0  T
   3    -37.1856784  0.114159E-04  0.358E-02    4.22       1.0  T
   4    -37.1856945 -0.160882E-04  0.371E-03    4.22       5.3  T
   5    -37.1856945 -0.360275E-07  0.201E-03    4.22       9.7  T
   6    -37.1856945 -0.177045E-08  0.482E-04    4.22      40.7  T
     SCC iter.                  ...        0 min,  0.006 sec
     gradient                   ...        0 min,  0.011 sec
 * total energy  :   -36.6764385 Eh     change       -0.5913157E-03 Eh
   gradient norm :     0.0054811 Eh/α   predicted    -0.4337021E-03 ( -26.65%)
   displ. norm   :     0.2753479 α      lambda       -0.5264188E-03
   maximum displ.:     0.2021275 α      in ANC's #2, #5, #1, ...

........................................................................
.............................. CYCLE    4 ..............................
........................................................................
   1    -37.1863588 -0.371864E+02  0.165E-01    4.22       0.0  T
   2    -37.1863704 -0.115524E-04  0.998E-02    4.23       1.0  T
   3    -37.1863573  0.130595E-04  0.359E-02    4.23       1.0  T
   4    -37.1863752 -0.179304E-04  0.484E-03    4.23       4.0  T
   5    -37.1863753 -0.902215E-07  0.250E-03    4.23       7.8  T
   6    -37.1863753 -0.106085E-08  0.566E-04    4.23      34.6  T
     SCC iter.                  ...        0 min,  0.006 sec
     gradient                   ...        0 min,  0.011 sec
 * total energy  :   -36.6768555 Eh     change       -0.4170761E-03 Eh
   gradient norm :     0.0074212 Eh/α   predicted    -0.2831663E-03 ( -32.11%)
   displ. norm   :     0.3168601 α      lambda       -0.4854598E-03
   maximum displ.:     0.2274685 α      in ANC's #2, #5, #1, ...

........................................................................
.............................. CYCLE    5 ..............................
........................................................................
   1    -37.1845970 -0.371846E+02  0.186E-01    4.22       0.0  T
   2    -37.1846078 -0.108141E-04  0.113E-01    4.23       1.0  T
   3    -37.1845980  0.984220E-05  0.307E-02    4.23       1.0  T
   4    -37.1846122 -0.142662E-04  0.544E-03    4.23       3.6  T
   5    -37.1846123 -0.110222E-06  0.273E-03    4.23       7.2  T
   6    -37.1846123 -0.902332E-09  0.594E-04    4.23      33.0  T
     SCC iter.                  ...        0 min,  0.006 sec
     gradient                   ...        0 min,  0.011 sec
 * total energy  :   -36.6772473 Eh     change       -0.3917406E-03 Eh
   gradient norm :     0.0098601 Eh/α   predicted    -0.2671439E-03 ( -31.81%)
   displ. norm   :     0.3610850 α      lambda       -0.5143642E-03
   maximum displ.:     0.2633094 α      in ANC's #2, #1, #5, ...

........................................................................
.............................. CYCLE    6 ..............................
........................................................................
   1    -37.1823592 -0.371824E+02  0.207E-01    4.22       0.0  T
   2    -37.1823682 -0.898624E-05  0.126E-01    4.22       1.0  T
   3    -37.1823636  0.456892E-05  0.229E-02    4.22       1.0  T
   4    -37.1823723 -0.868984E-05  0.583E-03    4.22       3.4  T
   5    -37.1823724 -0.105693E-06  0.282E-03    4.22       7.0  T
   6    -37.1823724 -0.135279E-08  0.615E-04    4.22      31.9  T
     SCC iter.                  ...        0 min,  0.006 sec
     gradient                   ...        0 min,  0.011 sec
 * total energy  :   -36.6776422 Eh     change       -0.3948844E-03 Eh
   gradient norm :     0.0102592 Eh/α   predicted    -0.2907159E-03 ( -26.38%)
   displ. norm   :     0.3671924 α      lambda       -0.5044320E-03
   maximum displ.:     0.2775587 α      in ANC's #2, #1, #4, ...

........................................................................
.............................. CYCLE    7 ..............................
........................................................................
   1    -37.1817501 -0.371818E+02  0.202E-01    4.21       0.0  T
   2    -37.1817559 -0.581573E-05  0.123E-01    4.21       1.0  T
   3    -37.1817548  0.107886E-05  0.142E-02    4.21       1.4  T
   4    -37.1817592 -0.437706E-05  0.544E-03    4.21       3.6  T
   5    -37.1817593 -0.859873E-07  0.215E-03    4.21       9.1  T
   6    -37.1817593 -0.756400E-08  0.551E-04    4.21      35.6  T
     SCC iter.                  ...        0 min,  0.006 sec
     gradient                   ...        0 min,  0.011 sec
 * total energy  :   -36.6780185 Eh     change       -0.3763099E-03 Eh
   gradient norm :     0.0085634 Eh/α   predicted    -0.2862463E-03 ( -23.93%)
   displ. norm   :     0.3359794 α      lambda       -0.4204348E-03
   maximum displ.:     0.2535602 α      in ANC's #2, #1, #4, ...

........................................................................
.............................. CYCLE    8 ..............................
........................................................................
   1    -37.1835749 -0.371836E+02  0.177E-01    4.21       0.0  T
   2    -37.1835787 -0.375374E-05  0.107E-01    4.21       1.0  T
   3    -37.1835773  0.140016E-05  0.119E-02    4.21       1.6  T
   4    -37.1835810 -0.375023E-05  0.455E-03    4.21       4.3  T
   5    -37.1835811 -0.408194E-07  0.133E-03    4.21      14.7  T
   6    -37.1835811 -0.960279E-08  0.399E-04    4.21      49.1  T
     SCC iter.                  ...        0 min,  0.006 sec
     gradient                   ...        0 min,  0.011 sec
 * total energy  :   -36.6783430 Eh     change       -0.3245263E-03 Eh
   gradient norm :     0.0062932 Eh/α   predicted    -0.2339504E-03 ( -27.91%)
   displ. norm   :     0.4443079 α      lambda       -0.3958402E-03
   maximum displ.:     0.3313277 α      in ANC's #2, #1, #4, ...

........................................................................
.............................. CYCLE    9 ..............................
........................................................................
   1    -37.1833076 -0.371833E+02  0.228E-01    4.21       0.0  T
   2    -37.1833131 -0.543736E-05  0.138E-01    4.21       1.0  T
   3    -37.1833148 -0.170190E-05  0.101E-02    4.21       1.9  T
   4    -37.1833162 -0.147361E-05  0.556E-03    4.21       3.5  T
   5    -37.1833164 -0.130273E-06  0.167E-03    4.21      11.7  T
   6    -37.1833164 -0.131635E-07  0.376E-04    4.21      52.2  T
     SCC iter.                  ...        0 min,  0.006 sec
     gradient                   ...        0 min,  0.011 sec
 * total energy  :   -36.6786249 Eh     change       -0.2818875E-03 Eh
   gradient norm :     0.0089736 Eh/α   predicted    -0.2369919E-03 ( -15.93%)
   displ. norm   :     0.4569921 α      lambda       -0.6607116E-03
   maximum displ.:     0.2794519 α      in ANC's #2, #1, #5, ...

........................................................................
.............................. CYCLE   10 ..............................
........................................................................
   1    -37.1909814 -0.371910E+02  0.212E-01    4.22       0.0  T
   2    -37.1909876 -0.614211E-05  0.126E-01    4.22       1.0  T
   3    -37.1909858  0.172837E-05  0.139E-02    4.21       1.4  T
   4    -37.1909895 -0.367455E-05  0.516E-03    4.22       3.8  T
   5    -37.1909897 -0.190999E-06  0.249E-03    4.22       7.9  T
   6    -37.1909897 -0.867155E-08  0.659E-04    4.22      29.8  T
     SCC iter.                  ...        0 min,  0.006 sec
     gradient                   ...        0 min,  0.011 sec
 * total energy  :   -36.6788289 Eh     change       -0.2039785E-03 Eh
   gradient norm :     0.0122556 Eh/α   predicted    -0.3993488E-03 (  95.78%)
   displ. norm   :     0.4635064 α      lambda       -0.5298494E-03
   maximum displ.:     0.3339918 α      in ANC's #2, #1, #4, ...

........................................................................
.............................. CYCLE   11 ..............................
........................................................................
   1    -37.1841074 -0.371841E+02  0.237E-01    4.22       0.0  T
   2    -37.1841145 -0.714027E-05  0.144E-01    4.22       1.0  T
   3    -37.1841169 -0.232641E-05  0.107E-02    4.22       1.8  T
   4    -37.1841182 -0.133359E-05  0.593E-03    4.22       3.3  T
   5    -37.1841183 -0.148879E-06  0.276E-03    4.22       7.1  T
   6    -37.1841184 -0.467872E-07  0.508E-04    4.22      38.6  T
     SCC iter.                  ...        0 min,  0.006 sec
     gradient                   ...        0 min,  0.011 sec
 * total energy  :   -36.6790593 Eh     change       -0.2304413E-03 Eh
   gradient norm :     0.0093738 Eh/α   predicted    -0.3218418E-03 (  39.66%)
   displ. norm   :     0.0926157 α      lambda       -0.1996415E-03
   maximum displ.:     0.0644780 α      in ANC's #2, #4, #1, ...

........................................................................
.............................. CYCLE   12 ..............................
........................................................................
   1    -37.1870884 -0.371871E+02  0.515E-02    4.22       0.0  T
   2    -37.1870897 -0.139010E-05  0.310E-02    4.22       1.0  T
   3    -37.1870885  0.127850E-05  0.103E-02    4.22       1.9  T
   4    -37.1870902 -0.173755E-05  0.178E-03    4.22      11.0  T
   5    -37.1870902 -0.240026E-07  0.863E-04    4.22      22.7  T
     SCC iter.                  ...        0 min,  0.006 sec
     gradient                   ...        0 min,  0.011 sec
 * total energy  :   -36.6791779 Eh     change       -0.1186099E-03 Eh
   gradient norm :     0.0042957 Eh/α   predicted    -0.1006763E-03 ( -15.12%)
   displ. norm   :     0.2437834 α      lambda       -0.1538797E-03
   maximum displ.:     0.1604797 α      in ANC's #1, #2, #9, ...

........................................................................
.............................. CYCLE   13 ..............................
........................................................................
   1    -37.1871885 -0.371872E+02  0.106E-01    4.22       0.0  T
   2    -37.1871898 -0.135932E-05  0.635E-02    4.22       1.0  T
   3    -37.1871886  0.120812E-05  0.937E-03    4.22       2.1  T
   4    -37.1871904 -0.173640E-05  0.217E-03    4.22       9.0  T
   5    -37.1871904 -0.182685E-07  0.105E-03    4.22      18.6  T
     SCC iter.                  ...        0 min,  0.005 sec
     gradient                   ...        0 min,  0.011 sec
 * total energy  :   -36.6792975 Eh     change       -0.1195792E-03 Eh
   gradient norm :     0.0033073 Eh/α   predicted    -0.8151789E-04 ( -31.83%)
   displ. norm   :     0.3841963 α      lambda       -0.1633312E-03
   maximum displ.:     0.2586940 α      in ANC's #1, #2, #5, ...

........................................................................
.............................. CYCLE   14 ..............................
........................................................................
   1    -37.1864344 -0.371864E+02  0.168E-01    4.22       0.0  T
   2    -37.1864365 -0.218813E-05  0.101E-01    4.22       1.0  T
   3    -37.1864367 -0.179273E-06  0.774E-03    4.22       2.5  T
   4    -37.1864376 -0.841725E-06  0.342E-03    4.22       5.7  T
   5    -37.1864376 -0.377095E-07  0.136E-03    4.22      14.5  T
   6    -37.1864376 -0.468983E-08  0.344E-04    4.22      57.0  T
   7    -37.1864376 -0.712213E-09  0.152E-04    4.22     129.1  T
     SCC iter.                  ...        0 min,  0.007 sec
     gradient                   ...        0 min,  0.011 sec
 * total energy  :   -36.6794002 Eh     change       -0.1027552E-03 Eh
   gradient norm :     0.0040852 Eh/α   predicted    -0.9372068E-04 (  -8.79%)
   displ. norm   :     0.2323918 α      lambda       -0.7785794E-04
   maximum displ.:     0.1549402 α      in ANC's #1, #2, #8, ...

........................................................................
.............................. CYCLE   15 ..............................
........................................................................
   1    -37.1853221 -0.371853E+02  0.100E-01    4.22       0.0  T
   2    -37.1853230 -0.887066E-06  0.596E-02    4.22       1.0  T
   3    -37.1853231 -0.104108E-06  0.361E-03    4.22       5.4  T
   4    -37.1853232 -0.154511E-06  0.187E-03    4.22      10.5  T
   5    -37.1853233 -0.262625E-07  0.955E-04    4.22      20.5  T
     SCC iter.                  ...        0 min,  0.005 sec
     gradient                   ...        0 min,  0.011 sec
 * total energy  :   -36.6794260 Eh     change       -0.2571251E-04 Eh
   gradient norm :     0.0064062 Eh/α   predicted    -0.4103486E-04 (  59.59%)
   displ. norm   :     0.1632839 α      lambda       -0.1550610E-03
   maximum displ.:     0.1089063 α      in ANC's #1, #5, #4, ...

........................................................................
.............................. CYCLE   16 ..............................
........................................................................
   1    -37.1897890 -0.371898E+02  0.671E-02    4.22       0.0  T
   2    -37.1897906 -0.159495E-05  0.394E-02    4.22       1.0  T
   3    -37.1897903  0.338209E-06  0.617E-03    4.22       3.2  T
   4    -37.1897908 -0.477504E-06  0.189E-03    4.22      10.4  T
   5    -37.1897908 -0.515597E-07  0.773E-04    4.22      25.4  T
     SCC iter.                  ...        0 min,  0.005 sec
     gradient                   ...        0 min,  0.011 sec
 * total energy  :   -36.6794566 Eh     change       -0.3067105E-04 Eh
   gradient norm :     0.0052031 Eh/α   predicted    -0.7959775E-04 ( 159.52%)
   displ. norm   :     0.1113621 α      lambda       -0.8333028E-04
   maximum displ.:     0.0755393 α      in ANC's #2, #1, #4, ...

........................................................................
.............................. CYCLE   17 ..............................
........................................................................
   1    -37.1875859 -0.371876E+02  0.557E-02    4.22       0.0  T
   2    -37.1875864 -0.574249E-06  0.335E-02    4.22       1.0  T
   3    -37.1875864  0.221772E-07  0.345E-03    4.22       5.7  T
   4    -37.1875866 -0.209315E-06  0.152E-03    4.22      12.9  T
   5    -37.1875866 -0.184789E-07  0.804E-04    4.22      24.4  T
     SCC iter.                  ...        0 min,  0.006 sec
     gradient                   ...        0 min,  0.011 sec
 * total energy  :   -36.6794997 Eh     change       -0.4308905E-04 Eh
   gradient norm :     0.0020737 Eh/α   predicted    -0.4218300E-04 (  -2.10%)
   displ. norm   :     0.0240798 α      lambda       -0.1821225E-04
   maximum displ.:     0.0101830 α      in ANC's #6, #8, #7, ...

........................................................................
.............................. CYCLE   18 ..............................
........................................................................
   1    -37.1877118 -0.371877E+02  0.116E-02    4.22       0.0  T
   2    -37.1877119 -0.704764E-07  0.686E-03    4.22       2.9  T
   3    -37.1877118  0.330186E-07  0.159E-03    4.22      12.3  T
   4    -37.1877119 -0.455534E-07  0.436E-04    4.22      45.0  T
   5    -37.1877119 -0.244951E-08  0.179E-04    4.22     109.4  T
     SCC iter.                  ...        0 min,  0.006 sec
     gradient                   ...        0 min,  0.011 sec
 * total energy  :   -36.6795133 Eh     change       -0.1353247E-04 Eh
   gradient norm :     0.0020998 Eh/α   predicted    -0.9114955E-05 ( -32.64%)
   displ. norm   :     0.0698456 α      lambda       -0.3068988E-04
   maximum displ.:     0.0304980 α      in ANC's #2, #3, #1, ...

........................................................................
.............................. CYCLE   19 ..............................
........................................................................
   1    -37.1879302 -0.371879E+02  0.318E-02    4.22       0.0  T
   2    -37.1879303 -0.194855E-06  0.189E-02    4.22       1.0  T
   3    -37.1879302  0.100203E-06  0.269E-03    4.22       7.3  T
   4    -37.1879304 -0.149903E-06  0.768E-04    4.22      25.5  T
   5    -37.1879304 -0.480944E-08  0.355E-04    4.22      55.2  T
     SCC iter.                  ...        0 min,  0.006 sec
     gradient                   ...        0 min,  0.012 sec
 * total energy  :   -36.6795352 Eh     change       -0.2193200E-04 Eh
   gradient norm :     0.0027691 Eh/α   predicted    -0.1542176E-04 ( -29.68%)
   displ. norm   :     0.0825949 α      lambda       -0.3244867E-04
   maximum displ.:     0.0381019 α      in ANC's #3, #7, #8, ...

........................................................................
.............................. CYCLE   20 ..............................
........................................................................
   1    -37.1885666 -0.371886E+02  0.369E-02    4.22       0.0  T
   2    -37.1885667 -0.108861E-06  0.220E-02    4.22       1.0  T
   3    -37.1885667  0.342493E-07  0.203E-03    4.22       9.6  T
   4    -37.1885668 -0.882575E-07  0.718E-04    4.22      27.3  T
   5    -37.1885668 -0.297042E-09  0.337E-04    4.22      58.1  T
     SCC iter.                  ...        0 min,  0.006 sec
     gradient                   ...        0 min,  0.011 sec
 * total energy  :   -36.6795574 Eh     change       -0.2222699E-04 Eh
   gradient norm :     0.0034945 Eh/α   predicted    -0.1633939E-04 ( -26.49%)
   displ. norm   :     0.1407036 α      lambda       -0.3815110E-04
   maximum displ.:     0.0683599 α      in ANC's #2, #3, #1, ...
 * RMSD in coord.:     0.8229354 α      energy gain  -0.6067220E-02 Eh

generating ANC from model Hessian ...
Using Lindh-Hessian (1995)
 Shifting diagonal of input Hessian by   3.569753718976854E-003
 Lowest  eigenvalues of input Hessian
   -0.000000   -0.000000   -0.000000    0.000000    0.000000    0.000000
    0.005000    0.005466    0.005516    0.006319    0.007169    0.009908
    0.013836    0.014689    0.017190    0.021038    0.021134    0.026483
 Highest eigenvalues
    1.579204    1.782329    1.803711    1.921721    2.084321    2.149070
 

........................................................................
.............................. CYCLE   21 ..............................
........................................................................
   1    -37.1881300 -0.371881E+02  0.630E-02    4.22       0.0  T
   2    -37.1881303 -0.239832E-06  0.374E-02    4.22       1.0  T
   3    -37.1881302  0.345318E-07  0.267E-03    4.22       7.3  T
   4    -37.1881304 -0.139666E-06  0.100E-03    4.22      19.5  T
   5    -37.1881304 -0.266808E-08  0.435E-04    4.22      45.0  T
   6    -37.1881304 -0.793428E-09  0.156E-04    4.22     125.6  T
     SCC iter.                  ...        0 min,  0.006 sec
     gradient                   ...        0 min,  0.011 sec
 * total energy  :   -36.6795811 Eh     change       -0.2369147E-04 Eh
   gradient norm :     0.0031077 Eh/α   predicted     0.0000000E+00 (-100.00%)
   displ. norm   :     0.0278505 α      lambda       -0.2550470E-04
   maximum displ.:     0.0148902 α      in ANC's #7, #5, #3, ...

........................................................................
.............................. CYCLE   22 ..............................
........................................................................
   1    -37.1882119 -0.371882E+02  0.138E-02    4.22       0.0  T
   2    -37.1882120 -0.941633E-07  0.817E-03    4.22       2.4  T
   3    -37.1882119  0.318174E-07  0.175E-03    4.22      11.2  T
   4    -37.1882120 -0.476803E-07  0.493E-04    4.22      39.7  T
   5    -37.1882120 -0.292849E-08  0.220E-04    4.22      89.1  T
     SCC iter.                  ...        0 min,  0.006 sec
     gradient                   ...        0 min,  0.011 sec
 * total energy  :   -36.6795994 Eh     change       -0.1828221E-04 Eh
   gradient norm :     0.0012571 Eh/α   predicted    -0.1276313E-04 ( -30.19%)
   displ. norm   :     0.0580191 α      lambda       -0.1459117E-04
   maximum displ.:     0.0353460 α      in ANC's #7, #8, #5, ...

........................................................................
.............................. CYCLE   23 ..............................
........................................................................
   1    -37.1881641 -0.371882E+02  0.275E-02    4.22       0.0  T
   2    -37.1881642 -0.184368E-06  0.163E-02    4.22       1.2  T
   3    -37.1881641  0.147168E-06  0.294E-03    4.22       6.7  T
   4    -37.1881643 -0.198105E-06  0.683E-04    4.22      28.7  T
   5    -37.1881643 -0.414174E-08  0.338E-04    4.22      58.1  T
     SCC iter.                  ...        0 min,  0.005 sec
     gradient                   ...        0 min,  0.011 sec
 * total energy  :   -36.6796113 Eh     change       -0.1193368E-04 Eh
   gradient norm :     0.0012141 Eh/α   predicted    -0.7306781E-05 ( -38.77%)
   displ. norm   :     0.0405642 α      lambda       -0.5621334E-05
   maximum displ.:     0.0237815 α      in ANC's #5, #8, #7, ...

........................................................................
.............................. CYCLE   24 ..............................
........................................................................
   1    -37.1881266 -0.371881E+02  0.196E-02    4.22       0.0  T
   2    -37.1881266 -0.196771E-07  0.117E-02    4.22       1.7  T
   3    -37.1881266  0.291893E-08  0.738E-04    4.22      26.6  T
   4    -37.1881266 -0.111300E-07  0.261E-04    4.22      75.2  T
     SCC iter.                  ...        0 min,  0.005 sec
     gradient                   ...        0 min,  0.011 sec
 * total energy  :   -36.6796181 Eh     change       -0.6763422E-05 Eh
   gradient norm :     0.0009604 Eh/α   predicted    -0.2814017E-05 ( -58.39%)
   displ. norm   :     0.0405187 α      lambda       -0.3966630E-05
   maximum displ.:     0.0237888 α      in ANC's #5, #8, #7, ...

........................................................................
.............................. CYCLE   25 ..............................
........................................................................
   1    -37.1880376 -0.371880E+02  0.197E-02    4.22       0.0  T
   2    -37.1880376 -0.216958E-07  0.117E-02    4.22       1.7  T
   3    -37.1880376  0.503844E-08  0.810E-04    4.22      24.2  T
   4    -37.1880376 -0.135418E-07  0.277E-04    4.22      70.7  T
     SCC iter.                  ...        0 min,  0.005 sec
     gradient                   ...        0 min,  0.011 sec
 * total energy  :   -36.6796213 Eh     change       -0.3198873E-05 Eh
   gradient norm :     0.0011088 Eh/α   predicted    -0.1986877E-05 ( -37.89%)
   displ. norm   :     0.0405079 α      lambda        0.1034456E-05
   maximum displ.:     0.0237897 α      in ANC's #5, #8, #7, ...

........................................................................
.............................. CYCLE   26 ..............................
........................................................................
   1    -37.1878970 -0.371879E+02  0.197E-02    4.22       0.0  T
   2    -37.1878970 -0.245482E-07  0.117E-02    4.22       1.7  T
   3    -37.1878970  0.439974E-08  0.800E-04    4.22      24.5  T
   4    -37.1878970 -0.128599E-07  0.288E-04    4.22      68.2  T
     SCC iter.                  ...        0 min,  0.005 sec
     gradient                   ...        0 min,  0.011 sec
 * total energy  :   -36.6796204 Eh     change        0.8985854E-06 Eh
   gradient norm :     0.0016716 Eh/α   predicted     0.5174164E-06 ( -42.42%)
   displ. norm   :     0.0405190 α      lambda        0.7155958E-05
   maximum displ.:     0.0237890 α      in ANC's #5, #8, #7, ...

........................................................................
.............................. CYCLE   27 ..............................
........................................................................
   1    -37.1877051 -0.371877E+02  0.197E-02    4.22       0.0  T
   2    -37.1877051 -0.280328E-07  0.117E-02    4.22       1.7  T
   3    -37.1877051  0.466925E-08  0.812E-04    4.22      24.1  T
   4    -37.1877051 -0.130835E-07  0.297E-04    4.22      66.0  T
     SCC iter.                  ...        0 min,  0.005 sec
     gradient                   ...        0 min,  0.011 sec
 * total energy  :   -36.6796147 Eh     change        0.5637336E-05 Eh
   gradient norm :     0.0024713 Eh/α   predicted     0.3580432E-05 ( -36.49%)
   displ. norm   :     0.0270799 α      lambda        0.1439907E-04
   maximum displ.:     0.0158586 α      in ANC's #5, #8, #7, ...

........................................................................
.............................. CYCLE   28 ..............................
........................................................................
   1    -37.1875492 -0.371875E+02  0.131E-02    4.22       0.0  T
   2    -37.1875492 -0.136181E-07  0.778E-03    4.22       2.5  T
   3    -37.1875492  0.270607E-08  0.564E-04    4.22      34.8  T
   4    -37.1875492 -0.635831E-08  0.201E-04    4.22      97.5  T
     SCC iter.                  ...        0 min,  0.005 sec
     gradient                   ...        0 min,  0.011 sec
 * total energy  :   -36.6796080 Eh     change        0.6753269E-05 Eh
   gradient norm :     0.0030893 Eh/α   predicted     0.7199883E-05 (   6.61%)
   displ. norm   :     0.0713935 α      lambda       -0.2901686E-04
   maximum displ.:     0.0381268 α      in ANC's #7, #5, #8, ...

........................................................................
.............................. CYCLE   29 ..............................
........................................................................
   1    -37.1880548 -0.371881E+02  0.348E-02    4.22       0.0  T
   2    -37.1880549 -0.151733E-06  0.207E-02    4.22       1.0  T
   3    -37.1880549  0.622024E-07  0.211E-03    4.22       9.3  T
   4    -37.1880550 -0.963001E-07  0.617E-04    4.22      31.8  T
   5    -37.1880550 -0.397959E-08  0.306E-04    4.22      64.0  T
     SCC iter.                  ...        0 min,  0.006 sec
     gradient                   ...        0 min,  0.011 sec
 * total energy  :   -36.6796242 Eh     change       -0.1621429E-04 Eh
   gradient norm :     0.0009631 Eh/α   predicted    -0.1458266E-04 ( -10.06%)
   displ. norm   :     0.0118820 α      lambda       -0.2243321E-05
   maximum displ.:     0.0064136 α      in ANC's #7, #6, #5, ...

........................................................................
.............................. CYCLE   30 ..............................
........................................................................
   1    -37.1882444 -0.371882E+02  0.613E-03    4.22       0.0  T
   2    -37.1882444 -0.251740E-07  0.360E-03    4.22       5.4  T
   3    -37.1882444  0.140747E-07  0.104E-03    4.22      18.8  T
   4    -37.1882444 -0.189847E-07  0.212E-04    4.22      92.6  T
   5    -37.1882444 -0.580428E-09  0.912E-05    4.22     215.1  T
     SCC iter.                  ...        0 min,  0.006 sec
     gradient                   ...        0 min,  0.012 sec
 * total energy  :   -36.6796263 Eh     change       -0.2067606E-05 Eh
   gradient norm :     0.0002238 Eh/α   predicted    -0.1130205E-05 ( -45.34%)
   displ. norm   :     0.0119217 α      lambda        0.7499401E-06
   maximum displ.:     0.0064140 α      in ANC's #7, #6, #5, ...

   *** GEOMETRY OPTIMIZATION CONVERGED AFTER 30 ITERATIONS ***

------------------------------------------------------------------------
 total energy gain   :        -0.0061361 Eh       -3.8505 kcal/mol
 total RMSD          :         0.8277260 a0        0.4380 Å
 total power (kW/mol):        -0.5370094 (step)  -21.2419 (real)
------------------------------------------------------------------------

 ANCopt (total)                0 d,  0 h,  0 min,  0.758 sec
 optimizer setup                ...        0 min,  0.000 sec (  0.022%)
 model hessian                  ...        0 min,  0.008 sec (  1.047%)
 ANC generation                 ...        0 min,  0.002 sec (  0.203%)
 coordinate transformation      ...        0 min,  0.001 sec (  0.081%)
 single point calculation       ...        0 min,  0.737 sec ( 97.123%)
 optimization log               ...        0 min,  0.003 sec (  0.415%)
 hessian update                 ...        0 min,  0.000 sec (  0.057%)
 rational function              ...        0 min,  0.006 sec (  0.812%)

================
 final structure:
================
$coord
    3.71580953330866   -0.52418673345619   -0.44640605220468      C 
    2.00618456410279    1.44457703727525   -0.72447612924585      C 
    2.56076914704630    3.94056455407717   -0.43790725763205      O 
    5.06337610841785    4.64681676297755    0.16971421827899      C 
    5.13901752065521    7.51340062996699    0.36261266475903      C 
   -0.50709926678508    0.93130651504398   -1.34595464223006      C 
   -1.30916806222838   -1.53601566798449   -1.68883250176056      C 
   -3.70735850567667   -2.22639338899628   -2.29314670433874      O 
   -5.56269338033699   -0.32947441335028   -2.59867658470840      C 
   -8.04489383351558   -1.63083893054847   -3.23550219196572      C 
    0.42098897716955   -3.51350677709987   -1.40876799731174      C 
    2.89261914934677   -2.98965615148200   -0.79534760279046      C 
    5.66465042489389   -0.17785357762048    0.03414518342611      H 
    6.36765373280768    3.99350116307188   -1.30877035337752      H 
    5.62857854752977    3.79263946398835    1.97653293045317      H 
    4.56241440673609    8.35027783075622   -1.42152246106952      H 
    7.04206869302810    8.13449760617013    0.81677477561978      H 
    3.85150914429019    8.15087686347925    1.82939076185907      H 
   -1.76142424994484    2.52324492497122   -1.54136465326044      H 
   -5.01573023022620    0.96251565811820   -4.12992284075216      H 
   -5.75662986051534    0.76659331156967   -0.84552851806845      H 
   -7.84128865810640   -2.71937827177316   -4.96443643993294      H 
   -9.52487276771477   -0.23081845538719   -3.48794390434908      H 
   -8.57424038604823   -2.90875827873981   -1.71811703108478      H 
   -0.22929793088735   -5.42387871855785   -1.68294263011384      H 
    4.22421530679483   -4.52077711683922   -0.57863713504896      H 
$end
           -------------------------------------------------
          |                Final Singlepoint                |
           -------------------------------------------------

          ...................................................
          :                      SETUP                      :
          :.................................................:
          :  # basis functions                  62          :
          :  # atomic orbitals                  62          :
          :  # shells                           38          :
          :  # electrons                        66          :
          :  max. iterations                   250          :
          :  Hamiltonian                  GFN2-xTB          :
          :  restarted?                      false          :
          :  GBSA solvation                  false          :
          :  PC potential                    false          :
          :  electronic temp.          300.0000000     K    :
          :  accuracy                    1.0000000          :
          :  -> integral cutoff          0.2500000E+02      :
          :  -> integral neglect         0.1000000E-07      :
          :  -> SCF convergence          0.1000000E-05 Eh   :
          :  -> wf. convergence          0.1000000E-03 e    :
          :  Broyden damping             0.4000000          :
          ...................................................

 iter      E             dE          RMSdq      gap      omega  full diag
   1    -37.1882444 -0.371882E+02  0.353E-05    4.22       0.0  T
   2    -37.1882444 -0.775913E-11  0.175E-05    4.22    1122.6  T
   3    -37.1882444 -0.292033E-11  0.122E-05    4.22    1601.1  T

   *** convergence criteria satisfied after 3 iterations ***

         #    Occupation            Energy/Eh            Energy/eV
      -------------------------------------------------------------
         1        2.0000           -0.7085605             -19.2809
       ...           ...                  ...                  ...
        27        2.0000           -0.4520593             -12.3012
        28        2.0000           -0.4429521             -12.0533
        29        2.0000           -0.4315757             -11.7438
        30        2.0000           -0.4253966             -11.5756
        31        2.0000           -0.4189219             -11.3994
        32        2.0000           -0.3810746             -10.3696
        33        2.0000           -0.3668706              -9.9831 (HOMO)
        34                         -0.2117192              -5.7612 (LUMO)
        35                         -0.2018122              -5.4916
        36                         -0.0786450              -2.1400
        37                          0.0184110               0.5010
        38                          0.0368645               1.0031
       ...                                ...                  ...
        62                          0.6882085              18.7271
      -------------------------------------------------------------
                  HL-Gap            0.1551515 Eh            4.2219 eV
             Fermi-level           -0.2892949 Eh           -7.8721 eV

 SCC (total)                   0 d,  0 h,  0 min,  0.023 sec
 SCC setup                      ...        0 min,  0.000 sec (  0.900%)
 Dispersion                     ...        0 min,  0.000 sec (  0.904%)
 integral evaluation            ...        0 min,  0.007 sec ( 31.576%)
 zeroth order Hamiltonian       ...        0 min,  0.000 sec (  0.566%)
 iterations                     ...        0 min,  0.004 sec ( 16.153%)
 molecular gradient             ...        0 min,  0.011 sec ( 48.143%)
 printout                       ...        0 min,  0.000 sec (  1.487%)

         :::::::::::::::::::::::::::::::::::::::::::::::::::::
         ::                     SUMMARY                     ::
         :::::::::::::::::::::::::::::::::::::::::::::::::::::
         :: total energy             -36.679626282598 Eh    ::
         :: gradient norm              0.000224799035 Eh/a0 ::
         :: HOMO-LUMO gap              4.221886618736 eV    ::
         ::.................................................::
         :: SCC energy               -37.188244428163 Eh    ::
         :: -> isotropic ES            0.032365121279 Eh    ::
         :: -> anisotropic ES          0.005656517190 Eh    ::
         :: -> anisotropic XC          0.011756261748 Eh    ::
         :: -> dispersion             -0.019479994242 Eh    ::
         :: repulsion energy           0.508688064249 Eh    ::
         :: add. restraining           0.000000000000 Eh    ::
         :::::::::::::::::::::::::::::::::::::::::::::::::::::

           -------------------------------------------------
          |                Property Printout                |
           -------------------------------------------------

    * Orbital Energies and Occupations

         #    Occupation            Energy/Eh            Energy/eV
      -------------------------------------------------------------
         1        2.0000           -0.7085605             -19.2809
       ...           ...                  ...                  ...
        21        2.0000           -0.4814835             -13.1018
        22        2.0000           -0.4762716             -12.9600
        23        2.0000           -0.4731714             -12.8757
        24        2.0000           -0.4678512             -12.7309
        25        2.0000           -0.4586418             -12.4803
        26        2.0000           -0.4570692             -12.4375
        27        2.0000           -0.4520593             -12.3012
        28        2.0000           -0.4429521             -12.0533
        29        2.0000           -0.4315757             -11.7438
        30        2.0000           -0.4253966             -11.5756
        31        2.0000           -0.4189219             -11.3994
        32        2.0000           -0.3810746             -10.3696
        33        2.0000           -0.3668706              -9.9831 (HOMO)
        34                         -0.2117192              -5.7612 (LUMO)
        35                         -0.2018122              -5.4916
        36                         -0.0786450              -2.1400
        37                          0.0184110               0.5010
        38                          0.0368645               1.0031
        39                          0.0991946               2.6992
        40                          0.1087631               2.9596
        41                          0.1207930               3.2869
        42                          0.1306730               3.5558
        43                          0.1483880               4.0378
        44                          0.1505413               4.0964
       ...                                ...                  ...
        62                          0.6882085              18.7271
      -------------------------------------------------------------
                  HL-Gap            0.1551515 Eh            4.2219 eV
             Fermi-level           -0.2892949 Eh           -7.8721 eV

     #   Z        covCN         q      C6AA      α(0)
     1   6 C      2.916    -0.081    30.038     8.987
     2   6 C      2.865     0.142    24.906     8.180
     3   8 O      1.706    -0.277    18.594     5.822
     4   6 C      3.691     0.088    19.292     6.286
     5   6 C      3.751    -0.113    22.720     6.798
     6   6 C      2.919    -0.095    30.376     9.038
     7   6 C      2.864     0.144    24.865     8.174
     8   8 O      1.706    -0.273    18.523     5.811
     9   6 C      3.691     0.087    19.314     6.289
    10   6 C      3.751    -0.113    22.723     6.798
    11   6 C      2.919    -0.068    29.693     8.936
    12   6 C      2.921    -0.032    28.801     8.801
    13   1 H      0.926     0.031     2.578     2.511
    14   1 H      0.923     0.028     2.613     2.528
    15   1 H      0.923     0.028     2.613     2.528
    16   1 H      0.925     0.056     2.246     2.344
    17   1 H      0.925     0.045     2.377     2.411
    18   1 H      0.925     0.056     2.248     2.345
    19   1 H      0.926     0.045     2.379     2.412
    20   1 H      0.923     0.029     2.594     2.519
    21   1 H      0.923     0.030     2.593     2.518
    22   1 H      0.925     0.056     2.243     2.342
    23   1 H      0.925     0.046     2.374     2.410
    24   1 H      0.925     0.056     2.244     2.343
    25   1 H      0.926     0.047     2.356     2.401
    26   1 H      0.926     0.037     2.489     2.467

 Mol. C6AA /au·bohr⁶  :       6453.900883
 Mol. C8AA /au·bohr⁸  :     146783.714021
 Mol. α(0) /au        :        123.995840


Wiberg/Mayer (AO) data.
largest (>0.10) Wiberg bond orders for each atom
          total WBO             WBO to atom ...
     1  C   3.983        C   12 1.413    C    2 1.383    H   13 0.967
     2  C   3.936        C    1 1.383    C    6 1.346    O    3 1.062
     3  O   2.228        C    2 1.062    C    4 0.968
     4  C   3.949        C    5 1.015    H   14 0.969    H   15 0.969    O    3 0.968
     5  C   3.993        C    4 1.015    H   18 0.986    H   16 0.986    H   17 0.985
     6  C   3.978        C    7 1.402    C    2 1.346    H   19 0.964
     7  C   3.937        C    6 1.402    C   11 1.326    O    8 1.067
     8  O   2.233        C    7 1.067    C    9 0.967
     9  C   3.949        C   10 1.015    H   20 0.968    H   21 0.968    O    8 0.967
    10  C   3.992        C    9 1.015    H   24 0.986    H   22 0.986    H   23 0.985
    11  C   3.984        C   12 1.479    C    7 1.326    H   25 0.969
    12  C   3.992        C   11 1.479    C    1 1.413    H   26 0.971
    13  H   0.999        C    1 0.967
    14  H   0.999        C    4 0.969
    15  H   0.999        C    4 0.969
    16  H   0.997        C    5 0.986
    17  H   0.997        C    5 0.985
    18  H   0.997        C    5 0.986
    19  H   0.998        C    6 0.964
    20  H   0.999        C    9 0.968
    21  H   0.999        C    9 0.968
    22  H   0.997        C   10 0.986
    23  H   0.997        C   10 0.985
    24  H   0.997        C   10 0.986
    25  H   0.998        C   11 0.969
    26  H   0.998        C   12 0.971

molecular dipole:
                 x           y           z       tot (Debye)
 q only:        0.007       0.430       0.027
   full:        0.153       0.532       0.067       1.418
molecular quadrupole (traceless):
                xx          xy          yy          xz          yz          zz
 q only:        7.369       2.989      -1.864       3.278       0.094      -5.505
  q+dip:        8.180       1.179      -2.942       3.001      -0.616      -5.238
   full:        8.101       1.594      -3.725       2.775      -0.630      -4.376

           -------------------------------------------------
          |                Geometry Summary                 |
           -------------------------------------------------

      molecular mass/u    :      166.2194000
   center of mass at/Å    :        0.0830723       0.3071387      -0.6415621
  moments of inertia/u·Å² :        0.2870194E+03   0.1128121E+04   0.1402439E+04
rotational constants/cm⁻¹ :        0.5873343E-01   0.1494311E-01   0.1202022E-01

 * 26 selected distances

     #   Z        #   Z                                     value/Å
     1   6 C      2   6 C                                 1.3876327
     2   6 C      3   8 O                                 1.3615022
     3   8 O      4   6 C                                 1.4131151
     4   6 C      5   6 C                                 1.5208884
     2   6 C      6   6 C                                 1.3966950
     6   6 C      7   6 C                                 1.3848437
     7   6 C      8   8 O                                 1.3587737
     8   8 O      9   6 C                                 1.4134004
     9   6 C     10   6 C                                 1.5209051 (max)
     7   6 C     11   6 C                                 1.3983053
     1   6 C     12   6 C                                 1.3878113
    11   6 C     12   6 C                                 1.3758263
     1   6 C     13   1 H                                 1.0778676
     4   6 C     14   1 H                                 1.0990947
     4   6 C     15   1 H                                 1.0990677
     5   6 C     16   1 H                                 1.0865509
     5   6 C     17   1 H                                 1.0862488
     5   6 C     18   1 H                                 1.0864889
     6   6 C     19   1 H                                 1.0774683 (min)
     9   6 C     20   1 H                                 1.0989984
     9   6 C     21   1 H                                 1.0989196
    10   6 C     22   1 H                                 1.0865011
    10   6 C     23   1 H                                 1.0863123
    10   6 C     24   1 H                                 1.0865213
    11   6 C     25   1 H                                 1.0776998
    12   6 C     26   1 H                                 1.0798903

 * 3 distinct bonds (by element types)

   Z      Z             #   av. dist./Å        max./Å        min./Å
   1 H    6 C          14     1.0876878     1.0990947     1.0774683
   6 C    6 C           8     1.4216135     1.5209051     1.3758263
   6 C    8 O           4     1.3866979     1.4134004     1.3587737


optimized geometry written to: xtbopt.xyz


           -------------------------------------------------
          | TOTAL ENERGY              -36.679626282598 Eh   |
          | GRADIENT NORM               0.000224799035 Eh/α |
          | HOMO-LUMO GAP               4.221886618736 eV   |
           -------------------------------------------------

------------------------------------------------------------------------
 * finished run on 2021/05/19 at 10:59:27.509     
------------------------------------------------------------------------
 total:
 * wall-time:     0 d,  0 h,  0 min,  0.835 sec
 *  cpu-time:     0 d,  0 h,  0 min,  0.835 sec
 * ratio c/w:     0.999 speedup
 SCF:
 * wall-time:     0 d,  0 h,  0 min,  0.032 sec
 *  cpu-time:     0 d,  0 h,  0 min,  0.032 sec
 * ratio c/w:     1.000 speedup
 ANC optimizer:
 * wall-time:     0 d,  0 h,  0 min,  0.782 sec
 *  cpu-time:     0 d,  0 h,  0 min,  0.782 sec
 * ratio c/w:     1.000 speedup

