      -----------------------------------------------------------      
     |                   =====================                   |     
     |                           x T B                           |     
     |                   =====================                   |     
     |                         S. Grimme                         |     
     |          Mulliken Center for Theoretical Chemistry        |     
     |                    University of Bonn                     |     
     |                Version 6.2 RC2 (SAW190805)                |     
      -----------------------------------------------------------      

   This program is distributed in the hope that it will be useful,
   but WITHOUT ANY WARRANTY; without even the implied warranty of
   MERCHANTABILITY or FITNESS FOR A PARTICULAR PURPOSE.
   
   FOR NON-COMMERCIAL, ACADEMIA USE ONLY.
   
   Cite this work as:
   * S. Grimme, C. Bannwarth, P. Shushkov, J. Chem. Theory Comput., 2017,
     13, 1989-2009. DOI: 10.1021/acs.jctc.7b00118
   * C. Bannwarth, S. Ehlert and S. Grimme., J. Chem. Theory Comput., 2019,
     15, 1652-1671. DOI: 10.1021/acs.jctc.8b01176
   * P. Pracht, E. Caldeweyher, S. Ehlert, S. Grimme, ChemRxiv, 2019, preprint.
     DOI: 10.26434/chemrxiv.8326202.v1
   
   for DFT-D4:
   * E. Caldeweyher, C. Bannwarth and S. Grimme, J. Chem. Phys., 2017,
     147, 034112. DOI: 10.1063/1.4993215
   * E. Caldeweyher, S. Ehlert, A. Hansen, H. Neugebauer, S. Spicher,
     C. Bannwarth and S. Grimme, J. Chem. Phys., 2019, 150, 154122.
     DOI: 10.1063/1.5090222
   
   for sTDA-xTB:
   * S. Grimme and C. Bannwarth, J. Chem. Phys., 2016, 145, 054103.
     DOI: 10.1063/1.4959605
   
   in the mass-spec context:
   * V. Asgeirsson, C. Bauer and S. Grimme, Chem. Sci., 2017, 8, 4879.
     DOI: 10.1039/c7sc00601b
   
   for metadynamics refer to:
   * S. Grimme, J. Chem. Theory Comput., 2019, 155, 2847-2862
     DOI: 10.1021/acs.jctc.9b00143
   
   with help from (in alphabetical order)
   C. Bannwarth, F. Bohle, G. Brandenburg, E. Caldeweyher, M. Checinski,
   S. Dohm, S. Ehlert, S. Ehrlich, F. März, H. Neugebauer, J. Pisarek,
   P. Pracht, P. Shushkov, and S. Spicher.
   
 * started run on 2021/05/19 at 10:59:29.702     

           -------------------------------------------------
          |                Calculation Setup                |
           -------------------------------------------------

          program call               : /ihome/ghutchison/geoffh/xtb/xtb 188.xyz -opt
          hostname                   : smp-n83
          coordinate file            : 188.xyz
          omp threads                :                     1
          number of atoms            :                    27
          number of electrons        :                    72
          charge                     :                     0
          spin                       :                   0.0
          first test random number   :      0.10705168503308


########################################################################
# WARNING! Please study the warnings concerning your input carefully
#  - the use of '-opt' is discouraged, please use '--opt' next time
########################################################################

           ------------------------------------------------- 
          |                 G F N 2 - x T B                 |
          | Geometry, Frequencies, Noncovalent interactions |
          |            JCTC 2019 parametrisation            |
           ------------------------------------------------- 
             KAB for C  - Si     :                1.0500
             KAB for H  - Pd     :                0.9500
             k(s)              :                1.8500
             k(p)              :                2.2300
             k(d)              :                2.2300
             k(f)              :                2.0000
             kEN (H0ij)        :               -2.0000
             D4 a1             :                0.5200
             D4 a2             :                5.0000
             D4 s6             :                1.0000
             D4 s8             :                2.7000
             D4 s9             :                5.0000
             alphaj            :                2.0000

  Z AO/shell   Hii/eV     exponent
  1     Wed Apr 25 08:07:45 CEST 2018   EN: 2.200 GM2: 0.406  GM3: 0.0800  RAES: 1.40
     1s    -10.707211    1.230000
  6     Wed Apr 25 08:07:45 CEST 2018   EN: 2.550 GM2: 0.538  GM3: 0.1500  RAES: 3.00
     2s    -13.970922    2.096432
     2p    -10.063292    1.800000

           ------------------------------------------------- 
          |        Self-Consistent Charge Iterations        |
           ------------------------------------------------- 

          ...................................................
          :                      SETUP                      :
          :.................................................:
          :  # basis functions                  72          :
          :  # atomic orbitals                  72          :
          :  # shells                           42          :
          :  # electrons                        72          :
          :  max. iterations                   250          :
          :  Hamiltonian                  GFN2-xTB          :
          :  restarted?                      false          :
          :  GBSA solvation                  false          :
          :  PC potential                    false          :
          :  electronic temp.          300.0000000     K    :
          :  accuracy                    1.0000000          :
          :  -> integral cutoff          0.2500000E+02      :
          :  -> integral neglect         0.1000000E-07      :
          :  -> SCF convergence          0.1000000E-05 Eh   :
          :  -> wf. convergence          0.1000000E-03 e    :
          :  Broyden damping             0.4000000          :
          ...................................................

 iter      E             dE          RMSdq      gap      omega  full diag
   1    -38.8933874 -0.388934E+02  0.463E+00    3.09       0.0  T
   2    -38.9147472 -0.213598E-01  0.274E+00    3.08       1.0  T
   3    -38.9087719  0.597530E-02  0.681E-01    3.08       1.0  T
   4    -38.9155760 -0.680405E-02  0.266E-01    3.07       1.0  T
   5    -38.9174247 -0.184876E-02  0.579E-02    3.08       1.0  T
   6    -38.9174812 -0.564516E-04  0.303E-02    3.08       1.0  T
   7    -38.9174841 -0.296454E-05  0.135E-02    3.08       1.4  T
   8    -38.9174859 -0.180077E-05  0.457E-03    3.08       4.2  T
   9    -38.9174864 -0.416246E-06  0.970E-04    3.08      19.8  T
  10    -38.9174864 -0.113691E-07  0.477E-04    3.08      40.3  T

   *** convergence criteria satisfied after 10 iterations ***

         #    Occupation            Energy/Eh            Energy/eV
      -------------------------------------------------------------
         1        2.0000           -0.6508522             -17.7106
       ...           ...                  ...                  ...
        30        2.0000           -0.4240176             -11.5381
        31        2.0000           -0.4148665             -11.2891
        32        2.0000           -0.4140873             -11.2679
        33        2.0000           -0.4027266             -10.9587
        34        2.0000           -0.3992231             -10.8634
        35        2.0000           -0.3905838             -10.6283
        36        2.0000           -0.3692512             -10.0478 (HOMO)
        37                         -0.2562111              -6.9719 (LUMO)
        38                         -0.2219550              -6.0397
        39                         -0.2200544              -5.9880
        40                         -0.2133951              -5.8068
        41                         -0.1663541              -4.5267
       ...                                ...                  ...
        72                          0.7244944              19.7145
      -------------------------------------------------------------
                  HL-Gap            0.1130401 Eh            3.0760 eV
             Fermi-level           -0.3127311 Eh           -8.5098 eV

 SCC (total)                   0 d,  0 h,  0 min,  0.040 sec
 SCC setup                      ...        0 min,  0.000 sec (  0.828%)
 Dispersion                     ...        0 min,  0.000 sec (  1.201%)
 integral evaluation            ...        0 min,  0.010 sec ( 25.517%)
 zeroth order Hamiltonian       ...        0 min,  0.000 sec (  0.445%)
 iterations                     ...        0 min,  0.013 sec ( 33.050%)
 molecular gradient             ...        0 min,  0.015 sec ( 37.706%)
 printout                       ...        0 min,  0.000 sec (  1.108%)

         :::::::::::::::::::::::::::::::::::::::::::::::::::::
         ::                     SUMMARY                     ::
         :::::::::::::::::::::::::::::::::::::::::::::::::::::
         :: total energy             -38.209584444146 Eh    ::
         :: gradient norm              0.044748055305 Eh/a0 ::
         :: HOMO-LUMO gap              3.075978279453 eV    ::
         ::.................................................::
         :: SCC energy               -38.917486361767 Eh    ::
         :: -> isotropic ES            0.002569573450 Eh    ::
         :: -> anisotropic ES          0.005400735066 Eh    ::
         :: -> anisotropic XC          0.026149946570 Eh    ::
         :: -> dispersion             -0.027903992661 Eh    ::
         :: repulsion energy           0.708009096275 Eh    ::
         :: add. restraining           0.000000000000 Eh    ::
         :::::::::::::::::::::::::::::::::::::::::::::::::::::

      ----------------------------------------------------------- 
     |                   =====================                   |
     |                        A N C O P T                        |
     |                   =====================                   |
     |               Approximate Normal Coordinate               |
     |                Rational Function Optimizer                |
      ----------------------------------------------------------- 

          ...................................................
          :                      SETUP                      :
          :.................................................:
          :   optimization level            normal          :
          :   max. optcycles                   200          :
          :   ANC micro-cycles                  20          :
          :   degrees of freedom                75          :
          :.................................................:
          :   RF solver                   davidson          :
          :   input Hessian                  false          :
          :   write xtbopt.log                true          :
          :   linear?                        false          :
          :   energy convergence         0.5000000E-05 Eh   :
          :   grad. convergence          0.1000000E-02 Eh/α :
          :   maximium RF displ.         2.0000000          :
          :   Hlow (freq-cutoff)         0.5000000E-02      :
          :   Hmax (freq-cutoff)         5.0000000          :
          :   S6 in model hess.         20.0000000          :
          ...................................................

generating ANC from model Hessian ...
Using Lindh-Hessian (1995)
 Shifting diagonal of input Hessian by   4.066181829536668E-003
 Lowest  eigenvalues of input Hessian
   -0.000000   -0.000000   -0.000000   -0.000000    0.000000    0.000000
    0.005000    0.006555    0.008001    0.008803    0.010214    0.012806
    0.015962    0.017554    0.020415    0.022282    0.023742    0.026470
 Highest eigenvalues
    1.848956    1.885887    1.898548    1.960221    1.992110    2.064006
 

........................................................................
.............................. CYCLE    1 ..............................
........................................................................
   1    -38.9174864 -0.389175E+02  0.161E-04    3.08       0.0  T
   2    -38.9174864 -0.113161E-09  0.107E-04    3.08     180.3  T
   3    -38.9174864 -0.999449E-10  0.637E-05    3.08     302.2  T
     SCC iter.                  ...        0 min,  0.004 sec
     gradient                   ...        0 min,  0.015 sec
 * total energy  :   -38.2095845 Eh     change       -0.3547550E-07 Eh
   gradient norm :     0.0447469 Eh/α   predicted     0.0000000E+00 (-100.00%)
   displ. norm   :     0.1755297 α      lambda       -0.4543225E-02
   maximum displ.:     0.0645074 α      in ANC's #37, #12, #21, ...

........................................................................
.............................. CYCLE    2 ..............................
........................................................................
   1    -38.9521438 -0.389521E+02  0.965E-02    3.11       0.0  T
   2    -38.9521527 -0.890586E-05  0.595E-02    3.11       1.0  T
   3    -38.9521417  0.109838E-04  0.290E-02    3.11       1.0  T
   4    -38.9521581 -0.163885E-04  0.446E-03    3.11       4.3  T
   5    -38.9521585 -0.408082E-06  0.217E-03    3.11       8.9  T
   6    -38.9521585 -0.299464E-07  0.814E-04    3.11      23.6  T
     SCC iter.                  ...        0 min,  0.008 sec
     gradient                   ...        0 min,  0.014 sec
 * total energy  :   -38.2123866 Eh     change       -0.2802090E-02 Eh
   gradient norm :     0.0130583 Eh/α   predicted    -0.2341605E-02 ( -16.43%)
   displ. norm   :     0.1202514 α      lambda       -0.4922723E-03
   maximum displ.:     0.0711570 α      in ANC's #5, #3, #2, ...

........................................................................
.............................. CYCLE    3 ..............................
........................................................................
   1    -38.9605436 -0.389605E+02  0.674E-02    3.11       0.0  T
   2    -38.9605460 -0.236432E-05  0.403E-02    3.11       1.0  T
   3    -38.9605418  0.415133E-05  0.152E-02    3.11       1.3  T
   4    -38.9605471 -0.528581E-05  0.170E-03    3.11      11.3  T
   5    -38.9605472 -0.548812E-07  0.773E-04    3.11      24.9  T
   6    -38.9605472 -0.367284E-08  0.297E-04    3.11      64.9  T
     SCC iter.                  ...        0 min,  0.007 sec
     gradient                   ...        0 min,  0.014 sec
 * total energy  :   -38.2126785 Eh     change       -0.2919796E-03 Eh
   gradient norm :     0.0041587 Eh/α   predicted    -0.2496989E-03 ( -14.48%)
   displ. norm   :     0.0978516 α      lambda       -0.1121843E-03
   maximum displ.:     0.0542278 α      in ANC's #5, #3, #2, ...

........................................................................
.............................. CYCLE    4 ..............................
........................................................................
   1    -38.9606446 -0.389606E+02  0.585E-02    3.09       0.0  T
   2    -38.9606452 -0.593573E-06  0.346E-02    3.09       1.0  T
   3    -38.9606433  0.183833E-05  0.836E-03    3.09       2.3  T
   4    -38.9606454 -0.210322E-05  0.129E-03    3.09      14.9  T
   5    -38.9606455 -0.378249E-07  0.412E-04    3.09      46.7  T
     SCC iter.                  ...        0 min,  0.006 sec
     gradient                   ...        0 min,  0.014 sec
 * total energy  :   -38.2127590 Eh     change       -0.8049328E-04 Eh
   gradient norm :     0.0025643 Eh/α   predicted    -0.5663783E-04 ( -29.64%)
   displ. norm   :     0.1449046 α      lambda       -0.1035476E-03
   maximum displ.:     0.0858809 α      in ANC's #3, #2, #5, ...

........................................................................
.............................. CYCLE    5 ..............................
........................................................................
   1    -38.9589471 -0.389589E+02  0.842E-02    3.07       0.0  T
   2    -38.9589477 -0.586504E-06  0.497E-02    3.07       1.0  T
   3    -38.9589458  0.181231E-05  0.795E-03    3.07       2.4  T
   4    -38.9589479 -0.209209E-05  0.122E-03    3.07      15.8  T
   5    -38.9589480 -0.326306E-07  0.433E-04    3.07      44.4  T
   6    -38.9589480 -0.110947E-08  0.220E-04    3.07      87.6  T
     SCC iter.                  ...        0 min,  0.007 sec
     gradient                   ...        0 min,  0.015 sec
 * total energy  :   -38.2128255 Eh     change       -0.6643084E-04 Eh
   gradient norm :     0.0039975 Eh/α   predicted    -0.5286106E-04 ( -20.43%)
   displ. norm   :     0.1254273 α      lambda       -0.7133900E-04
   maximum displ.:     0.0728211 α      in ANC's #2, #3, #5, ...

........................................................................
.............................. CYCLE    6 ..............................
........................................................................
   1    -38.9575609 -0.389576E+02  0.776E-02    3.06       0.0  T
   2    -38.9575611 -0.195675E-06  0.457E-02    3.06       1.0  T
   3    -38.9575605  0.541217E-06  0.505E-03    3.06       3.8  T
   4    -38.9575612 -0.666858E-06  0.784E-04    3.06      24.6  T
   5    -38.9575612 -0.534763E-08  0.451E-04    3.06      42.7  T
     SCC iter.                  ...        0 min,  0.006 sec
     gradient                   ...        0 min,  0.015 sec
 * total energy  :   -38.2128758 Eh     change       -0.5032914E-04 Eh
   gradient norm :     0.0042724 Eh/α   predicted    -0.3624356E-04 ( -27.99%)
   displ. norm   :     0.1498109 α      lambda       -0.7826742E-04
   maximum displ.:     0.0910556 α      in ANC's #2, #3, #4, ...

........................................................................
.............................. CYCLE    7 ..............................
........................................................................
   1    -38.9572155 -0.389572E+02  0.857E-02    3.05       0.0  T
   2    -38.9572158 -0.301727E-06  0.504E-02    3.05       1.0  T
   3    -38.9572151  0.719002E-06  0.611E-03    3.05       3.1  T
   4    -38.9572160 -0.902559E-06  0.531E-04    3.05      36.3  T
   5    -38.9572160 -0.207810E-08  0.312E-04    3.05      61.7  T
     SCC iter.                  ...        0 min,  0.006 sec
     gradient                   ...        0 min,  0.014 sec
 * total energy  :   -38.2129374 Eh     change       -0.6161550E-04 Eh
   gradient norm :     0.0034217 Eh/α   predicted    -0.4001385E-04 ( -35.06%)
   displ. norm   :     0.2031347 α      lambda       -0.9297136E-04
   maximum displ.:     0.1264788 α      in ANC's #2, #3, #4, ...

........................................................................
.............................. CYCLE    8 ..............................
........................................................................
   1    -38.9578104 -0.389578E+02  0.114E-01    3.04       0.0  T
   2    -38.9578110 -0.574533E-06  0.669E-02    3.04       1.0  T
   3    -38.9578099  0.108847E-05  0.761E-03    3.04       2.5  T
   4    -38.9578113 -0.139396E-05  0.771E-04    3.04      25.0  T
   5    -38.9578113 -0.754802E-08  0.421E-04    3.04      45.8  T
   6    -38.9578113 -0.392596E-09  0.228E-04    3.04      84.3  T
     SCC iter.                  ...        0 min,  0.007 sec
     gradient                   ...        0 min,  0.015 sec
 * total energy  :   -38.2130049 Eh     change       -0.6743395E-04 Eh
   gradient norm :     0.0029356 Eh/α   predicted    -0.4841220E-04 ( -28.21%)
   displ. norm   :     0.1928067 α      lambda       -0.6517599E-04
   maximum displ.:     0.1216007 α      in ANC's #2, #4, #3, ...

........................................................................
.............................. CYCLE    9 ..............................
........................................................................
   1    -38.9586714 -0.389587E+02  0.104E-01    3.03       0.0  T
   2    -38.9586718 -0.403742E-06  0.611E-02    3.03       1.0  T
   3    -38.9586715  0.295546E-06  0.475E-03    3.03       4.1  T
   4    -38.9586720 -0.495212E-06  0.672E-04    3.03      28.6  T
   5    -38.9586720 -0.213464E-08  0.357E-04    3.03      53.9  T
     SCC iter.                  ...        0 min,  0.006 sec
     gradient                   ...        0 min,  0.015 sec
 * total energy  :   -38.2130517 Eh     change       -0.4686110E-04 Eh
   gradient norm :     0.0030024 Eh/α   predicted    -0.3380139E-04 ( -27.87%)
   displ. norm   :     0.1832678 α      lambda       -0.5009993E-04
   maximum displ.:     0.1143955 α      in ANC's #2, #4, #1, ...

........................................................................
.............................. CYCLE   10 ..............................
........................................................................
   1    -38.9591714 -0.389592E+02  0.974E-02    3.02       0.0  T
   2    -38.9591717 -0.276031E-06  0.573E-02    3.02       1.0  T
   3    -38.9591710  0.680061E-06  0.580E-03    3.02       3.3  T
   4    -38.9591719 -0.874198E-06  0.669E-04    3.02      28.8  T
   5    -38.9591719 -0.232600E-08  0.422E-04    3.02      45.6  T
     SCC iter.                  ...        0 min,  0.006 sec
     gradient                   ...        0 min,  0.015 sec
 * total energy  :   -38.2130876 Eh     change       -0.3584641E-04 Eh
   gradient norm :     0.0025283 Eh/α   predicted    -0.2589591E-04 ( -27.76%)
   displ. norm   :     0.1637043 α      lambda       -0.3887410E-04
   maximum displ.:     0.0987283 α      in ANC's #2, #1, #4, ...

........................................................................
.............................. CYCLE   11 ..............................
........................................................................
   1    -38.9594929 -0.389595E+02  0.848E-02    3.02       0.0  T
   2    -38.9594931 -0.284915E-06  0.498E-02    3.02       1.0  T
   3    -38.9594926  0.517221E-06  0.441E-03    3.02       4.4  T
   4    -38.9594933 -0.684332E-06  0.791E-04    3.02      24.3  T
   5    -38.9594933 -0.404061E-08  0.436E-04    3.02      44.2  T
     SCC iter.                  ...        0 min,  0.006 sec
     gradient                   ...        0 min,  0.015 sec
 * total energy  :   -38.2131130 Eh     change       -0.2541773E-04 Eh
   gradient norm :     0.0013372 Eh/α   predicted    -0.1996320E-04 ( -21.46%)
   displ. norm   :     0.2619951 α      lambda       -0.2334218E-04
   maximum displ.:     0.1574402 α      in ANC's #2, #1, #4, ...

........................................................................
.............................. CYCLE   12 ..............................
........................................................................
   1    -38.9570242 -0.389570E+02  0.133E-01    3.00       0.0  T
   2    -38.9570249 -0.702099E-06  0.785E-02    3.00       1.0  T
   3    -38.9570221  0.278089E-05  0.112E-02    3.00       1.7  T
   4    -38.9570254 -0.329004E-05  0.116E-03    3.00      16.5  T
   5    -38.9570254 -0.147547E-07  0.641E-04    3.00      30.0  T
   6    -38.9570254 -0.196289E-08  0.257E-04    3.00      74.8  T
     SCC iter.                  ...        0 min,  0.007 sec
     gradient                   ...        0 min,  0.015 sec
 * total energy  :   -38.2130973 Eh     change        0.1572737E-04 Eh
   gradient norm :     0.0053065 Eh/α   predicted    -0.1203084E-04 (-176.50%)
   displ. norm   :     0.0504259 α      lambda       -0.7659783E-04
   maximum displ.:     0.0347513 α      in ANC's #1, #3, #10, ...

........................................................................
.............................. CYCLE   13 ..............................
........................................................................
   1    -38.9589785 -0.389590E+02  0.225E-02    3.01       0.0  T
   2    -38.9589786 -0.195792E-06  0.132E-02    3.01       1.5  T
   3    -38.9589782  0.452686E-06  0.422E-03    3.01       4.6  T
   4    -38.9589787 -0.530738E-06  0.818E-04    3.01      23.5  T
   5    -38.9589787 -0.833552E-08  0.406E-04    3.01      47.3  T
     SCC iter.                  ...        0 min,  0.006 sec
     gradient                   ...        0 min,  0.014 sec
 * total energy  :   -38.2131258 Eh     change       -0.2852569E-04 Eh
   gradient norm :     0.0033351 Eh/α   predicted    -0.3840603E-04 (  34.64%)
   displ. norm   :     0.0390102 α      lambda       -0.2898125E-04
   maximum displ.:     0.0225784 α      in ANC's #4, #2, #1, ...

........................................................................
.............................. CYCLE   14 ..............................
........................................................................
   1    -38.9591997 -0.389592E+02  0.187E-02    3.01       0.0  T
   2    -38.9591999 -0.161791E-06  0.111E-02    3.01       1.7  T
   3    -38.9591991  0.746975E-06  0.665E-03    3.01       2.9  T
   4    -38.9592000 -0.914146E-06  0.805E-04    3.01      23.9  T
   5    -38.9592000 -0.698949E-08  0.477E-04    3.01      40.3  T
     SCC iter.                  ...        0 min,  0.006 sec
     gradient                   ...        0 min,  0.015 sec
 * total energy  :   -38.2131386 Eh     change       -0.1282437E-04 Eh
   gradient norm :     0.0015055 Eh/α   predicted    -0.1451296E-04 (  13.17%)
   displ. norm   :     0.0589576 α      lambda        0.3870490E-04
   maximum displ.:     0.0338659 α      in ANC's #4, #2, #1, ...

........................................................................
.............................. CYCLE   15 ..............................
........................................................................
   1    -38.9594303 -0.389594E+02  0.283E-02    3.01       0.0  T
   2    -38.9594306 -0.345160E-06  0.168E-02    3.01       1.1  T
   3    -38.9594289  0.168978E-05  0.968E-03    3.01       2.0  T
   4    -38.9594310 -0.204364E-05  0.118E-03    3.01      16.2  T
   5    -38.9594310 -0.164412E-07  0.690E-04    3.01      27.9  T
   6    -38.9594310 -0.348978E-08  0.228E-04    3.01      84.6  T
     SCC iter.                  ...        0 min,  0.007 sec
     gradient                   ...        0 min,  0.015 sec
 * total energy  :   -38.2130986 Eh     change        0.3999252E-04 Eh
   gradient norm :     0.0062916 Eh/α   predicted     0.1937823E-04 ( -51.55%)
   displ. norm   :     0.0620450 α      lambda       -0.5997632E-04
   maximum displ.:     0.0336843 α      in ANC's #1, #2, #4, ...

........................................................................
.............................. CYCLE   16 ..............................
........................................................................
   1    -38.9593052 -0.389593E+02  0.289E-02    3.01       0.0  T
   2    -38.9593054 -0.172012E-06  0.170E-02    3.01       1.1  T
   3    -38.9593043  0.110118E-05  0.755E-03    3.01       2.5  T
   4    -38.9593055 -0.125797E-05  0.792E-04    3.01      24.3  T
   5    -38.9593055 -0.420489E-08  0.480E-04    3.01      40.1  T
     SCC iter.                  ...        0 min,  0.006 sec
     gradient                   ...        0 min,  0.014 sec
 * total energy  :   -38.2131396 Eh     change       -0.4098561E-04 Eh
   gradient norm :     0.0020852 Eh/α   predicted    -0.3010416E-04 ( -26.55%)
   displ. norm   :     0.1044416 α      lambda       -0.2225862E-04
   maximum displ.:     0.0657678 α      in ANC's #1, #2, #4, ...

........................................................................
.............................. CYCLE   17 ..............................
........................................................................
   1    -38.9588664 -0.389589E+02  0.543E-02    3.00       0.0  T
   2    -38.9588666 -0.230329E-06  0.321E-02    3.00       1.0  T
   3    -38.9588656  0.106669E-05  0.645E-03    3.00       3.0  T
   4    -38.9588668 -0.121824E-05  0.814E-04    3.00      23.7  T
   5    -38.9588668 -0.615680E-08  0.502E-04    3.00      38.3  T
   6    -38.9588668 -0.203663E-08  0.179E-04    3.00     107.6  T
     SCC iter.                  ...        0 min,  0.007 sec
     gradient                   ...        0 min,  0.015 sec
 * total energy  :   -38.2131472 Eh     change       -0.7639663E-05 Eh
   gradient norm :     0.0024649 Eh/α   predicted    -0.1125512E-04 (  47.32%)
   displ. norm   :     0.0366039 α      lambda       -0.1151141E-04
   maximum displ.:     0.0241694 α      in ANC's #1, #5, #2, ...

........................................................................
.............................. CYCLE   18 ..............................
........................................................................
   1    -38.9590920 -0.389591E+02  0.155E-02    3.01       0.0  T
   2    -38.9590921 -0.840602E-07  0.915E-03    3.01       2.1  T
   3    -38.9590920  0.140649E-06  0.275E-03    3.01       7.0  T
   4    -38.9590921 -0.157191E-06  0.546E-04    3.01      35.3  T
   5    -38.9590921 -0.515605E-08  0.161E-04    3.01     119.6  T
     SCC iter.                  ...        0 min,  0.006 sec
     gradient                   ...        0 min,  0.015 sec
 * total energy  :   -38.2131523 Eh     change       -0.5101979E-05 Eh
   gradient norm :     0.0016719 Eh/α   predicted    -0.5763695E-05 (  12.97%)
   displ. norm   :     0.0563825 α      lambda       -0.5649301E-05
   maximum displ.:     0.0414099 α      in ANC's #1, #2, #3, ...

........................................................................
.............................. CYCLE   19 ..............................
........................................................................
   1    -38.9592029 -0.389592E+02  0.268E-02    3.00       0.0  T
   2    -38.9592029 -0.350031E-07  0.157E-02    3.00       1.2  T
   3    -38.9592028  0.141439E-06  0.278E-03    3.00       6.9  T
   4    -38.9592029 -0.165512E-06  0.277E-04    3.00      69.4  T
   5    -38.9592029 -0.519428E-09  0.175E-04    3.00     109.7  T
     SCC iter.                  ...        0 min,  0.006 sec
     gradient                   ...        0 min,  0.015 sec
 * total energy  :   -38.2131589 Eh     change       -0.6600073E-05 Eh
   gradient norm :     0.0006280 Eh/α   predicted    -0.2830507E-05 ( -57.11%)
   displ. norm   :     0.1539799 α      lambda       -0.7885561E-05
   maximum displ.:     0.1083121 α      in ANC's #1, #2, #5, ...

........................................................................
.............................. CYCLE   20 ..............................
........................................................................
   1    -38.9588549 -0.389589E+02  0.729E-02    3.00       0.0  T
   2    -38.9588551 -0.164795E-06  0.429E-02    3.00       1.0  T
   3    -38.9588551 -0.189954E-07  0.186E-03    3.00      10.4  T
   4    -38.9588552 -0.652312E-07  0.409E-04    3.00      47.0  T
   5    -38.9588552 -0.270951E-09  0.197E-04    3.00      97.8  T
     SCC iter.                  ...        0 min,  0.007 sec
     gradient                   ...        0 min,  0.015 sec
 * total energy  :   -38.2131667 Eh     change       -0.7802649E-05 Eh
   gradient norm :     0.0013133 Eh/α   predicted    -0.3986100E-05 ( -48.91%)
   displ. norm   :     0.1543078 α      lambda       -0.6249329E-05
   maximum displ.:     0.1208352 α      in ANC's #1, #2, #5, ...
 * RMSD in coord.:     0.3874714 α      energy gain  -0.3582294E-02 Eh

generating ANC from model Hessian ...
Using Lindh-Hessian (1995)
 Shifting diagonal of input Hessian by   4.023787143044468E-003
 Lowest  eigenvalues of input Hessian
   -0.000000   -0.000000   -0.000000    0.000000    0.000000    0.000000
    0.005000    0.006772    0.008243    0.008949    0.010761    0.013386
    0.017046    0.019424    0.021130    0.022989    0.025700    0.028626
 Highest eigenvalues
    1.909559    1.943440    1.972644    2.024854    2.043959    2.115173
 

........................................................................
.............................. CYCLE   21 ..............................
........................................................................
   1    -38.9591088 -0.389591E+02  0.685E-02    3.00       0.0  T
   2    -38.9591090 -0.141042E-06  0.402E-02    3.00       1.0  T
   3    -38.9591090 -0.401850E-07  0.138E-03    3.00      14.0  T
   4    -38.9591090 -0.329452E-07  0.346E-04    3.00      55.6  T
   5    -38.9591090 -0.468816E-10  0.204E-04    3.00      94.3  T
     SCC iter.                  ...        0 min,  0.006 sec
     gradient                   ...        0 min,  0.015 sec
 * total energy  :   -38.2131720 Eh     change       -0.5305895E-05 Eh
   gradient norm :     0.0011859 Eh/α   predicted     0.0000000E+00 (-100.00%)
   displ. norm   :     0.0167641 α      lambda       -0.2351415E-05
   maximum displ.:     0.0112848 α      in ANC's #1, #5, #3, ...

........................................................................
.............................. CYCLE   22 ..............................
........................................................................
   1    -38.9593294 -0.389593E+02  0.786E-03    3.00       0.0  T
   2    -38.9593294 -0.132496E-07  0.467E-03    3.00       4.1  T
   3    -38.9593293  0.610814E-07  0.180E-03    3.00      10.7  T
   4    -38.9593294 -0.678842E-07  0.193E-04    3.00      99.5  T
   5    -38.9593294 -0.631196E-09  0.709E-05    3.00     271.6  T
     SCC iter.                  ...        0 min,  0.006 sec
     gradient                   ...        0 min,  0.015 sec
 * total energy  :   -38.2131738 Eh     change       -0.1740239E-05 Eh
   gradient norm :     0.0004152 Eh/α   predicted    -0.1182065E-05 ( -32.07%)
   displ. norm   :     0.0095109 α      lambda       -0.7154204E-06
   maximum displ.:     0.0045241 α      in ANC's #1, #5, #6, ...

   *** GEOMETRY OPTIMIZATION CONVERGED AFTER 22 ITERATIONS ***

------------------------------------------------------------------------
 total energy gain   :        -0.0035893 Eh       -2.2523 kcal/mol
 total RMSD          :         0.3887040 a0        0.2057 Å
 total power (kW/mol):        -0.4283550 (step)  -12.9750 (real)
------------------------------------------------------------------------

 ANCopt (total)                0 d,  0 h,  0 min,  0.726 sec
 optimizer setup                ...        0 min,  0.000 sec (  0.021%)
 model hessian                  ...        0 min,  0.010 sec (  1.344%)
 ANC generation                 ...        0 min,  0.002 sec (  0.215%)
 coordinate transformation      ...        0 min,  0.000 sec (  0.066%)
 single point calculation       ...        0 min,  0.706 sec ( 97.209%)
 optimization log               ...        0 min,  0.002 sec (  0.332%)
 hessian update                 ...        0 min,  0.000 sec (  0.043%)
 rational function              ...        0 min,  0.004 sec (  0.571%)

================
 final structure:
================
$coord
    6.52141638194771    0.24241856564192   -0.12423291476162      C 
    4.80858069656672    2.22981928544165   -0.14528212583901      C 
    2.26140555180919    1.68926495159641   -0.06627439889213      C 
    1.42022260445857   -0.82544205256000    0.03238096880461      C 
    3.13838666943820   -2.80225125887280    0.05312405042367      C 
    5.69360180380399   -2.24244818753645   -0.02577088175445      C 
   -1.32185807214912   -0.82140642866412    0.09855795179951      C 
   -2.16451506160185    1.69365745184849    0.04037974621841      C 
    0.04924616307067    3.46636662201571   -0.06621931661270      C 
   -4.70442223990675    2.24013859773557    0.08312077428431      C 
   -6.47184149688039    0.27374409872531    0.19637953983596      C 
   -5.60321636291640   -2.22148300117998    0.24560727397261      C 
   -3.05509642810386   -2.78460682479893    0.19706462055780      C 
   -9.14722694404722    0.91927154238532    0.25551096963662      C 
  -11.07510344778748   -0.65668208125676    0.56757426136711      C 
    8.52362518119186    0.63587547823659   -0.18506496931212      H 
    5.46700455920898    4.16158900578660   -0.22177111261182      H 
    2.49990145821540   -4.73907438307496    0.12968410504603      H 
    7.06193939830531   -3.75767583778468   -0.01053053413051      H 
    0.08988606306639    4.73483230365074    1.56331881776522      H 
    0.01027390922618    4.64175418324955   -1.76375706896535      H 
   -5.34917811724998    4.17921676314898    0.03747672923635      H 
   -6.95188140928426   -3.74921262286897    0.31233062600610      H 
   -2.42683095806540   -4.72625897743389    0.23365488621308      H 
   -9.53911554715928    2.91717756627517    0.03230774574564      H 
  -10.83487908254756   -2.66091711525706    0.81865570313232      H 
  -12.99522836802909    0.01567077753811    0.58941143390503      H 
$end
           -------------------------------------------------
          |                Final Singlepoint                |
           -------------------------------------------------

          ...................................................
          :                      SETUP                      :
          :.................................................:
          :  # basis functions                  72          :
          :  # atomic orbitals                  72          :
          :  # shells                           42          :
          :  # electrons                        72          :
          :  max. iterations                   250          :
          :  Hamiltonian                  GFN2-xTB          :
          :  restarted?                      false          :
          :  GBSA solvation                  false          :
          :  PC potential                    false          :
          :  electronic temp.          300.0000000     K    :
          :  accuracy                    1.0000000          :
          :  -> integral cutoff          0.2500000E+02      :
          :  -> integral neglect         0.1000000E-07      :
          :  -> SCF convergence          0.1000000E-05 Eh   :
          :  -> wf. convergence          0.1000000E-03 e    :
          :  Broyden damping             0.4000000          :
          ...................................................

 iter      E             dE          RMSdq      gap      omega  full diag
   1    -38.9593294 -0.389593E+02  0.304E-05    3.00       0.0  T
   2    -38.9593294 -0.454037E-11  0.136E-05    3.00    1417.2  T
   3    -38.9593294 -0.331113E-11  0.102E-05    3.00    1892.1  T

   *** convergence criteria satisfied after 3 iterations ***

         #    Occupation            Energy/Eh            Energy/eV
      -------------------------------------------------------------
         1        2.0000           -0.6530873             -17.7714
       ...           ...                  ...                  ...
        30        2.0000           -0.4252803             -11.5725
        31        2.0000           -0.4149279             -11.2908
        32        2.0000           -0.4125371             -11.2257
        33        2.0000           -0.4043852             -11.0039
        34        2.0000           -0.4014729             -10.9246
        35        2.0000           -0.3924146             -10.6781
        36        2.0000           -0.3690623             -10.0427 (HOMO)
        37                         -0.2588399              -7.0434 (LUMO)
        38                         -0.2192685              -5.9666
        39                         -0.2173264              -5.9138
        40                         -0.2115262              -5.7559
        41                         -0.1576344              -4.2895
       ...                                ...                  ...
        72                          0.7376665              20.0729
      -------------------------------------------------------------
                  HL-Gap            0.1102224 Eh            2.9993 eV
             Fermi-level           -0.3139511 Eh           -8.5430 eV

 SCC (total)                   0 d,  0 h,  0 min,  0.030 sec
 SCC setup                      ...        0 min,  0.000 sec (  0.749%)
 Dispersion                     ...        0 min,  0.000 sec (  0.849%)
 integral evaluation            ...        0 min,  0.010 sec ( 33.115%)
 zeroth order Hamiltonian       ...        0 min,  0.000 sec (  0.564%)
 iterations                     ...        0 min,  0.004 sec ( 14.325%)
 molecular gradient             ...        0 min,  0.015 sec ( 49.012%)
 printout                       ...        0 min,  0.000 sec (  1.211%)

         :::::::::::::::::::::::::::::::::::::::::::::::::::::
         ::                     SUMMARY                     ::
         :::::::::::::::::::::::::::::::::::::::::::::::::::::
         :: total energy             -38.213173779098 Eh    ::
         :: gradient norm              0.000415238482 Eh/a0 ::
         :: HOMO-LUMO gap              2.999304207827 eV    ::
         ::.................................................::
         :: SCC energy               -38.959329393079 Eh    ::
         :: -> isotropic ES            0.002620379169 Eh    ::
         :: -> anisotropic ES          0.005390556248 Eh    ::
         :: -> anisotropic XC          0.024524147103 Eh    ::
         :: -> dispersion             -0.028031521173 Eh    ::
         :: repulsion energy           0.746278209177 Eh    ::
         :: add. restraining           0.000000000000 Eh    ::
         :::::::::::::::::::::::::::::::::::::::::::::::::::::

           -------------------------------------------------
          |                Property Printout                |
           -------------------------------------------------

    * Orbital Energies and Occupations

         #    Occupation            Energy/Eh            Energy/eV
      -------------------------------------------------------------
         1        2.0000           -0.6530873             -17.7714
       ...           ...                  ...                  ...
        24        2.0000           -0.4693056             -12.7705
        25        2.0000           -0.4674354             -12.7196
        26        2.0000           -0.4630177             -12.5994
        27        2.0000           -0.4387588             -11.9392
        28        2.0000           -0.4361194             -11.8674
        29        2.0000           -0.4262850             -11.5998
        30        2.0000           -0.4252803             -11.5725
        31        2.0000           -0.4149279             -11.2908
        32        2.0000           -0.4125371             -11.2257
        33        2.0000           -0.4043852             -11.0039
        34        2.0000           -0.4014729             -10.9246
        35        2.0000           -0.3924146             -10.6781
        36        2.0000           -0.3690623             -10.0427 (HOMO)
        37                         -0.2588399              -7.0434 (LUMO)
        38                         -0.2192685              -5.9666
        39                         -0.2173264              -5.9138
        40                         -0.2115262              -5.7559
        41                         -0.1576344              -4.2895
        42                         -0.0944385              -2.5698
        43                         -0.0521801              -1.4199
        44                          0.0846140               2.3025
        45                          0.0950201               2.5856
        46                          0.1111960               3.0258
        47                          0.1155583               3.1445
       ...                                ...                  ...
        72                          0.7376665              20.0729
      -------------------------------------------------------------
                  HL-Gap            0.1102224 Eh            2.9993 eV
             Fermi-level           -0.3139511 Eh           -8.5430 eV

     #   Z        covCN         q      C6AA      α(0)
     1   6 C      2.922    -0.033    28.816     8.803
     2   6 C      2.914    -0.039    28.963     8.825
     3   6 C      3.050     0.005    27.853     8.656
     4   6 C      3.040     0.000    27.988     8.677
     5   6 C      2.914    -0.034    28.845     8.807
     6   6 C      2.921    -0.034    28.839     8.806
     7   6 C      3.040    -0.001    28.024     8.683
     8   6 C      3.045     0.004    27.888     8.661
     9   6 C      3.844    -0.067    21.742     6.633
    10   6 C      2.923    -0.044    29.096     8.846
    11   6 C      2.972     0.011    27.768     8.644
    12   6 C      2.925    -0.037    28.925     8.820
    13   6 C      2.912    -0.035    28.874     8.811
    14   6 C      2.896    -0.030    28.744     8.790
    15   6 C      2.837    -0.087    30.169     9.001
    16   1 H      0.926     0.029     2.606     2.524
    17   1 H      0.926     0.027     2.634     2.538
    18   1 H      0.926     0.030     2.592     2.518
    19   1 H      0.926     0.028     2.611     2.527
    20   1 H      0.924     0.055     2.257     2.349
    21   1 H      0.924     0.055     2.259     2.350
    22   1 H      0.925     0.027     2.624     2.533
    23   1 H      0.926     0.034     2.528     2.487
    24   1 H      0.926     0.030     2.589     2.516
    25   1 H      0.925     0.032     2.556     2.500
    26   1 H      0.926     0.038     2.476     2.461
    27   1 H      0.926     0.035     2.515     2.480

 Mol. C6AA /au·bohr⁶  :       9715.477263
 Mol. C8AA /au·bohr⁸  :     243946.574645
 Mol. α(0) /au        :        159.246868


Wiberg/Mayer (AO) data.
largest (>0.10) Wiberg bond orders for each atom
          total WBO             WBO to atom ...
     1  C   3.968        C    6 1.435    C    2 1.425    H   16 0.972
     2  C   3.992        C    3 1.443    C    1 1.425    H   17 0.970    C    5 0.104
     3  C   3.983        C    2 1.443    C    4 1.325    C    9 1.016    C    6 0.101
     4  C   3.988        C    5 1.390    C    3 1.325    C    7 1.091
     5  C   3.977        C    6 1.446    C    4 1.390    H   18 0.969    C    2 0.104
     6  C   3.992        C    5 1.446    C    1 1.435    H   19 0.971    C    3 0.101
     7  C   3.989        C   13 1.378    C    8 1.319    C    4 1.091
     8  C   3.987        C   10 1.461    C    7 1.319    C    9 1.015
     9  C   3.998        C    3 1.016    C    8 1.015    H   21 0.946    H   20 0.946
    10  C   3.991        C    8 1.461    C   11 1.359    H   22 0.967
    11  C   3.970        C   12 1.367    C   10 1.359    C   14 1.097
    12  C   3.991        C   13 1.469    C   11 1.367    H   23 0.966
    13  C   3.981        C   12 1.469    C    7 1.378    H   24 0.969
    14  C   3.990        C   15 1.894    C   11 1.097    H   25 0.965
    15  C   3.979        C   14 1.894    H   27 0.978    H   26 0.973
    16  H   0.999        C    1 0.972
    17  H   0.999        C    2 0.970
    18  H   0.999        C    5 0.969
    19  H   0.998        C    6 0.971
    20  H   0.997        C    9 0.946
    21  H   0.997        C    9 0.946
    22  H   0.999        C   10 0.967
    23  H   0.998        C   12 0.966
    24  H   0.999        C   13 0.969
    25  H   0.999        C   14 0.965
    26  H   0.999        C   15 0.973
    27  H   0.998        C   15 0.978

molecular dipole:
                 x           y           z       tot (Debye)
 q only:        0.032       0.215      -0.009
   full:        0.040       0.264      -0.008       0.679
molecular quadrupole (traceless):
                xx          xy          yy          xz          yz          zz
 q only:       -0.619       0.083       3.058      -0.046      -0.219      -2.439
  q+dip:        2.584       0.192       8.090      -0.436      -0.857     -10.674
   full:       -0.038       0.044       5.028      -0.167      -0.438      -4.990

           -------------------------------------------------
          |                Geometry Summary                 |
           -------------------------------------------------

      molecular mass/u    :      192.2598000
   center of mass at/Å    :       -0.7174391       0.0178212       0.0486231
  moments of inertia/u·Å² :        0.2378720E+03   0.1533745E+04   0.1768129E+04
rotational constants/cm⁻¹ :        0.7086850E-01   0.1099116E-01   0.9534162E-02

 * 25 selected distances

     #   Z        #   Z                                     value/Å
     1   6 C      2   6 C                                 1.3884235
     2   6 C      3   6 C                                 1.3785593
     3   6 C      4   6 C                                 1.4041729 (max)
     4   6 C      5   6 C                                 1.3860296
     1   6 C      6   6 C                                 1.3869629
     5   6 C      6   6 C                                 1.3848609
     7   6 C      8   6 C                                 1.4039664
     8   6 C     10   6 C                                 1.3750055
    10   6 C     11   6 C                                 1.4004020
    11   6 C     12   6 C                                 1.3983794
     7   6 C     13   6 C                                 1.3868054
    12   6 C     13   6 C                                 1.3811810
    14   6 C     15   6 C                                 1.3279841
     1   6 C     16   1 H                                 1.0802670
     2   6 C     17   1 H                                 1.0807539
     5   6 C     18   1 H                                 1.0799377
     6   6 C     19   1 H                                 1.0804155
     9   6 C     20   1 H                                 1.0929850
     9   6 C     21   1 H                                 1.0928105
    10   6 C     22   1 H                                 1.0816230
    12   6 C     23   1 H                                 1.0789647
    13   6 C     24   1 H                                 1.0801011
    14   6 C     25   1 H                                 1.0838482
    15   6 C     26   1 H                                 1.0764183 (min)
    15   6 C     27   1 H                                 1.0766404

 * 2 distinct bonds (by element types)

   Z      Z             #   av. dist./Å        max./Å        min./Å
   1 H    6 C          12     1.0820638     1.0929850     1.0764183
   6 C    6 C          13     1.3848256     1.4041729     1.3279841


optimized geometry written to: xtbopt.xyz


           -------------------------------------------------
          | TOTAL ENERGY              -38.213173779098 Eh   |
          | GRADIENT NORM               0.000415238482 Eh/α |
          | HOMO-LUMO GAP               2.999304207827 eV   |
           -------------------------------------------------

------------------------------------------------------------------------
 * finished run on 2021/05/19 at 10:59:30.523     
------------------------------------------------------------------------
 total:
 * wall-time:     0 d,  0 h,  0 min,  0.820 sec
 *  cpu-time:     0 d,  0 h,  0 min,  0.820 sec
 * ratio c/w:     0.999 speedup
 SCF:
 * wall-time:     0 d,  0 h,  0 min,  0.040 sec
 *  cpu-time:     0 d,  0 h,  0 min,  0.040 sec
 * ratio c/w:     0.998 speedup
 ANC optimizer:
 * wall-time:     0 d,  0 h,  0 min,  0.757 sec
 *  cpu-time:     0 d,  0 h,  0 min,  0.757 sec
 * ratio c/w:     1.000 speedup

