      -----------------------------------------------------------      
     |                   =====================                   |     
     |                           x T B                           |     
     |                   =====================                   |     
     |                         S. Grimme                         |     
     |          Mulliken Center for Theoretical Chemistry        |     
     |                    University of Bonn                     |     
     |                Version 6.2 RC2 (SAW190805)                |     
      -----------------------------------------------------------      

   This program is distributed in the hope that it will be useful,
   but WITHOUT ANY WARRANTY; without even the implied warranty of
   MERCHANTABILITY or FITNESS FOR A PARTICULAR PURPOSE.
   
   FOR NON-COMMERCIAL, ACADEMIA USE ONLY.
   
   Cite this work as:
   * S. Grimme, C. Bannwarth, P. Shushkov, J. Chem. Theory Comput., 2017,
     13, 1989-2009. DOI: 10.1021/acs.jctc.7b00118
   * C. Bannwarth, S. Ehlert and S. Grimme., J. Chem. Theory Comput., 2019,
     15, 1652-1671. DOI: 10.1021/acs.jctc.8b01176
   * P. Pracht, E. Caldeweyher, S. Ehlert, S. Grimme, ChemRxiv, 2019, preprint.
     DOI: 10.26434/chemrxiv.8326202.v1
   
   for DFT-D4:
   * E. Caldeweyher, C. Bannwarth and S. Grimme, J. Chem. Phys., 2017,
     147, 034112. DOI: 10.1063/1.4993215
   * E. Caldeweyher, S. Ehlert, A. Hansen, H. Neugebauer, S. Spicher,
     C. Bannwarth and S. Grimme, J. Chem. Phys., 2019, 150, 154122.
     DOI: 10.1063/1.5090222
   
   for sTDA-xTB:
   * S. Grimme and C. Bannwarth, J. Chem. Phys., 2016, 145, 054103.
     DOI: 10.1063/1.4959605
   
   in the mass-spec context:
   * V. Asgeirsson, C. Bauer and S. Grimme, Chem. Sci., 2017, 8, 4879.
     DOI: 10.1039/c7sc00601b
   
   for metadynamics refer to:
   * S. Grimme, J. Chem. Theory Comput., 2019, 155, 2847-2862
     DOI: 10.1021/acs.jctc.9b00143
   
   with help from (in alphabetical order)
   C. Bannwarth, F. Bohle, G. Brandenburg, E. Caldeweyher, M. Checinski,
   S. Dohm, S. Ehlert, S. Ehrlich, F. März, H. Neugebauer, J. Pisarek,
   P. Pracht, P. Shushkov, and S. Spicher.
   
 * started run on 2021/05/19 at 10:59:32.834     

           -------------------------------------------------
          |                Calculation Setup                |
           -------------------------------------------------

          program call               : /ihome/ghutchison/geoffh/xtb/xtb 193.xyz -opt
          hostname                   : smp-n83
          coordinate file            : 193.xyz
          omp threads                :                     1
          number of atoms            :                    23
          number of electrons        :                    70
          charge                     :                     0
          spin                       :                   0.0
          first test random number   :      0.82411199624162


########################################################################
# WARNING! Please study the warnings concerning your input carefully
#  - the use of '-opt' is discouraged, please use '--opt' next time
########################################################################

           ------------------------------------------------- 
          |                 G F N 2 - x T B                 |
          | Geometry, Frequencies, Noncovalent interactions |
          |            JCTC 2019 parametrisation            |
           ------------------------------------------------- 
             KAB for C  - Si     :                1.0500
             KAB for H  - Pd     :                0.9500
             k(s)              :                1.8500
             k(p)              :                2.2300
             k(d)              :                2.2300
             k(f)              :                2.0000
             kEN (H0ij)        :               -2.0000
             D4 a1             :                0.5200
             D4 a2             :                5.0000
             D4 s6             :                1.0000
             D4 s8             :                2.7000
             D4 s9             :                5.0000
             alphaj            :                2.0000

  Z AO/shell   Hii/eV     exponent
  1     Wed Apr 25 08:07:45 CEST 2018   EN: 2.200 GM2: 0.406  GM3: 0.0800  RAES: 1.40
     1s    -10.707211    1.230000
  6     Wed Apr 25 08:07:45 CEST 2018   EN: 2.550 GM2: 0.538  GM3: 0.1500  RAES: 3.00
     2s    -13.970922    2.096432
     2p    -10.063292    1.800000
  9     Mon Apr 23 13:58:50 CEST 2018   EN: 3.980 GM2: 0.532  GM3: 0.1426  RAES: 2.40
     2s    -23.458179    2.416361
     2p    -15.746583    2.308399
 16     Tue Apr 24 11:44:34 CEST 2018   EN: 2.580 GM2: 0.340  GM3:-0.0502  RAES: 3.10
     3s    -20.029654    1.981333
     3p    -11.377694    2.025643
     3d     -0.420282    1.702555

           ------------------------------------------------- 
          |        Self-Consistent Charge Iterations        |
           ------------------------------------------------- 

          ...................................................
          :                      SETUP                      :
          :.................................................:
          :  # basis functions                  68          :
          :  # atomic orbitals                  67          :
          :  # shells                           37          :
          :  # electrons                        70          :
          :  max. iterations                   250          :
          :  Hamiltonian                  GFN2-xTB          :
          :  restarted?                      false          :
          :  GBSA solvation                  false          :
          :  PC potential                    false          :
          :  electronic temp.          300.0000000     K    :
          :  accuracy                    1.0000000          :
          :  -> integral cutoff          0.2500000E+02      :
          :  -> integral neglect         0.1000000E-07      :
          :  -> SCF convergence          0.1000000E-05 Eh   :
          :  -> wf. convergence          0.1000000E-03 e    :
          :  Broyden damping             0.4000000          :
          ...................................................

 iter      E             dE          RMSdq      gap      omega  full diag
   1    -39.6125973 -0.396126E+02  0.421E+00    3.07       0.0  T
   2    -39.6543554 -0.417581E-01  0.235E+00    3.12       1.0  T
   3    -39.6551416 -0.786222E-03  0.800E-01    3.10       1.0  T
   4    -39.6560301 -0.888490E-03  0.269E-01    3.10       1.0  T
   5    -39.6566057 -0.575576E-03  0.140E-01    3.10       1.0  T
   6    -39.6568048 -0.199173E-03  0.489E-02    3.10       1.0  T
   7    -39.6568210 -0.161175E-04  0.214E-02    3.10       1.0  T
   8    -39.6568227 -0.175413E-05  0.116E-02    3.10       1.8  T
   9    -39.6568233 -0.578670E-06  0.446E-03    3.10       4.7  T
  10    -39.6568235 -0.219624E-06  0.174E-03    3.10      12.0  T
  11    -39.6568235 -0.153947E-07  0.785E-04    3.10      26.5  T
  12    -39.6568235 -0.151692E-08  0.522E-04    3.10      40.0  T

   *** convergence criteria satisfied after 12 iterations ***

         #    Occupation            Energy/Eh            Energy/eV
      -------------------------------------------------------------
         1        2.0000           -0.8167388             -22.2246
       ...           ...                  ...                  ...
        29        2.0000           -0.4581793             -12.4677
        30        2.0000           -0.4546856             -12.3726
        31        2.0000           -0.4494534             -12.2302
        32        2.0000           -0.4371268             -11.8948
        33        2.0000           -0.4366363             -11.8815
        34        2.0000           -0.3998087             -10.8793
        35        2.0000           -0.3857142             -10.4958 (HOMO)
        36                         -0.2718068              -7.3962 (LUMO)
        37                         -0.2167335              -5.8976
        38                         -0.2081714              -5.6646
        39                         -0.1711822              -4.6581
        40                         -0.1211412              -3.2964
       ...                                ...                  ...
        67                          0.6534342              17.7808
      -------------------------------------------------------------
                  HL-Gap            0.1139074 Eh            3.0996 eV
             Fermi-level           -0.3287605 Eh           -8.9460 eV

 SCC (total)                   0 d,  0 h,  0 min,  0.038 sec
 SCC setup                      ...        0 min,  0.000 sec (  0.846%)
 Dispersion                     ...        0 min,  0.000 sec (  0.854%)
 integral evaluation            ...        0 min,  0.009 sec ( 24.308%)
 zeroth order Hamiltonian       ...        0 min,  0.000 sec (  0.465%)
 iterations                     ...        0 min,  0.014 sec ( 37.663%)
 molecular gradient             ...        0 min,  0.013 sec ( 34.707%)
 printout                       ...        0 min,  0.000 sec (  1.010%)

         :::::::::::::::::::::::::::::::::::::::::::::::::::::
         ::                     SUMMARY                     ::
         :::::::::::::::::::::::::::::::::::::::::::::::::::::
         :: total energy             -39.203263738285 Eh    ::
         :: gradient norm              0.050519116663 Eh/a0 ::
         :: HOMO-LUMO gap              3.099578379836 eV    ::
         ::.................................................::
         :: SCC energy               -39.656823522100 Eh    ::
         :: -> isotropic ES            0.030102371782 Eh    ::
         :: -> anisotropic ES          0.000426650339 Eh    ::
         :: -> anisotropic XC          0.004760104797 Eh    ::
         :: -> dispersion             -0.022587158565 Eh    ::
         :: repulsion energy           0.453413998116 Eh    ::
         :: add. restraining           0.000000000000 Eh    ::
         :::::::::::::::::::::::::::::::::::::::::::::::::::::

      ----------------------------------------------------------- 
     |                   =====================                   |
     |                        A N C O P T                        |
     |                   =====================                   |
     |               Approximate Normal Coordinate               |
     |                Rational Function Optimizer                |
      ----------------------------------------------------------- 

          ...................................................
          :                      SETUP                      :
          :.................................................:
          :   optimization level            normal          :
          :   max. optcycles                   200          :
          :   ANC micro-cycles                  20          :
          :   degrees of freedom                63          :
          :.................................................:
          :   RF solver                   davidson          :
          :   input Hessian                  false          :
          :   write xtbopt.log                true          :
          :   linear?                        false          :
          :   energy convergence         0.5000000E-05 Eh   :
          :   grad. convergence          0.1000000E-02 Eh/α :
          :   maximium RF displ.         2.0000000          :
          :   Hlow (freq-cutoff)         0.5000000E-02      :
          :   Hmax (freq-cutoff)         5.0000000          :
          :   S6 in model hess.         20.0000000          :
          ...................................................

generating ANC from model Hessian ...
Using Lindh-Hessian (1995)
 Shifting diagonal of input Hessian by   3.338824242504797E-003
 Lowest  eigenvalues of input Hessian
   -0.000000   -0.000000    0.000000    0.000000    0.000000    0.000000
    0.005000    0.007048    0.008734    0.009930    0.012322    0.017785
    0.019244    0.023753    0.028454    0.033476    0.033838    0.041870
 Highest eigenvalues
    1.503525    1.533777    1.634835    1.781157    1.834065    1.976173
 

........................................................................
.............................. CYCLE    1 ..............................
........................................................................
   1    -39.6568235 -0.396568E+02  0.210E-04    3.10       0.0  T
   2    -39.6568235 -0.781952E-10  0.158E-04    3.10     131.8  T
   3    -39.6568235 -0.155914E-09  0.992E-05    3.10     210.1  T
     SCC iter.                  ...        0 min,  0.004 sec
     gradient                   ...        0 min,  0.013 sec
 * total energy  :   -39.2032637 Eh     change        0.1229030E-07 Eh
   gradient norm :     0.0505194 Eh/α   predicted     0.0000000E+00 (-100.00%)
   displ. norm   :     0.2105612 α      lambda       -0.4039247E-02
   maximum displ.:     0.0918734 α      in ANC's #6, #14, #3, ...

........................................................................
.............................. CYCLE    2 ..............................
........................................................................
   1    -39.6712524 -0.396713E+02  0.192E-01    3.15       0.0  T
   2    -39.6712839 -0.315110E-04  0.105E-01    3.15       1.0  T
   3    -39.6712470  0.368650E-04  0.629E-02    3.15       1.0  T
   4    -39.6713201 -0.730321E-04  0.191E-02    3.15       1.1  T
   5    -39.6713215 -0.142233E-05  0.940E-03    3.15       2.2  T
   6    -39.6713222 -0.715634E-06  0.314E-03    3.15       6.6  T
   7    -39.6713224 -0.162204E-06  0.689E-04    3.15      30.3  T
     SCC iter.                  ...        0 min,  0.008 sec
     gradient                   ...        0 min,  0.012 sec
 * total energy  :   -39.2060008 Eh     change       -0.2737081E-02 Eh
   gradient norm :     0.0186552 Eh/α   predicted    -0.2109189E-02 ( -22.94%)
   displ. norm   :     0.2017146 α      lambda       -0.1057366E-02
   maximum displ.:     0.1003011 α      in ANC's #6, #4, #2, ...

........................................................................
.............................. CYCLE    3 ..............................
........................................................................
   1    -39.6757886 -0.396758E+02  0.152E-01    3.17       0.0  T
   2    -39.6757999 -0.112736E-04  0.855E-02    3.17       1.0  T
   3    -39.6757671  0.328267E-04  0.488E-02    3.17       1.0  T
   4    -39.6758121 -0.450431E-04  0.134E-02    3.17       1.6  T
   5    -39.6758126 -0.495520E-06  0.608E-03    3.17       3.4  T
   6    -39.6758131 -0.431718E-06  0.184E-03    3.17      11.4  T
   7    -39.6758131 -0.532018E-07  0.561E-04    3.17      37.2  T
     SCC iter.                  ...        0 min,  0.008 sec
     gradient                   ...        0 min,  0.012 sec
 * total energy  :   -39.2066257 Eh     change       -0.6248787E-03 Eh
   gradient norm :     0.0048066 Eh/α   predicted    -0.5502078E-03 ( -11.95%)
   displ. norm   :     0.1402933 α      lambda       -0.2107062E-03
   maximum displ.:     0.0736438 α      in ANC's #4, #6, #2, ...

........................................................................
.............................. CYCLE    4 ..............................
........................................................................
   1    -39.6752005 -0.396752E+02  0.947E-02    3.16       0.0  T
   2    -39.6752017 -0.122068E-05  0.547E-02    3.16       1.0  T
   3    -39.6751990  0.267184E-05  0.139E-02    3.16       1.5  T
   4    -39.6752021 -0.311213E-05  0.519E-03    3.16       4.0  T
   5    -39.6752023 -0.191797E-06  0.125E-03    3.16      16.6  T
   6    -39.6752023 -0.104384E-07  0.507E-04    3.16      41.1  T
     SCC iter.                  ...        0 min,  0.007 sec
     gradient                   ...        0 min,  0.012 sec
 * total energy  :   -39.2067780 Eh     change       -0.1522702E-03 Eh
   gradient norm :     0.0043905 Eh/α   predicted    -0.1074638E-03 ( -29.43%)
   displ. norm   :     0.1955869 α      lambda       -0.1971247E-03
   maximum displ.:     0.1009376 α      in ANC's #4, #2, #1, ...

........................................................................
.............................. CYCLE    5 ..............................
........................................................................
   1    -39.6736159 -0.396736E+02  0.129E-01    3.14       0.0  T
   2    -39.6736178 -0.191723E-05  0.739E-02    3.14       1.0  T
   3    -39.6736169  0.900286E-06  0.120E-02    3.14       1.7  T
   4    -39.6736182 -0.130886E-05  0.638E-03    3.14       3.3  T
   5    -39.6736186 -0.382006E-06  0.102E-03    3.14      20.4  T
   6    -39.6736186 -0.105051E-07  0.592E-04    3.14      35.2  T
     SCC iter.                  ...        0 min,  0.007 sec
     gradient                   ...        0 min,  0.012 sec
 * total energy  :   -39.2068987 Eh     change       -0.1207488E-03 Eh
   gradient norm :     0.0049152 Eh/α   predicted    -0.1023338E-03 ( -15.25%)
   displ. norm   :     0.1185161 α      lambda       -0.9225863E-04
   maximum displ.:     0.0633600 α      in ANC's #1, #4, #2, ...

........................................................................
.............................. CYCLE    6 ..............................
........................................................................
   1    -39.6734882 -0.396735E+02  0.826E-02    3.13       0.0  T
   2    -39.6734890 -0.873307E-06  0.480E-02    3.13       1.0  T
   3    -39.6734840  0.506947E-05  0.167E-02    3.13       1.2  T
   4    -39.6734898 -0.582192E-05  0.372E-03    3.13       5.6  T
   5    -39.6734898 -0.189954E-07  0.148E-03    3.13      14.1  T
   6    -39.6734898 -0.363574E-07  0.446E-04    3.13      46.8  T
     SCC iter.                  ...        0 min,  0.007 sec
     gradient                   ...        0 min,  0.012 sec
 * total energy  :   -39.2069573 Eh     change       -0.5855553E-04 Eh
   gradient norm :     0.0039555 Eh/α   predicted    -0.4680501E-04 ( -20.07%)
   displ. norm   :     0.0823439 α      lambda       -0.5187031E-04
   maximum displ.:     0.0471098 α      in ANC's #1, #2, #4, ...

........................................................................
.............................. CYCLE    7 ..............................
........................................................................
   1    -39.6743309 -0.396743E+02  0.533E-02    3.13       0.0  T
   2    -39.6743315 -0.569340E-06  0.306E-02    3.13       1.0  T
   3    -39.6743290  0.247021E-05  0.123E-02    3.13       1.7  T
   4    -39.6743319 -0.286310E-05  0.272E-03    3.13       7.7  T
   5    -39.6743319 -0.305326E-07  0.978E-04    3.13      21.3  T
   6    -39.6743319 -0.850078E-08  0.398E-04    3.13      52.3  T
     SCC iter.                  ...        0 min,  0.007 sec
     gradient                   ...        0 min,  0.013 sec
 * total energy  :   -39.2069938 Eh     change       -0.3653175E-04 Eh
   gradient norm :     0.0024159 Eh/α   predicted    -0.2611250E-04 ( -28.52%)
   displ. norm   :     0.0741159 α      lambda       -0.3003920E-04
   maximum displ.:     0.0406771 α      in ANC's #1, #3, #2, ...

........................................................................
.............................. CYCLE    8 ..............................
........................................................................
   1    -39.6749671 -0.396750E+02  0.472E-02    3.12       0.0  T
   2    -39.6749675 -0.399339E-06  0.271E-02    3.12       1.0  T
   3    -39.6749662  0.134022E-05  0.980E-03    3.12       2.1  T
   4    -39.6749677 -0.152767E-05  0.222E-03    3.12       9.4  T
   5    -39.6749677 -0.290343E-07  0.670E-04    3.12      31.1  T
   6    -39.6749677 -0.260283E-08  0.218E-04    3.12      95.7  T
     SCC iter.                  ...        0 min,  0.007 sec
     gradient                   ...        0 min,  0.013 sec
 * total energy  :   -39.2070146 Eh     change       -0.2084481E-04 Eh
   gradient norm :     0.0013915 Eh/α   predicted    -0.1510422E-04 ( -27.54%)
   displ. norm   :     0.0937136 α      lambda       -0.1582746E-04
   maximum displ.:     0.0527583 α      in ANC's #3, #2, #1, ...

........................................................................
.............................. CYCLE    9 ..............................
........................................................................
   1    -39.6751720 -0.396752E+02  0.572E-02    3.12       0.0  T
   2    -39.6751724 -0.356274E-06  0.329E-02    3.12       1.0  T
   3    -39.6751709  0.155313E-05  0.103E-02    3.12       2.0  T
   4    -39.6751726 -0.176459E-05  0.236E-03    3.12       8.8  T
   5    -39.6751726 -0.211998E-07  0.791E-04    3.12      26.4  T
   6    -39.6751726 -0.888099E-08  0.226E-04    3.12      92.1  T
     SCC iter.                  ...        0 min,  0.007 sec
     gradient                   ...        0 min,  0.013 sec
 * total energy  :   -39.2070299 Eh     change       -0.1528948E-04 Eh
   gradient norm :     0.0020417 Eh/α   predicted    -0.7946162E-05 ( -48.03%)
   displ. norm   :     0.0417340 α      lambda       -0.1086137E-04
   maximum displ.:     0.0256131 α      in ANC's #3, #2, #1, ...

........................................................................
.............................. CYCLE   10 ..............................
........................................................................
   1    -39.6751468 -0.396751E+02  0.260E-02    3.11       0.0  T
   2    -39.6751468 -0.616316E-07  0.153E-02    3.11       1.4  T
   3    -39.6751463  0.502786E-06  0.533E-03    3.11       3.9  T
   4    -39.6751469 -0.569337E-06  0.863E-04    3.11      24.1  T
   5    -39.6751469  0.341437E-09  0.453E-04    3.11      46.0  T
     SCC iter.                  ...        0 min,  0.006 sec
     gradient                   ...        0 min,  0.013 sec
 * total energy  :   -39.2070391 Eh     change       -0.9174636E-05 Eh
   gradient norm :     0.0018168 Eh/α   predicted    -0.5441364E-05 ( -40.69%)
   displ. norm   :     0.1808545 α      lambda       -0.2452549E-04
   maximum displ.:     0.1174625 α      in ANC's #2, #3, #1, ...

........................................................................
.............................. CYCLE   11 ..............................
........................................................................
   1    -39.6742068 -0.396742E+02  0.111E-01    3.10       0.0  T
   2    -39.6742081 -0.134933E-05  0.649E-02    3.10       1.0  T
   3    -39.6742040  0.409003E-05  0.160E-02    3.10       1.3  T
   4    -39.6742089 -0.483479E-05  0.449E-03    3.10       4.6  T
   5    -39.6742089 -0.462412E-07  0.183E-03    3.10      11.4  T
   6    -39.6742090 -0.506667E-07  0.630E-04    3.10      33.1  T
   7    -39.6742090 -0.357354E-08  0.312E-04    3.10      66.8  T
     SCC iter.                  ...        0 min,  0.008 sec
     gradient                   ...        0 min,  0.013 sec
 * total energy  :   -39.2070552 Eh     change       -0.1605071E-04 Eh
   gradient norm :     0.0017626 Eh/α   predicted    -0.1244151E-04 ( -22.49%)
   displ. norm   :     0.0291448 α      lambda       -0.8203074E-05
   maximum displ.:     0.0236751 α      in ANC's #4, #6, #5, ...

........................................................................
.............................. CYCLE   12 ..............................
........................................................................
   1    -39.6750663 -0.396751E+02  0.181E-02    3.10       0.0  T
   2    -39.6750664 -0.103305E-06  0.105E-02    3.10       2.0  T
   3    -39.6750662  0.258884E-06  0.447E-03    3.10       4.7  T
   4    -39.6750665 -0.310140E-06  0.118E-03    3.10      17.6  T
   5    -39.6750665 -0.430254E-08  0.415E-04    3.10      50.2  T
   6    -39.6750665 -0.106349E-08  0.147E-04    3.10     141.4  T
     SCC iter.                  ...        0 min,  0.007 sec
     gradient                   ...        0 min,  0.013 sec
 * total energy  :   -39.2070609 Eh     change       -0.5744174E-05 Eh
   gradient norm :     0.0011669 Eh/α   predicted    -0.4105364E-05 ( -28.53%)
   displ. norm   :     0.0490958 α      lambda       -0.6182523E-05
   maximum displ.:     0.0407133 α      in ANC's #2, #1, #3, ...

........................................................................
.............................. CYCLE   13 ..............................
........................................................................
   1    -39.6749623 -0.396750E+02  0.307E-02    3.10       0.0  T
   2    -39.6749624 -0.942352E-07  0.180E-02    3.10       1.2  T
   3    -39.6749620  0.412328E-06  0.499E-03    3.10       4.2  T
   4    -39.6749625 -0.472204E-06  0.109E-03    3.10      19.1  T
   5    -39.6749625 -0.640893E-08  0.430E-04    3.10      48.4  T
   6    -39.6749625 -0.777057E-09  0.130E-04    3.10     159.9  T
     SCC iter.                  ...        0 min,  0.007 sec
     gradient                   ...        0 min,  0.013 sec
 * total energy  :   -39.2070666 Eh     change       -0.5749388E-05 Eh
   gradient norm :     0.0009015 Eh/α   predicted    -0.3096190E-05 ( -46.15%)
   displ. norm   :     0.0723832 α      lambda       -0.5533153E-05
   maximum displ.:     0.0569812 α      in ANC's #2, #4, #3, ...

........................................................................
.............................. CYCLE   14 ..............................
........................................................................
   1    -39.6749251 -0.396749E+02  0.451E-02    3.10       0.0  T
   2    -39.6749254 -0.335369E-06  0.255E-02    3.10       1.0  T
   3    -39.6749252  0.237258E-06  0.558E-03    3.10       3.7  T
   4    -39.6749255 -0.306841E-06  0.273E-03    3.10       7.6  T
   5    -39.6749256 -0.567035E-07  0.620E-04    3.10      33.6  T
   6    -39.6749256 -0.315040E-08  0.250E-04    3.10      83.4  T
     SCC iter.                  ...        0 min,  0.007 sec
     gradient                   ...        0 min,  0.014 sec
 * total energy  :   -39.2070703 Eh     change       -0.3660309E-05 Eh
   gradient norm :     0.0011633 Eh/α   predicted    -0.2775037E-05 ( -24.19%)
   displ. norm   :     0.0722109 α      lambda        0.7953009E-05
   maximum displ.:     0.0569834 α      in ANC's #2, #4, #3, ...

........................................................................
.............................. CYCLE   15 ..............................
........................................................................
   1    -39.6747759 -0.396748E+02  0.448E-02    3.10       0.0  T
   2    -39.6747763 -0.337812E-06  0.254E-02    3.10       1.0  T
   3    -39.6747760  0.236260E-06  0.558E-03    3.10       3.7  T
   4    -39.6747763 -0.304818E-06  0.272E-03    3.10       7.7  T
   5    -39.6747764 -0.574553E-07  0.620E-04    3.10      33.6  T
   6    -39.6747764 -0.292990E-08  0.245E-04    3.10      85.0  T
     SCC iter.                  ...        0 min,  0.007 sec
     gradient                   ...        0 min,  0.013 sec
 * total energy  :   -39.2070641 Eh     change        0.6200746E-05 Eh
   gradient norm :     0.0026503 Eh/α   predicted     0.3984806E-05 ( -35.74%)
   displ. norm   :     0.0174461 α      lambda       -0.1188359E-04
   maximum displ.:     0.0126990 α      in ANC's #2, #8, #12, ...

........................................................................
.............................. CYCLE   16 ..............................
........................................................................
   1    -39.6747058 -0.396747E+02  0.941E-03    3.10       0.0  T
   2    -39.6747058 -0.376238E-07  0.552E-03    3.10       3.8  T
   3    -39.6747057  0.143724E-06  0.326E-03    3.10       6.4  T
   4    -39.6747058 -0.175651E-06  0.547E-04    3.10      38.1  T
   5    -39.6747058 -0.142570E-08  0.233E-04    3.10      89.6  T
     SCC iter.                  ...        0 min,  0.006 sec
     gradient                   ...        0 min,  0.013 sec
 * total energy  :   -39.2070723 Eh     change       -0.8238931E-05 Eh
   gradient norm :     0.0013064 Eh/α   predicted    -0.5947333E-05 ( -27.81%)
   displ. norm   :     0.0285311 α      lambda       -0.5148229E-05
   maximum displ.:     0.0188879 α      in ANC's #2, #1, #4, ...

........................................................................
.............................. CYCLE   17 ..............................
........................................................................
   1    -39.6749591 -0.396750E+02  0.172E-02    3.10       0.0  T
   2    -39.6749592 -0.109123E-06  0.972E-03    3.10       2.1  T
   3    -39.6749588  0.323659E-06  0.474E-03    3.10       4.4  T
   4    -39.6749592 -0.386544E-06  0.110E-03    3.10      19.0  T
   5    -39.6749592 -0.631767E-08  0.418E-04    3.10      49.9  T
   6    -39.6749592 -0.390031E-09  0.197E-04    3.10     105.8  T
     SCC iter.                  ...        0 min,  0.007 sec
     gradient                   ...        0 min,  0.013 sec
 * total energy  :   -39.2070754 Eh     change       -0.3065666E-05 Eh
   gradient norm :     0.0006230 Eh/α   predicted    -0.2579006E-05 ( -15.87%)
   displ. norm   :     0.0324685 α      lambda       -0.1387898E-05
   maximum displ.:     0.0233034 α      in ANC's #2, #4, #3, ...

   *** GEOMETRY OPTIMIZATION CONVERGED AFTER 17 ITERATIONS ***

------------------------------------------------------------------------
 total energy gain   :        -0.0038117 Eh       -2.3919 kcal/mol
 total RMSD          :         0.2394690 a0        0.1267 Å
 total power (kW/mol):        -0.5886789 (step)  -19.6871 (real)
------------------------------------------------------------------------

 ANCopt (total)                0 d,  0 h,  0 min,  0.508 sec
 optimizer setup                ...        0 min,  0.000 sec (  0.031%)
 model hessian                  ...        0 min,  0.007 sec (  1.407%)
 ANC generation                 ...        0 min,  0.001 sec (  0.136%)
 coordinate transformation      ...        0 min,  0.000 sec (  0.065%)
 single point calculation       ...        0 min,  0.494 sec ( 97.197%)
 optimization log               ...        0 min,  0.002 sec (  0.321%)
 hessian update                 ...        0 min,  0.000 sec (  0.046%)
 rational function              ...        0 min,  0.003 sec (  0.587%)

================
 final structure:
================
$coord
    2.88540787934120   -2.44997766834936   -0.29581728651726      C 
    5.20252191522992   -0.19415917085365   -0.19576415182387      S 
    2.97522131811365    2.21293351310829    0.10365713877358      C 
    0.56510647479571    1.23885166095628    0.08463147311451      C 
    0.52685709266793   -1.43303829909764   -0.14089622393167      C 
   -1.86532606735968   -2.93570491153598   -0.26636547669803      C 
   -4.13306037186469   -1.39563518882114    0.62458327115588      C 
   -6.30459759038973   -2.66983527909574   -0.04987192506271      F 
   -4.11344637252313    1.21561153014513   -0.60945299641679      C 
   -6.26000291453332    2.52638225766424    0.07714558164713      F 
   -1.82205085931978    2.74009244571018    0.25719043967408      C 
    3.91383928447036    4.76338059086346    0.29764972976817      C 
    2.67428796194639    6.78978664402269    1.12009417229045      C 
    3.39060064951757   -4.40327512006249   -0.47127915909772      H 
   -1.70315711385648   -4.65685690010806    0.85943505072542      H 
   -2.22271067343866   -3.51040346312342   -2.22243748434486      H 
   -4.19417158113377   -1.20282263374746    2.68798179880836      H 
   -4.19168664734392    1.02034118496658   -2.67194055630175      H 
   -2.15895602420246    3.30516112816615    2.21999642764880      H 
   -1.67747296822166    4.45846713875561   -0.87684082130620      H 
    5.86976752353045    4.96307692835193   -0.26790738521172      H 
    0.76119096679947    6.73051054657106    1.79364242357600      H 
    3.59076000153036    8.60448799579669    1.17928856548647      H 
$end
           -------------------------------------------------
          |                Final Singlepoint                |
           -------------------------------------------------

          ...................................................
          :                      SETUP                      :
          :.................................................:
          :  # basis functions                  68          :
          :  # atomic orbitals                  67          :
          :  # shells                           37          :
          :  # electrons                        70          :
          :  max. iterations                   250          :
          :  Hamiltonian                  GFN2-xTB          :
          :  restarted?                      false          :
          :  GBSA solvation                  false          :
          :  PC potential                    false          :
          :  electronic temp.          300.0000000     K    :
          :  accuracy                    1.0000000          :
          :  -> integral cutoff          0.2500000E+02      :
          :  -> integral neglect         0.1000000E-07      :
          :  -> SCF convergence          0.1000000E-05 Eh   :
          :  -> wf. convergence          0.1000000E-03 e    :
          :  Broyden damping             0.4000000          :
          ...................................................

 iter      E             dE          RMSdq      gap      omega  full diag
   1    -39.6749592 -0.396750E+02  0.983E-05    3.10       0.0  T
   2    -39.6749592 -0.113403E-10  0.538E-05    3.10     387.8  T
   3    -39.6749592  0.640910E-11  0.403E-05    3.10     516.8  T

   *** convergence criteria satisfied after 3 iterations ***

         #    Occupation            Energy/Eh            Energy/eV
      -------------------------------------------------------------
         1        2.0000           -0.8138461             -22.1459
       ...           ...                  ...                  ...
        29        2.0000           -0.4592626             -12.4972
        30        2.0000           -0.4551300             -12.3847
        31        2.0000           -0.4492263             -12.2241
        32        2.0000           -0.4418122             -12.0223
        33        2.0000           -0.4360714             -11.8661
        34        2.0000           -0.4023999             -10.9499
        35        2.0000           -0.3878934             -10.5551 (HOMO)
        36                         -0.2740041              -7.4560 (LUMO)
        37                         -0.2165130              -5.8916
        38                         -0.2091123              -5.6902
        39                         -0.1622633              -4.4154
        40                         -0.1259801              -3.4281
       ...                                ...                  ...
        67                          0.6668144              18.1449
      -------------------------------------------------------------
                  HL-Gap            0.1138893 Eh            3.0991 eV
             Fermi-level           -0.3309488 Eh           -9.0056 eV

 SCC (total)                   0 d,  0 h,  0 min,  0.027 sec
 SCC setup                      ...        0 min,  0.000 sec (  0.742%)
 Dispersion                     ...        0 min,  0.000 sec (  0.665%)
 integral evaluation            ...        0 min,  0.009 sec ( 32.664%)
 zeroth order Hamiltonian       ...        0 min,  0.000 sec (  0.568%)
 iterations                     ...        0 min,  0.004 sec ( 14.705%)
 molecular gradient             ...        0 min,  0.014 sec ( 49.117%)
 printout                       ...        0 min,  0.000 sec (  1.298%)

         :::::::::::::::::::::::::::::::::::::::::::::::::::::
         ::                     SUMMARY                     ::
         :::::::::::::::::::::::::::::::::::::::::::::::::::::
         :: total energy             -39.207075427827 Eh    ::
         :: gradient norm              0.000622472453 Eh/a0 ::
         :: HOMO-LUMO gap              3.099086526697 eV    ::
         ::.................................................::
         :: SCC energy               -39.674959234551 Eh    ::
         :: -> isotropic ES            0.031055195463 Eh    ::
         :: -> anisotropic ES          0.000169420685 Eh    ::
         :: -> anisotropic XC          0.004999293318 Eh    ::
         :: -> dispersion             -0.022661972998 Eh    ::
         :: repulsion energy           0.467743771593 Eh    ::
         :: add. restraining           0.000000000000 Eh    ::
         :::::::::::::::::::::::::::::::::::::::::::::::::::::

           -------------------------------------------------
          |                Property Printout                |
           -------------------------------------------------

    * Orbital Energies and Occupations

         #    Occupation            Energy/Eh            Energy/eV
      -------------------------------------------------------------
         1        2.0000           -0.8138461             -22.1459
       ...           ...                  ...                  ...
        23        2.0000           -0.4973997             -13.5349
        24        2.0000           -0.4884311             -13.2909
        25        2.0000           -0.4851730             -13.2022
        26        2.0000           -0.4766824             -12.9712
        27        2.0000           -0.4727972             -12.8655
        28        2.0000           -0.4669314             -12.7058
        29        2.0000           -0.4592626             -12.4972
        30        2.0000           -0.4551300             -12.3847
        31        2.0000           -0.4492263             -12.2241
        32        2.0000           -0.4418122             -12.0223
        33        2.0000           -0.4360714             -11.8661
        34        2.0000           -0.4023999             -10.9499
        35        2.0000           -0.3878934             -10.5551 (HOMO)
        36                         -0.2740041              -7.4560 (LUMO)
        37                         -0.2165130              -5.8916
        38                         -0.2091123              -5.6902
        39                         -0.1622633              -4.4154
        40                         -0.1259801              -3.4281
        41                         -0.0183996              -0.5007
        42                         -0.0058471              -0.1591
        43                          0.0190263               0.5177
        44                          0.0233541               0.6355
        45                          0.0240362               0.6541
        46                          0.0607107               1.6520
       ...                                ...                  ...
        67                          0.6668144              18.1449
      -------------------------------------------------------------
                  HL-Gap            0.1138893 Eh            3.0991 eV
             Fermi-level           -0.3309488 Eh           -9.0056 eV

     #   Z        covCN         q      C6AA      α(0)
     1   6 C      2.936    -0.033    28.824     8.805
     2  16 S      2.344    -0.022   141.972    20.054
     3   6 C      2.986     0.015    27.679     8.630
     4   6 C      3.156    -0.022    28.251     8.691
     5   6 C      3.164    -0.017    28.082     8.661
     6   6 C      3.810    -0.071    21.841     6.652
     7   6 C      3.664     0.141    18.545     6.177
     8   9 F      0.785    -0.249    11.755     4.050
     9   6 C      3.664     0.140    18.560     6.179
    10   9 F      0.785    -0.249    11.758     4.051
    11   6 C      3.809    -0.068    21.787     6.644
    12   6 C      2.937    -0.031    28.768     8.796
    13   6 C      2.838    -0.092    30.297     9.020
    14   1 H      0.926     0.049     2.331     2.387
    15   1 H      0.924     0.061     2.190     2.314
    16   1 H      0.924     0.065     2.144     2.290
    17   1 H      0.924     0.056     2.243     2.342
    18   1 H      0.924     0.056     2.245     2.343
    19   1 H      0.924     0.064     2.150     2.293
    20   1 H      0.924     0.065     2.137     2.286
    21   1 H      0.925     0.048     2.346     2.395
    22   1 H      0.926     0.046     2.365     2.405
    23   1 H      0.926     0.047     2.359     2.402

 Mol. C6AA /au·bohr⁶  :       6971.957557
 Mol. C8AA /au·bohr⁸  :     186242.798258
 Mol. α(0) /au        :        129.867836


Wiberg/Mayer (AO) data.
largest (>0.10) Wiberg bond orders for each atom
          total WBO             WBO to atom ...
     1  C   3.948        C    5 1.577    S    2 1.201    H   14 0.970    C    3 0.102
     2  S   2.620        C    1 1.201    C    3 1.135
     3  C   3.948        C    4 1.500    S    2 1.135    C   12 1.130    C    1 0.102
     4  C   3.983        C    3 1.500    C    5 1.248    C   11 1.012
     5  C   3.984        C    1 1.577    C    4 1.248    C    6 1.007
     6  C   3.993        C    5 1.007    C    7 0.990    H   15 0.967    H   16 0.957
     7  C   3.908        C    6 0.990    C    9 0.977    H   17 0.961    F    8 0.931
     8  F   1.004        C    7 0.931
     9  C   3.907        C   11 0.988    C    7 0.977    H   18 0.961    F   10 0.931
    10  F   1.004        C    9 0.931
    11  C   3.994        C    4 1.012    C    9 0.988    H   20 0.961    H   19 0.954
    12  C   3.990        C   13 1.867    C    3 1.130    H   21 0.962
    13  C   3.991        C   12 1.867    H   23 0.977    H   22 0.973
    14  H   0.997        C    1 0.970
    15  H   0.996        C    6 0.967
    16  H   0.996        C    6 0.957
    17  H   0.997        C    7 0.961
    18  H   0.997        C    9 0.961
    19  H   0.996        C   11 0.954
    20  H   0.996        C   11 0.961
    21  H   0.997        C   12 0.962
    22  H   0.998        C   13 0.973
    23  H   0.997        C   13 0.977

molecular dipole:
                 x           y           z       tot (Debye)
 q only:        1.357       0.095      -0.001
   full:        1.164       0.020       0.007       2.959
molecular quadrupole (traceless):
                xx          xy          yy          xz          yz          zz
 q only:      -13.741       0.536       7.691      -0.163       0.056       6.049
  q+dip:      -19.091       0.219      10.602      -0.754      -0.070       8.489
   full:      -19.018       0.296      10.041      -0.285      -0.201       8.976

           -------------------------------------------------
          |                Geometry Summary                 |
           -------------------------------------------------

      molecular mass/u    :      200.2458000
   center of mass at/Å    :       -0.1457960       0.3582184       0.0280271
  moments of inertia/u·Å² :        0.4340984E+03   0.1015450E+04   0.1423691E+04
rotational constants/cm⁻¹ :        0.3883367E-01   0.1660115E-01   0.1184080E-01

 * 23 selected distances

     #   Z        #   Z                                     value/Å
     1   6 C      2  16 S                                 1.7120945
     2  16 S      3   6 C                                 1.7426424 (max)
     3   6 C      4   6 C                                 1.3756422
     1   6 C      5   6 C                                 1.3616347
     4   6 C      5   6 C                                 1.4190756
     5   6 C      6   6 C                                 1.4963922
     6   6 C      7   6 C                                 1.5252999
     7   6 C      8   9 F                                 1.3793216
     7   6 C      9   6 C                                 1.5283826
     9   6 C     10   9 F                                 1.3796456
     4   6 C     11   6 C                                 1.4950565
     9   6 C     11   6 C                                 1.5268948
    12   6 C     13   6 C                                 1.3302493
     1   6 C     14   1 H                                 1.0716823 (min)
     6   6 C     15   1 H                                 1.0917082
     6   6 C     16   1 H                                 1.0953100
     7   6 C     17   1 H                                 1.0971371
     9   6 C     18   1 H                                 1.0970838
    11   6 C     19   1 H                                 1.0954628
    11   6 C     20   1 H                                 1.0921764
    12   6 C     21   1 H                                 1.0826026
    13   6 C     22   1 H                                 1.0737372
    13   6 C     23   1 H                                 1.0762698

 * 4 distinct bonds (by element types)

   Z      Z             #   av. dist./Å        max./Å        min./Å
   1 H    6 C          10     1.0873170     1.0971371     1.0716823
   6 C    6 C           9     1.4509586     1.5283826     1.3302493
   6 C    9 F           2     1.3794836     1.3796456     1.3793216
   6 C   16 S           2     1.7273685     1.7426424     1.7120945


optimized geometry written to: xtbopt.xyz


           -------------------------------------------------
          | TOTAL ENERGY              -39.207075427827 Eh   |
          | GRADIENT NORM               0.000622472453 Eh/α |
          | HOMO-LUMO GAP               3.099086526697 eV   |
           -------------------------------------------------

------------------------------------------------------------------------
 * finished run on 2021/05/19 at 10:59:33.455     
------------------------------------------------------------------------
 total:
 * wall-time:     0 d,  0 h,  0 min,  0.620 sec
 *  cpu-time:     0 d,  0 h,  0 min,  0.595 sec
 * ratio c/w:     0.960 speedup
 SCF:
 * wall-time:     0 d,  0 h,  0 min,  0.038 sec
 *  cpu-time:     0 d,  0 h,  0 min,  0.038 sec
 * ratio c/w:     0.998 speedup
 ANC optimizer:
 * wall-time:     0 d,  0 h,  0 min,  0.536 sec
 *  cpu-time:     0 d,  0 h,  0 min,  0.536 sec
 * ratio c/w:     1.000 speedup

