      -----------------------------------------------------------      
     |                   =====================                   |     
     |                           x T B                           |     
     |                   =====================                   |     
     |                         S. Grimme                         |     
     |          Mulliken Center for Theoretical Chemistry        |     
     |                    University of Bonn                     |     
     |                Version 6.2 RC2 (SAW190805)                |     
      -----------------------------------------------------------      

   This program is distributed in the hope that it will be useful,
   but WITHOUT ANY WARRANTY; without even the implied warranty of
   MERCHANTABILITY or FITNESS FOR A PARTICULAR PURPOSE.
   
   FOR NON-COMMERCIAL, ACADEMIA USE ONLY.
   
   Cite this work as:
   * S. Grimme, C. Bannwarth, P. Shushkov, J. Chem. Theory Comput., 2017,
     13, 1989-2009. DOI: 10.1021/acs.jctc.7b00118
   * C. Bannwarth, S. Ehlert and S. Grimme., J. Chem. Theory Comput., 2019,
     15, 1652-1671. DOI: 10.1021/acs.jctc.8b01176
   * P. Pracht, E. Caldeweyher, S. Ehlert, S. Grimme, ChemRxiv, 2019, preprint.
     DOI: 10.26434/chemrxiv.8326202.v1
   
   for DFT-D4:
   * E. Caldeweyher, C. Bannwarth and S. Grimme, J. Chem. Phys., 2017,
     147, 034112. DOI: 10.1063/1.4993215
   * E. Caldeweyher, S. Ehlert, A. Hansen, H. Neugebauer, S. Spicher,
     C. Bannwarth and S. Grimme, J. Chem. Phys., 2019, 150, 154122.
     DOI: 10.1063/1.5090222
   
   for sTDA-xTB:
   * S. Grimme and C. Bannwarth, J. Chem. Phys., 2016, 145, 054103.
     DOI: 10.1063/1.4959605
   
   in the mass-spec context:
   * V. Asgeirsson, C. Bauer and S. Grimme, Chem. Sci., 2017, 8, 4879.
     DOI: 10.1039/c7sc00601b
   
   for metadynamics refer to:
   * S. Grimme, J. Chem. Theory Comput., 2019, 155, 2847-2862
     DOI: 10.1021/acs.jctc.9b00143
   
   with help from (in alphabetical order)
   C. Bannwarth, F. Bohle, G. Brandenburg, E. Caldeweyher, M. Checinski,
   S. Dohm, S. Ehlert, S. Ehrlich, F. März, H. Neugebauer, J. Pisarek,
   P. Pracht, P. Shushkov, and S. Spicher.
   
 * started run on 2021/05/19 at 10:59:36.523     

           -------------------------------------------------
          |                Calculation Setup                |
           -------------------------------------------------

          program call               : /ihome/ghutchison/geoffh/xtb/xtb 197.xyz -opt
          hostname                   : smp-n83
          coordinate file            : 197.xyz
          omp threads                :                     1
          number of atoms            :                    22
          number of electrons        :                    70
          charge                     :                     0
          spin                       :                   0.0
          first test random number   :      0.75926128939595


########################################################################
# WARNING! Please study the warnings concerning your input carefully
#  - the use of '-opt' is discouraged, please use '--opt' next time
########################################################################

           ------------------------------------------------- 
          |                 G F N 2 - x T B                 |
          | Geometry, Frequencies, Noncovalent interactions |
          |            JCTC 2019 parametrisation            |
           ------------------------------------------------- 
             KAB for C  - Si     :                1.0500
             KAB for H  - Pd     :                0.9500
             k(s)              :                1.8500
             k(p)              :                2.2300
             k(d)              :                2.2300
             k(f)              :                2.0000
             kEN (H0ij)        :               -2.0000
             D4 a1             :                0.5200
             D4 a2             :                5.0000
             D4 s6             :                1.0000
             D4 s8             :                2.7000
             D4 s9             :                5.0000
             alphaj            :                2.0000

  Z AO/shell   Hii/eV     exponent
  1     Wed Apr 25 08:07:45 CEST 2018   EN: 2.200 GM2: 0.406  GM3: 0.0800  RAES: 1.40
     1s    -10.707211    1.230000
  6     Wed Apr 25 08:07:45 CEST 2018   EN: 2.550 GM2: 0.538  GM3: 0.1500  RAES: 3.00
     2s    -13.970922    2.096432
     2p    -10.063292    1.800000
  9     Mon Apr 23 13:58:50 CEST 2018   EN: 3.980 GM2: 0.532  GM3: 0.1426  RAES: 2.40
     2s    -23.458179    2.416361
     2p    -15.746583    2.308399

           ------------------------------------------------- 
          |        Self-Consistent Charge Iterations        |
           ------------------------------------------------- 

          ...................................................
          :                      SETUP                      :
          :.................................................:
          :  # basis functions                  64          :
          :  # atomic orbitals                  64          :
          :  # shells                           36          :
          :  # electrons                        70          :
          :  max. iterations                   250          :
          :  Hamiltonian                  GFN2-xTB          :
          :  restarted?                      false          :
          :  GBSA solvation                  false          :
          :  PC potential                    false          :
          :  electronic temp.          300.0000000     K    :
          :  accuracy                    1.0000000          :
          :  -> integral cutoff          0.2500000E+02      :
          :  -> integral neglect         0.1000000E-07      :
          :  -> SCF convergence          0.1000000E-05 Eh   :
          :  -> wf. convergence          0.1000000E-03 e    :
          :  Broyden damping             0.4000000          :
          ...................................................

 iter      E             dE          RMSdq      gap      omega  full diag
   1    -39.6588744 -0.396589E+02  0.488E+00    1.60       0.0  T
   2    -39.6847522 -0.258779E-01  0.323E+00    1.40       1.0  T
   3    -39.6715296  0.132227E-01  0.196E+00    1.55       1.0  T
   4    -39.7104317 -0.389022E-01  0.386E-01    1.40       1.0  T
   5    -39.7116962 -0.126449E-02  0.232E-01    1.43       1.0  T
   6    -39.7125908 -0.894556E-03  0.869E-02    1.39       1.0  T
   7    -39.7126983 -0.107500E-03  0.318E-02    1.41       1.0  T
   8    -39.7127022 -0.391858E-05  0.200E-02    1.41       1.1  T
   9    -39.7127067 -0.451675E-05  0.738E-03    1.41       2.9  T
  10    -39.7127068 -0.107077E-06  0.288E-03    1.41       7.4  T
  11    -39.7127069 -0.108631E-06  0.127E-03    1.41      16.8  T
  12    -39.7127069 -0.199443E-07  0.385E-04    1.41      55.4  T
  13    -39.7127069  0.117240E-10  0.225E-04    1.41      94.7  T

   *** convergence criteria satisfied after 13 iterations ***

         #    Occupation            Energy/Eh            Energy/eV
      -------------------------------------------------------------
         1        2.0000           -0.8260277             -22.4774
       ...           ...                  ...                  ...
        29        2.0000           -0.4609483             -12.5430
        30        2.0000           -0.4555113             -12.3951
        31        2.0000           -0.4447342             -12.1018
        32        2.0000           -0.4241520             -11.5418
        33        2.0000           -0.4199627             -11.4278
        34        2.0000           -0.3985805             -10.8459
        35        2.0000           -0.3906133             -10.6291 (HOMO)
        36                         -0.3388698              -9.2211 (LUMO)
        37                         -0.2402700              -6.5381
        38                         -0.2139944              -5.8231
        39                         -0.1689927              -4.5985
        40                         -0.1651791              -4.4948
       ...                                ...                  ...
        64                          0.7470208              20.3275
      -------------------------------------------------------------
                  HL-Gap            0.0517435 Eh            1.4080 eV
             Fermi-level           -0.3647416 Eh           -9.9251 eV

 SCC (total)                   0 d,  0 h,  0 min,  0.036 sec
 SCC setup                      ...        0 min,  0.000 sec (  0.853%)
 Dispersion                     ...        0 min,  0.000 sec (  0.946%)
 integral evaluation            ...        0 min,  0.008 sec ( 23.390%)
 zeroth order Hamiltonian       ...        0 min,  0.000 sec (  0.474%)
 iterations                     ...        0 min,  0.014 sec ( 38.935%)
 molecular gradient             ...        0 min,  0.012 sec ( 34.151%)
 printout                       ...        0 min,  0.000 sec (  1.095%)

         :::::::::::::::::::::::::::::::::::::::::::::::::::::
         ::                     SUMMARY                     ::
         :::::::::::::::::::::::::::::::::::::::::::::::::::::
         :: total energy             -39.118995675295 Eh    ::
         :: gradient norm              0.051017585881 Eh/a0 ::
         :: HOMO-LUMO gap              1.408011132802 eV    ::
         ::.................................................::
         :: SCC energy               -39.712706939120 Eh    ::
         :: -> isotropic ES            0.023461374280 Eh    ::
         :: -> anisotropic ES          0.000388594457 Eh    ::
         :: -> anisotropic XC          0.011959159449 Eh    ::
         :: -> dispersion             -0.021397373766 Eh    ::
         :: repulsion energy           0.593612278754 Eh    ::
         :: add. restraining           0.000000000000 Eh    ::
         :::::::::::::::::::::::::::::::::::::::::::::::::::::

      ----------------------------------------------------------- 
     |                   =====================                   |
     |                        A N C O P T                        |
     |                   =====================                   |
     |               Approximate Normal Coordinate               |
     |                Rational Function Optimizer                |
      ----------------------------------------------------------- 

          ...................................................
          :                      SETUP                      :
          :.................................................:
          :   optimization level            normal          :
          :   max. optcycles                   200          :
          :   ANC micro-cycles                  20          :
          :   degrees of freedom                60          :
          :.................................................:
          :   RF solver                   davidson          :
          :   input Hessian                  false          :
          :   write xtbopt.log                true          :
          :   linear?                        false          :
          :   energy convergence         0.5000000E-05 Eh   :
          :   grad. convergence          0.1000000E-02 Eh/α :
          :   maximium RF displ.         2.0000000          :
          :   Hlow (freq-cutoff)         0.5000000E-02      :
          :   Hmax (freq-cutoff)         5.0000000          :
          :   S6 in model hess.         20.0000000          :
          ...................................................

generating ANC from model Hessian ...
Using Lindh-Hessian (1995)
 Shifting diagonal of input Hessian by   3.794649683970041E-003
 Lowest  eigenvalues of input Hessian
   -0.000000   -0.000000   -0.000000   -0.000000    0.000000    0.000000
    0.005000    0.005881    0.007401    0.008584    0.009708    0.013546
    0.014454    0.021955    0.022662    0.024329    0.029219    0.038462
 Highest eigenvalues
    1.881228    1.882952    1.993573    2.064028    2.101599    2.126524
 

........................................................................
.............................. CYCLE    1 ..............................
........................................................................
   1    -39.7127069 -0.397127E+02  0.534E-05    1.41       0.0  T
   2    -39.7127069 -0.923706E-12  0.474E-05    1.41     449.8  T
   3    -39.7127069 -0.463061E-10  0.167E-05    1.41    1275.1  T
     SCC iter.                  ...        0 min,  0.004 sec
     gradient                   ...        0 min,  0.012 sec
 * total energy  :   -39.1189957 Eh     change       -0.1057032E-08 Eh
   gradient norm :     0.0510176 Eh/α   predicted     0.0000000E+00 (-100.00%)
   displ. norm   :     0.2171828 α      lambda       -0.4308396E-02
   maximum displ.:     0.0886230 α      in ANC's #2, #3, #15, ...

........................................................................
.............................. CYCLE    2 ..............................
........................................................................
   1    -39.7131588 -0.397132E+02  0.141E-01    1.35       0.0  T
   2    -39.7131690 -0.102422E-04  0.958E-02    1.35       1.0  T
   3    -39.7131389  0.301384E-04  0.676E-02    1.36       1.0  T
   4    -39.7131988 -0.598945E-04  0.204E-02    1.35       1.0  T
   5    -39.7132059 -0.717405E-05  0.769E-03    1.36       2.8  T
   6    -39.7132070 -0.112214E-05  0.189E-03    1.36      11.3  T
   7    -39.7132071 -0.367989E-07  0.109E-03    1.36      19.6  T
     SCC iter.                  ...        0 min,  0.007 sec
     gradient                   ...        0 min,  0.012 sec
 * total energy  :   -39.1217311 Eh     change       -0.2735446E-02 Eh
   gradient norm :     0.0174854 Eh/α   predicted    -0.2255808E-02 ( -17.53%)
   displ. norm   :     0.2646869 α      lambda       -0.1378483E-02
   maximum displ.:     0.1397719 α      in ANC's #3, #2, #6, ...

........................................................................
.............................. CYCLE    3 ..............................
........................................................................
   1    -39.7135613 -0.397136E+02  0.139E-01    1.34       0.0  T
   2    -39.7135649 -0.354405E-05  0.896E-02    1.34       1.0  T
   3    -39.7135226  0.422676E-04  0.682E-02    1.34       1.0  T
   4    -39.7135968 -0.742259E-04  0.834E-03    1.34       2.6  T
   5    -39.7135976 -0.748953E-06  0.440E-03    1.34       4.8  T
   6    -39.7135978 -0.259895E-06  0.166E-03    1.34      12.8  T
   7    -39.7135978 -0.199484E-07  0.106E-03    1.34      20.1  T
     SCC iter.                  ...        0 min,  0.007 sec
     gradient                   ...        0 min,  0.011 sec
 * total energy  :   -39.1223955 Eh     change       -0.6643891E-03 Eh
   gradient norm :     0.0090316 Eh/α   predicted    -0.7375299E-03 (  11.01%)
   displ. norm   :     0.1707934 α      lambda       -0.4759077E-03
   maximum displ.:     0.0908798 α      in ANC's #2, #3, #5, ...

........................................................................
.............................. CYCLE    4 ..............................
........................................................................
   1    -39.7138842 -0.397139E+02  0.124E-01    1.34       0.0  T
   2    -39.7138861 -0.191484E-05  0.749E-02    1.35       1.0  T
   3    -39.7138594  0.267755E-04  0.362E-02    1.35       1.0  T
   4    -39.7138888 -0.294607E-04  0.362E-03    1.35       5.9  T
   5    -39.7138890 -0.168145E-06  0.183E-03    1.35      11.6  T
   6    -39.7138890 -0.313000E-07  0.110E-03    1.35      19.3  T
     SCC iter.                  ...        0 min,  0.006 sec
     gradient                   ...        0 min,  0.011 sec
 * total energy  :   -39.1226998 Eh     change       -0.3042816E-03 Eh
   gradient norm :     0.0076055 Eh/α   predicted    -0.2449008E-03 ( -19.52%)
   displ. norm   :     0.2175375 α      lambda       -0.3128154E-03
   maximum displ.:     0.1205107 α      in ANC's #2, #5, #3, ...

........................................................................
.............................. CYCLE    5 ..............................
........................................................................
   1    -39.7138906 -0.397139E+02  0.145E-01    1.35       0.0  T
   2    -39.7138917 -0.116917E-05  0.859E-02    1.36       1.0  T
   3    -39.7138786  0.131112E-04  0.260E-02    1.35       1.0  T
   4    -39.7138923 -0.137137E-04  0.525E-03    1.35       4.1  T
   5    -39.7138928 -0.486108E-06  0.196E-03    1.35      10.9  T
   6    -39.7138929 -0.396266E-07  0.109E-03    1.35      19.5  T
     SCC iter.                  ...        0 min,  0.006 sec
     gradient                   ...        0 min,  0.011 sec
 * total energy  :   -39.1229462 Eh     change       -0.2463789E-03 Eh
   gradient norm :     0.0059767 Eh/α   predicted    -0.1638098E-03 ( -33.51%)
   displ. norm   :     0.3086601 α      lambda       -0.3653701E-03
   maximum displ.:     0.1839191 α      in ANC's #5, #2, #3, ...

........................................................................
.............................. CYCLE    6 ..............................
........................................................................
   1    -39.7137290 -0.397137E+02  0.205E-01    1.35       0.0  T
   2    -39.7137309 -0.189531E-05  0.121E-01    1.35       1.0  T
   3    -39.7137057  0.251532E-04  0.373E-02    1.35       1.0  T
   4    -39.7137327 -0.269408E-04  0.586E-03    1.35       3.6  T
   5    -39.7137332 -0.498393E-06  0.281E-03    1.35       7.6  T
   6    -39.7137333 -0.907011E-07  0.138E-03    1.35      15.4  T
     SCC iter.                  ...        0 min,  0.006 sec
     gradient                   ...        0 min,  0.011 sec
 * total energy  :   -39.1232218 Eh     change       -0.2756310E-03 Eh
   gradient norm :     0.0072975 Eh/α   predicted    -0.2001004E-03 ( -27.40%)
   displ. norm   :     0.2926411 α      lambda       -0.3073826E-03
   maximum displ.:     0.1877995 α      in ANC's #5, #2, #1, ...

........................................................................
.............................. CYCLE    7 ..............................
........................................................................
   1    -39.7134008 -0.397134E+02  0.198E-01    1.34       0.0  T
   2    -39.7134019 -0.108039E-05  0.117E-01    1.34       1.0  T
   3    -39.7133672  0.347282E-04  0.423E-02    1.34       1.0  T
   4    -39.7134043 -0.371054E-04  0.563E-03    1.34       3.8  T
   5    -39.7134048 -0.490555E-06  0.249E-03    1.34       8.6  T
   6    -39.7134048 -0.573378E-07  0.120E-03    1.34      17.7  T
     SCC iter.                  ...        0 min,  0.006 sec
     gradient                   ...        0 min,  0.011 sec
 * total energy  :   -39.1234647 Eh     change       -0.2428778E-03 Eh
   gradient norm :     0.0090261 Eh/α   predicted    -0.1668539E-03 ( -31.30%)
   displ. norm   :     0.3311804 α      lambda       -0.4001333E-03
   maximum displ.:     0.2154008 α      in ANC's #5, #1, #2, ...

........................................................................
.............................. CYCLE    8 ..............................
........................................................................
   1    -39.7135281 -0.397135E+02  0.223E-01    1.32       0.0  T
   2    -39.7135288 -0.651496E-06  0.132E-01    1.32       1.0  T
   3    -39.7134653  0.634958E-04  0.556E-02    1.32       1.0  T
   4    -39.7135327 -0.674174E-04  0.690E-03    1.32       3.1  T
   5    -39.7135336 -0.838542E-06  0.261E-03    1.32       8.2  T
   6    -39.7135336 -0.398657E-07  0.129E-03    1.32      16.6  T
     SCC iter.                  ...        0 min,  0.006 sec
     gradient                   ...        0 min,  0.011 sec
 * total energy  :   -39.1237773 Eh     change       -0.3126683E-03 Eh
   gradient norm :     0.0093509 Eh/α   predicted    -0.2220112E-03 ( -28.99%)
   displ. norm   :     0.3583153 α      lambda       -0.4418483E-03
   maximum displ.:     0.2292725 α      in ANC's #5, #1, #4, ...

........................................................................
.............................. CYCLE    9 ..............................
........................................................................
   1    -39.7133783 -0.397134E+02  0.236E-01    1.30       0.0  T
   2    -39.7133784 -0.278552E-07  0.140E-01    1.30       1.0  T
   3    -39.7132925  0.858946E-04  0.632E-02    1.29       1.0  T
   4    -39.7133830 -0.904801E-04  0.688E-03    1.30       3.1  T
   5    -39.7133838 -0.805673E-06  0.258E-03    1.30       8.3  T
   6    -39.7133838 -0.263356E-07  0.124E-03    1.30      17.2  T
     SCC iter.                  ...        0 min,  0.006 sec
     gradient                   ...        0 min,  0.011 sec
 * total energy  :   -39.1241163 Eh     change       -0.3389458E-03 Eh
   gradient norm :     0.0077303 Eh/α   predicted    -0.2492956E-03 ( -26.45%)
   displ. norm   :     0.3242649 α      lambda       -0.3853247E-03
   maximum displ.:     0.2236746 α      in ANC's #1, #5, #4, ...

........................................................................
.............................. CYCLE   10 ..............................
........................................................................
   1    -39.7148172 -0.397148E+02  0.197E-01    1.29       0.0  T
   2    -39.7148177 -0.495084E-06  0.117E-01    1.29       1.0  T
   3    -39.7147703  0.474462E-04  0.467E-02    1.28       1.0  T
   4    -39.7148203 -0.500277E-04  0.516E-03    1.29       4.1  T
   5    -39.7148207 -0.377260E-06  0.232E-03    1.29       9.2  T
   6    -39.7148207 -0.249580E-07  0.111E-03    1.29      19.2  T
     SCC iter.                  ...        0 min,  0.006 sec
     gradient                   ...        0 min,  0.011 sec
 * total energy  :   -39.1243932 Eh     change       -0.2768808E-03 Eh
   gradient norm :     0.0063254 Eh/α   predicted    -0.2129236E-03 ( -23.10%)
   displ. norm   :     0.3840030 α      lambda       -0.2822711E-03
   maximum displ.:     0.2447047 α      in ANC's #1, #5, #4, ...

........................................................................
.............................. CYCLE   11 ..............................
........................................................................
   1    -39.7106345 -0.397106E+02  0.248E-01    1.26       0.0  T
   2    -39.7106360 -0.150597E-05  0.147E-01    1.27       1.0  T
   3    -39.7105910  0.450338E-04  0.482E-02    1.26       1.0  T
   4    -39.7106389 -0.479313E-04  0.735E-03    1.27       2.9  T
   5    -39.7106398 -0.921682E-06  0.291E-03    1.27       7.3  T
   6    -39.7106399 -0.300490E-07  0.131E-03    1.27      16.3  T
     SCC iter.                  ...        0 min,  0.006 sec
     gradient                   ...        0 min,  0.011 sec
 * total energy  :   -39.1245004 Eh     change       -0.1071956E-03 Eh
   gradient norm :     0.0084000 Eh/α   predicted    -0.1619564E-03 (  51.08%)
   displ. norm   :     0.1870555 α      lambda       -0.3921021E-03
   maximum displ.:     0.1345110 α      in ANC's #1, #3, #35, ...

........................................................................
.............................. CYCLE   12 ..............................
........................................................................
   1    -39.7177878 -0.397178E+02  0.100E-01    1.27       0.0  T
   2    -39.7177889 -0.115650E-05  0.606E-02    1.27       1.0  T
   3    -39.7177541  0.347910E-04  0.480E-02    1.27       1.0  T
   4    -39.7177944 -0.402501E-04  0.358E-03    1.27       6.0  T
   5    -39.7177945 -0.832153E-07  0.228E-03    1.27       9.3  T
   6    -39.7177945 -0.717287E-07  0.112E-03    1.27      19.0  T
     SCC iter.                  ...        0 min,  0.006 sec
     gradient                   ...        0 min,  0.011 sec
 * total energy  :   -39.1245535 Eh     change       -0.5310922E-04 Eh
   gradient norm :     0.0107109 Eh/α   predicted    -0.2029113E-03 ( 282.06%)
   displ. norm   :     0.1092969 α      lambda       -0.3078554E-03
   maximum displ.:     0.0560319 α      in ANC's #1, #5, #10, ...

........................................................................
.............................. CYCLE   13 ..............................
........................................................................
   1    -39.7168984 -0.397169E+02  0.662E-02    1.27       0.0  T
   2    -39.7168997 -0.125706E-05  0.404E-02    1.27       1.0  T
   3    -39.7168849  0.147800E-04  0.323E-02    1.27       1.0  T
   4    -39.7169027 -0.177381E-04  0.412E-03    1.27       5.2  T
   5    -39.7169028 -0.114895E-06  0.214E-03    1.27      10.0  T
   6    -39.7169028 -0.461555E-07  0.105E-03    1.27      20.3  T
     SCC iter.                  ...        0 min,  0.006 sec
     gradient                   ...        0 min,  0.011 sec
 * total energy  :   -39.1246539 Eh     change       -0.1003807E-03 Eh
   gradient norm :     0.0087565 Eh/α   predicted    -0.1557671E-03 (  55.18%)
   displ. norm   :     0.0504152 α      lambda       -0.1255297E-03
   maximum displ.:     0.0299593 α      in ANC's #2, #4, #3, ...

........................................................................
.............................. CYCLE   14 ..............................
........................................................................
   1    -39.7150459 -0.397150E+02  0.378E-02    1.26       0.0  T
   2    -39.7150462 -0.301728E-06  0.226E-02    1.27       1.0  T
   3    -39.7150452  0.105609E-05  0.725E-03    1.26       2.9  T
   4    -39.7150463 -0.111313E-05  0.231E-03    1.27       9.2  T
   5    -39.7150463 -0.704341E-07  0.107E-03    1.27      19.9  T
     SCC iter.                  ...        0 min,  0.005 sec
     gradient                   ...        0 min,  0.011 sec
 * total energy  :   -39.1247140 Eh     change       -0.6009634E-04 Eh
   gradient norm :     0.0027270 Eh/α   predicted    -0.6292606E-04 (   4.71%)
   displ. norm   :     0.0523522 α      lambda       -0.3251483E-04
   maximum displ.:     0.0414111 α      in ANC's #1, #4, #3, ...

........................................................................
.............................. CYCLE   15 ..............................
........................................................................
   1    -39.7156583 -0.397157E+02  0.310E-02    1.27       0.0  T
   2    -39.7156583 -0.870439E-07  0.184E-02    1.27       1.2  T
   3    -39.7156565  0.180182E-05  0.950E-03    1.27       2.2  T
   4    -39.7156585 -0.197000E-05  0.858E-04    1.27      24.8  T
   5    -39.7156585 -0.497880E-08  0.582E-04    1.27      36.6  T
   6    -39.7156585 -0.347446E-08  0.263E-04    1.27      81.2  T
     SCC iter.                  ...        0 min,  0.006 sec
     gradient                   ...        0 min,  0.012 sec
 * total energy  :   -39.1247381 Eh     change       -0.2410303E-04 Eh
   gradient norm :     0.0018093 Eh/α   predicted    -0.1630522E-04 ( -32.35%)
   displ. norm   :     0.1989307 α      lambda       -0.4377963E-04
   maximum displ.:     0.1520873 α      in ANC's #1, #3, #4, ...

........................................................................
.............................. CYCLE   16 ..............................
........................................................................
   1    -39.7165730 -0.397166E+02  0.113E-01    1.27       0.0  T
   2    -39.7165737 -0.628601E-06  0.672E-02    1.27       1.0  T
   3    -39.7165687  0.500145E-05  0.153E-02    1.27       1.4  T
   4    -39.7165743 -0.563720E-05  0.233E-03    1.27       9.1  T
   5    -39.7165743 -0.164838E-07  0.166E-03    1.27      12.8  T
   6    -39.7165743 -0.131392E-07  0.105E-03    1.27      20.4  T
   7    -39.7165743 -0.172261E-07  0.239E-04    1.27      89.4  T
   8    -39.7165743 -0.664627E-09  0.102E-04    1.27     209.3  T
     SCC iter.                  ...        0 min,  0.008 sec
     gradient                   ...        0 min,  0.012 sec
 * total energy  :   -39.1247489 Eh     change       -0.1084004E-04 Eh
   gradient norm :     0.0042136 Eh/α   predicted    -0.2227698E-04 ( 105.51%)
   displ. norm   :     0.0505614 α      lambda       -0.3715613E-04
   maximum displ.:     0.0301610 α      in ANC's #2, #1, #4, ...

........................................................................
.............................. CYCLE   17 ..............................
........................................................................
   1    -39.7158570 -0.397159E+02  0.332E-02    1.26       0.0  T
   2    -39.7158570 -0.815266E-07  0.198E-02    1.26       1.1  T
   3    -39.7158550  0.205448E-05  0.112E-02    1.26       1.9  T
   4    -39.7158572 -0.218723E-05  0.160E-03    1.26      13.3  T
   5    -39.7158572 -0.389375E-07  0.812E-04    1.26      26.3  T
     SCC iter.                  ...        0 min,  0.005 sec
     gradient                   ...        0 min,  0.011 sec
 * total energy  :   -39.1247631 Eh     change       -0.1423232E-04 Eh
   gradient norm :     0.0025670 Eh/α   predicted    -0.1862812E-04 (  30.89%)
   displ. norm   :     0.0390630 α      lambda       -0.1266965E-04
   maximum displ.:     0.0281996 α      in ANC's #1, #4, #3, ...

........................................................................
.............................. CYCLE   18 ..............................
........................................................................
   1    -39.7159961 -0.397160E+02  0.252E-02    1.26       0.0  T
   2    -39.7159961 -0.522899E-07  0.150E-02    1.26       1.4  T
   3    -39.7159948  0.132943E-05  0.829E-03    1.26       2.6  T
   4    -39.7159962 -0.140090E-05  0.135E-03    1.26      15.8  T
   5    -39.7159962 -0.308561E-07  0.532E-04    1.26      40.1  T
   6    -39.7159962 -0.268214E-08  0.311E-04    1.26      68.5  T
     SCC iter.                  ...        0 min,  0.006 sec
     gradient                   ...        0 min,  0.012 sec
 * total energy  :   -39.1247707 Eh     change       -0.7602769E-05 Eh
   gradient norm :     0.0012963 Eh/α   predicted    -0.6346931E-05 ( -16.52%)
   displ. norm   :     0.0349088 α      lambda       -0.5434489E-05
   maximum displ.:     0.0187290 α      in ANC's #4, #5, #1, ...

........................................................................
.............................. CYCLE   19 ..............................
........................................................................
   1    -39.7160808 -0.397161E+02  0.230E-02    1.26       0.0  T
   2    -39.7160809 -0.660439E-07  0.137E-02    1.26       1.6  T
   3    -39.7160799  0.930123E-06  0.653E-03    1.26       3.3  T
   4    -39.7160809 -0.101045E-05  0.963E-04    1.26      22.1  T
   5    -39.7160810 -0.133128E-07  0.543E-04    1.26      39.2  T
   6    -39.7160810 -0.385874E-08  0.265E-04    1.26      80.3  T
     SCC iter.                  ...        0 min,  0.006 sec
     gradient                   ...        0 min,  0.012 sec
 * total energy  :   -39.1247747 Eh     change       -0.3938325E-05 Eh
   gradient norm :     0.0006960 Eh/α   predicted    -0.2720999E-05 ( -30.91%)
   displ. norm   :     0.0462651 α      lambda       -0.4694625E-05
   maximum displ.:     0.0337270 α      in ANC's #2, #1, #5, ...

   *** GEOMETRY OPTIMIZATION CONVERGED AFTER 19 ITERATIONS ***

------------------------------------------------------------------------
 total energy gain   :        -0.0057790 Eh       -3.6264 kcal/mol
 total RMSD          :         0.5968952 a0        0.3159 Å
 total power (kW/mol):        -0.7985663 (step)  -29.4877 (real)
------------------------------------------------------------------------

 ANCopt (total)                0 d,  0 h,  0 min,  0.515 sec
 optimizer setup                ...        0 min,  0.000 sec (  0.031%)
 model hessian                  ...        0 min,  0.003 sec (  0.610%)
 ANC generation                 ...        0 min,  0.001 sec (  0.131%)
 coordinate transformation      ...        0 min,  0.000 sec (  0.070%)
 single point calculation       ...        0 min,  0.502 sec ( 97.539%)
 optimization log               ...        0 min,  0.002 sec (  0.350%)
 hessian update                 ...        0 min,  0.000 sec (  0.050%)
 rational function              ...        0 min,  0.005 sec (  0.977%)

================
 final structure:
================
$coord
    1.89932831820575    0.09568997529141    0.41684604687460      C 
    0.79076440383812   -2.19582735998753    0.38619762279041      C 
    1.90420831896629   -4.40960232627253    0.85632422526674      F 
   -1.88328142522689   -1.98992354406946   -0.22515296786397      C 
   -2.39960585044171    0.48063534946102   -0.50445508539739      C 
   -0.06411359849648    1.92610467039505   -0.14736760758879      C 
    0.09456832878505    4.49516887852863   -0.22585992456326      C 
    2.36214767394572    6.11872759081557    0.03417515663781      C 
    1.54272351698185    8.50935790306221    0.48678347902684      C 
   -1.18167512526443    8.50181788748302    0.36528539069840      C 
   -2.07022989786093    6.16426253902444   -0.14794989294373      C 
   -2.56437460391780   10.58246887658262    0.70514416168145      F 
    4.97726805860249    5.43751711181251   -0.35273783782760      C 
    5.80126149149719    3.72022558060036   -1.99315574935883      C 
    3.82117315448234    0.52398509615289    0.87975748411417      H 
   -3.14158947493514   -3.57219915511377   -0.38331534855744      H 
   -4.18595814176709    1.30134555380271   -0.98951513103121      H 
    2.67123091057227   10.16785757799069    0.78530647448907      H 
   -4.00890070723167    5.60216682060209   -0.28252370536814      H 
    6.32380141240591    6.57963165612060    0.68149112581886      H 
    4.52520307084965    2.63291678333955   -3.14661558749917      H 
    7.78855031123490    3.37499648779139   -2.25692957240211      H 
$end
           -------------------------------------------------
          |                Final Singlepoint                |
           -------------------------------------------------

          ...................................................
          :                      SETUP                      :
          :.................................................:
          :  # basis functions                  64          :
          :  # atomic orbitals                  64          :
          :  # shells                           36          :
          :  # electrons                        70          :
          :  max. iterations                   250          :
          :  Hamiltonian                  GFN2-xTB          :
          :  restarted?                      false          :
          :  GBSA solvation                  false          :
          :  PC potential                    false          :
          :  electronic temp.          300.0000000     K    :
          :  accuracy                    1.0000000          :
          :  -> integral cutoff          0.2500000E+02      :
          :  -> integral neglect         0.1000000E-07      :
          :  -> SCF convergence          0.1000000E-05 Eh   :
          :  -> wf. convergence          0.1000000E-03 e    :
          :  Broyden damping             0.4000000          :
          ...................................................

 iter      E             dE          RMSdq      gap      omega  full diag
   1    -39.7160810 -0.397161E+02  0.146E-04    1.26       0.0  T
   2    -39.7160810  0.134499E-09  0.121E-04    1.26     176.6  T
   3    -39.7160810 -0.315090E-09  0.672E-05    1.26     317.3  T

   *** convergence criteria satisfied after 3 iterations ***

         #    Occupation            Energy/Eh            Energy/eV
      -------------------------------------------------------------
         1        2.0000           -0.8281125             -22.5341
       ...           ...                  ...                  ...
        29        2.0000           -0.4596099             -12.5066
        30        2.0000           -0.4554915             -12.3946
        31        2.0000           -0.4439152             -12.0795
        32        2.0000           -0.4332613             -11.7896
        33        2.0000           -0.4178372             -11.3699
        34        2.0000           -0.3974420             -10.8149
        35        2.0000           -0.3856926             -10.4952 (HOMO)
        36                         -0.3394009              -9.2356 (LUMO)
        37                         -0.2503987              -6.8137
        38                         -0.2018017              -5.4913
        39                         -0.1710912              -4.6556
        40                         -0.1594957              -4.3401
       ...                                ...                  ...
        64                          0.7265661              19.7709
      -------------------------------------------------------------
                  HL-Gap            0.0462917 Eh            1.2597 eV
             Fermi-level           -0.3625467 Eh           -9.8654 eV

 SCC (total)                   0 d,  0 h,  0 min,  0.024 sec
 SCC setup                      ...        0 min,  0.000 sec (  0.753%)
 Dispersion                     ...        0 min,  0.000 sec (  0.773%)
 integral evaluation            ...        0 min,  0.008 sec ( 32.812%)
 zeroth order Hamiltonian       ...        0 min,  0.000 sec (  0.589%)
 iterations                     ...        0 min,  0.004 sec ( 15.152%)
 molecular gradient             ...        0 min,  0.012 sec ( 48.339%)
 printout                       ...        0 min,  0.000 sec (  1.385%)

         :::::::::::::::::::::::::::::::::::::::::::::::::::::
         ::                     SUMMARY                     ::
         :::::::::::::::::::::::::::::::::::::::::::::::::::::
         :: total energy             -39.124774665434 Eh    ::
         :: gradient norm              0.000695237923 Eh/a0 ::
         :: HOMO-LUMO gap              1.259660794583 eV    ::
         ::.................................................::
         :: SCC energy               -39.716080964961 Eh    ::
         :: -> isotropic ES            0.022790995723 Eh    ::
         :: -> anisotropic ES          0.000142065399 Eh    ::
         :: -> anisotropic XC          0.011776839142 Eh    ::
         :: -> dispersion             -0.021734965262 Eh    ::
         :: repulsion energy           0.591205785131 Eh    ::
         :: add. restraining           0.000000000000 Eh    ::
         :::::::::::::::::::::::::::::::::::::::::::::::::::::

           -------------------------------------------------
          |                Property Printout                |
           -------------------------------------------------

    * Orbital Energies and Occupations

         #    Occupation            Energy/Eh            Energy/eV
      -------------------------------------------------------------
         1        2.0000           -0.8281125             -22.5341
       ...           ...                  ...                  ...
        23        2.0000           -0.4985788             -13.5670
        24        2.0000           -0.4941697             -13.4470
        25        2.0000           -0.4884350             -13.2910
        26        2.0000           -0.4768867             -12.9767
        27        2.0000           -0.4718886             -12.8407
        28        2.0000           -0.4658544             -12.6765
        29        2.0000           -0.4596099             -12.5066
        30        2.0000           -0.4554915             -12.3946
        31        2.0000           -0.4439152             -12.0795
        32        2.0000           -0.4332613             -11.7896
        33        2.0000           -0.4178372             -11.3699
        34        2.0000           -0.3974420             -10.8149
        35        2.0000           -0.3856926             -10.4952 (HOMO)
        36                         -0.3394009              -9.2356 (LUMO)
        37                         -0.2503987              -6.8137
        38                         -0.2018017              -5.4913
        39                         -0.1710912              -4.6556
        40                         -0.1594957              -4.3401
        41                         -0.1226137              -3.3365
        42                          0.0411369               1.1194
        43                          0.0471317               1.2825
        44                          0.0741791               2.0185
        45                          0.0946910               2.5767
        46                          0.0998492               2.7170
       ...                                ...                  ...
        64                          0.7265661              19.7709
      -------------------------------------------------------------
                  HL-Gap            0.0462917 Eh            1.2597 eV
             Fermi-level           -0.3625467 Eh           -9.8654 eV

     #   Z        covCN         q      C6AA      α(0)
     1   6 C      2.975    -0.083    30.059     8.993
     2   6 C      2.926     0.171    24.319     8.087
     3   9 F      0.785    -0.205    11.289     3.969
     4   6 C      2.999    -0.047    29.158     8.858
     5   6 C      3.014    -0.049    29.207     8.865
     6   6 C      3.103     0.033    27.136     8.536
     7   6 C      3.098     0.029    27.234     8.552
     8   6 C      3.055     0.003    27.896     8.662
     9   6 C      3.006    -0.062    29.515     8.912
    10   6 C      2.914     0.174    24.262     8.077
    11   6 C      2.977    -0.084    30.090     8.998
    12   9 F      0.785    -0.204    11.273     3.966
    13   6 C      2.891    -0.023    28.584     8.766
    14   6 C      2.839    -0.082    30.053     8.984
    15   1 H      0.926     0.060     2.193     2.316
    16   1 H      0.926     0.057     2.229     2.335
    17   1 H      0.926     0.052     2.291     2.367
    18   1 H      0.926     0.055     2.256     2.349
    19   1 H      0.926     0.057     2.232     2.336
    20   1 H      0.925     0.048     2.349     2.397
    21   1 H      0.926     0.051     2.311     2.377
    22   1 H      0.926     0.047     2.355     2.400

 Mol. C6AA /au·bohr⁶  :       6746.494683
 Mol. C8AA /au·bohr⁸  :     168713.622559
 Mol. α(0) /au        :        131.100749


Wiberg/Mayer (AO) data.
largest (>0.10) Wiberg bond orders for each atom
          total WBO             WBO to atom ...
     1  C   3.976        C    2 1.658    C    6 1.119    H   15 0.964
     2  C   3.841        C    1 1.658    C    4 1.081    F    3 0.980
     3  F   1.119        C    2 0.980
     4  C   3.949        C    5 1.764    C    2 1.081    H   16 0.970
     5  C   3.983        C    4 1.764    C    6 1.081    H   17 0.969
     6  C   3.983        C    7 1.553    C    1 1.119    C    5 1.081
     7  C   3.981        C    6 1.553    C   11 1.137    C    8 1.039
     8  C   3.982        C    9 1.646    C   13 1.115    C    7 1.039
     9  C   3.957        C    8 1.646    C   10 1.114    H   18 0.970    C   14 0.102
    10  C   3.834        C   11 1.616    C    9 1.114    F   12 0.981
    11  C   3.974        C   10 1.616    C    7 1.137    H   19 0.967
    12  F   1.119        C   10 0.981
    13  C   3.990        C   14 1.870    C    8 1.115    H   20 0.958
    14  C   3.990        C   13 1.870    H   22 0.978    H   21 0.974    C    9 0.102
    15  H   0.996        C    1 0.964
    16  H   0.996        C    4 0.970
    17  H   0.997        C    5 0.969
    18  H   0.996        C    9 0.970
    19  H   0.996        C   11 0.967
    20  H   0.997        C   13 0.958
    21  H   0.997        C   14 0.974
    22  H   0.997        C   14 0.978

molecular dipole:
                 x           y           z       tot (Debye)
 q only:        0.253       0.041      -0.272
   full:        0.220       0.066      -0.251       0.863
molecular quadrupole (traceless):
                xx          xy          yy          xz          yz          zz
 q only:        8.461      11.248     -12.669       0.167      -0.149       4.209
  q+dip:       10.940      14.202     -11.466       1.137       1.688       0.527
   full:        9.123      13.348     -13.401       0.433       0.570       4.279

           -------------------------------------------------
          |                Geometry Summary                 |
           -------------------------------------------------

      molecular mass/u    :      190.1920000
   center of mass at/Å    :        0.3335983       1.7798980       0.0055818
  moments of inertia/u·Å² :        0.3921018E+03   0.1188784E+04   0.1531557E+04
rotational constants/cm⁻¹ :        0.4299300E-01   0.1418057E-01   0.1100686E-01

 * 17 selected distances

     #   Z        #   Z                                     value/Å
     1   6 C      2   6 C                                 1.3471594
     2   6 C      3   9 F                                 1.3346996
     4   6 C      5   6 C                                 1.3437625
     6   6 C      7   6 C                                 1.3627144
     8   6 C      9   6 C                                 1.3585974
     9   6 C     10   6 C                                 1.4431283 (max)
    10   6 C     11   6 C                                 1.3509166
    10   6 C     12   9 F                                 1.3341639
    13   6 C     14   6 C                                 1.3302285
     1   6 C     15   1 H                                 1.0703532 (min)
     4   6 C     16   1 H                                 1.0730627
     5   6 C     17   1 H                                 1.0714896
     9   6 C     18   1 H                                 1.0732344
    11   6 C     19   1 H                                 1.0705226
    13   6 C     20   1 H                                 1.0828378
    14   6 C     21   1 H                                 1.0768510
    14   6 C     22   1 H                                 1.0764663

 * 3 distinct bonds (by element types)

   Z      Z             #   av. dist./Å        max./Å        min./Å
   1 H    6 C           8     1.0743522     1.0828378     1.0703532
   6 C    6 C           7     1.3623581     1.4431283     1.3302285
   6 C    9 F           2     1.3344318     1.3346996     1.3341639


optimized geometry written to: xtbopt.xyz


           -------------------------------------------------
          | TOTAL ENERGY              -39.124774665434 Eh   |
          | GRADIENT NORM               0.000695237923 Eh/α |
          | HOMO-LUMO GAP               1.259660794583 eV   |
           -------------------------------------------------

------------------------------------------------------------------------
 * finished run on 2021/05/19 at 10:59:37.120     
------------------------------------------------------------------------
 total:
 * wall-time:     0 d,  0 h,  0 min,  0.597 sec
 *  cpu-time:     0 d,  0 h,  0 min,  0.596 sec
 * ratio c/w:     0.998 speedup
 SCF:
 * wall-time:     0 d,  0 h,  0 min,  0.036 sec
 *  cpu-time:     0 d,  0 h,  0 min,  0.036 sec
 * ratio c/w:     1.000 speedup
 ANC optimizer:
 * wall-time:     0 d,  0 h,  0 min,  0.540 sec
 *  cpu-time:     0 d,  0 h,  0 min,  0.540 sec
 * ratio c/w:     1.000 speedup

