      -----------------------------------------------------------      
     |                   =====================                   |     
     |                           x T B                           |     
     |                   =====================                   |     
     |                         S. Grimme                         |     
     |          Mulliken Center for Theoretical Chemistry        |     
     |                    University of Bonn                     |     
     |                Version 6.2 RC2 (SAW190805)                |     
      -----------------------------------------------------------      

   This program is distributed in the hope that it will be useful,
   but WITHOUT ANY WARRANTY; without even the implied warranty of
   MERCHANTABILITY or FITNESS FOR A PARTICULAR PURPOSE.
   
   FOR NON-COMMERCIAL, ACADEMIA USE ONLY.
   
   Cite this work as:
   * S. Grimme, C. Bannwarth, P. Shushkov, J. Chem. Theory Comput., 2017,
     13, 1989-2009. DOI: 10.1021/acs.jctc.7b00118
   * C. Bannwarth, S. Ehlert and S. Grimme., J. Chem. Theory Comput., 2019,
     15, 1652-1671. DOI: 10.1021/acs.jctc.8b01176
   * P. Pracht, E. Caldeweyher, S. Ehlert, S. Grimme, ChemRxiv, 2019, preprint.
     DOI: 10.26434/chemrxiv.8326202.v1
   
   for DFT-D4:
   * E. Caldeweyher, C. Bannwarth and S. Grimme, J. Chem. Phys., 2017,
     147, 034112. DOI: 10.1063/1.4993215
   * E. Caldeweyher, S. Ehlert, A. Hansen, H. Neugebauer, S. Spicher,
     C. Bannwarth and S. Grimme, J. Chem. Phys., 2019, 150, 154122.
     DOI: 10.1063/1.5090222
   
   for sTDA-xTB:
   * S. Grimme and C. Bannwarth, J. Chem. Phys., 2016, 145, 054103.
     DOI: 10.1063/1.4959605
   
   in the mass-spec context:
   * V. Asgeirsson, C. Bauer and S. Grimme, Chem. Sci., 2017, 8, 4879.
     DOI: 10.1039/c7sc00601b
   
   for metadynamics refer to:
   * S. Grimme, J. Chem. Theory Comput., 2019, 155, 2847-2862
     DOI: 10.1021/acs.jctc.9b00143
   
   with help from (in alphabetical order)
   C. Bannwarth, F. Bohle, G. Brandenburg, E. Caldeweyher, M. Checinski,
   S. Dohm, S. Ehlert, S. Ehrlich, F. März, H. Neugebauer, J. Pisarek,
   P. Pracht, P. Shushkov, and S. Spicher.
   
 * started run on 2021/05/19 at 10:59:37.137     

           -------------------------------------------------
          |                Calculation Setup                |
           -------------------------------------------------

          program call               : /ihome/ghutchison/geoffh/xtb/xtb 198.xyz -opt
          hostname                   : smp-n83
          coordinate file            : 198.xyz
          omp threads                :                     1
          number of atoms            :                    24
          number of electrons        :                    70
          charge                     :                     0
          spin                       :                   0.0
          first test random number   :      0.39418853423839


########################################################################
# WARNING! Please study the warnings concerning your input carefully
#  - the use of '-opt' is discouraged, please use '--opt' next time
########################################################################

           ------------------------------------------------- 
          |                 G F N 2 - x T B                 |
          | Geometry, Frequencies, Noncovalent interactions |
          |            JCTC 2019 parametrisation            |
           ------------------------------------------------- 
             KAB for C  - Si     :                1.0500
             KAB for H  - Pd     :                0.9500
             k(s)              :                1.8500
             k(p)              :                2.2300
             k(d)              :                2.2300
             k(f)              :                2.0000
             kEN (H0ij)        :               -2.0000
             D4 a1             :                0.5200
             D4 a2             :                5.0000
             D4 s6             :                1.0000
             D4 s8             :                2.7000
             D4 s9             :                5.0000
             alphaj            :                2.0000

  Z AO/shell   Hii/eV     exponent
  1     Wed Apr 25 08:07:45 CEST 2018   EN: 2.200 GM2: 0.406  GM3: 0.0800  RAES: 1.40
     1s    -10.707211    1.230000
  6     Wed Apr 25 08:07:45 CEST 2018   EN: 2.550 GM2: 0.538  GM3: 0.1500  RAES: 3.00
     2s    -13.970922    2.096432
     2p    -10.063292    1.800000
  8     Wed Apr 25 08:07:45 CEST 2018   EN: 3.440 GM2: 0.452  GM3:-0.0517  RAES: 1.80
     2s    -20.229985    2.439742
     2p    -15.503117    2.137023
 16     Tue Apr 24 11:44:34 CEST 2018   EN: 2.580 GM2: 0.340  GM3:-0.0502  RAES: 3.10
     3s    -20.029654    1.981333
     3p    -11.377694    2.025643
     3d     -0.420282    1.702555

           ------------------------------------------------- 
          |        Self-Consistent Charge Iterations        |
           ------------------------------------------------- 

          ...................................................
          :                      SETUP                      :
          :.................................................:
          :  # basis functions                  72          :
          :  # atomic orbitals                  71          :
          :  # shells                           39          :
          :  # electrons                        70          :
          :  max. iterations                   250          :
          :  Hamiltonian                  GFN2-xTB          :
          :  restarted?                      false          :
          :  GBSA solvation                  false          :
          :  PC potential                    false          :
          :  electronic temp.          300.0000000     K    :
          :  accuracy                    1.0000000          :
          :  -> integral cutoff          0.2500000E+02      :
          :  -> integral neglect         0.1000000E-07      :
          :  -> SCF convergence          0.1000000E-05 Eh   :
          :  -> wf. convergence          0.1000000E-03 e    :
          :  Broyden damping             0.4000000          :
          ...................................................

 iter      E             dE          RMSdq      gap      omega  full diag
   1    -38.5688159 -0.385688E+02  0.478E+00    1.74       0.0  T
   2    -38.6066409 -0.378250E-01  0.265E+00    1.69       1.0  T
   3    -38.5893535  0.172873E-01  0.165E+00    1.81       1.0  T
   4    -38.6038528 -0.144993E-01  0.777E-01    1.75       1.0  T
   5    -38.6180494 -0.141966E-01  0.201E-01    1.71       1.0  T
   6    -38.6186003 -0.550826E-03  0.722E-02    1.72       1.0  T
   7    -38.6186506 -0.503403E-04  0.373E-02    1.71       1.0  T
   8    -38.6186646 -0.140115E-04  0.140E-02    1.71       1.5  T
   9    -38.6186655 -0.916444E-06  0.733E-03    1.71       2.8  T
  10    -38.6186661 -0.565518E-06  0.279E-03    1.71       7.3  T
  11    -38.6186662 -0.422375E-07  0.138E-03    1.71      14.8  T
  12    -38.6186662 -0.275983E-07  0.476E-04    1.71      42.9  T
  13    -38.6186662 -0.946507E-09  0.229E-04    1.71      89.2  T

   *** convergence criteria satisfied after 13 iterations ***

         #    Occupation            Energy/Eh            Energy/eV
      -------------------------------------------------------------
         1        2.0000           -0.7363455             -20.0370
       ...           ...                  ...                  ...
        29        2.0000           -0.4447278             -12.1017
        30        2.0000           -0.4395523             -11.9608
        31        2.0000           -0.4356284             -11.8541
        32        2.0000           -0.4188947             -11.3987
        33        2.0000           -0.4025571             -10.9541
        34        2.0000           -0.3923207             -10.6756
        35        2.0000           -0.3638499              -9.9009 (HOMO)
        36                         -0.3008545              -8.1867 (LUMO)
        37                         -0.2600726              -7.0769
        38                         -0.2217565              -6.0343
        39                         -0.2098551              -5.7104
        40                         -0.1969011              -5.3580
       ...                                ...                  ...
        71                          0.7306800              19.8828
      -------------------------------------------------------------
                  HL-Gap            0.0629954 Eh            1.7142 eV
             Fermi-level           -0.3323522 Eh           -9.0438 eV

 SCC (total)                   0 d,  0 h,  0 min,  0.056 sec
 SCC setup                      ...        0 min,  0.000 sec (  0.629%)
 Dispersion                     ...        0 min,  0.000 sec (  0.695%)
 integral evaluation            ...        0 min,  0.010 sec ( 18.196%)
 zeroth order Hamiltonian       ...        0 min,  0.000 sec (  0.366%)
 iterations                     ...        0 min,  0.030 sec ( 53.205%)
 molecular gradient             ...        0 min,  0.015 sec ( 26.156%)
 printout                       ...        0 min,  0.000 sec (  0.649%)

         :::::::::::::::::::::::::::::::::::::::::::::::::::::
         ::                     SUMMARY                     ::
         :::::::::::::::::::::::::::::::::::::::::::::::::::::
         :: total energy             -38.043449151432 Eh    ::
         :: gradient norm              0.090932583276 Eh/a0 ::
         :: HOMO-LUMO gap              1.714191313593 eV    ::
         ::.................................................::
         :: SCC energy               -38.618666180658 Eh    ::
         :: -> isotropic ES            0.029331696929 Eh    ::
         :: -> anisotropic ES          0.002599548681 Eh    ::
         :: -> anisotropic XC          0.019408881319 Eh    ::
         :: -> dispersion             -0.025812840150 Eh    ::
         :: repulsion energy           0.575197070574 Eh    ::
         :: add. restraining           0.000000000000 Eh    ::
         :::::::::::::::::::::::::::::::::::::::::::::::::::::

      ----------------------------------------------------------- 
     |                   =====================                   |
     |                        A N C O P T                        |
     |                   =====================                   |
     |               Approximate Normal Coordinate               |
     |                Rational Function Optimizer                |
      ----------------------------------------------------------- 

          ...................................................
          :                      SETUP                      :
          :.................................................:
          :   optimization level            normal          :
          :   max. optcycles                   200          :
          :   ANC micro-cycles                  20          :
          :   degrees of freedom                66          :
          :.................................................:
          :   RF solver                   davidson          :
          :   input Hessian                  false          :
          :   write xtbopt.log                true          :
          :   linear?                        false          :
          :   energy convergence         0.5000000E-05 Eh   :
          :   grad. convergence          0.1000000E-02 Eh/α :
          :   maximium RF displ.         2.0000000          :
          :   Hlow (freq-cutoff)         0.5000000E-02      :
          :   Hmax (freq-cutoff)         5.0000000          :
          :   S6 in model hess.         20.0000000          :
          ...................................................

generating ANC from model Hessian ...
Using Lindh-Hessian (1995)
 Shifting diagonal of input Hessian by   4.081010694691236E-003
 Lowest  eigenvalues of input Hessian
   -0.000000   -0.000000   -0.000000    0.000000    0.000000    0.000000
    0.005000    0.006680    0.007481    0.008511    0.008996    0.011995
    0.012635    0.014622    0.020644    0.021716    0.023036    0.025521
 Highest eigenvalues
    1.704758    1.791891    1.906186    1.954959    2.038026    2.105221
 

........................................................................
.............................. CYCLE    1 ..............................
........................................................................
   1    -38.6186662 -0.386187E+02  0.980E-05    1.71       0.0  T
   2    -38.6186662 -0.283791E-10  0.593E-05    1.71     344.2  T
   3    -38.6186662 -0.250893E-10  0.441E-05    1.71     463.2  T
     SCC iter.                  ...        0 min,  0.004 sec
     gradient                   ...        0 min,  0.014 sec
 * total energy  :   -38.0434492 Eh     change       -0.5057515E-08 Eh
   gradient norm :     0.0909330 Eh/α   predicted     0.0000000E+00 (-100.00%)
   displ. norm   :     0.3064712 α      lambda       -0.1393260E-01
   maximum displ.:     0.1456620 α      in ANC's #16, #12, #21, ...

........................................................................
.............................. CYCLE    2 ..............................
........................................................................
   1    -38.6526830 -0.386527E+02  0.255E-01    1.78       0.0  T
   2    -38.6527557 -0.726951E-04  0.147E-01    1.77       1.0  T
   3    -38.6526509  0.104818E-03  0.920E-02    1.77       1.0  T
   4    -38.6527932 -0.142296E-03  0.361E-02    1.77       1.0  T
   5    -38.6528131 -0.198797E-04  0.184E-02    1.77       1.1  T
   6    -38.6528183 -0.518872E-05  0.587E-03    1.77       3.5  T
   7    -38.6528186 -0.307408E-06  0.222E-03    1.77       9.2  T
     SCC iter.                  ...        0 min,  0.008 sec
     gradient                   ...        0 min,  0.014 sec
 * total energy  :   -38.0529251 Eh     change       -0.9475951E-02 Eh
   gradient norm :     0.0399797 Eh/α   predicted    -0.7620611E-02 ( -19.58%)
   displ. norm   :     0.2587430 α      lambda       -0.3754419E-02
   maximum displ.:     0.1217245 α      in ANC's #3, #12, #16, ...

........................................................................
.............................. CYCLE    3 ..............................
........................................................................
   1    -38.6669102 -0.386669E+02  0.183E-01    1.83       0.0  T
   2    -38.6669468 -0.365941E-04  0.111E-01    1.82       1.0  T
   3    -38.6668953  0.515429E-04  0.689E-02    1.82       1.0  T
   4    -38.6669673 -0.719937E-04  0.229E-02    1.82       1.0  T
   5    -38.6669786 -0.113278E-04  0.848E-03    1.82       2.4  T
   6    -38.6669798 -0.121697E-05  0.300E-03    1.82       6.8  T
   7    -38.6669799 -0.721063E-07  0.131E-03    1.82      15.6  T
     SCC iter.                  ...        0 min,  0.008 sec
     gradient                   ...        0 min,  0.014 sec
 * total energy  :   -38.0549940 Eh     change       -0.2068939E-02 Eh
   gradient norm :     0.0093364 Eh/α   predicted    -0.2002884E-02 (  -3.19%)
   displ. norm   :     0.1825140 α      lambda       -0.5208538E-03
   maximum displ.:     0.1281743 α      in ANC's #3, #4, #5, ...

........................................................................
.............................. CYCLE    4 ..............................
........................................................................
   1    -38.6657235 -0.386657E+02  0.123E-01    1.82       0.0  T
   2    -38.6657272 -0.366630E-05  0.713E-02    1.83       1.0  T
   3    -38.6657119  0.152479E-04  0.301E-02    1.82       1.0  T
   4    -38.6657294 -0.175026E-04  0.847E-03    1.83       2.4  T
   5    -38.6657296 -0.201579E-06  0.628E-03    1.83       3.3  T
   6    -38.6657304 -0.749716E-06  0.145E-03    1.83      14.1  T
   7    -38.6657304 -0.220774E-07  0.746E-04    1.83      27.4  T
     SCC iter.                  ...        0 min,  0.008 sec
     gradient                   ...        0 min,  0.014 sec
 * total energy  :   -38.0553543 Eh     change       -0.3602544E-03 Eh
   gradient norm :     0.0053887 Eh/α   predicted    -0.2691031E-03 ( -25.30%)
   displ. norm   :     0.2290065 α      lambda       -0.3990697E-03
   maximum displ.:     0.1675800 α      in ANC's #3, #4, #5, ...

........................................................................
.............................. CYCLE    5 ..............................
........................................................................
   1    -38.6636049 -0.386636E+02  0.148E-01    1.82       0.0  T
   2    -38.6636077 -0.277232E-05  0.862E-02    1.82       1.0  T
   3    -38.6635944  0.133012E-04  0.269E-02    1.82       1.0  T
   4    -38.6636090 -0.146567E-04  0.801E-03    1.82       2.5  T
   5    -38.6636093 -0.271887E-06  0.564E-03    1.82       3.6  T
   6    -38.6636099 -0.612595E-06  0.111E-03    1.82      18.4  T
   7    -38.6636099 -0.103957E-07  0.630E-04    1.82      32.4  T
     SCC iter.                  ...        0 min,  0.008 sec
     gradient                   ...        0 min,  0.014 sec
 * total energy  :   -38.0556402 Eh     change       -0.2859297E-03 Eh
   gradient norm :     0.0072108 Eh/α   predicted    -0.2100058E-03 ( -26.55%)
   displ. norm   :     0.2344330 α      lambda       -0.3235731E-03
   maximum displ.:     0.1805339 α      in ANC's #3, #4, #5, ...

........................................................................
.............................. CYCLE    6 ..............................
........................................................................
   1    -38.6629662 -0.386630E+02  0.145E-01    1.81       0.0  T
   2    -38.6629682 -0.194516E-05  0.837E-02    1.81       1.0  T
   3    -38.6629572  0.109465E-04  0.244E-02    1.81       1.0  T
   4    -38.6629689 -0.116955E-04  0.802E-03    1.81       2.5  T
   5    -38.6629694 -0.439893E-06  0.450E-03    1.81       4.5  T
   6    -38.6629697 -0.348730E-06  0.119E-03    1.81      17.2  T
   7    -38.6629697 -0.169733E-07  0.639E-04    1.81      32.0  T
     SCC iter.                  ...        0 min,  0.008 sec
     gradient                   ...        0 min,  0.014 sec
 * total energy  :   -38.0558903 Eh     change       -0.2500968E-03 Eh
   gradient norm :     0.0084550 Eh/α   predicted    -0.1706795E-03 ( -31.75%)
   displ. norm   :     0.2893743 α      lambda       -0.3967081E-03
   maximum displ.:     0.2329869 α      in ANC's #3, #4, #5, ...

........................................................................
.............................. CYCLE    7 ..............................
........................................................................
   1    -38.6635351 -0.386635E+02  0.180E-01    1.79       0.0  T
   2    -38.6635390 -0.387686E-05  0.105E-01    1.79       1.0  T
   3    -38.6635214  0.175646E-04  0.327E-02    1.79       1.0  T
   4    -38.6635410 -0.195549E-04  0.958E-03    1.79       2.1  T
   5    -38.6635412 -0.169926E-06  0.636E-03    1.79       3.2  T
   6    -38.6635419 -0.700689E-06  0.205E-03    1.79      10.0  T
   7    -38.6635419 -0.611497E-07  0.962E-04    1.79      21.2  T
     SCC iter.                  ...        0 min,  0.008 sec
     gradient                   ...        0 min,  0.014 sec
 * total energy  :   -38.0561817 Eh     change       -0.2913960E-03 Eh
   gradient norm :     0.0073668 Eh/α   predicted    -0.2149642E-03 ( -26.23%)
   displ. norm   :     0.3226613 α      lambda       -0.3604643E-03
   maximum displ.:     0.2797717 α      in ANC's #3, #4, #5, ...

........................................................................
.............................. CYCLE    8 ..............................
........................................................................
   1    -38.6643909 -0.386644E+02  0.179E-01    1.77       0.0  T
   2    -38.6643940 -0.309755E-05  0.104E-01    1.77       1.0  T
   3    -38.6643865  0.750428E-05  0.219E-02    1.77       1.0  T
   4    -38.6643957 -0.920622E-05  0.664E-03    1.77       3.1  T
   5    -38.6643959 -0.149863E-06  0.302E-03    1.77       6.8  T
   6    -38.6643960 -0.111941E-06  0.120E-03    1.77      17.0  T
   7    -38.6643960 -0.906977E-08  0.716E-04    1.77      28.5  T
     SCC iter.                  ...        0 min,  0.008 sec
     gradient                   ...        0 min,  0.014 sec
 * total energy  :   -38.0564287 Eh     change       -0.2469623E-03 Eh
   gradient norm :     0.0055056 Eh/α   predicted    -0.1989982E-03 ( -19.42%)
   displ. norm   :     0.3013032 α      lambda       -0.2733551E-03
   maximum displ.:     0.2763282 α      in ANC's #3, #4, #8, ...

........................................................................
.............................. CYCLE    9 ..............................
........................................................................
   1    -38.6658972 -0.386659E+02  0.174E-01    1.76       0.0  T
   2    -38.6659007 -0.351959E-05  0.102E-01    1.76       1.0  T
   3    -38.6658723  0.284364E-04  0.405E-02    1.76       1.0  T
   4    -38.6659041 -0.318433E-04  0.755E-03    1.76       2.7  T
   5    -38.6659042 -0.101808E-06  0.548E-03    1.76       3.7  T
   6    -38.6659047 -0.456031E-06  0.206E-03    1.76       9.9  T
   7    -38.6659047 -0.578385E-07  0.957E-04    1.76      21.3  T
     SCC iter.                  ...        0 min,  0.008 sec
     gradient                   ...        0 min,  0.014 sec
 * total energy  :   -38.0566016 Eh     change       -0.1729548E-03 Eh
   gradient norm :     0.0053276 Eh/α   predicted    -0.1490860E-03 ( -13.80%)
   displ. norm   :     0.3361600 α      lambda       -0.1811091E-03
   maximum displ.:     0.3005598 α      in ANC's #3, #7, #5, ...

........................................................................
.............................. CYCLE   10 ..............................
........................................................................
   1    -38.6633491 -0.386633E+02  0.181E-01    1.74       0.0  T
   2    -38.6633522 -0.309190E-05  0.107E-01    1.75       1.0  T
   3    -38.6633130  0.392144E-04  0.427E-02    1.75       1.0  T
   4    -38.6633548 -0.418774E-04  0.828E-03    1.75       2.5  T
   5    -38.6633555 -0.675383E-06  0.485E-03    1.75       4.2  T
   6    -38.6633558 -0.286916E-06  0.164E-03    1.75      12.4  T
   7    -38.6633558 -0.138108E-07  0.744E-04    1.75      27.5  T
     SCC iter.                  ...        0 min,  0.008 sec
     gradient                   ...        0 min,  0.013 sec
 * total energy  :   -38.0566501 Eh     change       -0.4846849E-04 Eh
   gradient norm :     0.0079864 Eh/α   predicted    -0.1007912E-03 ( 107.95%)
   displ. norm   :     0.0961091 α      lambda       -0.2073347E-03
   maximum displ.:     0.0500133 α      in ANC's #4, #5, #3, ...

........................................................................
.............................. CYCLE   11 ..............................
........................................................................
   1    -38.6679203 -0.386679E+02  0.554E-02    1.76       0.0  T
   2    -38.6679207 -0.444859E-06  0.320E-02    1.76       1.0  T
   3    -38.6679163  0.442424E-05  0.143E-02    1.76       1.4  T
   4    -38.6679209 -0.465900E-05  0.356E-03    1.76       5.7  T
   5    -38.6679211 -0.120533E-06  0.169E-03    1.76      12.1  T
   6    -38.6679211 -0.325522E-07  0.520E-04    1.76      39.3  T
     SCC iter.                  ...        0 min,  0.007 sec
     gradient                   ...        0 min,  0.014 sec
 * total energy  :   -38.0567007 Eh     change       -0.5061247E-04 Eh
   gradient norm :     0.0071063 Eh/α   predicted    -0.1046284E-03 ( 106.72%)
   displ. norm   :     0.0900384 α      lambda       -0.1124274E-03
   maximum displ.:     0.0746230 α      in ANC's #3, #8, #2, ...

........................................................................
.............................. CYCLE   12 ..............................
........................................................................
   1    -38.6661905 -0.386662E+02  0.652E-02    1.75       0.0  T
   2    -38.6661913 -0.794871E-06  0.376E-02    1.75       1.0  T
   3    -38.6661841  0.722274E-05  0.195E-02    1.75       1.0  T
   4    -38.6661917 -0.761795E-05  0.433E-03    1.75       4.7  T
   5    -38.6661918 -0.168089E-06  0.222E-03    1.75       9.2  T
   6    -38.6661919 -0.597938E-07  0.934E-04    1.75      21.9  T
     SCC iter.                  ...        0 min,  0.007 sec
     gradient                   ...        0 min,  0.013 sec
 * total energy  :   -38.0567386 Eh     change       -0.3786071E-04 Eh
   gradient norm :     0.0055574 Eh/α   predicted    -0.5667132E-04 (  49.68%)
   displ. norm   :     0.0493766 α      lambda       -0.4606026E-04
   maximum displ.:     0.0348444 α      in ANC's #3, #1, #11, ...

........................................................................
.............................. CYCLE   13 ..............................
........................................................................
   1    -38.6659520 -0.386660E+02  0.241E-02    1.75       0.0  T
   2    -38.6659523 -0.353626E-06  0.147E-02    1.76       1.4  T
   3    -38.6659493  0.302798E-05  0.124E-02    1.76       1.6  T
   4    -38.6659526 -0.334584E-05  0.228E-03    1.76       9.0  T
   5    -38.6659527 -0.765266E-07  0.910E-04    1.76      22.4  T
   6    -38.6659527 -0.702082E-08  0.450E-04    1.76      45.4  T
     SCC iter.                  ...        0 min,  0.008 sec
     gradient                   ...        0 min,  0.014 sec
 * total energy  :   -38.0567548 Eh     change       -0.1620897E-04 Eh
   gradient norm :     0.0022194 Eh/α   predicted    -0.2309122E-04 (  42.46%)
   displ. norm   :     0.0425609 α      lambda       -0.1801273E-04
   maximum displ.:     0.0326981 α      in ANC's #3, #1, #9, ...

........................................................................
.............................. CYCLE   14 ..............................
........................................................................
   1    -38.6659116 -0.386659E+02  0.260E-02    1.76       0.0  T
   2    -38.6659117 -0.123734E-06  0.148E-02    1.76       1.4  T
   3    -38.6659108  0.914810E-06  0.776E-03    1.76       2.6  T
   4    -38.6659118 -0.997448E-06  0.185E-03    1.76      11.0  T
   5    -38.6659118 -0.851950E-08  0.130E-03    1.76      15.7  T
   6    -38.6659118 -0.320096E-07  0.339E-04    1.76      60.2  T
   7    -38.6659118 -0.172772E-08  0.133E-04    1.76     153.7  T
     SCC iter.                  ...        0 min,  0.008 sec
     gradient                   ...        0 min,  0.015 sec
 * total energy  :   -38.0567643 Eh     change       -0.9531398E-05 Eh
   gradient norm :     0.0012789 Eh/α   predicted    -0.9024305E-05 (  -5.32%)
   displ. norm   :     0.0518004 α      lambda       -0.8342564E-05
   maximum displ.:     0.0289112 α      in ANC's #3, #1, #4, ...

........................................................................
.............................. CYCLE   15 ..............................
........................................................................
   1    -38.6666305 -0.386666E+02  0.326E-02    1.76       0.0  T
   2    -38.6666307 -0.192203E-06  0.181E-02    1.76       1.1  T
   3    -38.6666288  0.191809E-05  0.938E-03    1.76       2.2  T
   4    -38.6666309 -0.205501E-05  0.249E-03    1.76       8.2  T
   5    -38.6666309 -0.317587E-07  0.128E-03    1.76      15.9  T
   6    -38.6666309 -0.234656E-07  0.319E-04    1.76      63.9  T
   7    -38.6666309 -0.153236E-08  0.100E-04    1.76     203.2  T
     SCC iter.                  ...        0 min,  0.009 sec
     gradient                   ...        0 min,  0.015 sec
 * total energy  :   -38.0567705 Eh     change       -0.6128466E-05 Eh
   gradient norm :     0.0015137 Eh/α   predicted    -0.4178230E-05 ( -31.82%)
   displ. norm   :     0.0758657 α      lambda       -0.6687512E-05
   maximum displ.:     0.0550042 α      in ANC's #3, #1, #8, ...

........................................................................
.............................. CYCLE   16 ..............................
........................................................................
   1    -38.6661563 -0.386662E+02  0.445E-02    1.76       0.0  T
   2    -38.6661567 -0.433299E-06  0.250E-02    1.76       1.0  T
   3    -38.6661558  0.878396E-06  0.751E-03    1.76       2.7  T
   4    -38.6661567 -0.894863E-06  0.353E-03    1.76       5.8  T
   5    -38.6661568 -0.112010E-06  0.181E-03    1.76      11.3  T
   6    -38.6661569 -0.568347E-07  0.486E-04    1.76      42.0  T
   7    -38.6661569 -0.328723E-08  0.202E-04    1.76     101.0  T
     SCC iter.                  ...        0 min,  0.008 sec
     gradient                   ...        0 min,  0.014 sec
 * total energy  :   -38.0567757 Eh     change       -0.5248317E-05 Eh
   gradient norm :     0.0011648 Eh/α   predicted    -0.3355581E-05 ( -36.06%)
   displ. norm   :     0.0337858 α      lambda       -0.3846744E-05
   maximum displ.:     0.0226489 α      in ANC's #1, #4, #6, ...

........................................................................
.............................. CYCLE   17 ..............................
........................................................................
   1    -38.6663568 -0.386664E+02  0.166E-02    1.76       0.0  T
   2    -38.6663568 -0.469790E-07  0.952E-03    1.76       2.1  T
   3    -38.6663568  0.486174E-07  0.183E-03    1.76      11.2  T
   4    -38.6663568 -0.412983E-07  0.108E-03    1.76      18.9  T
   5    -38.6663568 -0.157533E-07  0.529E-04    1.76      38.6  T
   6    -38.6663568 -0.477430E-08  0.194E-04    1.76     105.2  T
     SCC iter.                  ...        0 min,  0.008 sec
     gradient                   ...        0 min,  0.014 sec
 * total energy  :   -38.0567794 Eh     change       -0.3702499E-05 Eh
   gradient norm :     0.0012664 Eh/α   predicted    -0.1926379E-05 ( -47.97%)
   displ. norm   :     0.0455235 α      lambda       -0.3688791E-05
   maximum displ.:     0.0312216 α      in ANC's #1, #4, #6, ...

........................................................................
.............................. CYCLE   18 ..............................
........................................................................
   1    -38.6664716 -0.386665E+02  0.223E-02    1.76       0.0  T
   2    -38.6664716 -0.454397E-07  0.128E-02    1.76       1.6  T
   3    -38.6664714  0.243080E-06  0.384E-03    1.76       5.3  T
   4    -38.6664717 -0.272938E-06  0.103E-03    1.76      19.8  T
   5    -38.6664716  0.406639E-08  0.683E-04    1.76      29.9  T
   6    -38.6664717 -0.103824E-07  0.170E-04    1.76     119.8  T
     SCC iter.                  ...        0 min,  0.007 sec
     gradient                   ...        0 min,  0.014 sec
 * total energy  :   -38.0567831 Eh     change       -0.3691494E-05 Eh
   gradient norm :     0.0010605 Eh/α   predicted    -0.1851042E-05 ( -49.86%)
   displ. norm   :     0.0368017 α      lambda       -0.2268853E-05
   maximum displ.:     0.0271976 α      in ANC's #1, #4, #5, ...

........................................................................
.............................. CYCLE   19 ..............................
........................................................................
   1    -38.6662237 -0.386662E+02  0.184E-02    1.76       0.0  T
   2    -38.6662237 -0.520870E-07  0.104E-02    1.76       2.0  T
   3    -38.6662237  0.364105E-07  0.205E-03    1.76      10.0  T
   4    -38.6662238 -0.406015E-07  0.114E-03    1.76      17.9  T
   5    -38.6662238 -0.108023E-07  0.395E-04    1.76      51.7  T
   6    -38.6662238 -0.241898E-08  0.158E-04    1.76     129.1  T
     SCC iter.                  ...        0 min,  0.007 sec
     gradient                   ...        0 min,  0.014 sec
 * total energy  :   -38.0567849 Eh     change       -0.1799795E-05 Eh
   gradient norm :     0.0005963 Eh/α   predicted    -0.1138384E-05 ( -36.75%)
   displ. norm   :     0.0233234 α      lambda       -0.1337057E-05
   maximum displ.:     0.0201480 α      in ANC's #1, #4, #9, ...

   *** GEOMETRY OPTIMIZATION CONVERGED AFTER 19 ITERATIONS ***

------------------------------------------------------------------------
 total energy gain   :        -0.0133357 Eh       -8.3683 kcal/mol
 total RMSD          :         0.4823664 a0        0.2553 Å
 total power (kW/mol):        -1.8427887 (step)  -56.0123 (real)
------------------------------------------------------------------------

 ANCopt (total)                0 d,  0 h,  0 min,  0.625 sec
 optimizer setup                ...        0 min,  0.000 sec (  0.024%)
 model hessian                  ...        0 min,  0.003 sec (  0.493%)
 ANC generation                 ...        0 min,  0.001 sec (  0.105%)
 coordinate transformation      ...        0 min,  0.000 sec (  0.059%)
 single point calculation       ...        0 min,  0.613 sec ( 98.082%)
 optimization log               ...        0 min,  0.002 sec (  0.297%)
 hessian update                 ...        0 min,  0.000 sec (  0.041%)
 rational function              ...        0 min,  0.004 sec (  0.706%)

================
 final structure:
================
$coord
   -3.20951414601848    1.98099826872502   -0.43300568430067      C 
   -5.19950684132412   -0.53166797052392   -0.13088472998311      S 
   -2.74109164272590   -2.66225571666321    0.15549960802333      C 
   -0.42645911761206   -1.40634802841362    0.01401365186539      C 
   -0.70901169827900    1.27940964403443   -0.32608229510860      C 
    1.48706135198977    2.84914859975370   -0.53304832226872      C 
    1.20386446628367    5.60608679662057   -0.87680258295471      C 
   -0.80109527828091    6.68442023102325   -0.59743608210655      O 
    3.54850717924724    7.06775732245421   -1.61122181592819      C 
    3.81391619047966    1.70179607409856   -0.37600918438788      C 
    4.07546248797815   -0.91891986100619   -0.01990333117199      C 
    2.01382327454780   -2.45946500162616    0.16875258502227      C 
   -3.17007846157800   -5.31560917800975    0.47470273153501      C 
   -5.43384832423475   -6.41559851237138    0.56025199561818      C 
   -3.96504523261531    3.84249333534444   -0.66640366079243      H 
    4.45227546188768    6.22214013141413   -3.25108102820532      H 
    4.88448247732014    7.08619255692628   -0.04789511232040      H 
    3.01204592028296    9.00374054370730   -2.04093457860326      H 
    5.51837346148496    2.81335955716636   -0.49741333780457      H 
    5.95359871902858   -1.70776780696300    0.10400653261296      H 
    2.24218851596299   -4.46814836251637    0.43990551528372      H 
   -1.48203514323052   -6.45671482051211    0.64862271459064      H 
   -7.14965567359715   -5.33189991781775    0.39224979771471      H 
   -5.63476980164653   -8.42265597103884    0.80494682689624      H 
$end
           -------------------------------------------------
          |                Final Singlepoint                |
           -------------------------------------------------

          ...................................................
          :                      SETUP                      :
          :.................................................:
          :  # basis functions                  72          :
          :  # atomic orbitals                  71          :
          :  # shells                           39          :
          :  # electrons                        70          :
          :  max. iterations                   250          :
          :  Hamiltonian                  GFN2-xTB          :
          :  restarted?                      false          :
          :  GBSA solvation                  false          :
          :  PC potential                    false          :
          :  electronic temp.          300.0000000     K    :
          :  accuracy                    1.0000000          :
          :  -> integral cutoff          0.2500000E+02      :
          :  -> integral neglect         0.1000000E-07      :
          :  -> SCF convergence          0.1000000E-05 Eh   :
          :  -> wf. convergence          0.1000000E-03 e    :
          :  Broyden damping             0.4000000          :
          ...................................................

 iter      E             dE          RMSdq      gap      omega  full diag
   1    -38.6662238 -0.386662E+02  0.115E-04    1.76       0.0  T
   2    -38.6662238  0.330687E-10  0.462E-05    1.76     442.1  T
   3    -38.6662238  0.173870E-10  0.829E-05    1.76     246.1  T

   *** convergence criteria satisfied after 3 iterations ***

         #    Occupation            Energy/Eh            Energy/eV
      -------------------------------------------------------------
         1        2.0000           -0.7366230             -20.0445
       ...           ...                  ...                  ...
        29        2.0000           -0.4440437             -12.0830
        30        2.0000           -0.4432936             -12.0626
        31        2.0000           -0.4365766             -11.8799
        32        2.0000           -0.4207337             -11.4487
        33        2.0000           -0.4045722             -11.0090
        34        2.0000           -0.3880342             -10.5589
        35        2.0000           -0.3651172              -9.9353 (HOMO)
        36                         -0.3006029              -8.1798 (LUMO)
        37                         -0.2589607              -7.0467
        38                         -0.2136319              -5.8132
        39                         -0.2010580              -5.4711
        40                         -0.1997796              -5.4363
       ...                                ...                  ...
        71                          0.7289735              19.8364
      -------------------------------------------------------------
                  HL-Gap            0.0645143 Eh            1.7555 eV
             Fermi-level           -0.3328600 Eh           -9.0576 eV

 SCC (total)                   0 d,  0 h,  0 min,  0.029 sec
 SCC setup                      ...        0 min,  0.000 sec (  0.663%)
 Dispersion                     ...        0 min,  0.000 sec (  0.909%)
 integral evaluation            ...        0 min,  0.010 sec ( 33.237%)
 zeroth order Hamiltonian       ...        0 min,  0.000 sec (  0.573%)
 iterations                     ...        0 min,  0.004 sec ( 14.400%)
 molecular gradient             ...        0 min,  0.014 sec ( 48.817%)
 printout                       ...        0 min,  0.000 sec (  1.188%)

         :::::::::::::::::::::::::::::::::::::::::::::::::::::
         ::                     SUMMARY                     ::
         :::::::::::::::::::::::::::::::::::::::::::::::::::::
         :: total energy             -38.056784908973 Eh    ::
         :: gradient norm              0.000596184990 Eh/a0 ::
         :: HOMO-LUMO gap              1.755524461303 eV    ::
         ::.................................................::
         :: SCC energy               -38.666223763851 Eh    ::
         :: -> isotropic ES            0.028689436519 Eh    ::
         :: -> anisotropic ES          0.002421391675 Eh    ::
         :: -> anisotropic XC          0.017992762903 Eh    ::
         :: -> dispersion             -0.025967487307 Eh    ::
         :: repulsion energy           0.609437201781 Eh    ::
         :: add. restraining           0.000000000000 Eh    ::
         :::::::::::::::::::::::::::::::::::::::::::::::::::::

           -------------------------------------------------
          |                Property Printout                |
           -------------------------------------------------

    * Orbital Energies and Occupations

         #    Occupation            Energy/Eh            Energy/eV
      -------------------------------------------------------------
         1        2.0000           -0.7366230             -20.0445
       ...           ...                  ...                  ...
        23        2.0000           -0.4769300             -12.9779
        24        2.0000           -0.4725734             -12.8594
        25        2.0000           -0.4694763             -12.7751
        26        2.0000           -0.4656075             -12.6698
        27        2.0000           -0.4574724             -12.4485
        28        2.0000           -0.4502673             -12.2524
        29        2.0000           -0.4440437             -12.0830
        30        2.0000           -0.4432936             -12.0626
        31        2.0000           -0.4365766             -11.8799
        32        2.0000           -0.4207337             -11.4487
        33        2.0000           -0.4045722             -11.0090
        34        2.0000           -0.3880342             -10.5589
        35        2.0000           -0.3651172              -9.9353 (HOMO)
        36                         -0.3006029              -8.1798 (LUMO)
        37                         -0.2589607              -7.0467
        38                         -0.2136319              -5.8132
        39                         -0.2010580              -5.4711
        40                         -0.1997796              -5.4363
        41                         -0.1600149              -4.3542
        42                         -0.1215398              -3.3073
        43                         -0.0870774              -2.3695
        44                         -0.0050811              -0.1383
        45                          0.0275996               0.7510
        46                          0.0378502               1.0300
       ...                                ...                  ...
        71                          0.7289735              19.8364
      -------------------------------------------------------------
                  HL-Gap            0.0645143 Eh            1.7555 eV
             Fermi-level           -0.3328600 Eh           -9.0576 eV

     #   Z        covCN         q      C6AA      α(0)
     1   6 C      2.927    -0.030    28.757     8.794
     2  16 S      2.327     0.021   140.199    19.928
     3   6 C      2.977     0.010    27.786     8.647
     4   6 C      3.172    -0.006    27.793     8.611
     5   6 C      3.167     0.006    27.522     8.572
     6   6 C      2.959    -0.023    28.566     8.767
     7   6 C      2.816     0.231    23.155     7.884
     8   8 O      0.858    -0.378    21.247     6.180
     9   6 C      3.753    -0.135    23.160     6.862
    10   6 C      2.919    -0.028    28.704     8.786
    11   6 C      2.914    -0.033    28.827     8.804
    12   6 C      2.909    -0.024    28.597     8.769
    13   6 C      2.920    -0.030    28.760     8.794
    14   6 C      2.841    -0.089    30.233     9.011
    15   1 H      0.927     0.079     1.986     2.204
    16   1 H      0.925     0.058     2.228     2.334
    17   1 H      0.925     0.062     2.172     2.305
    18   1 H      0.925     0.066     2.130     2.282
    19   1 H      0.926     0.041     2.434     2.440
    20   1 H      0.926     0.035     2.519     2.482
    21   1 H      0.926     0.036     2.506     2.475
    22   1 H      0.925     0.042     2.427     2.436
    23   1 H      0.926     0.047     2.353     2.399
    24   1 H      0.926     0.043     2.411     2.428

 Mol. C6AA /au·bohr⁶  :       8945.874737
 Mol. C8AA /au·bohr⁸  :     244927.293406
 Mol. α(0) /au        :        152.195168


Wiberg/Mayer (AO) data.
largest (>0.10) Wiberg bond orders for each atom
          total WBO             WBO to atom ...
     1  C   3.945        C    5 1.471    S    2 1.243    H   15 0.960    C    3 0.123
     2  S   2.730        C    1 1.243    C    3 1.182
     3  C   3.947        C    4 1.357    S    2 1.182    C   13 1.160    C    1 0.123
     4  C   3.988        C    3 1.357    C   12 1.261    C    5 1.163
     5  C   3.988        C    1 1.471    C    6 1.178    C    4 1.163
     6  C   3.981        C   10 1.512    C    5 1.178    C    7 1.045    C   12 0.105
     7  C   3.926        O    8 1.800    C    6 1.045    C    9 0.998
     8  O   2.054        C    7 1.800
     9  C   3.994        C    7 0.998    H   18 0.983    H   16 0.969    H   17 0.960
    10  C   3.991        C    6 1.512    C   11 1.308    H   19 0.965
    11  C   3.974        C   12 1.558    C   10 1.308    H   20 0.970
    12  C   3.992        C   11 1.558    C    4 1.261    H   21 0.965    C    6 0.105
    13  C   3.992        C   14 1.838    C    3 1.160    H   22 0.956
    14  C   3.962        C   13 1.838    H   24 0.978    H   23 0.972
    15  H   0.993        C    1 0.960
    16  H   0.996        C    9 0.969
    17  H   0.996        C    9 0.960
    18  H   0.995        C    9 0.983
    19  H   0.997        C   10 0.965
    20  H   0.997        C   11 0.970
    21  H   0.998        C   12 0.965
    22  H   0.998        C   13 0.956
    23  H   0.998        C   14 0.972
    24  H   0.998        C   14 0.978

molecular dipole:
                 x           y           z       tot (Debye)
 q only:        0.636      -0.842      -0.093
   full:        1.093      -0.864      -0.104       3.550
molecular quadrupole (traceless):
                xx          xy          yy          xz          yz          zz
 q only:        6.496       8.012      -5.409      -1.168      -1.359      -1.086
  q+dip:        7.350       8.627      -2.954      -1.125      -2.413      -4.396
   full:        4.844       8.725      -4.659      -1.000      -1.641      -0.184

           -------------------------------------------------
          |                Geometry Summary                 |
           -------------------------------------------------

      molecular mass/u    :      202.2704000
   center of mass at/Å    :       -0.4347668       0.2830739      -0.1349072
  moments of inertia/u·Å² :        0.3909563E+03   0.1174145E+04   0.1557851E+04
rotational constants/cm⁻¹ :        0.4311897E-01   0.1435737E-01   0.1082108E-01

 * 23 selected distances

     #   Z        #   Z                                     value/Å
     1   6 C      2  16 S                                 1.7036582
     2  16 S      3   6 C                                 1.7281689 (max)
     3   6 C      4   6 C                                 1.3955485
     1   6 C      5   6 C                                 1.3754712
     4   6 C      5   6 C                                 1.4403730
     5   6 C      6   6 C                                 1.4326591
     7   6 C      8   8 O                                 1.2137338
     6   6 C     10   6 C                                 1.3753858
    10   6 C     11   6 C                                 1.4063945
     4   6 C     12   6 C                                 1.4088422
    11   6 C     12   6 C                                 1.3655672
     3   6 C     13   6 C                                 1.4323221
    13   6 C     14   6 C                                 1.3326391
     1   6 C     15   1 H                                 1.0702557 (min)
     9   6 C     16   1 H                                 1.0871990
     9   6 C     17   1 H                                 1.0882489
     9   6 C     18   1 H                                 1.0871309
    10   6 C     19   1 H                                 1.0787285
    11   6 C     20   1 H                                 1.0799664
    12   6 C     21   1 H                                 1.0793768
    13   6 C     22   1 H                                 1.0821462
    14   6 C     23   1 H                                 1.0775772
    14   6 C     24   1 H                                 1.0752232

 * 4 distinct bonds (by element types)

   Z      Z             #   av. dist./Å        max./Å        min./Å
   1 H    6 C          10     1.0805853     1.0882489     1.0702557
   6 C    6 C          10     1.3965203     1.4403730     1.3326391
   6 C    8 O           1     1.2137338     1.2137338     1.2137338
   6 C   16 S           2     1.7159136     1.7281689     1.7036582


optimized geometry written to: xtbopt.xyz


           -------------------------------------------------
          | TOTAL ENERGY              -38.056784908973 Eh   |
          | GRADIENT NORM               0.000596184990 Eh/α |
          | HOMO-LUMO GAP               1.755524461303 eV   |
           -------------------------------------------------

------------------------------------------------------------------------
 * finished run on 2021/05/19 at 10:59:37.892     
------------------------------------------------------------------------
 total:
 * wall-time:     0 d,  0 h,  0 min,  0.755 sec
 *  cpu-time:     0 d,  0 h,  0 min,  0.720 sec
 * ratio c/w:     0.954 speedup
 SCF:
 * wall-time:     0 d,  0 h,  0 min,  0.056 sec
 *  cpu-time:     0 d,  0 h,  0 min,  0.043 sec
 * ratio c/w:     0.767 speedup
 ANC optimizer:
 * wall-time:     0 d,  0 h,  0 min,  0.655 sec
 *  cpu-time:     0 d,  0 h,  0 min,  0.655 sec
 * ratio c/w:     1.000 speedup

