      -----------------------------------------------------------      
     |                   =====================                   |     
     |                           x T B                           |     
     |                   =====================                   |     
     |                         S. Grimme                         |     
     |          Mulliken Center for Theoretical Chemistry        |     
     |                    University of Bonn                     |     
     |                Version 6.2 RC2 (SAW190805)                |     
      -----------------------------------------------------------      

   This program is distributed in the hope that it will be useful,
   but WITHOUT ANY WARRANTY; without even the implied warranty of
   MERCHANTABILITY or FITNESS FOR A PARTICULAR PURPOSE.
   
   FOR NON-COMMERCIAL, ACADEMIA USE ONLY.
   
   Cite this work as:
   * S. Grimme, C. Bannwarth, P. Shushkov, J. Chem. Theory Comput., 2017,
     13, 1989-2009. DOI: 10.1021/acs.jctc.7b00118
   * C. Bannwarth, S. Ehlert and S. Grimme., J. Chem. Theory Comput., 2019,
     15, 1652-1671. DOI: 10.1021/acs.jctc.8b01176
   * P. Pracht, E. Caldeweyher, S. Ehlert, S. Grimme, ChemRxiv, 2019, preprint.
     DOI: 10.26434/chemrxiv.8326202.v1
   
   for DFT-D4:
   * E. Caldeweyher, C. Bannwarth and S. Grimme, J. Chem. Phys., 2017,
     147, 034112. DOI: 10.1063/1.4993215
   * E. Caldeweyher, S. Ehlert, A. Hansen, H. Neugebauer, S. Spicher,
     C. Bannwarth and S. Grimme, J. Chem. Phys., 2019, 150, 154122.
     DOI: 10.1063/1.5090222
   
   for sTDA-xTB:
   * S. Grimme and C. Bannwarth, J. Chem. Phys., 2016, 145, 054103.
     DOI: 10.1063/1.4959605
   
   in the mass-spec context:
   * V. Asgeirsson, C. Bauer and S. Grimme, Chem. Sci., 2017, 8, 4879.
     DOI: 10.1039/c7sc00601b
   
   for metadynamics refer to:
   * S. Grimme, J. Chem. Theory Comput., 2019, 155, 2847-2862
     DOI: 10.1021/acs.jctc.9b00143
   
   with help from (in alphabetical order)
   C. Bannwarth, F. Bohle, G. Brandenburg, E. Caldeweyher, M. Checinski,
   S. Dohm, S. Ehlert, S. Ehrlich, F. März, H. Neugebauer, J. Pisarek,
   P. Pracht, P. Shushkov, and S. Spicher.
   
 * started run on 2021/05/19 at 10:58:44.579     

           -------------------------------------------------
          |                Calculation Setup                |
           -------------------------------------------------

          program call               : /ihome/ghutchison/geoffh/xtb/xtb 202.xyz -opt
          hostname                   : smp-n83
          coordinate file            : 202.xyz
          omp threads                :                     1
          number of atoms            :                    14
          number of electrons        :                    42
          charge                     :                     0
          spin                       :                   0.0
          first test random number   :      0.58874042753267


########################################################################
# WARNING! Please study the warnings concerning your input carefully
#  - the use of '-opt' is discouraged, please use '--opt' next time
########################################################################

           ------------------------------------------------- 
          |                 G F N 2 - x T B                 |
          | Geometry, Frequencies, Noncovalent interactions |
          |            JCTC 2019 parametrisation            |
           ------------------------------------------------- 
             KAB for C  - Si     :                1.0500
             KAB for H  - Pd     :                0.9500
             k(s)              :                1.8500
             k(p)              :                2.2300
             k(d)              :                2.2300
             k(f)              :                2.0000
             kEN (H0ij)        :               -2.0000
             D4 a1             :                0.5200
             D4 a2             :                5.0000
             D4 s6             :                1.0000
             D4 s8             :                2.7000
             D4 s9             :                5.0000
             alphaj            :                2.0000

  Z AO/shell   Hii/eV     exponent
  1     Wed Apr 25 08:07:45 CEST 2018   EN: 2.200 GM2: 0.406  GM3: 0.0800  RAES: 1.40
     1s    -10.707211    1.230000
  6     Wed Apr 25 08:07:45 CEST 2018   EN: 2.550 GM2: 0.538  GM3: 0.1500  RAES: 3.00
     2s    -13.970922    2.096432
     2p    -10.063292    1.800000
  8     Wed Apr 25 08:07:45 CEST 2018   EN: 3.440 GM2: 0.452  GM3:-0.0517  RAES: 1.80
     2s    -20.229985    2.439742
     2p    -15.503117    2.137023
 16     Tue Apr 24 11:44:34 CEST 2018   EN: 2.580 GM2: 0.340  GM3:-0.0502  RAES: 3.10
     3s    -20.029654    1.981333
     3p    -11.377694    2.025643
     3d     -0.420282    1.702555

           ------------------------------------------------- 
          |        Self-Consistent Charge Iterations        |
           ------------------------------------------------- 

          ...................................................
          :                      SETUP                      :
          :.................................................:
          :  # basis functions                  44          :
          :  # atomic orbitals                  43          :
          :  # shells                           23          :
          :  # electrons                        42          :
          :  max. iterations                   250          :
          :  Hamiltonian                  GFN2-xTB          :
          :  restarted?                      false          :
          :  GBSA solvation                  false          :
          :  PC potential                    false          :
          :  electronic temp.          300.0000000     K    :
          :  accuracy                    1.0000000          :
          :  -> integral cutoff          0.2500000E+02      :
          :  -> integral neglect         0.1000000E-07      :
          :  -> SCF convergence          0.1000000E-05 Eh   :
          :  -> wf. convergence          0.1000000E-03 e    :
          :  Broyden damping             0.4000000          :
          ...................................................

 iter      E             dE          RMSdq      gap      omega  full diag
   1    -23.4328110 -0.234328E+02  0.482E+00    4.24       0.0  T
   2    -23.4513255 -0.185145E-01  0.290E+00    3.57       1.0  T
   3    -23.4374020  0.139234E-01  0.151E+00    3.56       1.0  T
   4    -23.4572016 -0.197996E-01  0.472E-01    3.29       1.0  T
   5    -23.4579203 -0.718625E-03  0.201E-01    3.33       1.0  T
   6    -23.4581009 -0.180647E-03  0.103E-01    3.37       1.0  T
   7    -23.4581877 -0.868113E-04  0.258E-02    3.36       1.0  T
   8    -23.4581888 -0.102746E-05  0.111E-02    3.36       2.4  T
   9    -23.4581889 -0.150035E-06  0.482E-03    3.36       5.5  T
  10    -23.4581890 -0.120080E-06  0.176E-03    3.36      15.2  T
  11    -23.4581890 -0.959718E-08  0.102E-03    3.36      26.1  T
  12    -23.4581890 -0.191491E-08  0.479E-04    3.36      55.8  T
  13    -23.4581890 -0.518032E-09  0.176E-04    3.36     151.9  T

   *** convergence criteria satisfied after 13 iterations ***

         #    Occupation            Energy/Eh            Energy/eV
      -------------------------------------------------------------
         1        2.0000           -0.7499913             -20.4083
       ...           ...                  ...                  ...
        15        2.0000           -0.4840934             -13.1729
        16        2.0000           -0.4652777             -12.6608
        17        2.0000           -0.4486200             -12.2076
        18        2.0000           -0.4410827             -12.0025
        19        2.0000           -0.4324853             -11.7685
        20        2.0000           -0.4067670             -11.0687
        21        2.0000           -0.3626765              -9.8689 (HOMO)
        22                         -0.2391426              -6.5074 (LUMO)
        23                         -0.2191571              -5.9636
        24                         -0.2080013              -5.6600
        25                         -0.1768285              -4.8117
        26                         -0.1153754              -3.1395
       ...                                ...                  ...
        43                          0.6687641              18.1980
      -------------------------------------------------------------
                  HL-Gap            0.1235340 Eh            3.3615 eV
             Fermi-level           -0.3009096 Eh           -8.1882 eV

 SCC (total)                   0 d,  0 h,  0 min,  0.018 sec
 SCC setup                      ...        0 min,  0.000 sec (  1.057%)
 Dispersion                     ...        0 min,  0.000 sec (  0.689%)
 integral evaluation            ...        0 min,  0.004 sec ( 21.402%)
 zeroth order Hamiltonian       ...        0 min,  0.000 sec (  0.450%)
 iterations                     ...        0 min,  0.008 sec ( 43.277%)
 molecular gradient             ...        0 min,  0.006 sec ( 31.293%)
 printout                       ...        0 min,  0.000 sec (  1.576%)

         :::::::::::::::::::::::::::::::::::::::::::::::::::::
         ::                     SUMMARY                     ::
         :::::::::::::::::::::::::::::::::::::::::::::::::::::
         :: total energy             -23.154888472835 Eh    ::
         :: gradient norm              0.054639992317 Eh/a0 ::
         :: HOMO-LUMO gap              3.361530840109 eV    ::
         ::.................................................::
         :: SCC energy               -23.458189040197 Eh    ::
         :: -> isotropic ES            0.009139560573 Eh    ::
         :: -> anisotropic ES          0.001823553886 Eh    ::
         :: -> anisotropic XC          0.012650573107 Eh    ::
         :: -> dispersion             -0.011201336143 Eh    ::
         :: repulsion energy           0.303299341126 Eh    ::
         :: add. restraining           0.000000000000 Eh    ::
         :::::::::::::::::::::::::::::::::::::::::::::::::::::

      ----------------------------------------------------------- 
     |                   =====================                   |
     |                        A N C O P T                        |
     |                   =====================                   |
     |               Approximate Normal Coordinate               |
     |                Rational Function Optimizer                |
      ----------------------------------------------------------- 

          ...................................................
          :                      SETUP                      :
          :.................................................:
          :   optimization level            normal          :
          :   max. optcycles                   200          :
          :   ANC micro-cycles                  20          :
          :   degrees of freedom                36          :
          :.................................................:
          :   RF solver                   davidson          :
          :   input Hessian                  false          :
          :   write xtbopt.log                true          :
          :   linear?                        false          :
          :   energy convergence         0.5000000E-05 Eh   :
          :   grad. convergence          0.1000000E-02 Eh/α :
          :   maximium RF displ.         2.0000000          :
          :   Hlow (freq-cutoff)         0.5000000E-02      :
          :   Hmax (freq-cutoff)         5.0000000          :
          :   S6 in model hess.         20.0000000          :
          ...................................................

generating ANC from model Hessian ...
Using Lindh-Hessian (1995)
 Shifting diagonal of input Hessian by   2.942519406601046E-003
 Lowest  eigenvalues of input Hessian
   -0.000000   -0.000000    0.000000    0.000000    0.000000    0.000000
    0.005000    0.005183    0.006219    0.015502    0.017691    0.031527
    0.033001    0.036908    0.062535    0.066789    0.089049    0.095612
 Highest eigenvalues
    1.505616    1.731272    1.779734    1.861935    1.872944    1.960476
 

........................................................................
.............................. CYCLE    1 ..............................
........................................................................
   1    -23.4581890 -0.234582E+02  0.319E-05    3.36       0.0  T
   2    -23.4581890 -0.561329E-12  0.196E-05    3.36    1363.8  T
   3    -23.4581890 -0.500933E-12  0.149E-05    3.36    1791.9  T
     SCC iter.                  ...        0 min,  0.002 sec
     gradient                   ...        0 min,  0.006 sec
 * total energy  :   -23.1548885 Eh     change       -0.3649276E-08 Eh
   gradient norm :     0.0546408 Eh/α   predicted     0.0000000E+00 (-100.00%)
   displ. norm   :     0.1376809 α      lambda       -0.3938196E-02
   maximum displ.:     0.0703205 α      in ANC's #7, #2, #1, ...

........................................................................
.............................. CYCLE    2 ..............................
........................................................................
   1    -23.4750719 -0.234751E+02  0.264E-01    3.53       0.0  T
   2    -23.4751417 -0.698314E-04  0.156E-01    3.49       1.0  T
   3    -23.4751826 -0.409203E-04  0.932E-02    3.50       1.0  T
   4    -23.4752476 -0.649182E-04  0.264E-02    3.49       1.0  T
   5    -23.4752504 -0.284740E-05  0.131E-02    3.48       2.0  T
   6    -23.4752513 -0.890584E-06  0.442E-03    3.49       6.1  T
   7    -23.4752513 -0.441453E-07  0.120E-03    3.49      22.2  T
     SCC iter.                  ...        0 min,  0.004 sec
     gradient                   ...        0 min,  0.006 sec
 * total energy  :   -23.1575739 Eh     change       -0.2685447E-02 Eh
   gradient norm :     0.0237158 Eh/α   predicted    -0.2006424E-02 ( -25.29%)
   displ. norm   :     0.1200181 α      lambda       -0.1211572E-02
   maximum displ.:     0.0560766 α      in ANC's #1, #6, #2, ...

........................................................................
.............................. CYCLE    3 ..............................
........................................................................
   1    -23.4811829 -0.234812E+02  0.211E-01    3.59       0.0  T
   2    -23.4812354 -0.525107E-04  0.129E-01    3.57       1.0  T
   3    -23.4812743 -0.389481E-04  0.732E-02    3.57       1.0  T
   4    -23.4813105 -0.362204E-04  0.212E-02    3.56       1.3  T
   5    -23.4813125 -0.191544E-05  0.102E-02    3.56       2.6  T
   6    -23.4813130 -0.580182E-06  0.367E-03    3.57       7.3  T
   7    -23.4813131 -0.334563E-07  0.939E-04    3.56      28.5  T
     SCC iter.                  ...        0 min,  0.004 sec
     gradient                   ...        0 min,  0.006 sec
 * total energy  :   -23.1582766 Eh     change       -0.7027117E-03 Eh
   gradient norm :     0.0074075 Eh/α   predicted    -0.6145117E-03 ( -12.55%)
   displ. norm   :     0.0891822 α      lambda       -0.1754408E-03
   maximum displ.:     0.0606499 α      in ANC's #1, #2, #4, ...

........................................................................
.............................. CYCLE    4 ..............................
........................................................................
   1    -23.4798227 -0.234798E+02  0.147E-01    3.58       0.0  T
   2    -23.4798290 -0.626238E-05  0.777E-02    3.58       1.0  T
   3    -23.4798108  0.181704E-04  0.467E-02    3.58       1.0  T
   4    -23.4798360 -0.251164E-04  0.109E-02    3.57       2.5  T
   5    -23.4798361 -0.173250E-06  0.562E-03    3.57       4.8  T
   6    -23.4798362 -0.121373E-06  0.171E-03    3.58      15.6  T
   7    -23.4798363 -0.207948E-07  0.509E-04    3.58      52.5  T
     SCC iter.                  ...        0 min,  0.004 sec
     gradient                   ...        0 min,  0.005 sec
 * total energy  :   -23.1583958 Eh     change       -0.1192066E-03 Eh
   gradient norm :     0.0036673 Eh/α   predicted    -0.8841885E-04 ( -25.83%)
   displ. norm   :     0.1086131 α      lambda       -0.9665066E-04
   maximum displ.:     0.0796031 α      in ANC's #1, #2, #15, ...

........................................................................
.............................. CYCLE    5 ..............................
........................................................................
   1    -23.4781026 -0.234781E+02  0.182E-01    3.57       0.0  T
   2    -23.4781078 -0.516306E-05  0.903E-02    3.58       1.0  T
   3    -23.4780980  0.978554E-05  0.338E-02    3.57       1.0  T
   4    -23.4781105 -0.125611E-04  0.109E-02    3.58       2.5  T
   5    -23.4781107 -0.193308E-06  0.372E-03    3.58       7.2  T
   6    -23.4781108 -0.421924E-07  0.945E-04    3.58      28.3  T
   7    -23.4781108 -0.613124E-08  0.523E-04    3.58      51.1  T
     SCC iter.                  ...        0 min,  0.004 sec
     gradient                   ...        0 min,  0.006 sec
 * total energy  :   -23.1584637 Eh     change       -0.6785945E-04 Eh
   gradient norm :     0.0028487 Eh/α   predicted    -0.4889320E-04 ( -27.95%)
   displ. norm   :     0.1055839 α      lambda       -0.6258374E-04
   maximum displ.:     0.0767833 α      in ANC's #1, #2, #3, ...

........................................................................
.............................. CYCLE    6 ..............................
........................................................................
   1    -23.4773321 -0.234773E+02  0.177E-01    3.57       0.0  T
   2    -23.4773363 -0.420456E-05  0.880E-02    3.57       1.0  T
   3    -23.4773347  0.151265E-05  0.208E-02    3.57       1.3  T
   4    -23.4773376 -0.282131E-05  0.104E-02    3.58       2.6  T
   5    -23.4773377 -0.169476E-06  0.272E-03    3.58       9.8  T
   6    -23.4773378 -0.666715E-07  0.101E-03    3.58      26.5  T
   7    -23.4773378 -0.621158E-08  0.506E-04    3.58      52.8  T
   8    -23.4773378 -0.272440E-09  0.162E-04    3.58     165.2  T
     SCC iter.                  ...        0 min,  0.004 sec
     gradient                   ...        0 min,  0.006 sec
 * total energy  :   -23.1585176 Eh     change       -0.5391056E-04 Eh
   gradient norm :     0.0039182 Eh/α   predicted    -0.3163965E-04 ( -41.31%)
   displ. norm   :     0.1459074 α      lambda       -0.9028241E-04
   maximum displ.:     0.1045692 α      in ANC's #1, #2, #3, ...

........................................................................
.............................. CYCLE    7 ..............................
........................................................................
   1    -23.4771376 -0.234771E+02  0.244E-01    3.57       0.0  T
   2    -23.4771456 -0.803268E-05  0.121E-01    3.57       1.0  T
   3    -23.4771420  0.364677E-05  0.292E-02    3.57       1.0  T
   4    -23.4771484 -0.642441E-05  0.138E-02    3.58       1.9  T
   5    -23.4771487 -0.260653E-06  0.271E-03    3.58       9.9  T
   6    -23.4771487 -0.586400E-07  0.126E-03    3.58      21.2  T
   7    -23.4771488 -0.753348E-08  0.547E-04    3.58      48.8  T
   8    -23.4771488 -0.467608E-10  0.234E-04    3.58     114.3  T
     SCC iter.                  ...        0 min,  0.004 sec
     gradient                   ...        0 min,  0.006 sec
 * total energy  :   -23.1585985 Eh     change       -0.8093806E-04 Eh
   gradient norm :     0.0049920 Eh/α   predicted    -0.4610305E-04 ( -43.04%)
   displ. norm   :     0.2596663 α      lambda       -0.1579440E-03
   maximum displ.:     0.1852240 α      in ANC's #1, #2, #3, ...

........................................................................
.............................. CYCLE    8 ..............................
........................................................................
   1    -23.4768499 -0.234768E+02  0.442E-01    3.56       0.0  T
   2    -23.4768754 -0.254897E-04  0.217E-01    3.58       1.0  T
   3    -23.4768684  0.700836E-05  0.480E-02    3.58       1.0  T
   4    -23.4768830 -0.145895E-04  0.249E-02    3.58       1.1  T
   5    -23.4768842 -0.121391E-05  0.516E-03    3.58       5.2  T
   6    -23.4768844 -0.220809E-06  0.231E-03    3.58      11.6  T
   7    -23.4768844 -0.250456E-07  0.992E-04    3.58      26.9  T
     SCC iter.                  ...        0 min,  0.004 sec
     gradient                   ...        0 min,  0.005 sec
 * total energy  :   -23.1587324 Eh     change       -0.1338694E-03 Eh
   gradient norm :     0.0068507 Eh/α   predicted    -0.8429759E-04 ( -37.03%)
   displ. norm   :     0.3698395 α      lambda       -0.2083768E-03
   maximum displ.:     0.2683497 α      in ANC's #1, #2, #3, ...

........................................................................
.............................. CYCLE    9 ..............................
........................................................................
   1    -23.4755274 -0.234755E+02  0.625E-01    3.57       0.0  T
   2    -23.4755769 -0.494788E-04  0.307E-01    3.59       1.0  T
   3    -23.4755710  0.593691E-05  0.620E-02    3.59       1.0  T
   4    -23.4755895 -0.185412E-04  0.348E-02    3.59       1.0  T
   5    -23.4755929 -0.338156E-05  0.559E-03    3.59       4.8  T
   6    -23.4755930 -0.147732E-06  0.336E-03    3.59       8.0  T
   7    -23.4755931 -0.712720E-07  0.147E-03    3.59      18.1  T
   8    -23.4755931 -0.190689E-08  0.602E-04    3.59      44.4  T
     SCC iter.                  ...        0 min,  0.004 sec
     gradient                   ...        0 min,  0.005 sec
 * total energy  :   -23.1588763 Eh     change       -0.1438507E-03 Eh
   gradient norm :     0.0097259 Eh/α   predicted    -0.1184329E-03 ( -17.67%)
   displ. norm   :     0.2306030 α      lambda       -0.1840173E-03
   maximum displ.:     0.1801468 α      in ANC's #1, #2, #3, ...

........................................................................
.............................. CYCLE   10 ..............................
........................................................................
   1    -23.4769716 -0.234770E+02  0.403E-01    3.59       0.0  T
   2    -23.4769922 -0.205942E-04  0.196E-01    3.60       1.0  T
   3    -23.4769849  0.731484E-05  0.446E-02    3.60       1.0  T
   4    -23.4769981 -0.132495E-04  0.232E-02    3.61       1.2  T
   5    -23.4769993 -0.116393E-05  0.608E-03    3.60       4.4  T
   6    -23.4769996 -0.347565E-06  0.193E-03    3.60      13.8  T
   7    -23.4769996 -0.984902E-08  0.912E-04    3.60      29.3  T
     SCC iter.                  ...        0 min,  0.004 sec
     gradient                   ...        0 min,  0.005 sec
 * total energy  :   -23.1590202 Eh     change       -0.1439184E-03 Eh
   gradient norm :     0.0084757 Eh/α   predicted    -0.9690290E-04 ( -32.67%)
   displ. norm   :     0.2513878 α      lambda       -0.2890289E-03
   maximum displ.:     0.2068934 α      in ANC's #1, #2, #3, ...

........................................................................
.............................. CYCLE   11 ..............................
........................................................................
   1    -23.4805674 -0.234806E+02  0.396E-01    3.62       0.0  T
   2    -23.4805880 -0.205830E-04  0.198E-01    3.62       1.0  T
   3    -23.4805381  0.498850E-04  0.789E-02    3.63       1.0  T
   4    -23.4806018 -0.637071E-04  0.251E-02    3.63       1.1  T
   5    -23.4806022 -0.352512E-06  0.846E-03    3.63       3.2  T
   6    -23.4806028 -0.657900E-06  0.226E-03    3.63      11.8  T
   7    -23.4806029 -0.222190E-07  0.116E-03    3.63      23.0  T
     SCC iter.                  ...        0 min,  0.004 sec
     gradient                   ...        0 min,  0.006 sec
 * total energy  :   -23.1591685 Eh     change       -0.1483173E-03 Eh
   gradient norm :     0.0058302 Eh/α   predicted    -0.1536490E-03 (   3.59%)
   displ. norm   :     0.3535481 α      lambda       -0.2299773E-03
   maximum displ.:     0.2679557 α      in ANC's #1, #2, #3, ...

........................................................................
.............................. CYCLE   12 ..............................
........................................................................
   1    -23.4783190 -0.234783E+02  0.690E-01    3.63       0.0  T
   2    -23.4783787 -0.597197E-04  0.333E-01    3.64       1.0  T
   3    -23.4783865 -0.773006E-05  0.556E-02    3.64       1.0  T
   4    -23.4783871 -0.579400E-06  0.372E-02    3.65       1.0  T
   5    -23.4783950 -0.793212E-05  0.798E-03    3.65       3.4  T
   6    -23.4783955 -0.499421E-06  0.296E-03    3.65       9.0  T
   7    -23.4783955 -0.315363E-07  0.183E-03    3.65      14.6  T
     SCC iter.                  ...        0 min,  0.004 sec
     gradient                   ...        0 min,  0.005 sec
 * total energy  :   -23.1592476 Eh     change       -0.7913258E-04 Eh
   gradient norm :     0.0051460 Eh/α   predicted    -0.1293616E-03 (  63.47%)
   displ. norm   :     0.0683089 α      lambda       -0.7926756E-04
   maximum displ.:     0.0461967 α      in ANC's #2, #1, #8, ...

........................................................................
.............................. CYCLE   13 ..............................
........................................................................
   1    -23.4805803 -0.234806E+02  0.950E-02    3.65       0.0  T
   2    -23.4805816 -0.131340E-05  0.483E-02    3.65       1.0  T
   3    -23.4805781  0.352535E-05  0.212E-02    3.65       1.3  T
   4    -23.4805826 -0.452563E-05  0.633E-03    3.65       4.2  T
   5    -23.4805826  0.278310E-07  0.276E-03    3.65       9.7  T
   6    -23.4805826 -0.825019E-07  0.608E-04    3.65      44.0  T
     SCC iter.                  ...        0 min,  0.003 sec
     gradient                   ...        0 min,  0.005 sec
 * total energy  :   -23.1592878 Eh     change       -0.4018235E-04 Eh
   gradient norm :     0.0023188 Eh/α   predicted    -0.3981764E-04 (  -0.91%)
   displ. norm   :     0.1438955 α      lambda       -0.5947604E-04
   maximum displ.:     0.1033638 α      in ANC's #1, #2, #3, ...

........................................................................
.............................. CYCLE   14 ..............................
........................................................................
   1    -23.4780575 -0.234781E+02  0.231E-01    3.63       0.0  T
   2    -23.4780642 -0.671612E-05  0.117E-01    3.64       1.0  T
   3    -23.4780630  0.117995E-05  0.244E-02    3.64       1.1  T
   4    -23.4780653 -0.231414E-05  0.146E-02    3.64       1.8  T
   5    -23.4780662 -0.944884E-06  0.351E-03    3.64       7.6  T
   6    -23.4780663 -0.101717E-06  0.129E-03    3.64      20.7  T
   7    -23.4780664 -0.106944E-07  0.610E-04    3.64      43.8  T
   8    -23.4780664 -0.650889E-09  0.269E-04    3.64      99.5  T
     SCC iter.                  ...        0 min,  0.004 sec
     gradient                   ...        0 min,  0.006 sec
 * total energy  :   -23.1592746 Eh     change        0.1320462E-04 Eh
   gradient norm :     0.0065205 Eh/α   predicted    -0.3035289E-04 (-329.87%)
   displ. norm   :     0.0432430 α      lambda       -0.9531921E-04
   maximum displ.:     0.0281103 α      in ANC's #2, #3, #4, ...

........................................................................
.............................. CYCLE   15 ..............................
........................................................................
   1    -23.4799566 -0.234800E+02  0.493E-02    3.66       0.0  T
   2    -23.4799575 -0.931108E-06  0.285E-02    3.65       1.0  T
   3    -23.4799559  0.162887E-05  0.180E-02    3.65       1.5  T
   4    -23.4799584 -0.251745E-05  0.414E-03    3.65       6.5  T
   5    -23.4799585 -0.354649E-07  0.226E-03    3.65      11.8  T
   6    -23.4799585 -0.292300E-07  0.777E-04    3.65      34.4  T
     SCC iter.                  ...        0 min,  0.003 sec
     gradient                   ...        0 min,  0.006 sec
 * total energy  :   -23.1593271 Eh     change       -0.5244482E-04 Eh
   gradient norm :     0.0021413 Eh/α   predicted    -0.4774946E-04 (  -8.95%)
   displ. norm   :     0.0923388 α      lambda       -0.3098838E-04
   maximum displ.:     0.0637324 α      in ANC's #1, #3, #2, ...

........................................................................
.............................. CYCLE   16 ..............................
........................................................................
   1    -23.4799199 -0.234799E+02  0.204E-01    3.65       0.0  T
   2    -23.4799253 -0.533844E-05  0.991E-02    3.65       1.0  T
   3    -23.4799259 -0.608084E-06  0.165E-02    3.65       1.6  T
   4    -23.4799262 -0.363717E-06  0.106E-02    3.66       2.5  T
   5    -23.4799267 -0.507091E-06  0.232E-03    3.66      11.5  T
   6    -23.4799268 -0.467453E-07  0.841E-04    3.66      31.8  T
   7    -23.4799268 -0.255182E-08  0.498E-04    3.66      53.6  T
     SCC iter.                  ...        0 min,  0.004 sec
     gradient                   ...        0 min,  0.006 sec
 * total energy  :   -23.1593444 Eh     change       -0.1736694E-04 Eh
   gradient norm :     0.0020543 Eh/α   predicted    -0.1562784E-04 ( -10.01%)
   displ. norm   :     0.0973411 α      lambda       -0.2641428E-04
   maximum displ.:     0.0690904 α      in ANC's #3, #1, #9, ...

........................................................................
.............................. CYCLE   17 ..............................
........................................................................
   1    -23.4797734 -0.234798E+02  0.179E-01    3.65       0.0  T
   2    -23.4797773 -0.391778E-05  0.898E-02    3.66       1.0  T
   3    -23.4797773 -0.577772E-07  0.167E-02    3.66       1.6  T
   4    -23.4797780 -0.668682E-06  0.104E-02    3.66       2.6  T
   5    -23.4797785 -0.440949E-06  0.182E-03    3.66      14.7  T
   6    -23.4797785 -0.313240E-07  0.725E-04    3.66      36.9  T
   7    -23.4797785 -0.204922E-08  0.368E-04    3.66      72.5  T
     SCC iter.                  ...        0 min,  0.004 sec
     gradient                   ...        0 min,  0.006 sec
 * total energy  :   -23.1593635 Eh     change       -0.1907644E-04 Eh
   gradient norm :     0.0019270 Eh/α   predicted    -0.1333199E-04 ( -30.11%)
   displ. norm   :     0.2047414 α      lambda       -0.2981861E-04
   maximum displ.:     0.1456501 α      in ANC's #3, #1, #6, ...

........................................................................
.............................. CYCLE   18 ..............................
........................................................................
   1    -23.4787285 -0.234787E+02  0.366E-01    3.65       0.0  T
   2    -23.4787449 -0.164273E-04  0.184E-01    3.66       1.0  T
   3    -23.4787435  0.147110E-05  0.364E-02    3.66       1.0  T
   4    -23.4787482 -0.473131E-05  0.215E-02    3.66       1.2  T
   5    -23.4787500 -0.179469E-05  0.435E-03    3.66       6.1  T
   6    -23.4787502 -0.175618E-06  0.153E-03    3.66      17.5  T
   7    -23.4787502 -0.112154E-07  0.754E-04    3.66      35.5  T
   8    -23.4787502 -0.445223E-09  0.222E-04    3.66     120.4  T
     SCC iter.                  ...        0 min,  0.004 sec
     gradient                   ...        0 min,  0.006 sec
 * total energy  :   -23.1593685 Eh     change       -0.4990109E-05 Eh
   gradient norm :     0.0033318 Eh/α   predicted    -0.1518765E-04 ( 204.36%)
   displ. norm   :     0.0266331 α      lambda       -0.2610002E-04
   maximum displ.:     0.0173190 α      in ANC's #2, #4, #1, ...

........................................................................
.............................. CYCLE   19 ..............................
........................................................................
   1    -23.4796616 -0.234797E+02  0.346E-02    3.66       0.0  T
   2    -23.4796619 -0.210303E-06  0.172E-02    3.66       1.6  T
   3    -23.4796616  0.223591E-06  0.614E-03    3.66       4.4  T
   4    -23.4796619 -0.299580E-06  0.216E-03    3.66      12.4  T
   5    -23.4796619 -0.449421E-08  0.891E-04    3.66      30.0  T
   6    -23.4796619 -0.417510E-08  0.322E-04    3.66      82.9  T
     SCC iter.                  ...        0 min,  0.003 sec
     gradient                   ...        0 min,  0.006 sec
 * total energy  :   -23.1593834 Eh     change       -0.1486003E-04 Eh
   gradient norm :     0.0013263 Eh/α   predicted    -0.1305754E-04 ( -12.13%)
   displ. norm   :     0.0291639 α      lambda       -0.7118804E-05
   maximum displ.:     0.0206963 α      in ANC's #1, #3, #8, ...

........................................................................
.............................. CYCLE   20 ..............................
........................................................................
   1    -23.4800116 -0.234800E+02  0.231E-02    3.66       0.0  T
   2    -23.4800117 -0.132810E-06  0.125E-02    3.66       2.1  T
   3    -23.4800113  0.485929E-06  0.857E-03    3.66       3.1  T
   4    -23.4800120 -0.706664E-06  0.190E-03    3.66      14.0  T
   5    -23.4800120 -0.858773E-09  0.889E-04    3.66      30.1  T
   6    -23.4800120 -0.476352E-08  0.328E-04    3.66      81.4  T
     SCC iter.                  ...        0 min,  0.003 sec
     gradient                   ...        0 min,  0.006 sec
 * total energy  :   -23.1593882 Eh     change       -0.4831332E-05 Eh
   gradient norm :     0.0010747 Eh/α   predicted    -0.3560978E-05 ( -26.29%)
   displ. norm   :     0.0208551 α      lambda       -0.3897378E-05
   maximum displ.:     0.0145423 α      in ANC's #2, #1, #7, ...
 * RMSD in coord.:     0.6358930 α      energy gain  -0.4499712E-02 Eh

generating ANC from model Hessian ...
Using Lindh-Hessian (1995)
 Shifting diagonal of input Hessian by   3.014199007070661E-003
 Lowest  eigenvalues of input Hessian
   -0.000000   -0.000000    0.000000    0.000000    0.000000    0.000000
    0.005000    0.005400    0.006446    0.015612    0.019860    0.030156
    0.032701    0.038308    0.049044    0.069741    0.094569    0.100428
 Highest eigenvalues
    1.502638    1.796802    1.827731    1.930949    1.948392    2.029647
 

........................................................................
.............................. CYCLE   21 ..............................
........................................................................
   1    -23.4802441 -0.234802E+02  0.243E-02    3.66       0.0  T
   2    -23.4802442 -0.548793E-07  0.135E-02    3.66       2.0  T
   3    -23.4802439  0.309551E-06  0.581E-03    3.66       4.6  T
   4    -23.4802442 -0.359537E-06  0.155E-03    3.66      17.2  T
   5    -23.4802442 -0.419592E-08  0.479E-04    3.66      55.8  T
   6    -23.4802442 -0.174127E-08  0.124E-04    3.66     216.0  T
     SCC iter.                  ...        0 min,  0.003 sec
     gradient                   ...        0 min,  0.006 sec
 * total energy  :   -23.1593918 Eh     change       -0.3647826E-05 Eh
   gradient norm :     0.0009659 Eh/α   predicted     0.0000000E+00 (-100.00%)
   displ. norm   :     0.0525686 α      lambda       -0.8389679E-05
   maximum displ.:     0.0516672 α      in ANC's #1, #3, #2, ...

   *** GEOMETRY OPTIMIZATION CONVERGED AFTER 21 ITERATIONS ***

------------------------------------------------------------------------
 total energy gain   :        -0.0045034 Eh       -2.8259 kcal/mol
 total RMSD          :         0.6358930 a0        0.3365 Å
 total power (kW/mol):        -0.5630272 (step)  -40.3251 (real)
------------------------------------------------------------------------

 ANCopt (total)                0 d,  0 h,  0 min,  0.293 sec
 optimizer setup                ...        0 min,  0.000 sec (  0.047%)
 model hessian                  ...        0 min,  0.002 sec (  0.721%)
 ANC generation                 ...        0 min,  0.001 sec (  0.236%)
 coordinate transformation      ...        0 min,  0.000 sec (  0.087%)
 single point calculation       ...        0 min,  0.284 sec ( 96.835%)
 optimization log               ...        0 min,  0.001 sec (  0.469%)
 hessian update                 ...        0 min,  0.000 sec (  0.072%)
 rational function              ...        0 min,  0.003 sec (  1.076%)

================
 final structure:
================
$coord
   -1.08427372142597    1.73786840741499    0.09948953098939      C 
   -2.53548768554876   -0.33314895747135   -0.08235909570156      O 
   -0.99308665305406   -2.34318617274262    0.02455297727773      C 
    1.45756160492738   -1.61214040516539    0.25660494327914      C 
    1.40101664079799    1.07421644336344    0.31847270184066      C 
    3.95761593631262    3.18617792519256    0.50548934346930      S 
    5.91806690753690    1.56539118288383    2.65220459061131      C 
    8.24152046426405    2.30044498135717    3.20258296333869      C 
   -1.98559375758070    3.54858631419419    0.03249636866187      H 
   -1.84335081613873   -4.17801026344462   -0.08872194962877      H 
    3.08860653981012   -2.80331971853696    0.35070986503247      H 
    5.03237166881691   -0.05545698328960    3.51021016009882      H 
    9.07805898725579    3.93603503696577    2.33215926476642      H 
    9.37058162408695    1.29080208507135    4.55750260562786      H 
$end
           -------------------------------------------------
          |                Final Singlepoint                |
           -------------------------------------------------

          ...................................................
          :                      SETUP                      :
          :.................................................:
          :  # basis functions                  44          :
          :  # atomic orbitals                  43          :
          :  # shells                           23          :
          :  # electrons                        42          :
          :  max. iterations                   250          :
          :  Hamiltonian                  GFN2-xTB          :
          :  restarted?                      false          :
          :  GBSA solvation                  false          :
          :  PC potential                    false          :
          :  electronic temp.          300.0000000     K    :
          :  accuracy                    1.0000000          :
          :  -> integral cutoff          0.2500000E+02      :
          :  -> integral neglect         0.1000000E-07      :
          :  -> SCF convergence          0.1000000E-05 Eh   :
          :  -> wf. convergence          0.1000000E-03 e    :
          :  Broyden damping             0.4000000          :
          ...................................................

 iter      E             dE          RMSdq      gap      omega  full diag
   1    -23.4802442 -0.234802E+02  0.297E-05    3.66       0.0  T
   2    -23.4802442 -0.100542E-11  0.178E-05    3.66    1503.7  T
   3    -23.4802442  0.106581E-13  0.117E-05    3.66    2284.9  T

   *** convergence criteria satisfied after 3 iterations ***

         #    Occupation            Energy/Eh            Energy/eV
      -------------------------------------------------------------
         1        2.0000           -0.7511451             -20.4397
       ...           ...                  ...                  ...
        15        2.0000           -0.4772834             -12.9875
        16        2.0000           -0.4666272             -12.6976
        17        2.0000           -0.4522699             -12.3069
        18        2.0000           -0.4396637             -11.9639
        19        2.0000           -0.4329744             -11.7818
        20        2.0000           -0.4082738             -11.1097
        21        2.0000           -0.3627967              -9.8722 (HOMO)
        22                         -0.2282301              -6.2105 (LUMO)
        23                         -0.2189096              -5.9568
        24                         -0.2011233              -5.4728
        25                         -0.1743244              -4.7436
        26                         -0.1295347              -3.5248
       ...                                ...                  ...
        43                          0.6787826              18.4706
      -------------------------------------------------------------
                  HL-Gap            0.1345666 Eh            3.6617 eV
             Fermi-level           -0.2955134 Eh           -8.0413 eV

 SCC (total)                   0 d,  0 h,  0 min,  0.012 sec
 SCC setup                      ...        0 min,  0.000 sec (  1.096%)
 Dispersion                     ...        0 min,  0.000 sec (  0.652%)
 integral evaluation            ...        0 min,  0.004 sec ( 31.210%)
 zeroth order Hamiltonian       ...        0 min,  0.000 sec (  0.593%)
 iterations                     ...        0 min,  0.002 sec ( 17.837%)
 molecular gradient             ...        0 min,  0.006 sec ( 46.421%)
 printout                       ...        0 min,  0.000 sec (  1.805%)

         :::::::::::::::::::::::::::::::::::::::::::::::::::::
         ::                     SUMMARY                     ::
         :::::::::::::::::::::::::::::::::::::::::::::::::::::
         :: total energy             -23.159391833640 Eh    ::
         :: gradient norm              0.000965583160 Eh/a0 ::
         :: HOMO-LUMO gap              3.661744453289 eV    ::
         ::.................................................::
         :: SCC energy               -23.480244240401 Eh    ::
         :: -> isotropic ES            0.008519455424 Eh    ::
         :: -> anisotropic ES          0.001901133249 Eh    ::
         :: -> anisotropic XC          0.011339694359 Eh    ::
         :: -> dispersion             -0.011181603570 Eh    ::
         :: repulsion energy           0.320860454427 Eh    ::
         :: add. restraining           0.000000000000 Eh    ::
         :::::::::::::::::::::::::::::::::::::::::::::::::::::

           -------------------------------------------------
          |                Property Printout                |
           -------------------------------------------------

    * Orbital Energies and Occupations

         #    Occupation            Energy/Eh            Energy/eV
      -------------------------------------------------------------
         1        2.0000           -0.7511451             -20.4397
       ...           ...                  ...                  ...
         9        2.0000           -0.5692748             -15.4908
        10        2.0000           -0.5579723             -15.1832
        11        2.0000           -0.5188147             -14.1177
        12        2.0000           -0.5087537             -13.8439
        13        2.0000           -0.4921152             -13.3911
        14        2.0000           -0.4856819             -13.2161
        15        2.0000           -0.4772834             -12.9875
        16        2.0000           -0.4666272             -12.6976
        17        2.0000           -0.4522699             -12.3069
        18        2.0000           -0.4396637             -11.9639
        19        2.0000           -0.4329744             -11.7818
        20        2.0000           -0.4082738             -11.1097
        21        2.0000           -0.3627967              -9.8722 (HOMO)
        22                         -0.2282301              -6.2105 (LUMO)
        23                         -0.2189096              -5.9568
        24                         -0.2011233              -5.4728
        25                         -0.1743244              -4.7436
        26                         -0.1295347              -3.5248
        27                         -0.0096475              -0.2625
        28                          0.0352175               0.9583
        29                          0.0458135               1.2466
        30                          0.0896343               2.4391
        31                          0.1211547               3.2968
        32                          0.1408294               3.8322
       ...                                ...                  ...
        43                          0.6787826              18.4706
      -------------------------------------------------------------
                  HL-Gap            0.1345666 Eh            3.6617 eV
             Fermi-level           -0.2955134 Eh           -8.0413 eV

     #   Z        covCN         q      C6AA      α(0)
     1   6 C      3.094     0.058    26.591     8.452
     2   8 O      1.731    -0.167    16.821     5.538
     3   6 C      3.081     0.068    26.399     8.423
     4   6 C      3.021    -0.069    29.689     8.938
     5   6 C      3.072     0.023    27.426     8.587
     6  16 S      2.037    -0.132   146.590    20.378
     7   6 C      2.880     0.012    27.740     8.634
     8   6 C      2.885    -0.100    30.515     9.056
     9   1 H      0.926     0.058     2.217     2.328
    10   1 H      0.926     0.055     2.255     2.348
    11   1 H      0.927     0.047     2.354     2.399
    12   1 H      0.926     0.048     2.345     2.395
    13   1 H      0.926     0.052     2.300     2.371
    14   1 H      0.926     0.047     2.361     2.403

 Mol. C6AA /au·bohr⁶  :       3248.593406
 Mol. C8AA /au·bohr⁸  :      93171.077428
 Mol. α(0) /au        :         92.250383


Wiberg/Mayer (AO) data.
largest (>0.10) Wiberg bond orders for each atom
          total WBO             WBO to atom ...
     1  C   3.904        C    5 1.552    O    2 1.139    H    9 0.966    C    3 0.147
     2  O   2.460        C    3 1.140    C    1 1.139
     3  C   3.908        C    4 1.611    O    2 1.140    H   10 0.965    C    1 0.147
     4  C   3.981        C    3 1.611    C    5 1.255    H   11 0.973
     5  C   3.956        C    1 1.552    C    4 1.255    S    6 1.033
     6  S   2.351        C    7 1.058    C    5 1.033    C    8 0.112
     7  C   3.963        C    8 1.915    S    6 1.058    H   12 0.961
     8  C   3.988        C    7 1.915    H   13 0.975    H   14 0.970    S    6 0.112
     9  H   0.997        C    1 0.966
    10  H   0.997        C    3 0.965
    11  H   0.998        C    4 0.973
    12  H   0.998        C    7 0.961
    13  H   0.997        C    8 0.975
    14  H   0.997        C    8 0.970

molecular dipole:
                 x           y           z       tot (Debye)
 q only:        0.028      -0.393       0.172
   full:       -0.056      -0.641       0.290       1.792
molecular quadrupole (traceless):
                xx          xy          yy          xz          yz          zz
 q only:       -0.209      -2.011       0.566       1.835      -0.210      -0.357
  q+dip:        1.152      -3.432      -0.204       2.956      -0.624      -0.949
   full:        0.146      -3.532      -0.411       2.915      -0.408       0.265

           -------------------------------------------------
          |                Geometry Summary                 |
           -------------------------------------------------

      molecular mass/u    :      126.1728000
   center of mass at/Å    :        1.2107821       0.5505642       0.4378024
  moments of inertia/u·Å² :        0.9490796E+02   0.5108149E+03   0.5856853E+03
rotational constants/cm⁻¹ :        0.1776208E+00   0.3300145E-01   0.2878275E-01

 * 12 selected distances

     #   Z        #   Z                                     value/Å
     1   6 C      2   8 O                                 1.3416709
     2   8 O      3   6 C                                 1.3419293
     3   6 C      4   6 C                                 1.3588581
     1   6 C      5   6 C                                 1.3661647
     4   6 C      5   6 C                                 1.4222507 (max)
     7   6 C      8   6 C                                 1.3220599
     1   6 C      9   1 H                                 1.0709226
     3   6 C     10   1 H                                 1.0718106
     4   6 C     11   1 H                                 1.0699424 (min)
     7   6 C     12   1 H                                 1.0777275
     8   6 C     13   1 H                                 1.0757523
     8   6 C     14   1 H                                 1.0754107

 * 3 distinct bonds (by element types)

   Z      Z             #   av. dist./Å        max./Å        min./Å
   1 H    6 C           6     1.0735944     1.0777275     1.0699424
   6 C    6 C           4     1.3673333     1.4222507     1.3220599
   6 C    8 O           2     1.3418001     1.3419293     1.3416709


optimized geometry written to: xtbopt.xyz


           -------------------------------------------------
          | TOTAL ENERGY              -23.159391833640 Eh   |
          | GRADIENT NORM               0.000965583160 Eh/α |
          | HOMO-LUMO GAP               3.661744453289 eV   |
           -------------------------------------------------

------------------------------------------------------------------------
 * finished run on 2021/05/19 at 10:58:44.920     
------------------------------------------------------------------------
 total:
 * wall-time:     0 d,  0 h,  0 min,  0.341 sec
 *  cpu-time:     0 d,  0 h,  0 min,  0.340 sec
 * ratio c/w:     0.997 speedup
 SCF:
 * wall-time:     0 d,  0 h,  0 min,  0.019 sec
 *  cpu-time:     0 d,  0 h,  0 min,  0.019 sec
 * ratio c/w:     1.000 speedup
 ANC optimizer:
 * wall-time:     0 d,  0 h,  0 min,  0.306 sec
 *  cpu-time:     0 d,  0 h,  0 min,  0.306 sec
 * ratio c/w:     1.000 speedup

