      -----------------------------------------------------------      
     |                   =====================                   |     
     |                           x T B                           |     
     |                   =====================                   |     
     |                         S. Grimme                         |     
     |          Mulliken Center for Theoretical Chemistry        |     
     |                    University of Bonn                     |     
     |                Version 6.2 RC2 (SAW190805)                |     
      -----------------------------------------------------------      

   This program is distributed in the hope that it will be useful,
   but WITHOUT ANY WARRANTY; without even the implied warranty of
   MERCHANTABILITY or FITNESS FOR A PARTICULAR PURPOSE.
   
   FOR NON-COMMERCIAL, ACADEMIA USE ONLY.
   
   Cite this work as:
   * S. Grimme, C. Bannwarth, P. Shushkov, J. Chem. Theory Comput., 2017,
     13, 1989-2009. DOI: 10.1021/acs.jctc.7b00118
   * C. Bannwarth, S. Ehlert and S. Grimme., J. Chem. Theory Comput., 2019,
     15, 1652-1671. DOI: 10.1021/acs.jctc.8b01176
   * P. Pracht, E. Caldeweyher, S. Ehlert, S. Grimme, ChemRxiv, 2019, preprint.
     DOI: 10.26434/chemrxiv.8326202.v1
   
   for DFT-D4:
   * E. Caldeweyher, C. Bannwarth and S. Grimme, J. Chem. Phys., 2017,
     147, 034112. DOI: 10.1063/1.4993215
   * E. Caldeweyher, S. Ehlert, A. Hansen, H. Neugebauer, S. Spicher,
     C. Bannwarth and S. Grimme, J. Chem. Phys., 2019, 150, 154122.
     DOI: 10.1063/1.5090222
   
   for sTDA-xTB:
   * S. Grimme and C. Bannwarth, J. Chem. Phys., 2016, 145, 054103.
     DOI: 10.1063/1.4959605
   
   in the mass-spec context:
   * V. Asgeirsson, C. Bauer and S. Grimme, Chem. Sci., 2017, 8, 4879.
     DOI: 10.1039/c7sc00601b
   
   for metadynamics refer to:
   * S. Grimme, J. Chem. Theory Comput., 2019, 155, 2847-2862
     DOI: 10.1021/acs.jctc.9b00143
   
   with help from (in alphabetical order)
   C. Bannwarth, F. Bohle, G. Brandenburg, E. Caldeweyher, M. Checinski,
   S. Dohm, S. Ehlert, S. Ehrlich, F. März, H. Neugebauer, J. Pisarek,
   P. Pracht, P. Shushkov, and S. Spicher.
   
 * started run on 2021/05/19 at 10:58:45.297     

           -------------------------------------------------
          |                Calculation Setup                |
           -------------------------------------------------

          program call               : /ihome/ghutchison/geoffh/xtb/xtb 204.xyz -opt
          hostname                   : smp-n83
          coordinate file            : 204.xyz
          omp threads                :                     1
          number of atoms            :                    26
          number of electrons        :                    72
          charge                     :                     0
          spin                       :                   0.0
          first test random number   :      0.60338940298562


########################################################################
# WARNING! Please study the warnings concerning your input carefully
#  - the use of '-opt' is discouraged, please use '--opt' next time
########################################################################

           ------------------------------------------------- 
          |                 G F N 2 - x T B                 |
          | Geometry, Frequencies, Noncovalent interactions |
          |            JCTC 2019 parametrisation            |
           ------------------------------------------------- 
             KAB for C  - Si     :                1.0500
             KAB for H  - Pd     :                0.9500
             k(s)              :                1.8500
             k(p)              :                2.2300
             k(d)              :                2.2300
             k(f)              :                2.0000
             kEN (H0ij)        :               -2.0000
             D4 a1             :                0.5200
             D4 a2             :                5.0000
             D4 s6             :                1.0000
             D4 s8             :                2.7000
             D4 s9             :                5.0000
             alphaj            :                2.0000

  Z AO/shell   Hii/eV     exponent
  1     Wed Apr 25 08:07:45 CEST 2018   EN: 2.200 GM2: 0.406  GM3: 0.0800  RAES: 1.40
     1s    -10.707211    1.230000
  6     Wed Apr 25 08:07:45 CEST 2018   EN: 2.550 GM2: 0.538  GM3: 0.1500  RAES: 3.00
     2s    -13.970922    2.096432
     2p    -10.063292    1.800000
  8     Wed Apr 25 08:07:45 CEST 2018   EN: 3.440 GM2: 0.452  GM3:-0.0517  RAES: 1.80
     2s    -20.229985    2.439742
     2p    -15.503117    2.137023

           ------------------------------------------------- 
          |        Self-Consistent Charge Iterations        |
           ------------------------------------------------- 

          ...................................................
          :                      SETUP                      :
          :.................................................:
          :  # basis functions                  68          :
          :  # atomic orbitals                  68          :
          :  # shells                           40          :
          :  # electrons                        72          :
          :  max. iterations                   250          :
          :  Hamiltonian                  GFN2-xTB          :
          :  restarted?                      false          :
          :  GBSA solvation                  false          :
          :  PC potential                    false          :
          :  electronic temp.          300.0000000     K    :
          :  accuracy                    1.0000000          :
          :  -> integral cutoff          0.2500000E+02      :
          :  -> integral neglect         0.1000000E-07      :
          :  -> SCF convergence          0.1000000E-05 Eh   :
          :  -> wf. convergence          0.1000000E-03 e    :
          :  Broyden damping             0.4000000          :
          ...................................................

 iter      E             dE          RMSdq      gap      omega  full diag
   1    -40.4056143 -0.404056E+02  0.465E+00    1.61       0.0  T
   2    -40.4485572 -0.429428E-01  0.284E+00    1.46       1.0  T
   3    -40.4305159  0.180413E-01  0.154E+00    1.55       1.0  T
   4    -40.4613501 -0.308342E-01  0.428E-01    1.51       1.0  T
   5    -40.4636755 -0.232537E-02  0.125E-01    1.50       1.0  T
   6    -40.4638809 -0.205347E-03  0.753E-02    1.50       1.0  T
   7    -40.4639327 -0.518603E-04  0.348E-02    1.50       1.0  T
   8    -40.4639367 -0.397759E-05  0.197E-02    1.50       1.0  T
   9    -40.4639430 -0.629054E-05  0.933E-03    1.50       2.1  T
  10    -40.4639448 -0.180115E-05  0.166E-03    1.50      11.8  T
  11    -40.4639448 -0.802451E-08  0.842E-04    1.50      23.3  T
  12    -40.4639448  0.106833E-08  0.586E-04    1.50      33.5  T

   *** convergence criteria satisfied after 12 iterations ***

         #    Occupation            Energy/Eh            Energy/eV
      -------------------------------------------------------------
         1        2.0000           -0.7151203             -19.4594
       ...           ...                  ...                  ...
        30        2.0000           -0.4385176             -11.9327
        31        2.0000           -0.4363572             -11.8739
        32        2.0000           -0.4321260             -11.7587
        33        2.0000           -0.4256342             -11.5821
        34        2.0000           -0.3880326             -10.5589
        35        2.0000           -0.3674074              -9.9977
        36        2.0000           -0.3597949              -9.7905 (HOMO)
        37                         -0.3045987              -8.2886 (LUMO)
        38                         -0.1944052              -5.2900
        39                         -0.1391717              -3.7871
        40                         -0.1363986              -3.7116
        41                         -0.0883679              -2.4046
       ...                                ...                  ...
        68                          0.7917596              21.5449
      -------------------------------------------------------------
                  HL-Gap            0.0551962 Eh            1.5020 eV
             Fermi-level           -0.3321968 Eh           -9.0395 eV

 SCC (total)                   0 d,  0 h,  0 min,  0.038 sec
 SCC setup                      ...        0 min,  0.000 sec (  0.851%)
 Dispersion                     ...        0 min,  0.000 sec (  1.117%)
 integral evaluation            ...        0 min,  0.009 sec ( 23.743%)
 zeroth order Hamiltonian       ...        0 min,  0.000 sec (  0.412%)
 iterations                     ...        0 min,  0.014 sec ( 37.335%)
 molecular gradient             ...        0 min,  0.013 sec ( 35.375%)
 printout                       ...        0 min,  0.000 sec (  1.026%)

         :::::::::::::::::::::::::::::::::::::::::::::::::::::
         ::                     SUMMARY                     ::
         :::::::::::::::::::::::::::::::::::::::::::::::::::::
         :: total energy             -39.863358971987 Eh    ::
         :: gradient norm              0.051727089483 Eh/a0 ::
         :: HOMO-LUMO gap              1.501965861639 eV    ::
         ::.................................................::
         :: SCC energy               -40.463944795215 Eh    ::
         :: -> isotropic ES            0.029349006319 Eh    ::
         :: -> anisotropic ES          0.005716231430 Eh    ::
         :: -> anisotropic XC          0.014934221472 Eh    ::
         :: -> dispersion             -0.022850233447 Eh    ::
         :: repulsion energy           0.600679565174 Eh    ::
         :: add. restraining           0.000000000000 Eh    ::
         :::::::::::::::::::::::::::::::::::::::::::::::::::::

      ----------------------------------------------------------- 
     |                   =====================                   |
     |                        A N C O P T                        |
     |                   =====================                   |
     |               Approximate Normal Coordinate               |
     |                Rational Function Optimizer                |
      ----------------------------------------------------------- 

          ...................................................
          :                      SETUP                      :
          :.................................................:
          :   optimization level            normal          :
          :   max. optcycles                   200          :
          :   ANC micro-cycles                  20          :
          :   degrees of freedom                72          :
          :.................................................:
          :   RF solver                   davidson          :
          :   input Hessian                  false          :
          :   write xtbopt.log                true          :
          :   linear?                        false          :
          :   energy convergence         0.5000000E-05 Eh   :
          :   grad. convergence          0.1000000E-02 Eh/α :
          :   maximium RF displ.         2.0000000          :
          :   Hlow (freq-cutoff)         0.5000000E-02      :
          :   Hmax (freq-cutoff)         5.0000000          :
          :   S6 in model hess.         20.0000000          :
          ...................................................

generating ANC from model Hessian ...
Using Lindh-Hessian (1995)
 Shifting diagonal of input Hessian by   4.549963849116417E-003
 Lowest  eigenvalues of input Hessian
   -0.000000   -0.000000   -0.000000   -0.000000   -0.000000    0.000000
    0.005000    0.006788    0.007122    0.007908    0.008987    0.009350
    0.010017    0.013224    0.015543    0.019097    0.023997    0.024099
 Highest eigenvalues
    1.831555    1.866697    1.895708    2.077313    2.104578    2.149514
 

........................................................................
.............................. CYCLE    1 ..............................
........................................................................
   1    -40.4639448 -0.404639E+02  0.134E-04    1.50       0.0  T
   2    -40.4639448 -0.576676E-10  0.886E-05    1.50     221.3  T
   3    -40.4639448 -0.615614E-10  0.610E-05    1.50     321.6  T
     SCC iter.                  ...        0 min,  0.004 sec
     gradient                   ...        0 min,  0.013 sec
 * total energy  :   -39.8633589 Eh     change        0.2396136E-07 Eh
   gradient norm :     0.0517272 Eh/α   predicted     0.0000000E+00 (-100.00%)
   displ. norm   :     0.1530270 α      lambda       -0.4027870E-02
   maximum displ.:     0.0966404 α      in ANC's #29, #14, #25, ...

........................................................................
.............................. CYCLE    2 ..............................
........................................................................
   1    -40.4643858 -0.404644E+02  0.129E-01    1.42       0.0  T
   2    -40.4644230 -0.372298E-04  0.835E-02    1.43       1.0  T
   3    -40.4644394 -0.164239E-04  0.566E-02    1.43       1.0  T
   4    -40.4644688 -0.293069E-04  0.156E-02    1.43       1.3  T
   5    -40.4644711 -0.232956E-05  0.108E-02    1.43       1.8  T
   6    -40.4644742 -0.308736E-05  0.204E-03    1.43       9.6  T
   7    -40.4644742 -0.604027E-07  0.978E-04    1.43      20.1  T
     SCC iter.                  ...        0 min,  0.008 sec
     gradient                   ...        0 min,  0.012 sec
 * total energy  :   -39.8660246 Eh     change       -0.2665687E-02 Eh
   gradient norm :     0.0232376 Eh/α   predicted    -0.2061102E-02 ( -22.68%)
   displ. norm   :     0.0793368 α      lambda       -0.8858186E-03
   maximum displ.:     0.0398761 α      in ANC's #29, #25, #31, ...

........................................................................
.............................. CYCLE    3 ..............................
........................................................................
   1    -40.4651862 -0.404652E+02  0.837E-02    1.39       0.0  T
   2    -40.4652062 -0.199076E-04  0.542E-02    1.39       1.0  T
   3    -40.4652287 -0.225512E-04  0.350E-02    1.39       1.0  T
   4    -40.4652375 -0.875688E-05  0.101E-02    1.39       1.9  T
   5    -40.4652378 -0.316091E-06  0.758E-03    1.39       2.6  T
   6    -40.4652393 -0.150463E-05  0.172E-03    1.39      11.4  T
   7    -40.4652393 -0.568923E-07  0.708E-04    1.39      27.7  T
     SCC iter.                  ...        0 min,  0.008 sec
     gradient                   ...        0 min,  0.012 sec
 * total energy  :   -39.8665239 Eh     change       -0.4992885E-03 Eh
   gradient norm :     0.0062755 Eh/α   predicted    -0.4457006E-03 ( -10.73%)
   displ. norm   :     0.0294872 α      lambda       -0.6176258E-04
   maximum displ.:     0.0143929 α      in ANC's #14, #2, #25, ...

........................................................................
.............................. CYCLE    4 ..............................
........................................................................
   1    -40.4653859 -0.404654E+02  0.208E-02    1.39       0.0  T
   2    -40.4653870 -0.111493E-05  0.132E-02    1.39       1.5  T
   3    -40.4653884 -0.136190E-05  0.877E-03    1.39       2.2  T
   4    -40.4653890 -0.645189E-06  0.223E-03    1.39       8.8  T
   5    -40.4653890 -0.132131E-07  0.152E-03    1.39      12.9  T
     SCC iter.                  ...        0 min,  0.006 sec
     gradient                   ...        0 min,  0.012 sec
 * total energy  :   -39.8665648 Eh     change       -0.4085292E-04 Eh
   gradient norm :     0.0025393 Eh/α   predicted    -0.3091723E-04 ( -24.32%)
   displ. norm   :     0.0291305 α      lambda       -0.2175157E-04
   maximum displ.:     0.0160162 α      in ANC's #2, #1, #3, ...

........................................................................
.............................. CYCLE    5 ..............................
........................................................................
   1    -40.4654406 -0.404654E+02  0.142E-02    1.39       0.0  T
   2    -40.4654408 -0.205930E-06  0.849E-03    1.39       2.3  T
   3    -40.4654405  0.345450E-06  0.617E-03    1.39       3.2  T
   4    -40.4654411 -0.607302E-06  0.870E-04    1.39      22.5  T
   5    -40.4654411 -0.594289E-08  0.535E-04    1.39      36.6  T
     SCC iter.                  ...        0 min,  0.006 sec
     gradient                   ...        0 min,  0.013 sec
 * total energy  :   -39.8665777 Eh     change       -0.1292389E-04 Eh
   gradient norm :     0.0011121 Eh/α   predicted    -0.1089187E-04 ( -15.72%)
   displ. norm   :     0.0333469 α      lambda       -0.5769044E-05
   maximum displ.:     0.0188239 α      in ANC's #2, #1, #3, ...

........................................................................
.............................. CYCLE    6 ..............................
........................................................................
   1    -40.4654432 -0.404654E+02  0.143E-02    1.39       0.0  T
   2    -40.4654433 -0.152957E-07  0.861E-03    1.39       2.3  T
   3    -40.4654428  0.427839E-06  0.406E-03    1.39       4.8  T
   4    -40.4654433 -0.451440E-06  0.877E-04    1.39      22.4  T
   5    -40.4654433 -0.174416E-07  0.322E-04    1.39      60.9  T
     SCC iter.                  ...        0 min,  0.006 sec
     gradient                   ...        0 min,  0.013 sec
 * total energy  :   -39.8665819 Eh     change       -0.4244275E-05 Eh
   gradient norm :     0.0009608 Eh/α   predicted    -0.2893066E-05 ( -31.84%)
   displ. norm   :     0.0237633 α      lambda       -0.2976581E-05
   maximum displ.:     0.0137158 α      in ANC's #1, #2, #3, ...

   *** GEOMETRY OPTIMIZATION CONVERGED AFTER 6 ITERATIONS ***

------------------------------------------------------------------------
 total energy gain   :        -0.0032230 Eh       -2.0224 kcal/mol
 total RMSD          :         0.0484270 a0        0.0256 Å
 total power (kW/mol):        -1.4103187 (step)  -47.5466 (real)
------------------------------------------------------------------------

 ANCopt (total)                0 d,  0 h,  0 min,  0.178 sec
 optimizer setup                ...        0 min,  0.000 sec (  0.088%)
 model hessian                  ...        0 min,  0.004 sec (  2.122%)
 ANC generation                 ...        0 min,  0.001 sec (  0.426%)
 coordinate transformation      ...        0 min,  0.000 sec (  0.066%)
 single point calculation       ...        0 min,  0.171 sec ( 96.131%)
 optimization log               ...        0 min,  0.001 sec (  0.367%)
 hessian update                 ...        0 min,  0.000 sec (  0.056%)
 rational function              ...        0 min,  0.001 sec (  0.466%)

================
 final structure:
================
$coord
    2.35973161372793    0.51788234382702   -0.32044841313717      C 
    1.68289398275232   -1.92352131872199   -0.17442372221475      C 
   -1.06130889690533   -2.03811187885232    0.14595768036389      C 
   -2.21727939042943   -4.29519337758101    0.32894357241456      O 
   -4.86224756088847   -4.25567124483607    0.61424391438494      C 
   -2.00178241123380    0.35045935637837    0.19607140890957      C 
    0.08525409938696    2.07101829150168   -0.09665043074323      C 
   -0.00000606943703    4.64853986216823   -0.17756431951860      C 
    2.08673594236179    6.36148300762665   -0.51440507792987      C 
    1.14881035265429    8.75122124083730   -0.50571443525089      C 
    2.30547980194991   11.00070275318623   -0.76525910617148      O 
    4.94092449887634   10.94371553906301   -1.12665460308144      C 
   -1.59140362612670    8.64589804242413   -0.15079243346544      C 
   -2.27006431743650    6.20803931666320    0.04122305687289      C 
    4.23176411831546    1.25807214304063   -0.55629581873257      H 
    2.86033315758440   -3.57264204376709   -0.26615347663773      H 
   -5.46586867979015   -6.22041883112211    0.70404722853187      H 
   -5.76893560711236   -3.32269392677722   -0.99393869819594      H 
   -5.40749160241029   -3.28058005334850    2.35528386025626      H 
   -3.93503306425203    0.91801777773375    0.40497014362084      H 
    4.01668638936200    5.78742270674754   -0.73458038301263      H 
    5.54225333846619   12.90069765785884   -1.32984065595597      H 
    5.43344988648250    9.88429810555002   -2.83373261298987      H 
    5.89540582525232   10.08816335954216    0.49705379699463      H 
   -2.76607612852860   10.29778710282046   -0.07352308243229      H 
   -4.14025086254856    5.47494716966756    0.31267364333770      H 
$end
           -------------------------------------------------
          |                Final Singlepoint                |
           -------------------------------------------------

          ...................................................
          :                      SETUP                      :
          :.................................................:
          :  # basis functions                  68          :
          :  # atomic orbitals                  68          :
          :  # shells                           40          :
          :  # electrons                        72          :
          :  max. iterations                   250          :
          :  Hamiltonian                  GFN2-xTB          :
          :  restarted?                      false          :
          :  GBSA solvation                  false          :
          :  PC potential                    false          :
          :  electronic temp.          300.0000000     K    :
          :  accuracy                    1.0000000          :
          :  -> integral cutoff          0.2500000E+02      :
          :  -> integral neglect         0.1000000E-07      :
          :  -> SCF convergence          0.1000000E-05 Eh   :
          :  -> wf. convergence          0.1000000E-03 e    :
          :  Broyden damping             0.4000000          :
          ...................................................

 iter      E             dE          RMSdq      gap      omega  full diag
   1    -40.4654433 -0.404654E+02  0.185E-04    1.39       0.0  T
   2    -40.4654433  0.136339E-09  0.104E-04    1.39     189.0  T
   3    -40.4654433 -0.185331E-09  0.125E-04    1.39     157.1  T

   *** convergence criteria satisfied after 3 iterations ***

         #    Occupation            Energy/Eh            Energy/eV
      -------------------------------------------------------------
         1        2.0000           -0.7192655             -19.5722
       ...           ...                  ...                  ...
        30        2.0000           -0.4364740             -11.8771
        31        2.0000           -0.4361040             -11.8670
        32        2.0000           -0.4316207             -11.7450
        33        2.0000           -0.4231364             -11.5141
        34        2.0000           -0.3859758             -10.5029
        35        2.0000           -0.3653943              -9.9429
        36        2.0000           -0.3555399              -9.6747 (HOMO)
        37                         -0.3043982              -8.2831 (LUMO)
        38                         -0.1900443              -5.1714
        39                         -0.1410549              -3.8383
        40                         -0.1382445              -3.7618
        41                         -0.0875971              -2.3836
       ...                                ...                  ...
        68                          0.7687678              20.9192
      -------------------------------------------------------------
                  HL-Gap            0.0511417 Eh            1.3916 eV
             Fermi-level           -0.3299690 Eh           -8.9789 eV

 SCC (total)                   0 d,  0 h,  0 min,  0.027 sec
 SCC setup                      ...        0 min,  0.000 sec (  0.741%)
 Dispersion                     ...        0 min,  0.000 sec (  0.844%)
 integral evaluation            ...        0 min,  0.009 sec ( 33.881%)
 zeroth order Hamiltonian       ...        0 min,  0.000 sec (  0.522%)
 iterations                     ...        0 min,  0.004 sec ( 15.103%)
 molecular gradient             ...        0 min,  0.013 sec ( 47.454%)
 printout                       ...        0 min,  0.000 sec (  1.274%)

         :::::::::::::::::::::::::::::::::::::::::::::::::::::
         ::                     SUMMARY                     ::
         :::::::::::::::::::::::::::::::::::::::::::::::::::::
         :: total energy             -39.866581960179 Eh    ::
         :: gradient norm              0.000962494204 Eh/a0 ::
         :: HOMO-LUMO gap              1.391636040793 eV    ::
         ::.................................................::
         :: SCC energy               -40.465443303857 Eh    ::
         :: -> isotropic ES            0.028255686666 Eh    ::
         :: -> anisotropic ES          0.005436864540 Eh    ::
         :: -> anisotropic XC          0.014381809919 Eh    ::
         :: -> dispersion             -0.022826782601 Eh    ::
         :: repulsion energy           0.598956495707 Eh    ::
         :: add. restraining           0.000000000000 Eh    ::
         :::::::::::::::::::::::::::::::::::::::::::::::::::::

           -------------------------------------------------
          |                Property Printout                |
           -------------------------------------------------

    * Orbital Energies and Occupations

         #    Occupation            Energy/Eh            Energy/eV
      -------------------------------------------------------------
         1        2.0000           -0.7192655             -19.5722
       ...           ...                  ...                  ...
        24        2.0000           -0.4754435             -12.9375
        25        2.0000           -0.4701404             -12.7932
        26        2.0000           -0.4606061             -12.5337
        27        2.0000           -0.4599730             -12.5165
        28        2.0000           -0.4557473             -12.4015
        29        2.0000           -0.4445243             -12.0961
        30        2.0000           -0.4364740             -11.8771
        31        2.0000           -0.4361040             -11.8670
        32        2.0000           -0.4316207             -11.7450
        33        2.0000           -0.4231364             -11.5141
        34        2.0000           -0.3859758             -10.5029
        35        2.0000           -0.3653943              -9.9429
        36        2.0000           -0.3555399              -9.6747 (HOMO)
        37                         -0.3043982              -8.2831 (LUMO)
        38                         -0.1900443              -5.1714
        39                         -0.1410549              -3.8383
        40                         -0.1382445              -3.7618
        41                         -0.0875971              -2.3836
        42                          0.0317818               0.8648
        43                          0.0355821               0.9682
        44                          0.0915284               2.4906
        45                          0.0997182               2.7135
        46                          0.1130991               3.0776
        47                          0.1259065               3.4261
       ...                                ...                  ...
        68                          0.7687678              20.9192
      -------------------------------------------------------------
                  HL-Gap            0.0511417 Eh            1.3916 eV
             Fermi-level           -0.3299690 Eh           -8.9789 eV

     #   Z        covCN         q      C6AA      α(0)
     1   6 C      3.002    -0.049    29.211     8.866
     2   6 C      3.010    -0.052    29.272     8.875
     3   6 C      3.001     0.141    24.911     8.187
     4   8 O      1.704    -0.249    18.124     5.748
     5   6 C      3.657     0.035    20.268     6.462
     6   6 C      2.986    -0.109    30.737     9.094
     7   6 C      3.096     0.020    27.444     8.586
     8   6 C      3.096     0.020    27.443     8.586
     9   6 C      2.986    -0.109    30.738     9.094
    10   6 C      3.001     0.141    24.912     8.187
    11   8 O      1.704    -0.249    18.126     5.748
    12   6 C      3.657     0.035    20.267     6.462
    13   6 C      3.011    -0.052    29.271     8.875
    14   6 C      3.002    -0.049    29.211     8.866
    15   1 H      0.926     0.039     2.463     2.454
    16   1 H      0.926     0.043     2.407     2.426
    17   1 H      0.925     0.062     2.175     2.306
    18   1 H      0.924     0.045     2.378     2.412
    19   1 H      0.924     0.045     2.379     2.412
    20   1 H      0.926     0.028     2.622     2.532
    21   1 H      0.926     0.028     2.621     2.532
    22   1 H      0.925     0.062     2.175     2.306
    23   1 H      0.924     0.045     2.378     2.412
    24   1 H      0.924     0.045     2.379     2.412
    25   1 H      0.926     0.043     2.407     2.426
    26   1 H      0.926     0.039     2.464     2.455

 Mol. C6AA /au·bohr⁶  :       7945.261005
 Mol. C8AA /au·bohr⁸  :     190616.246197
 Mol. α(0) /au        :        140.720967


Wiberg/Mayer (AO) data.
largest (>0.10) Wiberg bond orders for each atom
          total WBO             WBO to atom ...
     1  C   3.982        C    2 1.769    C    7 1.083    H   15 0.971
     2  C   3.937        C    1 1.769    C    3 1.067    H   16 0.972
     3  C   3.873        C    6 1.584    O    4 1.091    C    2 1.067
     4  O   2.251        C    3 1.091    C    5 0.981
     5  C   3.944        O    4 0.981    H   17 0.981    H   18 0.976    H   19 0.976
     6  C   3.962        C    3 1.584    C    7 1.159    H   20 0.970
     7  C   3.985        C    8 1.507    C    6 1.159    C    1 1.083
     8  C   3.985        C    7 1.507    C    9 1.159    C   14 1.084
     9  C   3.963        C   10 1.585    C    8 1.159    H   21 0.970
    10  C   3.873        C    9 1.585    O   11 1.091    C   13 1.067
    11  O   2.250        C   10 1.091    C   12 0.981
    12  C   3.944        O   11 0.981    H   22 0.981    H   23 0.976    H   24 0.976
    13  C   3.937        C   14 1.768    C   10 1.067    H   25 0.972
    14  C   3.982        C   13 1.768    C    8 1.084    H   26 0.971
    15  H   0.998        C    1 0.971
    16  H   0.997        C    2 0.972
    17  H   0.996        C    5 0.981
    18  H   0.996        C    5 0.976
    19  H   0.996        C    5 0.976
    20  H   0.999        C    6 0.970
    21  H   0.999        C    9 0.970
    22  H   0.996        C   12 0.981
    23  H   0.996        C   12 0.976
    24  H   0.996        C   12 0.976
    25  H   0.997        C   13 0.972
    26  H   0.998        C   14 0.971

molecular dipole:
                 x           y           z       tot (Debye)
 q only:       -0.002      -0.005      -0.017
   full:       -0.003      -0.006      -0.020       0.055
molecular quadrupole (traceless):
                xx          xy          yy          xz          yz          zz
 q only:        8.981      11.069      -3.762      -2.176      -1.517      -5.219
  q+dip:       10.715      11.216      -2.603      -2.748      -1.702      -8.112
   full:       10.634      11.940      -5.414      -2.410      -1.587      -5.220

           -------------------------------------------------
          |                Geometry Summary                 |
           -------------------------------------------------

      molecular mass/u    :      188.2256000
   center of mass at/Å    :        0.0228495       1.7757623      -0.0966203
  moments of inertia/u·Å² :        0.2307375E+03   0.1718340E+04   0.1942482E+04
rotational constants/cm⁻¹ :        0.7305979E-01   0.9810420E-02   0.8678399E-02

 * 23 selected distances

     #   Z        #   Z                                     value/Å
     1   6 C      2   6 C                                 1.3428893
     3   6 C      4   8 O                                 1.3454188
     4   8 O      5   6 C                                 1.4079313
     3   6 C      6   6 C                                 1.3586851
     6   6 C      7   6 C                                 1.4396861
     7   6 C      8   6 C                                 1.3653833
     8   6 C      9   6 C                                 1.4397248 (max)
     9   6 C     10   6 C                                 1.3585155
    10   6 C     11   8 O                                 1.3455485
    11   8 O     12   6 C                                 1.4079917
    13   6 C     14   6 C                                 1.3429645
     1   6 C     15   1 H                                 1.0725485
     2   6 C     16   1 H                                 1.0733792
     5   6 C     17   1 H                                 1.0886986
     5   6 C     18   1 H                                 1.0946145
     5   6 C     19   1 H                                 1.0946827
     6   6 C     20   1 H                                 1.0719229
     9   6 C     21   1 H                                 1.0718591 (min)
    12   6 C     22   1 H                                 1.0886991
    12   6 C     23   1 H                                 1.0946504
    12   6 C     24   1 H                                 1.0946979
    13   6 C     25   1 H                                 1.0734036
    14   6 C     26   1 H                                 1.0726395

 * 3 distinct bonds (by element types)

   Z      Z             #   av. dist./Å        max./Å        min./Å
   1 H    6 C          12     1.0826497     1.0946979     1.0718591
   6 C    6 C           7     1.3782641     1.4397248     1.3428893
   6 C    8 O           4     1.3767226     1.4079917     1.3454188


optimized geometry written to: xtbopt.xyz


           -------------------------------------------------
          | TOTAL ENERGY              -39.866581960179 Eh   |
          | GRADIENT NORM               0.000962494204 Eh/α |
          | HOMO-LUMO GAP               1.391636040793 eV   |
           -------------------------------------------------

------------------------------------------------------------------------
 * finished run on 2021/05/19 at 10:58:45.562     
------------------------------------------------------------------------
 total:
 * wall-time:     0 d,  0 h,  0 min,  0.265 sec
 *  cpu-time:     0 d,  0 h,  0 min,  0.264 sec
 * ratio c/w:     0.997 speedup
 SCF:
 * wall-time:     0 d,  0 h,  0 min,  0.038 sec
 *  cpu-time:     0 d,  0 h,  0 min,  0.038 sec
 * ratio c/w:     0.999 speedup
 ANC optimizer:
 * wall-time:     0 d,  0 h,  0 min,  0.206 sec
 *  cpu-time:     0 d,  0 h,  0 min,  0.205 sec
 * ratio c/w:     0.999 speedup

