      -----------------------------------------------------------      
     |                   =====================                   |     
     |                           x T B                           |     
     |                   =====================                   |     
     |                         S. Grimme                         |     
     |          Mulliken Center for Theoretical Chemistry        |     
     |                    University of Bonn                     |     
     |                Version 6.2 RC2 (SAW190805)                |     
      -----------------------------------------------------------      

   This program is distributed in the hope that it will be useful,
   but WITHOUT ANY WARRANTY; without even the implied warranty of
   MERCHANTABILITY or FITNESS FOR A PARTICULAR PURPOSE.
   
   FOR NON-COMMERCIAL, ACADEMIA USE ONLY.
   
   Cite this work as:
   * S. Grimme, C. Bannwarth, P. Shushkov, J. Chem. Theory Comput., 2017,
     13, 1989-2009. DOI: 10.1021/acs.jctc.7b00118
   * C. Bannwarth, S. Ehlert and S. Grimme., J. Chem. Theory Comput., 2019,
     15, 1652-1671. DOI: 10.1021/acs.jctc.8b01176
   * P. Pracht, E. Caldeweyher, S. Ehlert, S. Grimme, ChemRxiv, 2019, preprint.
     DOI: 10.26434/chemrxiv.8326202.v1
   
   for DFT-D4:
   * E. Caldeweyher, C. Bannwarth and S. Grimme, J. Chem. Phys., 2017,
     147, 034112. DOI: 10.1063/1.4993215
   * E. Caldeweyher, S. Ehlert, A. Hansen, H. Neugebauer, S. Spicher,
     C. Bannwarth and S. Grimme, J. Chem. Phys., 2019, 150, 154122.
     DOI: 10.1063/1.5090222
   
   for sTDA-xTB:
   * S. Grimme and C. Bannwarth, J. Chem. Phys., 2016, 145, 054103.
     DOI: 10.1063/1.4959605
   
   in the mass-spec context:
   * V. Asgeirsson, C. Bauer and S. Grimme, Chem. Sci., 2017, 8, 4879.
     DOI: 10.1039/c7sc00601b
   
   for metadynamics refer to:
   * S. Grimme, J. Chem. Theory Comput., 2019, 155, 2847-2862
     DOI: 10.1021/acs.jctc.9b00143
   
   with help from (in alphabetical order)
   C. Bannwarth, F. Bohle, G. Brandenburg, E. Caldeweyher, M. Checinski,
   S. Dohm, S. Ehlert, S. Ehrlich, F. März, H. Neugebauer, J. Pisarek,
   P. Pracht, P. Shushkov, and S. Spicher.
   
 * started run on 2021/05/19 at 10:58:48.736     

           -------------------------------------------------
          |                Calculation Setup                |
           -------------------------------------------------

          program call               : /ihome/ghutchison/geoffh/xtb/xtb 208.xyz -opt
          hostname                   : smp-n83
          coordinate file            : 208.xyz
          omp threads                :                     1
          number of atoms            :                    24
          number of electrons        :                    74
          charge                     :                     0
          spin                       :                   0.0
          first test random number   :      0.31625255331465


########################################################################
# WARNING! Please study the warnings concerning your input carefully
#  - the use of '-opt' is discouraged, please use '--opt' next time
########################################################################

           ------------------------------------------------- 
          |                 G F N 2 - x T B                 |
          | Geometry, Frequencies, Noncovalent interactions |
          |            JCTC 2019 parametrisation            |
           ------------------------------------------------- 
             KAB for C  - Si     :                1.0500
             KAB for H  - Pd     :                0.9500
             k(s)              :                1.8500
             k(p)              :                2.2300
             k(d)              :                2.2300
             k(f)              :                2.0000
             kEN (H0ij)        :               -2.0000
             D4 a1             :                0.5200
             D4 a2             :                5.0000
             D4 s6             :                1.0000
             D4 s8             :                2.7000
             D4 s9             :                5.0000
             alphaj            :                2.0000

  Z AO/shell   Hii/eV     exponent
  1     Wed Apr 25 08:07:45 CEST 2018   EN: 2.200 GM2: 0.406  GM3: 0.0800  RAES: 1.40
     1s    -10.707211    1.230000
  6     Wed Apr 25 08:07:45 CEST 2018   EN: 2.550 GM2: 0.538  GM3: 0.1500  RAES: 3.00
     2s    -13.970922    2.096432
     2p    -10.063292    1.800000
  7     Wed Apr 25 08:07:45 CEST 2018   EN: 3.040 GM2: 0.461  GM3:-0.0640  RAES: 1.90
     2s    -16.686243    2.339881
     2p    -12.523956    2.014332

           ------------------------------------------------- 
          |        Self-Consistent Charge Iterations        |
           ------------------------------------------------- 

          ...................................................
          :                      SETUP                      :
          :.................................................:
          :  # basis functions                  72          :
          :  # atomic orbitals                  72          :
          :  # shells                           40          :
          :  # electrons                        74          :
          :  max. iterations                   250          :
          :  Hamiltonian                  GFN2-xTB          :
          :  restarted?                      false          :
          :  GBSA solvation                  false          :
          :  PC potential                    false          :
          :  electronic temp.          300.0000000     K    :
          :  accuracy                    1.0000000          :
          :  -> integral cutoff          0.2500000E+02      :
          :  -> integral neglect         0.1000000E-07      :
          :  -> SCF convergence          0.1000000E-05 Eh   :
          :  -> wf. convergence          0.1000000E-03 e    :
          :  Broyden damping             0.4000000          :
          ...................................................

 iter      E             dE          RMSdq      gap      omega  full diag
   1    -40.3292863 -0.403293E+02  0.617E+00    1.43       0.0  T
   2    -40.2805695  0.487168E-01  0.438E+00    1.31       1.0  T
   3    -40.2140235  0.665460E-01  0.350E+00    1.30       1.0  T
   4    -40.3880629 -0.174039E+00  0.105E+00    1.28       1.0  T
   5    -40.4116065 -0.235436E-01  0.340E-01    1.19       1.0  T
   6    -40.4125942 -0.987713E-03  0.183E-01    1.23       1.0  T
   7    -40.4130433 -0.449042E-03  0.797E-02    1.21       1.0  T
   8    -40.4131234 -0.801027E-04  0.282E-02    1.22       1.0  T
   9    -40.4131270 -0.363157E-05  0.162E-02    1.22       1.3  T
  10    -40.4131295 -0.250051E-05  0.676E-03    1.22       3.0  T
  11    -40.4131302 -0.725401E-06  0.159E-03    1.22      12.9  T
  12    -40.4131302 -0.843271E-08  0.100E-03    1.22      20.4  T
  13    -40.4131302 -0.846818E-08  0.407E-04    1.22      50.2  T
  14    -40.4131302 -0.237513E-08  0.124E-04    1.22     164.6  T

   *** convergence criteria satisfied after 14 iterations ***

         #    Occupation            Energy/Eh            Energy/eV
      -------------------------------------------------------------
         1        2.0000           -0.6937209             -18.8771
       ...           ...                  ...                  ...
        31        2.0000           -0.4558477             -12.4042
        32        2.0000           -0.4405572             -11.9882
        33        2.0000           -0.4378078             -11.9134
        34        2.0000           -0.4362135             -11.8700
        35        2.0000           -0.4295819             -11.6895
        36        2.0000           -0.4148039             -11.2874
        37        2.0000           -0.4056010             -11.0370 (HOMO)
        38                         -0.3608172              -9.8183 (LUMO)
        39                         -0.2749313              -7.4813
        40                         -0.2617319              -7.1221
        41                         -0.2546587              -6.9296
        42                         -0.2473668              -6.7312
       ...                                ...                  ...
        72                          1.0997892              29.9268
      -------------------------------------------------------------
                  HL-Gap            0.0447838 Eh            1.2186 eV
             Fermi-level           -0.3832090 Eh          -10.4276 eV

 SCC (total)                   0 d,  0 h,  0 min,  0.042 sec
 SCC setup                      ...        0 min,  0.000 sec (  0.750%)
 Dispersion                     ...        0 min,  0.000 sec (  1.039%)
 integral evaluation            ...        0 min,  0.010 sec ( 24.717%)
 zeroth order Hamiltonian       ...        0 min,  0.000 sec (  0.424%)
 iterations                     ...        0 min,  0.017 sec ( 39.201%)
 molecular gradient             ...        0 min,  0.014 sec ( 32.908%)
 printout                       ...        0 min,  0.000 sec (  0.832%)

         :::::::::::::::::::::::::::::::::::::::::::::::::::::
         ::                     SUMMARY                     ::
         :::::::::::::::::::::::::::::::::::::::::::::::::::::
         :: total energy             -39.668174513111 Eh    ::
         :: gradient norm              0.259031296083 Eh/a0 ::
         :: HOMO-LUMO gap              1.218628760043 eV    ::
         ::.................................................::
         :: SCC energy               -40.413130240048 Eh    ::
         :: -> isotropic ES            0.016722876041 Eh    ::
         :: -> anisotropic ES          0.003746612143 Eh    ::
         :: -> anisotropic XC          0.055007161141 Eh    ::
         :: -> dispersion             -0.025265338934 Eh    ::
         :: repulsion energy           0.744942616120 Eh    ::
         :: add. restraining           0.000000000000 Eh    ::
         :::::::::::::::::::::::::::::::::::::::::::::::::::::

      ----------------------------------------------------------- 
     |                   =====================                   |
     |                        A N C O P T                        |
     |                   =====================                   |
     |               Approximate Normal Coordinate               |
     |                Rational Function Optimizer                |
      ----------------------------------------------------------- 

          ...................................................
          :                      SETUP                      :
          :.................................................:
          :   optimization level            normal          :
          :   max. optcycles                   200          :
          :   ANC micro-cycles                  20          :
          :   degrees of freedom                66          :
          :.................................................:
          :   RF solver                   davidson          :
          :   input Hessian                  false          :
          :   write xtbopt.log                true          :
          :   linear?                        false          :
          :   energy convergence         0.5000000E-05 Eh   :
          :   grad. convergence          0.1000000E-02 Eh/α :
          :   maximium RF displ.         2.0000000          :
          :   Hlow (freq-cutoff)         0.5000000E-02      :
          :   Hmax (freq-cutoff)         5.0000000          :
          :   S6 in model hess.         20.0000000          :
          ...................................................

generating ANC from model Hessian ...
Using Lindh-Hessian (1995)
 Shifting diagonal of input Hessian by   4.275166948829867E-003
 Lowest  eigenvalues of input Hessian
   -0.000000   -0.000000    0.000000    0.000000    0.000000    0.000000
    0.005000    0.005398    0.006252    0.006882    0.007524    0.008421
    0.009714    0.010269    0.014603    0.015019    0.019333    0.024852
 Highest eigenvalues
    1.829591    1.867862    1.999445    2.038278    2.097045    2.578606
 

........................................................................
.............................. CYCLE    1 ..............................
........................................................................
   1    -40.4131302 -0.404131E+02  0.815E-05    1.22       0.0  T
   2    -40.4131302  0.648370E-10  0.719E-05    1.22     283.9  T
   3    -40.4131302 -0.114277E-09  0.396E-05    1.22     514.9  T
     SCC iter.                  ...        0 min,  0.004 sec
     gradient                   ...        0 min,  0.014 sec
 * total energy  :   -39.6681745 Eh     change        0.8773483E-08 Eh
   gradient norm :     0.2590319 Eh/α   predicted     0.0000000E+00 (-100.00%)
   displ. norm   :     0.3196561 α      lambda       -0.5834506E-01
   maximum displ.:     0.1639101 α      in ANC's #29, #44, #24, ...

........................................................................
.............................. CYCLE    2 ..............................
........................................................................
   1    -40.5184082 -0.405184E+02  0.443E-01    1.19       0.0  T
   2    -40.5185815 -0.173316E-03  0.279E-01    1.18       1.0  T
   3    -40.5181355  0.446002E-03  0.219E-01    1.20       1.0  T
   4    -40.5188697 -0.734190E-03  0.608E-02    1.17       1.0  T
   5    -40.5189496 -0.799360E-04  0.261E-02    1.19       1.0  T
   6    -40.5189630 -0.133368E-04  0.734E-03    1.19       2.8  T
   7    -40.5189630 -0.371509E-07  0.523E-03    1.19       3.9  T
   8    -40.5189633 -0.334568E-06  0.216E-03    1.19       9.5  T
     SCC iter.                  ...        0 min,  0.009 sec
     gradient                   ...        0 min,  0.013 sec
 * total energy  :   -39.7028645 Eh     change       -0.3468998E-01 Eh
   gradient norm :     0.0546055 Eh/α   predicted    -0.3215386E-01 (  -7.31%)
   displ. norm   :     0.2182113 α      lambda       -0.4039861E-02
   maximum displ.:     0.0824877 α      in ANC's #5, #4, #6, ...

........................................................................
.............................. CYCLE    3 ..............................
........................................................................
   1    -40.5292155 -0.405292E+02  0.179E-01    1.17       0.0  T
   2    -40.5292177 -0.219348E-05  0.124E-01    1.16       1.0  T
   3    -40.5292107  0.701672E-05  0.795E-02    1.17       1.0  T
   4    -40.5292876 -0.768833E-04  0.311E-02    1.16       1.0  T
   5    -40.5293095 -0.218573E-04  0.715E-03    1.17       2.9  T
   6    -40.5293100 -0.542566E-06  0.361E-03    1.17       5.7  T
   7    -40.5293101 -0.132026E-06  0.167E-03    1.17      12.2  T
     SCC iter.                  ...        0 min,  0.008 sec
     gradient                   ...        0 min,  0.013 sec
 * total energy  :   -39.7053496 Eh     change       -0.2485113E-02 Eh
   gradient norm :     0.0210558 Eh/α   predicted    -0.2116112E-02 ( -14.85%)
   displ. norm   :     0.1931010 α      lambda       -0.8793055E-03
   maximum displ.:     0.1090877 α      in ANC's #6, #4, #9, ...

........................................................................
.............................. CYCLE    4 ..............................
........................................................................
   1    -40.5283109 -0.405283E+02  0.133E-01    1.15       0.0  T
   2    -40.5283151 -0.416022E-05  0.791E-02    1.15       1.0  T
   3    -40.5282768  0.383181E-04  0.479E-02    1.16       1.0  T
   4    -40.5283216 -0.448768E-04  0.549E-03    1.16       3.7  T
   5    -40.5283219 -0.232686E-06  0.306E-03    1.16       6.7  T
   6    -40.5283219 -0.786290E-07  0.131E-03    1.16      15.6  T
     SCC iter.                  ...        0 min,  0.007 sec
     gradient                   ...        0 min,  0.024 sec
 * total energy  :   -39.7058133 Eh     change       -0.4636795E-03 Eh
   gradient norm :     0.0111983 Eh/α   predicted    -0.4560472E-03 (  -1.65%)
   displ. norm   :     0.2450469 α      lambda       -0.4999467E-03
   maximum displ.:     0.1203956 α      in ANC's #5, #4, #6, ...

........................................................................
.............................. CYCLE    5 ..............................
........................................................................
   1    -40.5246876 -0.405247E+02  0.278E-01    1.15       0.0  T
   2    -40.5247026 -0.150056E-04  0.155E-01    1.16       1.0  T
   3    -40.5246424  0.602000E-04  0.526E-02    1.15       1.0  T
   4    -40.5247116 -0.692605E-04  0.974E-03    1.16       2.1  T
   5    -40.5247133 -0.163827E-05  0.493E-03    1.16       4.1  T
   6    -40.5247134 -0.186042E-06  0.210E-03    1.16       9.7  T
   7    -40.5247135 -0.778779E-07  0.717E-04    1.16      28.5  T
     SCC iter.                  ...        0 min,  0.021 sec
     gradient                   ...        0 min,  0.026 sec
 * total energy  :   -39.7059448 Eh     change       -0.1315403E-03 Eh
   gradient norm :     0.0262107 Eh/α   predicted    -0.2649871E-03 ( 101.45%)
   displ. norm   :     0.1716465 α      lambda       -0.5879862E-03
   maximum displ.:     0.0877165 α      in ANC's #8, #4, #9, ...

........................................................................
.............................. CYCLE    6 ..............................
........................................................................
   1    -40.5282949 -0.405283E+02  0.145E-01    1.16       0.0  T
   2    -40.5283016 -0.667008E-05  0.836E-02    1.17       1.0  T
   3    -40.5282506  0.509216E-04  0.465E-02    1.16       1.0  T
   4    -40.5283049 -0.542222E-04  0.920E-03    1.16       2.2  T
   5    -40.5283062 -0.137716E-05  0.443E-03    1.16       4.6  T
   6    -40.5283065 -0.262673E-06  0.202E-03    1.16      10.1  T
     SCC iter.                  ...        0 min,  0.007 sec
     gradient                   ...        0 min,  0.013 sec
 * total energy  :   -39.7061686 Eh     change       -0.2237991E-03 Eh
   gradient norm :     0.0093359 Eh/α   predicted    -0.3026552E-03 (  35.24%)
   displ. norm   :     0.1413625 α      lambda       -0.3446521E-03
   maximum displ.:     0.0674888 α      in ANC's #4, #8, #6, ...

........................................................................
.............................. CYCLE    7 ..............................
........................................................................
   1    -40.5291506 -0.405292E+02  0.203E-01    1.16       0.0  T
   2    -40.5291582 -0.760841E-05  0.113E-01    1.16       1.0  T
   3    -40.5291404  0.178474E-04  0.311E-02    1.16       1.0  T
   4    -40.5291628 -0.223625E-04  0.495E-03    1.16       4.1  T
   5    -40.5291628 -0.915444E-07  0.367E-03    1.16       5.6  T
   6    -40.5291630 -0.171381E-06  0.135E-03    1.16      15.1  T
   7    -40.5291631 -0.308153E-07  0.539E-04    1.16      37.9  T
     SCC iter.                  ...        0 min,  0.008 sec
     gradient                   ...        0 min,  0.013 sec
 * total energy  :   -39.7063002 Eh     change       -0.1315698E-03 Eh
   gradient norm :     0.0109561 Eh/α   predicted    -0.1757712E-03 (  33.60%)
   displ. norm   :     0.1543122 α      lambda       -0.2413058E-03
   maximum displ.:     0.1086141 α      in ANC's #8, #4, #1, ...

........................................................................
.............................. CYCLE    8 ..............................
........................................................................
   1    -40.5283947 -0.405284E+02  0.111E-01    1.15       0.0  T
   2    -40.5283960 -0.121841E-05  0.642E-02    1.15       1.0  T
   3    -40.5283812  0.147480E-04  0.280E-02    1.15       1.0  T
   4    -40.5283975 -0.162793E-04  0.315E-03    1.15       6.5  T
   5    -40.5283975 -0.312215E-07  0.203E-03    1.15      10.1  T
   6    -40.5283975 -0.277682E-08  0.141E-03    1.15      14.5  T
     SCC iter.                  ...        0 min,  0.007 sec
     gradient                   ...        0 min,  0.013 sec
 * total energy  :   -39.7064964 Eh     change       -0.1961913E-03 Eh
   gradient norm :     0.0051133 Eh/α   predicted    -0.1235286E-03 ( -37.04%)
   displ. norm   :     0.3526673 α      lambda       -0.3934194E-03
   maximum displ.:     0.2304315 α      in ANC's #8, #4, #1, ...

........................................................................
.............................. CYCLE    9 ..............................
........................................................................
   1    -40.5258555 -0.405259E+02  0.224E-01    1.13       0.0  T
   2    -40.5258578 -0.235388E-05  0.130E-01    1.13       1.0  T
   3    -40.5258164  0.414123E-04  0.474E-02    1.13       1.0  T
   4    -40.5258615 -0.451352E-04  0.446E-03    1.13       4.6  T
   5    -40.5258616 -0.347585E-07  0.310E-03    1.13       6.6  T
   6    -40.5258616 -0.614184E-07  0.174E-03    1.13      11.7  T
   7    -40.5258617 -0.598646E-07  0.588E-04    1.13      34.7  T
     SCC iter.                  ...        0 min,  0.008 sec
     gradient                   ...        0 min,  0.013 sec
 * total energy  :   -39.7067865 Eh     change       -0.2901268E-03 Eh
   gradient norm :     0.0099225 Eh/α   predicted    -0.2211755E-03 ( -23.77%)
   displ. norm   :     0.3798912 α      lambda       -0.3610684E-03
   maximum displ.:     0.2460988 α      in ANC's #8, #1, #4, ...

........................................................................
.............................. CYCLE   10 ..............................
........................................................................
   1    -40.5242236 -0.405242E+02  0.243E-01    1.11       0.0  T
   2    -40.5242248 -0.115506E-05  0.143E-01    1.11       1.0  T
   3    -40.5241535  0.712885E-04  0.619E-02    1.11       1.0  T
   4    -40.5242302 -0.766632E-04  0.478E-03    1.11       4.3  T
   5    -40.5242302 -0.341912E-07  0.375E-03    1.11       5.4  T
   6    -40.5242304 -0.187651E-06  0.139E-03    1.11      14.7  T
   7    -40.5242304 -0.397324E-07  0.554E-04    1.11      36.8  T
     SCC iter.                  ...        0 min,  0.008 sec
     gradient                   ...        0 min,  0.013 sec
 * total energy  :   -39.7070346 Eh     change       -0.2480699E-03 Eh
   gradient norm :     0.0127535 Eh/α   predicted    -0.2065950E-03 ( -16.72%)
   displ. norm   :     0.3439351 α      lambda       -0.4702986E-03
   maximum displ.:     0.2069062 α      in ANC's #1, #8, #4, ...

........................................................................
.............................. CYCLE   11 ..............................
........................................................................
   1    -40.5263654 -0.405264E+02  0.210E-01    1.09       0.0  T
   2    -40.5263684 -0.296498E-05  0.122E-01    1.09       1.0  T
   3    -40.5263599  0.846846E-05  0.237E-02    1.09       1.0  T
   4    -40.5263701 -0.101955E-04  0.427E-03    1.09       4.8  T
   5    -40.5263702 -0.639110E-07  0.246E-03    1.09       8.3  T
   6    -40.5263702 -0.509639E-07  0.928E-04    1.09      22.0  T
     SCC iter.                  ...        0 min,  0.007 sec
     gradient                   ...        0 min,  0.013 sec
 * total energy  :   -39.7073670 Eh     change       -0.3324653E-03 Eh
   gradient norm :     0.0108882 Eh/α   predicted    -0.2629690E-03 ( -20.90%)
   displ. norm   :     0.4316422 α      lambda       -0.4829512E-03
   maximum displ.:     0.2578861 α      in ANC's #1, #8, #4, ...

........................................................................
.............................. CYCLE   12 ..............................
........................................................................
   1    -40.5247497 -0.405247E+02  0.281E-01    1.06       0.0  T
   2    -40.5247551 -0.543647E-05  0.163E-01    1.06       1.0  T
   3    -40.5246989  0.562208E-04  0.509E-02    1.06       1.0  T
   4    -40.5247604 -0.615152E-04  0.795E-03    1.07       2.6  T
   5    -40.5247607 -0.319735E-06  0.555E-03    1.06       3.7  T
   6    -40.5247611 -0.390738E-06  0.195E-03    1.06      10.5  T
   7    -40.5247612 -0.844960E-07  0.618E-04    1.06      33.0  T
     SCC iter.                  ...        0 min,  0.008 sec
     gradient                   ...        0 min,  0.013 sec
 * total energy  :   -39.7076973 Eh     change       -0.3302615E-03 Eh
   gradient norm :     0.0080808 Eh/α   predicted    -0.2864670E-03 ( -13.26%)
   displ. norm   :     0.2860469 α      lambda       -0.3856995E-03
   maximum displ.:     0.2006670 α      in ANC's #1, #2, #4, ...

........................................................................
.............................. CYCLE   13 ..............................
........................................................................
   1    -40.5316146 -0.405316E+02  0.174E-01    1.07       0.0  T
   2    -40.5316172 -0.268197E-05  0.100E-01    1.07       1.0  T
   3    -40.5315546  0.626481E-04  0.510E-02    1.06       1.0  T
   4    -40.5316220 -0.673633E-04  0.659E-03    1.07       3.1  T
   5    -40.5316224 -0.439476E-06  0.376E-03    1.07       5.4  T
   6    -40.5316225 -0.722301E-07  0.177E-03    1.07      11.6  T
   7    -40.5316225 -0.636106E-07  0.535E-04    1.07      38.2  T
     SCC iter.                  ...        0 min,  0.008 sec
     gradient                   ...        0 min,  0.013 sec
 * total energy  :   -39.7078472 Eh     change       -0.1498668E-03 Eh
   gradient norm :     0.0100374 Eh/α   predicted    -0.2086320E-03 (  39.21%)
   displ. norm   :     0.4501875 α      lambda       -0.3498042E-03
   maximum displ.:     0.2640205 α      in ANC's #1, #8, #4, ...

........................................................................
.............................. CYCLE   14 ..............................
........................................................................
   1    -40.5240328 -0.405240E+02  0.268E-01    1.05       0.0  T
   2    -40.5240369 -0.403252E-05  0.156E-01    1.05       1.0  T
   3    -40.5239382  0.986705E-04  0.716E-02    1.05       1.0  T
   4    -40.5240453 -0.107082E-03  0.609E-03    1.05       3.4  T
   5    -40.5240454 -0.103221E-06  0.409E-03    1.05       5.0  T
   6    -40.5240455 -0.145622E-06  0.165E-03    1.05      12.4  T
   7    -40.5240456 -0.291793E-07  0.802E-04    1.05      25.5  T
     SCC iter.                  ...        0 min,  0.008 sec
     gradient                   ...        0 min,  0.013 sec
 * total energy  :   -39.7077962 Eh     change        0.5101711E-04 Eh
   gradient norm :     0.0147571 Eh/α   predicted    -0.2103511E-03 (-512.31%)
   displ. norm   :     0.1157970 α      lambda       -0.5543162E-03
   maximum displ.:     0.0869862 α      in ANC's #8, #4, #5, ...

........................................................................
.............................. CYCLE   15 ..............................
........................................................................
   1    -40.5285245 -0.405285E+02  0.914E-02    1.05       0.0  T
   2    -40.5285278 -0.331668E-05  0.522E-02    1.05       1.0  T
   3    -40.5285085  0.192931E-04  0.340E-02    1.05       1.0  T
   4    -40.5285303 -0.218001E-04  0.474E-03    1.05       4.3  T
   5    -40.5285305 -0.145053E-06  0.312E-03    1.05       6.5  T
   6    -40.5285306 -0.126792E-06  0.140E-03    1.05      14.6  T
   7    -40.5285306  0.126860E-09  0.940E-04    1.05      21.7  T
     SCC iter.                  ...        0 min,  0.008 sec
     gradient                   ...        0 min,  0.013 sec
 * total energy  :   -39.7080023 Eh     change       -0.2061340E-03 Eh
   gradient norm :     0.0090237 Eh/α   predicted    -0.2808778E-03 (  36.26%)
   displ. norm   :     0.0831258 α      lambda       -0.1842126E-03
   maximum displ.:     0.0452226 α      in ANC's #6, #1, #9, ...

........................................................................
.............................. CYCLE   16 ..............................
........................................................................
   1    -40.5297642 -0.405298E+02  0.604E-02    1.06       0.0  T
   2    -40.5297652 -0.993920E-06  0.356E-02    1.06       1.0  T
   3    -40.5297567  0.844031E-05  0.198E-02    1.06       1.0  T
   4    -40.5297659 -0.918232E-05  0.381E-03    1.06       5.4  T
   5    -40.5297661 -0.163328E-06  0.219E-03    1.06       9.3  T
   6    -40.5297662 -0.827273E-07  0.974E-04    1.06      21.0  T
     SCC iter.                  ...        0 min,  0.007 sec
     gradient                   ...        0 min,  0.013 sec
 * total energy  :   -39.7080384 Eh     change       -0.3608615E-04 Eh
   gradient norm :     0.0076582 Eh/α   predicted    -0.9274548E-04 ( 157.01%)
   displ. norm   :     0.0839384 α      lambda       -0.1331755E-03
   maximum displ.:     0.0573782 α      in ANC's #1, #4, #3, ...

........................................................................
.............................. CYCLE   17 ..............................
........................................................................
   1    -40.5299813 -0.405300E+02  0.479E-02    1.06       0.0  T
   2    -40.5299814 -0.803214E-07  0.283E-02    1.06       1.0  T
   3    -40.5299667  0.146425E-04  0.242E-02    1.06       1.0  T
   4    -40.5299825 -0.157950E-04  0.329E-03    1.06       6.2  T
   5    -40.5299827 -0.127306E-06  0.157E-03    1.06      13.0  T
   6    -40.5299827 -0.137788E-07  0.802E-04    1.06      25.4  T
     SCC iter.                  ...        0 min,  0.007 sec
     gradient                   ...        0 min,  0.013 sec
 * total energy  :   -39.7081045 Eh     change       -0.6612098E-04 Eh
   gradient norm :     0.0050331 Eh/α   predicted    -0.6706292E-04 (   1.42%)
   displ. norm   :     0.1777851 α      lambda       -0.8200952E-04
   maximum displ.:     0.1245155 α      in ANC's #1, #4, #3, ...

........................................................................
.............................. CYCLE   18 ..............................
........................................................................
   1    -40.5286465 -0.405286E+02  0.102E-01    1.05       0.0  T
   2    -40.5286470 -0.500035E-06  0.592E-02    1.05       1.0  T
   3    -40.5286335  0.134832E-04  0.251E-02    1.06       1.0  T
   4    -40.5286479 -0.144176E-04  0.328E-03    1.05       6.2  T
   5    -40.5286481 -0.136578E-06  0.182E-03    1.05      11.2  T
   6    -40.5286481 -0.333461E-07  0.797E-04    1.05      25.6  T
     SCC iter.                  ...        0 min,  0.007 sec
     gradient                   ...        0 min,  0.013 sec
 * total energy  :   -39.7081508 Eh     change       -0.4625577E-04 Eh
   gradient norm :     0.0034273 Eh/α   predicted    -0.4230536E-04 (  -8.54%)
   displ. norm   :     0.1368223 α      lambda       -0.5247067E-04
   maximum displ.:     0.1145471 α      in ANC's #1, #3, #4, ...

........................................................................
.............................. CYCLE   19 ..............................
........................................................................
   1    -40.5284579 -0.405285E+02  0.780E-02    1.05       0.0  T
   2    -40.5284589 -0.927282E-06  0.446E-02    1.05       1.0  T
   3    -40.5284575  0.134998E-05  0.881E-03    1.05       2.3  T
   4    -40.5284593 -0.182385E-05  0.195E-03    1.05      10.5  T
   5    -40.5284593  0.109258E-07  0.141E-03    1.05      14.5  T
   6    -40.5284593 -0.317373E-07  0.334E-04    1.05      61.1  T
   7    -40.5284593 -0.139875E-08  0.156E-04    1.05     130.5  T
     SCC iter.                  ...        0 min,  0.008 sec
     gradient                   ...        0 min,  0.014 sec
 * total energy  :   -39.7081924 Eh     change       -0.4168188E-04 Eh
   gradient norm :     0.0029645 Eh/α   predicted    -0.2673266E-04 ( -35.87%)
   displ. norm   :     0.1727031 α      lambda       -0.6090849E-04
   maximum displ.:     0.1403884 α      in ANC's #1, #3, #6, ...

........................................................................
.............................. CYCLE   20 ..............................
........................................................................
   1    -40.5305486 -0.405305E+02  0.930E-02    1.05       0.0  T
   2    -40.5305496 -0.106525E-05  0.534E-02    1.05       1.0  T
   3    -40.5305483  0.135908E-05  0.976E-03    1.05       2.1  T
   4    -40.5305502 -0.189263E-05  0.217E-03    1.05       9.4  T
   5    -40.5305501  0.513088E-07  0.189E-03    1.05      10.8  T
   6    -40.5305502 -0.773590E-07  0.490E-04    1.05      41.7  T
   7    -40.5305502 -0.409253E-08  0.183E-04    1.05     111.4  T
     SCC iter.                  ...        0 min,  0.008 sec
     gradient                   ...        0 min,  0.014 sec
 * total energy  :   -39.7082258 Eh     change       -0.3337253E-04 Eh
   gradient norm :     0.0022879 Eh/α   predicted    -0.3136767E-04 (  -6.01%)
   displ. norm   :     0.1089259 α      lambda       -0.2242320E-04
   maximum displ.:     0.0900551 α      in ANC's #1, #3, #4, ...
 * RMSD in coord.:     0.6847703 α      energy gain  -0.4005129E-01 Eh

generating ANC from model Hessian ...
Using Lindh-Hessian (1995)
 Shifting diagonal of input Hessian by   4.780432413604655E-003
 Lowest  eigenvalues of input Hessian
   -0.000000   -0.000000   -0.000000    0.000000    0.000000    0.000000
    0.005000    0.005517    0.006249    0.007263    0.007847    0.009223
    0.011038    0.013001    0.014778    0.018709    0.021391    0.023225
 Highest eigenvalues
    1.859508    1.891184    2.026715    2.072827    2.645500    2.648516
 

........................................................................
.............................. CYCLE   21 ..............................
........................................................................
   1    -40.5294267 -0.405294E+02  0.661E-02    1.05       0.0  T
   2    -40.5294274 -0.718411E-06  0.377E-02    1.05       1.0  T
   3    -40.5294253  0.212518E-05  0.110E-02    1.05       1.9  T
   4    -40.5294278 -0.256939E-05  0.182E-03    1.05      11.2  T
   5    -40.5294278  0.276159E-08  0.140E-03    1.05      14.6  T
   6    -40.5294279 -0.256247E-07  0.298E-04    1.05      68.5  T
   7    -40.5294279 -0.111771E-08  0.128E-04    1.05     160.0  T
     SCC iter.                  ...        0 min,  0.008 sec
     gradient                   ...        0 min,  0.014 sec
 * total energy  :   -39.7082374 Eh     change       -0.1159432E-04 Eh
   gradient norm :     0.0024776 Eh/α   predicted     0.0000000E+00 (-100.00%)
   displ. norm   :     0.0250673 α      lambda       -0.1163598E-04
   maximum displ.:     0.0158545 α      in ANC's #2, #8, #5, ...

........................................................................
.............................. CYCLE   22 ..............................
........................................................................
   1    -40.5300220 -0.405300E+02  0.205E-02    1.05       0.0  T
   2    -40.5300221 -0.103404E-06  0.115E-02    1.05       1.8  T
   3    -40.5300216  0.476700E-06  0.506E-03    1.05       4.0  T
   4    -40.5300222 -0.558646E-06  0.647E-04    1.05      31.6  T
   5    -40.5300222 -0.117780E-08  0.472E-04    1.05      43.3  T
     SCC iter.                  ...        0 min,  0.006 sec
     gradient                   ...        0 min,  0.014 sec
 * total energy  :   -39.7082435 Eh     change       -0.6108071E-05 Eh
   gradient norm :     0.0009733 Eh/α   predicted    -0.5848088E-05 (  -4.26%)
   displ. norm   :     0.0610953 α      lambda       -0.1282320E-04
   maximum displ.:     0.0353076 α      in ANC's #8, #3, #4, ...

........................................................................
.............................. CYCLE   23 ..............................
........................................................................
   1    -40.5306288 -0.405306E+02  0.649E-02    1.04       0.0  T
   2    -40.5306298 -0.949439E-06  0.363E-02    1.04       1.0  T
   3    -40.5306260  0.381934E-05  0.139E-02    1.04       1.5  T
   4    -40.5306304 -0.449483E-05  0.205E-03    1.04       9.9  T
   5    -40.5306305 -0.363180E-07  0.142E-03    1.04      14.4  T
   6    -40.5306305 -0.254375E-07  0.608E-04    1.04      33.6  T
   7    -40.5306305 -0.496215E-08  0.214E-04    1.04      95.3  T
     SCC iter.                  ...        0 min,  0.008 sec
     gradient                   ...        0 min,  0.014 sec
 * total energy  :   -39.7082204 Eh     change        0.2314600E-04 Eh
   gradient norm :     0.0044808 Eh/α   predicted    -0.6422848E-05 (-127.75%)
   displ. norm   :     0.0213710 α      lambda       -0.3650548E-04
   maximum displ.:     0.0122951 α      in ANC's #4, #3, #8, ...

........................................................................
.............................. CYCLE   24 ..............................
........................................................................
   1    -40.5301383 -0.405301E+02  0.340E-02    1.04       0.0  T
   2    -40.5301386 -0.315883E-06  0.188E-02    1.04       1.1  T
   3    -40.5301381  0.558332E-06  0.556E-03    1.04       3.7  T
   4    -40.5301388 -0.732724E-06  0.879E-04    1.04      23.2  T
   5    -40.5301388 -0.511474E-08  0.669E-04    1.04      30.5  T
     SCC iter.                  ...        0 min,  0.006 sec
     gradient                   ...        0 min,  0.013 sec
 * total energy  :   -39.7082453 Eh     change       -0.2489243E-04 Eh
   gradient norm :     0.0016822 Eh/α   predicted    -0.1826202E-04 ( -26.64%)
   displ. norm   :     0.0226385 α      lambda       -0.8823406E-05
   maximum displ.:     0.0153526 α      in ANC's #2, #5, #11, ...

........................................................................
.............................. CYCLE   25 ..............................
........................................................................
   1    -40.5296735 -0.405297E+02  0.342E-02    1.05       0.0  T
   2    -40.5296739 -0.325671E-06  0.189E-02    1.05       1.1  T
   3    -40.5296732  0.655284E-06  0.554E-03    1.05       3.7  T
   4    -40.5296740 -0.827721E-06  0.102E-03    1.05      20.0  T
   5    -40.5296740 -0.152333E-07  0.582E-04    1.05      35.1  T
   6    -40.5296740 -0.372539E-08  0.214E-04    1.05      95.6  T
     SCC iter.                  ...        0 min,  0.007 sec
     gradient                   ...        0 min,  0.014 sec
 * total energy  :   -39.7082475 Eh     change       -0.2257803E-05 Eh
   gradient norm :     0.0013021 Eh/α   predicted    -0.4413254E-05 (  95.47%)
   displ. norm   :     0.0287124 α      lambda       -0.6764093E-05
   maximum displ.:     0.0195780 α      in ANC's #1, #6, #9, ...

........................................................................
.............................. CYCLE   26 ..............................
........................................................................
   1    -40.5296485 -0.405296E+02  0.457E-02    1.05       0.0  T
   2    -40.5296492 -0.626468E-06  0.252E-02    1.05       1.0  T
   3    -40.5296487  0.453571E-06  0.550E-03    1.05       3.7  T
   4    -40.5296495 -0.759179E-06  0.919E-04    1.05      22.2  T
   5    -40.5296495 -0.345905E-08  0.677E-04    1.05      30.1  T
     SCC iter.                  ...        0 min,  0.006 sec
     gradient                   ...        0 min,  0.014 sec
 * total energy  :   -39.7082361 Eh     change        0.1137170E-04 Eh
   gradient norm :     0.0020480 Eh/α   predicted    -0.3388273E-05 (-129.80%)
   displ. norm   :     0.0164484 α      lambda       -0.2054627E-04
   maximum displ.:     0.0097804 α      in ANC's #6, #1, #4, ...

........................................................................
.............................. CYCLE   27 ..............................
........................................................................
   1    -40.5299786 -0.405300E+02  0.264E-02    1.05       0.0  T
   2    -40.5299788 -0.208640E-06  0.146E-02    1.05       1.4  T
   3    -40.5299787  0.824192E-07  0.268E-03    1.05       7.6  T
   4    -40.5299789 -0.181528E-06  0.528E-04    1.05      38.7  T
   5    -40.5299789  0.195826E-10  0.428E-04    1.05      47.7  T
     SCC iter.                  ...        0 min,  0.006 sec
     gradient                   ...        0 min,  0.014 sec
 * total energy  :   -39.7082492 Eh     change       -0.1306807E-04 Eh
   gradient norm :     0.0006889 Eh/α   predicted    -0.1027863E-04 ( -21.35%)
   displ. norm   :     0.0145749 α      lambda       -0.3970812E-05
   maximum displ.:     0.0077266 α      in ANC's #2, #6, #5, ...

........................................................................
.............................. CYCLE   28 ..............................
........................................................................
   1    -40.5298152 -0.405298E+02  0.178E-02    1.05       0.0  T
   2    -40.5298152 -0.826574E-07  0.997E-03    1.05       2.0  T
   3    -40.5298151  0.195293E-06  0.360E-03    1.05       5.7  T
   4    -40.5298153 -0.247629E-06  0.444E-04    1.05      46.0  T
   5    -40.5298153  0.170687E-09  0.292E-04    1.05      69.9  T
     SCC iter.                  ...        0 min,  0.006 sec
     gradient                   ...        0 min,  0.014 sec
 * total energy  :   -39.7082503 Eh     change       -0.1055295E-05 Eh
   gradient norm :     0.0005732 Eh/α   predicted    -0.1989657E-05 (  88.54%)
   displ. norm   :     0.0106077 α      lambda       -0.1634689E-05
   maximum displ.:     0.0059898 α      in ANC's #2, #3, #1, ...

   *** GEOMETRY OPTIMIZATION CONVERGED AFTER 28 ITERATIONS ***

------------------------------------------------------------------------
 total energy gain   :        -0.0400758 Eh      -25.1479 kcal/mol
 total RMSD          :         0.6912997 a0        0.3658 Å
 total power (kW/mol):        -3.7578167 (step) -109.0446 (real)
------------------------------------------------------------------------

 ANCopt (total)                0 d,  0 h,  0 min,  0.965 sec
 optimizer setup                ...        0 min,  0.000 sec (  0.012%)
 model hessian                  ...        0 min,  0.007 sec (  0.750%)
 ANC generation                 ...        0 min,  0.001 sec (  0.136%)
 coordinate transformation      ...        0 min,  0.000 sec (  0.051%)
 single point calculation       ...        0 min,  0.944 sec ( 97.796%)
 optimization log               ...        0 min,  0.003 sec (  0.286%)
 hessian update                 ...        0 min,  0.000 sec (  0.037%)
 rational function              ...        0 min,  0.007 sec (  0.756%)

================
 final structure:
================
$coord
    1.87075675860368    0.74823318960798    0.71595290380085      C 
    1.11174005758482   -1.66282703486184    0.50255870132178      C 
   -1.58225609330353   -1.67002838701174   -0.17147897206853      C 
   -2.98669010582797   -3.86597969594094   -0.62871918404013      C 
   -4.11785446714911   -5.68252759322867   -0.98603425569057      N 
   -2.41685642430038    0.75550527162389   -0.27950336377040      C 
   -0.29727540149912    2.40308113125629    0.28399362024007      C 
   -0.23883026218960    4.98081673545564    0.32707710653750      C 
   -2.34786865907436    6.79399618213342    0.06011490628183      C 
   -1.32140098800314    9.09560794646153   -0.40384242602048      C 
    1.42367659176135    8.88725441367378   -0.31294595115784      C 
    2.06144354220068    6.45078147833307    0.22093575894268      C 
    3.08023917014597   10.91566486238475   -0.70654178797910      C 
    4.41780720499947   12.59373428360668   -1.02301106203780      N 
   -5.01377756573191    6.33569201245692    0.44901733199232      C 
   -5.97297937915519    4.69887434511695    2.09700963246241      C 
    3.72521341381439    1.39464747702817    1.21586769438088      H 
    2.21449869391712   -3.34952542311738    0.74313436898838      H 
   -4.27312276819612    1.37397652256768   -0.80444964975745      H 
   -2.31228952623200   10.84117590686907   -0.70670475794781      H 
    3.94089271423600    5.70342933471893    0.35177880868424      H 
   -6.26182083734554    7.57611202929869   -0.59655161959698      H 
   -4.79302463038567    3.52519414190201    3.27023426352152      H 
   -7.98109846092616    4.51314434699161    2.36080399404011      H 
$end
           -------------------------------------------------
          |                Final Singlepoint                |
           -------------------------------------------------

          ...................................................
          :                      SETUP                      :
          :.................................................:
          :  # basis functions                  72          :
          :  # atomic orbitals                  72          :
          :  # shells                           40          :
          :  # electrons                        74          :
          :  max. iterations                   250          :
          :  Hamiltonian                  GFN2-xTB          :
          :  restarted?                      false          :
          :  GBSA solvation                  false          :
          :  PC potential                    false          :
          :  electronic temp.          300.0000000     K    :
          :  accuracy                    1.0000000          :
          :  -> integral cutoff          0.2500000E+02      :
          :  -> integral neglect         0.1000000E-07      :
          :  -> SCF convergence          0.1000000E-05 Eh   :
          :  -> wf. convergence          0.1000000E-03 e    :
          :  Broyden damping             0.4000000          :
          ...................................................

 iter      E             dE          RMSdq      gap      omega  full diag
   1    -40.5298153 -0.405298E+02  0.177E-04    1.05       0.0  T
   2    -40.5298153  0.474273E-09  0.153E-04    1.05     133.6  T
   3    -40.5298153 -0.707971E-09  0.916E-05    1.05     222.7  T

   *** convergence criteria satisfied after 3 iterations ***

         #    Occupation            Energy/Eh            Energy/eV
      -------------------------------------------------------------
         1        2.0000           -0.6912113             -18.8088
       ...           ...                  ...                  ...
        31        2.0000           -0.4553340             -12.3903
        32        2.0000           -0.4450066             -12.1092
        33        2.0000           -0.4343323             -11.8188
        34        2.0000           -0.4325220             -11.7695
        35        2.0000           -0.4315579             -11.7433
        36        2.0000           -0.4137381             -11.2584
        37        2.0000           -0.3996348             -10.8746 (HOMO)
        38                         -0.3611699              -9.8279 (LUMO)
        39                         -0.2678051              -7.2873
        40                         -0.2575380              -7.0080
        41                         -0.2395996              -6.5198
        42                         -0.2203518              -5.9961
       ...                                ...                  ...
        72                          1.1729005              31.9162
      -------------------------------------------------------------
                  HL-Gap            0.0384649 Eh            1.0467 eV
             Fermi-level           -0.3804024 Eh          -10.3513 eV

 SCC (total)                   0 d,  0 h,  0 min,  0.030 sec
 SCC setup                      ...        0 min,  0.000 sec (  0.774%)
 Dispersion                     ...        0 min,  0.000 sec (  0.837%)
 integral evaluation            ...        0 min,  0.011 sec ( 35.189%)
 zeroth order Hamiltonian       ...        0 min,  0.000 sec (  0.532%)
 iterations                     ...        0 min,  0.004 sec ( 14.083%)
 molecular gradient             ...        0 min,  0.014 sec ( 47.206%)
 printout                       ...        0 min,  0.000 sec (  1.218%)

         :::::::::::::::::::::::::::::::::::::::::::::::::::::
         ::                     SUMMARY                     ::
         :::::::::::::::::::::::::::::::::::::::::::::::::::::
         :: total energy             -39.708250253285 Eh    ::
         :: gradient norm              0.000573058850 Eh/a0 ::
         :: HOMO-LUMO gap              1.046683688230 eV    ::
         ::.................................................::
         :: SCC energy               -40.529815298642 Eh    ::
         :: -> isotropic ES            0.017197192107 Eh    ::
         :: -> anisotropic ES          0.003295742229 Eh    ::
         :: -> anisotropic XC          0.052695193928 Eh    ::
         :: -> dispersion             -0.025787700549 Eh    ::
         :: repulsion energy           0.821553038487 Eh    ::
         :: add. restraining           0.000000000000 Eh    ::
         :::::::::::::::::::::::::::::::::::::::::::::::::::::

           -------------------------------------------------
          |                Property Printout                |
           -------------------------------------------------

    * Orbital Energies and Occupations

         #    Occupation            Energy/Eh            Energy/eV
      -------------------------------------------------------------
         1        2.0000           -0.6912113             -18.8088
       ...           ...                  ...                  ...
        25        2.0000           -0.4961018             -13.4996
        26        2.0000           -0.4850586             -13.1991
        27        2.0000           -0.4829197             -13.1409
        28        2.0000           -0.4763753             -12.9628
        29        2.0000           -0.4705327             -12.8038
        30        2.0000           -0.4670954             -12.7103
        31        2.0000           -0.4553340             -12.3903
        32        2.0000           -0.4450066             -12.1092
        33        2.0000           -0.4343323             -11.8188
        34        2.0000           -0.4325220             -11.7695
        35        2.0000           -0.4315579             -11.7433
        36        2.0000           -0.4137381             -11.2584
        37        2.0000           -0.3996348             -10.8746 (HOMO)
        38                         -0.3611699              -9.8279 (LUMO)
        39                         -0.2678051              -7.2873
        40                         -0.2575380              -7.0080
        41                         -0.2395996              -6.5198
        42                         -0.2203518              -5.9961
        43                         -0.2189131              -5.9569
        44                         -0.1946765              -5.2974
        45                         -0.1376812              -3.7465
        46                         -0.1230470              -3.3483
        47                         -0.1198971              -3.2626
        48                          0.0384457               1.0462
       ...                                ...                  ...
        72                          1.1729005              31.9162
      -------------------------------------------------------------
                  HL-Gap            0.0384649 Eh            1.0467 eV
             Fermi-level           -0.3804024 Eh          -10.3513 eV

     #   Z        covCN         q      C6AA      α(0)
     1   6 C      2.996    -0.046    29.130     8.854
     2   6 C      3.009    -0.022    28.544     8.764
     3   6 C      3.080     0.022    27.435     8.587
     4   6 C      1.899     0.115    28.282     8.589
     5   7 N      0.911    -0.223    25.881     7.358
     6   6 C      2.988    -0.037    28.916     8.821
     7   6 C      3.085     0.038    27.060     8.527
     8   6 C      3.081     0.034    27.149     8.542
     9   6 C      3.040     0.004    27.893     8.662
    10   6 C      3.015    -0.038    28.914     8.820
    11   6 C      3.073     0.025    27.368     8.577
    12   6 C      2.989    -0.041    29.005     8.834
    13   6 C      1.899     0.115    28.265     8.586
    14   7 N      0.911    -0.221    25.814     7.348
    15   6 C      2.891    -0.024    28.606     8.769
    16   6 C      2.839    -0.080    30.003     8.977
    17   1 H      0.926     0.046     2.376     2.410
    18   1 H      0.926     0.047     2.353     2.399
    19   1 H      0.926     0.053     2.286     2.364
    20   1 H      0.926     0.044     2.394     2.419
    21   1 H      0.926     0.049     2.337     2.391
    22   1 H      0.925     0.047     2.360     2.402
    23   1 H      0.926     0.047     2.359     2.402
    24   1 H      0.926     0.047     2.351     2.398

 Mol. C6AA /au·bohr⁶  :       9385.109905
 Mol. C8AA /au·bohr⁸  :     240884.810398
 Mol. α(0) /au        :        155.801678


Wiberg/Mayer (AO) data.
largest (>0.10) Wiberg bond orders for each atom
          total WBO             WBO to atom ...
     1  C   3.984        C    2 1.775    C    7 1.093    H   17 0.968
     2  C   3.945        C    1 1.775    C    3 1.045    H   18 0.972
     3  C   3.948        C    6 1.623    C    4 1.126    C    2 1.045
     4  C   3.949        N    5 2.777    C    3 1.126
     5  N   2.968        C    4 2.777    C    6 0.113
     6  C   3.985        C    3 1.623    C    7 1.119    H   19 0.966    N    5 0.113
     7  C   3.959        C    8 1.535    C    6 1.119    C    1 1.093
     8  C   3.958        C    7 1.535    C   12 1.142    C    9 1.046
     9  C   3.983        C   10 1.665    C   15 1.108    C    8 1.046
    10  C   3.959        C    9 1.665    C   11 1.076    H   20 0.972    C   16 0.103
    11  C   3.938        C   12 1.583    C   13 1.122    C   10 1.076
    12  C   3.984        C   11 1.583    C    8 1.142    H   21 0.969    N   14 0.105
    13  C   3.948        N   14 2.780    C   11 1.122
    14  N   2.965        C   13 2.780    C   12 0.105
    15  C   3.987        C   16 1.874    C    9 1.108    H   22 0.958
    16  C   3.988        C   15 1.874    H   24 0.977    H   23 0.974    C   10 0.103
    17  H   0.996        C    1 0.968
    18  H   0.997        C    2 0.972
    19  H   0.997        C    6 0.966
    20  H   0.997        C   10 0.972
    21  H   0.997        C   12 0.969
    22  H   0.997        C   15 0.958
    23  H   0.998        C   16 0.974
    24  H   0.997        C   16 0.977

molecular dipole:
                 x           y           z       tot (Debye)
 q only:       -0.281       0.090       0.367
   full:       -0.297       0.137       0.491       1.498
molecular quadrupole (traceless):
                xx          xy          yy          xz          yz          zz
 q only:        8.371     -21.352     -18.863       0.176       1.069      10.492
  q+dip:       12.712     -31.282     -24.414       1.155      -0.254      11.702
   full:       11.103     -33.401     -28.510       0.496       0.955      17.407

           -------------------------------------------------
          |                Geometry Summary                 |
           -------------------------------------------------

      molecular mass/u    :      204.2306000
   center of mass at/Å    :       -0.4232878       2.0408216       0.0093469
  moments of inertia/u·Å² :        0.4226700E+03   0.1755382E+04   0.2114718E+04
rotational constants/cm⁻¹ :        0.3988368E-01   0.9603399E-02   0.7971575E-02

 * 16 selected distances

     #   Z        #   Z                                     value/Å
     1   6 C      2   6 C                                 1.3423648
     4   6 C      5   7 N                                 1.1480894
     3   6 C      6   6 C                                 1.3585992
     7   6 C      8   6 C                                 1.3646201 (max)
     9   6 C     10   6 C                                 1.3560067
    11   6 C     12   6 C                                 1.3623799
    13   6 C     14   7 N                                 1.1478583
    15   6 C     16   6 C                                 1.3298172
     1   6 C     17   1 H                                 1.0723873
     2   6 C     18   1 H                                 1.0739697
     6   6 C     19   1 H                                 1.0719987 (min)
    10   6 C     20   1 H                                 1.0741898
    12   6 C     21   1 H                                 1.0725451
    15   6 C     22   1 H                                 1.0831301
    16   6 C     23   1 H                                 1.0775321
    16   6 C     24   1 H                                 1.0762775

 * 3 distinct bonds (by element types)

   Z      Z             #   av. dist./Å        max./Å        min./Å
   1 H    6 C           8     1.0752538     1.0831301     1.0719987
   6 C    6 C           6     1.3522980     1.3646201     1.3298172
   6 C    7 N           2     1.1479739     1.1480894     1.1478583


optimized geometry written to: xtbopt.xyz


           -------------------------------------------------
          | TOTAL ENERGY              -39.708250253285 Eh   |
          | GRADIENT NORM               0.000573058850 Eh/α |
          | HOMO-LUMO GAP               1.046683688230 eV   |
           -------------------------------------------------

------------------------------------------------------------------------
 * finished run on 2021/05/19 at 10:58:49.798     
------------------------------------------------------------------------
 total:
 * wall-time:     0 d,  0 h,  0 min,  1.061 sec
 *  cpu-time:     0 d,  0 h,  0 min,  1.010 sec
 * ratio c/w:     0.952 speedup
 SCF:
 * wall-time:     0 d,  0 h,  0 min,  0.043 sec
 *  cpu-time:     0 d,  0 h,  0 min,  0.043 sec
 * ratio c/w:     1.000 speedup
 ANC optimizer:
 * wall-time:     0 d,  0 h,  0 min,  0.995 sec
 *  cpu-time:     0 d,  0 h,  0 min,  0.945 sec
 * ratio c/w:     0.950 speedup

