      -----------------------------------------------------------      
     |                   =====================                   |     
     |                           x T B                           |     
     |                   =====================                   |     
     |                         S. Grimme                         |     
     |          Mulliken Center for Theoretical Chemistry        |     
     |                    University of Bonn                     |     
     |                Version 6.2 RC2 (SAW190805)                |     
      -----------------------------------------------------------      

   This program is distributed in the hope that it will be useful,
   but WITHOUT ANY WARRANTY; without even the implied warranty of
   MERCHANTABILITY or FITNESS FOR A PARTICULAR PURPOSE.
   
   FOR NON-COMMERCIAL, ACADEMIA USE ONLY.
   
   Cite this work as:
   * S. Grimme, C. Bannwarth, P. Shushkov, J. Chem. Theory Comput., 2017,
     13, 1989-2009. DOI: 10.1021/acs.jctc.7b00118
   * C. Bannwarth, S. Ehlert and S. Grimme., J. Chem. Theory Comput., 2019,
     15, 1652-1671. DOI: 10.1021/acs.jctc.8b01176
   * P. Pracht, E. Caldeweyher, S. Ehlert, S. Grimme, ChemRxiv, 2019, preprint.
     DOI: 10.26434/chemrxiv.8326202.v1
   
   for DFT-D4:
   * E. Caldeweyher, C. Bannwarth and S. Grimme, J. Chem. Phys., 2017,
     147, 034112. DOI: 10.1063/1.4993215
   * E. Caldeweyher, S. Ehlert, A. Hansen, H. Neugebauer, S. Spicher,
     C. Bannwarth and S. Grimme, J. Chem. Phys., 2019, 150, 154122.
     DOI: 10.1063/1.5090222
   
   for sTDA-xTB:
   * S. Grimme and C. Bannwarth, J. Chem. Phys., 2016, 145, 054103.
     DOI: 10.1063/1.4959605
   
   in the mass-spec context:
   * V. Asgeirsson, C. Bauer and S. Grimme, Chem. Sci., 2017, 8, 4879.
     DOI: 10.1039/c7sc00601b
   
   for metadynamics refer to:
   * S. Grimme, J. Chem. Theory Comput., 2019, 155, 2847-2862
     DOI: 10.1021/acs.jctc.9b00143
   
   with help from (in alphabetical order)
   C. Bannwarth, F. Bohle, G. Brandenburg, E. Caldeweyher, M. Checinski,
   S. Dohm, S. Ehlert, S. Ehrlich, F. März, H. Neugebauer, J. Pisarek,
   P. Pracht, P. Shushkov, and S. Spicher.
   
 * started run on 2021/05/19 at 10:58:51.057     

           -------------------------------------------------
          |                Calculation Setup                |
           -------------------------------------------------

          program call               : /ihome/ghutchison/geoffh/xtb/xtb 212.xyz -opt
          hostname                   : smp-n83
          coordinate file            : 212.xyz
          omp threads                :                     1
          number of atoms            :                    26
          number of electrons        :                    62
          charge                     :                     0
          spin                       :                   0.0
          first test random number   :      0.95381325812737


########################################################################
# WARNING! Please study the warnings concerning your input carefully
#  - the use of '-opt' is discouraged, please use '--opt' next time
########################################################################

           ------------------------------------------------- 
          |                 G F N 2 - x T B                 |
          | Geometry, Frequencies, Noncovalent interactions |
          |            JCTC 2019 parametrisation            |
           ------------------------------------------------- 
             KAB for C  - Si     :                1.0500
             KAB for H  - Pd     :                0.9500
             k(s)              :                1.8500
             k(p)              :                2.2300
             k(d)              :                2.2300
             k(f)              :                2.0000
             kEN (H0ij)        :               -2.0000
             D4 a1             :                0.5200
             D4 a2             :                5.0000
             D4 s6             :                1.0000
             D4 s8             :                2.7000
             D4 s9             :                5.0000
             alphaj            :                2.0000

  Z AO/shell   Hii/eV     exponent
  1     Wed Apr 25 08:07:45 CEST 2018   EN: 2.200 GM2: 0.406  GM3: 0.0800  RAES: 1.40
     1s    -10.707211    1.230000
  6     Wed Apr 25 08:07:45 CEST 2018   EN: 2.550 GM2: 0.538  GM3: 0.1500  RAES: 3.00
     2s    -13.970922    2.096432
     2p    -10.063292    1.800000

           ------------------------------------------------- 
          |        Self-Consistent Charge Iterations        |
           ------------------------------------------------- 

          ...................................................
          :                      SETUP                      :
          :.................................................:
          :  # basis functions                  62          :
          :  # atomic orbitals                  62          :
          :  # shells                           38          :
          :  # electrons                        62          :
          :  max. iterations                   250          :
          :  Hamiltonian                  GFN2-xTB          :
          :  restarted?                      false          :
          :  GBSA solvation                  false          :
          :  PC potential                    false          :
          :  electronic temp.          300.0000000     K    :
          :  accuracy                    1.0000000          :
          :  -> integral cutoff          0.2500000E+02      :
          :  -> integral neglect         0.1000000E-07      :
          :  -> SCF convergence          0.1000000E-05 Eh   :
          :  -> wf. convergence          0.1000000E-03 e    :
          :  Broyden damping             0.4000000          :
          ...................................................

 iter      E             dE          RMSdq      gap      omega  full diag
   1    -33.2584009 -0.332584E+02  0.337E+00    4.21       0.0  T
   2    -33.2946318 -0.362309E-01  0.202E+00    4.14       1.0  T
   3    -33.2861991  0.843271E-02  0.914E-01    4.08       1.0  T
   4    -33.2939812 -0.778209E-02  0.470E-01    4.09       1.0  T
   5    -33.2979638 -0.398257E-02  0.735E-02    4.09       1.0  T
   6    -33.2980001 -0.363327E-04  0.432E-02    4.09       1.0  T
   7    -33.2980126 -0.125154E-04  0.264E-02    4.09       1.0  T
   8    -33.2980206 -0.796778E-05  0.248E-03    4.09       7.9  T
   9    -33.2980206 -0.611245E-07  0.104E-03    4.09      18.8  T
  10    -33.2980206 -0.130743E-08  0.363E-04    4.09      54.0  T
  11    -33.2980206 -0.132475E-08  0.199E-04    4.09      98.5  T

   *** convergence criteria satisfied after 11 iterations ***

         #    Occupation            Energy/Eh            Energy/eV
      -------------------------------------------------------------
         1        2.0000           -0.6474627             -17.6184
       ...           ...                  ...                  ...
        25        2.0000           -0.4322449             -11.7620
        26        2.0000           -0.4294997             -11.6873
        27        2.0000           -0.4205121             -11.4427
        28        2.0000           -0.4125184             -11.2252
        29        2.0000           -0.3890042             -10.5853
        30        2.0000           -0.3790008             -10.3131
        31        2.0000           -0.3654818              -9.9453 (HOMO)
        32                         -0.2152256              -5.8566 (LUMO)
        33                         -0.2016563              -5.4873
        34                         -0.1933028              -5.2600
        35                          0.0267457               0.7278
        36                          0.0402663               1.0957
       ...                                ...                  ...
        62                          0.6529521              17.7677
      -------------------------------------------------------------
                  HL-Gap            0.1502562 Eh            4.0887 eV
             Fermi-level           -0.2903537 Eh           -7.9009 eV

 SCC (total)                   0 d,  0 h,  0 min,  0.034 sec
 SCC setup                      ...        0 min,  0.000 sec (  0.885%)
 Dispersion                     ...        0 min,  0.000 sec (  1.146%)
 integral evaluation            ...        0 min,  0.007 sec ( 21.791%)
 zeroth order Hamiltonian       ...        0 min,  0.000 sec (  0.475%)
 iterations                     ...        0 min,  0.012 sec ( 35.953%)
 molecular gradient             ...        0 min,  0.013 sec ( 38.506%)
 printout                       ...        0 min,  0.000 sec (  1.099%)

         :::::::::::::::::::::::::::::::::::::::::::::::::::::
         ::                     SUMMARY                     ::
         :::::::::::::::::::::::::::::::::::::::::::::::::::::
         :: total energy             -32.756850407464 Eh    ::
         :: gradient norm              0.084202029933 Eh/a0 ::
         :: HOMO-LUMO gap              4.088679254803 eV    ::
         ::.................................................::
         :: SCC energy               -33.298020647753 Eh    ::
         :: -> isotropic ES            0.003544350458 Eh    ::
         :: -> anisotropic ES          0.006697777768 Eh    ::
         :: -> anisotropic XC          0.021835045359 Eh    ::
         :: -> dispersion             -0.025535206372 Eh    ::
         :: repulsion energy           0.540888307679 Eh    ::
         :: add. restraining           0.000000000000 Eh    ::
         :::::::::::::::::::::::::::::::::::::::::::::::::::::

      ----------------------------------------------------------- 
     |                   =====================                   |
     |                        A N C O P T                        |
     |                   =====================                   |
     |               Approximate Normal Coordinate               |
     |                Rational Function Optimizer                |
      ----------------------------------------------------------- 

          ...................................................
          :                      SETUP                      :
          :.................................................:
          :   optimization level            normal          :
          :   max. optcycles                   200          :
          :   ANC micro-cycles                  20          :
          :   degrees of freedom                72          :
          :.................................................:
          :   RF solver                   davidson          :
          :   input Hessian                  false          :
          :   write xtbopt.log                true          :
          :   linear?                        false          :
          :   energy convergence         0.5000000E-05 Eh   :
          :   grad. convergence          0.1000000E-02 Eh/α :
          :   maximium RF displ.         2.0000000          :
          :   Hlow (freq-cutoff)         0.5000000E-02      :
          :   Hmax (freq-cutoff)         5.0000000          :
          :   S6 in model hess.         20.0000000          :
          ...................................................

generating ANC from model Hessian ...
Using Lindh-Hessian (1995)
 Shifting diagonal of input Hessian by   2.693677524105600E-003
 Lowest  eigenvalues of input Hessian
   -0.000000   -0.000000   -0.000000   -0.000000    0.000000    0.000000
    0.005000    0.005666    0.006783    0.009996    0.010860    0.012331
    0.017702    0.019322    0.024116    0.027867    0.033092    0.040008
 Highest eigenvalues
    1.375335    1.522532    1.541912    1.783787    1.841339    1.906723
 

........................................................................
.............................. CYCLE    1 ..............................
........................................................................
   1    -33.2980206 -0.332980E+02  0.657E-05    4.09       0.0  T
   2    -33.2980206 -0.532907E-11  0.456E-05    4.09     429.8  T
   3    -33.2980206 -0.240377E-10  0.264E-05    4.09     743.4  T
     SCC iter.                  ...        0 min,  0.004 sec
     gradient                   ...        0 min,  0.013 sec
 * total energy  :   -32.7568504 Eh     change       -0.1893099E-08 Eh
   gradient norm :     0.0842020 Eh/α   predicted     0.0000000E+00 (-100.00%)
   displ. norm   :     0.6109802 α      lambda       -0.2353478E-01
   maximum displ.:     0.4767739 α      in ANC's #8, #7, #13, ...

........................................................................
.............................. CYCLE    2 ..............................
........................................................................
   1    -33.3204202 -0.333204E+02  0.336E-01    4.50       0.0  T
   2    -33.3204850 -0.647688E-04  0.199E-01    4.49       1.0  T
   3    -33.3203116  0.173316E-03  0.939E-02    4.49       1.0  T
   4    -33.3205014 -0.189721E-03  0.191E-02    4.49       1.0  T
   5    -33.3205091 -0.774555E-05  0.387E-03    4.49       5.1  T
   6    -33.3205092 -0.535406E-07  0.232E-03    4.49       8.5  T
   7    -33.3205092 -0.289396E-07  0.119E-03    4.49      16.5  T
     SCC iter.                  ...        0 min,  0.007 sec
     gradient                   ...        0 min,  0.012 sec
 * total energy  :   -32.7735137 Eh     change       -0.1666325E-01 Eh
   gradient norm :     0.0380179 Eh/α   predicted    -0.1616012E-01 (  -3.02%)
   displ. norm   :     0.5010268 α      lambda       -0.9180655E-02
   maximum displ.:     0.4090427 α      in ANC's #8, #7, #13, ...

........................................................................
.............................. CYCLE    3 ..............................
........................................................................
   1    -33.3310112 -0.333310E+02  0.253E-01    4.72       0.0  T
   2    -33.3310535 -0.422963E-04  0.150E-01    4.71       1.0  T
   3    -33.3309275  0.125963E-03  0.834E-02    4.71       1.0  T
   4    -33.3310717 -0.144181E-03  0.125E-02    4.71       1.6  T
   5    -33.3310751 -0.340885E-05  0.256E-03    4.71       7.7  T
   6    -33.3310751 -0.306196E-07  0.146E-03    4.71      13.5  T
     SCC iter.                  ...        0 min,  0.006 sec
     gradient                   ...        0 min,  0.012 sec
 * total energy  :   -32.7794384 Eh     change       -0.5924710E-02 Eh
   gradient norm :     0.0301512 Eh/α   predicted    -0.5742633E-02 (  -3.07%)
   displ. norm   :     0.3793923 α      lambda       -0.3705136E-02
   maximum displ.:     0.2446373 α      in ANC's #8, #2, #4, ...

........................................................................
.............................. CYCLE    4 ..............................
........................................................................
   1    -33.3351381 -0.333351E+02  0.212E-01    4.76       0.0  T
   2    -33.3351432 -0.505610E-05  0.126E-01    4.76       1.0  T
   3    -33.3351021  0.410964E-04  0.434E-02    4.76       1.0  T
   4    -33.3351474 -0.453221E-04  0.525E-03    4.76       3.7  T
   5    -33.3351477 -0.331982E-06  0.231E-03    4.76       8.5  T
   6    -33.3351477 -0.250399E-08  0.799E-04    4.76      24.5  T
     SCC iter.                  ...        0 min,  0.006 sec
     gradient                   ...        0 min,  0.012 sec
 * total energy  :   -32.7819848 Eh     change       -0.2546465E-02 Eh
   gradient norm :     0.0222868 Eh/α   predicted    -0.2119230E-02 ( -16.78%)
   displ. norm   :     0.4079397 α      lambda       -0.2762103E-02
   maximum displ.:     0.2337668 α      in ANC's #8, #2, #4, ...

........................................................................
.............................. CYCLE    5 ..............................
........................................................................
   1    -33.3385378 -0.333385E+02  0.236E-01    4.77       0.0  T
   2    -33.3385439 -0.610140E-05  0.140E-01    4.78       1.0  T
   3    -33.3385427  0.119300E-05  0.118E-02    4.77       1.7  T
   4    -33.3385445 -0.181061E-05  0.641E-03    4.77       3.1  T
   5    -33.3385452 -0.696503E-06  0.203E-03    4.77       9.7  T
   6    -33.3385453 -0.111733E-07  0.739E-04    4.77      26.5  T
     SCC iter.                  ...        0 min,  0.006 sec
     gradient                   ...        0 min,  0.012 sec
 * total energy  :   -32.7835450 Eh     change       -0.1560185E-02 Eh
   gradient norm :     0.0159008 Eh/α   predicted    -0.1610881E-02 (   3.25%)
   displ. norm   :     0.3223684 α      lambda       -0.1275413E-02
   maximum displ.:     0.1514783 α      in ANC's #1, #3, #4, ...

........................................................................
.............................. CYCLE    6 ..............................
........................................................................
   1    -33.3392688 -0.333393E+02  0.156E-01    4.79       0.0  T
   2    -33.3392717 -0.295003E-05  0.925E-02    4.79       1.0  T
   3    -33.3392449  0.268185E-04  0.353E-02    4.79       1.0  T
   4    -33.3392746 -0.296963E-04  0.330E-03    4.79       5.9  T
   5    -33.3392747 -0.128851E-06  0.153E-03    4.79      12.8  T
   6    -33.3392747  0.323865E-09  0.772E-04    4.79      25.4  T
     SCC iter.                  ...        0 min,  0.006 sec
     gradient                   ...        0 min,  0.012 sec
 * total energy  :   -32.7843391 Eh     change       -0.7940427E-03 Eh
   gradient norm :     0.0099863 Eh/α   predicted    -0.7039787E-03 ( -11.34%)
   displ. norm   :     0.2618548 α      lambda       -0.5956044E-03
   maximum displ.:     0.1772850 α      in ANC's #1, #2, #3, ...

........................................................................
.............................. CYCLE    7 ..............................
........................................................................
   1    -33.3427109 -0.333427E+02  0.124E-01    4.79       0.0  T
   2    -33.3427140 -0.312723E-05  0.732E-02    4.80       1.0  T
   3    -33.3427090  0.503270E-05  0.154E-02    4.79       1.3  T
   4    -33.3427145 -0.551750E-05  0.429E-03    4.80       4.6  T
   5    -33.3427148 -0.299532E-06  0.125E-03    4.80      15.7  T
   6    -33.3427148 -0.219700E-08  0.593E-04    4.80      33.0  T
     SCC iter.                  ...        0 min,  0.006 sec
     gradient                   ...        0 min,  0.012 sec
 * total energy  :   -32.7847014 Eh     change       -0.3623098E-03 Eh
   gradient norm :     0.0098975 Eh/α   predicted    -0.3182243E-03 ( -12.17%)
   displ. norm   :     0.3838478 α      lambda       -0.7408821E-03
   maximum displ.:     0.2215414 α      in ANC's #1, #2, #4, ...

........................................................................
.............................. CYCLE    8 ..............................
........................................................................
   1    -33.3442993 -0.333443E+02  0.188E-01    4.80       0.0  T
   2    -33.3443020 -0.261764E-05  0.111E-01    4.80       1.0  T
   3    -33.3442744  0.276054E-04  0.369E-02    4.80       1.0  T
   4    -33.3443051 -0.307047E-04  0.318E-03    4.80       6.2  T
   5    -33.3443051 -0.474134E-07  0.184E-03    4.80      10.7  T
   6    -33.3443051 -0.831548E-10  0.862E-04    4.80      22.7  T
     SCC iter.                  ...        0 min,  0.006 sec
     gradient                   ...        0 min,  0.012 sec
 * total energy  :   -32.7850312 Eh     change       -0.3297970E-03 Eh
   gradient norm :     0.0167583 Eh/α   predicted    -0.4250234E-03 (  28.87%)
   displ. norm   :     0.2759284 α      lambda       -0.5951010E-03
   maximum displ.:     0.1763659 α      in ANC's #1, #2, #3, ...

........................................................................
.............................. CYCLE    9 ..............................
........................................................................
   1    -33.3414085 -0.333414E+02  0.132E-01    4.80       0.0  T
   2    -33.3414106 -0.205338E-05  0.779E-02    4.80       1.0  T
   3    -33.3413993  0.112683E-04  0.230E-02    4.80       1.0  T
   4    -33.3414118 -0.125004E-04  0.262E-03    4.80       7.5  T
   5    -33.3414119 -0.670006E-07  0.128E-03    4.80      15.3  T
   6    -33.3414119 -0.137589E-09  0.700E-04    4.80      28.0  T
     SCC iter.                  ...        0 min,  0.006 sec
     gradient                   ...        0 min,  0.012 sec
 * total energy  :   -32.7854372 Eh     change       -0.4060095E-03 Eh
   gradient norm :     0.0073711 Eh/α   predicted    -0.3202062E-03 ( -21.13%)
   displ. norm   :     0.2931146 α      lambda       -0.6121683E-03
   maximum displ.:     0.2055703 α      in ANC's #2, #1, #8, ...

........................................................................
.............................. CYCLE   10 ..............................
........................................................................
   1    -33.3433048 -0.333433E+02  0.143E-01    4.81       0.0  T
   2    -33.3433059 -0.102216E-05  0.846E-02    4.81       1.0  T
   3    -33.3432887  0.171620E-04  0.278E-02    4.81       1.0  T
   4    -33.3433076 -0.188934E-04  0.206E-03    4.81       9.5  T
   5    -33.3433076 -0.219161E-07  0.116E-03    4.81      16.9  T
   6    -33.3433076 -0.443535E-09  0.497E-04    4.81      39.5  T
     SCC iter.                  ...        0 min,  0.006 sec
     gradient                   ...        0 min,  0.012 sec
 * total energy  :   -32.7858739 Eh     change       -0.4367452E-03 Eh
   gradient norm :     0.0073970 Eh/α   predicted    -0.3323945E-03 ( -23.89%)
   displ. norm   :     0.3926800 α      lambda       -0.5089418E-03
   maximum displ.:     0.2824080 α      in ANC's #2, #1, #3, ...

........................................................................
.............................. CYCLE   11 ..............................
........................................................................
   1    -33.3410085 -0.333410E+02  0.183E-01    4.81       0.0  T
   2    -33.3410099 -0.134245E-05  0.108E-01    4.81       1.0  T
   3    -33.3409926  0.172896E-04  0.275E-02    4.81       1.0  T
   4    -33.3410116 -0.190148E-04  0.220E-03    4.81       8.9  T
   5    -33.3410116 -0.292898E-07  0.118E-03    4.81      16.6  T
   6    -33.3410116 -0.192578E-08  0.441E-04    4.81      44.4  T
     SCC iter.                  ...        0 min,  0.006 sec
     gradient                   ...        0 min,  0.012 sec
 * total energy  :   -32.7863020 Eh     change       -0.4281070E-03 Eh
   gradient norm :     0.0096849 Eh/α   predicted    -0.2937113E-03 ( -31.39%)
   displ. norm   :     0.4733506 α      lambda       -0.6379741E-03
   maximum displ.:     0.3507420 α      in ANC's #2, #1, #3, ...

........................................................................
.............................. CYCLE   12 ..............................
........................................................................
   1    -33.3410947 -0.333411E+02  0.215E-01    4.82       0.0  T
   2    -33.3410968 -0.202897E-05  0.127E-01    4.82       1.0  T
   3    -33.3410924  0.433075E-05  0.145E-02    4.82       1.3  T
   4    -33.3410975 -0.509193E-05  0.313E-03    4.82       6.3  T
   5    -33.3410977 -0.131842E-06  0.133E-03    4.82      14.8  T
   6    -33.3410977  0.109395E-08  0.555E-04    4.82      35.3  T
     SCC iter.                  ...        0 min,  0.006 sec
     gradient                   ...        0 min,  0.012 sec
 * total energy  :   -32.7868484 Eh     change       -0.5463666E-03 Eh
   gradient norm :     0.0115776 Eh/α   predicted    -0.3904645E-03 ( -28.53%)
   displ. norm   :     0.5818981 α      lambda       -0.7930808E-03
   maximum displ.:     0.4423584 α      in ANC's #2, #1, #3, ...

........................................................................
.............................. CYCLE   13 ..............................
........................................................................
   1    -33.3402823 -0.333403E+02  0.258E-01    4.83       0.0  T
   2    -33.3402843 -0.207461E-05  0.152E-01    4.83       1.0  T
   3    -33.3402809  0.337508E-05  0.137E-02    4.83       1.4  T
   4    -33.3402854 -0.441411E-05  0.325E-03    4.83       6.0  T
   5    -33.3402854 -0.777607E-07  0.160E-03    4.83      12.3  T
   6    -33.3402854 -0.807397E-09  0.584E-04    4.83      33.6  T
     SCC iter.                  ...        0 min,  0.006 sec
     gradient                   ...        0 min,  0.012 sec
 * total energy  :   -32.7875214 Eh     change       -0.6730518E-03 Eh
   gradient norm :     0.0108206 Eh/α   predicted    -0.5308132E-03 ( -21.13%)
   displ. norm   :     0.6435076 α      lambda       -0.9423660E-03
   maximum displ.:     0.4900307 α      in ANC's #2, #1, #4, ...

........................................................................
.............................. CYCLE   14 ..............................
........................................................................
   1    -33.3416439 -0.333416E+02  0.290E-01    4.84       0.0  T
   2    -33.3416469 -0.299060E-05  0.171E-01    4.84       1.0  T
   3    -33.3416454  0.156275E-05  0.113E-02    4.84       1.7  T
   4    -33.3416480 -0.260765E-05  0.391E-03    4.84       5.0  T
   5    -33.3416481 -0.167486E-06  0.199E-03    4.84       9.9  T
   6    -33.3416481 -0.926490E-08  0.421E-04    4.84      46.6  T
     SCC iter.                  ...        0 min,  0.007 sec
     gradient                   ...        0 min,  0.012 sec
 * total energy  :   -32.7882690 Eh     change       -0.7475826E-03 Eh
   gradient norm :     0.0095056 Eh/α   predicted    -0.6663020E-03 ( -10.87%)
   displ. norm   :     0.5800253 α      lambda       -0.8746371E-03
   maximum displ.:     0.4264318 α      in ANC's #2, #1, #5, ...

........................................................................
.............................. CYCLE   15 ..............................
........................................................................
   1    -33.3446230 -0.333446E+02  0.266E-01    4.85       0.0  T
   2    -33.3446254 -0.237709E-05  0.157E-01    4.84       1.0  T
   3    -33.3446240  0.141193E-05  0.107E-02    4.84       1.8  T
   4    -33.3446263 -0.226919E-05  0.352E-03    4.84       5.6  T
   5    -33.3446264 -0.115525E-06  0.170E-03    4.84      11.6  T
   6    -33.3446264 -0.697867E-08  0.462E-04    4.84      42.5  T
     SCC iter.                  ...        0 min,  0.006 sec
     gradient                   ...        0 min,  0.013 sec
 * total energy  :   -32.7888552 Eh     change       -0.5861185E-03 Eh
   gradient norm :     0.0120972 Eh/α   predicted    -0.5844500E-03 (  -0.28%)
   displ. norm   :     0.4941360 α      lambda       -0.8183977E-03
   maximum displ.:     0.3409834 α      in ANC's #2, #1, #4, ...

........................................................................
.............................. CYCLE   16 ..............................
........................................................................
   1    -33.3465337 -0.333465E+02  0.222E-01    4.84       0.0  T
   2    -33.3465370 -0.328413E-05  0.131E-01    4.84       1.0  T
   3    -33.3465271  0.990076E-05  0.221E-02    4.84       1.0  T
   4    -33.3465385 -0.114223E-04  0.392E-03    4.84       5.0  T
   5    -33.3465386 -0.125623E-06  0.175E-03    4.84      11.2  T
   6    -33.3465386 -0.698407E-09  0.705E-04    4.84      27.8  T
     SCC iter.                  ...        0 min,  0.006 sec
     gradient                   ...        0 min,  0.012 sec
 * total energy  :   -32.7893146 Eh     change       -0.4594838E-03 Eh
   gradient norm :     0.0103931 Eh/α   predicted    -0.5091154E-03 (  10.80%)
   displ. norm   :     0.5364480 α      lambda       -0.5098559E-03
   maximum displ.:     0.3492520 α      in ANC's #2, #1, #5, ...

........................................................................
.............................. CYCLE   17 ..............................
........................................................................
   1    -33.3357015 -0.333357E+02  0.244E-01    4.80       0.0  T
   2    -33.3357086 -0.712189E-05  0.144E-01    4.80       1.0  T
   3    -33.3357021  0.646459E-05  0.186E-02    4.80       1.1  T
   4    -33.3357092 -0.707475E-05  0.655E-03    4.80       3.0  T
   5    -33.3357100 -0.842020E-06  0.181E-03    4.80      10.8  T
   6    -33.3357100 -0.129191E-08  0.763E-04    4.80      25.7  T
     SCC iter.                  ...        0 min,  0.007 sec
     gradient                   ...        0 min,  0.013 sec
 * total energy  :   -32.7892870 Eh     change        0.2758624E-04 Eh
   gradient norm :     0.0197470 Eh/α   predicted    -0.3282911E-03 (*******%)
   displ. norm   :     0.1686248 α      lambda       -0.1165596E-02
   maximum displ.:     0.0654423 α      in ANC's #4, #5, #3, ...

........................................................................
.............................. CYCLE   18 ..............................
........................................................................
   1    -33.3501907 -0.333502E+02  0.813E-02    4.82       0.0  T
   2    -33.3501976 -0.689596E-05  0.476E-02    4.82       1.0  T
   3    -33.3501875  0.101002E-04  0.259E-02    4.82       1.0  T
   4    -33.3501994 -0.119405E-04  0.492E-03    4.82       4.0  T
   5    -33.3501998 -0.419224E-06  0.144E-03    4.82      13.7  T
   6    -33.3501998 -0.537532E-08  0.812E-04    4.82      24.1  T
     SCC iter.                  ...        0 min,  0.006 sec
     gradient                   ...        0 min,  0.012 sec
 * total energy  :   -32.7896294 Eh     change       -0.3423940E-03 Eh
   gradient norm :     0.0142204 Eh/α   predicted    -0.5993719E-03 (  75.05%)
   displ. norm   :     0.1119956 α      lambda       -0.5519065E-03
   maximum displ.:     0.0545375 α      in ANC's #1, #2, #7, ...

........................................................................
.............................. CYCLE   19 ..............................
........................................................................
   1    -33.3486568 -0.333487E+02  0.534E-02    4.85       0.0  T
   2    -33.3486599 -0.310944E-05  0.318E-02    4.84       1.0  T
   3    -33.3486557  0.420834E-05  0.169E-02    4.84       1.2  T
   4    -33.3486607 -0.502312E-05  0.377E-03    4.84       5.2  T
   5    -33.3486609 -0.184032E-06  0.132E-03    4.84      14.8  T
   6    -33.3486609 -0.505293E-08  0.722E-04    4.84      27.2  T
     SCC iter.                  ...        0 min,  0.006 sec
     gradient                   ...        0 min,  0.012 sec
 * total energy  :   -32.7898176 Eh     change       -0.1881124E-03 Eh
   gradient norm :     0.0105393 Eh/α   predicted    -0.2794176E-03 (  48.54%)
   displ. norm   :     0.1598216 α      lambda       -0.3452297E-03
   maximum displ.:     0.0998618 α      in ANC's #1, #3, #6, ...

........................................................................
.............................. CYCLE   20 ..............................
........................................................................
   1    -33.3467401 -0.333467E+02  0.837E-02    4.83       0.0  T
   2    -33.3467414 -0.131685E-05  0.499E-02    4.83       1.0  T
   3    -33.3467388  0.262170E-05  0.114E-02    4.82       1.7  T
   4    -33.3467418 -0.304219E-05  0.323E-03    4.82       6.1  T
   5    -33.3467419 -0.116927E-06  0.123E-03    4.83      16.0  T
   6    -33.3467419 -0.332776E-08  0.393E-04    4.83      49.9  T
     SCC iter.                  ...        0 min,  0.006 sec
     gradient                   ...        0 min,  0.012 sec
 * total energy  :   -32.7898631 Eh     change       -0.4554312E-04 Eh
   gradient norm :     0.0106136 Eh/α   predicted    -0.1770266E-03 ( 288.70%)
   displ. norm   :     0.1745423 α      lambda       -0.3211330E-03
   maximum displ.:     0.1150780 α      in ANC's #1, #5, #2, ...
 * RMSD in coord.:     1.1798141 α      energy gain  -0.3301269E-01 Eh

generating ANC from model Hessian ...
Using Lindh-Hessian (1995)
 Shifting diagonal of input Hessian by   2.228605639995117E-003
 Lowest  eigenvalues of input Hessian
   -0.000000    0.000000    0.000000    0.000000    0.000000    0.000000
    0.005000    0.005854    0.007172    0.009908    0.011713    0.013724
    0.016481    0.018310    0.023157    0.030079    0.034089    0.038399
 Highest eigenvalues
    1.462513    1.539284    1.567830    1.884543    1.896767    1.936110
 

........................................................................
.............................. CYCLE   21 ..............................
........................................................................
   1    -33.3450527 -0.333451E+02  0.862E-02    4.80       0.0  T
   2    -33.3450546 -0.192619E-05  0.515E-02    4.80       1.0  T
   3    -33.3450462  0.843459E-05  0.199E-02    4.80       1.0  T
   4    -33.3450556 -0.939553E-05  0.290E-03    4.80       6.8  T
   5    -33.3450557 -0.108978E-06  0.111E-03    4.80      17.7  T
   6    -33.3450557  0.184988E-08  0.714E-04    4.80      27.4  T
   7    -33.3450557 -0.794870E-08  0.176E-04    4.80     111.2  T
     SCC iter.                  ...        0 min,  0.007 sec
     gradient                   ...        0 min,  0.013 sec
 * total energy  :   -32.7899797 Eh     change       -0.1166297E-03 Eh
   gradient norm :     0.0106667 Eh/α   predicted     0.0000000E+00 (-100.00%)
   displ. norm   :     0.1198588 α      lambda       -0.2277285E-03
   maximum displ.:     0.0790513 α      in ANC's #2, #1, #3, ...

........................................................................
.............................. CYCLE   22 ..............................
........................................................................
   1    -33.3476738 -0.333477E+02  0.577E-02    4.83       0.0  T
   2    -33.3476747 -0.923692E-06  0.343E-02    4.83       1.0  T
   3    -33.3476729  0.178577E-05  0.940E-03    4.83       2.1  T
   4    -33.3476748 -0.191629E-05  0.231E-03    4.83       8.5  T
   5    -33.3476749 -0.106279E-06  0.644E-04    4.83      30.4  T
     SCC iter.                  ...        0 min,  0.005 sec
     gradient                   ...        0 min,  0.012 sec
 * total energy  :   -32.7901224 Eh     change       -0.1426581E-03 Eh
   gradient norm :     0.0025440 Eh/α   predicted    -0.1155009E-03 ( -19.04%)
   displ. norm   :     0.0817497 α      lambda       -0.8894420E-04
   maximum displ.:     0.0469518 α      in ANC's #2, #1, #4, ...

........................................................................
.............................. CYCLE   23 ..............................
........................................................................
   1    -33.3488775 -0.333489E+02  0.441E-02    4.84       0.0  T
   2    -33.3488777 -0.199107E-06  0.262E-02    4.84       1.0  T
   3    -33.3488777  0.219086E-07  0.181E-03    4.84      10.8  T
   4    -33.3488778 -0.473789E-07  0.795E-04    4.84      24.7  T
   5    -33.3488778 -0.735339E-08  0.475E-04    4.84      41.3  T
     SCC iter.                  ...        0 min,  0.005 sec
     gradient                   ...        0 min,  0.013 sec
 * total energy  :   -32.7901716 Eh     change       -0.4917966E-04 Eh
   gradient norm :     0.0031623 Eh/α   predicted    -0.4477125E-04 (  -8.96%)
   displ. norm   :     0.0919558 α      lambda       -0.5404939E-04
   maximum displ.:     0.0598920 α      in ANC's #1, #2, #4, ...

........................................................................
.............................. CYCLE   24 ..............................
........................................................................
   1    -33.3486446 -0.333486E+02  0.406E-02    4.83       0.0  T
   2    -33.3486447 -0.775334E-07  0.239E-02    4.84       1.0  T
   3    -33.3486444  0.315220E-06  0.388E-03    4.84       5.1  T
   4    -33.3486447 -0.358864E-06  0.601E-04    4.84      32.6  T
   5    -33.3486447 -0.402580E-08  0.271E-04    4.84      72.3  T
     SCC iter.                  ...        0 min,  0.006 sec
     gradient                   ...        0 min,  0.013 sec
 * total energy  :   -32.7902165 Eh     change       -0.4489889E-04 Eh
   gradient norm :     0.0030699 Eh/α   predicted    -0.2728389E-04 ( -39.23%)
   displ. norm   :     0.1261342 α      lambda       -0.6175072E-04
   maximum displ.:     0.0886475 α      in ANC's #1, #2, #4, ...

........................................................................
.............................. CYCLE   25 ..............................
........................................................................
   1    -33.3478784 -0.333479E+02  0.552E-02    4.83       0.0  T
   2    -33.3478786 -0.140369E-06  0.325E-02    4.83       1.0  T
   3    -33.3478779  0.693287E-06  0.579E-03    4.83       3.4  T
   4    -33.3478787 -0.784108E-06  0.834E-04    4.83      23.5  T
   5    -33.3478787 -0.671032E-08  0.388E-04    4.83      50.5  T
     SCC iter.                  ...        0 min,  0.006 sec
     gradient                   ...        0 min,  0.013 sec
 * total energy  :   -32.7902657 Eh     change       -0.4923470E-04 Eh
   gradient norm :     0.0014013 Eh/α   predicted    -0.3136718E-04 ( -36.29%)
   displ. norm   :     0.1831511 α      lambda       -0.4301180E-04
   maximum displ.:     0.1369013 α      in ANC's #1, #2, #4, ...

........................................................................
.............................. CYCLE   26 ..............................
........................................................................
   1    -33.3474399 -0.333474E+02  0.779E-02    4.82       0.0  T
   2    -33.3474401 -0.240368E-06  0.459E-02    4.82       1.0  T
   3    -33.3474391  0.106002E-05  0.732E-03    4.82       2.7  T
   4    -33.3474403 -0.122051E-05  0.109E-03    4.82      18.0  T
   5    -33.3474403 -0.970245E-08  0.529E-04    4.82      37.1  T
   6    -33.3474403 -0.174374E-09  0.232E-04    4.82      84.6  T
     SCC iter.                  ...        0 min,  0.006 sec
     gradient                   ...        0 min,  0.013 sec
 * total energy  :   -32.7903150 Eh     change       -0.4931286E-04 Eh
   gradient norm :     0.0017727 Eh/α   predicted    -0.2182947E-04 ( -55.73%)
   displ. norm   :     0.1124127 α      lambda       -0.2433211E-04
   maximum displ.:     0.0911263 α      in ANC's #1, #2, #4, ...

........................................................................
.............................. CYCLE   27 ..............................
........................................................................
   1    -33.3479686 -0.333480E+02  0.479E-02    4.83       0.0  T
   2    -33.3479686 -0.734677E-07  0.282E-02    4.83       1.0  T
   3    -33.3479683  0.334446E-06  0.406E-03    4.83       4.8  T
   4    -33.3479687 -0.389571E-06  0.599E-04    4.83      32.8  T
   5    -33.3479687 -0.168777E-08  0.307E-04    4.83      63.9  T
     SCC iter.                  ...        0 min,  0.006 sec
     gradient                   ...        0 min,  0.013 sec
 * total energy  :   -32.7903460 Eh     change       -0.3101493E-04 Eh
   gradient norm :     0.0011451 Eh/α   predicted    -0.1223665E-04 ( -60.55%)
   displ. norm   :     0.0891309 α      lambda       -0.1804812E-04
   maximum displ.:     0.0770840 α      in ANC's #1, #2, #3, ...

........................................................................
.............................. CYCLE   28 ..............................
........................................................................
   1    -33.3483531 -0.333484E+02  0.387E-02    4.83       0.0  T
   2    -33.3483531 -0.475688E-07  0.228E-02    4.83       1.0  T
   3    -33.3483530  0.909022E-07  0.225E-03    4.83       8.7  T
   4    -33.3483532 -0.117450E-06  0.473E-04    4.83      41.5  T
   5    -33.3483532 -0.135780E-08  0.237E-04    4.83      82.6  T
     SCC iter.                  ...        0 min,  0.006 sec
     gradient                   ...        0 min,  0.013 sec
 * total energy  :   -32.7903686 Eh     change       -0.2254375E-04 Eh
   gradient norm :     0.0006243 Eh/α   predicted    -0.9056302E-05 ( -59.83%)
   displ. norm   :     0.0748687 α      lambda       -0.1268519E-04
   maximum displ.:     0.0655361 α      in ANC's #1, #3, #4, ...

........................................................................
.............................. CYCLE   29 ..............................
........................................................................
   1    -33.3483744 -0.333484E+02  0.352E-02    4.83       0.0  T
   2    -33.3483744 -0.354102E-07  0.208E-02    4.83       1.0  T
   3    -33.3483742  0.174246E-06  0.289E-03    4.83       6.8  T
   4    -33.3483744 -0.202544E-06  0.386E-04    4.83      50.8  T
   5    -33.3483744 -0.287827E-09  0.178E-04    4.83     110.0  T
     SCC iter.                  ...        0 min,  0.006 sec
     gradient                   ...        0 min,  0.013 sec
 * total energy  :   -32.7903845 Eh     change       -0.1591738E-04 Eh
   gradient norm :     0.0005709 Eh/α   predicted    -0.6360838E-05 ( -60.04%)
   displ. norm   :     0.0602766 α      lambda       -0.9355596E-05
   maximum displ.:     0.0535628 α      in ANC's #1, #3, #4, ...

........................................................................
.............................. CYCLE   30 ..............................
........................................................................
   1    -33.3484842 -0.333485E+02  0.269E-02    4.83       0.0  T
   2    -33.3484842 -0.230745E-07  0.158E-02    4.83       1.2  T
   3    -33.3484841  0.282636E-07  0.133E-03    4.83      14.8  T
   4    -33.3484842 -0.398067E-07  0.295E-04    4.83      66.6  T
   5    -33.3484842 -0.504741E-09  0.151E-04    4.83     129.8  T
     SCC iter.                  ...        0 min,  0.006 sec
     gradient                   ...        0 min,  0.013 sec
 * total energy  :   -32.7903971 Eh     change       -0.1263804E-04 Eh
   gradient norm :     0.0004847 Eh/α   predicted    -0.4685704E-05 ( -62.92%)
   displ. norm   :     0.0590800 α      lambda       -0.5877150E-05
   maximum displ.:     0.0522151 α      in ANC's #1, #3, #4, ...

........................................................................
.............................. CYCLE   31 ..............................
........................................................................
   1    -33.3485523 -0.333486E+02  0.264E-02    4.83       0.0  T
   2    -33.3485523 -0.224641E-07  0.155E-02    4.83       1.3  T
   3    -33.3485523  0.209099E-07  0.119E-03    4.83      16.5  T
   4    -33.3485523 -0.315073E-07  0.295E-04    4.83      66.4  T
   5    -33.3485523 -0.577465E-09  0.149E-04    4.83     131.6  T
     SCC iter.                  ...        0 min,  0.005 sec
     gradient                   ...        0 min,  0.013 sec
 * total energy  :   -32.7904067 Eh     change       -0.9613163E-05 Eh
   gradient norm :     0.0006846 Eh/α   predicted    -0.2947132E-05 ( -69.34%)
   displ. norm   :     0.0487257 α      lambda       -0.6853220E-05
   maximum displ.:     0.0430381 α      in ANC's #1, #3, #2, ...

........................................................................
.............................. CYCLE   32 ..............................
........................................................................
   1    -33.3484915 -0.333485E+02  0.216E-02    4.83       0.0  T
   2    -33.3484915 -0.157156E-07  0.127E-02    4.83       1.5  T
   3    -33.3484915  0.103188E-08  0.616E-04    4.83      31.9  T
   4    -33.3484915 -0.644067E-08  0.266E-04    4.83      73.7  T
     SCC iter.                  ...        0 min,  0.005 sec
     gradient                   ...        0 min,  0.013 sec
 * total energy  :   -32.7904159 Eh     change       -0.9143860E-05 Eh
   gradient norm :     0.0006136 Eh/α   predicted    -0.3431396E-05 ( -62.47%)
   displ. norm   :     0.0497386 α      lambda       -0.4435823E-05
   maximum displ.:     0.0441837 α      in ANC's #1, #3, #2, ...

........................................................................
.............................. CYCLE   33 ..............................
........................................................................
   1    -33.3483854 -0.333484E+02  0.219E-02    4.82       0.0  T
   2    -33.3483854 -0.161291E-07  0.129E-02    4.82       1.5  T
   3    -33.3483854  0.761463E-08  0.819E-04    4.82      24.0  T
   4    -33.3483854 -0.137071E-07  0.268E-04    4.82      73.3  T
     SCC iter.                  ...        0 min,  0.005 sec
     gradient                   ...        0 min,  0.013 sec
 * total energy  :   -32.7904229 Eh     change       -0.6987989E-05 Eh
   gradient norm :     0.0007009 Eh/α   predicted    -0.2223278E-05 ( -68.18%)
   displ. norm   :     0.0484250 α      lambda       -0.1665370E-05
   maximum displ.:     0.0427009 α      in ANC's #1, #3, #2, ...

........................................................................
.............................. CYCLE   34 ..............................
........................................................................
   1    -33.3482581 -0.333483E+02  0.214E-02    4.82       0.0  T
   2    -33.3482581 -0.157283E-07  0.126E-02    4.82       1.6  T
   3    -33.3482581  0.559280E-08  0.751E-04    4.82      26.1  T
   4    -33.3482581 -0.111879E-07  0.268E-04    4.82      73.1  T
     SCC iter.                  ...        0 min,  0.005 sec
     gradient                   ...        0 min,  0.013 sec
 * total energy  :   -32.7904272 Eh     change       -0.4325734E-05 Eh
   gradient norm :     0.0009250 Eh/α   predicted    -0.8384250E-06 ( -80.62%)
   displ. norm   :     0.0332491 α      lambda       -0.5375372E-05
   maximum displ.:     0.0276884 α      in ANC's #1, #6, #2, ...

   *** GEOMETRY OPTIMIZATION CONVERGED AFTER 34 ITERATIONS ***

------------------------------------------------------------------------
 total energy gain   :        -0.0335768 Eh      -21.0698 kcal/mol
 total RMSD          :         1.3030775 a0        0.6896 Å
 total power (kW/mol):        -2.5928191 (step)  -92.9068 (real)
------------------------------------------------------------------------

 ANCopt (total)                0 d,  0 h,  0 min,  0.949 sec
 optimizer setup                ...        0 min,  0.000 sec (  0.015%)
 model hessian                  ...        0 min,  0.035 sec (  3.733%)
 ANC generation                 ...        0 min,  0.002 sec (  0.161%)
 coordinate transformation      ...        0 min,  0.001 sec (  0.068%)
 single point calculation       ...        0 min,  0.897 sec ( 94.557%)
 optimization log               ...        0 min,  0.004 sec (  0.369%)
 hessian update                 ...        0 min,  0.000 sec (  0.049%)
 rational function              ...        0 min,  0.008 sec (  0.832%)

================
 final structure:
================
$coord
    1.80388141815575    0.09592608678954   -0.45134242887374      C 
    3.16765607321506   -1.21674968623347    1.17623036427034      C 
    5.29355587671840    0.33643627583314    2.22958668482235      C 
    5.39632652441485    2.67964623025726    0.49329665794349      C 
    2.77285672789734    2.73845242124328   -0.77460804249463      C 
    6.08262250609857    4.91762868386730    2.21576270265487      C 
    5.07624876805384    4.17599199835566    4.85089453641128      C 
    2.69095342500650    5.70564291547640    5.08617795508689      C 
    2.52800344697826    7.45281107505043    3.30720810183549      C 
    4.77033989439997    7.42541903868540    1.56932451219729      C 
    4.71170837264136    1.35530262431058    4.83385983333405      C 
    3.98755267046892   -0.00547378006283    6.79653878872969      C 
    0.14054227166968   -0.55037391097796   -1.42930075215404      H 
    2.83204775572010   -3.12873643633545    1.78135523817047      H 
    7.07739144074090   -0.70893709544221    2.27556640080484      H 
    6.82915105400592    2.44047078440909   -0.97477127945401      H 
    2.87543360738859    3.29063655599880   -2.75889450305757      H 
    1.49229182139943    4.04139151533259    0.18702922593130      H 
    8.13537151106291    5.13080573237933    2.23279237083040      H 
    6.37117863040663    4.70747034521889    6.37885256024159      H 
    1.35278932204003    5.35561454227017    6.57588587843748      H 
    1.02675077496158    8.81017105965652    3.08715250018339      H 
    6.00343358585323    9.03056735444146    1.99299635800042      H 
    4.24408589731846    7.55837815758063   -0.41843814646182      H 
    3.60764589755142    0.84474196878576    8.60776841572902      H 
    3.74145286553173   -2.02072554258154    6.67801896741355      H 
$end
           -------------------------------------------------
          |                Final Singlepoint                |
           -------------------------------------------------

          ...................................................
          :                      SETUP                      :
          :.................................................:
          :  # basis functions                  62          :
          :  # atomic orbitals                  62          :
          :  # shells                           38          :
          :  # electrons                        62          :
          :  max. iterations                   250          :
          :  Hamiltonian                  GFN2-xTB          :
          :  restarted?                      false          :
          :  GBSA solvation                  false          :
          :  PC potential                    false          :
          :  electronic temp.          300.0000000     K    :
          :  accuracy                    1.0000000          :
          :  -> integral cutoff          0.2500000E+02      :
          :  -> integral neglect         0.1000000E-07      :
          :  -> SCF convergence          0.1000000E-05 Eh   :
          :  -> wf. convergence          0.1000000E-03 e    :
          :  Broyden damping             0.4000000          :
          ...................................................

 iter      E             dE          RMSdq      gap      omega  full diag
   1    -33.3482581 -0.333483E+02  0.104E-04    4.82       0.0  T
   2    -33.3482581 -0.172591E-10  0.453E-05    4.82     432.7  T
   3    -33.3482581  0.104023E-10  0.516E-05    4.82     380.0  T

   *** convergence criteria satisfied after 3 iterations ***

         #    Occupation            Energy/Eh            Energy/eV
      -------------------------------------------------------------
         1        2.0000           -0.6482656             -17.6402
       ...           ...                  ...                  ...
        25        2.0000           -0.4347724             -11.8308
        26        2.0000           -0.4249956             -11.5647
        27        2.0000           -0.4236126             -11.5271
        28        2.0000           -0.4211691             -11.4606
        29        2.0000           -0.3861363             -10.5073
        30        2.0000           -0.3820043             -10.3949
        31        2.0000           -0.3788745             -10.3097 (HOMO)
        32                         -0.2016556              -5.4873 (LUMO)
        33                         -0.1956293              -5.3233
        34                         -0.1873394              -5.0978
        35                          0.0362210               0.9856
        36                          0.0468950               1.2761
       ...                                ...                  ...
        62                          0.6655086              18.1094
      -------------------------------------------------------------
                  HL-Gap            0.1772189 Eh            4.8224 eV
             Fermi-level           -0.2902650 Eh           -7.8985 eV

 SCC (total)                   0 d,  0 h,  0 min,  0.025 sec
 SCC setup                      ...        0 min,  0.000 sec (  0.799%)
 Dispersion                     ...        0 min,  0.000 sec (  0.883%)
 integral evaluation            ...        0 min,  0.007 sec ( 29.346%)
 zeroth order Hamiltonian       ...        0 min,  0.000 sec (  0.559%)
 iterations                     ...        0 min,  0.004 sec ( 15.244%)
 molecular gradient             ...        0 min,  0.013 sec ( 51.549%)
 printout                       ...        0 min,  0.000 sec (  1.367%)

         :::::::::::::::::::::::::::::::::::::::::::::::::::::
         ::                     SUMMARY                     ::
         :::::::::::::::::::::::::::::::::::::::::::::::::::::
         :: total energy             -32.790427193301 Eh    ::
         :: gradient norm              0.000924697240 Eh/a0 ::
         :: HOMO-LUMO gap              4.822372176421 eV    ::
         ::.................................................::
         :: SCC energy               -33.348258096921 Eh    ::
         :: -> isotropic ES            0.003475388539 Eh    ::
         :: -> anisotropic ES          0.005895664088 Eh    ::
         :: -> anisotropic XC          0.021118250193 Eh    ::
         :: -> dispersion             -0.025942768149 Eh    ::
         :: repulsion energy           0.557550518463 Eh    ::
         :: add. restraining           0.000000000000 Eh    ::
         :::::::::::::::::::::::::::::::::::::::::::::::::::::

           -------------------------------------------------
          |                Property Printout                |
           -------------------------------------------------

    * Orbital Energies and Occupations

         #    Occupation            Energy/Eh            Energy/eV
      -------------------------------------------------------------
         1        2.0000           -0.6482656             -17.6402
       ...           ...                  ...                  ...
        19        2.0000           -0.4684974             -12.7485
        20        2.0000           -0.4585629             -12.4781
        21        2.0000           -0.4522245             -12.3057
        22        2.0000           -0.4451469             -12.1131
        23        2.0000           -0.4422513             -12.0343
        24        2.0000           -0.4396107             -11.9624
        25        2.0000           -0.4347724             -11.8308
        26        2.0000           -0.4249956             -11.5647
        27        2.0000           -0.4236126             -11.5271
        28        2.0000           -0.4211691             -11.4606
        29        2.0000           -0.3861363             -10.5073
        30        2.0000           -0.3820043             -10.3949
        31        2.0000           -0.3788745             -10.3097 (HOMO)
        32                         -0.2016556              -5.4873 (LUMO)
        33                         -0.1956293              -5.3233
        34                         -0.1873394              -5.0978
        35                          0.0362210               0.9856
        36                          0.0468950               1.2761
        37                          0.0586413               1.5957
        38                          0.0857407               2.3331
        39                          0.0980325               2.6676
        40                          0.1117742               3.0415
        41                          0.1178989               3.2082
        42                          0.1217872               3.3140
       ...                                ...                  ...
        62                          0.6655086              18.1094
      -------------------------------------------------------------
                  HL-Gap            0.1772189 Eh            4.8224 eV
             Fermi-level           -0.2902650 Eh           -7.8985 eV

     #   Z        covCN         q      C6AA      α(0)
     1   6 C      2.940    -0.039    28.975     8.828
     2   6 C      2.937    -0.040    28.989     8.830
     3   6 C      3.916    -0.023    20.925     6.502
     4   6 C      3.900    -0.021    20.898     6.498
     5   6 C      3.844    -0.059    21.609     6.613
     6   6 C      3.902    -0.022    20.902     6.499
     7   6 C      3.912    -0.024    20.937     6.504
     8   6 C      2.938    -0.036    28.901     8.817
     9   6 C      2.938    -0.040    28.993     8.831
    10   6 C      3.841    -0.058    21.591     6.610
    11   6 C      2.959     0.017    27.640     8.623
    12   6 C      2.839    -0.107    30.687     9.078
    13   1 H      0.926     0.026     2.640     2.541
    14   1 H      0.926     0.028     2.618     2.530
    15   1 H      0.924     0.036     2.507     2.476
    16   1 H      0.924     0.023     2.685     2.563
    17   1 H      0.924     0.030     2.591     2.517
    18   1 H      0.924     0.051     2.304     2.374
    19   1 H      0.924     0.024     2.674     2.557
    20   1 H      0.924     0.040     2.444     2.445
    21   1 H      0.926     0.029     2.598     2.521
    22   1 H      0.926     0.025     2.652     2.547
    23   1 H      0.924     0.037     2.489     2.467
    24   1 H      0.924     0.040     2.449     2.447
    25   1 H      0.926     0.031     2.573     2.509
    26   1 H      0.926     0.032     2.557     2.501

 Mol. C6AA /au·bohr⁶  :       6752.017174
 Mol. C8AA /au·bohr⁸  :     159538.898733
 Mol. α(0) /au        :        127.225853


Wiberg/Mayer (AO) data.
largest (>0.10) Wiberg bond orders for each atom
          total WBO             WBO to atom ...
     1  C   3.989        C    2 1.926    C    5 1.023    H   13 0.969
     2  C   3.988        C    1 1.926    C    3 1.002    H   14 0.969
     3  C   3.996        C    2 1.002    C    4 0.978    C   11 0.977    H   15 0.950
     4  C   3.994        C    5 0.993    C    6 0.988    C    3 0.978    H   16 0.976
     5  C   3.998        C    1 1.023    C    4 0.993    H   17 0.972    H   18 0.952
     6  C   3.995        C   10 0.994    C    4 0.988    C    7 0.979    H   19 0.975
     7  C   3.996        C    8 0.997    C   11 0.989    C    6 0.979    H   20 0.943
     8  C   3.989        C    9 1.923    C    7 0.997    H   21 0.969
     9  C   3.989        C    8 1.923    C   10 1.021    H   22 0.969
    10  C   3.998        C    9 1.021    C    6 0.994    H   24 0.967    H   23 0.961
    11  C   3.985        C   12 1.935    C    7 0.989    C    3 0.977
    12  C   3.987        C   11 1.935    H   26 0.975    H   25 0.975
    13  H   0.999        C    1 0.969
    14  H   0.999        C    2 0.969
    15  H   0.999        C    3 0.950
    16  H   0.999        C    4 0.976
    17  H   0.999        C    5 0.972
    18  H   0.997        C    5 0.952
    19  H   0.999        C    6 0.975
    20  H   0.998        C    7 0.943
    21  H   0.999        C    8 0.969
    22  H   0.998        C    9 0.969
    23  H   0.998        C   10 0.961
    24  H   0.998        C   10 0.967
    25  H   0.999        C   12 0.975
    26  H   0.998        C   12 0.975

molecular dipole:
                 x           y           z       tot (Debye)
 q only:        0.121       0.224      -0.145
   full:        0.140       0.249      -0.130       0.799
molecular quadrupole (traceless):
                xx          xy          yy          xz          yz          zz
 q only:        0.835       1.917       1.417      -0.142      -0.178      -2.252
  q+dip:        0.278       2.018       1.545      -0.051      -1.447      -1.823
   full:        0.833       2.153       1.359       0.009      -0.392      -2.192

           -------------------------------------------------
          |                Geometry Summary                 |
           -------------------------------------------------

      molecular mass/u    :      158.2426000
   center of mass at/Å    :        2.1271125       1.5833593       1.3738390
  moments of inertia/u·Å² :        0.3448088E+03   0.4788220E+03   0.6423780E+03
rotational constants/cm⁻¹ :        0.4888979E-01   0.3520647E-01   0.2624254E-01

 * 22 selected distances

     #   Z        #   Z                                     value/Å
     1   6 C      2   6 C                                 1.3210359
     3   6 C      4   6 C                                 1.5442457 (max)
     4   6 C      5   6 C                                 1.5422258
     4   6 C      6   6 C                                 1.5379367
     6   6 C      7   6 C                                 1.5434145
     8   6 C      9   6 C                                 1.3222956
     6   6 C     10   6 C                                 1.5363448
    11   6 C     12   6 C                                 1.3206363
     1   6 C     13   1 H                                 1.0768209
     2   6 C     14   1 H                                 1.0760013
     3   6 C     15   1 H                                 1.0943853
     4   6 C     16   1 H                                 1.0929034
     5   6 C     17   1 H                                 1.0912890
     5   6 C     18   1 H                                 1.0924971
     6   6 C     19   1 H                                 1.0921471
     7   6 C     20   1 H                                 1.0965554
     8   6 C     21   1 H                                 1.0757320 (min)
     9   6 C     22   1 H                                 1.0773158
    10   6 C     23   1 H                                 1.0943251
    10   6 C     24   1 H                                 1.0903905
    12   6 C     25   1 H                                 1.0777236
    12   6 C     26   1 H                                 1.0761769

 * 2 distinct bonds (by element types)

   Z      Z             #   av. dist./Å        max./Å        min./Å
   1 H    6 C          14     1.0860188     1.0965554     1.0757320
   6 C    6 C           8     1.4585169     1.5442457     1.3206363


optimized geometry written to: xtbopt.xyz


           -------------------------------------------------
          | TOTAL ENERGY              -32.790427193301 Eh   |
          | GRADIENT NORM               0.000924697240 Eh/α |
          | HOMO-LUMO GAP               4.822372176421 eV   |
           -------------------------------------------------

------------------------------------------------------------------------
 * finished run on 2021/05/19 at 10:58:52.098     
------------------------------------------------------------------------
 total:
 * wall-time:     0 d,  0 h,  0 min,  1.041 sec
 *  cpu-time:     0 d,  0 h,  0 min,  1.028 sec
 * ratio c/w:     0.987 speedup
 SCF:
 * wall-time:     0 d,  0 h,  0 min,  0.034 sec
 *  cpu-time:     0 d,  0 h,  0 min,  0.034 sec
 * ratio c/w:     1.000 speedup
 ANC optimizer:
 * wall-time:     0 d,  0 h,  0 min,  0.974 sec
 *  cpu-time:     0 d,  0 h,  0 min,  0.974 sec
 * ratio c/w:     1.000 speedup

