      -----------------------------------------------------------      
     |                   =====================                   |     
     |                           x T B                           |     
     |                   =====================                   |     
     |                         S. Grimme                         |     
     |          Mulliken Center for Theoretical Chemistry        |     
     |                    University of Bonn                     |     
     |                Version 6.2 RC2 (SAW190805)                |     
      -----------------------------------------------------------      

   This program is distributed in the hope that it will be useful,
   but WITHOUT ANY WARRANTY; without even the implied warranty of
   MERCHANTABILITY or FITNESS FOR A PARTICULAR PURPOSE.
   
   FOR NON-COMMERCIAL, ACADEMIA USE ONLY.
   
   Cite this work as:
   * S. Grimme, C. Bannwarth, P. Shushkov, J. Chem. Theory Comput., 2017,
     13, 1989-2009. DOI: 10.1021/acs.jctc.7b00118
   * C. Bannwarth, S. Ehlert and S. Grimme., J. Chem. Theory Comput., 2019,
     15, 1652-1671. DOI: 10.1021/acs.jctc.8b01176
   * P. Pracht, E. Caldeweyher, S. Ehlert, S. Grimme, ChemRxiv, 2019, preprint.
     DOI: 10.26434/chemrxiv.8326202.v1
   
   for DFT-D4:
   * E. Caldeweyher, C. Bannwarth and S. Grimme, J. Chem. Phys., 2017,
     147, 034112. DOI: 10.1063/1.4993215
   * E. Caldeweyher, S. Ehlert, A. Hansen, H. Neugebauer, S. Spicher,
     C. Bannwarth and S. Grimme, J. Chem. Phys., 2019, 150, 154122.
     DOI: 10.1063/1.5090222
   
   for sTDA-xTB:
   * S. Grimme and C. Bannwarth, J. Chem. Phys., 2016, 145, 054103.
     DOI: 10.1063/1.4959605
   
   in the mass-spec context:
   * V. Asgeirsson, C. Bauer and S. Grimme, Chem. Sci., 2017, 8, 4879.
     DOI: 10.1039/c7sc00601b
   
   for metadynamics refer to:
   * S. Grimme, J. Chem. Theory Comput., 2019, 155, 2847-2862
     DOI: 10.1021/acs.jctc.9b00143
   
   with help from (in alphabetical order)
   C. Bannwarth, F. Bohle, G. Brandenburg, E. Caldeweyher, M. Checinski,
   S. Dohm, S. Ehlert, S. Ehrlich, F. März, H. Neugebauer, J. Pisarek,
   P. Pracht, P. Shushkov, and S. Spicher.
   
 * started run on 2021/05/19 at 10:58:57.487     

           -------------------------------------------------
          |                Calculation Setup                |
           -------------------------------------------------

          program call               : /ihome/ghutchison/geoffh/xtb/xtb 219.xyz -opt
          hostname                   : smp-n83
          coordinate file            : 219.xyz
          omp threads                :                     1
          number of atoms            :                    35
          number of electrons        :                    80
          charge                     :                     0
          spin                       :                   0.0
          first test random number   :      0.67556452165497


########################################################################
# WARNING! Please study the warnings concerning your input carefully
#  - the use of '-opt' is discouraged, please use '--opt' next time
########################################################################

           ------------------------------------------------- 
          |                 G F N 2 - x T B                 |
          | Geometry, Frequencies, Noncovalent interactions |
          |            JCTC 2019 parametrisation            |
           ------------------------------------------------- 
             KAB for C  - Si     :                1.0500
             KAB for H  - Pd     :                0.9500
             k(s)              :                1.8500
             k(p)              :                2.2300
             k(d)              :                2.2300
             k(f)              :                2.0000
             kEN (H0ij)        :               -2.0000
             D4 a1             :                0.5200
             D4 a2             :                5.0000
             D4 s6             :                1.0000
             D4 s8             :                2.7000
             D4 s9             :                5.0000
             alphaj            :                2.0000

  Z AO/shell   Hii/eV     exponent
  1     Wed Apr 25 08:07:45 CEST 2018   EN: 2.200 GM2: 0.406  GM3: 0.0800  RAES: 1.40
     1s    -10.707211    1.230000
  6     Wed Apr 25 08:07:45 CEST 2018   EN: 2.550 GM2: 0.538  GM3: 0.1500  RAES: 3.00
     2s    -13.970922    2.096432
     2p    -10.063292    1.800000

           ------------------------------------------------- 
          |        Self-Consistent Charge Iterations        |
           ------------------------------------------------- 

          ...................................................
          :                      SETUP                      :
          :.................................................:
          :  # basis functions                  80          :
          :  # atomic orbitals                  80          :
          :  # shells                           50          :
          :  # electrons                        80          :
          :  max. iterations                   250          :
          :  Hamiltonian                  GFN2-xTB          :
          :  restarted?                      false          :
          :  GBSA solvation                  false          :
          :  PC potential                    false          :
          :  electronic temp.          300.0000000     K    :
          :  accuracy                    1.0000000          :
          :  -> integral cutoff          0.2500000E+02      :
          :  -> integral neglect         0.1000000E-07      :
          :  -> SCF convergence          0.1000000E-05 Eh   :
          :  -> wf. convergence          0.1000000E-03 e    :
          :  Broyden damping             0.4000000          :
          ...................................................

 iter      E             dE          RMSdq      gap      omega  full diag
   1    -42.9383680 -0.429384E+02  0.385E+00    3.56       0.0  T
   2    -42.9848814 -0.465135E-01  0.226E+00    3.52       1.0  T
   3    -42.9698757  0.150058E-01  0.101E+00    3.55       1.0  T
   4    -42.9821054 -0.122297E-01  0.533E-01    3.50       1.0  T
   5    -42.9896293 -0.752387E-02  0.140E-01    3.50       1.0  T
   6    -42.9900224 -0.393124E-03  0.545E-02    3.50       1.0  T
   7    -42.9900644 -0.419688E-04  0.244E-02    3.50       1.0  T
   8    -42.9900648 -0.461694E-06  0.100E-02    3.50       1.7  T
   9    -42.9900671 -0.228491E-05  0.138E-03    3.50      12.3  T
  10    -42.9900671 -0.203263E-07  0.669E-04    3.50      25.3  T
  11    -42.9900671  0.153889E-09  0.263E-04    3.50      64.3  T

   *** convergence criteria satisfied after 11 iterations ***

         #    Occupation            Energy/Eh            Energy/eV
      -------------------------------------------------------------
         1        2.0000           -0.6352273             -17.2854
       ...           ...                  ...                  ...
        34        2.0000           -0.4245877             -11.5536
        35        2.0000           -0.4233503             -11.5199
        36        2.0000           -0.4132919             -11.2462
        37        2.0000           -0.4045770             -11.0091
        38        2.0000           -0.3821262             -10.3982
        39        2.0000           -0.3808391             -10.3632
        40        2.0000           -0.3713108             -10.1039 (HOMO)
        41                         -0.2427339              -6.6051 (LUMO)
        42                         -0.2153914              -5.8611
        43                         -0.2145547              -5.8383
        44                         -0.1410768              -3.8389
        45                         -0.0957045              -2.6043
       ...                                ...                  ...
        80                          0.6419337              17.4679
      -------------------------------------------------------------
                  HL-Gap            0.1285769 Eh            3.4988 eV
             Fermi-level           -0.3070223 Eh           -8.3545 eV

 SCC (total)                   0 d,  0 h,  0 min,  0.051 sec
 SCC setup                      ...        0 min,  0.000 sec (  0.770%)
 Dispersion                     ...        0 min,  0.001 sec (  1.165%)
 integral evaluation            ...        0 min,  0.012 sec ( 23.830%)
 zeroth order Hamiltonian       ...        0 min,  0.000 sec (  0.478%)
 iterations                     ...        0 min,  0.017 sec ( 33.899%)
 molecular gradient             ...        0 min,  0.020 sec ( 38.852%)
 printout                       ...        0 min,  0.000 sec (  0.882%)

         :::::::::::::::::::::::::::::::::::::::::::::::::::::
         ::                     SUMMARY                     ::
         :::::::::::::::::::::::::::::::::::::::::::::::::::::
         :: total energy             -42.270931502957 Eh    ::
         :: gradient norm              0.042524891701 Eh/a0 ::
         :: HOMO-LUMO gap              3.498756725772 eV    ::
         ::.................................................::
         :: SCC energy               -42.990067123268 Eh    ::
         :: -> isotropic ES            0.005053245671 Eh    ::
         :: -> anisotropic ES          0.010012840967 Eh    ::
         :: -> anisotropic XC          0.029381781193 Eh    ::
         :: -> dispersion             -0.032965986772 Eh    ::
         :: repulsion energy           0.718548573520 Eh    ::
         :: add. restraining           0.000000000000 Eh    ::
         :::::::::::::::::::::::::::::::::::::::::::::::::::::

      ----------------------------------------------------------- 
     |                   =====================                   |
     |                        A N C O P T                        |
     |                   =====================                   |
     |               Approximate Normal Coordinate               |
     |                Rational Function Optimizer                |
      ----------------------------------------------------------- 

          ...................................................
          :                      SETUP                      :
          :.................................................:
          :   optimization level            normal          :
          :   max. optcycles                   200          :
          :   ANC micro-cycles                  20          :
          :   degrees of freedom                99          :
          :.................................................:
          :   RF solver                   davidson          :
          :   input Hessian                  false          :
          :   write xtbopt.log                true          :
          :   linear?                        false          :
          :   energy convergence         0.5000000E-05 Eh   :
          :   grad. convergence          0.1000000E-02 Eh/α :
          :   maximium RF displ.         2.0000000          :
          :   Hlow (freq-cutoff)         0.5000000E-02      :
          :   Hmax (freq-cutoff)         5.0000000          :
          :   S6 in model hess.         20.0000000          :
          ...................................................

generating ANC from model Hessian ...
Using Lindh-Hessian (1995)
 Shifting diagonal of input Hessian by   4.504968072832289E-003
 Lowest  eigenvalues of input Hessian
   -0.000000   -0.000000   -0.000000   -0.000000    0.000000    0.000000
    0.005000    0.005094    0.005389    0.005849    0.006740    0.006858
    0.008378    0.008918    0.009856    0.010808    0.011924    0.012504
 Highest eigenvalues
    1.610576    1.755883    1.766831    1.897754    1.908676    1.990202
 

........................................................................
.............................. CYCLE    1 ..............................
........................................................................
   1    -42.9900671 -0.429901E+02  0.888E-05    3.50       0.0  T
   2    -42.9900671 -0.400888E-10  0.596E-05    3.50     283.4  T
   3    -42.9900671 -0.363443E-10  0.412E-05    3.50     410.5  T
     SCC iter.                  ...        0 min,  0.005 sec
     gradient                   ...        0 min,  0.020 sec
 * total energy  :   -42.2709315 Eh     change        0.3909691E-07 Eh
   gradient norm :     0.0425257 Eh/α   predicted     0.0000000E+00 (-100.00%)
   displ. norm   :     0.3028272 α      lambda       -0.6138037E-02
   maximum displ.:     0.1080421 α      in ANC's #9, #16, #14, ...

........................................................................
.............................. CYCLE    2 ..............................
........................................................................
   1    -43.0272218 -0.430272E+02  0.102E-01    3.57       0.0  T
   2    -43.0272359 -0.140766E-04  0.607E-02    3.57       1.0  T
   3    -43.0272292  0.662302E-05  0.180E-02    3.57       1.0  T
   4    -43.0272360 -0.672485E-05  0.677E-03    3.57       2.5  T
   5    -43.0272374 -0.146900E-05  0.225E-03    3.57       7.5  T
   6    -43.0272375 -0.112209E-06  0.965E-04    3.57      17.5  T
     SCC iter.                  ...        0 min,  0.009 sec
     gradient                   ...        0 min,  0.019 sec
 * total energy  :   -42.2748963 Eh     change       -0.3964863E-02 Eh
   gradient norm :     0.0134604 Eh/α   predicted    -0.3350460E-02 ( -15.50%)
   displ. norm   :     0.2639054 α      lambda       -0.1229526E-02
   maximum displ.:     0.1390177 α      in ANC's #9, #10, #16, ...

........................................................................
.............................. CYCLE    3 ..............................
........................................................................
   1    -43.0402797 -0.430403E+02  0.683E-02    3.60       0.0  T
   2    -43.0402840 -0.428353E-05  0.411E-02    3.60       1.0  T
   3    -43.0402728  0.111853E-04  0.203E-02    3.60       1.0  T
   4    -43.0402849 -0.120784E-04  0.565E-03    3.60       3.0  T
   5    -43.0402856 -0.765910E-06  0.142E-03    3.60      11.9  T
   6    -43.0402857 -0.446833E-07  0.571E-04    3.60      29.6  T
     SCC iter.                  ...        0 min,  0.009 sec
     gradient                   ...        0 min,  0.019 sec
 * total energy  :   -42.2756504 Eh     change       -0.7540496E-03 Eh
   gradient norm :     0.0050639 Eh/α   predicted    -0.6575910E-03 ( -12.79%)
   displ. norm   :     0.1579565 α      lambda       -0.2490836E-03
   maximum displ.:     0.0909743 α      in ANC's #10, #9, #6, ...

........................................................................
.............................. CYCLE    4 ..............................
........................................................................
   1    -43.0410462 -0.430410E+02  0.468E-02    3.61       0.0  T
   2    -43.0410469 -0.617185E-06  0.283E-02    3.61       1.0  T
   3    -43.0410401  0.674029E-05  0.149E-02    3.61       1.1  T
   4    -43.0410475 -0.735835E-05  0.221E-03    3.61       7.6  T
   5    -43.0410476 -0.106177E-06  0.722E-04    3.61      23.4  T
   6    -43.0410476 -0.864021E-08  0.338E-04    3.61      50.0  T
     SCC iter.                  ...        0 min,  0.009 sec
     gradient                   ...        0 min,  0.019 sec
 * total energy  :   -42.2758095 Eh     change       -0.1591401E-03 Eh
   gradient norm :     0.0029520 Eh/α   predicted    -0.1276731E-03 ( -19.77%)
   displ. norm   :     0.0902120 α      lambda       -0.7058358E-04
   maximum displ.:     0.0486018 α      in ANC's #10, #6, #9, ...

........................................................................
.............................. CYCLE    5 ..............................
........................................................................
   1    -43.0399274 -0.430399E+02  0.272E-02    3.61       0.0  T
   2    -43.0399275 -0.850913E-07  0.165E-02    3.61       1.0  T
   3    -43.0399250  0.245114E-05  0.895E-03    3.61       1.9  T
   4    -43.0399277 -0.266303E-05  0.100E-03    3.61      16.8  T
   5    -43.0399277 -0.226741E-07  0.350E-04    3.61      48.2  T
   6    -43.0399277 -0.107583E-08  0.168E-04    3.61     100.6  T
     SCC iter.                  ...        0 min,  0.009 sec
     gradient                   ...        0 min,  0.020 sec
 * total energy  :   -42.2758461 Eh     change       -0.3663153E-04 Eh
   gradient norm :     0.0014328 Eh/α   predicted    -0.3559416E-04 (  -2.83%)
   displ. norm   :     0.0700994 α      lambda       -0.2341462E-04
   maximum displ.:     0.0425128 α      in ANC's #6, #2, #10, ...

........................................................................
.............................. CYCLE    6 ..............................
........................................................................
   1    -43.0390689 -0.430391E+02  0.247E-02    3.60       0.0  T
   2    -43.0390690 -0.494474E-07  0.147E-02    3.60       1.1  T
   3    -43.0390683  0.632786E-06  0.460E-03    3.60       3.7  T
   4    -43.0390690 -0.679586E-06  0.557E-04    3.60      30.3  T
   5    -43.0390690 -0.555973E-08  0.254E-04    3.60      66.5  T
     SCC iter.                  ...        0 min,  0.008 sec
     gradient                   ...        0 min,  0.020 sec
 * total energy  :   -42.2758548 Eh     change       -0.8623601E-05 Eh
   gradient norm :     0.0018022 Eh/α   predicted    -0.1173357E-04 (  36.06%)
   displ. norm   :     0.0394134 α      lambda       -0.1580751E-04
   maximum displ.:     0.0230457 α      in ANC's #2, #9, #6, ...

........................................................................
.............................. CYCLE    7 ..............................
........................................................................
   1    -43.0394559 -0.430395E+02  0.152E-02    3.60       0.0  T
   2    -43.0394559 -0.172574E-07  0.902E-03    3.60       1.9  T
   3    -43.0394557  0.193820E-06  0.243E-03    3.60       7.0  T
   4    -43.0394560 -0.209496E-06  0.346E-04    3.60      48.9  T
   5    -43.0394560 -0.221315E-08  0.150E-04    3.60     112.9  T
     SCC iter.                  ...        0 min,  0.008 sec
     gradient                   ...        0 min,  0.020 sec
 * total energy  :   -42.2758715 Eh     change       -0.1668574E-04 Eh
   gradient norm :     0.0009727 Eh/α   predicted    -0.7912605E-05 ( -52.58%)
   displ. norm   :     0.0686731 α      lambda       -0.1290486E-04
   maximum displ.:     0.0451056 α      in ANC's #2, #6, #9, ...

........................................................................
.............................. CYCLE    8 ..............................
........................................................................
   1    -43.0399209 -0.430399E+02  0.277E-02    3.60       0.0  T
   2    -43.0399209 -0.426819E-07  0.163E-02    3.60       1.0  T
   3    -43.0399206  0.303990E-06  0.282E-03    3.60       6.0  T
   4    -43.0399210 -0.334161E-06  0.528E-04    3.60      32.0  T
   5    -43.0399210 -0.590014E-08  0.183E-04    3.60      92.2  T
     SCC iter.                  ...        0 min,  0.008 sec
     gradient                   ...        0 min,  0.020 sec
 * total energy  :   -42.2758849 Eh     change       -0.1345953E-04 Eh
   gradient norm :     0.0007299 Eh/α   predicted    -0.6466057E-05 ( -51.96%)
   displ. norm   :     0.0828703 α      lambda       -0.9723024E-05
   maximum displ.:     0.0546166 α      in ANC's #2, #6, #9, ...

........................................................................
.............................. CYCLE    9 ..............................
........................................................................
   1    -43.0399221 -0.430399E+02  0.281E-02    3.60       0.0  T
   2    -43.0399221 -0.406601E-07  0.165E-02    3.60       1.0  T
   3    -43.0399219  0.233265E-06  0.260E-03    3.60       6.5  T
   4    -43.0399222 -0.263151E-06  0.444E-04    3.60      38.1  T
   5    -43.0399222 -0.302330E-08  0.210E-04    3.60      80.4  T
     SCC iter.                  ...        0 min,  0.007 sec
     gradient                   ...        0 min,  0.020 sec
 * total energy  :   -42.2758962 Eh     change       -0.1126362E-04 Eh
   gradient norm :     0.0007884 Eh/α   predicted    -0.4879843E-05 ( -56.68%)
   displ. norm   :     0.0862011 α      lambda       -0.8209143E-05
   maximum displ.:     0.0581682 α      in ANC's #2, #6, #9, ...

........................................................................
.............................. CYCLE   10 ..............................
........................................................................
   1    -43.0398213 -0.430398E+02  0.295E-02    3.60       0.0  T
   2    -43.0398214 -0.397410E-07  0.174E-02    3.60       1.0  T
   3    -43.0398211  0.229448E-06  0.286E-03    3.60       5.9  T
   4    -43.0398214 -0.263861E-06  0.301E-04    3.60      56.2  T
   5    -43.0398214 -0.141867E-09  0.192E-04    3.60      88.1  T
     SCC iter.                  ...        0 min,  0.008 sec
     gradient                   ...        0 min,  0.020 sec
 * total energy  :   -42.2759057 Eh     change       -0.9512767E-05 Eh
   gradient norm :     0.0003518 Eh/α   predicted    -0.4119725E-05 ( -56.69%)
   displ. norm   :     0.0861972 α      lambda       -0.3266649E-05
   maximum displ.:     0.0581695 α      in ANC's #2, #6, #9, ...

........................................................................
.............................. CYCLE   11 ..............................
........................................................................
   1    -43.0396358 -0.430396E+02  0.296E-02    3.60       0.0  T
   2    -43.0396359 -0.398269E-07  0.174E-02    3.60       1.0  T
   3    -43.0396357  0.221630E-06  0.282E-03    3.60       6.0  T
   4    -43.0396359 -0.255563E-06  0.300E-04    3.60      56.4  T
   5    -43.0396359 -0.181210E-09  0.188E-04    3.60      90.0  T
     SCC iter.                  ...        0 min,  0.008 sec
     gradient                   ...        0 min,  0.020 sec
 * total energy  :   -42.2759098 Eh     change       -0.4113987E-05 Eh
   gradient norm :     0.0004982 Eh/α   predicted    -0.1640358E-05 ( -60.13%)
   displ. norm   :     0.0400103 α      lambda       -0.2809084E-05
   maximum displ.:     0.0271221 α      in ANC's #2, #6, #4, ...

   *** GEOMETRY OPTIMIZATION CONVERGED AFTER 11 ITERATIONS ***

------------------------------------------------------------------------
 total energy gain   :        -0.0049783 Eh       -3.1239 kcal/mol
 total RMSD          :         0.1572329 a0        0.0832 Å
 total power (kW/mol):        -1.1882306 (step)  -28.4815 (real)
------------------------------------------------------------------------

 ANCopt (total)                0 d,  0 h,  0 min,  0.459 sec
 optimizer setup                ...        0 min,  0.000 sec (  0.032%)
 model hessian                  ...        0 min,  0.013 sec (  2.810%)
 ANC generation                 ...        0 min,  0.001 sec (  0.274%)
 coordinate transformation      ...        0 min,  0.000 sec (  0.058%)
 single point calculation       ...        0 min,  0.440 sec ( 95.957%)
 optimization log               ...        0 min,  0.002 sec (  0.336%)
 hessian update                 ...        0 min,  0.000 sec (  0.041%)
 rational function              ...        0 min,  0.002 sec (  0.328%)

================
 final structure:
================
$coord
    1.92817512551661   -0.40286654975620   -1.99653562070955      C 
    0.65850874697712    1.86251667212181   -1.71649643783202      C 
   -1.74931959025657    1.93392144341127   -0.67907223810037      C 
   -3.06308654903462    4.43338170417085   -0.35274697626049      C 
   -2.44532704563305    5.59058978759328    2.22345374932180      C 
   -2.89094140143639   -0.31628639713638    0.09971840982442      C 
   -1.62213689980043   -2.61273936077732   -0.19868231735315      C 
    0.78396071364389   -2.62640697661251   -1.24264354096175      C 
   -2.79447938528016   -5.05839160161666    0.65208048254542      C 
   -2.11557592349752   -5.61786175736631    3.40592353441293      C 
   -5.42846474397739   -0.26498629169761    1.26729878280527      C 
   -7.61539752996481   -0.46883356939500    0.01357123998212      C 
  -10.09958567927102   -0.39698520004653    1.37894406571523      C 
   -7.63204178197995   -0.76416478982271   -2.72156960563367      C 
   -9.67763632272397   -0.98318303305208   -4.15991102498605      C 
    3.80171571352147   -0.43607241826276   -2.80632171196660      H 
    1.53854814037095    3.60560221635867   -2.31653853524024      H 
   -5.10369612741886    4.18499232638496   -0.51808355158199      H 
   -2.44833035673023    5.72864435309080   -1.83750636269610      H 
   -3.06904500500958    4.34841585455211    3.73667480227222      H 
   -3.38468034009349    7.40625948400020    2.43938328307602      H 
   -0.41780038574891    5.87261276840415    2.41349357237224      H 
    1.76203324090750   -4.40516121193248   -1.47120605481691      H 
   -2.10526834101605   -6.59773117830978   -0.53766125025034      H 
   -4.84545163479567   -4.96379520481775    0.46003467969158      H 
   -0.07460917805749   -5.70999132169842    3.63486521844598      H 
   -2.92483126628588   -7.41315227838257    3.99512905695253      H 
   -2.83747472307881   -4.14022382781174    4.63790156234570      H 
   -5.45215768380228   -0.04395919643210    3.30398170767420      H 
   -9.81398555907269   -0.18546702770728    3.40262658359761      H 
  -11.15194383400834   -2.13353661278204    1.04232749856304      H 
  -11.23998059692177    1.18015130106902    0.70833291783283      H 
   -5.78100165533350   -0.79816298946083   -3.59294960208805      H 
  -11.56588490809864   -0.96070211358692   -3.40268835643751      H 
   -9.53022859459257   -1.19674984158473   -6.17818503330172      H 
$end
           -------------------------------------------------
          |                Final Singlepoint                |
           -------------------------------------------------

          ...................................................
          :                      SETUP                      :
          :.................................................:
          :  # basis functions                  80          :
          :  # atomic orbitals                  80          :
          :  # shells                           50          :
          :  # electrons                        80          :
          :  max. iterations                   250          :
          :  Hamiltonian                  GFN2-xTB          :
          :  restarted?                      false          :
          :  GBSA solvation                  false          :
          :  PC potential                    false          :
          :  electronic temp.          300.0000000     K    :
          :  accuracy                    1.0000000          :
          :  -> integral cutoff          0.2500000E+02      :
          :  -> integral neglect         0.1000000E-07      :
          :  -> SCF convergence          0.1000000E-05 Eh   :
          :  -> wf. convergence          0.1000000E-03 e    :
          :  Broyden damping             0.4000000          :
          ...................................................

 iter      E             dE          RMSdq      gap      omega  full diag
   1    -43.0396359 -0.430396E+02  0.111E-04    3.60       0.0  T
   2    -43.0396359  0.420357E-10  0.683E-05    3.60     247.4  T
   3    -43.0396359 -0.164185E-09  0.491E-05    3.60     344.5  T

   *** convergence criteria satisfied after 3 iterations ***

         #    Occupation            Energy/Eh            Energy/eV
      -------------------------------------------------------------
         1        2.0000           -0.6398253             -17.4105
       ...           ...                  ...                  ...
        34        2.0000           -0.4251774             -11.5697
        35        2.0000           -0.4232811             -11.5181
        36        2.0000           -0.4123819             -11.2215
        37        2.0000           -0.4051427             -11.0245
        38        2.0000           -0.3840745             -10.4512
        39        2.0000           -0.3825379             -10.4094
        40        2.0000           -0.3722325             -10.1290 (HOMO)
        41                         -0.2397643              -6.5243 (LUMO)
        42                         -0.2118866              -5.7657
        43                         -0.2112966              -5.7497
        44                         -0.1372547              -3.7349
        45                         -0.0876973              -2.3864
       ...                                ...                  ...
        80                          0.6774602              18.4346
      -------------------------------------------------------------
                  HL-Gap            0.1324682 Eh            3.6046 eV
             Fermi-level           -0.3059984 Eh           -8.3266 eV

 SCC (total)                   0 d,  0 h,  0 min,  0.038 sec
 SCC setup                      ...        0 min,  0.000 sec (  0.720%)
 Dispersion                     ...        0 min,  0.000 sec (  0.896%)
 integral evaluation            ...        0 min,  0.012 sec ( 31.155%)
 zeroth order Hamiltonian       ...        0 min,  0.000 sec (  0.580%)
 iterations                     ...        0 min,  0.005 sec ( 13.646%)
 molecular gradient             ...        0 min,  0.020 sec ( 51.748%)
 printout                       ...        0 min,  0.000 sec (  1.123%)

         :::::::::::::::::::::::::::::::::::::::::::::::::::::
         ::                     SUMMARY                     ::
         :::::::::::::::::::::::::::::::::::::::::::::::::::::
         :: total energy             -42.275909786323 Eh    ::
         :: gradient norm              0.000497671549 Eh/a0 ::
         :: HOMO-LUMO gap              3.604642353407 eV    ::
         ::.................................................::
         :: SCC energy               -43.039635913150 Eh    ::
         :: -> isotropic ES            0.005405478724 Eh    ::
         :: -> anisotropic ES          0.009198642933 Eh    ::
         :: -> anisotropic XC          0.028293436203 Eh    ::
         :: -> dispersion             -0.033745930784 Eh    ::
         :: repulsion energy           0.763113726601 Eh    ::
         :: add. restraining           0.000000000000 Eh    ::
         :::::::::::::::::::::::::::::::::::::::::::::::::::::

           -------------------------------------------------
          |                Property Printout                |
           -------------------------------------------------

    * Orbital Energies and Occupations

         #    Occupation            Energy/Eh            Energy/eV
      -------------------------------------------------------------
         1        2.0000           -0.6398253             -17.4105
       ...           ...                  ...                  ...
        28        2.0000           -0.4480272             -12.1914
        29        2.0000           -0.4473406             -12.1728
        30        2.0000           -0.4462568             -12.1433
        31        2.0000           -0.4414481             -12.0124
        32        2.0000           -0.4359793             -11.8636
        33        2.0000           -0.4316449             -11.7457
        34        2.0000           -0.4251774             -11.5697
        35        2.0000           -0.4232811             -11.5181
        36        2.0000           -0.4123819             -11.2215
        37        2.0000           -0.4051427             -11.0245
        38        2.0000           -0.3840745             -10.4512
        39        2.0000           -0.3825379             -10.4094
        40        2.0000           -0.3722325             -10.1290 (HOMO)
        41                         -0.2397643              -6.5243 (LUMO)
        42                         -0.2118866              -5.7657
        43                         -0.2112966              -5.7497
        44                         -0.1372547              -3.7349
        45                         -0.0876973              -2.3864
        46                          0.0845661               2.3012
        47                          0.0935744               2.5463
        48                          0.1139966               3.1020
        49                          0.1290173               3.5107
        50                          0.1309013               3.5620
        51                          0.1392046               3.7879
       ...                                ...                  ...
        80                          0.6774602              18.4346
      -------------------------------------------------------------
                  HL-Gap            0.1324682 Eh            3.6046 eV
             Fermi-level           -0.3059984 Eh           -8.3266 eV

     #   Z        covCN         q      C6AA      α(0)
     1   6 C      2.916    -0.037    28.912     8.817
     2   6 C      2.925    -0.043    29.080     8.843
     3   6 C      2.973     0.006    27.893     8.663
     4   6 C      3.806    -0.057    21.590     6.615
     5   6 C      3.753    -0.096    22.383     6.746
     6   6 C      2.979     0.001    27.996     8.679
     7   6 C      2.973     0.006    27.892     8.663
     8   6 C      2.925    -0.043    29.080     8.843
     9   6 C      3.806    -0.057    21.591     6.615
    10   6 C      3.753    -0.096    22.383     6.746
    11   6 C      2.911    -0.042    29.035     8.836
    12   6 C      2.946     0.009    27.825     8.652
    13   6 C      3.759    -0.106    22.579     6.774
    14   6 C      2.899    -0.031    28.769     8.794
    15   6 C      2.838    -0.090    30.241     9.012
    16   1 H      0.926     0.025     2.654     2.547
    17   1 H      0.926     0.026     2.638     2.540
    18   1 H      0.924     0.036     2.504     2.475
    19   1 H      0.924     0.033     2.546     2.495
    20   1 H      0.925     0.034     2.528     2.486
    21   1 H      0.925     0.033     2.546     2.495
    22   1 H      0.925     0.034     2.524     2.485
    23   1 H      0.926     0.026     2.638     2.540
    24   1 H      0.924     0.033     2.546     2.495
    25   1 H      0.924     0.036     2.504     2.474
    26   1 H      0.925     0.035     2.523     2.484
    27   1 H      0.925     0.033     2.546     2.495
    28   1 H      0.925     0.034     2.529     2.487
    29   1 H      0.925     0.031     2.570     2.507
    30   1 H      0.925     0.036     2.501     2.473
    31   1 H      0.925     0.044     2.395     2.420
    32   1 H      0.925     0.044     2.396     2.421
    33   1 H      0.925     0.033     2.541     2.493
    34   1 H      0.926     0.038     2.470     2.458
    35   1 H      0.926     0.030     2.582     2.513

 Mol. C6AA /au·bohr⁶  :      11828.536770
 Mol. C8AA /au·bohr⁸  :     275028.583514
 Mol. α(0) /au        :        171.084149


Wiberg/Mayer (AO) data.
largest (>0.10) Wiberg bond orders for each atom
          total WBO             WBO to atom ...
     1  C   3.992        C    8 1.440    C    2 1.440    H   16 0.971    C    6 0.106
     2  C   3.991        C    1 1.440    C    3 1.415    H   17 0.968    C    7 0.105
     3  C   3.988        C    2 1.415    C    6 1.377    C    4 1.011    C    8 0.105
     4  C   3.997        C    3 1.011    C    5 1.002    H   19 0.975    H   18 0.971
     5  C   3.997        C    4 1.002    H   22 0.989    H   20 0.988    H   21 0.987
     6  C   3.989        C    7 1.377    C    3 1.377    C   11 1.023    C    1 0.106
     7  C   3.988        C    8 1.415    C    6 1.377    C    9 1.011    C    2 0.105
     8  C   3.991        C    1 1.440    C    7 1.415    H   23 0.968    C    3 0.105
     9  C   3.997        C    7 1.011    C   10 1.002    H   24 0.975    H   25 0.972
    10  C   3.997        C    9 1.002    H   26 0.988    H   28 0.988    H   27 0.987
    11  C   3.990        C   12 1.788    C    6 1.023    H   29 0.952    C   15 0.131
    12  C   3.987        C   11 1.788    C   14 1.099    C   13 1.020
    13  C   3.996        C   12 1.020    H   30 0.985    H   31 0.973    H   32 0.973
    14  C   3.992        C   15 1.891    C   12 1.099    H   33 0.962
    15  C   3.991        C   14 1.891    H   35 0.979    H   34 0.975    C   11 0.131
    16  H   0.998        C    1 0.971
    17  H   0.998        C    2 0.968
    18  H   0.998        C    4 0.971
    19  H   0.999        C    4 0.975
    20  H   0.999        C    5 0.988
    21  H   0.998        C    5 0.987
    22  H   0.999        C    5 0.989
    23  H   0.998        C    8 0.968
    24  H   0.999        C    9 0.975
    25  H   0.998        C    9 0.972
    26  H   0.999        C   10 0.988
    27  H   0.998        C   10 0.987
    28  H   0.999        C   10 0.988
    29  H   0.998        C   11 0.952
    30  H   0.999        C   13 0.985
    31  H   0.998        C   13 0.973
    32  H   0.998        C   13 0.973
    33  H   0.999        C   14 0.962
    34  H   0.998        C   15 0.975
    35  H   0.998        C   15 0.979

molecular dipole:
                 x           y           z       tot (Debye)
 q only:       -0.235       0.017       0.220
   full:       -0.246       0.018       0.236       0.869
molecular quadrupole (traceless):
                xx          xy          yy          xz          yz          zz
 q only:        1.816      -0.089       0.086      -2.120      -0.355      -1.902
  q+dip:        5.017      -0.149      -0.783      -3.911      -0.556      -4.234
   full:        3.043      -0.113      -0.304      -2.821      -0.424      -2.739

           -------------------------------------------------
          |                Geometry Summary                 |
           -------------------------------------------------

      molecular mass/u    :      200.3230000
   center of mass at/Å    :       -1.9311942      -0.1983349      -0.1088202
  moments of inertia/u·Å² :        0.7687448E+03   0.9985430E+03   0.1313409E+04
rotational constants/cm⁻¹ :        0.2192878E-01   0.1688223E-01   0.1283502E-01

 * 30 selected distances

     #   Z        #   Z                                     value/Å
     1   6 C      2   6 C                                 1.3822000
     2   6 C      3   6 C                                 1.3879165
     4   6 C      5   6 C                                 1.5298228
     3   6 C      6   6 C                                 1.3973938
     6   6 C      7   6 C                                 1.3973290
     1   6 C      8   6 C                                 1.3821267
     7   6 C      8   6 C                                 1.3879531
     9   6 C     10   6 C                                 1.5298228 (max)
    11   6 C     12   6 C                                 1.3383124
    14   6 C     15   6 C                                 1.3283564
     1   6 C     16   1 H                                 1.0802231
     2   6 C     17   1 H                                 1.0809820
     4   6 C     18   1 H                                 1.0913273
     4   6 C     19   1 H                                 1.0922276
     5   6 C     20   1 H                                 1.0873090
     5   6 C     21   1 H                                 1.0877993
     5   6 C     22   1 H                                 1.0879087
     8   6 C     23   1 H                                 1.0809776
     9   6 C     24   1 H                                 1.0922177
     9   6 C     25   1 H                                 1.0912242
    10   6 C     26   1 H                                 1.0878998
    10   6 C     27   1 H                                 1.0877297
    10   6 C     28   1 H                                 1.0873687
    11   6 C     29   1 H                                 1.0841668
    13   6 C     30   1 H                                 1.0872756
    13   6 C     31   1 H                                 1.0891773
    13   6 C     32   1 H                                 1.0893316
    14   6 C     33   1 H                                 1.0827862
    15   6 C     34   1 H                                 1.0766351 (min)
    15   6 C     35   1 H                                 1.0768165

 * 2 distinct bonds (by element types)

   Z      Z             #   av. dist./Å        max./Å        min./Å
   1 H    6 C          20     1.0860692     1.0922276     1.0766351
   6 C    6 C          10     1.4061234     1.5298228     1.3283564


optimized geometry written to: xtbopt.xyz


           -------------------------------------------------
          | TOTAL ENERGY              -42.275909786323 Eh   |
          | GRADIENT NORM               0.000497671549 Eh/α |
          | HOMO-LUMO GAP               3.604642353407 eV   |
           -------------------------------------------------

------------------------------------------------------------------------
 * finished run on 2021/05/19 at 10:58:58.068     
------------------------------------------------------------------------
 total:
 * wall-time:     0 d,  0 h,  0 min,  0.581 sec
 *  cpu-time:     0 d,  0 h,  0 min,  0.573 sec
 * ratio c/w:     0.986 speedup
 SCF:
 * wall-time:     0 d,  0 h,  0 min,  0.051 sec
 *  cpu-time:     0 d,  0 h,  0 min,  0.051 sec
 * ratio c/w:     0.999 speedup
 ANC optimizer:
 * wall-time:     0 d,  0 h,  0 min,  0.497 sec
 *  cpu-time:     0 d,  0 h,  0 min,  0.497 sec
 * ratio c/w:     1.000 speedup

