      -----------------------------------------------------------      
     |                   =====================                   |     
     |                           x T B                           |     
     |                   =====================                   |     
     |                         S. Grimme                         |     
     |          Mulliken Center for Theoretical Chemistry        |     
     |                    University of Bonn                     |     
     |                Version 6.2 RC2 (SAW190805)                |     
      -----------------------------------------------------------      

   This program is distributed in the hope that it will be useful,
   but WITHOUT ANY WARRANTY; without even the implied warranty of
   MERCHANTABILITY or FITNESS FOR A PARTICULAR PURPOSE.
   
   FOR NON-COMMERCIAL, ACADEMIA USE ONLY.
   
   Cite this work as:
   * S. Grimme, C. Bannwarth, P. Shushkov, J. Chem. Theory Comput., 2017,
     13, 1989-2009. DOI: 10.1021/acs.jctc.7b00118
   * C. Bannwarth, S. Ehlert and S. Grimme., J. Chem. Theory Comput., 2019,
     15, 1652-1671. DOI: 10.1021/acs.jctc.8b01176
   * P. Pracht, E. Caldeweyher, S. Ehlert, S. Grimme, ChemRxiv, 2019, preprint.
     DOI: 10.26434/chemrxiv.8326202.v1
   
   for DFT-D4:
   * E. Caldeweyher, C. Bannwarth and S. Grimme, J. Chem. Phys., 2017,
     147, 034112. DOI: 10.1063/1.4993215
   * E. Caldeweyher, S. Ehlert, A. Hansen, H. Neugebauer, S. Spicher,
     C. Bannwarth and S. Grimme, J. Chem. Phys., 2019, 150, 154122.
     DOI: 10.1063/1.5090222
   
   for sTDA-xTB:
   * S. Grimme and C. Bannwarth, J. Chem. Phys., 2016, 145, 054103.
     DOI: 10.1063/1.4959605
   
   in the mass-spec context:
   * V. Asgeirsson, C. Bauer and S. Grimme, Chem. Sci., 2017, 8, 4879.
     DOI: 10.1039/c7sc00601b
   
   for metadynamics refer to:
   * S. Grimme, J. Chem. Theory Comput., 2019, 155, 2847-2862
     DOI: 10.1021/acs.jctc.9b00143
   
   with help from (in alphabetical order)
   C. Bannwarth, F. Bohle, G. Brandenburg, E. Caldeweyher, M. Checinski,
   S. Dohm, S. Ehlert, S. Ehrlich, F. März, H. Neugebauer, J. Pisarek,
   P. Pracht, P. Shushkov, and S. Spicher.
   
 * started run on 2021/05/19 at 10:58:59.572     

           -------------------------------------------------
          |                Calculation Setup                |
           -------------------------------------------------

          program call               : /ihome/ghutchison/geoffh/xtb/xtb 224.xyz -opt
          hostname                   : smp-n83
          coordinate file            : 224.xyz
          omp threads                :                     1
          number of atoms            :                    18
          number of electrons        :                    45
          charge                     :                     0
          spin                       :                   0.5
          first test random number   :      0.50611349428987


########################################################################
# WARNING! Please study the warnings concerning your input carefully
#  - the use of '-opt' is discouraged, please use '--opt' next time
########################################################################

           ------------------------------------------------- 
          |                 G F N 2 - x T B                 |
          | Geometry, Frequencies, Noncovalent interactions |
          |            JCTC 2019 parametrisation            |
           ------------------------------------------------- 
             KAB for C  - Si     :                1.0500
             KAB for H  - Pd     :                0.9500
             k(s)              :                1.8500
             k(p)              :                2.2300
             k(d)              :                2.2300
             k(f)              :                2.0000
             kEN (H0ij)        :               -2.0000
             D4 a1             :                0.5200
             D4 a2             :                5.0000
             D4 s6             :                1.0000
             D4 s8             :                2.7000
             D4 s9             :                5.0000
             alphaj            :                2.0000

  Z AO/shell   Hii/eV     exponent
  1     Wed Apr 25 08:07:45 CEST 2018   EN: 2.200 GM2: 0.406  GM3: 0.0800  RAES: 1.40
     1s    -10.707211    1.230000
  6     Wed Apr 25 08:07:45 CEST 2018   EN: 2.550 GM2: 0.538  GM3: 0.1500  RAES: 3.00
     2s    -13.970922    2.096432
     2p    -10.063292    1.800000

           ------------------------------------------------- 
          |        Self-Consistent Charge Iterations        |
           ------------------------------------------------- 

          ...................................................
          :                      SETUP                      :
          :.................................................:
          :  # basis functions                  45          :
          :  # atomic orbitals                  45          :
          :  # shells                           27          :
          :  # electrons                        45          :
          :  max. iterations                   250          :
          :  Hamiltonian                  GFN2-xTB          :
          :  restarted?                      false          :
          :  GBSA solvation                  false          :
          :  PC potential                    false          :
          :  electronic temp.          300.0000000     K    :
          :  accuracy                    1.0000000          :
          :  -> integral cutoff          0.2500000E+02      :
          :  -> integral neglect         0.1000000E-07      :
          :  -> SCF convergence          0.1000000E-05 Eh   :
          :  -> wf. convergence          0.1000000E-03 e    :
          :  Broyden damping             0.4000000          :
          ...................................................

 iter      E             dE          RMSdq      gap      omega  full diag
   1    -24.0923790 -0.240924E+02  0.404E+00    1.94       0.0  T
   2    -24.1069890 -0.146100E-01  0.240E+00    1.82       1.0  T
   3    -24.0807105  0.262785E-01  0.128E+00    2.14       1.0  T
   4    -24.1059964 -0.252860E-01  0.511E-01    1.81       1.0  T
   5    -24.1098085 -0.381208E-02  0.205E-01    1.90       1.0  T
   6    -24.1106228 -0.814242E-03  0.542E-02    1.88       1.0  T
   7    -24.1106439 -0.211579E-04  0.269E-02    1.88       1.0  T
   8    -24.1106436  0.285022E-06  0.152E-02    1.88       1.5  T
   9    -24.1106469 -0.329772E-05  0.229E-03    1.88      10.3  T
  10    -24.1106470 -0.619062E-07  0.880E-04    1.88      26.8  T
  11    -24.1106470 -0.236632E-08  0.292E-04    1.88      80.8  T

   *** convergence criteria satisfied after 11 iterations ***

         #    Occupation            Energy/Eh            Energy/eV
      -------------------------------------------------------------
         1        2.0000           -0.6562391             -17.8572
       ...           ...                  ...                  ...
        17        2.0000           -0.4368114             -11.8862
        18        2.0000           -0.4310498             -11.7295
        19        2.0000           -0.4248516             -11.5608
        20        2.0000           -0.4108412             -11.1796
        21        2.0000           -0.4066459             -11.0654
        22        2.0000           -0.3776541             -10.2765
        23        1.0000           -0.3083387              -8.3903 (HOMO)
        24                         -0.2392073              -6.5092 (LUMO)
        25                         -0.1686829              -4.5901
        26                         -0.1225467              -3.3347
        27                          0.0125727               0.3421
        28                          0.0178279               0.4851
       ...                                ...                  ...
        45                          0.7543967              20.5282
      -------------------------------------------------------------
                  HL-Gap            0.0691314 Eh            1.8812 eV
             Fermi-level           -0.3083847 Eh           -8.3916 eV

 SCC (total)                   0 d,  0 h,  0 min,  0.020 sec
 SCC setup                      ...        0 min,  0.000 sec (  1.182%)
 Dispersion                     ...        0 min,  0.000 sec (  1.157%)
 integral evaluation            ...        0 min,  0.004 sec ( 20.785%)
 zeroth order Hamiltonian       ...        0 min,  0.000 sec (  0.482%)
 iterations                     ...        0 min,  0.008 sec ( 39.747%)
 molecular gradient             ...        0 min,  0.007 sec ( 34.647%)
 printout                       ...        0 min,  0.000 sec (  1.725%)

         :::::::::::::::::::::::::::::::::::::::::::::::::::::
         ::                     SUMMARY                     ::
         :::::::::::::::::::::::::::::::::::::::::::::::::::::
         :: total energy             -23.689233160439 Eh    ::
         :: gradient norm              0.145719894614 Eh/a0 ::
         :: HOMO-LUMO gap              1.881161091735 eV    ::
         ::.................................................::
         :: SCC energy               -24.110647000309 Eh    ::
         :: -> isotropic ES            0.002601639173 Eh    ::
         :: -> anisotropic ES          0.003733798594 Eh    ::
         :: -> anisotropic XC          0.016452852372 Eh    ::
         :: -> dispersion             -0.013254908213 Eh    ::
         :: repulsion energy           0.421423858351 Eh    ::
         :: add. restraining           0.000000000000 Eh    ::
         :::::::::::::::::::::::::::::::::::::::::::::::::::::

      ----------------------------------------------------------- 
     |                   =====================                   |
     |                        A N C O P T                        |
     |                   =====================                   |
     |               Approximate Normal Coordinate               |
     |                Rational Function Optimizer                |
      ----------------------------------------------------------- 

          ...................................................
          :                      SETUP                      :
          :.................................................:
          :   optimization level            normal          :
          :   max. optcycles                   200          :
          :   ANC micro-cycles                  20          :
          :   degrees of freedom                48          :
          :.................................................:
          :   RF solver                   davidson          :
          :   input Hessian                  false          :
          :   write xtbopt.log                true          :
          :   linear?                        false          :
          :   energy convergence         0.5000000E-05 Eh   :
          :   grad. convergence          0.1000000E-02 Eh/α :
          :   maximium RF displ.         2.0000000          :
          :   Hlow (freq-cutoff)         0.5000000E-02      :
          :   Hmax (freq-cutoff)         5.0000000          :
          :   S6 in model hess.         20.0000000          :
          ...................................................

generating ANC from model Hessian ...
Using Lindh-Hessian (1995)
 Shifting diagonal of input Hessian by   3.613592477046626E-003
 Lowest  eigenvalues of input Hessian
   -0.000000   -0.000000   -0.000000    0.000000    0.000000    0.000000
    0.005000    0.007352    0.009597    0.010671    0.013971    0.017690
    0.029524    0.034000    0.044188    0.044492    0.047100    0.057951
 Highest eigenvalues
    1.603732    1.649348    1.712341    1.815210    1.850520    1.989251
 

........................................................................
.............................. CYCLE    1 ..............................
........................................................................
   1    -24.1106470 -0.241106E+02  0.122E-04    1.88       0.0  T
   2    -24.1106470 -0.142535E-10  0.834E-05    1.88     282.5  T
   3    -24.1106470 -0.174971E-10  0.599E-05    1.88     393.7  T
     SCC iter.                  ...        0 min,  0.003 sec
     gradient                   ...        0 min,  0.007 sec
 * total energy  :   -23.6892332 Eh     change       -0.3460262E-07 Eh
   gradient norm :     0.1457209 Eh/α   predicted     0.0000000E+00 (-100.00%)
   displ. norm   :     0.2268068 α      lambda       -0.1677199E-01
   maximum displ.:     0.1542179 α      in ANC's #14, #17, #46, ...

........................................................................
.............................. CYCLE    2 ..............................
........................................................................
   1    -24.1244958 -0.241245E+02  0.314E-01    1.98       0.0  T
   2    -24.1245052 -0.944423E-05  0.180E-01    1.98       1.0  T
   3    -24.1241729  0.332378E-03  0.181E-01    1.97       1.0  T
   4    -24.1246024 -0.429519E-03  0.477E-02    1.98       1.0  T
   5    -24.1246447 -0.422623E-04  0.970E-03    1.98       2.4  T
   6    -24.1246458 -0.116213E-05  0.393E-03    1.98       6.0  T
   7    -24.1246458 -0.319793E-07  0.195E-03    1.98      12.1  T
     SCC iter.                  ...        0 min,  0.004 sec
     gradient                   ...        0 min,  0.006 sec
 * total energy  :   -23.7017849 Eh     change       -0.1255171E-01 Eh
   gradient norm :     0.0816895 Eh/α   predicted    -0.8817385E-02 ( -29.75%)
   displ. norm   :     0.1884470 α      lambda       -0.9615026E-02
   maximum displ.:     0.1214420 α      in ANC's #14, #46, #4, ...

........................................................................
.............................. CYCLE    3 ..............................
........................................................................
   1    -24.1403451 -0.241403E+02  0.347E-01    2.16       0.0  T
   2    -24.1403558 -0.106270E-04  0.197E-01    2.13       1.0  T
   3    -24.1399949  0.360849E-03  0.196E-01    2.16       1.0  T
   4    -24.1405084 -0.513487E-03  0.392E-02    2.15       1.0  T
   5    -24.1405343 -0.259172E-04  0.802E-03    2.14       2.9  T
   6    -24.1405351 -0.793464E-06  0.315E-03    2.14       7.5  T
   7    -24.1405351 -0.110891E-07  0.152E-03    2.14      15.5  T
     SCC iter.                  ...        0 min,  0.004 sec
     gradient                   ...        0 min,  0.006 sec
 * total energy  :   -23.7065253 Eh     change       -0.4740361E-02 Eh
   gradient norm :     0.0193065 Eh/α   predicted    -0.4978242E-02 (   5.02%)
   displ. norm   :     0.0563306 α      lambda       -0.4227408E-03
   maximum displ.:     0.0326521 α      in ANC's #4, #21, #12, ...

........................................................................
.............................. CYCLE    4 ..............................
........................................................................
   1    -24.1359157 -0.241359E+02  0.404E-02    2.12       0.0  T
   2    -24.1359173 -0.162818E-05  0.261E-02    2.12       1.0  T
   3    -24.1359156  0.172186E-05  0.148E-02    2.12       1.6  T
   4    -24.1359184 -0.273694E-05  0.398E-03    2.12       5.9  T
   5    -24.1359186 -0.251788E-06  0.946E-04    2.12      24.9  T
   6    -24.1359186 -0.796014E-08  0.582E-04    2.12      40.5  T
     SCC iter.                  ...        0 min,  0.004 sec
     gradient                   ...        0 min,  0.006 sec
 * total energy  :   -23.7067990 Eh     change       -0.2737626E-03 Eh
   gradient norm :     0.0082276 Eh/α   predicted    -0.2120421E-03 ( -22.55%)
   displ. norm   :     0.0435897 α      lambda       -0.1131326E-03
   maximum displ.:     0.0251320 α      in ANC's #4, #2, #12, ...

........................................................................
.............................. CYCLE    5 ..............................
........................................................................
   1    -24.1345198 -0.241345E+02  0.353E-02    2.11       0.0  T
   2    -24.1345192  0.603281E-06  0.216E-02    2.11       1.1  T
   3    -24.1345153  0.388250E-05  0.212E-02    2.11       1.1  T
   4    -24.1345213 -0.592970E-05  0.247E-03    2.11       9.5  T
   5    -24.1345214 -0.105810E-06  0.664E-04    2.11      35.5  T
   6    -24.1345214 -0.316225E-08  0.369E-04    2.11      64.0  T
     SCC iter.                  ...        0 min,  0.004 sec
     gradient                   ...        0 min,  0.006 sec
 * total energy  :   -23.7068652 Eh     change       -0.6618505E-04 Eh
   gradient norm :     0.0025327 Eh/α   predicted    -0.5667309E-04 ( -14.37%)
   displ. norm   :     0.0191321 α      lambda       -0.1320112E-04
   maximum displ.:     0.0113552 α      in ANC's #2, #1, #4, ...

........................................................................
.............................. CYCLE    6 ..............................
........................................................................
   1    -24.1346553 -0.241347E+02  0.139E-02    2.11       0.0  T
   2    -24.1346550  0.227225E-06  0.922E-03    2.11       2.6  T
   3    -24.1346549  0.157815E-06  0.806E-03    2.11       2.9  T
   4    -24.1346557 -0.774962E-06  0.121E-03    2.11      19.5  T
   5    -24.1346557 -0.264319E-07  0.245E-04    2.11      96.2  T
   6    -24.1346557 -0.683169E-09  0.117E-04    2.11     201.8  T
     SCC iter.                  ...        0 min,  0.004 sec
     gradient                   ...        0 min,  0.007 sec
 * total energy  :   -23.7068737 Eh     change       -0.8526332E-05 Eh
   gradient norm :     0.0010307 Eh/α   predicted    -0.6602639E-05 ( -22.56%)
   displ. norm   :     0.0221822 α      lambda       -0.3714815E-05
   maximum displ.:     0.0145743 α      in ANC's #1, #2, #4, ...

........................................................................
.............................. CYCLE    7 ..............................
........................................................................
   1    -24.1350885 -0.241351E+02  0.154E-02    2.11       0.0  T
   2    -24.1350883  0.170316E-06  0.983E-03    2.11       2.4  T
   3    -24.1350875  0.818647E-06  0.926E-03    2.11       2.5  T
   4    -24.1350888 -0.128157E-05  0.114E-03    2.11      20.7  T
   5    -24.1350888 -0.267211E-07  0.185E-04    2.11     127.6  T
   6    -24.1350888 -0.187526E-09  0.102E-04    2.11     231.2  T
     SCC iter.                  ...        0 min,  0.004 sec
     gradient                   ...        0 min,  0.007 sec
 * total energy  :   -23.7068757 Eh     change       -0.1909551E-05 Eh
   gradient norm :     0.0007010 Eh/α   predicted    -0.1857798E-05 (  -2.71%)
   displ. norm   :     0.0096630 α      lambda       -0.1309393E-05
   maximum displ.:     0.0059116 α      in ANC's #1, #2, #5, ...

   *** GEOMETRY OPTIMIZATION CONVERGED AFTER 7 ITERATIONS ***

------------------------------------------------------------------------
 total energy gain   :        -0.0176425 Eh      -11.0708 kcal/mol
 total RMSD          :         0.0983962 a0        0.0521 Å
 total power (kW/mol):        -6.6171942 (step) -422.2422 (real)
------------------------------------------------------------------------

 ANCopt (total)                0 d,  0 h,  0 min,  0.110 sec
 optimizer setup                ...        0 min,  0.000 sec (  0.126%)
 model hessian                  ...        0 min,  0.003 sec (  2.852%)
 ANC generation                 ...        0 min,  0.001 sec (  0.469%)
 coordinate transformation      ...        0 min,  0.000 sec (  0.085%)
 single point calculation       ...        0 min,  0.103 sec ( 93.724%)
 optimization log               ...        0 min,  0.001 sec (  0.535%)
 hessian update                 ...        0 min,  0.000 sec (  0.075%)
 rational function              ...        0 min,  0.002 sec (  1.670%)

================
 final structure:
================
$coord
   -2.59452477580880    1.46118827842617   -0.81981480845957      C 
   -3.33069424985394   -1.00087155488406   -0.09012948210473      C 
   -1.02868148869702   -2.64331990422024    0.45745235043609      C 
    1.03973456600957   -0.81097153850943   -0.04882307179184      C 
   -0.01443715812162    1.56358169896426   -0.79218104019053      C 
    2.63234606467533    2.65898396166328   -1.05925863635246      C 
    3.46326432328924    0.01363048467225   -0.24028746414075      C 
   -5.85251931457648   -1.83677206246818    0.11401097795900      C 
   -6.58823812480164   -4.17146541182261    0.82196089349786      C 
   -3.91058134037266    2.93651416029346   -1.29627804020127      H 
   -0.96463594610422   -4.28671403943844   -0.78893890617198      H 
   -1.03567333032425   -3.32469722918740    2.40515016617090      H 
    3.08250294716477    4.18236529796023    0.25107385201683      H 
    3.16183408368575    3.21194227781587   -2.97075262256596      H 
    5.29796921063301   -0.79990168607895    0.04986670468562      H 
   -7.29050259744983   -0.45166030352682   -0.34140584277789      H 
   -5.24821175800973   -5.62300762441785    1.30269339207640      H 
   -8.55432658835628   -4.67109443527062    0.93975098001747      H 
$end
           -------------------------------------------------
          |                Final Singlepoint                |
           -------------------------------------------------

          ...................................................
          :                      SETUP                      :
          :.................................................:
          :  # basis functions                  45          :
          :  # atomic orbitals                  45          :
          :  # shells                           27          :
          :  # electrons                        45          :
          :  max. iterations                   250          :
          :  Hamiltonian                  GFN2-xTB          :
          :  restarted?                      false          :
          :  GBSA solvation                  false          :
          :  PC potential                    false          :
          :  electronic temp.          300.0000000     K    :
          :  accuracy                    1.0000000          :
          :  -> integral cutoff          0.2500000E+02      :
          :  -> integral neglect         0.1000000E-07      :
          :  -> SCF convergence          0.1000000E-05 Eh   :
          :  -> wf. convergence          0.1000000E-03 e    :
          :  Broyden damping             0.4000000          :
          ...................................................

 iter      E             dE          RMSdq      gap      omega  full diag
   1    -24.1350888 -0.241351E+02  0.580E-05    2.11       0.0  T
   2    -24.1350888  0.962785E-12  0.433E-05    2.11     544.9  T
   3    -24.1350888 -0.383729E-10  0.162E-05    2.11    1452.6  T

   *** convergence criteria satisfied after 3 iterations ***

         #    Occupation            Energy/Eh            Energy/eV
      -------------------------------------------------------------
         1        2.0000           -0.6551757             -17.8282
       ...           ...                  ...                  ...
        17        2.0000           -0.4367423             -11.8844
        18        2.0000           -0.4348015             -11.8316
        19        2.0000           -0.4249957             -11.5647
        20        2.0000           -0.4146590             -11.2834
        21        2.0000           -0.3995442             -10.8721
        22        2.0000           -0.3828371             -10.4175
        23        1.0000           -0.3091739              -8.4130 (HOMO)
        24                         -0.2314633              -6.2984 (LUMO)
        25                         -0.1692116              -4.6045
        26                         -0.1196654              -3.2563
        27                          0.0117997               0.3211
        28                          0.0238008               0.6477
       ...                                ...                  ...
        45                          0.7814867              21.2653
      -------------------------------------------------------------
                  HL-Gap            0.0777106 Eh            2.1146 eV
             Fermi-level           -0.3081620 Eh           -8.3855 eV

 SCC (total)                   0 d,  0 h,  0 min,  0.013 sec
 SCC setup                      ...        0 min,  0.000 sec (  1.165%)
 Dispersion                     ...        0 min,  0.000 sec (  0.972%)
 integral evaluation            ...        0 min,  0.004 sec ( 27.779%)
 zeroth order Hamiltonian       ...        0 min,  0.000 sec (  0.601%)
 iterations                     ...        0 min,  0.002 sec ( 17.686%)
 molecular gradient             ...        0 min,  0.007 sec ( 49.498%)
 printout                       ...        0 min,  0.000 sec (  1.943%)

         :::::::::::::::::::::::::::::::::::::::::::::::::::::
         ::                     SUMMARY                     ::
         :::::::::::::::::::::::::::::::::::::::::::::::::::::
         :: total energy             -23.706875649634 Eh    ::
         :: gradient norm              0.000700663890 Eh/a0 ::
         :: HOMO-LUMO gap              2.114614054661 eV    ::
         ::.................................................::
         :: SCC energy               -24.135088786075 Eh    ::
         :: -> isotropic ES            0.002697445508 Eh    ::
         :: -> anisotropic ES          0.003593211720 Eh    ::
         :: -> anisotropic XC          0.016051672241 Eh    ::
         :: -> dispersion             -0.013529448571 Eh    ::
         :: repulsion energy           0.428221713742 Eh    ::
         :: add. restraining           0.000000000000 Eh    ::
         :::::::::::::::::::::::::::::::::::::::::::::::::::::

           -------------------------------------------------
          |                Property Printout                |
           -------------------------------------------------

    * Orbital Energies and Occupations

         #    Occupation            Energy/Eh            Energy/eV
      -------------------------------------------------------------
         1        2.0000           -0.6551757             -17.8282
       ...           ...                  ...                  ...
        11        2.0000           -0.5112235             -13.9111
        12        2.0000           -0.4929135             -13.4129
        13        2.0000           -0.4904978             -13.3471
        14        2.0000           -0.4726858             -12.8624
        15        2.0000           -0.4605522             -12.5323
        16        2.0000           -0.4493413             -12.2272
        17        2.0000           -0.4367423             -11.8844
        18        2.0000           -0.4348015             -11.8316
        19        2.0000           -0.4249957             -11.5647
        20        2.0000           -0.4146590             -11.2834
        21        2.0000           -0.3995442             -10.8721
        22        2.0000           -0.3828371             -10.4175
        23        1.0000           -0.3091739              -8.4130 (HOMO)
        24                         -0.2314633              -6.2984 (LUMO)
        25                         -0.1692116              -4.6045
        26                         -0.1196654              -3.2563
        27                          0.0117997               0.3211
        28                          0.0238008               0.6477
        29                          0.0764797               2.0811
        30                          0.1045574               2.8452
        31                          0.1477035               4.0192
        32                          0.1618473               4.4041
        33                          0.1754303               4.7737
        34                          0.1882674               5.1230
       ...                                ...                  ...
        45                          0.7814867              21.2653
      -------------------------------------------------------------
                  HL-Gap            0.0777106 Eh            2.1146 eV
             Fermi-level           -0.3081620 Eh           -8.3855 eV

     #   Z        covCN         q      C6AA      α(0)
     1   6 C      2.955    -0.042    29.042     8.839
     2   6 C      3.081     0.001    27.912     8.661
     3   6 C      3.835    -0.064    21.700     6.627
     4   6 C      3.347    -0.007    25.475     7.962
     5   6 C      3.464    -0.011    23.018     7.216
     6   6 C      4.110    -0.053    21.437     6.576
     7   6 C      3.298    -0.048    27.375     8.382
     8   6 C      2.890    -0.033    28.813     8.801
     9   6 C      2.841    -0.096    30.406     9.037
    10   1 H      0.926     0.030     2.584     2.514
    11   1 H      0.924     0.061     2.189     2.314
    12   1 H      0.924     0.061     2.189     2.314
    13   1 H      0.925     0.040     2.451     2.448
    14   1 H      0.925     0.040     2.451     2.448
    15   1 H      0.926     0.026     2.647     2.544
    16   1 H      0.925     0.031     2.567     2.506
    17   1 H      0.926     0.033     2.543     2.494
    18   1 H      0.926     0.031     2.571     2.507

 Mol. C6AA /au·bohr⁶  :       3598.362536
 Mol. C8AA /au·bohr⁸  :      87485.132903
 Mol. α(0) /au        :         94.189804

(R)spin-density population

 Mulliken population n(s)   n(p)   n(d)
     1 C   0.0003   0.000  0.000  0.000
     2 C   0.2971   0.000  0.297  0.000
     3 C   0.0029   0.000  0.003  0.000
     4 C   0.0004   0.000  0.000  0.000
     5 C   0.2360   0.000  0.236  0.000
     6 C   0.0000   0.000  0.000  0.000
     7 C   0.1963   0.000  0.196  0.000
     8 C   0.0020   0.000  0.002  0.000
     9 C   0.2472   0.000  0.247  0.000
    10 H   0.0000   0.000  0.000  0.000
    11 H   0.0087   0.009  0.000  0.000
    12 H   0.0087   0.009  0.000  0.000
    13 H   0.0001   0.000  0.000  0.000
    14 H   0.0001   0.000  0.000  0.000
    15 H   0.0000   0.000  0.000  0.000
    16 H   0.0000   0.000  0.000  0.000
    17 H   0.0000   0.000  0.000  0.000
    18 H   0.0000   0.000  0.000  0.000

Wiberg/Mayer (AO) data.
largest (>0.10) Wiberg bond orders for each atom
          total WBO             WBO to atom ...
     1  C   3.988        C    5 1.494    C    2 1.336    H   10 0.968
     2  C   3.686        C    1 1.336    C    8 1.258    C    3 1.008
     3  C   3.996        C    4 1.025    C    2 1.008    H   12 0.942    H   11 0.942
     4  C   3.973        C    7 1.654    C    5 1.162    C    3 1.025
     5  C   3.734        C    1 1.494    C    4 1.162    C    6 0.990
     6  C   3.990        C    7 1.009    C    5 0.990    H   14 0.965    H   13 0.965
     7  C   3.779        C    4 1.654    C    6 1.009    H   15 0.971
     8  C   3.991        C    9 1.708    C    2 1.258    H   16 0.963
     9  C   3.744        C    8 1.708    H   18 0.982    H   17 0.978
    10  H   0.999        C    1 0.968
    11  H   0.988        C    3 0.942
    12  H   0.988        C    3 0.942
    13  H   0.998        C    6 0.965
    14  H   0.998        C    6 0.965
    15  H   0.999        C    7 0.971
    16  H   0.999        C    8 0.963
    17  H   0.999        C    9 0.978
    18  H   0.999        C    9 0.982

molecular dipole:
                 x           y           z       tot (Debye)
 q only:        0.159      -0.031       0.013
   full:        0.179      -0.034       0.015       0.465
molecular quadrupole (traceless):
                xx          xy          yy          xz          yz          zz
 q only:       -1.087      -0.184       1.651      -0.024      -0.723      -0.564
  q+dip:        1.074      -0.097       2.476       0.054      -2.014      -3.551
   full:       -0.575      -0.255       1.851       0.009      -1.038      -1.276

           -------------------------------------------------
          |                Geometry Summary                 |
           -------------------------------------------------

      molecular mass/u    :      117.1701000
   center of mass at/Å    :       -0.7361767      -0.2987119      -0.0919317
  moments of inertia/u·Å² :        0.9188357E+02   0.4790651E+03   0.5646063E+03
rotational constants/cm⁻¹ :        0.1834673E+00   0.3518861E-01   0.2985732E-01

 * 17 selected distances

     #   Z        #   Z                                     value/Å
     1   6 C      2   6 C                                 1.4136191
     3   6 C      4   6 C                                 1.4866171
     1   6 C      5   6 C                                 1.3664767
     4   6 C      5   6 C                                 1.4299895
     5   6 C      6   6 C                                 1.5224033 (max)
     4   6 C      7   6 C                                 1.3584634
     2   6 C      8   6 C                                 1.4100369
     8   6 C      9   6 C                                 1.3484438
     1   6 C     10   1 H                                 1.0761452
     3   6 C     11   1 H                                 1.0919964
     3   6 C     12   1 H                                 1.0919340
     6   6 C     13   1 H                                 1.0896816
     6   6 C     14   1 H                                 1.0896336
     7   6 C     15   1 H                                 1.0730909 (min)
     8   6 C     16   1 H                                 1.0836815
     9   6 C     17   1 H                                 1.0759033
     9   6 C     18   1 H                                 1.0752860

 * 2 distinct bonds (by element types)

   Z      Z             #   av. dist./Å        max./Å        min./Å
   1 H    6 C           9     1.0830392     1.0919964     1.0730909
   6 C    6 C           8     1.4170062     1.5224033     1.3484438


optimized geometry written to: xtbopt.xyz


           -------------------------------------------------
          | TOTAL ENERGY              -23.706875649634 Eh   |
          | GRADIENT NORM               0.000700663890 Eh/α |
          | HOMO-LUMO GAP               2.114614054661 eV   |
           -------------------------------------------------

------------------------------------------------------------------------
 * finished run on 2021/05/19 at 10:58:59.733     
------------------------------------------------------------------------
 total:
 * wall-time:     0 d,  0 h,  0 min,  0.160 sec
 *  cpu-time:     0 d,  0 h,  0 min,  0.159 sec
 * ratio c/w:     0.992 speedup
 SCF:
 * wall-time:     0 d,  0 h,  0 min,  0.020 sec
 *  cpu-time:     0 d,  0 h,  0 min,  0.020 sec
 * ratio c/w:     1.000 speedup
 ANC optimizer:
 * wall-time:     0 d,  0 h,  0 min,  0.124 sec
 *  cpu-time:     0 d,  0 h,  0 min,  0.124 sec
 * ratio c/w:     0.999 speedup

