      -----------------------------------------------------------      
     |                   =====================                   |     
     |                           x T B                           |     
     |                   =====================                   |     
     |                         S. Grimme                         |     
     |          Mulliken Center for Theoretical Chemistry        |     
     |                    University of Bonn                     |     
     |                Version 6.2 RC2 (SAW190805)                |     
      -----------------------------------------------------------      

   This program is distributed in the hope that it will be useful,
   but WITHOUT ANY WARRANTY; without even the implied warranty of
   MERCHANTABILITY or FITNESS FOR A PARTICULAR PURPOSE.
   
   FOR NON-COMMERCIAL, ACADEMIA USE ONLY.
   
   Cite this work as:
   * S. Grimme, C. Bannwarth, P. Shushkov, J. Chem. Theory Comput., 2017,
     13, 1989-2009. DOI: 10.1021/acs.jctc.7b00118
   * C. Bannwarth, S. Ehlert and S. Grimme., J. Chem. Theory Comput., 2019,
     15, 1652-1671. DOI: 10.1021/acs.jctc.8b01176
   * P. Pracht, E. Caldeweyher, S. Ehlert, S. Grimme, ChemRxiv, 2019, preprint.
     DOI: 10.26434/chemrxiv.8326202.v1
   
   for DFT-D4:
   * E. Caldeweyher, C. Bannwarth and S. Grimme, J. Chem. Phys., 2017,
     147, 034112. DOI: 10.1063/1.4993215
   * E. Caldeweyher, S. Ehlert, A. Hansen, H. Neugebauer, S. Spicher,
     C. Bannwarth and S. Grimme, J. Chem. Phys., 2019, 150, 154122.
     DOI: 10.1063/1.5090222
   
   for sTDA-xTB:
   * S. Grimme and C. Bannwarth, J. Chem. Phys., 2016, 145, 054103.
     DOI: 10.1063/1.4959605
   
   in the mass-spec context:
   * V. Asgeirsson, C. Bauer and S. Grimme, Chem. Sci., 2017, 8, 4879.
     DOI: 10.1039/c7sc00601b
   
   for metadynamics refer to:
   * S. Grimme, J. Chem. Theory Comput., 2019, 155, 2847-2862
     DOI: 10.1021/acs.jctc.9b00143
   
   with help from (in alphabetical order)
   C. Bannwarth, F. Bohle, G. Brandenburg, E. Caldeweyher, M. Checinski,
   S. Dohm, S. Ehlert, S. Ehrlich, F. März, H. Neugebauer, J. Pisarek,
   P. Pracht, P. Shushkov, and S. Spicher.
   
 * started run on 2021/05/19 at 10:59:01.581     

           -------------------------------------------------
          |                Calculation Setup                |
           -------------------------------------------------

          program call               : /ihome/ghutchison/geoffh/xtb/xtb 230.xyz -opt
          hostname                   : smp-n83
          coordinate file            : 230.xyz
          omp threads                :                     1
          number of atoms            :                    28
          number of electrons        :                    78
          charge                     :                     0
          spin                       :                   0.0
          first test random number   :      0.56363963750627


########################################################################
# WARNING! Please study the warnings concerning your input carefully
#  - the use of '-opt' is discouraged, please use '--opt' next time
########################################################################

           ------------------------------------------------- 
          |                 G F N 2 - x T B                 |
          | Geometry, Frequencies, Noncovalent interactions |
          |            JCTC 2019 parametrisation            |
           ------------------------------------------------- 
             KAB for C  - Si     :                1.0500
             KAB for H  - Pd     :                0.9500
             k(s)              :                1.8500
             k(p)              :                2.2300
             k(d)              :                2.2300
             k(f)              :                2.0000
             kEN (H0ij)        :               -2.0000
             D4 a1             :                0.5200
             D4 a2             :                5.0000
             D4 s6             :                1.0000
             D4 s8             :                2.7000
             D4 s9             :                5.0000
             alphaj            :                2.0000

  Z AO/shell   Hii/eV     exponent
  1     Wed Apr 25 08:07:45 CEST 2018   EN: 2.200 GM2: 0.406  GM3: 0.0800  RAES: 1.40
     1s    -10.707211    1.230000
  6     Wed Apr 25 08:07:45 CEST 2018   EN: 2.550 GM2: 0.538  GM3: 0.1500  RAES: 3.00
     2s    -13.970922    2.096432
     2p    -10.063292    1.800000
  7     Wed Apr 25 08:07:45 CEST 2018   EN: 3.040 GM2: 0.461  GM3:-0.0640  RAES: 1.90
     2s    -16.686243    2.339881
     2p    -12.523956    2.014332
 16     Tue Apr 24 11:44:34 CEST 2018   EN: 2.580 GM2: 0.340  GM3:-0.0502  RAES: 3.10
     3s    -20.029654    1.981333
     3p    -11.377694    2.025643
     3d     -0.420282    1.702555

           ------------------------------------------------- 
          |        Self-Consistent Charge Iterations        |
           ------------------------------------------------- 

          ...................................................
          :                      SETUP                      :
          :.................................................:
          :  # basis functions                  82          :
          :  # atomic orbitals                  80          :
          :  # shells                           44          :
          :  # electrons                        78          :
          :  max. iterations                   250          :
          :  Hamiltonian                  GFN2-xTB          :
          :  restarted?                      false          :
          :  GBSA solvation                  false          :
          :  PC potential                    false          :
          :  electronic temp.          300.0000000     K    :
          :  accuracy                    1.0000000          :
          :  -> integral cutoff          0.2500000E+02      :
          :  -> integral neglect         0.1000000E-07      :
          :  -> SCF convergence          0.1000000E-05 Eh   :
          :  -> wf. convergence          0.1000000E-03 e    :
          :  Broyden damping             0.4000000          :
          ...................................................

 iter      E             dE          RMSdq      gap      omega  full diag
   1    -42.7428490 -0.427428E+02  0.474E+00    2.74       0.0  T
   2    -42.8105596 -0.677106E-01  0.306E+00    2.56       1.0  T
   3    -42.8015225  0.903708E-02  0.147E+00    2.44       1.0  T
   4    -42.8254322 -0.239097E-01  0.629E-01    2.24       1.0  T
   5    -42.8300386 -0.460633E-02  0.232E-01    2.26       1.0  T
   6    -42.8301172 -0.786089E-04  0.765E-02    2.26       1.0  T
   7    -42.8301502 -0.329797E-04  0.231E-02    2.26       1.0  T
   8    -42.8301518 -0.163937E-05  0.123E-02    2.26       1.5  T
   9    -42.8301520 -0.146634E-06  0.311E-03    2.26       6.1  T
  10    -42.8301520 -0.139631E-07  0.150E-03    2.26      12.6  T
  11    -42.8301520 -0.389450E-08  0.591E-04    2.26      32.0  T
  12    -42.8301520 -0.178270E-08  0.256E-04    2.26      73.9  T

   *** convergence criteria satisfied after 12 iterations ***

         #    Occupation            Energy/Eh            Energy/eV
      -------------------------------------------------------------
         1        2.0000           -0.7420076             -20.1911
       ...           ...                  ...                  ...
        33        2.0000           -0.4376489             -11.9090
        34        2.0000           -0.4322990             -11.7635
        35        2.0000           -0.4306481             -11.7185
        36        2.0000           -0.3875291             -10.5452
        37        2.0000           -0.3773672             -10.2687
        38        2.0000           -0.3726512             -10.1404
        39        2.0000           -0.3215474              -8.7498 (HOMO)
        40                         -0.2384513              -6.4886 (LUMO)
        41                         -0.2220088              -6.0412
        42                         -0.1842539              -5.0138
        43                         -0.1581884              -4.3045
        44                         -0.1413202              -3.8455
       ...                                ...                  ...
        80                          0.6161245              16.7656
      -------------------------------------------------------------
                  HL-Gap            0.0830961 Eh            2.2612 eV
             Fermi-level           -0.2799994 Eh           -7.6192 eV

 SCC (total)                   0 d,  0 h,  0 min,  0.050 sec
 SCC setup                      ...        0 min,  0.000 sec (  0.696%)
 Dispersion                     ...        0 min,  0.000 sec (  0.796%)
 integral evaluation            ...        0 min,  0.013 sec ( 25.337%)
 zeroth order Hamiltonian       ...        0 min,  0.000 sec (  0.470%)
 iterations                     ...        0 min,  0.018 sec ( 34.832%)
 molecular gradient             ...        0 min,  0.019 sec ( 36.933%)
 printout                       ...        0 min,  0.000 sec (  0.833%)

         :::::::::::::::::::::::::::::::::::::::::::::::::::::
         ::                     SUMMARY                     ::
         :::::::::::::::::::::::::::::::::::::::::::::::::::::
         :: total energy             -42.395673169428 Eh    ::
         :: gradient norm              0.100752391893 Eh/a0 ::
         :: HOMO-LUMO gap              2.261160321863 eV    ::
         ::.................................................::
         :: SCC energy               -42.830151973749 Eh    ::
         :: -> isotropic ES            0.032209299644 Eh    ::
         :: -> anisotropic ES          0.006738428861 Eh    ::
         :: -> anisotropic XC          0.038418806474 Eh    ::
         :: -> dispersion             -0.030620164838 Eh    ::
         :: repulsion energy           0.434315930804 Eh    ::
         :: add. restraining           0.000000000000 Eh    ::
         :::::::::::::::::::::::::::::::::::::::::::::::::::::

      ----------------------------------------------------------- 
     |                   =====================                   |
     |                        A N C O P T                        |
     |                   =====================                   |
     |               Approximate Normal Coordinate               |
     |                Rational Function Optimizer                |
      ----------------------------------------------------------- 

          ...................................................
          :                      SETUP                      :
          :.................................................:
          :   optimization level            normal          :
          :   max. optcycles                   200          :
          :   ANC micro-cycles                  20          :
          :   degrees of freedom                78          :
          :.................................................:
          :   RF solver                   davidson          :
          :   input Hessian                  false          :
          :   write xtbopt.log                true          :
          :   linear?                        false          :
          :   energy convergence         0.5000000E-05 Eh   :
          :   grad. convergence          0.1000000E-02 Eh/α :
          :   maximium RF displ.         2.0000000          :
          :   Hlow (freq-cutoff)         0.5000000E-02      :
          :   Hmax (freq-cutoff)         5.0000000          :
          :   S6 in model hess.         20.0000000          :
          ...................................................

generating ANC from model Hessian ...
Using Lindh-Hessian (1995)
 Shifting diagonal of input Hessian by   3.538504584028799E-003
 Lowest  eigenvalues of input Hessian
   -0.000000   -0.000000   -0.000000   -0.000000    0.000000    0.000000
    0.005000    0.006593    0.007912    0.010468    0.012224    0.014142
    0.016291    0.017994    0.021709    0.022577    0.026044    0.028249
 Highest eigenvalues
    1.355967    1.421099    1.514508    1.699490    1.833650    2.098495
 

........................................................................
.............................. CYCLE    1 ..............................
........................................................................
   1    -42.8301520 -0.428302E+02  0.854E-05    2.26       0.0  T
   2    -42.8301520 -0.305391E-10  0.552E-05    2.26     342.5  T
   3    -42.8301520 -0.318323E-11  0.355E-05    2.26     532.2  T
     SCC iter.                  ...        0 min,  0.005 sec
     gradient                   ...        0 min,  0.018 sec
 * total energy  :   -42.3956732 Eh     change       -0.5294748E-07 Eh
   gradient norm :     0.1007520 Eh/α   predicted     0.0000000E+00 (-100.00%)
   displ. norm   :     0.3933031 α      lambda       -0.1917247E-01
   maximum displ.:     0.1933146 α      in ANC's #9, #16, #43, ...

........................................................................
.............................. CYCLE    2 ..............................
........................................................................
   1    -42.8533810 -0.428534E+02  0.529E-01    2.17       0.0  T
   2    -42.8536323 -0.251328E-03  0.265E-01    2.17       1.0  T
   3    -42.8536488 -0.165225E-04  0.635E-02    2.18       1.0  T
   4    -42.8536677 -0.188874E-04  0.301E-02    2.18       1.0  T
   5    -42.8536702 -0.249769E-05  0.127E-02    2.18       1.5  T
   6    -42.8536725 -0.229229E-05  0.500E-03    2.18       3.8  T
   7    -42.8536727 -0.227800E-06  0.193E-03    2.18       9.8  T
     SCC iter.                  ...        0 min,  0.010 sec
     gradient                   ...        0 min,  0.017 sec
 * total energy  :   -42.4092410 Eh     change       -0.1356774E-01 Eh
   gradient norm :     0.0531986 Eh/α   predicted    -0.1106911E-01 ( -18.42%)
   displ. norm   :     0.4000670 α      lambda       -0.8766648E-02
   maximum displ.:     0.2225852 α      in ANC's #9, #10, #11, ...

........................................................................
.............................. CYCLE    3 ..............................
........................................................................
   1    -42.8666020 -0.428666E+02  0.528E-01    2.10       0.0  T
   2    -42.8668285 -0.226444E-03  0.248E-01    2.10       1.0  T
   3    -42.8668263  0.210888E-05  0.698E-02    2.11       1.0  T
   4    -42.8668508 -0.244834E-04  0.428E-02    2.11       1.0  T
   5    -42.8668697 -0.188344E-04  0.137E-02    2.11       1.4  T
   6    -42.8668714 -0.173774E-05  0.454E-03    2.11       4.2  T
   7    -42.8668715 -0.533326E-07  0.190E-03    2.11       9.9  T
     SCC iter.                  ...        0 min,  0.010 sec
     gradient                   ...        0 min,  0.017 sec
 * total energy  :   -42.4145061 Eh     change       -0.5265092E-02 Eh
   gradient norm :     0.0161462 Eh/α   predicted    -0.5084899E-02 (  -3.42%)
   displ. norm   :     0.1941880 α      lambda       -0.1226468E-02
   maximum displ.:     0.1031603 α      in ANC's #10, #9, #16, ...

........................................................................
.............................. CYCLE    4 ..............................
........................................................................
   1    -42.8687660 -0.428688E+02  0.317E-01    2.10       0.0  T
   2    -42.8688318 -0.657256E-04  0.138E-01    2.10       1.0  T
   3    -42.8688207  0.110151E-04  0.430E-02    2.10       1.0  T
   4    -42.8688461 -0.253151E-04  0.214E-02    2.11       1.0  T
   5    -42.8688497 -0.359632E-05  0.488E-03    2.11       3.9  T
   6    -42.8688497 -0.402668E-07  0.199E-03    2.11       9.5  T
   7    -42.8688497 -0.556651E-08  0.678E-04    2.11      27.9  T
     SCC iter.                  ...        0 min,  0.010 sec
     gradient                   ...        0 min,  0.017 sec
 * total energy  :   -42.4153325 Eh     change       -0.8264040E-03 Eh
   gradient norm :     0.0099446 Eh/α   predicted    -0.6363602E-03 ( -23.00%)
   displ. norm   :     0.1566263 α      lambda       -0.6346086E-03
   maximum displ.:     0.0631390 α      in ANC's #9, #10, #1, ...

........................................................................
.............................. CYCLE    5 ..............................
........................................................................
   1    -42.8687214 -0.428687E+02  0.398E-01    2.11       0.0  T
   2    -42.8688208 -0.994291E-04  0.171E-01    2.12       1.0  T
   3    -42.8687892  0.315483E-04  0.583E-02    2.12       1.0  T
   4    -42.8688517 -0.624486E-04  0.209E-02    2.12       1.0  T
   5    -42.8688536 -0.194178E-05  0.558E-03    2.12       3.4  T
   6    -42.8688538 -0.120850E-06  0.221E-03    2.12       8.6  T
   7    -42.8688538 -0.991150E-08  0.678E-04    2.12      27.9  T
     SCC iter.                  ...        0 min,  0.010 sec
     gradient                   ...        0 min,  0.017 sec
 * total energy  :   -42.4157881 Eh     change       -0.4556908E-03 Eh
   gradient norm :     0.0100660 Eh/α   predicted    -0.3251074E-03 ( -28.66%)
   displ. norm   :     0.2052985 α      lambda       -0.6495171E-03
   maximum displ.:     0.0663619 α      in ANC's #1, #17, #9, ...

........................................................................
.............................. CYCLE    6 ..............................
........................................................................
   1    -42.8673603 -0.428674E+02  0.638E-01    2.16       0.0  T
   2    -42.8676226 -0.262265E-03  0.272E-01    2.17       1.0  T
   3    -42.8675251  0.974321E-04  0.973E-02    2.16       1.0  T
   4    -42.8677114 -0.186266E-03  0.304E-02    2.17       1.0  T
   5    -42.8677144 -0.296159E-05  0.861E-03    2.17       2.2  T
   6    -42.8677147 -0.360230E-06  0.339E-03    2.17       5.6  T
   7    -42.8677148 -0.222620E-07  0.977E-04    2.17      19.3  T
   8    -42.8677148 -0.245139E-08  0.444E-04    2.17      42.6  T
     SCC iter.                  ...        0 min,  0.011 sec
     gradient                   ...        0 min,  0.017 sec
 * total energy  :   -42.4162679 Eh     change       -0.4797085E-03 Eh
   gradient norm :     0.0150112 Eh/α   predicted    -0.3384475E-03 ( -29.45%)
   displ. norm   :     0.2782945 α      lambda       -0.8247028E-03
   maximum displ.:     0.1045256 α      in ANC's #2, #14, #17, ...

........................................................................
.............................. CYCLE    7 ..............................
........................................................................
   1    -42.8647188 -0.428647E+02  0.881E-01    2.23       0.0  T
   2    -42.8652371 -0.518315E-03  0.375E-01    2.25       1.0  T
   3    -42.8649957  0.241421E-03  0.146E-01    2.24       1.0  T
   4    -42.8654309 -0.435237E-03  0.400E-02    2.25       1.0  T
   5    -42.8654343 -0.336401E-05  0.120E-02    2.25       1.6  T
   6    -42.8654351 -0.794704E-06  0.435E-03    2.25       4.3  T
   7    -42.8654351 -0.337161E-07  0.139E-03    2.25      13.6  T
   8    -42.8654351 -0.584291E-08  0.628E-04    2.25      30.1  T
     SCC iter.                  ...        0 min,  0.011 sec
     gradient                   ...        0 min,  0.018 sec
 * total energy  :   -42.4168028 Eh     change       -0.5349358E-03 Eh
   gradient norm :     0.0226628 Eh/α   predicted    -0.4442937E-03 ( -16.94%)
   displ. norm   :     0.2004229 α      lambda       -0.9026849E-03
   maximum displ.:     0.1015279 α      in ANC's #2, #11, #14, ...

........................................................................
.............................. CYCLE    8 ..............................
........................................................................
   1    -42.8649494 -0.428649E+02  0.474E-01    2.31       0.0  T
   2    -42.8650997 -0.150278E-03  0.204E-01    2.32       1.0  T
   3    -42.8650822  0.175307E-04  0.579E-02    2.32       1.0  T
   4    -42.8651409 -0.586912E-04  0.218E-02    2.32       1.0  T
   5    -42.8651422 -0.128085E-05  0.663E-03    2.32       2.8  T
   6    -42.8651425 -0.324308E-06  0.226E-03    2.32       8.4  T
   7    -42.8651425 -0.958547E-08  0.862E-04    2.32      21.9  T
     SCC iter.                  ...        0 min,  0.010 sec
     gradient                   ...        0 min,  0.017 sec
 * total energy  :   -42.4175389 Eh     change       -0.7361093E-03 Eh
   gradient norm :     0.0211819 Eh/α   predicted    -0.4694728E-03 ( -36.22%)
   displ. norm   :     0.3332458 α      lambda       -0.1863402E-02
   maximum displ.:     0.1721243 α      in ANC's #2, #11, #12, ...

........................................................................
.............................. CYCLE    9 ..............................
........................................................................
   1    -42.8664580 -0.428665E+02  0.712E-01    2.42       0.0  T
   2    -42.8667935 -0.335461E-03  0.309E-01    2.42       1.0  T
   3    -42.8668571 -0.636169E-04  0.484E-02    2.42       1.0  T
   4    -42.8668550  0.210489E-05  0.314E-02    2.42       1.0  T
   5    -42.8668665 -0.115432E-04  0.811E-03    2.42       2.3  T
   6    -42.8668673 -0.710045E-06  0.334E-03    2.42       5.7  T
   7    -42.8668673 -0.162820E-07  0.128E-03    2.42      14.8  T
     SCC iter.                  ...        0 min,  0.010 sec
     gradient                   ...        0 min,  0.017 sec
 * total energy  :   -42.4188359 Eh     change       -0.1296977E-02 Eh
   gradient norm :     0.0141590 Eh/α   predicted    -0.1035169E-02 ( -20.19%)
   displ. norm   :     0.4032035 α      lambda       -0.1260799E-02
   maximum displ.:     0.2001110 α      in ANC's #2, #3, #11, ...

........................................................................
.............................. CYCLE   10 ..............................
........................................................................
   1    -42.8636246 -0.428636E+02  0.103E+00    2.44       0.0  T
   2    -42.8644042 -0.779627E-03  0.435E-01    2.45       1.0  T
   3    -42.8643761  0.281035E-04  0.115E-01    2.45       1.0  T
   4    -42.8645994 -0.223267E-03  0.446E-02    2.46       1.0  T
   5    -42.8646052 -0.580671E-05  0.112E-02    2.46       1.7  T
   6    -42.8646056 -0.448219E-06  0.398E-03    2.46       4.7  T
   7    -42.8646056 -0.378477E-07  0.206E-03    2.46       9.2  T
   8    -42.8646057 -0.754464E-08  0.551E-04    2.46      34.3  T
     SCC iter.                  ...        0 min,  0.011 sec
     gradient                   ...        0 min,  0.017 sec
 * total energy  :   -42.4194192 Eh     change       -0.5833463E-03 Eh
   gradient norm :     0.0207317 Eh/α   predicted    -0.7328861E-03 (  25.63%)
   displ. norm   :     0.2349862 α      lambda       -0.1619638E-02
   maximum displ.:     0.1174633 α      in ANC's #3, #5, #4, ...

........................................................................
.............................. CYCLE   11 ..............................
........................................................................
   1    -42.8700574 -0.428701E+02  0.358E-01    2.54       0.0  T
   2    -42.8701608 -0.103465E-03  0.172E-01    2.53       1.0  T
   3    -42.8700892  0.716769E-04  0.837E-02    2.53       1.0  T
   4    -42.8701985 -0.109323E-03  0.340E-02    2.53       1.0  T
   5    -42.8702046 -0.610076E-05  0.825E-03    2.53       2.3  T
   6    -42.8702048 -0.261331E-06  0.290E-03    2.53       6.5  T
   7    -42.8702049 -0.105592E-07  0.140E-03    2.53      13.5  T
     SCC iter.                  ...        0 min,  0.010 sec
     gradient                   ...        0 min,  0.017 sec
 * total energy  :   -42.4199851 Eh     change       -0.5658647E-03 Eh
   gradient norm :     0.0153573 Eh/α   predicted    -0.8545412E-03 (  51.02%)
   displ. norm   :     0.1434673 α      lambda       -0.7352082E-03
   maximum displ.:     0.0730430 α      in ANC's #3, #9, #5, ...

........................................................................
.............................. CYCLE   12 ..............................
........................................................................
   1    -42.8705865 -0.428706E+02  0.223E-01    2.51       0.0  T
   2    -42.8706220 -0.354921E-04  0.978E-02    2.52       1.0  T
   3    -42.8706229 -0.945387E-06  0.227E-02    2.52       1.0  T
   4    -42.8706294 -0.645286E-05  0.127E-02    2.52       1.5  T
   5    -42.8706304 -0.103917E-05  0.312E-03    2.52       6.1  T
   6    -42.8706305 -0.535776E-07  0.891E-04    2.52      21.2  T
   7    -42.8706305 -0.273316E-08  0.464E-04    2.52      40.8  T
     SCC iter.                  ...        0 min,  0.009 sec
     gradient                   ...        0 min,  0.017 sec
 * total energy  :   -42.4204874 Eh     change       -0.5023403E-03 Eh
   gradient norm :     0.0084588 Eh/α   predicted    -0.3751732E-03 ( -25.31%)
   displ. norm   :     0.2451454 α      lambda       -0.6337888E-03
   maximum displ.:     0.1576355 α      in ANC's #3, #9, #10, ...

........................................................................
.............................. CYCLE   13 ..............................
........................................................................
   1    -42.8698518 -0.428699E+02  0.336E-01    2.52       0.0  T
   2    -42.8699329 -0.810979E-04  0.148E-01    2.52       1.0  T
   3    -42.8699389 -0.595002E-05  0.319E-02    2.53       1.0  T
   4    -42.8699493 -0.104219E-04  0.187E-02    2.53       1.0  T
   5    -42.8699518 -0.243320E-05  0.403E-03    2.53       4.7  T
   6    -42.8699519 -0.153646E-06  0.124E-03    2.53      15.3  T
   7    -42.8699519 -0.262462E-08  0.662E-04    2.53      28.6  T
     SCC iter.                  ...        0 min,  0.009 sec
     gradient                   ...        0 min,  0.017 sec
 * total energy  :   -42.4208616 Eh     change       -0.3741932E-03 Eh
   gradient norm :     0.0092646 Eh/α   predicted    -0.3359402E-03 ( -10.22%)
   displ. norm   :     0.1761579 α      lambda       -0.3025634E-03
   maximum displ.:     0.1237415 α      in ANC's #3, #5, #9, ...

........................................................................
.............................. CYCLE   14 ..............................
........................................................................
   1    -42.8707832 -0.428708E+02  0.186E-01    2.54       0.0  T
   2    -42.8708070 -0.237889E-04  0.854E-02    2.54       1.0  T
   3    -42.8708052  0.178642E-05  0.257E-02    2.54       1.0  T
   4    -42.8708114 -0.614010E-05  0.133E-02    2.54       1.4  T
   5    -42.8708128 -0.141913E-05  0.327E-03    2.54       5.8  T
   6    -42.8708129 -0.597888E-07  0.991E-04    2.54      19.1  T
   7    -42.8708129 -0.118374E-08  0.461E-04    2.54      41.0  T
     SCC iter.                  ...        0 min,  0.009 sec
     gradient                   ...        0 min,  0.017 sec
 * total energy  :   -42.4210646 Eh     change       -0.2029437E-03 Eh
   gradient norm :     0.0072717 Eh/α   predicted    -0.1559767E-03 ( -23.14%)
   displ. norm   :     0.1984849 α      lambda       -0.2151962E-03
   maximum displ.:     0.1345461 α      in ANC's #3, #2, #1, ...

........................................................................
.............................. CYCLE   15 ..............................
........................................................................
   1    -42.8706705 -0.428707E+02  0.267E-01    2.55       0.0  T
   2    -42.8707182 -0.476980E-04  0.119E-01    2.56       1.0  T
   3    -42.8707268 -0.867573E-05  0.224E-02    2.56       1.0  T
   4    -42.8707257  0.114179E-05  0.132E-02    2.56       1.4  T
   5    -42.8707278 -0.212390E-05  0.406E-03    2.56       4.7  T
   6    -42.8707280 -0.184498E-06  0.142E-03    2.56      13.3  T
   7    -42.8707280 -0.164514E-08  0.605E-04    2.56      31.2  T
     SCC iter.                  ...        0 min,  0.009 sec
     gradient                   ...        0 min,  0.017 sec
 * total energy  :   -42.4212043 Eh     change       -0.1397107E-03 Eh
   gradient norm :     0.0063257 Eh/α   predicted    -0.1118396E-03 ( -19.95%)
   displ. norm   :     0.0990178 α      lambda       -0.1612068E-03
   maximum displ.:     0.0557186 α      in ANC's #3, #1, #2, ...

........................................................................
.............................. CYCLE   16 ..............................
........................................................................
   1    -42.8740657 -0.428741E+02  0.955E-02    2.58       0.0  T
   2    -42.8740725 -0.673019E-05  0.497E-02    2.57       1.0  T
   3    -42.8740617  0.107542E-04  0.311E-02    2.57       1.0  T
   4    -42.8740782 -0.164634E-04  0.663E-03    2.57       2.8  T
   5    -42.8740783 -0.105269E-06  0.203E-03    2.57       9.3  T
   6    -42.8740783 -0.885215E-08  0.755E-04    2.57      25.0  T
     SCC iter.                  ...        0 min,  0.009 sec
     gradient                   ...        0 min,  0.017 sec
 * total energy  :   -42.4212475 Eh     change       -0.4320282E-04 Eh
   gradient norm :     0.0063581 Eh/α   predicted    -0.8139408E-04 (  88.40%)
   displ. norm   :     0.1355843 α      lambda       -0.1240758E-03
   maximum displ.:     0.0708466 α      in ANC's #3, #2, #4, ...

........................................................................
.............................. CYCLE   17 ..............................
........................................................................
   1    -42.8720140 -0.428720E+02  0.186E-01    2.57       0.0  T
   2    -42.8720367 -0.226927E-04  0.826E-02    2.58       1.0  T
   3    -42.8720413 -0.456788E-05  0.139E-02    2.58       1.4  T
   4    -42.8720413 -0.795127E-08  0.494E-03    2.58       3.8  T
   5    -42.8720413 -0.673649E-07  0.186E-03    2.58      10.2  T
   6    -42.8720414 -0.452068E-07  0.939E-04    2.58      20.1  T
     SCC iter.                  ...        0 min,  0.008 sec
     gradient                   ...        0 min,  0.018 sec
 * total energy  :   -42.4213092 Eh     change       -0.6167775E-04 Eh
   gradient norm :     0.0038996 Eh/α   predicted    -0.6318209E-04 (   2.44%)
   displ. norm   :     0.0230753 α      lambda       -0.2989386E-04
   maximum displ.:     0.0104079 α      in ANC's #3, #2, #4, ...

........................................................................
.............................. CYCLE   18 ..............................
........................................................................
   1    -42.8724633 -0.428725E+02  0.388E-02    2.57       0.0  T
   2    -42.8724644 -0.108726E-05  0.168E-02    2.57       1.1  T
   3    -42.8724643  0.134859E-06  0.539E-03    2.57       3.5  T
   4    -42.8724646 -0.387868E-06  0.250E-03    2.57       7.5  T
   5    -42.8724647 -0.306325E-07  0.689E-04    2.57      27.4  T
   6    -42.8724647 -0.101726E-08  0.220E-04    2.57      86.0  T
     SCC iter.                  ...        0 min,  0.008 sec
     gradient                   ...        0 min,  0.019 sec
 * total energy  :   -42.4213314 Eh     change       -0.2228243E-04 Eh
   gradient norm :     0.0021041 Eh/α   predicted    -0.1496599E-04 ( -32.84%)
   displ. norm   :     0.0588342 α      lambda       -0.3485554E-04
   maximum displ.:     0.0323789 α      in ANC's #2, #1, #4, ...

........................................................................
.............................. CYCLE   19 ..............................
........................................................................
   1    -42.8728675 -0.428729E+02  0.521E-02    2.57       0.0  T
   2    -42.8728691 -0.166339E-05  0.251E-02    2.57       1.0  T
   3    -42.8728670  0.218089E-05  0.135E-02    2.57       1.4  T
   4    -42.8728702 -0.323074E-05  0.346E-03    2.57       5.5  T
   5    -42.8728702 -0.131028E-07  0.653E-04    2.57      28.9  T
   6    -42.8728702 -0.832181E-09  0.313E-04    2.57      60.4  T
     SCC iter.                  ...        0 min,  0.008 sec
     gradient                   ...        0 min,  0.019 sec
 * total energy  :   -42.4213532 Eh     change       -0.2175918E-04 Eh
   gradient norm :     0.0019148 Eh/α   predicted    -0.1749181E-04 ( -19.61%)
   displ. norm   :     0.0807230 α      lambda       -0.1261170E-04
   maximum displ.:     0.0460241 α      in ANC's #2, #1, #4, ...

........................................................................
.............................. CYCLE   20 ..............................
........................................................................
   1    -42.8728169 -0.428728E+02  0.586E-02    2.57       0.0  T
   2    -42.8728183 -0.141218E-05  0.301E-02    2.57       1.0  T
   3    -42.8728180  0.231927E-06  0.786E-03    2.57       2.4  T
   4    -42.8728185 -0.502661E-06  0.432E-03    2.57       4.4  T
   5    -42.8728187 -0.193639E-06  0.666E-04    2.57      28.4  T
   6    -42.8728187 -0.801002E-09  0.352E-04    2.57      53.6  T
     SCC iter.                  ...        0 min,  0.008 sec
     gradient                   ...        0 min,  0.019 sec
 * total energy  :   -42.4213615 Eh     change       -0.8252411E-05 Eh
   gradient norm :     0.0018923 Eh/α   predicted    -0.6326036E-05 ( -23.34%)
   displ. norm   :     0.0810223 α      lambda        0.1774562E-04
   maximum displ.:     0.0460203 α      in ANC's #2, #1, #4, ...
 * RMSD in coord.:     0.4773330 α      energy gain  -0.2568828E-01 Eh

generating ANC from model Hessian ...
Using Lindh-Hessian (1995)
 Shifting diagonal of input Hessian by   3.339275182848865E-003
 Lowest  eigenvalues of input Hessian
   -0.000000   -0.000000    0.000000    0.000000    0.000000    0.000000
    0.005000    0.006910    0.007584    0.010639    0.011754    0.014272
    0.017755    0.018488    0.020852    0.024013    0.025575    0.031291
 Highest eigenvalues
    1.408441    1.453381    1.531263    1.579168    1.755629    2.085520
 

........................................................................
.............................. CYCLE   21 ..............................
........................................................................
   1    -42.8725837 -0.428726E+02  0.586E-02    2.57       0.0  T
   2    -42.8725851 -0.139640E-05  0.301E-02    2.57       1.0  T
   3    -42.8725851 -0.662131E-07  0.673E-03    2.57       2.8  T
   4    -42.8725852 -0.869724E-07  0.436E-03    2.57       4.3  T
   5    -42.8725855 -0.264020E-06  0.646E-04    2.57      29.2  T
   6    -42.8725855 -0.648008E-09  0.342E-04    2.57      55.2  T
     SCC iter.                  ...        0 min,  0.008 sec
     gradient                   ...        0 min,  0.019 sec
 * total energy  :   -42.4213478 Eh     change        0.1364776E-04 Eh
   gradient norm :     0.0034299 Eh/α   predicted     0.0000000E+00 (-100.00%)
   displ. norm   :     0.0239247 α      lambda       -0.2647232E-04
   maximum displ.:     0.0140854 α      in ANC's #4, #8, #9, ...

........................................................................
.............................. CYCLE   22 ..............................
........................................................................
   1    -42.8729447 -0.428729E+02  0.256E-02    2.57       0.0  T
   2    -42.8729452 -0.488763E-06  0.117E-02    2.57       1.6  T
   3    -42.8729453 -0.734114E-07  0.268E-03    2.57       7.0  T
   4    -42.8729453  0.208909E-07  0.186E-03    2.57      10.2  T
   5    -42.8729453 -0.418673E-07  0.415E-04    2.57      45.5  T
   6    -42.8729453 -0.124172E-08  0.169E-04    2.57     112.1  T
     SCC iter.                  ...        0 min,  0.008 sec
     gradient                   ...        0 min,  0.019 sec
 * total energy  :   -42.4213645 Eh     change       -0.1667930E-04 Eh
   gradient norm :     0.0014134 Eh/α   predicted    -0.1324422E-04 ( -20.59%)
   displ. norm   :     0.0269842 α      lambda       -0.8702731E-05
   maximum displ.:     0.0180299 α      in ANC's #4, #8, #2, ...

........................................................................
.............................. CYCLE   23 ..............................
........................................................................
   1    -42.8731587 -0.428732E+02  0.329E-02    2.57       0.0  T
   2    -42.8731594 -0.731961E-06  0.151E-02    2.57       1.2  T
   3    -42.8731593  0.127731E-06  0.522E-03    2.57       3.6  T
   4    -42.8731596 -0.299250E-06  0.268E-03    2.57       7.0  T
   5    -42.8731596 -0.518341E-07  0.456E-04    2.57      41.4  T
   6    -42.8731596 -0.106780E-09  0.236E-04    2.57      80.1  T
     SCC iter.                  ...        0 min,  0.008 sec
     gradient                   ...        0 min,  0.019 sec
 * total energy  :   -42.4213703 Eh     change       -0.5825448E-05 Eh
   gradient norm :     0.0012454 Eh/α   predicted    -0.4358096E-05 ( -25.19%)
   displ. norm   :     0.0269146 α      lambda        0.1178304E-04
   maximum displ.:     0.0180309 α      in ANC's #4, #8, #2, ...

........................................................................
.............................. CYCLE   24 ..............................
........................................................................
   1    -42.8733426 -0.428733E+02  0.329E-02    2.58       0.0  T
   2    -42.8733433 -0.731054E-06  0.151E-02    2.58       1.2  T
   3    -42.8733432  0.138765E-06  0.528E-03    2.58       3.6  T
   4    -42.8733435 -0.315112E-06  0.268E-03    2.58       7.1  T
   5    -42.8733435 -0.500921E-07  0.455E-04    2.58      41.5  T
   6    -42.8733435 -0.996394E-10  0.232E-04    2.58      81.5  T
     SCC iter.                  ...        0 min,  0.008 sec
     gradient                   ...        0 min,  0.019 sec
 * total energy  :   -42.4213614 Eh     change        0.8873163E-05 Eh
   gradient norm :     0.0033360 Eh/α   predicted     0.5893192E-05 ( -33.58%)
   displ. norm   :     0.0104709 α      lambda       -0.1529387E-04
   maximum displ.:     0.0039008 α      in ANC's #4, #19, #18, ...

........................................................................
.............................. CYCLE   25 ..............................
........................................................................
   1    -42.8731198 -0.428731E+02  0.144E-02    2.58       0.0  T
   2    -42.8731199 -0.136269E-06  0.688E-03    2.58       2.7  T
   3    -42.8731199 -0.272373E-07  0.144E-03    2.58      13.2  T
   4    -42.8731199  0.279117E-08  0.744E-04    2.58      25.4  T
   5    -42.8731199 -0.501903E-08  0.315E-04    2.58      59.9  T
     SCC iter.                  ...        0 min,  0.007 sec
     gradient                   ...        0 min,  0.019 sec
 * total energy  :   -42.4213719 Eh     change       -0.1044751E-04 Eh
   gradient norm :     0.0015700 Eh/α   predicted    -0.7649490E-05 ( -26.78%)
   displ. norm   :     0.0131876 α      lambda       -0.5568516E-05
   maximum displ.:     0.0064317 α      in ANC's #1, #2, #9, ...

........................................................................
.............................. CYCLE   26 ..............................
........................................................................
   1    -42.8728857 -0.428729E+02  0.223E-02    2.57       0.0  T
   2    -42.8728861 -0.429703E-06  0.932E-03    2.57       2.0  T
   3    -42.8728861 -0.198540E-07  0.250E-03    2.57       7.6  T
   4    -42.8728862 -0.546336E-07  0.124E-03    2.57      15.2  T
   5    -42.8728862 -0.116561E-07  0.533E-04    2.57      35.4  T
   6    -42.8728862 -0.138868E-08  0.111E-04    2.57     170.2  T
     SCC iter.                  ...        0 min,  0.008 sec
     gradient                   ...        0 min,  0.018 sec
 * total energy  :   -42.4213749 Eh     change       -0.3014385E-05 Eh
   gradient norm :     0.0007498 Eh/α   predicted    -0.2786340E-05 (  -7.57%)
   displ. norm   :     0.0176842 α      lambda       -0.1769274E-05
   maximum displ.:     0.0100272 α      in ANC's #4, #2, #1, ...

   *** GEOMETRY OPTIMIZATION CONVERGED AFTER 26 ITERATIONS ***

------------------------------------------------------------------------
 total energy gain   :        -0.0257017 Eh      -16.1281 kcal/mol
 total RMSD          :         0.4773697 a0        0.2526 Å
 total power (kW/mol):        -2.5953801 (step)  -62.4695 (real)
------------------------------------------------------------------------

 ANCopt (total)                0 d,  0 h,  0 min,  1.080 sec
 optimizer setup                ...        0 min,  0.000 sec (  0.016%)
 model hessian                  ...        0 min,  0.030 sec (  2.814%)
 ANC generation                 ...        0 min,  0.002 sec (  0.157%)
 coordinate transformation      ...        0 min,  0.001 sec (  0.046%)
 single point calculation       ...        0 min,  1.037 sec ( 96.036%)
 optimization log               ...        0 min,  0.003 sec (  0.269%)
 hessian update                 ...        0 min,  0.000 sec (  0.033%)
 rational function              ...        0 min,  0.005 sec (  0.482%)

================
 final structure:
================
$coord
    4.38916481163531    2.51554166269284    0.43877169284163      N 
    2.17802850729589    1.52249244334001   -0.83763095516844      C 
    2.26837729180977   -1.46108293772402   -0.78004068582567      C 
    0.03434079707264   -2.53198585157620    0.39207836371685      N 
   -2.26878839096017   -1.58379048365303   -0.75926604913656      C 
   -2.34058009078667    1.37829976344070   -0.83650214211158      C 
   -4.72635988037779    2.29766276974654    0.49658593631589      C 
   -7.04558607269575   -0.20540350781017    0.13818736475277      S 
   -4.58512201990529   -2.53648645823934    0.66643284025014      C 
   -0.10370796358875    2.47761921461975    0.31477390905232      N 
    4.46904139764403   -2.10982801566845    0.69026372160072      N 
    6.68798930998317    0.28762173602591    0.27790477361001      S 
    5.16814693728593   -4.60289549373568    0.99509707884776      C 
    7.48969129410887   -5.38154297044142    1.52035915267562      C 
    3.99394714133528    3.00111746406413    2.25401525108534      H 
    2.21993795958665    2.18173599862384   -2.80513014659423      H 
    2.35752598786150   -2.20575267374314   -2.72580601650413      H 
    0.06257945148902   -2.16296997226463    2.27998885721468      H 
   -2.30266122591762   -2.31249844106694   -2.69733483293756      H 
   -2.36212289789835    2.00944977911602   -2.80740952011458      H 
   -5.47469842433298    4.02598543078098   -0.31774989598701      H 
   -4.38979050916359    2.58951162565107    2.51141905785578      H 
   -5.23615907900168   -4.36370536737358   -0.00325929277541      H 
   -4.22003310082546   -2.64871594036441    2.69473521832674      H 
   -0.08610786998167    2.09284585534461    2.20229264287665      H 
    3.57704590478304   -5.87852171346448    0.86255764490751      H 
    9.04613241830896   -4.07422890507987    1.61075478669423      H 
    7.87769585883445   -7.33797103894270    1.89302385908292      H 
$end
           -------------------------------------------------
          |                Final Singlepoint                |
           -------------------------------------------------

          ...................................................
          :                      SETUP                      :
          :.................................................:
          :  # basis functions                  82          :
          :  # atomic orbitals                  80          :
          :  # shells                           44          :
          :  # electrons                        78          :
          :  max. iterations                   250          :
          :  Hamiltonian                  GFN2-xTB          :
          :  restarted?                      false          :
          :  GBSA solvation                  false          :
          :  PC potential                    false          :
          :  electronic temp.          300.0000000     K    :
          :  accuracy                    1.0000000          :
          :  -> integral cutoff          0.2500000E+02      :
          :  -> integral neglect         0.1000000E-07      :
          :  -> SCF convergence          0.1000000E-05 Eh   :
          :  -> wf. convergence          0.1000000E-03 e    :
          :  Broyden damping             0.4000000          :
          ...................................................

 iter      E             dE          RMSdq      gap      omega  full diag
   1    -42.8728862 -0.428729E+02  0.422E-05    2.57       0.0  T
   2    -42.8728862 -0.101537E-10  0.173E-05    2.57    1089.8  T
   3    -42.8728862 -0.122924E-11  0.840E-06    2.57    2250.8  T

   *** convergence criteria satisfied after 3 iterations ***

         #    Occupation            Energy/Eh            Energy/eV
      -------------------------------------------------------------
         1        2.0000           -0.7363970             -20.0384
       ...           ...                  ...                  ...
        33        2.0000           -0.4455815             -12.1249
        34        2.0000           -0.4231601             -11.5148
        35        2.0000           -0.4168591             -11.3433
        36        2.0000           -0.3889663             -10.5843
        37        2.0000           -0.3712544             -10.1023
        38        2.0000           -0.3697798             -10.0622
        39        2.0000           -0.3465187              -9.4293 (HOMO)
        40                         -0.2519791              -6.8567 (LUMO)
        41                         -0.2264704              -6.1626
        42                         -0.1898374              -5.1657
        43                         -0.1665644              -4.5324
        44                         -0.1369908              -3.7277
       ...                                ...                  ...
        80                          0.6133896              16.6912
      -------------------------------------------------------------
                  HL-Gap            0.0945395 Eh            2.5726 eV
             Fermi-level           -0.2992489 Eh           -8.1430 eV

 SCC (total)                   0 d,  0 h,  0 min,  0.037 sec
 SCC setup                      ...        0 min,  0.000 sec (  0.652%)
 Dispersion                     ...        0 min,  0.000 sec (  0.627%)
 integral evaluation            ...        0 min,  0.012 sec ( 33.776%)
 zeroth order Hamiltonian       ...        0 min,  0.000 sec (  0.597%)
 iterations                     ...        0 min,  0.005 sec ( 13.136%)
 molecular gradient             ...        0 min,  0.018 sec ( 49.965%)
 printout                       ...        0 min,  0.000 sec (  1.105%)

         :::::::::::::::::::::::::::::::::::::::::::::::::::::
         ::                     SUMMARY                     ::
         :::::::::::::::::::::::::::::::::::::::::::::::::::::
         :: total energy             -42.421374907423 Eh    ::
         :: gradient norm              0.000749389556 Eh/a0 ::
         :: HOMO-LUMO gap              2.572551776559 eV    ::
         ::.................................................::
         :: SCC energy               -42.872886191789 Eh    ::
         :: -> isotropic ES            0.031991032667 Eh    ::
         :: -> anisotropic ES          0.004614193311 Eh    ::
         :: -> anisotropic XC          0.037823128298 Eh    ::
         :: -> dispersion             -0.031160592793 Eh    ::
         :: repulsion energy           0.451352713533 Eh    ::
         :: add. restraining           0.000000000000 Eh    ::
         :::::::::::::::::::::::::::::::::::::::::::::::::::::

           -------------------------------------------------
          |                Property Printout                |
           -------------------------------------------------

    * Orbital Energies and Occupations

         #    Occupation            Energy/Eh            Energy/eV
      -------------------------------------------------------------
         1        2.0000           -0.7363970             -20.0384
       ...           ...                  ...                  ...
        27        2.0000           -0.4885633             -13.2945
        28        2.0000           -0.4785713             -13.0226
        29        2.0000           -0.4752322             -12.9317
        30        2.0000           -0.4645402             -12.6408
        31        2.0000           -0.4620116             -12.5720
        32        2.0000           -0.4537887             -12.3482
        33        2.0000           -0.4455815             -12.1249
        34        2.0000           -0.4231601             -11.5148
        35        2.0000           -0.4168591             -11.3433
        36        2.0000           -0.3889663             -10.5843
        37        2.0000           -0.3712544             -10.1023
        38        2.0000           -0.3697798             -10.0622
        39        2.0000           -0.3465187              -9.4293 (HOMO)
        40                         -0.2519791              -6.8567 (LUMO)
        41                         -0.2264704              -6.1626
        42                         -0.1898374              -5.1657
        43                         -0.1665644              -4.5324
        44                         -0.1369908              -3.7277
        45                         -0.0402936              -1.0964
        46                         -0.0228928              -0.6229
        47                         -0.0176800              -0.4811
        48                         -0.0097392              -0.2650
        49                         -0.0047642              -0.1296
        50                          0.0035424               0.0964
       ...                                ...                  ...
        80                          0.6133896              16.6912
      -------------------------------------------------------------
                  HL-Gap            0.0945395 Eh            2.5726 eV
             Fermi-level           -0.2992489 Eh           -8.1430 eV

     #   Z        covCN         q      C6AA      α(0)
     1   7 N      2.686    -0.232    26.079     7.585
     2   6 C      3.931     0.116    18.622     6.133
     3   6 C      3.895     0.114    18.669     6.142
     4   7 N      2.683    -0.280    27.225     7.749
     5   6 C      3.874     0.045    19.772     6.323
     6   6 C      3.874     0.044    19.792     6.326
     7   6 C      3.801    -0.014    20.823     6.497
     8  16 S      2.092    -0.189   149.071    20.549
     9   6 C      3.801    -0.013    20.810     6.495
    10   7 N      2.683    -0.278    27.170     7.741
    11   7 N      2.744    -0.141    24.040     7.282
    12  16 S      2.230     0.011   140.619    19.958
    13   6 C      2.868     0.025    27.433     8.586
    14   6 C      2.840    -0.126    31.197     9.153
    15   1 H      0.862     0.165     1.303     1.788
    16   1 H      0.923     0.036     2.500     2.473
    17   1 H      0.923     0.012     2.863     2.646
    18   1 H      0.860     0.148     1.415     1.863
    19   1 H      0.924     0.035     2.519     2.482
    20   1 H      0.924     0.036     2.503     2.474
    21   1 H      0.925     0.060     2.194     2.317
    22   1 H      0.924     0.046     2.369     2.407
    23   1 H      0.925     0.060     2.201     2.320
    24   1 H      0.924     0.045     2.380     2.412
    25   1 H      0.860     0.145     1.435     1.876
    26   1 H      0.925     0.045     2.384     2.414
    27   1 H      0.926     0.043     2.409     2.427
    28   1 H      0.926     0.040     2.455     2.450

 Mol. C6AA /au·bohr⁶  :      10489.729674
 Mol. C8AA /au·bohr⁸  :     287854.839878
 Mol. α(0) /au        :        158.869845


Wiberg/Mayer (AO) data.
largest (>0.10) Wiberg bond orders for each atom
          total WBO             WBO to atom ...
     1  N   3.164        S   12 1.126    C    2 1.000    H   15 0.942
     2  C   3.970        N   10 1.010    N    1 1.000    H   16 0.959    C    3 0.923
     3  C   3.971        N    4 0.999    N   11 0.993    H   17 0.956    C    2 0.923
     4  N   3.083        C    5 1.002    C    3 0.999    H   18 0.944
     5  C   3.981        N    4 1.002    C    9 0.998    H   19 0.967    C    6 0.942
     6  C   3.980        N   10 1.000    C    7 0.998    H   20 0.967    C    5 0.942
     7  C   3.981        C    6 0.998    S    8 0.994    H   21 0.975    H   22 0.974
     8  S   2.078        C    7 0.994    C    9 0.994
     9  C   3.981        C    5 0.998    S    8 0.994    H   23 0.975    H   24 0.974
    10  N   3.084        C    2 1.010    C    6 1.000    H   25 0.943
    11  N   3.352        C   13 1.115    S   12 1.028    C    3 0.993    C   14 0.115
    12  S   2.317        N    1 1.126    N   11 1.028
    13  C   3.964        C   14 1.855    N   11 1.115    H   26 0.951
    14  C   3.978        C   13 1.855    H   28 0.976    H   27 0.968    N   11 0.115
    15  H   0.973        N    1 0.942
    16  H   0.998        C    2 0.959
    17  H   1.000        C    3 0.956
    18  H   0.978        N    4 0.944
    19  H   0.999        C    5 0.967
    20  H   0.999        C    6 0.967
    21  H   0.996        C    7 0.975
    22  H   0.998        C    7 0.974
    23  H   0.996        C    9 0.975
    24  H   0.998        C    9 0.974
    25  H   0.979        N   10 0.943
    26  H   0.998        C   13 0.951
    27  H   0.998        C   14 0.968
    28  H   0.998        C   14 0.976

molecular dipole:
                 x           y           z       tot (Debye)
 q only:       -0.182       0.114       0.244
   full:       -0.205      -0.078       0.522       1.440
molecular quadrupole (traceless):
                xx          xy          yy          xz          yz          zz
 q only:       -9.695       0.551       3.707      -0.122       1.022       5.988
  q+dip:      -22.067      -0.891       5.385      -0.275       2.131      16.682
   full:      -20.320      -0.998       5.849      -0.210       2.212      14.471

           -------------------------------------------------
          |                Geometry Summary                 |
           -------------------------------------------------

      molecular mass/u    :      230.3454000
   center of mass at/Å    :        0.3560321      -0.3036321       0.1140192
  moments of inertia/u·Å² :        0.3754920E+03   0.1611956E+04   0.1916977E+04
rotational constants/cm⁻¹ :        0.4489479E-01   0.1045787E-01   0.8793861E-02

 * 25 selected distances

     #   Z        #   Z                                     value/Å
     1   7 N      2   6 C                                 1.4496438
     3   6 C      4   7 N                                 1.4503334
     4   7 N      5   6 C                                 1.4520177
     6   6 C      7   6 C                                 1.5258574
     5   6 C      9   6 C                                 1.5250636
     2   6 C     10   7 N                                 1.4440457
     6   6 C     10   7 N                                 1.4528337
     3   6 C     11   7 N                                 1.4420044
     1   7 N     12  16 S                                 1.6961844 (max)
    11   7 N     13   6 C                                 1.3796269
    13   6 C     14   6 C                                 1.3252442
     1   7 N     15   1 H                                 1.0161154 (min)
     2   6 C     16   1 H                                 1.0982706
     3   6 C     17   1 H                                 1.1034942
     4   7 N     18   1 H                                 1.0180546
     5   6 C     19   1 H                                 1.0958280
     6   6 C     20   1 H                                 1.0951912
     7   6 C     21   1 H                                 1.0858135
     7   6 C     22   1 H                                 1.0919541
     9   6 C     23   1 H                                 1.0859184
     9   6 C     24   1 H                                 1.0921962
    10   7 N     25   1 H                                 1.0194167
    13   6 C     26   1 H                                 1.0814384
    14   6 C     27   1 H                                 1.0766840
    14   6 C     28   1 H                                 1.0737263

 * 5 distinct bonds (by element types)

   Z      Z             #   av. dist./Å        max./Å        min./Å
   1 H    6 C          11     1.0891377     1.1034942     1.0737263
   6 C    6 C           3     1.4587217     1.5258574     1.3252442
   1 H    7 N           3     1.0178622     1.0194167     1.0161154
   6 C    7 N           7     1.4386436     1.4528337     1.3796269
   7 N   16 S           1     1.6961844     1.6961844     1.6961844


optimized geometry written to: xtbopt.xyz


           -------------------------------------------------
          | TOTAL ENERGY              -42.421374907423 Eh   |
          | GRADIENT NORM               0.000749389556 Eh/α |
          | HOMO-LUMO GAP               2.572551776559 eV   |
           -------------------------------------------------

------------------------------------------------------------------------
 * finished run on 2021/05/19 at 10:59:02.775     
------------------------------------------------------------------------
 total:
 * wall-time:     0 d,  0 h,  0 min,  1.193 sec
 *  cpu-time:     0 d,  0 h,  0 min,  1.192 sec
 * ratio c/w:     0.999 speedup
 SCF:
 * wall-time:     0 d,  0 h,  0 min,  0.050 sec
 *  cpu-time:     0 d,  0 h,  0 min,  0.050 sec
 * ratio c/w:     1.000 speedup
 ANC optimizer:
 * wall-time:     0 d,  0 h,  0 min,  1.117 sec
 *  cpu-time:     0 d,  0 h,  0 min,  1.117 sec
 * ratio c/w:     1.000 speedup

