      -----------------------------------------------------------      
     |                   =====================                   |     
     |                           x T B                           |     
     |                   =====================                   |     
     |                         S. Grimme                         |     
     |          Mulliken Center for Theoretical Chemistry        |     
     |                    University of Bonn                     |     
     |                Version 6.2 RC2 (SAW190805)                |     
      -----------------------------------------------------------      

   This program is distributed in the hope that it will be useful,
   but WITHOUT ANY WARRANTY; without even the implied warranty of
   MERCHANTABILITY or FITNESS FOR A PARTICULAR PURPOSE.
   
   FOR NON-COMMERCIAL, ACADEMIA USE ONLY.
   
   Cite this work as:
   * S. Grimme, C. Bannwarth, P. Shushkov, J. Chem. Theory Comput., 2017,
     13, 1989-2009. DOI: 10.1021/acs.jctc.7b00118
   * C. Bannwarth, S. Ehlert and S. Grimme., J. Chem. Theory Comput., 2019,
     15, 1652-1671. DOI: 10.1021/acs.jctc.8b01176
   * P. Pracht, E. Caldeweyher, S. Ehlert, S. Grimme, ChemRxiv, 2019, preprint.
     DOI: 10.26434/chemrxiv.8326202.v1
   
   for DFT-D4:
   * E. Caldeweyher, C. Bannwarth and S. Grimme, J. Chem. Phys., 2017,
     147, 034112. DOI: 10.1063/1.4993215
   * E. Caldeweyher, S. Ehlert, A. Hansen, H. Neugebauer, S. Spicher,
     C. Bannwarth and S. Grimme, J. Chem. Phys., 2019, 150, 154122.
     DOI: 10.1063/1.5090222
   
   for sTDA-xTB:
   * S. Grimme and C. Bannwarth, J. Chem. Phys., 2016, 145, 054103.
     DOI: 10.1063/1.4959605
   
   in the mass-spec context:
   * V. Asgeirsson, C. Bauer and S. Grimme, Chem. Sci., 2017, 8, 4879.
     DOI: 10.1039/c7sc00601b
   
   for metadynamics refer to:
   * S. Grimme, J. Chem. Theory Comput., 2019, 155, 2847-2862
     DOI: 10.1021/acs.jctc.9b00143
   
   with help from (in alphabetical order)
   C. Bannwarth, F. Bohle, G. Brandenburg, E. Caldeweyher, M. Checinski,
   S. Dohm, S. Ehlert, S. Ehrlich, F. März, H. Neugebauer, J. Pisarek,
   P. Pracht, P. Shushkov, and S. Spicher.
   
 * started run on 2021/05/19 at 10:59:02.794     

           -------------------------------------------------
          |                Calculation Setup                |
           -------------------------------------------------

          program call               : /ihome/ghutchison/geoffh/xtb/xtb 231.xyz -opt
          hostname                   : smp-n83
          coordinate file            : 231.xyz
          omp threads                :                     1
          number of atoms            :                    24
          number of electrons        :                    64
          charge                     :                     0
          spin                       :                   0.0
          first test random number   :      0.50767711976196


########################################################################
# WARNING! Please study the warnings concerning your input carefully
#  - the use of '-opt' is discouraged, please use '--opt' next time
########################################################################

           ------------------------------------------------- 
          |                 G F N 2 - x T B                 |
          | Geometry, Frequencies, Noncovalent interactions |
          |            JCTC 2019 parametrisation            |
           ------------------------------------------------- 
             KAB for C  - Si     :                1.0500
             KAB for H  - Pd     :                0.9500
             k(s)              :                1.8500
             k(p)              :                2.2300
             k(d)              :                2.2300
             k(f)              :                2.0000
             kEN (H0ij)        :               -2.0000
             D4 a1             :                0.5200
             D4 a2             :                5.0000
             D4 s6             :                1.0000
             D4 s8             :                2.7000
             D4 s9             :                5.0000
             alphaj            :                2.0000

  Z AO/shell   Hii/eV     exponent
  1     Wed Apr 25 08:07:45 CEST 2018   EN: 2.200 GM2: 0.406  GM3: 0.0800  RAES: 1.40
     1s    -10.707211    1.230000
  6     Wed Apr 25 08:07:45 CEST 2018   EN: 2.550 GM2: 0.538  GM3: 0.1500  RAES: 3.00
     2s    -13.970922    2.096432
     2p    -10.063292    1.800000
  8     Wed Apr 25 08:07:45 CEST 2018   EN: 3.440 GM2: 0.452  GM3:-0.0517  RAES: 1.80
     2s    -20.229985    2.439742
     2p    -15.503117    2.137023
 16     Tue Apr 24 11:44:34 CEST 2018   EN: 2.580 GM2: 0.340  GM3:-0.0502  RAES: 3.10
     3s    -20.029654    1.981333
     3p    -11.377694    2.025643
     3d     -0.420282    1.702555

           ------------------------------------------------- 
          |        Self-Consistent Charge Iterations        |
           ------------------------------------------------- 

          ...................................................
          :                      SETUP                      :
          :.................................................:
          :  # basis functions                  66          :
          :  # atomic orbitals                  65          :
          :  # shells                           37          :
          :  # electrons                        64          :
          :  max. iterations                   250          :
          :  Hamiltonian                  GFN2-xTB          :
          :  restarted?                      false          :
          :  GBSA solvation                  false          :
          :  PC potential                    false          :
          :  electronic temp.          300.0000000     K    :
          :  accuracy                    1.0000000          :
          :  -> integral cutoff          0.2500000E+02      :
          :  -> integral neglect         0.1000000E-07      :
          :  -> SCF convergence          0.1000000E-05 Eh   :
          :  -> wf. convergence          0.1000000E-03 e    :
          :  Broyden damping             0.4000000          :
          ...................................................

 iter      E             dE          RMSdq      gap      omega  full diag
   1    -35.2331614 -0.352332E+02  0.402E+00    3.11       0.0  T
   2    -35.2722528 -0.390914E-01  0.223E+00    3.14       1.0  T
   3    -35.2662814  0.597140E-02  0.982E-01    3.13       1.0  T
   4    -35.2713784 -0.509691E-02  0.520E-01    3.13       1.0  T
   5    -35.2756162 -0.423787E-02  0.122E-01    3.14       1.0  T
   6    -35.2756625 -0.462257E-04  0.549E-02    3.13       1.0  T
   7    -35.2757007 -0.382837E-04  0.194E-02    3.13       1.0  T
   8    -35.2757021 -0.140701E-05  0.120E-02    3.13       1.7  T
   9    -35.2757031 -0.920039E-06  0.491E-03    3.13       4.2  T
  10    -35.2757032 -0.147903E-06  0.184E-03    3.13      11.1  T
  11    -35.2757032 -0.275961E-07  0.905E-04    3.13      22.5  T
  12    -35.2757033 -0.901263E-08  0.465E-04    3.13      43.9  T

   *** convergence criteria satisfied after 12 iterations ***

         #    Occupation            Energy/Eh            Energy/eV
      -------------------------------------------------------------
         1        2.0000           -0.7283866             -19.8204
       ...           ...                  ...                  ...
        26        2.0000           -0.4383264             -11.9275
        27        2.0000           -0.4368714             -11.8879
        28        2.0000           -0.4335456             -11.7974
        29        2.0000           -0.4233515             -11.5200
        30        2.0000           -0.4068099             -11.0699
        31        2.0000           -0.3810104             -10.3678
        32        2.0000           -0.3718048             -10.1173 (HOMO)
        33                         -0.2566242              -6.9831 (LUMO)
        34                         -0.2071158              -5.6359
        35                         -0.1923417              -5.2339
        36                         -0.1612368              -4.3875
        37                         -0.1074604              -2.9241
       ...                                ...                  ...
        65                          0.6766811              18.4134
      -------------------------------------------------------------
                  HL-Gap            0.1151806 Eh            3.1342 eV
             Fermi-level           -0.3142145 Eh           -8.5502 eV

 SCC (total)                   0 d,  0 h,  0 min,  0.036 sec
 SCC setup                      ...        0 min,  0.000 sec (  0.841%)
 Dispersion                     ...        0 min,  0.000 sec (  0.944%)
 integral evaluation            ...        0 min,  0.008 sec ( 23.016%)
 zeroth order Hamiltonian       ...        0 min,  0.000 sec (  0.482%)
 iterations                     ...        0 min,  0.013 sec ( 37.294%)
 molecular gradient             ...        0 min,  0.013 sec ( 36.226%)
 printout                       ...        0 min,  0.000 sec (  1.050%)

         :::::::::::::::::::::::::::::::::::::::::::::::::::::
         ::                     SUMMARY                     ::
         :::::::::::::::::::::::::::::::::::::::::::::::::::::
         :: total energy             -34.804832964164 Eh    ::
         :: gradient norm              0.057122512776 Eh/a0 ::
         :: HOMO-LUMO gap              3.134224415951 eV    ::
         ::.................................................::
         :: SCC energy               -35.275703251253 Eh    ::
         :: -> isotropic ES            0.018314926316 Eh    ::
         :: -> anisotropic ES          0.003788866548 Eh    ::
         :: -> anisotropic XC          0.014620129968 Eh    ::
         :: -> dispersion             -0.023800616203 Eh    ::
         :: repulsion energy           0.470681439101 Eh    ::
         :: add. restraining           0.000000000000 Eh    ::
         :::::::::::::::::::::::::::::::::::::::::::::::::::::

      ----------------------------------------------------------- 
     |                   =====================                   |
     |                        A N C O P T                        |
     |                   =====================                   |
     |               Approximate Normal Coordinate               |
     |                Rational Function Optimizer                |
      ----------------------------------------------------------- 

          ...................................................
          :                      SETUP                      :
          :.................................................:
          :   optimization level            normal          :
          :   max. optcycles                   200          :
          :   ANC micro-cycles                  20          :
          :   degrees of freedom                66          :
          :.................................................:
          :   RF solver                   davidson          :
          :   input Hessian                  false          :
          :   write xtbopt.log                true          :
          :   linear?                        false          :
          :   energy convergence         0.5000000E-05 Eh   :
          :   grad. convergence          0.1000000E-02 Eh/α :
          :   maximium RF displ.         2.0000000          :
          :   Hlow (freq-cutoff)         0.5000000E-02      :
          :   Hmax (freq-cutoff)         5.0000000          :
          :   S6 in model hess.         20.0000000          :
          ...................................................

generating ANC from model Hessian ...
Using Lindh-Hessian (1995)
 Shifting diagonal of input Hessian by   3.553260750722905E-003
 Lowest  eigenvalues of input Hessian
   -0.000000   -0.000000   -0.000000    0.000000    0.000000    0.000000
    0.005000    0.007060    0.008155    0.009588    0.012896    0.014848
    0.016791    0.020938    0.024670    0.029176    0.032121    0.040812
 Highest eigenvalues
    1.476702    1.545906    1.760926    1.815327    1.960282    2.008222
 

........................................................................
.............................. CYCLE    1 ..............................
........................................................................
   1    -35.2757033 -0.352757E+02  0.146E-04    3.13       0.0  T
   2    -35.2757033 -0.203997E-10  0.964E-05    3.13     211.8  T
   3    -35.2757033  0.325926E-10  0.785E-05    3.13     260.1  T
     SCC iter.                  ...        0 min,  0.004 sec
     gradient                   ...        0 min,  0.013 sec
 * total energy  :   -34.8048330 Eh     change        0.4502418E-08 Eh
   gradient norm :     0.0571234 Eh/α   predicted     0.0000000E+00 (-100.00%)
   displ. norm   :     0.2822850 α      lambda       -0.5799374E-02
   maximum displ.:     0.1314561 α      in ANC's #7, #2, #3, ...

........................................................................
.............................. CYCLE    2 ..............................
........................................................................
   1    -35.2883973 -0.352884E+02  0.308E-01    3.21       0.0  T
   2    -35.2884424 -0.451383E-04  0.156E-01    3.20       1.0  T
   3    -35.2883558  0.866042E-04  0.809E-02    3.21       1.0  T
   4    -35.2884693 -0.113498E-03  0.249E-02    3.20       1.0  T
   5    -35.2884712 -0.190206E-05  0.114E-02    3.20       1.8  T
   6    -35.2884729 -0.167812E-05  0.188E-03    3.20      10.9  T
   7    -35.2884729 -0.220520E-07  0.106E-03    3.20      19.3  T
     SCC iter.                  ...        0 min,  0.007 sec
     gradient                   ...        0 min,  0.012 sec
 * total energy  :   -34.8085855 Eh     change       -0.3752543E-02 Eh
   gradient norm :     0.0216902 Eh/α   predicted    -0.3130768E-02 ( -16.57%)
   displ. norm   :     0.2480194 α      lambda       -0.1477960E-02
   maximum displ.:     0.1261179 α      in ANC's #7, #3, #4, ...

........................................................................
.............................. CYCLE    3 ..............................
........................................................................
   1    -35.2935536 -0.352936E+02  0.161E-01    3.24       0.0  T
   2    -35.2935655 -0.119124E-04  0.891E-02    3.24       1.0  T
   3    -35.2935284  0.371099E-04  0.539E-02    3.24       1.0  T
   4    -35.2935762 -0.477346E-04  0.125E-02    3.24       1.6  T
   5    -35.2935769 -0.725621E-06  0.569E-03    3.24       3.6  T
   6    -35.2935773 -0.405396E-06  0.112E-03    3.24      18.3  T
     SCC iter.                  ...        0 min,  0.007 sec
     gradient                   ...        0 min,  0.012 sec
 * total energy  :   -34.8095264 Eh     change       -0.9408953E-03 Eh
   gradient norm :     0.0057507 Eh/α   predicted    -0.7844493E-03 ( -16.63%)
   displ. norm   :     0.2606965 α      lambda       -0.6015913E-03
   maximum displ.:     0.1307296 α      in ANC's #4, #7, #1, ...

........................................................................
.............................. CYCLE    4 ..............................
........................................................................
   1    -35.2933214 -0.352933E+02  0.164E-01    3.23       0.0  T
   2    -35.2933262 -0.471028E-05  0.927E-02    3.23       1.0  T
   3    -35.2933039  0.222319E-04  0.378E-02    3.23       1.0  T
   4    -35.2933293 -0.254059E-04  0.950E-03    3.23       2.1  T
   5    -35.2933298 -0.429541E-06  0.308E-03    3.24       6.6  T
   6    -35.2933299 -0.110865E-06  0.717E-04    3.24      28.5  T
   7    -35.2933299 -0.591252E-08  0.358E-04    3.23      57.0  T
     SCC iter.                  ...        0 min,  0.007 sec
     gradient                   ...        0 min,  0.012 sec
 * total energy  :   -34.8099782 Eh     change       -0.4518429E-03 Eh
   gradient norm :     0.0085931 Eh/α   predicted    -0.3212387E-03 ( -28.90%)
   displ. norm   :     0.4073584 α      lambda       -0.7074065E-03
   maximum displ.:     0.2031371 α      in ANC's #4, #1, #3, ...

........................................................................
.............................. CYCLE    5 ..............................
........................................................................
   1    -35.2902394 -0.352902E+02  0.245E-01    3.20       0.0  T
   2    -35.2902480 -0.857265E-05  0.138E-01    3.20       1.0  T
   3    -35.2902186  0.293737E-04  0.450E-02    3.20       1.0  T
   4    -35.2902525 -0.338484E-04  0.130E-02    3.20       1.6  T
   5    -35.2902532 -0.750880E-06  0.312E-03    3.20       6.5  T
   6    -35.2902533 -0.785614E-07  0.878E-04    3.20      23.2  T
   7    -35.2902533 -0.564765E-08  0.551E-04    3.20      37.0  T
     SCC iter.                  ...        0 min,  0.007 sec
     gradient                   ...        0 min,  0.012 sec
 * total energy  :   -34.8104773 Eh     change       -0.4990838E-03 Eh
   gradient norm :     0.0118557 Eh/α   predicted    -0.4124027E-03 ( -17.37%)
   displ. norm   :     0.3464354 α      lambda       -0.5528030E-03
   maximum displ.:     0.1833491 α      in ANC's #4, #1, #3, ...

........................................................................
.............................. CYCLE    6 ..............................
........................................................................
   1    -35.2890657 -0.352891E+02  0.212E-01    3.16       0.0  T
   2    -35.2890726 -0.686778E-05  0.122E-01    3.16       1.0  T
   3    -35.2890492  0.233265E-04  0.397E-02    3.16       1.0  T
   4    -35.2890761 -0.268550E-04  0.109E-02    3.16       1.9  T
   5    -35.2890766 -0.522652E-06  0.339E-03    3.16       6.0  T
   6    -35.2890767 -0.102685E-06  0.106E-03    3.16      19.2  T
   7    -35.2890767 -0.139443E-07  0.578E-04    3.16      35.3  T
     SCC iter.                  ...        0 min,  0.008 sec
     gradient                   ...        0 min,  0.012 sec
 * total energy  :   -34.8108665 Eh     change       -0.3892218E-03 Eh
   gradient norm :     0.0109317 Eh/α   predicted    -0.3095753E-03 ( -20.46%)
   displ. norm   :     0.2750553 α      lambda       -0.5047721E-03
   maximum displ.:     0.1533067 α      in ANC's #4, #1, #3, ...

........................................................................
.............................. CYCLE    7 ..............................
........................................................................
   1    -35.2918747 -0.352919E+02  0.161E-01    3.13       0.0  T
   2    -35.2918790 -0.426183E-05  0.926E-02    3.14       1.0  T
   3    -35.2918596  0.193972E-04  0.349E-02    3.13       1.0  T
   4    -35.2918820 -0.224082E-04  0.838E-03    3.13       2.4  T
   5    -35.2918823 -0.262132E-06  0.289E-03    3.13       7.1  T
   6    -35.2918824 -0.985804E-07  0.937E-04    3.13      21.8  T
     SCC iter.                  ...        0 min,  0.007 sec
     gradient                   ...        0 min,  0.012 sec
 * total energy  :   -34.8112134 Eh     change       -0.3468640E-03 Eh
   gradient norm :     0.0073457 Eh/α   predicted    -0.2714860E-03 ( -21.73%)
   displ. norm   :     0.2577932 α      lambda       -0.2851748E-03
   maximum displ.:     0.1529224 α      in ANC's #4, #1, #3, ...

........................................................................
.............................. CYCLE    8 ..............................
........................................................................
   1    -35.2927921 -0.352928E+02  0.155E-01    3.10       0.0  T
   2    -35.2927959 -0.388178E-05  0.898E-02    3.11       1.0  T
   3    -35.2927764  0.195429E-04  0.344E-02    3.10       1.0  T
   4    -35.2927988 -0.223711E-04  0.700E-03    3.11       2.9  T
   5    -35.2927989 -0.170294E-06  0.232E-03    3.11       8.8  T
   6    -35.2927990 -0.355068E-07  0.101E-03    3.11      20.2  T
     SCC iter.                  ...        0 min,  0.007 sec
     gradient                   ...        0 min,  0.013 sec
 * total energy  :   -34.8114064 Eh     change       -0.1929947E-03 Eh
   gradient norm :     0.0057258 Eh/α   predicted    -0.1520636E-03 ( -21.21%)
   displ. norm   :     0.1471014 α      lambda       -0.1579607E-03
   maximum displ.:     0.0894299 α      in ANC's #4, #1, #3, ...

........................................................................
.............................. CYCLE    9 ..............................
........................................................................
   1    -35.2955792 -0.352956E+02  0.807E-02    3.11       0.0  T
   2    -35.2955804 -0.119435E-05  0.469E-02    3.11       1.0  T
   3    -35.2955788  0.160465E-05  0.111E-02    3.11       1.8  T
   4    -35.2955806 -0.179960E-05  0.415E-03    3.11       4.9  T
   5    -35.2955808 -0.191118E-06  0.120E-03    3.11      17.0  T
   6    -35.2955808 -0.283508E-08  0.471E-04    3.11      43.4  T
     SCC iter.                  ...        0 min,  0.007 sec
     gradient                   ...        0 min,  0.013 sec
 * total energy  :   -34.8114927 Eh     change       -0.8633432E-04 Eh
   gradient norm :     0.0035606 Eh/α   predicted    -0.8069507E-04 (  -6.53%)
   displ. norm   :     0.1685478 α      lambda       -0.7217617E-04
   maximum displ.:     0.1096672 α      in ANC's #4, #1, #2, ...

........................................................................
.............................. CYCLE   10 ..............................
........................................................................
   1    -35.2931981 -0.352932E+02  0.103E-01    3.09       0.0  T
   2    -35.2931992 -0.105280E-05  0.594E-02    3.09       1.0  T
   3    -35.2931958  0.336722E-05  0.153E-02    3.09       1.3  T
   4    -35.2931997 -0.387507E-05  0.466E-03    3.09       4.4  T
   5    -35.2931998 -0.103248E-06  0.108E-03    3.09      18.8  T
   6    -35.2931998 -0.166885E-07  0.368E-04    3.09      55.5  T
   7    -35.2931998 -0.401336E-09  0.209E-04    3.09      97.5  T
     SCC iter.                  ...        0 min,  0.008 sec
     gradient                   ...        0 min,  0.013 sec
 * total energy  :   -34.8115107 Eh     change       -0.1797917E-04 Eh
   gradient norm :     0.0051277 Eh/α   predicted    -0.3711335E-04 ( 106.42%)
   displ. norm   :     0.0522990 α      lambda       -0.5980373E-04
   maximum displ.:     0.0236237 α      in ANC's #3, #5, #1, ...

........................................................................
.............................. CYCLE   11 ..............................
........................................................................
   1    -35.2947356 -0.352947E+02  0.262E-02    3.10       0.0  T
   2    -35.2947357 -0.154370E-06  0.154E-02    3.10       1.3  T
   3    -35.2947350  0.773640E-06  0.687E-03    3.10       3.0  T
   4    -35.2947358 -0.893473E-06  0.141E-03    3.10      14.5  T
   5    -35.2947359 -0.670491E-08  0.494E-04    3.10      41.3  T
     SCC iter.                  ...        0 min,  0.006 sec
     gradient                   ...        0 min,  0.012 sec
 * total energy  :   -34.8115405 Eh     change       -0.2981858E-04 Eh
   gradient norm :     0.0033839 Eh/α   predicted    -0.2998579E-04 (   0.56%)
   displ. norm   :     0.0457375 α      lambda       -0.2874971E-04
   maximum displ.:     0.0301591 α      in ANC's #3, #1, #7, ...

........................................................................
.............................. CYCLE   12 ..............................
........................................................................
   1    -35.2953584 -0.352954E+02  0.256E-02    3.11       0.0  T
   2    -35.2953587 -0.282021E-06  0.149E-02    3.11       1.4  T
   3    -35.2953579  0.761063E-06  0.718E-03    3.11       2.8  T
   4    -35.2953588 -0.897797E-06  0.154E-03    3.11      13.3  T
   5    -35.2953588 -0.132157E-07  0.591E-04    3.11      34.6  T
   6    -35.2953588 -0.110661E-08  0.212E-04    3.11      96.4  T
     SCC iter.                  ...        0 min,  0.006 sec
     gradient                   ...        0 min,  0.013 sec
 * total energy  :   -34.8115570 Eh     change       -0.1643280E-04 Eh
   gradient norm :     0.0025683 Eh/α   predicted    -0.1440750E-04 ( -12.32%)
   displ. norm   :     0.0489126 α      lambda       -0.2297357E-04
   maximum displ.:     0.0280281 α      in ANC's #2, #4, #3, ...

........................................................................
.............................. CYCLE   13 ..............................
........................................................................
   1    -35.2950417 -0.352950E+02  0.312E-02    3.11       0.0  T
   2    -35.2950418 -0.899632E-07  0.184E-02    3.11       1.1  T
   3    -35.2950413  0.489879E-06  0.526E-03    3.11       3.9  T
   4    -35.2950419 -0.551957E-06  0.905E-04    3.11      22.6  T
   5    -35.2950419 -0.332749E-08  0.376E-04    3.11      54.3  T
     SCC iter.                  ...        0 min,  0.006 sec
     gradient                   ...        0 min,  0.013 sec
 * total energy  :   -34.8115739 Eh     change       -0.1694047E-04 Eh
   gradient norm :     0.0020434 Eh/α   predicted    -0.1151748E-04 ( -32.01%)
   displ. norm   :     0.1161065 α      lambda       -0.3580078E-04
   maximum displ.:     0.0731453 α      in ANC's #2, #4, #3, ...

........................................................................
.............................. CYCLE   14 ..............................
........................................................................
   1    -35.2940597 -0.352941E+02  0.711E-02    3.10       0.0  T
   2    -35.2940602 -0.451169E-06  0.416E-02    3.10       1.0  T
   3    -35.2940574  0.278009E-05  0.127E-02    3.10       1.6  T
   4    -35.2940605 -0.313138E-05  0.182E-03    3.10      11.2  T
   5    -35.2940605 -0.138397E-07  0.830E-04    3.10      24.6  T
   6    -35.2940605 -0.487545E-08  0.393E-04    3.10      51.9  T
     SCC iter.                  ...        0 min,  0.006 sec
     gradient                   ...        0 min,  0.013 sec
 * total energy  :   -34.8115919 Eh     change       -0.1799635E-04 Eh
   gradient norm :     0.0027754 Eh/α   predicted    -0.1814221E-04 (   0.81%)
   displ. norm   :     0.0433406 α      lambda       -0.1885263E-04
   maximum displ.:     0.0257430 α      in ANC's #2, #3, #6, ...

........................................................................
.............................. CYCLE   15 ..............................
........................................................................
   1    -35.2941616 -0.352942E+02  0.240E-02    3.09       0.0  T
   2    -35.2941618 -0.128801E-06  0.142E-02    3.09       1.4  T
   3    -35.2941611  0.648742E-06  0.607E-03    3.09       3.4  T
   4    -35.2941619 -0.737398E-06  0.814E-04    3.09      25.1  T
   5    -35.2941619 -0.430388E-08  0.371E-04    3.09      55.0  T
     SCC iter.                  ...        0 min,  0.006 sec
     gradient                   ...        0 min,  0.013 sec
 * total energy  :   -34.8116061 Eh     change       -0.1424008E-04 Eh
   gradient norm :     0.0019715 Eh/α   predicted    -0.9447783E-05 ( -33.65%)
   displ. norm   :     0.1518917 α      lambda       -0.3275479E-04
   maximum displ.:     0.0962668 α      in ANC's #2, #3, #6, ...

........................................................................
.............................. CYCLE   16 ..............................
........................................................................
   1    -35.2943192 -0.352943E+02  0.810E-02    3.08       0.0  T
   2    -35.2943199 -0.738663E-06  0.476E-02    3.08       1.0  T
   3    -35.2943143  0.566636E-05  0.178E-02    3.08       1.1  T
   4    -35.2943207 -0.638323E-05  0.235E-03    3.08       8.7  T
   5    -35.2943207 -0.148861E-07  0.116E-03    3.08      17.5  T
   6    -35.2943207 -0.939028E-08  0.501E-04    3.08      40.8  T
   7    -35.2943207 -0.352532E-08  0.237E-04    3.08      86.1  T
     SCC iter.                  ...        0 min,  0.007 sec
     gradient                   ...        0 min,  0.013 sec
 * total energy  :   -34.8116369 Eh     change       -0.3080051E-04 Eh
   gradient norm :     0.0032085 Eh/α   predicted    -0.1654674E-04 ( -46.28%)
   displ. norm   :     0.1062717 α      lambda       -0.2425045E-04
   maximum displ.:     0.0743565 α      in ANC's #2, #3, #6, ...

........................................................................
.............................. CYCLE   17 ..............................
........................................................................
   1    -35.2941117 -0.352941E+02  0.633E-02    3.07       0.0  T
   2    -35.2941120 -0.316770E-06  0.363E-02    3.07       1.0  T
   3    -35.2941117  0.330765E-06  0.607E-03    3.07       3.4  T
   4    -35.2941121 -0.392354E-06  0.287E-03    3.07       7.1  T
   5    -35.2941122 -0.696593E-07  0.356E-04    3.07      57.3  T
   6    -35.2941122 -0.128797E-08  0.174E-04    3.07     117.0  T
     SCC iter.                  ...        0 min,  0.007 sec
     gradient                   ...        0 min,  0.013 sec
 * total energy  :   -34.8116556 Eh     change       -0.1869534E-04 Eh
   gradient norm :     0.0030261 Eh/α   predicted    -0.1226329E-04 ( -34.40%)
   displ. norm   :     0.1729010 α      lambda       -0.4190910E-04
   maximum displ.:     0.1133703 α      in ANC's #2, #3, #7, ...

........................................................................
.............................. CYCLE   18 ..............................
........................................................................
   1    -35.2941654 -0.352942E+02  0.103E-01    3.07       0.0  T
   2    -35.2941666 -0.117584E-05  0.581E-02    3.07       1.0  T
   3    -35.2941651  0.146692E-05  0.122E-02    3.07       1.7  T
   4    -35.2941668 -0.173537E-05  0.552E-03    3.07       3.7  T
   5    -35.2941671 -0.223338E-06  0.876E-04    3.07      23.3  T
   6    -35.2941671 -0.121241E-07  0.420E-04    3.07      48.6  T
     SCC iter.                  ...        0 min,  0.007 sec
     gradient                   ...        0 min,  0.013 sec
 * total energy  :   -34.8116796 Eh     change       -0.2400175E-04 Eh
   gradient norm :     0.0021914 Eh/α   predicted    -0.2158535E-04 ( -10.07%)
   displ. norm   :     0.0923653 α      lambda       -0.1451647E-04
   maximum displ.:     0.0634410 α      in ANC's #2, #3, #1, ...

........................................................................
.............................. CYCLE   19 ..............................
........................................................................
   1    -35.2939763 -0.352940E+02  0.614E-02    3.07       0.0  T
   2    -35.2939767 -0.392100E-06  0.349E-02    3.07       1.0  T
   3    -35.2939763  0.363630E-06  0.636E-03    3.07       3.2  T
   4    -35.2939767 -0.413912E-06  0.323E-03    3.07       6.3  T
   5    -35.2939768 -0.994004E-07  0.510E-04    3.07      40.0  T
   6    -35.2939768 -0.328783E-08  0.238E-04    3.07      85.8  T
     SCC iter.                  ...        0 min,  0.007 sec
     gradient                   ...        0 min,  0.013 sec
 * total energy  :   -34.8116901 Eh     change       -0.1048750E-04 Eh
   gradient norm :     0.0020215 Eh/α   predicted    -0.7335517E-05 ( -30.05%)
   displ. norm   :     0.0941987 α      lambda       -0.2318569E-04
   maximum displ.:     0.0563192 α      in ANC's #2, #3, #1, ...

........................................................................
.............................. CYCLE   20 ..............................
........................................................................
   1    -35.2949847 -0.352950E+02  0.723E-02    3.07       0.0  T
   2    -35.2949857 -0.100007E-05  0.399E-02    3.07       1.0  T
   3    -35.2949854  0.359573E-06  0.812E-03    3.07       2.5  T
   4    -35.2949858 -0.420877E-06  0.470E-03    3.07       4.3  T
   5    -35.2949860 -0.226987E-06  0.117E-03    3.07      17.4  T
   6    -35.2949860 -0.179915E-07  0.420E-04    3.07      48.6  T
   7    -35.2949860 -0.178450E-08  0.221E-04    3.07      92.6  T
     SCC iter.                  ...        0 min,  0.008 sec
     gradient                   ...        0 min,  0.013 sec
 * total energy  :   -34.8117009 Eh     change       -0.1072892E-04 Eh
   gradient norm :     0.0017039 Eh/α   predicted    -0.1169761E-04 (   9.03%)
   displ. norm   :     0.1383960 α      lambda       -0.8965908E-05
   maximum displ.:     0.0954262 α      in ANC's #2, #3, #1, ...
 * RMSD in coord.:     0.5116566 α      energy gain  -0.6867897E-02 Eh

generating ANC from model Hessian ...
Using Lindh-Hessian (1995)
 Shifting diagonal of input Hessian by   3.538990023335951E-003
 Lowest  eigenvalues of input Hessian
   -0.000000   -0.000000   -0.000000    0.000000    0.000000    0.000000
    0.005000    0.007208    0.008593    0.009313    0.013402    0.015065
    0.017205    0.022535    0.024603    0.029443    0.031712    0.040831
 Highest eigenvalues
    1.469387    1.527281    1.784645    1.835466    1.989069    2.027808
 

........................................................................
.............................. CYCLE   21 ..............................
........................................................................
   1    -35.2937213 -0.352937E+02  0.891E-02    3.06       0.0  T
   2    -35.2937222 -0.892462E-06  0.508E-02    3.06       1.0  T
   3    -35.2937206  0.159173E-05  0.114E-02    3.06       1.8  T
   4    -35.2937225 -0.188699E-05  0.428E-03    3.06       4.8  T
   5    -35.2937226 -0.106799E-06  0.927E-04    3.06      22.0  T
   6    -35.2937226 -0.107135E-07  0.378E-04    3.06      54.0  T
     SCC iter.                  ...        0 min,  0.006 sec
     gradient                   ...        0 min,  0.013 sec
 * total energy  :   -34.8117009 Eh     change       -0.6044874E-07 Eh
   gradient norm :     0.0019292 Eh/α   predicted     0.0000000E+00 (-100.00%)
   displ. norm   :     0.0180089 α      lambda       -0.1142536E-04
   maximum displ.:     0.0067139 α      in ANC's #1, #9, #7, ...

........................................................................
.............................. CYCLE   22 ..............................
........................................................................
   1    -35.2949353 -0.352949E+02  0.125E-02    3.06       0.0  T
   2    -35.2949354 -0.522830E-07  0.724E-03    3.06       2.8  T
   3    -35.2949352  0.158559E-06  0.319E-03    3.06       6.4  T
   4    -35.2949354 -0.190445E-06  0.811E-04    3.06      25.2  T
   5    -35.2949354 -0.272125E-08  0.361E-04    3.06      56.5  T
     SCC iter.                  ...        0 min,  0.006 sec
     gradient                   ...        0 min,  0.013 sec
 * total energy  :   -34.8117066 Eh     change       -0.5655196E-05 Eh
   gradient norm :     0.0008750 Eh/α   predicted    -0.5713586E-05 (   1.03%)
   displ. norm   :     0.0127286 α      lambda       -0.3271459E-05
   maximum displ.:     0.0061781 α      in ANC's #13, #5, #9, ...

........................................................................
.............................. CYCLE   23 ..............................
........................................................................
   1    -35.2949179 -0.352949E+02  0.960E-03    3.06       0.0  T
   2    -35.2949179 -0.167410E-07  0.559E-03    3.06       3.6  T
   3    -35.2949178  0.425120E-07  0.159E-03    3.06      12.8  T
   4    -35.2949179 -0.495088E-07  0.512E-04    3.06      39.9  T
   5    -35.2949179 -0.126006E-08  0.142E-04    3.06     143.7  T
     SCC iter.                  ...        0 min,  0.006 sec
     gradient                   ...        0 min,  0.013 sec
 * total energy  :   -34.8117071 Eh     change       -0.4875046E-06 Eh
   gradient norm :     0.0006754 Eh/α   predicted    -0.1647317E-05 ( 237.91%)
   displ. norm   :     0.0130274 α      lambda        0.1134031E-04
   maximum displ.:     0.0061585 α      in ANC's #13, #5, #9, ...

   *** GEOMETRY OPTIMIZATION CONVERGED AFTER 23 ITERATIONS ***

------------------------------------------------------------------------
 total energy gain   :        -0.0068741 Eh       -4.3136 kcal/mol
 total RMSD          :         0.5115789 a0        0.2707 Å
 total power (kW/mol):        -0.7846934 (step)  -26.7078 (real)
------------------------------------------------------------------------

 ANCopt (total)                0 d,  0 h,  0 min,  0.676 sec
 optimizer setup                ...        0 min,  0.000 sec (  0.023%)
 model hessian                  ...        0 min,  0.018 sec (  2.662%)
 ANC generation                 ...        0 min,  0.001 sec (  0.208%)
 coordinate transformation      ...        0 min,  0.000 sec (  0.061%)
 single point calculation       ...        0 min,  0.647 sec ( 95.682%)
 optimization log               ...        0 min,  0.002 sec (  0.337%)
 hessian update                 ...        0 min,  0.000 sec (  0.042%)
 rational function              ...        0 min,  0.005 sec (  0.772%)

================
 final structure:
================
$coord
   -2.90295144381979   -2.42053926412551   -0.27814102016681      C 
   -5.32342008342800   -0.37146563262347    0.31895599518824      S 
   -3.29699498837580    2.22408043218741    0.11112084877874      C 
   -0.85888893901425    1.48314314380905   -0.40700979335529      C 
   -0.66170247899974   -1.19595683216102   -0.63233052694860      C 
    1.48202622671938   -2.50595828149706   -1.26331636393159      O 
    3.41224756294362   -2.53541575747650    0.58814634274275      C 
    4.14888837265038    0.10470909190293    1.52558116101642      C 
    3.92200487130702    2.02953890220099   -0.61954216167480      C 
    1.31722108067035    3.28462256449798   -0.65353479877351      C 
   -4.43808014983834    4.66508440323242    0.50818676198774      C 
   -3.48735443286713    6.93827117097006    0.00799073805429      C 
   -3.23871488349688   -4.41380693650226   -0.39152521799530      H 
    5.00728767972294   -3.43034950622786   -0.37173215370283      H 
    2.84216200595777   -3.73518037423466    2.18701376870061      H 
    6.07886542536094    0.02029040327059    2.24269722197455      H 
    2.92154266672259    0.66842968853700    3.08606107058266      H 
    4.26559789592475    1.07881225755104   -2.41715950661917      H 
    5.34505287703506    3.50719440114805   -0.40524015073366      H 
    1.11068710591981    4.35184828280471   -2.41332871955022      H 
    1.20318961077324    4.63371706445253    0.91092699041541      H 
   -6.32874514630838    4.54955160987299    1.28495936675773      H 
   -1.66249173223741    7.23575217350041   -0.82421664316549      H 
   -4.56929041799729    8.61308822875097    0.41264959090803      H 
$end
           -------------------------------------------------
          |                Final Singlepoint                |
           -------------------------------------------------

          ...................................................
          :                      SETUP                      :
          :.................................................:
          :  # basis functions                  66          :
          :  # atomic orbitals                  65          :
          :  # shells                           37          :
          :  # electrons                        64          :
          :  max. iterations                   250          :
          :  Hamiltonian                  GFN2-xTB          :
          :  restarted?                      false          :
          :  GBSA solvation                  false          :
          :  PC potential                    false          :
          :  electronic temp.          300.0000000     K    :
          :  accuracy                    1.0000000          :
          :  -> integral cutoff          0.2500000E+02      :
          :  -> integral neglect         0.1000000E-07      :
          :  -> SCF convergence          0.1000000E-05 Eh   :
          :  -> wf. convergence          0.1000000E-03 e    :
          :  Broyden damping             0.4000000          :
          ...................................................

 iter      E             dE          RMSdq      gap      omega  full diag
   1    -35.2949179 -0.352949E+02  0.564E-05    3.06       0.0  T
   2    -35.2949179 -0.237321E-11  0.279E-05    3.06     732.9  T
   3    -35.2949179 -0.484590E-11  0.243E-05    3.06     841.5  T

   *** convergence criteria satisfied after 3 iterations ***

         #    Occupation            Energy/Eh            Energy/eV
      -------------------------------------------------------------
         1        2.0000           -0.7282052             -19.8155
       ...           ...                  ...                  ...
        26        2.0000           -0.4391622             -11.9502
        27        2.0000           -0.4354649             -11.8496
        28        2.0000           -0.4345368             -11.8243
        29        2.0000           -0.4287810             -11.6677
        30        2.0000           -0.4075459             -11.0899
        31        2.0000           -0.3829391             -10.4203
        32        2.0000           -0.3732293             -10.1561 (HOMO)
        33                         -0.2607817              -7.0962 (LUMO)
        34                         -0.2036270              -5.5410
        35                         -0.1945198              -5.2932
        36                         -0.1473212              -4.0088
        37                         -0.1138237              -3.0973
       ...                                ...                  ...
        65                          0.6806268              18.5208
      -------------------------------------------------------------
                  HL-Gap            0.1124476 Eh            3.0599 eV
             Fermi-level           -0.3170055 Eh           -8.6262 eV

 SCC (total)                   0 d,  0 h,  0 min,  0.026 sec
 SCC setup                      ...        0 min,  0.000 sec (  0.747%)
 Dispersion                     ...        0 min,  0.000 sec (  0.755%)
 integral evaluation            ...        0 min,  0.008 sec ( 31.454%)
 zeroth order Hamiltonian       ...        0 min,  0.000 sec (  0.597%)
 iterations                     ...        0 min,  0.004 sec ( 14.940%)
 molecular gradient             ...        0 min,  0.013 sec ( 49.957%)
 printout                       ...        0 min,  0.000 sec (  1.352%)

         :::::::::::::::::::::::::::::::::::::::::::::::::::::
         ::                     SUMMARY                     ::
         :::::::::::::::::::::::::::::::::::::::::::::::::::::
         :: total energy             -34.811707074044 Eh    ::
         :: gradient norm              0.000675603251 Eh/a0 ::
         :: HOMO-LUMO gap              3.059853630578 eV    ::
         ::.................................................::
         :: SCC energy               -35.294917875421 Eh    ::
         :: -> isotropic ES            0.019019371081 Eh    ::
         :: -> anisotropic ES          0.002920907329 Eh    ::
         :: -> anisotropic XC          0.014188213067 Eh    ::
         :: -> dispersion             -0.023867744434 Eh    ::
         :: repulsion energy           0.483032460226 Eh    ::
         :: add. restraining           0.000000000000 Eh    ::
         :::::::::::::::::::::::::::::::::::::::::::::::::::::

           -------------------------------------------------
          |                Property Printout                |
           -------------------------------------------------

    * Orbital Energies and Occupations

         #    Occupation            Energy/Eh            Energy/eV
      -------------------------------------------------------------
         1        2.0000           -0.7282052             -19.8155
       ...           ...                  ...                  ...
        20        2.0000           -0.4905473             -13.3485
        21        2.0000           -0.4795444             -13.0491
        22        2.0000           -0.4678159             -12.7299
        23        2.0000           -0.4618806             -12.5684
        24        2.0000           -0.4533039             -12.3350
        25        2.0000           -0.4494260             -12.2295
        26        2.0000           -0.4391622             -11.9502
        27        2.0000           -0.4354649             -11.8496
        28        2.0000           -0.4345368             -11.8243
        29        2.0000           -0.4287810             -11.6677
        30        2.0000           -0.4075459             -11.0899
        31        2.0000           -0.3829391             -10.4203
        32        2.0000           -0.3732293             -10.1561 (HOMO)
        33                         -0.2607817              -7.0962 (LUMO)
        34                         -0.2036270              -5.5410
        35                         -0.1945198              -5.2932
        36                         -0.1473212              -4.0088
        37                         -0.1138237              -3.0973
        38                         -0.0040241              -0.1095
        39                          0.0321298               0.8743
        40                          0.0350336               0.9533
        41                          0.0438424               1.1930
        42                          0.0773571               2.1050
        43                          0.0812040               2.2097
       ...                                ...                  ...
        65                          0.6806268              18.5208
      -------------------------------------------------------------
                  HL-Gap            0.1124476 Eh            3.0599 eV
             Fermi-level           -0.3170055 Eh           -8.6262 eV

     #   Z        covCN         q      C6AA      α(0)
     1   6 C      2.926    -0.047    29.168     8.857
     2  16 S      2.342    -0.045   142.934    20.122
     3   6 C      2.990     0.009    27.805     8.650
     4   6 C      3.128    -0.025    28.428     8.730
     5   6 C      3.072     0.125    25.180     8.228
     6   8 O      1.703    -0.303    19.039     5.891
     7   6 C      3.702     0.084    19.324     6.286
     8   6 C      3.800    -0.065    21.741     6.639
     9   6 C      3.803    -0.052    21.500     6.601
    10   6 C      3.805    -0.049    21.442     6.592
    11   6 C      2.944    -0.029    28.732     8.791
    12   6 C      2.837    -0.095    30.371     9.031
    13   1 H      0.926     0.053     2.279     2.361
    14   1 H      0.924     0.047     2.354     2.399
    15   1 H      0.923     0.021     2.721     2.580
    16   1 H      0.924     0.034     2.528     2.487
    17   1 H      0.924     0.039     2.469     2.457
    18   1 H      0.924     0.050     2.319     2.381
    19   1 H      0.924     0.030     2.585     2.514
    20   1 H      0.924     0.044     2.397     2.421
    21   1 H      0.924     0.043     2.403     2.424
    22   1 H      0.925     0.045     2.389     2.417
    23   1 H      0.926     0.043     2.407     2.426
    24   1 H      0.926     0.041     2.438     2.442

 Mol. C6AA /au·bohr⁶  :       7242.563615
 Mol. C8AA /au·bohr⁸  :     191479.698093
 Mol. α(0) /au        :        133.726679


Wiberg/Mayer (AO) data.
largest (>0.10) Wiberg bond orders for each atom
          total WBO             WBO to atom ...
     1  C   3.943        C    5 1.549    S    2 1.198    H   13 0.969    C    3 0.100
     2  S   2.610        C    1 1.198    C    3 1.121
     3  C   3.944        C    4 1.505    C   11 1.135    S    2 1.121    C    1 0.100
     4  C   3.984        C    3 1.505    C    5 1.223    C   10 1.011
     5  C   3.938        C    1 1.549    C    4 1.223    O    6 1.014
     6  O   2.137        C    5 1.014    C    7 0.961
     7  C   3.949        C    8 0.996    H   14 0.972    H   15 0.971    O    6 0.961
     8  C   3.997        C    9 1.007    C    7 0.996    H   16 0.978    H   17 0.978
     9  C   3.996        C    8 1.007    C   10 1.005    H   19 0.979    H   18 0.976
    10  C   3.998        C    4 1.011    C    9 1.005    H   21 0.962    H   20 0.957
    11  C   3.991        C   12 1.861    C    3 1.135    H   22 0.962
    12  C   3.990        C   11 1.861    H   24 0.977    H   23 0.972
    13  H   0.997        C    1 0.969
    14  H   0.997        C    7 0.972
    15  H   1.000        C    7 0.971
    16  H   0.999        C    8 0.978
    17  H   0.999        C    8 0.978
    18  H   0.997        C    9 0.976
    19  H   0.998        C    9 0.979
    20  H   0.998        C   10 0.957
    21  H   0.998        C   10 0.962
    22  H   0.998        C   11 0.962
    23  H   0.998        C   12 0.972
    24  H   0.998        C   12 0.977

molecular dipole:
                 x           y           z       tot (Debye)
 q only:        0.431       0.412       0.354
   full:        0.720       0.376       0.382       2.283
molecular quadrupole (traceless):
                xx          xy          yy          xz          yz          zz
 q only:        1.378      -0.096       0.932       0.799      -1.731      -2.310
  q+dip:       -1.249       0.729       3.903       0.036      -2.034      -2.654
   full:       -1.558       0.259       3.102       1.210      -2.097      -1.544

           -------------------------------------------------
          |                Geometry Summary                 |
           -------------------------------------------------

      molecular mass/u    :      180.2642000
   center of mass at/Å    :       -0.4933460       0.4296184      -0.0142437
  moments of inertia/u·Å² :        0.3973376E+03   0.6970167E+03   0.1029574E+04
rotational constants/cm⁻¹ :        0.4242647E-01   0.2418541E-01   0.1637340E-01

 * 23 selected distances

     #   Z        #   Z                                     value/Å
     1   6 C      2  16 S                                 1.7076851
     2  16 S      3   6 C                                 1.7460006 (max)
     3   6 C      4   6 C                                 1.3760449
     1   6 C      5   6 C                                 1.3644412
     4   6 C      5   6 C                                 1.4265454
     5   6 C      6   8 O                                 1.3707448
     6   8 O      7   6 C                                 1.4154415
     7   6 C      8   6 C                                 1.5329419
     8   6 C      9   6 C                                 1.5298623
     9   6 C     10   6 C                                 1.5301633
    11   6 C     12   6 C                                 1.3304840
     1   6 C     13   1 H                                 1.0713336 (min)
     7   6 C     14   1 H                                 1.0930330
     7   6 C     15   1 H                                 1.0999774
     8   6 C     16   1 H                                 1.0904382
     8   6 C     17   1 H                                 1.0921142
     9   6 C     18   1 H                                 1.0913587
     9   6 C     19   1 H                                 1.0914987
    10   6 C     20   1 H                                 1.0945788
    10   6 C     21   1 H                                 1.0948471
    11   6 C     22   1 H                                 1.0833717
    12   6 C     23   1 H                                 1.0729632
    12   6 C     24   1 H                                 1.0766314

 * 4 distinct bonds (by element types)

   Z      Z             #   av. dist./Å        max./Å        min./Å
   1 H    6 C          12     1.0876788     1.0999774     1.0713336
   6 C    6 C           7     1.4414976     1.5329419     1.3304840
   6 C    8 O           2     1.3930931     1.4154415     1.3707448
   6 C   16 S           2     1.7268428     1.7460006     1.7076851


optimized geometry written to: xtbopt.xyz


           -------------------------------------------------
          | TOTAL ENERGY              -34.811707074044 Eh   |
          | GRADIENT NORM               0.000675603251 Eh/α |
          | HOMO-LUMO GAP               3.059853630578 eV   |
           -------------------------------------------------

------------------------------------------------------------------------
 * finished run on 2021/05/19 at 10:59:03.564     
------------------------------------------------------------------------
 total:
 * wall-time:     0 d,  0 h,  0 min,  0.771 sec
 *  cpu-time:     0 d,  0 h,  0 min,  0.758 sec
 * ratio c/w:     0.983 speedup
 SCF:
 * wall-time:     0 d,  0 h,  0 min,  0.036 sec
 *  cpu-time:     0 d,  0 h,  0 min,  0.036 sec
 * ratio c/w:     1.000 speedup
 ANC optimizer:
 * wall-time:     0 d,  0 h,  0 min,  0.702 sec
 *  cpu-time:     0 d,  0 h,  0 min,  0.702 sec
 * ratio c/w:     1.000 speedup

