      -----------------------------------------------------------      
     |                   =====================                   |     
     |                           x T B                           |     
     |                   =====================                   |     
     |                         S. Grimme                         |     
     |          Mulliken Center for Theoretical Chemistry        |     
     |                    University of Bonn                     |     
     |                Version 6.2 RC2 (SAW190805)                |     
      -----------------------------------------------------------      

   This program is distributed in the hope that it will be useful,
   but WITHOUT ANY WARRANTY; without even the implied warranty of
   MERCHANTABILITY or FITNESS FOR A PARTICULAR PURPOSE.
   
   FOR NON-COMMERCIAL, ACADEMIA USE ONLY.
   
   Cite this work as:
   * S. Grimme, C. Bannwarth, P. Shushkov, J. Chem. Theory Comput., 2017,
     13, 1989-2009. DOI: 10.1021/acs.jctc.7b00118
   * C. Bannwarth, S. Ehlert and S. Grimme., J. Chem. Theory Comput., 2019,
     15, 1652-1671. DOI: 10.1021/acs.jctc.8b01176
   * P. Pracht, E. Caldeweyher, S. Ehlert, S. Grimme, ChemRxiv, 2019, preprint.
     DOI: 10.26434/chemrxiv.8326202.v1
   
   for DFT-D4:
   * E. Caldeweyher, C. Bannwarth and S. Grimme, J. Chem. Phys., 2017,
     147, 034112. DOI: 10.1063/1.4993215
   * E. Caldeweyher, S. Ehlert, A. Hansen, H. Neugebauer, S. Spicher,
     C. Bannwarth and S. Grimme, J. Chem. Phys., 2019, 150, 154122.
     DOI: 10.1063/1.5090222
   
   for sTDA-xTB:
   * S. Grimme and C. Bannwarth, J. Chem. Phys., 2016, 145, 054103.
     DOI: 10.1063/1.4959605
   
   in the mass-spec context:
   * V. Asgeirsson, C. Bauer and S. Grimme, Chem. Sci., 2017, 8, 4879.
     DOI: 10.1039/c7sc00601b
   
   for metadynamics refer to:
   * S. Grimme, J. Chem. Theory Comput., 2019, 155, 2847-2862
     DOI: 10.1021/acs.jctc.9b00143
   
   with help from (in alphabetical order)
   C. Bannwarth, F. Bohle, G. Brandenburg, E. Caldeweyher, M. Checinski,
   S. Dohm, S. Ehlert, S. Ehrlich, F. März, H. Neugebauer, J. Pisarek,
   P. Pracht, P. Shushkov, and S. Spicher.
   
 * started run on 2021/05/19 at 10:59:05.279     

           -------------------------------------------------
          |                Calculation Setup                |
           -------------------------------------------------

          program call               : /ihome/ghutchison/geoffh/xtb/xtb 234.xyz -opt
          hostname                   : smp-n83
          coordinate file            : 234.xyz
          omp threads                :                     1
          number of atoms            :                    18
          number of electrons        :                    46
          charge                     :                     0
          spin                       :                   0.0
          first test random number   :      0.75506420395358


########################################################################
# WARNING! Please study the warnings concerning your input carefully
#  - the use of '-opt' is discouraged, please use '--opt' next time
########################################################################

           ------------------------------------------------- 
          |                 G F N 2 - x T B                 |
          | Geometry, Frequencies, Noncovalent interactions |
          |            JCTC 2019 parametrisation            |
           ------------------------------------------------- 
             KAB for C  - Si     :                1.0500
             KAB for H  - Pd     :                0.9500
             k(s)              :                1.8500
             k(p)              :                2.2300
             k(d)              :                2.2300
             k(f)              :                2.0000
             kEN (H0ij)        :               -2.0000
             D4 a1             :                0.5200
             D4 a2             :                5.0000
             D4 s6             :                1.0000
             D4 s8             :                2.7000
             D4 s9             :                5.0000
             alphaj            :                2.0000

  Z AO/shell   Hii/eV     exponent
  1     Wed Apr 25 08:07:45 CEST 2018   EN: 2.200 GM2: 0.406  GM3: 0.0800  RAES: 1.40
     1s    -10.707211    1.230000
  6     Wed Apr 25 08:07:45 CEST 2018   EN: 2.550 GM2: 0.538  GM3: 0.1500  RAES: 3.00
     2s    -13.970922    2.096432
     2p    -10.063292    1.800000
  7     Wed Apr 25 08:07:45 CEST 2018   EN: 3.040 GM2: 0.461  GM3:-0.0640  RAES: 1.90
     2s    -16.686243    2.339881
     2p    -12.523956    2.014332
 16     Tue Apr 24 11:44:34 CEST 2018   EN: 2.580 GM2: 0.340  GM3:-0.0502  RAES: 3.10
     3s    -20.029654    1.981333
     3p    -11.377694    2.025643
     3d     -0.420282    1.702555

           ------------------------------------------------- 
          |        Self-Consistent Charge Iterations        |
           ------------------------------------------------- 

          ...................................................
          :                      SETUP                      :
          :.................................................:
          :  # basis functions                  48          :
          :  # atomic orbitals                  47          :
          :  # shells                           27          :
          :  # electrons                        46          :
          :  max. iterations                   250          :
          :  Hamiltonian                  GFN2-xTB          :
          :  restarted?                      false          :
          :  GBSA solvation                  false          :
          :  PC potential                    false          :
          :  electronic temp.          300.0000000     K    :
          :  accuracy                    1.0000000          :
          :  -> integral cutoff          0.2500000E+02      :
          :  -> integral neglect         0.1000000E-07      :
          :  -> SCF convergence          0.1000000E-05 Eh   :
          :  -> wf. convergence          0.1000000E-03 e    :
          :  Broyden damping             0.4000000          :
          ...................................................

 iter      E             dE          RMSdq      gap      omega  full diag
   1    -25.1198287 -0.251198E+02  0.407E+00    4.23       0.0  T
   2    -25.1527253 -0.328966E-01  0.243E+00    4.27       1.0  T
   3    -25.1537095 -0.984260E-03  0.725E-01    4.04       1.0  T
   4    -25.1544114 -0.701888E-03  0.243E-01    3.96       1.0  T
   5    -25.1544636 -0.521587E-04  0.992E-02    3.98       1.0  T
   6    -25.1544859 -0.223549E-04  0.222E-02    3.98       1.1  T
   7    -25.1544867 -0.774319E-06  0.105E-02    3.98       2.3  T
   8    -25.1544868 -0.110194E-06  0.290E-03    3.98       8.1  T
   9    -25.1544868 -0.125075E-07  0.111E-03    3.98      21.1  T
  10    -25.1544868 -0.149653E-08  0.370E-04    3.98      63.6  T
  11    -25.1544868 -0.235708E-09  0.157E-04    3.98     150.2  T

   *** convergence criteria satisfied after 11 iterations ***

         #    Occupation            Energy/Eh            Energy/eV
      -------------------------------------------------------------
         1        2.0000           -0.7121812             -19.3794
       ...           ...                  ...                  ...
        17        2.0000           -0.4730807             -12.8732
        18        2.0000           -0.4692702             -12.7695
        19        2.0000           -0.4639716             -12.6253
        20        2.0000           -0.4460479             -12.1376
        21        2.0000           -0.3877799             -10.5520
        22        2.0000           -0.3779550             -10.2847
        23        2.0000           -0.3550506              -9.6614 (HOMO)
        24                         -0.2087542              -5.6805 (LUMO)
        25                         -0.1282873              -3.4909
        26                         -0.0327053              -0.8900
        27                         -0.0105995              -0.2884
        28                          0.0107172               0.2916
       ...                                ...                  ...
        47                          0.4316097              11.7447
      -------------------------------------------------------------
                  HL-Gap            0.1462964 Eh            3.9809 eV
             Fermi-level           -0.2819024 Eh           -7.6710 eV

 SCC (total)                   0 d,  0 h,  0 min,  0.021 sec
 SCC setup                      ...        0 min,  0.000 sec (  1.160%)
 Dispersion                     ...        0 min,  0.000 sec (  0.859%)
 integral evaluation            ...        0 min,  0.005 sec ( 21.665%)
 zeroth order Hamiltonian       ...        0 min,  0.000 sec (  0.468%)
 iterations                     ...        0 min,  0.008 sec ( 39.025%)
 molecular gradient             ...        0 min,  0.007 sec ( 35.187%)
 printout                       ...        0 min,  0.000 sec (  1.399%)

         :::::::::::::::::::::::::::::::::::::::::::::::::::::
         ::                     SUMMARY                     ::
         :::::::::::::::::::::::::::::::::::::::::::::::::::::
         :: total energy             -24.896901576419 Eh    ::
         :: gradient norm              0.048687408284 Eh/a0 ::
         :: HOMO-LUMO gap              3.980927372688 eV    ::
         ::.................................................::
         :: SCC energy               -25.154486813936 Eh    ::
         :: -> isotropic ES            0.018100039854 Eh    ::
         :: -> anisotropic ES          0.003302369456 Eh    ::
         :: -> anisotropic XC          0.021952584096 Eh    ::
         :: -> dispersion             -0.015272988406 Eh    ::
         :: repulsion energy           0.257533243815 Eh    ::
         :: add. restraining           0.000000000000 Eh    ::
         :::::::::::::::::::::::::::::::::::::::::::::::::::::

      ----------------------------------------------------------- 
     |                   =====================                   |
     |                        A N C O P T                        |
     |                   =====================                   |
     |               Approximate Normal Coordinate               |
     |                Rational Function Optimizer                |
      ----------------------------------------------------------- 

          ...................................................
          :                      SETUP                      :
          :.................................................:
          :   optimization level            normal          :
          :   max. optcycles                   200          :
          :   ANC micro-cycles                  20          :
          :   degrees of freedom                48          :
          :.................................................:
          :   RF solver                   davidson          :
          :   input Hessian                  false          :
          :   write xtbopt.log                true          :
          :   linear?                        false          :
          :   energy convergence         0.5000000E-05 Eh   :
          :   grad. convergence          0.1000000E-02 Eh/α :
          :   maximium RF displ.         2.0000000          :
          :   Hlow (freq-cutoff)         0.5000000E-02      :
          :   Hmax (freq-cutoff)         5.0000000          :
          :   S6 in model hess.         20.0000000          :
          ...................................................

generating ANC from model Hessian ...
Using Lindh-Hessian (1995)
 Shifting diagonal of input Hessian by   0.000000000000000E+000
 Lowest  eigenvalues of input Hessian
   -0.000000    0.000000    0.000000    0.000000    0.000000    0.000000
    0.007247    0.009903    0.012219    0.018159    0.023844    0.034024
    0.043773    0.049796    0.054346    0.054865    0.056555    0.059126
 Highest eigenvalues
    1.192214    1.264429    1.352745    1.372403    1.415562    1.463775
 

........................................................................
.............................. CYCLE    1 ..............................
........................................................................
   1    -25.1544868 -0.251545E+02  0.462E-05    3.98       0.0  T
   2    -25.1544868 -0.708056E-11  0.280E-05    3.98     841.1  T
   3    -25.1544868 -0.653699E-12  0.160E-05    3.98    1473.4  T
     SCC iter.                  ...        0 min,  0.003 sec
     gradient                   ...        0 min,  0.007 sec
 * total energy  :   -24.8969016 Eh     change       -0.1799683E-07 Eh
   gradient norm :     0.0486878 Eh/α   predicted     0.0000000E+00 (-100.00%)
   displ. norm   :     0.2701612 α      lambda       -0.5390630E-02
   maximum displ.:     0.1442304 α      in ANC's #1, #12, #2, ...

........................................................................
.............................. CYCLE    2 ..............................
........................................................................
   1    -25.1598046 -0.251598E+02  0.420E-01    3.91       0.0  T
   2    -25.1598640 -0.593978E-04  0.208E-01    3.91       1.0  T
   3    -25.1598748 -0.108113E-04  0.397E-02    3.91       1.0  T
   4    -25.1598770 -0.217955E-05  0.192E-02    3.91       1.2  T
   5    -25.1598776 -0.616904E-06  0.347E-03    3.91       6.8  T
   6    -25.1598776 -0.194485E-07  0.166E-03    3.91      14.2  T
     SCC iter.                  ...        0 min,  0.004 sec
     gradient                   ...        0 min,  0.007 sec
 * total energy  :   -24.9005421 Eh     change       -0.3640548E-02 Eh
   gradient norm :     0.0274460 Eh/α   predicted    -0.2892040E-02 ( -20.56%)
   displ. norm   :     0.3039041 α      lambda       -0.2622257E-02
   maximum displ.:     0.1702750 α      in ANC's #2, #3, #1, ...

........................................................................
.............................. CYCLE    3 ..............................
........................................................................
   1    -25.1630382 -0.251630E+02  0.521E-01    3.88       0.0  T
   2    -25.1631608 -0.122676E-03  0.252E-01    3.87       1.0  T
   3    -25.1631772 -0.163514E-04  0.451E-02    3.86       1.0  T
   4    -25.1631805 -0.329060E-05  0.221E-02    3.86       1.1  T
   5    -25.1631814 -0.936978E-06  0.706E-03    3.86       3.3  T
   6    -25.1631815 -0.590810E-07  0.216E-03    3.86      10.9  T
   7    -25.1631815 -0.209988E-08  0.791E-04    3.86      29.8  T
     SCC iter.                  ...        0 min,  0.005 sec
     gradient                   ...        0 min,  0.007 sec
 * total energy  :   -24.9023054 Eh     change       -0.1763264E-02 Eh
   gradient norm :     0.0119621 Eh/α   predicted    -0.1432225E-02 ( -18.77%)
   displ. norm   :     0.2882393 α      lambda       -0.1063605E-02
   maximum displ.:     0.1987622 α      in ANC's #3, #2, #1, ...

........................................................................
.............................. CYCLE    4 ..............................
........................................................................
   1    -25.1646607 -0.251647E+02  0.525E-01    3.81       0.0  T
   2    -25.1647806 -0.119918E-03  0.249E-01    3.80       1.0  T
   3    -25.1647958 -0.152456E-04  0.398E-02    3.80       1.0  T
   4    -25.1647982 -0.237386E-05  0.207E-02    3.80       1.1  T
   5    -25.1647989 -0.657279E-06  0.765E-03    3.80       3.1  T
   6    -25.1647989 -0.809789E-07  0.191E-03    3.80      12.3  T
   7    -25.1647989 -0.133026E-08  0.722E-04    3.80      32.7  T
     SCC iter.                  ...        0 min,  0.004 sec
     gradient                   ...        0 min,  0.007 sec
 * total energy  :   -24.9029822 Eh     change       -0.6768259E-03 Eh
   gradient norm :     0.0090830 Eh/α   predicted    -0.5759851E-03 ( -14.90%)
   displ. norm   :     0.1586758 α      lambda       -0.3705855E-03
   maximum displ.:     0.1196258 α      in ANC's #3, #2, #1, ...

........................................................................
.............................. CYCLE    5 ..............................
........................................................................
   1    -25.1666128 -0.251666E+02  0.301E-01    3.79       0.0  T
   2    -25.1666425 -0.297405E-04  0.142E-01    3.78       1.0  T
   3    -25.1666473 -0.474189E-05  0.194E-02    3.78       1.2  T
   4    -25.1666475 -0.272620E-06  0.103E-02    3.78       2.3  T
   5    -25.1666476 -0.104567E-06  0.350E-03    3.78       6.7  T
   6    -25.1666477 -0.329851E-07  0.978E-04    3.78      24.1  T
   7    -25.1666477 -0.151903E-09  0.317E-04    3.78      74.3  T
     SCC iter.                  ...        0 min,  0.005 sec
     gradient                   ...        0 min,  0.007 sec
 * total energy  :   -24.9032526 Eh     change       -0.2703242E-03 Eh
   gradient norm :     0.0086072 Eh/α   predicted    -0.1899578E-03 ( -29.73%)
   displ. norm   :     0.1741819 α      lambda       -0.3421365E-03
   maximum displ.:     0.1285518 α      in ANC's #3, #2, #1, ...

........................................................................
.............................. CYCLE    6 ..............................
........................................................................
   1    -25.1680711 -0.251681E+02  0.349E-01    3.79       0.0  T
   2    -25.1680984 -0.273703E-04  0.164E-01    3.79       1.0  T
   3    -25.1681047 -0.628854E-05  0.198E-02    3.79       1.2  T
   4    -25.1681048 -0.404834E-07  0.802E-03    3.79       2.9  T
   5    -25.1681048 -0.425665E-07  0.202E-03    3.79      11.6  T
   6    -25.1681048 -0.113600E-07  0.983E-04    3.79      24.0  T
     SCC iter.                  ...        0 min,  0.004 sec
     gradient                   ...        0 min,  0.007 sec
 * total energy  :   -24.9035036 Eh     change       -0.2510099E-03 Eh
   gradient norm :     0.0075721 Eh/α   predicted    -0.1762588E-03 ( -29.78%)
   displ. norm   :     0.2177124 α      lambda       -0.3014005E-03
   maximum displ.:     0.1536104 α      in ANC's #3, #2, #1, ...

........................................................................
.............................. CYCLE    7 ..............................
........................................................................
   1    -25.1675962 -0.251676E+02  0.464E-01    3.79       0.0  T
   2    -25.1676391 -0.429362E-04  0.217E-01    3.79       1.0  T
   3    -25.1676496 -0.105321E-04  0.248E-02    3.79       1.0  T
   4    -25.1676496  0.309058E-07  0.991E-03    3.79       2.4  T
   5    -25.1676499 -0.324059E-06  0.222E-03    3.79      10.6  T
   6    -25.1676499 -0.355767E-08  0.100E-03    3.79      23.5  T
     SCC iter.                  ...        0 min,  0.004 sec
     gradient                   ...        0 min,  0.007 sec
 * total energy  :   -24.9037298 Eh     change       -0.2261933E-03 Eh
   gradient norm :     0.0073837 Eh/α   predicted    -0.1578419E-03 ( -30.22%)
   displ. norm   :     0.2165405 α      lambda       -0.3102904E-03
   maximum displ.:     0.1361824 α      in ANC's #2, #3, #5, ...

........................................................................
.............................. CYCLE    8 ..............................
........................................................................
   1    -25.1679852 -0.251680E+02  0.482E-01    3.82       0.0  T
   2    -25.1680351 -0.498824E-04  0.226E-01    3.82       1.0  T
   3    -25.1680459 -0.108124E-04  0.264E-02    3.82       1.0  T
   4    -25.1680462 -0.372202E-06  0.134E-02    3.82       1.8  T
   5    -25.1680465 -0.276919E-06  0.289E-03    3.82       8.2  T
   6    -25.1680466 -0.244043E-07  0.129E-03    3.82      18.2  T
     SCC iter.                  ...        0 min,  0.004 sec
     gradient                   ...        0 min,  0.007 sec
 * total energy  :   -24.9039285 Eh     change       -0.1987667E-03 Eh
   gradient norm :     0.0066035 Eh/α   predicted    -0.1624209E-03 ( -18.29%)
   displ. norm   :     0.2416938 α      lambda       -0.1839463E-03
   maximum displ.:     0.1685838 α      in ANC's #2, #3, #1, ...

........................................................................
.............................. CYCLE    9 ..............................
........................................................................
   1    -25.1653041 -0.251653E+02  0.539E-01    3.81       0.0  T
   2    -25.1653599 -0.558188E-04  0.251E-01    3.81       1.0  T
   3    -25.1653728 -0.129042E-04  0.283E-02    3.81       1.0  T
   4    -25.1653732 -0.341545E-06  0.149E-02    3.81       1.6  T
   5    -25.1653736 -0.378307E-06  0.267E-03    3.81       8.8  T
   6    -25.1653736 -0.986973E-08  0.132E-03    3.81      17.8  T
     SCC iter.                  ...        0 min,  0.004 sec
     gradient                   ...        0 min,  0.007 sec
 * total energy  :   -24.9039897 Eh     change       -0.6118946E-04 Eh
   gradient norm :     0.0070460 Eh/α   predicted    -0.9734713E-04 (  59.09%)
   displ. norm   :     0.0654490 α      lambda       -0.1864923E-03
   maximum displ.:     0.0343763 α      in ANC's #3, #1, #2, ...

........................................................................
.............................. CYCLE   10 ..............................
........................................................................
   1    -25.1677875 -0.251678E+02  0.755E-02    3.85       0.0  T
   2    -25.1677934 -0.591320E-05  0.392E-02    3.85       1.0  T
   3    -25.1677937 -0.271635E-06  0.114E-02    3.85       2.1  T
   4    -25.1677937 -0.674004E-07  0.474E-03    3.85       5.0  T
   5    -25.1677938 -0.415172E-07  0.161E-03    3.85      14.6  T
   6    -25.1677938 -0.395027E-08  0.508E-04    3.85      46.4  T
     SCC iter.                  ...        0 min,  0.004 sec
     gradient                   ...        0 min,  0.007 sec
 * total energy  :   -24.9040913 Eh     change       -0.1016147E-03 Eh
   gradient norm :     0.0036901 Eh/α   predicted    -0.9364618E-04 (  -7.84%)
   displ. norm   :     0.0839698 α      lambda       -0.6342935E-04
   maximum displ.:     0.0712749 α      in ANC's #2, #1, #5, ...

........................................................................
.............................. CYCLE   11 ..............................
........................................................................
   1    -25.1682983 -0.251683E+02  0.144E-01    3.84       0.0  T
   2    -25.1683025 -0.418988E-05  0.684E-02    3.84       1.0  T
   3    -25.1683035 -0.946008E-06  0.872E-03    3.84       2.7  T
   4    -25.1683035 -0.250279E-07  0.449E-03    3.84       5.3  T
   5    -25.1683035 -0.376884E-07  0.946E-04    3.84      24.9  T
   6    -25.1683035 -0.139930E-08  0.448E-04    3.84      52.6  T
     SCC iter.                  ...        0 min,  0.004 sec
     gradient                   ...        0 min,  0.007 sec
 * total energy  :   -24.9041363 Eh     change       -0.4493187E-04 Eh
   gradient norm :     0.0032064 Eh/α   predicted    -0.3193918E-04 ( -28.92%)
   displ. norm   :     0.1481037 α      lambda       -0.7736988E-04
   maximum displ.:     0.1263651 α      in ANC's #2, #1, #5, ...

........................................................................
.............................. CYCLE   12 ..............................
........................................................................
   1    -25.1681185 -0.251681E+02  0.225E-01    3.85       0.0  T
   2    -25.1681284 -0.990459E-05  0.108E-01    3.85       1.0  T
   3    -25.1681307 -0.227408E-05  0.149E-02    3.85       1.6  T
   4    -25.1681308 -0.964000E-07  0.771E-03    3.85       3.1  T
   5    -25.1681310 -0.134830E-06  0.156E-03    3.85      15.1  T
   6    -25.1681310 -0.151030E-08  0.735E-04    3.85      32.1  T
   7    -25.1681310 -0.185999E-09  0.170E-04    3.85     138.6  T
     SCC iter.                  ...        0 min,  0.005 sec
     gradient                   ...        0 min,  0.007 sec
 * total energy  :   -24.9041855 Eh     change       -0.4924274E-04 Eh
   gradient norm :     0.0028052 Eh/α   predicted    -0.3953363E-04 ( -19.72%)
   displ. norm   :     0.1011986 α      lambda       -0.3189976E-04
   maximum displ.:     0.0872928 α      in ANC's #2, #1, #5, ...

........................................................................
.............................. CYCLE   13 ..............................
........................................................................
   1    -25.1679435 -0.251679E+02  0.130E-01    3.85       0.0  T
   2    -25.1679466 -0.312495E-05  0.633E-02    3.85       1.0  T
   3    -25.1679474 -0.821120E-06  0.898E-03    3.85       2.6  T
   4    -25.1679474  0.231017E-08  0.303E-03    3.85       7.8  T
   5    -25.1679474 -0.312369E-07  0.858E-04    3.85      27.5  T
   6    -25.1679474 -0.889571E-09  0.440E-04    3.85      53.6  T
     SCC iter.                  ...        0 min,  0.004 sec
     gradient                   ...        0 min,  0.007 sec
 * total energy  :   -24.9042109 Eh     change       -0.2539018E-04 Eh
   gradient norm :     0.0027960 Eh/α   predicted    -0.1611398E-04 ( -36.53%)
   displ. norm   :     0.1911435 α      lambda       -0.5628787E-04
   maximum displ.:     0.1639025 α      in ANC's #2, #5, #1, ...

........................................................................
.............................. CYCLE   14 ..............................
........................................................................
   1    -25.1674876 -0.251675E+02  0.213E-01    3.86       0.0  T
   2    -25.1674961 -0.850073E-05  0.107E-01    3.86       1.0  T
   3    -25.1674984 -0.233675E-05  0.156E-02    3.86       1.5  T
   4    -25.1674985 -0.271823E-07  0.456E-03    3.86       5.2  T
   5    -25.1674985 -0.415018E-07  0.134E-03    3.86      17.6  T
   6    -25.1674985 -0.925841E-09  0.599E-04    3.86      39.4  T
   7    -25.1674985 -0.297931E-09  0.114E-04    3.86     206.0  T
     SCC iter.                  ...        0 min,  0.004 sec
     gradient                   ...        0 min,  0.007 sec
 * total energy  :   -24.9042526 Eh     change       -0.4173822E-04 Eh
   gradient norm :     0.0031660 Eh/α   predicted    -0.2917230E-04 ( -30.11%)
   displ. norm   :     0.2334723 α      lambda       -0.6006494E-04
   maximum displ.:     0.1987192 α      in ANC's #2, #5, #1, ...

........................................................................
.............................. CYCLE   15 ..............................
........................................................................
   1    -25.1668081 -0.251668E+02  0.242E-01    3.86       0.0  T
   2    -25.1668193 -0.112345E-04  0.123E-01    3.86       1.0  T
   3    -25.1668224 -0.305053E-05  0.180E-02    3.86       1.3  T
   4    -25.1668224 -0.555848E-07  0.627E-03    3.86       3.8  T
   5    -25.1668225 -0.763723E-07  0.163E-03    3.86      14.5  T
   6    -25.1668225 -0.378841E-08  0.856E-04    3.86      27.5  T
   7    -25.1668225 -0.456598E-09  0.173E-04    3.86     136.6  T
     SCC iter.                  ...        0 min,  0.005 sec
     gradient                   ...        0 min,  0.007 sec
 * total energy  :   -24.9042990 Eh     change       -0.4639372E-04 Eh
   gradient norm :     0.0045420 Eh/α   predicted    -0.3167354E-04 ( -31.73%)
   displ. norm   :     0.3131409 α      lambda       -0.9464231E-04
   maximum displ.:     0.2550584 α      in ANC's #2, #5, #4, ...

........................................................................
.............................. CYCLE   16 ..............................
........................................................................
   1    -25.1662674 -0.251663E+02  0.272E-01    3.87       0.0  T
   2    -25.1662825 -0.150453E-04  0.145E-01    3.87       1.0  T
   3    -25.1662866 -0.411647E-05  0.198E-02    3.87       1.2  T
   4    -25.1662868 -0.225476E-06  0.847E-03    3.87       2.8  T
   5    -25.1662869 -0.121471E-06  0.201E-03    3.87      11.7  T
   6    -25.1662870 -0.973294E-08  0.103E-03    3.87      23.0  T
     SCC iter.                  ...        0 min,  0.004 sec
     gradient                   ...        0 min,  0.007 sec
 * total energy  :   -24.9043695 Eh     change       -0.7046828E-04 Eh
   gradient norm :     0.0073832 Eh/α   predicted    -0.5196395E-04 ( -26.26%)
   displ. norm   :     0.2980199 α      lambda       -0.1362553E-03
   maximum displ.:     0.2319541 α      in ANC's #2, #5, #4, ...

........................................................................
.............................. CYCLE   17 ..............................
........................................................................
   1    -25.1665245 -0.251665E+02  0.230E-01    3.87       0.0  T
   2    -25.1665365 -0.120184E-04  0.128E-01    3.87       1.0  T
   3    -25.1665396 -0.304759E-05  0.149E-02    3.87       1.6  T
   4    -25.1665400 -0.443321E-06  0.718E-03    3.87       3.3  T
   5    -25.1665401 -0.556776E-07  0.181E-03    3.87      13.0  T
   6    -25.1665401 -0.111777E-07  0.790E-04    3.87      29.9  T
     SCC iter.                  ...        0 min,  0.004 sec
     gradient                   ...        0 min,  0.007 sec
 * total energy  :   -24.9044751 Eh     change       -0.1056231E-03 Eh
   gradient norm :     0.0096002 Eh/α   predicted    -0.7418260E-04 ( -29.77%)
   displ. norm   :     0.4088013 α      lambda       -0.2349778E-03
   maximum displ.:     0.3224784 α      in ANC's #2, #5, #3, ...

........................................................................
.............................. CYCLE   18 ..............................
........................................................................
   1    -25.1654518 -0.251655E+02  0.298E-01    3.85       0.0  T
   2    -25.1654699 -0.180403E-04  0.166E-01    3.85       1.0  T
   3    -25.1654752 -0.536225E-05  0.185E-02    3.85       1.3  T
   4    -25.1654757 -0.433565E-06  0.858E-03    3.85       2.7  T
   5    -25.1654758 -0.991307E-07  0.213E-03    3.85      11.1  T
   6    -25.1654758 -0.111420E-07  0.103E-03    3.85      23.0  T
     SCC iter.                  ...        0 min,  0.004 sec
     gradient                   ...        0 min,  0.007 sec
 * total energy  :   -24.9046457 Eh     change       -0.1705829E-03 Eh
   gradient norm :     0.0119945 Eh/α   predicted    -0.1371282E-03 ( -19.61%)
   displ. norm   :     0.4685938 α      lambda       -0.9398931E-03
   maximum displ.:     0.2767764 α      in ANC's #3, #2, #4, ...

........................................................................
.............................. CYCLE   19 ..............................
........................................................................
   1    -25.1797558 -0.251798E+02  0.646E-01    3.82       0.0  T
   2    -25.1798459 -0.900712E-04  0.310E-01    3.82       1.0  T
   3    -25.1798661 -0.202106E-04  0.445E-02    3.81       1.0  T
   4    -25.1798667 -0.659631E-06  0.190E-02    3.81       1.2  T
   5    -25.1798674 -0.633968E-06  0.408E-03    3.81       5.8  T
   6    -25.1798674 -0.362735E-07  0.207E-03    3.81      11.4  T
   7    -25.1798674 -0.186079E-08  0.516E-04    3.81      45.7  T
     SCC iter.                  ...        0 min,  0.004 sec
     gradient                   ...        0 min,  0.007 sec
 * total energy  :   -24.9039669 Eh     change        0.6788323E-03 Eh
   gradient norm :     0.0274831 Eh/α   predicted    -0.5731309E-03 (-184.43%)
   displ. norm   :     0.2761990 α      lambda       -0.1958506E-02
   maximum displ.:     0.2289208 α      in ANC's #2, #1, #5, ...

........................................................................
.............................. CYCLE   20 ..............................
........................................................................
   1    -25.1683216 -0.251683E+02  0.341E-01    3.83       0.0  T
   2    -25.1683474 -0.257642E-04  0.167E-01    3.83       1.0  T
   3    -25.1683533 -0.595297E-05  0.257E-02    3.83       1.0  T
   4    -25.1683534 -0.104186E-06  0.964E-03    3.83       2.4  T
   5    -25.1683536 -0.120844E-06  0.267E-03    3.83       8.8  T
   6    -25.1683536 -0.168433E-07  0.130E-03    3.83      18.1  T
     SCC iter.                  ...        0 min,  0.004 sec
     gradient                   ...        0 min,  0.007 sec
 * total energy  :   -24.9049856 Eh     change       -0.1018773E-02 Eh
   gradient norm :     0.0112924 Eh/α   predicted    -0.1053954E-02 (   3.45%)
   displ. norm   :     0.3097909 α      lambda       -0.2816096E-03
   maximum displ.:     0.1821061 α      in ANC's #3, #2, #4, ...
 * RMSD in coord.:     0.7117877 α      energy gain  -0.8084067E-02 Eh

generating ANC from model Hessian ...
Using Lindh-Hessian (1995)
 Shifting diagonal of input Hessian by   0.000000000000000E+000
 Lowest  eigenvalues of input Hessian
   -0.000000   -0.000000    0.000000    0.000000    0.000000    0.000000
    0.007055    0.009816    0.011790    0.019655    0.025258    0.032557
    0.044925    0.046907    0.050468    0.052726    0.053514    0.057569
 Highest eigenvalues
    1.180089    1.228731    1.406126    1.414086    1.464056    1.586294
 

........................................................................
.............................. CYCLE   21 ..............................
........................................................................
   1    -25.1675461 -0.251675E+02  0.352E-01    3.83       0.0  T
   2    -25.1675731 -0.269358E-04  0.175E-01    3.83       1.0  T
   3    -25.1675789 -0.578844E-05  0.263E-02    3.84       1.0  T
   4    -25.1675792 -0.368957E-06  0.119E-02    3.84       2.0  T
   5    -25.1675794 -0.194545E-06  0.250E-03    3.84       9.4  T
   6    -25.1675795 -0.192637E-07  0.107E-03    3.84      22.0  T
   7    -25.1675795 -0.612879E-09  0.351E-04    3.84      67.1  T
   8    -25.1675795 -0.268681E-09  0.110E-04    3.84     215.2  T
     SCC iter.                  ...        0 min,  0.005 sec
     gradient                   ...        0 min,  0.007 sec
 * total energy  :   -24.9050280 Eh     change       -0.4235377E-04 Eh
   gradient norm :     0.0036786 Eh/α   predicted     0.0000000E+00 (-100.00%)
   displ. norm   :     0.0655526 α      lambda       -0.7984685E-04
   maximum displ.:     0.0535981 α      in ANC's #2, #1, #5, ...

........................................................................
.............................. CYCLE   22 ..............................
........................................................................
   1    -25.1685516 -0.251686E+02  0.506E-02    3.85       0.0  T
   2    -25.1685525 -0.851012E-06  0.268E-02    3.85       1.0  T
   3    -25.1685526 -0.142566E-06  0.482E-03    3.85       4.9  T
   4    -25.1685526 -0.297658E-07  0.213E-03    3.85      11.0  T
   5    -25.1685526 -0.111924E-07  0.492E-04    3.85      47.9  T
   6    -25.1685526 -0.330346E-09  0.269E-04    3.85      87.8  T
     SCC iter.                  ...        0 min,  0.004 sec
     gradient                   ...        0 min,  0.007 sec
 * total energy  :   -24.9050867 Eh     change       -0.5869783E-04 Eh
   gradient norm :     0.0018660 Eh/α   predicted    -0.4009418E-04 ( -31.69%)
   displ. norm   :     0.1245986 α      lambda       -0.6153950E-04
   maximum displ.:     0.0982247 α      in ANC's #2, #5, #4, ...

........................................................................
.............................. CYCLE   23 ..............................
........................................................................
   1    -25.1695904 -0.251696E+02  0.987E-02    3.85       0.0  T
   2    -25.1695938 -0.345281E-05  0.537E-02    3.85       1.0  T
   3    -25.1695944 -0.593733E-06  0.820E-03    3.85       2.9  T
   4    -25.1695946 -0.132924E-06  0.387E-03    3.85       6.1  T
   5    -25.1695946 -0.246940E-07  0.114E-03    3.85      20.6  T
   6    -25.1695946 -0.220462E-08  0.549E-04    3.85      42.9  T
   7    -25.1695946 -0.156170E-09  0.178E-04    3.85     132.2  T
     SCC iter.                  ...        0 min,  0.005 sec
     gradient                   ...        0 min,  0.007 sec
 * total energy  :   -24.9051449 Eh     change       -0.5819968E-04 Eh
   gradient norm :     0.0021882 Eh/α   predicted    -0.3098156E-04 ( -46.77%)
   displ. norm   :     0.0773877 α      lambda       -0.4064750E-04
   maximum displ.:     0.0606311 α      in ANC's #2, #4, #3, ...

........................................................................
.............................. CYCLE   24 ..............................
........................................................................
   1    -25.1693419 -0.251693E+02  0.554E-02    3.86       0.0  T
   2    -25.1693430 -0.104275E-05  0.309E-02    3.86       1.0  T
   3    -25.1693431 -0.195118E-06  0.389E-03    3.86       6.1  T
   4    -25.1693432 -0.206350E-07  0.175E-03    3.86      13.4  T
   5    -25.1693432 -0.341697E-08  0.573E-04    3.86      41.1  T
   6    -25.1693432 -0.798984E-09  0.253E-04    3.86      93.0  T
     SCC iter.                  ...        0 min,  0.004 sec
     gradient                   ...        0 min,  0.007 sec
 * total energy  :   -24.9051788 Eh     change       -0.3393871E-04 Eh
   gradient norm :     0.0022932 Eh/α   predicted    -0.2044536E-04 ( -39.76%)
   displ. norm   :     0.1528509 α      lambda       -0.7041011E-04
   maximum displ.:     0.1119488 α      in ANC's #2, #4, #3, ...

........................................................................
.............................. CYCLE   25 ..............................
........................................................................
   1    -25.1684794 -0.251685E+02  0.105E-01    3.85       0.0  T
   2    -25.1684827 -0.325965E-05  0.594E-02    3.86       1.0  T
   3    -25.1684834 -0.689658E-06  0.683E-03    3.86       3.4  T
   4    -25.1684835 -0.907164E-07  0.323E-03    3.86       7.3  T
   5    -25.1684835 -0.884554E-08  0.107E-03    3.86      22.0  T
   6    -25.1684835 -0.347557E-08  0.412E-04    3.86      57.2  T
   7    -25.1684835 -0.812612E-10  0.143E-04    3.86     165.1  T
     SCC iter.                  ...        0 min,  0.004 sec
     gradient                   ...        0 min,  0.008 sec
 * total energy  :   -24.9052310 Eh     change       -0.5220290E-04 Eh
   gradient norm :     0.0022704 Eh/α   predicted    -0.3602524E-04 ( -30.99%)
   displ. norm   :     0.1555457 α      lambda       -0.4931900E-04
   maximum displ.:     0.1076199 α      in ANC's #2, #1, #4, ...

........................................................................
.............................. CYCLE   26 ..............................
........................................................................
   1    -25.1678713 -0.251679E+02  0.966E-02    3.85       0.0  T
   2    -25.1678736 -0.231433E-05  0.552E-02    3.85       1.0  T
   3    -25.1678742 -0.554856E-06  0.556E-03    3.85       4.2  T
   4    -25.1678743 -0.969099E-07  0.279E-03    3.85       8.4  T
   5    -25.1678743 -0.734724E-08  0.968E-04    3.85      24.3  T
   6    -25.1678743 -0.231805E-08  0.265E-04    3.85      89.1  T
     SCC iter.                  ...        0 min,  0.004 sec
     gradient                   ...        0 min,  0.007 sec
 * total energy  :   -24.9052653 Eh     change       -0.3428396E-04 Eh
   gradient norm :     0.0026442 Eh/α   predicted    -0.2525635E-04 ( -26.33%)
   displ. norm   :     0.0868613 α      lambda       -0.3202327E-04
   maximum displ.:     0.0609701 α      in ANC's #1, #2, #5, ...

........................................................................
.............................. CYCLE   27 ..............................
........................................................................
   1    -25.1681709 -0.251682E+02  0.661E-02    3.85       0.0  T
   2    -25.1681718 -0.877989E-06  0.344E-02    3.85       1.0  T
   3    -25.1681720 -0.240096E-06  0.533E-03    3.85       4.4  T
   4    -25.1681720 -0.424846E-08  0.197E-03    3.85      12.0  T
   5    -25.1681720 -0.150296E-07  0.488E-04    3.85      48.3  T
   6    -25.1681720 -0.245890E-09  0.236E-04    3.85      99.7  T
     SCC iter.                  ...        0 min,  0.004 sec
     gradient                   ...        0 min,  0.007 sec
 * total energy  :   -24.9052927 Eh     change       -0.2737692E-04 Eh
   gradient norm :     0.0019564 Eh/α   predicted    -0.1613439E-04 ( -41.07%)
   displ. norm   :     0.1346987 α      lambda       -0.3973915E-04
   maximum displ.:     0.1121548 α      in ANC's #1, #2, #5, ...

........................................................................
.............................. CYCLE   28 ..............................
........................................................................
   1    -25.1692130 -0.251692E+02  0.155E-01    3.84       0.0  T
   2    -25.1692177 -0.475265E-05  0.745E-02    3.84       1.0  T
   3    -25.1692189 -0.116695E-05  0.104E-02    3.84       2.3  T
   4    -25.1692189  0.429289E-09  0.321E-03    3.84       7.3  T
   5    -25.1692189 -0.290625E-07  0.962E-04    3.84      24.5  T
   6    -25.1692189 -0.143477E-08  0.432E-04    3.84      54.5  T
     SCC iter.                  ...        0 min,  0.004 sec
     gradient                   ...        0 min,  0.007 sec
 * total energy  :   -24.9053383 Eh     change       -0.4559078E-04 Eh
   gradient norm :     0.0019651 Eh/α   predicted    -0.2002984E-04 ( -56.07%)
   displ. norm   :     0.1718074 α      lambda       -0.3418873E-04
   maximum displ.:     0.1307636 α      in ANC's #1, #2, #5, ...

........................................................................
.............................. CYCLE   29 ..............................
........................................................................
   1    -25.1689311 -0.251689E+02  0.195E-01    3.84       0.0  T
   2    -25.1689379 -0.676198E-05  0.945E-02    3.84       1.0  T
   3    -25.1689396 -0.176418E-05  0.133E-02    3.84       1.8  T
   4    -25.1689396  0.343245E-07  0.483E-03    3.84       4.9  T
   5    -25.1689397 -0.109696E-06  0.123E-03    3.84      19.1  T
   6    -25.1689397 -0.308358E-09  0.399E-04    3.84      59.1  T
   7    -25.1689397 -0.270894E-09  0.143E-04    3.84     164.7  T
     SCC iter.                  ...        0 min,  0.005 sec
     gradient                   ...        0 min,  0.007 sec
 * total energy  :   -24.9053845 Eh     change       -0.4618817E-04 Eh
   gradient norm :     0.0023712 Eh/α   predicted    -0.1731572E-04 ( -62.51%)
   displ. norm   :     0.1102136 α      lambda       -0.4051030E-04
   maximum displ.:     0.0923019 α      in ANC's #1, #2, #3, ...

........................................................................
.............................. CYCLE   30 ..............................
........................................................................
   1    -25.1690199 -0.251690E+02  0.164E-01    3.84       0.0  T
   2    -25.1690248 -0.490421E-05  0.775E-02    3.84       1.0  T
   3    -25.1690260 -0.119177E-05  0.987E-03    3.84       2.4  T
   4    -25.1690260 -0.430697E-08  0.477E-03    3.84       4.9  T
   5    -25.1690261 -0.632696E-07  0.947E-04    3.84      24.9  T
   6    -25.1690261 -0.265572E-09  0.329E-04    3.84      71.6  T
     SCC iter.                  ...        0 min,  0.004 sec
     gradient                   ...        0 min,  0.007 sec
 * total energy  :   -24.9054231 Eh     change       -0.3860110E-04 Eh
   gradient norm :     0.0023994 Eh/α   predicted    -0.2050196E-04 ( -46.89%)
   displ. norm   :     0.1410014 α      lambda       -0.5335689E-04
   maximum displ.:     0.1166727 α      in ANC's #1, #2, #3, ...

........................................................................
.............................. CYCLE   31 ..............................
........................................................................
   1    -25.1689234 -0.251689E+02  0.223E-01    3.84       0.0  T
   2    -25.1689325 -0.912562E-05  0.105E-01    3.84       1.0  T
   3    -25.1689347 -0.219796E-05  0.131E-02    3.85       1.8  T
   4    -25.1689347 -0.468824E-08  0.623E-03    3.84       3.8  T
   5    -25.1689348 -0.100101E-06  0.132E-03    3.84      17.9  T
   6    -25.1689348 -0.116606E-08  0.595E-04    3.84      39.6  T
   7    -25.1689348 -0.216385E-09  0.160E-04    3.84     146.9  T
     SCC iter.                  ...        0 min,  0.005 sec
     gradient                   ...        0 min,  0.007 sec
 * total energy  :   -24.9054730 Eh     change       -0.4992375E-04 Eh
   gradient norm :     0.0021561 Eh/α   predicted    -0.2720796E-04 ( -45.50%)
   displ. norm   :     0.1827570 α      lambda       -0.6490378E-04
   maximum displ.:     0.1516336 α      in ANC's #1, #2, #3, ...

........................................................................
.............................. CYCLE   32 ..............................
........................................................................
   1    -25.1685189 -0.251685E+02  0.285E-01    3.85       0.0  T
   2    -25.1685341 -0.151978E-04  0.134E-01    3.85       1.0  T
   3    -25.1685377 -0.359176E-05  0.169E-02    3.85       1.4  T
   4    -25.1685377 -0.767383E-08  0.765E-03    3.85       3.1  T
   5    -25.1685378 -0.132529E-06  0.181E-03    3.85      13.0  T
   6    -25.1685378 -0.430225E-08  0.854E-04    3.85      27.6  T
   7    -25.1685378 -0.311779E-09  0.222E-04    3.85     106.3  T
     SCC iter.                  ...        0 min,  0.005 sec
     gradient                   ...        0 min,  0.007 sec
 * total energy  :   -24.9055316 Eh     change       -0.5862713E-04 Eh
   gradient norm :     0.0022031 Eh/α   predicted    -0.3353582E-04 ( -42.80%)
   displ. norm   :     0.2209867 α      lambda       -0.7119976E-04
   maximum displ.:     0.1860614 α      in ANC's #1, #2, #3, ...

........................................................................
.............................. CYCLE   33 ..............................
........................................................................
   1    -25.1678663 -0.251679E+02  0.333E-01    3.85       0.0  T
   2    -25.1678876 -0.213090E-04  0.157E-01    3.86       1.0  T
   3    -25.1678926 -0.498104E-05  0.202E-02    3.86       1.2  T
   4    -25.1678926 -0.120951E-07  0.853E-03    3.86       2.8  T
   5    -25.1678928 -0.146481E-06  0.219E-03    3.86      10.8  T
   6    -25.1678928 -0.864407E-08  0.105E-03    3.86      22.5  T
   7    -25.1678928 -0.457220E-09  0.268E-04    3.86      87.9  T
   8    -25.1678928 -0.191406E-09  0.131E-04    3.86     179.6  T
     SCC iter.                  ...        0 min,  0.005 sec
     gradient                   ...        0 min,  0.007 sec
 * total energy  :   -24.9055922 Eh     change       -0.6060356E-04 Eh
   gradient norm :     0.0030603 Eh/α   predicted    -0.3733925E-04 ( -38.39%)
   displ. norm   :     0.3874671 α      lambda       -0.1077652E-03
   maximum displ.:     0.3338877 α      in ANC's #1, #2, #3, ...

........................................................................
.............................. CYCLE   34 ..............................
........................................................................
   1    -25.1659055 -0.251659E+02  0.559E-01    3.86       0.0  T
   2    -25.1659666 -0.611123E-04  0.262E-01    3.86       1.0  T
   3    -25.1659808 -0.142656E-04  0.348E-02    3.86       1.0  T
   4    -25.1659809 -0.395475E-07  0.136E-02    3.86       1.7  T
   5    -25.1659812 -0.350392E-06  0.369E-03    3.86       6.4  T
   6    -25.1659812 -0.271371E-07  0.181E-03    3.86      13.0  T
   7    -25.1659812 -0.157322E-08  0.460E-04    3.86      51.3  T
   8    -25.1659812 -0.457163E-09  0.228E-04    3.86     103.2  T
     SCC iter.                  ...        0 min,  0.005 sec
     gradient                   ...        0 min,  0.007 sec
 * total energy  :   -24.9056489 Eh     change       -0.5670836E-04 Eh
   gradient norm :     0.0064145 Eh/α   predicted    -0.6197016E-04 (   9.28%)
   displ. norm   :     0.0590889 α      lambda       -0.7103501E-04
   maximum displ.:     0.0536729 α      in ANC's #1, #6, #4, ...

........................................................................
.............................. CYCLE   35 ..............................
........................................................................
   1    -25.1676747 -0.251677E+02  0.547E-02    3.87       0.0  T
   2    -25.1676755 -0.877083E-06  0.272E-02    3.87       1.0  T
   3    -25.1676757 -0.176078E-06  0.546E-03    3.87       4.3  T
   4    -25.1676757 -0.401172E-08  0.213E-03    3.87      11.1  T
   5    -25.1676757 -0.120660E-07  0.623E-04    3.87      37.8  T
     SCC iter.                  ...        0 min,  0.003 sec
     gradient                   ...        0 min,  0.007 sec
 * total energy  :   -24.9056994 Eh     change       -0.5043219E-04 Eh
   gradient norm :     0.0043336 Eh/α   predicted    -0.3564126E-04 ( -29.33%)
   displ. norm   :     0.2643516 α      lambda       -0.8633619E-04
   maximum displ.:     0.2310594 α      in ANC's #1, #2, #3, ...

........................................................................
.............................. CYCLE   36 ..............................
........................................................................
   1    -25.1679278 -0.251679E+02  0.342E-01    3.88       0.0  T
   2    -25.1679515 -0.237033E-04  0.162E-01    3.88       1.0  T
   3    -25.1679571 -0.551756E-05  0.226E-02    3.88       1.0  T
   4    -25.1679571 -0.320835E-08  0.781E-03    3.88       3.0  T
   5    -25.1679572 -0.147112E-06  0.235E-03    3.88      10.0  T
   6    -25.1679572 -0.134082E-07  0.115E-03    3.88      20.4  T
     SCC iter.                  ...        0 min,  0.004 sec
     gradient                   ...        0 min,  0.007 sec
 * total energy  :   -24.9057680 Eh     change       -0.6858293E-04 Eh
   gradient norm :     0.0040865 Eh/α   predicted    -0.4618449E-04 ( -32.66%)
   displ. norm   :     0.3418879 α      lambda       -0.1065063E-03
   maximum displ.:     0.2915136 α      in ANC's #1, #2, #3, ...

........................................................................
.............................. CYCLE   37 ..............................
........................................................................
   1    -25.1675140 -0.251675E+02  0.420E-01    3.88       0.0  T
   2    -25.1675486 -0.345494E-04  0.199E-01    3.88       1.0  T
   3    -25.1675569 -0.830948E-05  0.283E-02    3.88       1.0  T
   4    -25.1675568  0.119017E-06  0.946E-03    3.88       2.5  T
   5    -25.1675572 -0.420290E-06  0.282E-03    3.88       8.4  T
   6    -25.1675572 -0.730787E-08  0.131E-03    3.88      18.0  T
     SCC iter.                  ...        0 min,  0.004 sec
     gradient                   ...        0 min,  0.007 sec
 * total energy  :   -24.9058427 Eh     change       -0.7472647E-04 Eh
   gradient norm :     0.0037897 Eh/α   predicted    -0.5947490E-04 ( -20.41%)
   displ. norm   :     0.1623339 α      lambda       -0.9008245E-04
   maximum displ.:     0.1236101 α      in ANC's #1, #2, #5, ...

........................................................................
.............................. CYCLE   38 ..............................
........................................................................
   1    -25.1701931 -0.251702E+02  0.155E-01    3.88       0.0  T
   2    -25.1701983 -0.523237E-05  0.764E-02    3.88       1.0  T
   3    -25.1701995 -0.117383E-05  0.123E-02    3.88       1.9  T
   4    -25.1701996 -0.526995E-07  0.574E-03    3.88       4.1  T
   5    -25.1701996 -0.838126E-07  0.110E-03    3.88      21.4  T
   6    -25.1701997 -0.117764E-08  0.515E-04    3.88      45.8  T
   7    -25.1701997 -0.226756E-09  0.176E-04    3.88     133.9  T
     SCC iter.                  ...        0 min,  0.004 sec
     gradient                   ...        0 min,  0.007 sec
 * total energy  :   -24.9058705 Eh     change       -0.2779968E-04 Eh
   gradient norm :     0.0036287 Eh/α   predicted    -0.4622793E-04 (  66.29%)
   displ. norm   :     0.3238795 α      lambda       -0.7321827E-04
   maximum displ.:     0.2760173 α      in ANC's #1, #2, #3, ...

........................................................................
.............................. CYCLE   39 ..............................
........................................................................
   1    -25.1668178 -0.251668E+02  0.385E-01    3.86       0.0  T
   2    -25.1668466 -0.288370E-04  0.183E-01    3.87       1.0  T
   3    -25.1668539 -0.723133E-05  0.266E-02    3.87       1.0  T
   4    -25.1668538  0.629051E-07  0.678E-03    3.87       3.5  T
   5    -25.1668540 -0.241352E-06  0.254E-03    3.87       9.3  T
   6    -25.1668540 -0.464338E-08  0.109E-03    3.87      21.7  T
   7    -25.1668540 -0.781281E-09  0.313E-04    3.87      75.3  T
   8    -25.1668540 -0.560334E-10  0.119E-04    3.87     197.9  T
     SCC iter.                  ...        0 min,  0.005 sec
     gradient                   ...        0 min,  0.007 sec
 * total energy  :   -24.9058765 Eh     change       -0.6002511E-05 Eh
   gradient norm :     0.0047641 Eh/α   predicted    -0.4044680E-04 ( 573.83%)
   displ. norm   :     0.1836660 α      lambda       -0.6973941E-04
   maximum displ.:     0.1493776 α      in ANC's #1, #2, #5, ...

........................................................................
.............................. CYCLE   40 ..............................
........................................................................
   1    -25.1691952 -0.251692E+02  0.215E-01    3.88       0.0  T
   2    -25.1692042 -0.896711E-05  0.102E-01    3.88       1.0  T
   3    -25.1692064 -0.219931E-05  0.149E-02    3.87       1.6  T
   4    -25.1692063  0.407257E-07  0.513E-03    3.87       4.6  T
   5    -25.1692065 -0.137756E-06  0.144E-03    3.87      16.4  T
   6    -25.1692065 -0.144913E-08  0.675E-04    3.87      34.9  T
     SCC iter.                  ...        0 min,  0.004 sec
     gradient                   ...        0 min,  0.007 sec
 * total energy  :   -24.9059015 Eh     change       -0.2501096E-04 Eh
   gradient norm :     0.0015007 Eh/α   predicted    -0.3604814E-04 (  44.13%)
   displ. norm   :     0.0644827 α      lambda       -0.1713515E-04
   maximum displ.:     0.0428967 α      in ANC's #2, #3, #4, ...

........................................................................
.............................. CYCLE   41 ..............................
........................................................................
   1    -25.1692947 -0.251693E+02  0.739E-02    3.88       0.0  T
   2    -25.1692957 -0.105326E-05  0.359E-02    3.88       1.0  T
   3    -25.1692960 -0.258128E-06  0.540E-03    3.88       4.4  T
   4    -25.1692960  0.302446E-08  0.178E-03    3.88      13.3  T
   5    -25.1692960 -0.143216E-07  0.458E-04    3.88      51.5  T
   6    -25.1692960 -0.136989E-09  0.196E-04    3.88     120.0  T
     SCC iter.                  ...        0 min,  0.004 sec
     gradient                   ...        0 min,  0.007 sec
 * total energy  :   -24.9058919 Eh     change        0.9591174E-05 Eh
   gradient norm :     0.0039553 Eh/α   predicted    -0.8584354E-05 (-189.50%)
   displ. norm   :     0.0664473 α      lambda       -0.2759047E-04
   maximum displ.:     0.0564315 α      in ANC's #1, #3, #2, ...

........................................................................
.............................. CYCLE   42 ..............................
........................................................................
   1    -25.1691870 -0.251692E+02  0.999E-02    3.87       0.0  T
   2    -25.1691889 -0.195136E-05  0.466E-02    3.87       1.0  T
   3    -25.1691894 -0.477278E-06  0.595E-03    3.87       4.0  T
   4    -25.1691894  0.633172E-09  0.149E-03    3.87      15.9  T
   5    -25.1691894 -0.821869E-08  0.565E-04    3.87      41.7  T
   6    -25.1691894 -0.294207E-09  0.237E-04    3.87      99.4  T
     SCC iter.                  ...        0 min,  0.004 sec
     gradient                   ...        0 min,  0.007 sec
 * total energy  :   -24.9059111 Eh     change       -0.1917840E-04 Eh
   gradient norm :     0.0018090 Eh/α   predicted    -0.1385499E-04 ( -27.76%)
   displ. norm   :     0.1012082 α      lambda       -0.1136652E-04
   maximum displ.:     0.0896680 α      in ANC's #1, #2, #3, ...
 * RMSD in coord.:     0.6650100 α      energy gain  -0.9254386E-03 Eh

generating ANC from model Hessian ...
Using Lindh-Hessian (1995)
 Shifting diagonal of input Hessian by   0.000000000000000E+000
 Lowest  eigenvalues of input Hessian
   -0.000000   -0.000000   -0.000000    0.000000    0.000000    0.000000
    0.006781    0.010328    0.012075    0.020727    0.025716    0.036276
    0.041458    0.046828    0.051754    0.053126    0.054631    0.058741
 Highest eigenvalues
    1.185247    1.244908    1.392679    1.410666    1.456285    1.571303
 

........................................................................
.............................. CYCLE   43 ..............................
........................................................................
   1    -25.1691864 -0.251692E+02  0.113E-01    3.87       0.0  T
   2    -25.1691890 -0.262886E-05  0.541E-02    3.87       1.0  T
   3    -25.1691897 -0.645961E-06  0.818E-03    3.87       2.9  T
   4    -25.1691897  0.453561E-08  0.263E-03    3.87       9.0  T
   5    -25.1691897 -0.274301E-07  0.820E-04    3.87      28.7  T
   6    -25.1691897 -0.231417E-09  0.341E-04    3.87      69.0  T
     SCC iter.                  ...        0 min,  0.004 sec
     gradient                   ...        0 min,  0.007 sec
 * total energy  :   -24.9059125 Eh     change       -0.1418601E-05 Eh
   gradient norm :     0.0016825 Eh/α   predicted     0.0000000E+00 (-100.00%)
   displ. norm   :     0.0198329 α      lambda       -0.8810742E-05
   maximum displ.:     0.0119620 α      in ANC's #3, #2, #6, ...

........................................................................
.............................. CYCLE   44 ..............................
........................................................................
   1    -25.1694474 -0.251694E+02  0.245E-02    3.87       0.0  T
   2    -25.1694475 -0.128665E-06  0.118E-02    3.87       2.0  T
   3    -25.1694475 -0.276483E-07  0.192E-03    3.87      12.3  T
   4    -25.1694475 -0.161317E-08  0.908E-04    3.87      26.0  T
   5    -25.1694475 -0.126344E-08  0.155E-04    3.87     152.3  T
     SCC iter.                  ...        0 min,  0.004 sec
     gradient                   ...        0 min,  0.007 sec
 * total energy  :   -24.9059176 Eh     change       -0.5102646E-05 Eh
   gradient norm :     0.0005866 Eh/α   predicted    -0.4404917E-05 ( -13.67%)
   displ. norm   :     0.0115167 α      lambda       -0.1906258E-05
   maximum displ.:     0.0089801 α      in ANC's #3, #2, #6, ...

........................................................................
.............................. CYCLE   45 ..............................
........................................................................
   1    -25.1694508 -0.251695E+02  0.178E-02    3.87       0.0  T
   2    -25.1694509 -0.667020E-07  0.831E-03    3.87       2.8  T
   3    -25.1694509 -0.136649E-07  0.115E-03    3.87      20.5  T
   4    -25.1694509 -0.538886E-09  0.558E-04    3.87      42.2  T
   5    -25.1694509 -0.490676E-09  0.123E-04    3.87     192.0  T
     SCC iter.                  ...        0 min,  0.004 sec
     gradient                   ...        0 min,  0.007 sec
 * total energy  :   -24.9059189 Eh     change       -0.1338189E-05 Eh
   gradient norm :     0.0004058 Eh/α   predicted    -0.9536889E-06 ( -28.73%)
   displ. norm   :     0.0075064 α      lambda       -0.6328779E-06
   maximum displ.:     0.0055996 α      in ANC's #3, #4, #6, ...

   *** GEOMETRY OPTIMIZATION CONVERGED AFTER 45 ITERATIONS ***

------------------------------------------------------------------------
 total energy gain   :        -0.0090174 Eh       -5.6585 kcal/mol
 total RMSD          :         1.2564258 a0        0.6649 Å
 total power (kW/mol):        -0.5261131 (step)  -30.6406 (real)
------------------------------------------------------------------------

 ANCopt (total)                0 d,  0 h,  0 min,  0.773 sec
 optimizer setup                ...        0 min,  0.000 sec (  0.016%)
 model hessian                  ...        0 min,  0.028 sec (  3.571%)
 ANC generation                 ...        0 min,  0.001 sec (  0.191%)
 coordinate transformation      ...        0 min,  0.001 sec (  0.079%)
 single point calculation       ...        0 min,  0.728 sec ( 94.229%)
 optimization log               ...        0 min,  0.003 sec (  0.452%)
 hessian update                 ...        0 min,  0.000 sec (  0.063%)
 rational function              ...        0 min,  0.008 sec (  1.059%)

================
 final structure:
================
$coord
   -1.71660352771901   -2.47123585513488    0.25368390777173      C 
   -3.32121183486912    0.02493156656941    1.96760752402900      S 
   -2.31845525942994    2.26098668721858   -0.55427044599814      C 
    0.13232319016495    1.53336147989643   -1.30683262215891      N 
    0.26789878853572   -1.23538766446799   -1.52152443994139      C 
    2.78799449412113   -1.97628440837888   -0.79806462189066      N 
    3.47846011217370   -0.16009139609132    1.15356258285629      C 
    2.22491212787613    2.32728454996587    0.31806207426837      C 
   -3.11311523262682   -3.54008430979945   -0.81649227590474      H 
   -0.79169604909969   -3.71627150502806    1.60072665351651      H 
   -2.39483481333703    4.17878374748056    0.17359076743706      H 
   -3.64749257690463    2.03014287988502   -2.11532663282594      H 
   -0.13208576126085   -1.80263699954946   -3.47048649501979      H 
    3.97439133839581   -1.81083581813453   -2.29577229972995      H 
    5.52004514301840   -0.02244755872597    1.35429022211891      H 
    2.66791241589266   -0.79924370568402    2.94326914619113      H 
    3.52182795756921    3.47815227235258   -0.81155258763641      H 
    1.56350485381050    3.43815779459357    1.92266570103530      H 
$end
           -------------------------------------------------
          |                Final Singlepoint                |
           -------------------------------------------------

          ...................................................
          :                      SETUP                      :
          :.................................................:
          :  # basis functions                  48          :
          :  # atomic orbitals                  47          :
          :  # shells                           27          :
          :  # electrons                        46          :
          :  max. iterations                   250          :
          :  Hamiltonian                  GFN2-xTB          :
          :  restarted?                      false          :
          :  GBSA solvation                  false          :
          :  PC potential                    false          :
          :  electronic temp.          300.0000000     K    :
          :  accuracy                    1.0000000          :
          :  -> integral cutoff          0.2500000E+02      :
          :  -> integral neglect         0.1000000E-07      :
          :  -> SCF convergence          0.1000000E-05 Eh   :
          :  -> wf. convergence          0.1000000E-03 e    :
          :  Broyden damping             0.4000000          :
          ...................................................

 iter      E             dE          RMSdq      gap      omega  full diag
   1    -25.1694509 -0.251695E+02  0.387E-05    3.87       0.0  T
   2    -25.1694509 -0.245137E-11  0.138E-05    3.87    1710.3  T
   3    -25.1694509 -0.277112E-12  0.851E-06    3.87    2770.0  T

   *** convergence criteria satisfied after 3 iterations ***

         #    Occupation            Energy/Eh            Energy/eV
      -------------------------------------------------------------
         1        2.0000           -0.7054495             -19.1963
       ...           ...                  ...                  ...
        17        2.0000           -0.4665303             -12.6949
        18        2.0000           -0.4630453             -12.6001
        19        2.0000           -0.4564828             -12.4215
        20        2.0000           -0.4465886             -12.1523
        21        2.0000           -0.3873209             -10.5395
        22        2.0000           -0.3767086             -10.2508
        23        2.0000           -0.3536118              -9.6223 (HOMO)
        24                         -0.2112882              -5.7494 (LUMO)
        25                         -0.1259240              -3.4266
        26                         -0.0189430              -0.5155
        27                          0.0016364               0.0445
        28                          0.0045143               0.1228
       ...                                ...                  ...
        47                          0.3931273              10.6975
      -------------------------------------------------------------
                  HL-Gap            0.1423235 Eh            3.8728 eV
             Fermi-level           -0.2824500 Eh           -7.6859 eV

 SCC (total)                   0 d,  0 h,  0 min,  0.015 sec
 SCC setup                      ...        0 min,  0.000 sec (  0.987%)
 Dispersion                     ...        0 min,  0.000 sec (  0.676%)
 integral evaluation            ...        0 min,  0.004 sec ( 29.017%)
 zeroth order Hamiltonian       ...        0 min,  0.000 sec (  0.596%)
 iterations                     ...        0 min,  0.003 sec ( 16.862%)
 molecular gradient             ...        0 min,  0.007 sec ( 49.655%)
 printout                       ...        0 min,  0.000 sec (  1.873%)

         :::::::::::::::::::::::::::::::::::::::::::::::::::::
         ::                     SUMMARY                     ::
         :::::::::::::::::::::::::::::::::::::::::::::::::::::
         :: total energy             -24.905918943678 Eh    ::
         :: gradient norm              0.000405698247 Eh/a0 ::
         :: HOMO-LUMO gap              3.872820339108 eV    ::
         ::.................................................::
         :: SCC energy               -25.169450906067 Eh    ::
         :: -> isotropic ES            0.018012135581 Eh    ::
         :: -> anisotropic ES          0.003123328640 Eh    ::
         :: -> anisotropic XC          0.020232270795 Eh    ::
         :: -> dispersion             -0.015670292964 Eh    ::
         :: repulsion energy           0.263481799703 Eh    ::
         :: add. restraining           0.000000000000 Eh    ::
         :::::::::::::::::::::::::::::::::::::::::::::::::::::

           -------------------------------------------------
          |                Property Printout                |
           -------------------------------------------------

    * Orbital Energies and Occupations

         #    Occupation            Energy/Eh            Energy/eV
      -------------------------------------------------------------
         1        2.0000           -0.7054495             -19.1963
       ...           ...                  ...                  ...
        11        2.0000           -0.5266293             -14.3303
        12        2.0000           -0.5161078             -14.0440
        13        2.0000           -0.5143147             -13.9952
        14        2.0000           -0.5046487             -13.7322
        15        2.0000           -0.4865080             -13.2386
        16        2.0000           -0.4831639             -13.1476
        17        2.0000           -0.4665303             -12.6949
        18        2.0000           -0.4630453             -12.6001
        19        2.0000           -0.4564828             -12.4215
        20        2.0000           -0.4465886             -12.1523
        21        2.0000           -0.3873209             -10.5395
        22        2.0000           -0.3767086             -10.2508
        23        2.0000           -0.3536118              -9.6223 (HOMO)
        24                         -0.2112882              -5.7494 (LUMO)
        25                         -0.1259240              -3.4266
        26                         -0.0189430              -0.5155
        27                          0.0016364               0.0445
        28                          0.0045143               0.1228
        29                          0.0163129               0.4439
        30                          0.0233376               0.6350
        31                          0.0523842               1.4254
        32                          0.0662457               1.8026
        33                          0.1001966               2.7265
        34                          0.1070842               2.9139
       ...                                ...                  ...
        47                          0.3931273              10.6975
      -------------------------------------------------------------
                  HL-Gap            0.1423235 Eh            3.8728 eV
             Fermi-level           -0.2824500 Eh           -7.6859 eV

     #   Z        covCN         q      C6AA      α(0)
     1   6 C      3.797    -0.015    20.841     6.500
     2  16 S      2.037    -0.253   151.902    20.744
     3   6 C      3.761     0.064    19.556     6.304
     4   7 N      2.795    -0.190    25.123     7.444
     5   6 C      3.877     0.121    18.572     6.127
     6   7 N      2.692    -0.263    26.825     7.692
     7   6 C      3.804     0.012    20.369     6.425
     8   6 C      3.774     0.008    20.466     6.446
     9   1 H      0.925     0.036     2.497     2.471
    10   1 H      0.925     0.060     2.195     2.317
    11   1 H      0.925     0.048     2.349     2.397
    12   1 H      0.924     0.041     2.434     2.440
    13   1 H      0.924     0.027     2.622     2.532
    14   1 H      0.860     0.146     1.430     1.873
    15   1 H      0.925     0.036     2.505     2.475
    16   1 H      0.924     0.050     2.319     2.382
    17   1 H      0.924     0.032     2.557     2.501
    18   1 H      0.924     0.039     2.459     2.452

 Mol. C6AA /au·bohr⁶  :       3593.552046
 Mol. C8AA /au·bohr⁸  :      93887.644851
 Mol. α(0) /au        :         91.523042


Wiberg/Mayer (AO) data.
largest (>0.10) Wiberg bond orders for each atom
          total WBO             WBO to atom ...
     1  C   3.980        S    2 1.008    H    9 0.981    H   10 0.974    C    5 0.964
     2  S   2.074        C    1 1.008    C    3 0.913
     3  C   3.976        N    4 1.078    H   11 0.973    H   12 0.971    S    2 0.913
     4  N   3.206        C    3 1.078    C    8 0.990    C    5 0.965
     5  C   3.977        N    6 1.024    N    4 0.965    C    1 0.964    H   13 0.964
     6  N   3.082        C    5 1.024    C    7 1.008    H   14 0.955
     7  C   3.984        N    6 1.008    C    8 0.989    H   15 0.979    H   16 0.974
     8  C   3.982        N    4 0.990    C    7 0.989    H   17 0.975    H   18 0.974
     9  H   0.999        C    1 0.981
    10  H   0.996        C    1 0.974
    11  H   0.998        C    3 0.973
    12  H   0.998        C    3 0.971
    13  H   0.999        C    5 0.964
    14  H   0.979        N    6 0.955
    15  H   0.998        C    7 0.979
    16  H   0.997        C    7 0.974
    17  H   0.999        C    8 0.975
    18  H   0.998        C    8 0.974

molecular dipole:
                 x           y           z       tot (Debye)
 q only:        0.706       0.093      -0.440
   full:        0.846       0.230      -0.776       2.977
molecular quadrupole (traceless):
                xx          xy          yy          xz          yz          zz
 q only:       -0.735       0.423       1.687       3.070       0.819      -0.952
  q+dip:       -0.536       2.200       1.081       4.777       1.404      -0.545
   full:       -0.659       1.816       1.698       4.392       1.578      -1.040

           -------------------------------------------------
          |                Geometry Summary                 |
           -------------------------------------------------

      molecular mass/u    :      130.2074000
   center of mass at/Å    :       -0.1426223       0.0191301       0.1132346
  moments of inertia/u·Å² :        0.1641271E+03   0.3080138E+03   0.3587217E+03
rotational constants/cm⁻¹ :        0.1027108E+00   0.5473012E-01   0.4699362E-01

 * 16 selected distances

     #   Z        #   Z                                     value/Å
     3   6 C      4   7 N                                 1.4102453
     4   7 N      5   6 C                                 1.4713074
     5   6 C      6   7 N                                 1.4417730
     6   7 N      7   6 C                                 1.4573189
     4   7 N      8   6 C                                 1.4635865
     7   6 C      8   6 C                                 1.5388492 (max)
     1   6 C      9   1 H                                 1.0893804
     1   6 C     10   1 H                                 1.0870815
     3   6 C     11   1 H                                 1.0862401
     3   6 C     12   1 H                                 1.0917641
     5   6 C     13   1 H                                 1.0947976
     6   7 N     14   1 H                                 1.0148675 (min)
     7   6 C     15   1 H                                 1.0880104
     7   6 C     16   1 H                                 1.0933054
     8   6 C     17   1 H                                 1.0950922
     8   6 C     18   1 H                                 1.0904457

 * 4 distinct bonds (by element types)

   Z      Z             #   av. dist./Å        max./Å        min./Å
   1 H    6 C           9     1.0906797     1.0950922     1.0862401
   6 C    6 C           1     1.5388492     1.5388492     1.5388492
   1 H    7 N           1     1.0148675     1.0148675     1.0148675
   6 C    7 N           5     1.4488462     1.4713074     1.4102453


optimized geometry written to: xtbopt.xyz


           -------------------------------------------------
          | TOTAL ENERGY              -24.905918943678 Eh   |
          | GRADIENT NORM               0.000405698247 Eh/α |
          | HOMO-LUMO GAP               3.872820339108 eV   |
           -------------------------------------------------

------------------------------------------------------------------------
 * finished run on 2021/05/19 at 10:59:06.106     
------------------------------------------------------------------------
 total:
 * wall-time:     0 d,  0 h,  0 min,  0.826 sec
 *  cpu-time:     0 d,  0 h,  0 min,  0.825 sec
 * ratio c/w:     0.999 speedup
 SCF:
 * wall-time:     0 d,  0 h,  0 min,  0.021 sec
 *  cpu-time:     0 d,  0 h,  0 min,  0.021 sec
 * ratio c/w:     0.998 speedup
 ANC optimizer:
 * wall-time:     0 d,  0 h,  0 min,  0.788 sec
 *  cpu-time:     0 d,  0 h,  0 min,  0.788 sec
 * ratio c/w:     1.000 speedup

