      -----------------------------------------------------------      
     |                   =====================                   |     
     |                           x T B                           |     
     |                   =====================                   |     
     |                         S. Grimme                         |     
     |          Mulliken Center for Theoretical Chemistry        |     
     |                    University of Bonn                     |     
     |                Version 6.2 RC2 (SAW190805)                |     
      -----------------------------------------------------------      

   This program is distributed in the hope that it will be useful,
   but WITHOUT ANY WARRANTY; without even the implied warranty of
   MERCHANTABILITY or FITNESS FOR A PARTICULAR PURPOSE.
   
   FOR NON-COMMERCIAL, ACADEMIA USE ONLY.
   
   Cite this work as:
   * S. Grimme, C. Bannwarth, P. Shushkov, J. Chem. Theory Comput., 2017,
     13, 1989-2009. DOI: 10.1021/acs.jctc.7b00118
   * C. Bannwarth, S. Ehlert and S. Grimme., J. Chem. Theory Comput., 2019,
     15, 1652-1671. DOI: 10.1021/acs.jctc.8b01176
   * P. Pracht, E. Caldeweyher, S. Ehlert, S. Grimme, ChemRxiv, 2019, preprint.
     DOI: 10.26434/chemrxiv.8326202.v1
   
   for DFT-D4:
   * E. Caldeweyher, C. Bannwarth and S. Grimme, J. Chem. Phys., 2017,
     147, 034112. DOI: 10.1063/1.4993215
   * E. Caldeweyher, S. Ehlert, A. Hansen, H. Neugebauer, S. Spicher,
     C. Bannwarth and S. Grimme, J. Chem. Phys., 2019, 150, 154122.
     DOI: 10.1063/1.5090222
   
   for sTDA-xTB:
   * S. Grimme and C. Bannwarth, J. Chem. Phys., 2016, 145, 054103.
     DOI: 10.1063/1.4959605
   
   in the mass-spec context:
   * V. Asgeirsson, C. Bauer and S. Grimme, Chem. Sci., 2017, 8, 4879.
     DOI: 10.1039/c7sc00601b
   
   for metadynamics refer to:
   * S. Grimme, J. Chem. Theory Comput., 2019, 155, 2847-2862
     DOI: 10.1021/acs.jctc.9b00143
   
   with help from (in alphabetical order)
   C. Bannwarth, F. Bohle, G. Brandenburg, E. Caldeweyher, M. Checinski,
   S. Dohm, S. Ehlert, S. Ehrlich, F. März, H. Neugebauer, J. Pisarek,
   P. Pracht, P. Shushkov, and S. Spicher.
   
 * started run on 2021/05/19 at 10:59:06.443     

           -------------------------------------------------
          |                Calculation Setup                |
           -------------------------------------------------

          program call               : /ihome/ghutchison/geoffh/xtb/xtb 236.xyz -opt
          hostname                   : smp-n83
          coordinate file            : 236.xyz
          omp threads                :                     1
          number of atoms            :                    24
          number of electrons        :                    88
          charge                     :                     0
          spin                       :                   0.0
          first test random number   :      0.25140192237178


########################################################################
# WARNING! Please study the warnings concerning your input carefully
#  - the use of '-opt' is discouraged, please use '--opt' next time
########################################################################

           ------------------------------------------------- 
          |                 G F N 2 - x T B                 |
          | Geometry, Frequencies, Noncovalent interactions |
          |            JCTC 2019 parametrisation            |
           ------------------------------------------------- 
             KAB for C  - Si     :                1.0500
             KAB for H  - Pd     :                0.9500
             k(s)              :                1.8500
             k(p)              :                2.2300
             k(d)              :                2.2300
             k(f)              :                2.0000
             kEN (H0ij)        :               -2.0000
             D4 a1             :                0.5200
             D4 a2             :                5.0000
             D4 s6             :                1.0000
             D4 s8             :                2.7000
             D4 s9             :                5.0000
             alphaj            :                2.0000

  Z AO/shell   Hii/eV     exponent
  1     Wed Apr 25 08:07:45 CEST 2018   EN: 2.200 GM2: 0.406  GM3: 0.0800  RAES: 1.40
     1s    -10.707211    1.230000
  6     Wed Apr 25 08:07:45 CEST 2018   EN: 2.550 GM2: 0.538  GM3: 0.1500  RAES: 3.00
     2s    -13.970922    2.096432
     2p    -10.063292    1.800000
  7     Wed Apr 25 08:07:45 CEST 2018   EN: 3.040 GM2: 0.461  GM3:-0.0640  RAES: 1.90
     2s    -16.686243    2.339881
     2p    -12.523956    2.014332
  8     Wed Apr 25 08:07:45 CEST 2018   EN: 3.440 GM2: 0.452  GM3:-0.0517  RAES: 1.80
     2s    -20.229985    2.439742
     2p    -15.503117    2.137023

           ------------------------------------------------- 
          |        Self-Consistent Charge Iterations        |
           ------------------------------------------------- 

          ...................................................
          :                      SETUP                      :
          :.................................................:
          :  # basis functions                  78          :
          :  # atomic orbitals                  78          :
          :  # shells                           42          :
          :  # electrons                        88          :
          :  max. iterations                   250          :
          :  Hamiltonian                  GFN2-xTB          :
          :  restarted?                      false          :
          :  GBSA solvation                  false          :
          :  PC potential                    false          :
          :  electronic temp.          300.0000000     K    :
          :  accuracy                    1.0000000          :
          :  -> integral cutoff          0.2500000E+02      :
          :  -> integral neglect         0.1000000E-07      :
          :  -> SCF convergence          0.1000000E-05 Eh   :
          :  -> wf. convergence          0.1000000E-03 e    :
          :  Broyden damping             0.4000000          :
          ...................................................

 iter      E             dE          RMSdq      gap      omega  full diag
   1    -51.4258459 -0.514258E+02  0.577E+00    1.85       0.0  T
   2    -51.5386749 -0.112829E+00  0.332E+00    1.92       1.0  T
   3    -51.5363222  0.235264E-02  0.199E+00    1.99       1.0  T
   4    -51.5542427 -0.179205E-01  0.806E-01    1.62       1.0  T
   5    -51.5635794 -0.933670E-02  0.133E-01    1.68       1.0  T
   6    -51.5637805 -0.201157E-03  0.709E-02    1.70       1.0  T
   7    -51.5637945 -0.139856E-04  0.246E-02    1.71       1.0  T
   8    -51.5638009 -0.642465E-05  0.961E-03    1.71       2.1  T
   9    -51.5638012 -0.260596E-06  0.340E-03    1.71       6.0  T
  10    -51.5638013 -0.130676E-06  0.163E-03    1.71      12.5  T
  11    -51.5638014 -0.438233E-07  0.501E-04    1.71      40.8  T
  12    -51.5638014 -0.204864E-08  0.184E-04    1.71     111.2  T

   *** convergence criteria satisfied after 12 iterations ***

         #    Occupation            Energy/Eh            Energy/eV
      -------------------------------------------------------------
         1        2.0000           -0.7551520             -20.5487
       ...           ...                  ...                  ...
        38        2.0000           -0.4711500             -12.8206
        39        2.0000           -0.4689163             -12.7599
        40        2.0000           -0.4494136             -12.2292
        41        2.0000           -0.4486692             -12.2089
        42        2.0000           -0.4415436             -12.0150
        43        2.0000           -0.4349627             -11.8359
        44        2.0000           -0.4212341             -11.4624 (HOMO)
        45                         -0.3583211              -9.7504 (LUMO)
        46                         -0.3146384              -8.5617
        47                         -0.3104835              -8.4487
        48                         -0.2495187              -6.7897
        49                         -0.2081130              -5.6630
       ...                                ...                  ...
        78                          0.7015823              19.0910
      -------------------------------------------------------------
                  HL-Gap            0.0629130 Eh            1.7119 eV
             Fermi-level           -0.3897776 Eh          -10.6064 eV

 SCC (total)                   0 d,  0 h,  0 min,  0.047 sec
 SCC setup                      ...        0 min,  0.000 sec (  0.679%)
 Dispersion                     ...        0 min,  0.000 sec (  0.931%)
 integral evaluation            ...        0 min,  0.012 sec ( 26.184%)
 zeroth order Hamiltonian       ...        0 min,  0.000 sec (  0.418%)
 iterations                     ...        0 min,  0.017 sec ( 36.658%)
 molecular gradient             ...        0 min,  0.016 sec ( 34.165%)
 printout                       ...        0 min,  0.000 sec (  0.858%)

         :::::::::::::::::::::::::::::::::::::::::::::::::::::
         ::                     SUMMARY                     ::
         :::::::::::::::::::::::::::::::::::::::::::::::::::::
         :: total energy             -50.882707618701 Eh    ::
         :: gradient norm              0.104475912591 Eh/a0 ::
         :: HOMO-LUMO gap              1.711949480780 eV    ::
         ::.................................................::
         :: SCC energy               -51.563801367736 Eh    ::
         :: -> isotropic ES            0.110198134208 Eh    ::
         :: -> anisotropic ES          0.001719759999 Eh    ::
         :: -> anisotropic XC          0.008927455803 Eh    ::
         :: -> dispersion             -0.027338225570 Eh    ::
         :: repulsion energy           0.681220344685 Eh    ::
         :: add. restraining           0.000000000000 Eh    ::
         :::::::::::::::::::::::::::::::::::::::::::::::::::::

      ----------------------------------------------------------- 
     |                   =====================                   |
     |                        A N C O P T                        |
     |                   =====================                   |
     |               Approximate Normal Coordinate               |
     |                Rational Function Optimizer                |
      ----------------------------------------------------------- 

          ...................................................
          :                      SETUP                      :
          :.................................................:
          :   optimization level            normal          :
          :   max. optcycles                   200          :
          :   ANC micro-cycles                  20          :
          :   degrees of freedom                66          :
          :.................................................:
          :   RF solver                   davidson          :
          :   input Hessian                  false          :
          :   write xtbopt.log                true          :
          :   linear?                        false          :
          :   energy convergence         0.5000000E-05 Eh   :
          :   grad. convergence          0.1000000E-02 Eh/α :
          :   maximium RF displ.         2.0000000          :
          :   Hlow (freq-cutoff)         0.5000000E-02      :
          :   Hmax (freq-cutoff)         5.0000000          :
          :   S6 in model hess.         20.0000000          :
          ...................................................

generating ANC from model Hessian ...
Using Lindh-Hessian (1995)
 Shifting diagonal of input Hessian by   3.804857626452828E-003
 Lowest  eigenvalues of input Hessian
   -0.000000   -0.000000   -0.000000   -0.000000    0.000000    0.000000
    0.005000    0.007294    0.010248    0.010327    0.011535    0.016454
    0.021317    0.023253    0.025788    0.030977    0.041361    0.044378
 Highest eigenvalues
    2.133758    2.241935    2.355392    2.392996    2.496379    2.549614
 

........................................................................
.............................. CYCLE    1 ..............................
........................................................................
   1    -51.5638014 -0.515638E+02  0.537E-05    1.71       0.0  T
   2    -51.5638014 -0.185736E-10  0.330E-05    1.71     618.6  T
   3    -51.5638014 -0.164277E-10  0.179E-05    1.71    1140.9  T
     SCC iter.                  ...        0 min,  0.005 sec
     gradient                   ...        0 min,  0.016 sec
 * total energy  :   -50.8827076 Eh     change        0.5420645E-08 Eh
   gradient norm :     0.1044768 Eh/α   predicted     0.0000000E+00 (-100.00%)
   displ. norm   :     0.2226856 α      lambda       -0.1097304E-01
   maximum displ.:     0.1195682 α      in ANC's #16, #20, #11, ...

........................................................................
.............................. CYCLE    2 ..............................
........................................................................
   1    -51.5711482 -0.515711E+02  0.290E-01    1.81       0.0  T
   2    -51.5715706 -0.422412E-03  0.179E-01    1.77       1.0  T
   3    -51.5715801 -0.953388E-05  0.987E-02    1.76       1.0  T
   4    -51.5715827 -0.262632E-05  0.512E-02    1.77       1.0  T
   5    -51.5716199 -0.371762E-04  0.800E-03    1.76       2.6  T
   6    -51.5716206 -0.648699E-06  0.376E-03    1.76       5.4  T
   7    -51.5716206 -0.327828E-07  0.119E-03    1.76      17.2  T
     SCC iter.                  ...        0 min,  0.009 sec
     gradient                   ...        0 min,  0.015 sec
 * total energy  :   -50.8908313 Eh     change       -0.8123729E-02 Eh
   gradient norm :     0.0518128 Eh/α   predicted    -0.5758591E-02 ( -29.11%)
   displ. norm   :     0.2183799 α      lambda       -0.5360173E-02
   maximum displ.:     0.1185891 α      in ANC's #16, #20, #11, ...

........................................................................
.............................. CYCLE    3 ..............................
........................................................................
   1    -51.5730817 -0.515731E+02  0.302E-01    1.83       0.0  T
   2    -51.5734983 -0.416590E-03  0.187E-01    1.78       1.0  T
   3    -51.5735019 -0.361148E-05  0.107E-01    1.77       1.0  T
   4    -51.5735192 -0.172791E-04  0.524E-02    1.78       1.0  T
   5    -51.5735575 -0.383023E-04  0.772E-03    1.77       2.6  T
   6    -51.5735579 -0.461006E-06  0.383E-03    1.77       5.3  T
   7    -51.5735580 -0.401572E-07  0.108E-03    1.77      18.9  T
     SCC iter.                  ...        0 min,  0.009 sec
     gradient                   ...        0 min,  0.015 sec
 * total energy  :   -50.8938581 Eh     change       -0.3026730E-02 Eh
   gradient norm :     0.0096424 Eh/α   predicted    -0.2807905E-02 (  -7.23%)
   displ. norm   :     0.0587001 α      lambda       -0.2227563E-03
   maximum displ.:     0.0336945 α      in ANC's #3, #16, #21, ...

........................................................................
.............................. CYCLE    4 ..............................
........................................................................
   1    -51.5725827 -0.515726E+02  0.627E-02    1.77       0.0  T
   2    -51.5725938 -0.111469E-04  0.386E-02    1.76       1.0  T
   3    -51.5725921  0.170413E-05  0.219E-02    1.75       1.0  T
   4    -51.5725947 -0.254382E-05  0.877E-03    1.76       2.3  T
   5    -51.5725958 -0.114028E-05  0.152E-03    1.75      13.5  T
   6    -51.5725958 -0.683271E-08  0.729E-04    1.75      28.0  T
     SCC iter.                  ...        0 min,  0.008 sec
     gradient                   ...        0 min,  0.015 sec
 * total energy  :   -50.8939957 Eh     change       -0.1376117E-03 Eh
   gradient norm :     0.0044268 Eh/α   predicted    -0.1117845E-03 ( -18.77%)
   displ. norm   :     0.0330463 α      lambda       -0.3728110E-04
   maximum displ.:     0.0286541 α      in ANC's #3, #16, #28, ...

........................................................................
.............................. CYCLE    5 ..............................
........................................................................
   1    -51.5726555 -0.515727E+02  0.230E-02    1.75       0.0  T
   2    -51.5726563 -0.807435E-06  0.140E-02    1.74       1.5  T
   3    -51.5726561  0.219332E-06  0.557E-03    1.74       3.7  T
   4    -51.5726564 -0.260792E-06  0.205E-03    1.74      10.0  T
   5    -51.5726564 -0.763966E-07  0.605E-04    1.74      33.7  T
     SCC iter.                  ...        0 min,  0.007 sec
     gradient                   ...        0 min,  0.015 sec
 * total energy  :   -50.8940191 Eh     change       -0.2344061E-04 Eh
   gradient norm :     0.0021379 Eh/α   predicted    -0.1866903E-04 ( -20.36%)
   displ. norm   :     0.0158531 α      lambda       -0.6829740E-05
   maximum displ.:     0.0147723 α      in ANC's #3, #11, #28, ...

........................................................................
.............................. CYCLE    6 ..............................
........................................................................
   1    -51.5728971 -0.515729E+02  0.811E-03    1.74       0.0  T
   2    -51.5728973 -0.133779E-06  0.513E-03    1.74       4.0  T
   3    -51.5728972  0.315260E-07  0.276E-03    1.74       7.4  T
   4    -51.5728973 -0.651283E-07  0.826E-04    1.74      24.7  T
   5    -51.5728973 -0.105521E-07  0.194E-04    1.74     105.3  T
     SCC iter.                  ...        0 min,  0.007 sec
     gradient                   ...        0 min,  0.016 sec
 * total energy  :   -50.8940233 Eh     change       -0.4136366E-05 Eh
   gradient norm :     0.0008074 Eh/α   predicted    -0.3417405E-05 ( -17.38%)
   displ. norm   :     0.0238235 α      lambda        0.2721444E-05
   maximum displ.:     0.0221596 α      in ANC's #3, #11, #28, ...

   *** GEOMETRY OPTIMIZATION CONVERGED AFTER 6 ITERATIONS ***

------------------------------------------------------------------------
 total energy gain   :        -0.0113156 Eh       -7.1007 kcal/mol
 total RMSD          :         0.1019869 a0        0.0540 Å
 total power (kW/mol):        -4.9515359 (step) -135.6362 (real)
------------------------------------------------------------------------

 ANCopt (total)                0 d,  0 h,  0 min,  0.219 sec
 optimizer setup                ...        0 min,  0.000 sec (  0.071%)
 model hessian                  ...        0 min,  0.003 sec (  1.437%)
 ANC generation                 ...        0 min,  0.001 sec (  0.312%)
 coordinate transformation      ...        0 min,  0.000 sec (  0.051%)
 single point calculation       ...        0 min,  0.213 sec ( 97.250%)
 optimization log               ...        0 min,  0.001 sec (  0.288%)
 hessian update                 ...        0 min,  0.000 sec (  0.035%)
 rational function              ...        0 min,  0.001 sec (  0.345%)

================
 final structure:
================
$coord
   -0.19348497963585    2.95214576142209   -0.00807610419997      C 
    2.09890492534533    1.68628505882010   -0.00037187429985      C 
    4.71347707731317    2.70907363036859   -0.00322545645107      C 
    5.40477683525263    4.87101510591484   -0.01226807801843      O 
    6.30917178607724    0.60140949057601    0.00678423023139      N 
    4.97795474555391   -1.67394708528345    0.01631646529863      C 
    5.86459201673013   -3.76344233527426    0.02646432957908      O 
    2.25723466764847   -0.94917109733052    0.01120366469938      C 
    0.13236229488867   -2.47889200582145    0.01561096557260      C 
   -2.16210158878695   -1.21575479058042    0.00751788397745      C 
   -2.32054043231748    1.42381813731984   -0.00391039536332      C 
   -5.04501153957218    2.14005183184056   -0.01061461845072      C 
   -5.99851100723438    4.19562084308037   -0.02061489735441      O 
   -6.33222791342396   -0.14188646833990   -0.00278321362629      N 
   -4.78101846203908   -2.25316462345887    0.00819908507528      C 
   -5.48126156810836   -4.40828407289455    0.01605938401393      O 
    8.94193951386995    0.91315442273940    0.00562390790958      C 
   10.63092635254295   -0.92589995498453    0.01442008172678      C 
   -0.31466081775340    4.98627742833628   -0.01694064153124      H 
    0.25642135370242   -4.51283682084841    0.02449131788998      H 
   -8.23808454050181   -0.25650024450077   -0.00522170941831      H 
    9.44876639462062    2.89442023762135   -0.00389316123657      H 
   10.11354793600684   -2.88923853552691    0.02352368577387      H 
   12.61220760166546   -0.47789730822716    0.01197400707197      H 
$end
           -------------------------------------------------
          |                Final Singlepoint                |
           -------------------------------------------------

          ...................................................
          :                      SETUP                      :
          :.................................................:
          :  # basis functions                  78          :
          :  # atomic orbitals                  78          :
          :  # shells                           42          :
          :  # electrons                        88          :
          :  max. iterations                   250          :
          :  Hamiltonian                  GFN2-xTB          :
          :  restarted?                      false          :
          :  GBSA solvation                  false          :
          :  PC potential                    false          :
          :  electronic temp.          300.0000000     K    :
          :  accuracy                    1.0000000          :
          :  -> integral cutoff          0.2500000E+02      :
          :  -> integral neglect         0.1000000E-07      :
          :  -> SCF convergence          0.1000000E-05 Eh   :
          :  -> wf. convergence          0.1000000E-03 e    :
          :  Broyden damping             0.4000000          :
          ...................................................

 iter      E             dE          RMSdq      gap      omega  full diag
   1    -51.5728973 -0.515729E+02  0.803E-05    1.74       0.0  T
   2    -51.5728973 -0.294094E-10  0.420E-05    1.74     485.8  T
   3    -51.5728973 -0.370122E-10  0.269E-05    1.74     759.0  T

   *** convergence criteria satisfied after 3 iterations ***

         #    Occupation            Energy/Eh            Energy/eV
      -------------------------------------------------------------
         1        2.0000           -0.7554929             -20.5580
       ...           ...                  ...                  ...
        38        2.0000           -0.4721097             -12.8468
        39        2.0000           -0.4680266             -12.7357
        40        2.0000           -0.4539460             -12.3525
        41        2.0000           -0.4505258             -12.2594
        42        2.0000           -0.4422501             -12.0342
        43        2.0000           -0.4335812             -11.7983
        44        2.0000           -0.4190817             -11.4038 (HOMO)
        45                         -0.3552722              -9.6674 (LUMO)
        46                         -0.3107097              -8.4548
        47                         -0.3086018              -8.3975
        48                         -0.2438607              -6.6358
        49                         -0.2106322              -5.7316
       ...                                ...                  ...
        78                          0.7142011              19.4344
      -------------------------------------------------------------
                  HL-Gap            0.0638096 Eh            1.7363 eV
             Fermi-level           -0.3871769 Eh          -10.5356 eV

 SCC (total)                   0 d,  0 h,  0 min,  0.034 sec
 SCC setup                      ...        0 min,  0.000 sec (  0.618%)
 Dispersion                     ...        0 min,  0.000 sec (  0.754%)
 integral evaluation            ...        0 min,  0.012 sec ( 35.876%)
 zeroth order Hamiltonian       ...        0 min,  0.000 sec (  0.520%)
 iterations                     ...        0 min,  0.005 sec ( 13.674%)
 molecular gradient             ...        0 min,  0.016 sec ( 47.355%)
 printout                       ...        0 min,  0.000 sec (  1.031%)

         :::::::::::::::::::::::::::::::::::::::::::::::::::::
         ::                     SUMMARY                     ::
         :::::::::::::::::::::::::::::::::::::::::::::::::::::
         :: total energy             -50.894023256724 Eh    ::
         :: gradient norm              0.000806830905 Eh/a0 ::
         :: HOMO-LUMO gap              1.736346602450 eV    ::
         ::.................................................::
         :: SCC energy               -51.572897295278 Eh    ::
         :: -> isotropic ES            0.105144613984 Eh    ::
         :: -> anisotropic ES          0.000910101785 Eh    ::
         :: -> anisotropic XC          0.009723626546 Eh    ::
         :: -> dispersion             -0.027149195923 Eh    ::
         :: repulsion energy           0.679009330921 Eh    ::
         :: add. restraining           0.000000000000 Eh    ::
         :::::::::::::::::::::::::::::::::::::::::::::::::::::

           -------------------------------------------------
          |                Property Printout                |
           -------------------------------------------------

    * Orbital Energies and Occupations

         #    Occupation            Energy/Eh            Energy/eV
      -------------------------------------------------------------
         1        2.0000           -0.7554929             -20.5580
       ...           ...                  ...                  ...
        32        2.0000           -0.5269126             -14.3380
        33        2.0000           -0.5041960             -13.7199
        34        2.0000           -0.5019256             -13.6581
        35        2.0000           -0.5018167             -13.6551
        36        2.0000           -0.4774519             -12.9921
        37        2.0000           -0.4764192             -12.9640
        38        2.0000           -0.4721097             -12.8468
        39        2.0000           -0.4680266             -12.7357
        40        2.0000           -0.4539460             -12.3525
        41        2.0000           -0.4505258             -12.2594
        42        2.0000           -0.4422501             -12.0342
        43        2.0000           -0.4335812             -11.7983
        44        2.0000           -0.4190817             -11.4038 (HOMO)
        45                         -0.3552722              -9.6674 (LUMO)
        46                         -0.3107097              -8.4548
        47                         -0.3086018              -8.3975
        48                         -0.2438607              -6.6358
        49                         -0.2106322              -5.7316
        50                         -0.2035053              -5.5377
        51                         -0.1758794              -4.7859
        52                         -0.1214174              -3.3039
        53                         -0.0342490              -0.9320
        54                         -0.0084484              -0.2299
        55                          0.0118261               0.3218
       ...                                ...                  ...
        78                          0.7142011              19.4344
      -------------------------------------------------------------
                  HL-Gap            0.0638096 Eh            1.7363 eV
             Fermi-level           -0.3871769 Eh          -10.5356 eV

     #   Z        covCN         q      C6AA      α(0)
     1   6 C      2.907     0.000    28.025     8.680
     2   6 C      3.041    -0.013    28.291     8.724
     3   6 C      2.835     0.279    22.294     7.738
     4   8 O      0.857    -0.344    20.602     6.085
     5   7 N      2.784    -0.082    22.841     7.098
     6   6 C      2.823     0.280    22.269     7.732
     7   8 O      0.857    -0.343    20.566     6.080
     8   6 C      3.047    -0.013    28.287     8.723
     9   6 C      2.908     0.000    28.026     8.681
    10   6 C      3.048    -0.011    28.235     8.715
    11   6 C      3.048    -0.011    28.241     8.716
    12   6 C      2.817     0.289    22.105     7.703
    13   8 O      0.857    -0.344    20.589     6.084
    14   7 N      2.745    -0.178    24.860     7.405
    15   6 C      2.817     0.289    22.105     7.703
    16   8 O      0.857    -0.344    20.588     6.083
    17   6 C      2.830     0.027    27.392     8.576
    18   6 C      2.837    -0.099    30.485     9.048
    19   1 H      0.926     0.093     1.848     2.126
    20   1 H      0.926     0.093     1.845     2.124
    21   1 H      0.860     0.211     1.051     1.606
    22   1 H      0.925     0.074     2.045     2.237
    23   1 H      0.926     0.084     1.940     2.178
    24   1 H      0.926     0.062     2.176     2.307

 Mol. C6AA /au·bohr⁶  :       9440.057230
 Mol. C8AA /au·bohr⁸  :     234933.910615
 Mol. α(0) /au        :        152.153996


Wiberg/Mayer (AO) data.
largest (>0.10) Wiberg bond orders for each atom
          total WBO             WBO to atom ...
     1  C   3.978        C   11 1.408    C    2 1.407    H   19 0.960
     2  C   3.987        C    1 1.407    C    8 1.345    C    3 0.989
     3  C   3.948        O    4 1.770    N    5 1.087    C    2 0.989
     4  O   2.100        C    3 1.770    N    5 0.126
     5  N   3.597        C    6 1.093    C    3 1.087    C   17 1.046    O    4 0.126    O    7 0.124
     6  C   3.949        O    7 1.768    N    5 1.093    C    8 0.984
     7  O   2.100        C    6 1.768    N    5 0.124
     8  C   3.987        C    9 1.409    C    2 1.345    C    6 0.984
     9  C   3.978        C    8 1.409    C   10 1.408    H   20 0.960
    10  C   3.986        C    9 1.408    C   11 1.348    C   15 0.982
    11  C   3.986        C    1 1.408    C   10 1.348    C   12 0.982
    12  C   3.945        O   13 1.775    N   14 1.119    C   11 0.982
    13  O   2.098        C   12 1.775    N   14 0.138
    14  N   3.507        C   15 1.120    C   12 1.119    H   21 0.923    O   16 0.138    O   13 0.138
    15  C   3.945        O   16 1.775    N   14 1.120    C   10 0.982
    16  O   2.098        C   15 1.775    N   14 0.138
    17  C   3.947        C   18 1.905    N    5 1.046    H   22 0.954
    18  C   3.973        C   17 1.905    H   24 0.973    H   23 0.967
    19  H   0.991        C    1 0.960
    20  H   0.990        C    9 0.960
    21  H   0.954        N   14 0.923
    22  H   0.994        C   17 0.954
    23  H   0.993        C   18 0.967
    24  H   0.995        C   18 0.973

molecular dipole:
                 x           y           z       tot (Debye)
 q only:        0.313      -0.052       0.000
   full:        0.117      -0.027      -0.000       0.306
molecular quadrupole (traceless):
                xx          xy          yy          xz          yz          zz
 q only:        9.564       0.231     -15.841      -0.006       0.095       6.277
  q+dip:       12.395       0.993     -18.828      -0.008       0.108       6.433
   full:        9.474       1.129     -22.227      -0.017       0.151      12.754

           -------------------------------------------------
          |                Geometry Summary                 |
           -------------------------------------------------

      molecular mass/u    :      242.1904000
   center of mass at/Å    :        0.5497304       0.1058716       0.0019171
  moments of inertia/u·Å² :        0.4982689E+03   0.1975175E+04   0.2473444E+04
rotational constants/cm⁻¹ :        0.3383240E-01   0.8534753E-02   0.6815450E-02

 * 22 selected distances

     #   Z        #   Z                                     value/Å
     1   6 C      2   6 C                                 1.3857489
     3   6 C      4   8 O                                 1.2011238
     3   6 C      5   7 N                                 1.3989299
     5   7 N      6   6 C                                 1.3950097
     6   6 C      7   8 O                                 1.2011530
     2   6 C      8   6 C                                 1.3971514
     8   6 C      9   6 C                                 1.3855098
     9   6 C     10   6 C                                 1.3860147
     1   6 C     11   6 C                                 1.3860169
    10   6 C     11   6 C                                 1.3993291
    12   6 C     13   8 O                                 1.1991004
    12   6 C     14   7 N                                 1.3864272
    14   7 N     15   6 C                                 1.3863906
    15   6 C     16   8 O                                 1.1991374
     5   7 N     17   6 C                                 1.4029339 (max)
    17   6 C     18   6 C                                 1.3213414
     1   6 C     19   1 H                                 1.0783347
     9   6 C     20   1 H                                 1.0783278
    14   7 N     21   1 H                                 1.0103589 (min)
    17   6 C     22   1 H                                 1.0822132
    18   6 C     23   1 H                                 1.0744334
    18   6 C     24   1 H                                 1.0749188

 * 5 distinct bonds (by element types)

   Z      Z             #   av. dist./Å        max./Å        min./Å
   1 H    6 C           5     1.0776456     1.0822132     1.0744334
   6 C    6 C           7     1.3801589     1.3993291     1.3213414
   1 H    7 N           1     1.0103589     1.0103589     1.0103589
   6 C    7 N           5     1.3939383     1.4029339     1.3863906
   6 C    8 O           4     1.2001286     1.2011530     1.1991004


optimized geometry written to: xtbopt.xyz


           -------------------------------------------------
          | TOTAL ENERGY              -50.894023256724 Eh   |
          | GRADIENT NORM               0.000806830905 Eh/α |
          | HOMO-LUMO GAP               1.736346602450 eV   |
           -------------------------------------------------

------------------------------------------------------------------------
 * finished run on 2021/05/19 at 10:59:06.769     
------------------------------------------------------------------------
 total:
 * wall-time:     0 d,  0 h,  0 min,  0.325 sec
 *  cpu-time:     0 d,  0 h,  0 min,  0.325 sec
 * ratio c/w:     0.998 speedup
 SCF:
 * wall-time:     0 d,  0 h,  0 min,  0.047 sec
 *  cpu-time:     0 d,  0 h,  0 min,  0.047 sec
 * ratio c/w:     1.000 speedup
 ANC optimizer:
 * wall-time:     0 d,  0 h,  0 min,  0.253 sec
 *  cpu-time:     0 d,  0 h,  0 min,  0.253 sec
 * ratio c/w:     1.000 speedup

