      -----------------------------------------------------------      
     |                   =====================                   |     
     |                           x T B                           |     
     |                   =====================                   |     
     |                         S. Grimme                         |     
     |          Mulliken Center for Theoretical Chemistry        |     
     |                    University of Bonn                     |     
     |                Version 6.2 RC2 (SAW190805)                |     
      -----------------------------------------------------------      

   This program is distributed in the hope that it will be useful,
   but WITHOUT ANY WARRANTY; without even the implied warranty of
   MERCHANTABILITY or FITNESS FOR A PARTICULAR PURPOSE.
   
   FOR NON-COMMERCIAL, ACADEMIA USE ONLY.
   
   Cite this work as:
   * S. Grimme, C. Bannwarth, P. Shushkov, J. Chem. Theory Comput., 2017,
     13, 1989-2009. DOI: 10.1021/acs.jctc.7b00118
   * C. Bannwarth, S. Ehlert and S. Grimme., J. Chem. Theory Comput., 2019,
     15, 1652-1671. DOI: 10.1021/acs.jctc.8b01176
   * P. Pracht, E. Caldeweyher, S. Ehlert, S. Grimme, ChemRxiv, 2019, preprint.
     DOI: 10.26434/chemrxiv.8326202.v1
   
   for DFT-D4:
   * E. Caldeweyher, C. Bannwarth and S. Grimme, J. Chem. Phys., 2017,
     147, 034112. DOI: 10.1063/1.4993215
   * E. Caldeweyher, S. Ehlert, A. Hansen, H. Neugebauer, S. Spicher,
     C. Bannwarth and S. Grimme, J. Chem. Phys., 2019, 150, 154122.
     DOI: 10.1063/1.5090222
   
   for sTDA-xTB:
   * S. Grimme and C. Bannwarth, J. Chem. Phys., 2016, 145, 054103.
     DOI: 10.1063/1.4959605
   
   in the mass-spec context:
   * V. Asgeirsson, C. Bauer and S. Grimme, Chem. Sci., 2017, 8, 4879.
     DOI: 10.1039/c7sc00601b
   
   for metadynamics refer to:
   * S. Grimme, J. Chem. Theory Comput., 2019, 155, 2847-2862
     DOI: 10.1021/acs.jctc.9b00143
   
   with help from (in alphabetical order)
   C. Bannwarth, F. Bohle, G. Brandenburg, E. Caldeweyher, M. Checinski,
   S. Dohm, S. Ehlert, S. Ehrlich, F. März, H. Neugebauer, J. Pisarek,
   P. Pracht, P. Shushkov, and S. Spicher.
   
 * started run on 2021/05/19 at 10:59:09.676     

           -------------------------------------------------
          |                Calculation Setup                |
           -------------------------------------------------

          program call               : /ihome/ghutchison/geoffh/xtb/xtb 244.xyz -opt
          hostname                   : smp-n83
          coordinate file            : 244.xyz
          omp threads                :                     1
          number of atoms            :                    15
          number of electrons        :                    38
          charge                     :                     0
          spin                       :                   0.0
          first test random number   :      0.21897664461891


########################################################################
# WARNING! Please study the warnings concerning your input carefully
#  - the use of '-opt' is discouraged, please use '--opt' next time
########################################################################

           ------------------------------------------------- 
          |                 G F N 2 - x T B                 |
          | Geometry, Frequencies, Noncovalent interactions |
          |            JCTC 2019 parametrisation            |
           ------------------------------------------------- 
             KAB for C  - Si     :                1.0500
             KAB for H  - Pd     :                0.9500
             k(s)              :                1.8500
             k(p)              :                2.2300
             k(d)              :                2.2300
             k(f)              :                2.0000
             kEN (H0ij)        :               -2.0000
             D4 a1             :                0.5200
             D4 a2             :                5.0000
             D4 s6             :                1.0000
             D4 s8             :                2.7000
             D4 s9             :                5.0000
             alphaj            :                2.0000

  Z AO/shell   Hii/eV     exponent
  1     Wed Apr 25 08:07:45 CEST 2018   EN: 2.200 GM2: 0.406  GM3: 0.0800  RAES: 1.40
     1s    -10.707211    1.230000
  6     Wed Apr 25 08:07:45 CEST 2018   EN: 2.550 GM2: 0.538  GM3: 0.1500  RAES: 3.00
     2s    -13.970922    2.096432
     2p    -10.063292    1.800000
 16     Tue Apr 24 11:44:34 CEST 2018   EN: 2.580 GM2: 0.340  GM3:-0.0502  RAES: 3.10
     3s    -20.029654    1.981333
     3p    -11.377694    2.025643
     3d     -0.420282    1.702555

           ------------------------------------------------- 
          |        Self-Consistent Charge Iterations        |
           ------------------------------------------------- 

          ...................................................
          :                      SETUP                      :
          :.................................................:
          :  # basis functions                  42          :
          :  # atomic orbitals                  41          :
          :  # shells                           23          :
          :  # electrons                        38          :
          :  max. iterations                   250          :
          :  Hamiltonian                  GFN2-xTB          :
          :  restarted?                      false          :
          :  GBSA solvation                  false          :
          :  PC potential                    false          :
          :  electronic temp.          300.0000000     K    :
          :  accuracy                    1.0000000          :
          :  -> integral cutoff          0.2500000E+02      :
          :  -> integral neglect         0.1000000E-07      :
          :  -> SCF convergence          0.1000000E-05 Eh   :
          :  -> wf. convergence          0.1000000E-03 e    :
          :  Broyden damping             0.4000000          :
          ...................................................

 iter      E             dE          RMSdq      gap      omega  full diag
   1    -20.4220528 -0.204221E+02  0.370E+00    3.86       0.0  T
   2    -20.4419301 -0.198773E-01  0.208E+00    3.91       1.0  T
   3    -20.4389373  0.299276E-02  0.962E-01    3.89       1.0  T
   4    -20.4425623 -0.362500E-02  0.481E-01    3.86       1.0  T
   5    -20.4442457 -0.168332E-02  0.136E-01    3.88       1.0  T
   6    -20.4442717 -0.260896E-04  0.723E-02    3.88       1.0  T
   7    -20.4443268 -0.550401E-04  0.223E-02    3.88       1.2  T
   8    -20.4443284 -0.163148E-05  0.999E-03    3.88       2.6  T
   9    -20.4443287 -0.250443E-06  0.344E-03    3.88       7.5  T
  10    -20.4443287 -0.374043E-07  0.129E-03    3.88      20.0  T
  11    -20.4443287 -0.306271E-08  0.439E-04    3.88      58.8  T
  12    -20.4443287 -0.593232E-10  0.114E-04    3.88     226.6  T

   *** convergence criteria satisfied after 12 iterations ***

         #    Occupation            Energy/Eh            Energy/eV
      -------------------------------------------------------------
         1        2.0000           -0.7256212             -19.7452
       ...           ...                  ...                  ...
        13        2.0000           -0.4635834             -12.6147
        14        2.0000           -0.4606961             -12.5362
        15        2.0000           -0.4527243             -12.3193
        16        2.0000           -0.4362340             -11.8705
        17        2.0000           -0.4325261             -11.7696
        18        2.0000           -0.3893552             -10.5949
        19        2.0000           -0.3819169             -10.3925 (HOMO)
        20                         -0.2394187              -6.5149 (LUMO)
        21                         -0.1930596              -5.2534
        22                         -0.1710097              -4.6534
        23                         -0.1079099              -2.9364
        24                          0.0039531               0.1076
       ...                                ...                  ...
        41                          0.6747664              18.3613
      -------------------------------------------------------------
                  HL-Gap            0.1424982 Eh            3.8776 eV
             Fermi-level           -0.3106678 Eh           -8.4537 eV

 SCC (total)                   0 d,  0 h,  0 min,  0.017 sec
 SCC setup                      ...        0 min,  0.000 sec (  1.301%)
 Dispersion                     ...        0 min,  0.000 sec (  0.896%)
 integral evaluation            ...        0 min,  0.004 sec ( 21.547%)
 zeroth order Hamiltonian       ...        0 min,  0.000 sec (  0.498%)
 iterations                     ...        0 min,  0.007 sec ( 41.564%)
 molecular gradient             ...        0 min,  0.005 sec ( 32.188%)
 printout                       ...        0 min,  0.000 sec (  1.649%)

         :::::::::::::::::::::::::::::::::::::::::::::::::::::
         ::                     SUMMARY                     ::
         :::::::::::::::::::::::::::::::::::::::::::::::::::::
         :: total energy             -20.151503676539 Eh    ::
         :: gradient norm              0.040706082798 Eh/a0 ::
         :: HOMO-LUMO gap              3.877572794815 eV    ::
         ::.................................................::
         :: SCC energy               -20.444328711087 Eh    ::
         :: -> isotropic ES            0.001883412512 Eh    ::
         :: -> anisotropic ES          0.002896306708 Eh    ::
         :: -> anisotropic XC          0.011559142346 Eh    ::
         :: -> dispersion             -0.011408182939 Eh    ::
         :: repulsion energy           0.292798720988 Eh    ::
         :: add. restraining           0.000000000000 Eh    ::
         :::::::::::::::::::::::::::::::::::::::::::::::::::::

      ----------------------------------------------------------- 
     |                   =====================                   |
     |                        A N C O P T                        |
     |                   =====================                   |
     |               Approximate Normal Coordinate               |
     |                Rational Function Optimizer                |
      ----------------------------------------------------------- 

          ...................................................
          :                      SETUP                      :
          :.................................................:
          :   optimization level            normal          :
          :   max. optcycles                   200          :
          :   ANC micro-cycles                  20          :
          :   degrees of freedom                39          :
          :.................................................:
          :   RF solver                   davidson          :
          :   input Hessian                  false          :
          :   write xtbopt.log                true          :
          :   linear?                        false          :
          :   energy convergence         0.5000000E-05 Eh   :
          :   grad. convergence          0.1000000E-02 Eh/α :
          :   maximium RF displ.         2.0000000          :
          :   Hlow (freq-cutoff)         0.5000000E-02      :
          :   Hmax (freq-cutoff)         5.0000000          :
          :   S6 in model hess.         20.0000000          :
          ...................................................

generating ANC from model Hessian ...
Using Lindh-Hessian (1995)
 Shifting diagonal of input Hessian by   1.839026706089146E-003
 Lowest  eigenvalues of input Hessian
   -0.000000   -0.000000   -0.000000    0.000000    0.000000    0.000000
    0.005000    0.006330    0.009402    0.014164    0.021016    0.022998
    0.038246    0.045465    0.050752    0.054751    0.066037    0.067849
 Highest eigenvalues
    1.220501    1.353752    1.498232    1.638772    1.756083    1.811948
 

........................................................................
.............................. CYCLE    1 ..............................
........................................................................
   1    -20.4443287 -0.204443E+02  0.251E-05    3.88       0.0  T
   2    -20.4443287 -0.305533E-12  0.129E-05    3.88    1999.2  T
   3    -20.4443287 -0.888178E-13  0.122E-05    3.88    2125.0  T
     SCC iter.                  ...        0 min,  0.002 sec
     gradient                   ...        0 min,  0.005 sec
 * total energy  :   -20.1515037 Eh     change        0.7704983E-09 Eh
   gradient norm :     0.0407069 Eh/α   predicted     0.0000000E+00 (-100.00%)
   displ. norm   :     0.1540300 α      lambda       -0.2471780E-02
   maximum displ.:     0.0748825 α      in ANC's #2, #9, #1, ...

........................................................................
.............................. CYCLE    2 ..............................
........................................................................
   1    -20.4615392 -0.204615E+02  0.175E-01    3.96       0.0  T
   2    -20.4615639 -0.246758E-04  0.780E-02    3.96       1.0  T
   3    -20.4615613  0.254739E-05  0.288E-02    3.96       1.0  T
   4    -20.4615660 -0.466973E-05  0.167E-02    3.96       1.5  T
   5    -20.4615680 -0.198319E-05  0.614E-03    3.96       4.2  T
   6    -20.4615680  0.579940E-08  0.186E-03    3.96      13.9  T
   7    -20.4615680 -0.384277E-07  0.524E-04    3.96      49.2  T
     SCC iter.                  ...        0 min,  0.003 sec
     gradient                   ...        0 min,  0.005 sec
 * total energy  :   -20.1530367 Eh     change       -0.1533002E-02 Eh
   gradient norm :     0.0140073 Eh/α   predicted    -0.1265212E-02 ( -17.47%)
   displ. norm   :     0.0765384 α      lambda       -0.2657095E-03
   maximum displ.:     0.0515370 α      in ANC's #2, #1, #4, ...

........................................................................
.............................. CYCLE    3 ..............................
........................................................................
   1    -20.4658403 -0.204658E+02  0.896E-02    3.98       0.0  T
   2    -20.4658477 -0.743245E-05  0.399E-02    3.98       1.0  T
   3    -20.4658471  0.605423E-06  0.161E-02    3.98       1.6  T
   4    -20.4658484 -0.133321E-05  0.849E-03    3.98       3.0  T
   5    -20.4658489 -0.509850E-06  0.304E-03    3.98       8.5  T
   6    -20.4658489 -0.585995E-09  0.812E-04    3.98      31.8  T
   7    -20.4658490 -0.663407E-08  0.300E-04    3.98      86.1  T
     SCC iter.                  ...        0 min,  0.004 sec
     gradient                   ...        0 min,  0.005 sec
 * total energy  :   -20.1531999 Eh     change       -0.1632621E-03 Eh
   gradient norm :     0.0045734 Eh/α   predicted    -0.1336346E-03 ( -18.15%)
   displ. norm   :     0.0654797 α      lambda       -0.6257952E-04
   maximum displ.:     0.0448319 α      in ANC's #1, #2, #3, ...

........................................................................
.............................. CYCLE    4 ..............................
........................................................................
   1    -20.4658651 -0.204659E+02  0.685E-02    3.98       0.0  T
   2    -20.4658674 -0.229528E-05  0.335E-02    3.98       1.0  T
   3    -20.4658668  0.632465E-06  0.118E-02    3.98       2.2  T
   4    -20.4658677 -0.963877E-06  0.564E-03    3.98       4.6  T
   5    -20.4658679 -0.190124E-06  0.206E-03    3.98      12.5  T
   6    -20.4658679 -0.217110E-08  0.683E-04    3.98      37.8  T
     SCC iter.                  ...        0 min,  0.003 sec
     gradient                   ...        0 min,  0.005 sec
 * total energy  :   -20.1532440 Eh     change       -0.4403001E-04 Eh
   gradient norm :     0.0018982 Eh/α   predicted    -0.3142486E-04 ( -28.63%)
   displ. norm   :     0.0864364 α      lambda       -0.2725597E-04
   maximum displ.:     0.0676910 α      in ANC's #1, #2, #3, ...

........................................................................
.............................. CYCLE    5 ..............................
........................................................................
   1    -20.4646424 -0.204646E+02  0.767E-02    3.98       0.0  T
   2    -20.4646444 -0.200558E-05  0.390E-02    3.98       1.0  T
   3    -20.4646433  0.104480E-05  0.132E-02    3.98       1.9  T
   4    -20.4646448 -0.146644E-05  0.579E-03    3.98       4.5  T
   5    -20.4646449 -0.160582E-06  0.215E-03    3.98      12.0  T
   6    -20.4646450 -0.341392E-08  0.846E-04    3.98      30.5  T
   7    -20.4646450 -0.760545E-08  0.307E-04    3.98      84.2  T
     SCC iter.                  ...        0 min,  0.003 sec
     gradient                   ...        0 min,  0.005 sec
 * total energy  :   -20.1532630 Eh     change       -0.1902066E-04 Eh
   gradient norm :     0.0018051 Eh/α   predicted    -0.1367249E-04 ( -28.12%)
   displ. norm   :     0.0221243 α      lambda       -0.5703694E-05
   maximum displ.:     0.0197550 α      in ANC's #1, #2, #3, ...

........................................................................
.............................. CYCLE    6 ..............................
........................................................................
   1    -20.4647445 -0.204647E+02  0.201E-02    3.98       0.0  T
   2    -20.4647446 -0.100504E-06  0.104E-02    3.98       2.5  T
   3    -20.4647446 -0.736193E-08  0.212E-03    3.98      12.2  T
   4    -20.4647446 -0.583753E-08  0.116E-03    3.98      22.3  T
   5    -20.4647446 -0.373104E-08  0.453E-04    3.98      57.0  T
   6    -20.4647446 -0.189073E-08  0.104E-04    3.98     249.2  T
     SCC iter.                  ...        0 min,  0.003 sec
     gradient                   ...        0 min,  0.005 sec
 * total energy  :   -20.1532695 Eh     change       -0.6543613E-05 Eh
   gradient norm :     0.0009330 Eh/α   predicted    -0.2852178E-05 ( -56.41%)
   displ. norm   :     0.0452126 α      lambda       -0.8658149E-05
   maximum displ.:     0.0363643 α      in ANC's #1, #2, #3, ...

........................................................................
.............................. CYCLE    7 ..............................
........................................................................
   1    -20.4651257 -0.204651E+02  0.557E-02    3.98       0.0  T
   2    -20.4651265 -0.832052E-06  0.274E-02    3.98       1.0  T
   3    -20.4651265  0.102315E-07  0.597E-03    3.98       4.3  T
   4    -20.4651266 -0.117890E-06  0.371E-03    3.98       7.0  T
   5    -20.4651267 -0.688716E-07  0.124E-03    3.98      20.8  T
   6    -20.4651267 -0.705177E-08  0.365E-04    3.98      70.8  T
   7    -20.4651267 -0.110392E-08  0.146E-04    3.98     177.2  T
     SCC iter.                  ...        0 min,  0.004 sec
     gradient                   ...        0 min,  0.005 sec
 * total energy  :   -20.1532772 Eh     change       -0.7637771E-05 Eh
   gradient norm :     0.0012971 Eh/α   predicted    -0.4332328E-05 ( -43.28%)
   displ. norm   :     0.0393774 α      lambda       -0.5303061E-05
   maximum displ.:     0.0351815 α      in ANC's #1, #2, #3, ...

........................................................................
.............................. CYCLE    8 ..............................
........................................................................
   1    -20.4652101 -0.204652E+02  0.314E-02    3.98       0.0  T
   2    -20.4652103 -0.143269E-06  0.166E-02    3.98       1.6  T
   3    -20.4652103 -0.316135E-07  0.270E-03    3.98       9.6  T
   4    -20.4652103  0.132942E-07  0.123E-03    3.98      20.9  T
   5    -20.4652103 -0.184365E-07  0.210E-04    3.98     122.9  T
   6    -20.4652103 -0.197211E-09  0.122E-04    3.98     212.3  T
     SCC iter.                  ...        0 min,  0.003 sec
     gradient                   ...        0 min,  0.005 sec
 * total energy  :   -20.1532843 Eh     change       -0.7166766E-05 Eh
   gradient norm :     0.0012242 Eh/α   predicted    -0.2654269E-05 ( -62.96%)
   displ. norm   :     0.0433622 α      lambda       -0.6141928E-05
   maximum displ.:     0.0387110 α      in ANC's #1, #2, #3, ...

........................................................................
.............................. CYCLE    9 ..............................
........................................................................
   1    -20.4651237 -0.204651E+02  0.362E-02    3.98       0.0  T
   2    -20.4651239 -0.211897E-06  0.190E-02    3.98       1.4  T
   3    -20.4651240 -0.250925E-07  0.342E-03    3.98       7.5  T
   4    -20.4651240  0.872535E-08  0.207E-03    3.98      12.4  T
   5    -20.4651240 -0.342825E-07  0.544E-04    3.98      47.5  T
   6    -20.4651240 -0.235378E-08  0.175E-04    3.98     147.5  T
     SCC iter.                  ...        0 min,  0.003 sec
     gradient                   ...        0 min,  0.005 sec
 * total energy  :   -20.1532926 Eh     change       -0.8231970E-05 Eh
   gradient norm :     0.0005367 Eh/α   predicted    -0.3072869E-05 ( -62.67%)
   displ. norm   :     0.0486948 α      lambda       -0.5806304E-05
   maximum displ.:     0.0432266 α      in ANC's #1, #2, #6, ...

........................................................................
.............................. CYCLE   10 ..............................
........................................................................
   1    -20.4650064 -0.204650E+02  0.455E-02    3.98       0.0  T
   2    -20.4650067 -0.373807E-06  0.233E-02    3.98       1.1  T
   3    -20.4650068 -0.301918E-07  0.444E-03    3.98       5.8  T
   4    -20.4650068 -0.442163E-08  0.285E-03    3.98       9.1  T
   5    -20.4650068 -0.595588E-07  0.566E-04    3.98      45.6  T
   6    -20.4650068 -0.201386E-08  0.226E-04    3.98     114.4  T
     SCC iter.                  ...        0 min,  0.003 sec
     gradient                   ...        0 min,  0.005 sec
 * total energy  :   -20.1533004 Eh     change       -0.7819422E-05 Eh
   gradient norm :     0.0004380 Eh/α   predicted    -0.2906312E-05 ( -62.83%)
   displ. norm   :     0.0465396 α      lambda       -0.4899480E-05
   maximum displ.:     0.0408152 α      in ANC's #1, #2, #6, ...

........................................................................
.............................. CYCLE   11 ..............................
........................................................................
   1    -20.4649441 -0.204649E+02  0.459E-02    3.98       0.0  T
   2    -20.4649445 -0.375716E-06  0.234E-02    3.98       1.1  T
   3    -20.4649445 -0.450793E-07  0.435E-03    3.98       5.9  T
   4    -20.4649445  0.186821E-07  0.279E-03    3.98       9.2  T
   5    -20.4649446 -0.664426E-07  0.474E-04    3.98      54.5  T
   6    -20.4649446 -0.131164E-08  0.209E-04    3.98     123.4  T
     SCC iter.                  ...        0 min,  0.003 sec
     gradient                   ...        0 min,  0.005 sec
 * total energy  :   -20.1533071 Eh     change       -0.6756014E-05 Eh
   gradient norm :     0.0006494 Eh/α   predicted    -0.2453409E-05 ( -63.69%)
   displ. norm   :     0.0418775 α      lambda       -0.4298506E-05
   maximum displ.:     0.0372942 α      in ANC's #1, #2, #3, ...

........................................................................
.............................. CYCLE   12 ..............................
........................................................................
   1    -20.4649415 -0.204649E+02  0.394E-02    3.98       0.0  T
   2    -20.4649418 -0.266861E-06  0.202E-02    3.98       1.3  T
   3    -20.4649418 -0.323538E-07  0.371E-03    3.98       7.0  T
   4    -20.4649418  0.180422E-07  0.244E-03    3.98      10.6  T
   5    -20.4649418 -0.532689E-07  0.329E-04    3.98      78.6  T
   6    -20.4649418 -0.593356E-09  0.169E-04    3.98     152.5  T
     SCC iter.                  ...        0 min,  0.003 sec
     gradient                   ...        0 min,  0.005 sec
 * total energy  :   -20.1533133 Eh     change       -0.6137863E-05 Eh
   gradient norm :     0.0006012 Eh/α   predicted    -0.2151830E-05 ( -64.94%)
   displ. norm   :     0.0380339 α      lambda       -0.3946268E-05
   maximum displ.:     0.0344977 α      in ANC's #1, #2, #3, ...

........................................................................
.............................. CYCLE   13 ..............................
........................................................................
   1    -20.4649791 -0.204650E+02  0.349E-02    3.98       0.0  T
   2    -20.4649793 -0.201626E-06  0.180E-02    3.98       1.4  T
   3    -20.4649793 -0.363655E-07  0.312E-03    3.98       8.3  T
   4    -20.4649793  0.283759E-07  0.197E-03    3.98      13.1  T
   5    -20.4649794 -0.422095E-07  0.220E-04    3.98     117.1  T
   6    -20.4649794 -0.215582E-09  0.128E-04    3.98     201.4  T
     SCC iter.                  ...        0 min,  0.003 sec
     gradient                   ...        0 min,  0.005 sec
 * total energy  :   -20.1533189 Eh     change       -0.5646845E-05 Eh
   gradient norm :     0.0004197 Eh/α   predicted    -0.1975885E-05 ( -65.01%)
   displ. norm   :     0.0361249 α      lambda       -0.3721158E-05
   maximum displ.:     0.0336027 α      in ANC's #1, #2, #3, ...

........................................................................
.............................. CYCLE   14 ..............................
........................................................................
   1    -20.4650349 -0.204650E+02  0.308E-02    3.98       0.0  T
   2    -20.4650350 -0.149991E-06  0.160E-02    3.98       1.6  T
   3    -20.4650350 -0.320656E-07  0.268E-03    3.98       9.6  T
   4    -20.4650350  0.180389E-07  0.140E-03    3.98      18.4  T
   5    -20.4650350 -0.230633E-07  0.178E-04    3.98     145.1  T
   6    -20.4650350 -0.189299E-09  0.911E-05    3.98     283.4  T
     SCC iter.                  ...        0 min,  0.003 sec
     gradient                   ...        0 min,  0.006 sec
 * total energy  :   -20.1533242 Eh     change       -0.5243372E-05 Eh
   gradient norm :     0.0002340 Eh/α   predicted    -0.1860121E-05 ( -64.52%)
   displ. norm   :     0.0332854 α      lambda       -0.3200737E-05
   maximum displ.:     0.0313748 α      in ANC's #1, #2, #3, ...

........................................................................
.............................. CYCLE   15 ..............................
........................................................................
   1    -20.4650891 -0.204651E+02  0.282E-02    3.98       0.0  T
   2    -20.4650892 -0.124767E-06  0.146E-02    3.98       1.8  T
   3    -20.4650893 -0.267741E-07  0.245E-03    3.98      10.5  T
   4    -20.4650892  0.180418E-07  0.140E-03    3.98      18.5  T
   5    -20.4650893 -0.226609E-07  0.140E-04    3.98     184.5  T
   6    -20.4650893 -0.777725E-10  0.786E-05    3.98     328.4  T
     SCC iter.                  ...        0 min,  0.003 sec
     gradient                   ...        0 min,  0.005 sec
 * total energy  :   -20.1533287 Eh     change       -0.4532553E-05 Eh
   gradient norm :     0.0002129 Eh/α   predicted    -0.1601742E-05 ( -64.66%)
   displ. norm   :     0.0294110 α      lambda       -0.2637410E-05
   maximum displ.:     0.0282751 α      in ANC's #1, #2, #3, ...

   *** GEOMETRY OPTIMIZATION CONVERGED AFTER 15 ITERATIONS ***

------------------------------------------------------------------------
 total energy gain   :        -0.0018250 Eh       -1.1452 kcal/mol
 total RMSD          :         0.1532723 a0        0.0811 Å
 total power (kW/mol):        -0.3194411 (step)  -24.6477 (real)
------------------------------------------------------------------------

 ANCopt (total)                0 d,  0 h,  0 min,  0.194 sec
 optimizer setup                ...        0 min,  0.000 sec (  0.058%)
 model hessian                  ...        0 min,  0.003 sec (  1.366%)
 ANC generation                 ...        0 min,  0.000 sec (  0.207%)
 coordinate transformation      ...        0 min,  0.000 sec (  0.101%)
 single point calculation       ...        0 min,  0.186 sec ( 95.909%)
 optimization log               ...        0 min,  0.001 sec (  0.546%)
 hessian update                 ...        0 min,  0.000 sec (  0.082%)
 rational function              ...        0 min,  0.002 sec (  1.243%)

================
 final structure:
================
$coord
    0.12660400433017    2.25399330006559   -0.11637622084331      C 
    2.53037405531244    1.35233040546558   -0.04763941178428      C 
    4.85372321585179    2.96523482606153   -0.02321266320057      C 
    5.77604165132362    3.40118118718868    2.68112567893261      C 
    2.57444456782237   -1.32886863067805    0.08275527214916      C 
    0.23514240067691   -2.36818639749513    0.09964026891269      C 
   -2.10069619508757   -0.11259226085722   -0.03527314457383      S 
   -0.48299800353316    4.18336545407717   -0.21839694134121      H 
    4.44342036609958    4.78280390517651   -0.90883210728579      H 
    6.34041185399122    2.03498816106713   -1.11161749000747      H 
    4.33114590699274    4.36587612779731    3.77978016207942      H 
    7.47859784234052    4.55234961063322    2.68080747146417      H 
    6.19542246354841    1.60898712749221    3.59600301283143      H 
    4.29105575808751   -2.41553567079262    0.14909893490787      H 
   -0.27905955526646   -4.32563158639435    0.17808818404394      H 
$end
           -------------------------------------------------
          |                Final Singlepoint                |
           -------------------------------------------------

          ...................................................
          :                      SETUP                      :
          :.................................................:
          :  # basis functions                  42          :
          :  # atomic orbitals                  41          :
          :  # shells                           23          :
          :  # electrons                        38          :
          :  max. iterations                   250          :
          :  Hamiltonian                  GFN2-xTB          :
          :  restarted?                      false          :
          :  GBSA solvation                  false          :
          :  PC potential                    false          :
          :  electronic temp.          300.0000000     K    :
          :  accuracy                    1.0000000          :
          :  -> integral cutoff          0.2500000E+02      :
          :  -> integral neglect         0.1000000E-07      :
          :  -> SCF convergence          0.1000000E-05 Eh   :
          :  -> wf. convergence          0.1000000E-03 e    :
          :  Broyden damping             0.4000000          :
          ...................................................

 iter      E             dE          RMSdq      gap      omega  full diag
   1    -20.4650893 -0.204651E+02  0.417E-05    3.98       0.0  T
   2    -20.4650893 -0.537170E-11  0.287E-05    3.98     900.8  T
   3    -20.4650893 -0.113651E-10  0.117E-05    3.98    2209.2  T

   *** convergence criteria satisfied after 3 iterations ***

         #    Occupation            Energy/Eh            Energy/eV
      -------------------------------------------------------------
         1        2.0000           -0.7245204             -19.7152
       ...           ...                  ...                  ...
        13        2.0000           -0.4654412             -12.6653
        14        2.0000           -0.4604783             -12.5303
        15        2.0000           -0.4532389             -12.3333
        16        2.0000           -0.4357757             -11.8581
        17        2.0000           -0.4345869             -11.8257
        18        2.0000           -0.3904400             -10.6244
        19        2.0000           -0.3840294             -10.4500 (HOMO)
        20                         -0.2376200              -6.4660 (LUMO)
        21                         -0.1954526              -5.3185
        22                         -0.1643316              -4.4717
        23                         -0.1079411              -2.9372
        24                          0.0057575               0.1567
       ...                                ...                  ...
        41                          0.6994182              19.0321
      -------------------------------------------------------------
                  HL-Gap            0.1464094 Eh            3.9840 eV
             Fermi-level           -0.3108247 Eh           -8.4580 eV

 SCC (total)                   0 d,  0 h,  0 min,  0.012 sec
 SCC setup                      ...        0 min,  0.000 sec (  1.237%)
 Dispersion                     ...        0 min,  0.000 sec (  0.705%)
 integral evaluation            ...        0 min,  0.003 sec ( 28.493%)
 zeroth order Hamiltonian       ...        0 min,  0.000 sec (  0.600%)
 iterations                     ...        0 min,  0.002 sec ( 18.058%)
 molecular gradient             ...        0 min,  0.006 sec ( 48.294%)
 printout                       ...        0 min,  0.000 sec (  2.173%)

         :::::::::::::::::::::::::::::::::::::::::::::::::::::
         ::                     SUMMARY                     ::
         :::::::::::::::::::::::::::::::::::::::::::::::::::::
         :: total energy             -20.153328707409 Eh    ::
         :: gradient norm              0.000212868365 Eh/a0 ::
         :: HOMO-LUMO gap              3.984002285340 eV    ::
         ::.................................................::
         :: SCC energy               -20.465089255161 Eh    ::
         :: -> isotropic ES            0.001975232375 Eh    ::
         :: -> anisotropic ES          0.002665689037 Eh    ::
         :: -> anisotropic XC          0.011330239449 Eh    ::
         :: -> dispersion             -0.011489232501 Eh    ::
         :: repulsion energy           0.311734249367 Eh    ::
         :: add. restraining           0.000000000000 Eh    ::
         :::::::::::::::::::::::::::::::::::::::::::::::::::::

           -------------------------------------------------
          |                Property Printout                |
           -------------------------------------------------

    * Orbital Energies and Occupations

         #    Occupation            Energy/Eh            Energy/eV
      -------------------------------------------------------------
         1        2.0000           -0.7245204             -19.7152
       ...           ...                  ...                  ...
         7        2.0000           -0.5452065             -14.8358
         8        2.0000           -0.5254558             -14.2984
         9        2.0000           -0.5058902             -13.7660
        10        2.0000           -0.4955204             -13.4838
        11        2.0000           -0.4776217             -12.9967
        12        2.0000           -0.4675049             -12.7215
        13        2.0000           -0.4654412             -12.6653
        14        2.0000           -0.4604783             -12.5303
        15        2.0000           -0.4532389             -12.3333
        16        2.0000           -0.4357757             -11.8581
        17        2.0000           -0.4345869             -11.8257
        18        2.0000           -0.3904400             -10.6244
        19        2.0000           -0.3840294             -10.4500 (HOMO)
        20                         -0.2376200              -6.4660 (LUMO)
        21                         -0.1954526              -5.3185
        22                         -0.1643316              -4.4717
        23                         -0.1079411              -2.9372
        24                          0.0057575               0.1567
        25                          0.0363289               0.9886
        26                          0.0409341               1.1139
        27                          0.1092252               2.9722
        28                          0.1311012               3.5674
        29                          0.1429685               3.8904
        30                          0.1545584               4.2057
       ...                                ...                  ...
        41                          0.6994182              19.0321
      -------------------------------------------------------------
                  HL-Gap            0.1464094 Eh            3.9840 eV
             Fermi-level           -0.3108247 Eh           -8.4580 eV

     #   Z        covCN         q      C6AA      α(0)
     1   6 C      2.948    -0.030    28.756     8.795
     2   6 C      3.157    -0.002    27.760     8.615
     3   6 C      3.804    -0.053    21.523     6.605
     4   6 C      3.754    -0.098    22.433     6.754
     5   6 C      3.127    -0.052    29.077     8.829
     6   6 C      2.937    -0.021    28.542     8.762
     7  16 S      2.301    -0.040   142.717    20.107
     8   1 H      0.926     0.039     2.467     2.456
     9   1 H      0.924     0.034     2.530     2.487
    10   1 H      0.924     0.039     2.459     2.452
    11   1 H      0.925     0.036     2.501     2.473
    12   1 H      0.925     0.036     2.501     2.473
    13   1 H      0.925     0.038     2.477     2.461
    14   1 H      0.926     0.034     2.528     2.486
    15   1 H      0.926     0.040     2.445     2.445

 Mol. C6AA /au·bohr⁶  :       3050.077813
 Mol. C8AA /au·bohr⁸  :      85476.154781
 Mol. α(0) /au        :         88.200927


Wiberg/Mayer (AO) data.
largest (>0.10) Wiberg bond orders for each atom
          total WBO             WBO to atom ...
     1  C   3.943        C    2 1.608    S    7 1.184    H    8 0.971    C    6 0.118
     2  C   3.986        C    1 1.608    C    5 1.240    C    3 1.009
     3  C   3.998        C    2 1.009    C    4 1.002    H    9 0.976    H   10 0.972
     4  C   3.996        C    3 1.002    H   11 0.989    H   13 0.988    H   12 0.986
     5  C   3.987        C    6 1.642    C    2 1.240    H   14 0.965
     6  C   3.950        C    5 1.642    S    7 1.190    H   15 0.972    C    1 0.118
     7  S   2.623        C    6 1.190    C    1 1.184
     8  H   0.999        C    1 0.971
     9  H   0.999        C    3 0.976
    10  H   0.998        C    3 0.972
    11  H   0.999        C    4 0.989
    12  H   0.998        C    4 0.986
    13  H   0.999        C    4 0.988
    14  H   0.999        C    5 0.965
    15  H   0.998        C    6 0.972

molecular dipole:
                 x           y           z       tot (Debye)
 q only:        0.292       0.093       0.035
   full:        0.550       0.090       0.039       1.421
molecular quadrupole (traceless):
                xx          xy          yy          xz          yz          zz
 q only:        0.599       0.911       0.822       0.360       0.100      -1.421
  q+dip:        0.292       0.227       3.158       0.040      -0.218      -3.450
   full:       -0.427       0.457       2.719       0.178      -0.085      -2.292

           -------------------------------------------------
          |                Geometry Summary                 |
           -------------------------------------------------

      molecular mass/u    :      112.1892000
   center of mass at/Å    :        0.7478910       0.4088149       0.1850099
  moments of inertia/u·Å² :        0.9185411E+02   0.3546441E+03   0.4067423E+03
rotational constants/cm⁻¹ :        0.1835262E+00   0.4753394E-01   0.4144549E-01

 * 15 selected distances

     #   Z        #   Z                                     value/Å
     1   6 C      2   6 C                                 1.3590516
     2   6 C      3   6 C                                 1.4967401
     3   6 C      4   6 C                                 1.5295115
     2   6 C      5   6 C                                 1.4206979
     5   6 C      6   6 C                                 1.3546112
     1   6 C      7  16 S                                 1.7202877 (max)
     6   6 C      7  16 S                                 1.7197893
     1   6 C      8   1 H                                 1.0720901
     3   6 C      9   1 H                                 1.0917259
     3   6 C     10   1 H                                 1.0922387
     4   6 C     11   1 H                                 1.0877652
     4   6 C     12   1 H                                 1.0875702
     4   6 C     13   1 H                                 1.0876930
     5   6 C     14   1 H                                 1.0756757
     6   6 C     15   1 H                                 1.0717831 (min)

 * 3 distinct bonds (by element types)

   Z      Z             #   av. dist./Å        max./Å        min./Å
   1 H    6 C           8     1.0833177     1.0922387     1.0717831
   6 C    6 C           5     1.4321225     1.5295115     1.3546112
   6 C   16 S           2     1.7200385     1.7202877     1.7197893


optimized geometry written to: xtbopt.xyz


           -------------------------------------------------
          | TOTAL ENERGY              -20.153328707409 Eh   |
          | GRADIENT NORM               0.000212868365 Eh/α |
          | HOMO-LUMO GAP               3.984002285340 eV   |
           -------------------------------------------------

------------------------------------------------------------------------
 * finished run on 2021/05/19 at 10:59:09.923     
------------------------------------------------------------------------
 total:
 * wall-time:     0 d,  0 h,  0 min,  0.247 sec
 *  cpu-time:     0 d,  0 h,  0 min,  0.238 sec
 * ratio c/w:     0.964 speedup
 SCF:
 * wall-time:     0 d,  0 h,  0 min,  0.017 sec
 *  cpu-time:     0 d,  0 h,  0 min,  0.017 sec
 * ratio c/w:     1.000 speedup
 ANC optimizer:
 * wall-time:     0 d,  0 h,  0 min,  0.207 sec
 *  cpu-time:     0 d,  0 h,  0 min,  0.206 sec
 * ratio c/w:     0.999 speedup

