      -----------------------------------------------------------      
     |                   =====================                   |     
     |                           x T B                           |     
     |                   =====================                   |     
     |                         S. Grimme                         |     
     |          Mulliken Center for Theoretical Chemistry        |     
     |                    University of Bonn                     |     
     |                Version 6.2 RC2 (SAW190805)                |     
      -----------------------------------------------------------      

   This program is distributed in the hope that it will be useful,
   but WITHOUT ANY WARRANTY; without even the implied warranty of
   MERCHANTABILITY or FITNESS FOR A PARTICULAR PURPOSE.
   
   FOR NON-COMMERCIAL, ACADEMIA USE ONLY.
   
   Cite this work as:
   * S. Grimme, C. Bannwarth, P. Shushkov, J. Chem. Theory Comput., 2017,
     13, 1989-2009. DOI: 10.1021/acs.jctc.7b00118
   * C. Bannwarth, S. Ehlert and S. Grimme., J. Chem. Theory Comput., 2019,
     15, 1652-1671. DOI: 10.1021/acs.jctc.8b01176
   * P. Pracht, E. Caldeweyher, S. Ehlert, S. Grimme, ChemRxiv, 2019, preprint.
     DOI: 10.26434/chemrxiv.8326202.v1
   
   for DFT-D4:
   * E. Caldeweyher, C. Bannwarth and S. Grimme, J. Chem. Phys., 2017,
     147, 034112. DOI: 10.1063/1.4993215
   * E. Caldeweyher, S. Ehlert, A. Hansen, H. Neugebauer, S. Spicher,
     C. Bannwarth and S. Grimme, J. Chem. Phys., 2019, 150, 154122.
     DOI: 10.1063/1.5090222
   
   for sTDA-xTB:
   * S. Grimme and C. Bannwarth, J. Chem. Phys., 2016, 145, 054103.
     DOI: 10.1063/1.4959605
   
   in the mass-spec context:
   * V. Asgeirsson, C. Bauer and S. Grimme, Chem. Sci., 2017, 8, 4879.
     DOI: 10.1039/c7sc00601b
   
   for metadynamics refer to:
   * S. Grimme, J. Chem. Theory Comput., 2019, 155, 2847-2862
     DOI: 10.1021/acs.jctc.9b00143
   
   with help from (in alphabetical order)
   C. Bannwarth, F. Bohle, G. Brandenburg, E. Caldeweyher, M. Checinski,
   S. Dohm, S. Ehlert, S. Ehrlich, F. März, H. Neugebauer, J. Pisarek,
   P. Pracht, P. Shushkov, and S. Spicher.
   
 * started run on 2021/05/19 at 10:59:09.961     

           -------------------------------------------------
          |                Calculation Setup                |
           -------------------------------------------------

          program call               : /ihome/ghutchison/geoffh/xtb/xtb 245.xyz -opt
          hostname                   : smp-n83
          coordinate file            : 245.xyz
          omp threads                :                     1
          number of atoms            :                    30
          number of electrons        :                    94
          charge                     :                     0
          spin                       :                   0.0
          first test random number   :      0.18811499233813


########################################################################
# WARNING! Please study the warnings concerning your input carefully
#  - the use of '-opt' is discouraged, please use '--opt' next time
########################################################################

           ------------------------------------------------- 
          |                 G F N 2 - x T B                 |
          | Geometry, Frequencies, Noncovalent interactions |
          |            JCTC 2019 parametrisation            |
           ------------------------------------------------- 
             KAB for C  - Si     :                1.0500
             KAB for H  - Pd     :                0.9500
             k(s)              :                1.8500
             k(p)              :                2.2300
             k(d)              :                2.2300
             k(f)              :                2.0000
             kEN (H0ij)        :               -2.0000
             D4 a1             :                0.5200
             D4 a2             :                5.0000
             D4 s6             :                1.0000
             D4 s8             :                2.7000
             D4 s9             :                5.0000
             alphaj            :                2.0000

  Z AO/shell   Hii/eV     exponent
  1     Wed Apr 25 08:07:45 CEST 2018   EN: 2.200 GM2: 0.406  GM3: 0.0800  RAES: 1.40
     1s    -10.707211    1.230000
  6     Wed Apr 25 08:07:45 CEST 2018   EN: 2.550 GM2: 0.538  GM3: 0.1500  RAES: 3.00
     2s    -13.970922    2.096432
     2p    -10.063292    1.800000
  8     Wed Apr 25 08:07:45 CEST 2018   EN: 3.440 GM2: 0.452  GM3:-0.0517  RAES: 1.80
     2s    -20.229985    2.439742
     2p    -15.503117    2.137023
  9     Mon Apr 23 13:58:50 CEST 2018   EN: 3.980 GM2: 0.532  GM3: 0.1426  RAES: 2.40
     2s    -23.458179    2.416361
     2p    -15.746583    2.308399
 16     Tue Apr 24 11:44:34 CEST 2018   EN: 2.580 GM2: 0.340  GM3:-0.0502  RAES: 3.10
     3s    -20.029654    1.981333
     3p    -11.377694    2.025643
     3d     -0.420282    1.702555

           ------------------------------------------------- 
          |        Self-Consistent Charge Iterations        |
           ------------------------------------------------- 

          ...................................................
          :                      SETUP                      :
          :.................................................:
          :  # basis functions                  87          :
          :  # atomic orbitals                  86          :
          :  # shells                           48          :
          :  # electrons                        94          :
          :  max. iterations                   250          :
          :  Hamiltonian                  GFN2-xTB          :
          :  restarted?                      false          :
          :  GBSA solvation                  false          :
          :  PC potential                    false          :
          :  electronic temp.          300.0000000     K    :
          :  accuracy                    1.0000000          :
          :  -> integral cutoff          0.2500000E+02      :
          :  -> integral neglect         0.1000000E-07      :
          :  -> SCF convergence          0.1000000E-05 Eh   :
          :  -> wf. convergence          0.1000000E-03 e    :
          :  Broyden damping             0.4000000          :
          ...................................................

 iter      E             dE          RMSdq      gap      omega  full diag
   1    -54.2493560 -0.542494E+02  0.435E+00    3.05       0.0  T
   2    -54.3540849 -0.104729E+00  0.239E+00    3.07       1.0  T
   3    -54.3559826 -0.189773E-02  0.107E+00    3.07       1.0  T
   4    -54.3578736 -0.189096E-02  0.346E-01    3.07       1.0  T
   5    -54.3602343 -0.236079E-02  0.146E-01    3.06       1.0  T
   6    -54.3604976 -0.263239E-03  0.480E-02    3.07       1.0  T
   7    -54.3605054 -0.777466E-05  0.236E-02    3.06       1.0  T
   8    -54.3605128 -0.745693E-05  0.127E-02    3.06       1.4  T
   9    -54.3605138 -0.101030E-05  0.453E-03    3.06       4.0  T
  10    -54.3605140 -0.156769E-06  0.185E-03    3.06       9.9  T
  11    -54.3605140 -0.185390E-07  0.864E-04    3.06      21.1  T
  12    -54.3605140 -0.695871E-08  0.489E-04    3.06      37.3  T

   *** convergence criteria satisfied after 12 iterations ***

         #    Occupation            Energy/Eh            Energy/eV
      -------------------------------------------------------------
         1        2.0000           -0.8813871             -23.9838
       ...           ...                  ...                  ...
        41        2.0000           -0.4566475             -12.4260
        42        2.0000           -0.4505868             -12.2611
        43        2.0000           -0.4364772             -11.8771
        44        2.0000           -0.4294934             -11.6871
        45        2.0000           -0.4135633             -11.2536
        46        2.0000           -0.3905787             -10.6282
        47        2.0000           -0.3767728             -10.2525 (HOMO)
        48                         -0.2641467              -7.1878 (LUMO)
        49                         -0.2084024              -5.6709
        50                         -0.1996008              -5.4314
        51                         -0.1614375              -4.3929
        52                         -0.1139248              -3.1001
       ...                                ...                  ...
        86                          0.6609881              17.9864
      -------------------------------------------------------------
                  HL-Gap            0.1126262 Eh            3.0647 eV
             Fermi-level           -0.3204598 Eh           -8.7202 eV

 SCC (total)                   0 d,  0 h,  0 min,  0.058 sec
 SCC setup                      ...        0 min,  0.000 sec (  0.636%)
 Dispersion                     ...        0 min,  0.000 sec (  0.784%)
 integral evaluation            ...        0 min,  0.014 sec ( 25.018%)
 zeroth order Hamiltonian       ...        0 min,  0.000 sec (  0.463%)
 iterations                     ...        0 min,  0.021 sec ( 35.636%)
 molecular gradient             ...        0 min,  0.021 sec ( 36.637%)
 printout                       ...        0 min,  0.000 sec (  0.736%)

         :::::::::::::::::::::::::::::::::::::::::::::::::::::
         ::                     SUMMARY                     ::
         :::::::::::::::::::::::::::::::::::::::::::::::::::::
         :: total energy             -53.823158988755 Eh    ::
         :: gradient norm              0.058643906540 Eh/a0 ::
         :: HOMO-LUMO gap              3.064714146033 eV    ::
         ::.................................................::
         :: SCC energy               -54.360514012586 Eh    ::
         :: -> isotropic ES            0.062307418067 Eh    ::
         :: -> anisotropic ES          0.002944817554 Eh    ::
         :: -> anisotropic XC         -0.003528485797 Eh    ::
         :: -> dispersion             -0.032068548010 Eh    ::
         :: repulsion energy           0.536815334780 Eh    ::
         :: add. restraining           0.000000000000 Eh    ::
         :::::::::::::::::::::::::::::::::::::::::::::::::::::

      ----------------------------------------------------------- 
     |                   =====================                   |
     |                        A N C O P T                        |
     |                   =====================                   |
     |               Approximate Normal Coordinate               |
     |                Rational Function Optimizer                |
      ----------------------------------------------------------- 

          ...................................................
          :                      SETUP                      :
          :.................................................:
          :   optimization level            normal          :
          :   max. optcycles                   200          :
          :   ANC micro-cycles                  20          :
          :   degrees of freedom                84          :
          :.................................................:
          :   RF solver                   davidson          :
          :   input Hessian                  false          :
          :   write xtbopt.log                true          :
          :   linear?                        false          :
          :   energy convergence         0.5000000E-05 Eh   :
          :   grad. convergence          0.1000000E-02 Eh/α :
          :   maximium RF displ.         2.0000000          :
          :   Hlow (freq-cutoff)         0.5000000E-02      :
          :   Hmax (freq-cutoff)         5.0000000          :
          :   S6 in model hess.         20.0000000          :
          ...................................................

generating ANC from model Hessian ...
Using Lindh-Hessian (1995)
 Shifting diagonal of input Hessian by   4.235207282799416E-003
 Lowest  eigenvalues of input Hessian
   -0.000000   -0.000000    0.000000    0.000000    0.000000    0.000000
    0.005000    0.005557    0.006883    0.008037    0.008623    0.009371
    0.010672    0.012491    0.013661    0.015571    0.016535    0.021381
 Highest eigenvalues
    1.616000    1.668887    1.696799    1.771540    1.829772    1.955331
 

........................................................................
.............................. CYCLE    1 ..............................
........................................................................
   1    -54.3605140 -0.543605E+02  0.235E-04    3.06       0.0  T
   2    -54.3605140 -0.112578E-09  0.186E-04    3.06      98.1  T
   3    -54.3605140 -0.385548E-09  0.107E-04    3.06     170.1  T
     SCC iter.                  ...        0 min,  0.006 sec
     gradient                   ...        0 min,  0.021 sec
 * total energy  :   -53.8231590 Eh     change        0.1578798E-08 Eh
   gradient norm :     0.0586441 Eh/α   predicted     0.0000000E+00 (-100.00%)
   displ. norm   :     0.2736562 α      lambda       -0.6736229E-02
   maximum displ.:     0.1506160 α      in ANC's #4, #10, #13, ...

........................................................................
.............................. CYCLE    2 ..............................
........................................................................
   1    -54.3823213 -0.543823E+02  0.194E-01    3.12       0.0  T
   2    -54.3823642 -0.428966E-04  0.112E-01    3.12       1.0  T
   3    -54.3823072  0.570871E-04  0.668E-02    3.12       1.0  T
   4    -54.3824056 -0.984101E-04  0.195E-02    3.12       1.0  T
   5    -54.3824075 -0.191626E-05  0.906E-03    3.12       2.0  T
   6    -54.3824086 -0.115552E-05  0.300E-03    3.12       6.1  T
   7    -54.3824088 -0.164478E-06  0.868E-04    3.12      21.0  T
     SCC iter.                  ...        0 min,  0.011 sec
     gradient                   ...        0 min,  0.020 sec
 * total energy  :   -53.8275902 Eh     change       -0.4431236E-02 Eh
   gradient norm :     0.0223938 Eh/α   predicted    -0.3620347E-02 ( -18.30%)
   displ. norm   :     0.2588472 α      lambda       -0.1803144E-02
   maximum displ.:     0.1702440 α      in ANC's #4, #5, #13, ...

........................................................................
.............................. CYCLE    3 ..............................
........................................................................
   1    -54.3907105 -0.543907E+02  0.158E-01    3.15       0.0  T
   2    -54.3907310 -0.205267E-04  0.910E-02    3.15       1.0  T
   3    -54.3906872  0.438467E-04  0.526E-02    3.15       1.0  T
   4    -54.3907496 -0.624094E-04  0.140E-02    3.15       1.3  T
   5    -54.3907505 -0.975979E-06  0.631E-03    3.15       2.9  T
   6    -54.3907511 -0.604099E-06  0.204E-03    3.15       9.0  T
   7    -54.3907512 -0.738543E-07  0.689E-04    3.15      26.5  T
     SCC iter.                  ...        0 min,  0.011 sec
     gradient                   ...        0 min,  0.020 sec
 * total energy  :   -53.8285985 Eh     change       -0.1008284E-02 Eh
   gradient norm :     0.0071833 Eh/α   predicted    -0.9619850E-03 (  -4.59%)
   displ. norm   :     0.2283722 α      lambda       -0.6212054E-03
   maximum displ.:     0.1678610 α      in ANC's #4, #5, #8, ...

........................................................................
.............................. CYCLE    4 ..............................
........................................................................
   1    -54.3903584 -0.543904E+02  0.118E-01    3.14       0.0  T
   2    -54.3903634 -0.501089E-05  0.693E-02    3.14       1.0  T
   3    -54.3903530  0.103357E-04  0.231E-02    3.14       1.0  T
   4    -54.3903655 -0.124813E-04  0.717E-03    3.14       2.5  T
   5    -54.3903660 -0.454544E-06  0.253E-03    3.14       7.2  T
   6    -54.3903660 -0.603897E-07  0.115E-03    3.14      15.9  T
     SCC iter.                  ...        0 min,  0.010 sec
     gradient                   ...        0 min,  0.020 sec
 * total energy  :   -53.8289754 Eh     change       -0.3768910E-03 Eh
   gradient norm :     0.0064911 Eh/α   predicted    -0.3268022E-03 ( -13.29%)
   displ. norm   :     0.2025428 α      lambda       -0.3341999E-03
   maximum displ.:     0.1416927 α      in ANC's #4, #5, #9, ...

........................................................................
.............................. CYCLE    5 ..............................
........................................................................
   1    -54.3883186 -0.543883E+02  0.995E-02    3.14       0.0  T
   2    -54.3883207 -0.213906E-05  0.586E-02    3.14       1.0  T
   3    -54.3883216 -0.874494E-06  0.745E-03    3.14       2.5  T
   4    -54.3883215  0.154611E-06  0.407E-03    3.14       4.5  T
   5    -54.3883218 -0.310306E-06  0.115E-03    3.14      15.9  T
   6    -54.3883218 -0.166361E-07  0.548E-04    3.14      33.3  T
     SCC iter.                  ...        0 min,  0.010 sec
     gradient                   ...        0 min,  0.020 sec
 * total energy  :   -53.8292331 Eh     change       -0.2577243E-03 Eh
   gradient norm :     0.0053389 Eh/α   predicted    -0.1739565E-03 ( -32.50%)
   displ. norm   :     0.2335099 α      lambda       -0.2689912E-03
   maximum displ.:     0.1577411 α      in ANC's #4, #5, #9, ...

........................................................................
.............................. CYCLE    6 ..............................
........................................................................
   1    -54.3874802 -0.543875E+02  0.108E-01    3.13       0.0  T
   2    -54.3874826 -0.241675E-05  0.634E-02    3.13       1.0  T
   3    -54.3874806  0.203412E-05  0.133E-02    3.13       1.4  T
   4    -54.3874839 -0.326403E-05  0.553E-03    3.13       3.3  T
   5    -54.3874841 -0.215308E-06  0.137E-03    3.13      13.4  T
   6    -54.3874841 -0.231551E-07  0.681E-04    3.13      26.8  T
     SCC iter.                  ...        0 min,  0.010 sec
     gradient                   ...        0 min,  0.020 sec
 * total energy  :   -53.8294263 Eh     change       -0.1932274E-03 Eh
   gradient norm :     0.0047454 Eh/α   predicted    -0.1418303E-03 ( -26.60%)
   displ. norm   :     0.2047362 α      lambda       -0.1525581E-03
   maximum displ.:     0.1350150 α      in ANC's #4, #5, #3, ...

........................................................................
.............................. CYCLE    7 ..............................
........................................................................
   1    -54.3878355 -0.543878E+02  0.875E-02    3.12       0.0  T
   2    -54.3878369 -0.144100E-05  0.515E-02    3.12       1.0  T
   3    -54.3878339  0.304064E-05  0.140E-02    3.12       1.3  T
   4    -54.3878378 -0.392941E-05  0.394E-03    3.12       4.6  T
   5    -54.3878379 -0.662555E-07  0.125E-03    3.12      14.6  T
   6    -54.3878379 -0.144798E-07  0.553E-04    3.12      33.0  T
     SCC iter.                  ...        0 min,  0.010 sec
     gradient                   ...        0 min,  0.020 sec
 * total energy  :   -53.8295374 Eh     change       -0.1110615E-03 Eh
   gradient norm :     0.0041402 Eh/α   predicted    -0.7947754E-04 ( -28.44%)
   displ. norm   :     0.1820380 α      lambda       -0.1096267E-03
   maximum displ.:     0.1133965 α      in ANC's #4, #5, #3, ...

........................................................................
.............................. CYCLE    8 ..............................
........................................................................
   1    -54.3890937 -0.543891E+02  0.784E-02    3.12       0.0  T
   2    -54.3890949 -0.118140E-05  0.457E-02    3.12       1.0  T
   3    -54.3890915  0.336049E-05  0.143E-02    3.12       1.3  T
   4    -54.3890956 -0.407642E-05  0.369E-03    3.12       4.9  T
   5    -54.3890956 -0.598482E-07  0.118E-03    3.12      15.4  T
   6    -54.3890957 -0.118672E-07  0.499E-04    3.12      36.6  T
     SCC iter.                  ...        0 min,  0.010 sec
     gradient                   ...        0 min,  0.020 sec
 * total energy  :   -53.8296139 Eh     change       -0.7652442E-04 Eh
   gradient norm :     0.0025189 Eh/α   predicted    -0.5663822E-04 ( -25.99%)
   displ. norm   :     0.1328386 α      lambda       -0.5967470E-04
   maximum displ.:     0.0649336 α      in ANC's #5, #4, #3, ...

........................................................................
.............................. CYCLE    9 ..............................
........................................................................
   1    -54.3900572 -0.543901E+02  0.601E-02    3.11       0.0  T
   2    -54.3900579 -0.692103E-06  0.346E-02    3.11       1.0  T
   3    -54.3900561  0.181761E-05  0.107E-02    3.11       1.7  T
   4    -54.3900582 -0.218260E-05  0.308E-03    3.11       5.9  T
   5    -54.3900583 -0.457254E-07  0.891E-04    3.11      20.5  T
   6    -54.3900583 -0.834419E-08  0.342E-04    3.11      53.4  T
     SCC iter.                  ...        0 min,  0.010 sec
     gradient                   ...        0 min,  0.021 sec
 * total energy  :   -53.8296572 Eh     change       -0.4322850E-04 Eh
   gradient norm :     0.0016635 Eh/α   predicted    -0.3036435E-04 ( -29.76%)
   displ. norm   :     0.1754378 α      lambda       -0.4261455E-04
   maximum displ.:     0.0934785 α      in ANC's #3, #2, #5, ...

........................................................................
.............................. CYCLE   10 ..............................
........................................................................
   1    -54.3909963 -0.543910E+02  0.853E-02    3.11       0.0  T
   2    -54.3909977 -0.138421E-05  0.485E-02    3.11       1.0  T
   3    -54.3909960  0.169765E-05  0.119E-02    3.11       1.5  T
   4    -54.3909981 -0.210989E-05  0.496E-03    3.11       3.7  T
   5    -54.3909983 -0.198172E-06  0.105E-03    3.11      17.3  T
   6    -54.3909983 -0.131465E-07  0.400E-04    3.11      45.6  T
   7    -54.3909983 -0.341501E-09  0.254E-04    3.11      71.9  T
     SCC iter.                  ...        0 min,  0.011 sec
     gradient                   ...        0 min,  0.021 sec
 * total energy  :   -53.8296940 Eh     change       -0.3686440E-04 Eh
   gradient norm :     0.0021510 Eh/α   predicted    -0.2160349E-04 ( -41.40%)
   displ. norm   :     0.0815427 α      lambda       -0.2232907E-04
   maximum displ.:     0.0455685 α      in ANC's #2, #5, #3, ...

........................................................................
.............................. CYCLE   11 ..............................
........................................................................
   1    -54.3901528 -0.543902E+02  0.378E-02    3.10       0.0  T
   2    -54.3901531 -0.249566E-06  0.217E-02    3.10       1.0  T
   3    -54.3901529  0.147234E-06  0.408E-03    3.10       4.5  T
   4    -54.3901531 -0.188861E-06  0.201E-03    3.10       9.1  T
   5    -54.3901531 -0.427491E-07  0.402E-04    3.10      45.4  T
   6    -54.3901531 -0.160270E-08  0.192E-04    3.10      95.1  T
     SCC iter.                  ...        0 min,  0.010 sec
     gradient                   ...        0 min,  0.021 sec
 * total energy  :   -53.8297078 Eh     change       -0.1379757E-04 Eh
   gradient norm :     0.0019583 Eh/α   predicted    -0.1123906E-04 ( -18.54%)
   displ. norm   :     0.0933892 α      lambda       -0.2628858E-04
   maximum displ.:     0.0714889 α      in ANC's #2, #4, #1, ...

........................................................................
.............................. CYCLE   12 ..............................
........................................................................
   1    -54.3904549 -0.543905E+02  0.419E-02    3.10       0.0  T
   2    -54.3904553 -0.438349E-06  0.244E-02    3.10       1.0  T
   3    -54.3904554 -0.586178E-07  0.366E-03    3.10       5.0  T
   4    -54.3904554 -0.531802E-07  0.209E-03    3.10       8.7  T
   5    -54.3904555 -0.428147E-07  0.820E-04    3.10      22.3  T
   6    -54.3904555 -0.135607E-07  0.248E-04    3.10      73.7  T
     SCC iter.                  ...        0 min,  0.010 sec
     gradient                   ...        0 min,  0.021 sec
 * total energy  :   -53.8297327 Eh     change       -0.2485193E-04 Eh
   gradient norm :     0.0015948 Eh/α   predicted    -0.1319866E-04 ( -46.89%)
   displ. norm   :     0.0931215 α      lambda        0.9561655E-05
   maximum displ.:     0.0714973 α      in ANC's #2, #4, #3, ...

........................................................................
.............................. CYCLE   13 ..............................
........................................................................
   1    -54.3906520 -0.543907E+02  0.419E-02    3.10       0.0  T
   2    -54.3906524 -0.442251E-06  0.244E-02    3.10       1.0  T
   3    -54.3906524 -0.410452E-07  0.378E-03    3.10       4.8  T
   4    -54.3906525 -0.653999E-07  0.220E-03    3.10       8.3  T
   5    -54.3906526 -0.507384E-07  0.830E-04    3.10      22.0  T
   6    -54.3906526 -0.135515E-07  0.250E-04    3.10      72.9  T
     SCC iter.                  ...        0 min,  0.010 sec
     gradient                   ...        0 min,  0.021 sec
 * total energy  :   -53.8297286 Eh     change        0.4100232E-05 Eh
   gradient norm :     0.0038342 Eh/α   predicted     0.4797431E-05 (  17.00%)
   displ. norm   :     0.0476755 α      lambda       -0.3014674E-04
   maximum displ.:     0.0255389 α      in ANC's #2, #5, #4, ...

........................................................................
.............................. CYCLE   14 ..............................
........................................................................
   1    -54.3898363 -0.543898E+02  0.233E-02    3.10       0.0  T
   2    -54.3898364 -0.986238E-07  0.136E-02    3.10       1.3  T
   3    -54.3898364  0.588477E-08  0.188E-03    3.10       9.7  T
   4    -54.3898364 -0.215361E-07  0.111E-03    3.10      16.5  T
   5    -54.3898365 -0.165053E-07  0.359E-04    3.10      50.9  T
   6    -54.3898365 -0.138541E-08  0.132E-04    3.10     138.5  T
     SCC iter.                  ...        0 min,  0.010 sec
     gradient                   ...        0 min,  0.021 sec
 * total energy  :   -53.8297507 Eh     change       -0.2214080E-04 Eh
   gradient norm :     0.0027095 Eh/α   predicted    -0.1510850E-04 ( -31.76%)
   displ. norm   :     0.0656329 α      lambda       -0.3481611E-04
   maximum displ.:     0.0349193 α      in ANC's #2, #4, #5, ...

........................................................................
.............................. CYCLE   15 ..............................
........................................................................
   1    -54.3897270 -0.543897E+02  0.319E-02    3.10       0.0  T
   2    -54.3897273 -0.256798E-06  0.192E-02    3.10       1.0  T
   3    -54.3897265  0.744353E-06  0.648E-03    3.10       2.8  T
   4    -54.3897274 -0.886957E-06  0.141E-03    3.10      12.9  T
   5    -54.3897274 -0.973780E-08  0.654E-04    3.10      27.9  T
   6    -54.3897274 -0.169729E-08  0.285E-04    3.10      64.1  T
     SCC iter.                  ...        0 min,  0.010 sec
     gradient                   ...        0 min,  0.021 sec
 * total energy  :   -53.8297721 Eh     change       -0.2138006E-04 Eh
   gradient norm :     0.0014307 Eh/α   predicted    -0.1748515E-04 ( -18.22%)
   displ. norm   :     0.0985933 α      lambda        0.1347722E-04
   maximum displ.:     0.0523782 α      in ANC's #2, #4, #5, ...

........................................................................
.............................. CYCLE   16 ..............................
........................................................................
   1    -54.3893771 -0.543894E+02  0.478E-02    3.10       0.0  T
   2    -54.3893777 -0.586509E-06  0.287E-02    3.10       1.0  T
   3    -54.3893760  0.170798E-05  0.979E-03    3.10       1.9  T
   4    -54.3893781 -0.203004E-05  0.214E-03    3.10       8.5  T
   5    -54.3893781 -0.230942E-07  0.990E-04    3.10      18.4  T
   6    -54.3893781 -0.391748E-08  0.433E-04    3.10      42.1  T
     SCC iter.                  ...        0 min,  0.010 sec
     gradient                   ...        0 min,  0.021 sec
 * total energy  :   -53.8297508 Eh     change        0.2130658E-04 Eh
   gradient norm :     0.0050235 Eh/α   predicted     0.6767314E-05 ( -68.24%)
   displ. norm   :     0.0329863 α      lambda       -0.4284430E-04
   maximum displ.:     0.0208156 α      in ANC's #5, #4, #13, ...

........................................................................
.............................. CYCLE   17 ..............................
........................................................................
   1    -54.3898360 -0.543898E+02  0.153E-02    3.10       0.0  T
   2    -54.3898361 -0.117027E-06  0.900E-03    3.10       2.0  T
   3    -54.3898358  0.276417E-06  0.407E-03    3.10       4.5  T
   4    -54.3898361 -0.324480E-06  0.891E-04    3.10      20.5  T
   5    -54.3898361 -0.702729E-08  0.371E-04    3.10      49.2  T
     SCC iter.                  ...        0 min,  0.008 sec
     gradient                   ...        0 min,  0.020 sec
 * total energy  :   -53.8297818 Eh     change       -0.3103320E-04 Eh
   gradient norm :     0.0024296 Eh/α   predicted    -0.2144847E-04 ( -30.89%)
   displ. norm   :     0.0536521 α      lambda       -0.2727651E-04
   maximum displ.:     0.0449023 α      in ANC's #2, #1, #3, ...

........................................................................
.............................. CYCLE   18 ..............................
........................................................................
   1    -54.3900950 -0.543901E+02  0.241E-02    3.10       0.0  T
   2    -54.3900952 -0.154692E-06  0.137E-02    3.10       1.3  T
   3    -54.3900951  0.325280E-07  0.254E-03    3.10       7.2  T
   4    -54.3900952 -0.477687E-07  0.154E-03    3.10      11.9  T
   5    -54.3900952 -0.293134E-07  0.423E-04    3.10      43.1  T
   6    -54.3900952 -0.221357E-08  0.138E-04    3.10     132.5  T
     SCC iter.                  ...        0 min,  0.010 sec
     gradient                   ...        0 min,  0.021 sec
 * total energy  :   -53.8297998 Eh     change       -0.1801354E-04 Eh
   gradient norm :     0.0006396 Eh/α   predicted    -0.1368016E-04 ( -24.06%)
   displ. norm   :     0.1316442 α      lambda       -0.1623428E-04
   maximum displ.:     0.1138330 α      in ANC's #2, #1, #3, ...

........................................................................
.............................. CYCLE   19 ..............................
........................................................................
   1    -54.3903063 -0.543903E+02  0.605E-02    3.10       0.0  T
   2    -54.3903069 -0.636029E-06  0.347E-02    3.10       1.0  T
   3    -54.3903071 -0.204193E-06  0.484E-03    3.10       3.8  T
   4    -54.3903071  0.252486E-07  0.169E-03    3.10      10.8  T
   5    -54.3903071 -0.454852E-07  0.627E-04    3.10      29.1  T
   6    -54.3903071 -0.699809E-08  0.254E-04    3.10      71.9  T
     SCC iter.                  ...        0 min,  0.010 sec
     gradient                   ...        0 min,  0.021 sec
 * total energy  :   -53.8298181 Eh     change       -0.1822068E-04 Eh
   gradient norm :     0.0016864 Eh/α   predicted    -0.8183480E-05 ( -55.09%)
   displ. norm   :     0.1104746 α      lambda       -0.1374816E-04
   maximum displ.:     0.0893471 α      in ANC's #2, #1, #4, ...

........................................................................
.............................. CYCLE   20 ..............................
........................................................................
   1    -54.3902668 -0.543903E+02  0.502E-02    3.10       0.0  T
   2    -54.3902672 -0.383519E-06  0.290E-02    3.10       1.0  T
   3    -54.3902670  0.219313E-06  0.555E-03    3.10       3.3  T
   4    -54.3902673 -0.292562E-06  0.292E-03    3.10       6.3  T
   5    -54.3902674 -0.867292E-07  0.526E-04    3.10      34.7  T
   6    -54.3902674 -0.321167E-08  0.265E-04    3.10      68.8  T
     SCC iter.                  ...        0 min,  0.010 sec
     gradient                   ...        0 min,  0.021 sec
 * total energy  :   -53.8298366 Eh     change       -0.1850629E-04 Eh
   gradient norm :     0.0010188 Eh/α   predicted    -0.6913811E-05 ( -62.64%)
   displ. norm   :     0.0966748 α      lambda       -0.1115115E-04
   maximum displ.:     0.0748110 α      in ANC's #2, #1, #4, ...
 * RMSD in coord.:     0.3635485 α      energy gain  -0.6677577E-02 Eh

generating ANC from model Hessian ...
Using Lindh-Hessian (1995)
 Shifting diagonal of input Hessian by   4.202367233242451E-003
 Lowest  eigenvalues of input Hessian
   -0.000000   -0.000000    0.000000    0.000000    0.000000    0.000000
    0.005000    0.005670    0.007042    0.008067    0.008793    0.009498
    0.010835    0.012784    0.013849    0.016229    0.017695    0.023169
 Highest eigenvalues
    1.684933    1.694378    1.719930    1.835533    1.892057    2.021747
 

........................................................................
.............................. CYCLE   21 ..............................
........................................................................
   1    -54.3903139 -0.543903E+02  0.446E-02    3.09       0.0  T
   2    -54.3903142 -0.316966E-06  0.257E-02    3.09       1.0  T
   3    -54.3903141  0.389652E-07  0.416E-03    3.09       4.4  T
   4    -54.3903142 -0.462412E-07  0.265E-03    3.09       6.9  T
   5    -54.3903143 -0.996716E-07  0.528E-04    3.09      34.6  T
   6    -54.3903143 -0.362974E-08  0.220E-04    3.09      82.9  T
     SCC iter.                  ...        0 min,  0.010 sec
     gradient                   ...        0 min,  0.021 sec
 * total energy  :   -53.8298494 Eh     change       -0.1284507E-04 Eh
   gradient norm :     0.0008006 Eh/α   predicted     0.0000000E+00 (-100.00%)
   displ. norm   :     0.0441638 α      lambda       -0.6797200E-05
   maximum displ.:     0.0405918 α      in ANC's #2, #3, #9, ...

........................................................................
.............................. CYCLE   22 ..............................
........................................................................
   1    -54.3904048 -0.543904E+02  0.217E-02    3.09       0.0  T
   2    -54.3904050 -0.122689E-06  0.120E-02    3.09       1.5  T
   3    -54.3904050 -0.199917E-07  0.215E-03    3.09       8.5  T
   4    -54.3904050  0.230467E-07  0.140E-03    3.09      13.1  T
   5    -54.3904050 -0.420680E-07  0.242E-04    3.09      75.4  T
   6    -54.3904050 -0.849838E-09  0.106E-04    3.09     172.1  T
     SCC iter.                  ...        0 min,  0.010 sec
     gradient                   ...        0 min,  0.021 sec
 * total energy  :   -53.8298574 Eh     change       -0.7954982E-05 Eh
   gradient norm :     0.0003253 Eh/α   predicted    -0.3405257E-05 ( -57.19%)
   displ. norm   :     0.0442520 α      lambda        0.1197134E-05
   maximum displ.:     0.0405878 α      in ANC's #2, #3, #9, ...

........................................................................
.............................. CYCLE   23 ..............................
........................................................................
   1    -54.3904719 -0.543905E+02  0.218E-02    3.09       0.0  T
   2    -54.3904720 -0.124274E-06  0.120E-02    3.09       1.5  T
   3    -54.3904720 -0.137493E-07  0.222E-03    3.09       8.2  T
   4    -54.3904720  0.197448E-07  0.150E-03    3.09      12.2  T
   5    -54.3904721 -0.463647E-07  0.243E-04    3.09      75.1  T
   6    -54.3904721 -0.796810E-09  0.112E-04    3.09     162.5  T
     SCC iter.                  ...        0 min,  0.010 sec
     gradient                   ...        0 min,  0.021 sec
 * total energy  :   -53.8298609 Eh     change       -0.3539414E-05 Eh
   gradient norm :     0.0010987 Eh/α   predicted     0.5979930E-06 (-116.90%)
   displ. norm   :     0.0443553 α      lambda        0.5287447E-05
   maximum displ.:     0.0405892 α      in ANC's #2, #3, #9, ...

........................................................................
.............................. CYCLE   24 ..............................
........................................................................
   1    -54.3905152 -0.543905E+02  0.219E-02    3.09       0.0  T
   2    -54.3905153 -0.125690E-06  0.120E-02    3.09       1.5  T
   3    -54.3905153 -0.160092E-07  0.221E-03    3.09       8.3  T
   4    -54.3905153  0.212417E-07  0.148E-03    3.09      12.3  T
   5    -54.3905154 -0.458986E-07  0.247E-04    3.09      74.0  T
   6    -54.3905154 -0.836913E-09  0.113E-04    3.09     161.0  T
     SCC iter.                  ...        0 min,  0.010 sec
     gradient                   ...        0 min,  0.021 sec
 * total energy  :   -53.8298601 Eh     change        0.8110976E-06 Eh
   gradient norm :     0.0019735 Eh/α   predicted     0.2644979E-05 ( 226.10%)
   displ. norm   :     0.0149999 α      lambda       -0.6630229E-05
   maximum displ.:     0.0075751 α      in ANC's #9, #5, #12, ...

........................................................................
.............................. CYCLE   25 ..............................
........................................................................
   1    -54.3905149 -0.543905E+02  0.866E-03    3.10       0.0  T
   2    -54.3905149 -0.204769E-07  0.500E-03    3.10       3.7  T
   3    -54.3905149 -0.314531E-08  0.885E-04    3.10      20.6  T
   4    -54.3905149 -0.429949E-10  0.601E-04    3.10      30.4  T
     SCC iter.                  ...        0 min,  0.007 sec
     gradient                   ...        0 min,  0.021 sec
 * total energy  :   -53.8298676 Eh     change       -0.7544324E-05 Eh
   gradient norm :     0.0014641 Eh/α   predicted    -0.3318490E-05 ( -56.01%)
   displ. norm   :     0.0449481 α      lambda       -0.9981227E-05
   maximum displ.:     0.0237972 α      in ANC's #2, #9, #5, ...

........................................................................
.............................. CYCLE   26 ..............................
........................................................................
   1    -54.3904055 -0.543904E+02  0.239E-02    3.10       0.0  T
   2    -54.3904056 -0.155611E-06  0.142E-02    3.10       1.3  T
   3    -54.3904057 -0.411682E-07  0.200E-03    3.10       9.1  T
   4    -54.3904057 -0.106769E-07  0.127E-03    3.10      14.4  T
   5    -54.3904057 -0.230772E-07  0.325E-04    3.10      56.2  T
   6    -54.3904057 -0.100331E-08  0.111E-04    3.10     165.2  T
     SCC iter.                  ...        0 min,  0.010 sec
     gradient                   ...        0 min,  0.021 sec
 * total energy  :   -53.8298746 Eh     change       -0.6915791E-05 Eh
   gradient norm :     0.0006236 Eh/α   predicted    -0.4995476E-05 ( -27.77%)
   displ. norm   :     0.0449199 α      lambda        0.1280201E-04
   maximum displ.:     0.0237955 α      in ANC's #2, #9, #5, ...

........................................................................
.............................. CYCLE   27 ..............................
........................................................................
   1    -54.3902403 -0.543902E+02  0.239E-02    3.10       0.0  T
   2    -54.3902405 -0.158697E-06  0.142E-02    3.10       1.3  T
   3    -54.3902405 -0.500872E-07  0.190E-03    3.10       9.6  T
   4    -54.3902405 -0.323851E-08  0.120E-03    3.10      15.2  T
   5    -54.3902406 -0.205740E-07  0.355E-04    3.10      51.4  T
   6    -54.3902406 -0.144576E-08  0.110E-04    3.10     166.6  T
     SCC iter.                  ...        0 min,  0.010 sec
     gradient                   ...        0 min,  0.021 sec
 * total energy  :   -53.8298649 Eh     change        0.9652596E-05 Eh
   gradient norm :     0.0023582 Eh/α   predicted     0.6406545E-05 ( -33.63%)
   displ. norm   :     0.0159203 α      lambda       -0.1808032E-04
   maximum displ.:     0.0095017 α      in ANC's #12, #13, #2, ...

........................................................................
.............................. CYCLE   28 ..............................
........................................................................
   1    -54.3903232 -0.543903E+02  0.102E-02    3.10       0.0  T
   2    -54.3903232 -0.277983E-07  0.574E-03    3.10       3.2  T
   3    -54.3903232 -0.410048E-08  0.961E-04    3.10      19.0  T
   4    -54.3903232  0.979583E-09  0.461E-04    3.10      39.6  T
     SCC iter.                  ...        0 min,  0.007 sec
     gradient                   ...        0 min,  0.021 sec
 * total energy  :   -53.8298769 Eh     change       -0.1204658E-04 Eh
   gradient norm :     0.0012411 Eh/α   predicted    -0.9043437E-05 ( -24.93%)
   displ. norm   :     0.0245664 α      lambda       -0.7231416E-05
   maximum displ.:     0.0211678 α      in ANC's #2, #12, #11, ...

........................................................................
.............................. CYCLE   29 ..............................
........................................................................
   1    -54.3904920 -0.543905E+02  0.987E-03    3.10       0.0  T
   2    -54.3904921 -0.401374E-07  0.559E-03    3.10       3.3  T
   3    -54.3904920  0.469667E-07  0.186E-03    3.10       9.8  T
   4    -54.3904921 -0.564460E-07  0.596E-04    3.10      30.6  T
   5    -54.3904921 -0.250611E-08  0.226E-04    3.10      80.8  T
     SCC iter.                  ...        0 min,  0.008 sec
     gradient                   ...        0 min,  0.021 sec
 * total energy  :   -53.8298815 Eh     change       -0.4597375E-05 Eh
   gradient norm :     0.0006755 Eh/α   predicted    -0.3620521E-05 ( -21.25%)
   displ. norm   :     0.0282339 α      lambda       -0.2428185E-05
   maximum displ.:     0.0215461 α      in ANC's #2, #9, #5, ...

   *** GEOMETRY OPTIMIZATION CONVERGED AFTER 29 ITERATIONS ***

------------------------------------------------------------------------
 total energy gain   :        -0.0067226 Eh       -4.2185 kcal/mol
 total RMSD          :         0.3792704 a0        0.2007 Å
 total power (kW/mol):        -0.6086231 (step)  -12.8487 (real)
------------------------------------------------------------------------

 ANCopt (total)                0 d,  0 h,  0 min,  1.374 sec
 optimizer setup                ...        0 min,  0.000 sec (  0.012%)
 model hessian                  ...        0 min,  0.033 sec (  2.384%)
 ANC generation                 ...        0 min,  0.002 sec (  0.136%)
 coordinate transformation      ...        0 min,  0.001 sec (  0.044%)
 single point calculation       ...        0 min,  1.328 sec ( 96.663%)
 optimization log               ...        0 min,  0.003 sec (  0.249%)
 hessian update                 ...        0 min,  0.000 sec (  0.031%)
 rational function              ...        0 min,  0.005 sec (  0.348%)

================
 final structure:
================
$coord
    3.18101300179884   -2.76832333457242   -2.69128424991100      C 
    5.26652633223066   -0.30982689533748   -2.96114567100737      S 
    2.91708911195374    1.87931495220984   -2.23354887063128      C 
    0.65509291960780    0.68216199703194   -1.78529228408458      C 
    0.81831632990317   -1.97985009033224   -2.04865550275869      C 
   -1.35342317472513   -3.72626435886153   -1.55625291707600      C 
   -3.88007877371207   -2.31720458587684   -1.49928586008326      C 
   -4.82230260022392   -1.78538887284002   -4.16141417155900      C 
   -3.10576474742750   -0.77824387266102   -5.72073638550117      F 
   -5.61143319795609   -3.92332729543301   -5.28344162742853      F 
   -6.81312739528653   -0.20205881779087   -4.18570704600713      F 
   -3.65211081932391    0.09755485815773    0.10608209319104      C 
   -2.95169161685401   -0.74537792492022    2.54102838668745      O 
   -3.22339837339878    1.04992273781073    4.47864068980284      C 
   -1.76203801465707    1.95823822420402   -1.06543027853396      C 
    3.62997147205157    4.50764499422947   -2.17393781875932      C 
    2.10920231822735    6.50408939897032   -2.32143327944036      C 
    3.81534302355962   -4.66442292876969   -3.01508223809635      H 
   -1.08851042689309   -4.60056734495312    0.29568750926622      H 
   -1.40841097318211   -5.22761923846995   -2.97265292639706      H 
   -5.31544447134359   -3.53029720722715   -0.63174970684177      H 
   -5.51614179718890    1.02907283877097    0.21642781365029      H 
   -2.93475227210062    0.03015766110954    6.23994622789898      H 
   -5.12016484222281    1.88286946998643    4.46808342497237      H 
   -1.82185977800012    2.56617844110595    4.34423757728346      H 
   -1.37694653136652    3.47924432422889    0.27510162688711      H 
   -2.63381080053693    2.81245057029880   -2.73344737314435      H 
    5.65072014674448    4.81128539735295   -2.03709465706727      H 
    0.09940057859484    6.35567142499650   -2.56125302590960      H 
    2.86827605267081    8.38978808544825   -2.25412713278557      H 
$end
           -------------------------------------------------
          |                Final Singlepoint                |
           -------------------------------------------------

          ...................................................
          :                      SETUP                      :
          :.................................................:
          :  # basis functions                  87          :
          :  # atomic orbitals                  86          :
          :  # shells                           48          :
          :  # electrons                        94          :
          :  max. iterations                   250          :
          :  Hamiltonian                  GFN2-xTB          :
          :  restarted?                      false          :
          :  GBSA solvation                  false          :
          :  PC potential                    false          :
          :  electronic temp.          300.0000000     K    :
          :  accuracy                    1.0000000          :
          :  -> integral cutoff          0.2500000E+02      :
          :  -> integral neglect         0.1000000E-07      :
          :  -> SCF convergence          0.1000000E-05 Eh   :
          :  -> wf. convergence          0.1000000E-03 e    :
          :  Broyden damping             0.4000000          :
          ...................................................

 iter      E             dE          RMSdq      gap      omega  full diag
   1    -54.3904921 -0.543905E+02  0.101E-04    3.10       0.0  T
   2    -54.3904921 -0.406857E-10  0.460E-05    3.10     396.9  T
   3    -54.3904921 -0.288765E-10  0.389E-05    3.10     468.9  T

   *** convergence criteria satisfied after 3 iterations ***

         #    Occupation            Energy/Eh            Energy/eV
      -------------------------------------------------------------
         1        2.0000           -0.8818502             -23.9964
       ...           ...                  ...                  ...
        41        2.0000           -0.4569895             -12.4353
        42        2.0000           -0.4483912             -12.2013
        43        2.0000           -0.4353995             -11.8478
        44        2.0000           -0.4327636             -11.7761
        45        2.0000           -0.4148006             -11.2873
        46        2.0000           -0.3911675             -10.6442
        47        2.0000           -0.3772906             -10.2666 (HOMO)
        48                         -0.2634879              -7.1699 (LUMO)
        49                         -0.2063050              -5.6138
        50                         -0.1981740              -5.3926
        51                         -0.1519854              -4.1357
        52                         -0.1151109              -3.1323
       ...                                ...                  ...
        86                          0.6776656              18.4402
      -------------------------------------------------------------
                  HL-Gap            0.1138028 Eh            3.0967 eV
             Fermi-level           -0.3203892 Eh           -8.7182 eV

 SCC (total)                   0 d,  0 h,  0 min,  0.042 sec
 SCC setup                      ...        0 min,  0.000 sec (  0.615%)
 Dispersion                     ...        0 min,  0.000 sec (  0.623%)
 integral evaluation            ...        0 min,  0.014 sec ( 33.802%)
 zeroth order Hamiltonian       ...        0 min,  0.000 sec (  0.585%)
 iterations                     ...        0 min,  0.006 sec ( 13.005%)
 molecular gradient             ...        0 min,  0.021 sec ( 50.251%)
 printout                       ...        0 min,  0.000 sec (  0.960%)

         :::::::::::::::::::::::::::::::::::::::::::::::::::::
         ::                     SUMMARY                     ::
         :::::::::::::::::::::::::::::::::::::::::::::::::::::
         :: total energy             -53.829881538865 Eh    ::
         :: gradient norm              0.000675431783 Eh/a0 ::
         :: HOMO-LUMO gap              3.096730519670 eV    ::
         ::.................................................::
         :: SCC energy               -54.390492074249 Eh    ::
         :: -> isotropic ES            0.061196892254 Eh    ::
         :: -> anisotropic ES          0.002583767483 Eh    ::
         :: -> anisotropic XC         -0.005085689491 Eh    ::
         :: -> dispersion             -0.032260293585 Eh    ::
         :: repulsion energy           0.560084137893 Eh    ::
         :: add. restraining           0.000000000000 Eh    ::
         :::::::::::::::::::::::::::::::::::::::::::::::::::::

           -------------------------------------------------
          |                Property Printout                |
           -------------------------------------------------

    * Orbital Energies and Occupations

         #    Occupation            Energy/Eh            Energy/eV
      -------------------------------------------------------------
         1        2.0000           -0.8818502             -23.9964
       ...           ...                  ...                  ...
        35        2.0000           -0.4930994             -13.4179
        36        2.0000           -0.4821990             -13.1213
        37        2.0000           -0.4768310             -12.9752
        38        2.0000           -0.4695346             -12.7767
        39        2.0000           -0.4687238             -12.7546
        40        2.0000           -0.4593104             -12.4985
        41        2.0000           -0.4569895             -12.4353
        42        2.0000           -0.4483912             -12.2013
        43        2.0000           -0.4353995             -11.8478
        44        2.0000           -0.4327636             -11.7761
        45        2.0000           -0.4148006             -11.2873
        46        2.0000           -0.3911675             -10.6442
        47        2.0000           -0.3772906             -10.2666 (HOMO)
        48                         -0.2634879              -7.1699 (LUMO)
        49                         -0.2063050              -5.6138
        50                         -0.1981740              -5.3926
        51                         -0.1519854              -4.1357
        52                         -0.1151109              -3.1323
        53                         -0.0209242              -0.5694
        54                         -0.0047325              -0.1288
        55                          0.0084377               0.2296
        56                          0.0139760               0.3803
        57                          0.0319341               0.8690
        58                          0.0340413               0.9263
       ...                                ...                  ...
        86                          0.6776656              18.4402
      -------------------------------------------------------------
                  HL-Gap            0.1138028 Eh            3.0967 eV
             Fermi-level           -0.3203892 Eh           -8.7182 eV

     #   Z        covCN         q      C6AA      α(0)
     1   6 C      2.937    -0.032    28.806     8.802
     2  16 S      2.344    -0.030   142.276    20.076
     3   6 C      2.987     0.014    27.695     8.633
     4   6 C      3.157    -0.009    27.921     8.640
     5   6 C      3.163    -0.005    27.802     8.618
     6   6 C      3.810    -0.058    21.611     6.617
     7   6 C      3.858    -0.039    21.235     6.554
     8   6 C      3.332     0.482    17.399     6.615
     9   9 F      0.791    -0.199    11.224     3.958
    10   9 F      0.792    -0.208    11.322     3.975
    11   9 F      0.791    -0.214    11.376     3.984
    12   6 C      3.750     0.121    18.658     6.160
    13   8 O      1.702    -0.311    19.181     5.913
    14   6 C      3.645     0.039    20.253     6.468
    15   6 C      3.806    -0.066    21.754     6.640
    16   6 C      2.936    -0.030    28.738     8.792
    17   6 C      2.838    -0.094    30.348     9.028
    18   1 H      0.926     0.045     2.382     2.413
    19   1 H      0.924     0.076     2.024     2.225
    20   1 H      0.924     0.055     2.262     2.352
    21   1 H      0.924     0.073     2.054     2.241
    22   1 H      0.923     0.023     2.684     2.562
    23   1 H      0.925     0.064     2.153     2.295
    24   1 H      0.924     0.031     2.569     2.506
    25   1 H      0.924     0.034     2.525     2.485
    26   1 H      0.924     0.055     2.264     2.353
    27   1 H      0.924     0.052     2.299     2.371
    28   1 H      0.925     0.045     2.381     2.413
    29   1 H      0.926     0.042     2.419     2.432
    30   1 H      0.926     0.042     2.419     2.432

 Mol. C6AA /au·bohr⁶  :      10972.121715
 Mol. C8AA /au·bohr⁸  :     279658.081026
 Mol. α(0) /au        :        160.552515


Wiberg/Mayer (AO) data.
largest (>0.10) Wiberg bond orders for each atom
          total WBO             WBO to atom ...
     1  C   3.948        C    5 1.578    S    2 1.199    H   18 0.970    C    3 0.103
     2  S   2.615        C    1 1.199    C    3 1.132
     3  C   3.947        C    4 1.501    S    2 1.132    C   16 1.130    C    1 0.103
     4  C   3.985        C    3 1.501    C    5 1.249    C   15 1.012
     5  C   3.985        C    1 1.578    C    4 1.249    C    6 1.008
     6  C   3.990        C    5 1.008    C    7 0.988    H   20 0.967    H   19 0.956
     7  C   3.980        C    6 0.988    C   12 0.973    H   21 0.958    C    8 0.948
     8  C   3.825        F    9 0.956    C    7 0.948    F   10 0.946    F   11 0.941
     9  F   1.081        C    8 0.956
    10  F   1.068        C    8 0.946
    11  F   1.064        C    8 0.941
    12  C   3.958        C   15 0.982    O   13 0.981    C    7 0.973    H   22 0.957
    13  O   2.079        C   14 0.993    C   12 0.981
    14  C   3.949        O   13 0.993    H   23 0.979    H   24 0.976    H   25 0.975
    15  C   3.997        C    4 1.012    C   12 0.982    H   26 0.958    H   27 0.956
    16  C   3.991        C   17 1.866    C    3 1.130    H   28 0.962
    17  C   3.991        C   16 1.866    H   30 0.977    H   29 0.973
    18  H   0.997        C    1 0.970
    19  H   0.994        C    6 0.956
    20  H   0.997        C    6 0.967
    21  H   0.994        C    7 0.958
    22  H   0.998        C   12 0.957
    23  H   0.996        C   14 0.979
    24  H   0.999        C   14 0.976
    25  H   0.999        C   14 0.975
    26  H   0.997        C   15 0.958
    27  H   0.997        C   15 0.956
    28  H   0.997        C   16 0.962
    29  H   0.998        C   17 0.973
    30  H   0.998        C   17 0.977

molecular dipole:
                 x           y           z       tot (Debye)
 q only:        0.337       0.250       1.146
   full:       -0.118       0.300       1.214       3.193
molecular quadrupole (traceless):
                xx          xy          yy          xz          yz          zz
 q only:       -3.033      -2.217       8.089      -9.363      -0.099      -5.056
  q+dip:       -3.118      -3.029      10.692      -8.058       0.136      -7.574
   full:       -4.341      -3.028      10.202      -7.997       0.482      -5.861

           -------------------------------------------------
          |                Geometry Summary                 |
           -------------------------------------------------

      molecular mass/u    :      262.2893000
   center of mass at/Å    :       -0.5103996      -0.1055427      -1.1032675
  moments of inertia/u·Å² :        0.8860152E+03   0.1529860E+04   0.1737438E+04
rotational constants/cm⁻¹ :        0.1902635E-01   0.1101907E-01   0.9702583E-02

 * 30 selected distances

     #   Z        #   Z                                     value/Å
     1   6 C      2  16 S                                 1.7119842
     2  16 S      3   6 C                                 1.7423996 (max)
     3   6 C      4   6 C                                 1.3749178
     1   6 C      5   6 C                                 1.3612304
     4   6 C      5   6 C                                 1.4181862
     5   6 C      6   6 C                                 1.4975694
     6   6 C      7   6 C                                 1.5312056
     7   6 C      8   6 C                                 1.5206404
     8   6 C      9   9 F                                 1.3379218
     8   6 C     10   9 F                                 1.3441991
     8   6 C     11   9 F                                 1.3461200
     7   6 C     12   6 C                                 1.5391909
    12   6 C     13   8 O                                 1.4130208
    13   8 O     14   6 C                                 1.4051894
     4   6 C     15   6 C                                 1.4957187
    12   6 C     15   6 C                                 1.5343366
    16   6 C     17   6 C                                 1.3303609
     1   6 C     18   1 H                                 1.0718176 (min)
     6   6 C     19   1 H                                 1.0927565
     6   6 C     20   1 H                                 1.0926298
     7   6 C     21   1 H                                 1.0953442
    12   6 C     22   1 H                                 1.1042591
    14   6 C     23   1 H                                 1.0877695
    14   6 C     24   1 H                                 1.0962574
    14   6 C     25   1 H                                 1.0949502
    15   6 C     26   1 H                                 1.0920533
    15   6 C     27   1 H                                 1.0937401
    16   6 C     28   1 H                                 1.0837608
    17   6 C     29   1 H                                 1.0739619
    17   6 C     30   1 H                                 1.0762720

 * 5 distinct bonds (by element types)

   Z      Z             #   av. dist./Å        max./Å        min./Å
   1 H    6 C          13     1.0888902     1.1042591     1.0718176
   6 C    6 C          10     1.4603357     1.5391909     1.3303609
   6 C    8 O           2     1.4091051     1.4130208     1.4051894
   6 C    9 F           3     1.3427470     1.3461200     1.3379218
   6 C   16 S           2     1.7271919     1.7423996     1.7119842


optimized geometry written to: xtbopt.xyz


           -------------------------------------------------
          | TOTAL ENERGY              -53.829881538865 Eh   |
          | GRADIENT NORM               0.000675431783 Eh/α |
          | HOMO-LUMO GAP               3.096730519670 eV   |
           -------------------------------------------------

------------------------------------------------------------------------
 * finished run on 2021/05/19 at 10:59:11.476     
------------------------------------------------------------------------
 total:
 * wall-time:     0 d,  0 h,  0 min,  1.516 sec
 *  cpu-time:     0 d,  0 h,  0 min,  1.488 sec
 * ratio c/w:     0.982 speedup
 SCF:
 * wall-time:     0 d,  0 h,  0 min,  0.058 sec
 *  cpu-time:     0 d,  0 h,  0 min,  0.058 sec
 * ratio c/w:     1.000 speedup
 ANC optimizer:
 * wall-time:     0 d,  0 h,  0 min,  1.417 sec
 *  cpu-time:     0 d,  0 h,  0 min,  1.404 sec
 * ratio c/w:     0.991 speedup

