      -----------------------------------------------------------      
     |                   =====================                   |     
     |                           x T B                           |     
     |                   =====================                   |     
     |                         S. Grimme                         |     
     |          Mulliken Center for Theoretical Chemistry        |     
     |                    University of Bonn                     |     
     |                Version 6.2 RC2 (SAW190805)                |     
      -----------------------------------------------------------      

   This program is distributed in the hope that it will be useful,
   but WITHOUT ANY WARRANTY; without even the implied warranty of
   MERCHANTABILITY or FITNESS FOR A PARTICULAR PURPOSE.
   
   FOR NON-COMMERCIAL, ACADEMIA USE ONLY.
   
   Cite this work as:
   * S. Grimme, C. Bannwarth, P. Shushkov, J. Chem. Theory Comput., 2017,
     13, 1989-2009. DOI: 10.1021/acs.jctc.7b00118
   * C. Bannwarth, S. Ehlert and S. Grimme., J. Chem. Theory Comput., 2019,
     15, 1652-1671. DOI: 10.1021/acs.jctc.8b01176
   * P. Pracht, E. Caldeweyher, S. Ehlert, S. Grimme, ChemRxiv, 2019, preprint.
     DOI: 10.26434/chemrxiv.8326202.v1
   
   for DFT-D4:
   * E. Caldeweyher, C. Bannwarth and S. Grimme, J. Chem. Phys., 2017,
     147, 034112. DOI: 10.1063/1.4993215
   * E. Caldeweyher, S. Ehlert, A. Hansen, H. Neugebauer, S. Spicher,
     C. Bannwarth and S. Grimme, J. Chem. Phys., 2019, 150, 154122.
     DOI: 10.1063/1.5090222
   
   for sTDA-xTB:
   * S. Grimme and C. Bannwarth, J. Chem. Phys., 2016, 145, 054103.
     DOI: 10.1063/1.4959605
   
   in the mass-spec context:
   * V. Asgeirsson, C. Bauer and S. Grimme, Chem. Sci., 2017, 8, 4879.
     DOI: 10.1039/c7sc00601b
   
   for metadynamics refer to:
   * S. Grimme, J. Chem. Theory Comput., 2019, 155, 2847-2862
     DOI: 10.1021/acs.jctc.9b00143
   
   with help from (in alphabetical order)
   C. Bannwarth, F. Bohle, G. Brandenburg, E. Caldeweyher, M. Checinski,
   S. Dohm, S. Ehlert, S. Ehrlich, F. März, H. Neugebauer, J. Pisarek,
   P. Pracht, P. Shushkov, and S. Spicher.
   
 * started run on 2021/05/19 at 10:59:13.501     

           -------------------------------------------------
          |                Calculation Setup                |
           -------------------------------------------------

          program call               : /ihome/ghutchison/geoffh/xtb/xtb 250.xyz -opt
          hostname                   : smp-n83
          coordinate file            : 250.xyz
          omp threads                :                     1
          number of atoms            :                    15
          number of electrons        :                    56
          charge                     :                     0
          spin                       :                   0.0
          first test random number   :      0.36908766877486


########################################################################
# WARNING! Please study the warnings concerning your input carefully
#  - the use of '-opt' is discouraged, please use '--opt' next time
########################################################################

           ------------------------------------------------- 
          |                 G F N 2 - x T B                 |
          | Geometry, Frequencies, Noncovalent interactions |
          |            JCTC 2019 parametrisation            |
           ------------------------------------------------- 
             KAB for C  - Si     :                1.0500
             KAB for H  - Pd     :                0.9500
             k(s)              :                1.8500
             k(p)              :                2.2300
             k(d)              :                2.2300
             k(f)              :                2.0000
             kEN (H0ij)        :               -2.0000
             D4 a1             :                0.5200
             D4 a2             :                5.0000
             D4 s6             :                1.0000
             D4 s8             :                2.7000
             D4 s9             :                5.0000
             alphaj            :                2.0000

  Z AO/shell   Hii/eV     exponent
  1     Wed Apr 25 08:07:45 CEST 2018   EN: 2.200 GM2: 0.406  GM3: 0.0800  RAES: 1.40
     1s    -10.707211    1.230000
  6     Wed Apr 25 08:07:45 CEST 2018   EN: 2.550 GM2: 0.538  GM3: 0.1500  RAES: 3.00
     2s    -13.970922    2.096432
     2p    -10.063292    1.800000
  9     Mon Apr 23 13:58:50 CEST 2018   EN: 3.980 GM2: 0.532  GM3: 0.1426  RAES: 2.40
     2s    -23.458179    2.416361
     2p    -15.746583    2.308399
 16     Tue Apr 24 11:44:34 CEST 2018   EN: 2.580 GM2: 0.340  GM3:-0.0502  RAES: 3.10
     3s    -20.029654    1.981333
     3p    -11.377694    2.025643
     3d     -0.420282    1.702555

           ------------------------------------------------- 
          |        Self-Consistent Charge Iterations        |
           ------------------------------------------------- 

          ...................................................
          :                      SETUP                      :
          :.................................................:
          :  # basis functions                  54          :
          :  # atomic orbitals                  53          :
          :  # shells                           27          :
          :  # electrons                        56          :
          :  max. iterations                   250          :
          :  Hamiltonian                  GFN2-xTB          :
          :  restarted?                      false          :
          :  GBSA solvation                  false          :
          :  PC potential                    false          :
          :  electronic temp.          300.0000000     K    :
          :  accuracy                    1.0000000          :
          :  -> integral cutoff          0.2500000E+02      :
          :  -> integral neglect         0.1000000E-07      :
          :  -> SCF convergence          0.1000000E-05 Eh   :
          :  -> wf. convergence          0.1000000E-03 e    :
          :  Broyden damping             0.4000000          :
          ...................................................

 iter      E             dE          RMSdq      gap      omega  full diag
   1    -32.1890012 -0.321890E+02  0.444E+00    2.17       0.0  T
   2    -32.2063733 -0.173720E-01  0.290E+00    2.19       1.0  T
   3    -32.1947882  0.115851E-01  0.153E+00    2.25       1.0  T
   4    -32.2162886 -0.215004E-01  0.385E-01    2.19       1.0  T
   5    -32.2175432 -0.125452E-02  0.117E-01    2.20       1.0  T
   6    -32.2175988 -0.556663E-04  0.346E-02    2.20       1.0  T
   7    -32.2176021 -0.327386E-05  0.156E-02    2.20       1.6  T
   8    -32.2176024 -0.320998E-06  0.791E-03    2.20       3.3  T
   9    -32.2176027 -0.226637E-06  0.212E-03    2.20      12.2  T
  10    -32.2176027 -0.214040E-07  0.503E-04    2.20      51.3  T
  11    -32.2176027 -0.124146E-09  0.134E-04    2.20     193.4  T

   *** convergence criteria satisfied after 11 iterations ***

         #    Occupation            Energy/Eh            Energy/eV
      -------------------------------------------------------------
         1        2.0000           -0.8310088             -22.6129
       ...           ...                  ...                  ...
        22        2.0000           -0.4877229             -13.2716
        23        2.0000           -0.4623624             -12.5815
        24        2.0000           -0.4613497             -12.5540
        25        2.0000           -0.4469371             -12.1618
        26        2.0000           -0.4414397             -12.0122
        27        2.0000           -0.4197782             -11.4227
        28        2.0000           -0.3801063             -10.3432 (HOMO)
        29                         -0.2992296              -8.1425 (LUMO)
        30                         -0.2298446              -6.2544
        31                         -0.2198055              -5.9812
        32                         -0.2154884              -5.8637
        33                         -0.1382369              -3.7616
       ...                                ...                  ...
        53                          0.7266415              19.7729
      -------------------------------------------------------------
                  HL-Gap            0.0808767 Eh            2.2008 eV
             Fermi-level           -0.3396679 Eh           -9.2428 eV

 SCC (total)                   0 d,  0 h,  0 min,  0.025 sec
 SCC setup                      ...        0 min,  0.000 sec (  0.998%)
 Dispersion                     ...        0 min,  0.000 sec (  0.784%)
 integral evaluation            ...        0 min,  0.006 sec ( 24.358%)
 zeroth order Hamiltonian       ...        0 min,  0.000 sec (  0.492%)
 iterations                     ...        0 min,  0.009 sec ( 37.585%)
 molecular gradient             ...        0 min,  0.008 sec ( 34.284%)
 printout                       ...        0 min,  0.000 sec (  1.280%)

         :::::::::::::::::::::::::::::::::::::::::::::::::::::
         ::                     SUMMARY                     ::
         :::::::::::::::::::::::::::::::::::::::::::::::::::::
         :: total energy             -31.848050009948 Eh    ::
         :: gradient norm              0.106682909948 Eh/a0 ::
         :: HOMO-LUMO gap              2.200766896547 eV    ::
         ::.................................................::
         :: SCC energy               -32.217602677428 Eh    ::
         :: -> isotropic ES            0.020675149848 Eh    ::
         :: -> anisotropic ES         -0.000105062466 Eh    ::
         :: -> anisotropic XC          0.001099201447 Eh    ::
         :: -> dispersion             -0.015500044302 Eh    ::
         :: repulsion energy           0.369510447943 Eh    ::
         :: add. restraining           0.000000000000 Eh    ::
         :::::::::::::::::::::::::::::::::::::::::::::::::::::

      ----------------------------------------------------------- 
     |                   =====================                   |
     |                        A N C O P T                        |
     |                   =====================                   |
     |               Approximate Normal Coordinate               |
     |                Rational Function Optimizer                |
      ----------------------------------------------------------- 

          ...................................................
          :                      SETUP                      :
          :.................................................:
          :   optimization level            normal          :
          :   max. optcycles                   200          :
          :   ANC micro-cycles                  20          :
          :   degrees of freedom                39          :
          :.................................................:
          :   RF solver                   davidson          :
          :   input Hessian                  false          :
          :   write xtbopt.log                true          :
          :   linear?                        false          :
          :   energy convergence         0.5000000E-05 Eh   :
          :   grad. convergence          0.1000000E-02 Eh/α :
          :   maximium RF displ.         2.0000000          :
          :   Hlow (freq-cutoff)         0.5000000E-02      :
          :   Hmax (freq-cutoff)         5.0000000          :
          :   S6 in model hess.         20.0000000          :
          ...................................................

generating ANC from model Hessian ...
Using Lindh-Hessian (1995)
 Shifting diagonal of input Hessian by   0.000000000000000E+000
 Lowest  eigenvalues of input Hessian
   -0.000000   -0.000000   -0.000000    0.000000    0.000000    0.000000
    0.007156    0.008814    0.017291    0.019917    0.020811    0.038443
    0.048620    0.066016    0.067053    0.080621    0.089223    0.091985
 Highest eigenvalues
    1.576803    1.747985    1.875702    1.896318    2.086695    2.128334
 

........................................................................
.............................. CYCLE    1 ..............................
........................................................................
   1    -32.2176027 -0.322176E+02  0.433E-05    2.20       0.0  T
   2    -32.2176027 -0.324007E-11  0.201E-05    2.20    1285.6  T
   3    -32.2176027  0.852651E-13  0.124E-05    2.20    2074.9  T
     SCC iter.                  ...        0 min,  0.003 sec
     gradient                   ...        0 min,  0.008 sec
 * total energy  :   -31.8480500 Eh     change        0.3839911E-08 Eh
   gradient norm :     0.1066821 Eh/α   predicted     0.0000000E+00 (-100.00%)
   displ. norm   :     0.2680972 α      lambda       -0.1600397E-01
   maximum displ.:     0.1638671 α      in ANC's #8, #16, #17, ...

........................................................................
.............................. CYCLE    2 ..............................
........................................................................
   1    -32.2444747 -0.322445E+02  0.257E-01    2.30       0.0  T
   2    -32.2445753 -0.100513E-03  0.162E-01    2.29       1.0  T
   3    -32.2445793 -0.406946E-05  0.836E-02    2.29       1.0  T
   4    -32.2446255 -0.461320E-04  0.274E-02    2.29       1.0  T
   5    -32.2446301 -0.460387E-05  0.806E-03    2.29       3.2  T
   6    -32.2446306 -0.575182E-06  0.305E-03    2.29       8.5  T
   7    -32.2446307 -0.514577E-07  0.121E-03    2.29      21.4  T
     SCC iter.                  ...        0 min,  0.005 sec
     gradient                   ...        0 min,  0.008 sec
 * total energy  :   -31.8591333 Eh     change       -0.1108329E-01 Eh
   gradient norm :     0.0544533 Eh/α   predicted    -0.8577138E-02 ( -22.61%)
   displ. norm   :     0.1574464 α      lambda       -0.4664621E-02
   maximum displ.:     0.1030888 α      in ANC's #16, #8, #21, ...

........................................................................
.............................. CYCLE    3 ..............................
........................................................................
   1    -32.2564543 -0.322565E+02  0.213E-01    2.40       0.0  T
   2    -32.2565245 -0.701619E-04  0.131E-01    2.40       1.0  T
   3    -32.2565304 -0.590516E-05  0.688E-02    2.39       1.0  T
   4    -32.2565618 -0.314016E-04  0.206E-02    2.39       1.3  T
   5    -32.2565628 -0.102480E-05  0.703E-03    2.39       3.7  T
   6    -32.2565634 -0.592439E-06  0.209E-03    2.39      12.4  T
   7    -32.2565634 -0.195258E-07  0.550E-04    2.39      47.0  T
     SCC iter.                  ...        0 min,  0.005 sec
     gradient                   ...        0 min,  0.008 sec
 * total energy  :   -31.8616479 Eh     change       -0.2514573E-02 Eh
   gradient norm :     0.0150218 Eh/α   predicted    -0.2390126E-02 (  -4.95%)
   displ. norm   :     0.0385547 α      lambda       -0.2698789E-03
   maximum displ.:     0.0285999 α      in ANC's #14, #11, #16, ...

........................................................................
.............................. CYCLE    4 ..............................
........................................................................
   1    -32.2546762 -0.322547E+02  0.512E-02    2.41       0.0  T
   2    -32.2546808 -0.458226E-05  0.306E-02    2.40       1.0  T
   3    -32.2546809 -0.454503E-07  0.176E-02    2.40       1.5  T
   4    -32.2546826 -0.172979E-05  0.469E-03    2.40       5.5  T
   5    -32.2546827 -0.541632E-07  0.183E-03    2.40      14.1  T
   6    -32.2546827 -0.391426E-07  0.676E-04    2.40      38.2  T
     SCC iter.                  ...        0 min,  0.005 sec
     gradient                   ...        0 min,  0.008 sec
 * total energy  :   -31.8618219 Eh     change       -0.1740302E-03 Eh
   gradient norm :     0.0063386 Eh/α   predicted    -0.1351399E-03 ( -22.35%)
   displ. norm   :     0.0166999 α      lambda       -0.4904608E-04
   maximum displ.:     0.0103245 α      in ANC's #14, #8, #17, ...

........................................................................
.............................. CYCLE    5 ..............................
........................................................................
   1    -32.2541773 -0.322542E+02  0.248E-02    2.41       0.0  T
   2    -32.2541786 -0.127934E-05  0.145E-02    2.41       1.8  T
   3    -32.2541786 -0.226488E-07  0.816E-03    2.41       3.2  T
   4    -32.2541789 -0.294512E-06  0.270E-03    2.41       9.6  T
   5    -32.2541789 -0.385700E-07  0.989E-04    2.41      26.1  T
     SCC iter.                  ...        0 min,  0.004 sec
     gradient                   ...        0 min,  0.008 sec
 * total energy  :   -31.8618486 Eh     change       -0.2672285E-04 Eh
   gradient norm :     0.0016189 Eh/α   predicted    -0.2452894E-04 (  -8.21%)
   displ. norm   :     0.0078608 α      lambda       -0.2910223E-05
   maximum displ.:     0.0055591 α      in ANC's #5, #3, #7, ...

........................................................................
.............................. CYCLE    6 ..............................
........................................................................
   1    -32.2542773 -0.322543E+02  0.222E-02    2.41       0.0  T
   2    -32.2542776 -0.266533E-06  0.106E-02    2.41       2.4  T
   3    -32.2542776  0.572967E-07  0.356E-03    2.41       7.3  T
   4    -32.2542777 -0.110078E-06  0.159E-03    2.41      16.2  T
   5    -32.2542777 -0.969349E-08  0.651E-04    2.41      39.6  T
   6    -32.2542777 -0.758675E-09  0.111E-04    2.41     233.1  T
     SCC iter.                  ...        0 min,  0.005 sec
     gradient                   ...        0 min,  0.008 sec
 * total energy  :   -31.8618499 Eh     change       -0.1323448E-05 Eh
   gradient norm :     0.0004364 Eh/α   predicted    -0.1453557E-05 (   9.83%)
   displ. norm   :     0.0069061 α      lambda       -0.1192094E-05
   maximum displ.:     0.0050447 α      in ANC's #5, #3, #7, ...

   *** GEOMETRY OPTIMIZATION CONVERGED AFTER 6 ITERATIONS ***

------------------------------------------------------------------------
 total energy gain   :        -0.0137999 Eh       -8.6596 kcal/mol
 total RMSD          :         0.1089394 a0        0.0576 Å
 total power (kW/mol):        -6.0386209 (step) -312.1354 (real)
------------------------------------------------------------------------

 ANCopt (total)                0 d,  0 h,  0 min,  0.116 sec
 optimizer setup                ...        0 min,  0.000 sec (  0.129%)
 model hessian                  ...        0 min,  0.001 sec (  1.224%)
 ANC generation                 ...        0 min,  0.000 sec (  0.336%)
 coordinate transformation      ...        0 min,  0.000 sec (  0.067%)
 single point calculation       ...        0 min,  0.112 sec ( 96.497%)
 optimization log               ...        0 min,  0.000 sec (  0.394%)
 hessian update                 ...        0 min,  0.000 sec (  0.054%)
 rational function              ...        0 min,  0.001 sec (  0.911%)

================
 final structure:
================
$coord
   -2.89307115187182   -2.33259528426972    0.29653010868665      C 
   -5.10981557144216    0.00000002822455    0.45475247517003      S 
   -2.89307114099850    2.33259527574217    0.29653010634237      C 
   -0.48826366446853    1.36043531063197    0.13069114463825      C 
   -0.48826366199514   -1.36043531326652    0.13069114490533      C 
    1.86487785632300   -2.63117555140607   -0.03213760440474      C 
    1.86059303009238   -5.18057742216672   -0.03240461759002      F 
    4.07715774526331   -1.33718727543910   -0.18565853368535      C 
    4.07715774660059    1.33718728751777   -0.18565853020433      C 
    1.86487784728981    2.63117554913604   -0.03213760274941      C 
    1.86059301337910    5.18057739433627   -0.03240461549811      F 
   -3.44210055202945   -4.28054410795367    0.33381596935380      H 
   -3.44210054338884    4.28054409999915    0.33381596548147      H 
    5.84051418477578   -2.34854093738004   -0.30885752195893      H 
    5.84051418803483    2.34854094629392   -0.30885751986685      H 
$end
           -------------------------------------------------
          |                Final Singlepoint                |
           -------------------------------------------------

          ...................................................
          :                      SETUP                      :
          :.................................................:
          :  # basis functions                  54          :
          :  # atomic orbitals                  53          :
          :  # shells                           27          :
          :  # electrons                        56          :
          :  max. iterations                   250          :
          :  Hamiltonian                  GFN2-xTB          :
          :  restarted?                      false          :
          :  GBSA solvation                  false          :
          :  PC potential                    false          :
          :  electronic temp.          300.0000000     K    :
          :  accuracy                    1.0000000          :
          :  -> integral cutoff          0.2500000E+02      :
          :  -> integral neglect         0.1000000E-07      :
          :  -> SCF convergence          0.1000000E-05 Eh   :
          :  -> wf. convergence          0.1000000E-03 e    :
          :  Broyden damping             0.4000000          :
          ...................................................

 iter      E             dE          RMSdq      gap      omega  full diag
   1    -32.2542777 -0.322543E+02  0.484E-05    2.41       0.0  T
   2    -32.2542777 -0.525091E-11  0.200E-05    2.41    1289.9  T
   3    -32.2542777 -0.165556E-11  0.204E-05    2.41    1264.8  T

   *** convergence criteria satisfied after 3 iterations ***

         #    Occupation            Energy/Eh            Energy/eV
      -------------------------------------------------------------
         1        2.0000           -0.8249515             -22.4481
       ...           ...                  ...                  ...
        22        2.0000           -0.4823408             -13.1252
        23        2.0000           -0.4668306             -12.7031
        24        2.0000           -0.4642645             -12.6333
        25        2.0000           -0.4540487             -12.3553
        26        2.0000           -0.4384570             -11.9310
        27        2.0000           -0.4227433             -11.5034
        28        2.0000           -0.3848457             -10.4722 (HOMO)
        29                         -0.2963708              -8.0647 (LUMO)
        30                         -0.2265383              -6.1644
        31                         -0.2165930              -5.8938
        32                         -0.2162218              -5.8837
        33                         -0.1350788              -3.6757
       ...                                ...                  ...
        53                          0.7235408              19.6885
      -------------------------------------------------------------
                  HL-Gap            0.0884749 Eh            2.4075 eV
             Fermi-level           -0.3406083 Eh           -9.2684 eV

 SCC (total)                   0 d,  0 h,  0 min,  0.018 sec
 SCC setup                      ...        0 min,  0.000 sec (  0.835%)
 Dispersion                     ...        0 min,  0.000 sec (  0.590%)
 integral evaluation            ...        0 min,  0.006 sec ( 32.535%)
 zeroth order Hamiltonian       ...        0 min,  0.000 sec (  0.608%)
 iterations                     ...        0 min,  0.003 sec ( 15.872%)
 molecular gradient             ...        0 min,  0.008 sec ( 47.694%)
 printout                       ...        0 min,  0.000 sec (  1.578%)

         :::::::::::::::::::::::::::::::::::::::::::::::::::::
         ::                     SUMMARY                     ::
         :::::::::::::::::::::::::::::::::::::::::::::::::::::
         :: total energy             -31.861849945749 Eh    ::
         :: gradient norm              0.000436366985 Eh/a0 ::
         :: HOMO-LUMO gap              2.407523238054 eV    ::
         ::.................................................::
         :: SCC energy               -32.254277672977 Eh    ::
         :: -> isotropic ES            0.023250285049 Eh    ::
         :: -> anisotropic ES         -0.001010295691 Eh    ::
         :: -> anisotropic XC          0.001007755094 Eh    ::
         :: -> dispersion             -0.015485779203 Eh    ::
         :: repulsion energy           0.392386672337 Eh    ::
         :: add. restraining           0.000000000000 Eh    ::
         :::::::::::::::::::::::::::::::::::::::::::::::::::::

           -------------------------------------------------
          |                Property Printout                |
           -------------------------------------------------

    * Orbital Energies and Occupations

         #    Occupation            Energy/Eh            Energy/eV
      -------------------------------------------------------------
         1        2.0000           -0.8249515             -22.4481
       ...           ...                  ...                  ...
        16        2.0000           -0.5299118             -14.4196
        17        2.0000           -0.5104470             -13.8900
        18        2.0000           -0.5086206             -13.8403
        19        2.0000           -0.5047852             -13.7359
        20        2.0000           -0.4927573             -13.4086
        21        2.0000           -0.4866836             -13.2433
        22        2.0000           -0.4823408             -13.1252
        23        2.0000           -0.4668306             -12.7031
        24        2.0000           -0.4642645             -12.6333
        25        2.0000           -0.4540487             -12.3553
        26        2.0000           -0.4384570             -11.9310
        27        2.0000           -0.4227433             -11.5034
        28        2.0000           -0.3848457             -10.4722 (HOMO)
        29                         -0.2963708              -8.0647 (LUMO)
        30                         -0.2265383              -6.1644
        31                         -0.2165930              -5.8938
        32                         -0.2162218              -5.8837
        33                         -0.1350788              -3.6757
        34                         -0.1103401              -3.0025
        35                         -0.0183133              -0.4983
        36                          0.0094938               0.2583
        37                          0.0188585               0.5132
        38                          0.0213280               0.5804
        39                          0.0573771               1.5613
       ...                                ...                  ...
        53                          0.7235408              19.6885
      -------------------------------------------------------------
                  HL-Gap            0.0884749 Eh            2.4075 eV
             Fermi-level           -0.3406083 Eh           -9.2684 eV

     #   Z        covCN         q      C6AA      α(0)
     1   6 C      2.928    -0.030    28.747     8.793
     2  16 S      2.321     0.059   138.660    19.819
     3   6 C      2.928    -0.030    28.747     8.793
     4   6 C      3.185    -0.014    27.899     8.620
     5   6 C      3.185    -0.014    27.899     8.620
     6   6 C      2.770     0.159    24.556     8.116
     7   9 F      0.787    -0.221    11.449     3.997
     8   6 C      2.916    -0.055    29.379     8.888
     9   6 C      2.916    -0.055    29.379     8.888
    10   6 C      2.770     0.159    24.556     8.116
    11   9 F      0.787    -0.221    11.449     3.997
    12   1 H      0.926     0.065     2.144     2.290
    13   1 H      0.926     0.065     2.144     2.290
    14   1 H      0.926     0.067     2.118     2.276
    15   1 H      0.926     0.067     2.118     2.276

 Mol. C6AA /au·bohr⁶  :       4374.712425
 Mol. C8AA /au·bohr⁸  :     126412.979293
 Mol. α(0) /au        :        105.777154


Wiberg/Mayer (AO) data.
largest (>0.10) Wiberg bond orders for each atom
          total WBO             WBO to atom ...
     1  C   3.946        C    5 1.470    S    2 1.255    H   12 0.969    C    3 0.148
     2  S   2.756        C    1 1.255    C    3 1.255
     3  C   3.946        C    4 1.470    S    2 1.255    H   13 0.969    C    1 0.148
     4  C   3.987        C    3 1.470    C   10 1.187    C    5 1.153
     5  C   3.987        C    1 1.470    C    6 1.187    C    4 1.153
     6  C   3.886        C    8 1.558    C    5 1.187    F    7 0.960
     7  F   1.094        C    6 0.960
     8  C   3.988        C    6 1.558    C    9 1.261    H   14 0.965
     9  C   3.988        C   10 1.558    C    8 1.261    H   15 0.965
    10  C   3.886        C    9 1.558    C    4 1.187    F   11 0.960
    11  F   1.094        C   10 0.960
    12  H   0.995        C    1 0.969
    13  H   0.995        C    3 0.969
    14  H   0.994        C    8 0.965
    15  H   0.994        C    9 0.965

molecular dipole:
                 x           y           z       tot (Debye)
 q only:       -0.459      -0.000       0.032
   full:       -0.215      -0.000       0.015       0.548
molecular quadrupole (traceless):
                xx          xy          yy          xz          yz          zz
 q only:        8.414       0.000      -9.558      -0.575      -0.000       1.144
  q+dip:        9.567       0.000      -9.924      -0.674      -0.000       0.358
   full:        7.404       0.000      -9.989      -0.369      -0.000       2.585

           -------------------------------------------------
          |                Geometry Summary                 |
           -------------------------------------------------

      molecular mass/u    :      170.1764000
   center of mass at/Å    :       -0.0832628       0.0000000       0.0573071
  moments of inertia/u·Å² :        0.4066714E+03   0.4915015E+03   0.8981727E+03
rotational constants/cm⁻¹ :        0.4145271E-01   0.3429823E-01   0.1876881E-01

 * 14 selected distances

     #   Z        #   Z                                     value/Å
     1   6 C      2  16 S                                 1.7049030 (max)
     2  16 S      3   6 C                                 1.7049029
     3   6 C      4   6 C                                 1.3754229
     1   6 C      5   6 C                                 1.3754229
     4   6 C      5   6 C                                 1.4398229
     5   6 C      6   6 C                                 1.4178168
     6   6 C      8   6 C                                 1.3586730
     8   6 C      9   6 C                                 1.4152182
     4   6 C     10   6 C                                 1.4178168
     9   6 C     10   6 C                                 1.3586730
     1   6 C     12   1 H                                 1.0711531 (min)
     3   6 C     13   1 H                                 1.0711531
     8   6 C     14   1 H                                 1.0776835
     9   6 C     15   1 H                                 1.0776835

 * 3 distinct bonds (by element types)

   Z      Z             #   av. dist./Å        max./Å        min./Å
   1 H    6 C           4     1.0744183     1.0776835     1.0711531
   6 C    6 C           8     1.3948583     1.4398229     1.3586730
   6 C   16 S           2     1.7049029     1.7049030     1.7049029


optimized geometry written to: xtbopt.xyz


           -------------------------------------------------
          | TOTAL ENERGY              -31.861849945749 Eh   |
          | GRADIENT NORM               0.000436366985 Eh/α |
          | HOMO-LUMO GAP               2.407523238054 eV   |
           -------------------------------------------------

------------------------------------------------------------------------
 * finished run on 2021/05/19 at 10:59:13.678     
------------------------------------------------------------------------
 total:
 * wall-time:     0 d,  0 h,  0 min,  0.177 sec
 *  cpu-time:     0 d,  0 h,  0 min,  0.177 sec
 * ratio c/w:     0.997 speedup
 SCF:
 * wall-time:     0 d,  0 h,  0 min,  0.025 sec
 *  cpu-time:     0 d,  0 h,  0 min,  0.025 sec
 * ratio c/w:     0.999 speedup
 ANC optimizer:
 * wall-time:     0 d,  0 h,  0 min,  0.134 sec
 *  cpu-time:     0 d,  0 h,  0 min,  0.134 sec
 * ratio c/w:     1.000 speedup

