      -----------------------------------------------------------      
     |                   =====================                   |     
     |                           x T B                           |     
     |                   =====================                   |     
     |                         S. Grimme                         |     
     |          Mulliken Center for Theoretical Chemistry        |     
     |                    University of Bonn                     |     
     |                Version 6.2 RC2 (SAW190805)                |     
      -----------------------------------------------------------      

   This program is distributed in the hope that it will be useful,
   but WITHOUT ANY WARRANTY; without even the implied warranty of
   MERCHANTABILITY or FITNESS FOR A PARTICULAR PURPOSE.
   
   FOR NON-COMMERCIAL, ACADEMIA USE ONLY.
   
   Cite this work as:
   * S. Grimme, C. Bannwarth, P. Shushkov, J. Chem. Theory Comput., 2017,
     13, 1989-2009. DOI: 10.1021/acs.jctc.7b00118
   * C. Bannwarth, S. Ehlert and S. Grimme., J. Chem. Theory Comput., 2019,
     15, 1652-1671. DOI: 10.1021/acs.jctc.8b01176
   * P. Pracht, E. Caldeweyher, S. Ehlert, S. Grimme, ChemRxiv, 2019, preprint.
     DOI: 10.26434/chemrxiv.8326202.v1
   
   for DFT-D4:
   * E. Caldeweyher, C. Bannwarth and S. Grimme, J. Chem. Phys., 2017,
     147, 034112. DOI: 10.1063/1.4993215
   * E. Caldeweyher, S. Ehlert, A. Hansen, H. Neugebauer, S. Spicher,
     C. Bannwarth and S. Grimme, J. Chem. Phys., 2019, 150, 154122.
     DOI: 10.1063/1.5090222
   
   for sTDA-xTB:
   * S. Grimme and C. Bannwarth, J. Chem. Phys., 2016, 145, 054103.
     DOI: 10.1063/1.4959605
   
   in the mass-spec context:
   * V. Asgeirsson, C. Bauer and S. Grimme, Chem. Sci., 2017, 8, 4879.
     DOI: 10.1039/c7sc00601b
   
   for metadynamics refer to:
   * S. Grimme, J. Chem. Theory Comput., 2019, 155, 2847-2862
     DOI: 10.1021/acs.jctc.9b00143
   
   with help from (in alphabetical order)
   C. Bannwarth, F. Bohle, G. Brandenburg, E. Caldeweyher, M. Checinski,
   S. Dohm, S. Ehlert, S. Ehrlich, F. März, H. Neugebauer, J. Pisarek,
   P. Pracht, P. Shushkov, and S. Spicher.
   
 * started run on 2021/05/19 at 10:59:17.028     

           -------------------------------------------------
          |                Calculation Setup                |
           -------------------------------------------------

          program call               : /ihome/ghutchison/geoffh/xtb/xtb 254.xyz -opt
          hostname                   : smp-n83
          coordinate file            : 254.xyz
          omp threads                :                     1
          number of atoms            :                    29
          number of electrons        :                    82
          charge                     :                     0
          spin                       :                   0.0
          first test random number   :      0.06730184365094


########################################################################
# WARNING! Please study the warnings concerning your input carefully
#  - the use of '-opt' is discouraged, please use '--opt' next time
########################################################################

           ------------------------------------------------- 
          |                 G F N 2 - x T B                 |
          | Geometry, Frequencies, Noncovalent interactions |
          |            JCTC 2019 parametrisation            |
           ------------------------------------------------- 
             KAB for C  - Si     :                1.0500
             KAB for H  - Pd     :                0.9500
             k(s)              :                1.8500
             k(p)              :                2.2300
             k(d)              :                2.2300
             k(f)              :                2.0000
             kEN (H0ij)        :               -2.0000
             D4 a1             :                0.5200
             D4 a2             :                5.0000
             D4 s6             :                1.0000
             D4 s8             :                2.7000
             D4 s9             :                5.0000
             alphaj            :                2.0000

  Z AO/shell   Hii/eV     exponent
  1     Wed Apr 25 08:07:45 CEST 2018   EN: 2.200 GM2: 0.406  GM3: 0.0800  RAES: 1.40
     1s    -10.707211    1.230000
  6     Wed Apr 25 08:07:45 CEST 2018   EN: 2.550 GM2: 0.538  GM3: 0.1500  RAES: 3.00
     2s    -13.970922    2.096432
     2p    -10.063292    1.800000
  7     Wed Apr 25 08:07:45 CEST 2018   EN: 3.040 GM2: 0.461  GM3:-0.0640  RAES: 1.90
     2s    -16.686243    2.339881
     2p    -12.523956    2.014332
 16     Tue Apr 24 11:44:34 CEST 2018   EN: 2.580 GM2: 0.340  GM3:-0.0502  RAES: 3.10
     3s    -20.029654    1.981333
     3p    -11.377694    2.025643
     3d     -0.420282    1.702555

           ------------------------------------------------- 
          |        Self-Consistent Charge Iterations        |
           ------------------------------------------------- 

          ...................................................
          :                      SETUP                      :
          :.................................................:
          :  # basis functions                  89          :
          :  # atomic orbitals                  87          :
          :  # shells                           47          :
          :  # electrons                        82          :
          :  max. iterations                   250          :
          :  Hamiltonian                  GFN2-xTB          :
          :  restarted?                      false          :
          :  GBSA solvation                  false          :
          :  PC potential                    false          :
          :  electronic temp.          300.0000000     K    :
          :  accuracy                    1.0000000          :
          :  -> integral cutoff          0.2500000E+02      :
          :  -> integral neglect         0.1000000E-07      :
          :  -> SCF convergence          0.1000000E-05 Eh   :
          :  -> wf. convergence          0.1000000E-03 e    :
          :  Broyden damping             0.4000000          :
          ...................................................

 iter      E             dE          RMSdq      gap      omega  full diag
   1    -44.4422950 -0.444423E+02  0.452E+00    2.86       0.0  T
   2    -44.4865798 -0.442847E-01  0.252E+00    2.53       1.0  T
   3    -44.4772817  0.929805E-02  0.103E+00    2.44       1.0  T
   4    -44.4889563 -0.116745E-01  0.523E-01    2.43       1.0  T
   5    -44.4924731 -0.351686E-02  0.185E-01    2.47       1.0  T
   6    -44.4927234 -0.250302E-03  0.782E-02    2.46       1.0  T
   7    -44.4927928 -0.693514E-04  0.230E-02    2.46       1.0  T
   8    -44.4927977 -0.493510E-05  0.135E-02    2.47       1.4  T
   9    -44.4927986 -0.881412E-06  0.558E-03    2.46       3.3  T
  10    -44.4927989 -0.303983E-06  0.259E-03    2.46       7.2  T
  11    -44.4927989 -0.319975E-07  0.136E-03    2.46      13.6  T
  12    -44.4927990 -0.202103E-07  0.651E-04    2.46      28.5  T
  13    -44.4927990 -0.827178E-09  0.333E-04    2.46      55.8  T

   *** convergence criteria satisfied after 13 iterations ***

         #    Occupation            Energy/Eh            Energy/eV
      -------------------------------------------------------------
         1        2.0000           -0.7343628             -19.9830
       ...           ...                  ...                  ...
        35        2.0000           -0.4392597             -11.9529
        36        2.0000           -0.4310529             -11.7295
        37        2.0000           -0.4236447             -11.5280
        38        2.0000           -0.4097304             -11.1493
        39        2.0000           -0.3826775             -10.4132
        40        2.0000           -0.3765434             -10.2463
        41        2.0000           -0.3639640              -9.9040 (HOMO)
        42                         -0.2734183              -7.4401 (LUMO)
        43                         -0.2477712              -6.7422
        44                         -0.2353032              -6.4029
        45                         -0.2100625              -5.7161
        46                         -0.1977183              -5.3802
       ...                                ...                  ...
        87                          0.6891090              18.7516
      -------------------------------------------------------------
                  HL-Gap            0.0905457 Eh            2.4639 eV
             Fermi-level           -0.3186911 Eh           -8.6720 eV

 SCC (total)                   0 d,  0 h,  0 min,  0.061 sec
 SCC setup                      ...        0 min,  0.000 sec (  0.620%)
 Dispersion                     ...        0 min,  0.000 sec (  0.808%)
 integral evaluation            ...        0 min,  0.015 sec ( 25.003%)
 zeroth order Hamiltonian       ...        0 min,  0.000 sec (  0.457%)
 iterations                     ...        0 min,  0.023 sec ( 37.343%)
 molecular gradient             ...        0 min,  0.021 sec ( 34.886%)
 printout                       ...        0 min,  0.000 sec (  0.790%)

         :::::::::::::::::::::::::::::::::::::::::::::::::::::
         ::                     SUMMARY                     ::
         :::::::::::::::::::::::::::::::::::::::::::::::::::::
         :: total energy             -43.869506366283 Eh    ::
         :: gradient norm              0.080104719508 Eh/a0 ::
         :: HOMO-LUMO gap              2.463874696631 eV    ::
         ::.................................................::
         :: SCC energy               -44.492798951682 Eh    ::
         :: -> isotropic ES            0.014958158510 Eh    ::
         :: -> anisotropic ES          0.004697091996 Eh    ::
         :: -> anisotropic XC          0.027630850972 Eh    ::
         :: -> dispersion             -0.034412352094 Eh    ::
         :: repulsion energy           0.623034951727 Eh    ::
         :: add. restraining           0.000000000000 Eh    ::
         :::::::::::::::::::::::::::::::::::::::::::::::::::::

      ----------------------------------------------------------- 
     |                   =====================                   |
     |                        A N C O P T                        |
     |                   =====================                   |
     |               Approximate Normal Coordinate               |
     |                Rational Function Optimizer                |
      ----------------------------------------------------------- 

          ...................................................
          :                      SETUP                      :
          :.................................................:
          :   optimization level            normal          :
          :   max. optcycles                   200          :
          :   ANC micro-cycles                  20          :
          :   degrees of freedom                81          :
          :.................................................:
          :   RF solver                   davidson          :
          :   input Hessian                  false          :
          :   write xtbopt.log                true          :
          :   linear?                        false          :
          :   energy convergence         0.5000000E-05 Eh   :
          :   grad. convergence          0.1000000E-02 Eh/α :
          :   maximium RF displ.         2.0000000          :
          :   Hlow (freq-cutoff)         0.5000000E-02      :
          :   Hmax (freq-cutoff)         5.0000000          :
          :   S6 in model hess.         20.0000000          :
          ...................................................

generating ANC from model Hessian ...
Using Lindh-Hessian (1995)
 Shifting diagonal of input Hessian by   4.290922264547675E-003
 Lowest  eigenvalues of input Hessian
   -0.000000   -0.000000    0.000000    0.000000    0.000000    0.000000
    0.005000    0.006488    0.006634    0.007407    0.007852    0.009943
    0.010444    0.012200    0.016142    0.016915    0.018073    0.022188
 Highest eigenvalues
    1.632904    1.763984    1.869210    1.921023    1.988413    2.052400
 

........................................................................
.............................. CYCLE    1 ..............................
........................................................................
   1    -44.4927990 -0.444928E+02  0.127E-04    2.46       0.0  T
   2    -44.4927990 -0.677574E-10  0.810E-05    2.46     229.2  T
   3    -44.4927990 -0.102141E-09  0.543E-05    2.46     342.3  T
     SCC iter.                  ...        0 min,  0.006 sec
     gradient                   ...        0 min,  0.021 sec
 * total energy  :   -43.8695064 Eh     change        0.1408362E-07 Eh
   gradient norm :     0.0801053 Eh/α   predicted     0.0000000E+00 (-100.00%)
   displ. norm   :     0.3027746 α      lambda       -0.8870346E-02
   maximum displ.:     0.1617138 α      in ANC's #12, #21, #5, ...

........................................................................
.............................. CYCLE    2 ..............................
........................................................................
   1    -44.5186237 -0.445186E+02  0.233E-01    2.56       0.0  T
   2    -44.5186781 -0.543989E-04  0.119E-01    2.56       1.0  T
   3    -44.5186220  0.561189E-04  0.703E-02    2.55       1.0  T
   4    -44.5187064 -0.844774E-04  0.239E-02    2.56       1.0  T
   5    -44.5187101 -0.363922E-05  0.950E-03    2.56       2.0  T
   6    -44.5187109 -0.806556E-06  0.395E-03    2.55       4.7  T
   7    -44.5187111 -0.196343E-06  0.145E-03    2.56      12.8  T
     SCC iter.                  ...        0 min,  0.011 sec
     gradient                   ...        0 min,  0.020 sec
 * total energy  :   -43.8755447 Eh     change       -0.6038372E-02 Eh
   gradient norm :     0.0364622 Eh/α   predicted    -0.4841767E-02 ( -19.82%)
   displ. norm   :     0.2381811 α      lambda       -0.2595376E-02
   maximum displ.:     0.1275061 α      in ANC's #12, #5, #6, ...

........................................................................
.............................. CYCLE    3 ..............................
........................................................................
   1    -44.5316337 -0.445316E+02  0.173E-01    2.60       0.0  T
   2    -44.5316652 -0.314857E-04  0.895E-02    2.61       1.0  T
   3    -44.5316322  0.330545E-04  0.527E-02    2.61       1.0  T
   4    -44.5316826 -0.504646E-04  0.175E-02    2.61       1.1  T
   5    -44.5316843 -0.170128E-05  0.698E-03    2.61       2.7  T
   6    -44.5316849 -0.526679E-06  0.298E-03    2.61       6.2  T
   7    -44.5316850 -0.905965E-07  0.122E-03    2.61      15.3  T
     SCC iter.                  ...        0 min,  0.011 sec
     gradient                   ...        0 min,  0.020 sec
 * total energy  :   -43.8770441 Eh     change       -0.1499339E-02 Eh
   gradient norm :     0.0090909 Eh/α   predicted    -0.1371318E-02 (  -8.54%)
   displ. norm   :     0.1490045 α      lambda       -0.3543690E-03
   maximum displ.:     0.1019637 α      in ANC's #5, #3, #8, ...

........................................................................
.............................. CYCLE    4 ..............................
........................................................................
   1    -44.5311002 -0.445311E+02  0.794E-02    2.61       0.0  T
   2    -44.5311034 -0.319706E-05  0.445E-02    2.62       1.0  T
   3    -44.5310963  0.708448E-05  0.188E-02    2.62       1.0  T
   4    -44.5311046 -0.837588E-05  0.609E-03    2.62       3.0  T
   5    -44.5311049 -0.282846E-06  0.219E-03    2.62       8.5  T
   6    -44.5311050 -0.623891E-07  0.993E-04    2.62      18.7  T
     SCC iter.                  ...        0 min,  0.010 sec
     gradient                   ...        0 min,  0.020 sec
 * total energy  :   -43.8772999 Eh     change       -0.2557879E-03 Eh
   gradient norm :     0.0045004 Eh/α   predicted    -0.1811190E-03 ( -29.19%)
   displ. norm   :     0.1786725 α      lambda       -0.2207095E-03
   maximum displ.:     0.1227362 α      in ANC's #5, #3, #7, ...

........................................................................
.............................. CYCLE    5 ..............................
........................................................................
   1    -44.5294417 -0.445294E+02  0.952E-02    2.62       0.0  T
   2    -44.5294438 -0.204812E-05  0.551E-02    2.63       1.0  T
   3    -44.5294386  0.514289E-05  0.148E-02    2.62       1.3  T
   4    -44.5294444 -0.576271E-05  0.456E-03    2.63       4.1  T
   5    -44.5294446 -0.230890E-06  0.163E-03    2.63      11.4  T
   6    -44.5294446 -0.297982E-07  0.785E-04    2.63      23.6  T
     SCC iter.                  ...        0 min,  0.010 sec
     gradient                   ...        0 min,  0.020 sec
 * total energy  :   -43.8774580 Eh     change       -0.1581136E-03 Eh
   gradient norm :     0.0034592 Eh/α   predicted    -0.1138780E-03 ( -27.98%)
   displ. norm   :     0.1620665 α      lambda       -0.1265831E-03
   maximum displ.:     0.1092995 α      in ANC's #5, #3, #7, ...

........................................................................
.............................. CYCLE    6 ..............................
........................................................................
   1    -44.5285963 -0.445286E+02  0.918E-02    2.63       0.0  T
   2    -44.5285969 -0.677567E-06  0.536E-02    2.63       1.0  T
   3    -44.5285952  0.169243E-05  0.844E-03    2.63       2.2  T
   4    -44.5285972 -0.194179E-05  0.260E-03    2.63       7.2  T
   5    -44.5285973 -0.639930E-07  0.914E-04    2.63      20.3  T
   6    -44.5285973 -0.112136E-07  0.412E-04    2.63      45.1  T
     SCC iter.                  ...        0 min,  0.010 sec
     gradient                   ...        0 min,  0.022 sec
 * total energy  :   -43.8775599 Eh     change       -0.1019458E-03 Eh
   gradient norm :     0.0043568 Eh/α   predicted    -0.6496092E-04 ( -36.28%)
   displ. norm   :     0.1938063 α      lambda       -0.1406261E-03
   maximum displ.:     0.1288826 α      in ANC's #5, #3, #7, ...

........................................................................
.............................. CYCLE    7 ..............................
........................................................................
   1    -44.5286401 -0.445286E+02  0.110E-01    2.63       0.0  T
   2    -44.5286408 -0.702523E-06  0.641E-02    2.63       1.0  T
   3    -44.5286384  0.243002E-05  0.104E-02    2.63       1.8  T
   4    -44.5286412 -0.280100E-05  0.287E-03    2.63       6.5  T
   5    -44.5286412 -0.431229E-07  0.948E-04    2.63      19.6  T
     SCC iter.                  ...        0 min,  0.009 sec
     gradient                   ...        0 min,  0.020 sec
 * total energy  :   -43.8776727 Eh     change       -0.1127677E-03 Eh
   gradient norm :     0.0048810 Eh/α   predicted    -0.7295427E-04 ( -35.31%)
   displ. norm   :     0.2774868 α      lambda       -0.1722232E-03
   maximum displ.:     0.1826512 α      in ANC's #5, #3, #7, ...

........................................................................
.............................. CYCLE    8 ..............................
........................................................................
   1    -44.5290032 -0.445290E+02  0.163E-01    2.64       0.0  T
   2    -44.5290045 -0.130629E-05  0.954E-02    2.64       1.0  T
   3    -44.5289994  0.506631E-05  0.151E-02    2.64       1.2  T
   4    -44.5290052 -0.583285E-05  0.399E-03    2.64       4.7  T
   5    -44.5290053 -0.835273E-07  0.115E-03    2.64      16.1  T
   6    -44.5290054 -0.314835E-07  0.422E-04    2.64      44.1  T
     SCC iter.                  ...        0 min,  0.010 sec
     gradient                   ...        0 min,  0.020 sec
 * total energy  :   -43.8777838 Eh     change       -0.1111611E-03 Eh
   gradient norm :     0.0056612 Eh/α   predicted    -0.9274360E-04 ( -16.57%)
   displ. norm   :     0.1992002 α      lambda       -0.1081072E-03
   maximum displ.:     0.1350395 α      in ANC's #5, #3, #7, ...

........................................................................
.............................. CYCLE    9 ..............................
........................................................................
   1    -44.5302920 -0.445303E+02  0.110E-01    2.65       0.0  T
   2    -44.5302930 -0.985630E-06  0.644E-02    2.65       1.0  T
   3    -44.5302899  0.313002E-05  0.121E-02    2.65       1.5  T
   4    -44.5302934 -0.356625E-05  0.307E-03    2.65       6.1  T
   5    -44.5302935 -0.735492E-07  0.850E-04    2.65      21.9  T
   6    -44.5302935 -0.557802E-08  0.391E-04    2.65      47.5  T
     SCC iter.                  ...        0 min,  0.010 sec
     gradient                   ...        0 min,  0.020 sec
 * total energy  :   -43.8778444 Eh     change       -0.6055823E-04 Eh
   gradient norm :     0.0041500 Eh/α   predicted    -0.5620509E-04 (  -7.19%)
   displ. norm   :     0.1091578 α      lambda       -0.5510146E-04
   maximum displ.:     0.0712902 α      in ANC's #5, #3, #1, ...

........................................................................
.............................. CYCLE   10 ..............................
........................................................................
   1    -44.5320216 -0.445320E+02  0.630E-02    2.65       0.0  T
   2    -44.5320220 -0.348565E-06  0.368E-02    2.65       1.0  T
   3    -44.5320212  0.727272E-06  0.600E-03    2.65       3.1  T
   4    -44.5320221 -0.849099E-06  0.167E-03    2.65      11.1  T
   5    -44.5320221 -0.229043E-07  0.621E-04    2.65      29.9  T
     SCC iter.                  ...        0 min,  0.009 sec
     gradient                   ...        0 min,  0.020 sec
 * total energy  :   -43.8778732 Eh     change       -0.2881459E-04 Eh
   gradient norm :     0.0018193 Eh/α   predicted    -0.2788335E-04 (  -3.23%)
   displ. norm   :     0.1957607 α      lambda       -0.2528754E-04
   maximum displ.:     0.1223824 α      in ANC's #5, #3, #1, ...

........................................................................
.............................. CYCLE   11 ..............................
........................................................................
   1    -44.5306047 -0.445306E+02  0.118E-01    2.66       0.0  T
   2    -44.5306057 -0.981545E-06  0.687E-02    2.66       1.0  T
   3    -44.5306020  0.367794E-05  0.130E-02    2.66       1.4  T
   4    -44.5306062 -0.418094E-05  0.283E-03    2.66       6.6  T
   5    -44.5306063 -0.568374E-07  0.918E-04    2.66      20.2  T
   6    -44.5306063 -0.698132E-08  0.439E-04    2.66      42.3  T
     SCC iter.                  ...        0 min,  0.010 sec
     gradient                   ...        0 min,  0.021 sec
 * total energy  :   -43.8778771 Eh     change       -0.3932539E-05 Eh
   gradient norm :     0.0028528 Eh/α   predicted    -0.1286145E-04 ( 227.05%)
   displ. norm   :     0.0555679 α      lambda       -0.2480186E-04
   maximum displ.:     0.0336897 α      in ANC's #5, #3, #7, ...

........................................................................
.............................. CYCLE   12 ..............................
........................................................................
   1    -44.5315944 -0.445316E+02  0.316E-02    2.66       0.0  T
   2    -44.5315944 -0.909516E-07  0.183E-02    2.66       1.0  T
   3    -44.5315942  0.293857E-06  0.369E-03    2.66       5.0  T
   4    -44.5315945 -0.327789E-06  0.115E-03    2.66      16.1  T
   5    -44.5315945 -0.132787E-07  0.241E-04    2.66      77.1  T
   6    -44.5315945 -0.460538E-09  0.110E-04    2.66     168.1  T
     SCC iter.                  ...        0 min,  0.010 sec
     gradient                   ...        0 min,  0.021 sec
 * total energy  :   -43.8778917 Eh     change       -0.1455543E-04 Eh
   gradient norm :     0.0013962 Eh/α   predicted    -0.1244396E-04 ( -14.51%)
   displ. norm   :     0.0445908 α      lambda       -0.9618335E-05
   maximum displ.:     0.0188584 α      in ANC's #2, #5, #3, ...

........................................................................
.............................. CYCLE   13 ..............................
........................................................................
   1    -44.5317812 -0.445318E+02  0.235E-02    2.66       0.0  T
   2    -44.5317813 -0.129950E-06  0.126E-02    2.66       1.5  T
   3    -44.5317810  0.305635E-06  0.449E-03    2.66       4.1  T
   4    -44.5317814 -0.367411E-06  0.153E-03    2.66      12.1  T
   5    -44.5317814 -0.106364E-07  0.262E-04    2.66      71.0  T
   6    -44.5317814 -0.863238E-09  0.114E-04    2.66     162.6  T
     SCC iter.                  ...        0 min,  0.010 sec
     gradient                   ...        0 min,  0.021 sec
 * total energy  :   -43.8778962 Eh     change       -0.4543131E-05 Eh
   gradient norm :     0.0009365 Eh/α   predicted    -0.4814155E-05 (   5.97%)
   displ. norm   :     0.0281341 α      lambda       -0.4960380E-05
   maximum displ.:     0.0169264 α      in ANC's #2, #1, #8, ...

   *** GEOMETRY OPTIMIZATION CONVERGED AFTER 13 ITERATIONS ***

------------------------------------------------------------------------
 total energy gain   :        -0.0083899 Eh       -5.2647 kcal/mol
 total RMSD          :         0.2937003 a0        0.1554 Å
 total power (kW/mol):        -1.6944323 (step)  -36.3543 (real)
------------------------------------------------------------------------

 ANCopt (total)                0 d,  0 h,  0 min,  0.606 sec
 optimizer setup                ...        0 min,  0.000 sec (  0.024%)
 model hessian                  ...        0 min,  0.008 sec (  1.348%)
 ANC generation                 ...        0 min,  0.001 sec (  0.158%)
 coordinate transformation      ...        0 min,  0.000 sec (  0.046%)
 single point calculation       ...        0 min,  0.592 sec ( 97.664%)
 optimization log               ...        0 min,  0.002 sec (  0.251%)
 hessian update                 ...        0 min,  0.000 sec (  0.030%)
 rational function              ...        0 min,  0.002 sec (  0.340%)

================
 final structure:
================
$coord
   -6.15610159550829    1.52426884591334   -0.24736929781381      C 
   -4.12017465065154    3.08822035682931   -0.11356306406769      C 
   -1.78661997963899    1.70048720586186   -0.23738629145768      C 
   -2.24225077061849   -0.91417477576582   -0.51473084081048      C 
   -5.43885073773066   -1.63952819399934   -0.57930382775194      S 
   -0.49852344506012   -2.69314090122314   -0.68130972455647      N 
    1.84911458199919   -1.91491138292869   -0.55732194063621      C 
    2.58940290235449    0.61800452991355   -0.23160862494350      C 
    0.76074407122382    2.47425408487481   -0.04326410606345      C 
    1.48496548553160    5.19148693601656    0.33140382227264      C 
    2.00273870729287    6.49221938584279   -2.19895230657539      C 
    5.40314392997670    0.96775629344295   -0.21264157623194      C 
    6.59691279881685   -1.60581118578287    0.30899593829742      C 
    4.36847181184265   -4.03819159608686   -0.76198532106188      S 
   -4.43291419152045    5.82623130092887    0.03485197789906      C 
   -6.13855498609850    6.95235838686712    1.48225659957342      C 
   -8.10369228688678    2.08572827521101   -0.23892104766493      H 
    3.18325675742504    5.29844559378837    1.49836880097025      H 
   -0.02655949373088    6.17107648460585    1.33209382847805      H 
    3.61688558885921    5.63365620273211   -3.13595131604006      H 
    2.40498374205278    8.48566044189402   -1.90468744693946      H 
    0.38097096905243    6.32418464511334   -3.45069909803283      H 
    6.00823284779965    2.33175750800807    1.21045057013192      H 
    6.00635371735704    1.66893518560515   -2.06247878281647      H 
    6.89334692007662   -1.90939624459938    2.32586967425642      H 
    8.37493257688223   -1.88267723398555   -0.68241472659449      H 
   -3.23424377706833    6.94483582591351   -1.18381250958942      H 
   -7.35087294217766    5.89627301307834    2.72768652454656      H 
   -6.35783988355677    8.97404109435483    1.50189480446121      H 
$end
           -------------------------------------------------
          |                Final Singlepoint                |
           -------------------------------------------------

          ...................................................
          :                      SETUP                      :
          :.................................................:
          :  # basis functions                  89          :
          :  # atomic orbitals                  87          :
          :  # shells                           47          :
          :  # electrons                        82          :
          :  max. iterations                   250          :
          :  Hamiltonian                  GFN2-xTB          :
          :  restarted?                      false          :
          :  GBSA solvation                  false          :
          :  PC potential                    false          :
          :  electronic temp.          300.0000000     K    :
          :  accuracy                    1.0000000          :
          :  -> integral cutoff          0.2500000E+02      :
          :  -> integral neglect         0.1000000E-07      :
          :  -> SCF convergence          0.1000000E-05 Eh   :
          :  -> wf. convergence          0.1000000E-03 e    :
          :  Broyden damping             0.4000000          :
          ...................................................

 iter      E             dE          RMSdq      gap      omega  full diag
   1    -44.5317814 -0.445318E+02  0.673E-05    2.66       0.0  T
   2    -44.5317814 -0.409273E-11  0.335E-05    2.66     554.9  T
   3    -44.5317814 -0.266951E-10  0.284E-05    2.66     654.4  T

   *** convergence criteria satisfied after 3 iterations ***

         #    Occupation            Energy/Eh            Energy/eV
      -------------------------------------------------------------
         1        2.0000           -0.7295974             -19.8534
       ...           ...                  ...                  ...
        35        2.0000           -0.4397205             -11.9654
        36        2.0000           -0.4312963             -11.7362
        37        2.0000           -0.4231687             -11.5150
        38        2.0000           -0.4094999             -11.1431
        39        2.0000           -0.3796001             -10.3294
        40        2.0000           -0.3785536             -10.3010
        41        2.0000           -0.3636541              -9.8955 (HOMO)
        42                         -0.2660158              -7.2387 (LUMO)
        43                         -0.2432922              -6.6203
        44                         -0.2318029              -6.3077
        45                         -0.2133524              -5.8056
        46                         -0.2031720              -5.5286
       ...                                ...                  ...
        87                          0.6840842              18.6149
      -------------------------------------------------------------
                  HL-Gap            0.0976383 Eh            2.6569 eV
             Fermi-level           -0.3148349 Eh           -8.5671 eV

 SCC (total)                   0 d,  0 h,  0 min,  0.043 sec
 SCC setup                      ...        0 min,  0.000 sec (  0.606%)
 Dispersion                     ...        0 min,  0.000 sec (  0.636%)
 integral evaluation            ...        0 min,  0.015 sec ( 34.194%)
 zeroth order Hamiltonian       ...        0 min,  0.000 sec (  0.573%)
 iterations                     ...        0 min,  0.006 sec ( 12.924%)
 molecular gradient             ...        0 min,  0.021 sec ( 49.969%)
 printout                       ...        0 min,  0.000 sec (  0.983%)

         :::::::::::::::::::::::::::::::::::::::::::::::::::::
         ::                     SUMMARY                     ::
         :::::::::::::::::::::::::::::::::::::::::::::::::::::
         :: total energy             -43.877896245124 Eh    ::
         :: gradient norm              0.000936661372 Eh/a0 ::
         :: HOMO-LUMO gap              2.656872421583 eV    ::
         ::.................................................::
         :: SCC energy               -44.531781398230 Eh    ::
         :: -> isotropic ES            0.014661357937 Eh    ::
         :: -> anisotropic ES          0.003790900523 Eh    ::
         :: -> anisotropic XC          0.027062159982 Eh    ::
         :: -> dispersion             -0.034878189634 Eh    ::
         :: repulsion energy           0.653605624395 Eh    ::
         :: add. restraining           0.000000000000 Eh    ::
         :::::::::::::::::::::::::::::::::::::::::::::::::::::

           -------------------------------------------------
          |                Property Printout                |
           -------------------------------------------------

    * Orbital Energies and Occupations

         #    Occupation            Energy/Eh            Energy/eV
      -------------------------------------------------------------
         1        2.0000           -0.7295974             -19.8534
       ...           ...                  ...                  ...
        29        2.0000           -0.4717655             -12.8374
        30        2.0000           -0.4624916             -12.5850
        31        2.0000           -0.4590879             -12.4924
        32        2.0000           -0.4582146             -12.4687
        33        2.0000           -0.4559441             -12.4069
        34        2.0000           -0.4452724             -12.1165
        35        2.0000           -0.4397205             -11.9654
        36        2.0000           -0.4312963             -11.7362
        37        2.0000           -0.4231687             -11.5150
        38        2.0000           -0.4094999             -11.1431
        39        2.0000           -0.3796001             -10.3294
        40        2.0000           -0.3785536             -10.3010
        41        2.0000           -0.3636541              -9.8955 (HOMO)
        42                         -0.2660158              -7.2387 (LUMO)
        43                         -0.2432922              -6.6203
        44                         -0.2318029              -6.3077
        45                         -0.2133524              -5.8056
        46                         -0.2031720              -5.5286
        47                         -0.1728823              -4.7044
        48                         -0.1321717              -3.5966
        49                         -0.1143625              -3.1120
        50                         -0.1070070              -2.9118
        51                         -0.0168789              -0.4593
        52                         -0.0038179              -0.1039
       ...                                ...                  ...
        87                          0.6840842              18.6149
      -------------------------------------------------------------
                  HL-Gap            0.0976383 Eh            2.6569 eV
             Fermi-level           -0.3148349 Eh           -8.5671 eV

     #   Z        covCN         q      C6AA      α(0)
     1   6 C      2.945    -0.023    28.580     8.768
     2   6 C      3.107    -0.005    27.997     8.669
     3   6 C      3.126    -0.030    28.548     8.749
     4   6 C      3.030     0.112    25.496     8.282
     5  16 S      2.233    -0.032   142.381    20.083
     6   7 N      1.914    -0.258    27.570     7.785
     7   6 C      3.002     0.129    25.164     8.229
     8   6 C      3.068    -0.026    28.574     8.765
     9   6 C      2.972     0.012    27.732     8.638
    10   6 C      3.805    -0.057    21.601     6.616
    11   6 C      3.753    -0.095    22.382     6.746
    12   6 C      3.864    -0.051    21.453     6.587
    13   6 C      3.803    -0.014    20.821     6.496
    14  16 S      2.127    -0.125   146.292    20.357
    15   6 C      2.893    -0.030    28.743     8.790
    16   6 C      2.840    -0.091    30.276     9.017
    17   1 H      0.926     0.052     2.291     2.367
    18   1 H      0.924     0.038     2.481     2.463
    19   1 H      0.924     0.049     2.330     2.387
    20   1 H      0.925     0.035     2.510     2.477
    21   1 H      0.925     0.039     2.465     2.455
    22   1 H      0.925     0.038     2.471     2.458
    23   1 H      0.924     0.049     2.338     2.391
    24   1 H      0.924     0.051     2.313     2.379
    25   1 H      0.925     0.051     2.308     2.376
    26   1 H      0.925     0.055     2.255     2.349
    27   1 H      0.926     0.047     2.353     2.399
    28   1 H      0.926     0.040     2.446     2.446
    29   1 H      0.926     0.039     2.456     2.451

 Mol. C6AA /au·bohr⁶  :      13287.715983
 Mol. C8AA /au·bohr⁸  :     380801.623241
 Mol. α(0) /au        :        183.976007


Wiberg/Mayer (AO) data.
largest (>0.10) Wiberg bond orders for each atom
          total WBO             WBO to atom ...
     1  C   3.934        C    2 1.599    S    5 1.162    H   17 0.968
     2  C   3.983        C    1 1.599    C    3 1.161    C   15 1.061
     3  C   3.983        C    9 1.287    C    4 1.280    C    2 1.161
     4  C   3.958        N    6 1.368    C    3 1.280    S    5 1.110
     5  S   2.577        C    1 1.162    C    4 1.110
     6  N   3.077        C    7 1.428    C    4 1.368
     7  C   3.964        N    6 1.428    C    8 1.281    S   14 1.070
     8  C   3.981        C    9 1.462    C    7 1.281    C   12 1.013
     9  C   3.987        C    8 1.462    C    3 1.287    C   10 1.012
    10  C   3.997        C    9 1.012    C   11 0.999    H   18 0.967    H   19 0.965
    11  C   3.995        C   10 0.999    H   20 0.987    H   21 0.986    H   22 0.985
    12  C   3.996        C    8 1.013    C   13 1.008    H   23 0.960    H   24 0.959
    13  C   3.977        C   12 1.008    S   14 0.985    H   25 0.978    H   26 0.978
    14  S   2.280        C    7 1.070    C   13 0.985
    15  C   3.991        C   16 1.921    C    2 1.061    H   27 0.952
    16  C   3.987        C   15 1.921    H   29 0.978    H   28 0.976
    17  H   0.996        C    1 0.968
    18  H   0.997        C   10 0.967
    19  H   0.997        C   10 0.965
    20  H   0.999        C   11 0.987
    21  H   0.997        C   11 0.986
    22  H   0.998        C   11 0.985
    23  H   0.997        C   12 0.960
    24  H   0.996        C   12 0.959
    25  H   0.997        C   13 0.978
    26  H   0.996        C   13 0.978
    27  H   0.998        C   15 0.952
    28  H   0.998        C   16 0.976
    29  H   0.997        C   16 0.978

molecular dipole:
                 x           y           z       tot (Debye)
 q only:        0.589       1.365       0.181
   full:        0.796       2.034       0.299       5.604
molecular quadrupole (traceless):
                xx          xy          yy          xz          yz          zz
 q only:        6.919       0.717      -3.248       0.481      -1.729      -3.671
  q+dip:        8.231       0.684      -5.640      -0.530      -2.678      -2.591
   full:        7.706       0.665      -6.625       0.417      -2.942      -1.081

           -------------------------------------------------
          |                Geometry Summary                 |
           -------------------------------------------------

      molecular mass/u    :      247.3724000
   center of mass at/Å    :       -0.1705606       0.4318056      -0.1733595
  moments of inertia/u·Å² :        0.7159535E+03   0.1487797E+04   0.2122204E+04
rotational constants/cm⁻¹ :        0.2354571E-01   0.1133060E-01   0.7943456E-02

 * 27 selected distances

     #   Z        #   Z                                     value/Å
     1   6 C      2   6 C                                 1.3603918
     2   6 C      3   6 C                                 1.4382151
     3   6 C      4   6 C                                 1.4121179
     1   6 C      5  16 S                                 1.7256568
     4   6 C      5  16 S                                 1.7349074
     4   6 C      6   7 N                                 1.3211484
     6   7 N      7   6 C                                 1.3104398
     7   6 C      8   6 C                                 1.4070324
     3   6 C      9   6 C                                 1.4125626
     8   6 C      9   6 C                                 1.3824729
    10   6 C     11   6 C                                 1.5302921
    12   6 C     13   6 C                                 1.5264209
     7   6 C     14  16 S                                 1.7468755 (max)
    15   6 C     16   6 C                                 1.3253068
     1   6 C     17   1 H                                 1.0726017 (min)
    10   6 C     18   1 H                                 1.0918814
    10   6 C     19   1 H                                 1.0903728
    11   6 C     20   1 H                                 1.0871429
    11   6 C     21   1 H                                 1.0873531
    11   6 C     22   1 H                                 1.0877439
    12   6 C     23   1 H                                 1.0911608
    12   6 C     24   1 H                                 1.0944393
    13   6 C     25   1 H                                 1.0906466
    13   6 C     26   1 H                                 1.0871862
    15   6 C     27   1 H                                 1.0810290
    16   6 C     28   1 H                                 1.0762127
    16   6 C     29   1 H                                 1.0761536

 * 4 distinct bonds (by element types)

   Z      Z             #   av. dist./Å        max./Å        min./Å
   1 H    6 C          13     1.0856865     1.0944393     1.0726017
   6 C    6 C           9     1.4216458     1.5302921     1.3253068
   6 C    7 N           2     1.3157941     1.3211484     1.3104398
   6 C   16 S           3     1.7358132     1.7468755     1.7256568


optimized geometry written to: xtbopt.xyz


           -------------------------------------------------
          | TOTAL ENERGY              -43.877896245124 Eh   |
          | GRADIENT NORM               0.000936661372 Eh/α |
          | HOMO-LUMO GAP               2.656872421583 eV   |
           -------------------------------------------------

------------------------------------------------------------------------
 * finished run on 2021/05/19 at 10:59:17.766     
------------------------------------------------------------------------
 total:
 * wall-time:     0 d,  0 h,  0 min,  0.738 sec
 *  cpu-time:     0 d,  0 h,  0 min,  0.737 sec
 * ratio c/w:     0.999 speedup
 SCF:
 * wall-time:     0 d,  0 h,  0 min,  0.061 sec
 *  cpu-time:     0 d,  0 h,  0 min,  0.061 sec
 * ratio c/w:     0.998 speedup
 ANC optimizer:
 * wall-time:     0 d,  0 h,  0 min,  0.649 sec
 *  cpu-time:     0 d,  0 h,  0 min,  0.649 sec
 * ratio c/w:     1.000 speedup

