      -----------------------------------------------------------      
     |                   =====================                   |     
     |                           x T B                           |     
     |                   =====================                   |     
     |                         S. Grimme                         |     
     |          Mulliken Center for Theoretical Chemistry        |     
     |                    University of Bonn                     |     
     |                Version 6.2 RC2 (SAW190805)                |     
      -----------------------------------------------------------      

   This program is distributed in the hope that it will be useful,
   but WITHOUT ANY WARRANTY; without even the implied warranty of
   MERCHANTABILITY or FITNESS FOR A PARTICULAR PURPOSE.
   
   FOR NON-COMMERCIAL, ACADEMIA USE ONLY.
   
   Cite this work as:
   * S. Grimme, C. Bannwarth, P. Shushkov, J. Chem. Theory Comput., 2017,
     13, 1989-2009. DOI: 10.1021/acs.jctc.7b00118
   * C. Bannwarth, S. Ehlert and S. Grimme., J. Chem. Theory Comput., 2019,
     15, 1652-1671. DOI: 10.1021/acs.jctc.8b01176
   * P. Pracht, E. Caldeweyher, S. Ehlert, S. Grimme, ChemRxiv, 2019, preprint.
     DOI: 10.26434/chemrxiv.8326202.v1
   
   for DFT-D4:
   * E. Caldeweyher, C. Bannwarth and S. Grimme, J. Chem. Phys., 2017,
     147, 034112. DOI: 10.1063/1.4993215
   * E. Caldeweyher, S. Ehlert, A. Hansen, H. Neugebauer, S. Spicher,
     C. Bannwarth and S. Grimme, J. Chem. Phys., 2019, 150, 154122.
     DOI: 10.1063/1.5090222
   
   for sTDA-xTB:
   * S. Grimme and C. Bannwarth, J. Chem. Phys., 2016, 145, 054103.
     DOI: 10.1063/1.4959605
   
   in the mass-spec context:
   * V. Asgeirsson, C. Bauer and S. Grimme, Chem. Sci., 2017, 8, 4879.
     DOI: 10.1039/c7sc00601b
   
   for metadynamics refer to:
   * S. Grimme, J. Chem. Theory Comput., 2019, 155, 2847-2862
     DOI: 10.1021/acs.jctc.9b00143
   
   with help from (in alphabetical order)
   C. Bannwarth, F. Bohle, G. Brandenburg, E. Caldeweyher, M. Checinski,
   S. Dohm, S. Ehlert, S. Ehrlich, F. März, H. Neugebauer, J. Pisarek,
   P. Pracht, P. Shushkov, and S. Spicher.
   
 * started run on 2021/05/19 at 10:59:25.650     

           -------------------------------------------------
          |                Calculation Setup                |
           -------------------------------------------------

          program call               : /ihome/ghutchison/geoffh/xtb/xtb 266.xyz -opt
          hostname                   : smp-n83
          coordinate file            : 266.xyz
          omp threads                :                     1
          number of atoms            :                    13
          number of electrons        :                    38
          charge                     :                     0
          spin                       :                   0.0
          first test random number   :      0.72839971301796


########################################################################
# WARNING! Please study the warnings concerning your input carefully
#  - the use of '-opt' is discouraged, please use '--opt' next time
########################################################################

           ------------------------------------------------- 
          |                 G F N 2 - x T B                 |
          | Geometry, Frequencies, Noncovalent interactions |
          |            JCTC 2019 parametrisation            |
           ------------------------------------------------- 
             KAB for C  - Si     :                1.0500
             KAB for H  - Pd     :                0.9500
             k(s)              :                1.8500
             k(p)              :                2.2300
             k(d)              :                2.2300
             k(f)              :                2.0000
             kEN (H0ij)        :               -2.0000
             D4 a1             :                0.5200
             D4 a2             :                5.0000
             D4 s6             :                1.0000
             D4 s8             :                2.7000
             D4 s9             :                5.0000
             alphaj            :                2.0000

  Z AO/shell   Hii/eV     exponent
  1     Wed Apr 25 08:07:45 CEST 2018   EN: 2.200 GM2: 0.406  GM3: 0.0800  RAES: 1.40
     1s    -10.707211    1.230000
  6     Wed Apr 25 08:07:45 CEST 2018   EN: 2.550 GM2: 0.538  GM3: 0.1500  RAES: 3.00
     2s    -13.970922    2.096432
     2p    -10.063292    1.800000
  7     Wed Apr 25 08:07:45 CEST 2018   EN: 3.040 GM2: 0.461  GM3:-0.0640  RAES: 1.90
     2s    -16.686243    2.339881
     2p    -12.523956    2.014332

           ------------------------------------------------- 
          |        Self-Consistent Charge Iterations        |
           ------------------------------------------------- 

          ...................................................
          :                      SETUP                      :
          :.................................................:
          :  # basis functions                  37          :
          :  # atomic orbitals                  37          :
          :  # shells                           21          :
          :  # electrons                        38          :
          :  max. iterations                   250          :
          :  Hamiltonian                  GFN2-xTB          :
          :  restarted?                      false          :
          :  GBSA solvation                  false          :
          :  PC potential                    false          :
          :  electronic temp.          300.0000000     K    :
          :  accuracy                    1.0000000          :
          :  -> integral cutoff          0.2500000E+02      :
          :  -> integral neglect         0.1000000E-07      :
          :  -> SCF convergence          0.1000000E-05 Eh   :
          :  -> wf. convergence          0.1000000E-03 e    :
          :  Broyden damping             0.4000000          :
          ...................................................

 iter      E             dE          RMSdq      gap      omega  full diag
   1    -20.6984312 -0.206984E+02  0.516E+00    1.18       0.0  T
   2    -20.6955620  0.286922E-02  0.343E+00    1.07       1.0  T
   3    -20.6725732  0.229888E-01  0.292E+00    1.25       1.0  T
   4    -20.7165792 -0.440060E-01  0.837E-01    1.09       1.0  T
   5    -20.7239550 -0.737576E-02  0.345E-01    1.03       1.0  T
   6    -20.7250504 -0.109546E-02  0.133E-01    1.05       1.0  T
   7    -20.7251139 -0.635114E-04  0.821E-02    1.05       1.0  T
   8    -20.7251754 -0.614415E-04  0.297E-02    1.05       1.0  T
   9    -20.7251777 -0.227012E-05  0.107E-02    1.05       2.6  T
  10    -20.7251784 -0.689138E-06  0.404E-03    1.05       6.9  T
  11    -20.7251784 -0.735685E-07  0.906E-04    1.05      30.6  T
  12    -20.7251784 -0.194250E-08  0.535E-04    1.05      51.8  T

   *** convergence criteria satisfied after 12 iterations ***

         #    Occupation            Energy/Eh            Energy/eV
      -------------------------------------------------------------
         1        2.0000           -0.6804744             -18.5166
       ...           ...                  ...                  ...
        13        2.0000           -0.4723629             -12.8536
        14        2.0000           -0.4605202             -12.5314
        15        2.0000           -0.4599110             -12.5148
        16        2.0000           -0.4360531             -11.8656
        17        2.0000           -0.4304238             -11.7124
        18        2.0000           -0.3869427             -10.5292
        19        2.0000           -0.3747229             -10.1967 (HOMO)
        20                         -0.3363012              -9.1512 (LUMO)
        21                         -0.2096318              -5.7044
        22                         -0.1505462              -4.0966
        23                         -0.1142993              -3.1102
        24                          0.0713084               1.9404
       ...                                ...                  ...
        37                          0.7976993              21.7065
      -------------------------------------------------------------
                  HL-Gap            0.0384217 Eh            1.0455 eV
             Fermi-level           -0.3555121 Eh           -9.6740 eV

 SCC (total)                   0 d,  0 h,  0 min,  0.016 sec
 SCC setup                      ...        0 min,  0.000 sec (  1.139%)
 Dispersion                     ...        0 min,  0.000 sec (  0.883%)
 integral evaluation            ...        0 min,  0.003 sec ( 18.975%)
 zeroth order Hamiltonian       ...        0 min,  0.000 sec (  0.490%)
 iterations                     ...        0 min,  0.007 sec ( 44.751%)
 molecular gradient             ...        0 min,  0.005 sec ( 31.348%)
 printout                       ...        0 min,  0.000 sec (  2.073%)

         :::::::::::::::::::::::::::::::::::::::::::::::::::::
         ::                     SUMMARY                     ::
         :::::::::::::::::::::::::::::::::::::::::::::::::::::
         :: total energy             -20.347884426920 Eh    ::
         :: gradient norm              0.091210223006 Eh/a0 ::
         :: HOMO-LUMO gap              1.045507670978 eV    ::
         ::.................................................::
         :: SCC energy               -20.725178425852 Eh    ::
         :: -> isotropic ES            0.007878603026 Eh    ::
         :: -> anisotropic ES          0.002700175173 Eh    ::
         :: -> anisotropic XC          0.018391561880 Eh    ::
         :: -> dispersion             -0.010137759587 Eh    ::
         :: repulsion energy           0.377285372082 Eh    ::
         :: add. restraining           0.000000000000 Eh    ::
         :::::::::::::::::::::::::::::::::::::::::::::::::::::

      ----------------------------------------------------------- 
     |                   =====================                   |
     |                        A N C O P T                        |
     |                   =====================                   |
     |               Approximate Normal Coordinate               |
     |                Rational Function Optimizer                |
      ----------------------------------------------------------- 

          ...................................................
          :                      SETUP                      :
          :.................................................:
          :   optimization level            normal          :
          :   max. optcycles                   200          :
          :   ANC micro-cycles                  20          :
          :   degrees of freedom                33          :
          :.................................................:
          :   RF solver                   davidson          :
          :   input Hessian                  false          :
          :   write xtbopt.log                true          :
          :   linear?                        false          :
          :   energy convergence         0.5000000E-05 Eh   :
          :   grad. convergence          0.1000000E-02 Eh/α :
          :   maximium RF displ.         2.0000000          :
          :   Hlow (freq-cutoff)         0.5000000E-02      :
          :   Hmax (freq-cutoff)         5.0000000          :
          :   S6 in model hess.         20.0000000          :
          ...................................................

generating ANC from model Hessian ...
Using Lindh-Hessian (1995)
 Shifting diagonal of input Hessian by   0.000000000000000E+000
 Lowest  eigenvalues of input Hessian
   -0.000000   -0.000000   -0.000000    0.000000    0.000000    0.000000
    0.010376    0.013129    0.020653    0.038540    0.053271    0.071943
    0.082748    0.092694    0.099530    0.104209    0.116269    0.140424
 Highest eigenvalues
    1.582972    1.849437    1.903181    1.924917    2.100161    2.273420
 

........................................................................
.............................. CYCLE    1 ..............................
........................................................................
   1    -20.7251784 -0.207252E+02  0.707E-05    1.05       0.0  T
   2    -20.7251784  0.121751E-10  0.628E-05    1.05     441.6  T
   3    -20.7251784 -0.231211E-10  0.364E-05    1.05     761.4  T
     SCC iter.                  ...        0 min,  0.002 sec
     gradient                   ...        0 min,  0.005 sec
 * total energy  :   -20.3478844 Eh     change       -0.8689664E-08 Eh
   gradient norm :     0.0912096 Eh/α   predicted     0.0000000E+00 (-100.00%)
   displ. norm   :     0.2587769 α      lambda       -0.1430321E-01
   maximum displ.:     0.1551798 α      in ANC's #5, #13, #9, ...

........................................................................
.............................. CYCLE    2 ..............................
........................................................................
   1    -20.7206757 -0.207207E+02  0.261E-01    1.20       0.0  T
   2    -20.7207288 -0.531025E-04  0.190E-01    1.19       1.0  T
   3    -20.7208202 -0.914000E-04  0.123E-01    1.21       1.0  T
   4    -20.7208701 -0.499478E-04  0.446E-02    1.20       1.0  T
   5    -20.7208878 -0.177101E-04  0.190E-02    1.20       1.5  T
   6    -20.7208896 -0.177969E-05  0.971E-03    1.20       2.9  T
   7    -20.7208899 -0.274215E-06  0.780E-03    1.20       3.6  T
   8    -20.7208904 -0.533116E-06  0.194E-03    1.20      14.3  T
   9    -20.7208904 -0.907261E-08  0.121E-03    1.20      22.9  T
     SCC iter.                  ...        0 min,  0.004 sec
     gradient                   ...        0 min,  0.004 sec
 * total energy  :   -20.3569884 Eh     change       -0.9103938E-02 Eh
   gradient norm :     0.0358770 Eh/α   predicted    -0.7630514E-02 ( -16.18%)
   displ. norm   :     0.1190051 α      lambda       -0.2099575E-02
   maximum displ.:     0.0909846 α      in ANC's #5, #23, #12, ...

........................................................................
.............................. CYCLE    3 ..............................
........................................................................
   1    -20.7206819 -0.207207E+02  0.124E-01    1.27       0.0  T
   2    -20.7206689  0.130256E-04  0.970E-02    1.27       1.0  T
   3    -20.7207015 -0.325827E-04  0.688E-02    1.27       1.0  T
   4    -20.7207260 -0.245973E-04  0.284E-02    1.27       1.0  T
   5    -20.7207353 -0.920243E-05  0.105E-02    1.27       2.6  T
   6    -20.7207358 -0.547779E-06  0.463E-03    1.27       6.0  T
   7    -20.7207359 -0.564757E-07  0.274E-03    1.27      10.1  T
     SCC iter.                  ...        0 min,  0.003 sec
     gradient                   ...        0 min,  0.004 sec
 * total energy  :   -20.3582061 Eh     change       -0.1217682E-02 Eh
   gradient norm :     0.0131890 Eh/α   predicted    -0.1064654E-02 ( -12.57%)
   displ. norm   :     0.0363301 α      lambda       -0.1851424E-03
   maximum displ.:     0.0295558 α      in ANC's #5, #1, #8, ...

........................................................................
.............................. CYCLE    4 ..............................
........................................................................
   1    -20.7210403 -0.207210E+02  0.432E-02    1.29       0.0  T
   2    -20.7210348  0.548664E-05  0.345E-02    1.29       1.0  T
   3    -20.7210415 -0.673598E-05  0.256E-02    1.29       1.1  T
   4    -20.7210454 -0.390197E-05  0.569E-03    1.29       4.9  T
   5    -20.7210458 -0.358162E-06  0.152E-03    1.29      18.2  T
   6    -20.7210458 -0.122558E-07  0.662E-04    1.29      41.9  T
     SCC iter.                  ...        0 min,  0.003 sec
     gradient                   ...        0 min,  0.004 sec
 * total energy  :   -20.3583263 Eh     change       -0.1202552E-03 Eh
   gradient norm :     0.0054268 Eh/α   predicted    -0.9269181E-04 ( -22.92%)
   displ. norm   :     0.0154519 α      lambda       -0.4252969E-04
   maximum displ.:     0.0109880 α      in ANC's #5, #13, #21, ...

........................................................................
.............................. CYCLE    5 ..............................
........................................................................
   1    -20.7215018 -0.207215E+02  0.250E-02    1.29       0.0  T
   2    -20.7215002  0.165459E-05  0.189E-02    1.29       1.5  T
   3    -20.7215018 -0.162539E-05  0.149E-02    1.29       1.9  T
   4    -20.7215031 -0.133845E-05  0.331E-03    1.29       8.4  T
   5    -20.7215032 -0.108044E-06  0.804E-04    1.29      34.5  T
   6    -20.7215033 -0.396600E-08  0.370E-04    1.29      75.0  T
     SCC iter.                  ...        0 min,  0.003 sec
     gradient                   ...        0 min,  0.004 sec
 * total energy  :   -20.3583506 Eh     change       -0.2427935E-04 Eh
   gradient norm :     0.0014677 Eh/α   predicted    -0.2126978E-04 ( -12.40%)
   displ. norm   :     0.0063675 α      lambda       -0.3492256E-05
   maximum displ.:     0.0032103 α      in ANC's #2, #13, #8, ...

........................................................................
.............................. CYCLE    6 ..............................
........................................................................
   1    -20.7217204 -0.207217E+02  0.105E-02    1.29       0.0  T
   2    -20.7217204  0.495425E-07  0.690E-03    1.29       4.0  T
   3    -20.7217204 -0.133034E-07  0.589E-03    1.29       4.7  T
   4    -20.7217206 -0.170070E-06  0.214E-03    1.29      13.0  T
   5    -20.7217206 -0.590431E-07  0.395E-04    1.29      70.2  T
   6    -20.7217206 -0.649720E-09  0.244E-04    1.29     113.5  T
     SCC iter.                  ...        0 min,  0.003 sec
     gradient                   ...        0 min,  0.005 sec
 * total energy  :   -20.3583528 Eh     change       -0.2168508E-05 Eh
   gradient norm :     0.0007452 Eh/α   predicted    -0.1745746E-05 ( -19.50%)
   displ. norm   :     0.0039547 α      lambda       -0.7284838E-06
   maximum displ.:     0.0024258 α      in ANC's #2, #11, #3, ...

   *** GEOMETRY OPTIMIZATION CONVERGED AFTER 6 ITERATIONS ***

------------------------------------------------------------------------
 total energy gain   :        -0.0104683 Eh       -6.5690 kcal/mol
 total RMSD          :         0.1114462 a0        0.0590 Å
 total power (kW/mol):        -4.5807672 (step) -410.1266 (real)
------------------------------------------------------------------------

 ANCopt (total)                0 d,  0 h,  0 min,  0.067 sec
 optimizer setup                ...        0 min,  0.000 sec (  0.205%)
 model hessian                  ...        0 min,  0.001 sec (  1.990%)
 ANC generation                 ...        0 min,  0.000 sec (  0.583%)
 coordinate transformation      ...        0 min,  0.000 sec (  0.107%)
 single point calculation       ...        0 min,  0.063 sec ( 94.337%)
 optimization log               ...        0 min,  0.000 sec (  0.604%)
 hessian update                 ...        0 min,  0.000 sec (  0.090%)
 rational function              ...        0 min,  0.001 sec (  1.377%)

================
 final structure:
================
$coord
   -3.93726722724557    0.42389893470858    0.44171836507910      C 
   -2.78833920207333   -1.83389186792502    0.58002511925919      C 
   -0.07020017004627   -1.37537925216072    0.31986661862729      C 
    2.26283078840547   -2.36864034218829    0.23346295600345      C 
    3.95782054523718   -0.14982064475583   -0.12650172132669      C 
    2.79447077018440    1.97051294477999   -0.24629204144905      N 
    0.23283023376938    1.36406386128478    0.01824942977533      C 
   -2.05396260858635    2.46538576127696    0.08509983026507      C 
   -5.93317399883207    0.78413462293350    0.56299919337424      H 
   -3.64677602597224   -3.65449715909827    0.83294534513302      H 
    2.89679508934973   -4.29077552164007    0.37612552007621      H 
    5.98323691849515   -0.25991105053554   -0.27662029283713      H 
   -2.52852656420740    4.43273023412728   -0.07786984548577      H 
$end
           -------------------------------------------------
          |                Final Singlepoint                |
           -------------------------------------------------

          ...................................................
          :                      SETUP                      :
          :.................................................:
          :  # basis functions                  37          :
          :  # atomic orbitals                  37          :
          :  # shells                           21          :
          :  # electrons                        38          :
          :  max. iterations                   250          :
          :  Hamiltonian                  GFN2-xTB          :
          :  restarted?                      false          :
          :  GBSA solvation                  false          :
          :  PC potential                    false          :
          :  electronic temp.          300.0000000     K    :
          :  accuracy                    1.0000000          :
          :  -> integral cutoff          0.2500000E+02      :
          :  -> integral neglect         0.1000000E-07      :
          :  -> SCF convergence          0.1000000E-05 Eh   :
          :  -> wf. convergence          0.1000000E-03 e    :
          :  Broyden damping             0.4000000          :
          ...................................................

 iter      E             dE          RMSdq      gap      omega  full diag
   1    -20.7217206 -0.207217E+02  0.135E-04    1.29       0.0  T
   2    -20.7217206  0.289191E-10  0.902E-05    1.29     307.6  T
   3    -20.7217206 -0.796092E-10  0.670E-05    1.29     414.2  T

   *** convergence criteria satisfied after 3 iterations ***

         #    Occupation            Energy/Eh            Energy/eV
      -------------------------------------------------------------
         1        2.0000           -0.6731314             -18.3168
       ...           ...                  ...                  ...
        13        2.0000           -0.4716246             -12.8336
        14        2.0000           -0.4613611             -12.5543
        15        2.0000           -0.4552290             -12.3874
        16        2.0000           -0.4386500             -11.9363
        17        2.0000           -0.4242715             -11.5450
        18        2.0000           -0.3841867             -10.4543
        19        2.0000           -0.3787536             -10.3064 (HOMO)
        20                         -0.3312807              -9.0146 (LUMO)
        21                         -0.2057656              -5.5992
        22                         -0.1501064              -4.0846
        23                         -0.1295068              -3.5241
        24                          0.0355053               0.9661
       ...                                ...                  ...
        37                          0.7495150              20.3953
      -------------------------------------------------------------
                  HL-Gap            0.0474729 Eh            1.2918 eV
             Fermi-level           -0.3550156 Eh           -9.6605 eV

 SCC (total)                   0 d,  0 h,  0 min,  0.010 sec
 SCC setup                      ...        0 min,  0.000 sec (  1.281%)
 Dispersion                     ...        0 min,  0.000 sec (  0.796%)
 integral evaluation            ...        0 min,  0.003 sec ( 28.171%)
 zeroth order Hamiltonian       ...        0 min,  0.000 sec (  0.611%)
 iterations                     ...        0 min,  0.002 sec ( 18.355%)
 molecular gradient             ...        0 min,  0.005 sec ( 47.950%)
 printout                       ...        0 min,  0.000 sec (  2.356%)

         :::::::::::::::::::::::::::::::::::::::::::::::::::::
         ::                     SUMMARY                     ::
         :::::::::::::::::::::::::::::::::::::::::::::::::::::
         :: total energy             -20.358352760749 Eh    ::
         :: gradient norm              0.000745750728 Eh/a0 ::
         :: HOMO-LUMO gap              1.291803233406 eV    ::
         ::.................................................::
         :: SCC energy               -20.721720635947 Eh    ::
         :: -> isotropic ES            0.007855709652 Eh    ::
         :: -> anisotropic ES          0.002056826579 Eh    ::
         :: -> anisotropic XC          0.018800785690 Eh    ::
         :: -> dispersion             -0.010430396121 Eh    ::
         :: repulsion energy           0.363359355067 Eh    ::
         :: add. restraining           0.000000000000 Eh    ::
         :::::::::::::::::::::::::::::::::::::::::::::::::::::

           -------------------------------------------------
          |                Property Printout                |
           -------------------------------------------------

    * Orbital Energies and Occupations

         #    Occupation            Energy/Eh            Energy/eV
      -------------------------------------------------------------
         1        2.0000           -0.6731314             -18.3168
       ...           ...                  ...                  ...
         7        2.0000           -0.5570689             -15.1586
         8        2.0000           -0.5497604             -14.9597
         9        2.0000           -0.5205516             -14.1649
        10        2.0000           -0.5160811             -14.0433
        11        2.0000           -0.4970284             -13.5248
        12        2.0000           -0.4828396             -13.1387
        13        2.0000           -0.4716246             -12.8336
        14        2.0000           -0.4613611             -12.5543
        15        2.0000           -0.4552290             -12.3874
        16        2.0000           -0.4386500             -11.9363
        17        2.0000           -0.4242715             -11.5450
        18        2.0000           -0.3841867             -10.4543
        19        2.0000           -0.3787536             -10.3064 (HOMO)
        20                         -0.3312807              -9.0146 (LUMO)
        21                         -0.2057656              -5.5992
        22                         -0.1501064              -4.0846
        23                         -0.1295068              -3.5241
        24                          0.0355053               0.9661
        25                          0.0688425               1.8733
        26                          0.1181734               3.2157
        27                          0.1315573               3.5799
        28                          0.1530490               4.1647
        29                          0.1970211               5.3612
        30                          0.2407040               6.5499
       ...                                ...                  ...
        37                          0.7495150              20.3953
      -------------------------------------------------------------
                  HL-Gap            0.0474729 Eh            1.2918 eV
             Fermi-level           -0.3550156 Eh           -9.6605 eV

     #   Z        covCN         q      C6AA      α(0)
     1   6 C      3.041    -0.035    28.822     8.805
     2   6 C      2.960    -0.035    28.868     8.813
     3   6 C      3.194    -0.003    27.576     8.562
     4   6 C      2.991    -0.031    28.763     8.798
     5   6 C      3.155     0.070    26.141     8.361
     6   7 N      1.850    -0.230    26.873     7.683
     7   6 C      3.304     0.061    24.860     7.974
     8   6 C      2.988    -0.016    28.402     8.742
     9   1 H      0.926     0.041     2.436     2.440
    10   1 H      0.926     0.042     2.423     2.434
    11   1 H      0.926     0.039     2.459     2.452
    12   1 H      0.926     0.043     2.415     2.430
    13   1 H      0.926     0.053     2.283     2.363

 Mol. C6AA /au·bohr⁶  :       2469.251302
 Mol. C8AA /au·bohr⁸  :      62000.517396
 Mol. α(0) /au        :         79.857397


Wiberg/Mayer (AO) data.
largest (>0.10) Wiberg bond orders for each atom
          total WBO             WBO to atom ...
     1  C   3.987        C    2 1.826    C    8 1.059    H    9 0.972
     2  C   3.989        C    1 1.826    C    3 1.047    H   10 0.971
     3  C   3.983        C    4 1.729    C    2 1.047    C    7 1.047
     4  C   3.985        C    3 1.729    C    5 1.041    H   11 0.972
     5  C   3.973        N    6 1.787    C    4 1.041    H   12 0.966    C    8 0.125
     6  N   3.053        C    5 1.787    C    7 1.082
     7  C   3.977        C    8 1.692    N    6 1.082    C    3 1.047
     8  C   3.982        C    7 1.692    C    1 1.059    H   13 0.971    C    5 0.125
     9  H   0.998        C    1 0.972
    10  H   0.998        C    2 0.971
    11  H   0.998        C    4 0.972
    12  H   0.998        C    5 0.966
    13  H   0.997        C    8 0.971

molecular dipole:
                 x           y           z       tot (Debye)
 q only:       -0.314      -0.359       0.061
   full:       -0.414      -0.728       0.105       2.145
molecular quadrupole (traceless):
                xx          xy          yy          xz          yz          zz
 q only:        1.871      -2.910      -0.068      -0.083      -0.042      -1.803
  q+dip:        4.099      -6.547       0.970      -0.181      -0.292      -5.069
   full:        2.416      -5.762      -0.709       0.145       0.163      -1.706

           -------------------------------------------------
          |                Geometry Summary                 |
           -------------------------------------------------

      molecular mass/u    :      103.1232000
   center of mass at/Å    :        0.0364622       0.0353029       0.0852813
  moments of inertia/u·Å² :        0.9434841E+02   0.2226586E+03   0.3170069E+03
rotational constants/cm⁻¹ :        0.1786743E+00   0.7571067E-01   0.5317749E-01

 * 10 selected distances

     #   Z        #   Z                                     value/Å
     1   6 C      2   6 C                                 1.3425660
     3   6 C      4   6 C                                 1.3425955
     5   6 C      6   7 N                                 1.2813901
     3   6 C      7   6 C                                 1.4672005 (max)
     7   6 C      8   6 C                                 1.3436102
     1   6 C      9   1 H                                 1.0751708
     2   6 C     10   1 H                                 1.0735240 (min)
     4   6 C     11   1 H                                 1.0737040
     5   6 C     12   1 H                                 1.0763220
     8   6 C     13   1 H                                 1.0744011

 * 3 distinct bonds (by element types)

   Z      Z             #   av. dist./Å        max./Å        min./Å
   1 H    6 C           5     1.0746244     1.0763220     1.0735240
   6 C    6 C           4     1.3739930     1.4672005     1.3425660
   6 C    7 N           1     1.2813901     1.2813901     1.2813901


optimized geometry written to: xtbopt.xyz


           -------------------------------------------------
          | TOTAL ENERGY              -20.358352760749 Eh   |
          | GRADIENT NORM               0.000745750728 Eh/α |
          | HOMO-LUMO GAP               1.291803233406 eV   |
           -------------------------------------------------

------------------------------------------------------------------------
 * finished run on 2021/05/19 at 10:59:25.771     
------------------------------------------------------------------------
 total:
 * wall-time:     0 d,  0 h,  0 min,  0.120 sec
 *  cpu-time:     0 d,  0 h,  0 min,  0.107 sec
 * ratio c/w:     0.891 speedup
 SCF:
 * wall-time:     0 d,  0 h,  0 min,  0.016 sec
 *  cpu-time:     0 d,  0 h,  0 min,  0.016 sec
 * ratio c/w:     0.999 speedup
 ANC optimizer:
 * wall-time:     0 d,  0 h,  0 min,  0.077 sec
 *  cpu-time:     0 d,  0 h,  0 min,  0.077 sec
 * ratio c/w:     1.000 speedup

