      -----------------------------------------------------------      
     |                   =====================                   |     
     |                           x T B                           |     
     |                   =====================                   |     
     |                         S. Grimme                         |     
     |          Mulliken Center for Theoretical Chemistry        |     
     |                    University of Bonn                     |     
     |                Version 6.2 RC2 (SAW190805)                |     
      -----------------------------------------------------------      

   This program is distributed in the hope that it will be useful,
   but WITHOUT ANY WARRANTY; without even the implied warranty of
   MERCHANTABILITY or FITNESS FOR A PARTICULAR PURPOSE.
   
   FOR NON-COMMERCIAL, ACADEMIA USE ONLY.
   
   Cite this work as:
   * S. Grimme, C. Bannwarth, P. Shushkov, J. Chem. Theory Comput., 2017,
     13, 1989-2009. DOI: 10.1021/acs.jctc.7b00118
   * C. Bannwarth, S. Ehlert and S. Grimme., J. Chem. Theory Comput., 2019,
     15, 1652-1671. DOI: 10.1021/acs.jctc.8b01176
   * P. Pracht, E. Caldeweyher, S. Ehlert, S. Grimme, ChemRxiv, 2019, preprint.
     DOI: 10.26434/chemrxiv.8326202.v1
   
   for DFT-D4:
   * E. Caldeweyher, C. Bannwarth and S. Grimme, J. Chem. Phys., 2017,
     147, 034112. DOI: 10.1063/1.4993215
   * E. Caldeweyher, S. Ehlert, A. Hansen, H. Neugebauer, S. Spicher,
     C. Bannwarth and S. Grimme, J. Chem. Phys., 2019, 150, 154122.
     DOI: 10.1063/1.5090222
   
   for sTDA-xTB:
   * S. Grimme and C. Bannwarth, J. Chem. Phys., 2016, 145, 054103.
     DOI: 10.1063/1.4959605
   
   in the mass-spec context:
   * V. Asgeirsson, C. Bauer and S. Grimme, Chem. Sci., 2017, 8, 4879.
     DOI: 10.1039/c7sc00601b
   
   for metadynamics refer to:
   * S. Grimme, J. Chem. Theory Comput., 2019, 155, 2847-2862
     DOI: 10.1021/acs.jctc.9b00143
   
   with help from (in alphabetical order)
   C. Bannwarth, F. Bohle, G. Brandenburg, E. Caldeweyher, M. Checinski,
   S. Dohm, S. Ehlert, S. Ehrlich, F. März, H. Neugebauer, J. Pisarek,
   P. Pracht, P. Shushkov, and S. Spicher.
   
 * started run on 2021/05/19 at 10:58:16.979     

           -------------------------------------------------
          |                Calculation Setup                |
           -------------------------------------------------

          program call               : /ihome/ghutchison/geoffh/xtb/xtb 27.xyz -opt
          hostname                   : smp-n58
          coordinate file            : 27.xyz
          omp threads                :                     1
          number of atoms            :                    30
          number of electrons        :                    84
          charge                     :                     0
          spin                       :                   0.0
          first test random number   :      0.20745499601293


########################################################################
# WARNING! Please study the warnings concerning your input carefully
#  - the use of '-opt' is discouraged, please use '--opt' next time
########################################################################

           ------------------------------------------------- 
          |                 G F N 2 - x T B                 |
          | Geometry, Frequencies, Noncovalent interactions |
          |            JCTC 2019 parametrisation            |
           ------------------------------------------------- 
             KAB for C  - Si     :                1.0500
             KAB for H  - Pd     :                0.9500
             k(s)              :                1.8500
             k(p)              :                2.2300
             k(d)              :                2.2300
             k(f)              :                2.0000
             kEN (H0ij)        :               -2.0000
             D4 a1             :                0.5200
             D4 a2             :                5.0000
             D4 s6             :                1.0000
             D4 s8             :                2.7000
             D4 s9             :                5.0000
             alphaj            :                2.0000

  Z AO/shell   Hii/eV     exponent
  1     Wed Apr 25 08:07:45 CEST 2018   EN: 2.200 GM2: 0.406  GM3: 0.0800  RAES: 1.40
     1s    -10.707211    1.230000
  6     Wed Apr 25 08:07:45 CEST 2018   EN: 2.550 GM2: 0.538  GM3: 0.1500  RAES: 3.00
     2s    -13.970922    2.096432
     2p    -10.063292    1.800000

           ------------------------------------------------- 
          |        Self-Consistent Charge Iterations        |
           ------------------------------------------------- 

          ...................................................
          :                      SETUP                      :
          :.................................................:
          :  # basis functions                  84          :
          :  # atomic orbitals                  84          :
          :  # shells                           48          :
          :  # electrons                        84          :
          :  max. iterations                   250          :
          :  Hamiltonian                  GFN2-xTB          :
          :  restarted?                      false          :
          :  GBSA solvation                  false          :
          :  PC potential                    false          :
          :  electronic temp.          300.0000000     K    :
          :  accuracy                    1.0000000          :
          :  -> integral cutoff          0.2500000E+02      :
          :  -> integral neglect         0.1000000E-07      :
          :  -> SCF convergence          0.1000000E-05 Eh   :
          :  -> wf. convergence          0.1000000E-03 e    :
          :  Broyden damping             0.4000000          :
          ...................................................

 iter      E             dE          RMSdq      gap      omega  full diag
   1    -45.4397723 -0.454398E+02  0.493E+00    1.87       0.0  T
   2    -45.4586322 -0.188599E-01  0.293E+00    1.92       1.0  T
   3    -45.4321594  0.264729E-01  0.994E-01    1.74       1.0  T
   4    -45.4612865 -0.291271E-01  0.286E-01    1.89       1.0  T
   5    -45.4630846 -0.179812E-02  0.139E-01    1.86       1.0  T
   6    -45.4636091 -0.524489E-03  0.305E-02    1.86       1.0  T
   7    -45.4636124 -0.330035E-05  0.113E-02    1.87       1.6  T
   8    -45.4636135 -0.113003E-05  0.246E-03    1.87       7.4  T
   9    -45.4636137 -0.151903E-06  0.824E-04    1.87      22.2  T
  10    -45.4636137 -0.994610E-08  0.478E-04    1.87      38.2  T

   *** convergence criteria satisfied after 10 iterations ***

         #    Occupation            Energy/Eh            Energy/eV
      -------------------------------------------------------------
         1        2.0000           -0.6526770             -17.7602
       ...           ...                  ...                  ...
        36        2.0000           -0.4221275             -11.4867
        37        2.0000           -0.4211450             -11.4599
        38        2.0000           -0.4092229             -11.1355
        39        2.0000           -0.4086364             -11.1196
        40        2.0000           -0.3854217             -10.4879
        41        2.0000           -0.3795638             -10.3285
        42        2.0000           -0.3731934             -10.1551 (HOMO)
        43                         -0.3046055              -8.2887 (LUMO)
        44                         -0.2351400              -6.3985
        45                         -0.2296122              -6.2481
        46                         -0.2093762              -5.6974
        47                         -0.1892082              -5.1486
       ...                                ...                  ...
        84                          0.7657997              20.8385
      -------------------------------------------------------------
                  HL-Gap            0.0685879 Eh            1.8664 eV
             Fermi-level           -0.3388995 Eh           -9.2219 eV

 SCC (total)                   0 d,  0 h,  0 min,  0.046 sec
 SCC setup                      ...        0 min,  0.000 sec (  0.761%)
 Dispersion                     ...        0 min,  0.001 sec (  1.249%)
 integral evaluation            ...        0 min,  0.013 sec ( 28.014%)
 zeroth order Hamiltonian       ...        0 min,  0.000 sec (  0.421%)
 iterations                     ...        0 min,  0.015 sec ( 32.302%)
 molecular gradient             ...        0 min,  0.017 sec ( 36.239%)
 printout                       ...        0 min,  0.000 sec (  0.904%)

         :::::::::::::::::::::::::::::::::::::::::::::::::::::
         ::                     SUMMARY                     ::
         :::::::::::::::::::::::::::::::::::::::::::::::::::::
         :: total energy             -44.602736490289 Eh    ::
         :: gradient norm              0.047712641995 Eh/a0 ::
         :: HOMO-LUMO gap              1.866372957125 eV    ::
         ::.................................................::
         :: SCC energy               -45.463613662816 Eh    ::
         :: -> isotropic ES            0.001764362051 Eh    ::
         :: -> anisotropic ES          0.005828142949 Eh    ::
         :: -> anisotropic XC          0.028879266479 Eh    ::
         :: -> dispersion             -0.034414642070 Eh    ::
         :: repulsion energy           0.861032027722 Eh    ::
         :: add. restraining           0.000000000000 Eh    ::
         :::::::::::::::::::::::::::::::::::::::::::::::::::::

      ----------------------------------------------------------- 
     |                   =====================                   |
     |                        A N C O P T                        |
     |                   =====================                   |
     |               Approximate Normal Coordinate               |
     |                Rational Function Optimizer                |
      ----------------------------------------------------------- 

          ...................................................
          :                      SETUP                      :
          :.................................................:
          :   optimization level            normal          :
          :   max. optcycles                   200          :
          :   ANC micro-cycles                  20          :
          :   degrees of freedom                84          :
          :.................................................:
          :   RF solver                   davidson          :
          :   input Hessian                  false          :
          :   write xtbopt.log                true          :
          :   linear?                        false          :
          :   energy convergence         0.5000000E-05 Eh   :
          :   grad. convergence          0.1000000E-02 Eh/α :
          :   maximium RF displ.         2.0000000          :
          :   Hlow (freq-cutoff)         0.5000000E-02      :
          :   Hmax (freq-cutoff)         5.0000000          :
          :   S6 in model hess.         20.0000000          :
          ...................................................

generating ANC from model Hessian ...
Using Lindh-Hessian (1995)
 Shifting diagonal of input Hessian by   4.506901737437849E-003
 Lowest  eigenvalues of input Hessian
   -0.000000   -0.000000   -0.000000    0.000000    0.000000    0.000000
    0.005000    0.005360    0.005818    0.007651    0.011849    0.012342
    0.014384    0.014998    0.018048    0.021537    0.023779    0.024904
 Highest eigenvalues
    1.885639    1.969966    1.976110    2.027739    2.030389    2.075729
 

........................................................................
.............................. CYCLE    1 ..............................
........................................................................
   1    -45.4636137 -0.454636E+02  0.179E-04    1.87       0.0  T
   2    -45.4636137 -0.649152E-10  0.144E-04    1.87     126.9  T
   3    -45.4636137 -0.492079E-09  0.667E-05    1.87     273.9  T
     SCC iter.                  ...        0 min,  0.005 sec
     gradient                   ...        0 min,  0.019 sec
 * total energy  :   -44.6027365 Eh     change       -0.6008236E-08 Eh
   gradient norm :     0.0477130 Eh/α   predicted     0.0000000E+00 (-100.00%)
   displ. norm   :     0.2158066 α      lambda       -0.4773854E-02
   maximum displ.:     0.1317131 α      in ANC's #7, #18, #23, ...

........................................................................
.............................. CYCLE    2 ..............................
........................................................................
   1    -45.4841773 -0.454842E+02  0.989E-02    1.79       0.0  T
   2    -45.4841785 -0.112779E-05  0.643E-02    1.80       1.0  T
   3    -45.4841715  0.692477E-05  0.476E-02    1.79       1.0  T
   4    -45.4842138 -0.422368E-04  0.669E-03    1.80       2.7  T
   5    -45.4842151 -0.133320E-05  0.210E-03    1.80       8.7  T
   6    -45.4842151  0.949768E-08  0.123E-03    1.80      14.8  T
     SCC iter.                  ...        0 min,  0.009 sec
     gradient                   ...        0 min,  0.018 sec
 * total energy  :   -44.6058255 Eh     change       -0.3089048E-02 Eh
   gradient norm :     0.0200675 Eh/α   predicted    -0.2498102E-02 ( -19.13%)
   displ. norm   :     0.1158156 α      lambda       -0.7778215E-03
   maximum displ.:     0.0865786 α      in ANC's #7, #18, #23, ...

........................................................................
.............................. CYCLE    3 ..............................
........................................................................
   1    -45.4907014 -0.454907E+02  0.522E-02    1.76       0.0  T
   2    -45.4907013  0.707840E-07  0.336E-02    1.76       1.0  T
   3    -45.4907016 -0.309827E-06  0.260E-02    1.76       1.0  T
   4    -45.4907134 -0.117603E-04  0.303E-03    1.76       6.0  T
   5    -45.4907137 -0.252781E-06  0.120E-03    1.76      15.2  T
   6    -45.4907137 -0.103186E-07  0.711E-04    1.76      25.7  T
     SCC iter.                  ...        0 min,  0.009 sec
     gradient                   ...        0 min,  0.016 sec
 * total energy  :   -44.6062568 Eh     change       -0.4312585E-03 Eh
   gradient norm :     0.0059088 Eh/α   predicted    -0.3941314E-03 (  -8.61%)
   displ. norm   :     0.0206922 α      lambda       -0.4174066E-04
   maximum displ.:     0.0150022 α      in ANC's #7, #18, #36, ...

........................................................................
.............................. CYCLE    4 ..............................
........................................................................
   1    -45.4904421 -0.454904E+02  0.999E-03    1.75       0.0  T
   2    -45.4904422 -0.506687E-07  0.639E-03    1.75       2.9  T
   3    -45.4904423 -0.156027E-06  0.502E-03    1.75       3.6  T
   4    -45.4904427 -0.373313E-06  0.734E-04    1.75      24.9  T
   5    -45.4904427 -0.100867E-07  0.365E-04    1.75      50.0  T
     SCC iter.                  ...        0 min,  0.008 sec
     gradient                   ...        0 min,  0.016 sec
 * total energy  :   -44.6062841 Eh     change       -0.2729163E-04 Eh
   gradient norm :     0.0023449 Eh/α   predicted    -0.2088401E-04 ( -23.48%)
   displ. norm   :     0.0090428 α      lambda       -0.9977429E-05
   maximum displ.:     0.0040688 α      in ANC's #18, #1, #36, ...

........................................................................
.............................. CYCLE    5 ..............................
........................................................................
   1    -45.4900146 -0.454900E+02  0.532E-03    1.75       0.0  T
   2    -45.4900146 -0.152184E-07  0.340E-03    1.75       5.4  T
   3    -45.4900146 -0.561154E-08  0.257E-03    1.75       7.1  T
   4    -45.4900147 -0.982026E-07  0.494E-04    1.75      36.9  T
   5    -45.4900147 -0.663018E-08  0.148E-04    1.75     123.7  T
     SCC iter.                  ...        0 min,  0.007 sec
     gradient                   ...        0 min,  0.018 sec
 * total energy  :   -44.6062899 Eh     change       -0.5844326E-05 Eh
   gradient norm :     0.0008090 Eh/α   predicted    -0.4990364E-05 ( -14.61%)
   displ. norm   :     0.0076149 α      lambda       -0.1051143E-05
   maximum displ.:     0.0046081 α      in ANC's #1, #7, #14, ...

........................................................................
.............................. CYCLE    6 ..............................
........................................................................
   1    -45.4899088 -0.454899E+02  0.340E-03    1.75       0.0  T
   2    -45.4899088 -0.124131E-07  0.210E-03    1.75       8.7  T
   3    -45.4899088  0.213363E-07  0.135E-03    1.75      13.5  T
   4    -45.4899089 -0.347012E-07  0.265E-04    1.75      68.8  T
   5    -45.4899089 -0.183029E-08  0.651E-05    1.75     280.3  T
     SCC iter.                  ...        0 min,  0.007 sec
     gradient                   ...        0 min,  0.017 sec
 * total energy  :   -44.6062908 Eh     change       -0.8548011E-06 Eh
   gradient norm :     0.0003293 Eh/α   predicted    -0.5477249E-06 ( -35.92%)
   displ. norm   :     0.0043299 α      lambda       -0.1942713E-06
   maximum displ.:     0.0038750 α      in ANC's #1, #7, #22, ...

   *** GEOMETRY OPTIMIZATION CONVERGED AFTER 6 ITERATIONS ***

------------------------------------------------------------------------
 total energy gain   :        -0.0035543 Eh       -2.2304 kcal/mol
 total RMSD          :         0.0624239 a0        0.0330 Å
 total power (kW/mol):        -1.5553038 (step)  -39.6081 (real)
------------------------------------------------------------------------

 ANCopt (total)                0 d,  0 h,  0 min,  0.236 sec
 optimizer setup                ...        0 min,  0.000 sec (  0.060%)
 model hessian                  ...        0 min,  0.004 sec (  1.716%)
 ANC generation                 ...        0 min,  0.001 sec (  0.337%)
 coordinate transformation      ...        0 min,  0.000 sec (  0.047%)
 single point calculation       ...        0 min,  0.229 sec ( 97.014%)
 optimization log               ...        0 min,  0.001 sec (  0.295%)
 hessian update                 ...        0 min,  0.000 sec (  0.033%)
 rational function              ...        0 min,  0.001 sec (  0.313%)

================
 final structure:
================
$coord
    4.21931928790725   -1.13854606271687   -0.00599741420982      C 
    2.02373697743728   -2.58800310136472   -0.00454203070385      C 
   -0.30483670038663   -1.40355734812464   -0.00189529781237      C 
   -0.36545741620131    1.27312314217391   -0.00526514522808      C 
   -2.98053424611602    2.06316510013355   -0.00677738411898      C 
   -4.46462223389156   -0.00361390172048   -0.00397035682084      C 
   -2.94732974938720   -2.29277373827941    0.00147064801842      C 
   -3.85279642797138   -4.71357511842712    0.01436081855482      C 
   -2.33546288445172   -7.00261180609887    0.03448709496191      C 
   -3.81950007570910   -9.06933953812841    0.05064738176512      C 
   -6.43458104934126   -8.27941781415515    0.04103604691645      C 
   -6.49526178370244   -5.60284856311711    0.01789475424580      C 
   -8.82384736602169   -4.41851752449112    0.00239026187417      C 
  -11.01939085014559   -5.86799250511803    0.01326505177838      C 
  -10.92896937340746   -8.47871689553993    0.03806435766204      C 
   -8.61257520901857   -9.71262479951169    0.05134989653890      C 
    1.81256841774214    2.70630783246498   -0.00697328442859      C 
    4.12894870702569    1.47229559786273   -0.00626156737580      C 
    6.02837016745740   -2.08489596153574   -0.00700113820734      H 
    2.22686593454279   -4.61237627709035   -0.00701833980171      H 
   -3.59014956788991    4.00160608560247   -0.00977323465477      H 
   -6.48641908717289    0.03369582005378   -0.00270149043147      H 
   -0.31366429458559   -7.03985063099867    0.03919289082451      H 
   -3.20979872601917  -11.00768485913546    0.06814073884611      H 
   -9.02701393025348   -2.39425601134392   -0.01912236345693      H 
  -12.82846306032215   -4.92175117910618    0.00195738589209      H 
  -12.66096299303679   -9.55869274160115    0.04662443568503      H 
   -8.51405670613252  -11.75184279162815    0.06961688499026      H 
    1.71412028811958    4.74561014167367   -0.00878627088268      H 
    5.86097124869112    2.55225863519823   -0.00667936014400      H 
$end
           -------------------------------------------------
          |                Final Singlepoint                |
           -------------------------------------------------

          ...................................................
          :                      SETUP                      :
          :.................................................:
          :  # basis functions                  84          :
          :  # atomic orbitals                  84          :
          :  # shells                           48          :
          :  # electrons                        84          :
          :  max. iterations                   250          :
          :  Hamiltonian                  GFN2-xTB          :
          :  restarted?                      false          :
          :  GBSA solvation                  false          :
          :  PC potential                    false          :
          :  electronic temp.          300.0000000     K    :
          :  accuracy                    1.0000000          :
          :  -> integral cutoff          0.2500000E+02      :
          :  -> integral neglect         0.1000000E-07      :
          :  -> SCF convergence          0.1000000E-05 Eh   :
          :  -> wf. convergence          0.1000000E-03 e    :
          :  Broyden damping             0.4000000          :
          ...................................................

 iter      E             dE          RMSdq      gap      omega  full diag
   1    -45.4899089 -0.454899E+02  0.423E-05    1.75       0.0  T
   2    -45.4899089  0.150067E-10  0.304E-05    1.75     600.7  T
   3    -45.4899089 -0.263753E-10  0.222E-05    1.75     822.8  T

   *** convergence criteria satisfied after 3 iterations ***

         #    Occupation            Energy/Eh            Energy/eV
      -------------------------------------------------------------
         1        2.0000           -0.6535482             -17.7840
       ...           ...                  ...                  ...
        36        2.0000           -0.4219246             -11.4812
        37        2.0000           -0.4204035             -11.4398
        38        2.0000           -0.4107148             -11.1761
        39        2.0000           -0.4079121             -11.0999
        40        2.0000           -0.3855038             -10.4901
        41        2.0000           -0.3796396             -10.3305
        42        2.0000           -0.3720926             -10.1252 (HOMO)
        43                         -0.3076253              -8.3709 (LUMO)
        44                         -0.2345279              -6.3818
        45                         -0.2290030              -6.2315
        46                         -0.2072240              -5.6389
        47                         -0.1869374              -5.0868
       ...                                ...                  ...
        84                          0.7640911              20.7920
      -------------------------------------------------------------
                  HL-Gap            0.0644673 Eh            1.7542 eV
             Fermi-level           -0.3398590 Eh           -9.2480 eV

 SCC (total)                   0 d,  0 h,  0 min,  0.037 sec
 SCC setup                      ...        0 min,  0.000 sec (  0.772%)
 Dispersion                     ...        0 min,  0.000 sec (  1.109%)
 integral evaluation            ...        0 min,  0.013 sec ( 35.144%)
 zeroth order Hamiltonian       ...        0 min,  0.000 sec (  0.479%)
 iterations                     ...        0 min,  0.005 sec ( 13.475%)
 molecular gradient             ...        0 min,  0.017 sec ( 47.898%)
 printout                       ...        0 min,  0.000 sec (  1.003%)

         :::::::::::::::::::::::::::::::::::::::::::::::::::::
         ::                     SUMMARY                     ::
         :::::::::::::::::::::::::::::::::::::::::::::::::::::
         :: total energy             -44.606290792692 Eh    ::
         :: gradient norm              0.000329327692 Eh/a0 ::
         :: HOMO-LUMO gap              1.754244248044 eV    ::
         ::.................................................::
         :: SCC energy               -45.489908860570 Eh    ::
         :: -> isotropic ES            0.001783245944 Eh    ::
         :: -> anisotropic ES          0.005749025862 Eh    ::
         :: -> anisotropic XC          0.027919785962 Eh    ::
         :: -> dispersion             -0.034584184480 Eh    ::
         :: repulsion energy           0.883773762065 Eh    ::
         :: add. restraining           0.000000000000 Eh    ::
         :::::::::::::::::::::::::::::::::::::::::::::::::::::

           -------------------------------------------------
          |                Property Printout                |
           -------------------------------------------------

    * Orbital Energies and Occupations

         #    Occupation            Energy/Eh            Energy/eV
      -------------------------------------------------------------
         1        2.0000           -0.6535482             -17.7840
       ...           ...                  ...                  ...
        30        2.0000           -0.4522676             -12.3068
        31        2.0000           -0.4521951             -12.3049
        32        2.0000           -0.4413793             -12.0105
        33        2.0000           -0.4370657             -11.8932
        34        2.0000           -0.4302334             -11.7072
        35        2.0000           -0.4244393             -11.5496
        36        2.0000           -0.4219246             -11.4812
        37        2.0000           -0.4204035             -11.4398
        38        2.0000           -0.4107148             -11.1761
        39        2.0000           -0.4079121             -11.0999
        40        2.0000           -0.3855038             -10.4901
        41        2.0000           -0.3796396             -10.3305
        42        2.0000           -0.3720926             -10.1252 (HOMO)
        43                         -0.3076253              -8.3709 (LUMO)
        44                         -0.2345279              -6.3818
        45                         -0.2290030              -6.2315
        46                         -0.2072240              -5.6389
        47                         -0.1869374              -5.0868
        48                         -0.1633388              -4.4447
        49                         -0.1082472              -2.9456
        50                         -0.0754907              -2.0542
        51                         -0.0611056              -1.6628
        52                          0.0571481               1.5551
        53                          0.0806421               2.1944
       ...                                ...                  ...
        84                          0.7640911              20.7920
      -------------------------------------------------------------
                  HL-Gap            0.0644673 Eh            1.7542 eV
             Fermi-level           -0.3398590 Eh           -9.2480 eV

     #   Z        covCN         q      C6AA      α(0)
     1   6 C      2.920    -0.035    28.862     8.810
     2   6 C      2.916    -0.028    28.712     8.787
     3   6 C      3.054    -0.003    28.043     8.685
     4   6 C      3.090     0.005    27.814     8.645
     5   6 C      2.984    -0.035    28.861     8.812
     6   6 C      3.005    -0.046    29.114     8.851
     7   6 C      3.034     0.017    27.610     8.619
     8   6 C      3.034     0.017    27.610     8.619
     9   6 C      3.005    -0.046    29.114     8.851
    10   6 C      2.985    -0.035    28.861     8.812
    11   6 C      3.090     0.005    27.814     8.645
    12   6 C      3.054    -0.003    28.043     8.685
    13   6 C      2.916    -0.028    28.712     8.787
    14   6 C      2.920    -0.035    28.862     8.810
    15   6 C      2.920    -0.030    28.754     8.793
    16   6 C      2.913    -0.033    28.822     8.803
    17   6 C      2.913    -0.033    28.822     8.803
    18   6 C      2.920    -0.030    28.754     8.793
    19   1 H      0.926     0.029     2.593     2.518
    20   1 H      0.926     0.033     2.546     2.495
    21   1 H      0.926     0.031     2.577     2.510
    22   1 H      0.927     0.035     2.520     2.482
    23   1 H      0.927     0.035     2.520     2.482
    24   1 H      0.926     0.031     2.577     2.510
    25   1 H      0.926     0.033     2.546     2.495
    26   1 H      0.926     0.029     2.593     2.518
    27   1 H      0.926     0.030     2.587     2.515
    28   1 H      0.926     0.031     2.578     2.511
    29   1 H      0.926     0.031     2.578     2.511
    30   1 H      0.926     0.030     2.587     2.515

 Mol. C6AA /au·bohr⁶  :      13296.587440
 Mol. C8AA /au·bohr⁸  :     340608.535933
 Mol. α(0) /au        :        187.673724


Wiberg/Mayer (AO) data.
largest (>0.10) Wiberg bond orders for each atom
          total WBO             WBO to atom ...
     1  C   3.987        C   18 1.455    C    2 1.403    H   19 0.972
     2  C   3.981        C    3 1.435    C    1 1.403    H   20 0.957
     3  C   3.984        C    2 1.435    C    4 1.273    C    7 1.069
     4  C   3.975        C   17 1.423    C    3 1.273    C    5 1.108
     5  C   3.941        C    6 1.722    C    4 1.108    H   21 0.972
     6  C   3.987        C    5 1.722    C    7 1.129    H   22 0.959
     7  C   3.967        C    8 1.546    C    6 1.129    C    3 1.069
     8  C   3.967        C    7 1.546    C    9 1.129    C   12 1.069
     9  C   3.987        C   10 1.722    C    8 1.129    H   23 0.959
    10  C   3.941        C    9 1.722    C   11 1.108    H   24 0.972
    11  C   3.975        C   16 1.423    C   12 1.273    C   10 1.108
    12  C   3.984        C   13 1.435    C   11 1.273    C    8 1.069
    13  C   3.981        C   12 1.435    C   14 1.403    H   25 0.957
    14  C   3.987        C   15 1.455    C   13 1.403    H   26 0.972
    15  C   3.959        C   14 1.455    C   16 1.407    H   27 0.971
    16  C   3.982        C   11 1.423    C   15 1.407    H   28 0.969
    17  C   3.982        C    4 1.423    C   18 1.407    H   29 0.969
    18  C   3.959        C    1 1.455    C   17 1.407    H   30 0.971
    19  H   0.999        C    1 0.972
    20  H   0.999        C    2 0.957
    21  H   0.998        C    5 0.972
    22  H   0.998        C    6 0.959
    23  H   0.998        C    9 0.959
    24  H   0.998        C   10 0.972
    25  H   0.999        C   13 0.957
    26  H   0.999        C   14 0.972
    27  H   0.998        C   15 0.971
    28  H   0.999        C   16 0.969
    29  H   0.999        C   17 0.969
    30  H   0.998        C   18 0.971

molecular dipole:
                 x           y           z       tot (Debye)
 q only:       -0.000       0.000      -0.000
   full:        0.000       0.000       0.001       0.002
molecular quadrupole (traceless):
                xx          xy          yy          xz          yz          zz
 q only:        2.058      -0.234       1.499       0.004      -0.025      -3.557
  q+dip:        6.814       0.223       7.853       0.004      -0.116     -14.667
   full:        3.277      -0.101       3.769       0.000      -0.058      -7.045

           -------------------------------------------------
          |                Geometry Summary                 |
           -------------------------------------------------

      molecular mass/u    :      228.2928000
   center of mass at/Å    :       -1.7992196      -1.8538034       0.0066007
  moments of inertia/u·Å² :        0.4056938E+03   0.2072747E+04   0.2478432E+04
rotational constants/cm⁻¹ :        0.4155260E-01   0.8132989E-02   0.6801732E-02

 * 27 selected distances

     #   Z        #   Z                                     value/Å
     1   6 C      2   6 C                                 1.3921999
     2   6 C      3   6 C                                 1.3824774
     3   6 C      4   6 C                                 1.4168028 (max)
     5   6 C      6   6 C                                 1.3464520
     7   6 C      8   6 C                                 1.3677277
     9   6 C     10   6 C                                 1.3464407
    11   6 C     12   6 C                                 1.4167965
    12   6 C     13   6 C                                 1.3824791
    13   6 C     14   6 C                                 1.3921996
    14   6 C     15   6 C                                 1.3824266
    11   6 C     16   6 C                                 1.3797070
    15   6 C     16   6 C                                 1.3888647
     4   6 C     17   6 C                                 1.3797040
     1   6 C     18   6 C                                 1.3824254
    17   6 C     18   6 C                                 1.3888665
     1   6 C     19   1 H                                 1.0803830
     2   6 C     20   1 H                                 1.0766325
     5   6 C     21   1 H                                 1.0753102
     6   6 C     22   1 H                                 1.0700713 (min)
     9   6 C     23   1 H                                 1.0700742
    10   6 C     24   1 H                                 1.0753143
    13   6 C     25   1 H                                 1.0766350
    14   6 C     26   1 H                                 1.0803828
    15   6 C     27   1 H                                 1.0801210
    16   6 C     28   1 H                                 1.0804096
    17   6 C     29   1 H                                 1.0804096
    18   6 C     30   1 H                                 1.0801210

 * 2 distinct bonds (by element types)

   Z      Z             #   av. dist./Å        max./Å        min./Å
   1 H    6 C          12     1.0771554     1.0804096     1.0700713
   6 C    6 C          15     1.3830380     1.4168028     1.3464407


optimized geometry written to: xtbopt.xyz


           -------------------------------------------------
          | TOTAL ENERGY              -44.606290792692 Eh   |
          | GRADIENT NORM               0.000329327692 Eh/α |
          | HOMO-LUMO GAP               1.754244248044 eV   |
           -------------------------------------------------

------------------------------------------------------------------------
 * finished run on 2021/05/19 at 10:58:17.322     
------------------------------------------------------------------------
 total:
 * wall-time:     0 d,  0 h,  0 min,  0.343 sec
 *  cpu-time:     0 d,  0 h,  0 min,  0.343 sec
 * ratio c/w:     0.999 speedup
 SCF:
 * wall-time:     0 d,  0 h,  0 min,  0.046 sec
 *  cpu-time:     0 d,  0 h,  0 min,  0.046 sec
 * ratio c/w:     1.000 speedup
 ANC optimizer:
 * wall-time:     0 d,  0 h,  0 min,  0.273 sec
 *  cpu-time:     0 d,  0 h,  0 min,  0.273 sec
 * ratio c/w:     1.000 speedup

