      -----------------------------------------------------------      
     |                   =====================                   |     
     |                           x T B                           |     
     |                   =====================                   |     
     |                         S. Grimme                         |     
     |          Mulliken Center for Theoretical Chemistry        |     
     |                    University of Bonn                     |     
     |                Version 6.2 RC2 (SAW190805)                |     
      -----------------------------------------------------------      

   This program is distributed in the hope that it will be useful,
   but WITHOUT ANY WARRANTY; without even the implied warranty of
   MERCHANTABILITY or FITNESS FOR A PARTICULAR PURPOSE.
   
   FOR NON-COMMERCIAL, ACADEMIA USE ONLY.
   
   Cite this work as:
   * S. Grimme, C. Bannwarth, P. Shushkov, J. Chem. Theory Comput., 2017,
     13, 1989-2009. DOI: 10.1021/acs.jctc.7b00118
   * C. Bannwarth, S. Ehlert and S. Grimme., J. Chem. Theory Comput., 2019,
     15, 1652-1671. DOI: 10.1021/acs.jctc.8b01176
   * P. Pracht, E. Caldeweyher, S. Ehlert, S. Grimme, ChemRxiv, 2019, preprint.
     DOI: 10.26434/chemrxiv.8326202.v1
   
   for DFT-D4:
   * E. Caldeweyher, C. Bannwarth and S. Grimme, J. Chem. Phys., 2017,
     147, 034112. DOI: 10.1063/1.4993215
   * E. Caldeweyher, S. Ehlert, A. Hansen, H. Neugebauer, S. Spicher,
     C. Bannwarth and S. Grimme, J. Chem. Phys., 2019, 150, 154122.
     DOI: 10.1063/1.5090222
   
   for sTDA-xTB:
   * S. Grimme and C. Bannwarth, J. Chem. Phys., 2016, 145, 054103.
     DOI: 10.1063/1.4959605
   
   in the mass-spec context:
   * V. Asgeirsson, C. Bauer and S. Grimme, Chem. Sci., 2017, 8, 4879.
     DOI: 10.1039/c7sc00601b
   
   for metadynamics refer to:
   * S. Grimme, J. Chem. Theory Comput., 2019, 155, 2847-2862
     DOI: 10.1021/acs.jctc.9b00143
   
   with help from (in alphabetical order)
   C. Bannwarth, F. Bohle, G. Brandenburg, E. Caldeweyher, M. Checinski,
   S. Dohm, S. Ehlert, S. Ehrlich, F. März, H. Neugebauer, J. Pisarek,
   P. Pracht, P. Shushkov, and S. Spicher.
   
 * started run on 2021/05/19 at 10:59:36.041     

           -------------------------------------------------
          |                Calculation Setup                |
           -------------------------------------------------

          program call               : /ihome/ghutchison/geoffh/xtb/xtb 279.xyz -opt
          hostname                   : smp-n83
          coordinate file            : 279.xyz
          omp threads                :                     1
          number of atoms            :                    20
          number of electrons        :                    50
          charge                     :                     0
          spin                       :                   0.0
          first test random number   :      0.06573821817886


########################################################################
# WARNING! Please study the warnings concerning your input carefully
#  - the use of '-opt' is discouraged, please use '--opt' next time
########################################################################

           ------------------------------------------------- 
          |                 G F N 2 - x T B                 |
          | Geometry, Frequencies, Noncovalent interactions |
          |            JCTC 2019 parametrisation            |
           ------------------------------------------------- 
             KAB for C  - Si     :                1.0500
             KAB for H  - Pd     :                0.9500
             k(s)              :                1.8500
             k(p)              :                2.2300
             k(d)              :                2.2300
             k(f)              :                2.0000
             kEN (H0ij)        :               -2.0000
             D4 a1             :                0.5200
             D4 a2             :                5.0000
             D4 s6             :                1.0000
             D4 s8             :                2.7000
             D4 s9             :                5.0000
             alphaj            :                2.0000

  Z AO/shell   Hii/eV     exponent
  1     Wed Apr 25 08:07:45 CEST 2018   EN: 2.200 GM2: 0.406  GM3: 0.0800  RAES: 1.40
     1s    -10.707211    1.230000
  6     Wed Apr 25 08:07:45 CEST 2018   EN: 2.550 GM2: 0.538  GM3: 0.1500  RAES: 3.00
     2s    -13.970922    2.096432
     2p    -10.063292    1.800000
  7     Wed Apr 25 08:07:45 CEST 2018   EN: 3.040 GM2: 0.461  GM3:-0.0640  RAES: 1.90
     2s    -16.686243    2.339881
     2p    -12.523956    2.014332
 16     Tue Apr 24 11:44:34 CEST 2018   EN: 2.580 GM2: 0.340  GM3:-0.0502  RAES: 3.10
     3s    -20.029654    1.981333
     3p    -11.377694    2.025643
     3d     -0.420282    1.702555

           ------------------------------------------------- 
          |        Self-Consistent Charge Iterations        |
           ------------------------------------------------- 

          ...................................................
          :                      SETUP                      :
          :.................................................:
          :  # basis functions                  53          :
          :  # atomic orbitals                  52          :
          :  # shells                           30          :
          :  # electrons                        50          :
          :  max. iterations                   250          :
          :  Hamiltonian                  GFN2-xTB          :
          :  restarted?                      false          :
          :  GBSA solvation                  false          :
          :  PC potential                    false          :
          :  electronic temp.          300.0000000     K    :
          :  accuracy                    1.0000000          :
          :  -> integral cutoff          0.2500000E+02      :
          :  -> integral neglect         0.1000000E-07      :
          :  -> SCF convergence          0.1000000E-05 Eh   :
          :  -> wf. convergence          0.1000000E-03 e    :
          :  Broyden damping             0.4000000          :
          ...................................................

 iter      E             dE          RMSdq      gap      omega  full diag
   1    -26.9450793 -0.269451E+02  0.445E+00    3.04       0.0  T
   2    -26.9817771 -0.366978E-01  0.264E+00    3.33       1.0  T
   3    -26.9784278  0.334937E-02  0.110E+00    3.34       1.0  T
   4    -26.9849320 -0.650425E-02  0.448E-01    3.18       1.0  T
   5    -26.9860236 -0.109163E-02  0.243E-01    3.18       1.0  T
   6    -26.9866325 -0.608863E-03  0.900E-02    3.19       1.0  T
   7    -26.9866754 -0.429101E-04  0.260E-02    3.18       1.0  T
   8    -26.9866769 -0.149814E-05  0.125E-02    3.18       1.8  T
   9    -26.9866772 -0.261599E-06  0.307E-03    3.18       7.3  T
  10    -26.9866772 -0.290011E-07  0.161E-03    3.18      13.9  T
  11    -26.9866772 -0.782807E-08  0.457E-04    3.18      49.0  T
  12    -26.9866772 -0.766786E-09  0.188E-04    3.18     118.9  T

   *** convergence criteria satisfied after 12 iterations ***

         #    Occupation            Energy/Eh            Energy/eV
      -------------------------------------------------------------
         1        2.0000           -0.7149920             -19.4559
       ...           ...                  ...                  ...
        19        2.0000           -0.4568855             -12.4325
        20        2.0000           -0.4536411             -12.3442
        21        2.0000           -0.4453695             -12.1191
        22        2.0000           -0.4170011             -11.3472
        23        2.0000           -0.4093741             -11.1396
        24        2.0000           -0.3717342             -10.1154
        25        2.0000           -0.3588790              -9.7656 (HOMO)
        26                         -0.2419042              -6.5825 (LUMO)
        27                         -0.2166173              -5.8945
        28                         -0.1570415              -4.2733
        29                         -0.0657335              -1.7887
        30                         -0.0150026              -0.4082
       ...                                ...                  ...
        52                          0.5662961              15.4097
      -------------------------------------------------------------
                  HL-Gap            0.1169748 Eh            3.1830 eV
             Fermi-level           -0.3003916 Eh           -8.1741 eV

 SCC (total)                   0 d,  0 h,  0 min,  0.025 sec
 SCC setup                      ...        0 min,  0.000 sec (  0.889%)
 Dispersion                     ...        0 min,  0.000 sec (  0.748%)
 integral evaluation            ...        0 min,  0.006 sec ( 22.132%)
 zeroth order Hamiltonian       ...        0 min,  0.000 sec (  0.459%)
 iterations                     ...        0 min,  0.010 sec ( 38.868%)
 molecular gradient             ...        0 min,  0.009 sec ( 35.368%)
 printout                       ...        0 min,  0.000 sec (  1.337%)

         :::::::::::::::::::::::::::::::::::::::::::::::::::::
         ::                     SUMMARY                     ::
         :::::::::::::::::::::::::::::::::::::::::::::::::::::
         :: total energy             -26.665421952809 Eh    ::
         :: gradient norm              0.111844381847 Eh/a0 ::
         :: HOMO-LUMO gap              3.183046351335 eV    ::
         ::.................................................::
         :: SCC energy               -26.986677209713 Eh    ::
         :: -> isotropic ES            0.012166088269 Eh    ::
         :: -> anisotropic ES          0.004569571650 Eh    ::
         :: -> anisotropic XC          0.023893957956 Eh    ::
         :: -> dispersion             -0.017375043234 Eh    ::
         :: repulsion energy           0.321170813345 Eh    ::
         :: add. restraining           0.000000000000 Eh    ::
         :::::::::::::::::::::::::::::::::::::::::::::::::::::

      ----------------------------------------------------------- 
     |                   =====================                   |
     |                        A N C O P T                        |
     |                   =====================                   |
     |               Approximate Normal Coordinate               |
     |                Rational Function Optimizer                |
      ----------------------------------------------------------- 

          ...................................................
          :                      SETUP                      :
          :.................................................:
          :   optimization level            normal          :
          :   max. optcycles                   200          :
          :   ANC micro-cycles                  20          :
          :   degrees of freedom                54          :
          :.................................................:
          :   RF solver                   davidson          :
          :   input Hessian                  false          :
          :   write xtbopt.log                true          :
          :   linear?                        false          :
          :   energy convergence         0.5000000E-05 Eh   :
          :   grad. convergence          0.1000000E-02 Eh/α :
          :   maximium RF displ.         2.0000000          :
          :   Hlow (freq-cutoff)         0.5000000E-02      :
          :   Hmax (freq-cutoff)         5.0000000          :
          :   S6 in model hess.         20.0000000          :
          ...................................................

generating ANC from model Hessian ...
Using Lindh-Hessian (1995)
 Shifting diagonal of input Hessian by   2.092877051540949E-003
 Lowest  eigenvalues of input Hessian
   -0.000000   -0.000000   -0.000000    0.000000    0.000000    0.000000
    0.005000    0.005857    0.007144    0.011953    0.013680    0.019612
    0.023000    0.028331    0.031278    0.036145    0.039916    0.043437
 Highest eigenvalues
    1.234528    1.298563    1.329895    1.441318    1.476289    1.862020
 

........................................................................
.............................. CYCLE    1 ..............................
........................................................................
   1    -26.9866772 -0.269867E+02  0.575E-05    3.18       0.0  T
   2    -26.9866772 -0.997247E-11  0.321E-05    3.18     697.6  T
   3    -26.9866772 -0.236611E-11  0.214E-05    3.18    1045.2  T
     SCC iter.                  ...        0 min,  0.003 sec
     gradient                   ...        0 min,  0.009 sec
 * total energy  :   -26.6654220 Eh     change       -0.1717922E-07 Eh
   gradient norm :     0.1118446 Eh/α   predicted     0.0000000E+00 (-100.00%)
   displ. norm   :     0.4593421 α      lambda       -0.3631145E-01
   maximum displ.:     0.2016345 α      in ANC's #9, #31, #29, ...

........................................................................
.............................. CYCLE    2 ..............................
........................................................................
   1    -27.0255243 -0.270255E+02  0.931E-01    3.35       0.0  T
   2    -27.0259498 -0.425471E-03  0.453E-01    3.35       1.0  T
   3    -27.0259344  0.153713E-04  0.119E-01    3.35       1.0  T
   4    -27.0260147 -0.802827E-04  0.597E-02    3.35       1.0  T
   5    -27.0260234 -0.877228E-05  0.310E-02    3.35       1.0  T
   6    -27.0260343 -0.108794E-04  0.598E-03    3.35       3.7  T
   7    -27.0260345 -0.143553E-06  0.306E-03    3.35       7.3  T
   8    -27.0260345 -0.144966E-07  0.139E-03    3.35      16.1  T
     SCC iter.                  ...        0 min,  0.006 sec
     gradient                   ...        0 min,  0.008 sec
 * total energy  :   -26.6867483 Eh     change       -0.2132636E-01 Eh
   gradient norm :     0.0328362 Eh/α   predicted    -0.2198668E-01 (   3.10%)
   displ. norm   :     0.2385116 α      lambda       -0.3460796E-02
   maximum displ.:     0.1124150 α      in ANC's #4, #3, #9, ...

........................................................................
.............................. CYCLE    3 ..............................
........................................................................
   1    -27.0315215 -0.270315E+02  0.294E-01    3.39       0.0  T
   2    -27.0315529 -0.313604E-04  0.149E-01    3.39       1.0  T
   3    -27.0315501  0.277366E-05  0.389E-02    3.39       1.0  T
   4    -27.0315590 -0.885606E-05  0.190E-02    3.39       1.2  T
   5    -27.0315591 -0.110925E-06  0.988E-03    3.39       2.3  T
   6    -27.0315604 -0.135222E-05  0.150E-03    3.39      14.9  T
   7    -27.0315605 -0.809301E-08  0.803E-04    3.39      27.8  T
     SCC iter.                  ...        0 min,  0.005 sec
     gradient                   ...        0 min,  0.008 sec
 * total energy  :   -26.6888730 Eh     change       -0.2124651E-02 Eh
   gradient norm :     0.0120537 Eh/α   predicted    -0.1828842E-02 ( -13.92%)
   displ. norm   :     0.2123041 α      lambda       -0.8879684E-03
   maximum displ.:     0.1171615 α      in ANC's #3, #4, #9, ...

........................................................................
.............................. CYCLE    4 ..............................
........................................................................
   1    -27.0316616 -0.270317E+02  0.143E-01    3.40       0.0  T
   2    -27.0316652 -0.360369E-05  0.812E-02    3.40       1.0  T
   3    -27.0316656 -0.389260E-06  0.117E-02    3.40       1.9  T
   4    -27.0316658 -0.265916E-06  0.572E-03    3.40       3.9  T
   5    -27.0316660 -0.174819E-06  0.250E-03    3.40       9.0  T
   6    -27.0316661 -0.941681E-07  0.607E-04    3.40      36.8  T
     SCC iter.                  ...        0 min,  0.005 sec
     gradient                   ...        0 min,  0.008 sec
 * total energy  :   -26.6894461 Eh     change       -0.5731449E-03 Eh
   gradient norm :     0.0056191 Eh/α   predicted    -0.4639957E-03 ( -19.04%)
   displ. norm   :     0.1746727 α      lambda       -0.2931380E-03
   maximum displ.:     0.1058369 α      in ANC's #4, #3, #2, ...

........................................................................
.............................. CYCLE    5 ..............................
........................................................................
   1    -27.0313195 -0.270313E+02  0.123E-01    3.41       0.0  T
   2    -27.0313231 -0.356746E-05  0.683E-02    3.41       1.0  T
   3    -27.0313228  0.297446E-06  0.123E-02    3.41       1.8  T
   4    -27.0313236 -0.789682E-06  0.689E-03    3.41       3.2  T
   5    -27.0313240 -0.379769E-06  0.255E-03    3.41       8.8  T
   6    -27.0313241 -0.770251E-07  0.591E-04    3.41      37.9  T
     SCC iter.                  ...        0 min,  0.005 sec
     gradient                   ...        0 min,  0.008 sec
 * total energy  :   -26.6896507 Eh     change       -0.2046200E-03 Eh
   gradient norm :     0.0043995 Eh/α   predicted    -0.1510455E-03 ( -26.18%)
   displ. norm   :     0.1932223 α      lambda       -0.2017230E-03
   maximum displ.:     0.1099643 α      in ANC's #4, #3, #2, ...

........................................................................
.............................. CYCLE    6 ..............................
........................................................................
   1    -27.0314350 -0.270314E+02  0.143E-01    3.41       0.0  T
   2    -27.0314390 -0.402239E-05  0.787E-02    3.41       1.0  T
   3    -27.0314378  0.120374E-05  0.160E-02    3.41       1.4  T
   4    -27.0314397 -0.182048E-05  0.873E-03    3.41       2.6  T
   5    -27.0314403 -0.623693E-06  0.228E-03    3.41       9.8  T
   6    -27.0314403 -0.562274E-07  0.680E-04    3.41      32.9  T
     SCC iter.                  ...        0 min,  0.005 sec
     gradient                   ...        0 min,  0.008 sec
 * total energy  :   -26.6898062 Eh     change       -0.1554622E-03 Eh
   gradient norm :     0.0047883 Eh/α   predicted    -0.1046274E-03 ( -32.70%)
   displ. norm   :     0.2873381 α      lambda       -0.2528275E-03
   maximum displ.:     0.1473019 α      in ANC's #4, #3, #2, ...

........................................................................
.............................. CYCLE    7 ..............................
........................................................................
   1    -27.0315274 -0.270315E+02  0.209E-01    3.41       0.0  T
   2    -27.0315349 -0.751872E-05  0.116E-01    3.41       1.0  T
   3    -27.0315354 -0.451968E-06  0.186E-02    3.41       1.2  T
   4    -27.0315360 -0.640223E-06  0.109E-02    3.41       2.1  T
   5    -27.0315370 -0.100873E-05  0.332E-03    3.41       6.7  T
   6    -27.0315372 -0.143751E-06  0.103E-03    3.41      21.7  T
   7    -27.0315372 -0.193741E-08  0.452E-04    3.41      49.4  T
     SCC iter.                  ...        0 min,  0.005 sec
     gradient                   ...        0 min,  0.009 sec
 * total energy  :   -26.6899861 Eh     change       -0.1798956E-03 Eh
   gradient norm :     0.0061756 Eh/α   predicted    -0.1368559E-03 ( -23.92%)
   displ. norm   :     0.2625624 α      lambda       -0.2121754E-03
   maximum displ.:     0.1294814 α      in ANC's #3, #4, #2, ...

........................................................................
.............................. CYCLE    8 ..............................
........................................................................
   1    -27.0316685 -0.270317E+02  0.188E-01    3.41       0.0  T
   2    -27.0316739 -0.540933E-05  0.106E-01    3.41       1.0  T
   3    -27.0316727  0.121880E-05  0.186E-02    3.41       1.2  T
   4    -27.0316751 -0.238804E-05  0.936E-03    3.41       2.4  T
   5    -27.0316757 -0.533531E-06  0.336E-03    3.41       6.7  T
   6    -27.0316758 -0.131401E-06  0.915E-04    3.41      24.4  T
   7    -27.0316758 -0.151230E-08  0.430E-04    3.41      52.0  T
     SCC iter.                  ...        0 min,  0.005 sec
     gradient                   ...        0 min,  0.008 sec
 * total energy  :   -26.6901254 Eh     change       -0.1392517E-03 Eh
   gradient norm :     0.0054470 Eh/α   predicted    -0.1134032E-03 ( -18.56%)
   displ. norm   :     0.1696724 α      lambda       -0.1523128E-03
   maximum displ.:     0.0776562 α      in ANC's #5, #2, #1, ...

........................................................................
.............................. CYCLE    9 ..............................
........................................................................
   1    -27.0336380 -0.270336E+02  0.112E-01    3.40       0.0  T
   2    -27.0336401 -0.214554E-05  0.647E-02    3.40       1.0  T
   3    -27.0336387  0.137698E-05  0.128E-02    3.40       1.7  T
   4    -27.0336407 -0.194388E-05  0.471E-03    3.40       4.7  T
   5    -27.0336408 -0.145768E-06  0.210E-03    3.40      10.7  T
   6    -27.0336409 -0.328280E-07  0.521E-04    3.40      43.0  T
     SCC iter.                  ...        0 min,  0.005 sec
     gradient                   ...        0 min,  0.008 sec
 * total energy  :   -26.6902059 Eh     change       -0.8055383E-04 Eh
   gradient norm :     0.0032412 Eh/α   predicted    -0.7835199E-04 (  -2.73%)
   displ. norm   :     0.1576585 α      lambda       -0.6844717E-04
   maximum displ.:     0.0884232 α      in ANC's #1, #3, #2, ...

........................................................................
.............................. CYCLE   10 ..............................
........................................................................
   1    -27.0322968 -0.270323E+02  0.968E-02    3.40       0.0  T
   2    -27.0322979 -0.107600E-05  0.559E-02    3.40       1.0  T
   3    -27.0322977  0.162237E-06  0.711E-03    3.40       3.1  T
   4    -27.0322981 -0.384682E-06  0.360E-03    3.40       6.2  T
   5    -27.0322982 -0.110558E-06  0.147E-03    3.40      15.2  T
   6    -27.0322983 -0.220834E-07  0.360E-04    3.40      62.1  T
   7    -27.0322983 -0.123208E-09  0.158E-04    3.40     141.1  T
     SCC iter.                  ...        0 min,  0.005 sec
     gradient                   ...        0 min,  0.009 sec
 * total energy  :   -26.6902289 Eh     change       -0.2296001E-04 Eh
   gradient norm :     0.0046777 Eh/α   predicted    -0.3508301E-04 (  52.80%)
   displ. norm   :     0.0401871 α      lambda       -0.5709200E-04
   maximum displ.:     0.0255095 α      in ANC's #1, #5, #2, ...

........................................................................
.............................. CYCLE   11 ..............................
........................................................................
   1    -27.0329295 -0.270329E+02  0.490E-02    3.40       0.0  T
   2    -27.0329303 -0.800227E-06  0.248E-02    3.40       1.0  T
   3    -27.0329303  0.661620E-08  0.616E-03    3.40       3.6  T
   4    -27.0329304 -0.797219E-07  0.361E-03    3.40       6.2  T
   5    -27.0329304 -0.849315E-07  0.113E-03    3.40      19.8  T
   6    -27.0329305 -0.162485E-07  0.333E-04    3.40      67.1  T
     SCC iter.                  ...        0 min,  0.005 sec
     gradient                   ...        0 min,  0.008 sec
 * total energy  :   -26.6902526 Eh     change       -0.2376653E-04 Eh
   gradient norm :     0.0028596 Eh/α   predicted    -0.2860075E-04 (  20.34%)
   displ. norm   :     0.0335209 α      lambda       -0.2998599E-04
   maximum displ.:     0.0250548 α      in ANC's #1, #3, #6, ...

........................................................................
.............................. CYCLE   12 ..............................
........................................................................
   1    -27.0335554 -0.270336E+02  0.302E-02    3.40       0.0  T
   2    -27.0335557 -0.331118E-06  0.154E-02    3.40       1.4  T
   3    -27.0335557  0.219115E-08  0.387E-03    3.40       5.8  T
   4    -27.0335558 -0.534414E-07  0.199E-03    3.40      11.3  T
   5    -27.0335558 -0.103697E-07  0.816E-04    3.40      27.4  T
   6    -27.0335558 -0.850202E-08  0.235E-04    3.40      95.3  T
     SCC iter.                  ...        0 min,  0.005 sec
     gradient                   ...        0 min,  0.009 sec
 * total energy  :   -26.6902695 Eh     change       -0.1689911E-04 Eh
   gradient norm :     0.0019192 Eh/α   predicted    -0.1501067E-04 ( -11.17%)
   displ. norm   :     0.1642779 α      lambda       -0.3580578E-04
   maximum displ.:     0.1241578 α      in ANC's #1, #2, #3, ...

........................................................................
.............................. CYCLE   13 ..............................
........................................................................
   1    -27.0319401 -0.270319E+02  0.113E-01    3.40       0.0  T
   2    -27.0319422 -0.209128E-05  0.627E-02    3.40       1.0  T
   3    -27.0319422 -0.139659E-07  0.116E-02    3.40       1.9  T
   4    -27.0319426 -0.379921E-06  0.516E-03    3.40       4.3  T
   5    -27.0319426 -0.922683E-07  0.120E-03    3.40      18.6  T
   6    -27.0319427 -0.152708E-07  0.629E-04    3.40      35.5  T
   7    -27.0319427 -0.269593E-08  0.277E-04    3.40      80.6  T
     SCC iter.                  ...        0 min,  0.005 sec
     gradient                   ...        0 min,  0.009 sec
 * total energy  :   -26.6902615 Eh     change        0.7993757E-05 Eh
   gradient norm :     0.0051123 Eh/α   predicted    -0.1812285E-04 (-326.71%)
   displ. norm   :     0.0361726 α      lambda       -0.4721719E-04
   maximum displ.:     0.0194119 α      in ANC's #4, #5, #6, ...

........................................................................
.............................. CYCLE   14 ..............................
........................................................................
   1    -27.0329325 -0.270329E+02  0.284E-02    3.40       0.0  T
   2    -27.0329327 -0.242512E-06  0.147E-02    3.40       1.5  T
   3    -27.0329327  0.744800E-07  0.410E-03    3.40       5.4  T
   4    -27.0329328 -0.144497E-06  0.179E-03    3.40      12.5  T
   5    -27.0329328 -0.137411E-07  0.380E-04    3.40      58.9  T
     SCC iter.                  ...        0 min,  0.004 sec
     gradient                   ...        0 min,  0.008 sec
 * total energy  :   -26.6902933 Eh     change       -0.3177464E-04 Eh
   gradient norm :     0.0026287 Eh/α   predicted    -0.2364257E-04 ( -25.59%)
   displ. norm   :     0.0296723 α      lambda       -0.2288213E-04
   maximum displ.:     0.0237575 α      in ANC's #1, #4, #6, ...

........................................................................
.............................. CYCLE   15 ..............................
........................................................................
   1    -27.0331746 -0.270332E+02  0.305E-02    3.40       0.0  T
   2    -27.0331749 -0.254642E-06  0.167E-02    3.40       1.3  T
   3    -27.0331746  0.232964E-06  0.518E-03    3.40       4.3  T
   4    -27.0331749 -0.292237E-06  0.202E-03    3.40      11.1  T
   5    -27.0331749 -0.228855E-07  0.446E-04    3.40      50.2  T
   6    -27.0331749 -0.902247E-09  0.158E-04    3.40     141.5  T
     SCC iter.                  ...        0 min,  0.005 sec
     gradient                   ...        0 min,  0.009 sec
 * total energy  :   -26.6903064 Eh     change       -0.1304775E-04 Eh
   gradient norm :     0.0014795 Eh/α   predicted    -0.1145241E-04 ( -12.23%)
   displ. norm   :     0.0775066 α      lambda       -0.1476026E-04
   maximum displ.:     0.0503930 α      in ANC's #1, #4, #5, ...

........................................................................
.............................. CYCLE   16 ..............................
........................................................................
   1    -27.0341594 -0.270342E+02  0.696E-02    3.40       0.0  T
   2    -27.0341607 -0.124583E-05  0.363E-02    3.40       1.0  T
   3    -27.0341609 -0.269462E-06  0.605E-03    3.40       3.7  T
   4    -27.0341609  0.447067E-07  0.351E-03    3.40       6.4  T
   5    -27.0341610 -0.122383E-06  0.971E-04    3.40      23.0  T
   6    -27.0341610 -0.991632E-08  0.427E-04    3.40      52.4  T
     SCC iter.                  ...        0 min,  0.005 sec
     gradient                   ...        0 min,  0.009 sec
 * total energy  :   -26.6903177 Eh     change       -0.1137524E-04 Eh
   gradient norm :     0.0021598 Eh/α   predicted    -0.7402096E-05 ( -34.93%)
   displ. norm   :     0.0874256 α      lambda       -0.1747497E-04
   maximum displ.:     0.0788809 α      in ANC's #1, #3, #7, ...

........................................................................
.............................. CYCLE   17 ..............................
........................................................................
   1    -27.0335865 -0.270336E+02  0.724E-02    3.40       0.0  T
   2    -27.0335873 -0.792360E-06  0.398E-02    3.40       1.0  T
   3    -27.0335872  0.815831E-07  0.717E-03    3.40       3.1  T
   4    -27.0335873 -0.147004E-06  0.429E-03    3.40       5.2  T
   5    -27.0335875 -0.176027E-06  0.809E-04    3.40      27.6  T
   6    -27.0335875 -0.722121E-08  0.336E-04    3.40      66.5  T
     SCC iter.                  ...        0 min,  0.005 sec
     gradient                   ...        0 min,  0.009 sec
 * total energy  :   -26.6903310 Eh     change       -0.1322075E-04 Eh
   gradient norm :     0.0015072 Eh/α   predicted    -0.8806974E-05 ( -33.39%)
   displ. norm   :     0.1802714 α      lambda       -0.2048755E-04
   maximum displ.:     0.1585477 α      in ANC's #1, #3, #7, ...

........................................................................
.............................. CYCLE   18 ..............................
........................................................................
   1    -27.0321982 -0.270322E+02  0.154E-01    3.40       0.0  T
   2    -27.0322025 -0.436783E-05  0.835E-02    3.40       1.0  T
   3    -27.0322034 -0.860923E-06  0.132E-02    3.40       1.7  T
   4    -27.0322033  0.824114E-07  0.667E-03    3.40       3.4  T
   5    -27.0322037 -0.353646E-06  0.207E-03    3.40      10.8  T
   6    -27.0322037 -0.583751E-07  0.809E-04    3.40      27.7  T
   7    -27.0322037 -0.941185E-09  0.334E-04    3.40      66.9  T
     SCC iter.                  ...        0 min,  0.005 sec
     gradient                   ...        0 min,  0.009 sec
 * total energy  :   -26.6903332 Eh     change       -0.2249827E-05 Eh
   gradient norm :     0.0023960 Eh/α   predicted    -0.1040086E-04 ( 362.30%)
   displ. norm   :     0.0531658 α      lambda       -0.1135218E-04
   maximum displ.:     0.0478320 α      in ANC's #1, #7, #3, ...

........................................................................
.............................. CYCLE   19 ..............................
........................................................................
   1    -27.0328897 -0.270329E+02  0.449E-02    3.40       0.0  T
   2    -27.0328901 -0.375057E-06  0.244E-02    3.40       1.0  T
   3    -27.0328902 -0.603190E-07  0.402E-03    3.40       5.6  T
   4    -27.0328902 -0.450356E-09  0.218E-03    3.40      10.3  T
   5    -27.0328902 -0.357111E-07  0.658E-04    3.40      34.0  T
   6    -27.0328902 -0.610976E-08  0.236E-04    3.40      94.6  T
     SCC iter.                  ...        0 min,  0.005 sec
     gradient                   ...        0 min,  0.009 sec
 * total energy  :   -26.6903405 Eh     change       -0.7282084E-05 Eh
   gradient norm :     0.0009855 Eh/α   predicted    -0.5693576E-05 ( -21.81%)
   displ. norm   :     0.0199831 α      lambda       -0.2503259E-05
   maximum displ.:     0.0115551 α      in ANC's #4, #1, #7, ...

........................................................................
.............................. CYCLE   20 ..............................
........................................................................
   1    -27.0331757 -0.270332E+02  0.164E-02    3.40       0.0  T
   2    -27.0331757 -0.886968E-07  0.905E-03    3.40       2.5  T
   3    -27.0331757 -0.932801E-10  0.193E-03    3.40      11.6  T
   4    -27.0331758 -0.233099E-07  0.828E-04    3.40      27.0  T
   5    -27.0331758 -0.195541E-09  0.457E-04    3.40      48.9  T
     SCC iter.                  ...        0 min,  0.004 sec
     gradient                   ...        0 min,  0.009 sec
 * total energy  :   -26.6903415 Eh     change       -0.1016611E-05 Eh
   gradient norm :     0.0006104 Eh/α   predicted    -0.1256094E-05 (  23.56%)
   displ. norm   :     0.0089706 α      lambda       -0.9293372E-06
   maximum displ.:     0.0078800 α      in ANC's #2, #1, #7, ...

   *** GEOMETRY OPTIMIZATION CONVERGED AFTER 20 ITERATIONS ***

------------------------------------------------------------------------
 total energy gain   :        -0.0249196 Eh      -15.6373 kcal/mol
 total RMSD          :         0.4190913 a0        0.2218 Å
 total power (kW/mol):        -3.2713136 (step) -163.7942 (real)
------------------------------------------------------------------------

 ANCopt (total)                0 d,  0 h,  0 min,  0.399 sec
 optimizer setup                ...        0 min,  0.000 sec (  0.037%)
 model hessian                  ...        0 min,  0.007 sec (  1.855%)
 ANC generation                 ...        0 min,  0.001 sec (  0.136%)
 coordinate transformation      ...        0 min,  0.000 sec (  0.075%)
 single point calculation       ...        0 min,  0.383 sec ( 95.917%)
 optimization log               ...        0 min,  0.002 sec (  0.430%)
 hessian update                 ...        0 min,  0.000 sec (  0.059%)
 rational function              ...        0 min,  0.005 sec (  1.189%)

================
 final structure:
================
$coord
    3.21529640706213    2.06309915330267   -0.13568678177896      C 
    3.96715959969283   -1.35707935817801   -0.01368727784548      S 
    0.55983449907867   -1.17709597369880   -0.73110102766389      C 
    0.50370911567280    1.38368083573047    0.56034068141063      C 
   -1.94247830391405    2.43119129238206   -0.09492257666021      N 
   -3.56069260257019    0.16781830696675    0.19110239924270      C 
   -1.88681230781843   -2.32726939619468    0.18241704693027      C 
   -2.99871473285671   -4.37967513791567   -1.40931262324462      C 
   -1.72632661303862   -5.75562260286923   -3.05482021761359      C 
    3.46361763791710    2.75369884415090   -2.05808167947099      H 
    4.27012330153272    3.20581390412323    1.20080573493438      H 
    0.47427714466657   -0.95704276043415   -2.78862308221271      H 
    0.46565179493568    1.09483301827764    2.61440587721192      H 
   -1.93987215609066    3.01513522117313   -1.92600312755191      H 
   -4.96397395906053    0.10434190018405   -1.31437015920779      H 
   -4.54693374398296    0.33187525217052    1.99542058205114      H 
   -1.70187745216745   -3.01049469990351    2.12679950414437      H 
   -4.99266165313144   -4.71371445139440   -1.09508851506763      H 
    0.26874278796006   -5.49015436723968   -3.36831062542127      H 
   -2.62135460160484   -7.22589608522271   -4.13901557741161      H 
$end
           -------------------------------------------------
          |                Final Singlepoint                |
           -------------------------------------------------

          ...................................................
          :                      SETUP                      :
          :.................................................:
          :  # basis functions                  53          :
          :  # atomic orbitals                  52          :
          :  # shells                           30          :
          :  # electrons                        50          :
          :  max. iterations                   250          :
          :  Hamiltonian                  GFN2-xTB          :
          :  restarted?                      false          :
          :  GBSA solvation                  false          :
          :  PC potential                    false          :
          :  electronic temp.          300.0000000     K    :
          :  accuracy                    1.0000000          :
          :  -> integral cutoff          0.2500000E+02      :
          :  -> integral neglect         0.1000000E-07      :
          :  -> SCF convergence          0.1000000E-05 Eh   :
          :  -> wf. convergence          0.1000000E-03 e    :
          :  Broyden damping             0.4000000          :
          ...................................................

 iter      E             dE          RMSdq      gap      omega  full diag
   1    -27.0331758 -0.270332E+02  0.192E-04    3.40       0.0  T
   2    -27.0331758 -0.216325E-10  0.828E-05    3.40     269.9  T
   3    -27.0331758  0.162501E-10  0.900E-05    3.40     248.4  T

   *** convergence criteria satisfied after 3 iterations ***

         #    Occupation            Energy/Eh            Energy/eV
      -------------------------------------------------------------
         1        2.0000           -0.7154372             -19.4680
       ...           ...                  ...                  ...
        19        2.0000           -0.4579825             -12.4623
        20        2.0000           -0.4508766             -12.2690
        21        2.0000           -0.4433406             -12.0639
        22        2.0000           -0.4284596             -11.6590
        23        2.0000           -0.4115256             -11.1982
        24        2.0000           -0.3756526             -10.2220
        25        2.0000           -0.3629953              -9.8776 (HOMO)
        26                         -0.2380191              -6.4768 (LUMO)
        27                         -0.2127237              -5.7885
        28                         -0.1590939              -4.3292
        29                         -0.0409210              -1.1135
        30                         -0.0160794              -0.4375
       ...                                ...                  ...
        52                          0.6118846              16.6502
      -------------------------------------------------------------
                  HL-Gap            0.1249762 Eh            3.4008 eV
             Fermi-level           -0.3005072 Eh           -8.1772 eV

 SCC (total)                   0 d,  0 h,  0 min,  0.018 sec
 SCC setup                      ...        0 min,  0.000 sec (  0.989%)
 Dispersion                     ...        0 min,  0.000 sec (  0.658%)
 integral evaluation            ...        0 min,  0.005 sec ( 29.751%)
 zeroth order Hamiltonian       ...        0 min,  0.000 sec (  0.608%)
 iterations                     ...        0 min,  0.003 sec ( 17.127%)
 molecular gradient             ...        0 min,  0.009 sec ( 49.284%)
 printout                       ...        0 min,  0.000 sec (  1.323%)

         :::::::::::::::::::::::::::::::::::::::::::::::::::::
         ::                     SUMMARY                     ::
         :::::::::::::::::::::::::::::::::::::::::::::::::::::
         :: total energy             -26.690341531616 Eh    ::
         :: gradient norm              0.000611339610 Eh/a0 ::
         :: HOMO-LUMO gap              3.400775933307 eV    ::
         ::.................................................::
         :: SCC energy               -27.033175772554 Eh    ::
         :: -> isotropic ES            0.011623454056 Eh    ::
         :: -> anisotropic ES          0.003555634414 Eh    ::
         :: -> anisotropic XC          0.021810425926 Eh    ::
         :: -> dispersion             -0.017243745395 Eh    ::
         :: repulsion energy           0.342749853402 Eh    ::
         :: add. restraining           0.000000000000 Eh    ::
         :::::::::::::::::::::::::::::::::::::::::::::::::::::

           -------------------------------------------------
          |                Property Printout                |
           -------------------------------------------------

    * Orbital Energies and Occupations

         #    Occupation            Energy/Eh            Energy/eV
      -------------------------------------------------------------
         1        2.0000           -0.7154372             -19.4680
       ...           ...                  ...                  ...
        13        2.0000           -0.5240712             -14.2607
        14        2.0000           -0.5051980             -13.7471
        15        2.0000           -0.4896269             -13.3234
        16        2.0000           -0.4831578             -13.1474
        17        2.0000           -0.4660561             -12.6820
        18        2.0000           -0.4643100             -12.6345
        19        2.0000           -0.4579825             -12.4623
        20        2.0000           -0.4508766             -12.2690
        21        2.0000           -0.4433406             -12.0639
        22        2.0000           -0.4284596             -11.6590
        23        2.0000           -0.4115256             -11.1982
        24        2.0000           -0.3756526             -10.2220
        25        2.0000           -0.3629953              -9.8776 (HOMO)
        26                         -0.2380191              -6.4768 (LUMO)
        27                         -0.2127237              -5.7885
        28                         -0.1590939              -4.3292
        29                         -0.0409210              -1.1135
        30                         -0.0160794              -0.4375
        31                          0.0027962               0.0761
        32                          0.0134089               0.3649
        33                          0.0257148               0.6997
        34                          0.0500989               1.3633
        35                          0.0718378               1.9548
        36                          0.1014297               2.7600
       ...                                ...                  ...
        52                          0.6118846              16.6502
      -------------------------------------------------------------
                  HL-Gap            0.1249762 Eh            3.4008 eV
             Fermi-level           -0.3005072 Eh           -8.1772 eV

     #   Z        covCN         q      C6AA      α(0)
     1   6 C      3.890    -0.014    20.765     6.478
     2  16 S      2.426    -0.191   149.173    20.556
     3   6 C      3.990     0.018    20.200     6.385
     4   6 C      4.396     0.055    19.573     6.283
     5   7 N      2.687    -0.271    27.014     7.719
     6   6 C      3.843     0.006    20.445     6.432
     7   6 C      3.882    -0.026    20.986     6.513
     8   6 C      2.886    -0.034    28.849     8.806
     9   6 C      2.837    -0.090    30.255     9.014
    10   1 H      0.925     0.043     2.412     2.429
    11   1 H      0.925     0.046     2.364     2.405
    12   1 H      0.924     0.030     2.592     2.518
    13   1 H      0.924     0.039     2.461     2.453
    14   1 H      0.860     0.138     1.486     1.910
    15   1 H      0.925     0.036     2.505     2.475
    16   1 H      0.924     0.046     2.376     2.411
    17   1 H      0.924     0.047     2.358     2.401
    18   1 H      0.925     0.035     2.514     2.480
    19   1 H      0.926     0.047     2.361     2.403
    20   1 H      0.926     0.041     2.433     2.439

 Mol. C6AA /au·bohr⁶  :       4562.033287
 Mol. C8AA /au·bohr⁸  :     120737.320524
 Mol. α(0) /au        :        104.509568


Wiberg/Mayer (AO) data.
largest (>0.10) Wiberg bond orders for each atom
          total WBO             WBO to atom ...
     1  C   3.980        C    4 0.992    S    2 0.992    H   11 0.981    H   10 0.978
     2  S   2.057        C    1 0.992    C    3 0.956
     3  C   3.967        C    7 1.001    C    4 0.981    H   12 0.964    S    2 0.956
     4  C   3.979        N    5 0.999    C    1 0.992    C    3 0.981    H   13 0.961
     5  N   3.060        C    6 1.004    C    4 0.999    H   14 0.959
     6  C   3.982        N    5 1.004    H   15 0.981    H   16 0.978    C    7 0.939
     7  C   3.993        C    8 1.018    C    3 1.001    H   17 0.952    C    6 0.939
     8  C   3.991        C    9 1.978    C    7 1.018    H   18 0.964
     9  C   3.992        C    8 1.978    H   20 0.976    H   19 0.973
    10  H   0.998        C    1 0.978
    11  H   0.998        C    1 0.981
    12  H   0.999        C    3 0.964
    13  H   0.998        C    4 0.961
    14  H   0.981        N    5 0.959
    15  H   0.999        C    6 0.981
    16  H   0.998        C    6 0.978
    17  H   0.998        C    7 0.952
    18  H   0.998        C    8 0.964
    19  H   0.998        C    9 0.973
    20  H   0.998        C    9 0.976

molecular dipole:
                 x           y           z       tot (Debye)
 q only:       -0.577       0.212      -0.133
   full:       -0.734       0.310      -0.420       2.290
molecular quadrupole (traceless):
                xx          xy          yy          xz          yz          zz
 q only:       -1.393       4.079       0.042       0.095      -0.506       1.350
  q+dip:       -3.409       7.823      -2.660       0.090      -0.893       6.068
   full:       -2.927       7.722      -1.306       0.675      -1.664       4.234

           -------------------------------------------------
          |                Geometry Summary                 |
           -------------------------------------------------

      molecular mass/u    :      141.2306000
   center of mass at/Å    :        0.0647182      -0.5277276      -0.2375636
  moments of inertia/u·Å² :        0.2516426E+03   0.4048121E+03   0.6056864E+03
rotational constants/cm⁻¹ :        0.6699039E-01   0.4164310E-01   0.2783228E-01

 * 17 selected distances

     #   Z        #   Z                                     value/Å
     1   6 C      4   6 C                                 1.5244319 (max)
     3   6 C      4   6 C                                 1.5179687
     4   6 C      5   7 N                                 1.4502239
     5   7 N      6   6 C                                 1.4801160
     3   6 C      7   6 C                                 1.5101030
     8   6 C      9   6 C                                 1.3197535
     1   6 C     10   1 H                                 1.0888963
     1   6 C     11   1 H                                 1.0850933
     3   6 C     12   1 H                                 1.0959388
     4   6 C     13   1 H                                 1.0978439
     5   7 N     14   1 H                                 1.0170469 (min)
     6   6 C     15   1 H                                 1.0896010
     6   6 C     16   1 H                                 1.0915877
     7   6 C     17   1 H                                 1.0949777
     8   6 C     18   1 H                                 1.0827002
     9   6 C     19   1 H                                 1.0778928
     9   6 C     20   1 H                                 1.0764900

 * 4 distinct bonds (by element types)

   Z      Z             #   av. dist./Å        max./Å        min./Å
   1 H    6 C          10     1.0881022     1.0978439     1.0764900
   6 C    6 C           4     1.4680643     1.5244319     1.3197535
   1 H    7 N           1     1.0170469     1.0170469     1.0170469
   6 C    7 N           2     1.4651699     1.4801160     1.4502239


optimized geometry written to: xtbopt.xyz


           -------------------------------------------------
          | TOTAL ENERGY              -26.690341531616 Eh   |
          | GRADIENT NORM               0.000611339610 Eh/α |
          | HOMO-LUMO GAP               3.400775933307 eV   |
           -------------------------------------------------

------------------------------------------------------------------------
 * finished run on 2021/05/19 at 10:59:36.503     
------------------------------------------------------------------------
 total:
 * wall-time:     0 d,  0 h,  0 min,  0.462 sec
 *  cpu-time:     0 d,  0 h,  0 min,  0.461 sec
 * ratio c/w:     0.998 speedup
 SCF:
 * wall-time:     0 d,  0 h,  0 min,  0.025 sec
 *  cpu-time:     0 d,  0 h,  0 min,  0.025 sec
 * ratio c/w:     1.000 speedup
 ANC optimizer:
 * wall-time:     0 d,  0 h,  0 min,  0.418 sec
 *  cpu-time:     0 d,  0 h,  0 min,  0.418 sec
 * ratio c/w:     0.999 speedup

