      -----------------------------------------------------------      
     |                   =====================                   |     
     |                           x T B                           |     
     |                   =====================                   |     
     |                         S. Grimme                         |     
     |          Mulliken Center for Theoretical Chemistry        |     
     |                    University of Bonn                     |     
     |                Version 6.2 RC2 (SAW190805)                |     
      -----------------------------------------------------------      

   This program is distributed in the hope that it will be useful,
   but WITHOUT ANY WARRANTY; without even the implied warranty of
   MERCHANTABILITY or FITNESS FOR A PARTICULAR PURPOSE.
   
   FOR NON-COMMERCIAL, ACADEMIA USE ONLY.
   
   Cite this work as:
   * S. Grimme, C. Bannwarth, P. Shushkov, J. Chem. Theory Comput., 2017,
     13, 1989-2009. DOI: 10.1021/acs.jctc.7b00118
   * C. Bannwarth, S. Ehlert and S. Grimme., J. Chem. Theory Comput., 2019,
     15, 1652-1671. DOI: 10.1021/acs.jctc.8b01176
   * P. Pracht, E. Caldeweyher, S. Ehlert, S. Grimme, ChemRxiv, 2019, preprint.
     DOI: 10.26434/chemrxiv.8326202.v1
   
   for DFT-D4:
   * E. Caldeweyher, C. Bannwarth and S. Grimme, J. Chem. Phys., 2017,
     147, 034112. DOI: 10.1063/1.4993215
   * E. Caldeweyher, S. Ehlert, A. Hansen, H. Neugebauer, S. Spicher,
     C. Bannwarth and S. Grimme, J. Chem. Phys., 2019, 150, 154122.
     DOI: 10.1063/1.5090222
   
   for sTDA-xTB:
   * S. Grimme and C. Bannwarth, J. Chem. Phys., 2016, 145, 054103.
     DOI: 10.1063/1.4959605
   
   in the mass-spec context:
   * V. Asgeirsson, C. Bauer and S. Grimme, Chem. Sci., 2017, 8, 4879.
     DOI: 10.1039/c7sc00601b
   
   for metadynamics refer to:
   * S. Grimme, J. Chem. Theory Comput., 2019, 155, 2847-2862
     DOI: 10.1021/acs.jctc.9b00143
   
   with help from (in alphabetical order)
   C. Bannwarth, F. Bohle, G. Brandenburg, E. Caldeweyher, M. Checinski,
   S. Dohm, S. Ehlert, S. Ehrlich, F. März, H. Neugebauer, J. Pisarek,
   P. Pracht, P. Shushkov, and S. Spicher.
   
 * started run on 2021/05/19 at 10:59:36.523     

           -------------------------------------------------
          |                Calculation Setup                |
           -------------------------------------------------

          program call               : /ihome/ghutchison/geoffh/xtb/xtb 280.xyz -opt
          hostname                   : smp-n83
          coordinate file            : 280.xyz
          omp threads                :                     1
          number of atoms            :                    17
          number of electrons        :                    56
          charge                     :                     0
          spin                       :                   0.0
          first test random number   :      0.30736444011609


########################################################################
# WARNING! Please study the warnings concerning your input carefully
#  - the use of '-opt' is discouraged, please use '--opt' next time
########################################################################

           ------------------------------------------------- 
          |                 G F N 2 - x T B                 |
          | Geometry, Frequencies, Noncovalent interactions |
          |            JCTC 2019 parametrisation            |
           ------------------------------------------------- 
             KAB for C  - Si     :                1.0500
             KAB for H  - Pd     :                0.9500
             k(s)              :                1.8500
             k(p)              :                2.2300
             k(d)              :                2.2300
             k(f)              :                2.0000
             kEN (H0ij)        :               -2.0000
             D4 a1             :                0.5200
             D4 a2             :                5.0000
             D4 s6             :                1.0000
             D4 s8             :                2.7000
             D4 s9             :                5.0000
             alphaj            :                2.0000

  Z AO/shell   Hii/eV     exponent
  1     Wed Apr 25 08:07:45 CEST 2018   EN: 2.200 GM2: 0.406  GM3: 0.0800  RAES: 1.40
     1s    -10.707211    1.230000
  6     Wed Apr 25 08:07:45 CEST 2018   EN: 2.550 GM2: 0.538  GM3: 0.1500  RAES: 3.00
     2s    -13.970922    2.096432
     2p    -10.063292    1.800000
 16     Tue Apr 24 11:44:34 CEST 2018   EN: 2.580 GM2: 0.340  GM3:-0.0502  RAES: 3.10
     3s    -20.029654    1.981333
     3p    -11.377694    2.025643
     3d     -0.420282    1.702555

           ------------------------------------------------- 
          |        Self-Consistent Charge Iterations        |
           ------------------------------------------------- 

          ...................................................
          :                      SETUP                      :
          :.................................................:
          :  # basis functions                  68          :
          :  # atomic orbitals                  65          :
          :  # shells                           31          :
          :  # electrons                        56          :
          :  max. iterations                   250          :
          :  Hamiltonian                  GFN2-xTB          :
          :  restarted?                      false          :
          :  GBSA solvation                  false          :
          :  PC potential                    false          :
          :  electronic temp.          300.0000000     K    :
          :  accuracy                    1.0000000          :
          :  -> integral cutoff          0.2500000E+02      :
          :  -> integral neglect         0.1000000E-07      :
          :  -> SCF convergence          0.1000000E-05 Eh   :
          :  -> wf. convergence          0.1000000E-03 e    :
          :  Broyden damping             0.4000000          :
          ...................................................

 iter      E             dE          RMSdq      gap      omega  full diag
   1    -30.2072920 -0.302073E+02  0.486E+00    2.51       0.0  T
   2    -30.2264799 -0.191879E-01  0.255E+00    2.11       1.0  T
   3    -30.2254367  0.104321E-02  0.792E-01    2.15       1.0  T
   4    -30.2266972 -0.126045E-02  0.419E-01    2.14       1.0  T
   5    -30.2280468 -0.134965E-02  0.187E-01    2.14       1.0  T
   6    -30.2282291 -0.182255E-03  0.866E-02    2.14       1.0  T
   7    -30.2283329 -0.103890E-03  0.302E-02    2.14       1.0  T
   8    -30.2283404 -0.741791E-05  0.120E-02    2.14       2.0  T
   9    -30.2283405 -0.127650E-06  0.621E-03    2.14       3.9  T
  10    -30.2283406 -0.141626E-06  0.271E-03    2.14       9.0  T
  11    -30.2283407 -0.588427E-07  0.117E-03    2.14      20.8  T
  12    -30.2283407 -0.106628E-07  0.645E-04    2.14      37.6  T
  13    -30.2283407 -0.979430E-09  0.172E-04    2.14     140.6  T

   *** convergence criteria satisfied after 13 iterations ***

         #    Occupation            Energy/Eh            Energy/eV
      -------------------------------------------------------------
         1        2.0000           -0.7454149             -20.2838
       ...           ...                  ...                  ...
        22        2.0000           -0.4544782             -12.3670
        23        2.0000           -0.4472436             -12.1701
        24        2.0000           -0.4330557             -11.7840
        25        2.0000           -0.4270174             -11.6197
        26        2.0000           -0.4121227             -11.2144
        27        2.0000           -0.3879811             -10.5575
        28        2.0000           -0.3535480              -9.6205 (HOMO)
        29                         -0.2749182              -7.4809 (LUMO)
        30                         -0.2621686              -7.1340
        31                         -0.2223269              -6.0498
        32                         -0.2181773              -5.9369
        33                         -0.2007685              -5.4632
       ...                                ...                  ...
        65                          0.6678400              18.1729
      -------------------------------------------------------------
                  HL-Gap            0.0786297 Eh            2.1396 eV
             Fermi-level           -0.3142331 Eh           -8.5507 eV

 SCC (total)                   0 d,  0 h,  0 min,  0.037 sec
 SCC setup                      ...        0 min,  0.000 sec (  0.766%)
 Dispersion                     ...        0 min,  0.000 sec (  0.609%)
 integral evaluation            ...        0 min,  0.009 sec ( 25.475%)
 zeroth order Hamiltonian       ...        0 min,  0.000 sec (  0.436%)
 iterations                     ...        0 min,  0.014 sec ( 37.263%)
 molecular gradient             ...        0 min,  0.013 sec ( 34.485%)
 printout                       ...        0 min,  0.000 sec (  0.828%)

         :::::::::::::::::::::::::::::::::::::::::::::::::::::
         ::                     SUMMARY                     ::
         :::::::::::::::::::::::::::::::::::::::::::::::::::::
         :: total energy             -29.849756153242 Eh    ::
         :: gradient norm              0.072506161801 Eh/a0 ::
         :: HOMO-LUMO gap              2.139624108970 eV    ::
         ::.................................................::
         :: SCC energy               -30.228340703232 Eh    ::
         :: -> isotropic ES            0.002243794950 Eh    ::
         :: -> anisotropic ES          0.002031596652 Eh    ::
         :: -> anisotropic XC          0.016760940343 Eh    ::
         :: -> dispersion             -0.021232856453 Eh    ::
         :: repulsion energy           0.378605428021 Eh    ::
         :: add. restraining           0.000000000000 Eh    ::
         :::::::::::::::::::::::::::::::::::::::::::::::::::::

      ----------------------------------------------------------- 
     |                   =====================                   |
     |                        A N C O P T                        |
     |                   =====================                   |
     |               Approximate Normal Coordinate               |
     |                Rational Function Optimizer                |
      ----------------------------------------------------------- 

          ...................................................
          :                      SETUP                      :
          :.................................................:
          :   optimization level            normal          :
          :   max. optcycles                   200          :
          :   ANC micro-cycles                  20          :
          :   degrees of freedom                45          :
          :.................................................:
          :   RF solver                   davidson          :
          :   input Hessian                  false          :
          :   write xtbopt.log                true          :
          :   linear?                        false          :
          :   energy convergence         0.5000000E-05 Eh   :
          :   grad. convergence          0.1000000E-02 Eh/α :
          :   maximium RF displ.         2.0000000          :
          :   Hlow (freq-cutoff)         0.5000000E-02      :
          :   Hmax (freq-cutoff)         5.0000000          :
          :   S6 in model hess.         20.0000000          :
          ...................................................

generating ANC from model Hessian ...
Using Lindh-Hessian (1995)
 Shifting diagonal of input Hessian by   3.491037068676364E-003
 Lowest  eigenvalues of input Hessian
   -0.000000   -0.000000    0.000000    0.000000    0.000000    0.000000
    0.005000    0.007075    0.009104    0.011031    0.013810    0.021894
    0.022622    0.028196    0.029605    0.042902    0.044901    0.049447
 Highest eigenvalues
    1.492969    1.670454    1.715592    1.767757    1.828600    1.892492
 

........................................................................
.............................. CYCLE    1 ..............................
........................................................................
   1    -30.2283407 -0.302283E+02  0.660E-05    2.14       0.0  T
   2    -30.2283407 -0.189004E-11  0.567E-05    2.14     427.4  T
   3    -30.2283407 -0.377298E-10  0.224E-05    2.14    1081.3  T
     SCC iter.                  ...        0 min,  0.004 sec
     gradient                   ...        0 min,  0.013 sec
 * total energy  :   -29.8497561 Eh     change        0.9626064E-08 Eh
   gradient norm :     0.0725060 Eh/α   predicted     0.0000000E+00 (-100.00%)
   displ. norm   :     0.2069534 α      lambda       -0.6857794E-02
   maximum displ.:     0.1080109 α      in ANC's #9, #28, #6, ...

........................................................................
.............................. CYCLE    2 ..............................
........................................................................
   1    -30.2604067 -0.302604E+02  0.319E-01    2.30       0.0  T
   2    -30.2604679 -0.611701E-04  0.164E-01    2.28       1.0  T
   3    -30.2604111  0.567286E-04  0.741E-02    2.28       1.0  T
   4    -30.2604862 -0.750497E-04  0.284E-02    2.27       1.0  T
   5    -30.2604921 -0.589905E-05  0.132E-02    2.27       1.8  T
   6    -30.2604924 -0.286886E-06  0.369E-03    2.27       6.6  T
   7    -30.2604925 -0.142267E-06  0.134E-03    2.27      18.0  T
     SCC iter.                  ...        0 min,  0.008 sec
     gradient                   ...        0 min,  0.012 sec
 * total energy  :   -29.8540643 Eh     change       -0.4308188E-02 Eh
   gradient norm :     0.0209983 Eh/α   predicted    -0.3575753E-02 ( -17.00%)
   displ. norm   :     0.1144863 α      lambda       -0.8086493E-03
   maximum displ.:     0.0645693 α      in ANC's #2, #6, #11, ...

........................................................................
.............................. CYCLE    3 ..............................
........................................................................
   1    -30.2696278 -0.302696E+02  0.210E-01    2.33       0.0  T
   2    -30.2696401 -0.123492E-04  0.103E-01    2.32       1.0  T
   3    -30.2696213  0.188008E-04  0.426E-02    2.32       1.0  T
   4    -30.2696454 -0.240427E-04  0.135E-02    2.32       1.8  T
   5    -30.2696461 -0.708843E-06  0.601E-03    2.32       4.0  T
   6    -30.2696462 -0.807444E-07  0.137E-03    2.32      17.7  T
   7    -30.2696462 -0.178602E-07  0.600E-04    2.32      40.4  T
     SCC iter.                  ...        0 min,  0.007 sec
     gradient                   ...        0 min,  0.012 sec
 * total energy  :   -29.8544940 Eh     change       -0.4296825E-03 Eh
   gradient norm :     0.0049062 Eh/α   predicted    -0.4096224E-03 (  -4.67%)
   displ. norm   :     0.0841346 α      lambda       -0.1297129E-03
   maximum displ.:     0.0567674 α      in ANC's #2, #4, #8, ...

........................................................................
.............................. CYCLE    4 ..............................
........................................................................
   1    -30.2687951 -0.302688E+02  0.138E-01    2.32       0.0  T
   2    -30.2687987 -0.359498E-05  0.674E-02    2.32       1.0  T
   3    -30.2687903  0.839169E-05  0.275E-02    2.32       1.0  T
   4    -30.2688009 -0.105296E-04  0.814E-03    2.32       3.0  T
   5    -30.2688010 -0.109188E-06  0.256E-03    2.32       9.5  T
   6    -30.2688010 -0.456054E-07  0.542E-04    2.32      44.7  T
     SCC iter.                  ...        0 min,  0.006 sec
     gradient                   ...        0 min,  0.012 sec
 * total energy  :   -29.8545933 Eh     change       -0.9930482E-04 Eh
   gradient norm :     0.0033964 Eh/α   predicted    -0.6531424E-04 ( -34.23%)
   displ. norm   :     0.1649539 α      lambda       -0.1527664E-03
   maximum displ.:     0.1118877 α      in ANC's #2, #4, #3, ...

........................................................................
.............................. CYCLE    5 ..............................
........................................................................
   1    -30.2664333 -0.302664E+02  0.286E-01    2.30       0.0  T
   2    -30.2664475 -0.142136E-04  0.140E-01    2.30       1.0  T
   3    -30.2664258  0.216949E-04  0.463E-02    2.30       1.0  T
   4    -30.2664539 -0.280790E-04  0.164E-02    2.31       1.5  T
   5    -30.2664545 -0.532866E-06  0.381E-03    2.31       6.4  T
   6    -30.2664546 -0.120026E-06  0.993E-04    2.31      24.4  T
   7    -30.2664546 -0.323695E-08  0.623E-04    2.31      38.9  T
     SCC iter.                  ...        0 min,  0.007 sec
     gradient                   ...        0 min,  0.013 sec
 * total energy  :   -29.8546975 Eh     change       -0.1041846E-03 Eh
   gradient norm :     0.0034600 Eh/α   predicted    -0.7846266E-04 ( -24.69%)
   displ. norm   :     0.1326800 α      lambda       -0.7850523E-04
   maximum displ.:     0.0899635 α      in ANC's #2, #4, #3, ...

........................................................................
.............................. CYCLE    6 ..............................
........................................................................
   1    -30.2655820 -0.302656E+02  0.224E-01    2.29       0.0  T
   2    -30.2655902 -0.817330E-05  0.110E-01    2.29       1.0  T
   3    -30.2655798  0.103392E-04  0.333E-02    2.29       1.0  T
   4    -30.2655935 -0.136078E-04  0.129E-02    2.29       1.9  T
   5    -30.2655938 -0.389835E-06  0.212E-03    2.29      11.4  T
   6    -30.2655939 -0.383506E-07  0.842E-04    2.29      28.8  T
   7    -30.2655939 -0.594521E-08  0.423E-04    2.29      57.3  T
     SCC iter.                  ...        0 min,  0.007 sec
     gradient                   ...        0 min,  0.012 sec
 * total energy  :   -29.8547603 Eh     change       -0.6279129E-04 Eh
   gradient norm :     0.0038636 Eh/α   predicted    -0.3994442E-04 ( -36.39%)
   displ. norm   :     0.1952005 α      lambda       -0.1155054E-03
   maximum displ.:     0.1312405 α      in ANC's #2, #4, #3, ...

........................................................................
.............................. CYCLE    7 ..............................
........................................................................
   1    -30.2651795 -0.302652E+02  0.339E-01    2.27       0.0  T
   2    -30.2651981 -0.185584E-04  0.165E-01    2.28       1.0  T
   3    -30.2651840  0.140147E-04  0.430E-02    2.28       1.0  T
   4    -30.2652038 -0.197360E-04  0.195E-02    2.28       1.2  T
   5    -30.2652050 -0.117964E-05  0.330E-03    2.28       7.3  T
   6    -30.2652051 -0.112727E-06  0.137E-03    2.28      17.7  T
   7    -30.2652051 -0.180380E-07  0.620E-04    2.28      39.1  T
   8    -30.2652051 -0.871037E-09  0.329E-04    2.28      73.7  T
     SCC iter.                  ...        0 min,  0.008 sec
     gradient                   ...        0 min,  0.012 sec
 * total energy  :   -29.8548499 Eh     change       -0.8959651E-04 Eh
   gradient norm :     0.0040283 Eh/α   predicted    -0.5995412E-04 ( -33.08%)
   displ. norm   :     0.2931686 α      lambda       -0.1596675E-03
   maximum displ.:     0.1995533 α      in ANC's #2, #4, #1, ...

........................................................................
.............................. CYCLE    8 ..............................
........................................................................
   1    -30.2648849 -0.302649E+02  0.512E-01    2.25       0.0  T
   2    -30.2649266 -0.417270E-04  0.250E-01    2.26       1.0  T
   3    -30.2649018  0.248222E-04  0.611E-02    2.26       1.0  T
   4    -30.2649382 -0.363590E-04  0.295E-02    2.26       1.0  T
   5    -30.2649413 -0.310083E-05  0.425E-03    2.26       5.7  T
   6    -30.2649415 -0.185933E-06  0.196E-03    2.26      12.4  T
   7    -30.2649415 -0.397765E-07  0.847E-04    2.26      28.6  T
     SCC iter.                  ...        0 min,  0.007 sec
     gradient                   ...        0 min,  0.012 sec
 * total energy  :   -29.8549492 Eh     change       -0.9928825E-04 Eh
   gradient norm :     0.0045966 Eh/α   predicted    -0.8670225E-04 ( -12.68%)
   displ. norm   :     0.1701444 α      lambda       -0.9223365E-04
   maximum displ.:     0.1118752 α      in ANC's #2, #4, #1, ...

........................................................................
.............................. CYCLE    9 ..............................
........................................................................
   1    -30.2665006 -0.302665E+02  0.301E-01    2.25       0.0  T
   2    -30.2665152 -0.146430E-04  0.148E-01    2.26       1.0  T
   3    -30.2665121  0.306008E-05  0.307E-02    2.26       1.0  T
   4    -30.2665179 -0.580047E-05  0.176E-02    2.26       1.4  T
   5    -30.2665195 -0.160035E-05  0.248E-03    2.26       9.8  T
   6    -30.2665196 -0.522351E-07  0.119E-03    2.26      20.4  T
     SCC iter.                  ...        0 min,  0.006 sec
     gradient                   ...        0 min,  0.012 sec
 * total energy  :   -29.8550128 Eh     change       -0.6358829E-04 Eh
   gradient norm :     0.0033105 Eh/α   predicted    -0.4745113E-04 ( -25.38%)
   displ. norm   :     0.1674338 α      lambda       -0.5861500E-04
   maximum displ.:     0.1057209 α      in ANC's #4, #2, #1, ...

........................................................................
.............................. CYCLE   10 ..............................
........................................................................
   1    -30.2675984 -0.302676E+02  0.314E-01    2.25       0.0  T
   2    -30.2676144 -0.159671E-04  0.153E-01    2.25       1.0  T
   3    -30.2676155 -0.107060E-05  0.258E-02    2.25       1.0  T
   4    -30.2676158 -0.278079E-06  0.180E-02    2.25       1.4  T
   5    -30.2676186 -0.283937E-05  0.180E-03    2.25      13.5  T
   6    -30.2676186 -0.156830E-07  0.109E-03    2.25      22.3  T
   7    -30.2676186 -0.116360E-07  0.509E-04    2.25      47.7  T
   8    -30.2676186 -0.739590E-09  0.199E-04    2.25     122.1  T
     SCC iter.                  ...        0 min,  0.008 sec
     gradient                   ...        0 min,  0.013 sec
 * total energy  :   -29.8550538 Eh     change       -0.4102640E-04 Eh
   gradient norm :     0.0024388 Eh/α   predicted    -0.3012859E-04 ( -26.56%)
   displ. norm   :     0.2113893 α      lambda       -0.4197403E-04
   maximum displ.:     0.1352669 α      in ANC's #4, #2, #1, ...

........................................................................
.............................. CYCLE   11 ..............................
........................................................................
   1    -30.2670022 -0.302670E+02  0.377E-01    2.24       0.0  T
   2    -30.2670245 -0.222901E-04  0.185E-01    2.25       1.0  T
   3    -30.2670270 -0.252778E-05  0.306E-02    2.25       1.0  T
   4    -30.2670253  0.172775E-05  0.226E-02    2.25       1.1  T
   5    -30.2670303 -0.497943E-05  0.188E-03    2.25      12.9  T
   6    -30.2670303 -0.198875E-07  0.112E-03    2.25      21.7  T
   7    -30.2670303 -0.102955E-07  0.575E-04    2.25      42.2  T
   8    -30.2670303 -0.112106E-08  0.199E-04    2.25     121.8  T
     SCC iter.                  ...        0 min,  0.008 sec
     gradient                   ...        0 min,  0.013 sec
 * total energy  :   -29.8550807 Eh     change       -0.2693291E-04 Eh
   gradient norm :     0.0026109 Eh/α   predicted    -0.2192693E-04 ( -18.59%)
   displ. norm   :     0.1567668 α      lambda       -0.4678867E-04
   maximum displ.:     0.1038869 α      in ANC's #4, #2, #1, ...

........................................................................
.............................. CYCLE   12 ..............................
........................................................................
   1    -30.2689136 -0.302689E+02  0.312E-01    2.24       0.0  T
   2    -30.2689298 -0.162550E-04  0.153E-01    2.25       1.0  T
   3    -30.2689312 -0.140336E-05  0.252E-02    2.25       1.0  T
   4    -30.2689307  0.487174E-06  0.179E-02    2.25       1.4  T
   5    -30.2689340 -0.328371E-05  0.230E-03    2.25      10.6  T
   6    -30.2689341 -0.434972E-07  0.112E-03    2.25      21.6  T
   7    -30.2689341 -0.934481E-08  0.528E-04    2.25      46.0  T
   8    -30.2689341 -0.629342E-09  0.237E-04    2.25     102.4  T
     SCC iter.                  ...        0 min,  0.008 sec
     gradient                   ...        0 min,  0.013 sec
 * total energy  :   -29.8550931 Eh     change       -0.1241576E-04 Eh
   gradient norm :     0.0032220 Eh/α   predicted    -0.2396786E-04 (  93.04%)
   displ. norm   :     0.2872266 α      lambda       -0.5056962E-04
   maximum displ.:     0.1866582 α      in ANC's #4, #2, #1, ...

........................................................................
.............................. CYCLE   13 ..............................
........................................................................
   1    -30.2655184 -0.302655E+02  0.535E-01    2.25       0.0  T
   2    -30.2655646 -0.461877E-04  0.262E-01    2.25       1.0  T
   3    -30.2655733 -0.876892E-05  0.394E-02    2.25       1.0  T
   4    -30.2655649  0.841601E-05  0.277E-02    2.25       1.0  T
   5    -30.2655761 -0.112105E-04  0.260E-03    2.25       9.3  T
   6    -30.2655762 -0.402387E-07  0.152E-03    2.25      16.0  T
   7    -30.2655762 -0.105763E-07  0.845E-04    2.25      28.7  T
   8    -30.2655762 -0.341431E-08  0.277E-04    2.25      87.4  T
     SCC iter.                  ...        0 min,  0.008 sec
     gradient                   ...        0 min,  0.013 sec
 * total energy  :   -29.8550934 Eh     change       -0.2570423E-06 Eh
   gradient norm :     0.0039852 Eh/α   predicted    -0.2737051E-04 (*******%)
   displ. norm   :     0.1682951 α      lambda       -0.5553025E-04
   maximum displ.:     0.1064398 α      in ANC's #4, #2, #1, ...

........................................................................
.............................. CYCLE   14 ..............................
........................................................................
   1    -30.2680686 -0.302681E+02  0.327E-01    2.25       0.0  T
   2    -30.2680861 -0.174449E-04  0.159E-01    2.25       1.0  T
   3    -30.2680892 -0.318635E-05  0.242E-02    2.25       1.0  T
   4    -30.2680866  0.263386E-05  0.171E-02    2.25       1.4  T
   5    -30.2680904 -0.382891E-05  0.172E-03    2.25      14.1  T
   6    -30.2680905 -0.193394E-07  0.900E-04    2.25      26.9  T
   7    -30.2680905 -0.241429E-08  0.552E-04    2.25      43.9  T
     SCC iter.                  ...        0 min,  0.007 sec
     gradient                   ...        0 min,  0.013 sec
 * total energy  :   -29.8551128 Eh     change       -0.1941964E-04 Eh
   gradient norm :     0.0013821 Eh/α   predicted    -0.2855370E-04 (  47.04%)
   displ. norm   :     0.0875949 α      lambda       -0.6841919E-05
   maximum displ.:     0.0520280 α      in ANC's #4, #2, #3, ...

........................................................................
.............................. CYCLE   15 ..............................
........................................................................
   1    -30.2674948 -0.302675E+02  0.178E-01    2.24       0.0  T
   2    -30.2675000 -0.522187E-05  0.869E-02    2.24       1.0  T
   3    -30.2675000  0.116774E-07  0.155E-02    2.24       1.6  T
   4    -30.2675005 -0.490070E-06  0.108E-02    2.24       2.3  T
   5    -30.2675014 -0.954369E-06  0.104E-03    2.24      23.4  T
   6    -30.2675014 -0.704741E-08  0.530E-04    2.24      45.7  T
   7    -30.2675014 -0.142098E-08  0.290E-04    2.24      83.7  T
     SCC iter.                  ...        0 min,  0.007 sec
     gradient                   ...        0 min,  0.013 sec
 * total energy  :   -29.8551170 Eh     change       -0.4181624E-05 Eh
   gradient norm :     0.0014359 Eh/α   predicted    -0.3432966E-05 ( -17.90%)
   displ. norm   :     0.1440990 α      lambda       -0.7663170E-05
   maximum displ.:     0.0969922 α      in ANC's #4, #2, #28, ...

........................................................................
.............................. CYCLE   16 ..............................
........................................................................
   1    -30.2668595 -0.302669E+02  0.264E-01    2.24       0.0  T
   2    -30.2668707 -0.112468E-04  0.130E-01    2.24       1.0  T
   3    -30.2668729 -0.213503E-05  0.196E-02    2.25       1.2  T
   4    -30.2668708  0.210473E-05  0.141E-02    2.25       1.7  T
   5    -30.2668736 -0.280369E-05  0.146E-03    2.25      16.6  T
   6    -30.2668736 -0.182719E-07  0.725E-04    2.25      33.5  T
   7    -30.2668736 -0.171075E-08  0.387E-04    2.25      62.6  T
     SCC iter.                  ...        0 min,  0.007 sec
     gradient                   ...        0 min,  0.012 sec
 * total energy  :   -29.8551212 Eh     change       -0.4215555E-05 Eh
   gradient norm :     0.0016521 Eh/α   predicted    -0.3866445E-05 (  -8.28%)
   displ. norm   :     0.0127299 α      lambda       -0.5800222E-05
   maximum displ.:     0.0078176 α      in ANC's #2, #1, #28, ...

........................................................................
.............................. CYCLE   17 ..............................
........................................................................
   1    -30.2680538 -0.302681E+02  0.169E-02    2.25       0.0  T
   2    -30.2680539 -0.665147E-07  0.880E-03    2.25       2.8  T
   3    -30.2680536  0.304607E-06  0.512E-03    2.25       4.7  T
   4    -30.2680540 -0.394900E-06  0.124E-03    2.25      19.5  T
   5    -30.2680540 -0.229694E-08  0.416E-04    2.25      58.3  T
   6    -30.2680540 -0.966736E-09  0.139E-04    2.25     174.1  T
     SCC iter.                  ...        0 min,  0.006 sec
     gradient                   ...        0 min,  0.012 sec
 * total energy  :   -29.8551253 Eh     change       -0.4063403E-05 Eh
   gradient norm :     0.0010018 Eh/α   predicted    -0.2902131E-05 ( -28.58%)
   displ. norm   :     0.0761762 α      lambda       -0.3936073E-05
   maximum displ.:     0.0532605 α      in ANC's #4, #2, #28, ...

........................................................................
.............................. CYCLE   18 ..............................
........................................................................
   1    -30.2679635 -0.302680E+02  0.145E-01    2.24       0.0  T
   2    -30.2679669 -0.340507E-05  0.715E-02    2.24       1.0  T
   3    -30.2679663  0.601046E-06  0.144E-02    2.24       1.7  T
   4    -30.2679674 -0.113273E-05  0.876E-03    2.25       2.8  T
   5    -30.2679679 -0.473587E-06  0.104E-03    2.25      23.3  T
   6    -30.2679679 -0.112871E-07  0.505E-04    2.25      48.1  T
   7    -30.2679679 -0.223825E-08  0.233E-04    2.25     104.2  T
     SCC iter.                  ...        0 min,  0.007 sec
     gradient                   ...        0 min,  0.012 sec
 * total energy  :   -29.8551269 Eh     change       -0.1663912E-05 Eh
   gradient norm :     0.0012412 Eh/α   predicted    -0.1971596E-05 (  18.49%)
   displ. norm   :     0.1030772 α      lambda       -0.3575218E-05
   maximum displ.:     0.0670451 α      in ANC's #4, #2, #28, ...

........................................................................
.............................. CYCLE   19 ..............................
........................................................................
   1    -30.2675837 -0.302676E+02  0.197E-01    2.25       0.0  T
   2    -30.2675901 -0.641652E-05  0.964E-02    2.25       1.0  T
   3    -30.2675916 -0.145185E-05  0.140E-02    2.25       1.7  T
   4    -30.2675908  0.794644E-06  0.790E-03    2.25       3.1  T
   5    -30.2675917 -0.937333E-06  0.792E-04    2.25      30.6  T
   6    -30.2675917 -0.212873E-08  0.500E-04    2.25      48.5  T
     SCC iter.                  ...        0 min,  0.006 sec
     gradient                   ...        0 min,  0.012 sec
 * total energy  :   -29.8551295 Eh     change       -0.2530475E-05 Eh
   gradient norm :     0.0008217 Eh/α   predicted    -0.1796967E-05 ( -28.99%)
   displ. norm   :     0.0156189 α      lambda       -0.1777418E-05
   maximum displ.:     0.0107463 α      in ANC's #4, #28, #2, ...

   *** GEOMETRY OPTIMIZATION CONVERGED AFTER 19 ITERATIONS ***

------------------------------------------------------------------------
 total energy gain   :        -0.0053733 Eh       -3.3718 kcal/mol
 total RMSD          :         0.5331397 a0        0.2821 Å
 total power (kW/mol):        -0.7425081 (step)  -25.4833 (real)
------------------------------------------------------------------------

 ANCopt (total)                0 d,  0 h,  0 min,  0.554 sec
 optimizer setup                ...        0 min,  0.000 sec (  0.025%)
 model hessian                  ...        0 min,  0.001 sec (  0.236%)
 ANC generation                 ...        0 min,  0.001 sec (  0.092%)
 coordinate transformation      ...        0 min,  0.000 sec (  0.049%)
 single point calculation       ...        0 min,  0.545 sec ( 98.481%)
 optimization log               ...        0 min,  0.001 sec (  0.262%)
 hessian update                 ...        0 min,  0.000 sec (  0.036%)
 rational function              ...        0 min,  0.003 sec (  0.605%)

================
 final structure:
================
$coord
    1.31871293408615    0.27049906103726   -1.38690279723542      C 
    3.05803870839964    2.67613828548876   -2.81640408424738      S 
    4.83162452176275    3.96695348211989   -0.31672726579330      C 
    6.32635022385471    6.02726155128361   -0.67210069337906      C 
    7.86432020344522    6.92818557112539    2.04397316861768      S 
    6.46887271147941    4.49738420322069    3.68909024947028      C 
    4.91282740421397    3.07608225421974    2.21643478517139      C 
    3.29265821312434    0.46682136172134    3.48488993291611      S 
    1.34086956138028   -0.62747549431654    0.97477004409043      C 
   -0.25135336115553   -2.69154374565186    1.84905589737534      C 
   -1.92646336893541   -3.98990574429344    0.50344397304570      C 
    0.05892318022448   -0.55205702063166   -2.76277219564203      H 
    6.60206936037225    7.05652786633009   -2.39272120675118      H 
    6.86823571549829    4.23407707284185    5.65539125345959      H 
    0.02640577819487   -3.15785019218050    3.82338407477895      H 
   -2.29221853618433   -3.62761395978027   -1.46410691325080      H 
   -3.00207540410158   -5.49028822395465    1.35379122145905      H 
$end
           -------------------------------------------------
          |                Final Singlepoint                |
           -------------------------------------------------

          ...................................................
          :                      SETUP                      :
          :.................................................:
          :  # basis functions                  68          :
          :  # atomic orbitals                  65          :
          :  # shells                           31          :
          :  # electrons                        56          :
          :  max. iterations                   250          :
          :  Hamiltonian                  GFN2-xTB          :
          :  restarted?                      false          :
          :  GBSA solvation                  false          :
          :  PC potential                    false          :
          :  electronic temp.          300.0000000     K    :
          :  accuracy                    1.0000000          :
          :  -> integral cutoff          0.2500000E+02      :
          :  -> integral neglect         0.1000000E-07      :
          :  -> SCF convergence          0.1000000E-05 Eh   :
          :  -> wf. convergence          0.1000000E-03 e    :
          :  Broyden damping             0.4000000          :
          ...................................................

 iter      E             dE          RMSdq      gap      omega  full diag
   1    -30.2675917 -0.302676E+02  0.284E-04    2.25       0.0  T
   2    -30.2675917 -0.946088E-11  0.166E-04    2.25     146.2  T
   3    -30.2675917 -0.543288E-09  0.102E-04    2.25     238.7  T

   *** convergence criteria satisfied after 3 iterations ***

         #    Occupation            Energy/Eh            Energy/eV
      -------------------------------------------------------------
         1        2.0000           -0.7438761             -20.2419
       ...           ...                  ...                  ...
        22        2.0000           -0.4515554             -12.2874
        23        2.0000           -0.4436722             -12.0729
        24        2.0000           -0.4424221             -12.0389
        25        2.0000           -0.4313287             -11.7371
        26        2.0000           -0.4136641             -11.2564
        27        2.0000           -0.3895661             -10.6006
        28        2.0000           -0.3529587              -9.6045 (HOMO)
        29                         -0.2704419              -7.3591 (LUMO)
        30                         -0.2593798              -7.0581
        31                         -0.2255142              -6.1366
        32                         -0.2135404              -5.8107
        33                         -0.1999747              -5.4416
       ...                                ...                  ...
        65                          0.6915453              18.8179
      -------------------------------------------------------------
                  HL-Gap            0.0825168 Eh            2.2454 eV
             Fermi-level           -0.3117003 Eh           -8.4818 eV

 SCC (total)                   0 d,  0 h,  0 min,  0.026 sec
 SCC setup                      ...        0 min,  0.000 sec (  0.645%)
 Dispersion                     ...        0 min,  0.000 sec (  0.449%)
 integral evaluation            ...        0 min,  0.009 sec ( 34.656%)
 zeroth order Hamiltonian       ...        0 min,  0.000 sec (  0.550%)
 iterations                     ...        0 min,  0.004 sec ( 13.997%)
 molecular gradient             ...        0 min,  0.012 sec ( 48.222%)
 printout                       ...        0 min,  0.000 sec (  1.289%)

         :::::::::::::::::::::::::::::::::::::::::::::::::::::
         ::                     SUMMARY                     ::
         :::::::::::::::::::::::::::::::::::::::::::::::::::::
         :: total energy             -29.855129509555 Eh    ::
         :: gradient norm              0.000821865475 Eh/a0 ::
         :: HOMO-LUMO gap              2.245396841292 eV    ::
         ::.................................................::
         :: SCC energy               -30.267591718754 Eh    ::
         :: -> isotropic ES            0.002240609122 Eh    ::
         :: -> anisotropic ES          0.002034039792 Eh    ::
         :: -> anisotropic XC          0.016239353476 Eh    ::
         :: -> dispersion             -0.021243469957 Eh    ::
         :: repulsion energy           0.412503005373 Eh    ::
         :: add. restraining           0.000000000000 Eh    ::
         :::::::::::::::::::::::::::::::::::::::::::::::::::::

           -------------------------------------------------
          |                Property Printout                |
           -------------------------------------------------

    * Orbital Energies and Occupations

         #    Occupation            Energy/Eh            Energy/eV
      -------------------------------------------------------------
         1        2.0000           -0.7438761             -20.2419
       ...           ...                  ...                  ...
        16        2.0000           -0.4976576             -13.5420
        17        2.0000           -0.4871255             -13.2554
        18        2.0000           -0.4845156             -13.1843
        19        2.0000           -0.4756582             -12.9433
        20        2.0000           -0.4738922             -12.8953
        21        2.0000           -0.4606293             -12.5344
        22        2.0000           -0.4515554             -12.2874
        23        2.0000           -0.4436722             -12.0729
        24        2.0000           -0.4424221             -12.0389
        25        2.0000           -0.4313287             -11.7371
        26        2.0000           -0.4136641             -11.2564
        27        2.0000           -0.3895661             -10.6006
        28        2.0000           -0.3529587              -9.6045 (HOMO)
        29                         -0.2704419              -7.3591 (LUMO)
        30                         -0.2593798              -7.0581
        31                         -0.2255142              -6.1366
        32                         -0.2135404              -5.8107
        33                         -0.1999747              -5.4416
        34                         -0.1974814              -5.3737
        35                         -0.1681823              -4.5765
        36                         -0.1655776              -4.5056
        37                         -0.1246360              -3.3915
        38                         -0.1165774              -3.1722
        39                         -0.0237998              -0.6476
       ...                                ...                  ...
        65                          0.6915453              18.8179
      -------------------------------------------------------------
                  HL-Gap            0.0825168 Eh            2.2454 eV
             Fermi-level           -0.3117003 Eh           -8.4818 eV

     #   Z        covCN         q      C6AA      α(0)
     1   6 C      2.915    -0.012    28.324     8.727
     2  16 S      2.032    -0.098   145.128    20.276
     3   6 C      3.169     0.030    26.963     8.484
     4   6 C      2.989    -0.037    28.900     8.818
     5  16 S      2.290    -0.007   141.339    20.009
     6   6 C      2.994    -0.037    28.916     8.821
     7   6 C      3.166     0.033    26.919     8.479
     8  16 S      2.128    -0.123   146.222    20.352
     9   6 C      2.957     0.039    27.119     8.541
    10   6 C      2.980    -0.029    28.726     8.792
    11   6 C      2.837    -0.088    30.193     9.005
    12   1 H      0.926     0.063     2.167     2.302
    13   1 H      0.926     0.059     2.216     2.328
    14   1 H      0.927     0.058     2.218     2.329
    15   1 H      0.925     0.055     2.263     2.353
    16   1 H      0.926     0.043     2.415     2.430
    17   1 H      0.926     0.052     2.301     2.372

 Mol. C6AA /au·bohr⁶  :       7659.708227
 Mol. C8AA /au·bohr⁸  :     262052.555002
 Mol. α(0) /au        :        144.417836


Wiberg/Mayer (AO) data.
largest (>0.10) Wiberg bond orders for each atom
          total WBO             WBO to atom ...
     1  C   3.958        C    9 1.697    S    2 1.089    H   12 0.943
     2  S   2.452        C    1 1.089    C    3 1.024
     3  C   3.959        C    4 1.579    C    7 1.204    S    2 1.024
     4  C   3.939        C    3 1.579    S    5 1.179    H   13 0.968
     5  S   2.636        C    4 1.179    C    6 1.175
     6  C   3.942        C    7 1.577    S    5 1.175    H   14 0.968
     7  C   3.961        C    6 1.577    C    3 1.204    S    8 1.031
     8  S   2.379        C    7 1.031    C    9 1.019
     9  C   3.956        C    1 1.697    C   10 1.092    S    8 1.019
    10  C   3.987        C   11 1.883    C    9 1.092    H   15 0.958
    11  C   3.983        C   10 1.883    H   17 0.976    H   16 0.972
    12  H   0.995        C    1 0.943
    13  H   0.997        C    4 0.968
    14  H   0.997        C    6 0.968
    15  H   0.997        C   10 0.958
    16  H   0.998        C   11 0.972
    17  H   0.997        C   11 0.976

molecular dipole:
                 x           y           z       tot (Debye)
 q only:       -0.168      -0.114      -0.028
   full:       -0.307      -0.236      -0.102       1.018
molecular quadrupole (traceless):
                xx          xy          yy          xz          yz          zz
 q only:       -0.270       3.197       1.484       0.509       0.219      -1.214
  q+dip:       -1.442       1.198       0.226       0.290      -0.614       1.216
   full:       -0.837       0.731       0.698      -0.075      -0.156       0.139

           -------------------------------------------------
          |                Geometry Summary                 |
           -------------------------------------------------

      molecular mass/u    :      198.3154000
   center of mass at/Å    :        1.9761103       1.1948883       0.4631419
  moments of inertia/u·Å² :        0.2926965E+03   0.1041643E+04   0.1332771E+04
rotational constants/cm⁻¹ :        0.5759424E-01   0.1618370E-01   0.1264856E-01

 * 15 selected distances

     #   Z        #   Z                                     value/Å
     1   6 C      2  16 S                                 1.7435430
     3   6 C      4   6 C                                 1.3600334
     4   6 C      5  16 S                                 1.7191399
     5  16 S      6   6 C                                 1.7198244
     3   6 C      7   6 C                                 1.4216222
     6   6 C      7   6 C                                 1.3605198
     7   6 C      8  16 S                                 1.7584433 (max)
     1   6 C      9   6 C                                 1.3370863
    10   6 C     11   6 C                                 1.3284783
     1   6 C     12   1 H                                 1.0788840
     4   6 C     13   1 H                                 1.0709723
     6   6 C     14   1 H                                 1.0708698 (min)
    10   6 C     15   1 H                                 1.0835302
    11   6 C     16   1 H                                 1.0762337
    11   6 C     17   1 H                                 1.0755688

 * 3 distinct bonds (by element types)

   Z      Z             #   av. dist./Å        max./Å        min./Å
   1 H    6 C           6     1.0760098     1.0835302     1.0708698
   6 C    6 C           5     1.3615480     1.4216222     1.3284783
   6 C   16 S           4     1.7352376     1.7584433     1.7191399


optimized geometry written to: xtbopt.xyz


           -------------------------------------------------
          | TOTAL ENERGY              -29.855129509555 Eh   |
          | GRADIENT NORM               0.000821865475 Eh/α |
          | HOMO-LUMO GAP               2.245396841292 eV   |
           -------------------------------------------------

------------------------------------------------------------------------
 * finished run on 2021/05/19 at 10:59:37.162     
------------------------------------------------------------------------
 total:
 * wall-time:     0 d,  0 h,  0 min,  0.639 sec
 *  cpu-time:     0 d,  0 h,  0 min,  0.638 sec
 * ratio c/w:     0.998 speedup
 SCF:
 * wall-time:     0 d,  0 h,  0 min,  0.037 sec
 *  cpu-time:     0 d,  0 h,  0 min,  0.037 sec
 * ratio c/w:     1.000 speedup
 ANC optimizer:
 * wall-time:     0 d,  0 h,  0 min,  0.580 sec
 *  cpu-time:     0 d,  0 h,  0 min,  0.580 sec
 * ratio c/w:     1.000 speedup

