      -----------------------------------------------------------      
     |                   =====================                   |     
     |                           x T B                           |     
     |                   =====================                   |     
     |                         S. Grimme                         |     
     |          Mulliken Center for Theoretical Chemistry        |     
     |                    University of Bonn                     |     
     |                Version 6.2 RC2 (SAW190805)                |     
      -----------------------------------------------------------      

   This program is distributed in the hope that it will be useful,
   but WITHOUT ANY WARRANTY; without even the implied warranty of
   MERCHANTABILITY or FITNESS FOR A PARTICULAR PURPOSE.
   
   FOR NON-COMMERCIAL, ACADEMIA USE ONLY.
   
   Cite this work as:
   * S. Grimme, C. Bannwarth, P. Shushkov, J. Chem. Theory Comput., 2017,
     13, 1989-2009. DOI: 10.1021/acs.jctc.7b00118
   * C. Bannwarth, S. Ehlert and S. Grimme., J. Chem. Theory Comput., 2019,
     15, 1652-1671. DOI: 10.1021/acs.jctc.8b01176
   * P. Pracht, E. Caldeweyher, S. Ehlert, S. Grimme, ChemRxiv, 2019, preprint.
     DOI: 10.26434/chemrxiv.8326202.v1
   
   for DFT-D4:
   * E. Caldeweyher, C. Bannwarth and S. Grimme, J. Chem. Phys., 2017,
     147, 034112. DOI: 10.1063/1.4993215
   * E. Caldeweyher, S. Ehlert, A. Hansen, H. Neugebauer, S. Spicher,
     C. Bannwarth and S. Grimme, J. Chem. Phys., 2019, 150, 154122.
     DOI: 10.1063/1.5090222
   
   for sTDA-xTB:
   * S. Grimme and C. Bannwarth, J. Chem. Phys., 2016, 145, 054103.
     DOI: 10.1063/1.4959605
   
   in the mass-spec context:
   * V. Asgeirsson, C. Bauer and S. Grimme, Chem. Sci., 2017, 8, 4879.
     DOI: 10.1039/c7sc00601b
   
   for metadynamics refer to:
   * S. Grimme, J. Chem. Theory Comput., 2019, 155, 2847-2862
     DOI: 10.1021/acs.jctc.9b00143
   
   with help from (in alphabetical order)
   C. Bannwarth, F. Bohle, G. Brandenburg, E. Caldeweyher, M. Checinski,
   S. Dohm, S. Ehlert, S. Ehrlich, F. März, H. Neugebauer, J. Pisarek,
   P. Pracht, P. Shushkov, and S. Spicher.
   
 * started run on 2021/05/19 at 10:59:38.335     

           -------------------------------------------------
          |                Calculation Setup                |
           -------------------------------------------------

          program call               : /ihome/ghutchison/geoffh/xtb/xtb 286.xyz -opt
          hostname                   : smp-n83
          coordinate file            : 286.xyz
          omp threads                :                     1
          number of atoms            :                    20
          number of electrons        :                    60
          charge                     :                     0
          spin                       :                   0.0
          first test random number   :      0.34711420559543


########################################################################
# WARNING! Please study the warnings concerning your input carefully
#  - the use of '-opt' is discouraged, please use '--opt' next time
########################################################################

           ------------------------------------------------- 
          |                 G F N 2 - x T B                 |
          | Geometry, Frequencies, Noncovalent interactions |
          |            JCTC 2019 parametrisation            |
           ------------------------------------------------- 
             KAB for C  - Si     :                1.0500
             KAB for H  - Pd     :                0.9500
             k(s)              :                1.8500
             k(p)              :                2.2300
             k(d)              :                2.2300
             k(f)              :                2.0000
             kEN (H0ij)        :               -2.0000
             D4 a1             :                0.5200
             D4 a2             :                5.0000
             D4 s6             :                1.0000
             D4 s8             :                2.7000
             D4 s9             :                5.0000
             alphaj            :                2.0000

  Z AO/shell   Hii/eV     exponent
  1     Wed Apr 25 08:07:45 CEST 2018   EN: 2.200 GM2: 0.406  GM3: 0.0800  RAES: 1.40
     1s    -10.707211    1.230000
  6     Wed Apr 25 08:07:45 CEST 2018   EN: 2.550 GM2: 0.538  GM3: 0.1500  RAES: 3.00
     2s    -13.970922    2.096432
     2p    -10.063292    1.800000
  8     Wed Apr 25 08:07:45 CEST 2018   EN: 3.440 GM2: 0.452  GM3:-0.0517  RAES: 1.80
     2s    -20.229985    2.439742
     2p    -15.503117    2.137023
 16     Tue Apr 24 11:44:34 CEST 2018   EN: 2.580 GM2: 0.340  GM3:-0.0502  RAES: 3.10
     3s    -20.029654    1.981333
     3p    -11.377694    2.025643
     3d     -0.420282    1.702555

           ------------------------------------------------- 
          |        Self-Consistent Charge Iterations        |
           ------------------------------------------------- 

          ...................................................
          :                      SETUP                      :
          :.................................................:
          :  # basis functions                  62          :
          :  # atomic orbitals                  61          :
          :  # shells                           33          :
          :  # electrons                        60          :
          :  max. iterations                   250          :
          :  Hamiltonian                  GFN2-xTB          :
          :  restarted?                      false          :
          :  GBSA solvation                  false          :
          :  PC potential                    false          :
          :  electronic temp.          300.0000000     K    :
          :  accuracy                    1.0000000          :
          :  -> integral cutoff          0.2500000E+02      :
          :  -> integral neglect         0.1000000E-07      :
          :  -> SCF convergence          0.1000000E-05 Eh   :
          :  -> wf. convergence          0.1000000E-03 e    :
          :  Broyden damping             0.4000000          :
          ...................................................

 iter      E             dE          RMSdq      gap      omega  full diag
   1    -33.2098862 -0.332099E+02  0.449E+00    2.05       0.0  T
   2    -33.2219510 -0.120648E-01  0.271E+00    2.05       1.0  T
   3    -33.1771934  0.447576E-01  0.181E+00    2.23       1.0  T
   4    -33.2244780 -0.472846E-01  0.563E-01    2.04       1.0  T
   5    -33.2292520 -0.477397E-02  0.223E-01    2.07       1.0  T
   6    -33.2298562 -0.604229E-03  0.644E-02    2.07       1.0  T
   7    -33.2298634 -0.721829E-05  0.332E-02    2.06       1.0  T
   8    -33.2298776 -0.142117E-04  0.119E-02    2.07       1.9  T
   9    -33.2298777 -0.134280E-06  0.623E-03    2.07       3.6  T
  10    -33.2298780 -0.272200E-06  0.229E-03    2.07       9.8  T
  11    -33.2298781 -0.427653E-07  0.102E-03    2.07      22.0  T
  12    -33.2298781 -0.837914E-08  0.429E-04    2.07      52.1  T
  13    -33.2298781 -0.632483E-09  0.212E-04    2.07     105.4  T

   *** convergence criteria satisfied after 13 iterations ***

         #    Occupation            Energy/Eh            Energy/eV
      -------------------------------------------------------------
         1        2.0000           -0.7317004             -19.9106
       ...           ...                  ...                  ...
        24        2.0000           -0.4406949             -11.9919
        25        2.0000           -0.4359158             -11.8619
        26        2.0000           -0.4321215             -11.7586
        27        2.0000           -0.4259057             -11.5895
        28        2.0000           -0.4099862             -11.1563
        29        2.0000           -0.3868079             -10.5256
        30        2.0000           -0.3554730              -9.6729 (HOMO)
        31                         -0.2795521              -7.6070 (LUMO)
        32                         -0.2295388              -6.2461
        33                         -0.2005883              -5.4583
        34                         -0.1962174              -5.3393
        35                         -0.1869763              -5.0879
       ...                                ...                  ...
        61                          0.7401263              20.1399
      -------------------------------------------------------------
                  HL-Gap            0.0759210 Eh            2.0659 eV
             Fermi-level           -0.3175126 Eh           -8.6400 eV

 SCC (total)                   0 d,  0 h,  0 min,  0.033 sec
 SCC setup                      ...        0 min,  0.000 sec (  0.863%)
 Dispersion                     ...        0 min,  0.000 sec (  0.880%)
 integral evaluation            ...        0 min,  0.007 sec ( 22.945%)
 zeroth order Hamiltonian       ...        0 min,  0.000 sec (  0.451%)
 iterations                     ...        0 min,  0.013 sec ( 39.359%)
 molecular gradient             ...        0 min,  0.011 sec ( 34.295%)
 printout                       ...        0 min,  0.000 sec (  1.049%)

         :::::::::::::::::::::::::::::::::::::::::::::::::::::
         ::                     SUMMARY                     ::
         :::::::::::::::::::::::::::::::::::::::::::::::::::::
         :: total energy             -32.743508626205 Eh    ::
         :: gradient norm              0.097219196749 Eh/a0 ::
         :: HOMO-LUMO gap              2.065914953090 eV    ::
         ::.................................................::
         :: SCC energy               -33.229878067414 Eh    ::
         :: -> isotropic ES            0.021753034819 Eh    ::
         :: -> anisotropic ES          0.002464031601 Eh    ::
         :: -> anisotropic XC          0.015165681982 Eh    ::
         :: -> dispersion             -0.021257316406 Eh    ::
         :: repulsion energy           0.486266374319 Eh    ::
         :: add. restraining           0.000000000000 Eh    ::
         :::::::::::::::::::::::::::::::::::::::::::::::::::::

      ----------------------------------------------------------- 
     |                   =====================                   |
     |                        A N C O P T                        |
     |                   =====================                   |
     |               Approximate Normal Coordinate               |
     |                Rational Function Optimizer                |
      ----------------------------------------------------------- 

          ...................................................
          :                      SETUP                      :
          :.................................................:
          :   optimization level            normal          :
          :   max. optcycles                   200          :
          :   ANC micro-cycles                  20          :
          :   degrees of freedom                54          :
          :.................................................:
          :   RF solver                   davidson          :
          :   input Hessian                  false          :
          :   write xtbopt.log                true          :
          :   linear?                        false          :
          :   energy convergence         0.5000000E-05 Eh   :
          :   grad. convergence          0.1000000E-02 Eh/α :
          :   maximium RF displ.         2.0000000          :
          :   Hlow (freq-cutoff)         0.5000000E-02      :
          :   Hmax (freq-cutoff)         5.0000000          :
          :   S6 in model hess.         20.0000000          :
          ...................................................

generating ANC from model Hessian ...
Using Lindh-Hessian (1995)
 Shifting diagonal of input Hessian by   2.720607806429975E-003
 Lowest  eigenvalues of input Hessian
   -0.000000   -0.000000   -0.000000    0.000000    0.000000    0.000000
    0.005000    0.006128    0.007896    0.009129    0.011649    0.016571
    0.021685    0.022595    0.026793    0.030332    0.038156    0.046676
 Highest eigenvalues
    1.735093    1.759409    1.838089    1.867654    2.002709    2.039446
 

........................................................................
.............................. CYCLE    1 ..............................
........................................................................
   1    -33.2298781 -0.332299E+02  0.104E-04    2.07       0.0  T
   2    -33.2298781 -0.184315E-10  0.847E-05    2.07     264.0  T
   3    -33.2298781 -0.110930E-09  0.394E-05    2.07     567.8  T
     SCC iter.                  ...        0 min,  0.003 sec
     gradient                   ...        0 min,  0.011 sec
 * total energy  :   -32.7435086 Eh     change        0.5442139E-08 Eh
   gradient norm :     0.0972204 Eh/α   predicted     0.0000000E+00 (-100.00%)
   displ. norm   :     0.3137306 α      lambda       -0.1474414E-01
   maximum displ.:     0.1903605 α      in ANC's #13, #24, #9, ...

........................................................................
.............................. CYCLE    2 ..............................
........................................................................
   1    -33.2615811 -0.332616E+02  0.257E-01    2.17       0.0  T
   2    -33.2616519 -0.708756E-04  0.160E-01    2.16       1.0  T
   3    -33.2616082  0.437317E-04  0.103E-01    2.17       1.0  T
   4    -33.2617199 -0.111655E-03  0.311E-02    2.16       1.0  T
   5    -33.2617367 -0.168221E-04  0.116E-02    2.16       1.9  T
   6    -33.2617386 -0.192306E-05  0.408E-03    2.16       5.5  T
   7    -33.2617387 -0.112619E-06  0.187E-03    2.16      11.9  T
     SCC iter.                  ...        0 min,  0.007 sec
     gradient                   ...        0 min,  0.010 sec
 * total energy  :   -32.7538221 Eh     change       -0.1031345E-01 Eh
   gradient norm :     0.0466259 Eh/α   predicted    -0.8097679E-02 ( -21.48%)
   displ. norm   :     0.2640672 α      lambda       -0.4588895E-02
   maximum displ.:     0.1154141 α      in ANC's #3, #2, #13, ...

........................................................................
.............................. CYCLE    3 ..............................
........................................................................
   1    -33.2760750 -0.332761E+02  0.226E-01    2.26       0.0  T
   2    -33.2761172 -0.421788E-04  0.137E-01    2.26       1.0  T
   3    -33.2760649  0.523355E-04  0.895E-02    2.26       1.0  T
   4    -33.2761526 -0.877674E-04  0.274E-02    2.26       1.0  T
   5    -33.2761661 -0.134922E-04  0.839E-03    2.26       2.7  T
   6    -33.2761668 -0.644605E-06  0.324E-03    2.26       6.9  T
   7    -33.2761669 -0.811849E-07  0.126E-03    2.26      17.7  T
     SCC iter.                  ...        0 min,  0.007 sec
     gradient                   ...        0 min,  0.010 sec
 * total energy  :   -32.7562790 Eh     change       -0.2456929E-02 Eh
   gradient norm :     0.0116111 Eh/α   predicted    -0.2454451E-02 (  -0.10%)
   displ. norm   :     0.1531396 α      lambda       -0.5235848E-03
   maximum displ.:     0.0772492 α      in ANC's #2, #3, #1, ...

........................................................................
.............................. CYCLE    4 ..............................
........................................................................
   1    -33.2743618 -0.332744E+02  0.142E-01    2.26       0.0  T
   2    -33.2743653 -0.343465E-05  0.837E-02    2.26       1.0  T
   3    -33.2743350  0.302891E-04  0.529E-02    2.26       1.0  T
   4    -33.2743702 -0.352106E-04  0.913E-03    2.26       2.4  T
   5    -33.2743716 -0.142022E-05  0.301E-03    2.26       7.4  T
   6    -33.2743717 -0.786104E-07  0.132E-03    2.26      16.9  T
   7    -33.2743717 -0.135458E-07  0.644E-04    2.26      34.7  T
     SCC iter.                  ...        0 min,  0.007 sec
     gradient                   ...        0 min,  0.010 sec
 * total energy  :   -32.7565694 Eh     change       -0.2904081E-03 Eh
   gradient norm :     0.0064622 Eh/α   predicted    -0.2679323E-03 (  -7.74%)
   displ. norm   :     0.1877357 α      lambda       -0.3179849E-03
   maximum displ.:     0.1335009 α      in ANC's #2, #1, #3, ...

........................................................................
.............................. CYCLE    5 ..............................
........................................................................
   1    -33.2718341 -0.332718E+02  0.134E-01    2.25       0.0  T
   2    -33.2718365 -0.242354E-05  0.788E-02    2.25       1.0  T
   3    -33.2718115  0.249711E-04  0.459E-02    2.25       1.0  T
   4    -33.2718398 -0.282599E-04  0.719E-03    2.25       3.1  T
   5    -33.2718407 -0.880535E-06  0.288E-03    2.25       7.8  T
   6    -33.2718408 -0.976915E-07  0.109E-03    2.25      20.5  T
     SCC iter.                  ...        0 min,  0.006 sec
     gradient                   ...        0 min,  0.010 sec
 * total energy  :   -32.7567635 Eh     change       -0.1941243E-03 Eh
   gradient norm :     0.0050802 Eh/α   predicted    -0.1646031E-03 ( -15.21%)
   displ. norm   :     0.1146853 α      lambda       -0.1280577E-03
   maximum displ.:     0.0833245 α      in ANC's #2, #1, #3, ...

........................................................................
.............................. CYCLE    6 ..............................
........................................................................
   1    -33.2722972 -0.332723E+02  0.883E-02    2.24       0.0  T
   2    -33.2722982 -0.985534E-06  0.516E-02    2.24       1.0  T
   3    -33.2722874  0.108438E-04  0.293E-02    2.24       1.0  T
   4    -33.2722996 -0.121986E-04  0.511E-03    2.24       4.4  T
   5    -33.2722999 -0.320053E-06  0.284E-03    2.24       7.9  T
   6    -33.2723000 -0.103369E-06  0.756E-04    2.24      29.6  T
     SCC iter.                  ...        0 min,  0.006 sec
     gradient                   ...        0 min,  0.010 sec
 * total energy  :   -32.7568658 Eh     change       -0.1022824E-03 Eh
   gradient norm :     0.0045457 Eh/α   predicted    -0.6487184E-04 ( -36.58%)
   displ. norm   :     0.1724943 α      lambda       -0.1523297E-03
   maximum displ.:     0.1230798 α      in ANC's #2, #1, #4, ...

........................................................................
.............................. CYCLE    7 ..............................
........................................................................
   1    -33.2733208 -0.332733E+02  0.134E-01    2.23       0.0  T
   2    -33.2733227 -0.194767E-05  0.780E-02    2.23       1.0  T
   3    -33.2733063  0.164046E-04  0.353E-02    2.23       1.0  T
   4    -33.2733250 -0.187058E-04  0.550E-03    2.23       4.1  T
   5    -33.2733250  0.182786E-07  0.418E-03    2.23       5.3  T
   6    -33.2733252 -0.247534E-06  0.115E-03    2.23      19.4  T
   7    -33.2733253 -0.132507E-07  0.543E-04    2.23      41.2  T
     SCC iter.                  ...        0 min,  0.007 sec
     gradient                   ...        0 min,  0.010 sec
 * total energy  :   -32.7569765 Eh     change       -0.1106959E-03 Eh
   gradient norm :     0.0037529 Eh/α   predicted    -0.7843477E-04 ( -29.14%)
   displ. norm   :     0.1680175 α      lambda       -0.9585853E-04
   maximum displ.:     0.1177818 α      in ANC's #2, #1, #4, ...

........................................................................
.............................. CYCLE    8 ..............................
........................................................................
   1    -33.2735382 -0.332735E+02  0.134E-01    2.22       0.0  T
   2    -33.2735401 -0.192785E-05  0.769E-02    2.22       1.0  T
   3    -33.2735289  0.112442E-04  0.293E-02    2.22       1.0  T
   4    -33.2735418 -0.129574E-04  0.583E-03    2.22       3.8  T
   5    -33.2735419 -0.491613E-07  0.211E-03    2.22      10.6  T
   6    -33.2735419 -0.528188E-07  0.722E-04    2.22      31.0  T
   7    -33.2735419 -0.664769E-08  0.347E-04    2.22      64.4  T
     SCC iter.                  ...        0 min,  0.007 sec
     gradient                   ...        0 min,  0.011 sec
 * total energy  :   -32.7570453 Eh     change       -0.6877915E-04 Eh
   gradient norm :     0.0031382 Eh/α   predicted    -0.4928473E-04 ( -28.34%)
   displ. norm   :     0.1546103 α      lambda       -0.6799241E-04
   maximum displ.:     0.1031148 α      in ANC's #2, #1, #4, ...

........................................................................
.............................. CYCLE    9 ..............................
........................................................................
   1    -33.2735737 -0.332736E+02  0.129E-01    2.22       0.0  T
   2    -33.2735755 -0.179780E-05  0.723E-02    2.22       1.0  T
   3    -33.2735715  0.398857E-05  0.185E-02    2.21       1.2  T
   4    -33.2735760 -0.452966E-05  0.725E-03    2.22       3.1  T
   5    -33.2735761 -0.950394E-07  0.393E-03    2.21       5.7  T
   6    -33.2735763 -0.262070E-06  0.682E-04    2.22      32.8  T
   7    -33.2735764 -0.550511E-08  0.273E-04    2.22      82.0  T
     SCC iter.                  ...        0 min,  0.007 sec
     gradient                   ...        0 min,  0.011 sec
 * total energy  :   -32.7570900 Eh     change       -0.4466777E-04 Eh
   gradient norm :     0.0023690 Eh/α   predicted    -0.3481245E-04 ( -22.06%)
   displ. norm   :     0.0805131 α      lambda       -0.2831921E-04
   maximum displ.:     0.0449452 α      in ANC's #2, #3, #1, ...

........................................................................
.............................. CYCLE   10 ..............................
........................................................................
   1    -33.2737233 -0.332737E+02  0.691E-02    2.22       0.0  T
   2    -33.2737240 -0.712537E-06  0.379E-02    2.22       1.0  T
   3    -33.2737239  0.950211E-07  0.683E-03    2.22       3.3  T
   4    -33.2737240 -0.172654E-06  0.400E-03    2.22       5.6  T
   5    -33.2737242 -0.123638E-06  0.912E-04    2.22      24.5  T
   6    -33.2737242 -0.141528E-07  0.310E-04    2.22      72.1  T
     SCC iter.                  ...        0 min,  0.006 sec
     gradient                   ...        0 min,  0.011 sec
 * total energy  :   -32.7571067 Eh     change       -0.1672862E-04 Eh
   gradient norm :     0.0013225 Eh/α   predicted    -0.1425188E-04 ( -14.81%)
   displ. norm   :     0.1203538 α      lambda        0.1352286E-04
   maximum displ.:     0.0674270 α      in ANC's #2, #3, #1, ...

........................................................................
.............................. CYCLE   11 ..............................
........................................................................
   1    -33.2736182 -0.332736E+02  0.103E-01    2.22       0.0  T
   2    -33.2736198 -0.160063E-05  0.566E-02    2.22       1.0  T
   3    -33.2736196  0.255681E-06  0.103E-02    2.22       2.2  T
   4    -33.2736200 -0.440614E-06  0.601E-03    2.22       3.7  T
   5    -33.2736203 -0.266464E-06  0.148E-03    2.22      15.1  T
   6    -33.2736203 -0.373840E-07  0.508E-04    2.22      44.0  T
   7    -33.2736203 -0.296748E-08  0.269E-04    2.22      83.0  T
     SCC iter.                  ...        0 min,  0.007 sec
     gradient                   ...        0 min,  0.011 sec
 * total energy  :   -32.7570904 Eh     change        0.1631879E-04 Eh
   gradient norm :     0.0032817 Eh/α   predicted     0.6803221E-05 ( -58.31%)
   displ. norm   :     0.0480440 α      lambda       -0.2931066E-04
   maximum displ.:     0.0260392 α      in ANC's #2, #1, #3, ...

........................................................................
.............................. CYCLE   12 ..............................
........................................................................
   1    -33.2735197 -0.332735E+02  0.395E-02    2.22       0.0  T
   2    -33.2735200 -0.249156E-06  0.218E-02    2.22       1.0  T
   3    -33.2735194  0.561365E-06  0.691E-03    2.22       3.2  T
   4    -33.2735201 -0.664446E-06  0.244E-03    2.22       9.2  T
   5    -33.2735201  0.636784E-08  0.146E-03    2.22      15.3  T
   6    -33.2735201 -0.374498E-07  0.266E-04    2.22      84.0  T
   7    -33.2735201 -0.839385E-09  0.102E-04    2.22     218.5  T
     SCC iter.                  ...        0 min,  0.007 sec
     gradient                   ...        0 min,  0.011 sec
 * total energy  :   -32.7571088 Eh     change       -0.1842630E-04 Eh
   gradient norm :     0.0011565 Eh/α   predicted    -0.1468947E-04 ( -20.28%)
   displ. norm   :     0.0898461 α      lambda       -0.7094008E-05
   maximum displ.:     0.0566455 α      in ANC's #2, #1, #4, ...

........................................................................
.............................. CYCLE   13 ..............................
........................................................................
   1    -33.2739142 -0.332739E+02  0.762E-02    2.22       0.0  T
   2    -33.2739148 -0.660743E-06  0.430E-02    2.22       1.0  T
   3    -33.2739129  0.191950E-05  0.124E-02    2.22       1.8  T
   4    -33.2739151 -0.220028E-05  0.415E-03    2.22       5.4  T
   5    -33.2739151  0.219625E-08  0.245E-03    2.22       9.1  T
   6    -33.2739152 -0.101538E-06  0.479E-04    2.22      46.7  T
   7    -33.2739152 -0.291470E-08  0.180E-04    2.22     124.0  T
     SCC iter.                  ...        0 min,  0.007 sec
     gradient                   ...        0 min,  0.011 sec
 * total energy  :   -32.7571098 Eh     change       -0.1035125E-05 Eh
   gradient norm :     0.0007275 Eh/α   predicted    -0.3560690E-05 ( 243.99%)
   displ. norm   :     0.0462367 α      lambda       -0.3056099E-05
   maximum displ.:     0.0312988 α      in ANC's #2, #1, #4, ...

   *** GEOMETRY OPTIMIZATION CONVERGED AFTER 13 ITERATIONS ***

------------------------------------------------------------------------
 total energy gain   :        -0.0136012 Eh       -8.5349 kcal/mol
 total RMSD          :         0.2737381 a0        0.1449 Å
 total power (kW/mol):        -2.7469189 (step) -108.0260 (real)
------------------------------------------------------------------------

 ANCopt (total)                0 d,  0 h,  0 min,  0.331 sec
 optimizer setup                ...        0 min,  0.000 sec (  0.044%)
 model hessian                  ...        0 min,  0.003 sec (  0.860%)
 ANC generation                 ...        0 min,  0.001 sec (  0.162%)
 coordinate transformation      ...        0 min,  0.000 sec (  0.053%)
 single point calculation       ...        0 min,  0.323 sec ( 97.726%)
 optimization log               ...        0 min,  0.001 sec (  0.354%)
 hessian update                 ...        0 min,  0.000 sec (  0.052%)
 rational function              ...        0 min,  0.002 sec (  0.504%)

================
 final structure:
================
$coord
   -2.68523441245150   -2.41407339093864    0.29050286620975      C 
   -5.00747671456722   -0.17851669896022    0.53713830562507      S 
   -2.87477611155266    2.23492898294877    0.40500278238669      C 
   -0.43773563932339    1.36472327444206    0.17202790043931      C 
   -0.32320003577520   -1.35208372664979    0.09346151512002      C 
    2.05611353073468   -2.61296724149430   -0.11409361146099      C 
    4.19468406427262   -1.13325591556129   -0.27126357881987      C 
    4.05995068823552    1.55084783014405   -0.20600375773508      C 
    1.82550597010332    2.78569106793646    0.01625115373717      C 
    6.55085574383377   -2.09795372206688   -0.58630193346189      O 
    2.11501505646495   -5.37156063688311   -0.24811889039558      C 
    3.77508469544089   -6.86591067614299    0.90006808497734      C 
   -3.19763250354676   -4.37174253885971    0.31801828203582      H 
   -3.51060464327145    4.15419486741371    0.51163743469918      H 
    5.82685715499328    2.55671710438777   -0.34979582941067      H 
    1.73730721604187    4.82221128216249    0.06867909540431      H 
    6.44140237744191   -3.91278466221689   -0.77815582487319      H 
    0.63147139207605   -6.20919445069461   -1.38290952045273      H 
    5.20115554955192   -6.15608562227333    2.17150944961691      H 
    3.70072375486252   -8.88906543719666    0.69263508650971      H 
$end
           -------------------------------------------------
          |                Final Singlepoint                |
           -------------------------------------------------

          ...................................................
          :                      SETUP                      :
          :.................................................:
          :  # basis functions                  62          :
          :  # atomic orbitals                  61          :
          :  # shells                           33          :
          :  # electrons                        60          :
          :  max. iterations                   250          :
          :  Hamiltonian                  GFN2-xTB          :
          :  restarted?                      false          :
          :  GBSA solvation                  false          :
          :  PC potential                    false          :
          :  electronic temp.          300.0000000     K    :
          :  accuracy                    1.0000000          :
          :  -> integral cutoff          0.2500000E+02      :
          :  -> integral neglect         0.1000000E-07      :
          :  -> SCF convergence          0.1000000E-05 Eh   :
          :  -> wf. convergence          0.1000000E-03 e    :
          :  Broyden damping             0.4000000          :
          ...................................................

 iter      E             dE          RMSdq      gap      omega  full diag
   1    -33.2739152 -0.332739E+02  0.869E-05    2.22       0.0  T
   2    -33.2739152 -0.280593E-10  0.466E-05    2.22     479.7  T
   3    -33.2739152 -0.477911E-10  0.298E-05    2.22     749.2  T

   *** convergence criteria satisfied after 3 iterations ***

         #    Occupation            Energy/Eh            Energy/eV
      -------------------------------------------------------------
         1        2.0000           -0.7337557             -19.9665
       ...           ...                  ...                  ...
        24        2.0000           -0.4486627             -12.2087
        25        2.0000           -0.4395717             -11.9614
        26        2.0000           -0.4332836             -11.7902
        27        2.0000           -0.4211598             -11.4603
        28        2.0000           -0.4070393             -11.0761
        29        2.0000           -0.3896137             -10.6019
        30        2.0000           -0.3581927              -9.7469 (HOMO)
        31                         -0.2766844              -7.5290 (LUMO)
        32                         -0.2274655              -6.1897
        33                         -0.1981518              -5.3920
        34                         -0.1957374              -5.3263
        35                         -0.1757663              -4.7828
       ...                                ...                  ...
        61                          0.7408806              20.1604
      -------------------------------------------------------------
                  HL-Gap            0.0815082 Eh            2.2180 eV
             Fermi-level           -0.3174385 Eh           -8.6379 eV

 SCC (total)                   0 d,  0 h,  0 min,  0.023 sec
 SCC setup                      ...        0 min,  0.000 sec (  0.737%)
 Dispersion                     ...        0 min,  0.000 sec (  0.659%)
 integral evaluation            ...        0 min,  0.007 sec ( 32.370%)
 zeroth order Hamiltonian       ...        0 min,  0.000 sec (  0.579%)
 iterations                     ...        0 min,  0.004 sec ( 15.610%)
 molecular gradient             ...        0 min,  0.011 sec ( 48.471%)
 printout                       ...        0 min,  0.000 sec (  1.353%)

         :::::::::::::::::::::::::::::::::::::::::::::::::::::
         ::                     SUMMARY                     ::
         :::::::::::::::::::::::::::::::::::::::::::::::::::::
         :: total energy             -32.757109815497 Eh    ::
         :: gradient norm              0.000727196575 Eh/a0 ::
         :: HOMO-LUMO gap              2.217952264429 eV    ::
         ::.................................................::
         :: SCC energy               -33.273915200074 Eh    ::
         :: -> isotropic ES            0.021450206713 Eh    ::
         :: -> anisotropic ES          0.002653844363 Eh    ::
         :: -> anisotropic XC          0.013591746205 Eh    ::
         :: -> dispersion             -0.021326247779 Eh    ::
         :: repulsion energy           0.516714153081 Eh    ::
         :: add. restraining           0.000000000000 Eh    ::
         :::::::::::::::::::::::::::::::::::::::::::::::::::::

           -------------------------------------------------
          |                Property Printout                |
           -------------------------------------------------

    * Orbital Energies and Occupations

         #    Occupation            Energy/Eh            Energy/eV
      -------------------------------------------------------------
         1        2.0000           -0.7337557             -19.9665
       ...           ...                  ...                  ...
        18        2.0000           -0.4917564             -13.3814
        19        2.0000           -0.4843476             -13.1798
        20        2.0000           -0.4815199             -13.1028
        21        2.0000           -0.4724998             -12.8574
        22        2.0000           -0.4569500             -12.4342
        23        2.0000           -0.4554994             -12.3948
        24        2.0000           -0.4486627             -12.2087
        25        2.0000           -0.4395717             -11.9614
        26        2.0000           -0.4332836             -11.7902
        27        2.0000           -0.4211598             -11.4603
        28        2.0000           -0.4070393             -11.0761
        29        2.0000           -0.3896137             -10.6019
        30        2.0000           -0.3581927              -9.7469 (HOMO)
        31                         -0.2766844              -7.5290 (LUMO)
        32                         -0.2274655              -6.1897
        33                         -0.1981518              -5.3920
        34                         -0.1957374              -5.3263
        35                         -0.1757663              -4.7828
        36                         -0.1149744              -3.1286
        37                         -0.0817574              -2.2247
        38                          0.0002530               0.0069
        39                          0.0282934               0.7699
        40                          0.0390877               1.0636
        41                          0.0741086               2.0166
       ...                                ...                  ...
        61                          0.7408806              20.1604
      -------------------------------------------------------------
                  HL-Gap            0.0815082 Eh            2.2180 eV
             Fermi-level           -0.3174385 Eh           -8.6379 eV

     #   Z        covCN         q      C6AA      α(0)
     1   6 C      2.932    -0.039    28.966     8.826
     2  16 S      2.303     0.001   141.036    19.988
     3   6 C      2.929    -0.035    28.861     8.810
     4   6 C      3.184    -0.006    27.703     8.590
     5   6 C      3.176    -0.005    27.742     8.601
     6   6 C      2.960    -0.039    28.969     8.828
     7   6 C      2.845     0.142    24.900     8.178
     8   6 C      2.915    -0.048    29.204     8.862
     9   6 C      2.907    -0.036    28.894     8.814
    10   8 O      1.660    -0.393    20.711     6.144
    11   6 C      2.893    -0.028    28.704     8.784
    12   6 C      2.837    -0.102    30.555     9.059
    13   1 H      0.927     0.041     2.438     2.441
    14   1 H      0.926     0.043     2.409     2.427
    15   1 H      0.926     0.053     2.284     2.363
    16   1 H      0.926     0.037     2.488     2.467
    17   1 H      0.805     0.305     0.707     1.321
    18   1 H      0.925     0.035     2.511     2.478
    19   1 H      0.926     0.040     2.451     2.448
    20   1 H      0.926     0.034     2.526     2.485

 Mol. C6AA /au·bohr⁶  :       6630.519201
 Mol. C8AA /au·bohr⁸  :     185572.310343
 Mol. α(0) /au        :        131.914457


Wiberg/Mayer (AO) data.
largest (>0.10) Wiberg bond orders for each atom
          total WBO             WBO to atom ...
     1  C   3.936        C    5 1.485    S    2 1.223    H   13 0.970    C    3 0.152
     2  S   2.716        C    3 1.243    C    1 1.223
     3  C   3.938        C    4 1.471    S    2 1.243    H   14 0.971    C    1 0.152
     4  C   3.987        C    3 1.471    C    9 1.208    C    5 1.155
     5  C   3.987        C    1 1.485    C    6 1.173    C    4 1.155
     6  C   3.982        C    7 1.458    C    5 1.173    C   11 1.078
     7  C   3.939        C    6 1.458    C    8 1.213    O   10 1.084
     8  C   3.989        C    9 1.626    C    7 1.213    H   15 0.966
     9  C   3.992        C    8 1.626    C    4 1.208    H   16 0.968
    10  O   2.125        C    7 1.084    H   17 0.868
    11  C   3.991        C   12 1.902    C    6 1.078    H   18 0.959
    12  C   3.985        C   11 1.902    H   20 0.978    H   19 0.971
    13  H   0.998        C    1 0.970
    14  H   0.998        C    3 0.971
    15  H   0.996        C    8 0.966
    16  H   0.998        C    9 0.968
    17  H   0.907        O   10 0.868
    18  H   0.999        C   11 0.959
    19  H   0.998        C   12 0.971
    20  H   0.998        C   12 0.978

molecular dipole:
                 x           y           z       tot (Debye)
 q only:       -0.150      -0.191      -0.062
   full:       -0.016      -0.375      -0.083       0.978
molecular quadrupole (traceless):
                xx          xy          yy          xz          yz          zz
 q only:       -3.018      -2.701       4.868      -0.162       0.955      -1.850
  q+dip:       -6.226      -3.723      10.930       0.987       1.292      -4.704
   full:       -7.469      -3.950       9.613       0.546       1.298      -2.144

           -------------------------------------------------
          |                Geometry Summary                 |
           -------------------------------------------------

      molecular mass/u    :      176.2326000
   center of mass at/Å    :        0.3057591      -0.5985357       0.0647600
  moments of inertia/u·Å² :        0.3269844E+03   0.7756550E+03   0.1090900E+04
rotational constants/cm⁻¹ :        0.5155484E-01   0.2173341E-01   0.1545296E-01

 * 20 selected distances

     #   Z        #   Z                                     value/Å
     1   6 C      2  16 S                                 1.7107534 (max)
     2  16 S      3   6 C                                 1.7057733
     3   6 C      4   6 C                                 1.3749143
     1   6 C      5   6 C                                 1.3744205
     4   6 C      5   6 C                                 1.4395500
     5   6 C      6   6 C                                 1.4291744
     6   6 C      7   6 C                                 1.3786801
     7   6 C      8   6 C                                 1.4225742
     4   6 C      9   6 C                                 1.4165432
     8   6 C      9   6 C                                 1.3560758
     7   6 C     10   8 O                                 1.3575677
    11   6 C     12   6 C                                 1.3289881
     1   6 C     13   1 H                                 1.0709504
     3   6 C     14   1 H                                 1.0714017
     8   6 C     15   1 H                                 1.0785884
     9   6 C     16   1 H                                 1.0790471
    10   8 O     17   1 H                                 0.9674540 (min)
    11   6 C     18   1 H                                 1.0832353
    12   6 C     19   1 H                                 1.0785475
    12   6 C     20   1 H                                 1.0769392

 * 5 distinct bonds (by element types)

   Z      Z             #   av. dist./Å        max./Å        min./Å
   1 H    6 C           7     1.0769585     1.0832353     1.0709504
   6 C    6 C           9     1.3912134     1.4395500     1.3289881
   1 H    8 O           1     0.9674540     0.9674540     0.9674540
   6 C    8 O           1     1.3575677     1.3575677     1.3575677
   6 C   16 S           2     1.7082634     1.7107534     1.7057733


optimized geometry written to: xtbopt.xyz


           -------------------------------------------------
          | TOTAL ENERGY              -32.757109815497 Eh   |
          | GRADIENT NORM               0.000727196575 Eh/α |
          | HOMO-LUMO GAP               2.217952264429 eV   |
           -------------------------------------------------

------------------------------------------------------------------------
 * finished run on 2021/05/19 at 10:59:38.742     
------------------------------------------------------------------------
 total:
 * wall-time:     0 d,  0 h,  0 min,  0.407 sec
 *  cpu-time:     0 d,  0 h,  0 min,  0.406 sec
 * ratio c/w:     0.998 speedup
 SCF:
 * wall-time:     0 d,  0 h,  0 min,  0.033 sec
 *  cpu-time:     0 d,  0 h,  0 min,  0.033 sec
 * ratio c/w:     1.000 speedup
 ANC optimizer:
 * wall-time:     0 d,  0 h,  0 min,  0.354 sec
 *  cpu-time:     0 d,  0 h,  0 min,  0.354 sec
 * ratio c/w:     1.000 speedup

