      -----------------------------------------------------------      
     |                   =====================                   |     
     |                           x T B                           |     
     |                   =====================                   |     
     |                         S. Grimme                         |     
     |          Mulliken Center for Theoretical Chemistry        |     
     |                    University of Bonn                     |     
     |                Version 6.2 RC2 (SAW190805)                |     
      -----------------------------------------------------------      

   This program is distributed in the hope that it will be useful,
   but WITHOUT ANY WARRANTY; without even the implied warranty of
   MERCHANTABILITY or FITNESS FOR A PARTICULAR PURPOSE.
   
   FOR NON-COMMERCIAL, ACADEMIA USE ONLY.
   
   Cite this work as:
   * S. Grimme, C. Bannwarth, P. Shushkov, J. Chem. Theory Comput., 2017,
     13, 1989-2009. DOI: 10.1021/acs.jctc.7b00118
   * C. Bannwarth, S. Ehlert and S. Grimme., J. Chem. Theory Comput., 2019,
     15, 1652-1671. DOI: 10.1021/acs.jctc.8b01176
   * P. Pracht, E. Caldeweyher, S. Ehlert, S. Grimme, ChemRxiv, 2019, preprint.
     DOI: 10.26434/chemrxiv.8326202.v1
   
   for DFT-D4:
   * E. Caldeweyher, C. Bannwarth and S. Grimme, J. Chem. Phys., 2017,
     147, 034112. DOI: 10.1063/1.4993215
   * E. Caldeweyher, S. Ehlert, A. Hansen, H. Neugebauer, S. Spicher,
     C. Bannwarth and S. Grimme, J. Chem. Phys., 2019, 150, 154122.
     DOI: 10.1063/1.5090222
   
   for sTDA-xTB:
   * S. Grimme and C. Bannwarth, J. Chem. Phys., 2016, 145, 054103.
     DOI: 10.1063/1.4959605
   
   in the mass-spec context:
   * V. Asgeirsson, C. Bauer and S. Grimme, Chem. Sci., 2017, 8, 4879.
     DOI: 10.1039/c7sc00601b
   
   for metadynamics refer to:
   * S. Grimme, J. Chem. Theory Comput., 2019, 155, 2847-2862
     DOI: 10.1021/acs.jctc.9b00143
   
   with help from (in alphabetical order)
   C. Bannwarth, F. Bohle, G. Brandenburg, E. Caldeweyher, M. Checinski,
   S. Dohm, S. Ehlert, S. Ehrlich, F. März, H. Neugebauer, J. Pisarek,
   P. Pracht, P. Shushkov, and S. Spicher.
   
 * started run on 2021/05/19 at 10:59:43.030     

           -------------------------------------------------
          |                Calculation Setup                |
           -------------------------------------------------

          program call               : /ihome/ghutchison/geoffh/xtb/xtb 294.xyz -opt
          hostname                   : smp-n83
          coordinate file            : 294.xyz
          omp threads                :                     1
          number of atoms            :                    21
          number of electrons        :                    56
          charge                     :                     0
          spin                       :                   0.0
          first test random number   :      0.57828861295922


########################################################################
# WARNING! Please study the warnings concerning your input carefully
#  - the use of '-opt' is discouraged, please use '--opt' next time
########################################################################

           ------------------------------------------------- 
          |                 G F N 2 - x T B                 |
          | Geometry, Frequencies, Noncovalent interactions |
          |            JCTC 2019 parametrisation            |
           ------------------------------------------------- 
             KAB for C  - Si     :                1.0500
             KAB for H  - Pd     :                0.9500
             k(s)              :                1.8500
             k(p)              :                2.2300
             k(d)              :                2.2300
             k(f)              :                2.0000
             kEN (H0ij)        :               -2.0000
             D4 a1             :                0.5200
             D4 a2             :                5.0000
             D4 s6             :                1.0000
             D4 s8             :                2.7000
             D4 s9             :                5.0000
             alphaj            :                2.0000

  Z AO/shell   Hii/eV     exponent
  1     Wed Apr 25 08:07:45 CEST 2018   EN: 2.200 GM2: 0.406  GM3: 0.0800  RAES: 1.40
     1s    -10.707211    1.230000
  6     Wed Apr 25 08:07:45 CEST 2018   EN: 2.550 GM2: 0.538  GM3: 0.1500  RAES: 3.00
     2s    -13.970922    2.096432
     2p    -10.063292    1.800000
  7     Wed Apr 25 08:07:45 CEST 2018   EN: 3.040 GM2: 0.461  GM3:-0.0640  RAES: 1.90
     2s    -16.686243    2.339881
     2p    -12.523956    2.014332

           ------------------------------------------------- 
          |        Self-Consistent Charge Iterations        |
           ------------------------------------------------- 

          ...................................................
          :                      SETUP                      :
          :.................................................:
          :  # basis functions                  54          :
          :  # atomic orbitals                  54          :
          :  # shells                           32          :
          :  # electrons                        56          :
          :  max. iterations                   250          :
          :  Hamiltonian                  GFN2-xTB          :
          :  restarted?                      false          :
          :  GBSA solvation                  false          :
          :  PC potential                    false          :
          :  electronic temp.          300.0000000     K    :
          :  accuracy                    1.0000000          :
          :  -> integral cutoff          0.2500000E+02      :
          :  -> integral neglect         0.1000000E-07      :
          :  -> SCF convergence          0.1000000E-05 Eh   :
          :  -> wf. convergence          0.1000000E-03 e    :
          :  Broyden damping             0.4000000          :
          ...................................................

 iter      E             dE          RMSdq      gap      omega  full diag
   1    -30.5701393 -0.305701E+02  0.447E+00    2.61       0.0  T
   2    -30.6004634 -0.303241E-01  0.304E+00    3.00       1.0  T
   3    -30.5863972  0.140661E-01  0.153E+00    2.75       1.0  T
   4    -30.6094953 -0.230981E-01  0.518E-01    2.94       1.0  T
   5    -30.6122140 -0.271862E-02  0.137E-01    2.87       1.0  T
   6    -30.6123972 -0.183273E-03  0.569E-02    2.88       1.0  T
   7    -30.6124198 -0.225664E-04  0.247E-02    2.88       1.0  T
   8    -30.6124207 -0.873555E-06  0.571E-03    2.88       3.8  T
   9    -30.6124210 -0.363148E-06  0.258E-03    2.88       8.4  T
  10    -30.6124211 -0.373829E-07  0.128E-03    2.88      17.0  T
  11    -30.6124211 -0.570541E-08  0.544E-04    2.88      40.1  T
  12    -30.6124211 -0.423763E-08  0.198E-04    2.88     110.2  T

   *** convergence criteria satisfied after 12 iterations ***

         #    Occupation            Energy/Eh            Energy/eV
      -------------------------------------------------------------
         1        2.0000           -0.6725337             -18.3006
       ...           ...                  ...                  ...
        22        2.0000           -0.4351237             -11.8403
        23        2.0000           -0.4218731             -11.4798
        24        2.0000           -0.4186732             -11.3927
        25        2.0000           -0.4052203             -11.0266
        26        2.0000           -0.3973155             -10.8115
        27        2.0000           -0.3922484             -10.6736
        28        2.0000           -0.3567438              -9.7075 (HOMO)
        29                         -0.2509243              -6.8280 (LUMO)
        30                         -0.2293202              -6.2401
        31                         -0.2226629              -6.0590
        32                         -0.1695128              -4.6127
        33                         -0.0819842              -2.2309
       ...                                ...                  ...
        54                          0.6454786              17.5644
      -------------------------------------------------------------
                  HL-Gap            0.1058195 Eh            2.8795 eV
             Fermi-level           -0.3038341 Eh           -8.2677 eV

 SCC (total)                   0 d,  0 h,  0 min,  0.026 sec
 SCC setup                      ...        0 min,  0.000 sec (  1.029%)
 Dispersion                     ...        0 min,  0.000 sec (  1.095%)
 integral evaluation            ...        0 min,  0.006 sec ( 21.980%)
 zeroth order Hamiltonian       ...        0 min,  0.000 sec (  0.431%)
 iterations                     ...        0 min,  0.010 sec ( 40.451%)
 molecular gradient             ...        0 min,  0.009 sec ( 33.468%)
 printout                       ...        0 min,  0.000 sec (  1.343%)

         :::::::::::::::::::::::::::::::::::::::::::::::::::::
         ::                     SUMMARY                     ::
         :::::::::::::::::::::::::::::::::::::::::::::::::::::
         :: total energy             -30.125867126078 Eh    ::
         :: gradient norm              0.072983157458 Eh/a0 ::
         :: HOMO-LUMO gap              2.879495079910 eV    ::
         ::.................................................::
         :: SCC energy               -30.612421089941 Eh    ::
         :: -> isotropic ES            0.007160315787 Eh    ::
         :: -> anisotropic ES          0.005375048541 Eh    ::
         :: -> anisotropic XC          0.028707272813 Eh    ::
         :: -> dispersion             -0.017384036168 Eh    ::
         :: repulsion energy           0.486646216557 Eh    ::
         :: add. restraining           0.000000000000 Eh    ::
         :::::::::::::::::::::::::::::::::::::::::::::::::::::

      ----------------------------------------------------------- 
     |                   =====================                   |
     |                        A N C O P T                        |
     |                   =====================                   |
     |               Approximate Normal Coordinate               |
     |                Rational Function Optimizer                |
      ----------------------------------------------------------- 

          ...................................................
          :                      SETUP                      :
          :.................................................:
          :   optimization level            normal          :
          :   max. optcycles                   200          :
          :   ANC micro-cycles                  20          :
          :   degrees of freedom                57          :
          :.................................................:
          :   RF solver                   davidson          :
          :   input Hessian                  false          :
          :   write xtbopt.log                true          :
          :   linear?                        false          :
          :   energy convergence         0.5000000E-05 Eh   :
          :   grad. convergence          0.1000000E-02 Eh/α :
          :   maximium RF displ.         2.0000000          :
          :   Hlow (freq-cutoff)         0.5000000E-02      :
          :   Hmax (freq-cutoff)         5.0000000          :
          :   S6 in model hess.         20.0000000          :
          ...................................................

generating ANC from model Hessian ...
Using Lindh-Hessian (1995)
 Shifting diagonal of input Hessian by   4.156045783265569E-003
 Lowest  eigenvalues of input Hessian
   -0.000000   -0.000000   -0.000000    0.000000    0.000000    0.000000
    0.005000    0.007427    0.008549    0.008784    0.009570    0.013184
    0.016267    0.018501    0.022134    0.024243    0.028151    0.030580
 Highest eigenvalues
    1.691595    1.838391    1.880527    1.965143    1.985891    2.079949
 

........................................................................
.............................. CYCLE    1 ..............................
........................................................................
   1    -30.6124211 -0.306124E+02  0.859E-05    2.88       0.0  T
   2    -30.6124211 -0.387566E-10  0.553E-05    2.88     394.6  T
   3    -30.6124211 -0.266311E-10  0.354E-05    2.88     616.2  T
     SCC iter.                  ...        0 min,  0.003 sec
     gradient                   ...        0 min,  0.009 sec
 * total energy  :   -30.1258671 Eh     change       -0.4914682E-08 Eh
   gradient norm :     0.0729830 Eh/α   predicted     0.0000000E+00 (-100.00%)
   displ. norm   :     0.3255464 α      lambda       -0.9739572E-02
   maximum displ.:     0.1569185 α      in ANC's #7, #3, #5, ...

........................................................................
.............................. CYCLE    2 ..............................
........................................................................
   1    -30.6500398 -0.306500E+02  0.329E-01    2.97       0.0  T
   2    -30.6501251 -0.853242E-04  0.181E-01    3.00       1.0  T
   3    -30.6500037  0.121435E-03  0.122E-01    2.97       1.0  T
   4    -30.6502134 -0.209709E-03  0.159E-02    2.99       1.4  T
   5    -30.6502145 -0.107408E-05  0.841E-03    2.99       2.6  T
   6    -30.6502148 -0.334359E-06  0.245E-03    2.99       8.9  T
   7    -30.6502149 -0.251046E-07  0.607E-04    2.99      36.0  T
     SCC iter.                  ...        0 min,  0.006 sec
     gradient                   ...        0 min,  0.008 sec
 * total energy  :   -30.1328736 Eh     change       -0.7006442E-02 Eh
   gradient norm :     0.0333006 Eh/α   predicted    -0.5385897E-02 ( -23.13%)
   displ. norm   :     0.3674959 α      lambda       -0.6046598E-02
   maximum displ.:     0.1705958 α      in ANC's #10, #7, #3, ...

........................................................................
.............................. CYCLE    3 ..............................
........................................................................
   1    -30.6723299 -0.306723E+02  0.490E-01    2.98       0.0  T
   2    -30.6725776 -0.247728E-03  0.273E-01    3.02       1.0  T
   3    -30.6724474  0.130206E-03  0.187E-01    3.00       1.0  T
   4    -30.6728489 -0.401492E-03  0.194E-02    3.01       1.1  T
   5    -30.6728503 -0.140855E-05  0.913E-03    3.01       2.4  T
   6    -30.6728508 -0.463098E-06  0.464E-03    3.01       4.7  T
   7    -30.6728508 -0.787560E-07  0.737E-04    3.01      29.6  T
     SCC iter.                  ...        0 min,  0.006 sec
     gradient                   ...        0 min,  0.008 sec
 * total energy  :   -30.1360439 Eh     change       -0.3170340E-02 Eh
   gradient norm :     0.0283080 Eh/α   predicted    -0.3431638E-02 (   8.24%)
   displ. norm   :     0.3509400 α      lambda       -0.2542962E-02
   maximum displ.:     0.2208111 α      in ANC's #3, #5, #7, ...

........................................................................
.............................. CYCLE    4 ..............................
........................................................................
   1    -30.6683271 -0.306683E+02  0.331E-01    2.97       0.0  T
   2    -30.6684218 -0.947539E-04  0.187E-01    2.99       1.0  T
   3    -30.6683325  0.893042E-04  0.120E-01    2.98       1.0  T
   4    -30.6685151 -0.182518E-03  0.146E-02    2.99       1.5  T
   5    -30.6685158 -0.701217E-06  0.713E-03    2.99       3.1  T
   6    -30.6685159 -0.155789E-06  0.317E-03    2.99       6.9  T
   7    -30.6685160 -0.587474E-07  0.501E-04    2.99      43.6  T
     SCC iter.                  ...        0 min,  0.006 sec
     gradient                   ...        0 min,  0.008 sec
 * total energy  :   -30.1370172 Eh     change       -0.9732613E-03 Eh
   gradient norm :     0.0287182 Eh/α   predicted    -0.1428078E-02 (  46.73%)
   displ. norm   :     0.1456139 α      lambda       -0.1345942E-02
   maximum displ.:     0.0797046 α      in ANC's #3, #5, #4, ...

........................................................................
.............................. CYCLE    5 ..............................
........................................................................
   1    -30.6675067 -0.306675E+02  0.119E-01    2.98       0.0  T
   2    -30.6675217 -0.149286E-04  0.679E-02    2.98       1.0  T
   3    -30.6675135  0.816501E-05  0.476E-02    2.98       1.0  T
   4    -30.6675336 -0.201280E-04  0.640E-03    2.98       3.4  T
   5    -30.6675337 -0.695172E-07  0.376E-03    2.98       5.8  T
   6    -30.6675339 -0.162115E-06  0.133E-03    2.98      16.4  T
     SCC iter.                  ...        0 min,  0.005 sec
     gradient                   ...        0 min,  0.008 sec
 * total energy  :   -30.1378064 Eh     change       -0.7891971E-03 Eh
   gradient norm :     0.0091707 Eh/α   predicted    -0.6872435E-03 ( -12.92%)
   displ. norm   :     0.1680312 α      lambda       -0.4848285E-03
   maximum displ.:     0.1109324 α      in ANC's #3, #10, #1, ...

........................................................................
.............................. CYCLE    6 ..............................
........................................................................
   1    -30.6662411 -0.306662E+02  0.127E-01    2.99       0.0  T
   2    -30.6662470 -0.588781E-05  0.722E-02    2.99       1.0  T
   3    -30.6662330  0.139620E-04  0.371E-02    2.98       1.0  T
   4    -30.6662519 -0.188254E-04  0.323E-03    2.99       6.8  T
   5    -30.6662519 -0.134962E-07  0.194E-03    2.99      11.2  T
   6    -30.6662519 -0.376455E-07  0.593E-04    2.99      36.8  T
     SCC iter.                  ...        0 min,  0.005 sec
     gradient                   ...        0 min,  0.008 sec
 * total energy  :   -30.1380771 Eh     change       -0.2707520E-03 Eh
   gradient norm :     0.0106409 Eh/α   predicted    -0.2492617E-03 (  -7.94%)
   displ. norm   :     0.1630236 α      lambda       -0.2940965E-03
   maximum displ.:     0.1268815 α      in ANC's #3, #1, #2, ...

........................................................................
.............................. CYCLE    7 ..............................
........................................................................
   1    -30.6664681 -0.306665E+02  0.138E-01    2.98       0.0  T
   2    -30.6664753 -0.727930E-05  0.773E-02    2.98       1.0  T
   3    -30.6664710  0.431081E-05  0.194E-02    2.98       1.1  T
   4    -30.6664780 -0.700582E-05  0.524E-03    2.98       4.2  T
   5    -30.6664782 -0.119559E-06  0.227E-03    2.98       9.6  T
   6    -30.6664782 -0.275029E-07  0.917E-04    2.98      23.8  T
     SCC iter.                  ...        0 min,  0.005 sec
     gradient                   ...        0 min,  0.008 sec
 * total energy  :   -30.1382459 Eh     change       -0.1687755E-03 Eh
   gradient norm :     0.0066653 Eh/α   predicted    -0.1509587E-03 ( -10.56%)
   displ. norm   :     0.0769660 α      lambda       -0.9975886E-04
   maximum displ.:     0.0479905 α      in ANC's #3, #5, #9, ...

........................................................................
.............................. CYCLE    8 ..............................
........................................................................
   1    -30.6686725 -0.306687E+02  0.574E-02    2.98       0.0  T
   2    -30.6686753 -0.276943E-05  0.331E-02    2.98       1.0  T
   3    -30.6686730  0.229908E-05  0.222E-02    2.98       1.0  T
   4    -30.6686780 -0.499569E-05  0.221E-03    2.98       9.9  T
   5    -30.6686780 -0.188816E-07  0.104E-03    2.98      21.0  T
   6    -30.6686780 -0.501038E-08  0.538E-04    2.98      40.6  T
     SCC iter.                  ...        0 min,  0.005 sec
     gradient                   ...        0 min,  0.008 sec
 * total energy  :   -30.1383096 Eh     change       -0.6374993E-04 Eh
   gradient norm :     0.0032561 Eh/α   predicted    -0.5017785E-04 ( -21.29%)
   displ. norm   :     0.0927258 α      lambda       -0.5899566E-04
   maximum displ.:     0.0713004 α      in ANC's #3, #5, #2, ...

........................................................................
.............................. CYCLE    9 ..............................
........................................................................
   1    -30.6691304 -0.306691E+02  0.555E-02    2.98       0.0  T
   2    -30.6691312 -0.818779E-06  0.322E-02    2.98       1.0  T
   3    -30.6691279  0.333993E-05  0.194E-02    2.98       1.1  T
   4    -30.6691324 -0.445850E-05  0.117E-03    2.98      18.6  T
   5    -30.6691324 -0.131758E-07  0.661E-04    2.98      33.0  T
   6    -30.6691324 -0.413889E-08  0.252E-04    2.98      86.5  T
     SCC iter.                  ...        0 min,  0.005 sec
     gradient                   ...        0 min,  0.009 sec
 * total energy  :   -30.1383445 Eh     change       -0.3483926E-04 Eh
   gradient norm :     0.0025350 Eh/α   predicted    -0.2975292E-04 ( -14.60%)
   displ. norm   :     0.1205823 α      lambda       -0.5821534E-04
   maximum displ.:     0.0728705 α      in ANC's #3, #5, #4, ...

........................................................................
.............................. CYCLE   10 ..............................
........................................................................
   1    -30.6698392 -0.306698E+02  0.741E-02    2.97       0.0  T
   2    -30.6698404 -0.116896E-05  0.430E-02    2.97       1.0  T
   3    -30.6698377  0.269065E-05  0.156E-02    2.97       1.4  T
   4    -30.6698411 -0.341912E-05  0.209E-03    2.97      10.4  T
   5    -30.6698411 -0.349611E-08  0.114E-03    2.97      19.1  T
   6    -30.6698411 -0.189402E-07  0.202E-04    2.97     108.0  T
   7    -30.6698411 -0.608065E-09  0.884E-05    2.97     246.9  T
     SCC iter.                  ...        0 min,  0.006 sec
     gradient                   ...        0 min,  0.009 sec
 * total energy  :   -30.1383839 Eh     change       -0.3944974E-04 Eh
   gradient norm :     0.0030673 Eh/α   predicted    -0.2953436E-04 ( -25.13%)
   displ. norm   :     0.1436527 α      lambda       -0.5991068E-04
   maximum displ.:     0.0896728 α      in ANC's #3, #4, #5, ...

........................................................................
.............................. CYCLE   11 ..............................
........................................................................
   1    -30.6695391 -0.306695E+02  0.949E-02    2.96       0.0  T
   2    -30.6695411 -0.199505E-05  0.543E-02    2.96       1.0  T
   3    -30.6695407  0.430033E-06  0.951E-03    2.96       2.3  T
   4    -30.6695419 -0.119177E-05  0.279E-03    2.96       7.8  T
   5    -30.6695419 -0.112323E-08  0.112E-03    2.96      19.4  T
   6    -30.6695419 -0.194534E-07  0.275E-04    2.96      79.3  T
   7    -30.6695419 -0.138312E-08  0.743E-05    2.96     293.7  T
     SCC iter.                  ...        0 min,  0.006 sec
     gradient                   ...        0 min,  0.009 sec
 * total energy  :   -30.1384266 Eh     change       -0.4267130E-04 Eh
   gradient norm :     0.0037099 Eh/α   predicted    -0.3057564E-04 ( -28.35%)
   displ. norm   :     0.1528725 α      lambda       -0.5122323E-04
   maximum displ.:     0.0946365 α      in ANC's #3, #4, #5, ...

........................................................................
.............................. CYCLE   12 ..............................
........................................................................
   1    -30.6683944 -0.306684E+02  0.992E-02    2.95       0.0  T
   2    -30.6683971 -0.269382E-05  0.567E-02    2.95       1.0  T
   3    -30.6683938  0.336916E-05  0.169E-02    2.95       1.3  T
   4    -30.6683984 -0.465963E-05  0.320E-03    2.95       6.8  T
   5    -30.6683984 -0.162589E-07  0.122E-03    2.95      17.8  T
   6    -30.6683985 -0.832751E-08  0.426E-04    2.95      51.2  T
   7    -30.6683985 -0.298519E-08  0.648E-05    2.95     336.6  T
     SCC iter.                  ...        0 min,  0.006 sec
     gradient                   ...        0 min,  0.009 sec
 * total energy  :   -30.1384570 Eh     change       -0.3040766E-04 Eh
   gradient norm :     0.0029680 Eh/α   predicted    -0.2621518E-04 ( -13.79%)
   displ. norm   :     0.0883152 α      lambda       -0.2652664E-04
   maximum displ.:     0.0598083 α      in ANC's #4, #3, #1, ...

........................................................................
.............................. CYCLE   13 ..............................
........................................................................
   1    -30.6685863 -0.306686E+02  0.590E-02    2.95       0.0  T
   2    -30.6685872 -0.902569E-06  0.336E-02    2.95       1.0  T
   3    -30.6685861  0.111344E-05  0.102E-02    2.95       2.1  T
   4    -30.6685877 -0.156553E-05  0.191E-03    2.95      11.4  T
   5    -30.6685877 -0.164764E-08  0.879E-04    2.95      24.8  T
   6    -30.6685877 -0.955083E-08  0.174E-04    2.95     125.6  T
     SCC iter.                  ...        0 min,  0.005 sec
     gradient                   ...        0 min,  0.009 sec
 * total energy  :   -30.1384683 Eh     change       -0.1132615E-04 Eh
   gradient norm :     0.0026109 Eh/α   predicted    -0.1336867E-04 (  18.03%)
   displ. norm   :     0.0594180 α      lambda       -0.2123372E-04
   maximum displ.:     0.0343084 α      in ANC's #3, #4, #2, ...

........................................................................
.............................. CYCLE   14 ..............................
........................................................................
   1    -30.6687962 -0.306688E+02  0.396E-02    2.95       0.0  T
   2    -30.6687965 -0.270863E-06  0.231E-02    2.95       1.0  T
   3    -30.6687962  0.249905E-06  0.450E-03    2.95       4.9  T
   4    -30.6687966 -0.352183E-06  0.114E-03    2.95      19.1  T
   5    -30.6687966 -0.445133E-08  0.573E-04    2.95      38.1  T
   6    -30.6687966 -0.240049E-08  0.197E-04    2.95     110.8  T
     SCC iter.                  ...        0 min,  0.005 sec
     gradient                   ...        0 min,  0.009 sec
 * total energy  :   -30.1384808 Eh     change       -0.1246453E-04 Eh
   gradient norm :     0.0018794 Eh/α   predicted    -0.1065513E-04 ( -14.52%)
   displ. norm   :     0.1147243 α      lambda       -0.1668900E-04
   maximum displ.:     0.0740961 α      in ANC's #3, #2, #4, ...

........................................................................
.............................. CYCLE   15 ..............................
........................................................................
   1    -30.6681889 -0.306682E+02  0.666E-02    2.95       0.0  T
   2    -30.6681893 -0.396737E-06  0.389E-02    2.94       1.0  T
   3    -30.6681886  0.709043E-06  0.734E-03    2.94       3.0  T
   4    -30.6681895 -0.900765E-06  0.120E-03    2.94      18.1  T
   5    -30.6681895 -0.565302E-08  0.593E-04    2.94      36.8  T
   6    -30.6681895 -0.170484E-08  0.256E-04    2.94      85.4  T
     SCC iter.                  ...        0 min,  0.005 sec
     gradient                   ...        0 min,  0.009 sec
 * total energy  :   -30.1384852 Eh     change       -0.4412583E-05 Eh
   gradient norm :     0.0028996 Eh/α   predicted    -0.8396965E-05 (  90.30%)
   displ. norm   :     0.0525083 α      lambda       -0.2569128E-04
   maximum displ.:     0.0341544 α      in ANC's #5, #1, #3, ...

........................................................................
.............................. CYCLE   16 ..............................
........................................................................
   1    -30.6695799 -0.306696E+02  0.334E-02    2.95       0.0  T
   2    -30.6695803 -0.467607E-06  0.186E-02    2.95       1.2  T
   3    -30.6695803  0.716216E-07  0.394E-03    2.95       5.5  T
   4    -30.6695805 -0.253025E-06  0.116E-03    2.95      18.8  T
   5    -30.6695805  0.163916E-08  0.629E-04    2.95      34.7  T
   6    -30.6695805 -0.479281E-08  0.127E-04    2.95     172.2  T
     SCC iter.                  ...        0 min,  0.005 sec
     gradient                   ...        0 min,  0.009 sec
 * total energy  :   -30.1384953 Eh     change       -0.1012109E-04 Eh
   gradient norm :     0.0021627 Eh/α   predicted    -0.1289146E-04 (  27.37%)
   displ. norm   :     0.0393148 α      lambda       -0.1310123E-04
   maximum displ.:     0.0218371 α      in ANC's #1, #3, #4, ...

........................................................................
.............................. CYCLE   17 ..............................
........................................................................
   1    -30.6692660 -0.306693E+02  0.262E-02    2.95       0.0  T
   2    -30.6692662 -0.133371E-06  0.152E-02    2.94       1.4  T
   3    -30.6692656  0.584974E-06  0.723E-03    2.95       3.0  T
   4    -30.6692663 -0.715195E-06  0.617E-04    2.94      35.4  T
   5    -30.6692663 -0.861771E-09  0.376E-04    2.94      58.0  T
     SCC iter.                  ...        0 min,  0.004 sec
     gradient                   ...        0 min,  0.009 sec
 * total energy  :   -30.1385039 Eh     change       -0.8543883E-05 Eh
   gradient norm :     0.0012874 Eh/α   predicted    -0.6563543E-05 ( -23.18%)
   displ. norm   :     0.0601450 α      lambda       -0.7597001E-05
   maximum displ.:     0.0398344 α      in ANC's #1, #3, #2, ...

........................................................................
.............................. CYCLE   18 ..............................
........................................................................
   1    -30.6690955 -0.306691E+02  0.321E-02    2.94       0.0  T
   2    -30.6690957 -0.196582E-06  0.185E-02    2.94       1.2  T
   3    -30.6690954  0.227653E-06  0.469E-03    2.94       4.7  T
   4    -30.6690958 -0.321849E-06  0.734E-04    2.94      29.7  T
   5    -30.6690958 -0.123653E-08  0.399E-04    2.94      54.7  T
     SCC iter.                  ...        0 min,  0.004 sec
     gradient                   ...        0 min,  0.009 sec
 * total energy  :   -30.1385108 Eh     change       -0.6895207E-05 Eh
   gradient norm :     0.0018459 Eh/α   predicted    -0.3809609E-05 ( -44.75%)
   displ. norm   :     0.0608664 α      lambda        0.4128989E-05
   maximum displ.:     0.0409126 α      in ANC's #1, #3, #2, ...

........................................................................
.............................. CYCLE   19 ..............................
........................................................................
   1    -30.6688493 -0.306688E+02  0.323E-02    2.94       0.0  T
   2    -30.6688495 -0.205684E-06  0.187E-02    2.94       1.2  T
   3    -30.6688493  0.242137E-06  0.483E-03    2.94       4.5  T
   4    -30.6688496 -0.341003E-06  0.755E-04    2.94      28.9  T
   5    -30.6688496 -0.129840E-08  0.410E-04    2.94      53.2  T
     SCC iter.                  ...        0 min,  0.004 sec
     gradient                   ...        0 min,  0.009 sec
 * total energy  :   -30.1385081 Eh     change        0.2669954E-05 Eh
   gradient norm :     0.0036017 Eh/α   predicted     0.2065302E-05 ( -22.65%)
   displ. norm   :     0.0371486 α      lambda       -0.1292477E-04
   maximum displ.:     0.0235793 α      in ANC's #3, #1, #2, ...

........................................................................
.............................. CYCLE   20 ..............................
........................................................................
   1    -30.6685699 -0.306686E+02  0.279E-02    2.94       0.0  T
   2    -30.6685701 -0.225868E-06  0.160E-02    2.94       1.4  T
   3    -30.6685697  0.365298E-06  0.544E-03    2.94       4.0  T
   4    -30.6685702 -0.480080E-06  0.958E-04    2.94      22.8  T
   5    -30.6685702 -0.134352E-08  0.396E-04    2.94      55.2  T
     SCC iter.                  ...        0 min,  0.004 sec
     gradient                   ...        0 min,  0.009 sec
 * total energy  :   -30.1385179 Eh     change       -0.9784528E-05 Eh
   gradient norm :     0.0023940 Eh/α   predicted    -0.6474460E-05 ( -33.83%)
   displ. norm   :     0.0637141 α      lambda       -0.2000478E-04
   maximum displ.:     0.0431539 α      in ANC's #1, #2, #3, ...
 * RMSD in coord.:     0.4022217 α      energy gain  -0.1265077E-01 Eh

generating ANC from model Hessian ...
Using Lindh-Hessian (1995)
 Shifting diagonal of input Hessian by   4.088286470958415E-003
 Lowest  eigenvalues of input Hessian
   -0.000000   -0.000000    0.000000    0.000000    0.000000    0.000000
    0.005000    0.008180    0.008365    0.009340    0.010336    0.014785
    0.017129    0.019966    0.023230    0.028768    0.030950    0.033963
 Highest eigenvalues
    1.807768    1.914168    1.976607    2.069236    2.112067    2.302661
 

........................................................................
.............................. CYCLE   21 ..............................
........................................................................
   1    -30.6691218 -0.306691E+02  0.522E-02    2.94       0.0  T
   2    -30.6691235 -0.176555E-05  0.281E-02    2.94       1.0  T
   3    -30.6691237 -0.194293E-06  0.591E-03    2.94       3.7  T
   4    -30.6691242 -0.446071E-06  0.197E-03    2.94      11.1  T
   5    -30.6691242 -0.198806E-08  0.604E-04    2.94      36.1  T
   6    -30.6691242 -0.504899E-08  0.111E-04    2.94     196.6  T
     SCC iter.                  ...        0 min,  0.005 sec
     gradient                   ...        0 min,  0.009 sec
 * total energy  :   -30.1385302 Eh     change       -0.1229888E-04 Eh
   gradient norm :     0.0010263 Eh/α   predicted     0.0000000E+00 (-100.00%)
   displ. norm   :     0.0328222 α      lambda       -0.5705273E-05
   maximum displ.:     0.0190949 α      in ANC's #1, #3, #5, ...

........................................................................
.............................. CYCLE   22 ..............................
........................................................................
   1    -30.6691704 -0.306692E+02  0.217E-02    2.94       0.0  T
   2    -30.6691707 -0.324805E-06  0.118E-02    2.94       1.8  T
   3    -30.6691706  0.582291E-07  0.368E-03    2.94       5.9  T
   4    -30.6691708 -0.190259E-06  0.843E-04    2.94      25.9  T
   5    -30.6691708  0.172264E-09  0.366E-04    2.94      59.6  T
     SCC iter.                  ...        0 min,  0.004 sec
     gradient                   ...        0 min,  0.009 sec
 * total energy  :   -30.1385355 Eh     change       -0.5347468E-05 Eh
   gradient norm :     0.0004727 Eh/α   predicted    -0.2854341E-05 ( -46.62%)
   displ. norm   :     0.0300682 α      lambda       -0.3328546E-05
   maximum displ.:     0.0162909 α      in ANC's #4, #3, #5, ...

........................................................................
.............................. CYCLE   23 ..............................
........................................................................
   1    -30.6691648 -0.306692E+02  0.226E-02    2.94       0.0  T
   2    -30.6691651 -0.310729E-06  0.123E-02    2.94       1.8  T
   3    -30.6691651 -0.516646E-08  0.292E-03    2.94       7.5  T
   4    -30.6691652 -0.114477E-06  0.846E-04    2.94      25.8  T
   5    -30.6691652 -0.186084E-09  0.275E-04    2.94      79.4  T
     SCC iter.                  ...        0 min,  0.004 sec
     gradient                   ...        0 min,  0.009 sec
 * total energy  :   -30.1385386 Eh     change       -0.3091770E-05 Eh
   gradient norm :     0.0005780 Eh/α   predicted    -0.1665572E-05 ( -46.13%)
   displ. norm   :     0.0447465 α      lambda       -0.3694008E-05
   maximum displ.:     0.0241659 α      in ANC's #1, #3, #4, ...

   *** GEOMETRY OPTIMIZATION CONVERGED AFTER 23 ITERATIONS ***

------------------------------------------------------------------------
 total energy gain   :        -0.0126715 Eh       -7.9515 kcal/mol
 total RMSD          :         0.4045412 a0        0.2141 Å
 total power (kW/mol):        -1.4464798 (step)  -71.5477 (real)
------------------------------------------------------------------------

 ANCopt (total)                0 d,  0 h,  0 min,  0.465 sec
 optimizer setup                ...        0 min,  0.000 sec (  0.031%)
 model hessian                  ...        0 min,  0.005 sec (  1.026%)
 ANC generation                 ...        0 min,  0.001 sec (  0.254%)
 coordinate transformation      ...        0 min,  0.000 sec (  0.073%)
 single point calculation       ...        0 min,  0.450 sec ( 96.730%)
 optimization log               ...        0 min,  0.002 sec (  0.441%)
 hessian update                 ...        0 min,  0.000 sec (  0.061%)
 rational function              ...        0 min,  0.005 sec (  1.069%)

================
 final structure:
================
$coord
    2.93680237706286   -1.46079583097676   -4.71147416840631      C 
    5.32363269702515   -1.36710149873891   -4.62797027646488      N 
    6.51987174330175   -1.41920768291992   -2.42752383241685      N 
    9.11752346724236   -1.29632288600753   -2.25669881331006      C 
   10.62181304926624   -1.15826308932869   -4.41623681168431      C 
   13.21078212935648   -1.03492657820878   -4.18677094590293      C 
   14.39480393967030   -1.03365265039781   -1.82483311037832      C 
   12.86274573093926   -1.18466326125341    0.31887001247310      C 
   10.27090795634948   -1.31543995781138    0.11405942076971      C 
   17.13775404082143   -0.88024629116443   -1.70318444278704      C 
   18.54378776695261   -0.61890768187849    0.35969372784182      C 
    2.05439671808477   -1.41322648530339   -6.53789206870320      H 
    1.73192064072107   -1.58538394710033   -3.04056075708671      H 
    5.50925192981824   -1.52374978918928   -0.78437904413129      H 
    9.71814587433983   -1.15122429515577   -6.24204233762043      H 
   14.35712691302067   -0.92781248584637   -5.87399182032746      H 
   13.70902099255547   -1.21131230210560    2.17348551010649      H 
    9.11545843607977   -1.43465857602705    1.79594449587814      H 
   18.07012852639912   -0.96876447081940   -3.52432254349568      H 
   17.74842767793552   -0.48928048556760    2.22776527530013      H 
   20.57213426224579   -0.51063313276800    0.24995701689300      H 
$end
           -------------------------------------------------
          |                Final Singlepoint                |
           -------------------------------------------------

          ...................................................
          :                      SETUP                      :
          :.................................................:
          :  # basis functions                  54          :
          :  # atomic orbitals                  54          :
          :  # shells                           32          :
          :  # electrons                        56          :
          :  max. iterations                   250          :
          :  Hamiltonian                  GFN2-xTB          :
          :  restarted?                      false          :
          :  GBSA solvation                  false          :
          :  PC potential                    false          :
          :  electronic temp.          300.0000000     K    :
          :  accuracy                    1.0000000          :
          :  -> integral cutoff          0.2500000E+02      :
          :  -> integral neglect         0.1000000E-07      :
          :  -> SCF convergence          0.1000000E-05 Eh   :
          :  -> wf. convergence          0.1000000E-03 e    :
          :  Broyden damping             0.4000000          :
          ...................................................

 iter      E             dE          RMSdq      gap      omega  full diag
   1    -30.6691652 -0.306692E+02  0.130E-04    2.94       0.0  T
   2    -30.6691652 -0.345963E-10  0.493E-05    2.94     443.0  T
   3    -30.6691652 -0.254516E-10  0.569E-05    2.94     383.4  T

   *** convergence criteria satisfied after 3 iterations ***

         #    Occupation            Energy/Eh            Energy/eV
      -------------------------------------------------------------
         1        2.0000           -0.6787389             -18.4694
       ...           ...                  ...                  ...
        22        2.0000           -0.4404180             -11.9844
        23        2.0000           -0.4238557             -11.5337
        24        2.0000           -0.4158609             -11.3162
        25        2.0000           -0.4020315             -10.9398
        26        2.0000           -0.4005248             -10.8988
        27        2.0000           -0.3907474             -10.6328
        28        2.0000           -0.3566105              -9.7039 (HOMO)
        29                         -0.2485517              -6.7634 (LUMO)
        30                         -0.2180373              -5.9331
        31                         -0.2163790              -5.8880
        32                         -0.1557463              -4.2381
        33                         -0.0687415              -1.8706
       ...                                ...                  ...
        54                          0.6930265              18.8582
      -------------------------------------------------------------
                  HL-Gap            0.1080588 Eh            2.9404 eV
             Fermi-level           -0.3025811 Eh           -8.2337 eV

 SCC (total)                   0 d,  0 h,  0 min,  0.018 sec
 SCC setup                      ...        0 min,  0.000 sec (  0.896%)
 Dispersion                     ...        0 min,  0.000 sec (  0.862%)
 integral evaluation            ...        0 min,  0.006 sec ( 31.072%)
 zeroth order Hamiltonian       ...        0 min,  0.000 sec (  0.531%)
 iterations                     ...        0 min,  0.003 sec ( 16.816%)
 molecular gradient             ...        0 min,  0.009 sec ( 47.831%)
 printout                       ...        0 min,  0.000 sec (  1.707%)

         :::::::::::::::::::::::::::::::::::::::::::::::::::::
         ::                     SUMMARY                     ::
         :::::::::::::::::::::::::::::::::::::::::::::::::::::
         :: total energy             -30.138538623316 Eh    ::
         :: gradient norm              0.000579187037 Eh/a0 ::
         :: HOMO-LUMO gap              2.940429644902 eV    ::
         ::.................................................::
         :: SCC energy               -30.669165246288 Eh    ::
         :: -> isotropic ES            0.006626159437 Eh    ::
         :: -> anisotropic ES          0.004955350857 Eh    ::
         :: -> anisotropic XC          0.026388589296 Eh    ::
         :: -> dispersion             -0.017512265618 Eh    ::
         :: repulsion energy           0.530725850074 Eh    ::
         :: add. restraining           0.000000000000 Eh    ::
         :::::::::::::::::::::::::::::::::::::::::::::::::::::

           -------------------------------------------------
          |                Property Printout                |
           -------------------------------------------------

    * Orbital Energies and Occupations

         #    Occupation            Energy/Eh            Energy/eV
      -------------------------------------------------------------
         1        2.0000           -0.6787389             -18.4694
       ...           ...                  ...                  ...
        16        2.0000           -0.4902785             -13.3412
        17        2.0000           -0.4805178             -13.0756
        18        2.0000           -0.4779218             -13.0049
        19        2.0000           -0.4741441             -12.9021
        20        2.0000           -0.4661844             -12.6855
        21        2.0000           -0.4440177             -12.0823
        22        2.0000           -0.4404180             -11.9844
        23        2.0000           -0.4238557             -11.5337
        24        2.0000           -0.4158609             -11.3162
        25        2.0000           -0.4020315             -10.9398
        26        2.0000           -0.4005248             -10.8988
        27        2.0000           -0.3907474             -10.6328
        28        2.0000           -0.3566105              -9.7039 (HOMO)
        29                         -0.2485517              -6.7634 (LUMO)
        30                         -0.2180373              -5.9331
        31                         -0.2163790              -5.8880
        32                         -0.1557463              -4.2381
        33                         -0.0687415              -1.8706
        34                          0.0011025               0.0300
        35                          0.1040462               2.8312
        36                          0.1222315               3.3261
        37                          0.1380797               3.7573
        38                          0.1419621               3.8630
        39                          0.1456916               3.9645
       ...                                ...                  ...
        54                          0.6930265              18.8582
      -------------------------------------------------------------
                  HL-Gap            0.1080588 Eh            2.9404 eV
             Fermi-level           -0.3025811 Eh           -8.2337 eV

     #   Z        covCN         q      C6AA      α(0)
     1   6 C      2.806    -0.020    28.483     8.744
     2   7 N      1.900    -0.136    24.726     7.372
     3   7 N      2.806    -0.045    22.101     6.982
     4   6 C      2.912     0.063    26.595     8.456
     5   6 C      2.919    -0.049    29.222     8.865
     6   6 C      2.928    -0.033    28.833     8.806
     7   6 C      2.969     0.004    27.934     8.669
     8   6 C      2.923    -0.032    28.796     8.800
     9   6 C      2.921    -0.059    29.466     8.902
    10   6 C      2.896    -0.030    28.755     8.792
    11   6 C      2.837    -0.090    30.250     9.013
    12   1 H      0.926     0.049     2.338     2.391
    13   1 H      0.924     0.001     3.049     2.731
    14   1 H      0.859     0.133     1.524     1.934
    15   1 H      0.926     0.053     2.281     2.362
    16   1 H      0.926     0.034     2.531     2.488
    17   1 H      0.926     0.036     2.498     2.472
    18   1 H      0.925     0.023     2.693     2.566
    19   1 H      0.925     0.032     2.564     2.504
    20   1 H      0.926     0.035     2.517     2.481
    21   1 H      0.926     0.033     2.542     2.493

 Mol. C6AA /au·bohr⁶  :       5394.450167
 Mol. C8AA /au·bohr⁸  :     128716.440130
 Mol. α(0) /au        :        117.822885


Wiberg/Mayer (AO) data.
largest (>0.10) Wiberg bond orders for each atom
          total WBO             WBO to atom ...
     1  C   3.953        N    2 1.812    H   12 0.971    H   13 0.955    N    3 0.151
     2  N   3.081        C    1 1.812    N    3 1.169
     3  N   3.504        N    2 1.169    C    4 1.117    H   14 0.928    C    1 0.151
     4  C   3.965        C    5 1.341    C    9 1.341    N    3 1.117
     5  C   3.988        C    6 1.482    C    4 1.341    H   15 0.966
     6  C   3.991        C    5 1.482    C    7 1.360    H   16 0.968
     7  C   3.973        C    8 1.361    C    6 1.360    C   10 1.099
     8  C   3.992        C    9 1.481    C    7 1.361    H   17 0.966
     9  C   3.987        C    8 1.481    C    4 1.341    H   18 0.968
    10  C   3.990        C   11 1.891    C    7 1.099    H   19 0.965
    11  C   3.976        C   10 1.891    H   21 0.979    H   20 0.973
    12  H   0.997        C    1 0.971
    13  H   1.000        C    1 0.955
    14  H   0.982        N    3 0.928
    15  H   0.997        C    5 0.966
    16  H   0.998        C    6 0.968
    17  H   0.998        C    8 0.966
    18  H   0.999        C    9 0.968
    19  H   0.999        C   10 0.965
    20  H   0.999        C   11 0.973
    21  H   0.998        C   11 0.979

molecular dipole:
                 x           y           z       tot (Debye)
 q only:       -0.201      -0.023       0.182
   full:       -0.587      -0.050       0.554       2.057
molecular quadrupole (traceless):
                xx          xy          yy          xz          yz          zz
 q only:       -3.015       0.175       0.596       1.285      -0.408       2.419
  q+dip:       -4.357       1.208      -1.255       5.931      -1.069       5.611
   full:       -6.012       0.894       2.704       6.172      -1.031       3.308

           -------------------------------------------------
          |                Geometry Summary                 |
           -------------------------------------------------

      molecular mass/u    :      146.1914000
   center of mass at/Å    :        5.7544244      -0.6162276      -1.2249798
  moments of inertia/u·Å² :        0.1074486E+03   0.1001286E+04   0.1108158E+04
rotational constants/cm⁻¹ :        0.1568902E+00   0.1683599E-01   0.1521230E-01

 * 20 selected distances

     #   Z        #   Z                                     value/Å
     1   6 C      2   7 N                                 1.2648012
     2   7 N      3   7 N                                 1.3256569
     3   7 N      4   6 C                                 1.3791213
     4   6 C      5   6 C                                 1.3946157
     5   6 C      6   6 C                                 1.3769419
     6   6 C      7   6 C                                 1.3981360 (max)
     7   6 C      8   6 C                                 1.3966139
     4   6 C      9   6 C                                 1.3951782
     8   6 C      9   6 C                                 1.3775566
    10   6 C     11   6 C                                 1.3282976
     1   6 C     12   1 H                                 1.0736829
     1   6 C     13   1 H                                 1.0921088
     3   7 N     14   1 H                                 1.0223133 (min)
     5   6 C     15   1 H                                 1.0780459
     6   6 C     16   1 H                                 1.0809077
     8   6 C     17   1 H                                 1.0788587
     9   6 C     18   1 H                                 1.0816484
    10   6 C     19   1 H                                 1.0836772
    11   6 C     20   1 H                                 1.0765984
    11   6 C     21   1 H                                 1.0764505

 * 5 distinct bonds (by element types)

   Z      Z             #   av. dist./Å        max./Å        min./Å
   1 H    6 C           9     1.0802198     1.0921088     1.0736829
   6 C    6 C           7     1.3810486     1.3981360     1.3282976
   1 H    7 N           1     1.0223133     1.0223133     1.0223133
   6 C    7 N           2     1.3219612     1.3791213     1.2648012
   7 N    7 N           1     1.3256569     1.3256569     1.3256569


optimized geometry written to: xtbopt.xyz


           -------------------------------------------------
          | TOTAL ENERGY              -30.138538623316 Eh   |
          | GRADIENT NORM               0.000579187037 Eh/α |
          | HOMO-LUMO GAP               2.940429644902 eV   |
           -------------------------------------------------

------------------------------------------------------------------------
 * finished run on 2021/05/19 at 10:59:43.559     
------------------------------------------------------------------------
 total:
 * wall-time:     0 d,  0 h,  0 min,  0.528 sec
 *  cpu-time:     0 d,  0 h,  0 min,  0.528 sec
 * ratio c/w:     0.998 speedup
 SCF:
 * wall-time:     0 d,  0 h,  0 min,  0.026 sec
 *  cpu-time:     0 d,  0 h,  0 min,  0.026 sec
 * ratio c/w:     1.000 speedup
 ANC optimizer:
 * wall-time:     0 d,  0 h,  0 min,  0.484 sec
 *  cpu-time:     0 d,  0 h,  0 min,  0.484 sec
 * ratio c/w:     1.000 speedup

