      -----------------------------------------------------------      
     |                   =====================                   |     
     |                           x T B                           |     
     |                   =====================                   |     
     |                         S. Grimme                         |     
     |          Mulliken Center for Theoretical Chemistry        |     
     |                    University of Bonn                     |     
     |                Version 6.2 RC2 (SAW190805)                |     
      -----------------------------------------------------------      

   This program is distributed in the hope that it will be useful,
   but WITHOUT ANY WARRANTY; without even the implied warranty of
   MERCHANTABILITY or FITNESS FOR A PARTICULAR PURPOSE.
   
   FOR NON-COMMERCIAL, ACADEMIA USE ONLY.
   
   Cite this work as:
   * S. Grimme, C. Bannwarth, P. Shushkov, J. Chem. Theory Comput., 2017,
     13, 1989-2009. DOI: 10.1021/acs.jctc.7b00118
   * C. Bannwarth, S. Ehlert and S. Grimme., J. Chem. Theory Comput., 2019,
     15, 1652-1671. DOI: 10.1021/acs.jctc.8b01176
   * P. Pracht, E. Caldeweyher, S. Ehlert, S. Grimme, ChemRxiv, 2019, preprint.
     DOI: 10.26434/chemrxiv.8326202.v1
   
   for DFT-D4:
   * E. Caldeweyher, C. Bannwarth and S. Grimme, J. Chem. Phys., 2017,
     147, 034112. DOI: 10.1063/1.4993215
   * E. Caldeweyher, S. Ehlert, A. Hansen, H. Neugebauer, S. Spicher,
     C. Bannwarth and S. Grimme, J. Chem. Phys., 2019, 150, 154122.
     DOI: 10.1063/1.5090222
   
   for sTDA-xTB:
   * S. Grimme and C. Bannwarth, J. Chem. Phys., 2016, 145, 054103.
     DOI: 10.1063/1.4959605
   
   in the mass-spec context:
   * V. Asgeirsson, C. Bauer and S. Grimme, Chem. Sci., 2017, 8, 4879.
     DOI: 10.1039/c7sc00601b
   
   for metadynamics refer to:
   * S. Grimme, J. Chem. Theory Comput., 2019, 155, 2847-2862
     DOI: 10.1021/acs.jctc.9b00143
   
   with help from (in alphabetical order)
   C. Bannwarth, F. Bohle, G. Brandenburg, E. Caldeweyher, M. Checinski,
   S. Dohm, S. Ehlert, S. Ehrlich, F. März, H. Neugebauer, J. Pisarek,
   P. Pracht, P. Shushkov, and S. Spicher.
   
 * started run on 2021/05/19 at 10:59:43.992     

           -------------------------------------------------
          |                Calculation Setup                |
           -------------------------------------------------

          program call               : /ihome/ghutchison/geoffh/xtb/xtb 297.xyz -opt
          hostname                   : smp-n83
          coordinate file            : 297.xyz
          omp threads                :                     1
          number of atoms            :                    17
          number of electrons        :                    48
          charge                     :                     0
          spin                       :                   0.0
          first test random number   :      0.18655129142891


########################################################################
# WARNING! Please study the warnings concerning your input carefully
#  - the use of '-opt' is discouraged, please use '--opt' next time
########################################################################

           ------------------------------------------------- 
          |                 G F N 2 - x T B                 |
          | Geometry, Frequencies, Noncovalent interactions |
          |            JCTC 2019 parametrisation            |
           ------------------------------------------------- 
             KAB for C  - Si     :                1.0500
             KAB for H  - Pd     :                0.9500
             k(s)              :                1.8500
             k(p)              :                2.2300
             k(d)              :                2.2300
             k(f)              :                2.0000
             kEN (H0ij)        :               -2.0000
             D4 a1             :                0.5200
             D4 a2             :                5.0000
             D4 s6             :                1.0000
             D4 s8             :                2.7000
             D4 s9             :                5.0000
             alphaj            :                2.0000

  Z AO/shell   Hii/eV     exponent
  1     Wed Apr 25 08:07:45 CEST 2018   EN: 2.200 GM2: 0.406  GM3: 0.0800  RAES: 1.40
     1s    -10.707211    1.230000
  6     Wed Apr 25 08:07:45 CEST 2018   EN: 2.550 GM2: 0.538  GM3: 0.1500  RAES: 3.00
     2s    -13.970922    2.096432
     2p    -10.063292    1.800000
  8     Wed Apr 25 08:07:45 CEST 2018   EN: 3.440 GM2: 0.452  GM3:-0.0517  RAES: 1.80
     2s    -20.229985    2.439742
     2p    -15.503117    2.137023
 16     Tue Apr 24 11:44:34 CEST 2018   EN: 2.580 GM2: 0.340  GM3:-0.0502  RAES: 3.10
     3s    -20.029654    1.981333
     3p    -11.377694    2.025643
     3d     -0.420282    1.702555

           ------------------------------------------------- 
          |        Self-Consistent Charge Iterations        |
           ------------------------------------------------- 

          ...................................................
          :                      SETUP                      :
          :.................................................:
          :  # basis functions                  50          :
          :  # atomic orbitals                  49          :
          :  # shells                           27          :
          :  # electrons                        48          :
          :  max. iterations                   250          :
          :  Hamiltonian                  GFN2-xTB          :
          :  restarted?                      false          :
          :  GBSA solvation                  false          :
          :  PC potential                    false          :
          :  electronic temp.          300.0000000     K    :
          :  accuracy                    1.0000000          :
          :  -> integral cutoff          0.2500000E+02      :
          :  -> integral neglect         0.1000000E-07      :
          :  -> SCF convergence          0.1000000E-05 Eh   :
          :  -> wf. convergence          0.1000000E-03 e    :
          :  Broyden damping             0.4000000          :
          ...................................................

 iter      E             dE          RMSdq      gap      omega  full diag
   1    -26.5690423 -0.265690E+02  0.528E+00    3.10       0.0  T
   2    -26.6136898 -0.446475E-01  0.277E+00    2.50       1.0  T
   3    -26.6104104  0.327941E-02  0.168E+00    2.82       1.0  T
   4    -26.6232584 -0.128480E-01  0.566E-01    2.61       1.0  T
   5    -26.6253538 -0.209537E-02  0.236E-01    2.64       1.0  T
   6    -26.6256020 -0.248189E-03  0.756E-02    2.65       1.0  T
   7    -26.6256524 -0.504016E-04  0.282E-02    2.64       1.0  T
   8    -26.6256531 -0.717212E-06  0.137E-02    2.64       1.8  T
   9    -26.6256539 -0.835048E-06  0.782E-03    2.64       3.1  T
  10    -26.6256545 -0.548979E-06  0.189E-03    2.64      12.8  T
  11    -26.6256545 -0.141634E-07  0.805E-04    2.64      30.1  T
  12    -26.6256545 -0.133340E-08  0.280E-04    2.64      86.7  T

   *** convergence criteria satisfied after 12 iterations ***

         #    Occupation            Energy/Eh            Energy/eV
      -------------------------------------------------------------
         1        2.0000           -0.7445567             -20.2604
       ...           ...                  ...                  ...
        18        2.0000           -0.4689841             -12.7617
        19        2.0000           -0.4575160             -12.4496
        20        2.0000           -0.4522352             -12.3059
        21        2.0000           -0.4457757             -12.1302
        22        2.0000           -0.4215659             -11.4714
        23        2.0000           -0.3923994             -10.6777
        24        2.0000           -0.3904712             -10.6253 (HOMO)
        25                         -0.2934197              -7.9844 (LUMO)
        26                         -0.2515892              -6.8461
        27                         -0.2209351              -6.0120
        28                         -0.1888972              -5.1402
        29                         -0.1473728              -4.0102
       ...                                ...                  ...
        49                          0.6944226              18.8962
      -------------------------------------------------------------
                  HL-Gap            0.0970515 Eh            2.6409 eV
             Fermi-level           -0.3419455 Eh           -9.3048 eV

 SCC (total)                   0 d,  0 h,  0 min,  0.022 sec
 SCC setup                      ...        0 min,  0.000 sec (  1.090%)
 Dispersion                     ...        0 min,  0.000 sec (  0.918%)
 integral evaluation            ...        0 min,  0.005 sec ( 22.740%)
 zeroth order Hamiltonian       ...        0 min,  0.000 sec (  0.518%)
 iterations                     ...        0 min,  0.009 sec ( 39.934%)
 molecular gradient             ...        0 min,  0.007 sec ( 33.295%)
 printout                       ...        0 min,  0.000 sec (  1.268%)

         :::::::::::::::::::::::::::::::::::::::::::::::::::::
         ::                     SUMMARY                     ::
         :::::::::::::::::::::::::::::::::::::::::::::::::::::
         :: total energy             -26.285402700081 Eh    ::
         :: gradient norm              0.064445648200 Eh/a0 ::
         :: HOMO-LUMO gap              2.640905079574 eV    ::
         ::.................................................::
         :: SCC energy               -26.625654493849 Eh    ::
         :: -> isotropic ES            0.029313218409 Eh    ::
         :: -> anisotropic ES          0.002572170382 Eh    ::
         :: -> anisotropic XC          0.014723829755 Eh    ::
         :: -> dispersion             -0.013504527919 Eh    ::
         :: repulsion energy           0.340178723057 Eh    ::
         :: add. restraining           0.000000000000 Eh    ::
         :::::::::::::::::::::::::::::::::::::::::::::::::::::

      ----------------------------------------------------------- 
     |                   =====================                   |
     |                        A N C O P T                        |
     |                   =====================                   |
     |               Approximate Normal Coordinate               |
     |                Rational Function Optimizer                |
      ----------------------------------------------------------- 

          ...................................................
          :                      SETUP                      :
          :.................................................:
          :   optimization level            normal          :
          :   max. optcycles                   200          :
          :   ANC micro-cycles                  20          :
          :   degrees of freedom                45          :
          :.................................................:
          :   RF solver                   davidson          :
          :   input Hessian                  false          :
          :   write xtbopt.log                true          :
          :   linear?                        false          :
          :   energy convergence         0.5000000E-05 Eh   :
          :   grad. convergence          0.1000000E-02 Eh/α :
          :   maximium RF displ.         2.0000000          :
          :   Hlow (freq-cutoff)         0.5000000E-02      :
          :   Hmax (freq-cutoff)         5.0000000          :
          :   S6 in model hess.         20.0000000          :
          ...................................................

generating ANC from model Hessian ...
Using Lindh-Hessian (1995)
 Shifting diagonal of input Hessian by   3.583747365597847E-003
 Lowest  eigenvalues of input Hessian
   -0.000000   -0.000000   -0.000000   -0.000000    0.000000    0.000000
    0.005000    0.005096    0.006971    0.012598    0.013457    0.015798
    0.020769    0.026856    0.032455    0.040045    0.041544    0.055555
 Highest eigenvalues
    1.363575    1.456212    1.543716    1.831209    1.856048    2.089966
 

........................................................................
.............................. CYCLE    1 ..............................
........................................................................
   1    -26.6256545 -0.266257E+02  0.133E-04    2.64       0.0  T
   2    -26.6256545 -0.703437E-11  0.810E-05    2.64     299.6  T
   3    -26.6256545  0.192237E-10  0.655E-05    2.64     370.5  T
     SCC iter.                  ...        0 min,  0.003 sec
     gradient                   ...        0 min,  0.007 sec
 * total energy  :   -26.2854027 Eh     change       -0.1527400E-07 Eh
   gradient norm :     0.0644454 Eh/α   predicted     0.0000000E+00 (-100.00%)
   displ. norm   :     0.2364459 α      lambda       -0.7018219E-02
   maximum displ.:     0.1010206 α      in ANC's #6, #4, #23, ...

........................................................................
.............................. CYCLE    2 ..............................
........................................................................
   1    -26.6457432 -0.266457E+02  0.459E-01    2.67       0.0  T
   2    -26.6458361 -0.928612E-04  0.228E-01    2.64       1.0  T
   3    -26.6457371  0.989218E-04  0.960E-02    2.65       1.0  T
   4    -26.6458684 -0.131235E-03  0.361E-02    2.65       1.0  T
   5    -26.6458751 -0.669755E-05  0.186E-02    2.64       1.3  T
   6    -26.6458765 -0.142045E-05  0.349E-03    2.65       6.9  T
   7    -26.6458765 -0.341950E-07  0.178E-03    2.64      13.6  T
     SCC iter.                  ...        0 min,  0.005 sec
     gradient                   ...        0 min,  0.007 sec
 * total energy  :   -26.2895468 Eh     change       -0.4144080E-02 Eh
   gradient norm :     0.0169290 Eh/α   predicted    -0.3705301E-02 ( -10.59%)
   displ. norm   :     0.1653838 α      lambda       -0.1178572E-02
   maximum displ.:     0.0942654 α      in ANC's #5, #2, #10, ...

........................................................................
.............................. CYCLE    3 ..............................
........................................................................
   1    -26.6524519 -0.266525E+02  0.182E-01    2.65       0.0  T
   2    -26.6524636 -0.116977E-04  0.932E-02    2.65       1.0  T
   3    -26.6524607  0.296647E-05  0.275E-02    2.65       1.0  T
   4    -26.6524664 -0.573982E-05  0.137E-02    2.65       1.8  T
   5    -26.6524665 -0.102702E-06  0.851E-03    2.65       2.8  T
   6    -26.6524672 -0.725732E-06  0.160E-03    2.65      15.2  T
   7    -26.6524672 -0.726597E-08  0.104E-03    2.65      23.2  T
     SCC iter.                  ...        0 min,  0.005 sec
     gradient                   ...        0 min,  0.007 sec
 * total energy  :   -26.2900836 Eh     change       -0.5367701E-03 Eh
   gradient norm :     0.0104182 Eh/α   predicted    -0.6054065E-03 (  12.79%)
   displ. norm   :     0.1136776 α      lambda       -0.3095268E-03
   maximum displ.:     0.0689999 α      in ANC's #2, #5, #6, ...

........................................................................
.............................. CYCLE    4 ..............................
........................................................................
   1    -26.6513230 -0.266513E+02  0.148E-01    2.64       0.0  T
   2    -26.6513296 -0.655300E-05  0.705E-02    2.64       1.0  T
   3    -26.6513303 -0.724110E-06  0.141E-02    2.64       1.7  T
   4    -26.6513309 -0.604899E-06  0.863E-03    2.64       2.8  T
   5    -26.6513311 -0.129708E-06  0.367E-03    2.64       6.6  T
   6    -26.6513312 -0.146782E-06  0.744E-04    2.64      32.6  T
   7    -26.6513312 -0.281673E-09  0.390E-04    2.64      62.2  T
     SCC iter.                  ...        0 min,  0.005 sec
     gradient                   ...        0 min,  0.007 sec
 * total energy  :   -26.2902920 Eh     change       -0.2084178E-03 Eh
   gradient norm :     0.0051201 Eh/α   predicted    -0.1567624E-03 ( -24.78%)
   displ. norm   :     0.1392309 α      lambda       -0.1712148E-03
   maximum displ.:     0.1011048 α      in ANC's #2, #5, #4, ...

........................................................................
.............................. CYCLE    5 ..............................
........................................................................
   1    -26.6499286 -0.266499E+02  0.133E-01    2.63       0.0  T
   2    -26.6499339 -0.530500E-05  0.660E-02    2.63       1.0  T
   3    -26.6499323  0.157171E-05  0.196E-02    2.63       1.2  T
   4    -26.6499350 -0.262593E-05  0.101E-02    2.63       2.4  T
   5    -26.6499352 -0.284771E-06  0.491E-03    2.63       4.9  T
   6    -26.6499354 -0.208344E-06  0.112E-03    2.63      21.7  T
   7    -26.6499355 -0.660685E-08  0.734E-04    2.63      33.0  T
     SCC iter.                  ...        0 min,  0.005 sec
     gradient                   ...        0 min,  0.007 sec
 * total energy  :   -26.2903947 Eh     change       -0.1027226E-03 Eh
   gradient norm :     0.0035296 Eh/α   predicted    -0.8726811E-04 ( -15.04%)
   displ. norm   :     0.0976594 α      lambda       -0.7438104E-04
   maximum displ.:     0.0825948 α      in ANC's #2, #1, #5, ...

........................................................................
.............................. CYCLE    6 ..............................
........................................................................
   1    -26.6499752 -0.266500E+02  0.645E-02    2.64       0.0  T
   2    -26.6499763 -0.115352E-05  0.346E-02    2.63       1.0  T
   3    -26.6499751  0.123779E-05  0.131E-02    2.63       1.8  T
   4    -26.6499765 -0.140702E-05  0.582E-03    2.63       4.2  T
   5    -26.6499767 -0.195341E-06  0.251E-03    2.63       9.6  T
   6    -26.6499767 -0.367894E-07  0.736E-04    2.63      33.0  T
   7    -26.6499767 -0.264513E-08  0.442E-04    2.63      54.8  T
     SCC iter.                  ...        0 min,  0.005 sec
     gradient                   ...        0 min,  0.007 sec
 * total energy  :   -26.2904352 Eh     change       -0.4046657E-04 Eh
   gradient norm :     0.0036831 Eh/α   predicted    -0.3754724E-04 (  -7.21%)
   displ. norm   :     0.0558838 α      lambda       -0.4162449E-04
   maximum displ.:     0.0482211 α      in ANC's #2, #1, #5, ...

........................................................................
.............................. CYCLE    7 ..............................
........................................................................
   1    -26.6506877 -0.266507E+02  0.455E-02    2.64       0.0  T
   2    -26.6506883 -0.582396E-06  0.238E-02    2.64       1.0  T
   3    -26.6506872  0.108157E-05  0.105E-02    2.64       2.3  T
   4    -26.6506885 -0.127084E-05  0.368E-03    2.64       6.6  T
   5    -26.6506886 -0.615315E-07  0.119E-03    2.64      20.3  T
   6    -26.6506886 -0.396185E-08  0.356E-04    2.64      68.2  T
   7    -26.6506886 -0.679702E-09  0.194E-04    2.64     124.8  T
     SCC iter.                  ...        0 min,  0.005 sec
     gradient                   ...        0 min,  0.007 sec
 * total energy  :   -26.2904694 Eh     change       -0.3418419E-04 Eh
   gradient norm :     0.0023863 Eh/α   predicted    -0.2087656E-04 ( -38.93%)
   displ. norm   :     0.0910501 α      lambda       -0.5371347E-04
   maximum displ.:     0.0788666 α      in ANC's #2, #1, #4, ...

........................................................................
.............................. CYCLE    8 ..............................
........................................................................
   1    -26.6513588 -0.266514E+02  0.864E-02    2.64       0.0  T
   2    -26.6513607 -0.190390E-05  0.434E-02    2.64       1.0  T
   3    -26.6513604  0.310409E-06  0.107E-02    2.64       2.3  T
   4    -26.6513608 -0.420486E-06  0.676E-03    2.64       3.6  T
   5    -26.6513612 -0.334727E-06  0.194E-03    2.64      12.5  T
   6    -26.6513612 -0.330406E-07  0.490E-04    2.64      49.5  T
   7    -26.6513612 -0.493579E-09  0.294E-04    2.64      82.5  T
     SCC iter.                  ...        0 min,  0.005 sec
     gradient                   ...        0 min,  0.007 sec
 * total energy  :   -26.2905125 Eh     change       -0.4317071E-04 Eh
   gradient norm :     0.0019447 Eh/α   predicted    -0.2707974E-04 ( -37.27%)
   displ. norm   :     0.1551544 α      lambda       -0.4481598E-04
   maximum displ.:     0.1340358 α      in ANC's #2, #1, #6, ...

........................................................................
.............................. CYCLE    9 ..............................
........................................................................
   1    -26.6515092 -0.266515E+02  0.141E-01    2.64       0.0  T
   2    -26.6515136 -0.440909E-05  0.719E-02    2.64       1.0  T
   3    -26.6515143 -0.677319E-06  0.143E-02    2.64       1.7  T
   4    -26.6515140  0.258215E-06  0.898E-03    2.64       2.7  T
   5    -26.6515146 -0.586471E-06  0.323E-03    2.64       7.5  T
   6    -26.6515148 -0.139064E-06  0.881E-04    2.64      27.5  T
   7    -26.6515148 -0.730729E-09  0.440E-04    2.64      55.1  T
     SCC iter.                  ...        0 min,  0.005 sec
     gradient                   ...        0 min,  0.007 sec
 * total energy  :   -26.2905665 Eh     change       -0.5394567E-04 Eh
   gradient norm :     0.0028187 Eh/α   predicted    -0.2264692E-04 ( -58.02%)
   displ. norm   :     0.0827775 α      lambda       -0.3246552E-04
   maximum displ.:     0.0711209 α      in ANC's #2, #1, #6, ...

........................................................................
.............................. CYCLE   10 ..............................
........................................................................
   1    -26.6513190 -0.266513E+02  0.784E-02    2.64       0.0  T
   2    -26.6513204 -0.137551E-05  0.393E-02    2.64       1.0  T
   3    -26.6513200  0.390287E-06  0.101E-02    2.64       2.4  T
   4    -26.6513205 -0.527475E-06  0.639E-03    2.64       3.8  T
   5    -26.6513208 -0.293974E-06  0.104E-03    2.64      23.3  T
   6    -26.6513208 -0.625619E-08  0.474E-04    2.64      51.1  T
   7    -26.6513208 -0.568555E-09  0.277E-04    2.64      87.7  T
     SCC iter.                  ...        0 min,  0.005 sec
     gradient                   ...        0 min,  0.007 sec
 * total energy  :   -26.2905960 Eh     change       -0.2949846E-04 Eh
   gradient norm :     0.0020800 Eh/α   predicted    -0.1634374E-04 ( -44.59%)
   displ. norm   :     0.0807011 α      lambda       -0.3061718E-04
   maximum displ.:     0.0691792 α      in ANC's #2, #1, #5, ...

........................................................................
.............................. CYCLE   11 ..............................
........................................................................
   1    -26.6511324 -0.266511E+02  0.661E-02    2.63       0.0  T
   2    -26.6511333 -0.898552E-06  0.348E-02    2.64       1.0  T
   3    -26.6511323  0.107079E-05  0.117E-02    2.64       2.1  T
   4    -26.6511336 -0.131364E-05  0.556E-03    2.64       4.4  T
   5    -26.6511337 -0.161965E-06  0.105E-03    2.64      23.1  T
   6    -26.6511337 -0.401256E-08  0.534E-04    2.64      45.4  T
   7    -26.6511337 -0.140447E-08  0.317E-04    2.64      76.5  T
     SCC iter.                  ...        0 min,  0.005 sec
     gradient                   ...        0 min,  0.007 sec
 * total energy  :   -26.2906223 Eh     change       -0.2631722E-04 Eh
   gradient norm :     0.0009777 Eh/α   predicted    -0.1541007E-04 ( -41.44%)
   displ. norm   :     0.1077765 α      lambda       -0.2123829E-04
   maximum displ.:     0.0935396 α      in ANC's #2, #1, #5, ...

........................................................................
.............................. CYCLE   12 ..............................
........................................................................
   1    -26.6509061 -0.266509E+02  0.880E-02    2.64       0.0  T
   2    -26.6509076 -0.146862E-05  0.459E-02    2.64       1.0  T
   3    -26.6509071  0.465740E-06  0.116E-02    2.64       2.1  T
   4    -26.6509077 -0.610866E-06  0.715E-03    2.63       3.4  T
   5    -26.6509081 -0.367663E-06  0.117E-03    2.64      20.7  T
   6    -26.6509081 -0.100140E-07  0.643E-04    2.63      37.7  T
   7    -26.6509081 -0.175623E-08  0.353E-04    2.63      68.7  T
     SCC iter.                  ...        0 min,  0.005 sec
     gradient                   ...        0 min,  0.007 sec
 * total energy  :   -26.2906469 Eh     change       -0.2466148E-04 Eh
   gradient norm :     0.0011895 Eh/α   predicted    -0.1067402E-04 ( -56.72%)
   displ. norm   :     0.0613880 α      lambda       -0.9442088E-05
   maximum displ.:     0.0563269 α      in ANC's #2, #3, #7, ...

........................................................................
.............................. CYCLE   13 ..............................
........................................................................
   1    -26.6509663 -0.266510E+02  0.422E-02    2.64       0.0  T
   2    -26.6509666 -0.287205E-06  0.231E-02    2.64       1.1  T
   3    -26.6509666  0.633737E-07  0.515E-03    2.63       4.7  T
   4    -26.6509666 -0.812137E-07  0.324E-03    2.64       7.5  T
   5    -26.6509667 -0.865367E-07  0.753E-04    2.63      32.2  T
   6    -26.6509667 -0.426150E-08  0.354E-04    2.63      68.5  T
     SCC iter.                  ...        0 min,  0.004 sec
     gradient                   ...        0 min,  0.007 sec
 * total energy  :   -26.2906591 Eh     change       -0.1213913E-04 Eh
   gradient norm :     0.0012296 Eh/α   predicted    -0.4727777E-05 ( -61.05%)
   displ. norm   :     0.0509262 α      lambda       -0.8208941E-05
   maximum displ.:     0.0469527 α      in ANC's #2, #3, #6, ...

........................................................................
.............................. CYCLE   14 ..............................
........................................................................
   1    -26.6512084 -0.266512E+02  0.339E-02    2.64       0.0  T
   2    -26.6512087 -0.237354E-06  0.183E-02    2.64       1.3  T
   3    -26.6512081  0.561983E-06  0.741E-03    2.64       3.3  T
   4    -26.6512088 -0.663411E-06  0.254E-03    2.64       9.5  T
   5    -26.6512088 -0.254718E-07  0.739E-04    2.64      32.8  T
   6    -26.6512088 -0.152614E-08  0.240E-04    2.64     101.1  T
     SCC iter.                  ...        0 min,  0.004 sec
     gradient                   ...        0 min,  0.007 sec
 * total energy  :   -26.2906698 Eh     change       -0.1074156E-04 Eh
   gradient norm :     0.0007205 Eh/α   predicted    -0.4109533E-05 ( -61.74%)
   displ. norm   :     0.0603226 α      lambda       -0.8862476E-05
   maximum displ.:     0.0522196 α      in ANC's #2, #1, #3, ...

........................................................................
.............................. CYCLE   15 ..............................
........................................................................
   1    -26.6512463 -0.266512E+02  0.484E-02    2.64       0.0  T
   2    -26.6512469 -0.551490E-06  0.249E-02    2.64       1.0  T
   3    -26.6512462  0.670871E-06  0.883E-03    2.63       2.7  T
   4    -26.6512471 -0.842766E-06  0.354E-03    2.64       6.9  T
   5    -26.6512471 -0.469390E-07  0.984E-04    2.64      24.7  T
   6    -26.6512471 -0.313093E-08  0.299E-04    2.64      81.2  T
     SCC iter.                  ...        0 min,  0.004 sec
     gradient                   ...        0 min,  0.007 sec
 * total energy  :   -26.2906816 Eh     change       -0.1176119E-04 Eh
   gradient norm :     0.0007257 Eh/α   predicted    -0.4436301E-05 ( -62.28%)
   displ. norm   :     0.0869957 α      lambda       -0.1121084E-04
   maximum displ.:     0.0706163 α      in ANC's #2, #1, #3, ...

........................................................................
.............................. CYCLE   16 ..............................
........................................................................
   1    -26.6512691 -0.266513E+02  0.619E-02    2.64       0.0  T
   2    -26.6512698 -0.693290E-06  0.326E-02    2.63       1.0  T
   3    -26.6512699 -0.417242E-07  0.702E-03    2.63       3.5  T
   4    -26.6512698  0.746650E-07  0.493E-03    2.63       4.9  T
   5    -26.6512701 -0.250773E-06  0.883E-04    2.63      27.5  T
   6    -26.6512701 -0.667067E-08  0.408E-04    2.63      59.5  T
     SCC iter.                  ...        0 min,  0.004 sec
     gradient                   ...        0 min,  0.007 sec
 * total energy  :   -26.2906963 Eh     change       -0.1473887E-04 Eh
   gradient norm :     0.0008338 Eh/α   predicted    -0.5623410E-05 ( -61.85%)
   displ. norm   :     0.1188117 α      lambda       -0.1290821E-04
   maximum displ.:     0.0924227 α      in ANC's #2, #1, #3, ...

........................................................................
.............................. CYCLE   17 ..............................
........................................................................
   1    -26.6512163 -0.266512E+02  0.972E-02    2.63       0.0  T
   2    -26.6512181 -0.182648E-05  0.495E-02    2.63       1.0  T
   3    -26.6512186 -0.427126E-06  0.906E-03    2.63       2.7  T
   4    -26.6512183  0.241375E-06  0.490E-03    2.63       4.9  T
   5    -26.6512186 -0.303796E-06  0.979E-04    2.63      24.8  T
   6    -26.6512186 -0.688440E-08  0.500E-04    2.63      48.5  T
     SCC iter.                  ...        0 min,  0.004 sec
     gradient                   ...        0 min,  0.007 sec
 * total energy  :   -26.2907130 Eh     change       -0.1670124E-04 Eh
   gradient norm :     0.0009129 Eh/α   predicted    -0.6496042E-05 ( -61.10%)
   displ. norm   :     0.2115633 α      lambda       -0.1760668E-04
   maximum displ.:     0.1604295 α      in ANC's #2, #1, #3, ...

........................................................................
.............................. CYCLE   18 ..............................
........................................................................
   1    -26.6506929 -0.266507E+02  0.164E-01    2.63       0.0  T
   2    -26.6506978 -0.495197E-05  0.849E-02    2.63       1.0  T
   3    -26.6506986 -0.781593E-06  0.164E-02    2.63       1.5  T
   4    -26.6506974  0.119192E-05  0.125E-02    2.63       1.9  T
   5    -26.6506993 -0.185441E-05  0.212E-03    2.63      11.4  T
   6    -26.6506993 -0.390522E-07  0.963E-04    2.63      25.2  T
   7    -26.6506993 -0.324750E-09  0.531E-04    2.63      45.7  T
     SCC iter.                  ...        0 min,  0.005 sec
     gradient                   ...        0 min,  0.007 sec
 * total energy  :   -26.2907307 Eh     change       -0.1771209E-04 Eh
   gradient norm :     0.0010534 Eh/α   predicted    -0.8980708E-05 ( -49.30%)
   displ. norm   :     0.1016824 α      lambda       -0.5760591E-05
   maximum displ.:     0.0713776 α      in ANC's #2, #1, #3, ...

........................................................................
.............................. CYCLE   19 ..............................
........................................................................
   1    -26.6511251 -0.266511E+02  0.851E-02    2.63       0.0  T
   2    -26.6511265 -0.141068E-05  0.431E-02    2.63       1.0  T
   3    -26.6511268 -0.258824E-06  0.829E-03    2.63       2.9  T
   4    -26.6511266  0.237627E-06  0.568E-03    2.63       4.3  T
   5    -26.6511269 -0.346522E-06  0.105E-03    2.63      23.0  T
   6    -26.6511269 -0.145013E-07  0.426E-04    2.63      56.9  T
   7    -26.6511269 -0.587725E-10  0.234E-04    2.63     103.5  T
     SCC iter.                  ...        0 min,  0.005 sec
     gradient                   ...        0 min,  0.007 sec
 * total energy  :   -26.2907361 Eh     change       -0.5314888E-05 Eh
   gradient norm :     0.0005959 Eh/α   predicted    -0.2894053E-05 ( -45.55%)
   displ. norm   :     0.0374435 α      lambda       -0.2373650E-05
   maximum displ.:     0.0284915 α      in ANC's #1, #2, #3, ...

........................................................................
.............................. CYCLE   20 ..............................
........................................................................
   1    -26.6512647 -0.266513E+02  0.301E-02    2.63       0.0  T
   2    -26.6512649 -0.178031E-06  0.156E-02    2.63       1.6  T
   3    -26.6512647  0.166056E-06  0.480E-03    2.63       5.1  T
   4    -26.6512649 -0.194269E-06  0.265E-03    2.63       9.1  T
   5    -26.6512650 -0.440284E-07  0.569E-04    2.63      42.6  T
   6    -26.6512650 -0.273190E-08  0.207E-04    2.63     117.4  T
     SCC iter.                  ...        0 min,  0.004 sec
     gradient                   ...        0 min,  0.007 sec
 * total energy  :   -26.2907388 Eh     change       -0.2787088E-05 Eh
   gradient norm :     0.0003315 Eh/α   predicted    -0.1186427E-05 ( -57.43%)
   displ. norm   :     0.0287428 α      lambda       -0.2276033E-05
   maximum displ.:     0.0237710 α      in ANC's #1, #3, #5, ...

   *** GEOMETRY OPTIMIZATION CONVERGED AFTER 20 ITERATIONS ***

------------------------------------------------------------------------
 total energy gain   :        -0.0053361 Eh       -3.3485 kcal/mol
 total RMSD          :         0.3770359 a0        0.1995 Å
 total power (kW/mol):        -0.7005024 (step)  -40.5132 (real)
------------------------------------------------------------------------

 ANCopt (total)                0 d,  0 h,  0 min,  0.346 sec
 optimizer setup                ...        0 min,  0.000 sec (  0.034%)
 model hessian                  ...        0 min,  0.003 sec (  0.908%)
 ANC generation                 ...        0 min,  0.001 sec (  0.147%)
 coordinate transformation      ...        0 min,  0.000 sec (  0.074%)
 single point calculation       ...        0 min,  0.335 sec ( 96.948%)
 optimization log               ...        0 min,  0.002 sec (  0.439%)
 hessian update                 ...        0 min,  0.000 sec (  0.064%)
 rational function              ...        0 min,  0.004 sec (  1.036%)

================
 final structure:
================
$coord
    0.73643409252108    4.12904735843174    1.00963497241487      C 
    3.66646890756189    2.26964590969710    1.34157679777902      S 
    1.33813445930088    0.12165327752458    0.46949501881292      C 
   -0.63482421077899    1.73948610327267    0.30955469273285      C 
   -3.26891856673592    1.30323983700243   -0.31256171098753      C 
   -4.07373321316049   -0.76308459733239   -0.89871561034466      O 
   -4.96565918402137    3.61864444810468   -0.09020994395706      C 
   -5.52367506859698    4.07449253175726    2.64827679721682      C 
   -4.91584974546146    6.14962069500116    3.89180784512505      C 
    0.90542361830907    5.54108653199471   -0.47217732868183      H 
    0.17445568193633    4.99033709364389    2.78640888365568      H 
    1.54828129083586   -1.87386529236397    0.18966545573244      H 
   -6.72412665458686    3.21455937266807   -1.09165925777290      H 
   -4.04845074450408    5.26508292342303   -0.92352256529160      H 
   -6.47686589400960    2.53498579536014    3.59709531259848      H 
   -3.98117868039670    7.71717627909345    2.98432590555416      H 
   -5.36010369068082    6.38768195575568    5.86254365641681      H 
$end
           -------------------------------------------------
          |                Final Singlepoint                |
           -------------------------------------------------

          ...................................................
          :                      SETUP                      :
          :.................................................:
          :  # basis functions                  50          :
          :  # atomic orbitals                  49          :
          :  # shells                           27          :
          :  # electrons                        48          :
          :  max. iterations                   250          :
          :  Hamiltonian                  GFN2-xTB          :
          :  restarted?                      false          :
          :  GBSA solvation                  false          :
          :  PC potential                    false          :
          :  electronic temp.          300.0000000     K    :
          :  accuracy                    1.0000000          :
          :  -> integral cutoff          0.2500000E+02      :
          :  -> integral neglect         0.1000000E-07      :
          :  -> SCF convergence          0.1000000E-05 Eh   :
          :  -> wf. convergence          0.1000000E-03 e    :
          :  Broyden damping             0.4000000          :
          ...................................................

 iter      E             dE          RMSdq      gap      omega  full diag
   1    -26.6512650 -0.266513E+02  0.986E-05    2.63       0.0  T
   2    -26.6512650 -0.112124E-10  0.660E-05    2.63     367.5  T
   3    -26.6512650 -0.616041E-10  0.310E-05    2.63     783.5  T

   *** convergence criteria satisfied after 3 iterations ***

         #    Occupation            Energy/Eh            Energy/eV
      -------------------------------------------------------------
         1        2.0000           -0.7436494             -20.2357
       ...           ...                  ...                  ...
        18        2.0000           -0.4684702             -12.7477
        19        2.0000           -0.4586932             -12.4817
        20        2.0000           -0.4520339             -12.3005
        21        2.0000           -0.4466654             -12.1544
        22        2.0000           -0.4256338             -11.5821
        23        2.0000           -0.3926993             -10.6859
        24        2.0000           -0.3905682             -10.6279 (HOMO)
        25                         -0.2938567              -7.9962 (LUMO)
        26                         -0.2523149              -6.8658
        27                         -0.2177354              -5.9249
        28                         -0.1818507              -4.9484
        29                         -0.1470664              -4.0019
       ...                                ...                  ...
        49                          0.7056963              19.2030
      -------------------------------------------------------------
                  HL-Gap            0.0967115 Eh            2.6317 eV
             Fermi-level           -0.3422125 Eh           -9.3121 eV

 SCC (total)                   0 d,  0 h,  0 min,  0.015 sec
 SCC setup                      ...        0 min,  0.000 sec (  0.995%)
 Dispersion                     ...        0 min,  0.000 sec (  0.686%)
 integral evaluation            ...        0 min,  0.005 sec ( 31.040%)
 zeroth order Hamiltonian       ...        0 min,  0.000 sec (  0.568%)
 iterations                     ...        0 min,  0.003 sec ( 16.638%)
 molecular gradient             ...        0 min,  0.007 sec ( 48.189%)
 printout                       ...        0 min,  0.000 sec (  1.596%)

         :::::::::::::::::::::::::::::::::::::::::::::::::::::
         ::                     SUMMARY                     ::
         :::::::::::::::::::::::::::::::::::::::::::::::::::::
         :: total energy             -26.290738842808 Eh    ::
         :: gradient norm              0.000331210003 Eh/a0 ::
         :: HOMO-LUMO gap              2.631655048559 eV    ::
         ::.................................................::
         :: SCC energy               -26.651264970791 Eh    ::
         :: -> isotropic ES            0.029265696878 Eh    ::
         :: -> anisotropic ES          0.001851111856 Eh    ::
         :: -> anisotropic XC          0.014260128551 Eh    ::
         :: -> dispersion             -0.013999727797 Eh    ::
         :: repulsion energy           0.360450377772 Eh    ::
         :: add. restraining           0.000000000000 Eh    ::
         :::::::::::::::::::::::::::::::::::::::::::::::::::::

           -------------------------------------------------
          |                Property Printout                |
           -------------------------------------------------

    * Orbital Energies and Occupations

         #    Occupation            Energy/Eh            Energy/eV
      -------------------------------------------------------------
         1        2.0000           -0.7436494             -20.2357
       ...           ...                  ...                  ...
        12        2.0000           -0.5327553             -14.4970
        13        2.0000           -0.5248905             -14.2830
        14        2.0000           -0.5149649             -14.0129
        15        2.0000           -0.5019862             -13.6597
        16        2.0000           -0.4912811             -13.3684
        17        2.0000           -0.4809820             -13.0882
        18        2.0000           -0.4684702             -12.7477
        19        2.0000           -0.4586932             -12.4817
        20        2.0000           -0.4520339             -12.3005
        21        2.0000           -0.4466654             -12.1544
        22        2.0000           -0.4256338             -11.5821
        23        2.0000           -0.3926993             -10.6859
        24        2.0000           -0.3905682             -10.6279 (HOMO)
        25                         -0.2938567              -7.9962 (LUMO)
        26                         -0.2523149              -6.8658
        27                         -0.2177354              -5.9249
        28                         -0.1818507              -4.9484
        29                         -0.1470664              -4.0019
        30                         -0.0213342              -0.5805
        31                         -0.0186154              -0.5066
        32                          0.0154557               0.4206
        33                          0.0363724               0.9897
        34                          0.0947270               2.5777
        35                          0.1102521               3.0001
       ...                                ...                  ...
        49                          0.7056963              19.2030
      -------------------------------------------------------------
                  HL-Gap            0.0967115 Eh            2.6317 eV
             Fermi-level           -0.3422125 Eh           -9.3121 eV

     #   Z        covCN         q      C6AA      α(0)
     1   6 C      3.983    -0.017    20.809     6.481
     2  16 S      2.433    -0.062   143.611    20.170
     3   6 C      3.072     0.016    27.570     8.609
     4   6 C      3.434    -0.036    24.104     7.475
     5   6 C      2.819     0.230    23.183     7.889
     6   8 O      0.858    -0.373    21.156     6.167
     7   6 C      3.809    -0.085    22.123     6.695
     8   6 C      2.891    -0.021    28.524     8.756
     9   6 C      2.837    -0.097    30.420     9.038
    10   1 H      0.925     0.066     2.133     2.284
    11   1 H      0.925     0.071     2.075     2.253
    12   1 H      0.926     0.067     2.119     2.277
    13   1 H      0.924     0.070     2.087     2.259
    14   1 H      0.924     0.050     2.320     2.382
    15   1 H      0.925     0.043     2.410     2.428
    16   1 H      0.926     0.036     2.499     2.472
    17   1 H      0.926     0.042     2.423     2.434

 Mol. C6AA /au·bohr⁶  :       4038.019454
 Mol. C8AA /au·bohr⁸  :     111737.399696
 Mol. α(0) /au        :        100.069659


Wiberg/Mayer (AO) data.
largest (>0.10) Wiberg bond orders for each atom
          total WBO             WBO to atom ...
     1  C   3.972        C    4 1.015    S    2 0.988    H   10 0.964    H   11 0.962
     2  S   2.381        C    3 1.160    C    1 0.988    C    4 0.108
     3  C   3.960        C    4 1.679    S    2 1.160    H   12 0.967
     4  C   3.974        C    3 1.679    C    5 1.086    C    1 1.015    S    2 0.108
     5  C   3.940        O    6 1.777    C    4 1.086    C    7 0.957
     6  O   2.063        C    5 1.777
     7  C   3.996        C    8 1.006    H   14 0.964    H   13 0.957    C    5 0.957
     8  C   3.989        C    9 1.968    C    7 1.006    H   15 0.967
     9  C   3.991        C    8 1.968    H   17 0.975    H   16 0.974
    10  H   0.996        C    1 0.964
    11  H   0.995        C    1 0.962
    12  H   0.996        C    3 0.967
    13  H   0.994        C    7 0.957
    14  H   0.998        C    7 0.964
    15  H   0.998        C    8 0.967
    16  H   0.999        C    9 0.974
    17  H   0.998        C    9 0.975

molecular dipole:
                 x           y           z       tot (Debye)
 q only:        0.446       1.062       0.302
   full:        0.251       1.187       0.285       3.168
molecular quadrupole (traceless):
                xx          xy          yy          xz          yz          zz
 q only:       -4.666      -5.057       5.042      -2.008      -0.057      -0.376
  q+dip:       -8.361      -6.424       7.709      -3.673      -0.583       0.652
   full:       -7.950      -6.923       6.892      -3.604      -0.910       1.057

           -------------------------------------------------
          |                Geometry Summary                 |
           -------------------------------------------------

      molecular mass/u    :      140.1996000
   center of mass at/Å    :       -0.6748125       1.3152717       0.5165949
  moments of inertia/u·Å² :        0.2297308E+03   0.5261433E+03   0.7053137E+03
rotational constants/cm⁻¹ :        0.7337995E-01   0.3204000E-01   0.2390090E-01

 * 14 selected distances

     #   Z        #   Z                                     value/Å
     2  16 S      3   6 C                                 1.7386948 (max)
     1   6 C      4   6 C                                 1.5042477
     3   6 C      4   6 C                                 1.3528249
     4   6 C      5   6 C                                 1.4507366
     5   6 C      6   8 O                                 1.2137670
     8   6 C      9   6 C                                 1.3199741
     1   6 C     10   1 H                                 1.0868353
     1   6 C     11   1 H                                 1.0863695
     3   6 C     12   1 H                                 1.0720981 (min)
     7   6 C     13   1 H                                 1.0920036
     7   6 C     14   1 H                                 1.0904700
     8   6 C     15   1 H                                 1.0817644
     9   6 C     16   1 H                                 1.0785827
     9   6 C     17   1 H                                 1.0764348

 * 4 distinct bonds (by element types)

   Z      Z             #   av. dist./Å        max./Å        min./Å
   1 H    6 C           8     1.0830698     1.0920036     1.0720981
   6 C    6 C           4     1.4069458     1.5042477     1.3199741
   6 C    8 O           1     1.2137670     1.2137670     1.2137670
   6 C   16 S           1     1.7386948     1.7386948     1.7386948


optimized geometry written to: xtbopt.xyz


           -------------------------------------------------
          | TOTAL ENERGY              -26.290738842808 Eh   |
          | GRADIENT NORM               0.000331210003 Eh/α |
          | HOMO-LUMO GAP               2.631655048559 eV   |
           -------------------------------------------------

------------------------------------------------------------------------
 * finished run on 2021/05/19 at 10:59:44.393     
------------------------------------------------------------------------
 total:
 * wall-time:     0 d,  0 h,  0 min,  0.401 sec
 *  cpu-time:     0 d,  0 h,  0 min,  0.400 sec
 * ratio c/w:     0.999 speedup
 SCF:
 * wall-time:     0 d,  0 h,  0 min,  0.022 sec
 *  cpu-time:     0 d,  0 h,  0 min,  0.022 sec
 * ratio c/w:     1.000 speedup
 ANC optimizer:
 * wall-time:     0 d,  0 h,  0 min,  0.361 sec
 *  cpu-time:     0 d,  0 h,  0 min,  0.361 sec
 * ratio c/w:     1.000 speedup

