      -----------------------------------------------------------      
     |                   =====================                   |     
     |                           x T B                           |     
     |                   =====================                   |     
     |                         S. Grimme                         |     
     |          Mulliken Center for Theoretical Chemistry        |     
     |                    University of Bonn                     |     
     |                Version 6.2 RC2 (SAW190805)                |     
      -----------------------------------------------------------      

   This program is distributed in the hope that it will be useful,
   but WITHOUT ANY WARRANTY; without even the implied warranty of
   MERCHANTABILITY or FITNESS FOR A PARTICULAR PURPOSE.
   
   FOR NON-COMMERCIAL, ACADEMIA USE ONLY.
   
   Cite this work as:
   * S. Grimme, C. Bannwarth, P. Shushkov, J. Chem. Theory Comput., 2017,
     13, 1989-2009. DOI: 10.1021/acs.jctc.7b00118
   * C. Bannwarth, S. Ehlert and S. Grimme., J. Chem. Theory Comput., 2019,
     15, 1652-1671. DOI: 10.1021/acs.jctc.8b01176
   * P. Pracht, E. Caldeweyher, S. Ehlert, S. Grimme, ChemRxiv, 2019, preprint.
     DOI: 10.26434/chemrxiv.8326202.v1
   
   for DFT-D4:
   * E. Caldeweyher, C. Bannwarth and S. Grimme, J. Chem. Phys., 2017,
     147, 034112. DOI: 10.1063/1.4993215
   * E. Caldeweyher, S. Ehlert, A. Hansen, H. Neugebauer, S. Spicher,
     C. Bannwarth and S. Grimme, J. Chem. Phys., 2019, 150, 154122.
     DOI: 10.1063/1.5090222
   
   for sTDA-xTB:
   * S. Grimme and C. Bannwarth, J. Chem. Phys., 2016, 145, 054103.
     DOI: 10.1063/1.4959605
   
   in the mass-spec context:
   * V. Asgeirsson, C. Bauer and S. Grimme, Chem. Sci., 2017, 8, 4879.
     DOI: 10.1039/c7sc00601b
   
   for metadynamics refer to:
   * S. Grimme, J. Chem. Theory Comput., 2019, 155, 2847-2862
     DOI: 10.1021/acs.jctc.9b00143
   
   with help from (in alphabetical order)
   C. Bannwarth, F. Bohle, G. Brandenburg, E. Caldeweyher, M. Checinski,
   S. Dohm, S. Ehlert, S. Ehrlich, F. März, H. Neugebauer, J. Pisarek,
   P. Pracht, P. Shushkov, and S. Spicher.
   
 * started run on 2021/05/19 at 10:59:44.729     

           -------------------------------------------------
          |                Calculation Setup                |
           -------------------------------------------------

          program call               : /ihome/ghutchison/geoffh/xtb/xtb 299.xyz -opt
          hostname                   : smp-n83
          coordinate file            : 299.xyz
          omp threads                :                     1
          number of atoms            :                    14
          number of electrons        :                    42
          charge                     :                     0
          spin                       :                   0.0
          first test random number   :      0.58561310068570


########################################################################
# WARNING! Please study the warnings concerning your input carefully
#  - the use of '-opt' is discouraged, please use '--opt' next time
########################################################################

           ------------------------------------------------- 
          |                 G F N 2 - x T B                 |
          | Geometry, Frequencies, Noncovalent interactions |
          |            JCTC 2019 parametrisation            |
           ------------------------------------------------- 
             KAB for C  - Si     :                1.0500
             KAB for H  - Pd     :                0.9500
             k(s)              :                1.8500
             k(p)              :                2.2300
             k(d)              :                2.2300
             k(f)              :                2.0000
             kEN (H0ij)        :               -2.0000
             D4 a1             :                0.5200
             D4 a2             :                5.0000
             D4 s6             :                1.0000
             D4 s8             :                2.7000
             D4 s9             :                5.0000
             alphaj            :                2.0000

  Z AO/shell   Hii/eV     exponent
  1     Wed Apr 25 08:07:45 CEST 2018   EN: 2.200 GM2: 0.406  GM3: 0.0800  RAES: 1.40
     1s    -10.707211    1.230000
  6     Wed Apr 25 08:07:45 CEST 2018   EN: 2.550 GM2: 0.538  GM3: 0.1500  RAES: 3.00
     2s    -13.970922    2.096432
     2p    -10.063292    1.800000
  8     Wed Apr 25 08:07:45 CEST 2018   EN: 3.440 GM2: 0.452  GM3:-0.0517  RAES: 1.80
     2s    -20.229985    2.439742
     2p    -15.503117    2.137023
 16     Tue Apr 24 11:44:34 CEST 2018   EN: 2.580 GM2: 0.340  GM3:-0.0502  RAES: 3.10
     3s    -20.029654    1.981333
     3p    -11.377694    2.025643
     3d     -0.420282    1.702555

           ------------------------------------------------- 
          |        Self-Consistent Charge Iterations        |
           ------------------------------------------------- 

          ...................................................
          :                      SETUP                      :
          :.................................................:
          :  # basis functions                  44          :
          :  # atomic orbitals                  43          :
          :  # shells                           23          :
          :  # electrons                        42          :
          :  max. iterations                   250          :
          :  Hamiltonian                  GFN2-xTB          :
          :  restarted?                      false          :
          :  GBSA solvation                  false          :
          :  PC potential                    false          :
          :  electronic temp.          300.0000000     K    :
          :  accuracy                    1.0000000          :
          :  -> integral cutoff          0.2500000E+02      :
          :  -> integral neglect         0.1000000E-07      :
          :  -> SCF convergence          0.1000000E-05 Eh   :
          :  -> wf. convergence          0.1000000E-03 e    :
          :  Broyden damping             0.4000000          :
          ...................................................

 iter      E             dE          RMSdq      gap      omega  full diag
   1    -23.4410628 -0.234411E+02  0.488E+00    3.22       0.0  T
   2    -23.4725652 -0.315025E-01  0.251E+00    2.66       1.0  T
   3    -23.4723541  0.211120E-03  0.162E+00    3.08       1.0  T
   4    -23.4800796 -0.772550E-02  0.375E-01    2.82       1.0  T
   5    -23.4808429 -0.763253E-03  0.183E-01    2.85       1.0  T
   6    -23.4810586 -0.215767E-03  0.580E-02    2.85       1.0  T
   7    -23.4810807 -0.220840E-04  0.270E-02    2.85       1.0  T
   8    -23.4810818 -0.108512E-05  0.131E-02    2.85       2.0  T
   9    -23.4810827 -0.888232E-06  0.513E-03    2.85       5.2  T
  10    -23.4810828 -0.785595E-07  0.223E-03    2.85      12.0  T
  11    -23.4810828 -0.306122E-07  0.996E-04    2.85      26.8  T
  12    -23.4810828 -0.314155E-08  0.468E-04    2.85      57.1  T

   *** convergence criteria satisfied after 12 iterations ***

         #    Occupation            Energy/Eh            Energy/eV
      -------------------------------------------------------------
         1        2.0000           -0.7422517             -20.1977
       ...           ...                  ...                  ...
        15        2.0000           -0.4729328             -12.8692
        16        2.0000           -0.4723103             -12.8522
        17        2.0000           -0.4708092             -12.8114
        18        2.0000           -0.4632905             -12.6068
        19        2.0000           -0.4113701             -11.1939
        20        2.0000           -0.4092495             -11.1362
        21        2.0000           -0.3981827             -10.8351 (HOMO)
        22                         -0.2934591              -7.9854 (LUMO)
        23                         -0.2218559              -6.0370
        24                         -0.2038242              -5.5463
        25                         -0.1735374              -4.7222
        26                         -0.1265497              -3.4436
       ...                                ...                  ...
        43                          0.6677947              18.1716
      -------------------------------------------------------------
                  HL-Gap            0.1047235 Eh            2.8497 eV
             Fermi-level           -0.3458209 Eh           -9.4103 eV

 SCC (total)                   0 d,  0 h,  0 min,  0.018 sec
 SCC setup                      ...        0 min,  0.000 sec (  1.153%)
 Dispersion                     ...        0 min,  0.000 sec (  0.728%)
 integral evaluation            ...        0 min,  0.004 sec ( 21.734%)
 zeroth order Hamiltonian       ...        0 min,  0.000 sec (  0.463%)
 iterations                     ...        0 min,  0.008 sec ( 41.750%)
 molecular gradient             ...        0 min,  0.006 sec ( 32.238%)
 printout                       ...        0 min,  0.000 sec (  1.666%)

         :::::::::::::::::::::::::::::::::::::::::::::::::::::
         ::                     SUMMARY                     ::
         :::::::::::::::::::::::::::::::::::::::::::::::::::::
         :: total energy             -23.183318750356 Eh    ::
         :: gradient norm              0.050475084951 Eh/a0 ::
         :: HOMO-LUMO gap              2.849672223947 eV    ::
         ::.................................................::
         :: SCC energy               -23.481082817200 Eh    ::
         :: -> isotropic ES            0.029417478067 Eh    ::
         :: -> anisotropic ES          0.002988876264 Eh    ::
         :: -> anisotropic XC          0.009455254276 Eh    ::
         :: -> dispersion             -0.011511938568 Eh    ::
         :: repulsion energy           0.297753363697 Eh    ::
         :: add. restraining           0.000000000000 Eh    ::
         :::::::::::::::::::::::::::::::::::::::::::::::::::::

      ----------------------------------------------------------- 
     |                   =====================                   |
     |                        A N C O P T                        |
     |                   =====================                   |
     |               Approximate Normal Coordinate               |
     |                Rational Function Optimizer                |
      ----------------------------------------------------------- 

          ...................................................
          :                      SETUP                      :
          :.................................................:
          :   optimization level            normal          :
          :   max. optcycles                   200          :
          :   ANC micro-cycles                  20          :
          :   degrees of freedom                36          :
          :.................................................:
          :   RF solver                   davidson          :
          :   input Hessian                  false          :
          :   write xtbopt.log                true          :
          :   linear?                        false          :
          :   energy convergence         0.5000000E-05 Eh   :
          :   grad. convergence          0.1000000E-02 Eh/α :
          :   maximium RF displ.         2.0000000          :
          :   Hlow (freq-cutoff)         0.5000000E-02      :
          :   Hmax (freq-cutoff)         5.0000000          :
          :   S6 in model hess.         20.0000000          :
          ...................................................

generating ANC from model Hessian ...
Using Lindh-Hessian (1995)
 Shifting diagonal of input Hessian by   2.348387938534370E-003
 Lowest  eigenvalues of input Hessian
   -0.000000   -0.000000   -0.000000   -0.000000    0.000000    0.000000
    0.005000    0.008317    0.011061    0.016161    0.020569    0.039625
    0.040914    0.050375    0.056153    0.068750    0.083041    0.095331
 Highest eigenvalues
    1.393836    1.574829    1.625420    1.768615    1.809822    2.103889
 

........................................................................
.............................. CYCLE    1 ..............................
........................................................................
   1    -23.4810828 -0.234811E+02  0.153E-04    2.85       0.0  T
   2    -23.4810828 -0.109420E-09  0.845E-05    2.85     316.3  T
   3    -23.4810828 -0.492903E-10  0.485E-05    2.85     550.8  T
     SCC iter.                  ...        0 min,  0.002 sec
     gradient                   ...        0 min,  0.006 sec
 * total energy  :   -23.1833188 Eh     change       -0.1129911E-07 Eh
   gradient norm :     0.0504739 Eh/α   predicted     0.0000000E+00 (-100.00%)
   displ. norm   :     0.1548955 α      lambda       -0.3981710E-02
   maximum displ.:     0.0995708 α      in ANC's #15, #11, #6, ...

........................................................................
.............................. CYCLE    2 ..............................
........................................................................
   1    -23.4997327 -0.234997E+02  0.258E-01    2.88       0.0  T
   2    -23.4997665 -0.337454E-04  0.132E-01    2.89       1.0  T
   3    -23.4997580  0.846647E-05  0.506E-02    2.90       1.0  T
   4    -23.4997725 -0.145115E-04  0.249E-02    2.90       1.1  T
   5    -23.4997736 -0.109095E-05  0.104E-02    2.90       2.6  T
   6    -23.4997744 -0.807127E-06  0.356E-03    2.90       7.5  T
   7    -23.4997745 -0.702851E-07  0.168E-03    2.90      15.9  T
     SCC iter.                  ...        0 min,  0.004 sec
     gradient                   ...        0 min,  0.006 sec
 * total energy  :   -23.1857648 Eh     change       -0.2446037E-02 Eh
   gradient norm :     0.0152123 Eh/α   predicted    -0.2038624E-02 ( -16.66%)
   displ. norm   :     0.0566440 α      lambda       -0.4002403E-03
   maximum displ.:     0.0308166 α      in ANC's #6, #11, #15, ...

........................................................................
.............................. CYCLE    3 ..............................
........................................................................
   1    -23.5040057 -0.235040E+02  0.110E-01    2.91       0.0  T
   2    -23.5040119 -0.611826E-05  0.648E-02    2.92       1.0  T
   3    -23.5040047  0.719426E-05  0.339E-02    2.92       1.0  T
   4    -23.5040140 -0.932581E-05  0.121E-02    2.92       2.2  T
   5    -23.5040146 -0.622190E-06  0.507E-03    2.92       5.3  T
   6    -23.5040148 -0.171180E-06  0.173E-03    2.92      15.4  T
   7    -23.5040148 -0.120200E-07  0.890E-04    2.92      30.0  T
     SCC iter.                  ...        0 min,  0.004 sec
     gradient                   ...        0 min,  0.006 sec
 * total energy  :   -23.1860026 Eh     change       -0.2377862E-03 Eh
   gradient norm :     0.0044746 Eh/α   predicted    -0.2007624E-03 ( -15.57%)
   displ. norm   :     0.0392330 α      lambda       -0.6600384E-04
   maximum displ.:     0.0241304 α      in ANC's #3, #6, #9, ...

........................................................................
.............................. CYCLE    4 ..............................
........................................................................
   1    -23.5038088 -0.235038E+02  0.558E-02    2.92       0.0  T
   2    -23.5038099 -0.116208E-05  0.340E-02    2.93       1.0  T
   3    -23.5038071  0.277247E-05  0.192E-02    2.93       1.4  T
   4    -23.5038106 -0.343046E-05  0.519E-03    2.93       5.2  T
   5    -23.5038107 -0.139141E-06  0.208E-03    2.93      12.9  T
   6    -23.5038107 -0.311687E-07  0.898E-04    2.93      29.8  T
     SCC iter.                  ...        0 min,  0.003 sec
     gradient                   ...        0 min,  0.006 sec
 * total energy  :   -23.1860453 Eh     change       -0.4271454E-04 Eh
   gradient norm :     0.0019711 Eh/α   predicted    -0.3305166E-04 ( -22.62%)
   displ. norm   :     0.0507060 α      lambda       -0.2033969E-04
   maximum displ.:     0.0309887 α      in ANC's #3, #4, #2, ...

........................................................................
.............................. CYCLE    5 ..............................
........................................................................
   1    -23.5027810 -0.235028E+02  0.519E-02    2.93       0.0  T
   2    -23.5027819 -0.867274E-06  0.307E-02    2.94       1.0  T
   3    -23.5027800  0.185588E-05  0.154E-02    2.94       1.7  T
   4    -23.5027822 -0.218254E-05  0.486E-03    2.94       5.5  T
   5    -23.5027823 -0.117744E-06  0.181E-03    2.94      14.8  T
   6    -23.5027824 -0.230476E-07  0.865E-04    2.94      30.9  T
   7    -23.5027824 -0.173918E-08  0.386E-04    2.94      69.2  T
     SCC iter.                  ...        0 min,  0.004 sec
     gradient                   ...        0 min,  0.006 sec
 * total energy  :   -23.1860532 Eh     change       -0.7889289E-05 Eh
   gradient norm :     0.0014855 Eh/α   predicted    -0.1018090E-04 (  29.05%)
   displ. norm   :     0.0142197 α      lambda       -0.7695443E-05
   maximum displ.:     0.0091670 α      in ANC's #2, #7, #14, ...

........................................................................
.............................. CYCLE    6 ..............................
........................................................................
   1    -23.5028684 -0.235029E+02  0.273E-02    2.94       0.0  T
   2    -23.5028686 -0.169661E-06  0.143E-02    2.94       1.9  T
   3    -23.5028684  0.173864E-06  0.514E-03    2.94       5.2  T
   4    -23.5028686 -0.233649E-06  0.240E-03    2.94      11.1  T
   5    -23.5028686 -0.139369E-07  0.878E-04    2.94      30.4  T
   6    -23.5028686 -0.575894E-08  0.204E-04    2.94     130.9  T
     SCC iter.                  ...        0 min,  0.003 sec
     gradient                   ...        0 min,  0.006 sec
 * total energy  :   -23.1860587 Eh     change       -0.5500455E-05 Eh
   gradient norm :     0.0006438 Eh/α   predicted    -0.3848548E-05 ( -30.03%)
   displ. norm   :     0.0217540 α      lambda       -0.3898656E-05
   maximum displ.:     0.0141063 α      in ANC's #2, #4, #3, ...

........................................................................
.............................. CYCLE    7 ..............................
........................................................................
   1    -23.5031711 -0.235032E+02  0.186E-02    2.94       0.0  T
   2    -23.5031712 -0.681377E-07  0.111E-02    2.94       2.4  T
   3    -23.5031710  0.213192E-06  0.458E-03    2.93       5.8  T
   4    -23.5031712 -0.240654E-06  0.127E-03    2.94      21.0  T
   5    -23.5031712 -0.858465E-08  0.503E-04    2.93      53.2  T
   6    -23.5031712 -0.142494E-08  0.203E-04    2.94     131.3  T
     SCC iter.                  ...        0 min,  0.003 sec
     gradient                   ...        0 min,  0.006 sec
 * total energy  :   -23.1860629 Eh     change       -0.4200725E-05 Eh
   gradient norm :     0.0004882 Eh/α   predicted    -0.1950443E-05 ( -53.57%)
   displ. norm   :     0.0615797 α      lambda       -0.7003807E-05
   maximum displ.:     0.0428865 α      in ANC's #2, #4, #1, ...

   *** GEOMETRY OPTIMIZATION CONVERGED AFTER 7 ITERATIONS ***

------------------------------------------------------------------------
 total energy gain   :        -0.0027441 Eh       -1.7220 kcal/mol
 total RMSD          :         0.0621391 a0        0.0329 Å
 total power (kW/mol):        -1.0292482 (step)  -74.6451 (real)
------------------------------------------------------------------------

 ANCopt (total)                0 d,  0 h,  0 min,  0.097 sec
 optimizer setup                ...        0 min,  0.000 sec (  0.147%)
 model hessian                  ...        0 min,  0.001 sec (  1.306%)
 ANC generation                 ...        0 min,  0.000 sec (  0.369%)
 coordinate transformation      ...        0 min,  0.000 sec (  0.083%)
 single point calculation       ...        0 min,  0.092 sec ( 95.789%)
 optimization log               ...        0 min,  0.001 sec (  0.520%)
 hessian update                 ...        0 min,  0.000 sec (  0.076%)
 rational function              ...        0 min,  0.001 sec (  1.199%)

================
 final structure:
================
$coord
    2.71223214272752    1.27149891725973    0.02126651777632      C 
    0.35395622105165    2.35710141980373    0.00109239262636      C 
   -0.47707236972507    4.98374713063516   -0.00884444825664      C 
   -2.71136323210722    5.50420113254972    0.00712769766458      O 
    1.52949954240366    7.01395018362340   -0.03608381430775      C 
   -1.99914323471971    0.06425526706044   -0.00856429040933      S 
    0.21456943264397   -2.28461501114878    0.01115385928140      C 
    2.62772192808087   -1.37918092313693    0.02791185383346      C 
    4.45352618723585    2.31739216545391    0.03577724660276      H 
    3.43007778232154    6.26404951419468   -0.16668949681536      H 
    1.34622499719592    8.13204313582269    1.68088913504061      H 
    1.16869173125122    8.26814633151791   -1.62594990403161      H 
   -0.37980026660062   -4.22190820538091    0.00924304387017      H 
    4.27877463926780   -2.56380571973395    0.04252393353044      H 
$end
           -------------------------------------------------
          |                Final Singlepoint                |
           -------------------------------------------------

          ...................................................
          :                      SETUP                      :
          :.................................................:
          :  # basis functions                  44          :
          :  # atomic orbitals                  43          :
          :  # shells                           23          :
          :  # electrons                        42          :
          :  max. iterations                   250          :
          :  Hamiltonian                  GFN2-xTB          :
          :  restarted?                      false          :
          :  GBSA solvation                  false          :
          :  PC potential                    false          :
          :  electronic temp.          300.0000000     K    :
          :  accuracy                    1.0000000          :
          :  -> integral cutoff          0.2500000E+02      :
          :  -> integral neglect         0.1000000E-07      :
          :  -> SCF convergence          0.1000000E-05 Eh   :
          :  -> wf. convergence          0.1000000E-03 e    :
          :  Broyden damping             0.4000000          :
          ...................................................

 iter      E             dE          RMSdq      gap      omega  full diag
   1    -23.5031712 -0.235032E+02  0.998E-05    2.94       0.0  T
   2    -23.5031712 -0.213980E-10  0.448E-05    2.94     596.0  T
   3    -23.5031712 -0.153939E-10  0.372E-05    2.94     718.4  T

   *** convergence criteria satisfied after 3 iterations ***

         #    Occupation            Energy/Eh            Energy/eV
      -------------------------------------------------------------
         1        2.0000           -0.7392462             -20.1159
       ...           ...                  ...                  ...
        15        2.0000           -0.4745170             -12.9123
        16        2.0000           -0.4727785             -12.8650
        17        2.0000           -0.4698352             -12.7849
        18        2.0000           -0.4630111             -12.5992
        19        2.0000           -0.4108878             -11.1808
        20        2.0000           -0.4070263             -11.0758
        21        2.0000           -0.3983136             -10.8387 (HOMO)
        22                         -0.2904541              -7.9037 (LUMO)
        23                         -0.2167760              -5.8988
        24                         -0.2049382              -5.5767
        25                         -0.1656073              -4.5064
        26                         -0.1227615              -3.3405
       ...                                ...                  ...
        43                          0.6828306              18.5808
      -------------------------------------------------------------
                  HL-Gap            0.1078595 Eh            2.9350 eV
             Fermi-level           -0.3443839 Eh           -9.3712 eV

 SCC (total)                   0 d,  0 h,  0 min,  0.012 sec
 SCC setup                      ...        0 min,  0.000 sec (  1.068%)
 Dispersion                     ...        0 min,  0.000 sec (  0.642%)
 integral evaluation            ...        0 min,  0.004 sec ( 30.630%)
 zeroth order Hamiltonian       ...        0 min,  0.000 sec (  0.567%)
 iterations                     ...        0 min,  0.002 sec ( 17.193%)
 molecular gradient             ...        0 min,  0.006 sec ( 47.599%)
 printout                       ...        0 min,  0.000 sec (  1.928%)

         :::::::::::::::::::::::::::::::::::::::::::::::::::::
         ::                     SUMMARY                     ::
         :::::::::::::::::::::::::::::::::::::::::::::::::::::
         :: total energy             -23.186062893443 Eh    ::
         :: gradient norm              0.000487992356 Eh/a0 ::
         :: HOMO-LUMO gap              2.935006556785 eV    ::
         ::.................................................::
         :: SCC energy               -23.503171220330 Eh    ::
         :: -> isotropic ES            0.028462547808 Eh    ::
         :: -> anisotropic ES          0.002814284950 Eh    ::
         :: -> anisotropic XC          0.008809772768 Eh    ::
         :: -> dispersion             -0.011570614053 Eh    ::
         :: repulsion energy           0.317097295487 Eh    ::
         :: add. restraining           0.000000000000 Eh    ::
         :::::::::::::::::::::::::::::::::::::::::::::::::::::

           -------------------------------------------------
          |                Property Printout                |
           -------------------------------------------------

    * Orbital Energies and Occupations

         #    Occupation            Energy/Eh            Energy/eV
      -------------------------------------------------------------
         1        2.0000           -0.7392462             -20.1159
       ...           ...                  ...                  ...
         9        2.0000           -0.5518898             -15.0177
        10        2.0000           -0.5406885             -14.7129
        11        2.0000           -0.5189743             -14.1220
        12        2.0000           -0.5071323             -13.7998
        13        2.0000           -0.4933465             -13.4246
        14        2.0000           -0.4840070             -13.1705
        15        2.0000           -0.4745170             -12.9123
        16        2.0000           -0.4727785             -12.8650
        17        2.0000           -0.4698352             -12.7849
        18        2.0000           -0.4630111             -12.5992
        19        2.0000           -0.4108878             -11.1808
        20        2.0000           -0.4070263             -11.0758
        21        2.0000           -0.3983136             -10.8387 (HOMO)
        22                         -0.2904541              -7.9037 (LUMO)
        23                         -0.2167760              -5.8988
        24                         -0.2049382              -5.5767
        25                         -0.1656073              -4.5064
        26                         -0.1227615              -3.3405
        27                         -0.0075390              -0.2051
        28                          0.0255671               0.6957
        29                          0.0316846               0.8622
        30                          0.1024742               2.7885
        31                          0.1134392               3.0868
        32                          0.1419247               3.8620
       ...                                ...                  ...
        43                          0.6828306              18.5808
      -------------------------------------------------------------
                  HL-Gap            0.1078595 Eh            2.9350 eV
             Fermi-level           -0.3443839 Eh           -9.3712 eV

     #   Z        covCN         q      C6AA      α(0)
     1   6 C      3.107    -0.039    28.812     8.795
     2   6 C      2.992    -0.015    28.380     8.739
     3   6 C      2.861     0.232    23.148     7.886
     4   8 O      0.859    -0.374    21.166     6.168
     5   6 C      3.754    -0.137    23.190     6.867
     6  16 S      2.337     0.056   138.771    19.827
     7   6 C      2.944    -0.021    28.529     8.760
     8   6 C      3.108    -0.044    28.944     8.815
     9   1 H      0.926     0.044     2.390     2.418
    10   1 H      0.925     0.049     2.327     2.385
    11   1 H      0.925     0.073     2.048     2.238
    12   1 H      0.925     0.073     2.048     2.238
    13   1 H      0.926     0.055     2.256     2.349
    14   1 H      0.926     0.045     2.382     2.413

 Mol. C6AA /au·bohr⁶  :       3167.193667
 Mol. C8AA /au·bohr⁸  :      90385.414547
 Mol. α(0) /au        :         89.897606


Wiberg/Mayer (AO) data.
largest (>0.10) Wiberg bond orders for each atom
          total WBO             WBO to atom ...
     1  C   3.990        C    2 1.506    C    8 1.324    H    9 0.961    S    6 0.102
     2  C   3.947        C    1 1.506    S    6 1.147    C    3 1.085
     3  C   3.939        O    4 1.784    C    2 1.085    C    5 0.994
     4  O   2.063        C    3 1.784
     5  C   3.994        C    3 0.994    H   10 0.984    H   12 0.963    H   11 0.960
     6  S   2.698        C    7 1.255    C    2 1.147    C    1 0.102
     7  C   3.957        C    8 1.571    S    6 1.255    H   13 0.970
     8  C   3.988        C    7 1.571    C    1 1.324    H   14 0.965
     9  H   0.998        C    1 0.961
    10  H   0.998        C    5 0.984
    11  H   0.994        C    5 0.960
    12  H   0.994        C    5 0.963
    13  H   0.997        C    7 0.970
    14  H   0.997        C    8 0.965

molecular dipole:
                 x           y           z       tot (Debye)
 q only:        1.075      -0.565      -0.003
   full:        1.469      -0.548       0.002       3.984
molecular quadrupole (traceless):
                xx          xy          yy          xz          yz          zz
 q only:       -1.402       9.311       0.924       0.037      -0.041       0.478
  q+dip:       -2.018      10.729       2.526       0.073      -0.024      -0.508
   full:       -3.094      10.829       1.839       0.063      -0.015       1.255

           -------------------------------------------------
          |                Geometry Summary                 |
           -------------------------------------------------

      molecular mass/u    :      126.1728000
   center of mass at/Å    :       -0.0396542       1.0575141       0.0000554
  moments of inertia/u·Å² :        0.1400949E+03   0.3530311E+03   0.4900108E+03
rotational constants/cm⁻¹ :        0.1203301E+00   0.4775113E-01   0.3440257E-01

 * 12 selected distances

     #   Z        #   Z                                     value/Å
     1   6 C      2   6 C                                 1.3738654
     3   6 C      4   8 O                                 1.2140188
     2   6 C      6  16 S                                 1.7385961 (max)
     6  16 S      7   6 C                                 1.7080301
     1   6 C      8   6 C                                 1.4033966
     7   6 C      8   6 C                                 1.3639431
     1   6 C      9   1 H                                 1.0749215
     5   6 C     10   1 H                                 1.0834065
     5   6 C     11   1 H                                 1.0885779
     5   6 C     12   1 H                                 1.0884682
     7   6 C     13   1 H                                 1.0723362 (min)
     8   6 C     14   1 H                                 1.0753534

 * 4 distinct bonds (by element types)

   Z      Z             #   av. dist./Å        max./Å        min./Å
   1 H    6 C           6     1.0805106     1.0885779     1.0723362
   6 C    6 C           3     1.3804017     1.4033966     1.3639431
   6 C    8 O           1     1.2140188     1.2140188     1.2140188
   6 C   16 S           2     1.7233131     1.7385961     1.7080301


optimized geometry written to: xtbopt.xyz


           -------------------------------------------------
          | TOTAL ENERGY              -23.186062893443 Eh   |
          | GRADIENT NORM               0.000487992356 Eh/α |
          | HOMO-LUMO GAP               2.935006556785 eV   |
           -------------------------------------------------

------------------------------------------------------------------------
 * finished run on 2021/05/19 at 10:59:44.872     
------------------------------------------------------------------------
 total:
 * wall-time:     0 d,  0 h,  0 min,  0.143 sec
 *  cpu-time:     0 d,  0 h,  0 min,  0.143 sec
 * ratio c/w:     0.997 speedup
 SCF:
 * wall-time:     0 d,  0 h,  0 min,  0.018 sec
 *  cpu-time:     0 d,  0 h,  0 min,  0.018 sec
 * ratio c/w:     1.000 speedup
 ANC optimizer:
 * wall-time:     0 d,  0 h,  0 min,  0.109 sec
 *  cpu-time:     0 d,  0 h,  0 min,  0.109 sec
 * ratio c/w:     0.999 speedup

