      -----------------------------------------------------------      
     |                   =====================                   |     
     |                           x T B                           |     
     |                   =====================                   |     
     |                         S. Grimme                         |     
     |          Mulliken Center for Theoretical Chemistry        |     
     |                    University of Bonn                     |     
     |                Version 6.2 RC2 (SAW190805)                |     
      -----------------------------------------------------------      

   This program is distributed in the hope that it will be useful,
   but WITHOUT ANY WARRANTY; without even the implied warranty of
   MERCHANTABILITY or FITNESS FOR A PARTICULAR PURPOSE.
   
   FOR NON-COMMERCIAL, ACADEMIA USE ONLY.
   
   Cite this work as:
   * S. Grimme, C. Bannwarth, P. Shushkov, J. Chem. Theory Comput., 2017,
     13, 1989-2009. DOI: 10.1021/acs.jctc.7b00118
   * C. Bannwarth, S. Ehlert and S. Grimme., J. Chem. Theory Comput., 2019,
     15, 1652-1671. DOI: 10.1021/acs.jctc.8b01176
   * P. Pracht, E. Caldeweyher, S. Ehlert, S. Grimme, ChemRxiv, 2019, preprint.
     DOI: 10.26434/chemrxiv.8326202.v1
   
   for DFT-D4:
   * E. Caldeweyher, C. Bannwarth and S. Grimme, J. Chem. Phys., 2017,
     147, 034112. DOI: 10.1063/1.4993215
   * E. Caldeweyher, S. Ehlert, A. Hansen, H. Neugebauer, S. Spicher,
     C. Bannwarth and S. Grimme, J. Chem. Phys., 2019, 150, 154122.
     DOI: 10.1063/1.5090222
   
   for sTDA-xTB:
   * S. Grimme and C. Bannwarth, J. Chem. Phys., 2016, 145, 054103.
     DOI: 10.1063/1.4959605
   
   in the mass-spec context:
   * V. Asgeirsson, C. Bauer and S. Grimme, Chem. Sci., 2017, 8, 4879.
     DOI: 10.1039/c7sc00601b
   
   for metadynamics refer to:
   * S. Grimme, J. Chem. Theory Comput., 2019, 155, 2847-2862
     DOI: 10.1021/acs.jctc.9b00143
   
   with help from (in alphabetical order)
   C. Bannwarth, F. Bohle, G. Brandenburg, E. Caldeweyher, M. Checinski,
   S. Dohm, S. Ehlert, S. Ehrlich, F. März, H. Neugebauer, J. Pisarek,
   P. Pracht, P. Shushkov, and S. Spicher.
   
 * started run on 2021/05/19 at 10:58:18.099     

           -------------------------------------------------
          |                Calculation Setup                |
           -------------------------------------------------

          program call               : /ihome/ghutchison/geoffh/xtb/xtb 3.xyz -opt
          hostname                   : smp-n58
          coordinate file            : 3.xyz
          omp threads                :                     1
          number of atoms            :                    26
          number of electrons        :                    70
          charge                     :                     0
          spin                       :                   0.0
          first test random number   :      0.50347995841680


########################################################################
# WARNING! Please study the warnings concerning your input carefully
#  - the use of '-opt' is discouraged, please use '--opt' next time
########################################################################

           ------------------------------------------------- 
          |                 G F N 2 - x T B                 |
          | Geometry, Frequencies, Noncovalent interactions |
          |            JCTC 2019 parametrisation            |
           ------------------------------------------------- 
             KAB for C  - Si     :                1.0500
             KAB for H  - Pd     :                0.9500
             k(s)              :                1.8500
             k(p)              :                2.2300
             k(d)              :                2.2300
             k(f)              :                2.0000
             kEN (H0ij)        :               -2.0000
             D4 a1             :                0.5200
             D4 a2             :                5.0000
             D4 s6             :                1.0000
             D4 s8             :                2.7000
             D4 s9             :                5.0000
             alphaj            :                2.0000

  Z AO/shell   Hii/eV     exponent
  1     Wed Apr 25 08:07:45 CEST 2018   EN: 2.200 GM2: 0.406  GM3: 0.0800  RAES: 1.40
     1s    -10.707211    1.230000
  6     Wed Apr 25 08:07:45 CEST 2018   EN: 2.550 GM2: 0.538  GM3: 0.1500  RAES: 3.00
     2s    -13.970922    2.096432
     2p    -10.063292    1.800000
 16     Tue Apr 24 11:44:34 CEST 2018   EN: 2.580 GM2: 0.340  GM3:-0.0502  RAES: 3.10
     3s    -20.029654    1.981333
     3p    -11.377694    2.025643
     3d     -0.420282    1.702555

           ------------------------------------------------- 
          |        Self-Consistent Charge Iterations        |
           ------------------------------------------------- 

          ...................................................
          :                      SETUP                      :
          :.................................................:
          :  # basis functions                  74          :
          :  # atomic orbitals                  73          :
          :  # shells                           41          :
          :  # electrons                        70          :
          :  max. iterations                   250          :
          :  Hamiltonian                  GFN2-xTB          :
          :  restarted?                      false          :
          :  GBSA solvation                  false          :
          :  PC potential                    false          :
          :  electronic temp.          300.0000000     K    :
          :  accuracy                    1.0000000          :
          :  -> integral cutoff          0.2500000E+02      :
          :  -> integral neglect         0.1000000E-07      :
          :  -> SCF convergence          0.1000000E-05 Eh   :
          :  -> wf. convergence          0.1000000E-03 e    :
          :  Broyden damping             0.4000000          :
          ...................................................

 iter      E             dE          RMSdq      gap      omega  full diag
   1    -37.7164148 -0.377164E+02  0.448E+00    1.87       0.0  T
   2    -37.7387732 -0.223584E-01  0.262E+00    1.92       1.0  T
   3    -37.7253082  0.134650E-01  0.969E-01    1.93       1.0  T
   4    -37.7342819 -0.897376E-02  0.604E-01    1.91       1.0  T
   5    -37.7413564 -0.707444E-02  0.203E-01    1.91       1.0  T
   6    -37.7422050 -0.848602E-03  0.688E-02    1.90       1.0  T
   7    -37.7422465 -0.414836E-04  0.406E-02    1.91       1.0  T
   8    -37.7422700 -0.234970E-04  0.140E-02    1.91       1.4  T
   9    -37.7422706 -0.624174E-06  0.617E-03    1.91       3.2  T
  10    -37.7422707 -0.114527E-06  0.373E-03    1.91       5.3  T
  11    -37.7422709 -0.160659E-06  0.154E-03    1.91      12.7  T
  12    -37.7422709 -0.253653E-07  0.661E-04    1.91      29.7  T
  13    -37.7422709 -0.266098E-08  0.346E-04    1.91      56.6  T

   *** convergence criteria satisfied after 13 iterations ***

         #    Occupation            Energy/Eh            Energy/eV
      -------------------------------------------------------------
         1        2.0000           -0.7270683             -19.7845
       ...           ...                  ...                  ...
        29        2.0000           -0.4292875             -11.6815
        30        2.0000           -0.4244934             -11.5511
        31        2.0000           -0.4185277             -11.3887
        32        2.0000           -0.4049784             -11.0200
        33        2.0000           -0.4019296             -10.9371
        34        2.0000           -0.3845071             -10.4630
        35        2.0000           -0.3494955              -9.5103 (HOMO)
        36                         -0.2794694              -7.6047 (LUMO)
        37                         -0.2238315              -6.0908
        38                         -0.2117454              -5.7619
        39                         -0.1990021              -5.4151
        40                         -0.1913960              -5.2081
       ...                                ...                  ...
        73                          0.7455370              20.2871
      -------------------------------------------------------------
                  HL-Gap            0.0700262 Eh            1.9055 eV
             Fermi-level           -0.3144824 Eh           -8.5575 eV

 SCC (total)                   0 d,  0 h,  0 min,  0.041 sec
 SCC setup                      ...        0 min,  0.000 sec (  0.727%)
 Dispersion                     ...        0 min,  0.000 sec (  0.895%)
 integral evaluation            ...        0 min,  0.010 sec ( 23.618%)
 zeroth order Hamiltonian       ...        0 min,  0.000 sec (  0.415%)
 iterations                     ...        0 min,  0.015 sec ( 37.237%)
 molecular gradient             ...        0 min,  0.015 sec ( 36.058%)
 printout                       ...        0 min,  0.000 sec (  0.937%)

         :::::::::::::::::::::::::::::::::::::::::::::::::::::
         ::                     SUMMARY                     ::
         :::::::::::::::::::::::::::::::::::::::::::::::::::::
         :: total energy             -37.115544061291 Eh    ::
         :: gradient norm              0.106783848760 Eh/a0 ::
         :: HOMO-LUMO gap              1.905508781649 eV    ::
         ::.................................................::
         :: SCC energy               -37.742270888117 Eh    ::
         :: -> isotropic ES            0.003220426400 Eh    ::
         :: -> anisotropic ES          0.005185939688 Eh    ::
         :: -> anisotropic XC          0.024828192691 Eh    ::
         :: -> dispersion             -0.027686767693 Eh    ::
         :: repulsion energy           0.626691105481 Eh    ::
         :: add. restraining           0.000000000000 Eh    ::
         :::::::::::::::::::::::::::::::::::::::::::::::::::::

      ----------------------------------------------------------- 
     |                   =====================                   |
     |                        A N C O P T                        |
     |                   =====================                   |
     |               Approximate Normal Coordinate               |
     |                Rational Function Optimizer                |
      ----------------------------------------------------------- 

          ...................................................
          :                      SETUP                      :
          :.................................................:
          :   optimization level            normal          :
          :   max. optcycles                   200          :
          :   ANC micro-cycles                  20          :
          :   degrees of freedom                72          :
          :.................................................:
          :   RF solver                   davidson          :
          :   input Hessian                  false          :
          :   write xtbopt.log                true          :
          :   linear?                        false          :
          :   energy convergence         0.5000000E-05 Eh   :
          :   grad. convergence          0.1000000E-02 Eh/α :
          :   maximium RF displ.         2.0000000          :
          :   Hlow (freq-cutoff)         0.5000000E-02      :
          :   Hmax (freq-cutoff)         5.0000000          :
          :   S6 in model hess.         20.0000000          :
          ...................................................

generating ANC from model Hessian ...
Using Lindh-Hessian (1995)
 Shifting diagonal of input Hessian by   4.214291120912687E-003
 Lowest  eigenvalues of input Hessian
   -0.000000   -0.000000   -0.000000    0.000000    0.000000    0.000000
    0.005000    0.006394    0.006691    0.008271    0.008537    0.009548
    0.010201    0.011940    0.015717    0.017163    0.018128    0.021752
 Highest eigenvalues
    1.683805    1.777718    1.874568    1.934898    1.974820    2.055519
 

........................................................................
.............................. CYCLE    1 ..............................
........................................................................
   1    -37.7422709 -0.377423E+02  0.173E-04    1.91       0.0  T
   2    -37.7422709 -0.775771E-10  0.125E-04    1.91     156.8  T
   3    -37.7422709 -0.213213E-09  0.694E-05    1.91     282.5  T
     SCC iter.                  ...        0 min,  0.004 sec
     gradient                   ...        0 min,  0.014 sec
 * total energy  :   -37.1155441 Eh     change        0.6785989E-08 Eh
   gradient norm :     0.1067838 Eh/α   predicted     0.0000000E+00 (-100.00%)
   displ. norm   :     0.3317271 α      lambda       -0.1941884E-01
   maximum displ.:     0.1810681 α      in ANC's #34, #24, #19, ...

........................................................................
.............................. CYCLE    2 ..............................
........................................................................
   1    -37.7842399 -0.377842E+02  0.275E-01    1.98       0.0  T
   2    -37.7843120 -0.720978E-04  0.162E-01    1.97       1.0  T
   3    -37.7841542  0.157802E-03  0.995E-02    1.97       1.0  T
   4    -37.7843821 -0.227935E-03  0.299E-02    1.97       1.0  T
   5    -37.7843900 -0.789883E-05  0.170E-02    1.97       1.2  T
   6    -37.7843930 -0.295836E-05  0.801E-03    1.97       2.4  T
   7    -37.7843943 -0.133431E-05  0.272E-03    1.97       7.2  T
   8    -37.7843945 -0.142545E-06  0.979E-04    1.97      20.0  T
     SCC iter.                  ...        0 min,  0.010 sec
     gradient                   ...        0 min,  0.014 sec
 * total energy  :   -37.1287627 Eh     change       -0.1321862E-01 Eh
   gradient norm :     0.0481416 Eh/α   predicted    -0.1077788E-01 ( -18.46%)
   displ. norm   :     0.2590024 α      lambda       -0.4993443E-02
   maximum displ.:     0.1412859 α      in ANC's #6, #34, #27, ...

........................................................................
.............................. CYCLE    3 ..............................
........................................................................
   1    -37.8004662 -0.378005E+02  0.186E-01    2.04       0.0  T
   2    -37.8004967 -0.305090E-04  0.113E-01    2.04       1.0  T
   3    -37.8004330  0.636735E-04  0.638E-02    2.04       1.0  T
   4    -37.8005198 -0.867203E-04  0.143E-02    2.04       1.4  T
   5    -37.8005235 -0.372183E-05  0.552E-03    2.04       3.6  T
   6    -37.8005237 -0.234650E-06  0.369E-03    2.04       5.3  T
     SCC iter.                  ...        0 min,  0.007 sec
     gradient                   ...        0 min,  0.013 sec
 * total energy  :   -37.1314382 Eh     change       -0.2675501E-02 Eh
   gradient norm :     0.0126826 Eh/α   predicted    -0.2664223E-02 (  -0.42%)
   displ. norm   :     0.2063724 α      lambda       -0.7255208E-03
   maximum displ.:     0.1494130 α      in ANC's #6, #2, #4, ...

........................................................................
.............................. CYCLE    4 ..............................
........................................................................
   1    -37.7976249 -0.377976E+02  0.122E-01    2.04       0.0  T
   2    -37.7976272 -0.230579E-05  0.704E-02    2.04       1.0  T
   3    -37.7976073  0.199599E-04  0.303E-02    2.04       1.0  T
   4    -37.7976281 -0.208367E-04  0.908E-03    2.04       2.2  T
   5    -37.7976292 -0.115802E-05  0.433E-03    2.04       4.5  T
   6    -37.7976295 -0.286917E-06  0.875E-04    2.04      22.4  T
   7    -37.7976295 -0.108032E-07  0.386E-04    2.04      50.9  T
     SCC iter.                  ...        0 min,  0.009 sec
     gradient                   ...        0 min,  0.014 sec
 * total energy  :   -37.1318957 Eh     change       -0.4574819E-03 Eh
   gradient norm :     0.0071308 Eh/α   predicted    -0.3782114E-03 ( -17.33%)
   displ. norm   :     0.2494127 α      lambda       -0.5474539E-03
   maximum displ.:     0.1722895 α      in ANC's #6, #2, #4, ...

........................................................................
.............................. CYCLE    5 ..............................
........................................................................
   1    -37.7934349 -0.377934E+02  0.150E-01    2.04       0.0  T
   2    -37.7934367 -0.179001E-05  0.865E-02    2.04       1.0  T
   3    -37.7933981  0.385584E-04  0.408E-02    2.04       1.0  T
   4    -37.7934390 -0.409202E-04  0.905E-03    2.04       2.2  T
   5    -37.7934398 -0.734764E-06  0.472E-03    2.04       4.2  T
   6    -37.7934401 -0.364464E-06  0.951E-04    2.04      20.6  T
   7    -37.7934402 -0.166809E-07  0.384E-04    2.04      51.0  T
     SCC iter.                  ...        0 min,  0.009 sec
     gradient                   ...        0 min,  0.014 sec
 * total energy  :   -37.1322644 Eh     change       -0.3687829E-03 Eh
   gradient norm :     0.0074315 Eh/α   predicted    -0.2907583E-03 ( -21.16%)
   displ. norm   :     0.2410027 α      lambda       -0.3585395E-03
   maximum displ.:     0.1543458 α      in ANC's #6, #2, #8, ...

........................................................................
.............................. CYCLE    6 ..............................
........................................................................
   1    -37.7931325 -0.377931E+02  0.148E-01    2.03       0.0  T
   2    -37.7931338 -0.129846E-05  0.850E-02    2.03       1.0  T
   3    -37.7930939  0.398875E-04  0.420E-02    2.03       1.0  T
   4    -37.7931365 -0.425813E-04  0.699E-03    2.03       2.8  T
   5    -37.7931367 -0.177913E-06  0.355E-03    2.03       5.5  T
   6    -37.7931369 -0.185071E-06  0.981E-04    2.03      20.0  T
   7    -37.7931369 -0.194775E-07  0.309E-04    2.03      63.5  T
     SCC iter.                  ...        0 min,  0.009 sec
     gradient                   ...        0 min,  0.014 sec
 * total energy  :   -37.1325472 Eh     change       -0.2827943E-03 Eh
   gradient norm :     0.0092186 Eh/α   predicted    -0.1896854E-03 ( -32.92%)
   displ. norm   :     0.3508882 α      lambda       -0.4803973E-03
   maximum displ.:     0.2178948 α      in ANC's #6, #2, #8, ...

........................................................................
.............................. CYCLE    7 ..............................
........................................................................
   1    -37.7943238 -0.377943E+02  0.204E-01    2.02       0.0  T
   2    -37.7943274 -0.368840E-05  0.117E-01    2.02       1.0  T
   3    -37.7942794  0.480768E-04  0.478E-02    2.02       1.0  T
   4    -37.7943307 -0.513164E-04  0.107E-02    2.02       1.8  T
   5    -37.7943312 -0.507213E-06  0.592E-03    2.02       3.3  T
   6    -37.7943318 -0.619259E-06  0.144E-03    2.02      13.7  T
   7    -37.7943319 -0.442151E-07  0.483E-04    2.02      40.6  T
     SCC iter.                  ...        0 min,  0.008 sec
     gradient                   ...        0 min,  0.014 sec
 * total energy  :   -37.1329024 Eh     change       -0.3551921E-03 Eh
   gradient norm :     0.0088383 Eh/α   predicted    -0.2697729E-03 ( -24.05%)
   displ. norm   :     0.3371145 α      lambda       -0.4342418E-03
   maximum displ.:     0.1883570 α      in ANC's #6, #2, #8, ...

........................................................................
.............................. CYCLE    8 ..............................
........................................................................
   1    -37.7966795 -0.377967E+02  0.194E-01    2.01       0.0  T
   2    -37.7966816 -0.208671E-05  0.112E-01    2.01       1.0  T
   3    -37.7966216  0.599557E-04  0.537E-02    2.01       1.0  T
   4    -37.7966857 -0.640451E-04  0.843E-03    2.01       2.3  T
   5    -37.7966857 -0.394189E-07  0.578E-03    2.01       3.4  T
   6    -37.7966864 -0.654673E-06  0.123E-03    2.01      16.0  T
   7    -37.7966864 -0.340802E-07  0.369E-04    2.01      53.1  T
     SCC iter.                  ...        0 min,  0.008 sec
     gradient                   ...        0 min,  0.013 sec
 * total energy  :   -37.1332008 Eh     change       -0.2983938E-03 Eh
   gradient norm :     0.0072222 Eh/α   predicted    -0.2417990E-03 ( -18.97%)
   displ. norm   :     0.4696828 α      lambda       -0.5225367E-03
   maximum displ.:     0.2875720 α      in ANC's #2, #6, #8, ...

........................................................................
.............................. CYCLE    9 ..............................
........................................................................
   1    -37.7959583 -0.377960E+02  0.251E-01    2.00       0.0  T
   2    -37.7959640 -0.573785E-05  0.145E-01    2.00       1.0  T
   3    -37.7959624  0.161450E-05  0.165E-02    2.00       1.2  T
   4    -37.7959648 -0.241855E-05  0.987E-03    2.00       2.0  T
   5    -37.7959659 -0.105838E-05  0.346E-03    2.00       5.7  T
   6    -37.7959660 -0.184124E-06  0.134E-03    2.00      14.6  T
   7    -37.7959661 -0.241824E-07  0.833E-04    2.00      23.6  T
     SCC iter.                  ...        0 min,  0.008 sec
     gradient                   ...        0 min,  0.014 sec
 * total energy  :   -37.1334356 Eh     change       -0.2347806E-03 Eh
   gradient norm :     0.0122924 Eh/α   predicted    -0.3189064E-03 (  35.83%)
   displ. norm   :     0.1983855 α      lambda       -0.4727968E-03
   maximum displ.:     0.1114584 α      in ANC's #2, #3, #8, ...

........................................................................
.............................. CYCLE   10 ..............................
........................................................................
   1    -37.8020459 -0.378020E+02  0.108E-01    2.00       0.0  T
   2    -37.8020474 -0.157274E-05  0.618E-02    2.00       1.0  T
   3    -37.8020390  0.845237E-05  0.224E-02    2.00       1.0  T
   4    -37.8020479 -0.891788E-05  0.588E-03    2.00       3.3  T
   5    -37.8020481 -0.202653E-06  0.379E-03    2.00       5.2  T
   6    -37.8020484 -0.322102E-06  0.110E-03    2.00      17.8  T
   7    -37.8020484 -0.174133E-07  0.300E-04    2.00      65.4  T
     SCC iter.                  ...        0 min,  0.007 sec
     gradient                   ...        0 min,  0.013 sec
 * total energy  :   -37.1336817 Eh     change       -0.2461022E-03 Eh
   gradient norm :     0.0110606 Eh/α   predicted    -0.2457024E-03 (  -0.16%)
   displ. norm   :     0.5256200 α      lambda       -0.7155245E-03
   maximum displ.:     0.3583206 α      in ANC's #2, #6, #8, ...

........................................................................
.............................. CYCLE   11 ..............................
........................................................................
   1    -37.7939546 -0.377940E+02  0.297E-01    1.99       0.0  T
   2    -37.7939641 -0.950859E-05  0.172E-01    1.98       1.0  T
   3    -37.7939055  0.586496E-04  0.548E-02    1.98       1.0  T
   4    -37.7939672 -0.617409E-04  0.146E-02    1.98       1.3  T
   5    -37.7939689 -0.175145E-05  0.762E-03    1.98       2.6  T
   6    -37.7939702 -0.123055E-05  0.228E-03    1.98       8.6  T
   7    -37.7939703 -0.836066E-07  0.828E-04    1.98      23.7  T
     SCC iter.                  ...        0 min,  0.008 sec
     gradient                   ...        0 min,  0.012 sec
 * total energy  :   -37.1338137 Eh     change       -0.1320497E-03 Eh
   gradient norm :     0.0184511 Eh/α   predicted    -0.4566024E-03 ( 245.78%)
   displ. norm   :     0.1102636 α      lambda       -0.6486817E-03
   maximum displ.:     0.0527645 α      in ANC's #3, #2, #18, ...

........................................................................
.............................. CYCLE   12 ..............................
........................................................................
   1    -37.7967300 -0.377967E+02  0.619E-02    1.99       0.0  T
   2    -37.7967324 -0.234122E-05  0.346E-02    1.99       1.0  T
   3    -37.7967302  0.220302E-05  0.145E-02    1.99       1.4  T
   4    -37.7967331 -0.296922E-05  0.429E-03    1.99       4.6  T
   5    -37.7967332 -0.272908E-07  0.237E-03    1.99       8.3  T
   6    -37.7967332 -0.641178E-07  0.960E-04    1.99      20.4  T
     SCC iter.                  ...        0 min,  0.007 sec
     gradient                   ...        0 min,  0.013 sec
 * total energy  :   -37.1341788 Eh     change       -0.3650157E-03 Eh
   gradient norm :     0.0099057 Eh/α   predicted    -0.3282834E-03 ( -10.06%)
   displ. norm   :     0.2913899 α      lambda       -0.4611702E-03
   maximum displ.:     0.1886512 α      in ANC's #2, #3, #8, ...

........................................................................
.............................. CYCLE   13 ..............................
........................................................................
   1    -37.7976355 -0.377976E+02  0.155E-01    2.00       0.0  T
   2    -37.7976414 -0.585553E-05  0.911E-02    2.00       1.0  T
   3    -37.7975732  0.682216E-04  0.570E-02    2.00       1.0  T
   4    -37.7976458 -0.726551E-04  0.939E-03    2.00       2.1  T
   5    -37.7976470 -0.118715E-05  0.450E-03    2.00       4.4  T
   6    -37.7976473 -0.293497E-06  0.195E-03    2.00      10.1  T
   7    -37.7976474 -0.514894E-07  0.519E-04    2.00      37.8  T
     SCC iter.                  ...        0 min,  0.008 sec
     gradient                   ...        0 min,  0.013 sec
 * total energy  :   -37.1343017 Eh     change       -0.1229414E-03 Eh
   gradient norm :     0.0181031 Eh/α   predicted    -0.2501650E-03 ( 103.48%)
   displ. norm   :     0.2587389 α      lambda       -0.4653757E-03
   maximum displ.:     0.1683972 α      in ANC's #2, #3, #1, ...

........................................................................
.............................. CYCLE   14 ..............................
........................................................................
   1    -37.7970842 -0.377971E+02  0.154E-01    1.99       0.0  T
   2    -37.7970865 -0.229380E-05  0.888E-02    1.99       1.0  T
   3    -37.7970345  0.520071E-04  0.491E-02    2.00       1.0  T
   4    -37.7970900 -0.555500E-04  0.789E-03    1.99       2.5  T
   5    -37.7970902 -0.198932E-06  0.362E-03    1.99       5.4  T
   6    -37.7970904 -0.168857E-06  0.153E-03    1.99      12.9  T
   7    -37.7970905 -0.487520E-07  0.409E-04    1.99      47.9  T
     SCC iter.                  ...        0 min,  0.008 sec
     gradient                   ...        0 min,  0.014 sec
 * total energy  :   -37.1346292 Eh     change       -0.3275042E-03 Eh
   gradient norm :     0.0072249 Eh/α   predicted    -0.2482680E-03 ( -24.19%)
   displ. norm   :     0.3291345 α      lambda       -0.4068580E-03
   maximum displ.:     0.1991831 α      in ANC's #2, #3, #1, ...

........................................................................
.............................. CYCLE   15 ..............................
........................................................................
   1    -37.7992622 -0.377993E+02  0.182E-01    2.00       0.0  T
   2    -37.7992655 -0.337523E-05  0.105E-01    2.00       1.0  T
   3    -37.7992450  0.205180E-04  0.307E-02    2.00       1.0  T
   4    -37.7992667 -0.216866E-04  0.911E-03    2.00       2.2  T
   5    -37.7992671 -0.429818E-06  0.609E-03    2.00       3.2  T
   6    -37.7992678 -0.690646E-06  0.110E-03    2.00      17.8  T
   7    -37.7992678 -0.153688E-07  0.408E-04    2.00      48.0  T
     SCC iter.                  ...        0 min,  0.008 sec
     gradient                   ...        0 min,  0.014 sec
 * total energy  :   -37.1348310 Eh     change       -0.2018223E-03 Eh
   gradient norm :     0.0089061 Eh/α   predicted    -0.2254700E-03 (  11.72%)
   displ. norm   :     0.5936619 α      lambda       -0.4467014E-03
   maximum displ.:     0.3647164 α      in ANC's #2, #3, #8, ...

........................................................................
.............................. CYCLE   16 ..............................
........................................................................
   1    -37.7866591 -0.377867E+02  0.340E-01    1.98       0.0  T
   2    -37.7866660 -0.692559E-05  0.198E-01    1.98       1.0  T
   3    -37.7866480  0.179974E-04  0.320E-02    1.98       1.0  T
   4    -37.7866673 -0.192688E-04  0.131E-02    1.98       1.5  T
   5    -37.7866684 -0.111706E-05  0.756E-03    1.98       2.6  T
   6    -37.7866696 -0.121326E-05  0.163E-03    1.98      12.0  T
   7    -37.7866696 -0.371451E-07  0.854E-04    1.98      23.0  T
     SCC iter.                  ...        0 min,  0.008 sec
     gradient                   ...        0 min,  0.014 sec
 * total energy  :   -37.1346325 Eh     change        0.1985817E-03 Eh
   gradient norm :     0.0231182 Eh/α   predicted    -0.3020709E-03 (-252.11%)
   displ. norm   :     0.1687237 α      lambda       -0.1256759E-02
   maximum displ.:     0.1090487 α      in ANC's #2, #6, #8, ...

........................................................................
.............................. CYCLE   17 ..............................
........................................................................
   1    -37.8019262 -0.378019E+02  0.103E-01    2.00       0.0  T
   2    -37.8019296 -0.340626E-05  0.596E-02    2.00       1.0  T
   3    -37.8019166  0.130461E-04  0.284E-02    2.00       1.0  T
   4    -37.8019317 -0.151258E-04  0.535E-03    2.00       3.7  T
   5    -37.8019316  0.115698E-06  0.393E-03    2.00       5.0  T
   6    -37.8019319 -0.288095E-06  0.168E-03    2.00      11.7  T
     SCC iter.                  ...        0 min,  0.007 sec
     gradient                   ...        0 min,  0.014 sec
 * total energy  :   -37.1350268 Eh     change       -0.3943415E-03 Eh
   gradient norm :     0.0131083 Eh/α   predicted    -0.6462734E-03 (  63.89%)
   displ. norm   :     0.1133018 α      lambda       -0.6576707E-03
   maximum displ.:     0.0558498 α      in ANC's #12, #13, #1, ...

........................................................................
.............................. CYCLE   18 ..............................
........................................................................
   1    -37.8032586 -0.378033E+02  0.647E-02    2.00       0.0  T
   2    -37.8032611 -0.255979E-05  0.360E-02    2.00       1.0  T
   3    -37.8032476  0.135674E-04  0.332E-02    2.00       1.0  T
   4    -37.8032646 -0.170563E-04  0.812E-03    2.00       2.4  T
   5    -37.8032652 -0.542458E-06  0.436E-03    2.00       4.5  T
   6    -37.8032654 -0.242065E-06  0.125E-03    2.00      15.7  T
   7    -37.8032655 -0.316151E-07  0.439E-04    2.00      44.7  T
     SCC iter.                  ...        0 min,  0.009 sec
     gradient                   ...        0 min,  0.014 sec
 * total energy  :   -37.1351171 Eh     change       -0.9035195E-04 Eh
   gradient norm :     0.0122719 Eh/α   predicted    -0.3330574E-03 ( 268.62%)
   displ. norm   :     0.1884821 α      lambda       -0.4504708E-03
   maximum displ.:     0.1006672 α      in ANC's #3, #2, #6, ...

........................................................................
.............................. CYCLE   19 ..............................
........................................................................
   1    -37.7997562 -0.377998E+02  0.114E-01    1.99       0.0  T
   2    -37.7997575 -0.130442E-05  0.667E-02    1.99       1.0  T
   3    -37.7997479  0.960571E-05  0.207E-02    1.99       1.0  T
   4    -37.7997582 -0.103681E-04  0.458E-03    1.99       4.3  T
   5    -37.7997584 -0.187700E-06  0.300E-03    1.99       6.5  T
   6    -37.7997585 -0.137259E-06  0.718E-04    1.99      27.3  T
   7    -37.7997586 -0.572594E-08  0.341E-04    1.99      57.5  T
     SCC iter.                  ...        0 min,  0.008 sec
     gradient                   ...        0 min,  0.014 sec
 * total energy  :   -37.1353741 Eh     change       -0.2569236E-03 Eh
   gradient norm :     0.0052307 Eh/α   predicted    -0.2332381E-03 (  -9.22%)
   displ. norm   :     0.2886699 α      lambda       -0.2483971E-03
   maximum displ.:     0.1533810 α      in ANC's #3, #2, #6, ...

........................................................................
.............................. CYCLE   20 ..............................
........................................................................
   1    -37.7969911 -0.377970E+02  0.178E-01    1.99       0.0  T
   2    -37.7969929 -0.182294E-05  0.104E-01    1.99       1.0  T
   3    -37.7969792  0.137266E-04  0.261E-02    1.99       1.0  T
   4    -37.7969943 -0.150838E-04  0.518E-03    1.99       3.8  T
   5    -37.7969942  0.114337E-06  0.437E-03    1.99       4.5  T
   6    -37.7969946 -0.396836E-06  0.921E-04    1.99      21.3  T
   7    -37.7969946 -0.850346E-08  0.561E-04    1.99      34.9  T
     SCC iter.                  ...        0 min,  0.009 sec
     gradient                   ...        0 min,  0.014 sec
 * total energy  :   -37.1354903 Eh     change       -0.1161971E-03 Eh
   gradient norm :     0.0101051 Eh/α   predicted    -0.1345552E-03 (  15.80%)
   displ. norm   :     0.1403252 α      lambda       -0.2311775E-03
   maximum displ.:     0.0748243 α      in ANC's #3, #6, #43, ...
 * RMSD in coord.:     0.8220492 α      energy gain  -0.1994620E-01 Eh

generating ANC from model Hessian ...
Using Lindh-Hessian (1995)
 Shifting diagonal of input Hessian by   4.177121587475067E-003
 Lowest  eigenvalues of input Hessian
   -0.000000   -0.000000   -0.000000    0.000000    0.000000    0.000000
    0.005000    0.006839    0.007223    0.008726    0.008992    0.009520
    0.010801    0.013090    0.016291    0.018840    0.019135    0.022363
 Highest eigenvalues
    1.766186    1.878492    1.905249    1.985633    2.022142    2.117363
 

........................................................................
.............................. CYCLE   21 ..............................
........................................................................
   1    -37.7990238 -0.377990E+02  0.868E-02    1.99       0.0  T
   2    -37.7990248 -0.101034E-05  0.506E-02    1.99       1.0  T
   3    -37.7990230  0.183966E-05  0.976E-03    1.99       2.0  T
   4    -37.7990250 -0.200877E-05  0.309E-03    1.99       6.3  T
   5    -37.7990251 -0.132206E-06  0.898E-04    1.99      21.9  T
   6    -37.7990251 -0.599184E-08  0.375E-04    1.99      52.3  T
     SCC iter.                  ...        0 min,  0.008 sec
     gradient                   ...        0 min,  0.014 sec
 * total energy  :   -37.1356428 Eh     change       -0.1525015E-03 Eh
   gradient norm :     0.0099431 Eh/α   predicted     0.0000000E+00 (-100.00%)
   displ. norm   :     0.1533090 α      lambda       -0.3371236E-03
   maximum displ.:     0.0727733 α      in ANC's #3, #6, #7, ...

........................................................................
.............................. CYCLE   22 ..............................
........................................................................
   1    -37.8001839 -0.378002E+02  0.843E-02    1.99       0.0  T
   2    -37.8001847 -0.854224E-06  0.490E-02    1.99       1.0  T
   3    -37.8001818  0.291887E-05  0.121E-02    1.99       1.6  T
   4    -37.8001850 -0.317694E-05  0.299E-03    1.99       6.6  T
   5    -37.8001850 -0.247786E-07  0.214E-03    1.99       9.1  T
   6    -37.8001851 -0.996849E-07  0.675E-04    1.99      29.0  T
     SCC iter.                  ...        0 min,  0.008 sec
     gradient                   ...        0 min,  0.014 sec
 * total energy  :   -37.1358911 Eh     change       -0.2483214E-03 Eh
   gradient norm :     0.0038416 Eh/α   predicted    -0.1725294E-03 ( -30.52%)
   displ. norm   :     0.2005512 α      lambda       -0.2917105E-03
   maximum displ.:     0.0928905 α      in ANC's #6, #7, #3, ...

........................................................................
.............................. CYCLE   23 ..............................
........................................................................
   1    -37.8006131 -0.378006E+02  0.127E-01    1.98       0.0  T
   2    -37.8006139 -0.815803E-06  0.744E-02    1.98       1.0  T
   3    -37.8005994  0.144387E-04  0.246E-02    1.98       1.0  T
   4    -37.8006147 -0.152951E-04  0.422E-03    1.98       4.6  T
   5    -37.8006150 -0.212521E-06  0.258E-03    1.98       7.6  T
   6    -37.8006151 -0.129596E-06  0.635E-04    1.98      30.9  T
   7    -37.8006151 -0.189154E-08  0.278E-04    1.98      70.6  T
     SCC iter.                  ...        0 min,  0.009 sec
     gradient                   ...        0 min,  0.015 sec
 * total energy  :   -37.1360934 Eh     change       -0.2023396E-03 Eh
   gradient norm :     0.0043621 Eh/α   predicted    -0.1517389E-03 ( -25.01%)
   displ. norm   :     0.3386216 α      lambda       -0.3173489E-03
   maximum displ.:     0.1792166 α      in ANC's #3, #6, #7, ...

........................................................................
.............................. CYCLE   24 ..............................
........................................................................
   1    -37.7987006 -0.377987E+02  0.205E-01    1.97       0.0  T
   2    -37.7987014 -0.793508E-06  0.121E-01    1.97       1.0  T
   3    -37.7986596  0.417749E-04  0.415E-02    1.97       1.0  T
   4    -37.7987037 -0.440931E-04  0.516E-03    1.97       3.8  T
   5    -37.7987041 -0.417526E-06  0.258E-03    1.97       7.6  T
   6    -37.7987043 -0.114101E-06  0.732E-04    1.97      26.8  T
     SCC iter.                  ...        0 min,  0.007 sec
     gradient                   ...        0 min,  0.014 sec
 * total energy  :   -37.1363300 Eh     change       -0.2366069E-03 Eh
   gradient norm :     0.0072790 Eh/α   predicted    -0.1768884E-03 ( -25.24%)
   displ. norm   :     0.3085801 α      lambda       -0.2238123E-03
   maximum displ.:     0.1765350 α      in ANC's #3, #6, #1, ...

........................................................................
.............................. CYCLE   25 ..............................
........................................................................
   1    -37.7975071 -0.377975E+02  0.188E-01    1.97       0.0  T
   2    -37.7975075 -0.410084E-06  0.110E-01    1.97       1.0  T
   3    -37.7974767  0.307922E-04  0.361E-02    1.97       1.0  T
   4    -37.7975092 -0.325326E-04  0.355E-03    1.97       5.5  T
   5    -37.7975094 -0.219814E-06  0.181E-03    1.97      10.8  T
   6    -37.7975095 -0.419125E-07  0.598E-04    1.97      32.8  T
     SCC iter.                  ...        0 min,  0.008 sec
     gradient                   ...        0 min,  0.014 sec
 * total energy  :   -37.1364818 Eh     change       -0.1517608E-03 Eh
   gradient norm :     0.0071113 Eh/α   predicted    -0.1225634E-03 ( -19.24%)
   displ. norm   :     0.3089458 α      lambda        0.4038001E-04
   maximum displ.:     0.1765414 α      in ANC's #3, #6, #1, ...

........................................................................
.............................. CYCLE   26 ..............................
........................................................................
   1    -37.7939680 -0.377940E+02  0.187E-01    1.96       0.0  T
   2    -37.7939685 -0.543242E-06  0.110E-01    1.96       1.0  T
   3    -37.7939407  0.278072E-04  0.343E-02    1.96       1.0  T
   4    -37.7939701 -0.293961E-04  0.361E-03    1.96       5.4  T
   5    -37.7939703 -0.215149E-06  0.186E-03    1.96      10.5  T
   6    -37.7939704 -0.431443E-07  0.646E-04    1.96      30.3  T
     SCC iter.                  ...        0 min,  0.008 sec
     gradient                   ...        0 min,  0.014 sec
 * total energy  :   -37.1364060 Eh     change        0.7581081E-04 Eh
   gradient norm :     0.0130627 Eh/α   predicted     0.2211214E-04 ( -70.83%)
   displ. norm   :     0.1164273 α      lambda       -0.3936195E-03
   maximum displ.:     0.0836943 α      in ANC's #7, #4, #6, ...

........................................................................
.............................. CYCLE   27 ..............................
........................................................................
   1    -37.7997594 -0.377998E+02  0.630E-02    1.96       0.0  T
   2    -37.7997598 -0.335201E-06  0.372E-02    1.96       1.0  T
   3    -37.7997547  0.512669E-05  0.150E-02    1.96       1.3  T
   4    -37.7997602 -0.557999E-05  0.209E-03    1.96       9.4  T
   5    -37.7997603 -0.493904E-07  0.121E-03    1.96      16.1  T
   6    -37.7997603 -0.266115E-07  0.475E-04    1.96      41.3  T
     SCC iter.                  ...        0 min,  0.007 sec
     gradient                   ...        0 min,  0.014 sec
 * total energy  :   -37.1366236 Eh     change       -0.2176193E-03 Eh
   gradient norm :     0.0050307 Eh/α   predicted    -0.1994887E-03 (  -8.33%)
   displ. norm   :     0.0880754 α      lambda       -0.7697850E-04
   maximum displ.:     0.0553703 α      in ANC's #3, #1, #2, ...

........................................................................
.............................. CYCLE   28 ..............................
........................................................................
   1    -37.8012671 -0.378013E+02  0.463E-02    1.96       0.0  T
   2    -37.8012672 -0.917605E-07  0.271E-02    1.96       1.0  T
   3    -37.8012652  0.203889E-05  0.940E-03    1.96       2.1  T
   4    -37.8012673 -0.214089E-05  0.183E-03    1.96      10.7  T
   5    -37.8012674 -0.348532E-07  0.880E-04    1.96      22.3  T
     SCC iter.                  ...        0 min,  0.006 sec
     gradient                   ...        0 min,  0.014 sec
 * total energy  :   -37.1366804 Eh     change       -0.5681697E-04 Eh
   gradient norm :     0.0018575 Eh/α   predicted    -0.3878824E-04 ( -31.73%)
   displ. norm   :     0.3234871 α      lambda       -0.8440232E-04
   maximum displ.:     0.2068254 α      in ANC's #3, #1, #2, ...

........................................................................
.............................. CYCLE   29 ..............................
........................................................................
   1    -37.8010930 -0.378011E+02  0.186E-01    1.95       0.0  T
   2    -37.8010945 -0.151526E-05  0.109E-01    1.95       1.0  T
   3    -37.8010934  0.116892E-05  0.998E-03    1.95       2.0  T
   4    -37.8010950 -0.160007E-05  0.410E-03    1.95       4.8  T
   5    -37.8010951 -0.137107E-06  0.150E-03    1.95      13.1  T
   6    -37.8010951 -0.349012E-07  0.524E-04    1.95      37.4  T
   7    -37.8010951 -0.286602E-08  0.271E-04    1.95      72.5  T
     SCC iter.                  ...        0 min,  0.009 sec
     gradient                   ...        0 min,  0.015 sec
 * total energy  :   -37.1367491 Eh     change       -0.6863078E-04 Eh
   gradient norm :     0.0025111 Eh/α   predicted    -0.4416761E-04 ( -35.64%)
   displ. norm   :     0.0820002 α      lambda       -0.2998587E-04
   maximum displ.:     0.0515163 α      in ANC's #1, #3, #7, ...

........................................................................
.............................. CYCLE   30 ..............................
........................................................................
   1    -37.8009564 -0.378010E+02  0.421E-02    1.95       0.0  T
   2    -37.8009565 -0.111388E-06  0.247E-02    1.95       1.0  T
   3    -37.8009558  0.722405E-06  0.566E-03    1.95       3.5  T
   4    -37.8009566 -0.799120E-06  0.103E-03    1.95      19.0  T
   5    -37.8009566  0.110796E-08  0.741E-04    1.95      26.5  T
   6    -37.8009566 -0.110325E-07  0.247E-04    1.95      79.5  T
     SCC iter.                  ...        0 min,  0.008 sec
     gradient                   ...        0 min,  0.015 sec
 * total energy  :   -37.1367656 Eh     change       -0.1655527E-04 Eh
   gradient norm :     0.0023608 Eh/α   predicted    -0.1509514E-04 (  -8.82%)
   displ. norm   :     0.0508246 α      lambda       -0.1381880E-04
   maximum displ.:     0.0389859 α      in ANC's #1, #7, #3, ...

........................................................................
.............................. CYCLE   31 ..............................
........................................................................
   1    -37.8007619 -0.378008E+02  0.296E-02    1.95       0.0  T
   2    -37.8007620 -0.562178E-07  0.172E-02    1.95       1.1  T
   3    -37.8007611  0.814531E-06  0.584E-03    1.95       3.4  T
   4    -37.8007620 -0.855838E-06  0.134E-03    1.95      14.6  T
   5    -37.8007620 -0.130028E-07  0.870E-04    1.95      22.5  T
   6    -37.8007620 -0.155015E-07  0.155E-04    1.95     126.5  T
     SCC iter.                  ...        0 min,  0.007 sec
     gradient                   ...        0 min,  0.013 sec
 * total energy  :   -37.1367756 Eh     change       -0.1001092E-04 Eh
   gradient norm :     0.0011837 Eh/α   predicted    -0.6929789E-05 ( -30.78%)
   displ. norm   :     0.0591150 α      lambda       -0.1049152E-04
   maximum displ.:     0.0492689 α      in ANC's #1, #7, #2, ...

........................................................................
.............................. CYCLE   32 ..............................
........................................................................
   1    -37.8013017 -0.378013E+02  0.248E-02    1.95       0.0  T
   2    -37.8013018 -0.766769E-07  0.142E-02    1.95       1.4  T
   3    -37.8013009  0.911192E-06  0.633E-03    1.95       3.1  T
   4    -37.8013019 -0.957687E-06  0.172E-03    1.95      11.4  T
   5    -37.8013019 -0.326266E-07  0.993E-04    1.95      19.8  T
   6    -37.8013019 -0.160355E-07  0.248E-04    1.95      79.0  T
     SCC iter.                  ...        0 min,  0.007 sec
     gradient                   ...        0 min,  0.014 sec
 * total energy  :   -37.1367835 Eh     change       -0.7921040E-05 Eh
   gradient norm :     0.0010814 Eh/α   predicted    -0.5255246E-05 ( -33.65%)
   displ. norm   :     0.0379940 α      lambda       -0.5535482E-05
   maximum displ.:     0.0329190 α      in ANC's #1, #3, #2, ...

........................................................................
.............................. CYCLE   33 ..............................
........................................................................
   1    -37.8010573 -0.378011E+02  0.172E-02    1.95       0.0  T
   2    -37.8010573 -0.298865E-07  0.975E-03    1.95       2.0  T
   3    -37.8010572  0.143737E-06  0.278E-03    1.95       7.1  T
   4    -37.8010573 -0.149552E-06  0.101E-03    1.95      19.4  T
   5    -37.8010573 -0.839668E-08  0.408E-04    1.95      48.1  T
   6    -37.8010573 -0.380089E-08  0.820E-05    1.95     239.1  T
     SCC iter.                  ...        0 min,  0.007 sec
     gradient                   ...        0 min,  0.014 sec
 * total energy  :   -37.1367893 Eh     change       -0.5767082E-05 Eh
   gradient norm :     0.0012983 Eh/α   predicted    -0.2770883E-05 ( -51.95%)
   displ. norm   :     0.0375741 α      lambda        0.8921332E-06
   maximum displ.:     0.0324330 α      in ANC's #1, #3, #2, ...

........................................................................
.............................. CYCLE   34 ..............................
........................................................................
   1    -37.8007933 -0.378008E+02  0.170E-02    1.95       0.0  T
   2    -37.8007933 -0.288328E-07  0.967E-03    1.95       2.0  T
   3    -37.8007932  0.167525E-06  0.294E-03    1.95       6.7  T
   4    -37.8007934 -0.175886E-06  0.990E-04    1.95      19.8  T
   5    -37.8007934 -0.639209E-08  0.461E-04    1.95      42.6  T
     SCC iter.                  ...        0 min,  0.006 sec
     gradient                   ...        0 min,  0.014 sec
 * total energy  :   -37.1367898 Eh     change       -0.5255933E-06 Eh
   gradient norm :     0.0023054 Eh/α   predicted     0.4458210E-06 (-184.82%)
   displ. norm   :     0.0142338 α      lambda       -0.6435044E-05
   maximum displ.:     0.0086500 α      in ANC's #1, #2, #4, ...

........................................................................
.............................. CYCLE   35 ..............................
........................................................................
   1    -37.8008132 -0.378008E+02  0.838E-03    1.95       0.0  T
   2    -37.8008132 -0.224882E-07  0.458E-03    1.95       4.3  T
   3    -37.8008132  0.249391E-07  0.146E-03    1.95      13.4  T
   4    -37.8008132 -0.315614E-07  0.579E-04    1.95      33.9  T
   5    -37.8008132 -0.166288E-08  0.173E-04    1.95     113.3  T
     SCC iter.                  ...        0 min,  0.006 sec
     gradient                   ...        0 min,  0.014 sec
 * total energy  :   -37.1367945 Eh     change       -0.4638390E-05 Eh
   gradient norm :     0.0013912 Eh/α   predicted    -0.3223058E-05 ( -30.51%)
   displ. norm   :     0.0472312 α      lambda       -0.7422879E-05
   maximum displ.:     0.0308747 α      in ANC's #1, #2, #8, ...

........................................................................
.............................. CYCLE   36 ..............................
........................................................................
   1    -37.8011354 -0.378011E+02  0.247E-02    1.95       0.0  T
   2    -37.8011355 -0.164883E-06  0.133E-02    1.95       1.5  T
   3    -37.8011354  0.155815E-06  0.370E-03    1.95       5.3  T
   4    -37.8011356 -0.194771E-06  0.162E-03    1.95      12.1  T
   5    -37.8011356 -0.100434E-07  0.681E-04    1.95      28.8  T
   6    -37.8011356 -0.106878E-07  0.271E-04    1.95      72.3  T
     SCC iter.                  ...        0 min,  0.007 sec
     gradient                   ...        0 min,  0.014 sec
 * total energy  :   -37.1367983 Eh     change       -0.3861058E-05 Eh
   gradient norm :     0.0015550 Eh/α   predicted    -0.3718865E-05 (  -3.68%)
   displ. norm   :     0.0315091 α      lambda       -0.4534215E-05
   maximum displ.:     0.0254927 α      in ANC's #1, #2, #18, ...

........................................................................
.............................. CYCLE   37 ..............................
........................................................................
   1    -37.8011270 -0.378011E+02  0.157E-02    1.95       0.0  T
   2    -37.8011271 -0.473625E-07  0.884E-03    1.95       2.2  T
   3    -37.8011269  0.144039E-06  0.288E-03    1.95       6.8  T
   4    -37.8011271 -0.147193E-06  0.115E-03    1.95      17.0  T
   5    -37.8011271 -0.116015E-07  0.558E-04    1.95      35.1  T
   6    -37.8011271 -0.565995E-08  0.123E-04    1.95     158.8  T
     SCC iter.                  ...        0 min,  0.008 sec
     gradient                   ...        0 min,  0.015 sec
 * total energy  :   -37.1368017 Eh     change       -0.3403603E-05 Eh
   gradient norm :     0.0012084 Eh/α   predicted    -0.2272716E-05 ( -33.23%)
   displ. norm   :     0.0267826 α      lambda       -0.3219748E-05
   maximum displ.:     0.0210128 α      in ANC's #1, #2, #3, ...

........................................................................
.............................. CYCLE   38 ..............................
........................................................................
   1    -37.8010020 -0.378010E+02  0.150E-02    1.95       0.0  T
   2    -37.8010020 -0.314469E-07  0.845E-03    1.95       2.3  T
   3    -37.8010018  0.152730E-06  0.281E-03    1.95       7.0  T
   4    -37.8010020 -0.172762E-06  0.787E-04    1.95      24.9  T
   5    -37.8010020  0.145563E-08  0.489E-04    1.95      40.1  T
     SCC iter.                  ...        0 min,  0.006 sec
     gradient                   ...        0 min,  0.015 sec
 * total energy  :   -37.1368047 Eh     change       -0.2951384E-05 Eh
   gradient norm :     0.0007028 Eh/α   predicted    -0.1613713E-05 ( -45.32%)
   displ. norm   :     0.0279455 α      lambda       -0.1461360E-05
   maximum displ.:     0.0236308 α      in ANC's #1, #2, #3, ...

   *** GEOMETRY OPTIMIZATION CONVERGED AFTER 38 ITERATIONS ***

------------------------------------------------------------------------
 total energy gain   :        -0.0212606 Eh      -13.3412 kcal/mol
 total RMSD          :         0.9265985 a0        0.4903 Å
 total power (kW/mol):        -1.4689411 (step)  -45.6226 (real)
------------------------------------------------------------------------

 ANCopt (total)                0 d,  0 h,  0 min,  1.224 sec
 optimizer setup                ...        0 min,  0.000 sec (  0.010%)
 model hessian                  ...        0 min,  0.008 sec (  0.680%)
 ANC generation                 ...        0 min,  0.001 sec (  0.113%)
 coordinate transformation      ...        0 min,  0.001 sec (  0.055%)
 single point calculation       ...        0 min,  1.198 sec ( 97.915%)
 optimization log               ...        0 min,  0.004 sec (  0.304%)
 hessian update                 ...        0 min,  0.000 sec (  0.040%)
 rational function              ...        0 min,  0.009 sec (  0.706%)

================
 final structure:
================
$coord
   -2.22716108240283    2.39047589639189   -0.56378923391961      C 
   -4.70253253183674    0.32852406413043   -0.51378814023461      S 
   -2.74115466130972   -2.26472851335229   -0.09836767964074      C 
   -0.22554898229293   -1.49979713136299   -0.00718969257545      C 
    0.06167879537511    1.18259516155009   -0.28074095842383      C 
    2.50298175542158    2.25723912531496   -0.23611842584647      C 
    4.59238457382023    0.76127798547265    0.06758758932453      C 
    7.11556866762363    1.88926639962418    0.12305607714421      C 
    7.81219254780470    3.87709189126772   -1.23526080380397      C 
    4.30866131404941   -1.91945861670458    0.35543778311014      C 
    6.60664367538130   -3.54719885408787    0.66466914422477      C 
    1.96493244552494   -2.99257672618167    0.30793123998895      C 
   -3.72411329034950   -4.77740263506305    0.09745416989069      C 
   -6.16098730326401   -5.39951842419591   -0.01937175464446      C 
   -2.57171591208176    4.37180198057342   -0.80356673763854      H 
    2.69172732456685    4.28147413644092   -0.40611680349103      H 
    8.47470249711200    0.99824456172663    1.36266875594766      H 
    6.54666365243883    4.78808905782921   -2.54370761754323      H 
    9.69022508410085    4.65066664277550   -1.11302390487935      H 
    7.95333314635251   -3.19880408388940   -0.85222882699334      H 
    6.08911251425831   -5.53559027323408    0.64189500725617      H 
    7.54520537636080   -3.14838786899174    2.45507856783191      H 
    1.77049645334118   -5.01480975308886    0.51026247323047      H 
   -2.31581845588628   -6.23692185055325    0.35836341364745      H 
   -7.60744344251995   -3.98975897929820   -0.27800594852366      H 
   -6.77811178911170   -7.32885338271743    0.14033329466191      H 
$end
           -------------------------------------------------
          |                Final Singlepoint                |
           -------------------------------------------------

          ...................................................
          :                      SETUP                      :
          :.................................................:
          :  # basis functions                  74          :
          :  # atomic orbitals                  73          :
          :  # shells                           41          :
          :  # electrons                        70          :
          :  max. iterations                   250          :
          :  Hamiltonian                  GFN2-xTB          :
          :  restarted?                      false          :
          :  GBSA solvation                  false          :
          :  PC potential                    false          :
          :  electronic temp.          300.0000000     K    :
          :  accuracy                    1.0000000          :
          :  -> integral cutoff          0.2500000E+02      :
          :  -> integral neglect         0.1000000E-07      :
          :  -> SCF convergence          0.1000000E-05 Eh   :
          :  -> wf. convergence          0.1000000E-03 e    :
          :  Broyden damping             0.4000000          :
          ...................................................

 iter      E             dE          RMSdq      gap      omega  full diag
   1    -37.8010020 -0.378010E+02  0.363E-04    1.95       0.0  T
   2    -37.8010020  0.309512E-09  0.145E-04    1.95     135.1  T
   3    -37.8010020  0.148546E-09  0.255E-04    1.95      77.0  T

   *** convergence criteria satisfied after 3 iterations ***

         #    Occupation            Energy/Eh            Energy/eV
      -------------------------------------------------------------
         1        2.0000           -0.7292184             -19.8430
       ...           ...                  ...                  ...
        29        2.0000           -0.4325280             -11.7697
        30        2.0000           -0.4258760             -11.5887
        31        2.0000           -0.4194413             -11.4136
        32        2.0000           -0.4160127             -11.3203
        33        2.0000           -0.4012025             -10.9173
        34        2.0000           -0.3838277             -10.4445
        35        2.0000           -0.3522577              -9.5854 (HOMO)
        36                         -0.2804760              -7.6321 (LUMO)
        37                         -0.2375798              -6.4649
        38                         -0.2009282              -5.4675
        39                         -0.1949180              -5.3040
        40                         -0.1808843              -4.9221
       ...                                ...                  ...
        73                          0.7386243              20.0990
      -------------------------------------------------------------
                  HL-Gap            0.0717817 Eh            1.9533 eV
             Fermi-level           -0.3163669 Eh           -8.6088 eV

 SCC (total)                   0 d,  0 h,  0 min,  0.030 sec
 SCC setup                      ...        0 min,  0.000 sec (  0.696%)
 Dispersion                     ...        0 min,  0.000 sec (  0.806%)
 integral evaluation            ...        0 min,  0.010 sec ( 32.363%)
 zeroth order Hamiltonian       ...        0 min,  0.000 sec (  0.568%)
 iterations                     ...        0 min,  0.004 sec ( 14.179%)
 molecular gradient             ...        0 min,  0.015 sec ( 50.125%)
 printout                       ...        0 min,  0.000 sec (  1.119%)

         :::::::::::::::::::::::::::::::::::::::::::::::::::::
         ::                     SUMMARY                     ::
         :::::::::::::::::::::::::::::::::::::::::::::::::::::
         :: total energy             -37.136804660770 Eh    ::
         :: gradient norm              0.000702184406 Eh/a0 ::
         :: HOMO-LUMO gap              1.953280514027 eV    ::
         ::.................................................::
         :: SCC energy               -37.801002013217 Eh    ::
         :: -> isotropic ES            0.003391839437 Eh    ::
         :: -> anisotropic ES          0.005225204468 Eh    ::
         :: -> anisotropic XC          0.022560856676 Eh    ::
         :: -> dispersion             -0.027606934065 Eh    ::
         :: repulsion energy           0.664206432823 Eh    ::
         :: add. restraining           0.000000000000 Eh    ::
         :::::::::::::::::::::::::::::::::::::::::::::::::::::

           -------------------------------------------------
          |                Property Printout                |
           -------------------------------------------------

    * Orbital Energies and Occupations

         #    Occupation            Energy/Eh            Energy/eV
      -------------------------------------------------------------
         1        2.0000           -0.7292184             -19.8430
       ...           ...                  ...                  ...
        23        2.0000           -0.4693114             -12.7706
        24        2.0000           -0.4589123             -12.4876
        25        2.0000           -0.4560991             -12.4111
        26        2.0000           -0.4499781             -12.2445
        27        2.0000           -0.4439358             -12.0801
        28        2.0000           -0.4354357             -11.8488
        29        2.0000           -0.4325280             -11.7697
        30        2.0000           -0.4258760             -11.5887
        31        2.0000           -0.4194413             -11.4136
        32        2.0000           -0.4160127             -11.3203
        33        2.0000           -0.4012025             -10.9173
        34        2.0000           -0.3838277             -10.4445
        35        2.0000           -0.3522577              -9.5854 (HOMO)
        36                         -0.2804760              -7.6321 (LUMO)
        37                         -0.2375798              -6.4649
        38                         -0.2009282              -5.4675
        39                         -0.1949180              -5.3040
        40                         -0.1808843              -4.9221
        41                         -0.1487098              -4.0466
        42                         -0.1166473              -3.1741
        43                         -0.0765302              -2.0825
        44                         -0.0001193              -0.0032
        45                          0.0330888               0.9004
        46                          0.0433554               1.1798
       ...                                ...                  ...
        73                          0.7386243              20.0990
      -------------------------------------------------------------
                  HL-Gap            0.0717817 Eh            1.9533 eV
             Fermi-level           -0.3163669 Eh           -8.6088 eV

     #   Z        covCN         q      C6AA      α(0)
     1   6 C      2.927    -0.035    28.877     8.813
     2  16 S      2.321    -0.008   141.372    20.012
     3   6 C      2.979     0.010    27.795     8.648
     4   6 C      3.165    -0.008    27.879     8.629
     5   6 C      3.167    -0.002    27.728     8.604
     6   6 C      2.916    -0.042    29.047     8.838
     7   6 C      2.972     0.006    27.877     8.661
     8   6 C      2.896    -0.030    28.749     8.791
     9   6 C      2.839    -0.088    30.208     9.007
    10   6 C      2.965     0.011    27.770     8.644
    11   6 C      3.758    -0.106    22.566     6.773
    12   6 C      2.914    -0.046    29.138     8.852
    13   6 C      2.920    -0.030    28.761     8.794
    14   6 C      2.841    -0.092    30.299     9.021
    15   1 H      0.926     0.041     2.433     2.439
    16   1 H      0.926     0.032     2.556     2.500
    17   1 H      0.925     0.039     2.464     2.454
    18   1 H      0.926     0.038     2.480     2.463
    19   1 H      0.926     0.035     2.520     2.483
    20   1 H      0.925     0.046     2.373     2.409
    21   1 H      0.925     0.039     2.460     2.453
    22   1 H      0.924     0.045     2.380     2.413
    23   1 H      0.926     0.027     2.628     2.535
    24   1 H      0.925     0.039     2.460     2.453
    25   1 H      0.926     0.043     2.413     2.429
    26   1 H      0.926     0.038     2.479     2.462

 Mol. C6AA /au·bohr⁶  :       9937.814696
 Mol. C8AA /au·bohr⁸  :     269915.039237
 Mol. α(0) /au        :        161.578692


Wiberg/Mayer (AO) data.
largest (>0.10) Wiberg bond orders for each atom
          total WBO             WBO to atom ...
     1  C   3.930        C    5 1.443    S    2 1.242    H   15 0.970    C    3 0.127
     2  S   2.696        C    1 1.242    C    3 1.160
     3  C   3.938        C    4 1.374    C   13 1.160    S    2 1.160    C    1 0.127
     4  C   3.988        C    3 1.374    C   12 1.238    C    5 1.164
     5  C   3.988        C    1 1.443    C    6 1.231    C    4 1.164
     6  C   3.985        C    7 1.544    C    5 1.231    H   16 0.965    C   12 0.103
     7  C   3.989        C    6 1.544    C   10 1.196    C    8 1.074
     8  C   3.990        C    9 1.919    C    7 1.074    H   17 0.959
     9  C   3.972        C    8 1.919    H   19 0.978    H   18 0.975
    10  C   3.969        C   12 1.581    C    7 1.196    C   11 1.027
    11  C   3.995        C   10 1.027    H   21 0.985    H   20 0.973    H   22 0.968
    12  C   3.990        C   10 1.581    C    4 1.238    H   23 0.963    C    6 0.103
    13  C   3.992        C   14 1.838    C    3 1.160    H   24 0.956
    14  C   3.964        C   13 1.838    H   26 0.979    H   25 0.973
    15  H   0.998        C    1 0.970
    16  H   0.998        C    6 0.965
    17  H   0.997        C    8 0.959
    18  H   0.999        C    9 0.975
    19  H   0.998        C    9 0.978
    20  H   0.995        C   11 0.973
    21  H   0.998        C   11 0.985
    22  H   0.994        C   11 0.968
    23  H   0.998        C   12 0.963
    24  H   0.998        C   13 0.956
    25  H   0.998        C   14 0.973
    26  H   0.998        C   14 0.979

molecular dipole:
                 x           y           z       tot (Debye)
 q only:        0.261      -0.091       0.049
   full:        0.530      -0.083       0.066       1.374
molecular quadrupole (traceless):
                xx          xy          yy          xz          yz          zz
 q only:        1.936      -1.610       1.005       0.817      -0.778      -2.941
  q+dip:        2.405      -1.148       4.963       1.574      -2.806      -7.368
   full:        0.270      -1.455       3.606       0.941      -1.578      -3.876

           -------------------------------------------------
          |                Geometry Summary                 |
           -------------------------------------------------

      molecular mass/u    :      200.2978000
   center of mass at/Å    :        0.3165736      -0.3317632      -0.0710943
  moments of inertia/u·Å² :        0.3813834E+03   0.1308638E+04   0.1676991E+04
rotational constants/cm⁻¹ :        0.4420127E-01   0.1288182E-01   0.1005231E-01

 * 24 selected distances

     #   Z        #   Z                                     value/Å
     1   6 C      2  16 S                                 1.7050358
     2  16 S      3   6 C                                 1.7345827 (max)
     3   6 C      4   6 C                                 1.3922196
     1   6 C      5   6 C                                 1.3776792
     4   6 C      5   6 C                                 1.4348960
     5   6 C      6   6 C                                 1.4117048
     6   6 C      7   6 C                                 1.3693060
     8   6 C      9   6 C                                 1.3263002
     4   6 C     12   6 C                                 1.4126061
    10   6 C     12   6 C                                 1.3643032
     3   6 C     13   6 C                                 1.4315282
    13   6 C     14   6 C                                 1.3323325
     1   6 C     15   1 H                                 1.0717459 (min)
     6   6 C     16   1 H                                 1.0795802
     8   6 C     17   1 H                                 1.0816213
     9   6 C     18   1 H                                 1.0771731
     9   6 C     19   1 H                                 1.0767640
    11   6 C     20   1 H                                 1.0891197
    11   6 C     21   1 H                                 1.0873347
    11   6 C     22   1 H                                 1.0903510
    12   6 C     23   1 H                                 1.0803734
    13   6 C     24   1 H                                 1.0821079
    14   6 C     25   1 H                                 1.0775677
    14   6 C     26   1 H                                 1.0752436

 * 3 distinct bonds (by element types)

   Z      Z             #   av. dist./Å        max./Å        min./Å
   1 H    6 C          12     1.0807485     1.0903510     1.0717459
   6 C    6 C          10     1.3852876     1.4348960     1.3263002
   6 C   16 S           2     1.7198093     1.7345827     1.7050358


optimized geometry written to: xtbopt.xyz


           -------------------------------------------------
          | TOTAL ENERGY              -37.136804660770 Eh   |
          | GRADIENT NORM               0.000702184406 Eh/α |
          | HOMO-LUMO GAP               1.953280514027 eV   |
           -------------------------------------------------

------------------------------------------------------------------------
 * finished run on 2021/05/19 at 10:58:19.415     
------------------------------------------------------------------------
 total:
 * wall-time:     0 d,  0 h,  0 min,  1.316 sec
 *  cpu-time:     0 d,  0 h,  0 min,  1.315 sec
 * ratio c/w:     1.000 speedup
 SCF:
 * wall-time:     0 d,  0 h,  0 min,  0.041 sec
 *  cpu-time:     0 d,  0 h,  0 min,  0.041 sec
 * ratio c/w:     1.000 speedup
 ANC optimizer:
 * wall-time:     0 d,  0 h,  0 min,  1.254 sec
 *  cpu-time:     0 d,  0 h,  0 min,  1.254 sec
 * ratio c/w:     1.000 speedup

