      -----------------------------------------------------------      
     |                   =====================                   |     
     |                           x T B                           |     
     |                   =====================                   |     
     |                         S. Grimme                         |     
     |          Mulliken Center for Theoretical Chemistry        |     
     |                    University of Bonn                     |     
     |                Version 6.2 RC2 (SAW190805)                |     
      -----------------------------------------------------------      

   This program is distributed in the hope that it will be useful,
   but WITHOUT ANY WARRANTY; without even the implied warranty of
   MERCHANTABILITY or FITNESS FOR A PARTICULAR PURPOSE.
   
   FOR NON-COMMERCIAL, ACADEMIA USE ONLY.
   
   Cite this work as:
   * S. Grimme, C. Bannwarth, P. Shushkov, J. Chem. Theory Comput., 2017,
     13, 1989-2009. DOI: 10.1021/acs.jctc.7b00118
   * C. Bannwarth, S. Ehlert and S. Grimme., J. Chem. Theory Comput., 2019,
     15, 1652-1671. DOI: 10.1021/acs.jctc.8b01176
   * P. Pracht, E. Caldeweyher, S. Ehlert, S. Grimme, ChemRxiv, 2019, preprint.
     DOI: 10.26434/chemrxiv.8326202.v1
   
   for DFT-D4:
   * E. Caldeweyher, C. Bannwarth and S. Grimme, J. Chem. Phys., 2017,
     147, 034112. DOI: 10.1063/1.4993215
   * E. Caldeweyher, S. Ehlert, A. Hansen, H. Neugebauer, S. Spicher,
     C. Bannwarth and S. Grimme, J. Chem. Phys., 2019, 150, 154122.
     DOI: 10.1063/1.5090222
   
   for sTDA-xTB:
   * S. Grimme and C. Bannwarth, J. Chem. Phys., 2016, 145, 054103.
     DOI: 10.1063/1.4959605
   
   in the mass-spec context:
   * V. Asgeirsson, C. Bauer and S. Grimme, Chem. Sci., 2017, 8, 4879.
     DOI: 10.1039/c7sc00601b
   
   for metadynamics refer to:
   * S. Grimme, J. Chem. Theory Comput., 2019, 155, 2847-2862
     DOI: 10.1021/acs.jctc.9b00143
   
   with help from (in alphabetical order)
   C. Bannwarth, F. Bohle, G. Brandenburg, E. Caldeweyher, M. Checinski,
   S. Dohm, S. Ehlert, S. Ehrlich, F. März, H. Neugebauer, J. Pisarek,
   P. Pracht, P. Shushkov, and S. Spicher.
   
 * started run on 2021/05/19 at 10:58:54.266     

           -------------------------------------------------
          |                Calculation Setup                |
           -------------------------------------------------

          program call               : /ihome/ghutchison/geoffh/xtb/xtb 305.xyz -opt
          hostname                   : smp-n122
          coordinate file            : 305.xyz
          omp threads                :                     1
          number of atoms            :                    15
          number of electrons        :                    36
          charge                     :                     0
          spin                       :                   0.0
          first test random number   :      0.56833066526246


########################################################################
# WARNING! Please study the warnings concerning your input carefully
#  - the use of '-opt' is discouraged, please use '--opt' next time
########################################################################

           ------------------------------------------------- 
          |                 G F N 2 - x T B                 |
          | Geometry, Frequencies, Noncovalent interactions |
          |            JCTC 2019 parametrisation            |
           ------------------------------------------------- 
             KAB for C  - Si     :                1.0500
             KAB for H  - Pd     :                0.9500
             k(s)              :                1.8500
             k(p)              :                2.2300
             k(d)              :                2.2300
             k(f)              :                2.0000
             kEN (H0ij)        :               -2.0000
             D4 a1             :                0.5200
             D4 a2             :                5.0000
             D4 s6             :                1.0000
             D4 s8             :                2.7000
             D4 s9             :                5.0000
             alphaj            :                2.0000

  Z AO/shell   Hii/eV     exponent
  1     Wed Apr 25 08:07:45 CEST 2018   EN: 2.200 GM2: 0.406  GM3: 0.0800  RAES: 1.40
     1s    -10.707211    1.230000
  6     Wed Apr 25 08:07:45 CEST 2018   EN: 2.550 GM2: 0.538  GM3: 0.1500  RAES: 3.00
     2s    -13.970922    2.096432
     2p    -10.063292    1.800000

           ------------------------------------------------- 
          |        Self-Consistent Charge Iterations        |
           ------------------------------------------------- 

          ...................................................
          :                      SETUP                      :
          :.................................................:
          :  # basis functions                  36          :
          :  # atomic orbitals                  36          :
          :  # shells                           22          :
          :  # electrons                        36          :
          :  max. iterations                   250          :
          :  Hamiltonian                  GFN2-xTB          :
          :  restarted?                      false          :
          :  GBSA solvation                  false          :
          :  PC potential                    false          :
          :  electronic temp.          300.0000000     K    :
          :  accuracy                    1.0000000          :
          :  -> integral cutoff          0.2500000E+02      :
          :  -> integral neglect         0.1000000E-07      :
          :  -> SCF convergence          0.1000000E-05 Eh   :
          :  -> wf. convergence          0.1000000E-03 e    :
          :  Broyden damping             0.4000000          :
          ...................................................

 iter      E             dE          RMSdq      gap      omega  full diag
   1    -19.3294515 -0.193295E+02  0.422E+00    3.25       0.0  T
   2    -19.3468488 -0.173973E-01  0.249E+00    3.26       1.0  T
   3    -19.3422085  0.464028E-02  0.883E-01    3.25       1.0  T
   4    -19.3465597 -0.435115E-02  0.446E-01    3.26       1.0  T
   5    -19.3485458 -0.198609E-02  0.806E-02    3.25       1.0  T
   6    -19.3485769 -0.311333E-04  0.459E-02    3.25       1.0  T
   7    -19.3485882 -0.112717E-04  0.249E-02    3.25       1.0  T
   8    -19.3485910 -0.284694E-05  0.242E-03    3.25      10.7  T
   9    -19.3485910 -0.208152E-07  0.947E-04    3.25      27.3  T
  10    -19.3485910 -0.383977E-08  0.447E-04    3.25      57.7  T

   *** convergence criteria satisfied after 10 iterations ***

         #    Occupation            Energy/Eh            Energy/eV
      -------------------------------------------------------------
         1        2.0000           -0.6427150             -17.4892
       ...           ...                  ...                  ...
        12        2.0000           -0.4491645             -12.2224
        13        2.0000           -0.4485037             -12.2044
        14        2.0000           -0.4440240             -12.0825
        15        2.0000           -0.4328903             -11.7795
        16        2.0000           -0.4221757             -11.4880
        17        2.0000           -0.3992367             -10.8638
        18        2.0000           -0.3658979              -9.9566 (HOMO)
        19                         -0.2465306              -6.7084 (LUMO)
        20                         -0.2039205              -5.5490
        21                         -0.1057510              -2.8776
        22                          0.0990096               2.6942
        23                          0.1072039               2.9172
       ...                                ...                  ...
        36                          0.7020898              19.1048
      -------------------------------------------------------------
                  HL-Gap            0.1193673 Eh            3.2481 eV
             Fermi-level           -0.3062143 Eh           -8.3325 eV

 SCC (total)                   0 d,  0 h,  0 min,  0.013 sec
 SCC setup                      ...        0 min,  0.000 sec (  1.414%)
 Dispersion                     ...        0 min,  0.000 sec (  1.194%)
 integral evaluation            ...        0 min,  0.002 sec ( 18.723%)
 zeroth order Hamiltonian       ...        0 min,  0.000 sec (  0.464%)
 iterations                     ...        0 min,  0.005 sec ( 41.798%)
 molecular gradient             ...        0 min,  0.004 sec ( 34.126%)
 printout                       ...        0 min,  0.000 sec (  1.939%)

         :::::::::::::::::::::::::::::::::::::::::::::::::::::
         ::                     SUMMARY                     ::
         :::::::::::::::::::::::::::::::::::::::::::::::::::::
         :: total energy             -18.993139495091 Eh    ::
         :: gradient norm              0.029587077894 Eh/a0 ::
         :: HOMO-LUMO gap              3.248149291240 eV    ::
         ::.................................................::
         :: SCC energy               -19.348591027972 Eh    ::
         :: -> isotropic ES            0.002566232506 Eh    ::
         :: -> anisotropic ES          0.004015855594 Eh    ::
         :: -> anisotropic XC          0.015271513275 Eh    ::
         :: -> dispersion             -0.010158684027 Eh    ::
         :: repulsion energy           0.355441283443 Eh    ::
         :: add. restraining           0.000000000000 Eh    ::
         :::::::::::::::::::::::::::::::::::::::::::::::::::::

      ----------------------------------------------------------- 
     |                   =====================                   |
     |                        A N C O P T                        |
     |                   =====================                   |
     |               Approximate Normal Coordinate               |
     |                Rational Function Optimizer                |
      ----------------------------------------------------------- 

          ...................................................
          :                      SETUP                      :
          :.................................................:
          :   optimization level            normal          :
          :   max. optcycles                   200          :
          :   ANC micro-cycles                  20          :
          :   degrees of freedom                39          :
          :.................................................:
          :   RF solver                   davidson          :
          :   input Hessian                  false          :
          :   write xtbopt.log                true          :
          :   linear?                        false          :
          :   energy convergence         0.5000000E-05 Eh   :
          :   grad. convergence          0.1000000E-02 Eh/α :
          :   maximium RF displ.         2.0000000          :
          :   Hlow (freq-cutoff)         0.5000000E-02      :
          :   Hmax (freq-cutoff)         5.0000000          :
          :   S6 in model hess.         20.0000000          :
          ...................................................

generating ANC from model Hessian ...
Using Lindh-Hessian (1995)
 Shifting diagonal of input Hessian by   1.189390628935289E-003
 Lowest  eigenvalues of input Hessian
   -0.000000   -0.000000   -0.000000   -0.000000    0.000000    0.000000
    0.005000    0.007005    0.010818    0.016208    0.016719    0.027941
    0.038925    0.044530    0.048480    0.062480    0.073579    0.079926
 Highest eigenvalues
    1.396110    1.516221    1.708745    1.766966    1.860477    2.040182
 

........................................................................
.............................. CYCLE    1 ..............................
........................................................................
   1    -19.3485910 -0.193486E+02  0.154E-04    3.25       0.0  T
   2    -19.3485910 -0.190887E-10  0.102E-04    3.25     252.3  T
   3    -19.3485910 -0.274269E-11  0.757E-05    3.25     340.9  T
     SCC iter.                  ...        0 min,  0.002 sec
     gradient                   ...        0 min,  0.004 sec
 * total energy  :   -18.9931395 Eh     change       -0.4275408E-07 Eh
   gradient norm :     0.0295854 Eh/α   predicted     0.0000000E+00 (-100.00%)
   displ. norm   :     0.1890045 α      lambda       -0.1937739E-02
   maximum displ.:     0.1074483 α      in ANC's #3, #2, #1, ...

........................................................................
.............................. CYCLE    2 ..............................
........................................................................
   1    -19.3561831 -0.193562E+02  0.137E-01    3.25       0.0  T
   2    -19.3561859 -0.275983E-05  0.843E-02    3.24       1.0  T
   3    -19.3561648  0.210884E-04  0.414E-02    3.24       1.0  T
   4    -19.3561887 -0.239236E-04  0.499E-03    3.25       5.2  T
   5    -19.3561888 -0.127330E-06  0.298E-03    3.25       8.7  T
   6    -19.3561889 -0.368089E-07  0.148E-03    3.25      17.4  T
     SCC iter.                  ...        0 min,  0.003 sec
     gradient                   ...        0 min,  0.004 sec
 * total energy  :   -18.9943958 Eh     change       -0.1256243E-02 Eh
   gradient norm :     0.0101477 Eh/α   predicted    -0.1003482E-02 ( -20.12%)
   displ. norm   :     0.1538980 α      lambda       -0.4680996E-03
   maximum displ.:     0.1046618 α      in ANC's #3, #2, #1, ...

........................................................................
.............................. CYCLE    3 ..............................
........................................................................
   1    -19.3588792 -0.193589E+02  0.106E-01    3.25       0.0  T
   2    -19.3588801 -0.928563E-06  0.639E-02    3.25       1.0  T
   3    -19.3588690  0.111297E-04  0.302E-02    3.25       1.0  T
   4    -19.3588817 -0.127261E-04  0.242E-03    3.25      10.7  T
   5    -19.3588817 -0.121198E-07  0.146E-03    3.25      17.7  T
   6    -19.3588817 -0.103503E-08  0.943E-04    3.25      27.4  T
     SCC iter.                  ...        0 min,  0.003 sec
     gradient                   ...        0 min,  0.004 sec
 * total energy  :   -18.9946703 Eh     change       -0.2745355E-03 Eh
   gradient norm :     0.0031773 Eh/α   predicted    -0.2395959E-03 ( -12.73%)
   displ. norm   :     0.0952362 α      lambda       -0.8772593E-04
   maximum displ.:     0.0579289 α      in ANC's #1, #2, #3, ...

........................................................................
.............................. CYCLE    4 ..............................
........................................................................
   1    -19.3585859 -0.193586E+02  0.636E-02    3.26       0.0  T
   2    -19.3585861 -0.186616E-06  0.376E-02    3.26       1.0  T
   3    -19.3585843  0.178013E-05  0.119E-02    3.26       2.2  T
   4    -19.3585863 -0.197847E-05  0.133E-03    3.26      19.4  T
   5    -19.3585863 -0.779778E-08  0.791E-04    3.26      32.7  T
   6    -19.3585863 -0.371634E-08  0.400E-04    3.26      64.6  T
     SCC iter.                  ...        0 min,  0.003 sec
     gradient                   ...        0 min,  0.004 sec
 * total energy  :   -18.9947278 Eh     change       -0.5749627E-04 Eh
   gradient norm :     0.0020433 Eh/α   predicted    -0.4426229E-04 ( -23.02%)
   displ. norm   :     0.0788073 α      lambda       -0.4071561E-04
   maximum displ.:     0.0619698 α      in ANC's #1, #2, #3, ...

........................................................................
.............................. CYCLE    5 ..............................
........................................................................
   1    -19.3583613 -0.193584E+02  0.573E-02    3.26       0.0  T
   2    -19.3583614 -0.726645E-07  0.337E-02    3.26       1.0  T
   3    -19.3583607  0.677063E-06  0.769E-03    3.26       3.4  T
   4    -19.3583615 -0.746625E-06  0.697E-04    3.26      37.0  T
   5    -19.3583615 -0.292810E-08  0.359E-04    3.26      71.9  T
     SCC iter.                  ...        0 min,  0.002 sec
     gradient                   ...        0 min,  0.004 sec
 * total energy  :   -18.9947584 Eh     change       -0.3060065E-04 Eh
   gradient norm :     0.0020808 Eh/α   predicted    -0.2048473E-04 ( -33.06%)
   displ. norm   :     0.0762891 α      lambda       -0.3746353E-04
   maximum displ.:     0.0620368 α      in ANC's #1, #2, #5, ...

........................................................................
.............................. CYCLE    6 ..............................
........................................................................
   1    -19.3583550 -0.193584E+02  0.620E-02    3.26       0.0  T
   2    -19.3583550 -0.739578E-07  0.366E-02    3.26       1.0  T
   3    -19.3583546  0.473360E-06  0.649E-03    3.26       4.0  T
   4    -19.3583551 -0.531297E-06  0.678E-04    3.26      38.1  T
   5    -19.3583551 -0.264233E-08  0.402E-04    3.26      64.2  T
     SCC iter.                  ...        0 min,  0.002 sec
     gradient                   ...        0 min,  0.004 sec
 * total energy  :   -18.9947864 Eh     change       -0.2802359E-04 Eh
   gradient norm :     0.0020510 Eh/α   predicted    -0.1884294E-04 ( -32.76%)
   displ. norm   :     0.0917366 α      lambda       -0.3970727E-04
   maximum displ.:     0.0784724 α      in ANC's #1, #2, #5, ...

........................................................................
.............................. CYCLE    7 ..............................
........................................................................
   1    -19.3584777 -0.193585E+02  0.709E-02    3.26       0.0  T
   2    -19.3584778 -0.889341E-07  0.417E-02    3.26       1.0  T
   3    -19.3584774  0.364064E-06  0.576E-03    3.26       4.5  T
   4    -19.3584779 -0.422185E-06  0.628E-04    3.26      41.1  T
   5    -19.3584779 -0.319092E-08  0.328E-04    3.26      78.8  T
     SCC iter.                  ...        0 min,  0.002 sec
     gradient                   ...        0 min,  0.004 sec
 * total energy  :   -18.9948194 Eh     change       -0.3292102E-04 Eh
   gradient norm :     0.0020375 Eh/α   predicted    -0.2001928E-04 ( -39.19%)
   displ. norm   :     0.0865180 α      lambda       -0.3351651E-04
   maximum displ.:     0.0755856 α      in ANC's #1, #2, #3, ...

........................................................................
.............................. CYCLE    8 ..............................
........................................................................
   1    -19.3586281 -0.193586E+02  0.645E-02    3.25       0.0  T
   2    -19.3586282 -0.615041E-07  0.379E-02    3.25       1.0  T
   3    -19.3586282 -0.149403E-07  0.117E-03    3.25      22.1  T
   4    -19.3586282 -0.129305E-07  0.528E-04    3.25      48.9  T
   5    -19.3586282 -0.195711E-08  0.206E-04    3.25     125.1  T
     SCC iter.                  ...        0 min,  0.002 sec
     gradient                   ...        0 min,  0.004 sec
 * total energy  :   -18.9948484 Eh     change       -0.2899241E-04 Eh
   gradient norm :     0.0016957 Eh/α   predicted    -0.1688434E-04 ( -41.76%)
   displ. norm   :     0.1283378 α      lambda       -0.2795074E-04
   maximum displ.:     0.1152025 α      in ANC's #1, #2, #3, ...

........................................................................
.............................. CYCLE    9 ..............................
........................................................................
   1    -19.3586653 -0.193587E+02  0.956E-02    3.25       0.0  T
   2    -19.3586655 -0.149537E-06  0.562E-02    3.25       1.0  T
   3    -19.3586653  0.188024E-06  0.423E-03    3.25       6.1  T
   4    -19.3586656 -0.270989E-06  0.734E-04    3.25      35.2  T
   5    -19.3586656 -0.207434E-08  0.407E-04    3.25      63.5  T
     SCC iter.                  ...        0 min,  0.002 sec
     gradient                   ...        0 min,  0.004 sec
 * total energy  :   -18.9948810 Eh     change       -0.3266394E-04 Eh
   gradient norm :     0.0011783 Eh/α   predicted    -0.1407850E-04 ( -56.90%)
   displ. norm   :     0.0820933 α      lambda       -0.1343546E-04
   maximum displ.:     0.0780714 α      in ANC's #1, #2, #3, ...

........................................................................
.............................. CYCLE   10 ..............................
........................................................................
   1    -19.3587631 -0.193588E+02  0.601E-02    3.25       0.0  T
   2    -19.3587632 -0.628688E-07  0.353E-02    3.25       1.0  T
   3    -19.3587630  0.162622E-06  0.383E-03    3.25       6.7  T
   4    -19.3587633 -0.203008E-06  0.403E-04    3.25      64.1  T
   5    -19.3587633 -0.690790E-09  0.247E-04    3.25     104.4  T
     SCC iter.                  ...        0 min,  0.002 sec
     gradient                   ...        0 min,  0.004 sec
 * total energy  :   -18.9948978 Eh     change       -0.1676077E-04 Eh
   gradient norm :     0.0008571 Eh/α   predicted    -0.6739122E-05 ( -59.79%)
   displ. norm   :     0.0703458 α      lambda       -0.1079370E-04
   maximum displ.:     0.0670655 α      in ANC's #1, #2, #5, ...

........................................................................
.............................. CYCLE   11 ..............................
........................................................................
   1    -19.3588262 -0.193588E+02  0.530E-02    3.25       0.0  T
   2    -19.3588262 -0.387665E-07  0.312E-02    3.25       1.0  T
   3    -19.3588260  0.246383E-06  0.458E-03    3.25       5.6  T
   4    -19.3588263 -0.282291E-06  0.428E-04    3.25      60.3  T
   5    -19.3588263 -0.359350E-09  0.304E-04    3.25      84.8  T
     SCC iter.                  ...        0 min,  0.002 sec
     gradient                   ...        0 min,  0.004 sec
 * total energy  :   -18.9949101 Eh     change       -0.1234601E-04 Eh
   gradient norm :     0.0009014 Eh/α   predicted    -0.5407983E-05 ( -56.20%)
   displ. norm   :     0.0614166 α      lambda       -0.7874070E-05
   maximum displ.:     0.0593003 α      in ANC's #1, #2, #7, ...

........................................................................
.............................. CYCLE   12 ..............................
........................................................................
   1    -19.3586960 -0.193587E+02  0.447E-02    3.25       0.0  T
   2    -19.3586960 -0.323684E-07  0.263E-02    3.25       1.0  T
   3    -19.3586959  0.899348E-07  0.303E-03    3.25       8.5  T
   4    -19.3586961 -0.111293E-06  0.383E-04    3.25      67.4  T
   5    -19.3586961 -0.379480E-09  0.257E-04    3.25     100.5  T
     SCC iter.                  ...        0 min,  0.002 sec
     gradient                   ...        0 min,  0.004 sec
 * total energy  :   -18.9949190 Eh     change       -0.8842999E-05 Eh
   gradient norm :     0.0005409 Eh/α   predicted    -0.3942373E-05 ( -55.42%)
   displ. norm   :     0.0515759 α      lambda       -0.4985496E-05
   maximum displ.:     0.0495156 α      in ANC's #1, #4, #7, ...

........................................................................
.............................. CYCLE   13 ..............................
........................................................................
   1    -19.3588603 -0.193589E+02  0.359E-02    3.25       0.0  T
   2    -19.3588603 -0.259303E-07  0.211E-02    3.25       1.2  T
   3    -19.3588603  0.458803E-07  0.206E-03    3.25      12.5  T
   4    -19.3588603 -0.593455E-07  0.312E-04    3.25      82.7  T
   5    -19.3588603 -0.461352E-09  0.170E-04    3.25     151.6  T
     SCC iter.                  ...        0 min,  0.002 sec
     gradient                   ...        0 min,  0.004 sec
 * total energy  :   -18.9949236 Eh     change       -0.4600836E-05 Eh
   gradient norm :     0.0005712 Eh/α   predicted    -0.2494505E-05 ( -45.78%)
   displ. norm   :     0.0374852 α      lambda       -0.2519092E-05
   maximum displ.:     0.0363289 α      in ANC's #1, #2, #24, ...

   *** GEOMETRY OPTIMIZATION CONVERGED AFTER 13 ITERATIONS ***

------------------------------------------------------------------------
 total energy gain   :        -0.0017841 Eh       -1.1195 kcal/mol
 total RMSD          :         0.2546750 a0        0.1348 Å
 total power (kW/mol):        -0.3603134 (step)  -36.2834 (real)
------------------------------------------------------------------------

 ANCopt (total)                0 d,  0 h,  0 min,  0.129 sec
 optimizer setup                ...        0 min,  0.000 sec (  0.100%)
 model hessian                  ...        0 min,  0.002 sec (  1.561%)
 ANC generation                 ...        0 min,  0.000 sec (  0.264%)
 coordinate transformation      ...        0 min,  0.000 sec (  0.108%)
 single point calculation       ...        0 min,  0.123 sec ( 95.166%)
 optimization log               ...        0 min,  0.001 sec (  0.632%)
 hessian update                 ...        0 min,  0.000 sec (  0.182%)
 rational function              ...        0 min,  0.002 sec (  1.409%)

================
 final structure:
================
$coord
    1.07877595264733    1.79322956269211   -0.70228968279091      C 
    2.22080189186466   -0.42894982878450   -0.33143719063871      C 
    0.30480867896565   -2.38344113227265    0.35651382699486      C 
   -2.09876029003099   -0.91743781249685    0.31986812432899      C 
   -1.63375049518015    1.51598637751275   -0.30085055002712      C 
   -3.51042040585191    3.49232375323839   -0.52747603837341      C 
   -3.05699740826472    5.86495619636392   -1.20850438686823      C 
    1.98062767137261    3.53980624535225   -1.20959600976435      H 
    4.20532402785708   -0.83543984196574   -0.48115237631797      H 
    0.67811175663559   -3.20880912879848    2.21260828109355      H 
    0.27707111412279   -3.94256535703290   -0.99753314153316      H 
   -3.90764213153752   -1.74395532047345    0.73454634535675      H 
   -5.42644897973033    2.90855387231822   -0.09913813854473      H 
   -1.18677343009229    6.52716071801187   -1.65888115749376      H 
   -4.54988399217368    7.24078816076248   -1.34186129179789      H 
$end
           -------------------------------------------------
          |                Final Singlepoint                |
           -------------------------------------------------

          ...................................................
          :                      SETUP                      :
          :.................................................:
          :  # basis functions                  36          :
          :  # atomic orbitals                  36          :
          :  # shells                           22          :
          :  # electrons                        36          :
          :  max. iterations                   250          :
          :  Hamiltonian                  GFN2-xTB          :
          :  restarted?                      false          :
          :  GBSA solvation                  false          :
          :  PC potential                    false          :
          :  electronic temp.          300.0000000     K    :
          :  accuracy                    1.0000000          :
          :  -> integral cutoff          0.2500000E+02      :
          :  -> integral neglect         0.1000000E-07      :
          :  -> SCF convergence          0.1000000E-05 Eh   :
          :  -> wf. convergence          0.1000000E-03 e    :
          :  Broyden damping             0.4000000          :
          ...................................................

 iter      E             dE          RMSdq      gap      omega  full diag
   1    -19.3588603 -0.193589E+02  0.121E-04    3.25       0.0  T
   2    -19.3588603  0.283933E-10  0.982E-05    3.25     263.0  T
   3    -19.3588603 -0.147100E-09  0.340E-05    3.25     760.4  T

   *** convergence criteria satisfied after 3 iterations ***

         #    Occupation            Energy/Eh            Energy/eV
      -------------------------------------------------------------
         1        2.0000           -0.6425823             -17.4856
       ...           ...                  ...                  ...
        12        2.0000           -0.4505683             -12.2606
        13        2.0000           -0.4459683             -12.1354
        14        2.0000           -0.4453461             -12.1185
        15        2.0000           -0.4364632             -11.8768
        16        2.0000           -0.4191162             -11.4047
        17        2.0000           -0.3997922             -10.8789
        18        2.0000           -0.3660482              -9.9607 (HOMO)
        19                         -0.2467090              -6.7133 (LUMO)
        20                         -0.2014765              -5.4825
        21                         -0.1028500              -2.7987
        22                          0.1070929               2.9141
        23                          0.1111926               3.0257
       ...                                ...                  ...
        36                          0.7107522              19.3406
      -------------------------------------------------------------
                  HL-Gap            0.1193392 Eh            3.2474 eV
             Fermi-level           -0.3063786 Eh           -8.3370 eV

 SCC (total)                   0 d,  0 h,  0 min,  0.009 sec
 SCC setup                      ...        0 min,  0.000 sec (  1.314%)
 Dispersion                     ...        0 min,  0.000 sec (  0.871%)
 integral evaluation            ...        0 min,  0.002 sec ( 26.680%)
 zeroth order Hamiltonian       ...        0 min,  0.000 sec (  0.588%)
 iterations                     ...        0 min,  0.002 sec ( 18.441%)
 molecular gradient             ...        0 min,  0.004 sec ( 49.470%)
 printout                       ...        0 min,  0.000 sec (  2.182%)

         :::::::::::::::::::::::::::::::::::::::::::::::::::::
         ::                     SUMMARY                     ::
         :::::::::::::::::::::::::::::::::::::::::::::::::::::
         :: total energy             -18.994923564532 Eh    ::
         :: gradient norm              0.000571001847 Eh/a0 ::
         :: HOMO-LUMO gap              3.247384766209 eV    ::
         ::.................................................::
         :: SCC energy               -19.358860347766 Eh    ::
         :: -> isotropic ES            0.002585997145 Eh    ::
         :: -> anisotropic ES          0.004042632967 Eh    ::
         :: -> anisotropic XC          0.014919679793 Eh    ::
         :: -> dispersion             -0.010178574779 Eh    ::
         :: repulsion energy           0.363927070887 Eh    ::
         :: add. restraining           0.000000000000 Eh    ::
         :::::::::::::::::::::::::::::::::::::::::::::::::::::

           -------------------------------------------------
          |                Property Printout                |
           -------------------------------------------------

    * Orbital Energies and Occupations

         #    Occupation            Energy/Eh            Energy/eV
      -------------------------------------------------------------
         1        2.0000           -0.6425823             -17.4856
       ...           ...                  ...                  ...
         6        2.0000           -0.5472792             -14.8922
         7        2.0000           -0.5288722             -14.3913
         8        2.0000           -0.5143819             -13.9970
         9        2.0000           -0.5032597             -13.6944
        10        2.0000           -0.4873010             -13.2601
        11        2.0000           -0.4590620             -12.4917
        12        2.0000           -0.4505683             -12.2606
        13        2.0000           -0.4459683             -12.1354
        14        2.0000           -0.4453461             -12.1185
        15        2.0000           -0.4364632             -11.8768
        16        2.0000           -0.4191162             -11.4047
        17        2.0000           -0.3997922             -10.8789
        18        2.0000           -0.3660482              -9.9607 (HOMO)
        19                         -0.2467090              -6.7133 (LUMO)
        20                         -0.2014765              -5.4825
        21                         -0.1028500              -2.7987
        22                          0.1070929               2.9141
        23                          0.1111926               3.0257
        24                          0.1164504               3.1688
        25                          0.1434917               3.9046
        26                          0.1637418               4.4556
        27                          0.1834026               4.9906
        28                          0.2195361               5.9739
        29                          0.2249172               6.1203
       ...                                ...                  ...
        36                          0.7107522              19.3406
      -------------------------------------------------------------
                  HL-Gap            0.1193392 Eh            3.2474 eV
             Fermi-level           -0.3063786 Eh           -8.3370 eV

     #   Z        covCN         q      C6AA      α(0)
     1   6 C      3.003    -0.042    29.026     8.838
     2   6 C      2.989    -0.045    29.105     8.850
     3   6 C      3.888    -0.061    21.622     6.611
     4   6 C      3.000    -0.050    29.218     8.867
     5   6 C      3.048     0.005    27.864     8.657
     6   6 C      2.890    -0.028    28.701     8.783
     7   6 C      2.839    -0.087    30.162     9.000
     8   1 H      0.926     0.029     2.598     2.521
     9   1 H      0.926     0.026     2.644     2.543
    10   1 H      0.924     0.063     2.163     2.300
    11   1 H      0.924     0.063     2.162     2.299
    12   1 H      0.926     0.026     2.637     2.539
    13   1 H      0.925     0.029     2.600     2.522
    14   1 H      0.926     0.039     2.461     2.453
    15   1 H      0.926     0.031     2.567     2.505

 Mol. C6AA /au·bohr⁶  :       2451.940696
 Mol. C8AA /au·bohr⁸  :      58752.961913
 Mol. α(0) /au        :         79.288441


Wiberg/Mayer (AO) data.
largest (>0.10) Wiberg bond orders for each atom
          total WBO             WBO to atom ...
     1  C   3.990        C    2 1.824    C    5 1.104    H    8 0.970
     2  C   3.988        C    1 1.824    C    3 1.038    H    9 0.973    C    4 0.108
     3  C   3.998        C    4 1.046    C    2 1.038    H   10 0.932    H   11 0.931
     4  C   3.987        C    5 1.693    C    3 1.046    H   12 0.973    C    7 0.124    C    2 0.108
     5  C   3.987        C    4 1.693    C    6 1.104    C    1 1.104
     6  C   3.993        C    7 1.892    C    5 1.104    H   13 0.965
     7  C   3.984        C    6 1.892    H   15 0.979    H   14 0.975    C    4 0.124
     8  H   0.999        C    1 0.970
     9  H   0.999        C    2 0.973
    10  H   0.992        C    3 0.932
    11  H   0.992        C    3 0.931
    12  H   0.999        C    4 0.973
    13  H   0.999        C    6 0.965
    14  H   0.998        C    7 0.975
    15  H   0.998        C    7 0.979

molecular dipole:
                 x           y           z       tot (Debye)
 q only:        0.073      -0.313       0.063
   full:        0.075      -0.374       0.076       0.988
molecular quadrupole (traceless):
                xx          xy          yy          xz          yz          zz
 q only:       -0.183       0.134       1.127      -0.173      -0.461      -0.943
  q+dip:        1.090       0.179       3.206      -0.858      -1.866      -4.296
   full:        0.315       0.191       1.809      -0.429      -0.938      -2.124

           -------------------------------------------------
          |                Geometry Summary                 |
           -------------------------------------------------

      molecular mass/u    :       92.1402000
   center of mass at/Å    :       -0.5077679       0.6771587      -0.1815986
  moments of inertia/u·Å² :        0.6939210E+02   0.2571722E+03   0.3234334E+03
rotational constants/cm⁻¹ :        0.2429330E+00   0.6554997E-01   0.5212087E-01

 * 13 selected distances

     #   Z        #   Z                                     value/Å
     1   6 C      2   6 C                                 1.3366138
     2   6 C      3   6 C                                 1.4934000 (max)
     3   6 C      4   6 C                                 1.4899561
     4   6 C      5   6 C                                 1.3515356
     6   6 C      7   6 C                                 1.3280954
     1   6 C      8   1 H                                 1.0742724 (min)
     2   6 C      9   1 H                                 1.0748914
     3   6 C     10   1 H                                 1.0929367
     3   6 C     11   1 H                                 1.0928607
     4   6 C     12   1 H                                 1.0750432
     6   6 C     13   1 H                                 1.0839000
     7   6 C     14   1 H                                 1.0765983
     7   6 C     15   1 H                                 1.0766395

 * 2 distinct bonds (by element types)

   Z      Z             #   av. dist./Å        max./Å        min./Å
   1 H    6 C           8     1.0808928     1.0929367     1.0742724
   6 C    6 C           5     1.3999202     1.4934000     1.3280954


optimized geometry written to: xtbopt.xyz


           -------------------------------------------------
          | TOTAL ENERGY              -18.994923564532 Eh   |
          | GRADIENT NORM               0.000571001847 Eh/α |
          | HOMO-LUMO GAP               3.247384766209 eV   |
           -------------------------------------------------

------------------------------------------------------------------------
 * finished run on 2021/05/19 at 10:58:54.431     
------------------------------------------------------------------------
 total:
 * wall-time:     0 d,  0 h,  0 min,  0.165 sec
 *  cpu-time:     0 d,  0 h,  0 min,  0.165 sec
 * ratio c/w:     0.998 speedup
 SCF:
 * wall-time:     0 d,  0 h,  0 min,  0.013 sec
 *  cpu-time:     0 d,  0 h,  0 min,  0.013 sec
 * ratio c/w:     1.000 speedup
 ANC optimizer:
 * wall-time:     0 d,  0 h,  0 min,  0.138 sec
 *  cpu-time:     0 d,  0 h,  0 min,  0.138 sec
 * ratio c/w:     1.000 speedup

