      -----------------------------------------------------------      
     |                   =====================                   |     
     |                           x T B                           |     
     |                   =====================                   |     
     |                         S. Grimme                         |     
     |          Mulliken Center for Theoretical Chemistry        |     
     |                    University of Bonn                     |     
     |                Version 6.2 RC2 (SAW190805)                |     
      -----------------------------------------------------------      

   This program is distributed in the hope that it will be useful,
   but WITHOUT ANY WARRANTY; without even the implied warranty of
   MERCHANTABILITY or FITNESS FOR A PARTICULAR PURPOSE.
   
   FOR NON-COMMERCIAL, ACADEMIA USE ONLY.
   
   Cite this work as:
   * S. Grimme, C. Bannwarth, P. Shushkov, J. Chem. Theory Comput., 2017,
     13, 1989-2009. DOI: 10.1021/acs.jctc.7b00118
   * C. Bannwarth, S. Ehlert and S. Grimme., J. Chem. Theory Comput., 2019,
     15, 1652-1671. DOI: 10.1021/acs.jctc.8b01176
   * P. Pracht, E. Caldeweyher, S. Ehlert, S. Grimme, ChemRxiv, 2019, preprint.
     DOI: 10.26434/chemrxiv.8326202.v1
   
   for DFT-D4:
   * E. Caldeweyher, C. Bannwarth and S. Grimme, J. Chem. Phys., 2017,
     147, 034112. DOI: 10.1063/1.4993215
   * E. Caldeweyher, S. Ehlert, A. Hansen, H. Neugebauer, S. Spicher,
     C. Bannwarth and S. Grimme, J. Chem. Phys., 2019, 150, 154122.
     DOI: 10.1063/1.5090222
   
   for sTDA-xTB:
   * S. Grimme and C. Bannwarth, J. Chem. Phys., 2016, 145, 054103.
     DOI: 10.1063/1.4959605
   
   in the mass-spec context:
   * V. Asgeirsson, C. Bauer and S. Grimme, Chem. Sci., 2017, 8, 4879.
     DOI: 10.1039/c7sc00601b
   
   for metadynamics refer to:
   * S. Grimme, J. Chem. Theory Comput., 2019, 155, 2847-2862
     DOI: 10.1021/acs.jctc.9b00143
   
   with help from (in alphabetical order)
   C. Bannwarth, F. Bohle, G. Brandenburg, E. Caldeweyher, M. Checinski,
   S. Dohm, S. Ehlert, S. Ehrlich, F. März, H. Neugebauer, J. Pisarek,
   P. Pracht, P. Shushkov, and S. Spicher.
   
 * started run on 2021/05/19 at 10:58:54.535     

           -------------------------------------------------
          |                Calculation Setup                |
           -------------------------------------------------

          program call               : /ihome/ghutchison/geoffh/xtb/xtb 307.xyz -opt
          hostname                   : smp-n122
          coordinate file            : 307.xyz
          omp threads                :                     1
          number of atoms            :                    24
          number of electrons        :                    64
          charge                     :                     0
          spin                       :                   0.0
          first test random number   :      0.36801790971380


########################################################################
# WARNING! Please study the warnings concerning your input carefully
#  - the use of '-opt' is discouraged, please use '--opt' next time
########################################################################

           ------------------------------------------------- 
          |                 G F N 2 - x T B                 |
          | Geometry, Frequencies, Noncovalent interactions |
          |            JCTC 2019 parametrisation            |
           ------------------------------------------------- 
             KAB for C  - Si     :                1.0500
             KAB for H  - Pd     :                0.9500
             k(s)              :                1.8500
             k(p)              :                2.2300
             k(d)              :                2.2300
             k(f)              :                2.0000
             kEN (H0ij)        :               -2.0000
             D4 a1             :                0.5200
             D4 a2             :                5.0000
             D4 s6             :                1.0000
             D4 s8             :                2.7000
             D4 s9             :                5.0000
             alphaj            :                2.0000

  Z AO/shell   Hii/eV     exponent
  1     Wed Apr 25 08:07:45 CEST 2018   EN: 2.200 GM2: 0.406  GM3: 0.0800  RAES: 1.40
     1s    -10.707211    1.230000
  6     Wed Apr 25 08:07:45 CEST 2018   EN: 2.550 GM2: 0.538  GM3: 0.1500  RAES: 3.00
     2s    -13.970922    2.096432
     2p    -10.063292    1.800000
  8     Wed Apr 25 08:07:45 CEST 2018   EN: 3.440 GM2: 0.452  GM3:-0.0517  RAES: 1.80
     2s    -20.229985    2.439742
     2p    -15.503117    2.137023

           ------------------------------------------------- 
          |        Self-Consistent Charge Iterations        |
           ------------------------------------------------- 

          ...................................................
          :                      SETUP                      :
          :.................................................:
          :  # basis functions                  60          :
          :  # atomic orbitals                  60          :
          :  # shells                           36          :
          :  # electrons                        64          :
          :  max. iterations                   250          :
          :  Hamiltonian                  GFN2-xTB          :
          :  restarted?                      false          :
          :  GBSA solvation                  false          :
          :  PC potential                    false          :
          :  electronic temp.          300.0000000     K    :
          :  accuracy                    1.0000000          :
          :  -> integral cutoff          0.2500000E+02      :
          :  -> integral neglect         0.1000000E-07      :
          :  -> SCF convergence          0.1000000E-05 Eh   :
          :  -> wf. convergence          0.1000000E-03 e    :
          :  Broyden damping             0.4000000          :
          ...................................................

 iter      E             dE          RMSdq      gap      omega  full diag
   1    -36.0581743 -0.360582E+02  0.465E+00    3.12       0.0  T
   2    -36.1028283 -0.446540E-01  0.262E+00    3.24       1.0  T
   3    -36.0996058  0.322255E-02  0.939E-01    3.04       1.0  T
   4    -36.1043915 -0.478569E-02  0.329E-01    3.28       1.0  T
   5    -36.1062684 -0.187696E-02  0.105E-01    3.23       1.0  T
   6    -36.1063407 -0.722912E-04  0.598E-02    3.22       1.0  T
   7    -36.1063647 -0.239754E-04  0.277E-02    3.23       1.0  T
   8    -36.1063696 -0.487166E-05  0.111E-02    3.23       1.8  T
   9    -36.1063714 -0.185453E-05  0.256E-03    3.23       8.0  T
  10    -36.1063714 -0.242621E-07  0.913E-04    3.23      22.3  T
  11    -36.1063714 -0.158139E-08  0.521E-04    3.23      39.1  T

   *** convergence criteria satisfied after 11 iterations ***

         #    Occupation            Energy/Eh            Energy/eV
      -------------------------------------------------------------
         1        2.0000           -0.7094075             -19.3040
       ...           ...                  ...                  ...
        26        2.0000           -0.4504660             -12.2578
        27        2.0000           -0.4304896             -11.7142
        28        2.0000           -0.4283935             -11.6572
        29        2.0000           -0.4170432             -11.3483
        30        2.0000           -0.4104669             -11.1694
        31        2.0000           -0.3832432             -10.4286
        32        2.0000           -0.3620197              -9.8511 (HOMO)
        33                         -0.2434727              -6.6252 (LUMO)
        34                         -0.2113512              -5.7512
        35                         -0.1739443              -4.7333
        36                         -0.0831567              -2.2628
        37                          0.0178563               0.4859
       ...                                ...                  ...
        60                          0.6569920              17.8777
      -------------------------------------------------------------
                  HL-Gap            0.1185469 Eh            3.2258 eV
             Fermi-level           -0.3027462 Eh           -8.2381 eV

 SCC (total)                   0 d,  0 h,  0 min,  0.029 sec
 SCC setup                      ...        0 min,  0.000 sec (  0.903%)
 Dispersion                     ...        0 min,  0.000 sec (  1.091%)
 integral evaluation            ...        0 min,  0.007 sec ( 22.417%)
 zeroth order Hamiltonian       ...        0 min,  0.000 sec (  0.455%)
 iterations                     ...        0 min,  0.011 sec ( 37.082%)
 molecular gradient             ...        0 min,  0.011 sec ( 36.791%)
 printout                       ...        0 min,  0.000 sec (  1.091%)

         :::::::::::::::::::::::::::::::::::::::::::::::::::::
         ::                     SUMMARY                     ::
         :::::::::::::::::::::::::::::::::::::::::::::::::::::
         :: total energy             -35.617589099878 Eh    ::
         :: gradient norm              0.038503744070 Eh/a0 ::
         :: HOMO-LUMO gap              3.225826467984 eV    ::
         ::.................................................::
         :: SCC energy               -36.106371442079 Eh    ::
         :: -> isotropic ES            0.031095497939 Eh    ::
         :: -> anisotropic ES          0.006055282368 Eh    ::
         :: -> anisotropic XC          0.013485676281 Eh    ::
         :: -> dispersion             -0.019847981108 Eh    ::
         :: repulsion energy           0.488766789872 Eh    ::
         :: add. restraining           0.000000000000 Eh    ::
         :::::::::::::::::::::::::::::::::::::::::::::::::::::

      ----------------------------------------------------------- 
     |                   =====================                   |
     |                        A N C O P T                        |
     |                   =====================                   |
     |               Approximate Normal Coordinate               |
     |                Rational Function Optimizer                |
      ----------------------------------------------------------- 

          ...................................................
          :                      SETUP                      :
          :.................................................:
          :   optimization level            normal          :
          :   max. optcycles                   200          :
          :   ANC micro-cycles                  20          :
          :   degrees of freedom                66          :
          :.................................................:
          :   RF solver                   davidson          :
          :   input Hessian                  false          :
          :   write xtbopt.log                true          :
          :   linear?                        false          :
          :   energy convergence         0.5000000E-05 Eh   :
          :   grad. convergence          0.1000000E-02 Eh/α :
          :   maximium RF displ.         2.0000000          :
          :   Hlow (freq-cutoff)         0.5000000E-02      :
          :   Hmax (freq-cutoff)         5.0000000          :
          :   S6 in model hess.         20.0000000          :
          ...................................................

generating ANC from model Hessian ...
Using Lindh-Hessian (1995)
 Shifting diagonal of input Hessian by   3.732417629436402E-003
 Lowest  eigenvalues of input Hessian
   -0.000000   -0.000000   -0.000000    0.000000    0.000000    0.000000
    0.005000    0.006188    0.006354    0.007623    0.008734    0.008897
    0.009265    0.012140    0.015774    0.018164    0.020132    0.026146
 Highest eigenvalues
    1.624479    1.791976    1.836612    1.895575    2.005932    2.074399
 

........................................................................
.............................. CYCLE    1 ..............................
........................................................................
   1    -36.1063714 -0.361064E+02  0.135E-04    3.23       0.0  T
   2    -36.1063714 -0.562395E-10  0.803E-05    3.23     254.3  T
   3    -36.1063714 -0.122284E-10  0.552E-05    3.23     369.8  T
     SCC iter.                  ...        0 min,  0.003 sec
     gradient                   ...        0 min,  0.011 sec
 * total energy  :   -35.6175891 Eh     change        0.3674696E-07 Eh
   gradient norm :     0.0385102 Eh/α   predicted     0.0000000E+00 (-100.00%)
   displ. norm   :     0.2332572 α      lambda       -0.4264947E-02
   maximum displ.:     0.1061592 α      in ANC's #7, #13, #19, ...

........................................................................
.............................. CYCLE    2 ..............................
........................................................................
   1    -36.1313936 -0.361314E+02  0.164E-01    3.27       0.0  T
   2    -36.1313993 -0.568511E-05  0.100E-01    3.26       1.0  T
   3    -36.1313772  0.221450E-04  0.337E-02    3.26       1.0  T
   4    -36.1314030 -0.258681E-04  0.588E-03    3.26       3.5  T
   5    -36.1314033 -0.220903E-06  0.329E-03    3.26       6.2  T
   6    -36.1314033 -0.413007E-07  0.143E-03    3.26      14.3  T
     SCC iter.                  ...        0 min,  0.006 sec
     gradient                   ...        0 min,  0.010 sec
 * total energy  :   -35.6203619 Eh     change       -0.2772794E-02 Eh
   gradient norm :     0.0138105 Eh/α   predicted    -0.2248517E-02 ( -18.91%)
   displ. norm   :     0.2100780 α      lambda       -0.9198107E-03
   maximum displ.:     0.1380102 α      in ANC's #7, #2, #1, ...

........................................................................
.............................. CYCLE    3 ..............................
........................................................................
   1    -36.1391906 -0.361392E+02  0.154E-01    3.26       0.0  T
   2    -36.1391970 -0.637816E-05  0.943E-02    3.26       1.0  T
   3    -36.1391859  0.111377E-04  0.247E-02    3.26       1.0  T
   4    -36.1391997 -0.138566E-04  0.608E-03    3.26       3.4  T
   5    -36.1392001 -0.329831E-06  0.323E-03    3.26       6.3  T
   6    -36.1392001 -0.549009E-07  0.157E-03    3.26      13.0  T
   7    -36.1392001 -0.160813E-07  0.328E-04    3.26      62.3  T
     SCC iter.                  ...        0 min,  0.006 sec
     gradient                   ...        0 min,  0.010 sec
 * total energy  :   -35.6209670 Eh     change       -0.6051503E-03 Eh
   gradient norm :     0.0057979 Eh/α   predicted    -0.4802082E-03 ( -20.65%)
   displ. norm   :     0.2303402 α      lambda       -0.4298599E-03
   maximum displ.:     0.1291021 α      in ANC's #2, #7, #1, ...

........................................................................
.............................. CYCLE    4 ..............................
........................................................................
   1    -36.1398061 -0.361398E+02  0.162E-01    3.25       0.0  T
   2    -36.1398133 -0.725558E-05  0.993E-02    3.25       1.0  T
   3    -36.1398056  0.774468E-05  0.234E-02    3.25       1.0  T
   4    -36.1398161 -0.105135E-04  0.605E-03    3.25       3.4  T
   5    -36.1398164 -0.280979E-06  0.349E-03    3.25       5.9  T
   6    -36.1398164 -0.862599E-07  0.163E-03    3.25      12.5  T
   7    -36.1398165 -0.138929E-07  0.343E-04    3.25      59.5  T
     SCC iter.                  ...        0 min,  0.006 sec
     gradient                   ...        0 min,  0.010 sec
 * total energy  :   -35.6212916 Eh     change       -0.3246146E-03 Eh
   gradient norm :     0.0067940 Eh/α   predicted    -0.2263331E-03 ( -30.28%)
   displ. norm   :     0.3248171 α      lambda       -0.4706195E-03
   maximum displ.:     0.1843082 α      in ANC's #2, #1, #7, ...

........................................................................
.............................. CYCLE    5 ..............................
........................................................................
   1    -36.1374572 -0.361375E+02  0.227E-01    3.22       0.0  T
   2    -36.1374696 -0.123760E-04  0.138E-01    3.23       1.0  T
   3    -36.1374561  0.134819E-04  0.312E-02    3.23       1.0  T
   4    -36.1374750 -0.188409E-04  0.723E-03    3.23       2.8  T
   5    -36.1374752 -0.222087E-06  0.447E-03    3.23       4.6  T
   6    -36.1374753 -0.135064E-06  0.215E-03    3.23       9.5  T
   7    -36.1374754 -0.324547E-07  0.404E-04    3.23      50.5  T
     SCC iter.                  ...        0 min,  0.006 sec
     gradient                   ...        0 min,  0.010 sec
 * total energy  :   -35.6216136 Eh     change       -0.3219353E-03 Eh
   gradient norm :     0.0100392 Eh/α   predicted    -0.2601365E-03 ( -19.20%)
   displ. norm   :     0.2835610 α      lambda       -0.4041973E-03
   maximum displ.:     0.1767184 α      in ANC's #2, #1, #8, ...

........................................................................
.............................. CYCLE    6 ..............................
........................................................................
   1    -36.1358365 -0.361358E+02  0.188E-01    3.21       0.0  T
   2    -36.1358445 -0.803319E-05  0.115E-01    3.21       1.0  T
   3    -36.1358305  0.139973E-04  0.313E-02    3.21       1.0  T
   4    -36.1358488 -0.182993E-04  0.615E-03    3.21       3.3  T
   5    -36.1358489 -0.100435E-06  0.405E-03    3.21       5.0  T
   6    -36.1358491 -0.141928E-06  0.157E-03    3.21      13.0  T
   7    -36.1358491 -0.107527E-07  0.329E-04    3.21      62.1  T
     SCC iter.                  ...        0 min,  0.006 sec
     gradient                   ...        0 min,  0.010 sec
 * total energy  :   -35.6218877 Eh     change       -0.2741359E-03 Eh
   gradient norm :     0.0100148 Eh/α   predicted    -0.2183490E-03 ( -20.35%)
   displ. norm   :     0.2707746 α      lambda       -0.3700544E-03
   maximum displ.:     0.1737148 α      in ANC's #2, #1, #8, ...

........................................................................
.............................. CYCLE    7 ..............................
........................................................................
   1    -36.1359671 -0.361360E+02  0.177E-01    3.20       0.0  T
   2    -36.1359731 -0.594151E-05  0.108E-01    3.20       1.0  T
   3    -36.1359606  0.124605E-04  0.287E-02    3.20       1.0  T
   4    -36.1359766 -0.160499E-04  0.555E-03    3.20       3.7  T
   5    -36.1359767 -0.593170E-07  0.380E-03    3.20       5.4  T
   6    -36.1359768 -0.129362E-06  0.120E-03    3.20      17.0  T
   7    -36.1359768 -0.531973E-08  0.224E-04    3.20      91.0  T
     SCC iter.                  ...        0 min,  0.006 sec
     gradient                   ...        0 min,  0.010 sec
 * total energy  :   -35.6221461 Eh     change       -0.2584458E-03 Eh
   gradient norm :     0.0071316 Eh/α   predicted    -0.1985974E-03 ( -23.16%)
   displ. norm   :     0.3160548 α      lambda       -0.3069483E-03
   maximum displ.:     0.2230317 α      in ANC's #2, #1, #8, ...

........................................................................
.............................. CYCLE    8 ..............................
........................................................................
   1    -36.1363147 -0.361363E+02  0.203E-01    3.20       0.0  T
   2    -36.1363206 -0.589012E-05  0.124E-01    3.20       1.0  T
   3    -36.1363140  0.659293E-05  0.219E-02    3.20       1.0  T
   4    -36.1363242 -0.102149E-04  0.613E-03    3.20       3.3  T
   5    -36.1363242 -0.450175E-08  0.402E-03    3.20       5.1  T
   6    -36.1363244 -0.149676E-06  0.115E-03    3.20      17.8  T
   7    -36.1363244 -0.787414E-08  0.168E-04    3.20     121.8  T
     SCC iter.                  ...        0 min,  0.006 sec
     gradient                   ...        0 min,  0.010 sec
 * total energy  :   -35.6223439 Eh     change       -0.1977935E-03 Eh
   gradient norm :     0.0072648 Eh/α   predicted    -0.1688055E-03 ( -14.66%)
   displ. norm   :     0.2061460 α      lambda       -0.2668175E-03
   maximum displ.:     0.1293656 α      in ANC's #2, #1, #7, ...

........................................................................
.............................. CYCLE    9 ..............................
........................................................................
   1    -36.1409313 -0.361409E+02  0.116E-01    3.21       0.0  T
   2    -36.1409325 -0.119501E-05  0.695E-02    3.21       1.0  T
   3    -36.1409325 -0.192866E-07  0.589E-03    3.21       3.5  T
   4    -36.1409330 -0.479761E-06  0.292E-03    3.21       7.0  T
   5    -36.1409330 -0.400498E-07  0.159E-03    3.21      12.8  T
     SCC iter.                  ...        0 min,  0.005 sec
     gradient                   ...        0 min,  0.010 sec
 * total energy  :   -35.6224148 Eh     change       -0.7085791E-04 Eh
   gradient norm :     0.0081109 Eh/α   predicted    -0.1390796E-03 (  96.28%)
   displ. norm   :     0.2655049 α      lambda       -0.2241730E-03
   maximum displ.:     0.1825480 α      in ANC's #2, #1, #8, ...

........................................................................
.............................. CYCLE   10 ..............................
........................................................................
   1    -36.1383393 -0.361383E+02  0.176E-01    3.20       0.0  T
   2    -36.1383428 -0.355847E-05  0.107E-01    3.20       1.0  T
   3    -36.1383433 -0.426358E-06  0.103E-02    3.20       2.0  T
   4    -36.1383451 -0.185275E-05  0.505E-03    3.20       4.0  T
   5    -36.1383452 -0.461403E-07  0.180E-03    3.20      11.3  T
   6    -36.1383452 -0.309198E-07  0.744E-04    3.20      27.4  T
     SCC iter.                  ...        0 min,  0.005 sec
     gradient                   ...        0 min,  0.010 sec
 * total energy  :   -35.6225105 Eh     change       -0.9570282E-04 Eh
   gradient norm :     0.0061752 Eh/α   predicted    -0.1199981E-03 (  25.39%)
   displ. norm   :     0.0587092 α      lambda       -0.7272213E-04
   maximum displ.:     0.0392902 α      in ANC's #2, #8, #1, ...

........................................................................
.............................. CYCLE   11 ..............................
........................................................................
   1    -36.1392715 -0.361393E+02  0.380E-02    3.20       0.0  T
   2    -36.1392721 -0.606398E-06  0.233E-02    3.20       1.0  T
   3    -36.1392703  0.182996E-05  0.105E-02    3.20       2.0  T
   4    -36.1392725 -0.222268E-05  0.191E-03    3.20      10.7  T
   5    -36.1392725 -0.310999E-07  0.109E-03    3.20      18.8  T
     SCC iter.                  ...        0 min,  0.005 sec
     gradient                   ...        0 min,  0.010 sec
 * total energy  :   -35.6225565 Eh     change       -0.4600787E-04 Eh
   gradient norm :     0.0021104 Eh/α   predicted    -0.3648714E-04 ( -20.69%)
   displ. norm   :     0.1129434 α      lambda       -0.4805035E-04
   maximum displ.:     0.0674628 α      in ANC's #1, #2, #5, ...

........................................................................
.............................. CYCLE   12 ..............................
........................................................................
   1    -36.1390967 -0.361391E+02  0.645E-02    3.19       0.0  T
   2    -36.1390972 -0.475588E-06  0.388E-02    3.19       1.0  T
   3    -36.1390953  0.182565E-05  0.973E-03    3.19       2.1  T
   4    -36.1390975 -0.215767E-05  0.183E-03    3.19      11.1  T
   5    -36.1390975 -0.157378E-07  0.115E-03    3.19      17.8  T
   6    -36.1390975 -0.808505E-08  0.370E-04    3.19      55.2  T
   7    -36.1390975 -0.559716E-09  0.930E-05    3.19     219.5  T
     SCC iter.                  ...        0 min,  0.006 sec
     gradient                   ...        0 min,  0.011 sec
 * total energy  :   -35.6225914 Eh     change       -0.3488165E-04 Eh
   gradient norm :     0.0017473 Eh/α   predicted    -0.2433417E-04 ( -30.24%)
   displ. norm   :     0.2604945 α      lambda       -0.4628245E-04
   maximum displ.:     0.1737476 α      in ANC's #1, #2, #6, ...

........................................................................
.............................. CYCLE   13 ..............................
........................................................................
   1    -36.1387435 -0.361387E+02  0.149E-01    3.18       0.0  T
   2    -36.1387454 -0.191097E-05  0.894E-02    3.18       1.0  T
   3    -36.1387436  0.182178E-05  0.110E-02    3.18       1.9  T
   4    -36.1387465 -0.296131E-05  0.385E-03    3.18       5.3  T
   5    -36.1387466 -0.225820E-07  0.229E-03    3.18       8.9  T
   6    -36.1387466 -0.435480E-07  0.620E-04    3.18      32.9  T
   7    -36.1387466 -0.336635E-08  0.125E-04    3.18     162.9  T
     SCC iter.                  ...        0 min,  0.006 sec
     gradient                   ...        0 min,  0.011 sec
 * total energy  :   -35.6226191 Eh     change       -0.2771720E-04 Eh
   gradient norm :     0.0032304 Eh/α   predicted    -0.2384010E-04 ( -13.99%)
   displ. norm   :     0.0449646 α      lambda       -0.2083998E-04
   maximum displ.:     0.0284421 α      in ANC's #1, #5, #4, ...

........................................................................
.............................. CYCLE   14 ..............................
........................................................................
   1    -36.1388239 -0.361388E+02  0.218E-02    3.18       0.0  T
   2    -36.1388241 -0.189085E-06  0.131E-02    3.18       1.6  T
   3    -36.1388237  0.327757E-06  0.483E-03    3.18       4.2  T
   4    -36.1388241 -0.411808E-06  0.619E-04    3.18      33.0  T
   5    -36.1388241 -0.119072E-08  0.411E-04    3.18      49.7  T
     SCC iter.                  ...        0 min,  0.005 sec
     gradient                   ...        0 min,  0.011 sec
 * total energy  :   -35.6226320 Eh     change       -0.1285785E-04 Eh
   gradient norm :     0.0024613 Eh/α   predicted    -0.1044441E-04 ( -18.77%)
   displ. norm   :     0.0361124 α      lambda       -0.1619355E-04
   maximum displ.:     0.0237628 α      in ANC's #1, #4, #6, ...

........................................................................
.............................. CYCLE   15 ..............................
........................................................................
   1    -36.1394717 -0.361395E+02  0.211E-02    3.18       0.0  T
   2    -36.1394721 -0.391693E-06  0.129E-02    3.18       1.6  T
   3    -36.1394716  0.435892E-06  0.676E-03    3.18       3.0  T
   4    -36.1394723 -0.628496E-06  0.111E-03    3.18      18.3  T
   5    -36.1394723 -0.125449E-07  0.609E-04    3.18      33.5  T
   6    -36.1394723 -0.487207E-08  0.228E-04    3.18      89.5  T
     SCC iter.                  ...        0 min,  0.006 sec
     gradient                   ...        0 min,  0.011 sec
 * total energy  :   -35.6226421 Eh     change       -0.1010243E-04 Eh
   gradient norm :     0.0014881 Eh/α   predicted    -0.8110797E-05 ( -19.71%)
   displ. norm   :     0.0864746 α      lambda       -0.9766765E-05
   maximum displ.:     0.0646753 α      in ANC's #1, #5, #4, ...

........................................................................
.............................. CYCLE   16 ..............................
........................................................................
   1    -36.1394727 -0.361395E+02  0.466E-02    3.18       0.0  T
   2    -36.1394730 -0.357030E-06  0.281E-02    3.18       1.0  T
   3    -36.1394724  0.619999E-06  0.657E-03    3.17       3.1  T
   4    -36.1394732 -0.803015E-06  0.123E-03    3.18      16.6  T
   5    -36.1394732 -0.558764E-09  0.818E-04    3.18      24.9  T
   6    -36.1394732 -0.541198E-08  0.360E-04    3.18      56.7  T
     SCC iter.                  ...        0 min,  0.006 sec
     gradient                   ...        0 min,  0.011 sec
 * total energy  :   -35.6226518 Eh     change       -0.9783828E-05 Eh
   gradient norm :     0.0016810 Eh/α   predicted    -0.4900501E-05 ( -49.91%)
   displ. norm   :     0.0865267 α      lambda        0.1327185E-06
   maximum displ.:     0.0647449 α      in ANC's #1, #5, #4, ...

........................................................................
.............................. CYCLE   17 ..............................
........................................................................
   1    -36.1393287 -0.361393E+02  0.466E-02    3.17       0.0  T
   2    -36.1393291 -0.362475E-06  0.280E-02    3.17       1.0  T
   3    -36.1393285  0.631890E-06  0.661E-03    3.17       3.1  T
   4    -36.1393293 -0.815507E-06  0.124E-03    3.17      16.5  T
   5    -36.1393293 -0.970154E-09  0.823E-04    3.17      24.8  T
   6    -36.1393293 -0.545643E-08  0.364E-04    3.17      56.1  T
     SCC iter.                  ...        0 min,  0.006 sec
     gradient                   ...        0 min,  0.011 sec
 * total energy  :   -35.6226517 Eh     change        0.1335451E-06 Eh
   gradient norm :     0.0027967 Eh/α   predicted     0.6656942E-07 ( -50.15%)
   displ. norm   :     0.0214739 α      lambda       -0.1038405E-04
   maximum displ.:     0.0110606 α      in ANC's #3, #2, #7, ...

........................................................................
.............................. CYCLE   18 ..............................
........................................................................
   1    -36.1395530 -0.361396E+02  0.156E-02    3.17       0.0  T
   2    -36.1395532 -0.138596E-06  0.965E-03    3.17       2.1  T
   3    -36.1395529  0.234344E-06  0.402E-03    3.17       5.1  T
   4    -36.1395532 -0.302055E-06  0.660E-04    3.17      30.9  T
   5    -36.1395532 -0.292862E-08  0.423E-04    3.17      48.2  T
     SCC iter.                  ...        0 min,  0.005 sec
     gradient                   ...        0 min,  0.011 sec
 * total energy  :   -35.6226592 Eh     change       -0.7519528E-05 Eh
   gradient norm :     0.0018483 Eh/α   predicted    -0.5195823E-05 ( -30.90%)
   displ. norm   :     0.0496121 α      lambda       -0.1056538E-04
   maximum displ.:     0.0288125 α      in ANC's #3, #1, #5, ...

........................................................................
.............................. CYCLE   19 ..............................
........................................................................
   1    -36.1389466 -0.361389E+02  0.335E-02    3.16       0.0  T
   2    -36.1389474 -0.801623E-06  0.203E-02    3.16       1.0  T
   3    -36.1389461  0.123916E-05  0.101E-02    3.16       2.0  T
   4    -36.1389478 -0.162640E-05  0.173E-03    3.16      11.8  T
   5    -36.1389478 -0.331947E-07  0.955E-04    3.16      21.4  T
   6    -36.1389478 -0.114574E-07  0.333E-04    3.16      61.4  T
     SCC iter.                  ...        0 min,  0.006 sec
     gradient                   ...        0 min,  0.011 sec
 * total energy  :   -35.6226642 Eh     change       -0.5012874E-05 Eh
   gradient norm :     0.0019162 Eh/α   predicted    -0.5292557E-05 (   5.58%)
   displ. norm   :     0.0429629 α      lambda       -0.6852349E-05
   maximum displ.:     0.0201623 α      in ANC's #3, #2, #6, ...

........................................................................
.............................. CYCLE   20 ..............................
........................................................................
   1    -36.1395928 -0.361396E+02  0.323E-02    3.17       0.0  T
   2    -36.1395930 -0.150343E-06  0.198E-02    3.17       1.0  T
   3    -36.1395930 -0.378150E-07  0.183E-03    3.17      11.1  T
   4    -36.1395930 -0.513155E-07  0.883E-04    3.17      23.1  T
   5    -36.1395930 -0.135492E-08  0.388E-04    3.17      52.7  T
     SCC iter.                  ...        0 min,  0.005 sec
     gradient                   ...        0 min,  0.011 sec
 * total energy  :   -35.6226674 Eh     change       -0.3117562E-05 Eh
   gradient norm :     0.0018162 Eh/α   predicted    -0.3430536E-05 (  10.04%)
   displ. norm   :     0.0396747 α      lambda       -0.5921444E-05
   maximum displ.:     0.0227563 α      in ANC's #1, #2, #4, ...
 * RMSD in coord.:     0.5028516 α      energy gain  -0.5078261E-02 Eh

generating ANC from model Hessian ...
Using Lindh-Hessian (1995)
 Shifting diagonal of input Hessian by   3.645089908317051E-003
 Lowest  eigenvalues of input Hessian
   -0.000000   -0.000000   -0.000000    0.000000    0.000000    0.000000
    0.005000    0.006434    0.006841    0.008286    0.008311    0.008826
    0.009257    0.012941    0.016999    0.019299    0.022591    0.028478
 Highest eigenvalues
    1.697191    1.851770    1.911451    1.959072    2.078307    2.148066
 

........................................................................
.............................. CYCLE   21 ..............................
........................................................................
   1    -36.1392763 -0.361393E+02  0.227E-02    3.16       0.0  T
   2    -36.1392765 -0.221153E-06  0.136E-02    3.16       1.5  T
   3    -36.1392760  0.548413E-06  0.610E-03    3.16       3.3  T
   4    -36.1392767 -0.676980E-06  0.843E-04    3.16      24.2  T
   5    -36.1392767 -0.957429E-08  0.368E-04    3.16      55.5  T
     SCC iter.                  ...        0 min,  0.005 sec
     gradient                   ...        0 min,  0.011 sec
 * total energy  :   -35.6226718 Eh     change       -0.4394449E-05 Eh
   gradient norm :     0.0009157 Eh/α   predicted     0.0000000E+00 (-100.00%)
   displ. norm   :     0.0202725 α      lambda       -0.2765473E-05
   maximum displ.:     0.0130040 α      in ANC's #3, #1, #4, ...

   *** GEOMETRY OPTIMIZATION CONVERGED AFTER 21 ITERATIONS ***

------------------------------------------------------------------------
 total energy gain   :        -0.0050827 Eh       -3.1894 kcal/mol
 total RMSD          :         0.5028516 a0        0.2661 Å
 total power (kW/mol):        -0.6354528 (step)  -26.7249 (real)
------------------------------------------------------------------------

 ANCopt (total)                0 d,  0 h,  0 min,  0.499 sec
 optimizer setup                ...        0 min,  0.000 sec (  0.027%)
 model hessian                  ...        0 min,  0.008 sec (  1.523%)
 ANC generation                 ...        0 min,  0.001 sec (  0.255%)
 coordinate transformation      ...        0 min,  0.000 sec (  0.063%)
 single point calculation       ...        0 min,  0.482 sec ( 96.545%)
 optimization log               ...        0 min,  0.002 sec (  0.385%)
 hessian update                 ...        0 min,  0.000 sec (  0.051%)
 rational function              ...        0 min,  0.004 sec (  0.862%)

================
 final structure:
================
$coord
    1.78115439741549   -0.55256247988402    0.14264273321192      C 
    0.41414663515274    1.64742189574462    0.51227994319624      C 
    1.47766889499525    3.96047783357452    0.96147359829631      O 
    4.12273068758096    4.15693246438294    1.00512656725130      C 
   -2.25201651806317    1.55784548179174    0.45402574033109      C 
   -3.41878499534917   -0.74331767600297    0.00350753950101      C 
   -2.03853125279844   -2.95190115084116   -0.37302616129103      C 
    0.57750095298523   -2.84213251772340   -0.29636529228689      C 
   -3.42918154318059   -5.08725947135905   -0.80459268822867      O 
   -2.13352995420945   -7.36442151756739   -1.23704389757715      C 
   -3.68054484243904    3.88425696345744    0.83284391272495      C 
   -6.10481533268409    4.03908987669426    1.45756699903535      C 
    3.81878768144382   -0.53407158604174    0.18577311791519      H 
    4.52482977141312    6.14496718201317    1.35813911805655      H 
    4.96077482861867    3.60420025577745   -0.80405154041553      H 
    4.94970396223370    3.01727128903727    2.52066761227500      H 
   -5.44880685713595   -0.86494497014177   -0.09563399495781      H 
    1.72226719085192   -4.50438999674333   -0.57775438517794      H 
   -3.59004485224367   -8.78422700020951   -1.54836885049526      H 
   -0.98687568236338   -7.91269465527098    0.39633803599250      H 
   -0.92559191340120   -7.24763324571142   -2.91393537098674      H 
   -2.58194045673175    5.59336360539917    0.60902180635567      H 
   -7.26517834184594    2.39731247419344    1.77092415471482      H 
   -7.01940695394371    5.84002494816284    1.70090922213674      H 
$end
           -------------------------------------------------
          |                Final Singlepoint                |
           -------------------------------------------------

          ...................................................
          :                      SETUP                      :
          :.................................................:
          :  # basis functions                  60          :
          :  # atomic orbitals                  60          :
          :  # shells                           36          :
          :  # electrons                        64          :
          :  max. iterations                   250          :
          :  Hamiltonian                  GFN2-xTB          :
          :  restarted?                      false          :
          :  GBSA solvation                  false          :
          :  PC potential                    false          :
          :  electronic temp.          300.0000000     K    :
          :  accuracy                    1.0000000          :
          :  -> integral cutoff          0.2500000E+02      :
          :  -> integral neglect         0.1000000E-07      :
          :  -> SCF convergence          0.1000000E-05 Eh   :
          :  -> wf. convergence          0.1000000E-03 e    :
          :  Broyden damping             0.4000000          :
          ...................................................

 iter      E             dE          RMSdq      gap      omega  full diag
   1    -36.1392767 -0.361393E+02  0.172E-04    3.16       0.0  T
   2    -36.1392767 -0.199094E-10  0.754E-05    3.16     270.7  T
   3    -36.1392767  0.344400E-10  0.865E-05    3.16     236.0  T

   *** convergence criteria satisfied after 3 iterations ***

         #    Occupation            Energy/Eh            Energy/eV
      -------------------------------------------------------------
         1        2.0000           -0.7114984             -19.3609
       ...           ...                  ...                  ...
        26        2.0000           -0.4528485             -12.3226
        27        2.0000           -0.4325561             -11.7705
        28        2.0000           -0.4229916             -11.5102
        29        2.0000           -0.4191279             -11.4051
        30        2.0000           -0.4136377             -11.2557
        31        2.0000           -0.3828455             -10.4178
        32        2.0000           -0.3593441              -9.7783 (HOMO)
        33                         -0.2431019              -6.6151 (LUMO)
        34                         -0.2046326              -5.5683
        35                         -0.1651218              -4.4932
        36                         -0.0707699              -1.9257
        37                          0.0284066               0.7730
       ...                                ...                  ...
        60                          0.7016912              19.0940
      -------------------------------------------------------------
                  HL-Gap            0.1162422 Eh            3.1631 eV
             Fermi-level           -0.3012230 Eh           -8.1967 eV

 SCC (total)                   0 d,  0 h,  0 min,  0.021 sec
 SCC setup                      ...        0 min,  0.000 sec (  0.787%)
 Dispersion                     ...        0 min,  0.000 sec (  0.838%)
 integral evaluation            ...        0 min,  0.006 sec ( 30.025%)
 zeroth order Hamiltonian       ...        0 min,  0.000 sec (  0.561%)
 iterations                     ...        0 min,  0.003 sec ( 15.508%)
 molecular gradient             ...        0 min,  0.011 sec ( 50.745%)
 printout                       ...        0 min,  0.000 sec (  1.329%)

         :::::::::::::::::::::::::::::::::::::::::::::::::::::
         ::                     SUMMARY                     ::
         :::::::::::::::::::::::::::::::::::::::::::::::::::::
         :: total energy             -35.622671761162 Eh    ::
         :: gradient norm              0.000916499252 Eh/a0 ::
         :: HOMO-LUMO gap              3.163111272272 eV    ::
         ::.................................................::
         :: SCC energy               -36.139276671479 Eh    ::
         :: -> isotropic ES            0.030116275681 Eh    ::
         :: -> anisotropic ES          0.005336478073 Eh    ::
         :: -> anisotropic XC          0.012100375607 Eh    ::
         :: -> dispersion             -0.019948159004 Eh    ::
         :: repulsion energy           0.516606730017 Eh    ::
         :: add. restraining           0.000000000000 Eh    ::
         :::::::::::::::::::::::::::::::::::::::::::::::::::::

           -------------------------------------------------
          |                Property Printout                |
           -------------------------------------------------

    * Orbital Energies and Occupations

         #    Occupation            Energy/Eh            Energy/eV
      -------------------------------------------------------------
         1        2.0000           -0.7114984             -19.3609
       ...           ...                  ...                  ...
        20        2.0000           -0.4871206             -13.2552
        21        2.0000           -0.4775314             -12.9943
        22        2.0000           -0.4727002             -12.8628
        23        2.0000           -0.4657254             -12.6730
        24        2.0000           -0.4645797             -12.6419
        25        2.0000           -0.4559437             -12.4069
        26        2.0000           -0.4528485             -12.3226
        27        2.0000           -0.4325561             -11.7705
        28        2.0000           -0.4229916             -11.5102
        29        2.0000           -0.4191279             -11.4051
        30        2.0000           -0.4136377             -11.2557
        31        2.0000           -0.3828455             -10.4178
        32        2.0000           -0.3593441              -9.7783 (HOMO)
        33                         -0.2431019              -6.6151 (LUMO)
        34                         -0.2046326              -5.5683
        35                         -0.1651218              -4.4932
        36                         -0.0707699              -1.9257
        37                          0.0284066               0.7730
        38                          0.0402995               1.0966
        39                          0.1059616               2.8834
        40                          0.1107030               3.0124
        41                          0.1306553               3.5553
        42                          0.1357027               3.6927
        43                          0.1403628               3.8195
       ...                                ...                  ...
        60                          0.7016912              19.0940
      -------------------------------------------------------------
                  HL-Gap            0.1162422 Eh            3.1631 eV
             Fermi-level           -0.3012230 Eh           -8.1967 eV

     #   Z        covCN         q      C6AA      α(0)
     1   6 C      2.916    -0.071    29.763     8.946
     2   6 C      2.868     0.127    25.215     8.231
     3   8 O      1.705    -0.270    18.477     5.804
     4   6 C      3.643     0.040    20.247     6.468
     5   6 C      2.970    -0.004    28.125     8.699
     6   6 C      2.926    -0.061    29.509     8.909
     7   6 C      2.862     0.132    25.112     8.214
     8   6 C      2.918    -0.071    29.759     8.946
     9   8 O      1.705    -0.275    18.554     5.816
    10   6 C      3.644     0.040    20.244     6.467
    11   6 C      2.895    -0.026    28.645     8.775
    12   6 C      2.838    -0.089    30.220     9.009
    13   1 H      0.926     0.036     2.507     2.476
    14   1 H      0.925     0.059     2.205     2.322
    15   1 H      0.924     0.038     2.481     2.463
    16   1 H      0.924     0.038     2.479     2.462
    17   1 H      0.926     0.058     2.226     2.333
    18   1 H      0.926     0.035     2.510     2.478
    19   1 H      0.925     0.060     2.202     2.320
    20   1 H      0.924     0.037     2.484     2.465
    21   1 H      0.924     0.037     2.485     2.465
    22   1 H      0.925     0.052     2.301     2.372
    23   1 H      0.926     0.040     2.444     2.444
    24   1 H      0.926     0.037     2.484     2.465

 Mol. C6AA /au·bohr⁶  :       6172.342713
 Mol. C8AA /au·bohr⁸  :     144160.133082
 Mol. α(0) /au        :        123.348723


Wiberg/Mayer (AO) data.
largest (>0.10) Wiberg bond orders for each atom
          total WBO             WBO to atom ...
     1  C   3.987        C    8 1.412    C    2 1.405    H   13 0.966
     2  C   3.934        C    1 1.405    C    5 1.279    O    3 1.051
     3  O   2.221        C    2 1.051    C    4 0.989
     4  C   3.949        O    3 0.989    H   14 0.979    H   15 0.976    H   16 0.976
     5  C   3.987        C    6 1.422    C    2 1.279    C   11 1.090
     6  C   3.987        C    5 1.422    C    7 1.354    H   17 0.963
     7  C   3.935        C    8 1.382    C    6 1.354    O    9 1.047
     8  C   3.987        C    1 1.412    C    7 1.382    H   18 0.967
     9  O   2.212        C    7 1.047    C   10 0.989
    10  C   3.949        O    9 0.989    H   19 0.980    H   21 0.977    H   20 0.977
    11  C   3.990        C   12 1.903    C    5 1.090    H   22 0.961
    12  C   3.991        C   11 1.903    H   24 0.978    H   23 0.973
    13  H   0.998        C    1 0.966
    14  H   0.996        C    4 0.979
    15  H   0.998        C    4 0.976
    16  H   0.998        C    4 0.976
    17  H   0.996        C    6 0.963
    18  H   0.998        C    8 0.967
    19  H   0.996        C   10 0.980
    20  H   0.998        C   10 0.977
    21  H   0.998        C   10 0.977
    22  H   0.997        C   11 0.961
    23  H   0.998        C   12 0.973
    24  H   0.998        C   12 0.978

molecular dipole:
                 x           y           z       tot (Debye)
 q only:        0.644      -0.262      -0.068
   full:        0.962      -0.434      -0.093       2.694
molecular quadrupole (traceless):
                xx          xy          yy          xz          yz          zz
 q only:        0.024       1.022       4.318       0.304       1.400      -4.342
  q+dip:        1.408       0.285       4.882      -0.290       1.394      -6.290
   full:       -0.028       0.531       4.254       0.083       1.136      -4.226

           -------------------------------------------------
          |                Geometry Summary                 |
           -------------------------------------------------

      molecular mass/u    :      164.2036000
   center of mass at/Å    :       -0.6189459      -0.0364830       0.1133704
  moments of inertia/u·Å² :        0.3712299E+03   0.7655172E+03   0.1128149E+04
rotational constants/cm⁻¹ :        0.4541022E-01   0.2202123E-01   0.1494273E-01

 * 23 selected distances

     #   Z        #   Z                                     value/Å
     1   6 C      2   6 C                                 1.3845115
     2   6 C      3   8 O                                 1.3680110
     3   8 O      4   6 C                                 1.4037520
     2   6 C      5   6 C                                 1.4120055 (max)
     5   6 C      6   6 C                                 1.3859664
     6   6 C      7   6 C                                 1.3925226
     1   6 C      8   6 C                                 1.3883861
     7   6 C      8   6 C                                 1.3861566
     7   6 C      9   8 O                                 1.3676866
     9   8 O     10   6 C                                 1.4051818
    11   6 C     12   6 C                                 1.3273111
     1   6 C     13   1 H                                 1.0785551
     4   6 C     14   1 H                                 1.0894606
     4   6 C     15   1 H                                 1.0948927
     4   6 C     16   1 H                                 1.0947163
     6   6 C     17   1 H                                 1.0774458
     8   6 C     18   1 H                                 1.0783757
    10   6 C     19   1 H                                 1.0888980
    10   6 C     20   1 H                                 1.0951996
    10   6 C     21   1 H                                 1.0953738
    11   6 C     22   1 H                                 1.0816561
    12   6 C     23   1 H                                 1.0767253
    12   6 C     24   1 H                                 1.0765942 (min)

 * 3 distinct bonds (by element types)

   Z      Z             #   av. dist./Å        max./Å        min./Å
   1 H    6 C          12     1.0856578     1.0953738     1.0765942
   6 C    6 C           7     1.3824086     1.4120055     1.3273111
   6 C    8 O           4     1.3861578     1.4051818     1.3676866


optimized geometry written to: xtbopt.xyz


           -------------------------------------------------
          | TOTAL ENERGY              -35.622671761162 Eh   |
          | GRADIENT NORM               0.000916499252 Eh/α |
          | HOMO-LUMO GAP               3.163111272272 eV   |
           -------------------------------------------------

------------------------------------------------------------------------
 * finished run on 2021/05/19 at 10:58:55.104     
------------------------------------------------------------------------
 total:
 * wall-time:     0 d,  0 h,  0 min,  0.569 sec
 *  cpu-time:     0 d,  0 h,  0 min,  0.568 sec
 * ratio c/w:     0.998 speedup
 SCF:
 * wall-time:     0 d,  0 h,  0 min,  0.029 sec
 *  cpu-time:     0 d,  0 h,  0 min,  0.029 sec
 * ratio c/w:     1.000 speedup
 ANC optimizer:
 * wall-time:     0 d,  0 h,  0 min,  0.521 sec
 *  cpu-time:     0 d,  0 h,  0 min,  0.521 sec
 * ratio c/w:     1.000 speedup

