      -----------------------------------------------------------      
     |                   =====================                   |     
     |                           x T B                           |     
     |                   =====================                   |     
     |                         S. Grimme                         |     
     |          Mulliken Center for Theoretical Chemistry        |     
     |                    University of Bonn                     |     
     |                Version 6.2 RC2 (SAW190805)                |     
      -----------------------------------------------------------      

   This program is distributed in the hope that it will be useful,
   but WITHOUT ANY WARRANTY; without even the implied warranty of
   MERCHANTABILITY or FITNESS FOR A PARTICULAR PURPOSE.
   
   FOR NON-COMMERCIAL, ACADEMIA USE ONLY.
   
   Cite this work as:
   * S. Grimme, C. Bannwarth, P. Shushkov, J. Chem. Theory Comput., 2017,
     13, 1989-2009. DOI: 10.1021/acs.jctc.7b00118
   * C. Bannwarth, S. Ehlert and S. Grimme., J. Chem. Theory Comput., 2019,
     15, 1652-1671. DOI: 10.1021/acs.jctc.8b01176
   * P. Pracht, E. Caldeweyher, S. Ehlert, S. Grimme, ChemRxiv, 2019, preprint.
     DOI: 10.26434/chemrxiv.8326202.v1
   
   for DFT-D4:
   * E. Caldeweyher, C. Bannwarth and S. Grimme, J. Chem. Phys., 2017,
     147, 034112. DOI: 10.1063/1.4993215
   * E. Caldeweyher, S. Ehlert, A. Hansen, H. Neugebauer, S. Spicher,
     C. Bannwarth and S. Grimme, J. Chem. Phys., 2019, 150, 154122.
     DOI: 10.1063/1.5090222
   
   for sTDA-xTB:
   * S. Grimme and C. Bannwarth, J. Chem. Phys., 2016, 145, 054103.
     DOI: 10.1063/1.4959605
   
   in the mass-spec context:
   * V. Asgeirsson, C. Bauer and S. Grimme, Chem. Sci., 2017, 8, 4879.
     DOI: 10.1039/c7sc00601b
   
   for metadynamics refer to:
   * S. Grimme, J. Chem. Theory Comput., 2019, 155, 2847-2862
     DOI: 10.1021/acs.jctc.9b00143
   
   with help from (in alphabetical order)
   C. Bannwarth, F. Bohle, G. Brandenburg, E. Caldeweyher, M. Checinski,
   S. Dohm, S. Ehlert, S. Ehrlich, F. März, H. Neugebauer, J. Pisarek,
   P. Pracht, P. Shushkov, and S. Spicher.
   
 * started run on 2021/05/19 at 10:58:57.095     

           -------------------------------------------------
          |                Calculation Setup                |
           -------------------------------------------------

          program call               : /ihome/ghutchison/geoffh/xtb/xtb 313.xyz -opt
          hostname                   : smp-n122
          coordinate file            : 313.xyz
          omp threads                :                     1
          number of atoms            :                    22
          number of electrons        :                    70
          charge                     :                     0
          spin                       :                   0.0
          first test random number   :      0.73621806715547


########################################################################
# WARNING! Please study the warnings concerning your input carefully
#  - the use of '-opt' is discouraged, please use '--opt' next time
########################################################################

           ------------------------------------------------- 
          |                 G F N 2 - x T B                 |
          | Geometry, Frequencies, Noncovalent interactions |
          |            JCTC 2019 parametrisation            |
           ------------------------------------------------- 
             KAB for C  - Si     :                1.0500
             KAB for H  - Pd     :                0.9500
             k(s)              :                1.8500
             k(p)              :                2.2300
             k(d)              :                2.2300
             k(f)              :                2.0000
             kEN (H0ij)        :               -2.0000
             D4 a1             :                0.5200
             D4 a2             :                5.0000
             D4 s6             :                1.0000
             D4 s8             :                2.7000
             D4 s9             :                5.0000
             alphaj            :                2.0000

  Z AO/shell   Hii/eV     exponent
  1     Wed Apr 25 08:07:45 CEST 2018   EN: 2.200 GM2: 0.406  GM3: 0.0800  RAES: 1.40
     1s    -10.707211    1.230000
  6     Wed Apr 25 08:07:45 CEST 2018   EN: 2.550 GM2: 0.538  GM3: 0.1500  RAES: 3.00
     2s    -13.970922    2.096432
     2p    -10.063292    1.800000
  9     Mon Apr 23 13:58:50 CEST 2018   EN: 3.980 GM2: 0.532  GM3: 0.1426  RAES: 2.40
     2s    -23.458179    2.416361
     2p    -15.746583    2.308399

           ------------------------------------------------- 
          |        Self-Consistent Charge Iterations        |
           ------------------------------------------------- 

          ...................................................
          :                      SETUP                      :
          :.................................................:
          :  # basis functions                  64          :
          :  # atomic orbitals                  64          :
          :  # shells                           36          :
          :  # electrons                        70          :
          :  max. iterations                   250          :
          :  Hamiltonian                  GFN2-xTB          :
          :  restarted?                      false          :
          :  GBSA solvation                  false          :
          :  PC potential                    false          :
          :  electronic temp.          300.0000000     K    :
          :  accuracy                    1.0000000          :
          :  -> integral cutoff          0.2500000E+02      :
          :  -> integral neglect         0.1000000E-07      :
          :  -> SCF convergence          0.1000000E-05 Eh   :
          :  -> wf. convergence          0.1000000E-03 e    :
          :  Broyden damping             0.4000000          :
          ...................................................

 iter      E             dE          RMSdq      gap      omega  full diag
   1    -39.6631829 -0.396632E+02  0.478E+00    1.41       0.0  T
   2    -39.6826560 -0.194731E-01  0.333E+00    1.37       1.0  T
   3    -39.6785461  0.410988E-02  0.201E+00    1.38       1.0  T
   4    -39.7139328 -0.353867E-01  0.339E-01    1.34       1.0  T
   5    -39.7139613 -0.285144E-04  0.235E-01    1.30       1.0  T
   6    -39.7148516 -0.890268E-03  0.718E-02    1.33       1.0  T
   7    -39.7149010 -0.494266E-04  0.378E-02    1.32       1.0  T
   8    -39.7149179 -0.168567E-04  0.184E-02    1.32       1.2  T
   9    -39.7149210 -0.312148E-05  0.721E-03    1.32       3.0  T
  10    -39.7149209  0.474322E-07  0.472E-03    1.32       4.5  T
  11    -39.7149214 -0.408246E-06  0.662E-04    1.32      32.2  T
  12    -39.7149214 -0.201576E-08  0.412E-04    1.32      51.8  T

   *** convergence criteria satisfied after 12 iterations ***

         #    Occupation            Energy/Eh            Energy/eV
      -------------------------------------------------------------
         1        2.0000           -0.8247842             -22.4435
       ...           ...                  ...                  ...
        29        2.0000           -0.4592933             -12.4980
        30        2.0000           -0.4485769             -12.2064
        31        2.0000           -0.4372336             -11.8977
        32        2.0000           -0.4368078             -11.8861
        33        2.0000           -0.4156234             -11.3097
        34        2.0000           -0.3890140             -10.5856
        35        2.0000           -0.3863635             -10.5135 (HOMO)
        36                         -0.3377418              -9.1904 (LUMO)
        37                         -0.2400835              -6.5330
        38                         -0.2111724              -5.7463
        39                         -0.1662601              -4.5242
        40                         -0.1472459              -4.0068
       ...                                ...                  ...
        64                          0.7693267              20.9344
      -------------------------------------------------------------
                  HL-Gap            0.0486217 Eh            1.3231 eV
             Fermi-level           -0.3620246 Eh           -9.8512 eV

 SCC (total)                   0 d,  0 h,  0 min,  0.033 sec
 SCC setup                      ...        0 min,  0.000 sec (  0.722%)
 Dispersion                     ...        0 min,  0.000 sec (  0.808%)
 integral evaluation            ...        0 min,  0.008 sec ( 23.765%)
 zeroth order Hamiltonian       ...        0 min,  0.000 sec (  0.444%)
 iterations                     ...        0 min,  0.012 sec ( 37.815%)
 molecular gradient             ...        0 min,  0.012 sec ( 35.348%)
 printout                       ...        0 min,  0.000 sec (  0.961%)

         :::::::::::::::::::::::::::::::::::::::::::::::::::::
         ::                     SUMMARY                     ::
         :::::::::::::::::::::::::::::::::::::::::::::::::::::
         :: total energy             -39.119724105321 Eh    ::
         :: gradient norm              0.044513786100 Eh/a0 ::
         :: HOMO-LUMO gap              1.323064014791 eV    ::
         ::.................................................::
         :: SCC energy               -39.714921352063 Eh    ::
         :: -> isotropic ES            0.022455890857 Eh    ::
         :: -> anisotropic ES          0.000138225670 Eh    ::
         :: -> anisotropic XC          0.011667512532 Eh    ::
         :: -> dispersion             -0.020599641795 Eh    ::
         :: repulsion energy           0.595264170124 Eh    ::
         :: add. restraining           0.000000000000 Eh    ::
         :::::::::::::::::::::::::::::::::::::::::::::::::::::

      ----------------------------------------------------------- 
     |                   =====================                   |
     |                        A N C O P T                        |
     |                   =====================                   |
     |               Approximate Normal Coordinate               |
     |                Rational Function Optimizer                |
      ----------------------------------------------------------- 

          ...................................................
          :                      SETUP                      :
          :.................................................:
          :   optimization level            normal          :
          :   max. optcycles                   200          :
          :   ANC micro-cycles                  20          :
          :   degrees of freedom                60          :
          :.................................................:
          :   RF solver                   davidson          :
          :   input Hessian                  false          :
          :   write xtbopt.log                true          :
          :   linear?                        false          :
          :   energy convergence         0.5000000E-05 Eh   :
          :   grad. convergence          0.1000000E-02 Eh/α :
          :   maximium RF displ.         2.0000000          :
          :   Hlow (freq-cutoff)         0.5000000E-02      :
          :   Hmax (freq-cutoff)         5.0000000          :
          :   S6 in model hess.         20.0000000          :
          ...................................................

generating ANC from model Hessian ...
Using Lindh-Hessian (1995)
 Shifting diagonal of input Hessian by   3.815146117615117E-003
 Lowest  eigenvalues of input Hessian
   -0.000000   -0.000000   -0.000000   -0.000000   -0.000000    0.000000
    0.005000    0.005688    0.007575    0.009263    0.010646    0.014748
    0.015043    0.020626    0.021516    0.026341    0.028678    0.034921
 Highest eigenvalues
    1.825734    1.907034    2.015026    2.076423    2.096303    2.181921
 

........................................................................
.............................. CYCLE    1 ..............................
........................................................................
   1    -39.7149214 -0.397149E+02  0.219E-04    1.32       0.0  T
   2    -39.7149214 -0.107981E-09  0.150E-04    1.32     142.3  T
   3    -39.7149214 -0.335653E-09  0.802E-05    1.32     265.9  T
     SCC iter.                  ...        0 min,  0.004 sec
     gradient                   ...        0 min,  0.011 sec
 * total energy  :   -39.1197241 Eh     change        0.8004974E-08 Eh
   gradient norm :     0.0445138 Eh/α   predicted     0.0000000E+00 (-100.00%)
   displ. norm   :     0.2724730 α      lambda       -0.4792767E-02
   maximum displ.:     0.1244997 α      in ANC's #4, #12, #3, ...

........................................................................
.............................. CYCLE    2 ..............................
........................................................................
   1    -39.7141644 -0.397142E+02  0.150E-01    1.25       0.0  T
   2    -39.7141684 -0.401923E-05  0.954E-02    1.26       1.0  T
   3    -39.7141108  0.576337E-04  0.821E-02    1.26       1.0  T
   4    -39.7141950 -0.841441E-04  0.168E-02    1.26       1.3  T
   5    -39.7141993 -0.437833E-05  0.777E-03    1.26       2.7  T
   6    -39.7142004 -0.109281E-05  0.227E-03    1.26       9.4  T
   7    -39.7142004 -0.147421E-07  0.129E-03    1.26      16.5  T
     SCC iter.                  ...        0 min,  0.007 sec
     gradient                   ...        0 min,  0.011 sec
 * total energy  :   -39.1228688 Eh     change       -0.3144664E-02 Eh
   gradient norm :     0.0171996 Eh/α   predicted    -0.2574310E-02 ( -18.14%)
   displ. norm   :     0.2831527 α      lambda       -0.1377209E-02
   maximum displ.:     0.1842934 α      in ANC's #4, #3, #2, ...

........................................................................
.............................. CYCLE    3 ..............................
........................................................................
   1    -39.7132448 -0.397132E+02  0.164E-01    1.24       0.0  T
   2    -39.7132529 -0.812266E-05  0.986E-02    1.25       1.0  T
   3    -39.7131930  0.598823E-04  0.635E-02    1.24       1.0  T
   4    -39.7132568 -0.637730E-04  0.148E-02    1.25       1.4  T
   5    -39.7132607 -0.392075E-05  0.517E-03    1.25       4.1  T
   6    -39.7132612 -0.490283E-06  0.186E-03    1.25      11.5  T
   7    -39.7132612 -0.954697E-08  0.995E-04    1.25      21.4  T
     SCC iter.                  ...        0 min,  0.007 sec
     gradient                   ...        0 min,  0.011 sec
 * total energy  :   -39.1237658 Eh     change       -0.8970100E-03 Eh
   gradient norm :     0.0082244 Eh/α   predicted    -0.7438397E-03 ( -17.08%)
   displ. norm   :     0.3021937 α      lambda       -0.7986568E-03
   maximum displ.:     0.1923233 α      in ANC's #4, #3, #2, ...

........................................................................
.............................. CYCLE    4 ..............................
........................................................................
   1    -39.7116506 -0.397117E+02  0.201E-01    1.24       0.0  T
   2    -39.7116529 -0.233807E-05  0.121E-01    1.26       1.0  T
   3    -39.7114721  0.180783E-03  0.980E-02    1.24       1.0  T
   4    -39.7116627 -0.190508E-03  0.159E-02    1.25       1.3  T
   5    -39.7116675 -0.483379E-05  0.431E-03    1.25       4.9  T
   6    -39.7116678 -0.314066E-06  0.177E-03    1.25      12.0  T
   7    -39.7116678 -0.779287E-08  0.922E-04    1.25      23.1  T
     SCC iter.                  ...        0 min,  0.007 sec
     gradient                   ...        0 min,  0.011 sec
 * total energy  :   -39.1242548 Eh     change       -0.4889866E-03 Eh
   gradient norm :     0.0098791 Eh/α   predicted    -0.4357953E-03 ( -10.88%)
   displ. norm   :     0.2824564 α      lambda       -0.5533530E-03
   maximum displ.:     0.1689590 α      in ANC's #4, #3, #2, ...

........................................................................
.............................. CYCLE    5 ..............................
........................................................................
   1    -39.7115779 -0.397116E+02  0.167E-01    1.26       0.0  T
   2    -39.7115801 -0.221869E-05  0.982E-02    1.27       1.0  T
   3    -39.7115603  0.198267E-04  0.320E-02    1.26       1.0  T
   4    -39.7115816 -0.213191E-04  0.543E-03    1.26       3.9  T
   5    -39.7115822 -0.567400E-06  0.185E-03    1.26      11.5  T
   6    -39.7115822 -0.543944E-07  0.878E-04    1.26      24.3  T
     SCC iter.                  ...        0 min,  0.006 sec
     gradient                   ...        0 min,  0.011 sec
 * total energy  :   -39.1246648 Eh     change       -0.4100682E-03 Eh
   gradient norm :     0.0106904 Eh/α   predicted    -0.2987514E-03 ( -27.15%)
   displ. norm   :     0.3186146 α      lambda       -0.6273167E-03
   maximum displ.:     0.1686686 α      in ANC's #4, #3, #2, ...

........................................................................
.............................. CYCLE    6 ..............................
........................................................................
   1    -39.7143920 -0.397144E+02  0.193E-01    1.27       0.0  T
   2    -39.7143925 -0.448419E-06  0.113E-01    1.27       1.0  T
   3    -39.7143591  0.333986E-04  0.390E-02    1.27       1.0  T
   4    -39.7143942 -0.351373E-04  0.574E-03    1.27       3.7  T
   5    -39.7143948 -0.644519E-06  0.186E-03    1.27      11.5  T
   6    -39.7143949 -0.307932E-07  0.860E-04    1.27      24.8  T
     SCC iter.                  ...        0 min,  0.006 sec
     gradient                   ...        0 min,  0.011 sec
 * total energy  :   -39.1251002 Eh     change       -0.4353394E-03 Eh
   gradient norm :     0.0092129 Eh/α   predicted    -0.3455000E-03 ( -20.64%)
   displ. norm   :     0.2439185 α      lambda       -0.3541068E-03
   maximum displ.:     0.1353404 α      in ANC's #4, #2, #3, ...

........................................................................
.............................. CYCLE    7 ..............................
........................................................................
   1    -39.7159352 -0.397159E+02  0.143E-01    1.27       0.0  T
   2    -39.7159359 -0.663920E-06  0.842E-02    1.27       1.0  T
   3    -39.7159321  0.373927E-05  0.136E-02    1.27       1.6  T
   4    -39.7159364 -0.420763E-05  0.215E-03    1.27       9.9  T
   5    -39.7159364 -0.427447E-07  0.148E-03    1.27      14.4  T
   6    -39.7159364 -0.236397E-07  0.767E-04    1.27      27.8  T
     SCC iter.                  ...        0 min,  0.006 sec
     gradient                   ...        0 min,  0.011 sec
 * total energy  :   -39.1253626 Eh     change       -0.2624144E-03 Eh
   gradient norm :     0.0080077 Eh/α   predicted    -0.1875905E-03 ( -28.51%)
   displ. norm   :     0.3086055 α      lambda       -0.3532763E-03
   maximum displ.:     0.1798170 α      in ANC's #2, #4, #1, ...

........................................................................
.............................. CYCLE    8 ..............................
........................................................................
   1    -39.7159700 -0.397160E+02  0.191E-01    1.26       0.0  T
   2    -39.7159712 -0.113285E-05  0.112E-01    1.26       1.0  T
   3    -39.7159636  0.751916E-05  0.196E-02    1.26       1.1  T
   4    -39.7159716 -0.795183E-05  0.465E-03    1.26       4.6  T
   5    -39.7159720 -0.366502E-06  0.191E-03    1.26      11.2  T
   6    -39.7159720 -0.295107E-07  0.933E-04    1.26      22.9  T
     SCC iter.                  ...        0 min,  0.006 sec
     gradient                   ...        0 min,  0.011 sec
 * total energy  :   -39.1256061 Eh     change       -0.2435567E-03 Eh
   gradient norm :     0.0089404 Eh/α   predicted    -0.1934610E-03 ( -20.57%)
   displ. norm   :     0.3112539 α      lambda       -0.3598229E-03
   maximum displ.:     0.1833603 α      in ANC's #2, #4, #1, ...

........................................................................
.............................. CYCLE    9 ..............................
........................................................................
   1    -39.7163821 -0.397164E+02  0.166E-01    1.25       0.0  T
   2    -39.7163828 -0.674911E-06  0.986E-02    1.25       1.0  T
   3    -39.7163391  0.436584E-04  0.458E-02    1.25       1.0  T
   4    -39.7163849 -0.457526E-04  0.670E-03    1.25       3.2  T
   5    -39.7163857 -0.834237E-06  0.254E-03    1.25       8.4  T
   6    -39.7163858 -0.958758E-07  0.985E-04    1.25      21.6  T
     SCC iter.                  ...        0 min,  0.006 sec
     gradient                   ...        0 min,  0.011 sec
 * total energy  :   -39.1258162 Eh     change       -0.2100448E-03 Eh
   gradient norm :     0.0070464 Eh/α   predicted    -0.1973507E-03 (  -6.04%)
   displ. norm   :     0.2222382 α      lambda       -0.2284546E-03
   maximum displ.:     0.1372641 α      in ANC's #2, #1, #4, ...

........................................................................
.............................. CYCLE   10 ..............................
........................................................................
   1    -39.7173451 -0.397173E+02  0.134E-01    1.25       0.0  T
   2    -39.7173453 -0.257077E-06  0.794E-02    1.24       1.0  T
   3    -39.7173147  0.306603E-04  0.416E-02    1.25       1.0  T
   4    -39.7173466 -0.319221E-04  0.610E-03    1.24       3.5  T
   5    -39.7173473 -0.713653E-06  0.196E-03    1.24      10.9  T
   6    -39.7173474 -0.487858E-07  0.851E-04    1.24      25.0  T
     SCC iter.                  ...        0 min,  0.006 sec
     gradient                   ...        0 min,  0.011 sec
 * total energy  :   -39.1259603 Eh     change       -0.1441335E-03 Eh
   gradient norm :     0.0054471 Eh/α   predicted    -0.1198719E-03 ( -16.83%)
   displ. norm   :     0.4622323 α      lambda       -0.2864648E-03
   maximum displ.:     0.3019095 α      in ANC's #2, #4, #1, ...

........................................................................
.............................. CYCLE   11 ..............................
........................................................................
   1    -39.7091780 -0.397092E+02  0.252E-01    1.23       0.0  T
   2    -39.7091726  0.532945E-05  0.151E-01    1.24       1.0  T
   3    -39.7088710  0.301589E-03  0.119E-01    1.23       1.0  T
   4    -39.7091867 -0.315706E-03  0.980E-03    1.23       2.2  T
   5    -39.7091885 -0.175277E-05  0.314E-03    1.24       6.8  T
   6    -39.7091886 -0.123453E-06  0.137E-03    1.24      15.6  T
   7    -39.7091886 -0.101321E-08  0.794E-04    1.24      26.8  T
     SCC iter.                  ...        0 min,  0.007 sec
     gradient                   ...        0 min,  0.011 sec
 * total energy  :   -39.1257338 Eh     change        0.2265250E-03 Eh
   gradient norm :     0.0199728 Eh/α   predicted    -0.1738380E-03 (-176.74%)
   displ. norm   :     0.1938391 α      lambda       -0.9147973E-03
   maximum displ.:     0.1190549 α      in ANC's #4, #2, #3, ...

........................................................................
.............................. CYCLE   12 ..............................
........................................................................
   1    -39.7171297 -0.397171E+02  0.119E-01    1.25       0.0  T
   2    -39.7171248  0.489599E-05  0.731E-02    1.25       1.0  T
   3    -39.7170097  0.115152E-03  0.787E-02    1.25       1.0  T
   4    -39.7171347 -0.124997E-03  0.530E-03    1.25       4.0  T
   5    -39.7171351 -0.406418E-06  0.207E-03    1.25      10.3  T
   6    -39.7171351 -0.600328E-07  0.102E-03    1.25      20.9  T
     SCC iter.                  ...        0 min,  0.006 sec
     gradient                   ...        0 min,  0.011 sec
 * total energy  :   -39.1261405 Eh     change       -0.4066697E-03 Eh
   gradient norm :     0.0066090 Eh/α   predicted    -0.4745994E-03 (  16.70%)
   displ. norm   :     0.1002817 α      lambda       -0.1782879E-03
   maximum displ.:     0.0553730 α      in ANC's #2, #1, #3, ...

........................................................................
.............................. CYCLE   13 ..............................
........................................................................
   1    -39.7173183 -0.397173E+02  0.552E-02    1.25       0.0  T
   2    -39.7173187 -0.351952E-06  0.326E-02    1.25       1.0  T
   3    -39.7173040  0.146854E-04  0.267E-02    1.25       1.0  T
   4    -39.7173197 -0.157571E-04  0.579E-03    1.25       3.7  T
   5    -39.7173202 -0.408959E-06  0.219E-03    1.25       9.7  T
   6    -39.7173202 -0.182242E-07  0.906E-04    1.25      23.5  T
     SCC iter.                  ...        0 min,  0.006 sec
     gradient                   ...        0 min,  0.011 sec
 * total energy  :   -39.1261550 Eh     change       -0.1450113E-04 Eh
   gradient norm :     0.0088187 Eh/α   predicted    -0.9004577E-04 ( 520.96%)
   displ. norm   :     0.1424360 α      lambda       -0.1772509E-03
   maximum displ.:     0.0914647 α      in ANC's #2, #1, #3, ...

........................................................................
.............................. CYCLE   14 ..............................
........................................................................
   1    -39.7167802 -0.397168E+02  0.792E-02    1.25       0.0  T
   2    -39.7167805 -0.364989E-06  0.465E-02    1.25       1.0  T
   3    -39.7167765  0.405910E-05  0.141E-02    1.25       1.5  T
   4    -39.7167808 -0.432803E-05  0.294E-03    1.25       7.2  T
   5    -39.7167809 -0.978754E-07  0.143E-03    1.25      14.9  T
   6    -39.7167809 -0.160276E-07  0.758E-04    1.25      28.1  T
     SCC iter.                  ...        0 min,  0.006 sec
     gradient                   ...        0 min,  0.011 sec
 * total energy  :   -39.1262770 Eh     change       -0.1220068E-03 Eh
   gradient norm :     0.0027162 Eh/α   predicted    -0.9042746E-04 ( -25.88%)
   displ. norm   :     0.2493857 α      lambda       -0.1011872E-03
   maximum displ.:     0.1610927 α      in ANC's #2, #1, #3, ...

........................................................................
.............................. CYCLE   15 ..............................
........................................................................
   1    -39.7156179 -0.397156E+02  0.136E-01    1.25       0.0  T
   2    -39.7156185 -0.547559E-06  0.802E-02    1.25       1.0  T
   3    -39.7156160  0.245540E-05  0.115E-02    1.25       1.9  T
   4    -39.7156188 -0.273839E-05  0.233E-03    1.25       9.2  T
   5    -39.7156188 -0.748965E-07  0.979E-04    1.25      21.8  T
   6    -39.7156189 -0.487722E-08  0.590E-04    1.25      36.1  T
     SCC iter.                  ...        0 min,  0.006 sec
     gradient                   ...        0 min,  0.011 sec
 * total energy  :   -39.1263388 Eh     change       -0.6183858E-04 Eh
   gradient norm :     0.0035885 Eh/α   predicted    -0.5374225E-04 ( -13.09%)
   displ. norm   :     0.1352563 α      lambda       -0.4627729E-04
   maximum displ.:     0.0832583 α      in ANC's #2, #1, #3, ...

........................................................................
.............................. CYCLE   16 ..............................
........................................................................
   1    -39.7161921 -0.397162E+02  0.757E-02    1.25       0.0  T
   2    -39.7161922 -0.103882E-06  0.445E-02    1.25       1.0  T
   3    -39.7161872  0.503782E-05  0.154E-02    1.25       1.4  T
   4    -39.7161925 -0.528321E-05  0.235E-03    1.25       9.1  T
   5    -39.7161926 -0.105912E-06  0.680E-04    1.25      31.3  T
   6    -39.7161926 -0.501078E-08  0.296E-04    1.25      72.0  T
     SCC iter.                  ...        0 min,  0.006 sec
     gradient                   ...        0 min,  0.011 sec
 * total energy  :   -39.1263728 Eh     change       -0.3398664E-04 Eh
   gradient norm :     0.0029286 Eh/α   predicted    -0.2356352E-04 ( -30.67%)
   displ. norm   :     0.1586897 α      lambda       -0.3954431E-04
   maximum displ.:     0.0994427 α      in ANC's #2, #1, #5, ...

........................................................................
.............................. CYCLE   17 ..............................
........................................................................
   1    -39.7167241 -0.397167E+02  0.884E-02    1.25       0.0  T
   2    -39.7167243 -0.188256E-06  0.519E-02    1.25       1.0  T
   3    -39.7167224  0.196124E-05  0.108E-02    1.25       2.0  T
   4    -39.7167246 -0.220644E-05  0.617E-04    1.25      34.6  T
   5    -39.7167246  0.644910E-09  0.389E-04    1.25      54.7  T
   6    -39.7167246 -0.102329E-08  0.227E-04    1.25      94.1  T
     SCC iter.                  ...        0 min,  0.006 sec
     gradient                   ...        0 min,  0.011 sec
 * total energy  :   -39.1263983 Eh     change       -0.2552022E-04 Eh
   gradient norm :     0.0015149 Eh/α   predicted    -0.2027172E-04 ( -20.57%)
   displ. norm   :     0.1474201 α      lambda       -0.1522608E-04
   maximum displ.:     0.0929842 α      in ANC's #1, #2, #35, ...

........................................................................
.............................. CYCLE   18 ..............................
........................................................................
   1    -39.7173541 -0.397174E+02  0.811E-02    1.25       0.0  T
   2    -39.7173543 -0.193552E-06  0.476E-02    1.25       1.0  T
   3    -39.7173534  0.918431E-06  0.703E-03    1.25       3.0  T
   4    -39.7173544 -0.102172E-05  0.147E-03    1.25      14.5  T
   5    -39.7173544 -0.315539E-07  0.669E-04    1.25      31.9  T
   6    -39.7173544 -0.465738E-08  0.350E-04    1.25      60.9  T
     SCC iter.                  ...        0 min,  0.006 sec
     gradient                   ...        0 min,  0.011 sec
 * total energy  :   -39.1264105 Eh     change       -0.1218718E-04 Eh
   gradient norm :     0.0020827 Eh/α   predicted    -0.7690986E-05 ( -36.89%)
   displ. norm   :     0.0449057 α      lambda       -0.7107366E-05
   maximum displ.:     0.0254287 α      in ANC's #1, #2, #5, ...

........................................................................
.............................. CYCLE   19 ..............................
........................................................................
   1    -39.7173404 -0.397173E+02  0.242E-02    1.25       0.0  T
   2    -39.7173404 -0.652142E-08  0.144E-02    1.25       1.5  T
   3    -39.7173392  0.125526E-05  0.781E-03    1.25       2.7  T
   4    -39.7173405 -0.131071E-05  0.107E-03    1.25      19.9  T
   5    -39.7173405 -0.216032E-07  0.383E-04    1.25      55.6  T
   6    -39.7173405 -0.206183E-08  0.152E-04    1.25     139.9  T
     SCC iter.                  ...        0 min,  0.006 sec
     gradient                   ...        0 min,  0.011 sec
 * total energy  :   -39.1264150 Eh     change       -0.4510803E-05 Eh
   gradient norm :     0.0009515 Eh/α   predicted    -0.3562528E-05 ( -21.02%)
   displ. norm   :     0.0724655 α      lambda       -0.4778118E-05
   maximum displ.:     0.0438244 α      in ANC's #1, #2, #3, ...

   *** GEOMETRY OPTIMIZATION CONVERGED AFTER 19 ITERATIONS ***

------------------------------------------------------------------------
 total energy gain   :        -0.0066909 Eh       -4.1986 kcal/mol
 total RMSD          :         0.6771434 a0        0.3583 Å
 total power (kW/mol):        -0.9245774 (step)  -36.1720 (real)
------------------------------------------------------------------------

 ANCopt (total)                0 d,  0 h,  0 min,  0.486 sec
 optimizer setup                ...        0 min,  0.000 sec (  0.027%)
 model hessian                  ...        0 min,  0.003 sec (  0.556%)
 ANC generation                 ...        0 min,  0.001 sec (  0.127%)
 coordinate transformation      ...        0 min,  0.000 sec (  0.056%)
 single point calculation       ...        0 min,  0.474 sec ( 97.533%)
 optimization log               ...        0 min,  0.002 sec (  0.345%)
 hessian update                 ...        0 min,  0.000 sec (  0.057%)
 rational function              ...        0 min,  0.005 sec (  1.041%)

================
 final structure:
================
$coord
    1.52089596034162   -2.01910165489962    0.25260367399145      C 
    2.24443354154188    0.40761498279699   -0.01245123766077      C 
    0.00238622570992    1.99328204479120    0.00442478028379      C 
   -2.10303923338743    0.22253577231882    0.30850033720137      C 
   -1.22338627835869   -2.15329874855013    0.45953233754608      C 
   -4.52913805030281    0.94258866695907    0.41879064248577      F 
   -0.14386443941041    4.55203664946910   -0.21387098253890      C 
   -2.36663132374949    6.12181425465282   -0.22272028880432      C 
   -1.66745422941620    8.58700494475661   -0.49806397915669      C 
    1.10457785249931    8.70263633627785   -0.67148516067979      C 
    1.97066406501310    6.33117645611258   -0.50510174469166      C 
    4.39474622987382    5.61247425853901   -0.58071492457195      F 
   -3.35663067227207   10.70593277339978   -0.61766546639224      C 
   -2.66561070893222   13.11033798556628   -0.92496775507913      C 
    2.72796120087015   -3.64995844327455    0.30987148634138      H 
    4.13470426296272    1.10709494857349   -0.21073292083194      H 
   -2.30009053161776   -3.85504164586624    0.68978337430898      H 
   -4.26127365990844    5.42534745791750   -0.04859539811329      H 
    2.20471012429118   10.38934595891896   -0.88980514130431      H 
   -5.34049105702829   10.23419797877695   -0.45536592889803      H 
   -0.71766730369100   13.66913809547267   -1.09494730746669      H 
   -4.04230715335017   14.60500853668480   -1.00972693525958      H 
$end
           -------------------------------------------------
          |                Final Singlepoint                |
           -------------------------------------------------

          ...................................................
          :                      SETUP                      :
          :.................................................:
          :  # basis functions                  64          :
          :  # atomic orbitals                  64          :
          :  # shells                           36          :
          :  # electrons                        70          :
          :  max. iterations                   250          :
          :  Hamiltonian                  GFN2-xTB          :
          :  restarted?                      false          :
          :  GBSA solvation                  false          :
          :  PC potential                    false          :
          :  electronic temp.          300.0000000     K    :
          :  accuracy                    1.0000000          :
          :  -> integral cutoff          0.2500000E+02      :
          :  -> integral neglect         0.1000000E-07      :
          :  -> SCF convergence          0.1000000E-05 Eh   :
          :  -> wf. convergence          0.1000000E-03 e    :
          :  Broyden damping             0.4000000          :
          ...................................................

 iter      E             dE          RMSdq      gap      omega  full diag
   1    -39.7173405 -0.397173E+02  0.104E-04    1.25       0.0  T
   2    -39.7173405  0.474927E-10  0.857E-05    1.25     248.7  T
   3    -39.7173405 -0.163332E-09  0.336E-05    1.25     634.5  T

   *** convergence criteria satisfied after 3 iterations ***

         #    Occupation            Energy/Eh            Energy/eV
      -------------------------------------------------------------
         1        2.0000           -0.8242260             -22.4283
       ...           ...                  ...                  ...
        29        2.0000           -0.4570611             -12.4373
        30        2.0000           -0.4467135             -12.1557
        31        2.0000           -0.4461278             -12.1398
        32        2.0000           -0.4360048             -11.8643
        33        2.0000           -0.4142915             -11.2734
        34        2.0000           -0.3873193             -10.5395
        35        2.0000           -0.3849228             -10.4743 (HOMO)
        36                         -0.3391135              -9.2277 (LUMO)
        37                         -0.2449916              -6.6666
        38                         -0.2098643              -5.7107
        39                         -0.1664234              -4.5286
        40                         -0.1342430              -3.6529
       ...                                ...                  ...
        64                          0.7396690              20.1274
      -------------------------------------------------------------
                  HL-Gap            0.0458093 Eh            1.2465 eV
             Fermi-level           -0.3619815 Eh           -9.8500 eV

 SCC (total)                   0 d,  0 h,  0 min,  0.023 sec
 SCC setup                      ...        0 min,  0.000 sec (  0.714%)
 Dispersion                     ...        0 min,  0.000 sec (  0.801%)
 integral evaluation            ...        0 min,  0.007 sec ( 32.101%)
 zeroth order Hamiltonian       ...        0 min,  0.000 sec (  0.563%)
 iterations                     ...        0 min,  0.003 sec ( 14.776%)
 molecular gradient             ...        0 min,  0.011 sec ( 49.573%)
 printout                       ...        0 min,  0.000 sec (  1.290%)

         :::::::::::::::::::::::::::::::::::::::::::::::::::::
         ::                     SUMMARY                     ::
         :::::::::::::::::::::::::::::::::::::::::::::::::::::
         :: total energy             -39.126415019907 Eh    ::
         :: gradient norm              0.000952087093 Eh/a0 ::
         :: HOMO-LUMO gap              1.246534101259 eV    ::
         ::.................................................::
         :: SCC energy               -39.717340507713 Eh    ::
         :: -> isotropic ES            0.022502357580 Eh    ::
         :: -> anisotropic ES         -0.000089844977 Eh    ::
         :: -> anisotropic XC          0.011748861099 Eh    ::
         :: -> dispersion             -0.020537492467 Eh    ::
         :: repulsion energy           0.591016569755 Eh    ::
         :: add. restraining           0.000000000000 Eh    ::
         :::::::::::::::::::::::::::::::::::::::::::::::::::::

           -------------------------------------------------
          |                Property Printout                |
           -------------------------------------------------

    * Orbital Energies and Occupations

         #    Occupation            Energy/Eh            Energy/eV
      -------------------------------------------------------------
         1        2.0000           -0.8242260             -22.4283
       ...           ...                  ...                  ...
        23        2.0000           -0.4966830             -13.5154
        24        2.0000           -0.4895701             -13.3219
        25        2.0000           -0.4792786             -13.0418
        26        2.0000           -0.4731944             -12.8763
        27        2.0000           -0.4689244             -12.7601
        28        2.0000           -0.4632978             -12.6070
        29        2.0000           -0.4570611             -12.4373
        30        2.0000           -0.4467135             -12.1557
        31        2.0000           -0.4461278             -12.1398
        32        2.0000           -0.4360048             -11.8643
        33        2.0000           -0.4142915             -11.2734
        34        2.0000           -0.3873193             -10.5395
        35        2.0000           -0.3849228             -10.4743 (HOMO)
        36                         -0.3391135              -9.2277 (LUMO)
        37                         -0.2449916              -6.6666
        38                         -0.2098643              -5.7107
        39                         -0.1664234              -4.5286
        40                         -0.1342430              -3.6529
        41                         -0.1136750              -3.0933
        42                          0.0348048               0.9471
        43                          0.0458538               1.2477
        44                          0.0612564               1.6669
        45                          0.0859856               2.3398
        46                          0.1117433               3.0407
       ...                                ...                  ...
        64                          0.7396690              20.1274
      -------------------------------------------------------------
                  HL-Gap            0.0458093 Eh            1.2465 eV
             Fermi-level           -0.3619815 Eh           -9.8500 eV

     #   Z        covCN         q      C6AA      α(0)
     1   6 C      3.044    -0.030    28.699     8.787
     2   6 C      2.996    -0.058    29.425     8.898
     3   6 C      3.069     0.022    27.443     8.590
     4   6 C      2.882     0.151    24.723     8.151
     5   6 C      2.999    -0.059    29.463     8.904
     6   9 F      0.785    -0.217    11.408     3.990
     7   6 C      3.057     0.023    27.436     8.590
     8   6 C      3.001    -0.065    29.613     8.927
     9   6 C      3.086     0.020    27.473     8.592
    10   6 C      2.992    -0.063    29.566     8.920
    11   6 C      2.877     0.155    24.651     8.139
    12   9 F      0.785    -0.212    11.362     3.982
    13   6 C      2.891    -0.023    28.570     8.763
    14   6 C      2.840    -0.076    29.885     8.959
    15   1 H      0.926     0.047     2.356     2.400
    16   1 H      0.926     0.062     2.177     2.307
    17   1 H      0.926     0.054     2.270     2.356
    18   1 H      0.926     0.064     2.157     2.297
    19   1 H      0.926     0.057     2.232     2.336
    20   1 H      0.925     0.048     2.344     2.394
    21   1 H      0.926     0.053     2.286     2.364
    22   1 H      0.926     0.048     2.343     2.394

 Mol. C6AA /au·bohr⁶  :       6741.284711
 Mol. C8AA /au·bohr⁸  :     168570.552910
 Mol. α(0) /au        :        131.039659


Wiberg/Mayer (AO) data.
largest (>0.10) Wiberg bond orders for each atom
          total WBO             WBO to atom ...
     1  C   3.927        C    2 1.741    C    5 1.097    H   15 0.973
     2  C   3.979        C    1 1.741    C    3 1.113    H   16 0.969
     3  C   3.947        C    7 1.548    C    2 1.113    C    4 1.060
     4  C   3.873        C    5 1.696    C    3 1.060    F    6 0.965
     5  C   3.942        C    4 1.696    C    1 1.097    H   17 0.971
     6  F   1.109        C    4 0.965
     7  C   3.984        C    3 1.548    C    8 1.156    C   11 1.045
     8  C   3.981        C    9 1.599    C    7 1.156    H   18 0.968    C   14 0.122
     9  C   3.941        C    8 1.599    C   13 1.148    C   10 1.057
    10  C   3.955        C   11 1.727    C    9 1.057    H   19 0.968
    11  C   3.880        C   10 1.727    C    7 1.045    F   12 0.969
    12  F   1.116        C   11 0.969
    13  C   3.988        C   14 1.835    C    9 1.148    H   20 0.962
    14  C   3.920        C   13 1.835    H   22 0.979    H   21 0.974    C    8 0.122
    15  H   0.997        C    1 0.973
    16  H   0.996        C    2 0.969
    17  H   0.996        C    5 0.971
    18  H   0.996        C    8 0.968
    19  H   0.996        C   10 0.968
    20  H   0.997        C   13 0.962
    21  H   0.997        C   14 0.974
    22  H   0.997        C   14 0.979

molecular dipole:
                 x           y           z       tot (Debye)
 q only:       -0.113       0.452      -0.050
   full:       -0.104       0.435      -0.051       1.145
molecular quadrupole (traceless):
                xx          xy          yy          xz          yz          zz
 q only:       -9.978      -7.369      14.521       1.013      -1.289      -4.542
  q+dip:      -10.830      -5.491      20.300       0.594      -2.459      -9.471
   full:      -11.814      -5.989      16.569       1.007      -1.621      -4.755

           -------------------------------------------------
          |                Geometry Summary                 |
           -------------------------------------------------

      molecular mass/u    :      190.1920000
   center of mass at/Å    :       -0.2517596       2.3711179      -0.1044250
  moments of inertia/u·Å² :        0.3738733E+03   0.1149132E+04   0.1522936E+04
rotational constants/cm⁻¹ :        0.4508915E-01   0.1466988E-01   0.1106916E-01

 * 18 selected distances

     #   Z        #   Z                                     value/Å
     1   6 C      2   6 C                                 1.3473475
     4   6 C      5   6 C                                 1.3430254
     4   6 C      6   9 F                                 1.3404589
     3   6 C      7   6 C                                 1.3611554
     7   6 C      8   6 C                                 1.4400014 (max)
     8   6 C      9   6 C                                 1.3637821
    10   6 C     11   6 C                                 1.3388928
    11   6 C     12   9 F                                 1.3385596
     9   6 C     13   6 C                                 1.4353758
    13   6 C     14   6 C                                 1.3338110
     1   6 C     15   1 H                                 1.0741099
     2   6 C     16   1 H                                 1.0717259 (min)
     5   6 C     17   1 H                                 1.0725780
     8   6 C     18   1 H                                 1.0721626
    10   6 C     19   1 H                                 1.0718869
    13   6 C     20   1 H                                 1.0824976
    14   6 C     21   1 H                                 1.0761486
    14   6 C     22   1 H                                 1.0762635

 * 3 distinct bonds (by element types)

   Z      Z             #   av. dist./Å        max./Å        min./Å
   1 H    6 C           8     1.0746716     1.0824976     1.0717259
   6 C    6 C           8     1.3704239     1.4400014     1.3338110
   6 C    9 F           2     1.3395092     1.3404589     1.3385596


optimized geometry written to: xtbopt.xyz


           -------------------------------------------------
          | TOTAL ENERGY              -39.126415019907 Eh   |
          | GRADIENT NORM               0.000952087093 Eh/α |
          | HOMO-LUMO GAP               1.246534101259 eV   |
           -------------------------------------------------

------------------------------------------------------------------------
 * finished run on 2021/05/19 at 10:58:57.656     
------------------------------------------------------------------------
 total:
 * wall-time:     0 d,  0 h,  0 min,  0.561 sec
 *  cpu-time:     0 d,  0 h,  0 min,  0.560 sec
 * ratio c/w:     0.999 speedup
 SCF:
 * wall-time:     0 d,  0 h,  0 min,  0.033 sec
 *  cpu-time:     0 d,  0 h,  0 min,  0.033 sec
 * ratio c/w:     1.000 speedup
 ANC optimizer:
 * wall-time:     0 d,  0 h,  0 min,  0.509 sec
 *  cpu-time:     0 d,  0 h,  0 min,  0.509 sec
 * ratio c/w:     1.000 speedup

