      -----------------------------------------------------------      
     |                   =====================                   |     
     |                           x T B                           |     
     |                   =====================                   |     
     |                         S. Grimme                         |     
     |          Mulliken Center for Theoretical Chemistry        |     
     |                    University of Bonn                     |     
     |                Version 6.2 RC2 (SAW190805)                |     
      -----------------------------------------------------------      

   This program is distributed in the hope that it will be useful,
   but WITHOUT ANY WARRANTY; without even the implied warranty of
   MERCHANTABILITY or FITNESS FOR A PARTICULAR PURPOSE.
   
   FOR NON-COMMERCIAL, ACADEMIA USE ONLY.
   
   Cite this work as:
   * S. Grimme, C. Bannwarth, P. Shushkov, J. Chem. Theory Comput., 2017,
     13, 1989-2009. DOI: 10.1021/acs.jctc.7b00118
   * C. Bannwarth, S. Ehlert and S. Grimme., J. Chem. Theory Comput., 2019,
     15, 1652-1671. DOI: 10.1021/acs.jctc.8b01176
   * P. Pracht, E. Caldeweyher, S. Ehlert, S. Grimme, ChemRxiv, 2019, preprint.
     DOI: 10.26434/chemrxiv.8326202.v1
   
   for DFT-D4:
   * E. Caldeweyher, C. Bannwarth and S. Grimme, J. Chem. Phys., 2017,
     147, 034112. DOI: 10.1063/1.4993215
   * E. Caldeweyher, S. Ehlert, A. Hansen, H. Neugebauer, S. Spicher,
     C. Bannwarth and S. Grimme, J. Chem. Phys., 2019, 150, 154122.
     DOI: 10.1063/1.5090222
   
   for sTDA-xTB:
   * S. Grimme and C. Bannwarth, J. Chem. Phys., 2016, 145, 054103.
     DOI: 10.1063/1.4959605
   
   in the mass-spec context:
   * V. Asgeirsson, C. Bauer and S. Grimme, Chem. Sci., 2017, 8, 4879.
     DOI: 10.1039/c7sc00601b
   
   for metadynamics refer to:
   * S. Grimme, J. Chem. Theory Comput., 2019, 155, 2847-2862
     DOI: 10.1021/acs.jctc.9b00143
   
   with help from (in alphabetical order)
   C. Bannwarth, F. Bohle, G. Brandenburg, E. Caldeweyher, M. Checinski,
   S. Dohm, S. Ehlert, S. Ehrlich, F. März, H. Neugebauer, J. Pisarek,
   P. Pracht, P. Shushkov, and S. Spicher.
   
 * started run on 2021/05/19 at 10:59:01.109     

           -------------------------------------------------
          |                Calculation Setup                |
           -------------------------------------------------

          program call               : /ihome/ghutchison/geoffh/xtb/xtb 315.xyz -opt
          hostname                   : smp-n122
          coordinate file            : 315.xyz
          omp threads                :                     1
          number of atoms            :                    20
          number of electrons        :                    64
          charge                     :                     0
          spin                       :                   0.0
          first test random number   :      0.53434161069758


########################################################################
# WARNING! Please study the warnings concerning your input carefully
#  - the use of '-opt' is discouraged, please use '--opt' next time
########################################################################

           ------------------------------------------------- 
          |                 G F N 2 - x T B                 |
          | Geometry, Frequencies, Noncovalent interactions |
          |            JCTC 2019 parametrisation            |
           ------------------------------------------------- 
             KAB for C  - Si     :                1.0500
             KAB for H  - Pd     :                0.9500
             k(s)              :                1.8500
             k(p)              :                2.2300
             k(d)              :                2.2300
             k(f)              :                2.0000
             kEN (H0ij)        :               -2.0000
             D4 a1             :                0.5200
             D4 a2             :                5.0000
             D4 s6             :                1.0000
             D4 s8             :                2.7000
             D4 s9             :                5.0000
             alphaj            :                2.0000

  Z AO/shell   Hii/eV     exponent
  1     Wed Apr 25 08:07:45 CEST 2018   EN: 2.200 GM2: 0.406  GM3: 0.0800  RAES: 1.40
     1s    -10.707211    1.230000
  6     Wed Apr 25 08:07:45 CEST 2018   EN: 2.550 GM2: 0.538  GM3: 0.1500  RAES: 3.00
     2s    -13.970922    2.096432
     2p    -10.063292    1.800000
  7     Wed Apr 25 08:07:45 CEST 2018   EN: 3.040 GM2: 0.461  GM3:-0.0640  RAES: 1.90
     2s    -16.686243    2.339881
     2p    -12.523956    2.014332

           ------------------------------------------------- 
          |        Self-Consistent Charge Iterations        |
           ------------------------------------------------- 

          ...................................................
          :                      SETUP                      :
          :.................................................:
          :  # basis functions                  62          :
          :  # atomic orbitals                  62          :
          :  # shells                           34          :
          :  # electrons                        64          :
          :  max. iterations                   250          :
          :  Hamiltonian                  GFN2-xTB          :
          :  restarted?                      false          :
          :  GBSA solvation                  false          :
          :  PC potential                    false          :
          :  electronic temp.          300.0000000     K    :
          :  accuracy                    1.0000000          :
          :  -> integral cutoff          0.2500000E+02      :
          :  -> integral neglect         0.1000000E-07      :
          :  -> SCF convergence          0.1000000E-05 Eh   :
          :  -> wf. convergence          0.1000000E-03 e    :
          :  Broyden damping             0.4000000          :
          ...................................................

 iter      E             dE          RMSdq      gap      omega  full diag
   1    -34.9633301 -0.349633E+02  0.635E+00    1.56       0.0  T
   2    -34.9101522  0.531780E-01  0.461E+00    1.50       1.0  T
   3    -34.8871534  0.229988E-01  0.353E+00    1.51       1.0  T
   4    -35.0192859 -0.132132E+00  0.119E+00    1.45       1.0  T
   5    -35.0457427 -0.264568E-01  0.334E-01    1.48       1.0  T
   6    -35.0463472 -0.604454E-03  0.189E-01    1.46       1.0  T
   7    -35.0467687 -0.421517E-03  0.771E-02    1.48       1.0  T
   8    -35.0468297 -0.610126E-04  0.274E-02    1.48       1.0  T
   9    -35.0468319 -0.216297E-05  0.159E-02    1.48       1.4  T
  10    -35.0468340 -0.209923E-05  0.640E-03    1.48       3.5  T
  11    -35.0468345 -0.519497E-06  0.148E-03    1.48      15.1  T
  12    -35.0468345 -0.205259E-08  0.886E-04    1.48      25.3  T
  13    -35.0468345 -0.546188E-08  0.456E-04    1.48      49.0  T

   *** convergence criteria satisfied after 13 iterations ***

         #    Occupation            Energy/Eh            Energy/eV
      -------------------------------------------------------------
         1        2.0000           -0.6964161             -18.9504
       ...           ...                  ...                  ...
        26        2.0000           -0.4675531             -12.7228
        27        2.0000           -0.4611011             -12.5472
        28        2.0000           -0.4417534             -12.0207
        29        2.0000           -0.4386290             -11.9357
        30        2.0000           -0.4356385             -11.8543
        31        2.0000           -0.4188522             -11.3975
        32        2.0000           -0.4171754             -11.3519 (HOMO)
        33                         -0.3628683              -9.8741 (LUMO)
        34                         -0.2762059              -7.5159
        35                         -0.2631231              -7.1599
        36                         -0.2553563              -6.9486
        37                         -0.2279965              -6.2041
       ...                                ...                  ...
        62                          1.1042275              30.0476
      -------------------------------------------------------------
                  HL-Gap            0.0543070 Eh            1.4778 eV
             Fermi-level           -0.3899454 Eh          -10.6110 eV

 SCC (total)                   0 d,  0 h,  0 min,  0.032 sec
 SCC setup                      ...        0 min,  0.000 sec (  0.842%)
 Dispersion                     ...        0 min,  0.000 sec (  1.024%)
 integral evaluation            ...        0 min,  0.008 sec ( 23.743%)
 zeroth order Hamiltonian       ...        0 min,  0.000 sec (  0.407%)
 iterations                     ...        0 min,  0.013 sec ( 40.186%)
 molecular gradient             ...        0 min,  0.010 sec ( 32.648%)
 printout                       ...        0 min,  0.000 sec (  0.993%)

         :::::::::::::::::::::::::::::::::::::::::::::::::::::
         ::                     SUMMARY                     ::
         :::::::::::::::::::::::::::::::::::::::::::::::::::::
         :: total energy             -34.394531209554 Eh    ::
         :: gradient norm              0.258143102627 Eh/a0 ::
         :: HOMO-LUMO gap              1.477770023215 eV    ::
         ::.................................................::
         :: SCC energy               -35.046834481344 Eh    ::
         :: -> isotropic ES            0.016358478865 Eh    ::
         :: -> anisotropic ES          0.003283893526 Eh    ::
         :: -> anisotropic XC          0.050347149014 Eh    ::
         :: -> dispersion             -0.019789836305 Eh    ::
         :: repulsion energy           0.652422260247 Eh    ::
         :: add. restraining           0.000000000000 Eh    ::
         :::::::::::::::::::::::::::::::::::::::::::::::::::::

      ----------------------------------------------------------- 
     |                   =====================                   |
     |                        A N C O P T                        |
     |                   =====================                   |
     |               Approximate Normal Coordinate               |
     |                Rational Function Optimizer                |
      ----------------------------------------------------------- 

          ...................................................
          :                      SETUP                      :
          :.................................................:
          :   optimization level            normal          :
          :   max. optcycles                   200          :
          :   ANC micro-cycles                  20          :
          :   degrees of freedom                54          :
          :.................................................:
          :   RF solver                   davidson          :
          :   input Hessian                  false          :
          :   write xtbopt.log                true          :
          :   linear?                        false          :
          :   energy convergence         0.5000000E-05 Eh   :
          :   grad. convergence          0.1000000E-02 Eh/α :
          :   maximium RF displ.         2.0000000          :
          :   Hlow (freq-cutoff)         0.5000000E-02      :
          :   Hmax (freq-cutoff)         5.0000000          :
          :   S6 in model hess.         20.0000000          :
          ...................................................

generating ANC from model Hessian ...
Using Lindh-Hessian (1995)
 Shifting diagonal of input Hessian by   4.833710547156036E-003
 Lowest  eigenvalues of input Hessian
   -0.000000   -0.000000   -0.000000   -0.000000    0.000000    0.000000
    0.005000    0.006131    0.006422    0.007582    0.010588    0.012137
    0.015879    0.021043    0.027550    0.030475    0.031188    0.043263
 Highest eigenvalues
    1.848034    1.881122    1.916642    2.043985    2.150746    2.584807
 

........................................................................
.............................. CYCLE    1 ..............................
........................................................................
   1    -35.0468345 -0.350468E+02  0.119E-04    1.48       0.0  T
   2    -35.0468345 -0.167120E-10  0.971E-05    1.48     230.4  T
   3    -35.0468345 -0.124075E-09  0.475E-05    1.48     470.5  T
     SCC iter.                  ...        0 min,  0.003 sec
     gradient                   ...        0 min,  0.010 sec
 * total energy  :   -34.3945312 Eh     change        0.1972279E-07 Eh
   gradient norm :     0.2581451 Eh/α   predicted     0.0000000E+00 (-100.00%)
   displ. norm   :     0.3095182 α      lambda       -0.5774846E-01
   maximum displ.:     0.1606701 α      in ANC's #23, #17, #35, ...

........................................................................
.............................. CYCLE    2 ..............................
........................................................................
   1    -35.1458186 -0.351458E+02  0.480E-01    1.42       0.0  T
   2    -35.1460099 -0.191351E-03  0.301E-01    1.43       1.0  T
   3    -35.1456361  0.373822E-03  0.232E-01    1.42       1.0  T
   4    -35.1463077 -0.671605E-03  0.554E-02    1.42       1.0  T
   5    -35.1463565 -0.488271E-04  0.298E-02    1.42       1.0  T
   6    -35.1463719 -0.154248E-04  0.806E-03    1.43       2.8  T
   7    -35.1463720 -0.981849E-07  0.532E-03    1.43       4.2  T
   8    -35.1463723 -0.275305E-06  0.247E-03    1.43       9.1  T
     SCC iter.                  ...        0 min,  0.007 sec
     gradient                   ...        0 min,  0.010 sec
 * total energy  :   -34.4287167 Eh     change       -0.3418553E-01 Eh
   gradient norm :     0.0546502 Eh/α   predicted    -0.3164074E-01 (  -7.44%)
   displ. norm   :     0.1280872 α      lambda       -0.3340246E-02
   maximum displ.:     0.0713796 α      in ANC's #23, #17, #2, ...

........................................................................
.............................. CYCLE    3 ..............................
........................................................................
   1    -35.1513156 -0.351513E+02  0.990E-02    1.39       0.0  T
   2    -35.1513121  0.352061E-05  0.947E-02    1.39       1.0  T
   3    -35.1513946 -0.825332E-04  0.419E-02    1.39       1.0  T
   4    -35.1513791  0.155060E-04  0.320E-02    1.39       1.0  T
   5    -35.1513970 -0.178988E-04  0.664E-03    1.39       3.4  T
   6    -35.1513976 -0.562236E-06  0.279E-03    1.39       8.0  T
   7    -35.1513977 -0.729302E-07  0.127E-03    1.39      17.6  T
     SCC iter.                  ...        0 min,  0.007 sec
     gradient                   ...        0 min,  0.010 sec
 * total energy  :   -34.4306984 Eh     change       -0.1981679E-02 Eh
   gradient norm :     0.0191541 Eh/α   predicted    -0.1697539E-02 ( -14.34%)
   displ. norm   :     0.0665250 α      lambda       -0.2981994E-03
   maximum displ.:     0.0445193 α      in ANC's #2, #3, #11, ...

........................................................................
.............................. CYCLE    4 ..............................
........................................................................
   1    -35.1489732 -0.351490E+02  0.868E-02    1.39       0.0  T
   2    -35.1489755 -0.231878E-05  0.510E-02    1.39       1.0  T
   3    -35.1489589  0.166549E-04  0.351E-02    1.39       1.0  T
   4    -35.1489793 -0.204563E-04  0.413E-03    1.39       5.4  T
   5    -35.1489795 -0.197047E-06  0.215E-03    1.39      10.4  T
   6    -35.1489796 -0.475513E-07  0.104E-03    1.39      21.4  T
     SCC iter.                  ...        0 min,  0.006 sec
     gradient                   ...        0 min,  0.010 sec
 * total energy  :   -34.4308575 Eh     change       -0.1591330E-03 Eh
   gradient norm :     0.0082970 Eh/α   predicted    -0.1497742E-03 (  -5.88%)
   displ. norm   :     0.0429750 α      lambda       -0.8515775E-04
   maximum displ.:     0.0197190 α      in ANC's #15, #5, #11, ...

........................................................................
.............................. CYCLE    5 ..............................
........................................................................
   1    -35.1493210 -0.351493E+02  0.388E-02    1.39       0.0  T
   2    -35.1493211 -0.110633E-06  0.227E-02    1.39       1.0  T
   3    -35.1493157  0.542453E-05  0.188E-02    1.39       1.2  T
   4    -35.1493223 -0.660697E-05  0.293E-03    1.39       7.6  T
   5    -35.1493224 -0.124146E-06  0.139E-03    1.39      16.1  T
   6    -35.1493224 -0.255624E-07  0.652E-04    1.39      34.3  T
     SCC iter.                  ...        0 min,  0.006 sec
     gradient                   ...        0 min,  0.010 sec
 * total energy  :   -34.4308995 Eh     change       -0.4193511E-04 Eh
   gradient norm :     0.0043538 Eh/α   predicted    -0.4267716E-04 (   1.77%)
   displ. norm   :     0.0991078 α      lambda       -0.1000984E-03
   maximum displ.:     0.0745150 α      in ANC's #2, #3, #11, ...

........................................................................
.............................. CYCLE    6 ..............................
........................................................................
   1    -35.1491820 -0.351492E+02  0.156E-01    1.40       0.0  T
   2    -35.1491857 -0.375998E-05  0.869E-02    1.40       1.0  T
   3    -35.1491472  0.385057E-04  0.446E-02    1.40       1.0  T
   4    -35.1491909 -0.437281E-04  0.480E-03    1.40       4.7  T
   5    -35.1491913 -0.344562E-06  0.248E-03    1.40       9.0  T
   6    -35.1491914 -0.670889E-07  0.112E-03    1.40      20.0  T
     SCC iter.                  ...        0 min,  0.006 sec
     gradient                   ...        0 min,  0.010 sec
 * total energy  :   -34.4309246 Eh     change       -0.2512249E-04 Eh
   gradient norm :     0.0047465 Eh/α   predicted    -0.5054247E-04 ( 101.18%)
   displ. norm   :     0.0263783 α      lambda       -0.3340923E-04
   maximum displ.:     0.0140312 α      in ANC's #1, #2, #6, ...

........................................................................
.............................. CYCLE    7 ..............................
........................................................................
   1    -35.1496027 -0.351496E+02  0.479E-02    1.40       0.0  T
   2    -35.1496033 -0.559487E-06  0.265E-02    1.40       1.0  T
   3    -35.1496012  0.207852E-05  0.110E-02    1.40       2.0  T
   4    -35.1496037 -0.245858E-05  0.161E-03    1.40      13.9  T
   5    -35.1496037 -0.376796E-07  0.781E-04    1.40      28.6  T
     SCC iter.                  ...        0 min,  0.005 sec
     gradient                   ...        0 min,  0.010 sec
 * total energy  :   -34.4309340 Eh     change       -0.9399317E-05 Eh
   gradient norm :     0.0021040 Eh/α   predicted    -0.1671645E-04 (  77.85%)
   displ. norm   :     0.0442726 α      lambda       -0.4249400E-04
   maximum displ.:     0.0235957 α      in ANC's #3, #5, #1, ...

........................................................................
.............................. CYCLE    8 ..............................
........................................................................
   1    -35.1502413 -0.351502E+02  0.840E-02    1.40       0.0  T
   2    -35.1502429 -0.151260E-05  0.465E-02    1.40       1.0  T
   3    -35.1502368  0.603394E-05  0.183E-02    1.40       1.2  T
   4    -35.1502440 -0.715454E-05  0.241E-03    1.40       9.3  T
   5    -35.1502441 -0.804549E-07  0.127E-03    1.40      17.6  T
   6    -35.1502441 -0.179803E-07  0.629E-04    1.40      35.5  T
   7    -35.1502441 -0.371585E-08  0.216E-04    1.40     103.6  T
     SCC iter.                  ...        0 min,  0.007 sec
     gradient                   ...        0 min,  0.010 sec
 * total energy  :   -34.4309231 Eh     change        0.1087029E-04 Eh
   gradient norm :     0.0038217 Eh/α   predicted    -0.2129021E-04 (-295.86%)
   displ. norm   :     0.0366440 α      lambda       -0.4386834E-04
   maximum displ.:     0.0227937 α      in ANC's #3, #2, #5, ...

........................................................................
.............................. CYCLE    9 ..............................
........................................................................
   1    -35.1497922 -0.351498E+02  0.652E-02    1.40       0.0  T
   2    -35.1497929 -0.762513E-06  0.361E-02    1.40       1.0  T
   3    -35.1497888  0.415170E-05  0.153E-02    1.40       1.5  T
   4    -35.1497936 -0.482506E-05  0.181E-03    1.40      12.4  T
   5    -35.1497936 -0.481680E-07  0.940E-04    1.40      23.8  T
   6    -35.1497937 -0.934291E-08  0.458E-04    1.40      48.8  T
     SCC iter.                  ...        0 min,  0.006 sec
     gradient                   ...        0 min,  0.010 sec
 * total energy  :   -34.4309461 Eh     change       -0.2293707E-04 Eh
   gradient norm :     0.0006446 Eh/α   predicted    -0.2196395E-04 (  -4.24%)
   displ. norm   :     0.0144914 α      lambda       -0.1457750E-05
   maximum displ.:     0.0085248 α      in ANC's #3, #2, #11, ...

........................................................................
.............................. CYCLE   10 ..............................
........................................................................
   1    -35.1497239 -0.351497E+02  0.148E-02    1.40       0.0  T
   2    -35.1497239 -0.389442E-07  0.826E-03    1.40       2.7  T
   3    -35.1497239  0.465425E-08  0.114E-03    1.40      19.6  T
   4    -35.1497239 -0.204725E-07  0.374E-04    1.40      59.8  T
   5    -35.1497239 -0.540666E-09  0.250E-04    1.40      89.6  T
     SCC iter.                  ...        0 min,  0.005 sec
     gradient                   ...        0 min,  0.010 sec
 * total energy  :   -34.4309476 Eh     change       -0.1593702E-05 Eh
   gradient norm :     0.0004685 Eh/α   predicted    -0.7302031E-06 ( -54.18%)
   displ. norm   :     0.0177300 α      lambda       -0.1366647E-05
   maximum displ.:     0.0088830 α      in ANC's #3, #5, #1, ...

   *** GEOMETRY OPTIMIZATION CONVERGED AFTER 10 ITERATIONS ***

------------------------------------------------------------------------
 total energy gain   :        -0.0364164 Eh      -22.8517 kcal/mol
 total RMSD          :         0.1112129 a0        0.0589 Å
 total power (kW/mol):        -9.5611350 (step) -393.3620 (real)
------------------------------------------------------------------------

 ANCopt (total)                0 d,  0 h,  0 min,  0.243 sec
 optimizer setup                ...        0 min,  0.000 sec (  0.055%)
 model hessian                  ...        0 min,  0.002 sec (  1.001%)
 ANC generation                 ...        0 min,  0.001 sec (  0.212%)
 coordinate transformation      ...        0 min,  0.000 sec (  0.054%)
 single point calculation       ...        0 min,  0.237 sec ( 97.426%)
 optimization log               ...        0 min,  0.001 sec (  0.356%)
 hessian update                 ...        0 min,  0.000 sec (  0.070%)
 rational function              ...        0 min,  0.001 sec (  0.545%)

================
 final structure:
================
$coord
    2.13430787133760    0.49123636401173   -0.00163941709729      C 
    1.28508589969300   -1.89914784137518    0.00000958313121      C 
   -1.49516309352070   -1.83999016439510   -0.00269784323846      C 
   -3.01814682632604   -4.00486646486671   -0.00495232558477      C 
   -4.24540385440227   -5.79369160260053   -0.00839902461932      N 
   -2.26891248242136    0.60681629751407   -0.00475620122155      C 
   -0.03415511808184    2.19453837175965   -0.00609712582531      C 
    0.01686619069667    4.76866455733232   -0.01608069474832      C 
   -2.15358064664540    6.46974352313340   -0.02416088272629      C 
   -1.30684573164691    8.86087353802031   -0.04146589100941      C 
    1.47323532025270    8.80468992231245   -0.04459187908947      C 
    2.24986359251778    6.35860212725378   -0.02794373402949      C 
    2.99579288521976   10.96970547030082   -0.06377380845692      C 
    4.23076415656577   12.75308132089256   -0.08253547865647      N 
    4.06781109519553    1.09853781416656   -0.00004047943979      H 
    2.36767314126069   -3.61579750015184    0.00273759336379      H 
   -4.18328449880056    1.27301988848267   -0.00696899491838      H 
   -4.08628713332395    5.86018281276342   -0.01707544772571      H 
   -2.39168687868008   10.57612341180508   -0.05173974660561      H 
    4.16483541378145    5.69408273497135   -0.02560546464485      H 
$end
           -------------------------------------------------
          |                Final Singlepoint                |
           -------------------------------------------------

          ...................................................
          :                      SETUP                      :
          :.................................................:
          :  # basis functions                  62          :
          :  # atomic orbitals                  62          :
          :  # shells                           34          :
          :  # electrons                        64          :
          :  max. iterations                   250          :
          :  Hamiltonian                  GFN2-xTB          :
          :  restarted?                      false          :
          :  GBSA solvation                  false          :
          :  PC potential                    false          :
          :  electronic temp.          300.0000000     K    :
          :  accuracy                    1.0000000          :
          :  -> integral cutoff          0.2500000E+02      :
          :  -> integral neglect         0.1000000E-07      :
          :  -> SCF convergence          0.1000000E-05 Eh   :
          :  -> wf. convergence          0.1000000E-03 e    :
          :  Broyden damping             0.4000000          :
          ...................................................

 iter      E             dE          RMSdq      gap      omega  full diag
   1    -35.1497239 -0.351497E+02  0.189E-04    1.40       0.0  T
   2    -35.1497239  0.391303E-09  0.162E-04    1.40     138.4  T
   3    -35.1497239 -0.662446E-09  0.992E-05    1.40     225.3  T

   *** convergence criteria satisfied after 3 iterations ***

         #    Occupation            Energy/Eh            Energy/eV
      -------------------------------------------------------------
         1        2.0000           -0.6927183             -18.8498
       ...           ...                  ...                  ...
        26        2.0000           -0.4692735             -12.7696
        27        2.0000           -0.4646320             -12.6433
        28        2.0000           -0.4360345             -11.8651
        29        2.0000           -0.4359743             -11.8635
        30        2.0000           -0.4337222             -11.8022
        31        2.0000           -0.4170236             -11.3478
        32        2.0000           -0.4155711             -11.3083 (HOMO)
        33                         -0.3640906              -9.9074 (LUMO)
        34                         -0.2655741              -7.2266
        35                         -0.2467192              -6.7136
        36                         -0.2227040              -6.0601
        37                         -0.2217965              -6.0354
       ...                                ...                  ...
        62                          1.1713387              31.8737
      -------------------------------------------------------------
                  HL-Gap            0.0514805 Eh            1.4009 eV
             Fermi-level           -0.3897375 Eh          -10.6053 eV

 SCC (total)                   0 d,  0 h,  0 min,  0.022 sec
 SCC setup                      ...        0 min,  0.000 sec (  0.746%)
 Dispersion                     ...        0 min,  0.000 sec (  0.896%)
 integral evaluation            ...        0 min,  0.007 sec ( 34.071%)
 zeroth order Hamiltonian       ...        0 min,  0.000 sec (  0.506%)
 iterations                     ...        0 min,  0.003 sec ( 15.276%)
 molecular gradient             ...        0 min,  0.010 sec ( 47.007%)
 printout                       ...        0 min,  0.000 sec (  1.292%)

         :::::::::::::::::::::::::::::::::::::::::::::::::::::
         ::                     SUMMARY                     ::
         :::::::::::::::::::::::::::::::::::::::::::::::::::::
         :: total energy             -34.430947651238 Eh    ::
         :: gradient norm              0.000467989083 Eh/a0 ::
         :: HOMO-LUMO gap              1.400855957624 eV    ::
         ::.................................................::
         :: SCC energy               -35.149723934510 Eh    ::
         :: -> isotropic ES            0.016730071923 Eh    ::
         :: -> anisotropic ES          0.003046946552 Eh    ::
         :: -> anisotropic XC          0.048423401281 Eh    ::
         :: -> dispersion             -0.019861730375 Eh    ::
         :: repulsion energy           0.718901954105 Eh    ::
         :: add. restraining           0.000000000000 Eh    ::
         :::::::::::::::::::::::::::::::::::::::::::::::::::::

           -------------------------------------------------
          |                Property Printout                |
           -------------------------------------------------

    * Orbital Energies and Occupations

         #    Occupation            Energy/Eh            Energy/eV
      -------------------------------------------------------------
         1        2.0000           -0.6927183             -18.8498
       ...           ...                  ...                  ...
        20        2.0000           -0.5044261             -13.7261
        21        2.0000           -0.5018375             -13.6557
        22        2.0000           -0.5017270             -13.6527
        23        2.0000           -0.4854329             -13.2093
        24        2.0000           -0.4834610             -13.1556
        25        2.0000           -0.4747724             -12.9192
        26        2.0000           -0.4692735             -12.7696
        27        2.0000           -0.4646320             -12.6433
        28        2.0000           -0.4360345             -11.8651
        29        2.0000           -0.4359743             -11.8635
        30        2.0000           -0.4337222             -11.8022
        31        2.0000           -0.4170236             -11.3478
        32        2.0000           -0.4155711             -11.3083 (HOMO)
        33                         -0.3640906              -9.9074 (LUMO)
        34                         -0.2655741              -7.2266
        35                         -0.2467192              -6.7136
        36                         -0.2227040              -6.0601
        37                         -0.2217965              -6.0354
        38                         -0.2208884              -6.0107
        39                         -0.1441420              -3.9223
        40                         -0.1259134              -3.4263
        41                         -0.1199754              -3.2647
        42                          0.0549046               1.4940
        43                          0.0603402               1.6419
       ...                                ...                  ...
        62                          1.1713387              31.8737
      -------------------------------------------------------------
                  HL-Gap            0.0514805 Eh            1.4009 eV
             Fermi-level           -0.3897375 Eh          -10.6053 eV

     #   Z        covCN         q      C6AA      α(0)
     1   6 C      2.993    -0.044    29.092     8.848
     2   6 C      3.012    -0.021    28.523     8.761
     3   6 C      3.079     0.024    27.379     8.578
     4   6 C      1.899     0.115    28.266     8.586
     5   7 N      0.911    -0.220    25.807     7.347
     6   6 C      2.988    -0.036    28.889     8.817
     7   6 C      3.089     0.037    27.069     8.528
     8   6 C      3.089     0.037    27.069     8.528
     9   6 C      2.993    -0.044    29.093     8.848
    10   6 C      3.012    -0.022    28.524     8.761
    11   6 C      3.079     0.024    27.378     8.578
    12   6 C      2.988    -0.036    28.889     8.817
    13   6 C      1.899     0.115    28.265     8.586
    14   7 N      0.911    -0.220    25.807     7.347
    15   1 H      0.926     0.047     2.359     2.402
    16   1 H      0.926     0.049     2.337     2.390
    17   1 H      0.926     0.050     2.319     2.381
    18   1 H      0.926     0.047     2.359     2.402
    19   1 H      0.926     0.049     2.337     2.391
    20   1 H      0.926     0.050     2.319     2.381

 Mol. C6AA /au·bohr⁶  :       6888.648827
 Mol. C8AA /au·bohr⁸  :     178118.601248
 Mol. α(0) /au        :        133.278352


Wiberg/Mayer (AO) data.
largest (>0.10) Wiberg bond orders for each atom
          total WBO             WBO to atom ...
     1  C   3.986        C    2 1.777    C    7 1.094    H   15 0.969
     2  C   3.941        C    1 1.777    C    3 1.042    H   16 0.972
     3  C   3.941        C    6 1.627    C    4 1.126    C    2 1.042
     4  C   3.950        N    5 2.778    C    3 1.126
     5  N   2.969        C    4 2.778    C    6 0.113
     6  C   3.986        C    3 1.627    C    7 1.119    H   17 0.970    N    5 0.113
     7  C   3.961        C    8 1.533    C    6 1.119    C    1 1.094
     8  C   3.961        C    7 1.533    C   12 1.119    C    9 1.094
     9  C   3.986        C   10 1.778    C    8 1.094    H   18 0.969
    10  C   3.941        C    9 1.778    C   11 1.042    H   19 0.972
    11  C   3.941        C   12 1.627    C   13 1.126    C   10 1.042
    12  C   3.986        C   11 1.627    C    8 1.119    H   20 0.970    N   14 0.113
    13  C   3.950        N   14 2.778    C   11 1.126
    14  N   2.969        C   13 2.778    C   12 0.113
    15  H   0.996        C    1 0.969
    16  H   0.997        C    2 0.972
    17  H   0.997        C    6 0.970
    18  H   0.996        C    9 0.969
    19  H   0.997        C   10 0.972
    20  H   0.997        C   12 0.970

molecular dipole:
                 x           y           z       tot (Debye)
 q only:       -0.001       0.001       0.009
   full:       -0.002       0.001       0.012       0.032
molecular quadrupole (traceless):
                xx          xy          yy          xz          yz          zz
 q only:        7.366     -19.441     -18.801       0.077       0.168      11.435
  q+dip:       12.050     -29.073     -24.909       0.115       0.219      12.859
   full:       10.580     -31.328     -29.497       0.125       0.261      18.917

           -------------------------------------------------
          |                Geometry Summary                 |
           -------------------------------------------------

      molecular mass/u    :      178.1928000
   center of mass at/Å    :       -0.0051305       1.8422741      -0.0125724
  moments of inertia/u·Å² :        0.1693584E+03   0.1744426E+04   0.1913770E+04
rotational constants/cm⁻¹ :        0.9953818E-01   0.9663715E-02   0.8808597E-02

 * 13 selected distances

     #   Z        #   Z                                     value/Å
     1   6 C      2   6 C                                 1.3423922
     4   6 C      5   7 N                                 1.1479692
     3   6 C      6   6 C                                 1.3579924
     7   6 C      8   6 C                                 1.3624468 (max)
     9   6 C     10   6 C                                 1.3423551
    11   6 C     12   6 C                                 1.3581182
    13   6 C     14   7 N                                 1.1479531
     1   6 C     15   1 H                                 1.0724495
     2   6 C     16   1 H                                 1.0739676
     6   6 C     17   1 H                                 1.0726323
     9   6 C     18   1 H                                 1.0724125 (min)
    10   6 C     19   1 H                                 1.0739910
    12   6 C     20   1 H                                 1.0726396

 * 3 distinct bonds (by element types)

   Z      Z             #   av. dist./Å        max./Å        min./Å
   1 H    6 C           6     1.0730154     1.0739910     1.0724125
   6 C    6 C           5     1.3526609     1.3624468     1.3423551
   6 C    7 N           2     1.1479612     1.1479692     1.1479531


optimized geometry written to: xtbopt.xyz


           -------------------------------------------------
          | TOTAL ENERGY              -34.430947651238 Eh   |
          | GRADIENT NORM               0.000467989083 Eh/α |
          | HOMO-LUMO GAP               1.400855957624 eV   |
           -------------------------------------------------

------------------------------------------------------------------------
 * finished run on 2021/05/19 at 10:59:01.426     
------------------------------------------------------------------------
 total:
 * wall-time:     0 d,  0 h,  0 min,  0.317 sec
 *  cpu-time:     0 d,  0 h,  0 min,  0.316 sec
 * ratio c/w:     0.997 speedup
 SCF:
 * wall-time:     0 d,  0 h,  0 min,  0.032 sec
 *  cpu-time:     0 d,  0 h,  0 min,  0.032 sec
 * ratio c/w:     1.000 speedup
 ANC optimizer:
 * wall-time:     0 d,  0 h,  0 min,  0.266 sec
 *  cpu-time:     0 d,  0 h,  0 min,  0.266 sec
 * ratio c/w:     1.000 speedup

