      -----------------------------------------------------------      
     |                   =====================                   |     
     |                           x T B                           |     
     |                   =====================                   |     
     |                         S. Grimme                         |     
     |          Mulliken Center for Theoretical Chemistry        |     
     |                    University of Bonn                     |     
     |                Version 6.2 RC2 (SAW190805)                |     
      -----------------------------------------------------------      

   This program is distributed in the hope that it will be useful,
   but WITHOUT ANY WARRANTY; without even the implied warranty of
   MERCHANTABILITY or FITNESS FOR A PARTICULAR PURPOSE.
   
   FOR NON-COMMERCIAL, ACADEMIA USE ONLY.
   
   Cite this work as:
   * S. Grimme, C. Bannwarth, P. Shushkov, J. Chem. Theory Comput., 2017,
     13, 1989-2009. DOI: 10.1021/acs.jctc.7b00118
   * C. Bannwarth, S. Ehlert and S. Grimme., J. Chem. Theory Comput., 2019,
     15, 1652-1671. DOI: 10.1021/acs.jctc.8b01176
   * P. Pracht, E. Caldeweyher, S. Ehlert, S. Grimme, ChemRxiv, 2019, preprint.
     DOI: 10.26434/chemrxiv.8326202.v1
   
   for DFT-D4:
   * E. Caldeweyher, C. Bannwarth and S. Grimme, J. Chem. Phys., 2017,
     147, 034112. DOI: 10.1063/1.4993215
   * E. Caldeweyher, S. Ehlert, A. Hansen, H. Neugebauer, S. Spicher,
     C. Bannwarth and S. Grimme, J. Chem. Phys., 2019, 150, 154122.
     DOI: 10.1063/1.5090222
   
   for sTDA-xTB:
   * S. Grimme and C. Bannwarth, J. Chem. Phys., 2016, 145, 054103.
     DOI: 10.1063/1.4959605
   
   in the mass-spec context:
   * V. Asgeirsson, C. Bauer and S. Grimme, Chem. Sci., 2017, 8, 4879.
     DOI: 10.1039/c7sc00601b
   
   for metadynamics refer to:
   * S. Grimme, J. Chem. Theory Comput., 2019, 155, 2847-2862
     DOI: 10.1021/acs.jctc.9b00143
   
   with help from (in alphabetical order)
   C. Bannwarth, F. Bohle, G. Brandenburg, E. Caldeweyher, M. Checinski,
   S. Dohm, S. Ehlert, S. Ehrlich, F. März, H. Neugebauer, J. Pisarek,
   P. Pracht, P. Shushkov, and S. Spicher.
   
 * started run on 2021/05/19 at 10:59:02.124     

           -------------------------------------------------
          |                Calculation Setup                |
           -------------------------------------------------

          program call               : /ihome/ghutchison/geoffh/xtb/xtb 317.xyz -opt
          hostname                   : smp-n122
          coordinate file            : 317.xyz
          omp threads                :                     1
          number of atoms            :                    25
          number of electrons        :                    70
          charge                     :                     0
          spin                       :                   0.0
          first test random number   :      0.35024153197674


########################################################################
# WARNING! Please study the warnings concerning your input carefully
#  - the use of '-opt' is discouraged, please use '--opt' next time
########################################################################

           ------------------------------------------------- 
          |                 G F N 2 - x T B                 |
          | Geometry, Frequencies, Noncovalent interactions |
          |            JCTC 2019 parametrisation            |
           ------------------------------------------------- 
             KAB for C  - Si     :                1.0500
             KAB for H  - Pd     :                0.9500
             k(s)              :                1.8500
             k(p)              :                2.2300
             k(d)              :                2.2300
             k(f)              :                2.0000
             kEN (H0ij)        :               -2.0000
             D4 a1             :                0.5200
             D4 a2             :                5.0000
             D4 s6             :                1.0000
             D4 s8             :                2.7000
             D4 s9             :                5.0000
             alphaj            :                2.0000

  Z AO/shell   Hii/eV     exponent
  1     Wed Apr 25 08:07:45 CEST 2018   EN: 2.200 GM2: 0.406  GM3: 0.0800  RAES: 1.40
     1s    -10.707211    1.230000
  6     Wed Apr 25 08:07:45 CEST 2018   EN: 2.550 GM2: 0.538  GM3: 0.1500  RAES: 3.00
     2s    -13.970922    2.096432
     2p    -10.063292    1.800000
  8     Wed Apr 25 08:07:45 CEST 2018   EN: 3.440 GM2: 0.452  GM3:-0.0517  RAES: 1.80
     2s    -20.229985    2.439742
     2p    -15.503117    2.137023
 16     Tue Apr 24 11:44:34 CEST 2018   EN: 2.580 GM2: 0.340  GM3:-0.0502  RAES: 3.10
     3s    -20.029654    1.981333
     3p    -11.377694    2.025643
     3d     -0.420282    1.702555

           ------------------------------------------------- 
          |        Self-Consistent Charge Iterations        |
           ------------------------------------------------- 

          ...................................................
          :                      SETUP                      :
          :.................................................:
          :  # basis functions                  76          :
          :  # atomic orbitals                  74          :
          :  # shells                           40          :
          :  # electrons                        70          :
          :  max. iterations                   250          :
          :  Hamiltonian                  GFN2-xTB          :
          :  restarted?                      false          :
          :  GBSA solvation                  false          :
          :  PC potential                    false          :
          :  electronic temp.          300.0000000     K    :
          :  accuracy                    1.0000000          :
          :  -> integral cutoff          0.2500000E+02      :
          :  -> integral neglect         0.1000000E-07      :
          :  -> SCF convergence          0.1000000E-05 Eh   :
          :  -> wf. convergence          0.1000000E-03 e    :
          :  Broyden damping             0.4000000          :
          ...................................................

 iter      E             dE          RMSdq      gap      omega  full diag
   1    -38.4857657 -0.384858E+02  0.441E+00    3.03       0.0  T
   2    -38.5202544 -0.344887E-01  0.252E+00    2.95       1.0  T
   3    -38.5159259  0.432855E-02  0.907E-01    2.68       1.0  T
   4    -38.5227751 -0.684920E-02  0.409E-01    2.61       1.0  T
   5    -38.5241501 -0.137502E-02  0.189E-01    2.65       1.0  T
   6    -38.5245170 -0.366911E-03  0.638E-02    2.66       1.0  T
   7    -38.5245562 -0.391885E-04  0.234E-02    2.67       1.0  T
   8    -38.5245612 -0.494213E-05  0.140E-02    2.67       1.4  T
   9    -38.5245628 -0.169501E-05  0.498E-03    2.67       4.0  T
  10    -38.5245629 -0.653227E-07  0.229E-03    2.67       8.7  T
  11    -38.5245630 -0.428810E-07  0.898E-04    2.67      22.3  T
  12    -38.5245630 -0.387180E-08  0.546E-04    2.67      36.6  T

   *** convergence criteria satisfied after 12 iterations ***

         #    Occupation            Energy/Eh            Energy/eV
      -------------------------------------------------------------
         1        2.0000           -0.7425372             -20.2055
       ...           ...                  ...                  ...
        29        2.0000           -0.4454340             -12.1209
        30        2.0000           -0.4408938             -11.9973
        31        2.0000           -0.4352198             -11.8429
        32        2.0000           -0.4134387             -11.2502
        33        2.0000           -0.4028046             -10.9609
        34        2.0000           -0.3878218             -10.5532
        35        2.0000           -0.3725630             -10.1380 (HOMO)
        36                         -0.2745035              -7.4696 (LUMO)
        37                         -0.2280529              -6.2056
        38                         -0.2098123              -5.7093
        39                         -0.1968766              -5.3573
        40                         -0.1713824              -4.6636
       ...                                ...                  ...
        74                          0.6510414              17.7157
      -------------------------------------------------------------
                  HL-Gap            0.0980595 Eh            2.6683 eV
             Fermi-level           -0.3235333 Eh           -8.8038 eV

 SCC (total)                   0 d,  0 h,  0 min,  0.044 sec
 SCC setup                      ...        0 min,  0.000 sec (  0.710%)
 Dispersion                     ...        0 min,  0.000 sec (  0.770%)
 integral evaluation            ...        0 min,  0.011 sec ( 24.859%)
 zeroth order Hamiltonian       ...        0 min,  0.000 sec (  0.458%)
 iterations                     ...        0 min,  0.016 sec ( 35.557%)
 molecular gradient             ...        0 min,  0.016 sec ( 36.720%)
 printout                       ...        0 min,  0.000 sec (  0.811%)

         :::::::::::::::::::::::::::::::::::::::::::::::::::::
         ::                     SUMMARY                     ::
         :::::::::::::::::::::::::::::::::::::::::::::::::::::
         :: total energy             -38.058610802015 Eh    ::
         :: gradient norm              0.054284153079 Eh/a0 ::
         :: HOMO-LUMO gap              2.668335128564 eV    ::
         ::.................................................::
         :: SCC energy               -38.524562959401 Eh    ::
         :: -> isotropic ES            0.030894719671 Eh    ::
         :: -> anisotropic ES          0.002774973201 Eh    ::
         :: -> anisotropic XC          0.016529962356 Eh    ::
         :: -> dispersion             -0.028220720308 Eh    ::
         :: repulsion energy           0.465664112371 Eh    ::
         :: add. restraining           0.000000000000 Eh    ::
         :::::::::::::::::::::::::::::::::::::::::::::::::::::

      ----------------------------------------------------------- 
     |                   =====================                   |
     |                        A N C O P T                        |
     |                   =====================                   |
     |               Approximate Normal Coordinate               |
     |                Rational Function Optimizer                |
      ----------------------------------------------------------- 

          ...................................................
          :                      SETUP                      :
          :.................................................:
          :   optimization level            normal          :
          :   max. optcycles                   200          :
          :   ANC micro-cycles                  20          :
          :   degrees of freedom                69          :
          :.................................................:
          :   RF solver                   davidson          :
          :   input Hessian                  false          :
          :   write xtbopt.log                true          :
          :   linear?                        false          :
          :   energy convergence         0.5000000E-05 Eh   :
          :   grad. convergence          0.1000000E-02 Eh/α :
          :   maximium RF displ.         2.0000000          :
          :   Hlow (freq-cutoff)         0.5000000E-02      :
          :   Hmax (freq-cutoff)         5.0000000          :
          :   S6 in model hess.         20.0000000          :
          ...................................................

generating ANC from model Hessian ...
Using Lindh-Hessian (1995)
 Shifting diagonal of input Hessian by   3.646448674971963E-003
 Lowest  eigenvalues of input Hessian
   -0.000000    0.000000    0.000000    0.000000    0.000000    0.000000
    0.005000    0.006607    0.007520    0.007977    0.009260    0.010081
    0.012538    0.013957    0.017047    0.021476    0.023628    0.027329
 Highest eigenvalues
    1.410103    1.519343    1.608150    1.764003    1.816359    1.977586
 

........................................................................
.............................. CYCLE    1 ..............................
........................................................................
   1    -38.5245630 -0.385246E+02  0.268E-04    2.67       0.0  T
   2    -38.5245630 -0.129127E-09  0.203E-04    2.67      98.6  T
   3    -38.5245630 -0.424535E-09  0.130E-04    2.67     153.5  T
     SCC iter.                  ...        0 min,  0.004 sec
     gradient                   ...        0 min,  0.016 sec
 * total energy  :   -38.0586108 Eh     change        0.1495941E-07 Eh
   gradient norm :     0.0542857 Eh/α   predicted     0.0000000E+00 (-100.00%)
   displ. norm   :     0.2803306 α      lambda       -0.6924686E-02
   maximum displ.:     0.0868470 α      in ANC's #15, #29, #6, ...

........................................................................
.............................. CYCLE    2 ..............................
........................................................................
   1    -38.5474574 -0.385475E+02  0.286E-01    2.71       0.0  T
   2    -38.5475070 -0.495670E-04  0.150E-01    2.71       1.0  T
   3    -38.5473943  0.112663E-03  0.878E-02    2.70       1.0  T
   4    -38.5475682 -0.173827E-03  0.240E-02    2.71       1.0  T
   5    -38.5475690 -0.779474E-06  0.120E-02    2.71       1.7  T
   6    -38.5475706 -0.167943E-05  0.393E-03    2.71       5.1  T
   7    -38.5475708 -0.189767E-06  0.161E-03    2.71      12.4  T
     SCC iter.                  ...        0 min,  0.009 sec
     gradient                   ...        0 min,  0.017 sec
 * total energy  :   -38.0629977 Eh     change       -0.4386871E-02 Eh
   gradient norm :     0.0198284 Eh/α   predicted    -0.3734438E-02 ( -14.87%)
   displ. norm   :     0.1934239 α      lambda       -0.1304882E-02
   maximum displ.:     0.0841368 α      in ANC's #6, #5, #2, ...

........................................................................
.............................. CYCLE    3 ..............................
........................................................................
   1    -38.5562503 -0.385563E+02  0.169E-01    2.72       0.0  T
   2    -38.5562719 -0.215924E-04  0.892E-02    2.72       1.0  T
   3    -38.5562372  0.347501E-04  0.508E-02    2.71       1.0  T
   4    -38.5562952 -0.580102E-04  0.146E-02    2.71       1.4  T
   5    -38.5562958 -0.576027E-06  0.702E-03    2.71       2.8  T
   6    -38.5562962 -0.475618E-06  0.248E-03    2.71       8.1  T
   7    -38.5562963 -0.967465E-07  0.821E-04    2.71      24.4  T
     SCC iter.                  ...        0 min,  0.009 sec
     gradient                   ...        0 min,  0.015 sec
 * total energy  :   -38.0637159 Eh     change       -0.7182811E-03 Eh
   gradient norm :     0.0059028 Eh/α   predicted    -0.6768569E-03 (  -5.77%)
   displ. norm   :     0.1196465 α      lambda       -0.1956026E-03
   maximum displ.:     0.0694150 α      in ANC's #2, #6, #4, ...

........................................................................
.............................. CYCLE    4 ..............................
........................................................................
   1    -38.5557425 -0.385557E+02  0.834E-02    2.71       0.0  T
   2    -38.5557449 -0.246819E-05  0.439E-02    2.71       1.0  T
   3    -38.5557417  0.327362E-05  0.162E-02    2.71       1.2  T
   4    -38.5557458 -0.416036E-05  0.646E-03    2.71       3.1  T
   5    -38.5557460 -0.193197E-06  0.194E-03    2.71      10.3  T
   6    -38.5557460 -0.386065E-07  0.475E-04    2.71      42.1  T
     SCC iter.                  ...        0 min,  0.008 sec
     gradient                   ...        0 min,  0.015 sec
 * total energy  :   -38.0638553 Eh     change       -0.1393471E-03 Eh
   gradient norm :     0.0035560 Eh/α   predicted    -0.9920733E-04 ( -28.81%)
   displ. norm   :     0.1274111 α      lambda       -0.1135992E-03
   maximum displ.:     0.0878455 α      in ANC's #2, #6, #4, ...

........................................................................
.............................. CYCLE    5 ..............................
........................................................................
   1    -38.5542829 -0.385543E+02  0.946E-02    2.70       0.0  T
   2    -38.5542858 -0.286226E-05  0.492E-02    2.70       1.0  T
   3    -38.5542853  0.442033E-06  0.118E-02    2.70       1.7  T
   4    -38.5542861 -0.726753E-06  0.710E-03    2.70       2.8  T
   5    -38.5542865 -0.475890E-06  0.132E-03    2.70      15.2  T
   6    -38.5542866 -0.246626E-07  0.474E-04    2.70      42.2  T
   7    -38.5542866 -0.112496E-08  0.285E-04    2.70      70.1  T
     SCC iter.                  ...        0 min,  0.009 sec
     gradient                   ...        0 min,  0.016 sec
 * total energy  :   -38.0639300 Eh     change       -0.7466943E-04 Eh
   gradient norm :     0.0018244 Eh/α   predicted    -0.5772215E-04 ( -22.70%)
   displ. norm   :     0.1122796 α      lambda       -0.3622692E-04
   maximum displ.:     0.0880237 α      in ANC's #2, #4, #6, ...

........................................................................
.............................. CYCLE    6 ..............................
........................................................................
   1    -38.5539247 -0.385539E+02  0.852E-02    2.70       0.0  T
   2    -38.5539269 -0.224486E-05  0.443E-02    2.70       1.0  T
   3    -38.5539264  0.542139E-06  0.107E-02    2.70       1.9  T
   4    -38.5539272 -0.820099E-06  0.623E-03    2.69       3.2  T
   5    -38.5539276 -0.389045E-06  0.103E-03    2.70      19.4  T
   6    -38.5539276 -0.150978E-07  0.447E-04    2.70      44.7  T
   7    -38.5539276 -0.140029E-08  0.226E-04    2.70      88.4  T
     SCC iter.                  ...        0 min,  0.009 sec
     gradient                   ...        0 min,  0.016 sec
 * total energy  :   -38.0639674 Eh     change       -0.3746342E-04 Eh
   gradient norm :     0.0021897 Eh/α   predicted    -0.1821576E-04 ( -51.38%)
   displ. norm   :     0.0615502 α      lambda       -0.2912882E-04
   maximum displ.:     0.0464562 α      in ANC's #2, #4, #5, ...

........................................................................
.............................. CYCLE    7 ..............................
........................................................................
   1    -38.5543477 -0.385543E+02  0.463E-02    2.69       0.0  T
   2    -38.5543483 -0.611426E-06  0.247E-02    2.69       1.0  T
   3    -38.5543482  0.577602E-07  0.549E-03    2.69       3.6  T
   4    -38.5543483 -0.774075E-07  0.359E-03    2.69       5.6  T
   5    -38.5543485 -0.158147E-06  0.525E-04    2.69      38.1  T
   6    -38.5543485 -0.207221E-08  0.269E-04    2.69      74.2  T
     SCC iter.                  ...        0 min,  0.008 sec
     gradient                   ...        0 min,  0.016 sec
 * total energy  :   -38.0639913 Eh     change       -0.2386153E-04 Eh
   gradient norm :     0.0017806 Eh/α   predicted    -0.1462198E-04 ( -38.72%)
   displ. norm   :     0.1822120 α      lambda       -0.4877126E-04
   maximum displ.:     0.1319217 α      in ANC's #2, #4, #5, ...

........................................................................
.............................. CYCLE    8 ..............................
........................................................................
   1    -38.5551108 -0.385551E+02  0.126E-01    2.69       0.0  T
   2    -38.5551151 -0.439343E-05  0.686E-02    2.69       1.0  T
   3    -38.5551155 -0.313540E-06  0.140E-02    2.69       1.4  T
   4    -38.5551151  0.343656E-06  0.962E-03    2.69       2.1  T
   5    -38.5551164 -0.127741E-05  0.159E-03    2.69      12.6  T
   6    -38.5551164 -0.208850E-07  0.748E-04    2.69      26.7  T
   7    -38.5551164 -0.267524E-08  0.390E-04    2.69      51.2  T
     SCC iter.                  ...        0 min,  0.009 sec
     gradient                   ...        0 min,  0.016 sec
 * total energy  :   -38.0640294 Eh     change       -0.3815130E-04 Eh
   gradient norm :     0.0021504 Eh/α   predicted    -0.2474772E-04 ( -35.13%)
   displ. norm   :     0.0679636 α      lambda       -0.2311334E-04
   maximum displ.:     0.0504287 α      in ANC's #2, #4, #5, ...

........................................................................
.............................. CYCLE    9 ..............................
........................................................................
   1    -38.5549352 -0.385549E+02  0.523E-02    2.69       0.0  T
   2    -38.5549360 -0.797475E-06  0.284E-02    2.69       1.0  T
   3    -38.5549359  0.137348E-06  0.699E-03    2.69       2.9  T
   4    -38.5549361 -0.219740E-06  0.428E-03    2.69       4.7  T
   5    -38.5549363 -0.173220E-06  0.862E-04    2.69      23.2  T
   6    -38.5549363 -0.108314E-07  0.316E-04    2.69      63.3  T
     SCC iter.                  ...        0 min,  0.008 sec
     gradient                   ...        0 min,  0.016 sec
 * total energy  :   -38.0640454 Eh     change       -0.1600685E-04 Eh
   gradient norm :     0.0017252 Eh/α   predicted    -0.1162109E-04 ( -27.40%)
   displ. norm   :     0.1129052 α      lambda       -0.1888353E-04
   maximum displ.:     0.0865086 α      in ANC's #2, #4, #5, ...

........................................................................
.............................. CYCLE   10 ..............................
........................................................................
   1    -38.5545641 -0.385546E+02  0.950E-02    2.69       0.0  T
   2    -38.5545670 -0.286311E-05  0.518E-02    2.69       1.0  T
   3    -38.5545651  0.194523E-05  0.161E-02    2.69       1.2  T
   4    -38.5545678 -0.269880E-05  0.810E-03    2.69       2.5  T
   5    -38.5545682 -0.394098E-06  0.167E-03    2.69      12.0  T
   6    -38.5545682 -0.337027E-07  0.637E-04    2.69      31.4  T
   7    -38.5545682 -0.107367E-08  0.369E-04    2.69      54.1  T
     SCC iter.                  ...        0 min,  0.009 sec
     gradient                   ...        0 min,  0.016 sec
 * total energy  :   -38.0640618 Eh     change       -0.1639297E-04 Eh
   gradient norm :     0.0013430 Eh/α   predicted    -0.9498151E-05 ( -42.06%)
   displ. norm   :     0.0626723 α      lambda       -0.8788062E-05
   maximum displ.:     0.0447700 α      in ANC's #2, #3, #10, ...

........................................................................
.............................. CYCLE   11 ..............................
........................................................................
   1    -38.5546073 -0.385546E+02  0.596E-02    2.69       0.0  T
   2    -38.5546085 -0.115180E-05  0.331E-02    2.69       1.0  T
   3    -38.5546079  0.603158E-06  0.988E-03    2.70       2.0  T
   4    -38.5546088 -0.911801E-06  0.511E-03    2.69       3.9  T
   5    -38.5546090 -0.156712E-06  0.111E-03    2.69      17.9  T
   6    -38.5546090 -0.137001E-07  0.426E-04    2.69      47.0  T
   7    -38.5546090 -0.106265E-08  0.240E-04    2.69      83.4  T
     SCC iter.                  ...        0 min,  0.009 sec
     gradient                   ...        0 min,  0.016 sec
 * total energy  :   -38.0640718 Eh     change       -0.9982924E-05 Eh
   gradient norm :     0.0014215 Eh/α   predicted    -0.4402058E-05 ( -55.90%)
   displ. norm   :     0.1623671 α      lambda       -0.2086209E-04
   maximum displ.:     0.1094653 α      in ANC's #2, #3, #10, ...

........................................................................
.............................. CYCLE   12 ..............................
........................................................................
   1    -38.5539410 -0.385539E+02  0.169E-01    2.70       0.0  T
   2    -38.5539497 -0.867186E-05  0.957E-02    2.70       1.0  T
   3    -38.5539396  0.101307E-04  0.330E-02    2.70       1.0  T
   4    -38.5539532 -0.136522E-04  0.138E-02    2.70       1.4  T
   5    -38.5539539 -0.731217E-06  0.350E-03    2.70       5.7  T
   6    -38.5539541 -0.155808E-06  0.132E-03    2.70      15.1  T
   7    -38.5539541 -0.168494E-07  0.671E-04    2.70      29.8  T
   8    -38.5539541 -0.150377E-08  0.274E-04    2.70      73.0  T
     SCC iter.                  ...        0 min,  0.010 sec
     gradient                   ...        0 min,  0.016 sec
 * total energy  :   -38.0640923 Eh     change       -0.2049465E-04 Eh
   gradient norm :     0.0041335 Eh/α   predicted    -0.1055426E-04 ( -48.50%)
   displ. norm   :     0.1074679 α      lambda       -0.3031216E-04
   maximum displ.:     0.0523834 α      in ANC's #2, #1, #3, ...

........................................................................
.............................. CYCLE   13 ..............................
........................................................................
   1    -38.5540806 -0.385541E+02  0.120E-01    2.71       0.0  T
   2    -38.5540848 -0.422967E-05  0.694E-02    2.71       1.0  T
   3    -38.5540773  0.747230E-05  0.257E-02    2.71       1.0  T
   4    -38.5540869 -0.953598E-05  0.935E-03    2.71       2.1  T
   5    -38.5540872 -0.280938E-06  0.269E-03    2.71       7.4  T
   6    -38.5540872 -0.917161E-07  0.978E-04    2.71      20.4  T
     SCC iter.                  ...        0 min,  0.008 sec
     gradient                   ...        0 min,  0.015 sec
 * total energy  :   -38.0641162 Eh     change       -0.2390281E-04 Eh
   gradient norm :     0.0060850 Eh/α   predicted    -0.1533189E-04 ( -35.86%)
   displ. norm   :     0.2107448 α      lambda       -0.9105750E-04
   maximum displ.:     0.1055865 α      in ANC's #1, #3, #10, ...

........................................................................
.............................. CYCLE   14 ..............................
........................................................................
   1    -38.5541616 -0.385542E+02  0.227E-01    2.73       0.0  T
   2    -38.5541756 -0.139433E-04  0.134E-01    2.73       1.0  T
   3    -38.5541368  0.388004E-04  0.537E-02    2.73       1.0  T
   4    -38.5541842 -0.473771E-04  0.157E-02    2.73       1.3  T
   5    -38.5541847 -0.526336E-06  0.547E-03    2.73       3.7  T
   6    -38.5541850 -0.358519E-06  0.195E-03    2.73      10.2  T
   7    -38.5541851 -0.432587E-07  0.941E-04    2.73      21.2  T
     SCC iter.                  ...        0 min,  0.009 sec
     gradient                   ...        0 min,  0.015 sec
 * total energy  :   -38.0641721 Eh     change       -0.5589337E-04 Eh
   gradient norm :     0.0107063 Eh/α   predicted    -0.4755412E-04 ( -14.92%)
   displ. norm   :     0.1827656 α      lambda       -0.1672302E-03
   maximum displ.:     0.1009984 α      in ANC's #1, #4, #2, ...

........................................................................
.............................. CYCLE   15 ..............................
........................................................................
   1    -38.5566577 -0.385567E+02  0.129E-01    2.75       0.0  T
   2    -38.5566623 -0.466431E-05  0.738E-02    2.74       1.0  T
   3    -38.5566515  0.108150E-04  0.275E-02    2.75       1.0  T
   4    -38.5566644 -0.129364E-04  0.961E-03    2.74       2.1  T
   5    -38.5566649 -0.439612E-06  0.317E-03    2.74       6.3  T
   6    -38.5566650 -0.108870E-06  0.122E-03    2.74      16.5  T
   7    -38.5566650 -0.867744E-08  0.693E-04    2.74      28.9  T
     SCC iter.                  ...        0 min,  0.009 sec
     gradient                   ...        0 min,  0.015 sec
 * total energy  :   -38.0642708 Eh     change       -0.9867905E-04 Eh
   gradient norm :     0.0068561 Eh/α   predicted    -0.8640859E-04 ( -12.43%)
   displ. norm   :     0.3377285 α      lambda       -0.2750210E-03
   maximum displ.:     0.1953726 α      in ANC's #1, #10, #3, ...

........................................................................
.............................. CYCLE   16 ..............................
........................................................................
   1    -38.5529629 -0.385530E+02  0.344E-01    2.78       0.0  T
   2    -38.5529956 -0.327075E-04  0.208E-01    2.77       1.0  T
   3    -38.5528623  0.133282E-03  0.930E-02    2.78       1.0  T
   4    -38.5530195 -0.157201E-03  0.185E-02    2.77       1.1  T
   5    -38.5530202 -0.638634E-06  0.820E-03    2.77       2.4  T
   6    -38.5530208 -0.620024E-06  0.338E-03    2.77       5.9  T
   7    -38.5530209 -0.110343E-06  0.154E-03    2.77      13.0  T
   8    -38.5530209 -0.818660E-08  0.723E-04    2.77      27.6  T
     SCC iter.                  ...        0 min,  0.010 sec
     gradient                   ...        0 min,  0.015 sec
 * total energy  :   -38.0643051 Eh     change       -0.3430953E-04 Eh
   gradient norm :     0.0211347 Eh/α   predicted    -0.1531954E-03 ( 346.51%)
   displ. norm   :     0.1631673 α      lambda       -0.5953775E-03
   maximum displ.:     0.0724912 α      in ANC's #1, #6, #2, ...

........................................................................
.............................. CYCLE   17 ..............................
........................................................................
   1    -38.5540493 -0.385540E+02  0.178E-01    2.76       0.0  T
   2    -38.5540701 -0.207224E-04  0.956E-02    2.76       1.0  T
   3    -38.5540667  0.339449E-05  0.301E-02    2.76       1.0  T
   4    -38.5540745 -0.782813E-05  0.162E-02    2.76       1.2  T
   5    -38.5540762 -0.171053E-05  0.433E-03    2.76       4.6  T
   6    -38.5540763 -0.105143E-06  0.211E-03    2.76       9.5  T
     SCC iter.                  ...        0 min,  0.007 sec
     gradient                   ...        0 min,  0.015 sec
 * total energy  :   -38.0645264 Eh     change       -0.2213345E-03 Eh
   gradient norm :     0.0068450 Eh/α   predicted    -0.3056157E-03 (  38.08%)
   displ. norm   :     0.1232254 α      lambda       -0.2005154E-03
   maximum displ.:     0.0601277 α      in ANC's #2, #4, #8, ...

........................................................................
.............................. CYCLE   18 ..............................
........................................................................
   1    -38.5545409 -0.385545E+02  0.117E-01    2.77       0.0  T
   2    -38.5545444 -0.355087E-05  0.690E-02    2.77       1.0  T
   3    -38.5545326  0.118397E-04  0.283E-02    2.77       1.0  T
   4    -38.5545467 -0.141411E-04  0.737E-03    2.77       2.7  T
   5    -38.5545468 -0.967660E-07  0.325E-03    2.77       6.2  T
   6    -38.5545469 -0.111292E-06  0.109E-03    2.77      18.4  T
   7    -38.5545469 -0.162064E-07  0.472E-04    2.77      42.4  T
     SCC iter.                  ...        0 min,  0.009 sec
     gradient                   ...        0 min,  0.016 sec
 * total energy  :   -38.0646927 Eh     change       -0.1662219E-03 Eh
   gradient norm :     0.0054990 Eh/α   predicted    -0.1017822E-03 ( -38.77%)
   displ. norm   :     0.3527920 α      lambda       -0.4980686E-03
   maximum displ.:     0.1531744 α      in ANC's #8, #2, #10, ...

........................................................................
.............................. CYCLE   19 ..............................
........................................................................
   1    -38.5504079 -0.385504E+02  0.420E-01    2.81       0.0  T
   2    -38.5504707 -0.627283E-04  0.245E-01    2.80       1.0  T
   3    -38.5502980  0.172708E-03  0.111E-01    2.82       1.0  T
   4    -38.5505076 -0.209593E-03  0.294E-02    2.81       1.0  T
   5    -38.5505092 -0.166179E-05  0.119E-02    2.81       1.7  T
   6    -38.5505106 -0.136200E-05  0.435E-03    2.81       4.6  T
   7    -38.5505108 -0.272388E-06  0.171E-03    2.81      11.7  T
   8    -38.5505109 -0.108574E-07  0.875E-04    2.81      22.9  T
     SCC iter.                  ...        0 min,  0.010 sec
     gradient                   ...        0 min,  0.015 sec
 * total energy  :   -38.0645046 Eh     change        0.1880156E-03 Eh
   gradient norm :     0.0325977 Eh/α   predicted    -0.2800307E-03 (-248.94%)
   displ. norm   :     0.2049444 α      lambda       -0.1228107E-02
   maximum displ.:     0.0928458 α      in ANC's #1, #8, #10, ...

........................................................................
.............................. CYCLE   20 ..............................
........................................................................
   1    -38.5556982 -0.385557E+02  0.228E-01    2.79       0.0  T
   2    -38.5557320 -0.338291E-04  0.138E-01    2.79       1.0  T
   3    -38.5556685  0.635170E-04  0.688E-02    2.78       1.0  T
   4    -38.5557473 -0.788153E-04  0.151E-02    2.79       1.3  T
   5    -38.5557483 -0.102811E-05  0.640E-03    2.79       3.1  T
   6    -38.5557486 -0.325335E-06  0.316E-03    2.79       6.3  T
   7    -38.5557487 -0.747426E-07  0.142E-03    2.79      14.1  T
     SCC iter.                  ...        0 min,  0.009 sec
     gradient                   ...        0 min,  0.015 sec
 * total energy  :   -38.0649467 Eh     change       -0.4420879E-03 Eh
   gradient norm :     0.0053331 Eh/α   predicted    -0.6398481E-03 (  44.73%)
   displ. norm   :     0.0837467 α      lambda       -0.1262037E-03
   maximum displ.:     0.0582147 α      in ANC's #2, #8, #7, ...
 * RMSD in coord.:     0.2530140 α      energy gain  -0.6335921E-02 Eh

generating ANC from model Hessian ...
Using Lindh-Hessian (1995)
 Shifting diagonal of input Hessian by   3.736441955534876E-003
 Lowest  eigenvalues of input Hessian
   -0.000000   -0.000000    0.000000    0.000000    0.000000    0.000000
    0.005000    0.006838    0.007587    0.008282    0.008804    0.010675
    0.013129    0.014331    0.017844    0.020723    0.024739    0.027016
 Highest eigenvalues
    1.444769    1.539783    1.686842    1.828329    1.884170    2.017373
 

........................................................................
.............................. CYCLE   21 ..............................
........................................................................
   1    -38.5555416 -0.385555E+02  0.113E-01    2.80       0.0  T
   2    -38.5555462 -0.454773E-05  0.584E-02    2.79       1.0  T
   3    -38.5555429  0.324830E-05  0.189E-02    2.80       1.1  T
   4    -38.5555477 -0.480968E-05  0.853E-03    2.79       2.3  T
   5    -38.5555480 -0.218311E-06  0.233E-03    2.79       8.6  T
   6    -38.5555480 -0.754740E-07  0.695E-04    2.79      28.8  T
   7    -38.5555480 -0.564805E-08  0.328E-04    2.79      60.9  T
     SCC iter.                  ...        0 min,  0.009 sec
     gradient                   ...        0 min,  0.016 sec
 * total energy  :   -38.0650655 Eh     change       -0.1187884E-03 Eh
   gradient norm :     0.0060945 Eh/α   predicted     0.0000000E+00 (-100.00%)
   displ. norm   :     0.1022187 α      lambda       -0.2162238E-03
   maximum displ.:     0.0432096 α      in ANC's #1, #4, #10, ...

........................................................................
.............................. CYCLE   22 ..............................
........................................................................
   1    -38.5557208 -0.385557E+02  0.994E-02    2.80       0.0  T
   2    -38.5557231 -0.230550E-05  0.576E-02    2.80       1.0  T
   3    -38.5557206  0.249028E-05  0.161E-02    2.80       1.2  T
   4    -38.5557239 -0.323305E-05  0.724E-03    2.80       2.8  T
   5    -38.5557242 -0.331296E-06  0.221E-03    2.80       9.0  T
   6    -38.5557242 -0.495523E-07  0.751E-04    2.80      26.6  T
     SCC iter.                  ...        0 min,  0.008 sec
     gradient                   ...        0 min,  0.016 sec
 * total energy  :   -38.0652551 Eh     change       -0.1895543E-03 Eh
   gradient norm :     0.0037352 Eh/α   predicted    -0.1092441E-03 ( -42.37%)
   displ. norm   :     0.3357758 α      lambda       -0.6309342E-03
   maximum displ.:     0.1221904 α      in ANC's #9, #10, #7, ...

........................................................................
.............................. CYCLE   23 ..............................
........................................................................
   1    -38.5533873 -0.385534E+02  0.349E-01    2.83       0.0  T
   2    -38.5534210 -0.337554E-04  0.206E-01    2.82       1.0  T
   3    -38.5533661  0.549385E-04  0.661E-02    2.83       1.0  T
   4    -38.5534351 -0.690437E-04  0.231E-02    2.83       1.0  T
   5    -38.5534378 -0.261252E-05  0.866E-03    2.82       2.3  T
   6    -38.5534384 -0.684906E-06  0.282E-03    2.83       7.1  T
   7    -38.5534385 -0.738829E-07  0.143E-03    2.83      14.0  T
   8    -38.5534385 -0.813809E-08  0.684E-04    2.83      29.3  T
   9    -38.5534385 -0.473781E-08  0.222E-04    2.83      90.3  T
     SCC iter.                  ...        0 min,  0.011 sec
     gradient                   ...        0 min,  0.016 sec
 * total energy  :   -38.0655960 Eh     change       -0.3409391E-03 Eh
   gradient norm :     0.0168936 Eh/α   predicted    -0.3510563E-03 (   2.97%)
   displ. norm   :     0.0481482 α      lambda       -0.2537027E-03
   maximum displ.:     0.0187786 α      in ANC's #5, #2, #4, ...

........................................................................
.............................. CYCLE   24 ..............................
........................................................................
   1    -38.5553851 -0.385554E+02  0.385E-02    2.82       0.0  T
   2    -38.5553878 -0.266488E-05  0.211E-02    2.82       1.0  T
   3    -38.5553871  0.729524E-06  0.111E-02    2.82       1.8  T
   4    -38.5553885 -0.146267E-05  0.441E-03    2.82       4.5  T
   5    -38.5553886 -0.957977E-07  0.145E-03    2.82      13.8  T
   6    -38.5553886 -0.588678E-08  0.789E-04    2.82      25.4  T
     SCC iter.                  ...        0 min,  0.008 sec
     gradient                   ...        0 min,  0.015 sec
 * total energy  :   -38.0657630 Eh     change       -0.1670376E-03 Eh
   gradient norm :     0.0064609 Eh/α   predicted    -0.1271582E-03 ( -23.87%)
   displ. norm   :     0.2208597 α      lambda       -0.3016573E-03
   maximum displ.:     0.0935788 α      in ANC's #3, #2, #6, ...

........................................................................
.............................. CYCLE   25 ..............................
........................................................................
   1    -38.5558774 -0.385559E+02  0.188E-01    2.84       0.0  T
   2    -38.5558859 -0.855434E-05  0.109E-01    2.84       1.0  T
   3    -38.5558792  0.669414E-05  0.270E-02    2.84       1.0  T
   4    -38.5558882 -0.898763E-05  0.135E-02    2.84       1.5  T
   5    -38.5558895 -0.125284E-05  0.503E-03    2.84       4.0  T
   6    -38.5558898 -0.309471E-06  0.129E-03    2.84      15.5  T
   7    -38.5558898 -0.854430E-08  0.757E-04    2.84      26.4  T
     SCC iter.                  ...        0 min,  0.009 sec
     gradient                   ...        0 min,  0.015 sec
 * total energy  :   -38.0659717 Eh     change       -0.2086409E-03 Eh
   gradient norm :     0.0067004 Eh/α   predicted    -0.1581886E-03 ( -24.18%)
   displ. norm   :     0.1724471 α      lambda       -0.1625357E-03
   maximum displ.:     0.0794768 α      in ANC's #3, #2, #6, ...

........................................................................
.............................. CYCLE   26 ..............................
........................................................................
   1    -38.5559191 -0.385559E+02  0.130E-01    2.85       0.0  T
   2    -38.5559224 -0.330996E-05  0.773E-02    2.85       1.0  T
   3    -38.5559164  0.603554E-05  0.207E-02    2.85       1.0  T
   4    -38.5559239 -0.754914E-05  0.719E-03    2.85       2.8  T
   5    -38.5559242 -0.277630E-06  0.314E-03    2.85       6.4  T
   6    -38.5559243 -0.913557E-07  0.940E-04    2.85      21.3  T
   7    -38.5559243 -0.312830E-08  0.524E-04    2.85      38.2  T
     SCC iter.                  ...        0 min,  0.009 sec
     gradient                   ...        0 min,  0.015 sec
 * total energy  :   -38.0660779 Eh     change       -0.1061696E-03 Eh
   gradient norm :     0.0070172 Eh/α   predicted    -0.8369017E-04 ( -21.17%)
   displ. norm   :     0.1188983 α      lambda       -0.1263156E-03
   maximum displ.:     0.0600054 α      in ANC's #3, #2, #6, ...

........................................................................
.............................. CYCLE   27 ..............................
........................................................................
   1    -38.5567692 -0.385568E+02  0.922E-02    2.86       0.0  T
   2    -38.5567713 -0.204310E-05  0.534E-02    2.85       1.0  T
   3    -38.5567711  0.168124E-06  0.100E-02    2.86       2.0  T
   4    -38.5567716 -0.478883E-06  0.618E-03    2.86       3.2  T
   5    -38.5567720 -0.402840E-06  0.194E-03    2.86      10.3  T
   6    -38.5567720 -0.475142E-07  0.702E-04    2.86      28.5  T
     SCC iter.                  ...        0 min,  0.008 sec
     gradient                   ...        0 min,  0.015 sec
 * total energy  :   -38.0661552 Eh     change       -0.7735360E-04 Eh
   gradient norm :     0.0023952 Eh/α   predicted    -0.6407588E-04 ( -17.16%)
   displ. norm   :     0.1424962 α      lambda       -0.6831910E-04
   maximum displ.:     0.0648299 α      in ANC's #3, #2, #6, ...

........................................................................
.............................. CYCLE   28 ..............................
........................................................................
   1    -38.5560489 -0.385560E+02  0.116E-01    2.87       0.0  T
   2    -38.5560518 -0.298096E-05  0.684E-02    2.87       1.0  T
   3    -38.5560489  0.294049E-05  0.168E-02    2.87       1.2  T
   4    -38.5560529 -0.402152E-05  0.694E-03    2.87       2.9  T
   5    -38.5560532 -0.315974E-06  0.241E-03    2.87       8.3  T
   6    -38.5560533 -0.501708E-07  0.935E-04    2.87      21.4  T
   7    -38.5560533 -0.362473E-08  0.502E-04    2.87      39.8  T
     SCC iter.                  ...        0 min,  0.008 sec
     gradient                   ...        0 min,  0.016 sec
 * total energy  :   -38.0661797 Eh     change       -0.2446950E-04 Eh
   gradient norm :     0.0062926 Eh/α   predicted    -0.3485381E-04 (  42.44%)
   displ. norm   :     0.0513900 α      lambda       -0.7113606E-04
   maximum displ.:     0.0411640 α      in ANC's #5, #16, #11, ...

........................................................................
.............................. CYCLE   29 ..............................
........................................................................
   1    -38.5570326 -0.385570E+02  0.446E-02    2.87       0.0  T
   2    -38.5570339 -0.132502E-05  0.230E-02    2.87       1.0  T
   3    -38.5570340 -0.592832E-07  0.524E-03    2.87       3.8  T
   4    -38.5570342 -0.200014E-06  0.325E-03    2.87       6.2  T
   5    -38.5570342 -0.652696E-07  0.132E-03    2.87      15.1  T
   6    -38.5570343 -0.219399E-07  0.494E-04    2.87      40.5  T
     SCC iter.                  ...        0 min,  0.008 sec
     gradient                   ...        0 min,  0.015 sec
 * total energy  :   -38.0662085 Eh     change       -0.2881856E-04 Eh
   gradient norm :     0.0019056 Eh/α   predicted    -0.3567087E-04 (  23.78%)
   displ. norm   :     0.0400638 α      lambda       -0.1842139E-04
   maximum displ.:     0.0308091 α      in ANC's #5, #16, #10, ...

........................................................................
.............................. CYCLE   30 ..............................
........................................................................
   1    -38.5569006 -0.385569E+02  0.335E-02    2.87       0.0  T
   2    -38.5569009 -0.323252E-06  0.180E-02    2.87       1.1  T
   3    -38.5569009 -0.372650E-07  0.349E-03    2.87       5.7  T
   4    -38.5569009 -0.350975E-08  0.226E-03    2.87       8.9  T
   5    -38.5569010 -0.524930E-07  0.620E-04    2.87      32.2  T
   6    -38.5569010 -0.630633E-08  0.193E-04    2.87     103.6  T
     SCC iter.                  ...        0 min,  0.007 sec
     gradient                   ...        0 min,  0.016 sec
 * total energy  :   -38.0662213 Eh     change       -0.1277851E-04 Eh
   gradient norm :     0.0009896 Eh/α   predicted    -0.9218113E-05 ( -27.86%)
   displ. norm   :     0.0406334 α      lambda       -0.6726284E-05
   maximum displ.:     0.0233374 α      in ANC's #5, #3, #10, ...

........................................................................
.............................. CYCLE   31 ..............................
........................................................................
   1    -38.5567051 -0.385567E+02  0.385E-02    2.88       0.0  T
   2    -38.5567055 -0.415700E-06  0.205E-02    2.88       1.0  T
   3    -38.5567055  0.356403E-08  0.443E-03    2.88       4.5  T
   4    -38.5567056 -0.548334E-07  0.290E-03    2.88       6.9  T
   5    -38.5567057 -0.855431E-07  0.597E-04    2.88      33.5  T
   6    -38.5567057 -0.416803E-08  0.215E-04    2.88      93.1  T
     SCC iter.                  ...        0 min,  0.007 sec
     gradient                   ...        0 min,  0.016 sec
 * total energy  :   -38.0662273 Eh     change       -0.6048011E-05 Eh
   gradient norm :     0.0010660 Eh/α   predicted    -0.3380380E-05 ( -44.11%)
   displ. norm   :     0.0363867 α      lambda       -0.4389005E-05
   maximum displ.:     0.0248702 α      in ANC's #5, #4, #1, ...

........................................................................
.............................. CYCLE   32 ..............................
........................................................................
   1    -38.5569431 -0.385569E+02  0.407E-02    2.88       0.0  T
   2    -38.5569438 -0.660158E-06  0.195E-02    2.88       1.0  T
   3    -38.5569439 -0.130709E-06  0.280E-03    2.88       7.1  T
   4    -38.5569439  0.485837E-08  0.191E-03    2.88      10.5  T
   5    -38.5569440 -0.375868E-07  0.482E-04    2.88      41.5  T
   6    -38.5569440 -0.214179E-08  0.206E-04    2.88      97.0  T
     SCC iter.                  ...        0 min,  0.008 sec
     gradient                   ...        0 min,  0.016 sec
 * total energy  :   -38.0662307 Eh     change       -0.3377285E-05 Eh
   gradient norm :     0.0007433 Eh/α   predicted    -0.2198800E-05 ( -34.89%)
   displ. norm   :     0.0210053 α      lambda       -0.1432150E-05
   maximum displ.:     0.0122908 α      in ANC's #5, #4, #1, ...

   *** GEOMETRY OPTIMIZATION CONVERGED AFTER 32 ITERATIONS ***

------------------------------------------------------------------------
 total energy gain   :        -0.0076199 Eh       -4.7816 kcal/mol
 total RMSD          :         0.3399704 a0        0.1799 Å
 total power (kW/mol):        -0.6251886 (step)  -17.2360 (real)
------------------------------------------------------------------------

 ANCopt (total)                0 d,  0 h,  0 min,  1.161 sec
 optimizer setup                ...        0 min,  0.000 sec (  0.013%)
 model hessian                  ...        0 min,  0.022 sec (  1.894%)
 ANC generation                 ...        0 min,  0.001 sec (  0.121%)
 coordinate transformation      ...        0 min,  0.001 sec (  0.046%)
 single point calculation       ...        0 min,  1.124 sec ( 96.869%)
 optimization log               ...        0 min,  0.003 sec (  0.271%)
 hessian update                 ...        0 min,  0.000 sec (  0.036%)
 rational function              ...        0 min,  0.007 sec (  0.563%)

================
 final structure:
================
$coord
    2.83487804532571   -2.51516043754188   -0.07367536379567      C 
    5.17313986161090   -0.28100447669847   -0.06436602707211      S 
    2.96557331353027    2.15897238408874    0.08224406284744      C 
    0.54434945762233    1.21585537312550    0.08002133555663      C 
    0.48252292819520   -1.47044017976289    0.00344844311318      C 
   -1.90568002233296   -2.95807271401246   -0.08359288006291      C 
   -2.27501207717449   -4.42710142524080   -3.24114991235325      S 
   -4.20127302971729   -1.35262422360487    0.58964711186354      C 
   -4.10624687516954    1.20829061490489   -0.72961598359774      C 
   -1.83148079672179    2.77761226153961    0.15145302519113      C 
   -2.26115197921741    3.82911731285057    2.57725687782167      O 
    3.91397439013912    4.71519861620919    0.13422728354565      C 
    2.69112287545450    6.73973971253074    0.98225417915254      C 
    3.31165947239742   -4.48228350737594   -0.15821413756728      H 
   -1.78669262848384   -4.60985007067468    1.15187807474714      H 
   -1.90670813670873   -2.32610013235559   -4.57267791553465      H 
   -4.24636285274318   -1.08774222666880    2.64018029921673      H 
   -5.91989030751430   -2.35903023937896    0.05527217045286      H 
   -5.82290679737667    2.27465904675048   -0.31917940803670      H 
   -3.99531700152766    0.94005037619005   -2.77225134199773      H 
   -1.61125349990012    4.42586389789091   -1.08614171729502      H 
   -2.33070500122355    2.47779797066077    3.79484773309301      H 
    5.83290651173393    4.90259674268821   -0.55326340585782      H 
    0.83074034553620    6.63752495585855    1.79096609706652      H 
    3.56661257638263    8.57574623852022    0.93280827677085      H 
$end
           -------------------------------------------------
          |                Final Singlepoint                |
           -------------------------------------------------

          ...................................................
          :                      SETUP                      :
          :.................................................:
          :  # basis functions                  76          :
          :  # atomic orbitals                  74          :
          :  # shells                           40          :
          :  # electrons                        70          :
          :  max. iterations                   250          :
          :  Hamiltonian                  GFN2-xTB          :
          :  restarted?                      false          :
          :  GBSA solvation                  false          :
          :  PC potential                    false          :
          :  electronic temp.          300.0000000     K    :
          :  accuracy                    1.0000000          :
          :  -> integral cutoff          0.2500000E+02      :
          :  -> integral neglect         0.1000000E-07      :
          :  -> SCF convergence          0.1000000E-05 Eh   :
          :  -> wf. convergence          0.1000000E-03 e    :
          :  Broyden damping             0.4000000          :
          ...................................................

 iter      E             dE          RMSdq      gap      omega  full diag
   1    -38.5569440 -0.385569E+02  0.112E-04    2.88       0.0  T
   2    -38.5569440 -0.402238E-10  0.608E-05    2.88     329.0  T
   3    -38.5569440 -0.864446E-10  0.377E-05    2.88     530.0  T

   *** convergence criteria satisfied after 3 iterations ***

         #    Occupation            Energy/Eh            Energy/eV
      -------------------------------------------------------------
         1        2.0000           -0.7366017             -20.0440
       ...           ...                  ...                  ...
        29        2.0000           -0.4427399             -12.0476
        30        2.0000           -0.4331746             -11.7873
        31        2.0000           -0.4303031             -11.7091
        32        2.0000           -0.4191653             -11.4061
        33        2.0000           -0.4005612             -10.8998
        34        2.0000           -0.3839749             -10.4485
        35        2.0000           -0.3744147             -10.1883 (HOMO)
        36                         -0.2686353              -7.3099 (LUMO)
        37                         -0.2263835              -6.1602
        38                         -0.2085091              -5.6738
        39                         -0.1927411              -5.2448
        40                         -0.1601512              -4.3579
       ...                                ...                  ...
        74                          0.6704506              18.2439
      -------------------------------------------------------------
                  HL-Gap            0.1057794 Eh            2.8784 eV
             Fermi-level           -0.3215250 Eh           -8.7491 eV

 SCC (total)                   0 d,  0 h,  0 min,  0.032 sec
 SCC setup                      ...        0 min,  0.000 sec (  0.659%)
 Dispersion                     ...        0 min,  0.000 sec (  0.608%)
 integral evaluation            ...        0 min,  0.010 sec ( 31.961%)
 zeroth order Hamiltonian       ...        0 min,  0.000 sec (  0.573%)
 iterations                     ...        0 min,  0.004 sec ( 13.555%)
 molecular gradient             ...        0 min,  0.016 sec ( 51.393%)
 printout                       ...        0 min,  0.000 sec (  1.067%)

         :::::::::::::::::::::::::::::::::::::::::::::::::::::
         ::                     SUMMARY                     ::
         :::::::::::::::::::::::::::::::::::::::::::::::::::::
         :: total energy             -38.066230688234 Eh    ::
         :: gradient norm              0.000743416374 Eh/a0 ::
         :: HOMO-LUMO gap              2.878403097677 eV    ::
         ::.................................................::
         :: SCC energy               -38.556943956265 Eh    ::
         :: -> isotropic ES            0.030221830033 Eh    ::
         :: -> anisotropic ES          0.001975936443 Eh    ::
         :: -> anisotropic XC          0.015933524396 Eh    ::
         :: -> dispersion             -0.028382725125 Eh    ::
         :: repulsion energy           0.490423803909 Eh    ::
         :: add. restraining           0.000000000000 Eh    ::
         :::::::::::::::::::::::::::::::::::::::::::::::::::::

           -------------------------------------------------
          |                Property Printout                |
           -------------------------------------------------

    * Orbital Energies and Occupations

         #    Occupation            Energy/Eh            Energy/eV
      -------------------------------------------------------------
         1        2.0000           -0.7366017             -20.0440
       ...           ...                  ...                  ...
        23        2.0000           -0.4808362             -13.0842
        24        2.0000           -0.4747826             -12.9195
        25        2.0000           -0.4684473             -12.7471
        26        2.0000           -0.4637176             -12.6184
        27        2.0000           -0.4569889             -12.4353
        28        2.0000           -0.4545800             -12.3698
        29        2.0000           -0.4427399             -12.0476
        30        2.0000           -0.4331746             -11.7873
        31        2.0000           -0.4303031             -11.7091
        32        2.0000           -0.4191653             -11.4061
        33        2.0000           -0.4005612             -10.8998
        34        2.0000           -0.3839749             -10.4485
        35        2.0000           -0.3744147             -10.1883 (HOMO)
        36                         -0.2686353              -7.3099 (LUMO)
        37                         -0.2263835              -6.1602
        38                         -0.2085091              -5.6738
        39                         -0.1927411              -5.2448
        40                         -0.1601512              -4.3579
        41                         -0.1227496              -3.3402
        42                         -0.1201682              -3.2699
        43                         -0.0203187              -0.5529
        44                         -0.0167799              -0.4566
        45                         -0.0076806              -0.2090
        46                         -0.0039165              -0.1066
       ...                                ...                  ...
        74                          0.6704506              18.2439
      -------------------------------------------------------------
                  HL-Gap            0.1057794 Eh            2.8784 eV
             Fermi-level           -0.3215250 Eh           -8.7491 eV

     #   Z        covCN         q      C6AA      α(0)
     1   6 C      2.935    -0.028    28.699     8.786
     2  16 S      2.338    -0.029   142.239    20.073
     3   6 C      2.987     0.020    27.548     8.610
     4   6 C      3.151    -0.038    28.642     8.753
     5   6 C      3.204    -0.017    27.832     8.594
     6   6 C      3.849     0.040    19.872     6.341
     7  16 S      1.956    -0.290   153.598    20.859
     8   6 C      3.830    -0.054    21.514     6.600
     9   6 C      3.805    -0.069    21.809     6.648
    10   6 C      3.729     0.115    18.787     6.188
    11   8 O      1.655    -0.444    21.732     6.293
    12   6 C      2.934    -0.032    28.788     8.799
    13   6 C      2.839    -0.091    30.263     9.015
    14   1 H      0.926     0.049     2.336     2.390
    15   1 H      0.925     0.045     2.378     2.411
    16   1 H      0.923     0.158     1.340     1.810
    17   1 H      0.924     0.034     2.526     2.486
    18   1 H      0.924     0.050     2.325     2.384
    19   1 H      0.924     0.050     2.324     2.384
    20   1 H      0.924     0.038     2.474     2.460
    21   1 H      0.924     0.046     2.365     2.405
    22   1 H      0.805     0.288     0.759     1.368
    23   1 H      0.925     0.042     2.418     2.432
    24   1 H      0.926     0.071     2.070     2.250
    25   1 H      0.926     0.043     2.407     2.426

 Mol. C6AA /au·bohr⁶  :       9285.038576
 Mol. C8AA /au·bohr⁸  :     270848.086719
 Mol. α(0) /au        :        152.764736


Wiberg/Mayer (AO) data.
largest (>0.10) Wiberg bond orders for each atom
          total WBO             WBO to atom ...
     1  C   3.949        C    5 1.569    S    2 1.204    H   14 0.969    C    3 0.100
     2  S   2.628        C    1 1.204    C    3 1.137
     3  C   3.949        C    4 1.509    S    2 1.137    C   12 1.123    C    1 0.100
     4  C   3.981        C    3 1.509    C    5 1.239    C   10 0.986
     5  C   3.983        C    1 1.569    C    4 1.239    C    6 1.015
     6  C   3.975        C    5 1.015    C    8 1.001    H   15 0.958    S    7 0.946
     7  S   2.017        H   16 0.960    C    6 0.946
     8  C   3.996        C    9 1.011    C    6 1.001    H   18 0.974    H   17 0.967
     9  C   3.997        C    8 1.011    C   10 0.984    H   19 0.973    H   20 0.971
    10  C   3.956        C    4 0.986    C    9 0.984    O   11 0.977    H   21 0.954
    11  O   1.972        C   10 0.977    H   22 0.897
    12  C   3.990        C   13 1.873    C    3 1.123    H   23 0.961
    13  C   3.988        C   12 1.873    H   25 0.977    H   24 0.967
    14  H   0.997        C    1 0.969
    15  H   0.998        C    6 0.958
    16  H   0.975        S    7 0.960
    17  H   0.999        C    8 0.967
    18  H   0.997        C    8 0.974
    19  H   0.996        C    9 0.973
    20  H   0.999        C    9 0.971
    21  H   0.998        C   10 0.954
    22  H   0.917        O   11 0.897
    23  H   0.998        C   12 0.961
    24  H   0.995        C   13 0.967
    25  H   0.998        C   13 0.977

molecular dipole:
                 x           y           z       tot (Debye)
 q only:       -0.066       0.285       0.217
   full:       -0.210       0.207       0.407       1.277
molecular quadrupole (traceless):
                xx          xy          yy          xz          yz          zz
 q only:        2.557       0.100      -5.010      -1.294      -6.324       2.453
  q+dip:        3.043      -0.175      -4.802      -3.046     -10.032       1.759
   full:        1.178       0.038      -5.300      -2.527     -10.040       4.122

           -------------------------------------------------
          |                Geometry Summary                 |
           -------------------------------------------------

      molecular mass/u    :      212.3242000
   center of mass at/Å    :        0.1475843       0.1300001      -0.1250627
  moments of inertia/u·Å² :        0.5567378E+03   0.9312052E+03   0.1347858E+04
rotational constants/cm⁻¹ :        0.3027930E-01   0.1810303E-01   0.1250698E-01

 * 23 selected distances

     #   Z        #   Z                                     value/Å
     1   6 C      2  16 S                                 1.7113799
     2  16 S      3   6 C                                 1.7429409 (max)
     3   6 C      4   6 C                                 1.3750261
     1   6 C      5   6 C                                 1.3626662
     4   6 C      5   6 C                                 1.4224802
     5   6 C      6   6 C                                 1.4896260
     6   6 C      8   6 C                                 1.5245875
     8   6 C      9   6 C                                 1.5252583
     9   6 C     10   6 C                                 1.5349437
    10   6 C     11   8 O                                 1.4174450
    12   6 C     13   6 C                                 1.3296238
     1   6 C     14   1 H                                 1.0720301
     6   6 C     15   1 H                                 1.0933518
     7  16 S     16   1 H                                 1.3306279
     8   6 C     17   1 H                                 1.0943716
     8   6 C     18   1 H                                 1.0911906
     9   6 C     19   1 H                                 1.0912504
     9   6 C     20   1 H                                 1.0917759
    10   6 C     21   1 H                                 1.0969264
    11   8 O     22   1 H                                 0.9632522 (min)
    12   6 C     23   1 H                                 1.0832068
    13   6 C     24   1 H                                 1.0748274
    13   6 C     25   1 H                                 1.0766966

 * 6 distinct bonds (by element types)

   Z      Z             #   av. dist./Å        max./Å        min./Å
   1 H    6 C          10     1.0865628     1.0969264     1.0720301
   6 C    6 C           8     1.4455265     1.5349437     1.3296238
   1 H    8 O           1     0.9632522     0.9632522     0.9632522
   6 C    8 O           1     1.4174450     1.4174450     1.4174450
   1 H   16 S           1     1.3306279     1.3306279     1.3306279
   6 C   16 S           2     1.7271604     1.7429409     1.7113799


optimized geometry written to: xtbopt.xyz


           -------------------------------------------------
          | TOTAL ENERGY              -38.066230688234 Eh   |
          | GRADIENT NORM               0.000743416374 Eh/α |
          | HOMO-LUMO GAP               2.878403097677 eV   |
           -------------------------------------------------

------------------------------------------------------------------------
 * finished run on 2021/05/19 at 10:59:03.384     
------------------------------------------------------------------------
 total:
 * wall-time:     0 d,  0 h,  0 min,  1.260 sec
 *  cpu-time:     0 d,  0 h,  0 min,  1.258 sec
 * ratio c/w:     0.998 speedup
 SCF:
 * wall-time:     0 d,  0 h,  0 min,  0.045 sec
 *  cpu-time:     0 d,  0 h,  0 min,  0.044 sec
 * ratio c/w:     1.000 speedup
 ANC optimizer:
 * wall-time:     0 d,  0 h,  0 min,  1.193 sec
 *  cpu-time:     0 d,  0 h,  0 min,  1.192 sec
 * ratio c/w:     0.999 speedup

