      -----------------------------------------------------------      
     |                   =====================                   |     
     |                           x T B                           |     
     |                   =====================                   |     
     |                         S. Grimme                         |     
     |          Mulliken Center for Theoretical Chemistry        |     
     |                    University of Bonn                     |     
     |                Version 6.2 RC2 (SAW190805)                |     
      -----------------------------------------------------------      

   This program is distributed in the hope that it will be useful,
   but WITHOUT ANY WARRANTY; without even the implied warranty of
   MERCHANTABILITY or FITNESS FOR A PARTICULAR PURPOSE.
   
   FOR NON-COMMERCIAL, ACADEMIA USE ONLY.
   
   Cite this work as:
   * S. Grimme, C. Bannwarth, P. Shushkov, J. Chem. Theory Comput., 2017,
     13, 1989-2009. DOI: 10.1021/acs.jctc.7b00118
   * C. Bannwarth, S. Ehlert and S. Grimme., J. Chem. Theory Comput., 2019,
     15, 1652-1671. DOI: 10.1021/acs.jctc.8b01176
   * P. Pracht, E. Caldeweyher, S. Ehlert, S. Grimme, ChemRxiv, 2019, preprint.
     DOI: 10.26434/chemrxiv.8326202.v1
   
   for DFT-D4:
   * E. Caldeweyher, C. Bannwarth and S. Grimme, J. Chem. Phys., 2017,
     147, 034112. DOI: 10.1063/1.4993215
   * E. Caldeweyher, S. Ehlert, A. Hansen, H. Neugebauer, S. Spicher,
     C. Bannwarth and S. Grimme, J. Chem. Phys., 2019, 150, 154122.
     DOI: 10.1063/1.5090222
   
   for sTDA-xTB:
   * S. Grimme and C. Bannwarth, J. Chem. Phys., 2016, 145, 054103.
     DOI: 10.1063/1.4959605
   
   in the mass-spec context:
   * V. Asgeirsson, C. Bauer and S. Grimme, Chem. Sci., 2017, 8, 4879.
     DOI: 10.1039/c7sc00601b
   
   for metadynamics refer to:
   * S. Grimme, J. Chem. Theory Comput., 2019, 155, 2847-2862
     DOI: 10.1021/acs.jctc.9b00143
   
   with help from (in alphabetical order)
   C. Bannwarth, F. Bohle, G. Brandenburg, E. Caldeweyher, M. Checinski,
   S. Dohm, S. Ehlert, S. Ehrlich, F. März, H. Neugebauer, J. Pisarek,
   P. Pracht, P. Shushkov, and S. Spicher.
   
 * started run on 2021/05/19 at 10:59:08.135     

           -------------------------------------------------
          |                Calculation Setup                |
           -------------------------------------------------

          program call               : /ihome/ghutchison/geoffh/xtb/xtb 323.xyz -opt
          hostname                   : smp-n122
          coordinate file            : 323.xyz
          omp threads                :                     1
          number of atoms            :                    18
          number of electrons        :                    42
          charge                     :                     0
          spin                       :                   0.0
          first test random number   :      0.87587727673797


########################################################################
# WARNING! Please study the warnings concerning your input carefully
#  - the use of '-opt' is discouraged, please use '--opt' next time
########################################################################

           ------------------------------------------------- 
          |                 G F N 2 - x T B                 |
          | Geometry, Frequencies, Noncovalent interactions |
          |            JCTC 2019 parametrisation            |
           ------------------------------------------------- 
             KAB for C  - Si     :                1.0500
             KAB for H  - Pd     :                0.9500
             k(s)              :                1.8500
             k(p)              :                2.2300
             k(d)              :                2.2300
             k(f)              :                2.0000
             kEN (H0ij)        :               -2.0000
             D4 a1             :                0.5200
             D4 a2             :                5.0000
             D4 s6             :                1.0000
             D4 s8             :                2.7000
             D4 s9             :                5.0000
             alphaj            :                2.0000

  Z AO/shell   Hii/eV     exponent
  1     Wed Apr 25 08:07:45 CEST 2018   EN: 2.200 GM2: 0.406  GM3: 0.0800  RAES: 1.40
     1s    -10.707211    1.230000
  6     Wed Apr 25 08:07:45 CEST 2018   EN: 2.550 GM2: 0.538  GM3: 0.1500  RAES: 3.00
     2s    -13.970922    2.096432
     2p    -10.063292    1.800000

           ------------------------------------------------- 
          |        Self-Consistent Charge Iterations        |
           ------------------------------------------------- 

          ...................................................
          :                      SETUP                      :
          :.................................................:
          :  # basis functions                  42          :
          :  # atomic orbitals                  42          :
          :  # shells                           26          :
          :  # electrons                        42          :
          :  max. iterations                   250          :
          :  Hamiltonian                  GFN2-xTB          :
          :  restarted?                      false          :
          :  GBSA solvation                  false          :
          :  PC potential                    false          :
          :  electronic temp.          300.0000000     K    :
          :  accuracy                    1.0000000          :
          :  -> integral cutoff          0.2500000E+02      :
          :  -> integral neglect         0.1000000E-07      :
          :  -> SCF convergence          0.1000000E-05 Eh   :
          :  -> wf. convergence          0.1000000E-03 e    :
          :  Broyden damping             0.4000000          :
          ...................................................

 iter      E             dE          RMSdq      gap      omega  full diag
   1    -22.5751608 -0.225752E+02  0.416E+00    4.62       0.0  T
   2    -22.6014482 -0.262874E-01  0.245E+00    4.67       1.0  T
   3    -22.6011894  0.258785E-03  0.698E-01    4.57       1.0  T
   4    -22.6017833 -0.593806E-03  0.305E-01    4.65       1.0  T
   5    -22.6028071 -0.102390E-02  0.547E-02    4.63       1.0  T
   6    -22.6028145 -0.732105E-05  0.286E-02    4.62       1.0  T
   7    -22.6028153 -0.796515E-06  0.112E-02    4.63       2.1  T
   8    -22.6028162 -0.935658E-06  0.126E-03    4.63      18.7  T
   9    -22.6028162 -0.516432E-08  0.682E-04    4.63      34.5  T
  10    -22.6028162 -0.822066E-09  0.284E-04    4.63      82.9  T

   *** convergence criteria satisfied after 10 iterations ***

         #    Occupation            Energy/Eh            Energy/eV
      -------------------------------------------------------------
         1        2.0000           -0.6366555             -17.3243
       ...           ...                  ...                  ...
        15        2.0000           -0.4576411             -12.4530
        16        2.0000           -0.4493437             -12.2273
        17        2.0000           -0.4350330             -11.8379
        18        2.0000           -0.4159634             -11.3189
        19        2.0000           -0.4157763             -11.3138
        20        2.0000           -0.3965569             -10.7909
        21        2.0000           -0.3897855             -10.6066 (HOMO)
        22                         -0.2198042              -5.9812 (LUMO)
        23                         -0.2186897              -5.9508
        24                         -0.0945714              -2.5734
        25                          0.0938489               2.5538
        26                          0.1138304               3.0975
       ...                                ...                  ...
        42                          0.6372325              17.3400
      -------------------------------------------------------------
                  HL-Gap            0.1699813 Eh            4.6254 eV
             Fermi-level           -0.3047948 Eh           -8.2939 eV

 SCC (total)                   0 d,  0 h,  0 min,  0.017 sec
 SCC setup                      ...        0 min,  0.000 sec (  1.294%)
 Dispersion                     ...        0 min,  0.000 sec (  1.217%)
 integral evaluation            ...        0 min,  0.003 sec ( 20.031%)
 zeroth order Hamiltonian       ...        0 min,  0.000 sec (  0.486%)
 iterations                     ...        0 min,  0.007 sec ( 39.416%)
 molecular gradient             ...        0 min,  0.006 sec ( 35.703%)
 printout                       ...        0 min,  0.000 sec (  1.492%)

         :::::::::::::::::::::::::::::::::::::::::::::::::::::
         ::                     SUMMARY                     ::
         :::::::::::::::::::::::::::::::::::::::::::::::::::::
         :: total energy             -22.213502313131 Eh    ::
         :: gradient norm              0.026423061567 Eh/a0 ::
         :: HOMO-LUMO gap              4.625426141151 eV    ::
         ::.................................................::
         :: SCC energy               -22.602816207370 Eh    ::
         :: -> isotropic ES            0.002051843207 Eh    ::
         :: -> anisotropic ES          0.004825488403 Eh    ::
         :: -> anisotropic XC          0.015992594288 Eh    ::
         :: -> dispersion             -0.013219947858 Eh    ::
         :: repulsion energy           0.389273413294 Eh    ::
         :: add. restraining           0.000000000000 Eh    ::
         :::::::::::::::::::::::::::::::::::::::::::::::::::::

      ----------------------------------------------------------- 
     |                   =====================                   |
     |                        A N C O P T                        |
     |                   =====================                   |
     |               Approximate Normal Coordinate               |
     |                Rational Function Optimizer                |
      ----------------------------------------------------------- 

          ...................................................
          :                      SETUP                      :
          :.................................................:
          :   optimization level            normal          :
          :   max. optcycles                   200          :
          :   ANC micro-cycles                  20          :
          :   degrees of freedom                48          :
          :.................................................:
          :   RF solver                   davidson          :
          :   input Hessian                  false          :
          :   write xtbopt.log                true          :
          :   linear?                        false          :
          :   energy convergence         0.5000000E-05 Eh   :
          :   grad. convergence          0.1000000E-02 Eh/α :
          :   maximium RF displ.         2.0000000          :
          :   Hlow (freq-cutoff)         0.5000000E-02      :
          :   Hmax (freq-cutoff)         5.0000000          :
          :   S6 in model hess.         20.0000000          :
          ...................................................

generating ANC from model Hessian ...
Using Lindh-Hessian (1995)
 Shifting diagonal of input Hessian by   2.172595971280015E-003
 Lowest  eigenvalues of input Hessian
   -0.000000   -0.000000   -0.000000   -0.000000    0.000000    0.000000
    0.005000    0.005046    0.009295    0.012883    0.016130    0.021705
    0.023837    0.027472    0.043788    0.045705    0.053247    0.064764
 Highest eigenvalues
    1.347830    1.523057    1.552899    1.826209    1.924498    1.939405
 

........................................................................
.............................. CYCLE    1 ..............................
........................................................................
   1    -22.6028162 -0.226028E+02  0.727E-05    4.63       0.0  T
   2    -22.6028162 -0.504485E-11  0.424E-05    4.63     556.5  T
   3    -22.6028162  0.375522E-11  0.239E-05    4.63     986.4  T
     SCC iter.                  ...        0 min,  0.002 sec
     gradient                   ...        0 min,  0.006 sec
 * total energy  :   -22.2135023 Eh     change       -0.2443893E-07 Eh
   gradient norm :     0.0264228 Eh/α   predicted     0.0000000E+00 (-100.00%)
   displ. norm   :     0.1346735 α      lambda       -0.2107712E-02
   maximum displ.:     0.0644339 α      in ANC's #28, #1, #26, ...

........................................................................
.............................. CYCLE    2 ..............................
........................................................................
   1    -22.6229606 -0.226230E+02  0.647E-02    4.73       0.0  T
   2    -22.6229648 -0.418327E-05  0.384E-02    4.73       1.0  T
   3    -22.6229640  0.718043E-06  0.110E-02    4.73       2.1  T
   4    -22.6229648 -0.773048E-06  0.350E-03    4.73       6.7  T
   5    -22.6229651 -0.252098E-06  0.831E-04    4.73      28.3  T
     SCC iter.                  ...        0 min,  0.003 sec
     gradient                   ...        0 min,  0.006 sec
 * total energy  :   -22.2147401 Eh     change       -0.1237808E-02 Eh
   gradient norm :     0.0074363 Eh/α   predicted    -0.1072970E-02 ( -13.32%)
   displ. norm   :     0.0531616 α      lambda       -0.1170321E-03
   maximum displ.:     0.0405989 α      in ANC's #1, #4, #28, ...

........................................................................
.............................. CYCLE    3 ..............................
........................................................................
   1    -22.6268856 -0.226269E+02  0.248E-02    4.74       0.0  T
   2    -22.6268863 -0.697566E-06  0.142E-02    4.74       1.7  T
   3    -22.6268861  0.212704E-06  0.538E-03    4.74       4.4  T
   4    -22.6268864 -0.270646E-06  0.134E-03    4.74      17.6  T
   5    -22.6268864 -0.348074E-07  0.242E-04    4.74      97.3  T
     SCC iter.                  ...        0 min,  0.003 sec
     gradient                   ...        0 min,  0.006 sec
 * total energy  :   -22.2148097 Eh     change       -0.6954270E-04 Eh
   gradient norm :     0.0023387 Eh/α   predicted    -0.5868196E-04 ( -15.62%)
   displ. norm   :     0.0403393 α      lambda       -0.2063822E-04
   maximum displ.:     0.0377255 α      in ANC's #1, #2, #4, ...

........................................................................
.............................. CYCLE    4 ..............................
........................................................................
   1    -22.6271506 -0.226272E+02  0.216E-02    4.74       0.0  T
   2    -22.6271507 -0.136308E-06  0.127E-02    4.74       1.9  T
   3    -22.6271506  0.136756E-06  0.294E-03    4.74       8.0  T
   4    -22.6271508 -0.160398E-06  0.573E-04    4.74      41.1  T
   5    -22.6271508 -0.581831E-08  0.162E-04    4.74     145.3  T
     SCC iter.                  ...        0 min,  0.003 sec
     gradient                   ...        0 min,  0.006 sec
 * total energy  :   -22.2148245 Eh     change       -0.1484957E-04 Eh
   gradient norm :     0.0007231 Eh/α   predicted    -0.1033466E-04 ( -30.40%)
   displ. norm   :     0.0461732 α      lambda       -0.8456401E-05
   maximum displ.:     0.0435072 α      in ANC's #1, #2, #3, ...

........................................................................
.............................. CYCLE    5 ..............................
........................................................................
   1    -22.6265724 -0.226266E+02  0.240E-02    4.74       0.0  T
   2    -22.6265724 -0.398512E-07  0.141E-02    4.74       1.7  T
   3    -22.6265724  0.348490E-07  0.165E-03    4.74      14.3  T
   4    -22.6265724 -0.454300E-07  0.344E-04    4.74      68.6  T
   5    -22.6265724 -0.102450E-08  0.136E-04    4.74     172.7  T
     SCC iter.                  ...        0 min,  0.003 sec
     gradient                   ...        0 min,  0.006 sec
 * total energy  :   -22.2148328 Eh     change       -0.8221668E-05 Eh
   gradient norm :     0.0010801 Eh/α   predicted    -0.4233434E-05 ( -48.51%)
   displ. norm   :     0.0220933 α      lambda       -0.2748105E-05
   maximum displ.:     0.0207092 α      in ANC's #1, #2, #4, ...

........................................................................
.............................. CYCLE    6 ..............................
........................................................................
   1    -22.6265327 -0.226265E+02  0.131E-02    4.74       0.0  T
   2    -22.6265328 -0.925878E-08  0.772E-03    4.74       3.1  T
   3    -22.6265327  0.207808E-07  0.108E-03    4.74      21.9  T
   4    -22.6265328 -0.250797E-07  0.134E-04    4.74     176.2  T
   5    -22.6265328 -0.103444E-09  0.649E-05    4.74     363.2  T
     SCC iter.                  ...        0 min,  0.003 sec
     gradient                   ...        0 min,  0.006 sec
 * total energy  :   -22.2148359 Eh     change       -0.3109061E-05 Eh
   gradient norm :     0.0005811 Eh/α   predicted    -0.1372383E-05 ( -55.86%)
   displ. norm   :     0.0183598 α      lambda       -0.1732721E-05
   maximum displ.:     0.0173169 α      in ANC's #1, #2, #13, ...

   *** GEOMETRY OPTIMIZATION CONVERGED AFTER 6 ITERATIONS ***

------------------------------------------------------------------------
 total energy gain   :        -0.0013336 Eh       -0.8368 kcal/mol
 total RMSD          :         0.0616766 a0        0.0326 Å
 total power (kW/mol):        -0.5835418 (step)  -43.9663 (real)
------------------------------------------------------------------------

 ANCopt (total)                0 d,  0 h,  0 min,  0.080 sec
 optimizer setup                ...        0 min,  0.000 sec (  0.133%)
 model hessian                  ...        0 min,  0.004 sec (  4.534%)
 ANC generation                 ...        0 min,  0.000 sec (  0.591%)
 coordinate transformation      ...        0 min,  0.000 sec (  0.088%)
 single point calculation       ...        0 min,  0.073 sec ( 91.990%)
 optimization log               ...        0 min,  0.000 sec (  0.588%)
 hessian update                 ...        0 min,  0.000 sec (  0.124%)
 rational function              ...        0 min,  0.001 sec (  1.389%)

================
 final structure:
================
$coord
    2.57071904654330   -0.45280357227578   -0.11808614880388      C 
    1.67587842830760    2.01488360635568   -0.15944390361335      C 
    3.47916179780138    4.20297006709715   -0.30137809052883      C 
    4.11298630590518    4.82185603739794   -3.05463011831699      C 
   -0.91831770254580    2.41447303045705   -0.14772576773079      C 
   -2.58064648584798    0.39739268763288   -0.08286188805988      C 
   -1.66813984371782   -2.05375123554047   -0.03433253979858      C 
    0.91399828743813   -2.47402864663217   -0.05422652150389      C 
    4.58592182231250   -0.79007096172052   -0.12859930545135      H 
    5.21930282326289    3.74108800267721    0.70702072161597      H 
    2.63755645904513    5.86238046976058    0.59055043361467      H 
    4.97910772113994    3.19842532319377   -3.97067169305255      H 
    5.41813162575744    6.40672874565584   -3.15388015849417      H 
    2.40486640413341    5.31070366580122   -4.08820533035190      H 
   -1.64032330427162    4.32560594311384   -0.18243186231829      H 
   -4.59392115637458    0.73876872709680   -0.06580390377206      H 
   -2.96380341896113   -3.63010586562450    0.02325689679088      H 
    1.63890189906165   -4.38271277046693   -0.01497133459100      H 
$end
           -------------------------------------------------
          |                Final Singlepoint                |
           -------------------------------------------------

          ...................................................
          :                      SETUP                      :
          :.................................................:
          :  # basis functions                  42          :
          :  # atomic orbitals                  42          :
          :  # shells                           26          :
          :  # electrons                        42          :
          :  max. iterations                   250          :
          :  Hamiltonian                  GFN2-xTB          :
          :  restarted?                      false          :
          :  GBSA solvation                  false          :
          :  PC potential                    false          :
          :  electronic temp.          300.0000000     K    :
          :  accuracy                    1.0000000          :
          :  -> integral cutoff          0.2500000E+02      :
          :  -> integral neglect         0.1000000E-07      :
          :  -> SCF convergence          0.1000000E-05 Eh   :
          :  -> wf. convergence          0.1000000E-03 e    :
          :  Broyden damping             0.4000000          :
          ...................................................

 iter      E             dE          RMSdq      gap      omega  full diag
   1    -22.6265328 -0.226265E+02  0.195E-05    4.74       0.0  T
   2    -22.6265328 -0.222400E-11  0.904E-06    4.74    2607.3  T
   3    -22.6265328 -0.866862E-12  0.518E-06    4.74    4546.3  T

   *** convergence criteria satisfied after 3 iterations ***

         #    Occupation            Energy/Eh            Energy/eV
      -------------------------------------------------------------
         1        2.0000           -0.6397278             -17.4079
       ...           ...                  ...                  ...
        15        2.0000           -0.4589083             -12.4875
        16        2.0000           -0.4498754             -12.2417
        17        2.0000           -0.4363797             -11.8745
        18        2.0000           -0.4160572             -11.3215
        19        2.0000           -0.4151299             -11.2963
        20        2.0000           -0.3983298             -10.8391
        21        2.0000           -0.3909582             -10.6385 (HOMO)
        22                         -0.2168170              -5.8999 (LUMO)
        23                         -0.2163052              -5.8860
        24                         -0.0880206              -2.3952
        25                          0.1028968               2.8000
        26                          0.1229559               3.3458
       ...                                ...                  ...
        42                          0.6696626              18.2224
      -------------------------------------------------------------
                  HL-Gap            0.1741413 Eh            4.7386 eV
             Fermi-level           -0.3038876 Eh           -8.2692 eV

 SCC (total)                   0 d,  0 h,  0 min,  0.012 sec
 SCC setup                      ...        0 min,  0.000 sec (  1.179%)
 Dispersion                     ...        0 min,  0.000 sec (  0.888%)
 integral evaluation            ...        0 min,  0.003 sec ( 26.764%)
 zeroth order Hamiltonian       ...        0 min,  0.000 sec (  0.554%)
 iterations                     ...        0 min,  0.002 sec ( 17.784%)
 molecular gradient             ...        0 min,  0.006 sec ( 50.573%)
 printout                       ...        0 min,  0.000 sec (  1.862%)

         :::::::::::::::::::::::::::::::::::::::::::::::::::::
         ::                     SUMMARY                     ::
         :::::::::::::::::::::::::::::::::::::::::::::::::::::
         :: total energy             -22.214835866019 Eh    ::
         :: gradient norm              0.000581138541 Eh/a0 ::
         :: HOMO-LUMO gap              4.738625622611 eV    ::
         ::.................................................::
         :: SCC energy               -22.626532754842 Eh    ::
         :: -> isotropic ES            0.002173646938 Eh    ::
         :: -> anisotropic ES          0.004542917554 Eh    ::
         :: -> anisotropic XC          0.015340739025 Eh    ::
         :: -> dispersion             -0.013316515845 Eh    ::
         :: repulsion energy           0.411656259721 Eh    ::
         :: add. restraining           0.000000000000 Eh    ::
         :::::::::::::::::::::::::::::::::::::::::::::::::::::

           -------------------------------------------------
          |                Property Printout                |
           -------------------------------------------------

    * Orbital Energies and Occupations

         #    Occupation            Energy/Eh            Energy/eV
      -------------------------------------------------------------
         1        2.0000           -0.6397278             -17.4079
       ...           ...                  ...                  ...
         9        2.0000           -0.5065962             -13.7852
        10        2.0000           -0.4996169             -13.5953
        11        2.0000           -0.4858439             -13.2205
        12        2.0000           -0.4785260             -13.0214
        13        2.0000           -0.4763819             -12.9630
        14        2.0000           -0.4718325             -12.8392
        15        2.0000           -0.4589083             -12.4875
        16        2.0000           -0.4498754             -12.2417
        17        2.0000           -0.4363797             -11.8745
        18        2.0000           -0.4160572             -11.3215
        19        2.0000           -0.4151299             -11.2963
        20        2.0000           -0.3983298             -10.8391
        21        2.0000           -0.3909582             -10.6385 (HOMO)
        22                         -0.2168170              -5.8999 (LUMO)
        23                         -0.2163052              -5.8860
        24                         -0.0880206              -2.3952
        25                          0.1028968               2.8000
        26                          0.1229559               3.3458
        27                          0.1382997               3.7633
        28                          0.1428412               3.8869
        29                          0.1584179               4.3108
        30                          0.1806441               4.9156
        31                          0.1893757               5.1532
        32                          0.1936783               5.2703
       ...                                ...                  ...
        42                          0.6696626              18.2224
      -------------------------------------------------------------
                  HL-Gap            0.1741413 Eh            4.7386 eV
             Fermi-level           -0.3038876 Eh           -8.2692 eV

     #   Z        covCN         q      C6AA      α(0)
     1   6 C      2.925    -0.038    28.935     8.821
     2   6 C      2.971     0.013    27.709     8.634
     3   6 C      3.806    -0.058    21.606     6.617
     4   6 C      3.753    -0.097    22.411     6.751
     5   6 C      2.925    -0.038    28.938     8.822
     6   6 C      2.919    -0.031    28.772     8.796
     7   6 C      2.920    -0.034    28.839     8.806
     8   6 C      2.919    -0.031    28.772     8.796
     9   1 H      0.925     0.028     2.620     2.531
    10   1 H      0.924     0.035     2.516     2.481
    11   1 H      0.924     0.035     2.519     2.482
    12   1 H      0.925     0.036     2.508     2.477
    13   1 H      0.925     0.035     2.515     2.480
    14   1 H      0.925     0.035     2.511     2.478
    15   1 H      0.925     0.028     2.622     2.532
    16   1 H      0.926     0.027     2.627     2.535
    17   1 H      0.926     0.027     2.633     2.538
    18   1 H      0.926     0.027     2.628     2.535

 Mol. C6AA /au·bohr⁶  :       3303.563798
 Mol. C8AA /au·bohr⁸  :      77649.072800
 Mol. α(0) /au        :         91.111870


Wiberg/Mayer (AO) data.
largest (>0.10) Wiberg bond orders for each atom
          total WBO             WBO to atom ...
     1  C   3.992        C    8 1.446    C    2 1.412    H    9 0.970    C    6 0.111
     2  C   3.989        C    5 1.413    C    1 1.412    C    3 1.012    C    7 0.110
     3  C   3.997        C    2 1.012    C    4 1.001    H   11 0.975    H   10 0.974
     4  C   3.996        C    3 1.001    H   14 0.989    H   12 0.988    H   13 0.987
     5  C   3.992        C    6 1.445    C    2 1.413    H   15 0.970    C    8 0.111
     6  C   3.993        C    5 1.445    C    7 1.439    H   16 0.971    C    1 0.111
     7  C   3.992        C    6 1.439    C    8 1.438    H   17 0.972    C    2 0.110
     8  C   3.993        C    1 1.446    C    7 1.438    H   18 0.971    C    5 0.111
     9  H   0.999        C    1 0.970
    10  H   0.999        C    3 0.974
    11  H   0.999        C    3 0.975
    12  H   0.999        C    4 0.988
    13  H   0.998        C    4 0.987
    14  H   0.999        C    4 0.989
    15  H   0.999        C    5 0.970
    16  H   0.999        C    6 0.971
    17  H   0.999        C    7 0.972
    18  H   0.999        C    8 0.971

molecular dipole:
                 x           y           z       tot (Debye)
 q only:        0.118       0.140      -0.035
   full:        0.116       0.137      -0.042       0.469
molecular quadrupole (traceless):
                xx          xy          yy          xz          yz          zz
 q only:        0.568       0.837       0.845      -0.294      -0.352      -1.413
  q+dip:        2.851       0.270       2.917      -0.130      -0.274      -5.768
   full:        1.405       0.521       1.561      -0.210      -0.304      -2.965

           -------------------------------------------------
          |                Geometry Summary                 |
           -------------------------------------------------

      molecular mass/u    :      106.1670000
   center of mass at/Å    :        0.5429819       0.6354816      -0.2883002
  moments of inertia/u·Å² :        0.1106262E+03   0.3378027E+03   0.4075975E+03
rotational constants/cm⁻¹ :        0.1523837E+00   0.4990378E-01   0.4135853E-01

 * 17 selected distances

     #   Z        #   Z                                     value/Å
     1   6 C      2   6 C                                 1.3892219
     3   6 C      4   6 C                                 1.5305166 (max)
     2   6 C      5   6 C                                 1.3889933
     5   6 C      6   6 C                                 1.3835893
     6   6 C      7   6 C                                 1.3842947
     1   6 C      8   6 C                                 1.3833864
     7   6 C      8   6 C                                 1.3844299
     1   6 C      9   1 H                                 1.0812455
     3   6 C     10   1 H                                 1.0919908
     3   6 C     11   1 H                                 1.0918863
     4   6 C     12   1 H                                 1.0876911
     4   6 C     13   1 H                                 1.0877234
     4   6 C     14   1 H                                 1.0877037
     5   6 C     15   1 H                                 1.0812486
     6   6 C     16   1 H                                 1.0806240
     7   6 C     17   1 H                                 1.0802159 (min)
     8   6 C     18   1 H                                 1.0806237

 * 2 distinct bonds (by element types)

   Z      Z             #   av. dist./Å        max./Å        min./Å
   1 H    6 C          10     1.0850953     1.0919908     1.0802159
   6 C    6 C           7     1.4063474     1.5305166     1.3833864


optimized geometry written to: xtbopt.xyz


           -------------------------------------------------
          | TOTAL ENERGY              -22.214835866019 Eh   |
          | GRADIENT NORM               0.000581138541 Eh/α |
          | HOMO-LUMO GAP               4.738625622611 eV   |
           -------------------------------------------------

------------------------------------------------------------------------
 * finished run on 2021/05/19 at 10:59:08.259     
------------------------------------------------------------------------
 total:
 * wall-time:     0 d,  0 h,  0 min,  0.124 sec
 *  cpu-time:     0 d,  0 h,  0 min,  0.123 sec
 * ratio c/w:     0.994 speedup
 SCF:
 * wall-time:     0 d,  0 h,  0 min,  0.017 sec
 *  cpu-time:     0 d,  0 h,  0 min,  0.017 sec
 * ratio c/w:     1.000 speedup
 ANC optimizer:
 * wall-time:     0 d,  0 h,  0 min,  0.092 sec
 *  cpu-time:     0 d,  0 h,  0 min,  0.092 sec
 * ratio c/w:     1.000 speedup

