      -----------------------------------------------------------      
     |                   =====================                   |     
     |                           x T B                           |     
     |                   =====================                   |     
     |                         S. Grimme                         |     
     |          Mulliken Center for Theoretical Chemistry        |     
     |                    University of Bonn                     |     
     |                Version 6.2 RC2 (SAW190805)                |     
      -----------------------------------------------------------      

   This program is distributed in the hope that it will be useful,
   but WITHOUT ANY WARRANTY; without even the implied warranty of
   MERCHANTABILITY or FITNESS FOR A PARTICULAR PURPOSE.
   
   FOR NON-COMMERCIAL, ACADEMIA USE ONLY.
   
   Cite this work as:
   * S. Grimme, C. Bannwarth, P. Shushkov, J. Chem. Theory Comput., 2017,
     13, 1989-2009. DOI: 10.1021/acs.jctc.7b00118
   * C. Bannwarth, S. Ehlert and S. Grimme., J. Chem. Theory Comput., 2019,
     15, 1652-1671. DOI: 10.1021/acs.jctc.8b01176
   * P. Pracht, E. Caldeweyher, S. Ehlert, S. Grimme, ChemRxiv, 2019, preprint.
     DOI: 10.26434/chemrxiv.8326202.v1
   
   for DFT-D4:
   * E. Caldeweyher, C. Bannwarth and S. Grimme, J. Chem. Phys., 2017,
     147, 034112. DOI: 10.1063/1.4993215
   * E. Caldeweyher, S. Ehlert, A. Hansen, H. Neugebauer, S. Spicher,
     C. Bannwarth and S. Grimme, J. Chem. Phys., 2019, 150, 154122.
     DOI: 10.1063/1.5090222
   
   for sTDA-xTB:
   * S. Grimme and C. Bannwarth, J. Chem. Phys., 2016, 145, 054103.
     DOI: 10.1063/1.4959605
   
   in the mass-spec context:
   * V. Asgeirsson, C. Bauer and S. Grimme, Chem. Sci., 2017, 8, 4879.
     DOI: 10.1039/c7sc00601b
   
   for metadynamics refer to:
   * S. Grimme, J. Chem. Theory Comput., 2019, 155, 2847-2862
     DOI: 10.1021/acs.jctc.9b00143
   
   with help from (in alphabetical order)
   C. Bannwarth, F. Bohle, G. Brandenburg, E. Caldeweyher, M. Checinski,
   S. Dohm, S. Ehlert, S. Ehrlich, F. März, H. Neugebauer, J. Pisarek,
   P. Pracht, P. Shushkov, and S. Spicher.
   
 * started run on 2021/05/19 at 10:59:09.745     

           -------------------------------------------------
          |                Calculation Setup                |
           -------------------------------------------------

          program call               : /ihome/ghutchison/geoffh/xtb/xtb 328.xyz -opt
          hostname                   : smp-n122
          coordinate file            : 328.xyz
          omp threads                :                     1
          number of atoms            :                    22
          number of electrons        :                    88
          charge                     :                     0
          spin                       :                   0.0
          first test random number   :      0.73152703939928


########################################################################
# WARNING! Please study the warnings concerning your input carefully
#  - the use of '-opt' is discouraged, please use '--opt' next time
########################################################################

           ------------------------------------------------- 
          |                 G F N 2 - x T B                 |
          | Geometry, Frequencies, Noncovalent interactions |
          |            JCTC 2019 parametrisation            |
           ------------------------------------------------- 
             KAB for C  - Si     :                1.0500
             KAB for H  - Pd     :                0.9500
             k(s)              :                1.8500
             k(p)              :                2.2300
             k(d)              :                2.2300
             k(f)              :                2.0000
             kEN (H0ij)        :               -2.0000
             D4 a1             :                0.5200
             D4 a2             :                5.0000
             D4 s6             :                1.0000
             D4 s8             :                2.7000
             D4 s9             :                5.0000
             alphaj            :                2.0000

  Z AO/shell   Hii/eV     exponent
  1     Wed Apr 25 08:07:45 CEST 2018   EN: 2.200 GM2: 0.406  GM3: 0.0800  RAES: 1.40
     1s    -10.707211    1.230000
  6     Wed Apr 25 08:07:45 CEST 2018   EN: 2.550 GM2: 0.538  GM3: 0.1500  RAES: 3.00
     2s    -13.970922    2.096432
     2p    -10.063292    1.800000
  8     Wed Apr 25 08:07:45 CEST 2018   EN: 3.440 GM2: 0.452  GM3:-0.0517  RAES: 1.80
     2s    -20.229985    2.439742
     2p    -15.503117    2.137023
 16     Tue Apr 24 11:44:34 CEST 2018   EN: 2.580 GM2: 0.340  GM3:-0.0502  RAES: 3.10
     3s    -20.029654    1.981333
     3p    -11.377694    2.025643
     3d     -0.420282    1.702555

           ------------------------------------------------- 
          |        Self-Consistent Charge Iterations        |
           ------------------------------------------------- 

          ...................................................
          :                      SETUP                      :
          :.................................................:
          :  # basis functions                  88          :
          :  # atomic orbitals                  86          :
          :  # shells                           42          :
          :  # electrons                        88          :
          :  max. iterations                   250          :
          :  Hamiltonian                  GFN2-xTB          :
          :  restarted?                      false          :
          :  GBSA solvation                  false          :
          :  PC potential                    false          :
          :  electronic temp.          300.0000000     K    :
          :  accuracy                    1.0000000          :
          :  -> integral cutoff          0.2500000E+02      :
          :  -> integral neglect         0.1000000E-07      :
          :  -> SCF convergence          0.1000000E-05 Eh   :
          :  -> wf. convergence          0.1000000E-03 e    :
          :  Broyden damping             0.4000000          :
          ...................................................

 iter      E             dE          RMSdq      gap      omega  full diag
   1    -50.9470729 -0.509471E+02  0.650E+00    2.08       0.0  T
   2    -51.0222735 -0.752006E-01  0.340E+00    1.56       1.0  T
   3    -51.0178882  0.438528E-02  0.202E+00    1.85       1.0  T
   4    -51.0464224 -0.285343E-01  0.490E-01    1.56       1.0  T
   5    -51.0465849 -0.162471E-03  0.289E-01    1.60       1.0  T
   6    -51.0473774 -0.792458E-03  0.101E-01    1.59       1.0  T
   7    -51.0475450 -0.167603E-03  0.334E-02    1.58       1.0  T
   8    -51.0475484 -0.347179E-05  0.170E-02    1.58       1.3  T
   9    -51.0475481  0.337576E-06  0.701E-03    1.58       3.0  T
  10    -51.0475493 -0.117566E-05  0.206E-03    1.58      10.4  T
  11    -51.0475493 -0.227920E-07  0.792E-04    1.58      26.9  T
  12    -51.0475493 -0.323591E-08  0.260E-04    1.58      82.1  T

   *** convergence criteria satisfied after 12 iterations ***

         #    Occupation            Energy/Eh            Energy/eV
      -------------------------------------------------------------
         1        2.0000           -0.7863633             -21.3980
       ...           ...                  ...                  ...
        38        2.0000           -0.4587010             -12.4819
        39        2.0000           -0.4569572             -12.4344
        40        2.0000           -0.4549350             -12.3794
        41        2.0000           -0.4529541             -12.3255
        42        2.0000           -0.4516024             -12.2887
        43        2.0000           -0.4492730             -12.2253
        44        2.0000           -0.4371646             -11.8959 (HOMO)
        45                         -0.3789479             -10.3117 (LUMO)
        46                         -0.3379586              -9.1963
        47                         -0.3364053              -9.1541
        48                         -0.2735172              -7.4428
        49                         -0.2607260              -7.0947
       ...                                ...                  ...
        86                          0.6627446              18.0342
      -------------------------------------------------------------
                  HL-Gap            0.0582167 Eh            1.5842 eV
             Fermi-level           -0.4080562 Eh          -11.1038 eV

 SCC (total)                   0 d,  0 h,  0 min,  0.093 sec
 SCC setup                      ...        0 min,  0.000 sec (  0.373%)
 Dispersion                     ...        0 min,  0.000 sec (  0.414%)
 integral evaluation            ...        0 min,  0.028 sec ( 29.747%)
 zeroth order Hamiltonian       ...        0 min,  0.000 sec (  0.290%)
 iterations                     ...        0 min,  0.032 sec ( 34.082%)
 molecular gradient             ...        0 min,  0.032 sec ( 34.600%)
 printout                       ...        0 min,  0.000 sec (  0.429%)

         :::::::::::::::::::::::::::::::::::::::::::::::::::::
         ::                     SUMMARY                     ::
         :::::::::::::::::::::::::::::::::::::::::::::::::::::
         :: total energy             -50.451804363559 Eh    ::
         :: gradient norm              0.118721124072 Eh/a0 ::
         :: HOMO-LUMO gap              1.584156908191 eV    ::
         ::.................................................::
         :: SCC energy               -51.047549308503 Eh    ::
         :: -> isotropic ES            0.092871895855 Eh    ::
         :: -> anisotropic ES          0.002428759985 Eh    ::
         :: -> anisotropic XC          0.010969607750 Eh    ::
         :: -> dispersion             -0.030916058877 Eh    ::
         :: repulsion energy           0.595580938265 Eh    ::
         :: add. restraining           0.000000000000 Eh    ::
         :::::::::::::::::::::::::::::::::::::::::::::::::::::

      ----------------------------------------------------------- 
     |                   =====================                   |
     |                        A N C O P T                        |
     |                   =====================                   |
     |               Approximate Normal Coordinate               |
     |                Rational Function Optimizer                |
      ----------------------------------------------------------- 

          ...................................................
          :                      SETUP                      :
          :.................................................:
          :   optimization level            normal          :
          :   max. optcycles                   200          :
          :   ANC micro-cycles                  20          :
          :   degrees of freedom                60          :
          :.................................................:
          :   RF solver                   davidson          :
          :   input Hessian                  false          :
          :   write xtbopt.log                true          :
          :   linear?                        false          :
          :   energy convergence         0.5000000E-05 Eh   :
          :   grad. convergence          0.1000000E-02 Eh/α :
          :   maximium RF displ.         2.0000000          :
          :   Hlow (freq-cutoff)         0.5000000E-02      :
          :   Hmax (freq-cutoff)         5.0000000          :
          :   S6 in model hess.         20.0000000          :
          ...................................................

generating ANC from model Hessian ...
Using Lindh-Hessian (1995)
 Shifting diagonal of input Hessian by   2.971007608141043E-003
 Lowest  eigenvalues of input Hessian
   -0.000000   -0.000000    0.000000    0.000000    0.000000    0.000000
    0.005000    0.006084    0.007232    0.007838    0.009365    0.015032
    0.020803    0.021212    0.021912    0.022077    0.029900    0.034623
 Highest eigenvalues
    1.966997    2.022456    2.179759    2.181892    2.211672    2.239100
 

........................................................................
.............................. CYCLE    1 ..............................
........................................................................
   1    -51.0475493 -0.510475E+02  0.114E-04    1.58       0.0  T
   2    -51.0475493 -0.371827E-10  0.727E-05    1.58     293.2  T
   3    -51.0475493 -0.301483E-10  0.446E-05    1.58     477.7  T
     SCC iter.                  ...        0 min,  0.005 sec
     gradient                   ...        0 min,  0.019 sec
 * total energy  :   -50.4518043 Eh     change        0.1727460E-07 Eh
   gradient norm :     0.1187201 Eh/α   predicted     0.0000000E+00 (-100.00%)
   displ. norm   :     0.1868460 α      lambda       -0.9478052E-02
   maximum displ.:     0.1108950 α      in ANC's #10, #27, #13, ...

........................................................................
.............................. CYCLE    2 ..............................
........................................................................
   1    -51.0715762 -0.510716E+02  0.362E-01    1.65       0.0  T
   2    -51.0722968 -0.720643E-03  0.151E-01    1.66       1.0  T
   3    -51.0723118 -0.149492E-04  0.772E-02    1.64       1.0  T
   4    -51.0722933  0.184821E-04  0.488E-02    1.65       1.0  T
   5    -51.0723270 -0.336960E-04  0.139E-02    1.65       1.5  T
   6    -51.0723281 -0.108361E-05  0.698E-03    1.65       3.1  T
   7    -51.0723284 -0.348897E-06  0.207E-03    1.65      10.3  T
   8    -51.0723285 -0.594211E-07  0.787E-04    1.65      27.1  T
     SCC iter.                  ...        0 min,  0.011 sec
     gradient                   ...        0 min,  0.018 sec
 * total energy  :   -50.4585577 Eh     change       -0.6753363E-02 Eh
   gradient norm :     0.0570136 Eh/α   predicted    -0.4904473E-02 ( -27.38%)
   displ. norm   :     0.2036703 α      lambda       -0.4682446E-02
   maximum displ.:     0.1182325 α      in ANC's #10, #27, #2, ...

........................................................................
.............................. CYCLE    3 ..............................
........................................................................
   1    -51.0853062 -0.510853E+02  0.347E-01    1.71       0.0  T
   2    -51.0860659 -0.759735E-03  0.146E-01    1.69       1.0  T
   3    -51.0860807 -0.148363E-04  0.805E-02    1.68       1.0  T
   4    -51.0860624  0.183049E-04  0.417E-02    1.68       1.0  T
   5    -51.0860892 -0.267351E-04  0.956E-03    1.68       2.2  T
   6    -51.0860898 -0.661174E-06  0.512E-03    1.68       4.2  T
   7    -51.0860901 -0.246524E-06  0.194E-03    1.68      11.0  T
     SCC iter.                  ...        0 min,  0.010 sec
     gradient                   ...        0 min,  0.018 sec
 * total energy  :   -50.4608185 Eh     change       -0.2260805E-02 Eh
   gradient norm :     0.0192058 Eh/α   predicted    -0.2438370E-02 (   7.85%)
   displ. norm   :     0.1221827 α      lambda       -0.9131107E-03
   maximum displ.:     0.0720511 α      in ANC's #13, #5, #15, ...

........................................................................
.............................. CYCLE    4 ..............................
........................................................................
   1    -51.0819350 -0.510819E+02  0.144E-01    1.67       0.0  T
   2    -51.0819680 -0.330205E-04  0.845E-02    1.68       1.0  T
   3    -51.0819527  0.153023E-04  0.522E-02    1.67       1.0  T
   4    -51.0819789 -0.261189E-04  0.201E-02    1.68       1.1  T
   5    -51.0819836 -0.469002E-05  0.530E-03    1.68       4.0  T
   6    -51.0819838 -0.243958E-06  0.229E-03    1.68       9.3  T
   7    -51.0819838 -0.400704E-07  0.712E-04    1.68      30.0  T
     SCC iter.                  ...        0 min,  0.010 sec
     gradient                   ...        0 min,  0.018 sec
 * total energy  :   -50.4611547 Eh     change       -0.3361658E-03 Eh
   gradient norm :     0.0125108 Eh/α   predicted    -0.4633710E-03 (  37.84%)
   displ. norm   :     0.0563273 α      lambda       -0.2300572E-03
   maximum displ.:     0.0390369 α      in ANC's #2, #13, #9, ...

........................................................................
.............................. CYCLE    5 ..............................
........................................................................
   1    -51.0798175 -0.510798E+02  0.531E-02    1.67       0.0  T
   2    -51.0798216 -0.419297E-05  0.277E-02    1.66       1.0  T
   3    -51.0798216  0.454091E-07  0.880E-03    1.67       2.4  T
   4    -51.0798220 -0.410754E-06  0.407E-03    1.67       5.2  T
   5    -51.0798221 -0.568384E-07  0.202E-03    1.67      10.6  T
   6    -51.0798221 -0.403153E-07  0.535E-04    1.67      39.9  T
     SCC iter.                  ...        0 min,  0.009 sec
     gradient                   ...        0 min,  0.018 sec
 * total energy  :   -50.4613015 Eh     change       -0.1467779E-03 Eh
   gradient norm :     0.0053706 Eh/α   predicted    -0.1154017E-03 ( -21.38%)
   displ. norm   :     0.0611830 α      lambda       -0.7054886E-04
   maximum displ.:     0.0489023 α      in ANC's #2, #5, #3, ...

........................................................................
.............................. CYCLE    6 ..............................
........................................................................
   1    -51.0792367 -0.510792E+02  0.684E-02    1.66       0.0  T
   2    -51.0792394 -0.272277E-05  0.344E-02    1.66       1.0  T
   3    -51.0792383  0.102834E-05  0.118E-02    1.66       1.8  T
   4    -51.0792396 -0.123804E-05  0.600E-03    1.66       3.6  T
   5    -51.0792400 -0.366061E-06  0.224E-03    1.66       9.5  T
   6    -51.0792400 -0.289214E-07  0.636E-04    1.66      33.5  T
     SCC iter.                  ...        0 min,  0.009 sec
     gradient                   ...        0 min,  0.018 sec
 * total energy  :   -50.4613453 Eh     change       -0.4389162E-04 Eh
   gradient norm :     0.0020981 Eh/α   predicted    -0.3540701E-04 ( -19.33%)
   displ. norm   :     0.0577458 α      lambda       -0.3188653E-04
   maximum displ.:     0.0452435 α      in ANC's #2, #5, #1, ...

........................................................................
.............................. CYCLE    7 ..............................
........................................................................
   1    -51.0792751 -0.510793E+02  0.534E-02    1.65       0.0  T
   2    -51.0792768 -0.161382E-05  0.290E-02    1.65       1.0  T
   3    -51.0792744  0.237937E-05  0.146E-02    1.65       1.5  T
   4    -51.0792772 -0.284488E-05  0.482E-03    1.65       4.4  T
   5    -51.0792774 -0.218926E-06  0.168E-03    1.65      12.7  T
   6    -51.0792774 -0.398837E-08  0.810E-04    1.65      26.3  T
   7    -51.0792775 -0.151375E-07  0.249E-04    1.65      85.7  T
     SCC iter.                  ...        0 min,  0.010 sec
     gradient                   ...        0 min,  0.019 sec
 * total energy  :   -50.4613650 Eh     change       -0.1962467E-04 Eh
   gradient norm :     0.0022025 Eh/α   predicted    -0.1599832E-04 ( -18.48%)
   displ. norm   :     0.0575941 α      lambda        0.1250014E-04
   maximum displ.:     0.0452481 α      in ANC's #2, #5, #3, ...

........................................................................
.............................. CYCLE    8 ..............................
........................................................................
   1    -51.0792100 -0.510792E+02  0.534E-02    1.65       0.0  T
   2    -51.0792116 -0.162360E-05  0.290E-02    1.65       1.0  T
   3    -51.0792092  0.239267E-05  0.147E-02    1.65       1.4  T
   4    -51.0792121 -0.287366E-05  0.480E-03    1.65       4.4  T
   5    -51.0792123 -0.213885E-06  0.169E-03    1.65      12.6  T
   6    -51.0792123 -0.450610E-08  0.832E-04    1.65      25.6  T
   7    -51.0792123 -0.159996E-07  0.249E-04    1.65      85.6  T
     SCC iter.                  ...        0 min,  0.010 sec
     gradient                   ...        0 min,  0.019 sec
 * total energy  :   -50.4613600 Eh     change        0.4972890E-05 Eh
   gradient norm :     0.0047824 Eh/α   predicted     0.6268050E-05 (  26.04%)
   displ. norm   :     0.0165172 α      lambda       -0.3306098E-04
   maximum displ.:     0.0086760 α      in ANC's #12, #7, #2, ...

........................................................................
.............................. CYCLE    9 ..............................
........................................................................
   1    -51.0796012 -0.510796E+02  0.388E-02    1.65       0.0  T
   2    -51.0796019 -0.783051E-06  0.187E-02    1.65       1.1  T
   3    -51.0796019  0.857600E-08  0.432E-03    1.65       4.9  T
   4    -51.0796021 -0.136415E-06  0.271E-03    1.65       7.9  T
   5    -51.0796021 -0.502845E-07  0.108E-03    1.65      19.8  T
     SCC iter.                  ...        0 min,  0.008 sec
     gradient                   ...        0 min,  0.018 sec
 * total energy  :   -50.4613820 Eh     change       -0.2199291E-04 Eh
   gradient norm :     0.0028843 Eh/α   predicted    -0.1653526E-04 ( -24.82%)
   displ. norm   :     0.0398441 α      lambda       -0.2007947E-04
   maximum displ.:     0.0324283 α      in ANC's #2, #5, #1, ...

........................................................................
.............................. CYCLE   10 ..............................
........................................................................
   1    -51.0798076 -0.510798E+02  0.355E-02    1.66       0.0  T
   2    -51.0798082 -0.587980E-06  0.195E-02    1.66       1.1  T
   3    -51.0798070  0.123346E-05  0.101E-02    1.66       2.1  T
   4    -51.0798085 -0.151743E-05  0.272E-03    1.66       7.8  T
   5    -51.0798085 -0.412673E-07  0.111E-03    1.66      19.3  T
   6    -51.0798086 -0.108923E-07  0.467E-04    1.66      45.7  T
   7    -51.0798086 -0.495424E-08  0.136E-04    1.66     157.2  T
     SCC iter.                  ...        0 min,  0.010 sec
     gradient                   ...        0 min,  0.019 sec
 * total energy  :   -50.4613974 Eh     change       -0.1541779E-04 Eh
   gradient norm :     0.0014485 Eh/α   predicted    -0.1005730E-04 ( -34.77%)
   displ. norm   :     0.1051567 α      lambda       -0.1995488E-04
   maximum displ.:     0.0845142 α      in ANC's #2, #5, #1, ...

........................................................................
.............................. CYCLE   11 ..............................
........................................................................
   1    -51.0796567 -0.510797E+02  0.821E-02    1.66       0.0  T
   2    -51.0796584 -0.170794E-05  0.473E-02    1.67       1.0  T
   3    -51.0796474  0.110465E-04  0.284E-02    1.66       1.0  T
   4    -51.0796607 -0.132849E-04  0.443E-03    1.66       4.8  T
   5    -51.0796607 -0.784843E-07  0.208E-03    1.67      10.2  T
   6    -51.0796608 -0.563542E-07  0.887E-04    1.67      24.0  T
   7    -51.0796608 -0.163468E-07  0.271E-04    1.67      78.8  T
     SCC iter.                  ...        0 min,  0.010 sec
     gradient                   ...        0 min,  0.019 sec
 * total energy  :   -50.4614173 Eh     change       -0.1987016E-04 Eh
   gradient norm :     0.0015931 Eh/α   predicted    -0.1002877E-04 ( -49.53%)
   displ. norm   :     0.0733939 α      lambda       -0.1015099E-04
   maximum displ.:     0.0608309 α      in ANC's #2, #5, #1, ...

........................................................................
.............................. CYCLE   12 ..............................
........................................................................
   1    -51.0794070 -0.510794E+02  0.557E-02    1.67       0.0  T
   2    -51.0794074 -0.411688E-06  0.318E-02    1.67       1.0  T
   3    -51.0794022  0.518947E-05  0.190E-02    1.67       1.1  T
   4    -51.0794083 -0.613457E-05  0.276E-03    1.67       7.7  T
   5    -51.0794083  0.255470E-07  0.145E-03    1.67      14.7  T
   6    -51.0794084 -0.558365E-07  0.327E-04    1.67      65.2  T
   7    -51.0794084 -0.914454E-09  0.181E-04    1.67     117.9  T
     SCC iter.                  ...        0 min,  0.010 sec
     gradient                   ...        0 min,  0.019 sec
 * total energy  :   -50.4614280 Eh     change       -0.1069133E-04 Eh
   gradient norm :     0.0009219 Eh/α   predicted    -0.5089221E-05 ( -52.40%)
   displ. norm   :     0.0487847 α      lambda       -0.5093297E-05
   maximum displ.:     0.0424462 α      in ANC's #2, #5, #9, ...

........................................................................
.............................. CYCLE   13 ..............................
........................................................................
   1    -51.0793627 -0.510794E+02  0.369E-02    1.67       0.0  T
   2    -51.0793630 -0.226578E-06  0.211E-02    1.67       1.0  T
   3    -51.0793610  0.197410E-05  0.114E-02    1.67       1.9  T
   4    -51.0793633 -0.230317E-05  0.206E-03    1.67      10.3  T
   5    -51.0793633 -0.627181E-08  0.831E-04    1.67      25.7  T
   6    -51.0793633 -0.123134E-07  0.319E-04    1.67      66.8  T
     SCC iter.                  ...        0 min,  0.009 sec
     gradient                   ...        0 min,  0.019 sec
 * total energy  :   -50.4614323 Eh     change       -0.4298216E-05 Eh
   gradient norm :     0.0005023 Eh/α   predicted    -0.2553110E-05 ( -40.60%)
   displ. norm   :     0.0230362 α      lambda       -0.1863101E-05
   maximum displ.:     0.0214816 α      in ANC's #2, #5, #8, ...

   *** GEOMETRY OPTIMIZATION CONVERGED AFTER 13 ITERATIONS ***

------------------------------------------------------------------------
 total energy gain   :        -0.0096279 Eh       -6.0416 kcal/mol
 total RMSD          :         0.1512796 a0        0.0801 Å
 total power (kW/mol):        -1.9444669 (step)  -44.9075 (real)
------------------------------------------------------------------------

 ANCopt (total)                0 d,  0 h,  0 min,  0.563 sec
 optimizer setup                ...        0 min,  0.000 sec (  0.026%)
 model hessian                  ...        0 min,  0.003 sec (  0.541%)
 ANC generation                 ...        0 min,  0.001 sec (  0.104%)
 coordinate transformation      ...        0 min,  0.000 sec (  0.035%)
 single point calculation       ...        0 min,  0.555 sec ( 98.569%)
 optimization log               ...        0 min,  0.001 sec (  0.212%)
 hessian update                 ...        0 min,  0.000 sec (  0.030%)
 rational function              ...        0 min,  0.002 sec (  0.319%)

================
 final structure:
================
$coord
   -0.03729616014679    2.68153516414018    0.19409396145619      C 
    2.17160935316681    1.27668783524384    0.10753351582427      C 
    4.72273658873152    2.42160331266601    0.18749188360861      C 
    5.23993636599599    4.60844850255827    0.33065535118986      O 
    7.02370340240560   -0.06319911551545    0.03493503329846      S 
    4.67082324574429   -2.51986901050155   -0.09324404172371      C 
    5.19985861400496   -4.70924104438012   -0.18441593449452      O 
    2.13524870630577   -1.35011424238657   -0.05458941360303      C 
   -0.13194353191957   -2.73050118513577   -0.12806956354497      C 
   -2.35894636124300   -1.28404798973753   -0.10298622242073      C 
   -2.28826986532047    1.34532169275388    0.06596330908819      C 
   -4.78426030396682    2.60988565687287    0.06906233390215      C 
   -5.19543912116243    4.81733185360555    0.25006920653712      O 
   -7.18534723827612    0.25211825127542   -0.26481733991665      S 
   -4.94383446174476   -2.31677219717659   -0.40578109320503      C 
   -5.59368108247362   -4.44371074146574   -0.75241825591840      O 
   -0.09575057715627   -5.48718649740812   -0.22932135409487      C 
   -1.31795847182068   -6.96790272442341    1.37628001345442      C 
   -0.01090531927581    4.71511007125170    0.33322733968498      H 
    1.13886852496856   -6.28984367644472   -1.64703118980428      H 
   -2.46387018633991   -6.22525252163435    2.88556059195127      H 
   -1.18275422387034   -8.99114122375654    1.24961453694701      H 
$end
           -------------------------------------------------
          |                Final Singlepoint                |
           -------------------------------------------------

          ...................................................
          :                      SETUP                      :
          :.................................................:
          :  # basis functions                  88          :
          :  # atomic orbitals                  86          :
          :  # shells                           42          :
          :  # electrons                        88          :
          :  max. iterations                   250          :
          :  Hamiltonian                  GFN2-xTB          :
          :  restarted?                      false          :
          :  GBSA solvation                  false          :
          :  PC potential                    false          :
          :  electronic temp.          300.0000000     K    :
          :  accuracy                    1.0000000          :
          :  -> integral cutoff          0.2500000E+02      :
          :  -> integral neglect         0.1000000E-07      :
          :  -> SCF convergence          0.1000000E-05 Eh   :
          :  -> wf. convergence          0.1000000E-03 e    :
          :  Broyden damping             0.4000000          :
          ...................................................

 iter      E             dE          RMSdq      gap      omega  full diag
   1    -51.0793633 -0.510794E+02  0.143E-04    1.67       0.0  T
   2    -51.0793633 -0.232845E-10  0.690E-05    1.67     308.9  T
   3    -51.0793633  0.647304E-11  0.607E-05    1.67     351.3  T

   *** convergence criteria satisfied after 3 iterations ***

         #    Occupation            Energy/Eh            Energy/eV
      -------------------------------------------------------------
         1        2.0000           -0.7780709             -21.1724
       ...           ...                  ...                  ...
        38        2.0000           -0.4591979             -12.4954
        39        2.0000           -0.4570934             -12.4381
        40        2.0000           -0.4528939             -12.3239
        41        2.0000           -0.4497453             -12.2382
        42        2.0000           -0.4445311             -12.0963
        43        2.0000           -0.4405566             -11.9882
        44        2.0000           -0.4372845             -11.8991 (HOMO)
        45                         -0.3760028             -10.2316 (LUMO)
        46                         -0.3362293              -9.1493
        47                         -0.3315655              -9.0224
        48                         -0.2703900              -7.3577
        49                         -0.2586022              -7.0369
       ...                                ...                  ...
        86                          0.7003743              19.0582
      -------------------------------------------------------------
                  HL-Gap            0.0612817 Eh            1.6676 eV
             Fermi-level           -0.4066436 Eh          -11.0653 eV

 SCC (total)                   0 d,  0 h,  0 min,  0.066 sec
 SCC setup                      ...        0 min,  0.000 sec (  0.402%)
 Dispersion                     ...        0 min,  0.000 sec (  0.425%)
 integral evaluation            ...        0 min,  0.014 sec ( 21.418%)
 zeroth order Hamiltonian       ...        0 min,  0.000 sec (  0.346%)
 iterations                     ...        0 min,  0.018 sec ( 27.773%)
 molecular gradient             ...        0 min,  0.032 sec ( 49.002%)
 printout                       ...        0 min,  0.000 sec (  0.561%)

         :::::::::::::::::::::::::::::::::::::::::::::::::::::
         ::                     SUMMARY                     ::
         :::::::::::::::::::::::::::::::::::::::::::::::::::::
         :: total energy             -50.461432265718 Eh    ::
         :: gradient norm              0.000499899992 Eh/a0 ::
         :: HOMO-LUMO gap              1.667559217474 eV    ::
         ::.................................................::
         :: SCC energy               -51.079363320843 Eh    ::
         :: -> isotropic ES            0.084548305319 Eh    ::
         :: -> anisotropic ES          0.001555908281 Eh    ::
         :: -> anisotropic XC          0.011737994923 Eh    ::
         :: -> dispersion             -0.030886951474 Eh    ::
         :: repulsion energy           0.617775493478 Eh    ::
         :: add. restraining           0.000000000000 Eh    ::
         :::::::::::::::::::::::::::::::::::::::::::::::::::::

           -------------------------------------------------
          |                Property Printout                |
           -------------------------------------------------

    * Orbital Energies and Occupations

         #    Occupation            Energy/Eh            Energy/eV
      -------------------------------------------------------------
         1        2.0000           -0.7780709             -21.1724
       ...           ...                  ...                  ...
        32        2.0000           -0.5376368             -14.6298
        33        2.0000           -0.5226358             -14.2216
        34        2.0000           -0.5073910             -13.8068
        35        2.0000           -0.4924180             -13.3994
        36        2.0000           -0.4879915             -13.2789
        37        2.0000           -0.4757828             -12.9467
        38        2.0000           -0.4591979             -12.4954
        39        2.0000           -0.4570934             -12.4381
        40        2.0000           -0.4528939             -12.3239
        41        2.0000           -0.4497453             -12.2382
        42        2.0000           -0.4445311             -12.0963
        43        2.0000           -0.4405566             -11.9882
        44        2.0000           -0.4372845             -11.8991 (HOMO)
        45                         -0.3760028             -10.2316 (LUMO)
        46                         -0.3362293              -9.1493
        47                         -0.3315655              -9.0224
        48                         -0.2703900              -7.3577
        49                         -0.2586022              -7.0369
        50                         -0.2581555              -7.0248
        51                         -0.2440632              -6.6413
        52                         -0.2329091              -6.3378
        53                         -0.2300539              -6.2601
        54                         -0.1711232              -4.6565
        55                         -0.1660876              -4.5195
       ...                                ...                  ...
        86                          0.7003743              19.0582
      -------------------------------------------------------------
                  HL-Gap            0.0612817 Eh            1.6676 eV
             Fermi-level           -0.4066436 Eh          -11.0653 eV

     #   Z        covCN         q      C6AA      α(0)
     1   6 C      2.914    -0.004    28.125     8.696
     2   6 C      3.074     0.002    27.904     8.661
     3   6 C      2.820     0.257    22.688     7.804
     4   8 O      0.869    -0.289    19.578     5.933
     5  16 S      2.129    -0.067   143.838    20.185
     6   6 C      2.822     0.257    22.688     7.805
     7   8 O      0.870    -0.296    19.702     5.951
     8   6 C      3.065    -0.010    28.200     8.708
     9   6 C      2.967     0.055    26.765     8.486
    10   6 C      3.057    -0.007    28.148     8.701
    11   6 C      3.077     0.002    27.905     8.661
    12   6 C      2.820     0.257    22.688     7.804
    13   8 O      0.869    -0.291    19.616     5.938
    14  16 S      2.128    -0.068   143.880    20.188
    15   6 C      2.821     0.258    22.656     7.799
    16   8 O      0.871    -0.292    19.626     5.940
    17   6 C      2.892    -0.024    28.610     8.770
    18   6 C      2.840    -0.059    29.452     8.894
    19   1 H      0.926     0.101     1.774     2.083
    20   1 H      0.925     0.085     1.926     2.170
    21   1 H      0.926     0.060     2.198     2.318
    22   1 H      0.926     0.074     2.047     2.237

 Mol. C6AA /au·bohr⁶  :      11774.501764
 Mol. C8AA /au·bohr⁸  :     355419.412015
 Mol. α(0) /au        :        173.733425


Wiberg/Mayer (AO) data.
largest (>0.10) Wiberg bond orders for each atom
          total WBO             WBO to atom ...
     1  C   3.981        C    2 1.391    C   11 1.390    H   19 0.958
     2  C   3.988        C    1 1.391    C    8 1.354    C    3 1.002
     3  C   3.938        O    4 1.862    S    5 1.012    C    2 1.002
     4  O   2.187        C    3 1.862    S    5 0.177
     5  S   2.479        C    3 1.012    C    6 1.001    O    4 0.177    O    7 0.171
     6  C   3.938        O    7 1.852    C    8 1.017    S    5 1.001
     7  O   2.185        C    6 1.852    S    5 0.171
     8  C   3.988        C    2 1.354    C    9 1.327    C    6 1.017
     9  C   3.979        C   10 1.328    C    8 1.327    C   17 1.074
    10  C   3.987        C   11 1.355    C    9 1.328    C   15 1.011
    11  C   3.989        C    1 1.390    C   10 1.355    C   12 1.001
    12  C   3.938        O   13 1.858    S   14 1.018    C   11 1.001
    13  O   2.184        C   12 1.858    S   14 0.178
    14  S   2.484        C   12 1.018    C   15 0.994    O   13 0.178    O   16 0.172
    15  C   3.936        O   16 1.863    C   10 1.011    S   14 0.994
    16  O   2.191        C   15 1.863    S   14 0.172
    17  C   3.985        C   18 1.922    C    9 1.074    H   20 0.939
    18  C   3.978        C   17 1.922    H   21 0.974    H   22 0.973
    19  H   0.988        C    1 0.958
    20  H   0.992        C   17 0.939
    21  H   0.996        C   18 0.974
    22  H   0.994        C   18 0.973

molecular dipole:
                 x           y           z       tot (Debye)
 q only:       -0.055      -0.695       0.135
   full:       -0.036      -0.626       0.142       1.635
molecular quadrupole (traceless):
                xx          xy          yy          xz          yz          zz
 q only:      -11.955       1.029      -0.660      -1.879      -2.800      12.615
  q+dip:      -14.894       0.873      -2.185      -3.193      -3.335      17.080
   full:      -16.672       0.883      -4.803      -2.548      -3.717      21.475

           -------------------------------------------------
          |                Geometry Summary                 |
           -------------------------------------------------

      molecular mass/u    :      276.2812000
   center of mass at/Å    :       -0.0774356      -0.2959108       0.0031108
  moments of inertia/u·Å² :        0.8482099E+03   0.1808722E+04   0.2627993E+04
rotational constants/cm⁻¹ :        0.1987436E-01   0.9320189E-02   0.6414640E-02

 * 15 selected distances

     #   Z        #   Z                                     value/Å
     1   6 C      2   6 C                                 1.3860356
     3   6 C      4   8 O                                 1.1915638
     6   6 C      7   8 O                                 1.1928858
     2   6 C      8   6 C                                 1.3928218
     8   6 C      9   6 C                                 1.4051652
     9   6 C     10   6 C                                 1.4053017 (max)
     1   6 C     11   6 C                                 1.3868853
    10   6 C     11   6 C                                 1.3947735
    12   6 C     13   8 O                                 1.1920768
    15   6 C     16   8 O                                 1.1910986
    17   6 C     18   6 C                                 1.3244524
     1   6 C     19   1 H                                 1.0787277
    17   6 C     20   1 H                                 1.0817041
    18   6 C     21   1 H                                 1.0770507
    18   6 C     22   1 H                                 1.0751312 (min)

 * 3 distinct bonds (by element types)

   Z      Z             #   av. dist./Å        max./Å        min./Å
   1 H    6 C           4     1.0781534     1.0817041     1.0751312
   6 C    6 C           7     1.3850622     1.4053017     1.3244524
   6 C    8 O           4     1.1919062     1.1928858     1.1910986


optimized geometry written to: xtbopt.xyz


           -------------------------------------------------
          | TOTAL ENERGY              -50.461432265718 Eh   |
          | GRADIENT NORM               0.000499899992 Eh/α |
          | HOMO-LUMO GAP               1.667559217474 eV   |
           -------------------------------------------------

------------------------------------------------------------------------
 * finished run on 2021/05/19 at 10:59:10.519     
------------------------------------------------------------------------
 total:
 * wall-time:     0 d,  0 h,  0 min,  0.774 sec
 *  cpu-time:     0 d,  0 h,  0 min,  0.684 sec
 * ratio c/w:     0.883 speedup
 SCF:
 * wall-time:     0 d,  0 h,  0 min,  0.094 sec
 *  cpu-time:     0 d,  0 h,  0 min,  0.055 sec
 * ratio c/w:     0.583 speedup
 ANC optimizer:
 * wall-time:     0 d,  0 h,  0 min,  0.629 sec
 *  cpu-time:     0 d,  0 h,  0 min,  0.603 sec
 * ratio c/w:     0.959 speedup

