      -----------------------------------------------------------      
     |                   =====================                   |     
     |                           x T B                           |     
     |                   =====================                   |     
     |                         S. Grimme                         |     
     |          Mulliken Center for Theoretical Chemistry        |     
     |                    University of Bonn                     |     
     |                Version 6.2 RC2 (SAW190805)                |     
      -----------------------------------------------------------      

   This program is distributed in the hope that it will be useful,
   but WITHOUT ANY WARRANTY; without even the implied warranty of
   MERCHANTABILITY or FITNESS FOR A PARTICULAR PURPOSE.
   
   FOR NON-COMMERCIAL, ACADEMIA USE ONLY.
   
   Cite this work as:
   * S. Grimme, C. Bannwarth, P. Shushkov, J. Chem. Theory Comput., 2017,
     13, 1989-2009. DOI: 10.1021/acs.jctc.7b00118
   * C. Bannwarth, S. Ehlert and S. Grimme., J. Chem. Theory Comput., 2019,
     15, 1652-1671. DOI: 10.1021/acs.jctc.8b01176
   * P. Pracht, E. Caldeweyher, S. Ehlert, S. Grimme, ChemRxiv, 2019, preprint.
     DOI: 10.26434/chemrxiv.8326202.v1
   
   for DFT-D4:
   * E. Caldeweyher, C. Bannwarth and S. Grimme, J. Chem. Phys., 2017,
     147, 034112. DOI: 10.1063/1.4993215
   * E. Caldeweyher, S. Ehlert, A. Hansen, H. Neugebauer, S. Spicher,
     C. Bannwarth and S. Grimme, J. Chem. Phys., 2019, 150, 154122.
     DOI: 10.1063/1.5090222
   
   for sTDA-xTB:
   * S. Grimme and C. Bannwarth, J. Chem. Phys., 2016, 145, 054103.
     DOI: 10.1063/1.4959605
   
   in the mass-spec context:
   * V. Asgeirsson, C. Bauer and S. Grimme, Chem. Sci., 2017, 8, 4879.
     DOI: 10.1039/c7sc00601b
   
   for metadynamics refer to:
   * S. Grimme, J. Chem. Theory Comput., 2019, 155, 2847-2862
     DOI: 10.1021/acs.jctc.9b00143
   
   with help from (in alphabetical order)
   C. Bannwarth, F. Bohle, G. Brandenburg, E. Caldeweyher, M. Checinski,
   S. Dohm, S. Ehlert, S. Ehrlich, F. März, H. Neugebauer, J. Pisarek,
   P. Pracht, P. Shushkov, and S. Spicher.
   
 * started run on 2021/05/19 at 10:59:12.032     

           -------------------------------------------------
          |                Calculation Setup                |
           -------------------------------------------------

          program call               : /ihome/ghutchison/geoffh/xtb/xtb 332.xyz -opt
          hostname                   : smp-n122
          coordinate file            : 332.xyz
          omp threads                :                     1
          number of atoms            :                    24
          number of electrons        :                    66
          charge                     :                     0
          spin                       :                   0.0
          first test random number   :      0.10705168503308


########################################################################
# WARNING! Please study the warnings concerning your input carefully
#  - the use of '-opt' is discouraged, please use '--opt' next time
########################################################################

           ------------------------------------------------- 
          |                 G F N 2 - x T B                 |
          | Geometry, Frequencies, Noncovalent interactions |
          |            JCTC 2019 parametrisation            |
           ------------------------------------------------- 
             KAB for C  - Si     :                1.0500
             KAB for H  - Pd     :                0.9500
             k(s)              :                1.8500
             k(p)              :                2.2300
             k(d)              :                2.2300
             k(f)              :                2.0000
             kEN (H0ij)        :               -2.0000
             D4 a1             :                0.5200
             D4 a2             :                5.0000
             D4 s6             :                1.0000
             D4 s8             :                2.7000
             D4 s9             :                5.0000
             alphaj            :                2.0000

  Z AO/shell   Hii/eV     exponent
  1     Wed Apr 25 08:07:45 CEST 2018   EN: 2.200 GM2: 0.406  GM3: 0.0800  RAES: 1.40
     1s    -10.707211    1.230000
  6     Wed Apr 25 08:07:45 CEST 2018   EN: 2.550 GM2: 0.538  GM3: 0.1500  RAES: 3.00
     2s    -13.970922    2.096432
     2p    -10.063292    1.800000

           ------------------------------------------------- 
          |        Self-Consistent Charge Iterations        |
           ------------------------------------------------- 

          ...................................................
          :                      SETUP                      :
          :.................................................:
          :  # basis functions                  66          :
          :  # atomic orbitals                  66          :
          :  # shells                           38          :
          :  # electrons                        66          :
          :  max. iterations                   250          :
          :  Hamiltonian                  GFN2-xTB          :
          :  restarted?                      false          :
          :  GBSA solvation                  false          :
          :  PC potential                    false          :
          :  electronic temp.          300.0000000     K    :
          :  accuracy                    1.0000000          :
          :  -> integral cutoff          0.2500000E+02      :
          :  -> integral neglect         0.1000000E-07      :
          :  -> SCF convergence          0.1000000E-05 Eh   :
          :  -> wf. convergence          0.1000000E-03 e    :
          :  Broyden damping             0.4000000          :
          ...................................................

 iter      E             dE          RMSdq      gap      omega  full diag
   1    -35.7095054 -0.357095E+02  0.491E+00    2.89       0.0  T
   2    -35.7274070 -0.179017E-01  0.293E+00    2.88       1.0  T
   3    -35.7142935  0.131136E-01  0.820E-01    2.88       1.0  T
   4    -35.7287154 -0.144219E-01  0.268E-01    2.88       1.0  T
   5    -35.7305337 -0.181835E-02  0.579E-02    2.88       1.0  T
   6    -35.7305794 -0.456121E-04  0.287E-02    2.88       1.0  T
   7    -35.7305808 -0.142057E-05  0.631E-03    2.88       3.2  T
   8    -35.7305818 -0.984224E-06  0.129E-03    2.88      15.8  T
   9    -35.7305818 -0.349153E-07  0.416E-04    2.88      49.1  T
  10    -35.7305818 -0.960931E-09  0.200E-04    2.88     102.3  T

   *** convergence criteria satisfied after 10 iterations ***

         #    Occupation            Energy/Eh            Energy/eV
      -------------------------------------------------------------
         1        2.0000           -0.6490781             -17.6623
       ...           ...                  ...                  ...
        27        2.0000           -0.4321079             -11.7583
        28        2.0000           -0.4224594             -11.4957
        29        2.0000           -0.4120422             -11.2122
        30        2.0000           -0.4109640             -11.1829
        31        2.0000           -0.4082469             -11.1090
        32        2.0000           -0.3835203             -10.4361
        33        2.0000           -0.3711008             -10.0982 (HOMO)
        34                         -0.2653232              -7.2198 (LUMO)
        35                         -0.2506246              -6.8198
        36                         -0.2088166              -5.6822
        37                         -0.1920692              -5.2265
        38                         -0.1611491              -4.3851
       ...                                ...                  ...
        66                          0.7079062              19.2631
      -------------------------------------------------------------
                  HL-Gap            0.1057776 Eh            2.8784 eV
             Fermi-level           -0.3182120 Eh           -8.6590 eV

 SCC (total)                   0 d,  0 h,  0 min,  0.060 sec
 SCC setup                      ...        0 min,  0.000 sec (  0.475%)
 Dispersion                     ...        0 min,  0.000 sec (  0.670%)
 integral evaluation            ...        0 min,  0.008 sec ( 13.685%)
 zeroth order Hamiltonian       ...        0 min,  0.000 sec (  0.261%)
 iterations                     ...        0 min,  0.025 sec ( 41.004%)
 molecular gradient             ...        0 min,  0.026 sec ( 43.199%)
 printout                       ...        0 min,  0.000 sec (  0.620%)

         :::::::::::::::::::::::::::::::::::::::::::::::::::::
         ::                     SUMMARY                     ::
         :::::::::::::::::::::::::::::::::::::::::::::::::::::
         :: total energy             -35.066096650543 Eh    ::
         :: gradient norm              0.087250875682 Eh/a0 ::
         :: HOMO-LUMO gap              2.878356291697 eV    ::
         ::.................................................::
         :: SCC energy               -35.730581796700 Eh    ::
         :: -> isotropic ES            0.001325498406 Eh    ::
         :: -> anisotropic ES          0.004566647191 Eh    ::
         :: -> anisotropic XC          0.023347366129 Eh    ::
         :: -> dispersion             -0.025930508742 Eh    ::
         :: repulsion energy           0.664456095432 Eh    ::
         :: add. restraining           0.000000000000 Eh    ::
         :::::::::::::::::::::::::::::::::::::::::::::::::::::

      ----------------------------------------------------------- 
     |                   =====================                   |
     |                        A N C O P T                        |
     |                   =====================                   |
     |               Approximate Normal Coordinate               |
     |                Rational Function Optimizer                |
      ----------------------------------------------------------- 

          ...................................................
          :                      SETUP                      :
          :.................................................:
          :   optimization level            normal          :
          :   max. optcycles                   200          :
          :   ANC micro-cycles                  20          :
          :   degrees of freedom                66          :
          :.................................................:
          :   RF solver                   davidson          :
          :   input Hessian                  false          :
          :   write xtbopt.log                true          :
          :   linear?                        false          :
          :   energy convergence         0.5000000E-05 Eh   :
          :   grad. convergence          0.1000000E-02 Eh/α :
          :   maximium RF displ.         2.0000000          :
          :   Hlow (freq-cutoff)         0.5000000E-02      :
          :   Hmax (freq-cutoff)         5.0000000          :
          :   S6 in model hess.         20.0000000          :
          ...................................................

generating ANC from model Hessian ...
Using Lindh-Hessian (1995)
 Shifting diagonal of input Hessian by   2.560115128771100E-003
 Lowest  eigenvalues of input Hessian
   -0.000000   -0.000000   -0.000000   -0.000000    0.000000    0.000000
    0.005000    0.005337    0.010583    0.012082    0.013852    0.018010
    0.019137    0.022742    0.023636    0.028046    0.043175    0.045233
 Highest eigenvalues
    1.838566    1.853439    1.916925    1.945004    2.032846    2.086053
 

........................................................................
.............................. CYCLE    1 ..............................
........................................................................
   1    -35.7305818 -0.357306E+02  0.318E-05    2.88       0.0  T
   2    -35.7305818 -0.446931E-11  0.245E-05    2.88     832.6  T
   3    -35.7305818 -0.112550E-10  0.897E-06    2.88    2276.7  T
     SCC iter.                  ...        0 min,  0.017 sec
     gradient                   ...        0 min,  0.013 sec
 * total energy  :   -35.0660967 Eh     change       -0.2311625E-07 Eh
   gradient norm :     0.0872510 Eh/α   predicted     0.0000000E+00 (-100.00%)
   displ. norm   :     0.2147939 α      lambda       -0.7245030E-02
   maximum displ.:     0.1413373 α      in ANC's #5, #13, #32, ...

........................................................................
.............................. CYCLE    2 ..............................
........................................................................
   1    -35.7606964 -0.357607E+02  0.111E-01    3.06       0.0  T
   2    -35.7607365 -0.401183E-04  0.722E-02    3.06       1.0  T
   3    -35.7607459 -0.937251E-05  0.383E-02    3.06       1.0  T
   4    -35.7607589 -0.129916E-04  0.801E-03    3.06       2.5  T
   5    -35.7607604 -0.145067E-05  0.251E-03    3.06       8.1  T
   6    -35.7607604 -0.171927E-07  0.934E-04    3.06      21.9  T
     SCC iter.                  ...        0 min,  0.006 sec
     gradient                   ...        0 min,  0.012 sec
 * total energy  :   -35.0708810 Eh     change       -0.4784323E-02 Eh
   gradient norm :     0.0319981 Eh/α   predicted    -0.3789647E-02 ( -20.79%)
   displ. norm   :     0.1335234 α      lambda       -0.1367189E-02
   maximum displ.:     0.1078183 α      in ANC's #5, #13, #2, ...

........................................................................
.............................. CYCLE    3 ..............................
........................................................................
   1    -35.7710537 -0.357711E+02  0.623E-02    3.16       0.0  T
   2    -35.7710664 -0.126742E-04  0.392E-02    3.16       1.0  T
   3    -35.7710689 -0.256765E-05  0.218E-02    3.16       1.0  T
   4    -35.7710734 -0.450664E-05  0.446E-03    3.16       4.6  T
   5    -35.7710739 -0.504120E-06  0.131E-03    3.16      15.5  T
     SCC iter.                  ...        0 min,  0.006 sec
     gradient                   ...        0 min,  0.012 sec
 * total energy  :   -35.0716313 Eh     change       -0.7502696E-03 Eh
   gradient norm :     0.0061209 Eh/α   predicted    -0.6957874E-03 (  -7.26%)
   displ. norm   :     0.0438522 α      lambda       -0.9455859E-04
   maximum displ.:     0.0252471 α      in ANC's #2, #5, #24, ...

........................................................................
.............................. CYCLE    4 ..............................
........................................................................
   1    -35.7699025 -0.357699E+02  0.190E-02    3.17       0.0  T
   2    -35.7699027 -0.239469E-06  0.112E-02    3.17       1.8  T
   3    -35.7699020  0.692517E-06  0.609E-03    3.17       3.3  T
   4    -35.7699029 -0.913150E-06  0.721E-04    3.17      28.3  T
   5    -35.7699029 -0.101879E-07  0.246E-04    3.17      82.9  T
     SCC iter.                  ...        0 min,  0.006 sec
     gradient                   ...        0 min,  0.012 sec
 * total energy  :   -35.0716940 Eh     change       -0.6270654E-04 Eh
   gradient norm :     0.0024723 Eh/α   predicted    -0.4737394E-04 ( -24.45%)
   displ. norm   :     0.0354302 α      lambda       -0.2453234E-04
   maximum displ.:     0.0294138 α      in ANC's #2, #1, #24, ...

........................................................................
.............................. CYCLE    5 ..............................
........................................................................
   1    -35.7689903 -0.357690E+02  0.180E-02    3.17       0.0  T
   2    -35.7689903 -0.322714E-07  0.106E-02    3.17       1.9  T
   3    -35.7689901  0.253066E-06  0.297E-03    3.17       6.9  T
   4    -35.7689904 -0.286513E-06  0.248E-04    3.17      82.3  T
   5    -35.7689904 -0.820854E-09  0.113E-04    3.17     181.2  T
     SCC iter.                  ...        0 min,  0.006 sec
     gradient                   ...        0 min,  0.013 sec
 * total energy  :   -35.0717089 Eh     change       -0.1493875E-04 Eh
   gradient norm :     0.0005807 Eh/α   predicted    -0.1228313E-04 ( -17.78%)
   displ. norm   :     0.0372110 α      lambda       -0.5075246E-05
   maximum displ.:     0.0324394 α      in ANC's #2, #1, #5, ...

........................................................................
.............................. CYCLE    6 ..............................
........................................................................
   1    -35.7687539 -0.357688E+02  0.188E-02    3.17       0.0  T
   2    -35.7687539 -0.143933E-07  0.110E-02    3.17       1.9  T
   3    -35.7687539  0.461895E-07  0.132E-03    3.17      15.5  T
   4    -35.7687539 -0.572317E-07  0.158E-04    3.17     128.9  T
   5    -35.7687539  0.575042E-10  0.769E-05    3.17     265.4  T
     SCC iter.                  ...        0 min,  0.006 sec
     gradient                   ...        0 min,  0.013 sec
 * total energy  :   -35.0717144 Eh     change       -0.5442903E-05 Eh
   gradient norm :     0.0008090 Eh/α   predicted    -0.2539626E-05 ( -53.34%)
   displ. norm   :     0.0271371 α      lambda       -0.3217227E-05
   maximum displ.:     0.0233204 α      in ANC's #2, #1, #5, ...

........................................................................
.............................. CYCLE    7 ..............................
........................................................................
   1    -35.7689555 -0.357690E+02  0.142E-02    3.17       0.0  T
   2    -35.7689556 -0.122304E-07  0.831E-03    3.17       2.5  T
   3    -35.7689555  0.950786E-07  0.178E-03    3.17      11.4  T
   4    -35.7689556 -0.108213E-06  0.124E-04    3.17     164.2  T
   5    -35.7689556 -0.139728E-09  0.682E-05    3.17     299.5  T
     SCC iter.                  ...        0 min,  0.006 sec
     gradient                   ...        0 min,  0.013 sec
 * total energy  :   -35.0717183 Eh     change       -0.3929775E-05 Eh
   gradient norm :     0.0005076 Eh/α   predicted    -0.1631405E-05 ( -58.49%)
   displ. norm   :     0.0277974 α      lambda       -0.1508471E-05
   maximum displ.:     0.0233208 α      in ANC's #2, #1, #5, ...

   *** GEOMETRY OPTIMIZATION CONVERGED AFTER 7 ITERATIONS ***

------------------------------------------------------------------------
 total energy gain   :        -0.0056216 Eh       -3.5276 kcal/mol
 total RMSD          :         0.0786089 a0        0.0416 Å
 total power (kW/mol):        -2.1085138 (step)  -67.3097 (real)
------------------------------------------------------------------------

 ANCopt (total)                0 d,  0 h,  0 min,  0.219 sec
 optimizer setup                ...        0 min,  0.000 sec (  0.063%)
 model hessian                  ...        0 min,  0.016 sec (  7.446%)
 ANC generation                 ...        0 min,  0.001 sec (  0.314%)
 coordinate transformation      ...        0 min,  0.000 sec (  0.050%)
 single point calculation       ...        0 min,  0.200 sec ( 91.141%)
 optimization log               ...        0 min,  0.001 sec (  0.319%)
 hessian update                 ...        0 min,  0.000 sec (  0.043%)
 rational function              ...        0 min,  0.001 sec (  0.362%)

================
 final structure:
================
$coord
    5.31725705030818    1.62854846977855   -0.00267930449688      C 
    6.67539208967803   -0.57711765854321    0.00963399479323      C 
    5.40417344360490   -2.88707765137529    0.02972787390641      C 
    2.81038123672887   -2.96193965633765    0.02829173674501      C 
    1.36250019925808   -0.73771431816225    0.01117456625445      C 
    2.66385024647679    1.59831760038001    0.00357136864279      C 
    1.27812713499985    3.90549986216861    0.01054636816136      C 
   -1.27527265905570    3.90691225109784    0.03370346431416      C 
   -2.66367984881253    1.60133750610935    0.03206812512748      C 
   -1.36507895075957   -0.73612049249831    0.00845643344326      C 
   -2.81558538598058   -2.95851968228147   -0.01976029655243      C 
   -5.40927838429307   -2.88068673167994   -0.01218245191514      C 
   -6.67774759907016   -0.56942654452728    0.02753638288796      C 
   -5.31702677924486    1.63457158063640    0.04722824593080      C 
    6.27497932884660    3.43302062893302   -0.01432344108081      H 
    8.71626234592474   -0.53890397711172    0.00736750917076      H 
    6.47228163617176   -4.62697344228102    0.04793977029550      H 
    1.88804114594055   -4.77956217387166    0.04683503697406      H 
    2.32887764000438    5.65724109980534    0.00336040416312      H 
   -2.32400030753770    5.65981374577693    0.04860368989929      H 
   -1.89542449619411   -4.77707215560933   -0.05315178524695      H 
   -6.47945145793240   -4.61922678687826   -0.03756248553229      H 
   -8.71857033627642   -0.52887729863246    0.03906383268976      H 
   -6.27262575764557    3.44004997812924    0.07299082975957      H 
$end
           -------------------------------------------------
          |                Final Singlepoint                |
           -------------------------------------------------

          ...................................................
          :                      SETUP                      :
          :.................................................:
          :  # basis functions                  66          :
          :  # atomic orbitals                  66          :
          :  # shells                           38          :
          :  # electrons                        66          :
          :  max. iterations                   250          :
          :  Hamiltonian                  GFN2-xTB          :
          :  restarted?                      false          :
          :  GBSA solvation                  false          :
          :  PC potential                    false          :
          :  electronic temp.          300.0000000     K    :
          :  accuracy                    1.0000000          :
          :  -> integral cutoff          0.2500000E+02      :
          :  -> integral neglect         0.1000000E-07      :
          :  -> SCF convergence          0.1000000E-05 Eh   :
          :  -> wf. convergence          0.1000000E-03 e    :
          :  Broyden damping             0.4000000          :
          ...................................................

 iter      E             dE          RMSdq      gap      omega  full diag
   1    -35.7689556 -0.357690E+02  0.261E-05    3.17       0.0  T
   2    -35.7689556 -0.384404E-11  0.119E-05    3.17    1708.8  T
   3    -35.7689556 -0.304112E-11  0.866E-06    3.17    2356.0  T

   *** convergence criteria satisfied after 3 iterations ***

         #    Occupation            Energy/Eh            Energy/eV
      -------------------------------------------------------------
         1        2.0000           -0.6496217             -17.6771
       ...           ...                  ...                  ...
        27        2.0000           -0.4325520             -11.7703
        28        2.0000           -0.4236694             -11.5286
        29        2.0000           -0.4117974             -11.2056
        30        2.0000           -0.4103275             -11.1656
        31        2.0000           -0.4065468             -11.0627
        32        2.0000           -0.3847070             -10.4684
        33        2.0000           -0.3756447             -10.2218 (HOMO)
        34                         -0.2591866              -7.0528 (LUMO)
        35                         -0.2475569              -6.7364
        36                         -0.2095848              -5.7031
        37                         -0.1890942              -5.1455
        38                         -0.1572708              -4.2796
       ...                                ...                  ...
        66                          0.7152391              19.4626
      -------------------------------------------------------------
                  HL-Gap            0.1164580 Eh            3.1690 eV
             Fermi-level           -0.3174157 Eh           -8.6373 eV

 SCC (total)                   0 d,  0 h,  0 min,  0.025 sec
 SCC setup                      ...        0 min,  0.000 sec (  0.688%)
 Dispersion                     ...        0 min,  0.000 sec (  0.883%)
 integral evaluation            ...        0 min,  0.008 sec ( 31.081%)
 zeroth order Hamiltonian       ...        0 min,  0.000 sec (  0.546%)
 iterations                     ...        0 min,  0.004 sec ( 14.542%)
 molecular gradient             ...        0 min,  0.013 sec ( 50.788%)
 printout                       ...        0 min,  0.000 sec (  1.256%)

         :::::::::::::::::::::::::::::::::::::::::::::::::::::
         ::                     SUMMARY                     ::
         :::::::::::::::::::::::::::::::::::::::::::::::::::::
         :: total energy             -35.071718288273 Eh    ::
         :: gradient norm              0.000507442304 Eh/a0 ::
         :: HOMO-LUMO gap              3.168984041912 eV    ::
         ::.................................................::
         :: SCC energy               -35.768955568867 Eh    ::
         :: -> isotropic ES            0.001354819450 Eh    ::
         :: -> anisotropic ES          0.004379352178 Eh    ::
         :: -> anisotropic XC          0.022324903173 Eh    ::
         :: -> dispersion             -0.026092116959 Eh    ::
         :: repulsion energy           0.697201256131 Eh    ::
         :: add. restraining           0.000000000000 Eh    ::
         :::::::::::::::::::::::::::::::::::::::::::::::::::::

           -------------------------------------------------
          |                Property Printout                |
           -------------------------------------------------

    * Orbital Energies and Occupations

         #    Occupation            Energy/Eh            Energy/eV
      -------------------------------------------------------------
         1        2.0000           -0.6496217             -17.6771
       ...           ...                  ...                  ...
        21        2.0000           -0.4742412             -12.9048
        22        2.0000           -0.4705775             -12.8051
        23        2.0000           -0.4647894             -12.6476
        24        2.0000           -0.4560613             -12.4101
        25        2.0000           -0.4427057             -12.0466
        26        2.0000           -0.4353114             -11.8454
        27        2.0000           -0.4325520             -11.7703
        28        2.0000           -0.4236694             -11.5286
        29        2.0000           -0.4117974             -11.2056
        30        2.0000           -0.4103275             -11.1656
        31        2.0000           -0.4065468             -11.0627
        32        2.0000           -0.3847070             -10.4684
        33        2.0000           -0.3756447             -10.2218 (HOMO)
        34                         -0.2591866              -7.0528 (LUMO)
        35                         -0.2475569              -6.7364
        36                         -0.2095848              -5.7031
        37                         -0.1890942              -5.1455
        38                         -0.1572708              -4.2796
        39                         -0.1013219              -2.7571
        40                         -0.0386852              -1.0527
        41                          0.1033054               2.8111
        42                          0.1035432               2.8176
        43                          0.1186056               3.2274
        44                          0.1337936               3.6407
       ...                                ...                  ...
        66                          0.7152391              19.4626
      -------------------------------------------------------------
                  HL-Gap            0.1164580 Eh            3.1690 eV
             Fermi-level           -0.3174157 Eh           -8.6373 eV

     #   Z        covCN         q      C6AA      α(0)
     1   6 C      2.923    -0.035    28.879     8.813
     2   6 C      2.916    -0.031    28.767     8.795
     3   6 C      2.917    -0.031    28.781     8.797
     4   6 C      2.920    -0.035    28.863     8.810
     5   6 C      2.979     0.007    27.858     8.658
     6   6 C      2.987     0.012    27.743     8.640
     7   6 C      2.915    -0.036    28.904     8.816
     8   6 C      2.915    -0.036    28.904     8.816
     9   6 C      2.987     0.012    27.743     8.640
    10   6 C      2.979     0.007    27.858     8.658
    11   6 C      2.920    -0.035    28.863     8.810
    12   6 C      2.917    -0.031    28.781     8.797
    13   6 C      2.916    -0.031    28.767     8.795
    14   6 C      2.923    -0.035    28.879     8.813
    15   1 H      0.926     0.030     2.586     2.515
    16   1 H      0.926     0.029     2.600     2.522
    17   1 H      0.926     0.029     2.603     2.523
    18   1 H      0.926     0.032     2.560     2.502
    19   1 H      0.926     0.030     2.590     2.516
    20   1 H      0.926     0.030     2.590     2.516
    21   1 H      0.926     0.032     2.560     2.502
    22   1 H      0.926     0.029     2.603     2.523
    23   1 H      0.926     0.029     2.600     2.522
    24   1 H      0.926     0.030     2.586     2.515

 Mol. C6AA /au·bohr⁶  :       8255.745597
 Mol. C8AA /au·bohr⁸  :     209845.300240
 Mol. α(0) /au        :        147.814252


Wiberg/Mayer (AO) data.
largest (>0.10) Wiberg bond orders for each atom
          total WBO             WBO to atom ...
     1  C   3.985        C    2 1.517    C    6 1.316    H   15 0.968    C    4 0.112
     2  C   3.985        C    1 1.517    C    3 1.360    H   16 0.971
     3  C   3.986        C    4 1.511    C    2 1.360    H   17 0.971
     4  C   3.992        C    3 1.511    C    5 1.331    H   18 0.963    C    1 0.112
     5  C   3.989        C    4 1.331    C    6 1.286    C   10 1.162
     6  C   3.990        C    1 1.316    C    5 1.286    C    7 1.206
     7  C   3.992        C    8 1.650    C    6 1.206    H   19 0.968
     8  C   3.992        C    7 1.650    C    9 1.206    H   20 0.968
     9  C   3.990        C   14 1.316    C   10 1.286    C    8 1.206
    10  C   3.989        C   11 1.331    C    9 1.286    C    5 1.162
    11  C   3.992        C   12 1.511    C   10 1.331    H   21 0.963    C   14 0.112
    12  C   3.986        C   11 1.511    C   13 1.360    H   22 0.971
    13  C   3.985        C   14 1.517    C   12 1.360    H   23 0.971
    14  C   3.985        C   13 1.517    C    9 1.316    H   24 0.968    C   11 0.112
    15  H   0.999        C    1 0.968
    16  H   0.998        C    2 0.971
    17  H   0.999        C    3 0.971
    18  H   0.999        C    4 0.963
    19  H   0.998        C    7 0.968
    20  H   0.998        C    8 0.968
    21  H   0.999        C   11 0.963
    22  H   0.999        C   12 0.971
    23  H   0.998        C   13 0.971
    24  H   0.999        C   14 0.968

molecular dipole:
                 x           y           z       tot (Debye)
 q only:       -0.000      -0.009       0.000
   full:       -0.000      -0.003       0.001       0.008
molecular quadrupole (traceless):
                xx          xy          yy          xz          yz          zz
 q only:        1.231       0.000       1.590      -0.006       0.013      -2.820
  q+dip:        5.557       0.001       6.010      -0.034       0.051     -11.567
   full:        2.545       0.000       3.079      -0.007       0.026      -5.624

           -------------------------------------------------
          |                Geometry Summary                 |
           -------------------------------------------------

      molecular mass/u    :      178.2330000
   center of mass at/Å    :       -0.0004563      -0.0062205       0.0078752
  moments of inertia/u·Å² :        0.3083893E+03   0.9050026E+03   0.1213356E+04
rotational constants/cm⁻¹ :        0.5466348E-01   0.1862717E-01   0.1389340E-01

 * 25 selected distances

     #   Z        #   Z                                     value/Å
     1   6 C      2   6 C                                 1.3707270
     2   6 C      3   6 C                                 1.3952946
     3   6 C      4   6 C                                 1.3731476
     4   6 C      5   6 C                                 1.4044479
     1   6 C      6   6 C                                 1.4042176
     5   6 C      6   6 C                                 1.4150535
     6   6 C      7   6 C                                 1.4242015 (max)
     7   6 C      8   6 C                                 1.3512569
     8   6 C      9   6 C                                 1.4242000
     9   6 C     10   6 C                                 1.4150552
    10   6 C     11   6 C                                 1.4044471
    11   6 C     12   6 C                                 1.3731471
    12   6 C     13   6 C                                 1.3953146
     9   6 C     14   6 C                                 1.4042239
    13   6 C     14   6 C                                 1.3707179
     1   6 C     15   1 H                                 1.0810623
     2   6 C     16   1 H                                 1.0801721
     3   6 C     17   1 H                                 1.0804063
     4   6 C     18   1 H                                 1.0786402 (min)
     7   6 C     19   1 H                                 1.0809636
     8   6 C     20   1 H                                 1.0809623
    11   6 C     21   1 H                                 1.0786580
    12   6 C     22   1 H                                 1.0804079
    13   6 C     23   1 H                                 1.0801874
    14   6 C     24   1 H                                 1.0810750

 * 2 distinct bonds (by element types)

   Z      Z             #   av. dist./Å        max./Å        min./Å
   1 H    6 C          10     1.0802535     1.0810750     1.0786402
   6 C    6 C          15     1.3950302     1.4242015     1.3512569


optimized geometry written to: xtbopt.xyz


           -------------------------------------------------
          | TOTAL ENERGY              -35.071718288273 Eh   |
          | GRADIENT NORM               0.000507442304 Eh/α |
          | HOMO-LUMO GAP               3.168984041912 eV   |
           -------------------------------------------------

------------------------------------------------------------------------
 * finished run on 2021/05/19 at 10:59:12.370     
------------------------------------------------------------------------
 total:
 * wall-time:     0 d,  0 h,  0 min,  0.338 sec
 *  cpu-time:     0 d,  0 h,  0 min,  0.273 sec
 * ratio c/w:     0.808 speedup
 SCF:
 * wall-time:     0 d,  0 h,  0 min,  0.060 sec
 *  cpu-time:     0 d,  0 h,  0 min,  0.034 sec
 * ratio c/w:     0.570 speedup
 ANC optimizer:
 * wall-time:     0 d,  0 h,  0 min,  0.245 sec
 *  cpu-time:     0 d,  0 h,  0 min,  0.219 sec
 * ratio c/w:     0.894 speedup

