      -----------------------------------------------------------      
     |                   =====================                   |     
     |                           x T B                           |     
     |                   =====================                   |     
     |                         S. Grimme                         |     
     |          Mulliken Center for Theoretical Chemistry        |     
     |                    University of Bonn                     |     
     |                Version 6.2 RC2 (SAW190805)                |     
      -----------------------------------------------------------      

   This program is distributed in the hope that it will be useful,
   but WITHOUT ANY WARRANTY; without even the implied warranty of
   MERCHANTABILITY or FITNESS FOR A PARTICULAR PURPOSE.
   
   FOR NON-COMMERCIAL, ACADEMIA USE ONLY.
   
   Cite this work as:
   * S. Grimme, C. Bannwarth, P. Shushkov, J. Chem. Theory Comput., 2017,
     13, 1989-2009. DOI: 10.1021/acs.jctc.7b00118
   * C. Bannwarth, S. Ehlert and S. Grimme., J. Chem. Theory Comput., 2019,
     15, 1652-1671. DOI: 10.1021/acs.jctc.8b01176
   * P. Pracht, E. Caldeweyher, S. Ehlert, S. Grimme, ChemRxiv, 2019, preprint.
     DOI: 10.26434/chemrxiv.8326202.v1
   
   for DFT-D4:
   * E. Caldeweyher, C. Bannwarth and S. Grimme, J. Chem. Phys., 2017,
     147, 034112. DOI: 10.1063/1.4993215
   * E. Caldeweyher, S. Ehlert, A. Hansen, H. Neugebauer, S. Spicher,
     C. Bannwarth and S. Grimme, J. Chem. Phys., 2019, 150, 154122.
     DOI: 10.1063/1.5090222
   
   for sTDA-xTB:
   * S. Grimme and C. Bannwarth, J. Chem. Phys., 2016, 145, 054103.
     DOI: 10.1063/1.4959605
   
   in the mass-spec context:
   * V. Asgeirsson, C. Bauer and S. Grimme, Chem. Sci., 2017, 8, 4879.
     DOI: 10.1039/c7sc00601b
   
   for metadynamics refer to:
   * S. Grimme, J. Chem. Theory Comput., 2019, 155, 2847-2862
     DOI: 10.1021/acs.jctc.9b00143
   
   with help from (in alphabetical order)
   C. Bannwarth, F. Bohle, G. Brandenburg, E. Caldeweyher, M. Checinski,
   S. Dohm, S. Ehlert, S. Ehrlich, F. März, H. Neugebauer, J. Pisarek,
   P. Pracht, P. Shushkov, and S. Spicher.
   
 * started run on 2021/05/19 at 10:59:17.347     

           -------------------------------------------------
          |                Calculation Setup                |
           -------------------------------------------------

          program call               : /ihome/ghutchison/geoffh/xtb/xtb 339.xyz -opt
          hostname                   : smp-n122
          coordinate file            : 339.xyz
          omp threads                :                     1
          number of atoms            :                    26
          number of electrons        :                    74
          charge                     :                     0
          spin                       :                   0.0
          first test random number   :      0.69177719801714


########################################################################
# WARNING! Please study the warnings concerning your input carefully
#  - the use of '-opt' is discouraged, please use '--opt' next time
########################################################################

           ------------------------------------------------- 
          |                 G F N 2 - x T B                 |
          | Geometry, Frequencies, Noncovalent interactions |
          |            JCTC 2019 parametrisation            |
           ------------------------------------------------- 
             KAB for C  - Si     :                1.0500
             KAB for H  - Pd     :                0.9500
             k(s)              :                1.8500
             k(p)              :                2.2300
             k(d)              :                2.2300
             k(f)              :                2.0000
             kEN (H0ij)        :               -2.0000
             D4 a1             :                0.5200
             D4 a2             :                5.0000
             D4 s6             :                1.0000
             D4 s8             :                2.7000
             D4 s9             :                5.0000
             alphaj            :                2.0000

  Z AO/shell   Hii/eV     exponent
  1     Wed Apr 25 08:07:45 CEST 2018   EN: 2.200 GM2: 0.406  GM3: 0.0800  RAES: 1.40
     1s    -10.707211    1.230000
  6     Wed Apr 25 08:07:45 CEST 2018   EN: 2.550 GM2: 0.538  GM3: 0.1500  RAES: 3.00
     2s    -13.970922    2.096432
     2p    -10.063292    1.800000
  8     Wed Apr 25 08:07:45 CEST 2018   EN: 3.440 GM2: 0.452  GM3:-0.0517  RAES: 1.80
     2s    -20.229985    2.439742
     2p    -15.503117    2.137023
 16     Tue Apr 24 11:44:34 CEST 2018   EN: 2.580 GM2: 0.340  GM3:-0.0502  RAES: 3.10
     3s    -20.029654    1.981333
     3p    -11.377694    2.025643
     3d     -0.420282    1.702555

           ------------------------------------------------- 
          |        Self-Consistent Charge Iterations        |
           ------------------------------------------------- 

          ...................................................
          :                      SETUP                      :
          :.................................................:
          :  # basis functions                  74          :
          :  # atomic orbitals                  73          :
          :  # shells                           41          :
          :  # electrons                        74          :
          :  max. iterations                   250          :
          :  Hamiltonian                  GFN2-xTB          :
          :  restarted?                      false          :
          :  GBSA solvation                  false          :
          :  PC potential                    false          :
          :  electronic temp.          300.0000000     K    :
          :  accuracy                    1.0000000          :
          :  -> integral cutoff          0.2500000E+02      :
          :  -> integral neglect         0.1000000E-07      :
          :  -> SCF convergence          0.1000000E-05 Eh   :
          :  -> wf. convergence          0.1000000E-03 e    :
          :  Broyden damping             0.4000000          :
          ...................................................

 iter      E             dE          RMSdq      gap      omega  full diag
   1    -41.4937049 -0.414937E+02  0.426E+00    3.07       0.0  T
   2    -41.5483509 -0.546461E-01  0.228E+00    3.11       1.0  T
   3    -41.5491547 -0.803721E-03  0.119E+00    3.08       1.0  T
   4    -41.5557179 -0.656324E-02  0.243E-01    3.08       1.0  T
   5    -41.5559826 -0.264726E-03  0.137E-01    3.08       1.0  T
   6    -41.5562248 -0.242120E-03  0.616E-02    3.08       1.0  T
   7    -41.5562682 -0.434459E-04  0.179E-02    3.08       1.1  T
   8    -41.5562684 -0.247906E-06  0.681E-03    3.08       2.9  T
   9    -41.5562686 -0.136072E-06  0.337E-03    3.08       5.8  T
  10    -41.5562687 -0.108056E-06  0.162E-03    3.08      12.1  T
  11    -41.5562687 -0.164423E-07  0.653E-04    3.08      30.0  T
  12    -41.5562687 -0.431161E-08  0.379E-04    3.08      51.8  T

   *** convergence criteria satisfied after 12 iterations ***

         #    Occupation            Energy/Eh            Energy/eV
      -------------------------------------------------------------
         1        2.0000           -0.7418612             -20.1871
       ...           ...                  ...                  ...
        31        2.0000           -0.4551027             -12.3840
        32        2.0000           -0.4482814             -12.1984
        33        2.0000           -0.4399291             -11.9711
        34        2.0000           -0.4366826             -11.8827
        35        2.0000           -0.4129186             -11.2361
        36        2.0000           -0.3989268             -10.8553
        37        2.0000           -0.3853821             -10.4868 (HOMO)
        38                         -0.2721597              -7.4058 (LUMO)
        39                         -0.2436435              -6.6299
        40                         -0.2160926              -5.8802
        41                         -0.2063679              -5.6156
        42                         -0.1716780              -4.6716
       ...                                ...                  ...
        73                          0.6522798              17.7494
      -------------------------------------------------------------
                  HL-Gap            0.1132224 Eh            3.0809 eV
             Fermi-level           -0.3287709 Eh           -8.9463 eV

 SCC (total)                   0 d,  0 h,  0 min,  0.043 sec
 SCC setup                      ...        0 min,  0.000 sec (  0.713%)
 Dispersion                     ...        0 min,  0.000 sec (  0.908%)
 integral evaluation            ...        0 min,  0.010 sec ( 23.185%)
 zeroth order Hamiltonian       ...        0 min,  0.000 sec (  0.488%)
 iterations                     ...        0 min,  0.016 sec ( 37.022%)
 molecular gradient             ...        0 min,  0.016 sec ( 36.709%)
 printout                       ...        0 min,  0.000 sec (  0.861%)

         :::::::::::::::::::::::::::::::::::::::::::::::::::::
         ::                     SUMMARY                     ::
         :::::::::::::::::::::::::::::::::::::::::::::::::::::
         :: total energy             -41.032915471827 Eh    ::
         :: gradient norm              0.072883067620 Eh/a0 ::
         :: HOMO-LUMO gap              3.080938141150 eV    ::
         ::.................................................::
         :: SCC energy               -41.556268711488 Eh    ::
         :: -> isotropic ES            0.051393066236 Eh    ::
         :: -> anisotropic ES          0.003992495104 Eh    ::
         :: -> anisotropic XC          0.014454999906 Eh    ::
         :: -> dispersion             -0.027615666205 Eh    ::
         :: repulsion energy           0.523046739492 Eh    ::
         :: add. restraining           0.000000000000 Eh    ::
         :::::::::::::::::::::::::::::::::::::::::::::::::::::

      ----------------------------------------------------------- 
     |                   =====================                   |
     |                        A N C O P T                        |
     |                   =====================                   |
     |               Approximate Normal Coordinate               |
     |                Rational Function Optimizer                |
      ----------------------------------------------------------- 

          ...................................................
          :                      SETUP                      :
          :.................................................:
          :   optimization level            normal          :
          :   max. optcycles                   200          :
          :   ANC micro-cycles                  20          :
          :   degrees of freedom                72          :
          :.................................................:
          :   RF solver                   davidson          :
          :   input Hessian                  false          :
          :   write xtbopt.log                true          :
          :   linear?                        false          :
          :   energy convergence         0.5000000E-05 Eh   :
          :   grad. convergence          0.1000000E-02 Eh/α :
          :   maximium RF displ.         2.0000000          :
          :   Hlow (freq-cutoff)         0.5000000E-02      :
          :   Hmax (freq-cutoff)         5.0000000          :
          :   S6 in model hess.         20.0000000          :
          ...................................................

generating ANC from model Hessian ...
Using Lindh-Hessian (1995)
 Shifting diagonal of input Hessian by   3.880430157823966E-003
 Lowest  eigenvalues of input Hessian
   -0.000000    0.000000    0.000000    0.000000    0.000000    0.000000
    0.005000    0.006016    0.007904    0.008539    0.008885    0.011663
    0.013050    0.016616    0.017743    0.021500    0.027266    0.029145
 Highest eigenvalues
    1.621420    1.712695    1.778754    1.827178    1.973945    2.212802
 

........................................................................
.............................. CYCLE    1 ..............................
........................................................................
   1    -41.5562687 -0.415563E+02  0.147E-04    3.08       0.0  T
   2    -41.5562687 -0.122661E-09  0.114E-04    3.08     172.0  T
   3    -41.5562687 -0.239858E-09  0.529E-05    3.08     371.0  T
     SCC iter.                  ...        0 min,  0.004 sec
     gradient                   ...        0 min,  0.016 sec
 * total energy  :   -41.0329155 Eh     change       -0.3335579E-08 Eh
   gradient norm :     0.0728849 Eh/α   predicted     0.0000000E+00 (-100.00%)
   displ. norm   :     0.2698170 α      lambda       -0.7615049E-02
   maximum displ.:     0.1051464 α      in ANC's #2, #3, #7, ...

........................................................................
.............................. CYCLE    2 ..............................
........................................................................
   1    -41.5817561 -0.415818E+02  0.225E-01    3.12       0.0  T
   2    -41.5818224 -0.663762E-04  0.126E-01    3.12       1.0  T
   3    -41.5817607  0.617266E-04  0.694E-02    3.12       1.0  T
   4    -41.5818466 -0.859313E-04  0.256E-02    3.12       1.0  T
   5    -41.5818524 -0.576653E-05  0.986E-03    3.12       2.0  T
   6    -41.5818529 -0.450620E-06  0.394E-03    3.12       5.0  T
   7    -41.5818531 -0.275506E-06  0.140E-03    3.12      14.0  T
     SCC iter.                  ...        0 min,  0.008 sec
     gradient                   ...        0 min,  0.015 sec
 * total energy  :   -41.0375962 Eh     change       -0.4680760E-02 Eh
   gradient norm :     0.0202670 Eh/α   predicted    -0.4084726E-02 ( -12.73%)
   displ. norm   :     0.2874307 α      lambda       -0.2053301E-02
   maximum displ.:     0.1531374 α      in ANC's #3, #2, #5, ...

........................................................................
.............................. CYCLE    3 ..............................
........................................................................
   1    -41.5910143 -0.415910E+02  0.202E-01    3.14       0.0  T
   2    -41.5910391 -0.248168E-04  0.122E-01    3.14       1.0  T
   3    -41.5909726  0.664874E-04  0.642E-02    3.14       1.0  T
   4    -41.5910558 -0.831771E-04  0.185E-02    3.14       1.1  T
   5    -41.5910580 -0.222865E-05  0.740E-03    3.14       2.6  T
   6    -41.5910583 -0.301411E-06  0.276E-03    3.14       7.1  T
   7    -41.5910584 -0.820434E-07  0.146E-03    3.14      13.4  T
     SCC iter.                  ...        0 min,  0.008 sec
     gradient                   ...        0 min,  0.015 sec
 * total energy  :   -41.0385738 Eh     change       -0.9775633E-03 Eh
   gradient norm :     0.0135066 Eh/α   predicted    -0.1111468E-02 (  13.70%)
   displ. norm   :     0.2429467 α      lambda       -0.8580174E-03
   maximum displ.:     0.1210443 α      in ANC's #2, #5, #3, ...

........................................................................
.............................. CYCLE    4 ..............................
........................................................................
   1    -41.5895735 -0.415896E+02  0.130E-01    3.13       0.0  T
   2    -41.5895814 -0.789688E-05  0.767E-02    3.13       1.0  T
   3    -41.5895659  0.155062E-04  0.321E-02    3.13       1.0  T
   4    -41.5895849 -0.189933E-04  0.884E-03    3.13       2.2  T
   5    -41.5895857 -0.758652E-06  0.422E-03    3.13       4.7  T
   6    -41.5895858 -0.123223E-06  0.143E-03    3.13      13.7  T
   7    -41.5895858 -0.118385E-07  0.836E-04    3.13      23.5  T
     SCC iter.                  ...        0 min,  0.009 sec
     gradient                   ...        0 min,  0.015 sec
 * total energy  :   -41.0391490 Eh     change       -0.5751652E-03 Eh
   gradient norm :     0.0087662 Eh/α   predicted    -0.4543327E-03 ( -21.01%)
   displ. norm   :     0.2562268 α      lambda       -0.4609512E-03
   maximum displ.:     0.1317812 α      in ANC's #3, #5, #2, ...

........................................................................
.............................. CYCLE    5 ..............................
........................................................................
   1    -41.5861019 -0.415861E+02  0.137E-01    3.12       0.0  T
   2    -41.5861088 -0.686365E-05  0.786E-02    3.12       1.0  T
   3    -41.5861017  0.709135E-05  0.234E-02    3.12       1.0  T
   4    -41.5861113 -0.958555E-05  0.833E-03    3.12       2.4  T
   5    -41.5861116 -0.351522E-06  0.383E-03    3.12       5.1  T
   6    -41.5861118 -0.182254E-06  0.112E-03    3.12      17.5  T
   7    -41.5861118 -0.402871E-08  0.761E-04    3.12      25.8  T
     SCC iter.                  ...        0 min,  0.009 sec
     gradient                   ...        0 min,  0.015 sec
 * total energy  :   -41.0394805 Eh     change       -0.3315689E-03 Eh
   gradient norm :     0.0066461 Eh/α   predicted    -0.2456174E-03 ( -25.92%)
   displ. norm   :     0.2499357 α      lambda       -0.3062194E-03
   maximum displ.:     0.1265066 α      in ANC's #3, #5, #2, ...

........................................................................
.............................. CYCLE    6 ..............................
........................................................................
   1    -41.5852786 -0.415853E+02  0.145E-01    3.10       0.0  T
   2    -41.5852829 -0.429073E-05  0.812E-02    3.10       1.0  T
   3    -41.5852795  0.345140E-05  0.188E-02    3.10       1.0  T
   4    -41.5852840 -0.451780E-05  0.934E-03    3.10       2.1  T
   5    -41.5852847 -0.685412E-06  0.263E-03    3.10       7.5  T
   6    -41.5852848 -0.998528E-07  0.973E-04    3.10      20.2  T
     SCC iter.                  ...        0 min,  0.008 sec
     gradient                   ...        0 min,  0.015 sec
 * total energy  :   -41.0396888 Eh     change       -0.2082197E-03 Eh
   gradient norm :     0.0057487 Eh/α   predicted    -0.1626784E-03 ( -21.87%)
   displ. norm   :     0.1775645 α      lambda       -0.1509866E-03
   maximum displ.:     0.0881391 α      in ANC's #5, #1, #3, ...

........................................................................
.............................. CYCLE    7 ..............................
........................................................................
   1    -41.5863389 -0.415863E+02  0.108E-01    3.09       0.0  T
   2    -41.5863413 -0.245754E-05  0.620E-02    3.09       1.0  T
   3    -41.5863361  0.523881E-05  0.196E-02    3.09       1.0  T
   4    -41.5863425 -0.647016E-05  0.674E-03    3.09       2.9  T
   5    -41.5863428 -0.211298E-06  0.232E-03    3.09       8.4  T
   6    -41.5863428 -0.620628E-07  0.801E-04    3.09      24.5  T
     SCC iter.                  ...        0 min,  0.008 sec
     gradient                   ...        0 min,  0.015 sec
 * total energy  :   -41.0397939 Eh     change       -0.1051068E-03 Eh
   gradient norm :     0.0048676 Eh/α   predicted    -0.7787571E-04 ( -25.91%)
   displ. norm   :     0.1529972 α      lambda       -0.1089357E-03
   maximum displ.:     0.0738205 α      in ANC's #5, #1, #4, ...

........................................................................
.............................. CYCLE    8 ..............................
........................................................................
   1    -41.5881695 -0.415882E+02  0.102E-01    3.08       0.0  T
   2    -41.5881721 -0.256225E-05  0.583E-02    3.08       1.0  T
   3    -41.5881652  0.690150E-05  0.216E-02    3.08       1.0  T
   4    -41.5881734 -0.827276E-05  0.657E-03    3.08       3.0  T
   5    -41.5881736 -0.175231E-06  0.270E-03    3.08       7.3  T
   6    -41.5881737 -0.804049E-07  0.789E-04    3.08      24.9  T
     SCC iter.                  ...        0 min,  0.008 sec
     gradient                   ...        0 min,  0.015 sec
 * total energy  :   -41.0398637 Eh     change       -0.6987309E-04 Eh
   gradient norm :     0.0032833 Eh/α   predicted    -0.5575398E-04 ( -20.21%)
   displ. norm   :     0.1433394 α      lambda       -0.8535378E-04
   maximum displ.:     0.0790971 α      in ANC's #5, #4, #1, ...

........................................................................
.............................. CYCLE    9 ..............................
........................................................................
   1    -41.5892122 -0.415892E+02  0.966E-02    3.08       0.0  T
   2    -41.5892142 -0.203956E-05  0.578E-02    3.08       1.0  T
   3    -41.5892044  0.977925E-05  0.234E-02    3.08       1.0  T
   4    -41.5892159 -0.114852E-04  0.455E-03    3.08       4.3  T
   5    -41.5892160 -0.840162E-07  0.237E-03    3.08       8.3  T
   6    -41.5892160 -0.447596E-07  0.889E-04    3.08      22.1  T
   7    -41.5892161 -0.595887E-08  0.482E-04    3.08      40.7  T
     SCC iter.                  ...        0 min,  0.009 sec
     gradient                   ...        0 min,  0.016 sec
 * total energy  :   -41.0399140 Eh     change       -0.5026399E-04 Eh
   gradient norm :     0.0028960 Eh/α   predicted    -0.4355863E-04 ( -13.34%)
   displ. norm   :     0.0987476 α      lambda       -0.4644422E-04
   maximum displ.:     0.0552838 α      in ANC's #5, #4, #1, ...

........................................................................
.............................. CYCLE   10 ..............................
........................................................................
   1    -41.5889638 -0.415890E+02  0.675E-02    3.07       0.0  T
   2    -41.5889646 -0.769491E-06  0.408E-02    3.07       1.0  T
   3    -41.5889605  0.403538E-05  0.142E-02    3.07       1.4  T
   4    -41.5889653 -0.476844E-05  0.251E-03    3.07       7.8  T
   5    -41.5889653 -0.110791E-07  0.149E-03    3.07      13.1  T
   6    -41.5889653 -0.203737E-07  0.549E-04    3.07      35.7  T
   7    -41.5889653 -0.168961E-08  0.282E-04    3.07      69.6  T
     SCC iter.                  ...        0 min,  0.008 sec
     gradient                   ...        0 min,  0.016 sec
 * total energy  :   -41.0399472 Eh     change       -0.3318559E-04 Eh
   gradient norm :     0.0021379 Eh/α   predicted    -0.2345010E-04 ( -29.34%)
   displ. norm   :     0.0854018 α      lambda       -0.3244757E-04
   maximum displ.:     0.0452474 α      in ANC's #5, #4, #1, ...

........................................................................
.............................. CYCLE   11 ..............................
........................................................................
   1    -41.5888403 -0.415888E+02  0.594E-02    3.07       0.0  T
   2    -41.5888409 -0.630194E-06  0.362E-02    3.07       1.0  T
   3    -41.5888387  0.223157E-05  0.104E-02    3.07       1.9  T
   4    -41.5888414 -0.275558E-05  0.186E-03    3.07      10.5  T
   5    -41.5888414 -0.125770E-07  0.119E-03    3.07      16.5  T
   6    -41.5888414 -0.798669E-08  0.469E-04    3.07      41.8  T
   7    -41.5888414 -0.188165E-08  0.166E-04    3.07     118.0  T
     SCC iter.                  ...        0 min,  0.008 sec
     gradient                   ...        0 min,  0.016 sec
 * total energy  :   -41.0399666 Eh     change       -0.1944745E-04 Eh
   gradient norm :     0.0013373 Eh/α   predicted    -0.1634240E-04 ( -15.97%)
   displ. norm   :     0.0963173 α      lambda       -0.1294663E-04
   maximum displ.:     0.0676906 α      in ANC's #5, #4, #1, ...

........................................................................
.............................. CYCLE   12 ..............................
........................................................................
   1    -41.5874043 -0.415874E+02  0.714E-02    3.07       0.0  T
   2    -41.5874055 -0.119119E-05  0.434E-02    3.07       1.0  T
   3    -41.5874040  0.146017E-05  0.957E-03    3.07       2.0  T
   4    -41.5874061 -0.209255E-05  0.297E-03    3.07       6.6  T
   5    -41.5874062 -0.865982E-07  0.159E-03    3.07      12.3  T
   6    -41.5874062 -0.108194E-07  0.605E-04    3.07      32.4  T
   7    -41.5874062 -0.208456E-08  0.267E-04    3.07      73.4  T
     SCC iter.                  ...        0 min,  0.008 sec
     gradient                   ...        0 min,  0.016 sec
 * total energy  :   -41.0399712 Eh     change       -0.4522777E-05 Eh
   gradient norm :     0.0033345 Eh/α   predicted    -0.6501357E-05 (  43.75%)
   displ. norm   :     0.0265975 α      lambda       -0.1294408E-04
   maximum displ.:     0.0154958 α      in ANC's #2, #6, #3, ...

........................................................................
.............................. CYCLE   13 ..............................
........................................................................
   1    -41.5880385 -0.415880E+02  0.181E-02    3.07       0.0  T
   2    -41.5880387 -0.188798E-06  0.976E-03    3.07       2.0  T
   3    -41.5880386  0.132194E-06  0.352E-03    3.07       5.6  T
   4    -41.5880387 -0.173495E-06  0.149E-03    3.07      13.2  T
   5    -41.5880388 -0.146245E-07  0.697E-04    3.07      28.1  T
   6    -41.5880388 -0.535785E-08  0.135E-04    3.07     145.0  T
     SCC iter.                  ...        0 min,  0.007 sec
     gradient                   ...        0 min,  0.016 sec
 * total energy  :   -41.0399799 Eh     change       -0.8733186E-05 Eh
   gradient norm :     0.0013850 Eh/α   predicted    -0.6478552E-05 ( -25.82%)
   displ. norm   :     0.0396866 α      lambda       -0.7903022E-05
   maximum displ.:     0.0261761 α      in ANC's #6, #2, #9, ...

........................................................................
.............................. CYCLE   14 ..............................
........................................................................
   1    -41.5888219 -0.415888E+02  0.236E-02    3.07       0.0  T
   2    -41.5888221 -0.167596E-06  0.136E-02    3.07       1.4  T
   3    -41.5888218  0.289759E-06  0.459E-03    3.07       4.3  T
   4    -41.5888222 -0.349686E-06  0.158E-03    3.07      12.5  T
   5    -41.5888222 -0.154076E-07  0.639E-04    3.07      30.7  T
   6    -41.5888222 -0.357321E-08  0.170E-04    3.07     115.6  T
     SCC iter.                  ...        0 min,  0.008 sec
     gradient                   ...        0 min,  0.016 sec
 * total energy  :   -41.0399861 Eh     change       -0.6218349E-05 Eh
   gradient norm :     0.0009713 Eh/α   predicted    -0.3955489E-05 ( -36.39%)
   displ. norm   :     0.0396867 α      lambda        0.6599480E-05
   maximum displ.:     0.0261805 α      in ANC's #6, #2, #9, ...

........................................................................
.............................. CYCLE   15 ..............................
........................................................................
   1    -41.5895728 -0.415896E+02  0.235E-02    3.07       0.0  T
   2    -41.5895729 -0.164691E-06  0.135E-02    3.07       1.5  T
   3    -41.5895726  0.297406E-06  0.464E-03    3.07       4.2  T
   4    -41.5895730 -0.358452E-06  0.156E-03    3.07      12.6  T
   5    -41.5895730 -0.150650E-07  0.634E-04    3.07      30.9  T
   6    -41.5895730 -0.342217E-08  0.170E-04    3.07     115.6  T
     SCC iter.                  ...        0 min,  0.007 sec
     gradient                   ...        0 min,  0.016 sec
 * total energy  :   -41.0399812 Eh     change        0.4855924E-05 Eh
   gradient norm :     0.0028594 Eh/α   predicted     0.3298132E-05 ( -32.08%)
   displ. norm   :     0.0195545 α      lambda       -0.9948999E-05
   maximum displ.:     0.0099545 α      in ANC's #5, #4, #9, ...

........................................................................
.............................. CYCLE   16 ..............................
........................................................................
   1    -41.5890703 -0.415891E+02  0.127E-02    3.07       0.0  T
   2    -41.5890704 -0.502680E-07  0.768E-03    3.07       2.6  T
   3    -41.5890702  0.183385E-06  0.301E-03    3.07       6.5  T
   4    -41.5890704 -0.217702E-06  0.601E-04    3.07      32.6  T
   5    -41.5890704 -0.246357E-08  0.326E-04    3.07      60.1  T
     SCC iter.                  ...        0 min,  0.006 sec
     gradient                   ...        0 min,  0.016 sec
 * total energy  :   -41.0399883 Eh     change       -0.7072982E-05 Eh
   gradient norm :     0.0012072 Eh/α   predicted    -0.4980693E-05 ( -29.58%)
   displ. norm   :     0.0401439 α      lambda       -0.4747664E-05
   maximum displ.:     0.0248850 α      in ANC's #4, #5, #1, ...

........................................................................
.............................. CYCLE   17 ..............................
........................................................................
   1    -41.5882733 -0.415883E+02  0.297E-02    3.07       0.0  T
   2    -41.5882735 -0.217158E-06  0.181E-02    3.07       1.1  T
   3    -41.5882724  0.112632E-05  0.749E-03    3.07       2.6  T
   4    -41.5882737 -0.132089E-05  0.121E-03    3.07      16.2  T
   5    -41.5882737 -0.796523E-08  0.700E-04    3.07      28.0  T
   6    -41.5882737 -0.240587E-08  0.313E-04    3.07      62.6  T
     SCC iter.                  ...        0 min,  0.007 sec
     gradient                   ...        0 min,  0.016 sec
 * total energy  :   -41.0399902 Eh     change       -0.1863563E-05 Eh
   gradient norm :     0.0011934 Eh/α   predicted    -0.2376683E-05 (  27.53%)
   displ. norm   :     0.0136272 α      lambda       -0.1587214E-05
   maximum displ.:     0.0070205 α      in ANC's #6, #2, #9, ...

........................................................................
.............................. CYCLE   18 ..............................
........................................................................
   1    -41.5885609 -0.415886E+02  0.807E-03    3.07       0.0  T
   2    -41.5885609 -0.368073E-07  0.448E-03    3.07       4.4  T
   3    -41.5885609  0.349273E-07  0.160E-03    3.07      12.3  T
   4    -41.5885609 -0.446116E-07  0.605E-04    3.07      32.4  T
   5    -41.5885609 -0.240672E-08  0.275E-04    3.07      71.3  T
     SCC iter.                  ...        0 min,  0.006 sec
     gradient                   ...        0 min,  0.016 sec
 * total energy  :   -41.0399914 Eh     change       -0.1196006E-05 Eh
   gradient norm :     0.0004427 Eh/α   predicted    -0.7959381E-06 ( -33.45%)
   displ. norm   :     0.0140139 α      lambda        0.1562408E-05
   maximum displ.:     0.0070193 α      in ANC's #6, #2, #9, ...

   *** GEOMETRY OPTIMIZATION CONVERGED AFTER 18 ITERATIONS ***

------------------------------------------------------------------------
 total energy gain   :        -0.0070759 Eh       -4.4402 kcal/mol
 total RMSD          :         0.3357350 a0        0.1777 Å
 total power (kW/mol):        -1.0320997 (step)  -29.8867 (real)
------------------------------------------------------------------------

 ANCopt (total)                0 d,  0 h,  0 min,  0.622 sec
 optimizer setup                ...        0 min,  0.000 sec (  0.022%)
 model hessian                  ...        0 min,  0.014 sec (  2.332%)
 ANC generation                 ...        0 min,  0.001 sec (  0.123%)
 coordinate transformation      ...        0 min,  0.000 sec (  0.048%)
 single point calculation       ...        0 min,  0.599 sec ( 96.432%)
 optimization log               ...        0 min,  0.002 sec (  0.299%)
 hessian update                 ...        0 min,  0.000 sec (  0.037%)
 rational function              ...        0 min,  0.003 sec (  0.509%)

================
 final structure:
================
$coord
    2.71989706930572   -2.46047173800393    0.49664191022747      C 
    5.08752196348426   -0.25427389527755    0.37210319059941      S 
    2.91571054611498    2.16756189876341   -0.15280433669947      C 
    0.48500846052529    1.23775213797538   -0.18393912606893      C 
    0.38666308824465   -1.42418387820689    0.18556103037961      C 
   -2.04298498337087   -2.87183469290840    0.31063993794570      C 
   -4.22329404619727   -1.34612316726226   -0.80485626623040      C 
   -4.25066823845856    1.35647247983215    0.25487729105347      C 
   -4.62554862319341    1.24181460626075    3.11429394440075      C 
   -6.67487931109989    1.00552432913777    4.04882952764617      O 
   -2.54935171382515    1.38859421667609    4.55250654691992      O 
   -1.86688546845939    2.77514867447416   -0.57346141881153      C 
    3.90763863426636    4.68854027115603   -0.44142303991380      C 
    2.75570775414353    6.68136137928034   -1.45125887448227      C 
    3.18155696315556   -4.40953340094186    0.79652397520128      H 
   -2.45561977522729   -3.32845092024947    2.28666266072203      H 
   -1.84328432955292   -4.66288059287870   -0.69449273600433      H 
   -6.01304042292173   -2.27220004907282   -0.37334708517410      H 
   -4.02435908195382   -1.24338168295591   -2.85681857440196      H 
   -5.91665921780743    2.32893254732137   -0.49161254259361      H 
   -1.01539567501633    1.48818041105367    3.54949321320652      H 
   -1.72004987737506    4.57818524898845    0.42927663865243      H 
   -2.05102858742172    3.20969946199495   -2.58812690378532      H 
    5.83536058582506    4.89128565580591    0.21770640773436      H 
    0.88349226815552    6.61386172420049   -2.23326853614271      H 
    3.70740336182665    8.47498982317623   -1.56137127589476      H 
$end
           -------------------------------------------------
          |                Final Singlepoint                |
           -------------------------------------------------

          ...................................................
          :                      SETUP                      :
          :.................................................:
          :  # basis functions                  74          :
          :  # atomic orbitals                  73          :
          :  # shells                           41          :
          :  # electrons                        74          :
          :  max. iterations                   250          :
          :  Hamiltonian                  GFN2-xTB          :
          :  restarted?                      false          :
          :  GBSA solvation                  false          :
          :  PC potential                    false          :
          :  electronic temp.          300.0000000     K    :
          :  accuracy                    1.0000000          :
          :  -> integral cutoff          0.2500000E+02      :
          :  -> integral neglect         0.1000000E-07      :
          :  -> SCF convergence          0.1000000E-05 Eh   :
          :  -> wf. convergence          0.1000000E-03 e    :
          :  Broyden damping             0.4000000          :
          ...................................................

 iter      E             dE          RMSdq      gap      omega  full diag
   1    -41.5885609 -0.415886E+02  0.141E-04    3.07       0.0  T
   2    -41.5885609 -0.237392E-10  0.648E-05    3.07     302.5  T
   3    -41.5885609 -0.368630E-10  0.601E-05    3.07     326.4  T

   *** convergence criteria satisfied after 3 iterations ***

         #    Occupation            Energy/Eh            Energy/eV
      -------------------------------------------------------------
         1        2.0000           -0.7429283             -20.2161
       ...           ...                  ...                  ...
        31        2.0000           -0.4557255             -12.4009
        32        2.0000           -0.4490693             -12.2198
        33        2.0000           -0.4411771             -12.0050
        34        2.0000           -0.4375141             -11.9054
        35        2.0000           -0.4128765             -11.2349
        36        2.0000           -0.4008821             -10.9086
        37        2.0000           -0.3875139             -10.5448 (HOMO)
        38                         -0.2747250              -7.4756 (LUMO)
        39                         -0.2335060              -6.3540
        40                         -0.2152705              -5.8578
        41                         -0.2082179              -5.6659
        42                         -0.1639044              -4.4601
       ...                                ...                  ...
        73                          0.6632907              18.0491
      -------------------------------------------------------------
                  HL-Gap            0.1127889 Eh            3.0691 eV
             Fermi-level           -0.3311195 Eh           -9.0102 eV

 SCC (total)                   0 d,  0 h,  0 min,  0.031 sec
 SCC setup                      ...        0 min,  0.000 sec (  0.625%)
 Dispersion                     ...        0 min,  0.000 sec (  0.701%)
 integral evaluation            ...        0 min,  0.010 sec ( 31.357%)
 zeroth order Hamiltonian       ...        0 min,  0.000 sec (  0.579%)
 iterations                     ...        0 min,  0.004 sec ( 14.056%)
 molecular gradient             ...        0 min,  0.016 sec ( 51.420%)
 printout                       ...        0 min,  0.000 sec (  1.110%)

         :::::::::::::::::::::::::::::::::::::::::::::::::::::
         ::                     SUMMARY                     ::
         :::::::::::::::::::::::::::::::::::::::::::::::::::::
         :: total energy             -41.039991375721 Eh    ::
         :: gradient norm              0.000442381853 Eh/a0 ::
         :: HOMO-LUMO gap              3.069142473925 eV    ::
         ::.................................................::
         :: SCC energy               -41.588560899882 Eh    ::
         :: -> isotropic ES            0.051008363486 Eh    ::
         :: -> anisotropic ES          0.003464206802 Eh    ::
         :: -> anisotropic XC          0.013691835821 Eh    ::
         :: -> dispersion             -0.028125978959 Eh    ::
         :: repulsion energy           0.548268949208 Eh    ::
         :: add. restraining           0.000000000000 Eh    ::
         :::::::::::::::::::::::::::::::::::::::::::::::::::::

           -------------------------------------------------
          |                Property Printout                |
           -------------------------------------------------

    * Orbital Energies and Occupations

         #    Occupation            Energy/Eh            Energy/eV
      -------------------------------------------------------------
         1        2.0000           -0.7429283             -20.2161
       ...           ...                  ...                  ...
        25        2.0000           -0.4927183             -13.4075
        26        2.0000           -0.4839458             -13.1688
        27        2.0000           -0.4767194             -12.9722
        28        2.0000           -0.4731205             -12.8743
        29        2.0000           -0.4680493             -12.7363
        30        2.0000           -0.4627752             -12.5928
        31        2.0000           -0.4557255             -12.4009
        32        2.0000           -0.4490693             -12.2198
        33        2.0000           -0.4411771             -12.0050
        34        2.0000           -0.4375141             -11.9054
        35        2.0000           -0.4128765             -11.2349
        36        2.0000           -0.4008821             -10.9086
        37        2.0000           -0.3875139             -10.5448 (HOMO)
        38                         -0.2747250              -7.4756 (LUMO)
        39                         -0.2335060              -6.3540
        40                         -0.2152705              -5.8578
        41                         -0.2082179              -5.6659
        42                         -0.1639044              -4.4601
        43                         -0.1254006              -3.4123
        44                         -0.0141655              -0.3855
        45                          0.0199216               0.5421
        46                          0.0236725               0.6442
        47                          0.0509939               1.3876
        48                          0.0660156               1.7964
       ...                                ...                  ...
        73                          0.6632907              18.0491
      -------------------------------------------------------------
                  HL-Gap            0.1127889 Eh            3.0691 eV
             Fermi-level           -0.3311195 Eh           -9.0102 eV

     #   Z        covCN         q      C6AA      α(0)
     1   6 C      2.936    -0.035    28.864     8.811
     2  16 S      2.333    -0.035   142.515    20.092
     3   6 C      2.984     0.007    27.849     8.656
     4   6 C      3.150    -0.029    28.436     8.722
     5   6 C      3.156    -0.012    28.018     8.655
     6   6 C      3.806    -0.059    21.631     6.621
     7   6 C      3.809    -0.054    21.537     6.606
     8   6 C      3.854    -0.057    21.553     6.603
     9   6 C      2.690     0.357    20.941     7.489
    10   8 O      0.857    -0.380    21.279     6.185
    11   8 O      1.659    -0.376    20.390     6.096
    12   6 C      3.807    -0.061    21.659     6.625
    13   6 C      2.936    -0.032    28.791     8.800
    14   6 C      2.838    -0.092    30.300     9.021
    15   1 H      0.926     0.044     2.390     2.418
    16   1 H      0.924     0.048     2.344     2.394
    17   1 H      0.924     0.046     2.377     2.411
    18   1 H      0.924     0.049     2.331     2.387
    19   1 H      0.924     0.046     2.364     2.405
    20   1 H      0.924     0.060     2.199     2.319
    21   1 H      0.804     0.329     0.639     1.256
    22   1 H      0.924     0.046     2.374     2.409
    23   1 H      0.924     0.054     2.265     2.354
    24   1 H      0.925     0.045     2.382     2.414
    25   1 H      0.926     0.044     2.397     2.421
    26   1 H      0.926     0.045     2.388     2.417

 Mol. C6AA /au·bohr⁶  :       8796.151089
 Mol. C8AA /au·bohr⁸  :     232478.375063
 Mol. α(0) /au        :        146.587555


Wiberg/Mayer (AO) data.
largest (>0.10) Wiberg bond orders for each atom
          total WBO             WBO to atom ...
     1  C   3.947        C    5 1.579    S    2 1.198    H   15 0.970    C    3 0.102
     2  S   2.621        C    1 1.198    C    3 1.135
     3  C   3.946        C    4 1.491    S    2 1.135    C   13 1.130    C    1 0.102
     4  C   3.983        C    3 1.491    C    5 1.238    C   12 1.008
     5  C   3.985        C    1 1.579    C    4 1.238    C    6 1.008
     6  C   3.997        C    5 1.008    C    7 1.006    H   17 0.968    H   16 0.959
     7  C   3.995        C    6 1.006    H   18 0.976    C    8 0.976    H   19 0.975
     8  C   3.994        C   12 0.992    C    7 0.976    H   20 0.958    C    9 0.951
     9  C   3.915        O   10 1.787    O   11 1.136    C    8 0.951
    10  O   2.063        C    9 1.787    O   11 0.166
    11  O   2.209        C    9 1.136    H   21 0.844    O   10 0.166
    12  C   3.997        C    4 1.008    C    8 0.992    H   22 0.962    H   23 0.954
    13  C   3.991        C   14 1.866    C    3 1.130    H   24 0.962
    14  C   3.990        C   13 1.866    H   26 0.977    H   25 0.973
    15  H   0.997        C    1 0.970
    16  H   0.997        C    6 0.959
    17  H   0.998        C    6 0.968
    18  H   0.997        C    7 0.976
    19  H   0.998        C    7 0.975
    20  H   0.995        C    8 0.958
    21  H   0.892        O   11 0.844
    22  H   0.998        C   12 0.962
    23  H   0.997        C   12 0.954
    24  H   0.997        C   13 0.962
    25  H   0.998        C   14 0.973
    26  H   0.997        C   14 0.977

molecular dipole:
                 x           y           z       tot (Debye)
 q only:        0.939       0.031      -1.151
   full:        1.002       0.003      -1.423       4.425
molecular quadrupole (traceless):
                xx          xy          yy          xz          yz          zz
 q only:       -7.778       2.730      11.394      13.713      -2.268      -3.616
  q+dip:      -11.111       2.592      16.240      16.777      -3.553      -5.129
   full:      -11.842       2.542      16.358      16.364      -3.021      -4.517

           -------------------------------------------------
          |                Geometry Summary                 |
           -------------------------------------------------

      molecular mass/u    :      208.2746000
   center of mass at/Å    :       -0.1069801       0.4843461       0.3939668
  moments of inertia/u·Å² :        0.4993320E+03   0.1058399E+04   0.1287555E+04
rotational constants/cm⁻¹ :        0.3376037E-01   0.1592749E-01   0.1309274E-01

 * 23 selected distances

     #   Z        #   Z                                     value/Å
     1   6 C      2  16 S                                 1.7137883
     2  16 S      3   6 C                                 1.7436837 (max)
     3   6 C      4   6 C                                 1.3772674
     1   6 C      5   6 C                                 1.3609884
     4   6 C      5   6 C                                 1.4230939
     6   6 C      7   6 C                                 1.5269194
     7   6 C      8   6 C                                 1.5362379
     9   6 C     10   8 O                                 1.1984371
     9   6 C     11   8 O                                 1.3387864
     8   6 C     12   6 C                                 1.5319848
    13   6 C     14   6 C                                 1.3301257
     1   6 C     15   1 H                                 1.0717506
     6   6 C     16   1 H                                 1.0952092
     6   6 C     17   1 H                                 1.0919554
     7   6 C     18   1 H                                 1.0905431
     7   6 C     19   1 H                                 1.0922968
     8   6 C     20   1 H                                 1.0945724
    11   8 O     21   1 H                                 0.9712925 (min)
    12   6 C     22   1 H                                 1.0945127
    12   6 C     23   1 H                                 1.0949776
    13   6 C     24   1 H                                 1.0834146
    14   6 C     25   1 H                                 1.0742802
    14   6 C     26   1 H                                 1.0760598

 * 5 distinct bonds (by element types)

   Z      Z             #   av. dist./Å        max./Å        min./Å
   1 H    6 C          11     1.0872339     1.0952092     1.0717506
   6 C    6 C           7     1.4409454     1.5362379     1.3301257
   1 H    8 O           1     0.9712925     0.9712925     0.9712925
   6 C    8 O           2     1.2686117     1.3387864     1.1984371
   6 C   16 S           2     1.7287360     1.7436837     1.7137883


optimized geometry written to: xtbopt.xyz


           -------------------------------------------------
          | TOTAL ENERGY              -41.039991375721 Eh   |
          | GRADIENT NORM               0.000442381853 Eh/α |
          | HOMO-LUMO GAP               3.069142473925 eV   |
           -------------------------------------------------

------------------------------------------------------------------------
 * finished run on 2021/05/19 at 10:59:18.064     
------------------------------------------------------------------------
 total:
 * wall-time:     0 d,  0 h,  0 min,  0.717 sec
 *  cpu-time:     0 d,  0 h,  0 min,  0.717 sec
 * ratio c/w:     0.999 speedup
 SCF:
 * wall-time:     0 d,  0 h,  0 min,  0.043 sec
 *  cpu-time:     0 d,  0 h,  0 min,  0.043 sec
 * ratio c/w:     1.000 speedup
 ANC optimizer:
 * wall-time:     0 d,  0 h,  0 min,  0.653 sec
 *  cpu-time:     0 d,  0 h,  0 min,  0.653 sec
 * ratio c/w:     1.000 speedup

