      -----------------------------------------------------------      
     |                   =====================                   |     
     |                           x T B                           |     
     |                   =====================                   |     
     |                         S. Grimme                         |     
     |          Mulliken Center for Theoretical Chemistry        |     
     |                    University of Bonn                     |     
     |                Version 6.2 RC2 (SAW190805)                |     
      -----------------------------------------------------------      

   This program is distributed in the hope that it will be useful,
   but WITHOUT ANY WARRANTY; without even the implied warranty of
   MERCHANTABILITY or FITNESS FOR A PARTICULAR PURPOSE.
   
   FOR NON-COMMERCIAL, ACADEMIA USE ONLY.
   
   Cite this work as:
   * S. Grimme, C. Bannwarth, P. Shushkov, J. Chem. Theory Comput., 2017,
     13, 1989-2009. DOI: 10.1021/acs.jctc.7b00118
   * C. Bannwarth, S. Ehlert and S. Grimme., J. Chem. Theory Comput., 2019,
     15, 1652-1671. DOI: 10.1021/acs.jctc.8b01176
   * P. Pracht, E. Caldeweyher, S. Ehlert, S. Grimme, ChemRxiv, 2019, preprint.
     DOI: 10.26434/chemrxiv.8326202.v1
   
   for DFT-D4:
   * E. Caldeweyher, C. Bannwarth and S. Grimme, J. Chem. Phys., 2017,
     147, 034112. DOI: 10.1063/1.4993215
   * E. Caldeweyher, S. Ehlert, A. Hansen, H. Neugebauer, S. Spicher,
     C. Bannwarth and S. Grimme, J. Chem. Phys., 2019, 150, 154122.
     DOI: 10.1063/1.5090222
   
   for sTDA-xTB:
   * S. Grimme and C. Bannwarth, J. Chem. Phys., 2016, 145, 054103.
     DOI: 10.1063/1.4959605
   
   in the mass-spec context:
   * V. Asgeirsson, C. Bauer and S. Grimme, Chem. Sci., 2017, 8, 4879.
     DOI: 10.1039/c7sc00601b
   
   for metadynamics refer to:
   * S. Grimme, J. Chem. Theory Comput., 2019, 155, 2847-2862
     DOI: 10.1021/acs.jctc.9b00143
   
   with help from (in alphabetical order)
   C. Bannwarth, F. Bohle, G. Brandenburg, E. Caldeweyher, M. Checinski,
   S. Dohm, S. Ehlert, S. Ehrlich, F. März, H. Neugebauer, J. Pisarek,
   P. Pracht, P. Shushkov, and S. Spicher.
   
 * started run on 2021/05/19 at 10:58:23.301     

           -------------------------------------------------
          |                Calculation Setup                |
           -------------------------------------------------

          program call               : /ihome/ghutchison/geoffh/xtb/xtb 34.xyz -opt
          hostname                   : smp-n58
          coordinate file            : 34.xyz
          omp threads                :                     1
          number of atoms            :                    16
          number of electrons        :                    48
          charge                     :                     0
          spin                       :                   0.0
          first test random number   :      0.47261838203881


########################################################################
# WARNING! Please study the warnings concerning your input carefully
#  - the use of '-opt' is discouraged, please use '--opt' next time
########################################################################

           ------------------------------------------------- 
          |                 G F N 2 - x T B                 |
          | Geometry, Frequencies, Noncovalent interactions |
          |            JCTC 2019 parametrisation            |
           ------------------------------------------------- 
             KAB for C  - Si     :                1.0500
             KAB for H  - Pd     :                0.9500
             k(s)              :                1.8500
             k(p)              :                2.2300
             k(d)              :                2.2300
             k(f)              :                2.0000
             kEN (H0ij)        :               -2.0000
             D4 a1             :                0.5200
             D4 a2             :                5.0000
             D4 s6             :                1.0000
             D4 s8             :                2.7000
             D4 s9             :                5.0000
             alphaj            :                2.0000

  Z AO/shell   Hii/eV     exponent
  1     Wed Apr 25 08:07:45 CEST 2018   EN: 2.200 GM2: 0.406  GM3: 0.0800  RAES: 1.40
     1s    -10.707211    1.230000
  6     Wed Apr 25 08:07:45 CEST 2018   EN: 2.550 GM2: 0.538  GM3: 0.1500  RAES: 3.00
     2s    -13.970922    2.096432
     2p    -10.063292    1.800000
  8     Wed Apr 25 08:07:45 CEST 2018   EN: 3.440 GM2: 0.452  GM3:-0.0517  RAES: 1.80
     2s    -20.229985    2.439742
     2p    -15.503117    2.137023

           ------------------------------------------------- 
          |        Self-Consistent Charge Iterations        |
           ------------------------------------------------- 

          ...................................................
          :                      SETUP                      :
          :.................................................:
          :  # basis functions                  46          :
          :  # atomic orbitals                  46          :
          :  # shells                           26          :
          :  # electrons                        48          :
          :  max. iterations                   250          :
          :  Hamiltonian                  GFN2-xTB          :
          :  restarted?                      false          :
          :  GBSA solvation                  false          :
          :  PC potential                    false          :
          :  electronic temp.          300.0000000     K    :
          :  accuracy                    1.0000000          :
          :  -> integral cutoff          0.2500000E+02      :
          :  -> integral neglect         0.1000000E-07      :
          :  -> SCF convergence          0.1000000E-05 Eh   :
          :  -> wf. convergence          0.1000000E-03 e    :
          :  Broyden damping             0.4000000          :
          ...................................................

 iter      E             dE          RMSdq      gap      omega  full diag
   1    -26.7280061 -0.267280E+02  0.547E+00    1.08       0.0  T
   2    -26.7458564 -0.178503E-01  0.317E+00    1.03       1.0  T
   3    -26.7124191  0.334373E-01  0.230E+00    0.99       1.0  T
   4    -26.7560240 -0.436049E-01  0.535E-01    0.92       1.0  T
   5    -26.7598134 -0.378935E-02  0.121E-01    0.91       1.0  T
   6    -26.7599112 -0.978766E-04  0.609E-02    0.92       1.0  T
   7    -26.7599369 -0.256361E-04  0.397E-02    0.92       1.0  T
   8    -26.7599443 -0.743130E-05  0.242E-02    0.92       1.0  T
   9    -26.7599483 -0.400590E-05  0.941E-03    0.92       2.7  T
  10    -26.7599491 -0.786271E-06  0.190E-03    0.92      13.1  T
  11    -26.7599491 -0.149455E-07  0.870E-04    0.92      28.7  T
  12    -26.7599491 -0.109472E-08  0.236E-04    0.92     105.8  T

   *** convergence criteria satisfied after 12 iterations ***

         #    Occupation            Energy/Eh            Energy/eV
      -------------------------------------------------------------
         1        2.0000           -0.7157119             -19.4755
       ...           ...                  ...                  ...
        18        2.0000           -0.4742072             -12.9038
        19        2.0000           -0.4586249             -12.4798
        20        2.0000           -0.4492558             -12.2249
        21        2.0000           -0.4433964             -12.0654
        22        2.0000           -0.4389306             -11.9439
        23        2.0000           -0.4021535             -10.9432
        24        2.0000           -0.3782185             -10.2918 (HOMO)
        25                         -0.3444468              -9.3729 (LUMO)
        26                         -0.2425342              -6.5997
        27                         -0.2116745              -5.7600
        28                         -0.1537903              -4.1848
        29                         -0.0981864              -2.6718
       ...                                ...                  ...
        46                          0.7491578              20.3856
      -------------------------------------------------------------
                  HL-Gap            0.0337716 Eh            0.9190 eV
             Fermi-level           -0.3613326 Eh           -9.8324 eV

 SCC (total)                   0 d,  0 h,  0 min,  0.019 sec
 SCC setup                      ...        0 min,  0.000 sec (  1.121%)
 Dispersion                     ...        0 min,  0.000 sec (  1.266%)
 integral evaluation            ...        0 min,  0.004 sec ( 20.867%)
 zeroth order Hamiltonian       ...        0 min,  0.000 sec (  0.421%)
 iterations                     ...        0 min,  0.008 sec ( 40.773%)
 molecular gradient             ...        0 min,  0.006 sec ( 33.870%)
 printout                       ...        0 min,  0.000 sec (  1.450%)

         :::::::::::::::::::::::::::::::::::::::::::::::::::::
         ::                     SUMMARY                     ::
         :::::::::::::::::::::::::::::::::::::::::::::::::::::
         :: total energy             -26.305054019153 Eh    ::
         :: gradient norm              0.073756384559 Eh/a0 ::
         :: HOMO-LUMO gap              0.918973193818 eV    ::
         ::.................................................::
         :: SCC energy               -26.759949123640 Eh    ::
         :: -> isotropic ES            0.023096341545 Eh    ::
         :: -> anisotropic ES          0.000110362650 Eh    ::
         :: -> anisotropic XC          0.013998224015 Eh    ::
         :: -> dispersion             -0.014449517455 Eh    ::
         :: repulsion energy           0.454870122189 Eh    ::
         :: add. restraining           0.000000000000 Eh    ::
         :::::::::::::::::::::::::::::::::::::::::::::::::::::

      ----------------------------------------------------------- 
     |                   =====================                   |
     |                        A N C O P T                        |
     |                   =====================                   |
     |               Approximate Normal Coordinate               |
     |                Rational Function Optimizer                |
      ----------------------------------------------------------- 

          ...................................................
          :                      SETUP                      :
          :.................................................:
          :   optimization level            normal          :
          :   max. optcycles                   200          :
          :   ANC micro-cycles                  20          :
          :   degrees of freedom                42          :
          :.................................................:
          :   RF solver                   davidson          :
          :   input Hessian                  false          :
          :   write xtbopt.log                true          :
          :   linear?                        false          :
          :   energy convergence         0.5000000E-05 Eh   :
          :   grad. convergence          0.1000000E-02 Eh/α :
          :   maximium RF displ.         2.0000000          :
          :   Hlow (freq-cutoff)         0.5000000E-02      :
          :   Hmax (freq-cutoff)         5.0000000          :
          :   S6 in model hess.         20.0000000          :
          ...................................................

generating ANC from model Hessian ...
Using Lindh-Hessian (1995)
 Shifting diagonal of input Hessian by   0.000000000000000E+000
 Lowest  eigenvalues of input Hessian
   -0.000000   -0.000000   -0.000000    0.000000    0.000000    0.000000
    0.006898    0.007607    0.014751    0.018570    0.020415    0.035597
    0.042425    0.060593    0.066052    0.085908    0.088205    0.098751
 Highest eigenvalues
    1.777408    1.791597    1.826813    1.998377    2.119802    2.263019
 

........................................................................
.............................. CYCLE    1 ..............................
........................................................................
   1    -26.7599491 -0.267599E+02  0.794E-05    0.92       0.0  T
   2    -26.7599491 -0.322231E-11  0.733E-05    0.92     340.9  T
   3    -26.7599491 -0.579732E-10  0.238E-05    0.92    1048.4  T
     SCC iter.                  ...        0 min,  0.002 sec
     gradient                   ...        0 min,  0.006 sec
 * total energy  :   -26.3050540 Eh     change        0.5359208E-08 Eh
   gradient norm :     0.0737556 Eh/α   predicted     0.0000000E+00 (-100.00%)
   displ. norm   :     0.1701578 α      lambda       -0.7057503E-02
   maximum displ.:     0.1065618 α      in ANC's #9, #26, #17, ...

........................................................................
.............................. CYCLE    2 ..............................
........................................................................
   1    -26.7595183 -0.267595E+02  0.150E-01    0.85       0.0  T
   2    -26.7596010 -0.826965E-04  0.107E-01    0.83       1.0  T
   3    -26.7596280 -0.269750E-04  0.572E-02    0.83       1.0  T
   4    -26.7596254  0.259382E-05  0.291E-02    0.83       1.0  T
   5    -26.7596359 -0.105015E-04  0.650E-03    0.83       3.8  T
   6    -26.7596362 -0.298743E-06  0.388E-03    0.83       6.4  T
   7    -26.7596362 -0.410457E-07  0.296E-03    0.83       8.4  T
     SCC iter.                  ...        0 min,  0.004 sec
     gradient                   ...        0 min,  0.006 sec
 * total energy  :   -26.3094822 Eh     change       -0.4428151E-02 Eh
   gradient norm :     0.0322435 Eh/α   predicted    -0.3630921E-02 ( -18.00%)
   displ. norm   :     0.0514938 α      lambda       -0.1041021E-02
   maximum displ.:     0.0265090 α      in ANC's #17, #26, #20, ...

........................................................................
.............................. CYCLE    3 ..............................
........................................................................
   1    -26.7606666 -0.267607E+02  0.705E-02    0.83       0.0  T
   2    -26.7606829 -0.163021E-04  0.491E-02    0.82       1.0  T
   3    -26.7606872 -0.422186E-05  0.294E-02    0.82       1.0  T
   4    -26.7606885 -0.129860E-05  0.119E-02    0.82       2.1  T
   5    -26.7606904 -0.195848E-05  0.413E-03    0.82       6.0  T
   6    -26.7606906 -0.208472E-06  0.119E-03    0.82      21.0  T
     SCC iter.                  ...        0 min,  0.004 sec
     gradient                   ...        0 min,  0.006 sec
 * total energy  :   -26.3100852 Eh     change       -0.6030241E-03 Eh
   gradient norm :     0.0092781 Eh/α   predicted    -0.5218917E-03 ( -13.45%)
   displ. norm   :     0.0137519 α      lambda       -0.8080585E-04
   maximum displ.:     0.0064543 α      in ANC's #17, #38, #12, ...

........................................................................
.............................. CYCLE    4 ..............................
........................................................................
   1    -26.7607242 -0.267607E+02  0.196E-02    0.83       0.0  T
   2    -26.7607243 -0.847358E-07  0.134E-02    0.83       1.9  T
   3    -26.7607250 -0.650206E-06  0.983E-03    0.83       2.5  T
   4    -26.7607254 -0.414786E-06  0.436E-03    0.83       5.7  T
   5    -26.7607255 -0.180724E-06  0.209E-03    0.83      12.0  T
   6    -26.7607256 -0.463919E-07  0.581E-04    0.83      43.0  T
     SCC iter.                  ...        0 min,  0.004 sec
     gradient                   ...        0 min,  0.006 sec
 * total energy  :   -26.3101352 Eh     change       -0.5000877E-04 Eh
   gradient norm :     0.0028934 Eh/α   predicted    -0.4041187E-04 ( -19.19%)
   displ. norm   :     0.0076160 α      lambda       -0.1183318E-04
   maximum displ.:     0.0052907 α      in ANC's #12, #9, #11, ...

........................................................................
.............................. CYCLE    5 ..............................
........................................................................
   1    -26.7607529 -0.267608E+02  0.769E-03    0.84       0.0  T
   2    -26.7607529 -0.114024E-07  0.523E-03    0.84       4.8  T
   3    -26.7607531 -0.116690E-06  0.370E-03    0.84       6.8  T
   4    -26.7607531 -0.501931E-07  0.200E-03    0.84      12.5  T
   5    -26.7607531 -0.356703E-07  0.890E-04    0.84      28.1  T
   6    -26.7607531 -0.912249E-08  0.136E-04    0.84     184.0  T
     SCC iter.                  ...        0 min,  0.004 sec
     gradient                   ...        0 min,  0.007 sec
 * total energy  :   -26.3101420 Eh     change       -0.6815997E-05 Eh
   gradient norm :     0.0009154 Eh/α   predicted    -0.5917452E-05 ( -13.18%)
   displ. norm   :     0.0039764 α      lambda       -0.1080241E-05
   maximum displ.:     0.0028350 α      in ANC's #12, #11, #26, ...

........................................................................
.............................. CYCLE    6 ..............................
........................................................................
   1    -26.7607951 -0.267608E+02  0.366E-03    0.84       0.0  T
   2    -26.7607951 -0.364048E-07  0.253E-03    0.84       9.9  T
   3    -26.7607951 -0.401376E-08  0.169E-03    0.84      14.8  T
   4    -26.7607951  0.148501E-07  0.166E-03    0.84      15.1  T
   5    -26.7607951 -0.280382E-07  0.449E-04    0.84      55.6  T
   6    -26.7607951 -0.272998E-08  0.811E-05    0.84     308.3  T
     SCC iter.                  ...        0 min,  0.004 sec
     gradient                   ...        0 min,  0.007 sec
 * total energy  :   -26.3101427 Eh     change       -0.6469065E-06 Eh
   gradient norm :     0.0004103 Eh/α   predicted    -0.5403498E-06 ( -16.47%)
   displ. norm   :     0.0029417 α      lambda       -0.2333943E-06
   maximum displ.:     0.0021875 α      in ANC's #4, #3, #2, ...

   *** GEOMETRY OPTIMIZATION CONVERGED AFTER 6 ITERATIONS ***

------------------------------------------------------------------------
 total energy gain   :        -0.0050886 Eh       -3.1932 kcal/mol
 total RMSD          :         0.0543343 a0        0.0288 Å
 total power (kW/mol):        -2.2267041 (step) -149.1980 (real)
------------------------------------------------------------------------

 ANCopt (total)                0 d,  0 h,  0 min,  0.090 sec
 optimizer setup                ...        0 min,  0.000 sec (  0.149%)
 model hessian                  ...        0 min,  0.002 sec (  1.852%)
 ANC generation                 ...        0 min,  0.000 sec (  0.346%)
 coordinate transformation      ...        0 min,  0.000 sec (  0.083%)
 single point calculation       ...        0 min,  0.085 sec ( 95.415%)
 optimization log               ...        0 min,  0.000 sec (  0.476%)
 hessian update                 ...        0 min,  0.000 sec (  0.069%)
 rational function              ...        0 min,  0.001 sec (  1.154%)

================
 final structure:
================
$coord
    3.01207425930340   -2.20118302509842    0.00251565920336      C 
    0.59124004055127   -1.41046302516234    0.00258970792505      C 
   -1.75355347203881   -2.76228928185823    0.00582695230301      C 
   -3.94451264087386   -1.46123239309912    0.00480845484279      C 
   -4.00262639129360    1.26342885557981    0.00062034822584      C 
   -1.86911306609466    2.65671017941346   -0.00250515523443      C 
    0.53118913185496    1.40603701824239   -0.00174351559853      C 
    2.91612992128274    2.29915976375371   -0.00440585626724      C 
    4.67013198989205    0.08528142176211   -0.00094066265791      C 
    6.94966572566617    0.13398185149660   -0.00217431994161      O 
    3.72829766482111   -4.09738007894925    0.00477568992849      H 
   -1.71342441078185   -4.80219532585300    0.00879431922365      H 
   -5.73349750705598   -2.44431393015194    0.00686806483340      H 
   -5.83189251199870    2.16933282316082   -0.00023161065776      H 
   -1.91602853085711    4.69647124532289   -0.00582633291528      H 
    3.55108886554538    4.22408556908248   -0.00803022996640      H 
$end
           -------------------------------------------------
          |                Final Singlepoint                |
           -------------------------------------------------

          ...................................................
          :                      SETUP                      :
          :.................................................:
          :  # basis functions                  46          :
          :  # atomic orbitals                  46          :
          :  # shells                           26          :
          :  # electrons                        48          :
          :  max. iterations                   250          :
          :  Hamiltonian                  GFN2-xTB          :
          :  restarted?                      false          :
          :  GBSA solvation                  false          :
          :  PC potential                    false          :
          :  electronic temp.          300.0000000     K    :
          :  accuracy                    1.0000000          :
          :  -> integral cutoff          0.2500000E+02      :
          :  -> integral neglect         0.1000000E-07      :
          :  -> SCF convergence          0.1000000E-05 Eh   :
          :  -> wf. convergence          0.1000000E-03 e    :
          :  Broyden damping             0.4000000          :
          ...................................................

 iter      E             dE          RMSdq      gap      omega  full diag
   1    -26.7607951 -0.267608E+02  0.379E-05    0.84       0.0  T
   2    -26.7607951  0.405009E-12  0.184E-05    0.84    1360.5  T
   3    -26.7607951  0.412115E-11  0.310E-05    0.84     806.2  T

   *** convergence criteria satisfied after 3 iterations ***

         #    Occupation            Energy/Eh            Energy/eV
      -------------------------------------------------------------
         1        2.0000           -0.7183051             -19.5461
       ...           ...                  ...                  ...
        18        2.0000           -0.4777756             -13.0009
        19        2.0000           -0.4584564             -12.4752
        20        2.0000           -0.4488365             -12.2135
        21        2.0000           -0.4428502             -12.0506
        22        2.0000           -0.4349561             -11.8358
        23        2.0000           -0.4026267             -10.9560
        24        2.0000           -0.3751652             -10.2088 (HOMO)
        25        0.0000           -0.3444211              -9.3722 (LUMO)
        26                         -0.2412487              -6.5647
        27                         -0.2124615              -5.7814
        28                         -0.1551526              -4.2219
        29                         -0.0989891              -2.6936
       ...                                ...                  ...
        46                          0.7372676              20.0621
      -------------------------------------------------------------
                  HL-Gap            0.0307441 Eh            0.8366 eV
             Fermi-level           -0.3597932 Eh           -9.7905 eV

 SCC (total)                   0 d,  0 h,  0 min,  0.012 sec
 SCC setup                      ...        0 min,  0.000 sec (  0.967%)
 Dispersion                     ...        0 min,  0.000 sec (  0.921%)
 integral evaluation            ...        0 min,  0.004 sec ( 30.508%)
 zeroth order Hamiltonian       ...        0 min,  0.000 sec (  0.532%)
 iterations                     ...        0 min,  0.002 sec ( 16.671%)
 molecular gradient             ...        0 min,  0.006 sec ( 48.324%)
 printout                       ...        0 min,  0.000 sec (  1.766%)

         :::::::::::::::::::::::::::::::::::::::::::::::::::::
         ::                     SUMMARY                     ::
         :::::::::::::::::::::::::::::::::::::::::::::::::::::
         :: total energy             -26.310142666263 Eh    ::
         :: gradient norm              0.000410595630 Eh/a0 ::
         :: HOMO-LUMO gap              0.836588817637 eV    ::
         ::.................................................::
         :: SCC energy               -26.760795115299 Eh    ::
         :: -> isotropic ES            0.021853200922 Eh    ::
         :: -> anisotropic ES          0.000608264677 Eh    ::
         :: -> anisotropic XC          0.013894700434 Eh    ::
         :: -> dispersion             -0.014415695157 Eh    ::
         :: repulsion energy           0.450628544799 Eh    ::
         :: add. restraining           0.000000000000 Eh    ::
         :::::::::::::::::::::::::::::::::::::::::::::::::::::

           -------------------------------------------------
          |                Property Printout                |
           -------------------------------------------------

    * Orbital Energies and Occupations

         #    Occupation            Energy/Eh            Energy/eV
      -------------------------------------------------------------
         1        2.0000           -0.7183051             -19.5461
       ...           ...                  ...                  ...
        12        2.0000           -0.5368917             -14.6096
        13        2.0000           -0.5294506             -14.4071
        14        2.0000           -0.5069584             -13.7950
        15        2.0000           -0.5007914             -13.6272
        16        2.0000           -0.4916049             -13.3772
        17        2.0000           -0.4879276             -13.2772
        18        2.0000           -0.4777756             -13.0009
        19        2.0000           -0.4584564             -12.4752
        20        2.0000           -0.4488365             -12.2135
        21        2.0000           -0.4428502             -12.0506
        22        2.0000           -0.4349561             -11.8358
        23        2.0000           -0.4026267             -10.9560
        24        2.0000           -0.3751652             -10.2088 (HOMO)
        25        0.0000           -0.3444211              -9.3722 (LUMO)
        26                         -0.2412487              -6.5647
        27                         -0.2124615              -5.7814
        28                         -0.1551526              -4.2219
        29                         -0.0989891              -2.6936
        30                          0.0660992               1.7987
        31                          0.0682351               1.8568
        32                          0.1099075               2.9907
        33                          0.1163950               3.1673
        34                          0.1304602               3.5500
        35                          0.1520901               4.1386
       ...                                ...                  ...
        46                          0.7372676              20.0621
      -------------------------------------------------------------
                  HL-Gap            0.0307441 Eh            0.8366 eV
             Fermi-level           -0.3597932 Eh           -9.7905 eV

     #   Z        covCN         q      C6AA      α(0)
     1   6 C      2.953    -0.081    30.026     8.987
     2   6 C      3.058     0.023    27.433     8.589
     3   6 C      2.901    -0.029    28.720     8.787
     4   6 C      2.912    -0.020    28.499     8.754
     5   6 C      2.912    -0.020    28.499     8.754
     6   6 C      2.901    -0.029    28.720     8.787
     7   6 C      3.058     0.023    27.433     8.589
     8   6 C      2.953    -0.081    30.025     8.987
     9   6 C      2.921     0.243    22.953     7.857
    10   8 O      0.856    -0.314    20.029     6.000
    11   1 H      0.926     0.057     2.230     2.335
    12   1 H      0.926     0.043     2.403     2.424
    13   1 H      0.926     0.041     2.434     2.440
    14   1 H      0.926     0.041     2.434     2.440
    15   1 H      0.926     0.043     2.403     2.424
    16   1 H      0.926     0.057     2.230     2.335

 Mol. C6AA /au·bohr⁶  :       3748.886766
 Mol. C8AA /au·bohr⁸  :      94793.755376
 Mol. α(0) /au        :         98.490421


Wiberg/Mayer (AO) data.
largest (>0.10) Wiberg bond orders for each atom
          total WBO             WBO to atom ...
     1  C   3.985        C    2 1.695    C    9 0.994    H   11 0.969    C    8 0.138    C    4 0.105
     2  C   3.986        C    1 1.695    C    3 1.151    C    7 1.004
     3  C   3.992        C    4 1.712    C    2 1.151    H   12 0.966    C    6 0.115
     4  C   3.975        C    3 1.712    C    5 1.154    H   13 0.970    C    1 0.105
     5  C   3.975        C    6 1.712    C    4 1.154    H   14 0.970    C    8 0.105
     6  C   3.992        C    5 1.712    C    7 1.151    H   15 0.966    C    3 0.115
     7  C   3.986        C    8 1.695    C    6 1.151    C    2 1.004
     8  C   3.985        C    7 1.695    C    9 0.994    H   16 0.969    C    1 0.138    C    5 0.105
     9  C   3.912        O   10 1.848    C    1 0.994    C    8 0.994
    10  O   2.075        C    9 1.848
    11  H   0.996        C    1 0.969
    12  H   0.998        C    3 0.966
    13  H   0.998        C    4 0.970
    14  H   0.998        C    5 0.970
    15  H   0.998        C    6 0.966
    16  H   0.996        C    8 0.969

molecular dipole:
                 x           y           z       tot (Debye)
 q only:       -1.455      -0.031       0.001
   full:       -1.616      -0.034       0.001       4.109
molecular quadrupole (traceless):
                xx          xy          yy          xz          yz          zz
 q only:       -9.096      -0.310       6.915       0.004      -0.007       2.181
  q+dip:       -8.711      -0.373      10.402       0.002      -0.019      -1.691
   full:      -11.267      -0.388       8.518       0.005      -0.009       2.749

           -------------------------------------------------
          |                Geometry Summary                 |
           -------------------------------------------------

      molecular mass/u    :      130.1458000
   center of mass at/Å    :        0.4270380       0.0015925       0.0002150
  moments of inertia/u·Å² :        0.1348395E+03   0.4839466E+03   0.6187860E+03
rotational constants/cm⁻¹ :        0.1250200E+00   0.3483367E-01   0.2724307E-01

 * 13 selected distances

     #   Z        #   Z                                     value/Å
     1   6 C      2   6 C                                 1.3476553
     2   6 C      3   6 C                                 1.4322534
     3   6 C      4   6 C                                 1.3484213
     5   6 C      6   6 C                                 1.3484286
     6   6 C      7   6 C                                 1.4322664 (max)
     7   6 C      8   6 C                                 1.3476492
     9   6 C     10   8 O                                 1.2065529
     1   6 C     11   1 H                                 1.0726182
     3   6 C     12   1 H                                 1.0796819
     4   6 C     13   1 H                                 1.0802114
     5   6 C     14   1 H                                 1.0802059
     6   6 C     15   1 H                                 1.0796821
     8   6 C     16   1 H                                 1.0726157 (min)

 * 3 distinct bonds (by element types)

   Z      Z             #   av. dist./Å        max./Å        min./Å
   1 H    6 C           6     1.0775025     1.0802114     1.0726157
   6 C    6 C           6     1.3761124     1.4322664     1.3476492
   6 C    8 O           1     1.2065529     1.2065529     1.2065529


optimized geometry written to: xtbopt.xyz


           -------------------------------------------------
          | TOTAL ENERGY              -26.310142666263 Eh   |
          | GRADIENT NORM               0.000410595630 Eh/α |
          | HOMO-LUMO GAP               0.836588817637 eV   |
           -------------------------------------------------

------------------------------------------------------------------------
 * finished run on 2021/05/19 at 10:58:23.437     
------------------------------------------------------------------------
 total:
 * wall-time:     0 d,  0 h,  0 min,  0.136 sec
 *  cpu-time:     0 d,  0 h,  0 min,  0.136 sec
 * ratio c/w:     0.998 speedup
 SCF:
 * wall-time:     0 d,  0 h,  0 min,  0.019 sec
 *  cpu-time:     0 d,  0 h,  0 min,  0.019 sec
 * ratio c/w:     1.000 speedup
 ANC optimizer:
 * wall-time:     0 d,  0 h,  0 min,  0.102 sec
 *  cpu-time:     0 d,  0 h,  0 min,  0.102 sec
 * ratio c/w:     1.000 speedup

