      -----------------------------------------------------------      
     |                   =====================                   |     
     |                           x T B                           |     
     |                   =====================                   |     
     |                         S. Grimme                         |     
     |          Mulliken Center for Theoretical Chemistry        |     
     |                    University of Bonn                     |     
     |                Version 6.2 RC2 (SAW190805)                |     
      -----------------------------------------------------------      

   This program is distributed in the hope that it will be useful,
   but WITHOUT ANY WARRANTY; without even the implied warranty of
   MERCHANTABILITY or FITNESS FOR A PARTICULAR PURPOSE.
   
   FOR NON-COMMERCIAL, ACADEMIA USE ONLY.
   
   Cite this work as:
   * S. Grimme, C. Bannwarth, P. Shushkov, J. Chem. Theory Comput., 2017,
     13, 1989-2009. DOI: 10.1021/acs.jctc.7b00118
   * C. Bannwarth, S. Ehlert and S. Grimme., J. Chem. Theory Comput., 2019,
     15, 1652-1671. DOI: 10.1021/acs.jctc.8b01176
   * P. Pracht, E. Caldeweyher, S. Ehlert, S. Grimme, ChemRxiv, 2019, preprint.
     DOI: 10.26434/chemrxiv.8326202.v1
   
   for DFT-D4:
   * E. Caldeweyher, C. Bannwarth and S. Grimme, J. Chem. Phys., 2017,
     147, 034112. DOI: 10.1063/1.4993215
   * E. Caldeweyher, S. Ehlert, A. Hansen, H. Neugebauer, S. Spicher,
     C. Bannwarth and S. Grimme, J. Chem. Phys., 2019, 150, 154122.
     DOI: 10.1063/1.5090222
   
   for sTDA-xTB:
   * S. Grimme and C. Bannwarth, J. Chem. Phys., 2016, 145, 054103.
     DOI: 10.1063/1.4959605
   
   in the mass-spec context:
   * V. Asgeirsson, C. Bauer and S. Grimme, Chem. Sci., 2017, 8, 4879.
     DOI: 10.1039/c7sc00601b
   
   for metadynamics refer to:
   * S. Grimme, J. Chem. Theory Comput., 2019, 155, 2847-2862
     DOI: 10.1021/acs.jctc.9b00143
   
   with help from (in alphabetical order)
   C. Bannwarth, F. Bohle, G. Brandenburg, E. Caldeweyher, M. Checinski,
   S. Dohm, S. Ehlert, S. Ehrlich, F. März, H. Neugebauer, J. Pisarek,
   P. Pracht, P. Shushkov, and S. Spicher.
   
 * started run on 2021/05/19 at 10:59:18.187     

           -------------------------------------------------
          |                Calculation Setup                |
           -------------------------------------------------

          program call               : /ihome/ghutchison/geoffh/xtb/xtb 340.xyz -opt
          hostname                   : smp-n122
          coordinate file            : 340.xyz
          omp threads                :                     1
          number of atoms            :                    30
          number of electrons        :                    82
          charge                     :                     0
          spin                       :                   0.0
          first test random number   :      0.80213845715940


########################################################################
# WARNING! Please study the warnings concerning your input carefully
#  - the use of '-opt' is discouraged, please use '--opt' next time
########################################################################

           ------------------------------------------------- 
          |                 G F N 2 - x T B                 |
          | Geometry, Frequencies, Noncovalent interactions |
          |            JCTC 2019 parametrisation            |
           ------------------------------------------------- 
             KAB for C  - Si     :                1.0500
             KAB for H  - Pd     :                0.9500
             k(s)              :                1.8500
             k(p)              :                2.2300
             k(d)              :                2.2300
             k(f)              :                2.0000
             kEN (H0ij)        :               -2.0000
             D4 a1             :                0.5200
             D4 a2             :                5.0000
             D4 s6             :                1.0000
             D4 s8             :                2.7000
             D4 s9             :                5.0000
             alphaj            :                2.0000

  Z AO/shell   Hii/eV     exponent
  1     Wed Apr 25 08:07:45 CEST 2018   EN: 2.200 GM2: 0.406  GM3: 0.0800  RAES: 1.40
     1s    -10.707211    1.230000
  6     Wed Apr 25 08:07:45 CEST 2018   EN: 2.550 GM2: 0.538  GM3: 0.1500  RAES: 3.00
     2s    -13.970922    2.096432
     2p    -10.063292    1.800000
 16     Tue Apr 24 11:44:34 CEST 2018   EN: 2.580 GM2: 0.340  GM3:-0.0502  RAES: 3.10
     3s    -20.029654    1.981333
     3p    -11.377694    2.025643
     3d     -0.420282    1.702555

           ------------------------------------------------- 
          |        Self-Consistent Charge Iterations        |
           ------------------------------------------------- 

          ...................................................
          :                      SETUP                      :
          :.................................................:
          :  # basis functions                  90          :
          :  # atomic orbitals                  88          :
          :  # shells                           48          :
          :  # electrons                        82          :
          :  max. iterations                   250          :
          :  Hamiltonian                  GFN2-xTB          :
          :  restarted?                      false          :
          :  GBSA solvation                  false          :
          :  PC potential                    false          :
          :  electronic temp.          300.0000000     K    :
          :  accuracy                    1.0000000          :
          :  -> integral cutoff          0.2500000E+02      :
          :  -> integral neglect         0.1000000E-07      :
          :  -> SCF convergence          0.1000000E-05 Eh   :
          :  -> wf. convergence          0.1000000E-03 e    :
          :  Broyden damping             0.4000000          :
          ...................................................

 iter      E             dE          RMSdq      gap      omega  full diag
   1    -44.2228807 -0.442229E+02  0.403E+00    3.14       0.0  T
   2    -44.2567054 -0.338247E-01  0.232E+00    2.86       1.0  T
   3    -44.2346077  0.220977E-01  0.121E+00    3.14       1.0  T
   4    -44.2636791 -0.290714E-01  0.488E-01    2.87       1.0  T
   5    -44.2663815 -0.270243E-02  0.126E-01    2.93       1.0  T
   6    -44.2664266 -0.450210E-04  0.406E-02    2.93       1.0  T
   7    -44.2664572 -0.306706E-04  0.149E-02    2.92       1.2  T
   8    -44.2664577 -0.440783E-06  0.774E-03    2.93       2.4  T
   9    -44.2664587 -0.104862E-05  0.280E-03    2.93       6.5  T
  10    -44.2664588 -0.969668E-07  0.800E-04    2.93      22.8  T
  11    -44.2664588 -0.177283E-08  0.362E-04    2.93      50.5  T

   *** convergence criteria satisfied after 11 iterations ***

         #    Occupation            Energy/Eh            Energy/eV
      -------------------------------------------------------------
         1        2.0000           -0.7295581             -19.8523
       ...           ...                  ...                  ...
        35        2.0000           -0.4253019             -11.5731
        36        2.0000           -0.4223375             -11.4924
        37        2.0000           -0.4192012             -11.4070
        38        2.0000           -0.4141496             -11.2696
        39        2.0000           -0.4006941             -10.9034
        40        2.0000           -0.3728668             -10.1462
        41        2.0000           -0.3631620              -9.8821 (HOMO)
        42                         -0.2556309              -6.9561 (LUMO)
        43                         -0.2400783              -6.5329
        44                         -0.2142583              -5.8303
        45                         -0.2060851              -5.6079
        46                         -0.1823489              -4.9620
       ...                                ...                  ...
        88                          0.7083511              19.2752
      -------------------------------------------------------------
                  HL-Gap            0.1075311 Eh            2.9261 eV
             Fermi-level           -0.3093964 Eh           -8.4191 eV

 SCC (total)                   0 d,  0 h,  0 min,  0.057 sec
 SCC setup                      ...        0 min,  0.000 sec (  0.648%)
 Dispersion                     ...        0 min,  0.000 sec (  0.866%)
 integral evaluation            ...        0 min,  0.015 sec ( 26.033%)
 zeroth order Hamiltonian       ...        0 min,  0.000 sec (  0.476%)
 iterations                     ...        0 min,  0.018 sec ( 32.296%)
 molecular gradient             ...        0 min,  0.022 sec ( 38.864%)
 printout                       ...        0 min,  0.000 sec (  0.728%)

         :::::::::::::::::::::::::::::::::::::::::::::::::::::
         ::                     SUMMARY                     ::
         :::::::::::::::::::::::::::::::::::::::::::::::::::::
         :: total energy             -43.615035565942 Eh    ::
         :: gradient norm              0.090086711961 Eh/a0 ::
         :: HOMO-LUMO gap              2.926070631104 eV    ::
         ::.................................................::
         :: SCC energy               -44.266458815856 Eh    ::
         :: -> isotropic ES            0.003271010180 Eh    ::
         :: -> anisotropic ES          0.006744415181 Eh    ::
         :: -> anisotropic XC          0.021533792505 Eh    ::
         :: -> dispersion             -0.036046318632 Eh    ::
         :: repulsion energy           0.651062733330 Eh    ::
         :: add. restraining           0.000000000000 Eh    ::
         :::::::::::::::::::::::::::::::::::::::::::::::::::::

      ----------------------------------------------------------- 
     |                   =====================                   |
     |                        A N C O P T                        |
     |                   =====================                   |
     |               Approximate Normal Coordinate               |
     |                Rational Function Optimizer                |
      ----------------------------------------------------------- 

          ...................................................
          :                      SETUP                      :
          :.................................................:
          :   optimization level            normal          :
          :   max. optcycles                   200          :
          :   ANC micro-cycles                  20          :
          :   degrees of freedom                84          :
          :.................................................:
          :   RF solver                   davidson          :
          :   input Hessian                  false          :
          :   write xtbopt.log                true          :
          :   linear?                        false          :
          :   energy convergence         0.5000000E-05 Eh   :
          :   grad. convergence          0.1000000E-02 Eh/α :
          :   maximium RF displ.         2.0000000          :
          :   Hlow (freq-cutoff)         0.5000000E-02      :
          :   Hmax (freq-cutoff)         5.0000000          :
          :   S6 in model hess.         20.0000000          :
          ...................................................

generating ANC from model Hessian ...
Using Lindh-Hessian (1995)
 Shifting diagonal of input Hessian by   4.354222220937541E-003
 Lowest  eigenvalues of input Hessian
   -0.000000    0.000000    0.000000    0.000000    0.000000    0.000000
    0.005000    0.006356    0.006636    0.006834    0.008212    0.009626
    0.010469    0.011395    0.013800    0.014412    0.018120    0.019389
 Highest eigenvalues
    1.695256    1.716130    1.784124    1.843360    1.971103    1.990804
 

........................................................................
.............................. CYCLE    1 ..............................
........................................................................
   1    -44.2664588 -0.442665E+02  0.195E-04    2.93       0.0  T
   2    -44.2664588  0.201865E-10  0.146E-04    2.93     124.9  T
   3    -44.2664588 -0.204565E-09  0.982E-05    2.93     186.0  T
     SCC iter.                  ...        0 min,  0.005 sec
     gradient                   ...        0 min,  0.022 sec
 * total energy  :   -43.6150356 Eh     change       -0.6844135E-07 Eh
   gradient norm :     0.0900860 Eh/α   predicted     0.0000000E+00 (-100.00%)
   displ. norm   :     0.3562497 α      lambda       -0.1272220E-01
   maximum displ.:     0.1782048 α      in ANC's #14, #24, #13, ...

........................................................................
.............................. CYCLE    2 ..............................
........................................................................
   1    -44.2983864 -0.442984E+02  0.299E-01    2.96       0.0  T
   2    -44.2984782 -0.918318E-04  0.157E-01    2.98       1.0  T
   3    -44.2983568  0.121388E-03  0.859E-02    2.95       1.0  T
   4    -44.2985563 -0.199524E-03  0.316E-02    2.97       1.0  T
   5    -44.2985652 -0.888860E-05  0.122E-02    2.97       1.5  T
   6    -44.2985662 -0.955524E-06  0.456E-03    2.97       4.0  T
   7    -44.2985666 -0.451938E-06  0.141E-03    2.97      12.9  T
     SCC iter.                  ...        0 min,  0.011 sec
     gradient                   ...        0 min,  0.020 sec
 * total energy  :   -43.6239093 Eh     change       -0.8873630E-02 Eh
   gradient norm :     0.0347764 Eh/α   predicted    -0.7168418E-02 ( -19.22%)
   displ. norm   :     0.3442346 α      lambda       -0.3798865E-02
   maximum displ.:     0.1799824 α      in ANC's #14, #9, #11, ...

........................................................................
.............................. CYCLE    3 ..............................
........................................................................
   1    -44.3133416 -0.443133E+02  0.193E-01    2.98       0.0  T
   2    -44.3133923 -0.507620E-04  0.109E-01    2.98       1.0  T
   3    -44.3133468  0.455453E-04  0.611E-02    2.97       1.0  T
   4    -44.3134290 -0.822083E-04  0.233E-02    2.98       1.0  T
   5    -44.3134350 -0.603196E-05  0.824E-03    2.98       2.2  T
   6    -44.3134352 -0.149967E-06  0.360E-03    2.98       5.1  T
   7    -44.3134354 -0.242814E-06  0.152E-03    2.98      12.0  T
     SCC iter.                  ...        0 min,  0.011 sec
     gradient                   ...        0 min,  0.021 sec
 * total energy  :   -43.6260773 Eh     change       -0.2168006E-02 Eh
   gradient norm :     0.0106501 Eh/α   predicted    -0.2124514E-02 (  -2.01%)
   displ. norm   :     0.1953028 α      lambda       -0.5386758E-03
   maximum displ.:     0.0962555 α      in ANC's #2, #8, #14, ...

........................................................................
.............................. CYCLE    4 ..............................
........................................................................
   1    -44.3132205 -0.443132E+02  0.750E-02    2.97       0.0  T
   2    -44.3132240 -0.354590E-05  0.430E-02    2.97       1.0  T
   3    -44.3132186  0.539703E-05  0.179E-02    2.97       1.0  T
   4    -44.3132249 -0.632858E-05  0.749E-03    2.97       2.4  T
   5    -44.3132256 -0.690048E-06  0.274E-03    2.97       6.7  T
   6    -44.3132257 -0.296849E-07  0.111E-03    2.97      16.4  T
     SCC iter.                  ...        0 min,  0.009 sec
     gradient                   ...        0 min,  0.021 sec
 * total energy  :   -43.6264708 Eh     change       -0.3934934E-03 Eh
   gradient norm :     0.0063505 Eh/α   predicted    -0.2796325E-03 ( -28.94%)
   displ. norm   :     0.2088053 α      lambda       -0.3101132E-03
   maximum displ.:     0.1322610 α      in ANC's #2, #1, #8, ...

........................................................................
.............................. CYCLE    5 ..............................
........................................................................
   1    -44.3122598 -0.443123E+02  0.787E-02    2.97       0.0  T
   2    -44.3122619 -0.208543E-05  0.444E-02    2.97       1.0  T
   3    -44.3122606  0.133893E-05  0.104E-02    2.97       1.8  T
   4    -44.3122620 -0.147225E-05  0.615E-03    2.97       3.0  T
   5    -44.3122625 -0.466995E-06  0.205E-03    2.97       8.9  T
   6    -44.3122625 -0.432983E-07  0.788E-04    2.97      23.2  T
     SCC iter.                  ...        0 min,  0.010 sec
     gradient                   ...        0 min,  0.021 sec
 * total energy  :   -43.6266747 Eh     change       -0.2039063E-03 Eh
   gradient norm :     0.0026981 Eh/α   predicted    -0.1618295E-03 ( -20.64%)
   displ. norm   :     0.1381028 α      lambda       -0.1057392E-03
   maximum displ.:     0.0980448 α      in ANC's #2, #1, #3, ...

........................................................................
.............................. CYCLE    6 ..............................
........................................................................
   1    -44.3124156 -0.443124E+02  0.469E-02    2.97       0.0  T
   2    -44.3124160 -0.348477E-06  0.267E-02    2.97       1.0  T
   3    -44.3124156  0.333153E-06  0.510E-03    2.97       3.6  T
   4    -44.3124160 -0.370063E-06  0.258E-03    2.97       7.1  T
   5    -44.3124161 -0.888308E-07  0.502E-04    2.97      36.4  T
   6    -44.3124161 -0.433314E-08  0.209E-04    2.97      87.3  T
     SCC iter.                  ...        0 min,  0.010 sec
     gradient                   ...        0 min,  0.022 sec
 * total energy  :   -43.6267624 Eh     change       -0.8776002E-04 Eh
   gradient norm :     0.0033933 Eh/α   predicted    -0.5388340E-04 ( -38.60%)
   displ. norm   :     0.1542031 α      lambda       -0.1118063E-03
   maximum displ.:     0.1070525 α      in ANC's #2, #1, #7, ...

........................................................................
.............................. CYCLE    7 ..............................
........................................................................
   1    -44.3129883 -0.443130E+02  0.501E-02    2.97       0.0  T
   2    -44.3129887 -0.400361E-06  0.287E-02    2.97       1.0  T
   3    -44.3129873  0.140442E-05  0.823E-03    2.97       2.2  T
   4    -44.3129889 -0.160645E-05  0.254E-03    2.97       7.2  T
   5    -44.3129890 -0.433473E-07  0.674E-04    2.97      27.1  T
   6    -44.3129890 -0.797793E-08  0.165E-04    2.97     110.7  T
     SCC iter.                  ...        0 min,  0.010 sec
     gradient                   ...        0 min,  0.022 sec
 * total energy  :   -43.6268561 Eh     change       -0.9370335E-04 Eh
   gradient norm :     0.0028811 Eh/α   predicted    -0.5723268E-04 ( -38.92%)
   displ. norm   :     0.1885756 α      lambda       -0.1060533E-03
   maximum displ.:     0.1299885 α      in ANC's #2, #1, #7, ...

........................................................................
.............................. CYCLE    8 ..............................
........................................................................
   1    -44.3133547 -0.443134E+02  0.593E-02    2.97       0.0  T
   2    -44.3133553 -0.620196E-06  0.339E-02    2.97       1.0  T
   3    -44.3133546  0.775011E-06  0.698E-03    2.97       2.6  T
   4    -44.3133554 -0.875252E-06  0.334E-03    2.97       5.5  T
   5    -44.3133556 -0.125353E-06  0.895E-04    2.97      20.4  T
   6    -44.3133556 -0.105831E-07  0.265E-04    2.97      68.9  T
     SCC iter.                  ...        0 min,  0.010 sec
     gradient                   ...        0 min,  0.022 sec
 * total energy  :   -43.6269379 Eh     change       -0.8174525E-04 Eh
   gradient norm :     0.0017957 Eh/α   predicted    -0.5491320E-04 ( -32.82%)
   displ. norm   :     0.2432448 α      lambda       -0.5586347E-04
   maximum displ.:     0.1686907 α      in ANC's #2, #1, #7, ...

........................................................................
.............................. CYCLE    9 ..............................
........................................................................
   1    -44.3134207 -0.443134E+02  0.745E-02    2.97       0.0  T
   2    -44.3134216 -0.877374E-06  0.423E-02    2.98       1.0  T
   3    -44.3134215  0.588702E-07  0.570E-03    2.98       3.2  T
   4    -44.3134215 -0.368136E-07  0.341E-03    2.98       5.3  T
   5    -44.3134218 -0.256148E-06  0.771E-04    2.98      23.7  T
   6    -44.3134218 -0.131792E-07  0.292E-04    2.98      62.5  T
     SCC iter.                  ...        0 min,  0.010 sec
     gradient                   ...        0 min,  0.022 sec
 * total energy  :   -43.6269879 Eh     change       -0.4998664E-04 Eh
   gradient norm :     0.0015248 Eh/α   predicted    -0.2866707E-04 ( -42.65%)
   displ. norm   :     0.0709869 α      lambda       -0.8580310E-05
   maximum displ.:     0.0486497 α      in ANC's #2, #1, #6, ...

........................................................................
.............................. CYCLE   10 ..............................
........................................................................
   1    -44.3136740 -0.443137E+02  0.235E-02    2.97       0.0  T
   2    -44.3136742 -0.158739E-06  0.129E-02    2.97       1.4  T
   3    -44.3136737  0.529301E-06  0.520E-03    2.97       3.5  T
   4    -44.3136743 -0.633125E-06  0.147E-03    2.97      12.4  T
   5    -44.3136743 -0.873647E-08  0.371E-04    2.97      49.2  T
   6    -44.3136743 -0.201010E-08  0.819E-05    2.97     222.8  T
     SCC iter.                  ...        0 min,  0.010 sec
     gradient                   ...        0 min,  0.022 sec
 * total energy  :   -43.6269968 Eh     change       -0.8910813E-05 Eh
   gradient norm :     0.0006460 Eh/α   predicted    -0.4301790E-05 ( -51.72%)
   displ. norm   :     0.0497930 α      lambda       -0.3659387E-05
   maximum displ.:     0.0334183 α      in ANC's #1, #2, #3, ...

........................................................................
.............................. CYCLE   11 ..............................
........................................................................
   1    -44.3134621 -0.443135E+02  0.201E-02    2.97       0.0  T
   2    -44.3134622 -0.136787E-06  0.107E-02    2.97       1.7  T
   3    -44.3134619  0.279489E-06  0.397E-03    2.97       4.6  T
   4    -44.3134623 -0.348746E-06  0.136E-03    2.97      13.4  T
   5    -44.3134623 -0.797132E-08  0.273E-04    2.97      66.8  T
   6    -44.3134623 -0.106239E-08  0.640E-05    2.97     285.4  T
     SCC iter.                  ...        0 min,  0.010 sec
     gradient                   ...        0 min,  0.022 sec
 * total energy  :   -43.6270003 Eh     change       -0.3536985E-05 Eh
   gradient norm :     0.0003053 Eh/α   predicted    -0.1831939E-05 ( -48.21%)
   displ. norm   :     0.0490638 α      lambda        0.8919938E-06
   maximum displ.:     0.0323212 α      in ANC's #1, #2, #3, ...

   *** GEOMETRY OPTIMIZATION CONVERGED AFTER 11 ITERATIONS ***

------------------------------------------------------------------------
 total energy gain   :        -0.0119647 Eh       -7.5080 kcal/mol
 total RMSD          :         0.2812779 a0        0.1488 Å
 total power (kW/mol):        -2.8557672 (step)  -60.5080 (real)
------------------------------------------------------------------------

 ANCopt (total)                0 d,  0 h,  0 min,  0.519 sec
 optimizer setup                ...        0 min,  0.000 sec (  0.027%)
 model hessian                  ...        0 min,  0.010 sec (  1.837%)
 ANC generation                 ...        0 min,  0.001 sec (  0.173%)
 coordinate transformation      ...        0 min,  0.000 sec (  0.040%)
 single point calculation       ...        0 min,  0.505 sec ( 97.217%)
 optimization log               ...        0 min,  0.001 sec (  0.248%)
 hessian update                 ...        0 min,  0.000 sec (  0.029%)
 rational function              ...        0 min,  0.001 sec (  0.262%)

================
 final structure:
================
$coord
   -5.08116593216741    0.32786119573995   -0.07380943336142      C 
   -5.61270827885106   -2.16381305253496   -0.17867446300500      C 
   -2.95427480118205   -4.06211629630799   -0.28247744954092      S 
   -1.03432005610114   -1.40260070308225   -0.17458183130591      C 
   -2.43355677303861    0.84919629208133   -0.06783162890208      C 
   -1.19534416652484    3.21710208004661    0.02813374892571      C 
   -2.81033785179751    5.55842490892062    0.14081378176763      C 
   -3.60344386319917    6.13768399543195    2.86075344129678      C 
    1.41348270638200    3.30763632081738    0.08159487944698      C 
    2.85839936202630    5.75699355215027    0.20474561007206      C 
    3.58498142324945    6.65739223972668   -2.44545655464129      C 
    2.81795160380319    1.03676536176083   -0.06029525625186      C 
    5.49604362130431    0.70842822037595   -0.10628398201716      C 
    6.20449533023261   -1.73627772067018   -0.25955649950907      C 
    3.68876248626725   -3.82053018713104   -0.35429892326801      S 
    1.58349678279450   -1.30830852098593   -0.18829707686426      C 
   -6.52614253747757    1.75288128578973    0.00780514276284      H 
   -7.43571984147987   -3.04913112041449   -0.20168067345077      H 
   -4.49444803847966    5.27697048941207   -1.01503392929428      H 
   -1.80215716457972    7.17390103792000   -0.64095491408583      H 
   -4.66776854298900    4.56611341861872    3.64892798129633      H 
   -4.77730240329422    7.82441814349154    2.92266443869088      H 
   -1.95075439671310    6.44481342435834    4.04380566826530      H 
    4.56828202181435    5.48059938459190    1.32326871615664      H 
    1.74669568617295    7.21092452399384    1.14677072654405      H 
    4.72099927065940    5.23498010089267   -3.39945164410473      H 
    4.66585056710033    8.40296646657784   -2.34160584606663      H 
    1.90300195547823    6.99358931605826   -3.57861095848686      H 
    6.83541680132923    2.23383722637025   -0.03975609153760      H 
    8.08613583819017   -2.48623518906123   -0.32871602099931      H 
$end
           -------------------------------------------------
          |                Final Singlepoint                |
           -------------------------------------------------

          ...................................................
          :                      SETUP                      :
          :.................................................:
          :  # basis functions                  90          :
          :  # atomic orbitals                  88          :
          :  # shells                           48          :
          :  # electrons                        82          :
          :  max. iterations                   250          :
          :  Hamiltonian                  GFN2-xTB          :
          :  restarted?                      false          :
          :  GBSA solvation                  false          :
          :  PC potential                    false          :
          :  electronic temp.          300.0000000     K    :
          :  accuracy                    1.0000000          :
          :  -> integral cutoff          0.2500000E+02      :
          :  -> integral neglect         0.1000000E-07      :
          :  -> SCF convergence          0.1000000E-05 Eh   :
          :  -> wf. convergence          0.1000000E-03 e    :
          :  Broyden damping             0.4000000          :
          ...................................................

 iter      E             dE          RMSdq      gap      omega  full diag
   1    -44.3134623 -0.443135E+02  0.211E-05    2.97       0.0  T
   2    -44.3134623 -0.142109E-11  0.986E-06    2.97    1851.3  T
   3    -44.3134623 -0.490274E-12  0.812E-06    2.97    2248.3  T

   *** convergence criteria satisfied after 3 iterations ***

         #    Occupation            Energy/Eh            Energy/eV
      -------------------------------------------------------------
         1        2.0000           -0.7262430             -19.7621
       ...           ...                  ...                  ...
        35        2.0000           -0.4265162             -11.6061
        36        2.0000           -0.4253152             -11.5734
        37        2.0000           -0.4193099             -11.4100
        38        2.0000           -0.4173471             -11.3566
        39        2.0000           -0.3991658             -10.8619
        40        2.0000           -0.3726385             -10.1400
        41        2.0000           -0.3670690              -9.9885 (HOMO)
        42                         -0.2577993              -7.0151 (LUMO)
        43                         -0.2302027              -6.2641
        44                         -0.2121836              -5.7738
        45                         -0.2103778              -5.7247
        46                         -0.1915174              -5.2115
       ...                                ...                  ...
        88                          0.7163972              19.4942
      -------------------------------------------------------------
                  HL-Gap            0.1092696 Eh            2.9734 eV
             Fermi-level           -0.3124342 Eh           -8.5018 eV

 SCC (total)                   0 d,  0 h,  0 min,  0.043 sec
 SCC setup                      ...        0 min,  0.000 sec (  0.599%)
 Dispersion                     ...        0 min,  0.000 sec (  0.642%)
 integral evaluation            ...        0 min,  0.014 sec ( 33.056%)
 zeroth order Hamiltonian       ...        0 min,  0.000 sec (  0.583%)
 iterations                     ...        0 min,  0.005 sec ( 12.601%)
 molecular gradient             ...        0 min,  0.022 sec ( 51.504%)
 printout                       ...        0 min,  0.000 sec (  0.905%)

         :::::::::::::::::::::::::::::::::::::::::::::::::::::
         ::                     SUMMARY                     ::
         :::::::::::::::::::::::::::::::::::::::::::::::::::::
         :: total energy             -43.627000299454 Eh    ::
         :: gradient norm              0.000305364522 Eh/a0 ::
         :: HOMO-LUMO gap              2.973377796274 eV    ::
         ::.................................................::
         :: SCC energy               -44.313462284335 Eh    ::
         :: -> isotropic ES            0.003624767178 Eh    ::
         :: -> anisotropic ES          0.006047332906 Eh    ::
         :: -> anisotropic XC          0.020853234908 Eh    ::
         :: -> dispersion             -0.036506607718 Eh    ::
         :: repulsion energy           0.686075121398 Eh    ::
         :: add. restraining           0.000000000000 Eh    ::
         :::::::::::::::::::::::::::::::::::::::::::::::::::::

           -------------------------------------------------
          |                Property Printout                |
           -------------------------------------------------

    * Orbital Energies and Occupations

         #    Occupation            Energy/Eh            Energy/eV
      -------------------------------------------------------------
         1        2.0000           -0.7262430             -19.7621
       ...           ...                  ...                  ...
        29        2.0000           -0.4625851             -12.5876
        30        2.0000           -0.4545873             -12.3700
        31        2.0000           -0.4538041             -12.3486
        32        2.0000           -0.4514325             -12.2841
        33        2.0000           -0.4433631             -12.0645
        34        2.0000           -0.4401742             -11.9778
        35        2.0000           -0.4265162             -11.6061
        36        2.0000           -0.4253152             -11.5734
        37        2.0000           -0.4193099             -11.4100
        38        2.0000           -0.4173471             -11.3566
        39        2.0000           -0.3991658             -10.8619
        40        2.0000           -0.3726385             -10.1400
        41        2.0000           -0.3670690              -9.9885 (HOMO)
        42                         -0.2577993              -7.0151 (LUMO)
        43                         -0.2302027              -6.2641
        44                         -0.2121836              -5.7738
        45                         -0.2103778              -5.7247
        46                         -0.1915174              -5.2115
        47                         -0.1626013              -4.4246
        48                         -0.1153312              -3.1383
        49                         -0.1142825              -3.1098
        50                         -0.0988199              -2.6890
        51                         -0.0058648              -0.1596
        52                         -0.0000277              -0.0008
       ...                                ...                  ...
        88                          0.7163972              19.4942
      -------------------------------------------------------------
                  HL-Gap            0.1092696 Eh            2.9734 eV
             Fermi-level           -0.3124342 Eh           -8.5018 eV

     #   Z        covCN         q      C6AA      α(0)
     1   6 C      3.081    -0.048    29.110     8.845
     2   6 C      2.933    -0.014    28.374     8.736
     3  16 S      2.246    -0.052   143.216    20.142
     4   6 C      3.025     0.018    27.588     8.616
     5   6 C      3.137    -0.011    28.052     8.669
     6   6 C      2.966    -0.005    28.153     8.703
     7   6 C      3.806    -0.056    21.574     6.612
     8   6 C      3.753    -0.097    22.405     6.750
     9   6 C      2.966    -0.005    28.154     8.703
    10   6 C      3.806    -0.056    21.574     6.612
    11   6 C      3.753    -0.097    22.405     6.750
    12   6 C      3.137    -0.011    28.052     8.669
    13   6 C      3.081    -0.049    29.111     8.845
    14   6 C      2.933    -0.014    28.374     8.736
    15  16 S      2.246    -0.052   143.216    20.142
    16   6 C      3.025     0.018    27.587     8.616
    17   1 H      0.926     0.040     2.445     2.445
    18   1 H      0.926     0.043     2.411     2.428
    19   1 H      0.924     0.038     2.471     2.458
    20   1 H      0.925     0.040     2.449     2.447
    21   1 H      0.925     0.037     2.492     2.469
    22   1 H      0.925     0.034     2.527     2.486
    23   1 H      0.925     0.034     2.535     2.490
    24   1 H      0.924     0.038     2.470     2.458
    25   1 H      0.925     0.040     2.450     2.448
    26   1 H      0.925     0.037     2.491     2.468
    27   1 H      0.925     0.034     2.526     2.486
    28   1 H      0.925     0.034     2.536     2.491
    29   1 H      0.926     0.040     2.444     2.445
    30   1 H      0.926     0.043     2.411     2.428

 Mol. C6AA /au·bohr⁶  :      13855.860216
 Mol. C8AA /au·bohr⁸  :     396800.800118
 Mol. α(0) /au        :        188.590606


Wiberg/Mayer (AO) data.
largest (>0.10) Wiberg bond orders for each atom
          total WBO             WBO to atom ...
     1  C   3.985        C    2 1.677    C    5 1.197    H   17 0.960    S    3 0.100
     2  C   3.943        C    1 1.677    S    3 1.153    H   18 0.970
     3  S   2.557        C    2 1.153    C    4 1.112    C    1 0.100
     4  C   3.955        C   16 1.325    C    5 1.309    S    3 1.112
     5  C   3.984        C    4 1.309    C    6 1.260    C    1 1.197
     6  C   3.987        C    9 1.494    C    5 1.260    C    7 1.009
     7  C   3.996        C    6 1.009    C    8 1.001    H   20 0.970    H   19 0.970
     8  C   3.994        C    7 1.001    H   23 0.988    H   21 0.987    H   22 0.986
     9  C   3.987        C    6 1.494    C   12 1.260    C   10 1.009
    10  C   3.996        C    9 1.009    C   11 1.001    H   25 0.970    H   24 0.970
    11  C   3.994        C   10 1.001    H   28 0.988    H   26 0.987    H   27 0.986
    12  C   3.984        C   16 1.309    C    9 1.260    C   13 1.197
    13  C   3.985        C   14 1.677    C   12 1.197    H   29 0.960    S   15 0.100
    14  C   3.943        C   13 1.677    S   15 1.153    H   30 0.970
    15  S   2.557        C   14 1.153    C   16 1.112    C   13 0.100
    16  C   3.955        C    4 1.325    C   12 1.309    S   15 1.112
    17  H   0.998        C    1 0.960
    18  H   0.997        C    2 0.970
    19  H   0.998        C    7 0.970
    20  H   0.997        C    7 0.970
    21  H   0.999        C    8 0.987
    22  H   0.998        C    8 0.986
    23  H   0.999        C    8 0.988
    24  H   0.998        C   10 0.970
    25  H   0.997        C   10 0.970
    26  H   0.999        C   11 0.987
    27  H   0.998        C   11 0.986
    28  H   0.999        C   11 0.988
    29  H   0.998        C   13 0.960
    30  H   0.997        C   14 0.970

molecular dipole:
                 x           y           z       tot (Debye)
 q only:       -0.026       0.724       0.036
   full:       -0.040       1.108       0.055       2.821
molecular quadrupole (traceless):
                xx          xy          yy          xz          yz          zz
 q only:        3.346       0.387      -0.051      -0.329       0.026      -3.294
  q+dip:        9.341       0.786      -2.210       0.139       0.061      -7.131
   full:        8.068       0.807      -3.738      -0.110      -0.172      -4.331

           -------------------------------------------------
          |                Geometry Summary                 |
           -------------------------------------------------

      molecular mass/u    :      246.3846000
   center of mass at/Å    :        0.1089057       0.2888650      -0.0466559
  moments of inertia/u·Å² :        0.1000455E+04   0.1058179E+04   0.1939320E+04
rotational constants/cm⁻¹ :        0.1684997E-01   0.1593079E-01   0.8692549E-02

 * 30 selected distances

     #   Z        #   Z                                     value/Å
     1   6 C      2   6 C                                 1.3493475
     2   6 C      3  16 S                                 1.7294950
     3  16 S      4   6 C                                 1.7367087
     1   6 C      5   6 C                                 1.4279611
     4   6 C      5   6 C                                 1.4040508
     5   6 C      6   6 C                                 1.4149291
     7   6 C      8   6 C                                 1.5302860
     6   6 C      9   6 C                                 1.3816526
    10   6 C     11   6 C                                 1.5302477
     9   6 C     12   6 C                                 1.4149452
    12   6 C     13   6 C                                 1.4280039
    13   6 C     14   6 C                                 1.3493484
    14   6 C     15  16 S                                 1.7295271
     4   6 C     16   6 C                                 1.3862065
    12   6 C     16   6 C                                 1.4040295
    15  16 S     16   6 C                                 1.7367141 (max)
     1   6 C     17   1 H                                 1.0748033
     2   6 C     18   1 H                                 1.0725065 (min)
     7   6 C     19   1 H                                 1.0911101
     7   6 C     20   1 H                                 1.0893026
     8   6 C     21   1 H                                 1.0875642
     8   6 C     22   1 H                                 1.0879515
     8   6 C     23   1 H                                 1.0877552
    10   6 C     24   1 H                                 1.0910791
    10   6 C     25   1 H                                 1.0892843
    11   6 C     26   1 H                                 1.0875719
    11   6 C     27   1 H                                 1.0878541
    11   6 C     28   1 H                                 1.0878580
    13   6 C     29   1 H                                 1.0747926
    14   6 C     30   1 H                                 1.0725198

 * 3 distinct bonds (by element types)

   Z      Z             #   av. dist./Å        max./Å        min./Å
   1 H    6 C          14     1.0844252     1.0911101     1.0725065
   6 C    6 C          12     1.4184174     1.5302860     1.3493475
   6 C   16 S           4     1.7331112     1.7367141     1.7294950


optimized geometry written to: xtbopt.xyz


           -------------------------------------------------
          | TOTAL ENERGY              -43.627000299454 Eh   |
          | GRADIENT NORM               0.000305364522 Eh/α |
          | HOMO-LUMO GAP               2.973377796274 eV   |
           -------------------------------------------------

------------------------------------------------------------------------
 * finished run on 2021/05/19 at 10:59:18.833     
------------------------------------------------------------------------
 total:
 * wall-time:     0 d,  0 h,  0 min,  0.646 sec
 *  cpu-time:     0 d,  0 h,  0 min,  0.645 sec
 * ratio c/w:     0.999 speedup
 SCF:
 * wall-time:     0 d,  0 h,  0 min,  0.057 sec
 *  cpu-time:     0 d,  0 h,  0 min,  0.057 sec
 * ratio c/w:     1.000 speedup
 ANC optimizer:
 * wall-time:     0 d,  0 h,  0 min,  0.563 sec
 *  cpu-time:     0 d,  0 h,  0 min,  0.563 sec
 * ratio c/w:     1.000 speedup

