      -----------------------------------------------------------      
     |                   =====================                   |     
     |                           x T B                           |     
     |                   =====================                   |     
     |                         S. Grimme                         |     
     |          Mulliken Center for Theoretical Chemistry        |     
     |                    University of Bonn                     |     
     |                Version 6.2 RC2 (SAW190805)                |     
      -----------------------------------------------------------      

   This program is distributed in the hope that it will be useful,
   but WITHOUT ANY WARRANTY; without even the implied warranty of
   MERCHANTABILITY or FITNESS FOR A PARTICULAR PURPOSE.
   
   FOR NON-COMMERCIAL, ACADEMIA USE ONLY.
   
   Cite this work as:
   * S. Grimme, C. Bannwarth, P. Shushkov, J. Chem. Theory Comput., 2017,
     13, 1989-2009. DOI: 10.1021/acs.jctc.7b00118
   * C. Bannwarth, S. Ehlert and S. Grimme., J. Chem. Theory Comput., 2019,
     15, 1652-1671. DOI: 10.1021/acs.jctc.8b01176
   * P. Pracht, E. Caldeweyher, S. Ehlert, S. Grimme, ChemRxiv, 2019, preprint.
     DOI: 10.26434/chemrxiv.8326202.v1
   
   for DFT-D4:
   * E. Caldeweyher, C. Bannwarth and S. Grimme, J. Chem. Phys., 2017,
     147, 034112. DOI: 10.1063/1.4993215
   * E. Caldeweyher, S. Ehlert, A. Hansen, H. Neugebauer, S. Spicher,
     C. Bannwarth and S. Grimme, J. Chem. Phys., 2019, 150, 154122.
     DOI: 10.1063/1.5090222
   
   for sTDA-xTB:
   * S. Grimme and C. Bannwarth, J. Chem. Phys., 2016, 145, 054103.
     DOI: 10.1063/1.4959605
   
   in the mass-spec context:
   * V. Asgeirsson, C. Bauer and S. Grimme, Chem. Sci., 2017, 8, 4879.
     DOI: 10.1039/c7sc00601b
   
   for metadynamics refer to:
   * S. Grimme, J. Chem. Theory Comput., 2019, 155, 2847-2862
     DOI: 10.1021/acs.jctc.9b00143
   
   with help from (in alphabetical order)
   C. Bannwarth, F. Bohle, G. Brandenburg, E. Caldeweyher, M. Checinski,
   S. Dohm, S. Ehlert, S. Ehrlich, F. März, H. Neugebauer, J. Pisarek,
   P. Pracht, P. Shushkov, and S. Spicher.
   
 * started run on 2021/05/19 at 10:59:21.257     

           -------------------------------------------------
          |                Calculation Setup                |
           -------------------------------------------------

          program call               : /ihome/ghutchison/geoffh/xtb/xtb 345.xyz -opt
          hostname                   : smp-n122
          coordinate file            : 345.xyz
          omp threads                :                     1
          number of atoms            :                    27
          number of electrons        :                    70
          charge                     :                     0
          spin                       :                   0.0
          first test random number   :      0.79481396896727


########################################################################
# WARNING! Please study the warnings concerning your input carefully
#  - the use of '-opt' is discouraged, please use '--opt' next time
########################################################################

           ------------------------------------------------- 
          |                 G F N 2 - x T B                 |
          | Geometry, Frequencies, Noncovalent interactions |
          |            JCTC 2019 parametrisation            |
           ------------------------------------------------- 
             KAB for C  - Si     :                1.0500
             KAB for H  - Pd     :                0.9500
             k(s)              :                1.8500
             k(p)              :                2.2300
             k(d)              :                2.2300
             k(f)              :                2.0000
             kEN (H0ij)        :               -2.0000
             D4 a1             :                0.5200
             D4 a2             :                5.0000
             D4 s6             :                1.0000
             D4 s8             :                2.7000
             D4 s9             :                5.0000
             alphaj            :                2.0000

  Z AO/shell   Hii/eV     exponent
  1     Wed Apr 25 08:07:45 CEST 2018   EN: 2.200 GM2: 0.406  GM3: 0.0800  RAES: 1.40
     1s    -10.707211    1.230000
  6     Wed Apr 25 08:07:45 CEST 2018   EN: 2.550 GM2: 0.538  GM3: 0.1500  RAES: 3.00
     2s    -13.970922    2.096432
     2p    -10.063292    1.800000
  8     Wed Apr 25 08:07:45 CEST 2018   EN: 3.440 GM2: 0.452  GM3:-0.0517  RAES: 1.80
     2s    -20.229985    2.439742
     2p    -15.503117    2.137023
 16     Tue Apr 24 11:44:34 CEST 2018   EN: 2.580 GM2: 0.340  GM3:-0.0502  RAES: 3.10
     3s    -20.029654    1.981333
     3p    -11.377694    2.025643
     3d     -0.420282    1.702555

           ------------------------------------------------- 
          |        Self-Consistent Charge Iterations        |
           ------------------------------------------------- 

          ...................................................
          :                      SETUP                      :
          :.................................................:
          :  # basis functions                  72          :
          :  # atomic orbitals                  71          :
          :  # shells                           41          :
          :  # electrons                        70          :
          :  max. iterations                   250          :
          :  Hamiltonian                  GFN2-xTB          :
          :  restarted?                      false          :
          :  GBSA solvation                  false          :
          :  PC potential                    false          :
          :  electronic temp.          300.0000000     K    :
          :  accuracy                    1.0000000          :
          :  -> integral cutoff          0.2500000E+02      :
          :  -> integral neglect         0.1000000E-07      :
          :  -> SCF convergence          0.1000000E-05 Eh   :
          :  -> wf. convergence          0.1000000E-03 e    :
          :  Broyden damping             0.4000000          :
          ...................................................

 iter      E             dE          RMSdq      gap      omega  full diag
   1    -38.4287934 -0.384288E+02  0.403E+00    3.06       0.0  T
   2    -38.4797428 -0.509494E-01  0.219E+00    3.09       1.0  T
   3    -38.4780921  0.165063E-02  0.847E-01    3.08       1.0  T
   4    -38.4791153 -0.102318E-02  0.427E-01    3.07       1.0  T
   5    -38.4826962 -0.358093E-02  0.119E-01    3.07       1.0  T
   6    -38.4827739 -0.776187E-04  0.461E-02    3.07       1.0  T
   7    -38.4827916 -0.177859E-04  0.227E-02    3.07       1.0  T
   8    -38.4827953 -0.370884E-05  0.132E-02    3.07       1.5  T
   9    -38.4827966 -0.127902E-05  0.381E-03    3.07       5.1  T
  10    -38.4827966 -0.158610E-07  0.189E-03    3.07      10.2  T
  11    -38.4827967 -0.310141E-07  0.854E-04    3.07      22.5  T
  12    -38.4827967 -0.567691E-08  0.489E-04    3.07      39.3  T

   *** convergence criteria satisfied after 12 iterations ***

         #    Occupation            Energy/Eh            Energy/eV
      -------------------------------------------------------------
         1        2.0000           -0.7250434             -19.7294
       ...           ...                  ...                  ...
        29        2.0000           -0.4390208             -11.9464
        30        2.0000           -0.4358717             -11.8607
        31        2.0000           -0.4258713             -11.5885
        32        2.0000           -0.4200622             -11.4305
        33        2.0000           -0.3989622             -10.8563
        34        2.0000           -0.3819117             -10.3923
        35        2.0000           -0.3687552             -10.0343 (HOMO)
        36                         -0.2559040              -6.9635 (LUMO)
        37                         -0.2025226              -5.5109
        38                         -0.1925061              -5.2384
        39                         -0.1545937              -4.2067
        40                         -0.1056685              -2.8754
       ...                                ...                  ...
        71                          0.6666425              18.1403
      -------------------------------------------------------------
                  HL-Gap            0.1128512 Eh            3.0708 eV
             Fermi-level           -0.3123296 Eh           -8.4989 eV

 SCC (total)                   0 d,  0 h,  0 min,  0.041 sec
 SCC setup                      ...        0 min,  0.000 sec (  0.737%)
 Dispersion                     ...        0 min,  0.000 sec (  0.907%)
 integral evaluation            ...        0 min,  0.010 sec ( 23.198%)
 zeroth order Hamiltonian       ...        0 min,  0.000 sec (  0.446%)
 iterations                     ...        0 min,  0.015 sec ( 37.467%)
 molecular gradient             ...        0 min,  0.015 sec ( 36.235%)
 printout                       ...        0 min,  0.000 sec (  0.892%)

         :::::::::::::::::::::::::::::::::::::::::::::::::::::
         ::                     SUMMARY                     ::
         :::::::::::::::::::::::::::::::::::::::::::::::::::::
         :: total energy             -37.973440849894 Eh    ::
         :: gradient norm              0.051559617079 Eh/a0 ::
         :: HOMO-LUMO gap              3.070838593480 eV    ::
         ::.................................................::
         :: SCC energy               -38.482796678887 Eh    ::
         :: -> isotropic ES            0.021527661782 Eh    ::
         :: -> anisotropic ES          0.004583678456 Eh    ::
         :: -> anisotropic XC          0.015809421040 Eh    ::
         :: -> dispersion             -0.026299219491 Eh    ::
         :: repulsion energy           0.509191156795 Eh    ::
         :: add. restraining           0.000000000000 Eh    ::
         :::::::::::::::::::::::::::::::::::::::::::::::::::::

      ----------------------------------------------------------- 
     |                   =====================                   |
     |                        A N C O P T                        |
     |                   =====================                   |
     |               Approximate Normal Coordinate               |
     |                Rational Function Optimizer                |
      ----------------------------------------------------------- 

          ...................................................
          :                      SETUP                      :
          :.................................................:
          :   optimization level            normal          :
          :   max. optcycles                   200          :
          :   ANC micro-cycles                  20          :
          :   degrees of freedom                75          :
          :.................................................:
          :   RF solver                   davidson          :
          :   input Hessian                  false          :
          :   write xtbopt.log                true          :
          :   linear?                        false          :
          :   energy convergence         0.5000000E-05 Eh   :
          :   grad. convergence          0.1000000E-02 Eh/α :
          :   maximium RF displ.         2.0000000          :
          :   Hlow (freq-cutoff)         0.5000000E-02      :
          :   Hmax (freq-cutoff)         5.0000000          :
          :   S6 in model hess.         20.0000000          :
          ...................................................

generating ANC from model Hessian ...
Using Lindh-Hessian (1995)
 Shifting diagonal of input Hessian by   4.189809369082875E-003
 Lowest  eigenvalues of input Hessian
   -0.000000   -0.000000    0.000000    0.000000    0.000000    0.000000
    0.005000    0.006627    0.007828    0.008137    0.009000    0.010616
    0.011562    0.014336    0.018247    0.020134    0.024025    0.025011
 Highest eigenvalues
    1.488068    1.525376    1.621075    1.763364    1.822382    1.971026
 

........................................................................
.............................. CYCLE    1 ..............................
........................................................................
   1    -38.4827967 -0.384828E+02  0.199E-04    3.07       0.0  T
   2    -38.4827967 -0.212374E-09  0.149E-04    3.07     129.4  T
   3    -38.4827967 -0.214683E-09  0.902E-05    3.07     213.4  T
     SCC iter.                  ...        0 min,  0.004 sec
     gradient                   ...        0 min,  0.015 sec
 * total energy  :   -37.9734408 Eh     change        0.1212975E-08 Eh
   gradient norm :     0.0515612 Eh/α   predicted     0.0000000E+00 (-100.00%)
   displ. norm   :     0.3163792 α      lambda       -0.6078220E-02
   maximum displ.:     0.1356902 α      in ANC's #6, #13, #9, ...

........................................................................
.............................. CYCLE    2 ..............................
........................................................................
   1    -38.5032285 -0.385032E+02  0.202E-01    3.13       0.0  T
   2    -38.5032600 -0.314712E-04  0.111E-01    3.13       1.0  T
   3    -38.5031971  0.628459E-04  0.673E-02    3.13       1.0  T
   4    -38.5033031 -0.105946E-03  0.193E-02    3.13       1.0  T
   5    -38.5033041 -0.102490E-05  0.942E-03    3.13       2.0  T
   6    -38.5033052 -0.109637E-05  0.251E-03    3.13       7.7  T
   7    -38.5033053 -0.118367E-06  0.907E-04    3.13      21.2  T
     SCC iter.                  ...        0 min,  0.008 sec
     gradient                   ...        0 min,  0.014 sec
 * total energy  :   -37.9775618 Eh     change       -0.4120997E-02 Eh
   gradient norm :     0.0199777 Eh/α   predicted    -0.3343325E-02 ( -18.87%)
   displ. norm   :     0.2731930 α      lambda       -0.1649282E-02
   maximum displ.:     0.1472268 α      in ANC's #6, #9, #3, ...

........................................................................
.............................. CYCLE    3 ..............................
........................................................................
   1    -38.5113373 -0.385113E+02  0.154E-01    3.15       0.0  T
   2    -38.5113539 -0.166547E-04  0.843E-02    3.15       1.0  T
   3    -38.5113189  0.350725E-04  0.476E-02    3.15       1.0  T
   4    -38.5113685 -0.496466E-04  0.145E-02    3.15       1.3  T
   5    -38.5113695 -0.967829E-06  0.625E-03    3.15       3.1  T
   6    -38.5113699 -0.447975E-06  0.204E-03    3.15       9.4  T
   7    -38.5113700 -0.727629E-07  0.827E-04    3.15      23.3  T
     SCC iter.                  ...        0 min,  0.008 sec
     gradient                   ...        0 min,  0.014 sec
 * total energy  :   -37.9785374 Eh     change       -0.9755719E-03 Eh
   gradient norm :     0.0055947 Eh/α   predicted    -0.8861908E-03 (  -9.16%)
   displ. norm   :     0.1726726 α      lambda       -0.3152517E-03
   maximum displ.:     0.0749628 α      in ANC's #3, #2, #9, ...

........................................................................
.............................. CYCLE    4 ..............................
........................................................................
   1    -38.5111303 -0.385111E+02  0.104E-01    3.14       0.0  T
   2    -38.5111332 -0.293709E-05  0.575E-02    3.15       1.0  T
   3    -38.5111297  0.356657E-05  0.166E-02    3.15       1.2  T
   4    -38.5111338 -0.411921E-05  0.783E-03    3.15       2.5  T
   5    -38.5111344 -0.571459E-06  0.194E-03    3.15       9.9  T
   6    -38.5111344 -0.268320E-07  0.908E-04    3.15      21.2  T
     SCC iter.                  ...        0 min,  0.007 sec
     gradient                   ...        0 min,  0.014 sec
 * total energy  :   -37.9787464 Eh     change       -0.2090174E-03 Eh
   gradient norm :     0.0038860 Eh/α   predicted    -0.1623399E-03 ( -22.33%)
   displ. norm   :     0.1872324 α      lambda       -0.1982570E-03
   maximum displ.:     0.0956581 α      in ANC's #3, #2, #7, ...

........................................................................
.............................. CYCLE    5 ..............................
........................................................................
   1    -38.5097530 -0.385098E+02  0.105E-01    3.13       0.0  T
   2    -38.5097547 -0.174259E-05  0.594E-02    3.13       1.0  T
   3    -38.5097542  0.508930E-06  0.104E-02    3.13       1.9  T
   4    -38.5097546 -0.391152E-06  0.712E-03    3.13       2.7  T
   5    -38.5097553 -0.686362E-06  0.141E-03    3.13      13.7  T
   6    -38.5097553 -0.158464E-07  0.675E-04    3.13      28.5  T
   7    -38.5097553  0.120245E-09  0.396E-04    3.13      48.6  T
     SCC iter.                  ...        0 min,  0.008 sec
     gradient                   ...        0 min,  0.015 sec
 * total energy  :   -37.9788601 Eh     change       -0.1136485E-03 Eh
   gradient norm :     0.0031636 Eh/α   predicted    -0.1026044E-03 (  -9.72%)
   displ. norm   :     0.1066505 α      lambda       -0.7906375E-04
   maximum displ.:     0.0602973 α      in ANC's #3, #2, #1, ...

........................................................................
.............................. CYCLE    6 ..............................
........................................................................
   1    -38.5097754 -0.385098E+02  0.601E-02    3.13       0.0  T
   2    -38.5097758 -0.395636E-06  0.354E-02    3.13       1.0  T
   3    -38.5097732  0.259038E-05  0.111E-02    3.13       1.7  T
   4    -38.5097761 -0.293922E-05  0.266E-03    3.13       7.2  T
   5    -38.5097761 -0.186145E-07  0.962E-04    3.13      20.0  T
   6    -38.5097762 -0.115927E-07  0.440E-04    3.13      43.7  T
     SCC iter.                  ...        0 min,  0.007 sec
     gradient                   ...        0 min,  0.015 sec
 * total energy  :   -37.9789168 Eh     change       -0.5676450E-04 Eh
   gradient norm :     0.0025100 Eh/α   predicted    -0.3998167E-04 ( -29.57%)
   displ. norm   :     0.1299836 α      lambda       -0.7269904E-04
   maximum displ.:     0.0751143 α      in ANC's #3, #2, #1, ...

........................................................................
.............................. CYCLE    7 ..............................
........................................................................
   1    -38.5103496 -0.385103E+02  0.673E-02    3.12       0.0  T
   2    -38.5103501 -0.531371E-06  0.401E-02    3.12       1.0  T
   3    -38.5103468  0.333899E-05  0.129E-02    3.12       1.5  T
   4    -38.5103505 -0.377181E-05  0.246E-03    3.12       7.8  T
   5    -38.5103506 -0.335330E-07  0.110E-03    3.12      17.6  T
   6    -38.5103506 -0.661048E-08  0.527E-04    3.12      36.5  T
   7    -38.5103506 -0.212143E-08  0.243E-04    3.12      79.1  T
     SCC iter.                  ...        0 min,  0.008 sec
     gradient                   ...        0 min,  0.015 sec
 * total energy  :   -37.9789737 Eh     change       -0.5682836E-04 Eh
   gradient norm :     0.0021369 Eh/α   predicted    -0.3696441E-04 ( -34.95%)
   displ. norm   :     0.1719051 α      lambda       -0.7530209E-04
   maximum displ.:     0.0982831 α      in ANC's #3, #1, #2, ...

........................................................................
.............................. CYCLE    8 ..............................
........................................................................
   1    -38.5107436 -0.385107E+02  0.859E-02    3.11       0.0  T
   2    -38.5107444 -0.750835E-06  0.508E-02    3.11       1.0  T
   3    -38.5107408  0.352939E-05  0.144E-02    3.11       1.3  T
   4    -38.5107448 -0.401747E-05  0.318E-03    3.11       6.1  T
   5    -38.5107449 -0.490648E-07  0.128E-03    3.11      15.0  T
   6    -38.5107449 -0.975849E-08  0.566E-04    3.11      34.0  T
   7    -38.5107449 -0.263349E-08  0.312E-04    3.11      61.6  T
     SCC iter.                  ...        0 min,  0.008 sec
     gradient                   ...        0 min,  0.015 sec
 * total energy  :   -37.9790324 Eh     change       -0.5870504E-04 Eh
   gradient norm :     0.0023785 Eh/α   predicted    -0.3876981E-04 ( -33.96%)
   displ. norm   :     0.1987103 α      lambda       -0.7035645E-04
   maximum displ.:     0.1130961 α      in ANC's #1, #3, #2, ...

........................................................................
.............................. CYCLE    9 ..............................
........................................................................
   1    -38.5108125 -0.385108E+02  0.963E-02    3.10       0.0  T
   2    -38.5108133 -0.821760E-06  0.564E-02    3.10       1.0  T
   3    -38.5108102  0.311940E-05  0.143E-02    3.10       1.3  T
   4    -38.5108138 -0.361479E-05  0.385E-03    3.10       5.0  T
   5    -38.5108139 -0.429895E-07  0.123E-03    3.10      15.6  T
   6    -38.5108139 -0.189890E-07  0.545E-04    3.10      35.3  T
   7    -38.5108139 -0.231172E-08  0.321E-04    3.10      59.9  T
     SCC iter.                  ...        0 min,  0.008 sec
     gradient                   ...        0 min,  0.015 sec
 * total energy  :   -37.9790875 Eh     change       -0.5511658E-04 Eh
   gradient norm :     0.0026383 Eh/α   predicted    -0.3656767E-04 ( -33.65%)
   displ. norm   :     0.2105818 α      lambda       -0.6542664E-04
   maximum displ.:     0.1272835 α      in ANC's #1, #3, #2, ...

........................................................................
.............................. CYCLE   10 ..............................
........................................................................
   1    -38.5107122 -0.385107E+02  0.991E-02    3.10       0.0  T
   2    -38.5107131 -0.871073E-06  0.577E-02    3.10       1.0  T
   3    -38.5107097  0.337076E-05  0.145E-02    3.10       1.3  T
   4    -38.5107136 -0.389294E-05  0.411E-03    3.10       4.7  T
   5    -38.5107136 -0.321064E-07  0.127E-03    3.10      15.1  T
   6    -38.5107136 -0.319947E-07  0.473E-04    3.10      40.7  T
   7    -38.5107136 -0.169661E-08  0.256E-04    3.10      75.1  T
     SCC iter.                  ...        0 min,  0.008 sec
     gradient                   ...        0 min,  0.015 sec
 * total energy  :   -37.9791384 Eh     change       -0.5094273E-04 Eh
   gradient norm :     0.0024076 Eh/α   predicted    -0.3416544E-04 ( -32.93%)
   displ. norm   :     0.1968331 α      lambda       -0.5153120E-04
   maximum displ.:     0.1261856 α      in ANC's #1, #3, #2, ...

........................................................................
.............................. CYCLE   11 ..............................
........................................................................
   1    -38.5106222 -0.385106E+02  0.917E-02    3.09       0.0  T
   2    -38.5106231 -0.918893E-06  0.527E-02    3.09       1.0  T
   3    -38.5106209  0.217418E-05  0.120E-02    3.09       1.6  T
   4    -38.5106235 -0.252831E-05  0.432E-03    3.09       4.5  T
   5    -38.5106236 -0.882705E-07  0.120E-03    3.09      16.1  T
   6    -38.5106236 -0.301047E-07  0.374E-04    3.09      51.5  T
   7    -38.5106236 -0.121913E-08  0.201E-04    3.09      95.9  T
     SCC iter.                  ...        0 min,  0.008 sec
     gradient                   ...        0 min,  0.015 sec
 * total energy  :   -37.9791776 Eh     change       -0.3912834E-04 Eh
   gradient norm :     0.0017162 Eh/α   predicted    -0.2676756E-04 ( -31.59%)
   displ. norm   :     0.2252861 α      lambda       -0.3064536E-04
   maximum displ.:     0.1551350 α      in ANC's #1, #3, #2, ...

........................................................................
.............................. CYCLE   12 ..............................
........................................................................
   1    -38.5104697 -0.385105E+02  0.105E-01    3.08       0.0  T
   2    -38.5104709 -0.126027E-05  0.602E-02    3.08       1.0  T
   3    -38.5104694  0.152606E-05  0.112E-02    3.08       1.7  T
   4    -38.5104711 -0.173398E-05  0.522E-03    3.08       3.7  T
   5    -38.5104714 -0.261323E-06  0.115E-03    3.08      16.8  T
   6    -38.5104714 -0.249829E-07  0.400E-04    3.08      48.1  T
   7    -38.5104714 -0.162749E-08  0.220E-04    3.08      87.5  T
     SCC iter.                  ...        0 min,  0.008 sec
     gradient                   ...        0 min,  0.015 sec
 * total energy  :   -37.9792080 Eh     change       -0.3047533E-04 Eh
   gradient norm :     0.0015831 Eh/α   predicted    -0.1566919E-04 ( -48.58%)
   displ. norm   :     0.0902520 α      lambda       -0.1362192E-04
   maximum displ.:     0.0707851 α      in ANC's #1, #3, #4, ...

........................................................................
.............................. CYCLE   13 ..............................
........................................................................
   1    -38.5111487 -0.385111E+02  0.423E-02    3.09       0.0  T
   2    -38.5111489 -0.294030E-06  0.238E-02    3.09       1.0  T
   3    -38.5111489  0.746449E-07  0.425E-03    3.09       4.5  T
   4    -38.5111490 -0.868352E-07  0.257E-03    3.09       7.5  T
   5    -38.5111490 -0.807602E-07  0.492E-04    3.09      39.1  T
   6    -38.5111490 -0.345612E-08  0.215E-04    3.09      89.6  T
     SCC iter.                  ...        0 min,  0.007 sec
     gradient                   ...        0 min,  0.015 sec
 * total energy  :   -37.9792229 Eh     change       -0.1489095E-04 Eh
   gradient norm :     0.0014446 Eh/α   predicted    -0.6836247E-05 ( -54.09%)
   displ. norm   :     0.1009796 α      lambda       -0.1677072E-04
   maximum displ.:     0.0830904 α      in ANC's #1, #3, #4, ...

........................................................................
.............................. CYCLE   14 ..............................
........................................................................
   1    -38.5111199 -0.385111E+02  0.480E-02    3.09       0.0  T
   2    -38.5111202 -0.317709E-06  0.277E-02    3.09       1.0  T
   3    -38.5111198  0.397362E-06  0.539E-03    3.09       3.6  T
   4    -38.5111203 -0.502580E-06  0.234E-03    3.09       8.2  T
   5    -38.5111203 -0.430019E-07  0.572E-04    3.09      33.7  T
   6    -38.5111203 -0.322831E-08  0.321E-04    3.09      60.0  T
     SCC iter.                  ...        0 min,  0.007 sec
     gradient                   ...        0 min,  0.015 sec
 * total energy  :   -37.9792394 Eh     change       -0.1646613E-04 Eh
   gradient norm :     0.0011688 Eh/α   predicted    -0.8424555E-05 ( -48.84%)
   displ. norm   :     0.0690015 α      lambda       -0.9729115E-05
   maximum displ.:     0.0528420 α      in ANC's #1, #4, #2, ...

........................................................................
.............................. CYCLE   15 ..............................
........................................................................
   1    -38.5112972 -0.385113E+02  0.334E-02    3.09       0.0  T
   2    -38.5112974 -0.192905E-06  0.193E-02    3.09       1.0  T
   3    -38.5112969  0.425193E-06  0.554E-03    3.09       3.5  T
   4    -38.5112974 -0.513763E-06  0.209E-03    3.09       9.2  T
   5    -38.5112975 -0.223855E-07  0.577E-04    3.09      33.4  T
   6    -38.5112975 -0.359982E-08  0.294E-04    3.09      65.4  T
     SCC iter.                  ...        0 min,  0.007 sec
     gradient                   ...        0 min,  0.015 sec
 * total energy  :   -37.9792507 Eh     change       -0.1130057E-04 Eh
   gradient norm :     0.0012072 Eh/α   predicted    -0.4875414E-05 ( -56.86%)
   displ. norm   :     0.0929945 α      lambda       -0.1248487E-04
   maximum displ.:     0.0695330 α      in ANC's #1, #4, #2, ...

........................................................................
.............................. CYCLE   16 ..............................
........................................................................
   1    -38.5109702 -0.385110E+02  0.468E-02    3.09       0.0  T
   2    -38.5109707 -0.469053E-06  0.263E-02    3.09       1.0  T
   3    -38.5109706  0.692701E-07  0.518E-03    3.09       3.7  T
   4    -38.5109707 -0.911594E-07  0.337E-03    3.09       5.7  T
   5    -38.5109709 -0.149586E-06  0.713E-04    3.09      27.0  T
   6    -38.5109709 -0.636879E-08  0.373E-04    3.09      51.6  T
     SCC iter.                  ...        0 min,  0.007 sec
     gradient                   ...        0 min,  0.015 sec
 * total energy  :   -37.9792617 Eh     change       -0.1096419E-04 Eh
   gradient norm :     0.0016060 Eh/α   predicted    -0.6267591E-05 ( -42.84%)
   displ. norm   :     0.0712572 α      lambda       -0.7846655E-05
   maximum displ.:     0.0488538 α      in ANC's #1, #4, #2, ...

........................................................................
.............................. CYCLE   17 ..............................
........................................................................
   1    -38.5111471 -0.385111E+02  0.355E-02    3.09       0.0  T
   2    -38.5111474 -0.271050E-06  0.200E-02    3.09       1.0  T
   3    -38.5111471  0.274899E-06  0.500E-03    3.09       3.8  T
   4    -38.5111474 -0.334423E-06  0.254E-03    3.09       7.6  T
   5    -38.5111475 -0.541198E-07  0.592E-04    3.09      32.5  T
   6    -38.5111475 -0.426510E-08  0.247E-04    3.09      78.0  T
     SCC iter.                  ...        0 min,  0.007 sec
     gradient                   ...        0 min,  0.015 sec
 * total energy  :   -37.9792696 Eh     change       -0.7932160E-05 Eh
   gradient norm :     0.0007206 Eh/α   predicted    -0.3935090E-05 ( -50.39%)
   displ. norm   :     0.0709129 α      lambda        0.1617955E-05
   maximum displ.:     0.0483496 α      in ANC's #1, #4, #2, ...

........................................................................
.............................. CYCLE   18 ..............................
........................................................................
   1    -38.5112520 -0.385113E+02  0.353E-02    3.09       0.0  T
   2    -38.5112522 -0.266394E-06  0.199E-02    3.09       1.0  T
   3    -38.5112520  0.235128E-06  0.482E-03    3.09       4.0  T
   4    -38.5112523 -0.286192E-06  0.254E-03    3.09       7.6  T
   5    -38.5112523 -0.580155E-07  0.571E-04    3.09      33.7  T
   6    -38.5112523 -0.387442E-08  0.244E-04    3.09      78.7  T
     SCC iter.                  ...        0 min,  0.007 sec
     gradient                   ...        0 min,  0.015 sec
 * total energy  :   -37.9792695 Eh     change        0.6425176E-07 Eh
   gradient norm :     0.0015735 Eh/α   predicted     0.8102195E-06 (1161.01%)
   displ. norm   :     0.0703134 α      lambda        0.1143582E-04
   maximum displ.:     0.0474614 α      in ANC's #1, #4, #2, ...

........................................................................
.............................. CYCLE   19 ..............................
........................................................................
   1    -38.5112901 -0.385113E+02  0.351E-02    3.09       0.0  T
   2    -38.5112903 -0.261535E-06  0.198E-02    3.09       1.0  T
   3    -38.5112901  0.232908E-06  0.479E-03    3.09       4.0  T
   4    -38.5112904 -0.283283E-06  0.253E-03    3.09       7.6  T
   5    -38.5112904 -0.576835E-07  0.558E-04    3.09      34.5  T
   6    -38.5112904 -0.367155E-08  0.244E-04    3.09      79.0  T
     SCC iter.                  ...        0 min,  0.007 sec
     gradient                   ...        0 min,  0.015 sec
 * total energy  :   -37.9792614 Eh     change        0.8166089E-05 Eh
   gradient norm :     0.0029051 Eh/α   predicted     0.5728695E-05 ( -29.85%)
   displ. norm   :     0.0484417 α      lambda       -0.1527081E-04
   maximum displ.:     0.0280513 α      in ANC's #1, #4, #2, ...

........................................................................
.............................. CYCLE   20 ..............................
........................................................................
   1    -38.5110148 -0.385110E+02  0.244E-02    3.09       0.0  T
   2    -38.5110150 -0.148110E-06  0.139E-02    3.09       1.4  T
   3    -38.5110148  0.196195E-06  0.389E-03    3.09       5.0  T
   4    -38.5110150 -0.239238E-06  0.177E-03    3.09      10.9  T
   5    -38.5110150 -0.228927E-07  0.497E-04    3.09      38.7  T
   6    -38.5110150 -0.243543E-08  0.195E-04    3.09      98.4  T
     SCC iter.                  ...        0 min,  0.007 sec
     gradient                   ...        0 min,  0.015 sec
 * total energy  :   -37.9792721 Eh     change       -0.1077131E-04 Eh
   gradient norm :     0.0014197 Eh/α   predicted    -0.7655210E-05 ( -28.93%)
   displ. norm   :     0.0422040 α      lambda       -0.5930225E-05
   maximum displ.:     0.0258214 α      in ANC's #2, #4, #3, ...
 * RMSD in coord.:     0.3764121 α      energy gain  -0.5831290E-02 Eh

generating ANC from model Hessian ...
Using Lindh-Hessian (1995)
 Shifting diagonal of input Hessian by   4.120073418443130E-003
 Lowest  eigenvalues of input Hessian
   -0.000000   -0.000000   -0.000000   -0.000000   -0.000000    0.000000
    0.005000    0.006768    0.007919    0.008045    0.009170    0.010755
    0.012275    0.014841    0.018978    0.021241    0.024699    0.026106
 Highest eigenvalues
    1.526786    1.561227    1.694764    1.835667    1.888750    2.021326
 

........................................................................
.............................. CYCLE   21 ..............................
........................................................................
   1    -38.5108146 -0.385108E+02  0.219E-02    3.09       0.0  T
   2    -38.5108147 -0.126326E-06  0.128E-02    3.09       1.5  T
   3    -38.5108144  0.348277E-06  0.459E-03    3.09       4.2  T
   4    -38.5108148 -0.405355E-06  0.144E-03    3.09      13.4  T
   5    -38.5108148 -0.123457E-07  0.475E-04    3.09      40.5  T
   6    -38.5108148 -0.890523E-09  0.190E-04    3.09     101.1  T
     SCC iter.                  ...        0 min,  0.007 sec
     gradient                   ...        0 min,  0.015 sec
 * total energy  :   -37.9792755 Eh     change       -0.3381300E-05 Eh
   gradient norm :     0.0006537 Eh/α   predicted     0.0000000E+00 (-100.00%)
   displ. norm   :     0.0180479 α      lambda       -0.1573993E-05
   maximum displ.:     0.0157837 α      in ANC's #1, #5, #2, ...

   *** GEOMETRY OPTIMIZATION CONVERGED AFTER 21 ITERATIONS ***

------------------------------------------------------------------------
 total energy gain   :        -0.0058347 Eh       -3.6613 kcal/mol
 total RMSD          :         0.3764121 a0        0.1992 Å
 total power (kW/mol):        -0.7294727 (step)  -21.8376 (real)
------------------------------------------------------------------------

 ANCopt (total)                0 d,  0 h,  0 min,  0.702 sec
 optimizer setup                ...        0 min,  0.000 sec (  0.020%)
 model hessian                  ...        0 min,  0.019 sec (  2.675%)
 ANC generation                 ...        0 min,  0.002 sec (  0.215%)
 coordinate transformation      ...        0 min,  0.000 sec (  0.054%)
 single point calculation       ...        0 min,  0.674 sec ( 96.064%)
 optimization log               ...        0 min,  0.002 sec (  0.312%)
 hessian update                 ...        0 min,  0.000 sec (  0.039%)
 rational function              ...        0 min,  0.003 sec (  0.412%)

================
 final structure:
================
$coord
    2.00763217530606   -2.03565617471508   -0.64441106696827      C 
    4.53280971453343   -0.05769579861749   -0.24074982998685      S 
    2.54308980638966    2.52511135679055    0.26322268287798      C 
    0.05011712251155    1.80597124597851    0.13082106374475      C 
   -0.23842088966934   -0.80937064902904   -0.39432749512735      C 
   -2.75837914279524   -2.10286403477551   -0.62985957967962      C 
   -2.59854714463608   -3.79512643290174   -2.69855829445954      O 
   -4.57580504699865   -5.55540278280457   -2.85179482061147      C 
   -4.86660394905031   -0.13352607372968   -0.92201817193029      C 
   -4.55572065423817    1.93164838649793    1.06120014378442      C 
   -2.18675863866246    3.48975348057416    0.52586699020255      C 
    3.72710203887231    4.93144618759792    0.73497748474553      C 
    2.67820319966909    7.21003745459620    0.57066808604154      C 
    2.30572777739032   -3.99112463224844   -1.07254619476238      H 
   -3.11079692260956   -3.20471406667741    1.11544440373126      H 
   -4.05983785106544   -6.86873984074754   -4.34891454896396      H 
   -6.38205184747564   -4.66321850584996   -3.33093796850250      H 
   -4.79475175556020   -6.59511474865951   -1.07036695652334      H 
   -6.70686163510950   -1.04244292931166   -0.71717246220595      H 
   -4.74702159021845    0.67811378775783   -2.81590551988297      H 
   -4.40919372410976    1.06356436090221    2.92960339185083      H 
   -6.20864752467651    3.16599973313278    1.06083512045064      H 
   -1.81811664897136    4.78852490875293    2.08867142799297      H 
   -2.49271309596616    4.62080200082052   -1.18007296854836      H 
    5.71051597571424    4.79066704237411    1.22484826453933      H 
    0.74923622978092    7.50850190753745    0.01200511077759      H 
    3.76827688419251    8.88110960593383    0.96722930153251      H 
$end
           -------------------------------------------------
          |                Final Singlepoint                |
           -------------------------------------------------

          ...................................................
          :                      SETUP                      :
          :.................................................:
          :  # basis functions                  72          :
          :  # atomic orbitals                  71          :
          :  # shells                           41          :
          :  # electrons                        70          :
          :  max. iterations                   250          :
          :  Hamiltonian                  GFN2-xTB          :
          :  restarted?                      false          :
          :  GBSA solvation                  false          :
          :  PC potential                    false          :
          :  electronic temp.          300.0000000     K    :
          :  accuracy                    1.0000000          :
          :  -> integral cutoff          0.2500000E+02      :
          :  -> integral neglect         0.1000000E-07      :
          :  -> SCF convergence          0.1000000E-05 Eh   :
          :  -> wf. convergence          0.1000000E-03 e    :
          :  Broyden damping             0.4000000          :
          ...................................................

 iter      E             dE          RMSdq      gap      omega  full diag
   1    -38.5108148 -0.385108E+02  0.815E-05    3.09       0.0  T
   2    -38.5108148 -0.159943E-10  0.376E-05    3.09     511.3  T
   3    -38.5108148 -0.200799E-10  0.341E-05    3.09     563.7  T

   *** convergence criteria satisfied after 3 iterations ***

         #    Occupation            Energy/Eh            Energy/eV
      -------------------------------------------------------------
         1        2.0000           -0.7232516             -19.6807
       ...           ...                  ...                  ...
        29        2.0000           -0.4377282             -11.9112
        30        2.0000           -0.4362409             -11.8707
        31        2.0000           -0.4275142             -11.6333
        32        2.0000           -0.4199975             -11.4287
        33        2.0000           -0.3996013             -10.8737
        34        2.0000           -0.3827354             -10.4148
        35        2.0000           -0.3696480             -10.0586 (HOMO)
        36                         -0.2561427              -6.9700 (LUMO)
        37                         -0.1994217              -5.4265
        38                         -0.1923497              -5.2341
        39                         -0.1444650              -3.9311
        40                         -0.1084857              -2.9520
       ...                                ...                  ...
        71                          0.6863813              18.6774
      -------------------------------------------------------------
                  HL-Gap            0.1135053 Eh            3.0886 eV
             Fermi-level           -0.3128953 Eh           -8.5143 eV

 SCC (total)                   0 d,  0 h,  0 min,  0.029 sec
 SCC setup                      ...        0 min,  0.000 sec (  0.683%)
 Dispersion                     ...        0 min,  0.000 sec (  0.806%)
 integral evaluation            ...        0 min,  0.009 sec ( 30.909%)
 zeroth order Hamiltonian       ...        0 min,  0.000 sec (  0.564%)
 iterations                     ...        0 min,  0.004 sec ( 14.378%)
 molecular gradient             ...        0 min,  0.015 sec ( 51.273%)
 printout                       ...        0 min,  0.000 sec (  1.192%)

         :::::::::::::::::::::::::::::::::::::::::::::::::::::
         ::                     SUMMARY                     ::
         :::::::::::::::::::::::::::::::::::::::::::::::::::::
         :: total energy             -37.979275497513 Eh    ::
         :: gradient norm              0.000653747357 Eh/a0 ::
         :: HOMO-LUMO gap              3.088636387805 eV    ::
         ::.................................................::
         :: SCC energy               -38.510814776581 Eh    ::
         :: -> isotropic ES            0.020856501547 Eh    ::
         :: -> anisotropic ES          0.003973698777 Eh    ::
         :: -> anisotropic XC          0.015279364864 Eh    ::
         :: -> dispersion             -0.026513693607 Eh    ::
         :: repulsion energy           0.531385426783 Eh    ::
         :: add. restraining           0.000000000000 Eh    ::
         :::::::::::::::::::::::::::::::::::::::::::::::::::::

           -------------------------------------------------
          |                Property Printout                |
           -------------------------------------------------

    * Orbital Energies and Occupations

         #    Occupation            Energy/Eh            Energy/eV
      -------------------------------------------------------------
         1        2.0000           -0.7232516             -19.6807
       ...           ...                  ...                  ...
        23        2.0000           -0.4717671             -12.8374
        24        2.0000           -0.4692504             -12.7690
        25        2.0000           -0.4623177             -12.5803
        26        2.0000           -0.4557030             -12.4003
        27        2.0000           -0.4473956             -12.1743
        28        2.0000           -0.4444045             -12.0929
        29        2.0000           -0.4377282             -11.9112
        30        2.0000           -0.4362409             -11.8707
        31        2.0000           -0.4275142             -11.6333
        32        2.0000           -0.4199975             -11.4287
        33        2.0000           -0.3996013             -10.8737
        34        2.0000           -0.3827354             -10.4148
        35        2.0000           -0.3696480             -10.0586 (HOMO)
        36                         -0.2561427              -6.9700 (LUMO)
        37                         -0.1994217              -5.4265
        38                         -0.1923497              -5.2341
        39                         -0.1444650              -3.9311
        40                         -0.1084857              -2.9520
        41                          0.0028982               0.0789
        42                          0.0269172               0.7325
        43                          0.0381490               1.0381
        44                          0.0431655               1.1746
        45                          0.0779473               2.1211
        46                          0.0873877               2.3779
       ...                                ...                  ...
        71                          0.6863813              18.6774
      -------------------------------------------------------------
                  HL-Gap            0.1135053 Eh            3.0886 eV
             Fermi-level           -0.3128953 Eh           -8.5143 eV

     #   Z        covCN         q      C6AA      α(0)
     1   6 C      2.935    -0.021    28.525     8.759
     2  16 S      2.343    -0.043   142.849    20.116
     3   6 C      2.987     0.012    27.743     8.640
     4   6 C      3.151    -0.011    28.013     8.657
     5   6 C      3.170    -0.015    28.000     8.645
     6   6 C      3.752     0.121    18.656     6.159
     7   8 O      1.701    -0.320    19.339     5.937
     8   6 C      3.645     0.045    20.152     6.452
     9   6 C      3.806    -0.065    21.737     6.637
    10   6 C      3.807    -0.055    21.564     6.611
    11   6 C      3.807    -0.055    21.556     6.609
    12   6 C      2.936    -0.029    28.736     8.792
    13   6 C      2.838    -0.095    30.378     9.032
    14   1 H      0.927     0.052     2.295     2.369
    15   1 H      0.922     0.012     2.856     2.643
    16   1 H      0.925     0.057     2.240     2.341
    17   1 H      0.924     0.028     2.618     2.530
    18   1 H      0.924     0.025     2.658     2.550
    19   1 H      0.924     0.029     2.598     2.521
    20   1 H      0.924     0.046     2.367     2.406
    21   1 H      0.924     0.033     2.542     2.493
    22   1 H      0.924     0.035     2.517     2.481
    23   1 H      0.924     0.045     2.384     2.414
    24   1 H      0.924     0.045     2.378     2.411
    25   1 H      0.925     0.043     2.408     2.427
    26   1 H      0.926     0.041     2.431     2.438
    27   1 H      0.926     0.039     2.457     2.451

 Mol. C6AA /au·bohr⁶  :       8653.243946
 Mol. C8AA /au·bohr⁸  :     224543.136372
 Mol. α(0) /au        :        145.521664


Wiberg/Mayer (AO) data.
largest (>0.10) Wiberg bond orders for each atom
          total WBO             WBO to atom ...
     1  C   3.951        C    5 1.583    S    2 1.201    H   14 0.969    C    3 0.102
     2  S   2.609        C    1 1.201    C    3 1.123
     3  C   3.944        C    4 1.505    C   12 1.132    S    2 1.123    C    1 0.102
     4  C   3.985        C    3 1.505    C    5 1.247    C   11 1.012
     5  C   3.983        C    1 1.583    C    4 1.247    C    6 0.985
     6  C   3.953        C    5 0.985    C    9 0.982    O    7 0.968    H   15 0.946
     7  O   2.074        C    8 0.999    C    6 0.968
     8  C   3.955        O    7 0.999    H   16 0.979    H   17 0.977    H   18 0.976
     9  C   3.997        C   10 1.008    C    6 0.982    H   19 0.976    H   20 0.976
    10  C   3.998        C    9 1.008    C   11 1.005    H   21 0.978    H   22 0.977
    11  C   3.998        C    4 1.012    C   10 1.005    H   23 0.964    H   24 0.957
    12  C   3.991        C   13 1.864    C    3 1.132    H   25 0.962
    13  C   3.991        C   12 1.864    H   27 0.978    H   26 0.973
    14  H   0.997        C    1 0.969
    15  H   1.000        C    6 0.946
    16  H   0.996        C    8 0.979
    17  H   0.999        C    8 0.977
    18  H   0.999        C    8 0.976
    19  H   0.998        C    9 0.976
    20  H   0.998        C    9 0.976
    21  H   0.999        C   10 0.978
    22  H   0.998        C   10 0.977
    23  H   0.998        C   11 0.964
    24  H   0.998        C   11 0.957
    25  H   0.998        C   12 0.962
    26  H   0.998        C   13 0.973
    27  H   0.998        C   13 0.978

molecular dipole:
                 x           y           z       tot (Debye)
 q only:       -0.584       0.165       0.293
   full:       -1.059       0.049       0.359       2.844
molecular quadrupole (traceless):
                xx          xy          yy          xz          yz          zz
 q only:        1.891       1.822       2.407       0.757       0.415      -4.298
  q+dip:        1.154       1.701       4.501       1.248      -0.985      -5.656
   full:        0.433       2.411       4.120       0.944      -0.531      -4.553

           -------------------------------------------------
          |                Geometry Summary                 |
           -------------------------------------------------

      molecular mass/u    :      194.2910000
   center of mass at/Å    :       -0.0732667       0.2229135      -0.2232376
  moments of inertia/u·Å² :        0.4201727E+03   0.9798768E+03   0.1347753E+04
rotational constants/cm⁻¹ :        0.4012072E-01   0.1720383E-01   0.1250795E-01

 * 26 selected distances

     #   Z        #   Z                                     value/Å
     1   6 C      2  16 S                                 1.7107893
     2  16 S      3   6 C                                 1.7457931 (max)
     3   6 C      4   6 C                                 1.3748027
     1   6 C      5   6 C                                 1.3606209
     4   6 C      5   6 C                                 1.4198378
     6   6 C      7   8 O                                 1.4168530
     7   8 O      8   6 C                                 1.4032283
     6   6 C      9   6 C                                 1.5344553
     9   6 C     10   6 C                                 1.5240626
     4   6 C     11   6 C                                 1.4962525
    10   6 C     11   6 C                                 1.5269542
    12   6 C     13   6 C                                 1.3302431
     1   6 C     14   1 H                                 1.0709818 (min)
     6   6 C     15   1 H                                 1.1080368
     8   6 C     16   1 H                                 1.0886713
     8   6 C     17   1 H                                 1.0958057
     8   6 C     18   1 H                                 1.0976346
     9   6 C     19   1 H                                 1.0915222
     9   6 C     20   1 H                                 1.0921927
    10   6 C     21   1 H                                 1.0929747
    10   6 C     22   1 H                                 1.0916698
    11   6 C     23   1 H                                 1.0928583
    11   6 C     24   1 H                                 1.0951681
    12   6 C     25   1 H                                 1.0836800
    13   6 C     26   1 H                                 1.0743861
    13   6 C     27   1 H                                 1.0764568

 * 4 distinct bonds (by element types)

   Z      Z             #   av. dist./Å        max./Å        min./Å
   1 H    6 C          14     1.0894313     1.1080368     1.0709818
   6 C    6 C           8     1.4459036     1.5344553     1.3302431
   6 C    8 O           2     1.4100407     1.4168530     1.4032283
   6 C   16 S           2     1.7282912     1.7457931     1.7107893


optimized geometry written to: xtbopt.xyz


           -------------------------------------------------
          | TOTAL ENERGY              -37.979275497513 Eh   |
          | GRADIENT NORM               0.000653747357 Eh/α |
          | HOMO-LUMO GAP               3.088636387805 eV   |
           -------------------------------------------------

------------------------------------------------------------------------
 * finished run on 2021/05/19 at 10:59:22.052     
------------------------------------------------------------------------
 total:
 * wall-time:     0 d,  0 h,  0 min,  0.795 sec
 *  cpu-time:     0 d,  0 h,  0 min,  0.793 sec
 * ratio c/w:     0.998 speedup
 SCF:
 * wall-time:     0 d,  0 h,  0 min,  0.041 sec
 *  cpu-time:     0 d,  0 h,  0 min,  0.041 sec
 * ratio c/w:     1.000 speedup
 ANC optimizer:
 * wall-time:     0 d,  0 h,  0 min,  0.731 sec
 *  cpu-time:     0 d,  0 h,  0 min,  0.731 sec
 * ratio c/w:     1.000 speedup

