      -----------------------------------------------------------      
     |                   =====================                   |     
     |                           x T B                           |     
     |                   =====================                   |     
     |                         S. Grimme                         |     
     |          Mulliken Center for Theoretical Chemistry        |     
     |                    University of Bonn                     |     
     |                Version 6.2 RC2 (SAW190805)                |     
      -----------------------------------------------------------      

   This program is distributed in the hope that it will be useful,
   but WITHOUT ANY WARRANTY; without even the implied warranty of
   MERCHANTABILITY or FITNESS FOR A PARTICULAR PURPOSE.
   
   FOR NON-COMMERCIAL, ACADEMIA USE ONLY.
   
   Cite this work as:
   * S. Grimme, C. Bannwarth, P. Shushkov, J. Chem. Theory Comput., 2017,
     13, 1989-2009. DOI: 10.1021/acs.jctc.7b00118
   * C. Bannwarth, S. Ehlert and S. Grimme., J. Chem. Theory Comput., 2019,
     15, 1652-1671. DOI: 10.1021/acs.jctc.8b01176
   * P. Pracht, E. Caldeweyher, S. Ehlert, S. Grimme, ChemRxiv, 2019, preprint.
     DOI: 10.26434/chemrxiv.8326202.v1
   
   for DFT-D4:
   * E. Caldeweyher, C. Bannwarth and S. Grimme, J. Chem. Phys., 2017,
     147, 034112. DOI: 10.1063/1.4993215
   * E. Caldeweyher, S. Ehlert, A. Hansen, H. Neugebauer, S. Spicher,
     C. Bannwarth and S. Grimme, J. Chem. Phys., 2019, 150, 154122.
     DOI: 10.1063/1.5090222
   
   for sTDA-xTB:
   * S. Grimme and C. Bannwarth, J. Chem. Phys., 2016, 145, 054103.
     DOI: 10.1063/1.4959605
   
   in the mass-spec context:
   * V. Asgeirsson, C. Bauer and S. Grimme, Chem. Sci., 2017, 8, 4879.
     DOI: 10.1039/c7sc00601b
   
   for metadynamics refer to:
   * S. Grimme, J. Chem. Theory Comput., 2019, 155, 2847-2862
     DOI: 10.1021/acs.jctc.9b00143
   
   with help from (in alphabetical order)
   C. Bannwarth, F. Bohle, G. Brandenburg, E. Caldeweyher, M. Checinski,
   S. Dohm, S. Ehlert, S. Ehrlich, F. März, H. Neugebauer, J. Pisarek,
   P. Pracht, P. Shushkov, and S. Spicher.
   
 * started run on 2021/05/19 at 10:58:23.454     

           -------------------------------------------------
          |                Calculation Setup                |
           -------------------------------------------------

          program call               : /ihome/ghutchison/geoffh/xtb/xtb 35.xyz -opt
          hostname                   : smp-n58
          coordinate file            : 35.xyz
          omp threads                :                     1
          number of atoms            :                    27
          number of electrons        :                    68
          charge                     :                     0
          spin                       :                   0.0
          first test random number   :      0.87900460358494


########################################################################
# WARNING! Please study the warnings concerning your input carefully
#  - the use of '-opt' is discouraged, please use '--opt' next time
########################################################################

           ------------------------------------------------- 
          |                 G F N 2 - x T B                 |
          | Geometry, Frequencies, Noncovalent interactions |
          |            JCTC 2019 parametrisation            |
           ------------------------------------------------- 
             KAB for C  - Si     :                1.0500
             KAB for H  - Pd     :                0.9500
             k(s)              :                1.8500
             k(p)              :                2.2300
             k(d)              :                2.2300
             k(f)              :                2.0000
             kEN (H0ij)        :               -2.0000
             D4 a1             :                0.5200
             D4 a2             :                5.0000
             D4 s6             :                1.0000
             D4 s8             :                2.7000
             D4 s9             :                5.0000
             alphaj            :                2.0000

  Z AO/shell   Hii/eV     exponent
  1     Wed Apr 25 08:07:45 CEST 2018   EN: 2.200 GM2: 0.406  GM3: 0.0800  RAES: 1.40
     1s    -10.707211    1.230000
  6     Wed Apr 25 08:07:45 CEST 2018   EN: 2.550 GM2: 0.538  GM3: 0.1500  RAES: 3.00
     2s    -13.970922    2.096432
     2p    -10.063292    1.800000
 16     Tue Apr 24 11:44:34 CEST 2018   EN: 2.580 GM2: 0.340  GM3:-0.0502  RAES: 3.10
     3s    -20.029654    1.981333
     3p    -11.377694    2.025643
     3d     -0.420282    1.702555

           ------------------------------------------------- 
          |        Self-Consistent Charge Iterations        |
           ------------------------------------------------- 

          ...................................................
          :                      SETUP                      :
          :.................................................:
          :  # basis functions                  72          :
          :  # atomic orbitals                  71          :
          :  # shells                           41          :
          :  # electrons                        68          :
          :  max. iterations                   250          :
          :  Hamiltonian                  GFN2-xTB          :
          :  restarted?                      false          :
          :  GBSA solvation                  false          :
          :  PC potential                    false          :
          :  electronic temp.          300.0000000     K    :
          :  accuracy                    1.0000000          :
          :  -> integral cutoff          0.2500000E+02      :
          :  -> integral neglect         0.1000000E-07      :
          :  -> SCF convergence          0.1000000E-05 Eh   :
          :  -> wf. convergence          0.1000000E-03 e    :
          :  Broyden damping             0.4000000          :
          ...................................................

 iter      E             dE          RMSdq      gap      omega  full diag
   1    -36.5441510 -0.365442E+02  0.406E+00    3.05       0.0  T
   2    -36.5819812 -0.378302E-01  0.235E+00    3.09       1.0  T
   3    -36.5760428  0.593835E-02  0.906E-01    3.07       1.0  T
   4    -36.5820903 -0.604746E-02  0.480E-01    3.07       1.0  T
   5    -36.5856073 -0.351704E-02  0.108E-01    3.07       1.0  T
   6    -36.5855964  0.109452E-04  0.743E-02    3.07       1.0  T
   7    -36.5856950 -0.986088E-04  0.203E-02    3.07       1.0  T
   8    -36.5856965 -0.151898E-05  0.877E-03    3.07       2.2  T
   9    -36.5856965  0.190321E-07  0.446E-03    3.07       4.3  T
  10    -36.5856967 -0.234695E-06  0.199E-03    3.07       9.7  T
  11    -36.5856968 -0.326753E-07  0.810E-04    3.07      23.8  T
  12    -36.5856968 -0.362245E-08  0.355E-04    3.07      54.2  T

   *** convergence criteria satisfied after 12 iterations ***

         #    Occupation            Energy/Eh            Energy/eV
      -------------------------------------------------------------
         1        2.0000           -0.7241451             -19.7050
       ...           ...                  ...                  ...
        28        2.0000           -0.4332705             -11.7899
        29        2.0000           -0.4292240             -11.6798
        30        2.0000           -0.4186045             -11.3908
        31        2.0000           -0.4157888             -11.3142
        32        2.0000           -0.4005999             -10.9009
        33        2.0000           -0.3803386             -10.3495
        34        2.0000           -0.3671114              -9.9896 (HOMO)
        35                         -0.2543231              -6.9205 (LUMO)
        36                         -0.2138058              -5.8180
        37                         -0.1967781              -5.3546
        38                         -0.1900540              -5.1716
        39                         -0.1516776              -4.1274
       ...                                ...                  ...
        71                          0.6697584              18.2251
      -------------------------------------------------------------
                  HL-Gap            0.1127883 Eh            3.0691 eV
             Fermi-level           -0.3107173 Eh           -8.4550 eV

 SCC (total)                   0 d,  0 h,  0 min,  0.040 sec
 SCC setup                      ...        0 min,  0.000 sec (  0.727%)
 Dispersion                     ...        0 min,  0.000 sec (  0.988%)
 integral evaluation            ...        0 min,  0.009 sec ( 22.742%)
 zeroth order Hamiltonian       ...        0 min,  0.000 sec (  0.431%)
 iterations                     ...        0 min,  0.015 sec ( 37.454%)
 molecular gradient             ...        0 min,  0.015 sec ( 36.728%)
 printout                       ...        0 min,  0.000 sec (  0.821%)

         :::::::::::::::::::::::::::::::::::::::::::::::::::::
         ::                     SUMMARY                     ::
         :::::::::::::::::::::::::::::::::::::::::::::::::::::
         :: total energy             -36.025494604522 Eh    ::
         :: gradient norm              0.056738126909 Eh/a0 ::
         :: HOMO-LUMO gap              3.069124906449 eV    ::
         ::.................................................::
         :: SCC energy               -36.585696778171 Eh    ::
         :: -> isotropic ES            0.003274361210 Eh    ::
         :: -> anisotropic ES          0.005617392700 Eh    ::
         :: -> anisotropic XC          0.022822085292 Eh    ::
         :: -> dispersion             -0.027511954905 Eh    ::
         :: repulsion energy           0.559979049214 Eh    ::
         :: add. restraining           0.000000000000 Eh    ::
         :::::::::::::::::::::::::::::::::::::::::::::::::::::

      ----------------------------------------------------------- 
     |                   =====================                   |
     |                        A N C O P T                        |
     |                   =====================                   |
     |               Approximate Normal Coordinate               |
     |                Rational Function Optimizer                |
      ----------------------------------------------------------- 

          ...................................................
          :                      SETUP                      :
          :.................................................:
          :   optimization level            normal          :
          :   max. optcycles                   200          :
          :   ANC micro-cycles                  20          :
          :   degrees of freedom                75          :
          :.................................................:
          :   RF solver                   davidson          :
          :   input Hessian                  false          :
          :   write xtbopt.log                true          :
          :   linear?                        false          :
          :   energy convergence         0.5000000E-05 Eh   :
          :   grad. convergence          0.1000000E-02 Eh/α :
          :   maximium RF displ.         2.0000000          :
          :   Hlow (freq-cutoff)         0.5000000E-02      :
          :   Hmax (freq-cutoff)         5.0000000          :
          :   S6 in model hess.         20.0000000          :
          ...................................................

generating ANC from model Hessian ...
Using Lindh-Hessian (1995)
 Shifting diagonal of input Hessian by   4.111988815541568E-003
 Lowest  eigenvalues of input Hessian
   -0.000000   -0.000000   -0.000000   -0.000000    0.000000    0.000000
    0.005000    0.006160    0.007432    0.007793    0.009484    0.009708
    0.011345    0.014020    0.017357    0.020611    0.022154    0.024340
 Highest eigenvalues
    1.523203    1.611789    1.767990    1.818712    1.846657    1.976513
 

........................................................................
.............................. CYCLE    1 ..............................
........................................................................
   1    -36.5856968 -0.365857E+02  0.171E-04    3.07       0.0  T
   2    -36.5856968 -0.111669E-09  0.113E-04    3.07     169.7  T
   3    -36.5856968 -0.171404E-09  0.780E-05    3.07     246.8  T
     SCC iter.                  ...        0 min,  0.004 sec
     gradient                   ...        0 min,  0.014 sec
 * total energy  :   -36.0254946 Eh     change       -0.4084340E-07 Eh
   gradient norm :     0.0567382 Eh/α   predicted     0.0000000E+00 (-100.00%)
   displ. norm   :     0.2728904 α      lambda       -0.6253955E-02
   maximum displ.:     0.1368509 α      in ANC's #17, #7, #16, ...

........................................................................
.............................. CYCLE    2 ..............................
........................................................................
   1    -36.6148878 -0.366149E+02  0.204E-01    3.11       0.0  T
   2    -36.6149194 -0.316172E-04  0.110E-01    3.11       1.0  T
   3    -36.6148610  0.583852E-04  0.672E-02    3.11       1.0  T
   4    -36.6149663 -0.105226E-03  0.195E-02    3.11       1.0  T
   5    -36.6149678 -0.153217E-05  0.962E-03    3.11       2.0  T
   6    -36.6149689 -0.106971E-05  0.242E-03    3.11       8.0  T
   7    -36.6149690 -0.104345E-06  0.630E-04    3.11      30.5  T
     SCC iter.                  ...        0 min,  0.008 sec
     gradient                   ...        0 min,  0.014 sec
 * total energy  :   -36.0295451 Eh     change       -0.4050459E-02 Eh
   gradient norm :     0.0186066 Eh/α   predicted    -0.3359846E-02 ( -17.05%)
   displ. norm   :     0.2411446 α      lambda       -0.1424391E-02
   maximum displ.:     0.1579025 α      in ANC's #7, #9, #17, ...

........................................................................
.............................. CYCLE    3 ..............................
........................................................................
   1    -36.6252890 -0.366253E+02  0.172E-01    3.12       0.0  T
   2    -36.6253049 -0.158732E-04  0.908E-02    3.12       1.0  T
   3    -36.6252627  0.422665E-04  0.491E-02    3.12       1.0  T
   4    -36.6253202 -0.574989E-04  0.145E-02    3.12       1.3  T
   5    -36.6253209 -0.764332E-06  0.641E-03    3.12       3.0  T
   6    -36.6253214 -0.525988E-06  0.173E-03    3.12      11.1  T
   7    -36.6253215 -0.550510E-07  0.515E-04    3.12      37.4  T
     SCC iter.                  ...        0 min,  0.009 sec
     gradient                   ...        0 min,  0.014 sec
 * total energy  :   -36.0302988 Eh     change       -0.7537034E-03 Eh
   gradient norm :     0.0065731 Eh/α   predicted    -0.7536163E-03 (  -0.01%)
   displ. norm   :     0.1863903 α      lambda       -0.5039952E-03
   maximum displ.:     0.1215772 α      in ANC's #7, #3, #18, ...

........................................................................
.............................. CYCLE    4 ..............................
........................................................................
   1    -36.6254707 -0.366255E+02  0.115E-01    3.11       0.0  T
   2    -36.6254739 -0.321173E-05  0.648E-02    3.11       1.0  T
   3    -36.6254651  0.879917E-05  0.222E-02    3.11       1.0  T
   4    -36.6254753 -0.102044E-04  0.752E-03    3.11       2.6  T
   5    -36.6254757 -0.373322E-06  0.237E-03    3.11       8.1  T
   6    -36.6254758 -0.779697E-07  0.812E-04    3.11      23.7  T
     SCC iter.                  ...        0 min,  0.007 sec
     gradient                   ...        0 min,  0.013 sec
 * total energy  :   -36.0305166 Eh     change       -0.2177447E-03 Eh
   gradient norm :     0.0071298 Eh/α   predicted    -0.2607544E-03 (  19.75%)
   displ. norm   :     0.1192234 α      lambda       -0.2285274E-03
   maximum displ.:     0.0625780 α      in ANC's #7, #3, #4, ...

........................................................................
.............................. CYCLE    5 ..............................
........................................................................
   1    -36.6230162 -0.366230E+02  0.679E-02    3.10       0.0  T
   2    -36.6230169 -0.655725E-06  0.388E-02    3.10       1.0  T
   3    -36.6230125  0.431061E-05  0.144E-02    3.10       1.3  T
   4    -36.6230175 -0.493101E-05  0.358E-03    3.10       5.4  T
   5    -36.6230175 -0.276029E-07  0.120E-03    3.10      16.0  T
   6    -36.6230175 -0.311572E-07  0.241E-04    3.10      79.8  T
     SCC iter.                  ...        0 min,  0.007 sec
     gradient                   ...        0 min,  0.014 sec
 * total energy  :   -36.0306807 Eh     change       -0.1641730E-03 Eh
   gradient norm :     0.0038570 Eh/α   predicted    -0.1158890E-03 ( -29.41%)
   displ. norm   :     0.1539993 α      lambda       -0.1488516E-03
   maximum displ.:     0.0945412 α      in ANC's #3, #7, #4, ...

........................................................................
.............................. CYCLE    6 ..............................
........................................................................
   1    -36.6216051 -0.366216E+02  0.943E-02    3.09       0.0  T
   2    -36.6216069 -0.177711E-05  0.519E-02    3.09       1.0  T
   3    -36.6216001  0.679001E-05  0.194E-02    3.09       1.0  T
   4    -36.6216081 -0.802584E-05  0.571E-03    3.09       3.4  T
   5    -36.6216082 -0.101512E-06  0.151E-03    3.09      12.7  T
   6    -36.6216082 -0.446950E-07  0.383E-04    3.09      50.3  T
   7    -36.6216082 -0.127335E-08  0.208E-04    3.09      92.6  T
     SCC iter.                  ...        0 min,  0.008 sec
     gradient                   ...        0 min,  0.014 sec
 * total energy  :   -36.0307721 Eh     change       -0.9133452E-04 Eh
   gradient norm :     0.0025502 Eh/α   predicted    -0.7619144E-04 ( -16.58%)
   displ. norm   :     0.0972966 α      lambda       -0.5461879E-04
   maximum displ.:     0.0635897 α      in ANC's #3, #4, #7, ...

........................................................................
.............................. CYCLE    7 ..............................
........................................................................
   1    -36.6221111 -0.366221E+02  0.539E-02    3.08       0.0  T
   2    -36.6221116 -0.440148E-06  0.306E-02    3.08       1.0  T
   3    -36.6221095  0.209407E-05  0.107E-02    3.08       1.8  T
   4    -36.6221119 -0.241279E-05  0.272E-03    3.08       7.1  T
   5    -36.6221119 -0.257774E-07  0.689E-04    3.08      27.9  T
   6    -36.6221119 -0.743066E-08  0.220E-04    3.08      87.6  T
     SCC iter.                  ...        0 min,  0.007 sec
     gradient                   ...        0 min,  0.014 sec
 * total energy  :   -36.0308071 Eh     change       -0.3502574E-04 Eh
   gradient norm :     0.0022420 Eh/α   predicted    -0.2757071E-04 ( -21.28%)
   displ. norm   :     0.0903468 α      lambda       -0.4247123E-04
   maximum displ.:     0.0612075 α      in ANC's #3, #4, #7, ...

........................................................................
.............................. CYCLE    8 ..............................
........................................................................
   1    -36.6231558 -0.366232E+02  0.501E-02    3.08       0.0  T
   2    -36.6231563 -0.503162E-06  0.275E-02    3.08       1.0  T
   3    -36.6231553  0.999375E-06  0.865E-03    3.08       2.2  T
   4    -36.6231565 -0.118899E-05  0.302E-03    3.08       6.4  T
   5    -36.6231565 -0.473621E-07  0.545E-04    3.08      35.3  T
   6    -36.6231565 -0.334787E-08  0.233E-04    3.08      82.5  T
     SCC iter.                  ...        0 min,  0.007 sec
     gradient                   ...        0 min,  0.015 sec
 * total energy  :   -36.0308371 Eh     change       -0.3003751E-04 Eh
   gradient norm :     0.0014786 Eh/α   predicted    -0.2140952E-04 ( -28.72%)
   displ. norm   :     0.1244126 α      lambda       -0.2602901E-04
   maximum displ.:     0.0794928 α      in ANC's #3, #4, #6, ...

........................................................................
.............................. CYCLE    9 ..............................
........................................................................
   1    -36.6240088 -0.366240E+02  0.679E-02    3.08       0.0  T
   2    -36.6240098 -0.997273E-06  0.369E-02    3.08       1.0  T
   3    -36.6240075  0.231712E-05  0.127E-02    3.08       1.5  T
   4    -36.6240103 -0.276930E-05  0.423E-03    3.08       4.5  T
   5    -36.6240103 -0.721733E-07  0.737E-04    3.08      26.1  T
   6    -36.6240103 -0.881490E-08  0.262E-04    3.08      73.4  T
     SCC iter.                  ...        0 min,  0.007 sec
     gradient                   ...        0 min,  0.015 sec
 * total energy  :   -36.0308585 Eh     change       -0.2138332E-04 Eh
   gradient norm :     0.0013140 Eh/α   predicted    -0.1310628E-04 ( -38.71%)
   displ. norm   :     0.0538019 α      lambda       -0.8189449E-05
   maximum displ.:     0.0297145 α      in ANC's #4, #3, #2, ...

........................................................................
.............................. CYCLE   10 ..............................
........................................................................
   1    -36.6235457 -0.366235E+02  0.256E-02    3.07       0.0  T
   2    -36.6235458 -0.129369E-06  0.140E-02    3.07       1.4  T
   3    -36.6235458  0.205764E-07  0.255E-03    3.07       7.5  T
   4    -36.6235458 -0.200836E-07  0.158E-03    3.07      12.2  T
   5    -36.6235458 -0.364337E-07  0.284E-04    3.07      67.7  T
   6    -36.6235458 -0.170527E-08  0.674E-05    3.07     285.4  T
     SCC iter.                  ...        0 min,  0.007 sec
     gradient                   ...        0 min,  0.014 sec
 * total energy  :   -36.0308660 Eh     change       -0.7533117E-05 Eh
   gradient norm :     0.0007501 Eh/α   predicted    -0.4102575E-05 ( -45.54%)
   displ. norm   :     0.0451343 α      lambda       -0.5359486E-05
   maximum displ.:     0.0223975 α      in ANC's #1, #4, #2, ...

........................................................................
.............................. CYCLE   11 ..............................
........................................................................
   1    -36.6231412 -0.366231E+02  0.207E-02    3.07       0.0  T
   2    -36.6231413 -0.810893E-07  0.115E-02    3.07       1.7  T
   3    -36.6231413  0.308603E-07  0.215E-03    3.07       9.0  T
   4    -36.6231413 -0.359368E-07  0.123E-03    3.07      15.7  T
   5    -36.6231413 -0.188976E-07  0.227E-04    3.07      84.8  T
   6    -36.6231413 -0.886438E-09  0.916E-05    3.07     210.1  T
     SCC iter.                  ...        0 min,  0.007 sec
     gradient                   ...        0 min,  0.013 sec
 * total energy  :   -36.0308699 Eh     change       -0.3812489E-05 Eh
   gradient norm :     0.0005579 Eh/α   predicted    -0.2683561E-05 ( -29.61%)
   displ. norm   :     0.0172582 α      lambda       -0.1449934E-05
   maximum displ.:     0.0116807 α      in ANC's #1, #4, #2, ...

   *** GEOMETRY OPTIMIZATION CONVERGED AFTER 11 ITERATIONS ***

------------------------------------------------------------------------
 total energy gain   :        -0.0053752 Eh       -3.3730 kcal/mol
 total RMSD          :         0.2053604 a0        0.1087 Å
 total power (kW/mol):        -1.2829738 (step)  -40.0522 (real)
------------------------------------------------------------------------

 ANCopt (total)                0 d,  0 h,  0 min,  0.352 sec
 optimizer setup                ...        0 min,  0.000 sec (  0.040%)
 model hessian                  ...        0 min,  0.010 sec (  2.787%)
 ANC generation                 ...        0 min,  0.001 sec (  0.188%)
 coordinate transformation      ...        0 min,  0.000 sec (  0.056%)
 single point calculation       ...        0 min,  0.338 sec ( 95.856%)
 optimization log               ...        0 min,  0.001 sec (  0.370%)
 hessian update                 ...        0 min,  0.000 sec (  0.040%)
 rational function              ...        0 min,  0.002 sec (  0.458%)

================
 final structure:
================
$coord
    2.91078999047692   -2.34490841773888   -0.26108895849133      C 
    5.24925944411866   -0.10943893773307   -0.13381866825500      S 
    3.02988711546188    2.30225872446956    0.24971802109136      C 
    0.61406432727872    1.34615399854773    0.23323619172203      C 
    0.56018343909485   -1.32140838673089   -0.05024472723119      C 
   -1.82742934214967   -2.85629240630012   -0.19313119739752      C 
   -2.12761411974571   -3.84366549236346   -2.84104165104155      C 
   -2.28232827361855   -6.26173755300619   -3.42685098538347      C 
   -4.11490068842094   -1.25309560661405    0.59579831307809      C 
   -4.01837617070715    1.37240825833926   -0.58604717209999      C 
   -1.76657340777710    2.85590875969571    0.44295975274073      C 
    3.98492977360011    4.84101112923192    0.49194139271217      C 
    2.78225263083717    6.84324889234468    1.42139478499549      C 
    3.39780882039652   -4.29827275219619   -0.48997710049997      H 
   -1.66787444209716   -4.47767397601876    1.08551385997459      H 
   -2.19205071007816   -2.42387059091718   -4.30974024431090      H 
   -2.21091301706414   -7.71842061043510   -2.00395245555640      H 
   -2.48765244424262   -6.89544249305367   -5.35017320456795      H 
   -4.12893702588658   -1.06392234574807    2.65186570992165      H 
   -5.84391938087190   -2.22909282340005    0.03411997547497      H 
   -5.76152181111757    2.39390408658231   -0.16586795610212      H 
   -3.86424578046554    1.21232665243639   -2.63591772384183      H 
   -2.10701806308269    3.31041145513510    2.43380660948288      H 
   -1.55818660920710    4.63526735039174   -0.58328990245270      H 
    5.92337662203615    5.05429033353454   -0.13219326405589      H 
    0.89392100373972    6.75984585768471    2.16140210457824      H 
    3.70129734536601    8.65622732489870    1.50314277966491      H 
$end
           -------------------------------------------------
          |                Final Singlepoint                |
           -------------------------------------------------

          ...................................................
          :                      SETUP                      :
          :.................................................:
          :  # basis functions                  72          :
          :  # atomic orbitals                  71          :
          :  # shells                           41          :
          :  # electrons                        68          :
          :  max. iterations                   250          :
          :  Hamiltonian                  GFN2-xTB          :
          :  restarted?                      false          :
          :  GBSA solvation                  false          :
          :  PC potential                    false          :
          :  electronic temp.          300.0000000     K    :
          :  accuracy                    1.0000000          :
          :  -> integral cutoff          0.2500000E+02      :
          :  -> integral neglect         0.1000000E-07      :
          :  -> SCF convergence          0.1000000E-05 Eh   :
          :  -> wf. convergence          0.1000000E-03 e    :
          :  Broyden damping             0.4000000          :
          ...................................................

 iter      E             dE          RMSdq      gap      omega  full diag
   1    -36.6231413 -0.366231E+02  0.465E-05    3.07       0.0  T
   2    -36.6231413 -0.198952E-11  0.187E-05    3.07    1027.3  T
   3    -36.6231413  0.218137E-11  0.190E-05    3.07    1013.7  T

   *** convergence criteria satisfied after 3 iterations ***

         #    Occupation            Energy/Eh            Energy/eV
      -------------------------------------------------------------
         1        2.0000           -0.7227642             -19.6674
       ...           ...                  ...                  ...
        28        2.0000           -0.4330158             -11.7830
        29        2.0000           -0.4299617             -11.6999
        30        2.0000           -0.4203742             -11.4390
        31        2.0000           -0.4155470             -11.3076
        32        2.0000           -0.4033249             -10.9750
        33        2.0000           -0.3819731             -10.3940
        34        2.0000           -0.3683483             -10.0233 (HOMO)
        35                         -0.2554527              -6.9512 (LUMO)
        36                         -0.2087242              -5.6797
        37                         -0.1970507              -5.3620
        38                         -0.1884820              -5.1289
        39                         -0.1421557              -3.8683
       ...                                ...                  ...
        71                          0.6874482              18.7064
      -------------------------------------------------------------
                  HL-Gap            0.1128956 Eh            3.0720 eV
             Fermi-level           -0.3119005 Eh           -8.4872 eV

 SCC (total)                   0 d,  0 h,  0 min,  0.028 sec
 SCC setup                      ...        0 min,  0.000 sec (  0.727%)
 Dispersion                     ...        0 min,  0.000 sec (  0.816%)
 integral evaluation            ...        0 min,  0.009 sec ( 31.143%)
 zeroth order Hamiltonian       ...        0 min,  0.000 sec (  0.600%)
 iterations                     ...        0 min,  0.004 sec ( 15.348%)
 molecular gradient             ...        0 min,  0.014 sec ( 50.102%)
 printout                       ...        0 min,  0.000 sec (  1.107%)

         :::::::::::::::::::::::::::::::::::::::::::::::::::::
         ::                     SUMMARY                     ::
         :::::::::::::::::::::::::::::::::::::::::::::::::::::
         :: total energy             -36.030869850673 Eh    ::
         :: gradient norm              0.000557668811 Eh/a0 ::
         :: HOMO-LUMO gap              3.072045289258 eV    ::
         ::.................................................::
         :: SCC energy               -36.623141332145 Eh    ::
         :: -> isotropic ES            0.003462439671 Eh    ::
         :: -> anisotropic ES          0.005002411443 Eh    ::
         :: -> anisotropic XC          0.022033381616 Eh    ::
         :: -> dispersion             -0.027803068537 Eh    ::
         :: repulsion energy           0.592058382396 Eh    ::
         :: add. restraining           0.000000000000 Eh    ::
         :::::::::::::::::::::::::::::::::::::::::::::::::::::

           -------------------------------------------------
          |                Property Printout                |
           -------------------------------------------------

    * Orbital Energies and Occupations

         #    Occupation            Energy/Eh            Energy/eV
      -------------------------------------------------------------
         1        2.0000           -0.7227642             -19.6674
       ...           ...                  ...                  ...
        22        2.0000           -0.4642489             -12.6329
        23        2.0000           -0.4611539             -12.5486
        24        2.0000           -0.4571410             -12.4394
        25        2.0000           -0.4478259             -12.1860
        26        2.0000           -0.4465786             -12.1520
        27        2.0000           -0.4401489             -11.9771
        28        2.0000           -0.4330158             -11.7830
        29        2.0000           -0.4299617             -11.6999
        30        2.0000           -0.4203742             -11.4390
        31        2.0000           -0.4155470             -11.3076
        32        2.0000           -0.4033249             -10.9750
        33        2.0000           -0.3819731             -10.3940
        34        2.0000           -0.3683483             -10.0233 (HOMO)
        35                         -0.2554527              -6.9512 (LUMO)
        36                         -0.2087242              -5.6797
        37                         -0.1970507              -5.3620
        38                         -0.1884820              -5.1289
        39                         -0.1421557              -3.8683
        40                         -0.1081678              -2.9434
        41                          0.0029929               0.0814
        42                          0.0376995               1.0259
        43                          0.0400629               1.0902
        44                          0.0868168               2.3624
        45                          0.0914672               2.4889
       ...                                ...                  ...
        71                          0.6874482              18.7064
      -------------------------------------------------------------
                  HL-Gap            0.1128956 Eh            3.0720 eV
             Fermi-level           -0.3119005 Eh           -8.4872 eV

     #   Z        covCN         q      C6AA      α(0)
     1   6 C      2.936    -0.030    28.750     8.794
     2  16 S      2.334    -0.058   143.457    20.159
     3   6 C      2.987     0.012    27.748     8.641
     4   6 C      3.150    -0.010    27.990     8.654
     5   6 C      3.169    -0.007    27.828     8.619
     6   6 C      3.862    -0.017    20.829     6.490
     7   6 C      2.895    -0.026    28.653     8.776
     8   6 C      2.837    -0.094    30.351     9.028
     9   6 C      3.809    -0.053    21.513     6.602
    10   6 C      3.806    -0.052    21.507     6.602
    11   6 C      3.807    -0.052    21.502     6.601
    12   6 C      2.936    -0.029    28.737     8.792
    13   6 C      2.838    -0.095    30.372     9.031
    14   1 H      0.926     0.038     2.479     2.462
    15   1 H      0.924     0.038     2.481     2.463
    16   1 H      0.925     0.034     2.532     2.488
    17   1 H      0.926     0.035     2.517     2.481
    18   1 H      0.926     0.036     2.506     2.475
    19   1 H      0.924     0.035     2.520     2.483
    20   1 H      0.924     0.031     2.571     2.507
    21   1 H      0.924     0.029     2.605     2.524
    22   1 H      0.924     0.037     2.494     2.470
    23   1 H      0.924     0.040     2.451     2.448
    24   1 H      0.924     0.041     2.433     2.439
    25   1 H      0.925     0.041     2.437     2.441
    26   1 H      0.926     0.041     2.439     2.442
    27   1 H      0.926     0.038     2.477     2.461

 Mol. C6AA /au·bohr⁶  :       9095.089052
 Mol. C8AA /au·bohr⁸  :     240330.976803
 Mol. α(0) /au        :        151.375441


Wiberg/Mayer (AO) data.
largest (>0.10) Wiberg bond orders for each atom
          total WBO             WBO to atom ...
     1  C   3.947        C    5 1.579    S    2 1.194    H   14 0.970    C    3 0.103
     2  S   2.603        C    1 1.194    C    3 1.122
     3  C   3.943        C    4 1.504    C   12 1.131    S    2 1.122    C    1 0.103
     4  C   3.985        C    3 1.504    C    5 1.244    C   11 1.012
     5  C   3.984        C    1 1.579    C    4 1.244    C    6 0.982
     6  C   3.996        C    7 0.999    C    5 0.982    C    9 0.979    H   15 0.958
     7  C   3.990        C    8 1.978    C    6 0.999    H   16 0.964
     8  C   3.989        C    7 1.978    H   18 0.976    H   17 0.975
     9  C   3.997        C   10 1.011    C    6 0.979    H   20 0.977    H   19 0.976
    10  C   3.998        C    9 1.011    C   11 1.004    H   21 0.977    H   22 0.976
    11  C   3.999        C    4 1.012    C   10 1.004    H   24 0.965    H   23 0.957
    12  C   3.991        C   13 1.865    C    3 1.131    H   25 0.962
    13  C   3.991        C   12 1.865    H   27 0.978    H   26 0.973
    14  H   0.998        C    1 0.970
    15  H   0.998        C    6 0.958
    16  H   0.999        C    7 0.964
    17  H   0.999        C    8 0.975
    18  H   0.998        C    8 0.976
    19  H   0.998        C    9 0.976
    20  H   0.998        C    9 0.977
    21  H   0.998        C   10 0.977
    22  H   0.999        C   10 0.976
    23  H   0.998        C   11 0.957
    24  H   0.998        C   11 0.965
    25  H   0.998        C   12 0.962
    26  H   0.998        C   13 0.973
    27  H   0.998        C   13 0.978

molecular dipole:
                 x           y           z       tot (Debye)
 q only:       -0.466       0.101       0.062
   full:       -0.701       0.039       0.070       1.793
molecular quadrupole (traceless):
                xx          xy          yy          xz          yz          zz
 q only:       -1.074      -0.304       1.679      -0.433      -0.226      -0.606
  q+dip:       -4.572      -0.592       5.130      -1.178       0.216      -0.558
   full:       -4.268      -0.595       4.026      -0.712      -0.112       0.242

           -------------------------------------------------
          |                Geometry Summary                 |
           -------------------------------------------------

      molecular mass/u    :      190.3026000
   center of mass at/Å    :        0.3424664       0.0545216      -0.1592258
  moments of inertia/u·Å² :        0.4364129E+03   0.9127209E+03   0.1269825E+04
rotational constants/cm⁻¹ :        0.3862771E-01   0.1846965E-01   0.1327555E-01

 * 25 selected distances

     #   Z        #   Z                                     value/Å
     1   6 C      2  16 S                                 1.7132567
     2  16 S      3   6 C                                 1.7462047 (max)
     3   6 C      4   6 C                                 1.3749047
     1   6 C      5   6 C                                 1.3612676
     4   6 C      5   6 C                                 1.4198481
     7   6 C      8   6 C                                 1.3191468
     6   6 C      9   6 C                                 1.5359980
     9   6 C     10   6 C                                 1.5244849
     4   6 C     11   6 C                                 1.4958765
    10   6 C     11   6 C                                 1.5273200
    12   6 C     13   6 C                                 1.3302544
     1   6 C     14   1 H                                 1.0721828 (min)
     6   6 C     15   1 H                                 1.0959553
     7   6 C     16   1 H                                 1.0815230
     8   6 C     17   1 H                                 1.0782324
     8   6 C     18   1 H                                 1.0770946
     9   6 C     19   1 H                                 1.0926449
     9   6 C     20   1 H                                 1.0918966
    10   6 C     21   1 H                                 1.0920251
    10   6 C     22   1 H                                 1.0911003
    11   6 C     23   1 H                                 1.0955307
    11   6 C     24   1 H                                 1.0925595
    12   6 C     25   1 H                                 1.0835359
    13   6 C     26   1 H                                 1.0741599
    13   6 C     27   1 H                                 1.0764845

 * 3 distinct bonds (by element types)

   Z      Z             #   av. dist./Å        max./Å        min./Å
   1 H    6 C          14     1.0853518     1.0959553     1.0721828
   6 C    6 C           9     1.4321223     1.5359980     1.3191468
   6 C   16 S           2     1.7297307     1.7462047     1.7132567


optimized geometry written to: xtbopt.xyz


           -------------------------------------------------
          | TOTAL ENERGY              -36.030869850673 Eh   |
          | GRADIENT NORM               0.000557668811 Eh/α |
          | HOMO-LUMO GAP               3.072045289258 eV   |
           -------------------------------------------------

------------------------------------------------------------------------
 * finished run on 2021/05/19 at 10:58:23.895     
------------------------------------------------------------------------
 total:
 * wall-time:     0 d,  0 h,  0 min,  0.441 sec
 *  cpu-time:     0 d,  0 h,  0 min,  0.441 sec
 * ratio c/w:     0.999 speedup
 SCF:
 * wall-time:     0 d,  0 h,  0 min,  0.040 sec
 *  cpu-time:     0 d,  0 h,  0 min,  0.040 sec
 * ratio c/w:     1.000 speedup
 ANC optimizer:
 * wall-time:     0 d,  0 h,  0 min,  0.381 sec
 *  cpu-time:     0 d,  0 h,  0 min,  0.381 sec
 * ratio c/w:     1.000 speedup

