      -----------------------------------------------------------      
     |                   =====================                   |     
     |                           x T B                           |     
     |                   =====================                   |     
     |                         S. Grimme                         |     
     |          Mulliken Center for Theoretical Chemistry        |     
     |                    University of Bonn                     |     
     |                Version 6.2 RC2 (SAW190805)                |     
      -----------------------------------------------------------      

   This program is distributed in the hope that it will be useful,
   but WITHOUT ANY WARRANTY; without even the implied warranty of
   MERCHANTABILITY or FITNESS FOR A PARTICULAR PURPOSE.
   
   FOR NON-COMMERCIAL, ACADEMIA USE ONLY.
   
   Cite this work as:
   * S. Grimme, C. Bannwarth, P. Shushkov, J. Chem. Theory Comput., 2017,
     13, 1989-2009. DOI: 10.1021/acs.jctc.7b00118
   * C. Bannwarth, S. Ehlert and S. Grimme., J. Chem. Theory Comput., 2019,
     15, 1652-1671. DOI: 10.1021/acs.jctc.8b01176
   * P. Pracht, E. Caldeweyher, S. Ehlert, S. Grimme, ChemRxiv, 2019, preprint.
     DOI: 10.26434/chemrxiv.8326202.v1
   
   for DFT-D4:
   * E. Caldeweyher, C. Bannwarth and S. Grimme, J. Chem. Phys., 2017,
     147, 034112. DOI: 10.1063/1.4993215
   * E. Caldeweyher, S. Ehlert, A. Hansen, H. Neugebauer, S. Spicher,
     C. Bannwarth and S. Grimme, J. Chem. Phys., 2019, 150, 154122.
     DOI: 10.1063/1.5090222
   
   for sTDA-xTB:
   * S. Grimme and C. Bannwarth, J. Chem. Phys., 2016, 145, 054103.
     DOI: 10.1063/1.4959605
   
   in the mass-spec context:
   * V. Asgeirsson, C. Bauer and S. Grimme, Chem. Sci., 2017, 8, 4879.
     DOI: 10.1039/c7sc00601b
   
   for metadynamics refer to:
   * S. Grimme, J. Chem. Theory Comput., 2019, 155, 2847-2862
     DOI: 10.1021/acs.jctc.9b00143
   
   with help from (in alphabetical order)
   C. Bannwarth, F. Bohle, G. Brandenburg, E. Caldeweyher, M. Checinski,
   S. Dohm, S. Ehlert, S. Ehrlich, F. März, H. Neugebauer, J. Pisarek,
   P. Pracht, P. Shushkov, and S. Spicher.
   
 * started run on 2021/05/19 at 10:59:42.445     

           -------------------------------------------------
          |                Calculation Setup                |
           -------------------------------------------------

          program call               : /ihome/ghutchison/geoffh/xtb/xtb 365.xyz -opt
          hostname                   : smp-n122
          coordinate file            : 365.xyz
          omp threads                :                     1
          number of atoms            :                    30
          number of electrons        :                    76
          charge                     :                     0
          spin                       :                   0.0
          first test random number   :      0.03487656636374


########################################################################
# WARNING! Please study the warnings concerning your input carefully
#  - the use of '-opt' is discouraged, please use '--opt' next time
########################################################################

           ------------------------------------------------- 
          |                 G F N 2 - x T B                 |
          | Geometry, Frequencies, Noncovalent interactions |
          |            JCTC 2019 parametrisation            |
           ------------------------------------------------- 
             KAB for C  - Si     :                1.0500
             KAB for H  - Pd     :                0.9500
             k(s)              :                1.8500
             k(p)              :                2.2300
             k(d)              :                2.2300
             k(f)              :                2.0000
             kEN (H0ij)        :               -2.0000
             D4 a1             :                0.5200
             D4 a2             :                5.0000
             D4 s6             :                1.0000
             D4 s8             :                2.7000
             D4 s9             :                5.0000
             alphaj            :                2.0000

  Z AO/shell   Hii/eV     exponent
  1     Wed Apr 25 08:07:45 CEST 2018   EN: 2.200 GM2: 0.406  GM3: 0.0800  RAES: 1.40
     1s    -10.707211    1.230000
  6     Wed Apr 25 08:07:45 CEST 2018   EN: 2.550 GM2: 0.538  GM3: 0.1500  RAES: 3.00
     2s    -13.970922    2.096432
     2p    -10.063292    1.800000
  8     Wed Apr 25 08:07:45 CEST 2018   EN: 3.440 GM2: 0.452  GM3:-0.0517  RAES: 1.80
     2s    -20.229985    2.439742
     2p    -15.503117    2.137023

           ------------------------------------------------- 
          |        Self-Consistent Charge Iterations        |
           ------------------------------------------------- 

          ...................................................
          :                      SETUP                      :
          :.................................................:
          :  # basis functions                  72          :
          :  # atomic orbitals                  72          :
          :  # shells                           44          :
          :  # electrons                        76          :
          :  max. iterations                   250          :
          :  Hamiltonian                  GFN2-xTB          :
          :  restarted?                      false          :
          :  GBSA solvation                  false          :
          :  PC potential                    false          :
          :  electronic temp.          300.0000000     K    :
          :  accuracy                    1.0000000          :
          :  -> integral cutoff          0.2500000E+02      :
          :  -> integral neglect         0.1000000E-07      :
          :  -> SCF convergence          0.1000000E-05 Eh   :
          :  -> wf. convergence          0.1000000E-03 e    :
          :  Broyden damping             0.4000000          :
          ...................................................

 iter      E             dE          RMSdq      gap      omega  full diag
   1    -42.4581258 -0.424581E+02  0.426E+00    3.36       0.0  T
   2    -42.5241957 -0.660698E-01  0.247E+00    3.27       1.0  T
   3    -42.5197154  0.448021E-02  0.114E+00    3.30       1.0  T
   4    -42.5297943 -0.100789E-01  0.403E-01    3.29       1.0  T
   5    -42.5316695 -0.187515E-02  0.995E-02    3.29       1.0  T
   6    -42.5317336 -0.641539E-04  0.697E-02    3.29       1.0  T
   7    -42.5317899 -0.562851E-04  0.247E-02    3.29       1.0  T
   8    -42.5317933 -0.334614E-05  0.786E-03    3.29       2.3  T
   9    -42.5317937 -0.411898E-06  0.271E-03    3.29       6.7  T
  10    -42.5317938 -0.121256E-06  0.101E-03    3.29      18.1  T
  11    -42.5317938 -0.259639E-08  0.501E-04    3.29      36.5  T
  12    -42.5317938 -0.139939E-08  0.217E-04    3.29      84.0  T

   *** convergence criteria satisfied after 12 iterations ***

         #    Occupation            Energy/Eh            Energy/eV
      -------------------------------------------------------------
         1        2.0000           -0.7085828             -19.2815
       ...           ...                  ...                  ...
        32        2.0000           -0.4439257             -12.0798
        33        2.0000           -0.4315453             -11.7429
        34        2.0000           -0.4205706             -11.4443
        35        2.0000           -0.4140300             -11.2663
        36        2.0000           -0.4064784             -11.0608
        37        2.0000           -0.3860010             -10.5036
        38        2.0000           -0.3598872              -9.7930 (HOMO)
        39                         -0.2388913              -6.5006 (LUMO)
        40                         -0.2169876              -5.9045
        41                         -0.1644547              -4.4750
        42                         -0.0779534              -2.1212
        43                          0.0058759               0.1599
       ...                                ...                  ...
        72                          0.6516165              17.7314
      -------------------------------------------------------------
                  HL-Gap            0.1209958 Eh            3.2925 eV
             Fermi-level           -0.2993893 Eh           -8.1468 eV

 SCC (total)                   0 d,  0 h,  0 min,  0.041 sec
 SCC setup                      ...        0 min,  0.000 sec (  0.805%)
 Dispersion                     ...        0 min,  0.000 sec (  1.154%)
 integral evaluation            ...        0 min,  0.009 sec ( 23.045%)
 zeroth order Hamiltonian       ...        0 min,  0.000 sec (  0.438%)
 iterations                     ...        0 min,  0.015 sec ( 37.116%)
 molecular gradient             ...        0 min,  0.015 sec ( 36.433%)
 printout                       ...        0 min,  0.000 sec (  0.891%)

         :::::::::::::::::::::::::::::::::::::::::::::::::::::
         ::                     SUMMARY                     ::
         :::::::::::::::::::::::::::::::::::::::::::::::::::::
         :: total energy             -41.951456781551 Eh    ::
         :: gradient norm              0.048673100469 Eh/a0 ::
         :: HOMO-LUMO gap              3.292464462147 eV    ::
         ::.................................................::
         :: SCC energy               -42.531793793155 Eh    ::
         :: -> isotropic ES            0.033555694336 Eh    ::
         :: -> anisotropic ES          0.007832942364 Eh    ::
         :: -> anisotropic XC          0.017353209756 Eh    ::
         :: -> dispersion             -0.024419382086 Eh    ::
         :: repulsion energy           0.580357605416 Eh    ::
         :: add. restraining           0.000000000000 Eh    ::
         :::::::::::::::::::::::::::::::::::::::::::::::::::::

      ----------------------------------------------------------- 
     |                   =====================                   |
     |                        A N C O P T                        |
     |                   =====================                   |
     |               Approximate Normal Coordinate               |
     |                Rational Function Optimizer                |
      ----------------------------------------------------------- 

          ...................................................
          :                      SETUP                      :
          :.................................................:
          :   optimization level            normal          :
          :   max. optcycles                   200          :
          :   ANC micro-cycles                  20          :
          :   degrees of freedom                84          :
          :.................................................:
          :   RF solver                   davidson          :
          :   input Hessian                  false          :
          :   write xtbopt.log                true          :
          :   linear?                        false          :
          :   energy convergence         0.5000000E-05 Eh   :
          :   grad. convergence          0.1000000E-02 Eh/α :
          :   maximium RF displ.         2.0000000          :
          :   Hlow (freq-cutoff)         0.5000000E-02      :
          :   Hmax (freq-cutoff)         5.0000000          :
          :   S6 in model hess.         20.0000000          :
          ...................................................

generating ANC from model Hessian ...
Using Lindh-Hessian (1995)
 Shifting diagonal of input Hessian by   4.232324215680340E-003
 Lowest  eigenvalues of input Hessian
   -0.000000   -0.000000   -0.000000   -0.000000    0.000000    0.000000
    0.005000    0.005446    0.005830    0.006347    0.006652    0.007443
    0.008449    0.009683    0.012292    0.014805    0.015594    0.016921
 Highest eigenvalues
    1.675930    1.733183    1.832313    1.893852    1.998765    2.079707
 

........................................................................
.............................. CYCLE    1 ..............................
........................................................................
   1    -42.5317938 -0.425318E+02  0.717E-05    3.29       0.0  T
   2    -42.5317938 -0.108784E-10  0.424E-05    3.29     430.7  T
   3    -42.5317938  0.159162E-11  0.209E-05    3.29     874.9  T
     SCC iter.                  ...        0 min,  0.004 sec
     gradient                   ...        0 min,  0.015 sec
 * total energy  :   -41.9514568 Eh     change       -0.1973014E-07 Eh
   gradient norm :     0.0486742 Eh/α   predicted     0.0000000E+00 (-100.00%)
   displ. norm   :     0.2365824 α      lambda       -0.5340423E-02
   maximum displ.:     0.1000005 α      in ANC's #17, #12, #4, ...

........................................................................
.............................. CYCLE    2 ..............................
........................................................................
   1    -42.5602765 -0.425603E+02  0.153E-01    3.31       0.0  T
   2    -42.5602866 -0.101100E-04  0.918E-02    3.31       1.0  T
   3    -42.5602471  0.395545E-04  0.542E-02    3.31       1.0  T
   4    -42.5602964 -0.493080E-04  0.767E-03    3.31       2.4  T
   5    -42.5602975 -0.113949E-05  0.274E-03    3.31       6.7  T
   6    -42.5602976 -0.339169E-07  0.121E-03    3.31      15.0  T
     SCC iter.                  ...        0 min,  0.007 sec
     gradient                   ...        0 min,  0.014 sec
 * total energy  :   -41.9549114 Eh     change       -0.3454605E-02 Eh
   gradient norm :     0.0183295 Eh/α   predicted    -0.2819670E-02 ( -18.38%)
   displ. norm   :     0.1971905 α      lambda       -0.1068045E-02
   maximum displ.:     0.0942210 α      in ANC's #12, #4, #6, ...

........................................................................
.............................. CYCLE    3 ..............................
........................................................................
   1    -42.5695389 -0.425695E+02  0.126E-01    3.29       0.0  T
   2    -42.5695516 -0.126900E-04  0.759E-02    3.30       1.0  T
   3    -42.5695331  0.184653E-04  0.420E-02    3.30       1.0  T
   4    -42.5695578 -0.247166E-04  0.713E-03    3.30       2.6  T
   5    -42.5695587 -0.869419E-06  0.290E-03    3.30       6.3  T
   6    -42.5695588 -0.100024E-06  0.136E-03    3.30      13.4  T
     SCC iter.                  ...        0 min,  0.007 sec
     gradient                   ...        0 min,  0.014 sec
 * total energy  :   -41.9556005 Eh     change       -0.6891364E-03 Eh
   gradient norm :     0.0060009 Eh/α   predicted    -0.5547909E-03 ( -19.49%)
   displ. norm   :     0.2065504 α      lambda       -0.3758754E-03
   maximum displ.:     0.1059463 α      in ANC's #4, #8, #6, ...

........................................................................
.............................. CYCLE    4 ..............................
........................................................................
   1    -42.5697552 -0.425698E+02  0.122E-01    3.28       0.0  T
   2    -42.5697633 -0.806103E-05  0.743E-02    3.29       1.0  T
   3    -42.5697521  0.112106E-04  0.284E-02    3.29       1.0  T
   4    -42.5697664 -0.142760E-04  0.487E-03    3.29       3.8  T
   5    -42.5697666 -0.232825E-06  0.270E-03    3.29       6.8  T
   6    -42.5697667 -0.751478E-07  0.134E-03    3.29      13.7  T
     SCC iter.                  ...        0 min,  0.007 sec
     gradient                   ...        0 min,  0.014 sec
 * total energy  :   -41.9558881 Eh     change       -0.2875093E-03 Eh
   gradient norm :     0.0041721 Eh/α   predicted    -0.1959651E-03 ( -31.84%)
   displ. norm   :     0.2879916 α      lambda       -0.3452379E-03
   maximum displ.:     0.1487953 α      in ANC's #4, #8, #3, ...

........................................................................
.............................. CYCLE    5 ..............................
........................................................................
   1    -42.5672265 -0.425672E+02  0.165E-01    3.27       0.0  T
   2    -42.5672345 -0.807692E-05  0.100E-01    3.28       1.0  T
   3    -42.5672258  0.878678E-05  0.240E-02    3.28       1.0  T
   4    -42.5672380 -0.122096E-04  0.506E-03    3.28       3.6  T
   5    -42.5672381 -0.117008E-06  0.291E-03    3.28       6.3  T
   6    -42.5672381 -0.272773E-07  0.159E-03    3.28      11.5  T
     SCC iter.                  ...        0 min,  0.007 sec
     gradient                   ...        0 min,  0.014 sec
 * total energy  :   -41.9561487 Eh     change       -0.2606509E-03 Eh
   gradient norm :     0.0059873 Eh/α   predicted    -0.1869441E-03 ( -28.28%)
   displ. norm   :     0.3072754 α      lambda       -0.2755257E-03
   maximum displ.:     0.1545428 α      in ANC's #4, #1, #3, ...

........................................................................
.............................. CYCLE    6 ..............................
........................................................................
   1    -42.5649531 -0.425650E+02  0.171E-01    3.27       0.0  T
   2    -42.5649578 -0.474429E-05  0.104E-01    3.27       1.0  T
   3    -42.5649568  0.107636E-05  0.131E-02    3.27       1.4  T
   4    -42.5649604 -0.364687E-05  0.469E-03    3.27       3.9  T
   5    -42.5649605 -0.512130E-07  0.212E-03    3.27       8.6  T
   6    -42.5649605 -0.151475E-08  0.102E-03    3.27      17.9  T
     SCC iter.                  ...        0 min,  0.007 sec
     gradient                   ...        0 min,  0.014 sec
 * total energy  :   -41.9563592 Eh     change       -0.2105118E-03 Eh
   gradient norm :     0.0068907 Eh/α   predicted    -0.1507710E-03 ( -28.38%)
   displ. norm   :     0.3212709 α      lambda       -0.2694519E-03
   maximum displ.:     0.1559202 α      in ANC's #4, #1, #3, ...

........................................................................
.............................. CYCLE    7 ..............................
........................................................................
   1    -42.5644237 -0.425644E+02  0.175E-01    3.27       0.0  T
   2    -42.5644272 -0.356469E-05  0.106E-01    3.27       1.0  T
   3    -42.5644279 -0.665224E-06  0.886E-03    3.27       2.1  T
   4    -42.5644295 -0.162584E-05  0.456E-03    3.27       4.0  T
   5    -42.5644296 -0.445814E-07  0.105E-03    3.27      17.3  T
   6    -42.5644296 -0.174424E-07  0.453E-04    3.27      40.3  T
     SCC iter.                  ...        0 min,  0.007 sec
     gradient                   ...        0 min,  0.014 sec
 * total energy  :   -41.9565619 Eh     change       -0.2026885E-03 Eh
   gradient norm :     0.0059808 Eh/α   predicted    -0.1486438E-03 ( -26.66%)
   displ. norm   :     0.3149403 α      lambda       -0.2517961E-03
   maximum displ.:     0.1724935 α      in ANC's #1, #4, #5, ...

........................................................................
.............................. CYCLE    8 ..............................
........................................................................
   1    -42.5659501 -0.425660E+02  0.166E-01    3.27       0.0  T
   2    -42.5659531 -0.303790E-05  0.999E-02    3.27       1.0  T
   3    -42.5659521  0.988663E-06  0.102E-02    3.27       1.8  T
   4    -42.5659549 -0.280397E-05  0.436E-03    3.27       4.2  T
   5    -42.5659549 -0.180632E-07  0.245E-03    3.27       7.5  T
   6    -42.5659550 -0.734671E-07  0.668E-04    3.27      27.3  T
     SCC iter.                  ...        0 min,  0.008 sec
     gradient                   ...        0 min,  0.014 sec
 * total energy  :   -41.9567370 Eh     change       -0.1750683E-03 Eh
   gradient norm :     0.0044299 Eh/α   predicted    -0.1383890E-03 ( -20.95%)
   displ. norm   :     0.3426974 α      lambda       -0.2202264E-03
   maximum displ.:     0.1986964 α      in ANC's #1, #5, #4, ...

........................................................................
.............................. CYCLE    9 ..............................
........................................................................
   1    -42.5671221 -0.425671E+02  0.179E-01    3.28       0.0  T
   2    -42.5671250 -0.289475E-05  0.108E-01    3.28       1.0  T
   3    -42.5671243  0.736530E-06  0.103E-02    3.28       1.8  T
   4    -42.5671268 -0.249535E-05  0.462E-03    3.28       3.9  T
   5    -42.5671268 -0.503466E-07  0.239E-03    3.28       7.6  T
   6    -42.5671269 -0.583661E-07  0.529E-04    3.28      34.5  T
     SCC iter.                  ...        0 min,  0.007 sec
     gradient                   ...        0 min,  0.014 sec
 * total energy  :   -41.9568799 Eh     change       -0.1429187E-03 Eh
   gradient norm :     0.0052521 Eh/α   predicted    -0.1230461E-03 ( -13.90%)
   displ. norm   :     0.2721110 α      lambda       -0.1609670E-03
   maximum displ.:     0.1769317 α      in ANC's #1, #5, #3, ...

........................................................................
.............................. CYCLE   10 ..............................
........................................................................
   1    -42.5689991 -0.425690E+02  0.135E-01    3.28       0.0  T
   2    -42.5690004 -0.137459E-05  0.810E-02    3.28       1.0  T
   3    -42.5689993  0.117296E-05  0.967E-03    3.28       1.9  T
   4    -42.5690014 -0.212639E-05  0.327E-03    3.28       5.6  T
   5    -42.5690014 -0.566227E-08  0.126E-03    3.28      14.5  T
   6    -42.5690014 -0.193230E-07  0.247E-04    3.28      73.8  T
     SCC iter.                  ...        0 min,  0.007 sec
     gradient                   ...        0 min,  0.014 sec
 * total energy  :   -41.9570068 Eh     change       -0.1269093E-03 Eh
   gradient norm :     0.0039083 Eh/α   predicted    -0.8644367E-04 ( -31.89%)
   displ. norm   :     0.3754048 α      lambda       -0.1651321E-03
   maximum displ.:     0.2430791 α      in ANC's #1, #5, #3, ...

........................................................................
.............................. CYCLE   11 ..............................
........................................................................
   1    -42.5671917 -0.425672E+02  0.189E-01    3.27       0.0  T
   2    -42.5671949 -0.319303E-05  0.114E-01    3.27       1.0  T
   3    -42.5671953 -0.387672E-06  0.973E-03    3.27       1.9  T
   4    -42.5671967 -0.144303E-05  0.477E-03    3.27       3.8  T
   5    -42.5671968 -0.446237E-07  0.237E-03    3.27       7.7  T
   6    -42.5671968 -0.577243E-07  0.587E-04    3.27      31.1  T
   7    -42.5671968 -0.925949E-08  0.128E-04    3.27     142.4  T
     SCC iter.                  ...        0 min,  0.008 sec
     gradient                   ...        0 min,  0.015 sec
 * total energy  :   -41.9571172 Eh     change       -0.1104128E-03 Eh
   gradient norm :     0.0051840 Eh/α   predicted    -0.9420418E-04 ( -14.68%)
   displ. norm   :     0.3982237 α      lambda       -0.2758146E-03
   maximum displ.:     0.2843594 α      in ANC's #1, #2, #5, ...

........................................................................
.............................. CYCLE   12 ..............................
........................................................................
   1    -42.5733357 -0.425733E+02  0.166E-01    3.27       0.0  T
   2    -42.5733399 -0.424346E-05  0.987E-02    3.27       1.0  T
   3    -42.5733381  0.180877E-05  0.122E-02    3.27       1.5  T
   4    -42.5733411 -0.300234E-05  0.393E-03    3.27       4.6  T
   5    -42.5733412 -0.118238E-06  0.214E-03    3.27       8.5  T
   6    -42.5733412  0.385928E-08  0.103E-03    3.27      17.7  T
     SCC iter.                  ...        0 min,  0.007 sec
     gradient                   ...        0 min,  0.014 sec
 * total energy  :   -41.9571768 Eh     change       -0.5957755E-04 Eh
   gradient norm :     0.0071251 Eh/α   predicted    -0.1597838E-03 ( 168.19%)
   displ. norm   :     0.2587201 α      lambda       -0.1653039E-03
   maximum displ.:     0.1620151 α      in ANC's #1, #3, #4, ...

........................................................................
.............................. CYCLE   13 ..............................
........................................................................
   1    -42.5674011 -0.425674E+02  0.142E-01    3.27       0.0  T
   2    -42.5674042 -0.317855E-05  0.857E-02    3.27       1.0  T
   3    -42.5674047 -0.501085E-06  0.742E-03    3.27       2.5  T
   4    -42.5674054 -0.659332E-06  0.431E-03    3.27       4.2  T
   5    -42.5674056 -0.180112E-06  0.229E-03    3.27       8.0  T
   6    -42.5674056 -0.189021E-07  0.718E-04    3.27      25.4  T
     SCC iter.                  ...        0 min,  0.007 sec
     gradient                   ...        0 min,  0.014 sec
 * total energy  :   -41.9572443 Eh     change       -0.6747223E-04 Eh
   gradient norm :     0.0043658 Eh/α   predicted    -0.8818595E-04 (  30.70%)
   displ. norm   :     0.1304650 α      lambda       -0.6549714E-04
   maximum displ.:     0.0814707 α      in ANC's #1, #3, #5, ...

........................................................................
.............................. CYCLE   14 ..............................
........................................................................
   1    -42.5695279 -0.425695E+02  0.611E-02    3.27       0.0  T
   2    -42.5695286 -0.697177E-06  0.363E-02    3.28       1.0  T
   3    -42.5695283  0.325842E-06  0.426E-03    3.28       4.3  T
   4    -42.5695288 -0.493729E-06  0.157E-03    3.27      11.6  T
   5    -42.5695288 -0.344637E-07  0.839E-04    3.27      21.8  T
     SCC iter.                  ...        0 min,  0.006 sec
     gradient                   ...        0 min,  0.014 sec
 * total energy  :   -41.9572667 Eh     change       -0.2243847E-04 Eh
   gradient norm :     0.0030002 Eh/α   predicted    -0.3330821E-04 (  48.44%)
   displ. norm   :     0.0573445 α      lambda       -0.5217751E-04
   maximum displ.:     0.0291312 α      in ANC's #4, #5, #7, ...

........................................................................
.............................. CYCLE   15 ..............................
........................................................................
   1    -42.5706810 -0.425707E+02  0.276E-02    3.28       0.0  T
   2    -42.5706814 -0.440071E-06  0.164E-02    3.28       1.1  T
   3    -42.5706810  0.468403E-06  0.533E-03    3.28       3.4  T
   4    -42.5706815 -0.559156E-06  0.140E-03    3.28      13.0  T
   5    -42.5706815 -0.319385E-07  0.542E-04    3.28      33.7  T
   6    -42.5706815 -0.108400E-08  0.312E-04    3.28      58.6  T
     SCC iter.                  ...        0 min,  0.007 sec
     gradient                   ...        0 min,  0.015 sec
 * total energy  :   -41.9572870 Eh     change       -0.2033473E-04 Eh
   gradient norm :     0.0025334 Eh/α   predicted    -0.2617516E-04 (  28.72%)
   displ. norm   :     0.1788734 α      lambda       -0.4079363E-04
   maximum displ.:     0.1243960 α      in ANC's #1, #2, #5, ...

........................................................................
.............................. CYCLE   16 ..............................
........................................................................
   1    -42.5692853 -0.425693E+02  0.886E-02    3.28       0.0  T
   2    -42.5692861 -0.821864E-06  0.534E-02    3.28       1.0  T
   3    -42.5692858  0.353147E-06  0.614E-03    3.28       3.0  T
   4    -42.5692866 -0.856401E-06  0.250E-03    3.28       7.3  T
   5    -42.5692867 -0.188914E-07  0.116E-03    3.28      15.7  T
   6    -42.5692867 -0.113793E-07  0.281E-04    3.28      65.0  T
   7    -42.5692867 -0.178935E-08  0.804E-05    3.28     227.0  T
     SCC iter.                  ...        0 min,  0.008 sec
     gradient                   ...        0 min,  0.015 sec
 * total energy  :   -41.9573125 Eh     change       -0.2548724E-04 Eh
   gradient norm :     0.0022154 Eh/α   predicted    -0.2105205E-04 ( -17.40%)
   displ. norm   :     0.1727135 α      lambda       -0.3517207E-04
   maximum displ.:     0.1179227 α      in ANC's #1, #2, #8, ...

........................................................................
.............................. CYCLE   17 ..............................
........................................................................
   1    -42.5686665 -0.425687E+02  0.854E-02    3.28       0.0  T
   2    -42.5686674 -0.879807E-06  0.517E-02    3.28       1.0  T
   3    -42.5686675 -0.821013E-07  0.466E-03    3.28       3.9  T
   4    -42.5686679 -0.429256E-06  0.226E-03    3.28       8.1  T
   5    -42.5686679 -0.136286E-07  0.923E-04    3.28      19.8  T
   6    -42.5686679 -0.418775E-08  0.371E-04    3.28      49.2  T
     SCC iter.                  ...        0 min,  0.007 sec
     gradient                   ...        0 min,  0.015 sec
 * total energy  :   -41.9573272 Eh     change       -0.1462946E-04 Eh
   gradient norm :     0.0026725 Eh/α   predicted    -0.1811239E-04 (  23.81%)
   displ. norm   :     0.0403211 α      lambda       -0.1879887E-04
   maximum displ.:     0.0204987 α      in ANC's #4, #6, #7, ...

........................................................................
.............................. CYCLE   18 ..............................
........................................................................
   1    -42.5695212 -0.425695E+02  0.173E-02    3.28       0.0  T
   2    -42.5695213 -0.869498E-07  0.103E-02    3.28       1.8  T
   3    -42.5695212  0.468414E-07  0.175E-03    3.28      10.5  T
   4    -42.5695213 -0.671330E-07  0.543E-04    3.28      33.6  T
   5    -42.5695213 -0.344945E-08  0.290E-04    3.28      63.0  T
     SCC iter.                  ...        0 min,  0.006 sec
     gradient                   ...        0 min,  0.015 sec
 * total energy  :   -41.9573390 Eh     change       -0.1182265E-04 Eh
   gradient norm :     0.0011545 Eh/α   predicted    -0.9415165E-05 ( -20.36%)
   displ. norm   :     0.0645586 α      lambda       -0.7916376E-05
   maximum displ.:     0.0329558 α      in ANC's #8, #1, #7, ...

........................................................................
.............................. CYCLE   19 ..............................
........................................................................
   1    -42.5702494 -0.425702E+02  0.338E-02    3.28       0.0  T
   2    -42.5702495 -0.161452E-06  0.205E-02    3.28       1.0  T
   3    -42.5702493  0.208558E-06  0.354E-03    3.28       5.2  T
   4    -42.5702497 -0.315457E-06  0.101E-03    3.28      18.0  T
   5    -42.5702497 -0.175955E-08  0.537E-04    3.28      34.0  T
   6    -42.5702497 -0.260954E-08  0.143E-04    3.28     127.7  T
     SCC iter.                  ...        0 min,  0.007 sec
     gradient                   ...        0 min,  0.015 sec
 * total energy  :   -41.9573430 Eh     change       -0.4041115E-05 Eh
   gradient norm :     0.0012293 Eh/α   predicted    -0.3965863E-05 (  -1.86%)
   displ. norm   :     0.0644793 α      lambda        0.1552262E-04
   maximum displ.:     0.0329566 α      in ANC's #8, #7, #1, ...

........................................................................
.............................. CYCLE   20 ..............................
........................................................................
   1    -42.5708921 -0.425709E+02  0.338E-02    3.28       0.0  T
   2    -42.5708923 -0.159538E-06  0.205E-02    3.28       1.0  T
   3    -42.5708921  0.159434E-06  0.319E-03    3.28       5.7  T
   4    -42.5708924 -0.262334E-06  0.101E-03    3.28      18.1  T
   5    -42.5708924 -0.165214E-08  0.521E-04    3.28      35.0  T
   6    -42.5708924 -0.268248E-08  0.144E-04    3.28     126.5  T
     SCC iter.                  ...        0 min,  0.007 sec
     gradient                   ...        0 min,  0.015 sec
 * total energy  :   -41.9573314 Eh     change        0.1162579E-04 Eh
   gradient norm :     0.0027971 Eh/α   predicted     0.7775552E-05 ( -33.12%)
   displ. norm   :     0.0351091 α      lambda       -0.2038602E-04
   maximum displ.:     0.0154528 α      in ANC's #2, #4, #8, ...
 * RMSD in coord.:     0.6034525 α      energy gain  -0.5874609E-02 Eh

generating ANC from model Hessian ...
Using Lindh-Hessian (1995)
 Shifting diagonal of input Hessian by   4.120331284027326E-003
 Lowest  eigenvalues of input Hessian
   -0.000000   -0.000000   -0.000000    0.000000    0.000000    0.000000
    0.005000    0.005655    0.005741    0.006155    0.006832    0.007464
    0.008866    0.010328    0.013169    0.015133    0.016210    0.017255
 Highest eigenvalues
    1.754088    1.819743    1.912150    1.968369    2.073052    2.164730
 

........................................................................
.............................. CYCLE   21 ..............................
........................................................................
   1    -42.5702902 -0.425703E+02  0.161E-02    3.28       0.0  T
   2    -42.5702902 -0.526665E-07  0.981E-03    3.28       1.9  T
   3    -42.5702900  0.165204E-06  0.262E-03    3.28       7.0  T
   4    -42.5702903 -0.203390E-06  0.562E-04    3.28      32.5  T
   5    -42.5702903 -0.892335E-09  0.347E-04    3.28      52.7  T
     SCC iter.                  ...        0 min,  0.006 sec
     gradient                   ...        0 min,  0.015 sec
 * total energy  :   -41.9573446 Eh     change       -0.1322956E-04 Eh
   gradient norm :     0.0011322 Eh/α   predicted     0.0000000E+00 (-100.00%)
   displ. norm   :     0.0331826 α      lambda       -0.6404899E-05
   maximum displ.:     0.0204011 α      in ANC's #2, #6, #1, ...

........................................................................
.............................. CYCLE   22 ..............................
........................................................................
   1    -42.5698686 -0.425699E+02  0.124E-02    3.28       0.0  T
   2    -42.5698687 -0.343480E-07  0.738E-03    3.28       2.5  T
   3    -42.5698686  0.562625E-07  0.134E-03    3.28      13.6  T
   4    -42.5698687 -0.683230E-07  0.337E-04    3.28      54.1  T
   5    -42.5698687 -0.134415E-08  0.172E-04    3.28     106.2  T
     SCC iter.                  ...        0 min,  0.006 sec
     gradient                   ...        0 min,  0.015 sec
 * total energy  :   -41.9573508 Eh     change       -0.6171271E-05 Eh
   gradient norm :     0.0003565 Eh/α   predicted    -0.3209357E-05 ( -48.00%)
   displ. norm   :     0.0328115 α      lambda        0.2841849E-05
   maximum displ.:     0.0204024 α      in ANC's #2, #6, #5, ...

........................................................................
.............................. CYCLE   23 ..............................
........................................................................
   1    -42.5694245 -0.425694E+02  0.122E-02    3.28       0.0  T
   2    -42.5694245 -0.337064E-07  0.730E-03    3.28       2.5  T
   3    -42.5694244  0.496661E-07  0.128E-03    3.28      14.3  T
   4    -42.5694245 -0.609873E-07  0.327E-04    3.28      55.8  T
   5    -42.5694245 -0.132061E-08  0.159E-04    3.28     115.0  T
     SCC iter.                  ...        0 min,  0.006 sec
     gradient                   ...        0 min,  0.015 sec
 * total energy  :   -41.9573500 Eh     change        0.7818477E-06 Eh
   gradient norm :     0.0014668 Eh/α   predicted     0.1418315E-05 (  81.41%)
   displ. norm   :     0.0120474 α      lambda       -0.4546676E-05
   maximum displ.:     0.0064124 α      in ANC's #7, #10, #8, ...

........................................................................
.............................. CYCLE   24 ..............................
........................................................................
   1    -42.5697155 -0.425697E+02  0.674E-03    3.28       0.0  T
   2    -42.5697155 -0.789037E-08  0.406E-03    3.28       4.5  T
   3    -42.5697155  0.150990E-08  0.432E-04    3.28      42.3  T
   4    -42.5697155 -0.320075E-08  0.173E-04    3.28     105.3  T
     SCC iter.                  ...        0 min,  0.005 sec
     gradient                   ...        0 min,  0.015 sec
 * total energy  :   -41.9573542 Eh     change       -0.4228100E-05 Eh
   gradient norm :     0.0007129 Eh/α   predicted    -0.2274167E-05 ( -46.21%)
   displ. norm   :     0.0249249 α      lambda       -0.3212909E-05
   maximum displ.:     0.0120824 α      in ANC's #7, #1, #2, ...

   *** GEOMETRY OPTIMIZATION CONVERGED AFTER 24 ITERATIONS ***

------------------------------------------------------------------------
 total energy gain   :        -0.0058975 Eh       -3.7007 kcal/mol
 total RMSD          :         0.6063121 a0        0.3208 Å
 total power (kW/mol):        -0.6451570 (step)  -19.9053 (real)
------------------------------------------------------------------------

 ANCopt (total)                0 d,  0 h,  0 min,  0.778 sec
 optimizer setup                ...        0 min,  0.000 sec (  0.018%)
 model hessian                  ...        0 min,  0.010 sec (  1.272%)
 ANC generation                 ...        0 min,  0.002 sec (  0.225%)
 coordinate transformation      ...        0 min,  0.000 sec (  0.057%)
 single point calculation       ...        0 min,  0.756 sec ( 97.222%)
 optimization log               ...        0 min,  0.003 sec (  0.326%)
 hessian update                 ...        0 min,  0.000 sec (  0.042%)
 rational function              ...        0 min,  0.005 sec (  0.622%)

================
 final structure:
================
$coord
    2.75080415083970   -0.07317431604559    0.86043781881195      C 
    1.15175629044286    1.69779755101385   -0.25562968853513      C 
    2.03035514821777    4.10981482039441   -0.34589735475941      O 
    0.50198390328934    6.02327331082733   -1.40781210612318      C 
    1.94683418653158    8.50029299821862   -1.21792709283274      C 
   -1.18155461632733    0.92391015660537   -1.18468012127817      C 
   -1.92017462435169   -1.59057724037726   -1.00358087687169      C 
   -4.17651614622424   -2.45974987275315   -1.88151432599458      O 
   -5.89571761510909   -0.77030763111592   -3.02367810159205      C 
   -8.21897150785419   -2.28363390211438   -3.78322878652794      C 
   -0.31454139899746   -3.39409392346177    0.12368181754769      C 
    2.01119945850338   -2.55999789275631    1.03582300166422      C 
   -1.14401917722460   -6.01103366008744    0.29429654469620      C 
    0.16914080685728   -7.95118044629311    1.19718142816232      C 
    4.55340009811090    0.55266555385672    1.57363321356571      H 
   -1.29278949183737    6.16277867948449   -0.37098264023072      H 
    0.08787685469978    5.58901259461356   -3.39704348566722      H 
    2.38193394551280    8.90469299669508    0.74747516897849      H 
    0.81821320005812   10.03112761064182   -1.99040846983822      H 
    3.70975686023751    8.36389563240669   -2.26042117507427      H 
   -2.42594531658455    2.28124752370258   -2.05262216857528      H 
   -5.03714430151399    0.10562148870763   -4.70121062758884      H 
   -6.42766466128880    0.72904907689780   -1.68656085129051      H 
   -7.68942546416390   -3.76124167015613   -5.10781709623227      H 
   -9.60242495879360   -1.04896187197041   -4.66532335427331      H 
   -9.05465592036605   -3.16078013476324   -2.12481311196554      H 
    3.26904753305541   -3.90092665772348    1.91349424866647      H 
   -3.03410617599699   -6.33333841564248   -0.40986916713257      H 
    2.06260367965545   -7.77196584608510    1.91830386207041      H 
   -0.62330823290839   -9.82408695462291    1.24536167530631      H 
$end
           -------------------------------------------------
          |                Final Singlepoint                |
           -------------------------------------------------

          ...................................................
          :                      SETUP                      :
          :.................................................:
          :  # basis functions                  72          :
          :  # atomic orbitals                  72          :
          :  # shells                           44          :
          :  # electrons                        76          :
          :  max. iterations                   250          :
          :  Hamiltonian                  GFN2-xTB          :
          :  restarted?                      false          :
          :  GBSA solvation                  false          :
          :  PC potential                    false          :
          :  electronic temp.          300.0000000     K    :
          :  accuracy                    1.0000000          :
          :  -> integral cutoff          0.2500000E+02      :
          :  -> integral neglect         0.1000000E-07      :
          :  -> SCF convergence          0.1000000E-05 Eh   :
          :  -> wf. convergence          0.1000000E-03 e    :
          :  Broyden damping             0.4000000          :
          ...................................................

 iter      E             dE          RMSdq      gap      omega  full diag
   1    -42.5697155 -0.425697E+02  0.741E-05    3.28       0.0  T
   2    -42.5697155 -0.855493E-11  0.405E-05    3.28     450.9  T
   3    -42.5697155 -0.364295E-10  0.304E-05    3.28     600.9  T

   *** convergence criteria satisfied after 3 iterations ***

         #    Occupation            Energy/Eh            Energy/eV
      -------------------------------------------------------------
         1        2.0000           -0.7117972             -19.3690
       ...           ...                  ...                  ...
        32        2.0000           -0.4420086             -12.0277
        33        2.0000           -0.4337605             -11.8032
        34        2.0000           -0.4192695             -11.4089
        35        2.0000           -0.4109403             -11.1823
        36        2.0000           -0.4065529             -11.0629
        37        2.0000           -0.3855819             -10.4922
        38        2.0000           -0.3555690              -9.6755 (HOMO)
        39                         -0.2351597              -6.3990 (LUMO)
        40                         -0.2087420              -5.6802
        41                         -0.1572342              -4.2786
        42                         -0.0658239              -1.7912
        43                          0.0175722               0.4782
       ...                                ...                  ...
        72                          0.6947612              18.9054
      -------------------------------------------------------------
                  HL-Gap            0.1204094 Eh            3.2765 eV
             Fermi-level           -0.2953644 Eh           -8.0373 eV

 SCC (total)                   0 d,  0 h,  0 min,  0.029 sec
 SCC setup                      ...        0 min,  0.000 sec (  0.723%)
 Dispersion                     ...        0 min,  0.000 sec (  0.902%)
 integral evaluation            ...        0 min,  0.009 sec ( 31.124%)
 zeroth order Hamiltonian       ...        0 min,  0.000 sec (  0.538%)
 iterations                     ...        0 min,  0.004 sec ( 14.495%)
 molecular gradient             ...        0 min,  0.015 sec ( 50.807%)
 printout                       ...        0 min,  0.000 sec (  1.196%)

         :::::::::::::::::::::::::::::::::::::::::::::::::::::
         ::                     SUMMARY                     ::
         :::::::::::::::::::::::::::::::::::::::::::::::::::::
         :: total energy             -41.957354258426 Eh    ::
         :: gradient norm              0.000713145770 Eh/a0 ::
         :: HOMO-LUMO gap              3.276505895110 eV    ::
         ::.................................................::
         :: SCC energy               -42.569715475765 Eh    ::
         :: -> isotropic ES            0.032379251166 Eh    ::
         :: -> anisotropic ES          0.007065927936 Eh    ::
         :: -> anisotropic XC          0.015872315540 Eh    ::
         :: -> dispersion             -0.024580991125 Eh    ::
         :: repulsion energy           0.612394936462 Eh    ::
         :: add. restraining           0.000000000000 Eh    ::
         :::::::::::::::::::::::::::::::::::::::::::::::::::::

           -------------------------------------------------
          |                Property Printout                |
           -------------------------------------------------

    * Orbital Energies and Occupations

         #    Occupation            Energy/Eh            Energy/eV
      -------------------------------------------------------------
         1        2.0000           -0.7117972             -19.3690
       ...           ...                  ...                  ...
        26        2.0000           -0.4749924             -12.9252
        27        2.0000           -0.4619609             -12.5706
        28        2.0000           -0.4603632             -12.5271
        29        2.0000           -0.4584617             -12.4754
        30        2.0000           -0.4559604             -12.4073
        31        2.0000           -0.4482723             -12.1981
        32        2.0000           -0.4420086             -12.0277
        33        2.0000           -0.4337605             -11.8032
        34        2.0000           -0.4192695             -11.4089
        35        2.0000           -0.4109403             -11.1823
        36        2.0000           -0.4065529             -11.0629
        37        2.0000           -0.3855819             -10.4922
        38        2.0000           -0.3555690              -9.6755 (HOMO)
        39                         -0.2351597              -6.3990 (LUMO)
        40                         -0.2087420              -5.6802
        41                         -0.1572342              -4.2786
        42                         -0.0658239              -1.7912
        43                          0.0175722               0.4782
        44                          0.0258303               0.7029
        45                          0.0891159               2.4250
        46                          0.1062732               2.8918
        47                          0.1077638               2.9324
        48                          0.1273408               3.4651
        49                          0.1345932               3.6625
       ...                                ...                  ...
        72                          0.6947612              18.9054
      -------------------------------------------------------------
                  HL-Gap            0.1204094 Eh            3.2765 eV
             Fermi-level           -0.2953644 Eh           -8.0373 eV

     #   Z        covCN         q      C6AA      α(0)
     1   6 C      2.916    -0.069    29.719     8.939
     2   6 C      2.863     0.141    24.924     8.183
     3   8 O      1.706    -0.272    18.515     5.810
     4   6 C      3.690     0.089    19.273     6.283
     5   6 C      3.751    -0.113    22.731     6.799
     6   6 C      2.914    -0.107    30.706     9.087
     7   6 C      2.867     0.137    25.008     8.197
     8   8 O      1.706    -0.270    18.472     5.803
     9   6 C      3.689     0.090    19.273     6.283
    10   6 C      3.751    -0.113    22.718     6.797
    11   6 C      2.968    -0.019    28.472     8.752
    12   6 C      2.924    -0.036    28.904     8.817
    13   6 C      2.895    -0.027    28.685     8.781
    14   6 C      2.837    -0.093    30.334     9.026
    15   1 H      0.926     0.048     2.350     2.397
    16   1 H      0.923     0.027     2.632     2.537
    17   1 H      0.923     0.027     2.633     2.538
    18   1 H      0.925     0.057     2.231     2.336
    19   1 H      0.925     0.046     2.375     2.410
    20   1 H      0.925     0.057     2.236     2.338
    21   1 H      0.926     0.029     2.598     2.521
    22   1 H      0.923     0.027     2.636     2.539
    23   1 H      0.923     0.026     2.637     2.540
    24   1 H      0.925     0.057     2.239     2.340
    25   1 H      0.925     0.045     2.379     2.412
    26   1 H      0.925     0.057     2.239     2.340
    27   1 H      0.926     0.047     2.356     2.400
    28   1 H      0.926     0.048     2.346     2.395
    29   1 H      0.926     0.034     2.536     2.490
    30   1 H      0.926     0.032     2.553     2.498

 Mol. C6AA /au·bohr⁶  :       8882.523857
 Mol. C8AA /au·bohr⁸  :     204240.490581
 Mol. α(0) /au        :        146.589721


Wiberg/Mayer (AO) data.
largest (>0.10) Wiberg bond orders for each atom
          total WBO             WBO to atom ...
     1  C   3.984        C   12 1.474    C    2 1.338    H   15 0.968
     2  C   3.935        C    6 1.367    C    1 1.338    O    3 1.067
     3  O   2.227        C    2 1.067    C    4 0.969
     4  C   3.950        C    5 1.015    O    3 0.969    H   16 0.968    H   17 0.968
     5  C   3.992        C    4 1.015    H   20 0.986    H   18 0.986    H   19 0.985
     6  C   3.975        C    7 1.385    C    2 1.367    H   21 0.960
     7  C   3.934        C    6 1.385    C   11 1.292    O    8 1.067
     8  O   2.240        C    7 1.067    C    9 0.969
     9  C   3.950        C   10 1.015    O    8 0.969    H   23 0.968    H   22 0.968
    10  C   3.992        C    9 1.015    H   24 0.986    H   26 0.986    H   25 0.985
    11  C   3.984        C   12 1.375    C    7 1.292    C   13 1.102
    12  C   3.991        C    1 1.474    C   11 1.375    H   27 0.964
    13  C   3.990        C   14 1.888    C   11 1.102    H   28 0.963
    14  C   3.981        C   13 1.888    H   30 0.979    H   29 0.973
    15  H   0.997        C    1 0.968
    16  H   0.999        C    4 0.968
    17  H   0.999        C    4 0.968
    18  H   0.997        C    5 0.986
    19  H   0.997        C    5 0.985
    20  H   0.997        C    5 0.986
    21  H   0.999        C    6 0.960
    22  H   0.999        C    9 0.968
    23  H   0.999        C    9 0.968
    24  H   0.997        C   10 0.986
    25  H   0.997        C   10 0.985
    26  H   0.997        C   10 0.986
    27  H   0.996        C   12 0.964
    28  H   0.997        C   13 0.963
    29  H   0.999        C   14 0.973
    30  H   0.998        C   14 0.979

molecular dipole:
                 x           y           z       tot (Debye)
 q only:       -0.551       0.667      -0.375
   full:       -0.727       0.898      -0.504       3.204
molecular quadrupole (traceless):
                xx          xy          yy          xz          yz          zz
 q only:        2.105      -1.140       1.325       4.439      -2.463      -3.430
  q+dip:        2.540      -3.772       0.616       5.436      -3.814      -3.156
   full:        1.975      -3.846      -0.078       4.409      -3.325      -1.897

           -------------------------------------------------
          |                Geometry Summary                 |
           -------------------------------------------------

      molecular mass/u    :      192.2572000
   center of mass at/Å    :       -0.5083661      -0.1557156      -0.4339181
  moments of inertia/u·Å² :        0.5840786E+03   0.1177825E+04   0.1749127E+04
rotational constants/cm⁻¹ :        0.2886193E-01   0.1431251E-01   0.9637739E-02

 * 29 selected distances

     #   Z        #   Z                                     value/Å
     1   6 C      2   6 C                                 1.3939479
     2   6 C      3   8 O                                 1.3592659
     3   8 O      4   6 C                                 1.4125073
     4   6 C      5   6 C                                 1.5208001
     2   6 C      6   6 C                                 1.3906771
     6   6 C      7   6 C                                 1.3901360
     7   6 C      8   8 O                                 1.3612621
     8   8 O      9   6 C                                 1.4114663
     9   6 C     10   6 C                                 1.5212887 (max)
     7   6 C     11   6 C                                 1.4101806
     1   6 C     12   6 C                                 1.3760712
    11   6 C     12   6 C                                 1.3937356
    13   6 C     14   6 C                                 1.3286207
     1   6 C     15   1 H                                 1.0779739
     4   6 C     16   1 H                                 1.0993253
     4   6 C     17   1 H                                 1.0995061
     5   6 C     18   1 H                                 1.0865102
     5   6 C     19   1 H                                 1.0862924
     5   6 C     20   1 H                                 1.0862057
     6   6 C     21   1 H                                 1.0772620
     9   6 C     22   1 H                                 1.0996853
     9   6 C     23   1 H                                 1.0997369
    10   6 C     24   1 H                                 1.0868479
    10   6 C     25   1 H                                 1.0866123
    10   6 C     26   1 H                                 1.0868245
    12   6 C     27   1 H                                 1.0780912
    13   6 C     28   1 H                                 1.0808902
    14   6 C     29   1 H                                 1.0763701 (min)
    14   6 C     30   1 H                                 1.0764662

 * 3 distinct bonds (by element types)

   Z      Z             #   av. dist./Å        max./Å        min./Å
   1 H    6 C          16     1.0865375     1.0997369     1.0763701
   6 C    6 C           9     1.4139398     1.5212887     1.3286207
   6 C    8 O           4     1.3861254     1.4125073     1.3592659


optimized geometry written to: xtbopt.xyz


           -------------------------------------------------
          | TOTAL ENERGY              -41.957354258426 Eh   |
          | GRADIENT NORM               0.000713145770 Eh/α |
          | HOMO-LUMO GAP               3.276505895110 eV   |
           -------------------------------------------------

------------------------------------------------------------------------
 * finished run on 2021/05/19 at 10:59:43.325     
------------------------------------------------------------------------
 total:
 * wall-time:     0 d,  0 h,  0 min,  0.879 sec
 *  cpu-time:     0 d,  0 h,  0 min,  0.861 sec
 * ratio c/w:     0.979 speedup
 SCF:
 * wall-time:     0 d,  0 h,  0 min,  0.041 sec
 *  cpu-time:     0 d,  0 h,  0 min,  0.041 sec
 * ratio c/w:     1.000 speedup
 ANC optimizer:
 * wall-time:     0 d,  0 h,  0 min,  0.808 sec
 *  cpu-time:     0 d,  0 h,  0 min,  0.800 sec
 * ratio c/w:     0.990 speedup

