      -----------------------------------------------------------      
     |                   =====================                   |     
     |                           x T B                           |     
     |                   =====================                   |     
     |                         S. Grimme                         |     
     |          Mulliken Center for Theoretical Chemistry        |     
     |                    University of Bonn                     |     
     |                Version 6.2 RC2 (SAW190805)                |     
      -----------------------------------------------------------      

   This program is distributed in the hope that it will be useful,
   but WITHOUT ANY WARRANTY; without even the implied warranty of
   MERCHANTABILITY or FITNESS FOR A PARTICULAR PURPOSE.
   
   FOR NON-COMMERCIAL, ACADEMIA USE ONLY.
   
   Cite this work as:
   * S. Grimme, C. Bannwarth, P. Shushkov, J. Chem. Theory Comput., 2017,
     13, 1989-2009. DOI: 10.1021/acs.jctc.7b00118
   * C. Bannwarth, S. Ehlert and S. Grimme., J. Chem. Theory Comput., 2019,
     15, 1652-1671. DOI: 10.1021/acs.jctc.8b01176
   * P. Pracht, E. Caldeweyher, S. Ehlert, S. Grimme, ChemRxiv, 2019, preprint.
     DOI: 10.26434/chemrxiv.8326202.v1
   
   for DFT-D4:
   * E. Caldeweyher, C. Bannwarth and S. Grimme, J. Chem. Phys., 2017,
     147, 034112. DOI: 10.1063/1.4993215
   * E. Caldeweyher, S. Ehlert, A. Hansen, H. Neugebauer, S. Spicher,
     C. Bannwarth and S. Grimme, J. Chem. Phys., 2019, 150, 154122.
     DOI: 10.1063/1.5090222
   
   for sTDA-xTB:
   * S. Grimme and C. Bannwarth, J. Chem. Phys., 2016, 145, 054103.
     DOI: 10.1063/1.4959605
   
   in the mass-spec context:
   * V. Asgeirsson, C. Bauer and S. Grimme, Chem. Sci., 2017, 8, 4879.
     DOI: 10.1039/c7sc00601b
   
   for metadynamics refer to:
   * S. Grimme, J. Chem. Theory Comput., 2019, 155, 2847-2862
     DOI: 10.1021/acs.jctc.9b00143
   
   with help from (in alphabetical order)
   C. Bannwarth, F. Bohle, G. Brandenburg, E. Caldeweyher, M. Checinski,
   S. Dohm, S. Ehlert, S. Ehrlich, F. März, H. Neugebauer, J. Pisarek,
   P. Pracht, P. Shushkov, and S. Spicher.
   
 * started run on 2021/05/19 at 10:58:24.751     

           -------------------------------------------------
          |                Calculation Setup                |
           -------------------------------------------------

          program call               : /ihome/ghutchison/geoffh/xtb/xtb 38.xyz -opt
          hostname                   : smp-n58
          coordinate file            : 38.xyz
          omp threads                :                     1
          number of atoms            :                    17
          number of electrons        :                    68
          charge                     :                     0
          spin                       :                   0.0
          first test random number   :      0.63894208255693


########################################################################
# WARNING! Please study the warnings concerning your input carefully
#  - the use of '-opt' is discouraged, please use '--opt' next time
########################################################################

           ------------------------------------------------- 
          |                 G F N 2 - x T B                 |
          | Geometry, Frequencies, Noncovalent interactions |
          |            JCTC 2019 parametrisation            |
           ------------------------------------------------- 
             KAB for C  - Si     :                1.0500
             KAB for H  - Pd     :                0.9500
             k(s)              :                1.8500
             k(p)              :                2.2300
             k(d)              :                2.2300
             k(f)              :                2.0000
             kEN (H0ij)        :               -2.0000
             D4 a1             :                0.5200
             D4 a2             :                5.0000
             D4 s6             :                1.0000
             D4 s8             :                2.7000
             D4 s9             :                5.0000
             alphaj            :                2.0000

  Z AO/shell   Hii/eV     exponent
  1     Wed Apr 25 08:07:45 CEST 2018   EN: 2.200 GM2: 0.406  GM3: 0.0800  RAES: 1.40
     1s    -10.707211    1.230000
  6     Wed Apr 25 08:07:45 CEST 2018   EN: 2.550 GM2: 0.538  GM3: 0.1500  RAES: 3.00
     2s    -13.970922    2.096432
     2p    -10.063292    1.800000
  7     Wed Apr 25 08:07:45 CEST 2018   EN: 3.040 GM2: 0.461  GM3:-0.0640  RAES: 1.90
     2s    -16.686243    2.339881
     2p    -12.523956    2.014332
  9     Mon Apr 23 13:58:50 CEST 2018   EN: 3.980 GM2: 0.532  GM3: 0.1426  RAES: 2.40
     2s    -23.458179    2.416361
     2p    -15.746583    2.308399
 16     Tue Apr 24 11:44:34 CEST 2018   EN: 2.580 GM2: 0.340  GM3:-0.0502  RAES: 3.10
     3s    -20.029654    1.981333
     3p    -11.377694    2.025643
     3d     -0.420282    1.702555

           ------------------------------------------------- 
          |        Self-Consistent Charge Iterations        |
           ------------------------------------------------- 

          ...................................................
          :                      SETUP                      :
          :.................................................:
          :  # basis functions                  62          :
          :  # atomic orbitals                  61          :
          :  # shells                           31          :
          :  # electrons                        68          :
          :  max. iterations                   250          :
          :  Hamiltonian                  GFN2-xTB          :
          :  restarted?                      false          :
          :  GBSA solvation                  false          :
          :  PC potential                    false          :
          :  electronic temp.          300.0000000     K    :
          :  accuracy                    1.0000000          :
          :  -> integral cutoff          0.2500000E+02      :
          :  -> integral neglect         0.1000000E-07      :
          :  -> SCF convergence          0.1000000E-05 Eh   :
          :  -> wf. convergence          0.1000000E-03 e    :
          :  Broyden damping             0.4000000          :
          ...................................................

 iter      E             dE          RMSdq      gap      omega  full diag
   1    -39.7921029 -0.397921E+02  0.613E+00    3.00       0.0  T
   2    -39.8449337 -0.528307E-01  0.402E+00    2.84       1.0  T
   3    -39.8215487  0.233849E-01  0.258E+00    2.81       1.0  T
   4    -39.8764358 -0.548870E-01  0.874E-01    2.76       1.0  T
   5    -39.8853847 -0.894891E-02  0.296E-01    2.70       1.0  T
   6    -39.8858339 -0.449201E-03  0.140E-01    2.74       1.0  T
   7    -39.8859940 -0.160147E-03  0.373E-02    2.74       1.0  T
   8    -39.8860002 -0.623065E-05  0.206E-02    2.74       1.2  T
   9    -39.8860024 -0.215005E-05  0.777E-03    2.74       3.1  T
  10    -39.8860027 -0.295630E-06  0.309E-03    2.74       7.8  T
  11    -39.8860027 -0.826618E-08  0.157E-03    2.74      15.5  T
  12    -39.8860027 -0.103331E-07  0.878E-04    2.74      27.6  T
  13    -39.8860027 -0.509104E-08  0.263E-04    2.74      92.3  T

   *** convergence criteria satisfied after 13 iterations ***

         #    Occupation            Energy/Eh            Energy/eV
      -------------------------------------------------------------
         1        2.0000           -0.8913295             -24.2543
       ...           ...                  ...                  ...
        28        2.0000           -0.5027921             -13.6817
        29        2.0000           -0.4851903             -13.2027
        30        2.0000           -0.4769669             -12.9789
        31        2.0000           -0.4663148             -12.6891
        32        2.0000           -0.4510945             -12.2749
        33        2.0000           -0.4444357             -12.0937
        34        2.0000           -0.4216364             -11.4733 (HOMO)
        35                         -0.3210624              -8.7366 (LUMO)
        36                         -0.2749392              -7.4815
        37                         -0.2570874              -6.9957
        38                         -0.2359893              -6.4216
        39                         -0.2138077              -5.8180
       ...                                ...                  ...
        61                          1.0642302              28.9592
      -------------------------------------------------------------
                  HL-Gap            0.1005740 Eh            2.7368 eV
             Fermi-level           -0.3713494 Eh          -10.1049 eV

 SCC (total)                   0 d,  0 h,  0 min,  0.030 sec
 SCC setup                      ...        0 min,  0.000 sec (  0.846%)
 Dispersion                     ...        0 min,  0.000 sec (  0.695%)
 integral evaluation            ...        0 min,  0.007 sec ( 24.287%)
 zeroth order Hamiltonian       ...        0 min,  0.000 sec (  0.448%)
 iterations                     ...        0 min,  0.012 sec ( 40.885%)
 molecular gradient             ...        0 min,  0.010 sec ( 31.718%)
 printout                       ...        0 min,  0.000 sec (  0.954%)

         :::::::::::::::::::::::::::::::::::::::::::::::::::::
         ::                     SUMMARY                     ::
         :::::::::::::::::::::::::::::::::::::::::::::::::::::
         :: total energy             -39.459014986812 Eh    ::
         :: gradient norm              0.063781241097 Eh/a0 ::
         :: HOMO-LUMO gap              2.736757864794 eV    ::
         ::.................................................::
         :: SCC energy               -39.886002711805 Eh    ::
         :: -> isotropic ES            0.050633406929 Eh    ::
         :: -> anisotropic ES          0.003001767278 Eh    ::
         :: -> anisotropic XC          0.008459158517 Eh    ::
         :: -> dispersion             -0.017061107814 Eh    ::
         :: repulsion energy           0.426965168637 Eh    ::
         :: add. restraining           0.000000000000 Eh    ::
         :::::::::::::::::::::::::::::::::::::::::::::::::::::

      ----------------------------------------------------------- 
     |                   =====================                   |
     |                        A N C O P T                        |
     |                   =====================                   |
     |               Approximate Normal Coordinate               |
     |                Rational Function Optimizer                |
      ----------------------------------------------------------- 

          ...................................................
          :                      SETUP                      :
          :.................................................:
          :   optimization level            normal          :
          :   max. optcycles                   200          :
          :   ANC micro-cycles                  20          :
          :   degrees of freedom                45          :
          :.................................................:
          :   RF solver                   davidson          :
          :   input Hessian                  false          :
          :   write xtbopt.log                true          :
          :   linear?                        false          :
          :   energy convergence         0.5000000E-05 Eh   :
          :   grad. convergence          0.1000000E-02 Eh/α :
          :   maximium RF displ.         2.0000000          :
          :   Hlow (freq-cutoff)         0.5000000E-02      :
          :   Hmax (freq-cutoff)         5.0000000          :
          :   S6 in model hess.         20.0000000          :
          ...................................................

generating ANC from model Hessian ...
Using Lindh-Hessian (1995)
 Shifting diagonal of input Hessian by   4.783751637812523E-003
 Lowest  eigenvalues of input Hessian
   -0.000000   -0.000000   -0.000000   -0.000000    0.000000    0.000000
    0.005000    0.007953    0.008665    0.011003    0.011999    0.018004
    0.018842    0.020034    0.033995    0.037895    0.046997    0.050381
 Highest eigenvalues
    1.642563    1.699742    1.748433    1.830246    2.011219    2.524183
 

........................................................................
.............................. CYCLE    1 ..............................
........................................................................
   1    -39.8860027 -0.398860E+02  0.914E-05    2.74       0.0  T
   2    -39.8860027 -0.994760E-11  0.561E-05    2.74     431.9  T
   3    -39.8860027  0.626699E-11  0.429E-05    2.74     566.0  T
     SCC iter.                  ...        0 min,  0.003 sec
     gradient                   ...        0 min,  0.010 sec
 * total energy  :   -39.4590150 Eh     change        0.2198881E-08 Eh
   gradient norm :     0.0637819 Eh/α   predicted     0.0000000E+00 (-100.00%)
   displ. norm   :     0.1906986 α      lambda       -0.6306613E-02
   maximum displ.:     0.1242539 α      in ANC's #13, #15, #20, ...

........................................................................
.............................. CYCLE    2 ..............................
........................................................................
   1    -39.9177259 -0.399177E+02  0.293E-01    2.75       0.0  T
   2    -39.9177597 -0.337611E-04  0.139E-01    2.76       1.0  T
   3    -39.9177187  0.409829E-04  0.788E-02    2.75       1.0  T
   4    -39.9177846 -0.658439E-04  0.255E-02    2.75       1.0  T
   5    -39.9177855 -0.939544E-06  0.112E-02    2.75       2.2  T
   6    -39.9177863 -0.778125E-06  0.256E-03    2.75       9.5  T
   7    -39.9177864 -0.720587E-07  0.121E-03    2.75      20.0  T
     SCC iter.                  ...        0 min,  0.006 sec
     gradient                   ...        0 min,  0.010 sec
 * total energy  :   -39.4628529 Eh     change       -0.3837938E-02 Eh
   gradient norm :     0.0277761 Eh/α   predicted    -0.3267978E-02 ( -14.85%)
   displ. norm   :     0.0961636 α      lambda       -0.9889854E-03
   maximum displ.:     0.0568771 α      in ANC's #7, #13, #20, ...

........................................................................
.............................. CYCLE    3 ..............................
........................................................................
   1    -39.9226517 -0.399227E+02  0.143E-01    2.74       0.0  T
   2    -39.9226665 -0.148876E-04  0.705E-02    2.74       1.0  T
   3    -39.9226546  0.119360E-04  0.452E-02    2.74       1.0  T
   4    -39.9226752 -0.205762E-04  0.159E-02    2.74       1.5  T
   5    -39.9226762 -0.103576E-05  0.814E-03    2.74       3.0  T
   6    -39.9226765 -0.249188E-06  0.334E-03    2.74       7.3  T
   7    -39.9226766 -0.141855E-06  0.728E-04    2.74      33.3  T
     SCC iter.                  ...        0 min,  0.006 sec
     gradient                   ...        0 min,  0.009 sec
 * total energy  :   -39.4634007 Eh     change       -0.5477762E-03 Eh
   gradient norm :     0.0058440 Eh/α   predicted    -0.4990677E-03 (  -8.89%)
   displ. norm   :     0.0392322 α      lambda       -0.9081236E-04
   maximum displ.:     0.0309785 α      in ANC's #7, #16, #14, ...

........................................................................
.............................. CYCLE    4 ..............................
........................................................................
   1    -39.9221292 -0.399221E+02  0.365E-02    2.74       0.0  T
   2    -39.9221301 -0.835125E-06  0.204E-02    2.74       1.2  T
   3    -39.9221285  0.157221E-05  0.151E-02    2.74       1.6  T
   4    -39.9221308 -0.233278E-05  0.431E-03    2.74       5.6  T
   5    -39.9221309 -0.954323E-07  0.173E-03    2.74      14.0  T
   6    -39.9221310 -0.249429E-07  0.712E-04    2.74      34.1  T
     SCC iter.                  ...        0 min,  0.005 sec
     gradient                   ...        0 min,  0.008 sec
 * total energy  :   -39.4634624 Eh     change       -0.6166504E-04 Eh
   gradient norm :     0.0023290 Eh/α   predicted    -0.4547666E-04 ( -26.25%)
   displ. norm   :     0.0271751 α      lambda       -0.2536255E-04
   maximum displ.:     0.0206817 α      in ANC's #7, #16, #14, ...

........................................................................
.............................. CYCLE    5 ..............................
........................................................................
   1    -39.9212317 -0.399212E+02  0.238E-02    2.74       0.0  T
   2    -39.9212320 -0.228022E-06  0.139E-02    2.74       1.7  T
   3    -39.9212309  0.105485E-05  0.103E-02    2.74       2.3  T
   4    -39.9212323 -0.134511E-05  0.227E-03    2.74      10.7  T
   5    -39.9212323 -0.272474E-07  0.820E-04    2.74      29.6  T
   6    -39.9212323 -0.580361E-08  0.409E-04    2.74      59.3  T
     SCC iter.                  ...        0 min,  0.006 sec
     gradient                   ...        0 min,  0.010 sec
 * total energy  :   -39.4634753 Eh     change       -0.1292224E-04 Eh
   gradient norm :     0.0007923 Eh/α   predicted    -0.1269120E-04 (  -1.79%)
   displ. norm   :     0.0326676 α      lambda       -0.6462543E-05
   maximum displ.:     0.0223838 α      in ANC's #1, #5, #7, ...

........................................................................
.............................. CYCLE    6 ..............................
........................................................................
   1    -39.9207293 -0.399207E+02  0.631E-02    2.75       0.0  T
   2    -39.9207303 -0.908335E-06  0.349E-02    2.75       1.0  T
   3    -39.9207299  0.400479E-06  0.717E-03    2.75       3.4  T
   4    -39.9207307 -0.848754E-06  0.141E-03    2.75      17.3  T
   5    -39.9207307 -0.599396E-08  0.530E-04    2.75      45.8  T
   6    -39.9207307 -0.491426E-09  0.250E-04    2.75      97.0  T
     SCC iter.                  ...        0 min,  0.005 sec
     gradient                   ...        0 min,  0.010 sec
 * total energy  :   -39.4634481 Eh     change        0.2717287E-04 Eh
   gradient norm :     0.0025507 Eh/α   predicted    -0.3233128E-05 (-111.90%)
   displ. norm   :     0.0186309 α      lambda       -0.3781967E-04
   maximum displ.:     0.0132765 α      in ANC's #1, #5, #8, ...

........................................................................
.............................. CYCLE    7 ..............................
........................................................................
   1    -39.9210980 -0.399211E+02  0.374E-02    2.75       0.0  T
   2    -39.9210983 -0.322913E-06  0.206E-02    2.75       1.2  T
   3    -39.9210983  0.389694E-07  0.347E-03    2.75       7.0  T
   4    -39.9210985 -0.188696E-06  0.805E-04    2.75      30.1  T
   5    -39.9210985 -0.260329E-08  0.338E-04    2.75      71.7  T
     SCC iter.                  ...        0 min,  0.005 sec
     gradient                   ...        0 min,  0.010 sec
 * total energy  :   -39.4634732 Eh     change       -0.2510464E-04 Eh
   gradient norm :     0.0008853 Eh/α   predicted    -0.1891450E-04 ( -24.66%)
   displ. norm   :     0.0146257 α      lambda       -0.6786181E-05
   maximum displ.:     0.0096059 α      in ANC's #1, #5, #12, ...

........................................................................
.............................. CYCLE    8 ..............................
........................................................................
   1    -39.9212411 -0.399212E+02  0.272E-02    2.75       0.0  T
   2    -39.9212413 -0.174195E-06  0.151E-02    2.75       1.6  T
   3    -39.9212413  0.315960E-07  0.268E-03    2.75       9.0  T
   4    -39.9212414 -0.107562E-06  0.756E-04    2.75      32.1  T
   5    -39.9212414 -0.259467E-08  0.357E-04    2.75      67.9  T
     SCC iter.                  ...        0 min,  0.004 sec
     gradient                   ...        0 min,  0.010 sec
 * total energy  :   -39.4634751 Eh     change       -0.1839787E-05 Eh
   gradient norm :     0.0006726 Eh/α   predicted    -0.3394215E-05 (  84.49%)
   displ. norm   :     0.0078213 α      lambda       -0.2302220E-05
   maximum displ.:     0.0056286 α      in ANC's #12, #6, #10, ...

   *** GEOMETRY OPTIMIZATION CONVERGED AFTER 8 ITERATIONS ***

------------------------------------------------------------------------
 total energy gain   :        -0.0044601 Eh       -2.7987 kcal/mol
 total RMSD          :         0.0739023 a0        0.0391 Å
 total power (kW/mol):        -1.4637391 (step)  -64.3175 (real)
------------------------------------------------------------------------

 ANCopt (total)                0 d,  0 h,  0 min,  0.182 sec
 optimizer setup                ...        0 min,  0.000 sec (  0.062%)
 model hessian                  ...        0 min,  0.002 sec (  0.842%)
 ANC generation                 ...        0 min,  0.000 sec (  0.250%)
 coordinate transformation      ...        0 min,  0.000 sec (  0.056%)
 single point calculation       ...        0 min,  0.177 sec ( 97.360%)
 optimization log               ...        0 min,  0.001 sec (  0.329%)
 hessian update                 ...        0 min,  0.000 sec (  0.045%)
 rational function              ...        0 min,  0.001 sec (  0.767%)

================
 final structure:
================
$coord
    3.07420356120062   -2.34445262624592   -0.04076940419969      C 
    3.86614390402536    0.10649020457283   -0.05574334882200      C 
    6.53333451217440    1.00515351598785   -0.07650478487999      C 
    8.17032969341466   -0.92551850683074   -0.07818552614532      F 
    7.07386227832951    2.41885370557713   -2.11618061010926      F 
    7.09921415890016    2.43687833350192    1.94365408596120      F 
    1.41334141563001    2.25410605352050   -0.04888298016933      S 
   -0.73488752490967   -0.21474239296047   -0.02495286868387      C 
   -3.33192440434995    0.26435905780421   -0.01376825207253      C 
   -5.46901501659260    0.63288957934438    0.00402601637869      N 
    0.40925957176106   -2.57313501291474   -0.02309826143819      C 
   -1.02375013716677   -4.90453358350938   -0.00589908461168      C 
   -0.02622350262447   -7.20931759325665   -0.00572474439072      C 
    4.35750125619102   -3.91739502528303   -0.04298232551348      H 
   -3.05450819594638   -4.66263687135340    0.00989590229728      H 
    1.98105425696029   -7.53792840862613   -0.01567019059285      H 
   -1.20898194866921   -8.86210881045609    0.01324833236751      H 
$end
           -------------------------------------------------
          |                Final Singlepoint                |
           -------------------------------------------------

          ...................................................
          :                      SETUP                      :
          :.................................................:
          :  # basis functions                  62          :
          :  # atomic orbitals                  61          :
          :  # shells                           31          :
          :  # electrons                        68          :
          :  max. iterations                   250          :
          :  Hamiltonian                  GFN2-xTB          :
          :  restarted?                      false          :
          :  GBSA solvation                  false          :
          :  PC potential                    false          :
          :  electronic temp.          300.0000000     K    :
          :  accuracy                    1.0000000          :
          :  -> integral cutoff          0.2500000E+02      :
          :  -> integral neglect         0.1000000E-07      :
          :  -> SCF convergence          0.1000000E-05 Eh   :
          :  -> wf. convergence          0.1000000E-03 e    :
          :  Broyden damping             0.4000000          :
          ...................................................

 iter      E             dE          RMSdq      gap      omega  full diag
   1    -39.9212414 -0.399212E+02  0.168E-04    2.75       0.0  T
   2    -39.9212414 -0.126974E-10  0.845E-05    2.75     287.1  T
   3    -39.9212414 -0.131521E-09  0.659E-05    2.75     367.8  T

   *** convergence criteria satisfied after 3 iterations ***

         #    Occupation            Energy/Eh            Energy/eV
      -------------------------------------------------------------
         1        2.0000           -0.8949927             -24.3540
       ...           ...                  ...                  ...
        28        2.0000           -0.5035485             -13.7023
        29        2.0000           -0.4855899             -13.2136
        30        2.0000           -0.4768174             -12.9749
        31        2.0000           -0.4664269             -12.6921
        32        2.0000           -0.4481695             -12.1953
        33        2.0000           -0.4446382             -12.0992
        34        2.0000           -0.4227795             -11.5044 (HOMO)
        35                         -0.3218920              -8.7591 (LUMO)
        36                         -0.2704998              -7.3607
        37                         -0.2590820              -7.0500
        38                         -0.2346761              -6.3859
        39                         -0.2064767              -5.6185
       ...                                ...                  ...
        61                          1.1611399              31.5962
      -------------------------------------------------------------
                  HL-Gap            0.1008875 Eh            2.7453 eV
             Fermi-level           -0.3723358 Eh          -10.1318 eV

 SCC (total)                   0 d,  0 h,  0 min,  0.021 sec
 SCC setup                      ...        0 min,  0.000 sec (  0.680%)
 Dispersion                     ...        0 min,  0.000 sec (  0.496%)
 integral evaluation            ...        0 min,  0.007 sec ( 33.349%)
 zeroth order Hamiltonian       ...        0 min,  0.000 sec (  0.583%)
 iterations                     ...        0 min,  0.003 sec ( 15.003%)
 molecular gradient             ...        0 min,  0.010 sec ( 48.354%)
 printout                       ...        0 min,  0.000 sec (  1.315%)

         :::::::::::::::::::::::::::::::::::::::::::::::::::::
         ::                     SUMMARY                     ::
         :::::::::::::::::::::::::::::::::::::::::::::::::::::
         :: total energy             -39.463475062189 Eh    ::
         :: gradient norm              0.000673405715 Eh/a0 ::
         :: HOMO-LUMO gap              2.745289159718 eV    ::
         ::.................................................::
         :: SCC energy               -39.921241361429 Eh    ::
         :: -> isotropic ES            0.050782087098 Eh    ::
         :: -> anisotropic ES          0.002695493473 Eh    ::
         :: -> anisotropic XC          0.006277048944 Eh    ::
         :: -> dispersion             -0.017201895861 Eh    ::
         :: repulsion energy           0.457741045683 Eh    ::
         :: add. restraining           0.000000000000 Eh    ::
         :::::::::::::::::::::::::::::::::::::::::::::::::::::

           -------------------------------------------------
          |                Property Printout                |
           -------------------------------------------------

    * Orbital Energies and Occupations

         #    Occupation            Energy/Eh            Energy/eV
      -------------------------------------------------------------
         1        2.0000           -0.8949927             -24.3540
       ...           ...                  ...                  ...
        22        2.0000           -0.5456826             -14.8488
        23        2.0000           -0.5437394             -14.7959
        24        2.0000           -0.5311188             -14.4525
        25        2.0000           -0.5141531             -13.9908
        26        2.0000           -0.5102945             -13.8858
        27        2.0000           -0.5084172             -13.8347
        28        2.0000           -0.5035485             -13.7023
        29        2.0000           -0.4855899             -13.2136
        30        2.0000           -0.4768174             -12.9749
        31        2.0000           -0.4664269             -12.6921
        32        2.0000           -0.4481695             -12.1953
        33        2.0000           -0.4446382             -12.0992
        34        2.0000           -0.4227795             -11.5044 (HOMO)
        35                         -0.3218920              -8.7591 (LUMO)
        36                         -0.2704998              -7.3607
        37                         -0.2590820              -7.0500
        38                         -0.2346761              -6.3859
        39                         -0.2064767              -5.6185
        40                         -0.1537867              -4.1847
        41                         -0.1511773              -4.1137
        42                         -0.0544057              -1.4805
        43                         -0.0270050              -0.7348
        44                         -0.0032330              -0.0880
        45                          0.0106022               0.2885
       ...                                ...                  ...
        61                          1.1611399              31.5962
      -------------------------------------------------------------
                  HL-Gap            0.1008875 Eh            2.7453 eV
             Fermi-level           -0.3723358 Eh          -10.1318 eV

     #   Z        covCN         q      C6AA      α(0)
     1   6 C      3.089    -0.036    28.796     8.796
     2   6 C      2.994    -0.031    28.766     8.798
     3   6 C      3.357     0.493    16.891     6.459
     4   9 F      0.791    -0.199    11.229     3.958
     5   9 F      0.791    -0.203    11.261     3.964
     6   9 F      0.791    -0.203    11.261     3.964
     7  16 S      2.303     0.092   137.351    19.725
     8   6 C      2.999     0.017    27.612     8.620
     9   6 C      1.946     0.115    28.247     8.583
    10   7 N      0.911    -0.208    25.522     7.306
    11   6 C      3.126     0.018    27.410     8.573
    12   6 C      2.892    -0.025    28.630     8.773
    13   6 C      2.839    -0.075    29.873     8.957
    14   1 H      0.926     0.076     2.021     2.223
    15   1 H      0.925     0.054     2.273     2.358
    16   1 H      0.926     0.056     2.241     2.341
    17   1 H      0.926     0.059     2.211     2.325

 Mol. C6AA /au·bohr⁶  :       5448.046821
 Mol. C8AA /au·bohr⁸  :     151404.792634
 Mol. α(0) /au        :        115.723628


Wiberg/Mayer (AO) data.
largest (>0.10) Wiberg bond orders for each atom
          total WBO             WBO to atom ...
     1  C   3.985        C    2 1.576    C   11 1.255    H   14 0.956    S    7 0.105
     2  C   3.941        C    1 1.576    S    7 1.183    C    3 0.968
     3  C   3.837        C    2 0.968    F    4 0.952    F    5 0.944    F    6 0.944
     4  F   1.078        C    3 0.952
     5  F   1.075        C    3 0.944
     6  F   1.075        C    3 0.944
     7  S   2.688        C    2 1.183    C    8 1.151    C    1 0.105
     8  C   3.949        C   11 1.414    S    7 1.151    C    9 1.143
     9  C   3.957        N   10 2.771    C    8 1.143
    10  N   3.011        C    9 2.771
    11  C   3.985        C    8 1.414    C    1 1.255    C   12 1.106
    12  C   3.990        C   13 1.880    C   11 1.106    H   15 0.962
    13  C   3.989        C   12 1.880    H   17 0.976    H   16 0.973
    14  H   0.993        C    1 0.956
    15  H   0.997        C   12 0.962
    16  H   0.997        C   13 0.973
    17  H   0.995        C   13 0.976

molecular dipole:
                 x           y           z       tot (Debye)
 q only:       -0.400      -0.995       0.006
   full:        0.162      -1.167       0.003       2.994
molecular quadrupole (traceless):
                xx          xy          yy          xz          yz          zz
 q only:      -17.064      -2.948      12.709       0.172       0.027       4.355
  q+dip:      -17.718      -2.931      14.511       0.144       0.018       3.207
   full:      -20.262      -2.390      14.145       0.181       0.026       6.117

           -------------------------------------------------
          |                Geometry Summary                 |
           -------------------------------------------------

      molecular mass/u    :      203.1815000
   center of mass at/Å    :        1.3037375      -0.1562544      -0.0241432
  moments of inertia/u·Å² :        0.4269940E+03   0.1076986E+04   0.1416288E+04
rotational constants/cm⁻¹ :        0.3947979E-01   0.1565260E-01   0.1190269E-01

 * 15 selected distances

     #   Z        #   Z                                     value/Å
     1   6 C      2   6 C                                 1.3630310
     2   6 C      3   6 C                                 1.4894185
     3   6 C      4   9 F                                 1.3394824
     3   6 C      5   9 F                                 1.3440473
     3   6 C      6   9 F                                 1.3440579
     2   6 C      7  16 S                                 1.7251942
     7  16 S      8   6 C                                 1.7318471 (max)
     9   6 C     10   7 N                                 1.1476301
     1   6 C     11   6 C                                 1.4154413
     8   6 C     11   6 C                                 1.3871200
    12   6 C     13   6 C                                 1.3289714
     1   6 C     14   1 H                                 1.0742436 (min)
    12   6 C     15   1 H                                 1.0822602
    13   6 C     16   1 H                                 1.0763585
    13   6 C     17   1 H                                 1.0755450

 * 5 distinct bonds (by element types)

   Z      Z             #   av. dist./Å        max./Å        min./Å
   1 H    6 C           4     1.0771018     1.0822602     1.0742436
   6 C    6 C           5     1.3967965     1.4894185     1.3289714
   6 C    7 N           1     1.1476301     1.1476301     1.1476301
   6 C    9 F           3     1.3425292     1.3440579     1.3394824
   6 C   16 S           2     1.7285207     1.7318471     1.7251942


optimized geometry written to: xtbopt.xyz


           -------------------------------------------------
          | TOTAL ENERGY              -39.463475062189 Eh   |
          | GRADIENT NORM               0.000673405715 Eh/α |
          | HOMO-LUMO GAP               2.745289159718 eV   |
           -------------------------------------------------

------------------------------------------------------------------------
 * finished run on 2021/05/19 at 10:58:25.004     
------------------------------------------------------------------------
 total:
 * wall-time:     0 d,  0 h,  0 min,  0.252 sec
 *  cpu-time:     0 d,  0 h,  0 min,  0.252 sec
 * ratio c/w:     0.999 speedup
 SCF:
 * wall-time:     0 d,  0 h,  0 min,  0.031 sec
 *  cpu-time:     0 d,  0 h,  0 min,  0.031 sec
 * ratio c/w:     1.000 speedup
 ANC optimizer:
 * wall-time:     0 d,  0 h,  0 min,  0.203 sec
 *  cpu-time:     0 d,  0 h,  0 min,  0.203 sec
 * ratio c/w:     1.000 speedup

