      -----------------------------------------------------------      
     |                   =====================                   |     
     |                           x T B                           |     
     |                   =====================                   |     
     |                         S. Grimme                         |     
     |          Mulliken Center for Theoretical Chemistry        |     
     |                    University of Bonn                     |     
     |                Version 6.2 RC2 (SAW190805)                |     
      -----------------------------------------------------------      

   This program is distributed in the hope that it will be useful,
   but WITHOUT ANY WARRANTY; without even the implied warranty of
   MERCHANTABILITY or FITNESS FOR A PARTICULAR PURPOSE.
   
   FOR NON-COMMERCIAL, ACADEMIA USE ONLY.
   
   Cite this work as:
   * S. Grimme, C. Bannwarth, P. Shushkov, J. Chem. Theory Comput., 2017,
     13, 1989-2009. DOI: 10.1021/acs.jctc.7b00118
   * C. Bannwarth, S. Ehlert and S. Grimme., J. Chem. Theory Comput., 2019,
     15, 1652-1671. DOI: 10.1021/acs.jctc.8b01176
   * P. Pracht, E. Caldeweyher, S. Ehlert, S. Grimme, ChemRxiv, 2019, preprint.
     DOI: 10.26434/chemrxiv.8326202.v1
   
   for DFT-D4:
   * E. Caldeweyher, C. Bannwarth and S. Grimme, J. Chem. Phys., 2017,
     147, 034112. DOI: 10.1063/1.4993215
   * E. Caldeweyher, S. Ehlert, A. Hansen, H. Neugebauer, S. Spicher,
     C. Bannwarth and S. Grimme, J. Chem. Phys., 2019, 150, 154122.
     DOI: 10.1063/1.5090222
   
   for sTDA-xTB:
   * S. Grimme and C. Bannwarth, J. Chem. Phys., 2016, 145, 054103.
     DOI: 10.1063/1.4959605
   
   in the mass-spec context:
   * V. Asgeirsson, C. Bauer and S. Grimme, Chem. Sci., 2017, 8, 4879.
     DOI: 10.1039/c7sc00601b
   
   for metadynamics refer to:
   * S. Grimme, J. Chem. Theory Comput., 2019, 155, 2847-2862
     DOI: 10.1021/acs.jctc.9b00143
   
   with help from (in alphabetical order)
   C. Bannwarth, F. Bohle, G. Brandenburg, E. Caldeweyher, M. Checinski,
   S. Dohm, S. Ehlert, S. Ehrlich, F. März, H. Neugebauer, J. Pisarek,
   P. Pracht, P. Shushkov, and S. Spicher.
   
 * started run on 2021/05/19 at 10:59:54.966     

           -------------------------------------------------
          |                Calculation Setup                |
           -------------------------------------------------

          program call               : /ihome/ghutchison/geoffh/xtb/xtb 384.xyz -opt
          hostname                   : smp-n122
          coordinate file            : 384.xyz
          omp threads                :                     1
          number of atoms            :                    33
          number of electrons        :                    84
          charge                     :                     0
          spin                       :                   0.0
          first test random number   :      0.93027609357306


########################################################################
# WARNING! Please study the warnings concerning your input carefully
#  - the use of '-opt' is discouraged, please use '--opt' next time
########################################################################

           ------------------------------------------------- 
          |                 G F N 2 - x T B                 |
          | Geometry, Frequencies, Noncovalent interactions |
          |            JCTC 2019 parametrisation            |
           ------------------------------------------------- 
             KAB for C  - Si     :                1.0500
             KAB for H  - Pd     :                0.9500
             k(s)              :                1.8500
             k(p)              :                2.2300
             k(d)              :                2.2300
             k(f)              :                2.0000
             kEN (H0ij)        :               -2.0000
             D4 a1             :                0.5200
             D4 a2             :                5.0000
             D4 s6             :                1.0000
             D4 s8             :                2.7000
             D4 s9             :                5.0000
             alphaj            :                2.0000

  Z AO/shell   Hii/eV     exponent
  1     Wed Apr 25 08:07:45 CEST 2018   EN: 2.200 GM2: 0.406  GM3: 0.0800  RAES: 1.40
     1s    -10.707211    1.230000
  6     Wed Apr 25 08:07:45 CEST 2018   EN: 2.550 GM2: 0.538  GM3: 0.1500  RAES: 3.00
     2s    -13.970922    2.096432
     2p    -10.063292    1.800000

           ------------------------------------------------- 
          |        Self-Consistent Charge Iterations        |
           ------------------------------------------------- 

          ...................................................
          :                      SETUP                      :
          :.................................................:
          :  # basis functions                  84          :
          :  # atomic orbitals                  84          :
          :  # shells                           50          :
          :  # electrons                        84          :
          :  max. iterations                   250          :
          :  Hamiltonian                  GFN2-xTB          :
          :  restarted?                      false          :
          :  GBSA solvation                  false          :
          :  PC potential                    false          :
          :  electronic temp.          300.0000000     K    :
          :  accuracy                    1.0000000          :
          :  -> integral cutoff          0.2500000E+02      :
          :  -> integral neglect         0.1000000E-07      :
          :  -> SCF convergence          0.1000000E-05 Eh   :
          :  -> wf. convergence          0.1000000E-03 e    :
          :  Broyden damping             0.4000000          :
          ...................................................

 iter      E             dE          RMSdq      gap      omega  full diag
   1    -45.3032787 -0.453033E+02  0.431E+00    3.06       0.0  T
   2    -45.3343981 -0.311193E-01  0.253E+00    3.03       1.0  T
   3    -45.3265797  0.781832E-02  0.718E-01    3.05       1.0  T
   4    -45.3340721 -0.749235E-02  0.312E-01    3.03       1.0  T
   5    -45.3380048 -0.393266E-02  0.686E-02    3.04       1.0  T
   6    -45.3380964 -0.916428E-04  0.352E-02    3.04       1.0  T
   7    -45.3381067 -0.103493E-04  0.175E-02    3.04       1.0  T
   8    -45.3381082 -0.144350E-05  0.634E-03    3.04       2.7  T
   9    -45.3381091 -0.883049E-06  0.128E-03    3.04      13.6  T
  10    -45.3381091 -0.353297E-07  0.533E-04    3.04      32.7  T
  11    -45.3381091 -0.938279E-09  0.191E-04    3.04      91.1  T

   *** convergence criteria satisfied after 11 iterations ***

         #    Occupation            Energy/Eh            Energy/eV
      -------------------------------------------------------------
         1        2.0000           -0.6495978             -17.6765
       ...           ...                  ...                  ...
        36        2.0000           -0.4178462             -11.3702
        37        2.0000           -0.4111271             -11.1873
        38        2.0000           -0.4090777             -11.1316
        39        2.0000           -0.4016854             -10.9304
        40        2.0000           -0.3964847             -10.7889
        41        2.0000           -0.3917952             -10.6613
        42        2.0000           -0.3680609             -10.0154 (HOMO)
        43                         -0.2562775              -6.9737 (LUMO)
        44                         -0.2223313              -6.0499
        45                         -0.2193643              -5.9692
        46                         -0.2131799              -5.8009
        47                         -0.1655554              -4.5050
       ...                                ...                  ...
        84                          0.7215227              19.6336
      -------------------------------------------------------------
                  HL-Gap            0.1117834 Eh            3.0418 eV
             Fermi-level           -0.3121692 Eh           -8.4946 eV

 SCC (total)                   0 d,  0 h,  0 min,  0.053 sec
 SCC setup                      ...        0 min,  0.000 sec (  0.707%)
 Dispersion                     ...        0 min,  0.001 sec (  1.141%)
 integral evaluation            ...        0 min,  0.013 sec ( 24.488%)
 zeroth order Hamiltonian       ...        0 min,  0.000 sec (  0.443%)
 iterations                     ...        0 min,  0.018 sec ( 33.871%)
 molecular gradient             ...        0 min,  0.020 sec ( 38.429%)
 printout                       ...        0 min,  0.000 sec (  0.814%)

         :::::::::::::::::::::::::::::::::::::::::::::::::::::
         ::                     SUMMARY                     ::
         :::::::::::::::::::::::::::::::::::::::::::::::::::::
         :: total energy             -44.543583939550 Eh    ::
         :: gradient norm              0.046041747982 Eh/a0 ::
         :: HOMO-LUMO gap              3.041782192468 eV    ::
         ::.................................................::
         :: SCC energy               -45.338109107685 Eh    ::
         :: -> isotropic ES            0.003368174373 Eh    ::
         :: -> anisotropic ES          0.008512982253 Eh    ::
         :: -> anisotropic XC          0.029604565385 Eh    ::
         :: -> dispersion             -0.035940838123 Eh    ::
         :: repulsion energy           0.794349152685 Eh    ::
         :: add. restraining           0.000000000000 Eh    ::
         :::::::::::::::::::::::::::::::::::::::::::::::::::::

      ----------------------------------------------------------- 
     |                   =====================                   |
     |                        A N C O P T                        |
     |                   =====================                   |
     |               Approximate Normal Coordinate               |
     |                Rational Function Optimizer                |
      ----------------------------------------------------------- 

          ...................................................
          :                      SETUP                      :
          :.................................................:
          :   optimization level            normal          :
          :   max. optcycles                   200          :
          :   ANC micro-cycles                  20          :
          :   degrees of freedom                93          :
          :.................................................:
          :   RF solver                   davidson          :
          :   input Hessian                  false          :
          :   write xtbopt.log                true          :
          :   linear?                        false          :
          :   energy convergence         0.5000000E-05 Eh   :
          :   grad. convergence          0.1000000E-02 Eh/α :
          :   maximium RF displ.         2.0000000          :
          :   Hlow (freq-cutoff)         0.5000000E-02      :
          :   Hmax (freq-cutoff)         5.0000000          :
          :   S6 in model hess.         20.0000000          :
          ...................................................

generating ANC from model Hessian ...
Using Lindh-Hessian (1995)
 Shifting diagonal of input Hessian by   4.173773914869083E-003
 Lowest  eigenvalues of input Hessian
   -0.000000   -0.000000   -0.000000    0.000000    0.000000    0.000000
    0.005000    0.006017    0.006588    0.007636    0.008165    0.008873
    0.011114    0.011424    0.012785    0.012880    0.013072    0.016296
 Highest eigenvalues
    1.848726    1.878881    1.894731    1.955031    1.988147    2.057697
 

........................................................................
.............................. CYCLE    1 ..............................
........................................................................
   1    -45.3381091 -0.453381E+02  0.574E-05    3.04       0.0  T
   2    -45.3381091 -0.204565E-10  0.384E-05    3.04     453.0  T
   3    -45.3381091 -0.194120E-10  0.232E-05    3.04     751.8  T
     SCC iter.                  ...        0 min,  0.005 sec
     gradient                   ...        0 min,  0.020 sec
 * total energy  :   -44.5435839 Eh     change       -0.1019057E-07 Eh
   gradient norm :     0.0460424 Eh/α   predicted     0.0000000E+00 (-100.00%)
   displ. norm   :     0.2194358 α      lambda       -0.5285333E-02
   maximum displ.:     0.0787542 α      in ANC's #21, #49, #17, ...

........................................................................
.............................. CYCLE    2 ..............................
........................................................................
   1    -45.3792668 -0.453793E+02  0.867E-02    3.08       0.0  T
   2    -45.3792774 -0.106670E-04  0.520E-02    3.08       1.0  T
   3    -45.3792626  0.148927E-04  0.263E-02    3.08       1.0  T
   4    -45.3792834 -0.208038E-04  0.481E-03    3.08       3.6  T
   5    -45.3792841 -0.710212E-06  0.194E-03    3.08       9.0  T
   6    -45.3792841 -0.377033E-07  0.838E-04    3.08      20.8  T
     SCC iter.                  ...        0 min,  0.009 sec
     gradient                   ...        0 min,  0.019 sec
 * total energy  :   -44.5468412 Eh     change       -0.3257226E-02 Eh
   gradient norm :     0.0135126 Eh/α   predicted    -0.2769923E-02 ( -14.96%)
   displ. norm   :     0.1318391 α      lambda       -0.5649650E-03
   maximum displ.:     0.0748125 α      in ANC's #6, #8, #7, ...

........................................................................
.............................. CYCLE    3 ..............................
........................................................................
   1    -45.3908509 -0.453909E+02  0.607E-02    3.08       0.0  T
   2    -45.3908530 -0.204779E-05  0.358E-02    3.08       1.0  T
   3    -45.3908498  0.314831E-05  0.112E-02    3.08       1.6  T
   4    -45.3908537 -0.387993E-05  0.161E-03    3.08      10.8  T
   5    -45.3908538 -0.680120E-07  0.777E-04    3.08      22.4  T
   6    -45.3908538 -0.765273E-08  0.358E-04    3.08      48.6  T
     SCC iter.                  ...        0 min,  0.009 sec
     gradient                   ...        0 min,  0.019 sec
 * total energy  :   -44.5471725 Eh     change       -0.3313317E-03 Eh
   gradient norm :     0.0040186 Eh/α   predicted    -0.2873954E-03 ( -13.26%)
   displ. norm   :     0.0948683 α      lambda       -0.1061982E-03
   maximum displ.:     0.0690781 α      in ANC's #6, #7, #8, ...

........................................................................
.............................. CYCLE    4 ..............................
........................................................................
   1    -45.3913347 -0.453913E+02  0.501E-02    3.07       0.0  T
   2    -45.3913350 -0.302569E-06  0.296E-02    3.07       1.0  T
   3    -45.3913338  0.117084E-05  0.607E-03    3.07       2.9  T
   4    -45.3913352 -0.132710E-05  0.101E-03    3.07      17.3  T
   5    -45.3913352 -0.247230E-07  0.338E-04    3.07      51.5  T
     SCC iter.                  ...        0 min,  0.008 sec
     gradient                   ...        0 min,  0.019 sec
 * total energy  :   -44.5472507 Eh     change       -0.7821953E-04 Eh
   gradient norm :     0.0023127 Eh/α   predicted    -0.5357997E-04 ( -31.50%)
   displ. norm   :     0.1192553 α      lambda       -0.8296688E-04
   maximum displ.:     0.0877681 α      in ANC's #6, #4, #2, ...

........................................................................
.............................. CYCLE    5 ..............................
........................................................................
   1    -45.3898584 -0.453899E+02  0.642E-02    3.05       0.0  T
   2    -45.3898587 -0.245536E-06  0.378E-02    3.05       1.0  T
   3    -45.3898575  0.117801E-05  0.587E-03    3.05       3.0  T
   4    -45.3898588 -0.135490E-05  0.789E-04    3.05      22.1  T
   5    -45.3898588 -0.136927E-07  0.308E-04    3.05      56.6  T
   6    -45.3898588 -0.231068E-09  0.116E-04    3.05     150.7  T
     SCC iter.                  ...        0 min,  0.009 sec
     gradient                   ...        0 min,  0.020 sec
 * total energy  :   -44.5473099 Eh     change       -0.5913852E-04 Eh
   gradient norm :     0.0029606 Eh/α   predicted    -0.4208528E-04 ( -28.84%)
   displ. norm   :     0.1138236 α      lambda       -0.6324509E-04
   maximum displ.:     0.0826992 α      in ANC's #6, #2, #4, ...

........................................................................
.............................. CYCLE    6 ..............................
........................................................................
   1    -45.3884426 -0.453884E+02  0.637E-02    3.04       0.0  T
   2    -45.3884428 -0.158241E-06  0.376E-02    3.04       1.0  T
   3    -45.3884422  0.592601E-06  0.438E-03    3.04       4.0  T
   4    -45.3884429 -0.709063E-06  0.615E-04    3.04      28.3  T
   5    -45.3884429 -0.376604E-08  0.355E-04    3.04      49.0  T
     SCC iter.                  ...        0 min,  0.008 sec
     gradient                   ...        0 min,  0.020 sec
 * total energy  :   -44.5473555 Eh     change       -0.4567858E-04 Eh
   gradient norm :     0.0034188 Eh/α   predicted    -0.3203537E-04 ( -29.87%)
   displ. norm   :     0.1398626 α      lambda       -0.7019161E-04
   maximum displ.:     0.1004624 α      in ANC's #6, #2, #4, ...

........................................................................
.............................. CYCLE    7 ..............................
........................................................................
   1    -45.3877315 -0.453877E+02  0.722E-02    3.03       0.0  T
   2    -45.3877317 -0.222053E-06  0.425E-02    3.03       1.0  T
   3    -45.3877314  0.324748E-06  0.391E-03    3.03       4.5  T
   4    -45.3877319 -0.447378E-06  0.425E-04    3.03      40.9  T
   5    -45.3877319 -0.131261E-08  0.266E-04    3.03      65.5  T
     SCC iter.                  ...        0 min,  0.008 sec
     gradient                   ...        0 min,  0.020 sec
 * total energy  :   -44.5474113 Eh     change       -0.5578809E-04 Eh
   gradient norm :     0.0032576 Eh/α   predicted    -0.3579891E-04 ( -35.83%)
   displ. norm   :     0.1964749 α      lambda       -0.8520516E-04
   maximum displ.:     0.1421593 α      in ANC's #6, #2, #4, ...

........................................................................
.............................. CYCLE    8 ..............................
........................................................................
   1    -45.3879054 -0.453879E+02  0.101E-01    3.01       0.0  T
   2    -45.3879059 -0.422397E-06  0.595E-02    3.01       1.0  T
   3    -45.3879055  0.381356E-06  0.493E-03    3.01       3.5  T
   4    -45.3879061 -0.602384E-06  0.622E-04    3.01      28.0  T
   5    -45.3879061 -0.104848E-08  0.393E-04    3.01      44.3  T
     SCC iter.                  ...        0 min,  0.008 sec
     gradient                   ...        0 min,  0.033 sec
 * total energy  :   -44.5474732 Eh     change       -0.6191165E-04 Eh
   gradient norm :     0.0029531 Eh/α   predicted    -0.4424982E-04 ( -28.53%)
   displ. norm   :     0.1822082 α      lambda       -0.5925255E-04
   maximum displ.:     0.1303517 α      in ANC's #6, #2, #1, ...

........................................................................
.............................. CYCLE    9 ..............................
........................................................................
   1    -45.3887947 -0.453888E+02  0.904E-02    3.01       0.0  T
   2    -45.3887950 -0.334521E-06  0.532E-02    3.01       1.0  T
   3    -45.3887948  0.224739E-06  0.409E-03    3.01       4.3  T
   4    -45.3887952 -0.399769E-06  0.574E-04    3.01      30.3  T
   5    -45.3887952 -0.264343E-09  0.357E-04    3.01      48.7  T
     SCC iter.                  ...        0 min,  0.008 sec
     gradient                   ...        0 min,  0.046 sec
 * total energy  :   -44.5475144 Eh     change       -0.4116383E-04 Eh
   gradient norm :     0.0024552 Eh/α   predicted    -0.3061043E-04 ( -25.64%)
   displ. norm   :     0.1436143 α      lambda       -0.3845312E-04
   maximum displ.:     0.0973124 α      in ANC's #6, #2, #1, ...

........................................................................
.............................. CYCLE   10 ..............................
........................................................................
   1    -45.3896674 -0.453897E+02  0.699E-02    3.00       0.0  T
   2    -45.3896676 -0.176563E-06  0.411E-02    3.00       1.0  T
   3    -45.3896673  0.335988E-06  0.402E-03    3.00       4.3  T
   4    -45.3896677 -0.448532E-06  0.529E-04    3.00      32.9  T
   5    -45.3896677 -0.239093E-08  0.320E-04    3.00      54.4  T
     SCC iter.                  ...        0 min,  0.008 sec
     gradient                   ...        0 min,  0.046 sec
 * total energy  :   -44.5475423 Eh     change       -0.2789048E-04 Eh
   gradient norm :     0.0018155 Eh/α   predicted    -0.1962777E-04 ( -29.63%)
   displ. norm   :     0.3117855 α      lambda       -0.4005722E-04
   maximum displ.:     0.1975027 α      in ANC's #6, #2, #1, ...

........................................................................
.............................. CYCLE   11 ..............................
........................................................................
   1    -45.3890975 -0.453891E+02  0.143E-01    2.99       0.0  T
   2    -45.3890983 -0.848661E-06  0.843E-02    2.99       1.0  T
   3    -45.3890979  0.461331E-06  0.524E-03    2.99       3.3  T
   4    -45.3890988 -0.902228E-06  0.120E-03    2.99      14.5  T
   5    -45.3890988 -0.936174E-08  0.680E-04    2.99      25.6  T
   6    -45.3890988 -0.529985E-08  0.212E-04    2.99      81.9  T
     SCC iter.                  ...        0 min,  0.009 sec
     gradient                   ...        0 min,  0.020 sec
 * total energy  :   -44.5475644 Eh     change       -0.2208669E-04 Eh
   gradient norm :     0.0038143 Eh/α   predicted    -0.2089432E-04 (  -5.40%)
   displ. norm   :     0.1126676 α      lambda       -0.7410730E-04
   maximum displ.:     0.0722769 α      in ANC's #1, #2, #4, ...

........................................................................
.............................. CYCLE   12 ..............................
........................................................................
   1    -45.3915823 -0.453916E+02  0.418E-02    3.00       0.0  T
   2    -45.3915826 -0.268790E-06  0.246E-02    3.00       1.0  T
   3    -45.3915821  0.474308E-06  0.443E-03    3.00       3.9  T
   4    -45.3915827 -0.577448E-06  0.801E-04    3.00      21.7  T
   5    -45.3915827 -0.454489E-08  0.494E-04    3.00      35.3  T
     SCC iter.                  ...        0 min,  0.008 sec
     gradient                   ...        0 min,  0.020 sec
 * total energy  :   -44.5475751 Eh     change       -0.1071107E-04 Eh
   gradient norm :     0.0045223 Eh/α   predicted    -0.3753022E-04 ( 250.39%)
   displ. norm   :     0.0786234 α      lambda       -0.5682008E-04
   maximum displ.:     0.0474550 α      in ANC's #2, #6, #1, ...

........................................................................
.............................. CYCLE   13 ..............................
........................................................................
   1    -45.3899513 -0.453900E+02  0.360E-02    2.99       0.0  T
   2    -45.3899514 -0.149299E-06  0.212E-02    2.99       1.0  T
   3    -45.3899499  0.152826E-05  0.824E-03    2.99       2.1  T
   4    -45.3899516 -0.171931E-05  0.776E-04    2.99      22.4  T
   5    -45.3899516 -0.574964E-09  0.379E-04    2.99      45.9  T
     SCC iter.                  ...        0 min,  0.008 sec
     gradient                   ...        0 min,  0.019 sec
 * total energy  :   -44.5476033 Eh     change       -0.2821616E-04 Eh
   gradient norm :     0.0016237 Eh/α   predicted    -0.2858689E-04 (   1.31%)
   displ. norm   :     0.0986185 α      lambda       -0.1355172E-04
   maximum displ.:     0.0620307 α      in ANC's #2, #1, #6, ...

........................................................................
.............................. CYCLE   14 ..............................
........................................................................
   1    -45.3889021 -0.453889E+02  0.451E-02    2.98       0.0  T
   2    -45.3889022 -0.104932E-06  0.265E-02    2.98       1.0  T
   3    -45.3889021  0.982144E-07  0.216E-03    2.98       8.1  T
   4    -45.3889023 -0.153356E-06  0.428E-04    2.98      40.7  T
   5    -45.3889023 -0.289276E-09  0.192E-04    2.98      90.5  T
     SCC iter.                  ...        0 min,  0.008 sec
     gradient                   ...        0 min,  0.020 sec
 * total energy  :   -44.5476140 Eh     change       -0.1072899E-04 Eh
   gradient norm :     0.0020359 Eh/α   predicted    -0.6806568E-05 ( -36.56%)
   displ. norm   :     0.0507971 α      lambda       -0.1296658E-04
   maximum displ.:     0.0321318 α      in ANC's #1, #2, #3, ...

........................................................................
.............................. CYCLE   15 ..............................
........................................................................
   1    -45.3892037 -0.453892E+02  0.198E-02    2.98       0.0  T
   2    -45.3892037 -0.323033E-07  0.117E-02    2.98       1.5  T
   3    -45.3892037  0.936151E-08  0.792E-04    2.98      22.0  T
   4    -45.3892037 -0.188656E-07  0.318E-04    2.98      54.7  T
     SCC iter.                  ...        0 min,  0.020 sec
     gradient                   ...        0 min,  0.033 sec
 * total energy  :   -44.5476228 Eh     change       -0.8786043E-05 Eh
   gradient norm :     0.0013734 Eh/α   predicted    -0.6500651E-05 ( -26.01%)
   displ. norm   :     0.2080235 α      lambda       -0.1927360E-04
   maximum displ.:     0.1365737 α      in ANC's #1, #2, #3, ...

........................................................................
.............................. CYCLE   16 ..............................
........................................................................
   1    -45.3892920 -0.453893E+02  0.890E-02    2.97       0.0  T
   2    -45.3892925 -0.522215E-06  0.524E-02    2.97       1.0  T
   3    -45.3892923  0.284594E-06  0.413E-03    2.97       4.2  T
   4    -45.3892927 -0.465396E-06  0.998E-04    2.97      17.4  T
   5    -45.3892927 -0.102572E-07  0.498E-04    2.97      35.0  T
     SCC iter.                  ...        0 min,  0.008 sec
     gradient                   ...        0 min,  0.020 sec
 * total energy  :   -44.5476271 Eh     change       -0.4294875E-05 Eh
   gradient norm :     0.0036611 Eh/α   predicted    -0.9824623E-05 ( 128.75%)
   displ. norm   :     0.0349961 α      lambda       -0.1284493E-04
   maximum displ.:     0.0196373 α      in ANC's #2, #6, #1, ...

........................................................................
.............................. CYCLE   17 ..............................
........................................................................
   1    -45.3892637 -0.453893E+02  0.139E-02    2.98       0.0  T
   2    -45.3892638 -0.674451E-07  0.816E-03    2.98       2.1  T
   3    -45.3892636  0.234278E-06  0.332E-03    2.98       5.2  T
   4    -45.3892638 -0.264367E-06  0.355E-04    2.98      49.1  T
   5    -45.3892638 -0.249244E-08  0.133E-04    2.98     130.4  T
     SCC iter.                  ...        0 min,  0.008 sec
     gradient                   ...        0 min,  0.020 sec
 * total energy  :   -44.5476356 Eh     change       -0.8459768E-05 Eh
   gradient norm :     0.0016223 Eh/α   predicted    -0.6434064E-05 ( -23.95%)
   displ. norm   :     0.0262569 α      lambda       -0.6184261E-05
   maximum displ.:     0.0125309 α      in ANC's #2, #3, #7, ...

........................................................................
.............................. CYCLE   18 ..............................
........................................................................
   1    -45.3900649 -0.453901E+02  0.122E-02    2.98       0.0  T
   2    -45.3900649 -0.566765E-07  0.731E-03    2.98       2.4  T
   3    -45.3900649  0.716531E-07  0.160E-03    2.98      10.9  T
   4    -45.3900650 -0.881914E-07  0.398E-04    2.98      43.7  T
   5    -45.3900650 -0.173001E-08  0.160E-04    2.98     108.8  T
     SCC iter.                  ...        0 min,  0.008 sec
     gradient                   ...        0 min,  0.020 sec
 * total energy  :   -44.5476375 Eh     change       -0.1888356E-05 Eh
   gradient norm :     0.0013778 Eh/α   predicted    -0.3098646E-05 (  64.09%)
   displ. norm   :     0.0890428 α      lambda       -0.4255681E-05
   maximum displ.:     0.0519546 α      in ANC's #2, #1, #6, ...

........................................................................
.............................. CYCLE   19 ..............................
........................................................................
   1    -45.3893958 -0.453894E+02  0.386E-02    2.98       0.0  T
   2    -45.3893959 -0.577685E-07  0.227E-02    2.98       1.0  T
   3    -45.3893959 -0.210910E-07  0.593E-04    2.98      29.4  T
   4    -45.3893959 -0.723642E-08  0.256E-04    2.98      68.1  T
     SCC iter.                  ...        0 min,  0.007 sec
     gradient                   ...        0 min,  0.020 sec
 * total energy  :   -44.5476397 Eh     change       -0.2269982E-05 Eh
   gradient norm :     0.0011642 Eh/α   predicted    -0.2138399E-05 (  -5.80%)
   displ. norm   :     0.0140411 α      lambda       -0.2789367E-05
   maximum displ.:     0.0075205 α      in ANC's #6, #1, #4, ...

........................................................................
.............................. CYCLE   20 ..............................
........................................................................
   1    -45.3895017 -0.453895E+02  0.596E-03    2.98       0.0  T
   2    -45.3895017 -0.261142E-07  0.352E-03    2.98       4.9  T
   3    -45.3895017  0.314493E-07  0.112E-03    2.98      15.6  T
   4    -45.3895017 -0.369871E-07  0.218E-04    2.98      79.7  T
   5    -45.3895017 -0.104748E-08  0.872E-05    2.98     199.7  T
     SCC iter.                  ...        0 min,  0.008 sec
     gradient                   ...        0 min,  0.020 sec
 * total energy  :   -44.5476419 Eh     change       -0.2150860E-05 Eh
   gradient norm :     0.0007159 Eh/α   predicted    -0.1399513E-05 ( -34.93%)
   displ. norm   :     0.0376427 α      lambda       -0.1213414E-05
   maximum displ.:     0.0244707 α      in ANC's #1, #6, #2, ...

   *** GEOMETRY OPTIMIZATION CONVERGED AFTER 20 ITERATIONS ***

------------------------------------------------------------------------
 total energy gain   :        -0.0040580 Eh       -2.5464 kcal/mol
 total RMSD          :         0.3317212 a0        0.1755 Å
 total power (kW/mol):        -0.5327074 (step)  -10.7378 (real)
------------------------------------------------------------------------

 ANCopt (total)                0 d,  0 h,  0 min,  0.992 sec
 optimizer setup                ...        0 min,  0.000 sec (  0.014%)
 model hessian                  ...        0 min,  0.012 sec (  1.238%)
 ANC generation                 ...        0 min,  0.001 sec (  0.106%)
 coordinate transformation      ...        0 min,  0.000 sec (  0.046%)
 single point calculation       ...        0 min,  0.957 sec ( 96.422%)
 optimization log               ...        0 min,  0.003 sec (  0.253%)
 hessian update                 ...        0 min,  0.000 sec (  0.030%)
 rational function              ...        0 min,  0.004 sec (  0.436%)

================
 final structure:
================
$coord
   -6.50200770057280    0.44720154540609   -0.02597002877749      C 
   -4.78532202409725   -1.53737148777181   -0.07404821016048      C 
   -2.23837449211432   -0.99654141264550   -0.04130227822105      C 
   -1.40303687688264    1.51828849216449    0.03987528603860      C 
   -3.12052852710364    3.49349883295515    0.08674604890647      C 
   -5.67736923536254    2.93232496135064    0.05271454554551      C 
    1.34139349868814    1.52165115608761    0.06170621676497      C 
    2.18897907541751   -0.98910524345330   -0.00677628080791      C 
   -0.02147279217197   -2.80003341067702   -0.08616274740612      C 
   -0.00044686788741   -4.36014561909753   -2.52483816722971      C 
   -0.03689250673110   -4.53827382765804    2.22789657004656      C 
    4.73068193978301   -1.52232372861466   -0.00293789115850      C 
    6.49329821184439    0.45073114964676    0.08071624085127      C 
    5.61741345238887    2.94170982045716    0.13801498867246      C 
    3.06529460690159    3.49254881444513    0.12887140146736      C 
    9.17168549018028   -0.18517350533430    0.09757807547005      C 
   11.09591361176961    1.39268101952116    0.43116172889993      C 
   -8.50439721814818    0.04953541078978   -0.05060298903717      H 
   -5.45079777678889   -3.46688418842013   -0.13590048245456      H 
   -2.48194185643429    5.43096178423977    0.14888832212757      H 
   -7.04636993969832    4.44686907817398    0.08817373666832      H 
    0.00448755425722   -3.11672181084022   -4.16244337624716      H 
   -1.66481762781082   -5.56230006433426   -2.61818394959363      H 
    1.67476414887838   -5.54846077521967   -2.59802201256611      H 
   -0.04932497050187   -3.42209060077889    3.95476356781518      H 
    1.63333986974374   -5.73585930839535    2.23265216932935      H 
   -1.70584978571372   -5.73757672254657    2.20925710958711      H 
    5.39105535559683   -3.45552571541041   -0.05466329882777      H 
    6.96063290776964    4.47549778245532    0.17600765300691      H 
    2.42849473754088    5.43146765386978    0.16994285386524      H 
    9.56998203307711   -2.17553174363867   -0.17443042053867      H 
   10.84820260267231    3.38865710986257    0.73833253325390      H 
   13.01933067828659    0.73001004299924    0.41836298482094      H 
$end
           -------------------------------------------------
          |                Final Singlepoint                |
           -------------------------------------------------

          ...................................................
          :                      SETUP                      :
          :.................................................:
          :  # basis functions                  84          :
          :  # atomic orbitals                  84          :
          :  # shells                           50          :
          :  # electrons                        84          :
          :  max. iterations                   250          :
          :  Hamiltonian                  GFN2-xTB          :
          :  restarted?                      false          :
          :  GBSA solvation                  false          :
          :  PC potential                    false          :
          :  electronic temp.          300.0000000     K    :
          :  accuracy                    1.0000000          :
          :  -> integral cutoff          0.2500000E+02      :
          :  -> integral neglect         0.1000000E-07      :
          :  -> SCF convergence          0.1000000E-05 Eh   :
          :  -> wf. convergence          0.1000000E-03 e    :
          :  Broyden damping             0.4000000          :
          ...................................................

 iter      E             dE          RMSdq      gap      omega  full diag
   1    -45.3895017 -0.453895E+02  0.471E-05    2.98       0.0  T
   2    -45.3895017 -0.783729E-11  0.266E-05    2.98     655.0  T
   3    -45.3895017 -0.187015E-10  0.173E-05    2.98    1008.2  T

   *** convergence criteria satisfied after 3 iterations ***

         #    Occupation            Energy/Eh            Energy/eV
      -------------------------------------------------------------
         1        2.0000           -0.6527381             -17.7619
       ...           ...                  ...                  ...
        36        2.0000           -0.4189325             -11.3997
        37        2.0000           -0.4109026             -11.1812
        38        2.0000           -0.4082850             -11.1100
        39        2.0000           -0.4035639             -10.9815
        40        2.0000           -0.3988483             -10.8532
        41        2.0000           -0.3937872             -10.7155
        42        2.0000           -0.3680420             -10.0149 (HOMO)
        43                         -0.2586641              -7.0386 (LUMO)
        44                         -0.2194688              -5.9721
        45                         -0.2163406              -5.8869
        46                         -0.2111787              -5.7465
        47                         -0.1572292              -4.2784
       ...                                ...                  ...
        84                          0.7399059              20.1339
      -------------------------------------------------------------
                  HL-Gap            0.1093779 Eh            2.9763 eV
             Fermi-level           -0.3133531 Eh           -8.5268 eV

 SCC (total)                   0 d,  0 h,  0 min,  0.039 sec
 SCC setup                      ...        0 min,  0.000 sec (  0.671%)
 Dispersion                     ...        0 min,  0.000 sec (  0.865%)
 integral evaluation            ...        0 min,  0.012 sec ( 31.715%)
 zeroth order Hamiltonian       ...        0 min,  0.000 sec (  0.554%)
 iterations                     ...        0 min,  0.005 sec ( 13.353%)
 molecular gradient             ...        0 min,  0.020 sec ( 51.734%)
 printout                       ...        0 min,  0.000 sec (  0.990%)

         :::::::::::::::::::::::::::::::::::::::::::::::::::::
         ::                     SUMMARY                     ::
         :::::::::::::::::::::::::::::::::::::::::::::::::::::
         :: total energy             -44.547641888011 Eh    ::
         :: gradient norm              0.000716221660 Eh/a0 ::
         :: HOMO-LUMO gap              2.976324667611 eV    ::
         ::.................................................::
         :: SCC energy               -45.389501736107 Eh    ::
         :: -> isotropic ES            0.003572971411 Eh    ::
         :: -> anisotropic ES          0.008186401731 Eh    ::
         :: -> anisotropic XC          0.028040875629 Eh    ::
         :: -> dispersion             -0.036213411169 Eh    ::
         :: repulsion energy           0.841701612416 Eh    ::
         :: add. restraining           0.000000000000 Eh    ::
         :::::::::::::::::::::::::::::::::::::::::::::::::::::

           -------------------------------------------------
          |                Property Printout                |
           -------------------------------------------------

    * Orbital Energies and Occupations

         #    Occupation            Energy/Eh            Energy/eV
      -------------------------------------------------------------
         1        2.0000           -0.6527381             -17.7619
       ...           ...                  ...                  ...
        30        2.0000           -0.4559513             -12.4071
        31        2.0000           -0.4520867             -12.3019
        32        2.0000           -0.4463546             -12.1459
        33        2.0000           -0.4360792             -11.8663
        34        2.0000           -0.4343708             -11.8198
        35        2.0000           -0.4201275             -11.4323
        36        2.0000           -0.4189325             -11.3997
        37        2.0000           -0.4109026             -11.1812
        38        2.0000           -0.4082850             -11.1100
        39        2.0000           -0.4035639             -10.9815
        40        2.0000           -0.3988483             -10.8532
        41        2.0000           -0.3937872             -10.7155
        42        2.0000           -0.3680420             -10.0149 (HOMO)
        43                         -0.2586641              -7.0386 (LUMO)
        44                         -0.2194688              -5.9721
        45                         -0.2163406              -5.8869
        46                         -0.2111787              -5.7465
        47                         -0.1572292              -4.2784
        48                         -0.0944275              -2.5695
        49                         -0.0511322              -1.3914
        50                          0.0734161               1.9978
        51                          0.0799358               2.1752
        52                          0.0944487               2.5701
        53                          0.1071106               2.9146
       ...                                ...                  ...
        84                          0.7399059              20.1339
      -------------------------------------------------------------
                  HL-Gap            0.1093779 Eh            2.9763 eV
             Fermi-level           -0.3133531 Eh           -8.5268 eV

     #   Z        covCN         q      C6AA      α(0)
     1   6 C      2.922    -0.033    28.829     8.805
     2   6 C      2.915    -0.034    28.842     8.807
     3   6 C      3.056    -0.002    28.014     8.680
     4   6 C      3.037    -0.000    27.993     8.678
     5   6 C      2.914    -0.034    28.854     8.808
     6   6 C      2.921    -0.033    28.829     8.805
     7   6 C      3.038    -0.002    28.030     8.684
     8   6 C      3.051    -0.003    28.044     8.685
     9   6 C      3.936     0.018    20.201     6.387
    10   6 C      3.759    -0.098    22.413     6.750
    11   6 C      3.758    -0.098    22.415     6.750
    12   6 C      2.923    -0.039    28.975     8.827
    13   6 C      2.972     0.010    27.782     8.646
    14   6 C      2.925    -0.037    28.915     8.818
    15   6 C      2.912    -0.035    28.882     8.812
    16   6 C      2.896    -0.030    28.743     8.790
    17   6 C      2.837    -0.087    30.174     9.002
    18   1 H      0.926     0.028     2.617     2.530
    19   1 H      0.926     0.026     2.640     2.541
    20   1 H      0.926     0.029     2.601     2.522
    21   1 H      0.926     0.028     2.618     2.530
    22   1 H      0.925     0.036     2.509     2.477
    23   1 H      0.925     0.040     2.451     2.448
    24   1 H      0.925     0.040     2.450     2.448
    25   1 H      0.925     0.036     2.509     2.477
    26   1 H      0.925     0.040     2.450     2.448
    27   1 H      0.925     0.040     2.451     2.448
    28   1 H      0.925     0.027     2.628     2.535
    29   1 H      0.926     0.034     2.535     2.490
    30   1 H      0.926     0.029     2.596     2.520
    31   1 H      0.925     0.032     2.561     2.503
    32   1 H      0.926     0.038     2.480     2.463
    33   1 H      0.926     0.035     2.521     2.483

 Mol. C6AA /au·bohr⁶  :      13059.165859
 Mol. C8AA /au·bohr⁸  :     320530.067671
 Mol. α(0) /au        :        182.596482


Wiberg/Mayer (AO) data.
largest (>0.10) Wiberg bond orders for each atom
          total WBO             WBO to atom ...
     1  C   3.968        C    6 1.439    C    2 1.421    H   18 0.972
     2  C   3.992        C    3 1.448    C    1 1.421    H   19 0.968    C    5 0.103
     3  C   3.982        C    2 1.448    C    4 1.328    C    9 0.987    C    6 0.103
     4  C   3.988        C    5 1.393    C    3 1.328    C    7 1.085
     5  C   3.977        C    6 1.442    C    4 1.393    H   20 0.969    C    2 0.103
     6  C   3.991        C    5 1.442    C    1 1.439    H   21 0.971    C    3 0.103
     7  C   3.989        C   15 1.382    C    8 1.321    C    4 1.085
     8  C   3.986        C   12 1.466    C    7 1.321    C    9 0.986
     9  C   3.991        C    3 0.987    C    8 0.986    C   11 0.976    C   10 0.976
    10  C   3.995        H   22 0.987    H   23 0.984    H   24 0.984    C    9 0.976
    11  C   3.995        H   25 0.987    H   27 0.984    H   26 0.984    C    9 0.976
    12  C   3.991        C    8 1.466    C   13 1.356    H   28 0.965
    13  C   3.970        C   14 1.370    C   12 1.356    C   16 1.097
    14  C   3.991        C   15 1.465    C   13 1.370    H   29 0.966
    15  C   3.981        C   14 1.465    C    7 1.382    H   30 0.968
    16  C   3.990        C   17 1.894    C   13 1.097    H   31 0.965
    17  C   3.979        C   16 1.894    H   33 0.979    H   32 0.973
    18  H   0.999        C    1 0.972
    19  H   0.999        C    2 0.968
    20  H   0.999        C    5 0.969
    21  H   0.998        C    6 0.971
    22  H   0.999        C   10 0.987
    23  H   0.998        C   10 0.984
    24  H   0.998        C   10 0.984
    25  H   0.999        C   11 0.987
    26  H   0.998        C   11 0.984
    27  H   0.998        C   11 0.984
    28  H   0.999        C   12 0.965
    29  H   0.998        C   14 0.966
    30  H   0.998        C   15 0.968
    31  H   0.999        C   16 0.965
    32  H   0.999        C   17 0.973
    33  H   0.998        C   17 0.979

molecular dipole:
                 x           y           z       tot (Debye)
 q only:       -0.037      -0.286      -0.014
   full:       -0.044      -0.277      -0.012       0.714
molecular quadrupole (traceless):
                xx          xy          yy          xz          yz          zz
 q only:       -0.927       0.021       3.077       0.005       0.237      -2.149
  q+dip:        3.367       0.130       7.690       0.243       0.927     -11.057
   full:        0.365      -0.022       4.638       0.094       0.477      -5.004

           -------------------------------------------------
          |                Geometry Summary                 |
           -------------------------------------------------

      molecular mass/u    :      220.3134000
   center of mass at/Å    :        0.6342798       0.0018572       0.0176547
  moments of inertia/u·Å² :        0.4791540E+03   0.1604621E+04   0.1975322E+04
rotational constants/cm⁻¹ :        0.3518208E-01   0.1050568E-01   0.8534119E-02

 * 31 selected distances

     #   Z        #   Z                                     value/Å
     1   6 C      2   6 C                                 1.3888107
     2   6 C      3   6 C                                 1.3779466
     3   6 C      4   6 C                                 1.4029434
     4   6 C      5   6 C                                 1.3853362
     1   6 C      6   6 C                                 1.3862079
     5   6 C      6   6 C                                 1.3853441
     7   6 C      8   6 C                                 1.4027679
     9   6 C     10   6 C                                 1.5320143 (max)
     9   6 C     11   6 C                                 1.5315626
     8   6 C     12   6 C                                 1.3742918
    12   6 C     13   6 C                                 1.4007473
    13   6 C     14   6 C                                 1.3976123
     7   6 C     15   6 C                                 1.3860792
    14   6 C     15   6 C                                 1.3816308
    16   6 C     17   6 C                                 1.3285993
     1   6 C     18   1 H                                 1.0803914
     2   6 C     19   1 H                                 1.0805721
     5   6 C     20   1 H                                 1.0800166
     6   6 C     21   1 H                                 1.0805152
    10   6 C     22   1 H                                 1.0880839
    10   6 C     23   1 H                                 1.0875872
    10   6 C     24   1 H                                 1.0875566
    11   6 C     25   1 H                                 1.0881111
    11   6 C     26   1 H                                 1.0875732
    11   6 C     27   1 H                                 1.0875968
    12   6 C     28   1 H                                 1.0813927
    14   6 C     29   1 H                                 1.0790789
    15   6 C     30   1 H                                 1.0801709
    16   6 C     31   1 H                                 1.0837357
    17   6 C     32   1 H                                 1.0766690
    17   6 C     33   1 H                                 1.0765643 (min)

 * 2 distinct bonds (by element types)

   Z      Z             #   av. dist./Å        max./Å        min./Å
   1 H    6 C          16     1.0828510     1.0881111     1.0765643
   6 C    6 C          15     1.4041263     1.5320143     1.3285993


optimized geometry written to: xtbopt.xyz


           -------------------------------------------------
          | TOTAL ENERGY              -44.547641888011 Eh   |
          | GRADIENT NORM               0.000716221660 Eh/α |
          | HOMO-LUMO GAP               2.976324667611 eV   |
           -------------------------------------------------

------------------------------------------------------------------------
 * finished run on 2021/05/19 at 10:59:56.076     
------------------------------------------------------------------------
 total:
 * wall-time:     0 d,  0 h,  0 min,  1.109 sec
 *  cpu-time:     0 d,  0 h,  0 min,  0.967 sec
 * ratio c/w:     0.872 speedup
 SCF:
 * wall-time:     0 d,  0 h,  0 min,  0.053 sec
 *  cpu-time:     0 d,  0 h,  0 min,  0.053 sec
 * ratio c/w:     1.000 speedup
 ANC optimizer:
 * wall-time:     0 d,  0 h,  0 min,  1.032 sec
 *  cpu-time:     0 d,  0 h,  0 min,  0.890 sec
 * ratio c/w:     0.862 speedup

