      -----------------------------------------------------------      
     |                   =====================                   |     
     |                           x T B                           |     
     |                   =====================                   |     
     |                         S. Grimme                         |     
     |          Mulliken Center for Theoretical Chemistry        |     
     |                    University of Bonn                     |     
     |                Version 6.2 RC2 (SAW190805)                |     
      -----------------------------------------------------------      

   This program is distributed in the hope that it will be useful,
   but WITHOUT ANY WARRANTY; without even the implied warranty of
   MERCHANTABILITY or FITNESS FOR A PARTICULAR PURPOSE.
   
   FOR NON-COMMERCIAL, ACADEMIA USE ONLY.
   
   Cite this work as:
   * S. Grimme, C. Bannwarth, P. Shushkov, J. Chem. Theory Comput., 2017,
     13, 1989-2009. DOI: 10.1021/acs.jctc.7b00118
   * C. Bannwarth, S. Ehlert and S. Grimme., J. Chem. Theory Comput., 2019,
     15, 1652-1671. DOI: 10.1021/acs.jctc.8b01176
   * P. Pracht, E. Caldeweyher, S. Ehlert, S. Grimme, ChemRxiv, 2019, preprint.
     DOI: 10.26434/chemrxiv.8326202.v1
   
   for DFT-D4:
   * E. Caldeweyher, C. Bannwarth and S. Grimme, J. Chem. Phys., 2017,
     147, 034112. DOI: 10.1063/1.4993215
   * E. Caldeweyher, S. Ehlert, A. Hansen, H. Neugebauer, S. Spicher,
     C. Bannwarth and S. Grimme, J. Chem. Phys., 2019, 150, 154122.
     DOI: 10.1063/1.5090222
   
   for sTDA-xTB:
   * S. Grimme and C. Bannwarth, J. Chem. Phys., 2016, 145, 054103.
     DOI: 10.1063/1.4959605
   
   in the mass-spec context:
   * V. Asgeirsson, C. Bauer and S. Grimme, Chem. Sci., 2017, 8, 4879.
     DOI: 10.1039/c7sc00601b
   
   for metadynamics refer to:
   * S. Grimme, J. Chem. Theory Comput., 2019, 155, 2847-2862
     DOI: 10.1021/acs.jctc.9b00143
   
   with help from (in alphabetical order)
   C. Bannwarth, F. Bohle, G. Brandenburg, E. Caldeweyher, M. Checinski,
   S. Dohm, S. Ehlert, S. Ehrlich, F. März, H. Neugebauer, J. Pisarek,
   P. Pracht, P. Shushkov, and S. Spicher.
   
 * started run on 2021/05/19 at 10:58:25.020     

           -------------------------------------------------
          |                Calculation Setup                |
           -------------------------------------------------

          program call               : /ihome/ghutchison/geoffh/xtb/xtb 39.xyz -opt
          hostname                   : smp-n58
          coordinate file            : 39.xyz
          omp threads                :                     1
          number of atoms            :                    20
          number of electrons        :                    60
          charge                     :                     0
          spin                       :                   0.0
          first test random number   :      0.75975523170977


########################################################################
# WARNING! Please study the warnings concerning your input carefully
#  - the use of '-opt' is discouraged, please use '--opt' next time
########################################################################

           ------------------------------------------------- 
          |                 G F N 2 - x T B                 |
          | Geometry, Frequencies, Noncovalent interactions |
          |            JCTC 2019 parametrisation            |
           ------------------------------------------------- 
             KAB for C  - Si     :                1.0500
             KAB for H  - Pd     :                0.9500
             k(s)              :                1.8500
             k(p)              :                2.2300
             k(d)              :                2.2300
             k(f)              :                2.0000
             kEN (H0ij)        :               -2.0000
             D4 a1             :                0.5200
             D4 a2             :                5.0000
             D4 s6             :                1.0000
             D4 s8             :                2.7000
             D4 s9             :                5.0000
             alphaj            :                2.0000

  Z AO/shell   Hii/eV     exponent
  1     Wed Apr 25 08:07:45 CEST 2018   EN: 2.200 GM2: 0.406  GM3: 0.0800  RAES: 1.40
     1s    -10.707211    1.230000
  6     Wed Apr 25 08:07:45 CEST 2018   EN: 2.550 GM2: 0.538  GM3: 0.1500  RAES: 3.00
     2s    -13.970922    2.096432
     2p    -10.063292    1.800000
  8     Wed Apr 25 08:07:45 CEST 2018   EN: 3.440 GM2: 0.452  GM3:-0.0517  RAES: 1.80
     2s    -20.229985    2.439742
     2p    -15.503117    2.137023
 16     Tue Apr 24 11:44:34 CEST 2018   EN: 2.580 GM2: 0.340  GM3:-0.0502  RAES: 3.10
     3s    -20.029654    1.981333
     3p    -11.377694    2.025643
     3d     -0.420282    1.702555

           ------------------------------------------------- 
          |        Self-Consistent Charge Iterations        |
           ------------------------------------------------- 

          ...................................................
          :                      SETUP                      :
          :.................................................:
          :  # basis functions                  62          :
          :  # atomic orbitals                  61          :
          :  # shells                           33          :
          :  # electrons                        60          :
          :  max. iterations                   250          :
          :  Hamiltonian                  GFN2-xTB          :
          :  restarted?                      false          :
          :  GBSA solvation                  false          :
          :  PC potential                    false          :
          :  electronic temp.          300.0000000     K    :
          :  accuracy                    1.0000000          :
          :  -> integral cutoff          0.2500000E+02      :
          :  -> integral neglect         0.1000000E-07      :
          :  -> SCF convergence          0.1000000E-05 Eh   :
          :  -> wf. convergence          0.1000000E-03 e    :
          :  Broyden damping             0.4000000          :
          ...................................................

 iter      E             dE          RMSdq      gap      omega  full diag
   1    -33.1892853 -0.331893E+02  0.474E+00    2.07       0.0  T
   2    -33.2202277 -0.309423E-01  0.268E+00    2.05       1.0  T
   3    -33.2093422  0.108855E-01  0.162E+00    2.11       1.0  T
   4    -33.2239496 -0.146075E-01  0.622E-01    2.04       1.0  T
   5    -33.2308404 -0.689075E-02  0.203E-01    2.06       1.0  T
   6    -33.2312025 -0.362125E-03  0.110E-01    2.05       1.0  T
   7    -33.2313619 -0.159408E-03  0.340E-02    2.05       1.0  T
   8    -33.2313702 -0.831525E-05  0.144E-02    2.05       1.5  T
   9    -33.2313711 -0.903995E-06  0.636E-03    2.05       3.5  T
  10    -33.2313714 -0.281632E-06  0.226E-03    2.05       9.9  T
  11    -33.2313714 -0.188382E-07  0.127E-03    2.05      17.7  T
  12    -33.2313714 -0.183998E-07  0.474E-04    2.05      47.2  T
  13    -33.2313714 -0.837481E-09  0.160E-04    2.05     139.5  T

   *** convergence criteria satisfied after 13 iterations ***

         #    Occupation            Energy/Eh            Energy/eV
      -------------------------------------------------------------
         1        2.0000           -0.7438531             -20.2413
       ...           ...                  ...                  ...
        24        2.0000           -0.4535660             -12.3422
        25        2.0000           -0.4512148             -12.2782
        26        2.0000           -0.4395226             -11.9600
        27        2.0000           -0.4385633             -11.9339
        28        2.0000           -0.4067695             -11.0688
        29        2.0000           -0.3903039             -10.6207
        30        2.0000           -0.3733853             -10.1603 (HOMO)
        31                         -0.2980459              -8.1102 (LUMO)
        32                         -0.2616416              -7.1196
        33                         -0.2129983              -5.7960
        34                         -0.2067136              -5.6250
        35                         -0.1872055              -5.0941
       ...                                ...                  ...
        61                          0.7371140              20.0579
      -------------------------------------------------------------
                  HL-Gap            0.0753394 Eh            2.0501 eV
             Fermi-level           -0.3357156 Eh           -9.1353 eV

 SCC (total)                   0 d,  0 h,  0 min,  0.030 sec
 SCC setup                      ...        0 min,  0.000 sec (  0.809%)
 Dispersion                     ...        0 min,  0.000 sec (  0.807%)
 integral evaluation            ...        0 min,  0.007 sec ( 23.256%)
 zeroth order Hamiltonian       ...        0 min,  0.000 sec (  0.456%)
 iterations                     ...        0 min,  0.013 sec ( 42.231%)
 molecular gradient             ...        0 min,  0.010 sec ( 31.355%)
 printout                       ...        0 min,  0.000 sec (  0.928%)

         :::::::::::::::::::::::::::::::::::::::::::::::::::::
         ::                     SUMMARY                     ::
         :::::::::::::::::::::::::::::::::::::::::::::::::::::
         :: total energy             -32.755517191279 Eh    ::
         :: gradient norm              0.111394940452 Eh/a0 ::
         :: HOMO-LUMO gap              2.050089793408 eV    ::
         ::.................................................::
         :: SCC energy               -33.231371432052 Eh    ::
         :: -> isotropic ES            0.028876216894 Eh    ::
         :: -> anisotropic ES          0.001592822936 Eh    ::
         :: -> anisotropic XC          0.015312993238 Eh    ::
         :: -> dispersion             -0.020285725269 Eh    ::
         :: repulsion energy           0.475833432852 Eh    ::
         :: add. restraining           0.000000000000 Eh    ::
         :::::::::::::::::::::::::::::::::::::::::::::::::::::

      ----------------------------------------------------------- 
     |                   =====================                   |
     |                        A N C O P T                        |
     |                   =====================                   |
     |               Approximate Normal Coordinate               |
     |                Rational Function Optimizer                |
      ----------------------------------------------------------- 

          ...................................................
          :                      SETUP                      :
          :.................................................:
          :   optimization level            normal          :
          :   max. optcycles                   200          :
          :   ANC micro-cycles                  20          :
          :   degrees of freedom                54          :
          :.................................................:
          :   RF solver                   davidson          :
          :   input Hessian                  false          :
          :   write xtbopt.log                true          :
          :   linear?                        false          :
          :   energy convergence         0.5000000E-05 Eh   :
          :   grad. convergence          0.1000000E-02 Eh/α :
          :   maximium RF displ.         2.0000000          :
          :   Hlow (freq-cutoff)         0.5000000E-02      :
          :   Hmax (freq-cutoff)         5.0000000          :
          :   S6 in model hess.         20.0000000          :
          ...................................................

generating ANC from model Hessian ...
Using Lindh-Hessian (1995)
 Shifting diagonal of input Hessian by   3.270786862580422E-003
 Lowest  eigenvalues of input Hessian
   -0.000000   -0.000000    0.000000    0.000000    0.000000    0.000000
    0.005000    0.006454    0.008660    0.010895    0.013296    0.018345
    0.021644    0.024779    0.026929    0.044784    0.044926    0.050992
 Highest eigenvalues
    1.622332    1.705953    1.845486    1.967558    2.034135    2.075163
 

........................................................................
.............................. CYCLE    1 ..............................
........................................................................
   1    -33.2313714 -0.332314E+02  0.666E-05    2.05       0.0  T
   2    -33.2313714 -0.139906E-10  0.391E-05    2.05     571.3  T
   3    -33.2313714 -0.611067E-11  0.252E-05    2.05     887.4  T
     SCC iter.                  ...        0 min,  0.003 sec
     gradient                   ...        0 min,  0.009 sec
 * total energy  :   -32.7555172 Eh     change       -0.5372343E-08 Eh
   gradient norm :     0.1113951 Eh/α   predicted     0.0000000E+00 (-100.00%)
   displ. norm   :     0.3079844 α      lambda       -0.1859205E-01
   maximum displ.:     0.1566855 α      in ANC's #15, #23, #24, ...

........................................................................
.............................. CYCLE    2 ..............................
........................................................................
   1    -33.2655797 -0.332656E+02  0.267E-01    2.16       0.0  T
   2    -33.2657351 -0.155355E-03  0.165E-01    2.14       1.0  T
   3    -33.2657177  0.173633E-04  0.916E-02    2.15       1.0  T
   4    -33.2658013 -0.836459E-04  0.289E-02    2.14       1.0  T
   5    -33.2658108 -0.947375E-05  0.108E-02    2.14       2.1  T
   6    -33.2658121 -0.133388E-05  0.582E-03    2.14       3.8  T
   7    -33.2658125 -0.382112E-06  0.265E-03    2.14       8.4  T
     SCC iter.                  ...        0 min,  0.006 sec
     gradient                   ...        0 min,  0.009 sec
 * total energy  :   -32.7683553 Eh     change       -0.1283815E-01 Eh
   gradient norm :     0.0525856 Eh/α   predicted    -0.1017780E-01 ( -20.72%)
   displ. norm   :     0.1867331 α      lambda       -0.4845738E-02
   maximum displ.:     0.0876710 α      in ANC's #23, #15, #13, ...

........................................................................
.............................. CYCLE    3 ..............................
........................................................................
   1    -33.2802166 -0.332802E+02  0.200E-01    2.25       0.0  T
   2    -33.2802811 -0.644792E-04  0.119E-01    2.24       1.0  T
   3    -33.2802686  0.125334E-04  0.638E-02    2.24       1.0  T
   4    -33.2803132 -0.445873E-04  0.144E-02    2.24       1.6  T
   5    -33.2803143 -0.112115E-05  0.605E-03    2.24       3.7  T
   6    -33.2803145 -0.232329E-06  0.261E-03    2.24       8.6  T
   7    -33.2803146 -0.890744E-07  0.737E-04    2.24      30.3  T
     SCC iter.                  ...        0 min,  0.006 sec
     gradient                   ...        0 min,  0.010 sec
 * total energy  :   -32.7709160 Eh     change       -0.2560696E-02 Eh
   gradient norm :     0.0115753 Eh/α   predicted    -0.2507380E-02 (  -2.08%)
   displ. norm   :     0.0874646 α      lambda       -0.2498496E-03
   maximum displ.:     0.0675350 α      in ANC's #3, #1, #5, ...

........................................................................
.............................. CYCLE    4 ..............................
........................................................................
   1    -33.2781826 -0.332782E+02  0.522E-02    2.24       0.0  T
   2    -33.2781835 -0.963616E-06  0.310E-02    2.25       1.0  T
   3    -33.2781793  0.422464E-05  0.187E-02    2.24       1.2  T
   4    -33.2781844 -0.505760E-05  0.435E-03    2.24       5.1  T
   5    -33.2781847 -0.301488E-06  0.192E-03    2.25      11.6  T
   6    -33.2781847 -0.357600E-07  0.651E-04    2.24      34.4  T
     SCC iter.                  ...        0 min,  0.006 sec
     gradient                   ...        0 min,  0.010 sec
 * total energy  :   -32.7710952 Eh     change       -0.1791179E-03 Eh
   gradient norm :     0.0045894 Eh/α   predicted    -0.1258846E-03 ( -29.72%)
   displ. norm   :     0.1245145 α      lambda       -0.1582780E-03
   maximum displ.:     0.0920382 α      in ANC's #3, #5, #1, ...

........................................................................
.............................. CYCLE    5 ..............................
........................................................................
   1    -33.2768247 -0.332768E+02  0.722E-02    2.25       0.0  T
   2    -33.2768254 -0.758804E-06  0.419E-02    2.25       1.0  T
   3    -33.2768201  0.532750E-05  0.188E-02    2.25       1.2  T
   4    -33.2768260 -0.587251E-05  0.455E-03    2.25       4.9  T
   5    -33.2768261 -0.166822E-06  0.285E-03    2.25       7.8  T
   6    -33.2768262 -0.100923E-06  0.680E-04    2.25      32.9  T
     SCC iter.                  ...        0 min,  0.006 sec
     gradient                   ...        0 min,  0.010 sec
 * total energy  :   -32.7712100 Eh     change       -0.1148764E-03 Eh
   gradient norm :     0.0039389 Eh/α   predicted    -0.8036915E-04 ( -30.04%)
   displ. norm   :     0.1683281 α      lambda       -0.1404290E-03
   maximum displ.:     0.1126657 α      in ANC's #3, #5, #1, ...

........................................................................
.............................. CYCLE    6 ..............................
........................................................................
   1    -33.2758059 -0.332758E+02  0.934E-02    2.25       0.0  T
   2    -33.2758066 -0.677923E-06  0.552E-02    2.25       1.0  T
   3    -33.2758021  0.452012E-05  0.166E-02    2.25       1.3  T
   4    -33.2758070 -0.491323E-05  0.382E-03    2.25       5.8  T
   5    -33.2758071 -0.154308E-06  0.218E-03    2.25      10.2  T
   6    -33.2758072 -0.469439E-07  0.864E-04    2.25      25.9  T
   7    -33.2758072 -0.417008E-08  0.390E-04    2.25      57.3  T
     SCC iter.                  ...        0 min,  0.007 sec
     gradient                   ...        0 min,  0.010 sec
 * total energy  :   -32.7713232 Eh     change       -0.1131974E-03 Eh
   gradient norm :     0.0082089 Eh/α   predicted    -0.7220462E-04 ( -36.21%)
   displ. norm   :     0.3283009 α      lambda       -0.2685382E-03
   maximum displ.:     0.2110427 α      in ANC's #3, #5, #1, ...

........................................................................
.............................. CYCLE    7 ..............................
........................................................................
   1    -33.2735553 -0.332736E+02  0.187E-01    2.25       0.0  T
   2    -33.2735591 -0.385584E-05  0.110E-01    2.25       1.0  T
   3    -33.2735516  0.755691E-05  0.238E-02    2.25       1.0  T
   4    -33.2735602 -0.861671E-05  0.907E-03    2.25       2.5  T
   5    -33.2735610 -0.777555E-06  0.480E-03    2.25       4.7  T
   6    -33.2735612 -0.198527E-06  0.221E-03    2.25      10.1  T
   7    -33.2735612 -0.476314E-07  0.896E-04    2.25      24.9  T
     SCC iter.                  ...        0 min,  0.006 sec
     gradient                   ...        0 min,  0.009 sec
 * total energy  :   -32.7714703 Eh     change       -0.1470338E-03 Eh
   gradient norm :     0.0152102 Eh/α   predicted    -0.1487468E-03 (   1.17%)
   displ. norm   :     0.0994460 α      lambda       -0.2635253E-03
   maximum displ.:     0.0430457 α      in ANC's #3, #1, #6, ...

........................................................................
.............................. CYCLE    8 ..............................
........................................................................
   1    -33.2757263 -0.332757E+02  0.706E-02    2.24       0.0  T
   2    -33.2757276 -0.133229E-05  0.421E-02    2.24       1.0  T
   3    -33.2757269  0.736647E-06  0.977E-03    2.24       2.3  T
   4    -33.2757280 -0.112383E-05  0.468E-03    2.24       4.8  T
   5    -33.2757282 -0.166925E-06  0.273E-03    2.25       8.2  T
   6    -33.2757283 -0.772907E-07  0.107E-03    2.24      21.0  T
     SCC iter.                  ...        0 min,  0.005 sec
     gradient                   ...        0 min,  0.010 sec
 * total energy  :   -32.7716812 Eh     change       -0.2109321E-03 Eh
   gradient norm :     0.0113056 Eh/α   predicted    -0.1330671E-03 ( -36.91%)
   displ. norm   :     0.3891548 α      lambda       -0.5179218E-03
   maximum displ.:     0.1944089 α      in ANC's #3, #5, #1, ...

........................................................................
.............................. CYCLE    9 ..............................
........................................................................
   1    -33.2764979 -0.332765E+02  0.229E-01    2.23       0.0  T
   2    -33.2765033 -0.535581E-05  0.136E-01    2.23       1.0  T
   3    -33.2765022  0.107419E-05  0.187E-02    2.23       1.2  T
   4    -33.2765062 -0.400890E-05  0.812E-03    2.23       2.8  T
   5    -33.2765061  0.141216E-06  0.538E-03    2.23       4.2  T
   6    -33.2765065 -0.430308E-06  0.188E-03    2.23      11.9  T
   7    -33.2765065 -0.118829E-07  0.104E-03    2.23      21.5  T
     SCC iter.                  ...        0 min,  0.006 sec
     gradient                   ...        0 min,  0.009 sec
 * total energy  :   -32.7720233 Eh     change       -0.3421356E-03 Eh
   gradient norm :     0.0091465 Eh/α   predicted    -0.2981877E-03 ( -12.85%)
   displ. norm   :     0.1765344 α      lambda       -0.3749667E-03
   maximum displ.:     0.0961718 α      in ANC's #1, #5, #6, ...

........................................................................
.............................. CYCLE   10 ..............................
........................................................................
   1    -33.2808382 -0.332808E+02  0.120E-01    2.22       0.0  T
   2    -33.2808431 -0.489650E-05  0.703E-02    2.22       1.0  T
   3    -33.2808412  0.183281E-05  0.168E-02    2.22       1.3  T
   4    -33.2808433 -0.208071E-05  0.875E-03    2.22       2.6  T
   5    -33.2808443 -0.100087E-05  0.399E-03    2.22       5.6  T
   6    -33.2808444 -0.919577E-07  0.221E-03    2.22      10.1  T
   7    -33.2808445 -0.507993E-07  0.719E-04    2.22      31.1  T
     SCC iter.                  ...        0 min,  0.006 sec
     gradient                   ...        0 min,  0.010 sec
 * total energy  :   -32.7721910 Eh     change       -0.1676968E-03 Eh
   gradient norm :     0.0068824 Eh/α   predicted    -0.1933355E-03 (  15.29%)
   displ. norm   :     0.4493061 α      lambda       -0.3541878E-03
   maximum displ.:     0.2228026 α      in ANC's #1, #5, #3, ...

........................................................................
.............................. CYCLE   11 ..............................
........................................................................
   1    -33.2735830 -0.332736E+02  0.278E-01    2.20       0.0  T
   2    -33.2736034 -0.203643E-04  0.165E-01    2.21       1.0  T
   3    -33.2735917  0.116395E-04  0.362E-02    2.21       1.0  T
   4    -33.2736063 -0.145436E-04  0.185E-02    2.21       1.2  T
   5    -33.2736102 -0.397807E-05  0.920E-03    2.21       2.4  T
   6    -33.2736108 -0.582124E-06  0.459E-03    2.21       4.9  T
   7    -33.2736110 -0.199641E-06  0.178E-03    2.21      12.5  T
   8    -33.2736110 -0.160249E-07  0.892E-04    2.21      25.1  T
     SCC iter.                  ...        0 min,  0.007 sec
     gradient                   ...        0 min,  0.010 sec
 * total energy  :   -32.7720935 Eh     change        0.9752102E-04 Eh
   gradient norm :     0.0185980 Eh/α   predicted    -0.2128460E-03 (-318.26%)
   displ. norm   :     0.2175612 α      lambda       -0.6564856E-03
   maximum displ.:     0.1067390 α      in ANC's #3, #5, #1, ...

........................................................................
.............................. CYCLE   12 ..............................
........................................................................
   1    -33.2790820 -0.332791E+02  0.142E-01    2.22       0.0  T
   2    -33.2790929 -0.109076E-04  0.845E-02    2.22       1.0  T
   3    -33.2790887  0.422941E-05  0.226E-02    2.22       1.0  T
   4    -33.2790928 -0.411140E-05  0.124E-02    2.22       1.8  T
   5    -33.2790952 -0.238947E-05  0.455E-03    2.22       4.9  T
   6    -33.2790953 -0.129880E-06  0.251E-03    2.22       8.9  T
   7    -33.2790954 -0.380048E-07  0.902E-04    2.22      24.8  T
     SCC iter.                  ...        0 min,  0.006 sec
     gradient                   ...        0 min,  0.010 sec
 * total energy  :   -32.7723606 Eh     change       -0.2670964E-03 Eh
   gradient norm :     0.0038334 Eh/α   predicted    -0.3437887E-03 (  28.71%)
   displ. norm   :     0.1067463 α      lambda       -0.6312178E-04
   maximum displ.:     0.0721168 α      in ANC's #1, #5, #3, ...

........................................................................
.............................. CYCLE   13 ..............................
........................................................................
   1    -33.2788413 -0.332788E+02  0.684E-02    2.22       0.0  T
   2    -33.2788419 -0.680449E-06  0.396E-02    2.22       1.0  T
   3    -33.2788407  0.120793E-05  0.104E-02    2.22       2.1  T
   4    -33.2788422 -0.146536E-05  0.459E-03    2.22       4.9  T
   5    -33.2788422 -0.452315E-07  0.291E-03    2.22       7.7  T
   6    -33.2788424 -0.137540E-06  0.668E-04    2.22      33.5  T
   7    -33.2788424 -0.135758E-08  0.397E-04    2.22      56.3  T
     SCC iter.                  ...        0 min,  0.006 sec
     gradient                   ...        0 min,  0.009 sec
 * total energy  :   -32.7724169 Eh     change       -0.5628018E-04 Eh
   gradient norm :     0.0025215 Eh/α   predicted    -0.3192174E-04 ( -43.28%)
   displ. norm   :     0.4182966 α      lambda       -0.1976806E-03
   maximum displ.:     0.2912080 α      in ANC's #1, #5, #3, ...

........................................................................
.............................. CYCLE   14 ..............................
........................................................................
   1    -33.2761512 -0.332762E+02  0.267E-01    2.22       0.0  T
   2    -33.2761627 -0.114932E-04  0.153E-01    2.22       1.0  T
   3    -33.2761551  0.763254E-05  0.332E-02    2.22       1.0  T
   4    -33.2761655 -0.103841E-04  0.180E-02    2.22       1.2  T
   5    -33.2761671 -0.166500E-05  0.960E-03    2.22       2.3  T
   6    -33.2761685 -0.142821E-05  0.291E-03    2.22       7.7  T
   7    -33.2761686 -0.653020E-07  0.155E-03    2.22      14.4  T
   8    -33.2761686 -0.747233E-08  0.652E-04    2.22      34.3  T
   9    -33.2761686 -0.265509E-08  0.105E-04    2.22     213.5  T
     SCC iter.                  ...        0 min,  0.007 sec
     gradient                   ...        0 min,  0.010 sec
 * total energy  :   -32.7724905 Eh     change       -0.7361166E-04 Eh
   gradient norm :     0.0070702 Eh/α   predicted    -0.1161364E-03 (  57.77%)
   displ. norm   :     0.0731890 α      lambda       -0.1096261E-03
   maximum displ.:     0.0407591 α      in ANC's #3, #5, #1, ...

........................................................................
.............................. CYCLE   15 ..............................
........................................................................
   1    -33.2786686 -0.332787E+02  0.422E-02    2.22       0.0  T
   2    -33.2786694 -0.792392E-06  0.246E-02    2.22       1.0  T
   3    -33.2786693  0.134904E-06  0.529E-03    2.22       4.2  T
   4    -33.2786694 -0.125447E-06  0.301E-03    2.22       7.4  T
   5    -33.2786696 -0.134096E-06  0.108E-03    2.22      20.7  T
   6    -33.2786696 -0.805074E-08  0.545E-04    2.22      41.0  T
     SCC iter.                  ...        0 min,  0.005 sec
     gradient                   ...        0 min,  0.009 sec
 * total energy  :   -32.7725405 Eh     change       -0.5003763E-04 Eh
   gradient norm :     0.0030284 Eh/α   predicted    -0.5510783E-04 (  10.13%)
   displ. norm   :     0.1125169 α      lambda       -0.3903139E-04
   maximum displ.:     0.0915272 α      in ANC's #1, #5, #6, ...

........................................................................
.............................. CYCLE   16 ..............................
........................................................................
   1    -33.2791547 -0.332792E+02  0.739E-02    2.22       0.0  T
   2    -33.2791558 -0.105876E-05  0.408E-02    2.22       1.0  T
   3    -33.2791557  0.118236E-06  0.761E-03    2.22       2.9  T
   4    -33.2791556  0.948207E-07  0.595E-03    2.22       3.8  T
   5    -33.2791560 -0.462133E-06  0.200E-03    2.22      11.2  T
   6    -33.2791561 -0.525941E-07  0.606E-04    2.22      36.9  T
   7    -33.2791561 -0.396787E-08  0.299E-04    2.22      74.7  T
     SCC iter.                  ...        0 min,  0.006 sec
     gradient                   ...        0 min,  0.011 sec
 * total energy  :   -32.7725694 Eh     change       -0.2891768E-04 Eh
   gradient norm :     0.0020899 Eh/α   predicted    -0.1976637E-04 ( -31.65%)
   displ. norm   :     0.3236106 α      lambda       -0.6762888E-04
   maximum displ.:     0.2562893 α      in ANC's #1, #5, #6, ...

........................................................................
.............................. CYCLE   17 ..............................
........................................................................
   1    -33.2775564 -0.332776E+02  0.217E-01    2.21       0.0  T
   2    -33.2775650 -0.857582E-05  0.121E-01    2.21       1.0  T
   3    -33.2775641  0.968972E-06  0.239E-02    2.21       1.0  T
   4    -33.2775652 -0.110339E-05  0.165E-02    2.21       1.4  T
   5    -33.2775678 -0.261995E-05  0.692E-03    2.21       3.2  T
   6    -33.2775685 -0.763166E-06  0.207E-03    2.21      10.8  T
   7    -33.2775686 -0.292690E-07  0.119E-03    2.21      18.7  T
   8    -33.2775686 -0.524842E-08  0.479E-04    2.21      46.7  T
   9    -33.2775686 -0.129788E-08  0.828E-05    2.21     270.1  T
     SCC iter.                  ...        0 min,  0.007 sec
     gradient                   ...        0 min,  0.009 sec
 * total energy  :   -32.7725935 Eh     change       -0.2404720E-04 Eh
   gradient norm :     0.0043459 Eh/α   predicted    -0.3735608E-04 (  55.34%)
   displ. norm   :     0.0471276 α      lambda       -0.3503459E-04
   maximum displ.:     0.0220655 α      in ANC's #1, #5, #6, ...

........................................................................
.............................. CYCLE   18 ..............................
........................................................................
   1    -33.2793553 -0.332794E+02  0.321E-02    2.22       0.0  T
   2    -33.2793560 -0.674365E-06  0.190E-02    2.22       1.2  T
   3    -33.2793555  0.473359E-06  0.703E-03    2.22       3.2  T
   4    -33.2793562 -0.643452E-06  0.217E-03    2.22      10.3  T
   5    -33.2793562 -0.344953E-07  0.119E-03    2.22      18.8  T
     SCC iter.                  ...        0 min,  0.004 sec
     gradient                   ...        0 min,  0.009 sec
 * total energy  :   -32.7726090 Eh     change       -0.1547791E-04 Eh
   gradient norm :     0.0011332 Eh/α   predicted    -0.1755881E-04 (  13.44%)
   displ. norm   :     0.0956233 α      lambda       -0.6873470E-05
   maximum displ.:     0.0799143 α      in ANC's #1, #13, #5, ...

........................................................................
.............................. CYCLE   19 ..............................
........................................................................
   1    -33.2793636 -0.332794E+02  0.648E-02    2.22       0.0  T
   2    -33.2793643 -0.759315E-06  0.359E-02    2.22       1.0  T
   3    -33.2793628  0.155286E-05  0.116E-02    2.22       1.9  T
   4    -33.2793645 -0.172972E-05  0.540E-03    2.22       4.1  T
   5    -33.2793647 -0.190279E-06  0.171E-03    2.22      13.1  T
   6    -33.2793647 -0.474356E-07  0.558E-04    2.22      40.0  T
   7    -33.2793647 -0.171164E-08  0.327E-04    2.22      68.3  T
     SCC iter.                  ...        0 min,  0.006 sec
     gradient                   ...        0 min,  0.010 sec
 * total energy  :   -32.7726146 Eh     change       -0.5619909E-05 Eh
   gradient norm :     0.0013380 Eh/α   predicted    -0.3451926E-05 ( -38.58%)
   displ. norm   :     0.0939993 α      lambda       -0.4205988E-05
   maximum displ.:     0.0782053 α      in ANC's #1, #13, #5, ...

........................................................................
.............................. CYCLE   20 ..............................
........................................................................
   1    -33.2790915 -0.332791E+02  0.628E-02    2.22       0.0  T
   2    -33.2790921 -0.640519E-06  0.349E-02    2.22       1.0  T
   3    -33.2790920  0.119921E-06  0.703E-03    2.22       3.2  T
   4    -33.2790919  0.701949E-07  0.570E-03    2.22       3.9  T
   5    -33.2790924 -0.442834E-06  0.100E-03    2.22      22.4  T
   6    -33.2790924 -0.138239E-07  0.480E-04    2.22      46.6  T
   7    -33.2790924 -0.108536E-08  0.248E-04    2.22      90.1  T
     SCC iter.                  ...        0 min,  0.006 sec
     gradient                   ...        0 min,  0.011 sec
 * total energy  :   -32.7726167 Eh     change       -0.2055361E-05 Eh
   gradient norm :     0.0008267 Eh/α   predicted    -0.2115158E-05 (   2.91%)
   displ. norm   :     0.0157112 α      lambda       -0.2855256E-05
   maximum displ.:     0.0117750 α      in ANC's #2, #3, #5, ...

   *** GEOMETRY OPTIMIZATION CONVERGED AFTER 20 ITERATIONS ***

------------------------------------------------------------------------
 total energy gain   :        -0.0170995 Eh      -10.7301 kcal/mol
 total RMSD          :         0.5796229 a0        0.3067 Å
 total power (kW/mol):        -2.2447312 (step)  -96.0146 (real)
------------------------------------------------------------------------

 ANCopt (total)                0 d,  0 h,  0 min,  0.468 sec
 optimizer setup                ...        0 min,  0.000 sec (  0.028%)
 model hessian                  ...        0 min,  0.002 sec (  0.488%)
 ANC generation                 ...        0 min,  0.000 sec (  0.096%)
 coordinate transformation      ...        0 min,  0.000 sec (  0.055%)
 single point calculation       ...        0 min,  0.458 sec ( 97.853%)
 optimization log               ...        0 min,  0.002 sec (  0.335%)
 hessian update                 ...        0 min,  0.000 sec (  0.046%)
 rational function              ...        0 min,  0.004 sec (  0.860%)

================
 final structure:
================
$coord
   -2.87861297754309   -2.35241165204795    0.29083206052510      C 
   -5.09188430345653   -0.06106020324705    0.76678759781689      S 
   -2.88319518108646    2.29302002379510    0.65011147100490      C 
   -0.49267146546473    1.36027143234801    0.25584870970287      C 
   -0.48501805763540   -1.35441347604343    0.04327884260573      C 
    1.81151499163814   -2.65252695338902   -0.36577794308686      C 
    4.02095115689757   -1.31220899895819   -0.54337033620205      C 
    6.52071484458309   -2.52008182514082   -0.93795758631853      C 
    8.45956567763158   -1.30287852427650   -0.86694436997125      O 
    6.54907948662243   -5.33205482142579   -1.43475840997248      C 
    3.99299263446646    1.37810136707525   -0.32315390482137      C 
    1.82572099771041    2.69090204170686    0.05562170363353      C 
   -3.43569308239793   -4.29789394898378    0.21608199265981      H 
   -3.45424304342112    4.22197994895553    0.87842974290483      H 
    1.75957052817030   -4.68500245206687   -0.51295763849032      H 
    5.42041860649332   -5.77200835125652   -3.09628132405972      H 
    5.77736111474165   -6.34366567333897    0.17998516376086      H 
    8.48624778012008   -5.94002844001251   -1.74587223035842      H 
    5.79042830216188    2.33073702336895   -0.47550471721364      H 
    1.82389027345026    4.72471775969482    0.21277887962325      H 
$end
           -------------------------------------------------
          |                Final Singlepoint                |
           -------------------------------------------------

          ...................................................
          :                      SETUP                      :
          :.................................................:
          :  # basis functions                  62          :
          :  # atomic orbitals                  61          :
          :  # shells                           33          :
          :  # electrons                        60          :
          :  max. iterations                   250          :
          :  Hamiltonian                  GFN2-xTB          :
          :  restarted?                      false          :
          :  GBSA solvation                  false          :
          :  PC potential                    false          :
          :  electronic temp.          300.0000000     K    :
          :  accuracy                    1.0000000          :
          :  -> integral cutoff          0.2500000E+02      :
          :  -> integral neglect         0.1000000E-07      :
          :  -> SCF convergence          0.1000000E-05 Eh   :
          :  -> wf. convergence          0.1000000E-03 e    :
          :  Broyden damping             0.4000000          :
          ...................................................

 iter      E             dE          RMSdq      gap      omega  full diag
   1    -33.2790924 -0.332791E+02  0.783E-05    2.22       0.0  T
   2    -33.2790924 -0.192628E-10  0.439E-05    2.22     509.9  T
   3    -33.2790924 -0.141185E-10  0.374E-05    2.22     598.0  T

   *** convergence criteria satisfied after 3 iterations ***

         #    Occupation            Energy/Eh            Energy/eV
      -------------------------------------------------------------
         1        2.0000           -0.7465986             -20.3160
       ...           ...                  ...                  ...
        24        2.0000           -0.4598439             -12.5130
        25        2.0000           -0.4526211             -12.3164
        26        2.0000           -0.4369490             -11.8900
        27        2.0000           -0.4334608             -11.7951
        28        2.0000           -0.4093381             -11.1387
        29        2.0000           -0.3911040             -10.6425
        30        2.0000           -0.3777467             -10.2790 (HOMO)
        31                         -0.2963095              -8.0630 (LUMO)
        32                         -0.2580493              -7.0219
        33                         -0.2085980              -5.6762
        34                         -0.2069389              -5.6311
        35                         -0.1799097              -4.8956
       ...                                ...                  ...
        61                          0.7324959              19.9322
      -------------------------------------------------------------
                  HL-Gap            0.0814372 Eh            2.2160 eV
             Fermi-level           -0.3370281 Eh           -9.1710 eV

 SCC (total)                   0 d,  0 h,  0 min,  0.022 sec
 SCC setup                      ...        0 min,  0.000 sec (  0.807%)
 Dispersion                     ...        0 min,  0.000 sec (  0.736%)
 integral evaluation            ...        0 min,  0.007 sec ( 31.724%)
 zeroth order Hamiltonian       ...        0 min,  0.000 sec (  0.583%)
 iterations                     ...        0 min,  0.003 sec ( 15.586%)
 molecular gradient             ...        0 min,  0.011 sec ( 48.946%)
 printout                       ...        0 min,  0.000 sec (  1.346%)

         :::::::::::::::::::::::::::::::::::::::::::::::::::::
         ::                     SUMMARY                     ::
         :::::::::::::::::::::::::::::::::::::::::::::::::::::
         :: total energy             -32.772616653612 Eh    ::
         :: gradient norm              0.000827927385 Eh/a0 ::
         :: HOMO-LUMO gap              2.216018970762 eV    ::
         ::.................................................::
         :: SCC energy               -33.279092381833 Eh    ::
         :: -> isotropic ES            0.027510847839 Eh    ::
         :: -> anisotropic ES          0.002070941674 Eh    ::
         :: -> anisotropic XC          0.013769722365 Eh    ::
         :: -> dispersion             -0.020333267039 Eh    ::
         :: repulsion energy           0.506463965771 Eh    ::
         :: add. restraining           0.000000000000 Eh    ::
         :::::::::::::::::::::::::::::::::::::::::::::::::::::

           -------------------------------------------------
          |                Property Printout                |
           -------------------------------------------------

    * Orbital Energies and Occupations

         #    Occupation            Energy/Eh            Energy/eV
      -------------------------------------------------------------
         1        2.0000           -0.7465986             -20.3160
       ...           ...                  ...                  ...
        18        2.0000           -0.4976193             -13.5409
        19        2.0000           -0.4897755             -13.3275
        20        2.0000           -0.4849164             -13.1952
        21        2.0000           -0.4773331             -12.9889
        22        2.0000           -0.4711014             -12.8193
        23        2.0000           -0.4636789             -12.6173
        24        2.0000           -0.4598439             -12.5130
        25        2.0000           -0.4526211             -12.3164
        26        2.0000           -0.4369490             -11.8900
        27        2.0000           -0.4334608             -11.7951
        28        2.0000           -0.4093381             -11.1387
        29        2.0000           -0.3911040             -10.6425
        30        2.0000           -0.3777467             -10.2790 (HOMO)
        31                         -0.2963095              -8.0630 (LUMO)
        32                         -0.2580493              -7.0219
        33                         -0.2085980              -5.6762
        34                         -0.2069389              -5.6311
        35                         -0.1799097              -4.8956
        36                         -0.1272489              -3.4626
        37                         -0.0893687              -2.4318
        38                         -0.0107215              -0.2917
        39                          0.0164425               0.4474
        40                          0.0279026               0.7593
        41                          0.0768995               2.0925
       ...                                ...                  ...
        61                          0.7324959              19.9322
      -------------------------------------------------------------
                  HL-Gap            0.0814372 Eh            2.2160 eV
             Fermi-level           -0.3370281 Eh           -9.1710 eV

     #   Z        covCN         q      C6AA      α(0)
     1   6 C      2.928    -0.037    28.912     8.818
     2  16 S      2.307     0.029   139.877    19.906
     3   6 C      2.929    -0.038    28.944     8.823
     4   6 C      3.179     0.004    27.516     8.564
     5   6 C      3.179     0.002    27.565     8.571
     6   6 C      2.911    -0.031    28.781     8.797
     7   6 C      2.966    -0.016    28.418     8.744
     8   6 C      2.818     0.233    23.132     7.880
     9   8 O      0.858    -0.367    21.040     6.150
    10   6 C      3.753    -0.136    23.173     6.865
    11   6 C      2.921    -0.025    28.632     8.775
    12   6 C      2.906    -0.033    28.831     8.804
    13   1 H      0.926     0.047     2.358     2.401
    14   1 H      0.926     0.048     2.351     2.398
    15   1 H      0.926     0.040     2.455     2.450
    16   1 H      0.925     0.060     2.205     2.322
    17   1 H      0.925     0.061     2.190     2.314
    18   1 H      0.925     0.066     2.132     2.283
    19   1 H      0.926     0.061     2.192     2.315
    20   1 H      0.926     0.036     2.496     2.471

 Mol. C6AA /au·bohr⁶  :       6512.008430
 Mol. C8AA /au·bohr⁸  :     181552.035047
 Mol. α(0) /au        :        129.651508


Wiberg/Mayer (AO) data.
largest (>0.10) Wiberg bond orders for each atom
          total WBO             WBO to atom ...
     1  C   3.932        C    5 1.451    S    2 1.257    H   13 0.970    C    3 0.150
     2  S   2.742        C    1 1.257    C    3 1.236
     3  C   3.938        C    4 1.479    S    2 1.236    H   14 0.970    C    1 0.150
     4  C   3.989        C    3 1.479    C   12 1.208    C    5 1.149
     5  C   3.989        C    1 1.451    C    6 1.240    C    4 1.149
     6  C   3.991        C    7 1.536    C    5 1.240    H   15 0.964    C   12 0.108
     7  C   3.988        C    6 1.536    C   11 1.214    C    8 1.030
     8  C   3.921        O    9 1.819    C    7 1.030    C   10 1.000
     9  O   2.045        C    8 1.819
    10  C   3.994        C    8 1.000    H   18 0.983    H   16 0.966    H   17 0.962
    11  C   3.990        C   12 1.637    C    7 1.214    H   19 0.964
    12  C   3.992        C   11 1.637    C    4 1.208    H   20 0.968    C    6 0.108
    13  H   0.997        C    1 0.970
    14  H   0.997        C    3 0.970
    15  H   0.998        C    6 0.964
    16  H   0.996        C   10 0.966
    17  H   0.996        C   10 0.962
    18  H   0.995        C   10 0.983
    19  H   0.995        C   11 0.964
    20  H   0.998        C   12 0.968

molecular dipole:
                 x           y           z       tot (Debye)
 q only:       -1.308      -0.395       0.032
   full:       -1.282      -0.524       0.004       3.521
molecular quadrupole (traceless):
                xx          xy          yy          xz          yz          zz
 q only:      -14.573      -2.526      11.834       0.516       1.354       2.738
  q+dip:      -18.245      -3.483      17.270       0.426       1.991       0.976
   full:      -20.204      -3.586      15.885       1.061       1.538       4.319

           -------------------------------------------------
          |                Geometry Summary                 |
           -------------------------------------------------

      molecular mass/u    :      176.2326000
   center of mass at/Å    :        0.6318348      -0.3975338      -0.0642652
  moments of inertia/u·Å² :        0.2124309E+03   0.1089769E+04   0.1298139E+04
rotational constants/cm⁻¹ :        0.7935584E-01   0.1546899E-01   0.1298600E-01

 * 19 selected distances

     #   Z        #   Z                                     value/Å
     1   6 C      2  16 S                                 1.7045255
     2  16 S      3   6 C                                 1.7093011 (max)
     3   6 C      4   6 C                                 1.3738309
     1   6 C      5   6 C                                 1.3785631
     4   6 C      5   6 C                                 1.4409526
     5   6 C      6   6 C                                 1.4126645
     6   6 C      7   6 C                                 1.3707223
     8   6 C      9   8 O                                 1.2120088
     7   6 C     11   6 C                                 1.4284892
     4   6 C     12   6 C                                 1.4185122
    11   6 C     12   6 C                                 1.3557665
     1   6 C     13   1 H                                 1.0716104
     3   6 C     14   1 H                                 1.0713861 (min)
     6   6 C     15   1 H                                 1.0787064
    10   6 C     16   1 H                                 1.0881116
    10   6 C     17   1 H                                 1.0878812
    10   6 C     18   1 H                                 1.0869467
    11   6 C     19   1 H                                 1.0795087
    12   6 C     20   1 H                                 1.0794578

 * 4 distinct bonds (by element types)

   Z      Z             #   av. dist./Å        max./Å        min./Å
   1 H    6 C           8     1.0804511     1.0881116     1.0713861
   6 C    6 C           8     1.3974376     1.4409526     1.3557665
   6 C    8 O           1     1.2120088     1.2120088     1.2120088
   6 C   16 S           2     1.7069133     1.7093011     1.7045255


optimized geometry written to: xtbopt.xyz


           -------------------------------------------------
          | TOTAL ENERGY              -32.772616653612 Eh   |
          | GRADIENT NORM               0.000827927385 Eh/α |
          | HOMO-LUMO GAP               2.216018970762 eV   |
           -------------------------------------------------

------------------------------------------------------------------------
 * finished run on 2021/05/19 at 10:58:25.559     
------------------------------------------------------------------------
 total:
 * wall-time:     0 d,  0 h,  0 min,  0.538 sec
 *  cpu-time:     0 d,  0 h,  0 min,  0.538 sec
 * ratio c/w:     1.000 speedup
 SCF:
 * wall-time:     0 d,  0 h,  0 min,  0.031 sec
 *  cpu-time:     0 d,  0 h,  0 min,  0.031 sec
 * ratio c/w:     1.000 speedup
 ANC optimizer:
 * wall-time:     0 d,  0 h,  0 min,  0.490 sec
 *  cpu-time:     0 d,  0 h,  0 min,  0.490 sec
 * ratio c/w:     1.000 speedup

