      -----------------------------------------------------------      
     |                   =====================                   |     
     |                           x T B                           |     
     |                   =====================                   |     
     |                         S. Grimme                         |     
     |          Mulliken Center for Theoretical Chemistry        |     
     |                    University of Bonn                     |     
     |                Version 6.2 RC2 (SAW190805)                |     
      -----------------------------------------------------------      

   This program is distributed in the hope that it will be useful,
   but WITHOUT ANY WARRANTY; without even the implied warranty of
   MERCHANTABILITY or FITNESS FOR A PARTICULAR PURPOSE.
   
   FOR NON-COMMERCIAL, ACADEMIA USE ONLY.
   
   Cite this work as:
   * S. Grimme, C. Bannwarth, P. Shushkov, J. Chem. Theory Comput., 2017,
     13, 1989-2009. DOI: 10.1021/acs.jctc.7b00118
   * C. Bannwarth, S. Ehlert and S. Grimme., J. Chem. Theory Comput., 2019,
     15, 1652-1671. DOI: 10.1021/acs.jctc.8b01176
   * P. Pracht, E. Caldeweyher, S. Ehlert, S. Grimme, ChemRxiv, 2019, preprint.
     DOI: 10.26434/chemrxiv.8326202.v1
   
   for DFT-D4:
   * E. Caldeweyher, C. Bannwarth and S. Grimme, J. Chem. Phys., 2017,
     147, 034112. DOI: 10.1063/1.4993215
   * E. Caldeweyher, S. Ehlert, A. Hansen, H. Neugebauer, S. Spicher,
     C. Bannwarth and S. Grimme, J. Chem. Phys., 2019, 150, 154122.
     DOI: 10.1063/1.5090222
   
   for sTDA-xTB:
   * S. Grimme and C. Bannwarth, J. Chem. Phys., 2016, 145, 054103.
     DOI: 10.1063/1.4959605
   
   in the mass-spec context:
   * V. Asgeirsson, C. Bauer and S. Grimme, Chem. Sci., 2017, 8, 4879.
     DOI: 10.1039/c7sc00601b
   
   for metadynamics refer to:
   * S. Grimme, J. Chem. Theory Comput., 2019, 155, 2847-2862
     DOI: 10.1021/acs.jctc.9b00143
   
   with help from (in alphabetical order)
   C. Bannwarth, F. Bohle, G. Brandenburg, E. Caldeweyher, M. Checinski,
   S. Dohm, S. Ehlert, S. Ehrlich, F. März, H. Neugebauer, J. Pisarek,
   P. Pracht, P. Shushkov, and S. Spicher.
   
 * started run on 2021/05/19 at 11:00:07.809     

           -------------------------------------------------
          |                Calculation Setup                |
           -------------------------------------------------

          program call               : /ihome/ghutchison/geoffh/xtb/xtb 396.xyz -opt
          hostname                   : smp-n122
          coordinate file            : 396.xyz
          omp threads                :                     1
          number of atoms            :                    28
          number of electrons        :                    74
          charge                     :                     0
          spin                       :                   0.0
          first test random number   :      0.52232609521491


########################################################################
# WARNING! Please study the warnings concerning your input carefully
#  - the use of '-opt' is discouraged, please use '--opt' next time
########################################################################

           ------------------------------------------------- 
          |                 G F N 2 - x T B                 |
          | Geometry, Frequencies, Noncovalent interactions |
          |            JCTC 2019 parametrisation            |
           ------------------------------------------------- 
             KAB for C  - Si     :                1.0500
             KAB for H  - Pd     :                0.9500
             k(s)              :                1.8500
             k(p)              :                2.2300
             k(d)              :                2.2300
             k(f)              :                2.0000
             kEN (H0ij)        :               -2.0000
             D4 a1             :                0.5200
             D4 a2             :                5.0000
             D4 s6             :                1.0000
             D4 s8             :                2.7000
             D4 s9             :                5.0000
             alphaj            :                2.0000

  Z AO/shell   Hii/eV     exponent
  1     Wed Apr 25 08:07:45 CEST 2018   EN: 2.200 GM2: 0.406  GM3: 0.0800  RAES: 1.40
     1s    -10.707211    1.230000
  6     Wed Apr 25 08:07:45 CEST 2018   EN: 2.550 GM2: 0.538  GM3: 0.1500  RAES: 3.00
     2s    -13.970922    2.096432
     2p    -10.063292    1.800000
  8     Wed Apr 25 08:07:45 CEST 2018   EN: 3.440 GM2: 0.452  GM3:-0.0517  RAES: 1.80
     2s    -20.229985    2.439742
     2p    -15.503117    2.137023
 16     Tue Apr 24 11:44:34 CEST 2018   EN: 2.580 GM2: 0.340  GM3:-0.0502  RAES: 3.10
     3s    -20.029654    1.981333
     3p    -11.377694    2.025643
     3d     -0.420282    1.702555

           ------------------------------------------------- 
          |        Self-Consistent Charge Iterations        |
           ------------------------------------------------- 

          ...................................................
          :                      SETUP                      :
          :.................................................:
          :  # basis functions                  76          :
          :  # atomic orbitals                  75          :
          :  # shells                           43          :
          :  # electrons                        74          :
          :  max. iterations                   250          :
          :  Hamiltonian                  GFN2-xTB          :
          :  restarted?                      false          :
          :  GBSA solvation                  false          :
          :  PC potential                    false          :
          :  electronic temp.          300.0000000     K    :
          :  accuracy                    1.0000000          :
          :  -> integral cutoff          0.2500000E+02      :
          :  -> integral neglect         0.1000000E-07      :
          :  -> SCF convergence          0.1000000E-05 Eh   :
          :  -> wf. convergence          0.1000000E-03 e    :
          :  Broyden damping             0.4000000          :
          ...................................................

 iter      E             dE          RMSdq      gap      omega  full diag
   1    -40.5993163 -0.405993E+02  0.400E+00    3.01       0.0  T
   2    -40.6553155 -0.559992E-01  0.218E+00    2.92       1.0  T
   3    -40.6556429 -0.327413E-03  0.130E+00    3.02       1.0  T
   4    -40.6691952 -0.135523E-01  0.281E-01    2.94       1.0  T
   5    -40.6694393 -0.244110E-03  0.153E-01    2.97       1.0  T
   6    -40.6697686 -0.329304E-03  0.684E-02    2.97       1.0  T
   7    -40.6698211 -0.524546E-04  0.209E-02    2.97       1.0  T
   8    -40.6698232 -0.217316E-05  0.122E-02    2.97       1.5  T
   9    -40.6698245 -0.126875E-05  0.410E-03    2.97       4.6  T
  10    -40.6698247 -0.214043E-06  0.174E-03    2.97      10.9  T
  11    -40.6698247 -0.269909E-07  0.684E-04    2.97      27.6  T
  12    -40.6698247 -0.298362E-08  0.334E-04    2.97      56.6  T

   *** convergence criteria satisfied after 12 iterations ***

         #    Occupation            Energy/Eh            Energy/eV
      -------------------------------------------------------------
         1        2.0000           -0.7323732             -19.9289
       ...           ...                  ...                  ...
        31        2.0000           -0.4370903             -11.8938
        32        2.0000           -0.4332820             -11.7902
        33        2.0000           -0.4289026             -11.6710
        34        2.0000           -0.4241820             -11.5426
        35        2.0000           -0.4038203             -10.9885
        36        2.0000           -0.3847708             -10.4701
        37        2.0000           -0.3734256             -10.1614 (HOMO)
        38                         -0.2642503              -7.1906 (LUMO)
        39                         -0.2584539              -7.0329
        40                         -0.2073814              -5.6431
        41                         -0.1981714              -5.3925
        42                         -0.1596083              -4.3432
       ...                                ...                  ...
        75                          0.6603484              17.9690
      -------------------------------------------------------------
                  HL-Gap            0.1091753 Eh            2.9708 eV
             Fermi-level           -0.3188380 Eh           -8.6760 eV

 SCC (total)                   0 d,  0 h,  0 min,  0.083 sec
 SCC setup                      ...        0 min,  0.000 sec (  0.395%)
 Dispersion                     ...        0 min,  0.000 sec (  0.501%)
 integral evaluation            ...        0 min,  0.011 sec ( 12.876%)
 zeroth order Hamiltonian       ...        0 min,  0.000 sec (  0.246%)
 iterations                     ...        0 min,  0.052 sec ( 62.915%)
 molecular gradient             ...        0 min,  0.019 sec ( 22.528%)
 printout                       ...        0 min,  0.000 sec (  0.481%)

         :::::::::::::::::::::::::::::::::::::::::::::::::::::
         ::                     SUMMARY                     ::
         :::::::::::::::::::::::::::::::::::::::::::::::::::::
         :: total energy             -40.114708017196 Eh    ::
         :: gradient norm              0.074711156532 Eh/a0 ::
         :: HOMO-LUMO gap              2.970812329263 eV    ::
         ::.................................................::
         :: SCC energy               -40.669824747233 Eh    ::
         :: -> isotropic ES            0.028518944562 Eh    ::
         :: -> anisotropic ES          0.004390945899 Eh    ::
         :: -> anisotropic XC          0.019663070194 Eh    ::
         :: -> dispersion             -0.028984025660 Eh    ::
         :: repulsion energy           0.554817952172 Eh    ::
         :: add. restraining           0.000000000000 Eh    ::
         :::::::::::::::::::::::::::::::::::::::::::::::::::::

      ----------------------------------------------------------- 
     |                   =====================                   |
     |                        A N C O P T                        |
     |                   =====================                   |
     |               Approximate Normal Coordinate               |
     |                Rational Function Optimizer                |
      ----------------------------------------------------------- 

          ...................................................
          :                      SETUP                      :
          :.................................................:
          :   optimization level            normal          :
          :   max. optcycles                   200          :
          :   ANC micro-cycles                  20          :
          :   degrees of freedom                78          :
          :.................................................:
          :   RF solver                   davidson          :
          :   input Hessian                  false          :
          :   write xtbopt.log                true          :
          :   linear?                        false          :
          :   energy convergence         0.5000000E-05 Eh   :
          :   grad. convergence          0.1000000E-02 Eh/α :
          :   maximium RF displ.         2.0000000          :
          :   Hlow (freq-cutoff)         0.5000000E-02      :
          :   Hmax (freq-cutoff)         5.0000000          :
          :   S6 in model hess.         20.0000000          :
          ...................................................

generating ANC from model Hessian ...
Using Lindh-Hessian (1995)
 Shifting diagonal of input Hessian by   4.240110954862365E-003
 Lowest  eigenvalues of input Hessian
   -0.000000   -0.000000   -0.000000    0.000000    0.000000    0.000000
    0.005000    0.006398    0.006712    0.008440    0.009428    0.009742
    0.011281    0.013939    0.015588    0.018782    0.021755    0.024874
 Highest eigenvalues
    1.518725    1.607879    1.769210    1.815380    1.974478    2.009601
 

........................................................................
.............................. CYCLE    1 ..............................
........................................................................
   1    -40.6698247 -0.406698E+02  0.178E-04    2.97       0.0  T
   2    -40.6698247 -0.335092E-10  0.143E-04    2.97     131.9  T
   3    -40.6698247 -0.264968E-09  0.757E-05    2.97     249.8  T
     SCC iter.                  ...        0 min,  0.005 sec
     gradient                   ...        0 min,  0.016 sec
 * total energy  :   -40.1147080 Eh     change       -0.2703160E-07 Eh
   gradient norm :     0.0747116 Eh/α   predicted     0.0000000E+00 (-100.00%)
   displ. norm   :     0.3065978 α      lambda       -0.8147022E-02
   maximum displ.:     0.1306825 α      in ANC's #17, #7, #5, ...

........................................................................
.............................. CYCLE    2 ..............................
........................................................................
   1    -40.6996304 -0.406996E+02  0.242E-01    3.05       0.0  T
   2    -40.6997413 -0.110958E-03  0.128E-01    3.05       1.0  T
   3    -40.6996866  0.547341E-04  0.719E-02    3.05       1.0  T
   4    -40.6997838 -0.971935E-04  0.261E-02    3.05       1.0  T
   5    -40.6997897 -0.588172E-05  0.101E-02    3.05       1.9  T
   6    -40.6997902 -0.561591E-06  0.414E-03    3.05       4.6  T
   7    -40.6997905 -0.306039E-06  0.142E-03    3.05      13.3  T
     SCC iter.                  ...        0 min,  0.009 sec
     gradient                   ...        0 min,  0.016 sec
 * total energy  :   -40.1200442 Eh     change       -0.5336142E-02 Eh
   gradient norm :     0.0224927 Eh/α   predicted    -0.4456438E-02 ( -16.49%)
   displ. norm   :     0.2684782 α      lambda       -0.1740613E-02
   maximum displ.:     0.1544543 α      in ANC's #7, #6, #5, ...

........................................................................
.............................. CYCLE    3 ..............................
........................................................................
   1    -40.7102506 -0.407103E+02  0.178E-01    3.06       0.0  T
   2    -40.7102820 -0.313986E-04  0.929E-02    3.06       1.0  T
   3    -40.7102503  0.316249E-04  0.460E-02    3.06       1.0  T
   4    -40.7102944 -0.440681E-04  0.163E-02    3.05       1.2  T
   5    -40.7102964 -0.196964E-05  0.617E-03    3.05       3.1  T
   6    -40.7102966 -0.242049E-06  0.240E-03    3.05       7.9  T
   7    -40.7102967 -0.110177E-06  0.794E-04    3.05      23.8  T
     SCC iter.                  ...        0 min,  0.009 sec
     gradient                   ...        0 min,  0.016 sec
 * total energy  :   -40.1210796 Eh     change       -0.1035439E-02 Eh
   gradient norm :     0.0064031 Eh/α   predicted    -0.9330410E-03 (  -9.89%)
   displ. norm   :     0.1796518 α      lambda       -0.3707854E-03
   maximum displ.:     0.1068218 α      in ANC's #7, #10, #4, ...

........................................................................
.............................. CYCLE    4 ..............................
........................................................................
   1    -40.7103328 -0.407103E+02  0.961E-02    3.04       0.0  T
   2    -40.7103350 -0.220498E-05  0.540E-02    3.04       1.0  T
   3    -40.7103297  0.534970E-05  0.183E-02    3.04       1.0  T
   4    -40.7103359 -0.625813E-05  0.618E-03    3.04       3.1  T
   5    -40.7103361 -0.227252E-06  0.194E-03    3.04       9.7  T
   6    -40.7103362 -0.559318E-07  0.623E-04    3.04      30.3  T
     SCC iter.                  ...        0 min,  0.008 sec
     gradient                   ...        0 min,  0.016 sec
 * total energy  :   -40.1213252 Eh     change       -0.2455754E-03 Eh
   gradient norm :     0.0052378 Eh/α   predicted    -0.1913762E-03 ( -22.07%)
   displ. norm   :     0.1956270 α      lambda       -0.2434711E-03
   maximum displ.:     0.0983286 α      in ANC's #4, #7, #10, ...

........................................................................
.............................. CYCLE    5 ..............................
........................................................................
   1    -40.7087909 -0.407088E+02  0.108E-01    3.03       0.0  T
   2    -40.7087934 -0.255539E-05  0.598E-02    3.03       1.0  T
   3    -40.7087934  0.112845E-08  0.101E-02    3.03       1.9  T
   4    -40.7087936 -0.187209E-06  0.594E-03    3.03       3.2  T
   5    -40.7087940 -0.436674E-06  0.153E-03    3.03      12.3  T
   6    -40.7087941 -0.502025E-07  0.523E-04    3.03      36.1  T
     SCC iter.                  ...        0 min,  0.008 sec
     gradient                   ...        0 min,  0.016 sec
 * total energy  :   -40.1214640 Eh     change       -0.1387927E-03 Eh
   gradient norm :     0.0038050 Eh/α   predicted    -0.1263962E-03 (  -8.93%)
   displ. norm   :     0.1066208 α      lambda       -0.9899472E-04
   maximum displ.:     0.0669711 α      in ANC's #4, #1, #8, ...

........................................................................
.............................. CYCLE    6 ..............................
........................................................................
   1    -40.7086908 -0.407087E+02  0.570E-02    3.03       0.0  T
   2    -40.7086913 -0.513597E-06  0.335E-02    3.03       1.0  T
   3    -40.7086882  0.309272E-05  0.121E-02    3.03       1.6  T
   4    -40.7086918 -0.353124E-05  0.222E-03    3.03       8.5  T
   5    -40.7086918 -0.148451E-07  0.101E-03    3.03      18.7  T
   6    -40.7086918 -0.121841E-07  0.383E-04    3.03      49.4  T
   7    -40.7086918 -0.152154E-08  0.204E-04    3.03      92.8  T
     SCC iter.                  ...        0 min,  0.009 sec
     gradient                   ...        0 min,  0.017 sec
 * total energy  :   -40.1215308 Eh     change       -0.6682434E-04 Eh
   gradient norm :     0.0024169 Eh/α   predicted    -0.5006025E-04 ( -25.09%)
   displ. norm   :     0.0971261 α      lambda       -0.6009145E-04
   maximum displ.:     0.0670028 α      in ANC's #4, #1, #5, ...

........................................................................
.............................. CYCLE    7 ..............................
........................................................................
   1    -40.7091658 -0.407092E+02  0.495E-02    3.03       0.0  T
   2    -40.7091663 -0.422998E-06  0.292E-02    3.03       1.0  T
   3    -40.7091635  0.274901E-05  0.118E-02    3.03       1.6  T
   4    -40.7091667 -0.317598E-05  0.203E-03    3.03       9.3  T
   5    -40.7091667 -0.143953E-07  0.983E-04    3.03      19.2  T
   6    -40.7091667 -0.820535E-08  0.471E-04    3.03      40.1  T
     SCC iter.                  ...        0 min,  0.008 sec
     gradient                   ...        0 min,  0.017 sec
 * total energy  :   -40.1215744 Eh     change       -0.4354800E-04 Eh
   gradient norm :     0.0017913 Eh/α   predicted    -0.3032999E-04 ( -30.35%)
   displ. norm   :     0.1300283 α      lambda       -0.3534976E-04
   maximum displ.:     0.0927486 α      in ANC's #4, #1, #5, ...

........................................................................
.............................. CYCLE    8 ..............................
........................................................................
   1    -40.7096449 -0.407096E+02  0.674E-02    3.03       0.0  T
   2    -40.7096455 -0.590521E-06  0.400E-02    3.03       1.0  T
   3    -40.7096424  0.304231E-05  0.130E-02    3.03       1.5  T
   4    -40.7096460 -0.357534E-05  0.231E-03    3.03       8.2  T
   5    -40.7096460 -0.202410E-07  0.113E-03    3.03      16.7  T
   6    -40.7096460 -0.438755E-08  0.546E-04    3.03      34.6  T
   7    -40.7096460 -0.216903E-08  0.260E-04    3.03      72.8  T
     SCC iter.                  ...        0 min,  0.009 sec
     gradient                   ...        0 min,  0.017 sec
 * total energy  :   -40.1216088 Eh     change       -0.3438862E-04 Eh
   gradient norm :     0.0017806 Eh/α   predicted    -0.1780834E-04 ( -48.21%)
   displ. norm   :     0.0806012 α      lambda       -0.1801075E-04
   maximum displ.:     0.0585284 α      in ANC's #4, #1, #5, ...

........................................................................
.............................. CYCLE    9 ..............................
........................................................................
   1    -40.7097685 -0.407098E+02  0.428E-02    3.03       0.0  T
   2    -40.7097687 -0.217652E-06  0.249E-02    3.02       1.0  T
   3    -40.7097678  0.857822E-06  0.680E-03    3.03       2.8  T
   4    -40.7097688 -0.102574E-05  0.190E-03    3.02       9.9  T
   5    -40.7097689 -0.119960E-07  0.568E-04    3.02      33.3  T
   6    -40.7097689 -0.454057E-08  0.294E-04    3.02      64.3  T
     SCC iter.                  ...        0 min,  0.008 sec
     gradient                   ...        0 min,  0.017 sec
 * total energy  :   -40.1216311 Eh     change       -0.2238356E-04 Eh
   gradient norm :     0.0012951 Eh/α   predicted    -0.9033126E-05 ( -59.64%)
   displ. norm   :     0.1488617 α      lambda       -0.2923273E-04
   maximum displ.:     0.0983602 α      in ANC's #4, #1, #2, ...

........................................................................
.............................. CYCLE   10 ..............................
........................................................................
   1    -40.7094936 -0.407095E+02  0.783E-02    3.02       0.0  T
   2    -40.7094942 -0.595251E-06  0.464E-02    3.02       1.0  T
   3    -40.7094907  0.353422E-05  0.131E-02    3.02       1.4  T
   4    -40.7094948 -0.416584E-05  0.263E-03    3.02       7.2  T
   5    -40.7094949 -0.105702E-07  0.102E-03    3.02      18.4  T
   6    -40.7094949 -0.772717E-08  0.574E-04    3.02      32.9  T
   7    -40.7094949 -0.265839E-08  0.289E-04    3.02      65.3  T
     SCC iter.                  ...        0 min,  0.009 sec
     gradient                   ...        0 min,  0.017 sec
 * total energy  :   -40.1216624 Eh     change       -0.3128868E-04 Eh
   gradient norm :     0.0013494 Eh/α   predicted    -0.1476126E-04 ( -52.82%)
   displ. norm   :     0.2206404 α      lambda       -0.3132259E-04
   maximum displ.:     0.1386730 α      in ANC's #4, #1, #2, ...

........................................................................
.............................. CYCLE   11 ..............................
........................................................................
   1    -40.7087324 -0.407087E+02  0.110E-01    3.02       0.0  T
   2    -40.7087334 -0.108767E-05  0.641E-02    3.02       1.0  T
   3    -40.7087303  0.313223E-05  0.137E-02    3.02       1.4  T
   4    -40.7087342 -0.385477E-05  0.403E-03    3.02       4.7  T
   5    -40.7087342 -0.800920E-07  0.961E-04    3.02      19.7  T
   6    -40.7087342 -0.366008E-08  0.595E-04    3.02      31.8  T
     SCC iter.                  ...        0 min,  0.008 sec
     gradient                   ...        0 min,  0.017 sec
 * total energy  :   -40.1216866 Eh     change       -0.2414497E-04 Eh
   gradient norm :     0.0023942 Eh/α   predicted    -0.1600051E-04 ( -33.73%)
   displ. norm   :     0.0645292 α      lambda       -0.1868104E-04
   maximum displ.:     0.0360670 α      in ANC's #1, #4, #2, ...

........................................................................
.............................. CYCLE   12 ..............................
........................................................................
   1    -40.7092730 -0.407093E+02  0.327E-02    3.02       0.0  T
   2    -40.7092732 -0.170533E-06  0.191E-02    3.02       1.0  T
   3    -40.7092730  0.189960E-06  0.413E-03    3.02       4.6  T
   4    -40.7092733 -0.267583E-06  0.169E-03    3.02      11.2  T
   5    -40.7092733 -0.154687E-07  0.653E-04    3.02      28.9  T
   6    -40.7092733 -0.612458E-08  0.248E-04    3.02      76.3  T
     SCC iter.                  ...        0 min,  0.008 sec
     gradient                   ...        0 min,  0.017 sec
 * total energy  :   -40.1217015 Eh     change       -0.1488981E-04 Eh
   gradient norm :     0.0015060 Eh/α   predicted    -0.9381251E-05 ( -37.00%)
   displ. norm   :     0.2386430 α      lambda       -0.3032715E-04
   maximum displ.:     0.1343070 α      in ANC's #1, #3, #2, ...

........................................................................
.............................. CYCLE   13 ..............................
........................................................................
   1    -40.7096693 -0.407097E+02  0.114E-01    3.01       0.0  T
   2    -40.7096708 -0.153323E-05  0.669E-02    3.01       1.0  T
   3    -40.7096673  0.350007E-05  0.152E-02    3.01       1.2  T
   4    -40.7096718 -0.447022E-05  0.464E-03    3.01       4.1  T
   5    -40.7096719 -0.817385E-07  0.165E-03    3.01      11.4  T
   6    -40.7096719 -0.280129E-07  0.769E-04    3.01      24.6  T
   7    -40.7096719 -0.154265E-08  0.398E-04    3.01      47.5  T
     SCC iter.                  ...        0 min,  0.009 sec
     gradient                   ...        0 min,  0.017 sec
 * total energy  :   -40.1217277 Eh     change       -0.2620193E-04 Eh
   gradient norm :     0.0012998 Eh/α   predicted    -0.1554806E-04 ( -40.66%)
   displ. norm   :     0.1008674 α      lambda       -0.1149265E-04
   maximum displ.:     0.0576238 α      in ANC's #3, #2, #1, ...

........................................................................
.............................. CYCLE   14 ..............................
........................................................................
   1    -40.7100794 -0.407101E+02  0.488E-02    3.02       0.0  T
   2    -40.7100799 -0.480981E-06  0.275E-02    3.02       1.0  T
   3    -40.7100796  0.272349E-06  0.604E-03    3.02       3.1  T
   4    -40.7100800 -0.399462E-06  0.311E-03    3.02       6.1  T
   5    -40.7100801 -0.798957E-07  0.774E-04    3.02      24.4  T
   6    -40.7100801 -0.965490E-08  0.326E-04    3.02      57.9  T
     SCC iter.                  ...        0 min,  0.008 sec
     gradient                   ...        0 min,  0.017 sec
 * total energy  :   -40.1217392 Eh     change       -0.1157761E-04 Eh
   gradient norm :     0.0010646 Eh/α   predicted    -0.5774441E-05 ( -50.12%)
   displ. norm   :     0.0879696 α      lambda       -0.9399038E-05
   maximum displ.:     0.0536788 α      in ANC's #3, #1, #2, ...

........................................................................
.............................. CYCLE   15 ..............................
........................................................................
   1    -40.7097620 -0.407098E+02  0.454E-02    3.01       0.0  T
   2    -40.7097625 -0.435029E-06  0.253E-02    3.01       1.0  T
   3    -40.7097624  0.935816E-07  0.485E-03    3.01       3.9  T
   4    -40.7097625 -0.138903E-06  0.295E-03    3.01       6.4  T
   5    -40.7097626 -0.117291E-06  0.597E-04    3.01      31.7  T
   6    -40.7097626 -0.538442E-08  0.283E-04    3.01      66.8  T
     SCC iter.                  ...        0 min,  0.008 sec
     gradient                   ...        0 min,  0.017 sec
 * total energy  :   -40.1217483 Eh     change       -0.9107350E-05 Eh
   gradient norm :     0.0010056 Eh/α   predicted    -0.4717509E-05 ( -48.20%)
   displ. norm   :     0.1150093 α      lambda       -0.8911259E-05
   maximum displ.:     0.0670123 α      in ANC's #3, #2, #1, ...

........................................................................
.............................. CYCLE   16 ..............................
........................................................................
   1    -40.7092850 -0.407093E+02  0.612E-02    3.01       0.0  T
   2    -40.7092859 -0.850930E-06  0.353E-02    3.01       1.0  T
   3    -40.7092852  0.668321E-06  0.823E-03    3.01       2.3  T
   4    -40.7092862 -0.980215E-06  0.396E-03    3.01       4.8  T
   5    -40.7092863 -0.133032E-06  0.108E-03    3.01      17.4  T
   6    -40.7092864 -0.124196E-07  0.541E-04    3.01      34.9  T
   7    -40.7092864 -0.175681E-08  0.306E-04    3.01      61.7  T
     SCC iter.                  ...        0 min,  0.009 sec
     gradient                   ...        0 min,  0.017 sec
 * total energy  :   -40.1217576 Eh     change       -0.9290042E-05 Eh
   gradient norm :     0.0016615 Eh/α   predicted    -0.4483906E-05 ( -51.73%)
   displ. norm   :     0.1158234 α      lambda       -0.1379285E-06
   maximum displ.:     0.0670119 α      in ANC's #3, #2, #1, ...

........................................................................
.............................. CYCLE   17 ..............................
........................................................................
   1    -40.7085808 -0.407086E+02  0.614E-02    3.01       0.0  T
   2    -40.7085817 -0.890421E-06  0.354E-02    3.01       1.0  T
   3    -40.7085810  0.654313E-06  0.824E-03    3.01       2.3  T
   4    -40.7085820 -0.961872E-06  0.399E-03    3.01       4.7  T
   5    -40.7085821 -0.137807E-06  0.114E-03    3.01      16.6  T
   6    -40.7085821 -0.134998E-07  0.549E-04    3.01      34.4  T
   7    -40.7085821 -0.190664E-08  0.316E-04    3.01      59.8  T
     SCC iter.                  ...        0 min,  0.009 sec
     gradient                   ...        0 min,  0.017 sec
 * total energy  :   -40.1217568 Eh     change        0.8545106E-06 Eh
   gradient norm :     0.0036055 Eh/α   predicted    -0.7435135E-07 (-108.70%)
   displ. norm   :     0.0400112 α      lambda       -0.1444883E-04
   maximum displ.:     0.0210585 α      in ANC's #2, #4, #3, ...

........................................................................
.............................. CYCLE   18 ..............................
........................................................................
   1    -40.7094476 -0.407094E+02  0.189E-02    3.02       0.0  T
   2    -40.7094477 -0.128340E-06  0.110E-02    3.02       1.7  T
   3    -40.7094475  0.141439E-06  0.316E-03    3.02       6.0  T
   4    -40.7094477 -0.181069E-06  0.105E-03    3.02      18.0  T
   5    -40.7094477 -0.801661E-08  0.513E-04    3.02      36.8  T
   6    -40.7094477 -0.265408E-08  0.171E-04    3.02     110.5  T
     SCC iter.                  ...        0 min,  0.008 sec
     gradient                   ...        0 min,  0.017 sec
 * total energy  :   -40.1217666 Eh     change       -0.9793627E-05 Eh
   gradient norm :     0.0018681 Eh/α   predicted    -0.7236967E-05 ( -26.11%)
   displ. norm   :     0.0720553 α      lambda       -0.1347613E-04
   maximum displ.:     0.0461212 α      in ANC's #1, #2, #9, ...

........................................................................
.............................. CYCLE   19 ..............................
........................................................................
   1    -40.7101550 -0.407102E+02  0.374E-02    3.02       0.0  T
   2    -40.7101554 -0.374233E-06  0.226E-02    3.02       1.0  T
   3    -40.7101552  0.164050E-06  0.443E-03    3.02       4.3  T
   4    -40.7101556 -0.360687E-06  0.164E-03    3.02      11.5  T
   5    -40.7101556 -0.702501E-08  0.101E-03    3.02      18.7  T
   6    -40.7101556 -0.132658E-07  0.348E-04    3.02      54.4  T
   7    -40.7101556 -0.395907E-09  0.168E-04    3.02     112.3  T
     SCC iter.                  ...        0 min,  0.009 sec
     gradient                   ...        0 min,  0.017 sec
 * total energy  :   -40.1217788 Eh     change       -0.1219805E-04 Eh
   gradient norm :     0.0014768 Eh/α   predicted    -0.6757392E-05 ( -44.60%)
   displ. norm   :     0.1503296 α      lambda       -0.1405182E-04
   maximum displ.:     0.0970815 α      in ANC's #1, #2, #9, ...

........................................................................
.............................. CYCLE   20 ..............................
........................................................................
   1    -40.7102571 -0.407103E+02  0.813E-02    3.02       0.0  T
   2    -40.7102584 -0.129039E-05  0.489E-02    3.02       1.0  T
   3    -40.7102571  0.137900E-05  0.108E-02    3.02       1.8  T
   4    -40.7102594 -0.232222E-05  0.367E-03    3.02       5.1  T
   5    -40.7102594 -0.409300E-07  0.144E-03    3.02      13.1  T
   6    -40.7102594 -0.217929E-07  0.719E-04    3.02      26.3  T
   7    -40.7102594 -0.213068E-08  0.341E-04    3.02      55.4  T
     SCC iter.                  ...        0 min,  0.009 sec
     gradient                   ...        0 min,  0.017 sec
 * total energy  :   -40.1217958 Eh     change       -0.1700948E-04 Eh
   gradient norm :     0.0013027 Eh/α   predicted    -0.7099175E-05 ( -58.26%)
   displ. norm   :     0.3847783 α      lambda       -0.2831149E-04
   maximum displ.:     0.2575907 α      in ANC's #1, #2, #3, ...
 * RMSD in coord.:     0.4152247 α      energy gain  -0.7087768E-02 Eh

generating ANC from model Hessian ...
Using Lindh-Hessian (1995)
 Shifting diagonal of input Hessian by   4.229802328740971E-003
 Lowest  eigenvalues of input Hessian
   -0.000000   -0.000000    0.000000    0.000000    0.000000    0.000000
    0.005000    0.006454    0.007010    0.008838    0.009706    0.010117
    0.011606    0.014440    0.016569    0.019861    0.023464    0.025881
 Highest eigenvalues
    1.519635    1.674311    1.829418    1.884857    2.021966    2.134660
 

........................................................................
.............................. CYCLE   21 ..............................
........................................................................
   1    -40.7074930 -0.407075E+02  0.203E-01    3.01       0.0  T
   2    -40.7075035 -0.105045E-04  0.122E-01    3.01       1.0  T
   3    -40.7074959  0.752705E-05  0.268E-02    3.01       1.0  T
   4    -40.7075093 -0.133537E-04  0.102E-02    3.01       1.9  T
   5    -40.7075099 -0.583690E-06  0.482E-03    3.01       3.9  T
   6    -40.7075101 -0.206501E-06  0.202E-03    3.01       9.4  T
   7    -40.7075101 -0.202840E-07  0.107E-03    3.01      17.6  T
   8    -40.7075101 -0.873115E-08  0.394E-04    3.01      48.0  T
   9    -40.7075101 -0.237591E-08  0.909E-05    3.01     208.0  T
     SCC iter.                  ...        0 min,  0.011 sec
     gradient                   ...        0 min,  0.017 sec
 * total energy  :   -40.1217883 Eh     change        0.7441936E-05 Eh
   gradient norm :     0.0077227 Eh/α   predicted     0.0000000E+00 (-100.00%)
   displ. norm   :     0.0244356 α      lambda       -0.6530916E-04
   maximum displ.:     0.0105232 α      in ANC's #1, #8, #5, ...

........................................................................
.............................. CYCLE   22 ..............................
........................................................................
   1    -40.7095372 -0.407095E+02  0.203E-02    3.02       0.0  T
   2    -40.7095382 -0.979758E-06  0.113E-02    3.02       1.7  T
   3    -40.7095381  0.103813E-06  0.516E-03    3.02       3.7  T
   4    -40.7095384 -0.283281E-06  0.155E-03    3.02      12.2  T
   5    -40.7095384 -0.702563E-08  0.928E-04    3.02      20.4  T
     SCC iter.                  ...        0 min,  0.007 sec
     gradient                   ...        0 min,  0.016 sec
 * total energy  :   -40.1218246 Eh     change       -0.3621541E-04 Eh
   gradient norm :     0.0010327 Eh/α   predicted    -0.3267419E-04 (  -9.78%)
   displ. norm   :     0.0201673 α      lambda       -0.4616247E-05
   maximum displ.:     0.0123431 α      in ANC's #5, #8, #9, ...

........................................................................
.............................. CYCLE   23 ..............................
........................................................................
   1    -40.7100764 -0.407101E+02  0.131E-02    3.02       0.0  T
   2    -40.7100765 -0.136816E-06  0.714E-03    3.02       2.6  T
   3    -40.7100765  0.165320E-07  0.198E-03    3.02       9.6  T
   4    -40.7100765 -0.381104E-07  0.906E-04    3.02      20.9  T
   5    -40.7100765 -0.222018E-08  0.453E-04    3.02      41.7  T
     SCC iter.                  ...        0 min,  0.007 sec
     gradient                   ...        0 min,  0.017 sec
 * total energy  :   -40.1218270 Eh     change       -0.2401483E-05 Eh
   gradient norm :     0.0010021 Eh/α   predicted    -0.2314882E-05 (  -3.61%)
   displ. norm   :     0.0132909 α      lambda       -0.1845256E-05
   maximum displ.:     0.0069374 α      in ANC's #1, #5, #2, ...

........................................................................
.............................. CYCLE   24 ..............................
........................................................................
   1    -40.7099235 -0.407099E+02  0.706E-03    3.02       0.0  T
   2    -40.7099235 -0.182837E-07  0.398E-03    3.02       4.7  T
   3    -40.7099235  0.244530E-08  0.785E-04    3.02      24.1  T
   4    -40.7099235 -0.500749E-08  0.374E-04    3.02      50.5  T
     SCC iter.                  ...        0 min,  0.006 sec
     gradient                   ...        0 min,  0.017 sec
 * total energy  :   -40.1218286 Eh     change       -0.1600369E-05 Eh
   gradient norm :     0.0004798 Eh/α   predicted    -0.9353649E-06 ( -41.55%)
   displ. norm   :     0.0169188 α      lambda       -0.1222770E-05
   maximum displ.:     0.0088285 α      in ANC's #1, #5, #2, ...

   *** GEOMETRY OPTIMIZATION CONVERGED AFTER 24 ITERATIONS ***

------------------------------------------------------------------------
 total energy gain   :        -0.0071205 Eh       -4.4682 kcal/mol
 total RMSD          :         0.4191997 a0        0.2218 Å
 total power (kW/mol):        -0.7789576 (step)  -21.2335 (real)
------------------------------------------------------------------------

 ANCopt (total)                0 d,  0 h,  0 min,  0.880 sec
 optimizer setup                ...        0 min,  0.000 sec (  0.016%)
 model hessian                  ...        0 min,  0.022 sec (  2.534%)
 ANC generation                 ...        0 min,  0.002 sec (  0.178%)
 coordinate transformation      ...        0 min,  0.000 sec (  0.051%)
 single point calculation       ...        0 min,  0.847 sec ( 96.227%)
 optimization log               ...        0 min,  0.003 sec (  0.297%)
 hessian update                 ...        0 min,  0.000 sec (  0.035%)
 rational function              ...        0 min,  0.004 sec (  0.474%)

================
 final structure:
================
$coord
    2.80737686129923   -2.50526782152398    0.26300277755272      C 
    5.13913170755248   -0.26289484389647    0.37470215054578      S 
    2.91011466841887    2.16811727270588    0.36147101243634      C 
    0.49630594440504    1.21228874701367    0.23477313268708      C 
    0.45052194220468   -1.47226033030378    0.15819584148208      C 
   -1.96005602336641   -2.95785111868563    0.00759046364486      C 
   -2.50127479701187   -3.95646629739731   -2.66019351587122      C 
   -4.55470550650213   -3.77069888405827   -3.61996317952206      O 
   -0.33216658855296   -5.25314719132336   -3.96666714951911      C 
   -4.17024864251422   -1.34680150534225    0.94806258125543      C 
   -4.18987968817462    1.17821308755674   -0.44018701563025      C 
   -1.87468824004794    2.75174700599914    0.25900296600641      C 
    3.88200680174767    4.70941760770231    0.47236312041348      C 
    2.62513566063569    6.82725100356412    0.97847743856548      C 
    3.32161986420666   -4.46429753421343    0.29749828604341      H 
   -1.77117668346440   -4.65649309145016    1.18481293252630      H 
    1.15748437286782   -3.89014040669567   -4.35165970407748      H 
   -0.98458598486140   -6.06374333748746   -5.73762349088684      H 
    0.44488583227999   -6.73275689489388   -2.77293505591790      H 
   -3.98393255433872   -1.03225197334190    2.97913396788349      H 
   -5.93377529282151   -2.35301827558205    0.59520506030897      H 
   -5.89753703946555    2.23105230981071    0.03683621411958      H 
   -4.21837423764978    0.82589305433571   -2.47074017805067      H 
   -2.12926596367582    3.52071740257667    2.16439063771054      H 
   -1.68611814329718    4.34534418504282   -1.04042785576527      H 
    5.89787941348087    4.82515066206459    0.13165563303412      H 
    0.64283073716857    6.87747935664833    1.40563275962006      H 
    3.59366788323587    8.61595009746442    1.00492533834192      H 
$end
           -------------------------------------------------
          |                Final Singlepoint                |
           -------------------------------------------------

          ...................................................
          :                      SETUP                      :
          :.................................................:
          :  # basis functions                  76          :
          :  # atomic orbitals                  75          :
          :  # shells                           43          :
          :  # electrons                        74          :
          :  max. iterations                   250          :
          :  Hamiltonian                  GFN2-xTB          :
          :  restarted?                      false          :
          :  GBSA solvation                  false          :
          :  PC potential                    false          :
          :  electronic temp.          300.0000000     K    :
          :  accuracy                    1.0000000          :
          :  -> integral cutoff          0.2500000E+02      :
          :  -> integral neglect         0.1000000E-07      :
          :  -> SCF convergence          0.1000000E-05 Eh   :
          :  -> wf. convergence          0.1000000E-03 e    :
          :  Broyden damping             0.4000000          :
          ...................................................

 iter      E             dE          RMSdq      gap      omega  full diag
   1    -40.7099235 -0.407099E+02  0.216E-04    3.02       0.0  T
   2    -40.7099235 -0.328129E-10  0.141E-04    3.02     134.4  T
   3    -40.7099235 -0.462393E-09  0.663E-05    3.02     285.0  T

   *** convergence criteria satisfied after 3 iterations ***

         #    Occupation            Energy/Eh            Energy/eV
      -------------------------------------------------------------
         1        2.0000           -0.7310041             -19.8916
       ...           ...                  ...                  ...
        31        2.0000           -0.4398364             -11.9686
        32        2.0000           -0.4362284             -11.8704
        33        2.0000           -0.4296229             -11.6906
        34        2.0000           -0.4227449             -11.5035
        35        2.0000           -0.4056402             -11.0380
        36        2.0000           -0.3855835             -10.4923
        37        2.0000           -0.3744610             -10.1896 (HOMO)
        38                         -0.2635189              -7.1707 (LUMO)
        39                         -0.2522413              -6.8638
        40                         -0.2056252              -5.5953
        41                         -0.1989316              -5.4132
        42                         -0.1489509              -4.0532
       ...                                ...                  ...
        75                          0.6808836              18.5278
      -------------------------------------------------------------
                  HL-Gap            0.1109422 Eh            3.0189 eV
             Fermi-level           -0.3189899 Eh           -8.6802 eV

 SCC (total)                   0 d,  0 h,  0 min,  0.032 sec
 SCC setup                      ...        0 min,  0.000 sec (  0.668%)
 Dispersion                     ...        0 min,  0.000 sec (  0.786%)
 integral evaluation            ...        0 min,  0.010 sec ( 30.995%)
 zeroth order Hamiltonian       ...        0 min,  0.000 sec (  0.572%)
 iterations                     ...        0 min,  0.005 sec ( 14.168%)
 molecular gradient             ...        0 min,  0.017 sec ( 51.615%)
 printout                       ...        0 min,  0.000 sec (  1.052%)

         :::::::::::::::::::::::::::::::::::::::::::::::::::::
         ::                     SUMMARY                     ::
         :::::::::::::::::::::::::::::::::::::::::::::::::::::
         :: total energy             -40.121828559720 Eh    ::
         :: gradient norm              0.000479803705 Eh/a0 ::
         :: HOMO-LUMO gap              3.018889658386 eV    ::
         ::.................................................::
         :: SCC energy               -40.709923521978 Eh    ::
         :: -> isotropic ES            0.027478323756 Eh    ::
         :: -> anisotropic ES          0.004076577680 Eh    ::
         :: -> anisotropic XC          0.018886669032 Eh    ::
         :: -> dispersion             -0.029502044026 Eh    ::
         :: repulsion energy           0.587784649381 Eh    ::
         :: add. restraining           0.000000000000 Eh    ::
         :::::::::::::::::::::::::::::::::::::::::::::::::::::

           -------------------------------------------------
          |                Property Printout                |
           -------------------------------------------------

    * Orbital Energies and Occupations

         #    Occupation            Energy/Eh            Energy/eV
      -------------------------------------------------------------
         1        2.0000           -0.7310041             -19.8916
       ...           ...                  ...                  ...
        25        2.0000           -0.4778156             -13.0020
        26        2.0000           -0.4750087             -12.9256
        27        2.0000           -0.4673028             -12.7160
        28        2.0000           -0.4624527             -12.5840
        29        2.0000           -0.4501991             -12.2505
        30        2.0000           -0.4458638             -12.1326
        31        2.0000           -0.4398364             -11.9686
        32        2.0000           -0.4362284             -11.8704
        33        2.0000           -0.4296229             -11.6906
        34        2.0000           -0.4227449             -11.5035
        35        2.0000           -0.4056402             -11.0380
        36        2.0000           -0.3855835             -10.4923
        37        2.0000           -0.3744610             -10.1896 (HOMO)
        38                         -0.2635189              -7.1707 (LUMO)
        39                         -0.2522413              -6.8638
        40                         -0.2056252              -5.5953
        41                         -0.1989316              -5.4132
        42                         -0.1489509              -4.0532
        43                         -0.1156582              -3.1472
        44                         -0.0044852              -0.1220
        45                          0.0308029               0.8382
        46                          0.0316912               0.8624
        47                          0.0564826               1.5370
        48                          0.0812517               2.2110
       ...                                ...                  ...
        75                          0.6808836              18.5278
      -------------------------------------------------------------
                  HL-Gap            0.1109422 Eh            3.0189 eV
             Fermi-level           -0.3189899 Eh           -8.6802 eV

     #   Z        covCN         q      C6AA      α(0)
     1   6 C      2.935    -0.035    28.874     8.813
     2  16 S      2.336    -0.054   143.283    20.146
     3   6 C      2.986     0.012    27.744     8.640
     4   6 C      3.148    -0.009    27.969     8.651
     5   6 C      3.161    -0.009    27.915     8.636
     6   6 C      3.858    -0.040    21.247     6.555
     7   6 C      2.812     0.242    22.961     7.851
     8   8 O      0.857    -0.351    20.728     6.104
     9   6 C      3.753    -0.139    23.227     6.872
    10   6 C      3.810    -0.052    21.507     6.601
    11   6 C      3.807    -0.055    21.551     6.609
    12   6 C      3.807    -0.054    21.538     6.607
    13   6 C      2.941    -0.030    28.748     8.794
    14   6 C      2.837    -0.094    30.352     9.028
    15   1 H      0.926     0.038     2.469     2.457
    16   1 H      0.923     0.053     2.286     2.364
    17   1 H      0.925     0.071     2.078     2.254
    18   1 H      0.925     0.069     2.102     2.267
    19   1 H      0.925     0.061     2.184     2.311
    20   1 H      0.924     0.034     2.524     2.485
    21   1 H      0.924     0.051     2.311     2.377
    22   1 H      0.924     0.034     2.534     2.489
    23   1 H      0.924     0.046     2.370     2.407
    24   1 H      0.924     0.043     2.410     2.428
    25   1 H      0.924     0.044     2.399     2.422
    26   1 H      0.925     0.042     2.428     2.437
    27   1 H      0.926     0.043     2.407     2.426
    28   1 H      0.926     0.040     2.448     2.447

 Mol. C6AA /au·bohr⁶  :       9606.240004
 Mol. C8AA /au·bohr⁸  :     251684.292613
 Mol. α(0) /au        :        153.481019


Wiberg/Mayer (AO) data.
largest (>0.10) Wiberg bond orders for each atom
          total WBO             WBO to atom ...
     1  C   3.946        C    5 1.571    S    2 1.195    H   15 0.969    C    3 0.102
     2  S   2.607        C    1 1.195    C    3 1.123
     3  C   3.944        C    4 1.502    C   13 1.134    S    2 1.123    C    1 0.102
     4  C   3.986        C    3 1.502    C    5 1.244    C   12 1.013
     5  C   3.983        C    1 1.571    C    4 1.244    C    6 0.989
     6  C   3.995        C   10 0.993    C    5 0.989    C    7 0.948    H   16 0.933
     7  C   3.914        O    8 1.874    C    9 1.007    C    6 0.948
     8  O   2.085        C    7 1.874
     9  C   3.994        C    7 1.007    H   18 0.982    H   19 0.965    H   17 0.956
    10  C   3.996        C   11 1.010    C    6 0.993    H   20 0.977    H   21 0.973
    11  C   3.996        C   10 1.010    C   12 1.004    H   22 0.977    H   23 0.976
    12  C   3.998        C    4 1.013    C   11 1.004    H   25 0.962    H   24 0.956
    13  C   3.991        C   14 1.862    C    3 1.134    H   26 0.963
    14  C   3.991        C   13 1.862    H   28 0.978    H   27 0.972
    15  H   0.998        C    1 0.969
    16  H   0.997        C    6 0.933
    17  H   0.995        C    9 0.956
    18  H   0.995        C    9 0.982
    19  H   0.996        C    9 0.965
    20  H   0.999        C   10 0.977
    21  H   0.996        C   10 0.973
    22  H   0.998        C   11 0.977
    23  H   0.998        C   11 0.976
    24  H   0.998        C   12 0.956
    25  H   0.998        C   12 0.962
    26  H   0.998        C   13 0.963
    27  H   0.998        C   14 0.972
    28  H   0.998        C   14 0.978

molecular dipole:
                 x           y           z       tot (Debye)
 q only:        0.451       0.040       0.380
   full:        0.421      -0.049       0.480       1.629
molecular quadrupole (traceless):
                xx          xy          yy          xz          yz          zz
 q only:       -5.717      -5.560       6.639      -7.173      -1.053      -0.922
  q+dip:       -8.935      -6.480      10.541      -8.965      -1.265      -1.606
   full:       -9.994      -6.111      10.572      -8.977      -1.861      -0.578

           -------------------------------------------------
          |                Geometry Summary                 |
           -------------------------------------------------

      molecular mass/u    :      206.3020000
   center of mass at/Å    :        0.1486395      -0.1293162      -0.2390022
  moments of inertia/u·Å² :        0.4982518E+03   0.1050179E+04   0.1395192E+04
rotational constants/cm⁻¹ :        0.3383356E-01   0.1605215E-01   0.1208266E-01

 * 25 selected distances

     #   Z        #   Z                                     value/Å
     1   6 C      2  16 S                                 1.7129161
     2  16 S      3   6 C                                 1.7453636 (max)
     3   6 C      4   6 C                                 1.3754673
     1   6 C      5   6 C                                 1.3628605
     4   6 C      5   6 C                                 1.4213867
     7   6 C      8   8 O                                 1.2034851
     6   6 C     10   6 C                                 1.5304955
    10   6 C     11   6 C                                 1.5248499
     4   6 C     12   6 C                                 1.4960031
    11   6 C     12   6 C                                 1.5268380
    13   6 C     14   6 C                                 1.3304463
     1   6 C     15   1 H                                 1.0719508 (min)
     6   6 C     16   1 H                                 1.0982070
     9   6 C     17   1 H                                 1.0877221
     9   6 C     18   1 H                                 1.0869414
     9   6 C     19   1 H                                 1.0868187
    10   6 C     20   1 H                                 1.0920693
    10   6 C     21   1 H                                 1.0905426
    11   6 C     22   1 H                                 1.0911983
    11   6 C     23   1 H                                 1.0906814
    12   6 C     24   1 H                                 1.0956177
    12   6 C     25   1 H                                 1.0926749
    13   6 C     26   1 H                                 1.0836147
    14   6 C     27   1 H                                 1.0733976
    14   6 C     28   1 H                                 1.0764822

 * 4 distinct bonds (by element types)

   Z      Z             #   av. dist./Å        max./Å        min./Å
   1 H    6 C          14     1.0869942     1.0982070     1.0719508
   6 C    6 C           8     1.4460434     1.5304955     1.3304463
   6 C    8 O           1     1.2034851     1.2034851     1.2034851
   6 C   16 S           2     1.7291399     1.7453636     1.7129161


optimized geometry written to: xtbopt.xyz


           -------------------------------------------------
          | TOTAL ENERGY              -40.121828559720 Eh   |
          | GRADIENT NORM               0.000479803705 Eh/α |
          | HOMO-LUMO GAP               3.018889658386 eV   |
           -------------------------------------------------

------------------------------------------------------------------------
 * finished run on 2021/05/19 at 11:00:08.840     
------------------------------------------------------------------------
 total:
 * wall-time:     0 d,  0 h,  0 min,  1.031 sec
 *  cpu-time:     0 d,  0 h,  0 min,  0.981 sec
 * ratio c/w:     0.952 speedup
 SCF:
 * wall-time:     0 d,  0 h,  0 min,  0.083 sec
 *  cpu-time:     0 d,  0 h,  0 min,  0.046 sec
 * ratio c/w:     0.555 speedup
 ANC optimizer:
 * wall-time:     0 d,  0 h,  0 min,  0.913 sec
 *  cpu-time:     0 d,  0 h,  0 min,  0.913 sec
 * ratio c/w:     1.000 speedup

