      -----------------------------------------------------------      
     |                   =====================                   |     
     |                           x T B                           |     
     |                   =====================                   |     
     |                         S. Grimme                         |     
     |          Mulliken Center for Theoretical Chemistry        |     
     |                    University of Bonn                     |     
     |                Version 6.2 RC2 (SAW190805)                |     
      -----------------------------------------------------------      

   This program is distributed in the hope that it will be useful,
   but WITHOUT ANY WARRANTY; without even the implied warranty of
   MERCHANTABILITY or FITNESS FOR A PARTICULAR PURPOSE.
   
   FOR NON-COMMERCIAL, ACADEMIA USE ONLY.
   
   Cite this work as:
   * S. Grimme, C. Bannwarth, P. Shushkov, J. Chem. Theory Comput., 2017,
     13, 1989-2009. DOI: 10.1021/acs.jctc.7b00118
   * C. Bannwarth, S. Ehlert and S. Grimme., J. Chem. Theory Comput., 2019,
     15, 1652-1671. DOI: 10.1021/acs.jctc.8b01176
   * P. Pracht, E. Caldeweyher, S. Ehlert, S. Grimme, ChemRxiv, 2019, preprint.
     DOI: 10.26434/chemrxiv.8326202.v1
   
   for DFT-D4:
   * E. Caldeweyher, C. Bannwarth and S. Grimme, J. Chem. Phys., 2017,
     147, 034112. DOI: 10.1063/1.4993215
   * E. Caldeweyher, S. Ehlert, A. Hansen, H. Neugebauer, S. Spicher,
     C. Bannwarth and S. Grimme, J. Chem. Phys., 2019, 150, 154122.
     DOI: 10.1063/1.5090222
   
   for sTDA-xTB:
   * S. Grimme and C. Bannwarth, J. Chem. Phys., 2016, 145, 054103.
     DOI: 10.1063/1.4959605
   
   in the mass-spec context:
   * V. Asgeirsson, C. Bauer and S. Grimme, Chem. Sci., 2017, 8, 4879.
     DOI: 10.1039/c7sc00601b
   
   for metadynamics refer to:
   * S. Grimme, J. Chem. Theory Comput., 2019, 155, 2847-2862
     DOI: 10.1021/acs.jctc.9b00143
   
   with help from (in alphabetical order)
   C. Bannwarth, F. Bohle, G. Brandenburg, E. Caldeweyher, M. Checinski,
   S. Dohm, S. Ehlert, S. Ehrlich, F. März, H. Neugebauer, J. Pisarek,
   P. Pracht, P. Shushkov, and S. Spicher.
   
 * started run on 2021/05/19 at 10:59:15.608     

           -------------------------------------------------
          |                Calculation Setup                |
           -------------------------------------------------

          program call               : /ihome/ghutchison/geoffh/xtb/xtb 409.xyz -opt
          hostname                   : smp-n126
          coordinate file            : 409.xyz
          omp threads                :                     1
          number of atoms            :                    15
          number of electrons        :                    44
          charge                     :                     0
          spin                       :                   0.0
          first test random number   :      0.37953955878544


########################################################################
# WARNING! Please study the warnings concerning your input carefully
#  - the use of '-opt' is discouraged, please use '--opt' next time
########################################################################

           ------------------------------------------------- 
          |                 G F N 2 - x T B                 |
          | Geometry, Frequencies, Noncovalent interactions |
          |            JCTC 2019 parametrisation            |
           ------------------------------------------------- 
             KAB for C  - Si     :                1.0500
             KAB for H  - Pd     :                0.9500
             k(s)              :                1.8500
             k(p)              :                2.2300
             k(d)              :                2.2300
             k(f)              :                2.0000
             kEN (H0ij)        :               -2.0000
             D4 a1             :                0.5200
             D4 a2             :                5.0000
             D4 s6             :                1.0000
             D4 s8             :                2.7000
             D4 s9             :                5.0000
             alphaj            :                2.0000

  Z AO/shell   Hii/eV     exponent
  1     Wed Apr 25 08:07:45 CEST 2018   EN: 2.200 GM2: 0.406  GM3: 0.0800  RAES: 1.40
     1s    -10.707211    1.230000
  6     Wed Apr 25 08:07:45 CEST 2018   EN: 2.550 GM2: 0.538  GM3: 0.1500  RAES: 3.00
     2s    -13.970922    2.096432
     2p    -10.063292    1.800000
 16     Tue Apr 24 11:44:34 CEST 2018   EN: 2.580 GM2: 0.340  GM3:-0.0502  RAES: 3.10
     3s    -20.029654    1.981333
     3p    -11.377694    2.025643
     3d     -0.420282    1.702555

           ------------------------------------------------- 
          |        Self-Consistent Charge Iterations        |
           ------------------------------------------------- 

          ...................................................
          :                      SETUP                      :
          :.................................................:
          :  # basis functions                  48          :
          :  # atomic orbitals                  47          :
          :  # shells                           25          :
          :  # electrons                        44          :
          :  max. iterations                   250          :
          :  Hamiltonian                  GFN2-xTB          :
          :  restarted?                      false          :
          :  GBSA solvation                  false          :
          :  PC potential                    false          :
          :  electronic temp.          300.0000000     K    :
          :  accuracy                    1.0000000          :
          :  -> integral cutoff          0.2500000E+02      :
          :  -> integral neglect         0.1000000E-07      :
          :  -> SCF convergence          0.1000000E-05 Eh   :
          :  -> wf. convergence          0.1000000E-03 e    :
          :  Broyden damping             0.4000000          :
          ...................................................

 iter      E             dE          RMSdq      gap      omega  full diag
   1    -23.7624875 -0.237625E+02  0.455E+00    2.18       0.0  T
   2    -23.7708725 -0.838501E-02  0.269E+00    2.23       1.0  T
   3    -23.7692759  0.159661E-02  0.648E-01    2.18       1.0  T
   4    -23.7715490 -0.227309E-02  0.253E-01    2.20       1.0  T
   5    -23.7720278 -0.478872E-03  0.114E-01    2.20       1.0  T
   6    -23.7721369 -0.109028E-03  0.396E-02    2.20       1.0  T
   7    -23.7721494 -0.125827E-04  0.176E-02    2.20       1.5  T
   8    -23.7721500 -0.572952E-06  0.462E-03    2.20       5.6  T
   9    -23.7721500  0.178312E-08  0.140E-03    2.20      18.5  T
  10    -23.7721500 -0.137032E-07  0.397E-04    2.20      65.1  T
  11    -23.7721500 -0.245635E-10  0.187E-04    2.20     138.3  T

   *** convergence criteria satisfied after 11 iterations ***

         #    Occupation            Energy/Eh            Energy/eV
      -------------------------------------------------------------
         1        2.0000           -0.7320818             -19.9210
       ...           ...                  ...                  ...
        16        2.0000           -0.4448213             -12.1042
        17        2.0000           -0.4447385             -12.1020
        18        2.0000           -0.4339860             -11.8094
        19        2.0000           -0.4275343             -11.6338
        20        2.0000           -0.4268408             -11.6149
        21        2.0000           -0.3950462             -10.7498
        22        2.0000           -0.3602790              -9.8037 (HOMO)
        23                         -0.2792966              -7.6000 (LUMO)
        24                         -0.2028030              -5.5186
        25                         -0.2001276              -5.4457
        26                         -0.1957569              -5.3268
        27                         -0.1189593              -3.2370
       ...                                ...                  ...
        47                          0.7512876              20.4436
      -------------------------------------------------------------
                  HL-Gap            0.0809825 Eh            2.2036 eV
             Fermi-level           -0.3197878 Eh           -8.7019 eV

 SCC (total)                   0 d,  0 h,  0 min,  0.033 sec
 SCC setup                      ...        0 min,  0.000 sec (  0.672%)
 Dispersion                     ...        0 min,  0.000 sec (  0.570%)
 integral evaluation            ...        0 min,  0.004 sec ( 13.591%)
 zeroth order Hamiltonian       ...        0 min,  0.000 sec (  0.278%)
 iterations                     ...        0 min,  0.008 sec ( 23.289%)
 molecular gradient             ...        0 min,  0.020 sec ( 60.674%)
 printout                       ...        0 min,  0.000 sec (  0.779%)

         :::::::::::::::::::::::::::::::::::::::::::::::::::::
         ::                     SUMMARY                     ::
         :::::::::::::::::::::::::::::::::::::::::::::::::::::
         :: total energy             -23.390347715756 Eh    ::
         :: gradient norm              0.105191074103 Eh/a0 ::
         :: HOMO-LUMO gap              2.203645137493 eV    ::
         ::.................................................::
         :: SCC energy               -23.772150022085 Eh    ::
         :: -> isotropic ES            0.000913496511 Eh    ::
         :: -> anisotropic ES          0.002008769605 Eh    ::
         :: -> anisotropic XC          0.013990894434 Eh    ::
         :: -> dispersion             -0.014877152516 Eh    ::
         :: repulsion energy           0.381768898782 Eh    ::
         :: add. restraining           0.000000000000 Eh    ::
         :::::::::::::::::::::::::::::::::::::::::::::::::::::

      ----------------------------------------------------------- 
     |                   =====================                   |
     |                        A N C O P T                        |
     |                   =====================                   |
     |               Approximate Normal Coordinate               |
     |                Rational Function Optimizer                |
      ----------------------------------------------------------- 

          ...................................................
          :                      SETUP                      :
          :.................................................:
          :   optimization level            normal          :
          :   max. optcycles                   200          :
          :   ANC micro-cycles                  20          :
          :   degrees of freedom                39          :
          :.................................................:
          :   RF solver                   davidson          :
          :   input Hessian                  false          :
          :   write xtbopt.log                true          :
          :   linear?                        false          :
          :   energy convergence         0.5000000E-05 Eh   :
          :   grad. convergence          0.1000000E-02 Eh/α :
          :   maximium RF displ.         2.0000000          :
          :   Hlow (freq-cutoff)         0.5000000E-02      :
          :   Hmax (freq-cutoff)         5.0000000          :
          :   S6 in model hess.         20.0000000          :
          ...................................................

generating ANC from model Hessian ...
Using Lindh-Hessian (1995)
 Shifting diagonal of input Hessian by   0.000000000000000E+000
 Lowest  eigenvalues of input Hessian
   -0.000000   -0.000000   -0.000000    0.000000    0.000000    0.000000
    0.007169    0.008337    0.017803    0.018708    0.021242    0.038660
    0.045067    0.062957    0.064683    0.079350    0.085414    0.086065
 Highest eigenvalues
    1.537587    1.639407    1.709267    1.846469    1.968783    2.047829
 

........................................................................
.............................. CYCLE    1 ..............................
........................................................................
   1    -23.7721500 -0.237722E+02  0.212E-05    2.20       0.0  T
   2    -23.7721500 -0.142109E-12  0.115E-05    2.20    2248.1  T
   3    -23.7721500  0.401457E-12  0.745E-06    2.20    3466.4  T
     SCC iter.                  ...        0 min,  0.002 sec
     gradient                   ...        0 min,  0.007 sec
 * total energy  :   -23.3903477 Eh     change        0.1001768E-07 Eh
   gradient norm :     0.1051918 Eh/α   predicted     0.0000000E+00 (-100.00%)
   displ. norm   :     0.2958573 α      lambda       -0.1736207E-01
   maximum displ.:     0.1871233 α      in ANC's #9, #16, #18, ...

........................................................................
.............................. CYCLE    2 ..............................
........................................................................
   1    -23.8014664 -0.238015E+02  0.301E-01    2.31       0.0  T
   2    -23.8015829 -0.116503E-03  0.188E-01    2.30       1.0  T
   3    -23.8015741  0.880290E-05  0.103E-01    2.31       1.0  T
   4    -23.8016522 -0.780858E-04  0.241E-02    2.31       1.1  T
   5    -23.8016571 -0.490842E-05  0.761E-03    2.31       3.4  T
   6    -23.8016573 -0.277073E-06  0.359E-03    2.31       7.2  T
   7    -23.8016574 -0.651740E-07  0.107E-03    2.31      24.2  T
     SCC iter.                  ...        0 min,  0.004 sec
     gradient                   ...        0 min,  0.007 sec
 * total energy  :   -23.4022033 Eh     change       -0.1185563E-01 Eh
   gradient norm :     0.0498528 Eh/α   predicted    -0.9440896E-02 ( -20.37%)
   displ. norm   :     0.1594857 α      lambda       -0.4247323E-02
   maximum displ.:     0.1045573 α      in ANC's #16, #9, #14, ...

........................................................................
.............................. CYCLE    3 ..............................
........................................................................
   1    -23.8131676 -0.238132E+02  0.223E-01    2.42       0.0  T
   2    -23.8132223 -0.547062E-04  0.134E-01    2.41       1.0  T
   3    -23.8132144  0.788724E-05  0.730E-02    2.42       1.0  T
   4    -23.8132555 -0.411075E-04  0.137E-02    2.41       1.9  T
   5    -23.8132562 -0.657541E-06  0.591E-03    2.41       4.4  T
   6    -23.8132564 -0.171224E-06  0.199E-03    2.41      13.0  T
     SCC iter.                  ...        0 min,  0.004 sec
     gradient                   ...        0 min,  0.020 sec
 * total energy  :   -23.4044434 Eh     change       -0.2240100E-02 Eh
   gradient norm :     0.0109057 Eh/α   predicted    -0.2177678E-02 (  -2.79%)
   displ. norm   :     0.0348345 α      lambda       -0.1810057E-03
   maximum displ.:     0.0294481 α      in ANC's #14, #12, #18, ...

........................................................................
.............................. CYCLE    4 ..............................
........................................................................
   1    -23.8113181 -0.238113E+02  0.403E-02    2.42       0.0  T
   2    -23.8113191 -0.991048E-06  0.229E-02    2.42       1.1  T
   3    -23.8113184  0.782076E-06  0.132E-02    2.42       2.0  T
   4    -23.8113199 -0.154458E-05  0.236E-03    2.42      10.9  T
   5    -23.8113199  0.701754E-08  0.125E-03    2.42      20.7  T
     SCC iter.                  ...        0 min,  0.003 sec
     gradient                   ...        0 min,  0.020 sec
 * total energy  :   -23.4045552 Eh     change       -0.1117843E-03 Eh
   gradient norm :     0.0038155 Eh/α   predicted    -0.9061156E-04 ( -18.94%)
   displ. norm   :     0.0130568 α      lambda       -0.2220526E-04
   maximum displ.:     0.0091101 α      in ANC's #14, #9, #18, ...

........................................................................
.............................. CYCLE    5 ..............................
........................................................................
   1    -23.8110911 -0.238111E+02  0.163E-02    2.43       0.0  T
   2    -23.8110912 -0.138485E-06  0.850E-03    2.43       3.0  T
   3    -23.8110911  0.110044E-06  0.475E-03    2.43       5.4  T
   4    -23.8110913 -0.193532E-06  0.113E-03    2.43      22.9  T
   5    -23.8110913 -0.773671E-09  0.509E-04    2.43      50.7  T
   6    -23.8110913 -0.169387E-08  0.165E-04    2.43     156.5  T
     SCC iter.                  ...        0 min,  0.017 sec
     gradient                   ...        0 min,  0.007 sec
 * total energy  :   -23.4045671 Eh     change       -0.1189680E-04 Eh
   gradient norm :     0.0008462 Eh/α   predicted    -0.1110384E-04 (  -6.67%)
   displ. norm   :     0.0065132 α      lambda       -0.1304883E-05
   maximum displ.:     0.0037346 α      in ANC's #5, #3, #7, ...

........................................................................
.............................. CYCLE    6 ..............................
........................................................................
   1    -23.8111962 -0.238112E+02  0.170E-02    2.43       0.0  T
   2    -23.8111963 -0.992851E-07  0.791E-03    2.43       3.3  T
   3    -23.8111963 -0.128893E-07  0.151E-03    2.43      17.1  T
   4    -23.8111963 -0.623224E-09  0.834E-04    2.43      31.0  T
   5    -23.8111963 -0.108754E-08  0.407E-04    2.43      63.4  T
     SCC iter.                  ...        0 min,  0.016 sec
     gradient                   ...        0 min,  0.007 sec
 * total energy  :   -23.4045676 Eh     change       -0.4574269E-06 Eh
   gradient norm :     0.0003924 Eh/α   predicted    -0.6527800E-06 (  42.71%)
   displ. norm   :     0.0046664 α      lambda       -0.6096788E-06
   maximum displ.:     0.0027441 α      in ANC's #5, #3, #7, ...

   *** GEOMETRY OPTIMIZATION CONVERGED AFTER 6 ITERATIONS ***

------------------------------------------------------------------------
 total energy gain   :        -0.0142199 Eh       -8.9231 kcal/mol
 total RMSD          :         0.1165811 a0        0.0617 Å
 total power (kW/mol):        -6.2223727 (step) -201.0329 (real)
------------------------------------------------------------------------

 ANCopt (total)                0 d,  0 h,  0 min,  0.186 sec
 optimizer setup                ...        0 min,  0.000 sec (  0.060%)
 model hessian                  ...        0 min,  0.001 sec (  0.796%)
 ANC generation                 ...        0 min,  0.000 sec (  0.191%)
 coordinate transformation      ...        0 min,  0.000 sec (  0.039%)
 single point calculation       ...        0 min,  0.169 sec ( 90.867%)
 optimization log               ...        0 min,  0.000 sec (  0.222%)
 hessian update                 ...        0 min,  0.000 sec (  0.032%)
 rational function              ...        0 min,  0.014 sec (  7.556%)

================
 final structure:
================
$coord
   -2.89464676148873    2.32958030316299    0.30158790329932      C 
   -0.48820495431425    1.36088087255330    0.13602273540472      C 
   -0.48820495494875   -1.36088087993603    0.13602273519367      C 
    1.83889723255245   -2.67613484785204   -0.02455126557734      C 
    4.02776837178642   -1.33969354993847   -0.17581487132169      C 
    4.02776837377899    1.33969355912368   -0.17581487342989      C 
    1.83889722620268    2.67613484220549   -0.02455126591482      C 
   -2.89464677195668   -2.32958031679226    0.30158790275613      C 
   -5.12185646724195    0.00000002467482    0.45874600495369      S 
   -3.46320481181282    4.27273155118452    0.34020332150424      H 
    1.83000788174411   -4.71697286831151   -0.02443704374825      H 
    5.81681806441100   -2.31437397519778   -0.30057925117821      H 
    5.81681806688722    2.31437398310127   -0.30057925272121      H 
    1.83000786847980    4.71697286359639   -0.02443704369808      H 
   -3.46320482680088   -4.27273156157437    0.34020332054335      H 
$end
           -------------------------------------------------
          |                Final Singlepoint                |
           -------------------------------------------------

          ...................................................
          :                      SETUP                      :
          :.................................................:
          :  # basis functions                  48          :
          :  # atomic orbitals                  47          :
          :  # shells                           25          :
          :  # electrons                        44          :
          :  max. iterations                   250          :
          :  Hamiltonian                  GFN2-xTB          :
          :  restarted?                      false          :
          :  GBSA solvation                  false          :
          :  PC potential                    false          :
          :  electronic temp.          300.0000000     K    :
          :  accuracy                    1.0000000          :
          :  -> integral cutoff          0.2500000E+02      :
          :  -> integral neglect         0.1000000E-07      :
          :  -> SCF convergence          0.1000000E-05 Eh   :
          :  -> wf. convergence          0.1000000E-03 e    :
          :  Broyden damping             0.4000000          :
          ...................................................

 iter      E             dE          RMSdq      gap      omega  full diag
   1    -23.8111963 -0.238112E+02  0.155E-04    2.43       0.0  T
   2    -23.8111963 -0.121254E-10  0.885E-05    2.43     291.8  T
   3    -23.8111963  0.144063E-10  0.522E-05    2.43     494.9  T

   *** convergence criteria satisfied after 3 iterations ***

         #    Occupation            Energy/Eh            Energy/eV
      -------------------------------------------------------------
         1        2.0000           -0.7344361             -19.9850
       ...           ...                  ...                  ...
        16        2.0000           -0.4526234             -12.3165
        17        2.0000           -0.4510502             -12.2737
        18        2.0000           -0.4354904             -11.8503
        19        2.0000           -0.4239802             -11.5371
        20        2.0000           -0.4216512             -11.4737
        21        2.0000           -0.3973355             -10.8120
        22        2.0000           -0.3644332              -9.9167 (HOMO)
        23                         -0.2752078              -7.4888 (LUMO)
        24                         -0.1981288              -5.3914
        25                         -0.1974482              -5.3728
        26                         -0.1947681              -5.2999
        27                         -0.1159495              -3.1551
       ...                                ...                  ...
        47                          0.7463648              20.3096
      -------------------------------------------------------------
                  HL-Gap            0.0892254 Eh            2.4279 eV
             Fermi-level           -0.3198205 Eh           -8.7028 eV

 SCC (total)                   0 d,  0 h,  0 min,  0.027 sec
 SCC setup                      ...        0 min,  0.000 sec (  0.601%)
 Dispersion                     ...        0 min,  0.000 sec (  0.350%)
 integral evaluation            ...        0 min,  0.017 sec ( 63.696%)
 zeroth order Hamiltonian       ...        0 min,  0.000 sec (  0.324%)
 iterations                     ...        0 min,  0.002 sec (  8.678%)
 molecular gradient             ...        0 min,  0.007 sec ( 25.386%)
 printout                       ...        0 min,  0.000 sec (  0.800%)

         :::::::::::::::::::::::::::::::::::::::::::::::::::::
         ::                     SUMMARY                     ::
         :::::::::::::::::::::::::::::::::::::::::::::::::::::
         :: total energy             -23.404567556981 Eh    ::
         :: gradient norm              0.000393846038 Eh/a0 ::
         :: HOMO-LUMO gap              2.427946926541 eV    ::
         ::.................................................::
         :: SCC energy               -23.811196283655 Eh    ::
         :: -> isotropic ES            0.000898664668 Eh    ::
         :: -> anisotropic ES          0.002215182425 Eh    ::
         :: -> anisotropic XC          0.012789930980 Eh    ::
         :: -> dispersion             -0.014876917409 Eh    ::
         :: repulsion energy           0.406597146256 Eh    ::
         :: add. restraining           0.000000000000 Eh    ::
         :::::::::::::::::::::::::::::::::::::::::::::::::::::

           -------------------------------------------------
          |                Property Printout                |
           -------------------------------------------------

    * Orbital Energies and Occupations

         #    Occupation            Energy/Eh            Energy/eV
      -------------------------------------------------------------
         1        2.0000           -0.7344361             -19.9850
       ...           ...                  ...                  ...
        10        2.0000           -0.5090737             -13.8526
        11        2.0000           -0.5084295             -13.8351
        12        2.0000           -0.4959165             -13.4946
        13        2.0000           -0.4836634             -13.1612
        14        2.0000           -0.4730100             -12.8713
        15        2.0000           -0.4729628             -12.8700
        16        2.0000           -0.4526234             -12.3165
        17        2.0000           -0.4510502             -12.2737
        18        2.0000           -0.4354904             -11.8503
        19        2.0000           -0.4239802             -11.5371
        20        2.0000           -0.4216512             -11.4737
        21        2.0000           -0.3973355             -10.8120
        22        2.0000           -0.3644332              -9.9167 (HOMO)
        23                         -0.2752078              -7.4888 (LUMO)
        24                         -0.1981288              -5.3914
        25                         -0.1974482              -5.3728
        26                         -0.1947681              -5.2999
        27                         -0.1159495              -3.1551
        28                         -0.0854655              -2.3256
        29                          0.0000785               0.0021
        30                          0.0274016               0.7456
        31                          0.0388703               1.0577
        32                          0.1070861               2.9140
        33                          0.1324733               3.6048
       ...                                ...                  ...
        47                          0.7463648              20.3096
      -------------------------------------------------------------
                  HL-Gap            0.0892254 Eh            2.4279 eV
             Fermi-level           -0.3198205 Eh           -8.7028 eV

     #   Z        covCN         q      C6AA      α(0)
     1   6 C      2.929    -0.037    28.931     8.821
     2   6 C      3.180     0.001    27.573     8.572
     3   6 C      3.180     0.001    27.573     8.572
     4   6 C      2.908    -0.035    28.861     8.809
     5   6 C      2.916    -0.030    28.761     8.794
     6   6 C      2.916    -0.030    28.761     8.794
     7   6 C      2.908    -0.035    28.861     8.809
     8   6 C      2.929    -0.037    28.931     8.821
     9  16 S      2.307     0.006   140.829    19.973
    10   1 H      0.926     0.041     2.429     2.437
    11   1 H      0.926     0.028     2.615     2.529
    12   1 H      0.926     0.029     2.597     2.520
    13   1 H      0.926     0.029     2.597     2.520
    14   1 H      0.926     0.028     2.615     2.529
    15   1 H      0.926     0.041     2.429     2.437

 Mol. C6AA /au·bohr⁶  :       4114.210992
 Mol. C8AA /au·bohr⁸  :     119702.150542
 Mol. α(0) /au        :        104.938430


Wiberg/Mayer (AO) data.
largest (>0.10) Wiberg bond orders for each atom
          total WBO             WBO to atom ...
     1  C   3.939        C    2 1.468    S    9 1.240    H   10 0.971    C    8 0.157
     2  C   3.988        C    1 1.468    C    7 1.216    C    3 1.154
     3  C   3.988        C    8 1.468    C    4 1.216    C    2 1.154
     4  C   3.992        C    5 1.618    C    3 1.216    H   11 0.969    C    7 0.120
     5  C   3.993        C    4 1.618    C    6 1.258    H   12 0.971
     6  C   3.993        C    7 1.618    C    5 1.258    H   13 0.971
     7  C   3.992        C    6 1.618    C    2 1.216    H   14 0.969    C    4 0.120
     8  C   3.939        C    3 1.468    S    9 1.240    H   15 0.971    C    1 0.157
     9  S   2.736        C    1 1.240    C    8 1.240
    10  H   0.998        C    1 0.971
    11  H   0.999        C    4 0.969
    12  H   0.998        C    5 0.971
    13  H   0.998        C    6 0.971
    14  H   0.999        C    7 0.969
    15  H   0.998        C    8 0.971

molecular dipole:
                 x           y           z       tot (Debye)
 q only:       -0.030       0.000       0.002
   full:        0.187       0.000      -0.013       0.476
molecular quadrupole (traceless):
                xx          xy          yy          xz          yz          zz
 q only:        0.420      -0.000       1.333      -0.156       0.000      -1.753
  q+dip:       -0.151      -0.000       5.294      -0.319       0.000      -5.143
   full:       -1.721      -0.000       4.174      -0.024       0.000      -2.453

           -------------------------------------------------
          |                Geometry Summary                 |
           -------------------------------------------------

      molecular mass/u    :      134.1954000
   center of mass at/Å    :       -0.3789828       0.0000000       0.0805903
  moments of inertia/u·Å² :        0.1351017E+03   0.4359284E+03   0.5710300E+03
rotational constants/cm⁻¹ :        0.1247774E+00   0.3867064E-01   0.2952145E-01

 * 16 selected distances

     #   Z        #   Z                                     value/Å
     1   6 C      2   6 C                                 1.3755304
     2   6 C      3   6 C                                 1.4402944
     3   6 C      4   6 C                                 1.4170772
     4   6 C      5   6 C                                 1.3594926
     5   6 C      6   6 C                                 1.4178707
     2   6 C      7   6 C                                 1.4170772
     6   6 C      7   6 C                                 1.3594926
     3   6 C      8   6 C                                 1.3755304
     1   6 C      9  16 S                                 1.7075383
     8   6 C      9  16 S                                 1.7075384 (max)
     1   6 C     10   1 H                                 1.0715789
     4   6 C     11   1 H                                 1.0799753
     5   6 C     12   1 H                                 1.0801267
     6   6 C     13   1 H                                 1.0801267
     7   6 C     14   1 H                                 1.0799753
     8   6 C     15   1 H                                 1.0715789 (min)

 * 3 distinct bonds (by element types)

   Z      Z             #   av. dist./Å        max./Å        min./Å
   1 H    6 C           6     1.0772270     1.0801267     1.0715789
   6 C    6 C           8     1.3952957     1.4402944     1.3594926
   6 C   16 S           2     1.7075384     1.7075384     1.7075383


optimized geometry written to: xtbopt.xyz


           -------------------------------------------------
          | TOTAL ENERGY              -23.404567556981 Eh   |
          | GRADIENT NORM               0.000393846038 Eh/α |
          | HOMO-LUMO GAP               2.427946926541 eV   |
           -------------------------------------------------

------------------------------------------------------------------------
 * finished run on 2021/05/19 at 10:59:15.915     
------------------------------------------------------------------------
 total:
 * wall-time:     0 d,  0 h,  0 min,  0.306 sec
 *  cpu-time:     0 d,  0 h,  0 min,  0.144 sec
 * ratio c/w:     0.472 speedup
 SCF:
 * wall-time:     0 d,  0 h,  0 min,  0.033 sec
 *  cpu-time:     0 d,  0 h,  0 min,  0.020 sec
 * ratio c/w:     0.607 speedup
 ANC optimizer:
 * wall-time:     0 d,  0 h,  0 min,  0.213 sec
 *  cpu-time:     0 d,  0 h,  0 min,  0.109 sec
 * ratio c/w:     0.511 speedup

