      -----------------------------------------------------------      
     |                   =====================                   |     
     |                           x T B                           |     
     |                   =====================                   |     
     |                         S. Grimme                         |     
     |          Mulliken Center for Theoretical Chemistry        |     
     |                    University of Bonn                     |     
     |                Version 6.2 RC2 (SAW190805)                |     
      -----------------------------------------------------------      

   This program is distributed in the hope that it will be useful,
   but WITHOUT ANY WARRANTY; without even the implied warranty of
   MERCHANTABILITY or FITNESS FOR A PARTICULAR PURPOSE.
   
   FOR NON-COMMERCIAL, ACADEMIA USE ONLY.
   
   Cite this work as:
   * S. Grimme, C. Bannwarth, P. Shushkov, J. Chem. Theory Comput., 2017,
     13, 1989-2009. DOI: 10.1021/acs.jctc.7b00118
   * C. Bannwarth, S. Ehlert and S. Grimme., J. Chem. Theory Comput., 2019,
     15, 1652-1671. DOI: 10.1021/acs.jctc.8b01176
   * P. Pracht, E. Caldeweyher, S. Ehlert, S. Grimme, ChemRxiv, 2019, preprint.
     DOI: 10.26434/chemrxiv.8326202.v1
   
   for DFT-D4:
   * E. Caldeweyher, C. Bannwarth and S. Grimme, J. Chem. Phys., 2017,
     147, 034112. DOI: 10.1063/1.4993215
   * E. Caldeweyher, S. Ehlert, A. Hansen, H. Neugebauer, S. Spicher,
     C. Bannwarth and S. Grimme, J. Chem. Phys., 2019, 150, 154122.
     DOI: 10.1063/1.5090222
   
   for sTDA-xTB:
   * S. Grimme and C. Bannwarth, J. Chem. Phys., 2016, 145, 054103.
     DOI: 10.1063/1.4959605
   
   in the mass-spec context:
   * V. Asgeirsson, C. Bauer and S. Grimme, Chem. Sci., 2017, 8, 4879.
     DOI: 10.1039/c7sc00601b
   
   for metadynamics refer to:
   * S. Grimme, J. Chem. Theory Comput., 2019, 155, 2847-2862
     DOI: 10.1021/acs.jctc.9b00143
   
   with help from (in alphabetical order)
   C. Bannwarth, F. Bohle, G. Brandenburg, E. Caldeweyher, M. Checinski,
   S. Dohm, S. Ehlert, S. Ehrlich, F. März, H. Neugebauer, J. Pisarek,
   P. Pracht, P. Shushkov, and S. Spicher.
   
 * started run on 2021/05/19 at 10:59:17.468     

           -------------------------------------------------
          |                Calculation Setup                |
           -------------------------------------------------

          program call               : /ihome/ghutchison/geoffh/xtb/xtb 412.xyz -opt
          hostname                   : smp-n126
          coordinate file            : 412.xyz
          omp threads                :                     1
          number of atoms            :                    30
          number of electrons        :                    86
          charge                     :                     0
          spin                       :                   0.0
          first test random number   :      0.75662782942567


########################################################################
# WARNING! Please study the warnings concerning your input carefully
#  - the use of '-opt' is discouraged, please use '--opt' next time
########################################################################

           ------------------------------------------------- 
          |                 G F N 2 - x T B                 |
          | Geometry, Frequencies, Noncovalent interactions |
          |            JCTC 2019 parametrisation            |
           ------------------------------------------------- 
             KAB for C  - Si     :                1.0500
             KAB for H  - Pd     :                0.9500
             k(s)              :                1.8500
             k(p)              :                2.2300
             k(d)              :                2.2300
             k(f)              :                2.0000
             kEN (H0ij)        :               -2.0000
             D4 a1             :                0.5200
             D4 a2             :                5.0000
             D4 s6             :                1.0000
             D4 s8             :                2.7000
             D4 s9             :                5.0000
             alphaj            :                2.0000

  Z AO/shell   Hii/eV     exponent
  1     Wed Apr 25 08:07:45 CEST 2018   EN: 2.200 GM2: 0.406  GM3: 0.0800  RAES: 1.40
     1s    -10.707211    1.230000
  6     Wed Apr 25 08:07:45 CEST 2018   EN: 2.550 GM2: 0.538  GM3: 0.1500  RAES: 3.00
     2s    -13.970922    2.096432
     2p    -10.063292    1.800000
  8     Wed Apr 25 08:07:45 CEST 2018   EN: 3.440 GM2: 0.452  GM3:-0.0517  RAES: 1.80
     2s    -20.229985    2.439742
     2p    -15.503117    2.137023

           ------------------------------------------------- 
          |        Self-Consistent Charge Iterations        |
           ------------------------------------------------- 

          ...................................................
          :                      SETUP                      :
          :.................................................:
          :  # basis functions                  78          :
          :  # atomic orbitals                  78          :
          :  # shells                           46          :
          :  # electrons                        86          :
          :  max. iterations                   250          :
          :  Hamiltonian                  GFN2-xTB          :
          :  restarted?                      false          :
          :  GBSA solvation                  false          :
          :  PC potential                    false          :
          :  electronic temp.          300.0000000     K    :
          :  accuracy                    1.0000000          :
          :  -> integral cutoff          0.2500000E+02      :
          :  -> integral neglect         0.1000000E-07      :
          :  -> SCF convergence          0.1000000E-05 Eh   :
          :  -> wf. convergence          0.1000000E-03 e    :
          :  Broyden damping             0.4000000          :
          ...................................................

 iter      E             dE          RMSdq      gap      omega  full diag
   1    -49.5426301 -0.495426E+02  0.441E+00    4.85       0.0  T
   2    -49.6412155 -0.985855E-01  0.236E+00    4.17       1.0  T
   3    -49.6447785 -0.356296E-02  0.139E+00    4.59       1.0  T
   4    -49.6528067 -0.802824E-02  0.449E-01    4.24       1.0  T
   5    -49.6569558 -0.414907E-02  0.126E-01    4.27       1.0  T
   6    -49.6572467 -0.290904E-03  0.575E-02    4.28       1.0  T
   7    -49.6572592 -0.124952E-04  0.185E-02    4.29       1.0  T
   8    -49.6572602 -0.943038E-06  0.597E-03    4.29       3.1  T
   9    -49.6572604 -0.240920E-06  0.242E-03    4.29       7.5  T
  10    -49.6572604 -0.346317E-07  0.997E-04    4.29      18.3  T
  11    -49.6572604 -0.629884E-08  0.446E-04    4.29      40.9  T

   *** convergence criteria satisfied after 11 iterations ***

         #    Occupation            Energy/Eh            Energy/eV
      -------------------------------------------------------------
         1        2.0000           -0.7585287             -20.6406
       ...           ...                  ...                  ...
        37        2.0000           -0.4716199             -12.8334
        38        2.0000           -0.4632073             -12.6045
        39        2.0000           -0.4571727             -12.4403
        40        2.0000           -0.4463225             -12.1451
        41        2.0000           -0.4436074             -12.0712
        42        2.0000           -0.4286218             -11.6634
        43        2.0000           -0.4150705             -11.2946 (HOMO)
        44                         -0.2575717              -7.0089 (LUMO)
        45                         -0.2538625              -6.9080
        46                         -0.2329572              -6.3391
        47                         -0.0534902              -1.4555
        48                         -0.0347861              -0.9466
       ...                                ...                  ...
        78                          0.5759608              15.6727
      -------------------------------------------------------------
                  HL-Gap            0.1574988 Eh            4.2858 eV
             Fermi-level           -0.3363211 Eh           -9.1518 eV

 SCC (total)                   0 d,  0 h,  0 min,  0.084 sec
 SCC setup                      ...        0 min,  0.000 sec (  0.408%)
 Dispersion                     ...        0 min,  0.000 sec (  0.567%)
 integral evaluation            ...        0 min,  0.011 sec ( 13.315%)
 zeroth order Hamiltonian       ...        0 min,  0.000 sec (  0.256%)
 iterations                     ...        0 min,  0.053 sec ( 63.538%)
 molecular gradient             ...        0 min,  0.018 sec ( 21.381%)
 printout                       ...        0 min,  0.000 sec (  0.461%)

         :::::::::::::::::::::::::::::::::::::::::::::::::::::
         ::                     SUMMARY                     ::
         :::::::::::::::::::::::::::::::::::::::::::::::::::::
         :: total energy             -49.125995024026 Eh    ::
         :: gradient norm              0.098929437403 Eh/a0 ::
         :: HOMO-LUMO gap              4.285761444857 eV    ::
         ::.................................................::
         :: SCC energy               -49.657260437794 Eh    ::
         :: -> isotropic ES            0.089042793398 Eh    ::
         :: -> anisotropic ES          0.004203130820 Eh    ::
         :: -> anisotropic XC          0.011085338152 Eh    ::
         :: -> dispersion             -0.029601849023 Eh    ::
         :: repulsion energy           0.530993266182 Eh    ::
         :: add. restraining           0.000000000000 Eh    ::
         :::::::::::::::::::::::::::::::::::::::::::::::::::::

      ----------------------------------------------------------- 
     |                   =====================                   |
     |                        A N C O P T                        |
     |                   =====================                   |
     |               Approximate Normal Coordinate               |
     |                Rational Function Optimizer                |
      ----------------------------------------------------------- 

          ...................................................
          :                      SETUP                      :
          :.................................................:
          :   optimization level            normal          :
          :   max. optcycles                   200          :
          :   ANC micro-cycles                  20          :
          :   degrees of freedom                84          :
          :.................................................:
          :   RF solver                   davidson          :
          :   input Hessian                  false          :
          :   write xtbopt.log                true          :
          :   linear?                        false          :
          :   energy convergence         0.5000000E-05 Eh   :
          :   grad. convergence          0.1000000E-02 Eh/α :
          :   maximium RF displ.         2.0000000          :
          :   Hlow (freq-cutoff)         0.5000000E-02      :
          :   Hmax (freq-cutoff)         5.0000000          :
          :   S6 in model hess.         20.0000000          :
          ...................................................

generating ANC from model Hessian ...
Using Lindh-Hessian (1995)
 Shifting diagonal of input Hessian by   3.655986616837677E-003
 Lowest  eigenvalues of input Hessian
   -0.000000   -0.000000   -0.000000    0.000000    0.000000    0.000000
    0.005000    0.005567    0.007719    0.008687    0.010656    0.012752
    0.013873    0.016730    0.017784    0.020501    0.025963    0.028202
 Highest eigenvalues
    1.454705    1.582167    1.623444    1.858161    2.240395    2.262245
 

........................................................................
.............................. CYCLE    1 ..............................
........................................................................
   1    -49.6572604 -0.496573E+02  0.101E-04    4.29       0.0  T
   2    -49.6572604 -0.369909E-10  0.593E-05    4.29     308.0  T
   3    -49.6572604 -0.422062E-11  0.340E-05    4.29     536.7  T
     SCC iter.                  ...        0 min,  0.005 sec
     gradient                   ...        0 min,  0.050 sec
 * total energy  :   -49.1259949 Eh     change        0.8919781E-07 Eh
   gradient norm :     0.0989393 Eh/α   predicted     0.0000000E+00 (-100.00%)
   displ. norm   :     0.2362991 α      lambda       -0.1091052E-01
   maximum displ.:     0.0807820 α      in ANC's #22, #19, #32, ...

........................................................................
.............................. CYCLE    2 ..............................
........................................................................
   1    -49.6878645 -0.496879E+02  0.189E-01    4.57       0.0  T
   2    -49.6880371 -0.172626E-03  0.117E-01    4.52       1.0  T
   3    -49.6880403 -0.322061E-05  0.535E-02    4.53       1.0  T
   4    -49.6880501 -0.977984E-05  0.130E-02    4.52       1.4  T
   5    -49.6880534 -0.325803E-05  0.599E-03    4.53       3.0  T
   6    -49.6880540 -0.591167E-06  0.250E-03    4.53       7.3  T
     SCC iter.                  ...        0 min,  0.021 sec
     gradient                   ...        0 min,  0.030 sec
 * total energy  :   -49.1325601 Eh     change       -0.6565213E-02 Eh
   gradient norm :     0.0260054 Eh/α   predicted    -0.5759874E-02 ( -12.27%)
   displ. norm   :     0.1797515 α      lambda       -0.1720119E-02
   maximum displ.:     0.1051676 α      in ANC's #5, #3, #32, ...

........................................................................
.............................. CYCLE    3 ..............................
........................................................................
   1    -49.6967523 -0.496968E+02  0.125E-01    4.62       0.0  T
   2    -49.6967783 -0.260590E-04  0.757E-02    4.59       1.0  T
   3    -49.6967742  0.409564E-05  0.264E-02    4.60       1.0  T
   4    -49.6967813 -0.703451E-05  0.714E-03    4.59       2.6  T
   5    -49.6967822 -0.963931E-06  0.308E-03    4.59       5.9  T
   6    -49.6967823 -0.104427E-06  0.139E-03    4.59      13.1  T
     SCC iter.                  ...        0 min,  0.022 sec
     gradient                   ...        0 min,  0.030 sec
 * total energy  :   -49.1333259 Eh     change       -0.7657480E-03 Eh
   gradient norm :     0.0133190 Eh/α   predicted    -0.8878486E-03 (  15.95%)
   displ. norm   :     0.1179777 α      lambda       -0.4627393E-03
   maximum displ.:     0.0673753 α      in ANC's #3, #16, #2, ...

........................................................................
.............................. CYCLE    4 ..............................
........................................................................
   1    -49.6953248 -0.496953E+02  0.687E-02    4.58       0.0  T
   2    -49.6953290 -0.428231E-05  0.408E-02    4.58       1.0  T
   3    -49.6953262  0.279552E-05  0.134E-02    4.58       1.4  T
   4    -49.6953291 -0.283635E-05  0.462E-03    4.58       4.0  T
   5    -49.6953296 -0.506431E-06  0.988E-04    4.58      18.5  T
   6    -49.6953296 -0.212795E-08  0.465E-04    4.58      39.2  T
     SCC iter.                  ...        0 min,  0.022 sec
     gradient                   ...        0 min,  0.030 sec
 * total energy  :   -49.1335423 Eh     change       -0.2163712E-03 Eh
   gradient norm :     0.0066664 Eh/α   predicted    -0.2345916E-03 (   8.42%)
   displ. norm   :     0.0948595 α      lambda       -0.1596088E-03
   maximum displ.:     0.0562102 α      in ANC's #3, #4, #5, ...

........................................................................
.............................. CYCLE    5 ..............................
........................................................................
   1    -49.6935213 -0.496935E+02  0.466E-02    4.56       0.0  T
   2    -49.6935239 -0.254855E-05  0.279E-02    4.56       1.0  T
   3    -49.6935239 -0.203996E-07  0.507E-03    4.56       3.6  T
   4    -49.6935240 -0.110967E-06  0.166E-03    4.56      11.0  T
   5    -49.6935240 -0.362621E-07  0.934E-04    4.56      19.5  T
     SCC iter.                  ...        0 min,  0.020 sec
     gradient                   ...        0 min,  0.030 sec
 * total energy  :   -49.1336298 Eh     change       -0.8749154E-04 Eh
   gradient norm :     0.0031817 Eh/α   predicted    -0.8052630E-04 (  -7.96%)
   displ. norm   :     0.0935866 α      lambda       -0.8029551E-04
   maximum displ.:     0.0510925 α      in ANC's #3, #2, #4, ...

........................................................................
.............................. CYCLE    6 ..............................
........................................................................
   1    -49.6933301 -0.496933E+02  0.469E-02    4.56       0.0  T
   2    -49.6933311 -0.960384E-06  0.287E-02    4.55       1.0  T
   3    -49.6933312 -0.146563E-06  0.335E-03    4.56       5.5  T
   4    -49.6933314 -0.138323E-06  0.158E-03    4.55      11.6  T
   5    -49.6933314 -0.127376E-07  0.936E-04    4.56      19.5  T
   6    -49.6933314 -0.230499E-08  0.479E-04    4.56      38.1  T
     SCC iter.                  ...        0 min,  0.022 sec
     gradient                   ...        0 min,  0.031 sec
 * total energy  :   -49.1336877 Eh     change       -0.5790922E-04 Eh
   gradient norm :     0.0030236 Eh/α   predicted    -0.4050277E-04 ( -30.06%)
   displ. norm   :     0.1252101 α      lambda       -0.6479208E-04
   maximum displ.:     0.0733523 α      in ANC's #2, #3, #4, ...

........................................................................
.............................. CYCLE    7 ..............................
........................................................................
   1    -49.6939775 -0.496940E+02  0.574E-02    4.56       0.0  T
   2    -49.6939783 -0.749682E-06  0.348E-02    4.56       1.0  T
   3    -49.6939783 -0.189527E-07  0.432E-03    4.56       4.2  T
   4    -49.6939786 -0.336385E-06  0.188E-03    4.56       9.7  T
   5    -49.6939786 -0.804349E-08  0.120E-03    4.56      15.2  T
   6    -49.6939787 -0.159618E-07  0.297E-04    4.56      61.5  T
   7    -49.6939787 -0.758590E-09  0.829E-05    4.56     220.2  T
     SCC iter.                  ...        0 min,  0.023 sec
     gradient                   ...        0 min,  0.031 sec
 * total energy  :   -49.1337375 Eh     change       -0.4980956E-04 Eh
   gradient norm :     0.0022926 Eh/α   predicted    -0.3290504E-04 ( -33.94%)
   displ. norm   :     0.1344760 α      lambda       -0.5144735E-04
   maximum displ.:     0.0839237 α      in ANC's #2, #3, #4, ...

........................................................................
.............................. CYCLE    8 ..............................
........................................................................
   1    -49.6944442 -0.496944E+02  0.600E-02    4.56       0.0  T
   2    -49.6944447 -0.593136E-06  0.362E-02    4.56       1.0  T
   3    -49.6944449 -0.126864E-06  0.347E-03    4.56       5.3  T
   4    -49.6944451 -0.182060E-06  0.181E-03    4.56      10.1  T
   5    -49.6944451 -0.766283E-08  0.109E-03    4.56      16.8  T
   6    -49.6944451 -0.133225E-07  0.241E-04    4.56      75.7  T
   7    -49.6944451 -0.594440E-09  0.788E-05    4.56     231.8  T
     SCC iter.                  ...        0 min,  0.023 sec
     gradient                   ...        0 min,  0.031 sec
 * total energy  :   -49.1337786 Eh     change       -0.4109591E-04 Eh
   gradient norm :     0.0017078 Eh/α   predicted    -0.2619071E-04 ( -36.27%)
   displ. norm   :     0.2090988 α      lambda       -0.4346989E-04
   maximum displ.:     0.1349532 α      in ANC's #2, #3, #1, ...

........................................................................
.............................. CYCLE    9 ..............................
........................................................................
   1    -49.6945183 -0.496945E+02  0.923E-02    4.57       0.0  T
   2    -49.6945196 -0.121602E-05  0.554E-02    4.57       1.0  T
   3    -49.6945199 -0.353776E-06  0.433E-03    4.57       4.2  T
   4    -49.6945201 -0.195532E-06  0.270E-03    4.57       6.8  T
   5    -49.6945202 -0.562143E-07  0.144E-03    4.57      12.7  T
   6    -49.6945202 -0.129800E-07  0.429E-04    4.57      42.5  T
   7    -49.6945202 -0.227617E-08  0.116E-04    4.57     157.2  T
     SCC iter.                  ...        0 min,  0.023 sec
     gradient                   ...        0 min,  0.031 sec
 * total energy  :   -49.1338265 Eh     change       -0.4794647E-04 Eh
   gradient norm :     0.0018529 Eh/α   predicted    -0.2215941E-04 ( -53.78%)
   displ. norm   :     0.1565519 α      lambda       -0.2777058E-04
   maximum displ.:     0.1069517 α      in ANC's #2, #3, #1, ...

........................................................................
.............................. CYCLE   10 ..............................
........................................................................
   1    -49.6944142 -0.496944E+02  0.711E-02    4.57       0.0  T
   2    -49.6944148 -0.574463E-06  0.425E-02    4.57       1.0  T
   3    -49.6944148  0.214379E-07  0.407E-03    4.57       4.5  T
   4    -49.6944151 -0.292912E-06  0.200E-03    4.57       9.1  T
   5    -49.6944151 -0.352165E-07  0.102E-03    4.57      18.0  T
   6    -49.6944151 -0.498466E-08  0.293E-04    4.57      62.3  T
   7    -49.6944151 -0.729713E-09  0.882E-05    4.57     206.9  T
     SCC iter.                  ...        0 min,  0.023 sec
     gradient                   ...        0 min,  0.031 sec
 * total energy  :   -49.1338597 Eh     change       -0.3317668E-04 Eh
   gradient norm :     0.0013470 Eh/α   predicted    -0.1403921E-04 ( -57.68%)
   displ. norm   :     0.1520780 α      lambda       -0.2396579E-04
   maximum displ.:     0.1083750 α      in ANC's #2, #1, #3, ...

........................................................................
.............................. CYCLE   11 ..............................
........................................................................
   1    -49.6943690 -0.496944E+02  0.716E-02    4.57       0.0  T
   2    -49.6943695 -0.518083E-06  0.426E-02    4.57       1.0  T
   3    -49.6943694  0.164525E-06  0.443E-03    4.57       4.1  T
   4    -49.6943698 -0.401738E-06  0.186E-03    4.57       9.8  T
   5    -49.6943698 -0.317850E-07  0.956E-04    4.57      19.1  T
   6    -49.6943698 -0.400218E-08  0.306E-04    4.57      59.7  T
     SCC iter.                  ...        0 min,  0.022 sec
     gradient                   ...        0 min,  0.034 sec
 * total energy  :   -49.1338874 Eh     change       -0.2774857E-04 Eh
   gradient norm :     0.0012430 Eh/α   predicted    -0.1210891E-04 ( -56.36%)
   displ. norm   :     0.1466168 α      lambda       -0.1934551E-04
   maximum displ.:     0.1085299 α      in ANC's #2, #1, #3, ...

........................................................................
.............................. CYCLE   12 ..............................
........................................................................
   1    -49.6942628 -0.496943E+02  0.730E-02    4.57       0.0  T
   2    -49.6942632 -0.424295E-06  0.433E-02    4.57       1.0  T
   3    -49.6942620  0.116654E-05  0.769E-03    4.57       2.4  T
   4    -49.6942635 -0.147845E-05  0.157E-03    4.57      11.6  T
   5    -49.6942635 -0.889352E-08  0.837E-04    4.57      21.8  T
   6    -49.6942635 -0.243327E-08  0.234E-04    4.57      77.9  T
     SCC iter.                  ...        0 min,  0.022 sec
     gradient                   ...        0 min,  0.031 sec
 * total energy  :   -49.1339072 Eh     change       -0.1975452E-04 Eh
   gradient norm :     0.0015216 Eh/α   predicted    -0.9767112E-05 ( -50.56%)
   displ. norm   :     0.1511182 α      lambda       -0.2039148E-04
   maximum displ.:     0.1128369 α      in ANC's #2, #1, #3, ...

........................................................................
.............................. CYCLE   13 ..............................
........................................................................
   1    -49.6939182 -0.496939E+02  0.753E-02    4.58       0.0  T
   2    -49.6939187 -0.441183E-06  0.448E-02    4.58       1.0  T
   3    -49.6939187 -0.705896E-07  0.312E-03    4.58       5.9  T
   4    -49.6939189 -0.149905E-06  0.170E-03    4.58      10.8  T
   5    -49.6939189 -0.184690E-07  0.897E-04    4.58      20.3  T
   6    -49.6939189 -0.586566E-08  0.231E-04    4.58      79.2  T
     SCC iter.                  ...        0 min,  0.021 sec
     gradient                   ...        0 min,  0.031 sec
 * total energy  :   -49.1339255 Eh     change       -0.1829536E-04 Eh
   gradient norm :     0.0017997 Eh/α   predicted    -0.1030050E-04 ( -43.70%)
   displ. norm   :     0.1097190 α      lambda       -0.1553244E-04
   maximum displ.:     0.0854589 α      in ANC's #2, #4, #1, ...

........................................................................
.............................. CYCLE   14 ..............................
........................................................................
   1    -49.6945948 -0.496946E+02  0.571E-02    4.58       0.0  T
   2    -49.6945950 -0.235302E-06  0.339E-02    4.58       1.0  T
   3    -49.6945940  0.104485E-05  0.696E-03    4.58       2.6  T
   4    -49.6945952 -0.124424E-05  0.121E-03    4.58      15.1  T
   5    -49.6945952 -0.551094E-08  0.662E-04    4.58      27.6  T
   6    -49.6945952 -0.153657E-08  0.149E-04    4.58     122.4  T
     SCC iter.                  ...        0 min,  0.021 sec
     gradient                   ...        0 min,  0.031 sec
 * total energy  :   -49.1339434 Eh     change       -0.1787688E-04 Eh
   gradient norm :     0.0010883 Eh/α   predicted    -0.7809032E-05 ( -56.32%)
   displ. norm   :     0.3085835 α      lambda       -0.3073143E-04
   maximum displ.:     0.2410353 α      in ANC's #2, #4, #1, ...

........................................................................
.............................. CYCLE   15 ..............................
........................................................................
   1    -49.6931319 -0.496931E+02  0.155E-01    4.59       0.0  T
   2    -49.6931332 -0.135526E-05  0.919E-02    4.58       1.0  T
   3    -49.6931288  0.445219E-05  0.145E-02    4.59       1.3  T
   4    -49.6931343 -0.546149E-05  0.277E-03    4.58       6.6  T
   5    -49.6931343 -0.331296E-07  0.153E-03    4.58      12.0  T
   6    -49.6931343 -0.772224E-08  0.354E-04    4.58      51.5  T
   7    -49.6931343 -0.841453E-09  0.142E-04    4.58     128.3  T
     SCC iter.                  ...        0 min,  0.023 sec
     gradient                   ...        0 min,  0.044 sec
 * total energy  :   -49.1339543 Eh     change       -0.1094257E-04 Eh
   gradient norm :     0.0037031 Eh/α   predicted    -0.1601982E-04 (  46.40%)
   displ. norm   :     0.2058622 α      lambda        0.1029894E-03
   maximum displ.:     0.1606774 α      in ANC's #2, #4, #1, ...

........................................................................
.............................. CYCLE   16 ..............................
........................................................................
   1    -49.6911401 -0.496911E+02  0.105E-01    4.58       0.0  T
   2    -49.6911407 -0.624423E-06  0.619E-02    4.58       1.0  T
   3    -49.6911388  0.188964E-05  0.944E-03    4.58       1.9  T
   4    -49.6911411 -0.232970E-05  0.190E-03    4.58       9.6  T
   5    -49.6911411 -0.183455E-07  0.106E-03    4.58      17.3  T
   6    -49.6911411 -0.379166E-08  0.251E-04    4.58      72.7  T
   7    -49.6911411 -0.390585E-09  0.964E-05    4.58     189.5  T
     SCC iter.                  ...        0 min,  0.023 sec
     gradient                   ...        0 min,  0.044 sec
 * total energy  :   -49.1338922 Eh     change        0.6209276E-04 Eh
   gradient norm :     0.0080789 Eh/α   predicted     0.5367606E-04 ( -13.56%)
   displ. norm   :     0.1723971 α      lambda       -0.1557730E-03
   maximum displ.:     0.1262807 α      in ANC's #2, #1, #3, ...

........................................................................
.............................. CYCLE   17 ..............................
........................................................................
   1    -49.6941162 -0.496941E+02  0.873E-02    4.59       0.0  T
   2    -49.6941168 -0.595151E-06  0.517E-02    4.59       1.0  T
   3    -49.6941164  0.365138E-06  0.530E-03    4.59       3.4  T
   4    -49.6941170 -0.631684E-06  0.186E-03    4.59       9.8  T
   5    -49.6941171 -0.291230E-07  0.992E-04    4.59      18.4  T
     SCC iter.                  ...        0 min,  0.007 sec
     gradient                   ...        0 min,  0.030 sec
 * total energy  :   -49.1339724 Eh     change       -0.8021783E-04 Eh
   gradient norm :     0.0018115 Eh/α   predicted    -0.8020219E-04 (  -0.02%)
   displ. norm   :     0.0329831 α      lambda       -0.8452274E-05
   maximum displ.:     0.0195820 α      in ANC's #1, #2, #6, ...

........................................................................
.............................. CYCLE   18 ..............................
........................................................................
   1    -49.6950098 -0.496950E+02  0.211E-02    4.59       0.0  T
   2    -49.6950100 -0.117744E-06  0.129E-02    4.59       1.4  T
   3    -49.6950099  0.353862E-07  0.184E-03    4.59       9.9  T
   4    -49.6950100 -0.710438E-07  0.782E-04    4.59      23.3  T
   5    -49.6950100 -0.918617E-08  0.379E-04    4.59      48.1  T
     SCC iter.                  ...        0 min,  0.020 sec
     gradient                   ...        0 min,  0.031 sec
 * total energy  :   -49.1339776 Eh     change       -0.5182595E-05 Eh
   gradient norm :     0.0016642 Eh/α   predicted    -0.4233668E-05 ( -18.31%)
   displ. norm   :     0.0408762 α      lambda       -0.6735671E-05
   maximum displ.:     0.0244939 α      in ANC's #2, #4, #8, ...

........................................................................
.............................. CYCLE   19 ..............................
........................................................................
   1    -49.6951405 -0.496951E+02  0.272E-02    4.60       0.0  T
   2    -49.6951406 -0.111991E-06  0.163E-02    4.60       1.1  T
   3    -49.6951401  0.507306E-06  0.475E-03    4.60       3.8  T
   4    -49.6951407 -0.587810E-06  0.757E-04    4.60      24.1  T
   5    -49.6951407 -0.364211E-08  0.386E-04    4.60      47.3  T
     SCC iter.                  ...        0 min,  0.021 sec
     gradient                   ...        0 min,  0.031 sec
 * total energy  :   -49.1339827 Eh     change       -0.5044990E-05 Eh
   gradient norm :     0.0013173 Eh/α   predicted    -0.3372833E-05 ( -33.14%)
   displ. norm   :     0.0640192 α      lambda       -0.5646662E-05
   maximum displ.:     0.0469315 α      in ANC's #2, #4, #6, ...

........................................................................
.............................. CYCLE   20 ..............................
........................................................................
   1    -49.6947983 -0.496948E+02  0.335E-02    4.60       0.0  T
   2    -49.6947983 -0.781902E-07  0.199E-02    4.60       1.0  T
   3    -49.6947980  0.363842E-06  0.405E-03    4.60       4.5  T
   4    -49.6947984 -0.431030E-06  0.665E-04    4.60      27.5  T
   5    -49.6947984 -0.133802E-08  0.359E-04    4.60      50.9  T
     SCC iter.                  ...        0 min,  0.020 sec
     gradient                   ...        0 min,  0.031 sec
 * total energy  :   -49.1339885 Eh     change       -0.5836731E-05 Eh
   gradient norm :     0.0007641 Eh/α   predicted    -0.2829889E-05 ( -51.52%)
   displ. norm   :     0.0687540 α      lambda       -0.4458058E-05
   maximum displ.:     0.0476147 α      in ANC's #2, #4, #3, ...
 * RMSD in coord.:     0.3253130 α      energy gain  -0.7993480E-02 Eh

generating ANC from model Hessian ...
Using Lindh-Hessian (1995)
 Shifting diagonal of input Hessian by   3.650266809094841E-003
 Lowest  eigenvalues of input Hessian
   -0.000000   -0.000000   -0.000000   -0.000000    0.000000    0.000000
    0.005000    0.005637    0.007763    0.008888    0.010955    0.012705
    0.014437    0.016393    0.019556    0.021330    0.026577    0.028102
 Highest eigenvalues
    1.519954    1.678885    1.689236    1.960887    2.381993    2.385383
 

........................................................................
.............................. CYCLE   21 ..............................
........................................................................
   1    -49.6941907 -0.496942E+02  0.384E-02    4.60       0.0  T
   2    -49.6941908 -0.102217E-06  0.228E-02    4.60       1.0  T
   3    -49.6941905  0.354836E-06  0.413E-03    4.60       4.4  T
   4    -49.6941909 -0.433650E-06  0.803E-04    4.60      22.7  T
   5    -49.6941909 -0.222271E-08  0.436E-04    4.60      41.9  T
     SCC iter.                  ...        0 min,  0.020 sec
     gradient                   ...        0 min,  0.031 sec
 * total energy  :   -49.1339916 Eh     change       -0.3050271E-05 Eh
   gradient norm :     0.0010756 Eh/α   predicted     0.0000000E+00 (-100.00%)
   displ. norm   :     0.0239320 α      lambda       -0.3590385E-05
   maximum displ.:     0.0193190 α      in ANC's #1, #3, #6, ...

........................................................................
.............................. CYCLE   22 ..............................
........................................................................
   1    -49.6947815 -0.496948E+02  0.835E-03    4.60       0.0  T
   2    -49.6947815 -0.142248E-07  0.498E-03    4.60       3.7  T
   3    -49.6947815  0.183291E-07  0.993E-04    4.60      18.4  T
   4    -49.6947815 -0.227157E-07  0.271E-04    4.60      67.4  T
     SCC iter.                  ...        0 min,  0.006 sec
     gradient                   ...        0 min,  0.044 sec
 * total energy  :   -49.1339944 Eh     change       -0.2805307E-05 Eh
   gradient norm :     0.0005757 Eh/α   predicted    -0.1802884E-05 ( -35.73%)
   displ. norm   :     0.0143016 α      lambda       -0.1413546E-05
   maximum displ.:     0.0093673 α      in ANC's #1, #6, #3, ...

   *** GEOMETRY OPTIMIZATION CONVERGED AFTER 22 ITERATIONS ***

------------------------------------------------------------------------
 total energy gain   :        -0.0079993 Eh       -5.0197 kcal/mol
 total RMSD          :         0.3252469 a0        0.1721 Å
 total power (kW/mol):        -0.9546478 (step)  -11.7803 (real)
------------------------------------------------------------------------

 ANCopt (total)                0 d,  0 h,  0 min,  1.783 sec
 optimizer setup                ...        0 min,  0.000 sec (  0.008%)
 model hessian                  ...        0 min,  0.106 sec (  5.921%)
 ANC generation                 ...        0 min,  0.002 sec (  0.106%)
 coordinate transformation      ...        0 min,  0.000 sec (  0.026%)
 single point calculation       ...        0 min,  1.654 sec ( 92.760%)
 optimization log               ...        0 min,  0.015 sec (  0.862%)
 hessian update                 ...        0 min,  0.000 sec (  0.017%)
 rational function              ...        0 min,  0.004 sec (  0.221%)

================
 final structure:
================
$coord
   -4.62705186282826   -1.12095630245271   -0.52437558167356      C 
   -5.02699969368891    1.72099903243770   -0.73285779913309      C 
   -6.79593413861413    2.79371100111913   -1.62851167229381      O 
   -3.03579250030501    2.93131805731614    0.28383165663451      O 
   -1.11788006938948    1.20250269358804    1.02919687509710      C 
   -2.52618169360627   -1.31111168377591    1.44305962517143      C 
   -0.85103741381493   -3.64945616974125    1.32029587502833      C 
    0.79097217224851   -3.70662161331655   -1.04180488618584      C 
    2.40471051769070   -1.33991066940804   -1.31705324711279      C 
    0.95380544166905    1.16277791213671   -1.03635510152144      C 
    2.84283408336917    2.96436290312997   -0.39727716490685      O 
    4.87018025064022    1.85609018306202    0.65781004781577      C 
    6.62177625113064    3.01241440406754    1.47725338871736      O 
    4.53472237379973   -1.02381132056300    0.62027298434856      C 
    6.93206500307249   -2.35585791778833   -0.05047641908139      C 
    8.16067870396175   -3.88508375560232    1.48806773839411      C 
   -4.04463652966124   -1.83238976866713   -2.36991588261980      H 
   -6.37255082060272   -2.06300460290329    0.01368791840046      H 
   -0.27982743747939    1.93953344631674    2.77026502416620      H 
   -3.39918854372351   -1.22849737654262    3.31932655776176      H 
   -2.04526056853709   -5.32934069634366    1.37172011784139      H 
    0.34495096905325   -3.69405263596416    3.00005453385491      H 
   -0.39925845398007   -3.89821178811701   -2.71561921480701      H 
    2.03647103784252   -5.34910944862390   -0.97838420306338      H 
    3.26967447941965   -1.35284552463165   -3.20015538857679      H 
    0.10040180571061    1.78784463738221   -2.81405868964944      H 
    3.92924290385313   -1.59188812891195    2.51484665662575      H 
    7.64789154326910   -1.97005099404956   -1.92558519617130      H 
    7.49433382407637   -4.28499633155156    3.37001253188883      H 
    9.89411562609678   -4.79127820179765    0.93445795986941      H 
$end
           -------------------------------------------------
          |                Final Singlepoint                |
           -------------------------------------------------

          ...................................................
          :                      SETUP                      :
          :.................................................:
          :  # basis functions                  78          :
          :  # atomic orbitals                  78          :
          :  # shells                           46          :
          :  # electrons                        86          :
          :  max. iterations                   250          :
          :  Hamiltonian                  GFN2-xTB          :
          :  restarted?                      false          :
          :  GBSA solvation                  false          :
          :  PC potential                    false          :
          :  electronic temp.          300.0000000     K    :
          :  accuracy                    1.0000000          :
          :  -> integral cutoff          0.2500000E+02      :
          :  -> integral neglect         0.1000000E-07      :
          :  -> SCF convergence          0.1000000E-05 Eh   :
          :  -> wf. convergence          0.1000000E-03 e    :
          :  Broyden damping             0.4000000          :
          ...................................................

 iter      E             dE          RMSdq      gap      omega  full diag
   1    -49.6947815 -0.496948E+02  0.121E-04    4.60       0.0  T
   2    -49.6947815 -0.451621E-10  0.514E-05    4.60     355.1  T
   3    -49.6947815 -0.255085E-10  0.583E-05    4.60     313.3  T

   *** convergence criteria satisfied after 3 iterations ***

         #    Occupation            Energy/Eh            Energy/eV
      -------------------------------------------------------------
         1        2.0000           -0.7627732             -20.7561
       ...           ...                  ...                  ...
        37        2.0000           -0.4688159             -12.7571
        38        2.0000           -0.4639759             -12.6254
        39        2.0000           -0.4553090             -12.3896
        40        2.0000           -0.4438541             -12.0779
        41        2.0000           -0.4431022             -12.0574
        42        2.0000           -0.4284634             -11.6591
        43        2.0000           -0.4149782             -11.2921 (HOMO)
        44                         -0.2459306              -6.6921 (LUMO)
        45                         -0.2422869              -6.5930
        46                         -0.2261092              -6.1527
        47                         -0.0390661              -1.0630
        48                         -0.0242451              -0.6597
       ...                                ...                  ...
        78                          0.6654069              18.1066
      -------------------------------------------------------------
                  HL-Gap            0.1690476 Eh            4.6000 eV
             Fermi-level           -0.3304544 Eh           -8.9921 eV

 SCC (total)                   0 d,  0 h,  0 min,  0.061 sec
 SCC setup                      ...        0 min,  0.000 sec (  0.388%)
 Dispersion                     ...        0 min,  0.000 sec (  0.457%)
 integral evaluation            ...        0 min,  0.024 sec ( 39.349%)
 zeroth order Hamiltonian       ...        0 min,  0.000 sec (  0.338%)
 iterations                     ...        0 min,  0.005 sec (  8.070%)
 molecular gradient             ...        0 min,  0.031 sec ( 50.701%)
 printout                       ...        0 min,  0.000 sec (  0.613%)

         :::::::::::::::::::::::::::::::::::::::::::::::::::::
         ::                     SUMMARY                     ::
         :::::::::::::::::::::::::::::::::::::::::::::::::::::
         :: total energy             -49.133994343520 Eh    ::
         :: gradient norm              0.000576039946 Eh/a0 ::
         :: HOMO-LUMO gap              4.600018647010 eV    ::
         ::.................................................::
         :: SCC energy               -49.694781500393 Eh    ::
         :: -> isotropic ES            0.086157068494 Eh    ::
         :: -> anisotropic ES          0.003757610713 Eh    ::
         :: -> anisotropic XC          0.009825925937 Eh    ::
         :: -> dispersion             -0.029664177856 Eh    ::
         :: repulsion energy           0.560514697785 Eh    ::
         :: add. restraining           0.000000000000 Eh    ::
         :::::::::::::::::::::::::::::::::::::::::::::::::::::

           -------------------------------------------------
          |                Property Printout                |
           -------------------------------------------------

    * Orbital Energies and Occupations

         #    Occupation            Energy/Eh            Energy/eV
      -------------------------------------------------------------
         1        2.0000           -0.7627732             -20.7561
       ...           ...                  ...                  ...
        31        2.0000           -0.5054327             -13.7535
        32        2.0000           -0.4970377             -13.5251
        33        2.0000           -0.4928345             -13.4107
        34        2.0000           -0.4863716             -13.2348
        35        2.0000           -0.4787091             -13.0263
        36        2.0000           -0.4779493             -13.0057
        37        2.0000           -0.4688159             -12.7571
        38        2.0000           -0.4639759             -12.6254
        39        2.0000           -0.4553090             -12.3896
        40        2.0000           -0.4438541             -12.0779
        41        2.0000           -0.4431022             -12.0574
        42        2.0000           -0.4284634             -11.6591
        43        2.0000           -0.4149782             -11.2921 (HOMO)
        44                         -0.2459306              -6.6921 (LUMO)
        45                         -0.2422869              -6.5930
        46                         -0.2261092              -6.1527
        47                         -0.0390661              -1.0630
        48                         -0.0242451              -0.6597
        49                          0.0121405               0.3304
        50                          0.0247948               0.6747
        51                          0.0301704               0.8210
        52                          0.0380989               1.0367
        53                          0.0544521               1.4817
        54                          0.0648711               1.7652
       ...                                ...                  ...
        78                          0.6654069              18.1066
      -------------------------------------------------------------
                  HL-Gap            0.1690476 Eh            4.6000 eV
             Fermi-level           -0.3304544 Eh           -8.9921 eV

     #   Z        covCN         q      C6AA      α(0)
     1   6 C      3.825    -0.104    22.462     6.744
     2   6 C      2.771     0.358    20.934     7.493
     3   8 O      0.856    -0.362    20.940     6.135
     4   8 O      1.706    -0.256    18.233     5.765
     5   6 C      3.808     0.096    18.985     6.202
     6   6 C      3.874    -0.028    21.030     6.521
     7   6 C      3.803    -0.067    21.782     6.644
     8   6 C      3.803    -0.066    21.766     6.642
     9   6 C      3.876    -0.030    21.062     6.525
    10   6 C      3.803     0.097    18.984     6.203
    11   8 O      1.706    -0.255    18.231     5.765
    12   6 C      2.771     0.357    20.939     7.494
    13   8 O      0.856    -0.359    20.872     6.125
    14   6 C      3.877    -0.056    21.539     6.599
    15   6 C      2.889    -0.024    28.606     8.769
    16   6 C      2.837    -0.086    30.155     8.999
    17   1 H      0.924     0.071     2.072     2.251
    18   1 H      0.925     0.074     2.039     2.233
    19   1 H      0.924     0.065     2.143     2.289
    20   1 H      0.924     0.050     2.320     2.382
    21   1 H      0.924     0.056     2.251     2.346
    22   1 H      0.924     0.046     2.364     2.405
    23   1 H      0.924     0.046     2.373     2.409
    24   1 H      0.924     0.056     2.245     2.343
    25   1 H      0.924     0.050     2.319     2.381
    26   1 H      0.924     0.066     2.132     2.284
    27   1 H      0.924     0.065     2.141     2.288
    28   1 H      0.925     0.043     2.411     2.428
    29   1 H      0.926     0.046     2.370     2.407
    30   1 H      0.926     0.052     2.299     2.371

 Mol. C6AA /au·bohr⁶  :       9028.037447
 Mol. C8AA /au·bohr⁸  :     207630.752644
 Mol. α(0) /au        :        141.444671


Wiberg/Mayer (AO) data.
largest (>0.10) Wiberg bond orders for each atom
          total WBO             WBO to atom ...
     1  C   3.995        C    6 1.000    H   18 0.966    C    2 0.958    H   17 0.948
     2  C   3.917        O    3 1.798    O    4 1.109    C    1 0.958
     3  O   2.084        C    2 1.798    O    4 0.163
     4  O   2.311        C    2 1.109    C    5 0.953    O    3 0.163
     5  C   3.933        C    6 0.970    H   19 0.961    C   10 0.961    O    4 0.953
     6  C   3.991        C    7 1.000    C    1 1.000    C    5 0.970    H   20 0.967
     7  C   3.995        C    8 1.010    C    6 1.000    H   21 0.973    H   22 0.971
     8  C   3.995        C    7 1.010    C    9 1.000    H   24 0.972    H   23 0.971
     9  C   3.990        C    8 1.000    C   14 0.975    C   10 0.970    H   25 0.965
    10  C   3.932        C    9 0.970    C    5 0.961    H   26 0.961    O   11 0.951
    11  O   2.313        C   12 1.111    C   10 0.951    O   13 0.163
    12  C   3.914        O   13 1.803    O   11 1.111    C   14 0.923
    13  O   2.092        C   12 1.803    O   11 0.163
    14  C   3.994        C   15 1.012    C    9 0.975    H   27 0.938    C   12 0.923
    15  C   3.988        C   16 1.975    C   14 1.012    H   28 0.965
    16  C   3.990        C   15 1.975    H   30 0.975    H   29 0.974
    17  H   0.995        C    1 0.948
    18  H   0.994        C    1 0.966
    19  H   0.996        C    5 0.961
    20  H   0.997        C    6 0.967
    21  H   0.997        C    7 0.973
    22  H   0.997        C    7 0.971
    23  H   0.998        C    8 0.971
    24  H   0.997        C    8 0.972
    25  H   0.997        C    9 0.965
    26  H   0.995        C   10 0.961
    27  H   0.996        C   14 0.938
    28  H   0.998        C   15 0.965
    29  H   0.998        C   16 0.974
    30  H   0.997        C   16 0.975

molecular dipole:
                 x           y           z       tot (Debye)
 q only:        0.078      -2.706       0.085
   full:        0.052      -2.876       0.092       7.314
molecular quadrupole (traceless):
                xx          xy          yy          xz          yz          zz
 q only:      -12.618      -1.051       1.673      -7.314      -0.197      10.945
  q+dip:      -17.598      -1.098       0.264     -11.046      -0.842      17.334
   full:      -17.045      -0.629       0.191     -11.185      -0.297      16.854

           -------------------------------------------------
          |                Geometry Summary                 |
           -------------------------------------------------

      molecular mass/u    :      222.2402000
   center of mass at/Å    :        0.4442704       0.0089422       0.0508874
  moments of inertia/u·Å² :        0.4457547E+03   0.1394636E+04   0.1691532E+04
rotational constants/cm⁻¹ :        0.3781818E-01   0.1208747E-01   0.9965896E-02

 * 29 selected distances

     #   Z        #   Z                                     value/Å
     2   6 C      3   8 O                                 1.1929439
     2   6 C      4   8 O                                 1.3453426
     4   8 O      5   6 C                                 1.4221741
     1   6 C      6   6 C                                 1.5264371
     5   6 C      6   6 C                                 1.5403379
     6   6 C      7   6 C                                 1.5235375
     7   6 C      8   6 C                                 1.5226135
     8   6 C      9   6 C                                 1.5228204
     5   6 C     10   6 C                                 1.5482359 (max)
     9   6 C     10   6 C                                 1.5380196
    10   6 C     11   8 O                                 1.4221542
    11   8 O     12   6 C                                 1.3441113
    12   6 C     13   8 O                                 1.1923130
     9   6 C     14   6 C                                 1.5327976
    15   6 C     16   6 C                                 1.3192487
     1   6 C     17   1 H                                 1.0911019
     1   6 C     18   1 H                                 1.0875505
     5   6 C     19   1 H                                 1.0943694
     6   6 C     20   1 H                                 1.0959648
     7   6 C     21   1 H                                 1.0910328
     7   6 C     22   1 H                                 1.0914358
     8   6 C     23   1 H                                 1.0915697
     8   6 C     24   1 H                                 1.0913190
     9   6 C     25   1 H                                 1.0966110
    10   6 C     26   1 H                                 1.0946727
    14   6 C     27   1 H                                 1.0946075
    15   6 C     28   1 H                                 1.0815544
    16   6 C     29   1 H                                 1.0774524
    16   6 C     30   1 H                                 1.0757376 (min)

 * 3 distinct bonds (by element types)

   Z      Z             #   av. dist./Å        max./Å        min./Å
   1 H    6 C          14     1.0896414     1.0966110     1.0757376
   6 C    6 C           9     1.5082276     1.5482359     1.3192487
   6 C    8 O           6     1.3198399     1.4221741     1.1923130


optimized geometry written to: xtbopt.xyz


           -------------------------------------------------
          | TOTAL ENERGY              -49.133994343520 Eh   |
          | GRADIENT NORM               0.000576039946 Eh/α |
          | HOMO-LUMO GAP               4.600018647010 eV   |
           -------------------------------------------------

------------------------------------------------------------------------
 * finished run on 2021/05/19 at 10:59:19.442     
------------------------------------------------------------------------
 total:
 * wall-time:     0 d,  0 h,  0 min,  1.973 sec
 *  cpu-time:     0 d,  0 h,  0 min,  0.994 sec
 * ratio c/w:     0.504 speedup
 SCF:
 * wall-time:     0 d,  0 h,  0 min,  0.084 sec
 *  cpu-time:     0 d,  0 h,  0 min,  0.047 sec
 * ratio c/w:     0.559 speedup
 ANC optimizer:
 * wall-time:     0 d,  0 h,  0 min,  1.844 sec
 *  cpu-time:     0 d,  0 h,  0 min,  0.924 sec
 * ratio c/w:     0.501 speedup

