      -----------------------------------------------------------      
     |                   =====================                   |     
     |                           x T B                           |     
     |                   =====================                   |     
     |                         S. Grimme                         |     
     |          Mulliken Center for Theoretical Chemistry        |     
     |                    University of Bonn                     |     
     |                Version 6.2 RC2 (SAW190805)                |     
      -----------------------------------------------------------      

   This program is distributed in the hope that it will be useful,
   but WITHOUT ANY WARRANTY; without even the implied warranty of
   MERCHANTABILITY or FITNESS FOR A PARTICULAR PURPOSE.
   
   FOR NON-COMMERCIAL, ACADEMIA USE ONLY.
   
   Cite this work as:
   * S. Grimme, C. Bannwarth, P. Shushkov, J. Chem. Theory Comput., 2017,
     13, 1989-2009. DOI: 10.1021/acs.jctc.7b00118
   * C. Bannwarth, S. Ehlert and S. Grimme., J. Chem. Theory Comput., 2019,
     15, 1652-1671. DOI: 10.1021/acs.jctc.8b01176
   * P. Pracht, E. Caldeweyher, S. Ehlert, S. Grimme, ChemRxiv, 2019, preprint.
     DOI: 10.26434/chemrxiv.8326202.v1
   
   for DFT-D4:
   * E. Caldeweyher, C. Bannwarth and S. Grimme, J. Chem. Phys., 2017,
     147, 034112. DOI: 10.1063/1.4993215
   * E. Caldeweyher, S. Ehlert, A. Hansen, H. Neugebauer, S. Spicher,
     C. Bannwarth and S. Grimme, J. Chem. Phys., 2019, 150, 154122.
     DOI: 10.1063/1.5090222
   
   for sTDA-xTB:
   * S. Grimme and C. Bannwarth, J. Chem. Phys., 2016, 145, 054103.
     DOI: 10.1063/1.4959605
   
   in the mass-spec context:
   * V. Asgeirsson, C. Bauer and S. Grimme, Chem. Sci., 2017, 8, 4879.
     DOI: 10.1039/c7sc00601b
   
   for metadynamics refer to:
   * S. Grimme, J. Chem. Theory Comput., 2019, 155, 2847-2862
     DOI: 10.1021/acs.jctc.9b00143
   
   with help from (in alphabetical order)
   C. Bannwarth, F. Bohle, G. Brandenburg, E. Caldeweyher, M. Checinski,
   S. Dohm, S. Ehlert, S. Ehrlich, F. März, H. Neugebauer, J. Pisarek,
   P. Pracht, P. Shushkov, and S. Spicher.
   
 * started run on 2021/05/19 at 10:59:24.532     

           -------------------------------------------------
          |                Calculation Setup                |
           -------------------------------------------------

          program call               : /ihome/ghutchison/geoffh/xtb/xtb 416.xyz -opt
          hostname                   : smp-n126
          coordinate file            : 416.xyz
          omp threads                :                     1
          number of atoms            :                    32
          number of electrons        :                    82
          charge                     :                     0
          spin                       :                   0.0
          first test random number   :      0.59606491525914


########################################################################
# WARNING! Please study the warnings concerning your input carefully
#  - the use of '-opt' is discouraged, please use '--opt' next time
########################################################################

           ------------------------------------------------- 
          |                 G F N 2 - x T B                 |
          | Geometry, Frequencies, Noncovalent interactions |
          |            JCTC 2019 parametrisation            |
           ------------------------------------------------- 
             KAB for C  - Si     :                1.0500
             KAB for H  - Pd     :                0.9500
             k(s)              :                1.8500
             k(p)              :                2.2300
             k(d)              :                2.2300
             k(f)              :                2.0000
             kEN (H0ij)        :               -2.0000
             D4 a1             :                0.5200
             D4 a2             :                5.0000
             D4 s6             :                1.0000
             D4 s8             :                2.7000
             D4 s9             :                5.0000
             alphaj            :                2.0000

  Z AO/shell   Hii/eV     exponent
  1     Wed Apr 25 08:07:45 CEST 2018   EN: 2.200 GM2: 0.406  GM3: 0.0800  RAES: 1.40
     1s    -10.707211    1.230000
  6     Wed Apr 25 08:07:45 CEST 2018   EN: 2.550 GM2: 0.538  GM3: 0.1500  RAES: 3.00
     2s    -13.970922    2.096432
     2p    -10.063292    1.800000
  7     Wed Apr 25 08:07:45 CEST 2018   EN: 3.040 GM2: 0.461  GM3:-0.0640  RAES: 1.90
     2s    -16.686243    2.339881
     2p    -12.523956    2.014332

           ------------------------------------------------- 
          |        Self-Consistent Charge Iterations        |
           ------------------------------------------------- 

          ...................................................
          :                      SETUP                      :
          :.................................................:
          :  # basis functions                  80          :
          :  # atomic orbitals                  80          :
          :  # shells                           48          :
          :  # electrons                        82          :
          :  max. iterations                   250          :
          :  Hamiltonian                  GFN2-xTB          :
          :  restarted?                      false          :
          :  GBSA solvation                  false          :
          :  PC potential                    false          :
          :  electronic temp.          300.0000000     K    :
          :  accuracy                    1.0000000          :
          :  -> integral cutoff          0.2500000E+02      :
          :  -> integral neglect         0.1000000E-07      :
          :  -> SCF convergence          0.1000000E-05 Eh   :
          :  -> wf. convergence          0.1000000E-03 e    :
          :  Broyden damping             0.4000000          :
          ...................................................

 iter      E             dE          RMSdq      gap      omega  full diag
   1    -44.6062422 -0.446062E+02  0.415E+00    1.87       0.0  T
   2    -44.6503943 -0.441521E-01  0.246E+00    1.68       1.0  T
   3    -44.6408251  0.956924E-02  0.106E+00    1.61       1.0  T
   4    -44.6559333 -0.151082E-01  0.340E-01    1.43       1.0  T
   5    -44.6587272 -0.279397E-02  0.130E-01    1.46       1.0  T
   6    -44.6590558 -0.328570E-03  0.482E-02    1.46       1.0  T
   7    -44.6590850 -0.292344E-04  0.265E-02    1.46       1.0  T
   8    -44.6590930 -0.800513E-05  0.106E-02    1.46       1.7  T
   9    -44.6590940 -0.989754E-06  0.270E-03    1.46       6.5  T
  10    -44.6590942 -0.175767E-06  0.954E-04    1.46      18.5  T
  11    -44.6590942 -0.155906E-07  0.429E-04    1.46      41.2  T

   *** convergence criteria satisfied after 11 iterations ***

         #    Occupation            Energy/Eh            Energy/eV
      -------------------------------------------------------------
         1        2.0000           -0.6646366             -18.0857
       ...           ...                  ...                  ...
        35        2.0000           -0.4280781             -11.6486
        36        2.0000           -0.4254878             -11.5781
        37        2.0000           -0.4172483             -11.3539
        38        2.0000           -0.4049543             -11.0194
        39        2.0000           -0.4017244             -10.9315
        40        2.0000           -0.3788387             -10.3087
        41        2.0000           -0.3487344              -9.4895 (HOMO)
        42                         -0.2950908              -8.0298 (LUMO)
        43                         -0.2357388              -6.4148
        44                         -0.2333841              -6.3507
        45                         -0.1810630              -4.9270
        46                         -0.1595608              -4.3419
       ...                                ...                  ...
        80                          0.6683590              18.1870
      -------------------------------------------------------------
                  HL-Gap            0.0536437 Eh            1.4597 eV
             Fermi-level           -0.3219126 Eh           -8.7597 eV

 SCC (total)                   0 d,  0 h,  0 min,  0.087 sec
 SCC setup                      ...        0 min,  0.000 sec (  0.407%)
 Dispersion                     ...        0 min,  0.001 sec (  0.614%)
 integral evaluation            ...        0 min,  0.012 sec ( 13.236%)
 zeroth order Hamiltonian       ...        0 min,  0.000 sec (  0.252%)
 iterations                     ...        0 min,  0.043 sec ( 49.003%)
 molecular gradient             ...        0 min,  0.031 sec ( 35.960%)
 printout                       ...        0 min,  0.000 sec (  0.469%)

         :::::::::::::::::::::::::::::::::::::::::::::::::::::
         ::                     SUMMARY                     ::
         :::::::::::::::::::::::::::::::::::::::::::::::::::::
         :: total energy             -43.956235389704 Eh    ::
         :: gradient norm              0.102222807396 Eh/a0 ::
         :: HOMO-LUMO gap              1.459718951380 eV    ::
         ::.................................................::
         :: SCC energy               -44.659094209447 Eh    ::
         :: -> isotropic ES            0.019910868207 Eh    ::
         :: -> anisotropic ES          0.007035181539 Eh    ::
         :: -> anisotropic XC          0.037212147084 Eh    ::
         :: -> dispersion             -0.031088121896 Eh    ::
         :: repulsion energy           0.702739144283 Eh    ::
         :: add. restraining           0.000000000000 Eh    ::
         :::::::::::::::::::::::::::::::::::::::::::::::::::::

      ----------------------------------------------------------- 
     |                   =====================                   |
     |                        A N C O P T                        |
     |                   =====================                   |
     |               Approximate Normal Coordinate               |
     |                Rational Function Optimizer                |
      ----------------------------------------------------------- 

          ...................................................
          :                      SETUP                      :
          :.................................................:
          :   optimization level            normal          :
          :   max. optcycles                   200          :
          :   ANC micro-cycles                  20          :
          :   degrees of freedom                90          :
          :.................................................:
          :   RF solver                   davidson          :
          :   input Hessian                  false          :
          :   write xtbopt.log                true          :
          :   linear?                        false          :
          :   energy convergence         0.5000000E-05 Eh   :
          :   grad. convergence          0.1000000E-02 Eh/α :
          :   maximium RF displ.         2.0000000          :
          :   Hlow (freq-cutoff)         0.5000000E-02      :
          :   Hmax (freq-cutoff)         5.0000000          :
          :   S6 in model hess.         20.0000000          :
          ...................................................

generating ANC from model Hessian ...
Using Lindh-Hessian (1995)
 Shifting diagonal of input Hessian by   4.412069637199879E-003
 Lowest  eigenvalues of input Hessian
   -0.000000   -0.000000    0.000000    0.000000    0.000000    0.000000
    0.005000    0.005849    0.006232    0.006917    0.007909    0.008597
    0.009002    0.010163    0.012017    0.012924    0.013010    0.019290
 Highest eigenvalues
    1.812958    1.853704    1.892060    1.963434    2.055095    2.150761
 

........................................................................
.............................. CYCLE    1 ..............................
........................................................................
   1    -44.6590942 -0.446591E+02  0.970E-05    1.46       0.0  T
   2    -44.6590942 -0.669687E-10  0.590E-05    1.46     299.6  T
   3    -44.6590942 -0.254730E-10  0.381E-05    1.46     464.0  T
     SCC iter.                  ...        0 min,  0.005 sec
     gradient                   ...        0 min,  0.018 sec
 * total energy  :   -43.9562354 Eh     change       -0.1095806E-08 Eh
   gradient norm :     0.1022219 Eh/α   predicted     0.0000000E+00 (-100.00%)
   displ. norm   :     0.2706866 α      lambda       -0.1057707E-01
   maximum displ.:     0.0918049 α      in ANC's #10, #12, #30, ...

........................................................................
.............................. CYCLE    2 ..............................
........................................................................
   1    -44.6915034 -0.446915E+02  0.163E-01    1.56       0.0  T
   2    -44.6915738 -0.704273E-04  0.100E-01    1.56       1.0  T
   3    -44.6915383  0.354947E-04  0.560E-02    1.56       1.0  T
   4    -44.6916038 -0.654458E-04  0.132E-02    1.55       1.3  T
   5    -44.6916088 -0.500394E-05  0.319E-03    1.55       5.5  T
   6    -44.6916089 -0.859948E-07  0.168E-03    1.55      10.5  T
     SCC iter.                  ...        0 min,  0.009 sec
     gradient                   ...        0 min,  0.017 sec
 * total energy  :   -43.9635970 Eh     change       -0.7361566E-02 Eh
   gradient norm :     0.0449821 Eh/α   predicted    -0.5676042E-02 ( -22.90%)
   displ. norm   :     0.2493322 α      lambda       -0.3204860E-02
   maximum displ.:     0.1097847 α      in ANC's #10, #7, #9, ...

........................................................................
.............................. CYCLE    3 ..............................
........................................................................
   1    -44.7082914 -0.447083E+02  0.141E-01    1.62       0.0  T
   2    -44.7083249 -0.335353E-04  0.836E-02    1.62       1.0  T
   3    -44.7082863  0.385669E-04  0.469E-02    1.61       1.0  T
   4    -44.7083444 -0.580879E-04  0.775E-03    1.61       2.3  T
   5    -44.7083460 -0.153928E-05  0.270E-03    1.61       6.6  T
   6    -44.7083460 -0.434612E-07  0.145E-03    1.61      12.2  T
     SCC iter.                  ...        0 min,  0.009 sec
     gradient                   ...        0 min,  0.017 sec
 * total energy  :   -43.9653673 Eh     change       -0.1770379E-02 Eh
   gradient norm :     0.0094011 Eh/α   predicted    -0.1702056E-02 (  -3.86%)
   displ. norm   :     0.1742532 α      lambda       -0.4165457E-03
   maximum displ.:     0.0917585 α      in ANC's #7, #10, #6, ...

........................................................................
.............................. CYCLE    4 ..............................
........................................................................
   1    -44.7077387 -0.447077E+02  0.745E-02    1.62       0.0  T
   2    -44.7077404 -0.173474E-05  0.432E-02    1.62       1.0  T
   3    -44.7077319  0.849022E-05  0.165E-02    1.62       1.1  T
   4    -44.7077418 -0.989507E-05  0.260E-03    1.62       6.8  T
   5    -44.7077419 -0.706180E-07  0.136E-03    1.62      13.0  T
   6    -44.7077419 -0.189365E-07  0.432E-04    1.62      40.9  T
     SCC iter.                  ...        0 min,  0.009 sec
     gradient                   ...        0 min,  0.017 sec
 * total energy  :   -43.9656821 Eh     change       -0.3147423E-03 Eh
   gradient norm :     0.0062243 Eh/α   predicted    -0.2145984E-03 ( -31.82%)
   displ. norm   :     0.2592676 α      lambda       -0.3880906E-03
   maximum displ.:     0.1320428 α      in ANC's #7, #6, #9, ...

........................................................................
.............................. CYCLE    5 ..............................
........................................................................
   1    -44.7055802 -0.447056E+02  0.110E-01    1.62       0.0  T
   2    -44.7055829 -0.276448E-05  0.645E-02    1.62       1.0  T
   3    -44.7055642  0.187447E-04  0.248E-02    1.62       1.0  T
   4    -44.7055856 -0.214019E-04  0.329E-03    1.62       5.4  T
   5    -44.7055857 -0.918564E-07  0.181E-03    1.62       9.8  T
   6    -44.7055857 -0.358046E-07  0.626E-04    1.62      28.2  T
     SCC iter.                  ...        0 min,  0.009 sec
     gradient                   ...        0 min,  0.017 sec
 * total energy  :   -43.9658880 Eh     change       -0.2059433E-03 Eh
   gradient norm :     0.0051805 Eh/α   predicted    -0.2071004E-03 (   0.56%)
   displ. norm   :     0.1329882 α      lambda       -0.1433098E-03
   maximum displ.:     0.0626519 α      in ANC's #6, #7, #1, ...

........................................................................
.............................. CYCLE    6 ..............................
........................................................................
   1    -44.7059370 -0.447059E+02  0.548E-02    1.62       0.0  T
   2    -44.7059376 -0.508031E-06  0.324E-02    1.62       1.0  T
   3    -44.7059339  0.363202E-05  0.104E-02    1.62       1.7  T
   4    -44.7059380 -0.408629E-05  0.135E-03    1.62      13.1  T
   5    -44.7059380 -0.203621E-07  0.729E-04    1.62      24.3  T
   6    -44.7059380 -0.461644E-08  0.296E-04    1.62      59.8  T
     SCC iter.                  ...        0 min,  0.009 sec
     gradient                   ...        0 min,  0.017 sec
 * total energy  :   -43.9659622 Eh     change       -0.7419532E-04 Eh
   gradient norm :     0.0049357 Eh/α   predicted    -0.7292365E-04 (  -1.71%)
   displ. norm   :     0.0934718 α      lambda       -0.8205711E-04
   maximum displ.:     0.0445244 α      in ANC's #1, #6, #5, ...

........................................................................
.............................. CYCLE    7 ..............................
........................................................................
   1    -44.7071801 -0.447072E+02  0.343E-02    1.62       0.0  T
   2    -44.7071803 -0.199403E-06  0.202E-02    1.62       1.0  T
   3    -44.7071799  0.361926E-06  0.373E-03    1.62       4.7  T
   4    -44.7071803 -0.421754E-06  0.913E-04    1.62      19.4  T
   5    -44.7071804 -0.163181E-07  0.372E-04    1.62      47.5  T
     SCC iter.                  ...        0 min,  0.007 sec
     gradient                   ...        0 min,  0.017 sec
 * total energy  :   -43.9660281 Eh     change       -0.6585948E-04 Eh
   gradient norm :     0.0031605 Eh/α   predicted    -0.4138863E-04 ( -37.16%)
   displ. norm   :     0.2164667 α      lambda       -0.1297261E-03
   maximum displ.:     0.1070535 α      in ANC's #1, #5, #6, ...

........................................................................
.............................. CYCLE    8 ..............................
........................................................................
   1    -44.7080431 -0.447080E+02  0.841E-02    1.61       0.0  T
   2    -44.7080439 -0.802375E-06  0.495E-02    1.61       1.0  T
   3    -44.7080417  0.218249E-05  0.973E-03    1.61       1.8  T
   4    -44.7080443 -0.259233E-05  0.169E-03    1.61      10.5  T
   5    -44.7080444 -0.312097E-07  0.867E-04    1.61      20.4  T
   6    -44.7080444 -0.511494E-08  0.306E-04    1.61      57.7  T
     SCC iter.                  ...        0 min,  0.009 sec
     gradient                   ...        0 min,  0.018 sec
 * total energy  :   -43.9661134 Eh     change       -0.8531761E-04 Eh
   gradient norm :     0.0024412 Eh/α   predicted    -0.6790621E-04 ( -20.41%)
   displ. norm   :     0.1631394 α      lambda       -0.5756153E-04
   maximum displ.:     0.0917296 α      in ANC's #5, #1, #6, ...

........................................................................
.............................. CYCLE    9 ..............................
........................................................................
   1    -44.7078995 -0.447079E+02  0.642E-02    1.61       0.0  T
   2    -44.7078999 -0.420947E-06  0.377E-02    1.61       1.0  T
   3    -44.7078984  0.150558E-05  0.692E-03    1.61       2.6  T
   4    -44.7079002 -0.180163E-05  0.103E-03    1.61      17.2  T
   5    -44.7079002 -0.188621E-09  0.454E-04    1.61      39.0  T
   6    -44.7079002 -0.439292E-08  0.141E-04    1.61     125.7  T
     SCC iter.                  ...        0 min,  0.009 sec
     gradient                   ...        0 min,  0.018 sec
 * total energy  :   -43.9661568 Eh     change       -0.4338633E-04 Eh
   gradient norm :     0.0027314 Eh/α   predicted    -0.2955184E-04 ( -31.89%)
   displ. norm   :     0.1340024 α      lambda       -0.4880001E-04
   maximum displ.:     0.0835287 α      in ANC's #5, #1, #6, ...

........................................................................
.............................. CYCLE   10 ..............................
........................................................................
   1    -44.7080147 -0.447080E+02  0.544E-02    1.61       0.0  T
   2    -44.7080151 -0.400526E-06  0.317E-02    1.60       1.0  T
   3    -44.7080139  0.124501E-05  0.624E-03    1.60       2.8  T
   4    -44.7080154 -0.150525E-05  0.102E-03    1.60      17.4  T
   5    -44.7080154 -0.553015E-09  0.443E-04    1.60      39.9  T
   6    -44.7080154 -0.325491E-08  0.138E-04    1.60     128.0  T
     SCC iter.                  ...        0 min,  0.009 sec
     gradient                   ...        0 min,  0.018 sec
 * total energy  :   -43.9661961 Eh     change       -0.3932083E-04 Eh
   gradient norm :     0.0021470 Eh/α   predicted    -0.2483919E-04 ( -36.83%)
   displ. norm   :     0.1524826 α      lambda       -0.4699978E-04
   maximum displ.:     0.0984890 α      in ANC's #5, #1, #6, ...

........................................................................
.............................. CYCLE   11 ..............................
........................................................................
   1    -44.7074322 -0.447074E+02  0.618E-02    1.60       0.0  T
   2    -44.7074326 -0.422160E-06  0.361E-02    1.60       1.0  T
   3    -44.7074319  0.643513E-06  0.506E-03    1.60       3.5  T
   4    -44.7074328 -0.845274E-06  0.113E-03    1.60      15.7  T
   5    -44.7074328 -0.557828E-08  0.542E-04    1.60      32.6  T
   6    -44.7074328 -0.370892E-08  0.183E-04    1.60      96.4  T
     SCC iter.                  ...        0 min,  0.009 sec
     gradient                   ...        0 min,  0.018 sec
 * total energy  :   -43.9662318 Eh     change       -0.3567083E-04 Eh
   gradient norm :     0.0017564 Eh/α   predicted    -0.2404796E-04 ( -32.58%)
   displ. norm   :     0.2567169 α      lambda       -0.4127846E-04
   maximum displ.:     0.1675453 α      in ANC's #1, #5, #6, ...

........................................................................
.............................. CYCLE   12 ..............................
........................................................................
   1    -44.7072520 -0.447073E+02  0.107E-01    1.60       0.0  T
   2    -44.7072533 -0.129507E-05  0.625E-02    1.60       1.0  T
   3    -44.7072525  0.781167E-06  0.683E-03    1.60       2.6  T
   4    -44.7072538 -0.129098E-05  0.209E-03    1.60       8.5  T
   5    -44.7072538 -0.315966E-07  0.866E-04    1.60      20.4  T
   6    -44.7072539 -0.770912E-08  0.197E-04    1.60      89.5  T
     SCC iter.                  ...        0 min,  0.009 sec
     gradient                   ...        0 min,  0.018 sec
 * total energy  :   -43.9662600 Eh     change       -0.2827508E-04 Eh
   gradient norm :     0.0033883 Eh/α   predicted    -0.2124836E-04 ( -24.85%)
   displ. norm   :     0.0692943 α      lambda       -0.2071821E-04
   maximum displ.:     0.0450968 α      in ANC's #1, #5, #6, ...

........................................................................
.............................. CYCLE   13 ..............................
........................................................................
   1    -44.7071410 -0.447071E+02  0.251E-02    1.60       0.0  T
   2    -44.7071411 -0.976027E-07  0.148E-02    1.60       1.2  T
   3    -44.7071402  0.925717E-06  0.601E-03    1.60       2.9  T
   4    -44.7071413 -0.103798E-05  0.452E-04    1.60      39.1  T
   5    -44.7071413 -0.188432E-08  0.252E-04    1.60      70.2  T
   6    -44.7071413 -0.780695E-09  0.116E-04    1.60     152.7  T
     SCC iter.                  ...        0 min,  0.009 sec
     gradient                   ...        0 min,  0.018 sec
 * total energy  :   -43.9662730 Eh     change       -0.1295648E-04 Eh
   gradient norm :     0.0019151 Eh/α   predicted    -0.1041003E-04 ( -19.65%)
   displ. norm   :     0.0839968 α      lambda       -0.1733896E-04
   maximum displ.:     0.0620348 α      in ANC's #1, #5, #7, ...

........................................................................
.............................. CYCLE   14 ..............................
........................................................................
   1    -44.7079363 -0.447079E+02  0.319E-02    1.60       0.0  T
   2    -44.7079364 -0.148050E-06  0.189E-02    1.60       1.0  T
   3    -44.7079350  0.141536E-05  0.657E-03    1.60       2.7  T
   4    -44.7079366 -0.159749E-05  0.708E-04    1.60      25.0  T
   5    -44.7079366 -0.564810E-08  0.364E-04    1.60      48.6  T
   6    -44.7079366 -0.818950E-09  0.149E-04    1.60     118.5  T
     SCC iter.                  ...        0 min,  0.009 sec
     gradient                   ...        0 min,  0.018 sec
 * total energy  :   -43.9662906 Eh     change       -0.1764196E-04 Eh
   gradient norm :     0.0021226 Eh/α   predicted    -0.8699818E-05 ( -50.69%)
   displ. norm   :     0.1159724 α      lambda       -0.2179483E-04
   maximum displ.:     0.0845818 α      in ANC's #1, #5, #7, ...

........................................................................
.............................. CYCLE   15 ..............................
........................................................................
   1    -44.7076519 -0.447077E+02  0.467E-02    1.60       0.0  T
   2    -44.7076520 -0.157015E-06  0.275E-02    1.60       1.0  T
   3    -44.7076511  0.885589E-06  0.549E-03    1.60       3.2  T
   4    -44.7076521 -0.101208E-05  0.647E-04    1.60      27.3  T
   5    -44.7076521 -0.256965E-08  0.398E-04    1.60      44.4  T
   6    -44.7076521 -0.145565E-08  0.146E-04    1.60     121.4  T
     SCC iter.                  ...        0 min,  0.009 sec
     gradient                   ...        0 min,  0.018 sec
 * total energy  :   -43.9663061 Eh     change       -0.1541572E-04 Eh
   gradient norm :     0.0022594 Eh/α   predicted    -0.1104637E-04 ( -28.34%)
   displ. norm   :     0.1156160 α      lambda        0.1933815E-05
   maximum displ.:     0.0840903 α      in ANC's #1, #5, #7, ...

........................................................................
.............................. CYCLE   16 ..............................
........................................................................
   1    -44.7071460 -0.447071E+02  0.462E-02    1.60       0.0  T
   2    -44.7071461 -0.156798E-06  0.272E-02    1.60       1.0  T
   3    -44.7071453  0.876707E-06  0.550E-03    1.60       3.2  T
   4    -44.7071463 -0.100171E-05  0.650E-04    1.60      27.2  T
   5    -44.7071463 -0.262252E-08  0.402E-04    1.60      43.9  T
   6    -44.7071463 -0.151845E-08  0.146E-04    1.60     121.0  T
     SCC iter.                  ...        0 min,  0.009 sec
     gradient                   ...        0 min,  0.018 sec
 * total energy  :   -43.9663057 Eh     change        0.3619306E-06 Eh
   gradient norm :     0.0043240 Eh/α   predicted     0.9786219E-06 ( 170.39%)
   displ. norm   :     0.0567893 α      lambda       -0.3241136E-04
   maximum displ.:     0.0321973 α      in ANC's #3, #1, #6, ...

........................................................................
.............................. CYCLE   17 ..............................
........................................................................
   1    -44.7080899 -0.447081E+02  0.186E-02    1.60       0.0  T
   2    -44.7080899 -0.317576E-07  0.110E-02    1.60       1.6  T
   3    -44.7080895  0.357705E-06  0.363E-03    1.60       4.9  T
   4    -44.7080899 -0.398781E-06  0.325E-04    1.60      54.3  T
   5    -44.7080899 -0.374285E-09  0.212E-04    1.60      83.5  T
     SCC iter.                  ...        0 min,  0.008 sec
     gradient                   ...        0 min,  0.017 sec
 * total energy  :   -43.9663280 Eh     change       -0.2226123E-04 Eh
   gradient norm :     0.0027744 Eh/α   predicted    -0.1626001E-04 ( -26.96%)
   displ. norm   :     0.1221978 α      lambda       -0.2897590E-04
   maximum displ.:     0.0876539 α      in ANC's #1, #3, #2, ...

........................................................................
.............................. CYCLE   18 ..............................
........................................................................
   1    -44.7080761 -0.447081E+02  0.410E-02    1.60       0.0  T
   2    -44.7080762 -0.145273E-06  0.241E-02    1.60       1.0  T
   3    -44.7080757  0.491923E-06  0.385E-03    1.60       4.6  T
   4    -44.7080763 -0.587247E-06  0.586E-04    1.60      30.2  T
   5    -44.7080763 -0.118444E-08  0.340E-04    1.60      52.0  T
     SCC iter.                  ...        0 min,  0.007 sec
     gradient                   ...        0 min,  0.018 sec
 * total energy  :   -43.9663502 Eh     change       -0.2228670E-04 Eh
   gradient norm :     0.0017613 Eh/α   predicted    -0.1470703E-04 ( -34.01%)
   displ. norm   :     0.4019839 α      lambda       -0.3675778E-04
   maximum displ.:     0.2996027 α      in ANC's #1, #5, #3, ...

........................................................................
.............................. CYCLE   19 ..............................
........................................................................
   1    -44.7064087 -0.447064E+02  0.138E-01    1.60       0.0  T
   2    -44.7064099 -0.118837E-05  0.808E-02    1.60       1.0  T
   3    -44.7064092  0.665343E-06  0.623E-03    1.60       2.8  T
   4    -44.7064104 -0.122910E-05  0.173E-03    1.60      10.2  T
   5    -44.7064104 -0.160404E-07  0.865E-04    1.60      20.4  T
   6    -44.7064104 -0.584063E-08  0.292E-04    1.60      60.6  T
     SCC iter.                  ...        0 min,  0.009 sec
     gradient                   ...        0 min,  0.018 sec
 * total energy  :   -43.9663780 Eh     change       -0.2774076E-04 Eh
   gradient norm :     0.0019040 Eh/α   predicted    -0.1969944E-04 ( -28.99%)
   displ. norm   :     0.4012371 α      lambda        0.5437919E-04
   maximum displ.:     0.2985655 α      in ANC's #1, #5, #3, ...

........................................................................
.............................. CYCLE   20 ..............................
........................................................................
   1    -44.7025723 -0.447026E+02  0.135E-01    1.59       0.0  T
   2    -44.7025736 -0.124514E-05  0.795E-02    1.59       1.0  T
   3    -44.7025733  0.322866E-06  0.546E-03    1.59       3.2  T
   4    -44.7025741 -0.856572E-06  0.180E-03    1.59       9.8  T
   5    -44.7025741 -0.234161E-07  0.900E-04    1.59      19.7  T
   6    -44.7025741 -0.539607E-08  0.310E-04    1.59      56.9  T
     SCC iter.                  ...        0 min,  0.009 sec
     gradient                   ...        0 min,  0.018 sec
 * total energy  :   -43.9662971 Eh     change        0.8087241E-04 Eh
   gradient norm :     0.0077919 Eh/α   predicted     0.2913277E-04 ( -63.98%)
   displ. norm   :     0.2129525 α      lambda       -0.1266677E-03
   maximum displ.:     0.1530572 α      in ANC's #1, #5, #2, ...
 * RMSD in coord.:     0.4209145 α      energy gain  -0.1006173E-01 Eh

generating ANC from model Hessian ...
Using Lindh-Hessian (1995)
 Shifting diagonal of input Hessian by   4.383969929643927E-003
 Lowest  eigenvalues of input Hessian
   -0.000000   -0.000000   -0.000000   -0.000000    0.000000    0.000000
    0.005000    0.005981    0.006278    0.006859    0.008198    0.008523
    0.009403    0.010457    0.012389    0.012939    0.013634    0.020024
 Highest eigenvalues
    1.893264    1.923230    1.969580    2.054706    2.099566    2.201140
 

........................................................................
.............................. CYCLE   21 ..............................
........................................................................
   1    -44.7058783 -0.447059E+02  0.732E-02    1.59       0.0  T
   2    -44.7058788 -0.484544E-06  0.429E-02    1.60       1.0  T
   3    -44.7058782  0.545103E-06  0.478E-03    1.60       3.7  T
   4    -44.7058790 -0.757209E-06  0.109E-03    1.60      16.3  T
   5    -44.7058790 -0.928593E-08  0.537E-04    1.60      32.9  T
   6    -44.7058790 -0.946194E-09  0.210E-04    1.60      84.3  T
     SCC iter.                  ...        0 min,  0.009 sec
     gradient                   ...        0 min,  0.018 sec
 * total energy  :   -43.9663764 Eh     change       -0.7926408E-04 Eh
   gradient norm :     0.0031761 Eh/α   predicted     0.0000000E+00 (-100.00%)
   displ. norm   :     0.0306021 α      lambda       -0.2527219E-04
   maximum displ.:     0.0148229 α      in ANC's #4, #1, #10, ...

........................................................................
.............................. CYCLE   22 ..............................
........................................................................
   1    -44.7075039 -0.447075E+02  0.122E-02    1.60       0.0  T
   2    -44.7075039 -0.483094E-07  0.721E-03    1.60       2.5  T
   3    -44.7075038  0.169981E-06  0.224E-03    1.60       7.9  T
   4    -44.7075040 -0.195860E-06  0.361E-04    1.60      49.0  T
   5    -44.7075040 -0.241617E-08  0.146E-04    1.60     121.4  T
     SCC iter.                  ...        0 min,  0.007 sec
     gradient                   ...        0 min,  0.018 sec
 * total energy  :   -43.9663934 Eh     change       -0.1703188E-04 Eh
   gradient norm :     0.0008839 Eh/α   predicted    -0.1264867E-04 ( -25.74%)
   displ. norm   :     0.0482350 α      lambda       -0.9501589E-05
   maximum displ.:     0.0213356 α      in ANC's #4, #10, #7, ...

........................................................................
.............................. CYCLE   23 ..............................
........................................................................
   1    -44.7084855 -0.447085E+02  0.202E-02    1.60       0.0  T
   2    -44.7084856 -0.586226E-07  0.120E-02    1.60       1.5  T
   3    -44.7084853  0.284238E-06  0.284E-03    1.60       6.2  T
   4    -44.7084856 -0.320970E-06  0.455E-04    1.60      38.8  T
   5    -44.7084856 -0.339080E-08  0.197E-04    1.60      89.9  T
     SCC iter.                  ...        0 min,  0.007 sec
     gradient                   ...        0 min,  0.018 sec
 * total energy  :   -43.9664015 Eh     change       -0.8108017E-05 Eh
   gradient norm :     0.0012450 Eh/α   predicted    -0.4756177E-05 ( -41.34%)
   displ. norm   :     0.0634107 α      lambda       -0.8427941E-05
   maximum displ.:     0.0281127 α      in ANC's #4, #10, #8, ...

........................................................................
.............................. CYCLE   24 ..............................
........................................................................
   1    -44.7083752 -0.447084E+02  0.254E-02    1.60       0.0  T
   2    -44.7083752 -0.404190E-07  0.150E-02    1.60       1.2  T
   3    -44.7083751  0.119995E-06  0.194E-03    1.60       9.1  T
   4    -44.7083752 -0.140965E-06  0.374E-04    1.60      47.3  T
   5    -44.7083752 -0.170530E-08  0.183E-04    1.60      96.4  T
     SCC iter.                  ...        0 min,  0.007 sec
     gradient                   ...        0 min,  0.018 sec
 * total energy  :   -43.9664083 Eh     change       -0.6757709E-05 Eh
   gradient norm :     0.0014436 Eh/α   predicted    -0.4224322E-05 ( -37.49%)
   displ. norm   :     0.0639178 α      lambda       -0.7581165E-05
   maximum displ.:     0.0301014 α      in ANC's #4, #1, #8, ...

........................................................................
.............................. CYCLE   25 ..............................
........................................................................
   1    -44.7075710 -0.447076E+02  0.251E-02    1.60       0.0  T
   2    -44.7075710 -0.276573E-07  0.149E-02    1.60       1.2  T
   3    -44.7075710  0.399838E-07  0.135E-03    1.60      13.1  T
   4    -44.7075710 -0.539782E-07  0.298E-04    1.60      59.3  T
   5    -44.7075710 -0.285922E-09  0.140E-04    1.60     126.6  T
     SCC iter.                  ...        0 min,  0.007 sec
     gradient                   ...        0 min,  0.018 sec
 * total energy  :   -43.9664150 Eh     change       -0.6729360E-05 Eh
   gradient norm :     0.0009686 Eh/α   predicted    -0.3801837E-05 ( -43.50%)
   displ. norm   :     0.0304133 α      lambda       -0.2351682E-05
   maximum displ.:     0.0160571 α      in ANC's #1, #4, #6, ...

........................................................................
.............................. CYCLE   26 ..............................
........................................................................
   1    -44.7076132 -0.447076E+02  0.109E-02    1.60       0.0  T
   2    -44.7076132 -0.171216E-07  0.646E-03    1.60       2.7  T
   3    -44.7076131  0.490672E-07  0.123E-03    1.60      14.4  T
   4    -44.7076132 -0.570091E-07  0.236E-04    1.60      75.0  T
   5    -44.7076132 -0.600224E-09  0.118E-04    1.60     150.4  T
     SCC iter.                  ...        0 min,  0.021 sec
     gradient                   ...        0 min,  0.031 sec
 * total energy  :   -43.9664176 Eh     change       -0.2559617E-05 Eh
   gradient norm :     0.0003734 Eh/α   predicted    -0.1179982E-05 ( -53.90%)
   displ. norm   :     0.0366599 α      lambda       -0.1863447E-05
   maximum displ.:     0.0215036 α      in ANC's #1, #4, #2, ...

   *** GEOMETRY OPTIMIZATION CONVERGED AFTER 26 ITERATIONS ***

------------------------------------------------------------------------
 total energy gain   :        -0.0101822 Eh       -6.3894 kcal/mol
 total RMSD          :         0.4330826 a0        0.2292 Å
 total power (kW/mol):        -1.0282038 (step)  -25.4523 (real)
------------------------------------------------------------------------

 ANCopt (total)                0 d,  0 h,  0 min,  1.050 sec
 optimizer setup                ...        0 min,  0.000 sec (  0.014%)
 model hessian                  ...        0 min,  0.017 sec (  1.621%)
 ANC generation                 ...        0 min,  0.002 sec (  0.189%)
 coordinate transformation      ...        0 min,  0.001 sec (  0.049%)
 single point calculation       ...        0 min,  1.021 sec ( 97.185%)
 optimization log               ...        0 min,  0.003 sec (  0.306%)
 hessian update                 ...        0 min,  0.000 sec (  0.036%)
 rational function              ...        0 min,  0.005 sec (  0.445%)

================
 final structure:
================
$coord
   -2.15037387593683    2.79917480456982   -0.33667616476533      C 
   -4.39536009288493    1.51410288758411   -0.34509434871592      C 
   -4.45757440558872   -1.12799582796995   -0.24429718281098      C 
   -2.27731853652810   -2.55473604954430   -0.12920075600628      C 
    0.07460025943880   -1.24626153750999   -0.10585820377290      C 
    0.12734348469683    1.43274716227260   -0.21617065418109      C 
    2.35314813167084    2.67650555753426   -0.20396776263396      N 
    4.45233912111861    1.37511516011648   -0.09556538310288      C 
    6.85109153114635    2.88554375363775    0.00063281417388      C 
    7.61893518363720    3.37502195274584    2.74584268023950      C 
    4.40359610807318   -1.31577895658592    0.01048189351376      C 
    6.74746927532066   -2.91331408257556    0.02765493829675      C 
    7.56696289149999   -3.50063086432425   -2.68340614500642      C 
    2.25959553460235   -2.54864165030677    0.00631661049551      N 
   -2.23193044734640   -5.30161995071789   -0.03066113050971      C 
   -4.20799215466166   -6.83679130291497   -0.23304353470229      C 
   -2.06279775007024    4.83404971392764   -0.41632259329425      H 
   -6.15829955763702    2.54090937088291   -0.43082073026774      H 
   -6.27238147277729   -2.05870708800109   -0.25039855557477      H 
    6.49874665336253    4.69235761700050   -0.92706372533231      H 
    8.36957338089431    1.91116703062733   -0.99359983255036      H 
    6.12807796935504    4.40401675918204    3.71535262659377      H 
    9.34179745229653    4.49334047427912    2.81212856574390      H 
    7.94402310566388    1.60969047457062    3.74946634202003      H 
    6.30688906173934   -4.68218244016273    0.99089096838489      H 
    8.27486862424989   -1.96968200771892    1.03613434357581      H 
    6.06017215747111   -4.48902351936232   -3.67081989584608      H 
    9.24272663545119   -4.69014763642858   -2.67788446748963      H 
    7.99180952001582   -1.77324536014024   -3.71545501038822      H 
   -0.35671262376169   -6.07763681007534    0.20866916471799      H 
   -6.11075219558537   -6.16450797720239   -0.50104235545752      H 
   -3.98557692231124   -8.85696816888457   -0.14448275237920      H 
$end
           -------------------------------------------------
          |                Final Singlepoint                |
           -------------------------------------------------

          ...................................................
          :                      SETUP                      :
          :.................................................:
          :  # basis functions                  80          :
          :  # atomic orbitals                  80          :
          :  # shells                           48          :
          :  # electrons                        82          :
          :  max. iterations                   250          :
          :  Hamiltonian                  GFN2-xTB          :
          :  restarted?                      false          :
          :  GBSA solvation                  false          :
          :  PC potential                    false          :
          :  electronic temp.          300.0000000     K    :
          :  accuracy                    1.0000000          :
          :  -> integral cutoff          0.2500000E+02      :
          :  -> integral neglect         0.1000000E-07      :
          :  -> SCF convergence          0.1000000E-05 Eh   :
          :  -> wf. convergence          0.1000000E-03 e    :
          :  Broyden damping             0.4000000          :
          ...................................................

 iter      E             dE          RMSdq      gap      omega  full diag
   1    -44.7076132 -0.447076E+02  0.633E-05    1.60       0.0  T
   2    -44.7076132 -0.864731E-11  0.378E-05    1.60     468.1  T
   3    -44.7076132 -0.422062E-10  0.205E-05    1.60     863.9  T

   *** convergence criteria satisfied after 3 iterations ***

         #    Occupation            Energy/Eh            Energy/eV
      -------------------------------------------------------------
         1        2.0000           -0.6680022             -18.1773
       ...           ...                  ...                  ...
        35        2.0000           -0.4289578             -11.6725
        36        2.0000           -0.4264709             -11.6049
        37        2.0000           -0.4201597             -11.4331
        38        2.0000           -0.4034211             -10.9776
        39        2.0000           -0.4010209             -10.9123
        40        2.0000           -0.3795681             -10.3286
        41        2.0000           -0.3442100              -9.3664 (HOMO)
        42                         -0.2854801              -7.7683 (LUMO)
        43                         -0.2363652              -6.4318
        44                         -0.2338024              -6.3621
        45                         -0.1745723              -4.7504
        46                         -0.1462464              -3.9796
       ...                                ...                  ...
        80                          0.7120759              19.3766
      -------------------------------------------------------------
                  HL-Gap            0.0587298 Eh            1.5981 eV
             Fermi-level           -0.3148450 Eh           -8.5674 eV

 SCC (total)                   0 d,  0 h,  0 min,  0.075 sec
 SCC setup                      ...        0 min,  0.000 sec (  0.332%)
 Dispersion                     ...        0 min,  0.000 sec (  0.413%)
 integral evaluation            ...        0 min,  0.024 sec ( 32.569%)
 zeroth order Hamiltonian       ...        0 min,  0.000 sec (  0.277%)
 iterations                     ...        0 min,  0.005 sec (  6.680%)
 molecular gradient             ...        0 min,  0.044 sec ( 59.149%)
 printout                       ...        0 min,  0.000 sec (  0.511%)

         :::::::::::::::::::::::::::::::::::::::::::::::::::::
         ::                     SUMMARY                     ::
         :::::::::::::::::::::::::::::::::::::::::::::::::::::
         :: total energy             -43.966417559181 Eh    ::
         :: gradient norm              0.000373577173 Eh/a0 ::
         :: HOMO-LUMO gap              1.598119868614 eV    ::
         ::.................................................::
         :: SCC energy               -44.707613182742 Eh    ::
         :: -> isotropic ES            0.019483818886 Eh    ::
         :: -> anisotropic ES          0.005994032607 Eh    ::
         :: -> anisotropic XC          0.035876347742 Eh    ::
         :: -> dispersion             -0.031508365561 Eh    ::
         :: repulsion energy           0.741061092631 Eh    ::
         :: add. restraining           0.000000000000 Eh    ::
         :::::::::::::::::::::::::::::::::::::::::::::::::::::

           -------------------------------------------------
          |                Property Printout                |
           -------------------------------------------------

    * Orbital Energies and Occupations

         #    Occupation            Energy/Eh            Energy/eV
      -------------------------------------------------------------
         1        2.0000           -0.6680022             -18.1773
       ...           ...                  ...                  ...
        29        2.0000           -0.4564870             -12.4216
        30        2.0000           -0.4561664             -12.4129
        31        2.0000           -0.4529101             -12.3243
        32        2.0000           -0.4469504             -12.1621
        33        2.0000           -0.4412599             -12.0073
        34        2.0000           -0.4386239             -11.9356
        35        2.0000           -0.4289578             -11.6725
        36        2.0000           -0.4264709             -11.6049
        37        2.0000           -0.4201597             -11.4331
        38        2.0000           -0.4034211             -10.9776
        39        2.0000           -0.4010209             -10.9123
        40        2.0000           -0.3795681             -10.3286
        41        2.0000           -0.3442100              -9.3664 (HOMO)
        42                         -0.2854801              -7.7683 (LUMO)
        43                         -0.2363652              -6.4318
        44                         -0.2338024              -6.3621
        45                         -0.1745723              -4.7504
        46                         -0.1462464              -3.9796
        47                         -0.0607001              -1.6517
        48                          0.0840694               2.2876
        49                          0.0941847               2.5629
        50                          0.1115175               3.0345
        51                          0.1187160               3.2304
        52                          0.1212985               3.3007
       ...                                ...                  ...
        80                          0.7120759              19.3766
      -------------------------------------------------------------
                  HL-Gap            0.0587298 Eh            1.5981 eV
             Fermi-level           -0.3148450 Eh           -8.5674 eV

     #   Z        covCN         q      C6AA      α(0)
     1   6 C      2.917    -0.043    29.058     8.840
     2   6 C      2.915    -0.030    28.742     8.791
     3   6 C      2.921    -0.035    28.876     8.812
     4   6 C      2.968     0.006    27.877     8.660
     5   6 C      2.967     0.072    26.389     8.426
     6   6 C      2.962     0.076    26.297     8.411
     7   7 N      1.850    -0.241    27.134     7.720
     8   6 C      2.942     0.087    26.056     8.372
     9   6 C      3.809    -0.063    21.709     6.632
    10   6 C      3.754    -0.096    22.395     6.748
    11   6 C      2.941     0.086    26.080     8.376
    12   6 C      3.810    -0.063    21.698     6.631
    13   6 C      3.754    -0.096    22.391     6.747
    14   7 N      1.849    -0.239    27.089     7.714
    15   6 C      2.895    -0.029    28.714     8.786
    16   6 C      2.837    -0.085    30.115     8.993
    17   1 H      0.926     0.050     2.321     2.382
    18   1 H      0.926     0.037     2.493     2.469
    19   1 H      0.926     0.041     2.436     2.441
    20   1 H      0.924     0.056     2.247     2.344
    21   1 H      0.925     0.041     2.441     2.444
    22   1 H      0.925     0.044     2.397     2.421
    23   1 H      0.925     0.040     2.449     2.447
    24   1 H      0.925     0.033     2.543     2.494
    25   1 H      0.924     0.054     2.266     2.354
    26   1 H      0.925     0.041     2.441     2.443
    27   1 H      0.925     0.044     2.397     2.421
    28   1 H      0.925     0.040     2.450     2.448
    29   1 H      0.925     0.033     2.544     2.494
    30   1 H      0.925     0.060     2.194     2.316
    31   1 H      0.926     0.038     2.474     2.460
    32   1 H      0.926     0.039     2.459     2.452

 Mol. C6AA /au·bohr⁶  :      11369.157840
 Mol. C8AA /au·bohr⁸  :     269568.838816
 Mol. α(0) /au        :        167.490792


Wiberg/Mayer (AO) data.
largest (>0.10) Wiberg bond orders for each atom
          total WBO             WBO to atom ...
     1  C   3.988        C    2 1.536    C    6 1.270    H   17 0.967    C    4 0.105
     2  C   3.989        C    1 1.536    C    3 1.347    H   18 0.970
     3  C   3.989        C    4 1.470    C    2 1.347    H   19 0.966
     4  C   3.986        C    3 1.470    C    5 1.216    C   15 1.100    C    1 0.105
     5  C   3.980        N   14 1.296    C    6 1.231    C    4 1.216
     6  C   3.980        N    7 1.281    C    1 1.270    C    5 1.231
     7  N   3.060        C    8 1.537    C    6 1.281
     8  C   3.974        N    7 1.537    C   11 1.220    C    9 1.008
     9  C   3.995        C    8 1.008    C   10 0.996    H   20 0.972    H   21 0.969
    10  C   3.992        C    9 0.996    H   22 0.988    H   24 0.987    H   23 0.985
    11  C   3.966        N   14 1.530    C    8 1.220    C   12 1.008
    12  C   3.995        C   11 1.008    C   13 0.996    H   25 0.972    H   26 0.970
    13  C   3.992        C   12 0.996    H   27 0.988    H   29 0.987    H   28 0.985
    14  N   3.068        C   11 1.530    C    5 1.296
    15  C   3.989        C   16 1.890    C    4 1.100    H   30 0.960
    16  C   3.980        C   15 1.890    H   32 0.978    H   31 0.973
    17  H   0.997        C    1 0.967
    18  H   0.998        C    2 0.970
    19  H   0.998        C    3 0.966
    20  H   0.997        C    9 0.972
    21  H   0.997        C    9 0.969
    22  H   0.998        C   10 0.988
    23  H   0.997        C   10 0.985
    24  H   0.999        C   10 0.987
    25  H   0.997        C   12 0.972
    26  H   0.997        C   12 0.970
    27  H   0.998        C   13 0.988
    28  H   0.997        C   13 0.985
    29  H   0.999        C   13 0.987
    30  H   0.996        C   15 0.960
    31  H   0.998        C   16 0.973
    32  H   0.998        C   16 0.978

molecular dipole:
                 x           y           z       tot (Debye)
 q only:        0.335      -0.117       0.014
   full:        0.352      -0.087       0.009       0.921
molecular quadrupole (traceless):
                xx          xy          yy          xz          yz          zz
 q only:        8.134      -0.183      -2.585       0.369       0.616      -5.550
  q+dip:       13.155      -0.276      -3.037       0.840       0.159     -10.118
   full:       10.878      -0.404      -6.171       0.493       0.627      -4.707

           -------------------------------------------------
          |                Geometry Summary                 |
           -------------------------------------------------

      molecular mass/u    :      212.2938000
   center of mass at/Å    :        0.8322680      -0.3781992      -0.0589157
  moments of inertia/u·Å² :        0.5863381E+03   0.1306686E+04   0.1770616E+04
rotational constants/cm⁻¹ :        0.2875070E-01   0.1290106E-01   0.9520771E-02

 * 30 selected distances

     #   Z        #   Z                                     value/Å
     1   6 C      2   6 C                                 1.3688665
     2   6 C      3   6 C                                 1.3995429
     3   6 C      4   6 C                                 1.3801639
     4   6 C      5   6 C                                 1.4242806
     1   6 C      6   6 C                                 1.4070188
     5   6 C      6   6 C                                 1.4191463
     6   6 C      7   7 N                                 1.3492765
     7   7 N      8   6 C                                 1.3082532
     9   6 C     10   6 C                                 1.5305349
     8   6 C     11   6 C                                 1.4252988
    12   6 C     13   6 C                                 1.5306275 (max)
     5   6 C     14   7 N                                 1.3473752
    11   6 C     14   7 N                                 1.3087599
    15   6 C     16   6 C                                 1.3284910
     1   6 C     17   1 H                                 1.0786301
     2   6 C     18   1 H                                 1.0805634
     3   6 C     19   1 H                                 1.0792862
     9   6 C     20   1 H                                 1.0908427
     9   6 C     21   1 H                                 1.0901174
    10   6 C     22   1 H                                 1.0872545
    10   6 C     23   1 H                                 1.0874927
    10   6 C     24   1 H                                 1.0882718
    12   6 C     25   1 H                                 1.0910334
    12   6 C     26   1 H                                 1.0896968
    13   6 C     27   1 H                                 1.0873690
    13   6 C     28   1 H                                 1.0874773
    13   6 C     29   1 H                                 1.0882901
    15   6 C     30   1 H                                 1.0813777
    16   6 C     31   1 H                                 1.0772734
    16   6 C     32   1 H                                 1.0765118 (min)

 * 3 distinct bonds (by element types)

   Z      Z             #   av. dist./Å        max./Å        min./Å
   1 H    6 C          16     1.0850930     1.0910334     1.0765118
   6 C    6 C          10     1.4213971     1.5306275     1.3284910
   6 C    7 N           4     1.3284162     1.3492765     1.3082532


optimized geometry written to: xtbopt.xyz


           -------------------------------------------------
          | TOTAL ENERGY              -43.966417559181 Eh   |
          | GRADIENT NORM               0.000373577173 Eh/α |
          | HOMO-LUMO GAP               1.598119868614 eV   |
           -------------------------------------------------

------------------------------------------------------------------------
 * finished run on 2021/05/19 at 10:59:25.813     
------------------------------------------------------------------------
 total:
 * wall-time:     0 d,  0 h,  0 min,  1.280 sec
 *  cpu-time:     0 d,  0 h,  0 min,  1.130 sec
 * ratio c/w:     0.882 speedup
 SCF:
 * wall-time:     0 d,  0 h,  0 min,  0.087 sec
 *  cpu-time:     0 d,  0 h,  0 min,  0.048 sec
 * ratio c/w:     0.553 speedup
 ANC optimizer:
 * wall-time:     0 d,  0 h,  0 min,  1.126 sec
 *  cpu-time:     0 d,  0 h,  0 min,  1.058 sec
 * ratio c/w:     0.940 speedup

