      -----------------------------------------------------------      
     |                   =====================                   |     
     |                           x T B                           |     
     |                   =====================                   |     
     |                         S. Grimme                         |     
     |          Mulliken Center for Theoretical Chemistry        |     
     |                    University of Bonn                     |     
     |                Version 6.2 RC2 (SAW190805)                |     
      -----------------------------------------------------------      

   This program is distributed in the hope that it will be useful,
   but WITHOUT ANY WARRANTY; without even the implied warranty of
   MERCHANTABILITY or FITNESS FOR A PARTICULAR PURPOSE.
   
   FOR NON-COMMERCIAL, ACADEMIA USE ONLY.
   
   Cite this work as:
   * S. Grimme, C. Bannwarth, P. Shushkov, J. Chem. Theory Comput., 2017,
     13, 1989-2009. DOI: 10.1021/acs.jctc.7b00118
   * C. Bannwarth, S. Ehlert and S. Grimme., J. Chem. Theory Comput., 2019,
     15, 1652-1671. DOI: 10.1021/acs.jctc.8b01176
   * P. Pracht, E. Caldeweyher, S. Ehlert, S. Grimme, ChemRxiv, 2019, preprint.
     DOI: 10.26434/chemrxiv.8326202.v1
   
   for DFT-D4:
   * E. Caldeweyher, C. Bannwarth and S. Grimme, J. Chem. Phys., 2017,
     147, 034112. DOI: 10.1063/1.4993215
   * E. Caldeweyher, S. Ehlert, A. Hansen, H. Neugebauer, S. Spicher,
     C. Bannwarth and S. Grimme, J. Chem. Phys., 2019, 150, 154122.
     DOI: 10.1063/1.5090222
   
   for sTDA-xTB:
   * S. Grimme and C. Bannwarth, J. Chem. Phys., 2016, 145, 054103.
     DOI: 10.1063/1.4959605
   
   in the mass-spec context:
   * V. Asgeirsson, C. Bauer and S. Grimme, Chem. Sci., 2017, 8, 4879.
     DOI: 10.1039/c7sc00601b
   
   for metadynamics refer to:
   * S. Grimme, J. Chem. Theory Comput., 2019, 155, 2847-2862
     DOI: 10.1021/acs.jctc.9b00143
   
   with help from (in alphabetical order)
   C. Bannwarth, F. Bohle, G. Brandenburg, E. Caldeweyher, M. Checinski,
   S. Dohm, S. Ehlert, S. Ehrlich, F. März, H. Neugebauer, J. Pisarek,
   P. Pracht, P. Shushkov, and S. Spicher.
   
 * started run on 2021/05/19 at 10:59:37.186     

           -------------------------------------------------
          |                Calculation Setup                |
           -------------------------------------------------

          program call               : /ihome/ghutchison/geoffh/xtb/xtb 430.xyz -opt
          hostname                   : smp-n126
          coordinate file            : 430.xyz
          omp threads                :                     1
          number of atoms            :                    15
          number of electrons        :                    40
          charge                     :                     0
          spin                       :                   0.0
          first test random number   :      0.20432759326317


########################################################################
# WARNING! Please study the warnings concerning your input carefully
#  - the use of '-opt' is discouraged, please use '--opt' next time
########################################################################

           ------------------------------------------------- 
          |                 G F N 2 - x T B                 |
          | Geometry, Frequencies, Noncovalent interactions |
          |            JCTC 2019 parametrisation            |
           ------------------------------------------------- 
             KAB for C  - Si     :                1.0500
             KAB for H  - Pd     :                0.9500
             k(s)              :                1.8500
             k(p)              :                2.2300
             k(d)              :                2.2300
             k(f)              :                2.0000
             kEN (H0ij)        :               -2.0000
             D4 a1             :                0.5200
             D4 a2             :                5.0000
             D4 s6             :                1.0000
             D4 s8             :                2.7000
             D4 s9             :                5.0000
             alphaj            :                2.0000

  Z AO/shell   Hii/eV     exponent
  1     Wed Apr 25 08:07:45 CEST 2018   EN: 2.200 GM2: 0.406  GM3: 0.0800  RAES: 1.40
     1s    -10.707211    1.230000
  6     Wed Apr 25 08:07:45 CEST 2018   EN: 2.550 GM2: 0.538  GM3: 0.1500  RAES: 3.00
     2s    -13.970922    2.096432
     2p    -10.063292    1.800000
  7     Wed Apr 25 08:07:45 CEST 2018   EN: 3.040 GM2: 0.461  GM3:-0.0640  RAES: 1.90
     2s    -16.686243    2.339881
     2p    -12.523956    2.014332

           ------------------------------------------------- 
          |        Self-Consistent Charge Iterations        |
           ------------------------------------------------- 

          ...................................................
          :                      SETUP                      :
          :.................................................:
          :  # basis functions                  39          :
          :  # atomic orbitals                  39          :
          :  # shells                           23          :
          :  # electrons                        40          :
          :  max. iterations                   250          :
          :  Hamiltonian                  GFN2-xTB          :
          :  restarted?                      false          :
          :  GBSA solvation                  false          :
          :  PC potential                    false          :
          :  electronic temp.          300.0000000     K    :
          :  accuracy                    1.0000000          :
          :  -> integral cutoff          0.2500000E+02      :
          :  -> integral neglect         0.1000000E-07      :
          :  -> SCF convergence          0.1000000E-05 Eh   :
          :  -> wf. convergence          0.1000000E-03 e    :
          :  Broyden damping             0.4000000          :
          ...................................................

 iter      E             dE          RMSdq      gap      omega  full diag
   1    -21.7793867 -0.217794E+02  0.498E+00    3.11       0.0  T
   2    -21.7943927 -0.150061E-01  0.300E+00    3.03       1.0  T
   3    -21.7868911  0.750161E-02  0.999E-01    2.90       1.0  T
   4    -21.7950928 -0.820168E-02  0.384E-01    2.78       1.0  T
   5    -21.7968062 -0.171336E-02  0.158E-01    2.84       1.0  T
   6    -21.7970341 -0.227975E-03  0.411E-02    2.82       1.0  T
   7    -21.7970393 -0.518579E-05  0.221E-02    2.82       1.2  T
   8    -21.7970409 -0.156665E-05  0.358E-03    2.82       7.2  T
   9    -21.7970409 -0.518122E-07  0.165E-03    2.82      15.7  T
  10    -21.7970410 -0.157858E-07  0.788E-04    2.82      32.8  T
  11    -21.7970410 -0.107682E-08  0.143E-04    2.82     180.0  T

   *** convergence criteria satisfied after 11 iterations ***

         #    Occupation            Energy/Eh            Energy/eV
      -------------------------------------------------------------
         1        2.0000           -0.6577589             -17.8985
       ...           ...                  ...                  ...
        14        2.0000           -0.4708094             -12.8114
        15        2.0000           -0.4465766             -12.1520
        16        2.0000           -0.4381692             -11.9232
        17        2.0000           -0.4322681             -11.7626
        18        2.0000           -0.4287343             -11.6665
        19        2.0000           -0.3971275             -10.8064
        20        2.0000           -0.3682735             -10.0212 (HOMO)
        21                         -0.2645502              -7.1988 (LUMO)
        22                         -0.2462590              -6.7010
        23                         -0.1862875              -5.0691
        24                         -0.1025047              -2.7893
        25                          0.0920732               2.5054
       ...                                ...                  ...
        39                          0.6419975              17.4696
      -------------------------------------------------------------
                  HL-Gap            0.1037232 Eh            2.8225 eV
             Fermi-level           -0.3164118 Eh           -8.6100 eV

 SCC (total)                   0 d,  0 h,  0 min,  0.015 sec
 SCC setup                      ...        0 min,  0.000 sec (  1.433%)
 Dispersion                     ...        0 min,  0.000 sec (  1.089%)
 integral evaluation            ...        0 min,  0.003 sec ( 19.301%)
 zeroth order Hamiltonian       ...        0 min,  0.000 sec (  0.476%)
 iterations                     ...        0 min,  0.007 sec ( 42.409%)
 molecular gradient             ...        0 min,  0.005 sec ( 33.093%)
 printout                       ...        0 min,  0.000 sec (  1.871%)

         :::::::::::::::::::::::::::::::::::::::::::::::::::::
         ::                     SUMMARY                     ::
         :::::::::::::::::::::::::::::::::::::::::::::::::::::
         :: total energy             -21.427414362194 Eh    ::
         :: gradient norm              0.051405173148 Eh/a0 ::
         :: HOMO-LUMO gap              2.822453123432 eV    ::
         ::.................................................::
         :: SCC energy               -21.797040953942 Eh    ::
         :: -> isotropic ES            0.008716703104 Eh    ::
         :: -> anisotropic ES          0.003102286789 Eh    ::
         :: -> anisotropic XC          0.021576984056 Eh    ::
         :: -> dispersion             -0.011290730863 Eh    ::
         :: repulsion energy           0.369621233866 Eh    ::
         :: add. restraining           0.000000000000 Eh    ::
         :::::::::::::::::::::::::::::::::::::::::::::::::::::

      ----------------------------------------------------------- 
     |                   =====================                   |
     |                        A N C O P T                        |
     |                   =====================                   |
     |               Approximate Normal Coordinate               |
     |                Rational Function Optimizer                |
      ----------------------------------------------------------- 

          ...................................................
          :                      SETUP                      :
          :.................................................:
          :   optimization level            normal          :
          :   max. optcycles                   200          :
          :   ANC micro-cycles                  20          :
          :   degrees of freedom                39          :
          :.................................................:
          :   RF solver                   davidson          :
          :   input Hessian                  false          :
          :   write xtbopt.log                true          :
          :   linear?                        false          :
          :   energy convergence         0.5000000E-05 Eh   :
          :   grad. convergence          0.1000000E-02 Eh/α :
          :   maximium RF displ.         2.0000000          :
          :   Hlow (freq-cutoff)         0.5000000E-02      :
          :   Hmax (freq-cutoff)         5.0000000          :
          :   S6 in model hess.         20.0000000          :
          ...................................................

generating ANC from model Hessian ...
Using Lindh-Hessian (1995)
 Shifting diagonal of input Hessian by   1.574557206696104E-003
 Lowest  eigenvalues of input Hessian
   -0.000000   -0.000000    0.000000    0.000000    0.000000    0.000000
    0.005000    0.006997    0.010459    0.016047    0.021135    0.024211
    0.037666    0.048404    0.053359    0.063173    0.072844    0.096891
 Highest eigenvalues
    1.532385    1.579482    1.877161    1.918259    1.994527    2.046052
 

........................................................................
.............................. CYCLE    1 ..............................
........................................................................
   1    -21.7970410 -0.217970E+02  0.715E-05    2.82       0.0  T
   2    -21.7970410 -0.291145E-10  0.494E-05    2.82     522.2  T
   3    -21.7970410 -0.270823E-10  0.233E-05    2.82    1109.7  T
     SCC iter.                  ...        0 min,  0.002 sec
     gradient                   ...        0 min,  0.005 sec
 * total energy  :   -21.4274144 Eh     change       -0.1895824E-08 Eh
   gradient norm :     0.0514052 Eh/α   predicted     0.0000000E+00 (-100.00%)
   displ. norm   :     0.1603491 α      lambda       -0.3192772E-02
   maximum displ.:     0.0755735 α      in ANC's #8, #7, #2, ...

........................................................................
.............................. CYCLE    2 ..............................
........................................................................
   1    -21.8171496 -0.218171E+02  0.134E-01    2.82       0.0  T
   2    -21.8171731 -0.234745E-04  0.850E-02    2.84       1.0  T
   3    -21.8171710  0.206619E-05  0.477E-02    2.82       1.0  T
   4    -21.8171862 -0.151190E-04  0.990E-03    2.82       2.6  T
   5    -21.8171873 -0.109322E-05  0.381E-03    2.82       6.8  T
   6    -21.8171874 -0.108842E-06  0.152E-03    2.82      17.0  T
     SCC iter.                  ...        0 min,  0.003 sec
     gradient                   ...        0 min,  0.005 sec
 * total energy  :   -21.4294433 Eh     change       -0.2028933E-02 Eh
   gradient norm :     0.0182044 Eh/α   predicted    -0.1637433E-02 ( -19.30%)
   displ. norm   :     0.0965895 α      lambda       -0.4807514E-03
   maximum displ.:     0.0705544 α      in ANC's #2, #1, #4, ...

........................................................................
.............................. CYCLE    3 ..............................
........................................................................
   1    -21.8225064 -0.218225E+02  0.898E-02    2.79       0.0  T
   2    -21.8225132 -0.679740E-05  0.552E-02    2.80       1.0  T
   3    -21.8225092  0.398918E-05  0.287E-02    2.79       1.0  T
   4    -21.8225167 -0.757207E-05  0.386E-03    2.79       6.7  T
   5    -21.8225169 -0.134255E-06  0.167E-03    2.79      15.5  T
   6    -21.8225169 -0.101664E-07  0.940E-04    2.79      27.5  T
     SCC iter.                  ...        0 min,  0.003 sec
     gradient                   ...        0 min,  0.005 sec
 * total energy  :   -21.4296918 Eh     change       -0.2485427E-03 Eh
   gradient norm :     0.0033022 Eh/α   predicted    -0.2426191E-03 (  -2.38%)
   displ. norm   :     0.0780966 α      lambda       -0.9306383E-04
   maximum displ.:     0.0479461 α      in ANC's #2, #1, #3, ...

........................................................................
.............................. CYCLE    4 ..............................
........................................................................
   1    -21.8220459 -0.218220E+02  0.553E-02    2.78       0.0  T
   2    -21.8220463 -0.361477E-06  0.326E-02    2.78       1.0  T
   3    -21.8220457  0.565094E-06  0.712E-03    2.78       3.6  T
   4    -21.8220465 -0.713755E-06  0.132E-03    2.78      19.6  T
   5    -21.8220465 -0.444856E-08  0.718E-04    2.78      36.0  T
   6    -21.8220465 -0.587384E-09  0.188E-04    2.78     137.7  T
     SCC iter.                  ...        0 min,  0.036 sec
     gradient                   ...        0 min,  0.005 sec
 * total energy  :   -21.4297331 Eh     change       -0.4125649E-04 Eh
   gradient norm :     0.0031223 Eh/α   predicted    -0.4681388E-04 (  13.47%)
   displ. norm   :     0.0572694 α      lambda       -0.5094028E-04
   maximum displ.:     0.0408181 α      in ANC's #2, #1, #8, ...

........................................................................
.............................. CYCLE    5 ..............................
........................................................................
   1    -21.8209897 -0.218210E+02  0.448E-02    2.77       0.0  T
   2    -21.8209899 -0.168246E-06  0.264E-02    2.77       1.0  T
   3    -21.8209893  0.660390E-06  0.748E-03    2.77       3.5  T
   4    -21.8209900 -0.753320E-06  0.103E-03    2.77      25.0  T
   5    -21.8209900 -0.481657E-08  0.558E-04    2.77      46.2  T
   6    -21.8209900 -0.132880E-08  0.221E-04    2.77     117.0  T
     SCC iter.                  ...        0 min,  0.003 sec
     gradient                   ...        0 min,  0.005 sec
 * total energy  :   -21.4297676 Eh     change       -0.3445579E-04 Eh
   gradient norm :     0.0021520 Eh/α   predicted    -0.2555498E-04 ( -25.83%)
   displ. norm   :     0.0816718 α      lambda       -0.4084887E-04
   maximum displ.:     0.0605206 α      in ANC's #1, #2, #10, ...

........................................................................
.............................. CYCLE    6 ..............................
........................................................................
   1    -21.8203423 -0.218203E+02  0.641E-02    2.77       0.0  T
   2    -21.8203425 -0.289244E-06  0.376E-02    2.76       1.0  T
   3    -21.8203416  0.909874E-06  0.866E-03    2.77       3.0  T
   4    -21.8203427 -0.109348E-05  0.131E-03    2.77      19.7  T
   5    -21.8203427 -0.502202E-08  0.805E-04    2.77      32.1  T
   6    -21.8203427 -0.345887E-08  0.190E-04    2.77     135.7  T
     SCC iter.                  ...        0 min,  0.003 sec
     gradient                   ...        0 min,  0.005 sec
 * total energy  :   -21.4297973 Eh     change       -0.2970401E-04 Eh
   gradient norm :     0.0019737 Eh/α   predicted    -0.2056127E-04 ( -30.78%)
   displ. norm   :     0.1426795 α      lambda       -0.3588730E-04
   maximum displ.:     0.1055245 α      in ANC's #1, #2, #4, ...

........................................................................
.............................. CYCLE    7 ..............................
........................................................................
   1    -21.8202998 -0.218203E+02  0.104E-01    2.76       0.0  T
   2    -21.8203003 -0.484043E-06  0.609E-02    2.76       1.0  T
   3    -21.8202991  0.112592E-05  0.993E-03    2.76       2.6  T
   4    -21.8203006 -0.142007E-05  0.174E-03    2.76      14.9  T
   5    -21.8203006 -0.330582E-08  0.109E-03    2.76      23.7  T
   6    -21.8203006 -0.775411E-08  0.157E-04    2.76     164.4  T
   7    -21.8203006 -0.111744E-09  0.749E-05    2.76     344.5  T
     SCC iter.                  ...        0 min,  0.003 sec
     gradient                   ...        0 min,  0.005 sec
 * total energy  :   -21.4298401 Eh     change       -0.4286531E-04 Eh
   gradient norm :     0.0023461 Eh/α   predicted    -0.1810734E-04 ( -57.76%)
   displ. norm   :     0.1088105 α      lambda       -0.4030547E-04
   maximum displ.:     0.0847796 α      in ANC's #1, #2, #3, ...

........................................................................
.............................. CYCLE    8 ..............................
........................................................................
   1    -21.8207623 -0.218208E+02  0.752E-02    2.76       0.0  T
   2    -21.8207625 -0.224843E-06  0.440E-02    2.76       1.0  T
   3    -21.8207624  0.169761E-06  0.471E-03    2.76       5.5  T
   4    -21.8207627 -0.280149E-06  0.115E-03    2.76      22.4  T
   5    -21.8207627 -0.211387E-08  0.635E-04    2.76      40.6  T
   6    -21.8207627 -0.231937E-08  0.113E-04    2.76     228.2  T
     SCC iter.                  ...        0 min,  0.003 sec
     gradient                   ...        0 min,  0.005 sec
 * total energy  :   -21.4298743 Eh     change       -0.3413889E-04 Eh
   gradient norm :     0.0017241 Eh/α   predicted    -0.2038839E-04 ( -40.28%)
   displ. norm   :     0.1855103 α      lambda       -0.3889970E-04
   maximum displ.:     0.1532130 α      in ANC's #1, #2, #3, ...

........................................................................
.............................. CYCLE    9 ..............................
........................................................................
   1    -21.8213856 -0.218214E+02  0.127E-01    2.75       0.0  T
   2    -21.8213862 -0.629193E-06  0.742E-02    2.75       1.0  T
   3    -21.8213862  0.166066E-07  0.514E-03    2.75       5.0  T
   4    -21.8213865 -0.292481E-06  0.178E-03    2.75      14.5  T
   5    -21.8213865 -0.239723E-08  0.941E-04    2.75      27.4  T
   6    -21.8213865 -0.675567E-08  0.235E-04    2.75     109.7  T
     SCC iter.                  ...        0 min,  0.003 sec
     gradient                   ...        0 min,  0.005 sec
 * total energy  :   -21.4299172 Eh     change       -0.4292486E-04 Eh
   gradient norm :     0.0014177 Eh/α   predicted    -0.1974608E-04 ( -54.00%)
   displ. norm   :     0.1253782 α      lambda       -0.2002405E-04
   maximum displ.:     0.1121491 α      in ANC's #1, #2, #3, ...

........................................................................
.............................. CYCLE   10 ..............................
........................................................................
   1    -21.8213479 -0.218213E+02  0.856E-02    2.74       0.0  T
   2    -21.8213482 -0.306412E-06  0.500E-02    2.74       1.0  T
   3    -21.8213479  0.329169E-06  0.633E-03    2.74       4.1  T
   4    -21.8213484 -0.499696E-06  0.127E-03    2.74      20.4  T
   5    -21.8213484  0.103060E-08  0.655E-04    2.74      39.4  T
   6    -21.8213484 -0.334778E-08  0.815E-05    2.74     316.9  T
     SCC iter.                  ...        0 min,  0.003 sec
     gradient                   ...        0 min,  0.005 sec
 * total energy  :   -21.4299420 Eh     change       -0.2480873E-04 Eh
   gradient norm :     0.0012545 Eh/α   predicted    -0.1008329E-04 ( -59.36%)
   displ. norm   :     0.1046004 α      lambda       -0.1789698E-04
   maximum displ.:     0.0981980 α      in ANC's #1, #2, #6, ...

........................................................................
.............................. CYCLE   11 ..............................
........................................................................
   1    -21.8216174 -0.218216E+02  0.745E-02    2.74       0.0  T
   2    -21.8216177 -0.292421E-06  0.434E-02    2.74       1.0  T
   3    -21.8216177 -0.617935E-07  0.270E-03    2.74       9.6  T
   4    -21.8216178 -0.685761E-07  0.117E-03    2.74      22.0  T
   5    -21.8216178 -0.208247E-08  0.201E-04    2.74     128.7  T
   6    -21.8216178 -0.290157E-09  0.735E-05    2.74     351.2  T
     SCC iter.                  ...        0 min,  0.003 sec
     gradient                   ...        0 min,  0.005 sec
 * total energy  :   -21.4299618 Eh     change       -0.1977268E-04 Eh
   gradient norm :     0.0011365 Eh/α   predicted    -0.8990173E-05 ( -54.53%)
   displ. norm   :     0.1227317 α      lambda       -0.1485831E-04
   maximum displ.:     0.1131928 α      in ANC's #1, #2, #6, ...

........................................................................
.............................. CYCLE   12 ..............................
........................................................................
   1    -21.8209553 -0.218210E+02  0.842E-02    2.73       0.0  T
   2    -21.8209556 -0.287330E-06  0.492E-02    2.73       1.0  T
   3    -21.8209554  0.155518E-06  0.499E-03    2.73       5.2  T
   4    -21.8209557 -0.300744E-06  0.127E-03    2.73      20.4  T
   5    -21.8209557 -0.158458E-08  0.546E-04    2.73      47.3  T
   6    -21.8209557 -0.141247E-08  0.121E-04    2.73     213.0  T
     SCC iter.                  ...        0 min,  0.003 sec
     gradient                   ...        0 min,  0.005 sec
 * total energy  :   -21.4299787 Eh     change       -0.1695392E-04 Eh
   gradient norm :     0.0011490 Eh/α   predicted    -0.7480426E-05 ( -55.88%)
   displ. norm   :     0.2561157 α      lambda       -0.2237703E-04
   maximum displ.:     0.2417798 α      in ANC's #1, #2, #23, ...

........................................................................
.............................. CYCLE   13 ..............................
........................................................................
   1    -21.8202166 -0.218202E+02  0.179E-01    2.73       0.0  T
   2    -21.8202180 -0.142699E-05  0.104E-01    2.73       1.0  T
   3    -21.8202177  0.297101E-06  0.934E-03    2.73       2.8  T
   4    -21.8202187 -0.100117E-05  0.283E-03    2.73       9.1  T
   5    -21.8202187  0.273183E-08  0.132E-03    2.73      19.6  T
   6    -21.8202187 -0.153264E-07  0.146E-04    2.73     176.8  T
   7    -21.8202187 -0.653841E-10  0.770E-05    2.73     335.2  T
     SCC iter.                  ...        0 min,  0.003 sec
     gradient                   ...        0 min,  0.005 sec
 * total energy  :   -21.4299918 Eh     change       -0.1304270E-04 Eh
   gradient norm :     0.0027692 Eh/α   predicted    -0.1151677E-04 ( -11.70%)
   displ. norm   :     0.0116140 α      lambda       -0.9736672E-05
   maximum displ.:     0.0093856 α      in ANC's #1, #2, #8, ...

........................................................................
.............................. CYCLE   14 ..............................
........................................................................
   1    -21.8210421 -0.218210E+02  0.993E-03    2.73       0.0  T
   2    -21.8210421 -0.615860E-08  0.591E-03    2.73       4.4  T
   3    -21.8210421  0.730562E-08  0.914E-04    2.73      28.2  T
   4    -21.8210421 -0.993057E-08  0.228E-04    2.73     113.5  T
     SCC iter.                  ...        0 min,  0.002 sec
     gradient                   ...        0 min,  0.005 sec
 * total energy  :   -21.4299975 Eh     change       -0.5747750E-05 Eh
   gradient norm :     0.0010751 Eh/α   predicted    -0.4870296E-05 ( -15.27%)
   displ. norm   :     0.0314766 α      lambda       -0.4277978E-05
   maximum displ.:     0.0224870 α      in ANC's #1, #2, #6, ...

........................................................................
.............................. CYCLE   15 ..............................
........................................................................
   1    -21.8214981 -0.218215E+02  0.241E-02    2.73       0.0  T
   2    -21.8214981 -0.331695E-07  0.141E-02    2.73       1.8  T
   3    -21.8214981  0.331301E-07  0.197E-03    2.73      13.1  T
   4    -21.8214981 -0.487069E-07  0.479E-04    2.73      53.9  T
   5    -21.8214981 -0.191733E-09  0.294E-04    2.73      87.8  T
     SCC iter.                  ...        0 min,  0.003 sec
     gradient                   ...        0 min,  0.005 sec
 * total energy  :   -21.4300011 Eh     change       -0.3552930E-05 Eh
   gradient norm :     0.0005639 Eh/α   predicted    -0.2142129E-05 ( -39.71%)
   displ. norm   :     0.0697986 α      lambda       -0.2568534E-05
   maximum displ.:     0.0585510 α      in ANC's #1, #2, #23, ...

   *** GEOMETRY OPTIMIZATION CONVERGED AFTER 15 ITERATIONS ***

------------------------------------------------------------------------
 total energy gain   :        -0.0025867 Eh       -1.6232 kcal/mol
 total RMSD          :         0.3488326 a0        0.1846 Å
 total power (kW/mol):        -0.4527590 (step)  -30.9215 (real)
------------------------------------------------------------------------

 ANCopt (total)                0 d,  0 h,  0 min,  0.220 sec
 optimizer setup                ...        0 min,  0.000 sec (  0.067%)
 model hessian                  ...        0 min,  0.001 sec (  0.625%)
 ANC generation                 ...        0 min,  0.000 sec (  0.163%)
 coordinate transformation      ...        0 min,  0.000 sec (  0.083%)
 single point calculation       ...        0 min,  0.213 sec ( 97.115%)
 optimization log               ...        0 min,  0.001 sec (  0.458%)
 hessian update                 ...        0 min,  0.000 sec (  0.064%)
 rational function              ...        0 min,  0.002 sec (  1.021%)

================
 final structure:
================
$coord
    1.18612549451087    2.40425311016237   -0.12946872239359      C 
   -1.39768167304861    1.96885662422129   -0.22605233301667      C 
   -2.41595691160345   -0.29766915952877   -0.08416073008664      N 
   -0.91247496940226   -2.30513027940590    0.17384025408290      C 
    1.71457805903168   -2.05476023483673    0.28907145387805      C 
    2.76705837433683    0.33097344364078    0.13279434474602      C 
   -2.23545645080741   -4.72118925558474    0.30967516314385      C 
   -1.19874838027393   -6.97284365136479    0.68622113420302      C 
    1.93408857529594    4.29592030539662   -0.25794021319645      H 
   -2.72203308041569    3.51569957596743   -0.42792608015128      H 
    2.90639237354020   -3.69529017785175    0.48985780692779      H 
    4.79398505012511    0.57415070756906    0.21313077068736      H 
   -4.25852670871354   -4.54125363946050    0.07726369364973      H 
    0.80232406311454   -7.24018689426705    0.94596602991596      H 
   -2.33557706036104   -8.65885287660628    0.75872347003254      H 
$end
           -------------------------------------------------
          |                Final Singlepoint                |
           -------------------------------------------------

          ...................................................
          :                      SETUP                      :
          :.................................................:
          :  # basis functions                  39          :
          :  # atomic orbitals                  39          :
          :  # shells                           23          :
          :  # electrons                        40          :
          :  max. iterations                   250          :
          :  Hamiltonian                  GFN2-xTB          :
          :  restarted?                      false          :
          :  GBSA solvation                  false          :
          :  PC potential                    false          :
          :  electronic temp.          300.0000000     K    :
          :  accuracy                    1.0000000          :
          :  -> integral cutoff          0.2500000E+02      :
          :  -> integral neglect         0.1000000E-07      :
          :  -> SCF convergence          0.1000000E-05 Eh   :
          :  -> wf. convergence          0.1000000E-03 e    :
          :  Broyden damping             0.4000000          :
          ...................................................

 iter      E             dE          RMSdq      gap      omega  full diag
   1    -21.8214981 -0.218215E+02  0.116E-04    2.73       0.0  T
   2    -21.8214981 -0.105480E-10  0.509E-05    2.73     507.2  T
   3    -21.8214981  0.313349E-11  0.531E-05    2.73     486.5  T

   *** convergence criteria satisfied after 3 iterations ***

         #    Occupation            Energy/Eh            Energy/eV
      -------------------------------------------------------------
         1        2.0000           -0.6604269             -17.9711
       ...           ...                  ...                  ...
        14        2.0000           -0.4713696             -12.8266
        15        2.0000           -0.4446241             -12.0988
        16        2.0000           -0.4413704             -12.0103
        17        2.0000           -0.4331008             -11.7853
        18        2.0000           -0.4320169             -11.7558
        19        2.0000           -0.3960981             -10.7784
        20        2.0000           -0.3647079              -9.9242 (HOMO)
        21                         -0.2644125              -7.1950 (LUMO)
        22                         -0.2415887              -6.5740
        23                         -0.1804443              -4.9101
        24                         -0.0924785              -2.5165
        25                          0.1038404               2.8256
       ...                                ...                  ...
        39                          0.6812925              18.5389
      -------------------------------------------------------------
                  HL-Gap            0.1002954 Eh            2.7292 eV
             Fermi-level           -0.3145602 Eh           -8.5596 eV

 SCC (total)                   0 d,  0 h,  0 min,  0.010 sec
 SCC setup                      ...        0 min,  0.000 sec (  1.191%)
 Dispersion                     ...        0 min,  0.000 sec (  0.849%)
 integral evaluation            ...        0 min,  0.003 sec ( 27.453%)
 zeroth order Hamiltonian       ...        0 min,  0.000 sec (  0.577%)
 iterations                     ...        0 min,  0.002 sec ( 18.404%)
 molecular gradient             ...        0 min,  0.005 sec ( 49.031%)
 printout                       ...        0 min,  0.000 sec (  2.108%)

         :::::::::::::::::::::::::::::::::::::::::::::::::::::
         ::                     SUMMARY                     ::
         :::::::::::::::::::::::::::::::::::::::::::::::::::::
         :: total energy             -21.430001049875 Eh    ::
         :: gradient norm              0.000563164303 Eh/a0 ::
         :: HOMO-LUMO gap              2.729177495784 eV    ::
         ::.................................................::
         :: SCC energy               -21.821498100292 Eh    ::
         :: -> isotropic ES            0.008444948284 Eh    ::
         :: -> anisotropic ES          0.002879067081 Eh    ::
         :: -> anisotropic XC          0.020813477528 Eh    ::
         :: -> dispersion             -0.011355260970 Eh    ::
         :: repulsion energy           0.391492765537 Eh    ::
         :: add. restraining           0.000000000000 Eh    ::
         :::::::::::::::::::::::::::::::::::::::::::::::::::::

           -------------------------------------------------
          |                Property Printout                |
           -------------------------------------------------

    * Orbital Energies and Occupations

         #    Occupation            Energy/Eh            Energy/eV
      -------------------------------------------------------------
         1        2.0000           -0.6604269             -17.9711
       ...           ...                  ...                  ...
         8        2.0000           -0.5319122             -14.4741
         9        2.0000           -0.5202723             -14.1573
        10        2.0000           -0.5069055             -13.7936
        11        2.0000           -0.5029430             -13.6858
        12        2.0000           -0.4948984             -13.4669
        13        2.0000           -0.4767915             -12.9742
        14        2.0000           -0.4713696             -12.8266
        15        2.0000           -0.4446241             -12.0988
        16        2.0000           -0.4413704             -12.0103
        17        2.0000           -0.4331008             -11.7853
        18        2.0000           -0.4320169             -11.7558
        19        2.0000           -0.3960981             -10.7784
        20        2.0000           -0.3647079              -9.9242 (HOMO)
        21                         -0.2644125              -7.1950 (LUMO)
        22                         -0.2415887              -6.5740
        23                         -0.1804443              -4.9101
        24                         -0.0924785              -2.5165
        25                          0.1038404               2.8256
        26                          0.1119743               3.0470
        27                          0.1391385               3.7862
        28                          0.1470324               4.0010
        29                          0.1712319               4.6595
        30                          0.1753765               4.7722
        31                          0.2270404               6.1781
       ...                                ...                  ...
        39                          0.6812925              18.5389
      -------------------------------------------------------------
                  HL-Gap            0.1002954 Eh            2.7292 eV
             Fermi-level           -0.3145602 Eh           -8.5596 eV

     #   Z        covCN         q      C6AA      α(0)
     1   6 C      2.914    -0.041    29.029     8.835
     2   6 C      2.902     0.060    26.645     8.464
     3   7 N      1.849    -0.230    26.887     7.685
     4   6 C      2.955     0.098    25.823     8.335
     5   6 C      2.917    -0.042    29.041     8.837
     6   6 C      2.927    -0.013    28.334     8.729
     7   6 C      2.900    -0.034    28.846     8.806
     8   6 C      2.837    -0.082    30.030     8.980
     9   1 H      0.926     0.033     2.541     2.493
    10   1 H      0.925     0.036     2.507     2.476
    11   1 H      0.926     0.037     2.494     2.470
    12   1 H      0.926     0.032     2.555     2.500
    13   1 H      0.925     0.059     2.214     2.327
    14   1 H      0.926     0.042     2.418     2.431
    15   1 H      0.926     0.045     2.389     2.417

 Mol. C6AA /au·bohr⁶  :       2840.090430
 Mol. C8AA /au·bohr⁸  :      68800.398021
 Mol. α(0) /au        :         85.784673


Wiberg/Mayer (AO) data.
largest (>0.10) Wiberg bond orders for each atom
          total WBO             WBO to atom ...
     1  C   3.992        C    6 1.431    C    2 1.416    H    9 0.971    C    4 0.105
     2  C   3.983        N    3 1.460    C    1 1.416    H   10 0.963    C    5 0.109
     3  N   3.061        C    2 1.460    C    4 1.375
     4  C   3.980        N    3 1.375    C    5 1.363    C    7 1.081    C    1 0.105
     5  C   3.992        C    6 1.462    C    4 1.363    H   11 0.966    C    2 0.109
     6  C   3.992        C    5 1.462    C    1 1.431    H   12 0.970
     7  C   3.990        C    8 1.906    C    4 1.081    H   13 0.963
     8  C   3.992        C    7 1.906    H   15 0.977    H   14 0.972
     9  H   0.999        C    1 0.971
    10  H   0.998        C    2 0.963
    11  H   0.999        C    5 0.966
    12  H   0.999        C    6 0.970
    13  H   0.996        C    7 0.963
    14  H   0.998        C    8 0.972
    15  H   0.997        C    8 0.977

molecular dipole:
                 x           y           z       tot (Debye)
 q only:        0.307      -0.135       0.027
   full:        0.730      -0.051       0.044       1.863
molecular quadrupole (traceless):
                xx          xy          yy          xz          yz          zz
 q only:       -0.924       0.409       3.380       0.108      -0.527      -2.456
  q+dip:       -0.012      -0.371       6.122       0.557      -1.228      -6.110
   full:       -2.060      -0.236       4.665       0.164      -0.726      -2.605

           -------------------------------------------------
          |                Geometry Summary                 |
           -------------------------------------------------

      molecular mass/u    :      105.1390000
   center of mass at/Å    :       -0.1692644      -0.7870116       0.0779180
  moments of inertia/u·Å² :        0.9393772E+02   0.3118283E+03   0.4056858E+03
rotational constants/cm⁻¹ :        0.1794554E+00   0.5406062E-01   0.4155342E-01

 * 14 selected distances

     #   Z        #   Z                                     value/Å
     1   6 C      2   6 C                                 1.3875102
     2   6 C      3   7 N                                 1.3170197
     3   7 N      4   6 C                                 1.3342114
     4   6 C      5   6 C                                 1.3978066 (max)
     1   6 C      6   6 C                                 1.3866685
     5   6 C      6   6 C                                 1.3823446
     7   6 C      8   6 C                                 1.3268003
     1   6 C      9   1 H                                 1.0785820
     2   6 C     10   1 H                                 1.0828605
     5   6 C     11   1 H                                 1.0782855
     6   6 C     12   1 H                                 1.0811314
     7   6 C     13   1 H                                 1.0818026
     8   6 C     14   1 H                                 1.0771365
     8   6 C     15   1 H                                 1.0767507 (min)

 * 3 distinct bonds (by element types)

   Z      Z             #   av. dist./Å        max./Å        min./Å
   1 H    6 C           7     1.0795070     1.0828605     1.0767507
   6 C    6 C           5     1.3762260     1.3978066     1.3268003
   6 C    7 N           2     1.3256155     1.3342114     1.3170197


optimized geometry written to: xtbopt.xyz


           -------------------------------------------------
          | TOTAL ENERGY              -21.430001049875 Eh   |
          | GRADIENT NORM               0.000563164303 Eh/α |
          | HOMO-LUMO GAP               2.729177495784 eV   |
           -------------------------------------------------

------------------------------------------------------------------------
 * finished run on 2021/05/19 at 10:59:37.470     
------------------------------------------------------------------------
 total:
 * wall-time:     0 d,  0 h,  0 min,  0.284 sec
 *  cpu-time:     0 d,  0 h,  0 min,  0.213 sec
 * ratio c/w:     0.749 speedup
 SCF:
 * wall-time:     0 d,  0 h,  0 min,  0.016 sec
 *  cpu-time:     0 d,  0 h,  0 min,  0.016 sec
 * ratio c/w:     0.997 speedup
 ANC optimizer:
 * wall-time:     0 d,  0 h,  0 min,  0.230 sec
 *  cpu-time:     0 d,  0 h,  0 min,  0.184 sec
 * ratio c/w:     0.798 speedup

