      -----------------------------------------------------------      
     |                   =====================                   |     
     |                           x T B                           |     
     |                   =====================                   |     
     |                         S. Grimme                         |     
     |          Mulliken Center for Theoretical Chemistry        |     
     |                    University of Bonn                     |     
     |                Version 6.2 RC2 (SAW190805)                |     
      -----------------------------------------------------------      

   This program is distributed in the hope that it will be useful,
   but WITHOUT ANY WARRANTY; without even the implied warranty of
   MERCHANTABILITY or FITNESS FOR A PARTICULAR PURPOSE.
   
   FOR NON-COMMERCIAL, ACADEMIA USE ONLY.
   
   Cite this work as:
   * S. Grimme, C. Bannwarth, P. Shushkov, J. Chem. Theory Comput., 2017,
     13, 1989-2009. DOI: 10.1021/acs.jctc.7b00118
   * C. Bannwarth, S. Ehlert and S. Grimme., J. Chem. Theory Comput., 2019,
     15, 1652-1671. DOI: 10.1021/acs.jctc.8b01176
   * P. Pracht, E. Caldeweyher, S. Ehlert, S. Grimme, ChemRxiv, 2019, preprint.
     DOI: 10.26434/chemrxiv.8326202.v1
   
   for DFT-D4:
   * E. Caldeweyher, C. Bannwarth and S. Grimme, J. Chem. Phys., 2017,
     147, 034112. DOI: 10.1063/1.4993215
   * E. Caldeweyher, S. Ehlert, A. Hansen, H. Neugebauer, S. Spicher,
     C. Bannwarth and S. Grimme, J. Chem. Phys., 2019, 150, 154122.
     DOI: 10.1063/1.5090222
   
   for sTDA-xTB:
   * S. Grimme and C. Bannwarth, J. Chem. Phys., 2016, 145, 054103.
     DOI: 10.1063/1.4959605
   
   in the mass-spec context:
   * V. Asgeirsson, C. Bauer and S. Grimme, Chem. Sci., 2017, 8, 4879.
     DOI: 10.1039/c7sc00601b
   
   for metadynamics refer to:
   * S. Grimme, J. Chem. Theory Comput., 2019, 155, 2847-2862
     DOI: 10.1021/acs.jctc.9b00143
   
   with help from (in alphabetical order)
   C. Bannwarth, F. Bohle, G. Brandenburg, E. Caldeweyher, M. Checinski,
   S. Dohm, S. Ehlert, S. Ehrlich, F. März, H. Neugebauer, J. Pisarek,
   P. Pracht, P. Shushkov, and S. Spicher.
   
 * started run on 2021/05/19 at 10:59:37.993     

           -------------------------------------------------
          |                Calculation Setup                |
           -------------------------------------------------

          program call               : /ihome/ghutchison/geoffh/xtb/xtb 432.xyz -opt
          hostname                   : smp-n126
          coordinate file            : 432.xyz
          omp threads                :                     1
          number of atoms            :                    14
          number of electrons        :                    35
          charge                     :                     0
          spin                       :                   0.5
          first test random number   :      0.61227759162131


########################################################################
# WARNING! Please study the warnings concerning your input carefully
#  - the use of '-opt' is discouraged, please use '--opt' next time
########################################################################

           ------------------------------------------------- 
          |                 G F N 2 - x T B                 |
          | Geometry, Frequencies, Noncovalent interactions |
          |            JCTC 2019 parametrisation            |
           ------------------------------------------------- 
             KAB for C  - Si     :                1.0500
             KAB for H  - Pd     :                0.9500
             k(s)              :                1.8500
             k(p)              :                2.2300
             k(d)              :                2.2300
             k(f)              :                2.0000
             kEN (H0ij)        :               -2.0000
             D4 a1             :                0.5200
             D4 a2             :                5.0000
             D4 s6             :                1.0000
             D4 s8             :                2.7000
             D4 s9             :                5.0000
             alphaj            :                2.0000

  Z AO/shell   Hii/eV     exponent
  1     Wed Apr 25 08:07:45 CEST 2018   EN: 2.200 GM2: 0.406  GM3: 0.0800  RAES: 1.40
     1s    -10.707211    1.230000
  6     Wed Apr 25 08:07:45 CEST 2018   EN: 2.550 GM2: 0.538  GM3: 0.1500  RAES: 3.00
     2s    -13.970922    2.096432
     2p    -10.063292    1.800000

           ------------------------------------------------- 
          |        Self-Consistent Charge Iterations        |
           ------------------------------------------------- 

          ...................................................
          :                      SETUP                      :
          :.................................................:
          :  # basis functions                  35          :
          :  # atomic orbitals                  35          :
          :  # shells                           21          :
          :  # electrons                        35          :
          :  max. iterations                   250          :
          :  Hamiltonian                  GFN2-xTB          :
          :  restarted?                      false          :
          :  GBSA solvation                  false          :
          :  PC potential                    false          :
          :  electronic temp.          300.0000000     K    :
          :  accuracy                    1.0000000          :
          :  -> integral cutoff          0.2500000E+02      :
          :  -> integral neglect         0.1000000E-07      :
          :  -> SCF convergence          0.1000000E-05 Eh   :
          :  -> wf. convergence          0.1000000E-03 e    :
          :  Broyden damping             0.4000000          :
          ...................................................

 iter      E             dE          RMSdq      gap      omega  full diag
   1    -18.7060438 -0.187060E+02  0.393E+00    2.55       0.0  T
   2    -18.7177299 -0.116861E-01  0.230E+00    2.40       1.0  T
   3    -18.7028887  0.148412E-01  0.121E+00    2.71       1.0  T
   4    -18.7178793 -0.149906E-01  0.451E-01    2.42       1.0  T
   5    -18.7200127 -0.213339E-02  0.144E-01    2.47       1.0  T
   6    -18.7202877 -0.275035E-03  0.536E-02    2.47       1.0  T
   7    -18.7203097 -0.220573E-04  0.249E-02    2.47       1.1  T
   8    -18.7203107 -0.925470E-06  0.792E-03    2.47       3.4  T
   9    -18.7203113 -0.610091E-06  0.112E-03    2.47      23.8  T
  10    -18.7203113 -0.687645E-08  0.582E-04    2.47      45.9  T
  11    -18.7203113 -0.114795E-08  0.162E-04    2.47     164.5  T

   *** convergence criteria satisfied after 11 iterations ***

         #    Occupation            Energy/Eh            Energy/eV
      -------------------------------------------------------------
         1        2.0000           -0.6527339             -17.7618
       ...           ...                  ...                  ...
        12        2.0000           -0.4551313             -12.3848
        13        2.0000           -0.4432117             -12.0604
        14        2.0000           -0.4316417             -11.7456
        15        2.0000           -0.4179019             -11.3717
        16        2.0000           -0.4039564             -10.9922
        17        2.0000           -0.3863628             -10.5135
        18        1.0000           -0.3038007              -8.2668 (HOMO)
        19                         -0.2129678              -5.7951 (LUMO)
        20                         -0.1381332              -3.7588
        21                          0.0197761               0.5381
        22                          0.0219477               0.5972
        23                          0.0668907               1.8202
       ...                                ...                  ...
        35                          0.7568388              20.5946
      -------------------------------------------------------------
                  HL-Gap            0.0908328 Eh            2.4717 eV
             Fermi-level           -0.3017330 Eh           -8.2106 eV

 SCC (total)                   0 d,  0 h,  0 min,  0.013 sec
 SCC setup                      ...        0 min,  0.000 sec (  1.332%)
 Dispersion                     ...        0 min,  0.000 sec (  1.009%)
 integral evaluation            ...        0 min,  0.003 sec ( 19.285%)
 zeroth order Hamiltonian       ...        0 min,  0.000 sec (  0.456%)
 iterations                     ...        0 min,  0.006 sec ( 43.054%)
 molecular gradient             ...        0 min,  0.004 sec ( 32.415%)
 printout                       ...        0 min,  0.000 sec (  2.116%)

         :::::::::::::::::::::::::::::::::::::::::::::::::::::
         ::                     SUMMARY                     ::
         :::::::::::::::::::::::::::::::::::::::::::::::::::::
         :: total energy             -18.401609006253 Eh    ::
         :: gradient norm              0.125700191703 Eh/a0 ::
         :: HOMO-LUMO gap              2.471687168996 eV    ::
         ::.................................................::
         :: SCC energy               -18.720311291820 Eh    ::
         :: -> isotropic ES            0.002040637531 Eh    ::
         :: -> anisotropic ES          0.002951344634 Eh    ::
         :: -> anisotropic XC          0.012123710497 Eh    ::
         :: -> dispersion             -0.009086416666 Eh    ::
         :: repulsion energy           0.318687931950 Eh    ::
         :: add. restraining           0.000000000000 Eh    ::
         :::::::::::::::::::::::::::::::::::::::::::::::::::::

      ----------------------------------------------------------- 
     |                   =====================                   |
     |                        A N C O P T                        |
     |                   =====================                   |
     |               Approximate Normal Coordinate               |
     |                Rational Function Optimizer                |
      ----------------------------------------------------------- 

          ...................................................
          :                      SETUP                      :
          :.................................................:
          :   optimization level            normal          :
          :   max. optcycles                   200          :
          :   ANC micro-cycles                  20          :
          :   degrees of freedom                36          :
          :.................................................:
          :   RF solver                   davidson          :
          :   input Hessian                  false          :
          :   write xtbopt.log                true          :
          :   linear?                        false          :
          :   energy convergence         0.5000000E-05 Eh   :
          :   grad. convergence          0.1000000E-02 Eh/α :
          :   maximium RF displ.         2.0000000          :
          :   Hlow (freq-cutoff)         0.5000000E-02      :
          :   Hmax (freq-cutoff)         5.0000000          :
          :   S6 in model hess.         20.0000000          :
          ...................................................

generating ANC from model Hessian ...
Using Lindh-Hessian (1995)
 Shifting diagonal of input Hessian by   4.451077093217464E-004
 Lowest  eigenvalues of input Hessian
   -0.000000   -0.000000   -0.000000    0.000000    0.000000    0.000000
    0.005000    0.005966    0.014784    0.033349    0.036757    0.042256
    0.047488    0.055825    0.067488    0.073719    0.075669    0.090810
 Highest eigenvalues
    1.268244    1.386560    1.667269    1.748868    1.820925    1.854923
 

........................................................................
.............................. CYCLE    1 ..............................
........................................................................
   1    -18.7203113 -0.187203E+02  0.366E-05    2.47       0.0  T
   2    -18.7203113 -0.316192E-12  0.213E-05    2.47    1252.2  T
   3    -18.7203113  0.820677E-12  0.205E-05    2.47    1300.7  T
     SCC iter.                  ...        0 min,  0.023 sec
     gradient                   ...        0 min,  0.004 sec
 * total energy  :   -18.4016090 Eh     change       -0.1704556E-07 Eh
   gradient norm :     0.1256998 Eh/α   predicted     0.0000000E+00 (-100.00%)
   displ. norm   :     0.2116609 α      lambda       -0.1327307E-01
   maximum displ.:     0.1753604 α      in ANC's #9, #35, #15, ...

........................................................................
.............................. CYCLE    2 ..............................
........................................................................
   1    -18.7299667 -0.187300E+02  0.305E-01    2.54       0.0  T
   2    -18.7300068 -0.401171E-04  0.177E-01    2.52       1.0  T
   3    -18.7299208  0.859722E-04  0.126E-01    2.53       1.0  T
   4    -18.7300238 -0.102958E-03  0.405E-02    2.53       1.0  T
   5    -18.7300500 -0.262251E-04  0.705E-03    2.52       3.8  T
   6    -18.7300502 -0.235688E-06  0.326E-03    2.52       8.2  T
   7    -18.7300503 -0.136519E-07  0.150E-03    2.52      17.8  T
     SCC iter.                  ...        0 min,  0.003 sec
     gradient                   ...        0 min,  0.018 sec
 * total energy  :   -18.4110757 Eh     change       -0.9466724E-02 Eh
   gradient norm :     0.0645225 Eh/α   predicted    -0.6933857E-02 ( -26.76%)
   displ. norm   :     0.1321329 α      lambda       -0.5521324E-02
   maximum displ.:     0.0802413 α      in ANC's #9, #35, #5, ...

........................................................................
.............................. CYCLE    3 ..............................
........................................................................
   1    -18.7382663 -0.187383E+02  0.288E-01    2.63       0.0  T
   2    -18.7382798 -0.135041E-04  0.162E-01    2.60       1.0  T
   3    -18.7381586  0.121190E-03  0.152E-01    2.62       1.0  T
   4    -18.7383404 -0.181808E-03  0.376E-02    2.62       1.0  T
   5    -18.7383609 -0.204831E-04  0.462E-03    2.61       5.8  T
   6    -18.7383610 -0.754699E-07  0.263E-03    2.61      10.2  T
   7    -18.7383610 -0.254503E-07  0.119E-03    2.61      22.5  T
     SCC iter.                  ...        0 min,  0.003 sec
     gradient                   ...        0 min,  0.004 sec
 * total energy  :   -18.4139499 Eh     change       -0.2874186E-02 Eh
   gradient norm :     0.0107055 Eh/α   predicted    -0.2808862E-02 (  -2.27%)
   displ. norm   :     0.0408708 α      lambda       -0.1780911E-03
   maximum displ.:     0.0222419 α      in ANC's #2, #5, #9, ...

........................................................................
.............................. CYCLE    4 ..............................
........................................................................
   1    -18.7357774 -0.187358E+02  0.376E-02    2.60       0.0  T
   2    -18.7357768  0.606767E-06  0.234E-02    2.60       1.1  T
   3    -18.7357742  0.259052E-05  0.221E-02    2.60       1.2  T
   4    -18.7357789 -0.472620E-05  0.230E-03    2.60      11.6  T
   5    -18.7357790 -0.561664E-07  0.788E-04    2.60      33.9  T
   6    -18.7357790 -0.380011E-08  0.458E-04    2.60      58.3  T
     SCC iter.                  ...        0 min,  0.003 sec
     gradient                   ...        0 min,  0.004 sec
 * total energy  :   -18.4140695 Eh     change       -0.1195454E-03 Eh
   gradient norm :     0.0044205 Eh/α   predicted    -0.8919312E-04 ( -25.39%)
   displ. norm   :     0.0321903 α      lambda       -0.5332676E-04
   maximum displ.:     0.0209873 α      in ANC's #2, #9, #5, ...

........................................................................
.............................. CYCLE    5 ..............................
........................................................................
   1    -18.7346596 -0.187347E+02  0.297E-02    2.59       0.0  T
   2    -18.7346590  0.632426E-06  0.195E-02    2.59       1.4  T
   3    -18.7346583  0.693830E-06  0.171E-02    2.59       1.6  T
   4    -18.7346609 -0.258334E-05  0.191E-03    2.59      14.0  T
   5    -18.7346609 -0.456546E-07  0.634E-04    2.59      42.1  T
     SCC iter.                  ...        0 min,  0.002 sec
     gradient                   ...        0 min,  0.004 sec
 * total energy  :   -18.4140988 Eh     change       -0.2934662E-04 Eh
   gradient norm :     0.0013493 Eh/α   predicted    -0.2669073E-04 (  -9.05%)
   displ. norm   :     0.0216072 α      lambda       -0.6228041E-05
   maximum displ.:     0.0164112 α      in ANC's #2, #1, #12, ...

........................................................................
.............................. CYCLE    6 ..............................
........................................................................
   1    -18.7349095 -0.187349E+02  0.166E-02    2.59       0.0  T
   2    -18.7349094  0.989014E-07  0.106E-02    2.59       2.5  T
   3    -18.7349086  0.745363E-06  0.972E-03    2.59       2.8  T
   4    -18.7349097 -0.107080E-05  0.965E-04    2.59      27.7  T
   5    -18.7349097 -0.122053E-07  0.249E-04    2.59     107.5  T
   6    -18.7349097 -0.295589E-09  0.145E-04    2.59     184.3  T
     SCC iter.                  ...        0 min,  0.003 sec
     gradient                   ...        0 min,  0.004 sec
 * total energy  :   -18.4141027 Eh     change       -0.3882489E-05 Eh
   gradient norm :     0.0007526 Eh/α   predicted    -0.3113986E-05 ( -19.79%)
   displ. norm   :     0.0099660 α      lambda       -0.1983422E-05
   maximum displ.:     0.0075548 α      in ANC's #2, #3, #8, ...

   *** GEOMETRY OPTIMIZATION CONVERGED AFTER 6 ITERATIONS ***

------------------------------------------------------------------------
 total energy gain   :        -0.0124937 Eh       -7.8399 kcal/mol
 total RMSD          :         0.0864117 a0        0.0457 Å
 total power (kW/mol):        -5.4670350 (step) -342.6822 (real)
------------------------------------------------------------------------

 ANCopt (total)                0 d,  0 h,  0 min,  0.096 sec
 optimizer setup                ...        0 min,  0.000 sec (  0.161%)
 model hessian                  ...        0 min,  0.002 sec (  2.189%)
 ANC generation                 ...        0 min,  0.000 sec (  0.353%)
 coordinate transformation      ...        0 min,  0.000 sec (  0.073%)
 single point calculation       ...        0 min,  0.091 sec ( 95.343%)
 optimization log               ...        0 min,  0.000 sec (  0.431%)
 hessian update                 ...        0 min,  0.000 sec (  0.059%)
 rational function              ...        0 min,  0.001 sec (  0.950%)

================
 final structure:
================
$coord
   -2.89730433657001    1.10271799107379   -0.53132505496944      C 
   -3.41393551456456   -1.43722003251525   -0.28090290754563      C 
   -1.04029786328214   -3.02732869981792   -0.14422906328202      C 
    0.91174154503455   -1.01255067665371   -0.35003858090365      C 
   -0.28385213876898    1.37559071814076   -0.57947789282465      C 
    2.28176991308027    2.67035240621411   -0.72010420881529      C 
    3.29658121477821   -0.02518723921380   -0.45908318514281      C 
   -4.30015118620396    2.56883316015160   -0.66793154305384      H 
   -5.26751400274739   -2.26120982959784   -0.18921899859166      H 
   -0.95325141996402   -4.39578926230280   -1.68863401574428      H 
   -0.93234141427287   -4.08382571140319    1.62670100754688      H 
    2.71070797931960    3.94101522615765    0.84231504310120      H 
    2.69285017751628    3.60637970442758   -2.50765352574329      H 
    5.18121058877644   -0.76771445647616   -0.39132291340942      H 
$end
           -------------------------------------------------
          |                Final Singlepoint                |
           -------------------------------------------------

          ...................................................
          :                      SETUP                      :
          :.................................................:
          :  # basis functions                  35          :
          :  # atomic orbitals                  35          :
          :  # shells                           21          :
          :  # electrons                        35          :
          :  max. iterations                   250          :
          :  Hamiltonian                  GFN2-xTB          :
          :  restarted?                      false          :
          :  GBSA solvation                  false          :
          :  PC potential                    false          :
          :  electronic temp.          300.0000000     K    :
          :  accuracy                    1.0000000          :
          :  -> integral cutoff          0.2500000E+02      :
          :  -> integral neglect         0.1000000E-07      :
          :  -> SCF convergence          0.1000000E-05 Eh   :
          :  -> wf. convergence          0.1000000E-03 e    :
          :  Broyden damping             0.4000000          :
          ...................................................

 iter      E             dE          RMSdq      gap      omega  full diag
   1    -18.7349097 -0.187349E+02  0.519E-05    2.59       0.0  T
   2    -18.7349097 -0.563816E-11  0.224E-05    2.59    1190.8  T
   3    -18.7349097 -0.420286E-11  0.226E-05    2.59    1184.0  T

   *** convergence criteria satisfied after 3 iterations ***

         #    Occupation            Energy/Eh            Energy/eV
      -------------------------------------------------------------
         1        2.0000           -0.6504984             -17.7010
       ...           ...                  ...                  ...
        12        2.0000           -0.4526485             -12.3172
        13        2.0000           -0.4427192             -12.0470
        14        2.0000           -0.4372619             -11.8985
        15        2.0000           -0.4204958             -11.4423
        16        2.0000           -0.3968738             -10.7995
        17        2.0000           -0.3904622             -10.6250
        18        1.0000           -0.3031421              -8.2489 (HOMO)
        19                         -0.2078875              -5.6569 (LUMO)
        20                         -0.1354722              -3.6864
        21                          0.0119250               0.3245
        22                          0.0304764               0.8293
        23                          0.0926863               2.5221
       ...                                ...                  ...
        35                          0.7671802              20.8760
      -------------------------------------------------------------
                  HL-Gap            0.0952546 Eh            2.5920 eV
             Fermi-level           -0.3011585 Eh           -8.1949 eV

 SCC (total)                   0 d,  0 h,  0 min,  0.009 sec
 SCC setup                      ...        0 min,  0.000 sec (  1.485%)
 Dispersion                     ...        0 min,  0.000 sec (  0.944%)
 integral evaluation            ...        0 min,  0.002 sec ( 25.939%)
 zeroth order Hamiltonian       ...        0 min,  0.000 sec (  0.598%)
 iterations                     ...        0 min,  0.002 sec ( 19.502%)
 molecular gradient             ...        0 min,  0.004 sec ( 48.825%)
 printout                       ...        0 min,  0.000 sec (  2.221%)

         :::::::::::::::::::::::::::::::::::::::::::::::::::::
         ::                     SUMMARY                     ::
         :::::::::::::::::::::::::::::::::::::::::::::::::::::
         :: total energy             -18.414102706625 Eh    ::
         :: gradient norm              0.000752526703 Eh/a0 ::
         :: HOMO-LUMO gap              2.592008940217 eV    ::
         ::.................................................::
         :: SCC energy               -18.734909728011 Eh    ::
         :: -> isotropic ES            0.002059536253 Eh    ::
         :: -> anisotropic ES          0.002912909233 Eh    ::
         :: -> anisotropic XC          0.011888568936 Eh    ::
         :: -> dispersion             -0.009278464200 Eh    ::
         :: repulsion energy           0.320792659385 Eh    ::
         :: add. restraining           0.000000000000 Eh    ::
         :::::::::::::::::::::::::::::::::::::::::::::::::::::

           -------------------------------------------------
          |                Property Printout                |
           -------------------------------------------------

    * Orbital Energies and Occupations

         #    Occupation            Energy/Eh            Energy/eV
      -------------------------------------------------------------
         1        2.0000           -0.6504984             -17.7010
       ...           ...                  ...                  ...
         6        2.0000           -0.5422987             -14.7567
         7        2.0000           -0.5198624             -14.1462
         8        2.0000           -0.5137611             -13.9802
         9        2.0000           -0.5101378             -13.8816
        10        2.0000           -0.4871554             -13.2562
        11        2.0000           -0.4770813             -12.9820
        12        2.0000           -0.4526485             -12.3172
        13        2.0000           -0.4427192             -12.0470
        14        2.0000           -0.4372619             -11.8985
        15        2.0000           -0.4204958             -11.4423
        16        2.0000           -0.3968738             -10.7995
        17        2.0000           -0.3904622             -10.6250
        18        1.0000           -0.3031421              -8.2489 (HOMO)
        19                         -0.2078875              -5.6569 (LUMO)
        20                         -0.1354722              -3.6864
        21                          0.0119250               0.3245
        22                          0.0304764               0.8293
        23                          0.0926863               2.5221
        24                          0.1038276               2.8253
        25                          0.1653847               4.5003
        26                          0.1904066               5.1812
        27                          0.1955446               5.3210
        28                          0.2294640               6.2440
        29                          0.2413484               6.5674
       ...                                ...                  ...
        35                          0.7671802              20.8760
      -------------------------------------------------------------
                  HL-Gap            0.0952546 Eh            2.5920 eV
             Fermi-level           -0.3011585 Eh           -8.1949 eV

     #   Z        covCN         q      C6AA      α(0)
     1   6 C      2.953    -0.035    28.870     8.813
     2   6 C      3.044    -0.049    29.166     8.858
     3   6 C      3.840    -0.060    21.614     6.614
     4   6 C      3.356    -0.009    25.318     7.912
     5   6 C      3.482    -0.018    22.825     7.135
     6   6 C      4.112    -0.052    21.418     6.573
     7   6 C      3.299    -0.052    27.454     8.393
     8   1 H      0.926     0.028     2.609     2.526
     9   1 H      0.926     0.028     2.618     2.530
    10   1 H      0.924     0.059     2.213     2.326
    11   1 H      0.924     0.059     2.215     2.328
    12   1 H      0.925     0.038     2.475     2.460
    13   1 H      0.925     0.038     2.475     2.460
    14   1 H      0.926     0.024     2.667     2.554

 Mol. C6AA /au·bohr⁶  :       2119.570037
 Mol. C8AA /au·bohr⁸  :      51406.716682
 Mol. α(0) /au        :         71.481114

(R)spin-density population

 Mulliken population n(s)   n(p)   n(d)
     1 C   0.0001   0.000  0.000  0.000
     2 C   0.3380   0.000  0.338  0.000
     3 C   0.0034   0.000  0.003  0.000
     4 C   0.0012   0.000  0.001  0.000
     5 C   0.3377   0.000  0.338  0.000
     6 C   0.0000   0.000  0.000  0.000
     7 C   0.3004   0.000  0.300  0.000
     8 H   0.0000   0.000  0.000  0.000
     9 H   0.0000   0.000  0.000  0.000
    10 H   0.0095   0.010  0.000  0.000
    11 H   0.0095   0.009  0.000  0.000
    12 H   0.0001   0.000  0.000  0.000
    13 H   0.0001   0.000  0.000  0.000
    14 H   0.0000   0.000  0.000  0.000

Wiberg/Mayer (AO) data.
largest (>0.10) Wiberg bond orders for each atom
          total WBO             WBO to atom ...
     1  C   3.989        C    2 1.559    C    5 1.351    H    8 0.969
     2  C   3.647        C    1 1.559    C    3 1.032    H    9 0.974
     3  C   3.995        C    2 1.032    C    4 1.023    H   11 0.939    H   10 0.939
     4  C   3.972        C    7 1.590    C    5 1.220    C    3 1.023
     5  C   3.631        C    1 1.351    C    4 1.220    C    6 0.991
     6  C   3.991        C    7 1.009    C    5 0.991    H   12 0.965    H   13 0.965
     7  C   3.674        C    4 1.590    C    6 1.009    H   14 0.971
     8  H   0.999        C    1 0.969
     9  H   0.999        C    2 0.974
    10  H   0.987        C    3 0.939
    11  H   0.987        C    3 0.939
    12  H   0.998        C    6 0.965
    13  H   0.998        C    6 0.965
    14  H   0.999        C    7 0.971

molecular dipole:
                 x           y           z       tot (Debye)
 q only:       -0.011      -0.160       0.014
   full:       -0.008      -0.185       0.017       0.474
molecular quadrupole (traceless):
                xx          xy          yy          xz          yz          zz
 q only:       -0.654       0.831       1.748      -0.075      -0.173      -1.094
  q+dip:        0.822       1.322       2.352      -0.139      -0.423      -3.174
   full:       -0.354       1.103       1.866      -0.102      -0.209      -1.512

           -------------------------------------------------
          |                Geometry Summary                 |
           -------------------------------------------------

      molecular mass/u    :       91.1323000
   center of mass at/Å    :       -0.0849607      -0.0328119      -0.2311929
  moments of inertia/u·Å² :        0.8080666E+02   0.1765185E+03   0.2509960E+03
rotational constants/cm⁻¹ :        0.2086169E+00   0.9550063E-01   0.6716295E-01

 * 13 selected distances

     #   Z        #   Z                                     value/Å
     1   6 C      2   6 C                                 1.3779865
     3   6 C      4   6 C                                 1.4884982
     1   6 C      5   6 C                                 1.3907309
     4   6 C      5   6 C                                 1.4184819
     5   6 C      6   6 C                                 1.5225783 (max)
     4   6 C      7   6 C                                 1.3671054
     1   6 C      8   1 H                                 1.0762136
     2   6 C      9   1 H                                 1.0745189
     3   6 C     10   1 H                                 1.0929077
     3   6 C     11   1 H                                 1.0927265
     6   6 C     12   1 H                                 1.0896074
     6   6 C     13   1 H                                 1.0897026
     7   6 C     14   1 H                                 1.0725166 (min)

 * 2 distinct bonds (by element types)

   Z      Z             #   av. dist./Å        max./Å        min./Å
   1 H    6 C           7     1.0840276     1.0929077     1.0725166
   6 C    6 C           6     1.4275635     1.5225783     1.3671054


optimized geometry written to: xtbopt.xyz


           -------------------------------------------------
          | TOTAL ENERGY              -18.414102706625 Eh   |
          | GRADIENT NORM               0.000752526703 Eh/α |
          | HOMO-LUMO GAP               2.592008940217 eV   |
           -------------------------------------------------

------------------------------------------------------------------------
 * finished run on 2021/05/19 at 10:59:38.150     
------------------------------------------------------------------------
 total:
 * wall-time:     0 d,  0 h,  0 min,  0.157 sec
 *  cpu-time:     0 d,  0 h,  0 min,  0.096 sec
 * ratio c/w:     0.612 speedup
 SCF:
 * wall-time:     0 d,  0 h,  0 min,  0.014 sec
 *  cpu-time:     0 d,  0 h,  0 min,  0.014 sec
 * ratio c/w:     0.998 speedup
 ANC optimizer:
 * wall-time:     0 d,  0 h,  0 min,  0.105 sec
 *  cpu-time:     0 d,  0 h,  0 min,  0.070 sec
 * ratio c/w:     0.666 speedup

