      -----------------------------------------------------------      
     |                   =====================                   |     
     |                           x T B                           |     
     |                   =====================                   |     
     |                         S. Grimme                         |     
     |          Mulliken Center for Theoretical Chemistry        |     
     |                    University of Bonn                     |     
     |                Version 6.2 RC2 (SAW190805)                |     
      -----------------------------------------------------------      

   This program is distributed in the hope that it will be useful,
   but WITHOUT ANY WARRANTY; without even the implied warranty of
   MERCHANTABILITY or FITNESS FOR A PARTICULAR PURPOSE.
   
   FOR NON-COMMERCIAL, ACADEMIA USE ONLY.
   
   Cite this work as:
   * S. Grimme, C. Bannwarth, P. Shushkov, J. Chem. Theory Comput., 2017,
     13, 1989-2009. DOI: 10.1021/acs.jctc.7b00118
   * C. Bannwarth, S. Ehlert and S. Grimme., J. Chem. Theory Comput., 2019,
     15, 1652-1671. DOI: 10.1021/acs.jctc.8b01176
   * P. Pracht, E. Caldeweyher, S. Ehlert, S. Grimme, ChemRxiv, 2019, preprint.
     DOI: 10.26434/chemrxiv.8326202.v1
   
   for DFT-D4:
   * E. Caldeweyher, C. Bannwarth and S. Grimme, J. Chem. Phys., 2017,
     147, 034112. DOI: 10.1063/1.4993215
   * E. Caldeweyher, S. Ehlert, A. Hansen, H. Neugebauer, S. Spicher,
     C. Bannwarth and S. Grimme, J. Chem. Phys., 2019, 150, 154122.
     DOI: 10.1063/1.5090222
   
   for sTDA-xTB:
   * S. Grimme and C. Bannwarth, J. Chem. Phys., 2016, 145, 054103.
     DOI: 10.1063/1.4959605
   
   in the mass-spec context:
   * V. Asgeirsson, C. Bauer and S. Grimme, Chem. Sci., 2017, 8, 4879.
     DOI: 10.1039/c7sc00601b
   
   for metadynamics refer to:
   * S. Grimme, J. Chem. Theory Comput., 2019, 155, 2847-2862
     DOI: 10.1021/acs.jctc.9b00143
   
   with help from (in alphabetical order)
   C. Bannwarth, F. Bohle, G. Brandenburg, E. Caldeweyher, M. Checinski,
   S. Dohm, S. Ehlert, S. Ehrlich, F. März, H. Neugebauer, J. Pisarek,
   P. Pracht, P. Shushkov, and S. Spicher.
   
 * started run on 2021/05/19 at 10:59:42.992     

           -------------------------------------------------
          |                Calculation Setup                |
           -------------------------------------------------

          program call               : /ihome/ghutchison/geoffh/xtb/xtb 439.xyz -opt
          hostname                   : smp-n126
          coordinate file            : 439.xyz
          omp threads                :                     1
          number of atoms            :                    29
          number of electrons        :                    86
          charge                     :                     0
          spin                       :                   0.0
          first test random number   :      0.95694058450868


########################################################################
# WARNING! Please study the warnings concerning your input carefully
#  - the use of '-opt' is discouraged, please use '--opt' next time
########################################################################

           ------------------------------------------------- 
          |                 G F N 2 - x T B                 |
          | Geometry, Frequencies, Noncovalent interactions |
          |            JCTC 2019 parametrisation            |
           ------------------------------------------------- 
             KAB for C  - Si     :                1.0500
             KAB for H  - Pd     :                0.9500
             k(s)              :                1.8500
             k(p)              :                2.2300
             k(d)              :                2.2300
             k(f)              :                2.0000
             kEN (H0ij)        :               -2.0000
             D4 a1             :                0.5200
             D4 a2             :                5.0000
             D4 s6             :                1.0000
             D4 s8             :                2.7000
             D4 s9             :                5.0000
             alphaj            :                2.0000

  Z AO/shell   Hii/eV     exponent
  1     Wed Apr 25 08:07:45 CEST 2018   EN: 2.200 GM2: 0.406  GM3: 0.0800  RAES: 1.40
     1s    -10.707211    1.230000
  6     Wed Apr 25 08:07:45 CEST 2018   EN: 2.550 GM2: 0.538  GM3: 0.1500  RAES: 3.00
     2s    -13.970922    2.096432
     2p    -10.063292    1.800000
 16     Tue Apr 24 11:44:34 CEST 2018   EN: 2.580 GM2: 0.340  GM3:-0.0502  RAES: 3.10
     3s    -20.029654    1.981333
     3p    -11.377694    2.025643
     3d     -0.420282    1.702555

           ------------------------------------------------- 
          |        Self-Consistent Charge Iterations        |
           ------------------------------------------------- 

          ...................................................
          :                      SETUP                      :
          :.................................................:
          :  # basis functions                  98          :
          :  # atomic orbitals                  95          :
          :  # shells                           49          :
          :  # electrons                        86          :
          :  max. iterations                   250          :
          :  Hamiltonian                  GFN2-xTB          :
          :  restarted?                      false          :
          :  GBSA solvation                  false          :
          :  PC potential                    false          :
          :  electronic temp.          300.0000000     K    :
          :  accuracy                    1.0000000          :
          :  -> integral cutoff          0.2500000E+02      :
          :  -> integral neglect         0.1000000E-07      :
          :  -> SCF convergence          0.1000000E-05 Eh   :
          :  -> wf. convergence          0.1000000E-03 e    :
          :  Broyden damping             0.4000000          :
          ...................................................

 iter      E             dE          RMSdq      gap      omega  full diag
   1    -46.3503912 -0.463504E+02  0.429E+00    0.61       0.0  T
   2    -46.3339711  0.164201E-01  0.256E+00    0.60       1.0  T
   3    -46.0208539  0.313117E+00  0.286E+00    1.59       1.0  T
   4    -46.3794569 -0.358603E+00  0.879E-01    0.58       1.0  T
   5    -46.3748630  0.459388E-02  0.672E-01    0.55       1.0  T
   6    -46.3734062  0.145679E-02  0.629E-01    0.57       1.0  T
   7    -46.3907274 -0.173213E-01  0.279E-01    0.55       1.0  T
   8    -46.3936279 -0.290049E-02  0.802E-02    0.53       1.0  T
   9    -46.3938310 -0.203087E-03  0.424E-02    0.54       1.0  T
  10    -46.3938979 -0.668999E-04  0.156E-02    0.54       1.2  T
  11    -46.3938801  0.178055E-04  0.201E-02    0.54       1.0  T
  12    -46.3939017 -0.215784E-04  0.305E-03    0.54       6.1  T
  13    -46.3939017 -0.355622E-08  0.252E-03    0.54       7.4  T
  14    -46.3939019 -0.246287E-06  0.688E-04    0.54      27.0  T
  15    -46.3939019  0.347556E-08  0.487E-04    0.54      38.2  T

   *** convergence criteria satisfied after 15 iterations ***

         #    Occupation            Energy/Eh            Energy/eV
      -------------------------------------------------------------
         1        2.0000           -0.7284214             -19.8214
       ...           ...                  ...                  ...
        37        2.0000           -0.4348475             -11.8328
        38        2.0000           -0.4319761             -11.7547
        39        2.0000           -0.3988107             -10.8522
        40        2.0000           -0.3903221             -10.6212
        41        2.0000           -0.3844955             -10.4627
        42        2.0000           -0.3807521             -10.3608
        43        1.9999           -0.3197495              -8.7008 (HOMO)
        44        0.0001           -0.3000817              -8.1656 (LUMO)
        45                         -0.2512580              -6.8371
        46                         -0.2168345              -5.9004
        47                         -0.2108023              -5.7362
        48                         -0.2093104              -5.6956
       ...                                ...                  ...
        95                          0.7063304              19.2202
      -------------------------------------------------------------
                  HL-Gap            0.0196677 Eh            0.5352 eV
             Fermi-level           -0.3099156 Eh           -8.4332 eV

 SCC (total)                   0 d,  0 h,  0 min,  0.090 sec
 SCC setup                      ...        0 min,  0.000 sec (  0.421%)
 Dispersion                     ...        0 min,  0.000 sec (  0.517%)
 integral evaluation            ...        0 min,  0.018 sec ( 19.647%)
 zeroth order Hamiltonian       ...        0 min,  0.013 sec ( 14.791%)
 iterations                     ...        0 min,  0.036 sec ( 39.586%)
 molecular gradient             ...        0 min,  0.022 sec ( 24.509%)
 printout                       ...        0 min,  0.000 sec (  0.466%)

         :::::::::::::::::::::::::::::::::::::::::::::::::::::
         ::                     SUMMARY                     ::
         :::::::::::::::::::::::::::::::::::::::::::::::::::::
         :: total energy             -45.718557762423 Eh    ::
         :: gradient norm              0.220265705443 Eh/a0 ::
         :: HOMO-LUMO gap              0.535186643238 eV    ::
         ::.................................................::
         :: SCC energy               -46.393901941423 Eh    ::
         :: -> isotropic ES            0.005010535830 Eh    ::
         :: -> anisotropic ES          0.003334579267 Eh    ::
         :: -> anisotropic XC          0.026999464962 Eh    ::
         :: -> dispersion             -0.034263181326 Eh    ::
         :: repulsion energy           0.675758583989 Eh    ::
         :: add. restraining           0.000000000000 Eh    ::
         :::::::::::::::::::::::::::::::::::::::::::::::::::::

      ----------------------------------------------------------- 
     |                   =====================                   |
     |                        A N C O P T                        |
     |                   =====================                   |
     |               Approximate Normal Coordinate               |
     |                Rational Function Optimizer                |
      ----------------------------------------------------------- 

          ...................................................
          :                      SETUP                      :
          :.................................................:
          :   optimization level            normal          :
          :   max. optcycles                   200          :
          :   ANC micro-cycles                  20          :
          :   degrees of freedom                81          :
          :.................................................:
          :   RF solver                   davidson          :
          :   input Hessian                  false          :
          :   write xtbopt.log                true          :
          :   linear?                        false          :
          :   energy convergence         0.5000000E-05 Eh   :
          :   grad. convergence          0.1000000E-02 Eh/α :
          :   maximium RF displ.         2.0000000          :
          :   Hlow (freq-cutoff)         0.5000000E-02      :
          :   Hmax (freq-cutoff)         5.0000000          :
          :   S6 in model hess.         20.0000000          :
          ...................................................

generating ANC from model Hessian ...
Using Lindh-Hessian (1995)
 Shifting diagonal of input Hessian by   4.340215751916007E-003
 Lowest  eigenvalues of input Hessian
   -0.000000   -0.000000   -0.000000    0.000000    0.000000    0.000000
    0.005000    0.005401    0.005476    0.006128    0.008678    0.009242
    0.010326    0.012939    0.015593    0.016361    0.017868    0.019080
 Highest eigenvalues
    1.742096    1.784994    1.818758    1.883779    1.912895    1.990717
 

........................................................................
.............................. CYCLE    1 ..............................
........................................................................
   1    -46.3939020 -0.463939E+02  0.140E-04    0.54       0.0  T
   2    -46.3939019  0.147795E-07  0.523E-04    0.54      35.5  T
   3    -46.3939020 -0.149710E-07  0.101E-04    0.54     184.6  T
     SCC iter.                  ...        0 min,  0.006 sec
     gradient                   ...        0 min,  0.022 sec
 * total energy  :   -45.7185577 Eh     change        0.1590081E-07 Eh
   gradient norm :     0.2202658 Eh/α   predicted     0.0000000E+00 (-100.00%)
   displ. norm   :     0.3863545 α      lambda       -0.4625526E-01
   maximum displ.:     0.1754387 α      in ANC's #32, #33, #39, ...

........................................................................
.............................. CYCLE    2 ..............................
........................................................................
   1    -46.4213069 -0.464213E+02  0.364E-01    0.73       0.0  T
   2    -46.4216139 -0.307038E-03  0.206E-01    0.70       1.0  T
   3    -46.4197619  0.185198E-02  0.214E-01    0.71       1.0  T
   4    -46.4195218  0.240124E-03  0.212E-01    0.71       1.0  T
   5    -46.4216948 -0.217301E-02  0.350E-02    0.70       1.0  T
   6    -46.4217273 -0.324257E-04  0.143E-02    0.70       1.3  T
   7    -46.4217297 -0.245121E-05  0.728E-03    0.70       2.6  T
   8    -46.4217310 -0.128573E-05  0.269E-03    0.70       6.9  T
   9    -46.4217312 -0.179954E-06  0.101E-03    0.70      18.5  T
     SCC iter.                  ...        0 min,  0.015 sec
     gradient                   ...        0 min,  0.021 sec
 * total energy  :   -45.7526589 Eh     change       -0.3410112E-01 Eh
   gradient norm :     0.1263814 Eh/α   predicted    -0.2657989E-01 ( -22.06%)
   displ. norm   :     0.3395718 α      lambda       -0.2319996E-01
   maximum displ.:     0.1454128 α      in ANC's #14, #32, #13, ...

........................................................................
.............................. CYCLE    3 ..............................
........................................................................
   1    -46.4540722 -0.464541E+02  0.338E-01    1.00       0.0  T
   2    -46.4544708 -0.398543E-03  0.178E-01    0.96       1.0  T
   3    -46.4541891  0.281728E-03  0.127E-01    0.97       1.0  T
   4    -46.4541697  0.193756E-04  0.103E-01    0.96       1.0  T
   5    -46.4545229 -0.353185E-03  0.380E-02    0.96       1.0  T
   6    -46.4545706 -0.477568E-04  0.143E-02    0.96       1.3  T
   7    -46.4545749 -0.424201E-05  0.513E-03    0.96       3.6  T
   8    -46.4545754 -0.538954E-06  0.231E-03    0.96       8.0  T
     SCC iter.                  ...        0 min,  0.014 sec
     gradient                   ...        0 min,  0.021 sec
 * total energy  :   -45.7660117 Eh     change       -0.1335282E-01 Eh
   gradient norm :     0.0303228 Eh/α   predicted    -0.1293772E-01 (  -3.11%)
   displ. norm   :     0.2315412 α      lambda       -0.2264629E-02
   maximum displ.:     0.1561675 α      in ANC's #14, #10, #13, ...

........................................................................
.............................. CYCLE    4 ..............................
........................................................................
   1    -46.4624810 -0.464625E+02  0.160E-01    1.03       0.0  T
   2    -46.4624859 -0.488751E-05  0.831E-02    1.02       1.0  T
   3    -46.4622244  0.261422E-03  0.893E-02    1.02       1.0  T
   4    -46.4624969 -0.272496E-03  0.240E-02    1.02       1.0  T
   5    -46.4625115 -0.145919E-04  0.115E-02    1.02       1.6  T
   6    -46.4625139 -0.236726E-05  0.484E-03    1.02       3.8  T
   7    -46.4625144 -0.498644E-06  0.158E-03    1.02      11.8  T
     SCC iter.                  ...        0 min,  0.012 sec
     gradient                   ...        0 min,  0.021 sec
 * total energy  :   -45.7674334 Eh     change       -0.1421754E-02 Eh
   gradient norm :     0.0105109 Eh/α   predicted    -0.1193020E-02 ( -16.09%)
   displ. norm   :     0.1377219 α      lambda       -0.5147784E-03
   maximum displ.:     0.0873788 α      in ANC's #14, #10, #13, ...

........................................................................
.............................. CYCLE    5 ..............................
........................................................................
   1    -46.4648395 -0.464648E+02  0.139E-01    1.03       0.0  T
   2    -46.4648456 -0.604110E-05  0.682E-02    1.03       1.0  T
   3    -46.4648017  0.439080E-04  0.387E-02    1.03       1.0  T
   4    -46.4648495 -0.478339E-04  0.118E-02    1.03       1.6  T
   5    -46.4648504 -0.925629E-06  0.897E-03    1.03       2.1  T
   6    -46.4648523 -0.190968E-05  0.364E-03    1.03       5.1  T
   7    -46.4648527 -0.390473E-06  0.679E-04    1.03      27.4  T
   8    -46.4648527 -0.722623E-08  0.359E-04    1.03      51.7  T
     SCC iter.                  ...        0 min,  0.014 sec
     gradient                   ...        0 min,  0.021 sec
 * total energy  :   -45.7677715 Eh     change       -0.3381104E-03 Eh
   gradient norm :     0.0058802 Eh/α   predicted    -0.2622722E-03 ( -22.43%)
   displ. norm   :     0.1166404 α      lambda       -0.1881156E-03
   maximum displ.:     0.0631023 α      in ANC's #14, #5, #8, ...

........................................................................
.............................. CYCLE    6 ..............................
........................................................................
   1    -46.4653090 -0.464653E+02  0.133E-01    1.02       0.0  T
   2    -46.4653148 -0.578114E-05  0.633E-02    1.02       1.0  T
   3    -46.4653034  0.114713E-04  0.208E-02    1.02       1.0  T
   4    -46.4653153 -0.119338E-04  0.967E-03    1.02       1.9  T
   5    -46.4653155 -0.201576E-06  0.794E-03    1.02       2.3  T
   6    -46.4653173 -0.175707E-05  0.271E-03    1.02       6.8  T
   7    -46.4653174 -0.197355E-06  0.480E-04    1.02      38.7  T
     SCC iter.                  ...        0 min,  0.012 sec
     gradient                   ...        0 min,  0.021 sec
 * total energy  :   -45.7679044 Eh     change       -0.1328639E-03 Eh
   gradient norm :     0.0040144 Eh/α   predicted    -0.9534317E-04 ( -28.24%)
   displ. norm   :     0.1342395 α      lambda       -0.1228238E-03
   maximum displ.:     0.0530352 α      in ANC's #14, #5, #4, ...

........................................................................
.............................. CYCLE    7 ..............................
........................................................................
   1    -46.4655702 -0.464656E+02  0.151E-01    1.02       0.0  T
   2    -46.4655770 -0.678421E-05  0.704E-02    1.02       1.0  T
   3    -46.4655665  0.105176E-04  0.199E-02    1.02       1.0  T
   4    -46.4655761 -0.960205E-05  0.116E-02    1.02       1.6  T
   5    -46.4655789 -0.285255E-05  0.376E-03    1.02       4.9  T
   6    -46.4655792 -0.274692E-06  0.151E-03    1.02      12.3  T
   7    -46.4655793 -0.618709E-07  0.533E-04    1.02      34.8  T
     SCC iter.                  ...        0 min,  0.012 sec
     gradient                   ...        0 min,  0.021 sec
 * total energy  :   -45.7679899 Eh     change       -0.8546863E-04 Eh
   gradient norm :     0.0031638 Eh/α   predicted    -0.6251965E-04 ( -26.85%)
   displ. norm   :     0.1247605 α      lambda       -0.7430372E-04
   maximum displ.:     0.0602274 α      in ANC's #4, #5, #3, ...

........................................................................
.............................. CYCLE    8 ..............................
........................................................................
   1    -46.4656779 -0.464657E+02  0.126E-01    1.02       0.0  T
   2    -46.4656825 -0.467995E-05  0.586E-02    1.02       1.0  T
   3    -46.4656778  0.474207E-05  0.152E-02    1.02       1.2  T
   4    -46.4656805 -0.269692E-05  0.114E-02    1.02       1.6  T
   5    -46.4656831 -0.262334E-05  0.521E-03    1.02       3.6  T
   6    -46.4656840 -0.868209E-06  0.826E-04    1.02      22.5  T
   7    -46.4656840 -0.745821E-08  0.499E-04    1.02      37.2  T
     SCC iter.                  ...        0 min,  0.012 sec
     gradient                   ...        0 min,  0.022 sec
 * total energy  :   -45.7680412 Eh     change       -0.5130314E-04 Eh
   gradient norm :     0.0029725 Eh/α   predicted    -0.3775385E-04 ( -26.41%)
   displ. norm   :     0.1101447 α      lambda       -0.5189946E-04
   maximum displ.:     0.0602476 α      in ANC's #4, #3, #5, ...

........................................................................
.............................. CYCLE    9 ..............................
........................................................................
   1    -46.4657744 -0.464658E+02  0.979E-02    1.02       0.0  T
   2    -46.4657772 -0.287861E-05  0.458E-02    1.02       1.0  T
   3    -46.4657763  0.891019E-06  0.105E-02    1.02       1.8  T
   4    -46.4657768 -0.498312E-06  0.781E-03    1.02       2.4  T
   5    -46.4657772 -0.341889E-06  0.482E-03    1.02       3.9  T
   6    -46.4657780 -0.829030E-06  0.126E-03    1.02      14.7  T
   7    -46.4657781 -0.529071E-07  0.395E-04    1.02      47.0  T
   8    -46.4657781 -0.522647E-09  0.247E-04    1.02      75.0  T
     SCC iter.                  ...        0 min,  0.027 sec
     gradient                   ...        0 min,  0.035 sec
 * total energy  :   -45.7680757 Eh     change       -0.3450248E-04 Eh
   gradient norm :     0.0025620 Eh/α   predicted    -0.2626632E-04 ( -23.87%)
   displ. norm   :     0.0875876 α      lambda       -0.3576063E-04
   maximum displ.:     0.0558125 α      in ANC's #4, #3, #2, ...

........................................................................
.............................. CYCLE   10 ..............................
........................................................................
   1    -46.4658866 -0.464659E+02  0.695E-02    1.02       0.0  T
   2    -46.4658879 -0.131158E-05  0.336E-02    1.02       1.0  T
   3    -46.4658866  0.128528E-05  0.909E-03    1.02       2.0  T
   4    -46.4658863  0.274812E-06  0.796E-03    1.02       2.3  T
   5    -46.4658877 -0.136258E-05  0.415E-03    1.02       4.5  T
   6    -46.4658883 -0.583235E-06  0.931E-04    1.02      20.0  T
   7    -46.4658883 -0.241758E-07  0.255E-04    1.02      73.0  T
     SCC iter.                  ...        0 min,  0.012 sec
     gradient                   ...        0 min,  0.022 sec
 * total energy  :   -45.7680988 Eh     change       -0.2307088E-04 Eh
   gradient norm :     0.0019123 Eh/α   predicted    -0.1801814E-04 ( -21.90%)
   displ. norm   :     0.0897993 α      lambda       -0.1773928E-04
   maximum displ.:     0.0593299 α      in ANC's #4, #3, #2, ...

........................................................................
.............................. CYCLE   11 ..............................
........................................................................
   1    -46.4657628 -0.464658E+02  0.768E-02    1.02       0.0  T
   2    -46.4657641 -0.132395E-05  0.376E-02    1.02       1.0  T
   3    -46.4657615  0.263375E-05  0.108E-02    1.02       1.7  T
   4    -46.4657622 -0.743097E-06  0.880E-03    1.02       2.1  T
   5    -46.4657645 -0.228825E-05  0.150E-03    1.02      12.4  T
   6    -46.4657646 -0.526226E-07  0.506E-04    1.02      36.7  T
   7    -46.4657646 -0.668798E-08  0.219E-04    1.02      84.8  T
     SCC iter.                  ...        0 min,  0.012 sec
     gradient                   ...        0 min,  0.022 sec
 * total energy  :   -45.7681143 Eh     change       -0.1552597E-04 Eh
   gradient norm :     0.0014722 Eh/α   predicted    -0.8904874E-05 ( -42.65%)
   displ. norm   :     0.0898355 α      lambda        0.1108049E-04
   maximum displ.:     0.0593299 α      in ANC's #4, #3, #2, ...

........................................................................
.............................. CYCLE   12 ..............................
........................................................................
   1    -46.4654858 -0.464655E+02  0.769E-02    1.02       0.0  T
   2    -46.4654871 -0.129750E-05  0.377E-02    1.02       1.0  T
   3    -46.4654835  0.351868E-05  0.119E-02    1.02       1.6  T
   4    -46.4654856 -0.210195E-05  0.830E-03    1.02       2.2  T
   5    -46.4654875 -0.184654E-05  0.156E-03    1.02      11.9  T
   6    -46.4654876 -0.622761E-07  0.526E-04    1.02      35.3  T
   7    -46.4654876 -0.781630E-08  0.213E-04    1.02      87.3  T
     SCC iter.                  ...        0 min,  0.012 sec
     gradient                   ...        0 min,  0.022 sec
 * total energy  :   -45.7681074 Eh     change        0.6883500E-05 Eh
   gradient norm :     0.0028927 Eh/α   predicted     0.5559265E-05 ( -19.24%)
   displ. norm   :     0.0284972 α      lambda       -0.1754786E-04
   maximum displ.:     0.0143577 α      in ANC's #4, #5, #3, ...

........................................................................
.............................. CYCLE   13 ..............................
........................................................................
   1    -46.4657540 -0.464658E+02  0.261E-02    1.02       0.0  T
   2    -46.4657541 -0.158882E-06  0.126E-02    1.02       1.5  T
   3    -46.4657526  0.150200E-05  0.671E-03    1.02       2.8  T
   4    -46.4657541 -0.147677E-05  0.265E-03    1.02       7.0  T
   5    -46.4657542 -0.113105E-06  0.138E-03    1.02      13.4  T
   6    -46.4657543 -0.401407E-07  0.433E-04    1.02      42.9  T
   7    -46.4657543 -0.537606E-08  0.956E-05    1.02     194.3  T
     SCC iter.                  ...        0 min,  0.012 sec
     gradient                   ...        0 min,  0.022 sec
 * total energy  :   -45.7681204 Eh     change       -0.1296803E-04 Eh
   gradient norm :     0.0015561 Eh/α   predicted    -0.8783600E-05 ( -32.27%)
   displ. norm   :     0.0395044 α      lambda       -0.1197688E-04
   maximum displ.:     0.0235553 α      in ANC's #5, #6, #3, ...

........................................................................
.............................. CYCLE   14 ..............................
........................................................................
   1    -46.4659444 -0.464659E+02  0.397E-02    1.02       0.0  T
   2    -46.4659448 -0.367186E-06  0.195E-02    1.02       1.0  T
   3    -46.4659415  0.332348E-05  0.987E-03    1.02       1.9  T
   4    -46.4659447 -0.322500E-05  0.403E-03    1.02       4.6  T
   5    -46.4659450 -0.311207E-06  0.192E-03    1.02       9.7  T
   6    -46.4659451 -0.655869E-07  0.567E-04    1.02      32.8  T
   7    -46.4659451 -0.882808E-08  0.147E-04    1.02     126.6  T
     SCC iter.                  ...        0 min,  0.012 sec
     gradient                   ...        0 min,  0.022 sec
 * total energy  :   -45.7681283 Eh     change       -0.7976188E-05 Eh
   gradient norm :     0.0008326 Eh/α   predicted    -0.5994043E-05 ( -24.85%)
   displ. norm   :     0.0374340 α      lambda       -0.3497679E-05
   maximum displ.:     0.0253930 α      in ANC's #3, #4, #2, ...

........................................................................
.............................. CYCLE   15 ..............................
........................................................................
   1    -46.4660330 -0.464660E+02  0.359E-02    1.02       0.0  T
   2    -46.4660333 -0.281900E-06  0.179E-02    1.02       1.0  T
   3    -46.4660329  0.427330E-06  0.450E-03    1.02       4.1  T
   4    -46.4660330 -0.103290E-06  0.373E-03    1.02       5.0  T
   5    -46.4660334 -0.413848E-06  0.464E-04    1.02      40.0  T
   6    -46.4660334 -0.408878E-08  0.179E-04    1.02     103.5  T
     SCC iter.                  ...        0 min,  0.011 sec
     gradient                   ...        0 min,  0.022 sec
 * total energy  :   -45.7681324 Eh     change       -0.4011664E-05 Eh
   gradient norm :     0.0006465 Eh/α   predicted    -0.1752875E-05 ( -56.31%)
   displ. norm   :     0.0542524 α      lambda       -0.4119935E-05
   maximum displ.:     0.0354801 α      in ANC's #3, #4, #2, ...

   *** GEOMETRY OPTIMIZATION CONVERGED AFTER 15 ITERATIONS ***

------------------------------------------------------------------------
 total energy gain   :        -0.0495746 Eh      -31.1085 kcal/mol
 total RMSD          :         0.2341414 a0        0.1239 Å
 total power (kW/mol):        -8.6772049 (step) -150.6351 (real)
------------------------------------------------------------------------

 ANCopt (total)                0 d,  0 h,  0 min,  0.864 sec
 optimizer setup                ...        0 min,  0.000 sec (  0.016%)
 model hessian                  ...        0 min,  0.003 sec (  0.379%)
 ANC generation                 ...        0 min,  0.001 sec (  0.101%)
 coordinate transformation      ...        0 min,  0.000 sec (  0.032%)
 single point calculation       ...        0 min,  0.855 sec ( 98.892%)
 optimization log               ...        0 min,  0.002 sec (  0.198%)
 hessian update                 ...        0 min,  0.000 sec (  0.024%)
 rational function              ...        0 min,  0.002 sec (  0.245%)

================
 final structure:
================
$coord
    0.30066399891918    1.91712166794076   -1.52879093189377      C 
   -1.38693106697531    0.09388454901896   -1.98189635368559      C 
   -1.46489292956669   -1.90128490148712   -0.15967036726406      C 
    0.77288105791295   -1.35612881140060    2.24317379322966      S 
    1.84309519494229    1.59125849206705    0.79829347856749      C 
   -3.00425057539607   -3.96889699327111   -0.17451003520408      C 
   -3.11486864530492   -5.95026635876101    1.62790656566026      C 
   -4.85471385370165   -7.75790661582635    1.10357930328073      C 
   -6.23739599814781   -7.34022559913137   -1.15122914478563      C 
   -5.23016008463085   -4.51359613923233   -2.59607395604005      S 
   -8.09207391392583   -8.82513584319124   -2.16975575116214      C 
   -9.10775877435871  -11.64463832752594   -0.71355927138910      S 
  -11.40388904571417  -12.28624478310453   -3.20363629039063      C 
  -11.19674749455462  -10.16501582654534   -5.06622054149051      C 
   -9.44577351298547   -8.40373899771856   -4.44225297098017      C 
  -12.74327855154332  -10.07846447287217   -7.29338342060258      C 
  -14.47702543948722  -11.79190817103654   -7.93709753070536      C 
    0.60482223488906    3.55023487821555   -2.70128488703225      H 
   -2.64615080906965    0.04293459084193   -3.58001105259608      H 
    3.86123840673844    1.43209534128407    0.39323589278745      H 
    1.57011818964008    3.12564546639197    2.15083090580976      H 
   -1.88466145538445   -5.93770923688424    3.24708438180110      H 
   -5.21900864061931   -9.40241795977544    2.24313522696976      H 
  -13.27854607651513  -12.39345565870485   -2.34854411716358      H 
  -10.95314157159819  -14.11280596256124   -4.04950451367548      H 
   -9.04599513181562   -6.75168498478135   -5.56412419771824      H 
  -12.41827944598066   -8.46257681207318   -8.50416622361273      H 
  -14.86621692693021  -13.42992611764375   -6.79499531353870      H 
  -15.56479547323555  -11.60308746744684   -9.64396599847876      H 
$end
           -------------------------------------------------
          |                Final Singlepoint                |
           -------------------------------------------------

          ...................................................
          :                      SETUP                      :
          :.................................................:
          :  # basis functions                  98          :
          :  # atomic orbitals                  95          :
          :  # shells                           49          :
          :  # electrons                        86          :
          :  max. iterations                   250          :
          :  Hamiltonian                  GFN2-xTB          :
          :  restarted?                      false          :
          :  GBSA solvation                  false          :
          :  PC potential                    false          :
          :  electronic temp.          300.0000000     K    :
          :  accuracy                    1.0000000          :
          :  -> integral cutoff          0.2500000E+02      :
          :  -> integral neglect         0.1000000E-07      :
          :  -> SCF convergence          0.1000000E-05 Eh   :
          :  -> wf. convergence          0.1000000E-03 e    :
          :  Broyden damping             0.4000000          :
          ...................................................

 iter      E             dE          RMSdq      gap      omega  full diag
   1    -46.4660334 -0.464660E+02  0.116E-04    1.02       0.0  T
   2    -46.4660334  0.248406E-10  0.420E-05    1.02     441.8  T
   3    -46.4660334  0.940830E-10  0.778E-05    1.02     238.5  T

   *** convergence criteria satisfied after 3 iterations ***

         #    Occupation            Energy/Eh            Energy/eV
      -------------------------------------------------------------
         1        2.0000           -0.7229649             -19.6729
       ...           ...                  ...                  ...
        37        2.0000           -0.4366435             -11.8817
        38        2.0000           -0.4351575             -11.8412
        39        2.0000           -0.4076773             -11.0935
        40        2.0000           -0.3939134             -10.7189
        41        2.0000           -0.3884705             -10.5708
        42        2.0000           -0.3772288             -10.2649
        43        2.0000           -0.3315495              -9.0219 (HOMO)
        44                         -0.2941040              -8.0030 (LUMO)
        45                         -0.2515587              -6.8453
        46                         -0.2190645              -5.9610
        47                         -0.2151838              -5.8554
        48                         -0.2122344              -5.7752
       ...                                ...                  ...
        95                          0.7187468              19.5581
      -------------------------------------------------------------
                  HL-Gap            0.0374455 Eh            1.0189 eV
             Fermi-level           -0.3128268 Eh           -8.5124 eV

 SCC (total)                   0 d,  0 h,  0 min,  0.046 sec
 SCC setup                      ...        0 min,  0.000 sec (  0.659%)
 Dispersion                     ...        0 min,  0.000 sec (  0.759%)
 integral evaluation            ...        0 min,  0.017 sec ( 36.836%)
 zeroth order Hamiltonian       ...        0 min,  0.000 sec (  0.510%)
 iterations                     ...        0 min,  0.006 sec ( 13.442%)
 molecular gradient             ...        0 min,  0.022 sec ( 46.827%)
 printout                       ...        0 min,  0.000 sec (  0.862%)

         :::::::::::::::::::::::::::::::::::::::::::::::::::::
         ::                     SUMMARY                     ::
         :::::::::::::::::::::::::::::::::::::::::::::::::::::
         :: total energy             -45.768132341366 Eh    ::
         :: gradient norm              0.000646971539 Eh/a0 ::
         :: HOMO-LUMO gap              1.018943043070 eV    ::
         ::.................................................::
         :: SCC energy               -46.466033419047 Eh    ::
         :: -> isotropic ES            0.005057322136 Eh    ::
         :: -> anisotropic ES          0.001189493937 Eh    ::
         :: -> anisotropic XC          0.028165080139 Eh    ::
         :: -> dispersion             -0.034518589303 Eh    ::
         :: repulsion energy           0.698299555974 Eh    ::
         :: add. restraining           0.000000000000 Eh    ::
         :::::::::::::::::::::::::::::::::::::::::::::::::::::

           -------------------------------------------------
          |                Property Printout                |
           -------------------------------------------------

    * Orbital Energies and Occupations

         #    Occupation            Energy/Eh            Energy/eV
      -------------------------------------------------------------
         1        2.0000           -0.7229649             -19.6729
       ...           ...                  ...                  ...
        31        2.0000           -0.4604893             -12.5306
        32        2.0000           -0.4570488             -12.4369
        33        2.0000           -0.4545388             -12.3686
        34        2.0000           -0.4513102             -12.2808
        35        2.0000           -0.4430770             -12.0567
        36        2.0000           -0.4395875             -11.9618
        37        2.0000           -0.4366435             -11.8817
        38        2.0000           -0.4351575             -11.8412
        39        2.0000           -0.4076773             -11.0935
        40        2.0000           -0.3939134             -10.7189
        41        2.0000           -0.3884705             -10.5708
        42        2.0000           -0.3772288             -10.2649
        43        2.0000           -0.3315495              -9.0219 (HOMO)
        44                         -0.2941040              -8.0030 (LUMO)
        45                         -0.2515587              -6.8453
        46                         -0.2190645              -5.9610
        47                         -0.2151838              -5.8554
        48                         -0.2122344              -5.7752
        49                         -0.2018552              -5.4928
        50                         -0.1747118              -4.7542
        51                         -0.1548081              -4.2125
        52                         -0.1482663              -4.0345
        53                         -0.1348753              -3.6701
        54                         -0.1249673              -3.4005
       ...                                ...                  ...
        95                          0.7187468              19.5581
      -------------------------------------------------------------
                  HL-Gap            0.0374455 Eh            1.0189 eV
             Fermi-level           -0.3128268 Eh           -8.5124 eV

     #   Z        covCN         q      C6AA      α(0)
     1   6 C      3.009    -0.040    28.981     8.831
     2   6 C      3.022    -0.033    28.789     8.801
     3   6 C      3.013     0.028    27.370     8.582
     4  16 S      2.186    -0.128   146.425    20.366
     5   6 C      3.814    -0.005    20.662     6.470
     6   6 C      3.018     0.027    27.388     8.585
     7   6 C      3.054    -0.038    28.892     8.815
     8   6 C      3.055    -0.037    28.859     8.810
     9   6 C      3.019     0.026    27.395     8.586
    10  16 S      2.277    -0.116   145.928    20.332
    11   6 C      3.007     0.029    27.335     8.576
    12  16 S      2.178    -0.139   146.896    20.399
    13   6 C      3.815    -0.006    20.679     6.472
    14   6 C      3.051     0.005    27.857     8.656
    15   6 C      3.033    -0.041    28.995     8.832
    16   6 C      2.893    -0.032    28.804     8.799
    17   6 C      2.840    -0.089    30.234     9.011
    18   1 H      0.926     0.042     2.426     2.436
    19   1 H      0.926     0.051     2.309     2.376
    20   1 H      0.924     0.061     2.188     2.313
    21   1 H      0.924     0.061     2.188     2.313
    22   1 H      0.926     0.045     2.383     2.414
    23   1 H      0.926     0.046     2.373     2.409
    24   1 H      0.924     0.059     2.205     2.322
    25   1 H      0.924     0.059     2.206     2.322
    26   1 H      0.926     0.048     2.342     2.393
    27   1 H      0.925     0.041     2.438     2.442
    28   1 H      0.926     0.037     2.486     2.465
    29   1 H      0.926     0.040     2.443     2.444

 Mol. C6AA /au·bohr⁶  :      16266.011812
 Mol. C8AA /au·bohr⁸  :     503916.596412
 Mol. α(0) /au        :        207.572992


Wiberg/Mayer (AO) data.
largest (>0.10) Wiberg bond orders for each atom
          total WBO             WBO to atom ...
     1  C   3.899        C    2 1.770    C    5 1.038    H   18 0.963
     2  C   3.989        C    1 1.770    C    3 1.169    H   19 0.957
     3  C   3.889        C    6 1.473    C    2 1.169    S    4 1.059
     4  S   2.267        C    3 1.059    C    5 0.986
     5  C   3.978        C    1 1.038    S    4 0.986    H   21 0.955    H   20 0.955
     6  C   3.955        C    3 1.473    C    7 1.223    S   10 1.049
     7  C   3.949        C    8 1.605    C    6 1.223    H   22 0.959
     8  C   3.960        C    7 1.605    C    9 1.230    H   23 0.959
     9  C   3.929        C   11 1.446    C    8 1.230    S   10 1.053
    10  S   2.418        C    9 1.053    C    6 1.049
    11  C   3.909        C    9 1.446    C   15 1.220    S   12 1.051
    12  S   2.262        C   11 1.051    C   13 0.989
    13  C   3.976        C   14 1.014    S   12 0.989    H   25 0.958    H   24 0.958
    14  C   3.906        C   15 1.611    C   16 1.145    C   13 1.014
    15  C   3.987        C   14 1.611    C   11 1.220    H   26 0.957    C   17 0.105
    16  C   3.988        C   17 1.834    C   14 1.145    H   27 0.963
    17  C   3.906        C   16 1.834    H   29 0.979    H   28 0.976    C   15 0.105
    18  H   0.998        C    1 0.963
    19  H   0.997        C    2 0.957
    20  H   0.987        C    5 0.955
    21  H   0.987        C    5 0.955
    22  H   0.997        C    7 0.959
    23  H   0.997        C    8 0.959
    24  H   0.988        C   13 0.958
    25  H   0.988        C   13 0.958
    26  H   0.998        C   15 0.957
    27  H   0.998        C   16 0.963
    28  H   0.999        C   17 0.976
    29  H   0.998        C   17 0.979

molecular dipole:
                 x           y           z       tot (Debye)
 q only:        0.018       0.398      -0.375
   full:       -0.052       0.562      -0.633       2.156
molecular quadrupole (traceless):
                xx          xy          yy          xz          yz          zz
 q only:        3.742       8.448      -0.563       6.498       4.812      -3.179
  q+dip:        6.055      13.555      -0.395       9.583       7.918      -5.660
   full:        6.389      12.087      -0.837       8.532       8.578      -5.552

           -------------------------------------------------
          |                Geometry Summary                 |
           -------------------------------------------------

      molecular mass/u    :      276.4288000
   center of mass at/Å    :       -2.9473893      -3.1689377      -0.8593679
  moments of inertia/u·Å² :        0.4407857E+03   0.3666316E+04   0.4100674E+04
rotational constants/cm⁻¹ :        0.3824450E-01   0.4597976E-02   0.4110941E-02

 * 24 selected distances

     #   Z        #   Z                                     value/Å
     1   6 C      2   6 C                                 1.3363664
     2   6 C      3   6 C                                 1.4304716
     1   6 C      5   6 C                                 1.4874120 (max)
     3   6 C      6   6 C                                 1.3640935
     6   6 C      7   6 C                                 1.4186261
     7   6 C      8   6 C                                 1.3563406
     8   6 C      9   6 C                                 1.4170127
     9   6 C     11   6 C                                 1.3679191
    11   6 C     15   6 C                                 1.4173973
    14   6 C     15   6 C                                 1.3550804
    14   6 C     16   6 C                                 1.4355735
    16   6 C     17   6 C                                 1.3341288
     1   6 C     18   1 H                                 1.0759767
     2   6 C     19   1 H                                 1.0770026
     5   6 C     20   1 H                                 1.0925052
     5   6 C     21   1 H                                 1.0919810
     7   6 C     22   1 H                                 1.0761056
     8   6 C     23   1 H                                 1.0761592
    13   6 C     24   1 H                                 1.0918269
    13   6 C     25   1 H                                 1.0915674
    15   6 C     26   1 H                                 1.0777173
    16   6 C     27   1 H                                 1.0822564
    17   6 C     28   1 H                                 1.0765825
    17   6 C     29   1 H                                 1.0757143 (min)

 * 2 distinct bonds (by element types)

   Z      Z             #   av. dist./Å        max./Å        min./Å
   1 H    6 C          12     1.0821163     1.0925052     1.0757143
   6 C    6 C          12     1.3933685     1.4874120     1.3341288


optimized geometry written to: xtbopt.xyz


           -------------------------------------------------
          | TOTAL ENERGY              -45.768132341366 Eh   |
          | GRADIENT NORM               0.000646971539 Eh/α |
          | HOMO-LUMO GAP               1.018943043070 eV   |
           -------------------------------------------------

------------------------------------------------------------------------
 * finished run on 2021/05/19 at 10:59:44.045     
------------------------------------------------------------------------
 total:
 * wall-time:     0 d,  0 h,  0 min,  1.053 sec
 *  cpu-time:     0 d,  0 h,  0 min,  0.922 sec
 * ratio c/w:     0.876 speedup
 SCF:
 * wall-time:     0 d,  0 h,  0 min,  0.090 sec
 *  cpu-time:     0 d,  0 h,  0 min,  0.068 sec
 * ratio c/w:     0.753 speedup
 ANC optimizer:
 * wall-time:     0 d,  0 h,  0 min,  0.911 sec
 *  cpu-time:     0 d,  0 h,  0 min,  0.826 sec
 * ratio c/w:     0.907 speedup

