      -----------------------------------------------------------      
     |                   =====================                   |     
     |                           x T B                           |     
     |                   =====================                   |     
     |                         S. Grimme                         |     
     |          Mulliken Center for Theoretical Chemistry        |     
     |                    University of Bonn                     |     
     |                Version 6.2 RC2 (SAW190805)                |     
      -----------------------------------------------------------      

   This program is distributed in the hope that it will be useful,
   but WITHOUT ANY WARRANTY; without even the implied warranty of
   MERCHANTABILITY or FITNESS FOR A PARTICULAR PURPOSE.
   
   FOR NON-COMMERCIAL, ACADEMIA USE ONLY.
   
   Cite this work as:
   * S. Grimme, C. Bannwarth, P. Shushkov, J. Chem. Theory Comput., 2017,
     13, 1989-2009. DOI: 10.1021/acs.jctc.7b00118
   * C. Bannwarth, S. Ehlert and S. Grimme., J. Chem. Theory Comput., 2019,
     15, 1652-1671. DOI: 10.1021/acs.jctc.8b01176
   * P. Pracht, E. Caldeweyher, S. Ehlert, S. Grimme, ChemRxiv, 2019, preprint.
     DOI: 10.26434/chemrxiv.8326202.v1
   
   for DFT-D4:
   * E. Caldeweyher, C. Bannwarth and S. Grimme, J. Chem. Phys., 2017,
     147, 034112. DOI: 10.1063/1.4993215
   * E. Caldeweyher, S. Ehlert, A. Hansen, H. Neugebauer, S. Spicher,
     C. Bannwarth and S. Grimme, J. Chem. Phys., 2019, 150, 154122.
     DOI: 10.1063/1.5090222
   
   for sTDA-xTB:
   * S. Grimme and C. Bannwarth, J. Chem. Phys., 2016, 145, 054103.
     DOI: 10.1063/1.4959605
   
   in the mass-spec context:
   * V. Asgeirsson, C. Bauer and S. Grimme, Chem. Sci., 2017, 8, 4879.
     DOI: 10.1039/c7sc00601b
   
   for metadynamics refer to:
   * S. Grimme, J. Chem. Theory Comput., 2019, 155, 2847-2862
     DOI: 10.1021/acs.jctc.9b00143
   
   with help from (in alphabetical order)
   C. Bannwarth, F. Bohle, G. Brandenburg, E. Caldeweyher, M. Checinski,
   S. Dohm, S. Ehlert, S. Ehrlich, F. März, H. Neugebauer, J. Pisarek,
   P. Pracht, P. Shushkov, and S. Spicher.
   
 * started run on 2021/05/19 at 10:58:28.471     

           -------------------------------------------------
          |                Calculation Setup                |
           -------------------------------------------------

          program call               : /ihome/ghutchison/geoffh/xtb/xtb 45.xyz -opt
          hostname                   : smp-n58
          coordinate file            : 45.xyz
          omp threads                :                     1
          number of atoms            :                    34
          number of electrons        :                    94
          charge                     :                     0
          spin                       :                   0.0
          first test random number   :      0.01603042956562


########################################################################
# WARNING! Please study the warnings concerning your input carefully
#  - the use of '-opt' is discouraged, please use '--opt' next time
########################################################################

           ------------------------------------------------- 
          |                 G F N 2 - x T B                 |
          | Geometry, Frequencies, Noncovalent interactions |
          |            JCTC 2019 parametrisation            |
           ------------------------------------------------- 
             KAB for C  - Si     :                1.0500
             KAB for H  - Pd     :                0.9500
             k(s)              :                1.8500
             k(p)              :                2.2300
             k(d)              :                2.2300
             k(f)              :                2.0000
             kEN (H0ij)        :               -2.0000
             D4 a1             :                0.5200
             D4 a2             :                5.0000
             D4 s6             :                1.0000
             D4 s8             :                2.7000
             D4 s9             :                5.0000
             alphaj            :                2.0000

  Z AO/shell   Hii/eV     exponent
  1     Wed Apr 25 08:07:45 CEST 2018   EN: 2.200 GM2: 0.406  GM3: 0.0800  RAES: 1.40
     1s    -10.707211    1.230000
  6     Wed Apr 25 08:07:45 CEST 2018   EN: 2.550 GM2: 0.538  GM3: 0.1500  RAES: 3.00
     2s    -13.970922    2.096432
     2p    -10.063292    1.800000

           ------------------------------------------------- 
          |        Self-Consistent Charge Iterations        |
           ------------------------------------------------- 

          ...................................................
          :                      SETUP                      :
          :.................................................:
          :  # basis functions                  94          :
          :  # atomic orbitals                  94          :
          :  # shells                           54          :
          :  # electrons                        94          :
          :  max. iterations                   250          :
          :  Hamiltonian                  GFN2-xTB          :
          :  restarted?                      false          :
          :  GBSA solvation                  false          :
          :  PC potential                    false          :
          :  electronic temp.          300.0000000     K    :
          :  accuracy                    1.0000000          :
          :  -> integral cutoff          0.2500000E+02      :
          :  -> integral neglect         0.1000000E-07      :
          :  -> SCF convergence          0.1000000E-05 Eh   :
          :  -> wf. convergence          0.1000000E-03 e    :
          :  Broyden damping             0.4000000          :
          ...................................................

 iter      E             dE          RMSdq      gap      omega  full diag
   1    -50.8030374 -0.508030E+02  0.488E+00    1.77       0.0  T
   2    -50.8266581 -0.236206E-01  0.289E+00    1.84       1.0  T
   3    -50.7988495  0.278086E-01  0.986E-01    1.64       1.0  T
   4    -50.8293817 -0.305322E-01  0.301E-01    1.81       1.0  T
   5    -50.8317281 -0.234642E-02  0.143E-01    1.77       1.0  T
   6    -50.8323500 -0.621881E-03  0.378E-02    1.77       1.0  T
   7    -50.8323620 -0.119340E-04  0.238E-02    1.78       1.0  T
   8    -50.8323668 -0.482986E-05  0.128E-02    1.77       1.3  T
   9    -50.8323703 -0.348925E-05  0.201E-03    1.78       8.5  T
  10    -50.8323704 -0.100822E-06  0.766E-04    1.78      22.4  T
  11    -50.8323704 -0.117777E-07  0.313E-04    1.78      54.9  T

   *** convergence criteria satisfied after 11 iterations ***

         #    Occupation            Energy/Eh            Energy/eV
      -------------------------------------------------------------
         1        2.0000           -0.6518234             -17.7370
       ...           ...                  ...                  ...
        41        2.0000           -0.4183039             -11.3826
        42        2.0000           -0.4154508             -11.3050
        43        2.0000           -0.4081349             -11.1059
        44        2.0000           -0.3973376             -10.8121
        45        2.0000           -0.3847197             -10.4688
        46        2.0000           -0.3782908             -10.2938
        47        2.0000           -0.3696981             -10.0600 (HOMO)
        48                         -0.3044581              -8.2847 (LUMO)
        49                         -0.2493895              -6.7862
        50                         -0.2324433              -6.3251
        51                         -0.2127998              -5.7906
        52                         -0.1907899              -5.1917
       ...                                ...                  ...
        94                          0.7615614              20.7231
      -------------------------------------------------------------
                  HL-Gap            0.0652400 Eh            1.7753 eV
             Fermi-level           -0.3370781 Eh           -9.1724 eV

 SCC (total)                   0 d,  0 h,  0 min,  0.062 sec
 SCC setup                      ...        0 min,  0.000 sec (  0.640%)
 Dispersion                     ...        0 min,  0.001 sec (  1.132%)
 integral evaluation            ...        0 min,  0.016 sec ( 26.051%)
 zeroth order Hamiltonian       ...        0 min,  0.000 sec (  0.422%)
 iterations                     ...        0 min,  0.021 sec ( 34.154%)
 molecular gradient             ...        0 min,  0.023 sec ( 36.801%)
 printout                       ...        0 min,  0.000 sec (  0.716%)

         :::::::::::::::::::::::::::::::::::::::::::::::::::::
         ::                     SUMMARY                     ::
         :::::::::::::::::::::::::::::::::::::::::::::::::::::
         :: total energy             -49.880585647033 Eh    ::
         :: gradient norm              0.051549723352 Eh/a0 ::
         :: HOMO-LUMO gap              1.775270908047 eV    ::
         ::.................................................::
         :: SCC energy               -50.832370382260 Eh    ::
         :: -> isotropic ES            0.002398531379 Eh    ::
         :: -> anisotropic ES          0.006893104872 Eh    ::
         :: -> anisotropic XC          0.033593980662 Eh    ::
         :: -> dispersion             -0.039338363561 Eh    ::
         :: repulsion energy           0.952044408388 Eh    ::
         :: add. restraining           0.000000000000 Eh    ::
         :::::::::::::::::::::::::::::::::::::::::::::::::::::

      ----------------------------------------------------------- 
     |                   =====================                   |
     |                        A N C O P T                        |
     |                   =====================                   |
     |               Approximate Normal Coordinate               |
     |                Rational Function Optimizer                |
      ----------------------------------------------------------- 

          ...................................................
          :                      SETUP                      :
          :.................................................:
          :   optimization level            normal          :
          :   max. optcycles                   200          :
          :   ANC micro-cycles                  20          :
          :   degrees of freedom                96          :
          :.................................................:
          :   RF solver                   davidson          :
          :   input Hessian                  false          :
          :   write xtbopt.log                true          :
          :   linear?                        false          :
          :   energy convergence         0.5000000E-05 Eh   :
          :   grad. convergence          0.1000000E-02 Eh/α :
          :   maximium RF displ.         2.0000000          :
          :   Hlow (freq-cutoff)         0.5000000E-02      :
          :   Hmax (freq-cutoff)         5.0000000          :
          :   S6 in model hess.         20.0000000          :
          ...................................................

generating ANC from model Hessian ...
Using Lindh-Hessian (1995)
 Shifting diagonal of input Hessian by   4.553592833718430E-003
 Lowest  eigenvalues of input Hessian
   -0.000000   -0.000000   -0.000000   -0.000000   -0.000000    0.000000
    0.005000    0.005118    0.005279    0.006792    0.008090    0.009284
    0.010702    0.012039    0.012879    0.014142    0.014932    0.018077
 Highest eigenvalues
    1.881511    1.965164    1.978993    2.013322    2.024414    2.064286
 

........................................................................
.............................. CYCLE    1 ..............................
........................................................................
   1    -50.8323704 -0.508324E+02  0.152E-04    1.78       0.0  T
   2    -50.8323704 -0.990852E-10  0.120E-04    1.78     143.2  T
   3    -50.8323704 -0.420080E-09  0.488E-05    1.78     351.1  T
     SCC iter.                  ...        0 min,  0.006 sec
     gradient                   ...        0 min,  0.022 sec
 * total energy  :   -49.8805856 Eh     change        0.3219398E-08 Eh
   gradient norm :     0.0515500 Eh/α   predicted     0.0000000E+00 (-100.00%)
   displ. norm   :     0.2575014 α      lambda       -0.5796909E-02
   maximum displ.:     0.1771644 α      in ANC's #10, #30, #37, ...

........................................................................
.............................. CYCLE    2 ..............................
........................................................................
   1    -50.8636903 -0.508637E+02  0.102E-01    1.71       0.0  T
   2    -50.8636897  0.628255E-06  0.654E-02    1.71       1.0  T
   3    -50.8636662  0.234737E-04  0.502E-02    1.71       1.0  T
   4    -50.8637254 -0.592217E-04  0.621E-03    1.71       2.8  T
   5    -50.8637266 -0.123054E-05  0.214E-03    1.71       8.0  T
   6    -50.8637266  0.202846E-07  0.168E-03    1.71      10.2  T
     SCC iter.                  ...        0 min,  0.010 sec
     gradient                   ...        0 min,  0.019 sec
 * total energy  :   -49.8843517 Eh     change       -0.3766039E-02 Eh
   gradient norm :     0.0209914 Eh/α   predicted    -0.3090649E-02 ( -17.93%)
   displ. norm   :     0.1886262 α      lambda       -0.1097813E-02
   maximum displ.:     0.1371643 α      in ANC's #10, #5, #9, ...

........................................................................
.............................. CYCLE    3 ..............................
........................................................................
   1    -50.8746934 -0.508747E+02  0.735E-02    1.67       0.0  T
   2    -50.8746933  0.142645E-06  0.449E-02    1.68       1.0  T
   3    -50.8746693  0.239658E-04  0.368E-02    1.67       1.0  T
   4    -50.8747061 -0.367912E-04  0.350E-03    1.67       4.9  T
   5    -50.8747064 -0.368461E-06  0.149E-03    1.67      11.5  T
   6    -50.8747065 -0.279384E-07  0.970E-04    1.67      17.7  T
     SCC iter.                  ...        0 min,  0.011 sec
     gradient                   ...        0 min,  0.021 sec
 * total energy  :   -49.8849772 Eh     change       -0.6254994E-03 Eh
   gradient norm :     0.0063901 Eh/α   predicted    -0.5684458E-03 (  -9.12%)
   displ. norm   :     0.0799565 α      lambda       -0.1195896E-03
   maximum displ.:     0.0577005 α      in ANC's #5, #10, #9, ...

........................................................................
.............................. CYCLE    4 ..............................
........................................................................
   1    -50.8746386 -0.508746E+02  0.397E-02    1.66       0.0  T
   2    -50.8746389 -0.276439E-06  0.236E-02    1.66       1.0  T
   3    -50.8746325  0.639737E-05  0.144E-02    1.66       1.2  T
   4    -50.8746397 -0.721014E-05  0.124E-03    1.66      13.9  T
   5    -50.8746398 -0.433015E-07  0.483E-04    1.66      35.5  T
   6    -50.8746398 -0.213194E-08  0.250E-04    1.66      68.5  T
     SCC iter.                  ...        0 min,  0.011 sec
     gradient                   ...        0 min,  0.020 sec
 * total energy  :   -49.8850562 Eh     change       -0.7897658E-04 Eh
   gradient norm :     0.0025844 Eh/α   predicted    -0.6018592E-04 ( -23.79%)
   displ. norm   :     0.0798380 α      lambda       -0.5809918E-04
   maximum displ.:     0.0700847 α      in ANC's #5, #9, #8, ...

........................................................................
.............................. CYCLE    5 ..............................
........................................................................
   1    -50.8737099 -0.508737E+02  0.410E-02    1.66       0.0  T
   2    -50.8737101 -0.201177E-06  0.242E-02    1.66       1.0  T
   3    -50.8737079  0.223147E-05  0.834E-03    1.66       2.1  T
   4    -50.8737103 -0.245507E-05  0.963E-04    1.66      17.8  T
   5    -50.8737104 -0.268354E-07  0.356E-04    1.66      48.1  T
   6    -50.8737104 -0.123163E-08  0.174E-04    1.66      98.7  T
     SCC iter.                  ...        0 min,  0.010 sec
     gradient                   ...        0 min,  0.023 sec
 * total energy  :   -49.8850924 Eh     change       -0.3628287E-04 Eh
   gradient norm :     0.0023624 Eh/α   predicted    -0.2923612E-04 ( -19.42%)
   displ. norm   :     0.0576952 α      lambda       -0.3053300E-04
   maximum displ.:     0.0482445 α      in ANC's #5, #7, #4, ...

........................................................................
.............................. CYCLE    6 ..............................
........................................................................
   1    -50.8730806 -0.508731E+02  0.338E-02    1.66       0.0  T
   2    -50.8730806 -0.578287E-07  0.200E-02    1.66       1.0  T
   3    -50.8730801  0.528929E-06  0.401E-03    1.66       4.3  T
   4    -50.8730807 -0.575155E-06  0.771E-04    1.66      22.2  T
   5    -50.8730807 -0.165250E-07  0.250E-04    1.66      68.5  T
     SCC iter.                  ...        0 min,  0.010 sec
     gradient                   ...        0 min,  0.022 sec
 * total energy  :   -49.8851142 Eh     change       -0.2170845E-04 Eh
   gradient norm :     0.0023115 Eh/α   predicted    -0.1532181E-04 ( -29.42%)
   displ. norm   :     0.0695305 α      lambda       -0.2924956E-04
   maximum displ.:     0.0571315 α      in ANC's #5, #4, #7, ...

........................................................................
.............................. CYCLE    7 ..............................
........................................................................
   1    -50.8729377 -0.508729E+02  0.368E-02    1.66       0.0  T
   2    -50.8729378 -0.886932E-07  0.217E-02    1.66       1.0  T
   3    -50.8729373  0.490879E-06  0.361E-03    1.66       4.8  T
   4    -50.8729378 -0.549002E-06  0.530E-04    1.66      32.4  T
   5    -50.8729378 -0.858803E-08  0.197E-04    1.66      86.9  T
     SCC iter.                  ...        0 min,  0.009 sec
     gradient                   ...        0 min,  0.021 sec
 * total energy  :   -49.8851383 Eh     change       -0.2416550E-04 Eh
   gradient norm :     0.0018667 Eh/α   predicted    -0.1469932E-04 ( -39.17%)
   displ. norm   :     0.1347708 α      lambda       -0.3171250E-04
   maximum displ.:     0.1059308 α      in ANC's #5, #4, #7, ...

........................................................................
.............................. CYCLE    8 ..............................
........................................................................
   1    -50.8732935 -0.508733E+02  0.709E-02    1.66       0.0  T
   2    -50.8732937 -0.248544E-06  0.417E-02    1.66       1.0  T
   3    -50.8732930  0.725280E-06  0.478E-03    1.66       3.6  T
   4    -50.8732938 -0.835841E-06  0.104E-03    1.66      16.4  T
   5    -50.8732939 -0.298404E-07  0.413E-04    1.66      41.6  T
   6    -50.8732939 -0.220159E-08  0.223E-04    1.66      76.9  T
     SCC iter.                  ...        0 min,  0.011 sec
     gradient                   ...        0 min,  0.023 sec
 * total energy  :   -49.8851740 Eh     change       -0.3565706E-04 Eh
   gradient norm :     0.0021368 Eh/α   predicted    -0.1598720E-04 ( -55.16%)
   displ. norm   :     0.0882628 α      lambda       -0.2272564E-04
   maximum displ.:     0.0682821 α      in ANC's #5, #4, #7, ...

........................................................................
.............................. CYCLE    9 ..............................
........................................................................
   1    -50.8734013 -0.508734E+02  0.457E-02    1.66       0.0  T
   2    -50.8734013 -0.704301E-07  0.269E-02    1.66       1.0  T
   3    -50.8734011  0.234387E-06  0.292E-03    1.66       5.9  T
   4    -50.8734014 -0.278552E-06  0.521E-04    1.66      32.9  T
   5    -50.8734014 -0.615357E-08  0.248E-04    1.66      69.1  T
     SCC iter.                  ...        0 min,  0.009 sec
     gradient                   ...        0 min,  0.022 sec
 * total energy  :   -49.8851936 Eh     change       -0.1963799E-04 Eh
   gradient norm :     0.0016690 Eh/α   predicted    -0.1145591E-04 ( -41.66%)
   displ. norm   :     0.1831181 α      lambda       -0.2620321E-04
   maximum displ.:     0.1393581 α      in ANC's #5, #4, #7, ...

........................................................................
.............................. CYCLE   10 ..............................
........................................................................
   1    -50.8732607 -0.508733E+02  0.941E-02    1.66       0.0  T
   2    -50.8732611 -0.328682E-06  0.554E-02    1.66       1.0  T
   3    -50.8732596  0.143907E-05  0.719E-03    1.65       2.4  T
   4    -50.8732613 -0.166773E-05  0.109E-03    1.66      15.7  T
   5    -50.8732613 -0.266694E-07  0.530E-04    1.66      32.4  T
   6    -50.8732613 -0.276530E-08  0.291E-04    1.66      58.9  T
     SCC iter.                  ...        0 min,  0.011 sec
     gradient                   ...        0 min,  0.021 sec
 * total energy  :   -49.8852183 Eh     change       -0.2465421E-04 Eh
   gradient norm :     0.0013590 Eh/α   predicted    -0.1330235E-04 ( -46.04%)
   displ. norm   :     0.0964592 α      lambda       -0.8038890E-05
   maximum displ.:     0.0725078 α      in ANC's #5, #4, #2, ...

........................................................................
.............................. CYCLE   11 ..............................
........................................................................
   1    -50.8734412 -0.508734E+02  0.476E-02    1.65       0.0  T
   2    -50.8734413 -0.929119E-07  0.280E-02    1.65       1.0  T
   3    -50.8734412  0.184723E-06  0.271E-03    1.65       6.3  T
   4    -50.8734414 -0.237381E-06  0.493E-04    1.65      34.8  T
   5    -50.8734414 -0.439008E-08  0.266E-04    1.65      64.5  T
     SCC iter.                  ...        0 min,  0.009 sec
     gradient                   ...        0 min,  0.023 sec
 * total energy  :   -49.8852253 Eh     change       -0.7078442E-05 Eh
   gradient norm :     0.0009491 Eh/α   predicted    -0.4037404E-05 ( -42.96%)
   displ. norm   :     0.0710004 α      lambda       -0.3701176E-05
   maximum displ.:     0.0526905 α      in ANC's #5, #4, #2, ...

........................................................................
.............................. CYCLE   12 ..............................
........................................................................
   1    -50.8733378 -0.508733E+02  0.366E-02    1.65       0.0  T
   2    -50.8733379 -0.597064E-07  0.216E-02    1.65       1.0  T
   3    -50.8733375  0.383163E-06  0.370E-03    1.65       4.6  T
   4    -50.8733380 -0.437559E-06  0.352E-04    1.65      48.8  T
   5    -50.8733380 -0.206896E-08  0.182E-04    1.65      94.2  T
     SCC iter.                  ...        0 min,  0.009 sec
     gradient                   ...        0 min,  0.022 sec
 * total energy  :   -49.8852281 Eh     change       -0.2718491E-05 Eh
   gradient norm :     0.0006831 Eh/α   predicted    -0.1859954E-05 ( -31.58%)
   displ. norm   :     0.0710738 α      lambda        0.4007574E-05
   maximum displ.:     0.0526808 α      in ANC's #5, #4, #2, ...

   *** GEOMETRY OPTIMIZATION CONVERGED AFTER 12 ITERATIONS ***

------------------------------------------------------------------------
 total energy gain   :        -0.0046424 Eh       -2.9132 kcal/mol
 total RMSD          :         0.1729012 a0        0.0915 Å
 total power (kW/mol):        -1.0157216 (step)  -20.8795 (real)
------------------------------------------------------------------------

 ANCopt (total)                0 d,  0 h,  0 min,  0.584 sec
 optimizer setup                ...        0 min,  0.000 sec (  0.023%)
 model hessian                  ...        0 min,  0.006 sec (  0.986%)
 ANC generation                 ...        0 min,  0.001 sec (  0.205%)
 coordinate transformation      ...        0 min,  0.000 sec (  0.045%)
 single point calculation       ...        0 min,  0.572 sec ( 98.046%)
 optimization log               ...        0 min,  0.002 sec (  0.272%)
 hessian update                 ...        0 min,  0.000 sec (  0.031%)
 rational function              ...        0 min,  0.002 sec (  0.270%)

================
 final structure:
================
$coord
    4.14109957927603   -1.10582052480227   -0.04614147916928      C 
    1.95600301391734   -2.57401729004271   -0.01769691919439      C 
   -0.37402338440326   -1.39828472317903    0.00035754514503      C 
   -0.46450408903231    1.27934620263115   -0.01968554720840      C 
   -3.09178909961041    2.02205145254888   -0.02965736566256      C 
   -4.54859353990775   -0.06656080843055   -0.00331573004201      C 
   -3.00259186755396   -2.32914720601542    0.02342915298482      C 
   -3.87492409210941   -4.76364508611899    0.05630465525572      C 
   -2.33326041690630   -7.03532629394218    0.08329244445649      C 
   -3.79405566517132   -9.11903802741904    0.06991466929355      C 
   -6.41721274708873   -8.35857385135620    0.04316280933489      C 
   -6.50719431527208   -5.68269257968441    0.04764675914809      C 
   -8.84985139659863   -4.52547671526895    0.04378678569677      C 
  -11.02832854530293   -5.99980279058092    0.02540244820921      C 
  -10.90870326989178   -8.60950569308489    0.01113212572808      C 
   -8.57865412049092   -9.81680482710708    0.02204053102662      C 
    1.70934241059902    2.76337674000146   -0.06614183915242      C 
    4.03323166523686    1.49493499634422   -0.07069755058426      C 
    1.55100257619327    5.51275888571982   -0.08319043899314      C 
    3.34469771266190    7.07182380833747   -0.88881192843587      C 
    5.95807697843743   -2.03730255874028   -0.04171152061013      H 
    2.17059001533770   -4.59601350632881   -0.00734204718205      H 
   -3.76181143190464    3.93919787659627   -0.06589257514571      H 
   -6.57035567278834   -0.05119547542064   -0.00406745883526      H 
   -0.31153443313975   -7.05427365671185    0.11359663761844      H 
   -3.16313869623781  -11.05062061906218    0.08099277267425      H 
   -9.07709588527831   -2.50394237121856    0.05916025776572      H 
  -12.84821085620148   -5.07438796128813    0.02269007112631      H 
  -12.62856290702022   -9.70851581880867   -0.00573012570067      H 
   -8.45573343477903  -11.85473516884669    0.01470986764148      H 
    5.76396117564888    2.57347761688180   -0.05579643829940      H 
   -0.20748602220586    6.29547462322355    0.60526076838865      H 
    5.11328940309188    6.40843690103315   -1.64769229406658      H 
    3.09343164550910    9.09069279122316   -0.84689523805349      H 
$end
           -------------------------------------------------
          |                Final Singlepoint                |
           -------------------------------------------------

          ...................................................
          :                      SETUP                      :
          :.................................................:
          :  # basis functions                  94          :
          :  # atomic orbitals                  94          :
          :  # shells                           54          :
          :  # electrons                        94          :
          :  max. iterations                   250          :
          :  Hamiltonian                  GFN2-xTB          :
          :  restarted?                      false          :
          :  GBSA solvation                  false          :
          :  PC potential                    false          :
          :  electronic temp.          300.0000000     K    :
          :  accuracy                    1.0000000          :
          :  -> integral cutoff          0.2500000E+02      :
          :  -> integral neglect         0.1000000E-07      :
          :  -> SCF convergence          0.1000000E-05 Eh   :
          :  -> wf. convergence          0.1000000E-03 e    :
          :  Broyden damping             0.4000000          :
          ...................................................

 iter      E             dE          RMSdq      gap      omega  full diag
   1    -50.8733380 -0.508733E+02  0.977E-05    1.65       0.0  T
   2    -50.8733380  0.191349E-09  0.104E-04    1.65     165.5  T
   3    -50.8733380 -0.397002E-09  0.298E-05    1.65     574.9  T

   *** convergence criteria satisfied after 3 iterations ***

         #    Occupation            Energy/Eh            Energy/eV
      -------------------------------------------------------------
         1        2.0000           -0.6534239             -17.7806
       ...           ...                  ...                  ...
        41        2.0000           -0.4179503             -11.3730
        42        2.0000           -0.4168323             -11.3426
        43        2.0000           -0.4075698             -11.0905
        44        2.0000           -0.3979641             -10.8292
        45        2.0000           -0.3849110             -10.4740
        46        2.0000           -0.3783833             -10.2963
        47        2.0000           -0.3683466             -10.0232 (HOMO)
        48                         -0.3075651              -8.3693 (LUMO)
        49                         -0.2521245              -6.8607
        50                         -0.2315159              -6.2999
        51                         -0.2098482              -5.7103
        52                         -0.1873570              -5.0982
       ...                                ...                  ...
        94                          0.7640476              20.7908
      -------------------------------------------------------------
                  HL-Gap            0.0607815 Eh            1.6539 eV
             Fermi-level           -0.3379559 Eh           -9.1962 eV

 SCC (total)                   0 d,  0 h,  0 min,  0.045 sec
 SCC setup                      ...        0 min,  0.000 sec (  0.732%)
 Dispersion                     ...        0 min,  0.001 sec (  1.169%)
 integral evaluation            ...        0 min,  0.016 sec ( 35.077%)
 zeroth order Hamiltonian       ...        0 min,  0.000 sec (  0.490%)
 iterations                     ...        0 min,  0.006 sec ( 13.037%)
 molecular gradient             ...        0 min,  0.022 sec ( 48.532%)
 printout                       ...        0 min,  0.000 sec (  0.859%)

         :::::::::::::::::::::::::::::::::::::::::::::::::::::
         ::                     SUMMARY                     ::
         :::::::::::::::::::::::::::::::::::::::::::::::::::::
         :: total energy             -49.885228070914 Eh    ::
         :: gradient norm              0.000683136381 Eh/a0 ::
         :: HOMO-LUMO gap              1.653948277749 eV    ::
         ::.................................................::
         :: SCC energy               -50.873337955802 Eh    ::
         :: -> isotropic ES            0.002478870456 Eh    ::
         :: -> anisotropic ES          0.006934634021 Eh    ::
         :: -> anisotropic XC          0.032114690182 Eh    ::
         :: -> dispersion             -0.039639287691 Eh    ::
         :: repulsion energy           0.988383789371 Eh    ::
         :: add. restraining           0.000000000000 Eh    ::
         :::::::::::::::::::::::::::::::::::::::::::::::::::::

           -------------------------------------------------
          |                Property Printout                |
           -------------------------------------------------

    * Orbital Energies and Occupations

         #    Occupation            Energy/Eh            Energy/eV
      -------------------------------------------------------------
         1        2.0000           -0.6534239             -17.7806
       ...           ...                  ...                  ...
        35        2.0000           -0.4437106             -12.0740
        36        2.0000           -0.4420608             -12.0291
        37        2.0000           -0.4371476             -11.8954
        38        2.0000           -0.4338992             -11.8070
        39        2.0000           -0.4276791             -11.6377
        40        2.0000           -0.4217354             -11.4760
        41        2.0000           -0.4179503             -11.3730
        42        2.0000           -0.4168323             -11.3426
        43        2.0000           -0.4075698             -11.0905
        44        2.0000           -0.3979641             -10.8292
        45        2.0000           -0.3849110             -10.4740
        46        2.0000           -0.3783833             -10.2963
        47        2.0000           -0.3683466             -10.0232 (HOMO)
        48                         -0.3075651              -8.3693 (LUMO)
        49                         -0.2521245              -6.8607
        50                         -0.2315159              -6.2999
        51                         -0.2098482              -5.7103
        52                         -0.1873570              -5.0982
        53                         -0.1774128              -4.8276
        54                         -0.1616096              -4.3976
        55                         -0.1047459              -2.8503
        56                         -0.0711308              -1.9356
        57                         -0.0577193              -1.5706
        58                          0.0566600               1.5418
       ...                                ...                  ...
        94                          0.7640476              20.7908
      -------------------------------------------------------------
                  HL-Gap            0.0607815 Eh            1.6539 eV
             Fermi-level           -0.3379559 Eh           -9.1962 eV

     #   Z        covCN         q      C6AA      α(0)
     1   6 C      2.917    -0.036    28.884     8.813
     2   6 C      2.915    -0.030    28.749     8.792
     3   6 C      3.057    -0.003    28.043     8.684
     4   6 C      3.088    -0.002    27.978     8.670
     5   6 C      2.988    -0.033    28.814     8.805
     6   6 C      3.005    -0.047    29.143     8.855
     7   6 C      3.033     0.016    27.624     8.621
     8   6 C      3.034     0.016    27.616     8.620
     9   6 C      3.006    -0.046    29.118     8.852
    10   6 C      2.985    -0.035    28.866     8.813
    11   6 C      3.090     0.005    27.818     8.645
    12   6 C      3.054    -0.003    28.045     8.685
    13   6 C      2.916    -0.029    28.714     8.787
    14   6 C      2.920    -0.035    28.864     8.810
    15   6 C      2.920    -0.030    28.756     8.794
    16   6 C      2.913    -0.033    28.823     8.804
    17   6 C      2.966     0.011    27.757     8.642
    18   6 C      2.924    -0.035    28.860     8.810
    19   6 C      2.894    -0.029    28.711     8.785
    20   6 C      2.838    -0.086    30.143     8.997
    21   1 H      0.926     0.030     2.591     2.517
    22   1 H      0.926     0.034     2.535     2.490
    23   1 H      0.926     0.030     2.588     2.516
    24   1 H      0.927     0.034     2.527     2.486
    25   1 H      0.927     0.034     2.526     2.485
    26   1 H      0.926     0.030     2.581     2.512
    27   1 H      0.926     0.033     2.548     2.496
    28   1 H      0.926     0.029     2.597     2.520
    29   1 H      0.926     0.030     2.590     2.516
    30   1 H      0.926     0.030     2.580     2.512
    31   1 H      0.926     0.035     2.515     2.480
    32   1 H      0.925     0.037     2.485     2.465
    33   1 H      0.926     0.039     2.461     2.453
    34   1 H      0.926     0.036     2.504     2.474

 Mol. C6AA /au·bohr⁶  :      16691.885871
 Mol. C8AA /au·bohr⁸  :     425616.810259
 Mol. α(0) /au        :        210.209189


Wiberg/Mayer (AO) data.
largest (>0.10) Wiberg bond orders for each atom
          total WBO             WBO to atom ...
     1  C   3.987        C   18 1.480    C    2 1.386    H   21 0.971
     2  C   3.980        C    3 1.438    C    1 1.386    H   22 0.957
     3  C   3.984        C    2 1.438    C    4 1.275    C    7 1.068
     4  C   3.975        C   17 1.361    C    3 1.275    C    5 1.119
     5  C   3.941        C    6 1.708    C    4 1.119    H   23 0.970
     6  C   3.973        C    5 1.708    C    7 1.136    H   24 0.959
     7  C   3.966        C    8 1.541    C    6 1.136    C    3 1.068
     8  C   3.963        C    7 1.541    C    9 1.131    C   12 1.070
     9  C   3.986        C   10 1.720    C    8 1.131    H   25 0.959
    10  C   3.939        C    9 1.720    C   11 1.108    H   26 0.972
    11  C   3.975        C   16 1.422    C   12 1.273    C   10 1.108
    12  C   3.984        C   13 1.435    C   11 1.273    C    8 1.070
    13  C   3.980        C   12 1.435    C   14 1.404    H   27 0.957
    14  C   3.986        C   15 1.455    C   13 1.404    H   28 0.972
    15  C   3.959        C   14 1.455    C   16 1.408    H   29 0.971
    16  C   3.981        C   11 1.422    C   15 1.408    H   30 0.969
    17  C   3.979        C    4 1.361    C   18 1.339    C   19 1.090
    18  C   3.958        C    1 1.480    C   17 1.339    H   31 0.967
    19  C   3.991        C   20 1.900    C   17 1.090    H   32 0.962
    20  C   3.970        C   19 1.900    H   34 0.978    H   33 0.974
    21  H   0.998        C    1 0.971
    22  H   0.998        C    2 0.957
    23  H   0.998        C    5 0.970
    24  H   0.998        C    6 0.959
    25  H   0.998        C    9 0.959
    26  H   0.998        C   10 0.972
    27  H   0.999        C   13 0.957
    28  H   0.999        C   14 0.972
    29  H   0.998        C   15 0.971
    30  H   0.999        C   16 0.969
    31  H   0.998        C   18 0.967
    32  H   0.998        C   19 0.962
    33  H   0.998        C   20 0.974
    34  H   0.998        C   20 0.978

molecular dipole:
                 x           y           z       tot (Debye)
 q only:        0.034       0.044       0.007
   full:        0.027       0.035      -0.001       0.111
molecular quadrupole (traceless):
                xx          xy          yy          xz          yz          zz
 q only:        2.131      -0.435       1.670      -0.240      -0.008      -3.801
  q+dip:        7.571      -0.065       8.303      -1.105      -0.194     -15.874
   full:        3.661      -0.429       3.954      -0.559      -0.060      -7.615

           -------------------------------------------------
          |                Geometry Summary                 |
           -------------------------------------------------

      molecular mass/u    :      254.3306000
   center of mass at/Å    :       -1.4986786      -1.3342789      -0.0236946
  moments of inertia/u·Å² :        0.4814454E+03   0.2905076E+04   0.3381482E+04
rotational constants/cm⁻¹ :        0.3501463E-01   0.5802819E-02   0.4985280E-02

 * 31 selected distances

     #   Z        #   Z                                     value/Å
     1   6 C      2   6 C                                 1.3931598
     2   6 C      3   6 C                                 1.3811117
     3   6 C      4   6 C                                 1.4177898
     4   6 C      5   6 C                                 1.4447932 (max)
     5   6 C      6   6 C                                 1.3476135
     7   6 C      8   6 C                                 1.3685985
     9   6 C     10   6 C                                 1.3466450
    11   6 C     12   6 C                                 1.4168179
    12   6 C     13   6 C                                 1.3826831
    13   6 C     14   6 C                                 1.3920217
    14   6 C     15   6 C                                 1.3824662
    11   6 C     16   6 C                                 1.3797948
    15   6 C     16   6 C                                 1.3887066
     4   6 C     17   6 C                                 1.3930649
     1   6 C     18   6 C                                 1.3775052
    17   6 C     18   6 C                                 1.4010138
    19   6 C     20   6 C                                 1.3279135
     1   6 C     21   1 H                                 1.0804920
     2   6 C     22   1 H                                 1.0760171
     5   6 C     23   1 H                                 1.0748544
     6   6 C     24   1 H                                 1.0699015 (min)
     9   6 C     25   1 H                                 1.0700186
    10   6 C     26   1 H                                 1.0753098
    13   6 C     27   1 H                                 1.0765184
    14   6 C     28   1 H                                 1.0803995
    15   6 C     29   1 H                                 1.0800954
    16   6 C     30   1 H                                 1.0803933
    18   6 C     31   1 H                                 1.0791715
    19   6 C     32   1 H                                 1.0817620
    20   6 C     33   1 H                                 1.0772232
    20   6 C     34   1 H                                 1.0768105

 * 2 distinct bonds (by element types)

   Z      Z             #   av. dist./Å        max./Å        min./Å
   1 H    6 C          14     1.0770691     1.0817620     1.0699015
   6 C    6 C          17     1.3848058     1.4447932     1.3279135


optimized geometry written to: xtbopt.xyz


           -------------------------------------------------
          | TOTAL ENERGY              -49.885228070914 Eh   |
          | GRADIENT NORM               0.000683136381 Eh/α |
          | HOMO-LUMO GAP               1.653948277749 eV   |
           -------------------------------------------------

------------------------------------------------------------------------
 * finished run on 2021/05/19 at 10:58:29.189     
------------------------------------------------------------------------
 total:
 * wall-time:     0 d,  0 h,  0 min,  0.718 sec
 *  cpu-time:     0 d,  0 h,  0 min,  0.718 sec
 * ratio c/w:     0.999 speedup
 SCF:
 * wall-time:     0 d,  0 h,  0 min,  0.062 sec
 *  cpu-time:     0 d,  0 h,  0 min,  0.062 sec
 * ratio c/w:     1.000 speedup
 ANC optimizer:
 * wall-time:     0 d,  0 h,  0 min,  0.629 sec
 *  cpu-time:     0 d,  0 h,  0 min,  0.629 sec
 * ratio c/w:     1.000 speedup

