      -----------------------------------------------------------      
     |                   =====================                   |     
     |                           x T B                           |     
     |                   =====================                   |     
     |                         S. Grimme                         |     
     |          Mulliken Center for Theoretical Chemistry        |     
     |                    University of Bonn                     |     
     |                Version 6.2 RC2 (SAW190805)                |     
      -----------------------------------------------------------      

   This program is distributed in the hope that it will be useful,
   but WITHOUT ANY WARRANTY; without even the implied warranty of
   MERCHANTABILITY or FITNESS FOR A PARTICULAR PURPOSE.
   
   FOR NON-COMMERCIAL, ACADEMIA USE ONLY.
   
   Cite this work as:
   * S. Grimme, C. Bannwarth, P. Shushkov, J. Chem. Theory Comput., 2017,
     13, 1989-2009. DOI: 10.1021/acs.jctc.7b00118
   * C. Bannwarth, S. Ehlert and S. Grimme., J. Chem. Theory Comput., 2019,
     15, 1652-1671. DOI: 10.1021/acs.jctc.8b01176
   * P. Pracht, E. Caldeweyher, S. Ehlert, S. Grimme, ChemRxiv, 2019, preprint.
     DOI: 10.26434/chemrxiv.8326202.v1
   
   for DFT-D4:
   * E. Caldeweyher, C. Bannwarth and S. Grimme, J. Chem. Phys., 2017,
     147, 034112. DOI: 10.1063/1.4993215
   * E. Caldeweyher, S. Ehlert, A. Hansen, H. Neugebauer, S. Spicher,
     C. Bannwarth and S. Grimme, J. Chem. Phys., 2019, 150, 154122.
     DOI: 10.1063/1.5090222
   
   for sTDA-xTB:
   * S. Grimme and C. Bannwarth, J. Chem. Phys., 2016, 145, 054103.
     DOI: 10.1063/1.4959605
   
   in the mass-spec context:
   * V. Asgeirsson, C. Bauer and S. Grimme, Chem. Sci., 2017, 8, 4879.
     DOI: 10.1039/c7sc00601b
   
   for metadynamics refer to:
   * S. Grimme, J. Chem. Theory Comput., 2019, 155, 2847-2862
     DOI: 10.1021/acs.jctc.9b00143
   
   with help from (in alphabetical order)
   C. Bannwarth, F. Bohle, G. Brandenburg, E. Caldeweyher, M. Checinski,
   S. Dohm, S. Ehlert, S. Ehrlich, F. März, H. Neugebauer, J. Pisarek,
   P. Pracht, P. Shushkov, and S. Spicher.
   
 * started run on 2021/05/19 at 10:59:58.986     

           -------------------------------------------------
          |                Calculation Setup                |
           -------------------------------------------------

          program call               : /ihome/ghutchison/geoffh/xtb/xtb 454.xyz -opt
          hostname                   : smp-n126
          coordinate file            : 454.xyz
          omp threads                :                     1
          number of atoms            :                    32
          number of electrons        :                    86
          charge                     :                     0
          spin                       :                   0.0
          first test random number   :      0.59606491525914


########################################################################
# WARNING! Please study the warnings concerning your input carefully
#  - the use of '-opt' is discouraged, please use '--opt' next time
########################################################################

           ------------------------------------------------- 
          |                 G F N 2 - x T B                 |
          | Geometry, Frequencies, Noncovalent interactions |
          |            JCTC 2019 parametrisation            |
           ------------------------------------------------- 
             KAB for C  - Si     :                1.0500
             KAB for H  - Pd     :                0.9500
             k(s)              :                1.8500
             k(p)              :                2.2300
             k(d)              :                2.2300
             k(f)              :                2.0000
             kEN (H0ij)        :               -2.0000
             D4 a1             :                0.5200
             D4 a2             :                5.0000
             D4 s6             :                1.0000
             D4 s8             :                2.7000
             D4 s9             :                5.0000
             alphaj            :                2.0000

  Z AO/shell   Hii/eV     exponent
  1     Wed Apr 25 08:07:45 CEST 2018   EN: 2.200 GM2: 0.406  GM3: 0.0800  RAES: 1.40
     1s    -10.707211    1.230000
  6     Wed Apr 25 08:07:45 CEST 2018   EN: 2.550 GM2: 0.538  GM3: 0.1500  RAES: 3.00
     2s    -13.970922    2.096432
     2p    -10.063292    1.800000

           ------------------------------------------------- 
          |        Self-Consistent Charge Iterations        |
           ------------------------------------------------- 

          ...................................................
          :                      SETUP                      :
          :.................................................:
          :  # basis functions                  86          :
          :  # atomic orbitals                  86          :
          :  # shells                           50          :
          :  # electrons                        86          :
          :  max. iterations                   250          :
          :  Hamiltonian                  GFN2-xTB          :
          :  restarted?                      false          :
          :  GBSA solvation                  false          :
          :  PC potential                    false          :
          :  electronic temp.          300.0000000     K    :
          :  accuracy                    1.0000000          :
          :  -> integral cutoff          0.2500000E+02      :
          :  -> integral neglect         0.1000000E-07      :
          :  -> SCF convergence          0.1000000E-05 Eh   :
          :  -> wf. convergence          0.1000000E-03 e    :
          :  Broyden damping             0.4000000          :
          ...................................................

 iter      E             dE          RMSdq      gap      omega  full diag
   1    -46.4254651 -0.464255E+02  0.514E+00    1.88       0.0  T
   2    -46.4529081 -0.274430E-01  0.307E+00    1.87       1.0  T
   3    -46.4390687  0.138395E-01  0.795E-01    1.87       1.0  T
   4    -46.4530993 -0.140306E-01  0.363E-01    1.87       1.0  T
   5    -46.4560098 -0.291047E-02  0.177E-01    1.87       1.0  T
   6    -46.4569407 -0.930880E-03  0.502E-02    1.87       1.0  T
   7    -46.4569873 -0.466078E-04  0.251E-02    1.87       1.0  T
   8    -46.4569910 -0.369828E-05  0.980E-03    1.87       1.8  T
   9    -46.4569924 -0.140110E-05  0.464E-03    1.87       3.8  T
  10    -46.4569928 -0.479064E-06  0.718E-04    1.87      24.6  T
  11    -46.4569928 -0.713047E-08  0.345E-04    1.87      51.2  T

   *** convergence criteria satisfied after 11 iterations ***

         #    Occupation            Energy/Eh            Energy/eV
      -------------------------------------------------------------
         1        2.0000           -0.6485204             -17.6471
       ...           ...                  ...                  ...
        37        2.0000           -0.4192270             -11.4077
        38        2.0000           -0.4069444             -11.0735
        39        2.0000           -0.4035871             -10.9822
        40        2.0000           -0.3998721             -10.8811
        41        2.0000           -0.3971381             -10.8067
        42        2.0000           -0.3954609             -10.7610
        43        2.0000           -0.3513651              -9.5611 (HOMO)
        44                         -0.2827227              -7.6933 (LUMO)
        45                         -0.2247358              -6.1154
        46                         -0.2235464              -6.0830
        47                         -0.2134164              -5.8074
        48                         -0.2103965              -5.7252
       ...                                ...                  ...
        86                          0.6896808              18.7672
      -------------------------------------------------------------
                  HL-Gap            0.0686424 Eh            1.8679 eV
             Fermi-level           -0.3170439 Eh           -8.6272 eV

 SCC (total)                   0 d,  0 h,  0 min,  0.096 sec
 SCC setup                      ...        0 min,  0.000 sec (  0.392%)
 Dispersion                     ...        0 min,  0.001 sec (  0.632%)
 integral evaluation            ...        0 min,  0.014 sec ( 14.215%)
 zeroth order Hamiltonian       ...        0 min,  0.000 sec (  0.266%)
 iterations                     ...        0 min,  0.032 sec ( 33.176%)
 molecular gradient             ...        0 min,  0.049 sec ( 50.800%)
 printout                       ...        0 min,  0.000 sec (  0.468%)

         :::::::::::::::::::::::::::::::::::::::::::::::::::::
         ::                     SUMMARY                     ::
         :::::::::::::::::::::::::::::::::::::::::::::::::::::
         :: total energy             -45.602766352476 Eh    ::
         :: gradient norm              0.099424861604 Eh/a0 ::
         :: HOMO-LUMO gap              1.867855191188 eV    ::
         ::.................................................::
         :: SCC energy               -46.456992848376 Eh    ::
         :: -> isotropic ES            0.002609740696 Eh    ::
         :: -> anisotropic ES          0.005801000893 Eh    ::
         :: -> anisotropic XC          0.033459076470 Eh    ::
         :: -> dispersion             -0.036669721081 Eh    ::
         :: repulsion energy           0.854087149453 Eh    ::
         :: add. restraining           0.000000000000 Eh    ::
         :::::::::::::::::::::::::::::::::::::::::::::::::::::

      ----------------------------------------------------------- 
     |                   =====================                   |
     |                        A N C O P T                        |
     |                   =====================                   |
     |               Approximate Normal Coordinate               |
     |                Rational Function Optimizer                |
      ----------------------------------------------------------- 

          ...................................................
          :                      SETUP                      :
          :.................................................:
          :   optimization level            normal          :
          :   max. optcycles                   200          :
          :   ANC micro-cycles                  20          :
          :   degrees of freedom                90          :
          :.................................................:
          :   RF solver                   davidson          :
          :   input Hessian                  false          :
          :   write xtbopt.log                true          :
          :   linear?                        false          :
          :   energy convergence         0.5000000E-05 Eh   :
          :   grad. convergence          0.1000000E-02 Eh/α :
          :   maximium RF displ.         2.0000000          :
          :   Hlow (freq-cutoff)         0.5000000E-02      :
          :   Hmax (freq-cutoff)         5.0000000          :
          :   S6 in model hess.         20.0000000          :
          ...................................................

generating ANC from model Hessian ...
Using Lindh-Hessian (1995)
 Shifting diagonal of input Hessian by   4.225917846118790E-003
 Lowest  eigenvalues of input Hessian
   -0.000000   -0.000000   -0.000000   -0.000000    0.000000    0.000000
    0.005000    0.005736    0.006324    0.006657    0.007083    0.008803
    0.009616    0.009945    0.014346    0.014736    0.016181    0.019113
 Highest eigenvalues
    1.857200    1.881716    1.926875    1.952101    2.010975    2.073615
 

........................................................................
.............................. CYCLE    1 ..............................
........................................................................
   1    -46.4569928 -0.464570E+02  0.165E-04    1.87       0.0  T
   2    -46.4569928 -0.521538E-10  0.144E-04    1.87     122.9  T
   3    -46.4569928 -0.529532E-09  0.460E-05    1.87     384.5  T
     SCC iter.                  ...        0 min,  0.019 sec
     gradient                   ...        0 min,  0.049 sec
 * total energy  :   -45.6027664 Eh     change       -0.2683325E-07 Eh
   gradient norm :     0.0994251 Eh/α   predicted     0.0000000E+00 (-100.00%)
   displ. norm   :     0.3074964 α      lambda       -0.1155720E-01
   maximum displ.:     0.1462722 α      in ANC's #20, #19, #14, ...

........................................................................
.............................. CYCLE    2 ..............................
........................................................................
   1    -46.5029393 -0.465029E+02  0.132E-01    2.06       0.0  T
   2    -46.5029694 -0.301236E-04  0.809E-02    2.06       1.0  T
   3    -46.5029457  0.237593E-04  0.477E-02    2.06       1.0  T
   4    -46.5029762 -0.305628E-04  0.191E-02    2.06       1.0  T
   5    -46.5029876 -0.114258E-04  0.417E-03    2.06       4.2  T
   6    -46.5029878 -0.141776E-06  0.248E-03    2.06       7.1  T
   7    -46.5029879 -0.985520E-07  0.808E-04    2.06      21.9  T
     SCC iter.                  ...        0 min,  0.011 sec
     gradient                   ...        0 min,  0.028 sec
 * total energy  :   -45.6105337 Eh     change       -0.7767291E-02 Eh
   gradient norm :     0.0400078 Eh/α   predicted    -0.6325003E-02 ( -18.57%)
   displ. norm   :     0.2197515 α      lambda       -0.2708534E-02
   maximum displ.:     0.1050559 α      in ANC's #11, #14, #18, ...

........................................................................
.............................. CYCLE    3 ..............................
........................................................................
   1    -46.5222525 -0.465223E+02  0.939E-02    2.20       0.0  T
   2    -46.5222618 -0.929441E-05  0.569E-02    2.20       1.0  T
   3    -46.5222428  0.189290E-04  0.331E-02    2.20       1.0  T
   4    -46.5222642 -0.213072E-04  0.116E-02    2.20       1.5  T
   5    -46.5222685 -0.431249E-05  0.212E-03    2.20       8.4  T
   6    -46.5222685 -0.951844E-08  0.120E-03    2.20      14.7  T
     SCC iter.                  ...        0 min,  0.025 sec
     gradient                   ...        0 min,  0.035 sec
 * total energy  :   -45.6119712 Eh     change       -0.1437502E-02 Eh
   gradient norm :     0.0086104 Eh/α   predicted    -0.1419687E-02 (  -1.24%)
   displ. norm   :     0.0959503 α      lambda       -0.3310751E-03
   maximum displ.:     0.0339324 α      in ANC's #20, #6, #11, ...

........................................................................
.............................. CYCLE    4 ..............................
........................................................................
   1    -46.5212109 -0.465212E+02  0.494E-02    2.21       0.0  T
   2    -46.5212115 -0.591823E-06  0.296E-02    2.21       1.0  T
   3    -46.5212076  0.392007E-05  0.113E-02    2.21       1.6  T
   4    -46.5212117 -0.413383E-05  0.306E-03    2.21       5.8  T
   5    -46.5212120 -0.265143E-06  0.792E-04    2.21      22.3  T
   6    -46.5212120 -0.162530E-09  0.445E-04    2.21      39.7  T
     SCC iter.                  ...        0 min,  0.023 sec
     gradient                   ...        0 min,  0.054 sec
 * total energy  :   -45.6121201 Eh     change       -0.1489553E-03 Eh
   gradient norm :     0.0053558 Eh/α   predicted    -0.1671239E-03 (  12.20%)
   displ. norm   :     0.0757391 α      lambda       -0.1418228E-03
   maximum displ.:     0.0342432 α      in ANC's #6, #8, #11, ...

........................................................................
.............................. CYCLE    5 ..............................
........................................................................
   1    -46.5187611 -0.465188E+02  0.327E-02    2.21       0.0  T
   2    -46.5187613 -0.230201E-06  0.196E-02    2.21       1.0  T
   3    -46.5187598  0.148433E-05  0.674E-03    2.21       2.6  T
   4    -46.5187615 -0.167445E-05  0.105E-03    2.21      16.9  T
   5    -46.5187615 -0.208215E-07  0.449E-04    2.21      39.3  T
     SCC iter.                  ...        0 min,  0.021 sec
     gradient                   ...        0 min,  0.036 sec
 * total energy  :   -45.6122019 Eh     change       -0.8178573E-04 Eh
   gradient norm :     0.0022496 Eh/α   predicted    -0.7132089E-04 ( -12.80%)
   displ. norm   :     0.0435051 α      lambda       -0.2240003E-04
   maximum displ.:     0.0270842 α      in ANC's #8, #6, #7, ...

........................................................................
.............................. CYCLE    6 ..............................
........................................................................
   1    -46.5186544 -0.465187E+02  0.195E-02    2.21       0.0  T
   2    -46.5186544 -0.563346E-07  0.115E-02    2.21       1.5  T
   3    -46.5186540  0.419189E-06  0.364E-03    2.21       4.9  T
   4    -46.5186545 -0.460489E-06  0.673E-04    2.21      26.3  T
   5    -46.5186545 -0.127662E-07  0.193E-04    2.21      91.6  T
     SCC iter.                  ...        0 min,  0.008 sec
     gradient                   ...        0 min,  0.041 sec
 * total energy  :   -45.6122191 Eh     change       -0.1723428E-04 Eh
   gradient norm :     0.0010171 Eh/α   predicted    -0.1122310E-04 ( -34.88%)
   displ. norm   :     0.1186082 α      lambda       -0.2675044E-04
   maximum displ.:     0.0682808 α      in ANC's #8, #6, #5, ...

........................................................................
.............................. CYCLE    7 ..............................
........................................................................
   1    -46.5189531 -0.465190E+02  0.547E-02    2.21       0.0  T
   2    -46.5189534 -0.226819E-06  0.322E-02    2.21       1.0  T
   3    -46.5189526  0.789648E-06  0.544E-03    2.21       3.2  T
   4    -46.5189535 -0.928841E-06  0.818E-04    2.21      21.6  T
   5    -46.5189535 -0.122536E-07  0.442E-04    2.21      40.0  T
     SCC iter.                  ...        0 min,  0.008 sec
     gradient                   ...        0 min,  0.064 sec
 * total energy  :   -45.6122468 Eh     change       -0.2761579E-04 Eh
   gradient norm :     0.0025671 Eh/α   predicted    -0.1346160E-04 ( -51.25%)
   displ. norm   :     0.1039363 α      lambda       -0.2894433E-04
   maximum displ.:     0.0596577 α      in ANC's #8, #5, #6, ...

........................................................................
.............................. CYCLE    8 ..............................
........................................................................
   1    -46.5190466 -0.465190E+02  0.486E-02    2.21       0.0  T
   2    -46.5190467 -0.964788E-07  0.286E-02    2.21       1.0  T
   3    -46.5190461  0.601653E-06  0.446E-03    2.21       4.0  T
   4    -46.5190468 -0.681368E-06  0.647E-04    2.21      27.3  T
   5    -46.5190468 -0.720112E-08  0.316E-04    2.21      56.0  T
     SCC iter.                  ...        0 min,  0.043 sec
     gradient                   ...        0 min,  0.034 sec
 * total energy  :   -45.6122739 Eh     change       -0.2712742E-04 Eh
   gradient norm :     0.0030670 Eh/α   predicted    -0.1462929E-04 ( -46.07%)
   displ. norm   :     0.3485511 α      lambda       -0.1040704E-03
   maximum displ.:     0.1960279 α      in ANC's #8, #5, #4, ...

........................................................................
.............................. CYCLE    9 ..............................
........................................................................
   1    -46.5178535 -0.465179E+02  0.164E-01    2.21       0.0  T
   2    -46.5178546 -0.104257E-05  0.966E-02    2.21       1.0  T
   3    -46.5178481  0.649427E-05  0.144E-02    2.21       1.2  T
   4    -46.5178555 -0.737523E-05  0.202E-03    2.21       8.8  T
   5    -46.5178555 -0.616121E-07  0.990E-04    2.21      17.9  T
   6    -46.5178555 -0.320716E-08  0.428E-04    2.21      41.3  T
     SCC iter.                  ...        0 min,  0.023 sec
     gradient                   ...        0 min,  0.034 sec
 * total energy  :   -45.6123460 Eh     change       -0.7207959E-04 Eh
   gradient norm :     0.0059827 Eh/α   predicted    -0.5835711E-04 ( -19.04%)
   displ. norm   :     0.1743446 α      lambda       -0.8446681E-04
   maximum displ.:     0.1010053 α      in ANC's #5, #8, #4, ...

........................................................................
.............................. CYCLE   10 ..............................
........................................................................
   1    -46.5181505 -0.465182E+02  0.844E-02    2.21       0.0  T
   2    -46.5181508 -0.304590E-06  0.497E-02    2.21       1.0  T
   3    -46.5181486  0.218895E-05  0.814E-03    2.21       2.2  T
   4    -46.5181510 -0.243213E-05  0.120E-03    2.21      14.7  T
   5    -46.5181511 -0.250085E-07  0.507E-04    2.21      34.8  T
     SCC iter.                  ...        0 min,  0.021 sec
     gradient                   ...        0 min,  0.032 sec
 * total energy  :   -45.6124188 Eh     change       -0.7285629E-04 Eh
   gradient norm :     0.0060017 Eh/α   predicted    -0.4351763E-04 ( -40.27%)
   displ. norm   :     0.3525399 α      lambda       -0.3236047E-03
   maximum displ.:     0.2180481 α      in ANC's #5, #8, #4, ...

........................................................................
.............................. CYCLE   11 ..............................
........................................................................
   1    -46.5213560 -0.465214E+02  0.165E-01    2.21       0.0  T
   2    -46.5213576 -0.163747E-05  0.968E-02    2.21       1.0  T
   3    -46.5213486  0.905146E-05  0.168E-02    2.21       1.1  T
   4    -46.5213585 -0.990022E-05  0.325E-03    2.21       5.4  T
   5    -46.5213588 -0.261331E-06  0.105E-03    2.21      16.9  T
   6    -46.5213588 -0.112970E-07  0.542E-04    2.21      32.6  T
     SCC iter.                  ...        0 min,  0.010 sec
     gradient                   ...        0 min,  0.019 sec
 * total energy  :   -45.6126372 Eh     change       -0.2183605E-03 Eh
   gradient norm :     0.0058196 Eh/α   predicted    -0.1819255E-03 ( -16.69%)
   displ. norm   :     0.7808115 α      lambda       -0.4956056E-03
   maximum displ.:     0.4315965 α      in ANC's #5, #8, #4, ...

........................................................................
.............................. CYCLE   12 ..............................
........................................................................
   1    -46.5111442 -0.465111E+02  0.386E-01    2.20       0.0  T
   2    -46.5111490 -0.472689E-05  0.227E-01    2.20       1.0  T
   3    -46.5110977  0.512157E-04  0.411E-02    2.20       1.0  T
   4    -46.5111543 -0.565117E-04  0.485E-03    2.20       3.6  T
   5    -46.5111547 -0.437089E-06  0.216E-03    2.20       8.2  T
   6    -46.5111547 -0.365183E-08  0.124E-03    2.20      14.2  T
     SCC iter.                  ...        0 min,  0.010 sec
     gradient                   ...        0 min,  0.019 sec
 * total energy  :   -45.6126050 Eh     change        0.3222736E-04 Eh
   gradient norm :     0.0218561 Eh/α   predicted    -0.3988808E-03 (*******%)
   displ. norm   :     0.2677457 α      lambda       -0.1060377E-02
   maximum displ.:     0.1468548 α      in ANC's #8, #5, #6, ...

........................................................................
.............................. CYCLE   13 ..............................
........................................................................
   1    -46.5200304 -0.465200E+02  0.138E-01    2.20       0.0  T
   2    -46.5200313 -0.943829E-06  0.818E-02    2.20       1.0  T
   3    -46.5200166  0.147325E-04  0.209E-02    2.20       1.0  T
   4    -46.5200325 -0.158952E-04  0.324E-03    2.20       5.5  T
   5    -46.5200327 -0.187763E-06  0.134E-03    2.20      13.2  T
   6    -46.5200326  0.580457E-09  0.690E-04    2.20      25.6  T
     SCC iter.                  ...        0 min,  0.010 sec
     gradient                   ...        0 min,  0.019 sec
 * total energy  :   -45.6130626 Eh     change       -0.4576280E-03 Eh
   gradient norm :     0.0065705 Eh/α   predicted    -0.5681964E-03 (  24.16%)
   displ. norm   :     0.2534986 α      lambda       -0.2977430E-03
   maximum displ.:     0.1284519 α      in ANC's #2, #5, #4, ...

........................................................................
.............................. CYCLE   14 ..............................
........................................................................
   1    -46.5198716 -0.465199E+02  0.125E-01    2.19       0.0  T
   2    -46.5198729 -0.129657E-05  0.738E-02    2.19       1.0  T
   3    -46.5198672  0.577075E-05  0.140E-02    2.19       1.3  T
   4    -46.5198735 -0.633574E-05  0.258E-03    2.19       6.9  T
   5    -46.5198736 -0.120960E-06  0.130E-03    2.19      13.6  T
   6    -46.5198736 -0.277784E-07  0.614E-04    2.19      28.8  T
     SCC iter.                  ...        0 min,  0.010 sec
     gradient                   ...        0 min,  0.019 sec
 * total energy  :   -45.6132982 Eh     change       -0.2355997E-03 Eh
   gradient norm :     0.0065694 Eh/α   predicted    -0.1584406E-03 ( -32.75%)
   displ. norm   :     0.7038683 α      lambda       -0.6371930E-03
   maximum displ.:     0.3606815 α      in ANC's #2, #4, #5, ...

........................................................................
.............................. CYCLE   15 ..............................
........................................................................
   1    -46.5127302 -0.465127E+02  0.356E-01    2.16       0.0  T
   2    -46.5127356 -0.536329E-05  0.210E-01    2.16       1.0  T
   3    -46.5127183  0.172892E-04  0.248E-02    2.16       1.0  T
   4    -46.5127389 -0.205539E-04  0.398E-03    2.16       4.4  T
   5    -46.5127391 -0.271241E-06  0.216E-03    2.16       8.2  T
   6    -46.5127392 -0.287691E-07  0.102E-03    2.16      17.3  T
     SCC iter.                  ...        0 min,  0.010 sec
     gradient                   ...        0 min,  0.019 sec
 * total energy  :   -45.6135848 Eh     change       -0.2865680E-03 Eh
   gradient norm :     0.0202925 Eh/α   predicted    -0.4764393E-03 (  66.26%)
   displ. norm   :     0.0985232 α      lambda       -0.4557151E-03
   maximum displ.:     0.0674748 α      in ANC's #5, #8, #1, ...

........................................................................
.............................. CYCLE   16 ..............................
........................................................................
   1    -46.5176996 -0.465177E+02  0.523E-02    2.17       0.0  T
   2    -46.5177002 -0.618146E-06  0.313E-02    2.17       1.0  T
   3    -46.5176965  0.375828E-05  0.110E-02    2.17       1.6  T
   4    -46.5177004 -0.395071E-05  0.206E-03    2.17       8.6  T
   5    -46.5177005 -0.105286E-06  0.798E-04    2.17      22.2  T
     SCC iter.                  ...        0 min,  0.008 sec
     gradient                   ...        0 min,  0.019 sec
 * total energy  :   -45.6138393 Eh     change       -0.2545747E-03 Eh
   gradient norm :     0.0076937 Eh/α   predicted    -0.2300693E-03 (  -9.63%)
   displ. norm   :     0.2774562 α      lambda       -0.3932064E-03
   maximum displ.:     0.1635612 α      in ANC's #2, #4, #3, ...

........................................................................
.............................. CYCLE   17 ..............................
........................................................................
   1    -46.5196373 -0.465196E+02  0.143E-01    2.16       0.0  T
   2    -46.5196392 -0.192441E-05  0.843E-02    2.16       1.0  T
   3    -46.5196370  0.213012E-05  0.105E-02    2.16       1.7  T
   4    -46.5196398 -0.273284E-05  0.243E-03    2.16       7.3  T
   5    -46.5196398 -0.532109E-07  0.127E-03    2.16      13.9  T
     SCC iter.                  ...        0 min,  0.008 sec
     gradient                   ...        0 min,  0.019 sec
 * total energy  :   -45.6140708 Eh     change       -0.2314631E-03 Eh
   gradient norm :     0.0081947 Eh/α   predicted    -0.2117400E-03 (  -8.52%)
   displ. norm   :     0.5896325 α      lambda       -0.5590957E-03
   maximum displ.:     0.3441483 α      in ANC's #2, #4, #3, ...

........................................................................
.............................. CYCLE   18 ..............................
........................................................................
   1    -46.5144045 -0.465144E+02  0.310E-01    2.14       0.0  T
   2    -46.5144077 -0.312791E-05  0.182E-01    2.14       1.0  T
   3    -46.5143971  0.105527E-04  0.212E-02    2.14       1.0  T
   4    -46.5144099 -0.127732E-04  0.242E-03    2.14       7.3  T
   5    -46.5144099 -0.677757E-07  0.161E-03    2.14      11.0  T
   6    -46.5144100 -0.201521E-07  0.653E-04    2.14      27.1  T
     SCC iter.                  ...        0 min,  0.010 sec
     gradient                   ...        0 min,  0.019 sec
 * total energy  :   -45.6144079 Eh     change       -0.3371334E-03 Eh
   gradient norm :     0.0133891 Eh/α   predicted    -0.3767378E-03 (  11.75%)
   displ. norm   :     0.1799054 α      lambda       -0.3586401E-03
   maximum displ.:     0.0965284 α      in ANC's #2, #1, #6, ...

........................................................................
.............................. CYCLE   19 ..............................
........................................................................
   1    -46.5183983 -0.465184E+02  0.919E-02    2.15       0.0  T
   2    -46.5183990 -0.623694E-06  0.543E-02    2.15       1.0  T
   3    -46.5183867  0.122595E-04  0.188E-02    2.15       1.0  T
   4    -46.5183998 -0.130652E-04  0.319E-03    2.15       5.6  T
   5    -46.5184000 -0.233350E-06  0.852E-04    2.15      20.8  T
   6    -46.5184000 -0.196830E-08  0.511E-04    2.15      34.6  T
     SCC iter.                  ...        0 min,  0.010 sec
     gradient                   ...        0 min,  0.019 sec
 * total energy  :   -45.6146403 Eh     change       -0.2323789E-03 Eh
   gradient norm :     0.0077726 Eh/α   predicted    -0.1851290E-03 ( -20.33%)
   displ. norm   :     0.3416266 α      lambda       -0.3642413E-03
   maximum displ.:     0.2039318 α      in ANC's #2, #1, #4, ...

........................................................................
.............................. CYCLE   20 ..............................
........................................................................
   1    -46.5187407 -0.465187E+02  0.185E-01    2.14       0.0  T
   2    -46.5187420 -0.128686E-05  0.109E-01    2.14       1.0  T
   3    -46.5187291  0.128907E-04  0.199E-02    2.14       1.0  T
   4    -46.5187432 -0.140524E-04  0.337E-03    2.14       5.2  T
   5    -46.5187434 -0.241820E-06  0.136E-03    2.14      13.0  T
   6    -46.5187434 -0.752648E-08  0.658E-04    2.14      26.9  T
     SCC iter.                  ...        0 min,  0.010 sec
     gradient                   ...        0 min,  0.045 sec
 * total energy  :   -45.6148928 Eh     change       -0.2525449E-03 Eh
   gradient norm :     0.0074132 Eh/α   predicted    -0.2033781E-03 ( -19.47%)
   displ. norm   :     0.4390253 α      lambda       -0.3526905E-03
   maximum displ.:     0.2645683 α      in ANC's #2, #1, #4, ...
 * RMSD in coord.:     0.7030163 α      energy gain  -0.1212650E-01 Eh

generating ANC from model Hessian ...
Using Lindh-Hessian (1995)
 Shifting diagonal of input Hessian by   4.198487528799824E-003
 Lowest  eigenvalues of input Hessian
   -0.000000   -0.000000   -0.000000    0.000000    0.000000    0.000000
    0.005000    0.005776    0.006624    0.007038    0.007570    0.009347
    0.010058    0.010374    0.015113    0.015552    0.017472    0.019692
 Highest eigenvalues
    1.928288    1.961232    1.996894    2.007905    2.060201    2.128914
 

........................................................................
.............................. CYCLE   21 ..............................
........................................................................
   1    -46.5153550 -0.465154E+02  0.237E-01    2.12       0.0  T
   2    -46.5153571 -0.208337E-05  0.140E-01    2.12       1.0  T
   3    -46.5153485  0.859248E-05  0.186E-02    2.12       1.0  T
   4    -46.5153585 -0.100256E-04  0.312E-03    2.12       5.7  T
   5    -46.5153586 -0.103606E-06  0.184E-03    2.12       9.6  T
   6    -46.5153586 -0.457482E-07  0.715E-04    2.12      24.7  T
   7    -46.5153586 -0.105819E-07  0.267E-04    2.12      66.1  T
     SCC iter.                  ...        0 min,  0.024 sec
     gradient                   ...        0 min,  0.047 sec
 * total energy  :   -45.6150637 Eh     change       -0.1708317E-03 Eh
   gradient norm :     0.0105021 Eh/α   predicted     0.0000000E+00 (-100.00%)
   displ. norm   :     0.1268537 α      lambda       -0.3756505E-03
   maximum displ.:     0.0833033 α      in ANC's #7, #8, #2, ...

........................................................................
.............................. CYCLE   22 ..............................
........................................................................
   1    -46.5200642 -0.465201E+02  0.589E-02    2.12       0.0  T
   2    -46.5200646 -0.388103E-06  0.349E-02    2.12       1.0  T
   3    -46.5200610  0.364482E-05  0.105E-02    2.12       1.7  T
   4    -46.5200650 -0.399301E-05  0.188E-03    2.12       9.4  T
   5    -46.5200651 -0.678250E-07  0.851E-04    2.12      20.8  T
   6    -46.5200651 -0.312084E-08  0.433E-04    2.12      40.8  T
     SCC iter.                  ...        0 min,  0.023 sec
     gradient                   ...        0 min,  0.032 sec
 * total energy  :   -45.6152988 Eh     change       -0.2350832E-03 Eh
   gradient norm :     0.0032955 Eh/α   predicted    -0.1908563E-03 ( -18.81%)
   displ. norm   :     0.1006267 α      lambda       -0.1173633E-03
   maximum displ.:     0.0569042 α      in ANC's #7, #8, #3, ...

........................................................................
.............................. CYCLE   23 ..............................
........................................................................
   1    -46.5218888 -0.465219E+02  0.525E-02    2.11       0.0  T
   2    -46.5218891 -0.266394E-06  0.310E-02    2.11       1.0  T
   3    -46.5218868  0.233684E-05  0.828E-03    2.11       2.1  T
   4    -46.5218894 -0.259658E-05  0.118E-03    2.11      15.0  T
   5    -46.5218894 -0.297576E-07  0.468E-04    2.11      37.8  T
   6    -46.5218894 -0.342389E-09  0.276E-04    2.11      64.1  T
     SCC iter.                  ...        0 min,  0.023 sec
     gradient                   ...        0 min,  0.047 sec
 * total energy  :   -45.6153731 Eh     change       -0.7430655E-04 Eh
   gradient norm :     0.0027683 Eh/α   predicted    -0.5927826E-04 ( -20.22%)
   displ. norm   :     0.1322235 α      lambda       -0.8672993E-04
   maximum displ.:     0.0642149 α      in ANC's #7, #2, #8, ...

........................................................................
.............................. CYCLE   24 ..............................
........................................................................
   1    -46.5219429 -0.465219E+02  0.707E-02    2.10       0.0  T
   2    -46.5219432 -0.307647E-06  0.416E-02    2.10       1.0  T
   3    -46.5219416  0.164147E-05  0.692E-03    2.10       2.6  T
   4    -46.5219434 -0.183679E-05  0.122E-03    2.10      14.4  T
   5    -46.5219435 -0.362753E-07  0.503E-04    2.10      35.2  T
   6    -46.5219435 -0.292172E-08  0.240E-04    2.10      73.7  T
     SCC iter.                  ...        0 min,  0.023 sec
     gradient                   ...        0 min,  0.034 sec
 * total energy  :   -45.6154350 Eh     change       -0.6192253E-04 Eh
   gradient norm :     0.0030974 Eh/α   predicted    -0.4412339E-04 ( -28.74%)
   displ. norm   :     0.1896220 α      lambda       -0.8801732E-04
   maximum displ.:     0.0888660 α      in ANC's #2, #7, #5, ...

........................................................................
.............................. CYCLE   25 ..............................
........................................................................
   1    -46.5205428 -0.465205E+02  0.104E-01    2.09       0.0  T
   2    -46.5205432 -0.422290E-06  0.613E-02    2.09       1.0  T
   3    -46.5205420  0.121358E-05  0.669E-03    2.09       2.6  T
   4    -46.5205434 -0.147474E-05  0.103E-03    2.09      17.1  T
   5    -46.5205435 -0.150613E-07  0.620E-04    2.09      28.5  T
   6    -46.5205435 -0.204204E-08  0.309E-04    2.09      57.3  T
     SCC iter.                  ...        0 min,  0.023 sec
     gradient                   ...        0 min,  0.047 sec
 * total energy  :   -45.6154982 Eh     change       -0.6318262E-04 Eh
   gradient norm :     0.0030395 Eh/α   predicted    -0.4559164E-04 ( -27.84%)
   displ. norm   :     0.1651564 α      lambda       -0.6485322E-04
   maximum displ.:     0.0860091 α      in ANC's #2, #5, #4, ...

........................................................................
.............................. CYCLE   26 ..............................
........................................................................
   1    -46.5198268 -0.465198E+02  0.877E-02    2.09       0.0  T
   2    -46.5198271 -0.302367E-06  0.516E-02    2.09       1.0  T
   3    -46.5198263  0.805115E-06  0.604E-03    2.09       2.9  T
   4    -46.5198273 -0.995919E-06  0.883E-04    2.09      20.0  T
   5    -46.5198273 -0.616757E-08  0.517E-04    2.09      34.2  T
     SCC iter.                  ...        0 min,  0.008 sec
     gradient                   ...        0 min,  0.047 sec
 * total energy  :   -45.6155486 Eh     change       -0.5038045E-04 Eh
   gradient norm :     0.0033037 Eh/α   predicted    -0.3331144E-04 ( -33.88%)
   displ. norm   :     0.1723222 α      lambda       -0.7084196E-04
   maximum displ.:     0.0951302 α      in ANC's #2, #5, #1, ...

........................................................................
.............................. CYCLE   27 ..............................
........................................................................
   1    -46.5197968 -0.465198E+02  0.878E-02    2.08       0.0  T
   2    -46.5197972 -0.388568E-06  0.516E-02    2.08       1.0  T
   3    -46.5197956  0.154577E-05  0.759E-03    2.08       2.3  T
   4    -46.5197975 -0.182282E-05  0.992E-04    2.08      17.8  T
   5    -46.5197975 -0.103004E-07  0.557E-04    2.08      31.7  T
   6    -46.5197975 -0.727560E-09  0.292E-04    2.08      60.6  T
     SCC iter.                  ...        0 min,  0.023 sec
     gradient                   ...        0 min,  0.034 sec
 * total energy  :   -45.6156025 Eh     change       -0.5389748E-04 Eh
   gradient norm :     0.0032959 Eh/α   predicted    -0.3647569E-04 ( -32.32%)
   displ. norm   :     0.1721320 α      lambda       -0.5794811E-04
   maximum displ.:     0.0984420 α      in ANC's #2, #1, #4, ...

........................................................................
.............................. CYCLE   28 ..............................
........................................................................
   1    -46.5200249 -0.465200E+02  0.841E-02    2.08       0.0  T
   2    -46.5200253 -0.346642E-06  0.494E-02    2.08       1.0  T
   3    -46.5200239  0.142215E-05  0.718E-03    2.08       2.5  T
   4    -46.5200255 -0.168154E-05  0.742E-04    2.08      23.8  T
   5    -46.5200256 -0.703572E-08  0.448E-04    2.08      39.5  T
   6    -46.5200256 -0.610655E-09  0.235E-04    2.08      75.1  T
     SCC iter.                  ...        0 min,  0.010 sec
     gradient                   ...        0 min,  0.047 sec
 * total energy  :   -45.6156438 Eh     change       -0.4138654E-04 Eh
   gradient norm :     0.0028044 Eh/α   predicted    -0.2983359E-04 ( -27.91%)
   displ. norm   :     0.1508452 α      lambda       -0.4164378E-04
   maximum displ.:     0.0900061 α      in ANC's #2, #1, #4, ...

........................................................................
.............................. CYCLE   29 ..............................
........................................................................
   1    -46.5202534 -0.465203E+02  0.781E-02    2.07       0.0  T
   2    -46.5202536 -0.230063E-06  0.460E-02    2.07       1.0  T
   3    -46.5202526  0.996115E-06  0.634E-03    2.07       2.8  T
   4    -46.5202538 -0.117630E-05  0.764E-04    2.07      23.1  T
   5    -46.5202538 -0.495623E-08  0.493E-04    2.07      35.8  T
   6    -46.5202538 -0.226442E-08  0.203E-04    2.07      87.0  T
     SCC iter.                  ...        0 min,  0.023 sec
     gradient                   ...        0 min,  0.034 sec
 * total energy  :   -45.6156712 Eh     change       -0.2731133E-04 Eh
   gradient norm :     0.0021162 Eh/α   predicted    -0.2129788E-04 ( -22.02%)
   displ. norm   :     0.1334298 α      lambda       -0.3250431E-04
   maximum displ.:     0.0783137 α      in ANC's #2, #1, #4, ...

........................................................................
.............................. CYCLE   30 ..............................
........................................................................
   1    -46.5204533 -0.465205E+02  0.666E-02    2.06       0.0  T
   2    -46.5204535 -0.140527E-06  0.391E-02    2.06       1.0  T
   3    -46.5204518  0.163337E-05  0.739E-03    2.06       2.4  T
   4    -46.5204536 -0.179622E-05  0.902E-04    2.06      19.6  T
   5    -46.5204536 -0.191701E-07  0.344E-04    2.06      51.4  T
   6    -46.5204536 -0.633229E-09  0.188E-04    2.06      93.9  T
     SCC iter.                  ...        0 min,  0.023 sec
     gradient                   ...        0 min,  0.047 sec
 * total energy  :   -45.6156920 Eh     change       -0.2083669E-04 Eh
   gradient norm :     0.0012489 Eh/α   predicted    -0.1654224E-04 ( -20.61%)
   displ. norm   :     0.1277759 α      lambda       -0.1628710E-04
   maximum displ.:     0.0785938 α      in ANC's #1, #2, #4, ...

........................................................................
.............................. CYCLE   31 ..............................
........................................................................
   1    -46.5205105 -0.465205E+02  0.639E-02    2.06       0.0  T
   2    -46.5205107 -0.152215E-06  0.376E-02    2.06       1.0  T
   3    -46.5205089  0.175773E-05  0.719E-03    2.06       2.5  T
   4    -46.5205109 -0.191911E-05  0.108E-03    2.06      16.4  T
   5    -46.5205109 -0.302072E-07  0.365E-04    2.06      48.4  T
   6    -46.5205109  0.186169E-09  0.212E-04    2.06      83.5  T
     SCC iter.                  ...        0 min,  0.010 sec
     gradient                   ...        0 min,  0.021 sec
 * total energy  :   -45.6157068 Eh     change       -0.1476982E-04 Eh
   gradient norm :     0.0012061 Eh/α   predicted    -0.8203711E-05 ( -44.46%)
   displ. norm   :     0.0544180 α      lambda       -0.5922537E-05
   maximum displ.:     0.0366428 α      in ANC's #1, #6, #2, ...

........................................................................
.............................. CYCLE   32 ..............................
........................................................................
   1    -46.5206275 -0.465206E+02  0.238E-02    2.06       0.0  T
   2    -46.5206275 -0.234184E-07  0.140E-02    2.06       1.3  T
   3    -46.5206274  0.168245E-06  0.237E-03    2.06       7.5  T
   4    -46.5206276 -0.187158E-06  0.357E-04    2.06      49.5  T
   5    -46.5206276 -0.330315E-08  0.174E-04    2.06     101.7  T
     SCC iter.                  ...        0 min,  0.008 sec
     gradient                   ...        0 min,  0.021 sec
 * total energy  :   -45.6157124 Eh     change       -0.5631691E-05 Eh
   gradient norm :     0.0008264 Eh/α   predicted    -0.2969371E-05 ( -47.27%)
   displ. norm   :     0.0358392 α      lambda       -0.3812009E-05
   maximum displ.:     0.0246173 α      in ANC's #1, #5, #6, ...

........................................................................
.............................. CYCLE   33 ..............................
........................................................................
   1    -46.5206771 -0.465207E+02  0.132E-02    2.06       0.0  T
   2    -46.5206772 -0.276641E-07  0.781E-03    2.06       2.3  T
   3    -46.5206770  0.109691E-06  0.194E-03    2.06       9.1  T
   4    -46.5206772 -0.121582E-06  0.370E-04    2.06      47.7  T
   5    -46.5206772 -0.237014E-08  0.188E-04    2.06      94.1  T
     SCC iter.                  ...        0 min,  0.008 sec
     gradient                   ...        0 min,  0.020 sec
 * total energy  :   -45.6157155 Eh     change       -0.3095400E-05 Eh
   gradient norm :     0.0005203 Eh/α   predicted    -0.1912010E-05 ( -38.23%)
   displ. norm   :     0.0184315 α      lambda       -0.1427680E-05
   maximum displ.:     0.0137330 α      in ANC's #1, #5, #3, ...

   *** GEOMETRY OPTIMIZATION CONVERGED AFTER 33 ITERATIONS ***

------------------------------------------------------------------------
 total energy gain   :        -0.0129491 Eh       -8.1257 kcal/mol
 total RMSD          :         0.8906477 a0        0.4713 Å
 total power (kW/mol):        -1.0302408 (step)  -14.2508 (real)
------------------------------------------------------------------------

 ANCopt (total)                0 d,  0 h,  0 min,  2.386 sec
 optimizer setup                ...        0 min,  0.000 sec (  0.006%)
 model hessian                  ...        0 min,  0.026 sec (  1.094%)
 ANC generation                 ...        0 min,  0.002 sec (  0.082%)
 coordinate transformation      ...        0 min,  0.001 sec (  0.029%)
 single point calculation       ...        0 min,  2.344 sec ( 98.235%)
 optimization log               ...        0 min,  0.004 sec (  0.167%)
 hessian update                 ...        0 min,  0.000 sec (  0.020%)
 rational function              ...        0 min,  0.007 sec (  0.286%)

================
 final structure:
================
$coord
    4.73747806293372    2.93861954018652   -0.29247244556683      C 
    2.44898557126063    1.56409796903627   -0.03178559282240      C 
    0.05768737135214    2.70799971144343   -0.15620354533393      C 
   -0.18076140032685    5.46241918738755   -0.44678627011984      C 
    0.74038757853543    7.13613918999150    1.16781853245223      C 
   -2.14798264052524    1.23297611733406   -0.00700417199896      C 
   -1.97237877756892   -1.45204583086101    0.26875801884198      C 
    0.41051525437486   -2.54228155260289    0.47776469118136      C 
    2.60939072859670   -1.10783520281489    0.32467109375085      C 
    5.02619047848547   -2.25333294546087    0.50652177347457      C 
    7.17476409035390   -0.85768550469144    0.29946198306295      C 
    7.02243977043870    1.76761276706040   -0.12879097421524      C 
   -4.24757966856628   -2.91601237163693    0.40295387501641      C 
   -6.54151580169899   -1.71157914593746    0.33831773021401      C 
   -6.70815536982690    0.92875679513539    0.13301176028997      C 
   -4.57833963776718    2.36270042049720   -0.04217698770491      C 
   -4.14143727529881   -5.67379692110086    0.55104087647296      C 
   -5.71806083138175   -7.07919183962812    1.89959458069773      C 
    4.63872734177580    4.94534089033771   -0.64490143325412      H 
   -1.21017619864168    6.09545347791204   -2.10079747280855      H 
    1.72862366162741    6.55983699390495    2.85244622556201      H 
    0.52028491583241    9.14002685747942    0.88631165735930      H 
    0.59176194395897   -4.55073057779786    0.78726786067553      H 
    5.11740150471532   -4.27283564161270    0.80054461639950      H 
    9.00844312359268   -1.74429991742285    0.43610838788037      H 
    8.74519801005554    2.84343208345365   -0.33602213440631      H 
   -8.25874448173077   -2.81252303743205    0.40427503358316      H 
   -8.54979290740913    1.80950212944181    0.10064466434551      H 
   -4.71936931350491    4.39219646071336   -0.18934941145764      H 
   -2.67566415090942   -6.58192605963870   -0.54929791395211      H 
   -7.17044638769360   -6.25290447293169    3.06283110715157      H 
   -5.59614871914791   -9.11007965769876    1.91889213458841      H 
$end
           -------------------------------------------------
          |                Final Singlepoint                |
           -------------------------------------------------

          ...................................................
          :                      SETUP                      :
          :.................................................:
          :  # basis functions                  86          :
          :  # atomic orbitals                  86          :
          :  # shells                           50          :
          :  # electrons                        86          :
          :  max. iterations                   250          :
          :  Hamiltonian                  GFN2-xTB          :
          :  restarted?                      false          :
          :  GBSA solvation                  false          :
          :  PC potential                    false          :
          :  electronic temp.          300.0000000     K    :
          :  accuracy                    1.0000000          :
          :  -> integral cutoff          0.2500000E+02      :
          :  -> integral neglect         0.1000000E-07      :
          :  -> SCF convergence          0.1000000E-05 Eh   :
          :  -> wf. convergence          0.1000000E-03 e    :
          :  Broyden damping             0.4000000          :
          ...................................................

 iter      E             dE          RMSdq      gap      omega  full diag
   1    -46.5206772 -0.465207E+02  0.106E-04    2.06       0.0  T
   2    -46.5206772  0.247056E-10  0.499E-05    2.06     354.3  T
   3    -46.5206772 -0.491198E-10  0.648E-05    2.06     272.8  T

   *** convergence criteria satisfied after 3 iterations ***

         #    Occupation            Energy/Eh            Energy/eV
      -------------------------------------------------------------
         1        2.0000           -0.6500109             -17.6877
       ...           ...                  ...                  ...
        37        2.0000           -0.4211073             -11.4589
        38        2.0000           -0.4126332             -11.2283
        39        2.0000           -0.4030060             -10.9664
        40        2.0000           -0.4021149             -10.9421
        41        2.0000           -0.3961168             -10.7789
        42        2.0000           -0.3915662             -10.6551
        43        2.0000           -0.3555157              -9.6741 (HOMO)
        44                         -0.2798591              -7.6154 (LUMO)
        45                         -0.2334709              -6.3531
        46                         -0.2278545              -6.2002
        47                         -0.2128715              -5.7925
        48                         -0.1908767              -5.1940
       ...                                ...                  ...
        86                          0.7214134              19.6307
      -------------------------------------------------------------
                  HL-Gap            0.0756566 Eh            2.0587 eV
             Fermi-level           -0.3176874 Eh           -8.6447 eV

 SCC (total)                   0 d,  0 h,  0 min,  0.041 sec
 SCC setup                      ...        0 min,  0.000 sec (  0.641%)
 Dispersion                     ...        0 min,  0.000 sec (  0.872%)
 integral evaluation            ...        0 min,  0.013 sec ( 32.637%)
 zeroth order Hamiltonian       ...        0 min,  0.000 sec (  0.547%)
 iterations                     ...        0 min,  0.006 sec ( 13.738%)
 molecular gradient             ...        0 min,  0.020 sec ( 50.516%)
 printout                       ...        0 min,  0.000 sec (  0.937%)

         :::::::::::::::::::::::::::::::::::::::::::::::::::::
         ::                     SUMMARY                     ::
         :::::::::::::::::::::::::::::::::::::::::::::::::::::
         :: total energy             -45.615715455260 Eh    ::
         :: gradient norm              0.000520042166 Eh/a0 ::
         :: HOMO-LUMO gap              2.058720747517 eV    ::
         ::.................................................::
         :: SCC energy               -46.520677172446 Eh    ::
         :: -> isotropic ES            0.002723085810 Eh    ::
         :: -> anisotropic ES          0.005589337741 Eh    ::
         :: -> anisotropic XC          0.031472396519 Eh    ::
         :: -> dispersion             -0.036962863231 Eh    ::
         :: repulsion energy           0.904907862290 Eh    ::
         :: add. restraining           0.000000000000 Eh    ::
         :::::::::::::::::::::::::::::::::::::::::::::::::::::

           -------------------------------------------------
          |                Property Printout                |
           -------------------------------------------------

    * Orbital Energies and Occupations

         #    Occupation            Energy/Eh            Energy/eV
      -------------------------------------------------------------
         1        2.0000           -0.6500109             -17.6877
       ...           ...                  ...                  ...
        31        2.0000           -0.4485356             -12.2053
        32        2.0000           -0.4450270             -12.1098
        33        2.0000           -0.4413626             -12.0101
        34        2.0000           -0.4341319             -11.8133
        35        2.0000           -0.4285489             -11.6614
        36        2.0000           -0.4239799             -11.5371
        37        2.0000           -0.4211073             -11.4589
        38        2.0000           -0.4126332             -11.2283
        39        2.0000           -0.4030060             -10.9664
        40        2.0000           -0.4021149             -10.9421
        41        2.0000           -0.3961168             -10.7789
        42        2.0000           -0.3915662             -10.6551
        43        2.0000           -0.3555157              -9.6741 (HOMO)
        44                         -0.2798591              -7.6154 (LUMO)
        45                         -0.2334709              -6.3531
        46                         -0.2278545              -6.2002
        47                         -0.2128715              -5.7925
        48                         -0.1908767              -5.1940
        49                         -0.1696583              -4.6166
        50                         -0.1554140              -4.2290
        51                         -0.0926227              -2.5204
        52                         -0.0389110              -1.0588
        53                          0.0866895               2.3589
        54                          0.1098195               2.9883
       ...                                ...                  ...
        86                          0.7214134              19.6307
      -------------------------------------------------------------
                  HL-Gap            0.0756566 Eh            2.0587 eV
             Fermi-level           -0.3176874 Eh           -8.6447 eV

     #   Z        covCN         q      C6AA      α(0)
     1   6 C      2.916    -0.035    28.874     8.812
     2   6 C      2.983     0.007    27.846     8.656
     3   6 C      2.974     0.002    27.972     8.675
     4   6 C      2.894    -0.024    28.603     8.769
     5   6 C      2.838    -0.086    30.149     8.998
     6   6 C      2.985     0.005    27.914     8.667
     7   6 C      2.981     0.006    27.876     8.661
     8   6 C      2.922    -0.046    29.152     8.854
     9   6 C      2.982     0.010    27.778     8.645
    10   6 C      2.919    -0.036    28.888     8.814
    11   6 C      2.914    -0.030    28.747     8.792
    12   6 C      2.915    -0.031    28.775     8.796
    13   6 C      2.970     0.009    27.818     8.651
    14   6 C      2.923    -0.035    28.873     8.812
    15   6 C      2.912    -0.032    28.790     8.798
    16   6 C      2.918    -0.037    28.930     8.820
    17   6 C      2.896    -0.029    28.719     8.787
    18   6 C      2.839    -0.088    30.187     9.004
    19   1 H      0.926     0.033     2.545     2.495
    20   1 H      0.925     0.039     2.466     2.456
    21   1 H      0.926     0.040     2.450     2.448
    22   1 H      0.926     0.035     2.513     2.479
    23   1 H      0.926     0.034     2.536     2.490
    24   1 H      0.926     0.029     2.600     2.521
    25   1 H      0.926     0.028     2.612     2.528
    26   1 H      0.926     0.028     2.620     2.531
    27   1 H      0.926     0.032     2.555     2.499
    28   1 H      0.926     0.028     2.614     2.528
    29   1 H      0.926     0.031     2.568     2.506
    30   1 H      0.925     0.038     2.479     2.462
    31   1 H      0.926     0.039     2.464     2.455
    32   1 H      0.926     0.036     2.504     2.474

 Mol. C6AA /au·bohr⁶  :      14073.812474
 Mol. C8AA /au·bohr⁸  :     354789.579346
 Mol. α(0) /au        :        192.883893


Wiberg/Mayer (AO) data.
largest (>0.10) Wiberg bond orders for each atom
          total WBO             WBO to atom ...
     1  C   3.985        C   12 1.593    C    2 1.246    H   19 0.965    C   10 0.119
     2  C   3.989        C    3 1.327    C    1 1.246    C    9 1.205
     3  C   3.985        C    2 1.327    C    6 1.323    C    4 1.048    C    8 0.126
     4  C   3.991        C    5 1.942    C    3 1.048    H   20 0.953
     5  C   3.987        C    4 1.942    H   22 0.977    H   21 0.976
     6  C   3.989        C    3 1.323    C   16 1.249    C    7 1.208
     7  C   3.989        C    8 1.383    C    6 1.208    C   13 1.194
     8  C   3.991        C    7 1.383    C    9 1.367    H   23 0.962    C    3 0.126
     9  C   3.987        C    8 1.367    C   10 1.240    C    2 1.205
    10  C   3.985        C   11 1.596    C    9 1.240    H   24 0.968    C    1 0.119
    11  C   3.979        C   10 1.596    C   12 1.282    H   25 0.971
    12  C   3.982        C    1 1.593    C   11 1.282    H   26 0.971
    13  C   3.981        C   14 1.520    C    7 1.194    C   17 1.074    C   16 0.110
    14  C   3.981        C   13 1.520    C   15 1.302    H   27 0.968
    15  C   3.980        C   16 1.576    C   14 1.302    H   28 0.970
    16  C   3.987        C   15 1.576    C    6 1.249    H   29 0.965    C   13 0.110
    17  C   3.991        C   18 1.917    C   13 1.074    H   30 0.957
    18  C   3.983        C   17 1.917    H   32 0.978    H   31 0.975
    19  H   0.998        C    1 0.965
    20  H   0.998        C    4 0.953
    21  H   0.998        C    5 0.976
    22  H   0.998        C    5 0.977
    23  H   0.997        C    8 0.962
    24  H   0.999        C   10 0.968
    25  H   0.998        C   11 0.971
    26  H   0.999        C   12 0.971
    27  H   0.998        C   14 0.968
    28  H   0.998        C   15 0.970
    29  H   0.998        C   16 0.965
    30  H   0.998        C   17 0.957
    31  H   0.998        C   18 0.975
    32  H   0.998        C   18 0.978

molecular dipole:
                 x           y           z       tot (Debye)
 q only:       -0.015       0.038      -0.041
   full:       -0.020       0.050      -0.041       0.173
molecular quadrupole (traceless):
                xx          xy          yy          xz          yz          zz
 q only:        0.525      -0.087       2.270       0.047      -0.564      -2.795
  q+dip:        3.989      -0.342       7.106      -0.145      -2.037     -11.096
   full:        1.475      -0.404       3.844      -0.026      -1.052      -5.320

           -------------------------------------------------
          |                Geometry Summary                 |
           -------------------------------------------------

      molecular mass/u    :      230.3086000
   center of mass at/Å    :       -0.1839490       0.0150738       0.1624968
  moments of inertia/u·Å² :        0.7147045E+03   0.1480363E+04   0.2157986E+04
rotational constants/cm⁻¹ :        0.2358686E-01   0.1138750E-01   0.7811744E-02

 * 32 selected distances

     #   Z        #   Z                                     value/Å
     1   6 C      2   6 C                                 1.4193857
     2   6 C      3   6 C                                 1.4042951
     4   6 C      5   6 C                                 1.3236629
     3   6 C      6   6 C                                 1.4063512
     6   6 C      7   6 C                                 1.4313462
     7   6 C      8   6 C                                 1.3910903
     2   6 C      9   6 C                                 1.4289763
     8   6 C      9   6 C                                 1.3916585
     9   6 C     10   6 C                                 1.4185658
    10   6 C     11   6 C                                 1.3602094
     1   6 C     12   6 C                                 1.3614465
    11   6 C     12   6 C                                 1.4099167
     7   6 C     13   6 C                                 1.4334498 (max)
    13   6 C     14   6 C                                 1.3714760
    14   6 C     15   6 C                                 1.4041949
     6   6 C     16   6 C                                 1.4183677
    15   6 C     16   6 C                                 1.3618478
    17   6 C     18   6 C                                 1.3260589
     1   6 C     19   1 H                                 1.0794293
     4   6 C     20   1 H                                 1.0839974
     5   6 C     21   1 H                                 1.0775880
     5   6 C     22   1 H                                 1.0771399
     8   6 C     23   1 H                                 1.0796396
    10   6 C     24   1 H                                 1.0810199
    11   6 C     25   1 H                                 1.0802394
    12   6 C     26   1 H                                 1.0803809
    14   6 C     27   1 H                                 1.0800017
    15   6 C     28   1 H                                 1.0804018
    16   6 C     29   1 H                                 1.0793664
    17   6 C     30   1 H                                 1.0824146
    18   6 C     31   1 H                                 1.0774046
    18   6 C     32   1 H                                 1.0766827 (min)

 * 2 distinct bonds (by element types)

   Z      Z             #   av. dist./Å        max./Å        min./Å
   1 H    6 C          14     1.0796933     1.0839974     1.0766827
   6 C    6 C          18     1.3923500     1.4334498     1.3236629


optimized geometry written to: xtbopt.xyz


           -------------------------------------------------
          | TOTAL ENERGY              -45.615715455260 Eh   |
          | GRADIENT NORM               0.000520042166 Eh/α |
          | HOMO-LUMO GAP               2.058720747517 eV   |
           -------------------------------------------------

------------------------------------------------------------------------
 * finished run on 2021/05/19 at 11:00:01.549     
------------------------------------------------------------------------
 total:
 * wall-time:     0 d,  0 h,  0 min,  2.563 sec
 *  cpu-time:     0 d,  0 h,  0 min,  1.581 sec
 * ratio c/w:     0.617 speedup
 SCF:
 * wall-time:     0 d,  0 h,  0 min,  0.096 sec
 *  cpu-time:     0 d,  0 h,  0 min,  0.055 sec
 * ratio c/w:     0.573 speedup
 ANC optimizer:
 * wall-time:     0 d,  0 h,  0 min,  2.427 sec
 *  cpu-time:     0 d,  0 h,  0 min,  1.501 sec
 * ratio c/w:     0.619 speedup

