      -----------------------------------------------------------      
     |                   =====================                   |     
     |                           x T B                           |     
     |                   =====================                   |     
     |                         S. Grimme                         |     
     |          Mulliken Center for Theoretical Chemistry        |     
     |                    University of Bonn                     |     
     |                Version 6.2 RC2 (SAW190805)                |     
      -----------------------------------------------------------      

   This program is distributed in the hope that it will be useful,
   but WITHOUT ANY WARRANTY; without even the implied warranty of
   MERCHANTABILITY or FITNESS FOR A PARTICULAR PURPOSE.
   
   FOR NON-COMMERCIAL, ACADEMIA USE ONLY.
   
   Cite this work as:
   * S. Grimme, C. Bannwarth, P. Shushkov, J. Chem. Theory Comput., 2017,
     13, 1989-2009. DOI: 10.1021/acs.jctc.7b00118
   * C. Bannwarth, S. Ehlert and S. Grimme., J. Chem. Theory Comput., 2019,
     15, 1652-1671. DOI: 10.1021/acs.jctc.8b01176
   * P. Pracht, E. Caldeweyher, S. Ehlert, S. Grimme, ChemRxiv, 2019, preprint.
     DOI: 10.26434/chemrxiv.8326202.v1
   
   for DFT-D4:
   * E. Caldeweyher, C. Bannwarth and S. Grimme, J. Chem. Phys., 2017,
     147, 034112. DOI: 10.1063/1.4993215
   * E. Caldeweyher, S. Ehlert, A. Hansen, H. Neugebauer, S. Spicher,
     C. Bannwarth and S. Grimme, J. Chem. Phys., 2019, 150, 154122.
     DOI: 10.1063/1.5090222
   
   for sTDA-xTB:
   * S. Grimme and C. Bannwarth, J. Chem. Phys., 2016, 145, 054103.
     DOI: 10.1063/1.4959605
   
   in the mass-spec context:
   * V. Asgeirsson, C. Bauer and S. Grimme, Chem. Sci., 2017, 8, 4879.
     DOI: 10.1039/c7sc00601b
   
   for metadynamics refer to:
   * S. Grimme, J. Chem. Theory Comput., 2019, 155, 2847-2862
     DOI: 10.1021/acs.jctc.9b00143
   
   with help from (in alphabetical order)
   C. Bannwarth, F. Bohle, G. Brandenburg, E. Caldeweyher, M. Checinski,
   S. Dohm, S. Ehlert, S. Ehrlich, F. März, H. Neugebauer, J. Pisarek,
   P. Pracht, P. Shushkov, and S. Spicher.
   
 * started run on 2021/05/19 at 11:00:16.811     

           -------------------------------------------------
          |                Calculation Setup                |
           -------------------------------------------------

          program call               : /ihome/ghutchison/geoffh/xtb/xtb 459.xyz -opt
          hostname                   : smp-n126
          coordinate file            : 459.xyz
          omp threads                :                     1
          number of atoms            :                    25
          number of electrons        :                    68
          charge                     :                     0
          spin                       :                   0.0
          first test random number   :      0.27650278783531


########################################################################
# WARNING! Please study the warnings concerning your input carefully
#  - the use of '-opt' is discouraged, please use '--opt' next time
########################################################################

           ------------------------------------------------- 
          |                 G F N 2 - x T B                 |
          | Geometry, Frequencies, Noncovalent interactions |
          |            JCTC 2019 parametrisation            |
           ------------------------------------------------- 
             KAB for C  - Si     :                1.0500
             KAB for H  - Pd     :                0.9500
             k(s)              :                1.8500
             k(p)              :                2.2300
             k(d)              :                2.2300
             k(f)              :                2.0000
             kEN (H0ij)        :               -2.0000
             D4 a1             :                0.5200
             D4 a2             :                5.0000
             D4 s6             :                1.0000
             D4 s8             :                2.7000
             D4 s9             :                5.0000
             alphaj            :                2.0000

  Z AO/shell   Hii/eV     exponent
  1     Wed Apr 25 08:07:45 CEST 2018   EN: 2.200 GM2: 0.406  GM3: 0.0800  RAES: 1.40
     1s    -10.707211    1.230000
  6     Wed Apr 25 08:07:45 CEST 2018   EN: 2.550 GM2: 0.538  GM3: 0.1500  RAES: 3.00
     2s    -13.970922    2.096432
     2p    -10.063292    1.800000
  8     Wed Apr 25 08:07:45 CEST 2018   EN: 3.440 GM2: 0.452  GM3:-0.0517  RAES: 1.80
     2s    -20.229985    2.439742
     2p    -15.503117    2.137023
 16     Tue Apr 24 11:44:34 CEST 2018   EN: 2.580 GM2: 0.340  GM3:-0.0502  RAES: 3.10
     3s    -20.029654    1.981333
     3p    -11.377694    2.025643
     3d     -0.420282    1.702555

           ------------------------------------------------- 
          |        Self-Consistent Charge Iterations        |
           ------------------------------------------------- 

          ...................................................
          :                      SETUP                      :
          :.................................................:
          :  # basis functions                  70          :
          :  # atomic orbitals                  69          :
          :  # shells                           39          :
          :  # electrons                        68          :
          :  max. iterations                   250          :
          :  Hamiltonian                  GFN2-xTB          :
          :  restarted?                      false          :
          :  GBSA solvation                  false          :
          :  PC potential                    false          :
          :  electronic temp.          300.0000000     K    :
          :  accuracy                    1.0000000          :
          :  -> integral cutoff          0.2500000E+02      :
          :  -> integral neglect         0.1000000E-07      :
          :  -> SCF convergence          0.1000000E-05 Eh   :
          :  -> wf. convergence          0.1000000E-03 e    :
          :  Broyden damping             0.4000000          :
          ...................................................

 iter      E             dE          RMSdq      gap      omega  full diag
   1    -37.3857814 -0.373858E+02  0.437E+00    2.98       0.0  T
   2    -37.4374031 -0.516217E-01  0.234E+00    2.72       1.0  T
   3    -37.4367199  0.683163E-03  0.142E+00    2.97       1.0  T
   4    -37.4487651 -0.120452E-01  0.299E-01    2.61       1.0  T
   5    -37.4489461 -0.180958E-03  0.180E-01    2.67       1.0  T
   6    -37.4494628 -0.516719E-03  0.722E-02    2.68       1.0  T
   7    -37.4495104 -0.475544E-04  0.227E-02    2.69       1.0  T
   8    -37.4495121 -0.173295E-05  0.139E-02    2.68       1.4  T
   9    -37.4495139 -0.183335E-05  0.534E-03    2.68       3.7  T
  10    -37.4495142 -0.242226E-06  0.237E-03    2.68       8.4  T
  11    -37.4495142 -0.341716E-07  0.110E-03    2.68      18.1  T
  12    -37.4495142 -0.483563E-08  0.572E-04    2.68      35.0  T
  13    -37.4495142 -0.363298E-08  0.236E-04    2.68      84.9  T

   *** convergence criteria satisfied after 13 iterations ***

         #    Occupation            Energy/Eh            Energy/eV
      -------------------------------------------------------------
         1        2.0000           -0.7331411             -19.9498
       ...           ...                  ...                  ...
        28        2.0000           -0.4458156             -12.1313
        29        2.0000           -0.4426814             -12.0460
        30        2.0000           -0.4324508             -11.7676
        31        2.0000           -0.4291478             -11.6777
        32        2.0000           -0.4107994             -11.1784
        33        2.0000           -0.3893896             -10.5958
        34        2.0000           -0.3763988             -10.2423 (HOMO)
        35                         -0.2778468              -7.5606 (LUMO)
        36                         -0.2650749              -7.2131
        37                         -0.2063973              -5.6164
        38                         -0.1970413              -5.3618
        39                         -0.1621215              -4.4115
       ...                                ...                  ...
        69                          0.6653346              18.1047
      -------------------------------------------------------------
                  HL-Gap            0.0985519 Eh            2.6817 eV
             Fermi-level           -0.3271228 Eh           -8.9015 eV

 SCC (total)                   0 d,  0 h,  0 min,  0.040 sec
 SCC setup                      ...        0 min,  0.000 sec (  0.756%)
 Dispersion                     ...        0 min,  0.000 sec (  0.925%)
 integral evaluation            ...        0 min,  0.009 sec ( 22.380%)
 zeroth order Hamiltonian       ...        0 min,  0.000 sec (  0.466%)
 iterations                     ...        0 min,  0.015 sec ( 38.422%)
 molecular gradient             ...        0 min,  0.014 sec ( 36.036%)
 printout                       ...        0 min,  0.000 sec (  0.890%)

         :::::::::::::::::::::::::::::::::::::::::::::::::::::
         ::                     SUMMARY                     ::
         :::::::::::::::::::::::::::::::::::::::::::::::::::::
         :: total energy             -36.940573946536 Eh    ::
         :: gradient norm              0.077830192982 Eh/a0 ::
         :: HOMO-LUMO gap              2.681734951692 eV    ::
         ::.................................................::
         :: SCC energy               -37.449514202805 Eh    ::
         :: -> isotropic ES            0.024253906577 Eh    ::
         :: -> anisotropic ES          0.003356543301 Eh    ::
         :: -> anisotropic XC          0.018039461690 Eh    ::
         :: -> dispersion             -0.025776852138 Eh    ::
         :: repulsion energy           0.508713846488 Eh    ::
         :: add. restraining           0.000000000000 Eh    ::
         :::::::::::::::::::::::::::::::::::::::::::::::::::::

      ----------------------------------------------------------- 
     |                   =====================                   |
     |                        A N C O P T                        |
     |                   =====================                   |
     |               Approximate Normal Coordinate               |
     |                Rational Function Optimizer                |
      ----------------------------------------------------------- 

          ...................................................
          :                      SETUP                      :
          :.................................................:
          :   optimization level            normal          :
          :   max. optcycles                   200          :
          :   ANC micro-cycles                  20          :
          :   degrees of freedom                69          :
          :.................................................:
          :   RF solver                   davidson          :
          :   input Hessian                  false          :
          :   write xtbopt.log                true          :
          :   linear?                        false          :
          :   energy convergence         0.5000000E-05 Eh   :
          :   grad. convergence          0.1000000E-02 Eh/α :
          :   maximium RF displ.         2.0000000          :
          :   Hlow (freq-cutoff)         0.5000000E-02      :
          :   Hmax (freq-cutoff)         5.0000000          :
          :   S6 in model hess.         20.0000000          :
          ...................................................

generating ANC from model Hessian ...
Using Lindh-Hessian (1995)
 Shifting diagonal of input Hessian by   3.607100210988579E-003
 Lowest  eigenvalues of input Hessian
   -0.000000   -0.000000   -0.000000   -0.000000    0.000000    0.000000
    0.005000    0.006318    0.008029    0.008648    0.009620    0.011877
    0.014204    0.015567    0.018880    0.020874    0.023362    0.028821
 Highest eigenvalues
    1.583129    1.655159    1.712335    1.805759    1.976074    2.057634
 

........................................................................
.............................. CYCLE    1 ..............................
........................................................................
   1    -37.4495142 -0.374495E+02  0.683E-05    2.68       0.0  T
   2    -37.4495142 -0.152696E-10  0.431E-05    2.68     463.8  T
   3    -37.4495142 -0.966338E-12  0.353E-05    2.68     567.0  T
     SCC iter.                  ...        0 min,  0.004 sec
     gradient                   ...        0 min,  0.014 sec
 * total energy  :   -36.9405740 Eh     change       -0.2223708E-07 Eh
   gradient norm :     0.0778288 Eh/α   predicted     0.0000000E+00 (-100.00%)
   displ. norm   :     0.2815887 α      lambda       -0.7297202E-02
   maximum displ.:     0.1340580 α      in ANC's #4, #7, #25, ...

........................................................................
.............................. CYCLE    2 ..............................
........................................................................
   1    -37.4762133 -0.374762E+02  0.273E-01    2.92       0.0  T
   2    -37.4762928 -0.795642E-04  0.145E-01    2.87       1.0  T
   3    -37.4762318  0.610204E-04  0.748E-02    2.86       1.0  T
   4    -37.4763230 -0.912186E-04  0.288E-02    2.85       1.0  T
   5    -37.4763282 -0.519262E-05  0.123E-02    2.86       1.6  T
   6    -37.4763294 -0.120880E-05  0.509E-03    2.86       3.9  T
   7    -37.4763298 -0.373935E-06  0.187E-03    2.86      10.7  T
     SCC iter.                  ...        0 min,  0.008 sec
     gradient                   ...        0 min,  0.014 sec
 * total energy  :   -36.9444967 Eh     change       -0.3922689E-02 Eh
   gradient norm :     0.0273134 Eh/α   predicted    -0.3937918E-02 (   0.39%)
   displ. norm   :     0.3116478 α      lambda       -0.3540047E-02
   maximum displ.:     0.1952826 α      in ANC's #6, #13, #4, ...

........................................................................
.............................. CYCLE    3 ..............................
........................................................................
   1    -37.4956088 -0.374956E+02  0.270E-01    3.04       0.0  T
   2    -37.4956865 -0.776966E-04  0.149E-01    3.01       1.0  T
   3    -37.4956231  0.633682E-04  0.765E-02    3.00       1.0  T
   4    -37.4957130 -0.898827E-04  0.283E-02    2.99       1.0  T
   5    -37.4957187 -0.568638E-05  0.117E-02    2.99       1.7  T
   6    -37.4957201 -0.139123E-05  0.451E-03    2.99       4.4  T
   7    -37.4957204 -0.271911E-06  0.179E-03    2.99      11.2  T
     SCC iter.                  ...        0 min,  0.008 sec
     gradient                   ...        0 min,  0.014 sec
 * total energy  :   -36.9449608 Eh     change       -0.4641759E-03 Eh
   gradient norm :     0.0325170 Eh/α   predicted    -0.1941941E-02 ( 318.36%)
   displ. norm   :     0.1496196 α      lambda       -0.1738728E-02
   maximum displ.:     0.0964471 α      in ANC's #4, #7, #5, ...

........................................................................
.............................. CYCLE    4 ..............................
........................................................................
   1    -37.4869317 -0.374869E+02  0.119E-01    2.88       0.0  T
   2    -37.4869425 -0.108479E-04  0.708E-02    2.92       1.0  T
   3    -37.4869251  0.174530E-04  0.363E-02    2.92       1.0  T
   4    -37.4869469 -0.217745E-04  0.106E-02    2.93       1.9  T
   5    -37.4869478 -0.956533E-06  0.474E-03    2.93       4.2  T
   6    -37.4869480 -0.198102E-06  0.200E-03    2.92      10.0  T
     SCC iter.                  ...        0 min,  0.007 sec
     gradient                   ...        0 min,  0.013 sec
 * total energy  :   -36.9460323 Eh     change       -0.1071467E-02 Eh
   gradient norm :     0.0058568 Eh/α   predicted    -0.8888269E-03 ( -17.05%)
   displ. norm   :     0.1948469 α      lambda       -0.4106741E-03
   maximum displ.:     0.1139812 α      in ANC's #4, #6, #7, ...

........................................................................
.............................. CYCLE    5 ..............................
........................................................................
   1    -37.4835651 -0.374836E+02  0.122E-01    2.89       0.0  T
   2    -37.4835676 -0.257065E-05  0.709E-02    2.90       1.0  T
   3    -37.4835627  0.493581E-05  0.190E-02    2.90       1.1  T
   4    -37.4835687 -0.605928E-05  0.678E-03    2.90       3.0  T
   5    -37.4835690 -0.288849E-06  0.274E-03    2.90       7.3  T
   6    -37.4835691 -0.767621E-07  0.108E-03    2.90      18.5  T
     SCC iter.                  ...        0 min,  0.007 sec
     gradient                   ...        0 min,  0.014 sec
 * total energy  :   -36.9463347 Eh     change       -0.3023589E-03 Eh
   gradient norm :     0.0059975 Eh/α   predicted    -0.2131384E-03 ( -29.51%)
   displ. norm   :     0.2776654 α      lambda       -0.3848486E-03
   maximum displ.:     0.1455433 α      in ANC's #4, #6, #7, ...

........................................................................
.............................. CYCLE    6 ..............................
........................................................................
   1    -37.4813784 -0.374814E+02  0.171E-01    2.88       0.0  T
   2    -37.4813821 -0.362282E-05  0.992E-02    2.88       1.0  T
   3    -37.4813771  0.501368E-05  0.203E-02    2.88       1.0  T
   4    -37.4813834 -0.637216E-05  0.885E-03    2.88       2.3  T
   5    -37.4813840 -0.615399E-06  0.268E-03    2.88       7.5  T
   6    -37.4813841 -0.716361E-07  0.132E-03    2.88      15.2  T
     SCC iter.                  ...        0 min,  0.007 sec
     gradient                   ...        0 min,  0.014 sec
 * total energy  :   -36.9465930 Eh     change       -0.2583642E-03 Eh
   gradient norm :     0.0083610 Eh/α   predicted    -0.2072604E-03 ( -19.78%)
   displ. norm   :     0.2525472 α      lambda       -0.2916488E-03
   maximum displ.:     0.1200627 α      in ANC's #3, #6, #4, ...

........................................................................
.............................. CYCLE    7 ..............................
........................................................................
   1    -37.4819086 -0.374819E+02  0.151E-01    2.88       0.0  T
   2    -37.4819120 -0.340847E-05  0.864E-02    2.88       1.0  T
   3    -37.4819112  0.828384E-06  0.141E-02    2.88       1.4  T
   4    -37.4819123 -0.118143E-05  0.872E-03    2.88       2.3  T
   5    -37.4819134 -0.104068E-05  0.198E-03    2.88      10.1  T
   6    -37.4819134 -0.365844E-07  0.970E-04    2.88      20.6  T
     SCC iter.                  ...        0 min,  0.007 sec
     gradient                   ...        0 min,  0.014 sec
 * total energy  :   -36.9467775 Eh     change       -0.1844808E-03 Eh
   gradient norm :     0.0080714 Eh/α   predicted    -0.1551308E-03 ( -15.91%)
   displ. norm   :     0.2381951 α      lambda       -0.3087966E-03
   maximum displ.:     0.1436103 α      in ANC's #3, #6, #2, ...

........................................................................
.............................. CYCLE    8 ..............................
........................................................................
   1    -37.4851708 -0.374852E+02  0.142E-01    2.88       0.0  T
   2    -37.4851738 -0.303713E-05  0.829E-02    2.88       1.0  T
   3    -37.4851715  0.231028E-05  0.164E-02    2.88       1.2  T
   4    -37.4851750 -0.349651E-05  0.754E-03    2.88       2.7  T
   5    -37.4851754 -0.348475E-06  0.280E-03    2.88       7.1  T
   6    -37.4851754 -0.887618E-07  0.127E-03    2.88      15.7  T
     SCC iter.                  ...        0 min,  0.007 sec
     gradient                   ...        0 min,  0.014 sec
 * total energy  :   -36.9469763 Eh     change       -0.1987739E-03 Eh
   gradient norm :     0.0048798 Eh/α   predicted    -0.1631596E-03 ( -17.92%)
   displ. norm   :     0.2771503 α      lambda       -0.2373855E-03
   maximum displ.:     0.1646756 α      in ANC's #3, #2, #6, ...

........................................................................
.............................. CYCLE    9 ..............................
........................................................................
   1    -37.4860225 -0.374860E+02  0.156E-01    2.87       0.0  T
   2    -37.4860261 -0.360763E-05  0.924E-02    2.88       1.0  T
   3    -37.4860267 -0.598376E-06  0.120E-02    2.88       1.7  T
   4    -37.4860276 -0.847334E-06  0.724E-03    2.88       2.8  T
   5    -37.4860281 -0.491633E-06  0.273E-03    2.88       7.3  T
   6    -37.4860281 -0.749823E-07  0.130E-03    2.88      15.4  T
     SCC iter.                  ...        0 min,  0.007 sec
     gradient                   ...        0 min,  0.014 sec
 * total energy  :   -36.9471431 Eh     change       -0.1668711E-03 Eh
   gradient norm :     0.0051768 Eh/α   predicted    -0.1278109E-03 ( -23.41%)
   displ. norm   :     0.2738185 α      lambda       -0.2497400E-03
   maximum displ.:     0.1791409 α      in ANC's #3, #2, #6, ...

........................................................................
.............................. CYCLE   10 ..............................
........................................................................
   1    -37.4883388 -0.374883E+02  0.167E-01    2.86       0.0  T
   2    -37.4883454 -0.659488E-05  0.980E-02    2.87       1.0  T
   3    -37.4883372  0.822670E-05  0.273E-02    2.87       1.0  T
   4    -37.4883480 -0.108772E-04  0.113E-02    2.87       1.8  T
   5    -37.4883490 -0.953136E-06  0.329E-03    2.87       6.1  T
   6    -37.4883491 -0.627582E-07  0.158E-03    2.87      12.6  T
   7    -37.4883491 -0.118749E-07  0.777E-04    2.87      25.8  T
     SCC iter.                  ...        0 min,  0.008 sec
     gradient                   ...        0 min,  0.014 sec
 * total energy  :   -36.9472649 Eh     change       -0.1217778E-03 Eh
   gradient norm :     0.0075704 Eh/α   predicted    -0.1342334E-03 (  10.23%)
   displ. norm   :     0.2296893 α      lambda       -0.1424001E-03
   maximum displ.:     0.1369116 α      in ANC's #2, #3, #6, ...

........................................................................
.............................. CYCLE   11 ..............................
........................................................................
   1    -37.4851039 -0.374851E+02  0.128E-01    2.86       0.0  T
   2    -37.4851067 -0.277750E-05  0.744E-02    2.87       1.0  T
   3    -37.4851068 -0.834903E-07  0.115E-02    2.87       1.7  T
   4    -37.4851076 -0.808031E-06  0.662E-03    2.87       3.0  T
   5    -37.4851078 -0.264470E-06  0.313E-03    2.87       6.4  T
   6    -37.4851080 -0.136049E-06  0.105E-03    2.87      19.0  T
   7    -37.4851080 -0.233995E-08  0.486E-04    2.87      41.1  T
     SCC iter.                  ...        0 min,  0.008 sec
     gradient                   ...        0 min,  0.014 sec
 * total energy  :   -36.9473149 Eh     change       -0.4993772E-04 Eh
   gradient norm :     0.0065069 Eh/α   predicted    -0.7495673E-04 (  50.10%)
   displ. norm   :     0.0704616 α      lambda       -0.1046307E-03
   maximum displ.:     0.0350981 α      in ANC's #4, #6, #8, ...

........................................................................
.............................. CYCLE   12 ..............................
........................................................................
   1    -37.4876956 -0.374877E+02  0.418E-02    2.90       0.0  T
   2    -37.4876970 -0.140293E-05  0.247E-02    2.89       1.0  T
   3    -37.4876965  0.517692E-06  0.781E-03    2.89       2.6  T
   4    -37.4876972 -0.764471E-06  0.244E-03    2.89       8.2  T
   5    -37.4876973 -0.456333E-07  0.128E-03    2.89      15.6  T
     SCC iter.                  ...        0 min,  0.006 sec
     gradient                   ...        0 min,  0.014 sec
 * total energy  :   -36.9473390 Eh     change       -0.2415658E-04 Eh
   gradient norm :     0.0058142 Eh/α   predicted    -0.5257865E-04 ( 117.66%)
   displ. norm   :     0.0716776 α      lambda       -0.7213522E-04
   maximum displ.:     0.0447230 α      in ANC's #8, #3, #7, ...

........................................................................
.............................. CYCLE   13 ..............................
........................................................................
   1    -37.4862293 -0.374862E+02  0.589E-02    2.85       0.0  T
   2    -37.4862312 -0.189295E-05  0.356E-02    2.86       1.0  T
   3    -37.4862310  0.208035E-06  0.854E-03    2.86       2.3  T
   4    -37.4862319 -0.895183E-06  0.349E-03    2.87       5.7  T
   5    -37.4862320 -0.628965E-07  0.186E-03    2.86      10.7  T
   6    -37.4862320 -0.352952E-07  0.824E-04    2.86      24.3  T
     SCC iter.                  ...        0 min,  0.007 sec
     gradient                   ...        0 min,  0.014 sec
 * total energy  :   -36.9473703 Eh     change       -0.3127110E-04 Eh
   gradient norm :     0.0046124 Eh/α   predicted    -0.3626512E-04 (  15.97%)
   displ. norm   :     0.0405945 α      lambda       -0.2806351E-04
   maximum displ.:     0.0252063 α      in ANC's #2, #8, #10, ...

........................................................................
.............................. CYCLE   14 ..............................
........................................................................
   1    -37.4866013 -0.374866E+02  0.246E-02    2.87       0.0  T
   2    -37.4866016 -0.252356E-06  0.140E-02    2.87       1.4  T
   3    -37.4866015  0.694532E-07  0.384E-03    2.87       5.2  T
   4    -37.4866016 -0.123423E-06  0.194E-03    2.87      10.3  T
   5    -37.4866017 -0.303250E-07  0.771E-04    2.87      25.9  T
     SCC iter.                  ...        0 min,  0.006 sec
     gradient                   ...        0 min,  0.014 sec
 * total energy  :   -36.9473864 Eh     change       -0.1611187E-04 Eh
   gradient norm :     0.0030311 Eh/α   predicted    -0.1405544E-04 ( -12.76%)
   displ. norm   :     0.0544637 α      lambda       -0.1919877E-04
   maximum displ.:     0.0357331 α      in ANC's #2, #8, #7, ...

........................................................................
.............................. CYCLE   15 ..............................
........................................................................
   1    -37.4864280 -0.374864E+02  0.365E-02    2.87       0.0  T
   2    -37.4864284 -0.377936E-06  0.217E-02    2.87       1.0  T
   3    -37.4864283  0.592556E-07  0.459E-03    2.87       4.4  T
   4    -37.4864286 -0.237983E-06  0.220E-03    2.87       9.1  T
   5    -37.4864286 -0.249470E-07  0.984E-04    2.87      20.3  T
   6    -37.4864286 -0.928011E-08  0.434E-04    2.87      46.1  T
     SCC iter.                  ...        0 min,  0.007 sec
     gradient                   ...        0 min,  0.014 sec
 * total energy  :   -36.9474006 Eh     change       -0.1416598E-04 Eh
   gradient norm :     0.0018735 Eh/α   predicted    -0.9629415E-05 ( -32.02%)
   displ. norm   :     0.1956958 α      lambda       -0.4399827E-04
   maximum displ.:     0.0999573 α      in ANC's #7, #8, #2, ...

........................................................................
.............................. CYCLE   16 ..............................
........................................................................
   1    -37.4860398 -0.374860E+02  0.133E-01    2.85       0.0  T
   2    -37.4860455 -0.577410E-05  0.816E-02    2.86       1.0  T
   3    -37.4860462 -0.637437E-06  0.151E-02    2.86       1.3  T
   4    -37.4860489 -0.270139E-05  0.816E-03    2.86       2.5  T
   5    -37.4860494 -0.551572E-06  0.349E-03    2.86       5.7  T
   6    -37.4860495 -0.539469E-07  0.167E-03    2.86      12.0  T
   7    -37.4860495 -0.277699E-07  0.801E-04    2.86      25.0  T
   8    -37.4860495 -0.406293E-08  0.294E-04    2.86      68.1  T
     SCC iter.                  ...        0 min,  0.009 sec
     gradient                   ...        0 min,  0.014 sec
 * total energy  :   -36.9474312 Eh     change       -0.3067009E-04 Eh
   gradient norm :     0.0051879 Eh/α   predicted    -0.2237703E-04 ( -27.04%)
   displ. norm   :     0.0911731 α      lambda       -0.4985564E-04
   maximum displ.:     0.0462943 α      in ANC's #1, #3, #8, ...

........................................................................
.............................. CYCLE   17 ..............................
........................................................................
   1    -37.4866522 -0.374867E+02  0.572E-02    2.86       0.0  T
   2    -37.4866531 -0.978434E-06  0.340E-02    2.86       1.0  T
   3    -37.4866528  0.356710E-06  0.853E-03    2.86       2.3  T
   4    -37.4866536 -0.842415E-06  0.432E-03    2.86       4.6  T
   5    -37.4866538 -0.141178E-06  0.130E-03    2.86      15.4  T
   6    -37.4866538 -0.125694E-07  0.620E-04    2.86      32.3  T
     SCC iter.                  ...        0 min,  0.007 sec
     gradient                   ...        0 min,  0.014 sec
 * total energy  :   -36.9474664 Eh     change       -0.3513001E-04 Eh
   gradient norm :     0.0031189 Eh/α   predicted    -0.2515449E-04 ( -28.40%)
   displ. norm   :     0.1754373 α      lambda       -0.6421391E-04
   maximum displ.:     0.0872945 α      in ANC's #1, #3, #8, ...

........................................................................
.............................. CYCLE   18 ..............................
........................................................................
   1    -37.4860547 -0.374861E+02  0.106E-01    2.83       0.0  T
   2    -37.4860581 -0.343201E-05  0.653E-02    2.84       1.0  T
   3    -37.4860584 -0.267760E-06  0.121E-02    2.84       1.7  T
   4    -37.4860606 -0.218638E-05  0.576E-03    2.84       3.5  T
   5    -37.4860607 -0.144626E-06  0.256E-03    2.84       7.8  T
   6    -37.4860608 -0.595063E-07  0.103E-03    2.84      19.4  T
   7    -37.4860608 -0.157784E-08  0.499E-04    2.84      40.1  T
   8    -37.4860608 -0.376251E-08  0.146E-04    2.84     136.6  T
     SCC iter.                  ...        0 min,  0.009 sec
     gradient                   ...        0 min,  0.014 sec
 * total energy  :   -36.9475137 Eh     change       -0.4736318E-04 Eh
   gradient norm :     0.0043252 Eh/α   predicted    -0.3309876E-04 ( -30.12%)
   displ. norm   :     0.2094920 α      lambda       -0.7586947E-04
   maximum displ.:     0.1177601 α      in ANC's #1, #3, #4, ...

........................................................................
.............................. CYCLE   19 ..............................
........................................................................
   1    -37.4865136 -0.374865E+02  0.116E-01    2.83       0.0  T
   2    -37.4865175 -0.385309E-05  0.698E-02    2.83       1.0  T
   3    -37.4865125  0.496467E-05  0.198E-02    2.83       1.0  T
   4    -37.4865201 -0.760100E-05  0.711E-03    2.83       2.8  T
   5    -37.4865203 -0.212539E-06  0.315E-03    2.83       6.4  T
   6    -37.4865204 -0.887953E-07  0.148E-03    2.83      13.5  T
   7    -37.4865204 -0.141164E-07  0.727E-04    2.83      27.5  T
     SCC iter.                  ...        0 min,  0.008 sec
     gradient                   ...        0 min,  0.014 sec
 * total energy  :   -36.9475510 Eh     change       -0.3724265E-04 Eh
   gradient norm :     0.0030575 Eh/α   predicted    -0.3960387E-04 (   6.34%)
   displ. norm   :     0.1371692 α      lambda       -0.3205653E-04
   maximum displ.:     0.0719299 α      in ANC's #1, #8, #7, ...

........................................................................
.............................. CYCLE   20 ..............................
........................................................................
   1    -37.4851039 -0.374851E+02  0.868E-02    2.80       0.0  T
   2    -37.4851067 -0.272291E-05  0.535E-02    2.81       1.0  T
   3    -37.4851061  0.510246E-06  0.114E-02    2.81       1.7  T
   4    -37.4851084 -0.221745E-05  0.481E-03    2.81       4.2  T
   5    -37.4851085 -0.122266E-06  0.255E-03    2.81       7.9  T
   6    -37.4851085 -0.502263E-07  0.992E-04    2.81      20.2  T
   7    -37.4851085 -0.272098E-08  0.432E-04    2.81      46.3  T
     SCC iter.                  ...        0 min,  0.021 sec
     gradient                   ...        0 min,  0.027 sec
 * total energy  :   -36.9475531 Eh     change       -0.2096148E-05 Eh
   gradient norm :     0.0079370 Eh/α   predicted    -0.1633578E-04 ( 679.32%)
   displ. norm   :     0.0547917 α      lambda       -0.6139049E-04
   maximum displ.:     0.0282667 α      in ANC's #3, #7, #9, ...
 * RMSD in coord.:     0.4502881 α      energy gain  -0.6979126E-02 Eh

generating ANC from model Hessian ...
Using Lindh-Hessian (1995)
 Shifting diagonal of input Hessian by   3.404506681186005E-003
 Lowest  eigenvalues of input Hessian
   -0.000000   -0.000000   -0.000000    0.000000    0.000000    0.000000
    0.005000    0.006546    0.008041    0.008481    0.010023    0.012341
    0.014357    0.017212    0.019691    0.021427    0.023052    0.028936
 Highest eigenvalues
    1.615704    1.678154    1.786044    1.873730    2.025797    2.203634
 

........................................................................
.............................. CYCLE   21 ..............................
........................................................................
   1    -37.4870089 -0.374870E+02  0.344E-02    2.84       0.0  T
   2    -37.4870102 -0.134401E-05  0.207E-02    2.83       1.0  T
   3    -37.4870092  0.985510E-06  0.916E-03    2.83       2.2  T
   4    -37.4870105 -0.129062E-05  0.327E-03    2.83       6.1  T
   5    -37.4870106 -0.127859E-06  0.142E-03    2.83      14.1  T
   6    -37.4870107 -0.112258E-07  0.712E-04    2.83      28.1  T
   7    -37.4870107 -0.288894E-08  0.357E-04    2.83      56.1  T
     SCC iter.                  ...        0 min,  0.021 sec
     gradient                   ...        0 min,  0.027 sec
 * total energy  :   -36.9475805 Eh     change       -0.2743309E-04 Eh
   gradient norm :     0.0020906 Eh/α   predicted     0.0000000E+00 (-100.00%)
   displ. norm   :     0.0397335 α      lambda       -0.2279444E-04
   maximum displ.:     0.0280720 α      in ANC's #2, #4, #8, ...

........................................................................
.............................. CYCLE   22 ..............................
........................................................................
   1    -37.4870303 -0.374870E+02  0.304E-02    2.83       0.0  T
   2    -37.4870306 -0.319648E-06  0.169E-02    2.83       1.2  T
   3    -37.4870304  0.193993E-06  0.533E-03    2.83       3.8  T
   4    -37.4870307 -0.312205E-06  0.277E-03    2.83       7.2  T
   5    -37.4870308 -0.507934E-07  0.688E-04    2.83      29.1  T
   6    -37.4870308 -0.485985E-08  0.313E-04    2.83      63.9  T
     SCC iter.                  ...        0 min,  0.007 sec
     gradient                   ...        0 min,  0.027 sec
 * total energy  :   -36.9475965 Eh     change       -0.1598050E-04 Eh
   gradient norm :     0.0009154 Eh/α   predicted    -0.1141568E-04 ( -28.56%)
   displ. norm   :     0.0899234 α      lambda       -0.2484727E-04
   maximum displ.:     0.0438387 α      in ANC's #8, #2, #7, ...

........................................................................
.............................. CYCLE   23 ..............................
........................................................................
   1    -37.4868532 -0.374869E+02  0.547E-02    2.83       0.0  T
   2    -37.4868541 -0.947249E-06  0.326E-02    2.83       1.0  T
   3    -37.4868542 -0.103016E-06  0.678E-03    2.83       3.0  T
   4    -37.4868546 -0.335152E-06  0.404E-03    2.83       5.0  T
   5    -37.4868547 -0.148959E-06  0.131E-03    2.83      15.3  T
   6    -37.4868547 -0.985459E-08  0.681E-04    2.83      29.3  T
   7    -37.4868547 -0.356275E-08  0.355E-04    2.83      56.4  T
     SCC iter.                  ...        0 min,  0.021 sec
     gradient                   ...        0 min,  0.027 sec
 * total energy  :   -36.9476127 Eh     change       -0.1616597E-04 Eh
   gradient norm :     0.0029621 Eh/α   predicted    -0.1247021E-04 ( -22.86%)
   displ. norm   :     0.0693972 α      lambda       -0.2690825E-04
   maximum displ.:     0.0362094 α      in ANC's #2, #8, #4, ...

........................................................................
.............................. CYCLE   24 ..............................
........................................................................
   1    -37.4865575 -0.374866E+02  0.507E-02    2.82       0.0  T
   2    -37.4865585 -0.927542E-06  0.312E-02    2.82       1.0  T
   3    -37.4865589 -0.465156E-06  0.450E-03    2.82       4.4  T
   4    -37.4865590 -0.996736E-07  0.275E-03    2.82       7.3  T
   5    -37.4865591 -0.470992E-07  0.146E-03    2.82      13.7  T
   6    -37.4865591 -0.233554E-07  0.521E-04    2.82      38.4  T
   7    -37.4865591 -0.989651E-09  0.234E-04    2.82      85.5  T
     SCC iter.                  ...        0 min,  0.008 sec
     gradient                   ...        0 min,  0.027 sec
 * total energy  :   -36.9476344 Eh     change       -0.2177368E-04 Eh
   gradient norm :     0.0028088 Eh/α   predicted    -0.1351936E-04 ( -37.91%)
   displ. norm   :     0.1752313 α      lambda       -0.5352892E-04
   maximum displ.:     0.0933833 α      in ANC's #8, #2, #7, ...

........................................................................
.............................. CYCLE   25 ..............................
........................................................................
   1    -37.4856945 -0.374857E+02  0.130E-01    2.80       0.0  T
   2    -37.4857011 -0.652916E-05  0.788E-02    2.80       1.0  T
   3    -37.4857027 -0.161108E-05  0.151E-02    2.81       1.3  T
   4    -37.4857045 -0.187405E-05  0.840E-03    2.81       2.4  T
   5    -37.4857051 -0.547864E-06  0.375E-03    2.81       5.3  T
   6    -37.4857052 -0.152294E-06  0.147E-03    2.81      13.7  T
   7    -37.4857053 -0.609818E-08  0.678E-04    2.81      29.5  T
   8    -37.4857053 -0.280973E-08  0.237E-04    2.81      84.5  T
     SCC iter.                  ...        0 min,  0.022 sec
     gradient                   ...        0 min,  0.027 sec
 * total energy  :   -36.9476598 Eh     change       -0.2536421E-04 Eh
   gradient norm :     0.0061800 Eh/α   predicted    -0.2759386E-04 (   8.79%)
   displ. norm   :     0.0154299 α      lambda       -0.2568476E-04
   maximum displ.:     0.0081232 α      in ANC's #4, #5, #6, ...

........................................................................
.............................. CYCLE   26 ..............................
........................................................................
   1    -37.4867493 -0.374867E+02  0.133E-02    2.82       0.0  T
   2    -37.4867496 -0.347837E-06  0.714E-03    2.81       2.8  T
   3    -37.4867495  0.120321E-06  0.387E-03    2.81       5.2  T
   4    -37.4867497 -0.191746E-06  0.136E-03    2.81      14.7  T
   5    -37.4867497 -0.118292E-07  0.598E-04    2.81      33.4  T
     SCC iter.                  ...        0 min,  0.006 sec
     gradient                   ...        0 min,  0.027 sec
 * total energy  :   -36.9476758 Eh     change       -0.1597095E-04 Eh
   gradient norm :     0.0021280 Eh/α   predicted    -0.1284779E-04 ( -19.56%)
   displ. norm   :     0.0712711 α      lambda       -0.1672942E-04
   maximum displ.:     0.0409177 α      in ANC's #8, #2, #6, ...

........................................................................
.............................. CYCLE   27 ..............................
........................................................................
   1    -37.4870255 -0.374870E+02  0.529E-02    2.81       0.0  T
   2    -37.4870266 -0.104495E-05  0.324E-02    2.81       1.0  T
   3    -37.4870255  0.104676E-05  0.969E-03    2.81       2.1  T
   4    -37.4870273 -0.182868E-05  0.331E-03    2.81       6.0  T
   5    -37.4870274 -0.342572E-07  0.150E-03    2.81      13.3  T
   6    -37.4870274 -0.192349E-07  0.656E-04    2.81      30.5  T
   7    -37.4870274 -0.283496E-08  0.332E-04    2.81      60.3  T
     SCC iter.                  ...        0 min,  0.008 sec
     gradient                   ...        0 min,  0.040 sec
 * total energy  :   -36.9476886 Eh     change       -0.1280581E-04 Eh
   gradient norm :     0.0016112 Eh/α   predicted    -0.8417991E-05 ( -34.26%)
   displ. norm   :     0.1531356 α      lambda       -0.1919678E-04
   maximum displ.:     0.0937538 α      in ANC's #8, #7, #2, ...

........................................................................
.............................. CYCLE   28 ..............................
........................................................................
   1    -37.4866570 -0.374867E+02  0.117E-01    2.79       0.0  T
   2    -37.4866623 -0.535345E-05  0.722E-02    2.80       1.0  T
   3    -37.4866583  0.408144E-05  0.202E-02    2.80       1.0  T
   4    -37.4866662 -0.794672E-05  0.709E-03    2.80       2.8  T
   5    -37.4866664 -0.172665E-06  0.362E-03    2.80       5.5  T
   6    -37.4866665 -0.114085E-06  0.149E-03    2.80      13.4  T
   7    -37.4866665 -0.102914E-07  0.796E-04    2.80      25.1  T
   8    -37.4866665 -0.515615E-08  0.260E-04    2.80      76.9  T
     SCC iter.                  ...        0 min,  0.022 sec
     gradient                   ...        0 min,  0.027 sec
 * total energy  :   -36.9476998 Eh     change       -0.1127192E-04 Eh
   gradient norm :     0.0033257 Eh/α   predicted    -0.9698829E-05 ( -13.96%)
   displ. norm   :     0.0309776 α      lambda       -0.1561860E-04
   maximum displ.:     0.0156969 α      in ANC's #2, #4, #3, ...

........................................................................
.............................. CYCLE   29 ..............................
........................................................................
   1    -37.4874121 -0.374874E+02  0.197E-02    2.81       0.0  T
   2    -37.4874124 -0.343262E-06  0.112E-02    2.81       1.8  T
   3    -37.4874124  0.699513E-07  0.341E-03    2.81       5.9  T
   4    -37.4874125 -0.129734E-06  0.144E-03    2.81      13.9  T
   5    -37.4874125 -0.101991E-07  0.824E-04    2.81      24.3  T
   6    -37.4874125 -0.844813E-08  0.291E-04    2.81      68.6  T
     SCC iter.                  ...        0 min,  0.007 sec
     gradient                   ...        0 min,  0.027 sec
 * total energy  :   -36.9477060 Eh     change       -0.6131627E-05 Eh
   gradient norm :     0.0018491 Eh/α   predicted    -0.7818064E-05 (  27.50%)
   displ. norm   :     0.0323784 α      lambda       -0.8080146E-05
   maximum displ.:     0.0168943 α      in ANC's #7, #5, #8, ...

........................................................................
.............................. CYCLE   30 ..............................
........................................................................
   1    -37.4871144 -0.374871E+02  0.272E-02    2.80       0.0  T
   2    -37.4871147 -0.328608E-06  0.163E-02    2.80       1.2  T
   3    -37.4871148 -0.865945E-07  0.338E-03    2.80       5.9  T
   4    -37.4871148 -0.504362E-07  0.205E-03    2.80       9.8  T
   5    -37.4871149 -0.329899E-07  0.847E-04    2.80      23.6  T
   6    -37.4871149 -0.791176E-08  0.340E-04    2.80      58.8  T
     SCC iter.                  ...        0 min,  0.020 sec
     gradient                   ...        0 min,  0.027 sec
 * total energy  :   -36.9477130 Eh     change       -0.7007071E-05 Eh
   gradient norm :     0.0006508 Eh/α   predicted    -0.4043465E-05 ( -42.29%)
   displ. norm   :     0.0699065 α      lambda       -0.7031788E-05
   maximum displ.:     0.0416146 α      in ANC's #8, #7, #5, ...

........................................................................
.............................. CYCLE   31 ..............................
........................................................................
   1    -37.4867041 -0.374867E+02  0.541E-02    2.79       0.0  T
   2    -37.4867052 -0.111981E-05  0.334E-02    2.80       1.0  T
   3    -37.4867054 -0.232193E-06  0.606E-03    2.80       3.3  T
   4    -37.4867059 -0.446515E-06  0.325E-03    2.80       6.1  T
   5    -37.4867060 -0.888811E-07  0.146E-03    2.80      13.7  T
   6    -37.4867060 -0.165589E-07  0.584E-04    2.80      34.2  T
   7    -37.4867060 -0.985821E-09  0.322E-04    2.80      62.1  T
     SCC iter.                  ...        0 min,  0.008 sec
     gradient                   ...        0 min,  0.027 sec
 * total energy  :   -36.9477178 Eh     change       -0.4776964E-05 Eh
   gradient norm :     0.0018963 Eh/α   predicted    -0.3527582E-05 ( -26.15%)
   displ. norm   :     0.0384200 α      lambda       -0.4288961E-05
   maximum displ.:     0.0222386 α      in ANC's #4, #2, #7, ...

........................................................................
.............................. CYCLE   32 ..............................
........................................................................
   1    -37.4870519 -0.374871E+02  0.225E-02    2.80       0.0  T
   2    -37.4870521 -0.183962E-06  0.130E-02    2.80       1.5  T
   3    -37.4870521  0.250951E-07  0.282E-03    2.80       7.1  T
   4    -37.4870521 -0.631307E-07  0.151E-03    2.80      13.2  T
   5    -37.4870521 -0.215288E-07  0.595E-04    2.80      33.6  T
   6    -37.4870521 -0.398359E-08  0.229E-04    2.80      87.3  T
     SCC iter.                  ...        0 min,  0.020 sec
     gradient                   ...        0 min,  0.027 sec
 * total energy  :   -36.9477212 Eh     change       -0.3463695E-05 Eh
   gradient norm :     0.0004264 Eh/α   predicted    -0.2146673E-05 ( -38.02%)
   displ. norm   :     0.0255744 α      lambda       -0.8757708E-06
   maximum displ.:     0.0144394 α      in ANC's #8, #7, #4, ...

   *** GEOMETRY OPTIMIZATION CONVERGED AFTER 32 ITERATIONS ***

------------------------------------------------------------------------
 total energy gain   :        -0.0071473 Eh       -4.4850 kcal/mol
 total RMSD          :         0.4907766 a0        0.2597 Å
 total power (kW/mol):        -0.5864112 (step)  -13.1156 (real)
------------------------------------------------------------------------

 ANCopt (total)                0 d,  0 h,  0 min,  1.431 sec
 optimizer setup                ...        0 min,  0.000 sec (  0.010%)
 model hessian                  ...        0 min,  0.019 sec (  1.359%)
 ANC generation                 ...        0 min,  0.014 sec (  1.007%)
 coordinate transformation      ...        0 min,  0.001 sec (  0.042%)
 single point calculation       ...        0 min,  1.383 sec ( 96.665%)
 optimization log               ...        0 min,  0.003 sec (  0.219%)
 hessian update                 ...        0 min,  0.000 sec (  0.027%)
 rational function              ...        0 min,  0.008 sec (  0.541%)

================
 final structure:
================
$coord
    2.82441713817801   -2.43536903332250    0.05744001633709      C 
    5.13398957160399   -0.16706045846199    0.27964265845423      S 
    2.88443680105644    2.23453605878079    0.23368152454833      C 
    0.48757898589724    1.24267064060932    0.03797052649668      C 
    0.45868976218727   -1.43737039100542   -0.05267832217678      C 
   -1.92580648228570   -2.93115110693737   -0.32870910037848      C 
   -4.18492100402445   -1.39188057284382    0.58887143955377      C 
   -4.20643634085467    1.19009303422587   -0.69364455860298      C 
   -1.89524896302238    2.79600514570034    0.01199276030203      C 
   -2.16248484923288    3.89192802093815    2.63326506698828      C 
   -1.87347963119442    6.07394402659544    3.16693292419906      O 
    3.61002183172575    4.85119576839515    0.37138252270373      C 
    5.97883030738537    5.66268908828392    0.58605998829521      C 
    3.35246834858762   -4.39065222202519    0.00973443881226      H 
   -1.77474038553209   -4.70465240047401    0.71465779251713      H 
   -2.18816135308674   -3.40708723691992   -2.32556807472281      H 
   -4.08579690710226   -1.17174751429122    2.63666814882343      H 
   -5.93366441759070   -2.39393752613616    0.15046565705207      H 
   -5.92006227974689    2.22432869994595   -0.18951783924397      H 
   -4.21362908236222    0.91760715353662   -2.74024424690642      H 
   -1.70361075158288    4.36647407496958   -1.32224804720296      H 
   -2.60856483396484    2.47429004182620    4.10327385396638      H 
    2.07121101169633    6.19360043095565    0.31319370636168      H 
    7.54560750705451    4.36406801842098    0.67353637724496      H 
    6.41877603399441    7.64366263420087    0.68737136912811      H 
$end
           -------------------------------------------------
          |                Final Singlepoint                |
           -------------------------------------------------

          ...................................................
          :                      SETUP                      :
          :.................................................:
          :  # basis functions                  70          :
          :  # atomic orbitals                  69          :
          :  # shells                           39          :
          :  # electrons                        68          :
          :  max. iterations                   250          :
          :  Hamiltonian                  GFN2-xTB          :
          :  restarted?                      false          :
          :  GBSA solvation                  false          :
          :  PC potential                    false          :
          :  electronic temp.          300.0000000     K    :
          :  accuracy                    1.0000000          :
          :  -> integral cutoff          0.2500000E+02      :
          :  -> integral neglect         0.1000000E-07      :
          :  -> SCF convergence          0.1000000E-05 Eh   :
          :  -> wf. convergence          0.1000000E-03 e    :
          :  Broyden damping             0.4000000          :
          ...................................................

 iter      E             dE          RMSdq      gap      omega  full diag
   1    -37.4870521 -0.374871E+02  0.813E-05    2.80       0.0  T
   2    -37.4870521 -0.311644E-10  0.534E-05    2.80     374.8  T
   3    -37.4870521 -0.467963E-10  0.293E-05    2.80     681.5  T

   *** convergence criteria satisfied after 3 iterations ***

         #    Occupation            Energy/Eh            Energy/eV
      -------------------------------------------------------------
         1        2.0000           -0.7302807             -19.8719
       ...           ...                  ...                  ...
        28        2.0000           -0.4436867             -12.0733
        29        2.0000           -0.4409176             -11.9980
        30        2.0000           -0.4329360             -11.7808
        31        2.0000           -0.4297417             -11.6939
        32        2.0000           -0.4105103             -11.1706
        33        2.0000           -0.3890807             -10.5874
        34        2.0000           -0.3748654             -10.2006 (HOMO)
        35                         -0.2720722              -7.4035 (LUMO)
        36                         -0.2609794              -7.1016
        37                         -0.2025422              -5.5115
        38                         -0.1952235              -5.3123
        39                         -0.1488784              -4.0512
       ...                                ...                  ...
        69                          0.6731660              18.3178
      -------------------------------------------------------------
                  HL-Gap            0.1027932 Eh            2.7971 eV
             Fermi-level           -0.3234688 Eh           -8.8020 eV

 SCC (total)                   0 d,  0 h,  0 min,  0.054 sec
 SCC setup                      ...        0 min,  0.000 sec (  0.347%)
 Dispersion                     ...        0 min,  0.000 sec (  0.382%)
 integral evaluation            ...        0 min,  0.009 sec ( 15.892%)
 zeroth order Hamiltonian       ...        0 min,  0.000 sec (  0.299%)
 iterations                     ...        0 min,  0.017 sec ( 31.779%)
 molecular gradient             ...        0 min,  0.027 sec ( 50.587%)
 printout                       ...        0 min,  0.000 sec (  0.633%)

         :::::::::::::::::::::::::::::::::::::::::::::::::::::
         ::                     SUMMARY                     ::
         :::::::::::::::::::::::::::::::::::::::::::::::::::::
         :: total energy             -36.947721243809 Eh    ::
         :: gradient norm              0.000426672988 Eh/a0 ::
         :: HOMO-LUMO gap              2.797145682435 eV    ::
         ::.................................................::
         :: SCC energy               -37.487052143505 Eh    ::
         :: -> isotropic ES            0.023352928173 Eh    ::
         :: -> anisotropic ES          0.002653601315 Eh    ::
         :: -> anisotropic XC          0.017239556292 Eh    ::
         :: -> dispersion             -0.026330238850 Eh    ::
         :: repulsion energy           0.539114626033 Eh    ::
         :: add. restraining           0.000000000000 Eh    ::
         :::::::::::::::::::::::::::::::::::::::::::::::::::::

           -------------------------------------------------
          |                Property Printout                |
           -------------------------------------------------

    * Orbital Energies and Occupations

         #    Occupation            Energy/Eh            Energy/eV
      -------------------------------------------------------------
         1        2.0000           -0.7302807             -19.8719
       ...           ...                  ...                  ...
        22        2.0000           -0.4843385             -13.1795
        23        2.0000           -0.4781381             -13.0108
        24        2.0000           -0.4750132             -12.9258
        25        2.0000           -0.4711322             -12.8202
        26        2.0000           -0.4574967             -12.4491
        27        2.0000           -0.4539832             -12.3535
        28        2.0000           -0.4436867             -12.0733
        29        2.0000           -0.4409176             -11.9980
        30        2.0000           -0.4329360             -11.7808
        31        2.0000           -0.4297417             -11.6939
        32        2.0000           -0.4105103             -11.1706
        33        2.0000           -0.3890807             -10.5874
        34        2.0000           -0.3748654             -10.2006 (HOMO)
        35                         -0.2720722              -7.4035 (LUMO)
        36                         -0.2609794              -7.1016
        37                         -0.2025422              -5.5115
        38                         -0.1952235              -5.3123
        39                         -0.1488784              -4.0512
        40                         -0.1191710              -3.2428
        41                         -0.0058534              -0.1593
        42                          0.0315951               0.8597
        43                          0.0352501               0.9592
        44                          0.0732395               1.9929
        45                          0.0784630               2.1351
       ...                                ...                  ...
        69                          0.6731660              18.3178
      -------------------------------------------------------------
                  HL-Gap            0.1027932 Eh            2.7971 eV
             Fermi-level           -0.3234688 Eh           -8.8020 eV

     #   Z        covCN         q      C6AA      α(0)
     1   6 C      2.941    -0.035    28.863     8.811
     2  16 S      2.313    -0.036   142.548    20.095
     3   6 C      2.987     0.013    27.704     8.634
     4   6 C      3.175    -0.017    28.034     8.647
     5   6 C      3.151    -0.007    27.902     8.640
     6   6 C      3.808    -0.057    21.583     6.613
     7   6 C      3.806    -0.054    21.543     6.607
     8   6 C      3.808    -0.055    21.555     6.609
     9   6 C      3.856    -0.035    21.158     6.542
    10   6 C      2.771     0.218    23.397     7.922
    11   8 O      0.856    -0.325    20.239     6.032
    12   6 C      2.918    -0.033    28.831     8.805
    13   6 C      2.841    -0.085    30.112     8.993
    14   1 H      0.926     0.043     2.411     2.428
    15   1 H      0.924     0.040     2.452     2.449
    16   1 H      0.924     0.045     2.386     2.416
    17   1 H      0.924     0.036     2.497     2.471
    18   1 H      0.924     0.037     2.493     2.469
    19   1 H      0.924     0.035     2.511     2.478
    20   1 H      0.924     0.047     2.362     2.404
    21   1 H      0.924     0.058     2.219     2.330
    22   1 H      0.922     0.020     2.738     2.588
    23   1 H      0.926     0.053     2.281     2.362
    24   1 H      0.926     0.048     2.346     2.395
    25   1 H      0.926     0.045     2.385     2.415

 Mol. C6AA /au·bohr⁶  :       8165.328594
 Mol. C8AA /au·bohr⁸  :     217019.883409
 Mol. α(0) /au        :        142.152977


Wiberg/Mayer (AO) data.
largest (>0.10) Wiberg bond orders for each atom
          total WBO             WBO to atom ...
     1  C   3.945        C    5 1.584    S    2 1.188    H   14 0.970
     2  S   2.616        C    1 1.188    C    3 1.133
     3  C   3.951        C    4 1.492    C   12 1.137    S    2 1.133
     4  C   3.979        C    3 1.492    C    5 1.242    C    9 0.969
     5  C   3.985        C    1 1.584    C    4 1.242    C    6 1.008
     6  C   3.998        C    5 1.008    C    7 1.005    H   15 0.971    H   16 0.960
     7  C   3.998        C    8 1.010    C    6 1.005    H   18 0.976    H   17 0.975
     8  C   3.995        C    7 1.010    C    9 0.977    H   19 0.976    H   20 0.974
     9  C   3.994        C    8 0.977    C   10 0.975    C    4 0.969    H   21 0.955
    10  C   3.910        O   11 1.922    C    9 0.975    H   22 0.929
    11  O   2.097        C   10 1.922
    12  C   3.991        C   13 1.866    C    3 1.137    H   23 0.955
    13  C   3.991        C   12 1.866    H   25 0.978    H   24 0.971
    14  H   0.997        C    1 0.970
    15  H   0.998        C    6 0.971
    16  H   0.998        C    6 0.960
    17  H   0.999        C    7 0.975
    18  H   0.998        C    7 0.976
    19  H   0.998        C    8 0.976
    20  H   0.998        C    8 0.974
    21  H   0.996        C    9 0.955
    22  H   1.000        C   10 0.929
    23  H   0.997        C   12 0.955
    24  H   0.998        C   13 0.971
    25  H   0.997        C   13 0.978

molecular dipole:
                 x           y           z       tot (Debye)
 q only:       -0.301      -0.932      -0.526
   full:       -0.617      -1.103      -0.530       3.482
molecular quadrupole (traceless):
                xx          xy          yy          xz          yz          zz
 q only:        5.082       3.859      -5.028       1.444      -6.009      -0.054
  q+dip:        3.971       3.843      -4.315       1.427      -7.285       0.344
   full:        3.942       3.663      -5.174       1.392      -7.218       1.232

           -------------------------------------------------
          |                Geometry Summary                 |
           -------------------------------------------------

      molecular mass/u    :      192.2752000
   center of mass at/Å    :        0.4072110       0.7383174       0.2855465
  moments of inertia/u·Å² :        0.5279534E+03   0.7234509E+03   0.1164958E+04
rotational constants/cm⁻¹ :        0.3193015E-01   0.2330169E-01   0.1447059E-01

 * 22 selected distances

     #   Z        #   Z                                     value/Å
     1   6 C      2  16 S                                 1.7170740
     2  16 S      3   6 C                                 1.7414890 (max)
     3   6 C      4   6 C                                 1.3765758
     1   6 C      5   6 C                                 1.3599746
     4   6 C      5   6 C                                 1.4191101
     5   6 C      6   6 C                                 1.4961214
     6   6 C      7   6 C                                 1.5259133
     7   6 C      8   6 C                                 1.5256372
     8   6 C      9   6 C                                 1.5353862
    10   6 C     11   8 O                                 1.1985040
    12   6 C     13   6 C                                 1.3298954
     1   6 C     14   1 H                                 1.0720570 (min)
     6   6 C     15   1 H                                 1.0917919
     6   6 C     16   1 H                                 1.0951273
     7   6 C     17   1 H                                 1.0911522
     7   6 C     18   1 H                                 1.0914942
     8   6 C     19   1 H                                 1.0922481
     8   6 C     20   1 H                                 1.0925775
     9   6 C     21   1 H                                 1.0951919
    12   6 C     23   1 H                                 1.0810477
    13   6 C     24   1 H                                 1.0778679
    13   6 C     25   1 H                                 1.0751643

 * 4 distinct bonds (by element types)

   Z      Z             #   av. dist./Å        max./Å        min./Å
   1 H    6 C          11     1.0868836     1.0951919     1.0720570
   6 C    6 C           8     1.4460767     1.5353862     1.3298954
   6 C    8 O           1     1.1985040     1.1985040     1.1985040
   6 C   16 S           2     1.7292815     1.7414890     1.7170740


optimized geometry written to: xtbopt.xyz


           -------------------------------------------------
          | TOTAL ENERGY              -36.947721243809 Eh   |
          | GRADIENT NORM               0.000426672988 Eh/α |
          | HOMO-LUMO GAP               2.797145682435 eV   |
           -------------------------------------------------

------------------------------------------------------------------------
 * finished run on 2021/05/19 at 11:00:18.386     
------------------------------------------------------------------------
 total:
 * wall-time:     0 d,  0 h,  0 min,  1.575 sec
 *  cpu-time:     0 d,  0 h,  0 min,  1.100 sec
 * ratio c/w:     0.699 speedup
 SCF:
 * wall-time:     0 d,  0 h,  0 min,  0.040 sec
 *  cpu-time:     0 d,  0 h,  0 min,  0.040 sec
 * ratio c/w:     0.997 speedup
 ANC optimizer:
 * wall-time:     0 d,  0 h,  0 min,  1.485 sec
 *  cpu-time:     0 d,  0 h,  0 min,  1.041 sec
 * ratio c/w:     0.701 speedup

