      -----------------------------------------------------------      
     |                   =====================                   |     
     |                           x T B                           |     
     |                   =====================                   |     
     |                         S. Grimme                         |     
     |          Mulliken Center for Theoretical Chemistry        |     
     |                    University of Bonn                     |     
     |                Version 6.2 RC2 (SAW190805)                |     
      -----------------------------------------------------------      

   This program is distributed in the hope that it will be useful,
   but WITHOUT ANY WARRANTY; without even the implied warranty of
   MERCHANTABILITY or FITNESS FOR A PARTICULAR PURPOSE.
   
   FOR NON-COMMERCIAL, ACADEMIA USE ONLY.
   
   Cite this work as:
   * S. Grimme, C. Bannwarth, P. Shushkov, J. Chem. Theory Comput., 2017,
     13, 1989-2009. DOI: 10.1021/acs.jctc.7b00118
   * C. Bannwarth, S. Ehlert and S. Grimme., J. Chem. Theory Comput., 2019,
     15, 1652-1671. DOI: 10.1021/acs.jctc.8b01176
   * P. Pracht, E. Caldeweyher, S. Ehlert, S. Grimme, ChemRxiv, 2019, preprint.
     DOI: 10.26434/chemrxiv.8326202.v1
   
   for DFT-D4:
   * E. Caldeweyher, C. Bannwarth and S. Grimme, J. Chem. Phys., 2017,
     147, 034112. DOI: 10.1063/1.4993215
   * E. Caldeweyher, S. Ehlert, A. Hansen, H. Neugebauer, S. Spicher,
     C. Bannwarth and S. Grimme, J. Chem. Phys., 2019, 150, 154122.
     DOI: 10.1063/1.5090222
   
   for sTDA-xTB:
   * S. Grimme and C. Bannwarth, J. Chem. Phys., 2016, 145, 054103.
     DOI: 10.1063/1.4959605
   
   in the mass-spec context:
   * V. Asgeirsson, C. Bauer and S. Grimme, Chem. Sci., 2017, 8, 4879.
     DOI: 10.1039/c7sc00601b
   
   for metadynamics refer to:
   * S. Grimme, J. Chem. Theory Comput., 2019, 155, 2847-2862
     DOI: 10.1021/acs.jctc.9b00143
   
   with help from (in alphabetical order)
   C. Bannwarth, F. Bohle, G. Brandenburg, E. Caldeweyher, M. Checinski,
   S. Dohm, S. Ehlert, S. Ehrlich, F. März, H. Neugebauer, J. Pisarek,
   P. Pracht, P. Shushkov, and S. Spicher.
   
 * started run on 2021/05/19 at 11:00:28.213     

           -------------------------------------------------
          |                Calculation Setup                |
           -------------------------------------------------

          program call               : /ihome/ghutchison/geoffh/xtb/xtb 470.xyz -opt
          hostname                   : smp-n126
          coordinate file            : 470.xyz
          omp threads                :                     1
          number of atoms            :                    23
          number of electrons        :                    62
          charge                     :                     0
          spin                       :                   0.0
          first test random number   :      0.51500160748844


########################################################################
# WARNING! Please study the warnings concerning your input carefully
#  - the use of '-opt' is discouraged, please use '--opt' next time
########################################################################

           ------------------------------------------------- 
          |                 G F N 2 - x T B                 |
          | Geometry, Frequencies, Noncovalent interactions |
          |            JCTC 2019 parametrisation            |
           ------------------------------------------------- 
             KAB for C  - Si     :                1.0500
             KAB for H  - Pd     :                0.9500
             k(s)              :                1.8500
             k(p)              :                2.2300
             k(d)              :                2.2300
             k(f)              :                2.0000
             kEN (H0ij)        :               -2.0000
             D4 a1             :                0.5200
             D4 a2             :                5.0000
             D4 s6             :                1.0000
             D4 s8             :                2.7000
             D4 s9             :                5.0000
             alphaj            :                2.0000

  Z AO/shell   Hii/eV     exponent
  1     Wed Apr 25 08:07:45 CEST 2018   EN: 2.200 GM2: 0.406  GM3: 0.0800  RAES: 1.40
     1s    -10.707211    1.230000
  6     Wed Apr 25 08:07:45 CEST 2018   EN: 2.550 GM2: 0.538  GM3: 0.1500  RAES: 3.00
     2s    -13.970922    2.096432
     2p    -10.063292    1.800000
  8     Wed Apr 25 08:07:45 CEST 2018   EN: 3.440 GM2: 0.452  GM3:-0.0517  RAES: 1.80
     2s    -20.229985    2.439742
     2p    -15.503117    2.137023
 16     Tue Apr 24 11:44:34 CEST 2018   EN: 2.580 GM2: 0.340  GM3:-0.0502  RAES: 3.10
     3s    -20.029654    1.981333
     3p    -11.377694    2.025643
     3d     -0.420282    1.702555

           ------------------------------------------------- 
          |        Self-Consistent Charge Iterations        |
           ------------------------------------------------- 

          ...................................................
          :                      SETUP                      :
          :.................................................:
          :  # basis functions                  62          :
          :  # atomic orbitals                  61          :
          :  # shells                           35          :
          :  # electrons                        62          :
          :  max. iterations                   250          :
          :  Hamiltonian                  GFN2-xTB          :
          :  restarted?                      false          :
          :  GBSA solvation                  false          :
          :  PC potential                    false          :
          :  electronic temp.          300.0000000     K    :
          :  accuracy                    1.0000000          :
          :  -> integral cutoff          0.2500000E+02      :
          :  -> integral neglect         0.1000000E-07      :
          :  -> SCF convergence          0.1000000E-05 Eh   :
          :  -> wf. convergence          0.1000000E-03 e    :
          :  Broyden damping             0.4000000          :
          ...................................................

 iter      E             dE          RMSdq      gap      omega  full diag
   1    -34.9528887 -0.349529E+02  0.516E+00    3.18       0.0  T
   2    -34.9937427 -0.408540E-01  0.304E+00    2.88       1.0  T
   3    -34.9896644  0.407825E-02  0.108E+00    3.11       1.0  T
   4    -34.9934219 -0.375746E-02  0.571E-01    2.97       1.0  T
   5    -34.9976761 -0.425417E-02  0.289E-01    3.02       1.0  T
   6    -34.9981396 -0.463521E-03  0.805E-02    3.00       1.0  T
   7    -34.9981485 -0.893231E-05  0.408E-02    2.99       1.0  T
   8    -34.9981504 -0.188910E-05  0.224E-02    3.00       1.0  T
   9    -34.9981571 -0.665851E-05  0.638E-03    3.00       3.3  T
  10    -34.9981571 -0.632539E-07  0.239E-03    3.00       8.7  T
  11    -34.9981571 -0.117139E-07  0.741E-04    3.00      28.1  T
  12    -34.9981571 -0.966075E-09  0.273E-04    3.00      76.2  T

   *** convergence criteria satisfied after 12 iterations ***

         #    Occupation            Energy/Eh            Energy/eV
      -------------------------------------------------------------
         1        2.0000           -0.7708940             -20.9771
       ...           ...                  ...                  ...
        25        2.0000           -0.4605117             -12.5312
        26        2.0000           -0.4568559             -12.4317
        27        2.0000           -0.4494169             -12.2293
        28        2.0000           -0.4370565             -11.8929
        29        2.0000           -0.4323522             -11.7649
        30        2.0000           -0.4143465             -11.2749
        31        2.0000           -0.4099747             -11.1560 (HOMO)
        32                         -0.2998321              -8.1588 (LUMO)
        33                         -0.1983177              -5.3965
        34                         -0.1366154              -3.7175
        35                         -0.0929902              -2.5304
        36                         -0.0306371              -0.8337
       ...                                ...                  ...
        61                          1.1413471              31.0576
      -------------------------------------------------------------
                  HL-Gap            0.1101426 Eh            2.9971 eV
             Fermi-level           -0.3549034 Eh           -9.6574 eV

 SCC (total)                   0 d,  0 h,  0 min,  0.036 sec
 SCC setup                      ...        0 min,  0.000 sec (  0.786%)
 Dispersion                     ...        0 min,  0.000 sec (  0.777%)
 integral evaluation            ...        0 min,  0.007 sec ( 19.639%)
 zeroth order Hamiltonian       ...        0 min,  0.000 sec (  0.426%)
 iterations                     ...        0 min,  0.016 sec ( 45.472%)
 molecular gradient             ...        0 min,  0.011 sec ( 31.856%)
 printout                       ...        0 min,  0.000 sec (  0.901%)

         :::::::::::::::::::::::::::::::::::::::::::::::::::::
         ::                     SUMMARY                     ::
         :::::::::::::::::::::::::::::::::::::::::::::::::::::
         :: total energy             -34.560640787513 Eh    ::
         :: gradient norm              0.062828849759 Eh/a0 ::
         :: HOMO-LUMO gap              2.997133203880 eV    ::
         ::.................................................::
         :: SCC energy               -34.998157149777 Eh    ::
         :: -> isotropic ES            0.064866093849 Eh    ::
         :: -> anisotropic ES         -0.002770085180 Eh    ::
         :: -> anisotropic XC          0.013107802997 Eh    ::
         :: -> dispersion             -0.020869346701 Eh    ::
         :: repulsion energy           0.437326377598 Eh    ::
         :: add. restraining           0.000000000000 Eh    ::
         :::::::::::::::::::::::::::::::::::::::::::::::::::::

      ----------------------------------------------------------- 
     |                   =====================                   |
     |                        A N C O P T                        |
     |                   =====================                   |
     |               Approximate Normal Coordinate               |
     |                Rational Function Optimizer                |
      ----------------------------------------------------------- 

          ...................................................
          :                      SETUP                      :
          :.................................................:
          :   optimization level            normal          :
          :   max. optcycles                   200          :
          :   ANC micro-cycles                  20          :
          :   degrees of freedom                63          :
          :.................................................:
          :   RF solver                   davidson          :
          :   input Hessian                  false          :
          :   write xtbopt.log                true          :
          :   linear?                        false          :
          :   energy convergence         0.5000000E-05 Eh   :
          :   grad. convergence          0.1000000E-02 Eh/α :
          :   maximium RF displ.         2.0000000          :
          :   Hlow (freq-cutoff)         0.5000000E-02      :
          :   Hmax (freq-cutoff)         5.0000000          :
          :   S6 in model hess.         20.0000000          :
          ...................................................

generating ANC from model Hessian ...
Using Lindh-Hessian (1995)
 Shifting diagonal of input Hessian by   3.376932950108288E-003
 Lowest  eigenvalues of input Hessian
   -0.000000   -0.000000    0.000000    0.000000    0.000000    0.000000
    0.005000    0.006069    0.006583    0.007188    0.009215    0.011478
    0.014434    0.018493    0.021210    0.030232    0.039777    0.046007
 Highest eigenvalues
    1.585727    1.626544    1.815838    1.876177    2.617007    3.417153
 

........................................................................
.............................. CYCLE    1 ..............................
........................................................................
   1    -34.9981571 -0.349982E+02  0.933E-05    3.00       0.0  T
   2    -34.9981571 -0.100115E-10  0.561E-05    3.00     372.0  T
   3    -34.9981571  0.125269E-10  0.359E-05    3.00     581.1  T
     SCC iter.                  ...        0 min,  0.004 sec
     gradient                   ...        0 min,  0.011 sec
 * total energy  :   -34.5606408 Eh     change       -0.5426529E-08 Eh
   gradient norm :     0.0628291 Eh/α   predicted     0.0000000E+00 (-100.00%)
   displ. norm   :     0.2438936 α      lambda       -0.5250145E-02
   maximum displ.:     0.1503068 α      in ANC's #3, #7, #26, ...

........................................................................
.............................. CYCLE    2 ..............................
........................................................................
   1    -35.0099756 -0.350100E+02  0.218E-01    3.08       0.0  T
   2    -35.0100025 -0.269001E-04  0.107E-01    3.10       1.0  T
   3    -35.0099463  0.561683E-04  0.720E-02    3.09       1.0  T
   4    -35.0100263 -0.800512E-04  0.191E-02    3.09       1.1  T
   5    -35.0100282 -0.181507E-05  0.686E-03    3.09       3.0  T
   6    -35.0100281  0.373966E-08  0.179E-03    3.09      11.6  T
   7    -35.0100282 -0.464765E-07  0.711E-04    3.09      29.3  T
     SCC iter.                  ...        0 min,  0.007 sec
     gradient                   ...        0 min,  0.011 sec
 * total energy  :   -34.5645526 Eh     change       -0.3911792E-02 Eh
   gradient norm :     0.0319462 Eh/α   predicted    -0.2781266E-02 ( -28.90%)
   displ. norm   :     0.2649683 α      lambda       -0.3035809E-02
   maximum displ.:     0.1672524 α      in ANC's #3, #7, #26, ...

........................................................................
.............................. CYCLE    3 ..............................
........................................................................
   1    -35.0171636 -0.350172E+02  0.270E-01    3.16       0.0  T
   2    -35.0172015 -0.378464E-04  0.125E-01    3.18       1.0  T
   3    -35.0171623  0.391894E-04  0.613E-02    3.17       1.0  T
   4    -35.0172115 -0.492649E-04  0.240E-02    3.18       1.0  T
   5    -35.0172172 -0.565524E-05  0.798E-03    3.18       2.6  T
   6    -35.0172172 -0.409717E-07  0.107E-03    3.18      19.4  T
   7    -35.0172172 -0.930846E-08  0.693E-04    3.18      30.1  T
     SCC iter.                  ...        0 min,  0.007 sec
     gradient                   ...        0 min,  0.011 sec
 * total energy  :   -34.5664370 Eh     change       -0.1884383E-02 Eh
   gradient norm :     0.0087887 Eh/α   predicted    -0.1624474E-02 ( -13.79%)
   displ. norm   :     0.1891564 α      lambda       -0.5504918E-03
   maximum displ.:     0.1410857 α      in ANC's #3, #1, #8, ...

........................................................................
.............................. CYCLE    4 ..............................
........................................................................
   1    -35.0166807 -0.350167E+02  0.148E-01    3.19       0.0  T
   2    -35.0166863 -0.557878E-05  0.716E-02    3.19       1.0  T
   3    -35.0166871 -0.806034E-06  0.147E-02    3.19       1.4  T
   4    -35.0166871 -0.586516E-08  0.571E-03    3.19       3.7  T
   5    -35.0166871  0.337031E-07  0.266E-03    3.19       7.8  T
   6    -35.0166872 -0.134394E-06  0.345E-04    3.19      60.4  T
     SCC iter.                  ...        0 min,  0.006 sec
     gradient                   ...        0 min,  0.011 sec
 * total energy  :   -34.5668132 Eh     change       -0.3761959E-03 Eh
   gradient norm :     0.0075997 Eh/α   predicted    -0.2850963E-03 ( -24.22%)
   displ. norm   :     0.1569882 α      lambda       -0.2243301E-03
   maximum displ.:     0.1163109 α      in ANC's #3, #1, #5, ...

........................................................................
.............................. CYCLE    5 ..............................
........................................................................
   1    -35.0157378 -0.350157E+02  0.118E-01    3.18       0.0  T
   2    -35.0157404 -0.259415E-05  0.600E-02    3.18       1.0  T
   3    -35.0157351  0.537991E-05  0.205E-02    3.18       1.0  T
   4    -35.0157417 -0.666384E-05  0.772E-03    3.18       2.7  T
   5    -35.0157420 -0.240082E-06  0.559E-04    3.18      37.3  T
   6    -35.0157420 -0.853362E-09  0.380E-04    3.18      54.8  T
     SCC iter.                  ...        0 min,  0.006 sec
     gradient                   ...        0 min,  0.011 sec
 * total energy  :   -34.5669751 Eh     change       -0.1619071E-03 Eh
   gradient norm :     0.0058697 Eh/α   predicted    -0.1149300E-03 ( -29.01%)
   displ. norm   :     0.1410084 α      lambda       -0.1332802E-03
   maximum displ.:     0.0989503 α      in ANC's #3, #1, #6, ...

........................................................................
.............................. CYCLE    6 ..............................
........................................................................
   1    -35.0154367 -0.350154E+02  0.108E-01    3.17       0.0  T
   2    -35.0154395 -0.279125E-05  0.564E-02    3.17       1.0  T
   3    -35.0154330  0.646544E-05  0.212E-02    3.17       1.0  T
   4    -35.0154410 -0.800449E-05  0.673E-03    3.17       3.1  T
   5    -35.0154411 -0.115817E-06  0.151E-03    3.17      13.8  T
   6    -35.0154412 -0.428928E-08  0.393E-04    3.17      53.1  T
     SCC iter.                  ...        0 min,  0.006 sec
     gradient                   ...        0 min,  0.011 sec
 * total energy  :   -34.5670775 Eh     change       -0.1023867E-03 Eh
   gradient norm :     0.0037783 Eh/α   predicted    -0.6797344E-04 ( -33.61%)
   displ. norm   :     0.1502679 α      lambda       -0.1076283E-03
   maximum displ.:     0.1032598 α      in ANC's #1, #3, #8, ...

........................................................................
.............................. CYCLE    7 ..............................
........................................................................
   1    -35.0156652 -0.350157E+02  0.121E-01    3.16       0.0  T
   2    -35.0156690 -0.389732E-05  0.630E-02    3.16       1.0  T
   3    -35.0156659  0.316329E-05  0.174E-02    3.16       1.2  T
   4    -35.0156702 -0.429697E-05  0.766E-03    3.16       2.7  T
   5    -35.0156705 -0.323927E-06  0.193E-03    3.16      10.8  T
   6    -35.0156705 -0.852481E-08  0.403E-04    3.16      51.8  T
   7    -35.0156705 -0.244370E-09  0.292E-04    3.16      71.3  T
     SCC iter.                  ...        0 min,  0.007 sec
     gradient                   ...        0 min,  0.011 sec
 * total energy  :   -34.5671584 Eh     change       -0.8097514E-04 Eh
   gradient norm :     0.0030195 Eh/α   predicted    -0.5503567E-04 ( -32.03%)
   displ. norm   :     0.1404019 α      lambda       -0.7016012E-04
   maximum displ.:     0.0959557 α      in ANC's #1, #3, #8, ...

........................................................................
.............................. CYCLE    8 ..............................
........................................................................
   1    -35.0161081 -0.350161E+02  0.120E-01    3.16       0.0  T
   2    -35.0161119 -0.382116E-05  0.618E-02    3.16       1.0  T
   3    -35.0161124 -0.514229E-06  0.105E-02    3.16       2.0  T
   4    -35.0161122  0.234720E-06  0.725E-03    3.16       2.9  T
   5    -35.0161129 -0.734852E-06  0.128E-03    3.16      16.3  T
   6    -35.0161129 -0.154060E-07  0.319E-04    3.16      65.5  T
   7    -35.0161129  0.855636E-10  0.132E-04    3.16     157.9  T
     SCC iter.                  ...        0 min,  0.007 sec
     gradient                   ...        0 min,  0.011 sec
 * total energy  :   -34.5672098 Eh     change       -0.5138772E-04 Eh
   gradient norm :     0.0039166 Eh/α   predicted    -0.3578192E-04 ( -30.37%)
   displ. norm   :     0.1149845 α      lambda       -0.4180108E-04
   maximum displ.:     0.0783334 α      in ANC's #1, #3, #8, ...

........................................................................
.............................. CYCLE    9 ..............................
........................................................................
   1    -35.0165590 -0.350166E+02  0.108E-01    3.16       0.0  T
   2    -35.0165621 -0.309091E-05  0.545E-02    3.16       1.0  T
   3    -35.0165628 -0.746073E-06  0.826E-03    3.16       2.5  T
   4    -35.0165626  0.242511E-06  0.390E-03    3.16       5.4  T
   5    -35.0165629 -0.301530E-06  0.444E-04    3.16      47.0  T
   6    -35.0165629 -0.135866E-08  0.235E-04    3.16      88.6  T
     SCC iter.                  ...        0 min,  0.006 sec
     gradient                   ...        0 min,  0.011 sec
 * total energy  :   -34.5672410 Eh     change       -0.3120638E-04 Eh
   gradient norm :     0.0042072 Eh/α   predicted    -0.2117784E-04 ( -32.14%)
   displ. norm   :     0.1051020 α      lambda       -0.3192005E-04
   maximum displ.:     0.0718382 α      in ANC's #1, #3, #8, ...

........................................................................
.............................. CYCLE   10 ..............................
........................................................................
   1    -35.0169134 -0.350169E+02  0.108E-01    3.16       0.0  T
   2    -35.0169167 -0.330314E-05  0.541E-02    3.16       1.0  T
   3    -35.0169173 -0.621944E-06  0.864E-03    3.16       2.4  T
   4    -35.0169170  0.343679E-06  0.609E-03    3.17       3.4  T
   5    -35.0169176 -0.574206E-06  0.820E-04    3.16      25.4  T
   6    -35.0169176 -0.585525E-08  0.275E-04    3.16      75.9  T
     SCC iter.                  ...        0 min,  0.006 sec
     gradient                   ...        0 min,  0.011 sec
 * total energy  :   -34.5672641 Eh     change       -0.2311584E-04 Eh
   gradient norm :     0.0034745 Eh/α   predicted    -0.1614075E-04 ( -30.17%)
   displ. norm   :     0.0762318 α      lambda       -0.1915866E-04
   maximum displ.:     0.0521870 α      in ANC's #1, #3, #22, ...

........................................................................
.............................. CYCLE   11 ..............................
........................................................................
   1    -35.0171024 -0.350171E+02  0.860E-02    3.17       0.0  T
   2    -35.0171046 -0.227952E-05  0.428E-02    3.17       1.0  T
   3    -35.0171051 -0.444815E-06  0.672E-03    3.17       3.1  T
   4    -35.0171050  0.113124E-06  0.433E-03    3.17       4.8  T
   5    -35.0171052 -0.204653E-06  0.146E-03    3.17      14.3  T
   6    -35.0171052 -0.282241E-07  0.263E-04    3.17      79.2  T
   7    -35.0171052 -0.444231E-09  0.167E-04    3.17     124.6  T
     SCC iter.                  ...        0 min,  0.007 sec
     gradient                   ...        0 min,  0.011 sec
 * total energy  :   -34.5672767 Eh     change       -0.1256697E-04 Eh
   gradient norm :     0.0019587 Eh/α   predicted    -0.9636332E-05 ( -23.32%)
   displ. norm   :     0.0337715 α      lambda       -0.5712122E-05
   maximum displ.:     0.0211488 α      in ANC's #1, #3, #22, ...

........................................................................
.............................. CYCLE   12 ..............................
........................................................................
   1    -35.0172272 -0.350172E+02  0.464E-02    3.17       0.0  T
   2    -35.0172279 -0.788193E-06  0.230E-02    3.17       1.0  T
   3    -35.0172281 -0.165432E-06  0.336E-03    3.17       6.2  T
   4    -35.0172281 -0.510209E-08  0.181E-03    3.17      11.5  T
   5    -35.0172281  0.945249E-08  0.927E-04    3.17      22.5  T
   6    -35.0172281 -0.153751E-07  0.137E-04    3.17     152.3  T
     SCC iter.                  ...        0 min,  0.006 sec
     gradient                   ...        0 min,  0.011 sec
 * total energy  :   -34.5672807 Eh     change       -0.3964653E-05 Eh
   gradient norm :     0.0005484 Eh/α   predicted    -0.2862030E-05 ( -27.81%)
   displ. norm   :     0.0335209 α      lambda        0.6863606E-05
   maximum displ.:     0.0207446 α      in ANC's #1, #3, #22, ...

   *** GEOMETRY OPTIMIZATION CONVERGED AFTER 12 ITERATIONS ***

------------------------------------------------------------------------
 total energy gain   :        -0.0066399 Eh       -4.1666 kcal/mol
 total RMSD          :         0.2951233 a0        0.1562 Å
 total power (kW/mol):        -1.4527517 (step)  -57.4424 (real)
------------------------------------------------------------------------

 ANCopt (total)                0 d,  0 h,  0 min,  0.304 sec
 optimizer setup                ...        0 min,  0.000 sec (  0.045%)
 model hessian                  ...        0 min,  0.007 sec (  2.226%)
 ANC generation                 ...        0 min,  0.001 sec (  0.222%)
 coordinate transformation      ...        0 min,  0.000 sec (  0.063%)
 single point calculation       ...        0 min,  0.292 sec ( 96.281%)
 optimization log               ...        0 min,  0.001 sec (  0.375%)
 hessian update                 ...        0 min,  0.000 sec (  0.046%)
 rational function              ...        0 min,  0.001 sec (  0.493%)

================
 final structure:
================
$coord
    1.93123742813643   -2.40799144179133    0.13761791666136      C 
    3.90837993541192   -0.86704750881205   -0.02145842002204      C 
    6.58852624152467   -1.75635803025891   -0.26629171607851      C 
    7.31429043664412   -1.96553883421445   -3.06008638651818      C 
    3.24961062707786    1.85288224481180   -0.08148615327128      C 
    5.24219030580011    3.86840632254430   -0.04987648805910      C 
    6.03751023755790    4.43788448119269    2.67394153077209      C 
    0.78238920083112    2.32170399153174   -0.03934297744470      C 
   -0.92228050569410   -0.59299150347362    0.15118603896717      S 
   -2.36121986525090   -1.05259838742033   -2.10694608372967      O 
   -2.21766483765092   -0.79321555335205    2.53076492228308      O 
    1.92387650228365   -4.43034074772621    0.19650978131519      H 
    6.76336356540967   -3.61263254140730    0.61307971648517      H 
    7.87649029779608   -0.46614186283763    0.69057750826632      H 
    6.08840185109298   -3.31281103912411   -4.00857482486292      H 
    9.25900012035870   -2.60270206019970   -3.24006500669146      H 
    7.12617391381539   -0.15273025780889   -4.00843542045833      H 
    4.47589453702576    5.58412971641753   -0.89769048121955      H 
    6.88556719125009    3.28684607895170   -1.14559829385569      H 
    4.42490547046177    5.10823316389804    3.75462021105305      H 
    7.49491259003312    5.88543001855768    2.69748817944864      H 
    6.76865389424645    2.75395196936969    3.59589209385311      H 
   -0.14963907851852    4.11738411170320   -0.05591279273944      H 
$end
           -------------------------------------------------
          |                Final Singlepoint                |
           -------------------------------------------------

          ...................................................
          :                      SETUP                      :
          :.................................................:
          :  # basis functions                  62          :
          :  # atomic orbitals                  61          :
          :  # shells                           35          :
          :  # electrons                        62          :
          :  max. iterations                   250          :
          :  Hamiltonian                  GFN2-xTB          :
          :  restarted?                      false          :
          :  GBSA solvation                  false          :
          :  PC potential                    false          :
          :  electronic temp.          300.0000000     K    :
          :  accuracy                    1.0000000          :
          :  -> integral cutoff          0.2500000E+02      :
          :  -> integral neglect         0.1000000E-07      :
          :  -> SCF convergence          0.1000000E-05 Eh   :
          :  -> wf. convergence          0.1000000E-03 e    :
          :  Broyden damping             0.4000000          :
          ...................................................

 iter      E             dE          RMSdq      gap      omega  full diag
   1    -35.0172281 -0.350172E+02  0.732E-05    3.17       0.0  T
   2    -35.0172281 -0.150635E-11  0.483E-05    3.17     432.1  T
   3    -35.0172281 -0.211315E-10  0.343E-05    3.17     608.2  T

   *** convergence criteria satisfied after 3 iterations ***

         #    Occupation            Energy/Eh            Energy/eV
      -------------------------------------------------------------
         1        2.0000           -0.7697800             -20.9468
       ...           ...                  ...                  ...
        25        2.0000           -0.4595976             -12.5063
        26        2.0000           -0.4555784             -12.3969
        27        2.0000           -0.4519057             -12.2970
        28        2.0000           -0.4332690             -11.7899
        29        2.0000           -0.4330923             -11.7850
        30        2.0000           -0.4169574             -11.3460
        31        2.0000           -0.4093641             -11.1394 (HOMO)
        32                         -0.2927322              -7.9656 (LUMO)
        33                         -0.1938238              -5.2742
        34                         -0.1345244              -3.6606
        35                         -0.0937832              -2.5520
        36                         -0.0713400              -1.9413
       ...                                ...                  ...
        61                          1.2227134              33.2717
      -------------------------------------------------------------
                  HL-Gap            0.1166319 Eh            3.1737 eV
             Fermi-level           -0.3510481 Eh           -9.5525 eV

 SCC (total)                   0 d,  0 h,  0 min,  0.022 sec
 SCC setup                      ...        0 min,  0.000 sec (  0.794%)
 Dispersion                     ...        0 min,  0.000 sec (  0.772%)
 integral evaluation            ...        0 min,  0.007 sec ( 30.009%)
 zeroth order Hamiltonian       ...        0 min,  0.000 sec (  0.583%)
 iterations                     ...        0 min,  0.003 sec ( 15.543%)
 molecular gradient             ...        0 min,  0.011 sec ( 50.811%)
 printout                       ...        0 min,  0.000 sec (  1.291%)

         :::::::::::::::::::::::::::::::::::::::::::::::::::::
         ::                     SUMMARY                     ::
         :::::::::::::::::::::::::::::::::::::::::::::::::::::
         :: total energy             -34.567280683378 Eh    ::
         :: gradient norm              0.000548635126 Eh/a0 ::
         :: HOMO-LUMO gap              3.173714518859 eV    ::
         ::.................................................::
         :: SCC energy               -35.017228118228 Eh    ::
         :: -> isotropic ES            0.062734152473 Eh    ::
         :: -> anisotropic ES         -0.002620341781 Eh    ::
         :: -> anisotropic XC          0.012512855400 Eh    ::
         :: -> dispersion             -0.021130828343 Eh    ::
         :: repulsion energy           0.449752387856 Eh    ::
         :: add. restraining           0.000000000000 Eh    ::
         :::::::::::::::::::::::::::::::::::::::::::::::::::::

           -------------------------------------------------
          |                Property Printout                |
           -------------------------------------------------

    * Orbital Energies and Occupations

         #    Occupation            Energy/Eh            Energy/eV
      -------------------------------------------------------------
         1        2.0000           -0.7697800             -20.9468
       ...           ...                  ...                  ...
        19        2.0000           -0.5023468             -13.6696
        20        2.0000           -0.4989537             -13.5772
        21        2.0000           -0.4931057             -13.4181
        22        2.0000           -0.4730298             -12.8718
        23        2.0000           -0.4691379             -12.7659
        24        2.0000           -0.4645335             -12.6406
        25        2.0000           -0.4595976             -12.5063
        26        2.0000           -0.4555784             -12.3969
        27        2.0000           -0.4519057             -12.2970
        28        2.0000           -0.4332690             -11.7899
        29        2.0000           -0.4330923             -11.7850
        30        2.0000           -0.4169574             -11.3460
        31        2.0000           -0.4093641             -11.1394 (HOMO)
        32                         -0.2927322              -7.9656 (LUMO)
        33                         -0.1938238              -5.2742
        34                         -0.1345244              -3.6606
        35                         -0.0937832              -2.5520
        36                         -0.0713400              -1.9413
        37                         -0.0048718              -0.1326
        38                          0.0436903               1.1889
        39                          0.0957517               2.6055
        40                          0.0997989               2.7157
        41                          0.1022443               2.7822
        42                          0.1162520               3.1634
       ...                                ...                  ...
        61                          1.2227134              33.2717
      -------------------------------------------------------------
                  HL-Gap            0.1166319 Eh            3.1737 eV
             Fermi-level           -0.3510481 Eh           -9.5525 eV

     #   Z        covCN         q      C6AA      α(0)
     1   6 C      2.910    -0.138    31.543     9.209
     2   6 C      3.146     0.017    27.377     8.560
     3   6 C      3.805    -0.058    21.608     6.617
     4   6 C      3.754    -0.104    22.538     6.769
     5   6 C      3.145     0.017    27.377     8.560
     6   6 C      3.805    -0.058    21.607     6.617
     7   6 C      3.754    -0.104    22.538     6.769
     8   6 C      2.910    -0.138    31.543     9.209
     9  16 S      4.017     0.972   107.456    17.447
    10   8 O      0.860    -0.530    24.468     6.632
    11   8 O      0.860    -0.530    24.467     6.632
    12   1 H      0.926     0.081     1.964     2.192
    13   1 H      0.924     0.051     2.313     2.379
    14   1 H      0.925     0.058     2.219     2.329
    15   1 H      0.925     0.046     2.376     2.410
    16   1 H      0.925     0.049     2.334     2.389
    17   1 H      0.925     0.042     2.416     2.431
    18   1 H      0.924     0.051     2.314     2.379
    19   1 H      0.925     0.058     2.219     2.329
    20   1 H      0.925     0.046     2.376     2.411
    21   1 H      0.925     0.049     2.334     2.389
    22   1 H      0.925     0.043     2.416     2.431
    23   1 H      0.926     0.081     1.964     2.192

 Mol. C6AA /au·bohr⁶  :       6175.920427
 Mol. C8AA /au·bohr⁸  :     157124.432661
 Mol. α(0) /au        :        121.283964


Wiberg/Mayer (AO) data.
largest (>0.10) Wiberg bond orders for each atom
          total WBO             WBO to atom ...
     1  C   3.972        C    2 1.839    H   12 0.962    S    9 0.777    C    8 0.167
     2  C   3.983        C    1 1.839    C    5 1.042    C    3 1.011
     3  C   3.995        C    2 1.011    C    4 0.995    H   13 0.973    H   14 0.965
     4  C   3.993        C    3 0.995    H   15 0.988    H   17 0.986    H   16 0.984
     5  C   3.983        C    8 1.839    C    2 1.042    C    6 1.011
     6  C   3.995        C    5 1.011    C    7 0.995    H   18 0.973    H   19 0.965
     7  C   3.993        C    6 0.995    H   20 0.988    H   22 0.986    H   21 0.984
     8  C   3.972        C    5 1.839    H   23 0.962    S    9 0.777    C    1 0.167
     9  S   4.929        O   11 1.656    O   10 1.656    C    1 0.777    C    8 0.777
    10  O   1.970        S    9 1.656    O   11 0.119
    11  O   1.970        S    9 1.656    O   10 0.119
    12  H   0.993        C    1 0.962
    13  H   0.997        C    3 0.973
    14  H   0.996        C    3 0.965
    15  H   0.998        C    4 0.988
    16  H   0.997        C    4 0.984
    17  H   0.998        C    4 0.986
    18  H   0.997        C    6 0.973
    19  H   0.996        C    6 0.965
    20  H   0.998        C    7 0.988
    21  H   0.997        C    7 0.984
    22  H   0.998        C    7 0.986
    23  H   0.993        C    8 0.962

molecular dipole:
                 x           y           z       tot (Debye)
 q only:        2.672       0.644      -0.120
   full:        2.680       0.646      -0.120       7.014
molecular quadrupole (traceless):
                xx          xy          yy          xz          yz          zz
 q only:        5.038      -1.273       3.599      -0.285       0.612      -8.637
  q+dip:        4.711      -2.318       7.224      -0.266       0.019     -11.935
   full:        3.785      -2.317       6.326      -0.191       0.229     -10.111

           -------------------------------------------------
          |                Geometry Summary                 |
           -------------------------------------------------

      molecular mass/u    :      172.2416000
   center of mass at/Å    :        1.1910977       0.0908757       0.0040367
  moments of inertia/u·Å² :        0.3551527E+03   0.6908385E+03   0.8843909E+03
rotational constants/cm⁻¹ :        0.4746586E-01   0.2440170E-01   0.1906129E-01

 * 20 selected distances

     #   Z        #   Z                                     value/Å
     1   6 C      2   6 C                                 1.3291629
     3   6 C      4   6 C                                 1.5314886
     6   6 C      7   6 C                                 1.5315110
     5   6 C      8   6 C                                 1.3291466
     1   6 C      9  16 S                                 1.7896031
     8   6 C      9  16 S                                 1.7896561 (max)
     9  16 S     10   8 O                                 1.4376633
     9  16 S     11   8 O                                 1.4376204
     1   6 C     12   1 H                                 1.0706420
     3   6 C     13   1 H                                 1.0908777
     3   6 C     14   1 H                                 1.0895280
     4   6 C     15   1 H                                 1.0867574
     4   6 C     16   1 H                                 1.0871039
     4   6 C     17   1 H                                 1.0872022
     6   6 C     18   1 H                                 1.0908889
     6   6 C     19   1 H                                 1.0895792
     7   6 C     20   1 H                                 1.0867770
     7   6 C     21   1 H                                 1.0870651
     7   6 C     22   1 H                                 1.0870945
     8   6 C     23   1 H                                 1.0706419 (min)

 * 4 distinct bonds (by element types)

   Z      Z             #   av. dist./Å        max./Å        min./Å
   1 H    6 C          12     1.0853465     1.0908889     1.0706419
   6 C    6 C           4     1.4303273     1.5315110     1.3291466
   6 C   16 S           2     1.7896296     1.7896561     1.7896031
   8 O   16 S           2     1.4376419     1.4376633     1.4376204


optimized geometry written to: xtbopt.xyz


           -------------------------------------------------
          | TOTAL ENERGY              -34.567280683378 Eh   |
          | GRADIENT NORM               0.000548635126 Eh/α |
          | HOMO-LUMO GAP               3.173714518859 eV   |
           -------------------------------------------------

------------------------------------------------------------------------
 * finished run on 2021/05/19 at 11:00:28.625     
------------------------------------------------------------------------
 total:
 * wall-time:     0 d,  0 h,  0 min,  0.411 sec
 *  cpu-time:     0 d,  0 h,  0 min,  0.375 sec
 * ratio c/w:     0.912 speedup
 SCF:
 * wall-time:     0 d,  0 h,  0 min,  0.036 sec
 *  cpu-time:     0 d,  0 h,  0 min,  0.032 sec
 * ratio c/w:     0.886 speedup
 ANC optimizer:
 * wall-time:     0 d,  0 h,  0 min,  0.326 sec
 *  cpu-time:     0 d,  0 h,  0 min,  0.326 sec
 * ratio c/w:     0.998 speedup

