      -----------------------------------------------------------      
     |                   =====================                   |     
     |                           x T B                           |     
     |                   =====================                   |     
     |                         S. Grimme                         |     
     |          Mulliken Center for Theoretical Chemistry        |     
     |                    University of Bonn                     |     
     |                Version 6.2 RC2 (SAW190805)                |     
      -----------------------------------------------------------      

   This program is distributed in the hope that it will be useful,
   but WITHOUT ANY WARRANTY; without even the implied warranty of
   MERCHANTABILITY or FITNESS FOR A PARTICULAR PURPOSE.
   
   FOR NON-COMMERCIAL, ACADEMIA USE ONLY.
   
   Cite this work as:
   * S. Grimme, C. Bannwarth, P. Shushkov, J. Chem. Theory Comput., 2017,
     13, 1989-2009. DOI: 10.1021/acs.jctc.7b00118
   * C. Bannwarth, S. Ehlert and S. Grimme., J. Chem. Theory Comput., 2019,
     15, 1652-1671. DOI: 10.1021/acs.jctc.8b01176
   * P. Pracht, E. Caldeweyher, S. Ehlert, S. Grimme, ChemRxiv, 2019, preprint.
     DOI: 10.26434/chemrxiv.8326202.v1
   
   for DFT-D4:
   * E. Caldeweyher, C. Bannwarth and S. Grimme, J. Chem. Phys., 2017,
     147, 034112. DOI: 10.1063/1.4993215
   * E. Caldeweyher, S. Ehlert, A. Hansen, H. Neugebauer, S. Spicher,
     C. Bannwarth and S. Grimme, J. Chem. Phys., 2019, 150, 154122.
     DOI: 10.1063/1.5090222
   
   for sTDA-xTB:
   * S. Grimme and C. Bannwarth, J. Chem. Phys., 2016, 145, 054103.
     DOI: 10.1063/1.4959605
   
   in the mass-spec context:
   * V. Asgeirsson, C. Bauer and S. Grimme, Chem. Sci., 2017, 8, 4879.
     DOI: 10.1039/c7sc00601b
   
   for metadynamics refer to:
   * S. Grimme, J. Chem. Theory Comput., 2019, 155, 2847-2862
     DOI: 10.1021/acs.jctc.9b00143
   
   with help from (in alphabetical order)
   C. Bannwarth, F. Bohle, G. Brandenburg, E. Caldeweyher, M. Checinski,
   S. Dohm, S. Ehlert, S. Ehrlich, F. März, H. Neugebauer, J. Pisarek,
   P. Pracht, P. Shushkov, and S. Spicher.
   
 * started run on 2021/05/19 at 10:59:11.721     

           -------------------------------------------------
          |                Calculation Setup                |
           -------------------------------------------------

          program call               : /ihome/ghutchison/geoffh/xtb/xtb 505.xyz -opt
          hostname                   : smp-n144
          coordinate file            : 505.xyz
          omp threads                :                     1
          number of atoms            :                    18
          number of electrons        :                    40
          charge                     :                     0
          spin                       :                   0.0
          first test random number   :      0.37221507105896


########################################################################
# WARNING! Please study the warnings concerning your input carefully
#  - the use of '-opt' is discouraged, please use '--opt' next time
########################################################################

           ------------------------------------------------- 
          |                 G F N 2 - x T B                 |
          | Geometry, Frequencies, Noncovalent interactions |
          |            JCTC 2019 parametrisation            |
           ------------------------------------------------- 
             KAB for C  - Si     :                1.0500
             KAB for H  - Pd     :                0.9500
             k(s)              :                1.8500
             k(p)              :                2.2300
             k(d)              :                2.2300
             k(f)              :                2.0000
             kEN (H0ij)        :               -2.0000
             D4 a1             :                0.5200
             D4 a2             :                5.0000
             D4 s6             :                1.0000
             D4 s8             :                2.7000
             D4 s9             :                5.0000
             alphaj            :                2.0000

  Z AO/shell   Hii/eV     exponent
  1     Wed Apr 25 08:07:45 CEST 2018   EN: 2.200 GM2: 0.406  GM3: 0.0800  RAES: 1.40
     1s    -10.707211    1.230000
  6     Wed Apr 25 08:07:45 CEST 2018   EN: 2.550 GM2: 0.538  GM3: 0.1500  RAES: 3.00
     2s    -13.970922    2.096432
     2p    -10.063292    1.800000
  7     Wed Apr 25 08:07:45 CEST 2018   EN: 3.040 GM2: 0.461  GM3:-0.0640  RAES: 1.90
     2s    -16.686243    2.339881
     2p    -12.523956    2.014332

           ------------------------------------------------- 
          |        Self-Consistent Charge Iterations        |
           ------------------------------------------------- 

          ...................................................
          :                      SETUP                      :
          :.................................................:
          :  # basis functions                  39          :
          :  # atomic orbitals                  39          :
          :  # shells                           25          :
          :  # electrons                        40          :
          :  max. iterations                   250          :
          :  Hamiltonian                  GFN2-xTB          :
          :  restarted?                      false          :
          :  GBSA solvation                  false          :
          :  PC potential                    false          :
          :  electronic temp.          300.0000000     K    :
          :  accuracy                    1.0000000          :
          :  -> integral cutoff          0.2500000E+02      :
          :  -> integral neglect         0.1000000E-07      :
          :  -> SCF convergence          0.1000000E-05 Eh   :
          :  -> wf. convergence          0.1000000E-03 e    :
          :  Broyden damping             0.4000000          :
          ...................................................

 iter      E             dE          RMSdq      gap      omega  full diag
   1    -21.5996580 -0.215997E+02  0.349E+00    3.59       0.0  T
   2    -21.6344881 -0.348301E-01  0.262E+00    3.22       1.0  T
   3    -21.6482317 -0.137436E-01  0.147E+00    3.36       1.0  T
   4    -21.6547388 -0.650715E-02  0.493E-01    3.33       1.0  T
   5    -21.6561756 -0.143677E-02  0.185E-01    3.29       1.0  T
   6    -21.6565482 -0.372626E-03  0.723E-02    3.30       1.0  T
   7    -21.6565879 -0.396678E-04  0.303E-02    3.30       1.0  T
   8    -21.6565888 -0.897020E-06  0.350E-03    3.30       6.7  T
   9    -21.6565889 -0.521450E-07  0.129E-03    3.30      18.3  T
  10    -21.6565889 -0.278928E-08  0.584E-04    3.30      40.3  T
  11    -21.6565889 -0.661544E-09  0.101E-04    3.30     232.9  T

   *** convergence criteria satisfied after 11 iterations ***

         #    Occupation            Energy/Eh            Energy/eV
      -------------------------------------------------------------
         1        2.0000           -0.6439793             -17.5236
       ...           ...                  ...                  ...
        14        2.0000           -0.4556734             -12.3995
        15        2.0000           -0.4470843             -12.1658
        16        2.0000           -0.4403198             -11.9817
        17        2.0000           -0.4299450             -11.6994
        18        2.0000           -0.4245960             -11.5538
        19        2.0000           -0.3985645             -10.8455
        20        2.0000           -0.3332985              -9.0695 (HOMO)
        21                         -0.2121551              -5.7730 (LUMO)
        22                         -0.1613727              -4.3912
        23                          0.0227589               0.6193
        24                          0.0688711               1.8741
        25                          0.1050148               2.8576
       ...                                ...                  ...
        39                          0.6216532              16.9160
      -------------------------------------------------------------
                  HL-Gap            0.1211434 Eh            3.2965 eV
             Fermi-level           -0.2727268 Eh           -7.4213 eV

 SCC (total)                   0 d,  0 h,  0 min,  0.016 sec
 SCC setup                      ...        0 min,  0.000 sec (  1.380%)
 Dispersion                     ...        0 min,  0.000 sec (  1.160%)
 integral evaluation            ...        0 min,  0.003 sec ( 18.669%)
 zeroth order Hamiltonian       ...        0 min,  0.000 sec (  0.456%)
 iterations                     ...        0 min,  0.007 sec ( 44.196%)
 molecular gradient             ...        0 min,  0.005 sec ( 31.833%)
 printout                       ...        0 min,  0.000 sec (  1.986%)

         :::::::::::::::::::::::::::::::::::::::::::::::::::::
         ::                     SUMMARY                     ::
         :::::::::::::::::::::::::::::::::::::::::::::::::::::
         :: total energy             -21.313591206588 Eh    ::
         :: gradient norm              0.038479765651 Eh/a0 ::
         :: HOMO-LUMO gap              3.296480909970 eV    ::
         ::.................................................::
         :: SCC energy               -21.656588859594 Eh    ::
         :: -> isotropic ES            0.009842651189 Eh    ::
         :: -> anisotropic ES          0.007304813222 Eh    ::
         :: -> anisotropic XC          0.016319034326 Eh    ::
         :: -> dispersion             -0.010900729561 Eh    ::
         :: repulsion energy           0.342978623124 Eh    ::
         :: add. restraining           0.000000000000 Eh    ::
         :::::::::::::::::::::::::::::::::::::::::::::::::::::

      ----------------------------------------------------------- 
     |                   =====================                   |
     |                        A N C O P T                        |
     |                   =====================                   |
     |               Approximate Normal Coordinate               |
     |                Rational Function Optimizer                |
      ----------------------------------------------------------- 

          ...................................................
          :                      SETUP                      :
          :.................................................:
          :   optimization level            normal          :
          :   max. optcycles                   200          :
          :   ANC micro-cycles                  20          :
          :   degrees of freedom                48          :
          :.................................................:
          :   RF solver                   davidson          :
          :   input Hessian                  false          :
          :   write xtbopt.log                true          :
          :   linear?                        false          :
          :   energy convergence         0.5000000E-05 Eh   :
          :   grad. convergence          0.1000000E-02 Eh/α :
          :   maximium RF displ.         2.0000000          :
          :   Hlow (freq-cutoff)         0.5000000E-02      :
          :   Hmax (freq-cutoff)         5.0000000          :
          :   S6 in model hess.         20.0000000          :
          ...................................................

generating ANC from model Hessian ...
Using Lindh-Hessian (1995)
 Shifting diagonal of input Hessian by   3.283158214553582E-003
 Lowest  eigenvalues of input Hessian
   -0.000000   -0.000000   -0.000000    0.000000    0.000000    0.000000
    0.005000    0.006039    0.006925    0.011683    0.012637    0.013933
    0.018283    0.020957    0.023950    0.025640    0.039141    0.046249
 Highest eigenvalues
    1.299994    1.471063    1.535997    1.759839    1.834976    2.122596
 

........................................................................
.............................. CYCLE    1 ..............................
........................................................................
   1    -21.6565889 -0.216566E+02  0.395E-05    3.30       0.0  T
   2    -21.6565889 -0.775913E-11  0.196E-05    3.30    1202.7  T
   3    -21.6565889 -0.273559E-12  0.108E-05    3.30    2173.6  T
     SCC iter.                  ...        0 min,  0.002 sec
     gradient                   ...        0 min,  0.005 sec
 * total energy  :   -21.3135912 Eh     change        0.6919301E-09 Eh
   gradient norm :     0.0384797 Eh/α   predicted     0.0000000E+00 (-100.00%)
   displ. norm   :     0.1894563 α      lambda       -0.3314384E-02
   maximum displ.:     0.0932634 α      in ANC's #14, #8, #3, ...

........................................................................
.............................. CYCLE    2 ..............................
........................................................................
   1    -21.6735076 -0.216735E+02  0.167E-01    3.45       0.0  T
   2    -21.6735165 -0.890917E-05  0.976E-02    3.45       1.0  T
   3    -21.6735148  0.170585E-05  0.161E-02    3.46       1.5  T
   4    -21.6735176 -0.277300E-05  0.849E-03    3.46       2.8  T
   5    -21.6735183 -0.709020E-06  0.315E-03    3.46       7.5  T
   6    -21.6735183 -0.116090E-07  0.883E-04    3.46      26.7  T
     SCC iter.                  ...        0 min,  0.003 sec
     gradient                   ...        0 min,  0.005 sec
 * total energy  :   -21.3155845 Eh     change       -0.1993335E-02 Eh
   gradient norm :     0.0095230 Eh/α   predicted    -0.1716675E-02 ( -13.88%)
   displ. norm   :     0.1642501 α      lambda       -0.6661706E-03
   maximum displ.:     0.0922265 α      in ANC's #3, #4, #7, ...

........................................................................
.............................. CYCLE    3 ..............................
........................................................................
   1    -21.6789225 -0.216789E+02  0.155E-01    3.51       0.0  T
   2    -21.6789273 -0.478894E-05  0.892E-02    3.52       1.0  T
   3    -21.6789194  0.789857E-05  0.280E-02    3.52       1.0  T
   4    -21.6789297 -0.103490E-04  0.531E-03    3.52       4.4  T
   5    -21.6789298 -0.705593E-07  0.258E-03    3.52       9.2  T
   6    -21.6789298  0.450555E-10  0.952E-04    3.52      24.8  T
     SCC iter.                  ...        0 min,  0.003 sec
     gradient                   ...        0 min,  0.005 sec
 * total energy  :   -21.3158960 Eh     change       -0.3114771E-03 Eh
   gradient norm :     0.0072724 Eh/α   predicted    -0.3420716E-03 (   9.82%)
   displ. norm   :     0.1509812 α      lambda       -0.3838120E-03
   maximum displ.:     0.0834911 α      in ANC's #3, #4, #12, ...

........................................................................
.............................. CYCLE    4 ..............................
........................................................................
   1    -21.6791691 -0.216792E+02  0.163E-01    3.55       0.0  T
   2    -21.6791758 -0.666805E-05  0.927E-02    3.56       1.0  T
   3    -21.6791545  0.212828E-04  0.462E-02    3.56       1.0  T
   4    -21.6791815 -0.270229E-04  0.488E-03    3.57       4.8  T
   5    -21.6791815 -0.257935E-07  0.254E-03    3.57       9.3  T
   6    -21.6791816 -0.349173E-08  0.130E-03    3.57      18.1  T
     SCC iter.                  ...        0 min,  0.003 sec
     gradient                   ...        0 min,  0.005 sec
 * total energy  :   -21.3161724 Eh     change       -0.2763500E-03 Eh
   gradient norm :     0.0070625 Eh/α   predicted    -0.1962787E-03 ( -28.97%)
   displ. norm   :     0.2792008 α      lambda       -0.4639414E-03
   maximum displ.:     0.1772382 α      in ANC's #3, #4, #1, ...

........................................................................
.............................. CYCLE    5 ..............................
........................................................................
   1    -21.6754149 -0.216754E+02  0.305E-01    3.61       0.0  T
   2    -21.6754425 -0.276098E-04  0.172E-01    3.64       1.0  T
   3    -21.6753488  0.936765E-04  0.103E-01    3.63       1.0  T
   4    -21.6754732 -0.124428E-03  0.859E-03    3.64       2.7  T
   5    -21.6754733 -0.827064E-07  0.475E-03    3.64       5.0  T
   6    -21.6754733 -0.182936E-07  0.253E-03    3.64       9.3  T
   7    -21.6754734 -0.771502E-07  0.407E-04    3.64      57.9  T
     SCC iter.                  ...        0 min,  0.004 sec
     gradient                   ...        0 min,  0.005 sec
 * total energy  :   -21.3164882 Eh     change       -0.3158564E-03 Eh
   gradient norm :     0.0082590 Eh/α   predicted    -0.2500536E-03 ( -20.83%)
   displ. norm   :     0.2004882 α      lambda       -0.2667007E-03
   maximum displ.:     0.1237651 α      in ANC's #3, #4, #1, ...

........................................................................
.............................. CYCLE    6 ..............................
........................................................................
   1    -21.6734183 -0.216734E+02  0.206E-01    3.68       0.0  T
   2    -21.6734316 -0.132785E-04  0.118E-01    3.70       1.0  T
   3    -21.6733857  0.459449E-04  0.775E-02    3.69       1.0  T
   4    -21.6734517 -0.660727E-04  0.594E-03    3.70       4.0  T
   5    -21.6734518 -0.426413E-07  0.337E-03    3.70       7.0  T
   6    -21.6734518 -0.203986E-07  0.174E-03    3.70      13.6  T
   7    -21.6734518 -0.361734E-07  0.276E-04    3.70      85.3  T
     SCC iter.                  ...        0 min,  0.004 sec
     gradient                   ...        0 min,  0.005 sec
 * total energy  :   -21.3166691 Eh     change       -0.1808361E-03 Eh
   gradient norm :     0.0072733 Eh/α   predicted    -0.1387095E-03 ( -23.30%)
   displ. norm   :     0.1597760 α      lambda       -0.2284858E-03
   maximum displ.:     0.0925668 α      in ANC's #4, #3, #1, ...

........................................................................
.............................. CYCLE    7 ..............................
........................................................................
   1    -21.6744969 -0.216745E+02  0.125E-01    3.72       0.0  T
   2    -21.6745014 -0.459063E-05  0.713E-02    3.73       1.0  T
   3    -21.6744849  0.165228E-04  0.479E-02    3.72       1.0  T
   4    -21.6745087 -0.238115E-04  0.333E-03    3.73       7.1  T
   5    -21.6745088 -0.298184E-07  0.187E-03    3.73      12.6  T
   6    -21.6745088 -0.101693E-09  0.113E-03    3.73      20.9  T
     SCC iter.                  ...        0 min,  0.003 sec
     gradient                   ...        0 min,  0.005 sec
 * total energy  :   -21.3168026 Eh     change       -0.1335511E-03 Eh
   gradient norm :     0.0037403 Eh/α   predicted    -0.1171608E-03 ( -12.27%)
   displ. norm   :     0.1126018 α      lambda       -0.7434029E-04
   maximum displ.:     0.0674877 α      in ANC's #3, #1, #4, ...

........................................................................
.............................. CYCLE    8 ..............................
........................................................................
   1    -21.6754701 -0.216755E+02  0.893E-02    3.75       0.0  T
   2    -21.6754710 -0.817693E-06  0.521E-02    3.75       1.0  T
   3    -21.6754653  0.568083E-05  0.220E-02    3.75       1.1  T
   4    -21.6754719 -0.666484E-05  0.203E-03    3.75      11.6  T
   5    -21.6754719  0.473594E-09  0.970E-04    3.75      24.3  T
   6    -21.6754719 -0.507918E-08  0.396E-04    3.75      59.5  T
     SCC iter.                  ...        0 min,  0.003 sec
     gradient                   ...        0 min,  0.005 sec
 * total energy  :   -21.3168479 Eh     change       -0.4533100E-04 Eh
   gradient norm :     0.0024464 Eh/α   predicted    -0.3764286E-04 ( -16.96%)
   displ. norm   :     0.0792050 α      lambda       -0.3853399E-04
   maximum displ.:     0.0478484 α      in ANC's #3, #1, #4, ...

........................................................................
.............................. CYCLE    9 ..............................
........................................................................
   1    -21.6763395 -0.216763E+02  0.538E-02    3.76       0.0  T
   2    -21.6763396 -0.679179E-07  0.317E-02    3.76       1.0  T
   3    -21.6763396  0.897901E-08  0.166E-03    3.76      14.2  T
   4    -21.6763396 -0.385423E-07  0.619E-04    3.76      38.1  T
   5    -21.6763396 -0.177198E-08  0.207E-04    3.76     113.6  T
     SCC iter.                  ...        0 min,  0.003 sec
     gradient                   ...        0 min,  0.005 sec
 * total energy  :   -21.3168735 Eh     change       -0.2552080E-04 Eh
   gradient norm :     0.0019683 Eh/α   predicted    -0.1938935E-04 ( -24.03%)
   displ. norm   :     0.0971385 α      lambda       -0.2406875E-04
   maximum displ.:     0.0641209 α      in ANC's #1, #3, #4, ...

........................................................................
.............................. CYCLE   10 ..............................
........................................................................
   1    -21.6771160 -0.216771E+02  0.643E-02    3.75       0.0  T
   2    -21.6771162 -0.277081E-06  0.382E-02    3.75       1.0  T
   3    -21.6771138  0.245675E-05  0.137E-02    3.75       1.7  T
   4    -21.6771166 -0.279412E-05  0.111E-03    3.75      21.2  T
   5    -21.6771166 -0.158108E-08  0.592E-04    3.75      39.8  T
   6    -21.6771166 -0.984564E-09  0.271E-04    3.75      87.1  T
     SCC iter.                  ...        0 min,  0.003 sec
     gradient                   ...        0 min,  0.005 sec
 * total energy  :   -21.3168913 Eh     change       -0.1778905E-04 Eh
   gradient norm :     0.0017962 Eh/α   predicted    -0.1208329E-04 ( -32.07%)
   displ. norm   :     0.0750818 α      lambda       -0.1285964E-04
   maximum displ.:     0.0450462 α      in ANC's #1, #3, #4, ...

........................................................................
.............................. CYCLE   11 ..............................
........................................................................
   1    -21.6755610 -0.216756E+02  0.584E-02    3.75       0.0  T
   2    -21.6755614 -0.363116E-06  0.337E-02    3.76       1.0  T
   3    -21.6755595  0.188931E-05  0.129E-02    3.76       1.8  T
   4    -21.6755617 -0.221642E-05  0.118E-03    3.76      19.9  T
   5    -21.6755617 -0.163048E-08  0.597E-04    3.76      39.5  T
   6    -21.6755617 -0.316991E-09  0.309E-04    3.76      76.4  T
     SCC iter.                  ...        0 min,  0.003 sec
     gradient                   ...        0 min,  0.005 sec
 * total energy  :   -21.3168966 Eh     change       -0.5328240E-05 Eh
   gradient norm :     0.0020925 Eh/α   predicted    -0.6446064E-05 (  20.98%)
   displ. norm   :     0.0207496 α      lambda       -0.8231157E-05
   maximum displ.:     0.0140310 α      in ANC's #3, #4, #2, ...

........................................................................
.............................. CYCLE   12 ..............................
........................................................................
   1    -21.6759807 -0.216760E+02  0.184E-02    3.76       0.0  T
   2    -21.6759808 -0.694465E-07  0.106E-02    3.75       2.2  T
   3    -21.6759808  0.329171E-08  0.144E-03    3.75      16.4  T
   4    -21.6759808 -0.161477E-07  0.629E-04    3.75      37.4  T
   5    -21.6759808 -0.436021E-08  0.268E-04    3.75      88.1  T
     SCC iter.                  ...        0 min,  0.003 sec
     gradient                   ...        0 min,  0.005 sec
 * total energy  :   -21.3169024 Eh     change       -0.5821854E-05 Eh
   gradient norm :     0.0008894 Eh/α   predicted    -0.4119216E-05 ( -29.25%)
   displ. norm   :     0.0422559 α      lambda       -0.6181135E-05
   maximum displ.:     0.0255956 α      in ANC's #2, #1, #3, ...

........................................................................
.............................. CYCLE   13 ..............................
........................................................................
   1    -21.6765374 -0.216765E+02  0.297E-02    3.75       0.0  T
   2    -21.6765375 -0.116115E-06  0.173E-02    3.75       1.4  T
   3    -21.6765375  0.480264E-07  0.225E-03    3.75      10.5  T
   4    -21.6765376 -0.610530E-07  0.108E-03    3.75      21.9  T
   5    -21.6765376 -0.137525E-07  0.312E-04    3.75      75.5  T
   6    -21.6765376 -0.220801E-10  0.870E-05    3.75     271.1  T
     SCC iter.                  ...        0 min,  0.003 sec
     gradient                   ...        0 min,  0.005 sec
 * total energy  :   -21.3169069 Eh     change       -0.4495102E-05 Eh
   gradient norm :     0.0007831 Eh/α   predicted    -0.3092346E-05 ( -31.21%)
   displ. norm   :     0.0387546 α      lambda       -0.3642678E-05
   maximum displ.:     0.0310774 α      in ANC's #1, #2, #6, ...

   *** GEOMETRY OPTIMIZATION CONVERGED AFTER 13 ITERATIONS ***

------------------------------------------------------------------------
 total energy gain   :        -0.0033157 Eh       -2.0806 kcal/mol
 total RMSD          :         0.2999860 a0        0.1587 Å
 total power (kW/mol):        -0.6696420 (step)  -55.3261 (real)
------------------------------------------------------------------------

 ANCopt (total)                0 d,  0 h,  0 min,  0.157 sec
 optimizer setup                ...        0 min,  0.000 sec (  0.088%)
 model hessian                  ...        0 min,  0.004 sec (  2.796%)
 ANC generation                 ...        0 min,  0.000 sec (  0.301%)
 coordinate transformation      ...        0 min,  0.000 sec (  0.106%)
 single point calculation       ...        0 min,  0.148 sec ( 93.877%)
 optimization log               ...        0 min,  0.001 sec (  0.652%)
 hessian update                 ...        0 min,  0.000 sec (  0.097%)
 rational function              ...        0 min,  0.002 sec (  1.559%)

================
 final structure:
================
$coord
    3.31872569078324    1.09369767818279   -2.51451779254318      C 
    4.83962365315098   -0.39963678505210   -1.20992258356562      C 
    5.37854872408451   -3.07968130459606   -1.93348931260040      C 
    6.17445801991180    0.49302308082611    1.14472031517221      C 
    8.88058568336067    0.24298757473291    0.85192368215398      N 
   10.44075526590333    0.02893093532897    2.91686927793489      C 
   12.88505452777990    0.59867944215986    2.95260138500818      C 
    2.36102388752857    0.45174745773256   -4.19080021765006      H 
    2.95095683975263    3.01512080856440   -1.95221297608358      H 
    4.55638451726585   -3.53724981414258   -3.75801951598103      H 
    4.60371276828801   -4.35972825330740   -0.51842070284950      H 
    7.41117818747341   -3.38806383467629   -2.00397949703694      H 
    5.60748544229234   -0.69618251554135    2.74108903077741      H 
    5.61261113970209    2.45119686050870    1.57250301870223      H 
    9.60723747055590    1.25665957736570   -0.59509314421020      H 
    9.53039256440552   -0.79048886452200    4.55579144933327      H 
   13.81977610114957    1.40796233838629    1.33754666368422      H 
   14.02659495141427    0.23395989908795    4.58908861119528      H 
$end
           -------------------------------------------------
          |                Final Singlepoint                |
           -------------------------------------------------

          ...................................................
          :                      SETUP                      :
          :.................................................:
          :  # basis functions                  39          :
          :  # atomic orbitals                  39          :
          :  # shells                           25          :
          :  # electrons                        40          :
          :  max. iterations                   250          :
          :  Hamiltonian                  GFN2-xTB          :
          :  restarted?                      false          :
          :  GBSA solvation                  false          :
          :  PC potential                    false          :
          :  electronic temp.          300.0000000     K    :
          :  accuracy                    1.0000000          :
          :  -> integral cutoff          0.2500000E+02      :
          :  -> integral neglect         0.1000000E-07      :
          :  -> SCF convergence          0.1000000E-05 Eh   :
          :  -> wf. convergence          0.1000000E-03 e    :
          :  Broyden damping             0.4000000          :
          ...................................................

 iter      E             dE          RMSdq      gap      omega  full diag
   1    -21.6765376 -0.216765E+02  0.551E-05    3.75       0.0  T
   2    -21.6765376 -0.549605E-11  0.294E-05    3.75     802.9  T
   3    -21.6765376 -0.157101E-10  0.180E-05    3.75    1308.6  T

   *** convergence criteria satisfied after 3 iterations ***

         #    Occupation            Energy/Eh            Energy/eV
      -------------------------------------------------------------
         1        2.0000           -0.6440692             -17.5260
       ...           ...                  ...                  ...
        14        2.0000           -0.4573956             -12.4464
        15        2.0000           -0.4463591             -12.1460
        16        2.0000           -0.4433952             -12.0654
        17        2.0000           -0.4314476             -11.7403
        18        2.0000           -0.4238124             -11.5325
        19        2.0000           -0.3979687             -10.8293
        20        2.0000           -0.3416251              -9.2961 (HOMO)
        21                         -0.2037361              -5.5439 (LUMO)
        22                         -0.1688766              -4.5954
        23                          0.0401620               1.0929
        24                          0.0860962               2.3428
        25                          0.1120021               3.0477
       ...                                ...                  ...
        39                          0.6382055              17.3665
      -------------------------------------------------------------
                  HL-Gap            0.1378890 Eh            3.7521 eV
             Fermi-level           -0.2726806 Eh           -7.4200 eV

 SCC (total)                   0 d,  0 h,  0 min,  0.010 sec
 SCC setup                      ...        0 min,  0.000 sec (  1.367%)
 Dispersion                     ...        0 min,  0.000 sec (  0.935%)
 integral evaluation            ...        0 min,  0.003 sec ( 25.543%)
 zeroth order Hamiltonian       ...        0 min,  0.000 sec (  0.573%)
 iterations                     ...        0 min,  0.002 sec ( 20.302%)
 molecular gradient             ...        0 min,  0.005 sec ( 48.595%)
 printout                       ...        0 min,  0.000 sec (  2.232%)

         :::::::::::::::::::::::::::::::::::::::::::::::::::::
         ::                     SUMMARY                     ::
         :::::::::::::::::::::::::::::::::::::::::::::::::::::
         :: total energy             -21.316906891081 Eh    ::
         :: gradient norm              0.000783792758 Eh/a0 ::
         :: HOMO-LUMO gap              3.752149567999 eV    ::
         ::.................................................::
         :: SCC energy               -21.676537568154 Eh    ::
         :: -> isotropic ES            0.009678077996 Eh    ::
         :: -> anisotropic ES          0.006345235665 Eh    ::
         :: -> anisotropic XC          0.016335474407 Eh    ::
         :: -> dispersion             -0.010952465721 Eh    ::
         :: repulsion energy           0.359618514081 Eh    ::
         :: add. restraining           0.000000000000 Eh    ::
         :::::::::::::::::::::::::::::::::::::::::::::::::::::

           -------------------------------------------------
          |                Property Printout                |
           -------------------------------------------------

    * Orbital Energies and Occupations

         #    Occupation            Energy/Eh            Energy/eV
      -------------------------------------------------------------
         1        2.0000           -0.6440692             -17.5260
       ...           ...                  ...                  ...
         8        2.0000           -0.5271419             -14.3443
         9        2.0000           -0.5095276             -13.8650
        10        2.0000           -0.5075801             -13.8120
        11        2.0000           -0.4865447             -13.2396
        12        2.0000           -0.4805127             -13.0754
        13        2.0000           -0.4675471             -12.7226
        14        2.0000           -0.4573956             -12.4464
        15        2.0000           -0.4463591             -12.1460
        16        2.0000           -0.4433952             -12.0654
        17        2.0000           -0.4314476             -11.7403
        18        2.0000           -0.4238124             -11.5325
        19        2.0000           -0.3979687             -10.8293
        20        2.0000           -0.3416251              -9.2961 (HOMO)
        21                         -0.2037361              -5.5439 (LUMO)
        22                         -0.1688766              -4.5954
        23                          0.0401620               1.0929
        24                          0.0860962               2.3428
        25                          0.1120021               3.0477
        26                          0.1172210               3.1897
        27                          0.1652708               4.4972
        28                          0.1786790               4.8621
        29                          0.1875946               5.1047
        30                          0.1970565               5.3622
        31                          0.2171497               5.9089
       ...                                ...                  ...
        39                          0.6382055              17.3665
      -------------------------------------------------------------
                  HL-Gap            0.1378890 Eh            3.7521 eV
             Fermi-level           -0.2726806 Eh           -7.4200 eV

     #   Z        covCN         q      C6AA      α(0)
     1   6 C      2.843    -0.107    30.701     9.081
     2   6 C      2.938     0.013    27.734     8.637
     3   6 C      3.759    -0.114    22.727     6.797
     4   6 C      3.746     0.005    20.561     6.468
     5   7 N      2.688    -0.183    24.957     7.420
     6   6 C      2.823     0.024    27.460     8.587
     7   6 C      2.839    -0.144    31.695     9.226
     8   1 H      0.926     0.037     2.484     2.464
     9   1 H      0.926     0.032     2.552     2.498
    10   1 H      0.925     0.044     2.400     2.423
    11   1 H      0.925     0.049     2.336     2.390
    12   1 H      0.925     0.058     2.223     2.331
    13   1 H      0.924     0.049     2.328     2.386
    14   1 H      0.923     0.023     2.687     2.563
    15   1 H      0.860     0.146     1.425     1.870
    16   1 H      0.925     0.025     2.656     2.549
    17   1 H      0.926     0.018     2.768     2.602
    18   1 H      0.926     0.024     2.670     2.555

 Mol. C6AA /au·bohr⁶  :       2802.016165
 Mol. C8AA /au·bohr⁸  :      61973.985832
 Mol. α(0) /au        :         82.845770


Wiberg/Mayer (AO) data.
largest (>0.10) Wiberg bond orders for each atom
          total WBO             WBO to atom ...
     1  C   3.988        C    2 1.934    H    8 0.975    H    9 0.975
     2  C   3.987        C    1 1.934    C    3 1.027    C    4 0.999
     3  C   3.996        C    2 1.027    H   10 0.985    H   12 0.970    H   11 0.969
     4  C   3.982        C    2 0.999    N    5 0.999    H   14 0.964    H   13 0.960
     5  N   3.319        C    6 1.157    C    4 0.999    H   15 0.948    C    7 0.154
     6  C   3.971        C    7 1.830    N    5 1.157    H   16 0.960
     7  C   3.968        C    6 1.830    H   18 0.979    H   17 0.977    N    5 0.154
     8  H   0.998        C    1 0.975
     9  H   0.999        C    1 0.975
    10  H   0.998        C    3 0.985
    11  H   0.998        C    3 0.969
    12  H   0.997        C    3 0.970
    13  H   0.998        C    4 0.960
    14  H   0.999        C    4 0.964
    15  H   0.979        N    5 0.948
    16  H   0.999        C    6 0.960
    17  H   1.000        C    7 0.977
    18  H   0.999        C    7 0.979

molecular dipole:
                 x           y           z       tot (Debye)
 q only:       -0.431      -0.131      -0.223
   full:       -0.429       0.041      -0.188       1.196
molecular quadrupole (traceless):
                xx          xy          yy          xz          yz          zz
 q only:       -9.149      -1.042       5.098      -4.919       0.019       4.050
  q+dip:       -9.664       1.300       4.877      -4.437      -1.042       4.787
   full:       -9.549       1.381       4.940      -4.901      -0.671       4.609

           -------------------------------------------------
          |                Geometry Summary                 |
           -------------------------------------------------

      molecular mass/u    :       97.1596000
   center of mass at/Å    :        3.9325022      -0.0859269       0.1634717
  moments of inertia/u·Å² :        0.7498394E+02   0.4120706E+03   0.4470762E+03
rotational constants/cm⁻¹ :        0.2248166E+00   0.4090958E-01   0.3770640E-01

 * 15 selected distances

     #   Z        #   Z                                     value/Å
     1   6 C      2   6 C                                 1.3224294
     4   6 C      5   7 N                                 1.4464433 (max)
     5   7 N      6   6 C                                 1.3742265
     6   6 C      7   6 C                                 1.3282759
     1   6 C      8   1 H                                 1.0766144
     1   6 C      9   1 H                                 1.0771465
     3   6 C     10   1 H                                 1.0863267
     3   6 C     11   1 H                                 1.0898110
     3   6 C     12   1 H                                 1.0885694
     4   6 C     13   1 H                                 1.0952897
     4   6 C     14   1 H                                 1.1015425
     5   7 N     15   1 H                                 1.0109102 (min)
     6   6 C     16   1 H                                 1.0827172
     7   6 C     17   1 H                                 1.0763321
     7   6 C     18   1 H                                 1.0733595

 * 4 distinct bonds (by element types)

   Z      Z             #   av. dist./Å        max./Å        min./Å
   1 H    6 C          10     1.0847709     1.1015425     1.0733595
   6 C    6 C           2     1.3253527     1.3282759     1.3224294
   1 H    7 N           1     1.0109102     1.0109102     1.0109102
   6 C    7 N           2     1.4103349     1.4464433     1.3742265


optimized geometry written to: xtbopt.xyz


           -------------------------------------------------
          | TOTAL ENERGY              -21.316906891081 Eh   |
          | GRADIENT NORM               0.000783792758 Eh/α |
          | HOMO-LUMO GAP               3.752149567999 eV   |
           -------------------------------------------------

------------------------------------------------------------------------
 * finished run on 2021/05/19 at 10:59:11.921     
------------------------------------------------------------------------
 total:
 * wall-time:     0 d,  0 h,  0 min,  0.200 sec
 *  cpu-time:     0 d,  0 h,  0 min,  0.198 sec
 * ratio c/w:     0.992 speedup
 SCF:
 * wall-time:     0 d,  0 h,  0 min,  0.016 sec
 *  cpu-time:     0 d,  0 h,  0 min,  0.016 sec
 * ratio c/w:     0.997 speedup
 ANC optimizer:
 * wall-time:     0 d,  0 h,  0 min,  0.168 sec
 *  cpu-time:     0 d,  0 h,  0 min,  0.168 sec
 * ratio c/w:     0.998 speedup

