      -----------------------------------------------------------      
     |                   =====================                   |     
     |                           x T B                           |     
     |                   =====================                   |     
     |                         S. Grimme                         |     
     |          Mulliken Center for Theoretical Chemistry        |     
     |                    University of Bonn                     |     
     |                Version 6.2 RC2 (SAW190805)                |     
      -----------------------------------------------------------      

   This program is distributed in the hope that it will be useful,
   but WITHOUT ANY WARRANTY; without even the implied warranty of
   MERCHANTABILITY or FITNESS FOR A PARTICULAR PURPOSE.
   
   FOR NON-COMMERCIAL, ACADEMIA USE ONLY.
   
   Cite this work as:
   * S. Grimme, C. Bannwarth, P. Shushkov, J. Chem. Theory Comput., 2017,
     13, 1989-2009. DOI: 10.1021/acs.jctc.7b00118
   * C. Bannwarth, S. Ehlert and S. Grimme., J. Chem. Theory Comput., 2019,
     15, 1652-1671. DOI: 10.1021/acs.jctc.8b01176
   * P. Pracht, E. Caldeweyher, S. Ehlert, S. Grimme, ChemRxiv, 2019, preprint.
     DOI: 10.26434/chemrxiv.8326202.v1
   
   for DFT-D4:
   * E. Caldeweyher, C. Bannwarth and S. Grimme, J. Chem. Phys., 2017,
     147, 034112. DOI: 10.1063/1.4993215
   * E. Caldeweyher, S. Ehlert, A. Hansen, H. Neugebauer, S. Spicher,
     C. Bannwarth and S. Grimme, J. Chem. Phys., 2019, 150, 154122.
     DOI: 10.1063/1.5090222
   
   for sTDA-xTB:
   * S. Grimme and C. Bannwarth, J. Chem. Phys., 2016, 145, 054103.
     DOI: 10.1063/1.4959605
   
   in the mass-spec context:
   * V. Asgeirsson, C. Bauer and S. Grimme, Chem. Sci., 2017, 8, 4879.
     DOI: 10.1039/c7sc00601b
   
   for metadynamics refer to:
   * S. Grimme, J. Chem. Theory Comput., 2019, 155, 2847-2862
     DOI: 10.1021/acs.jctc.9b00143
   
   with help from (in alphabetical order)
   C. Bannwarth, F. Bohle, G. Brandenburg, E. Caldeweyher, M. Checinski,
   S. Dohm, S. Ehlert, S. Ehrlich, F. März, H. Neugebauer, J. Pisarek,
   P. Pracht, P. Shushkov, and S. Spicher.
   
 * started run on 2021/05/19 at 10:59:12.298     

           -------------------------------------------------
          |                Calculation Setup                |
           -------------------------------------------------

          program call               : /ihome/ghutchison/geoffh/xtb/xtb 507.xyz -opt
          hostname                   : smp-n144
          coordinate file            : 507.xyz
          omp threads                :                     1
          number of atoms            :                    18
          number of electrons        :                    42
          charge                     :                     0
          spin                       :                   0.0
          first test random number   :      0.13947696232029


########################################################################
# WARNING! Please study the warnings concerning your input carefully
#  - the use of '-opt' is discouraged, please use '--opt' next time
########################################################################

           ------------------------------------------------- 
          |                 G F N 2 - x T B                 |
          | Geometry, Frequencies, Noncovalent interactions |
          |            JCTC 2019 parametrisation            |
           ------------------------------------------------- 
             KAB for C  - Si     :                1.0500
             KAB for H  - Pd     :                0.9500
             k(s)              :                1.8500
             k(p)              :                2.2300
             k(d)              :                2.2300
             k(f)              :                2.0000
             kEN (H0ij)        :               -2.0000
             D4 a1             :                0.5200
             D4 a2             :                5.0000
             D4 s6             :                1.0000
             D4 s8             :                2.7000
             D4 s9             :                5.0000
             alphaj            :                2.0000

  Z AO/shell   Hii/eV     exponent
  1     Wed Apr 25 08:07:45 CEST 2018   EN: 2.200 GM2: 0.406  GM3: 0.0800  RAES: 1.40
     1s    -10.707211    1.230000
  6     Wed Apr 25 08:07:45 CEST 2018   EN: 2.550 GM2: 0.538  GM3: 0.1500  RAES: 3.00
     2s    -13.970922    2.096432
     2p    -10.063292    1.800000

           ------------------------------------------------- 
          |        Self-Consistent Charge Iterations        |
           ------------------------------------------------- 

          ...................................................
          :                      SETUP                      :
          :.................................................:
          :  # basis functions                  42          :
          :  # atomic orbitals                  42          :
          :  # shells                           26          :
          :  # electrons                        42          :
          :  max. iterations                   250          :
          :  Hamiltonian                  GFN2-xTB          :
          :  restarted?                      false          :
          :  GBSA solvation                  false          :
          :  PC potential                    false          :
          :  electronic temp.          300.0000000     K    :
          :  accuracy                    1.0000000          :
          :  -> integral cutoff          0.2500000E+02      :
          :  -> integral neglect         0.1000000E-07      :
          :  -> SCF convergence          0.1000000E-05 Eh   :
          :  -> wf. convergence          0.1000000E-03 e    :
          :  Broyden damping             0.4000000          :
          ...................................................

 iter      E             dE          RMSdq      gap      omega  full diag
   1    -22.5866372 -0.225866E+02  0.402E+00    4.36       0.0  T
   2    -22.6079949 -0.213578E-01  0.237E+00    4.48       1.0  T
   3    -22.6073170  0.677942E-03  0.627E-01    4.25       1.0  T
   4    -22.6089007 -0.158374E-02  0.231E-01    4.45       1.0  T
   5    -22.6095384 -0.637684E-03  0.474E-02    4.39       1.0  T
   6    -22.6095401 -0.170735E-05  0.229E-02    4.39       1.0  T
   7    -22.6095404 -0.253237E-06  0.156E-03    4.39      15.1  T
   8    -22.6095404 -0.157105E-07  0.879E-04    4.39      26.8  T
   9    -22.6095404 -0.542474E-08  0.231E-04    4.39     102.2  T

   *** convergence criteria satisfied after 9 iterations ***

         #    Occupation            Energy/Eh            Energy/eV
      -------------------------------------------------------------
         1        2.0000           -0.6345583             -17.2672
       ...           ...                  ...                  ...
        15        2.0000           -0.4623715             -12.5818
        16        2.0000           -0.4446951             -12.1008
        17        2.0000           -0.4440439             -12.0830
        18        2.0000           -0.4190723             -11.4035
        19        2.0000           -0.4129761             -11.2377
        20        2.0000           -0.3927580             -10.6875
        21        2.0000           -0.3781366             -10.2896 (HOMO)
        22                         -0.2168022              -5.8995 (LUMO)
        23                         -0.2116615              -5.7596
        24                         -0.0914569              -2.4887
        25                          0.0977641               2.6603
        26                          0.1095078               2.9799
       ...                                ...                  ...
        42                          0.6317692              17.1913
      -------------------------------------------------------------
                  HL-Gap            0.1613344 Eh            4.3901 eV
             Fermi-level           -0.2974694 Eh           -8.0946 eV

 SCC (total)                   0 d,  0 h,  0 min,  0.017 sec
 SCC setup                      ...        0 min,  0.000 sec (  1.195%)
 Dispersion                     ...        0 min,  0.000 sec (  1.035%)
 integral evaluation            ...        0 min,  0.004 sec ( 20.996%)
 zeroth order Hamiltonian       ...        0 min,  0.000 sec (  0.480%)
 iterations                     ...        0 min,  0.007 sec ( 39.640%)
 molecular gradient             ...        0 min,  0.006 sec ( 34.622%)
 printout                       ...        0 min,  0.000 sec (  1.754%)

         :::::::::::::::::::::::::::::::::::::::::::::::::::::
         ::                     SUMMARY                     ::
         :::::::::::::::::::::::::::::::::::::::::::::::::::::
         :: total energy             -22.219556203387 Eh    ::
         :: gradient norm              0.028276050530 Eh/a0 ::
         :: HOMO-LUMO gap              4.390132086156 eV    ::
         ::.................................................::
         :: SCC energy               -22.609540398624 Eh    ::
         :: -> isotropic ES            0.002893790263 Eh    ::
         :: -> anisotropic ES          0.005029370716 Eh    ::
         :: -> anisotropic XC          0.015413634127 Eh    ::
         :: -> dispersion             -0.013108989815 Eh    ::
         :: repulsion energy           0.389975671609 Eh    ::
         :: add. restraining           0.000000000000 Eh    ::
         :::::::::::::::::::::::::::::::::::::::::::::::::::::

      ----------------------------------------------------------- 
     |                   =====================                   |
     |                        A N C O P T                        |
     |                   =====================                   |
     |               Approximate Normal Coordinate               |
     |                Rational Function Optimizer                |
      ----------------------------------------------------------- 

          ...................................................
          :                      SETUP                      :
          :.................................................:
          :   optimization level            normal          :
          :   max. optcycles                   200          :
          :   ANC micro-cycles                  20          :
          :   degrees of freedom                48          :
          :.................................................:
          :   RF solver                   davidson          :
          :   input Hessian                  false          :
          :   write xtbopt.log                true          :
          :   linear?                        false          :
          :   energy convergence         0.5000000E-05 Eh   :
          :   grad. convergence          0.1000000E-02 Eh/α :
          :   maximium RF displ.         2.0000000          :
          :   Hlow (freq-cutoff)         0.5000000E-02      :
          :   Hmax (freq-cutoff)         5.0000000          :
          :   S6 in model hess.         20.0000000          :
          ...................................................

generating ANC from model Hessian ...
Using Lindh-Hessian (1995)
 Shifting diagonal of input Hessian by   2.519304087312561E-003
 Lowest  eigenvalues of input Hessian
   -0.000000   -0.000000   -0.000000   -0.000000   -0.000000    0.000000
    0.005000    0.009890    0.011504    0.014051    0.014524    0.017168
    0.021633    0.023390    0.034914    0.036467    0.057654    0.061886
 Highest eigenvalues
    1.352230    1.509851    1.573276    1.822042    1.900985    1.940143
 

........................................................................
.............................. CYCLE    1 ..............................
........................................................................
   1    -22.6095404 -0.226095E+02  0.349E-05    4.39       0.0  T
   2    -22.6095404 -0.375877E-11  0.213E-05    4.39    1106.9  T
   3    -22.6095404 -0.285993E-11  0.127E-05    4.39    1852.6  T
     SCC iter.                  ...        0 min,  0.002 sec
     gradient                   ...        0 min,  0.006 sec
 * total energy  :   -22.2195563 Eh     change       -0.5470877E-07 Eh
   gradient norm :     0.0282771 Eh/α   predicted     0.0000000E+00 (-100.00%)
   displ. norm   :     0.1092540 α      lambda       -0.2304798E-02
   maximum displ.:     0.0662678 α      in ANC's #26, #28, #13, ...

........................................................................
.............................. CYCLE    2 ..............................
........................................................................
   1    -22.6308123 -0.226308E+02  0.801E-02    4.50       0.0  T
   2    -22.6308163 -0.408258E-05  0.478E-02    4.50       1.0  T
   3    -22.6308160  0.379051E-06  0.102E-02    4.50       2.3  T
   4    -22.6308165 -0.576422E-06  0.223E-03    4.50      10.6  T
   5    -22.6308166 -0.582152E-07  0.775E-04    4.50      30.4  T
     SCC iter.                  ...        0 min,  0.003 sec
     gradient                   ...        0 min,  0.006 sec
 * total energy  :   -22.2208948 Eh     change       -0.1338544E-02 Eh
   gradient norm :     0.0067178 Eh/α   predicted    -0.1166154E-02 ( -12.88%)
   displ. norm   :     0.0231919 α      lambda       -0.8656248E-04
   maximum displ.:     0.0139615 α      in ANC's #26, #28, #16, ...

........................................................................
.............................. CYCLE    3 ..............................
........................................................................
   1    -22.6345329 -0.226345E+02  0.179E-02    4.52       0.0  T
   2    -22.6345331 -0.254524E-06  0.106E-02    4.52       2.2  T
   3    -22.6345330  0.101481E-06  0.443E-03    4.52       5.3  T
   4    -22.6345332 -0.174101E-06  0.485E-04    4.52      48.5  T
   5    -22.6345332 -0.680512E-09  0.199E-04    4.52     118.4  T
     SCC iter.                  ...        0 min,  0.003 sec
     gradient                   ...        0 min,  0.006 sec
 * total energy  :   -22.2209412 Eh     change       -0.4638477E-04 Eh
   gradient norm :     0.0018674 Eh/α   predicted    -0.4330477E-04 (  -6.64%)
   displ. norm   :     0.0063641 α      lambda       -0.3541533E-05
   maximum displ.:     0.0044793 α      in ANC's #16, #5, #8, ...

........................................................................
.............................. CYCLE    4 ..............................
........................................................................
   1    -22.6344215 -0.226344E+02  0.467E-03    4.52       0.0  T
   2    -22.6344215 -0.609711E-07  0.292E-03    4.52       8.1  T
   3    -22.6344216 -0.133703E-07  0.163E-03    4.52      14.4  T
   4    -22.6344216 -0.797582E-08  0.173E-04    4.52     136.0  T
   5    -22.6344216 -0.557208E-10  0.698E-05    4.52     337.8  T
     SCC iter.                  ...        0 min,  0.003 sec
     gradient                   ...        0 min,  0.006 sec
 * total energy  :   -22.2209438 Eh     change       -0.2607764E-05 Eh
   gradient norm :     0.0002879 Eh/α   predicted    -0.1770631E-05 ( -32.10%)
   displ. norm   :     0.0016064 α      lambda       -0.1901997E-06
   maximum displ.:     0.0010131 α      in ANC's #26, #16, #1, ...

   *** GEOMETRY OPTIMIZATION CONVERGED AFTER 4 ITERATIONS ***

------------------------------------------------------------------------
 total energy gain   :        -0.0013876 Eh       -0.8707 kcal/mol
 total RMSD          :         0.0311531 a0        0.0165 Å
 total power (kW/mol):        -0.9107799 (step)  -66.6275 (real)
------------------------------------------------------------------------

 ANCopt (total)                0 d,  0 h,  0 min,  0.055 sec
 optimizer setup                ...        0 min,  0.000 sec (  0.252%)
 model hessian                  ...        0 min,  0.003 sec (  4.796%)
 ANC generation                 ...        0 min,  0.001 sec (  0.942%)
 coordinate transformation      ...        0 min,  0.000 sec (  0.101%)
 single point calculation       ...        0 min,  0.049 sec ( 90.255%)
 optimization log               ...        0 min,  0.000 sec (  0.629%)
 hessian update                 ...        0 min,  0.000 sec (  0.083%)
 rational function              ...        0 min,  0.001 sec (  2.327%)

================
 final structure:
================
$coord
    1.29046327573856    2.25772928387816    0.00270923094462      C 
    2.64915357681686    0.01395002207545    0.00489762853852      C 
    5.48228990286710    0.00329582746341    0.00990442596478      C 
    1.31397299647439   -2.24643875935431    0.00384147142861      C 
   -1.29857346815749   -2.26267534755698    0.00097918251347      C 
   -2.65731217291545   -0.01877518327646   -0.00095287361957      C 
   -1.32216151737850    2.24149176008673   -0.00021746906549      C 
   -5.49043821608865   -0.00832502599016   -0.00393461651513      C 
    2.28690400785565    4.04128855038885    0.00321897692476      H 
    6.22554083132617    1.91812253910644   -0.00952445212631      H 
    6.19958981397128   -0.99736802011353   -1.64017711657593      H 
    6.19288516953377   -0.96008234398149    1.68510806966222      H 
    2.33645768880758   -4.01512442628754    0.00530670514768      H 
   -2.29514718843382   -4.04614370420967    0.00024626987841      H 
   -2.34447383014681    4.01028631160564   -0.00192886404384      H 
   -6.23353358259048   -1.92328207207277   -0.00148156350931      H 
   -6.20274681153038    0.97090057599345   -1.66910491460635      H 
   -6.20622963750152    0.97660917161983    1.65634994828504      H 
$end
           -------------------------------------------------
          |                Final Singlepoint                |
           -------------------------------------------------

          ...................................................
          :                      SETUP                      :
          :.................................................:
          :  # basis functions                  42          :
          :  # atomic orbitals                  42          :
          :  # shells                           26          :
          :  # electrons                        42          :
          :  max. iterations                   250          :
          :  Hamiltonian                  GFN2-xTB          :
          :  restarted?                      false          :
          :  GBSA solvation                  false          :
          :  PC potential                    false          :
          :  electronic temp.          300.0000000     K    :
          :  accuracy                    1.0000000          :
          :  -> integral cutoff          0.2500000E+02      :
          :  -> integral neglect         0.1000000E-07      :
          :  -> SCF convergence          0.1000000E-05 Eh   :
          :  -> wf. convergence          0.1000000E-03 e    :
          :  Broyden damping             0.4000000          :
          ...................................................

 iter      E             dE          RMSdq      gap      omega  full diag
   1    -22.6344216 -0.226344E+02  0.301E-05    4.52       0.0  T
   2    -22.6344216 -0.416023E-11  0.136E-05    4.52    1731.3  T
   3    -22.6344216 -0.308020E-11  0.935E-06    4.52    2519.6  T

   *** convergence criteria satisfied after 3 iterations ***

         #    Occupation            Energy/Eh            Energy/eV
      -------------------------------------------------------------
         1        2.0000           -0.6376121             -17.3503
       ...           ...                  ...                  ...
        15        2.0000           -0.4633430             -12.6082
        16        2.0000           -0.4465199             -12.1504
        17        2.0000           -0.4457654             -12.1299
        18        2.0000           -0.4197195             -11.4211
        19        2.0000           -0.4112766             -11.1914
        20        2.0000           -0.3947060             -10.7405
        21        2.0000           -0.3793920             -10.3238 (HOMO)
        22                         -0.2132808              -5.8037 (LUMO)
        23                         -0.2095109              -5.7011
        24                         -0.0844535              -2.2981
        25                          0.1068728               2.9082
        26                          0.1120859               3.0500
       ...                                ...                  ...
        42                          0.6639195              18.0662
      -------------------------------------------------------------
                  HL-Gap            0.1661112 Eh            4.5201 eV
             Fermi-level           -0.2963364 Eh           -8.0637 eV

 SCC (total)                   0 d,  0 h,  0 min,  0.012 sec
 SCC setup                      ...        0 min,  0.000 sec (  1.163%)
 Dispersion                     ...        0 min,  0.000 sec (  0.916%)
 integral evaluation            ...        0 min,  0.003 sec ( 26.511%)
 zeroth order Hamiltonian       ...        0 min,  0.000 sec (  0.562%)
 iterations                     ...        0 min,  0.002 sec ( 18.941%)
 molecular gradient             ...        0 min,  0.006 sec ( 49.409%)
 printout                       ...        0 min,  0.000 sec (  2.095%)

         :::::::::::::::::::::::::::::::::::::::::::::::::::::
         ::                     SUMMARY                     ::
         :::::::::::::::::::::::::::::::::::::::::::::::::::::
         :: total energy             -22.220943787685 Eh    ::
         :: gradient norm              0.000287851429 Eh/a0 ::
         :: HOMO-LUMO gap              4.520116347952 eV    ::
         ::.................................................::
         :: SCC energy               -22.634421566213 Eh    ::
         :: -> isotropic ES            0.002998447092 Eh    ::
         :: -> anisotropic ES          0.004718166797 Eh    ::
         :: -> anisotropic XC          0.014589582096 Eh    ::
         :: -> dispersion             -0.013166298818 Eh    ::
         :: repulsion energy           0.413470826072 Eh    ::
         :: add. restraining           0.000000000000 Eh    ::
         :::::::::::::::::::::::::::::::::::::::::::::::::::::

           -------------------------------------------------
          |                Property Printout                |
           -------------------------------------------------

    * Orbital Energies and Occupations

         #    Occupation            Energy/Eh            Energy/eV
      -------------------------------------------------------------
         1        2.0000           -0.6376121             -17.3503
       ...           ...                  ...                  ...
         9        2.0000           -0.5025440             -13.6749
        10        2.0000           -0.4927957             -13.4097
        11        2.0000           -0.4885691             -13.2946
        12        2.0000           -0.4831212             -13.1464
        13        2.0000           -0.4689245             -12.7601
        14        2.0000           -0.4669707             -12.7069
        15        2.0000           -0.4633430             -12.6082
        16        2.0000           -0.4465199             -12.1504
        17        2.0000           -0.4457654             -12.1299
        18        2.0000           -0.4197195             -11.4211
        19        2.0000           -0.4112766             -11.1914
        20        2.0000           -0.3947060             -10.7405
        21        2.0000           -0.3793920             -10.3238 (HOMO)
        22                         -0.2132808              -5.8037 (LUMO)
        23                         -0.2095109              -5.7011
        24                         -0.0844535              -2.2981
        25                          0.1068728               2.9082
        26                          0.1120859               3.0500
        27                          0.1509885               4.1086
        28                          0.1647703               4.4836
        29                          0.1663477               4.5266
        30                          0.1817622               4.9460
        31                          0.1946791               5.2975
        32                          0.2093918               5.6978
       ...                                ...                  ...
        42                          0.6639195              18.0662
      -------------------------------------------------------------
                  HL-Gap            0.1661112 Eh            4.5201 eV
             Fermi-level           -0.2963364 Eh           -8.0637 eV

     #   Z        covCN         q      C6AA      α(0)
     1   6 C      2.924    -0.041    29.019     8.834
     2   6 C      2.966     0.012    27.740     8.639
     3   6 C      3.757    -0.108    22.610     6.779
     4   6 C      2.925    -0.042    29.035     8.837
     5   6 C      2.924    -0.041    29.019     8.834
     6   6 C      2.966     0.012    27.740     8.639
     7   6 C      2.925    -0.042    29.035     8.837
     8   6 C      3.757    -0.108    22.610     6.779
     9   1 H      0.926     0.026     2.644     2.543
    10   1 H      0.925     0.039     2.465     2.455
    11   1 H      0.925     0.043     2.407     2.426
    12   1 H      0.925     0.043     2.406     2.425
    13   1 H      0.926     0.027     2.631     2.536
    14   1 H      0.926     0.026     2.644     2.543
    15   1 H      0.926     0.027     2.631     2.536
    16   1 H      0.925     0.039     2.465     2.455
    17   1 H      0.925     0.043     2.406     2.426
    18   1 H      0.925     0.043     2.406     2.426

 Mol. C6AA /au·bohr⁶  :       3292.357822
 Mol. C8AA /au·bohr⁸  :      77556.949327
 Mol. α(0) /au        :         90.950399


Wiberg/Mayer (AO) data.
largest (>0.10) Wiberg bond orders for each atom
          total WBO             WBO to atom ...
     1  C   3.992        C    7 1.450    C    2 1.411    H    9 0.969    C    5 0.106
     2  C   3.989        C    1 1.411    C    4 1.409    C    3 1.024    C    6 0.106
     3  C   3.997        C    2 1.024    H   10 0.986    H   11 0.974    H   12 0.974
     4  C   3.992        C    5 1.450    C    2 1.409    H   13 0.970    C    7 0.111
     5  C   3.992        C    4 1.450    C    6 1.411    H   14 0.969    C    1 0.106
     6  C   3.989        C    5 1.411    C    7 1.409    C    8 1.024    C    2 0.106
     7  C   3.992        C    1 1.450    C    6 1.409    H   15 0.970    C    4 0.111
     8  C   3.997        C    6 1.024    H   16 0.986    H   18 0.974    H   17 0.974
     9  H   0.999        C    1 0.969
    10  H   0.998        C    3 0.986
    11  H   0.998        C    3 0.974
    12  H   0.998        C    3 0.974
    13  H   0.999        C    4 0.970
    14  H   0.999        C    5 0.969
    15  H   0.999        C    7 0.970
    16  H   0.998        C    8 0.986
    17  H   0.998        C    8 0.974
    18  H   0.998        C    8 0.974

molecular dipole:
                 x           y           z       tot (Debye)
 q only:       -0.000      -0.000       0.000
   full:       -0.000      -0.000       0.001       0.002
molecular quadrupole (traceless):
                xx          xy          yy          xz          yz          zz
 q only:        2.732      -0.213      -0.728       0.009      -0.001      -2.003
  q+dip:        3.595      -0.415       1.819       0.017      -0.002      -5.414
   full:        2.885      -0.375       0.229       0.014      -0.001      -3.115

           -------------------------------------------------
          |                Geometry Summary                 |
           -------------------------------------------------

      molecular mass/u    :      106.1670000
   center of mass at/Å    :       -0.0021568      -0.0013068       0.0011721
  moments of inertia/u·Å² :        0.9283759E+02   0.3472784E+03   0.4338735E+03
rotational constants/cm⁻¹ :        0.1815820E+00   0.4854213E-01   0.3885380E-01

 * 16 selected distances

     #   Z        #   Z                                     value/Å
     1   6 C      2   6 C                                 1.3880784
     2   6 C      4   6 C                                 1.3892355 (max)
     4   6 C      5   6 C                                 1.3825277
     5   6 C      6   6 C                                 1.3881463
     1   6 C      7   6 C                                 1.3825692
     6   6 C      7   6 C                                 1.3891719
     1   6 C      9   1 H                                 1.0811259
     3   6 C     10   1 H                                 1.0869874
     3   6 C     11   1 H                                 1.0894649
     3   6 C     12   1 H                                 1.0895592
     4   6 C     13   1 H                                 1.0810932 (min)
     5   6 C     14   1 H                                 1.0811182
     7   6 C     15   1 H                                 1.0810976
     8   6 C     16   1 H                                 1.0869740
     8   6 C     17   1 H                                 1.0895217
     8   6 C     18   1 H                                 1.0895139

 * 2 distinct bonds (by element types)

   Z      Z             #   av. dist./Å        max./Å        min./Å
   1 H    6 C          10     1.0856456     1.0895592     1.0810932
   6 C    6 C           6     1.3866215     1.3892355     1.3825277


optimized geometry written to: xtbopt.xyz


           -------------------------------------------------
          | TOTAL ENERGY              -22.220943787685 Eh   |
          | GRADIENT NORM               0.000287851429 Eh/α |
          | HOMO-LUMO GAP               4.520116347952 eV   |
           -------------------------------------------------

------------------------------------------------------------------------
 * finished run on 2021/05/19 at 10:59:12.398     
------------------------------------------------------------------------
 total:
 * wall-time:     0 d,  0 h,  0 min,  0.100 sec
 *  cpu-time:     0 d,  0 h,  0 min,  0.099 sec
 * ratio c/w:     0.987 speedup
 SCF:
 * wall-time:     0 d,  0 h,  0 min,  0.017 sec
 *  cpu-time:     0 d,  0 h,  0 min,  0.017 sec
 * ratio c/w:     0.998 speedup
 ANC optimizer:
 * wall-time:     0 d,  0 h,  0 min,  0.067 sec
 *  cpu-time:     0 d,  0 h,  0 min,  0.067 sec
 * ratio c/w:     0.998 speedup

