      -----------------------------------------------------------      
     |                   =====================                   |     
     |                           x T B                           |     
     |                   =====================                   |     
     |                         S. Grimme                         |     
     |          Mulliken Center for Theoretical Chemistry        |     
     |                    University of Bonn                     |     
     |                Version 6.2 RC2 (SAW190805)                |     
      -----------------------------------------------------------      

   This program is distributed in the hope that it will be useful,
   but WITHOUT ANY WARRANTY; without even the implied warranty of
   MERCHANTABILITY or FITNESS FOR A PARTICULAR PURPOSE.
   
   FOR NON-COMMERCIAL, ACADEMIA USE ONLY.
   
   Cite this work as:
   * S. Grimme, C. Bannwarth, P. Shushkov, J. Chem. Theory Comput., 2017,
     13, 1989-2009. DOI: 10.1021/acs.jctc.7b00118
   * C. Bannwarth, S. Ehlert and S. Grimme., J. Chem. Theory Comput., 2019,
     15, 1652-1671. DOI: 10.1021/acs.jctc.8b01176
   * P. Pracht, E. Caldeweyher, S. Ehlert, S. Grimme, ChemRxiv, 2019, preprint.
     DOI: 10.26434/chemrxiv.8326202.v1
   
   for DFT-D4:
   * E. Caldeweyher, C. Bannwarth and S. Grimme, J. Chem. Phys., 2017,
     147, 034112. DOI: 10.1063/1.4993215
   * E. Caldeweyher, S. Ehlert, A. Hansen, H. Neugebauer, S. Spicher,
     C. Bannwarth and S. Grimme, J. Chem. Phys., 2019, 150, 154122.
     DOI: 10.1063/1.5090222
   
   for sTDA-xTB:
   * S. Grimme and C. Bannwarth, J. Chem. Phys., 2016, 145, 054103.
     DOI: 10.1063/1.4959605
   
   in the mass-spec context:
   * V. Asgeirsson, C. Bauer and S. Grimme, Chem. Sci., 2017, 8, 4879.
     DOI: 10.1039/c7sc00601b
   
   for metadynamics refer to:
   * S. Grimme, J. Chem. Theory Comput., 2019, 155, 2847-2862
     DOI: 10.1021/acs.jctc.9b00143
   
   with help from (in alphabetical order)
   C. Bannwarth, F. Bohle, G. Brandenburg, E. Caldeweyher, M. Checinski,
   S. Dohm, S. Ehlert, S. Ehrlich, F. März, H. Neugebauer, J. Pisarek,
   P. Pracht, P. Shushkov, and S. Spicher.
   
 * started run on 2021/05/19 at 10:58:31.009     

           -------------------------------------------------
          |                Calculation Setup                |
           -------------------------------------------------

          program call               : /ihome/ghutchison/geoffh/xtb/xtb 51.xyz -opt
          hostname                   : smp-n58
          coordinate file            : 51.xyz
          omp threads                :                     1
          number of atoms            :                    17
          number of electrons        :                    46
          charge                     :                     0
          spin                       :                   0.0
          first test random number   :      0.06310468230578


########################################################################
# WARNING! Please study the warnings concerning your input carefully
#  - the use of '-opt' is discouraged, please use '--opt' next time
########################################################################

           ------------------------------------------------- 
          |                 G F N 2 - x T B                 |
          | Geometry, Frequencies, Noncovalent interactions |
          |            JCTC 2019 parametrisation            |
           ------------------------------------------------- 
             KAB for C  - Si     :                1.0500
             KAB for H  - Pd     :                0.9500
             k(s)              :                1.8500
             k(p)              :                2.2300
             k(d)              :                2.2300
             k(f)              :                2.0000
             kEN (H0ij)        :               -2.0000
             D4 a1             :                0.5200
             D4 a2             :                5.0000
             D4 s6             :                1.0000
             D4 s8             :                2.7000
             D4 s9             :                5.0000
             alphaj            :                2.0000

  Z AO/shell   Hii/eV     exponent
  1     Wed Apr 25 08:07:45 CEST 2018   EN: 2.200 GM2: 0.406  GM3: 0.0800  RAES: 1.40
     1s    -10.707211    1.230000
  6     Wed Apr 25 08:07:45 CEST 2018   EN: 2.550 GM2: 0.538  GM3: 0.1500  RAES: 3.00
     2s    -13.970922    2.096432
     2p    -10.063292    1.800000
 16     Tue Apr 24 11:44:34 CEST 2018   EN: 2.580 GM2: 0.340  GM3:-0.0502  RAES: 3.10
     3s    -20.029654    1.981333
     3p    -11.377694    2.025643
     3d     -0.420282    1.702555

           ------------------------------------------------- 
          |        Self-Consistent Charge Iterations        |
           ------------------------------------------------- 

          ...................................................
          :                      SETUP                      :
          :.................................................:
          :  # basis functions                  50          :
          :  # atomic orbitals                  49          :
          :  # shells                           27          :
          :  # electrons                        46          :
          :  max. iterations                   250          :
          :  Hamiltonian                  GFN2-xTB          :
          :  restarted?                      false          :
          :  GBSA solvation                  false          :
          :  PC potential                    false          :
          :  electronic temp.          300.0000000     K    :
          :  accuracy                    1.0000000          :
          :  -> integral cutoff          0.2500000E+02      :
          :  -> integral neglect         0.1000000E-07      :
          :  -> SCF convergence          0.1000000E-05 Eh   :
          :  -> wf. convergence          0.1000000E-03 e    :
          :  Broyden damping             0.4000000          :
          ...................................................

 iter      E             dE          RMSdq      gap      omega  full diag
   1    -24.7479277 -0.247479E+02  0.394E+00    2.77       0.0  T
   2    -24.7661328 -0.182050E-01  0.230E+00    2.78       1.0  T
   3    -24.7622310  0.390179E-02  0.823E-01    2.75       1.0  T
   4    -24.7670127 -0.478178E-02  0.405E-01    2.76       1.0  T
   5    -24.7684936 -0.148091E-02  0.112E-01    2.75       1.0  T
   6    -24.7685178 -0.241767E-04  0.682E-02    2.75       1.0  T
   7    -24.7685675 -0.496323E-04  0.187E-02    2.75       1.3  T
   8    -24.7685677 -0.197084E-06  0.858E-03    2.75       2.8  T
   9    -24.7685677 -0.912934E-07  0.464E-03    2.75       5.2  T
  10    -24.7685679 -0.179343E-06  0.214E-03    2.75      11.3  T
  11    -24.7685679 -0.198980E-07  0.646E-04    2.75      37.6  T
  12    -24.7685679 -0.125145E-08  0.349E-04    2.75      69.4  T

   *** convergence criteria satisfied after 12 iterations ***

         #    Occupation            Energy/Eh            Energy/eV
      -------------------------------------------------------------
         1        2.0000           -0.7281319             -19.8135
       ...           ...                  ...                  ...
        17        2.0000           -0.4453557             -12.1187
        18        2.0000           -0.4429559             -12.0534
        19        2.0000           -0.4322580             -11.7623
        20        2.0000           -0.4253979             -11.5757
        21        2.0000           -0.4213733             -11.4662
        22        2.0000           -0.3934367             -10.7060
        23        2.0000           -0.3583351              -9.7508 (HOMO)
        24                         -0.2571200              -6.9966 (LUMO)
        25                         -0.1973309              -5.3696
        26                         -0.1827823              -4.9738
        27                         -0.1400662              -3.8114
        28                         -0.1193435              -3.2475
       ...                                ...                  ...
        49                          0.8150312              22.1781
      -------------------------------------------------------------
                  HL-Gap            0.1012151 Eh            2.7542 eV
             Fermi-level           -0.3077276 Eh           -8.3737 eV

 SCC (total)                   0 d,  0 h,  0 min,  0.022 sec
 SCC setup                      ...        0 min,  0.000 sec (  1.065%)
 Dispersion                     ...        0 min,  0.000 sec (  0.951%)
 integral evaluation            ...        0 min,  0.005 sec ( 21.950%)
 zeroth order Hamiltonian       ...        0 min,  0.000 sec (  0.483%)
 iterations                     ...        0 min,  0.008 sec ( 39.056%)
 molecular gradient             ...        0 min,  0.008 sec ( 35.044%)
 printout                       ...        0 min,  0.000 sec (  1.227%)

         :::::::::::::::::::::::::::::::::::::::::::::::::::::
         ::                     SUMMARY                     ::
         :::::::::::::::::::::::::::::::::::::::::::::::::::::
         :: total energy             -24.359044993680 Eh    ::
         :: gradient norm              0.091686367942 Eh/a0 ::
         :: HOMO-LUMO gap              2.754203759957 eV    ::
         ::.................................................::
         :: SCC energy               -24.768567943776 Eh    ::
         :: -> isotropic ES            0.002372098368 Eh    ::
         :: -> anisotropic ES          0.003044100519 Eh    ::
         :: -> anisotropic XC          0.013529377000 Eh    ::
         :: -> dispersion             -0.014454875759 Eh    ::
         :: repulsion energy           0.409535798186 Eh    ::
         :: add. restraining           0.000000000000 Eh    ::
         :::::::::::::::::::::::::::::::::::::::::::::::::::::

      ----------------------------------------------------------- 
     |                   =====================                   |
     |                        A N C O P T                        |
     |                   =====================                   |
     |               Approximate Normal Coordinate               |
     |                Rational Function Optimizer                |
      ----------------------------------------------------------- 

          ...................................................
          :                      SETUP                      :
          :.................................................:
          :   optimization level            normal          :
          :   max. optcycles                   200          :
          :   ANC micro-cycles                  20          :
          :   degrees of freedom                45          :
          :.................................................:
          :   RF solver                   davidson          :
          :   input Hessian                  false          :
          :   write xtbopt.log                true          :
          :   linear?                        false          :
          :   energy convergence         0.5000000E-05 Eh   :
          :   grad. convergence          0.1000000E-02 Eh/α :
          :   maximium RF displ.         2.0000000          :
          :   Hlow (freq-cutoff)         0.5000000E-02      :
          :   Hmax (freq-cutoff)         5.0000000          :
          :   S6 in model hess.         20.0000000          :
          ...................................................

generating ANC from model Hessian ...
Using Lindh-Hessian (1995)
 Shifting diagonal of input Hessian by   3.256632007098766E-003
 Lowest  eigenvalues of input Hessian
   -0.000000   -0.000000   -0.000000   -0.000000    0.000000    0.000000
    0.005000    0.007085    0.011262    0.012043    0.014789    0.028629
    0.033484    0.039004    0.043578    0.044919    0.047336    0.057809
 Highest eigenvalues
    1.478067    1.626599    1.796154    1.934675    2.083696    2.159881
 

........................................................................
.............................. CYCLE    1 ..............................
........................................................................
   1    -24.7685679 -0.247686E+02  0.833E-05    2.75       0.0  T
   2    -24.7685679 -0.342837E-10  0.443E-05    2.75     547.5  T
   3    -24.7685679 -0.155964E-10  0.276E-05    2.75     877.9  T
     SCC iter.                  ...        0 min,  0.002 sec
     gradient                   ...        0 min,  0.007 sec
 * total energy  :   -24.3590450 Eh     change       -0.7214222E-08 Eh
   gradient norm :     0.0916854 Eh/α   predicted     0.0000000E+00 (-100.00%)
   displ. norm   :     0.3245026 α      lambda       -0.1329968E-01
   maximum displ.:     0.1827806 α      in ANC's #9, #7, #8, ...

........................................................................
.............................. CYCLE    2 ..............................
........................................................................
   1    -24.7656811 -0.247657E+02  0.255E-01    2.80       0.0  T
   2    -24.7656880 -0.694137E-05  0.216E-01    2.79       1.0  T
   3    -24.7659596 -0.271541E-03  0.105E-01    2.80       1.0  T
   4    -24.7659829 -0.233342E-04  0.275E-02    2.80       1.0  T
   5    -24.7659885 -0.561655E-05  0.117E-02    2.80       2.1  T
   6    -24.7659888 -0.212161E-06  0.468E-03    2.80       5.2  T
   7    -24.7659890 -0.262991E-06  0.102E-03    2.80      23.9  T
     SCC iter.                  ...        0 min,  0.004 sec
     gradient                   ...        0 min,  0.006 sec
 * total energy  :   -24.3679416 Eh     change       -0.8896561E-02 Eh
   gradient norm :     0.0427157 Eh/α   predicted    -0.7350081E-02 ( -17.38%)
   displ. norm   :     0.1714341 α      lambda       -0.3269469E-02
   maximum displ.:     0.0988643 α      in ANC's #7, #9, #8, ...

........................................................................
.............................. CYCLE    3 ..............................
........................................................................
   1    -24.7627195 -0.247627E+02  0.176E-01    2.85       0.0  T
   2    -24.7627120  0.755661E-05  0.151E-01    2.84       1.0  T
   3    -24.7628683 -0.156354E-03  0.694E-02    2.84       1.0  T
   4    -24.7628792 -0.108344E-04  0.178E-02    2.84       1.4  T
   5    -24.7628805 -0.136822E-05  0.809E-03    2.84       3.0  T
   6    -24.7628807 -0.205130E-06  0.183E-03    2.84      13.2  T
   7    -24.7628808 -0.964206E-08  0.117E-03    2.84      20.7  T
     SCC iter.                  ...        0 min,  0.004 sec
     gradient                   ...        0 min,  0.007 sec
 * total energy  :   -24.3698603 Eh     change       -0.1918760E-02 Eh
   gradient norm :     0.0155809 Eh/α   predicted    -0.1682776E-02 ( -12.30%)
   displ. norm   :     0.0839746 α      lambda       -0.3011536E-03
   maximum displ.:     0.0531085 α      in ANC's #2, #1, #3, ...

........................................................................
.............................. CYCLE    4 ..............................
........................................................................
   1    -24.7618597 -0.247619E+02  0.742E-02    2.85       0.0  T
   2    -24.7618591  0.635979E-06  0.507E-02    2.85       1.0  T
   3    -24.7618626 -0.349136E-05  0.337E-02    2.86       1.0  T
   4    -24.7618716 -0.896546E-05  0.545E-03    2.86       4.4  T
   5    -24.7618716 -0.710476E-08  0.220E-03    2.86      11.0  T
   6    -24.7618716 -0.220456E-07  0.938E-04    2.86      25.9  T
     SCC iter.                  ...        0 min,  0.004 sec
     gradient                   ...        0 min,  0.007 sec
 * total energy  :   -24.3700617 Eh     change       -0.2013993E-03 Eh
   gradient norm :     0.0080028 Eh/α   predicted    -0.1516375E-03 ( -24.71%)
   displ. norm   :     0.0954547 α      lambda       -0.1268448E-03
   maximum displ.:     0.0642758 α      in ANC's #2, #1, #3, ...

........................................................................
.............................. CYCLE    5 ..............................
........................................................................
   1    -24.7615708 -0.247616E+02  0.808E-02    2.86       0.0  T
   2    -24.7615716 -0.731310E-06  0.471E-02    2.86       1.0  T
   3    -24.7615604  0.112129E-04  0.340E-02    2.86       1.0  T
   4    -24.7615741 -0.137349E-04  0.503E-03    2.86       4.8  T
   5    -24.7615742 -0.820486E-07  0.213E-03    2.86      11.4  T
   6    -24.7615742 -0.245194E-07  0.819E-04    2.86      29.6  T
     SCC iter.                  ...        0 min,  0.004 sec
     gradient                   ...        0 min,  0.007 sec
 * total energy  :   -24.3701448 Eh     change       -0.8309059E-04 Eh
   gradient norm :     0.0031076 Eh/α   predicted    -0.6400059E-04 ( -22.97%)
   displ. norm   :     0.0995156 α      lambda       -0.6614895E-04
   maximum displ.:     0.0676295 α      in ANC's #2, #1, #4, ...

........................................................................
.............................. CYCLE    6 ..............................
........................................................................
   1    -24.7616638 -0.247617E+02  0.774E-02    2.85       0.0  T
   2    -24.7616647 -0.942149E-06  0.432E-02    2.85       1.0  T
   3    -24.7616641  0.661155E-06  0.990E-03    2.85       2.4  T
   4    -24.7616649 -0.774843E-06  0.476E-03    2.85       5.1  T
   5    -24.7616650 -0.108223E-06  0.215E-03    2.85      11.3  T
   6    -24.7616650 -0.516725E-07  0.552E-04    2.85      43.9  T
   7    -24.7616650 -0.295692E-08  0.239E-04    2.85     101.7  T
     SCC iter.                  ...        0 min,  0.004 sec
     gradient                   ...        0 min,  0.007 sec
 * total energy  :   -24.3701875 Eh     change       -0.4264572E-04 Eh
   gradient norm :     0.0036789 Eh/α   predicted    -0.3340153E-04 ( -21.68%)
   displ. norm   :     0.0879400 α      lambda       -0.4784019E-04
   maximum displ.:     0.0605840 α      in ANC's #1, #2, #4, ...

........................................................................
.............................. CYCLE    7 ..............................
........................................................................
   1    -24.7619829 -0.247620E+02  0.639E-02    2.85       0.0  T
   2    -24.7619832 -0.291127E-06  0.371E-02    2.85       1.0  T
   3    -24.7619806  0.257956E-05  0.146E-02    2.85       1.7  T
   4    -24.7619834 -0.284469E-05  0.254E-03    2.85       9.6  T
   5    -24.7619834 -0.228397E-07  0.117E-03    2.85      20.7  T
   6    -24.7619834 -0.673070E-08  0.322E-04    2.85      75.4  T
   7    -24.7619834 -0.112236E-08  0.129E-04    2.85     187.8  T
     SCC iter.                  ...        0 min,  0.004 sec
     gradient                   ...        0 min,  0.007 sec
 * total energy  :   -24.3702244 Eh     change       -0.3697499E-04 Eh
   gradient norm :     0.0045631 Eh/α   predicted    -0.2410688E-04 ( -34.80%)
   displ. norm   :     0.1188720 α      lambda       -0.5458614E-04
   maximum displ.:     0.0811529 α      in ANC's #2, #1, #4, ...

........................................................................
.............................. CYCLE    8 ..............................
........................................................................
   1    -24.7621970 -0.247622E+02  0.887E-02    2.84       0.0  T
   2    -24.7621975 -0.462026E-06  0.506E-02    2.84       1.0  T
   3    -24.7621908  0.662557E-05  0.240E-02    2.84       1.0  T
   4    -24.7621982 -0.738899E-05  0.413E-03    2.84       5.9  T
   5    -24.7621982 -0.794466E-08  0.102E-03    2.84      23.7  T
   6    -24.7621982 -0.102122E-07  0.395E-04    2.84      61.5  T
     SCC iter.                  ...        0 min,  0.004 sec
     gradient                   ...        0 min,  0.007 sec
 * total energy  :   -24.3702695 Eh     change       -0.4505530E-04 Eh
   gradient norm :     0.0042599 Eh/α   predicted    -0.2767769E-04 ( -38.57%)
   displ. norm   :     0.1557727 α      lambda       -0.6042593E-04
   maximum displ.:     0.1064519 α      in ANC's #1, #2, #4, ...

........................................................................
.............................. CYCLE    9 ..............................
........................................................................
   1    -24.7620870 -0.247621E+02  0.109E-01    2.84       0.0  T
   2    -24.7620876 -0.642551E-06  0.622E-02    2.84       1.0  T
   3    -24.7620832  0.438627E-05  0.202E-02    2.84       1.2  T
   4    -24.7620881 -0.487489E-05  0.481E-03    2.84       5.0  T
   5    -24.7620882 -0.685277E-07  0.107E-03    2.84      22.6  T
   6    -24.7620882 -0.978085E-08  0.445E-04    2.84      54.5  T
     SCC iter.                  ...        0 min,  0.004 sec
     gradient                   ...        0 min,  0.007 sec
 * total energy  :   -24.3703172 Eh     change       -0.4766420E-04 Eh
   gradient norm :     0.0030555 Eh/α   predicted    -0.3094615E-04 ( -35.07%)
   displ. norm   :     0.1800411 α      lambda       -0.4993696E-04
   maximum displ.:     0.1236842 α      in ANC's #1, #2, #4, ...

........................................................................
.............................. CYCLE   10 ..............................
........................................................................
   1    -24.7617288 -0.247617E+02  0.128E-01    2.83       0.0  T
   2    -24.7617299 -0.107024E-05  0.727E-02    2.83       1.0  T
   3    -24.7617296  0.325541E-06  0.105E-02    2.83       2.3  T
   4    -24.7617298 -0.254846E-06  0.680E-03    2.83       3.6  T
   5    -24.7617302 -0.385269E-06  0.159E-03    2.83      15.3  T
   6    -24.7617303 -0.311080E-07  0.391E-04    2.83      62.1  T
   7    -24.7617303 -0.528495E-09  0.223E-04    2.83     108.8  T
     SCC iter.                  ...        0 min,  0.005 sec
     gradient                   ...        0 min,  0.007 sec
 * total energy  :   -24.3703512 Eh     change       -0.3404174E-04 Eh
   gradient norm :     0.0026444 Eh/α   predicted    -0.2577527E-04 ( -24.28%)
   displ. norm   :     0.1164018 α      lambda       -0.2312787E-04
   maximum displ.:     0.0824378 α      in ANC's #1, #2, #4, ...

........................................................................
.............................. CYCLE   11 ..............................
........................................................................
   1    -24.7620966 -0.247621E+02  0.769E-02    2.83       0.0  T
   2    -24.7620969 -0.318491E-06  0.444E-02    2.83       1.0  T
   3    -24.7620965  0.321493E-06  0.650E-03    2.83       3.7  T
   4    -24.7620969 -0.334177E-06  0.360E-03    2.83       6.7  T
   5    -24.7620970 -0.104453E-06  0.975E-04    2.83      24.9  T
   6    -24.7620970 -0.814400E-08  0.206E-04    2.83     117.7  T
     SCC iter.                  ...        0 min,  0.004 sec
     gradient                   ...        0 min,  0.007 sec
 * total energy  :   -24.3703658 Eh     change       -0.1458744E-04 Eh
   gradient norm :     0.0017375 Eh/α   predicted    -0.1172154E-04 ( -19.65%)
   displ. norm   :     0.0858650 α      lambda       -0.6900503E-05
   maximum displ.:     0.0596482 α      in ANC's #1, #2, #4, ...

........................................................................
.............................. CYCLE   12 ..............................
........................................................................
   1    -24.7623997 -0.247624E+02  0.625E-02    2.84       0.0  T
   2    -24.7624000 -0.252140E-06  0.356E-02    2.84       1.0  T
   3    -24.7623993  0.631786E-06  0.832E-03    2.84       2.9  T
   4    -24.7624001 -0.718528E-06  0.318E-03    2.84       7.6  T
   5    -24.7624001 -0.384759E-07  0.768E-04    2.84      31.6  T
   6    -24.7624001 -0.858639E-08  0.226E-04    2.84     107.4  T
     SCC iter.                  ...        0 min,  0.004 sec
     gradient                   ...        0 min,  0.007 sec
 * total energy  :   -24.3703704 Eh     change       -0.4583316E-05 Eh
   gradient norm :     0.0010403 Eh/α   predicted    -0.3460785E-05 ( -24.49%)
   displ. norm   :     0.0114910 α      lambda       -0.1784225E-05
   maximum displ.:     0.0082803 α      in ANC's #2, #7, #1, ...

........................................................................
.............................. CYCLE   13 ..............................
........................................................................
   1    -24.7625596 -0.247626E+02  0.776E-03    2.84       0.0  T
   2    -24.7625596 -0.326928E-07  0.433E-03    2.84       5.6  T
   3    -24.7625596  0.128576E-07  0.158E-03    2.84      15.4  T
   4    -24.7625596 -0.123164E-07  0.809E-04    2.84      30.0  T
   5    -24.7625596 -0.523566E-08  0.271E-04    2.84      89.5  T
     SCC iter.                  ...        0 min,  0.004 sec
     gradient                   ...        0 min,  0.007 sec
 * total energy  :   -24.3703710 Eh     change       -0.6295396E-06 Eh
   gradient norm :     0.0008264 Eh/α   predicted    -0.8934403E-06 (  41.92%)
   displ. norm   :     0.0049788 α      lambda       -0.6988261E-06
   maximum displ.:     0.0031125 α      in ANC's #1, #3, #6, ...

   *** GEOMETRY OPTIMIZATION CONVERGED AFTER 13 ITERATIONS ***

------------------------------------------------------------------------
 total energy gain   :        -0.0113260 Eh       -7.1072 kcal/mol
 total RMSD          :         0.2941397 a0        0.1557 Å
 total power (kW/mol):        -2.2874160 (step) -137.8465 (real)
------------------------------------------------------------------------

 ANCopt (total)                0 d,  0 h,  0 min,  0.216 sec
 optimizer setup                ...        0 min,  0.000 sec (  0.052%)
 model hessian                  ...        0 min,  0.002 sec (  0.948%)
 ANC generation                 ...        0 min,  0.000 sec (  0.197%)
 coordinate transformation      ...        0 min,  0.000 sec (  0.078%)
 single point calculation       ...        0 min,  0.209 sec ( 96.785%)
 optimization log               ...        0 min,  0.001 sec (  0.443%)
 hessian update                 ...        0 min,  0.000 sec (  0.062%)
 rational function              ...        0 min,  0.002 sec (  1.062%)

================
 final structure:
================
$coord
   -2.15160824267814   -0.18549288008857   -0.36618516316070      C 
   -0.53757652288337    1.88854925906765   -0.10754851698842      C 
    0.00424068051808    4.68994790719423    0.03642097576232      C 
    2.84262081543706    3.96157292022206    0.37710895624759      C 
    1.94998534883537    1.27473263616720    0.19281789550754      C 
    2.47524064637226   -1.91006390215903    0.17748066889895      S 
   -0.79111450315291   -2.40803039148162   -0.24990960324769      C 
   -1.65858435413995   -4.97605042673467   -0.42412004776278      C 
   -4.04561722491262   -5.70016591024238   -0.74615378762176      C 
   -4.16424993717577   -0.12418468383235   -0.62090726933660      H 
   -0.82904500011586    5.64840241817817    1.65366484376453      H 
   -0.40605558214803    5.74013961566268   -1.68314219095637      H 
    3.66275045202688    4.48967422727273    2.18913303174369      H 
    4.08519246467109    4.57771286261316   -1.14328871082840      H 
   -0.18669409364650   -6.39022181176925   -0.27473703192215      H 
   -5.57238798059860   -4.36667667263273   -0.90631440360927      H 
   -4.54537815445556   -7.66722071679491   -0.85685666971800      H 
$end
           -------------------------------------------------
          |                Final Singlepoint                |
           -------------------------------------------------

          ...................................................
          :                      SETUP                      :
          :.................................................:
          :  # basis functions                  50          :
          :  # atomic orbitals                  49          :
          :  # shells                           27          :
          :  # electrons                        46          :
          :  max. iterations                   250          :
          :  Hamiltonian                  GFN2-xTB          :
          :  restarted?                      false          :
          :  GBSA solvation                  false          :
          :  PC potential                    false          :
          :  electronic temp.          300.0000000     K    :
          :  accuracy                    1.0000000          :
          :  -> integral cutoff          0.2500000E+02      :
          :  -> integral neglect         0.1000000E-07      :
          :  -> SCF convergence          0.1000000E-05 Eh   :
          :  -> wf. convergence          0.1000000E-03 e    :
          :  Broyden damping             0.4000000          :
          ...................................................

 iter      E             dE          RMSdq      gap      omega  full diag
   1    -24.7625596 -0.247626E+02  0.187E-04    2.84       0.0  T
   2    -24.7625596 -0.148255E-10  0.683E-05    2.84     355.1  T
   3    -24.7625596 -0.493081E-10  0.865E-05    2.84     280.5  T

   *** convergence criteria satisfied after 3 iterations ***

         #    Occupation            Energy/Eh            Energy/eV
      -------------------------------------------------------------
         1        2.0000           -0.7234905             -19.6872
       ...           ...                  ...                  ...
        17        2.0000           -0.4462222             -12.1423
        18        2.0000           -0.4439756             -12.0812
        19        2.0000           -0.4310824             -11.7303
        20        2.0000           -0.4253925             -11.5755
        21        2.0000           -0.4206995             -11.4478
        22        2.0000           -0.3912971             -10.6477
        23        2.0000           -0.3630170              -9.8782 (HOMO)
        24                         -0.2586791              -7.0390 (LUMO)
        25                         -0.1999274              -5.4403
        26                         -0.1879607              -5.1147
        27                         -0.1387210              -3.7748
        28                         -0.1301649              -3.5420
       ...                                ...                  ...
        49                          0.6883789              18.7317
      -------------------------------------------------------------
                  HL-Gap            0.1043379 Eh            2.8392 eV
             Fermi-level           -0.3108481 Eh           -8.4586 eV

 SCC (total)                   0 d,  0 h,  0 min,  0.015 sec
 SCC setup                      ...        0 min,  0.000 sec (  1.009%)
 Dispersion                     ...        0 min,  0.000 sec (  0.732%)
 integral evaluation            ...        0 min,  0.004 sec ( 30.488%)
 zeroth order Hamiltonian       ...        0 min,  0.000 sec (  0.575%)
 iterations                     ...        0 min,  0.002 sec ( 16.489%)
 molecular gradient             ...        0 min,  0.007 sec ( 48.826%)
 printout                       ...        0 min,  0.000 sec (  1.566%)

         :::::::::::::::::::::::::::::::::::::::::::::::::::::
         ::                     SUMMARY                     ::
         :::::::::::::::::::::::::::::::::::::::::::::::::::::
         :: total energy             -24.370370995368 Eh    ::
         :: gradient norm              0.000826905160 Eh/a0 ::
         :: HOMO-LUMO gap              2.839179454016 eV    ::
         ::.................................................::
         :: SCC energy               -24.762559592065 Eh    ::
         :: -> isotropic ES            0.002384597365 Eh    ::
         :: -> anisotropic ES          0.003005082718 Eh    ::
         :: -> anisotropic XC          0.013470218372 Eh    ::
         :: -> dispersion             -0.014495401528 Eh    ::
         :: repulsion energy           0.392206754548 Eh    ::
         :: add. restraining           0.000000000000 Eh    ::
         :::::::::::::::::::::::::::::::::::::::::::::::::::::

           -------------------------------------------------
          |                Property Printout                |
           -------------------------------------------------

    * Orbital Energies and Occupations

         #    Occupation            Energy/Eh            Energy/eV
      -------------------------------------------------------------
         1        2.0000           -0.7234905             -19.6872
       ...           ...                  ...                  ...
        11        2.0000           -0.5236109             -14.2482
        12        2.0000           -0.4971294             -13.5276
        13        2.0000           -0.4858553             -13.2208
        14        2.0000           -0.4742044             -12.9038
        15        2.0000           -0.4708729             -12.8131
        16        2.0000           -0.4658143             -12.6755
        17        2.0000           -0.4462222             -12.1423
        18        2.0000           -0.4439756             -12.0812
        19        2.0000           -0.4310824             -11.7303
        20        2.0000           -0.4253925             -11.5755
        21        2.0000           -0.4206995             -11.4478
        22        2.0000           -0.3912971             -10.6477
        23        2.0000           -0.3630170              -9.8782 (HOMO)
        24                         -0.2586791              -7.0390 (LUMO)
        25                         -0.1999274              -5.4403
        26                         -0.1879607              -5.1147
        27                         -0.1387210              -3.7748
        28                         -0.1301649              -3.5420
        29                         -0.0124341              -0.3383
        30                          0.0187713               0.5108
        31                          0.0301080               0.8193
        32                          0.0356517               0.9701
        33                          0.0378203               1.0291
        34                          0.1173167               3.1923
       ...                                ...                  ...
        49                          0.6883789              18.7317
      -------------------------------------------------------------
                  HL-Gap            0.1043379 Eh            2.8392 eV
             Fermi-level           -0.3108481 Eh           -8.4586 eV

     #   Z        covCN         q      C6AA      α(0)
     1   6 C      3.042    -0.054    29.291     8.877
     2   6 C      3.441    -0.023    23.698     7.390
     3   6 C      4.123    -0.053    21.444     6.577
     4   6 C      4.065    -0.051    21.411     6.573
     5   6 C      3.310     0.005    25.949     8.132
     6  16 S      2.269    -0.057   143.407    20.155
     7   6 C      3.017     0.020    27.536     8.608
     8   6 C      2.929    -0.029    28.734     8.791
     9   6 C      2.840    -0.092    30.312     9.023
    10   1 H      0.926     0.039     2.456     2.451
    11   1 H      0.925     0.044     2.402     2.424
    12   1 H      0.925     0.044     2.402     2.424
    13   1 H      0.925     0.045     2.380     2.412
    14   1 H      0.925     0.045     2.380     2.412
    15   1 H      0.925     0.041     2.438     2.442
    16   1 H      0.926     0.038     2.477     2.461
    17   1 H      0.926     0.039     2.462     2.453

 Mol. C6AA /au·bohr⁶  :       4236.358919
 Mol. C8AA /au·bohr⁸  :     119536.930856
 Mol. α(0) /au        :        103.603999


Wiberg/Mayer (AO) data.
largest (>0.10) Wiberg bond orders for each atom
          total WBO             WBO to atom ...
     1  C   3.987        C    7 1.504    C    2 1.306    H   10 0.961
     2  C   3.973        C    5 1.515    C    1 1.306    C    3 0.992
     3  C   3.990        C    2 0.992    C    4 0.990    H   12 0.971    H   11 0.971
     4  C   3.990        C    5 1.012    C    3 0.990    H   13 0.968    H   14 0.968
     5  C   3.936        C    2 1.515    S    6 1.188    C    4 1.012    C    7 0.108
     6  S   2.616        C    5 1.188    C    7 1.118
     7  C   3.944        C    1 1.504    C    8 1.142    S    6 1.118    C    5 0.108
     8  C   3.991        C    9 1.853    C    7 1.142    H   15 0.964
     9  C   3.987        C    8 1.853    H   17 0.978    H   16 0.976
    10  H   0.998        C    1 0.961
    11  H   0.998        C    3 0.971
    12  H   0.998        C    3 0.971
    13  H   0.996        C    4 0.968
    14  H   0.996        C    4 0.968
    15  H   0.998        C    8 0.964
    16  H   0.999        C    9 0.976
    17  H   0.998        C    9 0.978

molecular dipole:
                 x           y           z       tot (Debye)
 q only:       -0.006       0.427       0.011
   full:       -0.161       0.621      -0.004       1.630
molecular quadrupole (traceless):
                xx          xy          yy          xz          yz          zz
 q only:       -0.520       1.507       2.486       0.227       0.252      -1.966
  q+dip:       -0.115       2.641       3.468       0.509       0.429      -3.353
   full:       -0.799       2.744       2.807       0.249       0.392      -2.008

           -------------------------------------------------
          |                Geometry Summary                 |
           -------------------------------------------------

      molecular mass/u    :      136.2112000
   center of mass at/Å    :        0.0724058      -0.2983242      -0.0444068
  moments of inertia/u·Å² :        0.1435979E+03   0.5131543E+03   0.6503698E+03
rotational constants/cm⁻¹ :        0.1173947E+00   0.3285100E-01   0.2592007E-01

 * 17 selected distances

     #   Z        #   Z                                     value/Å
     1   6 C      2   6 C                                 1.3974330
     2   6 C      3   6 C                                 1.5118297
     3   6 C      4   6 C                                 1.5611178
     2   6 C      5   6 C                                 1.3651291
     4   6 C      5   6 C                                 1.5013974
     5   6 C      6  16 S                                 1.7081082 (max)
     1   6 C      7   6 C                                 1.3803451
     7   6 C      8   6 C                                 1.4373355
     8   6 C      9   6 C                                 1.3309597
     1   6 C     10   1 H                                 1.0740302 (min)
     3   6 C     11   1 H                                 1.0881611
     3   6 C     12   1 H                                 1.0881180
     4   6 C     13   1 H                                 1.0889916
     4   6 C     14   1 H                                 1.0890285
     8   6 C     15   1 H                                 1.0830252
     9   6 C     16   1 H                                 1.0760496
     9   6 C     17   1 H                                 1.0755872

 * 3 distinct bonds (by element types)

   Z      Z             #   av. dist./Å        max./Å        min./Å
   1 H    6 C           8     1.0828739     1.0890285     1.0740302
   6 C    6 C           8     1.4356934     1.5611178     1.3309597
   6 C   16 S           1     1.7081082     1.7081082     1.7081082


optimized geometry written to: xtbopt.xyz


           -------------------------------------------------
          | TOTAL ENERGY              -24.370370995368 Eh   |
          | GRADIENT NORM               0.000826905160 Eh/α |
          | HOMO-LUMO GAP               2.839179454016 eV   |
           -------------------------------------------------

------------------------------------------------------------------------
 * finished run on 2021/05/19 at 10:58:31.277     
------------------------------------------------------------------------
 total:
 * wall-time:     0 d,  0 h,  0 min,  0.268 sec
 *  cpu-time:     0 d,  0 h,  0 min,  0.268 sec
 * ratio c/w:     0.999 speedup
 SCF:
 * wall-time:     0 d,  0 h,  0 min,  0.022 sec
 *  cpu-time:     0 d,  0 h,  0 min,  0.022 sec
 * ratio c/w:     1.000 speedup
 ANC optimizer:
 * wall-time:     0 d,  0 h,  0 min,  0.231 sec
 *  cpu-time:     0 d,  0 h,  0 min,  0.231 sec
 * ratio c/w:     1.000 speedup

