      -----------------------------------------------------------      
     |                   =====================                   |     
     |                           x T B                           |     
     |                   =====================                   |     
     |                         S. Grimme                         |     
     |          Mulliken Center for Theoretical Chemistry        |     
     |                    University of Bonn                     |     
     |                Version 6.2 RC2 (SAW190805)                |     
      -----------------------------------------------------------      

   This program is distributed in the hope that it will be useful,
   but WITHOUT ANY WARRANTY; without even the implied warranty of
   MERCHANTABILITY or FITNESS FOR A PARTICULAR PURPOSE.
   
   FOR NON-COMMERCIAL, ACADEMIA USE ONLY.
   
   Cite this work as:
   * S. Grimme, C. Bannwarth, P. Shushkov, J. Chem. Theory Comput., 2017,
     13, 1989-2009. DOI: 10.1021/acs.jctc.7b00118
   * C. Bannwarth, S. Ehlert and S. Grimme., J. Chem. Theory Comput., 2019,
     15, 1652-1671. DOI: 10.1021/acs.jctc.8b01176
   * P. Pracht, E. Caldeweyher, S. Ehlert, S. Grimme, ChemRxiv, 2019, preprint.
     DOI: 10.26434/chemrxiv.8326202.v1
   
   for DFT-D4:
   * E. Caldeweyher, C. Bannwarth and S. Grimme, J. Chem. Phys., 2017,
     147, 034112. DOI: 10.1063/1.4993215
   * E. Caldeweyher, S. Ehlert, A. Hansen, H. Neugebauer, S. Spicher,
     C. Bannwarth and S. Grimme, J. Chem. Phys., 2019, 150, 154122.
     DOI: 10.1063/1.5090222
   
   for sTDA-xTB:
   * S. Grimme and C. Bannwarth, J. Chem. Phys., 2016, 145, 054103.
     DOI: 10.1063/1.4959605
   
   in the mass-spec context:
   * V. Asgeirsson, C. Bauer and S. Grimme, Chem. Sci., 2017, 8, 4879.
     DOI: 10.1039/c7sc00601b
   
   for metadynamics refer to:
   * S. Grimme, J. Chem. Theory Comput., 2019, 155, 2847-2862
     DOI: 10.1021/acs.jctc.9b00143
   
   with help from (in alphabetical order)
   C. Bannwarth, F. Bohle, G. Brandenburg, E. Caldeweyher, M. Checinski,
   S. Dohm, S. Ehlert, S. Ehrlich, F. März, H. Neugebauer, J. Pisarek,
   P. Pracht, P. Shushkov, and S. Spicher.
   
 * started run on 2021/05/19 at 10:59:13.827     

           -------------------------------------------------
          |                Calculation Setup                |
           -------------------------------------------------

          program call               : /ihome/ghutchison/geoffh/xtb/xtb 510.xyz -opt
          hostname                   : smp-n144
          coordinate file            : 510.xyz
          omp threads                :                     1
          number of atoms            :                    29
          number of electrons        :                    78
          charge                     :                     0
          spin                       :                   0.0
          first test random number   :      0.23518924554395


########################################################################
# WARNING! Please study the warnings concerning your input carefully
#  - the use of '-opt' is discouraged, please use '--opt' next time
########################################################################

           ------------------------------------------------- 
          |                 G F N 2 - x T B                 |
          | Geometry, Frequencies, Noncovalent interactions |
          |            JCTC 2019 parametrisation            |
           ------------------------------------------------- 
             KAB for C  - Si     :                1.0500
             KAB for H  - Pd     :                0.9500
             k(s)              :                1.8500
             k(p)              :                2.2300
             k(d)              :                2.2300
             k(f)              :                2.0000
             kEN (H0ij)        :               -2.0000
             D4 a1             :                0.5200
             D4 a2             :                5.0000
             D4 s6             :                1.0000
             D4 s8             :                2.7000
             D4 s9             :                5.0000
             alphaj            :                2.0000

  Z AO/shell   Hii/eV     exponent
  1     Wed Apr 25 08:07:45 CEST 2018   EN: 2.200 GM2: 0.406  GM3: 0.0800  RAES: 1.40
     1s    -10.707211    1.230000
  6     Wed Apr 25 08:07:45 CEST 2018   EN: 2.550 GM2: 0.538  GM3: 0.1500  RAES: 3.00
     2s    -13.970922    2.096432
     2p    -10.063292    1.800000
 16     Tue Apr 24 11:44:34 CEST 2018   EN: 2.580 GM2: 0.340  GM3:-0.0502  RAES: 3.10
     3s    -20.029654    1.981333
     3p    -11.377694    2.025643
     3d     -0.420282    1.702555

           ------------------------------------------------- 
          |        Self-Consistent Charge Iterations        |
           ------------------------------------------------- 

          ...................................................
          :                      SETUP                      :
          :.................................................:
          :  # basis functions                  86          :
          :  # atomic orbitals                  84          :
          :  # shells                           46          :
          :  # electrons                        78          :
          :  max. iterations                   250          :
          :  Hamiltonian                  GFN2-xTB          :
          :  restarted?                      false          :
          :  GBSA solvation                  false          :
          :  PC potential                    false          :
          :  electronic temp.          300.0000000     K    :
          :  accuracy                    1.0000000          :
          :  -> integral cutoff          0.2500000E+02      :
          :  -> integral neglect         0.1000000E-07      :
          :  -> SCF convergence          0.1000000E-05 Eh   :
          :  -> wf. convergence          0.1000000E-03 e    :
          :  Broyden damping             0.4000000          :
          ...................................................

 iter      E             dE          RMSdq      gap      omega  full diag
   1    -41.9962288 -0.419962E+02  0.373E+00    3.16       0.0  T
   2    -42.0278567 -0.316280E-01  0.219E+00    3.15       1.0  T
   3    -42.0106273  0.172294E-01  0.114E+00    3.05       1.0  T
   4    -42.0342364 -0.236090E-01  0.455E-01    3.06       1.0  T
   5    -42.0365039 -0.226750E-02  0.180E-01    3.03       1.0  T
   6    -42.0369413 -0.437437E-03  0.833E-02    3.05       1.0  T
   7    -42.0370474 -0.106134E-03  0.218E-02    3.05       1.0  T
   8    -42.0370487 -0.124855E-05  0.141E-02    3.05       1.3  T
   9    -42.0370511 -0.241404E-05  0.449E-03    3.05       4.1  T
  10    -42.0370512 -0.124003E-06  0.175E-03    3.05      10.6  T
  11    -42.0370512 -0.157739E-08  0.113E-03    3.05      16.4  T
  12    -42.0370512 -0.226757E-07  0.403E-04    3.05      46.1  T
  13    -42.0370512 -0.279591E-09  0.168E-04    3.05     110.4  T

   *** convergence criteria satisfied after 13 iterations ***

         #    Occupation            Energy/Eh            Energy/eV
      -------------------------------------------------------------
         1        2.0000           -0.7286069             -19.8264
       ...           ...                  ...                  ...
        33        2.0000           -0.4338984             -11.8070
        34        2.0000           -0.4313316             -11.7371
        35        2.0000           -0.4236401             -11.5278
        36        2.0000           -0.3909383             -10.6380
        37        2.0000           -0.3871421             -10.5347
        38        2.0000           -0.3743489             -10.1866
        39        2.0000           -0.3660690              -9.9612 (HOMO)
        40                         -0.2538880              -6.9086 (LUMO)
        41                         -0.2326322              -6.3302
        42                         -0.2200024              -5.9866
        43                         -0.1951065              -5.3091
        44                         -0.1883398              -5.1250
       ...                                ...                  ...
        84                          0.7012261              19.0813
      -------------------------------------------------------------
                  HL-Gap            0.1121810 Eh            3.0526 eV
             Fermi-level           -0.3099785 Eh           -8.4349 eV

 SCC (total)                   0 d,  0 h,  0 min,  0.052 sec
 SCC setup                      ...        0 min,  0.000 sec (  0.672%)
 Dispersion                     ...        0 min,  0.000 sec (  0.901%)
 integral evaluation            ...        0 min,  0.013 sec ( 25.569%)
 zeroth order Hamiltonian       ...        0 min,  0.000 sec (  0.413%)
 iterations                     ...        0 min,  0.020 sec ( 38.249%)
 molecular gradient             ...        0 min,  0.017 sec ( 33.271%)
 printout                       ...        0 min,  0.000 sec (  0.824%)

         :::::::::::::::::::::::::::::::::::::::::::::::::::::
         ::                     SUMMARY                     ::
         :::::::::::::::::::::::::::::::::::::::::::::::::::::
         :: total energy             -41.413431036616 Eh    ::
         :: gradient norm              0.059829867012 Eh/a0 ::
         :: HOMO-LUMO gap              3.052599726277 eV    ::
         ::.................................................::
         :: SCC energy               -42.037051233838 Eh    ::
         :: -> isotropic ES            0.003755635371 Eh    ::
         :: -> anisotropic ES          0.005215301030 Eh    ::
         :: -> anisotropic XC          0.023060284593 Eh    ::
         :: -> dispersion             -0.028267518140 Eh    ::
         :: repulsion energy           0.623776662782 Eh    ::
         :: add. restraining           0.000000000000 Eh    ::
         :::::::::::::::::::::::::::::::::::::::::::::::::::::

      ----------------------------------------------------------- 
     |                   =====================                   |
     |                        A N C O P T                        |
     |                   =====================                   |
     |               Approximate Normal Coordinate               |
     |                Rational Function Optimizer                |
      ----------------------------------------------------------- 

          ...................................................
          :                      SETUP                      :
          :.................................................:
          :   optimization level            normal          :
          :   max. optcycles                   200          :
          :   ANC micro-cycles                  20          :
          :   degrees of freedom                81          :
          :.................................................:
          :   RF solver                   davidson          :
          :   input Hessian                  false          :
          :   write xtbopt.log                true          :
          :   linear?                        false          :
          :   energy convergence         0.5000000E-05 Eh   :
          :   grad. convergence          0.1000000E-02 Eh/α :
          :   maximium RF displ.         2.0000000          :
          :   Hlow (freq-cutoff)         0.5000000E-02      :
          :   Hmax (freq-cutoff)         5.0000000          :
          :   S6 in model hess.         20.0000000          :
          ...................................................

generating ANC from model Hessian ...
Using Lindh-Hessian (1995)
 Shifting diagonal of input Hessian by   4.578850009775946E-003
 Lowest  eigenvalues of input Hessian
   -0.000000   -0.000000   -0.000000   -0.000000   -0.000000    0.000000
    0.005000    0.005321    0.005552    0.006647    0.008313    0.008813
    0.010922    0.011351    0.013156    0.016110    0.016807    0.019155
 Highest eigenvalues
    1.623008    1.759675    1.787000    1.799437    1.854713    2.010596
 

........................................................................
.............................. CYCLE    1 ..............................
........................................................................
   1    -42.0370512 -0.420371E+02  0.520E-05    3.05       0.0  T
   2    -42.0370512 -0.721911E-11  0.332E-05    3.05     559.5  T
   3    -42.0370512 -0.755307E-11  0.238E-05    3.05     779.6  T
     SCC iter.                  ...        0 min,  0.005 sec
     gradient                   ...        0 min,  0.017 sec
 * total energy  :   -41.4134310 Eh     change       -0.2035058E-08 Eh
   gradient norm :     0.0598299 Eh/α   predicted     0.0000000E+00 (-100.00%)
   displ. norm   :     0.3124127 α      lambda       -0.6538639E-02
   maximum displ.:     0.1485539 α      in ANC's #13, #5, #15, ...

........................................................................
.............................. CYCLE    2 ..............................
........................................................................
   1    -42.0660063 -0.420660E+02  0.227E-01    3.13       0.0  T
   2    -42.0660535 -0.472052E-04  0.116E-01    3.14       1.0  T
   3    -42.0660023  0.512114E-04  0.591E-02    3.13       1.0  T
   4    -42.0660659 -0.635738E-04  0.241E-02    3.13       1.0  T
   5    -42.0660729 -0.704951E-05  0.939E-03    3.13       2.0  T
   6    -42.0660736 -0.623228E-06  0.327E-03    3.13       5.7  T
   7    -42.0660738 -0.216266E-06  0.879E-04    3.13      21.1  T
     SCC iter.                  ...        0 min,  0.010 sec
     gradient                   ...        0 min,  0.016 sec
 * total energy  :   -41.4176201 Eh     change       -0.4189066E-02 Eh
   gradient norm :     0.0248378 Eh/α   predicted    -0.3588418E-02 ( -14.34%)
   displ. norm   :     0.2044575 α      lambda       -0.1263060E-02
   maximum displ.:     0.1096056 α      in ANC's #5, #13, #9, ...

........................................................................
.............................. CYCLE    3 ..............................
........................................................................
   1    -42.0778853 -0.420779E+02  0.167E-01    3.17       0.0  T
   2    -42.0779120 -0.267655E-04  0.818E-02    3.17       1.0  T
   3    -42.0778948  0.171906E-04  0.362E-02    3.17       1.0  T
   4    -42.0779171 -0.222337E-04  0.164E-02    3.17       1.1  T
   5    -42.0779203 -0.325632E-05  0.669E-03    3.17       2.8  T
   6    -42.0779206 -0.254312E-06  0.257E-03    3.17       7.2  T
   7    -42.0779207 -0.129417E-06  0.741E-04    3.17      25.0  T
     SCC iter.                  ...        0 min,  0.010 sec
     gradient                   ...        0 min,  0.016 sec
 * total energy  :   -41.4183684 Eh     change       -0.7483363E-03 Eh
   gradient norm :     0.0077395 Eh/α   predicted    -0.6579398E-03 ( -12.08%)
   displ. norm   :     0.1410558 α      lambda       -0.2602380E-03
   maximum displ.:     0.0946947 α      in ANC's #5, #6, #1, ...

........................................................................
.............................. CYCLE    4 ..............................
........................................................................
   1    -42.0780814 -0.420781E+02  0.102E-01    3.17       0.0  T
   2    -42.0780871 -0.570911E-05  0.521E-02    3.18       1.0  T
   3    -42.0780851  0.205249E-05  0.151E-02    3.17       1.2  T
   4    -42.0780877 -0.263686E-05  0.791E-03    3.17       2.3  T
   5    -42.0780884 -0.665745E-06  0.322E-03    3.17       5.8  T
   6    -42.0780884 -0.728495E-07  0.115E-03    3.17      16.2  T
   7    -42.0780885 -0.252992E-07  0.482E-04    3.17      38.5  T
     SCC iter.                  ...        0 min,  0.010 sec
     gradient                   ...        0 min,  0.016 sec
 * total energy  :   -41.4185527 Eh     change       -0.1842507E-03 Eh
   gradient norm :     0.0032156 Eh/α   predicted    -0.1327293E-03 ( -27.96%)
   displ. norm   :     0.1650448 α      lambda       -0.1649036E-03
   maximum displ.:     0.0975469 α      in ANC's #5, #1, #6, ...

........................................................................
.............................. CYCLE    5 ..............................
........................................................................
   1    -42.0761278 -0.420761E+02  0.103E-01    3.17       0.0  T
   2    -42.0761321 -0.435735E-05  0.536E-02    3.17       1.0  T
   3    -42.0761301  0.201437E-05  0.141E-02    3.17       1.3  T
   4    -42.0761323 -0.225388E-05  0.836E-03    3.17       2.2  T
   5    -42.0761332 -0.832396E-06  0.294E-03    3.17       6.3  T
   6    -42.0761333 -0.697347E-07  0.121E-03    3.17      15.4  T
   7    -42.0761333 -0.252336E-07  0.507E-04    3.17      36.6  T
   8    -42.0761333 -0.154721E-09  0.264E-04    3.17      70.2  T
     SCC iter.                  ...        0 min,  0.012 sec
     gradient                   ...        0 min,  0.017 sec
 * total energy  :   -41.4186678 Eh     change       -0.1151110E-03 Eh
   gradient norm :     0.0031847 Eh/α   predicted    -0.8470974E-04 ( -26.41%)
   displ. norm   :     0.1665260 α      lambda       -0.1034861E-03
   maximum displ.:     0.0854372 α      in ANC's #1, #5, #6, ...

........................................................................
.............................. CYCLE    6 ..............................
........................................................................
   1    -42.0747990 -0.420748E+02  0.947E-02    3.16       0.0  T
   2    -42.0748010 -0.199423E-05  0.504E-02    3.16       1.0  T
   3    -42.0747968  0.415672E-05  0.158E-02    3.16       1.2  T
   4    -42.0748015 -0.468268E-05  0.707E-03    3.16       2.6  T
   5    -42.0748019 -0.429548E-06  0.164E-03    3.16      11.4  T
   6    -42.0748019 -0.244208E-07  0.698E-04    3.16      26.6  T
   7    -42.0748019 -0.669055E-08  0.376E-04    3.16      49.4  T
     SCC iter.                  ...        0 min,  0.010 sec
     gradient                   ...        0 min,  0.017 sec
 * total energy  :   -41.4187499 Eh     change       -0.8208970E-04 Eh
   gradient norm :     0.0043377 Eh/α   predicted    -0.5317944E-04 ( -35.22%)
   displ. norm   :     0.2492607 α      lambda       -0.1379368E-03
   maximum displ.:     0.1330193 α      in ANC's #1, #5, #6, ...

........................................................................
.............................. CYCLE    7 ..............................
........................................................................
   1    -42.0738275 -0.420738E+02  0.138E-01    3.16       0.0  T
   2    -42.0738306 -0.308496E-05  0.742E-02    3.16       1.0  T
   3    -42.0738218  0.878513E-05  0.226E-02    3.16       1.0  T
   4    -42.0738318 -0.992728E-05  0.957E-03    3.16       1.9  T
   5    -42.0738324 -0.678236E-06  0.138E-03    3.16      13.5  T
   6    -42.0738325 -0.255616E-07  0.761E-04    3.16      24.4  T
     SCC iter.                  ...        0 min,  0.009 sec
     gradient                   ...        0 min,  0.016 sec
 * total energy  :   -41.4188589 Eh     change       -0.1090287E-03 Eh
   gradient norm :     0.0049109 Eh/α   predicted    -0.7327574E-04 ( -32.79%)
   displ. norm   :     0.2865543 α      lambda       -0.1462465E-03
   maximum displ.:     0.1630942 α      in ANC's #1, #5, #2, ...

........................................................................
.............................. CYCLE    8 ..............................
........................................................................
   1    -42.0739892 -0.420740E+02  0.171E-01    3.15       0.0  T
   2    -42.0739936 -0.445303E-05  0.905E-02    3.15       1.0  T
   3    -42.0739851  0.849400E-05  0.243E-02    3.15       1.0  T
   4    -42.0739945 -0.934886E-05  0.122E-02    3.15       1.5  T
   5    -42.0739958 -0.134127E-05  0.145E-03    3.15      12.8  T
   6    -42.0739959 -0.305086E-07  0.784E-04    3.15      23.7  T
     SCC iter.                  ...        0 min,  0.009 sec
     gradient                   ...        0 min,  0.016 sec
 * total energy  :   -41.4189710 Eh     change       -0.1120854E-03 Eh
   gradient norm :     0.0047461 Eh/α   predicted    -0.7912817E-04 ( -29.40%)
   displ. norm   :     0.2563093 α      lambda       -0.1236792E-03
   maximum displ.:     0.1584529 α      in ANC's #1, #2, #6, ...

........................................................................
.............................. CYCLE    9 ..............................
........................................................................
   1    -42.0754535 -0.420755E+02  0.156E-01    3.15       0.0  T
   2    -42.0754575 -0.395847E-05  0.824E-02    3.15       1.0  T
   3    -42.0754548  0.265855E-05  0.178E-02    3.15       1.0  T
   4    -42.0754569 -0.209444E-05  0.116E-02    3.15       1.6  T
   5    -42.0754588 -0.186370E-05  0.182E-03    3.15      10.2  T
   6    -42.0754589 -0.480440E-07  0.835E-04    3.15      22.2  T
     SCC iter.                  ...        0 min,  0.009 sec
     gradient                   ...        0 min,  0.016 sec
 * total energy  :   -41.4190666 Eh     change       -0.9555410E-04 Eh
   gradient norm :     0.0036039 Eh/α   predicted    -0.6590345E-04 ( -31.03%)
   displ. norm   :     0.2458907 α      lambda       -0.1000101E-03
   maximum displ.:     0.1597606 α      in ANC's #1, #2, #6, ...

........................................................................
.............................. CYCLE   10 ..............................
........................................................................
   1    -42.0769232 -0.420769E+02  0.167E-01    3.16       0.0  T
   2    -42.0769282 -0.500713E-05  0.863E-02    3.15       1.0  T
   3    -42.0769281  0.947506E-07  0.160E-02    3.16       1.2  T
   4    -42.0769269  0.122458E-05  0.119E-02    3.15       1.6  T
   5    -42.0769295 -0.261820E-05  0.169E-03    3.16      11.0  T
   6    -42.0769296 -0.395162E-07  0.832E-04    3.16      22.3  T
   7    -42.0769296 -0.434386E-08  0.507E-04    3.16      36.6  T
     SCC iter.                  ...        0 min,  0.010 sec
     gradient                   ...        0 min,  0.018 sec
 * total energy  :   -41.4191464 Eh     change       -0.7987956E-04 Eh
   gradient norm :     0.0027705 Eh/α   predicted    -0.5303454E-04 ( -33.61%)
   displ. norm   :     0.2577864 α      lambda       -0.8655182E-04
   maximum displ.:     0.1701357 α      in ANC's #1, #2, #6, ...

........................................................................
.............................. CYCLE   11 ..............................
........................................................................
   1    -42.0774484 -0.420774E+02  0.172E-01    3.16       0.0  T
   2    -42.0774534 -0.501339E-05  0.898E-02    3.16       1.0  T
   3    -42.0774543 -0.938490E-06  0.151E-02    3.16       1.2  T
   4    -42.0774530  0.131595E-05  0.840E-03    3.16       2.2  T
   5    -42.0774547 -0.163275E-05  0.154E-03    3.16      12.1  T
   6    -42.0774547 -0.289752E-07  0.882E-04    3.16      21.0  T
   7    -42.0774547 -0.359667E-08  0.518E-04    3.16      35.8  T
     SCC iter.                  ...        0 min,  0.010 sec
     gradient                   ...        0 min,  0.018 sec
 * total energy  :   -41.4192181 Eh     change       -0.7163079E-04 Eh
   gradient norm :     0.0024760 Eh/α   predicted    -0.4615263E-04 ( -35.57%)
   displ. norm   :     0.2471257 α      lambda       -0.7384093E-04
   maximum displ.:     0.1673672 α      in ANC's #1, #2, #6, ...

........................................................................
.............................. CYCLE   12 ..............................
........................................................................
   1    -42.0774981 -0.420775E+02  0.182E-01    3.17       0.0  T
   2    -42.0775044 -0.630237E-05  0.930E-02    3.17       1.0  T
   3    -42.0775053 -0.906896E-06  0.163E-02    3.16       1.1  T
   4    -42.0775033  0.207473E-05  0.111E-02    3.16       1.7  T
   5    -42.0775060 -0.275865E-05  0.166E-03    3.16      11.2  T
   6    -42.0775061 -0.360721E-07  0.975E-04    3.16      19.1  T
   7    -42.0775061 -0.495744E-08  0.487E-04    3.16      38.1  T
     SCC iter.                  ...        0 min,  0.011 sec
     gradient                   ...        0 min,  0.018 sec
 * total energy  :   -41.4192775 Eh     change       -0.5943313E-04 Eh
   gradient norm :     0.0022797 Eh/α   predicted    -0.3917633E-04 ( -34.08%)
   displ. norm   :     0.2142221 α      lambda       -0.5045591E-04
   maximum displ.:     0.1473299 α      in ANC's #1, #2, #6, ...

........................................................................
.............................. CYCLE   13 ..............................
........................................................................
   1    -42.0769867 -0.420770E+02  0.143E-01    3.17       0.0  T
   2    -42.0769905 -0.374281E-05  0.747E-02    3.17       1.0  T
   3    -42.0769907 -0.189559E-06  0.133E-02    3.17       1.4  T
   4    -42.0769898  0.864733E-06  0.942E-03    3.17       2.0  T
   5    -42.0769915 -0.165136E-05  0.144E-03    3.17      12.9  T
   6    -42.0769915 -0.253442E-07  0.886E-04    3.17      21.0  T
   7    -42.0769915 -0.635311E-08  0.495E-04    3.17      37.5  T
     SCC iter.                  ...        0 min,  0.010 sec
     gradient                   ...        0 min,  0.018 sec
 * total energy  :   -41.4193172 Eh     change       -0.3966980E-04 Eh
   gradient norm :     0.0017686 Eh/α   predicted    -0.2638645E-04 ( -33.48%)
   displ. norm   :     0.2242688 α      lambda       -0.3285068E-04
   maximum displ.:     0.1614594 α      in ANC's #1, #2, #4, ...

........................................................................
.............................. CYCLE   14 ..............................
........................................................................
   1    -42.0774075 -0.420774E+02  0.164E-01    3.18       0.0  T
   2    -42.0774133 -0.580208E-05  0.834E-02    3.18       1.0  T
   3    -42.0774136 -0.292575E-06  0.155E-02    3.18       1.2  T
   4    -42.0774124  0.119470E-05  0.115E-02    3.18       1.6  T
   5    -42.0774148 -0.235034E-05  0.191E-03    3.18       9.7  T
   6    -42.0774148 -0.491706E-07  0.107E-03    3.18      17.4  T
   7    -42.0774148 -0.104600E-07  0.612E-04    3.18      30.3  T
   8    -42.0774148 -0.544034E-09  0.203E-04    3.18      91.4  T
     SCC iter.                  ...        0 min,  0.012 sec
     gradient                   ...        0 min,  0.018 sec
 * total energy  :   -41.4193479 Eh     change       -0.3077461E-04 Eh
   gradient norm :     0.0026672 Eh/α   predicted    -0.1679629E-04 ( -45.42%)
   displ. norm   :     0.0925043 α      lambda       -0.2056075E-04
   maximum displ.:     0.0666288 α      in ANC's #1, #2, #6, ...

........................................................................
.............................. CYCLE   15 ..............................
........................................................................
   1    -42.0768493 -0.420768E+02  0.586E-02    3.18       0.0  T
   2    -42.0768500 -0.712303E-06  0.301E-02    3.18       1.0  T
   3    -42.0768499  0.713336E-07  0.581E-03    3.18       3.2  T
   4    -42.0768498  0.796024E-07  0.442E-03    3.18       4.2  T
   5    -42.0768502 -0.333119E-06  0.802E-04    3.18      23.2  T
   6    -42.0768502 -0.785561E-08  0.368E-04    3.18      50.4  T
     SCC iter.                  ...        0 min,  0.009 sec
     gradient                   ...        0 min,  0.018 sec
 * total energy  :   -41.4193627 Eh     change       -0.1476210E-04 Eh
   gradient norm :     0.0010274 Eh/α   predicted    -0.1036946E-04 ( -29.76%)
   displ. norm   :     0.0948441 α      lambda       -0.1504742E-04
   maximum displ.:     0.0717052 α      in ANC's #1, #2, #3, ...

........................................................................
.............................. CYCLE   16 ..............................
........................................................................
   1    -42.0775781 -0.420776E+02  0.438E-02    3.18       0.0  T
   2    -42.0775784 -0.257071E-06  0.242E-02    3.18       1.0  T
   3    -42.0775778  0.580835E-06  0.624E-03    3.18       3.0  T
   4    -42.0775784 -0.623189E-06  0.328E-03    3.18       5.7  T
   5    -42.0775785 -0.101643E-06  0.625E-04    3.18      29.7  T
   6    -42.0775785 -0.306820E-08  0.387E-04    3.18      48.0  T
     SCC iter.                  ...        0 min,  0.009 sec
     gradient                   ...        0 min,  0.018 sec
 * total energy  :   -41.4193780 Eh     change       -0.1530715E-04 Eh
   gradient norm :     0.0015588 Eh/α   predicted    -0.7554409E-05 ( -50.65%)
   displ. norm   :     0.1047757 α      lambda       -0.1714177E-04
   maximum displ.:     0.0768336 α      in ANC's #1, #2, #3, ...

........................................................................
.............................. CYCLE   17 ..............................
........................................................................
   1    -42.0774596 -0.420775E+02  0.567E-02    3.18       0.0  T
   2    -42.0774602 -0.614042E-06  0.293E-02    3.18       1.0  T
   3    -42.0774601  0.850069E-07  0.607E-03    3.18       3.1  T
   4    -42.0774601 -0.285699E-07  0.402E-03    3.18       4.6  T
   5    -42.0774604 -0.236209E-06  0.876E-04    3.18      21.2  T
   6    -42.0774604 -0.117059E-07  0.464E-04    3.18      40.0  T
     SCC iter.                  ...        0 min,  0.009 sec
     gradient                   ...        0 min,  0.018 sec
 * total energy  :   -41.4193963 Eh     change       -0.1824628E-04 Eh
   gradient norm :     0.0015628 Eh/α   predicted    -0.8614627E-05 ( -52.79%)
   displ. norm   :     0.1162627 α      lambda       -0.1630537E-04
   maximum displ.:     0.0803923 α      in ANC's #1, #2, #3, ...

........................................................................
.............................. CYCLE   18 ..............................
........................................................................
   1    -42.0776686 -0.420777E+02  0.716E-02    3.18       0.0  T
   2    -42.0776696 -0.102994E-05  0.368E-02    3.18       1.0  T
   3    -42.0776695  0.133268E-06  0.768E-03    3.18       2.4  T
   4    -42.0776696 -0.137166E-06  0.484E-03    3.18       3.8  T
   5    -42.0776700 -0.302458E-06  0.924E-04    3.18      20.1  T
   6    -42.0776700 -0.102738E-07  0.524E-04    3.18      35.4  T
     SCC iter.                  ...        0 min,  0.009 sec
     gradient                   ...        0 min,  0.018 sec
 * total energy  :   -41.4194147 Eh     change       -0.1845365E-04 Eh
   gradient norm :     0.0012819 Eh/α   predicted    -0.8205039E-05 ( -55.54%)
   displ. norm   :     0.1595614 α      lambda       -0.1954045E-04
   maximum displ.:     0.1104045 α      in ANC's #1, #2, #3, ...

........................................................................
.............................. CYCLE   19 ..............................
........................................................................
   1    -42.0773493 -0.420773E+02  0.729E-02    3.18       0.0  T
   2    -42.0773499 -0.633457E-06  0.409E-02    3.18       1.0  T
   3    -42.0773493  0.639100E-06  0.780E-03    3.18       2.4  T
   4    -42.0773498 -0.538617E-06  0.499E-03    3.18       3.7  T
   5    -42.0773502 -0.351798E-06  0.113E-03    3.18      16.4  T
   6    -42.0773502 -0.107099E-07  0.705E-04    3.18      26.3  T
   7    -42.0773502 -0.296605E-08  0.420E-04    3.18      44.2  T
     SCC iter.                  ...        0 min,  0.011 sec
     gradient                   ...        0 min,  0.018 sec
 * total energy  :   -41.4194352 Eh     change       -0.2049861E-04 Eh
   gradient norm :     0.0011596 Eh/α   predicted    -0.9884546E-05 ( -51.78%)
   displ. norm   :     0.1593639 α      lambda        0.1047970E-06
   maximum displ.:     0.1101189 α      in ANC's #1, #2, #3, ...

........................................................................
.............................. CYCLE   20 ..............................
........................................................................
   1    -42.0767289 -0.420767E+02  0.728E-02    3.18       0.0  T
   2    -42.0767296 -0.639361E-06  0.409E-02    3.18       1.0  T
   3    -42.0767288  0.776869E-06  0.816E-03    3.18       2.3  T
   4    -42.0767295 -0.712610E-06  0.500E-03    3.18       3.7  T
   5    -42.0767298 -0.328819E-06  0.114E-03    3.18      16.2  T
   6    -42.0767298 -0.105198E-07  0.708E-04    3.18      26.2  T
   7    -42.0767298 -0.300570E-08  0.426E-04    3.18      43.6  T
     SCC iter.                  ...        0 min,  0.010 sec
     gradient                   ...        0 min,  0.018 sec
 * total energy  :   -41.4194370 Eh     change       -0.1779095E-05 Eh
   gradient norm :     0.0024747 Eh/α   predicted     0.5280952E-07 (-102.97%)
   displ. norm   :     0.0194114 α      lambda       -0.1160495E-04
   maximum displ.:     0.0091057 α      in ANC's #1, #5, #7, ...
 * RMSD in coord.:     0.5564888 α      energy gain  -0.6005959E-02 Eh

generating ANC from model Hessian ...
Using Lindh-Hessian (1995)
 Shifting diagonal of input Hessian by   4.604039693410393E-003
 Lowest  eigenvalues of input Hessian
   -0.000000   -0.000000   -0.000000   -0.000000    0.000000    0.000000
    0.005000    0.005385    0.005659    0.006629    0.008341    0.009125
    0.011363    0.011453    0.013752    0.016653    0.017391    0.020369
 Highest eigenvalues
    1.657222    1.851473    1.881899    1.888757    1.911080    2.046564
 

........................................................................
.............................. CYCLE   21 ..............................
........................................................................
   1    -42.0770331 -0.420770E+02  0.268E-02    3.18       0.0  T
   2    -42.0770333 -0.224841E-06  0.127E-02    3.18       1.5  T
   3    -42.0770332  0.102900E-06  0.310E-03    3.18       6.0  T
   4    -42.0770333 -0.143750E-06  0.178E-03    3.18      10.4  T
   5    -42.0770334 -0.272248E-07  0.453E-04    3.18      41.0  T
   6    -42.0770334 -0.237657E-08  0.159E-04    3.18     116.5  T
     SCC iter.                  ...        0 min,  0.009 sec
     gradient                   ...        0 min,  0.018 sec
 * total energy  :   -41.4194460 Eh     change       -0.9005106E-05 Eh
   gradient norm :     0.0014170 Eh/α   predicted     0.0000000E+00 (-100.00%)
   displ. norm   :     0.0365282 α      lambda       -0.8345464E-05
   maximum displ.:     0.0167293 α      in ANC's #5, #8, #6, ...

........................................................................
.............................. CYCLE   22 ..............................
........................................................................
   1    -42.0775491 -0.420775E+02  0.335E-02    3.18       0.0  T
   2    -42.0775495 -0.362218E-06  0.165E-02    3.18       1.1  T
   3    -42.0775494  0.448427E-07  0.365E-03    3.18       5.1  T
   4    -42.0775495 -0.875295E-07  0.230E-03    3.18       8.1  T
   5    -42.0775496 -0.519507E-07  0.551E-04    3.18      33.7  T
   6    -42.0775496 -0.531978E-08  0.209E-04    3.18      88.8  T
     SCC iter.                  ...        0 min,  0.009 sec
     gradient                   ...        0 min,  0.018 sec
 * total energy  :   -41.4194536 Eh     change       -0.7607401E-05 Eh
   gradient norm :     0.0005065 Eh/α   predicted    -0.4175183E-05 ( -45.12%)
   displ. norm   :     0.0368475 α      lambda        0.4113567E-05
   maximum displ.:     0.0167304 α      in ANC's #5, #8, #6, ...

........................................................................
.............................. CYCLE   23 ..............................
........................................................................
   1    -42.0780325 -0.420780E+02  0.337E-02    3.18       0.0  T
   2    -42.0780328 -0.367580E-06  0.166E-02    3.18       1.1  T
   3    -42.0780328  0.452329E-07  0.367E-03    3.18       5.1  T
   4    -42.0780329 -0.874651E-07  0.231E-03    3.18       8.0  T
   5    -42.0780329 -0.538397E-07  0.544E-04    3.18      34.2  T
   6    -42.0780330 -0.498472E-08  0.211E-04    3.18      88.1  T
     SCC iter.                  ...        0 min,  0.009 sec
     gradient                   ...        0 min,  0.018 sec
 * total energy  :   -41.4194516 Eh     change        0.2046737E-05 Eh
   gradient norm :     0.0015926 Eh/α   predicted     0.2056306E-05 (   0.47%)
   displ. norm   :     0.0166111 α      lambda       -0.8292473E-05
   maximum displ.:     0.0068834 α      in ANC's #14, #6, #19, ...

........................................................................
.............................. CYCLE   24 ..............................
........................................................................
   1    -42.0777589 -0.420778E+02  0.332E-02    3.18       0.0  T
   2    -42.0777592 -0.327286E-06  0.157E-02    3.18       1.2  T
   3    -42.0777593 -0.573485E-07  0.255E-03    3.18       7.3  T
   4    -42.0777592  0.564117E-07  0.192E-03    3.18       9.7  T
   5    -42.0777593 -0.759619E-07  0.182E-04    3.18     101.8  T
   6    -42.0777593 -0.431164E-09  0.101E-04    3.18     184.8  T
     SCC iter.                  ...        0 min,  0.009 sec
     gradient                   ...        0 min,  0.018 sec
 * total energy  :   -41.4194586 Eh     change       -0.7077413E-05 Eh
   gradient norm :     0.0009264 Eh/α   predicted    -0.4147950E-05 ( -41.39%)
   displ. norm   :     0.0246860 α      lambda       -0.3439303E-05
   maximum displ.:     0.0128349 α      in ANC's #6, #1, #3, ...

........................................................................
.............................. CYCLE   25 ..............................
........................................................................
   1    -42.0772782 -0.420773E+02  0.102E-02    3.18       0.0  T
   2    -42.0772782 -0.166506E-07  0.600E-03    3.18       3.1  T
   3    -42.0772781  0.407492E-07  0.136E-03    3.18      13.6  T
   4    -42.0772782 -0.451810E-07  0.400E-04    3.18      46.4  T
   5    -42.0772782 -0.197904E-08  0.155E-04    3.18     119.8  T
     SCC iter.                  ...        0 min,  0.008 sec
     gradient                   ...        0 min,  0.018 sec
 * total energy  :   -41.4194622 Eh     change       -0.3513103E-05 Eh
   gradient norm :     0.0003108 Eh/α   predicted    -0.1723369E-05 ( -50.94%)
   displ. norm   :     0.0518682 α      lambda       -0.3549242E-05
   maximum displ.:     0.0260000 α      in ANC's #6, #1, #3, ...

   *** GEOMETRY OPTIMIZATION CONVERGED AFTER 25 ITERATIONS ***

------------------------------------------------------------------------
 total energy gain   :        -0.0060311 Eh       -3.7846 kcal/mol
 total RMSD          :         0.5624587 a0        0.2976 Å
 total power (kW/mol):        -0.6333876 (step)  -15.3014 (real)
------------------------------------------------------------------------

 ANCopt (total)                0 d,  0 h,  0 min,  1.035 sec
 optimizer setup                ...        0 min,  0.000 sec (  0.015%)
 model hessian                  ...        0 min,  0.008 sec (  0.819%)
 ANC generation                 ...        0 min,  0.002 sec (  0.174%)
 coordinate transformation      ...        0 min,  0.000 sec (  0.048%)
 single point calculation       ...        0 min,  1.016 sec ( 98.130%)
 optimization log               ...        0 min,  0.003 sec (  0.278%)
 hessian update                 ...        0 min,  0.000 sec (  0.035%)
 rational function              ...        0 min,  0.004 sec (  0.350%)

================
 final structure:
================
$coord
    2.96530155482248    0.19372469043502   -0.65898554270097      C 
    1.97936011453286   -2.85709921789017   -0.19081289774034      S 
    4.33546486584034   -3.34460835616682    1.99887402240553      C 
    5.77633163822652   -1.25997552474316    2.33181934335371      C 
    5.00865733534857    0.81757282523223    0.79630128217994      C 
    6.28922040544793    3.23662426594030    0.85622306756957      C 
    5.84802613492889    5.17726557945467   -0.68065710520503      C 
    7.19811808707614    7.65053178046929   -0.52219953210784      C 
    5.42405973270488    9.79980910022734   -0.01731990245128      C 
    2.22802555180857    9.27748712295825    0.48574895611632      S 
    1.67656721027004   12.48319110478518    0.91595478254070      C 
   -0.93541310106918   13.43884555349194    1.36381528061763      C 
   -2.35988421883127   13.78890031797961   -1.12918086270757      C 
    3.85126902950590   13.82435167962570    0.67110358176776      C 
    5.98178253950643   12.30140504860019    0.14427597753669      C 
    1.95712112070888    1.35577468718223   -1.97435259653666      H 
    4.49602035552746   -5.15156337392871    2.89952338605816      H 
    7.34897695610839   -1.17068200199302    3.61703802132842      H 
    7.73672854810896    3.40555538003205    2.29418857534451      H 
    4.42459211864345    5.04865269900998   -2.13990717971398      H 
    8.17828277895048    8.01783693380413   -2.31155324807333      H 
    8.62995732775812    7.58388746647235    0.96966760977873      H 
   -0.82556024983272   15.24702909961330    2.35426174458017      H 
   -1.96859764073722   12.10734136333833    2.55543706729946      H 
   -1.37004083264055   15.12842391300330   -2.33391198869383      H 
   -4.25656017463760   14.49624529145667   -0.77643287326775      H 
   -2.50032874791213   11.99631848270004   -2.12522294213533      H 
    3.94157668679280   15.84605540492205    0.86930444354323      H 
    7.85970793553792   13.04233277934609   -0.10007321262712      H 
$end
           -------------------------------------------------
          |                Final Singlepoint                |
           -------------------------------------------------

          ...................................................
          :                      SETUP                      :
          :.................................................:
          :  # basis functions                  86          :
          :  # atomic orbitals                  84          :
          :  # shells                           46          :
          :  # electrons                        78          :
          :  max. iterations                   250          :
          :  Hamiltonian                  GFN2-xTB          :
          :  restarted?                      false          :
          :  GBSA solvation                  false          :
          :  PC potential                    false          :
          :  electronic temp.          300.0000000     K    :
          :  accuracy                    1.0000000          :
          :  -> integral cutoff          0.2500000E+02      :
          :  -> integral neglect         0.1000000E-07      :
          :  -> SCF convergence          0.1000000E-05 Eh   :
          :  -> wf. convergence          0.1000000E-03 e    :
          :  Broyden damping             0.4000000          :
          ...................................................

 iter      E             dE          RMSdq      gap      omega  full diag
   1    -42.0772782 -0.420773E+02  0.803E-05    3.18       0.0  T
   2    -42.0772782 -0.246985E-10  0.474E-05    3.18     391.8  T
   3    -42.0772782 -0.560902E-10  0.249E-05    3.18     745.3  T

   *** convergence criteria satisfied after 3 iterations ***

         #    Occupation            Energy/Eh            Energy/eV
      -------------------------------------------------------------
         1        2.0000           -0.7275111             -19.7966
       ...           ...                  ...                  ...
        33        2.0000           -0.4335653             -11.7979
        34        2.0000           -0.4307647             -11.7217
        35        2.0000           -0.4252497             -11.5716
        36        2.0000           -0.3932693             -10.7014
        37        2.0000           -0.3862279             -10.5098
        38        2.0000           -0.3748141             -10.1992
        39        2.0000           -0.3693701             -10.0511 (HOMO)
        40                         -0.2525910              -6.8734 (LUMO)
        41                         -0.2318950              -6.3102
        42                         -0.2167308              -5.8975
        43                         -0.1973618              -5.3705
        44                         -0.1899401              -5.1685
       ...                                ...                  ...
        84                          0.7205896              19.6082
      -------------------------------------------------------------
                  HL-Gap            0.1167791 Eh            3.1777 eV
             Fermi-level           -0.3109805 Eh           -8.4622 eV

 SCC (total)                   0 d,  0 h,  0 min,  0.037 sec
 SCC setup                      ...        0 min,  0.000 sec (  0.673%)
 Dispersion                     ...        0 min,  0.000 sec (  0.706%)
 integral evaluation            ...        0 min,  0.013 sec ( 34.866%)
 zeroth order Hamiltonian       ...        0 min,  0.000 sec (  0.517%)
 iterations                     ...        0 min,  0.005 sec ( 14.203%)
 molecular gradient             ...        0 min,  0.018 sec ( 47.787%)
 printout                       ...        0 min,  0.000 sec (  1.100%)

         :::::::::::::::::::::::::::::::::::::::::::::::::::::
         ::                     SUMMARY                     ::
         :::::::::::::::::::::::::::::::::::::::::::::::::::::
         :: total energy             -41.419462144020 Eh    ::
         :: gradient norm              0.000310637235 Eh/a0 ::
         :: HOMO-LUMO gap              3.177722157965 eV    ::
         ::.................................................::
         :: SCC energy               -42.077278180797 Eh    ::
         :: -> isotropic ES            0.003886124169 Eh    ::
         :: -> anisotropic ES          0.004767429043 Eh    ::
         :: -> anisotropic XC          0.022578281700 Eh    ::
         :: -> dispersion             -0.028858173569 Eh    ::
         :: repulsion energy           0.657914698699 Eh    ::
         :: add. restraining           0.000000000000 Eh    ::
         :::::::::::::::::::::::::::::::::::::::::::::::::::::

           -------------------------------------------------
          |                Property Printout                |
           -------------------------------------------------

    * Orbital Energies and Occupations

         #    Occupation            Energy/Eh            Energy/eV
      -------------------------------------------------------------
         1        2.0000           -0.7275111             -19.7966
       ...           ...                  ...                  ...
        27        2.0000           -0.4589124             -12.4876
        28        2.0000           -0.4533527             -12.3364
        29        2.0000           -0.4517787             -12.2935
        30        2.0000           -0.4457447             -12.1293
        31        2.0000           -0.4416091             -12.0168
        32        2.0000           -0.4367990             -11.8859
        33        2.0000           -0.4335653             -11.7979
        34        2.0000           -0.4307647             -11.7217
        35        2.0000           -0.4252497             -11.5716
        36        2.0000           -0.3932693             -10.7014
        37        2.0000           -0.3862279             -10.5098
        38        2.0000           -0.3748141             -10.1992
        39        2.0000           -0.3693701             -10.0511 (HOMO)
        40                         -0.2525910              -6.8734 (LUMO)
        41                         -0.2318950              -6.3102
        42                         -0.2167308              -5.8975
        43                         -0.1973618              -5.3705
        44                         -0.1899401              -5.1685
        45                         -0.1581497              -4.3035
        46                         -0.1237690              -3.3679
        47                         -0.1130713              -3.0768
        48                         -0.1098924              -2.9903
        49                         -0.0017288              -0.0470
        50                          0.0043107               0.1173
       ...                                ...                  ...
        84                          0.7205896              19.6082
      -------------------------------------------------------------
                  HL-Gap            0.1167791 Eh            3.1777 eV
             Fermi-level           -0.3109805 Eh           -8.4622 eV

     #   Z        covCN         q      C6AA      α(0)
     1   6 C      2.945    -0.026    28.655     8.780
     2  16 S      2.298    -0.026   142.128    20.065
     3   6 C      2.933    -0.022    28.547     8.762
     4   6 C      3.126    -0.049    29.005     8.819
     5   6 C      3.153     0.001    27.721     8.610
     6   6 C      2.895    -0.042    29.045     8.836
     7   6 C      2.898    -0.035    28.879     8.811
     8   6 C      3.827    -0.055    21.543     6.604
     9   6 C      2.988     0.020    27.561     8.612
    10  16 S      2.360    -0.066   143.776    20.181
    11   6 C      2.987     0.018    27.590     8.616
    12   6 C      3.824    -0.053    21.511     6.600
    13   6 C      3.753    -0.100    22.462     6.758
    14   6 C      3.118    -0.058    29.272     8.862
    15   6 C      3.117    -0.062    29.353     8.874
    16   1 H      0.927     0.043     2.404     2.424
    17   1 H      0.926     0.042     2.422     2.434
    18   1 H      0.926     0.036     2.500     2.473
    19   1 H      0.925     0.036     2.500     2.472
    20   1 H      0.926     0.039     2.458     2.452
    21   1 H      0.924     0.052     2.298     2.370
    22   1 H      0.924     0.047     2.352     2.398
    23   1 H      0.924     0.040     2.447     2.446
    24   1 H      0.924     0.043     2.410     2.428
    25   1 H      0.925     0.038     2.476     2.461
    26   1 H      0.925     0.038     2.474     2.460
    27   1 H      0.925     0.041     2.429     2.437
    28   1 H      0.926     0.030     2.589     2.516
    29   1 H      0.926     0.028     2.615     2.529

 Mol. C6AA /au·bohr⁶  :      12807.097521
 Mol. C8AA /au·bohr⁸  :     366801.179010
 Mol. α(0) /au        :        182.091656


Wiberg/Mayer (AO) data.
largest (>0.10) Wiberg bond orders for each atom
          total WBO             WBO to atom ...
     1  C   3.946        C    5 1.543    S    2 1.207    H   16 0.969    C    3 0.109
     2  S   2.643        C    1 1.207    C    3 1.181
     3  C   3.949        C    4 1.656    S    2 1.181    H   17 0.971    C    1 0.109
     4  C   3.986        C    3 1.656    C    5 1.217    H   18 0.964
     5  C   3.986        C    1 1.543    C    4 1.217    C    6 1.097
     6  C   3.989        C    7 1.840    C    5 1.097    H   19 0.962
     7  C   3.990        C    6 1.840    C    8 1.028    H   20 0.962
     8  C   3.997        C    7 1.028    C    9 1.006    H   22 0.957    H   21 0.945
     9  C   3.946        C   15 1.606    S   10 1.155    C    8 1.006    C   11 0.112
    10  S   2.589        C    9 1.155    C   11 1.149
    11  C   3.947        C   14 1.608    S   10 1.149    C   12 1.024    C    9 0.112
    12  C   3.997        C   11 1.024    C   13 0.999    H   24 0.972    H   23 0.970
    13  C   3.995        C   12 0.999    H   25 0.989    H   27 0.988    H   26 0.986
    14  C   3.984        C   11 1.608    C   15 1.263    H   28 0.965
    15  C   3.984        C    9 1.606    C   14 1.263    H   29 0.965
    16  H   0.998        C    1 0.969
    17  H   0.998        C    3 0.971
    18  H   0.999        C    4 0.964
    19  H   0.999        C    6 0.962
    20  H   0.998        C    7 0.962
    21  H   0.995        C    8 0.945
    22  H   0.997        C    8 0.957
    23  H   0.998        C   12 0.970
    24  H   0.998        C   12 0.972
    25  H   0.999        C   13 0.989
    26  H   0.998        C   13 0.986
    27  H   0.998        C   13 0.988
    28  H   0.998        C   14 0.965
    29  H   0.999        C   15 0.965

molecular dipole:
                 x           y           z       tot (Debye)
 q only:        0.043       0.114      -0.028
   full:        0.420       0.483       0.087       1.641
molecular quadrupole (traceless):
                xx          xy          yy          xz          yz          zz
 q only:        1.795      -2.733       0.789       0.269      -1.486      -2.584
  q+dip:        2.020       1.725       5.191       2.422      -2.947      -7.211
   full:        1.958       0.663       4.170       1.405      -2.403      -6.128

           -------------------------------------------------
          |                Geometry Summary                 |
           -------------------------------------------------

      molecular mass/u    :      234.3736000
   center of mass at/Å    :        1.7885704       3.1202749       0.1946045
  moments of inertia/u·Å² :        0.4801302E+03   0.2728925E+04   0.3081302E+04
rotational constants/cm⁻¹ :        0.3511054E-01   0.6177389E-02   0.5470944E-02

 * 26 selected distances

     #   Z        #   Z                                     value/Å
     1   6 C      2  16 S                                 1.7146317
     2  16 S      3   6 C                                 1.7215449
     3   6 C      4   6 C                                 1.3525261
     1   6 C      5   6 C                                 1.3679359
     4   6 C      5   6 C                                 1.4261643
     6   6 C      7   6 C                                 1.3306195
     9   6 C     10  16 S                                 1.7342595
    10  16 S     11   6 C                                 1.7362919 (max)
    12   6 C     13   6 C                                 1.5306571
    11   6 C     14   6 C                                 1.3582437
     9   6 C     15   6 C                                 1.3589814
    14   6 C     15   6 C                                 1.4136069
     1   6 C     16   1 H                                 1.0711074 (min)
     3   6 C     17   1 H                                 1.0717680
     4   6 C     18   1 H                                 1.0758024
     6   6 C     19   1 H                                 1.0834008
     7   6 C     20   1 H                                 1.0808847
     8   6 C     21   1 H                                 1.0969964
     8   6 C     22   1 H                                 1.0948053
    12   6 C     23   1 H                                 1.0925402
    12   6 C     24   1 H                                 1.0922527
    13   6 C     25   1 H                                 1.0877767
    13   6 C     26   1 H                                 1.0873463
    13   6 C     27   1 H                                 1.0877359
    14   6 C     28   1 H                                 1.0760303
    15   6 C     29   1 H                                 1.0761030

 * 3 distinct bonds (by element types)

   Z      Z             #   av. dist./Å        max./Å        min./Å
   1 H    6 C          14     1.0838964     1.0969964     1.0711074
   6 C    6 C           8     1.3923419     1.5306571     1.3306195
   6 C   16 S           4     1.7266820     1.7362919     1.7146317


optimized geometry written to: xtbopt.xyz


           -------------------------------------------------
          | TOTAL ENERGY              -41.419462144020 Eh   |
          | GRADIENT NORM               0.000310637235 Eh/α |
          | HOMO-LUMO GAP               3.177722157965 eV   |
           -------------------------------------------------

------------------------------------------------------------------------
 * finished run on 2021/05/19 at 10:59:14.978     
------------------------------------------------------------------------
 total:
 * wall-time:     0 d,  0 h,  0 min,  1.151 sec
 *  cpu-time:     0 d,  0 h,  0 min,  1.147 sec
 * ratio c/w:     0.996 speedup
 SCF:
 * wall-time:     0 d,  0 h,  0 min,  0.052 sec
 *  cpu-time:     0 d,  0 h,  0 min,  0.052 sec
 * ratio c/w:     0.998 speedup
 ANC optimizer:
 * wall-time:     0 d,  0 h,  0 min,  1.072 sec
 *  cpu-time:     0 d,  0 h,  0 min,  1.070 sec
 * ratio c/w:     0.998 speedup

