      -----------------------------------------------------------      
     |                   =====================                   |     
     |                           x T B                           |     
     |                   =====================                   |     
     |                         S. Grimme                         |     
     |          Mulliken Center for Theoretical Chemistry        |     
     |                    University of Bonn                     |     
     |                Version 6.2 RC2 (SAW190805)                |     
      -----------------------------------------------------------      

   This program is distributed in the hope that it will be useful,
   but WITHOUT ANY WARRANTY; without even the implied warranty of
   MERCHANTABILITY or FITNESS FOR A PARTICULAR PURPOSE.
   
   FOR NON-COMMERCIAL, ACADEMIA USE ONLY.
   
   Cite this work as:
   * S. Grimme, C. Bannwarth, P. Shushkov, J. Chem. Theory Comput., 2017,
     13, 1989-2009. DOI: 10.1021/acs.jctc.7b00118
   * C. Bannwarth, S. Ehlert and S. Grimme., J. Chem. Theory Comput., 2019,
     15, 1652-1671. DOI: 10.1021/acs.jctc.8b01176
   * P. Pracht, E. Caldeweyher, S. Ehlert, S. Grimme, ChemRxiv, 2019, preprint.
     DOI: 10.26434/chemrxiv.8326202.v1
   
   for DFT-D4:
   * E. Caldeweyher, C. Bannwarth and S. Grimme, J. Chem. Phys., 2017,
     147, 034112. DOI: 10.1063/1.4993215
   * E. Caldeweyher, S. Ehlert, A. Hansen, H. Neugebauer, S. Spicher,
     C. Bannwarth and S. Grimme, J. Chem. Phys., 2019, 150, 154122.
     DOI: 10.1063/1.5090222
   
   for sTDA-xTB:
   * S. Grimme and C. Bannwarth, J. Chem. Phys., 2016, 145, 054103.
     DOI: 10.1063/1.4959605
   
   in the mass-spec context:
   * V. Asgeirsson, C. Bauer and S. Grimme, Chem. Sci., 2017, 8, 4879.
     DOI: 10.1039/c7sc00601b
   
   for metadynamics refer to:
   * S. Grimme, J. Chem. Theory Comput., 2019, 155, 2847-2862
     DOI: 10.1021/acs.jctc.9b00143
   
   with help from (in alphabetical order)
   C. Bannwarth, F. Bohle, G. Brandenburg, E. Caldeweyher, M. Checinski,
   S. Dohm, S. Ehlert, S. Ehrlich, F. März, H. Neugebauer, J. Pisarek,
   P. Pracht, P. Shushkov, and S. Spicher.
   
 * started run on 2021/05/19 at 10:59:15.295     

           -------------------------------------------------
          |                Calculation Setup                |
           -------------------------------------------------

          program call               : /ihome/ghutchison/geoffh/xtb/xtb 512.xyz -opt
          hostname                   : smp-n144
          coordinate file            : 512.xyz
          omp threads                :                     1
          number of atoms            :                    23
          number of electrons        :                    72
          charge                     :                     0
          spin                       :                   0.0
          first test random number   :      0.91562711812011


########################################################################
# WARNING! Please study the warnings concerning your input carefully
#  - the use of '-opt' is discouraged, please use '--opt' next time
########################################################################

           ------------------------------------------------- 
          |                 G F N 2 - x T B                 |
          | Geometry, Frequencies, Noncovalent interactions |
          |            JCTC 2019 parametrisation            |
           ------------------------------------------------- 
             KAB for C  - Si     :                1.0500
             KAB for H  - Pd     :                0.9500
             k(s)              :                1.8500
             k(p)              :                2.2300
             k(d)              :                2.2300
             k(f)              :                2.0000
             kEN (H0ij)        :               -2.0000
             D4 a1             :                0.5200
             D4 a2             :                5.0000
             D4 s6             :                1.0000
             D4 s8             :                2.7000
             D4 s9             :                5.0000
             alphaj            :                2.0000

  Z AO/shell   Hii/eV     exponent
  1     Wed Apr 25 08:07:45 CEST 2018   EN: 2.200 GM2: 0.406  GM3: 0.0800  RAES: 1.40
     1s    -10.707211    1.230000
  6     Wed Apr 25 08:07:45 CEST 2018   EN: 2.550 GM2: 0.538  GM3: 0.1500  RAES: 3.00
     2s    -13.970922    2.096432
     2p    -10.063292    1.800000
  7     Wed Apr 25 08:07:45 CEST 2018   EN: 3.040 GM2: 0.461  GM3:-0.0640  RAES: 1.90
     2s    -16.686243    2.339881
     2p    -12.523956    2.014332
  8     Wed Apr 25 08:07:45 CEST 2018   EN: 3.440 GM2: 0.452  GM3:-0.0517  RAES: 1.80
     2s    -20.229985    2.439742
     2p    -15.503117    2.137023
 16     Tue Apr 24 11:44:34 CEST 2018   EN: 2.580 GM2: 0.340  GM3:-0.0502  RAES: 3.10
     3s    -20.029654    1.981333
     3p    -11.377694    2.025643
     3d     -0.420282    1.702555

           ------------------------------------------------- 
          |        Self-Consistent Charge Iterations        |
           ------------------------------------------------- 

          ...................................................
          :                      SETUP                      :
          :.................................................:
          :  # basis functions                  71          :
          :  # atomic orbitals                  70          :
          :  # shells                           38          :
          :  # electrons                        72          :
          :  max. iterations                   250          :
          :  Hamiltonian                  GFN2-xTB          :
          :  restarted?                      false          :
          :  GBSA solvation                  false          :
          :  PC potential                    false          :
          :  electronic temp.          300.0000000     K    :
          :  accuracy                    1.0000000          :
          :  -> integral cutoff          0.2500000E+02      :
          :  -> integral neglect         0.1000000E-07      :
          :  -> SCF convergence          0.1000000E-05 Eh   :
          :  -> wf. convergence          0.1000000E-03 e    :
          :  Broyden damping             0.4000000          :
          ...................................................

 iter      E             dE          RMSdq      gap      omega  full diag
   1    -40.7470933 -0.407471E+02  0.485E+00    2.81       0.0  T
   2    -40.8232553 -0.761620E-01  0.264E+00    2.80       1.0  T
   3    -40.8254709 -0.221551E-02  0.149E+00    2.72       1.0  T
   4    -40.8315439 -0.607303E-02  0.470E-01    2.78       1.0  T
   5    -40.8355298 -0.398594E-02  0.165E-01    2.70       1.0  T
   6    -40.8358061 -0.276228E-03  0.696E-02    2.72       1.0  T
   7    -40.8358326 -0.265507E-04  0.251E-02    2.72       1.0  T
   8    -40.8358398 -0.717943E-05  0.127E-02    2.72       1.6  T
   9    -40.8358406 -0.853006E-06  0.450E-03    2.72       4.6  T
  10    -40.8358407 -0.697317E-07  0.134E-03    2.72      15.5  T
  11    -40.8358407 -0.528244E-08  0.689E-04    2.72      30.3  T
  12    -40.8358407 -0.873307E-09  0.272E-04    2.72      76.7  T

   *** convergence criteria satisfied after 12 iterations ***

         #    Occupation            Energy/Eh            Energy/eV
      -------------------------------------------------------------
         1        2.0000           -0.7588600             -20.6496
       ...           ...                  ...                  ...
        30        2.0000           -0.4537207             -12.3464
        31        2.0000           -0.4532104             -12.3325
        32        2.0000           -0.4352924             -11.8449
        33        2.0000           -0.4208991             -11.4532
        34        2.0000           -0.4189490             -11.4002
        35        2.0000           -0.4179179             -11.3721
        36        2.0000           -0.4074741             -11.0879 (HOMO)
        37                         -0.3075764              -8.3696 (LUMO)
        38                         -0.2947303              -8.0200
        39                         -0.2319632              -6.3120
        40                         -0.2160530              -5.8791
        41                         -0.1721378              -4.6841
       ...                                ...                  ...
        70                          0.7496545              20.3991
      -------------------------------------------------------------
                  HL-Gap            0.0998977 Eh            2.7184 eV
             Fermi-level           -0.3575253 Eh           -9.7288 eV

 SCC (total)                   0 d,  0 h,  0 min,  0.039 sec
 SCC setup                      ...        0 min,  0.000 sec (  0.755%)
 Dispersion                     ...        0 min,  0.000 sec (  0.883%)
 integral evaluation            ...        0 min,  0.009 sec ( 23.791%)
 zeroth order Hamiltonian       ...        0 min,  0.000 sec (  0.473%)
 iterations                     ...        0 min,  0.015 sec ( 37.013%)
 molecular gradient             ...        0 min,  0.014 sec ( 35.980%)
 printout                       ...        0 min,  0.000 sec (  0.973%)

         :::::::::::::::::::::::::::::::::::::::::::::::::::::
         ::                     SUMMARY                     ::
         :::::::::::::::::::::::::::::::::::::::::::::::::::::
         :: total energy             -40.298820342674 Eh    ::
         :: gradient norm              0.070184731573 Eh/a0 ::
         :: HOMO-LUMO gap              2.718355846457 eV    ::
         ::.................................................::
         :: SCC energy               -40.835840712338 Eh    ::
         :: -> isotropic ES            0.061787918521 Eh    ::
         :: -> anisotropic ES          0.001692655344 Eh    ::
         :: -> anisotropic XC          0.012780177689 Eh    ::
         :: -> dispersion             -0.024270601990 Eh    ::
         :: repulsion energy           0.536938585815 Eh    ::
         :: add. restraining           0.000000000000 Eh    ::
         :::::::::::::::::::::::::::::::::::::::::::::::::::::

      ----------------------------------------------------------- 
     |                   =====================                   |
     |                        A N C O P T                        |
     |                   =====================                   |
     |               Approximate Normal Coordinate               |
     |                Rational Function Optimizer                |
      ----------------------------------------------------------- 

          ...................................................
          :                      SETUP                      :
          :.................................................:
          :   optimization level            normal          :
          :   max. optcycles                   200          :
          :   ANC micro-cycles                  20          :
          :   degrees of freedom                63          :
          :.................................................:
          :   RF solver                   davidson          :
          :   input Hessian                  false          :
          :   write xtbopt.log                true          :
          :   linear?                        false          :
          :   energy convergence         0.5000000E-05 Eh   :
          :   grad. convergence          0.1000000E-02 Eh/α :
          :   maximium RF displ.         2.0000000          :
          :   Hlow (freq-cutoff)         0.5000000E-02      :
          :   Hmax (freq-cutoff)         5.0000000          :
          :   S6 in model hess.         20.0000000          :
          ...................................................

generating ANC from model Hessian ...
Using Lindh-Hessian (1995)
 Shifting diagonal of input Hessian by   3.408487108483535E-003
 Lowest  eigenvalues of input Hessian
   -0.000000    0.000000    0.000000    0.000000    0.000000    0.000000
    0.005000    0.005636    0.007339    0.007787    0.010233    0.012172
    0.014619    0.017168    0.022685    0.026781    0.033347    0.039087
 Highest eigenvalues
    1.864768    1.966134    2.081093    2.110164    2.369582    2.462797
 

........................................................................
.............................. CYCLE    1 ..............................
........................................................................
   1    -40.8358407 -0.408358E+02  0.138E-04    2.72       0.0  T
   2    -40.8358407 -0.973444E-11  0.109E-04    2.72     190.5  T
   3    -40.8358407 -0.214669E-09  0.524E-05    2.72     397.9  T
     SCC iter.                  ...        0 min,  0.004 sec
     gradient                   ...        0 min,  0.014 sec
 * total energy  :   -40.2988204 Eh     change       -0.1218327E-07 Eh
   gradient norm :     0.0701844 Eh/α   predicted     0.0000000E+00 (-100.00%)
   displ. norm   :     0.2147148 α      lambda       -0.6514336E-02
   maximum displ.:     0.0789168 α      in ANC's #4, #3, #22, ...

........................................................................
.............................. CYCLE    2 ..............................
........................................................................
   1    -40.8431114 -0.408431E+02  0.224E-01    2.82       0.0  T
   2    -40.8432256 -0.114174E-03  0.134E-01    2.79       1.0  T
   3    -40.8432001  0.254699E-04  0.696E-02    2.79       1.0  T
   4    -40.8432322 -0.320628E-04  0.305E-02    2.79       1.0  T
   5    -40.8432478 -0.156305E-04  0.778E-03    2.79       2.7  T
   6    -40.8432483 -0.438968E-06  0.274E-03    2.79       7.6  T
   7    -40.8432483 -0.276007E-07  0.106E-03    2.79      19.6  T
     SCC iter.                  ...        0 min,  0.008 sec
     gradient                   ...        0 min,  0.013 sec
 * total energy  :   -40.3034062 Eh     change       -0.4585810E-02 Eh
   gradient norm :     0.0287335 Eh/α   predicted    -0.3407356E-02 ( -25.70%)
   displ. norm   :     0.2276164 α      lambda       -0.2320884E-02
   maximum displ.:     0.1163163 α      in ANC's #4, #3, #5, ...

........................................................................
.............................. CYCLE    3 ..............................
........................................................................
   1    -40.8452804 -0.408453E+02  0.219E-01    2.84       0.0  T
   2    -40.8453400 -0.595954E-04  0.131E-01    2.83       1.0  T
   3    -40.8452946  0.454065E-04  0.670E-02    2.83       1.0  T
   4    -40.8453483 -0.536611E-04  0.239E-02    2.83       1.0  T
   5    -40.8453575 -0.923601E-05  0.638E-03    2.83       3.3  T
   6    -40.8453576 -0.149248E-06  0.239E-03    2.83       8.7  T
   7    -40.8453577 -0.239958E-07  0.831E-04    2.83      25.1  T
     SCC iter.                  ...        0 min,  0.008 sec
     gradient                   ...        0 min,  0.013 sec
 * total energy  :   -40.3047958 Eh     change       -0.1389615E-02 Eh
   gradient norm :     0.0067588 Eh/α   predicted    -0.1220569E-02 ( -12.16%)
   displ. norm   :     0.2282492 α      lambda       -0.5567441E-03
   maximum displ.:     0.1413228 α      in ANC's #4, #3, #1, ...

........................................................................
.............................. CYCLE    4 ..............................
........................................................................
   1    -40.8441016 -0.408441E+02  0.154E-01    2.83       0.0  T
   2    -40.8441110 -0.939049E-05  0.891E-02    2.83       1.0  T
   3    -40.8441011  0.989428E-05  0.275E-02    2.82       1.0  T
   4    -40.8441123 -0.112097E-04  0.111E-02    2.83       1.9  T
   5    -40.8441138 -0.150465E-05  0.417E-03    2.83       5.0  T
   6    -40.8441139 -0.698071E-07  0.111E-03    2.83      18.9  T
   7    -40.8441139 -0.739830E-08  0.568E-04    2.83      36.7  T
     SCC iter.                  ...        0 min,  0.008 sec
     gradient                   ...        0 min,  0.013 sec
 * total energy  :   -40.3051559 Eh     change       -0.3600836E-03 Eh
   gradient norm :     0.0084570 Eh/α   predicted    -0.2928746E-03 ( -18.66%)
   displ. norm   :     0.2795415 α      lambda       -0.5142477E-03
   maximum displ.:     0.1567732 α      in ANC's #4, #3, #1, ...

........................................................................
.............................. CYCLE    5 ..............................
........................................................................
   1    -40.8424763 -0.408425E+02  0.196E-01    2.80       0.0  T
   2    -40.8424849 -0.853910E-05  0.114E-01    2.80       1.0  T
   3    -40.8424617  0.231650E-04  0.401E-02    2.80       1.0  T
   4    -40.8424888 -0.270565E-04  0.103E-02    2.80       2.0  T
   5    -40.8424895 -0.778066E-06  0.388E-03    2.80       5.4  T
   6    -40.8424896 -0.475540E-07  0.115E-03    2.80      18.2  T
   7    -40.8424896 -0.665416E-08  0.647E-04    2.80      32.3  T
     SCC iter.                  ...        0 min,  0.008 sec
     gradient                   ...        0 min,  0.013 sec
 * total energy  :   -40.3055102 Eh     change       -0.3542967E-03 Eh
   gradient norm :     0.0100547 Eh/α   predicted    -0.2772273E-03 ( -21.75%)
   displ. norm   :     0.2782557 α      lambda       -0.4516437E-03
   maximum displ.:     0.1536342 α      in ANC's #4, #3, #1, ...

........................................................................
.............................. CYCLE    6 ..............................
........................................................................
   1    -40.8430091 -0.408430E+02  0.188E-01    2.78       0.0  T
   2    -40.8430159 -0.687467E-05  0.106E-01    2.78       1.0  T
   3    -40.8430158  0.139541E-06  0.170E-02    2.78       1.2  T
   4    -40.8430173 -0.145811E-05  0.985E-03    2.78       2.1  T
   5    -40.8430181 -0.804257E-06  0.354E-03    2.78       5.9  T
   6    -40.8430182 -0.175769E-06  0.107E-03    2.78      19.5  T
   7    -40.8430182 -0.415559E-08  0.613E-04    2.78      34.0  T
     SCC iter.                  ...        0 min,  0.008 sec
     gradient                   ...        0 min,  0.013 sec
 * total energy  :   -40.3058552 Eh     change       -0.3449946E-03 Eh
   gradient norm :     0.0092028 Eh/α   predicted    -0.2433088E-03 ( -29.47%)
   displ. norm   :     0.2910294 α      lambda       -0.4750680E-03
   maximum displ.:     0.1751263 α      in ANC's #3, #4, #1, ...

........................................................................
.............................. CYCLE    7 ..............................
........................................................................
   1    -40.8454233 -0.408454E+02  0.194E-01    2.76       0.0  T
   2    -40.8454319 -0.861426E-05  0.109E-01    2.76       1.0  T
   3    -40.8454294  0.255916E-05  0.215E-02    2.76       1.0  T
   4    -40.8454335 -0.409680E-05  0.117E-02    2.76       1.8  T
   5    -40.8454347 -0.125164E-05  0.416E-03    2.76       5.0  T
   6    -40.8454349 -0.158459E-06  0.112E-03    2.76      18.6  T
   7    -40.8454349 -0.312571E-08  0.644E-04    2.76      32.4  T
     SCC iter.                  ...        0 min,  0.008 sec
     gradient                   ...        0 min,  0.013 sec
 * total energy  :   -40.3061893 Eh     change       -0.3341566E-03 Eh
   gradient norm :     0.0071759 Eh/α   predicted    -0.2576693E-03 ( -22.89%)
   displ. norm   :     0.3103570 α      lambda       -0.2888162E-03
   maximum displ.:     0.1949966 α      in ANC's #3, #4, #1, ...

........................................................................
.............................. CYCLE    8 ..............................
........................................................................
   1    -40.8439664 -0.408440E+02  0.199E-01    2.74       0.0  T
   2    -40.8439743 -0.794131E-05  0.112E-01    2.74       1.0  T
   3    -40.8439761 -0.181881E-05  0.151E-02    2.74       1.4  T
   4    -40.8439765 -0.337760E-06  0.670E-03    2.74       3.1  T
   5    -40.8439766 -0.107569E-06  0.239E-03    2.74       8.7  T
   6    -40.8439767 -0.847286E-07  0.109E-03    2.74      19.2  T
     SCC iter.                  ...        0 min,  0.007 sec
     gradient                   ...        0 min,  0.013 sec
 * total energy  :   -40.3063718 Eh     change       -0.1824980E-03 Eh
   gradient norm :     0.0092026 Eh/α   predicted    -0.1583208E-03 ( -13.25%)
   displ. norm   :     0.2132300 α      lambda       -0.3463482E-03
   maximum displ.:     0.1455002 α      in ANC's #3, #1, #4, ...

........................................................................
.............................. CYCLE    9 ..............................
........................................................................
   1    -40.8481855 -0.408482E+02  0.149E-01    2.75       0.0  T
   2    -40.8481939 -0.833910E-05  0.847E-02    2.75       1.0  T
   3    -40.8481796  0.142789E-04  0.349E-02    2.75       1.0  T
   4    -40.8481969 -0.173050E-04  0.953E-03    2.75       2.2  T
   5    -40.8481975 -0.649842E-06  0.378E-03    2.75       5.5  T
   6    -40.8481976 -0.358604E-07  0.112E-03    2.75      18.6  T
   7    -40.8481976 -0.993748E-08  0.643E-04    2.75      32.4  T
     SCC iter.                  ...        0 min,  0.008 sec
     gradient                   ...        0 min,  0.013 sec
 * total energy  :   -40.3064917 Eh     change       -0.1198937E-03 Eh
   gradient norm :     0.0077486 Eh/α   predicted    -0.1810519E-03 (  51.01%)
   displ. norm   :     0.1584179 α      lambda       -0.1681596E-03
   maximum displ.:     0.0964604 α      in ANC's #3, #2, #4, ...

........................................................................
.............................. CYCLE   10 ..............................
........................................................................
   1    -40.8461580 -0.408462E+02  0.898E-02    2.75       0.0  T
   2    -40.8461595 -0.147532E-05  0.509E-02    2.75       1.0  T
   3    -40.8461573  0.219886E-05  0.140E-02    2.75       1.5  T
   4    -40.8461600 -0.276251E-05  0.489E-03    2.75       4.3  T
   5    -40.8461601 -0.109955E-06  0.123E-03    2.75      16.9  T
   6    -40.8461602 -0.129010E-07  0.459E-04    2.75      45.5  T
     SCC iter.                  ...        0 min,  0.007 sec
     gradient                   ...        0 min,  0.013 sec
 * total energy  :   -40.3065671 Eh     change       -0.7537009E-04 Eh
   gradient norm :     0.0063153 Eh/α   predicted    -0.8620290E-04 (  14.37%)
   displ. norm   :     0.0511991 α      lambda       -0.9581884E-04
   maximum displ.:     0.0392375 α      in ANC's #2, #8, #3, ...

........................................................................
.............................. CYCLE   11 ..............................
........................................................................
   1    -40.8455512 -0.408456E+02  0.529E-02    2.75       0.0  T
   2    -40.8455527 -0.146623E-05  0.298E-02    2.74       1.0  T
   3    -40.8455504  0.231551E-05  0.133E-02    2.74       1.6  T
   4    -40.8455531 -0.273998E-05  0.394E-03    2.74       5.3  T
   5    -40.8455533 -0.124137E-06  0.148E-03    2.74      14.1  T
   6    -40.8455533 -0.565112E-08  0.427E-04    2.74      48.8  T
     SCC iter.                  ...        0 min,  0.007 sec
     gradient                   ...        0 min,  0.013 sec
 * total energy  :   -40.3066151 Eh     change       -0.4803202E-04 Eh
   gradient norm :     0.0054364 Eh/α   predicted    -0.4803602E-04 (   0.01%)
   displ. norm   :     0.0805587 α      lambda       -0.8560567E-04
   maximum displ.:     0.0420554 α      in ANC's #1, #2, #8, ...

........................................................................
.............................. CYCLE   12 ..............................
........................................................................
   1    -40.8473011 -0.408473E+02  0.635E-02    2.76       0.0  T
   2    -40.8473032 -0.206166E-05  0.346E-02    2.76       1.0  T
   3    -40.8473030  0.259308E-06  0.865E-03    2.76       2.4  T
   4    -40.8473035 -0.517813E-06  0.429E-03    2.76       4.9  T
   5    -40.8473036 -0.159658E-06  0.182E-03    2.76      11.4  T
   6    -40.8473037 -0.299135E-07  0.491E-04    2.76      42.5  T
     SCC iter.                  ...        0 min,  0.007 sec
     gradient                   ...        0 min,  0.013 sec
 * total energy  :   -40.3066630 Eh     change       -0.4785872E-04 Eh
   gradient norm :     0.0036211 Eh/α   predicted    -0.4308181E-04 (  -9.98%)
   displ. norm   :     0.1429663 α      lambda       -0.6139458E-04
   maximum displ.:     0.0966125 α      in ANC's #2, #3, #4, ...

........................................................................
.............................. CYCLE   13 ..............................
........................................................................
   1    -40.8465296 -0.408465E+02  0.998E-02    2.75       0.0  T
   2    -40.8465317 -0.210208E-05  0.556E-02    2.75       1.0  T
   3    -40.8465321 -0.423635E-06  0.789E-03    2.75       2.6  T
   4    -40.8465321  0.549250E-07  0.411E-03    2.75       5.1  T
   5    -40.8465323 -0.205166E-06  0.155E-03    2.75      13.5  T
   6    -40.8465323 -0.382595E-07  0.496E-04    2.75      42.1  T
   7    -40.8465323 -0.130368E-08  0.283E-04    2.75      73.6  T
     SCC iter.                  ...        0 min,  0.008 sec
     gradient                   ...        0 min,  0.014 sec
 * total energy  :   -40.3067028 Eh     change       -0.3986704E-04 Eh
   gradient norm :     0.0040998 Eh/α   predicted    -0.3132564E-04 ( -21.42%)
   displ. norm   :     0.1609377 α      lambda       -0.6433038E-04
   maximum displ.:     0.1235205 α      in ANC's #2, #3, #8, ...

........................................................................
.............................. CYCLE   14 ..............................
........................................................................
   1    -40.8462726 -0.408463E+02  0.113E-01    2.75       0.0  T
   2    -40.8462754 -0.275929E-05  0.627E-02    2.75       1.0  T
   3    -40.8462757 -0.313135E-06  0.102E-02    2.75       2.0  T
   4    -40.8462757  0.485293E-07  0.660E-03    2.75       3.2  T
   5    -40.8462762 -0.566962E-06  0.155E-03    2.75      13.4  T
   6    -40.8462763 -0.238210E-07  0.574E-04    2.75      36.3  T
     SCC iter.                  ...        0 min,  0.007 sec
     gradient                   ...        0 min,  0.013 sec
 * total energy  :   -40.3067249 Eh     change       -0.2211350E-04 Eh
   gradient norm :     0.0050278 Eh/α   predicted    -0.3300235E-04 (  49.24%)
   displ. norm   :     0.0321532 α      lambda       -0.3448942E-04
   maximum displ.:     0.0271866 α      in ANC's #2, #3, #7, ...

........................................................................
.............................. CYCLE   15 ..............................
........................................................................
   1    -40.8465867 -0.408466E+02  0.205E-02    2.74       0.0  T
   2    -40.8465873 -0.557478E-06  0.115E-02    2.75       1.8  T
   3    -40.8465870  0.259006E-06  0.532E-03    2.75       3.9  T
   4    -40.8465874 -0.337300E-06  0.173E-03    2.75      12.1  T
   5    -40.8465874 -0.330329E-07  0.737E-04    2.75      28.3  T
     SCC iter.                  ...        0 min,  0.006 sec
     gradient                   ...        0 min,  0.013 sec
 * total energy  :   -40.3067472 Eh     change       -0.2224823E-04 Eh
   gradient norm :     0.0019758 Eh/α   predicted    -0.1726350E-04 ( -22.41%)
   displ. norm   :     0.0713551 α      lambda       -0.1878980E-04
   maximum displ.:     0.0622601 α      in ANC's #2, #3, #1, ...

........................................................................
.............................. CYCLE   16 ..............................
........................................................................
   1    -40.8471838 -0.408472E+02  0.424E-02    2.74       0.0  T
   2    -40.8471848 -0.966598E-06  0.240E-02    2.74       1.0  T
   3    -40.8471846  0.222089E-06  0.586E-03    2.74       3.6  T
   4    -40.8471849 -0.337969E-06  0.296E-03    2.74       7.1  T
   5    -40.8471850 -0.922318E-07  0.119E-03    2.74      17.5  T
   6    -40.8471850 -0.669794E-08  0.359E-04    2.74      58.0  T
   7    -40.8471850 -0.750354E-09  0.173E-04    2.74     120.8  T
     SCC iter.                  ...        0 min,  0.008 sec
     gradient                   ...        0 min,  0.014 sec
 * total energy  :   -40.3067652 Eh     change       -0.1801482E-04 Eh
   gradient norm :     0.0019234 Eh/α   predicted    -0.9419492E-05 ( -47.71%)
   displ. norm   :     0.0935492 α      lambda       -0.1382066E-04
   maximum displ.:     0.0832925 α      in ANC's #2, #5, #33, ...

........................................................................
.............................. CYCLE   17 ..............................
........................................................................
   1    -40.8467456 -0.408467E+02  0.513E-02    2.74       0.0  T
   2    -40.8467462 -0.624655E-06  0.291E-02    2.74       1.0  T
   3    -40.8467462  0.980054E-08  0.451E-03    2.74       4.6  T
   4    -40.8467464 -0.129709E-06  0.249E-03    2.74       8.4  T
   5    -40.8467464 -0.506406E-07  0.104E-03    2.74      20.1  T
   6    -40.8467464 -0.122825E-07  0.266E-04    2.74      78.3  T
   7    -40.8467464 -0.334587E-09  0.147E-04    2.74     142.2  T
     SCC iter.                  ...        0 min,  0.008 sec
     gradient                   ...        0 min,  0.014 sec
 * total energy  :   -40.3067780 Eh     change       -0.1283692E-04 Eh
   gradient norm :     0.0021004 Eh/α   predicted    -0.6941734E-05 ( -45.92%)
   displ. norm   :     0.0623884 α      lambda        0.4817605E-05
   maximum displ.:     0.0555297 α      in ANC's #2, #5, #33, ...

........................................................................
.............................. CYCLE   18 ..............................
........................................................................
   1    -40.8463427 -0.408463E+02  0.342E-02    2.74       0.0  T
   2    -40.8463430 -0.279208E-06  0.194E-02    2.74       1.1  T
   3    -40.8463430  0.332656E-07  0.328E-03    2.74       6.4  T
   4    -40.8463431 -0.860853E-07  0.175E-03    2.74      11.9  T
   5    -40.8463431 -0.269170E-07  0.677E-04    2.74      30.8  T
   6    -40.8463431 -0.459446E-08  0.178E-04    2.74     117.4  T
     SCC iter.                  ...        0 min,  0.007 sec
     gradient                   ...        0 min,  0.014 sec
 * total energy  :   -40.3067771 Eh     change        0.9537574E-06 Eh
   gradient norm :     0.0028131 Eh/α   predicted     0.2418049E-05 ( 153.53%)
   displ. norm   :     0.0367539 α      lambda       -0.1198028E-04
   maximum displ.:     0.0200275 α      in ANC's #2, #3, #4, ...

........................................................................
.............................. CYCLE   19 ..............................
........................................................................
   1    -40.8470902 -0.408471E+02  0.233E-02    2.75       0.0  T
   2    -40.8470905 -0.270232E-06  0.136E-02    2.75       1.5  T
   3    -40.8470902  0.209026E-06  0.424E-03    2.75       4.9  T
   4    -40.8470905 -0.248075E-06  0.135E-03    2.75      15.5  T
   5    -40.8470905 -0.223226E-07  0.471E-04    2.75      44.3  T
   6    -40.8470905 -0.949377E-09  0.206E-04    2.75     101.4  T
     SCC iter.                  ...        0 min,  0.007 sec
     gradient                   ...        0 min,  0.014 sec
 * total energy  :   -40.3067826 Eh     change       -0.5552506E-05 Eh
   gradient norm :     0.0014946 Eh/α   predicted    -0.5998830E-05 (   8.04%)
   displ. norm   :     0.0239903 α      lambda       -0.4203945E-05
   maximum displ.:     0.0168657 α      in ANC's #3, #1, #9, ...

........................................................................
.............................. CYCLE   20 ..............................
........................................................................
   1    -40.8469649 -0.408470E+02  0.164E-02    2.75       0.0  T
   2    -40.8469652 -0.329902E-06  0.937E-03    2.75       2.2  T
   3    -40.8469652  0.182066E-07  0.262E-03    2.75       8.0  T
   4    -40.8469653 -0.514522E-07  0.839E-04    2.75      24.8  T
   5    -40.8469653 -0.195284E-08  0.452E-04    2.75      46.2  T
     SCC iter.                  ...        0 min,  0.006 sec
     gradient                   ...        0 min,  0.014 sec
 * total energy  :   -40.3067846 Eh     change       -0.1925355E-05 Eh
   gradient norm :     0.0010143 Eh/α   predicted    -0.2104085E-05 (   9.28%)
   displ. norm   :     0.0238757 α      lambda       -0.2143959E-05
   maximum displ.:     0.0145648 α      in ANC's #2, #5, #4, ...
 * RMSD in coord.:     0.4779051 α      energy gain  -0.7964226E-02 Eh

generating ANC from model Hessian ...
Using Lindh-Hessian (1995)
 Shifting diagonal of input Hessian by   3.527788768916630E-003
 Lowest  eigenvalues of input Hessian
   -0.000000   -0.000000    0.000000    0.000000    0.000000    0.000000
    0.005000    0.005645    0.007062    0.007877    0.009961    0.012170
    0.014129    0.016697    0.023313    0.026557    0.033627    0.040759
 Highest eigenvalues
    1.848142    1.968941    2.033397    2.051930    2.376137    2.453231
 

........................................................................
.............................. CYCLE   21 ..............................
........................................................................
   1    -40.8469599 -0.408470E+02  0.152E-02    2.75       0.0  T
   2    -40.8469600 -0.752575E-07  0.858E-03    2.75       2.4  T
   3    -40.8469600  0.317001E-07  0.204E-03    2.75      10.2  T
   4    -40.8469600 -0.546624E-07  0.938E-04    2.75      22.2  T
   5    -40.8469601 -0.675526E-08  0.370E-04    2.75      56.4  T
     SCC iter.                  ...        0 min,  0.006 sec
     gradient                   ...        0 min,  0.014 sec
 * total energy  :   -40.3067861 Eh     change       -0.1496007E-05 Eh
   gradient norm :     0.0004543 Eh/α   predicted     0.0000000E+00 (-100.00%)
   displ. norm   :     0.0081601 α      lambda       -0.5641531E-06
   maximum displ.:     0.0057461 α      in ANC's #1, #5, #13, ...

   *** GEOMETRY OPTIMIZATION CONVERGED AFTER 21 ITERATIONS ***

------------------------------------------------------------------------
 total energy gain   :        -0.0079657 Eh       -4.9986 kcal/mol
 total RMSD          :         0.4779051 a0        0.2529 Å
 total power (kW/mol):        -0.9959048 (step)  -31.8137 (real)
------------------------------------------------------------------------

 ANCopt (total)                0 d,  0 h,  0 min,  0.657 sec
 optimizer setup                ...        0 min,  0.000 sec (  0.023%)
 model hessian                  ...        0 min,  0.009 sec (  1.346%)
 ANC generation                 ...        0 min,  0.001 sec (  0.193%)
 coordinate transformation      ...        0 min,  0.000 sec (  0.054%)
 single point calculation       ...        0 min,  0.638 sec ( 97.068%)
 optimization log               ...        0 min,  0.002 sec (  0.306%)
 hessian update                 ...        0 min,  0.000 sec (  0.041%)
 rational function              ...        0 min,  0.005 sec (  0.771%)

================
 final structure:
================
$coord
    2.54128527648608    2.30667973734304    0.14871053199455      C 
    4.77557801756190   -0.06092683167665    0.07153878737534      S 
    0.18133440211978    1.31275313352904    0.06433005638338      C 
   -2.44215789045181    2.24641485390971    0.06560236453572      C 
   -3.25380896531597    4.37099464594154    0.14319235680070      O 
   -3.91256095364008    0.07410706135022   -0.06867959157409      N 
   -6.64716414425883    0.12909482536672   -0.06002063280544      C 
   -7.68342418012492    0.16872305488958    2.62806232108238      C 
   -2.53427903891412   -2.16326560477372   -0.14518593592521      C 
   -3.47376963295189   -4.23878634041458   -0.26839270712618      O 
    0.13109124290010   -1.37626292262997   -0.06495511353716      C 
    2.48861124238637   -2.45543104876014   -0.08071265946649      C 
    3.31712823174750   -5.04066579429446   -0.19279875215566      C 
    1.77321944971945   -7.02282840746367   -0.32187876014657      C 
    3.11262822252797    4.24650792178516    0.24966211739490      H 
   -7.29716295517614   -1.55656758276190   -1.05949337954928      H 
   -7.23721290315421    1.82486620298531   -1.08008914371210      H 
   -7.07408804952391   -1.50726412273224    3.65020720120616      H 
   -9.73524532278046    0.20508056425086    2.58089148012064      H 
   -7.01425262525290    1.83968960906219    3.61997357882327      H 
    5.34742155008121   -5.29165313511394   -0.16640899342866      H 
   -0.24914370549051   -6.80601385900356   -0.35254997318658      H 
    2.50913288014787   -8.91709434973839   -0.40234355075144      H 
$end
           -------------------------------------------------
          |                Final Singlepoint                |
           -------------------------------------------------

          ...................................................
          :                      SETUP                      :
          :.................................................:
          :  # basis functions                  71          :
          :  # atomic orbitals                  70          :
          :  # shells                           38          :
          :  # electrons                        72          :
          :  max. iterations                   250          :
          :  Hamiltonian                  GFN2-xTB          :
          :  restarted?                      false          :
          :  GBSA solvation                  false          :
          :  PC potential                    false          :
          :  electronic temp.          300.0000000     K    :
          :  accuracy                    1.0000000          :
          :  -> integral cutoff          0.2500000E+02      :
          :  -> integral neglect         0.1000000E-07      :
          :  -> SCF convergence          0.1000000E-05 Eh   :
          :  -> wf. convergence          0.1000000E-03 e    :
          :  Broyden damping             0.4000000          :
          ...................................................

 iter      E             dE          RMSdq      gap      omega  full diag
   1    -40.8469601 -0.408470E+02  0.146E-04    2.75       0.0  T
   2    -40.8469601 -0.360885E-10  0.648E-05    2.75     321.6  T
   3    -40.8469601  0.365930E-11  0.592E-05    2.75     352.5  T

   *** convergence criteria satisfied after 3 iterations ***

         #    Occupation            Energy/Eh            Energy/eV
      -------------------------------------------------------------
         1        2.0000           -0.7575493             -20.6140
       ...           ...                  ...                  ...
        30        2.0000           -0.4548458             -12.3770
        31        2.0000           -0.4524144             -12.3108
        32        2.0000           -0.4346494             -11.8274
        33        2.0000           -0.4219885             -11.4829
        34        2.0000           -0.4194852             -11.4148
        35        2.0000           -0.4181924             -11.3796
        36        2.0000           -0.4066104             -11.0644 (HOMO)
        37                         -0.3056547              -8.3173 (LUMO)
        38                         -0.2927968              -7.9674
        39                         -0.2323304              -6.3220
        40                         -0.2100471              -5.7157
        41                         -0.1721162              -4.6835
       ...                                ...                  ...
        70                          0.7522659              20.4702
      -------------------------------------------------------------
                  HL-Gap            0.1009558 Eh            2.7471 eV
             Fermi-level           -0.3561326 Eh           -9.6909 eV

 SCC (total)                   0 d,  0 h,  0 min,  0.028 sec
 SCC setup                      ...        0 min,  0.000 sec (  0.694%)
 Dispersion                     ...        0 min,  0.000 sec (  0.715%)
 integral evaluation            ...        0 min,  0.009 sec ( 32.122%)
 zeroth order Hamiltonian       ...        0 min,  0.000 sec (  0.587%)
 iterations                     ...        0 min,  0.004 sec ( 14.684%)
 molecular gradient             ...        0 min,  0.014 sec ( 49.841%)
 printout                       ...        0 min,  0.000 sec (  1.195%)

         :::::::::::::::::::::::::::::::::::::::::::::::::::::
         ::                     SUMMARY                     ::
         :::::::::::::::::::::::::::::::::::::::::::::::::::::
         :: total energy             -40.306786086779 Eh    ::
         :: gradient norm              0.000453468829 Eh/a0 ::
         :: HOMO-LUMO gap              2.747146423609 eV    ::
         ::.................................................::
         :: SCC energy               -40.846960051655 Eh    ::
         :: -> isotropic ES            0.059209741784 Eh    ::
         :: -> anisotropic ES          0.000281045243 Eh    ::
         :: -> anisotropic XC          0.012510715872 Eh    ::
         :: -> dispersion             -0.024265613437 Eh    ::
         :: repulsion energy           0.540094476022 Eh    ::
         :: add. restraining           0.000000000000 Eh    ::
         :::::::::::::::::::::::::::::::::::::::::::::::::::::

           -------------------------------------------------
          |                Property Printout                |
           -------------------------------------------------

    * Orbital Energies and Occupations

         #    Occupation            Energy/Eh            Energy/eV
      -------------------------------------------------------------
         1        2.0000           -0.7575493             -20.6140
       ...           ...                  ...                  ...
        24        2.0000           -0.5000039             -13.6058
        25        2.0000           -0.4969945             -13.5239
        26        2.0000           -0.4916971             -13.3798
        27        2.0000           -0.4775846             -12.9957
        28        2.0000           -0.4727037             -12.8629
        29        2.0000           -0.4621958             -12.5770
        30        2.0000           -0.4548458             -12.3770
        31        2.0000           -0.4524144             -12.3108
        32        2.0000           -0.4346494             -11.8274
        33        2.0000           -0.4219885             -11.4829
        34        2.0000           -0.4194852             -11.4148
        35        2.0000           -0.4181924             -11.3796
        36        2.0000           -0.4066104             -11.0644 (HOMO)
        37                         -0.3056547              -8.3173 (LUMO)
        38                         -0.2927968              -7.9674
        39                         -0.2323304              -6.3220
        40                         -0.2100471              -5.7157
        41                         -0.1721162              -4.6835
        42                         -0.1470834              -4.0023
        43                         -0.1392155              -3.7882
        44                         -0.0335676              -0.9134
        45                          0.0009262               0.0252
        46                          0.0051400               0.1399
        47                          0.0137531               0.3742
       ...                                ...                  ...
        70                          0.7522659              20.4702
      -------------------------------------------------------------
                  HL-Gap            0.1009558 Eh            2.7471 eV
             Fermi-level           -0.3561326 Eh           -9.6909 eV

     #   Z        covCN         q      C6AA      α(0)
     1   6 C      2.923    -0.008    28.218     8.711
     2  16 S      2.380     0.026   140.013    19.915
     3   6 C      3.256    -0.041    27.854     8.534
     4   6 C      2.815     0.280    22.273     7.732
     5   8 O      0.857    -0.378    21.256     6.181
     6   7 N      2.803    -0.107    23.331     7.174
     7   6 C      3.740     0.011    20.465     6.455
     8   6 C      3.752    -0.109    22.646     6.786
     9   6 C      2.821     0.281    22.249     7.729
    10   8 O      0.857    -0.390    21.477     6.213
    11   6 C      3.228    -0.052    28.456     8.664
    12   6 C      2.980     0.041    27.070     8.534
    13   6 C      2.926    -0.030    28.750     8.793
    14   6 C      2.841    -0.078    29.945     8.968
    15   1 H      0.926     0.071     2.072     2.251
    16   1 H      0.924     0.067     2.120     2.277
    17   1 H      0.924     0.064     2.147     2.292
    18   1 H      0.925     0.050     2.326     2.385
    19   1 H      0.925     0.051     2.304     2.374
    20   1 H      0.925     0.052     2.297     2.370
    21   1 H      0.925     0.051     2.306     2.375
    22   1 H      0.926     0.090     1.878     2.143
    23   1 H      0.926     0.058     2.224     2.332

 Mol. C6AA /au·bohr⁶  :       8040.149018
 Mol. C8AA /au·bohr⁸  :     215958.907078
 Mol. α(0) /au        :        141.189009


Wiberg/Mayer (AO) data.
largest (>0.10) Wiberg bond orders for each atom
          total WBO             WBO to atom ...
     1  C   3.959        C    3 1.582    S    2 1.203    H   15 0.966
     2  S   2.638        C    1 1.203    C   12 1.136
     3  C   3.983        C    1 1.582    C   11 1.194    C    4 1.001
     4  C   3.947        O    5 1.738    N    6 1.111    C    3 1.001
     5  O   2.068        C    4 1.738    N    6 0.135
     6  N   3.561        C    4 1.111    C    9 1.109    C    7 0.974    O    5 0.135    O   10 0.130
     7  C   3.958        C    8 1.008    N    6 0.974    H   17 0.969    H   16 0.969
     8  C   3.990        C    7 1.008    H   18 0.987    H   20 0.986    H   19 0.984
     9  C   3.949        O   10 1.715    N    6 1.109    C   11 1.017
    10  O   2.068        C    9 1.715    N    6 0.130
    11  C   3.980        C   12 1.489    C    3 1.194    C    9 1.017
    12  C   3.956        C   11 1.489    C   13 1.140    S    2 1.136
    13  C   3.989        C   14 1.852    C   12 1.140    H   21 0.962
    14  C   3.974        C   13 1.852    H   23 0.976    H   22 0.961
    15  H   0.994        C    1 0.966
    16  H   0.995        C    7 0.969
    17  H   0.995        C    7 0.969
    18  H   0.998        C    8 0.987
    19  H   0.997        C    8 0.984
    20  H   0.997        C    8 0.986
    21  H   0.997        C   13 0.962
    22  H   0.992        C   14 0.961
    23  H   0.996        C   14 0.976

molecular dipole:
                 x           y           z       tot (Debye)
 q only:        0.773      -0.461       0.091
   full:        0.679      -0.351       0.072       1.951
molecular quadrupole (traceless):
                xx          xy          yy          xz          yz          zz
 q only:        8.181      -1.498      -7.844      -1.187      -0.270      -0.336
  q+dip:        7.576      -1.027      -7.616      -0.511      -0.349       0.040
   full:        5.674      -1.190      -9.081      -0.789      -0.555       3.407

           -------------------------------------------------
          |                Geometry Summary                 |
           -------------------------------------------------

      molecular mass/u    :      207.2466000
   center of mass at/Å    :       -0.3671246      -0.4028118       0.0790017
  moments of inertia/u·Å² :        0.4945683E+03   0.9981368E+03   0.1440660E+04
rotational constants/cm⁻¹ :        0.3408555E-01   0.1688910E-01   0.1170133E-01

 * 21 selected distances

     #   Z        #   Z                                     value/Å
     1   6 C      2  16 S                                 1.7231673
     1   6 C      3   6 C                                 1.3558073
     4   6 C      5   8 O                                 1.2042285
     4   6 C      6   7 N                                 1.3899380
     6   7 N      7   6 C                                 1.4473896
     7   6 C      8   6 C                                 1.5246547
     6   7 N      9   6 C                                 1.3911778
     9   6 C     10   8 O                                 1.2073604
     3   6 C     11   6 C                                 1.4248579
     2  16 S     12   6 C                                 1.7540488 (max)
    11   6 C     12   6 C                                 1.3720652
    13   6 C     14   6 C                                 1.3313078
     1   6 C     15   1 H                                 1.0714444 (min)
     7   6 C     16   1 H                                 1.0925815
     7   6 C     17   1 H                                 1.0927655
     8   6 C     18   1 H                                 1.0877140
     8   6 C     19   1 H                                 1.0862344
     8   6 C     20   1 H                                 1.0875600
    13   6 C     21   1 H                                 1.0826535
    14   6 C     22   1 H                                 1.0764436
    14   6 C     23   1 H                                 1.0762334

 * 5 distinct bonds (by element types)

   Z      Z             #   av. dist./Å        max./Å        min./Å
   1 H    6 C           9     1.0837367     1.0927655     1.0714444
   6 C    6 C           5     1.4017386     1.5246547     1.3313078
   6 C    7 N           3     1.4095018     1.4473896     1.3899380
   6 C    8 O           2     1.2057945     1.2073604     1.2042285
   6 C   16 S           2     1.7386081     1.7540488     1.7231673


optimized geometry written to: xtbopt.xyz


           -------------------------------------------------
          | TOTAL ENERGY              -40.306786086779 Eh   |
          | GRADIENT NORM               0.000453468829 Eh/α |
          | HOMO-LUMO GAP               2.747146423609 eV   |
           -------------------------------------------------

------------------------------------------------------------------------
 * finished run on 2021/05/19 at 10:59:16.042     
------------------------------------------------------------------------
 total:
 * wall-time:     0 d,  0 h,  0 min,  0.747 sec
 *  cpu-time:     0 d,  0 h,  0 min,  0.745 sec
 * ratio c/w:     0.997 speedup
 SCF:
 * wall-time:     0 d,  0 h,  0 min,  0.040 sec
 *  cpu-time:     0 d,  0 h,  0 min,  0.039 sec
 * ratio c/w:     0.997 speedup
 ANC optimizer:
 * wall-time:     0 d,  0 h,  0 min,  0.686 sec
 *  cpu-time:     0 d,  0 h,  0 min,  0.684 sec
 * ratio c/w:     0.998 speedup

