      -----------------------------------------------------------      
     |                   =====================                   |     
     |                           x T B                           |     
     |                   =====================                   |     
     |                         S. Grimme                         |     
     |          Mulliken Center for Theoretical Chemistry        |     
     |                    University of Bonn                     |     
     |                Version 6.2 RC2 (SAW190805)                |     
      -----------------------------------------------------------      

   This program is distributed in the hope that it will be useful,
   but WITHOUT ANY WARRANTY; without even the implied warranty of
   MERCHANTABILITY or FITNESS FOR A PARTICULAR PURPOSE.
   
   FOR NON-COMMERCIAL, ACADEMIA USE ONLY.
   
   Cite this work as:
   * S. Grimme, C. Bannwarth, P. Shushkov, J. Chem. Theory Comput., 2017,
     13, 1989-2009. DOI: 10.1021/acs.jctc.7b00118
   * C. Bannwarth, S. Ehlert and S. Grimme., J. Chem. Theory Comput., 2019,
     15, 1652-1671. DOI: 10.1021/acs.jctc.8b01176
   * P. Pracht, E. Caldeweyher, S. Ehlert, S. Grimme, ChemRxiv, 2019, preprint.
     DOI: 10.26434/chemrxiv.8326202.v1
   
   for DFT-D4:
   * E. Caldeweyher, C. Bannwarth and S. Grimme, J. Chem. Phys., 2017,
     147, 034112. DOI: 10.1063/1.4993215
   * E. Caldeweyher, S. Ehlert, A. Hansen, H. Neugebauer, S. Spicher,
     C. Bannwarth and S. Grimme, J. Chem. Phys., 2019, 150, 154122.
     DOI: 10.1063/1.5090222
   
   for sTDA-xTB:
   * S. Grimme and C. Bannwarth, J. Chem. Phys., 2016, 145, 054103.
     DOI: 10.1063/1.4959605
   
   in the mass-spec context:
   * V. Asgeirsson, C. Bauer and S. Grimme, Chem. Sci., 2017, 8, 4879.
     DOI: 10.1039/c7sc00601b
   
   for metadynamics refer to:
   * S. Grimme, J. Chem. Theory Comput., 2019, 155, 2847-2862
     DOI: 10.1021/acs.jctc.9b00143
   
   with help from (in alphabetical order)
   C. Bannwarth, F. Bohle, G. Brandenburg, E. Caldeweyher, M. Checinski,
   S. Dohm, S. Ehlert, S. Ehrlich, F. März, H. Neugebauer, J. Pisarek,
   P. Pracht, P. Shushkov, and S. Spicher.
   
 * started run on 2021/05/19 at 10:59:16.061     

           -------------------------------------------------
          |                Calculation Setup                |
           -------------------------------------------------

          program call               : /ihome/ghutchison/geoffh/xtb/xtb 513.xyz -opt
          hostname                   : smp-n144
          coordinate file            : 513.xyz
          omp threads                :                     1
          number of atoms            :                    19
          number of electrons        :                    50
          charge                     :                     0
          spin                       :                   0.0
          first test random number   :      0.15568963914812


########################################################################
# WARNING! Please study the warnings concerning your input carefully
#  - the use of '-opt' is discouraged, please use '--opt' next time
########################################################################

           ------------------------------------------------- 
          |                 G F N 2 - x T B                 |
          | Geometry, Frequencies, Noncovalent interactions |
          |            JCTC 2019 parametrisation            |
           ------------------------------------------------- 
             KAB for C  - Si     :                1.0500
             KAB for H  - Pd     :                0.9500
             k(s)              :                1.8500
             k(p)              :                2.2300
             k(d)              :                2.2300
             k(f)              :                2.0000
             kEN (H0ij)        :               -2.0000
             D4 a1             :                0.5200
             D4 a2             :                5.0000
             D4 s6             :                1.0000
             D4 s8             :                2.7000
             D4 s9             :                5.0000
             alphaj            :                2.0000

  Z AO/shell   Hii/eV     exponent
  1     Wed Apr 25 08:07:45 CEST 2018   EN: 2.200 GM2: 0.406  GM3: 0.0800  RAES: 1.40
     1s    -10.707211    1.230000
  6     Wed Apr 25 08:07:45 CEST 2018   EN: 2.550 GM2: 0.538  GM3: 0.1500  RAES: 3.00
     2s    -13.970922    2.096432
     2p    -10.063292    1.800000
  7     Wed Apr 25 08:07:45 CEST 2018   EN: 3.040 GM2: 0.461  GM3:-0.0640  RAES: 1.90
     2s    -16.686243    2.339881
     2p    -12.523956    2.014332

           ------------------------------------------------- 
          |        Self-Consistent Charge Iterations        |
           ------------------------------------------------- 

          ...................................................
          :                      SETUP                      :
          :.................................................:
          :  # basis functions                  49          :
          :  # atomic orbitals                  49          :
          :  # shells                           29          :
          :  # electrons                        50          :
          :  max. iterations                   250          :
          :  Hamiltonian                  GFN2-xTB          :
          :  restarted?                      false          :
          :  GBSA solvation                  false          :
          :  PC potential                    false          :
          :  electronic temp.          300.0000000     K    :
          :  accuracy                    1.0000000          :
          :  -> integral cutoff          0.2500000E+02      :
          :  -> integral neglect         0.1000000E-07      :
          :  -> SCF convergence          0.1000000E-05 Eh   :
          :  -> wf. convergence          0.1000000E-03 e    :
          :  Broyden damping             0.4000000          :
          ...................................................

 iter      E             dE          RMSdq      gap      omega  full diag
   1    -27.1617397 -0.271617E+02  0.506E+00    2.69       0.0  T
   2    -27.1814961 -0.197564E-01  0.306E+00    2.64       1.0  T
   3    -27.1667324  0.147637E-01  0.116E+00    2.57       1.0  T
   4    -27.1827535 -0.160211E-01  0.420E-01    2.45       1.0  T
   5    -27.1850175 -0.226400E-02  0.189E-01    2.50       1.0  T
   6    -27.1854256 -0.408050E-03  0.493E-02    2.48       1.0  T
   7    -27.1854421 -0.165529E-04  0.266E-02    2.48       1.0  T
   8    -27.1854434 -0.125875E-05  0.833E-03    2.48       2.8  T
   9    -27.1854444 -0.107735E-05  0.297E-03    2.48       7.7  T
  10    -27.1854445 -0.495663E-07  0.109E-03    2.48      21.0  T
  11    -27.1854445 -0.429056E-08  0.403E-04    2.48      57.0  T
  12    -27.1854445 -0.105538E-08  0.149E-04    2.48     153.5  T

   *** convergence criteria satisfied after 12 iterations ***

         #    Occupation            Energy/Eh            Energy/eV
      -------------------------------------------------------------
         1        2.0000           -0.6552563             -17.8304
       ...           ...                  ...                  ...
        19        2.0000           -0.4482169             -12.1966
        20        2.0000           -0.4385934             -11.9347
        21        2.0000           -0.4301174             -11.7041
        22        2.0000           -0.4253165             -11.5735
        23        2.0000           -0.4212661             -11.4632
        24        2.0000           -0.3779962             -10.2858
        25        2.0000           -0.3656005              -9.9485 (HOMO)
        26                         -0.2744914              -7.4693 (LUMO)
        27                         -0.2453102              -6.6752
        28                         -0.2090478              -5.6885
        29                         -0.1454501              -3.9579
        30                         -0.0936867              -2.5493
       ...                                ...                  ...
        49                          0.6719132              18.2837
      -------------------------------------------------------------
                  HL-Gap            0.0911092 Eh            2.4792 eV
             Fermi-level           -0.3200460 Eh           -8.7089 eV

 SCC (total)                   0 d,  0 h,  0 min,  0.022 sec
 SCC setup                      ...        0 min,  0.000 sec (  1.101%)
 Dispersion                     ...        0 min,  0.000 sec (  1.129%)
 integral evaluation            ...        0 min,  0.004 sec ( 20.631%)
 zeroth order Hamiltonian       ...        0 min,  0.000 sec (  0.443%)
 iterations                     ...        0 min,  0.009 sec ( 41.303%)
 molecular gradient             ...        0 min,  0.007 sec ( 33.619%)
 printout                       ...        0 min,  0.000 sec (  1.529%)

         :::::::::::::::::::::::::::::::::::::::::::::::::::::
         ::                     SUMMARY                     ::
         :::::::::::::::::::::::::::::::::::::::::::::::::::::
         :: total energy             -26.712601191968 Eh    ::
         :: gradient norm              0.051895570460 Eh/a0 ::
         :: HOMO-LUMO gap              2.479206279900 eV    ::
         ::.................................................::
         :: SCC energy               -27.185444500274 Eh    ::
         :: -> isotropic ES            0.008996767649 Eh    ::
         :: -> anisotropic ES          0.003611970931 Eh    ::
         :: -> anisotropic XC          0.025781195988 Eh    ::
         :: -> dispersion             -0.014769820667 Eh    ::
         :: repulsion energy           0.472922355925 Eh    ::
         :: add. restraining           0.000000000000 Eh    ::
         :::::::::::::::::::::::::::::::::::::::::::::::::::::

      ----------------------------------------------------------- 
     |                   =====================                   |
     |                        A N C O P T                        |
     |                   =====================                   |
     |               Approximate Normal Coordinate               |
     |                Rational Function Optimizer                |
      ----------------------------------------------------------- 

          ...................................................
          :                      SETUP                      :
          :.................................................:
          :   optimization level            normal          :
          :   max. optcycles                   200          :
          :   ANC micro-cycles                  20          :
          :   degrees of freedom                51          :
          :.................................................:
          :   RF solver                   davidson          :
          :   input Hessian                  false          :
          :   write xtbopt.log                true          :
          :   linear?                        false          :
          :   energy convergence         0.5000000E-05 Eh   :
          :   grad. convergence          0.1000000E-02 Eh/α :
          :   maximium RF displ.         2.0000000          :
          :   Hlow (freq-cutoff)         0.5000000E-02      :
          :   Hmax (freq-cutoff)         5.0000000          :
          :   S6 in model hess.         20.0000000          :
          ...................................................

generating ANC from model Hessian ...
Using Lindh-Hessian (1995)
 Shifting diagonal of input Hessian by   3.457699002838070E-003
 Lowest  eigenvalues of input Hessian
   -0.000000    0.000000    0.000000    0.000000    0.000000    0.000000
    0.005000    0.005652    0.006563    0.010988    0.012911    0.018625
    0.022528    0.024141    0.024186    0.029958    0.044094    0.048256
 Highest eigenvalues
    1.665256    1.769595    1.907349    1.973848    2.025030    2.066648
 

........................................................................
.............................. CYCLE    1 ..............................
........................................................................
   1    -27.1854445 -0.271854E+02  0.758E-05    2.48       0.0  T
   2    -27.1854445 -0.109779E-10  0.473E-05    2.48     485.3  T
   3    -27.1854445 -0.133937E-11  0.312E-05    2.48     735.0  T
     SCC iter.                  ...        0 min,  0.003 sec
     gradient                   ...        0 min,  0.007 sec
 * total energy  :   -26.7126012 Eh     change       -0.9736780E-08 Eh
   gradient norm :     0.0518959 Eh/α   predicted     0.0000000E+00 (-100.00%)
   displ. norm   :     0.1390898 α      lambda       -0.3227493E-02
   maximum displ.:     0.0731594 α      in ANC's #10, #16, #31, ...

........................................................................
.............................. CYCLE    2 ..............................
........................................................................
   1    -27.2061320 -0.272061E+02  0.994E-02    2.43       0.0  T
   2    -27.2061610 -0.290473E-04  0.656E-02    2.45       1.0  T
   3    -27.2061691 -0.807790E-05  0.375E-02    2.44       1.0  T
   4    -27.2061746 -0.554377E-05  0.104E-02    2.44       2.2  T
   5    -27.2061760 -0.134743E-05  0.521E-03    2.44       4.4  T
   6    -27.2061763 -0.322113E-06  0.145E-03    2.44      15.8  T
     SCC iter.                  ...        0 min,  0.004 sec
     gradient                   ...        0 min,  0.007 sec
 * total energy  :   -26.7146962 Eh     change       -0.2094991E-02 Eh
   gradient norm :     0.0203297 Eh/α   predicted    -0.1644973E-02 ( -21.48%)
   displ. norm   :     0.0618741 α      lambda       -0.4953928E-03
   maximum displ.:     0.0333961 α      in ANC's #10, #3, #8, ...

........................................................................
.............................. CYCLE    3 ..............................
........................................................................
   1    -27.2123226 -0.272123E+02  0.562E-02    2.39       0.0  T
   2    -27.2123298 -0.728767E-05  0.363E-02    2.40       1.0  T
   3    -27.2123316 -0.178546E-05  0.203E-02    2.40       1.1  T
   4    -27.2123341 -0.244628E-05  0.293E-03    2.40       7.8  T
   5    -27.2123342 -0.879698E-07  0.134E-03    2.40      17.1  T
     SCC iter.                  ...        0 min,  0.004 sec
     gradient                   ...        0 min,  0.007 sec
 * total energy  :   -26.7149583 Eh     change       -0.2620783E-03 Eh
   gradient norm :     0.0040580 Eh/α   predicted    -0.2486490E-03 (  -5.12%)
   displ. norm   :     0.0209299 α      lambda       -0.2707635E-04
   maximum displ.:     0.0166969 α      in ANC's #3, #16, #19, ...

........................................................................
.............................. CYCLE    4 ..............................
........................................................................
   1    -27.2115831 -0.272116E+02  0.140E-02    2.39       0.0  T
   2    -27.2115832 -0.876322E-07  0.855E-03    2.39       2.7  T
   3    -27.2115828  0.350123E-06  0.671E-03    2.39       3.4  T
   4    -27.2115833 -0.493597E-06  0.931E-04    2.39      24.6  T
   5    -27.2115833 -0.785526E-08  0.402E-04    2.39      57.1  T
     SCC iter.                  ...        0 min,  0.004 sec
     gradient                   ...        0 min,  0.007 sec
 * total energy  :   -26.7149772 Eh     change       -0.1896166E-04 Eh
   gradient norm :     0.0015656 Eh/α   predicted    -0.1354687E-04 ( -28.56%)
   displ. norm   :     0.0362593 α      lambda       -0.1038364E-04
   maximum displ.:     0.0324481 α      in ANC's #3, #16, #19, ...

........................................................................
.............................. CYCLE    5 ..............................
........................................................................
   1    -27.2105412 -0.272105E+02  0.203E-02    2.38       0.0  T
   2    -27.2105413 -0.125327E-06  0.124E-02    2.38       1.8  T
   3    -27.2105404  0.925203E-06  0.955E-03    2.38       2.4  T
   4    -27.2105415 -0.116127E-05  0.113E-03    2.38      20.4  T
   5    -27.2105416 -0.126145E-07  0.525E-04    2.38      43.7  T
   6    -27.2105416 -0.123006E-08  0.265E-04    2.38      86.6  T
     SCC iter.                  ...        0 min,  0.004 sec
     gradient                   ...        0 min,  0.007 sec
 * total energy  :   -26.7149827 Eh     change       -0.5503955E-05 Eh
   gradient norm :     0.0012706 Eh/α   predicted    -0.5197003E-05 (  -5.58%)
   displ. norm   :     0.0360670 α      lambda        0.2039545E-04
   maximum displ.:     0.0324492 α      in ANC's #3, #16, #19, ...

........................................................................
.............................. CYCLE    6 ..............................
........................................................................
   1    -27.2094586 -0.272095E+02  0.202E-02    2.37       0.0  T
   2    -27.2094587 -0.124918E-06  0.123E-02    2.37       1.9  T
   3    -27.2094578  0.918943E-06  0.959E-03    2.37       2.4  T
   4    -27.2094590 -0.116330E-05  0.112E-03    2.37      20.5  T
   5    -27.2094590 -0.126192E-07  0.523E-04    2.37      43.8  T
   6    -27.2094590 -0.124335E-08  0.261E-04    2.37      87.9  T
     SCC iter.                  ...        0 min,  0.004 sec
     gradient                   ...        0 min,  0.007 sec
 * total energy  :   -26.7149678 Eh     change        0.1491002E-04 Eh
   gradient norm :     0.0038721 Eh/α   predicted     0.1020058E-04 ( -31.59%)
   displ. norm   :     0.0199865 α      lambda       -0.2221484E-04
   maximum displ.:     0.0160873 α      in ANC's #3, #16, #19, ...

........................................................................
.............................. CYCLE    7 ..............................
........................................................................
   1    -27.2103709 -0.272104E+02  0.130E-02    2.38       0.0  T
   2    -27.2103710 -0.719145E-07  0.798E-03    2.38       2.9  T
   3    -27.2103706  0.352953E-06  0.613E-03    2.38       3.7  T
   4    -27.2103711 -0.455801E-06  0.782E-04    2.38      29.3  T
   5    -27.2103711 -0.597396E-08  0.341E-04    2.38      67.3  T
     SCC iter.                  ...        0 min,  0.004 sec
     gradient                   ...        0 min,  0.007 sec
 * total energy  :   -26.7149827 Eh     change       -0.1482870E-04 Eh
   gradient norm :     0.0016473 Eh/α   predicted    -0.1111249E-04 ( -25.06%)
   displ. norm   :     0.0299300 α      lambda       -0.1093666E-06
   maximum displ.:     0.0241308 α      in ANC's #3, #16, #19, ...

........................................................................
.............................. CYCLE    8 ..............................
........................................................................
   1    -27.2116961 -0.272117E+02  0.194E-02    2.39       0.0  T
   2    -27.2116962 -0.164127E-06  0.120E-02    2.39       1.9  T
   3    -27.2116955  0.778349E-06  0.915E-03    2.39       2.5  T
   4    -27.2116965 -0.100967E-05  0.120E-03    2.39      19.1  T
   5    -27.2116965 -0.142726E-07  0.513E-04    2.39      44.7  T
   6    -27.2116965 -0.138358E-08  0.264E-04    2.39      86.7  T
     SCC iter.                  ...        0 min,  0.004 sec
     gradient                   ...        0 min,  0.007 sec
 * total energy  :   -26.7149773 Eh     change        0.5364021E-05 Eh
   gradient norm :     0.0018456 Eh/α   predicted    -0.5608488E-07 (-101.05%)
   displ. norm   :     0.0256764 α      lambda       -0.1212975E-04
   maximum displ.:     0.0205918 α      in ANC's #3, #11, #15, ...

........................................................................
.............................. CYCLE    9 ..............................
........................................................................
   1    -27.2111492 -0.272111E+02  0.175E-02    2.39       0.0  T
   2    -27.2111493 -0.390389E-07  0.106E-02    2.38       2.2  T
   3    -27.2111487  0.566801E-06  0.658E-03    2.38       3.5  T
   4    -27.2111493 -0.630598E-06  0.632E-04    2.38      36.3  T
   5    -27.2111493 -0.285264E-08  0.324E-04    2.38      70.8  T
     SCC iter.                  ...        0 min,  0.004 sec
     gradient                   ...        0 min,  0.007 sec
 * total energy  :   -26.7149839 Eh     change       -0.6655132E-05 Eh
   gradient norm :     0.0006360 Eh/α   predicted    -0.6067091E-05 (  -8.84%)
   displ. norm   :     0.0258222 α      lambda        0.2203458E-04
   maximum displ.:     0.0205903 α      in ANC's #3, #11, #15, ...

........................................................................
.............................. CYCLE   10 ..............................
........................................................................
   1    -27.2105499 -0.272105E+02  0.178E-02    2.38       0.0  T
   2    -27.2105500 -0.422305E-07  0.107E-02    2.38       2.1  T
   3    -27.2105494  0.558294E-06  0.653E-03    2.38       3.5  T
   4    -27.2105500 -0.620222E-06  0.658E-04    2.38      34.9  T
   5    -27.2105500 -0.331899E-08  0.333E-04    2.38      68.9  T
     SCC iter.                  ...        0 min,  0.004 sec
     gradient                   ...        0 min,  0.007 sec
 * total energy  :   -26.7149675 Eh     change        0.1646324E-04 Eh
   gradient norm :     0.0022302 Eh/α   predicted     0.1101654E-04 ( -33.08%)
   displ. norm   :     0.0157663 α      lambda       -0.2687078E-04
   maximum displ.:     0.0120286 α      in ANC's #11, #4, #6, ...

........................................................................
.............................. CYCLE   11 ..............................
........................................................................
   1    -27.2105189 -0.272105E+02  0.140E-02    2.38       0.0  T
   2    -27.2105189 -0.258774E-08  0.846E-03    2.38       2.7  T
   3    -27.2105189  0.273905E-07  0.135E-03    2.38      17.0  T
   4    -27.2105189 -0.301627E-07  0.188E-04    2.38     121.8  T
   5    -27.2105189 -0.202654E-09  0.110E-04    2.38     208.9  T
     SCC iter.                  ...        0 min,  0.004 sec
     gradient                   ...        0 min,  0.007 sec
 * total energy  :   -26.7149839 Eh     change       -0.1645481E-04 Eh
   gradient norm :     0.0012965 Eh/α   predicted    -0.1343966E-04 ( -18.32%)
   displ. norm   :     0.0168216 α      lambda       -0.5695969E-05
   maximum displ.:     0.0119166 α      in ANC's #3, #16, #11, ...

........................................................................
.............................. CYCLE   12 ..............................
........................................................................
   1    -27.2113283 -0.272113E+02  0.119E-02    2.38       0.0  T
   2    -27.2113284 -0.555977E-07  0.732E-03    2.39       3.1  T
   3    -27.2113281  0.303614E-06  0.552E-03    2.38       4.2  T
   4    -27.2113285 -0.379469E-06  0.705E-04    2.39      32.5  T
   5    -27.2113285 -0.503492E-08  0.291E-04    2.39      78.8  T
     SCC iter.                  ...        0 min,  0.004 sec
     gradient                   ...        0 min,  0.007 sec
 * total energy  :   -26.7149853 Eh     change       -0.1319060E-05 Eh
   gradient norm :     0.0007783 Eh/α   predicted    -0.2848958E-05 ( 115.98%)
   displ. norm   :     0.0137284 α      lambda       -0.1895018E-05
   maximum displ.:     0.0124412 α      in ANC's #3, #16, #1, ...

   *** GEOMETRY OPTIMIZATION CONVERGED AFTER 12 ITERATIONS ***

------------------------------------------------------------------------
 total energy gain   :        -0.0023841 Eh       -1.4960 kcal/mol
 total RMSD          :         0.0533334 a0        0.0282 Å
 total power (kW/mol):        -0.5216136 (step)  -32.1479 (real)
------------------------------------------------------------------------

 ANCopt (total)                0 d,  0 h,  0 min,  0.195 sec
 optimizer setup                ...        0 min,  0.000 sec (  0.073%)
 model hessian                  ...        0 min,  0.002 sec (  0.853%)
 ANC generation                 ...        0 min,  0.000 sec (  0.257%)
 coordinate transformation      ...        0 min,  0.000 sec (  0.083%)
 single point calculation       ...        0 min,  0.189 sec ( 97.116%)
 optimization log               ...        0 min,  0.001 sec (  0.528%)
 hessian update                 ...        0 min,  0.000 sec (  0.073%)
 rational function              ...        0 min,  0.001 sec (  0.631%)

================
 final structure:
================
$coord
    1.15165145312276    2.76574376783940   -0.02095347252673      C 
   -1.37420789754584    2.10193928047292   -0.26843243868421      C 
   -2.19930775394488   -0.24348732005616   -0.22796334838891      N 
   -0.53052029396468   -2.11400786308100    0.06600552599340      C 
    2.05763156532722   -1.63158016048737    0.32948351557450      C 
    2.90152416151724    0.83889983455123    0.28512951187648      C 
   -1.47808304926389   -4.68415336856658    0.10616945469558      C 
   -3.93180386072516   -5.27970279487995   -0.12692634537097      C 
   -4.87889567260277   -7.82684353208593   -0.08380532500889      C 
   -7.31685049403658   -8.40744861099607   -0.30919592559589      C 
    1.72683448295843    4.72110915852964   -0.06573352971346      H 
   -2.81783553918165    3.53253708098249   -0.51109779335370      H 
    3.36677317129810   -3.17939801518097    0.56407282786762      H 
    4.89023370877686    1.26062541467932    0.48568249929475      H 
   -0.07517707534619   -6.15482883775160    0.34233376274567      H 
   -5.28655181818441   -3.76923823182410   -0.35962574597889      H 
   -3.48989605787424   -9.31246538215802    0.14589925114294      H 
   -8.73351796795033   -6.96420759226638   -0.54323486934439      H 
   -7.97643234236355  -10.33133367069286   -0.27283131682794      H 
$end
           -------------------------------------------------
          |                Final Singlepoint                |
           -------------------------------------------------

          ...................................................
          :                      SETUP                      :
          :.................................................:
          :  # basis functions                  49          :
          :  # atomic orbitals                  49          :
          :  # shells                           29          :
          :  # electrons                        50          :
          :  max. iterations                   250          :
          :  Hamiltonian                  GFN2-xTB          :
          :  restarted?                      false          :
          :  GBSA solvation                  false          :
          :  PC potential                    false          :
          :  electronic temp.          300.0000000     K    :
          :  accuracy                    1.0000000          :
          :  -> integral cutoff          0.2500000E+02      :
          :  -> integral neglect         0.1000000E-07      :
          :  -> SCF convergence          0.1000000E-05 Eh   :
          :  -> wf. convergence          0.1000000E-03 e    :
          :  Broyden damping             0.4000000          :
          ...................................................

 iter      E             dE          RMSdq      gap      omega  full diag
   1    -27.2113285 -0.272113E+02  0.104E-04    2.39       0.0  T
   2    -27.2113285 -0.278320E-10  0.529E-05    2.39     433.6  T
   3    -27.2113285 -0.246523E-10  0.404E-05    2.39     567.4  T

   *** convergence criteria satisfied after 3 iterations ***

         #    Occupation            Energy/Eh            Energy/eV
      -------------------------------------------------------------
         1        2.0000           -0.6581753             -17.9099
       ...           ...                  ...                  ...
        19        2.0000           -0.4486989             -12.2097
        20        2.0000           -0.4384322             -11.9303
        21        2.0000           -0.4326604             -11.7733
        22        2.0000           -0.4255837             -11.5807
        23        2.0000           -0.4219607             -11.4821
        24        2.0000           -0.3774367             -10.2706
        25        2.0000           -0.3625560              -9.8657 (HOMO)
        26                         -0.2748900              -7.4801 (LUMO)
        27                         -0.2395437              -6.5183
        28                         -0.2077903              -5.6543
        29                         -0.1429064              -3.8887
        30                         -0.0869241              -2.3653
       ...                                ...                  ...
        49                          0.6887755              18.7425
      -------------------------------------------------------------
                  HL-Gap            0.0876659 Eh            2.3855 eV
             Fermi-level           -0.3187230 Eh           -8.6729 eV

 SCC (total)                   0 d,  0 h,  0 min,  0.015 sec
 SCC setup                      ...        0 min,  0.000 sec (  0.997%)
 Dispersion                     ...        0 min,  0.000 sec (  0.853%)
 integral evaluation            ...        0 min,  0.004 sec ( 29.479%)
 zeroth order Hamiltonian       ...        0 min,  0.000 sec (  0.575%)
 iterations                     ...        0 min,  0.003 sec ( 17.819%)
 molecular gradient             ...        0 min,  0.007 sec ( 48.192%)
 printout                       ...        0 min,  0.000 sec (  1.769%)

         :::::::::::::::::::::::::::::::::::::::::::::::::::::
         ::                     SUMMARY                     ::
         :::::::::::::::::::::::::::::::::::::::::::::::::::::
         :: total energy             -26.714985249252 Eh    ::
         :: gradient norm              0.000777498740 Eh/a0 ::
         :: HOMO-LUMO gap              2.385511788421 eV    ::
         ::.................................................::
         :: SCC energy               -27.211328456515 Eh    ::
         :: -> isotropic ES            0.008785316534 Eh    ::
         :: -> anisotropic ES          0.003251177456 Eh    ::
         :: -> anisotropic XC          0.024932202848 Eh    ::
         :: -> dispersion             -0.014861918675 Eh    ::
         :: repulsion energy           0.496421565139 Eh    ::
         :: add. restraining           0.000000000000 Eh    ::
         :::::::::::::::::::::::::::::::::::::::::::::::::::::

           -------------------------------------------------
          |                Property Printout                |
           -------------------------------------------------

    * Orbital Energies and Occupations

         #    Occupation            Energy/Eh            Energy/eV
      -------------------------------------------------------------
         1        2.0000           -0.6581753             -17.9099
       ...           ...                  ...                  ...
        13        2.0000           -0.5048687             -13.7382
        14        2.0000           -0.4941777             -13.4473
        15        2.0000           -0.4881335             -13.2828
        16        2.0000           -0.4709059             -12.8140
        17        2.0000           -0.4595517             -12.5050
        18        2.0000           -0.4553921             -12.3919
        19        2.0000           -0.4486989             -12.2097
        20        2.0000           -0.4384322             -11.9303
        21        2.0000           -0.4326604             -11.7733
        22        2.0000           -0.4255837             -11.5807
        23        2.0000           -0.4219607             -11.4821
        24        2.0000           -0.3774367             -10.2706
        25        2.0000           -0.3625560              -9.8657 (HOMO)
        26                         -0.2748900              -7.4801 (LUMO)
        27                         -0.2395437              -6.5183
        28                         -0.2077903              -5.6543
        29                         -0.1429064              -3.8887
        30                         -0.0869241              -2.3653
        31                          0.1036858               2.8214
        32                          0.1107936               3.0148
        33                          0.1275687               3.4713
        34                          0.1393682               3.7924
        35                          0.1657396               4.5100
        36                          0.1765694               4.8047
       ...                                ...                  ...
        49                          0.6887755              18.7425
      -------------------------------------------------------------
                  HL-Gap            0.0876659 Eh            2.3855 eV
             Fermi-level           -0.3187230 Eh           -8.6729 eV

     #   Z        covCN         q      C6AA      α(0)
     1   6 C      2.915    -0.043    29.071     8.841
     2   6 C      2.904     0.061    26.631     8.462
     3   7 N      1.843    -0.232    26.926     7.690
     4   6 C      2.959     0.097    25.853     8.340
     5   6 C      2.920    -0.045    29.110     8.848
     6   6 C      2.925    -0.013    28.336     8.730
     7   6 C      2.906    -0.044    29.102     8.846
     8   6 C      2.902    -0.023    28.587     8.767
     9   6 C      2.893    -0.024    28.595     8.767
    10   6 C      2.842    -0.083    30.079     8.988
    11   1 H      0.926     0.032     2.561     2.503
    12   1 H      0.925     0.034     2.526     2.486
    13   1 H      0.926     0.032     2.560     2.502
    14   1 H      0.926     0.031     2.573     2.508
    15   1 H      0.925     0.034     2.524     2.484
    16   1 H      0.926     0.065     2.143     2.289
    17   1 H      0.925     0.036     2.497     2.471
    18   1 H      0.926     0.046     2.376     2.410
    19   1 H      0.926     0.040     2.452     2.449

 Mol. C6AA /au·bohr⁶  :       4518.234624
 Mol. C8AA /au·bohr⁸  :     109643.572628
 Mol. α(0) /au        :        108.381247


Wiberg/Mayer (AO) data.
largest (>0.10) Wiberg bond orders for each atom
          total WBO             WBO to atom ...
     1  C   3.978        C    6 1.430    C    2 1.409    H   11 0.971    C    4 0.100
     2  C   3.983        N    3 1.468    C    1 1.409    H   12 0.963    C    5 0.106
     3  N   3.063        C    2 1.468    C    4 1.361
     4  C   3.980        N    3 1.361    C    5 1.351    C    7 1.110    C    1 0.100
     5  C   3.976        C    6 1.463    C    4 1.351    H   13 0.969    C    2 0.106
     6  C   3.991        C    5 1.463    C    1 1.430    H   14 0.970
     7  C   3.991        C    8 1.741    C    4 1.110    H   15 0.965    C   10 0.129
     8  C   3.987        C    7 1.741    C    9 1.147    H   16 0.959
     9  C   3.991        C   10 1.858    C    8 1.147    H   17 0.964
    10  C   3.961        C    9 1.858    H   19 0.979    H   18 0.976    C    7 0.129
    11  H   0.999        C    1 0.971
    12  H   0.998        C    2 0.963
    13  H   0.999        C    5 0.969
    14  H   0.999        C    6 0.970
    15  H   0.998        C    7 0.965
    16  H   0.996        C    8 0.959
    17  H   0.999        C    9 0.964
    18  H   0.998        C   10 0.976
    19  H   0.998        C   10 0.979

molecular dipole:
                 x           y           z       tot (Debye)
 q only:        0.109      -0.173       0.023
   full:        0.543      -0.059       0.065       1.398
molecular quadrupole (traceless):
                xx          xy          yy          xz          yz          zz
 q only:        0.587       1.890       3.126       0.369      -0.185      -3.713
  q+dip:        2.419       0.778       6.349       1.205      -0.777      -8.768
   full:       -0.304       0.790       4.694       0.409      -0.429      -4.390

           -------------------------------------------------
          |                Geometry Summary                 |
           -------------------------------------------------

      molecular mass/u    :      131.1768000
   center of mass at/Å    :       -0.8483178      -1.3109081      -0.0148446
  moments of inertia/u·Å² :        0.1047288E+03   0.8085880E+03   0.9133147E+03
rotational constants/cm⁻¹ :        0.1609647E+00   0.2084823E-01   0.1845764E-01

 * 17 selected distances

     #   Z        #   Z                                     value/Å
     1   6 C      2   6 C                                 1.3882053
     2   6 C      3   7 N                                 1.3158813
     3   7 N      4   6 C                                 1.3355952
     4   6 C      5   6 C                                 1.4001401 (max)
     1   6 C      6   6 C                                 1.3868553
     5   6 C      6   6 C                                 1.3816892
     7   6 C      8   6 C                                 1.3418331
     9   6 C     10   6 C                                 1.3315436
     1   6 C     11   1 H                                 1.0788333
     2   6 C     12   1 H                                 1.0831416
     5   6 C     13   1 H                                 1.0799138
     6   6 C     14   1 H                                 1.0810043
     7   6 C     15   1 H                                 1.0827858
     8   6 C     16   1 H                                 1.0807394
     9   6 C     17   1 H                                 1.0830898
    10   6 C     18   1 H                                 1.0773230
    10   6 C     19   1 H                                 1.0764179 (min)

 * 3 distinct bonds (by element types)

   Z      Z             #   av. dist./Å        max./Å        min./Å
   1 H    6 C           9     1.0803610     1.0831416     1.0764179
   6 C    6 C           6     1.3717111     1.4001401     1.3315436
   6 C    7 N           2     1.3257383     1.3355952     1.3158813


optimized geometry written to: xtbopt.xyz


           -------------------------------------------------
          | TOTAL ENERGY              -26.714985249252 Eh   |
          | GRADIENT NORM               0.000777498740 Eh/α |
          | HOMO-LUMO GAP               2.385511788421 eV   |
           -------------------------------------------------

------------------------------------------------------------------------
 * finished run on 2021/05/19 at 10:59:16.310     
------------------------------------------------------------------------
 total:
 * wall-time:     0 d,  0 h,  0 min,  0.249 sec
 *  cpu-time:     0 d,  0 h,  0 min,  0.247 sec
 * ratio c/w:     0.994 speedup
 SCF:
 * wall-time:     0 d,  0 h,  0 min,  0.022 sec
 *  cpu-time:     0 d,  0 h,  0 min,  0.022 sec
 * ratio c/w:     0.997 speedup
 ANC optimizer:
 * wall-time:     0 d,  0 h,  0 min,  0.210 sec
 *  cpu-time:     0 d,  0 h,  0 min,  0.210 sec
 * ratio c/w:     0.998 speedup

