      -----------------------------------------------------------      
     |                   =====================                   |     
     |                           x T B                           |     
     |                   =====================                   |     
     |                         S. Grimme                         |     
     |          Mulliken Center for Theoretical Chemistry        |     
     |                    University of Bonn                     |     
     |                Version 6.2 RC2 (SAW190805)                |     
      -----------------------------------------------------------      

   This program is distributed in the hope that it will be useful,
   but WITHOUT ANY WARRANTY; without even the implied warranty of
   MERCHANTABILITY or FITNESS FOR A PARTICULAR PURPOSE.
   
   FOR NON-COMMERCIAL, ACADEMIA USE ONLY.
   
   Cite this work as:
   * S. Grimme, C. Bannwarth, P. Shushkov, J. Chem. Theory Comput., 2017,
     13, 1989-2009. DOI: 10.1021/acs.jctc.7b00118
   * C. Bannwarth, S. Ehlert and S. Grimme., J. Chem. Theory Comput., 2019,
     15, 1652-1671. DOI: 10.1021/acs.jctc.8b01176
   * P. Pracht, E. Caldeweyher, S. Ehlert, S. Grimme, ChemRxiv, 2019, preprint.
     DOI: 10.26434/chemrxiv.8326202.v1
   
   for DFT-D4:
   * E. Caldeweyher, C. Bannwarth and S. Grimme, J. Chem. Phys., 2017,
     147, 034112. DOI: 10.1063/1.4993215
   * E. Caldeweyher, S. Ehlert, A. Hansen, H. Neugebauer, S. Spicher,
     C. Bannwarth and S. Grimme, J. Chem. Phys., 2019, 150, 154122.
     DOI: 10.1063/1.5090222
   
   for sTDA-xTB:
   * S. Grimme and C. Bannwarth, J. Chem. Phys., 2016, 145, 054103.
     DOI: 10.1063/1.4959605
   
   in the mass-spec context:
   * V. Asgeirsson, C. Bauer and S. Grimme, Chem. Sci., 2017, 8, 4879.
     DOI: 10.1039/c7sc00601b
   
   for metadynamics refer to:
   * S. Grimme, J. Chem. Theory Comput., 2019, 155, 2847-2862
     DOI: 10.1021/acs.jctc.9b00143
   
   with help from (in alphabetical order)
   C. Bannwarth, F. Bohle, G. Brandenburg, E. Caldeweyher, M. Checinski,
   S. Dohm, S. Ehlert, S. Ehrlich, F. März, H. Neugebauer, J. Pisarek,
   P. Pracht, P. Shushkov, and S. Spicher.
   
 * started run on 2021/05/19 at 10:59:16.330     

           -------------------------------------------------
          |                Calculation Setup                |
           -------------------------------------------------

          program call               : /ihome/ghutchison/geoffh/xtb/xtb 514.xyz -opt
          hostname                   : smp-n144
          coordinate file            : 514.xyz
          omp threads                :                     1
          number of atoms            :                    24
          number of electrons        :                    74
          charge                     :                     0
          spin                       :                   0.0
          first test random number   :      0.52232609521491


########################################################################
# WARNING! Please study the warnings concerning your input carefully
#  - the use of '-opt' is discouraged, please use '--opt' next time
########################################################################

           ------------------------------------------------- 
          |                 G F N 2 - x T B                 |
          | Geometry, Frequencies, Noncovalent interactions |
          |            JCTC 2019 parametrisation            |
           ------------------------------------------------- 
             KAB for C  - Si     :                1.0500
             KAB for H  - Pd     :                0.9500
             k(s)              :                1.8500
             k(p)              :                2.2300
             k(d)              :                2.2300
             k(f)              :                2.0000
             kEN (H0ij)        :               -2.0000
             D4 a1             :                0.5200
             D4 a2             :                5.0000
             D4 s6             :                1.0000
             D4 s8             :                2.7000
             D4 s9             :                5.0000
             alphaj            :                2.0000

  Z AO/shell   Hii/eV     exponent
  1     Wed Apr 25 08:07:45 CEST 2018   EN: 2.200 GM2: 0.406  GM3: 0.0800  RAES: 1.40
     1s    -10.707211    1.230000
  6     Wed Apr 25 08:07:45 CEST 2018   EN: 2.550 GM2: 0.538  GM3: 0.1500  RAES: 3.00
     2s    -13.970922    2.096432
     2p    -10.063292    1.800000
  7     Wed Apr 25 08:07:45 CEST 2018   EN: 3.040 GM2: 0.461  GM3:-0.0640  RAES: 1.90
     2s    -16.686243    2.339881
     2p    -12.523956    2.014332
  8     Wed Apr 25 08:07:45 CEST 2018   EN: 3.440 GM2: 0.452  GM3:-0.0517  RAES: 1.80
     2s    -20.229985    2.439742
     2p    -15.503117    2.137023
 16     Tue Apr 24 11:44:34 CEST 2018   EN: 2.580 GM2: 0.340  GM3:-0.0502  RAES: 3.10
     3s    -20.029654    1.981333
     3p    -11.377694    2.025643
     3d     -0.420282    1.702555

           ------------------------------------------------- 
          |        Self-Consistent Charge Iterations        |
           ------------------------------------------------- 

          ...................................................
          :                      SETUP                      :
          :.................................................:
          :  # basis functions                  75          :
          :  # atomic orbitals                  74          :
          :  # shells                           40          :
          :  # electrons                        74          :
          :  max. iterations                   250          :
          :  Hamiltonian                  GFN2-xTB          :
          :  restarted?                      false          :
          :  GBSA solvation                  false          :
          :  PC potential                    false          :
          :  electronic temp.          300.0000000     K    :
          :  accuracy                    1.0000000          :
          :  -> integral cutoff          0.2500000E+02      :
          :  -> integral neglect         0.1000000E-07      :
          :  -> SCF convergence          0.1000000E-05 Eh   :
          :  -> wf. convergence          0.1000000E-03 e    :
          :  Broyden damping             0.4000000          :
          ...................................................

 iter      E             dE          RMSdq      gap      omega  full diag
   1    -40.9949835 -0.409950E+02  0.525E+00    1.86       0.0  T
   2    -41.0107460 -0.157625E-01  0.331E+00    1.84       1.0  T
   3    -40.9512946  0.594515E-01  0.240E+00    1.91       1.0  T
   4    -41.0440035 -0.927089E-01  0.577E-01    1.75       1.0  T
   5    -41.0482372 -0.423372E-02  0.343E-01    1.83       1.0  T
   6    -41.0502426 -0.200542E-02  0.119E-01    1.80       1.0  T
   7    -41.0503630 -0.120437E-03  0.611E-02    1.80       1.0  T
   8    -41.0504089 -0.458739E-04  0.222E-02    1.80       1.0  T
   9    -41.0504126 -0.364810E-05  0.102E-02    1.80       2.0  T
  10    -41.0504134 -0.817451E-06  0.296E-03    1.80       6.9  T
  11    -41.0504134 -0.188109E-07  0.163E-03    1.80      12.6  T
  12    -41.0504134 -0.349971E-07  0.764E-04    1.80      26.7  T
  13    -41.0504134 -0.357758E-08  0.395E-04    1.80      51.6  T

   *** convergence criteria satisfied after 13 iterations ***

         #    Occupation            Energy/Eh            Energy/eV
      -------------------------------------------------------------
         1        2.0000           -0.7444406             -20.2573
       ...           ...                  ...                  ...
        31        2.0000           -0.4479589             -12.1896
        32        2.0000           -0.4454802             -12.1221
        33        2.0000           -0.4370192             -11.8919
        34        2.0000           -0.4239406             -11.5360
        35        2.0000           -0.4168908             -11.3442
        36        2.0000           -0.3986445             -10.8477
        37        2.0000           -0.3672299              -9.9928 (HOMO)
        38                         -0.3009856              -8.1902 (LUMO)
        39                         -0.2594447              -7.0598
        40                         -0.2234163              -6.0795
        41                         -0.2111377              -5.7453
        42                         -0.2043475              -5.5606
       ...                                ...                  ...
        74                          1.0791954              29.3664
      -------------------------------------------------------------
                  HL-Gap            0.0662443 Eh            1.8026 eV
             Fermi-level           -0.3341078 Eh           -9.0915 eV

 SCC (total)                   0 d,  0 h,  0 min,  0.044 sec
 SCC setup                      ...        0 min,  0.000 sec (  0.727%)
 Dispersion                     ...        0 min,  0.000 sec (  0.883%)
 integral evaluation            ...        0 min,  0.010 sec ( 23.686%)
 zeroth order Hamiltonian       ...        0 min,  0.000 sec (  0.442%)
 iterations                     ...        0 min,  0.017 sec ( 38.775%)
 molecular gradient             ...        0 min,  0.015 sec ( 34.472%)
 printout                       ...        0 min,  0.000 sec (  0.897%)

         :::::::::::::::::::::::::::::::::::::::::::::::::::::
         ::                     SUMMARY                     ::
         :::::::::::::::::::::::::::::::::::::::::::::::::::::
         :: total energy             -40.426026304249 Eh    ::
         :: gradient norm              0.102658519594 Eh/a0 ::
         :: HOMO-LUMO gap              1.802599144885 eV    ::
         ::.................................................::
         :: SCC energy               -41.050413427675 Eh    ::
         :: -> isotropic ES            0.024268979274 Eh    ::
         :: -> anisotropic ES          0.003880723675 Eh    ::
         :: -> anisotropic XC          0.031473816972 Eh    ::
         :: -> dispersion             -0.026170819854 Eh    ::
         :: repulsion energy           0.624357831463 Eh    ::
         :: add. restraining           0.000000000000 Eh    ::
         :::::::::::::::::::::::::::::::::::::::::::::::::::::

      ----------------------------------------------------------- 
     |                   =====================                   |
     |                        A N C O P T                        |
     |                   =====================                   |
     |               Approximate Normal Coordinate               |
     |                Rational Function Optimizer                |
      ----------------------------------------------------------- 

          ...................................................
          :                      SETUP                      :
          :.................................................:
          :   optimization level            normal          :
          :   max. optcycles                   200          :
          :   ANC micro-cycles                  20          :
          :   degrees of freedom                66          :
          :.................................................:
          :   RF solver                   davidson          :
          :   input Hessian                  false          :
          :   write xtbopt.log                true          :
          :   linear?                        false          :
          :   energy convergence         0.5000000E-05 Eh   :
          :   grad. convergence          0.1000000E-02 Eh/α :
          :   maximium RF displ.         2.0000000          :
          :   Hlow (freq-cutoff)         0.5000000E-02      :
          :   Hmax (freq-cutoff)         5.0000000          :
          :   S6 in model hess.         20.0000000          :
          ...................................................

generating ANC from model Hessian ...
Using Lindh-Hessian (1995)
 Shifting diagonal of input Hessian by   4.884858100121363E-003
 Lowest  eigenvalues of input Hessian
   -0.000000   -0.000000   -0.000000   -0.000000    0.000000    0.000000
    0.005000    0.006449    0.007077    0.008069    0.009299    0.009723
    0.013228    0.014963    0.015754    0.020738    0.021592    0.022965
 Highest eigenvalues
    1.758105    1.818985    1.934745    1.985358    2.057209    2.501129
 

........................................................................
.............................. CYCLE    1 ..............................
........................................................................
   1    -41.0504134 -0.410504E+02  0.139E-04    1.80       0.0  T
   2    -41.0504134 -0.216076E-10  0.102E-04    1.80     199.2  T
   3    -41.0504134 -0.142272E-09  0.660E-05    1.80     309.5  T
     SCC iter.                  ...        0 min,  0.004 sec
     gradient                   ...        0 min,  0.015 sec
 * total energy  :   -40.4260263 Eh     change        0.1449945E-07 Eh
   gradient norm :     0.1026587 Eh/α   predicted     0.0000000E+00 (-100.00%)
   displ. norm   :     0.3033959 α      lambda       -0.1749269E-01
   maximum displ.:     0.1122796 α      in ANC's #27, #31, #21, ...

........................................................................
.............................. CYCLE    2 ..............................
........................................................................
   1    -41.0958511 -0.410959E+02  0.289E-01    1.88       0.0  T
   2    -41.0959246 -0.734827E-04  0.180E-01    1.86       1.0  T
   3    -41.0958686  0.560065E-04  0.124E-01    1.87       1.0  T
   4    -41.0961174 -0.248786E-03  0.362E-02    1.86       1.0  T
   5    -41.0961354 -0.179924E-04  0.192E-02    1.87       1.1  T
   6    -41.0961396 -0.426608E-05  0.958E-03    1.87       2.1  T
   7    -41.0961411 -0.144424E-05  0.277E-03    1.87       7.4  T
   8    -41.0961412 -0.113064E-06  0.929E-04    1.87      22.0  T
     SCC iter.                  ...        0 min,  0.010 sec
     gradient                   ...        0 min,  0.014 sec
 * total energy  :   -40.4377905 Eh     change       -0.1176416E-01 Eh
   gradient norm :     0.0481480 Eh/α   predicted    -0.9551441E-02 ( -18.81%)
   displ. norm   :     0.2321662 α      lambda       -0.4584461E-02
   maximum displ.:     0.0994365 α      in ANC's #6, #27, #7, ...

........................................................................
.............................. CYCLE    3 ..............................
........................................................................
   1    -41.1087891 -0.411088E+02  0.196E-01    1.93       0.0  T
   2    -41.1088179 -0.287442E-04  0.125E-01    1.92       1.0  T
   3    -41.1087673  0.505449E-04  0.893E-02    1.93       1.0  T
   4    -41.1088780 -0.110664E-03  0.305E-02    1.92       1.0  T
   5    -41.1088988 -0.208341E-04  0.821E-03    1.92       2.5  T
   6    -41.1088994 -0.625173E-06  0.461E-03    1.92       4.4  T
   7    -41.1088998 -0.330479E-06  0.117E-03    1.92      17.4  T
     SCC iter.                  ...        0 min,  0.009 sec
     gradient                   ...        0 min,  0.014 sec
 * total energy  :   -40.4402782 Eh     change       -0.2487752E-02 Eh
   gradient norm :     0.0128467 Eh/α   predicted    -0.2415809E-02 (  -2.89%)
   displ. norm   :     0.1811966 α      lambda       -0.5439112E-03
   maximum displ.:     0.1129385 α      in ANC's #6, #8, #3, ...

........................................................................
.............................. CYCLE    4 ..............................
........................................................................
   1    -41.1079869 -0.411080E+02  0.140E-01    1.93       0.0  T
   2    -41.1079901 -0.319058E-05  0.795E-02    1.92       1.0  T
   3    -41.1079425  0.475746E-04  0.481E-02    1.93       1.0  T
   4    -41.1079944 -0.519007E-04  0.847E-03    1.93       2.4  T
   5    -41.1079953 -0.931411E-06  0.420E-03    1.93       4.9  T
   6    -41.1079955 -0.197129E-06  0.119E-03    1.93      17.1  T
   7    -41.1079955 -0.143237E-07  0.623E-04    1.93      32.8  T
     SCC iter.                  ...        0 min,  0.009 sec
     gradient                   ...        0 min,  0.014 sec
 * total energy  :   -40.4405976 Eh     change       -0.3194116E-03 Eh
   gradient norm :     0.0071953 Eh/α   predicted    -0.2808859E-03 ( -12.06%)
   displ. norm   :     0.3989857 α      lambda       -0.1032484E-02
   maximum displ.:     0.2462863 α      in ANC's #3, #6, #7, ...

........................................................................
.............................. CYCLE    5 ..............................
........................................................................
   1    -41.1014810 -0.411015E+02  0.340E-01    1.92       0.0  T
   2    -41.1015051 -0.240996E-04  0.192E-01    1.92       1.0  T
   3    -41.1013381  0.167011E-03  0.902E-02    1.93       1.0  T
   4    -41.1015248 -0.186712E-03  0.171E-02    1.92       1.2  T
   5    -41.1015277 -0.286753E-05  0.962E-03    1.92       2.1  T
   6    -41.1015288 -0.115458E-05  0.302E-03    1.92       6.8  T
   7    -41.1015289 -0.111479E-06  0.137E-03    1.92      14.9  T
   8    -41.1015289 -0.165509E-07  0.542E-04    1.92      37.6  T
     SCC iter.                  ...        0 min,  0.010 sec
     gradient                   ...        0 min,  0.014 sec
 * total energy  :   -40.4404410 Eh     change        0.1566066E-03 Eh
   gradient norm :     0.0201772 Eh/α   predicted    -0.5984272E-03 (-482.12%)
   displ. norm   :     0.1155562 α      lambda       -0.1120849E-02
   maximum displ.:     0.0569762 α      in ANC's #1, #3, #6, ...

........................................................................
.............................. CYCLE    6 ..............................
........................................................................
   1    -41.1065645 -0.411066E+02  0.161E-01    1.92       0.0  T
   2    -41.1065740 -0.951013E-05  0.892E-02    1.92       1.0  T
   3    -41.1065643  0.975615E-05  0.254E-02    1.92       1.0  T
   4    -41.1065788 -0.145705E-04  0.491E-03    1.92       4.2  T
   5    -41.1065789 -0.967915E-07  0.312E-03    1.92       6.5  T
   6    -41.1065791 -0.109457E-06  0.138E-03    1.92      14.7  T
     SCC iter.                  ...        0 min,  0.008 sec
     gradient                   ...        0 min,  0.014 sec
 * total energy  :   -40.4410424 Eh     change       -0.6013756E-03 Eh
   gradient norm :     0.0099406 Eh/α   predicted    -0.5679103E-03 (  -5.56%)
   displ. norm   :     0.1114084 α      lambda       -0.2837616E-03
   maximum displ.:     0.0658310 α      in ANC's #3, #6, #8, ...

........................................................................
.............................. CYCLE    7 ..............................
........................................................................
   1    -41.1070634 -0.411071E+02  0.786E-02    1.91       0.0  T
   2    -41.1070658 -0.231414E-05  0.450E-02    1.91       1.0  T
   3    -41.1070611  0.464479E-05  0.163E-02    1.91       1.3  T
   4    -41.1070668 -0.574080E-05  0.372E-03    1.91       5.5  T
   5    -41.1070669 -0.918235E-07  0.202E-03    1.91      10.1  T
   6    -41.1070670 -0.360784E-07  0.804E-04    1.91      25.4  T
     SCC iter.                  ...        0 min,  0.008 sec
     gradient                   ...        0 min,  0.014 sec
 * total energy  :   -40.4411985 Eh     change       -0.1560732E-03 Eh
   gradient norm :     0.0058198 Eh/α   predicted    -0.1436435E-03 (  -7.96%)
   displ. norm   :     0.2403829 α      lambda       -0.2744246E-03
   maximum displ.:     0.1577927 α      in ANC's #3, #6, #8, ...

........................................................................
.............................. CYCLE    8 ..............................
........................................................................
   1    -41.1061788 -0.411062E+02  0.153E-01    1.90       0.0  T
   2    -41.1061800 -0.126933E-05  0.886E-02    1.90       1.0  T
   3    -41.1061615  0.185544E-04  0.305E-02    1.90       1.0  T
   4    -41.1061814 -0.199699E-04  0.513E-03    1.90       4.0  T
   5    -41.1061815 -0.103591E-06  0.330E-03    1.90       6.2  T
   6    -41.1061817 -0.170130E-06  0.975E-04    1.90      20.9  T
   7    -41.1061817 -0.170729E-07  0.373E-04    1.90      54.7  T
     SCC iter.                  ...        0 min,  0.009 sec
     gradient                   ...        0 min,  0.014 sec
 * total energy  :   -40.4414170 Eh     change       -0.2185214E-03 Eh
   gradient norm :     0.0075007 Eh/α   predicted    -0.1451429E-03 ( -33.58%)
   displ. norm   :     0.3899461 α      lambda       -0.4275394E-03
   maximum displ.:     0.2790763 α      in ANC's #3, #6, #1, ...

........................................................................
.............................. CYCLE    9 ..............................
........................................................................
   1    -41.1066579 -0.411067E+02  0.237E-01    1.88       0.0  T
   2    -41.1066618 -0.389979E-05  0.137E-01    1.88       1.0  T
   3    -41.1066281  0.337657E-04  0.429E-02    1.88       1.0  T
   4    -41.1066650 -0.369344E-04  0.855E-03    1.88       2.4  T
   5    -41.1066650  0.766722E-08  0.632E-03    1.88       3.2  T
   6    -41.1066657 -0.735098E-06  0.159E-03    1.88      12.8  T
   7    -41.1066658 -0.443915E-07  0.639E-04    1.88      32.0  T
     SCC iter.                  ...        0 min,  0.009 sec
     gradient                   ...        0 min,  0.014 sec
 * total energy  :   -40.4416737 Eh     change       -0.2567135E-03 Eh
   gradient norm :     0.0077946 Eh/α   predicted    -0.2462765E-03 (  -4.07%)
   displ. norm   :     0.1385736 α      lambda       -0.1651110E-03
   maximum displ.:     0.0972014 α      in ANC's #3, #6, #1, ...

........................................................................
.............................. CYCLE   10 ..............................
........................................................................
   1    -41.1087815 -0.411088E+02  0.760E-02    1.88       0.0  T
   2    -41.1087820 -0.458112E-06  0.444E-02    1.88       1.0  T
   3    -41.1087800  0.201768E-05  0.997E-03    1.88       2.0  T
   4    -41.1087823 -0.231625E-05  0.226E-03    1.88       9.0  T
   5    -41.1087823 -0.158019E-07  0.159E-03    1.88      12.8  T
     SCC iter.                  ...        0 min,  0.006 sec
     gradient                   ...        0 min,  0.014 sec
 * total energy  :   -40.4417877 Eh     change       -0.1139830E-03 Eh
   gradient norm :     0.0042426 Eh/α   predicted    -0.8414100E-04 ( -26.18%)
   displ. norm   :     0.3818543 α      lambda       -0.2196383E-03
   maximum displ.:     0.2656762 α      in ANC's #3, #6, #1, ...

........................................................................
.............................. CYCLE   11 ..............................
........................................................................
   1    -41.1061620 -0.411062E+02  0.224E-01    1.88       0.0  T
   2    -41.1061664 -0.438537E-05  0.130E-01    1.88       1.0  T
   3    -41.1061615  0.495519E-05  0.190E-02    1.88       1.1  T
   4    -41.1061681 -0.657476E-05  0.747E-03    1.88       2.7  T
   5    -41.1061683 -0.282460E-06  0.437E-03    1.88       4.7  T
   6    -41.1061687 -0.343244E-06  0.123E-03    1.88      16.6  T
   7    -41.1061687 -0.194706E-07  0.564E-04    1.88      36.2  T
     SCC iter.                  ...        0 min,  0.009 sec
     gradient                   ...        0 min,  0.014 sec
 * total energy  :   -40.4418682 Eh     change       -0.8055142E-04 Eh
   gradient norm :     0.0086102 Eh/α   predicted    -0.1258334E-03 (  56.21%)
   displ. norm   :     0.0761982 α      lambda       -0.1956200E-03
   maximum displ.:     0.0461534 α      in ANC's #1, #12, #6, ...

........................................................................
.............................. CYCLE   12 ..............................
........................................................................
   1    -41.1089736 -0.411090E+02  0.649E-02    1.89       0.0  T
   2    -41.1089744 -0.807977E-06  0.361E-02    1.88       1.0  T
   3    -41.1089601  0.143782E-04  0.280E-02    1.89       1.0  T
   4    -41.1089762 -0.161272E-04  0.394E-03    1.88       5.2  T
   5    -41.1089762 -0.238037E-07  0.230E-03    1.88       8.9  T
   6    -41.1089763 -0.758361E-07  0.866E-04    1.88      23.6  T
     SCC iter.                  ...        0 min,  0.008 sec
     gradient                   ...        0 min,  0.014 sec
 * total energy  :   -40.4419452 Eh     change       -0.7693374E-04 Eh
   gradient norm :     0.0056945 Eh/α   predicted    -0.9838122E-04 (  27.88%)
   displ. norm   :     0.1082775 α      lambda       -0.1009047E-03
   maximum displ.:     0.0582892 α      in ANC's #3, #5, #1, ...

........................................................................
.............................. CYCLE   13 ..............................
........................................................................
   1    -41.1093445 -0.411093E+02  0.604E-02    1.89       0.0  T
   2    -41.1093456 -0.118273E-05  0.351E-02    1.89       1.0  T
   3    -41.1093380  0.765746E-05  0.202E-02    1.89       1.0  T
   4    -41.1093463 -0.831136E-05  0.376E-03    1.89       5.4  T
   5    -41.1093465 -0.185224E-06  0.195E-03    1.89      10.5  T
   6    -41.1093465 -0.516884E-07  0.796E-04    1.89      25.6  T
     SCC iter.                  ...        0 min,  0.008 sec
     gradient                   ...        0 min,  0.014 sec
 * total energy  :   -40.4419830 Eh     change       -0.3787823E-04 Eh
   gradient norm :     0.0057537 Eh/α   predicted    -0.5104460E-04 (  34.76%)
   displ. norm   :     0.1575572 α      lambda       -0.7405806E-04
   maximum displ.:     0.1164737 α      in ANC's #3, #6, #1, ...

........................................................................
.............................. CYCLE   14 ..............................
........................................................................
   1    -41.1084427 -0.411084E+02  0.937E-02    1.88       0.0  T
   2    -41.1084436 -0.896928E-06  0.545E-02    1.88       1.0  T
   3    -41.1084427  0.902761E-06  0.760E-03    1.88       2.7  T
   4    -41.1084437 -0.955235E-06  0.415E-03    1.88       4.9  T
   5    -41.1084439 -0.249206E-06  0.179E-03    1.88      11.4  T
   6    -41.1084440 -0.401310E-07  0.645E-04    1.88      31.7  T
     SCC iter.                  ...        0 min,  0.008 sec
     gradient                   ...        0 min,  0.014 sec
 * total energy  :   -40.4420239 Eh     change       -0.4090612E-04 Eh
   gradient norm :     0.0028911 Eh/α   predicted    -0.3795206E-04 (  -7.22%)
   displ. norm   :     0.0639883 α      lambda       -0.2651380E-04
   maximum displ.:     0.0438207 α      in ANC's #3, #1, #5, ...

........................................................................
.............................. CYCLE   15 ..............................
........................................................................
   1    -41.1088621 -0.411089E+02  0.411E-02    1.88       0.0  T
   2    -41.1088623 -0.200058E-06  0.234E-02    1.88       1.0  T
   3    -41.1088599  0.236666E-05  0.110E-02    1.88       1.9  T
   4    -41.1088625 -0.258161E-05  0.187E-03    1.88      10.9  T
   5    -41.1088625 -0.523521E-09  0.120E-03    1.88      17.0  T
   6    -41.1088625 -0.243995E-07  0.330E-04    1.88      61.9  T
   7    -41.1088625 -0.170036E-08  0.141E-04    1.88     144.6  T
     SCC iter.                  ...        0 min,  0.009 sec
     gradient                   ...        0 min,  0.015 sec
 * total energy  :   -40.4420429 Eh     change       -0.1892337E-04 Eh
   gradient norm :     0.0016698 Eh/α   predicted    -0.1331204E-04 ( -29.65%)
   displ. norm   :     0.1664945 α      lambda       -0.2057269E-04
   maximum displ.:     0.1115856 α      in ANC's #3, #5, #1, ...

........................................................................
.............................. CYCLE   16 ..............................
........................................................................
   1    -41.1085623 -0.411086E+02  0.980E-02    1.88       0.0  T
   2    -41.1085633 -0.103963E-05  0.563E-02    1.88       1.0  T
   3    -41.1085611  0.218118E-05  0.112E-02    1.88       1.8  T
   4    -41.1085638 -0.263253E-05  0.354E-03    1.88       5.8  T
   5    -41.1085638 -0.413463E-07  0.209E-03    1.88       9.8  T
   6    -41.1085639 -0.793081E-07  0.541E-04    1.88      37.7  T
   7    -41.1085639 -0.463472E-08  0.224E-04    1.88      91.2  T
     SCC iter.                  ...        0 min,  0.009 sec
     gradient                   ...        0 min,  0.015 sec
 * total energy  :   -40.4420551 Eh     change       -0.1221597E-04 Eh
   gradient norm :     0.0018283 Eh/α   predicted    -0.1041865E-04 ( -14.71%)
   displ. norm   :     0.0675285 α      lambda       -0.9517441E-05
   maximum displ.:     0.0393246 α      in ANC's #3, #1, #6, ...

........................................................................
.............................. CYCLE   17 ..............................
........................................................................
   1    -41.1108126 -0.411108E+02  0.460E-02    1.88       0.0  T
   2    -41.1108130 -0.381423E-06  0.263E-02    1.88       1.0  T
   3    -41.1108123  0.730557E-06  0.696E-03    1.88       2.9  T
   4    -41.1108132 -0.937543E-06  0.177E-03    1.88      11.6  T
   5    -41.1108132  0.721533E-08  0.109E-03    1.88      18.8  T
   6    -41.1108132 -0.191671E-07  0.449E-04    1.88      45.5  T
   7    -41.1108132 -0.323853E-08  0.187E-04    1.88     109.4  T
     SCC iter.                  ...        0 min,  0.009 sec
     gradient                   ...        0 min,  0.015 sec
 * total energy  :   -40.4420478 Eh     change        0.7334072E-05 Eh
   gradient norm :     0.0038560 Eh/α   predicted    -0.4769392E-05 (-165.03%)
   displ. norm   :     0.0213698 α      lambda       -0.1640055E-04
   maximum displ.:     0.0116331 α      in ANC's #6, #3, #4, ...

........................................................................
.............................. CYCLE   18 ..............................
........................................................................
   1    -41.1100305 -0.411100E+02  0.149E-02    1.88       0.0  T
   2    -41.1100306 -0.457867E-07  0.840E-03    1.88       2.4  T
   3    -41.1100302  0.394483E-06  0.449E-03    1.88       4.5  T
   4    -41.1100306 -0.453632E-06  0.847E-04    1.88      24.1  T
   5    -41.1100306  0.340363E-08  0.681E-04    1.88      30.0  T
     SCC iter.                  ...        0 min,  0.006 sec
     gradient                   ...        0 min,  0.015 sec
 * total energy  :   -40.4420587 Eh     change       -0.1093894E-04 Eh
   gradient norm :     0.0019547 Eh/α   predicted    -0.8208578E-05 ( -24.96%)
   displ. norm   :     0.0331468 α      lambda       -0.5677804E-05
   maximum displ.:     0.0192551 α      in ANC's #3, #2, #6, ...

........................................................................
.............................. CYCLE   19 ..............................
........................................................................
   1    -41.1085433 -0.411085E+02  0.227E-02    1.88       0.0  T
   2    -41.1085434 -0.103184E-06  0.128E-02    1.88       1.6  T
   3    -41.1085429  0.547472E-06  0.522E-03    1.88       3.9  T
   4    -41.1085435 -0.616297E-06  0.122E-03    1.88      16.8  T
   5    -41.1085435 -0.264627E-09  0.850E-04    1.88      24.0  T
   6    -41.1085435 -0.122159E-07  0.292E-04    1.88      69.8  T
     SCC iter.                  ...        0 min,  0.008 sec
     gradient                   ...        0 min,  0.015 sec
 * total energy  :   -40.4420601 Eh     change       -0.1411386E-05 Eh
   gradient norm :     0.0019367 Eh/α   predicted    -0.2841295E-05 ( 101.31%)
   displ. norm   :     0.0189970 α      lambda       -0.2983197E-05
   maximum displ.:     0.0150634 α      in ANC's #1, #6, #3, ...

........................................................................
.............................. CYCLE   20 ..............................
........................................................................
   1    -41.1091505 -0.411092E+02  0.163E-02    1.88       0.0  T
   2    -41.1091506 -0.856349E-07  0.908E-03    1.88       2.2  T
   3    -41.1091505  0.864714E-07  0.259E-03    1.88       7.9  T
   4    -41.1091506 -0.124275E-06  0.633E-04    1.88      32.3  T
   5    -41.1091506 -0.876270E-09  0.438E-04    1.88      46.6  T
     SCC iter.                  ...        0 min,  0.007 sec
     gradient                   ...        0 min,  0.015 sec
 * total energy  :   -40.4420624 Eh     change       -0.2266961E-05 Eh
   gradient norm :     0.0007314 Eh/α   predicted    -0.1496725E-05 ( -33.98%)
   displ. norm   :     0.0161369 α      lambda       -0.1267328E-05
   maximum displ.:     0.0087530 α      in ANC's #1, #6, #3, ...

   *** GEOMETRY OPTIMIZATION CONVERGED AFTER 20 ITERATIONS ***

------------------------------------------------------------------------
 total energy gain   :        -0.0160361 Eh      -10.0628 kcal/mol
 total RMSD          :         0.4749323 a0        0.2513 Å
 total power (kW/mol):        -2.1051340 (step)  -62.4504 (real)
------------------------------------------------------------------------

 ANCopt (total)                0 d,  0 h,  0 min,  0.674 sec
 optimizer setup                ...        0 min,  0.000 sec (  0.023%)
 model hessian                  ...        0 min,  0.003 sec (  0.421%)
 ANC generation                 ...        0 min,  0.001 sec (  0.098%)
 coordinate transformation      ...        0 min,  0.000 sec (  0.051%)
 single point calculation       ...        0 min,  0.661 sec ( 98.077%)
 optimization log               ...        0 min,  0.002 sec (  0.294%)
 hessian update                 ...        0 min,  0.000 sec (  0.040%)
 rational function              ...        0 min,  0.006 sec (  0.816%)

================
 final structure:
================
$coord
   -3.37810237368873    2.60083240977646    0.22546462383705      C 
   -5.45708062616481    0.14920611009596    0.24716784826036      S 
   -3.06633031178043   -2.09502339067552    0.18142461154025      C 
   -0.71202305884413   -0.92308662767220    0.14667121845179      C 
   -0.90420297471199    1.78642116241903    0.16931554457485      C 
    1.31181760338729    3.26733705938478    0.13039151412785      C 
    3.61929452051267    2.09841898401561    0.07864199904278      C 
    5.85424765936174    3.55771066477516    0.03268443440201      C 
    7.63582749078344    4.78935530945649   -0.00607240354052      N 
    3.82752269007025   -0.61311540257277    0.06890516495457      C 
    6.23856002763492   -1.47987397828696    0.02971422113623      O 
    6.65082209664085   -4.10464287496257    0.03849268955921      C 
    1.69893629475262   -2.07648041037347    0.09901086214332      C 
   -3.61190744864296   -4.74663605937070    0.16054424696540      C 
   -5.91968859112701   -5.75319255097658    0.19649602512153      C 
   -4.05680633633527    4.50852684643148    0.25398836567124      H 
    1.18067291779213    5.30323655754295    0.14025749405710      H 
    8.69360943140201   -4.34292674076161    0.01817553546270      H 
    5.83750543007820   -5.00423656807964   -1.63773897405489      H 
    5.87301044796954   -4.98626875114123    1.74101680729733      H 
    1.81977547883073   -4.10903779985110    0.08848407909946      H 
   -1.97348140261606   -5.97052748018736    0.10807963363160      H 
   -7.58886435710997   -4.58895623511412    0.25123672700633      H 
   -6.20477568902354   -7.76443915838150    0.17297794555314      H 
$end
           -------------------------------------------------
          |                Final Singlepoint                |
           -------------------------------------------------

          ...................................................
          :                      SETUP                      :
          :.................................................:
          :  # basis functions                  75          :
          :  # atomic orbitals                  74          :
          :  # shells                           40          :
          :  # electrons                        74          :
          :  max. iterations                   250          :
          :  Hamiltonian                  GFN2-xTB          :
          :  restarted?                      false          :
          :  GBSA solvation                  false          :
          :  PC potential                    false          :
          :  electronic temp.          300.0000000     K    :
          :  accuracy                    1.0000000          :
          :  -> integral cutoff          0.2500000E+02      :
          :  -> integral neglect         0.1000000E-07      :
          :  -> SCF convergence          0.1000000E-05 Eh   :
          :  -> wf. convergence          0.1000000E-03 e    :
          :  Broyden damping             0.4000000          :
          ...................................................

 iter      E             dE          RMSdq      gap      omega  full diag
   1    -41.1091506 -0.411092E+02  0.320E-04    1.88       0.0  T
   2    -41.1091506  0.400846E-09  0.180E-04    1.88     113.1  T
   3    -41.1091506 -0.756749E-09  0.182E-04    1.88     112.4  T

   *** convergence criteria satisfied after 3 iterations ***

         #    Occupation            Energy/Eh            Energy/eV
      -------------------------------------------------------------
         1        2.0000           -0.7451961             -20.2778
       ...           ...                  ...                  ...
        31        2.0000           -0.4495943             -12.2341
        32        2.0000           -0.4406657             -11.9911
        33        2.0000           -0.4389312             -11.9439
        34        2.0000           -0.4248375             -11.5604
        35        2.0000           -0.4168991             -11.3444
        36        2.0000           -0.4001351             -10.8882
        37        2.0000           -0.3684377             -10.0257 (HOMO)
        38                         -0.2992764              -8.1437 (LUMO)
        39                         -0.2582752              -7.0280
        40                         -0.2132207              -5.8020
        41                         -0.2109572              -5.7404
        42                         -0.1996827              -5.4336
       ...                                ...                  ...
        74                          1.1773246              32.0366
      -------------------------------------------------------------
                  HL-Gap            0.0691613 Eh            1.8820 eV
             Fermi-level           -0.3338571 Eh           -9.0847 eV

 SCC (total)                   0 d,  0 h,  0 min,  0.031 sec
 SCC setup                      ...        0 min,  0.000 sec (  0.718%)
 Dispersion                     ...        0 min,  0.000 sec (  0.766%)
 integral evaluation            ...        0 min,  0.010 sec ( 33.386%)
 zeroth order Hamiltonian       ...        0 min,  0.000 sec (  0.563%)
 iterations                     ...        0 min,  0.004 sec ( 14.469%)
 molecular gradient             ...        0 min,  0.015 sec ( 48.776%)
 printout                       ...        0 min,  0.000 sec (  1.147%)

         :::::::::::::::::::::::::::::::::::::::::::::::::::::
         ::                     SUMMARY                     ::
         :::::::::::::::::::::::::::::::::::::::::::::::::::::
         :: total energy             -40.442062367289 Eh    ::
         :: gradient norm              0.000731189573 Eh/a0 ::
         :: HOMO-LUMO gap              1.881975677831 eV    ::
         ::.................................................::
         :: SCC energy               -41.109150612369 Eh    ::
         :: -> isotropic ES            0.023519037058 Eh    ::
         :: -> anisotropic ES          0.004470801092 Eh    ::
         :: -> anisotropic XC          0.029437431770 Eh    ::
         :: -> dispersion             -0.026300458940 Eh    ::
         :: repulsion energy           0.667082714407 Eh    ::
         :: add. restraining           0.000000000000 Eh    ::
         :::::::::::::::::::::::::::::::::::::::::::::::::::::

           -------------------------------------------------
          |                Property Printout                |
           -------------------------------------------------

    * Orbital Energies and Occupations

         #    Occupation            Energy/Eh            Energy/eV
      -------------------------------------------------------------
         1        2.0000           -0.7451961             -20.2778
       ...           ...                  ...                  ...
        25        2.0000           -0.4829162             -13.1408
        26        2.0000           -0.4789211             -13.0321
        27        2.0000           -0.4749661             -12.9245
        28        2.0000           -0.4654709             -12.6661
        29        2.0000           -0.4613794             -12.5548
        30        2.0000           -0.4591186             -12.4933
        31        2.0000           -0.4495943             -12.2341
        32        2.0000           -0.4406657             -11.9911
        33        2.0000           -0.4389312             -11.9439
        34        2.0000           -0.4248375             -11.5604
        35        2.0000           -0.4168991             -11.3444
        36        2.0000           -0.4001351             -10.8882
        37        2.0000           -0.3684377             -10.0257 (HOMO)
        38                         -0.2992764              -8.1437 (LUMO)
        39                         -0.2582752              -7.0280
        40                         -0.2132207              -5.8020
        41                         -0.2109572              -5.7404
        42                         -0.1996827              -5.4336
        43                         -0.1879135              -5.1134
        44                         -0.1472168              -4.0060
        45                         -0.1314979              -3.5782
        46                         -0.0822302              -2.2376
        47                         -0.0146832              -0.3996
        48                          0.0182420               0.4964
       ...                                ...                  ...
        74                          1.1773246              32.0366
      -------------------------------------------------------------
                  HL-Gap            0.0691613 Eh            1.8820 eV
             Fermi-level           -0.3338571 Eh           -9.0847 eV

     #   Z        covCN         q      C6AA      α(0)
     1   6 C      2.925    -0.033    28.822     8.804
     2  16 S      2.324     0.020   140.233    19.931
     3   6 C      2.980     0.007    27.852     8.657
     4   6 C      3.162    -0.005    27.804     8.619
     5   6 C      3.173    -0.004    27.740     8.603
     6   6 C      2.920    -0.025    28.621     8.773
     7   6 C      2.969     0.002    27.977     8.676
     8   6 C      1.913     0.121    28.123     8.564
     9   7 N      0.911    -0.230    26.041     7.381
    10   6 C      2.867     0.148    24.783     8.160
    11   8 O      1.706    -0.259    18.290     5.774
    12   6 C      3.645     0.038    20.273     6.471
    13   6 C      2.907    -0.077    29.922     8.969
    14   6 C      2.920    -0.031    28.762     8.795
    15   6 C      2.841    -0.090    30.259     9.015
    16   1 H      0.926     0.050     2.318     2.381
    17   1 H      0.926     0.047     2.353     2.399
    18   1 H      0.925     0.068     2.103     2.268
    19   1 H      0.924     0.043     2.411     2.428
    20   1 H      0.924     0.043     2.411     2.428
    21   1 H      0.926     0.037     2.487     2.466
    22   1 H      0.925     0.040     2.444     2.445
    23   1 H      0.926     0.046     2.371     2.408
    24   1 H      0.926     0.043     2.414     2.430

 Mol. C6AA /au·bohr⁶  :       9577.903411
 Mol. C8AA /au·bohr⁸  :     262121.012222
 Mol. α(0) /au        :        156.844546


Wiberg/Mayer (AO) data.
largest (>0.10) Wiberg bond orders for each atom
          total WBO             WBO to atom ...
     1  C   3.934        C    5 1.437    S    2 1.260    H   16 0.969    C    3 0.122
     2  S   2.705        C    1 1.260    C    3 1.156
     3  C   3.941        C    4 1.379    C   14 1.158    S    2 1.156    C    1 0.122
     4  C   3.980        C    3 1.379    C   13 1.239    C    5 1.160
     5  C   3.988        C    1 1.437    C    6 1.237    C    4 1.160
     6  C   3.986        C    7 1.524    C    5 1.237    H   17 0.967
     7  C   3.987        C    6 1.524    C   10 1.144    C    8 1.099
     8  C   3.946        N    9 2.801    C    7 1.099
     9  N   2.974        C    8 2.801
    10  C   3.918        C   13 1.515    C    7 1.144    O   11 1.078
    11  O   2.244        C   10 1.078    C   12 0.982
    12  C   3.942        O   11 0.982    H   18 0.979    H   20 0.976    H   19 0.976
    13  C   3.983        C   10 1.515    C    4 1.239    H   21 0.959
    14  C   3.991        C   15 1.841    C    3 1.158    H   22 0.955
    15  C   3.963        C   14 1.841    H   24 0.978    H   23 0.972
    16  H   0.997        C    1 0.969
    17  H   0.997        C    6 0.967
    18  H   0.995        C   12 0.979
    19  H   0.997        C   12 0.976
    20  H   0.997        C   12 0.976
    21  H   0.997        C   13 0.959
    22  H   0.998        C   14 0.955
    23  H   0.998        C   15 0.972
    24  H   0.998        C   15 0.978

molecular dipole:
                 x           y           z       tot (Debye)
 q only:       -1.048      -1.070       0.025
   full:       -1.231      -1.413       0.029       4.764
molecular quadrupole (traceless):
                xx          xy          yy          xz          yz          zz
 q only:       -7.237     -14.759       5.890      -0.007       0.069       1.347
  q+dip:      -12.290     -20.010      10.325       0.053       0.175       1.966
   full:      -15.149     -21.621       9.436       0.189       0.167       5.713

           -------------------------------------------------
          |                Geometry Summary                 |
           -------------------------------------------------

      molecular mass/u    :      215.2692000
   center of mass at/Å    :        0.2456358      -0.1550457       0.0683711
  moments of inertia/u·Å² :        0.4937944E+03   0.1420853E+04   0.1911391E+04
rotational constants/cm⁻¹ :        0.3413897E-01   0.1186445E-01   0.8819563E-02

 * 23 selected distances

     #   Z        #   Z                                     value/Å
     1   6 C      2  16 S                                 1.7010471
     2  16 S      3   6 C                                 1.7355542 (max)
     3   6 C      4   6 C                                 1.3917871
     1   6 C      5   6 C                                 1.3785648
     4   6 C      5   6 C                                 1.4374619
     5   6 C      6   6 C                                 1.4105700
     6   6 C      7   6 C                                 1.3690765
     8   6 C      9   7 N                                 1.1463105
    10   6 C     11   8 O                                 1.3559652
    11   8 O     12   6 C                                 1.4060040
     4   6 C     13   6 C                                 1.4145289
    10   6 C     13   6 C                                 1.3670016
     3   6 C     14   6 C                                 1.4326090
    14   6 C     15   6 C                                 1.3324661
     1   6 C     16   1 H                                 1.0716004 (min)
     6   6 C     17   1 H                                 1.0795972
    12   6 C     18   1 H                                 1.0883791
    12   6 C     19   1 H                                 1.0948351
    12   6 C     20   1 H                                 1.0948783
    13   6 C     21   1 H                                 1.0774967
    14   6 C     22   1 H                                 1.0825656
    15   6 C     23   1 H                                 1.0773132
    15   6 C     24   1 H                                 1.0750169

 * 5 distinct bonds (by element types)

   Z      Z             #   av. dist./Å        max./Å        min./Å
   1 H    6 C           9     1.0824092     1.0948783     1.0716004
   6 C    6 C           9     1.3926740     1.4374619     1.3324661
   6 C    7 N           1     1.1463105     1.1463105     1.1463105
   6 C    8 O           2     1.3809846     1.4060040     1.3559652
   6 C   16 S           2     1.7183007     1.7355542     1.7010471


optimized geometry written to: xtbopt.xyz


           -------------------------------------------------
          | TOTAL ENERGY              -40.442062367289 Eh   |
          | GRADIENT NORM               0.000731189573 Eh/α |
          | HOMO-LUMO GAP               1.881975677831 eV   |
           -------------------------------------------------

------------------------------------------------------------------------
 * finished run on 2021/05/19 at 10:59:17.103     
------------------------------------------------------------------------
 total:
 * wall-time:     0 d,  0 h,  0 min,  0.773 sec
 *  cpu-time:     0 d,  0 h,  0 min,  0.769 sec
 * ratio c/w:     0.996 speedup
 SCF:
 * wall-time:     0 d,  0 h,  0 min,  0.044 sec
 *  cpu-time:     0 d,  0 h,  0 min,  0.044 sec
 * ratio c/w:     0.998 speedup
 ANC optimizer:
 * wall-time:     0 d,  0 h,  0 min,  0.705 sec
 *  cpu-time:     0 d,  0 h,  0 min,  0.704 sec
 * ratio c/w:     0.998 speedup

