      -----------------------------------------------------------      
     |                   =====================                   |     
     |                           x T B                           |     
     |                   =====================                   |     
     |                         S. Grimme                         |     
     |          Mulliken Center for Theoretical Chemistry        |     
     |                    University of Bonn                     |     
     |                Version 6.2 RC2 (SAW190805)                |     
      -----------------------------------------------------------      

   This program is distributed in the hope that it will be useful,
   but WITHOUT ANY WARRANTY; without even the implied warranty of
   MERCHANTABILITY or FITNESS FOR A PARTICULAR PURPOSE.
   
   FOR NON-COMMERCIAL, ACADEMIA USE ONLY.
   
   Cite this work as:
   * S. Grimme, C. Bannwarth, P. Shushkov, J. Chem. Theory Comput., 2017,
     13, 1989-2009. DOI: 10.1021/acs.jctc.7b00118
   * C. Bannwarth, S. Ehlert and S. Grimme., J. Chem. Theory Comput., 2019,
     15, 1652-1671. DOI: 10.1021/acs.jctc.8b01176
   * P. Pracht, E. Caldeweyher, S. Ehlert, S. Grimme, ChemRxiv, 2019, preprint.
     DOI: 10.26434/chemrxiv.8326202.v1
   
   for DFT-D4:
   * E. Caldeweyher, C. Bannwarth and S. Grimme, J. Chem. Phys., 2017,
     147, 034112. DOI: 10.1063/1.4993215
   * E. Caldeweyher, S. Ehlert, A. Hansen, H. Neugebauer, S. Spicher,
     C. Bannwarth and S. Grimme, J. Chem. Phys., 2019, 150, 154122.
     DOI: 10.1063/1.5090222
   
   for sTDA-xTB:
   * S. Grimme and C. Bannwarth, J. Chem. Phys., 2016, 145, 054103.
     DOI: 10.1063/1.4959605
   
   in the mass-spec context:
   * V. Asgeirsson, C. Bauer and S. Grimme, Chem. Sci., 2017, 8, 4879.
     DOI: 10.1039/c7sc00601b
   
   for metadynamics refer to:
   * S. Grimme, J. Chem. Theory Comput., 2019, 155, 2847-2862
     DOI: 10.1021/acs.jctc.9b00143
   
   with help from (in alphabetical order)
   C. Bannwarth, F. Bohle, G. Brandenburg, E. Caldeweyher, M. Checinski,
   S. Dohm, S. Ehlert, S. Ehrlich, F. März, H. Neugebauer, J. Pisarek,
   P. Pracht, P. Shushkov, and S. Spicher.
   
 * started run on 2021/05/19 at 10:59:18.787     

           -------------------------------------------------
          |                Calculation Setup                |
           -------------------------------------------------

          program call               : /ihome/ghutchison/geoffh/xtb/xtb 516.xyz -opt
          hostname                   : smp-n144
          coordinate file            : 516.xyz
          omp threads                :                     1
          number of atoms            :                    23
          number of electrons        :                    68
          charge                     :                     0
          spin                       :                   0.0
          first test random number   :      0.54010247295197


########################################################################
# WARNING! Please study the warnings concerning your input carefully
#  - the use of '-opt' is discouraged, please use '--opt' next time
########################################################################

           ------------------------------------------------- 
          |                 G F N 2 - x T B                 |
          | Geometry, Frequencies, Noncovalent interactions |
          |            JCTC 2019 parametrisation            |
           ------------------------------------------------- 
             KAB for C  - Si     :                1.0500
             KAB for H  - Pd     :                0.9500
             k(s)              :                1.8500
             k(p)              :                2.2300
             k(d)              :                2.2300
             k(f)              :                2.0000
             kEN (H0ij)        :               -2.0000
             D4 a1             :                0.5200
             D4 a2             :                5.0000
             D4 s6             :                1.0000
             D4 s8             :                2.7000
             D4 s9             :                5.0000
             alphaj            :                2.0000

  Z AO/shell   Hii/eV     exponent
  1     Wed Apr 25 08:07:45 CEST 2018   EN: 2.200 GM2: 0.406  GM3: 0.0800  RAES: 1.40
     1s    -10.707211    1.230000
  6     Wed Apr 25 08:07:45 CEST 2018   EN: 2.550 GM2: 0.538  GM3: 0.1500  RAES: 3.00
     2s    -13.970922    2.096432
     2p    -10.063292    1.800000
  7     Wed Apr 25 08:07:45 CEST 2018   EN: 3.040 GM2: 0.461  GM3:-0.0640  RAES: 1.90
     2s    -16.686243    2.339881
     2p    -12.523956    2.014332
  8     Wed Apr 25 08:07:45 CEST 2018   EN: 3.440 GM2: 0.452  GM3:-0.0517  RAES: 1.80
     2s    -20.229985    2.439742
     2p    -15.503117    2.137023
 16     Tue Apr 24 11:44:34 CEST 2018   EN: 2.580 GM2: 0.340  GM3:-0.0502  RAES: 3.10
     3s    -20.029654    1.981333
     3p    -11.377694    2.025643
     3d     -0.420282    1.702555

           ------------------------------------------------- 
          |        Self-Consistent Charge Iterations        |
           ------------------------------------------------- 

          ...................................................
          :                      SETUP                      :
          :.................................................:
          :  # basis functions                  68          :
          :  # atomic orbitals                  67          :
          :  # shells                           37          :
          :  # electrons                        68          :
          :  max. iterations                   250          :
          :  Hamiltonian                  GFN2-xTB          :
          :  restarted?                      false          :
          :  GBSA solvation                  false          :
          :  PC potential                    false          :
          :  electronic temp.          300.0000000     K    :
          :  accuracy                    1.0000000          :
          :  -> integral cutoff          0.2500000E+02      :
          :  -> integral neglect         0.1000000E-07      :
          :  -> SCF convergence          0.1000000E-05 Eh   :
          :  -> wf. convergence          0.1000000E-03 e    :
          :  Broyden damping             0.4000000          :
          ...................................................

 iter      E             dE          RMSdq      gap      omega  full diag
   1    -37.8670963 -0.378671E+02  0.427E+00    2.38       0.0  T
   2    -37.9237548 -0.566584E-01  0.261E+00    1.59       1.0  T
   3    -37.9292940 -0.553927E-02  0.167E+00    1.81       1.0  T
   4    -37.9456903 -0.163963E-01  0.531E-01    1.46       1.0  T
   5    -37.9494391 -0.374879E-02  0.158E-01    1.44       1.0  T
   6    -37.9497187 -0.279647E-03  0.851E-02    1.49       1.0  T
   7    -37.9497629 -0.441392E-04  0.316E-02    1.49       1.0  T
   8    -37.9497678 -0.489695E-05  0.178E-02    1.49       1.2  T
   9    -37.9497708 -0.305748E-05  0.655E-03    1.49       3.2  T
  10    -37.9497710 -0.150484E-06  0.186E-03    1.49      11.2  T
  11    -37.9497710 -0.100941E-07  0.728E-04    1.49      28.7  T
  12    -37.9497710 -0.227968E-08  0.275E-04    1.49      75.8  T

   *** convergence criteria satisfied after 12 iterations ***

         #    Occupation            Energy/Eh            Energy/eV
      -------------------------------------------------------------
         1        2.0000           -0.7285148             -19.8239
       ...           ...                  ...                  ...
        28        2.0000           -0.4509933             -12.2722
        29        2.0000           -0.4408450             -11.9960
        30        2.0000           -0.4236564             -11.5283
        31        2.0000           -0.4213030             -11.4642
        32        2.0000           -0.4013686             -10.9218
        33        2.0000           -0.3654758              -9.9451
        34        2.0000           -0.3461976              -9.4205 (HOMO)
        35                         -0.2915497              -7.9335 (LUMO)
        36                         -0.2388653              -6.4999
        37                         -0.1978311              -5.3833
        38                         -0.1934795              -5.2648
        39                         -0.1581252              -4.3028
       ...                                ...                  ...
        67                          0.6866911              18.6858
      -------------------------------------------------------------
                  HL-Gap            0.0546480 Eh            1.4870 eV
             Fermi-level           -0.3188737 Eh           -8.6770 eV

 SCC (total)                   0 d,  0 h,  0 min,  0.037 sec
 SCC setup                      ...        0 min,  0.000 sec (  0.804%)
 Dispersion                     ...        0 min,  0.000 sec (  0.872%)
 integral evaluation            ...        0 min,  0.008 sec ( 22.817%)
 zeroth order Hamiltonian       ...        0 min,  0.000 sec (  0.474%)
 iterations                     ...        0 min,  0.014 sec ( 37.835%)
 molecular gradient             ...        0 min,  0.013 sec ( 36.015%)
 printout                       ...        0 min,  0.000 sec (  1.042%)

         :::::::::::::::::::::::::::::::::::::::::::::::::::::
         ::                     SUMMARY                     ::
         :::::::::::::::::::::::::::::::::::::::::::::::::::::
         :: total energy             -37.471323368118 Eh    ::
         :: gradient norm              0.090908477448 Eh/a0 ::
         :: HOMO-LUMO gap              1.487046721535 eV    ::
         ::.................................................::
         :: SCC energy               -37.949770973459 Eh    ::
         :: -> isotropic ES            0.034175725605 Eh    ::
         :: -> anisotropic ES          0.004463398067 Eh    ::
         :: -> anisotropic XC          0.017803920053 Eh    ::
         :: -> dispersion             -0.024229316893 Eh    ::
         :: repulsion energy           0.478235964624 Eh    ::
         :: add. restraining           0.000000000000 Eh    ::
         :::::::::::::::::::::::::::::::::::::::::::::::::::::

      ----------------------------------------------------------- 
     |                   =====================                   |
     |                        A N C O P T                        |
     |                   =====================                   |
     |               Approximate Normal Coordinate               |
     |                Rational Function Optimizer                |
      ----------------------------------------------------------- 

          ...................................................
          :                      SETUP                      :
          :.................................................:
          :   optimization level            normal          :
          :   max. optcycles                   200          :
          :   ANC micro-cycles                  20          :
          :   degrees of freedom                63          :
          :.................................................:
          :   RF solver                   davidson          :
          :   input Hessian                  false          :
          :   write xtbopt.log                true          :
          :   linear?                        false          :
          :   energy convergence         0.5000000E-05 Eh   :
          :   grad. convergence          0.1000000E-02 Eh/α :
          :   maximium RF displ.         2.0000000          :
          :   Hlow (freq-cutoff)         0.5000000E-02      :
          :   Hmax (freq-cutoff)         5.0000000          :
          :   S6 in model hess.         20.0000000          :
          ...................................................

generating ANC from model Hessian ...
Using Lindh-Hessian (1995)
 Shifting diagonal of input Hessian by   2.458935528426180E-003
 Lowest  eigenvalues of input Hessian
   -0.000000   -0.000000    0.000000    0.000000    0.000000    0.000000
    0.005000    0.006669    0.007684    0.009198    0.010034    0.016009
    0.018567    0.021631    0.024141    0.028564    0.036171    0.040554
 Highest eigenvalues
    1.667762    1.821663    1.894382    2.022428    2.047716    2.116853
 

........................................................................
.............................. CYCLE    1 ..............................
........................................................................
   1    -37.9497710 -0.379498E+02  0.116E-04    1.49       0.0  T
   2    -37.9497710 -0.529639E-10  0.698E-05    1.49     298.9  T
   3    -37.9497710 -0.119371E-10  0.493E-05    1.49     422.6  T
     SCC iter.                  ...        0 min,  0.004 sec
     gradient                   ...        0 min,  0.013 sec
 * total energy  :   -37.4713234 Eh     change       -0.2081322E-07 Eh
   gradient norm :     0.0909068 Eh/α   predicted     0.0000000E+00 (-100.00%)
   displ. norm   :     0.2989051 α      lambda       -0.1028853E-01
   maximum displ.:     0.1921163 α      in ANC's #10, #20, #12, ...

........................................................................
.............................. CYCLE    2 ..............................
........................................................................
   1    -37.9759406 -0.379759E+02  0.491E-01    1.83       0.0  T
   2    -37.9761060 -0.165465E-03  0.248E-01    1.76       1.0  T
   3    -37.9759204  0.185609E-03  0.130E-01    1.77       1.0  T
   4    -37.9762022 -0.281788E-03  0.315E-02    1.76       1.0  T
   5    -37.9762031 -0.911932E-06  0.150E-02    1.75       1.4  T
   6    -37.9762048 -0.169223E-05  0.467E-03    1.76       4.5  T
   7    -37.9762050 -0.179766E-06  0.241E-03    1.76       8.7  T
     SCC iter.                  ...        0 min,  0.008 sec
     gradient                   ...        0 min,  0.013 sec
 * total energy  :   -37.4780175 Eh     change       -0.6694135E-02 Eh
   gradient norm :     0.0334322 Eh/α   predicted    -0.5603883E-02 ( -16.29%)
   displ. norm   :     0.2234200 α      lambda       -0.2425278E-02
   maximum displ.:     0.1444132 α      in ANC's #10, #4, #20, ...

........................................................................
.............................. CYCLE    3 ..............................
........................................................................
   1    -37.9859058 -0.379859E+02  0.225E-01    1.86       0.0  T
   2    -37.9859575 -0.516535E-04  0.131E-01    1.84       1.0  T
   3    -37.9859138  0.436762E-04  0.836E-02    1.84       1.0  T
   4    -37.9860085 -0.947630E-04  0.110E-02    1.84       1.9  T
   5    -37.9860092 -0.622330E-06  0.644E-03    1.84       3.2  T
   6    -37.9860093 -0.143871E-06  0.340E-03    1.84       6.1  T
   7    -37.9860094 -0.124618E-06  0.133E-03    1.84      15.6  T
     SCC iter.                  ...        0 min,  0.008 sec
     gradient                   ...        0 min,  0.013 sec
 * total energy  :   -37.4794666 Eh     change       -0.1449064E-02 Eh
   gradient norm :     0.0122482 Eh/α   predicted    -0.1273170E-02 ( -12.14%)
   displ. norm   :     0.1879762 α      lambda       -0.5793204E-03
   maximum displ.:     0.1355497 α      in ANC's #4, #6, #2, ...

........................................................................
.............................. CYCLE    4 ..............................
........................................................................
   1    -37.9849015 -0.379849E+02  0.184E-01    1.83       0.0  T
   2    -37.9849154 -0.138363E-04  0.104E-01    1.84       1.0  T
   3    -37.9848689  0.464451E-04  0.589E-02    1.84       1.0  T
   4    -37.9849312 -0.622411E-04  0.921E-03    1.84       2.3  T
   5    -37.9849311  0.368618E-07  0.561E-03    1.84       3.7  T
   6    -37.9849315 -0.343020E-06  0.203E-03    1.84      10.3  T
   7    -37.9849315 -0.324465E-07  0.101E-03    1.84      20.6  T
     SCC iter.                  ...        0 min,  0.008 sec
     gradient                   ...        0 min,  0.013 sec
 * total energy  :   -37.4798755 Eh     change       -0.4089295E-03 Eh
   gradient norm :     0.0072472 Eh/α   predicted    -0.2998996E-03 ( -26.66%)
   displ. norm   :     0.2486761 α      lambda       -0.4604085E-03
   maximum displ.:     0.1726110 α      in ANC's #4, #6, #2, ...

........................................................................
.............................. CYCLE    5 ..............................
........................................................................
   1    -37.9818809 -0.379819E+02  0.233E-01    1.82       0.0  T
   2    -37.9818982 -0.172410E-04  0.129E-01    1.83       1.0  T
   3    -37.9818347  0.634544E-04  0.662E-02    1.83       1.0  T
   4    -37.9819155 -0.807792E-04  0.117E-02    1.84       1.8  T
   5    -37.9819154  0.492661E-07  0.614E-03    1.84       3.4  T
   6    -37.9819159 -0.425007E-06  0.238E-03    1.84       8.8  T
   7    -37.9819159 -0.350627E-07  0.125E-03    1.84      16.7  T
     SCC iter.                  ...        0 min,  0.008 sec
     gradient                   ...        0 min,  0.013 sec
 * total energy  :   -37.4801867 Eh     change       -0.3111350E-03 Eh
   gradient norm :     0.0076042 Eh/α   predicted    -0.2444437E-03 ( -21.43%)
   displ. norm   :     0.2199026 α      lambda       -0.2848397E-03
   maximum displ.:     0.1473098 α      in ANC's #4, #6, #2, ...

........................................................................
.............................. CYCLE    6 ..............................
........................................................................
   1    -37.9805533 -0.379806E+02  0.179E-01    1.84       0.0  T
   2    -37.9805618 -0.850824E-05  0.976E-02    1.84       1.0  T
   3    -37.9805454  0.164141E-04  0.355E-02    1.84       1.0  T
   4    -37.9805671 -0.216856E-04  0.921E-03    1.84       2.3  T
   5    -37.9805672 -0.129612E-06  0.317E-03    1.84       6.6  T
   6    -37.9805673 -0.858792E-07  0.162E-03    1.84      12.9  T
   7    -37.9805673 -0.159884E-07  0.814E-04    1.84      25.6  T
     SCC iter.                  ...        0 min,  0.008 sec
     gradient                   ...        0 min,  0.013 sec
 * total energy  :   -37.4804001 Eh     change       -0.2134778E-03 Eh
   gradient norm :     0.0076878 Eh/α   predicted    -0.1493077E-03 ( -30.06%)
   displ. norm   :     0.2537743 α      lambda       -0.2798284E-03
   maximum displ.:     0.1584081 α      in ANC's #4, #6, #2, ...

........................................................................
.............................. CYCLE    7 ..............................
........................................................................
   1    -37.9809770 -0.379810E+02  0.180E-01    1.85       0.0  T
   2    -37.9809852 -0.821281E-05  0.100E-01    1.86       1.0  T
   3    -37.9809827  0.247332E-05  0.213E-02    1.86       1.0  T
   4    -37.9809886 -0.587366E-05  0.840E-03    1.86       2.5  T
   5    -37.9809888 -0.257765E-06  0.271E-03    1.86       7.7  T
   6    -37.9809889 -0.331732E-07  0.141E-03    1.86      14.8  T
     SCC iter.                  ...        0 min,  0.007 sec
     gradient                   ...        0 min,  0.013 sec
 * total energy  :   -37.4806011 Eh     change       -0.2010055E-03 Eh
   gradient norm :     0.0065853 Eh/α   predicted    -0.1489295E-03 ( -25.91%)
   displ. norm   :     0.2155419 α      lambda       -0.1853262E-03
   maximum displ.:     0.1346960 α      in ANC's #2, #4, #6, ...

........................................................................
.............................. CYCLE    8 ..............................
........................................................................
   1    -37.9826379 -0.379826E+02  0.138E-01    1.87       0.0  T
   2    -37.9826429 -0.503746E-05  0.777E-02    1.87       1.0  T
   3    -37.9826409  0.204048E-05  0.173E-02    1.87       1.2  T
   4    -37.9826451 -0.425409E-05  0.621E-03    1.87       3.4  T
   5    -37.9826452 -0.825863E-07  0.216E-03    1.87       9.7  T
   6    -37.9826453 -0.255643E-07  0.101E-03    1.87      20.6  T
     SCC iter.                  ...        0 min,  0.007 sec
     gradient                   ...        0 min,  0.013 sec
 * total energy  :   -37.4807355 Eh     change       -0.1344084E-03 Eh
   gradient norm :     0.0051202 Eh/α   predicted    -0.9696863E-04 ( -27.86%)
   displ. norm   :     0.1800796 α      lambda       -0.1288333E-03
   maximum displ.:     0.1316937 α      in ANC's #2, #6, #4, ...

........................................................................
.............................. CYCLE    9 ..............................
........................................................................
   1    -37.9843740 -0.379844E+02  0.109E-01    1.88       0.0  T
   2    -37.9843775 -0.348351E-05  0.614E-02    1.88       1.0  T
   3    -37.9843753  0.217045E-05  0.153E-02    1.88       1.4  T
   4    -37.9843791 -0.372480E-05  0.489E-03    1.88       4.3  T
   5    -37.9843791 -0.491580E-07  0.194E-03    1.88      10.8  T
   6    -37.9843791 -0.278952E-07  0.858E-04    1.88      24.3  T
     SCC iter.                  ...        0 min,  0.007 sec
     gradient                   ...        0 min,  0.013 sec
 * total energy  :   -37.4808345 Eh     change       -0.9894447E-04 Eh
   gradient norm :     0.0040509 Eh/α   predicted    -0.6650744E-04 ( -32.78%)
   displ. norm   :     0.1792977 α      lambda       -0.1113240E-03
   maximum displ.:     0.1368233 α      in ANC's #2, #1, #6, ...

........................................................................
.............................. CYCLE   10 ..............................
........................................................................
   1    -37.9854080 -0.379854E+02  0.107E-01    1.89       0.0  T
   2    -37.9854114 -0.335163E-05  0.599E-02    1.89       1.0  T
   3    -37.9854112  0.171791E-06  0.107E-02    1.89       2.0  T
   4    -37.9854126 -0.138350E-05  0.499E-03    1.89       4.2  T
   5    -37.9854127 -0.136963E-06  0.149E-03    1.89      14.0  T
   6    -37.9854127 -0.161979E-07  0.623E-04    1.89      33.5  T
     SCC iter.                  ...        0 min,  0.007 sec
     gradient                   ...        0 min,  0.013 sec
 * total energy  :   -37.4809249 Eh     change       -0.9043492E-04 Eh
   gradient norm :     0.0039360 Eh/α   predicted    -0.5745659E-04 ( -36.47%)
   displ. norm   :     0.1970064 α      lambda       -0.1147502E-03
   maximum displ.:     0.1510729 α      in ANC's #2, #1, #6, ...

........................................................................
.............................. CYCLE   11 ..............................
........................................................................
   1    -37.9855464 -0.379855E+02  0.128E-01    1.90       0.0  T
   2    -37.9855510 -0.461638E-05  0.705E-02    1.90       1.0  T
   3    -37.9855503  0.703680E-06  0.142E-02    1.90       1.5  T
   4    -37.9855526 -0.227780E-05  0.658E-03    1.90       3.2  T
   5    -37.9855529 -0.275374E-06  0.170E-03    1.90      12.3  T
   6    -37.9855529 -0.215114E-07  0.695E-04    1.90      30.0  T
   7    -37.9855529 -0.185163E-08  0.424E-04    1.90      49.2  T
     SCC iter.                  ...        0 min,  0.008 sec
     gradient                   ...        0 min,  0.013 sec
 * total energy  :   -37.4810197 Eh     change       -0.9478282E-04 Eh
   gradient norm :     0.0041795 Eh/α   predicted    -0.5960345E-04 ( -37.12%)
   displ. norm   :     0.2478725 α      lambda       -0.1275939E-03
   maximum displ.:     0.1788228 α      in ANC's #2, #1, #6, ...

........................................................................
.............................. CYCLE   12 ..............................
........................................................................
   1    -37.9847405 -0.379847E+02  0.162E-01    1.90       0.0  T
   2    -37.9847484 -0.789772E-05  0.890E-02    1.91       1.0  T
   3    -37.9847431  0.525396E-05  0.242E-02    1.90       1.0  T
   4    -37.9847516 -0.843156E-05  0.846E-03    1.91       2.5  T
   5    -37.9847519 -0.288307E-06  0.278E-03    1.91       7.5  T
   6    -37.9847519 -0.660695E-07  0.111E-03    1.91      18.8  T
     SCC iter.                  ...        0 min,  0.007 sec
     gradient                   ...        0 min,  0.013 sec
 * total energy  :   -37.4811171 Eh     change       -0.9740915E-04 Eh
   gradient norm :     0.0040422 Eh/α   predicted    -0.6771938E-04 ( -30.48%)
   displ. norm   :     0.2528464 α      lambda       -0.1096283E-03
   maximum displ.:     0.1780274 α      in ANC's #2, #1, #5, ...

........................................................................
.............................. CYCLE   13 ..............................
........................................................................
   1    -37.9837570 -0.379838E+02  0.175E-01    1.91       0.0  T
   2    -37.9837667 -0.973879E-05  0.962E-02    1.91       1.0  T
   3    -37.9837517  0.149625E-04  0.356E-02    1.91       1.0  T
   4    -37.9837720 -0.202377E-04  0.909E-03    1.91       2.3  T
   5    -37.9837722 -0.174404E-06  0.355E-03    1.91       5.9  T
   6    -37.9837723 -0.113870E-06  0.152E-03    1.91      13.7  T
   7    -37.9837723 -0.261137E-07  0.692E-04    1.91      30.1  T
     SCC iter.                  ...        0 min,  0.008 sec
     gradient                   ...        0 min,  0.013 sec
 * total energy  :   -37.4811909 Eh     change       -0.7381888E-04 Eh
   gradient norm :     0.0039884 Eh/α   predicted    -0.5832210E-04 ( -20.99%)
   displ. norm   :     0.1914480 α      lambda       -0.6738434E-04
   maximum displ.:     0.1226108 α      in ANC's #1, #2, #5, ...

........................................................................
.............................. CYCLE   14 ..............................
........................................................................
   1    -37.9837107 -0.379837E+02  0.127E-01    1.91       0.0  T
   2    -37.9837161 -0.540085E-05  0.701E-02    1.92       1.0  T
   3    -37.9837074  0.871176E-05  0.261E-02    1.92       1.0  T
   4    -37.9837191 -0.116958E-04  0.708E-03    1.92       2.9  T
   5    -37.9837192 -0.158305E-06  0.267E-03    1.92       7.8  T
   6    -37.9837193 -0.554467E-07  0.126E-03    1.92      16.6  T
   7    -37.9837193 -0.165001E-07  0.562E-04    1.92      37.1  T
   8    -37.9837193 -0.114188E-08  0.202E-04    1.92     103.1  T
     SCC iter.                  ...        0 min,  0.009 sec
     gradient                   ...        0 min,  0.013 sec
 * total energy  :   -37.4812377 Eh     change       -0.4673159E-04 Eh
   gradient norm :     0.0031657 Eh/α   predicted    -0.3492970E-04 ( -25.25%)
   displ. norm   :     0.1416554 α      lambda       -0.5071493E-04
   maximum displ.:     0.0972959 α      in ANC's #1, #2, #3, ...

........................................................................
.............................. CYCLE   15 ..............................
........................................................................
   1    -37.9838800 -0.379839E+02  0.956E-02    1.91       0.0  T
   2    -37.9838834 -0.344042E-05  0.522E-02    1.92       1.0  T
   3    -37.9838765  0.693882E-05  0.227E-02    1.92       1.0  T
   4    -37.9838856 -0.908813E-05  0.597E-03    1.92       3.5  T
   5    -37.9838857 -0.128312E-06  0.224E-03    1.92       9.3  T
   6    -37.9838857 -0.280636E-07  0.113E-03    1.92      18.4  T
   7    -37.9838858 -0.153653E-07  0.459E-04    1.92      45.5  T
   8    -37.9838858 -0.477492E-09  0.206E-04    1.92     101.3  T
     SCC iter.                  ...        0 min,  0.009 sec
     gradient                   ...        0 min,  0.013 sec
 * total energy  :   -37.4812732 Eh     change       -0.3552235E-04 Eh
   gradient norm :     0.0028746 Eh/α   predicted    -0.2587180E-04 ( -27.17%)
   displ. norm   :     0.1630098 α      lambda       -0.4775698E-04
   maximum displ.:     0.1143930 α      in ANC's #1, #2, #5, ...

........................................................................
.............................. CYCLE   16 ..............................
........................................................................
   1    -37.9840483 -0.379840E+02  0.104E-01    1.91       0.0  T
   2    -37.9840519 -0.358464E-05  0.572E-02    1.92       1.0  T
   3    -37.9840454  0.649121E-05  0.218E-02    1.92       1.0  T
   4    -37.9840540 -0.859061E-05  0.673E-03    1.92       3.1  T
   5    -37.9840542 -0.180477E-06  0.226E-03    1.92       9.2  T
   6    -37.9840542 -0.269432E-07  0.109E-03    1.92      19.1  T
   7    -37.9840542 -0.109565E-07  0.546E-04    1.92      38.2  T
   8    -37.9840542 -0.112687E-08  0.233E-04    1.92      89.4  T
     SCC iter.                  ...        0 min,  0.009 sec
     gradient                   ...        0 min,  0.013 sec
 * total energy  :   -37.4813009 Eh     change       -0.2767961E-04 Eh
   gradient norm :     0.0031645 Eh/α   predicted    -0.2451406E-04 ( -11.44%)
   displ. norm   :     0.0899056 α      lambda       -0.3542791E-04
   maximum displ.:     0.0714940 α      in ANC's #1, #3, #2, ...

........................................................................
.............................. CYCLE   17 ..............................
........................................................................
   1    -37.9852094 -0.379852E+02  0.752E-02    1.92       0.0  T
   2    -37.9852113 -0.189267E-05  0.398E-02    1.92       1.0  T
   3    -37.9852081  0.318675E-05  0.152E-02    1.92       1.4  T
   4    -37.9852124 -0.428697E-05  0.467E-03    1.92       4.5  T
   5    -37.9852124 -0.690351E-07  0.130E-03    1.92      16.1  T
   6    -37.9852125 -0.106229E-07  0.623E-04    1.92      33.5  T
   7    -37.9852125 -0.263742E-08  0.336E-04    1.92      62.1  T
     SCC iter.                  ...        0 min,  0.008 sec
     gradient                   ...        0 min,  0.013 sec
 * total energy  :   -37.4813233 Eh     change       -0.2244067E-04 Eh
   gradient norm :     0.0028048 Eh/α   predicted    -0.1786107E-04 ( -20.41%)
   displ. norm   :     0.1568870 α      lambda       -0.3946733E-04
   maximum displ.:     0.1183959 α      in ANC's #1, #2, #3, ...

........................................................................
.............................. CYCLE   18 ..............................
........................................................................
   1    -37.9839762 -0.379840E+02  0.102E-01    1.91       0.0  T
   2    -37.9839793 -0.306711E-05  0.553E-02    1.92       1.0  T
   3    -37.9839751  0.414349E-05  0.186E-02    1.92       1.1  T
   4    -37.9839808 -0.565919E-05  0.560E-03    1.92       3.7  T
   5    -37.9839809 -0.811450E-07  0.206E-03    1.92      10.1  T
   6    -37.9839809 -0.489484E-07  0.703E-04    1.92      29.6  T
   7    -37.9839809 -0.206973E-08  0.386E-04    1.92      54.0  T
     SCC iter.                  ...        0 min,  0.008 sec
     gradient                   ...        0 min,  0.013 sec
 * total energy  :   -37.4813470 Eh     change       -0.2370397E-04 Eh
   gradient norm :     0.0034602 Eh/α   predicted    -0.2022043E-04 ( -14.70%)
   displ. norm   :     0.0686374 α      lambda       -0.3081930E-04
   maximum displ.:     0.0631842 α      in ANC's #1, #2, #10, ...

........................................................................
.............................. CYCLE   19 ..............................
........................................................................
   1    -37.9847523 -0.379848E+02  0.502E-02    1.92       0.0  T
   2    -37.9847531 -0.832845E-06  0.274E-02    1.92       1.0  T
   3    -37.9847520  0.110750E-05  0.954E-03    1.92       2.2  T
   4    -37.9847535 -0.149824E-05  0.281E-03    1.92       7.4  T
   5    -37.9847535 -0.304390E-07  0.927E-04    1.92      22.5  T
   6    -37.9847535 -0.196979E-08  0.403E-04    1.92      51.7  T
     SCC iter.                  ...        0 min,  0.007 sec
     gradient                   ...        0 min,  0.013 sec
 * total energy  :   -37.4813687 Eh     change       -0.2169781E-04 Eh
   gradient norm :     0.0018710 Eh/α   predicted    -0.1548774E-04 ( -28.62%)
   displ. norm   :     0.1381652 α      lambda       -0.2341096E-04
   maximum displ.:     0.1187767 α      in ANC's #1, #2, #20, ...

........................................................................
.............................. CYCLE   20 ..............................
........................................................................
   1    -37.9848497 -0.379848E+02  0.914E-02    1.92       0.0  T
   2    -37.9848519 -0.220404E-05  0.506E-02    1.92       1.0  T
   3    -37.9848495  0.234628E-05  0.143E-02    1.92       1.5  T
   4    -37.9848529 -0.337972E-05  0.434E-03    1.92       4.8  T
   5    -37.9848530 -0.755741E-07  0.144E-03    1.92      14.5  T
   6    -37.9848530 -0.946527E-08  0.601E-04    1.92      34.7  T
   7    -37.9848530 -0.182477E-08  0.330E-04    1.92      63.2  T
     SCC iter.                  ...        0 min,  0.008 sec
     gradient                   ...        0 min,  0.013 sec
 * total energy  :   -37.4813880 Eh     change       -0.1931254E-04 Eh
   gradient norm :     0.0024650 Eh/α   predicted    -0.1180562E-04 ( -38.87%)
   displ. norm   :     0.1008570 α      lambda       -0.2199621E-04
   maximum displ.:     0.0869112 α      in ANC's #1, #2, #4, ...
 * RMSD in coord.:     0.5782067 α      energy gain  -0.1006465E-01 Eh

generating ANC from model Hessian ...
Using Lindh-Hessian (1995)
 Shifting diagonal of input Hessian by   2.471886265581657E-003
 Lowest  eigenvalues of input Hessian
   -0.000000   -0.000000    0.000000    0.000000    0.000000    0.000000
    0.005000    0.006862    0.008250    0.008698    0.009854    0.016310
    0.018413    0.022648    0.023955    0.028288    0.038533    0.044193
 Highest eigenvalues
    1.751025    1.867509    1.900241    2.045420    2.174405    2.180750
 

........................................................................
.............................. CYCLE   21 ..............................
........................................................................
   1    -37.9845563 -0.379846E+02  0.621E-02    1.92       0.0  T
   2    -37.9845574 -0.113902E-05  0.345E-02    1.92       1.0  T
   3    -37.9845565  0.903015E-06  0.894E-03    1.92       2.3  T
   4    -37.9845579 -0.134189E-05  0.296E-03    1.92       7.0  T
   5    -37.9845579 -0.495102E-07  0.105E-03    1.92      19.9  T
   6    -37.9845579 -0.444425E-08  0.441E-04    1.92      47.3  T
   7    -37.9845579 -0.185393E-08  0.208E-04    1.92     100.2  T
     SCC iter.                  ...        0 min,  0.008 sec
     gradient                   ...        0 min,  0.013 sec
 * total energy  :   -37.4814043 Eh     change       -0.1631803E-04 Eh
   gradient norm :     0.0021815 Eh/α   predicted     0.0000000E+00 (-100.00%)
   displ. norm   :     0.0336330 α      lambda       -0.1414560E-04
   maximum displ.:     0.0292312 α      in ANC's #1, #3, #4, ...

........................................................................
.............................. CYCLE   22 ..............................
........................................................................
   1    -37.9848228 -0.379848E+02  0.233E-02    1.92       0.0  T
   2    -37.9848229 -0.149858E-06  0.132E-02    1.92       1.6  T
   3    -37.9848227  0.221197E-06  0.385E-03    1.92       5.4  T
   4    -37.9848230 -0.272485E-06  0.123E-03    1.92      17.0  T
   5    -37.9848230 -0.105132E-07  0.455E-04    1.92      45.8  T
   6    -37.9848230 -0.115384E-08  0.182E-04    1.92     114.7  T
     SCC iter.                  ...        0 min,  0.007 sec
     gradient                   ...        0 min,  0.013 sec
 * total energy  :   -37.4814147 Eh     change       -0.1037609E-04 Eh
   gradient norm :     0.0010683 Eh/α   predicted    -0.7081709E-05 ( -31.75%)
   displ. norm   :     0.0376918 α      lambda       -0.7954199E-05
   maximum displ.:     0.0269506 α      in ANC's #1, #3, #13, ...

........................................................................
.............................. CYCLE   23 ..............................
........................................................................
   1    -37.9850078 -0.379850E+02  0.263E-02    1.92       0.0  T
   2    -37.9850081 -0.267216E-06  0.151E-02    1.92       1.4  T
   3    -37.9850078  0.326055E-06  0.468E-03    1.92       4.5  T
   4    -37.9850082 -0.409958E-06  0.134E-03    1.92      15.6  T
   5    -37.9850082 -0.173526E-07  0.517E-04    1.92      40.3  T
   6    -37.9850082 -0.930022E-09  0.246E-04    1.92      84.6  T
     SCC iter.                  ...        0 min,  0.007 sec
     gradient                   ...        0 min,  0.013 sec
 * total energy  :   -37.4814210 Eh     change       -0.6326839E-05 Eh
   gradient norm :     0.0009018 Eh/α   predicted    -0.3980095E-05 ( -37.09%)
   displ. norm   :     0.0367985 α      lambda       -0.4433976E-05
   maximum displ.:     0.0306242 α      in ANC's #1, #3, #7, ...

........................................................................
.............................. CYCLE   24 ..............................
........................................................................
   1    -37.9848838 -0.379849E+02  0.210E-02    1.92       0.0  T
   2    -37.9848839 -0.707102E-07  0.122E-02    1.92       1.7  T
   3    -37.9848839  0.585285E-08  0.144E-03    1.92      14.5  T
   4    -37.9848839 -0.270424E-07  0.662E-04    1.92      31.5  T
   5    -37.9848839 -0.349249E-08  0.336E-04    1.92      62.1  T
     SCC iter.                  ...        0 min,  0.006 sec
     gradient                   ...        0 min,  0.013 sec
 * total energy  :   -37.4814260 Eh     change       -0.4953324E-05 Eh
   gradient norm :     0.0010054 Eh/α   predicted    -0.2219360E-05 ( -55.19%)
   displ. norm   :     0.0366582 α      lambda       -0.3345974E-07
   maximum displ.:     0.0304555 α      in ANC's #1, #3, #7, ...

........................................................................
.............................. CYCLE   25 ..............................
........................................................................
   1    -37.9847304 -0.379847E+02  0.209E-02    1.92       0.0  T
   2    -37.9847305 -0.716518E-07  0.121E-02    1.92       1.7  T
   3    -37.9847305  0.113308E-08  0.133E-03    1.92      15.7  T
   4    -37.9847305 -0.224949E-07  0.637E-04    1.92      32.7  T
   5    -37.9847305 -0.287292E-08  0.322E-04    1.92      64.7  T
     SCC iter.                  ...        0 min,  0.006 sec
     gradient                   ...        0 min,  0.013 sec
 * total energy  :   -37.4814275 Eh     change       -0.1480848E-05 Eh
   gradient norm :     0.0015000 Eh/α   predicted    -0.1680364E-07 ( -98.87%)
   displ. norm   :     0.0224848 α      lambda       -0.4440080E-05
   maximum displ.:     0.0174746 α      in ANC's #1, #3, #7, ...

........................................................................
.............................. CYCLE   26 ..............................
........................................................................
   1    -37.9846659 -0.379847E+02  0.135E-02    1.92       0.0  T
   2    -37.9846660 -0.362708E-07  0.786E-03    1.92       2.7  T
   3    -37.9846658  0.150595E-06  0.308E-03    1.92       6.8  T
   4    -37.9846660 -0.178206E-06  0.602E-04    1.92      34.6  T
   5    -37.9846660 -0.197216E-08  0.298E-04    1.92      70.1  T
     SCC iter.                  ...        0 min,  0.006 sec
     gradient                   ...        0 min,  0.013 sec
 * total energy  :   -37.4814327 Eh     change       -0.5223128E-05 Eh
   gradient norm :     0.0010637 Eh/α   predicted    -0.2220877E-05 ( -57.48%)
   displ. norm   :     0.0557881 α      lambda       -0.7210333E-05
   maximum displ.:     0.0467424 α      in ANC's #1, #3, #7, ...

........................................................................
.............................. CYCLE   27 ..............................
........................................................................
   1    -37.9847609 -0.379848E+02  0.329E-02    1.92       0.0  T
   2    -37.9847611 -0.203778E-06  0.188E-02    1.92       1.1  T
   3    -37.9847604  0.671649E-06  0.657E-03    1.92       3.2  T
   4    -37.9847612 -0.801032E-06  0.161E-03    1.92      13.0  T
   5    -37.9847612 -0.114905E-07  0.640E-04    1.92      32.6  T
   6    -37.9847612 -0.218066E-08  0.222E-04    1.92      93.9  T
     SCC iter.                  ...        0 min,  0.007 sec
     gradient                   ...        0 min,  0.013 sec
 * total energy  :   -37.4814402 Eh     change       -0.7521532E-05 Eh
   gradient norm :     0.0007806 Eh/α   predicted    -0.3611284E-05 ( -51.99%)
   displ. norm   :     0.0556522 α      lambda       -0.4421979E-05
   maximum displ.:     0.0495104 α      in ANC's #1, #3, #7, ...

........................................................................
.............................. CYCLE   28 ..............................
........................................................................
   1    -37.9848008 -0.379848E+02  0.328E-02    1.92       0.0  T
   2    -37.9848010 -0.190721E-06  0.187E-02    1.92       1.1  T
   3    -37.9848008  0.187502E-06  0.402E-03    1.92       5.2  T
   4    -37.9848011 -0.253255E-06  0.157E-03    1.92      13.3  T
   5    -37.9848011 -0.147715E-07  0.548E-04    1.92      38.1  T
   6    -37.9848011 -0.258412E-08  0.205E-04    1.92     101.6  T
     SCC iter.                  ...        0 min,  0.007 sec
     gradient                   ...        0 min,  0.013 sec
 * total energy  :   -37.4814458 Eh     change       -0.5604022E-05 Eh
   gradient norm :     0.0008376 Eh/α   predicted    -0.2215201E-05 ( -60.47%)
   displ. norm   :     0.0569544 α      lambda        0.1861830E-06
   maximum displ.:     0.0509697 α      in ANC's #1, #3, #7, ...

........................................................................
.............................. CYCLE   29 ..............................
........................................................................
   1    -37.9847805 -0.379848E+02  0.336E-02    1.92       0.0  T
   2    -37.9847807 -0.200890E-06  0.191E-02    1.93       1.1  T
   3    -37.9847805  0.211852E-06  0.425E-03    1.93       4.9  T
   4    -37.9847808 -0.283408E-06  0.162E-03    1.93      12.8  T
   5    -37.9847808 -0.150637E-07  0.565E-04    1.93      36.9  T
   6    -37.9847808 -0.288644E-08  0.208E-04    1.93     100.3  T
     SCC iter.                  ...        0 min,  0.007 sec
     gradient                   ...        0 min,  0.013 sec
 * total energy  :   -37.4814495 Eh     change       -0.3705442E-05 Eh
   gradient norm :     0.0012525 Eh/α   predicted     0.8849609E-07 (-102.39%)
   displ. norm   :     0.0286883 α      lambda       -0.3291585E-05
   maximum displ.:     0.0273638 α      in ANC's #1, #3, #7, ...

........................................................................
.............................. CYCLE   30 ..............................
........................................................................
   1    -37.9849046 -0.379849E+02  0.179E-02    1.92       0.0  T
   2    -37.9849046 -0.677349E-07  0.100E-02    1.93       2.1  T
   3    -37.9849046  0.228103E-07  0.186E-03    1.93      11.2  T
   4    -37.9849046 -0.384726E-07  0.975E-04    1.93      21.4  T
   5    -37.9849046 -0.827183E-08  0.214E-04    1.93      97.4  T
     SCC iter.                  ...        0 min,  0.006 sec
     gradient                   ...        0 min,  0.013 sec
 * total energy  :   -37.4814540 Eh     change       -0.4448823E-05 Eh
   gradient norm :     0.0008701 Eh/α   predicted    -0.1647781E-05 ( -62.96%)
   displ. norm   :     0.0294677 α      lambda       -0.2224972E-05
   maximum displ.:     0.0281804 α      in ANC's #1, #3, #7, ...

   *** GEOMETRY OPTIMIZATION CONVERGED AFTER 30 ITERATIONS ***

------------------------------------------------------------------------
 total energy gain   :        -0.0101306 Eh       -6.3571 kcal/mol
 total RMSD          :         0.6144838 a0        0.3252 Å
 total power (kW/mol):        -0.8865973 (step)  -29.5971 (real)
------------------------------------------------------------------------

 ANCopt (total)                0 d,  0 h,  0 min,  0.899 sec
 optimizer setup                ...        0 min,  0.000 sec (  0.017%)
 model hessian                  ...        0 min,  0.013 sec (  1.459%)
 ANC generation                 ...        0 min,  0.001 sec (  0.145%)
 coordinate transformation      ...        0 min,  0.001 sec (  0.058%)
 single point calculation       ...        0 min,  0.873 sec ( 97.189%)
 optimization log               ...        0 min,  0.003 sec (  0.316%)
 hessian update                 ...        0 min,  0.000 sec (  0.044%)
 rational function              ...        0 min,  0.005 sec (  0.569%)

================
 final structure:
================
$coord
    1.52530745584691   -2.51157359330320   -1.36421403024645      N 
   -0.74436626304838   -1.33653309686805   -0.62570065517824      C 
   -2.93820216187087   -2.59886965612716   -0.17789469228887      C 
   -5.37858818276575   -0.62223474145313    0.62866689263337      S 
   -3.40980162456165    1.95873374197564    0.43751447564586      C 
   -1.00984312466267    1.34825966682230   -0.30094935038524      C 
    0.90436006663965    3.08154852290261   -0.77065892404521      N 
    3.49374660742577    2.20377037103445   -0.94215292806634      C 
    4.06247753815754    0.35585385452681    1.18540012542111      C 
    4.87820796484256    1.00129445666047    3.20276585756538      O 
    3.51169697339837   -2.37207378050994    0.52494070578145      C 
    0.32686161664659    5.54659555855948   -1.38539200428325      C 
    1.89979723086781    7.39862853820678   -2.02450714806125      C 
    1.19568330509908   -4.32918417405361   -1.87591097738757      H 
   -3.26622546276534   -4.59209035053292   -0.33828755876605      H 
   -4.17987363590498    3.77783331906307    0.86986479966666      H 
    4.73308842051441    3.83211983049980   -0.69891729900206      H 
    3.85106519322760    1.30318094027284   -2.77475643380853      H 
    3.07989237345174   -3.41482000448926    2.27397228805587      H 
    5.24609941615075   -3.16910808425668   -0.27983727473235      H 
   -1.67694585898542    5.92323567505743   -1.36424775747422      H 
    3.92044881398425    7.22491506528856   -2.12689314741579      H 
    1.14811310024436    9.22935938300360   -2.47281723928836      H 
$end
           -------------------------------------------------
          |                Final Singlepoint                |
           -------------------------------------------------

          ...................................................
          :                      SETUP                      :
          :.................................................:
          :  # basis functions                  68          :
          :  # atomic orbitals                  67          :
          :  # shells                           37          :
          :  # electrons                        68          :
          :  max. iterations                   250          :
          :  Hamiltonian                  GFN2-xTB          :
          :  restarted?                      false          :
          :  GBSA solvation                  false          :
          :  PC potential                    false          :
          :  electronic temp.          300.0000000     K    :
          :  accuracy                    1.0000000          :
          :  -> integral cutoff          0.2500000E+02      :
          :  -> integral neglect         0.1000000E-07      :
          :  -> SCF convergence          0.1000000E-05 Eh   :
          :  -> wf. convergence          0.1000000E-03 e    :
          :  Broyden damping             0.4000000          :
          ...................................................

 iter      E             dE          RMSdq      gap      omega  full diag
   1    -37.9849046 -0.379849E+02  0.838E-05    1.93       0.0  T
   2    -37.9849046 -0.102105E-10  0.394E-05    1.93     529.1  T
   3    -37.9849046 -0.456879E-11  0.358E-05    1.93     582.1  T

   *** convergence criteria satisfied after 3 iterations ***

         #    Occupation            Energy/Eh            Energy/eV
      -------------------------------------------------------------
         1        2.0000           -0.7327547             -19.9393
       ...           ...                  ...                  ...
        28        2.0000           -0.4562875             -12.4162
        29        2.0000           -0.4404210             -11.9845
        30        2.0000           -0.4221045             -11.4860
        31        2.0000           -0.4128156             -11.2333
        32        2.0000           -0.4049032             -11.0180
        33        2.0000           -0.3762489             -10.2383
        34        2.0000           -0.3459309              -9.4133 (HOMO)
        35                         -0.2751765              -7.4879 (LUMO)
        36                         -0.2404869              -6.5440
        37                         -0.2027171              -5.5162
        38                         -0.1925601              -5.2398
        39                         -0.1526386              -4.1535
       ...                                ...                  ...
        67                          0.6870088              18.6945
      -------------------------------------------------------------
                  HL-Gap            0.0707545 Eh            1.9253 eV
             Fermi-level           -0.3105537 Eh           -8.4506 eV

 SCC (total)                   0 d,  0 h,  0 min,  0.026 sec
 SCC setup                      ...        0 min,  0.000 sec (  0.682%)
 Dispersion                     ...        0 min,  0.000 sec (  0.704%)
 integral evaluation            ...        0 min,  0.008 sec ( 31.213%)
 zeroth order Hamiltonian       ...        0 min,  0.000 sec (  0.583%)
 iterations                     ...        0 min,  0.004 sec ( 14.942%)
 molecular gradient             ...        0 min,  0.013 sec ( 50.358%)
 printout                       ...        0 min,  0.000 sec (  1.299%)

         :::::::::::::::::::::::::::::::::::::::::::::::::::::
         ::                     SUMMARY                     ::
         :::::::::::::::::::::::::::::::::::::::::::::::::::::
         :: total energy             -37.481453956433 Eh    ::
         :: gradient norm              0.000869899606 Eh/a0 ::
         :: HOMO-LUMO gap              1.925326803736 eV    ::
         ::.................................................::
         :: SCC energy               -37.984904645206 Eh    ::
         :: -> isotropic ES            0.033014276813 Eh    ::
         :: -> anisotropic ES          0.003693597551 Eh    ::
         :: -> anisotropic XC          0.017640849902 Eh    ::
         :: -> dispersion             -0.024668787119 Eh    ::
         :: repulsion energy           0.503249453561 Eh    ::
         :: add. restraining           0.000000000000 Eh    ::
         :::::::::::::::::::::::::::::::::::::::::::::::::::::

           -------------------------------------------------
          |                Property Printout                |
           -------------------------------------------------

    * Orbital Energies and Occupations

         #    Occupation            Energy/Eh            Energy/eV
      -------------------------------------------------------------
         1        2.0000           -0.7327547             -19.9393
       ...           ...                  ...                  ...
        22        2.0000           -0.4982449             -13.5579
        23        2.0000           -0.4860704             -13.2266
        24        2.0000           -0.4781721             -13.0117
        25        2.0000           -0.4718148             -12.8387
        26        2.0000           -0.4663881             -12.6911
        27        2.0000           -0.4638455             -12.6219
        28        2.0000           -0.4562875             -12.4162
        29        2.0000           -0.4404210             -11.9845
        30        2.0000           -0.4221045             -11.4860
        31        2.0000           -0.4128156             -11.2333
        32        2.0000           -0.4049032             -11.0180
        33        2.0000           -0.3762489             -10.2383
        34        2.0000           -0.3459309              -9.4133 (HOMO)
        35                         -0.2751765              -7.4879 (LUMO)
        36                         -0.2404869              -6.5440
        37                         -0.2027171              -5.5162
        38                         -0.1925601              -5.2398
        39                         -0.1526386              -4.1535
        40                         -0.1136086              -3.0914
        41                         -0.0075163              -0.2045
        42                          0.0147334               0.4009
        43                          0.0286665               0.7801
        44                          0.0330796               0.9001
        45                          0.0376935               1.0257
       ...                                ...                  ...
        67                          0.6870088              18.6945
      -------------------------------------------------------------
                  HL-Gap            0.0707545 Eh            1.9253 eV
             Fermi-level           -0.3105537 Eh           -8.4506 eV

     #   Z        covCN         q      C6AA      α(0)
     1   7 N      2.684    -0.228    25.982     7.570
     2   6 C      3.106     0.040    26.976     8.510
     3   6 C      2.935    -0.051    29.264     8.872
     4  16 S      2.273    -0.047   142.999    20.127
     5   6 C      2.941    -0.054    29.336     8.883
     6   6 C      3.090     0.034    27.133     8.538
     7   7 N      2.738    -0.051    22.222     7.001
     8   6 C      3.750    -0.028    21.142     6.557
     9   6 C      2.814     0.238    23.023     7.862
    10   8 O      0.857    -0.332    20.360     6.050
    11   6 C      3.750    -0.010    20.811     6.506
    12   6 C      2.841     0.014    27.701     8.625
    13   6 C      2.836    -0.133    31.396     9.182
    14   1 H      0.860     0.150     1.404     1.856
    15   1 H      0.926     0.038     2.476     2.461
    16   1 H      0.927     0.043     2.403     2.424
    17   1 H      0.924     0.084     1.938     2.177
    18   1 H      0.924     0.064     2.154     2.295
    19   1 H      0.923     0.049     2.333     2.389
    20   1 H      0.924     0.071     2.080     2.255
    21   1 H      0.926     0.043     2.404     2.425
    22   1 H      0.926     0.030     2.593     2.518
    23   1 H      0.926     0.036     2.502     2.474

 Mol. C6AA /au·bohr⁶  :       7575.112587
 Mol. C8AA /au·bohr⁸  :     201177.070803
 Mol. α(0) /au        :        137.557624


Wiberg/Mayer (AO) data.
largest (>0.10) Wiberg bond orders for each atom
          total WBO             WBO to atom ...
     1  N   3.166        C    2 1.056    C   11 0.998    H   14 0.950
     2  C   3.967        C    3 1.580    C    6 1.169    N    1 1.056
     3  C   3.936        C    2 1.580    S    4 1.175    H   15 0.971    C    5 0.104
     4  S   2.602        C    3 1.175    C    5 1.165
     5  C   3.928        C    6 1.539    S    4 1.165    H   16 0.967    C    3 0.104
     6  C   3.965        C    5 1.539    C    2 1.169    N    7 1.091
     7  N   3.503        C   12 1.127    C    6 1.091    C    8 0.980    C   13 0.115
     8  C   3.977        N    7 0.980    C    9 0.964    H   18 0.958    H   17 0.954
     9  C   3.918        O   10 1.894    C   11 0.982    C    8 0.964
    10  O   2.096        C    9 1.894
    11  C   3.985        N    1 0.998    C    9 0.982    H   19 0.955    H   20 0.939
    12  C   3.964        C   13 1.828    N    7 1.127    H   21 0.953
    13  C   3.962        C   12 1.828    H   23 0.976    H   22 0.969    N    7 0.115
    14  H   0.977        N    1 0.950
    15  H   0.998        C    3 0.971
    16  H   0.998        C    5 0.967
    17  H   0.992        C    8 0.954
    18  H   0.995        C    8 0.958
    19  H   0.997        C   11 0.955
    20  H   0.994        C   11 0.939
    21  H   0.998        C   12 0.953
    22  H   0.999        C   13 0.969
    23  H   0.998        C   13 0.976

molecular dipole:
                 x           y           z       tot (Debye)
 q only:        0.220      -0.572      -0.847
   full:        0.351      -0.852      -0.908       3.289
molecular quadrupole (traceless):
                xx          xy          yy          xz          yz          zz
 q only:       -1.085      -4.006       4.701      -6.182      -1.016      -3.616
  q+dip:       -3.976      -5.246       9.966      -7.241      -1.392      -5.990
   full:       -3.688      -5.804       9.098      -6.927      -1.137      -5.410

           -------------------------------------------------
          |                Geometry Summary                 |
           -------------------------------------------------

      molecular mass/u    :      194.2508000
   center of mass at/Å    :        0.0440512       0.4635351      -0.0193518
  moments of inertia/u·Å² :        0.5190430E+03   0.7718142E+03   0.1128891E+04
rotational constants/cm⁻¹ :        0.3247830E-01   0.2184157E-01   0.1493291E-01

 * 22 selected distances

     #   Z        #   Z                                     value/Å
     1   7 N      2   6 C                                 1.4078046
     2   6 C      3   6 C                                 1.3601955
     3   6 C      4  16 S                                 1.7158005
     4  16 S      5   6 C                                 1.7207668 (max)
     2   6 C      6   6 C                                 1.4379659
     5   6 C      6   6 C                                 1.3674711
     6   6 C      7   7 N                                 1.3889357
     7   7 N      8   6 C                                 1.4496779
     9   6 C     10   8 O                                 1.2011012
     1   7 N     11   6 C                                 1.4525033
     7   7 N     12   6 C                                 1.3786929
    12   6 C     13   6 C                                 1.3295541
     1   7 N     14   1 H                                 1.0143369 (min)
     3   6 C     15   1 H                                 1.0723192
     5   6 C     16   1 H                                 1.0700719
     8   6 C     17   1 H                                 1.0904973
     8   6 C     18   1 H                                 1.0969646
    11   6 C     19   1 H                                 1.1015135
    11   6 C     20   1 H                                 1.0961870
    12   6 C     21   1 H                                 1.0789961
    13   6 C     22   1 H                                 1.0745937
    13   6 C     23   1 H                                 1.0737979

 * 6 distinct bonds (by element types)

   Z      Z             #   av. dist./Å        max./Å        min./Å
   1 H    6 C           9     1.0838823     1.1015135     1.0700719
   6 C    6 C           4     1.3737967     1.4379659     1.3295541
   1 H    7 N           1     1.0143369     1.0143369     1.0143369
   6 C    7 N           5     1.4155229     1.4525033     1.3786929
   6 C    8 O           1     1.2011012     1.2011012     1.2011012
   6 C   16 S           2     1.7182837     1.7207668     1.7158005


optimized geometry written to: xtbopt.xyz


           -------------------------------------------------
          | TOTAL ENERGY              -37.481453956433 Eh   |
          | GRADIENT NORM               0.000869899606 Eh/α |
          | HOMO-LUMO GAP               1.925326803736 eV   |
           -------------------------------------------------

------------------------------------------------------------------------
 * finished run on 2021/05/19 at 10:59:19.771     
------------------------------------------------------------------------
 total:
 * wall-time:     0 d,  0 h,  0 min,  0.983 sec
 *  cpu-time:     0 d,  0 h,  0 min,  0.980 sec
 * ratio c/w:     0.997 speedup
 SCF:
 * wall-time:     0 d,  0 h,  0 min,  0.037 sec
 *  cpu-time:     0 d,  0 h,  0 min,  0.037 sec
 * ratio c/w:     0.998 speedup
 ANC optimizer:
 * wall-time:     0 d,  0 h,  0 min,  0.926 sec
 *  cpu-time:     0 d,  0 h,  0 min,  0.923 sec
 * ratio c/w:     0.998 speedup

