      -----------------------------------------------------------      
     |                   =====================                   |     
     |                           x T B                           |     
     |                   =====================                   |     
     |                         S. Grimme                         |     
     |          Mulliken Center for Theoretical Chemistry        |     
     |                    University of Bonn                     |     
     |                Version 6.2 RC2 (SAW190805)                |     
      -----------------------------------------------------------      

   This program is distributed in the hope that it will be useful,
   but WITHOUT ANY WARRANTY; without even the implied warranty of
   MERCHANTABILITY or FITNESS FOR A PARTICULAR PURPOSE.
   
   FOR NON-COMMERCIAL, ACADEMIA USE ONLY.
   
   Cite this work as:
   * S. Grimme, C. Bannwarth, P. Shushkov, J. Chem. Theory Comput., 2017,
     13, 1989-2009. DOI: 10.1021/acs.jctc.7b00118
   * C. Bannwarth, S. Ehlert and S. Grimme., J. Chem. Theory Comput., 2019,
     15, 1652-1671. DOI: 10.1021/acs.jctc.8b01176
   * P. Pracht, E. Caldeweyher, S. Ehlert, S. Grimme, ChemRxiv, 2019, preprint.
     DOI: 10.26434/chemrxiv.8326202.v1
   
   for DFT-D4:
   * E. Caldeweyher, C. Bannwarth and S. Grimme, J. Chem. Phys., 2017,
     147, 034112. DOI: 10.1063/1.4993215
   * E. Caldeweyher, S. Ehlert, A. Hansen, H. Neugebauer, S. Spicher,
     C. Bannwarth and S. Grimme, J. Chem. Phys., 2019, 150, 154122.
     DOI: 10.1063/1.5090222
   
   for sTDA-xTB:
   * S. Grimme and C. Bannwarth, J. Chem. Phys., 2016, 145, 054103.
     DOI: 10.1063/1.4959605
   
   in the mass-spec context:
   * V. Asgeirsson, C. Bauer and S. Grimme, Chem. Sci., 2017, 8, 4879.
     DOI: 10.1039/c7sc00601b
   
   for metadynamics refer to:
   * S. Grimme, J. Chem. Theory Comput., 2019, 155, 2847-2862
     DOI: 10.1021/acs.jctc.9b00143
   
   with help from (in alphabetical order)
   C. Bannwarth, F. Bohle, G. Brandenburg, E. Caldeweyher, M. Checinski,
   S. Dohm, S. Ehlert, S. Ehrlich, F. März, H. Neugebauer, J. Pisarek,
   P. Pracht, P. Shushkov, and S. Spicher.
   
 * started run on 2021/05/19 at 10:59:19.788     

           -------------------------------------------------
          |                Calculation Setup                |
           -------------------------------------------------

          program call               : /ihome/ghutchison/geoffh/xtb/xtb 517.xyz -opt
          hostname                   : smp-n144
          coordinate file            : 517.xyz
          omp threads                :                     1
          number of atoms            :                    16
          number of electrons        :                    42
          charge                     :                     0
          spin                       :                   0.0
          first test random number   :      0.74041522850063


########################################################################
# WARNING! Please study the warnings concerning your input carefully
#  - the use of '-opt' is discouraged, please use '--opt' next time
########################################################################

           ------------------------------------------------- 
          |                 G F N 2 - x T B                 |
          | Geometry, Frequencies, Noncovalent interactions |
          |            JCTC 2019 parametrisation            |
           ------------------------------------------------- 
             KAB for C  - Si     :                1.0500
             KAB for H  - Pd     :                0.9500
             k(s)              :                1.8500
             k(p)              :                2.2300
             k(d)              :                2.2300
             k(f)              :                2.0000
             kEN (H0ij)        :               -2.0000
             D4 a1             :                0.5200
             D4 a2             :                5.0000
             D4 s6             :                1.0000
             D4 s8             :                2.7000
             D4 s9             :                5.0000
             alphaj            :                2.0000

  Z AO/shell   Hii/eV     exponent
  1     Wed Apr 25 08:07:45 CEST 2018   EN: 2.200 GM2: 0.406  GM3: 0.0800  RAES: 1.40
     1s    -10.707211    1.230000
  6     Wed Apr 25 08:07:45 CEST 2018   EN: 2.550 GM2: 0.538  GM3: 0.1500  RAES: 3.00
     2s    -13.970922    2.096432
     2p    -10.063292    1.800000
 16     Tue Apr 24 11:44:34 CEST 2018   EN: 2.580 GM2: 0.340  GM3:-0.0502  RAES: 3.10
     3s    -20.029654    1.981333
     3p    -11.377694    2.025643
     3d     -0.420282    1.702555

           ------------------------------------------------- 
          |        Self-Consistent Charge Iterations        |
           ------------------------------------------------- 

          ...................................................
          :                      SETUP                      :
          :.................................................:
          :  # basis functions                  46          :
          :  # atomic orbitals                  45          :
          :  # shells                           25          :
          :  # electrons                        42          :
          :  max. iterations                   250          :
          :  Hamiltonian                  GFN2-xTB          :
          :  restarted?                      false          :
          :  GBSA solvation                  false          :
          :  PC potential                    false          :
          :  electronic temp.          300.0000000     K    :
          :  accuracy                    1.0000000          :
          :  -> integral cutoff          0.2500000E+02      :
          :  -> integral neglect         0.1000000E-07      :
          :  -> SCF convergence          0.1000000E-05 Eh   :
          :  -> wf. convergence          0.1000000E-03 e    :
          :  Broyden damping             0.4000000          :
          ...................................................

 iter      E             dE          RMSdq      gap      omega  full diag
   1    -22.5636377 -0.225636E+02  0.421E+00    3.03       0.0  T
   2    -22.5925492 -0.289115E-01  0.250E+00    2.70       1.0  T
   3    -22.5855136  0.703555E-02  0.112E+00    2.69       1.0  T
   4    -22.5937267 -0.821309E-02  0.617E-01    2.68       1.0  T
   5    -22.5965917 -0.286497E-02  0.190E-01    2.67       1.0  T
   6    -22.5966229 -0.311576E-04  0.862E-02    2.67       1.0  T
   7    -22.5966756 -0.527527E-04  0.378E-02    2.67       1.0  T
   8    -22.5966890 -0.133699E-04  0.153E-02    2.67       1.6  T
   9    -22.5966893 -0.318473E-06  0.369E-03    2.67       6.8  T
  10    -22.5966893 -0.317973E-07  0.158E-03    2.67      15.8  T
  11    -22.5966893 -0.476818E-08  0.473E-04    2.67      52.9  T
  12    -22.5966893 -0.141796E-09  0.194E-04    2.67     129.1  T

   *** convergence criteria satisfied after 12 iterations ***

         #    Occupation            Energy/Eh            Energy/eV
      -------------------------------------------------------------
         1        2.0000           -0.7154077             -19.4672
       ...           ...                  ...                  ...
        15        2.0000           -0.4548628             -12.3774
        16        2.0000           -0.4521184             -12.3028
        17        2.0000           -0.4468709             -12.1600
        18        2.0000           -0.4393876             -11.9563
        19        2.0000           -0.4323044             -11.7636
        20        2.0000           -0.3968269             -10.7982
        21        2.0000           -0.3502199              -9.5300 (HOMO)
        22                         -0.2520498              -6.8586 (LUMO)
        23                         -0.2058196              -5.6006
        24                         -0.1622396              -4.4148
        25                         -0.1077004              -2.9307
        26                         -0.0221284              -0.6021
       ...                                ...                  ...
        45                          0.7094185              19.3043
      -------------------------------------------------------------
                  HL-Gap            0.0981701 Eh            2.6713 eV
             Fermi-level           -0.3011349 Eh           -8.1943 eV

 SCC (total)                   0 d,  0 h,  0 min,  0.020 sec
 SCC setup                      ...        0 min,  0.000 sec (  1.140%)
 Dispersion                     ...        0 min,  0.000 sec (  0.949%)
 integral evaluation            ...        0 min,  0.004 sec ( 21.017%)
 zeroth order Hamiltonian       ...        0 min,  0.000 sec (  0.490%)
 iterations                     ...        0 min,  0.008 sec ( 40.710%)
 molecular gradient             ...        0 min,  0.007 sec ( 33.798%)
 printout                       ...        0 min,  0.000 sec (  1.621%)

         :::::::::::::::::::::::::::::::::::::::::::::::::::::
         ::                     SUMMARY                     ::
         :::::::::::::::::::::::::::::::::::::::::::::::::::::
         :: total energy             -22.264937214126 Eh    ::
         :: gradient norm              0.039992405040 Eh/a0 ::
         :: HOMO-LUMO gap              2.671345106821 eV    ::
         ::.................................................::
         :: SCC energy               -22.596689338022 Eh    ::
         :: -> isotropic ES            0.003164786954 Eh    ::
         :: -> anisotropic ES          0.002895299229 Eh    ::
         :: -> anisotropic XC          0.014549301116 Eh    ::
         :: -> dispersion             -0.014063451811 Eh    ::
         :: repulsion energy           0.331716402578 Eh    ::
         :: add. restraining           0.000000000000 Eh    ::
         :::::::::::::::::::::::::::::::::::::::::::::::::::::

      ----------------------------------------------------------- 
     |                   =====================                   |
     |                        A N C O P T                        |
     |                   =====================                   |
     |               Approximate Normal Coordinate               |
     |                Rational Function Optimizer                |
      ----------------------------------------------------------- 

          ...................................................
          :                      SETUP                      :
          :.................................................:
          :   optimization level            normal          :
          :   max. optcycles                   200          :
          :   ANC micro-cycles                  20          :
          :   degrees of freedom                42          :
          :.................................................:
          :   RF solver                   davidson          :
          :   input Hessian                  false          :
          :   write xtbopt.log                true          :
          :   linear?                        false          :
          :   energy convergence         0.5000000E-05 Eh   :
          :   grad. convergence          0.1000000E-02 Eh/α :
          :   maximium RF displ.         2.0000000          :
          :   Hlow (freq-cutoff)         0.5000000E-02      :
          :   Hmax (freq-cutoff)         5.0000000          :
          :   S6 in model hess.         20.0000000          :
          ...................................................

generating ANC from model Hessian ...
Using Lindh-Hessian (1995)
 Shifting diagonal of input Hessian by   0.000000000000000E+000
 Lowest  eigenvalues of input Hessian
   -0.000000   -0.000000   -0.000000   -0.000000    0.000000    0.000000
    0.006253    0.007751    0.014834    0.018853    0.033907    0.039555
    0.041764    0.048330    0.051066    0.055940    0.065773    0.068634
 Highest eigenvalues
    1.186299    1.358092    1.549200    1.627987    1.859805    1.958407
 

........................................................................
.............................. CYCLE    1 ..............................
........................................................................
   1    -22.5966893 -0.225967E+02  0.450E-05    2.67       0.0  T
   2    -22.5966893 -0.354206E-11  0.252E-05    2.67     993.8  T
   3    -22.5966893 -0.532907E-13  0.174E-05    2.67    1433.1  T
     SCC iter.                  ...        0 min,  0.002 sec
     gradient                   ...        0 min,  0.007 sec
 * total energy  :   -22.2649372 Eh     change       -0.5124495E-08 Eh
   gradient norm :     0.0399933 Eh/α   predicted     0.0000000E+00 (-100.00%)
   displ. norm   :     0.3417392 α      lambda       -0.6266165E-02
   maximum displ.:     0.2129528 α      in ANC's #1, #5, #4, ...

........................................................................
.............................. CYCLE    2 ..............................
........................................................................
   1    -22.5985196 -0.225985E+02  0.529E-01    2.73       0.0  T
   2    -22.5985761 -0.564581E-04  0.274E-01    2.72       1.0  T
   3    -22.5982725  0.303574E-03  0.175E-01    2.72       1.0  T
   4    -22.5986649 -0.392426E-03  0.397E-02    2.72       1.0  T
   5    -22.5986653 -0.402966E-06  0.169E-02    2.72       1.5  T
   6    -22.5986682 -0.290280E-05  0.384E-03    2.72       6.5  T
   7    -22.5986684 -0.148419E-06  0.144E-03    2.72      17.4  T
     SCC iter.                  ...        0 min,  0.004 sec
     gradient                   ...        0 min,  0.006 sec
 * total energy  :   -22.2690902 Eh     change       -0.4153015E-02 Eh
   gradient norm :     0.0179973 Eh/α   predicted    -0.3498994E-02 ( -15.75%)
   displ. norm   :     0.2728614 α      lambda       -0.2088967E-02
   maximum displ.:     0.1845332 α      in ANC's #1, #5, #3, ...

........................................................................
.............................. CYCLE    3 ..............................
........................................................................
   1    -22.6003595 -0.226004E+02  0.398E-01    2.77       0.0  T
   2    -22.6003914 -0.318776E-04  0.201E-01    2.76       1.0  T
   3    -22.6002275  0.163975E-03  0.129E-01    2.76       1.0  T
   4    -22.6004420 -0.214581E-03  0.281E-02    2.76       1.0  T
   5    -22.6004418  0.208421E-06  0.119E-02    2.76       2.1  T
   6    -22.6004435 -0.171078E-05  0.202E-03    2.76      12.4  T
   7    -22.6004436 -0.273075E-07  0.922E-04    2.76      27.1  T
     SCC iter.                  ...        0 min,  0.004 sec
     gradient                   ...        0 min,  0.006 sec
 * total energy  :   -22.2704124 Eh     change       -0.1322137E-02 Eh
   gradient norm :     0.0076742 Eh/α   predicted    -0.1122257E-02 ( -15.12%)
   displ. norm   :     0.2532360 α      lambda       -0.7162072E-03
   maximum displ.:     0.2160196 α      in ANC's #1, #3, #5, ...

........................................................................
.............................. CYCLE    4 ..............................
........................................................................
   1    -22.6010201 -0.226010E+02  0.279E-01    2.79       0.0  T
   2    -22.6010365 -0.163589E-04  0.134E-01    2.79       1.0  T
   3    -22.6010381 -0.165608E-05  0.275E-02    2.79       1.0  T
   4    -22.6010368  0.133550E-05  0.196E-02    2.79       1.3  T
   5    -22.6010397 -0.290912E-05  0.435E-03    2.79       5.8  T
   6    -22.6010399 -0.224641E-06  0.106E-03    2.79      23.6  T
   7    -22.6010399 -0.433428E-08  0.624E-04    2.79      40.0  T
     SCC iter.                  ...        0 min,  0.004 sec
     gradient                   ...        0 min,  0.006 sec
 * total energy  :   -22.2709568 Eh     change       -0.5444425E-03 Eh
   gradient norm :     0.0068962 Eh/α   predicted    -0.3810730E-03 ( -30.01%)
   displ. norm   :     0.2822592 α      lambda       -0.5896995E-03
   maximum displ.:     0.2423077 α      in ANC's #1, #3, #4, ...

........................................................................
.............................. CYCLE    5 ..............................
........................................................................
   1    -22.6019906 -0.226020E+02  0.336E-01    2.81       0.0  T
   2    -22.6020149 -0.243581E-04  0.161E-01    2.82       1.0  T
   3    -22.6019892  0.257826E-04  0.606E-02    2.82       1.0  T
   4    -22.6020239 -0.347263E-04  0.224E-02    2.82       1.1  T
   5    -22.6020245 -0.572753E-06  0.705E-03    2.82       3.5  T
   6    -22.6020248 -0.295217E-06  0.277E-03    2.82       9.0  T
   7    -22.6020248 -0.879126E-07  0.964E-04    2.82      25.9  T
     SCC iter.                  ...        0 min,  0.004 sec
     gradient                   ...        0 min,  0.006 sec
 * total energy  :   -22.2714491 Eh     change       -0.4922489E-03 Eh
   gradient norm :     0.0072713 Eh/α   predicted    -0.3183458E-03 ( -35.33%)
   displ. norm   :     0.3318647 α      lambda       -0.6327765E-03
   maximum displ.:     0.2912836 α      in ANC's #1, #3, #4, ...

........................................................................
.............................. CYCLE    6 ..............................
........................................................................
   1    -22.6022977 -0.226023E+02  0.419E-01    2.84       0.0  T
   2    -22.6023358 -0.381675E-04  0.201E-01    2.84       1.0  T
   3    -22.6022675  0.683452E-04  0.894E-02    2.85       1.0  T
   4    -22.6023570 -0.894744E-04  0.261E-02    2.85       1.0  T
   5    -22.6023570 -0.310352E-07  0.939E-03    2.85       2.7  T
   6    -22.6023576 -0.627294E-06  0.381E-03    2.85       6.6  T
   7    -22.6023578 -0.165170E-06  0.115E-03    2.85      21.7  T
   8    -22.6023578 -0.161554E-08  0.444E-04    2.85      56.3  T
     SCC iter.                  ...        0 min,  0.005 sec
     gradient                   ...        0 min,  0.006 sec
 * total energy  :   -22.2719891 Eh     change       -0.5400528E-03 Eh
   gradient norm :     0.0092905 Eh/α   predicted    -0.3512241E-03 ( -34.96%)
   displ. norm   :     0.3830162 α      lambda       -0.7460550E-03
   maximum displ.:     0.3332457 α      in ANC's #1, #3, #2, ...

........................................................................
.............................. CYCLE    7 ..............................
........................................................................
   1    -22.6030143 -0.226030E+02  0.477E-01    2.86       0.0  T
   2    -22.6030648 -0.505313E-04  0.230E-01    2.87       1.0  T
   3    -22.6029843  0.804956E-04  0.978E-02    2.87       1.0  T
   4    -22.6030910 -0.106696E-03  0.292E-02    2.87       1.0  T
   5    -22.6030911 -0.885715E-07  0.107E-02    2.87       2.3  T
   6    -22.6030919 -0.802722E-06  0.429E-03    2.87       5.8  T
   7    -22.6030921 -0.205302E-06  0.133E-03    2.87      18.8  T
   8    -22.6030921 -0.197009E-08  0.484E-04    2.87      51.7  T
     SCC iter.                  ...        0 min,  0.005 sec
     gradient                   ...        0 min,  0.006 sec
 * total energy  :   -22.2726138 Eh     change       -0.6247238E-03 Eh
   gradient norm :     0.0143523 Eh/α   predicted    -0.4277478E-03 ( -31.53%)
   displ. norm   :     0.5429456 α      lambda       -0.1130760E-02
   maximum displ.:     0.4722032 α      in ANC's #1, #3, #2, ...

........................................................................
.............................. CYCLE    8 ..............................
........................................................................
   1    -22.6024004 -0.226024E+02  0.659E-01    2.88       0.0  T
   2    -22.6024974 -0.969690E-04  0.319E-01    2.89       1.0  T
   3    -22.6023973  0.100119E-03  0.116E-01    2.89       1.0  T
   4    -22.6025367 -0.139406E-03  0.406E-02    2.89       1.0  T
   5    -22.6025378 -0.110735E-05  0.130E-02    2.89       1.9  T
   6    -22.6025391 -0.128996E-05  0.521E-03    2.89       4.8  T
   7    -22.6025393 -0.285018E-06  0.182E-03    2.89      13.8  T
   8    -22.6025393 -0.401882E-08  0.582E-04    2.89      43.0  T
     SCC iter.                  ...        0 min,  0.005 sec
     gradient                   ...        0 min,  0.006 sec
 * total energy  :   -22.2734306 Eh     change       -0.8167892E-03 Eh
   gradient norm :     0.0221534 Eh/α   predicted    -0.7320488E-03 ( -10.37%)
   displ. norm   :     0.3542991 α      lambda       -0.1347533E-02
   maximum displ.:     0.2690447 α      in ANC's #1, #2, #5, ...

........................................................................
.............................. CYCLE    9 ..............................
........................................................................
   1    -22.6082024 -0.226082E+02  0.430E-01    2.90       0.0  T
   2    -22.6082426 -0.401940E-04  0.209E-01    2.91       1.0  T
   3    -22.6082299  0.126948E-04  0.542E-02    2.91       1.0  T
   4    -22.6082531 -0.231815E-04  0.264E-02    2.90       1.0  T
   5    -22.6082549 -0.178941E-05  0.650E-03    2.90       3.8  T
   6    -22.6082552 -0.260219E-06  0.295E-03    2.90       8.5  T
   7    -22.6082552 -0.818373E-07  0.116E-03    2.90      21.6  T
     SCC iter.                  ...        0 min,  0.004 sec
     gradient                   ...        0 min,  0.006 sec
 * total energy  :   -22.2744359 Eh     change       -0.1005318E-02 Eh
   gradient norm :     0.0194147 Eh/α   predicted    -0.7583404E-03 ( -24.57%)
   displ. norm   :     0.5254894 α      lambda       -0.1654700E-02
   maximum displ.:     0.3962663 α      in ANC's #1, #2, #3, ...

........................................................................
.............................. CYCLE   10 ..............................
........................................................................
   1    -22.6061014 -0.226061E+02  0.597E-01    2.89       0.0  T
   2    -22.6061815 -0.801297E-04  0.296E-01    2.90       1.0  T
   3    -22.6061948 -0.132554E-04  0.530E-02    2.89       1.0  T
   4    -22.6061983 -0.350445E-05  0.305E-02    2.89       1.0  T
   5    -22.6061988 -0.478907E-06  0.137E-02    2.89       1.8  T
   6    -22.6062011 -0.228166E-05  0.241E-03    2.89      10.4  T
   7    -22.6062011  0.450966E-08  0.142E-03    2.89      17.6  T
     SCC iter.                  ...        0 min,  0.004 sec
     gradient                   ...        0 min,  0.006 sec
 * total energy  :   -22.2755110 Eh     change       -0.1075089E-02 Eh
   gradient norm :     0.0206441 Eh/α   predicted    -0.1055803E-02 (  -1.79%)
   displ. norm   :     0.2656751 α      lambda       -0.1901878E-02
   maximum displ.:     0.1462264 α      in ANC's #2, #27, #1, ...

........................................................................
.............................. CYCLE   11 ..............................
........................................................................
   1    -22.6116973 -0.226117E+02  0.334E-01    2.85       0.0  T
   2    -22.6117210 -0.236970E-04  0.180E-01    2.85       1.0  T
   3    -22.6115815  0.139478E-03  0.125E-01    2.84       1.0  T
   4    -22.6117682 -0.186707E-03  0.229E-02    2.84       1.1  T
   5    -22.6117666  0.163856E-05  0.143E-02    2.84       1.7  T
   6    -22.6117689 -0.232158E-05  0.210E-03    2.84      11.9  T
   7    -22.6117689 -0.152909E-07  0.102E-03    2.84      24.5  T
     SCC iter.                  ...        0 min,  0.004 sec
     gradient                   ...        0 min,  0.006 sec
 * total energy  :   -22.2760678 Eh     change       -0.5567562E-03 Eh
   gradient norm :     0.0159179 Eh/α   predicted    -0.1018058E-02 (  82.86%)
   displ. norm   :     0.4998335 α      lambda       -0.1462704E-02
   maximum displ.:     0.3926970 α      in ANC's #1, #2, #3, ...

........................................................................
.............................. CYCLE   12 ..............................
........................................................................
   1    -22.5992573 -0.225993E+02  0.585E-01    2.88       0.0  T
   2    -22.5993433 -0.859607E-04  0.283E-01    2.88       1.0  T
   3    -22.5993583 -0.149533E-04  0.496E-02    2.88       1.0  T
   4    -22.5993533  0.498799E-05  0.338E-02    2.88       1.0  T
   5    -22.5993615 -0.817680E-05  0.960E-03    2.88       2.6  T
   6    -22.5993624 -0.912699E-06  0.233E-03    2.88      10.7  T
   7    -22.5993624 -0.502830E-09  0.881E-04    2.88      28.4  T
     SCC iter.                  ...        0 min,  0.004 sec
     gradient                   ...        0 min,  0.006 sec
 * total energy  :   -22.2761267 Eh     change       -0.5887859E-04 Eh
   gradient norm :     0.0179129 Eh/α   predicted    -0.9140653E-03 (1452.46%)
   displ. norm   :     0.2339959 α      lambda       -0.1194493E-02
   maximum displ.:     0.1346729 α      in ANC's #1, #2, #3, ...

........................................................................
.............................. CYCLE   13 ..............................
........................................................................
   1    -22.6084104 -0.226084E+02  0.261E-01    2.88       0.0  T
   2    -22.6084298 -0.193892E-04  0.129E-01    2.88       1.0  T
   3    -22.6084232  0.661947E-05  0.371E-02    2.88       1.0  T
   4    -22.6084341 -0.109641E-04  0.183E-02    2.88       1.4  T
   5    -22.6084351 -0.976335E-06  0.592E-03    2.88       4.2  T
   6    -22.6084353 -0.184342E-06  0.203E-03    2.88      12.3  T
   7    -22.6084353 -0.387876E-07  0.886E-04    2.88      28.2  T
     SCC iter.                  ...        0 min,  0.004 sec
     gradient                   ...        0 min,  0.006 sec
 * total energy  :   -22.2765868 Eh     change       -0.4601525E-03 Eh
   gradient norm :     0.0075584 Eh/α   predicted    -0.6299513E-03 (  36.90%)
   displ. norm   :     0.0764377 α      lambda       -0.2433801E-03
   maximum displ.:     0.0461609 α      in ANC's #2, #3, #1, ...

........................................................................
.............................. CYCLE   14 ..............................
........................................................................
   1    -22.6098731 -0.226099E+02  0.637E-02    2.88       0.0  T
   2    -22.6098744 -0.123482E-05  0.346E-02    2.88       1.0  T
   3    -22.6098742  0.114208E-06  0.798E-03    2.88       3.1  T
   4    -22.6098745 -0.249117E-06  0.491E-03    2.88       5.1  T
   5    -22.6098746 -0.114400E-06  0.182E-03    2.88      13.7  T
   6    -22.6098746 -0.234106E-07  0.431E-04    2.88      58.0  T
     SCC iter.                  ...        0 min,  0.004 sec
     gradient                   ...        0 min,  0.006 sec
 * total energy  :   -22.2766500 Eh     change       -0.6320789E-04 Eh
   gradient norm :     0.0050082 Eh/α   predicted    -0.1224023E-03 (  93.65%)
   displ. norm   :     0.1001060 α      lambda       -0.1066211E-03
   maximum displ.:     0.0807485 α      in ANC's #1, #3, #25, ...

........................................................................
.............................. CYCLE   15 ..............................
........................................................................
   1    -22.6089506 -0.226090E+02  0.124E-01    2.88       0.0  T
   2    -22.6089541 -0.358599E-05  0.600E-02    2.88       1.0  T
   3    -22.6089548 -0.634033E-06  0.102E-02    2.88       2.4  T
   4    -22.6089545  0.270169E-06  0.761E-03    2.88       3.3  T
   5    -22.6089550 -0.489851E-06  0.133E-03    2.88      18.8  T
   6    -22.6089550 -0.126399E-07  0.511E-04    2.88      48.9  T
     SCC iter.                  ...        0 min,  0.004 sec
     gradient                   ...        0 min,  0.006 sec
 * total energy  :   -22.2767166 Eh     change       -0.6659645E-04 Eh
   gradient norm :     0.0034104 Eh/α   predicted    -0.5384447E-04 ( -19.15%)
   displ. norm   :     0.0690466 α      lambda       -0.3832621E-04
   maximum displ.:     0.0541718 α      in ANC's #1, #2, #25, ...

........................................................................
.............................. CYCLE   16 ..............................
........................................................................
   1    -22.6091693 -0.226092E+02  0.672E-02    2.89       0.0  T
   2    -22.6091703 -0.998056E-06  0.335E-02    2.89       1.0  T
   3    -22.6091701  0.168651E-06  0.834E-03    2.89       3.0  T
   4    -22.6091704 -0.302883E-06  0.492E-03    2.89       5.1  T
   5    -22.6091705 -0.130223E-06  0.100E-03    2.89      24.9  T
   6    -22.6091705 -0.712553E-08  0.444E-04    2.89      56.3  T
   7    -22.6091705 -0.162247E-08  0.205E-04    2.89     121.7  T
     SCC iter.                  ...        0 min,  0.004 sec
     gradient                   ...        0 min,  0.007 sec
 * total energy  :   -22.2767377 Eh     change       -0.2108069E-04 Eh
   gradient norm :     0.0020997 Eh/α   predicted    -0.1925629E-04 (  -8.65%)
   displ. norm   :     0.0380397 α      lambda       -0.1567601E-04
   maximum displ.:     0.0236067 α      in ANC's #1, #3, #25, ...

........................................................................
.............................. CYCLE   17 ..............................
........................................................................
   1    -22.6098133 -0.226098E+02  0.423E-02    2.89       0.0  T
   2    -22.6098138 -0.483554E-06  0.206E-02    2.89       1.2  T
   3    -22.6098136  0.188824E-06  0.632E-03    2.89       4.0  T
   4    -22.6098139 -0.292957E-06  0.301E-03    2.89       8.3  T
   5    -22.6098139 -0.311928E-07  0.848E-04    2.89      29.5  T
   6    -22.6098139 -0.219602E-08  0.282E-04    2.89      88.7  T
     SCC iter.                  ...        0 min,  0.004 sec
     gradient                   ...        0 min,  0.007 sec
 * total energy  :   -22.2767466 Eh     change       -0.8871925E-05 Eh
   gradient norm :     0.0014022 Eh/α   predicted    -0.7849632E-05 ( -11.52%)
   displ. norm   :     0.0118045 α      lambda       -0.4529890E-05
   maximum displ.:     0.0047067 α      in ANC's #6, #1, #11, ...

........................................................................
.............................. CYCLE   18 ..............................
........................................................................
   1    -22.6103262 -0.226103E+02  0.142E-02    2.89       0.0  T
   2    -22.6103262 -0.622958E-07  0.774E-03    2.89       3.2  T
   3    -22.6103260  0.189695E-06  0.473E-03    2.89       5.3  T
   4    -22.6103263 -0.247938E-06  0.129E-03    2.89      19.5  T
   5    -22.6103263 -0.321365E-08  0.536E-04    2.89      46.7  T
   6    -22.6103263 -0.156645E-08  0.207E-04    2.89     120.5  T
     SCC iter.                  ...        0 min,  0.004 sec
     gradient                   ...        0 min,  0.007 sec
 * total energy  :   -22.2767491 Eh     change       -0.2550217E-05 Eh
   gradient norm :     0.0007172 Eh/α   predicted    -0.2267330E-05 ( -11.09%)
   displ. norm   :     0.0098241 α      lambda       -0.1824945E-05
   maximum displ.:     0.0082538 α      in ANC's #2, #1, #6, ...

   *** GEOMETRY OPTIMIZATION CONVERGED AFTER 18 ITERATIONS ***

------------------------------------------------------------------------
 total energy gain   :        -0.0118119 Eh       -7.4121 kcal/mol
 total RMSD          :         0.8874450 a0        0.4696 Å
 total power (kW/mol):        -1.7228988 (step) -112.6352 (real)
------------------------------------------------------------------------

 ANCopt (total)                0 d,  0 h,  0 min,  0.275 sec
 optimizer setup                ...        0 min,  0.000 sec (  0.051%)
 model hessian                  ...        0 min,  0.004 sec (  1.350%)
 ANC generation                 ...        0 min,  0.000 sec (  0.144%)
 coordinate transformation      ...        0 min,  0.000 sec (  0.084%)
 single point calculation       ...        0 min,  0.265 sec ( 96.323%)
 optimization log               ...        0 min,  0.001 sec (  0.475%)
 hessian update                 ...        0 min,  0.000 sec (  0.075%)
 rational function              ...        0 min,  0.003 sec (  1.103%)

================
 final structure:
================
$coord
   -2.44121894372288   -2.59896199210931   -0.10872973762449      C 
   -4.12136080900565   -0.71110445168881    0.11306274493756      C 
   -2.85645335106721    1.71727772586683    0.06975784943662      C 
   -0.37718902354132    1.28629078426208   -0.26240803835880      C 
    0.12028139546720   -1.49225604324899   -0.55618864072092      C 
    2.38298972227777   -2.00288431296250    1.15125307070479      C 
    4.24718692663151    0.10558550443445    0.51906458414932      C 
    2.38034286330842    3.02044136249994    0.10390989511445      S 
   -2.81474609907591   -4.59267984623691   -0.14565066241311      H 
   -6.12821503239376   -0.91068153658570    0.37081501072003      H 
   -3.77647449238904    3.50609278566759    0.32679908188938      H 
    0.66830557979687   -1.88323806983106   -2.51995169347497      H 
    3.23170272315997   -3.85052399617475    0.82545926437908      H 
    1.79860400203087   -1.87111177504087    3.12425987689210      H 
    5.22426515384508   -0.26234147685271   -1.25859882051099      H 
    5.63178679476972    0.44612417982955    1.99940495706395      H 
$end
           -------------------------------------------------
          |                Final Singlepoint                |
           -------------------------------------------------

          ...................................................
          :                      SETUP                      :
          :.................................................:
          :  # basis functions                  46          :
          :  # atomic orbitals                  45          :
          :  # shells                           25          :
          :  # electrons                        42          :
          :  max. iterations                   250          :
          :  Hamiltonian                  GFN2-xTB          :
          :  restarted?                      false          :
          :  GBSA solvation                  false          :
          :  PC potential                    false          :
          :  electronic temp.          300.0000000     K    :
          :  accuracy                    1.0000000          :
          :  -> integral cutoff          0.2500000E+02      :
          :  -> integral neglect         0.1000000E-07      :
          :  -> SCF convergence          0.1000000E-05 Eh   :
          :  -> wf. convergence          0.1000000E-03 e    :
          :  Broyden damping             0.4000000          :
          ...................................................

 iter      E             dE          RMSdq      gap      omega  full diag
   1    -22.6103263 -0.226103E+02  0.102E-04    2.89       0.0  T
   2    -22.6103263 -0.476064E-11  0.464E-05    2.89     538.9  T
   3    -22.6103263  0.813927E-11  0.460E-05    2.89     543.2  T

   *** convergence criteria satisfied after 3 iterations ***

         #    Occupation            Energy/Eh            Energy/eV
      -------------------------------------------------------------
         1        2.0000           -0.7153970             -19.4669
       ...           ...                  ...                  ...
        15        2.0000           -0.4560714             -12.4103
        16        2.0000           -0.4532606             -12.3338
        17        2.0000           -0.4411712             -12.0049
        18        2.0000           -0.4368579             -11.8875
        19        2.0000           -0.4317723             -11.7491
        20        2.0000           -0.4017101             -10.9311
        21        2.0000           -0.3505787              -9.5397 (HOMO)
        22                         -0.2441973              -6.6449 (LUMO)
        23                         -0.2089469              -5.6857
        24                         -0.1559703              -4.2442
        25                         -0.1228116              -3.3419
        26                         -0.0213763              -0.5817
       ...                                ...                  ...
        45                          0.7167186              19.5029
      -------------------------------------------------------------
                  HL-Gap            0.1063813 Eh            2.8948 eV
             Fermi-level           -0.2973880 Eh           -8.0923 eV

 SCC (total)                   0 d,  0 h,  0 min,  0.013 sec
 SCC setup                      ...        0 min,  0.000 sec (  1.034%)
 Dispersion                     ...        0 min,  0.000 sec (  0.694%)
 integral evaluation            ...        0 min,  0.004 sec ( 28.294%)
 zeroth order Hamiltonian       ...        0 min,  0.000 sec (  0.574%)
 iterations                     ...        0 min,  0.002 sec ( 17.337%)
 molecular gradient             ...        0 min,  0.007 sec ( 49.718%)
 printout                       ...        0 min,  0.000 sec (  1.985%)

         :::::::::::::::::::::::::::::::::::::::::::::::::::::
         ::                     SUMMARY                     ::
         :::::::::::::::::::::::::::::::::::::::::::::::::::::
         :: total energy             -22.276749131715 Eh    ::
         :: gradient norm              0.000717909618 Eh/a0 ::
         :: HOMO-LUMO gap              2.894783647897 eV    ::
         ::.................................................::
         :: SCC energy               -22.610326276789 Eh    ::
         :: -> isotropic ES            0.003344821458 Eh    ::
         :: -> anisotropic ES          0.002923815399 Eh    ::
         :: -> anisotropic XC          0.014141842690 Eh    ::
         :: -> dispersion             -0.013975932344 Eh    ::
         :: repulsion energy           0.333547285939 Eh    ::
         :: add. restraining           0.000000000000 Eh    ::
         :::::::::::::::::::::::::::::::::::::::::::::::::::::

           -------------------------------------------------
          |                Property Printout                |
           -------------------------------------------------

    * Orbital Energies and Occupations

         #    Occupation            Energy/Eh            Energy/eV
      -------------------------------------------------------------
         1        2.0000           -0.7153970             -19.4669
       ...           ...                  ...                  ...
         9        2.0000           -0.5370453             -14.6137
        10        2.0000           -0.5201709             -14.1546
        11        2.0000           -0.5108887             -13.9020
        12        2.0000           -0.4931591             -13.4195
        13        2.0000           -0.4747705             -12.9192
        14        2.0000           -0.4673769             -12.7180
        15        2.0000           -0.4560714             -12.4103
        16        2.0000           -0.4532606             -12.3338
        17        2.0000           -0.4411712             -12.0049
        18        2.0000           -0.4368579             -11.8875
        19        2.0000           -0.4317723             -11.7491
        20        2.0000           -0.4017101             -10.9311
        21        2.0000           -0.3505787              -9.5397 (HOMO)
        22                         -0.2441973              -6.6449 (LUMO)
        23                         -0.2089469              -5.6857
        24                         -0.1559703              -4.2442
        25                         -0.1228116              -3.3419
        26                         -0.0213763              -0.5817
        27                          0.0024191               0.0658
        28                          0.0431083               1.1730
        29                          0.0522171               1.4209
        30                          0.1044475               2.8422
        31                          0.1143971               3.1129
        32                          0.1293828               3.5207
       ...                                ...                  ...
        45                          0.7167186              19.5029
      -------------------------------------------------------------
                  HL-Gap            0.1063813 Eh            2.8948 eV
             Fermi-level           -0.2973880 Eh           -8.0923 eV

     #   Z        covCN         q      C6AA      α(0)
     1   6 C      2.981    -0.058    29.441     8.900
     2   6 C      3.022    -0.035    28.851     8.811
     3   6 C      2.990    -0.059    29.469     8.905
     4   6 C      3.078     0.037    27.099     8.535
     5   6 C      4.017    -0.017    20.799     6.479
     6   6 C      3.872    -0.047    21.369     6.573
     7   6 C      3.807    -0.008    20.721     6.480
     8  16 S      2.072    -0.151   147.408    20.435
     9   1 H      0.926     0.030     2.583     2.513
    10   1 H      0.926     0.032     2.557     2.500
    11   1 H      0.926     0.034     2.527     2.486
    12   1 H      0.923     0.059     2.205     2.322
    13   1 H      0.925     0.043     2.408     2.427
    14   1 H      0.924     0.047     2.358     2.401
    15   1 H      0.925     0.045     2.383     2.414
    16   1 H      0.925     0.048     2.341     2.393

 Mol. C6AA /au·bohr⁶  :       3557.878609
 Mol. C8AA /au·bohr⁸  :     100350.831199
 Mol. α(0) /au        :         94.573492


Wiberg/Mayer (AO) data.
largest (>0.10) Wiberg bond orders for each atom
          total WBO             WBO to atom ...
     1  C   3.982        C    2 1.793    C    5 1.018    H    9 0.972    C    4 0.107
     2  C   3.989        C    1 1.793    C    3 1.142    H   10 0.971
     3  C   3.983        C    4 1.702    C    2 1.142    H   11 0.972
     4  C   3.955        C    3 1.702    S    8 1.086    C    5 0.997    C    1 0.107
     5  C   3.994        C    1 1.018    C    4 0.997    C    6 0.977    H   12 0.922
     6  C   3.996        C    7 1.011    H   14 0.978    C    5 0.977    H   13 0.969
     7  C   3.980        C    6 1.011    H   16 0.978    H   15 0.978    S    8 0.977
     8  S   2.298        C    4 1.086    C    7 0.977
     9  H   0.999        C    1 0.972
    10  H   0.998        C    2 0.971
    11  H   0.999        C    3 0.972
    12  H   0.996        C    5 0.922
    13  H   0.998        C    6 0.969
    14  H   0.998        C    6 0.978
    15  H   0.998        C    7 0.978
    16  H   0.997        C    7 0.978

molecular dipole:
                 x           y           z       tot (Debye)
 q only:        0.296      -0.620       0.015
   full:        0.314      -0.933      -0.034       2.503
molecular quadrupole (traceless):
                xx          xy          yy          xz          yz          zz
 q only:        2.100      -2.478      -1.864       0.386      -0.014      -0.236
  q+dip:        3.710      -4.649      -3.437      -0.383       0.826      -0.274
   full:        3.379      -4.387      -3.478       0.211       0.397       0.098

           -------------------------------------------------
          |                Geometry Summary                 |
           -------------------------------------------------

      molecular mass/u    :      124.2002000
   center of mass at/Å    :        0.1857513       0.1829932       0.0732638
  moments of inertia/u·Å² :        0.1439704E+03   0.3029382E+03   0.4253535E+03
rotational constants/cm⁻¹ :        0.1170910E+00   0.5564710E-01   0.3963205E-01

 * 15 selected distances

     #   Z        #   Z                                     value/Å
     1   6 C      2   6 C                                 1.3424920
     3   6 C      4   6 C                                 1.3431969
     1   6 C      5   6 C                                 1.4954573
     4   6 C      5   6 C                                 1.5017922
     5   6 C      6   6 C                                 1.5241727
     6   6 C      7   6 C                                 1.5264300
     4   6 C      8  16 S                                 1.7346564 (max)
     1   6 C      9   1 H                                 1.0735645
     2   6 C     10   1 H                                 1.0759009
     3   6 C     11   1 H                                 1.0731173 (min)
     5   6 C     12   1 H                                 1.0985448
     6   6 C     13   1 H                                 1.0896719
     6   6 C     14   1 H                                 1.0911356
     7   6 C     15   1 H                                 1.0909447
     7   6 C     16   1 H                                 1.0876480

 * 3 distinct bonds (by element types)

   Z      Z             #   av. dist./Å        max./Å        min./Å
   1 H    6 C           8     1.0850660     1.0985448     1.0731173
   6 C    6 C           6     1.4555902     1.5264300     1.3424920
   6 C   16 S           1     1.7346564     1.7346564     1.7346564


optimized geometry written to: xtbopt.xyz


           -------------------------------------------------
          | TOTAL ENERGY              -22.276749131715 Eh   |
          | GRADIENT NORM               0.000717909618 Eh/α |
          | HOMO-LUMO GAP               2.894783647897 eV   |
           -------------------------------------------------

------------------------------------------------------------------------
 * finished run on 2021/05/19 at 10:59:20.114     
------------------------------------------------------------------------
 total:
 * wall-time:     0 d,  0 h,  0 min,  0.325 sec
 *  cpu-time:     0 d,  0 h,  0 min,  0.324 sec
 * ratio c/w:     0.995 speedup
 SCF:
 * wall-time:     0 d,  0 h,  0 min,  0.020 sec
 *  cpu-time:     0 d,  0 h,  0 min,  0.020 sec
 * ratio c/w:     0.997 speedup
 ANC optimizer:
 * wall-time:     0 d,  0 h,  0 min,  0.289 sec
 *  cpu-time:     0 d,  0 h,  0 min,  0.288 sec
 * ratio c/w:     0.998 speedup

