      -----------------------------------------------------------      
     |                   =====================                   |     
     |                           x T B                           |     
     |                   =====================                   |     
     |                         S. Grimme                         |     
     |          Mulliken Center for Theoretical Chemistry        |     
     |                    University of Bonn                     |     
     |                Version 6.2 RC2 (SAW190805)                |     
      -----------------------------------------------------------      

   This program is distributed in the hope that it will be useful,
   but WITHOUT ANY WARRANTY; without even the implied warranty of
   MERCHANTABILITY or FITNESS FOR A PARTICULAR PURPOSE.
   
   FOR NON-COMMERCIAL, ACADEMIA USE ONLY.
   
   Cite this work as:
   * S. Grimme, C. Bannwarth, P. Shushkov, J. Chem. Theory Comput., 2017,
     13, 1989-2009. DOI: 10.1021/acs.jctc.7b00118
   * C. Bannwarth, S. Ehlert and S. Grimme., J. Chem. Theory Comput., 2019,
     15, 1652-1671. DOI: 10.1021/acs.jctc.8b01176
   * P. Pracht, E. Caldeweyher, S. Ehlert, S. Grimme, ChemRxiv, 2019, preprint.
     DOI: 10.26434/chemrxiv.8326202.v1
   
   for DFT-D4:
   * E. Caldeweyher, C. Bannwarth and S. Grimme, J. Chem. Phys., 2017,
     147, 034112. DOI: 10.1063/1.4993215
   * E. Caldeweyher, S. Ehlert, A. Hansen, H. Neugebauer, S. Spicher,
     C. Bannwarth and S. Grimme, J. Chem. Phys., 2019, 150, 154122.
     DOI: 10.1063/1.5090222
   
   for sTDA-xTB:
   * S. Grimme and C. Bannwarth, J. Chem. Phys., 2016, 145, 054103.
     DOI: 10.1063/1.4959605
   
   in the mass-spec context:
   * V. Asgeirsson, C. Bauer and S. Grimme, Chem. Sci., 2017, 8, 4879.
     DOI: 10.1039/c7sc00601b
   
   for metadynamics refer to:
   * S. Grimme, J. Chem. Theory Comput., 2019, 155, 2847-2862
     DOI: 10.1021/acs.jctc.9b00143
   
   with help from (in alphabetical order)
   C. Bannwarth, F. Bohle, G. Brandenburg, E. Caldeweyher, M. Checinski,
   S. Dohm, S. Ehlert, S. Ehrlich, F. März, H. Neugebauer, J. Pisarek,
   P. Pracht, P. Shushkov, and S. Spicher.
   
 * started run on 2021/05/19 at 10:59:20.132     

           -------------------------------------------------
          |                Calculation Setup                |
           -------------------------------------------------

          program call               : /ihome/ghutchison/geoffh/xtb/xtb 518.xyz -opt
          hostname                   : smp-n144
          coordinate file            : 518.xyz
          omp threads                :                     1
          number of atoms            :                    17
          number of electrons        :                    44
          charge                     :                     0
          spin                       :                   0.0
          first test random number   :      0.19543948053026


########################################################################
# WARNING! Please study the warnings concerning your input carefully
#  - the use of '-opt' is discouraged, please use '--opt' next time
########################################################################

           ------------------------------------------------- 
          |                 G F N 2 - x T B                 |
          | Geometry, Frequencies, Noncovalent interactions |
          |            JCTC 2019 parametrisation            |
           ------------------------------------------------- 
             KAB for C  - Si     :                1.0500
             KAB for H  - Pd     :                0.9500
             k(s)              :                1.8500
             k(p)              :                2.2300
             k(d)              :                2.2300
             k(f)              :                2.0000
             kEN (H0ij)        :               -2.0000
             D4 a1             :                0.5200
             D4 a2             :                5.0000
             D4 s6             :                1.0000
             D4 s8             :                2.7000
             D4 s9             :                5.0000
             alphaj            :                2.0000

  Z AO/shell   Hii/eV     exponent
  1     Wed Apr 25 08:07:45 CEST 2018   EN: 2.200 GM2: 0.406  GM3: 0.0800  RAES: 1.40
     1s    -10.707211    1.230000
  6     Wed Apr 25 08:07:45 CEST 2018   EN: 2.550 GM2: 0.538  GM3: 0.1500  RAES: 3.00
     2s    -13.970922    2.096432
     2p    -10.063292    1.800000
  7     Wed Apr 25 08:07:45 CEST 2018   EN: 3.040 GM2: 0.461  GM3:-0.0640  RAES: 1.90
     2s    -16.686243    2.339881
     2p    -12.523956    2.014332
 16     Tue Apr 24 11:44:34 CEST 2018   EN: 2.580 GM2: 0.340  GM3:-0.0502  RAES: 3.10
     3s    -20.029654    1.981333
     3p    -11.377694    2.025643
     3d     -0.420282    1.702555

           ------------------------------------------------- 
          |        Self-Consistent Charge Iterations        |
           ------------------------------------------------- 

          ...................................................
          :                      SETUP                      :
          :.................................................:
          :  # basis functions                  47          :
          :  # atomic orbitals                  46          :
          :  # shells                           26          :
          :  # electrons                        44          :
          :  max. iterations                   250          :
          :  Hamiltonian                  GFN2-xTB          :
          :  restarted?                      false          :
          :  GBSA solvation                  false          :
          :  PC potential                    false          :
          :  electronic temp.          300.0000000     K    :
          :  accuracy                    1.0000000          :
          :  -> integral cutoff          0.2500000E+02      :
          :  -> integral neglect         0.1000000E-07      :
          :  -> SCF convergence          0.1000000E-05 Eh   :
          :  -> wf. convergence          0.1000000E-03 e    :
          :  Broyden damping             0.4000000          :
          ...................................................

 iter      E             dE          RMSdq      gap      omega  full diag
   1    -23.8694692 -0.238695E+02  0.372E+00    2.69       0.0  T
   2    -23.8977052 -0.282361E-01  0.228E+00    3.07       1.0  T
   3    -23.8961392  0.156599E-02  0.156E+00    3.21       1.0  T
   4    -23.9112483 -0.151091E-01  0.461E-01    3.01       1.0  T
   5    -23.9124371 -0.118875E-02  0.136E-01    3.07       1.0  T
   6    -23.9124412 -0.418316E-05  0.538E-02    3.06       1.0  T
   7    -23.9124562 -0.149088E-04  0.249E-02    3.07       1.0  T
   8    -23.9124600 -0.381766E-05  0.133E-02    3.06       1.8  T
   9    -23.9124605 -0.567866E-06  0.328E-03    3.06       7.4  T
  10    -23.9124606 -0.318974E-07  0.152E-03    3.06      16.0  T
  11    -23.9124606 -0.723481E-08  0.512E-04    3.06      47.4  T
  12    -23.9124606 -0.349324E-09  0.185E-04    3.06     131.3  T

   *** convergence criteria satisfied after 12 iterations ***

         #    Occupation            Energy/Eh            Energy/eV
      -------------------------------------------------------------
         1        2.0000           -0.7121863             -19.3796
       ...           ...                  ...                  ...
        16        2.0000           -0.4579019             -12.4601
        17        2.0000           -0.4544988             -12.3675
        18        2.0000           -0.4455216             -12.1233
        19        2.0000           -0.4397949             -11.9674
        20        2.0000           -0.4149266             -11.2907
        21        2.0000           -0.3766509             -10.2492
        22        2.0000           -0.3366266              -9.1601 (HOMO)
        23                         -0.2240287              -6.0961 (LUMO)
        24                         -0.1835160              -4.9937
        25                         -0.1394423              -3.7944
        26                         -0.0964885              -2.6256
        27                          0.0057741               0.1571
       ...                                ...                  ...
        46                          0.7104493              19.3323
      -------------------------------------------------------------
                  HL-Gap            0.1125979 Eh            3.0639 eV
             Fermi-level           -0.2803277 Eh           -7.6281 eV

 SCC (total)                   0 d,  0 h,  0 min,  0.020 sec
 SCC setup                      ...        0 min,  0.000 sec (  1.141%)
 Dispersion                     ...        0 min,  0.000 sec (  0.938%)
 integral evaluation            ...        0 min,  0.004 sec ( 21.044%)
 zeroth order Hamiltonian       ...        0 min,  0.000 sec (  0.472%)
 iterations                     ...        0 min,  0.008 sec ( 41.954%)
 molecular gradient             ...        0 min,  0.007 sec ( 32.549%)
 printout                       ...        0 min,  0.000 sec (  1.608%)

         :::::::::::::::::::::::::::::::::::::::::::::::::::::
         ::                     SUMMARY                     ::
         :::::::::::::::::::::::::::::::::::::::::::::::::::::
         :: total energy             -23.581071463168 Eh    ::
         :: gradient norm              0.044967410151 Eh/a0 ::
         :: HOMO-LUMO gap              3.063944304394 eV    ::
         ::.................................................::
         :: SCC energy               -23.912460577417 Eh    ::
         :: -> isotropic ES            0.007951627578 Eh    ::
         :: -> anisotropic ES          0.004021737819 Eh    ::
         :: -> anisotropic XC          0.013175288344 Eh    ::
         :: -> dispersion             -0.013001174490 Eh    ::
         :: repulsion energy           0.331398450843 Eh    ::
         :: add. restraining           0.000000000000 Eh    ::
         :::::::::::::::::::::::::::::::::::::::::::::::::::::

      ----------------------------------------------------------- 
     |                   =====================                   |
     |                        A N C O P T                        |
     |                   =====================                   |
     |               Approximate Normal Coordinate               |
     |                Rational Function Optimizer                |
      ----------------------------------------------------------- 

          ...................................................
          :                      SETUP                      :
          :.................................................:
          :   optimization level            normal          :
          :   max. optcycles                   200          :
          :   ANC micro-cycles                  20          :
          :   degrees of freedom                45          :
          :.................................................:
          :   RF solver                   davidson          :
          :   input Hessian                  false          :
          :   write xtbopt.log                true          :
          :   linear?                        false          :
          :   energy convergence         0.5000000E-05 Eh   :
          :   grad. convergence          0.1000000E-02 Eh/α :
          :   maximium RF displ.         2.0000000          :
          :   Hlow (freq-cutoff)         0.5000000E-02      :
          :   Hmax (freq-cutoff)         5.0000000          :
          :   S6 in model hess.         20.0000000          :
          ...................................................

generating ANC from model Hessian ...
Using Lindh-Hessian (1995)
 Shifting diagonal of input Hessian by   1.964018624680840E-003
 Lowest  eigenvalues of input Hessian
   -0.000000   -0.000000   -0.000000    0.000000    0.000000    0.000000
    0.005000    0.005170    0.007448    0.013172    0.017108    0.020233
    0.021652    0.038132    0.040282    0.047174    0.055957    0.056471
 Highest eigenvalues
    1.445454    1.465877    1.556335    1.738587    1.919402    2.121101
 

........................................................................
.............................. CYCLE    1 ..............................
........................................................................
   1    -23.9124606 -0.239125E+02  0.447E-05    3.06       0.0  T
   2    -23.9124606 -0.335731E-11  0.248E-05    3.06     977.7  T
   3    -23.9124606  0.511591E-12  0.152E-05    3.06    1591.2  T
     SCC iter.                  ...        0 min,  0.003 sec
     gradient                   ...        0 min,  0.006 sec
 * total energy  :   -23.5810715 Eh     change       -0.1680297E-07 Eh
   gradient norm :     0.0449681 Eh/α   predicted     0.0000000E+00 (-100.00%)
   displ. norm   :     0.0912035 α      lambda       -0.2099531E-02
   maximum displ.:     0.0314911 α      in ANC's #9, #24, #5, ...

........................................................................
.............................. CYCLE    2 ..............................
........................................................................
   1    -23.9244499 -0.239244E+02  0.171E-01    3.15       0.0  T
   2    -23.9244944 -0.445108E-04  0.861E-02    3.11       1.0  T
   3    -23.9244907  0.370217E-05  0.403E-02    3.13       1.0  T
   4    -23.9245030 -0.123324E-04  0.177E-02    3.12       1.4  T
   5    -23.9245056 -0.259951E-05  0.692E-03    3.12       3.5  T
   6    -23.9245057 -0.110022E-06  0.212E-03    3.12      11.5  T
   7    -23.9245058 -0.262194E-07  0.944E-04    3.12      25.7  T
     SCC iter.                  ...        0 min,  0.004 sec
     gradient                   ...        0 min,  0.006 sec
 * total energy  :   -23.5824474 Eh     change       -0.1375918E-02 Eh
   gradient norm :     0.0175872 Eh/α   predicted    -0.1058499E-02 ( -23.07%)
   displ. norm   :     0.0662718 α      lambda       -0.5026342E-03
   maximum displ.:     0.0233652 α      in ANC's #3, #2, #8, ...

........................................................................
.............................. CYCLE    3 ..............................
........................................................................
   1    -23.9285472 -0.239285E+02  0.129E-01    3.16       0.0  T
   2    -23.9285657 -0.184190E-04  0.663E-02    3.14       1.0  T
   3    -23.9285640  0.170676E-05  0.269E-02    3.15       1.0  T
   4    -23.9285693 -0.530961E-05  0.102E-02    3.14       2.4  T
   5    -23.9285701 -0.855158E-06  0.418E-03    3.15       5.8  T
   6    -23.9285702 -0.706695E-07  0.137E-03    3.15      17.8  T
   7    -23.9285702 -0.964226E-08  0.618E-04    3.15      39.2  T
     SCC iter.                  ...        0 min,  0.004 sec
     gradient                   ...        0 min,  0.006 sec
 * total energy  :   -23.5827672 Eh     change       -0.3197614E-03 Eh
   gradient norm :     0.0061702 Eh/α   predicted    -0.2524200E-03 ( -21.06%)
   displ. norm   :     0.0809145 α      lambda       -0.2340095E-03
   maximum displ.:     0.0427207 α      in ANC's #2, #11, #3, ...

........................................................................
.............................. CYCLE    4 ..............................
........................................................................
   1    -23.9284389 -0.239284E+02  0.148E-01    3.17       0.0  T
   2    -23.9284493 -0.104219E-04  0.795E-02    3.16       1.0  T
   3    -23.9284475  0.185673E-05  0.222E-02    3.16       1.1  T
   4    -23.9284524 -0.492691E-05  0.593E-03    3.16       4.1  T
   5    -23.9284527 -0.265342E-06  0.348E-03    3.16       7.0  T
   6    -23.9284528 -0.726113E-07  0.998E-04    3.16      24.3  T
   7    -23.9284528 -0.581911E-08  0.560E-04    3.16      43.3  T
     SCC iter.                  ...        0 min,  0.004 sec
     gradient                   ...        0 min,  0.006 sec
 * total energy  :   -23.5829638 Eh     change       -0.1966692E-03 Eh
   gradient norm :     0.0071226 Eh/α   predicted    -0.1177697E-03 ( -40.12%)
   displ. norm   :     0.3142436 α      lambda       -0.7528745E-03
   maximum displ.:     0.1667470 α      in ANC's #2, #8, #11, ...

........................................................................
.............................. CYCLE    5 ..............................
........................................................................
   1    -23.9224966 -0.239225E+02  0.599E-01    3.25       0.0  T
   2    -23.9226449 -0.148281E-03  0.327E-01    3.22       1.0  T
   3    -23.9224757  0.169173E-03  0.139E-01    3.23       1.0  T
   4    -23.9227148 -0.239049E-03  0.268E-02    3.22       1.0  T
   5    -23.9227194 -0.466172E-05  0.141E-02    3.22       1.7  T
   6    -23.9227202 -0.720027E-06  0.576E-03    3.22       4.2  T
   7    -23.9227204 -0.284014E-06  0.222E-03    3.22      10.9  T
   8    -23.9227204 -0.139446E-07  0.102E-03    3.22      23.8  T
     SCC iter.                  ...        0 min,  0.005 sec
     gradient                   ...        0 min,  0.006 sec
 * total energy  :   -23.5832466 Eh     change       -0.2827349E-03 Eh
   gradient norm :     0.0235376 Eh/α   predicted    -0.4136123E-03 (  46.29%)
   displ. norm   :     0.0742964 α      lambda       -0.4464193E-03
   maximum displ.:     0.0315886 α      in ANC's #8, #11, #3, ...

........................................................................
.............................. CYCLE    6 ..............................
........................................................................
   1    -23.9249323 -0.239249E+02  0.157E-01    3.18       0.0  T
   2    -23.9249477 -0.154066E-04  0.845E-02    3.19       1.0  T
   3    -23.9249431  0.464950E-05  0.309E-02    3.19       1.0  T
   4    -23.9249517 -0.863749E-05  0.880E-03    3.19       2.8  T
   5    -23.9249523 -0.649900E-06  0.468E-03    3.19       5.2  T
   6    -23.9249524 -0.107869E-06  0.168E-03    3.19      14.4  T
     SCC iter.                  ...        0 min,  0.004 sec
     gradient                   ...        0 min,  0.006 sec
 * total energy  :   -23.5834837 Eh     change       -0.2370946E-03 Eh
   gradient norm :     0.0110015 Eh/α   predicted    -0.2244410E-03 (  -5.34%)
   displ. norm   :     0.1080617 α      lambda       -0.2917251E-03
   maximum displ.:     0.0770052 α      in ANC's #2, #11, #8, ...

........................................................................
.............................. CYCLE    7 ..............................
........................................................................
   1    -23.9242223 -0.239242E+02  0.174E-01    3.21       0.0  T
   2    -23.9242330 -0.106387E-04  0.941E-02    3.21       1.0  T
   3    -23.9242047  0.283111E-04  0.538E-02    3.20       1.0  T
   4    -23.9242425 -0.377843E-04  0.864E-03    3.20       2.8  T
   5    -23.9242426 -0.111311E-06  0.432E-03    3.20       5.6  T
   6    -23.9242427 -0.114631E-06  0.163E-03    3.20      14.9  T
   7    -23.9242427 -0.250259E-07  0.542E-04    3.20      44.8  T
     SCC iter.                  ...        0 min,  0.004 sec
     gradient                   ...        0 min,  0.006 sec
 * total energy  :   -23.5837221 Eh     change       -0.2384708E-03 Eh
   gradient norm :     0.0064718 Eh/α   predicted    -0.1475652E-03 ( -38.12%)
   displ. norm   :     0.2054632 α      lambda       -0.3835789E-03
   maximum displ.:     0.1436317 α      in ANC's #2, #11, #8, ...

........................................................................
.............................. CYCLE    8 ..............................
........................................................................
   1    -23.9226286 -0.239226E+02  0.335E-01    3.25       0.0  T
   2    -23.9226719 -0.432859E-04  0.183E-01    3.25       1.0  T
   3    -23.9225617  0.110259E-03  0.109E-01    3.24       1.0  T
   4    -23.9227117 -0.150086E-03  0.174E-02    3.24       1.4  T
   5    -23.9227123 -0.522235E-06  0.932E-03    3.24       2.6  T
   6    -23.9227128 -0.572320E-06  0.348E-03    3.24       7.0  T
   7    -23.9227129 -0.105350E-06  0.123E-03    3.24      19.7  T
   8    -23.9227129 -0.773802E-09  0.390E-04    3.24      62.1  T
     SCC iter.                  ...        0 min,  0.005 sec
     gradient                   ...        0 min,  0.006 sec
 * total energy  :   -23.5838609 Eh     change       -0.1387681E-03 Eh
   gradient norm :     0.0072323 Eh/α   predicted    -0.1998850E-03 (  44.04%)
   displ. norm   :     0.0559479 α      lambda       -0.1048722E-03
   maximum displ.:     0.0225216 α      in ANC's #2, #8, #4, ...

........................................................................
.............................. CYCLE    9 ..............................
........................................................................
   1    -23.9250414 -0.239250E+02  0.113E-01    3.23       0.0  T
   2    -23.9250465 -0.506446E-05  0.621E-02    3.23       1.0  T
   3    -23.9250381  0.838135E-05  0.298E-02    3.23       1.0  T
   4    -23.9250493 -0.111754E-04  0.549E-03    3.23       4.4  T
   5    -23.9250494 -0.106729E-06  0.278E-03    3.23       8.7  T
   6    -23.9250494 -0.266027E-07  0.128E-03    3.23      19.0  T
     SCC iter.                  ...        0 min,  0.004 sec
     gradient                   ...        0 min,  0.006 sec
 * total energy  :   -23.5839037 Eh     change       -0.4280064E-04 Eh
   gradient norm :     0.0018703 Eh/α   predicted    -0.5260021E-04 (  22.90%)
   displ. norm   :     0.0442780 α      lambda       -0.1557741E-04
   maximum displ.:     0.0312652 α      in ANC's #2, #5, #3, ...

........................................................................
.............................. CYCLE   10 ..............................
........................................................................
   1    -23.9248597 -0.239249E+02  0.508E-02    3.24       0.0  T
   2    -23.9248607 -0.959522E-06  0.271E-02    3.24       1.0  T
   3    -23.9248587  0.200222E-05  0.149E-02    3.24       1.6  T
   4    -23.9248614 -0.275578E-05  0.312E-03    3.24       7.8  T
   5    -23.9248615 -0.771547E-08  0.172E-03    3.24      14.1  T
   6    -23.9248615 -0.236652E-07  0.528E-04    3.24      45.9  T
   7    -23.9248615 -0.247173E-08  0.234E-04    3.24     103.6  T
     SCC iter.                  ...        0 min,  0.004 sec
     gradient                   ...        0 min,  0.006 sec
 * total energy  :   -23.5839206 Eh     change       -0.1690586E-04 Eh
   gradient norm :     0.0012539 Eh/α   predicted    -0.7795526E-05 ( -53.89%)
   displ. norm   :     0.0946976 α      lambda       -0.2086191E-04
   maximum displ.:     0.0576624 α      in ANC's #2, #1, #5, ...

........................................................................
.............................. CYCLE   11 ..............................
........................................................................
   1    -23.9248680 -0.239249E+02  0.716E-02    3.25       0.0  T
   2    -23.9248695 -0.148008E-05  0.406E-02    3.24       1.0  T
   3    -23.9248652  0.424169E-05  0.203E-02    3.24       1.2  T
   4    -23.9248707 -0.540465E-05  0.361E-03    3.24       6.7  T
   5    -23.9248707 -0.288539E-07  0.209E-03    3.24      11.6  T
   6    -23.9248707 -0.301537E-07  0.754E-04    3.24      32.2  T
   7    -23.9248707 -0.405286E-08  0.364E-04    3.24      66.6  T
     SCC iter.                  ...        0 min,  0.004 sec
     gradient                   ...        0 min,  0.006 sec
 * total energy  :   -23.5839404 Eh     change       -0.1978995E-04 Eh
   gradient norm :     0.0013850 Eh/α   predicted    -0.1047392E-04 ( -47.07%)
   displ. norm   :     0.0819550 α      lambda       -0.1189585E-04
   maximum displ.:     0.0512921 α      in ANC's #1, #2, #5, ...

........................................................................
.............................. CYCLE   12 ..............................
........................................................................
   1    -23.9249085 -0.239249E+02  0.796E-02    3.24       0.0  T
   2    -23.9249098 -0.129637E-05  0.411E-02    3.24       1.0  T
   3    -23.9249099 -0.177394E-06  0.742E-03    3.24       3.3  T
   4    -23.9249099  0.700206E-07  0.493E-03    3.24       4.9  T
   5    -23.9249101 -0.237980E-06  0.785E-04    3.24      30.9  T
   6    -23.9249101 -0.437385E-08  0.361E-04    3.24      67.2  T
     SCC iter.                  ...        0 min,  0.004 sec
     gradient                   ...        0 min,  0.006 sec
 * total energy  :   -23.5839513 Eh     change       -0.1092662E-04 Eh
   gradient norm :     0.0011995 Eh/α   predicted    -0.5965041E-05 ( -45.41%)
   displ. norm   :     0.0504660 α      lambda       -0.5921457E-05
   maximum displ.:     0.0386979 α      in ANC's #1, #2, #5, ...

........................................................................
.............................. CYCLE   13 ..............................
........................................................................
   1    -23.9249250 -0.239249E+02  0.368E-02    3.24       0.0  T
   2    -23.9249252 -0.178196E-06  0.208E-02    3.24       1.2  T
   3    -23.9249249  0.274391E-06  0.527E-03    3.24       4.6  T
   4    -23.9249253 -0.356799E-06  0.168E-03    3.24      14.4  T
   5    -23.9249253 -0.594308E-08  0.573E-04    3.24      42.4  T
   6    -23.9249253 -0.394177E-08  0.193E-04    3.24     125.4  T
     SCC iter.                  ...        0 min,  0.004 sec
     gradient                   ...        0 min,  0.006 sec
 * total energy  :   -23.5839582 Eh     change       -0.6833740E-05 Eh
   gradient norm :     0.0007679 Eh/α   predicted    -0.2963433E-05 ( -56.64%)
   displ. norm   :     0.0375478 α      lambda       -0.4200888E-05
   maximum displ.:     0.0329955 α      in ANC's #1, #2, #3, ...

........................................................................
.............................. CYCLE   14 ..............................
........................................................................
   1    -23.9250471 -0.239250E+02  0.340E-02    3.24       0.0  T
   2    -23.9250474 -0.268012E-06  0.181E-02    3.24       1.3  T
   3    -23.9250468  0.514715E-06  0.728E-03    3.24       3.3  T
   4    -23.9250475 -0.659570E-06  0.215E-03    3.24      11.3  T
   5    -23.9250475 -0.341956E-08  0.873E-04    3.24      27.8  T
   6    -23.9250475 -0.789541E-08  0.265E-04    3.24      91.5  T
     SCC iter.                  ...        0 min,  0.004 sec
     gradient                   ...        0 min,  0.006 sec
 * total energy  :   -23.5839630 Eh     change       -0.4894856E-05 Eh
   gradient norm :     0.0004080 Eh/α   predicted    -0.2101228E-05 ( -57.07%)
   displ. norm   :     0.0303041 α      lambda       -0.2569955E-05
   maximum displ.:     0.0266524 α      in ANC's #1, #2, #3, ...

   *** GEOMETRY OPTIMIZATION CONVERGED AFTER 14 ITERATIONS ***

------------------------------------------------------------------------
 total energy gain   :        -0.0028916 Eh       -1.8145 kcal/mol
 total RMSD          :         0.1987207 a0        0.1052 Å
 total power (kW/mol):        -0.5422755 (step)  -35.2882 (real)
------------------------------------------------------------------------

 ANCopt (total)                0 d,  0 h,  0 min,  0.215 sec
 optimizer setup                ...        0 min,  0.000 sec (  0.065%)
 model hessian                  ...        0 min,  0.002 sec (  0.994%)
 ANC generation                 ...        0 min,  0.000 sec (  0.223%)
 coordinate transformation      ...        0 min,  0.000 sec (  0.085%)
 single point calculation       ...        0 min,  0.208 sec ( 96.480%)
 optimization log               ...        0 min,  0.001 sec (  0.508%)
 hessian update                 ...        0 min,  0.000 sec (  0.073%)
 rational function              ...        0 min,  0.002 sec (  1.161%)

================
 final structure:
================
$coord
   -0.13892107118109    2.21181972681004   -0.36580270096652      C 
   -2.29465910156170   -0.22531779847257   -0.12947390109271      S 
    0.08831549125355   -2.36334379825493    0.40436750642905      C 
    2.39655657763073   -1.26264762103712    0.38352633797428      C 
    2.28986694509084    1.39236515016709   -0.07160142004567      C 
    4.44683768334540    2.84529841334753   -0.28750601041304      N 
    4.26166253905234    5.57008086594857   -0.18069973104885      C 
    6.88132497541567    6.74479416494338   -0.31610766763640      C 
   -0.81810369595352    4.08016424186207   -0.73563501784877      H 
   -0.37172448921118   -4.31308119777064    0.70036173831134      H 
    4.13883510544061   -2.27048886025809    0.67040594809698      H 
    5.93710039700003    2.13819904398416    0.67508561068769      H 
    3.29038036000070    6.20439364497426    1.55034558667801      H 
    3.13315150980845    6.18791563092507   -1.80080937205486      H 
    8.01012275792901    6.18651446361601    1.31030041240878      H 
    6.73781304885420    8.79277044670636   -0.33391181935743      H 
    7.84367759796467    6.13395111295988   -2.02500452524705      H 
$end
           -------------------------------------------------
          |                Final Singlepoint                |
           -------------------------------------------------

          ...................................................
          :                      SETUP                      :
          :.................................................:
          :  # basis functions                  47          :
          :  # atomic orbitals                  46          :
          :  # shells                           26          :
          :  # electrons                        44          :
          :  max. iterations                   250          :
          :  Hamiltonian                  GFN2-xTB          :
          :  restarted?                      false          :
          :  GBSA solvation                  false          :
          :  PC potential                    false          :
          :  electronic temp.          300.0000000     K    :
          :  accuracy                    1.0000000          :
          :  -> integral cutoff          0.2500000E+02      :
          :  -> integral neglect         0.1000000E-07      :
          :  -> SCF convergence          0.1000000E-05 Eh   :
          :  -> wf. convergence          0.1000000E-03 e    :
          :  Broyden damping             0.4000000          :
          ...................................................

 iter      E             dE          RMSdq      gap      omega  full diag
   1    -23.9250475 -0.239250E+02  0.134E-04    3.24       0.0  T
   2    -23.9250475 -0.141185E-10  0.551E-05    3.24     440.3  T
   3    -23.9250475  0.415312E-11  0.588E-05    3.24     412.4  T

   *** convergence criteria satisfied after 3 iterations ***

         #    Occupation            Energy/Eh            Energy/eV
      -------------------------------------------------------------
         1        2.0000           -0.7155513             -19.4711
       ...           ...                  ...                  ...
        16        2.0000           -0.4592462             -12.4967
        17        2.0000           -0.4564699             -12.4212
        18        2.0000           -0.4475943             -12.1797
        19        2.0000           -0.4421256             -12.0308
        20        2.0000           -0.4144164             -11.2768
        21        2.0000           -0.3826266             -10.4118
        22        2.0000           -0.3457766              -9.4091 (HOMO)
        23                         -0.2267682              -6.1707 (LUMO)
        24                         -0.1894445              -5.1550
        25                         -0.1465304              -3.9873
        26                         -0.1008371              -2.7439
        27                          0.0114402               0.3113
       ...                                ...                  ...
        46                          0.7121274              19.3780
      -------------------------------------------------------------
                  HL-Gap            0.1190084 Eh            3.2384 eV
             Fermi-level           -0.2862724 Eh           -7.7899 eV

 SCC (total)                   0 d,  0 h,  0 min,  0.013 sec
 SCC setup                      ...        0 min,  0.000 sec (  1.027%)
 Dispersion                     ...        0 min,  0.000 sec (  0.743%)
 integral evaluation            ...        0 min,  0.004 sec ( 29.119%)
 zeroth order Hamiltonian       ...        0 min,  0.000 sec (  0.573%)
 iterations                     ...        0 min,  0.002 sec ( 18.006%)
 molecular gradient             ...        0 min,  0.007 sec ( 48.346%)
 printout                       ...        0 min,  0.000 sec (  1.830%)

         :::::::::::::::::::::::::::::::::::::::::::::::::::::
         ::                     SUMMARY                     ::
         :::::::::::::::::::::::::::::::::::::::::::::::::::::
         :: total energy             -23.583963038087 Eh    ::
         :: gradient norm              0.000408649620 Eh/a0 ::
         :: HOMO-LUMO gap              3.238382857511 eV    ::
         ::.................................................::
         :: SCC energy               -23.925047518983 Eh    ::
         :: -> isotropic ES            0.008018118876 Eh    ::
         :: -> anisotropic ES          0.003561256421 Eh    ::
         :: -> anisotropic XC          0.013863039305 Eh    ::
         :: -> dispersion             -0.013058859388 Eh    ::
         :: repulsion energy           0.341094125405 Eh    ::
         :: add. restraining           0.000000000000 Eh    ::
         :::::::::::::::::::::::::::::::::::::::::::::::::::::

           -------------------------------------------------
          |                Property Printout                |
           -------------------------------------------------

    * Orbital Energies and Occupations

         #    Occupation            Energy/Eh            Energy/eV
      -------------------------------------------------------------
         1        2.0000           -0.7155513             -19.4711
       ...           ...                  ...                  ...
        10        2.0000           -0.5313861             -14.4598
        11        2.0000           -0.5136768             -13.9779
        12        2.0000           -0.4901779             -13.3384
        13        2.0000           -0.4845549             -13.1854
        14        2.0000           -0.4710368             -12.8176
        15        2.0000           -0.4622492             -12.5784
        16        2.0000           -0.4592462             -12.4967
        17        2.0000           -0.4564699             -12.4212
        18        2.0000           -0.4475943             -12.1797
        19        2.0000           -0.4421256             -12.0308
        20        2.0000           -0.4144164             -11.2768
        21        2.0000           -0.3826266             -10.4118
        22        2.0000           -0.3457766              -9.4091 (HOMO)
        23                         -0.2267682              -6.1707 (LUMO)
        24                         -0.1894445              -5.1550
        25                         -0.1465304              -3.9873
        26                         -0.1008371              -2.7439
        27                          0.0114402               0.3113
        28                          0.0332037               0.9035
        29                          0.0440928               1.1998
        30                          0.0504598               1.3731
        31                          0.0982736               2.6742
        32                          0.1245365               3.3888
        33                          0.1413424               3.8461
       ...                                ...                  ...
        46                          0.7121274              19.3780
      -------------------------------------------------------------
                  HL-Gap            0.1190084 Eh            3.2384 eV
             Fermi-level           -0.2862724 Eh           -7.7899 eV

     #   Z        covCN         q      C6AA      α(0)
     1   6 C      2.940    -0.059    29.458     8.901
     2  16 S      2.298    -0.062   143.647    20.172
     3   6 C      2.934    -0.018    28.461     8.749
     4   6 C      3.121    -0.067    29.476     8.891
     5   6 C      3.089     0.057    26.625     8.458
     6   7 N      2.686    -0.205    25.453     7.493
     7   6 C      3.739     0.017    20.374     6.441
     8   6 C      3.754    -0.111    22.684     6.791
     9   1 H      0.927     0.031     2.567     2.506
    10   1 H      0.926     0.040     2.452     2.449
    11   1 H      0.926     0.028     2.611     2.527
    12   1 H      0.860     0.153     1.379     1.839
    13   1 H      0.923     0.020     2.735     2.586
    14   1 H      0.924     0.043     2.410     2.428
    15   1 H      0.925     0.039     2.462     2.454
    16   1 H      0.925     0.045     2.384     2.415
    17   1 H      0.925     0.049     2.329     2.386

 Mol. C6AA /au·bohr⁶  :       3765.178728
 Mol. C8AA /au·bohr⁸  :     102230.035641
 Mol. α(0) /au        :         97.487158


Wiberg/Mayer (AO) data.
largest (>0.10) Wiberg bond orders for each atom
          total WBO             WBO to atom ...
     1  C   3.917        C    5 1.533    S    2 1.154    H    9 0.971    C    3 0.114
     2  S   2.602        C    3 1.191    C    1 1.154    C    4 0.111
     3  C   3.953        C    4 1.647    S    2 1.191    H   10 0.972    C    1 0.114
     4  C   3.983        C    3 1.647    C    5 1.201    H   11 0.965    S    2 0.111
     5  C   3.972        C    1 1.533    C    4 1.201    N    6 1.125
     6  N   3.277        C    5 1.125    C    7 1.004    H   12 0.944
     7  C   3.982        C    8 1.019    N    6 1.004    H   14 0.971    H   13 0.967
     8  C   3.995        C    7 1.019    H   17 0.987    H   15 0.986    H   16 0.985
     9  H   0.999        C    1 0.971
    10  H   0.998        C    3 0.972
    11  H   0.999        C    4 0.965
    12  H   0.976        N    6 0.944
    13  H   1.000        C    7 0.967
    14  H   0.998        C    7 0.971
    15  H   0.998        C    8 0.986
    16  H   0.998        C    8 0.985
    17  H   0.998        C    8 0.987

molecular dipole:
                 x           y           z       tot (Debye)
 q only:        0.703       0.399       0.100
   full:        1.012       0.414       0.316       2.893
molecular quadrupole (traceless):
                xx          xy          yy          xz          yz          zz
 q only:        2.056       4.293       2.136       0.726      -0.410      -4.193
  q+dip:        1.355       3.033       3.454       2.727      -0.115      -4.808
   full:        0.943       3.373       3.668       2.630       0.005      -4.611

           -------------------------------------------------
          |                Geometry Summary                 |
           -------------------------------------------------

      molecular mass/u    :      127.2038000
   center of mass at/Å    :        0.9004009       0.8889403      -0.0412852
  moments of inertia/u·Å² :        0.9268880E+02   0.5791205E+03   0.6642763E+03
rotational constants/cm⁻¹ :        0.1818735E+00   0.2910902E-01   0.2537744E-01

 * 17 selected distances

     #   Z        #   Z                                     value/Å
     1   6 C      2  16 S                                 1.7263427 (max)
     2  16 S      3   6 C                                 1.7175621
     3   6 C      4   6 C                                 1.3532816
     1   6 C      5   6 C                                 1.3653462
     4   6 C      5   6 C                                 1.4265835
     5   6 C      6   7 N                                 1.3809552
     6   7 N      7   6 C                                 1.4463235
     7   6 C      8   6 C                                 1.5209514
     1   6 C      9   1 H                                 1.0700347
     3   6 C     10   1 H                                 1.0715971
     4   6 C     11   1 H                                 1.0758811
     6   7 N     12   1 H                                 1.0106392 (min)
     7   6 C     13   1 H                                 1.1027043
     7   6 C     14   1 H                                 1.0947720
     8   6 C     15   1 H                                 1.0884938
     8   6 C     16   1 H                                 1.0864409
     8   6 C     17   1 H                                 1.0870157

 * 5 distinct bonds (by element types)

   Z      Z             #   av. dist./Å        max./Å        min./Å
   1 H    6 C           8     1.0846174     1.1027043     1.0700347
   6 C    6 C           4     1.4165406     1.5209514     1.3532816
   1 H    7 N           1     1.0106392     1.0106392     1.0106392
   6 C    7 N           2     1.4136394     1.4463235     1.3809552
   6 C   16 S           2     1.7219524     1.7263427     1.7175621


optimized geometry written to: xtbopt.xyz


           -------------------------------------------------
          | TOTAL ENERGY              -23.583963038087 Eh   |
          | GRADIENT NORM               0.000408649620 Eh/α |
          | HOMO-LUMO GAP               3.238382857511 eV   |
           -------------------------------------------------

------------------------------------------------------------------------
 * finished run on 2021/05/19 at 10:59:20.398     
------------------------------------------------------------------------
 total:
 * wall-time:     0 d,  0 h,  0 min,  0.266 sec
 *  cpu-time:     0 d,  0 h,  0 min,  0.264 sec
 * ratio c/w:     0.994 speedup
 SCF:
 * wall-time:     0 d,  0 h,  0 min,  0.020 sec
 *  cpu-time:     0 d,  0 h,  0 min,  0.020 sec
 * ratio c/w:     0.996 speedup
 ANC optimizer:
 * wall-time:     0 d,  0 h,  0 min,  0.229 sec
 *  cpu-time:     0 d,  0 h,  0 min,  0.229 sec
 * ratio c/w:     0.998 speedup

