      -----------------------------------------------------------      
     |                   =====================                   |     
     |                           x T B                           |     
     |                   =====================                   |     
     |                         S. Grimme                         |     
     |          Mulliken Center for Theoretical Chemistry        |     
     |                    University of Bonn                     |     
     |                Version 6.2 RC2 (SAW190805)                |     
      -----------------------------------------------------------      

   This program is distributed in the hope that it will be useful,
   but WITHOUT ANY WARRANTY; without even the implied warranty of
   MERCHANTABILITY or FITNESS FOR A PARTICULAR PURPOSE.
   
   FOR NON-COMMERCIAL, ACADEMIA USE ONLY.
   
   Cite this work as:
   * S. Grimme, C. Bannwarth, P. Shushkov, J. Chem. Theory Comput., 2017,
     13, 1989-2009. DOI: 10.1021/acs.jctc.7b00118
   * C. Bannwarth, S. Ehlert and S. Grimme., J. Chem. Theory Comput., 2019,
     15, 1652-1671. DOI: 10.1021/acs.jctc.8b01176
   * P. Pracht, E. Caldeweyher, S. Ehlert, S. Grimme, ChemRxiv, 2019, preprint.
     DOI: 10.26434/chemrxiv.8326202.v1
   
   for DFT-D4:
   * E. Caldeweyher, C. Bannwarth and S. Grimme, J. Chem. Phys., 2017,
     147, 034112. DOI: 10.1063/1.4993215
   * E. Caldeweyher, S. Ehlert, A. Hansen, H. Neugebauer, S. Spicher,
     C. Bannwarth and S. Grimme, J. Chem. Phys., 2019, 150, 154122.
     DOI: 10.1063/1.5090222
   
   for sTDA-xTB:
   * S. Grimme and C. Bannwarth, J. Chem. Phys., 2016, 145, 054103.
     DOI: 10.1063/1.4959605
   
   in the mass-spec context:
   * V. Asgeirsson, C. Bauer and S. Grimme, Chem. Sci., 2017, 8, 4879.
     DOI: 10.1039/c7sc00601b
   
   for metadynamics refer to:
   * S. Grimme, J. Chem. Theory Comput., 2019, 155, 2847-2862
     DOI: 10.1021/acs.jctc.9b00143
   
   with help from (in alphabetical order)
   C. Bannwarth, F. Bohle, G. Brandenburg, E. Caldeweyher, M. Checinski,
   S. Dohm, S. Ehlert, S. Ehrlich, F. März, H. Neugebauer, J. Pisarek,
   P. Pracht, P. Shushkov, and S. Spicher.
   
 * started run on 2021/05/19 at 10:59:20.420     

           -------------------------------------------------
          |                Calculation Setup                |
           -------------------------------------------------

          program call               : /ihome/ghutchison/geoffh/xtb/xtb 519.xyz -opt
          hostname                   : smp-n144
          coordinate file            : 519.xyz
          omp threads                :                     1
          number of atoms            :                    22
          number of electrons        :                    68
          charge                     :                     0
          spin                       :                   0.0
          first test random number   :      0.54742696067844


########################################################################
# WARNING! Please study the warnings concerning your input carefully
#  - the use of '-opt' is discouraged, please use '--opt' next time
########################################################################

           ------------------------------------------------- 
          |                 G F N 2 - x T B                 |
          | Geometry, Frequencies, Noncovalent interactions |
          |            JCTC 2019 parametrisation            |
           ------------------------------------------------- 
             KAB for C  - Si     :                1.0500
             KAB for H  - Pd     :                0.9500
             k(s)              :                1.8500
             k(p)              :                2.2300
             k(d)              :                2.2300
             k(f)              :                2.0000
             kEN (H0ij)        :               -2.0000
             D4 a1             :                0.5200
             D4 a2             :                5.0000
             D4 s6             :                1.0000
             D4 s8             :                2.7000
             D4 s9             :                5.0000
             alphaj            :                2.0000

  Z AO/shell   Hii/eV     exponent
  1     Wed Apr 25 08:07:45 CEST 2018   EN: 2.200 GM2: 0.406  GM3: 0.0800  RAES: 1.40
     1s    -10.707211    1.230000
  6     Wed Apr 25 08:07:45 CEST 2018   EN: 2.550 GM2: 0.538  GM3: 0.1500  RAES: 3.00
     2s    -13.970922    2.096432
     2p    -10.063292    1.800000
 16     Tue Apr 24 11:44:34 CEST 2018   EN: 2.580 GM2: 0.340  GM3:-0.0502  RAES: 3.10
     3s    -20.029654    1.981333
     3p    -11.377694    2.025643
     3d     -0.420282    1.702555

           ------------------------------------------------- 
          |        Self-Consistent Charge Iterations        |
           ------------------------------------------------- 

          ...................................................
          :                      SETUP                      :
          :.................................................:
          :  # basis functions                  76          :
          :  # atomic orbitals                  74          :
          :  # shells                           38          :
          :  # electrons                        68          :
          :  max. iterations                   250          :
          :  Hamiltonian                  GFN2-xTB          :
          :  restarted?                      false          :
          :  GBSA solvation                  false          :
          :  PC potential                    false          :
          :  electronic temp.          300.0000000     K    :
          :  accuracy                    1.0000000          :
          :  -> integral cutoff          0.2500000E+02      :
          :  -> integral neglect         0.1000000E-07      :
          :  -> SCF convergence          0.1000000E-05 Eh   :
          :  -> wf. convergence          0.1000000E-03 e    :
          :  Broyden damping             0.4000000          :
          ...................................................

 iter      E             dE          RMSdq      gap      omega  full diag
   1    -36.7758839 -0.367759E+02  0.495E+00    2.63       0.0  T
   2    -36.7945932 -0.187092E-01  0.290E+00    2.42       1.0  T
   3    -36.7627789  0.318142E-01  0.158E+00    2.52       1.0  T
   4    -36.8030245 -0.402455E-01  0.444E-01    2.43       1.0  T
   5    -36.8039445 -0.920019E-03  0.166E-01    2.45       1.0  T
   6    -36.8040762 -0.131749E-03  0.779E-02    2.45       1.0  T
   7    -36.8041606 -0.843593E-04  0.291E-02    2.45       1.0  T
   8    -36.8041708 -0.102393E-04  0.128E-02    2.45       1.7  T
   9    -36.8041710 -0.144082E-06  0.711E-03    2.45       3.0  T
  10    -36.8041714 -0.391497E-06  0.313E-03    2.45       6.8  T
  11    -36.8041715 -0.103667E-06  0.131E-03    2.45      16.3  T
  12    -36.8041715 -0.388460E-08  0.689E-04    2.45      31.0  T
  13    -36.8041715 -0.286306E-08  0.237E-04    2.45      89.8  T

   *** convergence criteria satisfied after 13 iterations ***

         #    Occupation            Energy/Eh            Energy/eV
      -------------------------------------------------------------
         1        2.0000           -0.7317214             -19.9112
       ...           ...                  ...                  ...
        28        2.0000           -0.4361536             -11.8683
        29        2.0000           -0.4300685             -11.7028
        30        2.0000           -0.4219198             -11.4810
        31        2.0000           -0.4083718             -11.1124
        32        2.0000           -0.3964776             -10.7887
        33        2.0000           -0.3957454             -10.7688
        34        2.0000           -0.3609972              -9.8232 (HOMO)
        35                         -0.2710528              -7.3757 (LUMO)
        36                         -0.2384815              -6.4894
        37                         -0.2245647              -6.1107
        38                         -0.2082235              -5.6661
        39                         -0.1988694              -5.4115
       ...                                ...                  ...
        74                          0.7133841              19.4122
      -------------------------------------------------------------
                  HL-Gap            0.0899444 Eh            2.4475 eV
             Fermi-level           -0.3160250 Eh           -8.5995 eV

 SCC (total)                   0 d,  0 h,  0 min,  0.045 sec
 SCC setup                      ...        0 min,  0.000 sec (  0.670%)
 Dispersion                     ...        0 min,  0.000 sec (  0.788%)
 integral evaluation            ...        0 min,  0.011 sec ( 23.822%)
 zeroth order Hamiltonian       ...        0 min,  0.000 sec (  0.457%)
 iterations                     ...        0 min,  0.017 sec ( 38.314%)
 molecular gradient             ...        0 min,  0.016 sec ( 34.968%)
 printout                       ...        0 min,  0.000 sec (  0.871%)

         :::::::::::::::::::::::::::::::::::::::::::::::::::::
         ::                     SUMMARY                     ::
         :::::::::::::::::::::::::::::::::::::::::::::::::::::
         :: total energy             -36.226856471691 Eh    ::
         :: gradient norm              0.080936701081 Eh/a0 ::
         :: HOMO-LUMO gap              2.447511194612 eV    ::
         ::.................................................::
         :: SCC energy               -36.804171466858 Eh    ::
         :: -> isotropic ES            0.001813511019 Eh    ::
         :: -> anisotropic ES          0.003053262113 Eh    ::
         :: -> anisotropic XC          0.020084708596 Eh    ::
         :: -> dispersion             -0.027905041283 Eh    ::
         :: repulsion energy           0.577203156437 Eh    ::
         :: add. restraining           0.000000000000 Eh    ::
         :::::::::::::::::::::::::::::::::::::::::::::::::::::

      ----------------------------------------------------------- 
     |                   =====================                   |
     |                        A N C O P T                        |
     |                   =====================                   |
     |               Approximate Normal Coordinate               |
     |                Rational Function Optimizer                |
      ----------------------------------------------------------- 

          ...................................................
          :                      SETUP                      :
          :.................................................:
          :   optimization level            normal          :
          :   max. optcycles                   200          :
          :   ANC micro-cycles                  20          :
          :   degrees of freedom                60          :
          :.................................................:
          :   RF solver                   davidson          :
          :   input Hessian                  false          :
          :   write xtbopt.log                true          :
          :   linear?                        false          :
          :   energy convergence         0.5000000E-05 Eh   :
          :   grad. convergence          0.1000000E-02 Eh/α :
          :   maximium RF displ.         2.0000000          :
          :   Hlow (freq-cutoff)         0.5000000E-02      :
          :   Hmax (freq-cutoff)         5.0000000          :
          :   S6 in model hess.         20.0000000          :
          ...................................................

generating ANC from model Hessian ...
Using Lindh-Hessian (1995)
 Shifting diagonal of input Hessian by   2.672537807021227E-003
 Lowest  eigenvalues of input Hessian
   -0.000000   -0.000000   -0.000000    0.000000    0.000000    0.000000
    0.005000    0.005653    0.006309    0.008528    0.009693    0.015648
    0.017198    0.019646    0.020725    0.025767    0.035139    0.045606
 Highest eigenvalues
    1.740378    1.784416    1.845424    1.894958    1.966117    2.060120
 

........................................................................
.............................. CYCLE    1 ..............................
........................................................................
   1    -36.8041715 -0.368042E+02  0.106E-04    2.45       0.0  T
   2    -36.8041715 -0.515641E-10  0.812E-05    2.45     262.6  T
   3    -36.8041715 -0.811369E-10  0.396E-05    2.45     538.4  T
     SCC iter.                  ...        0 min,  0.004 sec
     gradient                   ...        0 min,  0.016 sec
 * total energy  :   -36.2268565 Eh     change       -0.6691671E-08 Eh
   gradient norm :     0.0809373 Eh/α   predicted     0.0000000E+00 (-100.00%)
   displ. norm   :     0.3294507 α      lambda       -0.1244803E-01
   maximum displ.:     0.2345396 α      in ANC's #14, #23, #15, ...

........................................................................
.............................. CYCLE    2 ..............................
........................................................................
   1    -36.8340035 -0.368340E+02  0.318E-01    2.56       0.0  T
   2    -36.8340822 -0.786631E-04  0.166E-01    2.55       1.0  T
   3    -36.8340047  0.775010E-04  0.103E-01    2.55       1.0  T
   4    -36.8341527 -0.147983E-03  0.315E-02    2.55       1.0  T
   5    -36.8341568 -0.411712E-05  0.148E-02    2.55       1.4  T
   6    -36.8341585 -0.171007E-05  0.363E-03    2.55       5.9  T
   7    -36.8341586 -0.784436E-07  0.186E-03    2.55      11.5  T
     SCC iter.                  ...        0 min,  0.008 sec
     gradient                   ...        0 min,  0.015 sec
 * total energy  :   -36.2350327 Eh     change       -0.8176207E-02 Eh
   gradient norm :     0.0296477 Eh/α   predicted    -0.6899562E-02 ( -15.61%)
   displ. norm   :     0.2084878 α      lambda       -0.2251964E-02
   maximum displ.:     0.1162754 α      in ANC's #14, #2, #5, ...

........................................................................
.............................. CYCLE    3 ..............................
........................................................................
   1    -36.8429239 -0.368429E+02  0.192E-01    2.59       0.0  T
   2    -36.8429547 -0.308195E-04  0.103E-01    2.58       1.0  T
   3    -36.8429248  0.298671E-04  0.623E-02    2.58       1.0  T
   4    -36.8429753 -0.505020E-04  0.190E-02    2.58       1.1  T
   5    -36.8429775 -0.212541E-05  0.744E-03    2.58       2.9  T
   6    -36.8429778 -0.342571E-06  0.262E-03    2.58       8.1  T
   7    -36.8429779 -0.638278E-07  0.977E-04    2.58      21.8  T
     SCC iter.                  ...        0 min,  0.008 sec
     gradient                   ...        0 min,  0.015 sec
 * total energy  :   -36.2363278 Eh     change       -0.1295136E-02 Eh
   gradient norm :     0.0093743 Eh/α   predicted    -0.1174933E-02 (  -9.28%)
   displ. norm   :     0.1402964 α      lambda       -0.3382323E-03
   maximum displ.:     0.1052671 α      in ANC's #2, #5, #1, ...

........................................................................
.............................. CYCLE    4 ..............................
........................................................................
   1    -36.8418468 -0.368418E+02  0.124E-01    2.57       0.0  T
   2    -36.8418506 -0.377860E-05  0.706E-02    2.57       1.0  T
   3    -36.8418390  0.115881E-04  0.291E-02    2.57       1.0  T
   4    -36.8418524 -0.133918E-04  0.760E-03    2.57       2.8  T
   5    -36.8418528 -0.412601E-06  0.249E-03    2.57       8.6  T
   6    -36.8418528 -0.299031E-07  0.106E-03    2.57      20.0  T
     SCC iter.                  ...        0 min,  0.008 sec
     gradient                   ...        0 min,  0.015 sec
 * total energy  :   -36.2365742 Eh     change       -0.2464042E-03 Eh
   gradient norm :     0.0052108 Eh/α   predicted    -0.1724452E-03 ( -30.02%)
   displ. norm   :     0.2310879 α      lambda       -0.3474352E-03
   maximum displ.:     0.1856272 α      in ANC's #2, #1, #5, ...

........................................................................
.............................. CYCLE    5 ..............................
........................................................................
   1    -36.8391674 -0.368392E+02  0.175E-01    2.56       0.0  T
   2    -36.8391728 -0.538945E-05  0.997E-02    2.55       1.0  T
   3    -36.8391564  0.164412E-04  0.333E-02    2.55       1.0  T
   4    -36.8391748 -0.184069E-04  0.891E-03    2.55       2.4  T
   5    -36.8391755 -0.721482E-06  0.283E-03    2.55       7.5  T
   6    -36.8391755 -0.230001E-07  0.124E-03    2.55      17.2  T
     SCC iter.                  ...        0 min,  0.007 sec
     gradient                   ...        0 min,  0.015 sec
 * total energy  :   -36.2367992 Eh     change       -0.2249929E-03 Eh
   gradient norm :     0.0057106 Eh/α   predicted    -0.1830023E-03 ( -18.66%)
   displ. norm   :     0.1703466 α      lambda       -0.2034007E-03
   maximum displ.:     0.1317161 α      in ANC's #2, #1, #4, ...

........................................................................
.............................. CYCLE    6 ..............................
........................................................................
   1    -36.8384523 -0.368385E+02  0.136E-01    2.54       0.0  T
   2    -36.8384534 -0.105371E-05  0.793E-02    2.54       1.0  T
   3    -36.8384511  0.228795E-05  0.128E-02    2.54       1.7  T
   4    -36.8384537 -0.258027E-05  0.465E-03    2.54       4.6  T
   5    -36.8384538 -0.172713E-06  0.156E-03    2.54      13.7  T
   6    -36.8384539 -0.285630E-07  0.668E-04    2.54      31.9  T
     SCC iter.                  ...        0 min,  0.008 sec
     gradient                   ...        0 min,  0.015 sec
 * total energy  :   -36.2369549 Eh     change       -0.1556533E-03 Eh
   gradient norm :     0.0071944 Eh/α   predicted    -0.1046522E-03 ( -32.77%)
   displ. norm   :     0.2285160 α      lambda       -0.2598368E-03
   maximum displ.:     0.1768033 α      in ANC's #2, #1, #4, ...

........................................................................
.............................. CYCLE    7 ..............................
........................................................................
   1    -36.8388780 -0.368389E+02  0.178E-01    2.52       0.0  T
   2    -36.8388804 -0.238851E-05  0.102E-01    2.52       1.0  T
   3    -36.8388784  0.199404E-05  0.148E-02    2.52       1.4  T
   4    -36.8388807 -0.225987E-05  0.749E-03    2.52       2.8  T
   5    -36.8388812 -0.501972E-06  0.231E-03    2.52       9.2  T
   6    -36.8388813 -0.101070E-06  0.709E-04    2.52      30.1  T
     SCC iter.                  ...        0 min,  0.007 sec
     gradient                   ...        0 min,  0.015 sec
 * total energy  :   -36.2371663 Eh     change       -0.2113847E-03 Eh
   gradient norm :     0.0074087 Eh/α   predicted    -0.1367030E-03 ( -35.33%)
   displ. norm   :     0.3196425 α      lambda       -0.3198617E-03
   maximum displ.:     0.2408606 α      in ANC's #2, #1, #4, ...

........................................................................
.............................. CYCLE    8 ..............................
........................................................................
   1    -36.8390224 -0.368390E+02  0.247E-01    2.50       0.0  T
   2    -36.8390276 -0.519777E-05  0.141E-01    2.50       1.0  T
   3    -36.8390240  0.361740E-05  0.207E-02    2.50       1.0  T
   4    -36.8390279 -0.385789E-05  0.112E-02    2.50       1.9  T
   5    -36.8390292 -0.133800E-05  0.295E-03    2.50       7.2  T
   6    -36.8390293 -0.137684E-06  0.108E-03    2.50      19.8  T
     SCC iter.                  ...        0 min,  0.007 sec
     gradient                   ...        0 min,  0.015 sec
 * total energy  :   -36.2374081 Eh     change       -0.2418318E-03 Eh
   gradient norm :     0.0068588 Eh/α   predicted    -0.1762729E-03 ( -27.11%)
   displ. norm   :     0.3046770 α      lambda       -0.2698598E-03
   maximum displ.:     0.2218125 α      in ANC's #2, #1, #4, ...

........................................................................
.............................. CYCLE    9 ..............................
........................................................................
   1    -36.8398764 -0.368399E+02  0.241E-01    2.48       0.0  T
   2    -36.8398830 -0.662516E-05  0.137E-01    2.48       1.0  T
   3    -36.8398778  0.519916E-05  0.238E-02    2.49       1.0  T
   4    -36.8398831 -0.532225E-05  0.127E-02    2.49       1.7  T
   5    -36.8398849 -0.177734E-05  0.320E-03    2.49       6.7  T
   6    -36.8398850 -0.136737E-06  0.122E-03    2.49      17.4  T
   7    -36.8398851 -0.204884E-07  0.520E-04    2.49      41.0  T
     SCC iter.                  ...        0 min,  0.008 sec
     gradient                   ...        0 min,  0.015 sec
 * total energy  :   -36.2375851 Eh     change       -0.1770016E-03 Eh
   gradient norm :     0.0043684 Eh/α   predicted    -0.1474560E-03 ( -16.69%)
   displ. norm   :     0.1990027 α      lambda       -0.1206815E-03
   maximum displ.:     0.1268455 α      in ANC's #2, #1, #4, ...

........................................................................
.............................. CYCLE   10 ..............................
........................................................................
   1    -36.8403382 -0.368403E+02  0.158E-01    2.47       0.0  T
   2    -36.8403412 -0.295550E-05  0.887E-02    2.48       1.0  T
   3    -36.8403394  0.175880E-05  0.149E-02    2.48       1.4  T
   4    -36.8403412 -0.173446E-05  0.864E-03    2.48       2.5  T
   5    -36.8403421 -0.896180E-06  0.207E-03    2.48      10.3  T
   6    -36.8403421 -0.652399E-07  0.655E-04    2.48      32.5  T
     SCC iter.                  ...        0 min,  0.007 sec
     gradient                   ...        0 min,  0.015 sec
 * total energy  :   -36.2376569 Eh     change       -0.7179310E-04 Eh
   gradient norm :     0.0042394 Eh/α   predicted    -0.6273132E-04 ( -12.62%)
   displ. norm   :     0.1428935 α      lambda       -0.9969196E-04
   maximum displ.:     0.0744340 α      in ANC's #2, #3, #4, ...

........................................................................
.............................. CYCLE   11 ..............................
........................................................................
   1    -36.8417527 -0.368418E+02  0.123E-01    2.47       0.0  T
   2    -36.8417548 -0.205056E-05  0.695E-02    2.47       1.0  T
   3    -36.8417501  0.470345E-05  0.176E-02    2.47       1.2  T
   4    -36.8417553 -0.523367E-05  0.691E-03    2.47       3.1  T
   5    -36.8417557 -0.360377E-06  0.204E-03    2.47      10.4  T
   6    -36.8417557 -0.619644E-07  0.582E-04    2.47      36.7  T
     SCC iter.                  ...        0 min,  0.007 sec
     gradient                   ...        0 min,  0.015 sec
 * total energy  :   -36.2377012 Eh     change       -0.4431232E-04 Eh
   gradient norm :     0.0032172 Eh/α   predicted    -0.5086441E-04 (  14.79%)
   displ. norm   :     0.2164432 α      lambda       -0.6983192E-04
   maximum displ.:     0.1265945 α      in ANC's #2, #4, #1, ...

........................................................................
.............................. CYCLE   12 ..............................
........................................................................
   1    -36.8381009 -0.368381E+02  0.163E-01    2.45       0.0  T
   2    -36.8381031 -0.220754E-05  0.933E-02    2.45       1.0  T
   3    -36.8380937  0.936266E-05  0.247E-02    2.45       1.0  T
   4    -36.8381044 -0.106555E-04  0.718E-03    2.45       3.0  T
   5    -36.8381046 -0.182541E-06  0.213E-03    2.45      10.0  T
   6    -36.8381047 -0.928792E-07  0.598E-04    2.45      35.7  T
   7    -36.8381047 -0.256112E-08  0.325E-04    2.45      65.6  T
     SCC iter.                  ...        0 min,  0.008 sec
     gradient                   ...        0 min,  0.016 sec
 * total energy  :   -36.2376547 Eh     change        0.4651759E-04 Eh
   gradient norm :     0.0076848 Eh/α   predicted    -0.3655304E-04 (-178.58%)
   displ. norm   :     0.1277542 α      lambda       -0.1729424E-03
   maximum displ.:     0.0947626 α      in ANC's #2, #1, #4, ...

........................................................................
.............................. CYCLE   13 ..............................
........................................................................
   1    -36.8413407 -0.368413E+02  0.103E-01    2.47       0.0  T
   2    -36.8413417 -0.100495E-05  0.589E-02    2.47       1.0  T
   3    -36.8413374  0.432534E-05  0.174E-02    2.47       1.2  T
   4    -36.8413424 -0.497711E-05  0.442E-03    2.46       4.8  T
   5    -36.8413424 -0.121051E-07  0.178E-03    2.46      12.0  T
   6    -36.8413425 -0.702271E-07  0.468E-04    2.46      45.6  T
     SCC iter.                  ...        0 min,  0.007 sec
     gradient                   ...        0 min,  0.015 sec
 * total energy  :   -36.2377312 Eh     change       -0.7654638E-04 Eh
   gradient norm :     0.0040485 Eh/α   predicted    -0.8788840E-04 (  14.82%)
   displ. norm   :     0.0383863 α      lambda       -0.2613246E-04
   maximum displ.:     0.0226896 α      in ANC's #2, #1, #3, ...

........................................................................
.............................. CYCLE   14 ..............................
........................................................................
   1    -36.8407536 -0.368408E+02  0.364E-02    2.46       0.0  T
   2    -36.8407541 -0.464893E-06  0.211E-02    2.46       1.0  T
   3    -36.8407534  0.631448E-06  0.682E-03    2.46       3.1  T
   4    -36.8407541 -0.693384E-06  0.208E-03    2.46      10.3  T
   5    -36.8407542 -0.435836E-07  0.733E-04    2.46      29.1  T
     SCC iter.                  ...        0 min,  0.007 sec
     gradient                   ...        0 min,  0.015 sec
 * total energy  :   -36.2377302 Eh     change        0.1043484E-05 Eh
   gradient norm :     0.0035015 Eh/α   predicted    -0.1308859E-04 (*******%)
   displ. norm   :     0.0340471 α      lambda       -0.2503849E-04
   maximum displ.:     0.0290285 α      in ANC's #4, #5, #2, ...

........................................................................
.............................. CYCLE   15 ..............................
........................................................................
   1    -36.8409626 -0.368410E+02  0.196E-02    2.46       0.0  T
   2    -36.8409627 -0.715160E-07  0.113E-02    2.46       1.9  T
   3    -36.8409625  0.229474E-06  0.391E-03    2.46       5.5  T
   4    -36.8409627 -0.258713E-06  0.818E-04    2.46      26.1  T
   5    -36.8409627 -0.439072E-08  0.336E-04    2.46      63.5  T
     SCC iter.                  ...        0 min,  0.007 sec
     gradient                   ...        0 min,  0.016 sec
 * total energy  :   -36.2377456 Eh     change       -0.1538056E-04 Eh
   gradient norm :     0.0007910 Eh/α   predicted    -0.1253618E-04 ( -18.49%)
   displ. norm   :     0.0511948 α      lambda        0.8996693E-05
   maximum displ.:     0.0435508 α      in ANC's #4, #5, #2, ...

........................................................................
.............................. CYCLE   16 ..............................
........................................................................
   1    -36.8411766 -0.368412E+02  0.295E-02    2.46       0.0  T
   2    -36.8411768 -0.182343E-06  0.170E-02    2.46       1.3  T
   3    -36.8411763  0.526239E-06  0.612E-03    2.46       3.5  T
   4    -36.8411769 -0.598971E-06  0.125E-03    2.46      17.0  T
   5    -36.8411769 -0.927580E-08  0.566E-04    2.46      37.7  T
   6    -36.8411769 -0.252533E-08  0.245E-04    2.46      87.1  T
     SCC iter.                  ...        0 min,  0.008 sec
     gradient                   ...        0 min,  0.016 sec
 * total energy  :   -36.2377302 Eh     change        0.1540186E-04 Eh
   gradient norm :     0.0059533 Eh/α   predicted     0.4501774E-05 ( -70.77%)
   displ. norm   :     0.0178812 α      lambda       -0.2637444E-04
   maximum displ.:     0.0104654 α      in ANC's #2, #1, #9, ...

........................................................................
.............................. CYCLE   17 ..............................
........................................................................
   1    -36.8410182 -0.368410E+02  0.149E-02    2.46       0.0  T
   2    -36.8410183 -0.933550E-07  0.875E-03    2.46       2.4  T
   3    -36.8410181  0.174633E-06  0.365E-03    2.46       5.8  T
   4    -36.8410183 -0.199073E-06  0.691E-04    2.46      30.9  T
   5    -36.8410183 -0.439716E-08  0.307E-04    2.46      69.5  T
     SCC iter.                  ...        0 min,  0.007 sec
     gradient                   ...        0 min,  0.015 sec
 * total energy  :   -36.2377483 Eh     change       -0.1810309E-04 Eh
   gradient norm :     0.0025277 Eh/α   predicted    -0.1319482E-04 ( -27.11%)
   displ. norm   :     0.0203557 α      lambda       -0.7813974E-05
   maximum displ.:     0.0131748 α      in ANC's #2, #1, #8, ...

........................................................................
.............................. CYCLE   18 ..............................
........................................................................
   1    -36.8409803 -0.368410E+02  0.168E-02    2.46       0.0  T
   2    -36.8409804 -0.795854E-07  0.957E-03    2.46       2.2  T
   3    -36.8409802  0.137137E-06  0.323E-03    2.46       6.6  T
   4    -36.8409804 -0.154874E-06  0.944E-04    2.46      22.6  T
   5    -36.8409804 -0.624031E-08  0.367E-04    2.46      58.2  T
     SCC iter.                  ...        0 min,  0.006 sec
     gradient                   ...        0 min,  0.016 sec
 * total energy  :   -36.2377526 Eh     change       -0.4383102E-05 Eh
   gradient norm :     0.0004773 Eh/α   predicted    -0.3912759E-05 ( -10.73%)
   displ. norm   :     0.0274216 α      lambda       -0.1227423E-05
   maximum displ.:     0.0166658 α      in ANC's #4, #2, #1, ...

   *** GEOMETRY OPTIMIZATION CONVERGED AFTER 18 ITERATIONS ***

------------------------------------------------------------------------
 total energy gain   :        -0.0108962 Eh       -6.8375 kcal/mol
 total RMSD          :         0.4435995 a0        0.2347 Å
 total power (kW/mol):        -1.5893278 (step)  -46.9498 (real)
------------------------------------------------------------------------

 ANCopt (total)                0 d,  0 h,  0 min,  0.609 sec
 optimizer setup                ...        0 min,  0.000 sec (  0.025%)
 model hessian                  ...        0 min,  0.003 sec (  0.463%)
 ANC generation                 ...        0 min,  0.001 sec (  0.104%)
 coordinate transformation      ...        0 min,  0.000 sec (  0.049%)
 single point calculation       ...        0 min,  0.599 sec ( 98.290%)
 optimization log               ...        0 min,  0.002 sec (  0.273%)
 hessian update                 ...        0 min,  0.000 sec (  0.038%)
 rational function              ...        0 min,  0.003 sec (  0.569%)

================
 final structure:
================
$coord
   -4.23267556571051   -3.40283912307998   -0.04479285268947      C 
   -6.35625118242391   -2.00112060417066   -0.04474722698391      C 
   -5.79059304555802    1.21966476816635    0.05296615096856      S 
   -2.52907848725156    0.71670127382606    0.07530029449878      C 
   -1.99005925404598   -1.90443371420194    0.01114299444700      C 
    0.50099967269091   -2.74087948221085   -0.03512886685720      C 
    2.37789663852612   -0.93621162668619   -0.03436013646150      C 
    1.85911548852426    1.68746759274193   -0.00622407446674      C 
    4.13922854405463    3.13131249492469   -0.00168800988622      C 
    6.23755668425359    1.68696995941918   -0.04311668313759      C 
    5.62058121445442   -1.52498811514336   -0.08091884633853      S 
   -0.65064431432379    2.56040356235368    0.05130306942066      C 
   -1.16222643811706    5.26783206331835    0.01406252546288      C 
   -3.11537035980343    6.41250472327752    1.09060851108328      C 
   -4.20406693020652   -5.43391262598923   -0.09484599476605      H 
   -8.27966328021778   -2.64037044273155   -0.08042639155140      H 
    0.93632198444785   -4.73077462817349   -0.08388197584879      H 
    4.19429014299855    5.16099397133230    0.04969355768948      H 
    8.16985964683093    2.29952973441609   -0.04907257393778      H 
    0.22883244225242    6.38832611655113   -0.98307800398104      H 
   -4.51255340286562    5.40850940489748    2.17513478472206      H 
   -3.35816872655679    8.42807301107768    0.95892514258880      H 
$end
           -------------------------------------------------
          |                Final Singlepoint                |
           -------------------------------------------------

          ...................................................
          :                      SETUP                      :
          :.................................................:
          :  # basis functions                  76          :
          :  # atomic orbitals                  74          :
          :  # shells                           38          :
          :  # electrons                        68          :
          :  max. iterations                   250          :
          :  Hamiltonian                  GFN2-xTB          :
          :  restarted?                      false          :
          :  GBSA solvation                  false          :
          :  PC potential                    false          :
          :  electronic temp.          300.0000000     K    :
          :  accuracy                    1.0000000          :
          :  -> integral cutoff          0.2500000E+02      :
          :  -> integral neglect         0.1000000E-07      :
          :  -> SCF convergence          0.1000000E-05 Eh   :
          :  -> wf. convergence          0.1000000E-03 e    :
          :  Broyden damping             0.4000000          :
          ...................................................

 iter      E             dE          RMSdq      gap      omega  full diag
   1    -36.8409804 -0.368410E+02  0.198E-04    2.46       0.0  T
   2    -36.8409804 -0.860254E-10  0.836E-05    2.46     255.1  T
   3    -36.8409804 -0.915961E-10  0.735E-05    2.46     290.1  T

   *** convergence criteria satisfied after 3 iterations ***

         #    Occupation            Energy/Eh            Energy/eV
      -------------------------------------------------------------
         1        2.0000           -0.7290363             -19.8381
       ...           ...                  ...                  ...
        28        2.0000           -0.4379116             -11.9162
        29        2.0000           -0.4369082             -11.8889
        30        2.0000           -0.4257987             -11.5866
        31        2.0000           -0.4097003             -11.1485
        32        2.0000           -0.3978750             -10.8267
        33        2.0000           -0.3921177             -10.6701
        34        2.0000           -0.3632191              -9.8837 (HOMO)
        35                         -0.2729430              -7.4272 (LUMO)
        36                         -0.2439475              -6.6381
        37                         -0.2213298              -6.0227
        38                         -0.2065116              -5.6195
        39                         -0.2026348              -5.5140
       ...                                ...                  ...
        74                          0.7179996              19.5378
      -------------------------------------------------------------
                  HL-Gap            0.0902760 Eh            2.4565 eV
             Fermi-level           -0.3180811 Eh           -8.6554 eV

 SCC (total)                   0 d,  0 h,  0 min,  0.031 sec
 SCC setup                      ...        0 min,  0.000 sec (  0.637%)
 Dispersion                     ...        0 min,  0.000 sec (  0.628%)
 integral evaluation            ...        0 min,  0.010 sec ( 33.101%)
 zeroth order Hamiltonian       ...        0 min,  0.000 sec (  0.603%)
 iterations                     ...        0 min,  0.004 sec ( 13.794%)
 molecular gradient             ...        0 min,  0.016 sec ( 49.989%)
 printout                       ...        0 min,  0.000 sec (  1.087%)

         :::::::::::::::::::::::::::::::::::::::::::::::::::::
         ::                     SUMMARY                     ::
         :::::::::::::::::::::::::::::::::::::::::::::::::::::
         :: total energy             -36.237752631103 Eh    ::
         :: gradient norm              0.000477404191 Eh/a0 ::
         :: HOMO-LUMO gap              2.456535317782 eV    ::
         ::.................................................::
         :: SCC energy               -36.840980412110 Eh    ::
         :: -> isotropic ES            0.001875038658 Eh    ::
         :: -> anisotropic ES          0.002260926750 Eh    ::
         :: -> anisotropic XC          0.019513780412 Eh    ::
         :: -> dispersion             -0.028073606406 Eh    ::
         :: repulsion energy           0.603130454441 Eh    ::
         :: add. restraining           0.000000000000 Eh    ::
         :::::::::::::::::::::::::::::::::::::::::::::::::::::

           -------------------------------------------------
          |                Property Printout                |
           -------------------------------------------------

    * Orbital Energies and Occupations

         #    Occupation            Energy/Eh            Energy/eV
      -------------------------------------------------------------
         1        2.0000           -0.7290363             -19.8381
       ...           ...                  ...                  ...
        22        2.0000           -0.4769665             -12.9789
        23        2.0000           -0.4662761             -12.6880
        24        2.0000           -0.4611699             -12.5491
        25        2.0000           -0.4569977             -12.4355
        26        2.0000           -0.4531116             -12.3298
        27        2.0000           -0.4504616             -12.2577
        28        2.0000           -0.4379116             -11.9162
        29        2.0000           -0.4369082             -11.8889
        30        2.0000           -0.4257987             -11.5866
        31        2.0000           -0.4097003             -11.1485
        32        2.0000           -0.3978750             -10.8267
        33        2.0000           -0.3921177             -10.6701
        34        2.0000           -0.3632191              -9.8837 (HOMO)
        35                         -0.2729430              -7.4272 (LUMO)
        36                         -0.2439475              -6.6381
        37                         -0.2213298              -6.0227
        38                         -0.2065116              -5.6195
        39                         -0.2026348              -5.5140
        40                         -0.1941409              -5.2828
        41                         -0.1599443              -4.3523
        42                         -0.1219136              -3.3174
        43                         -0.1158582              -3.1527
        44                         -0.0960316              -2.6132
        45                         -0.0070019              -0.1905
       ...                                ...                  ...
        74                          0.7179996              19.5378
      -------------------------------------------------------------
                  HL-Gap            0.0902760 Eh            2.4565 eV
             Fermi-level           -0.3180811 Eh           -8.6554 eV

     #   Z        covCN         q      C6AA      α(0)
     1   6 C      3.072    -0.050    29.154     8.853
     2   6 C      2.934    -0.010    28.271     8.720
     3  16 S      2.258    -0.059   143.508    20.162
     4   6 C      3.002     0.024    27.461     8.596
     5   6 C      3.154     0.000    27.726     8.611
     6   6 C      2.935    -0.048    29.180     8.859
     7   6 C      3.007     0.029    27.332     8.576
     8   6 C      3.141    -0.006    27.934     8.649
     9   6 C      3.072    -0.048    29.110     8.846
    10   6 C      2.933    -0.010    28.258     8.718
    11  16 S      2.247    -0.062   143.641    20.172
    12   6 C      2.982     0.001    27.998     8.680
    13   6 C      2.893    -0.026    28.658     8.777
    14   6 C      2.838    -0.084    30.101     8.991
    15   1 H      0.926     0.040     2.449     2.447
    16   1 H      0.926     0.045     2.381     2.413
    17   1 H      0.926     0.044     2.398     2.422
    18   1 H      0.926     0.040     2.444     2.445
    19   1 H      0.926     0.045     2.384     2.414
    20   1 H      0.925     0.041     2.437     2.441
    21   1 H      0.926     0.052     2.297     2.370
    22   1 H      0.926     0.042     2.422     2.434

 Mol. C6AA /au·bohr⁶  :      10058.412477
 Mol. C8AA /au·bohr⁸  :     307608.538357
 Mol. α(0) /au        :        164.596736


Wiberg/Mayer (AO) data.
largest (>0.10) Wiberg bond orders for each atom
          total WBO             WBO to atom ...
     1  C   3.983        C    2 1.692    C    5 1.183    H   15 0.963    S    3 0.101
     2  C   3.945        C    1 1.692    S    3 1.145    H   16 0.970
     3  S   2.542        C    2 1.145    C    4 1.101    C    1 0.101
     4  C   3.956        C   12 1.367    C    5 1.262    S    3 1.101
     5  C   3.987        C    6 1.352    C    4 1.262    C    1 1.183
     6  C   3.990        C    7 1.425    C    5 1.352    H   17 0.966
     7  C   3.956        C    6 1.425    C    8 1.261    S   11 1.095
     8  C   3.986        C   12 1.297    C    7 1.261    C    9 1.194
     9  C   3.984        C   10 1.684    C    8 1.194    H   18 0.960    S   11 0.102
    10  C   3.933        C    9 1.684    S   11 1.148    H   19 0.970
    11  S   2.515        C   10 1.148    C    7 1.095    C    9 0.102
    12  C   3.988        C    4 1.367    C    8 1.297    C   13 1.084
    13  C   3.991        C   14 1.904    C   12 1.084    H   20 0.958
    14  C   3.978        C   13 1.904    H   22 0.977    H   21 0.968
    15  H   0.998        C    1 0.963
    16  H   0.997        C    2 0.970
    17  H   0.997        C    6 0.966
    18  H   0.998        C    9 0.960
    19  H   0.997        C   10 0.970
    20  H   0.998        C   13 0.958
    21  H   0.997        C   14 0.968
    22  H   0.997        C   14 0.977

molecular dipole:
                 x           y           z       tot (Debye)
 q only:       -0.055       0.141       0.017
   full:       -0.014       0.112      -0.010       0.287
molecular quadrupole (traceless):
                xx          xy          yy          xz          yz          zz
 q only:       -0.091       3.293       2.941      -0.453       0.199      -2.850
  q+dip:        0.189       8.122       6.056      -1.231      -0.032      -6.245
   full:       -1.289       8.592       4.471      -0.468       0.010      -3.182

           -------------------------------------------------
          |                Geometry Summary                 |
           -------------------------------------------------

      molecular mass/u    :      216.3152000
   center of mass at/Å    :       -0.1747701       0.3206080       0.0328074
  moments of inertia/u·Å² :        0.4809209E+03   0.1131334E+04   0.1604836E+04
rotational constants/cm⁻¹ :        0.3505282E-01   0.1490067E-01   0.1050427E-01

 * 23 selected distances

     #   Z        #   Z                                     value/Å
     1   6 C      2   6 C                                 1.3464820
     2   6 C      3  16 S                                 1.7312247
     3  16 S      4   6 C                                 1.7463610 (max)
     1   6 C      5   6 C                                 1.4275703
     4   6 C      5   6 C                                 1.4164768
     5   6 C      6   6 C                                 1.3907557
     6   6 C      7   6 C                                 1.3778509
     7   6 C      8   6 C                                 1.4153507
     8   6 C      9   6 C                                 1.4281537
     9   6 C     10   6 C                                 1.3481898
     7   6 C     11  16 S                                 1.7441853
    10   6 C     11  16 S                                 1.7308839
     4   6 C     12   6 C                                 1.3928855
     8   6 C     12   6 C                                 1.4064792
    13   6 C     14   6 C                                 1.3265365
     1   6 C     15   1 H                                 1.0752308
     2   6 C     16   1 H                                 1.0727335
     6   6 C     17   1 H                                 1.0782193
     9   6 C     18   1 H                                 1.0748004
    10   6 C     19   1 H                                 1.0726855 (min)
    13   6 C     20   1 H                                 1.0825318
    14   6 C     21   1 H                                 1.0762384
    14   6 C     22   1 H                                 1.0765613

 * 3 distinct bonds (by element types)

   Z      Z             #   av. dist./Å        max./Å        min./Å
   1 H    6 C           8     1.0761251     1.0825318     1.0726855
   6 C    6 C          11     1.3887937     1.4281537     1.3265365
   6 C   16 S           4     1.7381637     1.7463610     1.7308839


optimized geometry written to: xtbopt.xyz


           -------------------------------------------------
          | TOTAL ENERGY              -36.237752631103 Eh   |
          | GRADIENT NORM               0.000477404191 Eh/α |
          | HOMO-LUMO GAP               2.456535317782 eV   |
           -------------------------------------------------

------------------------------------------------------------------------
 * finished run on 2021/05/19 at 10:59:21.129     
------------------------------------------------------------------------
 total:
 * wall-time:     0 d,  0 h,  0 min,  0.709 sec
 *  cpu-time:     0 d,  0 h,  0 min,  0.706 sec
 * ratio c/w:     0.996 speedup
 SCF:
 * wall-time:     0 d,  0 h,  0 min,  0.045 sec
 *  cpu-time:     0 d,  0 h,  0 min,  0.045 sec
 * ratio c/w:     0.997 speedup
 ANC optimizer:
 * wall-time:     0 d,  0 h,  0 min,  0.641 sec
 *  cpu-time:     0 d,  0 h,  0 min,  0.640 sec
 * ratio c/w:     0.998 speedup

