      -----------------------------------------------------------      
     |                   =====================                   |     
     |                           x T B                           |     
     |                   =====================                   |     
     |                         S. Grimme                         |     
     |          Mulliken Center for Theoretical Chemistry        |     
     |                    University of Bonn                     |     
     |                Version 6.2 RC2 (SAW190805)                |     
      -----------------------------------------------------------      

   This program is distributed in the hope that it will be useful,
   but WITHOUT ANY WARRANTY; without even the implied warranty of
   MERCHANTABILITY or FITNESS FOR A PARTICULAR PURPOSE.
   
   FOR NON-COMMERCIAL, ACADEMIA USE ONLY.
   
   Cite this work as:
   * S. Grimme, C. Bannwarth, P. Shushkov, J. Chem. Theory Comput., 2017,
     13, 1989-2009. DOI: 10.1021/acs.jctc.7b00118
   * C. Bannwarth, S. Ehlert and S. Grimme., J. Chem. Theory Comput., 2019,
     15, 1652-1671. DOI: 10.1021/acs.jctc.8b01176
   * P. Pracht, E. Caldeweyher, S. Ehlert, S. Grimme, ChemRxiv, 2019, preprint.
     DOI: 10.26434/chemrxiv.8326202.v1
   
   for DFT-D4:
   * E. Caldeweyher, C. Bannwarth and S. Grimme, J. Chem. Phys., 2017,
     147, 034112. DOI: 10.1063/1.4993215
   * E. Caldeweyher, S. Ehlert, A. Hansen, H. Neugebauer, S. Spicher,
     C. Bannwarth and S. Grimme, J. Chem. Phys., 2019, 150, 154122.
     DOI: 10.1063/1.5090222
   
   for sTDA-xTB:
   * S. Grimme and C. Bannwarth, J. Chem. Phys., 2016, 145, 054103.
     DOI: 10.1063/1.4959605
   
   in the mass-spec context:
   * V. Asgeirsson, C. Bauer and S. Grimme, Chem. Sci., 2017, 8, 4879.
     DOI: 10.1039/c7sc00601b
   
   for metadynamics refer to:
   * S. Grimme, J. Chem. Theory Comput., 2019, 155, 2847-2862
     DOI: 10.1021/acs.jctc.9b00143
   
   with help from (in alphabetical order)
   C. Bannwarth, F. Bohle, G. Brandenburg, E. Caldeweyher, M. Checinski,
   S. Dohm, S. Ehlert, S. Ehrlich, F. März, H. Neugebauer, J. Pisarek,
   P. Pracht, P. Shushkov, and S. Spicher.
   
 * started run on 2021/05/19 at 10:59:21.148     

           -------------------------------------------------
          |                Calculation Setup                |
           -------------------------------------------------

          program call               : /ihome/ghutchison/geoffh/xtb/xtb 520.xyz -opt
          hostname                   : smp-n144
          coordinate file            : 520.xyz
          omp threads                :                     1
          number of atoms            :                    30
          number of electrons        :                    78
          charge                     :                     0
          spin                       :                   0.0
          first test random number   :      0.71531436257144


########################################################################
# WARNING! Please study the warnings concerning your input carefully
#  - the use of '-opt' is discouraged, please use '--opt' next time
########################################################################

           ------------------------------------------------- 
          |                 G F N 2 - x T B                 |
          | Geometry, Frequencies, Noncovalent interactions |
          |            JCTC 2019 parametrisation            |
           ------------------------------------------------- 
             KAB for C  - Si     :                1.0500
             KAB for H  - Pd     :                0.9500
             k(s)              :                1.8500
             k(p)              :                2.2300
             k(d)              :                2.2300
             k(f)              :                2.0000
             kEN (H0ij)        :               -2.0000
             D4 a1             :                0.5200
             D4 a2             :                5.0000
             D4 s6             :                1.0000
             D4 s8             :                2.7000
             D4 s9             :                5.0000
             alphaj            :                2.0000

  Z AO/shell   Hii/eV     exponent
  1     Wed Apr 25 08:07:45 CEST 2018   EN: 2.200 GM2: 0.406  GM3: 0.0800  RAES: 1.40
     1s    -10.707211    1.230000
  6     Wed Apr 25 08:07:45 CEST 2018   EN: 2.550 GM2: 0.538  GM3: 0.1500  RAES: 3.00
     2s    -13.970922    2.096432
     2p    -10.063292    1.800000
  7     Wed Apr 25 08:07:45 CEST 2018   EN: 3.040 GM2: 0.461  GM3:-0.0640  RAES: 1.90
     2s    -16.686243    2.339881
     2p    -12.523956    2.014332

           ------------------------------------------------- 
          |        Self-Consistent Charge Iterations        |
           ------------------------------------------------- 

          ...................................................
          :                      SETUP                      :
          :.................................................:
          :  # basis functions                  72          :
          :  # atomic orbitals                  72          :
          :  # shells                           44          :
          :  # electrons                        78          :
          :  max. iterations                   250          :
          :  Hamiltonian                  GFN2-xTB          :
          :  restarted?                      false          :
          :  GBSA solvation                  false          :
          :  PC potential                    false          :
          :  electronic temp.          300.0000000     K    :
          :  accuracy                    1.0000000          :
          :  -> integral cutoff          0.2500000E+02      :
          :  -> integral neglect         0.1000000E-07      :
          :  -> SCF convergence          0.1000000E-05 Eh   :
          :  -> wf. convergence          0.1000000E-03 e    :
          :  Broyden damping             0.4000000          :
          ...................................................

 iter      E             dE          RMSdq      gap      omega  full diag
   1    -43.1720372 -0.431720E+02  0.361E+00    4.35       0.0  T
   2    -43.2227566 -0.507195E-01  0.243E+00    4.55       1.0  T
   3    -43.2233441 -0.587428E-03  0.137E+00    4.64       1.0  T
   4    -43.2369300 -0.135859E-01  0.464E-01    4.55       1.0  T
   5    -43.2400517 -0.312175E-02  0.994E-02    4.58       1.0  T
   6    -43.2401504 -0.986865E-04  0.376E-02    4.58       1.0  T
   7    -43.2401530 -0.260143E-05  0.119E-02    4.57       1.5  T
   8    -43.2401537 -0.710311E-06  0.236E-03    4.57       7.8  T
   9    -43.2401538 -0.217073E-07  0.969E-04    4.57      18.8  T
  10    -43.2401538 -0.407067E-08  0.307E-04    4.57      59.4  T

   *** convergence criteria satisfied after 10 iterations ***

         #    Occupation            Energy/Eh            Energy/eV
      -------------------------------------------------------------
         1        2.0000           -0.6830494             -18.5867
       ...           ...                  ...                  ...
        33        2.0000           -0.4276722             -11.6376
        34        2.0000           -0.3988694             -10.8538
        35        2.0000           -0.3943298             -10.7303
        36        2.0000           -0.3844256             -10.4608
        37        2.0000           -0.3798924             -10.3374
        38        2.0000           -0.3661706              -9.9640
        39        2.0000           -0.3381614              -9.2018 (HOMO)
        40                         -0.1700653              -4.6277 (LUMO)
        41                         -0.0672466              -1.8299
        42                         -0.0290171              -0.7896
        43                         -0.0213053              -0.5797
        44                          0.0101251               0.2755
       ...                                ...                  ...
        72                          0.6247071              16.9991
      -------------------------------------------------------------
                  HL-Gap            0.1680961 Eh            4.5741 eV
             Fermi-level           -0.2541133 Eh           -6.9148 eV

 SCC (total)                   0 d,  0 h,  0 min,  0.040 sec
 SCC setup                      ...        0 min,  0.000 sec (  0.838%)
 Dispersion                     ...        0 min,  0.000 sec (  1.100%)
 integral evaluation            ...        0 min,  0.009 sec ( 23.492%)
 zeroth order Hamiltonian       ...        0 min,  0.000 sec (  0.482%)
 iterations                     ...        0 min,  0.014 sec ( 33.717%)
 molecular gradient             ...        0 min,  0.016 sec ( 39.236%)
 printout                       ...        0 min,  0.000 sec (  1.013%)

         :::::::::::::::::::::::::::::::::::::::::::::::::::::
         ::                     SUMMARY                     ::
         :::::::::::::::::::::::::::::::::::::::::::::::::::::
         :: total energy             -42.761392167677 Eh    ::
         :: gradient norm              0.076251731492 Eh/a0 ::
         :: HOMO-LUMO gap              4.574126355720 eV    ::
         ::.................................................::
         :: SCC energy               -43.240153762880 Eh    ::
         :: -> isotropic ES            0.050778513592 Eh    ::
         :: -> anisotropic ES          0.006507290794 Eh    ::
         :: -> anisotropic XC          0.040524492695 Eh    ::
         :: -> dispersion             -0.028762810866 Eh    ::
         :: repulsion energy           0.478597912768 Eh    ::
         :: add. restraining           0.000000000000 Eh    ::
         :::::::::::::::::::::::::::::::::::::::::::::::::::::

      ----------------------------------------------------------- 
     |                   =====================                   |
     |                        A N C O P T                        |
     |                   =====================                   |
     |               Approximate Normal Coordinate               |
     |                Rational Function Optimizer                |
      ----------------------------------------------------------- 

          ...................................................
          :                      SETUP                      :
          :.................................................:
          :   optimization level            normal          :
          :   max. optcycles                   200          :
          :   ANC micro-cycles                  20          :
          :   degrees of freedom                84          :
          :.................................................:
          :   RF solver                   davidson          :
          :   input Hessian                  false          :
          :   write xtbopt.log                true          :
          :   linear?                        false          :
          :   energy convergence         0.5000000E-05 Eh   :
          :   grad. convergence          0.1000000E-02 Eh/α :
          :   maximium RF displ.         2.0000000          :
          :   Hlow (freq-cutoff)         0.5000000E-02      :
          :   Hmax (freq-cutoff)         5.0000000          :
          :   S6 in model hess.         20.0000000          :
          ...................................................

generating ANC from model Hessian ...
Using Lindh-Hessian (1995)
 Shifting diagonal of input Hessian by   3.124622314723226E-003
 Lowest  eigenvalues of input Hessian
   -0.000000   -0.000000   -0.000000   -0.000000   -0.000000    0.000000
    0.005000    0.005841    0.007214    0.008361    0.012484    0.016296
    0.018388    0.019883    0.021097    0.022915    0.027049    0.030746
 Highest eigenvalues
    1.426308    1.487515    1.503034    1.553603    1.766841    2.113512
 

........................................................................
.............................. CYCLE    1 ..............................
........................................................................
   1    -43.2401538 -0.432402E+02  0.121E-04    4.57       0.0  T
   2    -43.2401538 -0.508891E-10  0.684E-05    4.57     266.9  T
   3    -43.2401538 -0.429878E-11  0.514E-05    4.57     355.4  T
     SCC iter.                  ...        0 min,  0.005 sec
     gradient                   ...        0 min,  0.016 sec
 * total energy  :   -42.7613922 Eh     change       -0.3750827E-07 Eh
   gradient norm :     0.0762514 Eh/α   predicted     0.0000000E+00 (-100.00%)
   displ. norm   :     0.4815243 α      lambda       -0.2385414E-01
   maximum displ.:     0.2224633 α      in ANC's #18, #17, #35, ...

........................................................................
.............................. CYCLE    2 ..............................
........................................................................
   1    -43.2623726 -0.432624E+02  0.407E-01    4.62       0.0  T
   2    -43.2625260 -0.153366E-03  0.234E-01    4.63       1.0  T
   3    -43.2625232  0.279215E-05  0.389E-02    4.62       1.0  T
   4    -43.2625533 -0.300983E-04  0.110E-02    4.63       1.7  T
   5    -43.2625535 -0.253278E-06  0.672E-03    4.63       2.7  T
   6    -43.2625540 -0.442422E-06  0.229E-03    4.63       8.0  T
   7    -43.2625540 -0.612021E-07  0.517E-04    4.63      35.3  T
     SCC iter.                  ...        0 min,  0.009 sec
     gradient                   ...        0 min,  0.015 sec
 * total energy  :   -42.7774608 Eh     change       -0.1606859E-01 Eh
   gradient norm :     0.0321179 Eh/α   predicted    -0.1469255E-01 (  -8.56%)
   displ. norm   :     0.3744992 α      lambda       -0.6858930E-02
   maximum displ.:     0.1668020 α      in ANC's #3, #18, #20, ...

........................................................................
.............................. CYCLE    3 ..............................
........................................................................
   1    -43.2717555 -0.432718E+02  0.300E-01    4.63       0.0  T
   2    -43.2718435 -0.880560E-04  0.171E-01    4.65       1.0  T
   3    -43.2718449 -0.140766E-05  0.282E-02    4.64       1.0  T
   4    -43.2718605 -0.155839E-04  0.794E-03    4.64       2.3  T
   5    -43.2718606 -0.749727E-07  0.279E-03    4.64       6.5  T
   6    -43.2718606 -0.201717E-07  0.123E-03    4.64      14.8  T
     SCC iter.                  ...        0 min,  0.008 sec
     gradient                   ...        0 min,  0.015 sec
 * total energy  :   -42.7815709 Eh     change       -0.4110111E-02 Eh
   gradient norm :     0.0159107 Eh/α   predicted    -0.3910485E-02 (  -4.86%)
   displ. norm   :     0.2466085 α      lambda       -0.1302103E-02
   maximum displ.:     0.1824160 α      in ANC's #3, #7, #1, ...

........................................................................
.............................. CYCLE    4 ..............................
........................................................................
   1    -43.2740488 -0.432740E+02  0.171E-01    4.63       0.0  T
   2    -43.2740723 -0.234923E-04  0.955E-02    4.64       1.0  T
   3    -43.2740733 -0.102114E-05  0.163E-02    4.63       1.1  T
   4    -43.2740778 -0.446102E-05  0.560E-03    4.63       3.3  T
   5    -43.2740780 -0.207378E-06  0.321E-03    4.63       5.7  T
   6    -43.2740781 -0.883506E-07  0.560E-04    4.63      32.6  T
   7    -43.2740781 -0.171819E-08  0.199E-04    4.63      92.0  T
     SCC iter.                  ...        0 min,  0.009 sec
     gradient                   ...        0 min,  0.015 sec
 * total energy  :   -42.7824557 Eh     change       -0.8847623E-03 Eh
   gradient norm :     0.0115502 Eh/α   predicted    -0.6906472E-03 ( -21.94%)
   displ. norm   :     0.2186709 α      lambda       -0.6292927E-03
   maximum displ.:     0.1703531 α      in ANC's #3, #1, #7, ...

........................................................................
.............................. CYCLE    5 ..............................
........................................................................
   1    -43.2762537 -0.432763E+02  0.143E-01    4.62       0.0  T
   2    -43.2762702 -0.164817E-04  0.793E-02    4.62       1.0  T
   3    -43.2762710 -0.777057E-06  0.138E-02    4.61       1.3  T
   4    -43.2762740 -0.300122E-05  0.512E-03    4.62       3.6  T
   5    -43.2762742 -0.230366E-06  0.269E-03    4.62       6.8  T
   6    -43.2762743 -0.498945E-07  0.577E-04    4.62      31.6  T
     SCC iter.                  ...        0 min,  0.008 sec
     gradient                   ...        0 min,  0.015 sec
 * total energy  :   -42.7828680 Eh     change       -0.4122879E-03 Eh
   gradient norm :     0.0059205 Eh/α   predicted    -0.3296973E-03 ( -20.03%)
   displ. norm   :     0.1777556 α      lambda       -0.2641905E-03
   maximum displ.:     0.1160784 α      in ANC's #3, #1, #7, ...

........................................................................
.............................. CYCLE    6 ..............................
........................................................................
   1    -43.2777576 -0.432778E+02  0.111E-01    4.61       0.0  T
   2    -43.2777660 -0.839411E-05  0.618E-02    4.61       1.0  T
   3    -43.2777636  0.238886E-05  0.154E-02    4.61       1.2  T
   4    -43.2777683 -0.462982E-05  0.482E-03    4.61       3.8  T
   5    -43.2777686 -0.334577E-06  0.200E-03    4.61       9.1  T
   6    -43.2777686 -0.853223E-08  0.409E-04    4.61      44.6  T
     SCC iter.                  ...        0 min,  0.008 sec
     gradient                   ...        0 min,  0.015 sec
 * total energy  :   -42.7830496 Eh     change       -0.1816014E-03 Eh
   gradient norm :     0.0047347 Eh/α   predicted    -0.1362794E-03 ( -24.96%)
   displ. norm   :     0.1714703 α      lambda       -0.1822139E-03
   maximum displ.:     0.1298828 α      in ANC's #1, #3, #7, ...

........................................................................
.............................. CYCLE    7 ..............................
........................................................................
   1    -43.2786753 -0.432787E+02  0.115E-01    4.60       0.0  T
   2    -43.2786822 -0.683058E-05  0.644E-02    4.60       1.0  T
   3    -43.2786767  0.542858E-05  0.191E-02    4.60       1.0  T
   4    -43.2786850 -0.831101E-05  0.392E-03    4.60       4.7  T
   5    -43.2786852 -0.135353E-06  0.181E-03    4.60      10.1  T
   6    -43.2786852 -0.496981E-08  0.312E-04    4.60      58.6  T
     SCC iter.                  ...        0 min,  0.008 sec
     gradient                   ...        0 min,  0.015 sec
 * total energy  :   -42.7831910 Eh     change       -0.1414493E-03 Eh
   gradient norm :     0.0049929 Eh/α   predicted    -0.9378643E-04 ( -33.70%)
   displ. norm   :     0.2218054 α      lambda       -0.2150789E-03
   maximum displ.:     0.1896971 α      in ANC's #1, #3, #7, ...

........................................................................
.............................. CYCLE    8 ..............................
........................................................................
   1    -43.2789861 -0.432790E+02  0.152E-01    4.60       0.0  T
   2    -43.2789970 -0.108355E-04  0.853E-02    4.60       1.0  T
   3    -43.2789792  0.177109E-04  0.325E-02    4.60       1.0  T
   4    -43.2790034 -0.241271E-04  0.427E-03    4.60       4.3  T
   5    -43.2790034 -0.680088E-07  0.210E-03    4.60       8.7  T
   6    -43.2790034 -0.935790E-08  0.340E-04    4.60      53.8  T
     SCC iter.                  ...        0 min,  0.008 sec
     gradient                   ...        0 min,  0.015 sec
 * total energy  :   -42.7833745 Eh     change       -0.1835109E-03 Eh
   gradient norm :     0.0053592 Eh/α   predicted    -0.1128339E-03 ( -38.51%)
   displ. norm   :     0.2640545 α      lambda       -0.2649732E-03
   maximum displ.:     0.2355556 α      in ANC's #1, #5, #6, ...

........................................................................
.............................. CYCLE    9 ..............................
........................................................................
   1    -43.2784081 -0.432784E+02  0.185E-01    4.60       0.0  T
   2    -43.2784248 -0.167340E-04  0.104E-01    4.60       1.0  T
   3    -43.2783844  0.404239E-04  0.487E-02    4.59       1.0  T
   4    -43.2784375 -0.530969E-04  0.498E-03    4.60       3.7  T
   5    -43.2784376 -0.719507E-07  0.249E-03    4.59       7.3  T
   6    -43.2784376 -0.144690E-07  0.394E-04    4.59      46.4  T
     SCC iter.                  ...        0 min,  0.008 sec
     gradient                   ...        0 min,  0.015 sec
 * total energy  :   -42.7836032 Eh     change       -0.2286719E-03 Eh
   gradient norm :     0.0051753 Eh/α   predicted    -0.1417247E-03 ( -38.02%)
   displ. norm   :     0.2800449 α      lambda       -0.2673009E-03
   maximum displ.:     0.2521038 α      in ANC's #1, #5, #6, ...

........................................................................
.............................. CYCLE   10 ..............................
........................................................................
   1    -43.2773009 -0.432773E+02  0.190E-01    4.59       0.0  T
   2    -43.2773189 -0.180349E-04  0.107E-01    4.59       1.0  T
   3    -43.2772693  0.496188E-04  0.545E-02    4.59       1.0  T
   4    -43.2773342 -0.649678E-04  0.515E-03    4.59       3.5  T
   5    -43.2773343 -0.757674E-07  0.263E-03    4.59       6.9  T
   6    -43.2773343 -0.169534E-07  0.424E-04    4.59      43.1  T
     SCC iter.                  ...        0 min,  0.008 sec
     gradient                   ...        0 min,  0.015 sec
 * total energy  :   -42.7838232 Eh     change       -0.2199761E-03 Eh
   gradient norm :     0.0047200 Eh/α   predicted    -0.1441358E-03 ( -34.48%)
   displ. norm   :     0.2160265 α      lambda       -0.1864291E-03
   maximum displ.:     0.1958680 α      in ANC's #1, #3, #5, ...

........................................................................
.............................. CYCLE   11 ..............................
........................................................................
   1    -43.2770281 -0.432770E+02  0.133E-01    4.59       0.0  T
   2    -43.2770361 -0.804203E-05  0.747E-02    4.59       1.0  T
   3    -43.2770176  0.184729E-04  0.329E-02    4.59       1.0  T
   4    -43.2770419 -0.242847E-04  0.369E-03    4.59       4.9  T
   5    -43.2770419 -0.274623E-07  0.177E-03    4.59      10.3  T
   6    -43.2770420 -0.105310E-07  0.312E-04    4.59      58.5  T
     SCC iter.                  ...        0 min,  0.008 sec
     gradient                   ...        0 min,  0.015 sec
 * total energy  :   -42.7839748 Eh     change       -0.1516682E-03 Eh
   gradient norm :     0.0040426 Eh/α   predicted    -0.9756506E-04 ( -35.67%)
   displ. norm   :     0.1678471 α      lambda       -0.1304211E-03
   maximum displ.:     0.1514208 α      in ANC's #1, #5, #3, ...

........................................................................
.............................. CYCLE   12 ..............................
........................................................................
   1    -43.2770777 -0.432771E+02  0.930E-02    4.59       0.0  T
   2    -43.2770811 -0.339891E-05  0.521E-02    4.59       1.0  T
   3    -43.2770796  0.151912E-05  0.118E-02    4.59       1.5  T
   4    -43.2770827 -0.305282E-05  0.268E-03    4.59       6.8  T
   5    -43.2770827 -0.237174E-07  0.114E-03    4.59      16.0  T
   6    -43.2770827 -0.519024E-08  0.237E-04    4.59      77.1  T
     SCC iter.                  ...        0 min,  0.008 sec
     gradient                   ...        0 min,  0.015 sec
 * total energy  :   -42.7840830 Eh     change       -0.1081228E-03 Eh
   gradient norm :     0.0033653 Eh/α   predicted    -0.6705070E-04 ( -37.99%)
   displ. norm   :     0.1547201 α      lambda       -0.1112648E-03
   maximum displ.:     0.1383945 α      in ANC's #1, #4, #7, ...

........................................................................
.............................. CYCLE   13 ..............................
........................................................................
   1    -43.2776046 -0.432776E+02  0.844E-02    4.59       0.0  T
   2    -43.2776073 -0.273596E-05  0.473E-02    4.59       1.0  T
   3    -43.2776083 -0.102513E-05  0.325E-03    4.59       5.6  T
   4    -43.2776084 -0.418363E-07  0.188E-03    4.59       9.7  T
   5    -43.2776084 -0.197021E-08  0.880E-04    4.59      20.7  T
   6    -43.2776084 -0.128057E-07  0.188E-04    4.59      97.1  T
     SCC iter.                  ...        0 min,  0.008 sec
     gradient                   ...        0 min,  0.016 sec
 * total energy  :   -42.7841754 Eh     change       -0.9243425E-04 Eh
   gradient norm :     0.0032512 Eh/α   predicted    -0.5696623E-04 ( -38.37%)
   displ. norm   :     0.1787817 α      lambda       -0.1167856E-03
   maximum displ.:     0.1546399 α      in ANC's #1, #4, #5, ...

........................................................................
.............................. CYCLE   14 ..............................
........................................................................
   1    -43.2776435 -0.432776E+02  0.970E-02    4.59       0.0  T
   2    -43.2776470 -0.351536E-05  0.546E-02    4.59       1.0  T
   3    -43.2776483 -0.133925E-05  0.364E-03    4.58       5.0  T
   4    -43.2776483 -0.320624E-07  0.213E-03    4.58       8.6  T
   5    -43.2776484 -0.142486E-07  0.963E-04    4.59      19.0  T
   6    -43.2776484 -0.137154E-07  0.248E-04    4.58      73.6  T
     SCC iter.                  ...        0 min,  0.008 sec
     gradient                   ...        0 min,  0.016 sec
 * total energy  :   -42.7842723 Eh     change       -0.9686354E-04 Eh
   gradient norm :     0.0033729 Eh/α   predicted    -0.6026233E-04 ( -37.79%)
   displ. norm   :     0.2155208 α      lambda       -0.1313674E-03
   maximum displ.:     0.1827887 α      in ANC's #1, #7, #2, ...

........................................................................
.............................. CYCLE   15 ..............................
........................................................................
   1    -43.2778784 -0.432779E+02  0.118E-01    4.58       0.0  T
   2    -43.2778836 -0.521559E-05  0.666E-02    4.58       1.0  T
   3    -43.2778840 -0.449310E-06  0.958E-03    4.58       1.9  T
   4    -43.2778858 -0.180925E-05  0.321E-03    4.58       5.7  T
   5    -43.2778859 -0.370300E-07  0.118E-03    4.58      15.5  T
   6    -43.2778859 -0.614951E-08  0.189E-04    4.58      96.7  T
   7    -43.2778859 -0.210868E-09  0.653E-05    4.58     279.6  T
     SCC iter.                  ...        0 min,  0.009 sec
     gradient                   ...        0 min,  0.016 sec
 * total energy  :   -42.7843878 Eh     change       -0.1155794E-03 Eh
   gradient norm :     0.0035458 Eh/α   predicted    -0.6873636E-04 ( -40.53%)
   displ. norm   :     0.3232389 α      lambda       -0.1853564E-03
   maximum displ.:     0.2685952 α      in ANC's #1, #7, #5, ...

........................................................................
.............................. CYCLE   16 ..............................
........................................................................
   1    -43.2774676 -0.432775E+02  0.176E-01    4.58       0.0  T
   2    -43.2774790 -0.114416E-04  0.992E-02    4.58       1.0  T
   3    -43.2774798 -0.747461E-06  0.145E-02    4.58       1.3  T
   4    -43.2774840 -0.426652E-05  0.474E-03    4.58       3.8  T
   5    -43.2774841 -0.777092E-07  0.151E-03    4.58      12.1  T
   6    -43.2774841 -0.824815E-08  0.290E-04    4.58      62.9  T
   7    -43.2774841 -0.510454E-09  0.870E-05    4.58     209.8  T
     SCC iter.                  ...        0 min,  0.009 sec
     gradient                   ...        0 min,  0.016 sec
 * total energy  :   -42.7845536 Eh     change       -0.1657216E-03 Eh
   gradient norm :     0.0040335 Eh/α   predicted    -0.1023640E-03 ( -38.23%)
   displ. norm   :     0.4904790 α      lambda       -0.2724306E-03
   maximum displ.:     0.4028880 α      in ANC's #1, #5, #2, ...

........................................................................
.............................. CYCLE   17 ..............................
........................................................................
   1    -43.2756950 -0.432757E+02  0.266E-01    4.57       0.0  T
   2    -43.2757211 -0.260933E-04  0.150E-01    4.57       1.0  T
   3    -43.2757182  0.283047E-05  0.258E-02    4.57       1.0  T
   4    -43.2757329 -0.146279E-04  0.720E-03    4.57       2.5  T
   5    -43.2757330 -0.150586E-06  0.230E-03    4.57       7.9  T
   6    -43.2757330 -0.171599E-07  0.480E-04    4.57      38.0  T
     SCC iter.                  ...        0 min,  0.008 sec
     gradient                   ...        0 min,  0.015 sec
 * total energy  :   -42.7847800 Eh     change       -0.2264271E-03 Eh
   gradient norm :     0.0065716 Eh/α   predicted    -0.1689852E-03 ( -25.37%)
   displ. norm   :     0.5790054 α      lambda       -0.3139867E-03
   maximum displ.:     0.4774481 α      in ANC's #1, #5, #2, ...

........................................................................
.............................. CYCLE   18 ..............................
........................................................................
   1    -43.2730540 -0.432731E+02  0.312E-01    4.57       0.0  T
   2    -43.2730899 -0.358498E-04  0.176E-01    4.57       1.0  T
   3    -43.2730914 -0.148434E-05  0.259E-02    4.57       1.0  T
   4    -43.2731054 -0.139748E-04  0.871E-03    4.57       2.1  T
   5    -43.2731057 -0.302416E-06  0.279E-03    4.57       6.6  T
   6    -43.2731057 -0.297875E-07  0.630E-04    4.57      29.0  T
     SCC iter.                  ...        0 min,  0.008 sec
     gradient                   ...        0 min,  0.015 sec
 * total energy  :   -42.7849967 Eh     change       -0.2166733E-03 Eh
   gradient norm :     0.0104827 Eh/α   predicted    -0.2096260E-03 (  -3.25%)
   displ. norm   :     0.3127800 α      lambda       -0.3390480E-03
   maximum displ.:     0.2505396 α      in ANC's #1, #3, #8, ...

........................................................................
.............................. CYCLE   19 ..............................
........................................................................
   1    -43.2756526 -0.432757E+02  0.168E-01    4.58       0.0  T
   2    -43.2756634 -0.108213E-04  0.952E-02    4.58       1.0  T
   3    -43.2756623  0.112457E-05  0.160E-02    4.58       1.1  T
   4    -43.2756677 -0.545625E-05  0.517E-03    4.58       3.5  T
   5    -43.2756679 -0.170510E-06  0.227E-03    4.58       8.0  T
   6    -43.2756679 -0.177742E-07  0.390E-04    4.58      46.8  T
     SCC iter.                  ...        0 min,  0.008 sec
     gradient                   ...        0 min,  0.015 sec
 * total energy  :   -42.7852691 Eh     change       -0.2724301E-03 Eh
   gradient norm :     0.0084070 Eh/α   predicted    -0.1861093E-03 ( -31.69%)
   displ. norm   :     0.4625924 α      lambda       -0.5047127E-03
   maximum displ.:     0.3554512 α      in ANC's #1, #3, #5, ...

........................................................................
.............................. CYCLE   20 ..............................
........................................................................
   1    -43.2774827 -0.432775E+02  0.257E-01    4.57       0.0  T
   2    -43.2775074 -0.247451E-04  0.146E-01    4.57       1.0  T
   3    -43.2774996  0.779058E-05  0.277E-02    4.57       1.0  T
   4    -43.2775171 -0.174794E-04  0.831E-03    4.57       2.2  T
   5    -43.2775177 -0.604096E-06  0.382E-03    4.57       4.8  T
   6    -43.2775177 -0.410488E-07  0.472E-04    4.57      38.7  T
   7    -43.2775177 -0.201931E-08  0.189E-04    4.57      96.6  T
     SCC iter.                  ...        0 min,  0.009 sec
     gradient                   ...        0 min,  0.015 sec
 * total energy  :   -42.7855849 Eh     change       -0.3158287E-03 Eh
   gradient norm :     0.0090407 Eh/α   predicted    -0.3063595E-03 (  -3.00%)
   displ. norm   :     0.3722598 α      lambda       -0.3599880E-03
   maximum displ.:     0.2848423 α      in ANC's #1, #3, #8, ...
 * RMSD in coord.:     0.8386186 α      energy gain  -0.2419275E-01 Eh

generating ANC from model Hessian ...
Using Lindh-Hessian (1995)
 Shifting diagonal of input Hessian by   2.801145061165439E-003
 Lowest  eigenvalues of input Hessian
   -0.000000   -0.000000   -0.000000   -0.000000   -0.000000    0.000000
    0.005000    0.005236    0.007796    0.008945    0.012527    0.014931
    0.018926    0.020394    0.021089    0.025304    0.027889    0.033824
 Highest eigenvalues
    1.515134    1.544386    1.575589    1.635764    1.794510    2.106909
 

........................................................................
.............................. CYCLE   21 ..............................
........................................................................
   1    -43.2796416 -0.432796E+02  0.199E-01    4.60       0.0  T
   2    -43.2796575 -0.158265E-04  0.113E-01    4.59       1.0  T
   3    -43.2796616 -0.416332E-05  0.982E-03    4.59       1.9  T
   4    -43.2796627 -0.105944E-05  0.469E-03    4.59       3.9  T
   5    -43.2796627  0.782549E-09  0.205E-03    4.59       8.9  T
   6    -43.2796627 -0.407006E-07  0.752E-04    4.59      24.3  T
   7    -43.2796627 -0.116765E-07  0.167E-04    4.59     109.3  T
     SCC iter.                  ...        0 min,  0.009 sec
     gradient                   ...        0 min,  0.016 sec
 * total energy  :   -42.7857852 Eh     change       -0.2002452E-03 Eh
   gradient norm :     0.0074568 Eh/α   predicted     0.0000000E+00 (-100.00%)
   displ. norm   :     0.0734217 α      lambda       -0.1192398E-03
   maximum displ.:     0.0528861 α      in ANC's #1, #2, #5, ...

........................................................................
.............................. CYCLE   22 ..............................
........................................................................
   1    -43.2799171 -0.432799E+02  0.509E-02    4.60       0.0  T
   2    -43.2799179 -0.726719E-06  0.294E-02    4.60       1.0  T
   3    -43.2799178  0.512185E-07  0.376E-03    4.60       4.9  T
   4    -43.2799180 -0.231440E-06  0.163E-03    4.60      11.2  T
   5    -43.2799181 -0.355915E-07  0.657E-04    4.60      27.8  T
     SCC iter.                  ...        0 min,  0.007 sec
     gradient                   ...        0 min,  0.015 sec
 * total energy  :   -42.7858692 Eh     change       -0.8405162E-04 Eh
   gradient norm :     0.0030243 Eh/α   predicted    -0.5994368E-04 ( -28.68%)
   displ. norm   :     0.0628105 α      lambda       -0.5961798E-04
   maximum displ.:     0.0350378 α      in ANC's #1, #5, #2, ...

........................................................................
.............................. CYCLE   23 ..............................
........................................................................
   1    -43.2800000 -0.432800E+02  0.486E-02    4.60       0.0  T
   2    -43.2800007 -0.771402E-06  0.281E-02    4.60       1.0  T
   3    -43.2799995  0.128990E-05  0.832E-03    4.60       2.2  T
   4    -43.2800011 -0.168655E-05  0.143E-03    4.60      12.8  T
   5    -43.2800012 -0.874393E-08  0.650E-04    4.60      28.1  T
   6    -43.2800012 -0.839876E-09  0.150E-04    4.60     121.5  T
     SCC iter.                  ...        0 min,  0.008 sec
     gradient                   ...        0 min,  0.016 sec
 * total energy  :   -42.7859078 Eh     change       -0.3863081E-04 Eh
   gradient norm :     0.0019061 Eh/α   predicted    -0.2992706E-04 ( -22.53%)
   displ. norm   :     0.1230242 α      lambda       -0.3780368E-04
   maximum displ.:     0.0782671 α      in ANC's #1, #5, #2, ...

........................................................................
.............................. CYCLE   24 ..............................
........................................................................
   1    -43.2797207 -0.432797E+02  0.830E-02    4.60       0.0  T
   2    -43.2797230 -0.236112E-05  0.474E-02    4.60       1.0  T
   3    -43.2797159  0.717497E-05  0.195E-02    4.60       1.0  T
   4    -43.2797248 -0.894293E-05  0.210E-03    4.60       8.7  T
   5    -43.2797248 -0.896009E-08  0.106E-03    4.60      17.1  T
   6    -43.2797248 -0.186424E-08  0.167E-04    4.60     109.4  T
   7    -43.2797248 -0.390109E-09  0.480E-05    4.60     380.4  T
     SCC iter.                  ...        0 min,  0.009 sec
     gradient                   ...        0 min,  0.016 sec
 * total energy  :   -42.7859416 Eh     change       -0.3372271E-04 Eh
   gradient norm :     0.0033831 Eh/α   predicted    -0.1903043E-04 ( -43.57%)
   displ. norm   :     0.0557304 α      lambda       -0.2337808E-04
   maximum displ.:     0.0394110 α      in ANC's #1, #2, #5, ...

........................................................................
.............................. CYCLE   25 ..............................
........................................................................
   1    -43.2797521 -0.432798E+02  0.355E-02    4.60       0.0  T
   2    -43.2797526 -0.487425E-06  0.202E-02    4.60       1.0  T
   3    -43.2797514  0.124563E-05  0.805E-03    4.60       2.3  T
   4    -43.2797530 -0.157361E-05  0.905E-04    4.60      20.2  T
   5    -43.2797530 -0.283818E-08  0.453E-04    4.60      40.3  T
   6    -43.2797530 -0.331568E-09  0.904E-05    4.60     201.9  T
     SCC iter.                  ...        0 min,  0.008 sec
     gradient                   ...        0 min,  0.016 sec
 * total energy  :   -42.7859611 Eh     change       -0.1955322E-04 Eh
   gradient norm :     0.0023122 Eh/α   predicted    -0.1174680E-04 ( -39.92%)
   displ. norm   :     0.0977843 α      lambda       -0.3267538E-04
   maximum displ.:     0.0709608 α      in ANC's #1, #5, #2, ...

........................................................................
.............................. CYCLE   26 ..............................
........................................................................
   1    -43.2797582 -0.432798E+02  0.601E-02    4.60       0.0  T
   2    -43.2797596 -0.141512E-05  0.340E-02    4.60       1.0  T
   3    -43.2797577  0.191637E-05  0.104E-02    4.60       1.8  T
   4    -43.2797603 -0.261519E-05  0.161E-03    4.60      11.3  T
   5    -43.2797604 -0.128430E-07  0.788E-04    4.60      23.2  T
   6    -43.2797604 -0.145714E-08  0.184E-04    4.60      99.4  T
     SCC iter.                  ...        0 min,  0.008 sec
     gradient                   ...        0 min,  0.016 sec
 * total energy  :   -42.7859839 Eh     change       -0.2276517E-04 Eh
   gradient norm :     0.0012610 Eh/α   predicted    -0.1649596E-04 ( -27.54%)
   displ. norm   :     0.1026708 α      lambda       -0.1305086E-04
   maximum displ.:     0.0771281 α      in ANC's #1, #5, #2, ...

........................................................................
.............................. CYCLE   27 ..............................
........................................................................
   1    -43.2797162 -0.432797E+02  0.608E-02    4.61       0.0  T
   2    -43.2797175 -0.129419E-05  0.343E-02    4.60       1.0  T
   3    -43.2797176 -0.135934E-06  0.422E-03    4.60       4.3  T
   4    -43.2797180 -0.329650E-06  0.172E-03    4.60      10.6  T
   5    -43.2797180 -0.250396E-07  0.782E-04    4.60      23.3  T
   6    -43.2797180 -0.333643E-08  0.162E-04    4.60     112.4  T
     SCC iter.                  ...        0 min,  0.008 sec
     gradient                   ...        0 min,  0.016 sec
 * total energy  :   -42.7859973 Eh     change       -0.1345450E-04 Eh
   gradient norm :     0.0016513 Eh/α   predicted    -0.6558995E-05 ( -51.25%)
   displ. norm   :     0.1032984 α      lambda        0.3586188E-05
   maximum displ.:     0.0779610 α      in ANC's #1, #5, #2, ...

........................................................................
.............................. CYCLE   28 ..............................
........................................................................
   1    -43.2794968 -0.432795E+02  0.612E-02    4.61       0.0  T
   2    -43.2794981 -0.131831E-05  0.346E-02    4.61       1.0  T
   3    -43.2794982 -0.664203E-07  0.459E-03    4.61       4.0  T
   4    -43.2794986 -0.412553E-06  0.173E-03    4.61      10.5  T
   5    -43.2794986 -0.247305E-07  0.791E-04    4.61      23.1  T
   6    -43.2794986 -0.322942E-08  0.166E-04    4.61     109.8  T
     SCC iter.                  ...        0 min,  0.008 sec
     gradient                   ...        0 min,  0.016 sec
 * total energy  :   -42.7859984 Eh     change       -0.1045172E-05 Eh
   gradient norm :     0.0027591 Eh/α   predicted     0.1800069E-05 (-272.23%)
   displ. norm   :     0.0159470 α      lambda       -0.9486776E-05
   maximum displ.:     0.0091525 α      in ANC's #3, #2, #7, ...

........................................................................
.............................. CYCLE   29 ..............................
........................................................................
   1    -43.2797609 -0.432798E+02  0.119E-02    4.61       0.0  T
   2    -43.2797610 -0.928407E-07  0.681E-03    4.61       2.7  T
   3    -43.2797607  0.260176E-06  0.412E-03    4.61       4.4  T
   4    -43.2797611 -0.354383E-06  0.354E-04    4.61      51.5  T
   5    -43.2797611 -0.694790E-09  0.179E-04    4.61     102.1  T
     SCC iter.                  ...        0 min,  0.007 sec
     gradient                   ...        0 min,  0.016 sec
 * total energy  :   -42.7860064 Eh     change       -0.7967306E-05 Eh
   gradient norm :     0.0018115 Eh/α   predicted    -0.4748576E-05 ( -40.40%)
   displ. norm   :     0.0656307 α      lambda       -0.1725259E-04
   maximum displ.:     0.0366004 α      in ANC's #3, #7, #1, ...

........................................................................
.............................. CYCLE   30 ..............................
........................................................................
   1    -43.2801364 -0.432801E+02  0.437E-02    4.61       0.0  T
   2    -43.2801377 -0.125566E-05  0.249E-02    4.61       1.0  T
   3    -43.2801343  0.334911E-05  0.147E-02    4.61       1.2  T
   4    -43.2801388 -0.452767E-05  0.134E-03    4.61      13.6  T
   5    -43.2801388 -0.948555E-08  0.690E-04    4.61      26.5  T
   6    -43.2801388 -0.598682E-09  0.145E-04    4.61     126.1  T
     SCC iter.                  ...        0 min,  0.008 sec
     gradient                   ...        0 min,  0.016 sec
 * total energy  :   -42.7860165 Eh     change       -0.1011068E-04 Eh
   gradient norm :     0.0015617 Eh/α   predicted    -0.8643815E-05 ( -14.51%)
   displ. norm   :     0.0253009 α      lambda       -0.3413518E-05
   maximum displ.:     0.0198726 α      in ANC's #1, #5, #6, ...

........................................................................
.............................. CYCLE   31 ..............................
........................................................................
   1    -43.2800086 -0.432800E+02  0.146E-02    4.61       0.0  T
   2    -43.2800087 -0.104527E-06  0.824E-03    4.61       2.2  T
   3    -43.2800085  0.146113E-06  0.284E-03    4.61       6.4  T
   4    -43.2800087 -0.200126E-06  0.425E-04    4.61      42.9  T
   5    -43.2800087 -0.992067E-09  0.201E-04    4.61      90.8  T
     SCC iter.                  ...        0 min,  0.007 sec
     gradient                   ...        0 min,  0.016 sec
 * total energy  :   -42.7860206 Eh     change       -0.4130618E-05 Eh
   gradient norm :     0.0006562 Eh/α   predicted    -0.1711755E-05 ( -58.56%)
   displ. norm   :     0.0489287 α      lambda       -0.3889450E-05
   maximum displ.:     0.0368126 α      in ANC's #1, #5, #3, ...

   *** GEOMETRY OPTIMIZATION CONVERGED AFTER 31 ITERATIONS ***

------------------------------------------------------------------------
 total energy gain   :        -0.0246284 Eh      -15.4546 kcal/mol
 total RMSD          :         0.9339295 a0        0.4942 Å
 total power (kW/mol):        -2.0858687 (step)  -60.5209 (real)
------------------------------------------------------------------------

 ANCopt (total)                0 d,  0 h,  0 min,  1.068 sec
 optimizer setup                ...        0 min,  0.000 sec (  0.014%)
 model hessian                  ...        0 min,  0.036 sec (  3.332%)
 ANC generation                 ...        0 min,  0.002 sec (  0.172%)
 coordinate transformation      ...        0 min,  0.001 sec (  0.058%)
 single point calculation       ...        0 min,  1.019 sec ( 95.383%)
 optimization log               ...        0 min,  0.003 sec (  0.318%)
 hessian update                 ...        0 min,  0.000 sec (  0.042%)
 rational function              ...        0 min,  0.005 sec (  0.487%)

================
 final structure:
================
$coord
   -4.69251722747698    2.12377963600886   -1.04073096933679      N 
   -6.36460463489494    0.07689398477434   -0.11863314073831      C 
   -4.84401079801697   -2.15217261521126    0.49212198478356      N 
   -2.36581291761425   -1.09287220761599    0.96509539163580      C 
   -0.22511815333431   -2.79675063501623    0.98020956241560      N 
    1.92514735285736   -1.54580382635475   -0.16690759616218      C 
    1.88331072583543    1.24757437771726    0.65702712771427      C 
   -0.11392339395046    2.70146102393711   -0.53304942877662      N 
   -2.18548140478908    1.00531893736674   -1.09060458527143      C 
    4.44276232484300    1.98059063295465    0.06581278183239      N 
    5.91681579911640   -0.08917340754414    1.12985544778796      C 
    4.38443243359816   -2.33705478667600    0.71365779297255      N 
    5.50321819538514   -4.51388589302812   -0.16883582643283      C 
    4.38210172930441   -6.40192390938698   -1.38332450241897      C 
   -4.67883650062590    3.59963906305899    0.18249800411080      H 
   -7.75221135894205   -0.38306083472925   -1.57834157426919      H 
   -7.37573154564324    0.67279020169728    1.58492790794518      H 
   -4.75290466061558   -3.32284785834543   -1.03067570795757      H 
   -2.47654746331589   -0.15658476505809    2.82108447753426      H 
   -0.63414090990101   -4.46918715556703    0.14206833976356      H 
    1.89050673599070   -1.65507017028210   -2.26611231543529      H 
    1.53800702048556    1.27334023392070    2.72097289581546      H 
    0.53648554289660    3.55403865076639   -2.12336066837874      H 
   -1.98674686743237    0.07540505280462   -2.95579192543005      H 
    4.92169796107748    3.67245356299426    0.82797244947489      H 
    6.24416170406926    0.14050749220709    3.18288539500993      H 
    7.74522890469575   -0.21079803753802    0.16769396437681      H 
    7.48914976798893   -4.63324474978468    0.30335250485243      H 
    2.41352823555943   -6.38747892210994   -1.87869880706885      H 
    5.43170910319904   -8.06151925768273   -1.89377776943495      H 
$end
           -------------------------------------------------
          |                Final Singlepoint                |
           -------------------------------------------------

          ...................................................
          :                      SETUP                      :
          :.................................................:
          :  # basis functions                  72          :
          :  # atomic orbitals                  72          :
          :  # shells                           44          :
          :  # electrons                        78          :
          :  max. iterations                   250          :
          :  Hamiltonian                  GFN2-xTB          :
          :  restarted?                      false          :
          :  GBSA solvation                  false          :
          :  PC potential                    false          :
          :  electronic temp.          300.0000000     K    :
          :  accuracy                    1.0000000          :
          :  -> integral cutoff          0.2500000E+02      :
          :  -> integral neglect         0.1000000E-07      :
          :  -> SCF convergence          0.1000000E-05 Eh   :
          :  -> wf. convergence          0.1000000E-03 e    :
          :  Broyden damping             0.4000000          :
          ...................................................

 iter      E             dE          RMSdq      gap      omega  full diag
   1    -43.2800087 -0.432800E+02  0.383E-05    4.61       0.0  T
   2    -43.2800087 -0.209397E-10  0.148E-05    4.61    1231.7  T
   3    -43.2800087 -0.274980E-11  0.883E-06    4.61    2067.5  T

   *** convergence criteria satisfied after 3 iterations ***

         #    Occupation            Energy/Eh            Energy/eV
      -------------------------------------------------------------
         1        2.0000           -0.6846289             -18.6297
       ...           ...                  ...                  ...
        33        2.0000           -0.4340532             -11.8112
        34        2.0000           -0.3939934             -10.7211
        35        2.0000           -0.3897518             -10.6057
        36        2.0000           -0.3761891             -10.2366
        37        2.0000           -0.3743679             -10.1871
        38        2.0000           -0.3622813              -9.8582
        39        2.0000           -0.3484068              -9.4806 (HOMO)
        40                         -0.1790290              -4.8716 (LUMO)
        41                         -0.0567195              -1.5434
        42                          0.0067302               0.1831
        43                          0.0221793               0.6035
        44                          0.0268588               0.7309
       ...                                ...                  ...
        72                          0.6236343              16.9700
      -------------------------------------------------------------
                  HL-Gap            0.1693778 Eh            4.6090 eV
             Fermi-level           -0.2637179 Eh           -7.1761 eV

 SCC (total)                   0 d,  0 h,  0 min,  0.031 sec
 SCC setup                      ...        0 min,  0.000 sec (  0.698%)
 Dispersion                     ...        0 min,  0.000 sec (  0.802%)
 integral evaluation            ...        0 min,  0.009 sec ( 30.083%)
 zeroth order Hamiltonian       ...        0 min,  0.000 sec (  0.576%)
 iterations                     ...        0 min,  0.004 sec ( 14.722%)
 molecular gradient             ...        0 min,  0.016 sec ( 51.740%)
 printout                       ...        0 min,  0.000 sec (  1.179%)

         :::::::::::::::::::::::::::::::::::::::::::::::::::::
         ::                     SUMMARY                     ::
         :::::::::::::::::::::::::::::::::::::::::::::::::::::
         :: total energy             -42.786020611875 Eh    ::
         :: gradient norm              0.000656210020 Eh/a0 ::
         :: HOMO-LUMO gap              4.609004473746 eV    ::
         ::.................................................::
         :: SCC energy               -43.280008725073 Eh    ::
         :: -> isotropic ES            0.050508119185 Eh    ::
         :: -> anisotropic ES          0.006530013621 Eh    ::
         :: -> anisotropic XC          0.039618581764 Eh    ::
         :: -> dispersion             -0.029253026359 Eh    ::
         :: repulsion energy           0.493805090249 Eh    ::
         :: add. restraining           0.000000000000 Eh    ::
         :::::::::::::::::::::::::::::::::::::::::::::::::::::

           -------------------------------------------------
          |                Property Printout                |
           -------------------------------------------------

    * Orbital Energies and Occupations

         #    Occupation            Energy/Eh            Energy/eV
      -------------------------------------------------------------
         1        2.0000           -0.6846289             -18.6297
       ...           ...                  ...                  ...
        27        2.0000           -0.4814097             -13.0998
        28        2.0000           -0.4741896             -12.9034
        29        2.0000           -0.4660803             -12.6827
        30        2.0000           -0.4643433             -12.6354
        31        2.0000           -0.4600329             -12.5181
        32        2.0000           -0.4380320             -11.9195
        33        2.0000           -0.4340532             -11.8112
        34        2.0000           -0.3939934             -10.7211
        35        2.0000           -0.3897518             -10.6057
        36        2.0000           -0.3761891             -10.2366
        37        2.0000           -0.3743679             -10.1871
        38        2.0000           -0.3622813              -9.8582
        39        2.0000           -0.3484068              -9.4806 (HOMO)
        40                         -0.1790290              -4.8716 (LUMO)
        41                         -0.0567195              -1.5434
        42                          0.0067302               0.1831
        43                          0.0221793               0.6035
        44                          0.0268588               0.7309
        45                          0.0355371               0.9670
        46                          0.0452990               1.2326
        47                          0.0472571               1.2859
        48                          0.0561702               1.5285
        49                          0.0701415               1.9086
        50                          0.0745454               2.0285
       ...                                ...                  ...
        72                          0.6236343              16.9700
      -------------------------------------------------------------
                  HL-Gap            0.1693778 Eh            4.6090 eV
             Fermi-level           -0.2637179 Eh           -7.1761 eV

     #   Z        covCN         q      C6AA      α(0)
     1   7 N      2.688    -0.298    27.661     7.811
     2   6 C      3.771     0.080    19.275     6.256
     3   7 N      2.691    -0.283    27.289     7.759
     4   6 C      3.821     0.112    18.733     6.159
     5   7 N      2.682    -0.282    27.269     7.756
     6   6 C      3.803     0.119    18.645     6.147
     7   6 C      3.850     0.123    18.552     6.126
     8   7 N      2.680    -0.290    27.477     7.785
     9   6 C      3.799     0.118    18.661     6.151
    10   7 N      2.711    -0.282    27.264     7.755
    11   6 C      3.780     0.082    19.237     6.248
    12   7 N      2.760    -0.133    23.878     7.257
    13   6 C      2.831     0.024    27.463     8.587
    14   6 C      2.838    -0.134    31.419     9.186
    15   1 H      0.860     0.155     1.370     1.833
    16   1 H      0.924     0.041     2.430     2.438
    17   1 H      0.924     0.036     2.503     2.474
    18   1 H      0.860     0.144     1.445     1.883
    19   1 H      0.923     0.036     2.507     2.476
    20   1 H      0.860     0.157     1.356     1.824
    21   1 H      0.921    -0.003     3.109     2.758
    22   1 H      0.922     0.018     2.769     2.602
    23   1 H      0.860     0.161     1.328     1.805
    24   1 H      0.922    -0.006     3.164     2.782
    25   1 H      0.860     0.153     1.380     1.840
    26   1 H      0.922     0.019     2.741     2.589
    27   1 H      0.924     0.046     2.371     2.408
    28   1 H      0.925     0.032     2.553     2.498
    29   1 H      0.926     0.021     2.724     2.581
    30   1 H      0.926     0.033     2.547     2.496

 Mol. C6AA /au·bohr⁶  :       8398.631807
 Mol. C8AA /au·bohr⁸  :     181943.039437
 Mol. α(0) /au        :        138.272243


Wiberg/Mayer (AO) data.
largest (>0.10) Wiberg bond orders for each atom
          total WBO             WBO to atom ...
     1  N   3.044        C    9 1.000    C    2 0.985    H   15 0.953
     2  C   3.975        N    3 1.005    N    1 0.985    H   17 0.975    H   16 0.975
     3  N   3.062        C    2 1.005    C    4 1.005    H   18 0.953
     4  C   3.973        N    3 1.005    N    5 1.002    H   19 0.953    C    9 0.940
     5  N   3.069        C    4 1.002    C    6 1.001    H   20 0.943
     6  C   3.977        N    5 1.001    N   12 0.982    C    7 0.960    H   21 0.944
     7  C   3.976        N   10 1.003    N    8 0.999    C    6 0.960    H   22 0.949
     8  N   3.062        C    9 1.003    C    7 0.999    H   23 0.948
     9  C   3.975        N    8 1.003    N    1 1.000    H   24 0.953    C    4 0.940
    10  N   3.053        C   11 1.004    C    7 1.003    H   25 0.952
    11  C   3.974        N   10 1.004    N   12 0.987    H   27 0.969    H   26 0.962
    12  N   3.349        C   13 1.136    C   11 0.987    C    6 0.982    C   14 0.142
    13  C   3.966        C   14 1.835    N   12 1.136    H   28 0.960
    14  C   3.971        C   13 1.835    H   30 0.978    H   29 0.973    N   12 0.142
    15  H   0.976        N    1 0.953
    16  H   0.998        C    2 0.975
    17  H   0.999        C    2 0.975
    18  H   0.979        N    3 0.953
    19  H   0.999        C    4 0.953
    20  H   0.975        N    5 0.943
    21  H   1.000        C    6 0.944
    22  H   1.000        C    7 0.949
    23  H   0.974        N    8 0.948
    24  H   1.000        C    9 0.953
    25  H   0.976        N   10 0.952
    26  H   1.000        C   11 0.962
    27  H   0.997        C   11 0.969
    28  H   0.998        C   13 0.960
    29  H   1.000        C   14 0.973
    30  H   0.999        C   14 0.978

molecular dipole:
                 x           y           z       tot (Debye)
 q only:        0.124       0.438       0.072
   full:        0.401       0.460      -0.229       1.655
molecular quadrupole (traceless):
                xx          xy          yy          xz          yz          zz
 q only:        5.219       3.179      -2.469       1.924       2.384      -2.750
  q+dip:        2.704       4.657      -3.636       3.312       8.926       0.932
   full:        4.082       4.587      -2.803       3.387       7.992      -1.280

           -------------------------------------------------
          |                Geometry Summary                 |
           -------------------------------------------------

      molecular mass/u    :      196.2546000
   center of mass at/Å    :        0.2652394      -0.4288231       0.0150229
  moments of inertia/u·Å² :        0.3694519E+03   0.1012640E+04   0.1289154E+04
rotational constants/cm⁻¹ :        0.4562877E-01   0.1664720E-01   0.1307651E-01

 * 31 selected distances

     #   Z        #   Z                                     value/Å
     1   7 N      2   6 C                                 1.4813071
     2   6 C      3   7 N                                 1.4640113
     3   7 N      4   6 C                                 1.4479827
     4   6 C      5   7 N                                 1.4478588
     5   7 N      6   6 C                                 1.4496354
     6   6 C      7   6 C                                 1.5413127 (max)
     7   6 C      8   7 N                                 1.4510473
     1   7 N      9   6 C                                 1.4529429
     8   7 N      9   6 C                                 1.4471927
     7   6 C     10   7 N                                 1.4431742
    10   7 N     11   6 C                                 1.4577795
     6   6 C     12   7 N                                 1.4443298
    11   6 C     12   7 N                                 1.4563810
    12   7 N     13   6 C                                 1.3767836
    13   6 C     14   6 C                                 1.3278630
     1   7 N     15   1 H                                 1.0143981
     2   6 C     16   1 H                                 1.0932038
     2   6 C     17   1 H                                 1.0947180
     3   7 N     18   1 H                                 1.0175755
     4   6 C     19   1 H                                 1.1016032
     5   7 N     20   1 H                                 1.0133191 (min)
     6   6 C     21   1 H                                 1.1125063
     7   6 C     22   1 H                                 1.1074570
     8   7 N     23   1 H                                 1.0150015
     9   6 C     24   1 H                                 1.1078853
    10   7 N     25   1 H                                 1.0141261
    11   6 C     26   1 H                                 1.1068335
    11   6 C     27   1 H                                 1.0952361
    13   6 C     28   1 H                                 1.0820520
    14   6 C     29   1 H                                 1.0742280
    14   6 C     30   1 H                                 1.0736555

 * 4 distinct bonds (by element types)

   Z      Z             #   av. dist./Å        max./Å        min./Å
   1 H    6 C          11     1.0953981     1.1125063     1.0736555
   6 C    6 C           2     1.4345879     1.5413127     1.3278630
   1 H    7 N           5     1.0148840     1.0175755     1.0133191
   6 C    7 N          13     1.4477251     1.4813071     1.3767836


optimized geometry written to: xtbopt.xyz


           -------------------------------------------------
          | TOTAL ENERGY              -42.786020611875 Eh   |
          | GRADIENT NORM               0.000656210020 Eh/α |
          | HOMO-LUMO GAP               4.609004473746 eV   |
           -------------------------------------------------

------------------------------------------------------------------------
 * finished run on 2021/05/19 at 10:59:22.310     
------------------------------------------------------------------------
 total:
 * wall-time:     0 d,  0 h,  0 min,  1.162 sec
 *  cpu-time:     0 d,  0 h,  0 min,  1.158 sec
 * ratio c/w:     0.997 speedup
 SCF:
 * wall-time:     0 d,  0 h,  0 min,  0.040 sec
 *  cpu-time:     0 d,  0 h,  0 min,  0.040 sec
 * ratio c/w:     0.997 speedup
 ANC optimizer:
 * wall-time:     0 d,  0 h,  0 min,  1.100 sec
 *  cpu-time:     0 d,  0 h,  0 min,  1.097 sec
 * ratio c/w:     0.998 speedup

