      -----------------------------------------------------------      
     |                   =====================                   |     
     |                           x T B                           |     
     |                   =====================                   |     
     |                         S. Grimme                         |     
     |          Mulliken Center for Theoretical Chemistry        |     
     |                    University of Bonn                     |     
     |                Version 6.2 RC2 (SAW190805)                |     
      -----------------------------------------------------------      

   This program is distributed in the hope that it will be useful,
   but WITHOUT ANY WARRANTY; without even the implied warranty of
   MERCHANTABILITY or FITNESS FOR A PARTICULAR PURPOSE.
   
   FOR NON-COMMERCIAL, ACADEMIA USE ONLY.
   
   Cite this work as:
   * S. Grimme, C. Bannwarth, P. Shushkov, J. Chem. Theory Comput., 2017,
     13, 1989-2009. DOI: 10.1021/acs.jctc.7b00118
   * C. Bannwarth, S. Ehlert and S. Grimme., J. Chem. Theory Comput., 2019,
     15, 1652-1671. DOI: 10.1021/acs.jctc.8b01176
   * P. Pracht, E. Caldeweyher, S. Ehlert, S. Grimme, ChemRxiv, 2019, preprint.
     DOI: 10.26434/chemrxiv.8326202.v1
   
   for DFT-D4:
   * E. Caldeweyher, C. Bannwarth and S. Grimme, J. Chem. Phys., 2017,
     147, 034112. DOI: 10.1063/1.4993215
   * E. Caldeweyher, S. Ehlert, A. Hansen, H. Neugebauer, S. Spicher,
     C. Bannwarth and S. Grimme, J. Chem. Phys., 2019, 150, 154122.
     DOI: 10.1063/1.5090222
   
   for sTDA-xTB:
   * S. Grimme and C. Bannwarth, J. Chem. Phys., 2016, 145, 054103.
     DOI: 10.1063/1.4959605
   
   in the mass-spec context:
   * V. Asgeirsson, C. Bauer and S. Grimme, Chem. Sci., 2017, 8, 4879.
     DOI: 10.1039/c7sc00601b
   
   for metadynamics refer to:
   * S. Grimme, J. Chem. Theory Comput., 2019, 155, 2847-2862
     DOI: 10.1021/acs.jctc.9b00143
   
   with help from (in alphabetical order)
   C. Bannwarth, F. Bohle, G. Brandenburg, E. Caldeweyher, M. Checinski,
   S. Dohm, S. Ehlert, S. Ehrlich, F. März, H. Neugebauer, J. Pisarek,
   P. Pracht, P. Shushkov, and S. Spicher.
   
 * started run on 2021/05/19 at 10:59:22.455     

           -------------------------------------------------
          |                Calculation Setup                |
           -------------------------------------------------

          program call               : /ihome/ghutchison/geoffh/xtb/xtb 522.xyz -opt
          hostname                   : smp-n144
          coordinate file            : 522.xyz
          omp threads                :                     1
          number of atoms            :                    26
          number of electrons        :                    72
          charge                     :                     0
          spin                       :                   0.0
          first test random number   :      0.11593979776599


########################################################################
# WARNING! Please study the warnings concerning your input carefully
#  - the use of '-opt' is discouraged, please use '--opt' next time
########################################################################

           ------------------------------------------------- 
          |                 G F N 2 - x T B                 |
          | Geometry, Frequencies, Noncovalent interactions |
          |            JCTC 2019 parametrisation            |
           ------------------------------------------------- 
             KAB for C  - Si     :                1.0500
             KAB for H  - Pd     :                0.9500
             k(s)              :                1.8500
             k(p)              :                2.2300
             k(d)              :                2.2300
             k(f)              :                2.0000
             kEN (H0ij)        :               -2.0000
             D4 a1             :                0.5200
             D4 a2             :                5.0000
             D4 s6             :                1.0000
             D4 s8             :                2.7000
             D4 s9             :                5.0000
             alphaj            :                2.0000

  Z AO/shell   Hii/eV     exponent
  1     Wed Apr 25 08:07:45 CEST 2018   EN: 2.200 GM2: 0.406  GM3: 0.0800  RAES: 1.40
     1s    -10.707211    1.230000
  6     Wed Apr 25 08:07:45 CEST 2018   EN: 2.550 GM2: 0.538  GM3: 0.1500  RAES: 3.00
     2s    -13.970922    2.096432
     2p    -10.063292    1.800000
  8     Wed Apr 25 08:07:45 CEST 2018   EN: 3.440 GM2: 0.452  GM3:-0.0517  RAES: 1.80
     2s    -20.229985    2.439742
     2p    -15.503117    2.137023
 16     Tue Apr 24 11:44:34 CEST 2018   EN: 2.580 GM2: 0.340  GM3:-0.0502  RAES: 3.10
     3s    -20.029654    1.981333
     3p    -11.377694    2.025643
     3d     -0.420282    1.702555

           ------------------------------------------------- 
          |        Self-Consistent Charge Iterations        |
           ------------------------------------------------- 

          ...................................................
          :                      SETUP                      :
          :.................................................:
          :  # basis functions                  74          :
          :  # atomic orbitals                  73          :
          :  # shells                           41          :
          :  # electrons                        72          :
          :  max. iterations                   250          :
          :  Hamiltonian                  GFN2-xTB          :
          :  restarted?                      false          :
          :  GBSA solvation                  false          :
          :  PC potential                    false          :
          :  electronic temp.          300.0000000     K    :
          :  accuracy                    1.0000000          :
          :  -> integral cutoff          0.2500000E+02      :
          :  -> integral neglect         0.1000000E-07      :
          :  -> SCF convergence          0.1000000E-05 Eh   :
          :  -> wf. convergence          0.1000000E-03 e    :
          :  Broyden damping             0.4000000          :
          ...................................................

 iter      E             dE          RMSdq      gap      omega  full diag
   1    -39.6143477 -0.396143E+02  0.435E+00    1.92       0.0  T
   2    -39.6435932 -0.292454E-01  0.249E+00    1.93       1.0  T
   3    -39.6159360  0.276572E-01  0.134E+00    2.06       1.0  T
   4    -39.6398121 -0.238762E-01  0.689E-01    1.92       1.0  T
   5    -39.6490318 -0.921963E-02  0.215E-01    1.94       1.0  T
   6    -39.6498955 -0.863717E-03  0.802E-02    1.94       1.0  T
   7    -39.6499232 -0.277434E-04  0.397E-02    1.94       1.0  T
   8    -39.6499472 -0.239388E-04  0.158E-02    1.94       1.2  T
   9    -39.6499484 -0.121898E-05  0.758E-03    1.94       2.6  T
  10    -39.6499484 -0.437387E-07  0.425E-03    1.94       4.6  T
  11    -39.6499487 -0.301905E-06  0.129E-03    1.94      15.2  T
  12    -39.6499487 -0.827529E-08  0.724E-04    1.94      27.1  T
  13    -39.6499487 -0.211618E-08  0.341E-04    1.94      57.5  T

   *** convergence criteria satisfied after 13 iterations ***

         #    Occupation            Energy/Eh            Energy/eV
      -------------------------------------------------------------
         1        2.0000           -0.7249074             -19.7257
       ...           ...                  ...                  ...
        30        2.0000           -0.4316120             -11.7448
        31        2.0000           -0.4277792             -11.6405
        32        2.0000           -0.4247951             -11.5593
        33        2.0000           -0.4185707             -11.3899
        34        2.0000           -0.4037082             -10.9855
        35        2.0000           -0.3752104             -10.2100
        36        2.0000           -0.3470276              -9.4431 (HOMO)
        37                         -0.2757464              -7.5034 (LUMO)
        38                         -0.2233132              -6.0767
        39                         -0.1925167              -5.2386
        40                         -0.1907161              -5.1897
        41                         -0.1666437              -4.5346
       ...                                ...                  ...
        73                          0.7467466              20.3200
      -------------------------------------------------------------
                  HL-Gap            0.0712812 Eh            1.9397 eV
             Fermi-level           -0.3113870 Eh           -8.4733 eV

 SCC (total)                   0 d,  0 h,  0 min,  0.045 sec
 SCC setup                      ...        0 min,  0.000 sec (  0.712%)
 Dispersion                     ...        0 min,  0.000 sec (  0.864%)
 integral evaluation            ...        0 min,  0.010 sec ( 22.465%)
 zeroth order Hamiltonian       ...        0 min,  0.000 sec (  0.444%)
 iterations                     ...        0 min,  0.018 sec ( 39.524%)
 molecular gradient             ...        0 min,  0.016 sec ( 34.844%)
 printout                       ...        0 min,  0.000 sec (  0.881%)

         :::::::::::::::::::::::::::::::::::::::::::::::::::::
         ::                     SUMMARY                     ::
         :::::::::::::::::::::::::::::::::::::::::::::::::::::
         :: total energy             -39.075575452282 Eh    ::
         :: gradient norm              0.103553841351 Eh/a0 ::
         :: HOMO-LUMO gap              1.939659104006 eV    ::
         ::.................................................::
         :: SCC energy               -39.649948731984 Eh    ::
         :: -> isotropic ES            0.016956285573 Eh    ::
         :: -> anisotropic ES          0.005085286679 Eh    ::
         :: -> anisotropic XC          0.017865804514 Eh    ::
         :: -> dispersion             -0.026608334228 Eh    ::
         :: repulsion energy           0.574314604641 Eh    ::
         :: add. restraining           0.000000000000 Eh    ::
         :::::::::::::::::::::::::::::::::::::::::::::::::::::

      ----------------------------------------------------------- 
     |                   =====================                   |
     |                        A N C O P T                        |
     |                   =====================                   |
     |               Approximate Normal Coordinate               |
     |                Rational Function Optimizer                |
      ----------------------------------------------------------- 

          ...................................................
          :                      SETUP                      :
          :.................................................:
          :   optimization level            normal          :
          :   max. optcycles                   200          :
          :   ANC micro-cycles                  20          :
          :   degrees of freedom                72          :
          :.................................................:
          :   RF solver                   davidson          :
          :   input Hessian                  false          :
          :   write xtbopt.log                true          :
          :   linear?                        false          :
          :   energy convergence         0.5000000E-05 Eh   :
          :   grad. convergence          0.1000000E-02 Eh/α :
          :   maximium RF displ.         2.0000000          :
          :   Hlow (freq-cutoff)         0.5000000E-02      :
          :   Hmax (freq-cutoff)         5.0000000          :
          :   S6 in model hess.         20.0000000          :
          ...................................................

generating ANC from model Hessian ...
Using Lindh-Hessian (1995)
 Shifting diagonal of input Hessian by   4.009411861074797E-003
 Lowest  eigenvalues of input Hessian
   -0.000000   -0.000000   -0.000000   -0.000000    0.000000    0.000000
    0.005000    0.005829    0.007152    0.008131    0.008639    0.009580
    0.011111    0.011605    0.015298    0.016366    0.018205    0.021789
 Highest eigenvalues
    1.693593    1.729207    1.822942    1.935050    1.982684    2.061906
 

........................................................................
.............................. CYCLE    1 ..............................
........................................................................
   1    -39.6499487 -0.396499E+02  0.145E-04    1.94       0.0  T
   2    -39.6499487 -0.370335E-10  0.907E-05    1.94     216.2  T
   3    -39.6499487 -0.331326E-10  0.615E-05    1.94     318.7  T
     SCC iter.                  ...        0 min,  0.005 sec
     gradient                   ...        0 min,  0.016 sec
 * total energy  :   -39.0755755 Eh     change        0.3769429E-09 Eh
   gradient norm :     0.1035545 Eh/α   predicted     0.0000000E+00 (-100.00%)
   displ. norm   :     0.3300638 α      lambda       -0.1844993E-01
   maximum displ.:     0.1764381 α      in ANC's #33, #19, #24, ...

........................................................................
.............................. CYCLE    2 ..............................
........................................................................
   1    -39.6853670 -0.396854E+02  0.300E-01    2.01       0.0  T
   2    -39.6854470 -0.800312E-04  0.174E-01    2.00       1.0  T
   3    -39.6852986  0.148340E-03  0.112E-01    2.01       1.0  T
   4    -39.6855598 -0.261170E-03  0.260E-02    2.01       1.0  T
   5    -39.6855604 -0.616672E-06  0.176E-02    2.01       1.1  T
   6    -39.6855657 -0.522422E-05  0.806E-03    2.01       2.4  T
   7    -39.6855669 -0.126307E-05  0.205E-03    2.01       9.6  T
   8    -39.6855670 -0.509994E-07  0.912E-04    2.01      21.5  T
     SCC iter.                  ...        0 min,  0.010 sec
     gradient                   ...        0 min,  0.014 sec
 * total energy  :   -39.0883530 Eh     change       -0.1277752E-01 Eh
   gradient norm :     0.0487055 Eh/α   predicted    -0.1022995E-01 ( -19.94%)
   displ. norm   :     0.2584339 α      lambda       -0.5147614E-02
   maximum displ.:     0.1274987 α      in ANC's #7, #33, #6, ...

........................................................................
.............................. CYCLE    3 ..............................
........................................................................
   1    -39.7009055 -0.397009E+02  0.200E-01    2.08       0.0  T
   2    -39.7009394 -0.338966E-04  0.122E-01    2.07       1.0  T
   3    -39.7008681  0.712292E-04  0.789E-02    2.08       1.0  T
   4    -39.7009817 -0.113547E-03  0.196E-02    2.07       1.0  T
   5    -39.7009898 -0.813113E-05  0.796E-03    2.07       2.5  T
   6    -39.7009906 -0.764576E-06  0.361E-03    2.07       5.4  T
   7    -39.7009908 -0.214995E-06  0.980E-04    2.07      20.0  T
     SCC iter.                  ...        0 min,  0.009 sec
     gradient                   ...        0 min,  0.014 sec
 * total energy  :   -39.0911618 Eh     change       -0.2808836E-02 Eh
   gradient norm :     0.0115175 Eh/α   predicted    -0.2745710E-02 (  -2.25%)
   displ. norm   :     0.2023089 α      lambda       -0.5908504E-03
   maximum displ.:     0.1071937 α      in ANC's #6, #7, #2, ...

........................................................................
.............................. CYCLE    4 ..............................
........................................................................
   1    -39.6987519 -0.396988E+02  0.128E-01    2.07       0.0  T
   2    -39.6987544 -0.250716E-05  0.721E-02    2.07       1.0  T
   3    -39.6987227  0.316623E-04  0.383E-02    2.08       1.0  T
   4    -39.6987566 -0.339285E-04  0.886E-03    2.07       2.2  T
   5    -39.6987574 -0.771619E-06  0.408E-03    2.07       4.8  T
   6    -39.6987577 -0.269578E-06  0.796E-04    2.07      24.6  T
   7    -39.6987577 -0.805442E-08  0.433E-04    2.07      45.3  T
     SCC iter.                  ...        0 min,  0.009 sec
     gradient                   ...        0 min,  0.014 sec
 * total energy  :   -39.0915927 Eh     change       -0.4309355E-03 Eh
   gradient norm :     0.0062352 Eh/α   predicted    -0.3075171E-03 ( -28.64%)
   displ. norm   :     0.3006344 α      lambda       -0.5836350E-03
   maximum displ.:     0.1463783 α      in ANC's #6, #7, #2, ...

........................................................................
.............................. CYCLE    5 ..............................
........................................................................
   1    -39.6952740 -0.396953E+02  0.196E-01    2.06       0.0  T
   2    -39.6952769 -0.290327E-05  0.114E-01    2.06       1.0  T
   3    -39.6952076  0.693640E-04  0.558E-02    2.06       1.0  T
   4    -39.6952815 -0.739693E-04  0.945E-03    2.06       2.1  T
   5    -39.6952823 -0.721442E-06  0.429E-03    2.06       4.6  T
   6    -39.6952825 -0.294889E-06  0.989E-04    2.06      19.8  T
   7    -39.6952826 -0.104366E-07  0.486E-04    2.06      40.4  T
     SCC iter.                  ...        0 min,  0.009 sec
     gradient                   ...        0 min,  0.014 sec
 * total energy  :   -39.0919346 Eh     change       -0.3418685E-03 Eh
   gradient norm :     0.0093208 Eh/α   predicted    -0.3181939E-03 (  -6.93%)
   displ. norm   :     0.2046920 α      lambda       -0.3223719E-03
   maximum displ.:     0.1128397 α      in ANC's #6, #2, #5, ...

........................................................................
.............................. CYCLE    6 ..............................
........................................................................
   1    -39.6957508 -0.396958E+02  0.131E-01    2.05       0.0  T
   2    -39.6957518 -0.108426E-05  0.755E-02    2.05       1.0  T
   3    -39.6957147  0.371670E-04  0.416E-02    2.06       1.0  T
   4    -39.6957546 -0.399029E-04  0.580E-03    2.05       3.4  T
   5    -39.6957547 -0.138923E-06  0.323E-03    2.05       6.1  T
   6    -39.6957549 -0.160403E-06  0.106E-03    2.05      18.4  T
   7    -39.6957549 -0.188301E-07  0.376E-04    2.05      52.1  T
     SCC iter.                  ...        0 min,  0.009 sec
     gradient                   ...        0 min,  0.015 sec
 * total energy  :   -39.0921714 Eh     change       -0.2367623E-03 Eh
   gradient norm :     0.0100097 Eh/α   predicted    -0.1679436E-03 ( -29.07%)
   displ. norm   :     0.2778980 α      lambda       -0.4425988E-03
   maximum displ.:     0.1432791 α      in ANC's #6, #2, #1, ...

........................................................................
.............................. CYCLE    7 ..............................
........................................................................
   1    -39.6985105 -0.396985E+02  0.171E-01    2.04       0.0  T
   2    -39.6985121 -0.154398E-05  0.989E-02    2.04       1.0  T
   3    -39.6984487  0.633545E-04  0.557E-02    2.04       1.0  T
   4    -39.6985169 -0.682146E-04  0.781E-03    2.04       2.5  T
   5    -39.6985172 -0.283733E-06  0.505E-03    2.04       3.9  T
   6    -39.6985177 -0.432285E-06  0.133E-03    2.04      14.7  T
   7    -39.6985177 -0.341828E-07  0.519E-04    2.04      37.8  T
     SCC iter.                  ...        0 min,  0.009 sec
     gradient                   ...        0 min,  0.014 sec
 * total energy  :   -39.0924981 Eh     change       -0.3266939E-03 Eh
   gradient norm :     0.0069705 Eh/α   predicted    -0.2384027E-03 ( -27.03%)
   displ. norm   :     0.4044226 α      lambda       -0.4003387E-03
   maximum displ.:     0.2321803 α      in ANC's #2, #6, #5, ...

........................................................................
.............................. CYCLE    8 ..............................
........................................................................
   1    -39.6973481 -0.396973E+02  0.220E-01    2.02       0.0  T
   2    -39.6973502 -0.214748E-05  0.129E-01    2.02       1.0  T
   3    -39.6973249  0.253437E-04  0.341E-02    2.02       1.0  T
   4    -39.6973523 -0.274604E-04  0.544E-03    2.02       3.6  T
   5    -39.6973527 -0.318406E-06  0.317E-03    2.02       6.2  T
   6    -39.6973528 -0.987551E-07  0.132E-03    2.02      14.9  T
   7    -39.6973528 -0.244126E-07  0.532E-04    2.02      36.8  T
     SCC iter.                  ...        0 min,  0.009 sec
     gradient                   ...        0 min,  0.015 sec
 * total energy  :   -39.0927223 Eh     change       -0.2242106E-03 Eh
   gradient norm :     0.0097515 Eh/α   predicted    -0.2329135E-03 (   3.88%)
   displ. norm   :     0.2243873 α      lambda       -0.4386466E-03
   maximum displ.:     0.1383635 α      in ANC's #2, #1, #6, ...

........................................................................
.............................. CYCLE    9 ..............................
........................................................................
   1    -39.7023106 -0.397023E+02  0.119E-01    2.02       0.0  T
   2    -39.7023132 -0.263268E-05  0.693E-02    2.02       1.0  T
   3    -39.7022945  0.187377E-04  0.310E-02    2.02       1.0  T
   4    -39.7023150 -0.204910E-04  0.632E-03    2.02       3.1  T
   5    -39.7023153 -0.303094E-06  0.413E-03    2.02       4.7  T
   6    -39.7023156 -0.319948E-06  0.126E-03    2.02      15.5  T
   7    -39.7023156 -0.174325E-07  0.607E-04    2.02      32.3  T
     SCC iter.                  ...        0 min,  0.009 sec
     gradient                   ...        0 min,  0.015 sec
 * total energy  :   -39.0929320 Eh     change       -0.2096922E-03 Eh
   gradient norm :     0.0063119 Eh/α   predicted    -0.2303711E-03 (   9.86%)
   displ. norm   :     0.2879907 α      lambda       -0.1948480E-03
   maximum displ.:     0.1898023 α      in ANC's #2, #1, #5, ...

........................................................................
.............................. CYCLE   10 ..............................
........................................................................
   1    -39.6993191 -0.396993E+02  0.147E-01    2.01       0.0  T
   2    -39.6993201 -0.998942E-06  0.860E-02    2.01       1.0  T
   3    -39.6993146  0.543621E-05  0.170E-02    2.01       1.2  T
   4    -39.6993208 -0.620169E-05  0.304E-03    2.01       6.4  T
   5    -39.6993208  0.149238E-07  0.233E-03    2.01       8.4  T
   6    -39.6993209 -0.106604E-06  0.706E-04    2.01      27.8  T
     SCC iter.                  ...        0 min,  0.008 sec
     gradient                   ...        0 min,  0.014 sec
 * total energy  :   -39.0930334 Eh     change       -0.1014067E-03 Eh
   gradient norm :     0.0082583 Eh/α   predicted    -0.1055090E-03 (   4.05%)
   displ. norm   :     0.1195974 α      lambda       -0.1339680E-03
   maximum displ.:     0.0839881 α      in ANC's #2, #1, #5, ...

........................................................................
.............................. CYCLE   11 ..............................
........................................................................
   1    -39.6992441 -0.396992E+02  0.562E-02    2.01       0.0  T
   2    -39.6992446 -0.510535E-06  0.332E-02    2.01       1.0  T
   3    -39.6992341  0.104728E-04  0.235E-02    2.01       1.0  T
   4    -39.6992456 -0.114854E-04  0.332E-03    2.01       5.9  T
   5    -39.6992457 -0.155092E-06  0.191E-03    2.01      10.3  T
   6    -39.6992458 -0.660326E-07  0.609E-04    2.01      32.2  T
     SCC iter.                  ...        0 min,  0.008 sec
     gradient                   ...        0 min,  0.015 sec
 * total energy  :   -39.0931121 Eh     change       -0.7873892E-04 Eh
   gradient norm :     0.0053446 Eh/α   predicted    -0.6794408E-04 ( -13.71%)
   displ. norm   :     0.1658624 α      lambda       -0.1362504E-03
   maximum displ.:     0.1204583 α      in ANC's #2, #1, #37, ...

........................................................................
.............................. CYCLE   12 ..............................
........................................................................
   1    -39.6991754 -0.396992E+02  0.100E-01    2.02       0.0  T
   2    -39.6991775 -0.212260E-05  0.570E-02    2.01       1.0  T
   3    -39.6991618  0.157257E-04  0.269E-02    2.02       1.0  T
   4    -39.6991785 -0.167084E-04  0.715E-03    2.02       2.7  T
   5    -39.6991789 -0.392600E-06  0.366E-03    2.02       5.4  T
   6    -39.6991791 -0.249080E-06  0.967E-04    2.02      20.3  T
   7    -39.6991791 -0.142662E-07  0.326E-04    2.02      60.1  T
     SCC iter.                  ...        0 min,  0.009 sec
     gradient                   ...        0 min,  0.014 sec
 * total energy  :   -39.0931524 Eh     change       -0.4023851E-04 Eh
   gradient norm :     0.0064735 Eh/α   predicted    -0.7000034E-04 (  73.96%)
   displ. norm   :     0.0960836 α      lambda       -0.7179379E-04
   maximum displ.:     0.0670679 α      in ANC's #2, #1, #5, ...

........................................................................
.............................. CYCLE   13 ..............................
........................................................................
   1    -39.6998922 -0.396999E+02  0.485E-02    2.02       0.0  T
   2    -39.6998929 -0.670590E-06  0.273E-02    2.02       1.0  T
   3    -39.6998915  0.140192E-05  0.867E-03    2.02       2.3  T
   4    -39.6998929 -0.136707E-05  0.396E-03    2.02       5.0  T
   5    -39.6998931 -0.229551E-06  0.130E-03    2.02      15.1  T
   6    -39.6998931 -0.156700E-07  0.466E-04    2.02      42.1  T
     SCC iter.                  ...        0 min,  0.008 sec
     gradient                   ...        0 min,  0.015 sec
 * total energy  :   -39.0931907 Eh     change       -0.3837675E-04 Eh
   gradient norm :     0.0028199 Eh/α   predicted    -0.3623760E-04 (  -5.57%)
   displ. norm   :     0.1406499 α      lambda       -0.3761399E-04
   maximum displ.:     0.0973548 α      in ANC's #2, #1, #6, ...

........................................................................
.............................. CYCLE   14 ..............................
........................................................................
   1    -39.6992296 -0.396992E+02  0.698E-02    2.01       0.0  T
   2    -39.6992300 -0.413591E-06  0.409E-02    2.01       1.0  T
   3    -39.6992292  0.775606E-06  0.596E-03    2.01       3.3  T
   4    -39.6992301 -0.903607E-06  0.228E-03    2.01       8.6  T
   5    -39.6992302 -0.434656E-07  0.133E-03    2.01      14.7  T
   6    -39.6992302 -0.244216E-07  0.457E-04    2.01      42.9  T
   7    -39.6992302 -0.277348E-08  0.252E-04    2.01      77.8  T
     SCC iter.                  ...        0 min,  0.009 sec
     gradient                   ...        0 min,  0.015 sec
 * total energy  :   -39.0931941 Eh     change       -0.3394224E-05 Eh
   gradient norm :     0.0038820 Eh/α   predicted    -0.1918657E-04 ( 465.27%)
   displ. norm   :     0.0515734 α      lambda       -0.3970627E-04
   maximum displ.:     0.0254668 α      in ANC's #5, #2, #6, ...

........................................................................
.............................. CYCLE   15 ..............................
........................................................................
   1    -39.7011754 -0.397012E+02  0.281E-02    2.02       0.0  T
   2    -39.7011755 -0.948585E-07  0.166E-02    2.02       1.2  T
   3    -39.7011746  0.920813E-06  0.641E-03    2.02       3.1  T
   4    -39.7011755 -0.989805E-06  0.160E-03    2.02      12.3  T
   5    -39.7011756 -0.225117E-07  0.903E-04    2.02      21.7  T
   6    -39.7011756 -0.120366E-07  0.248E-04    2.02      79.0  T
     SCC iter.                  ...        0 min,  0.008 sec
     gradient                   ...        0 min,  0.015 sec
 * total energy  :   -39.0932109 Eh     change       -0.1672457E-04 Eh
   gradient norm :     0.0015390 Eh/α   predicted    -0.1990674E-04 (  19.03%)
   displ. norm   :     0.0805113 α      lambda       -0.1290816E-04
   maximum displ.:     0.0558482 α      in ANC's #2, #1, #4, ...

........................................................................
.............................. CYCLE   16 ..............................
........................................................................
   1    -39.7001821 -0.397002E+02  0.430E-02    2.02       0.0  T
   2    -39.7001824 -0.223811E-06  0.250E-02    2.02       1.0  T
   3    -39.7001816  0.812282E-06  0.645E-03    2.02       3.0  T
   4    -39.7001824 -0.853648E-06  0.220E-03    2.02       8.9  T
   5    -39.7001825 -0.554295E-07  0.109E-03    2.02      17.9  T
   6    -39.7001825 -0.226602E-07  0.242E-04    2.02      81.0  T
   7    -39.7001825 -0.525965E-09  0.108E-04    2.02     181.8  T
     SCC iter.                  ...        0 min,  0.009 sec
     gradient                   ...        0 min,  0.015 sec
 * total energy  :   -39.0932156 Eh     change       -0.4728331E-05 Eh
   gradient norm :     0.0021902 Eh/α   predicted    -0.6473596E-05 (  36.91%)
   displ. norm   :     0.0227906 α      lambda       -0.6938803E-05
   maximum displ.:     0.0141373 α      in ANC's #2, #4, #6, ...

........................................................................
.............................. CYCLE   17 ..............................
........................................................................
   1    -39.7003749 -0.397004E+02  0.125E-02    2.02       0.0  T
   2    -39.7003749 -0.291121E-07  0.722E-03    2.02       2.7  T
   3    -39.7003748  0.122595E-06  0.259E-03    2.02       7.6  T
   4    -39.7003749 -0.129641E-06  0.783E-04    2.02      25.1  T
   5    -39.7003749 -0.664968E-08  0.380E-04    2.02      51.6  T
     SCC iter.                  ...        0 min,  0.007 sec
     gradient                   ...        0 min,  0.015 sec
 * total energy  :   -39.0932206 Eh     change       -0.5007010E-05 Eh
   gradient norm :     0.0009955 Eh/α   predicted    -0.3472670E-05 ( -30.64%)
   displ. norm   :     0.0367831 α      lambda       -0.4048662E-05
   maximum displ.:     0.0177296 α      in ANC's #2, #4, #11, ...

........................................................................
.............................. CYCLE   18 ..............................
........................................................................
   1    -39.7008303 -0.397008E+02  0.232E-02    2.02       0.0  T
   2    -39.7008304 -0.119671E-06  0.130E-02    2.02       1.5  T
   3    -39.7008299  0.458772E-06  0.518E-03    2.02       3.8  T
   4    -39.7008304 -0.492291E-06  0.184E-03    2.02      10.7  T
   5    -39.7008304 -0.182561E-07  0.946E-04    2.02      20.7  T
   6    -39.7008305 -0.201850E-07  0.185E-04    2.02     106.0  T
     SCC iter.                  ...        0 min,  0.008 sec
     gradient                   ...        0 min,  0.015 sec
 * total energy  :   -39.0932231 Eh     change       -0.2475642E-05 Eh
   gradient norm :     0.0007768 Eh/α   predicted    -0.2028707E-05 ( -18.05%)
   displ. norm   :     0.0094154 α      lambda       -0.9392026E-06
   maximum displ.:     0.0049443 α      in ANC's #4, #2, #8, ...

   *** GEOMETRY OPTIMIZATION CONVERGED AFTER 18 ITERATIONS ***

------------------------------------------------------------------------
 total energy gain   :        -0.0176476 Eh      -11.0740 kcal/mol
 total RMSD          :         0.4955323 a0        0.2622 Å
 total power (kW/mol):        -2.5740996 (step)  -75.1831 (real)
------------------------------------------------------------------------

 ANCopt (total)                0 d,  0 h,  0 min,  0.616 sec
 optimizer setup                ...        0 min,  0.000 sec (  0.026%)
 model hessian                  ...        0 min,  0.004 sec (  0.636%)
 ANC generation                 ...        0 min,  0.001 sec (  0.127%)
 coordinate transformation      ...        0 min,  0.000 sec (  0.055%)
 single point calculation       ...        0 min,  0.603 sec ( 97.903%)
 optimization log               ...        0 min,  0.002 sec (  0.307%)
 hessian update                 ...        0 min,  0.000 sec (  0.042%)
 rational function              ...        0 min,  0.004 sec (  0.713%)

================
 final structure:
================
$coord
   -3.77784875157862    2.81410533098378   -0.11973554761255      C 
   -5.81018892622023    0.32955988382239   -0.41949514499758      S 
   -3.36402607578620   -1.84855895320756   -0.60168986150748      C 
   -1.04057404189070   -0.62645412135783   -0.43252098857754      C 
   -1.29181488217929    2.05710704559509   -0.15246689018219      C 
    0.90477315837499    3.57390214765242    0.05396958766575      C 
    3.23827248046461    2.50428715934529   -0.01893856980236      C 
    5.60505856997995    4.03317656891050    0.19695830762958      C 
    3.47936441594932   -0.18324062641638   -0.31296990805932      C 
    5.91971430678247   -1.01335515187205   -0.37069153196610      O 
    6.36760281234167   -3.61241918485680   -0.66664135624682      C 
    1.40275171046411   -1.70543697796647   -0.51067996563442      C 
   -3.84130478813749   -4.49636325005142   -0.87927444292113      C 
   -6.11962259908810   -5.55712238203100   -1.03595349688768      C 
   -4.50965770320006    4.69335997854105    0.06490054242171      H 
    0.69275212522815    5.59185004439527    0.27171797533389      H 
    5.16701886710591    6.02486921226120    0.43674838160834      H 
    6.75948378206032    3.79038193692088   -1.48895968968538      H 
    6.72003130784663    3.38511635668702    1.79967993141123      H 
    8.41416070833376   -3.82980497047128   -0.67315975484110      H 
    5.59988194497702   -4.31752718412573   -2.45456571377653      H 
    5.56939476649321   -4.70532930790543    0.89917614280827      H 
    1.58046537914731   -3.72241127280150   -0.72770161318930      H 
   -2.17139137319880   -5.67362787751008   -0.95871184439985      H 
   -7.81999366211922   -4.43849822470724   -0.96006715304689      H 
   -6.34904855048386   -7.56577042995622   -1.24114635332815      H 
$end
           -------------------------------------------------
          |                Final Singlepoint                |
           -------------------------------------------------

          ...................................................
          :                      SETUP                      :
          :.................................................:
          :  # basis functions                  74          :
          :  # atomic orbitals                  73          :
          :  # shells                           41          :
          :  # electrons                        72          :
          :  max. iterations                   250          :
          :  Hamiltonian                  GFN2-xTB          :
          :  restarted?                      false          :
          :  GBSA solvation                  false          :
          :  PC potential                    false          :
          :  electronic temp.          300.0000000     K    :
          :  accuracy                    1.0000000          :
          :  -> integral cutoff          0.2500000E+02      :
          :  -> integral neglect         0.1000000E-07      :
          :  -> SCF convergence          0.1000000E-05 Eh   :
          :  -> wf. convergence          0.1000000E-03 e    :
          :  Broyden damping             0.4000000          :
          ...................................................

 iter      E             dE          RMSdq      gap      omega  full diag
   1    -39.7008305 -0.397008E+02  0.873E-05    2.02       0.0  T
   2    -39.7008305 -0.148219E-10  0.527E-05    2.02     372.1  T
   3    -39.7008305 -0.364437E-10  0.353E-05    2.02     555.8  T

   *** convergence criteria satisfied after 3 iterations ***

         #    Occupation            Energy/Eh            Energy/eV
      -------------------------------------------------------------
         1        2.0000           -0.7258698             -19.7519
       ...           ...                  ...                  ...
        30        2.0000           -0.4400027             -11.9731
        31        2.0000           -0.4326292             -11.7724
        32        2.0000           -0.4205967             -11.4450
        33        2.0000           -0.4182302             -11.3806
        34        2.0000           -0.4036568             -10.9841
        35        2.0000           -0.3786787             -10.3044
        36        2.0000           -0.3491276              -9.5002 (HOMO)
        37                         -0.2750185              -7.4836 (LUMO)
        38                         -0.2165219              -5.8919
        39                         -0.1928843              -5.2486
        40                         -0.1882918              -5.1237
        41                         -0.1555573              -4.2329
       ...                                ...                  ...
        73                          0.7388363              20.1048
      -------------------------------------------------------------
                  HL-Gap            0.0741091 Eh            2.0166 eV
             Fermi-level           -0.3120730 Eh           -8.4919 eV

 SCC (total)                   0 d,  0 h,  0 min,  0.031 sec
 SCC setup                      ...        0 min,  0.000 sec (  0.711%)
 Dispersion                     ...        0 min,  0.000 sec (  0.676%)
 integral evaluation            ...        0 min,  0.010 sec ( 31.979%)
 zeroth order Hamiltonian       ...        0 min,  0.000 sec (  0.588%)
 iterations                     ...        0 min,  0.004 sec ( 14.486%)
 molecular gradient             ...        0 min,  0.015 sec ( 50.141%)
 printout                       ...        0 min,  0.000 sec (  1.238%)

         :::::::::::::::::::::::::::::::::::::::::::::::::::::
         ::                     SUMMARY                     ::
         :::::::::::::::::::::::::::::::::::::::::::::::::::::
         :: total energy             -39.093223066019 Eh    ::
         :: gradient norm              0.000776613973 Eh/a0 ::
         :: HOMO-LUMO gap              2.016612016872 eV    ::
         ::.................................................::
         :: SCC energy               -39.700830464493 Eh    ::
         :: -> isotropic ES            0.016539420623 Eh    ::
         :: -> anisotropic ES          0.004947380879 Eh    ::
         :: -> anisotropic XC          0.016006643605 Eh    ::
         :: -> dispersion             -0.026702020823 Eh    ::
         :: repulsion energy           0.607576804952 Eh    ::
         :: add. restraining           0.000000000000 Eh    ::
         :::::::::::::::::::::::::::::::::::::::::::::::::::::

           -------------------------------------------------
          |                Property Printout                |
           -------------------------------------------------

    * Orbital Energies and Occupations

         #    Occupation            Energy/Eh            Energy/eV
      -------------------------------------------------------------
         1        2.0000           -0.7258698             -19.7519
       ...           ...                  ...                  ...
        24        2.0000           -0.4717598             -12.8372
        25        2.0000           -0.4661093             -12.6835
        26        2.0000           -0.4642815             -12.6337
        27        2.0000           -0.4547541             -12.3745
        28        2.0000           -0.4469857             -12.1631
        29        2.0000           -0.4406937             -11.9919
        30        2.0000           -0.4400027             -11.9731
        31        2.0000           -0.4326292             -11.7724
        32        2.0000           -0.4205967             -11.4450
        33        2.0000           -0.4182302             -11.3806
        34        2.0000           -0.4036568             -10.9841
        35        2.0000           -0.3786787             -10.3044
        36        2.0000           -0.3491276              -9.5002 (HOMO)
        37                         -0.2750185              -7.4836 (LUMO)
        38                         -0.2165219              -5.8919
        39                         -0.1928843              -5.2486
        40                         -0.1882918              -5.1237
        41                         -0.1555573              -4.2329
        42                         -0.1137121              -3.0943
        43                         -0.0793654              -2.1596
        44                          0.0020976               0.0571
        45                          0.0330779               0.9001
        46                          0.0361921               0.9848
        47                          0.0460351               1.2527
       ...                                ...                  ...
        73                          0.7388363              20.1048
      -------------------------------------------------------------
                  HL-Gap            0.0741091 Eh            2.0166 eV
             Fermi-level           -0.3120730 Eh           -8.4919 eV

     #   Z        covCN         q      C6AA      α(0)
     1   6 C      2.928    -0.034    28.839     8.807
     2  16 S      2.321    -0.015   141.674    20.033
     3   6 C      2.979     0.008    27.846     8.656
     4   6 C      3.167    -0.010    27.901     8.631
     5   6 C      3.168    -0.007    27.823     8.618
     6   6 C      2.913    -0.049    29.221     8.864
     7   6 C      2.962     0.003    27.962     8.674
     8   6 C      3.759    -0.107    22.594     6.777
     9   6 C      2.867     0.133    25.094     8.211
    10   8 O      1.705    -0.266    18.408     5.793
    11   6 C      3.644     0.039    20.255     6.469
    12   6 C      2.906    -0.080    29.987     8.979
    13   6 C      2.920    -0.031    28.766     8.795
    14   6 C      2.840    -0.094    30.346     9.028
    15   1 H      0.926     0.041     2.430     2.438
    16   1 H      0.926     0.035     2.523     2.484
    17   1 H      0.925     0.042     2.428     2.437
    18   1 H      0.925     0.055     2.257     2.349
    19   1 H      0.925     0.055     2.255     2.348
    20   1 H      0.925     0.060     2.205     2.322
    21   1 H      0.924     0.039     2.465     2.455
    22   1 H      0.924     0.039     2.467     2.456
    23   1 H      0.926     0.031     2.578     2.511
    24   1 H      0.925     0.036     2.507     2.476
    25   1 H      0.926     0.042     2.421     2.433
    26   1 H      0.926     0.036     2.502     2.474

 Mol. C6AA /au·bohr⁶  :       9451.371924
 Mol. C8AA /au·bohr⁸  :     252894.998743
 Mol. α(0) /au        :        155.518364


Wiberg/Mayer (AO) data.
largest (>0.10) Wiberg bond orders for each atom
          total WBO             WBO to atom ...
     1  C   3.939        C    5 1.458    S    2 1.236    H   15 0.970    C    3 0.125
     2  S   2.681        C    1 1.236    C    3 1.152
     3  C   3.941        C    4 1.376    C   13 1.162    S    2 1.152    C    1 0.125
     4  C   3.988        C    3 1.376    C   12 1.235    C    5 1.168
     5  C   3.988        C    1 1.458    C    6 1.208    C    4 1.168
     6  C   3.984        C    7 1.605    C    5 1.208    H   16 0.966
     7  C   3.988        C    6 1.605    C    9 1.171    C    8 1.030
     8  C   3.994        C    7 1.030    H   17 0.986    H   19 0.969    H   18 0.969
     9  C   3.915        C   12 1.524    C    7 1.171    O   10 1.058
    10  O   2.224        C    9 1.058    C   11 0.989
    11  C   3.949        O   10 0.989    H   20 0.980    H   21 0.976    H   22 0.976
    12  C   3.983        C    9 1.524    C    4 1.235    H   23 0.960
    13  C   3.992        C   14 1.836    C    3 1.162    H   24 0.956
    14  C   3.963        C   13 1.836    H   26 0.979    H   25 0.973
    15  H   0.998        C    1 0.970
    16  H   0.998        C    6 0.966
    17  H   0.998        C    8 0.986
    18  H   0.994        C    8 0.969
    19  H   0.994        C    8 0.969
    20  H   0.996        C   11 0.980
    21  H   0.998        C   11 0.976
    22  H   0.998        C   11 0.976
    23  H   0.998        C   12 0.960
    24  H   0.998        C   13 0.956
    25  H   0.998        C   14 0.973
    26  H   0.998        C   14 0.979

molecular dipole:
                 x           y           z       tot (Debye)
 q only:        0.431      -0.142      -0.011
   full:        0.667      -0.257      -0.020       1.816
molecular quadrupole (traceless):
                xx          xy          yy          xz          yz          zz
 q only:        0.187      -3.326       3.745      -0.548       0.890      -3.932
  q+dip:       -1.724      -4.679       7.809      -0.808       1.565      -6.085
   full:       -3.568      -4.949       6.979      -0.925       1.196      -3.411

           -------------------------------------------------
          |                Geometry Summary                 |
           -------------------------------------------------

      molecular mass/u    :      204.2862000
   center of mass at/Å    :       -0.1372525      -0.1375424      -0.2027233
  moments of inertia/u·Å² :        0.4593837E+03   0.1197988E+04   0.1651034E+04
rotational constants/cm⁻¹ :        0.3669619E-01   0.1407162E-01   0.1021035E-01

 * 25 selected distances

     #   Z        #   Z                                     value/Å
     1   6 C      2  16 S                                 1.7059897
     2  16 S      3   6 C                                 1.7359199 (max)
     3   6 C      4   6 C                                 1.3921071
     1   6 C      5   6 C                                 1.3752992
     4   6 C      5   6 C                                 1.4339681
     5   6 C      6   6 C                                 1.4168006
     6   6 C      7   6 C                                 1.3589259
     9   6 C     10   8 O                                 1.3643878
    10   8 O     11   6 C                                 1.4043974
     4   6 C     12   6 C                                 1.4140180
     9   6 C     12   6 C                                 1.3665168
     3   6 C     13   6 C                                 1.4312964
    13   6 C     14   6 C                                 1.3324858
     1   6 C     15   1 H                                 1.0716634 (min)
     6   6 C     16   1 H                                 1.0798952
     8   6 C     17   1 H                                 1.0865824
     8   6 C     18   1 H                                 1.0888671
     8   6 C     19   1 H                                 1.0885966
    11   6 C     20   1 H                                 1.0890898
    11   6 C     21   1 H                                 1.0951855
    11   6 C     22   1 H                                 1.0952017
    12   6 C     23   1 H                                 1.0776089
    13   6 C     24   1 H                                 1.0820185
    14   6 C     25   1 H                                 1.0778005
    14   6 C     26   1 H                                 1.0753381

 * 4 distinct bonds (by element types)

   Z      Z             #   av. dist./Å        max./Å        min./Å
   1 H    6 C          12     1.0839873     1.0952017     1.0716634
   6 C    6 C           9     1.3912687     1.4339681     1.3324858
   6 C    8 O           2     1.3843926     1.4043974     1.3643878
   6 C   16 S           2     1.7209548     1.7359199     1.7059897


optimized geometry written to: xtbopt.xyz


           -------------------------------------------------
          | TOTAL ENERGY              -39.093223066019 Eh   |
          | GRADIENT NORM               0.000776613973 Eh/α |
          | HOMO-LUMO GAP               2.016612016872 eV   |
           -------------------------------------------------

------------------------------------------------------------------------
 * finished run on 2021/05/19 at 10:59:23.171     
------------------------------------------------------------------------
 total:
 * wall-time:     0 d,  0 h,  0 min,  0.715 sec
 *  cpu-time:     0 d,  0 h,  0 min,  0.713 sec
 * ratio c/w:     0.997 speedup
 SCF:
 * wall-time:     0 d,  0 h,  0 min,  0.045 sec
 *  cpu-time:     0 d,  0 h,  0 min,  0.045 sec
 * ratio c/w:     0.997 speedup
 ANC optimizer:
 * wall-time:     0 d,  0 h,  0 min,  0.648 sec
 *  cpu-time:     0 d,  0 h,  0 min,  0.646 sec
 * ratio c/w:     0.998 speedup

