      -----------------------------------------------------------      
     |                   =====================                   |     
     |                           x T B                           |     
     |                   =====================                   |     
     |                         S. Grimme                         |     
     |          Mulliken Center for Theoretical Chemistry        |     
     |                    University of Bonn                     |     
     |                Version 6.2 RC2 (SAW190805)                |     
      -----------------------------------------------------------      

   This program is distributed in the hope that it will be useful,
   but WITHOUT ANY WARRANTY; without even the implied warranty of
   MERCHANTABILITY or FITNESS FOR A PARTICULAR PURPOSE.
   
   FOR NON-COMMERCIAL, ACADEMIA USE ONLY.
   
   Cite this work as:
   * S. Grimme, C. Bannwarth, P. Shushkov, J. Chem. Theory Comput., 2017,
     13, 1989-2009. DOI: 10.1021/acs.jctc.7b00118
   * C. Bannwarth, S. Ehlert and S. Grimme., J. Chem. Theory Comput., 2019,
     15, 1652-1671. DOI: 10.1021/acs.jctc.8b01176
   * P. Pracht, E. Caldeweyher, S. Ehlert, S. Grimme, ChemRxiv, 2019, preprint.
     DOI: 10.26434/chemrxiv.8326202.v1
   
   for DFT-D4:
   * E. Caldeweyher, C. Bannwarth and S. Grimme, J. Chem. Phys., 2017,
     147, 034112. DOI: 10.1063/1.4993215
   * E. Caldeweyher, S. Ehlert, A. Hansen, H. Neugebauer, S. Spicher,
     C. Bannwarth and S. Grimme, J. Chem. Phys., 2019, 150, 154122.
     DOI: 10.1063/1.5090222
   
   for sTDA-xTB:
   * S. Grimme and C. Bannwarth, J. Chem. Phys., 2016, 145, 054103.
     DOI: 10.1063/1.4959605
   
   in the mass-spec context:
   * V. Asgeirsson, C. Bauer and S. Grimme, Chem. Sci., 2017, 8, 4879.
     DOI: 10.1039/c7sc00601b
   
   for metadynamics refer to:
   * S. Grimme, J. Chem. Theory Comput., 2019, 155, 2847-2862
     DOI: 10.1021/acs.jctc.9b00143
   
   with help from (in alphabetical order)
   C. Bannwarth, F. Bohle, G. Brandenburg, E. Caldeweyher, M. Checinski,
   S. Dohm, S. Ehlert, S. Ehrlich, F. März, H. Neugebauer, J. Pisarek,
   P. Pracht, P. Shushkov, and S. Spicher.
   
 * started run on 2021/05/19 at 10:59:23.188     

           -------------------------------------------------
          |                Calculation Setup                |
           -------------------------------------------------

          program call               : /ihome/ghutchison/geoffh/xtb/xtb 523.xyz -opt
          hostname                   : smp-n144
          coordinate file            : 523.xyz
          omp threads                :                     1
          number of atoms            :                    17
          number of electrons        :                    35
          charge                     :                     0
          spin                       :                   0.5
          first test random number   :      0.72576617714489


########################################################################
# WARNING! Please study the warnings concerning your input carefully
#  - the use of '-opt' is discouraged, please use '--opt' next time
########################################################################

           ------------------------------------------------- 
          |                 G F N 2 - x T B                 |
          | Geometry, Frequencies, Noncovalent interactions |
          |            JCTC 2019 parametrisation            |
           ------------------------------------------------- 
             KAB for C  - Si     :                1.0500
             KAB for H  - Pd     :                0.9500
             k(s)              :                1.8500
             k(p)              :                2.2300
             k(d)              :                2.2300
             k(f)              :                2.0000
             kEN (H0ij)        :               -2.0000
             D4 a1             :                0.5200
             D4 a2             :                5.0000
             D4 s6             :                1.0000
             D4 s8             :                2.7000
             D4 s9             :                5.0000
             alphaj            :                2.0000

  Z AO/shell   Hii/eV     exponent
  1     Wed Apr 25 08:07:45 CEST 2018   EN: 2.200 GM2: 0.406  GM3: 0.0800  RAES: 1.40
     1s    -10.707211    1.230000
  6     Wed Apr 25 08:07:45 CEST 2018   EN: 2.550 GM2: 0.538  GM3: 0.1500  RAES: 3.00
     2s    -13.970922    2.096432
     2p    -10.063292    1.800000

           ------------------------------------------------- 
          |        Self-Consistent Charge Iterations        |
           ------------------------------------------------- 

          ...................................................
          :                      SETUP                      :
          :.................................................:
          :  # basis functions                  35          :
          :  # atomic orbitals                  35          :
          :  # shells                           23          :
          :  # electrons                        35          :
          :  max. iterations                   250          :
          :  Hamiltonian                  GFN2-xTB          :
          :  restarted?                      false          :
          :  GBSA solvation                  false          :
          :  PC potential                    false          :
          :  electronic temp.          300.0000000     K    :
          :  accuracy                    1.0000000          :
          :  -> integral cutoff          0.2500000E+02      :
          :  -> integral neglect         0.1000000E-07      :
          :  -> SCF convergence          0.1000000E-05 Eh   :
          :  -> wf. convergence          0.1000000E-03 e    :
          :  Broyden damping             0.4000000          :
          ...................................................

 iter      E             dE          RMSdq      gap      omega  full diag
   1    -18.5982877 -0.185983E+02  0.302E+00   10.04       0.0  T
   2    -18.6421738 -0.438861E-01  0.183E+00    9.93       1.0  T
   3    -18.6429085 -0.734649E-03  0.829E-01   10.20       1.0  T
   4    -18.6430825 -0.174029E-03  0.123E-01   10.06       1.0  T
   5    -18.6431607 -0.782687E-04  0.546E-02   10.09       1.0  T
   6    -18.6431618 -0.105462E-05  0.165E-02   10.09       1.5  T
   7    -18.6431622 -0.409365E-06  0.199E-03   10.09      12.2  T
   8    -18.6431622 -0.625988E-08  0.773E-04   10.09      31.4  T
   9    -18.6431622 -0.151086E-08  0.226E-04   10.09     107.4  T

   *** convergence criteria satisfied after 9 iterations ***

         #    Occupation            Energy/Eh            Energy/eV
      -------------------------------------------------------------
         1        2.0000           -0.6367548             -17.3270
       ...           ...                  ...                  ...
        12        2.0000           -0.4464893             -12.1496
        13        2.0000           -0.4424712             -12.0403
        14        2.0000           -0.4387771             -11.9397
        15        2.0000           -0.4263620             -11.6019
        16        2.0000           -0.4222318             -11.4895
        17        2.0000           -0.4146732             -11.2838
        18        1.0000           -0.3053798              -8.3098 (HOMO)
        19                          0.0655201               1.7829 (LUMO)
        20                          0.0760855               2.0704
        21                          0.0776169               2.1121
        22                          0.1040305               2.8308
        23                          0.1278276               3.4784
       ...                                ...                  ...
        35                          0.3494472               9.5089
      -------------------------------------------------------------
                  HL-Gap            0.3708999 Eh           10.0927 eV
             Fermi-level           -0.2399782 Eh           -6.5301 eV

 SCC (total)                   0 d,  0 h,  0 min,  0.013 sec
 SCC setup                      ...        0 min,  0.000 sec (  1.600%)
 Dispersion                     ...        0 min,  0.000 sec (  1.208%)
 integral evaluation            ...        0 min,  0.002 sec ( 17.558%)
 zeroth order Hamiltonian       ...        0 min,  0.000 sec (  0.567%)
 iterations                     ...        0 min,  0.005 sec ( 41.129%)
 molecular gradient             ...        0 min,  0.005 sec ( 35.093%)
 printout                       ...        0 min,  0.000 sec (  2.348%)

         :::::::::::::::::::::::::::::::::::::::::::::::::::::
         ::                     SUMMARY                     ::
         :::::::::::::::::::::::::::::::::::::::::::::::::::::
         :: total energy             -18.378629866577 Eh    ::
         :: gradient norm              0.034706685097 Eh/a0 ::
         :: HOMO-LUMO gap             10.092699208229 eV    ::
         ::.................................................::
         :: SCC energy               -18.643162220840 Eh    ::
         :: -> isotropic ES            0.002960129414 Eh    ::
         :: -> anisotropic ES          0.005182067803 Eh    ::
         :: -> anisotropic XC          0.012879568521 Eh    ::
         :: -> dispersion             -0.010682436431 Eh    ::
         :: repulsion energy           0.264506161842 Eh    ::
         :: add. restraining           0.000000000000 Eh    ::
         :::::::::::::::::::::::::::::::::::::::::::::::::::::

      ----------------------------------------------------------- 
     |                   =====================                   |
     |                        A N C O P T                        |
     |                   =====================                   |
     |               Approximate Normal Coordinate               |
     |                Rational Function Optimizer                |
      ----------------------------------------------------------- 

          ...................................................
          :                      SETUP                      :
          :.................................................:
          :   optimization level            normal          :
          :   max. optcycles                   200          :
          :   ANC micro-cycles                  20          :
          :   degrees of freedom                45          :
          :.................................................:
          :   RF solver                   davidson          :
          :   input Hessian                  false          :
          :   write xtbopt.log                true          :
          :   linear?                        false          :
          :   energy convergence         0.5000000E-05 Eh   :
          :   grad. convergence          0.1000000E-02 Eh/α :
          :   maximium RF displ.         2.0000000          :
          :   Hlow (freq-cutoff)         0.5000000E-02      :
          :   Hmax (freq-cutoff)         5.0000000          :
          :   S6 in model hess.         20.0000000          :
          ...................................................

generating ANC from model Hessian ...
Using Lindh-Hessian (1995)
 Shifting diagonal of input Hessian by   0.000000000000000E+000
 Lowest  eigenvalues of input Hessian
   -0.000000   -0.000000   -0.000000   -0.000000    0.000000    0.000000
    0.005732    0.007185    0.009813    0.012829    0.016436    0.037665
    0.043196    0.046850    0.049517    0.050392    0.052324    0.053020
 Highest eigenvalues
    1.195392    1.204581    1.222704    1.234203    1.255751    1.354896
 

........................................................................
.............................. CYCLE    1 ..............................
........................................................................
   1    -18.6431622 -0.186432E+02  0.352E-05   10.09       0.0  T
   2    -18.6431622 -0.713740E-11  0.173E-05   10.09    1404.0  T
   3    -18.6431622 -0.266454E-12  0.881E-06   10.09    2753.7  T
     SCC iter.                  ...        0 min,  0.002 sec
     gradient                   ...        0 min,  0.005 sec
 * total energy  :   -18.3786299 Eh     change        0.3472657E-08 Eh
   gradient norm :     0.0347066 Eh/α   predicted     0.0000000E+00 (-100.00%)
   displ. norm   :     0.1339608 α      lambda       -0.1833749E-02
   maximum displ.:     0.0644251 α      in ANC's #2, #1, #14, ...

........................................................................
.............................. CYCLE    2 ..............................
........................................................................
   1    -18.6503882 -0.186504E+02  0.893E-02   10.09       0.0  T
   2    -18.6503941 -0.590951E-05  0.528E-02   10.07       1.0  T
   3    -18.6503942 -0.124441E-06  0.874E-03   10.07       2.8  T
   4    -18.6503942 -0.588042E-07  0.148E-03   10.07      16.4  T
   5    -18.6503943 -0.583095E-08  0.766E-04   10.07      31.7  T
     SCC iter.                  ...        0 min,  0.003 sec
     gradient                   ...        0 min,  0.004 sec
 * total energy  :   -18.3797978 Eh     change       -0.1167902E-02 Eh
   gradient norm :     0.0149493 Eh/α   predicted    -0.9333271E-03 ( -20.09%)
   displ. norm   :     0.0659898 α      lambda       -0.3887686E-03
   maximum displ.:     0.0420894 α      in ANC's #2, #4, #1, ...

........................................................................
.............................. CYCLE    3 ..............................
........................................................................
   1    -18.6535280 -0.186535E+02  0.564E-02    9.97       0.0  T
   2    -18.6535294 -0.141953E-05  0.340E-02    9.97       1.0  T
   3    -18.6535294 -0.306050E-08  0.443E-03    9.96       5.5  T
   4    -18.6535295 -0.878288E-07  0.122E-03    9.97      20.0  T
   5    -18.6535295 -0.533616E-08  0.574E-04    9.97      42.2  T
     SCC iter.                  ...        0 min,  0.003 sec
     gradient                   ...        0 min,  0.005 sec
 * total energy  :   -18.3800177 Eh     change       -0.2199338E-03 Eh
   gradient norm :     0.0034357 Eh/α   predicted    -0.1952313E-03 ( -11.23%)
   displ. norm   :     0.0341252 α      lambda       -0.3235024E-04
   maximum displ.:     0.0231481 α      in ANC's #2, #4, #5, ...

........................................................................
.............................. CYCLE    4 ..............................
........................................................................
   1    -18.6532366 -0.186532E+02  0.224E-02    9.91       0.0  T
   2    -18.6532366 -0.586249E-07  0.136E-02    9.91       1.8  T
   3    -18.6532366  0.120726E-08  0.113E-03    9.91      21.5  T
   4    -18.6532366 -0.136387E-07  0.434E-04    9.91      55.9  T
   5    -18.6532366 -0.959197E-10  0.123E-04    9.91     196.9  T
     SCC iter.                  ...        0 min,  0.003 sec
     gradient                   ...        0 min,  0.005 sec
 * total energy  :   -18.3800363 Eh     change       -0.1855639E-04 Eh
   gradient norm :     0.0010498 Eh/α   predicted    -0.1619430E-04 ( -12.73%)
   displ. norm   :     0.0191367 α      lambda       -0.3873001E-05
   maximum displ.:     0.0108537 α      in ANC's #4, #5, #2, ...

........................................................................
.............................. CYCLE    5 ..............................
........................................................................
   1    -18.6529656 -0.186530E+02  0.107E-02    9.90       0.0  T
   2    -18.6529657 -0.171324E-07  0.636E-03    9.90       3.8  T
   3    -18.6529657 -0.789136E-09  0.539E-04    9.90      45.0  T
   4    -18.6529657 -0.194086E-08  0.214E-04    9.90     113.6  T
     SCC iter.                  ...        0 min,  0.002 sec
     gradient                   ...        0 min,  0.004 sec
 * total energy  :   -18.3800384 Eh     change       -0.2193109E-05 Eh
   gradient norm :     0.0005034 Eh/α   predicted    -0.1936697E-05 ( -11.69%)
   displ. norm   :     0.0076289 α      lambda       -0.9259049E-06
   maximum displ.:     0.0046291 α      in ANC's #1, #2, #5, ...

   *** GEOMETRY OPTIMIZATION CONVERGED AFTER 5 ITERATIONS ***

------------------------------------------------------------------------
 total energy gain   :        -0.0014086 Eh       -0.8839 kcal/mol
 total RMSD          :         0.0528414 a0        0.0280 Å
 total power (kW/mol):        -0.7396464 (step)  -61.2391 (real)
------------------------------------------------------------------------

 ANCopt (total)                0 d,  0 h,  0 min,  0.060 sec
 optimizer setup                ...        0 min,  0.000 sec (  0.229%)
 model hessian                  ...        0 min,  0.010 sec ( 16.324%)
 ANC generation                 ...        0 min,  0.000 sec (  0.729%)
 coordinate transformation      ...        0 min,  0.000 sec (  0.115%)
 single point calculation       ...        0 min,  0.048 sec ( 79.461%)
 optimization log               ...        0 min,  0.000 sec (  0.708%)
 hessian update                 ...        0 min,  0.000 sec (  0.088%)
 rational function              ...        0 min,  0.001 sec (  1.695%)

================
 final structure:
================
$coord
   -1.39663382099602   -1.94246711596040   -0.49408457487568      C 
   -2.23088056377830    0.66626648568350    0.56366029014845      C 
   -2.58231245408714    0.61751673558460    3.31772988053715      C 
   -0.00978253178490    2.34290264783175   -0.25409952270887      C 
    2.35294639823133    0.70535105513650    0.11236130097594      C 
    1.44003192556731   -2.05765017305553    0.04187477276646      C 
   -1.74971474879592   -1.97445083556052   -2.52477397263660      H 
   -2.42778637354412   -3.49549064469714    0.37648471184365      H 
   -3.99993841923067    1.23338489636983   -0.34893174516530      H 
   -1.00793350557785    0.87449278913430    4.56701667487255      H 
   -4.37225803296857    0.10282316675989    4.11888128340626      H 
    0.07748935431600    4.08881146724818    0.83223501229246      H 
   -0.23351917938802    2.83333888004323   -2.24399561475340      H 
    3.23882187169593    1.11838082796430    1.92482127993612      H 
    3.74588895062075    1.08335985599317   -1.35627717026822      H 
    1.77683035922225   -2.96781996048689    1.85854409540273      H 
    2.42356807802926   -3.15204610170680   -1.39891691317317      H 
$end
           -------------------------------------------------
          |                Final Singlepoint                |
           -------------------------------------------------

          ...................................................
          :                      SETUP                      :
          :.................................................:
          :  # basis functions                  35          :
          :  # atomic orbitals                  35          :
          :  # shells                           23          :
          :  # electrons                        35          :
          :  max. iterations                   250          :
          :  Hamiltonian                  GFN2-xTB          :
          :  restarted?                      false          :
          :  GBSA solvation                  false          :
          :  PC potential                    false          :
          :  electronic temp.          300.0000000     K    :
          :  accuracy                    1.0000000          :
          :  -> integral cutoff          0.2500000E+02      :
          :  -> integral neglect         0.1000000E-07      :
          :  -> SCF convergence          0.1000000E-05 Eh   :
          :  -> wf. convergence          0.1000000E-03 e    :
          :  Broyden damping             0.4000000          :
          ...................................................

 iter      E             dE          RMSdq      gap      omega  full diag
   1    -18.6529657 -0.186530E+02  0.437E-05    9.90       0.0  T
   2    -18.6529657 -0.563460E-11  0.228E-05    9.90    1063.7  T
   3    -18.6529657 -0.685674E-12  0.115E-05    9.90    2103.5  T

   *** convergence criteria satisfied after 3 iterations ***

         #    Occupation            Energy/Eh            Energy/eV
      -------------------------------------------------------------
         1        2.0000           -0.6354289             -17.2909
       ...           ...                  ...                  ...
        12        2.0000           -0.4443999             -12.0927
        13        2.0000           -0.4420778             -12.0295
        14        2.0000           -0.4384485             -11.9308
        15        2.0000           -0.4262425             -11.5986
        16        2.0000           -0.4238313             -11.5330
        17        2.0000           -0.4159915             -11.3197
        18        1.0000           -0.3028907              -8.2421 (HOMO)
        19                          0.0608507               1.6558 (LUMO)
        20                          0.0669211               1.8210
        21                          0.0878394               2.3902
        22                          0.1149580               3.1282
        23                          0.1279950               3.4829
       ...                                ...                  ...
        35                          0.3700917              10.0707
      -------------------------------------------------------------
                  HL-Gap            0.3637414 Eh            9.8979 eV
             Fermi-level           -0.2402305 Eh           -6.5370 eV

 SCC (total)                   0 d,  0 h,  0 min,  0.009 sec
 SCC setup                      ...        0 min,  0.000 sec (  1.467%)
 Dispersion                     ...        0 min,  0.000 sec (  0.931%)
 integral evaluation            ...        0 min,  0.002 sec ( 23.518%)
 zeroth order Hamiltonian       ...        0 min,  0.000 sec (  0.643%)
 iterations                     ...        0 min,  0.002 sec ( 20.480%)
 molecular gradient             ...        0 min,  0.005 sec ( 49.765%)
 printout                       ...        0 min,  0.000 sec (  2.663%)

         :::::::::::::::::::::::::::::::::::::::::::::::::::::
         ::                     SUMMARY                     ::
         :::::::::::::::::::::::::::::::::::::::::::::::::::::
         :: total energy             -18.380038444005 Eh    ::
         :: gradient norm              0.000503180373 Eh/a0 ::
         :: HOMO-LUMO gap              9.897906739153 eV    ::
         ::.................................................::
         :: SCC energy               -18.652965653022 Eh    ::
         :: -> isotropic ES            0.003145288939 Eh    ::
         :: -> anisotropic ES          0.005063303462 Eh    ::
         :: -> anisotropic XC          0.012597345528 Eh    ::
         :: -> dispersion             -0.010691146440 Eh    ::
         :: repulsion energy           0.272901302395 Eh    ::
         :: add. restraining           0.000000000000 Eh    ::
         :::::::::::::::::::::::::::::::::::::::::::::::::::::

           -------------------------------------------------
          |                Property Printout                |
           -------------------------------------------------

    * Orbital Energies and Occupations

         #    Occupation            Energy/Eh            Energy/eV
      -------------------------------------------------------------
         1        2.0000           -0.6354289             -17.2909
       ...           ...                  ...                  ...
         6        2.0000           -0.5400488             -14.6955
         7        2.0000           -0.5237363             -14.2516
         8        2.0000           -0.5143270             -13.9955
         9        2.0000           -0.4892616             -13.3135
        10        2.0000           -0.4804128             -13.0727
        11        2.0000           -0.4664814             -12.6936
        12        2.0000           -0.4443999             -12.0927
        13        2.0000           -0.4420778             -12.0295
        14        2.0000           -0.4384485             -11.9308
        15        2.0000           -0.4262425             -11.5986
        16        2.0000           -0.4238313             -11.5330
        17        2.0000           -0.4159915             -11.3197
        18        1.0000           -0.3028907              -8.2421 (HOMO)
        19                          0.0608507               1.6558 (LUMO)
        20                          0.0669211               1.8210
        21                          0.0878394               2.3902
        22                          0.1149580               3.1282
        23                          0.1279950               3.4829
        24                          0.1389203               3.7802
        25                          0.1498990               4.0790
        26                          0.1711196               4.6564
        27                          0.1872341               5.0949
        28                          0.1975260               5.3750
        29                          0.2125734               5.7844
       ...                                ...                  ...
        35                          0.3700917              10.0707
      -------------------------------------------------------------
                  HL-Gap            0.3637414 Eh            9.8979 eV
             Fermi-level           -0.2402305 Eh           -6.5370 eV

     #   Z        covCN         q      C6AA      α(0)
     1   6 C      3.827    -0.054    21.526     6.602
     2   6 C      3.869    -0.004    20.600     6.454
     3   6 C      2.838    -0.111    30.810     9.096
     4   6 C      3.829    -0.059    21.609     6.614
     5   6 C      3.815    -0.056    21.559     6.608
     6   6 C      3.815    -0.056    21.560     6.609
     7   1 H      0.924     0.034     2.531     2.488
     8   1 H      0.925     0.031     2.568     2.506
     9   1 H      0.924     0.031     2.572     2.508
    10   1 H      0.926     0.035     2.518     2.481
    11   1 H      0.926     0.026     2.650     2.546
    12   1 H      0.925     0.033     2.551     2.498
    13   1 H      0.924     0.030     2.585     2.515
    14   1 H      0.925     0.031     2.571     2.507
    15   1 H      0.925     0.028     2.614     2.528
    16   1 H      0.925     0.032     2.562     2.503
    17   1 H      0.925     0.029     2.602     2.522

 Mol. C6AA /au·bohr⁶  :       2138.213094
 Mol. C8AA /au·bohr⁸  :      46307.025690
 Mol. α(0) /au        :         69.586293

(R)spin-density population

 Mulliken population n(s)   n(p)   n(d)
     1 C   0.0685   0.012  0.056  0.000
     2 C   0.0072   0.000  0.007  0.000
     3 C   0.8852   0.001  0.884  0.000
     4 C   0.0136   0.002  0.012  0.000
     5 C   0.0011   0.000  0.001  0.000
     6 C   0.0014   0.000  0.001  0.000
     7 H   0.0046   0.005  0.000  0.000
     8 H   0.0000   0.000  0.000  0.000
     9 H   0.0141   0.014  0.000  0.000
    10 H   0.0003   0.000  0.000  0.000
    11 H   0.0001   0.000  0.000  0.000
    12 H   0.0001   0.000  0.000  0.000
    13 H   0.0013   0.001  0.000  0.000
    14 H   0.0002   0.000  0.000  0.000
    15 H   0.0005   0.001  0.000  0.000
    16 H   0.0000   0.000  0.000  0.000
    17 H   0.0017   0.002  0.000  0.000

Wiberg/Mayer (AO) data.
largest (>0.10) Wiberg bond orders for each atom
          total WBO             WBO to atom ...
     1  C   3.928        C    6 1.008    H    8 0.981    H    7 0.977    C    2 0.930
     2  C   3.989        C    3 1.095    C    4 0.982    H    9 0.957    C    1 0.930
     3  C   3.099        C    2 1.095    H   11 0.986    H   10 0.984
     4  C   3.984        C    5 1.006    C    2 0.982    H   12 0.980    H   13 0.980
     5  C   3.997        C    4 1.006    C    6 1.001    H   14 0.983    H   15 0.983
     6  C   3.996        C    1 1.008    C    5 1.001    H   16 0.984    H   17 0.981
     7  H   0.994        C    1 0.977
     8  H   0.999        C    1 0.981
     9  H   0.985        C    2 0.957
    10  H   0.998        C    3 0.984
    11  H   0.999        C    3 0.986
    12  H   0.999        C    4 0.980
    13  H   0.998        C    4 0.980
    14  H   0.999        C    5 0.983
    15  H   0.999        C    5 0.983
    16  H   0.999        C    6 0.984
    17  H   0.997        C    6 0.981

molecular dipole:
                 x           y           z       tot (Debye)
 q only:        0.083      -0.035      -0.159
   full:        0.077      -0.070      -0.175       0.517
molecular quadrupole (traceless):
                xx          xy          yy          xz          yz          zz
 q only:        0.099       0.189       0.348       0.784      -0.125      -0.447
  q+dip:       -0.081       0.662      -1.085       0.970      -0.399       1.167
   full:       -0.004       0.466      -0.321       0.903      -0.339       0.325

           -------------------------------------------------
          |                Geometry Summary                 |
           -------------------------------------------------

      molecular mass/u    :       83.1529000
   center of mass at/Å    :       -0.2017027       0.0237339       0.2885167
  moments of inertia/u·Å² :        0.9990477E+02   0.1406622E+03   0.1746709E+03
rotational constants/cm⁻¹ :        0.1687370E+00   0.1198448E+00   0.9651085E-01

 * 16 selected distances

     #   Z        #   Z                                     value/Å
     2   6 C      3   6 C                                 1.4694348
     2   6 C      4   6 C                                 1.5348984
     4   6 C      5   6 C                                 1.5335514
     1   6 C      6   6 C                                 1.5288729
     5   6 C      6   6 C                                 1.5403110 (max)
     1   6 C      7   1 H                                 1.0908484
     1   6 C      8   1 H                                 1.0887491
     2   6 C      9   1 H                                 1.0952836
     3   6 C     10   1 H                                 1.0722107 (min)
     3   6 C     11   1 H                                 1.0728941
     4   6 C     12   1 H                                 1.0891204
     4   6 C     13   1 H                                 1.0909618
     5   6 C     14   1 H                                 1.0896915
     5   6 C     15   1 H                                 1.0896528
     6   6 C     16   1 H                                 1.0899163
     6   6 C     17   1 H                                 1.0897617

 * 2 distinct bonds (by element types)

   Z      Z             #   av. dist./Å        max./Å        min./Å
   1 H    6 C          11     1.0871900     1.0952836     1.0722107
   6 C    6 C           5     1.5214137     1.5403110     1.4694348


optimized geometry written to: xtbopt.xyz


           -------------------------------------------------
          | TOTAL ENERGY              -18.380038444005 Eh   |
          | GRADIENT NORM               0.000503180373 Eh/α |
          | HOMO-LUMO GAP               9.897906739153 eV   |
           -------------------------------------------------

------------------------------------------------------------------------
 * finished run on 2021/05/19 at 10:59:23.285     
------------------------------------------------------------------------
 total:
 * wall-time:     0 d,  0 h,  0 min,  0.097 sec
 *  cpu-time:     0 d,  0 h,  0 min,  0.097 sec
 * ratio c/w:     0.995 speedup
 SCF:
 * wall-time:     0 d,  0 h,  0 min,  0.013 sec
 *  cpu-time:     0 d,  0 h,  0 min,  0.013 sec
 * ratio c/w:     0.997 speedup
 ANC optimizer:
 * wall-time:     0 d,  0 h,  0 min,  0.070 sec
 *  cpu-time:     0 d,  0 h,  0 min,  0.070 sec
 * ratio c/w:     0.998 speedup

