      -----------------------------------------------------------      
     |                   =====================                   |     
     |                           x T B                           |     
     |                   =====================                   |     
     |                         S. Grimme                         |     
     |          Mulliken Center for Theoretical Chemistry        |     
     |                    University of Bonn                     |     
     |                Version 6.2 RC2 (SAW190805)                |     
      -----------------------------------------------------------      

   This program is distributed in the hope that it will be useful,
   but WITHOUT ANY WARRANTY; without even the implied warranty of
   MERCHANTABILITY or FITNESS FOR A PARTICULAR PURPOSE.
   
   FOR NON-COMMERCIAL, ACADEMIA USE ONLY.
   
   Cite this work as:
   * S. Grimme, C. Bannwarth, P. Shushkov, J. Chem. Theory Comput., 2017,
     13, 1989-2009. DOI: 10.1021/acs.jctc.7b00118
   * C. Bannwarth, S. Ehlert and S. Grimme., J. Chem. Theory Comput., 2019,
     15, 1652-1671. DOI: 10.1021/acs.jctc.8b01176
   * P. Pracht, E. Caldeweyher, S. Ehlert, S. Grimme, ChemRxiv, 2019, preprint.
     DOI: 10.26434/chemrxiv.8326202.v1
   
   for DFT-D4:
   * E. Caldeweyher, C. Bannwarth and S. Grimme, J. Chem. Phys., 2017,
     147, 034112. DOI: 10.1063/1.4993215
   * E. Caldeweyher, S. Ehlert, A. Hansen, H. Neugebauer, S. Spicher,
     C. Bannwarth and S. Grimme, J. Chem. Phys., 2019, 150, 154122.
     DOI: 10.1063/1.5090222
   
   for sTDA-xTB:
   * S. Grimme and C. Bannwarth, J. Chem. Phys., 2016, 145, 054103.
     DOI: 10.1063/1.4959605
   
   in the mass-spec context:
   * V. Asgeirsson, C. Bauer and S. Grimme, Chem. Sci., 2017, 8, 4879.
     DOI: 10.1039/c7sc00601b
   
   for metadynamics refer to:
   * S. Grimme, J. Chem. Theory Comput., 2019, 155, 2847-2862
     DOI: 10.1021/acs.jctc.9b00143
   
   with help from (in alphabetical order)
   C. Bannwarth, F. Bohle, G. Brandenburg, E. Caldeweyher, M. Checinski,
   S. Dohm, S. Ehlert, S. Ehrlich, F. März, H. Neugebauer, J. Pisarek,
   P. Pracht, P. Shushkov, and S. Spicher.
   
 * started run on 2021/05/19 at 10:59:23.329     

           -------------------------------------------------
          |                Calculation Setup                |
           -------------------------------------------------

          program call               : /ihome/ghutchison/geoffh/xtb/xtb 524.xyz -opt
          hostname                   : smp-n144
          coordinate file            : 524.xyz
          omp threads                :                     1
          number of atoms            :                    23
          number of electrons        :                    70
          charge                     :                     0
          spin                       :                   0.0
          first test random number   :      0.70798987484497


########################################################################
# WARNING! Please study the warnings concerning your input carefully
#  - the use of '-opt' is discouraged, please use '--opt' next time
########################################################################

           ------------------------------------------------- 
          |                 G F N 2 - x T B                 |
          | Geometry, Frequencies, Noncovalent interactions |
          |            JCTC 2019 parametrisation            |
           ------------------------------------------------- 
             KAB for C  - Si     :                1.0500
             KAB for H  - Pd     :                0.9500
             k(s)              :                1.8500
             k(p)              :                2.2300
             k(d)              :                2.2300
             k(f)              :                2.0000
             kEN (H0ij)        :               -2.0000
             D4 a1             :                0.5200
             D4 a2             :                5.0000
             D4 s6             :                1.0000
             D4 s8             :                2.7000
             D4 s9             :                5.0000
             alphaj            :                2.0000

  Z AO/shell   Hii/eV     exponent
  1     Wed Apr 25 08:07:45 CEST 2018   EN: 2.200 GM2: 0.406  GM3: 0.0800  RAES: 1.40
     1s    -10.707211    1.230000
  6     Wed Apr 25 08:07:45 CEST 2018   EN: 2.550 GM2: 0.538  GM3: 0.1500  RAES: 3.00
     2s    -13.970922    2.096432
     2p    -10.063292    1.800000
  9     Mon Apr 23 13:58:50 CEST 2018   EN: 3.980 GM2: 0.532  GM3: 0.1426  RAES: 2.40
     2s    -23.458179    2.416361
     2p    -15.746583    2.308399
 16     Tue Apr 24 11:44:34 CEST 2018   EN: 2.580 GM2: 0.340  GM3:-0.0502  RAES: 3.10
     3s    -20.029654    1.981333
     3p    -11.377694    2.025643
     3d     -0.420282    1.702555

           ------------------------------------------------- 
          |        Self-Consistent Charge Iterations        |
           ------------------------------------------------- 

          ...................................................
          :                      SETUP                      :
          :.................................................:
          :  # basis functions                  68          :
          :  # atomic orbitals                  67          :
          :  # shells                           37          :
          :  # electrons                        70          :
          :  max. iterations                   250          :
          :  Hamiltonian                  GFN2-xTB          :
          :  restarted?                      false          :
          :  GBSA solvation                  false          :
          :  PC potential                    false          :
          :  electronic temp.          300.0000000     K    :
          :  accuracy                    1.0000000          :
          :  -> integral cutoff          0.2500000E+02      :
          :  -> integral neglect         0.1000000E-07      :
          :  -> SCF convergence          0.1000000E-05 Eh   :
          :  -> wf. convergence          0.1000000E-03 e    :
          :  Broyden damping             0.4000000          :
          ...................................................

 iter      E             dE          RMSdq      gap      omega  full diag
   1    -39.6006312 -0.396006E+02  0.417E+00    3.23       0.0  T
   2    -39.6468633 -0.462321E-01  0.236E+00    3.27       1.0  T
   3    -39.6452820  0.158135E-02  0.938E-01    3.26       1.0  T
   4    -39.6479496 -0.266763E-02  0.417E-01    3.25       1.0  T
   5    -39.6506504 -0.270078E-02  0.143E-01    3.26       1.0  T
   6    -39.6508160 -0.165572E-03  0.578E-02    3.25       1.0  T
   7    -39.6508405 -0.245302E-04  0.262E-02    3.26       1.0  T
   8    -39.6508497 -0.922341E-05  0.120E-02    3.26       1.7  T
   9    -39.6508501 -0.346282E-06  0.419E-03    3.26       5.0  T
  10    -39.6508502 -0.107647E-06  0.193E-03    3.26      10.8  T
  11    -39.6508502 -0.278871E-07  0.906E-04    3.26      23.0  T
  12    -39.6508502 -0.570056E-08  0.445E-04    3.26      46.9  T

   *** convergence criteria satisfied after 12 iterations ***

         #    Occupation            Energy/Eh            Energy/eV
      -------------------------------------------------------------
         1        2.0000           -0.8136148             -22.1396
       ...           ...                  ...                  ...
        29        2.0000           -0.4536983             -12.3458
        30        2.0000           -0.4460967             -12.1389
        31        2.0000           -0.4432828             -12.0623
        32        2.0000           -0.4375739             -11.9070
        33        2.0000           -0.4269611             -11.6182
        34        2.0000           -0.4023542             -10.9486
        35        2.0000           -0.3865456             -10.5184 (HOMO)
        36                         -0.2669204              -7.2633 (LUMO)
        37                         -0.2188863              -5.9562
        38                         -0.2061234              -5.6089
        39                         -0.1832170              -4.9856
        40                         -0.1168243              -3.1790
       ...                                ...                  ...
        67                          0.6524998              17.7554
      -------------------------------------------------------------
                  HL-Gap            0.1196252 Eh            3.2552 eV
             Fermi-level           -0.3267330 Eh           -8.8909 eV

 SCC (total)                   0 d,  0 h,  0 min,  0.037 sec
 SCC setup                      ...        0 min,  0.000 sec (  0.912%)
 Dispersion                     ...        0 min,  0.000 sec (  0.827%)
 integral evaluation            ...        0 min,  0.009 sec ( 23.377%)
 zeroth order Hamiltonian       ...        0 min,  0.000 sec (  0.503%)
 iterations                     ...        0 min,  0.014 sec ( 37.343%)
 molecular gradient             ...        0 min,  0.013 sec ( 35.896%)
 printout                       ...        0 min,  0.000 sec (  0.998%)

         :::::::::::::::::::::::::::::::::::::::::::::::::::::
         ::                     SUMMARY                     ::
         :::::::::::::::::::::::::::::::::::::::::::::::::::::
         :: total energy             -39.199271136686 Eh    ::
         :: gradient norm              0.064726828919 Eh/a0 ::
         :: HOMO-LUMO gap              3.255167460749 eV    ::
         ::.................................................::
         :: SCC energy               -39.650850204218 Eh    ::
         :: -> isotropic ES            0.028951592001 Eh    ::
         :: -> anisotropic ES         -0.000162637407 Eh    ::
         :: -> anisotropic XC          0.005125330174 Eh    ::
         :: -> dispersion             -0.022935914283 Eh    ::
         :: repulsion energy           0.451415687626 Eh    ::
         :: add. restraining           0.000000000000 Eh    ::
         :::::::::::::::::::::::::::::::::::::::::::::::::::::

      ----------------------------------------------------------- 
     |                   =====================                   |
     |                        A N C O P T                        |
     |                   =====================                   |
     |               Approximate Normal Coordinate               |
     |                Rational Function Optimizer                |
      ----------------------------------------------------------- 

          ...................................................
          :                      SETUP                      :
          :.................................................:
          :   optimization level            normal          :
          :   max. optcycles                   200          :
          :   ANC micro-cycles                  20          :
          :   degrees of freedom                63          :
          :.................................................:
          :   RF solver                   davidson          :
          :   input Hessian                  false          :
          :   write xtbopt.log                true          :
          :   linear?                        false          :
          :   energy convergence         0.5000000E-05 Eh   :
          :   grad. convergence          0.1000000E-02 Eh/α :
          :   maximium RF displ.         2.0000000          :
          :   Hlow (freq-cutoff)         0.5000000E-02      :
          :   Hmax (freq-cutoff)         5.0000000          :
          :   S6 in model hess.         20.0000000          :
          ...................................................

generating ANC from model Hessian ...
Using Lindh-Hessian (1995)
 Shifting diagonal of input Hessian by   3.382459932272710E-003
 Lowest  eigenvalues of input Hessian
   -0.000000   -0.000000   -0.000000   -0.000000    0.000000    0.000000
    0.005000    0.006346    0.008902    0.010159    0.011945    0.017128
    0.018285    0.024443    0.027820    0.031947    0.035109    0.041478
 Highest eigenvalues
    1.488092    1.557434    1.666588    1.773112    1.819232    1.972725
 

........................................................................
.............................. CYCLE    1 ..............................
........................................................................
   1    -39.6508502 -0.396509E+02  0.191E-04    3.26       0.0  T
   2    -39.6508502 -0.526725E-10  0.125E-04    3.26     166.7  T
   3    -39.6508502  0.202220E-10  0.101E-04    3.26     206.3  T
     SCC iter.                  ...        0 min,  0.004 sec
     gradient                   ...        0 min,  0.014 sec
 * total energy  :   -39.1992711 Eh     change       -0.5614972E-08 Eh
   gradient norm :     0.0647260 Eh/α   predicted     0.0000000E+00 (-100.00%)
   displ. norm   :     0.2155911 α      lambda       -0.5657194E-02
   maximum displ.:     0.1025174 α      in ANC's #9, #10, #6, ...

........................................................................
.............................. CYCLE    2 ..............................
........................................................................
   1    -39.6666332 -0.396666E+02  0.220E-01    3.32       0.0  T
   2    -39.6666718 -0.386108E-04  0.125E-01    3.33       1.0  T
   3    -39.6666098  0.619368E-04  0.790E-02    3.32       1.0  T
   4    -39.6667232 -0.113359E-03  0.219E-02    3.32       1.0  T
   5    -39.6667255 -0.225615E-05  0.115E-02    3.33       1.8  T
   6    -39.6667264 -0.989984E-06  0.374E-03    3.32       5.6  T
   7    -39.6667267 -0.223104E-06  0.872E-04    3.32      23.9  T
     SCC iter.                  ...        0 min,  0.008 sec
     gradient                   ...        0 min,  0.013 sec
 * total energy  :   -39.2030917 Eh     change       -0.3820509E-02 Eh
   gradient norm :     0.0249146 Eh/α   predicted    -0.2960079E-02 ( -22.52%)
   displ. norm   :     0.1826777 α      lambda       -0.1475050E-02
   maximum displ.:     0.0866734 α      in ANC's #4, #6, #9, ...

........................................................................
.............................. CYCLE    3 ..............................
........................................................................
   1    -39.6721109 -0.396721E+02  0.152E-01    3.34       0.0  T
   2    -39.6721281 -0.171747E-04  0.872E-02    3.35       1.0  T
   3    -39.6720948  0.332402E-04  0.540E-02    3.34       1.0  T
   4    -39.6721456 -0.507368E-04  0.147E-02    3.35       1.4  T
   5    -39.6721468 -0.123709E-05  0.716E-03    3.35       2.9  T
   6    -39.6721473 -0.455969E-06  0.239E-03    3.35       8.7  T
   7    -39.6721474 -0.893934E-07  0.612E-04    3.35      34.1  T
     SCC iter.                  ...        0 min,  0.008 sec
     gradient                   ...        0 min,  0.013 sec
 * total energy  :   -39.2039095 Eh     change       -0.8178662E-03 Eh
   gradient norm :     0.0070429 Eh/α   predicted    -0.7621373E-03 (  -6.81%)
   displ. norm   :     0.1143651 α      lambda       -0.2218586E-03
   maximum displ.:     0.0675421 α      in ANC's #4, #1, #7, ...

........................................................................
.............................. CYCLE    4 ..............................
........................................................................
   1    -39.6711442 -0.396711E+02  0.794E-02    3.34       0.0  T
   2    -39.6711460 -0.184015E-05  0.444E-02    3.34       1.0  T
   3    -39.6711435  0.249900E-05  0.138E-02    3.34       1.5  T
   4    -39.6711464 -0.293361E-05  0.589E-03    3.34       3.5  T
   5    -39.6711467 -0.253668E-06  0.212E-03    3.34       9.8  T
   6    -39.6711467 -0.443481E-07  0.711E-04    3.34      29.3  T
     SCC iter.                  ...        0 min,  0.007 sec
     gradient                   ...        0 min,  0.013 sec
 * total energy  :   -39.2040348 Eh     change       -0.1252878E-03 Eh
   gradient norm :     0.0047845 Eh/α   predicted    -0.1123803E-03 ( -10.30%)
   displ. norm   :     0.1265324 α      lambda       -0.1492889E-03
   maximum displ.:     0.0717745 α      in ANC's #4, #1, #5, ...

........................................................................
.............................. CYCLE    5 ..............................
........................................................................
   1    -39.6698855 -0.396699E+02  0.788E-02    3.32       0.0  T
   2    -39.6698864 -0.887199E-06  0.459E-02    3.32       1.0  T
   3    -39.6698863  0.763634E-07  0.635E-03    3.32       3.3  T
   4    -39.6698865 -0.210900E-06  0.356E-03    3.32       5.9  T
   5    -39.6698866 -0.110237E-06  0.123E-03    3.32      17.0  T
   6    -39.6698867 -0.165413E-07  0.401E-04    3.32      52.0  T
     SCC iter.                  ...        0 min,  0.007 sec
     gradient                   ...        0 min,  0.013 sec
 * total energy  :   -39.2041383 Eh     change       -0.1034798E-03 Eh
   gradient norm :     0.0038561 Eh/α   predicted    -0.7584133E-04 ( -26.71%)
   displ. norm   :     0.1544047 α      lambda       -0.1155978E-03
   maximum displ.:     0.0996495 α      in ANC's #1, #4, #5, ...

........................................................................
.............................. CYCLE    6 ..............................
........................................................................
   1    -39.6692459 -0.396692E+02  0.963E-02    3.30       0.0  T
   2    -39.6692469 -0.102286E-05  0.566E-02    3.30       1.0  T
   3    -39.6692441  0.284080E-05  0.135E-02    3.30       1.5  T
   4    -39.6692474 -0.331019E-05  0.425E-03    3.30       4.9  T
   5    -39.6692475 -0.929963E-07  0.158E-03    3.30      13.2  T
   6    -39.6692475 -0.330144E-07  0.543E-04    3.30      38.4  T
   7    -39.6692475 -0.194451E-08  0.310E-04    3.30      67.3  T
     SCC iter.                  ...        0 min,  0.008 sec
     gradient                   ...        0 min,  0.014 sec
 * total energy  :   -39.2042310 Eh     change       -0.9272125E-04 Eh
   gradient norm :     0.0046018 Eh/α   predicted    -0.5917791E-04 ( -36.18%)
   displ. norm   :     0.2182206 α      lambda       -0.1467208E-03
   maximum displ.:     0.1423336 α      in ANC's #1, #4, #5, ...

........................................................................
.............................. CYCLE    7 ..............................
........................................................................
   1    -39.6690649 -0.396691E+02  0.140E-01    3.27       0.0  T
   2    -39.6690676 -0.266771E-05  0.823E-02    3.27       1.0  T
   3    -39.6690583  0.930649E-05  0.247E-02    3.28       1.0  T
   4    -39.6690690 -0.107334E-04  0.655E-03    3.28       3.2  T
   5    -39.6690692 -0.197893E-06  0.220E-03    3.28       9.5  T
   6    -39.6690693 -0.441185E-07  0.778E-04    3.28      26.8  T
     SCC iter.                  ...        0 min,  0.007 sec
     gradient                   ...        0 min,  0.013 sec
 * total energy  :   -39.2043560 Eh     change       -0.1249880E-03 Eh
   gradient norm :     0.0054882 Eh/α   predicted    -0.7686507E-04 ( -38.50%)
   displ. norm   :     0.3362588 α      lambda       -0.2220460E-03
   maximum displ.:     0.2175765 α      in ANC's #1, #4, #5, ...

........................................................................
.............................. CYCLE    8 ..............................
........................................................................
   1    -39.6685279 -0.396685E+02  0.219E-01    3.23       0.0  T
   2    -39.6685348 -0.683241E-05  0.129E-01    3.23       1.0  T
   3    -39.6685099  0.248300E-04  0.411E-02    3.23       1.0  T
   4    -39.6685386 -0.286497E-04  0.107E-02    3.23       2.0  T
   5    -39.6685391 -0.476617E-06  0.337E-03    3.23       6.2  T
   6    -39.6685392 -0.907316E-07  0.117E-03    3.23      17.8  T
   7    -39.6685392 -0.512517E-08  0.570E-04    3.23      36.6  T
     SCC iter.                  ...        0 min,  0.008 sec
     gradient                   ...        0 min,  0.013 sec
 * total energy  :   -39.2045476 Eh     change       -0.1915812E-03 Eh
   gradient norm :     0.0071975 Eh/α   predicted    -0.1235768E-03 ( -35.50%)
   displ. norm   :     0.4422234 α      lambda       -0.3198980E-03
   maximum displ.:     0.2882060 α      in ANC's #1, #4, #5, ...

........................................................................
.............................. CYCLE    9 ..............................
........................................................................
   1    -39.6677236 -0.396677E+02  0.286E-01    3.18       0.0  T
   2    -39.6677351 -0.115058E-04  0.168E-01    3.18       1.0  T
   3    -39.6676813  0.538775E-04  0.603E-02    3.18       1.0  T
   4    -39.6677431 -0.618355E-04  0.138E-02    3.18       1.5  T
   5    -39.6677437 -0.636061E-06  0.454E-03    3.18       4.6  T
   6    -39.6677439 -0.166283E-06  0.160E-03    3.18      13.1  T
   7    -39.6677439 -0.927832E-08  0.794E-04    3.18      26.3  T
     SCC iter.                  ...        0 min,  0.008 sec
     gradient                   ...        0 min,  0.013 sec
 * total energy  :   -39.2048074 Eh     change       -0.2597834E-03 Eh
   gradient norm :     0.0109818 Eh/α   predicted    -0.1912312E-03 ( -26.39%)
   displ. norm   :     0.4874386 α      lambda       -0.4333666E-03
   maximum displ.:     0.3161784 α      in ANC's #1, #4, #5, ...

........................................................................
.............................. CYCLE   10 ..............................
........................................................................
   1    -39.6680768 -0.396681E+02  0.305E-01    3.14       0.0  T
   2    -39.6680900 -0.132097E-04  0.180E-01    3.14       1.0  T
   3    -39.6680186  0.713695E-04  0.694E-02    3.14       1.0  T
   4    -39.6681002 -0.816393E-04  0.146E-02    3.14       1.4  T
   5    -39.6681009 -0.652243E-06  0.494E-03    3.14       4.2  T
   6    -39.6681011 -0.189847E-06  0.178E-03    3.14      11.7  T
   7    -39.6681011 -0.129141E-07  0.907E-04    3.14      23.0  T
     SCC iter.                  ...        0 min,  0.008 sec
     gradient                   ...        0 min,  0.013 sec
 * total energy  :   -39.2051228 Eh     change       -0.3154482E-03 Eh
   gradient norm :     0.0150106 Eh/α   predicted    -0.2681666E-03 ( -14.99%)
   displ. norm   :     0.2928539 α      lambda       -0.5198476E-03
   maximum displ.:     0.1668218 α      in ANC's #1, #4, #3, ...

........................................................................
.............................. CYCLE   11 ..............................
........................................................................
   1    -39.6742688 -0.396743E+02  0.168E-01    3.14       0.0  T
   2    -39.6742722 -0.343137E-05  0.100E-01    3.14       1.0  T
   3    -39.6742472  0.250333E-04  0.409E-02    3.14       1.0  T
   4    -39.6742758 -0.285657E-04  0.711E-03    3.14       2.9  T
   5    -39.6742758 -0.820656E-07  0.286E-03    3.14       7.3  T
   6    -39.6742759 -0.575498E-07  0.122E-03    3.14      17.0  T
     SCC iter.                  ...        0 min,  0.007 sec
     gradient                   ...        0 min,  0.013 sec
 * total energy  :   -39.2054351 Eh     change       -0.3123258E-03 Eh
   gradient norm :     0.0121227 Eh/α   predicted    -0.2822189E-03 (  -9.64%)
   displ. norm   :     0.5308918 α      lambda       -0.5518791E-03
   maximum displ.:     0.3304898 α      in ANC's #1, #4, #2, ...

........................................................................
.............................. CYCLE   12 ..............................
........................................................................
   1    -39.6684850 -0.396685E+02  0.327E-01    3.10       0.0  T
   2    -39.6684967 -0.116735E-04  0.192E-01    3.10       1.0  T
   3    -39.6684787  0.179113E-04  0.387E-02    3.10       1.0  T
   4    -39.6685013 -0.225424E-04  0.146E-02    3.10       1.4  T
   5    -39.6685023 -0.991467E-06  0.490E-03    3.10       4.3  T
   6    -39.6685026 -0.278746E-06  0.178E-03    3.10      11.7  T
   7    -39.6685026 -0.909861E-08  0.982E-04    3.10      21.2  T
     SCC iter.                  ...        0 min,  0.008 sec
     gradient                   ...        0 min,  0.013 sec
 * total energy  :   -39.2056241 Eh     change       -0.1889429E-03 Eh
   gradient norm :     0.0151849 Eh/α   predicted    -0.3537244E-03 (  87.21%)
   displ. norm   :     0.1263217 α      lambda       -0.4799920E-03
   maximum displ.:     0.0740560 α      in ANC's #4, #5, #1, ...

........................................................................
.............................. CYCLE   13 ..............................
........................................................................
   1    -39.6727820 -0.396728E+02  0.813E-02    3.12       0.0  T
   2    -39.6727855 -0.347946E-05  0.465E-02    3.12       1.0  T
   3    -39.6727837  0.177719E-05  0.137E-02    3.12       1.5  T
   4    -39.6727859 -0.225235E-05  0.652E-03    3.12       3.2  T
   5    -39.6727863 -0.394562E-06  0.219E-03    3.12       9.5  T
   6    -39.6727864 -0.410980E-07  0.702E-04    3.12      29.7  T
     SCC iter.                  ...        0 min,  0.007 sec
     gradient                   ...        0 min,  0.013 sec
 * total energy  :   -39.2058408 Eh     change       -0.2166826E-03 Eh
   gradient norm :     0.0066140 Eh/α   predicted    -0.2438341E-03 (  12.53%)
   displ. norm   :     0.1271483 α      lambda       -0.1494329E-03
   maximum displ.:     0.0711367 α      in ANC's #6, #1, #4, ...

........................................................................
.............................. CYCLE   14 ..............................
........................................................................
   1    -39.6732407 -0.396732E+02  0.841E-02    3.12       0.0  T
   2    -39.6732421 -0.133734E-05  0.508E-02    3.12       1.0  T
   3    -39.6732349  0.716900E-05  0.206E-02    3.12       1.0  T
   4    -39.6732431 -0.823719E-05  0.339E-03    3.12       6.1  T
   5    -39.6732432 -0.550424E-07  0.163E-03    3.12      12.8  T
   6    -39.6732432 -0.267130E-07  0.541E-04    3.12      38.5  T
     SCC iter.                  ...        0 min,  0.007 sec
     gradient                   ...        0 min,  0.013 sec
 * total energy  :   -39.2059288 Eh     change       -0.8801346E-04 Eh
   gradient norm :     0.0034640 Eh/α   predicted    -0.7592810E-04 ( -13.73%)
   displ. norm   :     0.1702045 α      lambda       -0.8016008E-04
   maximum displ.:     0.1097510 α      in ANC's #1, #2, #4, ...

........................................................................
.............................. CYCLE   15 ..............................
........................................................................
   1    -39.6717629 -0.396718E+02  0.112E-01    3.11       0.0  T
   2    -39.6717640 -0.105516E-05  0.667E-02    3.11       1.0  T
   3    -39.6717550  0.895624E-05  0.231E-02    3.11       1.0  T
   4    -39.6717652 -0.101545E-04  0.354E-03    3.11       5.9  T
   5    -39.6717652 -0.199609E-07  0.119E-03    3.11      17.5  T
   6    -39.6717652 -0.845747E-08  0.531E-04    3.11      39.3  T
   7    -39.6717652 -0.942165E-09  0.280E-04    3.11      74.5  T
     SCC iter.                  ...        0 min,  0.008 sec
     gradient                   ...        0 min,  0.014 sec
 * total energy  :   -39.2059588 Eh     change       -0.3000063E-04 Eh
   gradient norm :     0.0032354 Eh/α   predicted    -0.4124559E-04 (  37.48%)
   displ. norm   :     0.0476179 α      lambda       -0.2776367E-04
   maximum displ.:     0.0303996 α      in ANC's #4, #3, #1, ...

........................................................................
.............................. CYCLE   16 ..............................
........................................................................
   1    -39.6726959 -0.396727E+02  0.316E-02    3.12       0.0  T
   2    -39.6726964 -0.487465E-06  0.181E-02    3.12       1.1  T
   3    -39.6726954  0.924317E-06  0.836E-03    3.12       2.5  T
   4    -39.6726965 -0.108191E-05  0.235E-03    3.12       8.9  T
   5    -39.6726966 -0.413952E-07  0.869E-04    3.12      24.0  T
   6    -39.6726966 -0.332456E-08  0.318E-04    3.12      65.5  T
     SCC iter.                  ...        0 min,  0.007 sec
     gradient                   ...        0 min,  0.014 sec
 * total energy  :   -39.2059673 Eh     change       -0.8504029E-05 Eh
   gradient norm :     0.0032574 Eh/α   predicted    -0.1391616E-04 (  63.64%)
   displ. norm   :     0.0264632 α      lambda       -0.2100526E-04
   maximum displ.:     0.0157545 α      in ANC's #1, #2, #7, ...

........................................................................
.............................. CYCLE   17 ..............................
........................................................................
   1    -39.6726897 -0.396727E+02  0.179E-02    3.11       0.0  T
   2    -39.6726899 -0.247699E-06  0.110E-02    3.11       1.9  T
   3    -39.6726894  0.531533E-06  0.726E-03    3.11       2.9  T
   4    -39.6726901 -0.719632E-06  0.111E-03    3.11      18.7  T
   5    -39.6726901 -0.138175E-07  0.476E-04    3.11      43.8  T
   6    -39.6726901 -0.481542E-09  0.240E-04    3.11      86.9  T
     SCC iter.                  ...        0 min,  0.007 sec
     gradient                   ...        0 min,  0.014 sec
 * total energy  :   -39.2059736 Eh     change       -0.6314790E-05 Eh
   gradient norm :     0.0016494 Eh/α   predicted    -0.1051136E-04 (  66.46%)
   displ. norm   :     0.0288562 α      lambda       -0.1087785E-04
   maximum displ.:     0.0159046 α      in ANC's #3, #4, #2, ...

........................................................................
.............................. CYCLE   18 ..............................
........................................................................
   1    -39.6727126 -0.396727E+02  0.231E-02    3.11       0.0  T
   2    -39.6727128 -0.163221E-06  0.127E-02    3.11       1.6  T
   3    -39.6727127  0.553293E-07  0.336E-03    3.11       6.2  T
   4    -39.6727128 -0.884044E-07  0.164E-03    3.11      12.7  T
   5    -39.6727128 -0.153706E-07  0.550E-04    3.11      37.9  T
   6    -39.6727128 -0.401704E-08  0.139E-04    3.11     150.4  T
     SCC iter.                  ...        0 min,  0.007 sec
     gradient                   ...        0 min,  0.013 sec
 * total energy  :   -39.2059789 Eh     change       -0.5290835E-05 Eh
   gradient norm :     0.0018840 Eh/α   predicted    -0.5442669E-05 (   2.87%)
   displ. norm   :     0.0473483 α      lambda       -0.9848370E-05
   maximum displ.:     0.0335104 α      in ANC's #1, #3, #2, ...

........................................................................
.............................. CYCLE   19 ..............................
........................................................................
   1    -39.6722882 -0.396723E+02  0.315E-02    3.11       0.0  T
   2    -39.6722884 -0.213673E-06  0.176E-02    3.11       1.2  T
   3    -39.6722881  0.297041E-06  0.529E-03    3.11       3.9  T
   4    -39.6722885 -0.362522E-06  0.198E-03    3.11      10.5  T
   5    -39.6722885 -0.209265E-07  0.505E-04    3.11      41.3  T
   6    -39.6722885 -0.148579E-08  0.205E-04    3.11     101.7  T
     SCC iter.                  ...        0 min,  0.007 sec
     gradient                   ...        0 min,  0.013 sec
 * total energy  :   -39.2059838 Eh     change       -0.4878687E-05 Eh
   gradient norm :     0.0022609 Eh/α   predicted    -0.4930500E-05 (   1.06%)
   displ. norm   :     0.0269776 α      lambda       -0.9823002E-05
   maximum displ.:     0.0151177 α      in ANC's #4, #3, #1, ...

........................................................................
.............................. CYCLE   20 ..............................
........................................................................
   1    -39.6722758 -0.396723E+02  0.162E-02    3.11       0.0  T
   2    -39.6722759 -0.600500E-07  0.916E-03    3.11       2.3  T
   3    -39.6722758  0.512010E-07  0.225E-03    3.11       9.3  T
   4    -39.6722759 -0.612649E-07  0.105E-03    3.11      19.9  T
   5    -39.6722759 -0.933871E-08  0.332E-04    3.11      62.9  T
   6    -39.6722759 -0.944802E-09  0.129E-04    3.11     161.3  T
     SCC iter.                  ...        0 min,  0.007 sec
     gradient                   ...        0 min,  0.014 sec
 * total energy  :   -39.2059916 Eh     change       -0.7832994E-05 Eh
   gradient norm :     0.0015702 Eh/α   predicted    -0.4918391E-05 ( -37.21%)
   displ. norm   :     0.1221570 α      lambda       -0.1851822E-04
   maximum displ.:     0.0732838 α      in ANC's #4, #3, #1, ...
 * RMSD in coord.:     0.5832705 α      energy gain  -0.6720457E-02 Eh

generating ANC from model Hessian ...
Using Lindh-Hessian (1995)
 Shifting diagonal of input Hessian by   3.386260176663545E-003
 Lowest  eigenvalues of input Hessian
   -0.000000   -0.000000   -0.000000   -0.000000   -0.000000    0.000000
    0.005000    0.007425    0.008311    0.010168    0.013005    0.016926
    0.018983    0.024969    0.030193    0.032450    0.036082    0.043420
 Highest eigenvalues
    1.443253    1.532391    1.704380    1.838318    1.893514    2.023237
 

........................................................................
.............................. CYCLE   21 ..............................
........................................................................
   1    -39.6723974 -0.396724E+02  0.761E-02    3.11       0.0  T
   2    -39.6723984 -0.975331E-06  0.430E-02    3.11       1.0  T
   3    -39.6723984  0.322129E-07  0.760E-03    3.11       2.7  T
   4    -39.6723985 -0.133366E-06  0.451E-03    3.11       4.6  T
   5    -39.6723987 -0.198226E-06  0.122E-03    3.11      17.0  T
   6    -39.6723987 -0.272027E-07  0.392E-04    3.11      53.2  T
   7    -39.6723987 -0.621128E-09  0.224E-04    3.11      93.1  T
     SCC iter.                  ...        0 min,  0.008 sec
     gradient                   ...        0 min,  0.014 sec
 * total energy  :   -39.2060072 Eh     change       -0.1555926E-04 Eh
   gradient norm :     0.0017063 Eh/α   predicted     0.0000000E+00 (-100.00%)
   displ. norm   :     0.0533566 α      lambda       -0.1800661E-04
   maximum displ.:     0.0429432 α      in ANC's #2, #6, #1, ...

........................................................................
.............................. CYCLE   22 ..............................
........................................................................
   1    -39.6725219 -0.396725E+02  0.400E-02    3.11       0.0  T
   2    -39.6725222 -0.281959E-06  0.230E-02    3.11       1.0  T
   3    -39.6725215  0.684405E-06  0.707E-03    3.11       3.0  T
   4    -39.6725223 -0.815443E-06  0.255E-03    3.11       8.2  T
   5    -39.6725224 -0.247059E-07  0.868E-04    3.11      24.0  T
   6    -39.6725224 -0.995247E-08  0.320E-04    3.11      65.2  T
     SCC iter.                  ...        0 min,  0.007 sec
     gradient                   ...        0 min,  0.013 sec
 * total energy  :   -39.2060236 Eh     change       -0.1647625E-04 Eh
   gradient norm :     0.0009871 Eh/α   predicted    -0.9015469E-05 ( -45.28%)
   displ. norm   :     0.0460876 α      lambda       -0.1080023E-04
   maximum displ.:     0.0322451 α      in ANC's #2, #6, #5, ...

........................................................................
.............................. CYCLE   23 ..............................
........................................................................
   1    -39.6725720 -0.396726E+02  0.360E-02    3.10       0.0  T
   2    -39.6725722 -0.226447E-06  0.208E-02    3.10       1.0  T
   3    -39.6725719  0.304916E-06  0.492E-03    3.10       4.2  T
   4    -39.6725723 -0.353932E-06  0.221E-03    3.10       9.4  T
   5    -39.6725723 -0.441562E-07  0.697E-04    3.10      29.9  T
   6    -39.6725723 -0.429968E-08  0.274E-04    3.10      76.1  T
     SCC iter.                  ...        0 min,  0.007 sec
     gradient                   ...        0 min,  0.014 sec
 * total energy  :   -39.2060335 Eh     change       -0.9841502E-05 Eh
   gradient norm :     0.0010264 Eh/α   predicted    -0.5408724E-05 ( -45.04%)
   displ. norm   :     0.0796312 α      lambda       -0.1348811E-04
   maximum displ.:     0.0592919 α      in ANC's #2, #3, #1, ...

........................................................................
.............................. CYCLE   24 ..............................
........................................................................
   1    -39.6724745 -0.396725E+02  0.539E-02    3.10       0.0  T
   2    -39.6724750 -0.443681E-06  0.311E-02    3.10       1.0  T
   3    -39.6724748  0.185089E-06  0.521E-03    3.10       4.0  T
   4    -39.6724750 -0.227981E-06  0.293E-03    3.10       7.1  T
   5    -39.6724751 -0.945528E-07  0.937E-04    3.10      22.3  T
   6    -39.6724751 -0.992938E-08  0.318E-04    3.10      65.5  T
     SCC iter.                  ...        0 min,  0.007 sec
     gradient                   ...        0 min,  0.014 sec
 * total energy  :   -39.2060469 Eh     change       -0.1341854E-04 Eh
   gradient norm :     0.0014449 Eh/α   predicted    -0.6766574E-05 ( -49.57%)
   displ. norm   :     0.0878182 α      lambda       -0.1329224E-04
   maximum displ.:     0.0662595 α      in ANC's #2, #3, #1, ...

........................................................................
.............................. CYCLE   25 ..............................
........................................................................
   1    -39.6723325 -0.396723E+02  0.555E-02    3.10       0.0  T
   2    -39.6723329 -0.361448E-06  0.321E-02    3.10       1.0  T
   3    -39.6723329 -0.412096E-07  0.389E-03    3.10       5.4  T
   4    -39.6723330 -0.458415E-07  0.191E-03    3.10      10.9  T
   5    -39.6723330 -0.261973E-07  0.585E-04    3.10      35.7  T
   6    -39.6723330 -0.543268E-08  0.257E-04    3.10      81.1  T
     SCC iter.                  ...        0 min,  0.007 sec
     gradient                   ...        0 min,  0.014 sec
 * total energy  :   -39.2060644 Eh     change       -0.1750321E-04 Eh
   gradient norm :     0.0014622 Eh/α   predicted    -0.6672701E-05 ( -61.88%)
   displ. norm   :     0.1323831 α      lambda       -0.1994297E-04
   maximum displ.:     0.0941416 α      in ANC's #2, #4, #3, ...

........................................................................
.............................. CYCLE   26 ..............................
........................................................................
   1    -39.6722123 -0.396722E+02  0.778E-02    3.09       0.0  T
   2    -39.6722131 -0.720154E-06  0.451E-02    3.09       1.0  T
   3    -39.6722130  0.254353E-07  0.568E-03    3.09       3.7  T
   4    -39.6722132 -0.184542E-06  0.302E-03    3.09       6.9  T
   5    -39.6722133 -0.746485E-07  0.918E-04    3.09      22.7  T
   6    -39.6722133 -0.122984E-07  0.374E-04    3.09      55.8  T
     SCC iter.                  ...        0 min,  0.007 sec
     gradient                   ...        0 min,  0.013 sec
 * total energy  :   -39.2060902 Eh     change       -0.2580064E-04 Eh
   gradient norm :     0.0011450 Eh/α   predicted    -0.1004988E-04 ( -61.05%)
   displ. norm   :     0.1976395 α      lambda       -0.2439016E-04
   maximum displ.:     0.1383733 α      in ANC's #2, #4, #1, ...

........................................................................
.............................. CYCLE   27 ..............................
........................................................................
   1    -39.6717610 -0.396718E+02  0.121E-01    3.08       0.0  T
   2    -39.6717628 -0.180767E-05  0.701E-02    3.08       1.0  T
   3    -39.6717629 -0.826149E-07  0.907E-03    3.08       2.3  T
   4    -39.6717631 -0.157425E-06  0.523E-03    3.08       4.0  T
   5    -39.6717634 -0.318967E-06  0.184E-03    3.08      11.3  T
   6    -39.6717634 -0.520061E-07  0.598E-04    3.08      34.9  T
   7    -39.6717634 -0.144205E-08  0.309E-04    3.08      67.5  T
     SCC iter.                  ...        0 min,  0.008 sec
     gradient                   ...        0 min,  0.013 sec
 * total energy  :   -39.2061200 Eh     change       -0.2982082E-04 Eh
   gradient norm :     0.0014658 Eh/α   predicted    -0.1240765E-04 ( -58.39%)
   displ. norm   :     0.2710270 α      lambda       -0.2806007E-04
   maximum displ.:     0.1908920 α      in ANC's #2, #4, #1, ...

........................................................................
.............................. CYCLE   28 ..............................
........................................................................
   1    -39.6711186 -0.396711E+02  0.166E-01    3.07       0.0  T
   2    -39.6711221 -0.351575E-05  0.961E-02    3.07       1.0  T
   3    -39.6711219  0.270154E-06  0.135E-02    3.07       1.5  T
   4    -39.6711223 -0.473257E-06  0.861E-03    3.07       2.4  T
   5    -39.6711233 -0.961368E-06  0.268E-03    3.07       7.8  T
   6    -39.6711234 -0.989106E-07  0.816E-04    3.07      25.5  T
   7    -39.6711234 -0.157985E-08  0.424E-04    3.07      49.2  T
     SCC iter.                  ...        0 min,  0.008 sec
     gradient                   ...        0 min,  0.014 sec
 * total energy  :   -39.2061496 Eh     change       -0.2958855E-04 Eh
   gradient norm :     0.0027902 Eh/α   predicted    -0.1449182E-04 ( -51.02%)
   displ. norm   :     0.1654721 α      lambda       -0.2702182E-04
   maximum displ.:     0.1166323 α      in ANC's #2, #4, #1, ...

........................................................................
.............................. CYCLE   29 ..............................
........................................................................
   1    -39.6714073 -0.396714E+02  0.104E-01    3.07       0.0  T
   2    -39.6714087 -0.136680E-05  0.603E-02    3.07       1.0  T
   3    -39.6714086  0.104324E-06  0.864E-03    3.07       2.4  T
   4    -39.6714087 -0.140385E-06  0.560E-03    3.07       3.7  T
   5    -39.6714091 -0.435618E-06  0.153E-03    3.07      13.7  T
   6    -39.6714092 -0.327414E-07  0.495E-04    3.07      42.1  T
   7    -39.6714092 -0.280487E-09  0.254E-04    3.07      82.0  T
     SCC iter.                  ...        0 min,  0.008 sec
     gradient                   ...        0 min,  0.014 sec
 * total energy  :   -39.2061712 Eh     change       -0.2157126E-04 Eh
   gradient norm :     0.0025983 Eh/α   predicted    -0.1388113E-04 ( -35.65%)
   displ. norm   :     0.2287371 α      lambda       -0.3547970E-04
   maximum displ.:     0.1623223 α      in ANC's #2, #1, #4, ...

........................................................................
.............................. CYCLE   30 ..............................
........................................................................
   1    -39.6717779 -0.396718E+02  0.144E-01    3.06       0.0  T
   2    -39.6717806 -0.265889E-05  0.830E-02    3.06       1.0  T
   3    -39.6717799  0.657578E-06  0.129E-02    3.06       1.6  T
   4    -39.6717807 -0.742892E-06  0.829E-03    3.06       2.5  T
   5    -39.6717816 -0.878884E-06  0.206E-03    3.06      10.1  T
   6    -39.6717816 -0.572573E-07  0.698E-04    3.06      29.9  T
   7    -39.6717816 -0.142336E-09  0.388E-04    3.06      53.8  T
     SCC iter.                  ...        0 min,  0.008 sec
     gradient                   ...        0 min,  0.013 sec
 * total energy  :   -39.2061977 Eh     change       -0.2652144E-04 Eh
   gradient norm :     0.0022090 Eh/α   predicted    -0.1866854E-04 ( -29.61%)
   displ. norm   :     0.2119862 α      lambda       -0.2828391E-04
   maximum displ.:     0.1518102 α      in ANC's #2, #1, #4, ...

........................................................................
.............................. CYCLE   31 ..............................
........................................................................
   1    -39.6722237 -0.396722E+02  0.132E-01    3.06       0.0  T
   2    -39.6722259 -0.213000E-05  0.767E-02    3.06       1.0  T
   3    -39.6722247  0.118429E-05  0.126E-02    3.06       1.7  T
   4    -39.6722261 -0.146397E-05  0.726E-03    3.06       2.9  T
   5    -39.6722267 -0.562128E-06  0.198E-03    3.06      10.5  T
   6    -39.6722267 -0.506263E-07  0.681E-04    3.06      30.6  T
   7    -39.6722267 -0.778122E-09  0.399E-04    3.06      52.3  T
     SCC iter.                  ...        0 min,  0.008 sec
     gradient                   ...        0 min,  0.013 sec
 * total energy  :   -39.2062191 Eh     change       -0.2141219E-04 Eh
   gradient norm :     0.0014727 Eh/α   predicted    -0.1477862E-04 ( -30.98%)
   displ. norm   :     0.3582888 α      lambda       -0.2022371E-04
   maximum displ.:     0.2614491 α      in ANC's #2, #1, #4, ...

........................................................................
.............................. CYCLE   32 ..............................
........................................................................
   1    -39.6706246 -0.396706E+02  0.221E-01    3.06       0.0  T
   2    -39.6706308 -0.627233E-05  0.128E-01    3.06       1.0  T
   3    -39.6706247  0.610563E-05  0.248E-02    3.06       1.0  T
   4    -39.6706321 -0.741538E-05  0.125E-02    3.06       1.7  T
   5    -39.6706334 -0.130062E-05  0.336E-03    3.06       6.2  T
   6    -39.6706336 -0.143663E-06  0.113E-03    3.06      18.4  T
   7    -39.6706336 -0.272397E-08  0.662E-04    3.06      31.5  T
   8    -39.6706336 -0.265972E-08  0.196E-04    3.06     106.2  T
     SCC iter.                  ...        0 min,  0.009 sec
     gradient                   ...        0 min,  0.014 sec
 * total energy  :   -39.2062230 Eh     change       -0.3872033E-05 Eh
   gradient norm :     0.0039320 Eh/α   predicted    -0.1068933E-04 ( 176.07%)
   displ. norm   :     0.1563761 α      lambda       -0.6891949E-04
   maximum displ.:     0.1135866 α      in ANC's #2, #1, #4, ...

........................................................................
.............................. CYCLE   33 ..............................
........................................................................
   1    -39.6740695 -0.396741E+02  0.993E-02    3.07       0.0  T
   2    -39.6740711 -0.165893E-05  0.573E-02    3.07       1.0  T
   3    -39.6740696  0.154534E-05  0.119E-02    3.07       1.8  T
   4    -39.6740714 -0.180332E-05  0.587E-03    3.07       3.6  T
   5    -39.6740717 -0.339305E-06  0.189E-03    3.07      11.0  T
   6    -39.6740718 -0.326002E-07  0.655E-04    3.07      31.8  T
   7    -39.6740718 -0.412493E-08  0.327E-04    3.07      63.8  T
     SCC iter.                  ...        0 min,  0.008 sec
     gradient                   ...        0 min,  0.014 sec
 * total energy  :   -39.2062379 Eh     change       -0.1487928E-04 Eh
   gradient norm :     0.0035259 Eh/α   predicted    -0.3530502E-04 ( 137.28%)
   displ. norm   :     0.0569883 α      lambda       -0.2290498E-04
   maximum displ.:     0.0398551 α      in ANC's #2, #4, #1, ...

........................................................................
.............................. CYCLE   34 ..............................
........................................................................
   1    -39.6725795 -0.396726E+02  0.341E-02    3.06       0.0  T
   2    -39.6725797 -0.141955E-06  0.203E-02    3.06       1.0  T
   3    -39.6725796  0.715950E-07  0.264E-03    3.06       7.9  T
   4    -39.6725797 -0.112319E-06  0.108E-03    3.06      19.4  T
   5    -39.6725797 -0.912368E-08  0.501E-04    3.06      41.6  T
   6    -39.6725797 -0.146103E-08  0.176E-04    3.06     118.3  T
     SCC iter.                  ...        0 min,  0.007 sec
     gradient                   ...        0 min,  0.013 sec
 * total energy  :   -39.2062514 Eh     change       -0.1355300E-04 Eh
   gradient norm :     0.0017778 Eh/α   predicted    -0.1149218E-04 ( -15.21%)
   displ. norm   :     0.0649643 α      lambda       -0.1073931E-04
   maximum displ.:     0.0492842 α      in ANC's #2, #3, #1, ...

........................................................................
.............................. CYCLE   35 ..............................
........................................................................
   1    -39.6718787 -0.396719E+02  0.343E-02    3.06       0.0  T
   2    -39.6718791 -0.400228E-06  0.199E-02    3.06       1.0  T
   3    -39.6718787  0.448087E-06  0.594E-03    3.06       3.5  T
   4    -39.6718792 -0.485896E-06  0.206E-03    3.06      10.1  T
   5    -39.6718792 -0.574672E-07  0.623E-04    3.06      33.5  T
   6    -39.6718792 -0.909537E-09  0.307E-04    3.06      67.8  T
     SCC iter.                  ...        0 min,  0.007 sec
     gradient                   ...        0 min,  0.013 sec
 * total energy  :   -39.2062583 Eh     change       -0.6859205E-05 Eh
   gradient norm :     0.0024494 Eh/α   predicted    -0.5381493E-05 ( -21.54%)
   displ. norm   :     0.0329269 α      lambda       -0.1208862E-04
   maximum displ.:     0.0237099 α      in ANC's #2, #1, #3, ...

........................................................................
.............................. CYCLE   36 ..............................
........................................................................
   1    -39.6720776 -0.396721E+02  0.212E-02    3.06       0.0  T
   2    -39.6720777 -0.961296E-07  0.122E-02    3.06       1.7  T
   3    -39.6720773  0.360975E-06  0.513E-03    3.06       4.1  T
   4    -39.6720777 -0.415480E-06  0.121E-03    3.06      17.2  T
   5    -39.6720777 -0.952440E-08  0.487E-04    3.06      42.8  T
   6    -39.6720777 -0.170657E-08  0.201E-04    3.06     103.8  T
     SCC iter.                  ...        0 min,  0.007 sec
     gradient                   ...        0 min,  0.014 sec
 * total energy  :   -39.2062670 Eh     change       -0.8707819E-05 Eh
   gradient norm :     0.0015833 Eh/α   predicted    -0.6053032E-05 ( -30.49%)
   displ. norm   :     0.1782097 α      lambda       -0.1433898E-04
   maximum displ.:     0.1437345 α      in ANC's #2, #1, #3, ...

........................................................................
.............................. CYCLE   37 ..............................
........................................................................
   1    -39.6723565 -0.396724E+02  0.103E-01    3.05       0.0  T
   2    -39.6723574 -0.961619E-06  0.596E-02    3.05       1.0  T
   3    -39.6723573  0.121998E-06  0.689E-03    3.05       3.0  T
   4    -39.6723575 -0.216942E-06  0.425E-03    3.05       4.9  T
   5    -39.6723578 -0.238497E-06  0.119E-03    3.05      17.6  T
   6    -39.6723578 -0.182206E-07  0.385E-04    3.05      54.1  T
   7    -39.6723578 -0.419192E-09  0.219E-04    3.05      95.2  T
     SCC iter.                  ...        0 min,  0.008 sec
     gradient                   ...        0 min,  0.014 sec
 * total energy  :   -39.2062803 Eh     change       -0.1330299E-04 Eh
   gradient norm :     0.0025205 Eh/α   predicted    -0.7272545E-05 ( -45.33%)
   displ. norm   :     0.0970299 α      lambda       -0.1992250E-04
   maximum displ.:     0.0791513 α      in ANC's #2, #36, #38, ...

........................................................................
.............................. CYCLE   38 ..............................
........................................................................
   1    -39.6732496 -0.396732E+02  0.514E-02    3.06       0.0  T
   2    -39.6732498 -0.205728E-06  0.301E-02    3.06       1.0  T
   3    -39.6732498  0.724820E-07  0.310E-03    3.06       6.7  T
   4    -39.6732499 -0.126625E-06  0.155E-03    3.06      13.5  T
   5    -39.6732499 -0.234841E-07  0.523E-04    3.06      39.9  T
   6    -39.6732499 -0.258155E-08  0.195E-04    3.06     106.8  T
     SCC iter.                  ...        0 min,  0.007 sec
     gradient                   ...        0 min,  0.014 sec
 * total energy  :   -39.2062919 Eh     change       -0.1164449E-04 Eh
   gradient norm :     0.0017085 Eh/α   predicted    -0.1005875E-04 ( -13.62%)
   displ. norm   :     0.4729954 α      lambda       -0.2514235E-04
   maximum displ.:     0.3882096 α      in ANC's #2, #1, #3, ...

........................................................................
.............................. CYCLE   39 ..............................
........................................................................
   1    -39.6683482 -0.396683E+02  0.273E-01    3.06       0.0  T
   2    -39.6683573 -0.911474E-05  0.158E-01    3.06       1.0  T
   3    -39.6683279  0.293325E-04  0.450E-02    3.06       1.0  T
   4    -39.6683620 -0.340728E-04  0.124E-02    3.06       1.7  T
   5    -39.6683625 -0.474228E-06  0.378E-03    3.06       5.5  T
   6    -39.6683627 -0.164648E-06  0.137E-03    3.06      15.3  T
   7    -39.6683627 -0.166570E-07  0.738E-04    3.06      28.3  T
   8    -39.6683627 -0.214362E-08  0.290E-04    3.06      71.9  T
     SCC iter.                  ...        0 min,  0.009 sec
     gradient                   ...        0 min,  0.013 sec
 * total energy  :   -39.2061980 Eh     change        0.9388424E-04 Eh
   gradient norm :     0.0089540 Eh/α   predicted    -0.1382798E-04 (-114.73%)
   displ. norm   :     0.2411715 α      lambda       -0.2190526E-03
   maximum displ.:     0.1965360 α      in ANC's #2, #1, #3, ...

........................................................................
.............................. CYCLE   40 ..............................
........................................................................
   1    -39.6718640 -0.396719E+02  0.138E-01    3.06       0.0  T
   2    -39.6718666 -0.266599E-05  0.801E-02    3.06       1.0  T
   3    -39.6718565  0.101395E-04  0.260E-02    3.06       1.0  T
   4    -39.6718681 -0.116125E-04  0.588E-03    3.06       3.5  T
   5    -39.6718682 -0.101279E-06  0.201E-03    3.06      10.4  T
   6    -39.6718683 -0.286113E-07  0.767E-04    3.06      27.2  T
     SCC iter.                  ...        0 min,  0.007 sec
     gradient                   ...        0 min,  0.013 sec
 * total energy  :   -39.2063021 Eh     change       -0.1040580E-03 Eh
   gradient norm :     0.0018807 Eh/α   predicted    -0.1158989E-03 (  11.38%)
   displ. norm   :     0.0221746 α      lambda       -0.6717784E-05
   maximum displ.:     0.0128788 α      in ANC's #4, #2, #1, ...

........................................................................
.............................. CYCLE   41 ..............................
........................................................................
   1    -39.6728154 -0.396728E+02  0.176E-02    3.06       0.0  T
   2    -39.6728155 -0.802349E-07  0.975E-03    3.06       2.1  T
   3    -39.6728154  0.838128E-07  0.300E-03    3.06       7.0  T
   4    -39.6728155 -0.104542E-06  0.144E-03    3.06      14.5  T
   5    -39.6728155 -0.117833E-07  0.246E-04    3.06      84.9  T
   6    -39.6728155 -0.605660E-09  0.961E-05    3.06     217.1  T
     SCC iter.                  ...        0 min,  0.007 sec
     gradient                   ...        0 min,  0.014 sec
 * total energy  :   -39.2063067 Eh     change       -0.4644397E-05 Eh
   gradient norm :     0.0005441 Eh/α   predicted    -0.3363623E-05 ( -27.58%)
   displ. norm   :     0.0251900 α      lambda       -0.1456052E-05
   maximum displ.:     0.0197420 α      in ANC's #2, #4, #1, ...

   *** GEOMETRY OPTIMIZATION CONVERGED AFTER 41 ITERATIONS ***

------------------------------------------------------------------------
 total energy gain   :        -0.0070356 Eh       -4.4149 kcal/mol
 total RMSD          :         0.8730521 a0        0.4620 Å
 total power (kW/mol):        -0.4505362 (step)  -14.8315 (real)
------------------------------------------------------------------------

 ANCopt (total)                0 d,  0 h,  0 min,  1.245 sec
 optimizer setup                ...        0 min,  0.000 sec (  0.013%)
 model hessian                  ...        0 min,  0.014 sec (  1.124%)
 ANC generation                 ...        0 min,  0.001 sec (  0.106%)
 coordinate transformation      ...        0 min,  0.001 sec (  0.059%)
 single point calculation       ...        0 min,  1.213 sec ( 97.424%)
 optimization log               ...        0 min,  0.004 sec (  0.307%)
 hessian update                 ...        0 min,  0.001 sec (  0.043%)
 rational function              ...        0 min,  0.009 sec (  0.725%)

================
 final structure:
================
$coord
    2.79358724471331   -2.44625683495290    0.08190755355569      C 
    5.10460909144571   -0.19106835132467    0.09676288076729      S 
    2.88833914320765    2.24175712466027    0.21262578973150      C 
    0.47236151892942    1.27151909494221    0.26804476921757      C 
    0.44115738196123   -1.41194762590883    0.17918975453961      C 
   -1.95999500154010   -2.91246625977951    0.12380533983174      C 
   -1.66964780829383   -5.00347401686020   -1.42051573311883      F 
   -4.12685258673097   -1.27725557421357   -0.83900607479631      C 
   -4.26300972886577    1.10415799315305    0.76724009602912      C 
   -1.93283936584336    2.77134528793855    0.38527667826187      C 
   -1.85295415605517    4.47250277689135    2.38173027824358      F 
    3.89992044614604    4.77300948878554    0.16183146076414      C 
    2.65943538584672    6.94952766844923   -0.02818232345709      C 
    3.27338357934891   -4.41038851928162   -0.02724902022001      H 
   -2.39532690432243   -3.67706959719534    2.00821535966271      H 
   -5.89580537474200   -2.32911795580899   -0.73208208337579      H 
   -3.77368781939270   -0.79879243442249   -2.81580591214236      H 
   -4.35549532598280    0.59075531006624    2.76534414567364      H 
   -5.95332314140785    2.19216219627194    0.31335735368835      H 
   -2.12759510075024    3.93277110341544   -1.32935054514416      H 
    5.94595023590504    4.81318032709692    0.24117983223818      H 
    0.63915739494442    7.09532428557452   -0.10705336942896      H 
    3.68172717456496    8.70780193957522   -0.07970898212468      H 
$end
           -------------------------------------------------
          |                Final Singlepoint                |
           -------------------------------------------------

          ...................................................
          :                      SETUP                      :
          :.................................................:
          :  # basis functions                  68          :
          :  # atomic orbitals                  67          :
          :  # shells                           37          :
          :  # electrons                        70          :
          :  max. iterations                   250          :
          :  Hamiltonian                  GFN2-xTB          :
          :  restarted?                      false          :
          :  GBSA solvation                  false          :
          :  PC potential                    false          :
          :  electronic temp.          300.0000000     K    :
          :  accuracy                    1.0000000          :
          :  -> integral cutoff          0.2500000E+02      :
          :  -> integral neglect         0.1000000E-07      :
          :  -> SCF convergence          0.1000000E-05 Eh   :
          :  -> wf. convergence          0.1000000E-03 e    :
          :  Broyden damping             0.4000000          :
          ...................................................

 iter      E             dE          RMSdq      gap      omega  full diag
   1    -39.6728155 -0.396728E+02  0.482E-05    3.06       0.0  T
   2    -39.6728155 -0.284928E-11  0.223E-05    3.06     936.6  T
   3    -39.6728155 -0.104379E-10  0.194E-05    3.06    1077.6  T

   *** convergence criteria satisfied after 3 iterations ***

         #    Occupation            Energy/Eh            Energy/eV
      -------------------------------------------------------------
         1        2.0000           -0.8093450             -22.0234
       ...           ...                  ...                  ...
        29        2.0000           -0.4538809             -12.3507
        30        2.0000           -0.4495203             -12.2321
        31        2.0000           -0.4441088             -12.0848
        32        2.0000           -0.4410151             -12.0006
        33        2.0000           -0.4355546             -11.8520
        34        2.0000           -0.4055430             -11.0354
        35        2.0000           -0.3871920             -10.5360 (HOMO)
        36                         -0.2745631              -7.4712 (LUMO)
        37                         -0.2141038              -5.8261
        38                         -0.2117211              -5.7612
        39                         -0.1616356              -4.3983
        40                         -0.1251228              -3.4048
       ...                                ...                  ...
        67                          0.6721086              18.2890
      -------------------------------------------------------------
                  HL-Gap            0.1126289 Eh            3.0648 eV
             Fermi-level           -0.3308776 Eh           -9.0036 eV

 SCC (total)                   0 d,  0 h,  0 min,  0.027 sec
 SCC setup                      ...        0 min,  0.000 sec (  0.736%)
 Dispersion                     ...        0 min,  0.000 sec (  0.653%)
 integral evaluation            ...        0 min,  0.008 sec ( 30.670%)
 zeroth order Hamiltonian       ...        0 min,  0.000 sec (  0.571%)
 iterations                     ...        0 min,  0.004 sec ( 14.675%)
 molecular gradient             ...        0 min,  0.014 sec ( 51.213%)
 printout                       ...        0 min,  0.000 sec (  1.297%)

         :::::::::::::::::::::::::::::::::::::::::::::::::::::
         ::                     SUMMARY                     ::
         :::::::::::::::::::::::::::::::::::::::::::::::::::::
         :: total energy             -39.206306752095 Eh    ::
         :: gradient norm              0.000544328174 Eh/a0 ::
         :: HOMO-LUMO gap              3.064788569563 eV    ::
         ::.................................................::
         :: SCC energy               -39.672815527847 Eh    ::
         :: -> isotropic ES            0.030990469523 Eh    ::
         :: -> anisotropic ES          0.000139236669 Eh    ::
         :: -> anisotropic XC          0.005433760646 Eh    ::
         :: -> dispersion             -0.023042157454 Eh    ::
         :: repulsion energy           0.466352980047 Eh    ::
         :: add. restraining           0.000000000000 Eh    ::
         :::::::::::::::::::::::::::::::::::::::::::::::::::::

           -------------------------------------------------
          |                Property Printout                |
           -------------------------------------------------

    * Orbital Energies and Occupations

         #    Occupation            Energy/Eh            Energy/eV
      -------------------------------------------------------------
         1        2.0000           -0.8093450             -22.0234
       ...           ...                  ...                  ...
        23        2.0000           -0.4925615             -13.4033
        24        2.0000           -0.4901852             -13.3386
        25        2.0000           -0.4812817             -13.0963
        26        2.0000           -0.4760108             -12.9529
        27        2.0000           -0.4668795             -12.7044
        28        2.0000           -0.4608178             -12.5395
        29        2.0000           -0.4538809             -12.3507
        30        2.0000           -0.4495203             -12.2321
        31        2.0000           -0.4441088             -12.0848
        32        2.0000           -0.4410151             -12.0006
        33        2.0000           -0.4355546             -11.8520
        34        2.0000           -0.4055430             -11.0354
        35        2.0000           -0.3871920             -10.5360 (HOMO)
        36                         -0.2745631              -7.4712 (LUMO)
        37                         -0.2141038              -5.8261
        38                         -0.2117211              -5.7612
        39                         -0.1616356              -4.3983
        40                         -0.1251228              -3.4048
        41                         -0.0122786              -0.3341
        42                          0.0001184               0.0032
        43                          0.0205739               0.5598
        44                          0.0241304               0.6566
        45                          0.0470954               1.2815
        46                          0.0650385               1.7698
       ...                                ...                  ...
        67                          0.6721086              18.2890
      -------------------------------------------------------------
                  HL-Gap            0.1126289 Eh            3.0648 eV
             Fermi-level           -0.3308776 Eh           -9.0036 eV

     #   Z        covCN         q      C6AA      α(0)
     1   6 C      2.933    -0.023    28.583     8.768
     2  16 S      2.365    -0.008   141.372    20.012
     3   6 C      2.985     0.024    27.468     8.597
     4   6 C      3.153    -0.029    28.422     8.719
     5   6 C      3.177    -0.020    28.095     8.655
     6   6 C      3.667     0.146    18.455     6.160
     7   9 F      0.785    -0.261    11.880     4.071
     8   6 C      3.809    -0.067    21.776     6.643
     9   6 C      3.809    -0.068    21.801     6.646
    10   6 C      3.663     0.147    18.454     6.163
    11   9 F      0.785    -0.261    11.880     4.071
    12   6 C      2.946    -0.028    28.706     8.787
    13   6 C      2.837    -0.083    30.076     8.987
    14   1 H      0.926     0.061     2.186     2.312
    15   1 H      0.923     0.049     2.338     2.391
    16   1 H      0.924     0.056     2.248     2.344
    17   1 H      0.924     0.055     2.255     2.348
    18   1 H      0.924     0.059     2.215     2.327
    19   1 H      0.924     0.054     2.272     2.357
    20   1 H      0.923     0.046     2.368     2.406
    21   1 H      0.925     0.047     2.360     2.402
    22   1 H      0.926     0.058     2.226     2.333
    23   1 H      0.926     0.047     2.362     2.403

 Mol. C6AA /au·bohr⁶  :       6978.406172
 Mol. C8AA /au·bohr⁸  :     186171.870446
 Mol. α(0) /au        :        129.905762


Wiberg/Mayer (AO) data.
largest (>0.10) Wiberg bond orders for each atom
          total WBO             WBO to atom ...
     1  C   3.952        C    5 1.580    S    2 1.208    H   14 0.968
     2  S   2.634        C    1 1.208    C    3 1.144
     3  C   3.951        C    4 1.500    S    2 1.144    C   12 1.131
     4  C   3.980        C    3 1.500    C    5 1.248    C   10 0.992
     5  C   3.982        C    1 1.580    C    4 1.248    C    6 0.990
     6  C   3.904        C    8 0.990    C    5 0.990    H   15 0.950    F    7 0.920
     7  F   0.995        C    6 0.920
     8  C   3.994        C    9 1.008    C    6 0.990    H   16 0.974    H   17 0.974
     9  C   3.994        C    8 1.008    C   10 0.991    H   19 0.975    H   18 0.973
    10  C   3.905        C    4 0.992    C    9 0.991    H   20 0.951    F   11 0.916
    11  F   0.996        C   10 0.916
    12  C   3.990        C   13 1.866    C    3 1.131    H   21 0.962
    13  C   3.990        C   12 1.866    H   23 0.977    H   22 0.972
    14  H   0.996        C    1 0.968
    15  H   0.997        C    6 0.950
    16  H   0.996        C    8 0.974
    17  H   0.997        C    8 0.974
    18  H   0.997        C    9 0.973
    19  H   0.996        C    9 0.975
    20  H   0.998        C   10 0.951
    21  H   0.997        C   12 0.962
    22  H   0.997        C   13 0.972
    23  H   0.997        C   13 0.977

molecular dipole:
                 x           y           z       tot (Debye)
 q only:       -0.118       0.273      -0.165
   full:       -0.433       0.220      -0.169       1.306
molecular quadrupole (traceless):
                xx          xy          yy          xz          yz          zz
 q only:        7.351       0.873      -5.747       0.496      -7.364      -1.603
  q+dip:        7.441       0.542      -5.006       0.545     -11.100      -2.435
   full:        6.092       0.653      -5.228       0.563     -10.030      -0.864

           -------------------------------------------------
          |                Geometry Summary                 |
           -------------------------------------------------

      molecular mass/u    :      200.2458000
   center of mass at/Å    :        0.2541087       0.3512412       0.0987546
  moments of inertia/u·Å² :        0.5276996E+03   0.7604649E+03   0.1221582E+04
rotational constants/cm⁻¹ :        0.3194551E-01   0.2216754E-01   0.1379984E-01

 * 22 selected distances

     #   Z        #   Z                                     value/Å
     1   6 C      2  16 S                                 1.7087524
     2  16 S      3   6 C                                 1.7425861 (max)
     3   6 C      4   6 C                                 1.3780350
     1   6 C      5   6 C                                 1.3608383
     4   6 C      5   6 C                                 1.4209038
     5   6 C      6   6 C                                 1.4986237
     6   6 C      7   9 F                                 1.3841342
     6   6 C      8   6 C                                 1.5241951
     8   6 C      9   6 C                                 1.5217592
     9   6 C     10   6 C                                 1.5295972
    10   6 C     11   9 F                                 1.3886387
    12   6 C     13   6 C                                 1.3295035
     1   6 C     14   1 H                                 1.0714935 (min)
     6   6 C     15   1 H                                 1.1005276
     8   6 C     16   1 H                                 1.0905471
     8   6 C     17   1 H                                 1.0923877
     9   6 C     18   1 H                                 1.0927934
     9   6 C     19   1 H                                 1.0905318
    10   6 C     20   1 H                                 1.1007378
    12   6 C     21   1 H                                 1.0837348
    13   6 C     22   1 H                                 1.0726777
    13   6 C     23   1 H                                 1.0766207

 * 4 distinct bonds (by element types)

   Z      Z             #   av. dist./Å        max./Å        min./Å
   1 H    6 C          10     1.0872052     1.1007378     1.0714935
   6 C    6 C           8     1.4454320     1.5295972     1.3295035
   6 C    9 F           2     1.3863864     1.3886387     1.3841342
   6 C   16 S           2     1.7256693     1.7425861     1.7087524


optimized geometry written to: xtbopt.xyz


           -------------------------------------------------
          | TOTAL ENERGY              -39.206306752095 Eh   |
          | GRADIENT NORM               0.000544328174 Eh/α |
          | HOMO-LUMO GAP               3.064788569563 eV   |
           -------------------------------------------------

------------------------------------------------------------------------
 * finished run on 2021/05/19 at 10:59:24.660     
------------------------------------------------------------------------
 total:
 * wall-time:     0 d,  0 h,  0 min,  1.331 sec
 *  cpu-time:     0 d,  0 h,  0 min,  1.328 sec
 * ratio c/w:     0.997 speedup
 SCF:
 * wall-time:     0 d,  0 h,  0 min,  0.038 sec
 *  cpu-time:     0 d,  0 h,  0 min,  0.037 sec
 * ratio c/w:     0.996 speedup
 ANC optimizer:
 * wall-time:     0 d,  0 h,  0 min,  1.273 sec
 *  cpu-time:     0 d,  0 h,  0 min,  1.270 sec
 * ratio c/w:     0.998 speedup

