      -----------------------------------------------------------      
     |                   =====================                   |     
     |                           x T B                           |     
     |                   =====================                   |     
     |                         S. Grimme                         |     
     |          Mulliken Center for Theoretical Chemistry        |     
     |                    University of Bonn                     |     
     |                Version 6.2 RC2 (SAW190805)                |     
      -----------------------------------------------------------      

   This program is distributed in the hope that it will be useful,
   but WITHOUT ANY WARRANTY; without even the implied warranty of
   MERCHANTABILITY or FITNESS FOR A PARTICULAR PURPOSE.
   
   FOR NON-COMMERCIAL, ACADEMIA USE ONLY.
   
   Cite this work as:
   * S. Grimme, C. Bannwarth, P. Shushkov, J. Chem. Theory Comput., 2017,
     13, 1989-2009. DOI: 10.1021/acs.jctc.7b00118
   * C. Bannwarth, S. Ehlert and S. Grimme., J. Chem. Theory Comput., 2019,
     15, 1652-1671. DOI: 10.1021/acs.jctc.8b01176
   * P. Pracht, E. Caldeweyher, S. Ehlert, S. Grimme, ChemRxiv, 2019, preprint.
     DOI: 10.26434/chemrxiv.8326202.v1
   
   for DFT-D4:
   * E. Caldeweyher, C. Bannwarth and S. Grimme, J. Chem. Phys., 2017,
     147, 034112. DOI: 10.1063/1.4993215
   * E. Caldeweyher, S. Ehlert, A. Hansen, H. Neugebauer, S. Spicher,
     C. Bannwarth and S. Grimme, J. Chem. Phys., 2019, 150, 154122.
     DOI: 10.1063/1.5090222
   
   for sTDA-xTB:
   * S. Grimme and C. Bannwarth, J. Chem. Phys., 2016, 145, 054103.
     DOI: 10.1063/1.4959605
   
   in the mass-spec context:
   * V. Asgeirsson, C. Bauer and S. Grimme, Chem. Sci., 2017, 8, 4879.
     DOI: 10.1039/c7sc00601b
   
   for metadynamics refer to:
   * S. Grimme, J. Chem. Theory Comput., 2019, 155, 2847-2862
     DOI: 10.1021/acs.jctc.9b00143
   
   with help from (in alphabetical order)
   C. Bannwarth, F. Bohle, G. Brandenburg, E. Caldeweyher, M. Checinski,
   S. Dohm, S. Ehlert, S. Ehrlich, F. März, H. Neugebauer, J. Pisarek,
   P. Pracht, P. Shushkov, and S. Spicher.
   
 * started run on 2021/05/19 at 10:59:25.490     

           -------------------------------------------------
          |                Calculation Setup                |
           -------------------------------------------------

          program call               : /ihome/ghutchison/geoffh/xtb/xtb 527.xyz -opt
          hostname                   : smp-n144
          coordinate file            : 527.xyz
          omp threads                :                     1
          number of atoms            :                    29
          number of electrons        :                   106
          charge                     :                     0
          spin                       :                   0.0
          first test random number   :      0.51656530839766


########################################################################
# WARNING! Please study the warnings concerning your input carefully
#  - the use of '-opt' is discouraged, please use '--opt' next time
########################################################################

           ------------------------------------------------- 
          |                 G F N 2 - x T B                 |
          | Geometry, Frequencies, Noncovalent interactions |
          |            JCTC 2019 parametrisation            |
           ------------------------------------------------- 
             KAB for C  - Si     :                1.0500
             KAB for H  - Pd     :                0.9500
             k(s)              :                1.8500
             k(p)              :                2.2300
             k(d)              :                2.2300
             k(f)              :                2.0000
             kEN (H0ij)        :               -2.0000
             D4 a1             :                0.5200
             D4 a2             :                5.0000
             D4 s6             :                1.0000
             D4 s8             :                2.7000
             D4 s9             :                5.0000
             alphaj            :                2.0000

  Z AO/shell   Hii/eV     exponent
  1     Wed Apr 25 08:07:45 CEST 2018   EN: 2.200 GM2: 0.406  GM3: 0.0800  RAES: 1.40
     1s    -10.707211    1.230000
  6     Wed Apr 25 08:07:45 CEST 2018   EN: 2.550 GM2: 0.538  GM3: 0.1500  RAES: 3.00
     2s    -13.970922    2.096432
     2p    -10.063292    1.800000
  9     Mon Apr 23 13:58:50 CEST 2018   EN: 3.980 GM2: 0.532  GM3: 0.1426  RAES: 2.40
     2s    -23.458179    2.416361
     2p    -15.746583    2.308399
 16     Tue Apr 24 11:44:34 CEST 2018   EN: 2.580 GM2: 0.340  GM3:-0.0502  RAES: 3.10
     3s    -20.029654    1.981333
     3p    -11.377694    2.025643
     3d     -0.420282    1.702555

           ------------------------------------------------- 
          |        Self-Consistent Charge Iterations        |
           ------------------------------------------------- 

          ...................................................
          :                      SETUP                      :
          :.................................................:
          :  # basis functions                  92          :
          :  # atomic orbitals                  91          :
          :  # shells                           49          :
          :  # electrons                       106          :
          :  max. iterations                   250          :
          :  Hamiltonian                  GFN2-xTB          :
          :  restarted?                      false          :
          :  GBSA solvation                  false          :
          :  PC potential                    false          :
          :  electronic temp.          300.0000000     K    :
          :  accuracy                    1.0000000          :
          :  -> integral cutoff          0.2500000E+02      :
          :  -> integral neglect         0.1000000E-07      :
          :  -> SCF convergence          0.1000000E-05 Eh   :
          :  -> wf. convergence          0.1000000E-03 e    :
          :  Broyden damping             0.4000000          :
          ...................................................

 iter      E             dE          RMSdq      gap      omega  full diag
   1    -62.8078296 -0.628078E+02  0.436E+00    3.03       0.0  T
   2    -62.9483315 -0.140502E+00  0.247E+00    3.07       1.0  T
   3    -62.9535664 -0.523490E-02  0.122E+00    3.07       1.0  T
   4    -62.9547957 -0.122923E-02  0.377E-01    3.05       1.0  T
   5    -62.9581065 -0.331087E-02  0.139E-01    3.06       1.0  T
   6    -62.9582900 -0.183439E-03  0.434E-02    3.06       1.0  T
   7    -62.9583019 -0.118979E-04  0.204E-02    3.06       1.0  T
   8    -62.9583076 -0.567900E-05  0.108E-02    3.06       1.7  T
   9    -62.9583082 -0.682819E-06  0.346E-03    3.06       5.4  T
  10    -62.9583083 -0.972011E-07  0.144E-03    3.06      12.9  T
  11    -62.9583083 -0.130990E-07  0.650E-04    3.06      28.6  T
  12    -62.9583083 -0.247886E-08  0.251E-04    3.06      73.9  T

   *** convergence criteria satisfied after 12 iterations ***

         #    Occupation            Energy/Eh            Energy/eV
      -------------------------------------------------------------
         1        2.0000           -0.8841024             -24.0577
       ...           ...                  ...                  ...
        47        2.0000           -0.4736579             -12.8889
        48        2.0000           -0.4679359             -12.7332
        49        2.0000           -0.4638591             -12.6222
        50        2.0000           -0.4536864             -12.3454
        51        2.0000           -0.4443168             -12.0905
        52        2.0000           -0.4152194             -11.2987
        53        2.0000           -0.3966566             -10.7936 (HOMO)
        54                         -0.2841796              -7.7329 (LUMO)
        55                         -0.2315305              -6.3003
        56                         -0.2198366              -5.9821
        57                         -0.1876281              -5.1056
        58                         -0.1301266              -3.5409
       ...                                ...                  ...
        91                          0.6373051              17.3420
      -------------------------------------------------------------
                  HL-Gap            0.1124770 Eh            3.0607 eV
             Fermi-level           -0.3404181 Eh           -9.2632 eV

 SCC (total)                   0 d,  0 h,  0 min,  0.061 sec
 SCC setup                      ...        0 min,  0.000 sec (  0.605%)
 Dispersion                     ...        0 min,  0.000 sec (  0.696%)
 integral evaluation            ...        0 min,  0.016 sec ( 25.605%)
 zeroth order Hamiltonian       ...        0 min,  0.000 sec (  0.473%)
 iterations                     ...        0 min,  0.022 sec ( 35.133%)
 molecular gradient             ...        0 min,  0.022 sec ( 36.670%)
 printout                       ...        0 min,  0.000 sec (  0.723%)

         :::::::::::::::::::::::::::::::::::::::::::::::::::::
         ::                     SUMMARY                     ::
         :::::::::::::::::::::::::::::::::::::::::::::::::::::
         :: total energy             -62.448883472515 Eh    ::
         :: gradient norm              0.064641729785 Eh/a0 ::
         :: HOMO-LUMO gap              3.060655524999 eV    ::
         ::.................................................::
         :: SCC energy               -62.958308347964 Eh    ::
         :: -> isotropic ES            0.085133236406 Eh    ::
         :: -> anisotropic ES         -0.000024883720 Eh    ::
         :: -> anisotropic XC         -0.020215235680 Eh    ::
         :: -> dispersion             -0.032784745208 Eh    ::
         :: repulsion energy           0.508945906723 Eh    ::
         :: add. restraining           0.000000000000 Eh    ::
         :::::::::::::::::::::::::::::::::::::::::::::::::::::

      ----------------------------------------------------------- 
     |                   =====================                   |
     |                        A N C O P T                        |
     |                   =====================                   |
     |               Approximate Normal Coordinate               |
     |                Rational Function Optimizer                |
      ----------------------------------------------------------- 

          ...................................................
          :                      SETUP                      :
          :.................................................:
          :   optimization level            normal          :
          :   max. optcycles                   200          :
          :   ANC micro-cycles                  20          :
          :   degrees of freedom                81          :
          :.................................................:
          :   RF solver                   davidson          :
          :   input Hessian                  false          :
          :   write xtbopt.log                true          :
          :   linear?                        false          :
          :   energy convergence         0.5000000E-05 Eh   :
          :   grad. convergence          0.1000000E-02 Eh/α :
          :   maximium RF displ.         2.0000000          :
          :   Hlow (freq-cutoff)         0.5000000E-02      :
          :   Hmax (freq-cutoff)         5.0000000          :
          :   S6 in model hess.         20.0000000          :
          ...................................................

generating ANC from model Hessian ...
Using Lindh-Hessian (1995)
 Shifting diagonal of input Hessian by   4.054953626889297E-003
 Lowest  eigenvalues of input Hessian
   -0.000000    0.000000    0.000000    0.000000    0.000000    0.000000
    0.005000    0.006051    0.007319    0.008206    0.008859    0.009779
    0.011921    0.012443    0.013445    0.015487    0.015527    0.020354
 Highest eigenvalues
    1.651558    1.680152    1.680650    1.758382    1.794861    1.965123
 

........................................................................
.............................. CYCLE    1 ..............................
........................................................................
   1    -62.9583083 -0.629583E+02  0.134E-04    3.06       0.0  T
   2    -62.9583083 -0.632383E-11  0.118E-04    3.06     157.8  T
   3    -62.9583083 -0.219515E-09  0.575E-05    3.06     322.9  T
     SCC iter.                  ...        0 min,  0.006 sec
     gradient                   ...        0 min,  0.023 sec
 * total energy  :   -62.4488835 Eh     change       -0.4427790E-08 Eh
   gradient norm :     0.0646417 Eh/α   predicted     0.0000000E+00 (-100.00%)
   displ. norm   :     0.3132855 α      lambda       -0.9293225E-02
   maximum displ.:     0.1278594 α      in ANC's #11, #7, #28, ...

........................................................................
.............................. CYCLE    2 ..............................
........................................................................
   1    -62.9866487 -0.629866E+02  0.249E-01    3.14       0.0  T
   2    -62.9866840 -0.352942E-04  0.142E-01    3.15       1.0  T
   3    -62.9865720  0.111992E-03  0.771E-02    3.15       1.0  T
   4    -62.9867196 -0.147551E-03  0.225E-02    3.15       1.0  T
   5    -62.9867218 -0.218514E-05  0.101E-02    3.15       1.8  T
   6    -62.9867234 -0.162265E-05  0.306E-03    3.15       6.1  T
   7    -62.9867236 -0.184804E-06  0.823E-04    3.15      22.6  T
     SCC iter.                  ...        0 min,  0.012 sec
     gradient                   ...        0 min,  0.021 sec
 * total energy  :   -62.4550673 Eh     change       -0.6183809E-02 Eh
   gradient norm :     0.0234775 Eh/α   predicted    -0.5102673E-02 ( -17.48%)
   displ. norm   :     0.2763445 α      lambda       -0.2147110E-02
   maximum displ.:     0.1387281 α      in ANC's #7, #4, #3, ...

........................................................................
.............................. CYCLE    3 ..............................
........................................................................
   1    -62.9987729 -0.629988E+02  0.158E-01    3.19       0.0  T
   2    -62.9987894 -0.165278E-04  0.939E-02    3.19       1.0  T
   3    -62.9987432  0.462199E-04  0.518E-02    3.19       1.0  T
   4    -62.9988051 -0.619028E-04  0.136E-02    3.19       1.4  T
   5    -62.9988060 -0.942100E-06  0.614E-03    3.19       3.0  T
   6    -62.9988067 -0.647721E-06  0.177E-03    3.19      10.5  T
   7    -62.9988067 -0.585433E-07  0.547E-04    3.19      33.9  T
     SCC iter.                  ...        0 min,  0.012 sec
     gradient                   ...        0 min,  0.021 sec
 * total energy  :   -62.4563628 Eh     change       -0.1295507E-02 Eh
   gradient norm :     0.0061376 Eh/α   predicted    -0.1155545E-02 ( -10.80%)
   displ. norm   :     0.2423866 α      lambda       -0.5582329E-03
   maximum displ.:     0.1575174 α      in ANC's #7, #4, #5, ...

........................................................................
.............................. CYCLE    4 ..............................
........................................................................
   1    -62.9997287 -0.629997E+02  0.144E-01    3.19       0.0  T
   2    -62.9997381 -0.944890E-05  0.860E-02    3.19       1.0  T
   3    -62.9997323  0.585602E-05  0.238E-02    3.19       1.0  T
   4    -62.9997432 -0.109120E-04  0.907E-03    3.19       2.0  T
   5    -62.9997439 -0.714444E-06  0.196E-03    3.19       9.5  T
   6    -62.9997440 -0.392070E-07  0.884E-04    3.19      21.0  T
     SCC iter.                  ...        0 min,  0.011 sec
     gradient                   ...        0 min,  0.021 sec
 * total energy  :   -62.4567893 Eh     change       -0.4264721E-03 Eh
   gradient norm :     0.0065771 Eh/α   predicted    -0.2955156E-03 ( -30.71%)
   displ. norm   :     0.3580707 α      lambda       -0.6068150E-03
   maximum displ.:     0.2314324 α      in ANC's #7, #4, #6, ...

........................................................................
.............................. CYCLE    5 ..............................
........................................................................
   1    -62.9977420 -0.629977E+02  0.228E-01    3.19       0.0  T
   2    -62.9977664 -0.243659E-04  0.134E-01    3.19       1.0  T
   3    -62.9977709 -0.455831E-05  0.274E-02    3.19       1.0  T
   4    -62.9977755 -0.462238E-05  0.164E-02    3.19       1.1  T
   5    -62.9977790 -0.348072E-05  0.339E-03    3.19       5.5  T
   6    -62.9977792 -0.208340E-06  0.833E-04    3.19      22.3  T
   7    -62.9977792 -0.834191E-09  0.504E-04    3.19      36.9  T
     SCC iter.                  ...        0 min,  0.012 sec
     gradient                   ...        0 min,  0.021 sec
 * total energy  :   -62.4572100 Eh     change       -0.4207297E-03 Eh
   gradient norm :     0.0109192 Eh/α   predicted    -0.3423098E-03 ( -18.64%)
   displ. norm   :     0.3059808 α      lambda       -0.4336631E-03
   maximum displ.:     0.1974409 α      in ANC's #7, #6, #1, ...

........................................................................
.............................. CYCLE    6 ..............................
........................................................................
   1    -62.9960565 -0.629961E+02  0.200E-01    3.17       0.0  T
   2    -62.9960741 -0.176403E-04  0.118E-01    3.17       1.0  T
   3    -62.9960800 -0.591373E-05  0.216E-02    3.17       1.0  T
   4    -62.9960810 -0.100424E-05  0.138E-02    3.17       1.4  T
   5    -62.9960837 -0.264002E-05  0.219E-03    3.17       8.5  T
   6    -62.9960838 -0.927510E-07  0.669E-04    3.17      27.7  T
     SCC iter.                  ...        0 min,  0.010 sec
     gradient                   ...        0 min,  0.022 sec
 * total energy  :   -62.4575140 Eh     change       -0.3040380E-03 Eh
   gradient norm :     0.0134724 Eh/α   predicted    -0.2371326E-03 ( -22.01%)
   displ. norm   :     0.2706491 α      lambda       -0.5217767E-03
   maximum displ.:     0.1506016 α      in ANC's #7, #1, #6, ...

........................................................................
.............................. CYCLE    7 ..............................
........................................................................
   1    -62.9965172 -0.629965E+02  0.172E-01    3.15       0.0  T
   2    -62.9965310 -0.137885E-04  0.101E-01    3.15       1.0  T
   3    -62.9965367 -0.573918E-05  0.162E-02    3.15       1.1  T
   4    -62.9965371 -0.364343E-06  0.775E-03    3.15       2.4  T
   5    -62.9965375 -0.403155E-06  0.319E-03    3.15       5.8  T
   6    -62.9965378 -0.260618E-06  0.667E-04    3.15      27.8  T
   7    -62.9965378 -0.161327E-08  0.367E-04    3.15      50.6  T
     SCC iter.                  ...        0 min,  0.012 sec
     gradient                   ...        0 min,  0.022 sec
 * total energy  :   -62.4579113 Eh     change       -0.3973124E-03 Eh
   gradient norm :     0.0090837 Eh/α   predicted    -0.2800022E-03 ( -29.53%)
   displ. norm   :     0.3552016 α      lambda       -0.5293352E-03
   maximum displ.:     0.2140090 α      in ANC's #7, #1, #8, ...

........................................................................
.............................. CYCLE    8 ..............................
........................................................................
   1    -62.9978422 -0.629978E+02  0.205E-01    3.14       0.0  T
   2    -62.9978604 -0.182242E-04  0.125E-01    3.14       1.0  T
   3    -62.9978690 -0.852920E-05  0.152E-02    3.14       1.2  T
   4    -62.9978699 -0.969268E-06  0.999E-03    3.14       1.9  T
   5    -62.9978715 -0.152459E-05  0.182E-03    3.14      10.2  T
   6    -62.9978715 -0.353875E-07  0.728E-04    3.14      25.5  T
     SCC iter.                  ...        0 min,  0.010 sec
     gradient                   ...        0 min,  0.022 sec
 * total energy  :   -62.4583171 Eh     change       -0.4057672E-03 Eh
   gradient norm :     0.0077027 Eh/α   predicted    -0.2980748E-03 ( -26.54%)
   displ. norm   :     0.3487969 α      lambda       -0.4972924E-03
   maximum displ.:     0.2061858 α      in ANC's #1, #7, #8, ...

........................................................................
.............................. CYCLE    9 ..............................
........................................................................
   1    -63.0007064 -0.630007E+02  0.185E-01    3.14       0.0  T
   2    -63.0007234 -0.169760E-04  0.113E-01    3.14       1.0  T
   3    -63.0007272 -0.380914E-05  0.166E-02    3.14       1.1  T
   4    -63.0007319 -0.466544E-05  0.737E-03    3.14       2.5  T
   5    -63.0007326 -0.726325E-06  0.282E-03    3.14       6.6  T
   6    -63.0007326 -0.588892E-07  0.814E-04    3.14      22.8  T
     SCC iter.                  ...        0 min,  0.010 sec
     gradient                   ...        0 min,  0.022 sec
 * total energy  :   -62.4586428 Eh     change       -0.3256981E-03 Eh
   gradient norm :     0.0053650 Eh/α   predicted    -0.2789027E-03 ( -14.37%)
   displ. norm   :     0.5654484 α      lambda       -0.4511130E-03
   maximum displ.:     0.3741448 α      in ANC's #7, #1, #8, ...

........................................................................
.............................. CYCLE   10 ..............................
........................................................................
   1    -62.9958245 -0.629958E+02  0.320E-01    3.13       0.0  T
   2    -62.9958989 -0.744497E-04  0.197E-01    3.13       1.0  T
   3    -62.9959152 -0.163029E-04  0.310E-02    3.13       1.0  T
   4    -62.9959296 -0.144001E-04  0.101E-02    3.13       1.8  T
   5    -62.9959300 -0.385802E-06  0.655E-03    3.13       2.8  T
   6    -62.9959308 -0.749668E-06  0.121E-03    3.13      15.4  T
   7    -62.9959308 -0.463060E-08  0.698E-04    3.13      26.6  T
     SCC iter.                  ...        0 min,  0.012 sec
     gradient                   ...        0 min,  0.022 sec
 * total energy  :   -62.4584588 Eh     change        0.1839814E-03 Eh
   gradient norm :     0.0216076 Eh/α   predicted    -0.2976770E-03 (-261.80%)
   displ. norm   :     0.2117680 α      lambda       -0.1000052E-02
   maximum displ.:     0.1370669 α      in ANC's #7, #8, #6, ...

........................................................................
.............................. CYCLE   11 ..............................
........................................................................
   1    -63.0022253 -0.630022E+02  0.140E-01    3.14       0.0  T
   2    -63.0022655 -0.401714E-04  0.847E-02    3.14       1.0  T
   3    -63.0022675 -0.204314E-05  0.271E-02    3.14       1.0  T
   4    -63.0022730 -0.541700E-05  0.543E-03    3.14       3.4  T
   5    -63.0022729  0.706895E-07  0.362E-03    3.14       5.1  T
     SCC iter.                  ...        0 min,  0.009 sec
     gradient                   ...        0 min,  0.022 sec
 * total energy  :   -62.4588039 Eh     change       -0.3450676E-03 Eh
   gradient norm :     0.0087500 Eh/α   predicted    -0.5224548E-03 (  51.41%)
   displ. norm   :     0.1503149 α      lambda       -0.4366356E-03
   maximum displ.:     0.0969173 α      in ANC's #8, #9, #3, ...

........................................................................
.............................. CYCLE   12 ..............................
........................................................................
   1    -63.0013575 -0.630014E+02  0.105E-01    3.14       0.0  T
   2    -63.0013953 -0.377506E-04  0.642E-02    3.14       1.0  T
   3    -63.0013958 -0.461706E-06  0.287E-02    3.14       1.0  T
   4    -63.0013994 -0.367987E-05  0.101E-02    3.14       1.8  T
   5    -63.0014015 -0.201517E-05  0.246E-03    3.14       7.6  T
   6    -63.0014015 -0.341934E-07  0.646E-04    3.14      28.8  T
     SCC iter.                  ...        0 min,  0.011 sec
     gradient                   ...        0 min,  0.022 sec
 * total energy  :   -62.4586275 Eh     change        0.1763516E-03 Eh
   gradient norm :     0.0161975 Eh/α   predicted    -0.2232514E-03 (-226.59%)
   displ. norm   :     0.1333627 α      lambda       -0.5618273E-03
   maximum displ.:     0.0916860 α      in ANC's #7, #1, #9, ...

........................................................................
.............................. CYCLE   13 ..............................
........................................................................
   1    -63.0013816 -0.630014E+02  0.844E-02    3.14       0.0  T
   2    -63.0013989 -0.172478E-04  0.521E-02    3.14       1.0  T
   3    -63.0013990 -0.162143E-06  0.191E-02    3.14       1.0  T
   4    -63.0014016 -0.251691E-05  0.537E-03    3.14       3.5  T
   5    -63.0014021 -0.576707E-06  0.145E-03    3.14      12.8  T
   6    -63.0014021 -0.116838E-07  0.516E-04    3.14      36.0  T
     SCC iter.                  ...        0 min,  0.011 sec
     gradient                   ...        0 min,  0.022 sec
 * total energy  :   -62.4589331 Eh     change       -0.3055371E-03 Eh
   gradient norm :     0.0020657 Eh/α   predicted    -0.2859143E-03 (  -6.42%)
   displ. norm   :     0.1144781 α      lambda       -0.4651786E-04
   maximum displ.:     0.0770042 α      in ANC's #7, #1, #8, ...

........................................................................
.............................. CYCLE   14 ..............................
........................................................................
   1    -63.0011820 -0.630012E+02  0.635E-02    3.14       0.0  T
   2    -63.0011839 -0.188961E-05  0.392E-02    3.14       1.0  T
   3    -63.0011847 -0.823747E-06  0.396E-03    3.14       4.7  T
   4    -63.0011850 -0.291946E-06  0.183E-03    3.14      10.2  T
   5    -63.0011851 -0.446999E-07  0.789E-04    3.14      23.5  T
   6    -63.0011851 -0.609789E-08  0.206E-04    3.14      90.3  T
     SCC iter.                  ...        0 min,  0.011 sec
     gradient                   ...        0 min,  0.023 sec
 * total energy  :   -62.4589706 Eh     change       -0.3755044E-04 Eh
   gradient norm :     0.0026540 Eh/α   predicted    -0.2356587E-04 ( -37.24%)
   displ. norm   :     0.2319820 α      lambda       -0.8468391E-04
   maximum displ.:     0.1561110 α      in ANC's #7, #1, #8, ...

........................................................................
.............................. CYCLE   15 ..............................
........................................................................
   1    -63.0006942 -0.630007E+02  0.131E-01    3.15       0.0  T
   2    -63.0007018 -0.761103E-05  0.808E-02    3.15       1.0  T
   3    -63.0007055 -0.371537E-05  0.742E-03    3.15       2.5  T
   4    -63.0007065 -0.965343E-06  0.370E-03    3.15       5.0  T
   5    -63.0007067 -0.184014E-06  0.132E-03    3.15      14.1  T
   6    -63.0007067 -0.165717E-07  0.478E-04    3.15      38.9  T
   7    -63.0007067 -0.139823E-08  0.255E-04    3.15      72.8  T
     SCC iter.                  ...        0 min,  0.012 sec
     gradient                   ...        0 min,  0.023 sec
 * total energy  :   -62.4590239 Eh     change       -0.5330315E-04 Eh
   gradient norm :     0.0036948 Eh/α   predicted    -0.4462060E-04 ( -16.29%)
   displ. norm   :     0.1009451 α      lambda       -0.4681453E-04
   maximum displ.:     0.0656022 α      in ANC's #7, #8, #1, ...

........................................................................
.............................. CYCLE   16 ..............................
........................................................................
   1    -63.0011257 -0.630011E+02  0.585E-02    3.16       0.0  T
   2    -63.0011272 -0.155468E-05  0.358E-02    3.16       1.0  T
   3    -63.0011277 -0.487084E-06  0.435E-03    3.16       4.3  T
   4    -63.0011280 -0.294075E-06  0.199E-03    3.16       9.3  T
   5    -63.0011281 -0.442841E-07  0.967E-04    3.16      19.2  T
   6    -63.0011281 -0.103380E-07  0.276E-04    3.16      67.3  T
     SCC iter.                  ...        0 min,  0.011 sec
     gradient                   ...        0 min,  0.023 sec
 * total energy  :   -62.4590602 Eh     change       -0.3626805E-04 Eh
   gradient norm :     0.0019880 Eh/α   predicted    -0.2364730E-04 ( -34.80%)
   displ. norm   :     0.2432757 α      lambda       -0.5522991E-04
   maximum displ.:     0.1559538 α      in ANC's #7, #3, #8, ...

........................................................................
.............................. CYCLE   17 ..............................
........................................................................
   1    -63.0012192 -0.630012E+02  0.142E-01    3.17       0.0  T
   2    -63.0012258 -0.664054E-05  0.864E-02    3.17       1.0  T
   3    -63.0012286 -0.276131E-05  0.901E-03    3.17       2.1  T
   4    -63.0012297 -0.113580E-05  0.437E-03    3.17       4.3  T
   5    -63.0012299 -0.154824E-06  0.187E-03    3.17       9.9  T
   6    -63.0012299 -0.342900E-07  0.574E-04    3.17      32.4  T
   7    -63.0012299 -0.160895E-09  0.255E-04    3.17      72.7  T
     SCC iter.                  ...        0 min,  0.012 sec
     gradient                   ...        0 min,  0.023 sec
 * total energy  :   -62.4591105 Eh     change       -0.5029668E-04 Eh
   gradient norm :     0.0025083 Eh/α   predicted    -0.2834162E-04 ( -43.65%)
   displ. norm   :     0.0776276 α      lambda       -0.2489214E-04
   maximum displ.:     0.0389873 α      in ANC's #4, #3, #7, ...

........................................................................
.............................. CYCLE   18 ..............................
........................................................................
   1    -63.0016526 -0.630017E+02  0.437E-02    3.18       0.0  T
   2    -63.0016530 -0.436088E-06  0.255E-02    3.18       1.0  T
   3    -63.0016529  0.118935E-06  0.394E-03    3.18       4.7  T
   4    -63.0016531 -0.219697E-06  0.204E-03    3.18       9.1  T
   5    -63.0016532 -0.520353E-07  0.821E-04    3.18      22.6  T
   6    -63.0016532 -0.976060E-08  0.205E-04    3.18      90.5  T
     SCC iter.                  ...        0 min,  0.011 sec
     gradient                   ...        0 min,  0.023 sec
 * total energy  :   -62.4591295 Eh     change       -0.1898693E-04 Eh
   gradient norm :     0.0023220 Eh/α   predicted    -0.1252525E-04 ( -34.03%)
   displ. norm   :     0.1764930 α      lambda       -0.3779521E-04
   maximum displ.:     0.0951497 α      in ANC's #7, #3, #4, ...

........................................................................
.............................. CYCLE   19 ..............................
........................................................................
   1    -63.0010962 -0.630011E+02  0.105E-01    3.20       0.0  T
   2    -63.0010988 -0.262250E-05  0.621E-02    3.20       1.0  T
   3    -63.0010988 -0.160301E-07  0.872E-03    3.20       2.1  T
   4    -63.0010999 -0.112971E-05  0.461E-03    3.20       4.0  T
   5    -63.0011002 -0.274089E-06  0.145E-03    3.20      12.8  T
   6    -63.0011002 -0.218526E-07  0.511E-04    3.20      36.4  T
   7    -63.0011002 -0.116994E-08  0.312E-04    3.20      59.5  T
     SCC iter.                  ...        0 min,  0.012 sec
     gradient                   ...        0 min,  0.023 sec
 * total energy  :   -62.4591488 Eh     change       -0.1928908E-04 Eh
   gradient norm :     0.0017987 Eh/α   predicted    -0.1948746E-04 (   1.03%)
   displ. norm   :     0.1387048 α      lambda       -0.2349521E-04
   maximum displ.:     0.0642087 α      in ANC's #3, #1, #6, ...

........................................................................
.............................. CYCLE   20 ..............................
........................................................................
   1    -63.0024263 -0.630024E+02  0.759E-02    3.21       0.0  T
   2    -63.0024287 -0.242352E-05  0.441E-02    3.21       1.0  T
   3    -63.0024282  0.538782E-06  0.949E-03    3.21       2.0  T
   4    -63.0024294 -0.121802E-05  0.487E-03    3.21       3.8  T
   5    -63.0024297 -0.294083E-06  0.189E-03    3.21       9.8  T
   6    -63.0024298 -0.476439E-07  0.497E-04    3.21      37.4  T
   7    -63.0024298 -0.342168E-08  0.266E-04    3.21      69.9  T
     SCC iter.                  ...        0 min,  0.012 sec
     gradient                   ...        0 min,  0.023 sec
 * total energy  :   -62.4591588 Eh     change       -0.1003832E-04 Eh
   gradient norm :     0.0030698 Eh/α   predicted    -0.1185193E-04 (  18.07%)
   displ. norm   :     0.0162715 α      lambda       -0.1229946E-04
   maximum displ.:     0.0095016 α      in ANC's #1, #3, #7, ...
 * RMSD in coord.:     0.5650243 α      energy gain  -0.1027534E-01 Eh

generating ANC from model Hessian ...
Using Lindh-Hessian (1995)
 Shifting diagonal of input Hessian by   3.940265229025682E-003
 Lowest  eigenvalues of input Hessian
   -0.000000   -0.000000   -0.000000   -0.000000   -0.000000   -0.000000
    0.005000    0.006334    0.007379    0.008419    0.009185    0.010463
    0.012456    0.013361    0.014259    0.016326    0.016512    0.021890
 Highest eigenvalues
    1.710181    1.714527    1.724630    1.832177    1.881044    2.016264
 

........................................................................
.............................. CYCLE   21 ..............................
........................................................................
   1    -63.0022651 -0.630023E+02  0.103E-02    3.21       0.0  T
   2    -63.0022652 -0.113131E-06  0.599E-03    3.21       3.1  T
   3    -63.0022651  0.231777E-07  0.171E-03    3.21      10.9  T
   4    -63.0022652 -0.347261E-07  0.685E-04    3.21      27.1  T
   5    -63.0022652 -0.717030E-08  0.286E-04    3.21      64.9  T
     SCC iter.                  ...        0 min,  0.009 sec
     gradient                   ...        0 min,  0.024 sec
 * total energy  :   -62.4591681 Eh     change       -0.9243952E-05 Eh
   gradient norm :     0.0018103 Eh/α   predicted     0.0000000E+00 (-100.00%)
   displ. norm   :     0.0387780 α      lambda       -0.9861868E-05
   maximum displ.:     0.0264826 α      in ANC's #1, #3, #9, ...

........................................................................
.............................. CYCLE   22 ..............................
........................................................................
   1    -63.0017561 -0.630018E+02  0.214E-02    3.21       0.0  T
   2    -63.0017563 -0.224170E-06  0.127E-02    3.21       1.5  T
   3    -63.0017563 -0.372916E-07  0.195E-03    3.21       9.5  T
   4    -63.0017564 -0.356433E-07  0.799E-04    3.21      23.3  T
   5    -63.0017564 -0.116373E-09  0.475E-04    3.21      39.1  T
     SCC iter.                  ...        0 min,  0.009 sec
     gradient                   ...        0 min,  0.023 sec
 * total energy  :   -62.4591791 Eh     change       -0.1102343E-04 Eh
   gradient norm :     0.0005942 Eh/α   predicted    -0.4944696E-05 ( -55.14%)
   displ. norm   :     0.0450248 α      lambda       -0.6669995E-05
   maximum displ.:     0.0232633 α      in ANC's #7, #9, #1, ...

........................................................................
.............................. CYCLE   23 ..............................
........................................................................
   1    -63.0015826 -0.630016E+02  0.274E-02    3.22       0.0  T
   2    -63.0015829 -0.299039E-06  0.166E-02    3.22       1.1  T
   3    -63.0015830 -0.876848E-08  0.268E-03    3.22       6.9  T
   4    -63.0015831 -0.130832E-06  0.120E-03    3.22      15.4  T
   5    -63.0015831 -0.230006E-07  0.449E-04    3.22      41.3  T
   6    -63.0015831 -0.106583E-08  0.147E-04    3.22     126.7  T
     SCC iter.                  ...        0 min,  0.011 sec
     gradient                   ...        0 min,  0.023 sec
 * total energy  :   -62.4591866 Eh     change       -0.7503549E-05 Eh
   gradient norm :     0.0007490 Eh/α   predicted    -0.3338128E-05 ( -55.51%)
   displ. norm   :     0.0726706 α      lambda       -0.6859282E-05
   maximum displ.:     0.0348669 α      in ANC's #9, #3, #1, ...

........................................................................
.............................. CYCLE   24 ..............................
........................................................................
   1    -63.0014640 -0.630015E+02  0.447E-02    3.22       0.0  T
   2    -63.0014647 -0.649195E-06  0.266E-02    3.22       1.0  T
   3    -63.0014647 -0.623184E-07  0.455E-03    3.22       4.1  T
   4    -63.0014650 -0.244570E-06  0.247E-03    3.22       7.5  T
   5    -63.0014651 -0.748234E-07  0.511E-04    3.22      36.3  T
   6    -63.0014651 -0.261696E-08  0.233E-04    3.22      79.5  T
     SCC iter.                  ...        0 min,  0.010 sec
     gradient                   ...        0 min,  0.023 sec
 * total energy  :   -62.4591933 Eh     change       -0.6743695E-05 Eh
   gradient norm :     0.0013733 Eh/α   predicted    -0.3440149E-05 ( -48.99%)
   displ. norm   :     0.0548719 α      lambda       -0.4372907E-05
   maximum displ.:     0.0279555 α      in ANC's #1, #3, #9, ...

........................................................................
.............................. CYCLE   25 ..............................
........................................................................
   1    -63.0015402 -0.630015E+02  0.317E-02    3.23       0.0  T
   2    -63.0015405 -0.242762E-06  0.191E-02    3.23       1.0  T
   3    -63.0015405 -0.292473E-07  0.246E-03    3.23       7.6  T
   4    -63.0015406 -0.121488E-06  0.963E-04    3.23      19.3  T
   5    -63.0015406 -0.389550E-08  0.382E-04    3.23      48.6  T
     SCC iter.                  ...        0 min,  0.009 sec
     gradient                   ...        0 min,  0.023 sec
 * total energy  :   -62.4591983 Eh     change       -0.4927294E-05 Eh
   gradient norm :     0.0011156 Eh/α   predicted    -0.2189515E-05 ( -55.56%)
   displ. norm   :     0.0677287 α      lambda       -0.5111825E-05
   maximum displ.:     0.0365694 α      in ANC's #1, #3, #4, ...

........................................................................
.............................. CYCLE   26 ..............................
........................................................................
   1    -63.0018098 -0.630018E+02  0.396E-02    3.23       0.0  T
   2    -63.0018101 -0.346948E-06  0.233E-02    3.23       1.0  T
   3    -63.0018099  0.208715E-06  0.431E-03    3.23       4.3  T
   4    -63.0018103 -0.355889E-06  0.182E-03    3.23      10.2  T
   5    -63.0018103 -0.320067E-07  0.610E-04    3.23      30.5  T
   6    -63.0018103 -0.465958E-08  0.222E-04    3.23      83.6  T
     SCC iter.                  ...        0 min,  0.011 sec
     gradient                   ...        0 min,  0.023 sec
 * total energy  :   -62.4592034 Eh     change       -0.5133781E-05 Eh
   gradient norm :     0.0003789 Eh/α   predicted    -0.2562410E-05 ( -50.09%)
   displ. norm   :     0.0481362 α      lambda       -0.2269459E-05
   maximum displ.:     0.0264783 α      in ANC's #1, #3, #4, ...

........................................................................
.............................. CYCLE   27 ..............................
........................................................................
   1    -63.0019469 -0.630019E+02  0.260E-02    3.24       0.0  T
   2    -63.0019470 -0.856425E-07  0.154E-02    3.24       1.2  T
   3    -63.0019468  0.190427E-06  0.302E-03    3.24       6.2  T
   4    -63.0019470 -0.236833E-06  0.771E-04    3.24      24.1  T
   5    -63.0019470 -0.602118E-08  0.338E-04    3.24      54.9  T
     SCC iter.                  ...        0 min,  0.009 sec
     gradient                   ...        0 min,  0.023 sec
 * total energy  :   -62.4592058 Eh     change       -0.2424966E-05 Eh
   gradient norm :     0.0005163 Eh/α   predicted    -0.1136195E-05 ( -53.15%)
   displ. norm   :     0.0488793 α      lambda       -0.1774845E-05
   maximum displ.:     0.0268064 α      in ANC's #1, #3, #4, ...

   *** GEOMETRY OPTIMIZATION CONVERGED AFTER 27 ITERATIONS ***

------------------------------------------------------------------------
 total energy gain   :        -0.0103223 Eh       -6.4774 kcal/mol
 total RMSD          :         0.5640044 a0        0.2985 Å
 total power (kW/mol):        -1.0037522 (step)  -19.7456 (real)
------------------------------------------------------------------------

 ANCopt (total)                0 d,  0 h,  0 min,  1.373 sec
 optimizer setup                ...        0 min,  0.000 sec (  0.011%)
 model hessian                  ...        0 min,  0.030 sec (  2.150%)
 ANC generation                 ...        0 min,  0.002 sec (  0.133%)
 coordinate transformation      ...        0 min,  0.001 sec (  0.042%)
 single point calculation       ...        0 min,  1.329 sec ( 96.808%)
 optimization log               ...        0 min,  0.003 sec (  0.227%)
 hessian update                 ...        0 min,  0.000 sec (  0.030%)
 rational function              ...        0 min,  0.006 sec (  0.473%)

================
 final structure:
================
$coord
    2.87637534884641   -2.23880534543482   -0.16780645832376      C 
    5.00481105191181    0.19130331385082   -0.15841079770056      S 
    2.60342851568804    2.42846139521779   -0.00681702024777      C 
    0.27926770536962    1.27578658249539    0.06749791419873      C 
    0.44664849922485   -1.40230568364177   -0.02867491449813      C 
   -1.81982455485467   -3.11288657395303   -0.11231252622112      C 
   -2.08867005991428   -4.14061569182780   -2.80256629663728      C 
   -0.13331156129014   -5.62482348423065   -3.43840040673967      F 
   -4.17190104676700   -5.56008012435723   -3.08538452460654      F 
   -2.21197474718889   -2.33474633143146   -4.57388852301024      F 
   -4.23768151739136   -1.77231735260001    0.75237203463565      C 
   -4.43179035366723    0.90553509618678   -0.30412155405996      C 
   -2.20977149576834    2.57228972384437    0.51695078373571      C 
   -2.37671232051707    3.26718297980230    3.32214140361919      C 
   -0.79479957468755    5.15519141008568    3.92027435758605      F 
   -4.69705775631938    4.05601476115481    3.98327940485167      F 
   -1.80600811226311    1.35471435847844    4.88506716608435      F 
    3.34150517039853    5.06667711949149   -0.00161130279908      C 
    2.15241971440671    6.94515216970392   -1.16053946033573      C 
    3.52775450012008   -4.15214493008981   -0.29252898438787      H 
   -1.48841948678917   -4.78246136933854    1.06722214145890      H 
   -4.24473087020500   -1.71859657122032    2.81127982677791      H 
   -5.88071519175955   -2.86534900869849    0.15324670734919      H 
   -6.19922200678456    1.75995584664748    0.32714077034197      H 
   -4.45720370915855    0.85204378489242   -2.36372832677657      H 
   -2.30385361711163    4.37391617391143   -0.48631419785977      H 
    5.09913730882905    5.44123256924608    0.97544305443389      H 
    0.46303325566917    6.67338376954426   -2.26028991495610      H 
    2.87171698210690    8.84386500490730   -1.07742722428436      H 
$end
           -------------------------------------------------
          |                Final Singlepoint                |
           -------------------------------------------------

          ...................................................
          :                      SETUP                      :
          :.................................................:
          :  # basis functions                  92          :
          :  # atomic orbitals                  91          :
          :  # shells                           49          :
          :  # electrons                       106          :
          :  max. iterations                   250          :
          :  Hamiltonian                  GFN2-xTB          :
          :  restarted?                      false          :
          :  GBSA solvation                  false          :
          :  PC potential                    false          :
          :  electronic temp.          300.0000000     K    :
          :  accuracy                    1.0000000          :
          :  -> integral cutoff          0.2500000E+02      :
          :  -> integral neglect         0.1000000E-07      :
          :  -> SCF convergence          0.1000000E-05 Eh   :
          :  -> wf. convergence          0.1000000E-03 e    :
          :  Broyden damping             0.4000000          :
          ...................................................

 iter      E             dE          RMSdq      gap      omega  full diag
   1    -63.0019470 -0.630019E+02  0.155E-04    3.24       0.0  T
   2    -63.0019470 -0.867146E-10  0.713E-05    3.24     260.4  T
   3    -63.0019470 -0.134122E-09  0.539E-05    3.24     344.6  T

   *** convergence criteria satisfied after 3 iterations ***

         #    Occupation            Energy/Eh            Energy/eV
      -------------------------------------------------------------
         1        2.0000           -0.8870957             -24.1391
       ...           ...                  ...                  ...
        47        2.0000           -0.4732700             -12.8783
        48        2.0000           -0.4700540             -12.7908
        49        2.0000           -0.4660195             -12.6810
        50        2.0000           -0.4517884             -12.2938
        51        2.0000           -0.4442217             -12.0879
        52        2.0000           -0.4151525             -11.2969
        53        2.0000           -0.3992315             -10.8636 (HOMO)
        54                         -0.2802580              -7.6262 (LUMO)
        55                         -0.2286794              -6.2227
        56                         -0.2184652              -5.9447
        57                         -0.1842781              -5.0145
        58                         -0.1305952              -3.5537
       ...                                ...                  ...
        91                          0.6532684              17.7763
      -------------------------------------------------------------
                  HL-Gap            0.1189736 Eh            3.2374 eV
             Fermi-level           -0.3397448 Eh           -9.2449 eV

 SCC (total)                   0 d,  0 h,  0 min,  0.046 sec
 SCC setup                      ...        0 min,  0.000 sec (  0.568%)
 Dispersion                     ...        0 min,  0.000 sec (  0.573%)
 integral evaluation            ...        0 min,  0.015 sec ( 33.589%)
 zeroth order Hamiltonian       ...        0 min,  0.000 sec (  0.578%)
 iterations                     ...        0 min,  0.006 sec ( 12.996%)
 molecular gradient             ...        0 min,  0.023 sec ( 50.690%)
 printout                       ...        0 min,  0.000 sec (  0.896%)

         :::::::::::::::::::::::::::::::::::::::::::::::::::::
         ::                     SUMMARY                     ::
         :::::::::::::::::::::::::::::::::::::::::::::::::::::
         :: total energy             -62.459205783454 Eh    ::
         :: gradient norm              0.000515478449 Eh/a0 ::
         :: HOMO-LUMO gap              3.237435437990 eV    ::
         ::.................................................::
         :: SCC energy               -63.001947006880 Eh    ::
         :: -> isotropic ES            0.085520982567 Eh    ::
         :: -> anisotropic ES         -0.000703018535 Eh    ::
         :: -> anisotropic XC         -0.022962739601 Eh    ::
         :: -> dispersion             -0.033728334330 Eh    ::
         :: repulsion energy           0.542230369227 Eh    ::
         :: add. restraining           0.000000000000 Eh    ::
         :::::::::::::::::::::::::::::::::::::::::::::::::::::

           -------------------------------------------------
          |                Property Printout                |
           -------------------------------------------------

    * Orbital Energies and Occupations

         #    Occupation            Energy/Eh            Energy/eV
      -------------------------------------------------------------
         1        2.0000           -0.8870957             -24.1391
       ...           ...                  ...                  ...
        41        2.0000           -0.5151311             -14.0174
        42        2.0000           -0.5143905             -13.9973
        43        2.0000           -0.5039228             -13.7124
        44        2.0000           -0.4952291             -13.4759
        45        2.0000           -0.4864823             -13.2379
        46        2.0000           -0.4777420             -13.0000
        47        2.0000           -0.4732700             -12.8783
        48        2.0000           -0.4700540             -12.7908
        49        2.0000           -0.4660195             -12.6810
        50        2.0000           -0.4517884             -12.2938
        51        2.0000           -0.4442217             -12.0879
        52        2.0000           -0.4151525             -11.2969
        53        2.0000           -0.3992315             -10.8636 (HOMO)
        54                         -0.2802580              -7.6262 (LUMO)
        55                         -0.2286794              -6.2227
        56                         -0.2184652              -5.9447
        57                         -0.1842781              -5.0145
        58                         -0.1305952              -3.5537
        59                         -0.0227539              -0.6192
        60                         -0.0045096              -0.1227
        61                          0.0053782               0.1463
        62                          0.0102518               0.2790
        63                          0.0146101               0.3976
        64                          0.0236853               0.6445
       ...                                ...                  ...
        91                          0.6532684              17.7763
      -------------------------------------------------------------
                  HL-Gap            0.1189736 Eh            3.2374 eV
             Fermi-level           -0.3397448 Eh           -9.2449 eV

     #   Z        covCN         q      C6AA      α(0)
     1   6 C      2.936    -0.034    28.851     8.809
     2  16 S      2.352     0.020   140.253    19.932
     3   6 C      2.987     0.016    27.641     8.624
     4   6 C      3.166    -0.019    28.119     8.665
     5   6 C      3.174    -0.012    27.906     8.628
     6   6 C      3.858    -0.036    21.170     6.544
     7   6 C      3.336     0.483    17.323     6.592
     8   9 F      0.791    -0.208    11.319     3.974
     9   9 F      0.791    -0.208    11.315     3.974
    10   9 F      0.791    -0.205    11.285     3.968
    11   6 C      3.805    -0.063    21.711     6.633
    12   6 C      3.806    -0.064    21.719     6.634
    13   6 C      3.857    -0.035    21.168     6.543
    14   6 C      3.335     0.483    17.329     6.594
    15   9 F      0.791    -0.208    11.315     3.973
    16   9 F      0.791    -0.208    11.323     3.975
    17   9 F      0.791    -0.206    11.299     3.971
    18   6 C      2.935    -0.028    28.688     8.784
    19   6 C      2.838    -0.084    30.087     8.989
    20   1 H      0.926     0.062     2.180     2.309
    21   1 H      0.924     0.071     2.071     2.251
    22   1 H      0.925     0.066     2.132     2.284
    23   1 H      0.924     0.060     2.200     2.319
    24   1 H      0.924     0.060     2.197     2.318
    25   1 H      0.924     0.067     2.123     2.279
    26   1 H      0.924     0.073     2.048     2.238
    27   1 H      0.925     0.057     2.235     2.338
    28   1 H      0.926     0.043     2.406     2.425
    29   1 H      0.926     0.055     2.254     2.348

 Mol. C6AA /au·bohr⁶  :      11026.051319
 Mol. C8AA /au·bohr⁸  :     282302.586164
 Mol. α(0) /au        :        158.914432


Wiberg/Mayer (AO) data.
largest (>0.10) Wiberg bond orders for each atom
          total WBO             WBO to atom ...
     1  C   3.952        C    5 1.581    S    2 1.211    H   20 0.968    C    3 0.102
     2  S   2.643        C    1 1.211    C    3 1.151
     3  C   3.953        C    4 1.520    S    2 1.151    C   18 1.099    C    1 0.102
     4  C   3.977        C    3 1.520    C    5 1.245    C   13 0.989
     5  C   3.980        C    1 1.581    C    4 1.245    C    6 0.989
     6  C   3.980        C   11 0.990    C    5 0.989    H   21 0.954    C    7 0.932
     7  C   3.822        F   10 0.950    F    8 0.948    F    9 0.946    C    6 0.932
     8  F   1.071        C    7 0.948
     9  F   1.071        C    7 0.946
    10  F   1.076        C    7 0.950
    11  C   3.990        C   12 1.011    C    6 0.990    H   22 0.973    H   23 0.972
    12  C   3.991        C   11 1.011    C   13 0.990    H   25 0.972    H   24 0.972
    13  C   3.980        C   12 0.990    C    4 0.989    H   26 0.950    C   14 0.930
    14  C   3.820        F   15 0.949    F   17 0.949    F   16 0.946    C   13 0.930
    15  F   1.072        C   14 0.949
    16  F   1.070        C   14 0.946
    17  F   1.075        C   14 0.949
    18  C   3.990        C   19 1.901    C    3 1.099    H   27 0.957
    19  C   3.990        C   18 1.901    H   29 0.975    H   28 0.971
    20  H   0.995        C    1 0.968
    21  H   0.995        C    6 0.954
    22  H   0.996        C   11 0.973
    23  H   0.995        C   11 0.972
    24  H   0.995        C   12 0.972
    25  H   0.996        C   12 0.972
    26  H   0.994        C   13 0.950
    27  H   0.996        C   18 0.957
    28  H   0.998        C   19 0.971
    29  H   0.996        C   19 0.975

molecular dipole:
                 x           y           z       tot (Debye)
 q only:        0.270       0.341      -0.075
   full:        0.002       0.246      -0.064       0.647
molecular quadrupole (traceless):
                xx          xy          yy          xz          yz          zz
 q only:        8.202       1.041       1.215       0.916     -13.375      -9.417
  q+dip:        5.179       0.313       3.710       2.059     -13.938      -8.889
   full:        5.043       0.315       3.411       1.431     -13.809      -8.453

           -------------------------------------------------
          |                Geometry Summary                 |
           -------------------------------------------------

      molecular mass/u    :      300.2614000
   center of mass at/Å    :       -0.3178637       0.1448586       0.0472084
  moments of inertia/u·Å² :        0.1046315E+04   0.1691066E+04   0.2268812E+04
rotational constants/cm⁻¹ :        0.1611143E-01   0.9968641E-02   0.7430157E-02

 * 27 selected distances

     #   Z        #   Z                                     value/Å
     1   6 C      2  16 S                                 1.7094764
     2  16 S      3   6 C                                 1.7386107 (max)
     3   6 C      4   6 C                                 1.3734067
     1   6 C      5   6 C                                 1.3618130
     4   6 C      5   6 C                                 1.4208625
     6   6 C      7   6 C                                 1.5305916
     7   6 C      8   9 F                                 1.3419193
     7   6 C      9   9 F                                 1.3423504
     7   6 C     10   9 F                                 1.3401826
     6   6 C     11   6 C                                 1.5328647
    11   6 C     12   6 C                                 1.5268163
    12   6 C     13   6 C                                 1.5327515
    13   6 C     14   6 C                                 1.5318599
    14   6 C     15   9 F                                 1.3413142
    14   6 C     16   9 F                                 1.3432518
    14   6 C     17   9 F                                 1.3414384
    18   6 C     19   6 C                                 1.3267169
     1   6 C     20   1 H                                 1.0715962 (min)
     6   6 C     21   1 H                                 1.0958712
    11   6 C     22   1 H                                 1.0899044
    11   6 C     23   1 H                                 1.0913412
    12   6 C     24   1 H                                 1.0912274
    12   6 C     25   1 H                                 1.0903475
    13   6 C     26   1 H                                 1.0923698
    18   6 C     27   1 H                                 1.0824486
    19   6 C     28   1 H                                 1.0763699
    19   6 C     29   1 H                                 1.0753380

 * 4 distinct bonds (by element types)

   Z      Z             #   av. dist./Å        max./Å        min./Å
   1 H    6 C          10     1.0856814     1.0958712     1.0715962
   6 C    6 C           9     1.4597426     1.5328647     1.3267169
   6 C    9 F           6     1.3417428     1.3432518     1.3401826
   6 C   16 S           2     1.7240435     1.7386107     1.7094764


optimized geometry written to: xtbopt.xyz


           -------------------------------------------------
          | TOTAL ENERGY              -62.459205783454 Eh   |
          | GRADIENT NORM               0.000515478449 Eh/α |
          | HOMO-LUMO GAP               3.237435437990 eV   |
           -------------------------------------------------

------------------------------------------------------------------------
 * finished run on 2021/05/19 at 10:59:26.998     
------------------------------------------------------------------------
 total:
 * wall-time:     0 d,  0 h,  0 min,  1.508 sec
 *  cpu-time:     0 d,  0 h,  0 min,  1.504 sec
 * ratio c/w:     0.997 speedup
 SCF:
 * wall-time:     0 d,  0 h,  0 min,  0.061 sec
 *  cpu-time:     0 d,  0 h,  0 min,  0.061 sec
 * ratio c/w:     0.998 speedup
 ANC optimizer:
 * wall-time:     0 d,  0 h,  0 min,  1.419 sec
 *  cpu-time:     0 d,  0 h,  0 min,  1.416 sec
 * ratio c/w:     0.998 speedup

