      -----------------------------------------------------------      
     |                   =====================                   |     
     |                           x T B                           |     
     |                   =====================                   |     
     |                         S. Grimme                         |     
     |          Mulliken Center for Theoretical Chemistry        |     
     |                    University of Bonn                     |     
     |                Version 6.2 RC2 (SAW190805)                |     
      -----------------------------------------------------------      

   This program is distributed in the hope that it will be useful,
   but WITHOUT ANY WARRANTY; without even the implied warranty of
   MERCHANTABILITY or FITNESS FOR A PARTICULAR PURPOSE.
   
   FOR NON-COMMERCIAL, ACADEMIA USE ONLY.
   
   Cite this work as:
   * S. Grimme, C. Bannwarth, P. Shushkov, J. Chem. Theory Comput., 2017,
     13, 1989-2009. DOI: 10.1021/acs.jctc.7b00118
   * C. Bannwarth, S. Ehlert and S. Grimme., J. Chem. Theory Comput., 2019,
     15, 1652-1671. DOI: 10.1021/acs.jctc.8b01176
   * P. Pracht, E. Caldeweyher, S. Ehlert, S. Grimme, ChemRxiv, 2019, preprint.
     DOI: 10.26434/chemrxiv.8326202.v1
   
   for DFT-D4:
   * E. Caldeweyher, C. Bannwarth and S. Grimme, J. Chem. Phys., 2017,
     147, 034112. DOI: 10.1063/1.4993215
   * E. Caldeweyher, S. Ehlert, A. Hansen, H. Neugebauer, S. Spicher,
     C. Bannwarth and S. Grimme, J. Chem. Phys., 2019, 150, 154122.
     DOI: 10.1063/1.5090222
   
   for sTDA-xTB:
   * S. Grimme and C. Bannwarth, J. Chem. Phys., 2016, 145, 054103.
     DOI: 10.1063/1.4959605
   
   in the mass-spec context:
   * V. Asgeirsson, C. Bauer and S. Grimme, Chem. Sci., 2017, 8, 4879.
     DOI: 10.1039/c7sc00601b
   
   for metadynamics refer to:
   * S. Grimme, J. Chem. Theory Comput., 2019, 155, 2847-2862
     DOI: 10.1021/acs.jctc.9b00143
   
   with help from (in alphabetical order)
   C. Bannwarth, F. Bohle, G. Brandenburg, E. Caldeweyher, M. Checinski,
   S. Dohm, S. Ehlert, S. Ehrlich, F. März, H. Neugebauer, J. Pisarek,
   P. Pracht, P. Shushkov, and S. Spicher.
   
 * started run on 2021/05/19 at 10:59:27.017     

           -------------------------------------------------
          |                Calculation Setup                |
           -------------------------------------------------

          program call               : /ihome/ghutchison/geoffh/xtb/xtb 528.xyz -opt
          hostname                   : smp-n144
          coordinate file            : 528.xyz
          omp threads                :                     1
          number of atoms            :                    22
          number of electrons        :                    68
          charge                     :                     0
          spin                       :                   0.0
          first test random number   :      0.89941444129228


########################################################################
# WARNING! Please study the warnings concerning your input carefully
#  - the use of '-opt' is discouraged, please use '--opt' next time
########################################################################

           ------------------------------------------------- 
          |                 G F N 2 - x T B                 |
          | Geometry, Frequencies, Noncovalent interactions |
          |            JCTC 2019 parametrisation            |
           ------------------------------------------------- 
             KAB for C  - Si     :                1.0500
             KAB for H  - Pd     :                0.9500
             k(s)              :                1.8500
             k(p)              :                2.2300
             k(d)              :                2.2300
             k(f)              :                2.0000
             kEN (H0ij)        :               -2.0000
             D4 a1             :                0.5200
             D4 a2             :                5.0000
             D4 s6             :                1.0000
             D4 s8             :                2.7000
             D4 s9             :                5.0000
             alphaj            :                2.0000

  Z AO/shell   Hii/eV     exponent
  1     Wed Apr 25 08:07:45 CEST 2018   EN: 2.200 GM2: 0.406  GM3: 0.0800  RAES: 1.40
     1s    -10.707211    1.230000
  6     Wed Apr 25 08:07:45 CEST 2018   EN: 2.550 GM2: 0.538  GM3: 0.1500  RAES: 3.00
     2s    -13.970922    2.096432
     2p    -10.063292    1.800000
  7     Wed Apr 25 08:07:45 CEST 2018   EN: 3.040 GM2: 0.461  GM3:-0.0640  RAES: 1.90
     2s    -16.686243    2.339881
     2p    -12.523956    2.014332

           ------------------------------------------------- 
          |        Self-Consistent Charge Iterations        |
           ------------------------------------------------- 

          ...................................................
          :                      SETUP                      :
          :.................................................:
          :  # basis functions                  64          :
          :  # atomic orbitals                  64          :
          :  # shells                           36          :
          :  # electrons                        68          :
          :  max. iterations                   250          :
          :  Hamiltonian                  GFN2-xTB          :
          :  restarted?                      false          :
          :  GBSA solvation                  false          :
          :  PC potential                    false          :
          :  electronic temp.          300.0000000     K    :
          :  accuracy                    1.0000000          :
          :  -> integral cutoff          0.2500000E+02      :
          :  -> integral neglect         0.1000000E-07      :
          :  -> SCF convergence          0.1000000E-05 Eh   :
          :  -> wf. convergence          0.1000000E-03 e    :
          :  Broyden damping             0.4000000          :
          ...................................................

 iter      E             dE          RMSdq      gap      omega  full diag
   1    -37.6464831 -0.376465E+02  0.437E+00    2.19       0.0  T
   2    -37.7518425 -0.105359E+00  0.292E+00    2.65       1.0  T
   3    -37.7629272 -0.110847E-01  0.165E+00    2.63       1.0  T
   4    -37.7579273  0.499984E-02  0.770E-01    2.58       1.0  T
   5    -37.7719761 -0.140487E-01  0.188E-01    2.59       1.0  T
   6    -37.7723042 -0.328170E-03  0.827E-02    2.60       1.0  T
   7    -37.7723403 -0.360944E-04  0.233E-02    2.60       1.0  T
   8    -37.7723413 -0.999398E-06  0.135E-02    2.60       1.6  T
   9    -37.7723431 -0.175712E-05  0.546E-03    2.60       3.9  T
  10    -37.7723434 -0.313938E-06  0.220E-03    2.60       9.7  T
  11    -37.7723434 -0.339441E-07  0.973E-04    2.60      21.9  T
  12    -37.7723434 -0.302796E-08  0.388E-04    2.60      55.0  T

   *** convergence criteria satisfied after 12 iterations ***

         #    Occupation            Energy/Eh            Energy/eV
      -------------------------------------------------------------
         1        2.0000           -0.6888289             -18.7440
       ...           ...                  ...                  ...
        28        2.0000           -0.4285892             -11.6625
        29        2.0000           -0.4126378             -11.2284
        30        2.0000           -0.4017287             -10.9316
        31        2.0000           -0.3863353             -10.5127
        32        2.0000           -0.3784899             -10.2992
        33        2.0000           -0.3699823             -10.0677
        34        2.0000           -0.3563254              -9.6961 (HOMO)
        35                         -0.2608029              -7.0968 (LUMO)
        36                         -0.2069393              -5.6311
        37                         -0.1917278              -5.2172
        38                         -0.1726713              -4.6986
        39                         -0.1535039              -4.1771
       ...                                ...                  ...
        64                          0.6926408              18.8477
      -------------------------------------------------------------
                  HL-Gap            0.0955225 Eh            2.5993 eV
             Fermi-level           -0.3085641 Eh           -8.3965 eV

 SCC (total)                   0 d,  0 h,  0 min,  0.035 sec
 SCC setup                      ...        0 min,  0.000 sec (  0.832%)
 Dispersion                     ...        0 min,  0.000 sec (  0.985%)
 integral evaluation            ...        0 min,  0.008 sec ( 22.381%)
 zeroth order Hamiltonian       ...        0 min,  0.000 sec (  0.463%)
 iterations                     ...        0 min,  0.013 sec ( 37.768%)
 molecular gradient             ...        0 min,  0.013 sec ( 36.328%)
 printout                       ...        0 min,  0.000 sec (  1.095%)

         :::::::::::::::::::::::::::::::::::::::::::::::::::::
         ::                     SUMMARY                     ::
         :::::::::::::::::::::::::::::::::::::::::::::::::::::
         :: total energy             -37.188270967725 Eh    ::
         :: gradient norm              0.069554230291 Eh/a0 ::
         :: HOMO-LUMO gap              2.599299491498 eV    ::
         ::.................................................::
         :: SCC energy               -37.772343448076 Eh    ::
         :: -> isotropic ES            0.026829760225 Eh    ::
         :: -> anisotropic ES          0.010001907264 Eh    ::
         :: -> anisotropic XC          0.026262903060 Eh    ::
         :: -> dispersion             -0.023358178013 Eh    ::
         :: repulsion energy           0.584018024158 Eh    ::
         :: add. restraining           0.000000000000 Eh    ::
         :::::::::::::::::::::::::::::::::::::::::::::::::::::

      ----------------------------------------------------------- 
     |                   =====================                   |
     |                        A N C O P T                        |
     |                   =====================                   |
     |               Approximate Normal Coordinate               |
     |                Rational Function Optimizer                |
      ----------------------------------------------------------- 

          ...................................................
          :                      SETUP                      :
          :.................................................:
          :   optimization level            normal          :
          :   max. optcycles                   200          :
          :   ANC micro-cycles                  20          :
          :   degrees of freedom                60          :
          :.................................................:
          :   RF solver                   davidson          :
          :   input Hessian                  false          :
          :   write xtbopt.log                true          :
          :   linear?                        false          :
          :   energy convergence         0.5000000E-05 Eh   :
          :   grad. convergence          0.1000000E-02 Eh/α :
          :   maximium RF displ.         2.0000000          :
          :   Hlow (freq-cutoff)         0.5000000E-02      :
          :   Hmax (freq-cutoff)         5.0000000          :
          :   S6 in model hess.         20.0000000          :
          ...................................................

generating ANC from model Hessian ...
Using Lindh-Hessian (1995)
 Shifting diagonal of input Hessian by   2.448210608166096E-003
 Lowest  eigenvalues of input Hessian
   -0.000000   -0.000000   -0.000000   -0.000000   -0.000000    0.000000
    0.005000    0.006297    0.007564    0.008037    0.012542    0.018310
    0.020741    0.025223    0.025504    0.037726    0.042673    0.053740
 Highest eigenvalues
    2.001421    2.047225    2.077781    2.126740    2.178060    2.284344
 

........................................................................
.............................. CYCLE    1 ..............................
........................................................................
   1    -37.7723435 -0.377723E+02  0.127E-04    2.60       0.0  T
   2    -37.7723435 -0.337508E-10  0.758E-05    2.60     281.1  T
   3    -37.7723435  0.127400E-10  0.462E-05    2.60     461.0  T
     SCC iter.                  ...        0 min,  0.004 sec
     gradient                   ...        0 min,  0.012 sec
 * total energy  :   -37.1882709 Eh     change        0.4485794E-07 Eh
   gradient norm :     0.0695521 Eh/α   predicted     0.0000000E+00 (-100.00%)
   displ. norm   :     0.2785178 α      lambda       -0.1050262E-01
   maximum displ.:     0.1675747 α      in ANC's #15, #13, #16, ...

........................................................................
.............................. CYCLE    2 ..............................
........................................................................
   1    -37.7947503 -0.377948E+02  0.185E-01    2.69       0.0  T
   2    -37.7948225 -0.721707E-04  0.115E-01    2.69       1.0  T
   3    -37.7948093  0.132101E-04  0.601E-02    2.69       1.0  T
   4    -37.7948428 -0.334892E-04  0.190E-02    2.70       1.1  T
   5    -37.7948510 -0.821387E-05  0.366E-03    2.70       5.8  T
   6    -37.7948510 -0.753018E-07  0.169E-03    2.70      12.6  T
   7    -37.7948511 -0.872879E-08  0.365E-04    2.70      58.4  T
     SCC iter.                  ...        0 min,  0.007 sec
     gradient                   ...        0 min,  0.012 sec
 * total energy  :   -37.1952532 Eh     change       -0.6982325E-02 Eh
   gradient norm :     0.0249971 Eh/α   predicted    -0.5658674E-02 ( -18.96%)
   displ. norm   :     0.1784047 α      lambda       -0.2020284E-02
   maximum displ.:     0.0967117 α      in ANC's #15, #13, #3, ...

........................................................................
.............................. CYCLE    3 ..............................
........................................................................
   1    -37.8023469 -0.378023E+02  0.131E-01    2.73       0.0  T
   2    -37.8023723 -0.253729E-04  0.794E-02    2.73       1.0  T
   3    -37.8023580  0.142853E-04  0.413E-02    2.73       1.0  T
   4    -37.8023802 -0.221889E-04  0.115E-02    2.73       1.9  T
   5    -37.8023827 -0.258426E-05  0.240E-03    2.73       8.9  T
   6    -37.8023828 -0.445196E-07  0.119E-03    2.73      18.0  T
     SCC iter.                  ...        0 min,  0.006 sec
     gradient                   ...        0 min,  0.012 sec
 * total energy  :   -37.1963655 Eh     change       -0.1112255E-02 Eh
   gradient norm :     0.0046056 Eh/α   predicted    -0.1042304E-02 (  -6.29%)
   displ. norm   :     0.1130076 α      lambda       -0.1731301E-03
   maximum displ.:     0.0718619 α      in ANC's #1, #2, #3, ...

........................................................................
.............................. CYCLE    4 ..............................
........................................................................
   1    -37.8017600 -0.378018E+02  0.620E-02    2.73       0.0  T
   2    -37.8017606 -0.610506E-06  0.364E-02    2.73       1.0  T
   3    -37.8017587  0.195543E-05  0.114E-02    2.73       1.9  T
   4    -37.8017609 -0.225098E-05  0.211E-03    2.73      10.1  T
   5    -37.8017610 -0.526419E-07  0.820E-04    2.73      26.0  T
     SCC iter.                  ...        0 min,  0.005 sec
     gradient                   ...        0 min,  0.011 sec
 * total energy  :   -37.1964824 Eh     change       -0.1168894E-03 Eh
   gradient norm :     0.0039304 Eh/α   predicted    -0.8767073E-04 ( -25.00%)
   displ. norm   :     0.1578575 α      lambda       -0.1743798E-03
   maximum displ.:     0.1002762 α      in ANC's #1, #2, #3, ...

........................................................................
.............................. CYCLE    5 ..............................
........................................................................
   1    -37.8004249 -0.378004E+02  0.957E-02    2.71       0.0  T
   2    -37.8004256 -0.707048E-06  0.564E-02    2.71       1.0  T
   3    -37.8004187  0.682193E-05  0.209E-02    2.71       1.0  T
   4    -37.8004264 -0.766122E-05  0.227E-03    2.71       9.4  T
   5    -37.8004264 -0.466435E-07  0.110E-03    2.71      19.4  T
   6    -37.8004265 -0.554103E-08  0.290E-04    2.71      73.5  T
   7    -37.8004265 -0.431505E-09  0.134E-04    2.71     159.0  T
     SCC iter.                  ...        0 min,  0.007 sec
     gradient                   ...        0 min,  0.012 sec
 * total energy  :   -37.1965838 Eh     change       -0.1014572E-03 Eh
   gradient norm :     0.0041091 Eh/α   predicted    -0.8936451E-04 ( -11.92%)
   displ. norm   :     0.1077418 α      lambda       -0.8913600E-04
   maximum displ.:     0.0830811 α      in ANC's #1, #2, #3, ...

........................................................................
.............................. CYCLE    6 ..............................
........................................................................
   1    -37.8005063 -0.378005E+02  0.628E-02    2.71       0.0  T
   2    -37.8005069 -0.670308E-06  0.369E-02    2.71       1.0  T
   3    -37.8005042  0.268315E-05  0.109E-02    2.71       2.0  T
   4    -37.8005073 -0.305475E-05  0.173E-03    2.71      12.3  T
   5    -37.8005074 -0.493198E-07  0.687E-04    2.71      31.0  T
   6    -37.8005074 -0.123428E-08  0.280E-04    2.71      76.2  T
     SCC iter.                  ...        0 min,  0.006 sec
     gradient                   ...        0 min,  0.012 sec
 * total energy  :   -37.1966522 Eh     change       -0.6839676E-04 Eh
   gradient norm :     0.0031476 Eh/α   predicted    -0.4508582E-04 ( -34.08%)
   displ. norm   :     0.1249440 α      lambda       -0.8727924E-04
   maximum displ.:     0.0981866 α      in ANC's #1, #2, #4, ...

........................................................................
.............................. CYCLE    7 ..............................
........................................................................
   1    -37.8014532 -0.378015E+02  0.740E-02    2.71       0.0  T
   2    -37.8014541 -0.867379E-06  0.432E-02    2.71       1.0  T
   3    -37.8014513  0.278108E-05  0.118E-02    2.71       1.8  T
   4    -37.8014545 -0.324740E-05  0.179E-03    2.71      11.9  T
   5    -37.8014546 -0.322513E-07  0.873E-04    2.71      24.4  T
   6    -37.8014546 -0.196015E-08  0.340E-04    2.71      62.8  T
     SCC iter.                  ...        0 min,  0.006 sec
     gradient                   ...        0 min,  0.012 sec
 * total energy  :   -37.1967191 Eh     change       -0.6684473E-04 Eh
   gradient norm :     0.0026890 Eh/α   predicted    -0.4432208E-04 ( -33.69%)
   displ. norm   :     0.1589237 α      lambda       -0.7480398E-04
   maximum displ.:     0.1262928 α      in ANC's #1, #2, #4, ...

........................................................................
.............................. CYCLE    8 ..............................
........................................................................
   1    -37.8015793 -0.378016E+02  0.954E-02    2.70       0.0  T
   2    -37.8015801 -0.864643E-06  0.557E-02    2.70       1.0  T
   3    -37.8015797  0.478934E-06  0.654E-03    2.70       3.3  T
   4    -37.8015805 -0.834688E-06  0.183E-03    2.70      11.7  T
   5    -37.8015805 -0.160298E-07  0.854E-04    2.70      25.0  T
   6    -37.8015805 -0.399803E-08  0.288E-04    2.70      74.1  T
     SCC iter.                  ...        0 min,  0.006 sec
     gradient                   ...        0 min,  0.013 sec
 * total energy  :   -37.1967765 Eh     change       -0.5736206E-04 Eh
   gradient norm :     0.0026360 Eh/α   predicted    -0.3834774E-04 ( -33.15%)
   displ. norm   :     0.1481635 α      lambda       -0.5689312E-04
   maximum displ.:     0.1212770 α      in ANC's #1, #2, #4, ...

........................................................................
.............................. CYCLE    9 ..............................
........................................................................
   1    -37.8017237 -0.378017E+02  0.885E-02    2.70       0.0  T
   2    -37.8017246 -0.809310E-06  0.515E-02    2.70       1.0  T
   3    -37.8017244  0.143500E-06  0.540E-03    2.70       3.9  T
   4    -37.8017249 -0.480115E-06  0.187E-03    2.70      11.4  T
   5    -37.8017249 -0.120771E-07  0.101E-03    2.70      21.1  T
   6    -37.8017249 -0.971795E-08  0.183E-04    2.70     116.2  T
   7    -37.8017249 -0.366818E-09  0.687E-05    2.70     310.5  T
     SCC iter.                  ...        0 min,  0.007 sec
     gradient                   ...        0 min,  0.013 sec
 * total energy  :   -37.1968172 Eh     change       -0.4074852E-04 Eh
   gradient norm :     0.0019703 Eh/α   predicted    -0.2907283E-04 ( -28.65%)
   displ. norm   :     0.1578453 α      lambda       -0.2896115E-04
   maximum displ.:     0.1374491 α      in ANC's #1, #2, #4, ...

........................................................................
.............................. CYCLE   10 ..............................
........................................................................
   1    -37.8017836 -0.378018E+02  0.981E-02    2.71       0.0  T
   2    -37.8017849 -0.135270E-05  0.568E-02    2.71       1.0  T
   3    -37.8017844  0.528108E-06  0.706E-03    2.71       3.0  T
   4    -37.8017855 -0.109036E-05  0.236E-03    2.71       9.0  T
   5    -37.8017855 -0.307766E-07  0.122E-03    2.71      17.5  T
   6    -37.8017855 -0.109592E-07  0.243E-04    2.71      87.7  T
   7    -37.8017855 -0.618193E-09  0.764E-05    2.71     279.1  T
     SCC iter.                  ...        0 min,  0.007 sec
     gradient                   ...        0 min,  0.013 sec
 * total energy  :   -37.1968387 Eh     change       -0.2151550E-04 Eh
   gradient norm :     0.0017245 Eh/α   predicted    -0.1464189E-04 ( -31.95%)
   displ. norm   :     0.0522620 α      lambda       -0.9160160E-05
   maximum displ.:     0.0471102 α      in ANC's #1, #6, #10, ...

........................................................................
.............................. CYCLE   11 ..............................
........................................................................
   1    -37.8018238 -0.378018E+02  0.321E-02    2.70       0.0  T
   2    -37.8018240 -0.193399E-06  0.185E-02    2.71       1.2  T
   3    -37.8018239  0.106013E-06  0.330E-03    2.70       6.5  T
   4    -37.8018241 -0.181899E-06  0.847E-04    2.71      25.2  T
   5    -37.8018241 -0.196311E-08  0.556E-04    2.71      38.4  T
     SCC iter.                  ...        0 min,  0.005 sec
     gradient                   ...        0 min,  0.012 sec
 * total energy  :   -37.1968451 Eh     change       -0.6405598E-05 Eh
   gradient norm :     0.0012163 Eh/α   predicted    -0.4586759E-05 ( -28.39%)
   displ. norm   :     0.0224061 α      lambda       -0.3703339E-05
   maximum displ.:     0.0184415 α      in ANC's #1, #2, #3, ...

........................................................................
.............................. CYCLE   12 ..............................
........................................................................
   1    -37.8020038 -0.378020E+02  0.151E-02    2.71       0.0  T
   2    -37.8020039 -0.976803E-07  0.847E-03    2.71       2.5  T
   3    -37.8020037  0.141219E-06  0.300E-03    2.71       7.1  T
   4    -37.8020039 -0.187958E-06  0.595E-04    2.71      35.9  T
   5    -37.8020039 -0.400448E-08  0.294E-04    2.71      72.4  T
     SCC iter.                  ...        0 min,  0.005 sec
     gradient                   ...        0 min,  0.013 sec
 * total energy  :   -37.1968488 Eh     change       -0.3648929E-05 Eh
   gradient norm :     0.0003674 Eh/α   predicted    -0.1854216E-05 ( -49.18%)
   displ. norm   :     0.0186579 α      lambda       -0.1466079E-05
   maximum displ.:     0.0148094 α      in ANC's #1, #2, #4, ...

   *** GEOMETRY OPTIMIZATION CONVERGED AFTER 12 ITERATIONS ***

------------------------------------------------------------------------
 total energy gain   :        -0.0085778 Eh       -5.3827 kcal/mol
 total RMSD          :         0.2533001 a0        0.1340 Å
 total power (kW/mol):        -1.8767518 (step)  -68.9583 (real)
------------------------------------------------------------------------

 ANCopt (total)                0 d,  0 h,  0 min,  0.327 sec
 optimizer setup                ...        0 min,  0.000 sec (  0.049%)
 model hessian                  ...        0 min,  0.003 sec (  0.825%)
 ANC generation                 ...        0 min,  0.001 sec (  0.210%)
 coordinate transformation      ...        0 min,  0.000 sec (  0.062%)
 single point calculation       ...        0 min,  0.319 sec ( 97.686%)
 optimization log               ...        0 min,  0.001 sec (  0.352%)
 hessian update                 ...        0 min,  0.000 sec (  0.046%)
 rational function              ...        0 min,  0.002 sec (  0.512%)

================
 final structure:
================
$coord
    0.01413522201386   -2.85331629089917   -0.11014566342070      C 
   -2.19820069205959   -1.46265615140835   -0.08857234387311      C 
   -4.68832618068733   -2.18080505334832   -0.20821783300152      N 
   -6.08377774786424   -0.01002566795793   -0.11669715902023      C 
   -4.73244295575443    2.01448295473512    0.05037841324792      N 
   -2.25707049514913    1.21967267256995    0.07591926793837      C 
   -0.06793944733582    2.69624765796440    0.23344946786229      C 
    2.17868114692314    1.29579420100130    0.20638161924722      C 
    2.17758217419080   -1.39133908044809    0.03948705093899      C 
    4.68209674530180   -2.06852190103501    0.06361535389365      N 
    6.03424319854760    0.12094013839103    0.23383773901266      C 
    4.64127906703327    2.12266759899060    0.32207632358773      N 
   -0.25856255731162    5.41953930902658    0.40984710318067      C 
    1.69487631912554    6.98989804582994    0.57560997847305      C 
    0.05370949209900   -4.88843435943113   -0.23217442684718      H 
   -5.34299372381337   -3.95994659043434   -0.33742218451224      H 
   -8.11063342327336   -0.02988189482100   -0.18136319170334      H 
    5.36885527203885   -3.83776138789326   -0.02848069327715      H 
    8.06168026069550    0.13630353489759    0.28600503375785      H 
   -2.18250202074932    6.11090921764705    0.40297350977511      H 
    3.60384978868484    6.29086906896905    0.58407550123367      H 
    1.42601326129013    9.00372677124809    0.70453732933619      H 
$end
           -------------------------------------------------
          |                Final Singlepoint                |
           -------------------------------------------------

          ...................................................
          :                      SETUP                      :
          :.................................................:
          :  # basis functions                  64          :
          :  # atomic orbitals                  64          :
          :  # shells                           36          :
          :  # electrons                        68          :
          :  max. iterations                   250          :
          :  Hamiltonian                  GFN2-xTB          :
          :  restarted?                      false          :
          :  GBSA solvation                  false          :
          :  PC potential                    false          :
          :  electronic temp.          300.0000000     K    :
          :  accuracy                    1.0000000          :
          :  -> integral cutoff          0.2500000E+02      :
          :  -> integral neglect         0.1000000E-07      :
          :  -> SCF convergence          0.1000000E-05 Eh   :
          :  -> wf. convergence          0.1000000E-03 e    :
          :  Broyden damping             0.4000000          :
          ...................................................

 iter      E             dE          RMSdq      gap      omega  full diag
   1    -37.8020039 -0.378020E+02  0.992E-05    2.71       0.0  T
   2    -37.8020039 -0.344897E-10  0.519E-05    2.71     410.9  T
   3    -37.8020039 -0.322160E-10  0.405E-05    2.71     526.8  T

   *** convergence criteria satisfied after 3 iterations ***

         #    Occupation            Energy/Eh            Energy/eV
      -------------------------------------------------------------
         1        2.0000           -0.6872333             -18.7006
       ...           ...                  ...                  ...
        28        2.0000           -0.4310922             -11.7306
        29        2.0000           -0.4149325             -11.2909
        30        2.0000           -0.4049263             -11.0186
        31        2.0000           -0.3804805             -10.3534
        32        2.0000           -0.3795476             -10.3280
        33        2.0000           -0.3715464             -10.1103
        34        2.0000           -0.3572705              -9.7218 (HOMO)
        35                         -0.2578508              -7.0165 (LUMO)
        36                         -0.2051879              -5.5834
        37                         -0.1874502              -5.1008
        38                         -0.1714247              -4.6647
        39                         -0.1497495              -4.0749
       ...                                ...                  ...
        64                          0.7059553              19.2100
      -------------------------------------------------------------
                  HL-Gap            0.0994197 Eh            2.7053 eV
             Fermi-level           -0.3075606 Eh           -8.3692 eV

 SCC (total)                   0 d,  0 h,  0 min,  0.025 sec
 SCC setup                      ...        0 min,  0.000 sec (  0.737%)
 Dispersion                     ...        0 min,  0.000 sec (  0.802%)
 integral evaluation            ...        0 min,  0.008 sec ( 31.812%)
 zeroth order Hamiltonian       ...        0 min,  0.000 sec (  0.591%)
 iterations                     ...        0 min,  0.004 sec ( 14.690%)
 molecular gradient             ...        0 min,  0.012 sec ( 49.813%)
 printout                       ...        0 min,  0.000 sec (  1.353%)

         :::::::::::::::::::::::::::::::::::::::::::::::::::::
         ::                     SUMMARY                     ::
         :::::::::::::::::::::::::::::::::::::::::::::::::::::
         :: total energy             -37.196848791601 Eh    ::
         :: gradient norm              0.000367348154 Eh/a0 ::
         :: HOMO-LUMO gap              2.705348538154 eV    ::
         ::.................................................::
         :: SCC energy               -37.802003932721 Eh    ::
         :: -> isotropic ES            0.026542435025 Eh    ::
         :: -> anisotropic ES          0.007973073181 Eh    ::
         :: -> anisotropic XC          0.025279377491 Eh    ::
         :: -> dispersion             -0.023487882390 Eh    ::
         :: repulsion energy           0.605096124115 Eh    ::
         :: add. restraining           0.000000000000 Eh    ::
         :::::::::::::::::::::::::::::::::::::::::::::::::::::

           -------------------------------------------------
          |                Property Printout                |
           -------------------------------------------------

    * Orbital Energies and Occupations

         #    Occupation            Energy/Eh            Energy/eV
      -------------------------------------------------------------
         1        2.0000           -0.6872333             -18.7006
       ...           ...                  ...                  ...
        22        2.0000           -0.4806074             -13.0780
        23        2.0000           -0.4673336             -12.7168
        24        2.0000           -0.4582103             -12.4685
        25        2.0000           -0.4507047             -12.2643
        26        2.0000           -0.4477830             -12.1848
        27        2.0000           -0.4318978             -11.7525
        28        2.0000           -0.4310922             -11.7306
        29        2.0000           -0.4149325             -11.2909
        30        2.0000           -0.4049263             -11.0186
        31        2.0000           -0.3804805             -10.3534
        32        2.0000           -0.3795476             -10.3280
        33        2.0000           -0.3715464             -10.1103
        34        2.0000           -0.3572705              -9.7218 (HOMO)
        35                         -0.2578508              -7.0165 (LUMO)
        36                         -0.2051879              -5.5834
        37                         -0.1874502              -5.1008
        38                         -0.1714247              -4.6647
        39                         -0.1497495              -4.0749
        40                         -0.0542556              -1.4764
        41                          0.0025658               0.0698
        42                          0.0304307               0.8281
        43                          0.0933265               2.5395
        44                          0.1136850               3.0935
        45                          0.1452177               3.9516
       ...                                ...                  ...
        64                          0.7059553              19.2100
      -------------------------------------------------------------
                  HL-Gap            0.0994197 Eh            2.7053 eV
             Fermi-level           -0.3075606 Eh           -8.3692 eV

     #   Z        covCN         q      C6AA      α(0)
     1   6 C      2.900    -0.086    30.141     9.002
     2   6 C      3.101     0.038    27.028     8.520
     3   7 N      2.776    -0.119    23.595     7.214
     4   6 C      3.135     0.106    25.461     8.259
     5   7 N      1.885    -0.263    27.699     7.802
     6   6 C      3.219     0.050    26.193     8.322
     7   6 C      2.960    -0.000    28.033     8.684
     8   6 C      3.206     0.051    26.266     8.346
     9   6 C      3.103     0.037    27.032     8.520
    10   7 N      2.775    -0.118    23.573     7.211
    11   6 C      3.130     0.105    25.494     8.266
    12   7 N      1.886    -0.261    27.641     7.794
    13   6 C      2.894    -0.025    28.626     8.772
    14   6 C      2.840    -0.087    30.172     9.002
    15   1 H      0.926     0.022     2.706     2.572
    16   1 H      0.860     0.158     1.346     1.818
    17   1 H      0.926     0.037     2.492     2.469
    18   1 H      0.860     0.159     1.344     1.816
    19   1 H      0.926     0.037     2.492     2.469
    20   1 H      0.925     0.053     2.277     2.360
    21   1 H      0.926     0.071     2.079     2.255
    22   1 H      0.926     0.037     2.484     2.464

 Mol. C6AA /au·bohr⁶  :       7084.277225
 Mol. C8AA /au·bohr⁸  :     173714.154493
 Mol. α(0) /au        :        133.936904


Wiberg/Mayer (AO) data.
largest (>0.10) Wiberg bond orders for each atom
          total WBO             WBO to atom ...
     1  C   3.937        C    2 1.370    C    9 1.367    H   15 0.966    C    7 0.107
     2  C   3.954        C    1 1.370    C    6 1.234    N    3 1.152
     3  N   3.540        C    4 1.209    C    2 1.152    H   16 0.946    N    5 0.125
     4  C   3.941        N    5 1.616    N    3 1.209    H   17 0.964
     5  N   3.032        C    4 1.616    C    6 1.200    N    3 0.125
     6  C   3.975        C    7 1.313    C    2 1.234    N    5 1.200
     7  C   3.988        C    6 1.313    C    8 1.310    C   13 1.113    C    1 0.107
     8  C   3.975        C    7 1.310    C    9 1.236    N   12 1.202
     9  C   3.953        C    1 1.367    C    8 1.236    N   10 1.152
    10  N   3.543        C   11 1.212    C    9 1.152    H   18 0.946    N   12 0.125
    11  C   3.952        N   12 1.612    N   10 1.212    H   19 0.964
    12  N   3.038        C   11 1.612    C    8 1.202    N   10 0.125
    13  C   3.989        C   14 1.875    C    7 1.113    H   20 0.963
    14  C   3.935        C   13 1.875    H   22 0.979    H   21 0.968
    15  H   0.999        C    1 0.966
    16  H   0.974        N    3 0.946
    17  H   0.998        C    4 0.964
    18  H   0.974        N   10 0.946
    19  H   0.998        C   11 0.964
    20  H   0.997        C   13 0.963
    21  H   0.995        C   14 0.968
    22  H   0.998        C   14 0.979

molecular dipole:
                 x           y           z       tot (Debye)
 q only:        0.083      -1.280      -0.076
   full:        0.074      -2.537      -0.155       6.463
molecular quadrupole (traceless):
                xx          xy          yy          xz          yz          zz
 q only:        4.482       0.688       1.098       0.337       0.346      -5.580
  q+dip:        8.330       0.539       1.883       0.566       0.581     -10.213
   full:        6.635       0.494      -0.451       0.399       0.173      -6.184

           -------------------------------------------------
          |                Geometry Summary                 |
           -------------------------------------------------

      molecular mass/u    :      184.2000000
   center of mass at/Å    :        0.0469932       0.4359640       0.0629857
  moments of inertia/u·Å² :        0.4282731E+03   0.7325665E+03   0.1160834E+04
rotational constants/cm⁻¹ :        0.3936188E-01   0.2301174E-01   0.1452200E-01

 * 23 selected distances

     #   Z        #   Z                                     value/Å
     1   6 C      2   6 C                                 1.3828477
     2   6 C      3   7 N                                 1.3728839
     3   7 N      4   6 C                                 1.3664607
     4   6 C      5   7 N                                 1.2910901
     2   6 C      6   6 C                                 1.4224351
     5   7 N      6   6 C                                 1.3758451
     6   6 C      7   6 C                                 1.3998098
     7   6 C      8   6 C                                 1.4010018
     1   6 C      9   6 C                                 1.3840054
     8   6 C      9   6 C                                 1.4247099 (max)
     9   6 C     10   7 N                                 1.3729832
    10   7 N     11   6 C                                 1.3647255
     8   6 C     12   7 N                                 1.3760128
    11   6 C     12   7 N                                 1.2913495
    13   6 C     14   6 C                                 1.3292178
     1   6 C     15   1 H                                 1.0790757
     3   7 N     16   1 H                                 1.0055242
     4   6 C     17   1 H                                 1.0731631
    10   7 N     18   1 H                                 1.0054824 (min)
    11   6 C     19   1 H                                 1.0732595
    13   6 C     20   1 H                                 1.0818515
    14   6 C     21   1 H                                 1.0757918
    14   6 C     22   1 H                                 1.0772905

 * 4 distinct bonds (by element types)

   Z      Z             #   av. dist./Å        max./Å        min./Å
   1 H    6 C           6     1.0767387     1.0818515     1.0731631
   6 C    6 C           7     1.3920039     1.4247099     1.3292178
   1 H    7 N           2     1.0055033     1.0055242     1.0054824
   6 C    7 N           8     1.3514188     1.3760128     1.2910901


optimized geometry written to: xtbopt.xyz


           -------------------------------------------------
          | TOTAL ENERGY              -37.196848791601 Eh   |
          | GRADIENT NORM               0.000367348154 Eh/α |
          | HOMO-LUMO GAP               2.705348538154 eV   |
           -------------------------------------------------

------------------------------------------------------------------------
 * finished run on 2021/05/19 at 10:59:27.424     
------------------------------------------------------------------------
 total:
 * wall-time:     0 d,  0 h,  0 min,  0.407 sec
 *  cpu-time:     0 d,  0 h,  0 min,  0.405 sec
 * ratio c/w:     0.995 speedup
 SCF:
 * wall-time:     0 d,  0 h,  0 min,  0.035 sec
 *  cpu-time:     0 d,  0 h,  0 min,  0.035 sec
 * ratio c/w:     0.997 speedup
 ANC optimizer:
 * wall-time:     0 d,  0 h,  0 min,  0.352 sec
 *  cpu-time:     0 d,  0 h,  0 min,  0.351 sec
 * ratio c/w:     0.998 speedup

