      -----------------------------------------------------------      
     |                   =====================                   |     
     |                           x T B                           |     
     |                   =====================                   |     
     |                         S. Grimme                         |     
     |          Mulliken Center for Theoretical Chemistry        |     
     |                    University of Bonn                     |     
     |                Version 6.2 RC2 (SAW190805)                |     
      -----------------------------------------------------------      

   This program is distributed in the hope that it will be useful,
   but WITHOUT ANY WARRANTY; without even the implied warranty of
   MERCHANTABILITY or FITNESS FOR A PARTICULAR PURPOSE.
   
   FOR NON-COMMERCIAL, ACADEMIA USE ONLY.
   
   Cite this work as:
   * S. Grimme, C. Bannwarth, P. Shushkov, J. Chem. Theory Comput., 2017,
     13, 1989-2009. DOI: 10.1021/acs.jctc.7b00118
   * C. Bannwarth, S. Ehlert and S. Grimme., J. Chem. Theory Comput., 2019,
     15, 1652-1671. DOI: 10.1021/acs.jctc.8b01176
   * P. Pracht, E. Caldeweyher, S. Ehlert, S. Grimme, ChemRxiv, 2019, preprint.
     DOI: 10.26434/chemrxiv.8326202.v1
   
   for DFT-D4:
   * E. Caldeweyher, C. Bannwarth and S. Grimme, J. Chem. Phys., 2017,
     147, 034112. DOI: 10.1063/1.4993215
   * E. Caldeweyher, S. Ehlert, A. Hansen, H. Neugebauer, S. Spicher,
     C. Bannwarth and S. Grimme, J. Chem. Phys., 2019, 150, 154122.
     DOI: 10.1063/1.5090222
   
   for sTDA-xTB:
   * S. Grimme and C. Bannwarth, J. Chem. Phys., 2016, 145, 054103.
     DOI: 10.1063/1.4959605
   
   in the mass-spec context:
   * V. Asgeirsson, C. Bauer and S. Grimme, Chem. Sci., 2017, 8, 4879.
     DOI: 10.1039/c7sc00601b
   
   for metadynamics refer to:
   * S. Grimme, J. Chem. Theory Comput., 2019, 155, 2847-2862
     DOI: 10.1021/acs.jctc.9b00143
   
   with help from (in alphabetical order)
   C. Bannwarth, F. Bohle, G. Brandenburg, E. Caldeweyher, M. Checinski,
   S. Dohm, S. Ehlert, S. Ehrlich, F. März, H. Neugebauer, J. Pisarek,
   P. Pracht, P. Shushkov, and S. Spicher.
   
 * started run on 2021/05/19 at 10:58:33.115     

           -------------------------------------------------
          |                Calculation Setup                |
           -------------------------------------------------

          program call               : /ihome/ghutchison/geoffh/xtb/xtb 53.xyz -opt
          hostname                   : smp-n58
          coordinate file            : 53.xyz
          omp threads                :                     1
          number of atoms            :                    14
          number of electrons        :                    44
          charge                     :                     0
          spin                       :                   0.0
          first test random number   :      0.49459184521823


########################################################################
# WARNING! Please study the warnings concerning your input carefully
#  - the use of '-opt' is discouraged, please use '--opt' next time
########################################################################

           ------------------------------------------------- 
          |                 G F N 2 - x T B                 |
          | Geometry, Frequencies, Noncovalent interactions |
          |            JCTC 2019 parametrisation            |
           ------------------------------------------------- 
             KAB for C  - Si     :                1.0500
             KAB for H  - Pd     :                0.9500
             k(s)              :                1.8500
             k(p)              :                2.2300
             k(d)              :                2.2300
             k(f)              :                2.0000
             kEN (H0ij)        :               -2.0000
             D4 a1             :                0.5200
             D4 a2             :                5.0000
             D4 s6             :                1.0000
             D4 s8             :                2.7000
             D4 s9             :                5.0000
             alphaj            :                2.0000

  Z AO/shell   Hii/eV     exponent
  1     Wed Apr 25 08:07:45 CEST 2018   EN: 2.200 GM2: 0.406  GM3: 0.0800  RAES: 1.40
     1s    -10.707211    1.230000
  6     Wed Apr 25 08:07:45 CEST 2018   EN: 2.550 GM2: 0.538  GM3: 0.1500  RAES: 3.00
     2s    -13.970922    2.096432
     2p    -10.063292    1.800000
  8     Wed Apr 25 08:07:45 CEST 2018   EN: 3.440 GM2: 0.452  GM3:-0.0517  RAES: 1.80
     2s    -20.229985    2.439742
     2p    -15.503117    2.137023
 16     Tue Apr 24 11:44:34 CEST 2018   EN: 2.580 GM2: 0.340  GM3:-0.0502  RAES: 3.10
     3s    -20.029654    1.981333
     3p    -11.377694    2.025643
     3d     -0.420282    1.702555

           ------------------------------------------------- 
          |        Self-Consistent Charge Iterations        |
           ------------------------------------------------- 

          ...................................................
          :                      SETUP                      :
          :.................................................:
          :  # basis functions                  44          :
          :  # atomic orbitals                  43          :
          :  # shells                           23          :
          :  # electrons                        44          :
          :  max. iterations                   250          :
          :  Hamiltonian                  GFN2-xTB          :
          :  restarted?                      false          :
          :  GBSA solvation                  false          :
          :  PC potential                    false          :
          :  electronic temp.          300.0000000     K    :
          :  accuracy                    1.0000000          :
          :  -> integral cutoff          0.2500000E+02      :
          :  -> integral neglect         0.1000000E-07      :
          :  -> SCF convergence          0.1000000E-05 Eh   :
          :  -> wf. convergence          0.1000000E-03 e    :
          :  Broyden damping             0.4000000          :
          ...................................................

 iter      E             dE          RMSdq      gap      omega  full diag
   1    -25.2983190 -0.252983E+02  0.574E+00    3.38       0.0  T
   2    -25.3427749 -0.444559E-01  0.296E+00    2.77       1.0  T
   3    -25.3386167  0.415818E-02  0.169E+00    3.03       1.0  T
   4    -25.3478391 -0.922240E-02  0.628E-01    2.84       1.0  T
   5    -25.3508033 -0.296415E-02  0.261E-01    2.85       1.0  T
   6    -25.3510267 -0.223406E-03  0.660E-02    2.85       1.0  T
   7    -25.3510496 -0.229125E-04  0.254E-02    2.85       1.1  T
   8    -25.3510500 -0.450041E-06  0.125E-02    2.85       2.1  T
   9    -25.3510503 -0.286977E-06  0.271E-03    2.85       9.9  T
  10    -25.3510503 -0.602879E-08  0.135E-03    2.85      19.7  T
  11    -25.3510503 -0.431359E-08  0.499E-04    2.85      53.6  T
  12    -25.3510503 -0.403780E-09  0.200E-04    2.85     133.6  T

   *** convergence criteria satisfied after 12 iterations ***

         #    Occupation            Energy/Eh            Energy/eV
      -------------------------------------------------------------
         1        2.0000           -0.7431660             -20.2226
       ...           ...                  ...                  ...
        16        2.0000           -0.4833514             -13.1527
        17        2.0000           -0.4736918             -12.8898
        18        2.0000           -0.4674885             -12.7210
        19        2.0000           -0.4521124             -12.3026
        20        2.0000           -0.4505893             -12.2612
        21        2.0000           -0.4187252             -11.3941
        22        2.0000           -0.3891219             -10.5885 (HOMO)
        23                         -0.2844561              -7.7404 (LUMO)
        24                         -0.2508394              -6.8257
        25                         -0.1779934              -4.8434
        26                         -0.1459040              -3.9702
        27                         -0.0232487              -0.6326
       ...                                ...                  ...
        43                          0.7200720              19.5942
      -------------------------------------------------------------
                  HL-Gap            0.1046658 Eh            2.8481 eV
             Fermi-level           -0.3367890 Eh           -9.1645 eV

 SCC (total)                   0 d,  0 h,  0 min,  0.018 sec
 SCC setup                      ...        0 min,  0.000 sec (  1.136%)
 Dispersion                     ...        0 min,  0.000 sec (  0.679%)
 integral evaluation            ...        0 min,  0.004 sec ( 21.406%)
 zeroth order Hamiltonian       ...        0 min,  0.000 sec (  0.469%)
 iterations                     ...        0 min,  0.008 sec ( 42.568%)
 molecular gradient             ...        0 min,  0.006 sec ( 32.058%)
 printout                       ...        0 min,  0.000 sec (  1.435%)

         :::::::::::::::::::::::::::::::::::::::::::::::::::::
         ::                     SUMMARY                     ::
         :::::::::::::::::::::::::::::::::::::::::::::::::::::
         :: total energy             -25.099653134152 Eh    ::
         :: gradient norm              0.053524378931 Eh/a0 ::
         :: HOMO-LUMO gap              2.848100786497 eV    ::
         ::.................................................::
         :: SCC energy               -25.351050321258 Eh    ::
         :: -> isotropic ES            0.045716091375 Eh    ::
         :: -> anisotropic ES          0.001350771624 Eh    ::
         :: -> anisotropic XC          0.006805361636 Eh    ::
         :: -> dispersion             -0.009880627718 Eh    ::
         :: repulsion energy           0.251387431315 Eh    ::
         :: add. restraining           0.000000000000 Eh    ::
         :::::::::::::::::::::::::::::::::::::::::::::::::::::

      ----------------------------------------------------------- 
     |                   =====================                   |
     |                        A N C O P T                        |
     |                   =====================                   |
     |               Approximate Normal Coordinate               |
     |                Rational Function Optimizer                |
      ----------------------------------------------------------- 

          ...................................................
          :                      SETUP                      :
          :.................................................:
          :   optimization level            normal          :
          :   max. optcycles                   200          :
          :   ANC micro-cycles                  20          :
          :   degrees of freedom                36          :
          :.................................................:
          :   RF solver                   davidson          :
          :   input Hessian                  false          :
          :   write xtbopt.log                true          :
          :   linear?                        false          :
          :   energy convergence         0.5000000E-05 Eh   :
          :   grad. convergence          0.1000000E-02 Eh/α :
          :   maximium RF displ.         2.0000000          :
          :   Hlow (freq-cutoff)         0.5000000E-02      :
          :   Hmax (freq-cutoff)         5.0000000          :
          :   S6 in model hess.         20.0000000          :
          ...................................................

generating ANC from model Hessian ...
Using Lindh-Hessian (1995)
 Shifting diagonal of input Hessian by   2.293832773315330E-003
 Lowest  eigenvalues of input Hessian
   -0.000000   -0.000000   -0.000000   -0.000000    0.000000    0.000000
    0.005000    0.006797    0.009534    0.013785    0.021436    0.027479
    0.033082    0.046417    0.062934    0.070926    0.087391    0.091374
 Highest eigenvalues
    1.208375    1.354068    1.500751    1.642202    1.935776    2.331146
 

........................................................................
.............................. CYCLE    1 ..............................
........................................................................
   1    -25.3510503 -0.253511E+02  0.507E-05    2.85       0.0  T
   2    -25.3510503 -0.229505E-11  0.305E-05    2.85     875.1  T
   3    -25.3510503  0.866862E-12  0.190E-05    2.85    1403.3  T
     SCC iter.                  ...        0 min,  0.002 sec
     gradient                   ...        0 min,  0.006 sec
 * total energy  :   -25.0996531 Eh     change        0.1920345E-08 Eh
   gradient norm :     0.0535248 Eh/α   predicted     0.0000000E+00 (-100.00%)
   displ. norm   :     0.1884167 α      lambda       -0.5776688E-02
   maximum displ.:     0.1245070 α      in ANC's #8, #12, #17, ...

........................................................................
.............................. CYCLE    2 ..............................
........................................................................
   1    -25.3625870 -0.253626E+02  0.206E-01    2.87       0.0  T
   2    -25.3626360 -0.490288E-04  0.118E-01    2.85       1.0  T
   3    -25.3626340  0.205185E-05  0.527E-02    2.86       1.0  T
   4    -25.3626445 -0.105342E-04  0.128E-02    2.85       2.1  T
   5    -25.3626448 -0.305128E-06  0.917E-03    2.85       2.9  T
   6    -25.3626455 -0.661562E-06  0.240E-03    2.85      11.1  T
   7    -25.3626455 -0.125163E-07  0.109E-03    2.85      24.5  T
     SCC iter.                  ...        0 min,  0.004 sec
     gradient                   ...        0 min,  0.005 sec
 * total energy  :   -25.1033181 Eh     change       -0.3664952E-02 Eh
   gradient norm :     0.0193991 Eh/α   predicted    -0.2990882E-02 ( -18.39%)
   displ. norm   :     0.1075879 α      lambda       -0.9443067E-03
   maximum displ.:     0.0769533 α      in ANC's #8, #12, #17, ...

........................................................................
.............................. CYCLE    3 ..............................
........................................................................
   1    -25.3653477 -0.253653E+02  0.108E-01    2.85       0.0  T
   2    -25.3653661 -0.184375E-04  0.581E-02    2.84       1.0  T
   3    -25.3653665 -0.394975E-06  0.264E-02    2.84       1.0  T
   4    -25.3653682 -0.172296E-05  0.991E-03    2.84       2.7  T
   5    -25.3653687 -0.525567E-06  0.549E-03    2.84       4.9  T
   6    -25.3653689 -0.185434E-06  0.161E-03    2.84      16.6  T
   7    -25.3653689 -0.748587E-08  0.605E-04    2.84      44.2  T
     SCC iter.                  ...        0 min,  0.003 sec
     gradient                   ...        0 min,  0.005 sec
 * total energy  :   -25.1038651 Eh     change       -0.5470628E-03 Eh
   gradient norm :     0.0106269 Eh/α   predicted    -0.4776172E-03 ( -12.69%)
   displ. norm   :     0.0584056 α      lambda       -0.1566620E-03
   maximum displ.:     0.0322138 α      in ANC's #8, #4, #3, ...

........................................................................
.............................. CYCLE    4 ..............................
........................................................................
   1    -25.3649661 -0.253650E+02  0.960E-02    2.84       0.0  T
   2    -25.3649758 -0.970710E-05  0.465E-02    2.84       1.0  T
   3    -25.3649754  0.384093E-06  0.164E-02    2.84       1.6  T
   4    -25.3649764 -0.102474E-05  0.861E-03    2.84       3.1  T
   5    -25.3649769 -0.494939E-06  0.418E-03    2.83       6.4  T
   6    -25.3649770 -0.608972E-07  0.122E-03    2.84      21.9  T
   7    -25.3649770 -0.518002E-08  0.338E-04    2.84      79.1  T
     SCC iter.                  ...        0 min,  0.003 sec
     gradient                   ...        0 min,  0.005 sec
 * total energy  :   -25.1039459 Eh     change       -0.8078484E-04 Eh
   gradient norm :     0.0040885 Eh/α   predicted    -0.7859777E-04 (  -2.71%)
   displ. norm   :     0.0333867 α      lambda       -0.4703975E-04
   maximum displ.:     0.0202765 α      in ANC's #3, #4, #8, ...

........................................................................
.............................. CYCLE    5 ..............................
........................................................................
   1    -25.3646338 -0.253646E+02  0.664E-02    2.84       0.0  T
   2    -25.3646364 -0.260943E-05  0.317E-02    2.83       1.0  T
   3    -25.3646358  0.617384E-06  0.113E-02    2.84       2.4  T
   4    -25.3646367 -0.935819E-06  0.558E-03    2.84       4.8  T
   5    -25.3646369 -0.207471E-06  0.251E-03    2.83      10.7  T
   6    -25.3646369 -0.128259E-07  0.529E-04    2.83      50.5  T
     SCC iter.                  ...        0 min,  0.003 sec
     gradient                   ...        0 min,  0.005 sec
 * total energy  :   -25.1039686 Eh     change       -0.2267269E-04 Eh
   gradient norm :     0.0019349 Eh/α   predicted    -0.2354458E-04 (   3.85%)
   displ. norm   :     0.0178879 α      lambda       -0.6103552E-05
   maximum displ.:     0.0138644 α      in ANC's #3, #2, #4, ...

........................................................................
.............................. CYCLE    6 ..............................
........................................................................
   1    -25.3647115 -0.253647E+02  0.211E-02    2.84       0.0  T
   2    -25.3647118 -0.281753E-06  0.111E-02    2.84       2.4  T
   3    -25.3647115  0.321615E-06  0.745E-03    2.84       3.6  T
   4    -25.3647119 -0.444891E-06  0.225E-03    2.84      11.9  T
   5    -25.3647119 -0.283861E-07  0.725E-04    2.84      36.9  T
   6    -25.3647119 -0.283023E-09  0.186E-04    2.84     143.7  T
     SCC iter.                  ...        0 min,  0.003 sec
     gradient                   ...        0 min,  0.005 sec
 * total energy  :   -25.1039733 Eh     change       -0.4713987E-05 Eh
   gradient norm :     0.0008601 Eh/α   predicted    -0.3053250E-05 ( -35.23%)
   displ. norm   :     0.0121244 α      lambda       -0.1071550E-05
   maximum displ.:     0.0103658 α      in ANC's #3, #2, #8, ...

   *** GEOMETRY OPTIMIZATION CONVERGED AFTER 6 ITERATIONS ***

------------------------------------------------------------------------
 total energy gain   :        -0.0043202 Eh       -2.7110 kcal/mol
 total RMSD          :         0.0908977 a0        0.0481 Å
 total power (kW/mol):        -1.8904406 (step) -150.0053 (real)
------------------------------------------------------------------------

 ANCopt (total)                0 d,  0 h,  0 min,  0.076 sec
 optimizer setup                ...        0 min,  0.000 sec (  0.149%)
 model hessian                  ...        0 min,  0.001 sec (  1.674%)
 ANC generation                 ...        0 min,  0.000 sec (  0.464%)
 coordinate transformation      ...        0 min,  0.000 sec (  0.098%)
 single point calculation       ...        0 min,  0.072 sec ( 95.225%)
 optimization log               ...        0 min,  0.000 sec (  0.555%)
 hessian update                 ...        0 min,  0.000 sec (  0.076%)
 rational function              ...        0 min,  0.001 sec (  1.224%)

================
 final structure:
================
$coord
    0.59545072481293    2.14977028785893    0.01908162807137      C 
    2.78991785589200   -0.55223528214216    0.19903830271171      S 
   -0.23144398721693   -1.85660007270944    0.15318650607805      C 
   -1.56603540724318    0.31095574768025    0.02200514362859      C 
   -4.27039845099403    0.78081213136415   -0.08846082821617      C 
   -5.88739267202925   -0.83180836948047   -0.08278148030642      O 
   -4.76671790726584    3.27859637873613   -0.19529950146470      O 
   -7.36192856048807    3.93988442490030   -0.31158326745714      C 
    0.84389784633260    3.23201905867095   -1.70747593599691      H 
    0.73336897479558    3.36793646703743    1.66560397070990      H 
   -0.73166684181630   -3.81874328587114    0.21567957783705      H 
   -7.43867281236781    5.99064544064537   -0.21914456477903      H 
   -8.38850050880595    3.09983540736762    1.26933813379532      H 
   -8.19557313890751    3.26333139959655   -2.07453503494941      H 
$end
           -------------------------------------------------
          |                Final Singlepoint                |
           -------------------------------------------------

          ...................................................
          :                      SETUP                      :
          :.................................................:
          :  # basis functions                  44          :
          :  # atomic orbitals                  43          :
          :  # shells                           23          :
          :  # electrons                        44          :
          :  max. iterations                   250          :
          :  Hamiltonian                  GFN2-xTB          :
          :  restarted?                      false          :
          :  GBSA solvation                  false          :
          :  PC potential                    false          :
          :  electronic temp.          300.0000000     K    :
          :  accuracy                    1.0000000          :
          :  -> integral cutoff          0.2500000E+02      :
          :  -> integral neglect         0.1000000E-07      :
          :  -> SCF convergence          0.1000000E-05 Eh   :
          :  -> wf. convergence          0.1000000E-03 e    :
          :  Broyden damping             0.4000000          :
          ...................................................

 iter      E             dE          RMSdq      gap      omega  full diag
   1    -25.3647119 -0.253647E+02  0.732E-05    2.84       0.0  T
   2    -25.3647119 -0.541789E-11  0.391E-05    2.84     682.9  T
   3    -25.3647119  0.144240E-11  0.280E-05    2.84     953.7  T

   *** convergence criteria satisfied after 3 iterations ***

         #    Occupation            Energy/Eh            Energy/eV
      -------------------------------------------------------------
         1        2.0000           -0.7454227             -20.2840
       ...           ...                  ...                  ...
        16        2.0000           -0.4844941             -13.1838
        17        2.0000           -0.4727687             -12.8647
        18        2.0000           -0.4660410             -12.6816
        19        2.0000           -0.4519529             -12.2983
        20        2.0000           -0.4492321             -12.2242
        21        2.0000           -0.4173545             -11.3568
        22        2.0000           -0.3890127             -10.5856 (HOMO)
        23                         -0.2847627              -7.7488 (LUMO)
        24                         -0.2516548              -6.8479
        25                         -0.1719251              -4.6783
        26                         -0.1465153              -3.9869
        27                         -0.0209187              -0.5692
       ...                                ...                  ...
        43                          0.7284469              19.8220
      -------------------------------------------------------------
                  HL-Gap            0.1042500 Eh            2.8368 eV
             Fermi-level           -0.3368877 Eh           -9.1672 eV

 SCC (total)                   0 d,  0 h,  0 min,  0.012 sec
 SCC setup                      ...        0 min,  0.000 sec (  1.063%)
 Dispersion                     ...        0 min,  0.000 sec (  0.616%)
 integral evaluation            ...        0 min,  0.004 sec ( 30.418%)
 zeroth order Hamiltonian       ...        0 min,  0.000 sec (  0.600%)
 iterations                     ...        0 min,  0.002 sec ( 17.771%)
 molecular gradient             ...        0 min,  0.006 sec ( 47.288%)
 printout                       ...        0 min,  0.000 sec (  1.858%)

         :::::::::::::::::::::::::::::::::::::::::::::::::::::
         ::                     SUMMARY                     ::
         :::::::::::::::::::::::::::::::::::::::::::::::::::::
         :: total energy             -25.103973312697 Eh    ::
         :: gradient norm              0.000861397007 Eh/a0 ::
         :: HOMO-LUMO gap              2.836786862057 eV    ::
         ::.................................................::
         :: SCC energy               -25.364711928222 Eh    ::
         :: -> isotropic ES            0.046442345193 Eh    ::
         :: -> anisotropic ES          0.000536400764 Eh    ::
         :: -> anisotropic XC          0.006174300819 Eh    ::
         :: -> dispersion             -0.009885774199 Eh    ::
         :: repulsion energy           0.260730825331 Eh    ::
         :: add. restraining           0.000000000000 Eh    ::
         :::::::::::::::::::::::::::::::::::::::::::::::::::::

           -------------------------------------------------
          |                Property Printout                |
           -------------------------------------------------

    * Orbital Energies and Occupations

         #    Occupation            Energy/Eh            Energy/eV
      -------------------------------------------------------------
         1        2.0000           -0.7454227             -20.2840
       ...           ...                  ...                  ...
        10        2.0000           -0.5638009             -15.3418
        11        2.0000           -0.5610587             -15.2672
        12        2.0000           -0.5387185             -14.6593
        13        2.0000           -0.5219396             -14.2027
        14        2.0000           -0.5136843             -13.9781
        15        2.0000           -0.5134972             -13.9730
        16        2.0000           -0.4844941             -13.1838
        17        2.0000           -0.4727687             -12.8647
        18        2.0000           -0.4660410             -12.6816
        19        2.0000           -0.4519529             -12.2983
        20        2.0000           -0.4492321             -12.2242
        21        2.0000           -0.4173545             -11.3568
        22        2.0000           -0.3890127             -10.5856 (HOMO)
        23                         -0.2847627              -7.7488 (LUMO)
        24                         -0.2516548              -6.8479
        25                         -0.1719251              -4.6783
        26                         -0.1465153              -3.9869
        27                         -0.0209187              -0.5692
        28                         -0.0162482              -0.4421
        29                          0.0172226               0.4687
        30                          0.0255372               0.6949
        31                          0.0398765               1.0851
        32                          0.1297293               3.5301
        33                          0.1425171               3.8781
       ...                                ...                  ...
        43                          0.7284469              19.8220
      -------------------------------------------------------------
                  HL-Gap            0.1042500 Eh            2.8368 eV
             Fermi-level           -0.3368877 Eh           -9.1672 eV

     #   Z        covCN         q      C6AA      α(0)
     1   6 C      3.979    -0.014    20.749     6.472
     2  16 S      2.443    -0.059   143.522    20.163
     3   6 C      3.068     0.013    27.645     8.621
     4   6 C      3.443    -0.040    24.013     7.434
     5   6 C      2.724     0.348    21.082     7.517
     6   8 O      0.857    -0.418    22.050     6.296
     7   8 O      1.706    -0.272    18.507     5.808
     8   6 C      3.657     0.036    20.256     6.460
     9   1 H      0.925     0.073     2.050     2.239
    10   1 H      0.925     0.073     2.050     2.239
    11   1 H      0.926     0.069     2.098     2.265
    12   1 H      0.925     0.066     2.131     2.283
    13   1 H      0.924     0.064     2.156     2.296
    14   1 H      0.924     0.061     2.189     2.314

 Mol. C6AA /au·bohr⁶  :       2842.891585
 Mol. C8AA /au·bohr⁸  :      79322.896759
 Mol. α(0) /au        :         82.407067


Wiberg/Mayer (AO) data.
largest (>0.10) Wiberg bond orders for each atom
          total WBO             WBO to atom ...
     1  C   3.973        C    4 1.019    S    2 0.989    H    9 0.963    H   10 0.963
     2  S   2.358        C    3 1.150    C    1 0.989    C    4 0.113
     3  C   3.962        C    4 1.702    S    2 1.150    H   11 0.967
     4  C   3.975        C    3 1.702    C    5 1.050    C    1 1.019    S    2 0.113
     5  C   3.929        O    6 1.699    O    7 1.095    C    4 1.050
     6  O   2.028        C    5 1.699    O    7 0.165
     7  O   2.286        C    5 1.095    C    8 0.962    O    6 0.165
     8  C   3.927        H   12 0.982    H   13 0.977    H   14 0.977    O    7 0.962
     9  H   0.995        C    1 0.963
    10  H   0.995        C    1 0.963
    11  H   0.995        C    3 0.967
    12  H   0.995        C    8 0.982
    13  H   0.995        C    8 0.977
    14  H   0.996        C    8 0.977

molecular dipole:
                 x           y           z       tot (Debye)
 q only:        0.433       0.847      -0.013
   full:        0.158       0.997      -0.031       2.568
molecular quadrupole (traceless):
                xx          xy          yy          xz          yz          zz
 q only:       -2.858      -8.329       3.654       0.242      -0.328      -0.796
  q+dip:       -6.806      -8.101       5.159       0.017      -0.287       1.647
   full:       -6.371      -8.429       4.689       0.039      -0.275       1.681

           -------------------------------------------------
          |                Geometry Summary                 |
           -------------------------------------------------

      molecular mass/u    :      130.1612000
   center of mass at/Å    :       -1.0510605       0.4092122      -0.0056785
  moments of inertia/u·Å² :        0.9692503E+02   0.5419650E+03   0.6324956E+03
rotational constants/cm⁻¹ :        0.1739244E+00   0.3110465E-01   0.2665257E-01

 * 13 selected distances

     #   Z        #   Z                                     value/Å
     2  16 S      3   6 C                                 1.7416362 (max)
     1   6 C      4   6 C                                 1.5017142
     3   6 C      4   6 C                                 1.3487939
     4   6 C      5   6 C                                 1.4537018
     5   6 C      6   8 O                                 1.2084777
     5   6 C      7   8 O                                 1.3487973
     7   8 O      8   6 C                                 1.4185447
     1   6 C      9   1 H                                 1.0862953
     1   6 C     10   1 H                                 1.0862949
     3   6 C     11   1 H                                 1.0720424 (min)
     8   6 C     12   1 H                                 1.0870768
     8   6 C     13   1 H                                 1.0920615
     8   6 C     14   1 H                                 1.0922975

 * 4 distinct bonds (by element types)

   Z      Z             #   av. dist./Å        max./Å        min./Å
   1 H    6 C           6     1.0860114     1.0922975     1.0720424
   6 C    6 C           3     1.4347367     1.5017142     1.3487939
   6 C    8 O           3     1.3252732     1.4185447     1.2084777
   6 C   16 S           1     1.7416362     1.7416362     1.7416362


optimized geometry written to: xtbopt.xyz


           -------------------------------------------------
          | TOTAL ENERGY              -25.103973312697 Eh   |
          | GRADIENT NORM               0.000861397007 Eh/α |
          | HOMO-LUMO GAP               2.836786862057 eV   |
           -------------------------------------------------

------------------------------------------------------------------------
 * finished run on 2021/05/19 at 10:58:33.235     
------------------------------------------------------------------------
 total:
 * wall-time:     0 d,  0 h,  0 min,  0.120 sec
 *  cpu-time:     0 d,  0 h,  0 min,  0.120 sec
 * ratio c/w:     0.997 speedup
 SCF:
 * wall-time:     0 d,  0 h,  0 min,  0.018 sec
 *  cpu-time:     0 d,  0 h,  0 min,  0.018 sec
 * ratio c/w:     1.000 speedup
 ANC optimizer:
 * wall-time:     0 d,  0 h,  0 min,  0.088 sec
 *  cpu-time:     0 d,  0 h,  0 min,  0.088 sec
 * ratio c/w:     1.000 speedup

