      -----------------------------------------------------------      
     |                   =====================                   |     
     |                           x T B                           |     
     |                   =====================                   |     
     |                         S. Grimme                         |     
     |          Mulliken Center for Theoretical Chemistry        |     
     |                    University of Bonn                     |     
     |                Version 6.2 RC2 (SAW190805)                |     
      -----------------------------------------------------------      

   This program is distributed in the hope that it will be useful,
   but WITHOUT ANY WARRANTY; without even the implied warranty of
   MERCHANTABILITY or FITNESS FOR A PARTICULAR PURPOSE.
   
   FOR NON-COMMERCIAL, ACADEMIA USE ONLY.
   
   Cite this work as:
   * S. Grimme, C. Bannwarth, P. Shushkov, J. Chem. Theory Comput., 2017,
     13, 1989-2009. DOI: 10.1021/acs.jctc.7b00118
   * C. Bannwarth, S. Ehlert and S. Grimme., J. Chem. Theory Comput., 2019,
     15, 1652-1671. DOI: 10.1021/acs.jctc.8b01176
   * P. Pracht, E. Caldeweyher, S. Ehlert, S. Grimme, ChemRxiv, 2019, preprint.
     DOI: 10.26434/chemrxiv.8326202.v1
   
   for DFT-D4:
   * E. Caldeweyher, C. Bannwarth and S. Grimme, J. Chem. Phys., 2017,
     147, 034112. DOI: 10.1063/1.4993215
   * E. Caldeweyher, S. Ehlert, A. Hansen, H. Neugebauer, S. Spicher,
     C. Bannwarth and S. Grimme, J. Chem. Phys., 2019, 150, 154122.
     DOI: 10.1063/1.5090222
   
   for sTDA-xTB:
   * S. Grimme and C. Bannwarth, J. Chem. Phys., 2016, 145, 054103.
     DOI: 10.1063/1.4959605
   
   in the mass-spec context:
   * V. Asgeirsson, C. Bauer and S. Grimme, Chem. Sci., 2017, 8, 4879.
     DOI: 10.1039/c7sc00601b
   
   for metadynamics refer to:
   * S. Grimme, J. Chem. Theory Comput., 2019, 155, 2847-2862
     DOI: 10.1021/acs.jctc.9b00143
   
   with help from (in alphabetical order)
   C. Bannwarth, F. Bohle, G. Brandenburg, E. Caldeweyher, M. Checinski,
   S. Dohm, S. Ehlert, S. Ehrlich, F. März, H. Neugebauer, J. Pisarek,
   P. Pracht, P. Shushkov, and S. Spicher.
   
 * started run on 2021/05/19 at 10:59:28.520     

           -------------------------------------------------
          |                Calculation Setup                |
           -------------------------------------------------

          program call               : /ihome/ghutchison/geoffh/xtb/xtb 531.xyz -opt
          hostname                   : smp-n144
          coordinate file            : 531.xyz
          omp threads                :                     1
          number of atoms            :                    27
          number of electrons        :                    70
          charge                     :                     0
          spin                       :                   0.0
          first test random number   :      0.76395231715215


########################################################################
# WARNING! Please study the warnings concerning your input carefully
#  - the use of '-opt' is discouraged, please use '--opt' next time
########################################################################

           ------------------------------------------------- 
          |                 G F N 2 - x T B                 |
          | Geometry, Frequencies, Noncovalent interactions |
          |            JCTC 2019 parametrisation            |
           ------------------------------------------------- 
             KAB for C  - Si     :                1.0500
             KAB for H  - Pd     :                0.9500
             k(s)              :                1.8500
             k(p)              :                2.2300
             k(d)              :                2.2300
             k(f)              :                2.0000
             kEN (H0ij)        :               -2.0000
             D4 a1             :                0.5200
             D4 a2             :                5.0000
             D4 s6             :                1.0000
             D4 s8             :                2.7000
             D4 s9             :                5.0000
             alphaj            :                2.0000

  Z AO/shell   Hii/eV     exponent
  1     Wed Apr 25 08:07:45 CEST 2018   EN: 2.200 GM2: 0.406  GM3: 0.0800  RAES: 1.40
     1s    -10.707211    1.230000
  6     Wed Apr 25 08:07:45 CEST 2018   EN: 2.550 GM2: 0.538  GM3: 0.1500  RAES: 3.00
     2s    -13.970922    2.096432
     2p    -10.063292    1.800000
  7     Wed Apr 25 08:07:45 CEST 2018   EN: 3.040 GM2: 0.461  GM3:-0.0640  RAES: 1.90
     2s    -16.686243    2.339881
     2p    -12.523956    2.014332
 16     Tue Apr 24 11:44:34 CEST 2018   EN: 2.580 GM2: 0.340  GM3:-0.0502  RAES: 3.10
     3s    -20.029654    1.981333
     3p    -11.377694    2.025643
     3d     -0.420282    1.702555

           ------------------------------------------------- 
          |        Self-Consistent Charge Iterations        |
           ------------------------------------------------- 

          ...................................................
          :                      SETUP                      :
          :.................................................:
          :  # basis functions                  72          :
          :  # atomic orbitals                  71          :
          :  # shells                           41          :
          :  # electrons                        70          :
          :  max. iterations                   250          :
          :  Hamiltonian                  GFN2-xTB          :
          :  restarted?                      false          :
          :  GBSA solvation                  false          :
          :  PC potential                    false          :
          :  electronic temp.          300.0000000     K    :
          :  accuracy                    1.0000000          :
          :  -> integral cutoff          0.2500000E+02      :
          :  -> integral neglect         0.1000000E-07      :
          :  -> SCF convergence          0.1000000E-05 Eh   :
          :  -> wf. convergence          0.1000000E-03 e    :
          :  Broyden damping             0.4000000          :
          ...................................................

 iter      E             dE          RMSdq      gap      omega  full diag
   1    -38.0740199 -0.380740E+02  0.374E+00    2.72       0.0  T
   2    -38.1078583 -0.338384E-01  0.213E+00    3.10       1.0  T
   3    -38.0969817  0.108766E-01  0.974E-01    3.13       1.0  T
   4    -38.1110482 -0.140665E-01  0.445E-01    3.09       1.0  T
   5    -38.1136896 -0.264141E-02  0.992E-02    3.09       1.0  T
   6    -38.1136932 -0.361183E-05  0.595E-02    3.09       1.0  T
   7    -38.1137533 -0.600085E-04  0.208E-02    3.09       1.0  T
   8    -38.1137560 -0.278622E-05  0.104E-02    3.09       1.9  T
   9    -38.1137564 -0.390738E-06  0.469E-03    3.09       4.1  T
  10    -38.1137566 -0.120937E-06  0.196E-03    3.09       9.8  T
  11    -38.1137566 -0.194364E-07  0.110E-03    3.09      17.6  T
  12    -38.1137566 -0.106968E-07  0.494E-04    3.09      39.0  T
  13    -38.1137566 -0.224207E-08  0.152E-04    3.09     126.3  T

   *** convergence criteria satisfied after 13 iterations ***

         #    Occupation            Energy/Eh            Energy/eV
      -------------------------------------------------------------
         1        2.0000           -0.7243115             -19.7095
       ...           ...                  ...                  ...
        29        2.0000           -0.4338671             -11.8061
        30        2.0000           -0.4205686             -11.4443
        31        2.0000           -0.4173780             -11.3574
        32        2.0000           -0.3850710             -10.4783
        33        2.0000           -0.3714198             -10.1068
        34        2.0000           -0.3694303             -10.0527
        35        2.0000           -0.3672071              -9.9922 (HOMO)
        36                         -0.2537269              -6.9043 (LUMO)
        37                         -0.2011483              -5.4735
        38                         -0.1908475              -5.1932
        39                         -0.1587612              -4.3201
        40                         -0.1032363              -2.8092
       ...                                ...                  ...
        71                          0.6678405              18.1729
      -------------------------------------------------------------
                  HL-Gap            0.1134803 Eh            3.0880 eV
             Fermi-level           -0.3104670 Eh           -8.4482 eV

 SCC (total)                   0 d,  0 h,  0 min,  0.044 sec
 SCC setup                      ...        0 min,  0.000 sec (  0.706%)
 Dispersion                     ...        0 min,  0.000 sec (  0.889%)
 integral evaluation            ...        0 min,  0.010 sec ( 22.304%)
 zeroth order Hamiltonian       ...        0 min,  0.000 sec (  0.463%)
 iterations                     ...        0 min,  0.017 sec ( 38.133%)
 molecular gradient             ...        0 min,  0.016 sec ( 36.429%)
 printout                       ...        0 min,  0.000 sec (  0.940%)

         :::::::::::::::::::::::::::::::::::::::::::::::::::::
         ::                     SUMMARY                     ::
         :::::::::::::::::::::::::::::::::::::::::::::::::::::
         :: total energy             -37.593261073296 Eh    ::
         :: gradient norm              0.059781681083 Eh/a0 ::
         :: HOMO-LUMO gap              3.087955613305 eV    ::
         ::.................................................::
         :: SCC energy               -38.113756582611 Eh    ::
         :: -> isotropic ES            0.023988603062 Eh    ::
         :: -> anisotropic ES          0.006573208943 Eh    ::
         :: -> anisotropic XC          0.026106925782 Eh    ::
         :: -> dispersion             -0.028460065793 Eh    ::
         :: repulsion energy           0.520175945819 Eh    ::
         :: add. restraining           0.000000000000 Eh    ::
         :::::::::::::::::::::::::::::::::::::::::::::::::::::

      ----------------------------------------------------------- 
     |                   =====================                   |
     |                        A N C O P T                        |
     |                   =====================                   |
     |               Approximate Normal Coordinate               |
     |                Rational Function Optimizer                |
      ----------------------------------------------------------- 

          ...................................................
          :                      SETUP                      :
          :.................................................:
          :   optimization level            normal          :
          :   max. optcycles                   200          :
          :   ANC micro-cycles                  20          :
          :   degrees of freedom                75          :
          :.................................................:
          :   RF solver                   davidson          :
          :   input Hessian                  false          :
          :   write xtbopt.log                true          :
          :   linear?                        false          :
          :   energy convergence         0.5000000E-05 Eh   :
          :   grad. convergence          0.1000000E-02 Eh/α :
          :   maximium RF displ.         2.0000000          :
          :   Hlow (freq-cutoff)         0.5000000E-02      :
          :   Hmax (freq-cutoff)         5.0000000          :
          :   S6 in model hess.         20.0000000          :
          ...................................................

generating ANC from model Hessian ...
Using Lindh-Hessian (1995)
 Shifting diagonal of input Hessian by   3.855849407927093E-003
 Lowest  eigenvalues of input Hessian
   -0.000000   -0.000000    0.000000    0.000000    0.000000    0.000000
    0.005000    0.007078    0.007477    0.008990    0.009687    0.011438
    0.013295    0.015819    0.016686    0.020612    0.021165    0.023594
 Highest eigenvalues
    1.419315    1.518152    1.612541    1.764539    1.810271    1.974501
 

........................................................................
.............................. CYCLE    1 ..............................
........................................................................
   1    -38.1137566 -0.381138E+02  0.442E-05    3.09       0.0  T
   2    -38.1137566 -0.385114E-11  0.282E-05    3.09     681.3  T
   3    -38.1137566  0.189004E-11  0.207E-05    3.09     931.2  T
     SCC iter.                  ...        0 min,  0.005 sec
     gradient                   ...        0 min,  0.015 sec
 * total energy  :   -37.5932611 Eh     change       -0.1308380E-07 Eh
   gradient norm :     0.0597822 Eh/α   predicted     0.0000000E+00 (-100.00%)
   displ. norm   :     0.3570286 α      lambda       -0.7992549E-02
   maximum displ.:     0.1438833 α      in ANC's #4, #10, #6, ...

........................................................................
.............................. CYCLE    2 ..............................
........................................................................
   1    -38.1350332 -0.381350E+02  0.270E-01    3.14       0.0  T
   2    -38.1350754 -0.421757E-04  0.146E-01    3.15       1.0  T
   3    -38.1349541  0.121285E-03  0.823E-02    3.15       1.0  T
   4    -38.1351189 -0.164875E-03  0.207E-02    3.15       1.0  T
   5    -38.1351202 -0.129579E-05  0.948E-03    3.15       2.0  T
   6    -38.1351216 -0.136019E-05  0.263E-03    3.15       7.3  T
   7    -38.1351217 -0.103976E-06  0.973E-04    3.15      19.8  T
     SCC iter.                  ...        0 min,  0.009 sec
     gradient                   ...        0 min,  0.015 sec
 * total energy  :   -37.5983291 Eh     change       -0.5068046E-02 Eh
   gradient norm :     0.0206271 Eh/α   predicted    -0.4505690E-02 ( -11.10%)
   displ. norm   :     0.2865777 α      lambda       -0.1863685E-02
   maximum displ.:     0.1482952 α      in ANC's #4, #2, #6, ...

........................................................................
.............................. CYCLE    3 ..............................
........................................................................
   1    -38.1434452 -0.381434E+02  0.177E-01    3.16       0.0  T
   2    -38.1434645 -0.192545E-04  0.960E-02    3.16       1.0  T
   3    -38.1434151  0.493741E-04  0.540E-02    3.16       1.0  T
   4    -38.1434850 -0.699076E-04  0.135E-02    3.16       1.4  T
   5    -38.1434855 -0.528586E-06  0.637E-03    3.16       3.0  T
   6    -38.1434861 -0.621592E-06  0.185E-03    3.16      10.4  T
   7    -38.1434862 -0.553285E-07  0.577E-04    3.16      33.3  T
     SCC iter.                  ...        0 min,  0.009 sec
     gradient                   ...        0 min,  0.015 sec
 * total energy  :   -37.5994762 Eh     change       -0.1147113E-02 Eh
   gradient norm :     0.0066431 Eh/α   predicted    -0.1008379E-02 ( -12.09%)
   displ. norm   :     0.2335628 α      lambda       -0.5080216E-03
   maximum displ.:     0.1239196 α      in ANC's #2, #4, #3, ...

........................................................................
.............................. CYCLE    4 ..............................
........................................................................
   1    -38.1432973 -0.381433E+02  0.123E-01    3.14       0.0  T
   2    -38.1433027 -0.537034E-05  0.674E-02    3.14       1.0  T
   3    -38.1432896  0.130505E-04  0.259E-02    3.14       1.0  T
   4    -38.1433058 -0.161455E-04  0.728E-03    3.14       2.6  T
   5    -38.1433060 -0.180212E-06  0.272E-03    3.14       7.1  T
   6    -38.1433061 -0.117081E-06  0.924E-04    3.14      20.8  T
     SCC iter.                  ...        0 min,  0.008 sec
     gradient                   ...        0 min,  0.015 sec
 * total energy  :   -37.5998380 Eh     change       -0.3617534E-03 Eh
   gradient norm :     0.0062360 Eh/α   predicted    -0.2678812E-03 ( -25.95%)
   displ. norm   :     0.2275970 α      lambda       -0.3198216E-03
   maximum displ.:     0.1259811 α      in ANC's #2, #3, #4, ...

........................................................................
.............................. CYCLE    5 ..............................
........................................................................
   1    -38.1422389 -0.381422E+02  0.127E-01    3.12       0.0  T
   2    -38.1422437 -0.477817E-05  0.701E-02    3.12       1.0  T
   3    -38.1422439 -0.220920E-06  0.114E-02    3.12       1.7  T
   4    -38.1422444 -0.533447E-06  0.640E-03    3.12       3.0  T
   5    -38.1422448 -0.381985E-06  0.248E-03    3.12       7.8  T
   6    -38.1422449 -0.116080E-06  0.579E-04    3.12      33.2  T
     SCC iter.                  ...        0 min,  0.008 sec
     gradient                   ...        0 min,  0.015 sec
 * total energy  :   -37.6000274 Eh     change       -0.1893954E-03 Eh
   gradient norm :     0.0040538 Eh/α   predicted    -0.1681951E-03 ( -11.19%)
   displ. norm   :     0.1363418 α      lambda       -0.1286836E-03
   maximum displ.:     0.0776283 α      in ANC's #2, #1, #5, ...

........................................................................
.............................. CYCLE    6 ..............................
........................................................................
   1    -38.1421859 -0.381422E+02  0.773E-02    3.11       0.0  T
   2    -38.1421877 -0.189072E-05  0.416E-02    3.11       1.0  T
   3    -38.1421862  0.153486E-05  0.111E-02    3.11       1.7  T
   4    -38.1421883 -0.206704E-05  0.493E-03    3.11       3.9  T
   5    -38.1421885 -0.172056E-06  0.142E-03    3.11      13.5  T
   6    -38.1421885 -0.335079E-07  0.441E-04    3.11      43.7  T
     SCC iter.                  ...        0 min,  0.008 sec
     gradient                   ...        0 min,  0.015 sec
 * total energy  :   -37.6001020 Eh     change       -0.7461941E-04 Eh
   gradient norm :     0.0028118 Eh/α   predicted    -0.6554702E-04 ( -12.16%)
   displ. norm   :     0.1002328 α      lambda       -0.7138793E-04
   maximum displ.:     0.0634795 α      in ANC's #1, #2, #5, ...

........................................................................
.............................. CYCLE    7 ..............................
........................................................................
   1    -38.1430617 -0.381431E+02  0.558E-02    3.11       0.0  T
   2    -38.1430627 -0.103224E-05  0.302E-02    3.11       1.0  T
   3    -38.1430611  0.167815E-05  0.103E-02    3.11       1.9  T
   4    -38.1430632 -0.215551E-05  0.338E-03    3.11       5.7  T
   5    -38.1430633 -0.551732E-07  0.863E-04    3.11      22.3  T
   6    -38.1430633 -0.842743E-08  0.340E-04    3.11      56.5  T
     SCC iter.                  ...        0 min,  0.008 sec
     gradient                   ...        0 min,  0.016 sec
 * total energy  :   -37.6001560 Eh     change       -0.5395268E-04 Eh
   gradient norm :     0.0021305 Eh/α   predicted    -0.3605305E-04 ( -33.18%)
   displ. norm   :     0.1187779 α      lambda       -0.5845659E-04
   maximum displ.:     0.0755747 α      in ANC's #1, #2, #4, ...

........................................................................
.............................. CYCLE    8 ..............................
........................................................................
   1    -38.1435604 -0.381436E+02  0.630E-02    3.11       0.0  T
   2    -38.1435616 -0.125677E-05  0.346E-02    3.11       1.0  T
   3    -38.1435607  0.919664E-06  0.898E-03    3.11       2.1  T
   4    -38.1435620 -0.127767E-05  0.380E-03    3.11       5.1  T
   5    -38.1435621 -0.117975E-06  0.819E-04    3.11      23.5  T
   6    -38.1435621 -0.390779E-08  0.326E-04    3.11      59.1  T
     SCC iter.                  ...        0 min,  0.008 sec
     gradient                   ...        0 min,  0.016 sec
 * total energy  :   -37.6001986 Eh     change       -0.4264905E-04 Eh
   gradient norm :     0.0014241 Eh/α   predicted    -0.2965372E-04 ( -30.47%)
   displ. norm   :     0.1489958 α      lambda       -0.3116067E-04
   maximum displ.:     0.0962549 α      in ANC's #1, #2, #4, ...

........................................................................
.............................. CYCLE    9 ..............................
........................................................................
   1    -38.1434961 -0.381435E+02  0.726E-02    3.11       0.0  T
   2    -38.1434976 -0.144637E-05  0.405E-02    3.11       1.0  T
   3    -38.1434973  0.276587E-06  0.744E-03    3.11       2.6  T
   4    -38.1434979 -0.579304E-06  0.409E-03    3.11       4.7  T
   5    -38.1434980 -0.173085E-06  0.100E-03    3.11      19.2  T
   6    -38.1434980 -0.122066E-07  0.423E-04    3.11      45.5  T
   7    -38.1434981 -0.160863E-08  0.222E-04    3.11      86.5  T
     SCC iter.                  ...        0 min,  0.009 sec
     gradient                   ...        0 min,  0.016 sec
 * total energy  :   -37.6002272 Eh     change       -0.2861318E-04 Eh
   gradient norm :     0.0016039 Eh/α   predicted    -0.1573533E-04 ( -45.01%)
   displ. norm   :     0.0627031 α      lambda       -0.1050891E-04
   maximum displ.:     0.0393201 α      in ANC's #1, #4, #2, ...

........................................................................
.............................. CYCLE   10 ..............................
........................................................................
   1    -38.1433708 -0.381434E+02  0.291E-02    3.10       0.0  T
   2    -38.1433711 -0.222947E-06  0.165E-02    3.10       1.2  T
   3    -38.1433707  0.368264E-06  0.446E-03    3.10       4.3  T
   4    -38.1433712 -0.462422E-06  0.147E-03    3.10      13.1  T
   5    -38.1433712 -0.104615E-07  0.522E-04    3.10      36.9  T
   6    -38.1433712 -0.375413E-08  0.247E-04    3.10      77.8  T
     SCC iter.                  ...        0 min,  0.008 sec
     gradient                   ...        0 min,  0.016 sec
 * total energy  :   -37.6002366 Eh     change       -0.9389794E-05 Eh
   gradient norm :     0.0009357 Eh/α   predicted    -0.5266302E-05 ( -43.91%)
   displ. norm   :     0.0624860 α      lambda        0.5041617E-05
   maximum displ.:     0.0389711 α      in ANC's #1, #4, #2, ...

........................................................................
.............................. CYCLE   11 ..............................
........................................................................
   1    -38.1431692 -0.381432E+02  0.290E-02    3.10       0.0  T
   2    -38.1431694 -0.221147E-06  0.164E-02    3.10       1.2  T
   3    -38.1431690  0.394661E-06  0.460E-03    3.10       4.2  T
   4    -38.1431695 -0.491249E-06  0.146E-03    3.10      13.1  T
   5    -38.1431695 -0.100099E-07  0.529E-04    3.10      36.4  T
   6    -38.1431695 -0.390466E-08  0.246E-04    3.10      78.2  T
     SCC iter.                  ...        0 min,  0.008 sec
     gradient                   ...        0 min,  0.016 sec
 * total energy  :   -37.6002332 Eh     change        0.3450789E-05 Eh
   gradient norm :     0.0015491 Eh/α   predicted     0.2524912E-05 ( -26.83%)
   displ. norm   :     0.0618076 α      lambda        0.2171270E-04
   maximum displ.:     0.0378581 α      in ANC's #1, #4, #2, ...

........................................................................
.............................. CYCLE   12 ..............................
........................................................................
   1    -38.1428960 -0.381429E+02  0.288E-02    3.10       0.0  T
   2    -38.1428963 -0.216097E-06  0.163E-02    3.10       1.2  T
   3    -38.1428958  0.421433E-06  0.471E-03    3.10       4.1  T
   4    -38.1428963 -0.520942E-06  0.144E-03    3.10      13.4  T
   5    -38.1428964 -0.880283E-08  0.528E-04    3.10      36.5  T
   6    -38.1428964 -0.390772E-08  0.243E-04    3.10      79.1  T
     SCC iter.                  ...        0 min,  0.008 sec
     gradient                   ...        0 min,  0.016 sec
 * total energy  :   -37.6002169 Eh     change        0.1627048E-04 Eh
   gradient norm :     0.0026753 Eh/α   predicted     0.1087200E-04 ( -33.18%)
   displ. norm   :     0.0410984 α      lambda        0.3878403E-04
   maximum displ.:     0.0250600 α      in ANC's #1, #4, #2, ...

........................................................................
.............................. CYCLE   13 ..............................
........................................................................
   1    -38.1426730 -0.381427E+02  0.192E-02    3.09       0.0  T
   2    -38.1426731 -0.956011E-07  0.109E-02    3.09       1.8  T
   3    -38.1426729  0.199240E-06  0.323E-03    3.09       6.0  T
   4    -38.1426731 -0.245029E-06  0.955E-04    3.09      20.2  T
   5    -38.1426731 -0.359355E-08  0.354E-04    3.09      54.4  T
     SCC iter.                  ...        0 min,  0.007 sec
     gradient                   ...        0 min,  0.016 sec
 * total energy  :   -37.6001989 Eh     change        0.1803859E-04 Eh
   gradient norm :     0.0034877 Eh/α   predicted     0.1942461E-04 (   7.68%)
   displ. norm   :     0.0416080 α      lambda        0.4756287E-04
   maximum displ.:     0.0259107 α      in ANC's #1, #4, #2, ...

........................................................................
.............................. CYCLE   14 ..............................
........................................................................
   1    -38.1424132 -0.381424E+02  0.193E-02    3.09       0.0  T
   2    -38.1424133 -0.986452E-07  0.110E-02    3.09       1.8  T
   3    -38.1424131  0.212977E-06  0.333E-03    3.09       5.8  T
   4    -38.1424133 -0.262328E-06  0.956E-04    3.09      20.1  T
   5    -38.1424133 -0.298595E-08  0.359E-04    3.09      53.5  T
     SCC iter.                  ...        0 min,  0.007 sec
     gradient                   ...        0 min,  0.016 sec
 * total energy  :   -37.6001750 Eh     change        0.2381485E-04 Eh
   gradient norm :     0.0043151 Eh/α   predicted     0.2381889E-04 (   0.02%)
   displ. norm   :     0.0421874 α      lambda        0.5928645E-04
   maximum displ.:     0.0268602 α      in ANC's #1, #4, #2, ...

........................................................................
.............................. CYCLE   15 ..............................
........................................................................
   1    -38.1421162 -0.381421E+02  0.195E-02    3.09       0.0  T
   2    -38.1421163 -0.100847E-06  0.110E-02    3.09       1.7  T
   3    -38.1421160  0.225352E-06  0.342E-03    3.09       5.6  T
   4    -38.1421163 -0.276876E-06  0.968E-04    3.09      19.9  T
   5    -38.1421163 -0.288981E-08  0.365E-04    3.09      52.7  T
     SCC iter.                  ...        0 min,  0.007 sec
     gradient                   ...        0 min,  0.015 sec
 * total energy  :   -37.6001453 Eh     change        0.2970364E-04 Eh
   gradient norm :     0.0051522 Eh/α   predicted     0.2969132E-04 (  -0.04%)
   displ. norm   :     0.1919814 α      lambda       -0.1755225E-03
   maximum displ.:     0.1204016 α      in ANC's #1, #4, #2, ...

........................................................................
.............................. CYCLE   16 ..............................
........................................................................
   1    -38.1429918 -0.381430E+02  0.920E-02    3.10       0.0  T
   2    -38.1429941 -0.225794E-05  0.516E-02    3.10       1.0  T
   3    -38.1429897  0.442346E-05  0.157E-02    3.10       1.2  T
   4    -38.1429951 -0.547768E-05  0.501E-03    3.10       3.8  T
   5    -38.1429952 -0.936472E-07  0.168E-03    3.10      11.5  T
   6    -38.1429953 -0.462757E-07  0.750E-04    3.10      25.7  T
     SCC iter.                  ...        0 min,  0.008 sec
     gradient                   ...        0 min,  0.015 sec
 * total energy  :   -37.6002380 Eh     change       -0.9262086E-04 Eh
   gradient norm :     0.0008542 Eh/α   predicted    -0.9099885E-04 (  -1.75%)
   displ. norm   :     0.0407494 α      lambda       -0.2732590E-05
   maximum displ.:     0.0222364 α      in ANC's #1, #2, #4, ...

........................................................................
.............................. CYCLE   17 ..............................
........................................................................
   1    -38.1436024 -0.381436E+02  0.206E-02    3.10       0.0  T
   2    -38.1436026 -0.103281E-06  0.116E-02    3.10       1.7  T
   3    -38.1436025  0.836666E-07  0.260E-03    3.10       7.4  T
   4    -38.1436026 -0.116611E-06  0.100E-03    3.10      19.2  T
   5    -38.1436026 -0.704772E-08  0.265E-04    3.10      72.7  T
   6    -38.1436026 -0.677950E-09  0.107E-04    3.10     179.9  T
     SCC iter.                  ...        0 min,  0.008 sec
     gradient                   ...        0 min,  0.016 sec
 * total energy  :   -37.6002390 Eh     change       -0.1017077E-05 Eh
   gradient norm :     0.0005428 Eh/α   predicted    -0.1371479E-05 (  34.85%)
   displ. norm   :     0.0078975 α      lambda       -0.7999575E-06
   maximum displ.:     0.0044571 α      in ANC's #2, #3, #8, ...

   *** GEOMETRY OPTIMIZATION CONVERGED AFTER 17 ITERATIONS ***

------------------------------------------------------------------------
 total energy gain   :        -0.0069779 Eh       -4.3787 kcal/mol
 total RMSD          :         0.2531017 a0        0.1339 Å
 total power (kW/mol):        -1.0776756 (step)  -31.4556 (real)
------------------------------------------------------------------------

 ANCopt (total)                0 d,  0 h,  0 min,  0.582 sec
 optimizer setup                ...        0 min,  0.000 sec (  0.027%)
 model hessian                  ...        0 min,  0.014 sec (  2.344%)
 ANC generation                 ...        0 min,  0.001 sec (  0.138%)
 coordinate transformation      ...        0 min,  0.000 sec (  0.058%)
 single point calculation       ...        0 min,  0.562 sec ( 96.492%)
 optimization log               ...        0 min,  0.002 sec (  0.326%)
 hessian update                 ...        0 min,  0.000 sec (  0.042%)
 rational function              ...        0 min,  0.002 sec (  0.368%)

================
 final structure:
================
$coord
    2.82190947810524   -2.44824797501903   -0.10358706599542      C 
    5.16675810193888   -0.21958410162408   -0.19458310453958      S 
    2.97005145934382    2.22619421527762   -0.01475836604663      C 
    0.55028348823566    1.28683573715551    0.07151813966305      C 
    0.47991524960515   -1.39634138307572    0.02966147705955      C 
   -1.90773646246510   -2.93668228098516   -0.01381128365811      C 
   -2.05856182874279   -4.20761122588138   -2.45463068711610      N 
   -4.20162002684868   -1.25864163003730    0.60662354083037      C 
   -4.05915887212483    1.24972220667856   -0.80478937278237      C 
   -1.81825601229598    2.85050247199622    0.13291448911464      C 
   -2.17642450677638    3.88959989734461    2.66453789311430      N 
    3.91096646654622    4.78516868122335   -0.03415964277448      C 
    2.72270105049546    6.79077889246943    0.90159986789128      C 
    3.28739399901392   -4.41674783103934   -0.17459377892094      H 
   -1.77301380363319   -4.44561330881372    1.40581776646932      H 
   -2.07961066543903   -2.92301819805827   -3.87724082383732      H 
   -3.66416829631073   -5.24859946127332   -2.56896343414888      H 
   -4.26037821820155   -0.91205867234104    2.64160834491993      H 
   -5.93417734021810   -2.26552969462032    0.10097792891055      H 
   -5.81033133666188    2.31539135001673   -0.54142684872824      H 
   -3.83734705498773    0.90488897098079   -2.82880605494952      H 
   -1.58493755743556    4.48104893676925   -1.13291897875298      H 
   -2.14619476276867    2.49091766916855    3.97397397311434      H 
   -3.86961309534722    4.78239555801615    2.78051631259270      H 
    5.77443265266646    4.98900748685208   -0.85686842216810      H 
    0.92922637476813    6.62526135799112    1.84153190808826      H 
    3.55949724348828    8.64260039479239    0.79324868059551      H 
$end
           -------------------------------------------------
          |                Final Singlepoint                |
           -------------------------------------------------

          ...................................................
          :                      SETUP                      :
          :.................................................:
          :  # basis functions                  72          :
          :  # atomic orbitals                  71          :
          :  # shells                           41          :
          :  # electrons                        70          :
          :  max. iterations                   250          :
          :  Hamiltonian                  GFN2-xTB          :
          :  restarted?                      false          :
          :  GBSA solvation                  false          :
          :  PC potential                    false          :
          :  electronic temp.          300.0000000     K    :
          :  accuracy                    1.0000000          :
          :  -> integral cutoff          0.2500000E+02      :
          :  -> integral neglect         0.1000000E-07      :
          :  -> SCF convergence          0.1000000E-05 Eh   :
          :  -> wf. convergence          0.1000000E-03 e    :
          :  Broyden damping             0.4000000          :
          ...................................................

 iter      E             dE          RMSdq      gap      omega  full diag
   1    -38.1436026 -0.381436E+02  0.559E-05    3.10       0.0  T
   2    -38.1436026 -0.155751E-10  0.316E-05    3.10     608.1  T
   3    -38.1436026 -0.281872E-10  0.177E-05    3.10    1084.9  T

   *** convergence criteria satisfied after 3 iterations ***

         #    Occupation            Energy/Eh            Energy/eV
      -------------------------------------------------------------
         1        2.0000           -0.7213859             -19.6299
       ...           ...                  ...                  ...
        29        2.0000           -0.4308899             -11.7251
        30        2.0000           -0.4190545             -11.4031
        31        2.0000           -0.4164119             -11.3311
        32        2.0000           -0.3851994             -10.4818
        33        2.0000           -0.3731992             -10.1553
        34        2.0000           -0.3706773             -10.0866
        35        2.0000           -0.3663657              -9.9693 (HOMO)
        36                         -0.2523345              -6.8664 (LUMO)
        37                         -0.1974150              -5.3719
        38                         -0.1888847              -5.1398
        39                         -0.1469615              -3.9990
        40                         -0.1056311              -2.8744
       ...                                ...                  ...
        71                          0.6843930              18.6233
      -------------------------------------------------------------
                  HL-Gap            0.1140312 Eh            3.1029 eV
             Fermi-level           -0.3093501 Eh           -8.4178 eV

 SCC (total)                   0 d,  0 h,  0 min,  0.030 sec
 SCC setup                      ...        0 min,  0.000 sec (  0.673%)
 Dispersion                     ...        0 min,  0.000 sec (  0.703%)
 integral evaluation            ...        0 min,  0.009 sec ( 29.850%)
 zeroth order Hamiltonian       ...        0 min,  0.000 sec (  0.597%)
 iterations                     ...        0 min,  0.005 sec ( 14.771%)
 molecular gradient             ...        0 min,  0.016 sec ( 52.028%)
 printout                       ...        0 min,  0.000 sec (  1.181%)

         :::::::::::::::::::::::::::::::::::::::::::::::::::::
         ::                     SUMMARY                     ::
         :::::::::::::::::::::::::::::::::::::::::::::::::::::
         :: total energy             -37.600238971383 Eh    ::
         :: gradient norm              0.000543045694 Eh/a0 ::
         :: HOMO-LUMO gap              3.102946693204 eV    ::
         ::.................................................::
         :: SCC energy               -38.143602593850 Eh    ::
         :: -> isotropic ES            0.023710646628 Eh    ::
         :: -> anisotropic ES          0.006030176708 Eh    ::
         :: -> anisotropic XC          0.025158377105 Eh    ::
         :: -> dispersion             -0.028690794679 Eh    ::
         :: repulsion energy           0.543051962358 Eh    ::
         :: add. restraining           0.000000000000 Eh    ::
         :::::::::::::::::::::::::::::::::::::::::::::::::::::

           -------------------------------------------------
          |                Property Printout                |
           -------------------------------------------------

    * Orbital Energies and Occupations

         #    Occupation            Energy/Eh            Energy/eV
      -------------------------------------------------------------
         1        2.0000           -0.7213859             -19.6299
       ...           ...                  ...                  ...
        23        2.0000           -0.4706288             -12.8065
        24        2.0000           -0.4596501             -12.5077
        25        2.0000           -0.4574514             -12.4479
        26        2.0000           -0.4504102             -12.2563
        27        2.0000           -0.4427932             -12.0490
        28        2.0000           -0.4389706             -11.9450
        29        2.0000           -0.4308899             -11.7251
        30        2.0000           -0.4190545             -11.4031
        31        2.0000           -0.4164119             -11.3311
        32        2.0000           -0.3851994             -10.4818
        33        2.0000           -0.3731992             -10.1553
        34        2.0000           -0.3706773             -10.0866
        35        2.0000           -0.3663657              -9.9693 (HOMO)
        36                         -0.2523345              -6.8664 (LUMO)
        37                         -0.1974150              -5.3719
        38                         -0.1888847              -5.1398
        39                         -0.1469615              -3.9990
        40                         -0.1056311              -2.8744
        41                          0.0050998               0.1388
        42                          0.0348214               0.9475
        43                          0.0407145               1.1079
        44                          0.0551072               1.4995
        45                          0.0598314               1.6281
        46                          0.0716710               1.9503
       ...                                ...                  ...
        71                          0.6843930              18.6233
      -------------------------------------------------------------
                  HL-Gap            0.1140312 Eh            3.1029 eV
             Fermi-level           -0.3093501 Eh           -8.4178 eV

     #   Z        covCN         q      C6AA      α(0)
     1   6 C      2.937    -0.027    28.671     8.782
     2  16 S      2.339    -0.043   142.835    20.115
     3   6 C      2.988     0.019    27.583     8.615
     4   6 C      3.160    -0.023    28.259     8.690
     5   6 C      3.170    -0.016    28.038     8.650
     6   6 C      3.787     0.056    19.650     6.314
     7   7 N      2.634    -0.345    28.886     7.982
     8   6 C      3.805    -0.060    21.646     6.623
     9   6 C      3.806    -0.060    21.647     6.623
    10   6 C      3.786     0.057    19.632     6.311
    11   7 N      2.632    -0.343    28.824     7.974
    12   6 C      2.933    -0.031    28.778     8.798
    13   6 C      2.839    -0.097    30.420     9.039
    14   1 H      0.926     0.049     2.329     2.386
    15   1 H      0.923     0.030     2.587     2.515
    16   1 H      0.860     0.139     1.481     1.907
    17   1 H      0.860     0.137     1.495     1.915
    18   1 H      0.924     0.027     2.635     2.539
    19   1 H      0.924     0.023     2.685     2.562
    20   1 H      0.924     0.023     2.687     2.563
    21   1 H      0.924     0.027     2.631     2.537
    22   1 H      0.923     0.034     2.534     2.489
    23   1 H      0.860     0.140     1.474     1.902
    24   1 H      0.860     0.136     1.497     1.917
    25   1 H      0.925     0.040     2.455     2.450
    26   1 H      0.926     0.070     2.088     2.259
    27   1 H      0.926     0.039     2.461     2.453

 Mol. C6AA /au·bohr⁶  :       8743.404394
 Mol. C8AA /au·bohr⁸  :     226156.770939
 Mol. α(0) /au        :        146.911957


Wiberg/Mayer (AO) data.
largest (>0.10) Wiberg bond orders for each atom
          total WBO             WBO to atom ...
     1  C   3.948        C    5 1.584    S    2 1.197    H   14 0.969    C    3 0.104
     2  S   2.613        C    1 1.197    C    3 1.134
     3  C   3.948        C    4 1.509    S    2 1.134    C   12 1.122    C    1 0.104
     4  C   3.982        C    3 1.509    C    5 1.248    C   10 0.993
     5  C   3.984        C    1 1.584    C    4 1.248    C    6 0.989
     6  C   3.985        N    7 1.008    C    5 0.989    C    8 0.980    H   15 0.959
     7  N   3.010        C    6 1.008    H   17 0.965    H   16 0.964
     8  C   3.998        C    9 1.011    C    6 0.980    H   19 0.975    H   18 0.973
     9  C   3.998        C    8 1.011    C   10 0.980    H   20 0.975    H   21 0.974
    10  C   3.985        N   11 1.004    C    4 0.993    C    9 0.980    H   22 0.955
    11  N   3.023        C   10 1.004    H   24 0.965    H   23 0.963
    12  C   3.991        C   13 1.875    C    3 1.122    H   25 0.962
    13  C   3.988        C   12 1.875    H   27 0.978    H   26 0.964
    14  H   0.997        C    1 0.969
    15  H   0.999        C    6 0.959
    16  H   0.981        N    7 0.964
    17  H   0.980        N    7 0.965
    18  H   0.999        C    8 0.973
    19  H   0.998        C    8 0.975
    20  H   0.998        C    9 0.975
    21  H   0.999        C    9 0.974
    22  H   0.999        C   10 0.955
    23  H   0.981        N   11 0.963
    24  H   0.980        N   11 0.965
    25  H   0.998        C   12 0.962
    26  H   0.995        C   13 0.964
    27  H   0.998        C   13 0.978

molecular dipole:
                 x           y           z       tot (Debye)
 q only:       -0.527       0.099       0.026
   full:       -1.432       0.000      -0.001       3.640
molecular quadrupole (traceless):
                xx          xy          yy          xz          yz          zz
 q only:        0.563       0.244      -0.144      -0.311      -0.764      -0.419
  q+dip:        3.242       0.540      -2.016      -1.082      -3.141      -1.226
   full:        2.224       0.592      -2.711      -0.441      -3.129       0.487

           -------------------------------------------------
          |                Geometry Summary                 |
           -------------------------------------------------

      molecular mass/u    :      194.2940000
   center of mass at/Å    :        0.2788808       0.3746532       0.0205194
  moments of inertia/u·Å² :        0.5139058E+03   0.7326459E+03   0.1145512E+04
rotational constants/cm⁻¹ :        0.3280296E-01   0.2300925E-01   0.1471624E-01

 * 25 selected distances

     #   Z        #   Z                                     value/Å
     1   6 C      2  16 S                                 1.7125682
     2  16 S      3   6 C                                 1.7422464 (max)
     3   6 C      4   6 C                                 1.3743453
     1   6 C      5   6 C                                 1.3604281
     4   6 C      5   6 C                                 1.4205372
     6   6 C      7   7 N                                 1.4584194
     6   6 C      8   6 C                                 1.5394113
     8   6 C      9   6 C                                 1.5249371
     9   6 C     10   6 C                                 1.5394813
    10   6 C     11   7 N                                 1.4604837
    12   6 C     13   6 C                                 1.3292879
     1   6 C     14   1 H                                 1.0710722
     6   6 C     15   1 H                                 1.0986477
     7   7 N     16   1 H                                 1.0143711
     7   7 N     17   1 H                                 1.0144068
     8   6 C     18   1 H                                 1.0928164
     8   6 C     19   1 H                                 1.0936515
     9   6 C     20   1 H                                 1.0936976
     9   6 C     21   1 H                                 1.0928188
    10   6 C     22   1 H                                 1.0992954
    11   7 N     23   1 H                                 1.0140131 (min)
    11   7 N     24   1 H                                 1.0147825
    12   6 C     25   1 H                                 1.0833160
    13   6 C     26   1 H                                 1.0750793
    13   6 C     27   1 H                                 1.0768739

 * 5 distinct bonds (by element types)

   Z      Z             #   av. dist./Å        max./Å        min./Å
   1 H    6 C          10     1.0877269     1.0992954     1.0710722
   6 C    6 C           7     1.4412040     1.5394813     1.3292879
   1 H    7 N           4     1.0143934     1.0147825     1.0140131
   6 C    7 N           2     1.4594516     1.4604837     1.4584194
   6 C   16 S           2     1.7274073     1.7422464     1.7125682


optimized geometry written to: xtbopt.xyz


           -------------------------------------------------
          | TOTAL ENERGY              -37.600238971383 Eh   |
          | GRADIENT NORM               0.000543045694 Eh/α |
          | HOMO-LUMO GAP               3.102946693204 eV   |
           -------------------------------------------------

------------------------------------------------------------------------
 * finished run on 2021/05/19 at 10:59:29.199     
------------------------------------------------------------------------
 total:
 * wall-time:     0 d,  0 h,  0 min,  0.680 sec
 *  cpu-time:     0 d,  0 h,  0 min,  0.677 sec
 * ratio c/w:     0.995 speedup
 SCF:
 * wall-time:     0 d,  0 h,  0 min,  0.044 sec
 *  cpu-time:     0 d,  0 h,  0 min,  0.044 sec
 * ratio c/w:     0.998 speedup
 ANC optimizer:
 * wall-time:     0 d,  0 h,  0 min,  0.614 sec
 *  cpu-time:     0 d,  0 h,  0 min,  0.612 sec
 * ratio c/w:     0.997 speedup

