      -----------------------------------------------------------      
     |                   =====================                   |     
     |                           x T B                           |     
     |                   =====================                   |     
     |                         S. Grimme                         |     
     |          Mulliken Center for Theoretical Chemistry        |     
     |                    University of Bonn                     |     
     |                Version 6.2 RC2 (SAW190805)                |     
      -----------------------------------------------------------      

   This program is distributed in the hope that it will be useful,
   but WITHOUT ANY WARRANTY; without even the implied warranty of
   MERCHANTABILITY or FITNESS FOR A PARTICULAR PURPOSE.
   
   FOR NON-COMMERCIAL, ACADEMIA USE ONLY.
   
   Cite this work as:
   * S. Grimme, C. Bannwarth, P. Shushkov, J. Chem. Theory Comput., 2017,
     13, 1989-2009. DOI: 10.1021/acs.jctc.7b00118
   * C. Bannwarth, S. Ehlert and S. Grimme., J. Chem. Theory Comput., 2019,
     15, 1652-1671. DOI: 10.1021/acs.jctc.8b01176
   * P. Pracht, E. Caldeweyher, S. Ehlert, S. Grimme, ChemRxiv, 2019, preprint.
     DOI: 10.26434/chemrxiv.8326202.v1
   
   for DFT-D4:
   * E. Caldeweyher, C. Bannwarth and S. Grimme, J. Chem. Phys., 2017,
     147, 034112. DOI: 10.1063/1.4993215
   * E. Caldeweyher, S. Ehlert, A. Hansen, H. Neugebauer, S. Spicher,
     C. Bannwarth and S. Grimme, J. Chem. Phys., 2019, 150, 154122.
     DOI: 10.1063/1.5090222
   
   for sTDA-xTB:
   * S. Grimme and C. Bannwarth, J. Chem. Phys., 2016, 145, 054103.
     DOI: 10.1063/1.4959605
   
   in the mass-spec context:
   * V. Asgeirsson, C. Bauer and S. Grimme, Chem. Sci., 2017, 8, 4879.
     DOI: 10.1039/c7sc00601b
   
   for metadynamics refer to:
   * S. Grimme, J. Chem. Theory Comput., 2019, 155, 2847-2862
     DOI: 10.1021/acs.jctc.9b00143
   
   with help from (in alphabetical order)
   C. Bannwarth, F. Bohle, G. Brandenburg, E. Caldeweyher, M. Checinski,
   S. Dohm, S. Ehlert, S. Ehrlich, F. März, H. Neugebauer, J. Pisarek,
   P. Pracht, P. Shushkov, and S. Spicher.
   
 * started run on 2021/05/19 at 10:59:30.577     

           -------------------------------------------------
          |                Calculation Setup                |
           -------------------------------------------------

          program call               : /ihome/ghutchison/geoffh/xtb/xtb 535.xyz -opt
          hostname                   : smp-n144
          coordinate file            : 535.xyz
          omp threads                :                     1
          number of atoms            :                    21
          number of electrons        :                    56
          charge                     :                     0
          spin                       :                   0.0
          first test random number   :      0.03644019137016


########################################################################
# WARNING! Please study the warnings concerning your input carefully
#  - the use of '-opt' is discouraged, please use '--opt' next time
########################################################################

           ------------------------------------------------- 
          |                 G F N 2 - x T B                 |
          | Geometry, Frequencies, Noncovalent interactions |
          |            JCTC 2019 parametrisation            |
           ------------------------------------------------- 
             KAB for C  - Si     :                1.0500
             KAB for H  - Pd     :                0.9500
             k(s)              :                1.8500
             k(p)              :                2.2300
             k(d)              :                2.2300
             k(f)              :                2.0000
             kEN (H0ij)        :               -2.0000
             D4 a1             :                0.5200
             D4 a2             :                5.0000
             D4 s6             :                1.0000
             D4 s8             :                2.7000
             D4 s9             :                5.0000
             alphaj            :                2.0000

  Z AO/shell   Hii/eV     exponent
  1     Wed Apr 25 08:07:45 CEST 2018   EN: 2.200 GM2: 0.406  GM3: 0.0800  RAES: 1.40
     1s    -10.707211    1.230000
  6     Wed Apr 25 08:07:45 CEST 2018   EN: 2.550 GM2: 0.538  GM3: 0.1500  RAES: 3.00
     2s    -13.970922    2.096432
     2p    -10.063292    1.800000
 16     Tue Apr 24 11:44:34 CEST 2018   EN: 2.580 GM2: 0.340  GM3:-0.0502  RAES: 3.10
     3s    -20.029654    1.981333
     3p    -11.377694    2.025643
     3d     -0.420282    1.702555

           ------------------------------------------------- 
          |        Self-Consistent Charge Iterations        |
           ------------------------------------------------- 

          ...................................................
          :                      SETUP                      :
          :.................................................:
          :  # basis functions                  60          :
          :  # atomic orbitals                  59          :
          :  # shells                           33          :
          :  # electrons                        56          :
          :  max. iterations                   250          :
          :  Hamiltonian                  GFN2-xTB          :
          :  restarted?                      false          :
          :  GBSA solvation                  false          :
          :  PC potential                    false          :
          :  electronic temp.          300.0000000     K    :
          :  accuracy                    1.0000000          :
          :  -> integral cutoff          0.2500000E+02      :
          :  -> integral neglect         0.1000000E-07      :
          :  -> SCF convergence          0.1000000E-05 Eh   :
          :  -> wf. convergence          0.1000000E-03 e    :
          :  Broyden damping             0.4000000          :
          ...................................................

 iter      E             dE          RMSdq      gap      omega  full diag
   1    -30.1525125 -0.301525E+02  0.422E+00    3.52       0.0  T
   2    -30.1702838 -0.177713E-01  0.244E+00    3.37       1.0  T
   3    -30.1671047  0.317905E-02  0.726E-01    3.38       1.0  T
   4    -30.1703893 -0.328460E-02  0.365E-01    3.41       1.0  T
   5    -30.1721978 -0.180845E-02  0.911E-02    3.43       1.0  T
   6    -30.1722452 -0.473591E-04  0.333E-02    3.42       1.0  T
   7    -30.1722451  0.291987E-07  0.176E-02    3.42       1.2  T
   8    -30.1722482 -0.311207E-05  0.870E-03    3.42       2.5  T
   9    -30.1722485 -0.269357E-06  0.343E-03    3.42       6.4  T
  10    -30.1722486 -0.114841E-06  0.153E-03    3.42      14.3  T
  11    -30.1722486 -0.196456E-07  0.609E-04    3.42      35.8  T
  12    -30.1722486 -0.247690E-08  0.265E-04    3.42      82.2  T

   *** convergence criteria satisfied after 12 iterations ***

         #    Occupation            Energy/Eh            Energy/eV
      -------------------------------------------------------------
         1        2.0000           -0.7244829             -19.7142
       ...           ...                  ...                  ...
        22        2.0000           -0.4406758             -11.9914
        23        2.0000           -0.4319840             -11.7549
        24        2.0000           -0.4265758             -11.6077
        25        2.0000           -0.4237801             -11.5316
        26        2.0000           -0.3870844             -10.5331
        27        2.0000           -0.3794349             -10.3250
        28        2.0000           -0.3706135             -10.0849 (HOMO)
        29                         -0.2449446              -6.6653 (LUMO)
        30                         -0.2378396              -6.4719
        31                         -0.1932204              -5.2578
        32                         -0.1667986              -4.5388
        33                         -0.1463011              -3.9811
       ...                                ...                  ...
        59                          0.6769573              18.4209
      -------------------------------------------------------------
                  HL-Gap            0.1256689 Eh            3.4196 eV
             Fermi-level           -0.3077790 Eh           -8.3751 eV

 SCC (total)                   0 d,  0 h,  0 min,  0.031 sec
 SCC setup                      ...        0 min,  0.000 sec (  0.876%)
 Dispersion                     ...        0 min,  0.000 sec (  0.909%)
 integral evaluation            ...        0 min,  0.007 sec ( 22.855%)
 zeroth order Hamiltonian       ...        0 min,  0.000 sec (  0.498%)
 iterations                     ...        0 min,  0.012 sec ( 38.368%)
 molecular gradient             ...        0 min,  0.011 sec ( 35.148%)
 printout                       ...        0 min,  0.000 sec (  1.146%)

         :::::::::::::::::::::::::::::::::::::::::::::::::::::
         ::                     SUMMARY                     ::
         :::::::::::::::::::::::::::::::::::::::::::::::::::::
         :: total energy             -29.703199898347 Eh    ::
         :: gradient norm              0.046050691331 Eh/a0 ::
         :: HOMO-LUMO gap              3.419625888279 eV    ::
         ::.................................................::
         :: SCC energy               -30.172248644749 Eh    ::
         :: -> isotropic ES            0.002525262798 Eh    ::
         :: -> anisotropic ES          0.003264816856 Eh    ::
         :: -> anisotropic XC          0.017879813214 Eh    ::
         :: -> dispersion             -0.020108273359 Eh    ::
         :: repulsion energy           0.469016185675 Eh    ::
         :: add. restraining           0.000000000000 Eh    ::
         :::::::::::::::::::::::::::::::::::::::::::::::::::::

      ----------------------------------------------------------- 
     |                   =====================                   |
     |                        A N C O P T                        |
     |                   =====================                   |
     |               Approximate Normal Coordinate               |
     |                Rational Function Optimizer                |
      ----------------------------------------------------------- 

          ...................................................
          :                      SETUP                      :
          :.................................................:
          :   optimization level            normal          :
          :   max. optcycles                   200          :
          :   ANC micro-cycles                  20          :
          :   degrees of freedom                57          :
          :.................................................:
          :   RF solver                   davidson          :
          :   input Hessian                  false          :
          :   write xtbopt.log                true          :
          :   linear?                        false          :
          :   energy convergence         0.5000000E-05 Eh   :
          :   grad. convergence          0.1000000E-02 Eh/α :
          :   maximium RF displ.         2.0000000          :
          :   Hlow (freq-cutoff)         0.5000000E-02      :
          :   Hmax (freq-cutoff)         5.0000000          :
          :   S6 in model hess.         20.0000000          :
          ...................................................

generating ANC from model Hessian ...
Using Lindh-Hessian (1995)
 Shifting diagonal of input Hessian by   3.015783389949821E-003
 Lowest  eigenvalues of input Hessian
   -0.000000   -0.000000   -0.000000   -0.000000   -0.000000    0.000000
    0.005000    0.006574    0.009105    0.009424    0.012108    0.017820
    0.019116    0.023389    0.030192    0.031921    0.035682    0.042248
 Highest eigenvalues
    1.585807    1.641887    1.715484    1.765898    1.824018    1.964885
 

........................................................................
.............................. CYCLE    1 ..............................
........................................................................
   1    -30.1722486 -0.301722E+02  0.151E-04    3.42       0.0  T
   2    -30.1722486 -0.139373E-10  0.116E-04    3.42     187.7  T
   3    -30.1722486 -0.154618E-09  0.612E-05    3.42     356.9  T
     SCC iter.                  ...        0 min,  0.003 sec
     gradient                   ...        0 min,  0.011 sec
 * total energy  :   -29.7031999 Eh     change       -0.3489126E-07 Eh
   gradient norm :     0.0460508 Eh/α   predicted     0.0000000E+00 (-100.00%)
   displ. norm   :     0.2050424 α      lambda       -0.4135071E-02
   maximum displ.:     0.0878805 α      in ANC's #11, #3, #13, ...

........................................................................
.............................. CYCLE    2 ..............................
........................................................................
   1    -30.2007618 -0.302008E+02  0.154E-01    3.51       0.0  T
   2    -30.2007980 -0.361951E-04  0.764E-02    3.51       1.0  T
   3    -30.2007885  0.947081E-05  0.439E-02    3.51       1.0  T
   4    -30.2008113 -0.228423E-04  0.183E-02    3.51       1.2  T
   5    -30.2008143 -0.295430E-05  0.831E-03    3.51       2.6  T
   6    -30.2008147 -0.362701E-06  0.375E-03    3.51       5.8  T
   7    -30.2008148 -0.143544E-06  0.422E-04    3.51      51.7  T
     SCC iter.                  ...        0 min,  0.007 sec
     gradient                   ...        0 min,  0.010 sec
 * total energy  :   -29.7057496 Eh     change       -0.2549644E-02 Eh
   gradient norm :     0.0141952 Eh/α   predicted    -0.2154475E-02 ( -15.50%)
   displ. norm   :     0.1000196 α      lambda       -0.3995948E-03
   maximum displ.:     0.0619357 α      in ANC's #3, #2, #11, ...

........................................................................
.............................. CYCLE    3 ..............................
........................................................................
   1    -30.2075422 -0.302075E+02  0.795E-02    3.53       0.0  T
   2    -30.2075504 -0.820286E-05  0.399E-02    3.53       1.0  T
   3    -30.2075473  0.306284E-05  0.241E-02    3.53       1.0  T
   4    -30.2075545 -0.714596E-05  0.907E-03    3.53       2.4  T
   5    -30.2075550 -0.582133E-06  0.426E-03    3.53       5.1  T
   6    -30.2075552 -0.127952E-06  0.180E-03    3.53      12.2  T
   7    -30.2075552 -0.306757E-07  0.285E-04    3.53      76.7  T
     SCC iter.                  ...        0 min,  0.006 sec
     gradient                   ...        0 min,  0.010 sec
 * total energy  :   -29.7059775 Eh     change       -0.2279410E-03 Eh
   gradient norm :     0.0047087 Eh/α   predicted    -0.2017987E-03 ( -11.47%)
   displ. norm   :     0.0771272 α      lambda       -0.8244540E-04
   maximum displ.:     0.0451999 α      in ANC's #2, #1, #3, ...

........................................................................
.............................. CYCLE    4 ..............................
........................................................................
   1    -30.2075801 -0.302076E+02  0.510E-02    3.53       0.0  T
   2    -30.2075816 -0.151560E-05  0.280E-02    3.53       1.0  T
   3    -30.2075791  0.247972E-05  0.153E-02    3.53       1.4  T
   4    -30.2075824 -0.327542E-05  0.457E-03    3.53       4.8  T
   5    -30.2075826 -0.157956E-06  0.213E-03    3.53      10.3  T
   6    -30.2075826 -0.393493E-07  0.831E-04    3.53      26.3  T
     SCC iter.                  ...        0 min,  0.006 sec
     gradient                   ...        0 min,  0.010 sec
 * total energy  :   -29.7060243 Eh     change       -0.4680758E-04 Eh
   gradient norm :     0.0024065 Eh/α   predicted    -0.4147917E-04 ( -11.38%)
   displ. norm   :     0.0811121 α      lambda       -0.5938322E-04
   maximum displ.:     0.0491974 α      in ANC's #2, #1, #3, ...

........................................................................
.............................. CYCLE    5 ..............................
........................................................................
   1    -30.2062670 -0.302063E+02  0.570E-02    3.53       0.0  T
   2    -30.2062680 -0.103878E-05  0.319E-02    3.53       1.0  T
   3    -30.2062657  0.228027E-05  0.130E-02    3.53       1.7  T
   4    -30.2062684 -0.270361E-05  0.387E-03    3.53       5.6  T
   5    -30.2062685 -0.107900E-06  0.165E-03    3.53      13.2  T
   6    -30.2062685 -0.168627E-07  0.834E-04    3.53      26.2  T
   7    -30.2062685 -0.970311E-08  0.144E-04    3.53     152.1  T
     SCC iter.                  ...        0 min,  0.006 sec
     gradient                   ...        0 min,  0.010 sec
 * total energy  :   -29.7060595 Eh     change       -0.3514386E-04 Eh
   gradient norm :     0.0019811 Eh/α   predicted    -0.2988942E-04 ( -14.95%)
   displ. norm   :     0.0795396 α      lambda       -0.2056227E-04
   maximum displ.:     0.0580067 α      in ANC's #1, #2, #4, ...

........................................................................
.............................. CYCLE    6 ..............................
........................................................................
   1    -30.2052710 -0.302053E+02  0.525E-02    3.52       0.0  T
   2    -30.2052712 -0.266670E-06  0.295E-02    3.52       1.0  T
   3    -30.2052713 -0.546912E-07  0.356E-03    3.52       6.1  T
   4    -30.2052713  0.370947E-07  0.197E-03    3.52      11.1  T
   5    -30.2052713 -0.566439E-07  0.268E-04    3.52      81.5  T
   6    -30.2052713 -0.122572E-08  0.724E-05    3.52     301.5  T
     SCC iter.                  ...        0 min,  0.006 sec
     gradient                   ...        0 min,  0.011 sec
 * total energy  :   -29.7060817 Eh     change       -0.2224998E-04 Eh
   gradient norm :     0.0019457 Eh/α   predicted    -0.1031048E-04 ( -53.66%)
   displ. norm   :     0.0743084 α      lambda       -0.1692581E-04
   maximum displ.:     0.0554046 α      in ANC's #1, #2, #4, ...

........................................................................
.............................. CYCLE    7 ..............................
........................................................................
   1    -30.2057627 -0.302058E+02  0.522E-02    3.52       0.0  T
   2    -30.2057631 -0.404233E-06  0.287E-02    3.52       1.0  T
   3    -30.2057627  0.443990E-06  0.654E-03    3.53       3.3  T
   4    -30.2057632 -0.520781E-06  0.321E-03    3.52       6.8  T
   5    -30.2057633 -0.726597E-07  0.838E-04    3.52      26.0  T
   6    -30.2057633 -0.788082E-08  0.379E-04    3.52      57.6  T
     SCC iter.                  ...        0 min,  0.006 sec
     gradient                   ...        0 min,  0.011 sec
 * total energy  :   -29.7061009 Eh     change       -0.1915367E-04 Eh
   gradient norm :     0.0010175 Eh/α   predicted    -0.8486107E-05 ( -55.69%)
   displ. norm   :     0.0808530 α      lambda       -0.1144583E-04
   maximum displ.:     0.0604302 α      in ANC's #1, #2, #4, ...

........................................................................
.............................. CYCLE    8 ..............................
........................................................................
   1    -30.2061911 -0.302062E+02  0.556E-02    3.52       0.0  T
   2    -30.2061915 -0.412882E-06  0.303E-02    3.52       1.0  T
   3    -30.2061916 -0.661258E-07  0.440E-03    3.52       5.0  T
   4    -30.2061915  0.590490E-07  0.257E-03    3.52       8.5  T
   5    -30.2061916 -0.103534E-06  0.291E-04    3.52      75.0  T
   6    -30.2061916 -0.945008E-09  0.111E-04    3.52     197.2  T
     SCC iter.                  ...        0 min,  0.006 sec
     gradient                   ...        0 min,  0.011 sec
 * total energy  :   -29.7061129 Eh     change       -0.1203820E-04 Eh
   gradient norm :     0.0007849 Eh/α   predicted    -0.5742506E-05 ( -52.30%)
   displ. norm   :     0.0802778 α      lambda        0.3398923E-06
   maximum displ.:     0.0596581 α      in ANC's #1, #2, #4, ...

........................................................................
.............................. CYCLE    9 ..............................
........................................................................
   1    -30.2064773 -0.302065E+02  0.550E-02    3.52       0.0  T
   2    -30.2064777 -0.401434E-06  0.300E-02    3.52       1.0  T
   3    -30.2064778 -0.604033E-07  0.438E-03    3.52       5.0  T
   4    -30.2064777  0.585155E-07  0.261E-03    3.52       8.4  T
   5    -30.2064778 -0.107089E-06  0.232E-04    3.52      94.1  T
   6    -30.2064778 -0.674856E-09  0.621E-05    3.52     351.1  T
     SCC iter.                  ...        0 min,  0.006 sec
     gradient                   ...        0 min,  0.011 sec
 * total energy  :   -29.7061147 Eh     change       -0.1820619E-05 Eh
   gradient norm :     0.0015017 Eh/α   predicted     0.1691077E-06 (-109.29%)
   displ. norm   :     0.0796806 α      lambda        0.1301814E-04
   maximum displ.:     0.0588430 α      in ANC's #1, #2, #4, ...

........................................................................
.............................. CYCLE   10 ..............................
........................................................................
   1    -30.2066239 -0.302066E+02  0.543E-02    3.52       0.0  T
   2    -30.2066243 -0.390455E-06  0.296E-02    3.52       1.0  T
   3    -30.2066243 -0.450760E-07  0.442E-03    3.52       4.9  T
   4    -30.2066243  0.606327E-07  0.284E-03    3.52       7.7  T
   5    -30.2066244 -0.122612E-06  0.319E-04    3.52      68.3  T
   6    -30.2066244 -0.123189E-08  0.156E-04    3.52     139.9  T
     SCC iter.                  ...        0 min,  0.006 sec
     gradient                   ...        0 min,  0.011 sec
 * total energy  :   -29.7061057 Eh     change        0.9008669E-05 Eh
   gradient norm :     0.0026044 Eh/α   predicted     0.6525930E-05 ( -27.56%)
   displ. norm   :     0.0417224 α      lambda       -0.1725880E-04
   maximum displ.:     0.0262002 α      in ANC's #1, #2, #4, ...

........................................................................
.............................. CYCLE   11 ..............................
........................................................................
   1    -30.2065062 -0.302065E+02  0.256E-02    3.52       0.0  T
   2    -30.2065063 -0.813454E-07  0.142E-02    3.52       1.5  T
   3    -30.2065062  0.763516E-07  0.301E-03    3.52       7.3  T
   4    -30.2065063 -0.957871E-07  0.139E-03    3.52      15.7  T
   5    -30.2065063 -0.114398E-07  0.314E-04    3.52      69.5  T
   6    -30.2065063 -0.149076E-08  0.103E-04    3.52     211.6  T
     SCC iter.                  ...        0 min,  0.006 sec
     gradient                   ...        0 min,  0.010 sec
 * total energy  :   -29.7061169 Eh     change       -0.1113973E-04 Eh
   gradient norm :     0.0011689 Eh/α   predicted    -0.8646396E-05 ( -22.38%)
   displ. norm   :     0.0490180 α      lambda       -0.4490679E-05
   maximum displ.:     0.0327809 α      in ANC's #2, #1, #4, ...

........................................................................
.............................. CYCLE   12 ..............................
........................................................................
   1    -30.2063797 -0.302064E+02  0.305E-02    3.53       0.0  T
   2    -30.2063798 -0.864200E-07  0.173E-02    3.53       1.3  T
   3    -30.2063798  0.402972E-07  0.262E-03    3.53       8.3  T
   4    -30.2063798 -0.445899E-07  0.151E-03    3.53      14.4  T
   5    -30.2063798 -0.220791E-07  0.385E-04    3.53      56.7  T
   6    -30.2063798 -0.198629E-08  0.140E-04    3.53     155.4  T
     SCC iter.                  ...        0 min,  0.006 sec
     gradient                   ...        0 min,  0.010 sec
 * total energy  :   -29.7061186 Eh     change       -0.1770553E-05 Eh
   gradient norm :     0.0006862 Eh/α   predicted    -0.2250181E-05 (  27.09%)
   displ. norm   :     0.0160015 α      lambda       -0.9926063E-06
   maximum displ.:     0.0116016 α      in ANC's #1, #2, #4, ...

   *** GEOMETRY OPTIMIZATION CONVERGED AFTER 12 ITERATIONS ***

------------------------------------------------------------------------
 total energy gain   :        -0.0029187 Eh       -1.8315 kcal/mol
 total RMSD          :         0.1359599 a0        0.0719 Å
 total power (kW/mol):        -0.6385950 (step)  -26.5230 (real)
------------------------------------------------------------------------

 ANCopt (total)                0 d,  0 h,  0 min,  0.289 sec
 optimizer setup                ...        0 min,  0.000 sec (  0.056%)
 model hessian                  ...        0 min,  0.005 sec (  1.635%)
 ANC generation                 ...        0 min,  0.001 sec (  0.215%)
 coordinate transformation      ...        0 min,  0.000 sec (  0.065%)
 single point calculation       ...        0 min,  0.280 sec ( 96.819%)
 optimization log               ...        0 min,  0.001 sec (  0.383%)
 hessian update                 ...        0 min,  0.000 sec (  0.053%)
 rational function              ...        0 min,  0.001 sec (  0.483%)

================
 final structure:
================
$coord
    4.03113133664986    1.39588201051209   -0.10818703077564      C 
    4.10303667728485   -1.08997206429963   -0.53552786549789      C 
    1.76418797896729   -2.70237211377539   -0.65418820867892      C 
   -0.61472543337393   -1.24604537905448   -0.20688658563218      C 
   -2.97363944332351   -2.26234487964816   -0.17836656452537      C 
   -5.27651728736422   -0.03963141184927    0.38899414683315      S 
   -3.02906705446663    2.29968657134159    0.59159689233010      C 
   -0.64922472741396    1.40156856305906    0.24005597574785      C 
    1.71113837964041    2.94897323739165    0.30324737801669      C 
    6.52700897729544   -2.33581560843173   -0.91354085548249      C 
    6.88862377959979   -4.77553255058655   -1.37841793551369      C 
    5.78347115513966    2.45009619448962   -0.04598056557346      H 
    1.91705468064778   -4.21558506348429    0.75052952765157      H 
    1.67126328849553   -3.61483252949499   -2.51083630208964      H 
   -3.50919057296104   -4.19610716143689   -0.45763100549877      H 
   -3.60882022145541    4.20538418308402    0.96091098639627      H 
    1.86168014028856    3.93009764535770    2.12304250667994      H 
    1.62078809275453    4.42947955706024   -1.14569832915204      H 
    8.15249511559946   -1.09796810112566   -0.79646416049762      H 
    5.36390053517551   -6.11229038496894   -1.52380606315907      H 
    8.75915144296195   -5.53298342296639   -1.63646862219035      H 
$end
           -------------------------------------------------
          |                Final Singlepoint                |
           -------------------------------------------------

          ...................................................
          :                      SETUP                      :
          :.................................................:
          :  # basis functions                  60          :
          :  # atomic orbitals                  59          :
          :  # shells                           33          :
          :  # electrons                        56          :
          :  max. iterations                   250          :
          :  Hamiltonian                  GFN2-xTB          :
          :  restarted?                      false          :
          :  GBSA solvation                  false          :
          :  PC potential                    false          :
          :  electronic temp.          300.0000000     K    :
          :  accuracy                    1.0000000          :
          :  -> integral cutoff          0.2500000E+02      :
          :  -> integral neglect         0.1000000E-07      :
          :  -> SCF convergence          0.1000000E-05 Eh   :
          :  -> wf. convergence          0.1000000E-03 e    :
          :  Broyden damping             0.4000000          :
          ...................................................

 iter      E             dE          RMSdq      gap      omega  full diag
   1    -30.2063798 -0.302064E+02  0.715E-05    3.53       0.0  T
   2    -30.2063798 -0.628830E-12  0.316E-05    3.53     689.9  T
   3    -30.2063798  0.829559E-11  0.373E-05    3.53     584.9  T

   *** convergence criteria satisfied after 3 iterations ***

         #    Occupation            Energy/Eh            Energy/eV
      -------------------------------------------------------------
         1        2.0000           -0.7236212             -19.6907
       ...           ...                  ...                  ...
        22        2.0000           -0.4408305             -11.9956
        23        2.0000           -0.4325176             -11.7694
        24        2.0000           -0.4281787             -11.6513
        25        2.0000           -0.4226809             -11.5017
        26        2.0000           -0.3882851             -10.5658
        27        2.0000           -0.3819687             -10.3939
        28        2.0000           -0.3721750             -10.1274 (HOMO)
        29                         -0.2425944              -6.6013 (LUMO)
        30                         -0.2367606              -6.4426
        31                         -0.1955707              -5.3218
        32                         -0.1608280              -4.3764
        33                         -0.1413419              -3.8461
       ...                                ...                  ...
        59                          0.7011728              19.0799
      -------------------------------------------------------------
                  HL-Gap            0.1295805 Eh            3.5261 eV
             Fermi-level           -0.3073847 Eh           -8.3644 eV

 SCC (total)                   0 d,  0 h,  0 min,  0.021 sec
 SCC setup                      ...        0 min,  0.000 sec (  0.754%)
 Dispersion                     ...        0 min,  0.000 sec (  0.768%)
 integral evaluation            ...        0 min,  0.006 sec ( 29.963%)
 zeroth order Hamiltonian       ...        0 min,  0.000 sec (  0.568%)
 iterations                     ...        0 min,  0.003 sec ( 15.736%)
 molecular gradient             ...        0 min,  0.011 sec ( 50.442%)
 printout                       ...        0 min,  0.000 sec (  1.532%)

         :::::::::::::::::::::::::::::::::::::::::::::::::::::
         ::                     SUMMARY                     ::
         :::::::::::::::::::::::::::::::::::::::::::::::::::::
         :: total energy             -29.706118632843 Eh    ::
         :: gradient norm              0.000686692116 Eh/a0 ::
         :: HOMO-LUMO gap              3.526065807940 eV    ::
         ::.................................................::
         :: SCC energy               -30.206379821719 Eh    ::
         :: -> isotropic ES            0.002606107795 Eh    ::
         :: -> anisotropic ES          0.003026069581 Eh    ::
         :: -> anisotropic XC          0.017226071416 Eh    ::
         :: -> dispersion             -0.020259853424 Eh    ::
         :: repulsion energy           0.500226991303 Eh    ::
         :: add. restraining           0.000000000000 Eh    ::
         :::::::::::::::::::::::::::::::::::::::::::::::::::::

           -------------------------------------------------
          |                Property Printout                |
           -------------------------------------------------

    * Orbital Energies and Occupations

         #    Occupation            Energy/Eh            Energy/eV
      -------------------------------------------------------------
         1        2.0000           -0.7236212             -19.6907
       ...           ...                  ...                  ...
        16        2.0000           -0.4928465             -13.4110
        17        2.0000           -0.4759562             -12.9514
        18        2.0000           -0.4671205             -12.7110
        19        2.0000           -0.4669378             -12.7060
        20        2.0000           -0.4660001             -12.6805
        21        2.0000           -0.4515578             -12.2875
        22        2.0000           -0.4408305             -11.9956
        23        2.0000           -0.4325176             -11.7694
        24        2.0000           -0.4281787             -11.6513
        25        2.0000           -0.4226809             -11.5017
        26        2.0000           -0.3882851             -10.5658
        27        2.0000           -0.3819687             -10.3939
        28        2.0000           -0.3721750             -10.1274 (HOMO)
        29                         -0.2425944              -6.6013 (LUMO)
        30                         -0.2367606              -6.4426
        31                         -0.1955707              -5.3218
        32                         -0.1608280              -4.3764
        33                         -0.1413419              -3.8461
        34                         -0.1078140              -2.9338
        35                          0.0048722               0.1326
        36                          0.0367562               1.0002
        37                          0.0413062               1.1240
        38                          0.0857063               2.3322
        39                          0.0936979               2.5496
       ...                                ...                  ...
        59                          0.7011728              19.0799
      -------------------------------------------------------------
                  HL-Gap            0.1295805 Eh            3.5261 eV
             Fermi-level           -0.3073847 Eh           -8.3644 eV

     #   Z        covCN         q      C6AA      α(0)
     1   6 C      2.906    -0.042    29.040     8.836
     2   6 C      2.948     0.007    27.868     8.658
     3   6 C      3.812    -0.058    21.604     6.616
     4   6 C      3.164    -0.005    27.815     8.620
     5   6 C      2.943    -0.035    28.871     8.813
     6  16 S      2.294    -0.048   143.024    20.128
     7   6 C      2.942    -0.035    28.869     8.812
     8   6 C      3.168    -0.007    27.820     8.618
     9   6 C      3.808    -0.052    21.499     6.600
    10   6 C      2.901    -0.034    28.849     8.807
    11   6 C      2.838    -0.091    30.265     9.016
    12   1 H      0.925     0.027     2.622     2.532
    13   1 H      0.924     0.050     2.319     2.382
    14   1 H      0.924     0.050     2.317     2.380
    15   1 H      0.926     0.037     2.483     2.464
    16   1 H      0.926     0.037     2.486     2.466
    17   1 H      0.924     0.048     2.349     2.397
    18   1 H      0.924     0.048     2.343     2.394
    19   1 H      0.925     0.031     2.577     2.510
    20   1 H      0.926     0.037     2.492     2.469
    21   1 H      0.926     0.033     2.538     2.491

 Mol. C6AA /au·bohr⁶  :       6344.177378
 Mol. C8AA /au·bohr⁸  :     174689.963893
 Mol. α(0) /au        :        128.008443


Wiberg/Mayer (AO) data.
largest (>0.10) Wiberg bond orders for each atom
          total WBO             WBO to atom ...
     1  C   3.990        C    2 1.797    C    9 1.030    H   12 0.965    C   11 0.127
     2  C   3.989        C    1 1.797    C   10 1.097    C    3 1.006
     3  C   3.998        C    4 1.008    C    2 1.006    H   13 0.950    H   14 0.949
     4  C   3.986        C    5 1.605    C    8 1.225    C    3 1.008
     5  C   3.942        C    4 1.605    S    6 1.183    H   15 0.971    C    7 0.121
     6  S   2.621        C    7 1.184    C    5 1.183
     7  C   3.942        C    8 1.605    S    6 1.184    H   16 0.971    C    5 0.121
     8  C   3.986        C    7 1.605    C    4 1.225    C    9 1.008
     9  C   3.998        C    1 1.030    C    8 1.008    H   17 0.947    H   18 0.945
    10  C   3.990        C   11 1.891    C    2 1.097    H   19 0.964
    11  C   3.982        C   10 1.891    H   21 0.979    H   20 0.975    C    1 0.127
    12  H   0.998        C    1 0.965
    13  H   0.997        C    3 0.950
    14  H   0.997        C    3 0.949
    15  H   0.998        C    5 0.971
    16  H   0.998        C    7 0.971
    17  H   0.993        C    9 0.947
    18  H   0.993        C    9 0.945
    19  H   0.999        C   10 0.964
    20  H   0.999        C   11 0.975
    21  H   0.998        C   11 0.979

molecular dipole:
                 x           y           z       tot (Debye)
 q only:        0.270       0.080      -0.015
   full:        0.532       0.105      -0.034       1.381
molecular quadrupole (traceless):
                xx          xy          yy          xz          yz          zz
 q only:       -2.555       0.767       3.489       0.232       0.705      -0.934
  q+dip:       -4.892       1.123       8.220       0.294       1.948      -3.328
   full:       -5.555       0.985       6.745       0.481       1.307      -1.190

           -------------------------------------------------
          |                Geometry Summary                 |
           -------------------------------------------------

      molecular mass/u    :      162.2490000
   center of mass at/Å    :        0.2360192      -0.2855913      -0.0846653
  moments of inertia/u·Å² :        0.2039573E+03   0.8686027E+03   0.1066311E+04
rotational constants/cm⁻¹ :        0.8265274E-01   0.1940776E-01   0.1580930E-01

 * 19 selected distances

     #   Z        #   Z                                     value/Å
     1   6 C      2   6 C                                 1.3352959
     3   6 C      4   6 C                                 1.4948855
     4   6 C      5   6 C                                 1.3592908
     5   6 C      6  16 S                                 1.7200784 (max)
     6  16 S      7   6 C                                 1.7199880
     4   6 C      8   6 C                                 1.4209969
     7   6 C      8   6 C                                 1.3588471
     8   6 C      9   6 C                                 1.4939086
    10   6 C     11   6 C                                 1.3281289
     1   6 C     12   1 H                                 1.0826729
     3   6 C     13   1 H                                 1.0955904
     3   6 C     14   1 H                                 1.0958392
     5   6 C     15   1 H                                 1.0720562
     7   6 C     16   1 H                                 1.0720497 (min)
     9   6 C     17   1 H                                 1.0969325
     9   6 C     18   1 H                                 1.0972623
    10   6 C     19   1 H                                 1.0829634
    11   6 C     20   1 H                                 1.0757850
    11   6 C     21   1 H                                 1.0766118

 * 3 distinct bonds (by element types)

   Z      Z             #   av. dist./Å        max./Å        min./Å
   1 H    6 C          10     1.0847763     1.0972623     1.0720497
   6 C    6 C           7     1.3987648     1.4948855     1.3281289
   6 C   16 S           2     1.7200332     1.7200784     1.7199880


optimized geometry written to: xtbopt.xyz


           -------------------------------------------------
          | TOTAL ENERGY              -29.706118632843 Eh   |
          | GRADIENT NORM               0.000686692116 Eh/α |
          | HOMO-LUMO GAP               3.526065807940 eV   |
           -------------------------------------------------

------------------------------------------------------------------------
 * finished run on 2021/05/19 at 10:59:30.937     
------------------------------------------------------------------------
 total:
 * wall-time:     0 d,  0 h,  0 min,  0.360 sec
 *  cpu-time:     0 d,  0 h,  0 min,  0.359 sec
 * ratio c/w:     0.996 speedup
 SCF:
 * wall-time:     0 d,  0 h,  0 min,  0.031 sec
 *  cpu-time:     0 d,  0 h,  0 min,  0.031 sec
 * ratio c/w:     0.997 speedup
 ANC optimizer:
 * wall-time:     0 d,  0 h,  0 min,  0.311 sec
 *  cpu-time:     0 d,  0 h,  0 min,  0.310 sec
 * ratio c/w:     0.998 speedup

