      -----------------------------------------------------------      
     |                   =====================                   |     
     |                           x T B                           |     
     |                   =====================                   |     
     |                         S. Grimme                         |     
     |          Mulliken Center for Theoretical Chemistry        |     
     |                    University of Bonn                     |     
     |                Version 6.2 RC2 (SAW190805)                |     
      -----------------------------------------------------------      

   This program is distributed in the hope that it will be useful,
   but WITHOUT ANY WARRANTY; without even the implied warranty of
   MERCHANTABILITY or FITNESS FOR A PARTICULAR PURPOSE.
   
   FOR NON-COMMERCIAL, ACADEMIA USE ONLY.
   
   Cite this work as:
   * S. Grimme, C. Bannwarth, P. Shushkov, J. Chem. Theory Comput., 2017,
     13, 1989-2009. DOI: 10.1021/acs.jctc.7b00118
   * C. Bannwarth, S. Ehlert and S. Grimme., J. Chem. Theory Comput., 2019,
     15, 1652-1671. DOI: 10.1021/acs.jctc.8b01176
   * P. Pracht, E. Caldeweyher, S. Ehlert, S. Grimme, ChemRxiv, 2019, preprint.
     DOI: 10.26434/chemrxiv.8326202.v1
   
   for DFT-D4:
   * E. Caldeweyher, C. Bannwarth and S. Grimme, J. Chem. Phys., 2017,
     147, 034112. DOI: 10.1063/1.4993215
   * E. Caldeweyher, S. Ehlert, A. Hansen, H. Neugebauer, S. Spicher,
     C. Bannwarth and S. Grimme, J. Chem. Phys., 2019, 150, 154122.
     DOI: 10.1063/1.5090222
   
   for sTDA-xTB:
   * S. Grimme and C. Bannwarth, J. Chem. Phys., 2016, 145, 054103.
     DOI: 10.1063/1.4959605
   
   in the mass-spec context:
   * V. Asgeirsson, C. Bauer and S. Grimme, Chem. Sci., 2017, 8, 4879.
     DOI: 10.1039/c7sc00601b
   
   for metadynamics refer to:
   * S. Grimme, J. Chem. Theory Comput., 2019, 155, 2847-2862
     DOI: 10.1021/acs.jctc.9b00143
   
   with help from (in alphabetical order)
   C. Bannwarth, F. Bohle, G. Brandenburg, E. Caldeweyher, M. Checinski,
   S. Dohm, S. Ehlert, S. Ehrlich, F. März, H. Neugebauer, J. Pisarek,
   P. Pracht, P. Shushkov, and S. Spicher.
   
 * started run on 2021/05/19 at 10:59:31.778     

           -------------------------------------------------
          |                Calculation Setup                |
           -------------------------------------------------

          program call               : /ihome/ghutchison/geoffh/xtb/xtb 539.xyz -opt
          hostname                   : smp-n144
          coordinate file            : 539.xyz
          omp threads                :                     1
          number of atoms            :                    22
          number of electrons        :                    60
          charge                     :                     0
          spin                       :                   0.0
          first test random number   :      0.50035263203549


########################################################################
# WARNING! Please study the warnings concerning your input carefully
#  - the use of '-opt' is discouraged, please use '--opt' next time
########################################################################

           ------------------------------------------------- 
          |                 G F N 2 - x T B                 |
          | Geometry, Frequencies, Noncovalent interactions |
          |            JCTC 2019 parametrisation            |
           ------------------------------------------------- 
             KAB for C  - Si     :                1.0500
             KAB for H  - Pd     :                0.9500
             k(s)              :                1.8500
             k(p)              :                2.2300
             k(d)              :                2.2300
             k(f)              :                2.0000
             kEN (H0ij)        :               -2.0000
             D4 a1             :                0.5200
             D4 a2             :                5.0000
             D4 s6             :                1.0000
             D4 s8             :                2.7000
             D4 s9             :                5.0000
             alphaj            :                2.0000

  Z AO/shell   Hii/eV     exponent
  1     Wed Apr 25 08:07:45 CEST 2018   EN: 2.200 GM2: 0.406  GM3: 0.0800  RAES: 1.40
     1s    -10.707211    1.230000
  6     Wed Apr 25 08:07:45 CEST 2018   EN: 2.550 GM2: 0.538  GM3: 0.1500  RAES: 3.00
     2s    -13.970922    2.096432
     2p    -10.063292    1.800000
 16     Tue Apr 24 11:44:34 CEST 2018   EN: 2.580 GM2: 0.340  GM3:-0.0502  RAES: 3.10
     3s    -20.029654    1.981333
     3p    -11.377694    2.025643
     3d     -0.420282    1.702555

           ------------------------------------------------- 
          |        Self-Consistent Charge Iterations        |
           ------------------------------------------------- 

          ...................................................
          :                      SETUP                      :
          :.................................................:
          :  # basis functions                  64          :
          :  # atomic orbitals                  63          :
          :  # shells                           35          :
          :  # electrons                        60          :
          :  max. iterations                   250          :
          :  Hamiltonian                  GFN2-xTB          :
          :  restarted?                      false          :
          :  GBSA solvation                  false          :
          :  PC potential                    false          :
          :  electronic temp.          300.0000000     K    :
          :  accuracy                    1.0000000          :
          :  -> integral cutoff          0.2500000E+02      :
          :  -> integral neglect         0.1000000E-07      :
          :  -> SCF convergence          0.1000000E-05 Eh   :
          :  -> wf. convergence          0.1000000E-03 e    :
          :  Broyden damping             0.4000000          :
          ...................................................

 iter      E             dE          RMSdq      gap      omega  full diag
   1    -32.3397982 -0.323398E+02  0.428E+00    2.11       0.0  T
   2    -32.3556019 -0.158037E-01  0.250E+00    2.16       1.0  T
   3    -32.3519079  0.369392E-02  0.717E-01    2.13       1.0  T
   4    -32.3547726 -0.286467E-02  0.416E-01    2.14       1.0  T
   5    -32.3569335 -0.216089E-02  0.204E-01    2.14       1.0  T
   6    -32.3576693 -0.735811E-03  0.674E-02    2.14       1.0  T
   7    -32.3577172 -0.478999E-04  0.293E-02    2.14       1.0  T
   8    -32.3577245 -0.727268E-05  0.140E-02    2.14       1.5  T
   9    -32.3577261 -0.160997E-05  0.496E-03    2.14       4.3  T
  10    -32.3577262 -0.774245E-07  0.270E-03    2.14       7.9  T
  11    -32.3577262 -0.664156E-07  0.111E-03    2.14      19.3  T
  12    -32.3577262 -0.126559E-07  0.447E-04    2.14      47.7  T
  13    -32.3577263 -0.169855E-08  0.210E-04    2.14     101.8  T

   *** convergence criteria satisfied after 13 iterations ***

         #    Occupation            Energy/Eh            Energy/eV
      -------------------------------------------------------------
         1        2.0000           -0.7282634             -19.8171
       ...           ...                  ...                  ...
        24        2.0000           -0.4332830             -11.7902
        25        2.0000           -0.4304487             -11.7131
        26        2.0000           -0.4209057             -11.4534
        27        2.0000           -0.4195546             -11.4167
        28        2.0000           -0.4036793             -10.9847
        29        2.0000           -0.3832733             -10.4294
        30        2.0000           -0.3540479              -9.6341 (HOMO)
        31                         -0.2754144              -7.4944 (LUMO)
        32                         -0.2197617              -5.9800
        33                         -0.1971483              -5.3647
        34                         -0.1930103              -5.2521
        35                         -0.1882140              -5.1216
       ...                                ...                  ...
        63                          0.7522729              20.4704
      -------------------------------------------------------------
                  HL-Gap            0.0786335 Eh            2.1397 eV
             Fermi-level           -0.3147312 Eh           -8.5643 eV

 SCC (total)                   0 d,  0 h,  0 min,  0.035 sec
 SCC setup                      ...        0 min,  0.000 sec (  0.802%)
 Dispersion                     ...        0 min,  0.000 sec (  0.929%)
 integral evaluation            ...        0 min,  0.008 sec ( 22.363%)
 zeroth order Hamiltonian       ...        0 min,  0.000 sec (  0.478%)
 iterations                     ...        0 min,  0.014 sec ( 39.784%)
 molecular gradient             ...        0 min,  0.012 sec ( 34.416%)
 printout                       ...        0 min,  0.000 sec (  1.071%)

         :::::::::::::::::::::::::::::::::::::::::::::::::::::
         ::                     SUMMARY                     ::
         :::::::::::::::::::::::::::::::::::::::::::::::::::::
         :: total energy             -31.832473141712 Eh    ::
         :: gradient norm              0.111981895308 Eh/a0 ::
         :: HOMO-LUMO gap              2.139727659727 eV    ::
         ::.................................................::
         :: SCC energy               -32.357726251039 Eh    ::
         :: -> isotropic ES            0.002499784167 Eh    ::
         :: -> anisotropic ES          0.003967345703 Eh    ::
         :: -> anisotropic XC          0.020371852996 Eh    ::
         :: -> dispersion             -0.022715577110 Eh    ::
         :: repulsion energy           0.525187242916 Eh    ::
         :: add. restraining           0.000000000000 Eh    ::
         :::::::::::::::::::::::::::::::::::::::::::::::::::::

      ----------------------------------------------------------- 
     |                   =====================                   |
     |                        A N C O P T                        |
     |                   =====================                   |
     |               Approximate Normal Coordinate               |
     |                Rational Function Optimizer                |
      ----------------------------------------------------------- 

          ...................................................
          :                      SETUP                      :
          :.................................................:
          :   optimization level            normal          :
          :   max. optcycles                   200          :
          :   ANC micro-cycles                  20          :
          :   degrees of freedom                60          :
          :.................................................:
          :   RF solver                   davidson          :
          :   input Hessian                  false          :
          :   write xtbopt.log                true          :
          :   linear?                        false          :
          :   energy convergence         0.5000000E-05 Eh   :
          :   grad. convergence          0.1000000E-02 Eh/α :
          :   maximium RF displ.         2.0000000          :
          :   Hlow (freq-cutoff)         0.5000000E-02      :
          :   Hmax (freq-cutoff)         5.0000000          :
          :   S6 in model hess.         20.0000000          :
          ...................................................

generating ANC from model Hessian ...
Using Lindh-Hessian (1995)
 Shifting diagonal of input Hessian by   3.451479831005511E-003
 Lowest  eigenvalues of input Hessian
   -0.000000   -0.000000   -0.000000    0.000000    0.000000    0.000000
    0.005000    0.006354    0.006782    0.009099    0.010258    0.013869
    0.015647    0.017481    0.022855    0.023173    0.026964    0.035224
 Highest eigenvalues
    1.605964    1.668651    1.843228    1.881221    1.967737    2.055807
 

........................................................................
.............................. CYCLE    1 ..............................
........................................................................
   1    -32.3577263 -0.323577E+02  0.980E-05    2.14       0.0  T
   2    -32.3577263 -0.324221E-10  0.746E-05    2.14     285.8  T
   3    -32.3577263 -0.913261E-10  0.355E-05    2.14     600.5  T
     SCC iter.                  ...        0 min,  0.004 sec
     gradient                   ...        0 min,  0.012 sec
 * total energy  :   -31.8324731 Eh     change        0.1043681E-08 Eh
   gradient norm :     0.1119820 Eh/α   predicted     0.0000000E+00 (-100.00%)
   displ. norm   :     0.3294967 α      lambda       -0.2007157E-01
   maximum displ.:     0.1473920 α      in ANC's #29, #25, #15, ...

........................................................................
.............................. CYCLE    2 ..............................
........................................................................
   1    -32.3966364 -0.323966E+02  0.257E-01    2.26       0.0  T
   2    -32.3967298 -0.933543E-04  0.165E-01    2.25       1.0  T
   3    -32.3966911  0.386686E-04  0.980E-02    2.25       1.0  T
   4    -32.3968154 -0.124315E-03  0.236E-02    2.25       1.0  T
   5    -32.3968249 -0.954941E-05  0.747E-03    2.25       2.9  T
   6    -32.3968256 -0.657031E-06  0.314E-03    2.25       6.8  T
   7    -32.3968257 -0.686793E-07  0.150E-03    2.25      14.2  T
     SCC iter.                  ...        0 min,  0.007 sec
     gradient                   ...        0 min,  0.011 sec
 * total energy  :   -31.8463375 Eh     change       -0.1386434E-01 Eh
   gradient norm :     0.0528021 Eh/α   predicted    -0.1112535E-01 ( -19.76%)
   displ. norm   :     0.2258586 α      lambda       -0.5557023E-02
   maximum displ.:     0.0917517 α      in ANC's #29, #25, #8, ...

........................................................................
.............................. CYCLE    3 ..............................
........................................................................
   1    -32.4133174 -0.324133E+02  0.204E-01    2.37       0.0  T
   2    -32.4133680 -0.505910E-04  0.124E-01    2.37       1.0  T
   3    -32.4133373  0.307192E-04  0.683E-02    2.37       1.0  T
   4    -32.4134004 -0.631236E-04  0.163E-02    2.37       1.3  T
   5    -32.4134030 -0.254157E-05  0.858E-03    2.37       2.5  T
   6    -32.4134038 -0.838074E-06  0.392E-03    2.37       5.4  T
   7    -32.4134041 -0.238613E-06  0.119E-03    2.37      18.0  T
     SCC iter.                  ...        0 min,  0.007 sec
     gradient                   ...        0 min,  0.011 sec
 * total energy  :   -31.8490810 Eh     change       -0.2743527E-02 Eh
   gradient norm :     0.0132279 Eh/α   predicted    -0.2920260E-02 (   6.44%)
   displ. norm   :     0.0976212 α      lambda       -0.5053557E-03
   maximum displ.:     0.0549936 α      in ANC's #15, #14, #7, ...

........................................................................
.............................. CYCLE    4 ..............................
........................................................................
   1    -32.4103158 -0.324103E+02  0.860E-02    2.37       0.0  T
   2    -32.4103175 -0.172005E-05  0.517E-02    2.37       1.0  T
   3    -32.4103100  0.750486E-05  0.203E-02    2.37       1.0  T
   4    -32.4103184 -0.840413E-05  0.411E-03    2.37       5.2  T
   5    -32.4103186 -0.168646E-06  0.227E-03    2.37       9.4  T
   6    -32.4103186 -0.576952E-07  0.978E-04    2.37      21.8  T
     SCC iter.                  ...        0 min,  0.006 sec
     gradient                   ...        0 min,  0.011 sec
 * total energy  :   -31.8492698 Eh     change       -0.1888426E-03 Eh
   gradient norm :     0.0060279 Eh/α   predicted    -0.2550857E-03 (  35.08%)
   displ. norm   :     0.0823335 α      lambda       -0.1859667E-03
   maximum displ.:     0.0472609 α      in ANC's #3, #2, #8, ...

........................................................................
.............................. CYCLE    5 ..............................
........................................................................
   1    -32.4084985 -0.324085E+02  0.477E-02    2.37       0.0  T
   2    -32.4084987 -0.246256E-06  0.285E-02    2.37       1.0  T
   3    -32.4084946  0.418403E-05  0.146E-02    2.37       1.5  T
   4    -32.4084993 -0.469318E-05  0.211E-03    2.37      10.1  T
   5    -32.4084993 -0.463254E-07  0.112E-03    2.37      19.1  T
   6    -32.4084993 -0.140612E-07  0.491E-04    2.37      43.4  T
     SCC iter.                  ...        0 min,  0.006 sec
     gradient                   ...        0 min,  0.011 sec
 * total energy  :   -31.8493798 Eh     change       -0.1099305E-03 Eh
   gradient norm :     0.0023810 Eh/α   predicted    -0.9364714E-04 ( -14.81%)
   displ. norm   :     0.0774387 α      lambda       -0.5331546E-04
   maximum displ.:     0.0464241 α      in ANC's #3, #2, #5, ...

........................................................................
.............................. CYCLE    6 ..............................
........................................................................
   1    -32.4088301 -0.324088E+02  0.475E-02    2.37       0.0  T
   2    -32.4088303 -0.230190E-06  0.276E-02    2.37       1.0  T
   3    -32.4088296  0.744321E-06  0.653E-03    2.37       3.3  T
   4    -32.4088303 -0.696200E-06  0.278E-03    2.37       7.7  T
   5    -32.4088304 -0.128877E-06  0.755E-04    2.37      28.2  T
   6    -32.4088304 -0.507112E-08  0.414E-04    2.37      51.5  T
     SCC iter.                  ...        0 min,  0.006 sec
     gradient                   ...        0 min,  0.012 sec
 * total energy  :   -31.8494240 Eh     change       -0.4424055E-04 Eh
   gradient norm :     0.0017880 Eh/α   predicted    -0.2681987E-04 ( -39.38%)
   displ. norm   :     0.2500231 α      lambda       -0.8921924E-04
   maximum displ.:     0.1386123 α      in ANC's #2, #3, #5, ...

........................................................................
.............................. CYCLE    7 ..............................
........................................................................
   1    -32.4089532 -0.324090E+02  0.161E-01    2.38       0.0  T
   2    -32.4089548 -0.167323E-05  0.939E-02    2.38       1.0  T
   3    -32.4089516  0.323639E-05  0.138E-02    2.38       1.5  T
   4    -32.4089544 -0.275124E-05  0.758E-03    2.38       2.8  T
   5    -32.4089554 -0.100689E-05  0.173E-03    2.38      12.3  T
   6    -32.4089554 -0.167577E-07  0.100E-03    2.38      21.3  T
   7    -32.4089554 -0.104535E-07  0.338E-04    2.38      63.2  T
   8    -32.4089554 -0.951559E-10  0.201E-04    2.38     106.1  T
     SCC iter.                  ...        0 min,  0.008 sec
     gradient                   ...        0 min,  0.012 sec
 * total energy  :   -31.8495168 Eh     change       -0.9273989E-04 Eh
   gradient norm :     0.0055138 Eh/α   predicted    -0.4585144E-04 ( -50.56%)
   displ. norm   :     0.1619167 α      lambda       -0.7294851E-04
   maximum displ.:     0.0908430 α      in ANC's #2, #3, #4, ...

........................................................................
.............................. CYCLE    8 ..............................
........................................................................
   1    -32.4088029 -0.324088E+02  0.108E-01    2.38       0.0  T
   2    -32.4088033 -0.395470E-06  0.633E-02    2.38       1.0  T
   3    -32.4088024  0.977322E-06  0.799E-03    2.38       2.7  T
   4    -32.4088034 -0.108353E-05  0.298E-03    2.38       7.2  T
   5    -32.4088035 -0.808260E-07  0.136E-03    2.38      15.7  T
     SCC iter.                  ...        0 min,  0.006 sec
     gradient                   ...        0 min,  0.012 sec
 * total energy  :   -31.8495766 Eh     change       -0.5987033E-04 Eh
   gradient norm :     0.0055247 Eh/α   predicted    -0.3743445E-04 ( -37.47%)
   displ. norm   :     0.2379088 α      lambda       -0.1170614E-03
   maximum displ.:     0.1395590 α      in ANC's #2, #3, #4, ...

........................................................................
.............................. CYCLE    9 ..............................
........................................................................
   1    -32.4086765 -0.324087E+02  0.166E-01    2.37       0.0  T
   2    -32.4086775 -0.924821E-06  0.970E-02    2.37       1.0  T
   3    -32.4086742  0.330379E-05  0.144E-02    2.37       1.5  T
   4    -32.4086780 -0.381617E-05  0.391E-03    2.37       5.5  T
   5    -32.4086780  0.283811E-07  0.259E-03    2.37       8.2  T
   6    -32.4086781 -0.134683E-06  0.556E-04    2.37      38.4  T
     SCC iter.                  ...        0 min,  0.006 sec
     gradient                   ...        0 min,  0.011 sec
 * total energy  :   -31.8496562 Eh     change       -0.7956232E-04 Eh
   gradient norm :     0.0042289 Eh/α   predicted    -0.6184710E-04 ( -22.27%)
   displ. norm   :     0.1197411 α      lambda       -0.7774215E-04
   maximum displ.:     0.0723591 α      in ANC's #2, #4, #1, ...

........................................................................
.............................. CYCLE   10 ..............................
........................................................................
   1    -32.4097166 -0.324097E+02  0.884E-02    2.36       0.0  T
   2    -32.4097172 -0.638638E-06  0.511E-02    2.36       1.0  T
   3    -32.4097161  0.116453E-05  0.913E-03    2.36       2.3  T
   4    -32.4097173 -0.126005E-05  0.367E-03    2.36       5.8  T
   5    -32.4097175 -0.138654E-06  0.103E-03    2.36      20.7  T
   6    -32.4097175  0.759144E-10  0.795E-04    2.36      26.8  T
     SCC iter.                  ...        0 min,  0.006 sec
     gradient                   ...        0 min,  0.011 sec
 * total energy  :   -31.8497108 Eh     change       -0.5461762E-04 Eh
   gradient norm :     0.0027171 Eh/α   predicted    -0.3942927E-04 ( -27.81%)
   displ. norm   :     0.2200869 α      lambda       -0.7126760E-04
   maximum displ.:     0.1336561 α      in ANC's #4, #2, #1, ...

........................................................................
.............................. CYCLE   11 ..............................
........................................................................
   1    -32.4082438 -0.324082E+02  0.158E-01    2.35       0.0  T
   2    -32.4082453 -0.149507E-05  0.917E-02    2.34       1.0  T
   3    -32.4082402  0.514583E-05  0.180E-02    2.34       1.2  T
   4    -32.4082458 -0.567976E-05  0.593E-03    2.34       3.6  T
   5    -32.4082460 -0.144470E-06  0.306E-03    2.34       7.0  T
   6    -32.4082462 -0.166680E-06  0.974E-04    2.34      21.9  T
   7    -32.4082462 -0.157680E-07  0.257E-04    2.34      82.9  T
     SCC iter.                  ...        0 min,  0.007 sec
     gradient                   ...        0 min,  0.012 sec
 * total energy  :   -31.8497544 Eh     change       -0.4359623E-04 Eh
   gradient norm :     0.0045560 Eh/α   predicted    -0.3736387E-04 ( -14.30%)
   displ. norm   :     0.1585978 α      lambda       -0.9098009E-04
   maximum displ.:     0.1013343 α      in ANC's #4, #2, #1, ...

........................................................................
.............................. CYCLE   12 ..............................
........................................................................
   1    -32.4088023 -0.324088E+02  0.111E-01    2.34       0.0  T
   2    -32.4088038 -0.155624E-05  0.635E-02    2.34       1.0  T
   3    -32.4088017  0.209099E-05  0.128E-02    2.34       1.7  T
   4    -32.4088038 -0.206324E-05  0.625E-03    2.34       3.4  T
   5    -32.4088042 -0.429023E-06  0.253E-03    2.34       8.4  T
   6    -32.4088043 -0.754684E-07  0.121E-03    2.34      17.6  T
     SCC iter.                  ...        0 min,  0.006 sec
     gradient                   ...        0 min,  0.011 sec
 * total energy  :   -31.8498169 Eh     change       -0.6245476E-04 Eh
   gradient norm :     0.0042740 Eh/α   predicted    -0.4663589E-04 ( -25.33%)
   displ. norm   :     0.2662877 α      lambda       -0.8553670E-04
   maximum displ.:     0.1621396 α      in ANC's #4, #2, #1, ...

........................................................................
.............................. CYCLE   13 ..............................
........................................................................
   1    -32.4075231 -0.324075E+02  0.187E-01    2.33       0.0  T
   2    -32.4075256 -0.248236E-05  0.107E-01    2.33       1.0  T
   3    -32.4075225  0.311346E-05  0.169E-02    2.32       1.3  T
   4    -32.4075253 -0.282587E-05  0.950E-03    2.32       2.2  T
   5    -32.4075263 -0.928986E-06  0.384E-03    2.32       5.5  T
   6    -32.4075266 -0.290098E-06  0.751E-04    2.32      28.4  T
   7    -32.4075266 -0.812258E-08  0.300E-04    2.32      71.0  T
     SCC iter.                  ...        0 min,  0.007 sec
     gradient                   ...        0 min,  0.011 sec
 * total energy  :   -31.8498750 Eh     change       -0.5818636E-04 Eh
   gradient norm :     0.0049743 Eh/α   predicted    -0.4580472E-04 ( -21.28%)
   displ. norm   :     0.2539714 α      lambda       -0.1483105E-03
   maximum displ.:     0.1433907 α      in ANC's #5, #4, #1, ...

........................................................................
.............................. CYCLE   14 ..............................
........................................................................
   1    -32.4079654 -0.324080E+02  0.158E-01    2.32       0.0  T
   2    -32.4079675 -0.208992E-05  0.917E-02    2.32       1.0  T
   3    -32.4079644  0.306757E-05  0.158E-02    2.32       1.4  T
   4    -32.4079673 -0.289377E-05  0.786E-03    2.32       2.7  T
   5    -32.4079680 -0.646410E-06  0.344E-03    2.32       6.2  T
   6    -32.4079682 -0.196322E-06  0.835E-04    2.32      25.5  T
   7    -32.4079682 -0.104698E-07  0.251E-04    2.32      85.0  T
     SCC iter.                  ...        0 min,  0.007 sec
     gradient                   ...        0 min,  0.011 sec
 * total energy  :   -31.8499618 Eh     change       -0.8678935E-04 Eh
   gradient norm :     0.0054348 Eh/α   predicted    -0.7893909E-04 (  -9.05%)
   displ. norm   :     0.1029964 α      lambda       -0.8096173E-04
   maximum displ.:     0.0623230 α      in ANC's #5, #3, #1, ...

........................................................................
.............................. CYCLE   15 ..............................
........................................................................
   1    -32.4087429 -0.324087E+02  0.625E-02    2.32       0.0  T
   2    -32.4087434 -0.472688E-06  0.364E-02    2.32       1.0  T
   3    -32.4087418  0.160536E-05  0.101E-02    2.32       2.1  T
   4    -32.4087435 -0.169415E-05  0.296E-03    2.32       7.2  T
   5    -32.4087435 -0.933803E-07  0.140E-03    2.32      15.2  T
     SCC iter.                  ...        0 min,  0.005 sec
     gradient                   ...        0 min,  0.011 sec
 * total energy  :   -31.8500210 Eh     change       -0.5917503E-04 Eh
   gradient norm :     0.0058150 Eh/α   predicted    -0.4091052E-04 ( -30.87%)
   displ. norm   :     0.2632834 α      lambda       -0.1689001E-03
   maximum displ.:     0.1402615 α      in ANC's #3, #5, #1, ...

........................................................................
.............................. CYCLE   16 ..............................
........................................................................
   1    -32.4085432 -0.324085E+02  0.158E-01    2.31       0.0  T
   2    -32.4085450 -0.179437E-05  0.919E-02    2.31       1.0  T
   3    -32.4085436  0.144032E-05  0.115E-02    2.31       1.9  T
   4    -32.4085450 -0.140061E-05  0.630E-03    2.31       3.4  T
   5    -32.4085454 -0.450031E-06  0.279E-03    2.31       7.7  T
   6    -32.4085455 -0.102420E-06  0.126E-03    2.31      16.9  T
     SCC iter.                  ...        0 min,  0.006 sec
     gradient                   ...        0 min,  0.011 sec
 * total energy  :   -31.8501134 Eh     change       -0.9243158E-04 Eh
   gradient norm :     0.0046146 Eh/α   predicted    -0.9031312E-04 (  -2.29%)
   displ. norm   :     0.2634514 α      lambda        0.1389382E-03
   maximum displ.:     0.1402395 α      in ANC's #3, #5, #1, ...

........................................................................
.............................. CYCLE   17 ..............................
........................................................................
   1    -32.4063810 -0.324064E+02  0.157E-01    2.30       0.0  T
   2    -32.4063830 -0.198544E-05  0.915E-02    2.30       1.0  T
   3    -32.4063808  0.216309E-05  0.131E-02    2.30       1.6  T
   4    -32.4063828 -0.192953E-05  0.725E-03    2.30       2.9  T
   5    -32.4063835 -0.696995E-06  0.284E-03    2.30       7.5  T
   6    -32.4063836 -0.100987E-06  0.129E-03    2.30      16.6  T
     SCC iter.                  ...        0 min,  0.006 sec
     gradient                   ...        0 min,  0.011 sec
 * total energy  :   -31.8500029 Eh     change        0.1105641E-03 Eh
   gradient norm :     0.0094754 Eh/α   predicted     0.7428948E-04 ( -32.81%)
   displ. norm   :     0.2024075 α      lambda       -0.3059381E-03
   maximum displ.:     0.1022322 α      in ANC's #4, #2, #3, ...

........................................................................
.............................. CYCLE   18 ..............................
........................................................................
   1    -32.4105827 -0.324106E+02  0.134E-01    2.31       0.0  T
   2    -32.4105839 -0.122802E-05  0.785E-02    2.31       1.0  T
   3    -32.4105826  0.131651E-05  0.102E-02    2.31       2.1  T
   4    -32.4105841 -0.150258E-05  0.395E-03    2.31       5.4  T
   5    -32.4105842 -0.146281E-06  0.189E-03    2.31      11.3  T
   6    -32.4105843 -0.362225E-07  0.110E-03    2.31      19.4  T
     SCC iter.                  ...        0 min,  0.006 sec
     gradient                   ...        0 min,  0.011 sec
 * total energy  :   -31.8501220 Eh     change       -0.1190921E-03 Eh
   gradient norm :     0.0059085 Eh/α   predicted    -0.1592525E-03 (  33.72%)
   displ. norm   :     0.2233628 α      lambda       -0.2150223E-03
   maximum displ.:     0.1140205 α      in ANC's #3, #2, #5, ...

........................................................................
.............................. CYCLE   19 ..............................
........................................................................
   1    -32.4045746 -0.324046E+02  0.162E-01    2.30       0.0  T
   2    -32.4045827 -0.809619E-05  0.888E-02    2.30       1.0  T
   3    -32.4045734  0.934035E-05  0.279E-02    2.30       1.0  T
   4    -32.4045810 -0.757772E-05  0.162E-02    2.30       1.3  T
   5    -32.4045843 -0.338449E-05  0.637E-03    2.30       3.3  T
   6    -32.4045848 -0.466998E-06  0.241E-03    2.30       8.9  T
   7    -32.4045849 -0.956514E-07  0.549E-04    2.30      38.8  T
     SCC iter.                  ...        0 min,  0.007 sec
     gradient                   ...        0 min,  0.011 sec
 * total energy  :   -31.8499252 Eh     change        0.1967503E-03 Eh
   gradient norm :     0.0158916 Eh/α   predicted    -0.1128757E-03 (-157.37%)
   displ. norm   :     0.1571820 α      lambda       -0.4532844E-03
   maximum displ.:     0.0790008 α      in ANC's #3, #5, #2, ...

........................................................................
.............................. CYCLE   20 ..............................
........................................................................
   1    -32.4090882 -0.324091E+02  0.117E-01    2.30       0.0  T
   2    -32.4090925 -0.424593E-05  0.637E-02    2.30       1.0  T
   3    -32.4090886  0.387844E-05  0.193E-02    2.30       1.1  T
   4    -32.4090917 -0.311810E-05  0.115E-02    2.30       1.9  T
   5    -32.4090932 -0.155474E-05  0.456E-03    2.30       4.7  T
   6    -32.4090935 -0.250106E-06  0.162E-03    2.30      13.1  T
   7    -32.4090935 -0.424506E-07  0.378E-04    2.30      56.4  T
     SCC iter.                  ...        0 min,  0.007 sec
     gradient                   ...        0 min,  0.011 sec
 * total energy  :   -31.8501559 Eh     change       -0.2306668E-03 Eh
   gradient norm :     0.0013005 Eh/α   predicted    -0.2322446E-03 (   0.68%)
   displ. norm   :     0.0886271 α      lambda       -0.1353093E-04
   maximum displ.:     0.0602242 α      in ANC's #5, #4, #6, ...
 * RMSD in coord.:     0.4466597 α      energy gain  -0.1768275E-01 Eh

generating ANC from model Hessian ...
Using Lindh-Hessian (1995)
 Shifting diagonal of input Hessian by   3.253554482240023E-003
 Lowest  eigenvalues of input Hessian
   -0.000000   -0.000000    0.000000    0.000000    0.000000    0.000000
    0.005000    0.006825    0.008169    0.009414    0.011108    0.014549
    0.017343    0.019116    0.023228    0.024762    0.029320    0.037844
 Highest eigenvalues
    1.701776    1.758772    1.889362    1.957448    1.983911    2.121777
 

........................................................................
.............................. CYCLE   21 ..............................
........................................................................
   1    -32.4087209 -0.324087E+02  0.483E-02    2.30       0.0  T
   2    -32.4087212 -0.256215E-06  0.283E-02    2.30       1.0  T
   3    -32.4087208  0.368204E-06  0.484E-03    2.30       4.4  T
   4    -32.4087212 -0.394501E-06  0.177E-03    2.30      12.0  T
   5    -32.4087212 -0.373958E-07  0.861E-04    2.30      24.7  T
   6    -32.4087212 -0.837186E-08  0.414E-04    2.30      51.5  T
     SCC iter.                  ...        0 min,  0.006 sec
     gradient                   ...        0 min,  0.012 sec
 * total energy  :   -31.8501502 Eh     change        0.5728718E-05 Eh
   gradient norm :     0.0041356 Eh/α   predicted     0.0000000E+00 (-100.00%)
   displ. norm   :     0.0140953 α      lambda       -0.2762070E-04
   maximum displ.:     0.0054101 α      in ANC's #9, #5, #11, ...

........................................................................
.............................. CYCLE   22 ..............................
........................................................................
   1    -32.4089036 -0.324089E+02  0.154E-02    2.30       0.0  T
   2    -32.4089038 -0.157647E-06  0.844E-03    2.30       2.5  T
   3    -32.4089036  0.142467E-06  0.350E-03    2.30       6.1  T
   4    -32.4089038 -0.157209E-06  0.147E-03    2.30      14.5  T
   5    -32.4089038 -0.200895E-07  0.654E-04    2.30      32.6  T
     SCC iter.                  ...        0 min,  0.005 sec
     gradient                   ...        0 min,  0.011 sec
 * total energy  :   -31.8501655 Eh     change       -0.1530225E-04 Eh
   gradient norm :     0.0010179 Eh/α   predicted    -0.1384649E-04 (  -9.51%)
   displ. norm   :     0.0100830 α      lambda       -0.2134763E-05
   maximum displ.:     0.0063108 α      in ANC's #5, #9, #7, ...

........................................................................
.............................. CYCLE   23 ..............................
........................................................................
   1    -32.4090733 -0.324091E+02  0.770E-03    2.30       0.0  T
   2    -32.4090733 -0.541322E-07  0.410E-03    2.30       5.2  T
   3    -32.4090733  0.784584E-07  0.265E-03    2.30       8.0  T
   4    -32.4090734 -0.107467E-06  0.712E-04    2.30      29.9  T
   5    -32.4090734 -0.129608E-08  0.458E-04    2.30      46.5  T
     SCC iter.                  ...        0 min,  0.005 sec
     gradient                   ...        0 min,  0.012 sec
 * total energy  :   -31.8501663 Eh     change       -0.7989922E-06 Eh
   gradient norm :     0.0005224 Eh/α   predicted    -0.1071329E-05 (  34.09%)
   displ. norm   :     0.0103690 α      lambda        0.5446194E-05
   maximum displ.:     0.0063117 α      in ANC's #5, #9, #7, ...

   *** GEOMETRY OPTIMIZATION CONVERGED AFTER 23 ITERATIONS ***

------------------------------------------------------------------------
 total energy gain   :        -0.0176931 Eh      -11.1026 kcal/mol
 total RMSD          :         0.4472420 a0        0.2367 Å
 total power (kW/mol):        -2.0197078 (step)  -75.9301 (real)
------------------------------------------------------------------------

 ANCopt (total)                0 d,  0 h,  0 min,  0.612 sec
 optimizer setup                ...        0 min,  0.000 sec (  0.026%)
 model hessian                  ...        0 min,  0.008 sec (  1.319%)
 ANC generation                 ...        0 min,  0.001 sec (  0.206%)
 coordinate transformation      ...        0 min,  0.000 sec (  0.065%)
 single point calculation       ...        0 min,  0.593 sec ( 96.972%)
 optimization log               ...        0 min,  0.002 sec (  0.346%)
 hessian update                 ...        0 min,  0.000 sec (  0.046%)
 rational function              ...        0 min,  0.005 sec (  0.778%)

================
 final structure:
================
$coord
   -2.59463101855847   -2.54535023141942    0.28357828801393      C 
   -5.02842124284489   -0.44148736822824    0.54680840314525      S 
   -3.03455366783422    2.09593502136625    0.39095799950003      C 
   -0.55518860066199    1.36112033592719    0.14492579649031      C 
   -0.29747642980534   -1.34296111623112    0.08294806702059      C 
    2.13895474318167   -2.40109480504283   -0.16348341864783      C 
    4.23897519907696   -0.89041341049692   -0.28284318445472      C 
    6.69474211003493   -2.16500305070980   -0.43629315767362      C 
    8.77390754482633   -1.55702664554973    0.82068609689135      C 
    3.97565650583562    1.81100194722985   -0.28281323429260      C 
    6.22948492136563    3.50173259130280   -0.59350984310470      C 
    1.63713510520453    2.87484446160737   -0.07994002990260      C 
   -2.97481744968953   -4.53401312117103    0.29642043151336      H 
   -3.78640919870915    3.97332268949160    0.48837794057391      H 
    2.33061359446296   -4.43416600884371   -0.20706529008599      H 
    6.70348992002936   -3.83779007483698   -1.61844111614290      H 
    8.85549644599821    0.01460957449547    2.10814510068816      H 
   10.47758230182011   -2.65659665976717    0.64099183676855      H 
    7.66274277203574    2.61833058595218   -1.77013769865610      H 
    7.07342897382134    3.93113612903310    1.23514764904375      H 
    5.66267166296055    5.28194623478344   -1.45137515537188      H 
    1.42179695223267    4.90576744458535   -0.10278097654600      H 
$end
           -------------------------------------------------
          |                Final Singlepoint                |
           -------------------------------------------------

          ...................................................
          :                      SETUP                      :
          :.................................................:
          :  # basis functions                  64          :
          :  # atomic orbitals                  63          :
          :  # shells                           35          :
          :  # electrons                        60          :
          :  max. iterations                   250          :
          :  Hamiltonian                  GFN2-xTB          :
          :  restarted?                      false          :
          :  GBSA solvation                  false          :
          :  PC potential                    false          :
          :  electronic temp.          300.0000000     K    :
          :  accuracy                    1.0000000          :
          :  -> integral cutoff          0.2500000E+02      :
          :  -> integral neglect         0.1000000E-07      :
          :  -> SCF convergence          0.1000000E-05 Eh   :
          :  -> wf. convergence          0.1000000E-03 e    :
          :  Broyden damping             0.4000000          :
          ...................................................

 iter      E             dE          RMSdq      gap      omega  full diag
   1    -32.4090734 -0.324091E+02  0.315E-04    2.30       0.0  T
   2    -32.4090734  0.211799E-09  0.135E-04    2.30     157.4  T
   3    -32.4090734 -0.126271E-09  0.204E-04    2.30     104.5  T

   *** convergence criteria satisfied after 3 iterations ***

         #    Occupation            Energy/Eh            Energy/eV
      -------------------------------------------------------------
         1        2.0000           -0.7311484             -19.8956
       ...           ...                  ...                  ...
        24        2.0000           -0.4366864             -11.8828
        25        2.0000           -0.4296398             -11.6911
        26        2.0000           -0.4205982             -11.4451
        27        2.0000           -0.4160862             -11.3223
        28        2.0000           -0.4099215             -11.1545
        29        2.0000           -0.3840549             -10.4507
        30        2.0000           -0.3578996              -9.7389 (HOMO)
        31                         -0.2733509              -7.4383 (LUMO)
        32                         -0.2246552              -6.1132
        33                         -0.1949484              -5.3048
        34                         -0.1910356              -5.1983
        35                         -0.1681491              -4.5756
       ...                                ...                  ...
        63                          0.7488165              20.3763
      -------------------------------------------------------------
                  HL-Gap            0.0845487 Eh            2.3007 eV
             Fermi-level           -0.3156253 Eh           -8.5886 eV

 SCC (total)                   0 d,  0 h,  0 min,  0.024 sec
 SCC setup                      ...        0 min,  0.000 sec (  0.747%)
 Dispersion                     ...        0 min,  0.000 sec (  0.784%)
 integral evaluation            ...        0 min,  0.007 sec ( 30.618%)
 zeroth order Hamiltonian       ...        0 min,  0.000 sec (  0.589%)
 iterations                     ...        0 min,  0.004 sec ( 15.557%)
 molecular gradient             ...        0 min,  0.012 sec ( 50.219%)
 printout                       ...        0 min,  0.000 sec (  1.275%)

         :::::::::::::::::::::::::::::::::::::::::::::::::::::
         ::                     SUMMARY                     ::
         :::::::::::::::::::::::::::::::::::::::::::::::::::::
         :: total energy             -31.850166270968 Eh    ::
         :: gradient norm              0.000521733257 Eh/a0 ::
         :: HOMO-LUMO gap              2.300686004438 eV    ::
         ::.................................................::
         :: SCC energy               -32.409073366786 Eh    ::
         :: -> isotropic ES            0.002585113716 Eh    ::
         :: -> anisotropic ES          0.004015959520 Eh    ::
         :: -> anisotropic XC          0.018408065116 Eh    ::
         :: -> dispersion             -0.022748282189 Eh    ::
         :: repulsion energy           0.558872875040 Eh    ::
         :: add. restraining           0.000000000000 Eh    ::
         :::::::::::::::::::::::::::::::::::::::::::::::::::::

           -------------------------------------------------
          |                Property Printout                |
           -------------------------------------------------

    * Orbital Energies and Occupations

         #    Occupation            Energy/Eh            Energy/eV
      -------------------------------------------------------------
         1        2.0000           -0.7311484             -19.8956
       ...           ...                  ...                  ...
        18        2.0000           -0.4795318             -13.0487
        19        2.0000           -0.4758025             -12.9472
        20        2.0000           -0.4701992             -12.7948
        21        2.0000           -0.4631337             -12.6025
        22        2.0000           -0.4527889             -12.3210
        23        2.0000           -0.4453390             -12.1183
        24        2.0000           -0.4366864             -11.8828
        25        2.0000           -0.4296398             -11.6911
        26        2.0000           -0.4205982             -11.4451
        27        2.0000           -0.4160862             -11.3223
        28        2.0000           -0.4099215             -11.1545
        29        2.0000           -0.3840549             -10.4507
        30        2.0000           -0.3578996              -9.7389 (HOMO)
        31                         -0.2733509              -7.4383 (LUMO)
        32                         -0.2246552              -6.1132
        33                         -0.1949484              -5.3048
        34                         -0.1910356              -5.1983
        35                         -0.1681491              -4.5756
        36                         -0.1132270              -3.0811
        37                         -0.0800157              -2.1773
        38                          0.0027880               0.0759
        39                          0.0300743               0.8184
        40                          0.0416042               1.1321
        41                          0.0936817               2.5492
       ...                                ...                  ...
        63                          0.7488165              20.3763
      -------------------------------------------------------------
                  HL-Gap            0.0845487 Eh            2.3007 eV
             Fermi-level           -0.3156253 Eh           -8.5886 eV

     #   Z        covCN         q      C6AA      α(0)
     1   6 C      2.929    -0.037    28.927     8.820
     2  16 S      2.308    -0.002   141.120    19.994
     3   6 C      2.930    -0.038    28.944     8.823
     4   6 C      3.177    -0.002    27.653     8.587
     5   6 C      3.178    -0.002    27.665     8.588
     6   6 C      2.921    -0.043    29.076     8.842
     7   6 C      2.969     0.007    27.862     8.658
     8   6 C      2.899    -0.027    28.685     8.782
     9   6 C      2.837    -0.088    30.198     9.005
    10   6 C      2.962     0.014    27.696     8.632
    11   6 C      3.759    -0.107    22.600     6.777
    12   6 C      2.915    -0.049    29.211     8.863
    13   1 H      0.926     0.040     2.448     2.447
    14   1 H      0.926     0.040     2.450     2.448
    15   1 H      0.926     0.027     2.624     2.533
    16   1 H      0.925     0.033     2.545     2.495
    17   1 H      0.926     0.042     2.428     2.437
    18   1 H      0.926     0.033     2.543     2.494
    19   1 H      0.925     0.046     2.364     2.405
    20   1 H      0.925     0.046     2.374     2.409
    21   1 H      0.925     0.040     2.447     2.446
    22   1 H      0.926     0.027     2.623     2.533

 Mol. C6AA /au·bohr⁶  :       7361.120178
 Mol. C8AA /au·bohr⁸  :     203127.748713
 Mol. α(0) /au        :        139.017600


Wiberg/Mayer (AO) data.
largest (>0.10) Wiberg bond orders for each atom
          total WBO             WBO to atom ...
     1  C   3.926        C    5 1.461    S    2 1.239    H   13 0.971    C    3 0.156
     2  S   2.722        C    1 1.239    C    3 1.232
     3  C   3.933        C    4 1.471    S    2 1.232    H   14 0.971    C    1 0.156
     4  C   3.988        C    3 1.471    C   12 1.216    C    5 1.150
     5  C   3.988        C    1 1.461    C    6 1.228    C    4 1.150
     6  C   3.991        C    7 1.550    C    5 1.228    H   15 0.967    C   12 0.108
     7  C   3.989        C    6 1.550    C   10 1.193    C    8 1.066
     8  C   3.990        C    9 1.925    C    7 1.066    H   16 0.960
     9  C   3.974        C    8 1.925    H   18 0.978    H   17 0.974
    10  C   3.988        C   12 1.595    C    7 1.193    C   11 1.026
    11  C   3.995        C   10 1.026    H   21 0.982    H   19 0.978    H   20 0.966
    12  C   3.990        C   10 1.595    C    4 1.216    H   22 0.966    C    6 0.108
    13  H   0.998        C    1 0.971
    14  H   0.998        C    3 0.971
    15  H   0.998        C    6 0.967
    16  H   0.998        C    8 0.960
    17  H   0.998        C    9 0.974
    18  H   0.998        C    9 0.978
    19  H   0.996        C   11 0.978
    20  H   0.994        C   11 0.966
    21  H   0.998        C   11 0.982
    22  H   0.998        C   12 0.966

molecular dipole:
                 x           y           z       tot (Debye)
 q only:        0.184       0.111      -0.024
   full:        0.404       0.106      -0.026       1.063
molecular quadrupole (traceless):
                xx          xy          yy          xz          yz          zz
 q only:        1.347       1.215       1.090      -0.194       0.267      -2.437
  q+dip:        0.659       0.043       5.144       0.431       1.488      -5.803
   full:       -1.001       0.291       4.076       0.343       0.804      -3.075

           -------------------------------------------------
          |                Geometry Summary                 |
           -------------------------------------------------

      molecular mass/u    :      174.2600000
   center of mass at/Å    :        0.6357107       0.0002175       0.0478471
  moments of inertia/u·Å² :        0.2293347E+03   0.1015733E+04   0.1225981E+04
rotational constants/cm⁻¹ :        0.7350667E-01   0.1659651E-01   0.1375032E-01

 * 20 selected distances

     #   Z        #   Z                                     value/Å
     1   6 C      2  16 S                                 1.7080924
     2  16 S      3   6 C                                 1.7096856 (max)
     3   6 C      4   6 C                                 1.3746122
     1   6 C      5   6 C                                 1.3761571
     4   6 C      5   6 C                                 1.4377965
     5   6 C      6   6 C                                 1.4116811
     6   6 C      7   6 C                                 1.3704047
     8   6 C      9   6 C                                 1.3253288
     4   6 C     12   6 C                                 1.4148154
    10   6 C     12   6 C                                 1.3637588
     1   6 C     13   1 H                                 1.0714352
     3   6 C     14   1 H                                 1.0714189 (min)
     6   6 C     15   1 H                                 1.0808711
     8   6 C     16   1 H                                 1.0839440
     9   6 C     17   1 H                                 1.0759682
     9   6 C     18   1 H                                 1.0772172
    11   6 C     19   1 H                                 1.0869513
    11   6 C     20   1 H                                 1.0897220
    11   6 C     21   1 H                                 1.0878900
    12   6 C     22   1 H                                 1.0808101

 * 3 distinct bonds (by element types)

   Z      Z             #   av. dist./Å        max./Å        min./Å
   1 H    6 C          10     1.0806228     1.0897220     1.0714189
   6 C    6 C           8     1.3843193     1.4377965     1.3253288
   6 C   16 S           2     1.7088890     1.7096856     1.7080924


optimized geometry written to: xtbopt.xyz


           -------------------------------------------------
          | TOTAL ENERGY              -31.850166270968 Eh   |
          | GRADIENT NORM               0.000521733257 Eh/α |
          | HOMO-LUMO GAP               2.300686004438 eV   |
           -------------------------------------------------

------------------------------------------------------------------------
 * finished run on 2021/05/19 at 10:59:32.469     
------------------------------------------------------------------------
 total:
 * wall-time:     0 d,  0 h,  0 min,  0.691 sec
 *  cpu-time:     0 d,  0 h,  0 min,  0.688 sec
 * ratio c/w:     0.996 speedup
 SCF:
 * wall-time:     0 d,  0 h,  0 min,  0.035 sec
 *  cpu-time:     0 d,  0 h,  0 min,  0.035 sec
 * ratio c/w:     0.998 speedup
 ANC optimizer:
 * wall-time:     0 d,  0 h,  0 min,  0.636 sec
 *  cpu-time:     0 d,  0 h,  0 min,  0.635 sec
 * ratio c/w:     0.998 speedup

