      -----------------------------------------------------------      
     |                   =====================                   |     
     |                           x T B                           |     
     |                   =====================                   |     
     |                         S. Grimme                         |     
     |          Mulliken Center for Theoretical Chemistry        |     
     |                    University of Bonn                     |     
     |                Version 6.2 RC2 (SAW190805)                |     
      -----------------------------------------------------------      

   This program is distributed in the hope that it will be useful,
   but WITHOUT ANY WARRANTY; without even the implied warranty of
   MERCHANTABILITY or FITNESS FOR A PARTICULAR PURPOSE.
   
   FOR NON-COMMERCIAL, ACADEMIA USE ONLY.
   
   Cite this work as:
   * S. Grimme, C. Bannwarth, P. Shushkov, J. Chem. Theory Comput., 2017,
     13, 1989-2009. DOI: 10.1021/acs.jctc.7b00118
   * C. Bannwarth, S. Ehlert and S. Grimme., J. Chem. Theory Comput., 2019,
     15, 1652-1671. DOI: 10.1021/acs.jctc.8b01176
   * P. Pracht, E. Caldeweyher, S. Ehlert, S. Grimme, ChemRxiv, 2019, preprint.
     DOI: 10.26434/chemrxiv.8326202.v1
   
   for DFT-D4:
   * E. Caldeweyher, C. Bannwarth and S. Grimme, J. Chem. Phys., 2017,
     147, 034112. DOI: 10.1063/1.4993215
   * E. Caldeweyher, S. Ehlert, A. Hansen, H. Neugebauer, S. Spicher,
     C. Bannwarth and S. Grimme, J. Chem. Phys., 2019, 150, 154122.
     DOI: 10.1063/1.5090222
   
   for sTDA-xTB:
   * S. Grimme and C. Bannwarth, J. Chem. Phys., 2016, 145, 054103.
     DOI: 10.1063/1.4959605
   
   in the mass-spec context:
   * V. Asgeirsson, C. Bauer and S. Grimme, Chem. Sci., 2017, 8, 4879.
     DOI: 10.1039/c7sc00601b
   
   for metadynamics refer to:
   * S. Grimme, J. Chem. Theory Comput., 2019, 155, 2847-2862
     DOI: 10.1021/acs.jctc.9b00143
   
   with help from (in alphabetical order)
   C. Bannwarth, F. Bohle, G. Brandenburg, E. Caldeweyher, M. Checinski,
   S. Dohm, S. Ehlert, S. Ehrlich, F. März, H. Neugebauer, J. Pisarek,
   P. Pracht, P. Shushkov, and S. Spicher.
   
 * started run on 2021/05/19 at 10:59:32.621     

           -------------------------------------------------
          |                Calculation Setup                |
           -------------------------------------------------

          program call               : /ihome/ghutchison/geoffh/xtb/xtb 541.xyz -opt
          hostname                   : smp-n144
          coordinate file            : 541.xyz
          omp threads                :                     1
          number of atoms            :                    21
          number of electrons        :                    61
          charge                     :                     0
          spin                       :                   0.5
          first test random number   :      0.12326436139525


########################################################################
# WARNING! Please study the warnings concerning your input carefully
#  - the use of '-opt' is discouraged, please use '--opt' next time
########################################################################

           ------------------------------------------------- 
          |                 G F N 2 - x T B                 |
          | Geometry, Frequencies, Noncovalent interactions |
          |            JCTC 2019 parametrisation            |
           ------------------------------------------------- 
             KAB for C  - Si     :                1.0500
             KAB for H  - Pd     :                0.9500
             k(s)              :                1.8500
             k(p)              :                2.2300
             k(d)              :                2.2300
             k(f)              :                2.0000
             kEN (H0ij)        :               -2.0000
             D4 a1             :                0.5200
             D4 a2             :                5.0000
             D4 s6             :                1.0000
             D4 s8             :                2.7000
             D4 s9             :                5.0000
             alphaj            :                2.0000

  Z AO/shell   Hii/eV     exponent
  1     Wed Apr 25 08:07:45 CEST 2018   EN: 2.200 GM2: 0.406  GM3: 0.0800  RAES: 1.40
     1s    -10.707211    1.230000
  6     Wed Apr 25 08:07:45 CEST 2018   EN: 2.550 GM2: 0.538  GM3: 0.1500  RAES: 3.00
     2s    -13.970922    2.096432
     2p    -10.063292    1.800000
  7     Wed Apr 25 08:07:45 CEST 2018   EN: 3.040 GM2: 0.461  GM3:-0.0640  RAES: 1.90
     2s    -16.686243    2.339881
     2p    -12.523956    2.014332
  8     Wed Apr 25 08:07:45 CEST 2018   EN: 3.440 GM2: 0.452  GM3:-0.0517  RAES: 1.80
     2s    -20.229985    2.439742
     2p    -15.503117    2.137023
 16     Tue Apr 24 11:44:34 CEST 2018   EN: 2.580 GM2: 0.340  GM3:-0.0502  RAES: 3.10
     3s    -20.029654    1.981333
     3p    -11.377694    2.025643
     3d     -0.420282    1.702555

           ------------------------------------------------- 
          |        Self-Consistent Charge Iterations        |
           ------------------------------------------------- 

          ...................................................
          :                      SETUP                      :
          :.................................................:
          :  # basis functions                  66          :
          :  # atomic orbitals                  64          :
          :  # shells                           34          :
          :  # electrons                        61          :
          :  max. iterations                   250          :
          :  Hamiltonian                  GFN2-xTB          :
          :  restarted?                      false          :
          :  GBSA solvation                  false          :
          :  PC potential                    false          :
          :  electronic temp.          300.0000000     K    :
          :  accuracy                    1.0000000          :
          :  -> integral cutoff          0.2500000E+02      :
          :  -> integral neglect         0.1000000E-07      :
          :  -> SCF convergence          0.1000000E-05 Eh   :
          :  -> wf. convergence          0.1000000E-03 e    :
          :  Broyden damping             0.4000000          :
          ...................................................

 iter      E             dE          RMSdq      gap      omega  full diag
   1    -33.7473112 -0.337473E+02  0.472E+00    1.39       0.0  T
   2    -33.7983367 -0.510255E-01  0.278E+00    1.29       1.0  T
   3    -33.8000066 -0.166992E-02  0.123E+00    1.33       1.0  T
   4    -33.8044474 -0.444073E-02  0.417E-01    1.33       1.0  T
   5    -33.8050596 -0.612278E-03  0.186E-01    1.31       1.0  T
   6    -33.8051797 -0.120097E-03  0.779E-02    1.33       1.0  T
   7    -33.8052449 -0.651296E-04  0.312E-02    1.32       1.0  T
   8    -33.8052503 -0.543393E-05  0.168E-02    1.32       1.3  T
   9    -33.8052518 -0.150927E-05  0.565E-03    1.32       3.9  T
  10    -33.8052519 -0.146870E-06  0.273E-03    1.32       8.0  T
  11    -33.8052520 -0.544353E-07  0.101E-03    1.32      21.5  T
  12    -33.8052520 -0.388228E-08  0.464E-04    1.32      47.1  T
  13    -33.8052520 -0.466528E-09  0.107E-04    1.32     204.8  T

   *** convergence criteria satisfied after 13 iterations ***

         #    Occupation            Energy/Eh            Energy/eV
      -------------------------------------------------------------
         1        2.0000           -0.7440820             -20.2475
       ...           ...                  ...                  ...
        25        2.0000           -0.4467780             -12.1574
        26        2.0000           -0.4346105             -11.8264
        27        2.0000           -0.4185879             -11.3904
        28        2.0000           -0.3831933             -10.4272
        29        2.0000           -0.3728697             -10.1463
        30        2.0000           -0.3523368              -9.5876
        31        1.0000           -0.2695622              -7.3352 (HOMO)
        32                         -0.2210526              -6.0151 (LUMO)
        33                         -0.1982474              -5.3946
        34                         -0.1972262              -5.3668
        35                         -0.1540861              -4.1929
        36                         -0.1206571              -3.2832
       ...                                ...                  ...
        64                          0.6866869              18.6857
      -------------------------------------------------------------
                  HL-Gap            0.0485096 Eh            1.3200 eV
             Fermi-level           -0.2781284 Eh           -7.5683 eV

 SCC (total)                   0 d,  0 h,  0 min,  0.036 sec
 SCC setup                      ...        0 min,  0.000 sec (  0.693%)
 Dispersion                     ...        0 min,  0.000 sec (  0.567%)
 integral evaluation            ...        0 min,  0.008 sec ( 23.813%)
 zeroth order Hamiltonian       ...        0 min,  0.000 sec (  0.447%)
 iterations                     ...        0 min,  0.014 sec ( 38.002%)
 molecular gradient             ...        0 min,  0.013 sec ( 35.289%)
 printout                       ...        0 min,  0.000 sec (  1.026%)

         :::::::::::::::::::::::::::::::::::::::::::::::::::::
         ::                     SUMMARY                     ::
         :::::::::::::::::::::::::::::::::::::::::::::::::::::
         :: total energy             -33.438847558016 Eh    ::
         :: gradient norm              0.117505331183 Eh/a0 ::
         :: HOMO-LUMO gap              1.320014609037 eV    ::
         ::.................................................::
         :: SCC energy               -33.805252006622 Eh    ::
         :: -> isotropic ES            0.028420196860 Eh    ::
         :: -> anisotropic ES          0.003972741012 Eh    ::
         :: -> anisotropic XC          0.015158617625 Eh    ::
         :: -> dispersion             -0.021590470692 Eh    ::
         :: repulsion energy           0.366349036288 Eh    ::
         :: add. restraining           0.000000000000 Eh    ::
         :::::::::::::::::::::::::::::::::::::::::::::::::::::

      ----------------------------------------------------------- 
     |                   =====================                   |
     |                        A N C O P T                        |
     |                   =====================                   |
     |               Approximate Normal Coordinate               |
     |                Rational Function Optimizer                |
      ----------------------------------------------------------- 

          ...................................................
          :                      SETUP                      :
          :.................................................:
          :   optimization level            normal          :
          :   max. optcycles                   200          :
          :   ANC micro-cycles                  20          :
          :   degrees of freedom                57          :
          :.................................................:
          :   RF solver                   davidson          :
          :   input Hessian                  false          :
          :   write xtbopt.log                true          :
          :   linear?                        false          :
          :   energy convergence         0.5000000E-05 Eh   :
          :   grad. convergence          0.1000000E-02 Eh/α :
          :   maximium RF displ.         2.0000000          :
          :   Hlow (freq-cutoff)         0.5000000E-02      :
          :   Hmax (freq-cutoff)         5.0000000          :
          :   S6 in model hess.         20.0000000          :
          ...................................................

generating ANC from model Hessian ...
Using Lindh-Hessian (1995)
 Shifting diagonal of input Hessian by   3.636328027762834E-003
 Lowest  eigenvalues of input Hessian
   -0.000000   -0.000000   -0.000000   -0.000000    0.000000    0.000000
    0.005000    0.006555    0.007946    0.012259    0.013220    0.018396
    0.018893    0.026445    0.031029    0.032834    0.041295    0.048819
 Highest eigenvalues
    1.387216    1.424702    1.638188    1.751722    1.825399    2.001750
 

........................................................................
.............................. CYCLE    1 ..............................
........................................................................
   1    -33.8052520 -0.338053E+02  0.280E-05    1.32       0.0  T
   2    -33.8052520 -0.120792E-11  0.191E-05    1.32    1141.3  T
   3    -33.8052520 -0.426326E-12  0.139E-05    1.32    1572.5  T
     SCC iter.                  ...        0 min,  0.004 sec
     gradient                   ...        0 min,  0.012 sec
 * total energy  :   -33.4388476 Eh     change       -0.4940262E-09 Eh
   gradient norm :     0.1175051 Eh/α   predicted     0.0000000E+00 (-100.00%)
   displ. norm   :     0.3916224 α      lambda       -0.1827007E-01
   maximum displ.:     0.2386296 α      in ANC's #6, #7, #20, ...

........................................................................
.............................. CYCLE    2 ..............................
........................................................................
   1    -33.8158022 -0.338158E+02  0.594E-01    1.71       0.0  T
   2    -33.8160569 -0.254689E-03  0.278E-01    1.72       1.0  T
   3    -33.8159819  0.750172E-04  0.117E-01    1.71       1.0  T
   4    -33.8161207 -0.138830E-03  0.460E-02    1.73       1.0  T
   5    -33.8161290 -0.833212E-05  0.191E-02    1.72       1.1  T
   6    -33.8161297 -0.616414E-06  0.697E-03    1.72       3.1  T
   7    -33.8161302 -0.572909E-06  0.268E-03    1.72       8.1  T
   8    -33.8161302  0.281678E-08  0.142E-03    1.72      15.4  T
     SCC iter.                  ...        0 min,  0.008 sec
     gradient                   ...        0 min,  0.012 sec
 * total energy  :   -33.4527397 Eh     change       -0.1389218E-01 Eh
   gradient norm :     0.0658867 Eh/α   predicted    -0.1053606E-01 ( -24.16%)
   displ. norm   :     0.3671308 α      lambda       -0.1106656E-01
   maximum displ.:     0.1827576 α      in ANC's #6, #7, #22, ...

........................................................................
.............................. CYCLE    3 ..............................
........................................................................
   1    -33.8262450 -0.338262E+02  0.564E-01    2.16       0.0  T
   2    -33.8266588 -0.413753E-03  0.286E-01    2.16       1.0  T
   3    -33.8266050  0.537782E-04  0.128E-01    2.15       1.0  T
   4    -33.8267441 -0.139071E-03  0.535E-02    2.16       1.0  T
   5    -33.8267688 -0.246958E-04  0.267E-02    2.16       1.0  T
   6    -33.8267705 -0.173099E-05  0.669E-03    2.15       3.3  T
   7    -33.8267708 -0.326299E-06  0.327E-03    2.15       6.7  T
   8    -33.8267709 -0.884243E-07  0.193E-03    2.15      11.3  T
     SCC iter.                  ...        0 min,  0.008 sec
     gradient                   ...        0 min,  0.012 sec
 * total energy  :   -33.4593603 Eh     change       -0.6620557E-02 Eh
   gradient norm :     0.0251969 Eh/α   predicted    -0.6279082E-02 (  -5.16%)
   displ. norm   :     0.2449014 α      lambda       -0.1686351E-02
   maximum displ.:     0.1220365 α      in ANC's #7, #4, #6, ...

........................................................................
.............................. CYCLE    4 ..............................
........................................................................
   1    -33.8275116 -0.338275E+02  0.253E-01    2.23       0.0  T
   2    -33.8275785 -0.669346E-04  0.138E-01    2.23       1.0  T
   3    -33.8275761  0.242980E-05  0.499E-02    2.22       1.0  T
   4    -33.8275909 -0.148472E-04  0.190E-02    2.22       1.2  T
   5    -33.8275916 -0.661147E-06  0.107E-02    2.22       2.0  T
   6    -33.8275927 -0.112369E-05  0.239E-03    2.22       9.1  T
   7    -33.8275927 -0.186784E-07  0.131E-03    2.22      16.7  T
     SCC iter.                  ...        0 min,  0.007 sec
     gradient                   ...        0 min,  0.012 sec
 * total energy  :   -33.4606182 Eh     change       -0.1257918E-02 Eh
   gradient norm :     0.0216875 Eh/α   predicted    -0.8937462E-03 ( -28.95%)
   displ. norm   :     0.2996114 α      lambda       -0.1425939E-02
   maximum displ.:     0.1617306 α      in ANC's #5, #4, #7, ...

........................................................................
.............................. CYCLE    5 ..............................
........................................................................
   1    -33.8268724 -0.338269E+02  0.305E-01    2.26       0.0  T
   2    -33.8269688 -0.963374E-04  0.176E-01    2.26       1.0  T
   3    -33.8269659  0.287193E-05  0.675E-02    2.25       1.0  T
   4    -33.8269901 -0.241524E-04  0.176E-02    2.25       1.2  T
   5    -33.8269899  0.123832E-06  0.908E-03    2.25       2.4  T
   6    -33.8269908 -0.824346E-06  0.330E-03    2.25       6.6  T
   7    -33.8269908 -0.678963E-07  0.143E-03    2.25      15.2  T
     SCC iter.                  ...        0 min,  0.007 sec
     gradient                   ...        0 min,  0.011 sec
 * total energy  :   -33.4616184 Eh     change       -0.1000197E-02 Eh
   gradient norm :     0.0173372 Eh/α   predicted    -0.7769747E-03 ( -22.32%)
   displ. norm   :     0.2244710 α      lambda       -0.7793352E-03
   maximum displ.:     0.1441575 α      in ANC's #5, #4, #7, ...

........................................................................
.............................. CYCLE    6 ..............................
........................................................................
   1    -33.8268516 -0.338269E+02  0.251E-01    2.27       0.0  T
   2    -33.8269363 -0.847154E-04  0.147E-01    2.27       1.0  T
   3    -33.8269362  0.718941E-07  0.649E-02    2.26       1.0  T
   4    -33.8269579 -0.216477E-04  0.170E-02    2.26       1.3  T
   5    -33.8269583 -0.477179E-06  0.104E-02    2.26       2.1  T
   6    -33.8269594 -0.102977E-05  0.304E-03    2.26       7.2  T
   7    -33.8269594 -0.465850E-07  0.146E-03    2.26      14.9  T
   8    -33.8269594 -0.107733E-07  0.622E-04    2.26      35.1  T
     SCC iter.                  ...        0 min,  0.008 sec
     gradient                   ...        0 min,  0.012 sec
 * total energy  :   -33.4621723 Eh     change       -0.5538882E-03 Eh
   gradient norm :     0.0124421 Eh/α   predicted    -0.4093042E-03 ( -26.10%)
   displ. norm   :     0.1591831 α      lambda       -0.4901145E-03
   maximum displ.:     0.1073638 α      in ANC's #5, #4, #1, ...

........................................................................
.............................. CYCLE    7 ..............................
........................................................................
   1    -33.8284927 -0.338285E+02  0.204E-01    2.28       0.0  T
   2    -33.8285743 -0.815457E-04  0.120E-01    2.27       1.0  T
   3    -33.8285835 -0.921700E-05  0.563E-02    2.27       1.0  T
   4    -33.8285990 -0.154788E-04  0.180E-02    2.26       1.2  T
   5    -33.8286002 -0.125330E-05  0.104E-02    2.26       2.1  T
   6    -33.8286011 -0.893010E-06  0.270E-03    2.26       8.1  T
   7    -33.8286011 -0.388565E-07  0.131E-03    2.26      16.7  T
     SCC iter.                  ...        0 min,  0.007 sec
     gradient                   ...        0 min,  0.012 sec
 * total energy  :   -33.4624973 Eh     change       -0.3250417E-03 Eh
   gradient norm :     0.0061264 Eh/α   predicted    -0.2512747E-03 ( -22.69%)
   displ. norm   :     0.0846601 α      lambda       -0.1612363E-03
   maximum displ.:     0.0468708 α      in ANC's #5, #4, #7, ...

........................................................................
.............................. CYCLE    8 ..............................
........................................................................
   1    -33.8292683 -0.338293E+02  0.117E-01    2.28       0.0  T
   2    -33.8292956 -0.273083E-04  0.689E-02    2.27       1.0  T
   3    -33.8292990 -0.342341E-05  0.321E-02    2.27       1.0  T
   4    -33.8293048 -0.577086E-05  0.109E-02    2.27       2.0  T
   5    -33.8293052 -0.390771E-06  0.593E-03    2.27       3.7  T
   6    -33.8293055 -0.294747E-06  0.156E-03    2.27      14.0  T
   7    -33.8293055 -0.129937E-07  0.767E-04    2.27      28.5  T
     SCC iter.                  ...        0 min,  0.007 sec
     gradient                   ...        0 min,  0.012 sec
 * total energy  :   -33.4626040 Eh     change       -0.1066572E-03 Eh
   gradient norm :     0.0034127 Eh/α   predicted    -0.8120475E-04 ( -23.86%)
   displ. norm   :     0.0584793 α      lambda       -0.6556827E-04
   maximum displ.:     0.0321085 α      in ANC's #7, #4, #1, ...

........................................................................
.............................. CYCLE    9 ..............................
........................................................................
   1    -33.8298390 -0.338298E+02  0.674E-02    2.28       0.0  T
   2    -33.8298478 -0.879325E-05  0.395E-02    2.28       1.0  T
   3    -33.8298491 -0.137106E-05  0.189E-02    2.28       1.2  T
   4    -33.8298508 -0.165912E-05  0.668E-03    2.28       3.3  T
   5    -33.8298510 -0.172452E-06  0.349E-03    2.28       6.2  T
   6    -33.8298511 -0.989384E-07  0.836E-04    2.28      26.1  T
   7    -33.8298511 -0.464357E-08  0.420E-04    2.28      52.0  T
     SCC iter.                  ...        0 min,  0.007 sec
     gradient                   ...        0 min,  0.013 sec
 * total energy  :   -33.4626493 Eh     change       -0.4534473E-04 Eh
   gradient norm :     0.0028890 Eh/α   predicted    -0.3289861E-04 ( -27.45%)
   displ. norm   :     0.0736088 α      lambda       -0.4733125E-04
   maximum displ.:     0.0364393 α      in ANC's #2, #1, #7, ...

........................................................................
.............................. CYCLE   10 ..............................
........................................................................
   1    -33.8295716 -0.338296E+02  0.630E-02    2.29       0.0  T
   2    -33.8295760 -0.440494E-05  0.367E-02    2.29       1.0  T
   3    -33.8295758  0.158507E-06  0.168E-02    2.29       1.3  T
   4    -33.8295775 -0.161416E-05  0.530E-03    2.29       4.1  T
   5    -33.8295775 -0.657934E-07  0.248E-03    2.29       8.8  T
   6    -33.8295776 -0.650290E-07  0.663E-04    2.29      32.9  T
   7    -33.8295776 -0.209816E-08  0.351E-04    2.29      62.2  T
     SCC iter.                  ...        0 min,  0.007 sec
     gradient                   ...        0 min,  0.012 sec
 * total energy  :   -33.4626824 Eh     change       -0.3305045E-04 Eh
   gradient norm :     0.0019938 Eh/α   predicted    -0.2380627E-04 ( -27.97%)
   displ. norm   :     0.1248662 α      lambda       -0.3632813E-04
   maximum displ.:     0.0667403 α      in ANC's #1, #2, #7, ...

........................................................................
.............................. CYCLE   11 ..............................
........................................................................
   1    -33.8294391 -0.338294E+02  0.855E-02    2.31       0.0  T
   2    -33.8294438 -0.469360E-05  0.483E-02    2.30       1.0  T
   3    -33.8294431  0.724339E-06  0.189E-02    2.30       1.2  T
   4    -33.8294451 -0.208789E-05  0.635E-03    2.30       3.4  T
   5    -33.8294452 -0.885347E-07  0.269E-03    2.30       8.1  T
   6    -33.8294453 -0.658503E-07  0.106E-03    2.30      20.5  T
   7    -33.8294453 -0.648532E-08  0.561E-04    2.30      38.9  T
   8    -33.8294453 -0.376751E-09  0.270E-04    2.30      80.9  T
     SCC iter.                  ...        0 min,  0.008 sec
     gradient                   ...        0 min,  0.012 sec
 * total energy  :   -33.4627123 Eh     change       -0.2990642E-04 Eh
   gradient norm :     0.0022913 Eh/α   predicted    -0.1829085E-04 ( -38.84%)
   displ. norm   :     0.0375949 α      lambda       -0.1650264E-04
   maximum displ.:     0.0226037 α      in ANC's #2, #1, #3, ...

........................................................................
.............................. CYCLE   12 ..............................
........................................................................
   1    -33.8292700 -0.338293E+02  0.264E-02    2.31       0.0  T
   2    -33.8292703 -0.225123E-06  0.140E-02    2.31       1.6  T
   3    -33.8292702  0.760929E-07  0.377E-03    2.31       5.8  T
   4    -33.8292703 -0.132237E-06  0.186E-03    2.31      11.7  T
   5    -33.8292703 -0.217471E-07  0.562E-04    2.31      38.9  T
   6    -33.8292703 -0.200008E-08  0.289E-04    2.31      75.4  T
     SCC iter.                  ...        0 min,  0.006 sec
     gradient                   ...        0 min,  0.012 sec
 * total energy  :   -33.4627251 Eh     change       -0.1277552E-04 Eh
   gradient norm :     0.0017490 Eh/α   predicted    -0.8263294E-05 ( -35.32%)
   displ. norm   :     0.0975185 α      lambda       -0.2017753E-04
   maximum displ.:     0.0597737 α      in ANC's #2, #1, #3, ...

........................................................................
.............................. CYCLE   13 ..............................
........................................................................
   1    -33.8293250 -0.338293E+02  0.698E-02    2.31       0.0  T
   2    -33.8293268 -0.175013E-05  0.370E-02    2.31       1.0  T
   3    -33.8293267  0.495450E-07  0.964E-03    2.31       2.3  T
   4    -33.8293273 -0.564276E-06  0.439E-03    2.31       5.0  T
   5    -33.8293273 -0.205888E-07  0.126E-03    2.31      17.3  T
   6    -33.8293273 -0.934644E-08  0.776E-04    2.31      28.1  T
   7    -33.8293273 -0.177121E-08  0.382E-04    2.31      57.2  T
     SCC iter.                  ...        0 min,  0.007 sec
     gradient                   ...        0 min,  0.012 sec
 * total energy  :   -33.4627394 Eh     change       -0.1431643E-04 Eh
   gradient norm :     0.0019333 Eh/α   predicted    -0.1013317E-04 ( -29.22%)
   displ. norm   :     0.0332463 α      lambda       -0.5569384E-05
   maximum displ.:     0.0215270 α      in ANC's #2, #1, #3, ...

........................................................................
.............................. CYCLE   14 ..............................
........................................................................
   1    -33.8293494 -0.338293E+02  0.240E-02    2.31       0.0  T
   2    -33.8293499 -0.562947E-06  0.138E-02    2.31       1.6  T
   3    -33.8293497  0.231704E-06  0.649E-03    2.31       3.4  T
   4    -33.8293502 -0.465073E-06  0.185E-03    2.31      11.8  T
   5    -33.8293502 -0.140094E-07  0.996E-04    2.31      21.9  T
   6    -33.8293502 -0.822453E-08  0.310E-04    2.31      70.4  T
     SCC iter.                  ...        0 min,  0.006 sec
     gradient                   ...        0 min,  0.012 sec
 * total energy  :   -33.4627464 Eh     change       -0.7005886E-05 Eh
   gradient norm :     0.0015134 Eh/α   predicted    -0.2789828E-05 ( -60.18%)
   displ. norm   :     0.0829349 α      lambda       -0.1278610E-04
   maximum displ.:     0.0550004 α      in ANC's #2, #1, #3, ...

........................................................................
.............................. CYCLE   15 ..............................
........................................................................
   1    -33.8296869 -0.338297E+02  0.560E-02    2.30       0.0  T
   2    -33.8296882 -0.126138E-05  0.315E-02    2.30       1.0  T
   3    -33.8296864  0.173312E-05  0.122E-02    2.30       1.8  T
   4    -33.8296888 -0.240027E-05  0.306E-03    2.30       7.1  T
   5    -33.8296889 -0.230701E-07  0.165E-03    2.30      13.3  T
   6    -33.8296889 -0.170342E-07  0.617E-04    2.30      35.4  T
   7    -33.8296889 -0.256740E-09  0.386E-04    2.30      56.5  T
     SCC iter.                  ...        0 min,  0.007 sec
     gradient                   ...        0 min,  0.012 sec
 * total energy  :   -33.4627596 Eh     change       -0.1315799E-04 Eh
   gradient norm :     0.0013697 Eh/α   predicted    -0.6416274E-05 ( -51.24%)
   displ. norm   :     0.1384207 α      lambda       -0.1216608E-04
   maximum displ.:     0.0923324 α      in ANC's #2, #1, #3, ...

........................................................................
.............................. CYCLE   16 ..............................
........................................................................
   1    -33.8291043 -0.338291E+02  0.898E-02    2.30       0.0  T
   2    -33.8291065 -0.222212E-05  0.504E-02    2.30       1.0  T
   3    -33.8291055  0.105554E-05  0.118E-02    2.30       1.9  T
   4    -33.8291074 -0.196446E-05  0.428E-03    2.30       5.1  T
   5    -33.8291075 -0.745674E-07  0.207E-03    2.30      10.5  T
   6    -33.8291075 -0.259956E-07  0.881E-04    2.30      24.8  T
   7    -33.8291075 -0.152118E-08  0.449E-04    2.30      48.5  T
     SCC iter.                  ...        0 min,  0.007 sec
     gradient                   ...        0 min,  0.012 sec
 * total energy  :   -33.4627718 Eh     change       -0.1221393E-04 Eh
   gradient norm :     0.0027815 Eh/α   predicted    -0.6139036E-05 ( -49.74%)
   displ. norm   :     0.1224837 α      lambda       -0.1693142E-04
   maximum displ.:     0.0838704 α      in ANC's #2, #1, #3, ...

........................................................................
.............................. CYCLE   17 ..............................
........................................................................
   1    -33.8291248 -0.338291E+02  0.814E-02    2.30       0.0  T
   2    -33.8291265 -0.170397E-05  0.452E-02    2.30       1.0  T
   3    -33.8291267 -0.196360E-06  0.722E-03    2.30       3.0  T
   4    -33.8291271 -0.409112E-06  0.373E-03    2.30       5.8  T
   5    -33.8291272 -0.103737E-06  0.115E-03    2.30      19.0  T
   6    -33.8291272 -0.965180E-09  0.650E-04    2.30      33.6  T
   7    -33.8291272 -0.143442E-08  0.341E-04    2.30      64.1  T
     SCC iter.                  ...        0 min,  0.007 sec
     gradient                   ...        0 min,  0.012 sec
 * total energy  :   -33.4627862 Eh     change       -0.1440121E-04 Eh
   gradient norm :     0.0031528 Eh/α   predicted    -0.8596820E-05 ( -40.30%)
   displ. norm   :     0.2342857 α      lambda       -0.3927729E-04
   maximum displ.:     0.1627651 α      in ANC's #2, #1, #3, ...

........................................................................
.............................. CYCLE   18 ..............................
........................................................................
   1    -33.8289853 -0.338290E+02  0.158E-01    2.29       0.0  T
   2    -33.8289922 -0.682809E-05  0.876E-02    2.30       1.0  T
   3    -33.8289931 -0.886048E-06  0.147E-02    2.30       1.5  T
   4    -33.8289946 -0.157958E-05  0.665E-03    2.30       3.3  T
   5    -33.8289949 -0.215899E-06  0.299E-03    2.30       7.3  T
   6    -33.8289949 -0.561066E-07  0.139E-03    2.30      15.7  T
   7    -33.8289949 -0.507949E-08  0.567E-04    2.30      38.5  T
   8    -33.8289949 -0.840743E-09  0.301E-04    2.30      72.5  T
     SCC iter.                  ...        0 min,  0.008 sec
     gradient                   ...        0 min,  0.012 sec
 * total energy  :   -33.4628160 Eh     change       -0.2982230E-04 Eh
   gradient norm :     0.0031949 Eh/α   predicted    -0.2071715E-04 ( -30.53%)
   displ. norm   :     0.2139503 α      lambda       -0.4324734E-04
   maximum displ.:     0.1473911 α      in ANC's #2, #1, #3, ...

........................................................................
.............................. CYCLE   19 ..............................
........................................................................
   1    -33.8292461 -0.338292E+02  0.149E-01    2.29       0.0  T
   2    -33.8292533 -0.721615E-05  0.822E-02    2.29       1.0  T
   3    -33.8292528  0.575053E-06  0.174E-02    2.29       1.3  T
   4    -33.8292559 -0.318252E-05  0.624E-03    2.29       3.5  T
   5    -33.8292560 -0.988423E-07  0.338E-03    2.29       6.5  T
   6    -33.8292561 -0.912248E-07  0.132E-03    2.29      16.5  T
   7    -33.8292561 -0.308947E-08  0.633E-04    2.29      34.5  T
   8    -33.8292561 -0.165844E-08  0.341E-04    2.29      64.0  T
     SCC iter.                  ...        0 min,  0.008 sec
     gradient                   ...        0 min,  0.012 sec
 * total energy  :   -33.4628468 Eh     change       -0.3084492E-04 Eh
   gradient norm :     0.0023494 Eh/α   predicted    -0.2262082E-04 ( -26.66%)
   displ. norm   :     0.1554522 α      lambda       -0.2696040E-04
   maximum displ.:     0.1061604 α      in ANC's #2, #1, #3, ...

........................................................................
.............................. CYCLE   20 ..............................
........................................................................
   1    -33.8295223 -0.338295E+02  0.106E-01    2.29       0.0  T
   2    -33.8295253 -0.307773E-05  0.581E-02    2.29       1.0  T
   3    -33.8295255 -0.104978E-06  0.101E-02    2.29       2.2  T
   4    -33.8295265 -0.102513E-05  0.438E-03    2.29       5.0  T
   5    -33.8295266 -0.113858E-06  0.155E-03    2.29      14.1  T
   6    -33.8295266 -0.636393E-08  0.893E-04    2.29      24.4  T
   7    -33.8295266 -0.229360E-08  0.421E-04    2.29      51.9  T
     SCC iter.                  ...        0 min,  0.007 sec
     gradient                   ...        0 min,  0.012 sec
 * total energy  :   -33.4628662 Eh     change       -0.1937991E-04 Eh
   gradient norm :     0.0016768 Eh/α   predicted    -0.1382788E-04 ( -28.65%)
   displ. norm   :     0.3513707 α      lambda       -0.2071383E-04
   maximum displ.:     0.2454303 α      in ANC's #2, #1, #3, ...
 * RMSD in coord.:     0.4530304 α      energy gain  -0.2401866E-01 Eh

generating ANC from model Hessian ...
Using Lindh-Hessian (1995)
 Shifting diagonal of input Hessian by   3.952603129989102E-003
 Lowest  eigenvalues of input Hessian
   -0.000000   -0.000000   -0.000000   -0.000000   -0.000000    0.000000
    0.005000    0.006306    0.007005    0.011038    0.011652    0.013293
    0.016633    0.024238    0.026197    0.032565    0.041939    0.047924
 Highest eigenvalues
    1.396045    1.475895    1.542682    1.729737    1.860717    2.003828
 

........................................................................
.............................. CYCLE   21 ..............................
........................................................................
   1    -33.8279614 -0.338280E+02  0.239E-01    2.29       0.0  T
   2    -33.8279758 -0.144135E-04  0.132E-01    2.29       1.0  T
   3    -33.8279793 -0.344264E-05  0.191E-02    2.29       1.1  T
   4    -33.8279810 -0.173175E-05  0.931E-03    2.29       2.3  T
   5    -33.8279817 -0.645382E-06  0.365E-03    2.29       6.0  T
   6    -33.8279817 -0.565589E-07  0.212E-03    2.29      10.3  T
   7    -33.8279817 -0.136537E-07  0.830E-04    2.29      26.3  T
   8    -33.8279817 -0.289677E-08  0.459E-04    2.29      47.6  T
     SCC iter.                  ...        0 min,  0.008 sec
     gradient                   ...        0 min,  0.012 sec
 * total energy  :   -33.4628606 Eh     change        0.5585823E-05 Eh
   gradient norm :     0.0053598 Eh/α   predicted     0.0000000E+00 (-100.00%)
   displ. norm   :     0.0260405 α      lambda       -0.5758081E-04
   maximum displ.:     0.0143404 α      in ANC's #2, #4, #5, ...

........................................................................
.............................. CYCLE   22 ..............................
........................................................................
   1    -33.8294086 -0.338294E+02  0.264E-02    2.30       0.0  T
   2    -33.8294094 -0.840903E-06  0.141E-02    2.29       1.5  T
   3    -33.8294092  0.232112E-06  0.706E-03    2.29       3.1  T
   4    -33.8294097 -0.547655E-06  0.212E-03    2.29      10.3  T
   5    -33.8294098 -0.560156E-08  0.120E-03    2.29      18.2  T
     SCC iter.                  ...        0 min,  0.005 sec
     gradient                   ...        0 min,  0.012 sec
 * total energy  :   -33.4628971 Eh     change       -0.3642283E-04 Eh
   gradient norm :     0.0019247 Eh/α   predicted    -0.2881249E-04 ( -20.89%)
   displ. norm   :     0.0390534 α      lambda        0.1267935E-04
   maximum displ.:     0.0215120 α      in ANC's #2, #4, #5, ...

........................................................................
.............................. CYCLE   23 ..............................
........................................................................
   1    -33.8314949 -0.338315E+02  0.397E-02    2.30       0.0  T
   2    -33.8314968 -0.187290E-05  0.212E-02    2.29       1.0  T
   3    -33.8314963  0.517186E-06  0.105E-02    2.29       2.1  T
   4    -33.8314975 -0.120741E-05  0.317E-03    2.29       6.9  T
   5    -33.8314975 -0.872619E-08  0.180E-03    2.29      12.1  T
   6    -33.8314975 -0.237325E-07  0.406E-04    2.29      53.8  T
   7    -33.8314975 -0.810289E-09  0.189E-04    2.29     115.5  T
     SCC iter.                  ...        0 min,  0.007 sec
     gradient                   ...        0 min,  0.012 sec
 * total energy  :   -33.4628718 Eh     change        0.2521518E-04 Eh
   gradient norm :     0.0044517 Eh/α   predicted     0.6342119E-05 ( -74.85%)
   displ. norm   :     0.0131324 α      lambda       -0.4208423E-04
   maximum displ.:     0.0056652 α      in ANC's #26, #37, #7, ...

........................................................................
.............................. CYCLE   24 ..............................
........................................................................
   1    -33.8304597 -0.338305E+02  0.125E-02    2.29       0.0  T
   2    -33.8304599 -0.182070E-06  0.682E-03    2.30       3.2  T
   3    -33.8304599  0.467749E-07  0.340E-03    2.29       6.4  T
   4    -33.8304600 -0.101786E-06  0.103E-03    2.29      21.2  T
   5    -33.8304600 -0.255697E-08  0.584E-04    2.29      37.3  T
     SCC iter.                  ...        0 min,  0.005 sec
     gradient                   ...        0 min,  0.011 sec
 * total energy  :   -33.4629006 Eh     change       -0.2872715E-04 Eh
   gradient norm :     0.0017482 Eh/α   predicted    -0.2104630E-04 ( -26.74%)
   displ. norm   :     0.0200201 α      lambda       -0.1092497E-04
   maximum displ.:     0.0115722 α      in ANC's #4, #2, #7, ...

........................................................................
.............................. CYCLE   25 ..............................
........................................................................
   1    -33.8294612 -0.338295E+02  0.181E-02    2.30       0.0  T
   2    -33.8294613 -0.132865E-06  0.971E-03    2.30       2.2  T
   3    -33.8294613  0.292128E-07  0.279E-03    2.30       7.8  T
   4    -33.8294613 -0.572731E-07  0.122E-03    2.30      17.9  T
   5    -33.8294613 -0.776799E-08  0.466E-04    2.30      46.9  T
   6    -33.8294613 -0.976591E-09  0.203E-04    2.30     107.5  T
     SCC iter.                  ...        0 min,  0.006 sec
     gradient                   ...        0 min,  0.013 sec
 * total energy  :   -33.4629066 Eh     change       -0.5984354E-05 Eh
   gradient norm :     0.0008986 Eh/α   predicted    -0.5464327E-05 (  -8.69%)
   displ. norm   :     0.0140572 α      lambda       -0.2192402E-05
   maximum displ.:     0.0104119 α      in ANC's #2, #4, #1, ...

........................................................................
.............................. CYCLE   26 ..............................
........................................................................
   1    -33.8296964 -0.338297E+02  0.124E-02    2.30       0.0  T
   2    -33.8296965 -0.111080E-06  0.677E-03    2.30       3.2  T
   3    -33.8296965  0.457313E-07  0.290E-03    2.30       7.5  T
   4    -33.8296966 -0.844958E-07  0.877E-04    2.30      24.9  T
   5    -33.8296966  0.140778E-08  0.456E-04    2.30      47.9  T
     SCC iter.                  ...        0 min,  0.005 sec
     gradient                   ...        0 min,  0.012 sec
 * total energy  :   -33.4629091 Eh     change       -0.2585261E-05 Eh
   gradient norm :     0.0003715 Eh/α   predicted    -0.1096609E-05 ( -57.58%)
   displ. norm   :     0.0303168 α      lambda       -0.2400053E-05
   maximum displ.:     0.0230103 α      in ANC's #2, #4, #1, ...

   *** GEOMETRY OPTIMIZATION CONVERGED AFTER 26 ITERATIONS ***

------------------------------------------------------------------------
 total energy gain   :        -0.0240616 Eh      -15.0989 kcal/mol
 total RMSD          :         0.4542732 a0        0.2404 Å
 total power (kW/mol):        -2.4297568 (step)  -86.6884 (real)
------------------------------------------------------------------------

 ANCopt (total)                0 d,  0 h,  0 min,  0.729 sec
 optimizer setup                ...        0 min,  0.000 sec (  0.019%)
 model hessian                  ...        0 min,  0.007 sec (  0.979%)
 ANC generation                 ...        0 min,  0.001 sec (  0.164%)
 coordinate transformation      ...        0 min,  0.000 sec (  0.054%)
 single point calculation       ...        0 min,  0.711 sec ( 97.495%)
 optimization log               ...        0 min,  0.002 sec (  0.313%)
 hessian update                 ...        0 min,  0.000 sec (  0.043%)
 rational function              ...        0 min,  0.005 sec (  0.712%)

================
 final structure:
================
$coord
    2.87161279788800    2.02927193425621    0.42491204091122      C 
    3.24260860442808   -0.54466262166847    0.36048057660377      C 
    5.61320685692767   -1.54869209909955    0.27484732618259      O 
    5.78621294819522   -4.14241009769105    0.86249565355131      C 
    3.98193214517546   -5.75495887719399   -0.68754062586560      C 
    0.74050191537903   -5.20595064886187    0.35887848999613      S 
    0.93392304204143   -1.90027666817317    0.42657539694751      C 
   -1.14287370654292   -0.33243658371335    0.56077820032517      C 
   -0.28033149095940    2.79376574730449    0.52002130625263      S 
   -0.90001344708130    3.56050168119205   -2.94131093830198      N 
   -0.11731526748264    6.07536613858505   -3.62041355208584      C 
    4.30977062315154    3.44417224185812    0.53192038613323      H 
    5.42178350259310   -4.44500322008821    2.88617086529858      H 
    7.74513012364773   -4.65286893655933    0.44711906117330      H 
    4.35513520880395   -7.75689638639208   -0.41028056180787      H 
    4.11345050761875   -5.27911780778501   -2.68837376388100      H 
   -3.06823430282387   -0.89037609991808    0.81879790281264      H 
   -2.79759041295621    3.35627510995058   -3.15876198093366      H 
    1.90623159861118    6.23491427226165   -3.26978433144935      H 
   -1.09887472731535    7.58010671240283   -2.58082936617321      H 
   -0.45425589170755    6.35360855309246   -5.63676347823703      H 
$end
           -------------------------------------------------
          |                Final Singlepoint                |
           -------------------------------------------------

          ...................................................
          :                      SETUP                      :
          :.................................................:
          :  # basis functions                  66          :
          :  # atomic orbitals                  64          :
          :  # shells                           34          :
          :  # electrons                        61          :
          :  max. iterations                   250          :
          :  Hamiltonian                  GFN2-xTB          :
          :  restarted?                      false          :
          :  GBSA solvation                  false          :
          :  PC potential                    false          :
          :  electronic temp.          300.0000000     K    :
          :  accuracy                    1.0000000          :
          :  -> integral cutoff          0.2500000E+02      :
          :  -> integral neglect         0.1000000E-07      :
          :  -> SCF convergence          0.1000000E-05 Eh   :
          :  -> wf. convergence          0.1000000E-03 e    :
          :  Broyden damping             0.4000000          :
          ...................................................

 iter      E             dE          RMSdq      gap      omega  full diag
   1    -33.8296966 -0.338297E+02  0.263E-04    2.30       0.0  T
   2    -33.8296966 -0.400320E-10  0.943E-05    2.30     231.3  T
   3    -33.8296966  0.333884E-10  0.966E-05    2.30     226.0  T

   *** convergence criteria satisfied after 3 iterations ***

         #    Occupation            Energy/Eh            Energy/eV
      -------------------------------------------------------------
         1        2.0000           -0.7408405             -20.1593
       ...           ...                  ...                  ...
        25        2.0000           -0.4529132             -12.3244
        26        2.0000           -0.4389056             -11.9432
        27        2.0000           -0.4264206             -11.6035
        28        2.0000           -0.3841039             -10.4520
        29        2.0000           -0.3725277             -10.1370
        30        2.0000           -0.3602788              -9.8037
        31        1.0000           -0.2979014              -8.1063 (HOMO)
        32                         -0.2134328              -5.8078 (LUMO)
        33                         -0.2054367              -5.5902
        34                         -0.1995378              -5.4297
        35                         -0.1656750              -4.5082
        36                         -0.1290140              -3.5106
       ...                                ...                  ...
        64                          0.6844490              18.6248
      -------------------------------------------------------------
                  HL-Gap            0.0844686 Eh            2.2985 eV
             Fermi-level           -0.2923786 Eh           -7.9560 eV

 SCC (total)                   0 d,  0 h,  0 min,  0.025 sec
 SCC setup                      ...        0 min,  0.000 sec (  0.728%)
 Dispersion                     ...        0 min,  0.000 sec (  0.572%)
 integral evaluation            ...        0 min,  0.008 sec ( 33.339%)
 zeroth order Hamiltonian       ...        0 min,  0.000 sec (  0.588%)
 iterations                     ...        0 min,  0.004 sec ( 14.261%)
 molecular gradient             ...        0 min,  0.012 sec ( 48.913%)
 printout                       ...        0 min,  0.000 sec (  1.329%)

         :::::::::::::::::::::::::::::::::::::::::::::::::::::
         ::                     SUMMARY                     ::
         :::::::::::::::::::::::::::::::::::::::::::::::::::::
         :: total energy             -33.462909131008 Eh    ::
         :: gradient norm              0.000373140548 Eh/a0 ::
         :: HOMO-LUMO gap              2.298506985072 eV    ::
         ::.................................................::
         :: SCC energy               -33.829696580829 Eh    ::
         :: -> isotropic ES            0.028687901351 Eh    ::
         :: -> anisotropic ES          0.003188757278 Eh    ::
         :: -> anisotropic XC          0.015247617029 Eh    ::
         :: -> dispersion             -0.021273438730 Eh    ::
         :: repulsion energy           0.366722016184 Eh    ::
         :: add. restraining           0.000000000000 Eh    ::
         :::::::::::::::::::::::::::::::::::::::::::::::::::::

           -------------------------------------------------
          |                Property Printout                |
           -------------------------------------------------

    * Orbital Energies and Occupations

         #    Occupation            Energy/Eh            Energy/eV
      -------------------------------------------------------------
         1        2.0000           -0.7408405             -20.1593
       ...           ...                  ...                  ...
        19        2.0000           -0.4926300             -13.4051
        20        2.0000           -0.4881838             -13.2842
        21        2.0000           -0.4844463             -13.1825
        22        2.0000           -0.4691163             -12.7653
        23        2.0000           -0.4624151             -12.5830
        24        2.0000           -0.4550839             -12.3835
        25        2.0000           -0.4529132             -12.3244
        26        2.0000           -0.4389056             -11.9432
        27        2.0000           -0.4264206             -11.6035
        28        2.0000           -0.3841039             -10.4520
        29        2.0000           -0.3725277             -10.1370
        30        2.0000           -0.3602788              -9.8037
        31        1.0000           -0.2979014              -8.1063 (HOMO)
        32                         -0.2134328              -5.8078 (LUMO)
        33                         -0.2054367              -5.5902
        34                         -0.1995378              -5.4297
        35                         -0.1656750              -4.5082
        36                         -0.1290140              -3.5106
        37                         -0.0554398              -1.5086
        38                         -0.0161806              -0.4403
        39                         -0.0098453              -0.2679
        40                          0.0016059               0.0437
        41                          0.0217757               0.5925
        42                          0.0400607               1.0901
       ...                                ...                  ...
        64                          0.6844490              18.6248
      -------------------------------------------------------------
                  HL-Gap            0.0844686 Eh            2.2985 eV
             Fermi-level           -0.2923786 Eh           -7.9560 eV

     #   Z        covCN         q      C6AA      α(0)
     1   6 C      2.934    -0.098    30.472     9.053
     2   6 C      3.079     0.126    25.158     8.223
     3   8 O      1.704    -0.273    18.525     5.811
     4   6 C      3.747     0.087    19.197     6.249
     5   6 C      3.794    -0.017    20.879     6.507
     6  16 S      2.041    -0.149   147.325    20.429
     7   6 C      3.151     0.009    27.541     8.583
     8   6 C      2.962    -0.088    30.201     9.014
     9  16 S      3.201     0.175   134.112    19.491
    10   7 N      2.653    -0.311    28.000     7.859
    11   6 C      3.704    -0.016    21.013     6.554
    12   1 H      0.927     0.051     2.305     2.374
    13   1 H      0.923     0.041     2.432     2.439
    14   1 H      0.924     0.055     2.256     2.349
    15   1 H      0.925     0.057     2.240     2.340
    16   1 H      0.925     0.061     2.186     2.312
    17   1 H      0.927     0.048     2.350     2.397
    18   1 H      0.860     0.140     1.472     1.901
    19   1 H      0.925     0.041     2.430     2.438
    20   1 H      0.923     0.015     2.806     2.620
    21   1 H      0.924     0.045     2.385     2.415

 Mol. C6AA /au·bohr⁶  :       6889.216673
 Mol. C8AA /au·bohr⁸  :     201367.351379
 Mol. α(0) /au        :        131.357856

(R)spin-density population

 Mulliken population n(s)   n(p)   n(d)
     1 C   0.0954   0.000  0.095  0.000
     2 C   0.1112   0.000  0.111  0.000
     3 O   0.0284   0.000  0.028  0.000
     4 C   0.0010   0.000  0.001  0.000
     5 C   0.0018   0.000  0.002  0.000
     6 S   0.0600   0.000  0.050  0.010
     7 C   0.1297   0.000  0.130  0.000
     8 C   0.1235   0.000  0.123  0.000
     9 S   0.1910   0.004  0.097  0.090
    10 N   0.2295   0.022  0.208  0.000
    11 C   0.0066   0.000  0.006  0.000
    12 H   0.0006   0.001  0.000  0.000
    13 H   0.0015   0.001  0.000  0.000
    14 H   0.0000   0.000  0.000  0.000
    15 H   0.0000   0.000  0.000  0.000
    16 H   0.0006   0.001  0.000  0.000
    17 H   0.0008   0.001  0.000  0.000
    18 H   0.0021   0.002  0.000  0.000
    19 H   0.0007   0.001  0.000  0.000
    20 H   0.0036   0.004  0.000  0.000
    21 H   0.0121   0.012  0.000  0.000

Wiberg/Mayer (AO) data.
largest (>0.10) Wiberg bond orders for each atom
          total WBO             WBO to atom ...
     1  C   3.788        C    2 1.460    S    9 1.144    H   12 0.968
     2  C   3.819        C    1 1.460    C    7 1.209    O    3 1.045
     3  O   2.193        C    2 1.045    C    4 0.976
     4  C   3.951        C    5 1.006    O    3 0.976    H   13 0.967    H   14 0.964
     5  C   3.981        C    4 1.006    S    6 0.989    H   16 0.974    H   15 0.972
     6  S   2.222        C    7 1.047    C    5 0.989
     7  C   3.820        C    8 1.451    C    2 1.209    S    6 1.047
     8  C   3.763        C    7 1.451    S    9 1.147    H   17 0.969
     9  S   3.235        C    8 1.147    C    1 1.144    N   10 0.779
    10  N   2.867        C   11 1.043    H   18 0.956    S    9 0.779
    11  C   3.980        N   10 1.043    H   19 0.983    H   20 0.976    H   21 0.967
    12  H   0.997        C    1 0.968
    13  H   0.997        C    4 0.967
    14  H   0.996        C    4 0.964
    15  H   0.996        C    5 0.972
    16  H   0.996        C    5 0.974
    17  H   0.997        C    8 0.969
    18  H   0.978        N   10 0.956
    19  H   0.998        C   11 0.983
    20  H   0.996        C   11 0.976
    21  H   0.985        C   11 0.967

molecular dipole:
                 x           y           z       tot (Debye)
 q only:        0.139       0.022       0.133
   full:        0.242       0.144      -0.081       0.745
molecular quadrupole (traceless):
                xx          xy          yy          xz          yz          zz
 q only:       -0.417      -7.723       3.978       0.669       0.014      -3.561
  q+dip:        1.429     -10.501       2.554       1.866      -0.879      -3.983
   full:        1.440     -10.592       3.072       1.795      -1.193      -4.512

           -------------------------------------------------
          |                Geometry Summary                 |
           -------------------------------------------------

      molecular mass/u    :      188.2821000
   center of mass at/Å    :        0.8414608      -0.2899298      -0.1177006
  moments of inertia/u·Å² :        0.2802937E+03   0.9620796E+03   0.1093740E+04
rotational constants/cm⁻¹ :        0.6014275E-01   0.1752208E-01   0.1541283E-01

 * 20 selected distances

     #   Z        #   Z                                     value/Å
     1   6 C      2   6 C                                 1.3765658
     2   6 C      3   8 O                                 1.3630957
     3   8 O      4   6 C                                 1.4102981
     4   6 C      5   6 C                                 1.5207154
     2   6 C      7   6 C                                 1.4171765
     6  16 S      7   6 C                                 1.7526456 (max)
     7   6 C      8   6 C                                 1.3788310
     1   6 C      9  16 S                                 1.7170354
     8   6 C      9  16 S                                 1.7162632
    10   7 N     11   6 C                                 1.4393563
     1   6 C     12   1 H                                 1.0691072
     4   6 C     13   1 H                                 1.0998275
     4   6 C     14   1 H                                 1.0935500
     5   6 C     15   1 H                                 1.0875729
     5   6 C     16   1 H                                 1.0905488
     8   6 C     17   1 H                                 1.0695253
    10   7 N     18   1 H                                 1.0164876 (min)
    11   6 C     19   1 H                                 1.0900459
    11   6 C     20   1 H                                 1.0984015
    11   6 C     21   1 H                                 1.0917755

 * 6 distinct bonds (by element types)

   Z      Z             #   av. dist./Å        max./Å        min./Å
   1 H    6 C           9     1.0878172     1.0998275     1.0691072
   6 C    6 C           4     1.4233222     1.5207154     1.3765658
   1 H    7 N           1     1.0164876     1.0164876     1.0164876
   6 C    7 N           1     1.4393563     1.4393563     1.4393563
   6 C    8 O           2     1.3866969     1.4102981     1.3630957
   6 C   16 S           3     1.7286481     1.7526456     1.7162632


optimized geometry written to: xtbopt.xyz


           -------------------------------------------------
          | TOTAL ENERGY              -33.462909131008 Eh   |
          | GRADIENT NORM               0.000373140548 Eh/α |
          | HOMO-LUMO GAP               2.298506985072 eV   |
           -------------------------------------------------

------------------------------------------------------------------------
 * finished run on 2021/05/19 at 10:59:33.432     
------------------------------------------------------------------------
 total:
 * wall-time:     0 d,  0 h,  0 min,  0.810 sec
 *  cpu-time:     0 d,  0 h,  0 min,  0.808 sec
 * ratio c/w:     0.996 speedup
 SCF:
 * wall-time:     0 d,  0 h,  0 min,  0.036 sec
 *  cpu-time:     0 d,  0 h,  0 min,  0.036 sec
 * ratio c/w:     0.997 speedup
 ANC optimizer:
 * wall-time:     0 d,  0 h,  0 min,  0.754 sec
 *  cpu-time:     0 d,  0 h,  0 min,  0.752 sec
 * ratio c/w:     0.998 speedup

