      -----------------------------------------------------------      
     |                   =====================                   |     
     |                           x T B                           |     
     |                   =====================                   |     
     |                         S. Grimme                         |     
     |          Mulliken Center for Theoretical Chemistry        |     
     |                    University of Bonn                     |     
     |                Version 6.2 RC2 (SAW190805)                |     
      -----------------------------------------------------------      

   This program is distributed in the hope that it will be useful,
   but WITHOUT ANY WARRANTY; without even the implied warranty of
   MERCHANTABILITY or FITNESS FOR A PARTICULAR PURPOSE.
   
   FOR NON-COMMERCIAL, ACADEMIA USE ONLY.
   
   Cite this work as:
   * S. Grimme, C. Bannwarth, P. Shushkov, J. Chem. Theory Comput., 2017,
     13, 1989-2009. DOI: 10.1021/acs.jctc.7b00118
   * C. Bannwarth, S. Ehlert and S. Grimme., J. Chem. Theory Comput., 2019,
     15, 1652-1671. DOI: 10.1021/acs.jctc.8b01176
   * P. Pracht, E. Caldeweyher, S. Ehlert, S. Grimme, ChemRxiv, 2019, preprint.
     DOI: 10.26434/chemrxiv.8326202.v1
   
   for DFT-D4:
   * E. Caldeweyher, C. Bannwarth and S. Grimme, J. Chem. Phys., 2017,
     147, 034112. DOI: 10.1063/1.4993215
   * E. Caldeweyher, S. Ehlert, A. Hansen, H. Neugebauer, S. Spicher,
     C. Bannwarth and S. Grimme, J. Chem. Phys., 2019, 150, 154122.
     DOI: 10.1063/1.5090222
   
   for sTDA-xTB:
   * S. Grimme and C. Bannwarth, J. Chem. Phys., 2016, 145, 054103.
     DOI: 10.1063/1.4959605
   
   in the mass-spec context:
   * V. Asgeirsson, C. Bauer and S. Grimme, Chem. Sci., 2017, 8, 4879.
     DOI: 10.1039/c7sc00601b
   
   for metadynamics refer to:
   * S. Grimme, J. Chem. Theory Comput., 2019, 155, 2847-2862
     DOI: 10.1021/acs.jctc.9b00143
   
   with help from (in alphabetical order)
   C. Bannwarth, F. Bohle, G. Brandenburg, E. Caldeweyher, M. Checinski,
   S. Dohm, S. Ehlert, S. Ehrlich, F. März, H. Neugebauer, J. Pisarek,
   P. Pracht, P. Shushkov, and S. Spicher.
   
 * started run on 2021/05/19 at 10:59:37.330     

           -------------------------------------------------
          |                Calculation Setup                |
           -------------------------------------------------

          program call               : /ihome/ghutchison/geoffh/xtb/xtb 547.xyz -opt
          hostname                   : smp-n144
          coordinate file            : 547.xyz
          omp threads                :                     1
          number of atoms            :                    21
          number of electrons        :                    59
          charge                     :                     0
          spin                       :                   0.5
          first test random number   :      0.43550200109261


########################################################################
# WARNING! Please study the warnings concerning your input carefully
#  - the use of '-opt' is discouraged, please use '--opt' next time
########################################################################

           ------------------------------------------------- 
          |                 G F N 2 - x T B                 |
          | Geometry, Frequencies, Noncovalent interactions |
          |            JCTC 2019 parametrisation            |
           ------------------------------------------------- 
             KAB for C  - Si     :                1.0500
             KAB for H  - Pd     :                0.9500
             k(s)              :                1.8500
             k(p)              :                2.2300
             k(d)              :                2.2300
             k(f)              :                2.0000
             kEN (H0ij)        :               -2.0000
             D4 a1             :                0.5200
             D4 a2             :                5.0000
             D4 s6             :                1.0000
             D4 s8             :                2.7000
             D4 s9             :                5.0000
             alphaj            :                2.0000

  Z AO/shell   Hii/eV     exponent
  1     Wed Apr 25 08:07:45 CEST 2018   EN: 2.200 GM2: 0.406  GM3: 0.0800  RAES: 1.40
     1s    -10.707211    1.230000
  6     Wed Apr 25 08:07:45 CEST 2018   EN: 2.550 GM2: 0.538  GM3: 0.1500  RAES: 3.00
     2s    -13.970922    2.096432
     2p    -10.063292    1.800000
 16     Tue Apr 24 11:44:34 CEST 2018   EN: 2.580 GM2: 0.340  GM3:-0.0502  RAES: 3.10
     3s    -20.029654    1.981333
     3p    -11.377694    2.025643
     3d     -0.420282    1.702555

           ------------------------------------------------- 
          |        Self-Consistent Charge Iterations        |
           ------------------------------------------------- 

          ...................................................
          :                      SETUP                      :
          :.................................................:
          :  # basis functions                  63          :
          :  # atomic orbitals                  62          :
          :  # shells                           34          :
          :  # electrons                        59          :
          :  max. iterations                   250          :
          :  Hamiltonian                  GFN2-xTB          :
          :  restarted?                      false          :
          :  GBSA solvation                  false          :
          :  PC potential                    false          :
          :  electronic temp.          300.0000000     K    :
          :  accuracy                    1.0000000          :
          :  -> integral cutoff          0.2500000E+02      :
          :  -> integral neglect         0.1000000E-07      :
          :  -> SCF convergence          0.1000000E-05 Eh   :
          :  -> wf. convergence          0.1000000E-03 e    :
          :  Broyden damping             0.4000000          :
          ...................................................

 iter      E             dE          RMSdq      gap      omega  full diag
   1    -31.7555918 -0.317556E+02  0.461E+00    1.70       0.0  T
   2    -31.7532783  0.231345E-02  0.330E+00    1.43       1.0  T
   3    -31.6934949  0.597834E-01  0.236E+00    2.02       1.0  T
   4    -31.7945479 -0.101053E+00  0.584E-01    1.48       1.0  T
   5    -31.7953706 -0.822699E-03  0.399E-01    1.55       1.0  T
   6    -31.7984256 -0.305495E-02  0.135E-01    1.50       1.0  T
   7    -31.7986378 -0.212262E-03  0.547E-02    1.51       1.0  T
   8    -31.7986709 -0.330585E-04  0.224E-02    1.51       1.0  T
   9    -31.7986760 -0.509876E-05  0.827E-03    1.51       2.6  T
  10    -31.7986761 -0.624111E-07  0.355E-03    1.51       6.1  T
  11    -31.7986762 -0.135350E-06  0.145E-03    1.51      15.0  T
  12    -31.7986762 -0.216679E-07  0.484E-04    1.51      45.1  T
  13    -31.7986762 -0.300874E-08  0.995E-05    1.51     219.3  T

   *** convergence criteria satisfied after 13 iterations ***

         #    Occupation            Energy/Eh            Energy/eV
      -------------------------------------------------------------
         1        2.0000           -0.7333563             -19.9556
       ...           ...                  ...                  ...
        24        2.0000           -0.4350240             -11.8376
        25        2.0000           -0.4299632             -11.6999
        26        2.0000           -0.4248862             -11.5617
        27        2.0000           -0.4099270             -11.1547
        28        2.0000           -0.4021190             -10.9422
        29        2.0000           -0.3563149              -9.6958
        30        1.0000           -0.3216907              -8.7537 (HOMO)
        31                         -0.2660852              -7.2405 (LUMO)
        32                         -0.2339444              -6.3660
        33                         -0.2107980              -5.7361
        34                         -0.1975299              -5.3751
        35                         -0.1396803              -3.8009
       ...                                ...                  ...
        62                          0.7429867              20.2177
      -------------------------------------------------------------
                  HL-Gap            0.0556055 Eh            1.5131 eV
             Fermi-level           -0.3164454 Eh           -8.6109 eV

 SCC (total)                   0 d,  0 h,  0 min,  0.034 sec
 SCC setup                      ...        0 min,  0.000 sec (  0.811%)
 Dispersion                     ...        0 min,  0.000 sec (  0.876%)
 integral evaluation            ...        0 min,  0.008 sec ( 22.316%)
 zeroth order Hamiltonian       ...        0 min,  0.000 sec (  0.440%)
 iterations                     ...        0 min,  0.013 sec ( 39.276%)
 molecular gradient             ...        0 min,  0.012 sec ( 35.128%)
 printout                       ...        0 min,  0.000 sec (  1.007%)

         :::::::::::::::::::::::::::::::::::::::::::::::::::::
         ::                     SUMMARY                     ::
         :::::::::::::::::::::::::::::::::::::::::::::::::::::
         :: total energy             -31.254002567370 Eh    ::
         :: gradient norm              0.121476254828 Eh/a0 ::
         :: HOMO-LUMO gap              1.513102756935 eV    ::
         ::.................................................::
         :: SCC energy               -31.798676222845 Eh    ::
         :: -> isotropic ES            0.002680431594 Eh    ::
         :: -> anisotropic ES          0.004273152925 Eh    ::
         :: -> anisotropic XC          0.020297850888 Eh    ::
         :: -> dispersion             -0.022343004118 Eh    ::
         :: repulsion energy           0.544599643129 Eh    ::
         :: add. restraining           0.000000000000 Eh    ::
         :::::::::::::::::::::::::::::::::::::::::::::::::::::

      ----------------------------------------------------------- 
     |                   =====================                   |
     |                        A N C O P T                        |
     |                   =====================                   |
     |               Approximate Normal Coordinate               |
     |                Rational Function Optimizer                |
      ----------------------------------------------------------- 

          ...................................................
          :                      SETUP                      :
          :.................................................:
          :   optimization level            normal          :
          :   max. optcycles                   200          :
          :   ANC micro-cycles                  20          :
          :   degrees of freedom                57          :
          :.................................................:
          :   RF solver                   davidson          :
          :   input Hessian                  false          :
          :   write xtbopt.log                true          :
          :   linear?                        false          :
          :   energy convergence         0.5000000E-05 Eh   :
          :   grad. convergence          0.1000000E-02 Eh/α :
          :   maximium RF displ.         2.0000000          :
          :   Hlow (freq-cutoff)         0.5000000E-02      :
          :   Hmax (freq-cutoff)         5.0000000          :
          :   S6 in model hess.         20.0000000          :
          ...................................................

generating ANC from model Hessian ...
Using Lindh-Hessian (1995)
 Shifting diagonal of input Hessian by   2.913251635015906E-003
 Lowest  eigenvalues of input Hessian
   -0.000000   -0.000000   -0.000000   -0.000000   -0.000000    0.000000
    0.005000    0.006162    0.006515    0.009004    0.011119    0.014855
    0.015462    0.016301    0.020036    0.023294    0.034696    0.039632
 Highest eigenvalues
    1.750234    1.830788    1.871315    1.965573    2.018607    2.106770
 

........................................................................
.............................. CYCLE    1 ..............................
........................................................................
   1    -31.7986762 -0.317987E+02  0.579E-05    1.51       0.0  T
   2    -31.7986762 -0.698819E-11  0.346E-05    1.51     631.0  T
   3    -31.7986762 -0.278533E-11  0.253E-05    1.51     861.4  T
     SCC iter.                  ...        0 min,  0.004 sec
     gradient                   ...        0 min,  0.012 sec
 * total energy  :   -31.2540026 Eh     change       -0.5016730E-08 Eh
   gradient norm :     0.1214762 Eh/α   predicted     0.0000000E+00 (-100.00%)
   displ. norm   :     0.2892764 α      lambda       -0.1659400E-01
   maximum displ.:     0.1552128 α      in ANC's #19, #2, #3, ...

........................................................................
.............................. CYCLE    2 ..............................
........................................................................
   1    -31.8156782 -0.318157E+02  0.246E-01    1.48       0.0  T
   2    -31.8154597  0.218540E-03  0.187E-01    1.48       1.0  T
   3    -31.8155811 -0.121372E-03  0.145E-01    1.47       1.0  T
   4    -31.8158825 -0.301413E-03  0.321E-02    1.48       1.0  T
   5    -31.8158902 -0.775538E-05  0.196E-02    1.48       1.1  T
   6    -31.8158948 -0.458552E-05  0.717E-03    1.48       3.0  T
   7    -31.8158957 -0.929759E-06  0.243E-03    1.48       9.0  T
   8    -31.8158958 -0.522485E-07  0.104E-03    1.48      20.9  T
     SCC iter.                  ...        0 min,  0.008 sec
     gradient                   ...        0 min,  0.011 sec
 * total energy  :   -31.2656345 Eh     change       -0.1163192E-01 Eh
   gradient norm :     0.0597804 Eh/α   predicted    -0.8991302E-02 ( -22.70%)
   displ. norm   :     0.3073694 α      lambda       -0.6124742E-02
   maximum displ.:     0.1641054 α      in ANC's #2, #3, #19, ...

........................................................................
.............................. CYCLE    3 ..............................
........................................................................
   1    -31.8287224 -0.318287E+02  0.225E-01    1.48       0.0  T
   2    -31.8285813  0.141110E-03  0.161E-01    1.47       1.0  T
   3    -31.8285776  0.368308E-05  0.139E-01    1.47       1.0  T
   4    -31.8288590 -0.281364E-03  0.265E-02    1.48       1.0  T
   5    -31.8288657 -0.664874E-05  0.150E-02    1.47       1.5  T
   6    -31.8288678 -0.219190E-05  0.555E-03    1.47       3.9  T
   7    -31.8288686 -0.714069E-06  0.169E-03    1.47      12.9  T
     SCC iter.                  ...        0 min,  0.007 sec
     gradient                   ...        0 min,  0.011 sec
 * total energy  :   -31.2688329 Eh     change       -0.3198449E-02 Eh
   gradient norm :     0.0181656 Eh/α   predicted    -0.3351691E-02 (   4.79%)
   displ. norm   :     0.2633895 α      lambda       -0.1344916E-02
   maximum displ.:     0.1626813 α      in ANC's #2, #3, #5, ...

........................................................................
.............................. CYCLE    4 ..............................
........................................................................
   1    -31.8256440 -0.318256E+02  0.203E-01    1.47       0.0  T
   2    -31.8256476 -0.356689E-05  0.120E-01    1.46       1.0  T
   3    -31.8255970  0.506283E-04  0.484E-02    1.47       1.0  T
   4    -31.8256482 -0.512581E-04  0.150E-02    1.46       1.5  T
   5    -31.8256517 -0.348402E-05  0.561E-03    1.46       3.9  T
   6    -31.8256520 -0.310010E-06  0.217E-03    1.46      10.0  T
   7    -31.8256521 -0.638753E-07  0.716E-04    1.46      30.5  T
     SCC iter.                  ...        0 min,  0.007 sec
     gradient                   ...        0 min,  0.011 sec
 * total energy  :   -31.2697074 Eh     change       -0.8744736E-03 Eh
   gradient norm :     0.0116168 Eh/α   predicted    -0.7191277E-03 ( -17.76%)
   displ. norm   :     0.3342564 α      lambda       -0.1026698E-02
   maximum displ.:     0.2458442 α      in ANC's #2, #3, #4, ...

........................................................................
.............................. CYCLE    5 ..............................
........................................................................
   1    -31.8221228 -0.318221E+02  0.238E-01    1.46       0.0  T
   2    -31.8221257 -0.294073E-05  0.140E-01    1.45       1.0  T
   3    -31.8219720  0.153729E-03  0.857E-02    1.47       1.0  T
   4    -31.8221316 -0.159621E-03  0.178E-02    1.46       1.2  T
   5    -31.8221368 -0.513611E-05  0.645E-03    1.46       3.4  T
   6    -31.8221372 -0.386428E-06  0.244E-03    1.46       8.9  T
   7    -31.8221372 -0.634460E-07  0.790E-04    1.46      27.6  T
     SCC iter.                  ...        0 min,  0.007 sec
     gradient                   ...        0 min,  0.011 sec
 * total energy  :   -31.2703869 Eh     change       -0.6795341E-03 Eh
   gradient norm :     0.0136001 Eh/α   predicted    -0.5707051E-03 ( -16.02%)
   displ. norm   :     0.2638046 α      lambda       -0.6357998E-03
   maximum displ.:     0.1820656 α      in ANC's #2, #3, #4, ...

........................................................................
.............................. CYCLE    6 ..............................
........................................................................
   1    -31.8224858 -0.318225E+02  0.186E-01    1.46       0.0  T
   2    -31.8224881 -0.227208E-05  0.109E-01    1.46       1.0  T
   3    -31.8224607  0.274383E-04  0.408E-02    1.46       1.0  T
   4    -31.8224910 -0.303169E-04  0.487E-03    1.46       4.5  T
   5    -31.8224910  0.113252E-07  0.378E-03    1.46       5.8  T
   6    -31.8224912 -0.191146E-06  0.177E-03    1.46      12.3  T
   7    -31.8224912 -0.483570E-07  0.577E-04    1.46      37.8  T
     SCC iter.                  ...        0 min,  0.007 sec
     gradient                   ...        0 min,  0.011 sec
 * total energy  :   -31.2708884 Eh     change       -0.5014935E-03 Eh
   gradient norm :     0.0143259 Eh/α   predicted    -0.3400235E-03 ( -32.20%)
   displ. norm   :     0.3664078 α      lambda       -0.9470778E-03
   maximum displ.:     0.2421949 α      in ANC's #2, #3, #4, ...

........................................................................
.............................. CYCLE    7 ..............................
........................................................................
   1    -31.8262074 -0.318262E+02  0.257E-01    1.47       0.0  T
   2    -31.8262108 -0.341038E-05  0.150E-01    1.46       1.0  T
   3    -31.8261597  0.511708E-04  0.557E-02    1.47       1.0  T
   4    -31.8262161 -0.564340E-04  0.628E-03    1.47       3.5  T
   5    -31.8262159  0.252291E-06  0.594E-03    1.47       3.7  T
   6    -31.8262164 -0.581582E-06  0.208E-03    1.47      10.5  T
   7    -31.8262165 -0.657299E-07  0.576E-04    1.47      37.9  T
     SCC iter.                  ...        0 min,  0.007 sec
     gradient                   ...        0 min,  0.011 sec
 * total energy  :   -31.2715210 Eh     change       -0.6325418E-03 Eh
   gradient norm :     0.0108430 Eh/α   predicted    -0.5371137E-03 ( -15.09%)
   displ. norm   :     0.2872903 α      lambda       -0.5449401E-03
   maximum displ.:     0.1625177 α      in ANC's #2, #3, #4, ...

........................................................................
.............................. CYCLE    8 ..............................
........................................................................
   1    -31.8269378 -0.318269E+02  0.194E-01    1.47       0.0  T
   2    -31.8269377  0.188289E-06  0.114E-01    1.47       1.0  T
   3    -31.8268251  0.112609E-03  0.725E-02    1.47       1.0  T
   4    -31.8269429 -0.117817E-03  0.937E-03    1.47       2.3  T
   5    -31.8269442 -0.135394E-05  0.330E-03    1.47       6.6  T
   6    -31.8269443 -0.118488E-06  0.128E-03    1.47      17.0  T
   7    -31.8269444 -0.160535E-07  0.415E-04    1.47      52.5  T
     SCC iter.                  ...        0 min,  0.007 sec
     gradient                   ...        0 min,  0.011 sec
 * total energy  :   -31.2718011 Eh     change       -0.2801241E-03 Eh
   gradient norm :     0.0100402 Eh/α   predicted    -0.2949586E-03 (   5.30%)
   displ. norm   :     0.1949339 α      lambda       -0.3789283E-03
   maximum displ.:     0.0941619 α      in ANC's #4, #3, #2, ...

........................................................................
.............................. CYCLE    9 ..............................
........................................................................
   1    -31.8285107 -0.318285E+02  0.144E-01    1.48       0.0  T
   2    -31.8285133 -0.258238E-05  0.839E-02    1.48       1.0  T
   3    -31.8284943  0.189437E-04  0.350E-02    1.48       1.0  T
   4    -31.8285154 -0.210988E-04  0.474E-03    1.48       4.6  T
   5    -31.8285156 -0.124197E-06  0.335E-03    1.48       6.5  T
   6    -31.8285156 -0.750311E-07  0.200E-03    1.48      10.9  T
   7    -31.8285157 -0.730623E-07  0.519E-04    1.48      42.1  T
     SCC iter.                  ...        0 min,  0.007 sec
     gradient                   ...        0 min,  0.011 sec
 * total energy  :   -31.2719858 Eh     change       -0.1847397E-03 Eh
   gradient norm :     0.0065115 Eh/α   predicted    -0.1966654E-03 (   6.46%)
   displ. norm   :     0.1641716 α      lambda       -0.1839406E-03
   maximum displ.:     0.1365703 α      in ANC's #4, #2, #3, ...

........................................................................
.............................. CYCLE   10 ..............................
........................................................................
   1    -31.8273209 -0.318273E+02  0.107E-01    1.48       0.0  T
   2    -31.8273210 -0.170050E-06  0.627E-02    1.48       1.0  T
   3    -31.8272948  0.262666E-04  0.371E-02    1.48       1.0  T
   4    -31.8273223 -0.275186E-04  0.647E-03    1.48       3.4  T
   5    -31.8273228 -0.541037E-06  0.293E-03    1.48       7.5  T
   6    -31.8273229 -0.957399E-07  0.118E-03    1.48      18.5  T
     SCC iter.                  ...        0 min,  0.006 sec
     gradient                   ...        0 min,  0.011 sec
 * total energy  :   -31.2720738 Eh     change       -0.8799895E-04 Eh
   gradient norm :     0.0071881 Eh/α   predicted    -0.9444990E-04 (   7.33%)
   displ. norm   :     0.1319125 α      lambda       -0.2587684E-03
   maximum displ.:     0.0949791 α      in ANC's #4, #2, #10, ...

........................................................................
.............................. CYCLE   11 ..............................
........................................................................
   1    -31.8312345 -0.318312E+02  0.912E-02    1.49       0.0  T
   2    -31.8312364 -0.191783E-05  0.508E-02    1.49       1.0  T
   3    -31.8312251  0.113221E-04  0.286E-02    1.49       1.0  T
   4    -31.8312376 -0.125722E-04  0.823E-03    1.49       2.7  T
   5    -31.8312377 -0.406669E-07  0.650E-03    1.49       3.4  T
   6    -31.8312384 -0.712647E-06  0.122E-03    1.49      17.8  T
   7    -31.8312384 -0.231472E-07  0.523E-04    1.49      41.7  T
     SCC iter.                  ...        0 min,  0.007 sec
     gradient                   ...        0 min,  0.011 sec
 * total energy  :   -31.2720211 Eh     change        0.5271559E-04 Eh
   gradient norm :     0.0128106 Eh/α   predicted    -0.1316396E-03 (-349.72%)
   displ. norm   :     0.1018870 α      lambda       -0.3307326E-03
   maximum displ.:     0.0565933 α      in ANC's #2, #3, #10, ...

........................................................................
.............................. CYCLE   12 ..............................
........................................................................
   1    -31.8280757 -0.318281E+02  0.701E-02    1.49       0.0  T
   2    -31.8280762 -0.499334E-06  0.404E-02    1.49       1.0  T
   3    -31.8280668  0.946354E-05  0.248E-02    1.49       1.0  T
   4    -31.8280774 -0.106560E-04  0.373E-03    1.49       5.9  T
   5    -31.8280775 -0.903433E-07  0.277E-03    1.49       7.9  T
   6    -31.8280776 -0.121211E-06  0.518E-04    1.49      42.1  T
     SCC iter.                  ...        0 min,  0.006 sec
     gradient                   ...        0 min,  0.011 sec
 * total energy  :   -31.2721965 Eh     change       -0.1753760E-03 Eh
   gradient norm :     0.0040618 Eh/α   predicted    -0.1670875E-03 (  -4.73%)
   displ. norm   :     0.0465034 α      lambda       -0.4819420E-04
   maximum displ.:     0.0364648 α      in ANC's #4, #5, #10, ...

........................................................................
.............................. CYCLE   13 ..............................
........................................................................
   1    -31.8288266 -0.318288E+02  0.272E-02    1.49       0.0  T
   2    -31.8288268 -0.130517E-06  0.163E-02    1.49       1.3  T
   3    -31.8288230  0.379177E-05  0.139E-02    1.49       1.6  T
   4    -31.8288270 -0.407785E-05  0.257E-03    1.49       8.5  T
   5    -31.8288271 -0.695269E-07  0.113E-03    1.49      19.3  T
   6    -31.8288271 -0.611224E-08  0.638E-04    1.49      34.2  T
     SCC iter.                  ...        0 min,  0.006 sec
     gradient                   ...        0 min,  0.011 sec
 * total energy  :   -31.2722174 Eh     change       -0.2090708E-04 Eh
   gradient norm :     0.0054447 Eh/α   predicted    -0.2415248E-04 (  15.52%)
   displ. norm   :     0.0978334 α      lambda       -0.5351171E-04
   maximum displ.:     0.0768167 α      in ANC's #4, #2, #3, ...

........................................................................
.............................. CYCLE   14 ..............................
........................................................................
   1    -31.8281953 -0.318282E+02  0.662E-02    1.49       0.0  T
   2    -31.8281957 -0.423799E-06  0.387E-02    1.49       1.0  T
   3    -31.8281924  0.325609E-05  0.137E-02    1.49       1.6  T
   4    -31.8281959 -0.349021E-05  0.302E-03    1.49       7.2  T
   5    -31.8281960 -0.675735E-07  0.194E-03    1.49      11.3  T
   6    -31.8281960 -0.452883E-07  0.887E-04    1.49      24.6  T
     SCC iter.                  ...        0 min,  0.006 sec
     gradient                   ...        0 min,  0.011 sec
 * total energy  :   -31.2722483 Eh     change       -0.3085839E-04 Eh
   gradient norm :     0.0028790 Eh/α   predicted    -0.2701303E-04 ( -12.46%)
   displ. norm   :     0.0722033 α      lambda       -0.3583907E-04
   maximum displ.:     0.0545557 α      in ANC's #4, #33, #3, ...

........................................................................
.............................. CYCLE   15 ..............................
........................................................................
   1    -31.8284308 -0.318284E+02  0.461E-02    1.49       0.0  T
   2    -31.8284310 -0.203378E-06  0.263E-02    1.49       1.0  T
   3    -31.8284298  0.118132E-05  0.877E-03    1.49       2.5  T
   4    -31.8284311 -0.126937E-05  0.266E-03    1.49       8.2  T
   5    -31.8284311  0.239233E-07  0.218E-03    1.49      10.0  T
   6    -31.8284312 -0.897890E-07  0.404E-04    1.49      54.1  T
   7    -31.8284312 -0.183490E-08  0.234E-04    1.49      93.2  T
     SCC iter.                  ...        0 min,  0.007 sec
     gradient                   ...        0 min,  0.012 sec
 * total energy  :   -31.2722690 Eh     change       -0.2071566E-04 Eh
   gradient norm :     0.0015628 Eh/α   predicted    -0.1801484E-04 ( -13.04%)
   displ. norm   :     0.0564333 α      lambda       -0.9734452E-05
   maximum displ.:     0.0458370 α      in ANC's #4, #33, #8, ...

........................................................................
.............................. CYCLE   16 ..............................
........................................................................
   1    -31.8289161 -0.318289E+02  0.390E-02    1.49       0.0  T
   2    -31.8289162 -0.182537E-06  0.218E-02    1.49       1.0  T
   3    -31.8289142  0.204836E-05  0.107E-02    1.49       2.0  T
   4    -31.8289164 -0.220664E-05  0.295E-03    1.49       7.4  T
   5    -31.8289164  0.254968E-07  0.230E-03    1.49       9.5  T
   6    -31.8289165 -0.997898E-07  0.551E-04    1.49      39.6  T
   7    -31.8289165 -0.431708E-08  0.220E-04    1.49      99.1  T
     SCC iter.                  ...        0 min,  0.007 sec
     gradient                   ...        0 min,  0.012 sec
 * total energy  :   -31.2722757 Eh     change       -0.6669930E-05 Eh
   gradient norm :     0.0008634 Eh/α   predicted    -0.4876212E-05 ( -26.89%)
   displ. norm   :     0.0436559 α      lambda       -0.2928670E-05
   maximum displ.:     0.0271723 α      in ANC's #4, #2, #3, ...

........................................................................
.............................. CYCLE   17 ..............................
........................................................................
   1    -31.8285143 -0.318285E+02  0.282E-02    1.49       0.0  T
   2    -31.8285143 -0.538204E-07  0.162E-02    1.49       1.3  T
   3    -31.8285140  0.342006E-06  0.451E-03    1.49       4.8  T
   4    -31.8285143 -0.352407E-06  0.154E-03    1.49      14.2  T
   5    -31.8285143 -0.137636E-07  0.879E-04    1.49      24.8  T
   6    -31.8285144 -0.134117E-07  0.181E-04    1.49     120.2  T
     SCC iter.                  ...        0 min,  0.006 sec
     gradient                   ...        0 min,  0.012 sec
 * total energy  :   -31.2722761 Eh     change       -0.4652994E-06 Eh
   gradient norm :     0.0011014 Eh/α   predicted    -0.1467002E-05 ( 215.28%)
   displ. norm   :     0.0292872 α      lambda       -0.2261528E-05
   maximum displ.:     0.0255966 α      in ANC's #4, #3, #33, ...

........................................................................
.............................. CYCLE   18 ..............................
........................................................................
   1    -31.8289319 -0.318289E+02  0.167E-02    1.49       0.0  T
   2    -31.8289319 -0.609849E-08  0.986E-03    1.49       2.2  T
   3    -31.8289310  0.846888E-06  0.666E-03    1.49       3.3  T
   4    -31.8289319 -0.895158E-06  0.104E-03    1.49      21.0  T
   5    -31.8289319 -0.129844E-07  0.521E-04    1.49      41.9  T
   6    -31.8289319 -0.335256E-08  0.228E-04    1.49      95.8  T
     SCC iter.                  ...        0 min,  0.006 sec
     gradient                   ...        0 min,  0.012 sec
 * total energy  :   -31.2722770 Eh     change       -0.9197571E-06 Eh
   gradient norm :     0.0006334 Eh/α   predicted    -0.1134826E-05 (  23.38%)
   displ. norm   :     0.0070158 α      lambda       -0.8773840E-06
   maximum displ.:     0.0034257 α      in ANC's #6, #3, #4, ...

   *** GEOMETRY OPTIMIZATION CONVERGED AFTER 18 ITERATIONS ***

------------------------------------------------------------------------
 total energy gain   :        -0.0182745 Eh      -11.4674 kcal/mol
 total RMSD          :         0.5125769 a0        0.2712 Å
 total power (kW/mol):        -2.6655346 (step) -101.7915 (real)
------------------------------------------------------------------------

 ANCopt (total)                0 d,  0 h,  0 min,  0.471 sec
 optimizer setup                ...        0 min,  0.000 sec (  0.032%)
 model hessian                  ...        0 min,  0.003 sec (  0.672%)
 ANC generation                 ...        0 min,  0.001 sec (  0.130%)
 coordinate transformation      ...        0 min,  0.000 sec (  0.062%)
 single point calculation       ...        0 min,  0.460 sec ( 97.506%)
 optimization log               ...        0 min,  0.002 sec (  0.339%)
 hessian update                 ...        0 min,  0.000 sec (  0.047%)
 rational function              ...        0 min,  0.005 sec (  0.971%)

================
 final structure:
================
$coord
   -2.96352902560610    2.27795566806578   -0.03081658514238      C 
   -4.64679037504076    0.13093446624734    0.12503341555274      C 
   -7.20052841037574    0.27503710395489    0.07898616386710      C 
   -3.09168778966619   -2.11208145903643    0.37647471746805      C 
   -0.53029167958936   -1.30820652344247    0.28302446625031      C 
   -0.53303878994502    1.46264130921098    0.06788482240090      C 
    1.74979360486733    2.88483807190948   -0.03573685827650      C 
    4.05485865576853    1.82459042406040   -0.02741555259950      C 
    4.62485764587248   -1.40999196164307    0.04165314455270      S 
    1.63934449316547   -2.69297098750745    0.21320945451909      C 
   -4.08881524013665   -4.59128427654043    0.68038261522593      C 
   -2.92361024613491   -6.62645256038180    1.63948845479979      C 
   -3.59008615465384    4.20150622665378   -0.20169400017926      H 
   -8.13323404237822    2.07368115737872   -0.09187467564138      H 
   -8.39278391919622   -1.36555269734759    0.20323332385865      H 
    1.59756081378284    4.92127399640183   -0.12324933388491      H 
    5.77597992159067    2.90956608965473   -0.09519835109278      H 
    1.66682587704546   -4.72588940175277    0.19679590401043      H 
   -6.04719823194489   -4.79932866358382    0.11887877385572      H 
   -1.03978401080368   -6.56321792623639    2.39439016102491      H 
   -3.88263828188684   -8.41438792853105    1.77036032463094      H 
$end
           -------------------------------------------------
          |                Final Singlepoint                |
           -------------------------------------------------

          ...................................................
          :                      SETUP                      :
          :.................................................:
          :  # basis functions                  63          :
          :  # atomic orbitals                  62          :
          :  # shells                           34          :
          :  # electrons                        59          :
          :  max. iterations                   250          :
          :  Hamiltonian                  GFN2-xTB          :
          :  restarted?                      false          :
          :  GBSA solvation                  false          :
          :  PC potential                    false          :
          :  electronic temp.          300.0000000     K    :
          :  accuracy                    1.0000000          :
          :  -> integral cutoff          0.2500000E+02      :
          :  -> integral neglect         0.1000000E-07      :
          :  -> SCF convergence          0.1000000E-05 Eh   :
          :  -> wf. convergence          0.1000000E-03 e    :
          :  Broyden damping             0.4000000          :
          ...................................................

 iter      E             dE          RMSdq      gap      omega  full diag
   1    -31.8289319 -0.318289E+02  0.152E-04    1.49       0.0  T
   2    -31.8289319  0.323688E-10  0.756E-05    1.49     288.6  T
   3    -31.8289319 -0.850449E-10  0.833E-05    1.49     262.0  T

   *** convergence criteria satisfied after 3 iterations ***

         #    Occupation            Energy/Eh            Energy/eV
      -------------------------------------------------------------
         1        2.0000           -0.7354766             -20.0133
       ...           ...                  ...                  ...
        24        2.0000           -0.4365690             -11.8796
        25        2.0000           -0.4273365             -11.6284
        26        2.0000           -0.4181521             -11.3785
        27        2.0000           -0.4146942             -11.2844
        28        2.0000           -0.4096694             -11.1477
        29        2.0000           -0.3558482              -9.6831
        30        1.0000           -0.3219253              -8.7600 (HOMO)
        31                         -0.2672555              -7.2724 (LUMO)
        32                         -0.2346821              -6.3860
        33                         -0.1997659              -5.4359
        34                         -0.1951809              -5.3111
        35                         -0.1343936              -3.6570
       ...                                ...                  ...
        62                          0.7281534              19.8141
      -------------------------------------------------------------
                  HL-Gap            0.0546699 Eh            1.4876 eV
             Fermi-level           -0.3167386 Eh           -8.6189 eV

 SCC (total)                   0 d,  0 h,  0 min,  0.023 sec
 SCC setup                      ...        0 min,  0.000 sec (  0.740%)
 Dispersion                     ...        0 min,  0.000 sec (  0.761%)
 integral evaluation            ...        0 min,  0.007 sec ( 30.833%)
 zeroth order Hamiltonian       ...        0 min,  0.000 sec (  0.605%)
 iterations                     ...        0 min,  0.003 sec ( 15.133%)
 molecular gradient             ...        0 min,  0.012 sec ( 50.199%)
 printout                       ...        0 min,  0.000 sec (  1.509%)

         :::::::::::::::::::::::::::::::::::::::::::::::::::::
         ::                     SUMMARY                     ::
         :::::::::::::::::::::::::::::::::::::::::::::::::::::
         :: total energy             -31.272277057556 Eh    ::
         :: gradient norm              0.000633255922 Eh/a0 ::
         :: HOMO-LUMO gap              1.487642788808 eV    ::
         ::.................................................::
         :: SCC energy               -31.828931932625 Eh    ::
         :: -> isotropic ES            0.002780560109 Eh    ::
         :: -> anisotropic ES          0.004373972434 Eh    ::
         :: -> anisotropic XC          0.019530525388 Eh    ::
         :: -> dispersion             -0.022447414971 Eh    ::
         :: repulsion energy           0.556587358852 Eh    ::
         :: add. restraining           0.000000000000 Eh    ::
         :::::::::::::::::::::::::::::::::::::::::::::::::::::

           -------------------------------------------------
          |                Property Printout                |
           -------------------------------------------------

    * Orbital Energies and Occupations

         #    Occupation            Energy/Eh            Energy/eV
      -------------------------------------------------------------
         1        2.0000           -0.7354766             -20.0133
       ...           ...                  ...                  ...
        18        2.0000           -0.4719638             -12.8428
        19        2.0000           -0.4703289             -12.7983
        20        2.0000           -0.4619633             -12.5707
        21        2.0000           -0.4606446             -12.5348
        22        2.0000           -0.4478725             -12.1872
        23        2.0000           -0.4391720             -11.9505
        24        2.0000           -0.4365690             -11.8796
        25        2.0000           -0.4273365             -11.6284
        26        2.0000           -0.4181521             -11.3785
        27        2.0000           -0.4146942             -11.2844
        28        2.0000           -0.4096694             -11.1477
        29        2.0000           -0.3558482              -9.6831
        30        1.0000           -0.3219253              -8.7600 (HOMO)
        31                         -0.2672555              -7.2724 (LUMO)
        32                         -0.2346821              -6.3860
        33                         -0.1997659              -5.4359
        34                         -0.1951809              -5.3111
        35                         -0.1343936              -3.6570
        36                         -0.1045431              -2.8448
        37                         -0.0949886              -2.5848
        38                         -0.0097772              -0.2661
        39                          0.0211306               0.5750
        40                          0.0381246               1.0374
        41                          0.0837720               2.2796
       ...                                ...                  ...
        62                          0.7281534              19.8141
      -------------------------------------------------------------
                  HL-Gap            0.0546699 Eh            1.4876 eV
             Fermi-level           -0.3167386 Eh           -8.6189 eV

     #   Z        covCN         q      C6AA      α(0)
     1   6 C      2.987    -0.063    29.561     8.919
     2   6 C      3.053     0.016    27.607     8.617
     3   6 C      2.841    -0.089    30.216     9.008
     4   6 C      3.025    -0.017    28.404     8.742
     5   6 C      3.093     0.002    27.858     8.651
     6   6 C      3.055     0.003    27.916     8.665
     7   6 C      2.936    -0.035    28.865     8.811
     8   6 C      2.891    -0.010    28.275     8.718
     9  16 S      2.040    -0.027   142.184    20.069
    10   6 C      2.889    -0.010    28.276     8.718
    11   6 C      2.889    -0.027    28.671     8.779
    12   6 C      2.838    -0.095    30.386     9.034
    13   1 H      0.926     0.025     2.655     2.548
    14   1 H      0.926     0.040     2.448     2.447
    15   1 H      0.926     0.038     2.472     2.459
    16   1 H      0.925     0.042     2.425     2.435
    17   1 H      0.926     0.048     2.348     2.396
    18   1 H      0.926     0.055     2.257     2.349
    19   1 H      0.925     0.038     2.480     2.463
    20   1 H      0.926     0.033     2.537     2.491
    21   1 H      0.926     0.034     2.533     2.489

 Mol. C6AA /au·bohr⁶  :       7218.340701
 Mol. C8AA /au·bohr⁸  :     201961.359214
 Mol. α(0) /au        :        138.807610

(R)spin-density population

 Mulliken population n(s)   n(p)   n(d)
     1 C   0.0157   0.000  0.016  0.000
     2 C   0.0004  -0.000  0.000  0.000
     3 C   0.2726   0.000  0.273  0.000
     4 C   0.2553   0.000  0.255  0.000
     5 C   0.0002   0.000  0.000  0.000
     6 C   0.0015   0.000  0.001  0.000
     7 C   0.0304   0.000  0.030  0.000
     8 C   0.0047   0.000  0.005  0.000
     9 S   0.0771   0.000  0.064  0.013
    10 C   0.1746   0.000  0.175  0.000
    11 C   0.0007  -0.000  0.001  0.000
    12 C   0.1634   0.000  0.163  0.000
    13 H   0.0000   0.000  0.000  0.000
    14 H   0.0000   0.000  0.000  0.000
    15 H   0.0000   0.000  0.000  0.000
    16 H   0.0000   0.000  0.000  0.000
    17 H   0.0000   0.000  0.000  0.000
    18 H  -0.0000  -0.000  0.000  0.000
    19 H   0.0032   0.003  0.000  0.000
    20 H   0.0001   0.000  0.000  0.000
    21 H   0.0000   0.000  0.000  0.000

Wiberg/Mayer (AO) data.
largest (>0.10) Wiberg bond orders for each atom
          total WBO             WBO to atom ...
     1  C   3.970        C    6 1.595    C    2 1.131    H   13 0.971
     2  C   3.988        C    3 1.625    C    4 1.136    C    1 1.131
     3  C   3.700        C    2 1.625    H   14 0.978    H   15 0.975
     4  C   3.728        C    5 1.234    C   11 1.203    C    2 1.136
     5  C   3.987        C   10 1.516    C    4 1.234    C    6 1.054
     6  C   3.986        C    1 1.595    C    7 1.176    C    5 1.054
     7  C   3.960        C    8 1.707    C    6 1.176    H   16 0.956
     8  C   3.932        C    7 1.707    S    9 1.107    H   17 0.965
     9  S   2.566        C   10 1.167    C    8 1.107
    10  C   3.782        C    5 1.516    S    9 1.167    H   18 0.956
    11  C   3.991        C   12 1.771    C    4 1.203    H   19 0.957
    12  C   3.821        C   11 1.771    H   21 0.980    H   20 0.973
    13  H   0.998        C    1 0.971
    14  H   0.998        C    3 0.978
    15  H   0.998        C    3 0.975
    16  H   0.998        C    7 0.956
    17  H   0.997        C    8 0.965
    18  H   0.996        C   10 0.956
    19  H   0.994        C   11 0.957
    20  H   0.999        C   12 0.973
    21  H   0.998        C   12 0.980

molecular dipole:
                 x           y           z       tot (Debye)
 q only:        0.247       0.108      -0.040
   full:        0.060       0.252      -0.042       0.668
molecular quadrupole (traceless):
                xx          xy          yy          xz          yz          zz
 q only:        1.080       0.915       1.262       0.306      -0.051      -2.342
  q+dip:        2.542       1.961       4.739       0.996      -1.067      -7.281
   full:        0.173       2.469       3.326       0.560      -0.432      -3.499

           -------------------------------------------------
          |                Geometry Summary                 |
           -------------------------------------------------

      molecular mass/u    :      173.2521000
   center of mass at/Å    :       -0.2949368      -0.4851964       0.1405724
  moments of inertia/u·Å² :        0.3569500E+03   0.7378481E+03   0.1088696E+04
rotational constants/cm⁻¹ :        0.4722688E-01   0.2284702E-01   0.1548424E-01

 * 19 selected distances

     #   Z        #   Z                                     value/Å
     2   6 C      3   6 C                                 1.3537492
     4   6 C      5   6 C                                 1.4214787
     1   6 C      6   6 C                                 1.3576014
     6   6 C      7   6 C                                 1.4243329
     7   6 C      8   6 C                                 1.3426427
     8   6 C      9  16 S                                 1.7384252 (max)
     5   6 C     10   6 C                                 1.3625434
     9  16 S     10   6 C                                 1.7219623
     4   6 C     11   6 C                                 1.4231887
    11   6 C     12   6 C                                 1.3407619
     1   6 C     13   1 H                                 1.0743497 (min)
     3   6 C     14   1 H                                 1.0759689
     3   6 C     15   1 H                                 1.0752129
     7   6 C     16   1 H                                 1.0816342
     8   6 C     17   1 H                                 1.0772397
    10   6 C     18   1 H                                 1.0759075
    11   6 C     19   1 H                                 1.0836942
    12   6 C     20   1 H                                 1.0744614
    12   6 C     21   1 H                                 1.0758806

 * 3 distinct bonds (by element types)

   Z      Z             #   av. dist./Å        max./Å        min./Å
   1 H    6 C           9     1.0771499     1.0836942     1.0743497
   6 C    6 C           8     1.3782874     1.4243329     1.3407619
   6 C   16 S           2     1.7301938     1.7384252     1.7219623


optimized geometry written to: xtbopt.xyz


           -------------------------------------------------
          | TOTAL ENERGY              -31.272277057556 Eh   |
          | GRADIENT NORM               0.000633255922 Eh/α |
          | HOMO-LUMO GAP               1.487642788808 eV   |
           -------------------------------------------------

------------------------------------------------------------------------
 * finished run on 2021/05/19 at 10:59:37.879     
------------------------------------------------------------------------
 total:
 * wall-time:     0 d,  0 h,  0 min,  0.549 sec
 *  cpu-time:     0 d,  0 h,  0 min,  0.547 sec
 * ratio c/w:     0.996 speedup
 SCF:
 * wall-time:     0 d,  0 h,  0 min,  0.034 sec
 *  cpu-time:     0 d,  0 h,  0 min,  0.034 sec
 * ratio c/w:     0.997 speedup
 ANC optimizer:
 * wall-time:     0 d,  0 h,  0 min,  0.495 sec
 *  cpu-time:     0 d,  0 h,  0 min,  0.494 sec
 * ratio c/w:     0.998 speedup

