      -----------------------------------------------------------      
     |                   =====================                   |     
     |                           x T B                           |     
     |                   =====================                   |     
     |                         S. Grimme                         |     
     |          Mulliken Center for Theoretical Chemistry        |     
     |                    University of Bonn                     |     
     |                Version 6.2 RC2 (SAW190805)                |     
      -----------------------------------------------------------      

   This program is distributed in the hope that it will be useful,
   but WITHOUT ANY WARRANTY; without even the implied warranty of
   MERCHANTABILITY or FITNESS FOR A PARTICULAR PURPOSE.
   
   FOR NON-COMMERCIAL, ACADEMIA USE ONLY.
   
   Cite this work as:
   * S. Grimme, C. Bannwarth, P. Shushkov, J. Chem. Theory Comput., 2017,
     13, 1989-2009. DOI: 10.1021/acs.jctc.7b00118
   * C. Bannwarth, S. Ehlert and S. Grimme., J. Chem. Theory Comput., 2019,
     15, 1652-1671. DOI: 10.1021/acs.jctc.8b01176
   * P. Pracht, E. Caldeweyher, S. Ehlert, S. Grimme, ChemRxiv, 2019, preprint.
     DOI: 10.26434/chemrxiv.8326202.v1
   
   for DFT-D4:
   * E. Caldeweyher, C. Bannwarth and S. Grimme, J. Chem. Phys., 2017,
     147, 034112. DOI: 10.1063/1.4993215
   * E. Caldeweyher, S. Ehlert, A. Hansen, H. Neugebauer, S. Spicher,
     C. Bannwarth and S. Grimme, J. Chem. Phys., 2019, 150, 154122.
     DOI: 10.1063/1.5090222
   
   for sTDA-xTB:
   * S. Grimme and C. Bannwarth, J. Chem. Phys., 2016, 145, 054103.
     DOI: 10.1063/1.4959605
   
   in the mass-spec context:
   * V. Asgeirsson, C. Bauer and S. Grimme, Chem. Sci., 2017, 8, 4879.
     DOI: 10.1039/c7sc00601b
   
   for metadynamics refer to:
   * S. Grimme, J. Chem. Theory Comput., 2019, 155, 2847-2862
     DOI: 10.1021/acs.jctc.9b00143
   
   with help from (in alphabetical order)
   C. Bannwarth, F. Bohle, G. Brandenburg, E. Caldeweyher, M. Checinski,
   S. Dohm, S. Ehlert, S. Ehrlich, F. März, H. Neugebauer, J. Pisarek,
   P. Pracht, P. Shushkov, and S. Spicher.
   
 * started run on 2021/05/19 at 10:59:38.182     

           -------------------------------------------------
          |                Calculation Setup                |
           -------------------------------------------------

          program call               : /ihome/ghutchison/geoffh/xtb/xtb 550.xyz -opt
          hostname                   : smp-n144
          coordinate file            : 550.xyz
          omp threads                :                     1
          number of atoms            :                    25
          number of electrons        :                    66
          charge                     :                     0
          spin                       :                   0.0
          first test random number   :      0.98780223678946


########################################################################
# WARNING! Please study the warnings concerning your input carefully
#  - the use of '-opt' is discouraged, please use '--opt' next time
########################################################################

           ------------------------------------------------- 
          |                 G F N 2 - x T B                 |
          | Geometry, Frequencies, Noncovalent interactions |
          |            JCTC 2019 parametrisation            |
           ------------------------------------------------- 
             KAB for C  - Si     :                1.0500
             KAB for H  - Pd     :                0.9500
             k(s)              :                1.8500
             k(p)              :                2.2300
             k(d)              :                2.2300
             k(f)              :                2.0000
             kEN (H0ij)        :               -2.0000
             D4 a1             :                0.5200
             D4 a2             :                5.0000
             D4 s6             :                1.0000
             D4 s8             :                2.7000
             D4 s9             :                5.0000
             alphaj            :                2.0000

  Z AO/shell   Hii/eV     exponent
  1     Wed Apr 25 08:07:45 CEST 2018   EN: 2.200 GM2: 0.406  GM3: 0.0800  RAES: 1.40
     1s    -10.707211    1.230000
  6     Wed Apr 25 08:07:45 CEST 2018   EN: 2.550 GM2: 0.538  GM3: 0.1500  RAES: 3.00
     2s    -13.970922    2.096432
     2p    -10.063292    1.800000
 16     Tue Apr 24 11:44:34 CEST 2018   EN: 2.580 GM2: 0.340  GM3:-0.0502  RAES: 3.10
     3s    -20.029654    1.981333
     3p    -11.377694    2.025643
     3d     -0.420282    1.702555

           ------------------------------------------------- 
          |        Self-Consistent Charge Iterations        |
           ------------------------------------------------- 

          ...................................................
          :                      SETUP                      :
          :.................................................:
          :  # basis functions                  70          :
          :  # atomic orbitals                  69          :
          :  # shells                           39          :
          :  # electrons                        66          :
          :  max. iterations                   250          :
          :  Hamiltonian                  GFN2-xTB          :
          :  restarted?                      false          :
          :  GBSA solvation                  false          :
          :  PC potential                    false          :
          :  electronic temp.          300.0000000     K    :
          :  accuracy                    1.0000000          :
          :  -> integral cutoff          0.2500000E+02      :
          :  -> integral neglect         0.1000000E-07      :
          :  -> SCF convergence          0.1000000E-05 Eh   :
          :  -> wf. convergence          0.1000000E-03 e    :
          :  Broyden damping             0.4000000          :
          ...................................................

 iter      E             dE          RMSdq      gap      omega  full diag
   1    -35.5449756 -0.355450E+02  0.409E+00    2.02       0.0  T
   2    -35.5697294 -0.247538E-01  0.244E+00    2.04       1.0  T
   3    -35.5523341  0.173952E-01  0.110E+00    2.05       1.0  T
   4    -35.5728300 -0.204959E-01  0.424E-01    2.01       1.0  T
   5    -35.5747780 -0.194800E-02  0.204E-01    2.02       1.0  T
   6    -35.5755415 -0.763513E-03  0.102E-01    2.02       1.0  T
   7    -35.5757083 -0.166811E-03  0.426E-02    2.02       1.0  T
   8    -35.5757342 -0.258590E-04  0.148E-02    2.02       1.4  T
   9    -35.5757350 -0.822835E-06  0.785E-03    2.02       2.5  T
  10    -35.5757357 -0.627817E-06  0.285E-03    2.02       7.0  T
  11    -35.5757357 -0.579009E-07  0.133E-03    2.02      15.0  T
  12    -35.5757357 -0.190684E-07  0.418E-04    2.02      47.9  T
  13    -35.5757357 -0.601446E-09  0.233E-04    2.02      85.8  T

   *** convergence criteria satisfied after 13 iterations ***

         #    Occupation            Energy/Eh            Energy/eV
      -------------------------------------------------------------
         1        2.0000           -0.7270861             -19.7850
       ...           ...                  ...                  ...
        27        2.0000           -0.4290753             -11.6757
        28        2.0000           -0.4258939             -11.5892
        29        2.0000           -0.4196420             -11.4190
        30        2.0000           -0.4089948             -11.1293
        31        2.0000           -0.3994181             -10.8687
        32        2.0000           -0.3871383             -10.5346
        33        2.0000           -0.3444381              -9.3726 (HOMO)
        34                         -0.2701767              -7.3519 (LUMO)
        35                         -0.2237431              -6.0884
        36                         -0.1934714              -5.2646
        37                         -0.1914755              -5.2103
        38                         -0.1869858              -5.0881
       ...                                ...                  ...
        69                          0.7363027              20.0358
      -------------------------------------------------------------
                  HL-Gap            0.0742614 Eh            2.0208 eV
             Fermi-level           -0.3073074 Eh           -8.3623 eV

 SCC (total)                   0 d,  0 h,  0 min,  0.041 sec
 SCC setup                      ...        0 min,  0.000 sec (  0.750%)
 Dispersion                     ...        0 min,  0.000 sec (  0.917%)
 integral evaluation            ...        0 min,  0.009 sec ( 22.854%)
 zeroth order Hamiltonian       ...        0 min,  0.000 sec (  0.440%)
 iterations                     ...        0 min,  0.016 sec ( 38.180%)
 molecular gradient             ...        0 min,  0.015 sec ( 35.739%)
 printout                       ...        0 min,  0.000 sec (  0.969%)

         :::::::::::::::::::::::::::::::::::::::::::::::::::::
         ::                     SUMMARY                     ::
         :::::::::::::::::::::::::::::::::::::::::::::::::::::
         :: total energy             -35.003932643428 Eh    ::
         :: gradient norm              0.107061360130 Eh/a0 ::
         :: HOMO-LUMO gap              2.020756602333 eV    ::
         ::.................................................::
         :: SCC energy               -35.575735728086 Eh    ::
         :: -> isotropic ES            0.003457889195 Eh    ::
         :: -> anisotropic ES          0.005513842932 Eh    ::
         :: -> anisotropic XC          0.020496985449 Eh    ::
         :: -> dispersion             -0.026738534008 Eh    ::
         :: repulsion energy           0.571641931912 Eh    ::
         :: add. restraining           0.000000000000 Eh    ::
         :::::::::::::::::::::::::::::::::::::::::::::::::::::

      ----------------------------------------------------------- 
     |                   =====================                   |
     |                        A N C O P T                        |
     |                   =====================                   |
     |               Approximate Normal Coordinate               |
     |                Rational Function Optimizer                |
      ----------------------------------------------------------- 

          ...................................................
          :                      SETUP                      :
          :.................................................:
          :   optimization level            normal          :
          :   max. optcycles                   200          :
          :   ANC micro-cycles                  20          :
          :   degrees of freedom                69          :
          :.................................................:
          :   RF solver                   davidson          :
          :   input Hessian                  false          :
          :   write xtbopt.log                true          :
          :   linear?                        false          :
          :   energy convergence         0.5000000E-05 Eh   :
          :   grad. convergence          0.1000000E-02 Eh/α :
          :   maximium RF displ.         2.0000000          :
          :   Hlow (freq-cutoff)         0.5000000E-02      :
          :   Hmax (freq-cutoff)         5.0000000          :
          :   S6 in model hess.         20.0000000          :
          ...................................................

generating ANC from model Hessian ...
Using Lindh-Hessian (1995)
 Shifting diagonal of input Hessian by   3.789814467967159E-003
 Lowest  eigenvalues of input Hessian
   -0.000000   -0.000000   -0.000000   -0.000000    0.000000    0.000000
    0.005000    0.005977    0.006877    0.009505    0.010535    0.011404
    0.012831    0.014569    0.016720    0.017015    0.018143    0.026988
 Highest eigenvalues
    1.630315    1.713515    1.809340    1.891196    1.951640    2.003129
 

........................................................................
.............................. CYCLE    1 ..............................
........................................................................
   1    -35.5757357 -0.355757E+02  0.132E-04    2.02       0.0  T
   2    -35.5757357 -0.224603E-10  0.928E-05    2.02     215.6  T
   3    -35.5757357 -0.777121E-10  0.652E-05    2.02     306.9  T
     SCC iter.                  ...        0 min,  0.004 sec
     gradient                   ...        0 min,  0.014 sec
 * total energy  :   -35.0039327 Eh     change       -0.1111329E-07 Eh
   gradient norm :     0.1070614 Eh/α   predicted     0.0000000E+00 (-100.00%)
   displ. norm   :     0.3181837 α      lambda       -0.1631333E-01
   maximum displ.:     0.2505282 α      in ANC's #15, #47, #40, ...

........................................................................
.............................. CYCLE    2 ..............................
........................................................................
   1    -35.6094910 -0.356095E+02  0.229E-01    2.11       0.0  T
   2    -35.6095602 -0.691845E-04  0.152E-01    2.11       1.0  T
   3    -35.6094903  0.699048E-04  0.104E-01    2.11       1.0  T
   4    -35.6096208 -0.130502E-03  0.496E-02    2.11       1.0  T
   5    -35.6096767 -0.559570E-04  0.140E-02    2.11       1.4  T
   6    -35.6096795 -0.276442E-05  0.480E-03    2.11       4.2  T
   7    -35.6096796 -0.143125E-06  0.212E-03    2.11       9.4  T
     SCC iter.                  ...        0 min,  0.008 sec
     gradient                   ...        0 min,  0.014 sec
 * total energy  :   -35.0153100 Eh     change       -0.1137734E-01 Eh
   gradient norm :     0.0463381 Eh/α   predicted    -0.8982452E-02 ( -21.05%)
   displ. norm   :     0.2873622 α      lambda       -0.4867512E-02
   maximum displ.:     0.2136639 α      in ANC's #15, #3, #8, ...

........................................................................
.............................. CYCLE    3 ..............................
........................................................................
   1    -35.6249076 -0.356249E+02  0.169E-01    2.20       0.0  T
   2    -35.6249396 -0.320201E-04  0.107E-01    2.20       1.0  T
   3    -35.6248763  0.632780E-04  0.746E-02    2.20       1.0  T
   4    -35.6249569 -0.805338E-04  0.304E-02    2.20       1.0  T
   5    -35.6249790 -0.221267E-04  0.643E-03    2.20       3.1  T
   6    -35.6249796 -0.602191E-06  0.214E-03    2.20       9.3  T
   7    -35.6249796 -0.123499E-07  0.121E-03    2.20      16.6  T
     SCC iter.                  ...        0 min,  0.008 sec
     gradient                   ...        0 min,  0.014 sec
 * total energy  :   -35.0179846 Eh     change       -0.2674571E-02 Eh
   gradient norm :     0.0096530 Eh/α   predicted    -0.2634745E-02 (  -1.49%)
   displ. norm   :     0.1551032 α      lambda       -0.4548650E-03
   maximum displ.:     0.0872166 α      in ANC's #3, #8, #15, ...

........................................................................
.............................. CYCLE    4 ..............................
........................................................................
   1    -35.6239188 -0.356239E+02  0.840E-02    2.21       0.0  T
   2    -35.6239211 -0.231870E-05  0.478E-02    2.20       1.0  T
   3    -35.6239151  0.598446E-05  0.185E-02    2.21       1.1  T
   4    -35.6239222 -0.705863E-05  0.519E-03    2.20       3.9  T
   5    -35.6239222  0.261310E-07  0.403E-03    2.20       5.0  T
   6    -35.6239225 -0.309899E-06  0.821E-04    2.20      24.4  T
   7    -35.6239225 -0.105902E-07  0.372E-04    2.20      53.7  T
     SCC iter.                  ...        0 min,  0.008 sec
     gradient                   ...        0 min,  0.014 sec
 * total energy  :   -35.0182831 Eh     change       -0.2984934E-03 Eh
   gradient norm :     0.0042259 Eh/α   predicted    -0.2329043E-03 ( -21.97%)
   displ. norm   :     0.1715976 α      lambda       -0.2387477E-03
   maximum displ.:     0.1200499 α      in ANC's #3, #8, #6, ...

........................................................................
.............................. CYCLE    5 ..............................
........................................................................
   1    -35.6227529 -0.356228E+02  0.108E-01    2.20       0.0  T
   2    -35.6227560 -0.312322E-05  0.576E-02    2.20       1.0  T
   3    -35.6227501  0.586547E-05  0.195E-02    2.20       1.0  T
   4    -35.6227566 -0.643488E-05  0.875E-03    2.20       2.3  T
   5    -35.6227569 -0.349408E-06  0.505E-03    2.20       4.0  T
   6    -35.6227574 -0.478018E-06  0.113E-03    2.20      17.7  T
   7    -35.6227574 -0.265793E-07  0.424E-04    2.20      47.1  T
     SCC iter.                  ...        0 min,  0.008 sec
     gradient                   ...        0 min,  0.014 sec
 * total energy  :   -35.0184228 Eh     change       -0.1397094E-03 Eh
   gradient norm :     0.0038751 Eh/α   predicted    -0.1228921E-03 ( -12.04%)
   displ. norm   :     0.1347606 α      lambda       -0.1289599E-03
   maximum displ.:     0.0862319 α      in ANC's #3, #6, #5, ...

........................................................................
.............................. CYCLE    6 ..............................
........................................................................
   1    -35.6228438 -0.356228E+02  0.938E-02    2.19       0.0  T
   2    -35.6228455 -0.170873E-05  0.517E-02    2.20       1.0  T
   3    -35.6228429  0.259469E-05  0.135E-02    2.20       1.5  T
   4    -35.6228452 -0.228809E-05  0.766E-03    2.20       2.6  T
   5    -35.6228460 -0.790779E-06  0.259E-03    2.20       7.7  T
   6    -35.6228461 -0.903309E-07  0.860E-04    2.20      23.3  T
   7    -35.6228461 -0.158672E-07  0.210E-04    2.20      95.2  T
     SCC iter.                  ...        0 min,  0.008 sec
     gradient                   ...        0 min,  0.014 sec
 * total energy  :   -35.0185260 Eh     change       -0.1032298E-03 Eh
   gradient norm :     0.0042570 Eh/α   predicted    -0.6565126E-04 ( -36.40%)
   displ. norm   :     0.2749898 α      lambda       -0.2269889E-03
   maximum displ.:     0.1647374 α      in ANC's #3, #6, #4, ...

........................................................................
.............................. CYCLE    7 ..............................
........................................................................
   1    -35.6224918 -0.356225E+02  0.189E-01    2.17       0.0  T
   2    -35.6224984 -0.653214E-05  0.105E-01    2.18       1.0  T
   3    -35.6224655  0.328989E-04  0.410E-02    2.18       1.0  T
   4    -35.6225001 -0.346038E-04  0.139E-02    2.18       1.4  T
   5    -35.6225018 -0.172106E-05  0.548E-03    2.18       3.6  T
   6    -35.6225022 -0.413350E-06  0.158E-03    2.18      12.7  T
   7    -35.6225022 -0.436978E-07  0.513E-04    2.18      39.0  T
     SCC iter.                  ...        0 min,  0.008 sec
     gradient                   ...        0 min,  0.014 sec
 * total energy  :   -35.0187008 Eh     change       -0.1747884E-03 Eh
   gradient norm :     0.0050562 Eh/α   predicted    -0.1220791E-03 ( -30.16%)
   displ. norm   :     0.3035166 α      lambda       -0.2235678E-03
   maximum displ.:     0.1713106 α      in ANC's #6, #3, #4, ...

........................................................................
.............................. CYCLE    8 ..............................
........................................................................
   1    -35.6218855 -0.356219E+02  0.202E-01    2.15       0.0  T
   2    -35.6218917 -0.625117E-05  0.114E-01    2.15       1.0  T
   3    -35.6218221  0.695809E-04  0.577E-02    2.15       1.0  T
   4    -35.6218966 -0.744540E-04  0.137E-02    2.15       1.5  T
   5    -35.6218977 -0.108261E-05  0.656E-03    2.15       3.1  T
   6    -35.6218983 -0.653282E-06  0.165E-03    2.15      12.1  T
   7    -35.6218984 -0.416153E-07  0.613E-04    2.15      32.6  T
     SCC iter.                  ...        0 min,  0.008 sec
     gradient                   ...        0 min,  0.014 sec
 * total energy  :   -35.0188596 Eh     change       -0.1587764E-03 Eh
   gradient norm :     0.0059207 Eh/α   predicted    -0.1220823E-03 ( -23.11%)
   displ. norm   :     0.2306279 α      lambda       -0.2101749E-03
   maximum displ.:     0.1356425 α      in ANC's #6, #3, #4, ...

........................................................................
.............................. CYCLE    9 ..............................
........................................................................
   1    -35.6232772 -0.356233E+02  0.137E-01    2.14       0.0  T
   2    -35.6232793 -0.210923E-05  0.788E-02    2.14       1.0  T
   3    -35.6232389  0.404029E-04  0.439E-02    2.14       1.0  T
   4    -35.6232821 -0.431457E-04  0.837E-03    2.14       2.4  T
   5    -35.6232824 -0.358306E-06  0.473E-03    2.14       4.2  T
   6    -35.6232828 -0.378607E-06  0.103E-03    2.14      19.4  T
   7    -35.6232828 -0.131320E-07  0.454E-04    2.14      44.1  T
     SCC iter.                  ...        0 min,  0.008 sec
     gradient                   ...        0 min,  0.014 sec
 * total energy  :   -35.0190117 Eh     change       -0.1521465E-03 Eh
   gradient norm :     0.0050068 Eh/α   predicted    -0.1106818E-03 ( -27.25%)
   displ. norm   :     0.2753931 α      lambda       -0.1829984E-03
   maximum displ.:     0.1558670 α      in ANC's #6, #4, #3, ...

........................................................................
.............................. CYCLE   10 ..............................
........................................................................
   1    -35.6226903 -0.356227E+02  0.156E-01    2.13       0.0  T
   2    -35.6226920 -0.169919E-05  0.904E-02    2.13       1.0  T
   3    -35.6226493  0.426474E-04  0.449E-02    2.13       1.0  T
   4    -35.6226945 -0.451930E-04  0.769E-03    2.12       2.6  T
   5    -35.6226948 -0.336101E-06  0.454E-03    2.13       4.4  T
   6    -35.6226952 -0.392324E-06  0.106E-03    2.13      18.8  T
   7    -35.6226952 -0.126331E-07  0.441E-04    2.13      45.3  T
     SCC iter.                  ...        0 min,  0.008 sec
     gradient                   ...        0 min,  0.014 sec
 * total energy  :   -35.0191476 Eh     change       -0.1358760E-03 Eh
   gradient norm :     0.0056032 Eh/α   predicted    -0.9844991E-04 ( -27.54%)
   displ. norm   :     0.2839157 α      lambda       -0.2414097E-03
   maximum displ.:     0.1544446 α      in ANC's #7, #6, #1, ...

........................................................................
.............................. CYCLE   11 ..............................
........................................................................
   1    -35.6249881 -0.356250E+02  0.143E-01    2.12       0.0  T
   2    -35.6249907 -0.262508E-05  0.832E-02    2.12       1.0  T
   3    -35.6249650  0.257032E-04  0.366E-02    2.12       1.0  T
   4    -35.6249917 -0.267291E-04  0.813E-03    2.12       2.5  T
   5    -35.6249926 -0.895005E-06  0.447E-03    2.12       4.5  T
   6    -35.6249931 -0.424250E-06  0.113E-03    2.12      17.7  T
   7    -35.6249931 -0.100030E-07  0.437E-04    2.12      45.7  T
     SCC iter.                  ...        0 min,  0.008 sec
     gradient                   ...        0 min,  0.014 sec
 * total energy  :   -35.0192866 Eh     change       -0.1389983E-03 Eh
   gradient norm :     0.0065278 Eh/α   predicted    -0.1304348E-03 (  -6.16%)
   displ. norm   :     0.4153043 α      lambda       -0.2244946E-03
   maximum displ.:     0.2175834 α      in ANC's #6, #7, #4, ...

........................................................................
.............................. CYCLE   12 ..............................
........................................................................
   1    -35.6196229 -0.356196E+02  0.239E-01    2.10       0.0  T
   2    -35.6196291 -0.625329E-05  0.137E-01    2.10       1.0  T
   3    -35.6195768  0.523172E-04  0.519E-02    2.10       1.0  T
   4    -35.6196315 -0.546901E-04  0.147E-02    2.10       1.4  T
   5    -35.6196330 -0.151589E-05  0.748E-03    2.10       2.7  T
   6    -35.6196342 -0.120137E-05  0.160E-03    2.10      12.5  T
   7    -35.6196343 -0.389867E-07  0.592E-04    2.10      33.8  T
     SCC iter.                  ...        0 min,  0.008 sec
     gradient                   ...        0 min,  0.014 sec
 * total energy  :   -35.0193679 Eh     change       -0.8128995E-04 Eh
   gradient norm :     0.0100974 Eh/α   predicted    -0.1316095E-03 (  61.90%)
   displ. norm   :     0.1069771 α      lambda       -0.2979257E-03
   maximum displ.:     0.0617095 α      in ANC's #7, #5, #6, ...

........................................................................
.............................. CYCLE   13 ..............................
........................................................................
   1    -35.6239802 -0.356240E+02  0.586E-02    2.11       0.0  T
   2    -35.6239819 -0.175478E-05  0.343E-02    2.11       1.0  T
   3    -35.6239699  0.119913E-04  0.241E-02    2.11       1.0  T
   4    -35.6239828 -0.128822E-04  0.492E-03    2.11       4.1  T
   5    -35.6239832 -0.394951E-06  0.185E-03    2.11      10.8  T
   6    -35.6239833 -0.389002E-07  0.828E-04    2.11      24.2  T
     SCC iter.                  ...        0 min,  0.007 sec
     gradient                   ...        0 min,  0.014 sec
 * total energy  :   -35.0195261 Eh     change       -0.1582337E-03 Eh
   gradient norm :     0.0053841 Eh/α   predicted    -0.1506684E-03 (  -4.78%)
   displ. norm   :     0.2427422 α      lambda       -0.2852907E-03
   maximum displ.:     0.1774333 α      in ANC's #7, #5, #6, ...

........................................................................
.............................. CYCLE   14 ..............................
........................................................................
   1    -35.6255476 -0.356255E+02  0.130E-01    2.10       0.0  T
   2    -35.6255510 -0.344208E-05  0.731E-02    2.11       1.0  T
   3    -35.6255477  0.332332E-05  0.170E-02    2.11       1.2  T
   4    -35.6255514 -0.373111E-05  0.710E-03    2.11       2.8  T
   5    -35.6255519 -0.446063E-06  0.209E-03    2.11       9.6  T
   6    -35.6255519 -0.338305E-07  0.125E-03    2.11      15.9  T
     SCC iter.                  ...        0 min,  0.007 sec
     gradient                   ...        0 min,  0.014 sec
 * total energy  :   -35.0196863 Eh     change       -0.1601440E-03 Eh
   gradient norm :     0.0078068 Eh/α   predicted    -0.1510516E-03 (  -5.68%)
   displ. norm   :     0.3218002 α      lambda       -0.2022065E-03
   maximum displ.:     0.2328362 α      in ANC's #7, #5, #6, ...

........................................................................
.............................. CYCLE   15 ..............................
........................................................................
   1    -35.6229007 -0.356229E+02  0.171E-01    2.09       0.0  T
   2    -35.6229042 -0.348260E-05  0.978E-02    2.10       1.0  T
   3    -35.6229015  0.268614E-05  0.159E-02    2.10       1.3  T
   4    -35.6229040 -0.250853E-05  0.868E-03    2.10       2.3  T
   5    -35.6229047 -0.765188E-06  0.414E-03    2.10       4.8  T
   6    -35.6229051 -0.352888E-06  0.148E-03    2.10      13.6  T
   7    -35.6229051 -0.442235E-07  0.294E-04    2.10      68.1  T
     SCC iter.                  ...        0 min,  0.008 sec
     gradient                   ...        0 min,  0.014 sec
 * total energy  :   -35.0198053 Eh     change       -0.1190190E-03 Eh
   gradient norm :     0.0084745 Eh/α   predicted    -0.1115733E-03 (  -6.26%)
   displ. norm   :     0.1430567 α      lambda       -0.2216331E-03
   maximum displ.:     0.1085471 α      in ANC's #7, #5, #2, ...

........................................................................
.............................. CYCLE   16 ..............................
........................................................................
   1    -35.6241919 -0.356242E+02  0.714E-02    2.09       0.0  T
   2    -35.6241930 -0.113853E-05  0.419E-02    2.09       1.0  T
   3    -35.6241882  0.481927E-05  0.159E-02    2.09       1.3  T
   4    -35.6241930 -0.476481E-05  0.513E-03    2.09       3.9  T
   5    -35.6241935 -0.564956E-06  0.172E-03    2.09      11.7  T
   6    -35.6241936 -0.570419E-07  0.601E-04    2.09      33.3  T
     SCC iter.                  ...        0 min,  0.007 sec
     gradient                   ...        0 min,  0.014 sec
 * total energy  :   -35.0199452 Eh     change       -0.1399445E-03 Eh
   gradient norm :     0.0053890 Eh/α   predicted    -0.1130876E-03 ( -19.19%)
   displ. norm   :     0.2742832 α      lambda       -0.2055373E-03
   maximum displ.:     0.2176470 α      in ANC's #7, #5, #2, ...

........................................................................
.............................. CYCLE   17 ..............................
........................................................................
   1    -35.6224416 -0.356224E+02  0.137E-01    2.09       0.0  T
   2    -35.6224435 -0.183707E-05  0.800E-02    2.09       1.0  T
   3    -35.6224369  0.657489E-05  0.192E-02    2.09       1.0  T
   4    -35.6224440 -0.705490E-05  0.596E-03    2.09       3.4  T
   5    -35.6224441 -0.139789E-06  0.364E-03    2.09       5.5  T
   6    -35.6224444 -0.296661E-06  0.115E-03    2.09      17.3  T
   7    -35.6224444 -0.235139E-07  0.403E-04    2.09      49.6  T
     SCC iter.                  ...        0 min,  0.008 sec
     gradient                   ...        0 min,  0.014 sec
 * total energy  :   -35.0200290 Eh     change       -0.8380960E-04 Eh
   gradient norm :     0.0095911 Eh/α   predicted    -0.1105064E-03 (  31.85%)
   displ. norm   :     0.0942957 α      lambda       -0.1763594E-03
   maximum displ.:     0.0585310 α      in ANC's #2, #1, #4, ...

........................................................................
.............................. CYCLE   18 ..............................
........................................................................
   1    -35.6251743 -0.356252E+02  0.505E-02    2.09       0.0  T
   2    -35.6251752 -0.863904E-06  0.295E-02    2.09       1.0  T
   3    -35.6251681  0.709182E-05  0.177E-02    2.09       1.1  T
   4    -35.6251756 -0.747992E-05  0.420E-03    2.09       4.8  T
   5    -35.6251758 -0.252551E-06  0.148E-03    2.09      13.5  T
   6    -35.6251759 -0.123655E-07  0.766E-04    2.09      26.1  T
     SCC iter.                  ...        0 min,  0.007 sec
     gradient                   ...        0 min,  0.014 sec
 * total energy  :   -35.0201370 Eh     change       -0.1079646E-03 Eh
   gradient norm :     0.0055415 Eh/α   predicted    -0.8896521E-04 ( -17.60%)
   displ. norm   :     0.1891234 α      lambda       -0.1453515E-03
   maximum displ.:     0.1346043 α      in ANC's #7, #6, #5, ...

........................................................................
.............................. CYCLE   19 ..............................
........................................................................
   1    -35.6235387 -0.356235E+02  0.955E-02    2.08       0.0  T
   2    -35.6235398 -0.109404E-05  0.558E-02    2.08       1.0  T
   3    -35.6235374  0.241163E-05  0.112E-02    2.08       1.8  T
   4    -35.6235400 -0.265671E-05  0.411E-03    2.08       4.9  T
   5    -35.6235402 -0.167199E-06  0.184E-03    2.08      10.9  T
   6    -35.6235402 -0.258574E-07  0.112E-03    2.08      17.8  T
     SCC iter.                  ...        0 min,  0.007 sec
     gradient                   ...        0 min,  0.014 sec
 * total energy  :   -35.0202248 Eh     change       -0.8778295E-04 Eh
   gradient norm :     0.0068006 Eh/α   predicted    -0.7527692E-04 ( -14.25%)
   displ. norm   :     0.1709397 α      lambda       -0.1694690E-03
   maximum displ.:     0.0886195 α      in ANC's #1, #7, #2, ...

........................................................................
.............................. CYCLE   20 ..............................
........................................................................
   1    -35.6253210 -0.356253E+02  0.814E-02    2.09       0.0  T
   2    -35.6253226 -0.165786E-05  0.481E-02    2.08       1.0  T
   3    -35.6253046  0.180368E-04  0.281E-02    2.08       1.0  T
   4    -35.6253234 -0.188463E-04  0.659E-03    2.08       3.0  T
   5    -35.6253242 -0.813802E-06  0.208E-03    2.08       9.6  T
   6    -35.6253243 -0.493590E-07  0.984E-04    2.08      20.3  T
     SCC iter.                  ...        0 min,  0.007 sec
     gradient                   ...        0 min,  0.014 sec
 * total energy  :   -35.0203215 Eh     change       -0.9668047E-04 Eh
   gradient norm :     0.0054522 Eh/α   predicted    -0.8721250E-04 (  -9.79%)
   displ. norm   :     0.3126069 α      lambda       -0.1553637E-03
   maximum displ.:     0.2247090 α      in ANC's #7, #5, #2, ...
 * RMSD in coord.:     0.6112879 α      energy gain  -0.1638881E-01 Eh

generating ANC from model Hessian ...
Using Lindh-Hessian (1995)
 Shifting diagonal of input Hessian by   3.730804384868377E-003
 Lowest  eigenvalues of input Hessian
   -0.000000   -0.000000   -0.000000   -0.000000    0.000000    0.000000
    0.005000    0.006114    0.007831    0.009195    0.010606    0.012104
    0.013263    0.015319    0.017138    0.018065    0.020047    0.026164
 Highest eigenvalues
    1.749235    1.774275    1.842588    1.966920    2.018229    2.049097
 

........................................................................
.............................. CYCLE   21 ..............................
........................................................................
   1    -35.6220343 -0.356220E+02  0.145E-01    2.09       0.0  T
   2    -35.6220356 -0.133154E-05  0.862E-02    2.09       1.0  T
   3    -35.6219952  0.403995E-04  0.407E-02    2.09       1.0  T
   4    -35.6220377 -0.425414E-04  0.536E-03    2.09       3.7  T
   5    -35.6220382 -0.431545E-06  0.206E-03    2.08       9.7  T
   6    -35.6220382 -0.298592E-07  0.100E-03    2.09      20.0  T
   7    -35.6220382 -0.979497E-08  0.384E-04    2.09      52.1  T
   8    -35.6220382 -0.735390E-09  0.239E-04    2.09      83.8  T
     SCC iter.                  ...        0 min,  0.009 sec
     gradient                   ...        0 min,  0.014 sec
 * total energy  :   -35.0202973 Eh     change        0.2416179E-04 Eh
   gradient norm :     0.0107468 Eh/α   predicted     0.0000000E+00 (-100.00%)
   displ. norm   :     0.0889283 α      lambda       -0.3036858E-03
   maximum displ.:     0.0542969 α      in ANC's #6, #1, #3, ...

........................................................................
.............................. CYCLE   22 ..............................
........................................................................
   1    -35.6248084 -0.356248E+02  0.441E-02    2.08       0.0  T
   2    -35.6248093 -0.899558E-06  0.258E-02    2.08       1.0  T
   3    -35.6248036  0.573195E-05  0.164E-02    2.08       1.2  T
   4    -35.6248096 -0.605066E-05  0.441E-03    2.08       4.5  T
   5    -35.6248100 -0.345010E-06  0.152E-03    2.08      13.1  T
   6    -35.6248100 -0.351755E-07  0.615E-04    2.08      32.5  T
     SCC iter.                  ...        0 min,  0.007 sec
     gradient                   ...        0 min,  0.014 sec
 * total energy  :   -35.0204970 Eh     change       -0.1997301E-03 Eh
   gradient norm :     0.0029393 Eh/α   predicted    -0.1530449E-03 ( -23.37%)
   displ. norm   :     0.1031813 α      lambda       -0.1050105E-03
   maximum displ.:     0.0829845 α      in ANC's #6, #1, #7, ...

........................................................................
.............................. CYCLE   23 ..............................
........................................................................
   1    -35.6259296 -0.356259E+02  0.490E-02    2.09       0.0  T
   2    -35.6259297 -0.576873E-07  0.292E-02    2.09       1.0  T
   3    -35.6259229  0.680456E-05  0.169E-02    2.09       1.2  T
   4    -35.6259301 -0.719313E-05  0.216E-03    2.09       9.3  T
   5    -35.6259302 -0.882540E-07  0.782E-04    2.09      25.6  T
   6    -35.6259302 -0.688775E-08  0.333E-04    2.09      60.0  T
     SCC iter.                  ...        0 min,  0.007 sec
     gradient                   ...        0 min,  0.015 sec
 * total energy  :   -35.0205799 Eh     change       -0.8290718E-04 Eh
   gradient norm :     0.0017850 Eh/α   predicted    -0.5306473E-04 ( -36.00%)
   displ. norm   :     0.2450023 α      lambda       -0.1158683E-03
   maximum displ.:     0.1866229 α      in ANC's #6, #1, #7, ...

........................................................................
.............................. CYCLE   24 ..............................
........................................................................
   1    -35.6257566 -0.356258E+02  0.117E-01    2.09       0.0  T
   2    -35.6257574 -0.744738E-06  0.686E-02    2.09       1.0  T
   3    -35.6257484  0.892390E-05  0.196E-02    2.09       1.0  T
   4    -35.6257577 -0.924094E-05  0.546E-03    2.09       3.7  T
   5    -35.6257580 -0.309190E-06  0.268E-03    2.09       7.5  T
   6    -35.6257581 -0.130414E-06  0.616E-04    2.09      32.5  T
   7    -35.6257581 -0.392733E-08  0.303E-04    2.09      66.1  T
     SCC iter.                  ...        0 min,  0.008 sec
     gradient                   ...        0 min,  0.014 sec
 * total energy  :   -35.0207126 Eh     change       -0.1326801E-03 Eh
   gradient norm :     0.0037828 Eh/α   predicted    -0.5949065E-04 ( -55.16%)
   displ. norm   :     0.1592857 α      lambda       -0.9629884E-04
   maximum displ.:     0.1195445 α      in ANC's #6, #1, #7, ...

........................................................................
.............................. CYCLE   25 ..............................
........................................................................
   1    -35.6249468 -0.356249E+02  0.744E-02    2.10       0.0  T
   2    -35.6249471 -0.259774E-06  0.440E-02    2.10       1.0  T
   3    -35.6249439  0.316418E-05  0.121E-02    2.10       1.7  T
   4    -35.6249472 -0.330883E-05  0.218E-03    2.10       9.2  T
   5    -35.6249473 -0.684062E-07  0.101E-03    2.10      19.8  T
   6    -35.6249473 -0.157041E-07  0.403E-04    2.10      49.7  T
   7    -35.6249473 -0.198704E-08  0.111E-04    2.10     180.0  T
     SCC iter.                  ...        0 min,  0.008 sec
     gradient                   ...        0 min,  0.014 sec
 * total energy  :   -35.0207832 Eh     change       -0.7055838E-04 Eh
   gradient norm :     0.0037945 Eh/α   predicted    -0.4937535E-04 ( -30.02%)
   displ. norm   :     0.1823002 α      lambda       -0.8321259E-04
   maximum displ.:     0.1325266 α      in ANC's #6, #1, #7, ...

........................................................................
.............................. CYCLE   26 ..............................
........................................................................
   1    -35.6243764 -0.356244E+02  0.873E-02    2.10       0.0  T
   2    -35.6243769 -0.485561E-06  0.511E-02    2.10       1.0  T
   3    -35.6243759  0.959555E-06  0.743E-03    2.10       2.7  T
   4    -35.6243768 -0.836965E-06  0.399E-03    2.10       5.0  T
   5    -35.6243770 -0.248899E-06  0.173E-03    2.10      11.6  T
   6    -35.6243771 -0.530488E-07  0.472E-04    2.10      42.4  T
   7    -35.6243771 -0.367351E-08  0.135E-04    2.10     148.0  T
     SCC iter.                  ...        0 min,  0.008 sec
     gradient                   ...        0 min,  0.015 sec
 * total energy  :   -35.0208395 Eh     change       -0.5636165E-04 Eh
   gradient norm :     0.0044465 Eh/α   predicted    -0.4298982E-04 ( -23.73%)
   displ. norm   :     0.1824597 α      lambda        0.8900672E-05
   maximum displ.:     0.1325213 α      in ANC's #6, #1, #7, ...

........................................................................
.............................. CYCLE   27 ..............................
........................................................................
   1    -35.6228022 -0.356228E+02  0.874E-02    2.11       0.0  T
   2    -35.6228030 -0.724109E-06  0.511E-02    2.11       1.0  T
   3    -35.6228022  0.789337E-06  0.718E-03    2.11       2.8  T
   4    -35.6228028 -0.646043E-06  0.406E-03    2.11       4.9  T
   5    -35.6228031 -0.271176E-06  0.173E-03    2.11      11.6  T
   6    -35.6228031 -0.485419E-07  0.650E-04    2.11      30.8  T
     SCC iter.                  ...        0 min,  0.007 sec
     gradient                   ...        0 min,  0.014 sec
 * total energy  :   -35.0208190 Eh     change        0.2050602E-04 Eh
   gradient norm :     0.0083908 Eh/α   predicted     0.4597887E-05 ( -77.58%)
   displ. norm   :     0.0790776 α      lambda       -0.1079510E-03
   maximum displ.:     0.0620096 α      in ANC's #6, #7, #1, ...

........................................................................
.............................. CYCLE   28 ..............................
........................................................................
   1    -35.6252212 -0.356252E+02  0.390E-02    2.11       0.0  T
   2    -35.6252219 -0.711981E-06  0.225E-02    2.11       1.0  T
   3    -35.6252208  0.112233E-05  0.776E-03    2.11       2.6  T
   4    -35.6252217 -0.910208E-06  0.385E-03    2.11       5.2  T
   5    -35.6252220 -0.323531E-06  0.732E-04    2.11      27.3  T
   6    -35.6252220 -0.124768E-08  0.436E-04    2.11      45.8  T
     SCC iter.                  ...        0 min,  0.007 sec
     gradient                   ...        0 min,  0.014 sec
 * total energy  :   -35.0208841 Eh     change       -0.6506610E-04 Eh
   gradient norm :     0.0034648 Eh/α   predicted    -0.5431922E-04 ( -16.52%)
   displ. norm   :     0.0588728 α      lambda       -0.3489945E-04
   maximum displ.:     0.0318463 α      in ANC's #1, #4, #6, ...

........................................................................
.............................. CYCLE   29 ..............................
........................................................................
   1    -35.6260708 -0.356261E+02  0.307E-02    2.11       0.0  T
   2    -35.6260710 -0.167076E-06  0.180E-02    2.11       1.1  T
   3    -35.6260699  0.108973E-05  0.707E-03    2.11       2.8  T
   4    -35.6260710 -0.111280E-05  0.188E-03    2.11      10.6  T
   5    -35.6260711 -0.613484E-07  0.680E-04    2.11      29.4  T
   6    -35.6260711 -0.594022E-08  0.299E-04    2.11      66.8  T
     SCC iter.                  ...        0 min,  0.007 sec
     gradient                   ...        0 min,  0.015 sec
 * total energy  :   -35.0209107 Eh     change       -0.2657355E-04 Eh
   gradient norm :     0.0017623 Eh/α   predicted    -0.1751170E-04 ( -34.10%)
   displ. norm   :     0.2117889 α      lambda       -0.3945711E-04
   maximum displ.:     0.1214240 α      in ANC's #6, #1, #4, ...

........................................................................
.............................. CYCLE   30 ..............................
........................................................................
   1    -35.6262635 -0.356263E+02  0.108E-01    2.12       0.0  T
   2    -35.6262642 -0.719252E-06  0.628E-02    2.12       1.0  T
   3    -35.6262559  0.826910E-05  0.200E-02    2.11       1.0  T
   4    -35.6262646 -0.865412E-05  0.519E-03    2.12       3.9  T
   5    -35.6262648 -0.186988E-06  0.288E-03    2.11       7.0  T
   6    -35.6262649 -0.169949E-06  0.552E-04    2.11      36.3  T
   7    -35.6262649 -0.433000E-08  0.235E-04    2.11      84.9  T
     SCC iter.                  ...        0 min,  0.008 sec
     gradient                   ...        0 min,  0.014 sec
 * total energy  :   -35.0209483 Eh     change       -0.3766018E-04 Eh
   gradient norm :     0.0017201 Eh/α   predicted    -0.2012216E-04 ( -46.57%)
   displ. norm   :     0.1634582 α      lambda       -0.1711787E-04
   maximum displ.:     0.0985543 α      in ANC's #6, #1, #4, ...

........................................................................
.............................. CYCLE   31 ..............................
........................................................................
   1    -35.6256271 -0.356256E+02  0.857E-02    2.12       0.0  T
   2    -35.6256277 -0.634921E-06  0.493E-02    2.12       1.0  T
   3    -35.6256243  0.342513E-05  0.137E-02    2.12       1.5  T
   4    -35.6256278 -0.352825E-05  0.479E-03    2.12       4.2  T
   5    -35.6256280 -0.161301E-06  0.241E-03    2.12       8.3  T
   6    -35.6256281 -0.132177E-06  0.457E-04    2.12      43.7  T
   7    -35.6256281 -0.405797E-08  0.130E-04    2.12     153.7  T
     SCC iter.                  ...        0 min,  0.008 sec
     gradient                   ...        0 min,  0.014 sec
 * total energy  :   -35.0209616 Eh     change       -0.1327902E-04 Eh
   gradient norm :     0.0017006 Eh/α   predicted    -0.8668417E-05 ( -34.72%)
   displ. norm   :     0.0379619 α      lambda       -0.7949940E-05
   maximum displ.:     0.0227881 α      in ANC's #4, #2, #3, ...

........................................................................
.............................. CYCLE   32 ..............................
........................................................................
   1    -35.6265188 -0.356265E+02  0.265E-02    2.13       0.0  T
   2    -35.6265190 -0.171151E-06  0.148E-02    2.13       1.3  T
   3    -35.6265182  0.711104E-06  0.635E-03    2.13       3.2  T
   4    -35.6265190 -0.749901E-06  0.201E-03    2.13      10.0  T
   5    -35.6265190 -0.333426E-07  0.109E-03    2.13      18.3  T
   6    -35.6265190 -0.194441E-07  0.367E-04    2.13      54.5  T
   7    -35.6265191 -0.269659E-08  0.105E-04    2.13     191.0  T
     SCC iter.                  ...        0 min,  0.008 sec
     gradient                   ...        0 min,  0.015 sec
 * total energy  :   -35.0209683 Eh     change       -0.6687801E-05 Eh
   gradient norm :     0.0006593 Eh/α   predicted    -0.3977851E-05 ( -40.52%)
   displ. norm   :     0.0378918 α      lambda        0.4976954E-05
   maximum displ.:     0.0227911 α      in ANC's #4, #2, #3, ...

........................................................................
.............................. CYCLE   33 ..............................
........................................................................
   1    -35.6273621 -0.356274E+02  0.265E-02    2.13       0.0  T
   2    -35.6273623 -0.169787E-06  0.148E-02    2.13       1.3  T
   3    -35.6273616  0.713335E-06  0.635E-03    2.13       3.1  T
   4    -35.6273623 -0.753069E-06  0.201E-03    2.13       9.9  T
   5    -35.6273624 -0.324856E-07  0.109E-03    2.13      18.3  T
   6    -35.6273624 -0.196316E-07  0.362E-04    2.13      55.2  T
   7    -35.6273624 -0.261601E-08  0.104E-04    2.13     191.6  T
     SCC iter.                  ...        0 min,  0.008 sec
     gradient                   ...        0 min,  0.015 sec
 * total energy  :   -35.0209647 Eh     change        0.3581886E-05 Eh
   gradient norm :     0.0021233 Eh/α   predicted     0.2488565E-05 ( -30.52%)
   displ. norm   :     0.0252748 α      lambda        0.1804174E-04
   maximum displ.:     0.0151948 α      in ANC's #4, #2, #3, ...

........................................................................
.............................. CYCLE   34 ..............................
........................................................................
   1    -35.6279032 -0.356279E+02  0.176E-02    2.13       0.0  T
   2    -35.6279033 -0.743809E-07  0.988E-03    2.13       2.0  T
   3    -35.6279030  0.323826E-06  0.427E-03    2.13       4.7  T
   4    -35.6279033 -0.342252E-06  0.133E-03    2.13      15.0  T
   5    -35.6279033 -0.140259E-07  0.729E-04    2.13      27.4  T
   6    -35.6279033 -0.877784E-08  0.239E-04    2.13      83.6  T
     SCC iter.                  ...        0 min,  0.007 sec
     gradient                   ...        0 min,  0.014 sec
 * total energy  :   -35.0209568 Eh     change        0.7871799E-05 Eh
   gradient norm :     0.0032766 Eh/α   predicted     0.9026511E-05 (  14.67%)
   displ. norm   :     0.0252133 α      lambda        0.2434866E-04
   maximum displ.:     0.0151910 α      in ANC's #4, #2, #3, ...

........................................................................
.............................. CYCLE   35 ..............................
........................................................................
   1    -35.6284218 -0.356284E+02  0.177E-02    2.13       0.0  T
   2    -35.6284219 -0.762483E-07  0.986E-03    2.13       2.0  T
   3    -35.6284216  0.302323E-06  0.416E-03    2.13       4.8  T
   4    -35.6284219 -0.318910E-06  0.135E-03    2.13      14.8  T
   5    -35.6284219 -0.145930E-07  0.731E-04    2.13      27.4  T
   6    -35.6284219 -0.884701E-08  0.241E-04    2.13      83.1  T
     SCC iter.                  ...        0 min,  0.007 sec
     gradient                   ...        0 min,  0.015 sec
 * total energy  :   -35.0209447 Eh     change        0.1213644E-04 Eh
   gradient norm :     0.0044329 Eh/α   predicted     0.1217911E-04 (   0.35%)
   displ. norm   :     0.0607083 α      lambda       -0.5121848E-04
   maximum displ.:     0.0359574 α      in ANC's #4, #2, #5, ...

........................................................................
.............................. CYCLE   36 ..............................
........................................................................
   1    -35.6266367 -0.356266E+02  0.457E-02    2.13       0.0  T
   2    -35.6266375 -0.754670E-06  0.248E-02    2.13       1.0  T
   3    -35.6266353  0.214135E-05  0.113E-02    2.13       1.8  T
   4    -35.6266376 -0.227553E-05  0.398E-03    2.13       5.0  T
   5    -35.6266377 -0.138796E-06  0.201E-03    2.13       9.9  T
   6    -35.6266378 -0.578176E-07  0.755E-04    2.13      26.5  T
     SCC iter.                  ...        0 min,  0.007 sec
     gradient                   ...        0 min,  0.014 sec
 * total energy  :   -35.0209706 Eh     change       -0.2587307E-04 Eh
   gradient norm :     0.0006391 Eh/α   predicted    -0.2572911E-04 (  -0.56%)
   displ. norm   :     0.0221044 α      lambda       -0.1898378E-05
   maximum displ.:     0.0125413 α      in ANC's #6, #7, #4, ...

........................................................................
.............................. CYCLE   37 ..............................
........................................................................
   1    -35.6263677 -0.356264E+02  0.120E-02    2.13       0.0  T
   2    -35.6263678 -0.197912E-07  0.697E-03    2.13       2.9  T
   3    -35.6263677  0.254277E-07  0.131E-03    2.13      15.2  T
   4    -35.6263678 -0.273476E-07  0.463E-04    2.13      43.2  T
   5    -35.6263678 -0.286186E-08  0.142E-04    2.13     140.6  T
     SCC iter.                  ...        0 min,  0.006 sec
     gradient                   ...        0 min,  0.014 sec
 * total energy  :   -35.0209717 Eh     change       -0.1146007E-05 Eh
   gradient norm :     0.0006016 Eh/α   predicted    -0.9496880E-06 ( -17.13%)
   displ. norm   :     0.0266683 α      lambda       -0.1606222E-05
   maximum displ.:     0.0143816 α      in ANC's #4, #6, #3, ...

   *** GEOMETRY OPTIMIZATION CONVERGED AFTER 37 ITERATIONS ***

------------------------------------------------------------------------
 total energy gain   :        -0.0170391 Eh      -10.6922 kcal/mol
 total RMSD          :         0.6727778 a0        0.3560 Å
 total power (kW/mol):        -1.2090835 (step)  -37.7145 (real)
------------------------------------------------------------------------

 ANCopt (total)                0 d,  0 h,  0 min,  1.186 sec
 optimizer setup                ...        0 min,  0.000 sec (  0.013%)
 model hessian                  ...        0 min,  0.010 sec (  0.863%)
 ANC generation                 ...        0 min,  0.001 sec (  0.123%)
 coordinate transformation      ...        0 min,  0.001 sec (  0.059%)
 single point calculation       ...        0 min,  1.159 sec ( 97.680%)
 optimization log               ...        0 min,  0.004 sec (  0.332%)
 hessian update                 ...        0 min,  0.001 sec (  0.043%)
 rational function              ...        0 min,  0.008 sec (  0.698%)

================
 final structure:
================
$coord
   -2.76267704221258    2.10055152926203   -0.46513756252765      C 
   -4.81876383714874   -0.35863254331095   -0.74498529410209      S 
   -2.45007624274821   -2.58239466751835   -0.32765845265980      C 
   -0.10658267756674   -1.42310241042035   -0.08654212136333      C 
   -0.31505194125428    1.29703376336432   -0.12389124380823      C 
    1.85594645076757    2.86381726476379    0.16178118239528      C 
    1.57388520076830    5.67740585651861    0.16399832953964      C 
    4.13925998024264    1.70205253981023    0.39483560544957      C 
    4.37495119135088   -0.95206998857672    0.26132878202803      C 
    2.35182105984108   -2.53206378392769   -0.00245212769770      C 
    2.77479527512826   -5.31293284841251   -0.31446306529210      C 
   -3.27467979244238   -5.18688391869936   -0.13241685353872      C 
   -2.62616659572793   -6.76800108209825    1.70449641234119      C 
   -3.46438788990148    3.99705192637245   -0.55233396013861      H 
    0.29783685105466    6.27561377678765    1.66507435222250      H 
    0.78860436564322    6.32205656462057   -1.62729057546573      H 
    3.39503609009430    6.58417040747592    0.44601684316861      H 
    5.83384045161542    2.81947658177119    0.61993256827885      H 
    6.25420881168125   -1.75003547196560    0.33083624116800      H 
    4.69590131492596   -5.65706846626706   -0.96421316870700      H 
    1.45528869682313   -6.10538605102391   -1.67610860651997      H 
    2.52159119004151   -6.31203396260701    1.46772337970349      H 
   -4.66495224709967   -5.76234377769959   -1.52290341340377      H 
   -1.35921546783347   -6.21463150076307    3.19604199033027      H 
   -3.35681114897068   -8.66428000089582    1.77958364879339      H 
$end
           -------------------------------------------------
          |                Final Singlepoint                |
           -------------------------------------------------

          ...................................................
          :                      SETUP                      :
          :.................................................:
          :  # basis functions                  70          :
          :  # atomic orbitals                  69          :
          :  # shells                           39          :
          :  # electrons                        66          :
          :  max. iterations                   250          :
          :  Hamiltonian                  GFN2-xTB          :
          :  restarted?                      false          :
          :  GBSA solvation                  false          :
          :  PC potential                    false          :
          :  electronic temp.          300.0000000     K    :
          :  accuracy                    1.0000000          :
          :  -> integral cutoff          0.2500000E+02      :
          :  -> integral neglect         0.1000000E-07      :
          :  -> SCF convergence          0.1000000E-05 Eh   :
          :  -> wf. convergence          0.1000000E-03 e    :
          :  Broyden damping             0.4000000          :
          ...................................................

 iter      E             dE          RMSdq      gap      omega  full diag
   1    -35.6263678 -0.356264E+02  0.852E-05    2.13       0.0  T
   2    -35.6263678  0.216005E-11  0.585E-05    2.13     341.8  T
   3    -35.6263678 -0.841069E-10  0.314E-05    2.13     636.9  T

   *** convergence criteria satisfied after 3 iterations ***

         #    Occupation            Energy/Eh            Energy/eV
      -------------------------------------------------------------
         1        2.0000           -0.7289085             -19.8346
       ...           ...                  ...                  ...
        27        2.0000           -0.4353767             -11.8472
        28        2.0000           -0.4269034             -11.6166
        29        2.0000           -0.4197823             -11.4229
        30        2.0000           -0.4146815             -11.2841
        31        2.0000           -0.3963845             -10.7862
        32        2.0000           -0.3908945             -10.6368
        33        2.0000           -0.3501981              -9.5294 (HOMO)
        34                         -0.2719796              -7.4009 (LUMO)
        35                         -0.2176166              -5.9216
        36                         -0.1940307              -5.2798
        37                         -0.1896731              -5.1613
        38                         -0.1760645              -4.7910
       ...                                ...                  ...
        69                          0.7328049              19.9406
      -------------------------------------------------------------
                  HL-Gap            0.0782184 Eh            2.1284 eV
             Fermi-level           -0.3110888 Eh           -8.4652 eV

 SCC (total)                   0 d,  0 h,  0 min,  0.029 sec
 SCC setup                      ...        0 min,  0.000 sec (  0.677%)
 Dispersion                     ...        0 min,  0.000 sec (  0.754%)
 integral evaluation            ...        0 min,  0.009 sec ( 30.150%)
 zeroth order Hamiltonian       ...        0 min,  0.000 sec (  0.605%)
 iterations                     ...        0 min,  0.004 sec ( 14.597%)
 molecular gradient             ...        0 min,  0.015 sec ( 51.728%)
 printout                       ...        0 min,  0.000 sec (  1.252%)

         :::::::::::::::::::::::::::::::::::::::::::::::::::::
         ::                     SUMMARY                     ::
         :::::::::::::::::::::::::::::::::::::::::::::::::::::
         :: total energy             -35.020971715070 Eh    ::
         :: gradient norm              0.000601985791 Eh/a0 ::
         :: HOMO-LUMO gap              2.128431578401 eV    ::
         ::.................................................::
         :: SCC energy               -35.626367756047 Eh    ::
         :: -> isotropic ES            0.003611150139 Eh    ::
         :: -> anisotropic ES          0.005236980946 Eh    ::
         :: -> anisotropic XC          0.019696107029 Eh    ::
         :: -> dispersion             -0.026987089930 Eh    ::
         :: repulsion energy           0.605232209475 Eh    ::
         :: add. restraining           0.000000000000 Eh    ::
         :::::::::::::::::::::::::::::::::::::::::::::::::::::

           -------------------------------------------------
          |                Property Printout                |
           -------------------------------------------------

    * Orbital Energies and Occupations

         #    Occupation            Energy/Eh            Energy/eV
      -------------------------------------------------------------
         1        2.0000           -0.7289085             -19.8346
       ...           ...                  ...                  ...
        21        2.0000           -0.4718135             -12.8387
        22        2.0000           -0.4669323             -12.7059
        23        2.0000           -0.4624932             -12.5851
        24        2.0000           -0.4575499             -12.4506
        25        2.0000           -0.4452220             -12.1151
        26        2.0000           -0.4393422             -11.9551
        27        2.0000           -0.4353767             -11.8472
        28        2.0000           -0.4269034             -11.6166
        29        2.0000           -0.4197823             -11.4229
        30        2.0000           -0.4146815             -11.2841
        31        2.0000           -0.3963845             -10.7862
        32        2.0000           -0.3908945             -10.6368
        33        2.0000           -0.3501981              -9.5294 (HOMO)
        34                         -0.2719796              -7.4009 (LUMO)
        35                         -0.2176166              -5.9216
        36                         -0.1940307              -5.2798
        37                         -0.1896731              -5.1613
        38                         -0.1760645              -4.7910
        39                         -0.1061830              -2.8894
        40                         -0.0829045              -2.2559
        41                          0.0035926               0.0978
        42                          0.0305378               0.8310
        43                          0.0387342               1.0540
        44                          0.0829820               2.2581
       ...                                ...                  ...
        69                          0.7328049              19.9406
      -------------------------------------------------------------
                  HL-Gap            0.0782184 Eh            2.1284 eV
             Fermi-level           -0.3110888 Eh           -8.4652 eV

     #   Z        covCN         q      C6AA      α(0)
     1   6 C      2.924    -0.034    28.859     8.810
     2  16 S      2.347    -0.023   142.013    20.057
     3   6 C      2.980     0.012    27.731     8.638
     4   6 C      3.155    -0.013    28.039     8.659
     5   6 C      3.181    -0.008    27.786     8.605
     6   6 C      2.958     0.006    27.893     8.663
     7   6 C      3.757    -0.107    22.605     6.779
     8   6 C      2.920    -0.044    29.096     8.846
     9   6 C      2.923    -0.045    29.127     8.850
    10   6 C      2.955     0.009    27.819     8.651
    11   6 C      3.758    -0.108    22.617     6.780
    12   6 C      2.946    -0.027    28.680     8.783
    13   6 C      2.839    -0.088    30.202     9.006
    14   1 H      0.927     0.041     2.429     2.437
    15   1 H      0.925     0.043     2.403     2.424
    16   1 H      0.925     0.044     2.396     2.421
    17   1 H      0.925     0.041     2.433     2.439
    18   1 H      0.926     0.026     2.642     2.542
    19   1 H      0.926     0.027     2.635     2.538
    20   1 H      0.925     0.041     2.441     2.443
    21   1 H      0.925     0.042     2.416     2.431
    22   1 H      0.925     0.047     2.358     2.401
    23   1 H      0.925     0.038     2.469     2.457
    24   1 H      0.926     0.042     2.418     2.432
    25   1 H      0.926     0.039     2.465     2.455

 Mol. C6AA /au·bohr⁶  :       8752.251199
 Mol. C8AA /au·bohr⁸  :     236842.749057
 Mol. α(0) /au        :        150.546965


Wiberg/Mayer (AO) data.
largest (>0.10) Wiberg bond orders for each atom
          total WBO             WBO to atom ...
     1  C   3.938        C    5 1.468    S    2 1.232    H   14 0.969    C    3 0.140
     2  S   2.699        C    1 1.232    C    3 1.169
     3  C   3.940        C    4 1.413    S    2 1.169    C   12 1.099    C    1 0.140
     4  C   3.985        C    3 1.413    C   10 1.198    C    5 1.161
     5  C   3.986        C    1 1.468    C    6 1.188    C    4 1.161
     6  C   3.984        C    8 1.579    C    5 1.188    C    7 1.026    C   10 0.112
     7  C   3.996        C    6 1.026    H   17 0.985    H   15 0.973    H   16 0.971
     8  C   3.990        C    6 1.579    C    9 1.270    H   18 0.968
     9  C   3.990        C   10 1.572    C    8 1.270    H   19 0.968
    10  C   3.988        C    9 1.572    C    4 1.198    C   11 1.026    C    6 0.112
    11  C   3.996        C   10 1.026    H   20 0.982    H   21 0.977    H   22 0.964
    12  C   3.990        C   13 1.894    C    3 1.099    H   23 0.958
    13  C   3.985        C   12 1.894    H   25 0.977    H   24 0.974
    14  H   0.997        C    1 0.969
    15  H   0.998        C    7 0.973
    16  H   0.998        C    7 0.971
    17  H   0.998        C    7 0.985
    18  H   0.998        C    8 0.968
    19  H   0.998        C    9 0.968
    20  H   0.998        C   11 0.982
    21  H   0.998        C   11 0.977
    22  H   0.997        C   11 0.964
    23  H   0.997        C   12 0.958
    24  H   0.998        C   13 0.974
    25  H   0.998        C   13 0.977

molecular dipole:
                 x           y           z       tot (Debye)
 q only:        0.049      -0.015      -0.002
   full:        0.218       0.042       0.022       0.567
molecular quadrupole (traceless):
                xx          xy          yy          xz          yz          zz
 q only:       -1.810      -0.295       4.243       0.315      -0.118      -2.434
  q+dip:       -1.780      -0.141       6.589       1.445      -0.521      -4.809
   full:       -3.247      -0.508       5.961       0.424      -0.264      -2.714

           -------------------------------------------------
          |                Geometry Summary                 |
           -------------------------------------------------

      molecular mass/u    :      188.2868000
   center of mass at/Å    :       -0.2122161      -0.4485557      -0.0165166
  moments of inertia/u·Å² :        0.4892076E+03   0.7316947E+03   0.1179733E+04
rotational constants/cm⁻¹ :        0.3445906E-01   0.2303916E-01   0.1428936E-01

 * 23 selected distances

     #   Z        #   Z                                     value/Å
     1   6 C      2  16 S                                 1.7027173
     2  16 S      3   6 C                                 1.7334058 (max)
     3   6 C      4   6 C                                 1.3894363
     1   6 C      5   6 C                                 1.3751441
     4   6 C      5   6 C                                 1.4437906
     5   6 C      6   6 C                                 1.4248193
     6   6 C      8   6 C                                 1.3612855
     8   6 C      9   6 C                                 1.4117970
     4   6 C     10   6 C                                 1.4278587
     9   6 C     10   6 C                                 1.3655456
    12   6 C     13   6 C                                 1.3276710
     1   6 C     14   1 H                                 1.0710730 (min)
     7   6 C     15   1 H                                 1.0895632
     7   6 C     16   1 H                                 1.0897656
     7   6 C     17   1 H                                 1.0868568
     8   6 C     18   1 H                                 1.0807282
     9   6 C     19   1 H                                 1.0810237
    11   6 C     20   1 H                                 1.0885181
    11   6 C     21   1 H                                 1.0874764
    11   6 C     22   1 H                                 1.0894504
    12   6 C     23   1 H                                 1.0841633
    13   6 C     24   1 H                                 1.0762080
    13   6 C     25   1 H                                 1.0761120

 * 3 distinct bonds (by element types)

   Z      Z             #   av. dist./Å        max./Å        min./Å
   1 H    6 C          12     1.0834116     1.0897656     1.0710730
   6 C    6 C           9     1.3919276     1.4437906     1.3276710
   6 C   16 S           2     1.7180615     1.7334058     1.7027173


optimized geometry written to: xtbopt.xyz


           -------------------------------------------------
          | TOTAL ENERGY              -35.020971715070 Eh   |
          | GRADIENT NORM               0.000601985791 Eh/α |
          | HOMO-LUMO GAP               2.128431578401 eV   |
           -------------------------------------------------

------------------------------------------------------------------------
 * finished run on 2021/05/19 at 10:59:39.460     
------------------------------------------------------------------------
 total:
 * wall-time:     0 d,  0 h,  0 min,  1.278 sec
 *  cpu-time:     0 d,  0 h,  0 min,  1.274 sec
 * ratio c/w:     0.997 speedup
 SCF:
 * wall-time:     0 d,  0 h,  0 min,  0.041 sec
 *  cpu-time:     0 d,  0 h,  0 min,  0.041 sec
 * ratio c/w:     0.998 speedup
 ANC optimizer:
 * wall-time:     0 d,  0 h,  0 min,  1.216 sec
 *  cpu-time:     0 d,  0 h,  0 min,  1.212 sec
 * ratio c/w:     0.997 speedup

