      -----------------------------------------------------------      
     |                   =====================                   |     
     |                           x T B                           |     
     |                   =====================                   |     
     |                         S. Grimme                         |     
     |          Mulliken Center for Theoretical Chemistry        |     
     |                    University of Bonn                     |     
     |                Version 6.2 RC2 (SAW190805)                |     
      -----------------------------------------------------------      

   This program is distributed in the hope that it will be useful,
   but WITHOUT ANY WARRANTY; without even the implied warranty of
   MERCHANTABILITY or FITNESS FOR A PARTICULAR PURPOSE.
   
   FOR NON-COMMERCIAL, ACADEMIA USE ONLY.
   
   Cite this work as:
   * S. Grimme, C. Bannwarth, P. Shushkov, J. Chem. Theory Comput., 2017,
     13, 1989-2009. DOI: 10.1021/acs.jctc.7b00118
   * C. Bannwarth, S. Ehlert and S. Grimme., J. Chem. Theory Comput., 2019,
     15, 1652-1671. DOI: 10.1021/acs.jctc.8b01176
   * P. Pracht, E. Caldeweyher, S. Ehlert, S. Grimme, ChemRxiv, 2019, preprint.
     DOI: 10.26434/chemrxiv.8326202.v1
   
   for DFT-D4:
   * E. Caldeweyher, C. Bannwarth and S. Grimme, J. Chem. Phys., 2017,
     147, 034112. DOI: 10.1063/1.4993215
   * E. Caldeweyher, S. Ehlert, A. Hansen, H. Neugebauer, S. Spicher,
     C. Bannwarth and S. Grimme, J. Chem. Phys., 2019, 150, 154122.
     DOI: 10.1063/1.5090222
   
   for sTDA-xTB:
   * S. Grimme and C. Bannwarth, J. Chem. Phys., 2016, 145, 054103.
     DOI: 10.1063/1.4959605
   
   in the mass-spec context:
   * V. Asgeirsson, C. Bauer and S. Grimme, Chem. Sci., 2017, 8, 4879.
     DOI: 10.1039/c7sc00601b
   
   for metadynamics refer to:
   * S. Grimme, J. Chem. Theory Comput., 2019, 155, 2847-2862
     DOI: 10.1021/acs.jctc.9b00143
   
   with help from (in alphabetical order)
   C. Bannwarth, F. Bohle, G. Brandenburg, E. Caldeweyher, M. Checinski,
   S. Dohm, S. Ehlert, S. Ehrlich, F. März, H. Neugebauer, J. Pisarek,
   P. Pracht, P. Shushkov, and S. Spicher.
   
 * started run on 2021/05/19 at 10:59:39.480     

           -------------------------------------------------
          |                Calculation Setup                |
           -------------------------------------------------

          program call               : /ihome/ghutchison/geoffh/xtb/xtb 551.xyz -opt
          hostname                   : smp-n144
          coordinate file            : 551.xyz
          omp threads                :                     1
          number of atoms            :                    30
          number of electrons        :                    82
          charge                     :                     0
          spin                       :                   0.0
          first test random number   :      0.22786475781747


########################################################################
# WARNING! Please study the warnings concerning your input carefully
#  - the use of '-opt' is discouraged, please use '--opt' next time
########################################################################

           ------------------------------------------------- 
          |                 G F N 2 - x T B                 |
          | Geometry, Frequencies, Noncovalent interactions |
          |            JCTC 2019 parametrisation            |
           ------------------------------------------------- 
             KAB for C  - Si     :                1.0500
             KAB for H  - Pd     :                0.9500
             k(s)              :                1.8500
             k(p)              :                2.2300
             k(d)              :                2.2300
             k(f)              :                2.0000
             kEN (H0ij)        :               -2.0000
             D4 a1             :                0.5200
             D4 a2             :                5.0000
             D4 s6             :                1.0000
             D4 s8             :                2.7000
             D4 s9             :                5.0000
             alphaj            :                2.0000

  Z AO/shell   Hii/eV     exponent
  1     Wed Apr 25 08:07:45 CEST 2018   EN: 2.200 GM2: 0.406  GM3: 0.0800  RAES: 1.40
     1s    -10.707211    1.230000
  6     Wed Apr 25 08:07:45 CEST 2018   EN: 2.550 GM2: 0.538  GM3: 0.1500  RAES: 3.00
     2s    -13.970922    2.096432
     2p    -10.063292    1.800000
  8     Wed Apr 25 08:07:45 CEST 2018   EN: 3.440 GM2: 0.452  GM3:-0.0517  RAES: 1.80
     2s    -20.229985    2.439742
     2p    -15.503117    2.137023

           ------------------------------------------------- 
          |        Self-Consistent Charge Iterations        |
           ------------------------------------------------- 

          ...................................................
          :                      SETUP                      :
          :.................................................:
          :  # basis functions                  78          :
          :  # atomic orbitals                  78          :
          :  # shells                           46          :
          :  # electrons                        82          :
          :  max. iterations                   250          :
          :  Hamiltonian                  GFN2-xTB          :
          :  restarted?                      false          :
          :  GBSA solvation                  false          :
          :  PC potential                    false          :
          :  electronic temp.          300.0000000     K    :
          :  accuracy                    1.0000000          :
          :  -> integral cutoff          0.2500000E+02      :
          :  -> integral neglect         0.1000000E-07      :
          :  -> SCF convergence          0.1000000E-05 Eh   :
          :  -> wf. convergence          0.1000000E-03 e    :
          :  Broyden damping             0.4000000          :
          ...................................................

 iter      E             dE          RMSdq      gap      omega  full diag
   1    -45.7617330 -0.457617E+02  0.466E+00    1.34       0.0  T
   2    -45.8051808 -0.434478E-01  0.296E+00    1.23       1.0  T
   3    -45.7788325  0.263483E-01  0.185E+00    1.31       1.0  T
   4    -45.8267930 -0.479604E-01  0.491E-01    1.19       1.0  T
   5    -45.8282816 -0.148867E-02  0.285E-01    1.21       1.0  T
   6    -45.8300441 -0.176245E-02  0.753E-02    1.22       1.0  T
   7    -45.8300462 -0.211829E-05  0.498E-02    1.23       1.0  T
   8    -45.8300850 -0.388322E-04  0.209E-02    1.23       1.0  T
   9    -45.8300888 -0.380483E-05  0.744E-03    1.23       2.5  T
  10    -45.8300899 -0.110002E-05  0.333E-03    1.23       5.5  T
  11    -45.8300902 -0.221104E-06  0.113E-03    1.23      16.1  T
  12    -45.8300902 -0.715291E-08  0.630E-04    1.23      29.0  T
  13    -45.8300902 -0.111125E-08  0.341E-04    1.23      53.6  T

   *** convergence criteria satisfied after 13 iterations ***

         #    Occupation            Energy/Eh            Energy/eV
      -------------------------------------------------------------
         1        2.0000           -0.7117557             -19.3679
       ...           ...                  ...                  ...
        35        2.0000           -0.4295037             -11.6874
        36        2.0000           -0.4273905             -11.6299
        37        2.0000           -0.4174003             -11.3580
        38        2.0000           -0.4133118             -11.2468
        39        2.0000           -0.3870881             -10.5332
        40        2.0000           -0.3531722              -9.6103
        41        2.0000           -0.3523656              -9.5884 (HOMO)
        42                         -0.3072954              -8.3619 (LUMO)
        43                         -0.2215763              -6.0294
        44                         -0.1797934              -4.8924
        45                         -0.1372579              -3.7350
        46                         -0.1117036              -3.0396
       ...                                ...                  ...
        78                          0.7739567              21.0604
      -------------------------------------------------------------
                  HL-Gap            0.0450701 Eh            1.2264 eV
             Fermi-level           -0.3296631 Eh           -8.9706 eV

 SCC (total)                   0 d,  0 h,  0 min,  0.050 sec
 SCC setup                      ...        0 min,  0.000 sec (  0.682%)
 Dispersion                     ...        0 min,  0.001 sec (  1.007%)
 integral evaluation            ...        0 min,  0.011 sec ( 22.817%)
 zeroth order Hamiltonian       ...        0 min,  0.000 sec (  0.433%)
 iterations                     ...        0 min,  0.019 sec ( 38.720%)
 molecular gradient             ...        0 min,  0.018 sec ( 35.417%)
 printout                       ...        0 min,  0.000 sec (  0.815%)

         :::::::::::::::::::::::::::::::::::::::::::::::::::::
         ::                     SUMMARY                     ::
         :::::::::::::::::::::::::::::::::::::::::::::::::::::
         :: total energy             -45.134322180753 Eh    ::
         :: gradient norm              0.051085359033 Eh/a0 ::
         :: HOMO-LUMO gap              1.226420154817 eV    ::
         ::.................................................::
         :: SCC energy               -45.830090176063 Eh    ::
         :: -> isotropic ES            0.030031558232 Eh    ::
         :: -> anisotropic ES          0.006254866159 Eh    ::
         :: -> anisotropic XC          0.018888878533 Eh    ::
         :: -> dispersion             -0.028314157073 Eh    ::
         :: repulsion energy           0.695780930039 Eh    ::
         :: add. restraining           0.000000000000 Eh    ::
         :::::::::::::::::::::::::::::::::::::::::::::::::::::

      ----------------------------------------------------------- 
     |                   =====================                   |
     |                        A N C O P T                        |
     |                   =====================                   |
     |               Approximate Normal Coordinate               |
     |                Rational Function Optimizer                |
      ----------------------------------------------------------- 

          ...................................................
          :                      SETUP                      :
          :.................................................:
          :   optimization level            normal          :
          :   max. optcycles                   200          :
          :   ANC micro-cycles                  20          :
          :   degrees of freedom                84          :
          :.................................................:
          :   RF solver                   davidson          :
          :   input Hessian                  false          :
          :   write xtbopt.log                true          :
          :   linear?                        false          :
          :   energy convergence         0.5000000E-05 Eh   :
          :   grad. convergence          0.1000000E-02 Eh/α :
          :   maximium RF displ.         2.0000000          :
          :   Hlow (freq-cutoff)         0.5000000E-02      :
          :   Hmax (freq-cutoff)         5.0000000          :
          :   S6 in model hess.         20.0000000          :
          ...................................................

generating ANC from model Hessian ...
Using Lindh-Hessian (1995)
 Shifting diagonal of input Hessian by   4.645838001068791E-003
 Lowest  eigenvalues of input Hessian
   -0.000000   -0.000000   -0.000000    0.000000    0.000000    0.000000
    0.005000    0.005938    0.006329    0.007325    0.008253    0.008844
    0.008953    0.009493    0.011003    0.012415    0.013614    0.017892
 Highest eigenvalues
    1.801703    1.900891    2.006196    2.060559    2.086011    2.141180
 

........................................................................
.............................. CYCLE    1 ..............................
........................................................................
   1    -45.8300902 -0.458301E+02  0.972E-05    1.23       0.0  T
   2    -45.8300902  0.169820E-11  0.783E-05    1.23     233.2  T
   3    -45.8300902 -0.953051E-10  0.437E-05    1.23     417.4  T
     SCC iter.                  ...        0 min,  0.005 sec
     gradient                   ...        0 min,  0.018 sec
 * total energy  :   -45.1343222 Eh     change        0.1551617E-07 Eh
   gradient norm :     0.0510874 Eh/α   predicted     0.0000000E+00 (-100.00%)
   displ. norm   :     0.2675314 α      lambda       -0.5061842E-02
   maximum displ.:     0.1258442 α      in ANC's #5, #26, #25, ...

........................................................................
.............................. CYCLE    2 ..............................
........................................................................
   1    -45.8361133 -0.458361E+02  0.165E-01    1.17       0.0  T
   2    -45.8361406 -0.273190E-04  0.107E-01    1.17       1.0  T
   3    -45.8361606 -0.199820E-04  0.802E-02    1.18       1.0  T
   4    -45.8362148 -0.542026E-04  0.209E-02    1.17       1.0  T
   5    -45.8362225 -0.771316E-05  0.105E-02    1.18       1.7  T
   6    -45.8362253 -0.278074E-05  0.244E-03    1.18       7.5  T
   7    -45.8362253 -0.170949E-07  0.164E-03    1.18      11.2  T
     SCC iter.                  ...        0 min,  0.010 sec
     gradient                   ...        0 min,  0.016 sec
 * total energy  :   -45.1378244 Eh     change       -0.3502195E-02 Eh
   gradient norm :     0.0235235 Eh/α   predicted    -0.2712071E-02 ( -22.56%)
   displ. norm   :     0.2873676 α      lambda       -0.1829213E-02
   maximum displ.:     0.1656158 α      in ANC's #5, #10, #7, ...

........................................................................
.............................. CYCLE    3 ..............................
........................................................................
   1    -45.8392339 -0.458392E+02  0.164E-01    1.14       0.0  T
   2    -45.8392579 -0.240161E-04  0.104E-01    1.14       1.0  T
   3    -45.8392375  0.203918E-04  0.797E-02    1.14       1.0  T
   4    -45.8393033 -0.658027E-04  0.214E-02    1.14       1.0  T
   5    -45.8393124 -0.904923E-05  0.100E-02    1.14       1.8  T
   6    -45.8393150 -0.263090E-05  0.230E-03    1.14       7.9  T
   7    -45.8393150 -0.147379E-07  0.130E-03    1.14      14.0  T
     SCC iter.                  ...        0 min,  0.010 sec
     gradient                   ...        0 min,  0.016 sec
 * total energy  :   -45.1389997 Eh     change       -0.1175379E-02 Eh
   gradient norm :     0.0074020 Eh/α   predicted    -0.9901381E-03 ( -15.76%)
   displ. norm   :     0.2676068 α      lambda       -0.6093912E-03
   maximum displ.:     0.1654394 α      in ANC's #5, #7, #10, ...

........................................................................
.............................. CYCLE    4 ..............................
........................................................................
   1    -45.8390074 -0.458390E+02  0.146E-01    1.13       0.0  T
   2    -45.8390141 -0.672037E-05  0.888E-02    1.13       1.0  T
   3    -45.8389561  0.580100E-04  0.635E-02    1.13       1.0  T
   4    -45.8390280 -0.718746E-04  0.656E-03    1.13       2.8  T
   5    -45.8390286 -0.620225E-06  0.392E-03    1.13       4.7  T
   6    -45.8390288 -0.242394E-06  0.218E-03    1.13       8.4  T
   7    -45.8390289 -0.525789E-07  0.984E-04    1.13      18.6  T
     SCC iter.                  ...        0 min,  0.010 sec
     gradient                   ...        0 min,  0.016 sec
 * total energy  :   -45.1394570 Eh     change       -0.4572606E-03 Eh
   gradient norm :     0.0075640 Eh/α   predicted    -0.3265413E-03 ( -28.59%)
   displ. norm   :     0.3299960 α      lambda       -0.5403242E-03
   maximum displ.:     0.1921053 α      in ANC's #5, #3, #1, ...

........................................................................
.............................. CYCLE    5 ..............................
........................................................................
   1    -45.8382351 -0.458382E+02  0.171E-01    1.12       0.0  T
   2    -45.8382374 -0.229059E-05  0.104E-01    1.12       1.0  T
   3    -45.8381400  0.973905E-04  0.699E-02    1.12       1.0  T
   4    -45.8382468 -0.106764E-03  0.104E-02    1.12       1.8  T
   5    -45.8382490 -0.226627E-05  0.454E-03    1.12       4.0  T
   6    -45.8382493 -0.318703E-06  0.217E-03    1.12       8.4  T
   7    -45.8382494 -0.126571E-07  0.104E-03    1.12      17.6  T
     SCC iter.                  ...        0 min,  0.010 sec
     gradient                   ...        0 min,  0.016 sec
 * total energy  :   -45.1398438 Eh     change       -0.3868258E-03 Eh
   gradient norm :     0.0100002 Eh/α   predicted    -0.2995825E-03 ( -22.55%)
   displ. norm   :     0.3253491 α      lambda       -0.4609935E-03
   maximum displ.:     0.1853436 α      in ANC's #5, #1, #3, ...

........................................................................
.............................. CYCLE    6 ..............................
........................................................................
   1    -45.8386266 -0.458386E+02  0.166E-01    1.12       0.0  T
   2    -45.8386263  0.316841E-06  0.101E-01    1.12       1.0  T
   3    -45.8385144  0.111901E-03  0.708E-02    1.12       1.0  T
   4    -45.8386335 -0.119074E-03  0.975E-03    1.12       1.9  T
   5    -45.8386358 -0.229829E-05  0.359E-03    1.12       5.1  T
   6    -45.8386359 -0.808386E-07  0.163E-03    1.12      11.2  T
   7    -45.8386359 -0.113796E-07  0.806E-04    1.12      22.7  T
     SCC iter.                  ...        0 min,  0.010 sec
     gradient                   ...        0 min,  0.016 sec
 * total energy  :   -45.1401390 Eh     change       -0.2951857E-03 Eh
   gradient norm :     0.0103100 Eh/α   predicted    -0.2548955E-03 ( -13.65%)
   displ. norm   :     0.2689384 α      lambda       -0.3687430E-03
   maximum displ.:     0.1446041 α      in ANC's #1, #5, #3, ...

........................................................................
.............................. CYCLE    7 ..............................
........................................................................
   1    -45.8404998 -0.458405E+02  0.121E-01    1.12       0.0  T
   2    -45.8404995  0.249319E-06  0.733E-02    1.12       1.0  T
   3    -45.8404289  0.706533E-04  0.547E-02    1.12       1.0  T
   4    -45.8405036 -0.747267E-04  0.667E-03    1.12       2.7  T
   5    -45.8405045 -0.962727E-06  0.285E-03    1.12       6.4  T
   6    -45.8405046 -0.799529E-07  0.147E-03    1.12      12.4  T
     SCC iter.                  ...        0 min,  0.009 sec
     gradient                   ...        0 min,  0.016 sec
 * total energy  :   -45.1403890 Eh     change       -0.2499452E-03 Eh
   gradient norm :     0.0079930 Eh/α   predicted    -0.1977107E-03 ( -20.90%)
   displ. norm   :     0.2421347 α      lambda       -0.2487715E-03
   maximum displ.:     0.1520260 α      in ANC's #1, #5, #3, ...

........................................................................
.............................. CYCLE    8 ..............................
........................................................................
   1    -45.8418893 -0.458419E+02  0.105E-01    1.12       0.0  T
   2    -45.8418902 -0.944570E-06  0.631E-02    1.12       1.0  T
   3    -45.8418602  0.300222E-04  0.358E-02    1.12       1.0  T
   4    -45.8418917 -0.314290E-04  0.620E-03    1.12       2.9  T
   5    -45.8418925 -0.830893E-06  0.247E-03    1.12       7.4  T
   6    -45.8418925 -0.577334E-07  0.129E-03    1.12      14.1  T
     SCC iter.                  ...        0 min,  0.009 sec
     gradient                   ...        0 min,  0.016 sec
 * total energy  :   -45.1405725 Eh     change       -0.1835508E-03 Eh
   gradient norm :     0.0052736 Eh/α   predicted    -0.1316989E-03 ( -28.25%)
   displ. norm   :     0.2931520 α      lambda       -0.1889810E-03
   maximum displ.:     0.1884265 α      in ANC's #1, #5, #3, ...

........................................................................
.............................. CYCLE    9 ..............................
........................................................................
   1    -45.8406300 -0.458406E+02  0.126E-01    1.12       0.0  T
   2    -45.8406314 -0.145808E-05  0.758E-02    1.12       1.0  T
   3    -45.8406277  0.372643E-05  0.142E-02    1.12       1.3  T
   4    -45.8406325 -0.477119E-05  0.304E-03    1.12       6.0  T
   5    -45.8406325  0.101942E-07  0.192E-03    1.12       9.5  T
   6    -45.8406325 -0.179656E-08  0.142E-03    1.12      12.9  T
     SCC iter.                  ...        0 min,  0.009 sec
     gradient                   ...        0 min,  0.016 sec
 * total energy  :   -45.1407037 Eh     change       -0.1311758E-03 Eh
   gradient norm :     0.0046272 Eh/α   predicted    -0.1026132E-03 ( -21.77%)
   displ. norm   :     0.2086271 α      lambda       -0.1660041E-03
   maximum displ.:     0.1650861 α      in ANC's #1, #6, #3, ...

........................................................................
.............................. CYCLE   10 ..............................
........................................................................
   1    -45.8429516 -0.458430E+02  0.848E-02    1.12       0.0  T
   2    -45.8429521 -0.516121E-06  0.505E-02    1.12       1.0  T
   3    -45.8429405  0.116425E-04  0.229E-02    1.12       1.0  T
   4    -45.8429532 -0.127612E-04  0.232E-03    1.12       7.9  T
   5    -45.8429533 -0.274241E-07  0.175E-03    1.12      10.4  T
   6    -45.8429533 -0.362270E-07  0.937E-04    1.12      19.5  T
     SCC iter.                  ...        0 min,  0.009 sec
     gradient                   ...        0 min,  0.016 sec
 * total energy  :   -45.1407909 Eh     change       -0.8718045E-04 Eh
   gradient norm :     0.0054727 Eh/α   predicted    -0.8661524E-04 (  -0.65%)
   displ. norm   :     0.1763446 α      lambda       -0.1005420E-03
   maximum displ.:     0.1313697 α      in ANC's #1, #4, #5, ...

........................................................................
.............................. CYCLE   11 ..............................
........................................................................
   1    -45.8417173 -0.458417E+02  0.734E-02    1.12       0.0  T
   2    -45.8417176 -0.332691E-06  0.441E-02    1.12       1.0  T
   3    -45.8417104  0.721102E-05  0.169E-02    1.12       1.1  T
   4    -45.8417181 -0.771113E-05  0.201E-03    1.11       9.1  T
   5    -45.8417181 -0.180802E-07  0.122E-03    1.12      15.0  T
   6    -45.8417181 -0.284955E-08  0.652E-04    1.12      28.0  T
     SCC iter.                  ...        0 min,  0.009 sec
     gradient                   ...        0 min,  0.016 sec
 * total energy  :   -45.1408676 Eh     change       -0.7677881E-04 Eh
   gradient norm :     0.0042227 Eh/α   predicted    -0.5183712E-04 ( -32.49%)
   displ. norm   :     0.1410306 α      lambda       -0.8773260E-04
   maximum displ.:     0.1058507 α      in ANC's #1, #4, #2, ...

........................................................................
.............................. CYCLE   12 ..............................
........................................................................
   1    -45.8411700 -0.458412E+02  0.561E-02    1.12       0.0  T
   2    -45.8411702 -0.191749E-06  0.335E-02    1.12       1.0  T
   3    -45.8411612  0.897835E-05  0.192E-02    1.12       1.0  T
   4    -45.8411706 -0.938001E-05  0.261E-03    1.12       7.0  T
   5    -45.8411707 -0.141112E-06  0.113E-03    1.12      16.1  T
   6    -45.8411708 -0.175151E-07  0.561E-04    1.12      32.5  T
     SCC iter.                  ...        0 min,  0.009 sec
     gradient                   ...        0 min,  0.016 sec
 * total energy  :   -45.1409310 Eh     change       -0.6337874E-04 Eh
   gradient norm :     0.0035950 Eh/α   predicted    -0.4473917E-04 ( -29.41%)
   displ. norm   :     0.1574222 α      lambda       -0.9460330E-04
   maximum displ.:     0.1247245 α      in ANC's #1, #4, #8, ...

........................................................................
.............................. CYCLE   13 ..............................
........................................................................
   1    -45.8417390 -0.458417E+02  0.616E-02    1.12       0.0  T
   2    -45.8417395 -0.430571E-06  0.369E-02    1.12       1.0  T
   3    -45.8417302  0.927409E-05  0.197E-02    1.12       1.0  T
   4    -45.8417398 -0.961089E-05  0.407E-03    1.12       4.5  T
   5    -45.8417402 -0.408420E-06  0.147E-03    1.12      12.4  T
   6    -45.8417402 -0.325496E-07  0.620E-04    1.12      29.5  T
   7    -45.8417402 -0.110542E-08  0.330E-04    1.12      55.4  T
     SCC iter.                  ...        0 min,  0.010 sec
     gradient                   ...        0 min,  0.017 sec
 * total energy  :   -45.1409847 Eh     change       -0.5368512E-04 Eh
   gradient norm :     0.0027098 Eh/α   predicted    -0.4847537E-04 (  -9.70%)
   displ. norm   :     0.0954846 α      lambda       -0.4439618E-04
   maximum displ.:     0.0752264 α      in ANC's #1, #4, #2, ...

........................................................................
.............................. CYCLE   14 ..............................
........................................................................
   1    -45.8418664 -0.458419E+02  0.380E-02    1.12       0.0  T
   2    -45.8418665 -0.996762E-07  0.228E-02    1.12       1.0  T
   3    -45.8418658  0.712228E-06  0.532E-03    1.12       3.4  T
   4    -45.8418666 -0.796219E-06  0.122E-03    1.12      15.0  T
   5    -45.8418666 -0.115769E-07  0.797E-04    1.12      22.9  T
   6    -45.8418666 -0.567305E-08  0.281E-04    1.12      64.9  T
     SCC iter.                  ...        0 min,  0.009 sec
     gradient                   ...        0 min,  0.017 sec
 * total energy  :   -45.1410204 Eh     change       -0.3572368E-04 Eh
   gradient norm :     0.0023311 Eh/α   predicted    -0.2240255E-04 ( -37.29%)
   displ. norm   :     0.1251165 α      lambda       -0.5317640E-04
   maximum displ.:     0.1060720 α      in ANC's #1, #4, #2, ...

........................................................................
.............................. CYCLE   15 ..............................
........................................................................
   1    -45.8419303 -0.458419E+02  0.493E-02    1.12       0.0  T
   2    -45.8419303  0.417774E-07  0.298E-02    1.12       1.0  T
   3    -45.8419198  0.104194E-04  0.198E-02    1.12       1.0  T
   4    -45.8419308 -0.109628E-04  0.181E-03    1.12      10.1  T
   5    -45.8419308 -0.455475E-07  0.103E-03    1.12      17.7  T
   6    -45.8419309 -0.900042E-08  0.455E-04    1.12      40.1  T
   7    -45.8419309 -0.870720E-09  0.165E-04    1.12     110.6  T
     SCC iter.                  ...        0 min,  0.010 sec
     gradient                   ...        0 min,  0.017 sec
 * total energy  :   -45.1410620 Eh     change       -0.4152592E-04 Eh
   gradient norm :     0.0024216 Eh/α   predicted    -0.2700597E-04 ( -34.97%)
   displ. norm   :     0.1037642 α      lambda       -0.4117499E-04
   maximum displ.:     0.0925108 α      in ANC's #1, #4, #2, ...

........................................................................
.............................. CYCLE   16 ..............................
........................................................................
   1    -45.8423772 -0.458424E+02  0.389E-02    1.12       0.0  T
   2    -45.8423772 -0.753593E-07  0.234E-02    1.12       1.0  T
   3    -45.8423736  0.368620E-05  0.125E-02    1.12       1.5  T
   4    -45.8423774 -0.386821E-05  0.183E-03    1.12      10.0  T
   5    -45.8423775 -0.686866E-07  0.852E-04    1.12      21.4  T
   6    -45.8423775 -0.723862E-08  0.413E-04    1.12      44.2  T
     SCC iter.                  ...        0 min,  0.009 sec
     gradient                   ...        0 min,  0.017 sec
 * total energy  :   -45.1410937 Eh     change       -0.3173071E-04 Eh
   gradient norm :     0.0024657 Eh/α   predicted    -0.2081133E-04 ( -34.41%)
   displ. norm   :     0.0764074 α      lambda       -0.2970527E-04
   maximum displ.:     0.0677830 α      in ANC's #1, #2, #6, ...

........................................................................
.............................. CYCLE   17 ..............................
........................................................................
   1    -45.8422875 -0.458423E+02  0.305E-02    1.12       0.0  T
   2    -45.8422874  0.927995E-08  0.183E-02    1.12       1.0  T
   3    -45.8422840  0.343573E-05  0.118E-02    1.12       1.5  T
   4    -45.8422876 -0.360570E-05  0.126E-03    1.12      14.5  T
   5    -45.8422876 -0.327801E-07  0.598E-04    1.12      30.5  T
   6    -45.8422877 -0.394105E-08  0.281E-04    1.12      65.0  T
     SCC iter.                  ...        0 min,  0.009 sec
     gradient                   ...        0 min,  0.017 sec
 * total energy  :   -45.1411189 Eh     change       -0.2517035E-04 Eh
   gradient norm :     0.0019365 Eh/α   predicted    -0.1494349E-04 ( -40.63%)
   displ. norm   :     0.1131327 α      lambda       -0.2787446E-04
   maximum displ.:     0.0973534 α      in ANC's #1, #6, #8, ...

........................................................................
.............................. CYCLE   18 ..............................
........................................................................
   1    -45.8424132 -0.458424E+02  0.468E-02    1.12       0.0  T
   2    -45.8424133 -0.125516E-06  0.280E-02    1.12       1.0  T
   3    -45.8424127  0.601391E-06  0.551E-03    1.12       3.3  T
   4    -45.8424134 -0.702423E-06  0.110E-03    1.12      16.5  T
   5    -45.8424134  0.255722E-08  0.891E-04    1.12      20.5  T
   6    -45.8424134 -0.116167E-07  0.378E-04    1.12      48.3  T
     SCC iter.                  ...        0 min,  0.009 sec
     gradient                   ...        0 min,  0.017 sec
 * total energy  :   -45.1411521 Eh     change       -0.3322825E-04 Eh
   gradient norm :     0.0015972 Eh/α   predicted    -0.1401894E-04 ( -57.81%)
   displ. norm   :     0.1264517 α      lambda       -0.2593944E-04
   maximum displ.:     0.1033891 α      in ANC's #1, #3, #2, ...

........................................................................
.............................. CYCLE   19 ..............................
........................................................................
   1    -45.8418866 -0.458419E+02  0.521E-02    1.12       0.0  T
   2    -45.8418867 -0.718692E-07  0.310E-02    1.12       1.0  T
   3    -45.8418821  0.451821E-05  0.131E-02    1.12       1.4  T
   4    -45.8418869 -0.474669E-05  0.188E-03    1.12       9.7  T
   5    -45.8418870 -0.601416E-07  0.851E-04    1.12      21.5  T
   6    -45.8418870 -0.394520E-08  0.325E-04    1.12      56.1  T
     SCC iter.                  ...        0 min,  0.009 sec
     gradient                   ...        0 min,  0.017 sec
 * total energy  :   -45.1411800 Eh     change       -0.2793514E-04 Eh
   gradient norm :     0.0020730 Eh/α   predicted    -0.1306494E-04 ( -53.23%)
   displ. norm   :     0.0841813 α      lambda       -0.2338377E-04
   maximum displ.:     0.0693616 α      in ANC's #1, #5, #2, ...

........................................................................
.............................. CYCLE   20 ..............................
........................................................................
   1    -45.8419891 -0.458420E+02  0.341E-02    1.12       0.0  T
   2    -45.8419891 -0.163111E-07  0.203E-02    1.12       1.0  T
   3    -45.8419863  0.276377E-05  0.111E-02    1.12       1.6  T
   4    -45.8419892 -0.291626E-05  0.151E-03    1.12      12.1  T
   5    -45.8419893 -0.484674E-07  0.636E-04    1.12      28.7  T
   6    -45.8419893 -0.247025E-08  0.241E-04    1.12      75.7  T
     SCC iter.                  ...        0 min,  0.009 sec
     gradient                   ...        0 min,  0.017 sec
 * total energy  :   -45.1412001 Eh     change       -0.2006656E-04 Eh
   gradient norm :     0.0016267 Eh/α   predicted    -0.1177702E-04 ( -41.31%)
   displ. norm   :     0.1700466 α      lambda       -0.2767910E-04
   maximum displ.:     0.1388320 α      in ANC's #1, #3, #2, ...
 * RMSD in coord.:     0.5574909 α      energy gain  -0.6877906E-02 Eh

generating ANC from model Hessian ...
Using Lindh-Hessian (1995)
 Shifting diagonal of input Hessian by   4.640088170009393E-003
 Lowest  eigenvalues of input Hessian
   -0.000000   -0.000000   -0.000000   -0.000000    0.000000    0.000000
    0.005000    0.005976    0.006205    0.007486    0.008626    0.008826
    0.008991    0.009629    0.010899    0.013030    0.013888    0.018854
 Highest eigenvalues
    1.826765    1.904587    2.016807    2.059019    2.090266    2.133181
 

........................................................................
.............................. CYCLE   21 ..............................
........................................................................
   1    -45.8421394 -0.458421E+02  0.667E-02    1.12       0.0  T
   2    -45.8421396 -0.117726E-06  0.397E-02    1.12       1.0  T
   3    -45.8421328  0.673187E-05  0.175E-02    1.12       1.0  T
   4    -45.8421400 -0.712533E-05  0.254E-03    1.12       7.2  T
   5    -45.8421401 -0.126814E-06  0.114E-03    1.12      16.0  T
   6    -45.8421401 -0.743734E-08  0.411E-04    1.12      44.4  T
   7    -45.8421401 -0.227611E-08  0.139E-04    1.12     131.7  T
     SCC iter.                  ...        0 min,  0.010 sec
     gradient                   ...        0 min,  0.017 sec
 * total energy  :   -45.1412323 Eh     change       -0.3220269E-04 Eh
   gradient norm :     0.0016149 Eh/α   predicted     0.0000000E+00 (-100.00%)
   displ. norm   :     0.0709519 α      lambda       -0.1898270E-04
   maximum displ.:     0.0628155 α      in ANC's #1, #4, #11, ...

........................................................................
.............................. CYCLE   22 ..............................
........................................................................
   1    -45.8422217 -0.458422E+02  0.250E-02    1.12       0.0  T
   2    -45.8422217  0.667549E-08  0.150E-02    1.12       1.2  T
   3    -45.8422197  0.206986E-05  0.976E-03    1.12       1.9  T
   4    -45.8422218 -0.219643E-05  0.136E-03    1.12      13.5  T
   5    -45.8422219 -0.473617E-07  0.343E-04    1.12      53.2  T
   6    -45.8422219 -0.134601E-08  0.172E-04    1.12     105.9  T
     SCC iter.                  ...        0 min,  0.009 sec
     gradient                   ...        0 min,  0.017 sec
 * total energy  :   -45.1412525 Eh     change       -0.2023061E-04 Eh
   gradient norm :     0.0008338 Eh/α   predicted    -0.9525696E-05 ( -52.91%)
   displ. norm   :     0.0474038 α      lambda       -0.1035953E-04
   maximum displ.:     0.0369984 α      in ANC's #1, #11, #4, ...

........................................................................
.............................. CYCLE   23 ..............................
........................................................................
   1    -45.8422749 -0.458423E+02  0.187E-02    1.12       0.0  T
   2    -45.8422749  0.118798E-07  0.113E-02    1.12       1.6  T
   3    -45.8422734  0.145438E-05  0.839E-03    1.12       2.2  T
   4    -45.8422750 -0.155548E-05  0.132E-03    1.12      13.9  T
   5    -45.8422750 -0.443862E-07  0.314E-04    1.12      58.1  T
   6    -45.8422750 -0.581942E-09  0.162E-04    1.12     112.9  T
     SCC iter.                  ...        0 min,  0.009 sec
     gradient                   ...        0 min,  0.018 sec
 * total energy  :   -45.1412634 Eh     change       -0.1086013E-04 Eh
   gradient norm :     0.0007580 Eh/α   predicted    -0.5186148E-05 ( -52.25%)
   displ. norm   :     0.0600564 α      lambda       -0.9294708E-05
   maximum displ.:     0.0486541 α      in ANC's #1, #4, #12, ...

........................................................................
.............................. CYCLE   24 ..............................
........................................................................
   1    -45.8422822 -0.458423E+02  0.222E-02    1.12       0.0  T
   2    -45.8422822  0.565819E-08  0.133E-02    1.12       1.4  T
   3    -45.8422806  0.160775E-05  0.799E-03    1.12       2.3  T
   4    -45.8422823 -0.168517E-05  0.110E-03    1.12      16.6  T
   5    -45.8422823 -0.264125E-07  0.363E-04    1.12      50.3  T
   6    -45.8422823 -0.588955E-09  0.143E-04    1.12     127.3  T
     SCC iter.                  ...        0 min,  0.009 sec
     gradient                   ...        0 min,  0.017 sec
 * total energy  :   -45.1412737 Eh     change       -0.1029717E-04 Eh
   gradient norm :     0.0007498 Eh/α   predicted    -0.4657726E-05 ( -54.77%)
   displ. norm   :     0.0523245 α      lambda       -0.6983380E-05
   maximum displ.:     0.0444994 α      in ANC's #1, #4, #2, ...

........................................................................
.............................. CYCLE   25 ..............................
........................................................................
   1    -45.8422522 -0.458423E+02  0.191E-02    1.12       0.0  T
   2    -45.8422523 -0.183248E-07  0.113E-02    1.12       1.6  T
   3    -45.8422521  0.140206E-06  0.231E-03    1.12       7.9  T
   4    -45.8422523 -0.156028E-06  0.439E-04    1.12      41.6  T
   5    -45.8422523 -0.102872E-08  0.338E-04    1.12      54.1  T
     SCC iter.                  ...        0 min,  0.008 sec
     gradient                   ...        0 min,  0.017 sec
 * total energy  :   -45.1412817 Eh     change       -0.8018087E-05 Eh
   gradient norm :     0.0007859 Eh/α   predicted    -0.3496383E-05 ( -56.39%)
   displ. norm   :     0.0430230 α      lambda       -0.5585051E-05
   maximum displ.:     0.0370817 α      in ANC's #1, #4, #8, ...

........................................................................
.............................. CYCLE   26 ..............................
........................................................................
   1    -45.8422533 -0.458423E+02  0.165E-02    1.12       0.0  T
   2    -45.8422533  0.698407E-09  0.982E-03    1.12       1.9  T
   3    -45.8422527  0.600496E-06  0.509E-03    1.12       3.6  T
   4    -45.8422533 -0.628763E-06  0.631E-04    1.12      28.9  T
   5    -45.8422533 -0.969681E-08  0.221E-04    1.12      82.7  T
     SCC iter.                  ...        0 min,  0.008 sec
     gradient                   ...        0 min,  0.017 sec
 * total energy  :   -45.1412888 Eh     change       -0.7126211E-05 Eh
   gradient norm :     0.0006086 Eh/α   predicted    -0.2797569E-05 ( -60.74%)
   displ. norm   :     0.0438904 α      lambda       -0.5315178E-05
   maximum displ.:     0.0377215 α      in ANC's #1, #8, #4, ...

........................................................................
.............................. CYCLE   27 ..............................
........................................................................
   1    -45.8423007 -0.458423E+02  0.168E-02    1.12       0.0  T
   2    -45.8423007  0.575461E-08  0.999E-03    1.12       1.8  T
   3    -45.8422999  0.857164E-06  0.590E-03    1.12       3.1  T
   4    -45.8423008 -0.896659E-06  0.845E-04    1.12      21.6  T
   5    -45.8423008 -0.166858E-07  0.217E-04    1.12      84.1  T
     SCC iter.                  ...        0 min,  0.008 sec
     gradient                   ...        0 min,  0.018 sec
 * total energy  :   -45.1412958 Eh     change       -0.6928470E-05 Eh
   gradient norm :     0.0004269 Eh/α   predicted    -0.2661958E-05 ( -61.58%)
   displ. norm   :     0.0422515 α      lambda       -0.4600263E-05
   maximum displ.:     0.0371189 α      in ANC's #1, #8, #2, ...

........................................................................
.............................. CYCLE   28 ..............................
........................................................................
   1    -45.8423047 -0.458423E+02  0.165E-02    1.12       0.0  T
   2    -45.8423048 -0.696252E-08  0.981E-03    1.12       1.9  T
   3    -45.8423044  0.357344E-06  0.383E-03    1.12       4.8  T
   4    -45.8423048 -0.374299E-06  0.659E-04    1.12      27.7  T
   5    -45.8423048 -0.948447E-08  0.239E-04    1.12      76.4  T
     SCC iter.                  ...        0 min,  0.008 sec
     gradient                   ...        0 min,  0.017 sec
 * total energy  :   -45.1413018 Eh     change       -0.6086487E-05 Eh
   gradient norm :     0.0004099 Eh/α   predicted    -0.2303410E-05 ( -62.16%)
   displ. norm   :     0.0369861 α      lambda       -0.3687593E-05
   maximum displ.:     0.0332945 α      in ANC's #1, #8, #2, ...

........................................................................
.............................. CYCLE   29 ..............................
........................................................................
   1    -45.8422959 -0.458423E+02  0.141E-02    1.12       0.0  T
   2    -45.8422960 -0.755885E-08  0.836E-03    1.12       2.2  T
   3    -45.8422959  0.454560E-07  0.151E-03    1.12      12.1  T
   4    -45.8422960 -0.510810E-07  0.309E-04    1.12      59.1  T
   5    -45.8422960 -0.785981E-09  0.209E-04    1.12      87.5  T
     SCC iter.                  ...        0 min,  0.008 sec
     gradient                   ...        0 min,  0.017 sec
 * total energy  :   -45.1413069 Eh     change       -0.5093641E-05 Eh
   gradient norm :     0.0004037 Eh/α   predicted    -0.1847461E-05 ( -63.73%)
   displ. norm   :     0.0364892 α      lambda       -0.2280730E-05
   maximum displ.:     0.0327424 α      in ANC's #1, #8, #2, ...

........................................................................
.............................. CYCLE   30 ..............................
........................................................................
   1    -45.8422726 -0.458423E+02  0.139E-02    1.12       0.0  T
   2    -45.8422726 -0.778270E-08  0.828E-03    1.12       2.2  T
   3    -45.8422726  0.389145E-07  0.141E-03    1.12      12.9  T
   4    -45.8422726 -0.455679E-07  0.236E-04    1.12      77.5  T
   5    -45.8422726  0.536673E-10  0.170E-04    1.12     107.3  T
     SCC iter.                  ...        0 min,  0.008 sec
     gradient                   ...        0 min,  0.017 sec
 * total energy  :   -45.1413110 Eh     change       -0.4071777E-05 Eh
   gradient norm :     0.0005240 Eh/α   predicted    -0.1141713E-05 ( -71.96%)
   displ. norm   :     0.0377286 α      lambda       -0.1382532E-05
   maximum displ.:     0.0341188 α      in ANC's #1, #8, #2, ...

   *** GEOMETRY OPTIMIZATION CONVERGED AFTER 30 ITERATIONS ***

------------------------------------------------------------------------
 total energy gain   :        -0.0069888 Eh       -4.3856 kcal/mol
 total RMSD          :         0.6093801 a0        0.3225 Å
 total power (kW/mol):        -0.6116383 (step)  -16.0036 (real)
------------------------------------------------------------------------

 ANCopt (total)                0 d,  0 h,  0 min,  1.147 sec
 optimizer setup                ...        0 min,  0.000 sec (  0.012%)
 model hessian                  ...        0 min,  0.009 sec (  0.824%)
 ANC generation                 ...        0 min,  0.002 sec (  0.160%)
 coordinate transformation      ...        0 min,  0.001 sec (  0.056%)
 single point calculation       ...        0 min,  1.124 sec ( 98.003%)
 optimization log               ...        0 min,  0.004 sec (  0.307%)
 hessian update                 ...        0 min,  0.000 sec (  0.043%)
 rational function              ...        0 min,  0.005 sec (  0.427%)

================
 final structure:
================
$coord
    1.00245093168659   -2.40541637247999    0.96929979445413      C 
    1.98509684084530   -0.07056560186411    0.68249553436768      C 
   -0.06549300999828    1.73683753112239    0.70839097642996      C 
   -2.39049717173901    0.21645610099651    1.05324010863553      C 
   -1.72602026934165   -2.24328167187612    1.21358731065311      C 
   -4.69450676515553    1.31932137014408    1.19228399508468      O 
   -6.74362250215378   -0.32138822855963    1.61343375197061      C 
    0.07676043179457    4.29102502436941    0.46687806866048      C 
   -1.96658312528734    6.07675260096647    0.39576175579240      C 
   -1.00464965414214    8.44981256603168    0.09008131320696      C 
    1.75376631237065    8.27425336581633   -0.01796995168560      C 
    2.40993682569887    5.82270623937150    0.19776289055761      C 
    4.71939600529263    4.73165508591701    0.22589814566588      O 
    6.79461343908690    6.38596741267880    0.06044239064827      C 
   -2.46780621209149   10.72927875076778   -0.10129635097881      C 
   -1.53752605553860   13.04651667272266   -0.43291380760355      C 
    2.02602858673819   -4.16036773461039    1.01710979538586      H 
    3.92888480342763    0.43966123015878    0.44836637307319      H 
   -2.93398755125880   -3.85229586687052    1.47348798330436      H 
   -8.42389330311186    0.86254358408894    1.70624052031234      H 
   -6.52003189774583   -1.35017013332421    3.39463112824365      H 
   -6.93935688384799   -1.68399619502515    0.06884762077335      H 
   -3.91955895826293    5.56289843858421    0.53686014768233      H 
    2.98506187687954    9.86980457062547   -0.23107976117135      H 
    6.79721612170655    7.73519425379511    1.62893160419305      H 
    6.77878069057850    7.42783284957519   -1.72688553153559      H 
    8.48016630277486    5.21030125330299    0.15862972077755      H 
   -4.49281656520619   10.46572014812392    0.04162104662330      H 
    0.45921773781785   13.40177721190814   -0.58812996242525      H 
   -2.75156472449897   14.67370297986507   -0.56455045782041      H 
$end
           -------------------------------------------------
          |                Final Singlepoint                |
           -------------------------------------------------

          ...................................................
          :                      SETUP                      :
          :.................................................:
          :  # basis functions                  78          :
          :  # atomic orbitals                  78          :
          :  # shells                           46          :
          :  # electrons                        82          :
          :  max. iterations                   250          :
          :  Hamiltonian                  GFN2-xTB          :
          :  restarted?                      false          :
          :  GBSA solvation                  false          :
          :  PC potential                    false          :
          :  electronic temp.          300.0000000     K    :
          :  accuracy                    1.0000000          :
          :  -> integral cutoff          0.2500000E+02      :
          :  -> integral neglect         0.1000000E-07      :
          :  -> SCF convergence          0.1000000E-05 Eh   :
          :  -> wf. convergence          0.1000000E-03 e    :
          :  Broyden damping             0.4000000          :
          ...................................................

 iter      E             dE          RMSdq      gap      omega  full diag
   1    -45.8422726 -0.458423E+02  0.116E-04    1.12       0.0  T
   2    -45.8422726  0.190575E-09  0.967E-05    1.12     188.8  T
   3    -45.8422726 -0.284437E-09  0.648E-05    1.12     282.0  T

   *** convergence criteria satisfied after 3 iterations ***

         #    Occupation            Energy/Eh            Energy/eV
      -------------------------------------------------------------
         1        2.0000           -0.7149391             -19.4545
       ...           ...                  ...                  ...
        35        2.0000           -0.4312937             -11.7361
        36        2.0000           -0.4255575             -11.5800
        37        2.0000           -0.4173772             -11.3574
        38        2.0000           -0.4149211             -11.2906
        39        2.0000           -0.3847918             -10.4707
        40        2.0000           -0.3514929              -9.5646
        41        2.0000           -0.3490778              -9.4989 (HOMO)
        42                         -0.3078221              -8.3763 (LUMO)
        43                         -0.2211404              -6.0175
        44                         -0.1767101              -4.8085
        45                         -0.1355082              -3.6874
        46                         -0.1061562              -2.8887
       ...                                ...                  ...
        78                          0.7614277              20.7195
      -------------------------------------------------------------
                  HL-Gap            0.0412557 Eh            1.1226 eV
             Fermi-level           -0.3284140 Eh           -8.9366 eV

 SCC (total)                   0 d,  0 h,  0 min,  0.034 sec
 SCC setup                      ...        0 min,  0.000 sec (  0.691%)
 Dispersion                     ...        0 min,  0.000 sec (  0.821%)
 integral evaluation            ...        0 min,  0.011 sec ( 32.545%)
 zeroth order Hamiltonian       ...        0 min,  0.000 sec (  0.549%)
 iterations                     ...        0 min,  0.005 sec ( 14.578%)
 molecular gradient             ...        0 min,  0.017 sec ( 49.495%)
 printout                       ...        0 min,  0.000 sec (  1.144%)

         :::::::::::::::::::::::::::::::::::::::::::::::::::::
         ::                     SUMMARY                     ::
         :::::::::::::::::::::::::::::::::::::::::::::::::::::
         :: total energy             -45.141310990961 Eh    ::
         :: gradient norm              0.000523191647 Eh/a0 ::
         :: HOMO-LUMO gap              1.122625317824 eV    ::
         ::.................................................::
         :: SCC energy               -45.842272641682 Eh    ::
         :: -> isotropic ES            0.029082078565 Eh    ::
         :: -> anisotropic ES          0.005642243359 Eh    ::
         :: -> anisotropic XC          0.018425402743 Eh    ::
         :: -> dispersion             -0.028390187087 Eh    ::
         :: repulsion energy           0.701002500926 Eh    ::
         :: add. restraining           0.000000000000 Eh    ::
         :::::::::::::::::::::::::::::::::::::::::::::::::::::

           -------------------------------------------------
          |                Property Printout                |
           -------------------------------------------------

    * Orbital Energies and Occupations

         #    Occupation            Energy/Eh            Energy/eV
      -------------------------------------------------------------
         1        2.0000           -0.7149391             -19.4545
       ...           ...                  ...                  ...
        29        2.0000           -0.4616151             -12.5612
        30        2.0000           -0.4519747             -12.2989
        31        2.0000           -0.4513568             -12.2820
        32        2.0000           -0.4415347             -12.0148
        33        2.0000           -0.4400770             -11.9751
        34        2.0000           -0.4371731             -11.8961
        35        2.0000           -0.4312937             -11.7361
        36        2.0000           -0.4255575             -11.5800
        37        2.0000           -0.4173772             -11.3574
        38        2.0000           -0.4149211             -11.2906
        39        2.0000           -0.3847918             -10.4707
        40        2.0000           -0.3514929              -9.5646
        41        2.0000           -0.3490778              -9.4989 (HOMO)
        42                         -0.3078221              -8.3763 (LUMO)
        43                         -0.2211404              -6.0175
        44                         -0.1767101              -4.8085
        45                         -0.1355082              -3.6874
        46                         -0.1061562              -2.8887
        47                         -0.0861400              -2.3440
        48                          0.0185707               0.5053
        49                          0.0362612               0.9867
        50                          0.0872339               2.3738
        51                          0.0995679               2.7094
        52                          0.1110226               3.0211
       ...                                ...                  ...
        78                          0.7614277              20.7195
      -------------------------------------------------------------
                  HL-Gap            0.0412557 Eh            1.1226 eV
             Fermi-level           -0.3284140 Eh           -8.9366 eV

     #   Z        covCN         q      C6AA      α(0)
     1   6 C      3.037    -0.030    28.712     8.789
     2   6 C      2.988    -0.069    29.702     8.940
     3   6 C      3.075     0.018    27.525     8.602
     4   6 C      2.964     0.126    25.239     8.240
     5   6 C      3.001    -0.093    30.320     9.033
     6   8 O      1.704    -0.256    18.243     5.767
     7   6 C      3.658     0.037    20.231     6.455
     8   6 C      3.062     0.018    27.545     8.607
     9   6 C      2.994    -0.072    29.785     8.952
    10   6 C      3.078     0.016    27.580     8.610
    11   6 C      2.997    -0.096    30.413     9.046
    12   6 C      2.959     0.128    25.194     8.233
    13   8 O      1.704    -0.254    18.206     5.761
    14   6 C      3.658     0.037    20.241     6.457
    15   6 C      2.891    -0.024    28.602     8.768
    16   6 C      2.839    -0.082    30.041     8.982
    17   1 H      0.926     0.031     2.573     2.508
    18   1 H      0.926     0.051     2.312     2.377
    19   1 H      0.926     0.024     2.668     2.554
    20   1 H      0.925     0.060     2.204     2.322
    21   1 H      0.924     0.043     2.413     2.429
    22   1 H      0.924     0.043     2.414     2.430
    23   1 H      0.926     0.053     2.280     2.361
    24   1 H      0.926     0.028     2.611     2.527
    25   1 H      0.924     0.043     2.410     2.428
    26   1 H      0.924     0.043     2.412     2.429
    27   1 H      0.925     0.061     2.190     2.314
    28   1 H      0.925     0.037     2.483     2.464
    29   1 H      0.926     0.043     2.405     2.425
    30   1 H      0.926     0.037     2.490     2.468

 Mol. C6AA /au·bohr⁶  :      10617.042963
 Mol. C8AA /au·bohr⁸  :     255360.562391
 Mol. α(0) /au        :        163.278890


Wiberg/Mayer (AO) data.
largest (>0.10) Wiberg bond orders for each atom
          total WBO             WBO to atom ...
     1  C   3.927        C    2 1.708    C    5 1.116    H   17 0.974
     2  C   3.978        C    1 1.708    C    3 1.133    H   18 0.967
     3  C   3.947        C    8 1.561    C    2 1.133    C    4 1.029
     4  C   3.922        C    5 1.653    O    6 1.070    C    3 1.029
     5  C   3.953        C    4 1.653    C    1 1.116    H   19 0.972    O    6 0.108
     6  O   2.255        C    4 1.070    C    7 0.983    C    5 0.108
     7  C   3.946        O    6 0.983    H   20 0.981    H   21 0.976    H   22 0.976
     8  C   3.984        C    3 1.561    C    9 1.167    C   12 1.023
     9  C   3.980        C   10 1.578    C    8 1.167    H   23 0.966    C   16 0.116
    10  C   3.943        C    9 1.578    C   15 1.142    C   11 1.076
    11  C   3.958        C   12 1.674    C   10 1.076    H   24 0.969    O   13 0.113
    12  C   3.929        C   11 1.674    O   13 1.074    C    8 1.023
    13  O   2.260        C   12 1.074    C   14 0.983    C   11 0.113
    14  C   3.945        O   13 0.983    H   27 0.981    H   25 0.976    H   26 0.976
    15  C   3.991        C   16 1.844    C   10 1.142    H   28 0.964
    16  C   3.924        C   15 1.844    H   30 0.979    H   29 0.975    C    9 0.116
    17  H   0.998        C    1 0.974
    18  H   0.997        C    2 0.967
    19  H   0.999        C    5 0.972
    20  H   0.996        C    7 0.981
    21  H   0.997        C    7 0.976
    22  H   0.997        C    7 0.976
    23  H   0.997        C    9 0.966
    24  H   0.998        C   11 0.969
    25  H   0.998        C   14 0.976
    26  H   0.998        C   14 0.976
    27  H   0.996        C   14 0.981
    28  H   0.998        C   15 0.964
    29  H   0.998        C   16 0.975
    30  H   0.998        C   16 0.979

molecular dipole:
                 x           y           z       tot (Debye)
 q only:       -0.016       0.196       0.025
   full:       -0.023       0.185       0.030       0.480
molecular quadrupole (traceless):
                xx          xy          yy          xz          yz          zz
 q only:        8.093       7.473       0.342      -1.836      -0.964      -8.435
  q+dip:        8.027       9.813       5.593      -2.416      -2.201     -13.620
   full:        7.634      10.012       2.209      -2.147      -1.489      -9.843

           -------------------------------------------------
          |                Geometry Summary                 |
           -------------------------------------------------

      molecular mass/u    :      214.2634000
   center of mass at/Å    :       -0.1253669       2.1794375       0.2790289
  moments of inertia/u·Å² :        0.6821727E+03   0.1317427E+04   0.1991693E+04
rotational constants/cm⁻¹ :        0.2471168E-01   0.1279588E-01   0.8463972E-02

 * 26 selected distances

     #   Z        #   Z                                     value/Å
     1   6 C      2   6 C                                 1.3490780
     4   6 C      5   6 C                                 1.3509628
     4   6 C      6   8 O                                 1.3537121
     6   8 O      7   6 C                                 1.4068723
     3   6 C      8   6 C                                 1.3597321
     8   6 C      9   6 C                                 1.4365124
     9   6 C     10   6 C                                 1.3646383
    11   6 C     12   6 C                                 1.3478119
    12   6 C     13   8 O                                 1.3517124
    13   8 O     14   6 C                                 1.4071193
    10   6 C     15   6 C                                 1.4369300 (max)
    15   6 C     16   6 C                                 1.3329578
     1   6 C     17   1 H                                 1.0753959
     2   6 C     18   1 H                                 1.0706473 (min)
     5   6 C     19   1 H                                 1.0735466
     7   6 C     20   1 H                                 1.0888223
     7   6 C     21   1 H                                 1.0949046
     7   6 C     22   1 H                                 1.0948675
     9   6 C     23   1 H                                 1.0712500
    11   6 C     24   1 H                                 1.0724542
    14   6 C     25   1 H                                 1.0948444
    14   6 C     26   1 H                                 1.0948056
    14   6 C     27   1 H                                 1.0887326
    15   6 C     28   1 H                                 1.0832706
    16   6 C     29   1 H                                 1.0763637
    16   6 C     30   1 H                                 1.0765803

 * 3 distinct bonds (by element types)

   Z      Z             #   av. dist./Å        max./Å        min./Å
   1 H    6 C          14     1.0826061     1.0949046     1.0706473
   6 C    6 C           8     1.3723279     1.4369300     1.3329578
   6 C    8 O           4     1.3798540     1.4071193     1.3517124


optimized geometry written to: xtbopt.xyz


           -------------------------------------------------
          | TOTAL ENERGY              -45.141310990961 Eh   |
          | GRADIENT NORM               0.000523191647 Eh/α |
          | HOMO-LUMO GAP               1.122625317824 eV   |
           -------------------------------------------------

------------------------------------------------------------------------
 * finished run on 2021/05/19 at 10:59:40.736     
------------------------------------------------------------------------
 total:
 * wall-time:     0 d,  0 h,  0 min,  1.256 sec
 *  cpu-time:     0 d,  0 h,  0 min,  1.252 sec
 * ratio c/w:     0.997 speedup
 SCF:
 * wall-time:     0 d,  0 h,  0 min,  0.051 sec
 *  cpu-time:     0 d,  0 h,  0 min,  0.050 sec
 * ratio c/w:     0.998 speedup
 ANC optimizer:
 * wall-time:     0 d,  0 h,  0 min,  1.181 sec
 *  cpu-time:     0 d,  0 h,  0 min,  1.178 sec
 * ratio c/w:     0.998 speedup

