      -----------------------------------------------------------      
     |                   =====================                   |     
     |                           x T B                           |     
     |                   =====================                   |     
     |                         S. Grimme                         |     
     |          Mulliken Center for Theoretical Chemistry        |     
     |                    University of Bonn                     |     
     |                Version 6.2 RC2 (SAW190805)                |     
      -----------------------------------------------------------      

   This program is distributed in the hope that it will be useful,
   but WITHOUT ANY WARRANTY; without even the implied warranty of
   MERCHANTABILITY or FITNESS FOR A PARTICULAR PURPOSE.
   
   FOR NON-COMMERCIAL, ACADEMIA USE ONLY.
   
   Cite this work as:
   * S. Grimme, C. Bannwarth, P. Shushkov, J. Chem. Theory Comput., 2017,
     13, 1989-2009. DOI: 10.1021/acs.jctc.7b00118
   * C. Bannwarth, S. Ehlert and S. Grimme., J. Chem. Theory Comput., 2019,
     15, 1652-1671. DOI: 10.1021/acs.jctc.8b01176
   * P. Pracht, E. Caldeweyher, S. Ehlert, S. Grimme, ChemRxiv, 2019, preprint.
     DOI: 10.26434/chemrxiv.8326202.v1
   
   for DFT-D4:
   * E. Caldeweyher, C. Bannwarth and S. Grimme, J. Chem. Phys., 2017,
     147, 034112. DOI: 10.1063/1.4993215
   * E. Caldeweyher, S. Ehlert, A. Hansen, H. Neugebauer, S. Spicher,
     C. Bannwarth and S. Grimme, J. Chem. Phys., 2019, 150, 154122.
     DOI: 10.1063/1.5090222
   
   for sTDA-xTB:
   * S. Grimme and C. Bannwarth, J. Chem. Phys., 2016, 145, 054103.
     DOI: 10.1063/1.4959605
   
   in the mass-spec context:
   * V. Asgeirsson, C. Bauer and S. Grimme, Chem. Sci., 2017, 8, 4879.
     DOI: 10.1039/c7sc00601b
   
   for metadynamics refer to:
   * S. Grimme, J. Chem. Theory Comput., 2019, 155, 2847-2862
     DOI: 10.1021/acs.jctc.9b00143
   
   with help from (in alphabetical order)
   C. Bannwarth, F. Bohle, G. Brandenburg, E. Caldeweyher, M. Checinski,
   S. Dohm, S. Ehlert, S. Ehrlich, F. März, H. Neugebauer, J. Pisarek,
   P. Pracht, P. Shushkov, and S. Spicher.
   
 * started run on 2021/05/19 at 10:59:42.052     

           -------------------------------------------------
          |                Calculation Setup                |
           -------------------------------------------------

          program call               : /ihome/ghutchison/geoffh/xtb/xtb 556.xyz -opt
          hostname                   : smp-n144
          coordinate file            : 556.xyz
          omp threads                :                     1
          number of atoms            :                    18
          number of electrons        :                    60
          charge                     :                     0
          spin                       :                   0.0
          first test random number   :      0.82723932262293


########################################################################
# WARNING! Please study the warnings concerning your input carefully
#  - the use of '-opt' is discouraged, please use '--opt' next time
########################################################################

           ------------------------------------------------- 
          |                 G F N 2 - x T B                 |
          | Geometry, Frequencies, Noncovalent interactions |
          |            JCTC 2019 parametrisation            |
           ------------------------------------------------- 
             KAB for C  - Si     :                1.0500
             KAB for H  - Pd     :                0.9500
             k(s)              :                1.8500
             k(p)              :                2.2300
             k(d)              :                2.2300
             k(f)              :                2.0000
             kEN (H0ij)        :               -2.0000
             D4 a1             :                0.5200
             D4 a2             :                5.0000
             D4 s6             :                1.0000
             D4 s8             :                2.7000
             D4 s9             :                5.0000
             alphaj            :                2.0000

  Z AO/shell   Hii/eV     exponent
  1     Wed Apr 25 08:07:45 CEST 2018   EN: 2.200 GM2: 0.406  GM3: 0.0800  RAES: 1.40
     1s    -10.707211    1.230000
  6     Wed Apr 25 08:07:45 CEST 2018   EN: 2.550 GM2: 0.538  GM3: 0.1500  RAES: 3.00
     2s    -13.970922    2.096432
     2p    -10.063292    1.800000
  8     Wed Apr 25 08:07:45 CEST 2018   EN: 3.440 GM2: 0.452  GM3:-0.0517  RAES: 1.80
     2s    -20.229985    2.439742
     2p    -15.503117    2.137023
 16     Tue Apr 24 11:44:34 CEST 2018   EN: 2.580 GM2: 0.340  GM3:-0.0502  RAES: 3.10
     3s    -20.029654    1.981333
     3p    -11.377694    2.025643
     3d     -0.420282    1.702555

           ------------------------------------------------- 
          |        Self-Consistent Charge Iterations        |
           ------------------------------------------------- 

          ...................................................
          :                      SETUP                      :
          :.................................................:
          :  # basis functions                  60          :
          :  # atomic orbitals                  59          :
          :  # shells                           31          :
          :  # electrons                        60          :
          :  max. iterations                   250          :
          :  Hamiltonian                  GFN2-xTB          :
          :  restarted?                      false          :
          :  GBSA solvation                  false          :
          :  PC potential                    false          :
          :  electronic temp.          300.0000000     K    :
          :  accuracy                    1.0000000          :
          :  -> integral cutoff          0.2500000E+02      :
          :  -> integral neglect         0.1000000E-07      :
          :  -> SCF convergence          0.1000000E-05 Eh   :
          :  -> wf. convergence          0.1000000E-03 e    :
          :  Broyden damping             0.4000000          :
          ...................................................

 iter      E             dE          RMSdq      gap      omega  full diag
   1    -34.0344454 -0.340344E+02  0.549E+00    2.78       0.0  T
   2    -34.0883066 -0.538612E-01  0.292E+00    2.40       1.0  T
   3    -34.0895385 -0.123183E-02  0.174E+00    2.69       1.0  T
   4    -34.0999190 -0.103805E-01  0.391E-01    2.58       1.0  T
   5    -34.1015616 -0.164264E-02  0.166E-01    2.59       1.0  T
   6    -34.1017610 -0.199331E-03  0.582E-02    2.61       1.0  T
   7    -34.1017807 -0.197631E-04  0.246E-02    2.60       1.0  T
   8    -34.1017855 -0.473105E-05  0.115E-02    2.60       2.1  T
   9    -34.1017860 -0.585126E-06  0.455E-03    2.60       5.2  T
  10    -34.1017861 -0.736852E-07  0.189E-03    2.60      12.5  T
  11    -34.1017861 -0.232508E-07  0.100E-03    2.60      23.5  T
  12    -34.1017861 -0.381584E-08  0.618E-04    2.60      38.1  T
  13    -34.1017862 -0.182889E-08  0.120E-04    2.60     196.2  T

   *** convergence criteria satisfied after 13 iterations ***

         #    Occupation            Energy/Eh            Energy/eV
      -------------------------------------------------------------
         1        2.0000           -0.7639673             -20.7886
       ...           ...                  ...                  ...
        24        2.0000           -0.4829300             -13.1412
        25        2.0000           -0.4620553             -12.5732
        26        2.0000           -0.4562244             -12.4145
        27        2.0000           -0.4322376             -11.7618
        28        2.0000           -0.4143944             -11.2762
        29        2.0000           -0.4112128             -11.1897
        30        2.0000           -0.4072433             -11.0817 (HOMO)
        31                         -0.3117948              -8.4844 (LUMO)
        32                         -0.3043992              -8.2831
        33                         -0.2386348              -6.4936
        34                         -0.2320618              -6.3147
        35                         -0.2011658              -5.4740
       ...                                ...                  ...
        59                          0.7294072              19.8482
      -------------------------------------------------------------
                  HL-Gap            0.0954484 Eh            2.5973 eV
             Fermi-level           -0.3595191 Eh           -9.7830 eV

 SCC (total)                   0 d,  0 h,  0 min,  0.031 sec
 SCC setup                      ...        0 min,  0.000 sec (  0.840%)
 Dispersion                     ...        0 min,  0.000 sec (  0.785%)
 integral evaluation            ...        0 min,  0.007 sec ( 22.790%)
 zeroth order Hamiltonian       ...        0 min,  0.000 sec (  0.485%)
 iterations                     ...        0 min,  0.012 sec ( 39.648%)
 molecular gradient             ...        0 min,  0.011 sec ( 34.156%)
 printout                       ...        0 min,  0.000 sec (  1.128%)

         :::::::::::::::::::::::::::::::::::::::::::::::::::::
         ::                     SUMMARY                     ::
         :::::::::::::::::::::::::::::::::::::::::::::::::::::
         :: total energy             -33.654080757017 Eh    ::
         :: gradient norm              0.062692758793 Eh/a0 ::
         :: HOMO-LUMO gap              2.597284300552 eV    ::
         ::.................................................::
         :: SCC energy               -34.101786150711 Eh    ::
         :: -> isotropic ES            0.052383570263 Eh    ::
         :: -> anisotropic ES         -0.000397655215 Eh    ::
         :: -> anisotropic XC          0.011645006238 Eh    ::
         :: -> dispersion             -0.018920309524 Eh    ::
         :: repulsion energy           0.447634327844 Eh    ::
         :: add. restraining           0.000000000000 Eh    ::
         :::::::::::::::::::::::::::::::::::::::::::::::::::::

      ----------------------------------------------------------- 
     |                   =====================                   |
     |                        A N C O P T                        |
     |                   =====================                   |
     |               Approximate Normal Coordinate               |
     |                Rational Function Optimizer                |
      ----------------------------------------------------------- 

          ...................................................
          :                      SETUP                      :
          :.................................................:
          :   optimization level            normal          :
          :   max. optcycles                   200          :
          :   ANC micro-cycles                  20          :
          :   degrees of freedom                48          :
          :.................................................:
          :   RF solver                   davidson          :
          :   input Hessian                  false          :
          :   write xtbopt.log                true          :
          :   linear?                        false          :
          :   energy convergence         0.5000000E-05 Eh   :
          :   grad. convergence          0.1000000E-02 Eh/α :
          :   maximium RF displ.         2.0000000          :
          :   Hlow (freq-cutoff)         0.5000000E-02      :
          :   Hmax (freq-cutoff)         5.0000000          :
          :   S6 in model hess.         20.0000000          :
          ...................................................

generating ANC from model Hessian ...
Using Lindh-Hessian (1995)
 Shifting diagonal of input Hessian by   2.491381690447297E-003
 Lowest  eigenvalues of input Hessian
   -0.000000   -0.000000   -0.000000    0.000000    0.000000    0.000000
    0.005000    0.006888    0.009056    0.011033    0.013028    0.021863
    0.028910    0.034117    0.044345    0.050782    0.056361    0.061286
 Highest eigenvalues
    1.599985    1.885908    1.972081    2.032649    2.203426    2.226537
 

........................................................................
.............................. CYCLE    1 ..............................
........................................................................
   1    -34.1017862 -0.341018E+02  0.596E-05    2.60       0.0  T
   2    -34.1017862 -0.913047E-11  0.356E-05    2.60     662.2  T
   3    -34.1017862 -0.169820E-11  0.242E-05    2.60     974.2  T
     SCC iter.                  ...        0 min,  0.003 sec
     gradient                   ...        0 min,  0.010 sec
 * total energy  :   -33.6540808 Eh     change       -0.1333063E-08 Eh
   gradient norm :     0.0626928 Eh/α   predicted     0.0000000E+00 (-100.00%)
   displ. norm   :     0.2102021 α      lambda       -0.4480316E-02
   maximum displ.:     0.1218364 α      in ANC's #1, #2, #23, ...

........................................................................
.............................. CYCLE    2 ..............................
........................................................................
   1    -34.1114041 -0.341114E+02  0.216E-01    2.61       0.0  T
   2    -34.1115279 -0.123781E-03  0.130E-01    2.66       1.0  T
   3    -34.1115077  0.201999E-04  0.781E-02    2.65       1.0  T
   4    -34.1115584 -0.507168E-04  0.284E-02    2.66       1.0  T
   5    -34.1115668 -0.835685E-05  0.847E-03    2.65       2.8  T
   6    -34.1115673 -0.550306E-06  0.364E-03    2.65       6.5  T
   7    -34.1115674 -0.743322E-07  0.174E-03    2.65      13.5  T
     SCC iter.                  ...        0 min,  0.006 sec
     gradient                   ...        0 min,  0.010 sec
 * total energy  :   -33.6571887 Eh     change       -0.3107987E-02 Eh
   gradient norm :     0.0232515 Eh/α   predicted    -0.2339136E-02 ( -24.74%)
   displ. norm   :     0.1945690 α      lambda       -0.1397181E-02
   maximum displ.:     0.1098817 α      in ANC's #2, #1, #5, ...

........................................................................
.............................. CYCLE    3 ..............................
........................................................................
   1    -34.1143806 -0.341144E+02  0.192E-01    2.66       0.0  T
   2    -34.1144228 -0.421627E-04  0.113E-01    2.68       1.0  T
   3    -34.1143775  0.452911E-04  0.709E-02    2.68       1.0  T
   4    -34.1144431 -0.656037E-04  0.175E-02    2.68       1.3  T
   5    -34.1144451 -0.203608E-05  0.676E-03    2.68       3.5  T
   6    -34.1144454 -0.239855E-06  0.283E-03    2.68       8.3  T
   7    -34.1144454 -0.417568E-07  0.134E-03    2.68      17.6  T
     SCC iter.                  ...        0 min,  0.006 sec
     gradient                   ...        0 min,  0.010 sec
 * total energy  :   -33.6580058 Eh     change       -0.8170924E-03 Eh
   gradient norm :     0.0058444 Eh/α   predicted    -0.7250389E-03 ( -11.27%)
   displ. norm   :     0.2020195 α      lambda       -0.3784733E-03
   maximum displ.:     0.1384846 α      in ANC's #1, #2, #4, ...

........................................................................
.............................. CYCLE    4 ..............................
........................................................................
   1    -34.1132274 -0.341132E+02  0.139E-01    2.68       0.0  T
   2    -34.1132311 -0.363379E-05  0.797E-02    2.69       1.0  T
   3    -34.1132185  0.125697E-04  0.296E-02    2.68       1.0  T
   4    -34.1132330 -0.144549E-04  0.740E-03    2.69       3.2  T
   5    -34.1132331 -0.183286E-06  0.284E-03    2.69       8.3  T
   6    -34.1132332 -0.419243E-07  0.112E-03    2.69      21.0  T
     SCC iter.                  ...        0 min,  0.005 sec
     gradient                   ...        0 min,  0.010 sec
 * total energy  :   -33.6582517 Eh     change       -0.2458768E-03 Eh
   gradient norm :     0.0080967 Eh/α   predicted    -0.1969598E-03 ( -19.89%)
   displ. norm   :     0.2225094 α      lambda       -0.3414011E-03
   maximum displ.:     0.1531764 α      in ANC's #1, #2, #4, ...

........................................................................
.............................. CYCLE    5 ..............................
........................................................................
   1    -34.1116341 -0.341116E+02  0.165E-01    2.68       0.0  T
   2    -34.1116371 -0.302536E-05  0.955E-02    2.68       1.0  T
   3    -34.1116252  0.119535E-04  0.322E-02    2.68       1.0  T
   4    -34.1116390 -0.137934E-04  0.760E-03    2.68       3.1  T
   5    -34.1116392 -0.220970E-06  0.258E-03    2.68       9.1  T
   6    -34.1116392 -0.345172E-07  0.891E-04    2.68      26.5  T
     SCC iter.                  ...        0 min,  0.006 sec
     gradient                   ...        0 min,  0.010 sec
 * total energy  :   -33.6585197 Eh     change       -0.2679647E-03 Eh
   gradient norm :     0.0082980 Eh/α   predicted    -0.1791552E-03 ( -33.14%)
   displ. norm   :     0.3274048 α      lambda       -0.4658879E-03
   maximum displ.:     0.2344772 α      in ANC's #1, #2, #4, ...

........................................................................
.............................. CYCLE    6 ..............................
........................................................................
   1    -34.1102320 -0.341102E+02  0.244E-01    2.66       0.0  T
   2    -34.1102412 -0.918701E-05  0.138E-01    2.66       1.0  T
   3    -34.1102399  0.130897E-05  0.242E-02    2.66       1.0  T
   4    -34.1102425 -0.253382E-05  0.133E-02    2.66       1.8  T
   5    -34.1102434 -0.992060E-06  0.541E-03    2.66       4.4  T
   6    -34.1102438 -0.328209E-06  0.147E-03    2.66      16.0  T
   7    -34.1102438 -0.709927E-08  0.831E-04    2.66      28.4  T
     SCC iter.                  ...        0 min,  0.006 sec
     gradient                   ...        0 min,  0.010 sec
 * total energy  :   -33.6588549 Eh     change       -0.3352276E-03 Eh
   gradient norm :     0.0093923 Eh/α   predicted    -0.2579183E-03 ( -23.06%)
   displ. norm   :     0.2933473 α      lambda       -0.4086643E-03
   maximum displ.:     0.2253164 α      in ANC's #1, #4, #2, ...

........................................................................
.............................. CYCLE    7 ..............................
........................................................................
   1    -34.1112419 -0.341112E+02  0.210E-01    2.66       0.0  T
   2    -34.1112472 -0.530282E-05  0.119E-01    2.65       1.0  T
   3    -34.1112431  0.405470E-05  0.234E-02    2.66       1.0  T
   4    -34.1112479 -0.482233E-05  0.119E-02    2.65       2.0  T
   5    -34.1112490 -0.109306E-05  0.354E-03    2.65       6.7  T
   6    -34.1112491 -0.113562E-06  0.102E-03    2.65      23.0  T
   7    -34.1112491 -0.162804E-08  0.624E-04    2.65      37.8  T
     SCC iter.                  ...        0 min,  0.006 sec
     gradient                   ...        0 min,  0.010 sec
 * total energy  :   -33.6591358 Eh     change       -0.2809225E-03 Eh
   gradient norm :     0.0090555 Eh/α   predicted    -0.2219151E-03 ( -21.00%)
   displ. norm   :     0.2554969 α      lambda       -0.3016976E-03
   maximum displ.:     0.1996115 α      in ANC's #1, #2, #3, ...

........................................................................
.............................. CYCLE    8 ..............................
........................................................................
   1    -34.1127622 -0.341128E+02  0.172E-01    2.66       0.0  T
   2    -34.1127654 -0.314429E-05  0.983E-02    2.65       1.0  T
   3    -34.1127634  0.196799E-05  0.188E-02    2.66       1.3  T
   4    -34.1127661 -0.268984E-05  0.102E-02    2.65       2.3  T
   5    -34.1127668 -0.652374E-06  0.249E-03    2.65       9.5  T
   6    -34.1127668 -0.585918E-07  0.999E-04    2.65      23.6  T
     SCC iter.                  ...        0 min,  0.006 sec
     gradient                   ...        0 min,  0.010 sec
 * total energy  :   -33.6593351 Eh     change       -0.1993157E-03 Eh
   gradient norm :     0.0075426 Eh/α   predicted    -0.1606969E-03 ( -19.38%)
   displ. norm   :     0.2109113 α      lambda       -0.2256327E-03
   maximum displ.:     0.1718937 α      in ANC's #1, #2, #3, ...

........................................................................
.............................. CYCLE    9 ..............................
........................................................................
   1    -34.1153955 -0.341154E+02  0.157E-01    2.66       0.0  T
   2    -34.1154005 -0.503037E-05  0.884E-02    2.66       1.0  T
   3    -34.1153912  0.937191E-05  0.315E-02    2.66       1.0  T
   4    -34.1154023 -0.111164E-04  0.983E-03    2.66       2.4  T
   5    -34.1154027 -0.393118E-06  0.372E-03    2.66       6.3  T
   6    -34.1154028 -0.744607E-07  0.142E-03    2.66      16.5  T
   7    -34.1154028 -0.212153E-07  0.675E-04    2.66      34.9  T
     SCC iter.                  ...        0 min,  0.006 sec
     gradient                   ...        0 min,  0.010 sec
 * total energy  :   -33.6594503 Eh     change       -0.1151951E-03 Eh
   gradient norm :     0.0051630 Eh/α   predicted    -0.1178330E-03 (   2.29%)
   displ. norm   :     0.3208793 α      lambda       -0.1754067E-03
   maximum displ.:     0.2390735 α      in ANC's #1, #2, #3, ...

........................................................................
.............................. CYCLE   10 ..............................
........................................................................
   1    -34.1107848 -0.341108E+02  0.210E-01    2.65       0.0  T
   2    -34.1107897 -0.487901E-05  0.120E-01    2.65       1.0  T
   3    -34.1107807  0.906251E-05  0.316E-02    2.65       1.0  T
   4    -34.1107918 -0.111665E-04  0.116E-02    2.65       2.0  T
   5    -34.1107923 -0.503052E-06  0.319E-03    2.65       7.4  T
   6    -34.1107924 -0.716007E-07  0.139E-03    2.65      17.0  T
   7    -34.1107924 -0.706342E-08  0.861E-04    2.65      27.4  T
     SCC iter.                  ...        0 min,  0.006 sec
     gradient                   ...        0 min,  0.010 sec
 * total energy  :   -33.6593928 Eh     change        0.5758391E-04 Eh
   gradient norm :     0.0098537 Eh/α   predicted    -0.9673757E-04 (-267.99%)
   displ. norm   :     0.1732512 α      lambda       -0.3094008E-03
   maximum displ.:     0.1214525 α      in ANC's #1, #2, #4, ...

........................................................................
.............................. CYCLE   11 ..............................
........................................................................
   1    -34.1157744 -0.341158E+02  0.120E-01    2.67       0.0  T
   2    -34.1157761 -0.172313E-05  0.677E-02    2.67       1.0  T
   3    -34.1157698  0.629726E-05  0.243E-02    2.67       1.0  T
   4    -34.1157772 -0.732403E-05  0.678E-03    2.67       3.5  T
   5    -34.1157773 -0.116322E-06  0.127E-03    2.67      18.5  T
   6    -34.1157773 -0.653063E-08  0.596E-04    2.67      39.6  T
     SCC iter.                  ...        0 min,  0.005 sec
     gradient                   ...        0 min,  0.010 sec
 * total energy  :   -33.6595077 Eh     change       -0.1149471E-03 Eh
   gradient norm :     0.0045030 Eh/α   predicted    -0.1593427E-03 (  38.62%)
   displ. norm   :     0.0496176 α      lambda       -0.6989132E-04
   maximum displ.:     0.0276223 α      in ANC's #5, #6, #3, ...

........................................................................
.............................. CYCLE   12 ..............................
........................................................................
   1    -34.1147336 -0.341147E+02  0.400E-02    2.66       0.0  T
   2    -34.1147342 -0.684440E-06  0.227E-02    2.66       1.0  T
   3    -34.1147337  0.550174E-06  0.800E-03    2.66       2.9  T
   4    -34.1147344 -0.654683E-06  0.288E-03    2.66       8.2  T
   5    -34.1147344 -0.613874E-07  0.136E-03    2.66      17.3  T
     SCC iter.                  ...        0 min,  0.005 sec
     gradient                   ...        0 min,  0.010 sec
 * total energy  :   -33.6595208 Eh     change       -0.1306524E-04 Eh
   gradient norm :     0.0045625 Eh/α   predicted    -0.3503282E-04 ( 168.14%)
   displ. norm   :     0.0427264 α      lambda       -0.3534578E-04
   maximum displ.:     0.0258488 α      in ANC's #1, #2, #3, ...

........................................................................
.............................. CYCLE   13 ..............................
........................................................................
   1    -34.1148289 -0.341148E+02  0.307E-02    2.67       0.0  T
   2    -34.1148293 -0.393989E-06  0.168E-02    2.67       1.4  T
   3    -34.1148293  0.547575E-07  0.413E-03    2.67       5.7  T
   4    -34.1148293 -0.892133E-07  0.216E-03    2.67      10.9  T
   5    -34.1148294 -0.284009E-07  0.100E-03    2.67      23.5  T
     SCC iter.                  ...        0 min,  0.005 sec
     gradient                   ...        0 min,  0.010 sec
 * total energy  :   -33.6595417 Eh     change       -0.2091304E-04 Eh
   gradient norm :     0.0016509 Eh/α   predicted    -0.1770535E-04 ( -15.34%)
   displ. norm   :     0.0948164 α      lambda       -0.1984280E-04
   maximum displ.:     0.0704388 α      in ANC's #1, #2, #4, ...

........................................................................
.............................. CYCLE   14 ..............................
........................................................................
   1    -34.1142488 -0.341142E+02  0.785E-02    2.67       0.0  T
   2    -34.1142498 -0.103515E-05  0.437E-02    2.66       1.0  T
   3    -34.1142484  0.139951E-05  0.131E-02    2.66       1.8  T
   4    -34.1142502 -0.176136E-05  0.528E-03    2.66       4.5  T
   5    -34.1142503 -0.118283E-06  0.104E-03    2.66      22.7  T
   6    -34.1142503 -0.540611E-08  0.472E-04    2.66      50.0  T
   7    -34.1142503 -0.588635E-09  0.276E-04    2.66      85.3  T
     SCC iter.                  ...        0 min,  0.006 sec
     gradient                   ...        0 min,  0.011 sec
 * total energy  :   -33.6595409 Eh     change        0.8245504E-06 Eh
   gradient norm :     0.0037113 Eh/α   predicted    -0.9960502E-05 (*******%)
   displ. norm   :     0.0287092 α      lambda       -0.2440639E-04
   maximum displ.:     0.0193624 α      in ANC's #4, #5, #2, ...

........................................................................
.............................. CYCLE   15 ..............................
........................................................................
   1    -34.1144818 -0.341145E+02  0.201E-02    2.67       0.0  T
   2    -34.1144819 -0.103470E-06  0.115E-02    2.67       2.0  T
   3    -34.1144815  0.362130E-06  0.599E-03    2.67       3.9  T
   4    -34.1144820 -0.430038E-06  0.116E-03    2.67      20.4  T
   5    -34.1144820 -0.253168E-08  0.506E-04    2.67      46.6  T
   6    -34.1144820 -0.521389E-09  0.202E-04    2.67     116.6  T
     SCC iter.                  ...        0 min,  0.005 sec
     gradient                   ...        0 min,  0.010 sec
 * total energy  :   -33.6595584 Eh     change       -0.1751414E-04 Eh
   gradient norm :     0.0017191 Eh/α   predicted    -0.1221327E-04 ( -30.27%)
   displ. norm   :     0.0600137 α      lambda       -0.1631519E-04
   maximum displ.:     0.0395045 α      in ANC's #4, #5, #2, ...

........................................................................
.............................. CYCLE   16 ..............................
........................................................................
   1    -34.1150336 -0.341150E+02  0.409E-02    2.67       0.0  T
   2    -34.1150338 -0.206098E-06  0.244E-02    2.67       1.0  T
   3    -34.1150328  0.975172E-06  0.935E-03    2.67       2.5  T
   4    -34.1150340 -0.116537E-05  0.157E-03    2.67      15.1  T
   5    -34.1150340 -0.478235E-08  0.884E-04    2.67      26.7  T
   6    -34.1150340 -0.214760E-08  0.345E-04    2.67      68.3  T
     SCC iter.                  ...        0 min,  0.005 sec
     gradient                   ...        0 min,  0.010 sec
 * total energy  :   -33.6595698 Eh     change       -0.1139348E-04 Eh
   gradient norm :     0.0021211 Eh/α   predicted    -0.8171763E-05 ( -28.28%)
   displ. norm   :     0.0314158 α      lambda       -0.7812558E-05
   maximum displ.:     0.0195591 α      in ANC's #4, #2, #1, ...

........................................................................
.............................. CYCLE   17 ..............................
........................................................................
   1    -34.1148755 -0.341149E+02  0.238E-02    2.67       0.0  T
   2    -34.1148756 -0.124170E-06  0.135E-02    2.67       1.7  T
   3    -34.1148756  0.112970E-07  0.267E-03    2.67       8.8  T
   4    -34.1148756 -0.304966E-07  0.151E-03    2.67      15.6  T
   5    -34.1148756 -0.144530E-07  0.579E-04    2.67      40.7  T
   6    -34.1148756 -0.314093E-08  0.205E-04    2.67     114.9  T
     SCC iter.                  ...        0 min,  0.006 sec
     gradient                   ...        0 min,  0.010 sec
 * total energy  :   -33.6595766 Eh     change       -0.6842862E-05 Eh
   gradient norm :     0.0015450 Eh/α   predicted    -0.3911197E-05 ( -42.84%)
   displ. norm   :     0.2521918 α      lambda       -0.3730463E-04
   maximum displ.:     0.1497331 α      in ANC's #4, #2, #5, ...

........................................................................
.............................. CYCLE   18 ..............................
........................................................................
   1    -34.1133317 -0.341133E+02  0.188E-01    2.66       0.0  T
   2    -34.1133362 -0.454901E-05  0.110E-01    2.66       1.0  T
   3    -34.1133369 -0.635065E-06  0.173E-02    2.66       1.4  T
   4    -34.1133379 -0.105140E-05  0.107E-02    2.66       2.2  T
   5    -34.1133387 -0.804244E-06  0.302E-03    2.66       7.8  T
   6    -34.1133388 -0.640810E-07  0.149E-03    2.66      15.8  T
   7    -34.1133388 -0.212186E-08  0.687E-04    2.66      34.3  T
   8    -34.1133388 -0.245551E-08  0.289E-04    2.66      81.4  T
     SCC iter.                  ...        0 min,  0.007 sec
     gradient                   ...        0 min,  0.010 sec
 * total energy  :   -33.6595942 Eh     change       -0.1754463E-04 Eh
   gradient norm :     0.0032866 Eh/α   predicted    -0.1918087E-04 (   9.33%)
   displ. norm   :     0.0441117 α      lambda       -0.1475827E-04
   maximum displ.:     0.0270598 α      in ANC's #1, #4, #2, ...

........................................................................
.............................. CYCLE   19 ..............................
........................................................................
   1    -34.1144528 -0.341145E+02  0.321E-02    2.66       0.0  T
   2    -34.1144531 -0.279142E-06  0.184E-02    2.67       1.3  T
   3    -34.1144530  0.400207E-07  0.397E-03    2.67       5.9  T
   4    -34.1144531 -0.878789E-07  0.192E-03    2.67      12.3  T
   5    -34.1144531 -0.166973E-07  0.956E-04    2.67      24.6  T
   6    -34.1144531 -0.775808E-08  0.274E-04    2.67      85.9  T
     SCC iter.                  ...        0 min,  0.005 sec
     gradient                   ...        0 min,  0.010 sec
 * total energy  :   -33.6596029 Eh     change       -0.8753617E-05 Eh
   gradient norm :     0.0012925 Eh/α   predicted    -0.7394676E-05 ( -15.52%)
   displ. norm   :     0.0220165 α      lambda       -0.4256954E-05
   maximum displ.:     0.0149776 α      in ANC's #2, #5, #7, ...

........................................................................
.............................. CYCLE   20 ..............................
........................................................................
   1    -34.1148502 -0.341149E+02  0.163E-02    2.67       0.0  T
   2    -34.1148504 -0.149277E-06  0.950E-03    2.67       2.5  T
   3    -34.1148503  0.764402E-07  0.356E-03    2.67       6.6  T
   4    -34.1148504 -0.101233E-06  0.129E-03    2.67      18.3  T
   5    -34.1148504 -0.131094E-07  0.555E-04    2.67      42.5  T
   6    -34.1148504 -0.161297E-08  0.226E-04    2.67     104.4  T
     SCC iter.                  ...        0 min,  0.006 sec
     gradient                   ...        0 min,  0.011 sec
 * total energy  :   -33.6596059 Eh     change       -0.3005022E-05 Eh
   gradient norm :     0.0009049 Eh/α   predicted    -0.2129362E-05 ( -29.14%)
   displ. norm   :     0.0332270 α      lambda       -0.1547377E-05
   maximum displ.:     0.0191069 α      in ANC's #4, #2, #5, ...

   *** GEOMETRY OPTIMIZATION CONVERGED AFTER 20 ITERATIONS ***

------------------------------------------------------------------------
 total energy gain   :        -0.0055252 Eh       -3.4671 kcal/mol
 total RMSD          :         0.5097185 a0        0.2697 Å
 total power (kW/mol):        -0.7253144 (step)  -30.7776 (real)
------------------------------------------------------------------------

 ANCopt (total)                0 d,  0 h,  0 min,  0.471 sec
 optimizer setup                ...        0 min,  0.000 sec (  0.031%)
 model hessian                  ...        0 min,  0.002 sec (  0.432%)
 ANC generation                 ...        0 min,  0.001 sec (  0.108%)
 coordinate transformation      ...        0 min,  0.000 sec (  0.061%)
 single point calculation       ...        0 min,  0.462 sec ( 97.937%)
 optimization log               ...        0 min,  0.002 sec (  0.338%)
 hessian update                 ...        0 min,  0.000 sec (  0.047%)
 rational function              ...        0 min,  0.004 sec (  0.786%)

================
 final structure:
================
$coord
   -2.33417722337786    2.50416550138413   -0.21753893230563      C 
   -4.65428221825241    0.23794841696332   -0.10499366876889      S 
   -2.47420936062539   -2.23416590982382    0.16098468265657      C 
   -0.05774238617340   -1.26067703312882    0.15626767841946      C 
   -0.00497855274359    1.42882396929720   -0.06133408853456      C 
    2.59897218710778    2.37951067849908   -0.06723339602972      C 
    3.30439979278006    4.53726394989857   -0.22295511165015      O 
    4.26977570265468    0.05170151601995    0.16328800890011      C 
    2.52729316340429   -2.23515985662998    0.31768384338654      C 
    3.23196656839424   -4.39385479470291    0.53488861244702      O 
   -3.44909037660697   -4.76483809948390    0.32459879073585      C 
   -2.04727787056611   -6.84321210227591    0.54549635805057      C 
   -2.82069233968937    4.46258825363303   -0.39056643757418      H 
    5.47414282790899    0.16784379626586    1.83500042926583      H 
    5.53571083888246   -0.10729081848389   -1.45882951107441      H 
   -5.49144965586631   -4.88982996662964    0.25315928102889      H 
   -0.01582082536736   -6.76736934002346    0.62517155828089      H 
   -2.91607507379409   -8.67887230919997    0.65294226317919      H 
$end
           -------------------------------------------------
          |                Final Singlepoint                |
           -------------------------------------------------

          ...................................................
          :                      SETUP                      :
          :.................................................:
          :  # basis functions                  60          :
          :  # atomic orbitals                  59          :
          :  # shells                           31          :
          :  # electrons                        60          :
          :  max. iterations                   250          :
          :  Hamiltonian                  GFN2-xTB          :
          :  restarted?                      false          :
          :  GBSA solvation                  false          :
          :  PC potential                    false          :
          :  electronic temp.          300.0000000     K    :
          :  accuracy                    1.0000000          :
          :  -> integral cutoff          0.2500000E+02      :
          :  -> integral neglect         0.1000000E-07      :
          :  -> SCF convergence          0.1000000E-05 Eh   :
          :  -> wf. convergence          0.1000000E-03 e    :
          :  Broyden damping             0.4000000          :
          ...................................................

 iter      E             dE          RMSdq      gap      omega  full diag
   1    -34.1148504 -0.341149E+02  0.855E-05    2.67       0.0  T
   2    -34.1148504 -0.109424E-10  0.515E-05    2.67     458.1  T
   3    -34.1148504 -0.349445E-10  0.319E-05    2.67     738.1  T

   *** convergence criteria satisfied after 3 iterations ***

         #    Occupation            Energy/Eh            Energy/eV
      -------------------------------------------------------------
         1        2.0000           -0.7617606             -20.7286
       ...           ...                  ...                  ...
        24        2.0000           -0.4796426             -13.0517
        25        2.0000           -0.4638905             -12.6231
        26        2.0000           -0.4539056             -12.3514
        27        2.0000           -0.4301764             -11.7057
        28        2.0000           -0.4144302             -11.2772
        29        2.0000           -0.4084296             -11.1139
        30        2.0000           -0.4083852             -11.1127 (HOMO)
        31                         -0.3103588              -8.4453 (LUMO)
        32                         -0.3007827              -8.1847
        33                         -0.2337775              -6.3614
        34                         -0.2331720              -6.3449
        35                         -0.1945945              -5.2952
       ...                                ...                  ...
        59                          0.7342251              19.9793
      -------------------------------------------------------------
                  HL-Gap            0.0980264 Eh            2.6674 eV
             Fermi-level           -0.3593720 Eh           -9.7790 eV

 SCC (total)                   0 d,  0 h,  0 min,  0.021 sec
 SCC setup                      ...        0 min,  0.000 sec (  0.787%)
 Dispersion                     ...        0 min,  0.000 sec (  0.660%)
 integral evaluation            ...        0 min,  0.007 sec ( 31.347%)
 zeroth order Hamiltonian       ...        0 min,  0.000 sec (  0.575%)
 iterations                     ...        0 min,  0.003 sec ( 15.502%)
 molecular gradient             ...        0 min,  0.010 sec ( 49.447%)
 printout                       ...        0 min,  0.000 sec (  1.466%)

         :::::::::::::::::::::::::::::::::::::::::::::::::::::
         ::                     SUMMARY                     ::
         :::::::::::::::::::::::::::::::::::::::::::::::::::::
         :: total energy             -33.659605914813 Eh    ::
         :: gradient norm              0.000906208981 Eh/a0 ::
         :: HOMO-LUMO gap              2.667434035158 eV    ::
         ::.................................................::
         :: SCC energy               -34.114850413700 Eh    ::
         :: -> isotropic ES            0.050079390816 Eh    ::
         :: -> anisotropic ES         -0.001107019743 Eh    ::
         :: -> anisotropic XC          0.010965612070 Eh    ::
         :: -> dispersion             -0.018902915741 Eh    ::
         :: repulsion energy           0.455177543795 Eh    ::
         :: add. restraining           0.000000000000 Eh    ::
         :::::::::::::::::::::::::::::::::::::::::::::::::::::

           -------------------------------------------------
          |                Property Printout                |
           -------------------------------------------------

    * Orbital Energies and Occupations

         #    Occupation            Energy/Eh            Energy/eV
      -------------------------------------------------------------
         1        2.0000           -0.7617606             -20.7286
       ...           ...                  ...                  ...
        18        2.0000           -0.5256202             -14.3029
        19        2.0000           -0.5151906             -14.0191
        20        2.0000           -0.5124737             -13.9451
        21        2.0000           -0.5007423             -13.6259
        22        2.0000           -0.4863854             -13.2352
        23        2.0000           -0.4848211             -13.1927
        24        2.0000           -0.4796426             -13.0517
        25        2.0000           -0.4638905             -12.6231
        26        2.0000           -0.4539056             -12.3514
        27        2.0000           -0.4301764             -11.7057
        28        2.0000           -0.4144302             -11.2772
        29        2.0000           -0.4084296             -11.1139
        30        2.0000           -0.4083852             -11.1127 (HOMO)
        31                         -0.3103588              -8.4453 (LUMO)
        32                         -0.3007827              -8.1847
        33                         -0.2337775              -6.3614
        34                         -0.2331720              -6.3449
        35                         -0.1945945              -5.2952
        36                         -0.1486347              -4.0446
        37                         -0.1401184              -3.8128
        38                         -0.0289193              -0.7869
        39                          0.0019064               0.0519
        40                          0.0104225               0.2836
        41                          0.0617196               1.6795
       ...                                ...                  ...
        59                          0.7342251              19.9793
      -------------------------------------------------------------
                  HL-Gap            0.0980264 Eh            2.6674 eV
             Fermi-level           -0.3593720 Eh           -9.7790 eV

     #   Z        covCN         q      C6AA      α(0)
     1   6 C      2.921    -0.009    28.238     8.714
     2  16 S      2.376     0.039   139.469    19.877
     3   6 C      2.979     0.041    27.077     8.536
     4   6 C      3.192    -0.044    28.577     8.718
     5   6 C      3.226    -0.033    28.024     8.601
     6   6 C      2.838     0.238    23.027     7.864
     7   8 O      0.856    -0.348    20.661     6.094
     8   6 C      3.840    -0.118    22.717     6.780
     9   6 C      2.844     0.239    23.006     7.861
    10   8 O      0.856    -0.360    20.902     6.130
    11   6 C      2.932    -0.030    28.739     8.792
    12   6 C      2.840    -0.078    29.929     8.966
    13   1 H      0.926     0.072     2.063     2.246
    14   1 H      0.924     0.094     1.841     2.122
    15   1 H      0.924     0.094     1.839     2.121
    16   1 H      0.925     0.050     2.321     2.382
    17   1 H      0.926     0.093     1.846     2.125
    18   1 H      0.926     0.058     2.226     2.333

 Mol. C6AA /au·bohr⁶  :       5717.472096
 Mol. C8AA /au·bohr⁸  :     161266.976135
 Mol. α(0) /au        :        120.260513


Wiberg/Mayer (AO) data.
largest (>0.10) Wiberg bond orders for each atom
          total WBO             WBO to atom ...
     1  C   3.960        C    5 1.558    S    2 1.219    H   13 0.966
     2  S   2.672        C    1 1.219    C    3 1.151
     3  C   3.957        C    4 1.462    S    2 1.151    C   11 1.144
     4  C   3.982        C    3 1.462    C    5 1.187    C    9 1.055
     5  C   3.985        C    1 1.558    C    4 1.187    C    6 1.034
     6  C   3.933        O    7 1.832    C    5 1.034    C    8 0.978
     7  O   2.090        C    6 1.832
     8  C   3.995        C    6 0.978    C    9 0.978    H   14 0.933    H   15 0.932
     9  C   3.936        O   10 1.803    C    4 1.055    C    8 0.978
    10  O   2.091        C    9 1.803
    11  C   3.989        C   12 1.846    C    3 1.144    H   16 0.962
    12  C   3.975        C   11 1.846    H   18 0.976    H   17 0.959
    13  H   0.994        C    1 0.966
    14  H   0.988        C    8 0.933
    15  H   0.988        C    8 0.932
    16  H   0.997        C   11 0.962
    17  H   0.991        C   12 0.959
    18  H   0.996        C   12 0.976

molecular dipole:
                 x           y           z       tot (Debye)
 q only:       -1.200      -0.442      -0.011
   full:       -1.058      -0.340      -0.018       2.824
molecular quadrupole (traceless):
                xx          xy          yy          xz          yz          zz
 q only:        4.148       0.889      -5.875      -0.145       0.689       1.727
  q+dip:        5.327       0.504      -7.237      -0.061       0.844       1.910
   full:        3.022       0.684      -8.359      -0.265       1.227       5.337

           -------------------------------------------------
          |                Geometry Summary                 |
           -------------------------------------------------

      molecular mass/u    :      178.2052000
   center of mass at/Å    :       -0.1679013      -0.4092591       0.0565230
  moments of inertia/u·Å² :        0.4223117E+03   0.6140224E+03   0.1033239E+04
rotational constants/cm⁻¹ :        0.3991751E-01   0.2745443E-01   0.1631533E-01

 * 14 selected distances

     #   Z        #   Z                                     value/Å
     1   6 C      2  16 S                                 1.7172836
     2  16 S      3   6 C                                 1.7498742 (max)
     3   6 C      4   6 C                                 1.3786074
     1   6 C      5   6 C                                 1.3600912
     4   6 C      5   6 C                                 1.4281464
     6   6 C      7   8 O                                 1.2041285
     9   6 C     10   8 O                                 1.2071398
    11   6 C     12   6 C                                 1.3317524
     1   6 C     13   1 H                                 1.0717708 (min)
     8   6 C     14   1 H                                 1.0920316
     8   6 C     15   1 H                                 1.0920987
    11   6 C     16   1 H                                 1.0834519
    12   6 C     17   1 H                                 1.0765757
    12   6 C     18   1 H                                 1.0761964

 * 4 distinct bonds (by element types)

   Z      Z             #   av. dist./Å        max./Å        min./Å
   1 H    6 C           6     1.0820208     1.0920987     1.0717708
   6 C    6 C           4     1.3746493     1.4281464     1.3317524
   6 C    8 O           2     1.2056341     1.2071398     1.2041285
   6 C   16 S           2     1.7335789     1.7498742     1.7172836


optimized geometry written to: xtbopt.xyz


           -------------------------------------------------
          | TOTAL ENERGY              -33.659605914813 Eh   |
          | GRADIENT NORM               0.000906208981 Eh/α |
          | HOMO-LUMO GAP               2.667434035158 eV   |
           -------------------------------------------------

------------------------------------------------------------------------
 * finished run on 2021/05/19 at 10:59:42.595     
------------------------------------------------------------------------
 total:
 * wall-time:     0 d,  0 h,  0 min,  0.543 sec
 *  cpu-time:     0 d,  0 h,  0 min,  0.541 sec
 * ratio c/w:     0.997 speedup
 SCF:
 * wall-time:     0 d,  0 h,  0 min,  0.031 sec
 *  cpu-time:     0 d,  0 h,  0 min,  0.031 sec
 * ratio c/w:     0.998 speedup
 ANC optimizer:
 * wall-time:     0 d,  0 h,  0 min,  0.493 sec
 *  cpu-time:     0 d,  0 h,  0 min,  0.492 sec
 * ratio c/w:     0.997 speedup

