      -----------------------------------------------------------      
     |                   =====================                   |     
     |                           x T B                           |     
     |                   =====================                   |     
     |                         S. Grimme                         |     
     |          Mulliken Center for Theoretical Chemistry        |     
     |                    University of Bonn                     |     
     |                Version 6.2 RC2 (SAW190805)                |     
      -----------------------------------------------------------      

   This program is distributed in the hope that it will be useful,
   but WITHOUT ANY WARRANTY; without even the implied warranty of
   MERCHANTABILITY or FITNESS FOR A PARTICULAR PURPOSE.
   
   FOR NON-COMMERCIAL, ACADEMIA USE ONLY.
   
   Cite this work as:
   * S. Grimme, C. Bannwarth, P. Shushkov, J. Chem. Theory Comput., 2017,
     13, 1989-2009. DOI: 10.1021/acs.jctc.7b00118
   * C. Bannwarth, S. Ehlert and S. Grimme., J. Chem. Theory Comput., 2019,
     15, 1652-1671. DOI: 10.1021/acs.jctc.8b01176
   * P. Pracht, E. Caldeweyher, S. Ehlert, S. Grimme, ChemRxiv, 2019, preprint.
     DOI: 10.26434/chemrxiv.8326202.v1
   
   for DFT-D4:
   * E. Caldeweyher, C. Bannwarth and S. Grimme, J. Chem. Phys., 2017,
     147, 034112. DOI: 10.1063/1.4993215
   * E. Caldeweyher, S. Ehlert, A. Hansen, H. Neugebauer, S. Spicher,
     C. Bannwarth and S. Grimme, J. Chem. Phys., 2019, 150, 154122.
     DOI: 10.1063/1.5090222
   
   for sTDA-xTB:
   * S. Grimme and C. Bannwarth, J. Chem. Phys., 2016, 145, 054103.
     DOI: 10.1063/1.4959605
   
   in the mass-spec context:
   * V. Asgeirsson, C. Bauer and S. Grimme, Chem. Sci., 2017, 8, 4879.
     DOI: 10.1039/c7sc00601b
   
   for metadynamics refer to:
   * S. Grimme, J. Chem. Theory Comput., 2019, 155, 2847-2862
     DOI: 10.1021/acs.jctc.9b00143
   
   with help from (in alphabetical order)
   C. Bannwarth, F. Bohle, G. Brandenburg, E. Caldeweyher, M. Checinski,
   S. Dohm, S. Ehlert, S. Ehrlich, F. März, H. Neugebauer, J. Pisarek,
   P. Pracht, P. Shushkov, and S. Spicher.
   
 * started run on 2021/05/19 at 10:59:44.559     

           -------------------------------------------------
          |                Calculation Setup                |
           -------------------------------------------------

          program call               : /ihome/ghutchison/geoffh/xtb/xtb 559.xyz -opt
          hostname                   : smp-n144
          coordinate file            : 559.xyz
          omp threads                :                     1
          number of atoms            :                    19
          number of electrons        :                    64
          charge                     :                     0
          spin                       :                   0.0
          first test random number   :      0.55631514977980


########################################################################
# WARNING! Please study the warnings concerning your input carefully
#  - the use of '-opt' is discouraged, please use '--opt' next time
########################################################################

           ------------------------------------------------- 
          |                 G F N 2 - x T B                 |
          | Geometry, Frequencies, Noncovalent interactions |
          |            JCTC 2019 parametrisation            |
           ------------------------------------------------- 
             KAB for C  - Si     :                1.0500
             KAB for H  - Pd     :                0.9500
             k(s)              :                1.8500
             k(p)              :                2.2300
             k(d)              :                2.2300
             k(f)              :                2.0000
             kEN (H0ij)        :               -2.0000
             D4 a1             :                0.5200
             D4 a2             :                5.0000
             D4 s6             :                1.0000
             D4 s8             :                2.7000
             D4 s9             :                5.0000
             alphaj            :                2.0000

  Z AO/shell   Hii/eV     exponent
  1     Wed Apr 25 08:07:45 CEST 2018   EN: 2.200 GM2: 0.406  GM3: 0.0800  RAES: 1.40
     1s    -10.707211    1.230000
  6     Wed Apr 25 08:07:45 CEST 2018   EN: 2.550 GM2: 0.538  GM3: 0.1500  RAES: 3.00
     2s    -13.970922    2.096432
     2p    -10.063292    1.800000
 16     Tue Apr 24 11:44:34 CEST 2018   EN: 2.580 GM2: 0.340  GM3:-0.0502  RAES: 3.10
     3s    -20.029654    1.981333
     3p    -11.377694    2.025643
     3d     -0.420282    1.702555

           ------------------------------------------------- 
          |        Self-Consistent Charge Iterations        |
           ------------------------------------------------- 

          ...................................................
          :                      SETUP                      :
          :.................................................:
          :  # basis functions                  76          :
          :  # atomic orbitals                  73          :
          :  # shells                           35          :
          :  # electrons                        64          :
          :  max. iterations                   250          :
          :  Hamiltonian                  GFN2-xTB          :
          :  restarted?                      false          :
          :  GBSA solvation                  false          :
          :  PC potential                    false          :
          :  electronic temp.          300.0000000     K    :
          :  accuracy                    1.0000000          :
          :  -> integral cutoff          0.2500000E+02      :
          :  -> integral neglect         0.1000000E-07      :
          :  -> SCF convergence          0.1000000E-05 Eh   :
          :  -> wf. convergence          0.1000000E-03 e    :
          :  Broyden damping             0.4000000          :
          ...................................................

 iter      E             dE          RMSdq      gap      omega  full diag
   1    -34.6370667 -0.346371E+02  0.509E+00    2.39       0.0  T
   2    -34.6518808 -0.148141E-01  0.272E+00    2.45       1.0  T
   3    -34.6370915  0.147892E-01  0.125E+00    2.48       1.0  T
   4    -34.6552752 -0.181837E-01  0.468E-01    2.45       1.0  T
   5    -34.6562550 -0.979798E-03  0.150E-01    2.47       1.0  T
   6    -34.6563286 -0.735979E-04  0.660E-02    2.46       1.0  T
   7    -34.6563930 -0.643732E-04  0.242E-02    2.46       1.0  T
   8    -34.6563979 -0.493979E-05  0.103E-02    2.46       2.2  T
   9    -34.6563981 -0.215004E-06  0.527E-03    2.46       4.4  T
  10    -34.6563983 -0.137113E-06  0.221E-03    2.46      10.4  T
  11    -34.6563983 -0.367469E-07  0.116E-03    2.46      19.8  T
  12    -34.6563983 -0.583109E-08  0.530E-04    2.46      43.3  T
  13    -34.6563983 -0.637527E-09  0.313E-04    2.46      73.3  T

   *** convergence criteria satisfied after 13 iterations ***

         #    Occupation            Energy/Eh            Energy/eV
      -------------------------------------------------------------
         1        2.0000           -0.7415953             -20.1798
       ...           ...                  ...                  ...
        26        2.0000           -0.4518612             -12.2958
        27        2.0000           -0.4426594             -12.0454
        28        2.0000           -0.4363513             -11.8737
        29        2.0000           -0.4159661             -11.3190
        30        2.0000           -0.4083046             -11.1105
        31        2.0000           -0.3776516             -10.2764
        32        2.0000           -0.3726833             -10.1412 (HOMO)
        33                         -0.2823106              -7.6821 (LUMO)
        34                         -0.2441029              -6.6424
        35                         -0.2227909              -6.0624
        36                         -0.2204301              -5.9982
        37                         -0.2030362              -5.5249
       ...                                ...                  ...
        73                          0.7611430              20.7118
      -------------------------------------------------------------
                  HL-Gap            0.0903727 Eh            2.4592 eV
             Fermi-level           -0.3274970 Eh           -8.9116 eV

 SCC (total)                   0 d,  0 h,  0 min,  0.044 sec
 SCC setup                      ...        0 min,  0.000 sec (  0.669%)
 Dispersion                     ...        0 min,  0.000 sec (  0.621%)
 integral evaluation            ...        0 min,  0.011 sec ( 24.740%)
 zeroth order Hamiltonian       ...        0 min,  0.000 sec (  0.456%)
 iterations                     ...        0 min,  0.017 sec ( 37.789%)
 molecular gradient             ...        0 min,  0.015 sec ( 34.766%)
 printout                       ...        0 min,  0.000 sec (  0.837%)

         :::::::::::::::::::::::::::::::::::::::::::::::::::::
         ::                     SUMMARY                     ::
         :::::::::::::::::::::::::::::::::::::::::::::::::::::
         :: total energy             -34.152145819752 Eh    ::
         :: gradient norm              0.083968954568 Eh/a0 ::
         :: HOMO-LUMO gap              2.459165559119 eV    ::
         ::.................................................::
         :: SCC energy               -34.656398296279 Eh    ::
         :: -> isotropic ES            0.001455491352 Eh    ::
         :: -> anisotropic ES          0.001646736983 Eh    ::
         :: -> anisotropic XC          0.016114105140 Eh    ::
         :: -> dispersion             -0.025191632734 Eh    ::
         :: repulsion energy           0.504351600797 Eh    ::
         :: add. restraining           0.000000000000 Eh    ::
         :::::::::::::::::::::::::::::::::::::::::::::::::::::

      ----------------------------------------------------------- 
     |                   =====================                   |
     |                        A N C O P T                        |
     |                   =====================                   |
     |               Approximate Normal Coordinate               |
     |                Rational Function Optimizer                |
      ----------------------------------------------------------- 

          ...................................................
          :                      SETUP                      :
          :.................................................:
          :   optimization level            normal          :
          :   max. optcycles                   200          :
          :   ANC micro-cycles                  20          :
          :   degrees of freedom                51          :
          :.................................................:
          :   RF solver                   davidson          :
          :   input Hessian                  false          :
          :   write xtbopt.log                true          :
          :   linear?                        false          :
          :   energy convergence         0.5000000E-05 Eh   :
          :   grad. convergence          0.1000000E-02 Eh/α :
          :   maximium RF displ.         2.0000000          :
          :   Hlow (freq-cutoff)         0.5000000E-02      :
          :   Hmax (freq-cutoff)         5.0000000          :
          :   S6 in model hess.         20.0000000          :
          ...................................................

generating ANC from model Hessian ...
Using Lindh-Hessian (1995)
 Shifting diagonal of input Hessian by   3.029871094074697E-003
 Lowest  eigenvalues of input Hessian
   -0.000000   -0.000000   -0.000000    0.000000    0.000000    0.000000
    0.005000    0.006503    0.008478    0.010232    0.013820    0.019686
    0.021460    0.030033    0.039146    0.043521    0.046702    0.051640
 Highest eigenvalues
    1.765417    1.792004    1.864281    1.979155    2.064454    2.100620
 

........................................................................
.............................. CYCLE    1 ..............................
........................................................................
   1    -34.6563983 -0.346564E+02  0.130E-04    2.46       0.0  T
   2    -34.6563983 -0.189075E-10  0.950E-05    2.46     241.6  T
   3    -34.6563983 -0.201936E-10  0.650E-05    2.46     352.7  T
     SCC iter.                  ...        0 min,  0.004 sec
     gradient                   ...        0 min,  0.016 sec
 * total energy  :   -34.1521458 Eh     change        0.8891099E-08 Eh
   gradient norm :     0.0839694 Eh/α   predicted     0.0000000E+00 (-100.00%)
   displ. norm   :     0.4006445 α      lambda       -0.1851417E-01
   maximum displ.:     0.3070360 α      in ANC's #8, #29, #3, ...

........................................................................
.............................. CYCLE    2 ..............................
........................................................................
   1    -34.6648807 -0.346649E+02  0.497E-01    2.44       0.0  T
   2    -34.6649460 -0.652965E-04  0.269E-01    2.43       1.0  T
   3    -34.6646381  0.307866E-03  0.158E-01    2.44       1.0  T
   4    -34.6650310 -0.392916E-03  0.447E-02    2.43       1.0  T
   5    -34.6650274  0.362234E-05  0.236E-02    2.43       1.0  T
   6    -34.6650332 -0.580591E-05  0.868E-03    2.43       2.6  T
   7    -34.6650334 -0.207149E-06  0.545E-03    2.43       4.2  T
   8    -34.6650335 -0.104445E-06  0.189E-03    2.43      12.1  T
     SCC iter.                  ...        0 min,  0.009 sec
     gradient                   ...        0 min,  0.014 sec
 * total energy  :   -34.1654915 Eh     change       -0.1334565E-01 Eh
   gradient norm :     0.0325654 Eh/α   predicted    -0.1074300E-01 ( -19.50%)
   displ. norm   :     0.4768367 α      lambda       -0.8124829E-02
   maximum displ.:     0.3700224 α      in ANC's #8, #3, #29, ...

........................................................................
.............................. CYCLE    3 ..............................
........................................................................
   1    -34.6669701 -0.346670E+02  0.402E-01    2.41       0.0  T
   2    -34.6670008 -0.307572E-04  0.217E-01    2.41       1.0  T
   3    -34.6669159  0.848871E-04  0.961E-02    2.42       1.0  T
   4    -34.6670228 -0.106808E-03  0.362E-02    2.41       1.0  T
   5    -34.6670227  0.118608E-07  0.145E-02    2.41       1.6  T
   6    -34.6670247 -0.190587E-05  0.795E-03    2.41       2.9  T
   7    -34.6670249 -0.250154E-06  0.363E-03    2.41       6.3  T
   8    -34.6670249 -0.231163E-07  0.134E-03    2.41      17.1  T
     SCC iter.                  ...        0 min,  0.009 sec
     gradient                   ...        0 min,  0.014 sec
 * total energy  :   -34.1709629 Eh     change       -0.5471462E-02 Eh
   gradient norm :     0.0121281 Eh/α   predicted    -0.4986105E-02 (  -8.87%)
   displ. norm   :     0.4201264 α      lambda       -0.2764913E-02
   maximum displ.:     0.2826005 α      in ANC's #3, #8, #4, ...

........................................................................
.............................. CYCLE    4 ..............................
........................................................................
   1    -34.6664849 -0.346665E+02  0.244E-01    2.41       0.0  T
   2    -34.6664997 -0.148075E-04  0.137E-01    2.41       1.0  T
   3    -34.6664822  0.174832E-04  0.464E-02    2.41       1.0  T
   4    -34.6665043 -0.221056E-04  0.221E-02    2.41       1.0  T
   5    -34.6665061 -0.182126E-05  0.108E-02    2.41       2.1  T
   6    -34.6665071 -0.929367E-06  0.480E-03    2.41       4.8  T
   7    -34.6665071 -0.291134E-07  0.242E-03    2.41       9.5  T
   8    -34.6665071 -0.104218E-07  0.110E-03    2.41      20.9  T
     SCC iter.                  ...        0 min,  0.009 sec
     gradient                   ...        0 min,  0.014 sec
 * total energy  :   -34.1728006 Eh     change       -0.1837626E-02 Eh
   gradient norm :     0.0120560 Eh/α   predicted    -0.1626471E-02 ( -11.49%)
   displ. norm   :     0.3286856 α      lambda       -0.1261181E-02
   maximum displ.:     0.2631544 α      in ANC's #3, #8, #4, ...

........................................................................
.............................. CYCLE    5 ..............................
........................................................................
   1    -34.6687408 -0.346687E+02  0.187E-01    2.41       0.0  T
   2    -34.6687482 -0.737451E-05  0.105E-01    2.41       1.0  T
   3    -34.6687404  0.774491E-05  0.300E-02    2.41       1.0  T
   4    -34.6687503 -0.985705E-05  0.149E-02    2.41       1.5  T
   5    -34.6687509 -0.650185E-06  0.768E-03    2.41       3.0  T
   6    -34.6687516 -0.706138E-06  0.290E-03    2.41       7.9  T
   7    -34.6687516  0.251880E-08  0.117E-03    2.41      19.6  T
     SCC iter.                  ...        0 min,  0.008 sec
     gradient                   ...        0 min,  0.014 sec
 * total energy  :   -34.1735215 Eh     change       -0.7209599E-03 Eh
   gradient norm :     0.0112037 Eh/α   predicted    -0.6987270E-03 (  -3.08%)
   displ. norm   :     0.2202022 α      lambda       -0.6213933E-03
   maximum displ.:     0.1744753 α      in ANC's #3, #2, #1, ...

........................................................................
.............................. CYCLE    6 ..............................
........................................................................
   1    -34.6725715 -0.346726E+02  0.152E-01    2.42       0.0  T
   2    -34.6725756 -0.411907E-05  0.820E-02    2.42       1.0  T
   3    -34.6725739  0.173686E-05  0.187E-02    2.42       1.2  T
   4    -34.6725763 -0.240926E-05  0.103E-02    2.42       2.2  T
   5    -34.6725768 -0.474309E-06  0.435E-03    2.42       5.3  T
   6    -34.6725770 -0.233969E-06  0.144E-03    2.42      15.9  T
   7    -34.6725770  0.274770E-08  0.930E-04    2.42      24.7  T
     SCC iter.                  ...        0 min,  0.008 sec
     gradient                   ...        0 min,  0.015 sec
 * total energy  :   -34.1739008 Eh     change       -0.3793286E-03 Eh
   gradient norm :     0.0075731 Eh/α   predicted    -0.3257638E-03 ( -14.12%)
   displ. norm   :     0.1463108 α      lambda       -0.2296359E-03
   maximum displ.:     0.1159917 α      in ANC's #3, #1, #2, ...

........................................................................
.............................. CYCLE    7 ..............................
........................................................................
   1    -34.6748234 -0.346748E+02  0.118E-01    2.42       0.0  T
   2    -34.6748269 -0.349919E-05  0.619E-02    2.42       1.0  T
   3    -34.6748240  0.294653E-05  0.186E-02    2.42       1.2  T
   4    -34.6748276 -0.367729E-05  0.868E-03    2.42       2.6  T
   5    -34.6748281 -0.442871E-06  0.246E-03    2.42       9.3  T
   6    -34.6748281 -0.316656E-07  0.111E-03    2.42      20.7  T
     SCC iter.                  ...        0 min,  0.007 sec
     gradient                   ...        0 min,  0.014 sec
 * total energy  :   -34.1740708 Eh     change       -0.1699836E-03 Eh
   gradient norm :     0.0044752 Eh/α   predicted    -0.1172774E-03 ( -31.01%)
   displ. norm   :     0.1708977 α      lambda       -0.1683863E-03
   maximum displ.:     0.1159044 α      in ANC's #3, #2, #1, ...

........................................................................
.............................. CYCLE    8 ..............................
........................................................................
   1    -34.6746175 -0.346746E+02  0.157E-01    2.41       0.0  T
   2    -34.6746233 -0.577945E-05  0.819E-02    2.41       1.0  T
   3    -34.6746194  0.387246E-05  0.220E-02    2.41       1.0  T
   4    -34.6746242 -0.481765E-05  0.116E-02    2.41       2.0  T
   5    -34.6746251 -0.869651E-06  0.343E-03    2.41       6.7  T
   6    -34.6746251 -0.804445E-07  0.143E-03    2.41      16.0  T
   7    -34.6746252 -0.223133E-07  0.654E-04    2.41      35.1  T
     SCC iter.                  ...        0 min,  0.008 sec
     gradient                   ...        0 min,  0.015 sec
 * total energy  :   -34.1741855 Eh     change       -0.1146609E-03 Eh
   gradient norm :     0.0036671 Eh/α   predicted    -0.8665406E-04 ( -24.43%)
   displ. norm   :     0.1296245 α      lambda       -0.7722331E-04
   maximum displ.:     0.0767141 α      in ANC's #2, #3, #1, ...

........................................................................
.............................. CYCLE    9 ..............................
........................................................................
   1    -34.6742836 -0.346743E+02  0.125E-01    2.41       0.0  T
   2    -34.6742867 -0.312708E-05  0.652E-02    2.41       1.0  T
   3    -34.6742866  0.129643E-06  0.130E-02    2.41       1.8  T
   4    -34.6742868 -0.248425E-06  0.832E-03    2.41       2.8  T
   5    -34.6742875 -0.698178E-06  0.133E-03    2.41      17.3  T
   6    -34.6742876 -0.166161E-07  0.611E-04    2.41      37.5  T
   7    -34.6742876 -0.158818E-08  0.395E-04    2.41      58.1  T
     SCC iter.                  ...        0 min,  0.008 sec
     gradient                   ...        0 min,  0.015 sec
 * total energy  :   -34.1742383 Eh     change       -0.5277723E-04 Eh
   gradient norm :     0.0037661 Eh/α   predicted    -0.3926347E-04 ( -25.61%)
   displ. norm   :     0.1099720 α      lambda       -0.4837459E-04
   maximum displ.:     0.0801334 α      in ANC's #2, #1, #3, ...

........................................................................
.............................. CYCLE   10 ..............................
........................................................................
   1    -34.6739432 -0.346739E+02  0.116E-01    2.41       0.0  T
   2    -34.6739459 -0.263853E-05  0.600E-02    2.41       1.0  T
   3    -34.6739462 -0.360808E-06  0.107E-02    2.41       2.2  T
   4    -34.6739459  0.285532E-06  0.653E-03    2.41       3.5  T
   5    -34.6739465 -0.581197E-06  0.694E-04    2.41      33.1  T
   6    -34.6739465 -0.426147E-08  0.377E-04    2.41      60.8  T
     SCC iter.                  ...        0 min,  0.007 sec
     gradient                   ...        0 min,  0.015 sec
 * total energy  :   -34.1742734 Eh     change       -0.3511422E-04 Eh
   gradient norm :     0.0031126 Eh/α   predicted    -0.2448339E-04 ( -30.27%)
   displ. norm   :     0.0855970 α      lambda       -0.3837852E-04
   maximum displ.:     0.0703026 α      in ANC's #2, #1, #4, ...

........................................................................
.............................. CYCLE   11 ..............................
........................................................................
   1    -34.6743120 -0.346743E+02  0.908E-02    2.41       0.0  T
   2    -34.6743137 -0.173773E-05  0.473E-02    2.41       1.0  T
   3    -34.6743123  0.143617E-05  0.131E-02    2.41       1.8  T
   4    -34.6743141 -0.184064E-05  0.620E-03    2.41       3.7  T
   5    -34.6743143 -0.189808E-06  0.178E-03    2.41      12.9  T
   6    -34.6743144 -0.320773E-07  0.528E-04    2.41      43.5  T
   7    -34.6743144 -0.403679E-08  0.173E-04    2.41     132.5  T
     SCC iter.                  ...        0 min,  0.008 sec
     gradient                   ...        0 min,  0.016 sec
 * total energy  :   -34.1743011 Eh     change       -0.2776186E-04 Eh
   gradient norm :     0.0016696 Eh/α   predicted    -0.1933073E-04 ( -30.37%)
   displ. norm   :     0.1330805 α      lambda       -0.2698583E-04
   maximum displ.:     0.1164037 α      in ANC's #2, #1, #4, ...

........................................................................
.............................. CYCLE   12 ..............................
........................................................................
   1    -34.6740092 -0.346740E+02  0.136E-01    2.41       0.0  T
   2    -34.6740128 -0.365842E-05  0.711E-02    2.41       1.0  T
   3    -34.6740110  0.185268E-05  0.169E-02    2.41       1.4  T
   4    -34.6740134 -0.239821E-05  0.916E-03    2.41       2.5  T
   5    -34.6740140 -0.574674E-06  0.219E-03    2.41      10.5  T
   6    -34.6740140 -0.502474E-07  0.751E-04    2.41      30.6  T
   7    -34.6740140 -0.708279E-08  0.292E-04    2.41      78.6  T
     SCC iter.                  ...        0 min,  0.008 sec
     gradient                   ...        0 min,  0.015 sec
 * total energy  :   -34.1743230 Eh     change       -0.2189861E-04 Eh
   gradient norm :     0.0022675 Eh/α   predicted    -0.1360114E-04 ( -37.89%)
   displ. norm   :     0.0383031 α      lambda       -0.1134843E-04
   maximum displ.:     0.0298061 α      in ANC's #2, #3, #1, ...

........................................................................
.............................. CYCLE   13 ..............................
........................................................................
   1    -34.6746642 -0.346747E+02  0.380E-02    2.41       0.0  T
   2    -34.6746645 -0.282252E-06  0.196E-02    2.41       1.2  T
   3    -34.6746645  0.328937E-07  0.434E-03    2.41       5.3  T
   4    -34.6746645 -0.637627E-07  0.266E-03    2.41       8.6  T
   5    -34.6746646 -0.450049E-07  0.484E-04    2.41      47.4  T
   6    -34.6746646 -0.316662E-08  0.225E-04    2.41     101.8  T
     SCC iter.                  ...        0 min,  0.007 sec
     gradient                   ...        0 min,  0.015 sec
 * total energy  :   -34.1743302 Eh     change       -0.7200605E-05 Eh
   gradient norm :     0.0019303 Eh/α   predicted    -0.5684640E-05 ( -21.05%)
   displ. norm   :     0.0627900 α      lambda       -0.8210270E-05
   maximum displ.:     0.0547536 α      in ANC's #2, #3, #1, ...

........................................................................
.............................. CYCLE   14 ..............................
........................................................................
   1    -34.6748357 -0.346748E+02  0.613E-02    2.41       0.0  T
   2    -34.6748365 -0.811161E-06  0.315E-02    2.41       1.0  T
   3    -34.6748357  0.750145E-06  0.896E-03    2.41       2.6  T
   4    -34.6748367 -0.971867E-06  0.427E-03    2.41       5.4  T
   5    -34.6748368 -0.788071E-07  0.140E-03    2.41      16.4  T
   6    -34.6748368 -0.210190E-07  0.412E-04    2.41      55.7  T
   7    -34.6748368 -0.162382E-08  0.215E-04    2.41     106.5  T
     SCC iter.                  ...        0 min,  0.008 sec
     gradient                   ...        0 min,  0.015 sec
 * total energy  :   -34.1743348 Eh     change       -0.4556108E-05 Eh
   gradient norm :     0.0012057 Eh/α   predicted    -0.4115142E-05 (  -9.68%)
   displ. norm   :     0.0073501 α      lambda       -0.2649892E-05
   maximum displ.:     0.0032848 α      in ANC's #9, #13, #2, ...

........................................................................
.............................. CYCLE   15 ..............................
........................................................................
   1    -34.6746245 -0.346746E+02  0.112E-02    2.41       0.0  T
   2    -34.6746246 -0.544786E-07  0.617E-03    2.41       3.7  T
   3    -34.6746245  0.789242E-07  0.281E-03    2.41       8.2  T
   4    -34.6746246 -0.969331E-07  0.890E-04    2.41      25.8  T
   5    -34.6746246 -0.315197E-08  0.319E-04    2.41      72.0  T
     SCC iter.                  ...        0 min,  0.006 sec
     gradient                   ...        0 min,  0.015 sec
 * total energy  :   -34.1743356 Eh     change       -0.8195860E-06 Eh
   gradient norm :     0.0010012 Eh/α   predicted    -0.1326057E-05 (  61.80%)
   displ. norm   :     0.0151128 α      lambda       -0.1077338E-05
   maximum displ.:     0.0128377 α      in ANC's #2, #1, #5, ...

........................................................................
.............................. CYCLE   16 ..............................
........................................................................
   1    -34.6747369 -0.346747E+02  0.163E-02    2.41       0.0  T
   2    -34.6747369 -0.465543E-07  0.875E-03    2.41       2.6  T
   3    -34.6747369  0.981881E-08  0.181E-03    2.41      12.7  T
   4    -34.6747369 -0.125984E-07  0.108E-03    2.41      21.3  T
   5    -34.6747369 -0.852464E-08  0.218E-04    2.41     105.1  T
   6    -34.6747369 -0.457540E-09  0.861E-05    2.41     266.4  T
     SCC iter.                  ...        0 min,  0.007 sec
     gradient                   ...        0 min,  0.016 sec
 * total energy  :   -34.1743363 Eh     change       -0.6408036E-06 Eh
   gradient norm :     0.0002728 Eh/α   predicted    -0.5419676E-06 ( -15.42%)
   displ. norm   :     0.0051481 α      lambda       -0.1827321E-06
   maximum displ.:     0.0033413 α      in ANC's #2, #6, #5, ...

   *** GEOMETRY OPTIMIZATION CONVERGED AFTER 16 ITERATIONS ***

------------------------------------------------------------------------
 total energy gain   :        -0.0221904 Eh      -13.9247 kcal/mol
 total RMSD          :         0.4870222 a0        0.2577 Å
 total power (kW/mol):        -3.6413112 (step) -105.1739 (real)
------------------------------------------------------------------------

 ANCopt (total)                0 d,  0 h,  0 min,  0.554 sec
 optimizer setup                ...        0 min,  0.000 sec (  0.030%)
 model hessian                  ...        0 min,  0.001 sec (  0.246%)
 ANC generation                 ...        0 min,  0.001 sec (  0.097%)
 coordinate transformation      ...        0 min,  0.000 sec (  0.043%)
 single point calculation       ...        0 min,  0.547 sec ( 98.668%)
 optimization log               ...        0 min,  0.001 sec (  0.243%)
 hessian update                 ...        0 min,  0.000 sec (  0.034%)
 rational function              ...        0 min,  0.003 sec (  0.460%)

================
 final structure:
================
$coord
    6.02635167581768   -0.52139173691146    0.11142790775152      C 
    3.74934944172849   -2.84822980657758    0.44688471849445      S 
    1.39158218455004   -0.61102200027237    0.18538605870060      C 
    2.39897576243609    1.79810739974244   -0.14349251422814      C 
    5.05956981419164    1.83710861875346   -0.18431563300461      C 
    0.08706596219538    4.12151853331041   -0.41686998628513      S 
   -2.24917191302396    1.82518748603975   -0.08526443806253      C 
   -4.89624302300725    1.90211673854296   -0.06053417940425      C 
   -5.93824165652434   -0.44993045363116    0.26093786406876      C 
   -3.62622361616853   -2.81280436639669    0.54046406623872      S 
   -1.26104136561270   -0.59738270235148    0.21887831432128      C 
   -8.58349570590935   -1.04716786258411    0.37426691390694      C 
   -9.52754399993529   -3.35482669338334    0.69217771526519      C 
    7.97640734611557   -1.06635130679977    0.15653549034514      H 
    6.17719527751387    3.51506193620334   -0.41908320532990      H 
   -5.99173229037479    3.59928476599510   -0.26825778582078      H 
   -9.82696914290532    0.56506682345452    0.17718194231621      H 
   -8.31544020710327   -4.97956704702039    0.89027066663290      H 
  -11.53052329328058   -3.68878813447154    0.76353019675872      H 
$end
           -------------------------------------------------
          |                Final Singlepoint                |
           -------------------------------------------------

          ...................................................
          :                      SETUP                      :
          :.................................................:
          :  # basis functions                  76          :
          :  # atomic orbitals                  73          :
          :  # shells                           35          :
          :  # electrons                        64          :
          :  max. iterations                   250          :
          :  Hamiltonian                  GFN2-xTB          :
          :  restarted?                      false          :
          :  GBSA solvation                  false          :
          :  PC potential                    false          :
          :  electronic temp.          300.0000000     K    :
          :  accuracy                    1.0000000          :
          :  -> integral cutoff          0.2500000E+02      :
          :  -> integral neglect         0.1000000E-07      :
          :  -> SCF convergence          0.1000000E-05 Eh   :
          :  -> wf. convergence          0.1000000E-03 e    :
          :  Broyden damping             0.4000000          :
          ...................................................

 iter      E             dE          RMSdq      gap      omega  full diag
   1    -34.6747369 -0.346747E+02  0.483E-05    2.41       0.0  T
   2    -34.6747369 -0.102318E-11  0.190E-05    2.41    1205.8  T
   3    -34.6747369  0.845546E-12  0.248E-05    2.41     924.5  T

   *** convergence criteria satisfied after 3 iterations ***

         #    Occupation            Energy/Eh            Energy/eV
      -------------------------------------------------------------
         1        2.0000           -0.7386775             -20.1004
       ...           ...                  ...                  ...
        26        2.0000           -0.4558257             -12.4036
        27        2.0000           -0.4424896             -12.0408
        28        2.0000           -0.4346137             -11.8264
        29        2.0000           -0.4170546             -11.3486
        30        2.0000           -0.4071911             -11.0802
        31        2.0000           -0.3785289             -10.3003
        32        2.0000           -0.3716266             -10.1125 (HOMO)
        33                         -0.2830361              -7.7018 (LUMO)
        34                         -0.2413533              -6.5676
        35                         -0.2299761              -6.2580
        36                         -0.2165016              -5.8913
        37                         -0.2023192              -5.5054
       ...                                ...                  ...
        73                          0.6982550              19.0005
      -------------------------------------------------------------
                  HL-Gap            0.0885905 Eh            2.4107 eV
             Fermi-level           -0.3273314 Eh           -8.9071 eV

 SCC (total)                   0 d,  0 h,  0 min,  0.031 sec
 SCC setup                      ...        0 min,  0.000 sec (  0.657%)
 Dispersion                     ...        0 min,  0.000 sec (  0.494%)
 integral evaluation            ...        0 min,  0.011 sec ( 34.456%)
 zeroth order Hamiltonian       ...        0 min,  0.000 sec (  0.541%)
 iterations                     ...        0 min,  0.004 sec ( 13.555%)
 molecular gradient             ...        0 min,  0.015 sec ( 49.047%)
 printout                       ...        0 min,  0.000 sec (  1.080%)

         :::::::::::::::::::::::::::::::::::::::::::::::::::::
         ::                     SUMMARY                     ::
         :::::::::::::::::::::::::::::::::::::::::::::::::::::
         :: total energy             -34.174336249885 Eh    ::
         :: gradient norm              0.000272823890 Eh/a0 ::
         :: HOMO-LUMO gap              2.410670109598 eV    ::
         ::.................................................::
         :: SCC energy               -34.674736938426 Eh    ::
         :: -> isotropic ES            0.001513928954 Eh    ::
         :: -> anisotropic ES          0.001224807494 Eh    ::
         :: -> anisotropic XC          0.015113920863 Eh    ::
         :: -> dispersion             -0.025324361150 Eh    ::
         :: repulsion energy           0.500518522336 Eh    ::
         :: add. restraining           0.000000000000 Eh    ::
         :::::::::::::::::::::::::::::::::::::::::::::::::::::

           -------------------------------------------------
          |                Property Printout                |
           -------------------------------------------------

    * Orbital Energies and Occupations

         #    Occupation            Energy/Eh            Energy/eV
      -------------------------------------------------------------
         1        2.0000           -0.7386775             -20.1004
       ...           ...                  ...                  ...
        20        2.0000           -0.4825148             -13.1299
        21        2.0000           -0.4712173             -12.8225
        22        2.0000           -0.4684059             -12.7460
        23        2.0000           -0.4662275             -12.6867
        24        2.0000           -0.4604459             -12.5294
        25        2.0000           -0.4575995             -12.4519
        26        2.0000           -0.4558257             -12.4036
        27        2.0000           -0.4424896             -12.0408
        28        2.0000           -0.4346137             -11.8264
        29        2.0000           -0.4170546             -11.3486
        30        2.0000           -0.4071911             -11.0802
        31        2.0000           -0.3785289             -10.3003
        32        2.0000           -0.3716266             -10.1125 (HOMO)
        33                         -0.2830361              -7.7018 (LUMO)
        34                         -0.2413533              -6.5676
        35                         -0.2299761              -6.2580
        36                         -0.2165016              -5.8913
        37                         -0.2023192              -5.5054
        38                         -0.1910475              -5.1987
        39                         -0.1799286              -4.8961
        40                         -0.1582550              -4.3063
        41                         -0.1433719              -3.9013
        42                         -0.1362804              -3.7084
        43                         -0.1186166              -3.2277
       ...                                ...                  ...
        73                          0.6982550              19.0005
      -------------------------------------------------------------
                  HL-Gap            0.0885905 Eh            2.4107 eV
             Fermi-level           -0.3273314 Eh           -8.9071 eV

     #   Z        covCN         q      C6AA      α(0)
     1   6 C      2.955    -0.021    28.523     8.760
     2  16 S      2.254    -0.023   142.007    20.057
     3   6 C      3.147     0.007    27.598     8.594
     4   6 C      3.208     0.016    27.045     8.468
     5   6 C      3.070    -0.049    29.141     8.852
     6  16 S      2.204    -0.062   143.632    20.171
     7   6 C      3.194     0.016    27.147     8.496
     8   6 C      3.067    -0.057    29.346     8.883
     9   6 C      3.001     0.026    27.408     8.588
    10  16 S      2.272    -0.035   142.504    20.092
    11   6 C      3.145     0.008    27.592     8.594
    12   6 C      2.916    -0.030    28.745     8.792
    13   6 C      2.841    -0.085    30.107     8.992
    14   1 H      0.926     0.051     2.302     2.373
    15   1 H      0.926     0.049     2.329     2.387
    16   1 H      0.926     0.047     2.353     2.399
    17   1 H      0.925     0.045     2.389     2.417
    18   1 H      0.926     0.051     2.305     2.374
    19   1 H      0.926     0.046     2.375     2.410

 Mol. C6AA /au·bohr⁶  :       9627.696122
 Mol. C8AA /au·bohr⁸  :     322975.760635
 Mol. α(0) /au        :        161.695698


Wiberg/Mayer (AO) data.
largest (>0.10) Wiberg bond orders for each atom
          total WBO             WBO to atom ...
     1  C   3.926        C    5 1.625    S    2 1.169    H   14 0.970
     2  S   2.588        C    1 1.169    C    3 1.125
     3  C   3.948        C    4 1.375    C   11 1.242    S    2 1.125
     4  C   3.935        C    3 1.375    C    5 1.260    S    6 1.097
     5  C   3.986        C    1 1.625    C    4 1.260    H   15 0.963
     6  S   2.506        C    4 1.097    C    7 1.092
     7  C   3.947        C   11 1.360    C    8 1.288    S    6 1.092
     8  C   3.985        C    9 1.517    C    7 1.288    H   16 0.962
     9  C   3.936        C    8 1.517    C   12 1.140    S   10 1.108
    10  S   2.565        C   11 1.128    C    9 1.108
    11  C   3.951        C    7 1.360    C    3 1.242    S   10 1.128
    12  C   3.989        C   13 1.860    C    9 1.140    H   17 0.958
    13  C   3.963        C   12 1.860    H   19 0.978    H   18 0.971
    14  H   0.997        C    1 0.970
    15  H   0.997        C    5 0.963
    16  H   0.997        C    8 0.962
    17  H   0.998        C   12 0.958
    18  H   0.997        C   13 0.971
    19  H   0.997        C   13 0.978

molecular dipole:
                 x           y           z       tot (Debye)
 q only:       -0.109      -0.038       0.006
   full:       -0.060       0.242      -0.031       0.637
molecular quadrupole (traceless):
                xx          xy          yy          xz          yz          zz
 q only:        7.627       0.799      -3.510      -0.282      -0.101      -4.117
  q+dip:       12.225       0.103      -6.178      -0.268       0.058      -6.047
   full:       11.702       0.148      -7.479      -0.242       0.475      -4.224

           -------------------------------------------------
          |                Geometry Summary                 |
           -------------------------------------------------

      molecular mass/u    :      222.3374000
   center of mass at/Å    :       -0.5381009      -0.1000822       0.0857982
  moments of inertia/u·Å² :        0.3878788E+03   0.1335449E+04   0.1723328E+04
rotational constants/cm⁻¹ :        0.4346108E-01   0.1262319E-01   0.9782022E-02

 * 20 selected distances

     #   Z        #   Z                                     value/Å
     1   6 C      2  16 S                                 1.7319096
     2  16 S      3   6 C                                 1.7255193
     3   6 C      4   6 C                                 1.3927426
     1   6 C      5   6 C                                 1.3578997
     4   6 C      5   6 C                                 1.4082428
     4   6 C      6  16 S                                 1.7404946
     6  16 S      7   6 C                                 1.7423603
     7   6 C      8   6 C                                 1.4014224
     8   6 C      9   6 C                                 1.3719099
     9   6 C     10  16 S                                 1.7556197 (max)
     3   6 C     11   6 C                                 1.4038385
     7   6 C     11   6 C                                 1.3938323
    10  16 S     11   6 C                                 1.7233312
    12   6 C     13   6 C                                 1.3300767
     1   6 C     14   1 H                                 1.0717287 (min)
     5   6 C     15   1 H                                 1.0740773
     8   6 C     16   1 H                                 1.0745850
    12   6 C     17   1 H                                 1.0824708
    13   6 C     18   1 H                                 1.0777845
    13   6 C     19   1 H                                 1.0752261

 * 3 distinct bonds (by element types)

   Z      Z             #   av. dist./Å        max./Å        min./Å
   1 H    6 C           6     1.0759787     1.0824708     1.0717287
   6 C    6 C           8     1.3824956     1.4082428     1.3300767
   6 C   16 S           6     1.7365391     1.7556197     1.7233312


optimized geometry written to: xtbopt.xyz


           -------------------------------------------------
          | TOTAL ENERGY              -34.174336249885 Eh   |
          | GRADIENT NORM               0.000272823890 Eh/α |
          | HOMO-LUMO GAP               2.410670109598 eV   |
           -------------------------------------------------

------------------------------------------------------------------------
 * finished run on 2021/05/19 at 10:59:45.212     
------------------------------------------------------------------------
 total:
 * wall-time:     0 d,  0 h,  0 min,  0.653 sec
 *  cpu-time:     0 d,  0 h,  0 min,  0.651 sec
 * ratio c/w:     0.997 speedup
 SCF:
 * wall-time:     0 d,  0 h,  0 min,  0.044 sec
 *  cpu-time:     0 d,  0 h,  0 min,  0.044 sec
 * ratio c/w:     0.998 speedup
 ANC optimizer:
 * wall-time:     0 d,  0 h,  0 min,  0.586 sec
 *  cpu-time:     0 d,  0 h,  0 min,  0.584 sec
 * ratio c/w:     0.998 speedup

