      -----------------------------------------------------------      
     |                   =====================                   |     
     |                           x T B                           |     
     |                   =====================                   |     
     |                         S. Grimme                         |     
     |          Mulliken Center for Theoretical Chemistry        |     
     |                    University of Bonn                     |     
     |                Version 6.2 RC2 (SAW190805)                |     
      -----------------------------------------------------------      

   This program is distributed in the hope that it will be useful,
   but WITHOUT ANY WARRANTY; without even the implied warranty of
   MERCHANTABILITY or FITNESS FOR A PARTICULAR PURPOSE.
   
   FOR NON-COMMERCIAL, ACADEMIA USE ONLY.
   
   Cite this work as:
   * S. Grimme, C. Bannwarth, P. Shushkov, J. Chem. Theory Comput., 2017,
     13, 1989-2009. DOI: 10.1021/acs.jctc.7b00118
   * C. Bannwarth, S. Ehlert and S. Grimme., J. Chem. Theory Comput., 2019,
     15, 1652-1671. DOI: 10.1021/acs.jctc.8b01176
   * P. Pracht, E. Caldeweyher, S. Ehlert, S. Grimme, ChemRxiv, 2019, preprint.
     DOI: 10.26434/chemrxiv.8326202.v1
   
   for DFT-D4:
   * E. Caldeweyher, C. Bannwarth and S. Grimme, J. Chem. Phys., 2017,
     147, 034112. DOI: 10.1063/1.4993215
   * E. Caldeweyher, S. Ehlert, A. Hansen, H. Neugebauer, S. Spicher,
     C. Bannwarth and S. Grimme, J. Chem. Phys., 2019, 150, 154122.
     DOI: 10.1063/1.5090222
   
   for sTDA-xTB:
   * S. Grimme and C. Bannwarth, J. Chem. Phys., 2016, 145, 054103.
     DOI: 10.1063/1.4959605
   
   in the mass-spec context:
   * V. Asgeirsson, C. Bauer and S. Grimme, Chem. Sci., 2017, 8, 4879.
     DOI: 10.1039/c7sc00601b
   
   for metadynamics refer to:
   * S. Grimme, J. Chem. Theory Comput., 2019, 155, 2847-2862
     DOI: 10.1021/acs.jctc.9b00143
   
   with help from (in alphabetical order)
   C. Bannwarth, F. Bohle, G. Brandenburg, E. Caldeweyher, M. Checinski,
   S. Dohm, S. Ehlert, S. Ehrlich, F. März, H. Neugebauer, J. Pisarek,
   P. Pracht, P. Shushkov, and S. Spicher.
   
 * started run on 2021/05/19 at 10:58:33.665     

           -------------------------------------------------
          |                Calculation Setup                |
           -------------------------------------------------

          program call               : /ihome/ghutchison/geoffh/xtb/xtb 56.xyz -opt
          hostname                   : smp-n58
          coordinate file            : 56.xyz
          omp threads                :                     1
          number of atoms            :                    29
          number of electrons        :                    90
          charge                     :                     0
          spin                       :                   0.0
          first test random number   :      0.56833066526246


########################################################################
# WARNING! Please study the warnings concerning your input carefully
#  - the use of '-opt' is discouraged, please use '--opt' next time
########################################################################

           ------------------------------------------------- 
          |                 G F N 2 - x T B                 |
          | Geometry, Frequencies, Noncovalent interactions |
          |            JCTC 2019 parametrisation            |
           ------------------------------------------------- 
             KAB for C  - Si     :                1.0500
             KAB for H  - Pd     :                0.9500
             k(s)              :                1.8500
             k(p)              :                2.2300
             k(d)              :                2.2300
             k(f)              :                2.0000
             kEN (H0ij)        :               -2.0000
             D4 a1             :                0.5200
             D4 a2             :                5.0000
             D4 s6             :                1.0000
             D4 s8             :                2.7000
             D4 s9             :                5.0000
             alphaj            :                2.0000

  Z AO/shell   Hii/eV     exponent
  1     Wed Apr 25 08:07:45 CEST 2018   EN: 2.200 GM2: 0.406  GM3: 0.0800  RAES: 1.40
     1s    -10.707211    1.230000
  6     Wed Apr 25 08:07:45 CEST 2018   EN: 2.550 GM2: 0.538  GM3: 0.1500  RAES: 3.00
     2s    -13.970922    2.096432
     2p    -10.063292    1.800000
  7     Wed Apr 25 08:07:45 CEST 2018   EN: 3.040 GM2: 0.461  GM3:-0.0640  RAES: 1.90
     2s    -16.686243    2.339881
     2p    -12.523956    2.014332
  8     Wed Apr 25 08:07:45 CEST 2018   EN: 3.440 GM2: 0.452  GM3:-0.0517  RAES: 1.80
     2s    -20.229985    2.439742
     2p    -15.503117    2.137023
 16     Tue Apr 24 11:44:34 CEST 2018   EN: 2.580 GM2: 0.340  GM3:-0.0502  RAES: 3.10
     3s    -20.029654    1.981333
     3p    -11.377694    2.025643
     3d     -0.420282    1.702555

           ------------------------------------------------- 
          |        Self-Consistent Charge Iterations        |
           ------------------------------------------------- 

          ...................................................
          :                      SETUP                      :
          :.................................................:
          :  # basis functions                  89          :
          :  # atomic orbitals                  88          :
          :  # shells                           48          :
          :  # electrons                        90          :
          :  max. iterations                   250          :
          :  Hamiltonian                  GFN2-xTB          :
          :  restarted?                      false          :
          :  GBSA solvation                  false          :
          :  PC potential                    false          :
          :  electronic temp.          300.0000000     K    :
          :  accuracy                    1.0000000          :
          :  -> integral cutoff          0.2500000E+02      :
          :  -> integral neglect         0.1000000E-07      :
          :  -> SCF convergence          0.1000000E-05 Eh   :
          :  -> wf. convergence          0.1000000E-03 e    :
          :  Broyden damping             0.4000000          :
          ...................................................

 iter      E             dE          RMSdq      gap      omega  full diag
   1    -50.4201643 -0.504202E+02  0.484E+00    2.44       0.0  T
   2    -50.5261495 -0.105985E+00  0.292E+00    2.19       1.0  T
   3    -50.5282058 -0.205627E-02  0.170E+00    2.41       1.0  T
   4    -50.5438000 -0.155942E-01  0.771E-01    2.35       1.0  T
   5    -50.5584640 -0.146640E-01  0.169E-01    2.36       1.0  T
   6    -50.5588137 -0.349650E-03  0.846E-02    2.37       1.0  T
   7    -50.5588887 -0.750272E-04  0.360E-02    2.37       1.0  T
   8    -50.5589062 -0.175254E-04  0.143E-02    2.36       1.3  T
   9    -50.5589074 -0.120016E-05  0.675E-03    2.36       2.7  T
  10    -50.5589075 -0.107445E-06  0.250E-03    2.36       7.4  T
  11    -50.5589076 -0.941536E-07  0.100E-03    2.36      18.5  T
  12    -50.5589076 -0.635485E-08  0.514E-04    2.36      36.2  T
  13    -50.5589076 -0.139013E-08  0.960E-05    2.36     193.5  T

   *** convergence criteria satisfied after 13 iterations ***

         #    Occupation            Energy/Eh            Energy/eV
      -------------------------------------------------------------
         1        2.0000           -0.7449448             -20.2710
       ...           ...                  ...                  ...
        39        2.0000           -0.4371510             -11.8955
        40        2.0000           -0.4160193             -11.3205
        41        2.0000           -0.4071742             -11.0798
        42        2.0000           -0.4009650             -10.9108
        43        2.0000           -0.3918746             -10.6635
        44        2.0000           -0.3903210             -10.6212
        45        2.0000           -0.3875821             -10.5466 (HOMO)
        46                         -0.3006790              -8.1819 (LUMO)
        47                         -0.2847875              -7.7495
        48                         -0.2388118              -6.4984
        49                         -0.2143509              -5.8328
        50                         -0.2007853              -5.4636
       ...                                ...                  ...
        88                          0.7310130              19.8919
      -------------------------------------------------------------
                  HL-Gap            0.0869031 Eh            2.3648 eV
             Fermi-level           -0.3441306 Eh           -9.3643 eV

 SCC (total)                   0 d,  0 h,  0 min,  0.054 sec
 SCC setup                      ...        0 min,  0.000 sec (  0.589%)
 Dispersion                     ...        0 min,  0.000 sec (  0.860%)
 integral evaluation            ...        0 min,  0.014 sec ( 25.976%)
 zeroth order Hamiltonian       ...        0 min,  0.000 sec (  0.394%)
 iterations                     ...        0 min,  0.019 sec ( 35.381%)
 molecular gradient             ...        0 min,  0.019 sec ( 35.861%)
 printout                       ...        0 min,  0.000 sec (  0.840%)

         :::::::::::::::::::::::::::::::::::::::::::::::::::::
         ::                     SUMMARY                     ::
         :::::::::::::::::::::::::::::::::::::::::::::::::::::
         :: total energy             -49.870705156977 Eh    ::
         :: gradient norm              0.052960020554 Eh/a0 ::
         :: HOMO-LUMO gap              2.364753299585 eV    ::
         ::.................................................::
         :: SCC energy               -50.558907627961 Eh    ::
         :: -> isotropic ES            0.061505525073 Eh    ::
         :: -> anisotropic ES          0.002182998004 Eh    ::
         :: -> anisotropic XC          0.019167006783 Eh    ::
         :: -> dispersion             -0.032938261314 Eh    ::
         :: repulsion energy           0.688305953971 Eh    ::
         :: add. restraining           0.000000000000 Eh    ::
         :::::::::::::::::::::::::::::::::::::::::::::::::::::

      ----------------------------------------------------------- 
     |                   =====================                   |
     |                        A N C O P T                        |
     |                   =====================                   |
     |               Approximate Normal Coordinate               |
     |                Rational Function Optimizer                |
      ----------------------------------------------------------- 

          ...................................................
          :                      SETUP                      :
          :.................................................:
          :   optimization level            normal          :
          :   max. optcycles                   200          :
          :   ANC micro-cycles                  20          :
          :   degrees of freedom                81          :
          :.................................................:
          :   RF solver                   davidson          :
          :   input Hessian                  false          :
          :   write xtbopt.log                true          :
          :   linear?                        false          :
          :   energy convergence         0.5000000E-05 Eh   :
          :   grad. convergence          0.1000000E-02 Eh/α :
          :   maximium RF displ.         2.0000000          :
          :   Hlow (freq-cutoff)         0.5000000E-02      :
          :   Hmax (freq-cutoff)         5.0000000          :
          :   S6 in model hess.         20.0000000          :
          ...................................................

generating ANC from model Hessian ...
Using Lindh-Hessian (1995)
 Shifting diagonal of input Hessian by   4.311799715374629E-003
 Lowest  eigenvalues of input Hessian
   -0.000000   -0.000000   -0.000000   -0.000000   -0.000000   -0.000000
    0.005000    0.005990    0.007139    0.007417    0.009038    0.010220
    0.011878    0.012516    0.016243    0.017726    0.019835    0.022865
 Highest eigenvalues
    1.898379    1.964149    2.002735    2.011752    2.185132    2.262202
 

........................................................................
.............................. CYCLE    1 ..............................
........................................................................
   1    -50.5589076 -0.505589E+02  0.526E-05    2.36       0.0  T
   2    -50.5589076 -0.120224E-10  0.307E-05    2.36     604.1  T
   3    -50.5589076 -0.392220E-11  0.208E-05    2.36     892.6  T
     SCC iter.                  ...        0 min,  0.006 sec
     gradient                   ...        0 min,  0.020 sec
 * total energy  :   -49.8707052 Eh     change       -0.8982148E-08 Eh
   gradient norm :     0.0529598 Eh/α   predicted     0.0000000E+00 (-100.00%)
   displ. norm   :     0.2450428 α      lambda       -0.5102574E-02
   maximum displ.:     0.1046964 α      in ANC's #14, #5, #4, ...

........................................................................
.............................. CYCLE    2 ..............................
........................................................................
   1    -50.5877935 -0.505878E+02  0.255E-01    2.39       0.0  T
   2    -50.5878895 -0.959626E-04  0.124E-01    2.40       1.0  T
   3    -50.5878387  0.508030E-04  0.610E-02    2.39       1.0  T
   4    -50.5879170 -0.783385E-04  0.240E-02    2.40       1.0  T
   5    -50.5879234 -0.636736E-05  0.108E-02    2.39       1.7  T
   6    -50.5879239 -0.566653E-06  0.473E-03    2.39       3.9  T
   7    -50.5879244 -0.464583E-06  0.122E-03    2.39      15.2  T
     SCC iter.                  ...        0 min,  0.011 sec
     gradient                   ...        0 min,  0.018 sec
 * total energy  :   -49.8740955 Eh     change       -0.3390345E-02 Eh
   gradient norm :     0.0200638 Eh/α   predicted    -0.2704489E-02 ( -20.23%)
   displ. norm   :     0.2508149 α      lambda       -0.1363087E-02
   maximum displ.:     0.1502055 α      in ANC's #4, #5, #6, ...

........................................................................
.............................. CYCLE    3 ..............................
........................................................................
   1    -50.5988238 -0.505988E+02  0.154E-01    2.40       0.0  T
   2    -50.5988624 -0.385759E-04  0.865E-02    2.40       1.0  T
   3    -50.5988421  0.202524E-04  0.429E-02    2.40       1.0  T
   4    -50.5988716 -0.295022E-04  0.151E-02    2.40       1.2  T
   5    -50.5988744 -0.278320E-05  0.516E-03    2.40       3.6  T
   6    -50.5988747 -0.288855E-06  0.238E-03    2.40       7.8  T
     SCC iter.                  ...        0 min,  0.009 sec
     gradient                   ...        0 min,  0.018 sec
 * total energy  :   -49.8749650 Eh     change       -0.8694522E-03 Eh
   gradient norm :     0.0059721 Eh/α   predicted    -0.7244269E-03 ( -16.68%)
   displ. norm   :     0.2351993 α      lambda       -0.4926711E-03
   maximum displ.:     0.1756479 α      in ANC's #4, #5, #6, ...

........................................................................
.............................. CYCLE    4 ..............................
........................................................................
   1    -50.5989953 -0.505990E+02  0.124E-01    2.40       0.0  T
   2    -50.5990041 -0.875582E-05  0.720E-02    2.40       1.0  T
   3    -50.5989810  0.230450E-04  0.338E-02    2.40       1.0  T
   4    -50.5990078 -0.267858E-04  0.760E-03    2.40       2.4  T
   5    -50.5990085 -0.706237E-06  0.327E-03    2.40       5.7  T
   6    -50.5990087 -0.167980E-06  0.123E-03    2.40      15.1  T
   7    -50.5990087 -0.173298E-07  0.391E-04    2.40      47.5  T
     SCC iter.                  ...        0 min,  0.011 sec
     gradient                   ...        0 min,  0.019 sec
 * total energy  :   -49.8753317 Eh     change       -0.3667032E-03 Eh
   gradient norm :     0.0080133 Eh/α   predicted    -0.2599839E-03 ( -29.10%)
   displ. norm   :     0.2563952 α      lambda       -0.4274790E-03
   maximum displ.:     0.1905293 α      in ANC's #4, #5, #6, ...

........................................................................
.............................. CYCLE    5 ..............................
........................................................................
   1    -50.5964586 -0.505965E+02  0.138E-01    2.39       0.0  T
   2    -50.5964614 -0.279983E-05  0.818E-02    2.39       1.0  T
   3    -50.5964301  0.312773E-04  0.358E-02    2.39       1.0  T
   4    -50.5964649 -0.347822E-04  0.398E-03    2.39       4.7  T
   5    -50.5964650 -0.655887E-07  0.224E-03    2.39       8.3  T
   6    -50.5964651 -0.814150E-07  0.882E-04    2.39      21.1  T
     SCC iter.                  ...        0 min,  0.009 sec
     gradient                   ...        0 min,  0.018 sec
 * total energy  :   -49.8756509 Eh     change       -0.3192614E-03 Eh
   gradient norm :     0.0079491 Eh/α   predicted    -0.2277904E-03 ( -28.65%)
   displ. norm   :     0.2808036 α      lambda       -0.3934529E-03
   maximum displ.:     0.2161348 α      in ANC's #4, #5, #2, ...

........................................................................
.............................. CYCLE    6 ..............................
........................................................................
   1    -50.5941841 -0.505942E+02  0.144E-01    2.38       0.0  T
   2    -50.5941865 -0.248333E-05  0.831E-02    2.38       1.0  T
   3    -50.5941762  0.103342E-04  0.221E-02    2.38       1.0  T
   4    -50.5941880 -0.118368E-04  0.546E-03    2.38       3.4  T
   5    -50.5941882 -0.123352E-06  0.175E-03    2.38      10.6  T
   6    -50.5941882 -0.554204E-07  0.755E-04    2.38      24.6  T
     SCC iter.                  ...        0 min,  0.009 sec
     gradient                   ...        0 min,  0.017 sec
 * total energy  :   -49.8759311 Eh     change       -0.2801226E-03 Eh
   gradient norm :     0.0076307 Eh/α   predicted    -0.2122634E-03 ( -24.22%)
   displ. norm   :     0.3322554 α      lambda       -0.3992897E-03
   maximum displ.:     0.2565642 α      in ANC's #4, #5, #2, ...

........................................................................
.............................. CYCLE    7 ..............................
........................................................................
   1    -50.5928142 -0.505928E+02  0.168E-01    2.37       0.0  T
   2    -50.5928185 -0.422943E-05  0.974E-02    2.37       1.0  T
   3    -50.5928119  0.651186E-05  0.193E-02    2.37       1.0  T
   4    -50.5928197 -0.771648E-05  0.667E-03    2.37       2.8  T
   5    -50.5928201 -0.433040E-06  0.239E-03    2.37       7.8  T
   6    -50.5928202 -0.861105E-07  0.870E-04    2.37      21.3  T
     SCC iter.                  ...        0 min,  0.009 sec
     gradient                   ...        0 min,  0.018 sec
 * total energy  :   -49.8761774 Eh     change       -0.2463546E-03 Eh
   gradient norm :     0.0076267 Eh/α   predicted    -0.2216860E-03 ( -10.01%)
   displ. norm   :     0.2736946 α      lambda       -0.3083110E-03
   maximum displ.:     0.2119039 α      in ANC's #4, #2, #6, ...

........................................................................
.............................. CYCLE    8 ..............................
........................................................................
   1    -50.5942368 -0.505942E+02  0.132E-01    2.37       0.0  T
   2    -50.5942393 -0.248501E-05  0.762E-02    2.37       1.0  T
   3    -50.5942349  0.443021E-05  0.149E-02    2.37       1.2  T
   4    -50.5942400 -0.510971E-05  0.538E-03    2.37       3.5  T
   5    -50.5942403 -0.294596E-06  0.243E-03    2.37       7.7  T
   6    -50.5942404 -0.901541E-07  0.780E-04    2.37      23.8  T
     SCC iter.                  ...        0 min,  0.010 sec
     gradient                   ...        0 min,  0.019 sec
 * total energy  :   -49.8763818 Eh     change       -0.2044243E-03 Eh
   gradient norm :     0.0070126 Eh/α   predicted    -0.1657047E-03 ( -18.94%)
   displ. norm   :     0.1802830 α      lambda       -0.2137176E-03
   maximum displ.:     0.1360677 α      in ANC's #4, #2, #29, ...

........................................................................
.............................. CYCLE    9 ..............................
........................................................................
   1    -50.5992822 -0.505993E+02  0.893E-02    2.37       0.0  T
   2    -50.5992839 -0.179038E-05  0.511E-02    2.37       1.0  T
   3    -50.5992670  0.169371E-04  0.288E-02    2.37       1.0  T
   4    -50.5992863 -0.192848E-04  0.429E-03    2.37       4.3  T
   5    -50.5992863 -0.381031E-07  0.190E-03    2.37       9.8  T
   6    -50.5992864 -0.534985E-07  0.619E-04    2.37      30.0  T
     SCC iter.                  ...        0 min,  0.010 sec
     gradient                   ...        0 min,  0.019 sec
 * total energy  :   -49.8764835 Eh     change       -0.1016681E-03 Eh
   gradient norm :     0.0046560 Eh/α   predicted    -0.1103326E-03 (   8.52%)
   displ. norm   :     0.3436316 α      lambda       -0.1986147E-03
   maximum displ.:     0.2609254 α      in ANC's #4, #6, #5, ...

........................................................................
.............................. CYCLE   10 ..............................
........................................................................
   1    -50.5966707 -0.505967E+02  0.162E-01    2.37       0.0  T
   2    -50.5966730 -0.226825E-05  0.940E-02    2.37       1.0  T
   3    -50.5966725  0.543725E-06  0.935E-03    2.37       2.0  T
   4    -50.5966735 -0.105057E-05  0.482E-03    2.37       3.9  T
   5    -50.5966738 -0.313068E-06  0.154E-03    2.37      12.0  T
   6    -50.5966739 -0.543752E-07  0.520E-04    2.37      35.7  T
     SCC iter.                  ...        0 min,  0.009 sec
     gradient                   ...        0 min,  0.019 sec
 * total energy  :   -49.8764628 Eh     change        0.2068335E-04 Eh
   gradient norm :     0.0096753 Eh/α   predicted    -0.1110401E-03 (-636.86%)
   displ. norm   :     0.1747335 α      lambda       -0.2223205E-03
   maximum displ.:     0.1337795 α      in ANC's #4, #5, #6, ...

........................................................................
.............................. CYCLE   11 ..............................
........................................................................
   1    -50.5987342 -0.505987E+02  0.788E-02    2.37       0.0  T
   2    -50.5987351 -0.879010E-06  0.460E-02    2.37       1.0  T
   3    -50.5987339  0.113579E-05  0.777E-03    2.37       2.4  T
   4    -50.5987354 -0.145617E-05  0.205E-03    2.37       9.0  T
   5    -50.5987354 -0.199598E-07  0.867E-04    2.37      21.4  T
     SCC iter.                  ...        0 min,  0.008 sec
     gradient                   ...        0 min,  0.018 sec
 * total energy  :   -49.8765631 Eh     change       -0.1002382E-03 Eh
   gradient norm :     0.0022286 Eh/α   predicted    -0.1145550E-03 (  14.28%)
   displ. norm   :     0.0486216 α      lambda       -0.2252654E-04
   maximum displ.:     0.0299755 α      in ANC's #4, #1, #6, ...

........................................................................
.............................. CYCLE   12 ..............................
........................................................................
   1    -50.5984952 -0.505985E+02  0.242E-02    2.37       0.0  T
   2    -50.5984953 -0.880903E-07  0.141E-02    2.37       1.3  T
   3    -50.5984952  0.986621E-07  0.244E-03    2.37       7.6  T
   4    -50.5984953 -0.130002E-06  0.665E-04    2.37      27.9  T
   5    -50.5984953 -0.987669E-09  0.370E-04    2.37      50.2  T
     SCC iter.                  ...        0 min,  0.007 sec
     gradient                   ...        0 min,  0.018 sec
 * total energy  :   -49.8765819 Eh     change       -0.1889373E-04 Eh
   gradient norm :     0.0015051 Eh/α   predicted    -0.1129121E-04 ( -40.24%)
   displ. norm   :     0.3015641 α      lambda       -0.7032239E-04
   maximum displ.:     0.1801219 α      in ANC's #4, #1, #6, ...

........................................................................
.............................. CYCLE   13 ..............................
........................................................................
   1    -50.5964172 -0.505964E+02  0.149E-01    2.37       0.0  T
   2    -50.5964202 -0.299715E-05  0.868E-02    2.37       1.0  T
   3    -50.5964165  0.375758E-05  0.150E-02    2.37       1.2  T
   4    -50.5964213 -0.480866E-05  0.538E-03    2.37       3.5  T
   5    -50.5964215 -0.167874E-06  0.256E-03    2.37       7.3  T
   6    -50.5964216 -0.110170E-06  0.894E-04    2.37      20.8  T
   7    -50.5964216 -0.565861E-08  0.484E-04    2.37      38.3  T
     SCC iter.                  ...        0 min,  0.010 sec
     gradient                   ...        0 min,  0.020 sec
 * total energy  :   -49.8766142 Eh     change       -0.3221376E-04 Eh
   gradient norm :     0.0037714 Eh/α   predicted    -0.3658307E-04 (  13.56%)
   displ. norm   :     0.0561200 α      lambda       -0.3418466E-04
   maximum displ.:     0.0419954 α      in ANC's #4, #2, #5, ...

........................................................................
.............................. CYCLE   14 ..............................
........................................................................
   1    -50.5977056 -0.505977E+02  0.281E-02    2.37       0.0  T
   2    -50.5977058 -0.191645E-06  0.159E-02    2.37       1.2  T
   3    -50.5977054  0.387069E-06  0.493E-03    2.37       3.8  T
   4    -50.5977059 -0.457940E-06  0.160E-03    2.37      11.6  T
   5    -50.5977059 -0.889844E-08  0.702E-04    2.37      26.5  T
   6    -50.5977059 -0.975852E-08  0.201E-04    2.37      92.6  T
     SCC iter.                  ...        0 min,  0.010 sec
     gradient                   ...        0 min,  0.020 sec
 * total energy  :   -49.8766360 Eh     change       -0.2179862E-04 Eh
   gradient norm :     0.0030466 Eh/α   predicted    -0.1714698E-04 ( -21.34%)
   displ. norm   :     0.0640951 α      lambda       -0.3633791E-04
   maximum displ.:     0.0466239 α      in ANC's #1, #2, #4, ...

........................................................................
.............................. CYCLE   15 ..............................
........................................................................
   1    -50.5986923 -0.505987E+02  0.299E-02    2.37       0.0  T
   2    -50.5986928 -0.547506E-06  0.169E-02    2.37       1.1  T
   3    -50.5986910  0.185992E-05  0.102E-02    2.37       1.8  T
   4    -50.5986932 -0.222899E-05  0.210E-03    2.37       8.9  T
   5    -50.5986932 -0.192741E-07  0.104E-03    2.37      17.9  T
   6    -50.5986932 -0.119669E-07  0.359E-04    2.37      51.7  T
   7    -50.5986932 -0.120462E-08  0.159E-04    2.37     117.1  T
     SCC iter.                  ...        0 min,  0.010 sec
     gradient                   ...        0 min,  0.020 sec
 * total energy  :   -49.8766482 Eh     change       -0.1221861E-04 Eh
   gradient norm :     0.0037030 Eh/α   predicted    -0.1824715E-04 (  49.34%)
   displ. norm   :     0.0778776 α      lambda       -0.3463548E-04
   maximum displ.:     0.0653818 α      in ANC's #1, #2, #6, ...

........................................................................
.............................. CYCLE   16 ..............................
........................................................................
   1    -50.5991238 -0.505991E+02  0.304E-02    2.37       0.0  T
   2    -50.5991241 -0.328073E-06  0.173E-02    2.37       1.1  T
   3    -50.5991239  0.181459E-06  0.380E-03    2.37       4.9  T
   4    -50.5991242 -0.257615E-06  0.157E-03    2.37      11.9  T
   5    -50.5991242 -0.215139E-07  0.704E-04    2.37      26.4  T
   6    -50.5991242 -0.756526E-08  0.265E-04    2.37      70.2  T
     SCC iter.                  ...        0 min,  0.009 sec
     gradient                   ...        0 min,  0.020 sec
 * total energy  :   -49.8766718 Eh     change       -0.2362622E-04 Eh
   gradient norm :     0.0018430 Eh/α   predicted    -0.1742578E-04 ( -26.24%)
   displ. norm   :     0.2220849 α      lambda       -0.3281069E-04
   maximum displ.:     0.1933010 α      in ANC's #1, #2, #6, ...

........................................................................
.............................. CYCLE   17 ..............................
........................................................................
   1    -50.5981734 -0.505982E+02  0.948E-02    2.37       0.0  T
   2    -50.5981751 -0.171426E-05  0.537E-02    2.37       1.0  T
   3    -50.5981747  0.408633E-06  0.858E-03    2.37       2.2  T
   4    -50.5981753 -0.682243E-06  0.512E-03    2.37       3.6  T
   5    -50.5981758 -0.406168E-06  0.714E-04    2.37      26.0  T
   6    -50.5981758 -0.329639E-08  0.407E-04    2.37      45.6  T
     SCC iter.                  ...        0 min,  0.009 sec
     gradient                   ...        0 min,  0.018 sec
 * total energy  :   -49.8767023 Eh     change       -0.3047889E-04 Eh
   gradient norm :     0.0033727 Eh/α   predicted    -0.1676696E-04 ( -44.99%)
   displ. norm   :     0.1082946 α      lambda       -0.2134978E-04
   maximum displ.:     0.0968330 α      in ANC's #1, #2, #7, ...

........................................................................
.............................. CYCLE   18 ..............................
........................................................................
   1    -50.5979193 -0.505979E+02  0.503E-02    2.37       0.0  T
   2    -50.5979200 -0.643845E-06  0.278E-02    2.37       1.0  T
   3    -50.5979200 -0.825326E-07  0.436E-03    2.37       4.3  T
   4    -50.5979201 -0.227726E-07  0.265E-03    2.37       7.0  T
   5    -50.5979202 -0.112381E-06  0.442E-04    2.37      42.0  T
   6    -50.5979202 -0.178648E-08  0.268E-04    2.37      69.3  T
     SCC iter.                  ...        0 min,  0.009 sec
     gradient                   ...        0 min,  0.018 sec
 * total energy  :   -49.8767192 Eh     change       -0.1691712E-04 Eh
   gradient norm :     0.0021793 Eh/α   predicted    -0.1080224E-04 ( -36.15%)
   displ. norm   :     0.2036900 α      lambda       -0.3062351E-04
   maximum displ.:     0.1817460 α      in ANC's #1, #2, #3, ...

........................................................................
.............................. CYCLE   19 ..............................
........................................................................
   1    -50.5974144 -0.505974E+02  0.102E-01    2.37       0.0  T
   2    -50.5974171 -0.271918E-05  0.556E-02    2.37       1.0  T
   3    -50.5974178 -0.640584E-06  0.853E-03    2.37       2.2  T
   4    -50.5974175  0.231525E-06  0.478E-03    2.37       3.9  T
   5    -50.5974180 -0.468815E-06  0.751E-04    2.37      24.7  T
   6    -50.5974180 -0.244122E-08  0.473E-04    2.37      39.2  T
     SCC iter.                  ...        0 min,  0.008 sec
     gradient                   ...        0 min,  0.019 sec
 * total energy  :   -49.8767378 Eh     change       -0.1855355E-04 Eh
   gradient norm :     0.0017491 Eh/α   predicted    -0.1595296E-04 ( -14.02%)
   displ. norm   :     0.1261061 α      lambda       -0.1191915E-04
   maximum displ.:     0.1025378 α      in ANC's #1, #2, #6, ...

........................................................................
.............................. CYCLE   20 ..............................
........................................................................
   1    -50.5979575 -0.505980E+02  0.751E-02    2.37       0.0  T
   2    -50.5979592 -0.166588E-05  0.404E-02    2.37       1.0  T
   3    -50.5979596 -0.369159E-06  0.705E-03    2.37       2.6  T
   4    -50.5979593  0.309402E-06  0.469E-03    2.37       4.0  T
   5    -50.5979598 -0.475304E-06  0.697E-04    2.37      26.6  T
   6    -50.5979598 -0.331677E-08  0.420E-04    2.37      44.2  T
     SCC iter.                  ...        0 min,  0.009 sec
     gradient                   ...        0 min,  0.018 sec
 * total energy  :   -49.8767489 Eh     change       -0.1116445E-04 Eh
   gradient norm :     0.0013783 Eh/α   predicted    -0.6002180E-05 ( -46.24%)
   displ. norm   :     0.0987343 α      lambda       -0.9956014E-05
   maximum displ.:     0.0660322 α      in ANC's #1, #4, #5, ...
 * RMSD in coord.:     0.4704555 α      energy gain  -0.6043760E-02 Eh

generating ANC from model Hessian ...
Using Lindh-Hessian (1995)
 Shifting diagonal of input Hessian by   4.235165211311205E-003
 Lowest  eigenvalues of input Hessian
   -0.000000   -0.000000   -0.000000   -0.000000   -0.000000    0.000000
    0.005000    0.005965    0.007092    0.007919    0.008617    0.010321
    0.012047    0.013105    0.017281    0.018753    0.021488    0.021993
 Highest eigenvalues
    1.976936    2.021724    2.066001    2.099909    2.222500    2.300082
 

........................................................................
.............................. CYCLE   21 ..............................
........................................................................
   1    -50.5981064 -0.505981E+02  0.590E-02    2.37       0.0  T
   2    -50.5981073 -0.879271E-06  0.329E-02    2.37       1.0  T
   3    -50.5981073  0.101941E-07  0.611E-03    2.37       3.0  T
   4    -50.5981074 -0.144939E-06  0.380E-03    2.37       4.9  T
   5    -50.5981076 -0.204811E-06  0.927E-04    2.37      20.0  T
   6    -50.5981076 -0.132477E-07  0.456E-04    2.37      40.7  T
     SCC iter.                  ...        0 min,  0.009 sec
     gradient                   ...        0 min,  0.018 sec
 * total energy  :   -49.8767569 Eh     change       -0.7939060E-05 Eh
   gradient norm :     0.0011379 Eh/α   predicted     0.0000000E+00 (-100.00%)
   displ. norm   :     0.0171050 α      lambda       -0.4004566E-05
   maximum displ.:     0.0099432 α      in ANC's #4, #7, #12, ...

........................................................................
.............................. CYCLE   22 ..............................
........................................................................
   1    -50.5983338 -0.505983E+02  0.810E-03    2.37       0.0  T
   2    -50.5983339 -0.243737E-07  0.470E-03    2.37       3.9  T
   3    -50.5983338  0.585083E-07  0.173E-03    2.37      10.7  T
   4    -50.5983339 -0.673331E-07  0.402E-04    2.37      46.2  T
   5    -50.5983339 -0.149103E-08  0.182E-04    2.37     102.1  T
     SCC iter.                  ...        0 min,  0.007 sec
     gradient                   ...        0 min,  0.018 sec
 * total energy  :   -49.8767592 Eh     change       -0.2384120E-05 Eh
   gradient norm :     0.0005332 Eh/α   predicted    -0.2008196E-05 ( -15.77%)
   displ. norm   :     0.0171443 α      lambda        0.6647607E-05
   maximum displ.:     0.0099450 α      in ANC's #4, #7, #12, ...

   *** GEOMETRY OPTIMIZATION CONVERGED AFTER 22 ITERATIONS ***

------------------------------------------------------------------------
 total energy gain   :        -0.0060541 Eh       -3.7990 kcal/mol
 total RMSD          :         0.4715008 a0        0.2495 Å
 total power (kW/mol):        -0.7224997 (step)  -16.6189 (real)
------------------------------------------------------------------------

 ANCopt (total)                0 d,  0 h,  0 min,  0.956 sec
 optimizer setup                ...        0 min,  0.000 sec (  0.014%)
 model hessian                  ...        0 min,  0.011 sec (  1.155%)
 ANC generation                 ...        0 min,  0.002 sec (  0.174%)
 coordinate transformation      ...        0 min,  0.000 sec (  0.045%)
 single point calculation       ...        0 min,  0.934 sec ( 97.664%)
 optimization log               ...        0 min,  0.002 sec (  0.244%)
 hessian update                 ...        0 min,  0.000 sec (  0.031%)
 rational function              ...        0 min,  0.005 sec (  0.539%)

================
 final structure:
================
$coord
   -4.54285261831598    2.77305308889304   -0.24583523857508      C 
   -6.99059809785105    0.66971296613765   -0.33523917122537      S 
   -2.23612490720011    1.62203491403672   -0.16417333172749      C 
    0.16450338481037    3.03724720296077   -0.07595421802867      C 
    0.27606040062110    5.33626201520773   -0.06510564172768      O 
    2.34437193915934    1.36461690152751   -0.00273792455340      C 
    4.88145026141746    1.93833438965423    0.09274794912760      C 
    6.21403580278241   -0.24598202862196    0.15194821620565      N 
    8.93068127325180   -0.42917075644113    0.13172932080055      C 
    9.94773168309472   -0.49339683370513   -2.56920797764406      C 
    4.60048372163877   -2.23148347988979    0.07658397116042      C 
    2.16223263141819   -1.32417167332923   -0.01298100669824      C 
   -0.19952085470257   -2.73870779409058   -0.09689184008631      C 
   -0.28459146036403   -5.04329121644568   -0.10305253324633      O 
   -2.43165547921704   -1.07633400746796   -0.17298878930912      C 
   -4.91160798758611   -1.88984706528062   -0.26199780868068      C 
   -5.81848045685133   -4.44652733155965   -0.29313225774989      C 
   -8.24683845395842   -5.09113255563799   -0.38962073101511      C 
   -4.89856496337243    4.76816147920840   -0.25738159764521      H 
    5.78450929283632    3.75116685883268    0.13463862080849      H 
    9.48042834660262   -2.14955051272830    1.13443050784487      H 
    9.70588769631375    1.19900503091043    1.13937647593581      H 
    9.20010934017561   -2.12066941854168   -3.57680554881038      H 
   11.99690034979597   -0.61505414425898   -2.54578294968463      H 
    9.39811101622742    1.20895689318094   -3.58029429513659      H 
    5.25223376124733   -4.14933146972349    0.10407031648988      H 
   -4.34721355111024   -5.86350054192362   -0.22922340179305      H 
   -9.72673430591990   -3.69055874314557   -0.44839780876986      H 
   -8.82758837123186   -7.03861070479003   -0.40792509631563      H 
$end
           -------------------------------------------------
          |                Final Singlepoint                |
           -------------------------------------------------

          ...................................................
          :                      SETUP                      :
          :.................................................:
          :  # basis functions                  89          :
          :  # atomic orbitals                  88          :
          :  # shells                           48          :
          :  # electrons                        90          :
          :  max. iterations                   250          :
          :  Hamiltonian                  GFN2-xTB          :
          :  restarted?                      false          :
          :  GBSA solvation                  false          :
          :  PC potential                    false          :
          :  electronic temp.          300.0000000     K    :
          :  accuracy                    1.0000000          :
          :  -> integral cutoff          0.2500000E+02      :
          :  -> integral neglect         0.1000000E-07      :
          :  -> SCF convergence          0.1000000E-05 Eh   :
          :  -> wf. convergence          0.1000000E-03 e    :
          :  Broyden damping             0.4000000          :
          ...................................................

 iter      E             dE          RMSdq      gap      omega  full diag
   1    -50.5983339 -0.505983E+02  0.108E-04    2.37       0.0  T
   2    -50.5983339 -0.143245E-10  0.614E-05    2.37     302.2  T
   3    -50.5983339 -0.930314E-10  0.403E-05    2.37     460.9  T

   *** convergence criteria satisfied after 3 iterations ***

         #    Occupation            Energy/Eh            Energy/eV
      -------------------------------------------------------------
         1        2.0000           -0.7418743             -20.1874
       ...           ...                  ...                  ...
        39        2.0000           -0.4422068             -12.0331
        40        2.0000           -0.4174242             -11.3587
        41        2.0000           -0.4079153             -11.0999
        42        2.0000           -0.4023031             -10.9472
        43        2.0000           -0.3905631             -10.6278
        44        2.0000           -0.3894490             -10.5974
        45        2.0000           -0.3874052             -10.5418 (HOMO)
        46                         -0.3003786              -8.1737 (LUMO)
        47                         -0.2854238              -7.7668
        48                         -0.2364314              -6.4336
        49                         -0.2107510              -5.7348
        50                         -0.1986012              -5.4042
       ...                                ...                  ...
        88                          0.7482735              20.3616
      -------------------------------------------------------------
                  HL-Gap            0.0870266 Eh            2.3681 eV
             Fermi-level           -0.3438919 Eh           -9.3578 eV

 SCC (total)                   0 d,  0 h,  0 min,  0.038 sec
 SCC setup                      ...        0 min,  0.000 sec (  0.760%)
 Dispersion                     ...        0 min,  0.000 sec (  1.002%)
 integral evaluation            ...        0 min,  0.014 sec ( 37.390%)
 zeroth order Hamiltonian       ...        0 min,  0.000 sec (  0.509%)
 iterations                     ...        0 min,  0.005 sec ( 12.733%)
 molecular gradient             ...        0 min,  0.018 sec ( 46.477%)
 printout                       ...        0 min,  0.000 sec (  1.008%)

         :::::::::::::::::::::::::::::::::::::::::::::::::::::
         ::                     SUMMARY                     ::
         :::::::::::::::::::::::::::::::::::::::::::::::::::::
         :: total energy             -49.876759222395 Eh    ::
         :: gradient norm              0.000533283581 Eh/a0 ::
         :: HOMO-LUMO gap              2.368114683003 eV    ::
         ::.................................................::
         :: SCC energy               -50.598333880815 Eh    ::
         :: -> isotropic ES            0.060603391747 Eh    ::
         :: -> anisotropic ES          0.001270921484 Eh    ::
         :: -> anisotropic XC          0.018033272256 Eh    ::
         :: -> dispersion             -0.033181968054 Eh    ::
         :: repulsion energy           0.721696019822 Eh    ::
         :: add. restraining           0.000000000000 Eh    ::
         :::::::::::::::::::::::::::::::::::::::::::::::::::::

           -------------------------------------------------
          |                Property Printout                |
           -------------------------------------------------

    * Orbital Energies and Occupations

         #    Occupation            Energy/Eh            Energy/eV
      -------------------------------------------------------------
         1        2.0000           -0.7418743             -20.1874
       ...           ...                  ...                  ...
        33        2.0000           -0.4859199             -13.2226
        34        2.0000           -0.4825681             -13.1313
        35        2.0000           -0.4729024             -12.8683
        36        2.0000           -0.4626335             -12.5889
        37        2.0000           -0.4530855             -12.3291
        38        2.0000           -0.4451548             -12.1133
        39        2.0000           -0.4422068             -12.0331
        40        2.0000           -0.4174242             -11.3587
        41        2.0000           -0.4079153             -11.0999
        42        2.0000           -0.4023031             -10.9472
        43        2.0000           -0.3905631             -10.6278
        44        2.0000           -0.3894490             -10.5974
        45        2.0000           -0.3874052             -10.5418 (HOMO)
        46                         -0.3003786              -8.1737 (LUMO)
        47                         -0.2854238              -7.7668
        48                         -0.2364314              -6.4336
        49                         -0.2107510              -5.7348
        50                         -0.1986012              -5.4042
        51                         -0.1711890              -4.6583
        52                         -0.1565007              -4.2586
        53                         -0.1287655              -3.5039
        54                         -0.0805473              -2.1918
        55                         -0.0161155              -0.4385
        56                         -0.0025384              -0.0691
       ...                                ...                  ...
        88                          0.7482735              20.3616
      -------------------------------------------------------------
                  HL-Gap            0.0870266 Eh            2.3681 eV
             Fermi-level           -0.3438919 Eh           -9.3578 eV

     #   Z        covCN         q      C6AA      α(0)
     1   6 C      2.934    -0.007    28.194     8.708
     2  16 S      2.302     0.011   140.593    19.956
     3   6 C      3.160    -0.030    28.424     8.716
     4   6 C      2.821     0.229    23.200     7.892
     5   8 O      0.857    -0.391    21.495     6.216
     6   6 C      3.109    -0.046    28.992     8.822
     7   6 C      3.044    -0.001    28.007     8.680
     8   7 N      2.855     0.019    20.909     6.791
     9   6 C      3.741    -0.007    20.772     6.502
    10   6 C      3.752    -0.114    22.733     6.799
    11   6 C      3.045    -0.001    28.007     8.680
    12   6 C      3.107    -0.046    28.986     8.821
    13   6 C      2.820     0.230    23.181     7.889
    14   8 O      0.857    -0.398    21.644     6.238
    15   6 C      3.147    -0.038    28.676     8.760
    16   6 C      2.986     0.039    27.121     8.543
    17   6 C      2.918    -0.032    28.795     8.800
    18   6 C      2.841    -0.079    29.965     8.971
    19   1 H      0.926     0.071     2.073     2.252
    20   1 H      0.926     0.058     2.218     2.329
    21   1 H      0.924     0.060     2.194     2.316
    22   1 H      0.924     0.060     2.194     2.316
    23   1 H      0.925     0.053     2.278     2.360
    24   1 H      0.925     0.055     2.260     2.351
    25   1 H      0.925     0.053     2.278     2.360
    26   1 H      0.926     0.059     2.213     2.326
    27   1 H      0.925     0.087     1.910     2.161
    28   1 H      0.926     0.051     2.302     2.373
    29   1 H      0.926     0.052     2.300     2.372

 Mol. C6AA /au·bohr⁶  :      13031.878236
 Mol. C8AA /au·bohr⁸  :     349140.425548
 Mol. α(0) /au        :        181.300436


Wiberg/Mayer (AO) data.
largest (>0.10) Wiberg bond orders for each atom
          total WBO             WBO to atom ...
     1  C   3.954        C    3 1.554    S    2 1.221    H   19 0.966
     2  S   2.667        C    1 1.221    C   16 1.137
     3  C   3.983        C    1 1.554    C   15 1.198    C    4 1.026
     4  C   3.943        O    5 1.741    C    6 1.068    C    3 1.026
     5  O   2.028        C    4 1.741
     6  C   3.979        C    7 1.475    C   12 1.219    C    4 1.068
     7  C   3.949        C    6 1.475    N    8 1.251    H   20 0.967
     8  N   3.666        C    7 1.251    C   11 1.250    C    9 0.987
     9  C   3.967        C   10 1.004    N    8 0.987    H   22 0.970    H   21 0.970
    10  C   3.988        C    9 1.004    H   23 0.986    H   25 0.986    H   24 0.983
    11  C   3.947        C   12 1.477    N    8 1.250    H   26 0.967
    12  C   3.979        C   11 1.477    C    6 1.219    C   13 1.066
    13  C   3.946        O   14 1.723    C   12 1.066    C   15 1.043
    14  O   2.033        C   13 1.723
    15  C   3.982        C   16 1.467    C    3 1.198    C   13 1.043
    16  C   3.952        C   15 1.467    C   17 1.147    S    2 1.137
    17  C   3.986        C   18 1.856    C   16 1.147    H   27 0.944
    18  C   3.980        C   17 1.856    H   29 0.977    H   28 0.970
    19  H   0.994        C    1 0.966
    20  H   0.996        C    7 0.967
    21  H   0.996        C    9 0.970
    22  H   0.996        C    9 0.970
    23  H   0.997        C   10 0.986
    24  H   0.996        C   10 0.983
    25  H   0.997        C   10 0.986
    26  H   0.996        C   11 0.967
    27  H   0.992        C   17 0.944
    28  H   0.997        C   18 0.970
    29  H   0.997        C   18 0.977

molecular dipole:
                 x           y           z       tot (Debye)
 q only:        1.250      -0.396      -0.092
   full:        1.602      -0.342      -0.052       4.166
molecular quadrupole (traceless):
                xx          xy          yy          xz          yz          zz
 q only:       31.406       0.166     -24.012      -0.907       0.116      -7.394
  q+dip:       32.507      -0.525     -23.227      -0.024       0.022      -9.281
   full:       29.766      -0.414     -25.443      -0.501       0.035      -4.323

           -------------------------------------------------
          |                Geometry Summary                 |
           -------------------------------------------------

      molecular mass/u    :      257.3064000
   center of mass at/Å    :       -0.0990346      -0.2057176      -0.1393718
  moments of inertia/u·Å² :        0.5955485E+03   0.2172071E+04   0.2710651E+04
rotational constants/cm⁻¹ :        0.2830606E-01   0.7761088E-02   0.6219035E-02

 * 26 selected distances

     #   Z        #   Z                                     value/Å
     1   6 C      2  16 S                                 1.7084716
     1   6 C      3   6 C                                 1.3648777
     4   6 C      5   8 O                                 1.2180313
     6   6 C      7   6 C                                 1.3773901
     7   6 C      8   7 N                                 1.3543762
     8   7 N      9   6 C                                 1.4408914
     9   6 C     10   6 C                                 1.5276257
     8   7 N     11   6 C                                 1.3544712
     6   6 C     12   6 C                                 1.4261169
    11   6 C     12   6 C                                 1.3775192
    13   6 C     14   8 O                                 1.2203681
     3   6 C     15   6 C                                 1.4316670
     2  16 S     16   6 C                                 1.7453957 (max)
    15   6 C     16   6 C                                 1.3819422
    17   6 C     18   6 C                                 1.3305150
     1   6 C     19   1 H                                 1.0724325
     7   6 C     20   1 H                                 1.0719768 (min)
     9   6 C     21   1 H                                 1.0931498
     9   6 C     22   1 H                                 1.0931391
    10   6 C     23   1 H                                 1.0873541
    10   6 C     24   1 H                                 1.0863535
    10   6 C     25   1 H                                 1.0873771
    11   6 C     26   1 H                                 1.0719823
    17   6 C     27   1 H                                 1.0814555
    18   6 C     28   1 H                                 1.0786852
    18   6 C     29   1 H                                 1.0754513

 * 5 distinct bonds (by element types)

   Z      Z             #   av. dist./Å        max./Å        min./Å
   1 H    6 C          11     1.0817597     1.0931498     1.0719768
   6 C    6 C           8     1.4022067     1.5276257     1.3305150
   6 C    7 N           3     1.3832462     1.4408914     1.3543762
   6 C    8 O           2     1.2191997     1.2203681     1.2180313
   6 C   16 S           2     1.7269336     1.7453957     1.7084716


optimized geometry written to: xtbopt.xyz


           -------------------------------------------------
          | TOTAL ENERGY              -49.876759222395 Eh   |
          | GRADIENT NORM               0.000533283581 Eh/α |
          | HOMO-LUMO GAP               2.368114683003 eV   |
           -------------------------------------------------

------------------------------------------------------------------------
 * finished run on 2021/05/19 at 10:58:34.740     
------------------------------------------------------------------------
 total:
 * wall-time:     0 d,  0 h,  0 min,  1.075 sec
 *  cpu-time:     0 d,  0 h,  0 min,  1.075 sec
 * ratio c/w:     1.000 speedup
 SCF:
 * wall-time:     0 d,  0 h,  0 min,  0.054 sec
 *  cpu-time:     0 d,  0 h,  0 min,  0.054 sec
 * ratio c/w:     1.000 speedup
 ANC optimizer:
 * wall-time:     0 d,  0 h,  0 min,  0.995 sec
 *  cpu-time:     0 d,  0 h,  0 min,  0.995 sec
 * ratio c/w:     1.000 speedup

