      -----------------------------------------------------------      
     |                   =====================                   |     
     |                           x T B                           |     
     |                   =====================                   |     
     |                         S. Grimme                         |     
     |          Mulliken Center for Theoretical Chemistry        |     
     |                    University of Bonn                     |     
     |                Version 6.2 RC2 (SAW190805)                |     
      -----------------------------------------------------------      

   This program is distributed in the hope that it will be useful,
   but WITHOUT ANY WARRANTY; without even the implied warranty of
   MERCHANTABILITY or FITNESS FOR A PARTICULAR PURPOSE.
   
   FOR NON-COMMERCIAL, ACADEMIA USE ONLY.
   
   Cite this work as:
   * S. Grimme, C. Bannwarth, P. Shushkov, J. Chem. Theory Comput., 2017,
     13, 1989-2009. DOI: 10.1021/acs.jctc.7b00118
   * C. Bannwarth, S. Ehlert and S. Grimme., J. Chem. Theory Comput., 2019,
     15, 1652-1671. DOI: 10.1021/acs.jctc.8b01176
   * P. Pracht, E. Caldeweyher, S. Ehlert, S. Grimme, ChemRxiv, 2019, preprint.
     DOI: 10.26434/chemrxiv.8326202.v1
   
   for DFT-D4:
   * E. Caldeweyher, C. Bannwarth and S. Grimme, J. Chem. Phys., 2017,
     147, 034112. DOI: 10.1063/1.4993215
   * E. Caldeweyher, S. Ehlert, A. Hansen, H. Neugebauer, S. Spicher,
     C. Bannwarth and S. Grimme, J. Chem. Phys., 2019, 150, 154122.
     DOI: 10.1063/1.5090222
   
   for sTDA-xTB:
   * S. Grimme and C. Bannwarth, J. Chem. Phys., 2016, 145, 054103.
     DOI: 10.1063/1.4959605
   
   in the mass-spec context:
   * V. Asgeirsson, C. Bauer and S. Grimme, Chem. Sci., 2017, 8, 4879.
     DOI: 10.1039/c7sc00601b
   
   for metadynamics refer to:
   * S. Grimme, J. Chem. Theory Comput., 2019, 155, 2847-2862
     DOI: 10.1021/acs.jctc.9b00143
   
   with help from (in alphabetical order)
   C. Bannwarth, F. Bohle, G. Brandenburg, E. Caldeweyher, M. Checinski,
   S. Dohm, S. Ehlert, S. Ehrlich, F. März, H. Neugebauer, J. Pisarek,
   P. Pracht, P. Shushkov, and S. Spicher.
   
 * started run on 2021/05/19 at 10:59:45.230     

           -------------------------------------------------
          |                Calculation Setup                |
           -------------------------------------------------

          program call               : /ihome/ghutchison/geoffh/xtb/xtb 560.xyz -opt
          hostname                   : smp-n144
          coordinate file            : 560.xyz
          omp threads                :                     1
          number of atoms            :                    23
          number of electrons        :                    62
          charge                     :                     0
          spin                       :                   0.0
          first test random number   :      0.21165208098964


########################################################################
# WARNING! Please study the warnings concerning your input carefully
#  - the use of '-opt' is discouraged, please use '--opt' next time
########################################################################

           ------------------------------------------------- 
          |                 G F N 2 - x T B                 |
          | Geometry, Frequencies, Noncovalent interactions |
          |            JCTC 2019 parametrisation            |
           ------------------------------------------------- 
             KAB for C  - Si     :                1.0500
             KAB for H  - Pd     :                0.9500
             k(s)              :                1.8500
             k(p)              :                2.2300
             k(d)              :                2.2300
             k(f)              :                2.0000
             kEN (H0ij)        :               -2.0000
             D4 a1             :                0.5200
             D4 a2             :                5.0000
             D4 s6             :                1.0000
             D4 s8             :                2.7000
             D4 s9             :                5.0000
             alphaj            :                2.0000

  Z AO/shell   Hii/eV     exponent
  1     Wed Apr 25 08:07:45 CEST 2018   EN: 2.200 GM2: 0.406  GM3: 0.0800  RAES: 1.40
     1s    -10.707211    1.230000
  6     Wed Apr 25 08:07:45 CEST 2018   EN: 2.550 GM2: 0.538  GM3: 0.1500  RAES: 3.00
     2s    -13.970922    2.096432
     2p    -10.063292    1.800000
  8     Wed Apr 25 08:07:45 CEST 2018   EN: 3.440 GM2: 0.452  GM3:-0.0517  RAES: 1.80
     2s    -20.229985    2.439742
     2p    -15.503117    2.137023
 16     Tue Apr 24 11:44:34 CEST 2018   EN: 2.580 GM2: 0.340  GM3:-0.0502  RAES: 3.10
     3s    -20.029654    1.981333
     3p    -11.377694    2.025643
     3d     -0.420282    1.702555

           ------------------------------------------------- 
          |        Self-Consistent Charge Iterations        |
           ------------------------------------------------- 

          ...................................................
          :                      SETUP                      :
          :.................................................:
          :  # basis functions                  62          :
          :  # atomic orbitals                  61          :
          :  # shells                           35          :
          :  # electrons                        62          :
          :  max. iterations                   250          :
          :  Hamiltonian                  GFN2-xTB          :
          :  restarted?                      false          :
          :  GBSA solvation                  false          :
          :  PC potential                    false          :
          :  electronic temp.          300.0000000     K    :
          :  accuracy                    1.0000000          :
          :  -> integral cutoff          0.2500000E+02      :
          :  -> integral neglect         0.1000000E-07      :
          :  -> SCF convergence          0.1000000E-05 Eh   :
          :  -> wf. convergence          0.1000000E-03 e    :
          :  Broyden damping             0.4000000          :
          ...................................................

 iter      E             dE          RMSdq      gap      omega  full diag
   1    -34.9468231 -0.349468E+02  0.408E+00    3.61       0.0  T
   2    -34.9907738 -0.439506E-01  0.217E+00    3.51       1.0  T
   3    -34.9892790  0.149481E-02  0.869E-01    3.40       1.0  T
   4    -34.9900732 -0.794224E-03  0.408E-01    3.53       1.0  T
   5    -34.9931262 -0.305298E-02  0.114E-01    3.46       1.0  T
   6    -34.9931349 -0.878705E-05  0.550E-02    3.47       1.0  T
   7    -34.9931524 -0.175091E-04  0.278E-02    3.48       1.0  T
   8    -34.9931605 -0.800431E-05  0.120E-02    3.47       1.7  T
   9    -34.9931609 -0.462746E-06  0.375E-03    3.47       5.6  T
  10    -34.9931610 -0.118160E-06  0.141E-03    3.47      14.8  T
  11    -34.9931610 -0.691033E-08  0.711E-04    3.47      29.3  T
  12    -34.9931610 -0.616680E-09  0.154E-04    3.47     135.3  T

   *** convergence criteria satisfied after 12 iterations ***

         #    Occupation            Energy/Eh            Energy/eV
      -------------------------------------------------------------
         1        2.0000           -0.7278350             -19.8054
       ...           ...                  ...                  ...
        25        2.0000           -0.4616753             -12.5628
        26        2.0000           -0.4557027             -12.4003
        27        2.0000           -0.4457230             -12.1287
        28        2.0000           -0.4407628             -11.9938
        29        2.0000           -0.4243924             -11.5483
        30        2.0000           -0.3767616             -10.2522
        31        2.0000           -0.3662858              -9.9671 (HOMO)
        32                         -0.2386695              -6.4945 (LUMO)
        33                         -0.1997205              -5.4347
        34                         -0.1611186              -4.3843
        35                         -0.1114940              -3.0339
        36                         -0.0033224              -0.0904
       ...                                ...                  ...
        61                          0.6779811              18.4488
      -------------------------------------------------------------
                  HL-Gap            0.1276164 Eh            3.4726 eV
             Fermi-level           -0.3024777 Eh           -8.2308 eV

 SCC (total)                   0 d,  0 h,  0 min,  0.032 sec
 SCC setup                      ...        0 min,  0.000 sec (  0.858%)
 Dispersion                     ...        0 min,  0.000 sec (  0.878%)
 integral evaluation            ...        0 min,  0.007 sec ( 22.382%)
 zeroth order Hamiltonian       ...        0 min,  0.000 sec (  0.470%)
 iterations                     ...        0 min,  0.012 sec ( 39.088%)
 molecular gradient             ...        0 min,  0.011 sec ( 35.060%)
 printout                       ...        0 min,  0.000 sec (  1.096%)

         :::::::::::::::::::::::::::::::::::::::::::::::::::::
         ::                     SUMMARY                     ::
         :::::::::::::::::::::::::::::::::::::::::::::::::::::
         :: total energy             -34.603660927735 Eh    ::
         :: gradient norm              0.044199719724 Eh/a0 ::
         :: HOMO-LUMO gap              3.472617829894 eV    ::
         ::.................................................::
         :: SCC energy               -34.993161040757 Eh    ::
         :: -> isotropic ES            0.031661263135 Eh    ::
         :: -> anisotropic ES          0.002304145751 Eh    ::
         :: -> anisotropic XC          0.009153406910 Eh    ::
         :: -> dispersion             -0.018368849061 Eh    ::
         :: repulsion energy           0.389412188799 Eh    ::
         :: add. restraining           0.000000000000 Eh    ::
         :::::::::::::::::::::::::::::::::::::::::::::::::::::

      ----------------------------------------------------------- 
     |                   =====================                   |
     |                        A N C O P T                        |
     |                   =====================                   |
     |               Approximate Normal Coordinate               |
     |                Rational Function Optimizer                |
      ----------------------------------------------------------- 

          ...................................................
          :                      SETUP                      :
          :.................................................:
          :   optimization level            normal          :
          :   max. optcycles                   200          :
          :   ANC micro-cycles                  20          :
          :   degrees of freedom                63          :
          :.................................................:
          :   RF solver                   davidson          :
          :   input Hessian                  false          :
          :   write xtbopt.log                true          :
          :   linear?                        false          :
          :   energy convergence         0.5000000E-05 Eh   :
          :   grad. convergence          0.1000000E-02 Eh/α :
          :   maximium RF displ.         2.0000000          :
          :   Hlow (freq-cutoff)         0.5000000E-02      :
          :   Hmax (freq-cutoff)         5.0000000          :
          :   S6 in model hess.         20.0000000          :
          ...................................................

generating ANC from model Hessian ...
Using Lindh-Hessian (1995)
 Shifting diagonal of input Hessian by   3.756803766557603E-003
 Lowest  eigenvalues of input Hessian
   -0.000000   -0.000000   -0.000000   -0.000000    0.000000    0.000000
    0.005000    0.005599    0.005827    0.006982    0.008648    0.010368
    0.013394    0.017759    0.018461    0.021986    0.025007    0.029796
 Highest eigenvalues
    1.421921    1.466984    1.549747    1.790291    1.975787    2.038303
 

........................................................................
.............................. CYCLE    1 ..............................
........................................................................
   1    -34.9931610 -0.349932E+02  0.516E-05    3.47       0.0  T
   2    -34.9931610 -0.698464E-11  0.315E-05    3.47     662.3  T
   3    -34.9931610  0.355271E-12  0.219E-05    3.47     950.5  T
     SCC iter.                  ...        0 min,  0.004 sec
     gradient                   ...        0 min,  0.011 sec
 * total energy  :   -34.6036609 Eh     change       -0.7272618E-09 Eh
   gradient norm :     0.0441996 Eh/α   predicted     0.0000000E+00 (-100.00%)
   displ. norm   :     0.2743880 α      lambda       -0.4339995E-02
   maximum displ.:     0.1386479 α      in ANC's #4, #1, #9, ...

........................................................................
.............................. CYCLE    2 ..............................
........................................................................
   1    -35.0071505 -0.350072E+02  0.386E-01    3.53       0.0  T
   2    -35.0071924 -0.418809E-04  0.193E-01    3.52       1.0  T
   3    -35.0071925 -0.149010E-06  0.402E-02    3.53       1.0  T
   4    -35.0071967 -0.419701E-05  0.261E-02    3.52       1.0  T
   5    -35.0072023 -0.562285E-05  0.553E-03    3.52       3.8  T
   6    -35.0072026 -0.283047E-06  0.193E-03    3.52      10.8  T
     SCC iter.                  ...        0 min,  0.006 sec
     gradient                   ...        0 min,  0.011 sec
 * total energy  :   -34.6064989 Eh     change       -0.2837929E-02 Eh
   gradient norm :     0.0174167 Eh/α   predicted    -0.2333374E-02 ( -17.78%)
   displ. norm   :     0.2343976 α      lambda       -0.1056475E-02
   maximum displ.:     0.1363559 α      in ANC's #4, #1, #6, ...

........................................................................
.............................. CYCLE    3 ..............................
........................................................................
   1    -35.0125436 -0.350125E+02  0.214E-01    3.55       0.0  T
   2    -35.0125558 -0.122147E-04  0.111E-01    3.55       1.0  T
   3    -35.0125510  0.483379E-05  0.278E-02    3.55       1.0  T
   4    -35.0125579 -0.689758E-05  0.151E-02    3.55       1.4  T
   5    -35.0125595 -0.161325E-05  0.396E-03    3.55       5.3  T
   6    -35.0125596 -0.116053E-06  0.166E-03    3.55      12.5  T
   7    -35.0125597 -0.293788E-07  0.843E-04    3.55      24.7  T
     SCC iter.                  ...        0 min,  0.007 sec
     gradient                   ...        0 min,  0.011 sec
 * total energy  :   -34.6072364 Eh     change       -0.7375840E-03 Eh
   gradient norm :     0.0068569 Eh/α   predicted    -0.5572606E-03 ( -24.45%)
   displ. norm   :     0.2924183 α      lambda       -0.5863950E-03
   maximum displ.:     0.1827897 α      in ANC's #4, #1, #2, ...

........................................................................
.............................. CYCLE    4 ..............................
........................................................................
   1    -35.0128433 -0.350128E+02  0.247E-01    3.55       0.0  T
   2    -35.0128593 -0.159341E-04  0.128E-01    3.56       1.0  T
   3    -35.0128447  0.145874E-04  0.369E-02    3.55       1.0  T
   4    -35.0128643 -0.196357E-04  0.166E-02    3.56       1.3  T
   5    -35.0128655 -0.116827E-05  0.337E-03    3.56       6.2  T
   6    -35.0128656 -0.648677E-07  0.181E-03    3.56      11.6  T
   7    -35.0128656 -0.374697E-07  0.833E-04    3.56      25.0  T
     SCC iter.                  ...        0 min,  0.007 sec
     gradient                   ...        0 min,  0.011 sec
 * total energy  :   -34.6076844 Eh     change       -0.4479821E-03 Eh
   gradient norm :     0.0063327 Eh/α   predicted    -0.3182689E-03 ( -28.96%)
   displ. norm   :     0.3200645 α      lambda       -0.4593642E-03
   maximum displ.:     0.2002430 α      in ANC's #4, #1, #2, ...

........................................................................
.............................. CYCLE    5 ..............................
........................................................................
   1    -35.0116071 -0.350116E+02  0.241E-01    3.55       0.0  T
   2    -35.0116223 -0.152484E-04  0.128E-01    3.56       1.0  T
   3    -35.0115997  0.225954E-04  0.422E-02    3.55       1.0  T
   4    -35.0116288 -0.290808E-04  0.163E-02    3.56       1.3  T
   5    -35.0116296 -0.791696E-06  0.250E-03    3.56       8.4  T
   6    -35.0116296 -0.181949E-07  0.101E-03    3.56      20.7  T
     SCC iter.                  ...        0 min,  0.006 sec
     gradient                   ...        0 min,  0.011 sec
 * total energy  :   -34.6080437 Eh     change       -0.3593194E-03 Eh
   gradient norm :     0.0081229 Eh/α   predicted    -0.2532116E-03 ( -29.53%)
   displ. norm   :     0.3445981 α      lambda       -0.4309306E-03
   maximum displ.:     0.2155639 α      in ANC's #4, #1, #2, ...

........................................................................
.............................. CYCLE    6 ..............................
........................................................................
   1    -35.0105305 -0.350105E+02  0.249E-01    3.55       0.0  T
   2    -35.0105448 -0.142955E-04  0.135E-01    3.56       1.0  T
   3    -35.0105192  0.256007E-04  0.449E-02    3.55       1.0  T
   4    -35.0105516 -0.324367E-04  0.171E-02    3.56       1.2  T
   5    -35.0105524 -0.774792E-06  0.236E-03    3.56       8.9  T
   6    -35.0105524 -0.153899E-08  0.145E-03    3.56      14.3  T
     SCC iter.                  ...        0 min,  0.006 sec
     gradient                   ...        0 min,  0.010 sec
 * total energy  :   -34.6083853 Eh     change       -0.3415115E-03 Eh
   gradient norm :     0.0097077 Eh/α   predicted    -0.2410568E-03 ( -29.41%)
   displ. norm   :     0.4176890 α      lambda       -0.4973483E-03
   maximum displ.:     0.2614750 α      in ANC's #4, #1, #3, ...

........................................................................
.............................. CYCLE    7 ..............................
........................................................................
   1    -35.0098894 -0.350099E+02  0.299E-01    3.55       0.0  T
   2    -35.0099052 -0.157916E-04  0.164E-01    3.56       1.0  T
   3    -35.0098844  0.208232E-04  0.466E-02    3.55       1.0  T
   4    -35.0099112 -0.268348E-04  0.211E-02    3.56       1.0  T
   5    -35.0099130 -0.176271E-05  0.345E-03    3.56       6.0  T
   6    -35.0099131 -0.119578E-06  0.193E-03    3.56      10.8  T
   7    -35.0099132 -0.370145E-07  0.848E-04    3.56      24.6  T
     SCC iter.                  ...        0 min,  0.007 sec
     gradient                   ...        0 min,  0.010 sec
 * total energy  :   -34.6087698 Eh     change       -0.3845055E-03 Eh
   gradient norm :     0.0104676 Eh/α   predicted    -0.2920591E-03 ( -24.04%)
   displ. norm   :     0.4078899 α      lambda       -0.4722834E-03
   maximum displ.:     0.2498797 α      in ANC's #4, #1, #3, ...

........................................................................
.............................. CYCLE    8 ..............................
........................................................................
   1    -35.0107553 -0.350108E+02  0.295E-01    3.55       0.0  T
   2    -35.0107686 -0.132683E-04  0.165E-01    3.56       1.0  T
   3    -35.0107629  0.571244E-05  0.377E-02    3.55       1.0  T
   4    -35.0107699 -0.699133E-05  0.227E-02    3.56       1.0  T
   5    -35.0107743 -0.438096E-05  0.374E-03    3.56       5.6  T
   6    -35.0107744 -0.160818E-06  0.162E-03    3.56      12.9  T
   7    -35.0107744 -0.158799E-09  0.853E-04    3.56      24.5  T
     SCC iter.                  ...        0 min,  0.007 sec
     gradient                   ...        0 min,  0.011 sec
 * total energy  :   -34.6091188 Eh     change       -0.3490873E-03 Eh
   gradient norm :     0.0087090 Eh/α   predicted    -0.2754324E-03 ( -21.10%)
   displ. norm   :     0.3457727 α      lambda       -0.3199633E-03
   maximum displ.:     0.2185243 α      in ANC's #4, #1, #3, ...

........................................................................
.............................. CYCLE    9 ..............................
........................................................................
   1    -35.0114676 -0.350115E+02  0.260E-01    3.56       0.0  T
   2    -35.0114789 -0.112367E-04  0.146E-01    3.55       1.0  T
   3    -35.0114708  0.805250E-05  0.339E-02    3.56       1.0  T
   4    -35.0114801 -0.926023E-05  0.200E-02    3.55       1.0  T
   5    -35.0114839 -0.378329E-05  0.381E-03    3.56       5.5  T
   6    -35.0114840 -0.141059E-06  0.181E-03    3.56      11.5  T
   7    -35.0114840 -0.230982E-07  0.957E-04    3.56      21.8  T
     SCC iter.                  ...        0 min,  0.007 sec
     gradient                   ...        0 min,  0.011 sec
 * total energy  :   -34.6093340 Eh     change       -0.2151853E-03 Eh
   gradient norm :     0.0071734 Eh/α   predicted    -0.1791092E-03 ( -16.77%)
   displ. norm   :     0.2185862 α      lambda       -0.3263768E-03
   maximum displ.:     0.1295068 α      in ANC's #4, #6, #1, ...

........................................................................
.............................. CYCLE   10 ..............................
........................................................................
   1    -35.0195569 -0.350196E+02  0.192E-01    3.55       0.0  T
   2    -35.0195712 -0.142539E-04  0.108E-01    3.55       1.0  T
   3    -35.0195536  0.175570E-04  0.371E-02    3.56       1.0  T
   4    -35.0195750 -0.213461E-04  0.155E-02    3.55       1.3  T
   5    -35.0195769 -0.189448E-05  0.415E-03    3.55       5.0  T
   6    -35.0195769 -0.138673E-07  0.170E-03    3.55      12.3  T
   7    -35.0195769 -0.268741E-07  0.867E-04    3.55      24.0  T
     SCC iter.                  ...        0 min,  0.007 sec
     gradient                   ...        0 min,  0.011 sec
 * total energy  :   -34.6092532 Eh     change        0.8083371E-04 Eh
   gradient norm :     0.0135454 Eh/α   predicted    -0.1709883E-03 (-311.53%)
   displ. norm   :     0.1552453 α      lambda       -0.4655056E-03
   maximum displ.:     0.1054301 α      in ANC's #4, #2, #7, ...

........................................................................
.............................. CYCLE   11 ..............................
........................................................................
   1    -35.0144048 -0.350144E+02  0.120E-01    3.55       0.0  T
   2    -35.0144103 -0.545255E-05  0.652E-02    3.55       1.0  T
   3    -35.0144073  0.295968E-05  0.189E-02    3.55       1.1  T
   4    -35.0144107 -0.335308E-05  0.947E-03    3.55       2.2  T
   5    -35.0144114 -0.738326E-06  0.290E-03    3.55       7.2  T
   6    -35.0144115 -0.419810E-07  0.793E-04    3.55      26.3  T
     SCC iter.                  ...        0 min,  0.006 sec
     gradient                   ...        0 min,  0.011 sec
 * total energy  :   -34.6094977 Eh     change       -0.2444986E-03 Eh
   gradient norm :     0.0049223 Eh/α   predicted    -0.2383706E-03 (  -2.51%)
   displ. norm   :     0.0426897 α      lambda       -0.4456897E-04
   maximum displ.:     0.0295839 α      in ANC's #4, #9, #7, ...

........................................................................
.............................. CYCLE   12 ..............................
........................................................................
   1    -35.0143964 -0.350144E+02  0.396E-02    3.55       0.0  T
   2    -35.0143972 -0.808679E-06  0.214E-02    3.55       1.0  T
   3    -35.0143954  0.181871E-05  0.119E-02    3.55       1.7  T
   4    -35.0143978 -0.241023E-05  0.290E-03    3.55       7.2  T
   5    -35.0143978 -0.200505E-07  0.127E-03    3.55      16.4  T
     SCC iter.                  ...        0 min,  0.005 sec
     gradient                   ...        0 min,  0.011 sec
 * total energy  :   -34.6095346 Eh     change       -0.3688203E-04 Eh
   gradient norm :     0.0030134 Eh/α   predicted    -0.2232541E-04 ( -39.47%)
   displ. norm   :     0.1995418 α      lambda       -0.1050248E-03
   maximum displ.:     0.1599064 α      in ANC's #4, #7, #9, ...

........................................................................
.............................. CYCLE   13 ..............................
........................................................................
   1    -35.0138067 -0.350138E+02  0.200E-01    3.55       0.0  T
   2    -35.0138148 -0.811353E-05  0.107E-01    3.55       1.0  T
   3    -35.0137997  0.150982E-04  0.363E-02    3.55       1.0  T
   4    -35.0138185 -0.187722E-04  0.147E-02    3.55       1.4  T
   5    -35.0138191 -0.654532E-06  0.325E-03    3.55       6.4  T
   6    -35.0138193 -0.160338E-06  0.113E-03    3.55      18.4  T
   7    -35.0138193 -0.111531E-07  0.597E-04    3.55      34.9  T
   8    -35.0138193 -0.245236E-08  0.264E-04    3.55      79.1  T
     SCC iter.                  ...        0 min,  0.008 sec
     gradient                   ...        0 min,  0.011 sec
 * total energy  :   -34.6095996 Eh     change       -0.6502861E-04 Eh
   gradient norm :     0.0029005 Eh/α   predicted    -0.5460398E-04 ( -16.03%)
   displ. norm   :     0.1037864 α      lambda       -0.4277756E-04
   maximum displ.:     0.0738688 α      in ANC's #4, #7, #9, ...

........................................................................
.............................. CYCLE   14 ..............................
........................................................................
   1    -35.0147504 -0.350148E+02  0.965E-02    3.55       0.0  T
   2    -35.0147519 -0.151487E-05  0.527E-02    3.55       1.0  T
   3    -35.0147512  0.705647E-06  0.121E-02    3.55       1.7  T
   4    -35.0147520 -0.829937E-06  0.712E-03    3.55       2.9  T
   5    -35.0147525 -0.463597E-06  0.118E-03    3.55      17.7  T
   6    -35.0147525 -0.175658E-07  0.518E-04    3.55      40.2  T
   7    -35.0147525 -0.172764E-08  0.294E-04    3.55      70.8  T
     SCC iter.                  ...        0 min,  0.007 sec
     gradient                   ...        0 min,  0.011 sec
 * total energy  :   -34.6096289 Eh     change       -0.2929396E-04 Eh
   gradient norm :     0.0031004 Eh/α   predicted    -0.2161972E-04 ( -26.20%)
   displ. norm   :     0.1566368 α      lambda       -0.4135205E-04
   maximum displ.:     0.1216267 α      in ANC's #4, #7, #9, ...

........................................................................
.............................. CYCLE   15 ..............................
........................................................................
   1    -35.0144908 -0.350145E+02  0.165E-01    3.55       0.0  T
   2    -35.0144952 -0.432734E-05  0.876E-02    3.55       1.0  T
   3    -35.0144963 -0.114239E-05  0.165E-02    3.55       1.3  T
   4    -35.0144953  0.992604E-06  0.785E-03    3.55       2.7  T
   5    -35.0144966 -0.124772E-05  0.120E-03    3.55      17.4  T
   6    -35.0144966 -0.712105E-08  0.683E-04    3.55      30.5  T
   7    -35.0144966 -0.390550E-09  0.297E-04    3.55      70.2  T
     SCC iter.                  ...        0 min,  0.007 sec
     gradient                   ...        0 min,  0.011 sec
 * total energy  :   -34.6096561 Eh     change       -0.2717421E-04 Eh
   gradient norm :     0.0026365 Eh/α   predicted    -0.2118834E-04 ( -22.03%)
   displ. norm   :     0.0775661 α      lambda       -0.2385013E-04
   maximum displ.:     0.0398114 α      in ANC's #2, #3, #4, ...

........................................................................
.............................. CYCLE   16 ..............................
........................................................................
   1    -35.0154851 -0.350155E+02  0.642E-02    3.55       0.0  T
   2    -35.0154858 -0.710976E-06  0.350E-02    3.55       1.0  T
   3    -35.0154853  0.493230E-06  0.928E-03    3.55       2.2  T
   4    -35.0154860 -0.661652E-06  0.509E-03    3.55       4.1  T
   5    -35.0154862 -0.160204E-06  0.833E-04    3.55      25.0  T
   6    -35.0154862 -0.953136E-08  0.392E-04    3.55      53.1  T
     SCC iter.                  ...        0 min,  0.006 sec
     gradient                   ...        0 min,  0.011 sec
 * total energy  :   -34.6096707 Eh     change       -0.1466713E-04 Eh
   gradient norm :     0.0018754 Eh/α   predicted    -0.1200176E-04 ( -18.17%)
   displ. norm   :     0.1108963 α      lambda       -0.1570571E-04
   maximum displ.:     0.0722293 α      in ANC's #4, #2, #9, ...

........................................................................
.............................. CYCLE   17 ..............................
........................................................................
   1    -35.0144470 -0.350144E+02  0.112E-01    3.54       0.0  T
   2    -35.0144491 -0.212786E-05  0.591E-02    3.54       1.0  T
   3    -35.0144481  0.941343E-06  0.144E-02    3.54       1.5  T
   4    -35.0144493 -0.115422E-05  0.873E-03    3.54       2.4  T
   5    -35.0144499 -0.621887E-06  0.972E-04    3.54      21.5  T
   6    -35.0144499 -0.479153E-08  0.564E-04    3.54      37.0  T
     SCC iter.                  ...        0 min,  0.006 sec
     gradient                   ...        0 min,  0.011 sec
 * total energy  :   -34.6096763 Eh     change       -0.5525008E-05 Eh
   gradient norm :     0.0020165 Eh/α   predicted    -0.7900108E-05 (  42.99%)
   displ. norm   :     0.0484199 α      lambda       -0.1302509E-04
   maximum displ.:     0.0372768 α      in ANC's #4, #3, #7, ...

........................................................................
.............................. CYCLE   18 ..............................
........................................................................
   1    -35.0149585 -0.350150E+02  0.419E-02    3.55       0.0  T
   2    -35.0149587 -0.235770E-06  0.236E-02    3.55       1.0  T
   3    -35.0149588 -0.564628E-07  0.409E-03    3.55       5.1  T
   4    -35.0149587  0.680744E-07  0.253E-03    3.55       8.3  T
   5    -35.0149588 -0.101159E-06  0.367E-04    3.55      56.8  T
   6    -35.0149588 -0.101749E-08  0.180E-04    3.55     116.0  T
     SCC iter.                  ...        0 min,  0.006 sec
     gradient                   ...        0 min,  0.011 sec
 * total energy  :   -34.6096847 Eh     change       -0.8413633E-05 Eh
   gradient norm :     0.0011110 Eh/α   predicted    -0.6528825E-05 ( -22.40%)
   displ. norm   :     0.0622196 α      lambda       -0.5778385E-05
   maximum displ.:     0.0481013 α      in ANC's #4, #7, #3, ...

........................................................................
.............................. CYCLE   19 ..............................
........................................................................
   1    -35.0150367 -0.350150E+02  0.580E-02    3.55       0.0  T
   2    -35.0150371 -0.491145E-06  0.316E-02    3.55       1.0  T
   3    -35.0150370  0.128621E-06  0.687E-03    3.55       3.0  T
   4    -35.0150372 -0.140813E-06  0.413E-03    3.55       5.1  T
   5    -35.0150373 -0.179389E-06  0.520E-04    3.55      40.1  T
   6    -35.0150373 -0.239177E-08  0.294E-04    3.55      70.9  T
     SCC iter.                  ...        0 min,  0.006 sec
     gradient                   ...        0 min,  0.011 sec
 * total energy  :   -34.6096884 Eh     change       -0.3717107E-05 Eh
   gradient norm :     0.0010611 Eh/α   predicted    -0.2895746E-05 ( -22.10%)
   displ. norm   :     0.0203417 α      lambda       -0.2646234E-05
   maximum displ.:     0.0115661 α      in ANC's #1, #3, #2, ...

........................................................................
.............................. CYCLE   20 ..............................
........................................................................
   1    -35.0149101 -0.350149E+02  0.177E-02    3.55       0.0  T
   2    -35.0149101 -0.759372E-07  0.981E-03    3.55       2.1  T
   3    -35.0149100  0.106415E-06  0.302E-03    3.55       6.9  T
   4    -35.0149102 -0.134183E-06  0.141E-03    3.55      14.8  T
   5    -35.0149102 -0.123702E-07  0.242E-04    3.55      86.1  T
   6    -35.0149102 -0.193111E-09  0.982E-05    3.55     212.4  T
     SCC iter.                  ...        0 min,  0.006 sec
     gradient                   ...        0 min,  0.011 sec
 * total energy  :   -34.6096906 Eh     change       -0.2202733E-05 Eh
   gradient norm :     0.0008746 Eh/α   predicted    -0.1324445E-05 ( -39.87%)
   displ. norm   :     0.0427824 α      lambda       -0.2944810E-05
   maximum displ.:     0.0219944 α      in ANC's #2, #3, #1, ...

   *** GEOMETRY OPTIMIZATION CONVERGED AFTER 20 ITERATIONS ***

------------------------------------------------------------------------
 total energy gain   :        -0.0060297 Eh       -3.7837 kcal/mol
 total RMSD          :         0.6301912 a0        0.3335 Å
 total power (kW/mol):        -0.7915453 (step)  -31.2597 (real)
------------------------------------------------------------------------

 ANCopt (total)                0 d,  0 h,  0 min,  0.506 sec
 optimizer setup                ...        0 min,  0.000 sec (  0.029%)
 model hessian                  ...        0 min,  0.004 sec (  0.701%)
 ANC generation                 ...        0 min,  0.001 sec (  0.141%)
 coordinate transformation      ...        0 min,  0.000 sec (  0.069%)
 single point calculation       ...        0 min,  0.494 sec ( 97.556%)
 optimization log               ...        0 min,  0.002 sec (  0.377%)
 hessian update                 ...        0 min,  0.000 sec (  0.052%)
 rational function              ...        0 min,  0.004 sec (  0.827%)

================
 final structure:
================
$coord
   -1.77828164748355   -0.07437125266478   -1.89835415054316      C 
   -3.15587418033078   -2.95665526816847   -1.29475563200571      S 
   -0.87858383980761   -3.65865489107624    0.90396027163142      C 
    0.87312053249723   -1.78789393429193    1.15173497415088      C 
    0.34547884711293    0.30982010329139   -0.49771350010805      C 
    1.88109070514565    2.37490968067907   -0.56622613611969      O 
    1.21057012028679    4.33002343960069   -2.25986102196665      C 
    3.21134167293132    6.38233247715944   -2.07132774455367      C 
    2.83675772154317   -2.08480292978469    2.77349587615803      O 
    4.22731061635196    0.07626498963658    3.54301663859097      C 
    5.95691634245193   -0.74135256515432    5.68674219191664      C 
   -2.62828423110530    1.14246818921602   -3.27023251402425      H 
   -0.91408349865480   -5.42259417917459    1.89162845829030      H 
   -0.65768033840609    5.08433745237932   -1.75659298345999      H 
    1.11735839386023    3.58333204654339   -4.19519326142072      H 
    5.04516399019782    5.62553255860474   -2.60039814933899      H 
    3.32188457927831    7.08196139910394   -0.14411481183860      H 
    2.73649477491257    7.93404261806177   -3.32698935251732      H 
    2.93296638981537    1.56353550175393    4.18294971613153      H 
    5.33792409656813    0.81248902284669    1.95719313340407      H 
    4.84484659749789   -1.47234723497023    7.25083639304718      H 
    7.06734790588193    0.85906490226124    6.33553550134278      H 
    7.22084505470793   -2.22355849117089    5.03766455823093      H 
$end
           -------------------------------------------------
          |                Final Singlepoint                |
           -------------------------------------------------

          ...................................................
          :                      SETUP                      :
          :.................................................:
          :  # basis functions                  62          :
          :  # atomic orbitals                  61          :
          :  # shells                           35          :
          :  # electrons                        62          :
          :  max. iterations                   250          :
          :  Hamiltonian                  GFN2-xTB          :
          :  restarted?                      false          :
          :  GBSA solvation                  false          :
          :  PC potential                    false          :
          :  electronic temp.          300.0000000     K    :
          :  accuracy                    1.0000000          :
          :  -> integral cutoff          0.2500000E+02      :
          :  -> integral neglect         0.1000000E-07      :
          :  -> SCF convergence          0.1000000E-05 Eh   :
          :  -> wf. convergence          0.1000000E-03 e    :
          :  Broyden damping             0.4000000          :
          ...................................................

 iter      E             dE          RMSdq      gap      omega  full diag
   1    -35.0149102 -0.350149E+02  0.546E-05    3.55       0.0  T
   2    -35.0149102 -0.491696E-11  0.334E-05    3.55     624.3  T
   3    -35.0149102 -0.258140E-10  0.146E-05    3.55    1424.8  T

   *** convergence criteria satisfied after 3 iterations ***

         #    Occupation            Energy/Eh            Energy/eV
      -------------------------------------------------------------
         1        2.0000           -0.7252937             -19.7362
       ...           ...                  ...                  ...
        25        2.0000           -0.4618092             -12.5665
        26        2.0000           -0.4569886             -12.4353
        27        2.0000           -0.4461553             -12.1405
        28        2.0000           -0.4388731             -11.9423
        29        2.0000           -0.4272487             -11.6260
        30        2.0000           -0.3773690             -10.2687
        31        2.0000           -0.3636599              -9.8957 (HOMO)
        32                         -0.2333246              -6.3491 (LUMO)
        33                         -0.2010264              -5.4702
        34                         -0.1537210              -4.1830
        35                         -0.1113637              -3.0304
        36                         -0.0031494              -0.0857
       ...                                ...                  ...
        61                          0.6921737              18.8350
      -------------------------------------------------------------
                  HL-Gap            0.1303354 Eh            3.5466 eV
             Fermi-level           -0.2984923 Eh           -8.1224 eV

 SCC (total)                   0 d,  0 h,  0 min,  0.022 sec
 SCC setup                      ...        0 min,  0.000 sec (  0.855%)
 Dispersion                     ...        0 min,  0.000 sec (  0.781%)
 integral evaluation            ...        0 min,  0.007 sec ( 30.348%)
 zeroth order Hamiltonian       ...        0 min,  0.000 sec (  0.596%)
 iterations                     ...        0 min,  0.004 sec ( 16.091%)
 molecular gradient             ...        0 min,  0.011 sec ( 49.729%)
 printout                       ...        0 min,  0.000 sec (  1.392%)

         :::::::::::::::::::::::::::::::::::::::::::::::::::::
         ::                     SUMMARY                     ::
         :::::::::::::::::::::::::::::::::::::::::::::::::::::
         :: total energy             -34.609690604235 Eh    ::
         :: gradient norm              0.000874506204 Eh/a0 ::
         :: HOMO-LUMO gap              3.546606396170 eV    ::
         ::.................................................::
         :: SCC energy               -35.014910179933 Eh    ::
         :: -> isotropic ES            0.031310424590 Eh    ::
         :: -> anisotropic ES          0.001514113521 Eh    ::
         :: -> anisotropic XC          0.008497062286 Eh    ::
         :: -> dispersion             -0.018445533882 Eh    ::
         :: repulsion energy           0.405131639042 Eh    ::
         :: add. restraining           0.000000000000 Eh    ::
         :::::::::::::::::::::::::::::::::::::::::::::::::::::

           -------------------------------------------------
          |                Property Printout                |
           -------------------------------------------------

    * Orbital Energies and Occupations

         #    Occupation            Energy/Eh            Energy/eV
      -------------------------------------------------------------
         1        2.0000           -0.7252937             -19.7362
       ...           ...                  ...                  ...
        19        2.0000           -0.4883286             -13.2881
        20        2.0000           -0.4855470             -13.2124
        21        2.0000           -0.4778237             -13.0022
        22        2.0000           -0.4708171             -12.8116
        23        2.0000           -0.4682278             -12.7411
        24        2.0000           -0.4644809             -12.6392
        25        2.0000           -0.4618092             -12.5665
        26        2.0000           -0.4569886             -12.4353
        27        2.0000           -0.4461553             -12.1405
        28        2.0000           -0.4388731             -11.9423
        29        2.0000           -0.4272487             -11.6260
        30        2.0000           -0.3773690             -10.2687
        31        2.0000           -0.3636599              -9.8957 (HOMO)
        32                         -0.2333246              -6.3491 (LUMO)
        33                         -0.2010264              -5.4702
        34                         -0.1537210              -4.1830
        35                         -0.1113637              -3.0304
        36                         -0.0031494              -0.0857
        37                          0.0142659               0.3882
        38                          0.0367302               0.9995
        39                          0.0402927               1.0964
        40                          0.0433708               1.1802
        41                          0.1008423               2.7441
        42                          0.1025229               2.7898
       ...                                ...                  ...
        61                          0.6921737              18.8350
      -------------------------------------------------------------
                  HL-Gap            0.1303354 Eh            3.5466 eV
             Fermi-level           -0.2984923 Eh           -8.1224 eV

     #   Z        covCN         q      C6AA      α(0)
     1   6 C      2.932    -0.070    29.738     8.943
     2  16 S      2.288    -0.044   142.889    20.119
     3   6 C      2.935    -0.058    29.433     8.897
     4   6 C      3.043     0.116    25.410     8.268
     5   6 C      3.052     0.106    25.608     8.299
     6   8 O      1.704    -0.281    18.667     5.833
     7   6 C      3.697     0.088    19.272     6.279
     8   6 C      3.751    -0.113    22.715     6.797
     9   8 O      1.705    -0.275    18.566     5.818
    10   6 C      3.690     0.088    19.302     6.287
    11   6 C      3.751    -0.113    22.726     6.798
    12   1 H      0.927     0.046     2.367     2.406
    13   1 H      0.927     0.060     2.199     2.319
    14   1 H      0.923     0.028     2.615     2.529
    15   1 H      0.923     0.029     2.601     2.522
    16   1 H      0.925     0.056     2.243     2.342
    17   1 H      0.925     0.056     2.242     2.342
    18   1 H      0.925     0.049     2.336     2.390
    19   1 H      0.924     0.033     2.543     2.494
    20   1 H      0.924     0.043     2.412     2.429
    21   1 H      0.925     0.054     2.267     2.355
    22   1 H      0.925     0.045     2.378     2.411
    23   1 H      0.925     0.056     2.251     2.346

 Mol. C6AA /au·bohr⁶  :       6104.654326
 Mol. C8AA /au·bohr⁸  :     157496.295448
 Mol. α(0) /au        :        121.223998


Wiberg/Mayer (AO) data.
largest (>0.10) Wiberg bond orders for each atom
          total WBO             WBO to atom ...
     1  C   3.928        C    5 1.560    S    2 1.163    H   12 0.970    C    3 0.109
     2  S   2.597        C    3 1.170    C    1 1.163
     3  C   3.930        C    4 1.558    S    2 1.170    H   13 0.969    C    1 0.109
     4  C   3.938        C    3 1.558    C    5 1.157    O    9 1.061
     5  C   3.932        C    1 1.560    C    4 1.157    O    6 1.047
     6  O   2.214        C    5 1.047    C    7 0.964
     7  C   3.947        C    8 1.016    H   14 0.969    H   15 0.969    O    6 0.964
     8  C   3.992        C    7 1.016    H   16 0.986    H   17 0.986    H   18 0.985
     9  O   2.216        C    4 1.061    C   10 0.956
    10  C   3.942        C   11 1.016    H   19 0.972    H   20 0.969    O    9 0.956
    11  C   3.992        C   10 1.016    H   21 0.986    H   23 0.986    H   22 0.985
    12  H   0.998        C    1 0.970
    13  H   0.996        C    3 0.969
    14  H   0.999        C    7 0.969
    15  H   0.999        C    7 0.969
    16  H   0.997        C    8 0.986
    17  H   0.997        C    8 0.986
    18  H   0.997        C    8 0.985
    19  H   0.999        C   10 0.972
    20  H   0.998        C   10 0.969
    21  H   0.997        C   11 0.986
    22  H   0.997        C   11 0.985
    23  H   0.997        C   11 0.986

molecular dipole:
                 x           y           z       tot (Debye)
 q only:        0.338       0.832      -0.027
   full:        0.492       1.145      -0.062       3.172
molecular quadrupole (traceless):
                xx          xy          yy          xz          yz          zz
 q only:       -0.835       2.658       0.799       2.470      -2.192       0.036
  q+dip:       -2.542      -0.476       0.541      -0.245      -2.845       2.000
   full:       -2.720      -0.112       0.912       0.156      -2.975       1.808

           -------------------------------------------------
          |                Geometry Summary                 |
           -------------------------------------------------

      molecular mass/u    :      172.2416000
   center of mass at/Å    :        0.5166662      -0.0224255       0.1843553
  moments of inertia/u·Å² :        0.5221240E+03   0.6242889E+03   0.1130440E+04
rotational constants/cm⁻¹ :        0.3228665E-01   0.2700293E-01   0.1491245E-01

 * 23 selected distances

     #   Z        #   Z                                     value/Å
     1   6 C      2  16 S                                 1.7204084 (max)
     2  16 S      3   6 C                                 1.7158083
     3   6 C      4   6 C                                 1.3625268
     1   6 C      5   6 C                                 1.3615142
     4   6 C      5   6 C                                 1.4394682
     5   6 C      6   8 O                                 1.3622993
     6   8 O      7   6 C                                 1.4140491
     7   6 C      8   6 C                                 1.5200016
     4   6 C      9   8 O                                 1.3568145
     9   8 O     10   6 C                                 1.4195385
    10   6 C     11   6 C                                 1.5204612
     1   6 C     12   1 H                                 1.0695735 (min)
     3   6 C     13   1 H                                 1.0699632
     7   6 C     14   1 H                                 1.0989354
     7   6 C     15   1 H                                 1.0988232
     8   6 C     16   1 H                                 1.0864985
     8   6 C     17   1 H                                 1.0865351
     8   6 C     18   1 H                                 1.0857771
    10   6 C     19   1 H                                 1.0969188
    10   6 C     20   1 H                                 1.0960900
    11   6 C     21   1 H                                 1.0867403
    11   6 C     22   1 H                                 1.0864677
    11   6 C     23   1 H                                 1.0865224

 * 4 distinct bonds (by element types)

   Z      Z             #   av. dist./Å        max./Å        min./Å
   1 H    6 C          12     1.0874038     1.0989354     1.0695735
   6 C    6 C           5     1.4407944     1.5204612     1.3615142
   6 C    8 O           4     1.3881753     1.4195385     1.3568145
   6 C   16 S           2     1.7181083     1.7204084     1.7158083


optimized geometry written to: xtbopt.xyz


           -------------------------------------------------
          | TOTAL ENERGY              -34.609690604235 Eh   |
          | GRADIENT NORM               0.000874506204 Eh/α |
          | HOMO-LUMO GAP               3.546606396170 eV   |
           -------------------------------------------------

------------------------------------------------------------------------
 * finished run on 2021/05/19 at 10:59:45.811     
------------------------------------------------------------------------
 total:
 * wall-time:     0 d,  0 h,  0 min,  0.581 sec
 *  cpu-time:     0 d,  0 h,  0 min,  0.579 sec
 * ratio c/w:     0.996 speedup
 SCF:
 * wall-time:     0 d,  0 h,  0 min,  0.032 sec
 *  cpu-time:     0 d,  0 h,  0 min,  0.032 sec
 * ratio c/w:     0.997 speedup
 ANC optimizer:
 * wall-time:     0 d,  0 h,  0 min,  0.529 sec
 *  cpu-time:     0 d,  0 h,  0 min,  0.528 sec
 * ratio c/w:     0.998 speedup

