      -----------------------------------------------------------      
     |                   =====================                   |     
     |                           x T B                           |     
     |                   =====================                   |     
     |                         S. Grimme                         |     
     |          Mulliken Center for Theoretical Chemistry        |     
     |                    University of Bonn                     |     
     |                Version 6.2 RC2 (SAW190805)                |     
      -----------------------------------------------------------      

   This program is distributed in the hope that it will be useful,
   but WITHOUT ANY WARRANTY; without even the implied warranty of
   MERCHANTABILITY or FITNESS FOR A PARTICULAR PURPOSE.
   
   FOR NON-COMMERCIAL, ACADEMIA USE ONLY.
   
   Cite this work as:
   * S. Grimme, C. Bannwarth, P. Shushkov, J. Chem. Theory Comput., 2017,
     13, 1989-2009. DOI: 10.1021/acs.jctc.7b00118
   * C. Bannwarth, S. Ehlert and S. Grimme., J. Chem. Theory Comput., 2019,
     15, 1652-1671. DOI: 10.1021/acs.jctc.8b01176
   * P. Pracht, E. Caldeweyher, S. Ehlert, S. Grimme, ChemRxiv, 2019, preprint.
     DOI: 10.26434/chemrxiv.8326202.v1
   
   for DFT-D4:
   * E. Caldeweyher, C. Bannwarth and S. Grimme, J. Chem. Phys., 2017,
     147, 034112. DOI: 10.1063/1.4993215
   * E. Caldeweyher, S. Ehlert, A. Hansen, H. Neugebauer, S. Spicher,
     C. Bannwarth and S. Grimme, J. Chem. Phys., 2019, 150, 154122.
     DOI: 10.1063/1.5090222
   
   for sTDA-xTB:
   * S. Grimme and C. Bannwarth, J. Chem. Phys., 2016, 145, 054103.
     DOI: 10.1063/1.4959605
   
   in the mass-spec context:
   * V. Asgeirsson, C. Bauer and S. Grimme, Chem. Sci., 2017, 8, 4879.
     DOI: 10.1039/c7sc00601b
   
   for metadynamics refer to:
   * S. Grimme, J. Chem. Theory Comput., 2019, 155, 2847-2862
     DOI: 10.1021/acs.jctc.9b00143
   
   with help from (in alphabetical order)
   C. Bannwarth, F. Bohle, G. Brandenburg, E. Caldeweyher, M. Checinski,
   S. Dohm, S. Ehlert, S. Ehrlich, F. März, H. Neugebauer, J. Pisarek,
   P. Pracht, P. Shushkov, and S. Spicher.
   
 * started run on 2021/05/19 at 10:59:45.830     

           -------------------------------------------------
          |                Calculation Setup                |
           -------------------------------------------------

          program call               : /ihome/ghutchison/geoffh/xtb/xtb 561.xyz -opt
          hostname                   : smp-n144
          coordinate file            : 561.xyz
          omp threads                :                     1
          number of atoms            :                    26
          number of electrons        :                    72
          charge                     :                     0
          spin                       :                   0.0
          first test random number   :      0.94805239540732


########################################################################
# WARNING! Please study the warnings concerning your input carefully
#  - the use of '-opt' is discouraged, please use '--opt' next time
########################################################################

           ------------------------------------------------- 
          |                 G F N 2 - x T B                 |
          | Geometry, Frequencies, Noncovalent interactions |
          |            JCTC 2019 parametrisation            |
           ------------------------------------------------- 
             KAB for C  - Si     :                1.0500
             KAB for H  - Pd     :                0.9500
             k(s)              :                1.8500
             k(p)              :                2.2300
             k(d)              :                2.2300
             k(f)              :                2.0000
             kEN (H0ij)        :               -2.0000
             D4 a1             :                0.5200
             D4 a2             :                5.0000
             D4 s6             :                1.0000
             D4 s8             :                2.7000
             D4 s9             :                5.0000
             alphaj            :                2.0000

  Z AO/shell   Hii/eV     exponent
  1     Wed Apr 25 08:07:45 CEST 2018   EN: 2.200 GM2: 0.406  GM3: 0.0800  RAES: 1.40
     1s    -10.707211    1.230000
  6     Wed Apr 25 08:07:45 CEST 2018   EN: 2.550 GM2: 0.538  GM3: 0.1500  RAES: 3.00
     2s    -13.970922    2.096432
     2p    -10.063292    1.800000
 16     Tue Apr 24 11:44:34 CEST 2018   EN: 2.580 GM2: 0.340  GM3:-0.0502  RAES: 3.10
     3s    -20.029654    1.981333
     3p    -11.377694    2.025643
     3d     -0.420282    1.702555

           ------------------------------------------------- 
          |        Self-Consistent Charge Iterations        |
           ------------------------------------------------- 

          ...................................................
          :                      SETUP                      :
          :.................................................:
          :  # basis functions                  80          :
          :  # atomic orbitals                  78          :
          :  # shells                           42          :
          :  # electrons                        72          :
          :  max. iterations                   250          :
          :  Hamiltonian                  GFN2-xTB          :
          :  restarted?                      false          :
          :  GBSA solvation                  false          :
          :  PC potential                    false          :
          :  electronic temp.          300.0000000     K    :
          :  accuracy                    1.0000000          :
          :  -> integral cutoff          0.2500000E+02      :
          :  -> integral neglect         0.1000000E-07      :
          :  -> SCF convergence          0.1000000E-05 Eh   :
          :  -> wf. convergence          0.1000000E-03 e    :
          :  Broyden damping             0.4000000          :
          ...................................................

 iter      E             dE          RMSdq      gap      omega  full diag
   1    -38.8042536 -0.388043E+02  0.481E+00    3.25       0.0  T
   2    -38.8458851 -0.416315E-01  0.269E+00    2.75       1.0  T
   3    -38.8457679  0.117138E-03  0.789E-01    2.60       1.0  T
   4    -38.8485510 -0.278307E-02  0.360E-01    2.70       1.0  T
   5    -38.8485458  0.522884E-05  0.188E-01    2.66       1.0  T
   6    -38.8489804 -0.434664E-03  0.643E-02    2.68       1.0  T
   7    -38.8490321 -0.516177E-04  0.244E-02    2.68       1.0  T
   8    -38.8490373 -0.523333E-05  0.134E-02    2.68       1.5  T
   9    -38.8490386 -0.129410E-05  0.419E-03    2.68       4.7  T
  10    -38.8490387 -0.986389E-07  0.167E-03    2.68      11.8  T
  11    -38.8490387 -0.265178E-07  0.680E-04    2.68      28.8  T
  12    -38.8490387 -0.502732E-08  0.326E-04    2.68      60.1  T

   *** convergence criteria satisfied after 12 iterations ***

         #    Occupation            Energy/Eh            Energy/eV
      -------------------------------------------------------------
         1        2.0000           -0.7134790             -19.4148
       ...           ...                  ...                  ...
        30        2.0000           -0.4433741             -12.0648
        31        2.0000           -0.4287315             -11.6664
        32        2.0000           -0.4265520             -11.6071
        33        2.0000           -0.4115180             -11.1980
        34        2.0000           -0.4017956             -10.9334
        35        2.0000           -0.3614422              -9.8353
        36        2.0000           -0.3478334              -9.4650 (HOMO)
        37                         -0.2492176              -6.7816 (LUMO)
        38                         -0.2301520              -6.2628
        39                         -0.2165171              -5.8917
        40                         -0.1982514              -5.3947
        41                         -0.1912543              -5.2043
       ...                                ...                  ...
        78                          0.6662018              18.1283
      -------------------------------------------------------------
                  HL-Gap            0.0986157 Eh            2.6835 eV
             Fermi-level           -0.2985255 Eh           -8.1233 eV

 SCC (total)                   0 d,  0 h,  0 min,  0.049 sec
 SCC setup                      ...        0 min,  0.000 sec (  0.662%)
 Dispersion                     ...        0 min,  0.000 sec (  0.803%)
 integral evaluation            ...        0 min,  0.012 sec ( 24.250%)
 zeroth order Hamiltonian       ...        0 min,  0.000 sec (  0.475%)
 iterations                     ...        0 min,  0.017 sec ( 35.764%)
 molecular gradient             ...        0 min,  0.018 sec ( 37.067%)
 printout                       ...        0 min,  0.000 sec (  0.867%)

         :::::::::::::::::::::::::::::::::::::::::::::::::::::
         ::                     SUMMARY                     ::
         :::::::::::::::::::::::::::::::::::::::::::::::::::::
         :: total energy             -38.291593559982 Eh    ::
         :: gradient norm              0.051533287073 Eh/a0 ::
         :: HOMO-LUMO gap              2.683470849631 eV    ::
         ::.................................................::
         :: SCC energy               -38.849038719249 Eh    ::
         :: -> isotropic ES            0.005045689421 Eh    ::
         :: -> anisotropic ES          0.005144360845 Eh    ::
         :: -> anisotropic XC          0.023863456945 Eh    ::
         :: -> dispersion             -0.029568850105 Eh    ::
         :: repulsion energy           0.557317571395 Eh    ::
         :: add. restraining           0.000000000000 Eh    ::
         :::::::::::::::::::::::::::::::::::::::::::::::::::::

      ----------------------------------------------------------- 
     |                   =====================                   |
     |                        A N C O P T                        |
     |                   =====================                   |
     |               Approximate Normal Coordinate               |
     |                Rational Function Optimizer                |
      ----------------------------------------------------------- 

          ...................................................
          :                      SETUP                      :
          :.................................................:
          :   optimization level            normal          :
          :   max. optcycles                   200          :
          :   ANC micro-cycles                  20          :
          :   degrees of freedom                72          :
          :.................................................:
          :   RF solver                   davidson          :
          :   input Hessian                  false          :
          :   write xtbopt.log                true          :
          :   linear?                        false          :
          :   energy convergence         0.5000000E-05 Eh   :
          :   grad. convergence          0.1000000E-02 Eh/α :
          :   maximium RF displ.         2.0000000          :
          :   Hlow (freq-cutoff)         0.5000000E-02      :
          :   Hmax (freq-cutoff)         5.0000000          :
          :   S6 in model hess.         20.0000000          :
          ...................................................

generating ANC from model Hessian ...
Using Lindh-Hessian (1995)
 Shifting diagonal of input Hessian by   2.848015245005379E-003
 Lowest  eigenvalues of input Hessian
   -0.000000   -0.000000   -0.000000   -0.000000    0.000000    0.000000
    0.005000    0.005452    0.005814    0.007685    0.008463    0.012111
    0.013003    0.015238    0.017495    0.023517    0.028206    0.031255
 Highest eigenvalues
    1.486034    1.655001    1.830944    1.877683    1.958668    2.019683
 

........................................................................
.............................. CYCLE    1 ..............................
........................................................................
   1    -38.8490387 -0.388490E+02  0.167E-04    2.68       0.0  T
   2    -38.8490387 -0.122562E-09  0.115E-04    2.68     170.5  T
   3    -38.8490387 -0.114390E-09  0.729E-05    2.68     269.0  T
     SCC iter.                  ...        0 min,  0.005 sec
     gradient                   ...        0 min,  0.018 sec
 * total energy  :   -38.2915936 Eh     change       -0.8479070E-08 Eh
   gradient norm :     0.0515334 Eh/α   predicted     0.0000000E+00 (-100.00%)
   displ. norm   :     0.3166762 α      lambda       -0.8320519E-02
   maximum displ.:     0.1466813 α      in ANC's #8, #12, #20, ...

........................................................................
.............................. CYCLE    2 ..............................
........................................................................
   1    -38.8687571 -0.388688E+02  0.198E-01    2.67       0.0  T
   2    -38.8688203 -0.631722E-04  0.116E-01    2.67       1.0  T
   3    -38.8688072  0.130637E-04  0.625E-02    2.66       1.0  T
   4    -38.8688467 -0.394947E-04  0.156E-02    2.66       1.3  T
   5    -38.8688500 -0.325840E-05  0.764E-03    2.67       2.6  T
   6    -38.8688509 -0.926660E-06  0.260E-03    2.67       7.5  T
   7    -38.8688509 -0.371471E-07  0.137E-03    2.66      14.3  T
     SCC iter.                  ...        0 min,  0.010 sec
     gradient                   ...        0 min,  0.017 sec
 * total energy  :   -38.2972622 Eh     change       -0.5668663E-02 Eh
   gradient norm :     0.0209151 Eh/α   predicted    -0.4577477E-02 ( -19.25%)
   displ. norm   :     0.2971945 α      lambda       -0.2699050E-02
   maximum displ.:     0.1841547 α      in ANC's #8, #12, #6, ...

........................................................................
.............................. CYCLE    3 ..............................
........................................................................
   1    -38.8759759 -0.388760E+02  0.196E-01    2.66       0.0  T
   2    -38.8760011 -0.252300E-04  0.106E-01    2.65       1.0  T
   3    -38.8759804  0.206919E-04  0.459E-02    2.65       1.0  T
   4    -38.8760106 -0.301533E-04  0.164E-02    2.65       1.2  T
   5    -38.8760118 -0.124170E-05  0.773E-03    2.65       2.5  T
   6    -38.8760128 -0.988573E-06  0.297E-03    2.65       6.6  T
   7    -38.8760129 -0.506895E-07  0.165E-03    2.65      11.9  T
     SCC iter.                  ...        0 min,  0.010 sec
     gradient                   ...        0 min,  0.017 sec
 * total energy  :   -38.2989151 Eh     change       -0.1652820E-02 Eh
   gradient norm :     0.0078067 Eh/α   predicted    -0.1468727E-02 ( -11.14%)
   displ. norm   :     0.1938613 α      lambda       -0.4715769E-03
   maximum displ.:     0.1222745 α      in ANC's #8, #3, #6, ...

........................................................................
.............................. CYCLE    4 ..............................
........................................................................
   1    -38.8750572 -0.388751E+02  0.105E-01    2.64       0.0  T
   2    -38.8750614 -0.418376E-05  0.567E-02    2.64       1.0  T
   3    -38.8750585  0.289796E-05  0.167E-02    2.64       1.2  T
   4    -38.8750623 -0.382734E-05  0.835E-03    2.64       2.4  T
   5    -38.8750628 -0.491227E-06  0.260E-03    2.64       7.6  T
   6    -38.8750629 -0.611293E-07  0.139E-03    2.64      14.1  T
     SCC iter.                  ...        0 min,  0.008 sec
     gradient                   ...        0 min,  0.017 sec
 * total energy  :   -38.2992206 Eh     change       -0.3055654E-03 Eh
   gradient norm :     0.0033957 Eh/α   predicted    -0.2446505E-03 ( -19.94%)
   displ. norm   :     0.1938249 α      lambda        0.6052001E-04
   maximum displ.:     0.1222666 α      in ANC's #8, #3, #6, ...

........................................................................
.............................. CYCLE    5 ..............................
........................................................................
   1    -38.8732223 -0.388732E+02  0.106E-01    2.64       0.0  T
   2    -38.8732266 -0.426097E-05  0.568E-02    2.63       1.0  T
   3    -38.8732239  0.274100E-05  0.165E-02    2.63       1.2  T
   4    -38.8732275 -0.363106E-05  0.837E-03    2.63       2.3  T
   5    -38.8732280 -0.508353E-06  0.255E-03    2.63       7.7  T
   6    -38.8732281 -0.564238E-07  0.138E-03    2.63      14.3  T
   7    -38.8732281 -0.702318E-08  0.777E-04    2.63      25.3  T
   8    -38.8732281 -0.166302E-08  0.259E-04    2.63      75.7  T
     SCC iter.                  ...        0 min,  0.011 sec
     gradient                   ...        0 min,  0.018 sec
 * total energy  :   -38.2991882 Eh     change        0.3244244E-04 Eh
   gradient norm :     0.0072625 Eh/α   predicted     0.3139649E-04 (  -3.22%)
   displ. norm   :     0.0873711 α      lambda       -0.2343697E-03
   maximum displ.:     0.0628861 α      in ANC's #8, #10, #12, ...

........................................................................
.............................. CYCLE    6 ..............................
........................................................................
   1    -38.8744533 -0.388745E+02  0.599E-02    2.63       0.0  T
   2    -38.8744554 -0.202197E-05  0.322E-02    2.63       1.0  T
   3    -38.8744533  0.210597E-05  0.122E-02    2.63       1.6  T
   4    -38.8744559 -0.267091E-05  0.506E-03    2.63       3.9  T
   5    -38.8744561 -0.194729E-06  0.218E-03    2.63       9.0  T
   6    -38.8744562 -0.346798E-07  0.950E-04    2.63      20.6  T
     SCC iter.                  ...        0 min,  0.009 sec
     gradient                   ...        0 min,  0.017 sec
 * total energy  :   -38.2993401 Eh     change       -0.1518933E-03 Eh
   gradient norm :     0.0031272 Eh/α   predicted    -0.1180805E-03 ( -22.26%)
   displ. norm   :     0.1217800 α      lambda       -0.1406391E-03
   maximum displ.:     0.0644948 α      in ANC's #6, #3, #8, ...

........................................................................
.............................. CYCLE    7 ..............................
........................................................................
   1    -38.8750122 -0.388750E+02  0.104E-01    2.62       0.0  T
   2    -38.8750160 -0.380490E-05  0.532E-02    2.63       1.0  T
   3    -38.8750147  0.131637E-05  0.122E-02    2.63       1.6  T
   4    -38.8750166 -0.195983E-05  0.705E-03    2.63       2.8  T
   5    -38.8750171 -0.458586E-06  0.197E-03    2.63      10.0  T
   6    -38.8750171 -0.512300E-07  0.764E-04    2.63      25.7  T
   7    -38.8750171 -0.766249E-08  0.363E-04    2.63      54.0  T
     SCC iter.                  ...        0 min,  0.009 sec
     gradient                   ...        0 min,  0.018 sec
 * total energy  :   -38.2994463 Eh     change       -0.1062574E-03 Eh
   gradient norm :     0.0019984 Eh/α   predicted    -0.7136811E-04 ( -32.83%)
   displ. norm   :     0.4490335 α      lambda       -0.2416846E-03
   maximum displ.:     0.2702207 α      in ANC's #6, #3, #4, ...

........................................................................
.............................. CYCLE    8 ..............................
........................................................................
   1    -38.8728116 -0.388728E+02  0.402E-01    2.58       0.0  T
   2    -38.8728616 -0.500165E-04  0.203E-01    2.59       1.0  T
   3    -38.8728665 -0.490854E-05  0.360E-02    2.59       1.0  T
   4    -38.8728633  0.321227E-05  0.243E-02    2.59       1.0  T
   5    -38.8728741 -0.107591E-04  0.442E-03    2.59       4.4  T
   6    -38.8728744 -0.290724E-06  0.170E-03    2.59      11.6  T
   7    -38.8728744 -0.230513E-07  0.834E-04    2.59      23.5  T
   8    -38.8728744 -0.374710E-08  0.327E-04    2.59      60.0  T
     SCC iter.                  ...        0 min,  0.011 sec
     gradient                   ...        0 min,  0.018 sec
 * total energy  :   -38.2996580 Eh     change       -0.2116487E-03 Eh
   gradient norm :     0.0080503 Eh/α   predicted    -0.1316730E-03 ( -37.79%)
   displ. norm   :     0.2237187 α      lambda       -0.2100634E-03
   maximum displ.:     0.1533294 α      in ANC's #6, #3, #4, ...

........................................................................
.............................. CYCLE    9 ..............................
........................................................................
   1    -38.8725054 -0.388725E+02  0.204E-01    2.58       0.0  T
   2    -38.8725191 -0.137726E-04  0.101E-01    2.58       1.0  T
   3    -38.8725213 -0.219384E-05  0.175E-02    2.58       1.1  T
   4    -38.8725209  0.472285E-06  0.106E-02    2.58       1.9  T
   5    -38.8725225 -0.164497E-05  0.169E-03    2.58      11.6  T
   6    -38.8725226 -0.460327E-07  0.795E-04    2.58      24.7  T
     SCC iter.                  ...        0 min,  0.008 sec
     gradient                   ...        0 min,  0.017 sec
 * total energy  :   -38.2998239 Eh     change       -0.1659104E-03 Eh
   gradient norm :     0.0077440 Eh/α   predicted    -0.1102906E-03 ( -33.52%)
   displ. norm   :     0.2947189 α      lambda       -0.3445188E-03
   maximum displ.:     0.2155621 α      in ANC's #6, #3, #7, ...

........................................................................
.............................. CYCLE   10 ..............................
........................................................................
   1    -38.8745304 -0.388745E+02  0.276E-01    2.58       0.0  T
   2    -38.8745584 -0.280532E-04  0.135E-01    2.57       1.0  T
   3    -38.8745537  0.467840E-05  0.297E-02    2.58       1.0  T
   4    -38.8745642 -0.104992E-04  0.167E-02    2.57       1.2  T
   5    -38.8745664 -0.215277E-05  0.418E-03    2.57       4.7  T
   6    -38.8745667 -0.282465E-06  0.150E-03    2.57      13.1  T
   7    -38.8745667 -0.286807E-07  0.643E-04    2.57      30.5  T
     SCC iter.                  ...        0 min,  0.010 sec
     gradient                   ...        0 min,  0.017 sec
 * total energy  :   -38.3000537 Eh     change       -0.2298654E-03 Eh
   gradient norm :     0.0044934 Eh/α   predicted    -0.1872372E-03 ( -18.54%)
   displ. norm   :     0.3188802 α      lambda       -0.1918096E-03
   maximum displ.:     0.2305997 α      in ANC's #6, #3, #5, ...

........................................................................
.............................. CYCLE   11 ..............................
........................................................................
   1    -38.8725832 -0.388726E+02  0.282E-01    2.56       0.0  T
   2    -38.8726104 -0.271543E-04  0.139E-01    2.56       1.0  T
   3    -38.8726095  0.873044E-06  0.281E-02    2.56       1.0  T
   4    -38.8726142 -0.472297E-05  0.172E-02    2.55       1.1  T
   5    -38.8726176 -0.342792E-05  0.221E-03    2.56       8.9  T
   6    -38.8726177 -0.399136E-07  0.101E-03    2.56      19.4  T
   7    -38.8726177 -0.760217E-08  0.533E-04    2.56      36.8  T
     SCC iter.                  ...        0 min,  0.010 sec
     gradient                   ...        0 min,  0.017 sec
 * total energy  :   -38.3001705 Eh     change       -0.1167331E-03 Eh
   gradient norm :     0.0056083 Eh/α   predicted    -0.1056577E-03 (  -9.49%)
   displ. norm   :     0.1877530 α      lambda       -0.1365613E-03
   maximum displ.:     0.1518578 α      in ANC's #6, #7, #1, ...

........................................................................
.............................. CYCLE   12 ..............................
........................................................................
   1    -38.8745519 -0.388746E+02  0.165E-01    2.56       0.0  T
   2    -38.8745615 -0.962067E-05  0.802E-02    2.55       1.0  T
   3    -38.8745616 -0.109036E-06  0.162E-02    2.55       1.2  T
   4    -38.8745627 -0.102267E-05  0.101E-02    2.55       2.0  T
   5    -38.8745640 -0.132977E-05  0.127E-03    2.55      15.5  T
   6    -38.8745640 -0.182702E-07  0.573E-04    2.55      34.2  T
     SCC iter.                  ...        0 min,  0.008 sec
     gradient                   ...        0 min,  0.016 sec
 * total energy  :   -38.3002638 Eh     change       -0.9331452E-04 Eh
   gradient norm :     0.0040105 Eh/α   predicted    -0.7068844E-04 ( -24.25%)
   displ. norm   :     0.2556960 α      lambda       -0.1116749E-03
   maximum displ.:     0.1865540 α      in ANC's #6, #1, #5, ...

........................................................................
.............................. CYCLE   13 ..............................
........................................................................
   1    -38.8744878 -0.388745E+02  0.236E-01    2.55       0.0  T
   2    -38.8745073 -0.195371E-04  0.113E-01    2.55       1.0  T
   3    -38.8745098 -0.244777E-05  0.202E-02    2.55       1.0  T
   4    -38.8745093  0.467013E-06  0.129E-02    2.55       1.5  T
   5    -38.8745120 -0.271075E-05  0.181E-03    2.55      10.8  T
   6    -38.8745120 -0.383585E-07  0.846E-04    2.55      23.2  T
     SCC iter.                  ...        0 min,  0.008 sec
     gradient                   ...        0 min,  0.017 sec
 * total energy  :   -38.3003278 Eh     change       -0.6396369E-04 Eh
   gradient norm :     0.0045068 Eh/α   predicted    -0.5948957E-04 (  -6.99%)
   displ. norm   :     0.0935501 α      lambda       -0.7796037E-04
   maximum displ.:     0.0451212 α      in ANC's #6, #4, #1, ...

........................................................................
.............................. CYCLE   14 ..............................
........................................................................
   1    -38.8775796 -0.388776E+02  0.707E-02    2.55       0.0  T
   2    -38.8775817 -0.213362E-05  0.344E-02    2.55       1.0  T
   3    -38.8775812  0.528064E-06  0.927E-03    2.55       2.1  T
   4    -38.8775821 -0.862003E-06  0.529E-03    2.55       3.7  T
   5    -38.8775823 -0.207751E-06  0.146E-03    2.55      13.4  T
   6    -38.8775823 -0.257835E-07  0.410E-04    2.55      47.8  T
     SCC iter.                  ...        0 min,  0.008 sec
     gradient                   ...        0 min,  0.017 sec
 * total energy  :   -38.3003637 Eh     change       -0.3596502E-04 Eh
   gradient norm :     0.0034037 Eh/α   predicted    -0.3932243E-04 (   9.34%)
   displ. norm   :     0.1534029 α      lambda       -0.5089113E-04
   maximum displ.:     0.0974545 α      in ANC's #6, #2, #1, ...

........................................................................
.............................. CYCLE   15 ..............................
........................................................................
   1    -38.8758580 -0.388759E+02  0.157E-01    2.54       0.0  T
   2    -38.8758670 -0.898936E-05  0.735E-02    2.55       1.0  T
   3    -38.8758688 -0.185872E-05  0.117E-02    2.55       1.7  T
   4    -38.8758685  0.359520E-06  0.517E-03    2.55       3.8  T
   5    -38.8758689 -0.472337E-06  0.128E-03    2.55      15.3  T
   6    -38.8758690 -0.268047E-07  0.531E-04    2.55      36.9  T
   7    -38.8758690 -0.120241E-08  0.258E-04    2.55      76.2  T
     SCC iter.                  ...        0 min,  0.010 sec
     gradient                   ...        0 min,  0.018 sec
 * total energy  :   -38.3003818 Eh     change       -0.1808622E-04 Eh
   gradient norm :     0.0040922 Eh/α   predicted    -0.2604730E-04 (  44.02%)
   displ. norm   :     0.0515508 α      lambda       -0.4566335E-04
   maximum displ.:     0.0241408 α      in ANC's #6, #4, #1, ...

........................................................................
.............................. CYCLE   16 ..............................
........................................................................
   1    -38.8762250 -0.388762E+02  0.325E-02    2.55       0.0  T
   2    -38.8762252 -0.231182E-06  0.181E-02    2.55       1.1  T
   3    -38.8762251  0.118345E-06  0.404E-03    2.55       4.9  T
   4    -38.8762252 -0.152797E-06  0.192E-03    2.55      10.2  T
   5    -38.8762252 -0.222032E-07  0.704E-04    2.55      27.8  T
     SCC iter.                  ...        0 min,  0.007 sec
     gradient                   ...        0 min,  0.017 sec
 * total energy  :   -38.3004160 Eh     change       -0.3419167E-04 Eh
   gradient norm :     0.0020559 Eh/α   predicted    -0.2289303E-04 ( -33.05%)
   displ. norm   :     0.1270832 α      lambda       -0.5554669E-04
   maximum displ.:     0.0588491 α      in ANC's #4, #1, #2, ...

........................................................................
.............................. CYCLE   17 ..............................
........................................................................
   1    -38.8764107 -0.388764E+02  0.852E-02    2.55       0.0  T
   2    -38.8764128 -0.209913E-05  0.437E-02    2.55       1.0  T
   3    -38.8764127  0.146073E-06  0.968E-03    2.55       2.0  T
   4    -38.8764131 -0.413238E-06  0.549E-03    2.55       3.6  T
   5    -38.8764134 -0.265285E-06  0.109E-03    2.55      18.0  T
   6    -38.8764134 -0.257732E-07  0.406E-04    2.55      48.3  T
   7    -38.8764134 -0.106323E-08  0.219E-04    2.55      89.7  T
     SCC iter.                  ...        0 min,  0.009 sec
     gradient                   ...        0 min,  0.018 sec
 * total energy  :   -38.3004522 Eh     change       -0.3622411E-04 Eh
   gradient norm :     0.0029188 Eh/α   predicted    -0.2822372E-04 ( -22.09%)
   displ. norm   :     0.1268949 α      lambda        0.4923910E-05
   maximum displ.:     0.0588489 α      in ANC's #4, #1, #2, ...

........................................................................
.............................. CYCLE   18 ..............................
........................................................................
   1    -38.8762642 -0.388763E+02  0.855E-02    2.55       0.0  T
   2    -38.8762663 -0.209573E-05  0.438E-02    2.55       1.0  T
   3    -38.8762661  0.161842E-06  0.972E-03    2.55       2.0  T
   4    -38.8762665 -0.411681E-06  0.556E-03    2.55       3.5  T
   5    -38.8762668 -0.279979E-06  0.119E-03    2.55      16.5  T
   6    -38.8762668 -0.306431E-07  0.409E-04    2.55      47.9  T
   7    -38.8762668 -0.928416E-09  0.220E-04    2.55      89.0  T
     SCC iter.                  ...        0 min,  0.009 sec
     gradient                   ...        0 min,  0.018 sec
 * total energy  :   -38.3004496 Eh     change        0.2592988E-05 Eh
   gradient norm :     0.0051670 Eh/α   predicted     0.2500764E-05 (  -3.56%)
   displ. norm   :     0.0284992 α      lambda       -0.4486873E-04
   maximum displ.:     0.0150615 α      in ANC's #7, #5, #3, ...

........................................................................
.............................. CYCLE   19 ..............................
........................................................................
   1    -38.8763129 -0.388763E+02  0.285E-02    2.55       0.0  T
   2    -38.8763133 -0.347524E-06  0.141E-02    2.55       1.4  T
   3    -38.8763133  0.390941E-08  0.340E-03    2.55       5.8  T
   4    -38.8763134 -0.866902E-07  0.169E-03    2.55      11.6  T
   5    -38.8763134 -0.857398E-09  0.811E-04    2.55      24.2  T
     SCC iter.                  ...        0 min,  0.007 sec
     gradient                   ...        0 min,  0.017 sec
 * total energy  :   -38.3004743 Eh     change       -0.2467760E-04 Eh
   gradient norm :     0.0031984 Eh/α   predicted    -0.2245946E-04 (  -8.99%)
   displ. norm   :     0.0640074 α      lambda       -0.2954451E-04
   maximum displ.:     0.0402354 α      in ANC's #6, #1, #7, ...

........................................................................
.............................. CYCLE   20 ..............................
........................................................................
   1    -38.8760623 -0.388761E+02  0.493E-02    2.55       0.0  T
   2    -38.8760633 -0.957042E-06  0.243E-02    2.55       1.0  T
   3    -38.8760631  0.123677E-06  0.598E-03    2.55       3.3  T
   4    -38.8760634 -0.269577E-06  0.336E-03    2.55       5.8  T
   5    -38.8760635 -0.814206E-07  0.105E-03    2.55      18.7  T
   6    -38.8760635 -0.149860E-07  0.318E-04    2.55      61.7  T
   7    -38.8760635 -0.135726E-08  0.156E-04    2.55     126.0  T
     SCC iter.                  ...        0 min,  0.010 sec
     gradient                   ...        0 min,  0.018 sec
 * total energy  :   -38.3004912 Eh     change       -0.1685263E-04 Eh
   gradient norm :     0.0016223 Eh/α   predicted    -0.1483793E-04 ( -11.95%)
   displ. norm   :     0.1197790 α      lambda       -0.1940746E-04
   maximum displ.:     0.0654608 α      in ANC's #5, #4, #1, ...
 * RMSD in coord.:     0.4832820 α      energy gain  -0.8897605E-02 Eh

generating ANC from model Hessian ...
Using Lindh-Hessian (1995)
 Shifting diagonal of input Hessian by   2.807830001430205E-003
 Lowest  eigenvalues of input Hessian
   -0.000000   -0.000000   -0.000000   -0.000000    0.000000    0.000000
    0.005000    0.005526    0.006182    0.008018    0.008422    0.012300
    0.013451    0.015534    0.018361    0.025420    0.030388    0.033654
 Highest eigenvalues
    1.554420    1.651942    1.850934    1.904717    1.994662    2.053788
 

........................................................................
.............................. CYCLE   21 ..............................
........................................................................
   1    -38.8759731 -0.388760E+02  0.663E-02    2.56       0.0  T
   2    -38.8759741 -0.969752E-06  0.362E-02    2.55       1.0  T
   3    -38.8759731  0.104580E-05  0.886E-03    2.56       2.2  T
   4    -38.8759743 -0.127162E-05  0.410E-03    2.55       4.8  T
   5    -38.8759745 -0.144172E-06  0.997E-04    2.55      19.7  T
   6    -38.8759745 -0.146401E-07  0.406E-04    2.55      48.3  T
     SCC iter.                  ...        0 min,  0.008 sec
     gradient                   ...        0 min,  0.018 sec
 * total energy  :   -38.3005056 Eh     change       -0.1442453E-04 Eh
   gradient norm :     0.0022636 Eh/α   predicted     0.0000000E+00 (-100.00%)
   displ. norm   :     0.0326086 α      lambda       -0.1246092E-04
   maximum displ.:     0.0235904 α      in ANC's #2, #1, #3, ...

........................................................................
.............................. CYCLE   22 ..............................
........................................................................
   1    -38.8760483 -0.388760E+02  0.286E-02    2.56       0.0  T
   2    -38.8760486 -0.274942E-06  0.140E-02    2.56       1.4  T
   3    -38.8760486 -0.296229E-07  0.273E-03    2.56       7.2  T
   4    -38.8760486  0.234564E-07  0.178E-03    2.56      11.0  T
   5    -38.8760486 -0.553043E-07  0.296E-04    2.56      66.2  T
   6    -38.8760486 -0.120355E-08  0.123E-04    2.56     159.2  T
     SCC iter.                  ...        0 min,  0.008 sec
     gradient                   ...        0 min,  0.018 sec
 * total energy  :   -38.3005152 Eh     change       -0.9606018E-05 Eh
   gradient norm :     0.0008540 Eh/α   predicted    -0.6237551E-05 ( -35.07%)
   displ. norm   :     0.0483292 α      lambda       -0.3014663E-05
   maximum displ.:     0.0353722 α      in ANC's #2, #1, #3, ...

........................................................................
.............................. CYCLE   23 ..............................
........................................................................
   1    -38.8761132 -0.388761E+02  0.424E-02    2.56       0.0  T
   2    -38.8761138 -0.608485E-06  0.207E-02    2.56       1.0  T
   3    -38.8761138 -0.804882E-07  0.397E-03    2.56       4.9  T
   4    -38.8761138  0.590547E-07  0.244E-03    2.56       8.1  T
   5    -38.8761139 -0.111477E-06  0.417E-04    2.56      47.1  T
   6    -38.8761139 -0.260199E-08  0.170E-04    2.56     115.6  T
     SCC iter.                  ...        0 min,  0.008 sec
     gradient                   ...        0 min,  0.018 sec
 * total energy  :   -38.3005189 Eh     change       -0.3730065E-05 Eh
   gradient norm :     0.0016437 Eh/α   predicted    -0.1512332E-05 ( -59.46%)
   displ. norm   :     0.0230285 α      lambda       -0.4950043E-05
   maximum displ.:     0.0129563 α      in ANC's #1, #2, #3, ...

........................................................................
.............................. CYCLE   24 ..............................
........................................................................
   1    -38.8760536 -0.388761E+02  0.155E-02    2.56       0.0  T
   2    -38.8760536 -0.603333E-07  0.808E-03    2.56       2.4  T
   3    -38.8760537 -0.602559E-08  0.150E-03    2.56      13.0  T
   4    -38.8760537 -0.348010E-09  0.819E-04    2.56      23.9  T
   5    -38.8760537 -0.844165E-08  0.164E-04    2.56     119.7  T
     SCC iter.                  ...        0 min,  0.007 sec
     gradient                   ...        0 min,  0.018 sec
 * total energy  :   -38.3005241 Eh     change       -0.5186462E-05 Eh
   gradient norm :     0.0010554 Eh/α   predicted    -0.2476266E-05 ( -52.26%)
   displ. norm   :     0.0419025 α      lambda       -0.4507158E-05
   maximum displ.:     0.0261511 α      in ANC's #1, #3, #4, ...

........................................................................
.............................. CYCLE   25 ..............................
........................................................................
   1    -38.8760339 -0.388760E+02  0.272E-02    2.56       0.0  T
   2    -38.8760341 -0.149490E-06  0.146E-02    2.56       1.3  T
   3    -38.8760341 -0.291394E-10  0.254E-03    2.56       7.7  T
   4    -38.8760341 -0.463707E-08  0.150E-03    2.56      13.1  T
   5    -38.8760341 -0.364895E-07  0.189E-04    2.56     103.9  T
   6    -38.8760341 -0.479545E-09  0.850E-05    2.56     230.8  T
     SCC iter.                  ...        0 min,  0.008 sec
     gradient                   ...        0 min,  0.018 sec
 * total energy  :   -38.3005282 Eh     change       -0.4057967E-05 Eh
   gradient norm :     0.0005567 Eh/α   predicted    -0.2260297E-05 ( -44.30%)
   displ. norm   :     0.0451544 α      lambda       -0.3088497E-05
   maximum displ.:     0.0299825 α      in ANC's #1, #3, #4, ...

   *** GEOMETRY OPTIMIZATION CONVERGED AFTER 25 ITERATIONS ***

------------------------------------------------------------------------
 total energy gain   :        -0.0089346 Eh       -5.6066 kcal/mol
 total RMSD          :         0.4794008 a0        0.2537 Å
 total power (kW/mol):        -0.9383126 (step)  -23.8455 (real)
------------------------------------------------------------------------

 ANCopt (total)                0 d,  0 h,  0 min,  0.984 sec
 optimizer setup                ...        0 min,  0.000 sec (  0.015%)
 model hessian                  ...        0 min,  0.010 sec (  1.013%)
 ANC generation                 ...        0 min,  0.001 sec (  0.150%)
 coordinate transformation      ...        0 min,  0.000 sec (  0.048%)
 single point calculation       ...        0 min,  0.962 sec ( 97.781%)
 optimization log               ...        0 min,  0.003 sec (  0.266%)
 hessian update                 ...        0 min,  0.000 sec (  0.036%)
 rational function              ...        0 min,  0.005 sec (  0.525%)

================
 final structure:
================
$coord
    1.28432942843244   -3.47377223634798    0.06789953688102      C 
    2.60852691382162   -1.24537359250208   -0.13922418403620      C 
    1.32220811634507    1.04589166006804   -0.36335630047137      C 
    3.30766013346491    3.68174844347379   -0.59950977652074      S 
    6.05470071159746    1.77512898531241    0.32848064213743      C 
    5.43173575757962   -0.97715286858965   -0.26109974574358      C 
   -1.29052458556240    1.05767108306940   -0.38637825675155      C 
   -2.63349782328671   -1.19843303286828   -0.18758069647391      C 
   -5.45158352659395   -0.84417701599828   -0.30569838798421      C 
   -6.00548387155632    1.93345406429173    0.23612689862416      C 
   -3.19929460511213    3.75373001153801   -0.66337560154815      S 
   -1.36530718361406   -3.49676167621660    0.04448238856512      C 
   -2.77723700434614   -5.85940899159028    0.20322980587582      C 
   -1.92753108008725   -8.01191349226484    1.17286740844475      C 
    2.30349355112334   -5.23397312831101    0.19876879919839      H 
    6.33763085111419    2.07337836917603    2.34834017522038      H 
    7.69233333424258    2.47381573276034   -0.69708175722756      H 
    6.37809927176574   -2.24126326316392    1.06405231072898      H 
    6.06225137519731   -1.46306586564263   -2.17070839113803      H 
   -6.43277396213765   -2.03807386658356    1.05836483043828      H 
   -6.11007826425729   -1.35011135935429   -2.20169591580095      H 
   -6.31647130584621    2.26349433645581    2.24703283993314      H 
   -7.60860038307040    2.66005564375488   -0.82458136385720      H 
   -4.67857679828858   -5.79482813420204   -0.54611136832841      H 
   -0.07361639367332   -8.18847353791407    1.99192089183892      H 
   -3.07962849047716   -9.68808080517208    1.20271896454950      H 
$end
           -------------------------------------------------
          |                Final Singlepoint                |
           -------------------------------------------------

          ...................................................
          :                      SETUP                      :
          :.................................................:
          :  # basis functions                  80          :
          :  # atomic orbitals                  78          :
          :  # shells                           42          :
          :  # electrons                        72          :
          :  max. iterations                   250          :
          :  Hamiltonian                  GFN2-xTB          :
          :  restarted?                      false          :
          :  GBSA solvation                  false          :
          :  PC potential                    false          :
          :  electronic temp.          300.0000000     K    :
          :  accuracy                    1.0000000          :
          :  -> integral cutoff          0.2500000E+02      :
          :  -> integral neglect         0.1000000E-07      :
          :  -> SCF convergence          0.1000000E-05 Eh   :
          :  -> wf. convergence          0.1000000E-03 e    :
          :  Broyden damping             0.4000000          :
          ...................................................

 iter      E             dE          RMSdq      gap      omega  full diag
   1    -38.8760341 -0.388760E+02  0.448E-05    2.56       0.0  T
   2    -38.8760341 -0.478195E-11  0.213E-05    2.56     922.8  T
   3    -38.8760341 -0.874678E-11  0.156E-05    2.56    1256.0  T

   *** convergence criteria satisfied after 3 iterations ***

         #    Occupation            Energy/Eh            Energy/eV
      -------------------------------------------------------------
         1        2.0000           -0.7136203             -19.4186
       ...           ...                  ...                  ...
        30        2.0000           -0.4450070             -12.1093
        31        2.0000           -0.4281541             -11.6507
        32        2.0000           -0.4265381             -11.6067
        33        2.0000           -0.4129239             -11.2362
        34        2.0000           -0.3995002             -10.8710
        35        2.0000           -0.3631499              -9.8818
        36        2.0000           -0.3472015              -9.4478 (HOMO)
        37                         -0.2531061              -6.8874 (LUMO)
        38                         -0.2283784              -6.2145
        39                         -0.2183284              -5.9410
        40                         -0.1973419              -5.3699
        41                         -0.1840579              -5.0085
       ...                                ...                  ...
        78                          0.6837531              18.6059
      -------------------------------------------------------------
                  HL-Gap            0.0940954 Eh            2.5605 eV
             Fermi-level           -0.3001538 Eh           -8.1676 eV

 SCC (total)                   0 d,  0 h,  0 min,  0.035 sec
 SCC setup                      ...        0 min,  0.000 sec (  0.619%)
 Dispersion                     ...        0 min,  0.000 sec (  0.668%)
 integral evaluation            ...        0 min,  0.011 sec ( 32.489%)
 zeroth order Hamiltonian       ...        0 min,  0.000 sec (  0.588%)
 iterations                     ...        0 min,  0.005 sec ( 13.967%)
 molecular gradient             ...        0 min,  0.018 sec ( 50.390%)
 printout                       ...        0 min,  0.000 sec (  1.108%)

         :::::::::::::::::::::::::::::::::::::::::::::::::::::
         ::                     SUMMARY                     ::
         :::::::::::::::::::::::::::::::::::::::::::::::::::::
         :: total energy             -38.300528173886 Eh    ::
         :: gradient norm              0.000556466295 Eh/a0 ::
         :: HOMO-LUMO gap              2.560466493987 eV    ::
         ::.................................................::
         :: SCC energy               -38.876034120505 Eh    ::
         :: -> isotropic ES            0.005516298542 Eh    ::
         :: -> anisotropic ES          0.004557887735 Eh    ::
         :: -> anisotropic XC          0.023219119065 Eh    ::
         :: -> dispersion             -0.029681451234 Eh    ::
         :: repulsion energy           0.575374875027 Eh    ::
         :: add. restraining           0.000000000000 Eh    ::
         :::::::::::::::::::::::::::::::::::::::::::::::::::::

           -------------------------------------------------
          |                Property Printout                |
           -------------------------------------------------

    * Orbital Energies and Occupations

         #    Occupation            Energy/Eh            Energy/eV
      -------------------------------------------------------------
         1        2.0000           -0.7136203             -19.4186
       ...           ...                  ...                  ...
        24        2.0000           -0.4729324             -12.8691
        25        2.0000           -0.4668266             -12.7030
        26        2.0000           -0.4624779             -12.5847
        27        2.0000           -0.4559088             -12.4059
        28        2.0000           -0.4534073             -12.3378
        29        2.0000           -0.4486447             -12.2082
        30        2.0000           -0.4450070             -12.1093
        31        2.0000           -0.4281541             -11.6507
        32        2.0000           -0.4265381             -11.6067
        33        2.0000           -0.4129239             -11.2362
        34        2.0000           -0.3995002             -10.8710
        35        2.0000           -0.3631499              -9.8818
        36        2.0000           -0.3472015              -9.4478 (HOMO)
        37                         -0.2531061              -6.8874 (LUMO)
        38                         -0.2283784              -6.2145
        39                         -0.2183284              -5.9410
        40                         -0.1973419              -5.3699
        41                         -0.1840579              -5.0085
        42                         -0.1233184              -3.3557
        43                         -0.1214738              -3.3055
        44                         -0.0999043              -2.7185
        45                         -0.0077559              -0.2110
        46                         -0.0072628              -0.1976
        47                          0.0028989               0.0789
       ...                                ...                  ...
        78                          0.6837531              18.6059
      -------------------------------------------------------------
                  HL-Gap            0.0940954 Eh            2.5605 eV
             Fermi-level           -0.3001538 Eh           -8.1676 eV

     #   Z        covCN         q      C6AA      α(0)
     1   6 C      2.924    -0.053    29.317     8.879
     2   6 C      3.075    -0.004    28.042     8.682
     3   6 C      3.003     0.032    27.273     8.567
     4  16 S      2.118    -0.144   147.114    20.414
     5   6 C      3.803    -0.007    20.702     6.478
     6   6 C      3.867    -0.054    21.497     6.593
     7   6 C      2.999     0.033    27.247     8.563
     8   6 C      3.077    -0.009    28.154     8.699
     9   6 C      3.867    -0.051    21.451     6.586
    10   6 C      3.802    -0.006    20.690     6.476
    11  16 S      2.117    -0.152   147.459    20.438
    12   6 C      2.971    -0.002    28.070     8.690
    13   6 C      2.895    -0.030    28.740     8.790
    14   6 C      2.838    -0.088    30.192     9.005
    15   1 H      0.926     0.040     2.452     2.449
    16   1 H      0.925     0.047     2.362     2.403
    17   1 H      0.925     0.049     2.327     2.386
    18   1 H      0.924     0.047     2.358     2.402
    19   1 H      0.924     0.050     2.318     2.381
    20   1 H      0.924     0.048     2.349     2.397
    21   1 H      0.924     0.049     2.336     2.390
    22   1 H      0.925     0.046     2.375     2.410
    23   1 H      0.925     0.049     2.336     2.390
    24   1 H      0.925     0.034     2.524     2.484
    25   1 H      0.926     0.039     2.456     2.450
    26   1 H      0.926     0.037     2.490     2.468

 Mol. C6AA /au·bohr⁶  :      10742.108451
 Mol. C8AA /au·bohr⁸  :     315195.865526
 Mol. α(0) /au        :        165.869411


Wiberg/Mayer (AO) data.
largest (>0.10) Wiberg bond orders for each atom
          total WBO             WBO to atom ...
     1  C   3.989        C    2 1.458    C   12 1.339    H   15 0.964
     2  C   3.986        C    1 1.458    C    3 1.331    C    6 1.008
     3  C   3.964        C    7 1.360    C    2 1.331    S    4 1.061
     4  S   2.259        C    3 1.061    C    5 0.982
     5  C   3.979        C    6 1.010    S    4 0.982    H   16 0.979    H   17 0.979
     6  C   3.996        C    5 1.010    C    2 1.008    H   18 0.966    H   19 0.961
     7  C   3.964        C    3 1.360    C    8 1.358    S   11 1.053
     8  C   3.984        C   12 1.371    C    7 1.358    C    9 1.009
     9  C   3.996        C    8 1.009    C   10 1.009    H   20 0.965    H   21 0.960
    10  C   3.979        C    9 1.009    S   11 0.983    H   22 0.979    H   23 0.979
    11  S   2.253        C    7 1.053    C   10 0.983
    12  C   3.988        C    8 1.371    C    1 1.339    C   13 1.087
    13  C   3.990        C   14 1.903    C   12 1.087    H   24 0.962
    14  C   3.978        C   13 1.903    H   26 0.978    H   25 0.974
    15  H   0.997        C    1 0.964
    16  H   0.998        C    5 0.979
    17  H   0.997        C    5 0.979
    18  H   0.997        C    6 0.966
    19  H   0.997        C    6 0.961
    20  H   0.997        C    9 0.965
    21  H   0.997        C    9 0.960
    22  H   0.998        C   10 0.979
    23  H   0.997        C   10 0.979
    24  H   0.998        C   13 0.962
    25  H   0.998        C   14 0.974
    26  H   0.998        C   14 0.978

molecular dipole:
                 x           y           z       tot (Debye)
 q only:        0.022      -0.855       0.212
   full:        0.008      -1.335       0.350       3.509
molecular quadrupole (traceless):
                xx          xy          yy          xz          yz          zz
 q only:       11.100      -0.152      -7.442       0.298       1.286      -3.658
  q+dip:       15.620      -0.395     -11.494       1.138       1.689      -4.126
   full:       15.621      -0.372     -12.097       0.654       2.086      -3.524

           -------------------------------------------------
          |                Geometry Summary                 |
           -------------------------------------------------

      molecular mass/u    :      220.3468000
   center of mass at/Å    :       -0.1420372      -0.0482851      -0.0765297
  moments of inertia/u·Å² :        0.7127328E+03   0.9482237E+03   0.1635848E+04
rotational constants/cm⁻¹ :        0.2365211E-01   0.1777812E-01   0.1030513E-01

 * 22 selected distances

     #   Z        #   Z                                     value/Å
     1   6 C      2   6 C                                 1.3760806
     2   6 C      3   6 C                                 1.3955386
     3   6 C      4  16 S                                 1.7507315 (max)
     5   6 C      6   6 C                                 1.5255315
     3   6 C      7   6 C                                 1.3826665
     7   6 C      8   6 C                                 1.3933654
     9   6 C     10   6 C                                 1.5259783
     1   6 C     12   6 C                                 1.4022350
     8   6 C     12   6 C                                 1.3945076
    13   6 C     14   6 C                                 1.3277471
     1   6 C     15   1 H                                 1.0785522
     5   6 C     16   1 H                                 1.0907773
     5   6 C     17   1 H                                 1.0872992
     6   6 C     18   1 H                                 1.0908764
     6   6 C     19   1 H                                 1.0948045
     9   6 C     20   1 H                                 1.0907719
     9   6 C     21   1 H                                 1.0953319
    10   6 C     22   1 H                                 1.0908476
    10   6 C     23   1 H                                 1.0874605
    13   6 C     24   1 H                                 1.0820059
    14   6 C     25   1 H                                 1.0765892
    14   6 C     26   1 H                                 1.0764246 (min)

 * 3 distinct bonds (by element types)

   Z      Z             #   av. dist./Å        max./Å        min./Å
   1 H    6 C          12     1.0868118     1.0953319     1.0764246
   6 C    6 C           9     1.4137389     1.5259783     1.3277471
   6 C   16 S           1     1.7507315     1.7507315     1.7507315


optimized geometry written to: xtbopt.xyz


           -------------------------------------------------
          | TOTAL ENERGY              -38.300528173886 Eh   |
          | GRADIENT NORM               0.000556466295 Eh/α |
          | HOMO-LUMO GAP               2.560466493987 eV   |
           -------------------------------------------------

------------------------------------------------------------------------
 * finished run on 2021/05/19 at 10:59:46.922     
------------------------------------------------------------------------
 total:
 * wall-time:     0 d,  0 h,  0 min,  1.093 sec
 *  cpu-time:     0 d,  0 h,  0 min,  1.089 sec
 * ratio c/w:     0.996 speedup
 SCF:
 * wall-time:     0 d,  0 h,  0 min,  0.049 sec
 *  cpu-time:     0 d,  0 h,  0 min,  0.049 sec
 * ratio c/w:     0.998 speedup
 ANC optimizer:
 * wall-time:     0 d,  0 h,  0 min,  1.019 sec
 *  cpu-time:     0 d,  0 h,  0 min,  1.017 sec
 * ratio c/w:     0.998 speedup

