      -----------------------------------------------------------      
     |                   =====================                   |     
     |                           x T B                           |     
     |                   =====================                   |     
     |                         S. Grimme                         |     
     |          Mulliken Center for Theoretical Chemistry        |     
     |                    University of Bonn                     |     
     |                Version 6.2 RC2 (SAW190805)                |     
      -----------------------------------------------------------      

   This program is distributed in the hope that it will be useful,
   but WITHOUT ANY WARRANTY; without even the implied warranty of
   MERCHANTABILITY or FITNESS FOR A PARTICULAR PURPOSE.
   
   FOR NON-COMMERCIAL, ACADEMIA USE ONLY.
   
   Cite this work as:
   * S. Grimme, C. Bannwarth, P. Shushkov, J. Chem. Theory Comput., 2017,
     13, 1989-2009. DOI: 10.1021/acs.jctc.7b00118
   * C. Bannwarth, S. Ehlert and S. Grimme., J. Chem. Theory Comput., 2019,
     15, 1652-1671. DOI: 10.1021/acs.jctc.8b01176
   * P. Pracht, E. Caldeweyher, S. Ehlert, S. Grimme, ChemRxiv, 2019, preprint.
     DOI: 10.26434/chemrxiv.8326202.v1
   
   for DFT-D4:
   * E. Caldeweyher, C. Bannwarth and S. Grimme, J. Chem. Phys., 2017,
     147, 034112. DOI: 10.1063/1.4993215
   * E. Caldeweyher, S. Ehlert, A. Hansen, H. Neugebauer, S. Spicher,
     C. Bannwarth and S. Grimme, J. Chem. Phys., 2019, 150, 154122.
     DOI: 10.1063/1.5090222
   
   for sTDA-xTB:
   * S. Grimme and C. Bannwarth, J. Chem. Phys., 2016, 145, 054103.
     DOI: 10.1063/1.4959605
   
   in the mass-spec context:
   * V. Asgeirsson, C. Bauer and S. Grimme, Chem. Sci., 2017, 8, 4879.
     DOI: 10.1039/c7sc00601b
   
   for metadynamics refer to:
   * S. Grimme, J. Chem. Theory Comput., 2019, 155, 2847-2862
     DOI: 10.1021/acs.jctc.9b00143
   
   with help from (in alphabetical order)
   C. Bannwarth, F. Bohle, G. Brandenburg, E. Caldeweyher, M. Checinski,
   S. Dohm, S. Ehlert, S. Ehrlich, F. März, H. Neugebauer, J. Pisarek,
   P. Pracht, P. Shushkov, and S. Spicher.
   
 * started run on 2021/05/19 at 10:59:46.940     

           -------------------------------------------------
          |                Calculation Setup                |
           -------------------------------------------------

          program call               : /ihome/ghutchison/geoffh/xtb/xtb 562.xyz -opt
          hostname                   : smp-n144
          coordinate file            : 562.xyz
          omp threads                :                     1
          number of atoms            :                    21
          number of electrons        :                    66
          charge                     :                     0
          spin                       :                   0.0
          first test random number   :      0.72420255167280


########################################################################
# WARNING! Please study the warnings concerning your input carefully
#  - the use of '-opt' is discouraged, please use '--opt' next time
########################################################################

           ------------------------------------------------- 
          |                 G F N 2 - x T B                 |
          | Geometry, Frequencies, Noncovalent interactions |
          |            JCTC 2019 parametrisation            |
           ------------------------------------------------- 
             KAB for C  - Si     :                1.0500
             KAB for H  - Pd     :                0.9500
             k(s)              :                1.8500
             k(p)              :                2.2300
             k(d)              :                2.2300
             k(f)              :                2.0000
             kEN (H0ij)        :               -2.0000
             D4 a1             :                0.5200
             D4 a2             :                5.0000
             D4 s6             :                1.0000
             D4 s8             :                2.7000
             D4 s9             :                5.0000
             alphaj            :                2.0000

  Z AO/shell   Hii/eV     exponent
  1     Wed Apr 25 08:07:45 CEST 2018   EN: 2.200 GM2: 0.406  GM3: 0.0800  RAES: 1.40
     1s    -10.707211    1.230000
  6     Wed Apr 25 08:07:45 CEST 2018   EN: 2.550 GM2: 0.538  GM3: 0.1500  RAES: 3.00
     2s    -13.970922    2.096432
     2p    -10.063292    1.800000
  7     Wed Apr 25 08:07:45 CEST 2018   EN: 3.040 GM2: 0.461  GM3:-0.0640  RAES: 1.90
     2s    -16.686243    2.339881
     2p    -12.523956    2.014332
 16     Tue Apr 24 11:44:34 CEST 2018   EN: 2.580 GM2: 0.340  GM3:-0.0502  RAES: 3.10
     3s    -20.029654    1.981333
     3p    -11.377694    2.025643
     3d     -0.420282    1.702555

           ------------------------------------------------- 
          |        Self-Consistent Charge Iterations        |
           ------------------------------------------------- 

          ...................................................
          :                      SETUP                      :
          :.................................................:
          :  # basis functions                  66          :
          :  # atomic orbitals                  65          :
          :  # shells                           35          :
          :  # electrons                        66          :
          :  max. iterations                   250          :
          :  Hamiltonian                  GFN2-xTB          :
          :  restarted?                      false          :
          :  GBSA solvation                  false          :
          :  PC potential                    false          :
          :  electronic temp.          300.0000000     K    :
          :  accuracy                    1.0000000          :
          :  -> integral cutoff          0.2500000E+02      :
          :  -> integral neglect         0.1000000E-07      :
          :  -> SCF convergence          0.1000000E-05 Eh   :
          :  -> wf. convergence          0.1000000E-03 e    :
          :  Broyden damping             0.4000000          :
          ...................................................

 iter      E             dE          RMSdq      gap      omega  full diag
   1    -36.4965970 -0.364966E+02  0.447E+00    1.75       0.0  T
   2    -36.5721677 -0.755707E-01  0.275E+00    1.86       1.0  T
   3    -36.5774370 -0.526928E-02  0.134E+00    1.73       1.0  T
   4    -36.5825586 -0.512165E-02  0.543E-01    1.81       1.0  T
   5    -36.5865511 -0.399242E-02  0.171E-01    1.71       1.0  T
   6    -36.5867685 -0.217491E-03  0.966E-02    1.74       1.0  T
   7    -36.5868450 -0.764847E-04  0.498E-02    1.74       1.0  T
   8    -36.5868725 -0.275142E-04  0.235E-02    1.74       1.0  T
   9    -36.5868809 -0.830906E-05  0.968E-03    1.74       2.3  T
  10    -36.5868813 -0.468039E-06  0.447E-03    1.74       4.9  T
  11    -36.5868814 -0.121744E-06  0.216E-03    1.74      10.1  T
  12    -36.5868815 -0.428760E-07  0.108E-03    1.74      20.2  T
  13    -36.5868815 -0.571411E-08  0.287E-04    1.74      76.2  T
  14    -36.5868815 -0.255085E-09  0.117E-04    1.74     186.2  T

   *** convergence criteria satisfied after 14 iterations ***

         #    Occupation            Energy/Eh            Energy/eV
      -------------------------------------------------------------
         1        2.0000           -0.7320621             -19.9204
       ...           ...                  ...                  ...
        27        2.0000           -0.4355188             -11.8511
        28        2.0000           -0.4276086             -11.6358
        29        2.0000           -0.4194714             -11.4144
        30        2.0000           -0.4148711             -11.2892
        31        2.0000           -0.3785798             -10.3017
        32        2.0000           -0.3664655              -9.9720
        33        2.0000           -0.3603147              -9.8047 (HOMO)
        34                         -0.2962351              -8.0610 (LUMO)
        35                         -0.2401809              -6.5357
        36                         -0.2088542              -5.6832
        37                         -0.2001511              -5.4464
        38                         -0.1702708              -4.6333
       ...                                ...                  ...
        65                          0.6954744              18.9248
      -------------------------------------------------------------
                  HL-Gap            0.0640796 Eh            1.7437 eV
             Fermi-level           -0.3282749 Eh           -8.9328 eV

 SCC (total)                   0 d,  0 h,  0 min,  0.037 sec
 SCC setup                      ...        0 min,  0.000 sec (  0.763%)
 Dispersion                     ...        0 min,  0.000 sec (  0.796%)
 integral evaluation            ...        0 min,  0.008 sec ( 22.403%)
 zeroth order Hamiltonian       ...        0 min,  0.000 sec (  0.450%)
 iterations                     ...        0 min,  0.015 sec ( 40.779%)
 molecular gradient             ...        0 min,  0.012 sec ( 33.632%)
 printout                       ...        0 min,  0.000 sec (  1.011%)

         :::::::::::::::::::::::::::::::::::::::::::::::::::::
         ::                     SUMMARY                     ::
         :::::::::::::::::::::::::::::::::::::::::::::::::::::
         :: total energy             -36.104000730979 Eh    ::
         :: gradient norm              0.107833773798 Eh/a0 ::
         :: HOMO-LUMO gap              1.743693983067 eV    ::
         ::.................................................::
         :: SCC energy               -36.586881494109 Eh    ::
         :: -> isotropic ES            0.037385497383 Eh    ::
         :: -> anisotropic ES          0.000957677509 Eh    ::
         :: -> anisotropic XC          0.027162437620 Eh    ::
         :: -> dispersion             -0.022477418265 Eh    ::
         :: repulsion energy           0.482817370193 Eh    ::
         :: add. restraining           0.000000000000 Eh    ::
         :::::::::::::::::::::::::::::::::::::::::::::::::::::

      ----------------------------------------------------------- 
     |                   =====================                   |
     |                        A N C O P T                        |
     |                   =====================                   |
     |               Approximate Normal Coordinate               |
     |                Rational Function Optimizer                |
      ----------------------------------------------------------- 

          ...................................................
          :                      SETUP                      :
          :.................................................:
          :   optimization level            normal          :
          :   max. optcycles                   200          :
          :   ANC micro-cycles                  20          :
          :   degrees of freedom                57          :
          :.................................................:
          :   RF solver                   davidson          :
          :   input Hessian                  false          :
          :   write xtbopt.log                true          :
          :   linear?                        false          :
          :   energy convergence         0.5000000E-05 Eh   :
          :   grad. convergence          0.1000000E-02 Eh/α :
          :   maximium RF displ.         2.0000000          :
          :   Hlow (freq-cutoff)         0.5000000E-02      :
          :   Hmax (freq-cutoff)         5.0000000          :
          :   S6 in model hess.         20.0000000          :
          ...................................................

generating ANC from model Hessian ...
Using Lindh-Hessian (1995)
 Shifting diagonal of input Hessian by   3.515523531394386E-003
 Lowest  eigenvalues of input Hessian
   -0.000000    0.000000    0.000000    0.000000    0.000000    0.000000
    0.005000    0.006845    0.008452    0.009716    0.013601    0.016059
    0.017249    0.022969    0.024213    0.028037    0.034473    0.039178
 Highest eigenvalues
    1.803606    1.851263    1.920886    1.947330    2.016695    2.106466
 

........................................................................
.............................. CYCLE    1 ..............................
........................................................................
   1    -36.5868815 -0.365869E+02  0.381E-05    1.74       0.0  T
   2    -36.5868815 -0.576961E-11  0.211E-05    1.74    1035.0  T
   3    -36.5868815 -0.660805E-12  0.137E-05    1.74    1590.9  T
     SCC iter.                  ...        0 min,  0.004 sec
     gradient                   ...        0 min,  0.013 sec
 * total energy  :   -36.1040007 Eh     change        0.5815721E-09 Eh
   gradient norm :     0.1078335 Eh/α   predicted     0.0000000E+00 (-100.00%)
   displ. norm   :     0.2245369 α      lambda       -0.1290317E-01
   maximum displ.:     0.1245530 α      in ANC's #6, #36, #38, ...

........................................................................
.............................. CYCLE    2 ..............................
........................................................................
   1    -36.6188137 -0.366188E+02  0.381E-01    1.89       0.0  T
   2    -36.6189751 -0.161374E-03  0.242E-01    1.85       1.0  T
   3    -36.6192503 -0.275185E-03  0.156E-01    1.87       1.0  T
   4    -36.6194816 -0.231308E-03  0.275E-02    1.85       1.0  T
   5    -36.6194948 -0.132448E-04  0.112E-02    1.85       1.9  T
   6    -36.6194956 -0.825766E-06  0.655E-03    1.85       3.3  T
   7    -36.6194960 -0.391452E-06  0.240E-03    1.85       9.1  T
   8    -36.6194961 -0.537258E-07  0.936E-04    1.85      23.3  T
     SCC iter.                  ...        0 min,  0.008 sec
     gradient                   ...        0 min,  0.011 sec
 * total energy  :   -36.1134320 Eh     change       -0.9431288E-02 Eh
   gradient norm :     0.0539253 Eh/α   predicted    -0.6776859E-02 ( -28.14%)
   displ. norm   :     0.2606563 α      lambda       -0.5811031E-02
   maximum displ.:     0.1675865 α      in ANC's #6, #2, #5, ...

........................................................................
.............................. CYCLE    3 ..............................
........................................................................
   1    -36.6379467 -0.366379E+02  0.395E-01    1.84       0.0  T
   2    -36.6381683 -0.221525E-03  0.241E-01    1.82       1.0  T
   3    -36.6383313 -0.163002E-03  0.156E-01    1.83       1.0  T
   4    -36.6385757 -0.244461E-03  0.250E-02    1.82       1.0  T
   5    -36.6385854 -0.967894E-05  0.113E-02    1.82       1.9  T
   6    -36.6385861 -0.669522E-06  0.695E-03    1.82       3.1  T
   7    -36.6385865 -0.429344E-06  0.295E-03    1.82       7.4  T
   8    -36.6385866 -0.807019E-07  0.116E-03    1.82      18.9  T
     SCC iter.                  ...        0 min,  0.008 sec
     gradient                   ...        0 min,  0.012 sec
 * total energy  :   -36.1166689 Eh     change       -0.3236843E-02 Eh
   gradient norm :     0.0184653 Eh/α   predicted    -0.3102923E-02 (  -4.14%)
   displ. norm   :     0.1795331 α      lambda       -0.7975634E-03
   maximum displ.:     0.1168300 α      in ANC's #2, #6, #5, ...

........................................................................
.............................. CYCLE    4 ..............................
........................................................................
   1    -36.6383786 -0.366384E+02  0.154E-01    1.82       0.0  T
   2    -36.6383979 -0.192297E-04  0.894E-02    1.81       1.0  T
   3    -36.6383693  0.285752E-04  0.517E-02    1.82       1.0  T
   4    -36.6384134 -0.441185E-04  0.887E-03    1.81       2.5  T
   5    -36.6384142 -0.839052E-06  0.455E-03    1.81       4.8  T
   6    -36.6384144 -0.134792E-06  0.229E-03    1.81       9.5  T
   7    -36.6384144 -0.422530E-07  0.942E-04    1.81      23.2  T
     SCC iter.                  ...        0 min,  0.007 sec
     gradient                   ...        0 min,  0.011 sec
 * total energy  :   -36.1172969 Eh     change       -0.6280567E-03 Eh
   gradient norm :     0.0129979 Eh/α   predicted    -0.4116374E-03 ( -34.46%)
   displ. norm   :     0.2798010 α      lambda       -0.8550334E-03
   maximum displ.:     0.2029800 α      in ANC's #2, #6, #1, ...

........................................................................
.............................. CYCLE    5 ..............................
........................................................................
   1    -36.6383248 -0.366383E+02  0.233E-01    1.83       0.0  T
   2    -36.6383543 -0.294404E-04  0.135E-01    1.82       1.0  T
   3    -36.6382805  0.737637E-04  0.721E-02    1.83       1.0  T
   4    -36.6383777 -0.971800E-04  0.135E-02    1.83       1.6  T
   5    -36.6383790 -0.128732E-05  0.792E-03    1.83       2.8  T
   6    -36.6383796 -0.612641E-06  0.345E-03    1.83       6.3  T
   7    -36.6383797 -0.121571E-06  0.137E-03    1.83      15.9  T
   8    -36.6383797 -0.219114E-07  0.706E-04    1.83      30.9  T
     SCC iter.                  ...        0 min,  0.008 sec
     gradient                   ...        0 min,  0.012 sec
 * total energy  :   -36.1178520 Eh     change       -0.5550970E-03 Eh
   gradient norm :     0.0084347 Eh/α   predicted    -0.4609882E-03 ( -16.95%)
   displ. norm   :     0.1847346 α      lambda       -0.2752626E-03
   maximum displ.:     0.1381412 α      in ANC's #2, #6, #1, ...

........................................................................
.............................. CYCLE    6 ..............................
........................................................................
   1    -36.6389217 -0.366389E+02  0.149E-01    1.84       0.0  T
   2    -36.6389300 -0.826332E-05  0.855E-02    1.84       1.0  T
   3    -36.6389011  0.288918E-04  0.418E-02    1.84       1.0  T
   4    -36.6389376 -0.364937E-04  0.678E-03    1.84       3.2  T
   5    -36.6389376 -0.376461E-07  0.445E-03    1.84       4.9  T
   6    -36.6389379 -0.240546E-06  0.154E-03    1.84      14.1  T
   7    -36.6389379 -0.202690E-07  0.684E-04    1.84      31.9  T
     SCC iter.                  ...        0 min,  0.007 sec
     gradient                   ...        0 min,  0.011 sec
 * total energy  :   -36.1180321 Eh     change       -0.1801317E-03 Eh
   gradient norm :     0.0080558 Eh/α   predicted    -0.1423285E-03 ( -20.99%)
   displ. norm   :     0.1597982 α      lambda       -0.2102011E-03
   maximum displ.:     0.1245314 α      in ANC's #2, #1, #6, ...

........................................................................
.............................. CYCLE    7 ..............................
........................................................................
   1    -36.6412901 -0.366413E+02  0.134E-01    1.85       0.0  T
   2    -36.6412952 -0.509958E-05  0.764E-02    1.85       1.0  T
   3    -36.6412775  0.177153E-04  0.322E-02    1.85       1.0  T
   4    -36.6412994 -0.218476E-04  0.613E-03    1.85       3.6  T
   5    -36.6412994 -0.482586E-07  0.245E-03    1.85       8.9  T
   6    -36.6412995 -0.654773E-07  0.103E-03    1.85      21.2  T
     SCC iter.                  ...        0 min,  0.006 sec
     gradient                   ...        0 min,  0.012 sec
 * total energy  :   -36.1181507 Eh     change       -0.1185340E-03 Eh
   gradient norm :     0.0049644 Eh/α   predicted    -0.1077856E-03 (  -9.07%)
   displ. norm   :     0.1092023 α      lambda       -0.1051553E-03
   maximum displ.:     0.0825283 α      in ANC's #2, #1, #3, ...

........................................................................
.............................. CYCLE    8 ..............................
........................................................................
   1    -36.6426017 -0.366426E+02  0.736E-02    1.85       0.0  T
   2    -36.6426029 -0.123413E-05  0.421E-02    1.85       1.0  T
   3    -36.6425995  0.341423E-05  0.145E-02    1.85       1.5  T
   4    -36.6426035 -0.399409E-05  0.357E-03    1.85       6.1  T
   5    -36.6426036 -0.482783E-07  0.236E-03    1.85       9.3  T
   6    -36.6426036 -0.826929E-07  0.697E-04    1.85      31.3  T
     SCC iter.                  ...        0 min,  0.006 sec
     gradient                   ...        0 min,  0.011 sec
 * total energy  :   -36.1182190 Eh     change       -0.6827650E-04 Eh
   gradient norm :     0.0038650 Eh/α   predicted    -0.5322489E-04 ( -22.05%)
   displ. norm   :     0.1125370 α      lambda       -0.7125864E-04
   maximum displ.:     0.0712273 α      in ANC's #2, #1, #3, ...

........................................................................
.............................. CYCLE    9 ..............................
........................................................................
   1    -36.6422552 -0.366423E+02  0.759E-02    1.85       0.0  T
   2    -36.6422561 -0.903352E-06  0.435E-02    1.85       1.0  T
   3    -36.6422512  0.498252E-05  0.180E-02    1.85       1.2  T
   4    -36.6422568 -0.567723E-05  0.376E-03    1.85       5.8  T
   5    -36.6422569 -0.512107E-07  0.252E-03    1.85       8.6  T
   6    -36.6422570 -0.100951E-06  0.414E-04    1.85      52.8  T
   7    -36.6422570 -0.918682E-09  0.196E-04    1.85     111.1  T
     SCC iter.                  ...        0 min,  0.007 sec
     gradient                   ...        0 min,  0.013 sec
 * total energy  :   -36.1182631 Eh     change       -0.4411699E-04 Eh
   gradient norm :     0.0033051 Eh/α   predicted    -0.3608813E-04 ( -18.20%)
   displ. norm   :     0.1161906 α      lambda       -0.6232388E-04
   maximum displ.:     0.0663605 α      in ANC's #1, #2, #3, ...

........................................................................
.............................. CYCLE   10 ..............................
........................................................................
   1    -36.6426363 -0.366426E+02  0.744E-02    1.85       0.0  T
   2    -36.6426373 -0.107239E-05  0.422E-02    1.84       1.0  T
   3    -36.6426328  0.451082E-05  0.173E-02    1.84       1.3  T
   4    -36.6426378 -0.498760E-05  0.441E-03    1.84       4.9  T
   5    -36.6426379 -0.129253E-06  0.216E-03    1.84      10.1  T
   6    -36.6426380 -0.736587E-07  0.801E-04    1.84      27.2  T
   7    -36.6426380 -0.703217E-08  0.254E-04    1.84      85.8  T
     SCC iter.                  ...        0 min,  0.007 sec
     gradient                   ...        0 min,  0.012 sec
 * total energy  :   -36.1183011 Eh     change       -0.3800899E-04 Eh
   gradient norm :     0.0046489 Eh/α   predicted    -0.3158557E-04 ( -16.90%)
   displ. norm   :     0.0802874 α      lambda       -0.3756627E-04
   maximum displ.:     0.0518611 α      in ANC's #1, #3, #2, ...

........................................................................
.............................. CYCLE   11 ..............................
........................................................................
   1    -36.6422698 -0.366423E+02  0.515E-02    1.84       0.0  T
   2    -36.6422704 -0.572135E-06  0.293E-02    1.84       1.0  T
   3    -36.6422691  0.134421E-05  0.937E-03    1.84       2.3  T
   4    -36.6422706 -0.150107E-05  0.307E-03    1.84       7.1  T
   5    -36.6422707 -0.892501E-07  0.135E-03    1.84      16.2  T
   6    -36.6422707 -0.197294E-07  0.548E-04    1.84      39.8  T
     SCC iter.                  ...        0 min,  0.006 sec
     gradient                   ...        0 min,  0.012 sec
 * total energy  :   -36.1183296 Eh     change       -0.2849882E-04 Eh
   gradient norm :     0.0031483 Eh/α   predicted    -0.1890880E-04 ( -33.65%)
   displ. norm   :     0.1140252 α      lambda       -0.4820130E-04
   maximum displ.:     0.0815238 α      in ANC's #1, #2, #3, ...

........................................................................
.............................. CYCLE   12 ..............................
........................................................................
   1    -36.6418037 -0.366418E+02  0.744E-02    1.84       0.0  T
   2    -36.6418048 -0.111939E-05  0.426E-02    1.84       1.0  T
   3    -36.6418015  0.329332E-05  0.137E-02    1.84       1.6  T
   4    -36.6418053 -0.382703E-05  0.351E-03    1.84       6.2  T
   5    -36.6418054 -0.964121E-07  0.200E-03    1.84      10.9  T
   6    -36.6418055 -0.485796E-07  0.603E-04    1.84      36.2  T
   7    -36.6418055 -0.325572E-08  0.208E-04    1.84     104.9  T
     SCC iter.                  ...        0 min,  0.007 sec
     gradient                   ...        0 min,  0.012 sec
 * total energy  :   -36.1183608 Eh     change       -0.3119445E-04 Eh
   gradient norm :     0.0027714 Eh/α   predicted    -0.2442587E-04 ( -21.70%)
   displ. norm   :     0.0996404 α      lambda       -0.3020457E-04
   maximum displ.:     0.0700723 α      in ANC's #1, #2, #3, ...

........................................................................
.............................. CYCLE   13 ..............................
........................................................................
   1    -36.6414567 -0.366415E+02  0.685E-02    1.84       0.0  T
   2    -36.6414577 -0.997489E-06  0.391E-02    1.84       1.0  T
   3    -36.6414560  0.165917E-05  0.102E-02    1.84       2.1  T
   4    -36.6414581 -0.209626E-05  0.291E-03    1.84       7.5  T
   5    -36.6414581 -0.277891E-07  0.196E-03    1.84      11.1  T
   6    -36.6414582 -0.535558E-07  0.500E-04    1.84      43.7  T
   7    -36.6414582 -0.275585E-08  0.201E-04    1.84     108.5  T
     SCC iter.                  ...        0 min,  0.007 sec
     gradient                   ...        0 min,  0.012 sec
 * total energy  :   -36.1183803 Eh     change       -0.1951156E-04 Eh
   gradient norm :     0.0032444 Eh/α   predicted    -0.1525650E-04 ( -21.81%)
   displ. norm   :     0.0833337 α      lambda       -0.2559552E-04
   maximum displ.:     0.0628580 α      in ANC's #1, #2, #9, ...

........................................................................
.............................. CYCLE   14 ..............................
........................................................................
   1    -36.6420057 -0.366420E+02  0.598E-02    1.84       0.0  T
   2    -36.6420067 -0.101877E-05  0.340E-02    1.84       1.0  T
   3    -36.6420046  0.213059E-05  0.113E-02    1.84       1.9  T
   4    -36.6420072 -0.265504E-05  0.280E-03    1.84       7.8  T
   5    -36.6420073 -0.456080E-07  0.181E-03    1.84      12.1  T
   6    -36.6420073 -0.375378E-07  0.554E-04    1.84      39.4  T
   7    -36.6420073 -0.431174E-08  0.177E-04    1.84     123.4  T
     SCC iter.                  ...        0 min,  0.007 sec
     gradient                   ...        0 min,  0.012 sec
 * total energy  :   -36.1183955 Eh     change       -0.1520477E-04 Eh
   gradient norm :     0.0021979 Eh/α   predicted    -0.1289224E-04 ( -15.21%)
   displ. norm   :     0.1078721 α      lambda       -0.1803958E-04
   maximum displ.:     0.0712914 α      in ANC's #2, #1, #9, ...

........................................................................
.............................. CYCLE   15 ..............................
........................................................................
   1    -36.6412702 -0.366413E+02  0.684E-02    1.84       0.0  T
   2    -36.6412710 -0.793966E-06  0.387E-02    1.84       1.0  T
   3    -36.6412706  0.351662E-06  0.706E-03    1.84       3.1  T
   4    -36.6412710 -0.412957E-06  0.401E-03    1.84       5.4  T
   5    -36.6412712 -0.168787E-06  0.145E-03    1.84      15.1  T
   6    -36.6412712 -0.217405E-07  0.558E-04    1.84      39.1  T
   7    -36.6412712 -0.586792E-08  0.148E-04    1.84     147.9  T
     SCC iter.                  ...        0 min,  0.007 sec
     gradient                   ...        0 min,  0.012 sec
 * total energy  :   -36.1183981 Eh     change       -0.2581941E-05 Eh
   gradient norm :     0.0019457 Eh/α   predicted    -0.9129365E-05 ( 253.59%)
   displ. norm   :     0.0606905 α      lambda       -0.1425561E-04
   maximum displ.:     0.0369375 α      in ANC's #2, #1, #3, ...

........................................................................
.............................. CYCLE   16 ..............................
........................................................................
   1    -36.6426436 -0.366426E+02  0.336E-02    1.84       0.0  T
   2    -36.6426437 -0.148723E-06  0.195E-02    1.84       1.1  T
   3    -36.6426424  0.138043E-05  0.956E-03    1.84       2.3  T
   4    -36.6426439 -0.151274E-05  0.139E-03    1.84      15.7  T
   5    -36.6426439 -0.188699E-07  0.865E-04    1.84      25.2  T
   6    -36.6426439 -0.101010E-07  0.244E-04    1.84      89.3  T
     SCC iter.                  ...        0 min,  0.006 sec
     gradient                   ...        0 min,  0.012 sec
 * total energy  :   -36.1184014 Eh     change       -0.3292230E-05 Eh
   gradient norm :     0.0019024 Eh/α   predicted    -0.7142054E-05 ( 116.94%)
   displ. norm   :     0.0156171 α      lambda       -0.5712807E-05
   maximum displ.:     0.0084043 α      in ANC's #5, #6, #9, ...

........................................................................
.............................. CYCLE   17 ..............................
........................................................................
   1    -36.6422860 -0.366423E+02  0.108E-02    1.84       0.0  T
   2    -36.6422861 -0.624678E-07  0.598E-03    1.84       3.7  T
   3    -36.6422858  0.283471E-06  0.486E-03    1.84       4.5  T
   4    -36.6422861 -0.344050E-06  0.955E-04    1.84      22.8  T
   5    -36.6422861 -0.462518E-08  0.529E-04    1.84      41.3  T
     SCC iter.                  ...        0 min,  0.005 sec
     gradient                   ...        0 min,  0.012 sec
 * total energy  :   -36.1184045 Eh     change       -0.3163534E-05 Eh
   gradient norm :     0.0009943 Eh/α   predicted    -0.2859572E-05 (  -9.61%)
   displ. norm   :     0.0415048 α      lambda       -0.2753448E-05
   maximum displ.:     0.0315017 α      in ANC's #1, #2, #4, ...

   *** GEOMETRY OPTIMIZATION CONVERGED AFTER 17 ITERATIONS ***

------------------------------------------------------------------------
 total energy gain   :        -0.0144038 Eh       -9.0385 kcal/mol
 total RMSD          :         0.3633232 a0        0.1923 Å
 total power (kW/mol):        -2.2245393 (step)  -78.8344 (real)
------------------------------------------------------------------------

 ANCopt (total)                0 d,  0 h,  0 min,  0.480 sec
 optimizer setup                ...        0 min,  0.000 sec (  0.030%)
 model hessian                  ...        0 min,  0.002 sec (  0.485%)
 ANC generation                 ...        0 min,  0.001 sec (  0.128%)
 coordinate transformation      ...        0 min,  0.000 sec (  0.058%)
 single point calculation       ...        0 min,  0.470 sec ( 97.955%)
 optimization log               ...        0 min,  0.002 sec (  0.321%)
 hessian update                 ...        0 min,  0.000 sec (  0.042%)
 rational function              ...        0 min,  0.004 sec (  0.755%)

================
 final structure:
================
$coord
   -2.69196489308920    2.54550134537330   -0.33619616525670      C 
   -4.99671797274689    0.28918171148826   -0.14258304666223      S 
   -2.84355188344247   -2.16671076629175    0.16076299939556      C 
   -0.40349283650153   -1.21289516472437    0.10182137176618      C 
   -0.33110837896523    1.49090195876528   -0.17433708657934      C 
    1.89678240950177    2.77800727280298   -0.19931833110689      N 
    3.94334209192085    1.42851835801038   -0.02261742402273      C 
    6.23710465383991    2.64237609637975   -0.10903466738331      N 
    3.87837825803487   -1.31636998937527    0.12317545256123      C 
    6.11099398301186   -2.63174455729221    0.29354207097732      N 
    1.76831112723447   -2.57867647602865    0.21495420233282      N 
   -3.73791966996109   -4.71124510704071    0.42111359383165      C 
   -2.25179114136799   -6.72165558598697    0.70361519457942      C 
   -3.17878216973045    4.49801258366202   -0.54341690134002      H 
    6.07939214381969    4.54053348607900    0.00960800212905      H 
    7.62950657205787    1.89600026918359    0.95530961831973      H 
    7.58069047659108   -1.93167469796074   -0.69544425800935      H 
    5.88514188469306   -4.52066666566177    0.14810595225512      H 
   -5.77335163502162   -4.91716651936406    0.38389581149409      H 
   -0.23034850106725   -6.52028607994785    0.74304656751254      H 
   -3.02705839548160   -8.59172281354379    0.89734304526175      H 
$end
           -------------------------------------------------
          |                Final Singlepoint                |
           -------------------------------------------------

          ...................................................
          :                      SETUP                      :
          :.................................................:
          :  # basis functions                  66          :
          :  # atomic orbitals                  65          :
          :  # shells                           35          :
          :  # electrons                        66          :
          :  max. iterations                   250          :
          :  Hamiltonian                  GFN2-xTB          :
          :  restarted?                      false          :
          :  GBSA solvation                  false          :
          :  PC potential                    false          :
          :  electronic temp.          300.0000000     K    :
          :  accuracy                    1.0000000          :
          :  -> integral cutoff          0.2500000E+02      :
          :  -> integral neglect         0.1000000E-07      :
          :  -> SCF convergence          0.1000000E-05 Eh   :
          :  -> wf. convergence          0.1000000E-03 e    :
          :  Broyden damping             0.4000000          :
          ...................................................

 iter      E             dE          RMSdq      gap      omega  full diag
   1    -36.6422861 -0.366423E+02  0.356E-04    1.84       0.0  T
   2    -36.6422861 -0.424834E-10  0.149E-04    1.84     146.1  T
   3    -36.6422861 -0.282213E-09  0.165E-04    1.84     132.5  T

   *** convergence criteria satisfied after 3 iterations ***

         #    Occupation            Energy/Eh            Energy/eV
      -------------------------------------------------------------
         1        2.0000           -0.7251825             -19.7332
       ...           ...                  ...                  ...
        27        2.0000           -0.4297217             -11.6933
        28        2.0000           -0.4256766             -11.5833
        29        2.0000           -0.4105441             -11.1715
        30        2.0000           -0.4072406             -11.0816
        31        2.0000           -0.3705147             -10.0822
        32        2.0000           -0.3540691              -9.6347
        33        2.0000           -0.3478160              -9.4646 (HOMO)
        34                         -0.2802049              -7.6248 (LUMO)
        35                         -0.2265446              -6.1646
        36                         -0.1973018              -5.3689
        37                         -0.1946606              -5.2970
        38                         -0.1556004              -4.2341
       ...                                ...                  ...
        65                          0.7183894              19.5484
      -------------------------------------------------------------
                  HL-Gap            0.0676112 Eh            1.8398 eV
             Fermi-level           -0.3140104 Eh           -8.5447 eV

 SCC (total)                   0 d,  0 h,  0 min,  0.025 sec
 SCC setup                      ...        0 min,  0.000 sec (  0.678%)
 Dispersion                     ...        0 min,  0.000 sec (  0.682%)
 integral evaluation            ...        0 min,  0.008 sec ( 32.721%)
 zeroth order Hamiltonian       ...        0 min,  0.000 sec (  0.591%)
 iterations                     ...        0 min,  0.004 sec ( 15.038%)
 molecular gradient             ...        0 min,  0.012 sec ( 48.704%)
 printout                       ...        0 min,  0.000 sec (  1.342%)

         :::::::::::::::::::::::::::::::::::::::::::::::::::::
         ::                     SUMMARY                     ::
         :::::::::::::::::::::::::::::::::::::::::::::::::::::
         :: total energy             -36.118404474081 Eh    ::
         :: gradient norm              0.000994105701 Eh/a0 ::
         :: HOMO-LUMO gap              1.839793267514 eV    ::
         ::.................................................::
         :: SCC energy               -36.642286136182 Eh    ::
         :: -> isotropic ES            0.038752294863 Eh    ::
         :: -> anisotropic ES          0.002036624956 Eh    ::
         :: -> anisotropic XC          0.025433923878 Eh    ::
         :: -> dispersion             -0.022608801048 Eh    ::
         :: repulsion energy           0.523827100205 Eh    ::
         :: add. restraining           0.000000000000 Eh    ::
         :::::::::::::::::::::::::::::::::::::::::::::::::::::

           -------------------------------------------------
          |                Property Printout                |
           -------------------------------------------------

    * Orbital Energies and Occupations

         #    Occupation            Energy/Eh            Energy/eV
      -------------------------------------------------------------
         1        2.0000           -0.7251825             -19.7332
       ...           ...                  ...                  ...
        21        2.0000           -0.4813315             -13.0977
        22        2.0000           -0.4749464             -12.9240
        23        2.0000           -0.4714858             -12.8298
        24        2.0000           -0.4568339             -12.4311
        25        2.0000           -0.4422591             -12.0345
        26        2.0000           -0.4370257             -11.8921
        27        2.0000           -0.4297217             -11.6933
        28        2.0000           -0.4256766             -11.5833
        29        2.0000           -0.4105441             -11.1715
        30        2.0000           -0.4072406             -11.0816
        31        2.0000           -0.3705147             -10.0822
        32        2.0000           -0.3540691              -9.6347
        33        2.0000           -0.3478160              -9.4646 (HOMO)
        34                         -0.2802049              -7.6248 (LUMO)
        35                         -0.2265446              -6.1646
        36                         -0.1973018              -5.3689
        37                         -0.1946606              -5.2970
        38                         -0.1556004              -4.2341
        39                         -0.1131594              -3.0792
        40                         -0.0918813              -2.5002
        41                         -0.0000691              -0.0019
        42                          0.0136875               0.3725
        43                          0.0365034               0.9933
        44                          0.0446718               1.2156
       ...                                ...                  ...
        65                          0.7183894              19.5484
      -------------------------------------------------------------
                  HL-Gap            0.0676112 Eh            1.8398 eV
             Fermi-level           -0.3140104 Eh           -8.5447 eV

     #   Z        covCN         q      C6AA      α(0)
     1   6 C      2.924    -0.045    29.108     8.848
     2  16 S      2.361    -0.021   141.938    20.052
     3   6 C      2.978     0.005    27.900     8.664
     4   6 C      3.166     0.055    26.424     8.400
     5   6 C      3.175     0.060    26.276     8.371
     6   7 N      1.843    -0.284    28.211     7.872
     7   6 C      2.887     0.144    24.856     8.174
     8   7 N      2.645    -0.283    27.299     7.760
     9   6 C      2.885     0.142    24.902     8.181
    10   7 N      2.645    -0.281    27.269     7.756
    11   7 N      1.843    -0.277    28.030     7.846
    12   6 C      2.928    -0.027    28.682     8.783
    13   6 C      2.841    -0.093    30.335     9.026
    14   1 H      0.927     0.051     2.302     2.373
    15   1 H      0.860     0.184     1.190     1.708
    16   1 H      0.860     0.173     1.253     1.753
    17   1 H      0.860     0.174     1.251     1.752
    18   1 H      0.860     0.183     1.194     1.712
    19   1 H      0.925     0.038     2.480     2.463
    20   1 H      0.926     0.062     2.176     2.307
    21   1 H      0.926     0.038     2.469     2.457

 Mol. C6AA /au·bohr⁶  :       7257.832745
 Mol. C8AA /au·bohr⁸  :     196319.938589
 Mol. α(0) /au        :        136.257993


Wiberg/Mayer (AO) data.
largest (>0.10) Wiberg bond orders for each atom
          total WBO             WBO to atom ...
     1  C   3.936        C    5 1.468    S    2 1.219    H   14 0.968    C    3 0.119
     2  S   2.652        C    1 1.219    C    3 1.156
     3  C   3.939        C    4 1.385    S    2 1.156    C   12 1.152    C    1 0.119
     4  C   3.979        C    3 1.385    N   11 1.219    C    5 1.144
     5  C   3.979        C    1 1.468    N    6 1.199    C    4 1.144
     6  N   3.042        C    7 1.535    C    5 1.199    N    8 0.110
     7  C   3.970        N    6 1.535    N    8 1.172    C    9 1.083
     8  N   3.254        C    7 1.172    H   15 0.946    H   16 0.945    N    6 0.110
     9  C   3.970        N   11 1.525    N   10 1.173    C    7 1.083
    10  N   3.257        C    9 1.173    H   18 0.946    H   17 0.945    N   11 0.107
    11  N   3.053        C    9 1.525    C    4 1.219    N   10 0.107
    12  C   3.991        C   13 1.840    C    3 1.152    H   19 0.964
    13  C   3.986        C   12 1.840    H   21 0.978    H   20 0.971
    14  H   0.997        C    1 0.968
    15  H   0.966        N    8 0.946
    16  H   0.968        N    8 0.945
    17  H   0.967        N   10 0.945
    18  H   0.966        N   10 0.946
    19  H   0.998        C   12 0.964
    20  H   0.996        C   13 0.971
    21  H   0.998        C   13 0.978

molecular dipole:
                 x           y           z       tot (Debye)
 q only:        1.420      -0.103       0.037
   full:        1.798      -0.027       0.038       4.571
molecular quadrupole (traceless):
                xx          xy          yy          xz          yz          zz
 q only:       12.611      -0.309      -3.509       0.431       1.097      -9.102
  q+dip:       13.299      -0.641      -2.884       0.562       2.460     -10.414
   full:       12.207      -0.508      -4.491       0.457       2.844      -7.716

           -------------------------------------------------
          |                Geometry Summary                 |
           -------------------------------------------------

      molecular mass/u    :      192.2380000
   center of mass at/Å    :        0.0712252      -0.3620996       0.0327144
  moments of inertia/u·Å² :        0.4071516E+03   0.8686755E+03   0.1274294E+04
rotational constants/cm⁻¹ :        0.4140382E-01   0.1940613E-01   0.1322900E-01

 * 21 selected distances

     #   Z        #   Z                                     value/Å
     1   6 C      2  16 S                                 1.7098528
     2  16 S      3   6 C                                 1.7357942 (max)
     3   6 C      4   6 C                                 1.3867197
     1   6 C      5   6 C                                 1.3709697
     4   6 C      5   6 C                                 1.4387416
     5   6 C      6   7 N                                 1.3616176
     6   7 N      7   6 C                                 1.3006086
     7   6 C      8   7 N                                 1.3740549
     9   6 C     10   7 N                                 1.3742121
     4   6 C     11   7 N                                 1.3589546
     9   6 C     11   7 N                                 1.3020583
     3   6 C     12   6 C                                 1.4338977
    12   6 C     13   6 C                                 1.3313973
     1   6 C     14   1 H                                 1.0704867
     8   7 N     15   1 H                                 1.0098764
     8   7 N     16   1 H                                 1.0080360
    10   7 N     17   1 H                                 1.0079680 (min)
    10   7 N     18   1 H                                 1.0096319
    12   6 C     19   1 H                                 1.0827815
    13   6 C     20   1 H                                 1.0751985
    13   6 C     21   1 H                                 1.0761599

 * 5 distinct bonds (by element types)

   Z      Z             #   av. dist./Å        max./Å        min./Å
   1 H    6 C           4     1.0761566     1.0827815     1.0704867
   6 C    6 C           5     1.3923452     1.4387416     1.3313973
   1 H    7 N           4     1.0088781     1.0098764     1.0079680
   6 C    7 N           6     1.3452510     1.3742121     1.3006086
   6 C   16 S           2     1.7228235     1.7357942     1.7098528


optimized geometry written to: xtbopt.xyz


           -------------------------------------------------
          | TOTAL ENERGY              -36.118404474081 Eh   |
          | GRADIENT NORM               0.000994105701 Eh/α |
          | HOMO-LUMO GAP               1.839793267514 eV   |
           -------------------------------------------------

------------------------------------------------------------------------
 * finished run on 2021/05/19 at 10:59:47.503     
------------------------------------------------------------------------
 total:
 * wall-time:     0 d,  0 h,  0 min,  0.562 sec
 *  cpu-time:     0 d,  0 h,  0 min,  0.560 sec
 * ratio c/w:     0.996 speedup
 SCF:
 * wall-time:     0 d,  0 h,  0 min,  0.037 sec
 *  cpu-time:     0 d,  0 h,  0 min,  0.037 sec
 * ratio c/w:     0.998 speedup
 ANC optimizer:
 * wall-time:     0 d,  0 h,  0 min,  0.505 sec
 *  cpu-time:     0 d,  0 h,  0 min,  0.504 sec
 * ratio c/w:     0.998 speedup

