      -----------------------------------------------------------      
     |                   =====================                   |     
     |                           x T B                           |     
     |                   =====================                   |     
     |                         S. Grimme                         |     
     |          Mulliken Center for Theoretical Chemistry        |     
     |                    University of Bonn                     |     
     |                Version 6.2 RC2 (SAW190805)                |     
      -----------------------------------------------------------      

   This program is distributed in the hope that it will be useful,
   but WITHOUT ANY WARRANTY; without even the implied warranty of
   MERCHANTABILITY or FITNESS FOR A PARTICULAR PURPOSE.
   
   FOR NON-COMMERCIAL, ACADEMIA USE ONLY.
   
   Cite this work as:
   * S. Grimme, C. Bannwarth, P. Shushkov, J. Chem. Theory Comput., 2017,
     13, 1989-2009. DOI: 10.1021/acs.jctc.7b00118
   * C. Bannwarth, S. Ehlert and S. Grimme., J. Chem. Theory Comput., 2019,
     15, 1652-1671. DOI: 10.1021/acs.jctc.8b01176
   * P. Pracht, E. Caldeweyher, S. Ehlert, S. Grimme, ChemRxiv, 2019, preprint.
     DOI: 10.26434/chemrxiv.8326202.v1
   
   for DFT-D4:
   * E. Caldeweyher, C. Bannwarth and S. Grimme, J. Chem. Phys., 2017,
     147, 034112. DOI: 10.1063/1.4993215
   * E. Caldeweyher, S. Ehlert, A. Hansen, H. Neugebauer, S. Spicher,
     C. Bannwarth and S. Grimme, J. Chem. Phys., 2019, 150, 154122.
     DOI: 10.1063/1.5090222
   
   for sTDA-xTB:
   * S. Grimme and C. Bannwarth, J. Chem. Phys., 2016, 145, 054103.
     DOI: 10.1063/1.4959605
   
   in the mass-spec context:
   * V. Asgeirsson, C. Bauer and S. Grimme, Chem. Sci., 2017, 8, 4879.
     DOI: 10.1039/c7sc00601b
   
   for metadynamics refer to:
   * S. Grimme, J. Chem. Theory Comput., 2019, 155, 2847-2862
     DOI: 10.1021/acs.jctc.9b00143
   
   with help from (in alphabetical order)
   C. Bannwarth, F. Bohle, G. Brandenburg, E. Caldeweyher, M. Checinski,
   S. Dohm, S. Ehlert, S. Ehrlich, F. März, H. Neugebauer, J. Pisarek,
   P. Pracht, P. Shushkov, and S. Spicher.
   
 * started run on 2021/05/19 at 10:59:47.521     

           -------------------------------------------------
          |                Calculation Setup                |
           -------------------------------------------------

          program call               : /ihome/ghutchison/geoffh/xtb/xtb 563.xyz -opt
          hostname                   : smp-n144
          coordinate file            : 563.xyz
          omp threads                :                     1
          number of atoms            :                    17
          number of electrons        :                    52
          charge                     :                     0
          spin                       :                   0.0
          first test random number   :      0.65202743300345


########################################################################
# WARNING! Please study the warnings concerning your input carefully
#  - the use of '-opt' is discouraged, please use '--opt' next time
########################################################################

           ------------------------------------------------- 
          |                 G F N 2 - x T B                 |
          | Geometry, Frequencies, Noncovalent interactions |
          |            JCTC 2019 parametrisation            |
           ------------------------------------------------- 
             KAB for C  - Si     :                1.0500
             KAB for H  - Pd     :                0.9500
             k(s)              :                1.8500
             k(p)              :                2.2300
             k(d)              :                2.2300
             k(f)              :                2.0000
             kEN (H0ij)        :               -2.0000
             D4 a1             :                0.5200
             D4 a2             :                5.0000
             D4 s6             :                1.0000
             D4 s8             :                2.7000
             D4 s9             :                5.0000
             alphaj            :                2.0000

  Z AO/shell   Hii/eV     exponent
  1     Wed Apr 25 08:07:45 CEST 2018   EN: 2.200 GM2: 0.406  GM3: 0.0800  RAES: 1.40
     1s    -10.707211    1.230000
  6     Wed Apr 25 08:07:45 CEST 2018   EN: 2.550 GM2: 0.538  GM3: 0.1500  RAES: 3.00
     2s    -13.970922    2.096432
     2p    -10.063292    1.800000
 16     Tue Apr 24 11:44:34 CEST 2018   EN: 2.580 GM2: 0.340  GM3:-0.0502  RAES: 3.10
     3s    -20.029654    1.981333
     3p    -11.377694    2.025643
     3d     -0.420282    1.702555

           ------------------------------------------------- 
          |        Self-Consistent Charge Iterations        |
           ------------------------------------------------- 

          ...................................................
          :                      SETUP                      :
          :.................................................:
          :  # basis functions                  56          :
          :  # atomic orbitals                  55          :
          :  # shells                           29          :
          :  # electrons                        52          :
          :  max. iterations                   250          :
          :  Hamiltonian                  GFN2-xTB          :
          :  restarted?                      false          :
          :  GBSA solvation                  false          :
          :  PC potential                    false          :
          :  electronic temp.          300.0000000     K    :
          :  accuracy                    1.0000000          :
          :  -> integral cutoff          0.2500000E+02      :
          :  -> integral neglect         0.1000000E-07      :
          :  -> SCF convergence          0.1000000E-05 Eh   :
          :  -> wf. convergence          0.1000000E-03 e    :
          :  Broyden damping             0.4000000          :
          ...................................................

 iter      E             dE          RMSdq      gap      omega  full diag
   1    -28.1139366 -0.281139E+02  0.726E+00    2.70       0.0  T
   2    -28.1222060 -0.826936E-02  0.429E+00    2.69       1.0  T
   3    -28.1048503  0.173557E-01  0.113E+00    2.75       1.0  T
   4    -28.1224110 -0.175607E-01  0.439E-01    2.72       1.0  T
   5    -28.1242684 -0.185739E-02  0.200E-01    2.72       1.0  T
   6    -28.1248024 -0.533970E-03  0.583E-02    2.72       1.0  T
   7    -28.1248373 -0.349274E-04  0.200E-02    2.72       1.2  T
   8    -28.1248378 -0.440245E-06  0.820E-03    2.72       3.0  T
   9    -28.1248380 -0.217082E-06  0.459E-03    2.72       5.3  T
  10    -28.1248382 -0.249221E-06  0.189E-03    2.72      12.8  T
  11    -28.1248383 -0.380215E-07  0.712E-04    2.72      34.1  T
  12    -28.1248383 -0.362205E-08  0.403E-04    2.72      60.2  T

   *** convergence criteria satisfied after 12 iterations ***

         #    Occupation            Energy/Eh            Energy/eV
      -------------------------------------------------------------
         1        2.0000           -0.7339425             -19.9716
       ...           ...                  ...                  ...
        20        2.0000           -0.4453510             -12.1186
        21        2.0000           -0.4422630             -12.0346
        22        2.0000           -0.4192133             -11.4074
        23        2.0000           -0.4136221             -11.2552
        24        2.0000           -0.4044613             -11.0060
        25        2.0000           -0.3978442             -10.8259
        26        2.0000           -0.3705210             -10.0824 (HOMO)
        27                         -0.2706155              -7.3638 (LUMO)
        28                         -0.2298887              -6.2556
        29                         -0.2037916              -5.5455
        30                         -0.1916757              -5.2158
        31                         -0.1797368              -4.8909
       ...                                ...                  ...
        55                          1.4480577              39.4037
      -------------------------------------------------------------
                  HL-Gap            0.0999055 Eh            2.7186 eV
             Fermi-level           -0.3205682 Eh           -8.7231 eV

 SCC (total)                   0 d,  0 h,  0 min,  0.026 sec
 SCC setup                      ...        0 min,  0.000 sec (  0.876%)
 Dispersion                     ...        0 min,  0.000 sec (  0.937%)
 integral evaluation            ...        0 min,  0.006 sec ( 23.202%)
 zeroth order Hamiltonian       ...        0 min,  0.000 sec (  0.463%)
 iterations                     ...        0 min,  0.010 sec ( 39.979%)
 molecular gradient             ...        0 min,  0.009 sec ( 33.087%)
 printout                       ...        0 min,  0.000 sec (  1.254%)

         :::::::::::::::::::::::::::::::::::::::::::::::::::::
         ::                     SUMMARY                     ::
         :::::::::::::::::::::::::::::::::::::::::::::::::::::
         :: total energy             -27.536019333065 Eh    ::
         :: gradient norm              0.080322656663 Eh/a0 ::
         :: HOMO-LUMO gap              2.718567250427 eV    ::
         ::.................................................::
         :: SCC energy               -28.124838268559 Eh    ::
         :: -> isotropic ES            0.002767608899 Eh    ::
         :: -> anisotropic ES          0.002228102646 Eh    ::
         :: -> anisotropic XC          0.026314418400 Eh    ::
         :: -> dispersion             -0.015118458060 Eh    ::
         :: repulsion energy           0.588962581566 Eh    ::
         :: add. restraining           0.000000000000 Eh    ::
         :::::::::::::::::::::::::::::::::::::::::::::::::::::

      ----------------------------------------------------------- 
     |                   =====================                   |
     |                        A N C O P T                        |
     |                   =====================                   |
     |               Approximate Normal Coordinate               |
     |                Rational Function Optimizer                |
      ----------------------------------------------------------- 

          ...................................................
          :                      SETUP                      :
          :.................................................:
          :   optimization level            normal          :
          :   max. optcycles                   200          :
          :   ANC micro-cycles                  20          :
          :   degrees of freedom                45          :
          :.................................................:
          :   RF solver                   davidson          :
          :   input Hessian                  false          :
          :   write xtbopt.log                true          :
          :   linear?                        false          :
          :   energy convergence         0.5000000E-05 Eh   :
          :   grad. convergence          0.1000000E-02 Eh/α :
          :   maximium RF displ.         2.0000000          :
          :   Hlow (freq-cutoff)         0.5000000E-02      :
          :   Hmax (freq-cutoff)         5.0000000          :
          :   S6 in model hess.         20.0000000          :
          ...................................................

generating ANC from model Hessian ...
Using Lindh-Hessian (1995)
 Shifting diagonal of input Hessian by   4.880532981493126E-003
 Lowest  eigenvalues of input Hessian
   -0.000000   -0.000000   -0.000000    0.000000    0.000000    0.000000
    0.005000    0.005126    0.005378    0.005475    0.006105    0.007674
    0.015759    0.019062    0.020818    0.024225    0.032142    0.035900
 Highest eigenvalues
    1.677219    1.770391    1.831473    1.895998    2.566846    2.652181
 

........................................................................
.............................. CYCLE    1 ..............................
........................................................................
   1    -28.1248383 -0.281248E+02  0.164E-04    2.72       0.0  T
   2    -28.1248383 -0.230287E-10  0.111E-04    2.72     217.8  T
   3    -28.1248383 -0.192983E-10  0.908E-05    2.72     267.1  T
     SCC iter.                  ...        0 min,  0.003 sec
     gradient                   ...        0 min,  0.008 sec
 * total energy  :   -27.5360193 Eh     change       -0.1192416E-07 Eh
   gradient norm :     0.0803235 Eh/α   predicted     0.0000000E+00 (-100.00%)
   displ. norm   :     0.1576361 α      lambda       -0.5154517E-02
   maximum displ.:     0.0888302 α      in ANC's #14, #18, #19, ...

........................................................................
.............................. CYCLE    2 ..............................
........................................................................
   1    -28.1389870 -0.281390E+02  0.207E-01    2.60       0.0  T
   2    -28.1390227 -0.356669E-04  0.109E-01    2.60       1.0  T
   3    -28.1389939  0.287821E-04  0.804E-02    2.60       1.0  T
   4    -28.1390587 -0.647605E-04  0.313E-02    2.60       1.0  T
   5    -28.1390693 -0.106770E-04  0.167E-02    2.60       1.5  T
   6    -28.1390715 -0.218612E-05  0.427E-03    2.60       5.7  T
   7    -28.1390717 -0.125836E-06  0.135E-03    2.60      17.9  T
     SCC iter.                  ...        0 min,  0.006 sec
     gradient                   ...        0 min,  0.008 sec
 * total energy  :   -27.5395523 Eh     change       -0.3532932E-02 Eh
   gradient norm :     0.0340269 Eh/α   predicted    -0.2641302E-02 ( -25.24%)
   displ. norm   :     0.1329215 α      lambda       -0.1807814E-02
   maximum displ.:     0.0587573 α      in ANC's #14, #6, #12, ...

........................................................................
.............................. CYCLE    3 ..............................
........................................................................
   1    -28.1490080 -0.281490E+02  0.191E-01    2.51       0.0  T
   2    -28.1490400 -0.320259E-04  0.105E-01    2.52       1.0  T
   3    -28.1490165  0.235160E-04  0.705E-02    2.51       1.0  T
   4    -28.1490540 -0.375108E-04  0.303E-02    2.52       1.0  T
   5    -28.1490627 -0.875843E-05  0.154E-02    2.52       1.6  T
   6    -28.1490657 -0.297018E-05  0.315E-03    2.52       7.7  T
   7    -28.1490658 -0.587813E-07  0.121E-03    2.52      20.1  T
     SCC iter.                  ...        0 min,  0.005 sec
     gradient                   ...        0 min,  0.008 sec
 * total energy  :   -27.5404509 Eh     change       -0.8986347E-03 Eh
   gradient norm :     0.0093376 Eh/α   predicted    -0.9198789E-03 (   2.36%)
   displ. norm   :     0.1661212 α      lambda       -0.5891388E-03
   maximum displ.:     0.1125714 α      in ANC's #5, #4, #8, ...

........................................................................
.............................. CYCLE    4 ..............................
........................................................................
   1    -28.1479305 -0.281479E+02  0.273E-01    2.48       0.0  T
   2    -28.1479404 -0.993804E-05  0.163E-01    2.49       1.0  T
   3    -28.1479136  0.267904E-04  0.450E-02    2.49       1.0  T
   4    -28.1479416 -0.279573E-04  0.149E-02    2.49       1.6  T
   5    -28.1479438 -0.216924E-05  0.789E-03    2.49       3.1  T
   6    -28.1479447 -0.952222E-06  0.221E-03    2.49      10.9  T
   7    -28.1479447 -0.177354E-07  0.103E-03    2.49      23.5  T
     SCC iter.                  ...        0 min,  0.005 sec
     gradient                   ...        0 min,  0.008 sec
 * total energy  :   -27.5404265 Eh     change        0.2440329E-04 Eh
   gradient norm :     0.0112184 Eh/α   predicted    -0.3027017E-03 (*******%)
   displ. norm   :     0.0977857 α      lambda       -0.5029632E-03
   maximum displ.:     0.0609782 α      in ANC's #5, #8, #6, ...

........................................................................
.............................. CYCLE    5 ..............................
........................................................................
   1    -28.1469675 -0.281470E+02  0.167E-01    2.51       0.0  T
   2    -28.1469684 -0.957982E-06  0.101E-01    2.51       1.0  T
   3    -28.1469577  0.107509E-04  0.272E-02    2.51       1.0  T
   4    -28.1469691 -0.114003E-04  0.626E-03    2.51       3.9  T
   5    -28.1469693 -0.249443E-06  0.363E-03    2.51       6.7  T
   6    -28.1469695 -0.145214E-06  0.943E-04    2.51      25.7  T
   7    -28.1469695 -0.744454E-08  0.463E-04    2.51      52.3  T
     SCC iter.                  ...        0 min,  0.006 sec
     gradient                   ...        0 min,  0.008 sec
 * total energy  :   -27.5406783 Eh     change       -0.2518023E-03 Eh
   gradient norm :     0.0036280 Eh/α   predicted    -0.2538851E-03 (   0.83%)
   displ. norm   :     0.0770646 α      lambda       -0.1446668E-03
   maximum displ.:     0.0345800 α      in ANC's #3, #6, #12, ...

........................................................................
.............................. CYCLE    6 ..............................
........................................................................
   1    -28.1448338 -0.281448E+02  0.765E-02    2.51       0.0  T
   2    -28.1448338 -0.183002E-07  0.456E-02    2.51       1.0  T
   3    -28.1448278  0.602238E-05  0.193E-02    2.51       1.3  T
   4    -28.1448341 -0.635325E-05  0.239E-03    2.51      10.1  T
   5    -28.1448341 -0.235496E-07  0.144E-03    2.51      16.8  T
   6    -28.1448342 -0.250351E-07  0.351E-04    2.51      69.0  T
   7    -28.1448342 -0.597407E-09  0.191E-04    2.51     126.9  T
     SCC iter.                  ...        0 min,  0.006 sec
     gradient                   ...        0 min,  0.008 sec
 * total energy  :   -27.5406689 Eh     change        0.9389295E-05 Eh
   gradient norm :     0.0038335 Eh/α   predicted    -0.7276329E-04 (-874.96%)
   displ. norm   :     0.0498439 α      lambda       -0.1260484E-03
   maximum displ.:     0.0270298 α      in ANC's #4, #6, #12, ...

........................................................................
.............................. CYCLE    7 ..............................
........................................................................
   1    -28.1451079 -0.281451E+02  0.499E-02    2.51       0.0  T
   2    -28.1451082 -0.314733E-06  0.289E-02    2.51       1.0  T
   3    -28.1451074  0.797668E-06  0.861E-03    2.51       2.8  T
   4    -28.1451082 -0.820138E-06  0.320E-03    2.51       7.6  T
   5    -28.1451083 -0.731359E-07  0.164E-03    2.51      14.8  T
   6    -28.1451083 -0.333192E-07  0.554E-04    2.51      43.8  T
   7    -28.1451083 -0.442448E-08  0.184E-04    2.51     131.5  T
     SCC iter.                  ...        0 min,  0.005 sec
     gradient                   ...        0 min,  0.008 sec
 * total energy  :   -27.5407432 Eh     change       -0.7427325E-04 Eh
   gradient norm :     0.0014895 Eh/α   predicted    -0.6317992E-04 ( -14.94%)
   displ. norm   :     0.0973500 α      lambda       -0.3351843E-04
   maximum displ.:     0.0622916 α      in ANC's #4, #6, #2, ...

........................................................................
.............................. CYCLE    8 ..............................
........................................................................
   1    -28.1453315 -0.281453E+02  0.711E-02    2.51       0.0  T
   2    -28.1453319 -0.458757E-06  0.401E-02    2.51       1.0  T
   3    -28.1453317  0.211032E-06  0.697E-03    2.51       3.5  T
   4    -28.1453319 -0.141182E-06  0.445E-03    2.51       5.4  T
   5    -28.1453320 -0.167641E-06  0.146E-03    2.51      16.6  T
   6    -28.1453321 -0.235675E-07  0.595E-04    2.51      40.8  T
   7    -28.1453321 -0.623454E-08  0.180E-04    2.51     134.9  T
     SCC iter.                  ...        0 min,  0.006 sec
     gradient                   ...        0 min,  0.008 sec
 * total energy  :   -27.5407676 Eh     change       -0.2442143E-04 Eh
   gradient norm :     0.0023257 Eh/α   predicted    -0.1682872E-04 ( -31.09%)
   displ. norm   :     0.1007009 α      lambda       -0.4874583E-04
   maximum displ.:     0.0621826 α      in ANC's #6, #4, #2, ...

........................................................................
.............................. CYCLE    9 ..............................
........................................................................
   1    -28.1454680 -0.281455E+02  0.700E-02    2.51       0.0  T
   2    -28.1454684 -0.400131E-06  0.393E-02    2.51       1.0  T
   3    -28.1454683  0.790456E-07  0.627E-03    2.51       3.9  T
   4    -28.1454684 -0.293228E-07  0.416E-03    2.51       5.8  T
   5    -28.1454685 -0.157824E-06  0.931E-04    2.51      26.0  T
   6    -28.1454685 -0.110688E-07  0.370E-04    2.51      65.5  T
     SCC iter.                  ...        0 min,  0.005 sec
     gradient                   ...        0 min,  0.008 sec
 * total energy  :   -27.5408019 Eh     change       -0.3423664E-04 Eh
   gradient norm :     0.0028270 Eh/α   predicted    -0.2462043E-04 ( -28.09%)
   displ. norm   :     0.1577098 α      lambda       -0.6024180E-04
   maximum displ.:     0.0941521 α      in ANC's #6, #4, #2, ...

........................................................................
.............................. CYCLE   10 ..............................
........................................................................
   1    -28.1452772 -0.281453E+02  0.111E-01    2.51       0.0  T
   2    -28.1452781 -0.902609E-06  0.640E-02    2.51       1.0  T
   3    -28.1452773  0.757417E-06  0.106E-02    2.51       2.3  T
   4    -28.1452781 -0.831775E-06  0.564E-03    2.51       4.3  T
   5    -28.1452783 -0.179261E-06  0.229E-03    2.51      10.6  T
   6    -28.1452784 -0.749151E-07  0.755E-04    2.51      32.1  T
   7    -28.1452784 -0.554787E-08  0.363E-04    2.51      66.7  T
     SCC iter.                  ...        0 min,  0.005 sec
     gradient                   ...        0 min,  0.008 sec
 * total energy  :   -27.5408352 Eh     change       -0.3338899E-04 Eh
   gradient norm :     0.0030207 Eh/α   predicted    -0.3087055E-04 (  -7.54%)
   displ. norm   :     0.2567475 α      lambda       -0.9009083E-04
   maximum displ.:     0.1576702 α      in ANC's #4, #6, #2, ...

........................................................................
.............................. CYCLE   11 ..............................
........................................................................
   1    -28.1445699 -0.281446E+02  0.173E-01    2.50       0.0  T
   2    -28.1445723 -0.238721E-05  0.996E-02    2.50       1.0  T
   3    -28.1445699  0.239584E-05  0.168E-02    2.50       1.4  T
   4    -28.1445725 -0.259468E-05  0.858E-03    2.50       2.8  T
   5    -28.1445729 -0.410063E-06  0.399E-03    2.50       6.1  T
   6    -28.1445731 -0.224673E-06  0.145E-03    2.50      16.7  T
   7    -28.1445731 -0.239654E-07  0.579E-04    2.50      41.9  T
   8    -28.1445731 -0.550031E-09  0.355E-04    2.50      68.4  T
     SCC iter.                  ...        0 min,  0.006 sec
     gradient                   ...        0 min,  0.008 sec
 * total energy  :   -27.5408639 Eh     change       -0.2867553E-04 Eh
   gradient norm :     0.0039148 Eh/α   predicted    -0.4801587E-04 (  67.45%)
   displ. norm   :     0.0233198 α      lambda       -0.4077274E-04
   maximum displ.:     0.0169786 α      in ANC's #1, #7, #3, ...

........................................................................
.............................. CYCLE   12 ..............................
........................................................................
   1    -28.1459234 -0.281459E+02  0.225E-02    2.50       0.0  T
   2    -28.1459234 -0.273114E-07  0.133E-02    2.50       1.8  T
   3    -28.1459231  0.305103E-06  0.468E-03    2.50       5.2  T
   4    -28.1459234 -0.310126E-06  0.145E-03    2.50      16.8  T
   5    -28.1459234 -0.182229E-07  0.601E-04    2.50      40.3  T
   6    -28.1459234 -0.428646E-08  0.183E-04    2.50     132.4  T
     SCC iter.                  ...        0 min,  0.005 sec
     gradient                   ...        0 min,  0.008 sec
 * total energy  :   -27.5408916 Eh     change       -0.2765077E-04 Eh
   gradient norm :     0.0018416 Eh/α   predicted    -0.2039684E-04 ( -26.23%)
   displ. norm   :     0.1741187 α      lambda       -0.2964252E-04
   maximum displ.:     0.1030856 α      in ANC's #4, #2, #6, ...

........................................................................
.............................. CYCLE   13 ..............................
........................................................................
   1    -28.1457641 -0.281458E+02  0.109E-01    2.49       0.0  T
   2    -28.1457649 -0.774479E-06  0.627E-02    2.49       1.0  T
   3    -28.1457635  0.137157E-05  0.113E-02    2.49       2.1  T
   4    -28.1457644 -0.833387E-06  0.760E-03    2.49       3.2  T
   5    -28.1457652 -0.815644E-06  0.165E-03    2.49      14.7  T
   6    -28.1457652 -0.181355E-07  0.713E-04    2.49      34.0  T
   7    -28.1457652 -0.603350E-09  0.536E-04    2.49      45.3  T
     SCC iter.                  ...        0 min,  0.006 sec
     gradient                   ...        0 min,  0.008 sec
 * total energy  :   -27.5409134 Eh     change       -0.2185264E-04 Eh
   gradient norm :     0.0019341 Eh/α   predicted    -0.1501837E-04 ( -31.27%)
   displ. norm   :     0.1017993 α      lambda       -0.1315407E-04
   maximum displ.:     0.0626574 α      in ANC's #2, #4, #6, ...

........................................................................
.............................. CYCLE   14 ..............................
........................................................................
   1    -28.1460121 -0.281460E+02  0.666E-02    2.49       0.0  T
   2    -28.1460124 -0.242165E-06  0.385E-02    2.49       1.0  T
   3    -28.1460123  0.344918E-07  0.458E-03    2.49       5.3  T
   4    -28.1460123 -0.866746E-08  0.336E-03    2.49       7.2  T
   5    -28.1460124 -0.105996E-06  0.861E-04    2.49      28.2  T
   6    -28.1460124 -0.556333E-08  0.512E-04    2.49      47.4  T
     SCC iter.                  ...        0 min,  0.005 sec
     gradient                   ...        0 min,  0.008 sec
 * total energy  :   -27.5409258 Eh     change       -0.1240232E-04 Eh
   gradient norm :     0.0019239 Eh/α   predicted    -0.6606304E-05 ( -46.73%)
   displ. norm   :     0.0746624 α      lambda       -0.1139113E-04
   maximum displ.:     0.0536362 α      in ANC's #2, #4, #3, ...

........................................................................
.............................. CYCLE   15 ..............................
........................................................................
   1    -28.1462511 -0.281463E+02  0.549E-02    2.49       0.0  T
   2    -28.1462512 -0.132090E-06  0.321E-02    2.49       1.0  T
   3    -28.1462510  0.185061E-06  0.437E-03    2.49       5.6  T
   4    -28.1462512 -0.193679E-06  0.229E-03    2.49      10.6  T
   5    -28.1462513 -0.256955E-07  0.131E-03    2.49      18.6  T
   6    -28.1462513 -0.252754E-07  0.413E-04    2.49      58.8  T
   7    -28.1462513 -0.755943E-09  0.232E-04    2.49     104.5  T
     SCC iter.                  ...        0 min,  0.005 sec
     gradient                   ...        0 min,  0.008 sec
 * total energy  :   -27.5409361 Eh     change       -0.1031993E-04 Eh
   gradient norm :     0.0013366 Eh/α   predicted    -0.5711718E-05 ( -44.65%)
   displ. norm   :     0.1023644 α      lambda       -0.1149186E-04
   maximum displ.:     0.0728074 α      in ANC's #2, #4, #3, ...

........................................................................
.............................. CYCLE   16 ..............................
........................................................................
   1    -28.1456765 -0.281457E+02  0.671E-02    2.49       0.0  T
   2    -28.1456768 -0.370671E-06  0.380E-02    2.49       1.0  T
   3    -28.1456762  0.584640E-06  0.758E-03    2.49       3.2  T
   4    -28.1456766 -0.397216E-06  0.495E-03    2.49       4.9  T
   5    -28.1456769 -0.299885E-06  0.151E-03    2.49      16.1  T
   6    -28.1456770 -0.277137E-07  0.485E-04    2.49      50.0  T
   7    -28.1456770 -0.182817E-08  0.259E-04    2.49      93.7  T
     SCC iter.                  ...        0 min,  0.006 sec
     gradient                   ...        0 min,  0.008 sec
 * total energy  :   -27.5409464 Eh     change       -0.1025186E-04 Eh
   gradient norm :     0.0016632 Eh/α   predicted    -0.5773922E-05 ( -43.68%)
   displ. norm   :     0.0725266 α      lambda       -0.9508564E-05
   maximum displ.:     0.0595670 α      in ANC's #2, #6, #3, ...

........................................................................
.............................. CYCLE   17 ..............................
........................................................................
   1    -28.1460192 -0.281460E+02  0.480E-02    2.49       0.0  T
   2    -28.1460194 -0.188880E-06  0.272E-02    2.49       1.0  T
   3    -28.1460193  0.578618E-07  0.394E-03    2.49       6.2  T
   4    -28.1460193  0.305339E-07  0.319E-03    2.49       7.6  T
   5    -28.1460194 -0.134066E-06  0.970E-04    2.49      25.0  T
   6    -28.1460194 -0.106239E-07  0.228E-04    2.49     106.3  T
     SCC iter.                  ...        0 min,  0.005 sec
     gradient                   ...        0 min,  0.008 sec
 * total energy  :   -27.5409549 Eh     change       -0.8533869E-05 Eh
   gradient norm :     0.0011961 Eh/α   predicted    -0.4764613E-05 ( -44.17%)
   displ. norm   :     0.1015246 α      lambda       -0.8098212E-05
   maximum displ.:     0.0798965 α      in ANC's #2, #4, #3, ...

........................................................................
.............................. CYCLE   18 ..............................
........................................................................
   1    -28.1456888 -0.281457E+02  0.715E-02    2.49       0.0  T
   2    -28.1456892 -0.373140E-06  0.404E-02    2.49       1.0  T
   3    -28.1456887  0.476690E-06  0.726E-03    2.49       3.3  T
   4    -28.1456891 -0.340775E-06  0.466E-03    2.49       5.2  T
   5    -28.1456893 -0.240032E-06  0.167E-03    2.49      14.5  T
   6    -28.1456893 -0.444066E-07  0.195E-04    2.49     124.5  T
   7    -28.1456893 -0.783373E-10  0.125E-04    2.49     194.6  T
     SCC iter.                  ...        0 min,  0.005 sec
     gradient                   ...        0 min,  0.008 sec
 * total energy  :   -27.5409619 Eh     change       -0.6973242E-05 Eh
   gradient norm :     0.0016638 Eh/α   predicted    -0.4066450E-05 ( -41.68%)
   displ. norm   :     0.0849673 α      lambda       -0.8273262E-05
   maximum displ.:     0.0679391 α      in ANC's #2, #3, #4, ...

........................................................................
.............................. CYCLE   19 ..............................
........................................................................
   1    -28.1460255 -0.281460E+02  0.529E-02    2.49       0.0  T
   2    -28.1460257 -0.232363E-06  0.302E-02    2.49       1.0  T
   3    -28.1460253  0.412270E-06  0.654E-03    2.49       3.7  T
   4    -28.1460258 -0.447358E-06  0.290E-03    2.49       8.4  T
   5    -28.1460258 -0.377008E-07  0.141E-03    2.49      17.2  T
   6    -28.1460258 -0.275313E-07  0.449E-04    2.49      54.0  T
   7    -28.1460258 -0.238498E-08  0.186E-04    2.49     130.2  T
     SCC iter.                  ...        0 min,  0.005 sec
     gradient                   ...        0 min,  0.008 sec
 * total energy  :   -27.5409679 Eh     change       -0.6014467E-05 Eh
   gradient norm :     0.0016370 Eh/α   predicted    -0.4148954E-05 ( -31.02%)
   displ. norm   :     0.1122727 α      lambda       -0.1170348E-04
   maximum displ.:     0.0855632 α      in ANC's #2, #4, #7, ...

........................................................................
.............................. CYCLE   20 ..............................
........................................................................
   1    -28.1457800 -0.281458E+02  0.751E-02    2.49       0.0  T
   2    -28.1457803 -0.333258E-06  0.433E-02    2.49       1.0  T
   3    -28.1457795  0.772670E-06  0.863E-03    2.49       2.8  T
   4    -28.1457803 -0.737801E-06  0.439E-03    2.49       5.5  T
   5    -28.1457804 -0.151208E-06  0.188E-03    2.49      12.9  T
   6    -28.1457805 -0.475183E-07  0.602E-04    2.49      40.3  T
   7    -28.1457805 -0.229111E-08  0.356E-04    2.49      68.1  T
     SCC iter.                  ...        0 min,  0.005 sec
     gradient                   ...        0 min,  0.008 sec
 * total energy  :   -27.5409766 Eh     change       -0.8642425E-05 Eh
   gradient norm :     0.0013265 Eh/α   predicted    -0.5882557E-05 ( -31.93%)
   displ. norm   :     0.0241320 α      lambda       -0.4391163E-05
   maximum displ.:     0.0136725 α      in ANC's #2, #7, #6, ...
 * RMSD in coord.:     0.3717062 α      energy gain  -0.4957225E-02 Eh

generating ANC from model Hessian ...
Using Lindh-Hessian (1995)
 Shifting diagonal of input Hessian by   4.827558600803497E-003
 Lowest  eigenvalues of input Hessian
   -0.000000   -0.000000   -0.000000    0.000000    0.000000    0.000000
    0.005000    0.005064    0.005378    0.005471    0.005747    0.008493
    0.015700    0.020372    0.022594    0.027046    0.033173    0.037951
 Highest eigenvalues
    1.669637    1.851010    1.873600    1.962922    2.613289    2.679952
 

........................................................................
.............................. CYCLE   21 ..............................
........................................................................
   1    -28.1460463 -0.281460E+02  0.199E-02    2.49       0.0  T
   2    -28.1460464 -0.443862E-07  0.114E-02    2.49       2.1  T
   3    -28.1460461  0.207330E-06  0.387E-03    2.49       6.3  T
   4    -28.1460464 -0.217633E-06  0.149E-03    2.49      16.3  T
   5    -28.1460464 -0.769764E-08  0.993E-04    2.49      24.4  T
   6    -28.1460464 -0.144788E-07  0.179E-04    2.49     135.5  T
     SCC iter.                  ...        0 min,  0.005 sec
     gradient                   ...        0 min,  0.008 sec
 * total energy  :   -27.5409801 Eh     change       -0.3560738E-05 Eh
   gradient norm :     0.0008819 Eh/α   predicted     0.0000000E+00 (-100.00%)
   displ. norm   :     0.0176976 α      lambda       -0.2271194E-05
   maximum displ.:     0.0088193 α      in ANC's #4, #1, #2, ...

   *** GEOMETRY OPTIMIZATION CONVERGED AFTER 21 ITERATIONS ***

------------------------------------------------------------------------
 total energy gain   :        -0.0049608 Eh       -3.1129 kcal/mol
 total RMSD          :         0.3717062 a0        0.1967 Å
 total power (kW/mol):        -0.6202163 (step)  -30.5165 (real)
------------------------------------------------------------------------

 ANCopt (total)                0 d,  0 h,  0 min,  0.427 sec
 optimizer setup                ...        0 min,  0.000 sec (  0.033%)
 model hessian                  ...        0 min,  0.002 sec (  0.353%)
 ANC generation                 ...        0 min,  0.001 sec (  0.214%)
 coordinate transformation      ...        0 min,  0.000 sec (  0.068%)
 single point calculation       ...        0 min,  0.417 sec ( 97.721%)
 optimization log               ...        0 min,  0.002 sec (  0.376%)
 hessian update                 ...        0 min,  0.000 sec (  0.053%)
 rational function              ...        0 min,  0.004 sec (  0.874%)

================
 final structure:
================
$coord
    1.84652689255941   -0.44327574854499    0.32641834836282      C 
    4.10625615491910   -0.21263031882758    0.24490623388878      C 
    6.72872945622717    0.07553819859936    0.14956245991463      C 
    8.09710399257417    3.06498485923186    0.24007023906821      S 
   11.10892043026774    1.73718108834723    0.04060250016184      C 
   10.99417105545111   -0.85550967401036   -0.08071231555563      C 
    8.52168128927376   -1.79220239222727   -0.01846379108561      C 
   13.25046708860441    3.25837669628634    0.02203458021580      C 
   15.10160139866651    4.60426417856127    0.00625603759960      C 
   17.24891319874654    6.15742786886316   -0.01119976904898      C 
   19.59613991405498    5.28585546830330   -0.25920571710849      C 
   -0.12130853625603   -0.66465049765190    0.39480264687216      H 
   12.65347331618592   -2.02187699531153   -0.20884507832853      H 
    8.04727942408107   -3.76732249343990   -0.09279884367141      H 
   16.88086166315711    8.16128378610023    0.19401061002426      H 
   19.97794013578402    3.29712151157968   -0.46705615424272      H 
   21.19914885128216    6.53733029541774   -0.26391387957471      H 
$end
           -------------------------------------------------
          |                Final Singlepoint                |
           -------------------------------------------------

          ...................................................
          :                      SETUP                      :
          :.................................................:
          :  # basis functions                  56          :
          :  # atomic orbitals                  55          :
          :  # shells                           29          :
          :  # electrons                        52          :
          :  max. iterations                   250          :
          :  Hamiltonian                  GFN2-xTB          :
          :  restarted?                      false          :
          :  GBSA solvation                  false          :
          :  PC potential                    false          :
          :  electronic temp.          300.0000000     K    :
          :  accuracy                    1.0000000          :
          :  -> integral cutoff          0.2500000E+02      :
          :  -> integral neglect         0.1000000E-07      :
          :  -> SCF convergence          0.1000000E-05 Eh   :
          :  -> wf. convergence          0.1000000E-03 e    :
          :  Broyden damping             0.4000000          :
          ...................................................

 iter      E             dE          RMSdq      gap      omega  full diag
   1    -28.1460464 -0.281460E+02  0.121E-04    2.49       0.0  T
   2    -28.1460464  0.994049E-11  0.731E-05    2.49     331.6  T
   3    -28.1460464 -0.101302E-09  0.455E-05    2.49     532.5  T

   *** convergence criteria satisfied after 3 iterations ***

         #    Occupation            Energy/Eh            Energy/eV
      -------------------------------------------------------------
         1        2.0000           -0.7303211             -19.8730
       ...           ...                  ...                  ...
        20        2.0000           -0.4454698             -12.1218
        21        2.0000           -0.4430538             -12.0561
        22        2.0000           -0.4187977             -11.3961
        23        2.0000           -0.4098810             -11.1534
        24        2.0000           -0.4066883             -11.0666
        25        2.0000           -0.3979321             -10.8283
        26        2.0000           -0.3678950             -10.0109 (HOMO)
        27                         -0.2765111              -7.5242 (LUMO)
        28                         -0.2273002              -6.1852
        29                         -0.2108141              -5.7365
        30                         -0.1874859              -5.1018
        31                         -0.1806865              -4.9167
       ...                                ...                  ...
        55                          1.4421167              39.2420
      -------------------------------------------------------------
                  HL-Gap            0.0913839 Eh            2.4867 eV
             Fermi-level           -0.3222031 Eh           -8.7676 eV

 SCC (total)                   0 d,  0 h,  0 min,  0.018 sec
 SCC setup                      ...        0 min,  0.000 sec (  0.851%)
 Dispersion                     ...        0 min,  0.000 sec (  0.738%)
 integral evaluation            ...        0 min,  0.006 sec ( 32.107%)
 zeroth order Hamiltonian       ...        0 min,  0.000 sec (  0.622%)
 iterations                     ...        0 min,  0.003 sec ( 16.494%)
 molecular gradient             ...        0 min,  0.008 sec ( 47.240%)
 printout                       ...        0 min,  0.000 sec (  1.602%)

         :::::::::::::::::::::::::::::::::::::::::::::::::::::
         ::                     SUMMARY                     ::
         :::::::::::::::::::::::::::::::::::::::::::::::::::::
         :: total energy             -27.540980114863 Eh    ::
         :: gradient norm              0.000882088070 Eh/a0 ::
         :: HOMO-LUMO gap              2.486683311452 eV    ::
         ::.................................................::
         :: SCC energy               -28.146046383749 Eh    ::
         :: -> isotropic ES            0.002738566879 Eh    ::
         :: -> anisotropic ES          0.001864702167 Eh    ::
         :: -> anisotropic XC          0.025801232781 Eh    ::
         :: -> dispersion             -0.015168023045 Eh    ::
         :: repulsion energy           0.605210209692 Eh    ::
         :: add. restraining           0.000000000000 Eh    ::
         :::::::::::::::::::::::::::::::::::::::::::::::::::::

           -------------------------------------------------
          |                Property Printout                |
           -------------------------------------------------

    * Orbital Energies and Occupations

         #    Occupation            Energy/Eh            Energy/eV
      -------------------------------------------------------------
         1        2.0000           -0.7303211             -19.8730
       ...           ...                  ...                  ...
        14        2.0000           -0.4933356             -13.4243
        15        2.0000           -0.4835926             -13.1592
        16        2.0000           -0.4768237             -12.9750
        17        2.0000           -0.4718247             -12.8390
        18        2.0000           -0.4667040             -12.6997
        19        2.0000           -0.4548170             -12.3762
        20        2.0000           -0.4454698             -12.1218
        21        2.0000           -0.4430538             -12.0561
        22        2.0000           -0.4187977             -11.3961
        23        2.0000           -0.4098810             -11.1534
        24        2.0000           -0.4066883             -11.0666
        25        2.0000           -0.3979321             -10.8283
        26        2.0000           -0.3678950             -10.0109 (HOMO)
        27                         -0.2765111              -7.5242 (LUMO)
        28                         -0.2273002              -6.1852
        29                         -0.2108141              -5.7365
        30                         -0.1874859              -5.1018
        31                         -0.1806865              -4.9167
        32                         -0.1520376              -4.1372
        33                         -0.1129640              -3.0739
        34                         -0.0944981              -2.5714
        35                         -0.0775059              -2.1090
        36                         -0.0028903              -0.0786
        37                          0.0392898               1.0691
       ...                                ...                  ...
        55                          1.4421167              39.2420
      -------------------------------------------------------------
                  HL-Gap            0.0913839 Eh            2.4867 eV
             Fermi-level           -0.3222031 Eh           -8.7676 eV

     #   Z        covCN         q      C6AA      α(0)
     1   6 C      1.910    -0.094    33.698     9.375
     2   6 C      2.012    -0.021    31.589     9.077
     3   6 C      2.988     0.047    26.930     8.513
     4  16 S      2.345    -0.022   141.971    20.054
     5   6 C      2.986     0.048    26.917     8.510
     6   6 C      3.091    -0.044    28.992     8.826
     7   6 C      3.091    -0.043    28.965     8.821
     8   6 C      2.013    -0.044    32.209     9.166
     9   6 C      1.976    -0.029    31.833     9.111
    10   6 C      2.887    -0.003    28.106     8.692
    11   6 C      2.847    -0.080    29.997     8.976
    12   1 H      0.928     0.082     1.953     2.186
    13   1 H      0.926     0.037     2.483     2.464
    14   1 H      0.926     0.037     2.485     2.465
    15   1 H      0.925     0.049     2.338     2.391
    16   1 H      0.926     0.042     2.422     2.434
    17   1 H      0.926     0.039     2.462     2.453

 Mol. C6AA /au·bohr⁶  :       5739.122768
 Mol. C8AA /au·bohr⁸  :     167464.662351
 Mol. α(0) /au        :        123.514005


Wiberg/Mayer (AO) data.
largest (>0.10) Wiberg bond orders for each atom
          total WBO             WBO to atom ...
     1  C   3.954        C    2 2.786    H   12 0.971
     2  C   3.980        C    1 2.786    C    3 1.157
     3  C   3.939        C    7 1.487    C    2 1.157    S    4 1.130
     4  S   2.593        C    3 1.130    C    5 1.119
     5  C   3.954        C    6 1.474    C    8 1.188    S    4 1.119
     6  C   3.962        C    5 1.474    C    7 1.334    H   13 0.965
     7  C   3.986        C    3 1.487    C    6 1.334    H   14 0.965
     8  C   3.979        C    9 2.599    C    5 1.188    C   11 0.121
     9  C   3.966        C    8 2.599    C   10 1.162
    10  C   3.991        C   11 1.851    C    9 1.162    H   15 0.947
    11  C   3.934        C   10 1.851    H   17 0.978    H   16 0.978    C    8 0.121
    12  H   0.993        C    1 0.971
    13  H   0.998        C    6 0.965
    14  H   0.998        C    7 0.965
    15  H   0.995        C   10 0.947
    16  H   0.998        C   11 0.978
    17  H   0.998        C   11 0.978

molecular dipole:
                 x           y           z       tot (Debye)
 q only:        0.150      -0.022      -0.007
   full:        0.194      -0.201      -0.018       0.712
molecular quadrupole (traceless):
                xx          xy          yy          xz          yz          zz
 q only:        6.606       2.658      -1.534      -0.294       0.084      -5.072
  q+dip:       14.437       3.264      -2.559      -0.929       0.328     -11.878
   full:       10.461       1.729      -2.636      -0.613       0.130      -7.825

           -------------------------------------------------
          |                Geometry Summary                 |
           -------------------------------------------------

      molecular mass/u    :      158.2174000
   center of mass at/Å    :        5.4921562       1.0832316       0.0411266
  moments of inertia/u·Å² :        0.1144312E+03   0.1313315E+04   0.1427672E+04
rotational constants/cm⁻¹ :        0.1473167E+00   0.1283594E-01   0.1180778E-01

 * 14 selected distances

     #   Z        #   Z                                     value/Å
     1   6 C      2   6 C                                 1.2027837
     3   6 C      4  16 S                                 1.7404568
     4  16 S      5   6 C                                 1.7449927 (max)
     5   6 C      6   6 C                                 1.3748357
     3   6 C      7   6 C                                 1.3729436
     6   6 C      7   6 C                                 1.3995187
     8   6 C      9   6 C                                 1.2111526
    10   6 C     11   6 C                                 1.3314481
     1   6 C     12   1 H                                 1.0485270 (min)
     6   6 C     13   1 H                                 1.0754302
     7   6 C     14   1 H                                 1.0756343
    10   6 C     15   1 H                                 1.0835881
    11   6 C     16   1 H                                 1.0772411
    11   6 C     17   1 H                                 1.0761765

 * 3 distinct bonds (by element types)

   Z      Z             #   av. dist./Å        max./Å        min./Å
   1 H    6 C           6     1.0727662     1.0835881     1.0485270
   6 C    6 C           6     1.3154471     1.3995187     1.2027837
   6 C   16 S           2     1.7427248     1.7449927     1.7404568


optimized geometry written to: xtbopt.xyz


           -------------------------------------------------
          | TOTAL ENERGY              -27.540980114863 Eh   |
          | GRADIENT NORM               0.000882088070 Eh/α |
          | HOMO-LUMO GAP               2.486683311452 eV   |
           -------------------------------------------------

------------------------------------------------------------------------
 * finished run on 2021/05/19 at 10:59:48.010     
------------------------------------------------------------------------
 total:
 * wall-time:     0 d,  0 h,  0 min,  0.489 sec
 *  cpu-time:     0 d,  0 h,  0 min,  0.488 sec
 * ratio c/w:     0.996 speedup
 SCF:
 * wall-time:     0 d,  0 h,  0 min,  0.026 sec
 *  cpu-time:     0 d,  0 h,  0 min,  0.026 sec
 * ratio c/w:     0.998 speedup
 ANC optimizer:
 * wall-time:     0 d,  0 h,  0 min,  0.445 sec
 *  cpu-time:     0 d,  0 h,  0 min,  0.444 sec
 * ratio c/w:     0.998 speedup

