      -----------------------------------------------------------      
     |                   =====================                   |     
     |                           x T B                           |     
     |                   =====================                   |     
     |                         S. Grimme                         |     
     |          Mulliken Center for Theoretical Chemistry        |     
     |                    University of Bonn                     |     
     |                Version 6.2 RC2 (SAW190805)                |     
      -----------------------------------------------------------      

   This program is distributed in the hope that it will be useful,
   but WITHOUT ANY WARRANTY; without even the implied warranty of
   MERCHANTABILITY or FITNESS FOR A PARTICULAR PURPOSE.
   
   FOR NON-COMMERCIAL, ACADEMIA USE ONLY.
   
   Cite this work as:
   * S. Grimme, C. Bannwarth, P. Shushkov, J. Chem. Theory Comput., 2017,
     13, 1989-2009. DOI: 10.1021/acs.jctc.7b00118
   * C. Bannwarth, S. Ehlert and S. Grimme., J. Chem. Theory Comput., 2019,
     15, 1652-1671. DOI: 10.1021/acs.jctc.8b01176
   * P. Pracht, E. Caldeweyher, S. Ehlert, S. Grimme, ChemRxiv, 2019, preprint.
     DOI: 10.26434/chemrxiv.8326202.v1
   
   for DFT-D4:
   * E. Caldeweyher, C. Bannwarth and S. Grimme, J. Chem. Phys., 2017,
     147, 034112. DOI: 10.1063/1.4993215
   * E. Caldeweyher, S. Ehlert, A. Hansen, H. Neugebauer, S. Spicher,
     C. Bannwarth and S. Grimme, J. Chem. Phys., 2019, 150, 154122.
     DOI: 10.1063/1.5090222
   
   for sTDA-xTB:
   * S. Grimme and C. Bannwarth, J. Chem. Phys., 2016, 145, 054103.
     DOI: 10.1063/1.4959605
   
   in the mass-spec context:
   * V. Asgeirsson, C. Bauer and S. Grimme, Chem. Sci., 2017, 8, 4879.
     DOI: 10.1039/c7sc00601b
   
   for metadynamics refer to:
   * S. Grimme, J. Chem. Theory Comput., 2019, 155, 2847-2862
     DOI: 10.1021/acs.jctc.9b00143
   
   with help from (in alphabetical order)
   C. Bannwarth, F. Bohle, G. Brandenburg, E. Caldeweyher, M. Checinski,
   S. Dohm, S. Ehlert, S. Ehrlich, F. März, H. Neugebauer, J. Pisarek,
   P. Pracht, P. Shushkov, and S. Spicher.
   
 * started run on 2021/05/19 at 10:59:48.215     

           -------------------------------------------------
          |                Calculation Setup                |
           -------------------------------------------------

          program call               : /ihome/ghutchison/geoffh/xtb/xtb 565.xyz -opt
          hostname                   : smp-n144
          coordinate file            : 565.xyz
          omp threads                :                     1
          number of atoms            :                    24
          number of electrons        :                    68
          charge                     :                     0
          spin                       :                   0.0
          first test random number   :      0.37221507105896


########################################################################
# WARNING! Please study the warnings concerning your input carefully
#  - the use of '-opt' is discouraged, please use '--opt' next time
########################################################################

           ------------------------------------------------- 
          |                 G F N 2 - x T B                 |
          | Geometry, Frequencies, Noncovalent interactions |
          |            JCTC 2019 parametrisation            |
           ------------------------------------------------- 
             KAB for C  - Si     :                1.0500
             KAB for H  - Pd     :                0.9500
             k(s)              :                1.8500
             k(p)              :                2.2300
             k(d)              :                2.2300
             k(f)              :                2.0000
             kEN (H0ij)        :               -2.0000
             D4 a1             :                0.5200
             D4 a2             :                5.0000
             D4 s6             :                1.0000
             D4 s8             :                2.7000
             D4 s9             :                5.0000
             alphaj            :                2.0000

  Z AO/shell   Hii/eV     exponent
  1     Wed Apr 25 08:07:45 CEST 2018   EN: 2.200 GM2: 0.406  GM3: 0.0800  RAES: 1.40
     1s    -10.707211    1.230000
  6     Wed Apr 25 08:07:45 CEST 2018   EN: 2.550 GM2: 0.538  GM3: 0.1500  RAES: 3.00
     2s    -13.970922    2.096432
     2p    -10.063292    1.800000
  7     Wed Apr 25 08:07:45 CEST 2018   EN: 3.040 GM2: 0.461  GM3:-0.0640  RAES: 1.90
     2s    -16.686243    2.339881
     2p    -12.523956    2.014332
  8     Wed Apr 25 08:07:45 CEST 2018   EN: 3.440 GM2: 0.452  GM3:-0.0517  RAES: 1.80
     2s    -20.229985    2.439742
     2p    -15.503117    2.137023
 16     Tue Apr 24 11:44:34 CEST 2018   EN: 2.580 GM2: 0.340  GM3:-0.0502  RAES: 3.10
     3s    -20.029654    1.981333
     3p    -11.377694    2.025643
     3d     -0.420282    1.702555

           ------------------------------------------------- 
          |        Self-Consistent Charge Iterations        |
           ------------------------------------------------- 

          ...................................................
          :                      SETUP                      :
          :.................................................:
          :  # basis functions                  69          :
          :  # atomic orbitals                  68          :
          :  # shells                           38          :
          :  # electrons                        68          :
          :  max. iterations                   250          :
          :  Hamiltonian                  GFN2-xTB          :
          :  restarted?                      false          :
          :  GBSA solvation                  false          :
          :  PC potential                    false          :
          :  electronic temp.          300.0000000     K    :
          :  accuracy                    1.0000000          :
          :  -> integral cutoff          0.2500000E+02      :
          :  -> integral neglect         0.1000000E-07      :
          :  -> SCF convergence          0.1000000E-05 Eh   :
          :  -> wf. convergence          0.1000000E-03 e    :
          :  Broyden damping             0.4000000          :
          ...................................................

 iter      E             dE          RMSdq      gap      omega  full diag
   1    -37.5798597 -0.375799E+02  0.465E+00    3.82       0.0  T
   2    -37.5860930 -0.623333E-02  0.291E+00    3.83       1.0  T
   3    -37.4660460  0.120047E+00  0.278E+00    3.64       1.0  T
   4    -37.6194970 -0.153451E+00  0.731E-01    3.49       1.0  T
   5    -37.6263993 -0.690238E-02  0.216E-01    3.51       1.0  T
   6    -37.6267060 -0.306704E-03  0.103E-01    3.54       1.0  T
   7    -37.6268343 -0.128237E-03  0.347E-02    3.58       1.0  T
   8    -37.6268433 -0.906725E-05  0.145E-02    3.57       1.4  T
   9    -37.6268439 -0.584680E-06  0.433E-03    3.57       4.7  T
  10    -37.6268440 -0.343861E-07  0.193E-03    3.57      10.6  T
  11    -37.6268440 -0.295817E-07  0.932E-04    3.57      21.9  T
  12    -37.6268440 -0.629503E-08  0.492E-04    3.57      41.5  T

   *** convergence criteria satisfied after 12 iterations ***

         #    Occupation            Energy/Eh            Energy/eV
      -------------------------------------------------------------
         1        2.0000           -0.7332658             -19.9532
       ...           ...                  ...                  ...
        28        2.0000           -0.4563056             -12.4167
        29        2.0000           -0.4470611             -12.1652
        30        2.0000           -0.4416712             -12.0185
        31        2.0000           -0.4349761             -11.8363
        32        2.0000           -0.4153435             -11.3021
        33        2.0000           -0.3914073             -10.6507
        34        2.0000           -0.3879845             -10.5576 (HOMO)
        35                         -0.2567771              -6.9873 (LUMO)
        36                         -0.2526321              -6.8745
        37                         -0.2477385              -6.7413
        38                         -0.2013808              -5.4798
        39                         -0.1769304              -4.8145
       ...                                ...                  ...
        68                          0.6652700              18.1029
      -------------------------------------------------------------
                  HL-Gap            0.1312074 Eh            3.5703 eV
             Fermi-level           -0.3223808 Eh           -8.7724 eV

 SCC (total)                   0 d,  0 h,  0 min,  0.038 sec
 SCC setup                      ...        0 min,  0.000 sec (  0.777%)
 Dispersion                     ...        0 min,  0.000 sec (  0.916%)
 integral evaluation            ...        0 min,  0.009 sec ( 23.287%)
 zeroth order Hamiltonian       ...        0 min,  0.000 sec (  0.509%)
 iterations                     ...        0 min,  0.014 sec ( 37.060%)
 molecular gradient             ...        0 min,  0.014 sec ( 36.298%)
 printout                       ...        0 min,  0.000 sec (  1.008%)

         :::::::::::::::::::::::::::::::::::::::::::::::::::::
         ::                     SUMMARY                     ::
         :::::::::::::::::::::::::::::::::::::::::::::::::::::
         :: total energy             -37.175016324571 Eh    ::
         :: gradient norm              0.265213385589 Eh/a0 ::
         :: HOMO-LUMO gap              3.570336158337 eV    ::
         ::.................................................::
         :: SCC energy               -37.626843997269 Eh    ::
         :: -> isotropic ES            0.028336481044 Eh    ::
         :: -> anisotropic ES          0.004537827044 Eh    ::
         :: -> anisotropic XC          0.027007214243 Eh    ::
         :: -> dispersion             -0.023451313985 Eh    ::
         :: repulsion energy           0.451601113964 Eh    ::
         :: add. restraining           0.000000000000 Eh    ::
         :::::::::::::::::::::::::::::::::::::::::::::::::::::

      ----------------------------------------------------------- 
     |                   =====================                   |
     |                        A N C O P T                        |
     |                   =====================                   |
     |               Approximate Normal Coordinate               |
     |                Rational Function Optimizer                |
      ----------------------------------------------------------- 

          ...................................................
          :                      SETUP                      :
          :.................................................:
          :   optimization level            normal          :
          :   max. optcycles                   200          :
          :   ANC micro-cycles                  20          :
          :   degrees of freedom                66          :
          :.................................................:
          :   RF solver                   davidson          :
          :   input Hessian                  false          :
          :   write xtbopt.log                true          :
          :   linear?                        false          :
          :   energy convergence         0.5000000E-05 Eh   :
          :   grad. convergence          0.1000000E-02 Eh/α :
          :   maximium RF displ.         2.0000000          :
          :   Hlow (freq-cutoff)         0.5000000E-02      :
          :   Hmax (freq-cutoff)         5.0000000          :
          :   S6 in model hess.         20.0000000          :
          ...................................................

generating ANC from model Hessian ...
Using Lindh-Hessian (1995)
 Shifting diagonal of input Hessian by   3.515421297419313E-003
 Lowest  eigenvalues of input Hessian
   -0.000000   -0.000000   -0.000000   -0.000000    0.000000    0.000000
    0.005000    0.005283    0.006093    0.007133    0.008474    0.011507
    0.013915    0.019428    0.022370    0.024991    0.029601    0.031584
 Highest eigenvalues
    1.469838    1.501264    1.659461    1.759655    1.826715    1.958321
 

........................................................................
.............................. CYCLE    1 ..............................
........................................................................
   1    -37.6268440 -0.376268E+02  0.206E-04    3.57       0.0  T
   2    -37.6268440  0.443734E-10  0.170E-04    3.57     120.3  T
   3    -37.6268440 -0.370228E-09  0.108E-04    3.57     188.1  T
     SCC iter.                  ...        0 min,  0.004 sec
     gradient                   ...        0 min,  0.014 sec
 * total energy  :   -37.1750163 Eh     change        0.5035354E-07 Eh
   gradient norm :     0.2652121 Eh/α   predicted     0.0000000E+00 (-100.00%)
   displ. norm   :     0.2980651 α      lambda       -0.5357404E-01
   maximum displ.:     0.1367786 α      in ANC's #28, #66, #48, ...

........................................................................
.............................. CYCLE    2 ..............................
........................................................................
   1    -37.7323183 -0.377323E+02  0.445E-01    3.89       0.0  T
   2    -37.7326052 -0.286861E-03  0.263E-01    3.89       1.0  T
   3    -37.7323264  0.278847E-03  0.187E-01    3.89       1.0  T
   4    -37.7327717 -0.445301E-03  0.360E-02    3.90       1.0  T
   5    -37.7327985 -0.268531E-04  0.980E-03    3.90       2.1  T
   6    -37.7327988 -0.260706E-06  0.375E-03    3.90       5.4  T
   7    -37.7327989 -0.100177E-06  0.220E-03    3.90       9.3  T
     SCC iter.                  ...        0 min,  0.008 sec
     gradient                   ...        0 min,  0.013 sec
 * total energy  :   -37.2059470 Eh     change       -0.3093070E-01 Eh
   gradient norm :     0.0430751 Eh/α   predicted    -0.2916686E-01 (  -5.70%)
   displ. norm   :     0.2915688 α      lambda       -0.3593040E-02
   maximum displ.:     0.1228659 α      in ANC's #7, #3, #5, ...

........................................................................
.............................. CYCLE    3 ..............................
........................................................................
   1    -37.7413294 -0.377413E+02  0.204E-01    3.93       0.0  T
   2    -37.7413606 -0.311971E-04  0.129E-01    3.93       1.0  T
   3    -37.7412929  0.676775E-04  0.850E-02    3.93       1.0  T
   4    -37.7414148 -0.121846E-03  0.157E-02    3.93       1.3  T
   5    -37.7414172 -0.248886E-05  0.461E-03    3.93       4.4  T
   6    -37.7414173 -0.977015E-07  0.130E-03    3.93      15.7  T
     SCC iter.                  ...        0 min,  0.007 sec
     gradient                   ...        0 min,  0.013 sec
 * total energy  :   -37.2083388 Eh     change       -0.2391818E-02 Eh
   gradient norm :     0.0151795 Eh/α   predicted    -0.1949297E-02 ( -18.50%)
   displ. norm   :     0.3109141 α      lambda       -0.1250476E-02
   maximum displ.:     0.1594972 α      in ANC's #3, #7, #5, ...

........................................................................
.............................. CYCLE    4 ..............................
........................................................................
   1    -37.7444931 -0.377445E+02  0.234E-01    3.94       0.0  T
   2    -37.7445144 -0.212853E-04  0.132E-01    3.95       1.0  T
   3    -37.7444514  0.630023E-04  0.591E-02    3.95       1.0  T
   4    -37.7445254 -0.740244E-04  0.135E-02    3.95       1.5  T
   5    -37.7445273 -0.187427E-05  0.407E-03    3.95       5.0  T
   6    -37.7445273 -0.487952E-07  0.116E-03    3.95      17.7  T
   7    -37.7445273 -0.223587E-08  0.530E-04    3.95      38.5  T
     SCC iter.                  ...        0 min,  0.008 sec
     gradient                   ...        0 min,  0.013 sec
 * total energy  :   -37.2091641 Eh     change       -0.8252719E-03 Eh
   gradient norm :     0.0099158 Eh/α   predicted    -0.6856912E-03 ( -16.91%)
   displ. norm   :     0.4777666 α      lambda       -0.1304138E-02
   maximum displ.:     0.2999293 α      in ANC's #2, #3, #5, ...

........................................................................
.............................. CYCLE    5 ..............................
........................................................................
   1    -37.7415038 -0.377415E+02  0.400E-01    3.95       0.0  T
   2    -37.7415579 -0.541436E-04  0.221E-01    3.95       1.0  T
   3    -37.7415312  0.267844E-04  0.489E-02    3.95       1.0  T
   4    -37.7415749 -0.437156E-04  0.187E-02    3.95       1.1  T
   5    -37.7415788 -0.392035E-05  0.561E-03    3.95       3.6  T
   6    -37.7415789 -0.152098E-06  0.182E-03    3.95      11.2  T
   7    -37.7415789 -0.241173E-08  0.846E-04    3.95      24.1  T
     SCC iter.                  ...        0 min,  0.008 sec
     gradient                   ...        0 min,  0.013 sec
 * total energy  :   -37.2094106 Eh     change       -0.2465622E-03 Eh
   gradient norm :     0.0353265 Eh/α   predicted    -0.8009185E-03 ( 224.83%)
   displ. norm   :     0.2702754 α      lambda       -0.1559491E-02
   maximum displ.:     0.1800259 α      in ANC's #1, #3, #2, ...

........................................................................
.............................. CYCLE    6 ..............................
........................................................................
   1    -37.7456245 -0.377456E+02  0.230E-01    3.95       0.0  T
   2    -37.7456393 -0.147899E-04  0.126E-01    3.95       1.0  T
   3    -37.7456157  0.235863E-04  0.385E-02    3.95       1.0  T
   4    -37.7456472 -0.315268E-04  0.936E-03    3.95       2.2  T
   5    -37.7456476 -0.416995E-06  0.263E-03    3.95       7.8  T
   6    -37.7456477 -0.374410E-07  0.968E-04    3.95      21.1  T
     SCC iter.                  ...        0 min,  0.007 sec
     gradient                   ...        0 min,  0.013 sec
 * total energy  :   -37.2104509 Eh     change       -0.1040260E-02 Eh
   gradient norm :     0.0124408 Eh/α   predicted    -0.8367064E-03 ( -19.57%)
   displ. norm   :     0.4951297 α      lambda       -0.1126782E-02
   maximum displ.:     0.2707891 α      in ANC's #1, #3, #2, ...

........................................................................
.............................. CYCLE    7 ..............................
........................................................................
   1    -37.7399025 -0.377399E+02  0.312E-01    3.94       0.0  T
   2    -37.7399212 -0.187269E-04  0.171E-01    3.94       1.0  T
   3    -37.7398486  0.726790E-04  0.661E-02    3.94       1.0  T
   4    -37.7399359 -0.873924E-04  0.149E-02    3.94       1.4  T
   5    -37.7399366 -0.666964E-06  0.306E-03    3.94       6.7  T
   6    -37.7399367 -0.851972E-07  0.158E-03    3.94      12.9  T
   7    -37.7399367 -0.424669E-08  0.950E-04    3.94      21.5  T
     SCC iter.                  ...        0 min,  0.008 sec
     gradient                   ...        0 min,  0.013 sec
 * total energy  :   -37.2113097 Eh     change       -0.8588130E-03 Eh
   gradient norm :     0.0189362 Eh/α   predicted    -0.7015083E-03 ( -18.32%)
   displ. norm   :     0.6274058 α      lambda       -0.1474652E-02
   maximum displ.:     0.3519386 α      in ANC's #2, #1, #3, ...

........................................................................
.............................. CYCLE    8 ..............................
........................................................................
   1    -37.7435895 -0.377436E+02  0.334E-01    3.93       0.0  T
   2    -37.7436160 -0.265231E-04  0.183E-01    3.93       1.0  T
   3    -37.7436149  0.109157E-05  0.323E-02    3.93       1.0  T
   4    -37.7436167 -0.177964E-05  0.224E-02    3.93       1.0  T
   5    -37.7436232 -0.658516E-05  0.513E-03    3.93       4.0  T
   6    -37.7436235 -0.296523E-06  0.214E-03    3.93       9.5  T
   7    -37.7436236 -0.192782E-07  0.130E-03    3.93      15.6  T
     SCC iter.                  ...        0 min,  0.008 sec
     gradient                   ...        0 min,  0.013 sec
 * total energy  :   -37.2122682 Eh     change       -0.9585437E-03 Eh
   gradient norm :     0.0171014 Eh/α   predicted    -0.1027568E-02 (   7.20%)
   displ. norm   :     0.5760160 α      lambda       -0.9832119E-03
   maximum displ.:     0.3197602 α      in ANC's #1, #3, #2, ...

........................................................................
.............................. CYCLE    9 ..............................
........................................................................
   1    -37.7379550 -0.377380E+02  0.336E-01    3.94       0.0  T
   2    -37.7379785 -0.235283E-04  0.184E-01    3.94       1.0  T
   3    -37.7379498  0.287031E-04  0.476E-02    3.94       1.0  T
   4    -37.7379882 -0.384321E-04  0.178E-02    3.94       1.1  T
   5    -37.7379901 -0.182661E-05  0.453E-03    3.94       4.5  T
   6    -37.7379903 -0.233954E-06  0.207E-03    3.94       9.9  T
   7    -37.7379903 -0.253666E-07  0.119E-03    3.94      17.2  T
     SCC iter.                  ...        0 min,  0.008 sec
     gradient                   ...        0 min,  0.013 sec
 * total energy  :   -37.2129386 Eh     change       -0.6703937E-03 Eh
   gradient norm :     0.0162451 Eh/α   predicted    -0.6547185E-03 (  -2.34%)
   displ. norm   :     0.3629475 α      lambda       -0.1048257E-02
   maximum displ.:     0.2002204 α      in ANC's #1, #3, #2, ...

........................................................................
.............................. CYCLE   10 ..............................
........................................................................
   1    -37.7489560 -0.377490E+02  0.189E-01    3.97       0.0  T
   2    -37.7489660 -0.100100E-04  0.107E-01    3.97       1.0  T
   3    -37.7489393  0.267722E-04  0.412E-02    3.97       1.0  T
   4    -37.7489714 -0.321632E-04  0.122E-02    3.97       1.7  T
   5    -37.7489720 -0.596418E-06  0.541E-03    3.97       3.8  T
   6    -37.7489724 -0.330390E-06  0.216E-03    3.97       9.5  T
   7    -37.7489724 -0.655228E-07  0.860E-04    3.97      23.7  T
     SCC iter.                  ...        0 min,  0.008 sec
     gradient                   ...        0 min,  0.013 sec
 * total energy  :   -37.2135776 Eh     change       -0.6389267E-03 Eh
   gradient norm :     0.0121358 Eh/α   predicted    -0.5931760E-03 (  -7.16%)
   displ. norm   :     0.4888618 α      lambda       -0.5777419E-03
   maximum displ.:     0.2840731 α      in ANC's #1, #3, #2, ...

........................................................................
.............................. CYCLE   11 ..............................
........................................................................
   1    -37.7477353 -0.377477E+02  0.258E-01    3.96       0.0  T
   2    -37.7477477 -0.123507E-04  0.142E-01    3.97       1.0  T
   3    -37.7477495 -0.181421E-05  0.220E-02    3.97       1.0  T
   4    -37.7477491  0.357655E-06  0.139E-02    3.96       1.5  T
   5    -37.7477519 -0.279789E-05  0.247E-03    3.97       8.3  T
   6    -37.7477520 -0.507728E-07  0.133E-03    3.97      15.4  T
     SCC iter.                  ...        0 min,  0.007 sec
     gradient                   ...        0 min,  0.013 sec
 * total energy  :   -37.2139845 Eh     change       -0.4069250E-03 Eh
   gradient norm :     0.0098009 Eh/α   predicted    -0.3579080E-03 ( -12.05%)
   displ. norm   :     0.3573431 α      lambda       -0.4923184E-03
   maximum displ.:     0.2202649 α      in ANC's #1, #3, #2, ...

........................................................................
.............................. CYCLE   12 ..............................
........................................................................
   1    -37.7508927 -0.377509E+02  0.202E-01    3.96       0.0  T
   2    -37.7509014 -0.869910E-05  0.112E-01    3.96       1.0  T
   3    -37.7508937  0.776132E-05  0.281E-02    3.97       1.0  T
   4    -37.7509041 -0.104221E-04  0.140E-02    3.96       1.5  T
   5    -37.7509052 -0.115849E-05  0.420E-03    3.96       4.9  T
   6    -37.7509055 -0.259434E-06  0.178E-03    3.97      11.5  T
   7    -37.7509055 -0.365350E-07  0.858E-04    3.96      23.8  T
     SCC iter.                  ...        0 min,  0.008 sec
     gradient                   ...        0 min,  0.013 sec
 * total energy  :   -37.2143444 Eh     change       -0.3599369E-03 Eh
   gradient norm :     0.0065019 Eh/α   predicted    -0.2775928E-03 ( -22.88%)
   displ. norm   :     0.4431835 α      lambda       -0.4224294E-03
   maximum displ.:     0.2730395 α      in ANC's #1, #3, #4, ...

........................................................................
.............................. CYCLE   13 ..............................
........................................................................
   1    -37.7480090 -0.377480E+02  0.257E-01    3.97       0.0  T
   2    -37.7480236 -0.145886E-04  0.144E-01    3.97       1.0  T
   3    -37.7480210  0.259710E-05  0.254E-02    3.97       1.0  T
   4    -37.7480276 -0.660443E-05  0.143E-02    3.97       1.4  T
   5    -37.7480294 -0.178494E-05  0.488E-03    3.97       4.2  T
   6    -37.7480297 -0.269734E-06  0.229E-03    3.97       8.9  T
   7    -37.7480297 -0.555150E-07  0.104E-03    3.97      19.6  T
     SCC iter.                  ...        0 min,  0.008 sec
     gradient                   ...        0 min,  0.013 sec
 * total energy  :   -37.2146057 Eh     change       -0.2612264E-03 Eh
   gradient norm :     0.0134713 Eh/α   predicted    -0.2527041E-03 (  -3.26%)
   displ. norm   :     0.2562472 α      lambda       -0.3921273E-03
   maximum displ.:     0.1381281 α      in ANC's #7, #4, #1, ...

........................................................................
.............................. CYCLE   14 ..............................
........................................................................
   1    -37.7533559 -0.377534E+02  0.172E-01    3.97       0.0  T
   2    -37.7533639 -0.799654E-05  0.991E-02    3.97       1.0  T
   3    -37.7533619  0.204629E-05  0.194E-02    3.97       1.1  T
   4    -37.7533661 -0.417927E-05  0.103E-02    3.97       2.0  T
   5    -37.7533669 -0.840547E-06  0.369E-03    3.97       5.5  T
   6    -37.7533670 -0.883598E-07  0.173E-03    3.97      11.8  T
   7    -37.7533670 -0.383981E-07  0.764E-04    3.97      26.7  T
     SCC iter.                  ...        0 min,  0.008 sec
     gradient                   ...        0 min,  0.013 sec
 * total energy  :   -37.2147769 Eh     change       -0.1712286E-03 Eh
   gradient norm :     0.0091277 Eh/α   predicted    -0.2089387E-03 (  22.02%)
   displ. norm   :     0.2606416 α      lambda       -0.2060801E-03
   maximum displ.:     0.1361071 α      in ANC's #1, #3, #4, ...

........................................................................
.............................. CYCLE   15 ..............................
........................................................................
   1    -37.7501901 -0.377502E+02  0.147E-01    3.97       0.0  T
   2    -37.7501940 -0.394915E-05  0.848E-02    3.97       1.0  T
   3    -37.7501824  0.116343E-04  0.275E-02    3.97       1.0  T
   4    -37.7501964 -0.139971E-04  0.824E-03    3.97       2.5  T
   5    -37.7501967 -0.307767E-06  0.250E-03    3.97       8.2  T
   6    -37.7501968 -0.498715E-07  0.113E-03    3.97      18.0  T
     SCC iter.                  ...        0 min,  0.007 sec
     gradient                   ...        0 min,  0.013 sec
 * total energy  :   -37.2148948 Eh     change       -0.1178718E-03 Eh
   gradient norm :     0.0068532 Eh/α   predicted    -0.1100416E-03 (  -6.64%)
   displ. norm   :     0.1190263 α      lambda       -0.1602295E-03
   maximum displ.:     0.0923939 α      in ANC's #4, #2, #7, ...

........................................................................
.............................. CYCLE   16 ..............................
........................................................................
   1    -37.7495786 -0.377496E+02  0.964E-02    3.96       0.0  T
   2    -37.7495813 -0.269981E-05  0.512E-02    3.96       1.0  T
   3    -37.7495808  0.567818E-06  0.122E-02    3.96       1.7  T
   4    -37.7495816 -0.891426E-06  0.736E-03    3.96       2.8  T
   5    -37.7495822 -0.517081E-06  0.169E-03    3.96      12.1  T
   6    -37.7495822 -0.368375E-07  0.605E-04    3.96      33.8  T
     SCC iter.                  ...        0 min,  0.007 sec
     gradient                   ...        0 min,  0.013 sec
 * total energy  :   -37.2150006 Eh     change       -0.1058208E-03 Eh
   gradient norm :     0.0078198 Eh/α   predicted    -0.8125062E-04 ( -23.22%)
   displ. norm   :     0.2357610 α      lambda       -0.2017380E-03
   maximum displ.:     0.1762971 α      in ANC's #4, #2, #7, ...

........................................................................
.............................. CYCLE   17 ..............................
........................................................................
   1    -37.7507726 -0.377508E+02  0.179E-01    3.96       0.0  T
   2    -37.7507802 -0.758369E-05  0.965E-02    3.96       1.0  T
   3    -37.7507780  0.217180E-05  0.222E-02    3.96       1.0  T
   4    -37.7507804 -0.240199E-05  0.148E-02    3.96       1.4  T
   5    -37.7507829 -0.249885E-05  0.186E-03    3.96      11.0  T
   6    -37.7507829 -0.212921E-07  0.109E-03    3.96      18.6  T
     SCC iter.                  ...        0 min,  0.007 sec
     gradient                   ...        0 min,  0.013 sec
 * total energy  :   -37.2151183 Eh     change       -0.1177041E-03 Eh
   gradient norm :     0.0054535 Eh/α   predicted    -0.1064771E-03 (  -9.54%)
   displ. norm   :     0.2420115 α      lambda       -0.1539696E-03
   maximum displ.:     0.2062163 α      in ANC's #4, #2, #6, ...

........................................................................
.............................. CYCLE   18 ..............................
........................................................................
   1    -37.7490397 -0.377490E+02  0.176E-01    3.96       0.0  T
   2    -37.7490460 -0.637992E-05  0.967E-02    3.96       1.0  T
   3    -37.7490332  0.128230E-04  0.316E-02    3.96       1.0  T
   4    -37.7490490 -0.157406E-04  0.118E-02    3.96       1.7  T
   5    -37.7490496 -0.639494E-06  0.210E-03    3.96       9.7  T
   6    -37.7490496 -0.438668E-07  0.119E-03    3.96      17.2  T
     SCC iter.                  ...        0 min,  0.007 sec
     gradient                   ...        0 min,  0.013 sec
 * total energy  :   -37.2152173 Eh     change       -0.9902294E-04 Eh
   gradient norm :     0.0081728 Eh/α   predicted    -0.8149470E-04 ( -17.70%)
   displ. norm   :     0.2402278 α      lambda       -0.1654119E-03
   maximum displ.:     0.1591987 α      in ANC's #4, #2, #1, ...

........................................................................
.............................. CYCLE   19 ..............................
........................................................................
   1    -37.7503189 -0.377503E+02  0.157E-01    3.96       0.0  T
   2    -37.7503242 -0.528394E-05  0.836E-02    3.96       1.0  T
   3    -37.7503221  0.205316E-05  0.191E-02    3.96       1.1  T
   4    -37.7503249 -0.278002E-05  0.107E-02    3.96       1.9  T
   5    -37.7503258 -0.906602E-06  0.195E-03    3.96      10.5  T
   6    -37.7503259 -0.781239E-07  0.658E-04    3.96      31.0  T
     SCC iter.                  ...        0 min,  0.007 sec
     gradient                   ...        0 min,  0.013 sec
 * total energy  :   -37.2153247 Eh     change       -0.1074390E-03 Eh
   gradient norm :     0.0083636 Eh/α   predicted    -0.8747943E-04 ( -18.58%)
   displ. norm   :     0.2947606 α      lambda       -0.1828843E-03
   maximum displ.:     0.2430886 α      in ANC's #4, #2, #5, ...

........................................................................
.............................. CYCLE   20 ..............................
........................................................................
   1    -37.7484593 -0.377485E+02  0.197E-01    3.96       0.0  T
   2    -37.7484685 -0.912987E-05  0.108E-01    3.96       1.0  T
   3    -37.7484673  0.115630E-05  0.207E-02    3.96       1.0  T
   4    -37.7484695 -0.217741E-05  0.121E-02    3.96       1.7  T
   5    -37.7484713 -0.181330E-05  0.269E-03    3.96       7.6  T
   6    -37.7484714 -0.886783E-07  0.136E-03    3.96      15.0  T
     SCC iter.                  ...        0 min,  0.007 sec
     gradient                   ...        0 min,  0.013 sec
 * total energy  :   -37.2153969 Eh     change       -0.7214164E-04 Eh
   gradient norm :     0.0087755 Eh/α   predicted    -0.9939266E-04 (  37.77%)
   displ. norm   :     0.0789420 α      lambda       -0.1729382E-03
   maximum displ.:     0.0383199 α      in ANC's #8, #7, #13, ...
 * RMSD in coord.:     0.9681191 α      energy gain  -0.4038056E-01 Eh

generating ANC from model Hessian ...
Using Lindh-Hessian (1995)
 Shifting diagonal of input Hessian by   3.385502979416834E-003
 Lowest  eigenvalues of input Hessian
   -0.000000   -0.000000   -0.000000    0.000000    0.000000    0.000000
    0.005000    0.006268    0.006934    0.008051    0.009208    0.012551
    0.014830    0.021554    0.024257    0.026958    0.032986    0.033117
 Highest eigenvalues
    1.520456    1.589808    1.691776    1.844123    1.906380    2.562145
 

........................................................................
.............................. CYCLE   21 ..............................
........................................................................
   1    -37.7526409 -0.377526E+02  0.640E-02    3.97       0.0  T
   2    -37.7526426 -0.161141E-05  0.385E-02    3.97       1.0  T
   3    -37.7526371  0.542433E-05  0.183E-02    3.98       1.1  T
   4    -37.7526436 -0.646815E-05  0.502E-03    3.97       4.1  T
   5    -37.7526438 -0.151173E-06  0.223E-03    3.97       9.1  T
   6    -37.7526438 -0.442396E-07  0.864E-04    3.97      23.6  T
   7    -37.7526438 -0.107024E-07  0.294E-04    3.97      69.4  T
     SCC iter.                  ...        0 min,  0.008 sec
     gradient                   ...        0 min,  0.014 sec
 * total energy  :   -37.2154655 Eh     change       -0.6865325E-04 Eh
   gradient norm :     0.0056274 Eh/α   predicted     0.0000000E+00 (-100.00%)
   displ. norm   :     0.0637553 α      lambda       -0.9439100E-04
   maximum displ.:     0.0483705 α      in ANC's #2, #8, #1, ...

........................................................................
.............................. CYCLE   22 ..............................
........................................................................
   1    -37.7521160 -0.377521E+02  0.557E-02    3.97       0.0  T
   2    -37.7521169 -0.853764E-06  0.311E-02    3.97       1.0  T
   3    -37.7521171 -0.260151E-06  0.366E-03    3.97       5.6  T
   4    -37.7521171 -0.178812E-08  0.256E-03    3.97       8.0  T
   5    -37.7521172 -0.689684E-07  0.803E-04    3.97      25.4  T
     SCC iter.                  ...        0 min,  0.006 sec
     gradient                   ...        0 min,  0.013 sec
 * total energy  :   -37.2155296 Eh     change       -0.6409573E-04 Eh
   gradient norm :     0.0025073 Eh/α   predicted    -0.4739187E-04 ( -26.06%)
   displ. norm   :     0.0661997 α      lambda       -0.6295684E-04
   maximum displ.:     0.0301125 α      in ANC's #2, #1, #8, ...

........................................................................
.............................. CYCLE   23 ..............................
........................................................................
   1    -37.7518877 -0.377519E+02  0.576E-02    3.96       0.0  T
   2    -37.7518885 -0.850001E-06  0.324E-02    3.96       1.0  T
   3    -37.7518862  0.231644E-05  0.123E-02    3.96       1.7  T
   4    -37.7518891 -0.290756E-05  0.295E-03    3.96       6.9  T
   5    -37.7518891 -0.195284E-07  0.898E-04    3.96      22.7  T
   6    -37.7518891 -0.375912E-08  0.437E-04    3.96      46.7  T
     SCC iter.                  ...        0 min,  0.007 sec
     gradient                   ...        0 min,  0.014 sec
 * total energy  :   -37.2155361 Eh     change       -0.6444645E-05 Eh
   gradient norm :     0.0030169 Eh/α   predicted    -0.3162734E-04 ( 390.75%)
   displ. norm   :     0.0436967 α      lambda       -0.5315318E-04
   maximum displ.:     0.0347356 α      in ANC's #2, #1, #3, ...

........................................................................
.............................. CYCLE   24 ..............................
........................................................................
   1    -37.7518356 -0.377518E+02  0.553E-02    3.96       0.0  T
   2    -37.7518366 -0.952577E-06  0.304E-02    3.96       1.0  T
   3    -37.7518362  0.349299E-06  0.622E-03    3.96       3.3  T
   4    -37.7518371 -0.811199E-06  0.137E-03    3.96      14.9  T
   5    -37.7518371 -0.389595E-08  0.485E-04    3.96      42.1  T
   6    -37.7518371 -0.219253E-08  0.225E-04    3.96      90.9  T
     SCC iter.                  ...        0 min,  0.007 sec
     gradient                   ...        0 min,  0.014 sec
 * total energy  :   -37.2155683 Eh     change       -0.3225859E-04 Eh
   gradient norm :     0.0016725 Eh/α   predicted    -0.2663072E-04 ( -17.45%)
   displ. norm   :     0.0679303 α      lambda       -0.1652001E-04
   maximum displ.:     0.0487733 α      in ANC's #2, #1, #4, ...

........................................................................
.............................. CYCLE   25 ..............................
........................................................................
   1    -37.7520511 -0.377521E+02  0.520E-02    3.97       0.0  T
   2    -37.7520518 -0.707509E-06  0.277E-02    3.97       1.0  T
   3    -37.7520513  0.470768E-06  0.671E-03    3.97       3.0  T
   4    -37.7520520 -0.714183E-06  0.299E-03    3.97       6.8  T
   5    -37.7520521 -0.539756E-07  0.836E-04    3.97      24.4  T
   6    -37.7520521 -0.123445E-07  0.277E-04    3.97      73.6  T
     SCC iter.                  ...        0 min,  0.007 sec
     gradient                   ...        0 min,  0.014 sec
 * total energy  :   -37.2155872 Eh     change       -0.1891288E-04 Eh
   gradient norm :     0.0011726 Eh/α   predicted    -0.8278813E-05 ( -56.23%)
   displ. norm   :     0.1536692 α      lambda       -0.2598020E-04
   maximum displ.:     0.1053018 α      in ANC's #2, #1, #4, ...

........................................................................
.............................. CYCLE   26 ..............................
........................................................................
   1    -37.7521074 -0.377521E+02  0.107E-01    3.97       0.0  T
   2    -37.7521101 -0.268663E-05  0.574E-02    3.97       1.0  T
   3    -37.7521092  0.879844E-06  0.117E-02    3.97       1.7  T
   4    -37.7521106 -0.141148E-05  0.664E-03    3.97       3.1  T
   5    -37.7521111 -0.431275E-06  0.158E-03    3.97      12.9  T
   6    -37.7521111 -0.436548E-07  0.528E-04    3.97      38.7  T
   7    -37.7521111 -0.165694E-08  0.256E-04    3.97      79.8  T
     SCC iter.                  ...        0 min,  0.008 sec
     gradient                   ...        0 min,  0.014 sec
 * total energy  :   -37.2156163 Eh     change       -0.2904138E-04 Eh
   gradient norm :     0.0012476 Eh/α   predicted    -0.1312738E-04 ( -54.80%)
   displ. norm   :     0.1615178 α      lambda       -0.1944782E-04
   maximum displ.:     0.1025086 α      in ANC's #2, #1, #4, ...

........................................................................
.............................. CYCLE   27 ..............................
........................................................................
   1    -37.7521355 -0.377521E+02  0.114E-01    3.97       0.0  T
   2    -37.7521387 -0.318214E-05  0.598E-02    3.97       1.0  T
   3    -37.7521387  0.312986E-07  0.109E-02    3.97       1.9  T
   4    -37.7521388 -0.164693E-06  0.738E-03    3.97       2.8  T
   5    -37.7521396 -0.803296E-06  0.128E-03    3.97      15.9  T
   6    -37.7521397 -0.266904E-07  0.515E-04    3.97      39.6  T
   7    -37.7521397 -0.203622E-08  0.229E-04    3.97      89.2  T
     SCC iter.                  ...        0 min,  0.008 sec
     gradient                   ...        0 min,  0.014 sec
 * total energy  :   -37.2156374 Eh     change       -0.2111730E-04 Eh
   gradient norm :     0.0012225 Eh/α   predicted    -0.9837772E-05 ( -53.41%)
   displ. norm   :     0.1161930 α      lambda       -0.1272692E-04
   maximum displ.:     0.0755659 α      in ANC's #1, #2, #4, ...

........................................................................
.............................. CYCLE   28 ..............................
........................................................................
   1    -37.7522919 -0.377523E+02  0.688E-02    3.97       0.0  T
   2    -37.7522928 -0.888326E-06  0.378E-02    3.97       1.0  T
   3    -37.7522923  0.489641E-06  0.768E-03    3.97       2.7  T
   4    -37.7522930 -0.629462E-06  0.409E-03    3.97       5.0  T
   5    -37.7522931 -0.165205E-06  0.923E-04    3.97      22.1  T
   6    -37.7522931 -0.153510E-07  0.307E-04    3.97      66.5  T
     SCC iter.                  ...        0 min,  0.007 sec
     gradient                   ...        0 min,  0.014 sec
 * total energy  :   -37.2156513 Eh     change       -0.1390475E-04 Eh
   gradient norm :     0.0009283 Eh/α   predicted    -0.6406274E-05 ( -53.93%)
   displ. norm   :     0.0822813 α      lambda       -0.9592245E-05
   maximum displ.:     0.0602404 α      in ANC's #1, #2, #6, ...

........................................................................
.............................. CYCLE   29 ..............................
........................................................................
   1    -37.7525163 -0.377525E+02  0.594E-02    3.97       0.0  T
   2    -37.7525173 -0.965788E-06  0.305E-02    3.97       1.0  T
   3    -37.7525175 -0.155368E-06  0.550E-03    3.97       3.7  T
   4    -37.7525173  0.151410E-06  0.368E-03    3.97       5.5  T
   5    -37.7525175 -0.231629E-06  0.389E-04    3.97      52.4  T
   6    -37.7525175 -0.170368E-08  0.207E-04    3.97      98.8  T
     SCC iter.                  ...        0 min,  0.007 sec
     gradient                   ...        0 min,  0.014 sec
 * total energy  :   -37.2156623 Eh     change       -0.1102325E-04 Eh
   gradient norm :     0.0009928 Eh/α   predicted    -0.4811208E-05 ( -56.35%)
   displ. norm   :     0.0594403 α      lambda       -0.6798212E-05
   maximum displ.:     0.0487810 α      in ANC's #1, #6, #3, ...

........................................................................
.............................. CYCLE   30 ..............................
........................................................................
   1    -37.7523368 -0.377523E+02  0.334E-02    3.97       0.0  T
   2    -37.7523370 -0.195001E-06  0.183E-02    3.97       1.1  T
   3    -37.7523368  0.177621E-06  0.430E-03    3.97       4.7  T
   4    -37.7523371 -0.222126E-06  0.208E-03    3.97       9.8  T
   5    -37.7523371 -0.322000E-07  0.388E-04    3.97      52.6  T
   6    -37.7523371 -0.238234E-08  0.162E-04    3.97     126.1  T
     SCC iter.                  ...        0 min,  0.007 sec
     gradient                   ...        0 min,  0.015 sec
 * total energy  :   -37.2156700 Eh     change       -0.7619806E-05 Eh
   gradient norm :     0.0006309 Eh/α   predicted    -0.3404941E-05 ( -55.31%)
   displ. norm   :     0.0423477 α      lambda       -0.4675408E-05
   maximum displ.:     0.0370350 α      in ANC's #1, #7, #6, ...

........................................................................
.............................. CYCLE   31 ..............................
........................................................................
   1    -37.7524390 -0.377524E+02  0.336E-02    3.97       0.0  T
   2    -37.7524393 -0.320646E-06  0.172E-02    3.97       1.2  T
   3    -37.7524394 -0.427771E-07  0.308E-03    3.97       6.6  T
   4    -37.7524393  0.121259E-07  0.213E-03    3.97       9.6  T
   5    -37.7524394 -0.579941E-07  0.367E-04    3.97      55.5  T
   6    -37.7524394 -0.197176E-08  0.172E-04    3.97     118.6  T
     SCC iter.                  ...        0 min,  0.007 sec
     gradient                   ...        0 min,  0.014 sec
 * total energy  :   -37.2156750 Eh     change       -0.5017890E-05 Eh
   gradient norm :     0.0004881 Eh/α   predicted    -0.2342568E-05 ( -53.32%)
   displ. norm   :     0.0279516 α      lambda       -0.2685975E-05
   maximum displ.:     0.0244029 α      in ANC's #1, #4, #2, ...

........................................................................
.............................. CYCLE   32 ..............................
........................................................................
   1    -37.7524557 -0.377525E+02  0.175E-02    3.97       0.0  T
   2    -37.7524557 -0.598211E-07  0.100E-02    3.97       2.0  T
   3    -37.7524557  0.210161E-07  0.199E-03    3.97      10.3  T
   4    -37.7524557 -0.405767E-07  0.106E-03    3.97      19.2  T
   5    -37.7524558 -0.806446E-08  0.220E-04    3.97      92.8  T
   6    -37.7524558 -0.489493E-09  0.118E-04    3.97     173.1  T
     SCC iter.                  ...        0 min,  0.007 sec
     gradient                   ...        0 min,  0.014 sec
 * total energy  :   -37.2156784 Eh     change       -0.3468837E-05 Eh
   gradient norm :     0.0004675 Eh/α   predicted    -0.1343975E-05 ( -61.26%)
   displ. norm   :     0.0308797 α      lambda       -0.2863469E-05
   maximum displ.:     0.0235972 α      in ANC's #1, #4, #3, ...

   *** GEOMETRY OPTIMIZATION CONVERGED AFTER 32 ITERATIONS ***

------------------------------------------------------------------------
 total energy gain   :        -0.0406621 Eh      -25.5159 kcal/mol
 total RMSD          :         1.0084789 a0        0.5337 Å
 total power (kW/mol):        -3.3361991 (step) -106.8998 (real)
------------------------------------------------------------------------

 ANCopt (total)                0 d,  0 h,  0 min,  0.999 sec
 optimizer setup                ...        0 min,  0.000 sec (  0.016%)
 model hessian                  ...        0 min,  0.020 sec (  2.007%)
 ANC generation                 ...        0 min,  0.001 sec (  0.135%)
 coordinate transformation      ...        0 min,  0.001 sec (  0.058%)
 single point calculation       ...        0 min,  0.963 sec ( 96.390%)
 optimization log               ...        0 min,  0.003 sec (  0.335%)
 hessian update                 ...        0 min,  0.000 sec (  0.041%)
 rational function              ...        0 min,  0.008 sec (  0.820%)

================
 final structure:
================
$coord
    3.00745895160964    1.72299435445612   -0.48931551495253      C 
    5.13258512874349   -0.58991378179559    0.33645631757833      S 
    2.71057408878659   -2.64221666241097    1.02098039192801      C 
    0.40061442763324   -1.58845869610520    0.63788215050537      C 
    0.57250883790178    0.94540160670075   -0.24533180323901      C 
   -1.70875614418201    2.47131189385331   -0.91733496273774      C 
   -4.09773955868057    1.36485162830945    0.30976212057327      C 
   -4.10436096343123    1.84248672434057    2.99270092132750      C 
   -4.10335254048342    2.24169335374245    5.11569004566829      N 
   -4.25102236272400   -1.50032036068261   -0.21313493486202      C 
   -4.21080710123353   -1.76627956504399   -2.86809680500022      O 
   -4.84928807647024   -4.17772108105964   -3.77244012830147      C 
   -2.07594462749980   -2.85631483263536    1.14557653315326      C 
    3.68738129196097    3.52485391862291   -1.11602879207447      H 
    3.14081858146770   -4.50825286984057    1.68096113621140      H 
   -1.97494587889661    2.41322430751316   -2.96540367343309      H 
   -1.45974947804397    4.44053292697039   -0.34994929051207      H 
   -5.76501811154226    2.28151647958637   -0.50953974295598      H 
   -6.05870857233505   -2.24243292974988    0.52487332595117      H 
   -5.05247945763646   -3.98540537120925   -5.81024598616200      H 
   -6.63963310864058   -4.83453318761025   -2.95953164299749      H 
   -3.37640026407641   -5.57611847503232   -3.37352159549084      H 
   -1.99774447362027   -4.83835644035078    0.57797257891596      H 
   -2.46540019967115   -2.81104256581779    3.17715255428804      H 
$end
           -------------------------------------------------
          |                Final Singlepoint                |
           -------------------------------------------------

          ...................................................
          :                      SETUP                      :
          :.................................................:
          :  # basis functions                  69          :
          :  # atomic orbitals                  68          :
          :  # shells                           38          :
          :  # electrons                        68          :
          :  max. iterations                   250          :
          :  Hamiltonian                  GFN2-xTB          :
          :  restarted?                      false          :
          :  GBSA solvation                  false          :
          :  PC potential                    false          :
          :  electronic temp.          300.0000000     K    :
          :  accuracy                    1.0000000          :
          :  -> integral cutoff          0.2500000E+02      :
          :  -> integral neglect         0.1000000E-07      :
          :  -> SCF convergence          0.1000000E-05 Eh   :
          :  -> wf. convergence          0.1000000E-03 e    :
          :  Broyden damping             0.4000000          :
          ...................................................

 iter      E             dE          RMSdq      gap      omega  full diag
   1    -37.7524558 -0.377525E+02  0.516E-05    3.97       0.0  T
   2    -37.7524558 -0.576961E-11  0.283E-05    3.97     720.7  T
   3    -37.7524558 -0.163425E-10  0.194E-05    3.97    1052.1  T

   *** convergence criteria satisfied after 3 iterations ***

         #    Occupation            Energy/Eh            Energy/eV
      -------------------------------------------------------------
         1        2.0000           -0.7297000             -19.8561
       ...           ...                  ...                  ...
        28        2.0000           -0.4592942             -12.4980
        29        2.0000           -0.4499131             -12.2428
        30        2.0000           -0.4382700             -11.9259
        31        2.0000           -0.4289274             -11.6717
        32        2.0000           -0.4133123             -11.2468
        33        2.0000           -0.3896426             -10.6027
        34        2.0000           -0.3889362             -10.5835 (HOMO)
        35                         -0.2430496              -6.6137 (LUMO)
        36                         -0.2141656              -5.8277
        37                         -0.2096334              -5.7044
        38                         -0.2004284              -5.4539
        39                         -0.1693247              -4.6076
       ...                                ...                  ...
        68                          1.1400910              31.0235
      -------------------------------------------------------------
                  HL-Gap            0.1458866 Eh            3.9698 eV
             Fermi-level           -0.3159929 Eh           -8.5986 eV

 SCC (total)                   0 d,  0 h,  0 min,  0.027 sec
 SCC setup                      ...        0 min,  0.000 sec (  0.676%)
 Dispersion                     ...        0 min,  0.000 sec (  0.699%)
 integral evaluation            ...        0 min,  0.008 sec ( 30.665%)
 zeroth order Hamiltonian       ...        0 min,  0.000 sec (  0.607%)
 iterations                     ...        0 min,  0.004 sec ( 14.485%)
 molecular gradient             ...        0 min,  0.014 sec ( 51.349%)
 printout                       ...        0 min,  0.000 sec (  1.306%)

         :::::::::::::::::::::::::::::::::::::::::::::::::::::
         ::                     SUMMARY                     ::
         :::::::::::::::::::::::::::::::::::::::::::::::::::::
         :: total energy             -37.215678439372 Eh    ::
         :: gradient norm              0.000467170626 Eh/a0 ::
         :: HOMO-LUMO gap              3.969776014137 eV    ::
         ::.................................................::
         :: SCC energy               -37.752455757010 Eh    ::
         :: -> isotropic ES            0.026978377328 Eh    ::
         :: -> anisotropic ES          0.003351259232 Eh    ::
         :: -> anisotropic XC          0.025452472852 Eh    ::
         :: -> dispersion             -0.024876291898 Eh    ::
         :: repulsion energy           0.536491056265 Eh    ::
         :: add. restraining           0.000000000000 Eh    ::
         :::::::::::::::::::::::::::::::::::::::::::::::::::::

           -------------------------------------------------
          |                Property Printout                |
           -------------------------------------------------

    * Orbital Energies and Occupations

         #    Occupation            Energy/Eh            Energy/eV
      -------------------------------------------------------------
         1        2.0000           -0.7297000             -19.8561
       ...           ...                  ...                  ...
        22        2.0000           -0.4875156             -13.2660
        23        2.0000           -0.4798573             -13.0576
        24        2.0000           -0.4735223             -12.8852
        25        2.0000           -0.4718060             -12.8385
        26        2.0000           -0.4692149             -12.7680
        27        2.0000           -0.4634356             -12.6107
        28        2.0000           -0.4592942             -12.4980
        29        2.0000           -0.4499131             -12.2428
        30        2.0000           -0.4382700             -11.9259
        31        2.0000           -0.4289274             -11.6717
        32        2.0000           -0.4133123             -11.2468
        33        2.0000           -0.3896426             -10.6027
        34        2.0000           -0.3889362             -10.5835 (HOMO)
        35                         -0.2430496              -6.6137 (LUMO)
        36                         -0.2141656              -5.8277
        37                         -0.2096334              -5.7044
        38                         -0.2004284              -5.4539
        39                         -0.1693247              -4.6076
        40                         -0.1132957              -3.0829
        41                         -0.0007065              -0.0192
        42                          0.0080542               0.2192
        43                          0.0319128               0.8684
        44                          0.0362301               0.9859
        45                          0.0535564               1.4573
       ...                                ...                  ...
        68                          1.1400910              31.0235
      -------------------------------------------------------------
                  HL-Gap            0.1458866 Eh            3.9698 eV
             Fermi-level           -0.3159929 Eh           -8.5986 eV

     #   Z        covCN         q      C6AA      α(0)
     1   6 C      2.942    -0.034    28.844     8.808
     2  16 S      2.299    -0.027   142.187    20.069
     3   6 C      2.941    -0.034    28.847     8.809
     4   6 C      3.168    -0.005    27.778     8.612
     5   6 C      3.167    -0.005    27.781     8.613
     6   6 C      3.814    -0.048    21.416     6.587
     7   6 C      3.859    -0.012    20.746     6.478
     8   6 C      1.906     0.114    28.289     8.590
     9   7 N      0.911    -0.234    26.118     7.391
    10   6 C      3.756     0.131    18.509     6.134
    11   8 O      1.702    -0.313    19.225     5.920
    12   6 C      3.645     0.043    20.183     6.457
    13   6 C      3.806    -0.063    21.706     6.632
    14   1 H      0.926     0.042     2.419     2.432
    15   1 H      0.926     0.041     2.430     2.438
    16   1 H      0.924     0.067     2.116     2.275
    17   1 H      0.924     0.046     2.377     2.411
    18   1 H      0.924     0.069     2.100     2.266
    19   1 H      0.922     0.011     2.875     2.652
    20   1 H      0.925     0.060     2.196     2.318
    21   1 H      0.924     0.028     2.622     2.532
    22   1 H      0.924     0.031     2.567     2.506
    23   1 H      0.924     0.043     2.407     2.426
    24   1 H      0.924     0.048     2.351     2.398

 Mol. C6AA /au·bohr⁶  :       7656.179460
 Mol. C8AA /au·bohr⁸  :     202631.811620
 Mol. α(0) /au        :        135.751783


Wiberg/Mayer (AO) data.
largest (>0.10) Wiberg bond orders for each atom
          total WBO             WBO to atom ...
     1  C   3.945        C    5 1.604    S    2 1.189    H   14 0.971    C    3 0.119
     2  S   2.630        C    3 1.189    C    1 1.189
     3  C   3.945        C    4 1.605    S    2 1.189    H   15 0.971    C    1 0.119
     4  C   3.985        C    3 1.605    C    5 1.224    C   13 1.008
     5  C   3.985        C    1 1.604    C    4 1.224    C    6 1.010
     6  C   3.994        C    5 1.010    H   17 0.969    C    7 0.964    H   16 0.955
     7  C   3.995        C    8 1.042    C    6 0.964    C   10 0.951    H   18 0.936
     8  C   3.944        N    9 2.850    C    7 1.042
     9  N   3.006        C    8 2.850
    10  C   3.957        C   13 0.983    O   11 0.979    H   19 0.958    C    7 0.951
    11  O   2.081        C   12 0.994    C   10 0.979
    12  C   3.951        O   11 0.994    H   20 0.979    H   21 0.976    H   22 0.976
    13  C   3.998        C    4 1.008    C   10 0.983    H   23 0.965    H   24 0.957
    14  H   0.998        C    1 0.971
    15  H   0.998        C    3 0.971
    16  H   0.995        C    6 0.955
    17  H   0.998        C    6 0.969
    18  H   0.994        C    7 0.936
    19  H   0.999        C   10 0.958
    20  H   0.996        C   12 0.979
    21  H   0.999        C   12 0.976
    22  H   0.999        C   12 0.976
    23  H   0.998        C   13 0.965
    24  H   0.998        C   13 0.957

molecular dipole:
                 x           y           z       tot (Debye)
 q only:       -0.208      -0.471      -0.790
   full:       -0.620      -0.692      -1.147       3.751
molecular quadrupole (traceless):
                xx          xy          yy          xz          yz          zz
 q only:        0.615       4.099       6.014       5.243      -2.648      -6.629
  q+dip:        0.915       5.838       9.563       7.444      -5.647     -10.478
   full:        0.883       6.089      10.423       7.451      -5.440     -11.306

           -------------------------------------------------
          |                Geometry Summary                 |
           -------------------------------------------------

      molecular mass/u    :      193.2630000
   center of mass at/Å    :       -0.4418962      -0.2330174       0.0848244
  moments of inertia/u·Å² :        0.5006192E+03   0.8719404E+03   0.1099562E+04
rotational constants/cm⁻¹ :        0.3367357E-01   0.1933347E-01   0.1533123E-01

 * 23 selected distances

     #   Z        #   Z                                     value/Å
     1   6 C      2  16 S                                 1.7186130 (max)
     2  16 S      3   6 C                                 1.7185359
     3   6 C      4   6 C                                 1.3587685
     1   6 C      5   6 C                                 1.3587764
     4   6 C      5   6 C                                 1.4228929
     5   6 C      6   6 C                                 1.4952568
     6   6 C      7   6 C                                 1.5370995
     8   6 C      9   7 N                                 1.1431270
    10   6 C     11   8 O                                 1.4121375
    11   8 O     12   6 C                                 1.4041203
     4   6 C     13   6 C                                 1.4966044
    10   6 C     13   6 C                                 1.5351414
     1   6 C     14   1 H                                 1.0717325 (min)
     3   6 C     15   1 H                                 1.0718650
     6   6 C     16   1 H                                 1.0933392
     6   6 C     17   1 H                                 1.0924355
     7   6 C     18   1 H                                 1.0962208
    10   6 C     19   1 H                                 1.1053494
    12   6 C     20   1 H                                 1.0884759
    12   6 C     21   1 H                                 1.0970136
    12   6 C     22   1 H                                 1.0952882
    13   6 C     23   1 H                                 1.0917965
    13   6 C     24   1 H                                 1.0949017

 * 5 distinct bonds (by element types)

   Z      Z             #   av. dist./Å        max./Å        min./Å
   1 H    6 C          11     1.0907653     1.1053494     1.0717325
   6 C    6 C           7     1.4577914     1.5370995     1.3587685
   6 C    7 N           1     1.1431270     1.1431270     1.1431270
   6 C    8 O           2     1.4081289     1.4121375     1.4041203
   6 C   16 S           2     1.7185744     1.7186130     1.7185359


optimized geometry written to: xtbopt.xyz


           -------------------------------------------------
          | TOTAL ENERGY              -37.215678439372 Eh   |
          | GRADIENT NORM               0.000467170626 Eh/α |
          | HOMO-LUMO GAP               3.969776014137 eV   |
           -------------------------------------------------

------------------------------------------------------------------------
 * finished run on 2021/05/19 at 10:59:49.301     
------------------------------------------------------------------------
 total:
 * wall-time:     0 d,  0 h,  0 min,  1.086 sec
 *  cpu-time:     0 d,  0 h,  0 min,  1.082 sec
 * ratio c/w:     0.996 speedup
 SCF:
 * wall-time:     0 d,  0 h,  0 min,  0.038 sec
 *  cpu-time:     0 d,  0 h,  0 min,  0.038 sec
 * ratio c/w:     0.998 speedup
 ANC optimizer:
 * wall-time:     0 d,  0 h,  0 min,  1.027 sec
 *  cpu-time:     0 d,  0 h,  0 min,  1.024 sec
 * ratio c/w:     0.997 speedup

