      -----------------------------------------------------------      
     |                   =====================                   |     
     |                           x T B                           |     
     |                   =====================                   |     
     |                         S. Grimme                         |     
     |          Mulliken Center for Theoretical Chemistry        |     
     |                    University of Bonn                     |     
     |                Version 6.2 RC2 (SAW190805)                |     
      -----------------------------------------------------------      

   This program is distributed in the hope that it will be useful,
   but WITHOUT ANY WARRANTY; without even the implied warranty of
   MERCHANTABILITY or FITNESS FOR A PARTICULAR PURPOSE.
   
   FOR NON-COMMERCIAL, ACADEMIA USE ONLY.
   
   Cite this work as:
   * S. Grimme, C. Bannwarth, P. Shushkov, J. Chem. Theory Comput., 2017,
     13, 1989-2009. DOI: 10.1021/acs.jctc.7b00118
   * C. Bannwarth, S. Ehlert and S. Grimme., J. Chem. Theory Comput., 2019,
     15, 1652-1671. DOI: 10.1021/acs.jctc.8b01176
   * P. Pracht, E. Caldeweyher, S. Ehlert, S. Grimme, ChemRxiv, 2019, preprint.
     DOI: 10.26434/chemrxiv.8326202.v1
   
   for DFT-D4:
   * E. Caldeweyher, C. Bannwarth and S. Grimme, J. Chem. Phys., 2017,
     147, 034112. DOI: 10.1063/1.4993215
   * E. Caldeweyher, S. Ehlert, A. Hansen, H. Neugebauer, S. Spicher,
     C. Bannwarth and S. Grimme, J. Chem. Phys., 2019, 150, 154122.
     DOI: 10.1063/1.5090222
   
   for sTDA-xTB:
   * S. Grimme and C. Bannwarth, J. Chem. Phys., 2016, 145, 054103.
     DOI: 10.1063/1.4959605
   
   in the mass-spec context:
   * V. Asgeirsson, C. Bauer and S. Grimme, Chem. Sci., 2017, 8, 4879.
     DOI: 10.1039/c7sc00601b
   
   for metadynamics refer to:
   * S. Grimme, J. Chem. Theory Comput., 2019, 155, 2847-2862
     DOI: 10.1021/acs.jctc.9b00143
   
   with help from (in alphabetical order)
   C. Bannwarth, F. Bohle, G. Brandenburg, E. Caldeweyher, M. Checinski,
   S. Dohm, S. Ehlert, S. Ehrlich, F. März, H. Neugebauer, J. Pisarek,
   P. Pracht, P. Shushkov, and S. Spicher.
   
 * started run on 2021/05/19 at 10:59:49.488     

           -------------------------------------------------
          |                Calculation Setup                |
           -------------------------------------------------

          program call               : /ihome/ghutchison/geoffh/xtb/xtb 567.xyz -opt
          hostname                   : smp-n144
          coordinate file            : 567.xyz
          omp threads                :                     1
          number of atoms            :                    26
          number of electrons        :                    76
          charge                     :                     0
          spin                       :                   0.0
          first test random number   :      0.42817751336614


########################################################################
# WARNING! Please study the warnings concerning your input carefully
#  - the use of '-opt' is discouraged, please use '--opt' next time
########################################################################

           ------------------------------------------------- 
          |                 G F N 2 - x T B                 |
          | Geometry, Frequencies, Noncovalent interactions |
          |            JCTC 2019 parametrisation            |
           ------------------------------------------------- 
             KAB for C  - Si     :                1.0500
             KAB for H  - Pd     :                0.9500
             k(s)              :                1.8500
             k(p)              :                2.2300
             k(d)              :                2.2300
             k(f)              :                2.0000
             kEN (H0ij)        :               -2.0000
             D4 a1             :                0.5200
             D4 a2             :                5.0000
             D4 s6             :                1.0000
             D4 s8             :                2.7000
             D4 s9             :                5.0000
             alphaj            :                2.0000

  Z AO/shell   Hii/eV     exponent
  1     Wed Apr 25 08:07:45 CEST 2018   EN: 2.200 GM2: 0.406  GM3: 0.0800  RAES: 1.40
     1s    -10.707211    1.230000
  6     Wed Apr 25 08:07:45 CEST 2018   EN: 2.550 GM2: 0.538  GM3: 0.1500  RAES: 3.00
     2s    -13.970922    2.096432
     2p    -10.063292    1.800000
  7     Wed Apr 25 08:07:45 CEST 2018   EN: 3.040 GM2: 0.461  GM3:-0.0640  RAES: 1.90
     2s    -16.686243    2.339881
     2p    -12.523956    2.014332
 16     Tue Apr 24 11:44:34 CEST 2018   EN: 2.580 GM2: 0.340  GM3:-0.0502  RAES: 3.10
     3s    -20.029654    1.981333
     3p    -11.377694    2.025643
     3d     -0.420282    1.702555

           ------------------------------------------------- 
          |        Self-Consistent Charge Iterations        |
           ------------------------------------------------- 

          ...................................................
          :                      SETUP                      :
          :.................................................:
          :  # basis functions                  83          :
          :  # atomic orbitals                  81          :
          :  # shells                           43          :
          :  # electrons                        76          :
          :  max. iterations                   250          :
          :  Hamiltonian                  GFN2-xTB          :
          :  restarted?                      false          :
          :  GBSA solvation                  false          :
          :  PC potential                    false          :
          :  electronic temp.          300.0000000     K    :
          :  accuracy                    1.0000000          :
          :  -> integral cutoff          0.2500000E+02      :
          :  -> integral neglect         0.1000000E-07      :
          :  -> SCF convergence          0.1000000E-05 Eh   :
          :  -> wf. convergence          0.1000000E-03 e    :
          :  Broyden damping             0.4000000          :
          ...................................................

 iter      E             dE          RMSdq      gap      omega  full diag
   1    -41.2484995 -0.412485E+02  0.439E+00    2.53       0.0  T
   2    -41.3017634 -0.532639E-01  0.238E+00    2.56       1.0  T
   3    -41.2966780  0.508536E-02  0.135E+00    2.68       1.0  T
   4    -41.3075904 -0.109124E-01  0.542E-01    2.60       1.0  T
   5    -41.3121990 -0.460867E-02  0.183E-01    2.64       1.0  T
   6    -41.3123181 -0.119008E-03  0.965E-02    2.63       1.0  T
   7    -41.3124693 -0.151232E-03  0.235E-02    2.63       1.0  T
   8    -41.3124734 -0.414836E-05  0.132E-02    2.63       1.5  T
   9    -41.3124747 -0.123544E-05  0.688E-03    2.63       2.9  T
  10    -41.3124752 -0.557079E-06  0.182E-03    2.63      10.8  T
  11    -41.3124752 -0.177777E-07  0.690E-04    2.63      28.4  T
  12    -41.3124753 -0.614285E-08  0.341E-04    2.63      57.5  T

   *** convergence criteria satisfied after 12 iterations ***

         #    Occupation            Energy/Eh            Energy/eV
      -------------------------------------------------------------
         1        2.0000           -0.7276910             -19.8015
       ...           ...                  ...                  ...
        32        2.0000           -0.4408343             -11.9957
        33        2.0000           -0.4389589             -11.9447
        34        2.0000           -0.4353903             -11.8476
        35        2.0000           -0.4056531             -11.0384
        36        2.0000           -0.3887147             -10.5775
        37        2.0000           -0.3622644              -9.8577
        38        2.0000           -0.3582357              -9.7481 (HOMO)
        39                         -0.2615400              -7.1169 (LUMO)
        40                         -0.2353731              -6.4048
        41                         -0.2076138              -5.6495
        42                         -0.1936806              -5.2703
        43                         -0.1864141              -5.0726
       ...                                ...                  ...
        81                          0.7937845              21.6000
      -------------------------------------------------------------
                  HL-Gap            0.0966957 Eh            2.6312 eV
             Fermi-level           -0.3098878 Eh           -8.4325 eV

 SCC (total)                   0 d,  0 h,  0 min,  0.052 sec
 SCC setup                      ...        0 min,  0.000 sec (  0.673%)
 Dispersion                     ...        0 min,  0.000 sec (  0.804%)
 integral evaluation            ...        0 min,  0.013 sec ( 24.306%)
 zeroth order Hamiltonian       ...        0 min,  0.000 sec (  0.467%)
 iterations                     ...        0 min,  0.018 sec ( 35.263%)
 molecular gradient             ...        0 min,  0.019 sec ( 37.524%)
 printout                       ...        0 min,  0.000 sec (  0.855%)

         :::::::::::::::::::::::::::::::::::::::::::::::::::::
         ::                     SUMMARY                     ::
         :::::::::::::::::::::::::::::::::::::::::::::::::::::
         :: total energy             -40.670788185904 Eh    ::
         :: gradient norm              0.102472177783 Eh/a0 ::
         :: HOMO-LUMO gap              2.631223441318 eV    ::
         ::.................................................::
         :: SCC energy               -41.312475253468 Eh    ::
         :: -> isotropic ES            0.004318409634 Eh    ::
         :: -> anisotropic ES          0.004629402776 Eh    ::
         :: -> anisotropic XC          0.020903631832 Eh    ::
         :: -> dispersion             -0.031175873865 Eh    ::
         :: repulsion energy           0.641516568171 Eh    ::
         :: add. restraining           0.000000000000 Eh    ::
         :::::::::::::::::::::::::::::::::::::::::::::::::::::

      ----------------------------------------------------------- 
     |                   =====================                   |
     |                        A N C O P T                        |
     |                   =====================                   |
     |               Approximate Normal Coordinate               |
     |                Rational Function Optimizer                |
      ----------------------------------------------------------- 

          ...................................................
          :                      SETUP                      :
          :.................................................:
          :   optimization level            normal          :
          :   max. optcycles                   200          :
          :   ANC micro-cycles                  20          :
          :   degrees of freedom                72          :
          :.................................................:
          :   RF solver                   davidson          :
          :   input Hessian                  false          :
          :   write xtbopt.log                true          :
          :   linear?                        false          :
          :   energy convergence         0.5000000E-05 Eh   :
          :   grad. convergence          0.1000000E-02 Eh/α :
          :   maximium RF displ.         2.0000000          :
          :   Hlow (freq-cutoff)         0.5000000E-02      :
          :   Hmax (freq-cutoff)         5.0000000          :
          :   S6 in model hess.         20.0000000          :
          ...................................................

generating ANC from model Hessian ...
Using Lindh-Hessian (1995)
 Shifting diagonal of input Hessian by   4.024100876401967E-003
 Lowest  eigenvalues of input Hessian
   -0.000000   -0.000000   -0.000000   -0.000000    0.000000    0.000000
    0.005000    0.006195    0.006880    0.008617    0.009619    0.010081
    0.011997    0.015624    0.016221    0.021350    0.023914    0.028896
 Highest eigenvalues
    1.866394    1.998058    2.094878    2.146406    2.290011    2.304500
 

........................................................................
.............................. CYCLE    1 ..............................
........................................................................
   1    -41.3124753 -0.413125E+02  0.155E-04    2.63       0.0  T
   2    -41.3124753 -0.559837E-10  0.113E-04    2.63     172.8  T
   3    -41.3124753 -0.936424E-10  0.736E-05    2.63     266.5  T
     SCC iter.                  ...        0 min,  0.005 sec
     gradient                   ...        0 min,  0.019 sec
 * total energy  :   -40.6707882 Eh     change       -0.1059312E-07 Eh
   gradient norm :     0.1024716 Eh/α   predicted     0.0000000E+00 (-100.00%)
   displ. norm   :     0.4080880 α      lambda       -0.2426161E-01
   maximum displ.:     0.1896496 α      in ANC's #12, #20, #19, ...

........................................................................
.............................. CYCLE    2 ..............................
........................................................................
   1    -41.3104724 -0.413105E+02  0.305E-01    2.69       0.0  T
   2    -41.3106208 -0.148394E-03  0.207E-01    2.65       1.0  T
   3    -41.3106729 -0.521017E-04  0.125E-01    2.67       1.0  T
   4    -41.3108591 -0.186175E-03  0.301E-02    2.66       1.0  T
   5    -41.3108660 -0.694063E-05  0.178E-02    2.66       1.1  T
   6    -41.3108685 -0.247314E-05  0.731E-03    2.66       2.7  T
   7    -41.3108690 -0.495135E-06  0.309E-03    2.66       6.3  T
   8    -41.3108690 -0.106668E-07  0.191E-03    2.66      10.3  T
     SCC iter.                  ...        0 min,  0.011 sec
     gradient                   ...        0 min,  0.018 sec
 * total energy  :   -40.6880164 Eh     change       -0.1722824E-01 Eh
   gradient norm :     0.0386284 Eh/α   predicted    -0.1415110E-01 ( -17.86%)
   displ. norm   :     0.4642319 α      lambda       -0.1005381E-01
   maximum displ.:     0.2785153 α      in ANC's #12, #20, #4, ...

........................................................................
.............................. CYCLE    3 ..............................
........................................................................
   1    -41.3091312 -0.413091E+02  0.283E-01    2.70       0.0  T
   2    -41.3091860 -0.547143E-04  0.169E-01    2.69       1.0  T
   3    -41.3090532  0.132761E-03  0.115E-01    2.70       1.0  T
   4    -41.3092783 -0.225114E-03  0.226E-02    2.69       1.0  T
   5    -41.3092772  0.114109E-05  0.158E-02    2.69       1.2  T
   6    -41.3092806 -0.339927E-05  0.554E-03    2.69       3.5  T
   7    -41.3092807 -0.171962E-06  0.289E-03    2.69       6.8  T
     SCC iter.                  ...        0 min,  0.010 sec
     gradient                   ...        0 min,  0.018 sec
 * total energy  :   -40.6948008 Eh     change       -0.6784332E-02 Eh
   gradient norm :     0.0161399 Eh/α   predicted    -0.6110258E-02 (  -9.94%)
   displ. norm   :     0.4138982 α      lambda       -0.3147484E-02
   maximum displ.:     0.2307754 α      in ANC's #12, #4, #7, ...

........................................................................
.............................. CYCLE    4 ..............................
........................................................................
   1    -41.3083600 -0.413084E+02  0.179E-01    2.70       0.0  T
   2    -41.3083834 -0.234344E-04  0.102E-01    2.70       1.0  T
   3    -41.3083451  0.382918E-04  0.570E-02    2.70       1.0  T
   4    -41.3083982 -0.530654E-04  0.140E-02    2.69       1.4  T
   5    -41.3083984 -0.277511E-06  0.922E-03    2.70       2.1  T
   6    -41.3083992 -0.766323E-06  0.374E-03    2.70       5.2  T
   7    -41.3083993 -0.984178E-07  0.208E-03    2.70       9.5  T
   8    -41.3083993 -0.212775E-07  0.880E-04    2.70      22.3  T
     SCC iter.                  ...        0 min,  0.011 sec
     gradient                   ...        0 min,  0.018 sec
 * total energy  :   -40.6969566 Eh     change       -0.2155797E-02 Eh
   gradient norm :     0.0129451 Eh/α   predicted    -0.1843363E-02 ( -14.49%)
   displ. norm   :     0.3290158 α      lambda       -0.1201000E-02
   maximum displ.:     0.1984719 α      in ANC's #4, #7, #12, ...

........................................................................
.............................. CYCLE    5 ..............................
........................................................................
   1    -41.3115458 -0.413115E+02  0.118E-01    2.70       0.0  T
   2    -41.3115528 -0.699281E-05  0.662E-02    2.70       1.0  T
   3    -41.3115483  0.449412E-05  0.232E-02    2.70       1.0  T
   4    -41.3115551 -0.679844E-05  0.814E-03    2.70       2.4  T
   5    -41.3115551 -0.644009E-08  0.508E-03    2.70       3.9  T
   6    -41.3115554 -0.303009E-06  0.187E-03    2.70      10.5  T
   7    -41.3115554 -0.217322E-08  0.108E-03    2.70      18.1  T
     SCC iter.                  ...        0 min,  0.010 sec
     gradient                   ...        0 min,  0.018 sec
 * total energy  :   -40.6977750 Eh     change       -0.8183941E-03 Eh
   gradient norm :     0.0089798 Eh/α   predicted    -0.6655277E-03 ( -18.68%)
   displ. norm   :     0.2144598 α      lambda       -0.4366568E-03
   maximum displ.:     0.1505691 α      in ANC's #4, #7, #2, ...

........................................................................
.............................. CYCLE    6 ..............................
........................................................................
   1    -41.3156637 -0.413157E+02  0.837E-02    2.70       0.0  T
   2    -41.3156660 -0.229479E-05  0.465E-02    2.70       1.0  T
   3    -41.3156624  0.358884E-05  0.162E-02    2.70       1.2  T
   4    -41.3156669 -0.447796E-05  0.594E-03    2.70       3.3  T
   5    -41.3156671 -0.186608E-06  0.286E-03    2.70       6.8  T
   6    -41.3156672 -0.790839E-07  0.114E-03    2.70      17.2  T
     SCC iter.                  ...        0 min,  0.009 sec
     gradient                   ...        0 min,  0.018 sec
 * total energy  :   -40.6980611 Eh     change       -0.2860927E-03 Eh
   gradient norm :     0.0051520 Eh/α   predicted    -0.2283716E-03 ( -20.18%)
   displ. norm   :     0.2144669 α      lambda        0.5236649E-04
   maximum displ.:     0.1505689 α      in ANC's #4, #7, #2, ...

........................................................................
.............................. CYCLE    7 ..............................
........................................................................
   1    -41.3189792 -0.413190E+02  0.837E-02    2.70       0.0  T
   2    -41.3189816 -0.232996E-05  0.465E-02    2.71       1.0  T
   3    -41.3189777  0.386648E-05  0.168E-02    2.71       1.2  T
   4    -41.3189825 -0.478439E-05  0.601E-03    2.71       3.3  T
   5    -41.3189827 -0.185601E-06  0.313E-03    2.71       6.3  T
   6    -41.3189828 -0.978955E-07  0.117E-03    2.71      16.8  T
   7    -41.3189828 -0.108290E-07  0.686E-04    2.71      28.6  T
     SCC iter.                  ...        0 min,  0.010 sec
     gradient                   ...        0 min,  0.018 sec
 * total energy  :   -40.6980490 Eh     change        0.1202949E-04 Eh
   gradient norm :     0.0076700 Eh/α   predicted     0.2738611E-04 ( 127.66%)
   displ. norm   :     0.0913822 α      lambda       -0.1750300E-03
   maximum displ.:     0.0459012 α      in ANC's #7, #12, #5, ...

........................................................................
.............................. CYCLE    8 ..............................
........................................................................
   1    -41.3178717 -0.413179E+02  0.403E-02    2.71       0.0  T
   2    -41.3178725 -0.871935E-06  0.227E-02    2.71       1.0  T
   3    -41.3178720  0.524603E-06  0.729E-03    2.71       2.7  T
   4    -41.3178728 -0.736919E-06  0.303E-03    2.71       6.5  T
   5    -41.3178728 -0.311749E-07  0.188E-03    2.71      10.4  T
   6    -41.3178728 -0.440367E-07  0.546E-04    2.71      35.9  T
     SCC iter.                  ...        0 min,  0.009 sec
     gradient                   ...        0 min,  0.018 sec
 * total energy  :   -40.6981512 Eh     change       -0.1021809E-03 Eh
   gradient norm :     0.0037305 Eh/α   predicted    -0.8824670E-04 ( -13.64%)
   displ. norm   :     0.0639207 α      lambda       -0.7220158E-04
   maximum displ.:     0.0345968 α      in ANC's #12, #5, #7, ...

........................................................................
.............................. CYCLE    9 ..............................
........................................................................
   1    -41.3167032 -0.413167E+02  0.429E-02    2.71       0.0  T
   2    -41.3167041 -0.865584E-06  0.232E-02    2.70       1.0  T
   3    -41.3167037  0.424081E-06  0.644E-03    2.71       3.0  T
   4    -41.3167043 -0.604859E-06  0.319E-03    2.70       6.2  T
   5    -41.3167044 -0.623470E-07  0.163E-03    2.70      12.1  T
   6    -41.3167044 -0.339794E-07  0.407E-04    2.70      48.2  T
   7    -41.3167044 -0.491283E-09  0.250E-04    2.70      78.3  T
     SCC iter.                  ...        0 min,  0.010 sec
     gradient                   ...        0 min,  0.019 sec
 * total energy  :   -40.6981903 Eh     change       -0.3908227E-04 Eh
   gradient norm :     0.0012343 Eh/α   predicted    -0.3625613E-04 (  -7.23%)
   displ. norm   :     0.1219451 α      lambda       -0.3702279E-04
   maximum displ.:     0.0852744 α      in ANC's #4, #2, #3, ...

........................................................................
.............................. CYCLE   10 ..............................
........................................................................
   1    -41.3164247 -0.413164E+02  0.743E-02    2.71       0.0  T
   2    -41.3164263 -0.158946E-05  0.395E-02    2.71       1.0  T
   3    -41.3164260  0.346178E-06  0.829E-03    2.71       2.4  T
   4    -41.3164266 -0.632794E-06  0.463E-03    2.71       4.2  T
   5    -41.3164268 -0.184003E-06  0.133E-03    2.71      14.8  T
   6    -41.3164268 -0.310098E-07  0.344E-04    2.71      56.9  T
   7    -41.3164268 -0.123727E-08  0.182E-04    2.71     107.7  T
     SCC iter.                  ...        0 min,  0.010 sec
     gradient                   ...        0 min,  0.019 sec
 * total energy  :   -40.6982279 Eh     change       -0.3764799E-04 Eh
   gradient norm :     0.0022512 Eh/α   predicted    -0.1863757E-04 ( -50.50%)
   displ. norm   :     0.0793396 α      lambda       -0.2631888E-04
   maximum displ.:     0.0498522 α      in ANC's #4, #2, #3, ...

........................................................................
.............................. CYCLE   11 ..............................
........................................................................
   1    -41.3167735 -0.413168E+02  0.466E-02    2.71       0.0  T
   2    -41.3167740 -0.548651E-06  0.251E-02    2.71       1.0  T
   3    -41.3167740  0.214176E-07  0.456E-03    2.71       4.3  T
   4    -41.3167741 -0.818156E-07  0.279E-03    2.71       7.0  T
   5    -41.3167742 -0.955164E-07  0.614E-04    2.71      31.9  T
   6    -41.3167742 -0.518398E-08  0.242E-04    2.71      81.0  T
     SCC iter.                  ...        0 min,  0.009 sec
     gradient                   ...        0 min,  0.019 sec
 * total energy  :   -40.6982504 Eh     change       -0.2243523E-04 Eh
   gradient norm :     0.0019781 Eh/α   predicted    -0.1324655E-04 ( -40.96%)
   displ. norm   :     0.2587839 α      lambda       -0.4605822E-04
   maximum displ.:     0.1445033 α      in ANC's #4, #1, #3, ...

........................................................................
.............................. CYCLE   12 ..............................
........................................................................
   1    -41.3168536 -0.413169E+02  0.151E-01    2.71       0.0  T
   2    -41.3168590 -0.547775E-05  0.818E-02    2.71       1.0  T
   3    -41.3168579  0.112503E-05  0.158E-02    2.71       1.2  T
   4    -41.3168598 -0.184650E-05  0.931E-03    2.71       2.1  T
   5    -41.3168607 -0.943177E-06  0.201E-03    2.71       9.7  T
   6    -41.3168608 -0.600506E-07  0.766E-04    2.71      25.6  T
   7    -41.3168608 -0.106131E-07  0.280E-04    2.71      69.9  T
     SCC iter.                  ...        0 min,  0.010 sec
     gradient                   ...        0 min,  0.019 sec
 * total energy  :   -40.6982893 Eh     change       -0.3893607E-04 Eh
   gradient norm :     0.0022006 Eh/α   predicted    -0.2371539E-04 ( -39.09%)
   displ. norm   :     0.0591861 α      lambda       -0.1717655E-04
   maximum displ.:     0.0418541 α      in ANC's #1, #3, #7, ...

........................................................................
.............................. CYCLE   13 ..............................
........................................................................
   1    -41.3172525 -0.413173E+02  0.329E-02    2.71       0.0  T
   2    -41.3172527 -0.234265E-06  0.178E-02    2.71       1.1  T
   3    -41.3172527  0.570442E-07  0.342E-03    2.71       5.7  T
   4    -41.3172528 -0.886099E-07  0.197E-03    2.71       9.9  T
   5    -41.3172528 -0.427266E-07  0.408E-04    2.71      48.1  T
   6    -41.3172528 -0.344289E-08  0.142E-04    2.71     138.5  T
     SCC iter.                  ...        0 min,  0.009 sec
     gradient                   ...        0 min,  0.019 sec
 * total energy  :   -40.6983046 Eh     change       -0.1527483E-04 Eh
   gradient norm :     0.0016525 Eh/α   predicted    -0.8619820E-05 ( -43.57%)
   displ. norm   :     0.1324912 α      lambda       -0.3006448E-04
   maximum displ.:     0.0942491 α      in ANC's #1, #3, #7, ...

........................................................................
.............................. CYCLE   14 ..............................
........................................................................
   1    -41.3175647 -0.413176E+02  0.743E-02    2.72       0.0  T
   2    -41.3175660 -0.132104E-05  0.402E-02    2.72       1.0  T
   3    -41.3175657  0.373305E-06  0.813E-03    2.71       2.4  T
   4    -41.3175662 -0.577188E-06  0.448E-03    2.72       4.4  T
   5    -41.3175664 -0.195862E-06  0.125E-03    2.71      15.7  T
   6    -41.3175665 -0.264429E-07  0.438E-04    2.71      44.8  T
   7    -41.3175665 -0.163086E-08  0.241E-04    2.71      81.4  T
     SCC iter.                  ...        0 min,  0.010 sec
     gradient                   ...        0 min,  0.019 sec
 * total energy  :   -40.6983385 Eh     change       -0.3393863E-04 Eh
   gradient norm :     0.0011232 Eh/α   predicted    -0.1515038E-04 ( -55.36%)
   displ. norm   :     0.1598085 α      lambda       -0.2353006E-04
   maximum displ.:     0.1104985 α      in ANC's #1, #3, #7, ...

........................................................................
.............................. CYCLE   15 ..............................
........................................................................
   1    -41.3167816 -0.413168E+02  0.908E-02    2.71       0.0  T
   2    -41.3167831 -0.157579E-05  0.497E-02    2.72       1.0  T
   3    -41.3167832 -0.877371E-07  0.775E-03    2.71       2.5  T
   4    -41.3167833 -0.265473E-07  0.466E-03    2.72       4.2  T
   5    -41.3167836 -0.331250E-06  0.863E-04    2.71      22.7  T
   6    -41.3167836 -0.134534E-07  0.327E-04    2.71      60.0  T
     SCC iter.                  ...        0 min,  0.009 sec
     gradient                   ...        0 min,  0.019 sec
 * total energy  :   -40.6983663 Eh     change       -0.2775264E-04 Eh
   gradient norm :     0.0019777 Eh/α   predicted    -0.1190133E-04 ( -57.12%)
   displ. norm   :     0.1597575 α      lambda       -0.2369074E-04
   maximum displ.:     0.1146702 α      in ANC's #1, #3, #2, ...

........................................................................
.............................. CYCLE   16 ..............................
........................................................................
   1    -41.3165622 -0.413166E+02  0.936E-02    2.72       0.0  T
   2    -41.3165639 -0.161650E-05  0.512E-02    2.72       1.0  T
   3    -41.3165639 -0.127481E-08  0.837E-03    2.72       2.3  T
   4    -41.3165638  0.937281E-07  0.591E-03    2.72       3.3  T
   5    -41.3165643 -0.557713E-06  0.757E-04    2.72      25.9  T
   6    -41.3165643 -0.996404E-08  0.230E-04    2.72      85.4  T
     SCC iter.                  ...        0 min,  0.009 sec
     gradient                   ...        0 min,  0.019 sec
 * total energy  :   -40.6983951 Eh     change       -0.2884200E-04 Eh
   gradient norm :     0.0026792 Eh/α   predicted    -0.1198070E-04 ( -58.46%)
   displ. norm   :     0.1562014 α      lambda       -0.3477350E-04
   maximum displ.:     0.1141993 α      in ANC's #1, #3, #2, ...

........................................................................
.............................. CYCLE   17 ..............................
........................................................................
   1    -41.3165786 -0.413166E+02  0.903E-02    2.72       0.0  T
   2    -41.3165801 -0.147820E-05  0.494E-02    2.72       1.0  T
   3    -41.3165802 -0.104191E-06  0.774E-03    2.72       2.5  T
   4    -41.3165800  0.153409E-06  0.531E-03    2.72       3.7  T
   5    -41.3165805 -0.466092E-06  0.577E-04    2.72      34.0  T
   6    -41.3165805 -0.533003E-08  0.215E-04    2.72      91.1  T
     SCC iter.                  ...        0 min,  0.009 sec
     gradient                   ...        0 min,  0.019 sec
 * total energy  :   -40.6984243 Eh     change       -0.2919005E-04 Eh
   gradient norm :     0.0027351 Eh/α   predicted    -0.1781143E-04 ( -38.98%)
   displ. norm   :     0.2764008 α      lambda       -0.5220725E-04
   maximum displ.:     0.2022809 α      in ANC's #1, #3, #2, ...

........................................................................
.............................. CYCLE   18 ..............................
........................................................................
   1    -41.3159414 -0.413159E+02  0.160E-01    2.73       0.0  T
   2    -41.3159456 -0.420539E-05  0.882E-02    2.73       1.0  T
   3    -41.3159456 -0.515423E-07  0.138E-02    2.73       1.4  T
   4    -41.3159454  0.162542E-06  0.938E-03    2.73       2.1  T
   5    -41.3159468 -0.131213E-05  0.128E-03    2.73      15.3  T
   6    -41.3159468 -0.311397E-07  0.409E-04    2.73      47.9  T
   7    -41.3159468 -0.206916E-08  0.214E-04    2.73      91.4  T
     SCC iter.                  ...        0 min,  0.010 sec
     gradient                   ...        0 min,  0.019 sec
 * total energy  :   -40.6984584 Eh     change       -0.3411249E-04 Eh
   gradient norm :     0.0041189 Eh/α   predicted    -0.2809917E-04 ( -17.63%)
   displ. norm   :     0.1534089 α      lambda       -0.3929906E-04
   maximum displ.:     0.1196404 α      in ANC's #1, #2, #3, ...

........................................................................
.............................. CYCLE   19 ..............................
........................................................................
   1    -41.3168324 -0.413168E+02  0.834E-02    2.73       0.0  T
   2    -41.3168337 -0.130448E-05  0.457E-02    2.73       1.0  T
   3    -41.3168335  0.165901E-06  0.805E-03    2.73       2.4  T
   4    -41.3168337 -0.201278E-06  0.513E-03    2.73       3.8  T
   5    -41.3168340 -0.328256E-06  0.991E-04    2.73      19.8  T
   6    -41.3168340 -0.167087E-07  0.346E-04    2.73      56.7  T
     SCC iter.                  ...        0 min,  0.009 sec
     gradient                   ...        0 min,  0.018 sec
 * total energy  :   -40.6984833 Eh     change       -0.2489444E-04 Eh
   gradient norm :     0.0023114 Eh/α   predicted    -0.2011545E-04 ( -19.20%)
   displ. norm   :     0.1803332 α      lambda       -0.2872064E-04
   maximum displ.:     0.1285407 α      in ANC's #1, #2, #4, ...

........................................................................
.............................. CYCLE   20 ..............................
........................................................................
   1    -41.3166814 -0.413167E+02  0.103E-01    2.74       0.0  T
   2    -41.3166831 -0.161134E-05  0.577E-02    2.74       1.0  T
   3    -41.3166820  0.110091E-05  0.111E-02    2.74       1.8  T
   4    -41.3166833 -0.133028E-05  0.557E-03    2.74       3.5  T
   5    -41.3166836 -0.288256E-06  0.139E-03    2.74      14.1  T
   6    -41.3166836 -0.324512E-07  0.435E-04    2.74      45.0  T
   7    -41.3166836 -0.320423E-08  0.199E-04    2.74      98.3  T
     SCC iter.                  ...        0 min,  0.010 sec
     gradient                   ...        0 min,  0.019 sec
 * total energy  :   -40.6985034 Eh     change       -0.2013025E-04 Eh
   gradient norm :     0.0027453 Eh/α   predicted    -0.1483007E-04 ( -26.33%)
   displ. norm   :     0.1538104 α      lambda       -0.4894074E-04
   maximum displ.:     0.0888673 α      in ANC's #1, #2, #4, ...
 * RMSD in coord.:     0.4986127 α      energy gain  -0.2771525E-01 Eh

generating ANC from model Hessian ...
Using Lindh-Hessian (1995)
 Shifting diagonal of input Hessian by   3.896981053937087E-003
 Lowest  eigenvalues of input Hessian
   -0.000000   -0.000000   -0.000000    0.000000    0.000000    0.000000
    0.005000    0.006441    0.006907    0.008213    0.009669    0.010155
    0.011871    0.015657    0.017297    0.020935    0.022131    0.026179
 Highest eigenvalues
    1.797469    1.862230    1.973037    2.041959    2.082932    2.150560
 

........................................................................
.............................. CYCLE   21 ..............................
........................................................................
   1    -41.3181381 -0.413181E+02  0.872E-02    2.75       0.0  T
   2    -41.3181394 -0.133474E-05  0.495E-02    2.75       1.0  T
   3    -41.3181372  0.219966E-05  0.123E-02    2.75       1.6  T
   4    -41.3181398 -0.256592E-05  0.442E-03    2.75       4.4  T
   5    -41.3181400 -0.173867E-06  0.135E-03    2.75      14.5  T
   6    -41.3181400 -0.181516E-07  0.530E-04    2.75      37.0  T
   7    -41.3181400 -0.437189E-08  0.253E-04    2.75      77.4  T
     SCC iter.                  ...        0 min,  0.010 sec
     gradient                   ...        0 min,  0.019 sec
 * total energy  :   -40.6985325 Eh     change       -0.2907850E-04 Eh
   gradient norm :     0.0024588 Eh/α   predicted     0.0000000E+00 (-100.00%)
   displ. norm   :     0.0410153 α      lambda       -0.2067143E-04
   maximum displ.:     0.0241746 α      in ANC's #1, #6, #2, ...

........................................................................
.............................. CYCLE   22 ..............................
........................................................................
   1    -41.3177478 -0.413177E+02  0.266E-02    2.75       0.0  T
   2    -41.3177480 -0.234955E-06  0.137E-02    2.75       1.4  T
   3    -41.3177480  0.722956E-08  0.292E-03    2.75       6.7  T
   4    -41.3177480 -0.450391E-07  0.169E-03    2.75      11.6  T
   5    -41.3177480 -0.187947E-07  0.487E-04    2.75      40.3  T
   6    -41.3177480 -0.449234E-08  0.119E-04    2.75     165.0  T
     SCC iter.                  ...        0 min,  0.009 sec
     gradient                   ...        0 min,  0.019 sec
 * total energy  :   -40.6985491 Eh     change       -0.1658878E-04 Eh
   gradient norm :     0.0013865 Eh/α   predicted    -0.1035349E-04 ( -37.59%)
   displ. norm   :     0.0751156 α      lambda       -0.1783097E-04
   maximum displ.:     0.0386879 α      in ANC's #6, #2, #1, ...

........................................................................
.............................. CYCLE   23 ..............................
........................................................................
   1    -41.3173320 -0.413173E+02  0.473E-02    2.75       0.0  T
   2    -41.3173327 -0.679909E-06  0.251E-02    2.75       1.0  T
   3    -41.3173326  0.419758E-07  0.514E-03    2.75       3.8  T
   4    -41.3173328 -0.147983E-06  0.290E-03    2.75       6.8  T
   5    -41.3173328 -0.567206E-07  0.866E-04    2.75      22.7  T
   6    -41.3173328 -0.135542E-07  0.227E-04    2.75      86.6  T
     SCC iter.                  ...        0 min,  0.009 sec
     gradient                   ...        0 min,  0.019 sec
 * total energy  :   -40.6985658 Eh     change       -0.1671839E-04 Eh
   gradient norm :     0.0009879 Eh/α   predicted    -0.8938091E-05 ( -46.54%)
   displ. norm   :     0.0746136 α      lambda        0.5110908E-05
   maximum displ.:     0.0386913 α      in ANC's #6, #2, #1, ...

........................................................................
.............................. CYCLE   24 ..............................
........................................................................
   1    -41.3167709 -0.413168E+02  0.470E-02    2.75       0.0  T
   2    -41.3167715 -0.664238E-06  0.250E-02    2.75       1.0  T
   3    -41.3167715  0.284092E-07  0.500E-03    2.75       3.9  T
   4    -41.3167716 -0.127889E-06  0.285E-03    2.75       6.9  T
   5    -41.3167717 -0.577457E-07  0.853E-04    2.75      23.0  T
   6    -41.3167717 -0.129300E-07  0.226E-04    2.75      86.9  T
     SCC iter.                  ...        0 min,  0.009 sec
     gradient                   ...        0 min,  0.019 sec
 * total energy  :   -40.6985623 Eh     change        0.3479967E-05 Eh
   gradient norm :     0.0029823 Eh/α   predicted     0.2557955E-05 ( -26.49%)
   displ. norm   :     0.0180834 α      lambda       -0.1186704E-04
   maximum displ.:     0.0099167 α      in ANC's #6, #7, #5, ...

........................................................................
.............................. CYCLE   25 ..............................
........................................................................
   1    -41.3173178 -0.413173E+02  0.158E-02    2.75       0.0  T
   2    -41.3173179 -0.113243E-06  0.801E-03    2.75       2.4  T
   3    -41.3173179  0.217079E-07  0.221E-03    2.75       8.9  T
   4    -41.3173179 -0.416832E-07  0.115E-03    2.75      17.1  T
   5    -41.3173179 -0.621326E-08  0.447E-04    2.75      43.9  T
   6    -41.3173179 -0.291527E-08  0.131E-04    2.75     149.9  T
     SCC iter.                  ...        0 min,  0.009 sec
     gradient                   ...        0 min,  0.019 sec
 * total energy  :   -40.6985713 Eh     change       -0.8998610E-05 Eh
   gradient norm :     0.0017517 Eh/α   predicted    -0.5935597E-05 ( -34.04%)
   displ. norm   :     0.0430062 α      lambda       -0.1069798E-04
   maximum displ.:     0.0224564 α      in ANC's #2, #3, #5, ...

........................................................................
.............................. CYCLE   26 ..............................
........................................................................
   1    -41.3181462 -0.413181E+02  0.274E-02    2.75       0.0  T
   2    -41.3181466 -0.330442E-06  0.147E-02    2.75       1.3  T
   3    -41.3181464  0.154026E-06  0.461E-03    2.75       4.3  T
   4    -41.3181466 -0.203990E-06  0.213E-03    2.75       9.2  T
   5    -41.3181467 -0.298082E-07  0.843E-04    2.75      23.3  T
   6    -41.3181467 -0.946635E-08  0.279E-04    2.75      70.3  T
     SCC iter.                  ...        0 min,  0.009 sec
     gradient                   ...        0 min,  0.019 sec
 * total energy  :   -40.6985789 Eh     change       -0.7552452E-05 Eh
   gradient norm :     0.0008700 Eh/α   predicted    -0.5357690E-05 ( -29.06%)
   displ. norm   :     0.0378982 α      lambda       -0.4072116E-05
   maximum displ.:     0.0251780 α      in ANC's #2, #3, #4, ...

........................................................................
.............................. CYCLE   27 ..............................
........................................................................
   1    -41.3180025 -0.413180E+02  0.202E-02    2.75       0.0  T
   2    -41.3180025 -0.588876E-07  0.113E-02    2.75       1.7  T
   3    -41.3180025  0.171274E-07  0.189E-03    2.75      10.4  T
   4    -41.3180025 -0.171192E-07  0.118E-03    2.75      16.7  T
   5    -41.3180025 -0.181157E-07  0.189E-04    2.75     103.6  T
   6    -41.3180025 -0.507967E-09  0.763E-05    2.75     257.1  T
     SCC iter.                  ...        0 min,  0.009 sec
     gradient                   ...        0 min,  0.019 sec
 * total energy  :   -40.6985837 Eh     change       -0.4811176E-05 Eh
   gradient norm :     0.0007542 Eh/α   predicted    -0.2037997E-05 ( -57.64%)
   displ. norm   :     0.0798611 α      lambda       -0.7774226E-05
   maximum displ.:     0.0529669 α      in ANC's #2, #3, #4, ...

   *** GEOMETRY OPTIMIZATION CONVERGED AFTER 27 ITERATIONS ***

------------------------------------------------------------------------
 total energy gain   :        -0.0277955 Eh      -17.4420 kcal/mol
 total RMSD          :         0.5085453 a0        0.2691 Å
 total power (kW/mol):        -2.7028568 (step)  -64.3981 (real)
------------------------------------------------------------------------

 ANCopt (total)                0 d,  0 h,  0 min,  1.133 sec
 optimizer setup                ...        0 min,  0.000 sec (  0.013%)
 model hessian                  ...        0 min,  0.012 sec (  1.099%)
 ANC generation                 ...        0 min,  0.002 sec (  0.137%)
 coordinate transformation      ...        0 min,  0.001 sec (  0.045%)
 single point calculation       ...        0 min,  1.109 sec ( 97.893%)
 optimization log               ...        0 min,  0.003 sec (  0.248%)
 hessian update                 ...        0 min,  0.000 sec (  0.034%)
 rational function              ...        0 min,  0.004 sec (  0.381%)

================
 final structure:
================
$coord
    4.72502272080836    1.60362963269636    0.11282131544434      C 
    5.87161670632043   -0.68833045330222   -0.03858013419112      C 
    3.80536567106501   -3.21501473718574   -0.36636672915311      S 
    1.27750041824255   -1.15717615286956   -0.30612835721679      C 
    2.07532577614272    1.35488383544786   -0.03832300361282      C 
    0.02090910809138    2.93194826411959    0.03213205722504      N 
    0.16312128628964    5.64448937659466    0.16568129536120      C 
    0.19769453312875    6.84319077887569   -2.46232426711815      C 
   -2.09359686109222    1.45264995666350   -0.24957027603183      C 
   -1.36501588985411   -1.09200523605416   -0.43214744213355      C 
   -3.93284647847926   -3.08192461201366   -0.70852251079897      S 
   -5.93343352946429   -0.50799959210467   -0.55403851720996      C 
   -4.76486010957303    1.79156963555561   -0.31550371115031      C 
   -6.10431097521373    4.18488373651662   -0.19958390242432      C 
   -8.49385834954163    4.46280798313698    0.51268882102797      C 
    5.73411154458294    3.35517468073438    0.31539842032856      H 
    7.85759323327951   -1.07963780442285    0.01929018698815      H 
    1.89572796844212    6.13523096422761    1.17910286868682      H 
   -1.44297617813403    6.34305373806686    1.26241219433609      H 
    1.83410901201792    6.18551738152068   -3.51725072000698      H 
    0.28736642232728    8.88907926331070   -2.30663535539246      H 
   -1.49349717399289    6.33051412503948   -3.51172187630267      H 
   -7.92421632461055   -0.84302072015049   -0.71127781324379      H 
   -5.03255906895208    5.83470131442950   -0.75024879696938      H 
   -9.63265730828510    2.89068112617322    1.12005413622823      H 
   -9.38678427536764    6.28970390156427    0.53294853291548      H 
$end
           -------------------------------------------------
          |                Final Singlepoint                |
           -------------------------------------------------

          ...................................................
          :                      SETUP                      :
          :.................................................:
          :  # basis functions                  83          :
          :  # atomic orbitals                  81          :
          :  # shells                           43          :
          :  # electrons                        76          :
          :  max. iterations                   250          :
          :  Hamiltonian                  GFN2-xTB          :
          :  restarted?                      false          :
          :  GBSA solvation                  false          :
          :  PC potential                    false          :
          :  electronic temp.          300.0000000     K    :
          :  accuracy                    1.0000000          :
          :  -> integral cutoff          0.2500000E+02      :
          :  -> integral neglect         0.1000000E-07      :
          :  -> SCF convergence          0.1000000E-05 Eh   :
          :  -> wf. convergence          0.1000000E-03 e    :
          :  Broyden damping             0.4000000          :
          ...................................................

 iter      E             dE          RMSdq      gap      omega  full diag
   1    -41.3180025 -0.413180E+02  0.408E-05    2.75       0.0  T
   2    -41.3180025 -0.178346E-11  0.203E-05    2.75     964.6  T
   3    -41.3180025 -0.432721E-11  0.191E-05    2.75    1028.7  T

   *** convergence criteria satisfied after 3 iterations ***

         #    Occupation            Energy/Eh            Energy/eV
      -------------------------------------------------------------
         1        2.0000           -0.7230706             -19.6758
       ...           ...                  ...                  ...
        32        2.0000           -0.4399251             -11.9710
        33        2.0000           -0.4367907             -11.8857
        34        2.0000           -0.4307499             -11.7213
        35        2.0000           -0.4065462             -11.0627
        36        2.0000           -0.3886166             -10.5748
        37        2.0000           -0.3617541              -9.8438
        38        2.0000           -0.3578320              -9.7371 (HOMO)
        39                         -0.2566180              -6.9829 (LUMO)
        40                         -0.2311281              -6.2893
        41                         -0.2008092              -5.4643
        42                         -0.1958370              -5.3290
        43                         -0.1906400              -5.1876
       ...                                ...                  ...
        81                          0.7017252              19.0949
      -------------------------------------------------------------
                  HL-Gap            0.1012140 Eh            2.7542 eV
             Fermi-level           -0.3072250 Eh           -8.3600 eV

 SCC (total)                   0 d,  0 h,  0 min,  0.038 sec
 SCC setup                      ...        0 min,  0.000 sec (  0.629%)
 Dispersion                     ...        0 min,  0.000 sec (  0.635%)
 integral evaluation            ...        0 min,  0.013 sec ( 33.264%)
 zeroth order Hamiltonian       ...        0 min,  0.000 sec (  0.564%)
 iterations                     ...        0 min,  0.005 sec ( 13.027%)
 molecular gradient             ...        0 min,  0.019 sec ( 50.772%)
 printout                       ...        0 min,  0.000 sec (  0.967%)

         :::::::::::::::::::::::::::::::::::::::::::::::::::::
         ::                     SUMMARY                     ::
         :::::::::::::::::::::::::::::::::::::::::::::::::::::
         :: total energy             -40.698583700536 Eh    ::
         :: gradient norm              0.000754155154 Eh/a0 ::
         :: HOMO-LUMO gap              2.754172335086 eV    ::
         ::.................................................::
         :: SCC energy               -41.318002542742 Eh    ::
         :: -> isotropic ES            0.004541136370 Eh    ::
         :: -> anisotropic ES          0.004130053888 Eh    ::
         :: -> anisotropic XC          0.019149234801 Eh    ::
         :: -> dispersion             -0.031275552385 Eh    ::
         :: repulsion energy           0.619227312847 Eh    ::
         :: add. restraining           0.000000000000 Eh    ::
         :::::::::::::::::::::::::::::::::::::::::::::::::::::

           -------------------------------------------------
          |                Property Printout                |
           -------------------------------------------------

    * Orbital Energies and Occupations

         #    Occupation            Energy/Eh            Energy/eV
      -------------------------------------------------------------
         1        2.0000           -0.7230706             -19.6758
       ...           ...                  ...                  ...
        26        2.0000           -0.4697825             -12.7834
        27        2.0000           -0.4652629             -12.6604
        28        2.0000           -0.4584131             -12.4741
        29        2.0000           -0.4535705             -12.3423
        30        2.0000           -0.4499605             -12.2440
        31        2.0000           -0.4439754             -12.0812
        32        2.0000           -0.4399251             -11.9710
        33        2.0000           -0.4367907             -11.8857
        34        2.0000           -0.4307499             -11.7213
        35        2.0000           -0.4065462             -11.0627
        36        2.0000           -0.3886166             -10.5748
        37        2.0000           -0.3617541              -9.8438
        38        2.0000           -0.3578320              -9.7371 (HOMO)
        39                         -0.2566180              -6.9829 (LUMO)
        40                         -0.2311281              -6.2893
        41                         -0.2008092              -5.4643
        42                         -0.1958370              -5.3290
        43                         -0.1906400              -5.1876
        44                         -0.1483820              -4.0377
        45                         -0.1257837              -3.4227
        46                         -0.1223619              -3.3296
        47                         -0.1110876              -3.0228
        48                         -0.0098879              -0.2691
        49                         -0.0075130              -0.2044
       ...                                ...                  ...
        81                          0.7017252              19.0949
      -------------------------------------------------------------
                  HL-Gap            0.1012140 Eh            2.7542 eV
             Fermi-level           -0.3072250 Eh           -8.3600 eV

     #   Z        covCN         q      C6AA      α(0)
     1   6 C      3.048    -0.059    29.422     8.896
     2   6 C      2.956    -0.022    28.562     8.766
     3  16 S      2.226    -0.056   143.361    20.152
     4   6 C      3.100    -0.008    28.089     8.685
     5   6 C      3.313     0.021    25.548     8.062
     6   7 N      2.803    -0.041    22.034     6.972
     7   6 C      3.738     0.007    20.541     6.467
     8   6 C      3.752    -0.109    22.649     6.787
     9   6 C      3.288     0.016    26.081     8.202
    10   6 C      3.109    -0.009    28.082     8.682
    11  16 S      2.204    -0.053   143.250    20.144
    12   6 C      2.958    -0.027    28.666     8.782
    13   6 C      3.088    -0.013    28.243     8.711
    14   6 C      2.891    -0.032    28.788     8.797
    15   6 C      2.839    -0.092    30.300     9.021
    16   1 H      0.926     0.033     2.548     2.496
    17   1 H      0.926     0.042     2.418     2.432
    18   1 H      0.924     0.051     2.303     2.373
    19   1 H      0.924     0.052     2.292     2.367
    20   1 H      0.925     0.047     2.352     2.398
    21   1 H      0.925     0.045     2.378     2.412
    22   1 H      0.925     0.048     2.343     2.394
    23   1 H      0.926     0.045     2.386     2.415
    24   1 H      0.926     0.036     2.498     2.472
    25   1 H      0.926     0.039     2.467     2.456
    26   1 H      0.926     0.037     2.490     2.468

 Mol. C6AA /au·bohr⁶  :      11647.774758
 Mol. C8AA /au·bohr⁸  :     340545.713366
 Mol. α(0) /au        :        173.808388


Wiberg/Mayer (AO) data.
largest (>0.10) Wiberg bond orders for each atom
          total WBO             WBO to atom ...
     1  C   3.983        C    2 1.632    C    5 1.232    H   16 0.963    S    3 0.104
     2  C   3.923        C    1 1.632    S    3 1.162    H   17 0.972
     3  S   2.549        C    2 1.162    C    4 1.115    C    1 0.104
     4  C   3.937        C    5 1.327    C   10 1.275    S    3 1.115
     5  C   3.952        C    4 1.327    C    1 1.232    N    6 1.157
     6  N   3.574        C    9 1.162    C    5 1.157    C    7 0.992
     7  C   3.973        C    8 1.005    N    6 0.992    H   18 0.970    H   19 0.966
     8  C   3.991        C    7 1.005    H   20 0.987    H   21 0.985    H   22 0.985
     9  C   3.950        C   10 1.334    C   13 1.187    N    6 1.162
    10  C   3.935        C    9 1.334    C    4 1.275    S   11 1.108
    11  S   2.576        C   12 1.179    C   10 1.108
    12  C   3.919        C   13 1.544    S   11 1.179    H   23 0.969
    13  C   3.982        C   12 1.544    C    9 1.187    C   14 1.088
    14  C   3.991        C   15 1.897    C   13 1.088    H   24 0.958
    15  C   3.990        C   14 1.897    H   26 0.979    H   25 0.976
    16  H   0.998        C    1 0.963
    17  H   0.998        C    2 0.972
    18  H   0.996        C    7 0.970
    19  H   0.996        C    7 0.966
    20  H   0.998        C    8 0.987
    21  H   0.997        C    8 0.985
    22  H   0.998        C    8 0.985
    23  H   0.997        C   12 0.969
    24  H   0.999        C   14 0.958
    25  H   0.998        C   15 0.976
    26  H   0.998        C   15 0.979

molecular dipole:
                 x           y           z       tot (Debye)
 q only:        0.085       1.182       0.001
   full:        0.109       1.703       0.059       4.339
molecular quadrupole (traceless):
                xx          xy          yy          xz          yz          zz
 q only:       -1.279       0.656       4.402       0.008      -0.961      -3.123
  q+dip:        3.445       1.052       2.522      -0.371      -1.064      -5.967
   full:        2.104       1.050       1.843      -0.022      -1.223      -3.946

           -------------------------------------------------
          |                Geometry Summary                 |
           -------------------------------------------------

      molecular mass/u    :      233.3456000
   center of mass at/Å    :       -0.4416079       0.4011473      -0.1953266
  moments of inertia/u·Å² :        0.6540143E+03   0.1233630E+04   0.1826158E+04
rotational constants/cm⁻¹ :        0.2577563E-01   0.1366506E-01   0.9231201E-02

 * 27 selected distances

     #   Z        #   Z                                     value/Å
     1   6 C      2   6 C                                 1.3585209
     2   6 C      3  16 S                                 1.7359088 (max)
     3  16 S      4   6 C                                 1.7251853
     1   6 C      5   6 C                                 1.4105937
     4   6 C      5   6 C                                 1.4019393
     5   6 C      6   7 N                                 1.3710414
     6   7 N      7   6 C                                 1.4391227
     7   6 C      8   6 C                                 1.5286257
     6   7 N      9   6 C                                 1.3737033
     4   6 C     10   6 C                                 1.4003735
     9   6 C     10   6 C                                 1.4040096
    10   6 C     11  16 S                                 1.7253058
    11  16 S     12   6 C                                 1.7270407
     9   6 C     13   6 C                                 1.4253310
    12   6 C     13   6 C                                 1.3708124
    14   6 C     15   6 C                                 1.3276456
     1   6 C     16   1 H                                 1.0750517
     2   6 C     17   1 H                                 1.0715772
     7   6 C     18   1 H                                 1.0934621
     7   6 C     19   1 H                                 1.0935368
     8   6 C     20   1 H                                 1.0874891
     8   6 C     21   1 H                                 1.0868043
     8   6 C     22   1 H                                 1.0876108
    12   6 C     23   1 H                                 1.0715257 (min)
    14   6 C     24   1 H                                 1.0811005
    15   6 C     25   1 H                                 1.0763703
    15   6 C     26   1 H                                 1.0761019

 * 4 distinct bonds (by element types)

   Z      Z             #   av. dist./Å        max./Å        min./Å
   1 H    6 C          11     1.0818755     1.0935368     1.0715257
   6 C    6 C           9     1.4030946     1.5286257     1.3276456
   6 C    7 N           3     1.3946225     1.4391227     1.3710414
   6 C   16 S           4     1.7283602     1.7359088     1.7251853


optimized geometry written to: xtbopt.xyz


           -------------------------------------------------
          | TOTAL ENERGY              -40.698583700536 Eh   |
          | GRADIENT NORM               0.000754155154 Eh/α |
          | HOMO-LUMO GAP               2.754172335086 eV   |
           -------------------------------------------------

------------------------------------------------------------------------
 * finished run on 2021/05/19 at 10:59:50.736     
------------------------------------------------------------------------
 total:
 * wall-time:     0 d,  0 h,  0 min,  1.249 sec
 *  cpu-time:     0 d,  0 h,  0 min,  1.245 sec
 * ratio c/w:     0.997 speedup
 SCF:
 * wall-time:     0 d,  0 h,  0 min,  0.052 sec
 *  cpu-time:     0 d,  0 h,  0 min,  0.052 sec
 * ratio c/w:     0.998 speedup
 ANC optimizer:
 * wall-time:     0 d,  0 h,  0 min,  1.172 sec
 *  cpu-time:     0 d,  0 h,  0 min,  1.169 sec
 * ratio c/w:     0.998 speedup

