      -----------------------------------------------------------      
     |                   =====================                   |     
     |                           x T B                           |     
     |                   =====================                   |     
     |                         S. Grimme                         |     
     |          Mulliken Center for Theoretical Chemistry        |     
     |                    University of Bonn                     |     
     |                Version 6.2 RC2 (SAW190805)                |     
      -----------------------------------------------------------      

   This program is distributed in the hope that it will be useful,
   but WITHOUT ANY WARRANTY; without even the implied warranty of
   MERCHANTABILITY or FITNESS FOR A PARTICULAR PURPOSE.
   
   FOR NON-COMMERCIAL, ACADEMIA USE ONLY.
   
   Cite this work as:
   * S. Grimme, C. Bannwarth, P. Shushkov, J. Chem. Theory Comput., 2017,
     13, 1989-2009. DOI: 10.1021/acs.jctc.7b00118
   * C. Bannwarth, S. Ehlert and S. Grimme., J. Chem. Theory Comput., 2019,
     15, 1652-1671. DOI: 10.1021/acs.jctc.8b01176
   * P. Pracht, E. Caldeweyher, S. Ehlert, S. Grimme, ChemRxiv, 2019, preprint.
     DOI: 10.26434/chemrxiv.8326202.v1
   
   for DFT-D4:
   * E. Caldeweyher, C. Bannwarth and S. Grimme, J. Chem. Phys., 2017,
     147, 034112. DOI: 10.1063/1.4993215
   * E. Caldeweyher, S. Ehlert, A. Hansen, H. Neugebauer, S. Spicher,
     C. Bannwarth and S. Grimme, J. Chem. Phys., 2019, 150, 154122.
     DOI: 10.1063/1.5090222
   
   for sTDA-xTB:
   * S. Grimme and C. Bannwarth, J. Chem. Phys., 2016, 145, 054103.
     DOI: 10.1063/1.4959605
   
   in the mass-spec context:
   * V. Asgeirsson, C. Bauer and S. Grimme, Chem. Sci., 2017, 8, 4879.
     DOI: 10.1039/c7sc00601b
   
   for metadynamics refer to:
   * S. Grimme, J. Chem. Theory Comput., 2019, 155, 2847-2862
     DOI: 10.1021/acs.jctc.9b00143
   
   with help from (in alphabetical order)
   C. Bannwarth, F. Bohle, G. Brandenburg, E. Caldeweyher, M. Checinski,
   S. Dohm, S. Ehlert, S. Ehrlich, F. März, H. Neugebauer, J. Pisarek,
   P. Pracht, P. Shushkov, and S. Spicher.
   
 * started run on 2021/05/19 at 10:59:50.755     

           -------------------------------------------------
          |                Calculation Setup                |
           -------------------------------------------------

          program call               : /ihome/ghutchison/geoffh/xtb/xtb 568.xyz -opt
          hostname                   : smp-n144
          coordinate file            : 568.xyz
          omp threads                :                     1
          number of atoms            :                    28
          number of electrons        :                    78
          charge                     :                     0
          spin                       :                   0.0
          first test random number   :      0.60338940298562


########################################################################
# WARNING! Please study the warnings concerning your input carefully
#  - the use of '-opt' is discouraged, please use '--opt' next time
########################################################################

           ------------------------------------------------- 
          |                 G F N 2 - x T B                 |
          | Geometry, Frequencies, Noncovalent interactions |
          |            JCTC 2019 parametrisation            |
           ------------------------------------------------- 
             KAB for C  - Si     :                1.0500
             KAB for H  - Pd     :                0.9500
             k(s)              :                1.8500
             k(p)              :                2.2300
             k(d)              :                2.2300
             k(f)              :                2.0000
             kEN (H0ij)        :               -2.0000
             D4 a1             :                0.5200
             D4 a2             :                5.0000
             D4 s6             :                1.0000
             D4 s8             :                2.7000
             D4 s9             :                5.0000
             alphaj            :                2.0000

  Z AO/shell   Hii/eV     exponent
  1     Wed Apr 25 08:07:45 CEST 2018   EN: 2.200 GM2: 0.406  GM3: 0.0800  RAES: 1.40
     1s    -10.707211    1.230000
  6     Wed Apr 25 08:07:45 CEST 2018   EN: 2.550 GM2: 0.538  GM3: 0.1500  RAES: 3.00
     2s    -13.970922    2.096432
     2p    -10.063292    1.800000
  7     Wed Apr 25 08:07:45 CEST 2018   EN: 3.040 GM2: 0.461  GM3:-0.0640  RAES: 1.90
     2s    -16.686243    2.339881
     2p    -12.523956    2.014332
  8     Wed Apr 25 08:07:45 CEST 2018   EN: 3.440 GM2: 0.452  GM3:-0.0517  RAES: 1.80
     2s    -20.229985    2.439742
     2p    -15.503117    2.137023
 16     Tue Apr 24 11:44:34 CEST 2018   EN: 2.580 GM2: 0.340  GM3:-0.0502  RAES: 3.10
     3s    -20.029654    1.981333
     3p    -11.377694    2.025643
     3d     -0.420282    1.702555

           ------------------------------------------------- 
          |        Self-Consistent Charge Iterations        |
           ------------------------------------------------- 

          ...................................................
          :                      SETUP                      :
          :.................................................:
          :  # basis functions                  79          :
          :  # atomic orbitals                  78          :
          :  # shells                           44          :
          :  # electrons                        78          :
          :  max. iterations                   250          :
          :  Hamiltonian                  GFN2-xTB          :
          :  restarted?                      false          :
          :  GBSA solvation                  false          :
          :  PC potential                    false          :
          :  electronic temp.          300.0000000     K    :
          :  accuracy                    1.0000000          :
          :  -> integral cutoff          0.2500000E+02      :
          :  -> integral neglect         0.1000000E-07      :
          :  -> SCF convergence          0.1000000E-05 Eh   :
          :  -> wf. convergence          0.1000000E-03 e    :
          :  Broyden damping             0.4000000          :
          ...................................................

 iter      E             dE          RMSdq      gap      omega  full diag
   1    -43.0302043 -0.430302E+02  0.467E+00    3.05       0.0  T
   2    -43.0619475 -0.317431E-01  0.279E+00    3.07       1.0  T
   3    -43.0070609  0.548866E-01  0.187E+00    3.14       1.0  T
   4    -43.0794537 -0.723928E-01  0.568E-01    3.09       1.0  T
   5    -43.0836845 -0.423078E-02  0.160E-01    3.09       1.0  T
   6    -43.0838342 -0.149673E-03  0.990E-02    3.09       1.0  T
   7    -43.0839844 -0.150271E-03  0.258E-02    3.09       1.0  T
   8    -43.0839889 -0.442010E-05  0.130E-02    3.09       1.5  T
   9    -43.0839893 -0.462900E-06  0.647E-03    3.09       2.9  T
  10    -43.0839901 -0.746466E-06  0.242E-03    3.09       7.8  T
  11    -43.0839901 -0.506302E-07  0.895E-04    3.09      21.1  T
  12    -43.0839901 -0.818908E-08  0.434E-04    3.09      43.6  T

   *** convergence criteria satisfied after 12 iterations ***

         #    Occupation            Energy/Eh            Energy/eV
      -------------------------------------------------------------
         1        2.0000           -0.7412084             -20.1693
       ...           ...                  ...                  ...
        33        2.0000           -0.4477736             -12.1845
        34        2.0000           -0.4426079             -12.0440
        35        2.0000           -0.4337284             -11.8024
        36        2.0000           -0.4251787             -11.5697
        37        2.0000           -0.4074305             -11.0867
        38        2.0000           -0.4000798             -10.8867
        39        2.0000           -0.3859302             -10.5017 (HOMO)
        40                         -0.2722855              -7.4093 (LUMO)
        41                         -0.2240695              -6.0972
        42                         -0.2159101              -5.8752
        43                         -0.2139752              -5.8226
        44                         -0.2051180              -5.5815
       ...                                ...                  ...
        78                          1.0191104              27.7314
      -------------------------------------------------------------
                  HL-Gap            0.1136447 Eh            3.0924 eV
             Fermi-level           -0.3291079 Eh           -8.9555 eV

 SCC (total)                   0 d,  0 h,  0 min,  0.049 sec
 SCC setup                      ...        0 min,  0.000 sec (  0.682%)
 Dispersion                     ...        0 min,  0.000 sec (  0.883%)
 integral evaluation            ...        0 min,  0.012 sec ( 23.815%)
 zeroth order Hamiltonian       ...        0 min,  0.000 sec (  0.485%)
 iterations                     ...        0 min,  0.018 sec ( 35.875%)
 molecular gradient             ...        0 min,  0.018 sec ( 37.284%)
 printout                       ...        0 min,  0.000 sec (  0.871%)

         :::::::::::::::::::::::::::::::::::::::::::::::::::::
         ::                     SUMMARY                     ::
         :::::::::::::::::::::::::::::::::::::::::::::::::::::
         :: total energy             -42.484841819454 Eh    ::
         :: gradient norm              0.082426253229 Eh/a0 ::
         :: HOMO-LUMO gap              3.092428771988 eV    ::
         ::.................................................::
         :: SCC energy               -43.083990131174 Eh    ::
         :: -> isotropic ES            0.028393047286 Eh    ::
         :: -> anisotropic ES          0.005140182453 Eh    ::
         :: -> anisotropic XC          0.031279478460 Eh    ::
         :: -> dispersion             -0.030721875206 Eh    ::
         :: repulsion energy           0.598713609066 Eh    ::
         :: add. restraining           0.000000000000 Eh    ::
         :::::::::::::::::::::::::::::::::::::::::::::::::::::

      ----------------------------------------------------------- 
     |                   =====================                   |
     |                        A N C O P T                        |
     |                   =====================                   |
     |               Approximate Normal Coordinate               |
     |                Rational Function Optimizer                |
      ----------------------------------------------------------- 

          ...................................................
          :                      SETUP                      :
          :.................................................:
          :   optimization level            normal          :
          :   max. optcycles                   200          :
          :   ANC micro-cycles                  20          :
          :   degrees of freedom                78          :
          :.................................................:
          :   RF solver                   davidson          :
          :   input Hessian                  false          :
          :   write xtbopt.log                true          :
          :   linear?                        false          :
          :   energy convergence         0.5000000E-05 Eh   :
          :   grad. convergence          0.1000000E-02 Eh/α :
          :   maximium RF displ.         2.0000000          :
          :   Hlow (freq-cutoff)         0.5000000E-02      :
          :   Hmax (freq-cutoff)         5.0000000          :
          :   S6 in model hess.         20.0000000          :
          ...................................................

generating ANC from model Hessian ...
Using Lindh-Hessian (1995)
 Shifting diagonal of input Hessian by   4.125447228812161E-003
 Lowest  eigenvalues of input Hessian
   -0.000000   -0.000000   -0.000000    0.000000    0.000000    0.000000
    0.005000    0.005763    0.006616    0.007029    0.007678    0.008815
    0.009332    0.012061    0.013474    0.015388    0.020351    0.022987
 Highest eigenvalues
    1.532892    1.601120    1.759796    1.816070    1.975176    2.420527
 

........................................................................
.............................. CYCLE    1 ..............................
........................................................................
   1    -43.0839901 -0.430840E+02  0.181E-04    3.09       0.0  T
   2    -43.0839901 -0.321663E-10  0.129E-04    3.09     146.8  T
   3    -43.0839901 -0.954259E-10  0.948E-05    3.09     199.2  T
     SCC iter.                  ...        0 min,  0.005 sec
     gradient                   ...        0 min,  0.018 sec
 * total energy  :   -42.4848418 Eh     change        0.4578809E-07 Eh
   gradient norm :     0.0824272 Eh/α   predicted     0.0000000E+00 (-100.00%)
   displ. norm   :     0.2901309 α      lambda       -0.1027907E-01
   maximum displ.:     0.1119819 α      in ANC's #20, #9, #32, ...

........................................................................
.............................. CYCLE    2 ..............................
........................................................................
   1    -43.1257824 -0.431258E+02  0.261E-01    3.15       0.0  T
   2    -43.1258193 -0.368860E-04  0.148E-01    3.15       1.0  T
   3    -43.1256690  0.150247E-03  0.103E-01    3.15       1.0  T
   4    -43.1259100 -0.241016E-03  0.225E-02    3.15       1.0  T
   5    -43.1259124 -0.236960E-05  0.110E-02    3.15       1.7  T
   6    -43.1259140 -0.154679E-05  0.349E-03    3.15       5.4  T
   7    -43.1259142 -0.219426E-06  0.123E-03    3.15      15.4  T
     SCC iter.                  ...        0 min,  0.010 sec
     gradient                   ...        0 min,  0.018 sec
 * total energy  :   -42.4910698 Eh     change       -0.6227992E-02 Eh
   gradient norm :     0.0297038 Eh/α   predicted    -0.5572167E-02 ( -10.53%)
   displ. norm   :     0.2684466 α      lambda       -0.2221651E-02
   maximum displ.:     0.1816583 α      in ANC's #8, #9, #4, ...

........................................................................
.............................. CYCLE    3 ..............................
........................................................................
   1    -43.1338858 -0.431339E+02  0.263E-01    3.18       0.0  T
   2    -43.1339159 -0.300817E-04  0.146E-01    3.19       1.0  T
   3    -43.1337770  0.138916E-03  0.779E-02    3.18       1.0  T
   4    -43.1339477 -0.170699E-03  0.147E-02    3.19       1.3  T
   5    -43.1339488 -0.111869E-05  0.733E-03    3.19       2.6  T
   6    -43.1339498 -0.981988E-06  0.219E-03    3.19       8.6  T
   7    -43.1339498 -0.288447E-07  0.103E-03    3.19      18.3  T
     SCC iter.                  ...        0 min,  0.010 sec
     gradient                   ...        0 min,  0.017 sec
 * total energy  :   -42.4919728 Eh     change       -0.9030541E-03 Eh
   gradient norm :     0.0103571 Eh/α   predicted    -0.1190878E-02 (  31.87%)
   displ. norm   :     0.2440067 α      lambda       -0.1265335E-02
   maximum displ.:     0.1192889 α      in ANC's #4, #8, #16, ...

........................................................................
.............................. CYCLE    4 ..............................
........................................................................
   1    -43.1336290 -0.431336E+02  0.292E-01    3.19       0.0  T
   2    -43.1336621 -0.331570E-04  0.161E-01    3.19       1.0  T
   3    -43.1336187  0.434858E-04  0.468E-02    3.19       1.0  T
   4    -43.1336794 -0.607111E-04  0.902E-03    3.19       2.1  T
   5    -43.1336800 -0.638882E-06  0.443E-03    3.19       4.3  T
   6    -43.1336803 -0.254990E-06  0.176E-03    3.19      10.8  T
   7    -43.1336803 -0.248769E-07  0.783E-04    3.19      24.1  T
     SCC iter.                  ...        0 min,  0.010 sec
     gradient                   ...        0 min,  0.017 sec
 * total energy  :   -42.4922507 Eh     change       -0.2778489E-03 Eh
   gradient norm :     0.0186343 Eh/α   predicted    -0.6703585E-03 ( 141.27%)
   displ. norm   :     0.1130188 α      lambda       -0.6714579E-03
   maximum displ.:     0.0723878 α      in ANC's #8, #11, #5, ...

........................................................................
.............................. CYCLE    5 ..............................
........................................................................
   1    -43.1331363 -0.431331E+02  0.115E-01    3.19       0.0  T
   2    -43.1331426 -0.624364E-05  0.642E-02    3.19       1.0  T
   3    -43.1331186  0.239483E-04  0.313E-02    3.19       1.0  T
   4    -43.1331480 -0.293341E-04  0.549E-03    3.19       3.4  T
   5    -43.1331482 -0.210818E-06  0.291E-03    3.19       6.5  T
   6    -43.1331483 -0.112493E-06  0.917E-04    3.19      20.6  T
     SCC iter.                  ...        0 min,  0.008 sec
     gradient                   ...        0 min,  0.017 sec
 * total energy  :   -42.4926720 Eh     change       -0.4213595E-03 Eh
   gradient norm :     0.0037657 Eh/α   predicted    -0.3400178E-03 ( -19.30%)
   displ. norm   :     0.2225542 α      lambda       -0.3332710E-03
   maximum displ.:     0.1491822 α      in ANC's #8, #2, #3, ...

........................................................................
.............................. CYCLE    6 ..............................
........................................................................
   1    -43.1299440 -0.431299E+02  0.128E-01    3.19       0.0  T
   2    -43.1299478 -0.378796E-05  0.713E-02    3.19       1.0  T
   3    -43.1299319  0.158404E-04  0.270E-02    3.19       1.0  T
   4    -43.1299508 -0.188376E-04  0.558E-03    3.19       3.4  T
   5    -43.1299507  0.266970E-07  0.273E-03    3.19       6.9  T
   6    -43.1299509 -0.149973E-06  0.657E-04    3.19      28.8  T
   7    -43.1299509 -0.294364E-08  0.337E-04    3.19      56.0  T
     SCC iter.                  ...        0 min,  0.010 sec
     gradient                   ...        0 min,  0.018 sec
 * total energy  :   -42.4929287 Eh     change       -0.2566408E-03 Eh
   gradient norm :     0.0046848 Eh/α   predicted    -0.1748946E-03 ( -31.85%)
   displ. norm   :     0.3866446 α      lambda       -0.4034689E-03
   maximum displ.:     0.2383764 α      in ANC's #8, #2, #3, ...

........................................................................
.............................. CYCLE    7 ..............................
........................................................................
   1    -43.1274719 -0.431275E+02  0.214E-01    3.19       0.0  T
   2    -43.1274817 -0.983560E-05  0.119E-01    3.19       1.0  T
   3    -43.1274649  0.168029E-04  0.306E-02    3.19       1.0  T
   4    -43.1274867 -0.218326E-04  0.860E-03    3.19       2.2  T
   5    -43.1274869 -0.196784E-06  0.316E-03    3.19       6.0  T
   6    -43.1274871 -0.175914E-06  0.107E-03    3.19      17.7  T
   7    -43.1274871 -0.761496E-08  0.539E-04    3.19      35.1  T
     SCC iter.                  ...        0 min,  0.010 sec
     gradient                   ...        0 min,  0.017 sec
 * total energy  :   -42.4932123 Eh     change       -0.2836668E-03 Eh
   gradient norm :     0.0083337 Eh/α   predicted    -0.2318946E-03 ( -18.25%)
   displ. norm   :     0.2983415 α      lambda       -0.2923518E-03
   maximum displ.:     0.1619215 α      in ANC's #2, #8, #3, ...

........................................................................
.............................. CYCLE    8 ..............................
........................................................................
   1    -43.1285606 -0.431286E+02  0.172E-01    3.19       0.0  T
   2    -43.1285674 -0.679253E-05  0.953E-02    3.19       1.0  T
   3    -43.1285664  0.101907E-05  0.145E-02    3.19       1.3  T
   4    -43.1285696 -0.316005E-05  0.716E-03    3.19       2.6  T
   5    -43.1285701 -0.576264E-06  0.183E-03    3.19      10.3  T
   6    -43.1285702 -0.383509E-07  0.820E-04    3.19      23.1  T
     SCC iter.                  ...        0 min,  0.009 sec
     gradient                   ...        0 min,  0.017 sec
 * total energy  :   -42.4934440 Eh     change       -0.2316825E-03 Eh
   gradient norm :     0.0079850 Eh/α   predicted    -0.1591872E-03 ( -31.29%)
   displ. norm   :     0.3073262 α      lambda       -0.3546966E-03
   maximum displ.:     0.1900694 α      in ANC's #2, #3, #8, ...

........................................................................
.............................. CYCLE    9 ..............................
........................................................................
   1    -43.1332529 -0.431333E+02  0.173E-01    3.18       0.0  T
   2    -43.1332603 -0.745239E-05  0.966E-02    3.18       1.0  T
   3    -43.1332608 -0.479190E-06  0.124E-02    3.18       1.5  T
   4    -43.1332622 -0.136807E-05  0.779E-03    3.18       2.4  T
   5    -43.1332630 -0.843010E-06  0.187E-03    3.18      10.1  T
   6    -43.1332630 -0.369438E-07  0.787E-04    3.18      24.0  T
     SCC iter.                  ...        0 min,  0.009 sec
     gradient                   ...        0 min,  0.018 sec
 * total energy  :   -42.4937075 Eh     change       -0.2635001E-03 Eh
   gradient norm :     0.0039360 Eh/α   predicted    -0.1940996E-03 ( -26.34%)
   displ. norm   :     0.4009799 α      lambda       -0.2861541E-03
   maximum displ.:     0.2614840 α      in ANC's #2, #3, #8, ...

........................................................................
.............................. CYCLE   10 ..............................
........................................................................
   1    -43.1321199 -0.431321E+02  0.227E-01    3.18       0.0  T
   2    -43.1321322 -0.122290E-04  0.126E-01    3.18       1.0  T
   3    -43.1321340 -0.178450E-05  0.164E-02    3.18       1.2  T
   4    -43.1321344 -0.406777E-06  0.116E-02    3.18       1.6  T
   5    -43.1321367 -0.234503E-05  0.192E-03    3.18       9.8  T
   6    -43.1321367 -0.216691E-07  0.102E-03    3.18      18.6  T
   7    -43.1321367 -0.248554E-08  0.508E-04    3.18      37.2  T
   8    -43.1321367 -0.271568E-08  0.182E-04    3.18     103.6  T
     SCC iter.                  ...        0 min,  0.011 sec
     gradient                   ...        0 min,  0.019 sec
 * total energy  :   -42.4939127 Eh     change       -0.2052260E-03 Eh
   gradient norm :     0.0092714 Eh/α   predicted    -0.1660829E-03 ( -19.07%)
   displ. norm   :     0.4046222 α      lambda       -0.3011065E-03
   maximum displ.:     0.2875068 α      in ANC's #2, #3, #1, ...

........................................................................
.............................. CYCLE   11 ..............................
........................................................................
   1    -43.1351347 -0.431351E+02  0.211E-01    3.17       0.0  T
   2    -43.1351455 -0.107266E-04  0.118E-01    3.17       1.0  T
   3    -43.1351472 -0.179625E-05  0.167E-02    3.17       1.1  T
   4    -43.1351468  0.417396E-06  0.110E-02    3.17       1.7  T
   5    -43.1351488 -0.194810E-05  0.266E-03    3.17       7.1  T
   6    -43.1351489 -0.871393E-07  0.112E-03    3.17      16.9  T
     SCC iter.                  ...        0 min,  0.008 sec
     gradient                   ...        0 min,  0.018 sec
 * total energy  :   -42.4941212 Eh     change       -0.2084862E-03 Eh
   gradient norm :     0.0055398 Eh/α   predicted    -0.1752071E-03 ( -15.96%)
   displ. norm   :     0.4269587 α      lambda       -0.2296560E-03
   maximum displ.:     0.3262219 α      in ANC's #2, #3, #1, ...

........................................................................
.............................. CYCLE   12 ..............................
........................................................................
   1    -43.1315948 -0.431316E+02  0.225E-01    3.17       0.0  T
   2    -43.1316054 -0.106205E-04  0.127E-01    3.17       1.0  T
   3    -43.1315966  0.885070E-05  0.261E-02    3.17       1.0  T
   4    -43.1316098 -0.131992E-04  0.110E-02    3.17       1.7  T
   5    -43.1316107 -0.929277E-06  0.234E-03    3.17       8.1  T
   6    -43.1316107 -0.363089E-07  0.138E-03    3.17      13.7  T
     SCC iter.                  ...        0 min,  0.008 sec
     gradient                   ...        0 min,  0.018 sec
 * total energy  :   -42.4942330 Eh     change       -0.1117412E-03 Eh
   gradient norm :     0.0129236 Eh/α   predicted    -0.1357658E-03 (  21.50%)
   displ. norm   :     0.2247636 α      lambda       -0.2697652E-03
   maximum displ.:     0.1593307 α      in ANC's #2, #1, #4, ...

........................................................................
.............................. CYCLE   13 ..............................
........................................................................
   1    -43.1365873 -0.431366E+02  0.116E-01    3.18       0.0  T
   2    -43.1365899 -0.252279E-05  0.692E-02    3.18       1.0  T
   3    -43.1365683  0.215929E-04  0.329E-02    3.18       1.0  T
   4    -43.1365928 -0.245006E-04  0.654E-03    3.18       2.9  T
   5    -43.1365929 -0.142110E-06  0.245E-03    3.18       7.7  T
   6    -43.1365930 -0.813612E-07  0.919E-04    3.18      20.6  T
     SCC iter.                  ...        0 min,  0.009 sec
     gradient                   ...        0 min,  0.018 sec
 * total energy  :   -42.4943629 Eh     change       -0.1299189E-03 Eh
   gradient norm :     0.0071544 Eh/α   predicted    -0.1416983E-03 (   9.07%)
   displ. norm   :     0.2227268 α      lambda       -0.1375784E-03
   maximum displ.:     0.1711878 α      in ANC's #2, #1, #3, ...

........................................................................
.............................. CYCLE   14 ..............................
........................................................................
   1    -43.1343347 -0.431343E+02  0.110E-01    3.18       0.0  T
   2    -43.1343373 -0.256495E-05  0.634E-02    3.18       1.0  T
   3    -43.1343335  0.373234E-05  0.153E-02    3.18       1.2  T
   4    -43.1343384 -0.486625E-05  0.526E-03    3.18       3.6  T
   5    -43.1343386 -0.164510E-06  0.175E-03    3.18      10.8  T
   6    -43.1343386 -0.311928E-07  0.766E-04    3.18      24.7  T
     SCC iter.                  ...        0 min,  0.008 sec
     gradient                   ...        0 min,  0.018 sec
 * total energy  :   -42.4944422 Eh     change       -0.7929068E-04 Eh
   gradient norm :     0.0046503 Eh/α   predicted    -0.7220570E-04 (  -8.94%)
   displ. norm   :     0.1347531 α      lambda       -0.9405462E-04
   maximum displ.:     0.1009426 α      in ANC's #2, #1, #6, ...

........................................................................
.............................. CYCLE   15 ..............................
........................................................................
   1    -43.1340093 -0.431340E+02  0.820E-02    3.19       0.0  T
   2    -43.1340114 -0.206565E-05  0.474E-02    3.19       1.0  T
   3    -43.1340118 -0.434329E-06  0.626E-03    3.19       3.0  T
   4    -43.1340119 -0.102625E-06  0.285E-03    3.19       6.6  T
   5    -43.1340119 -0.334435E-07  0.101E-03    3.19      18.8  T
     SCC iter.                  ...        0 min,  0.007 sec
     gradient                   ...        0 min,  0.018 sec
 * total energy  :   -42.4944990 Eh     change       -0.5677158E-04 Eh
   gradient norm :     0.0055638 Eh/α   predicted    -0.4788947E-04 ( -15.65%)
   displ. norm   :     0.0918565 α      lambda       -0.4338879E-04
   maximum displ.:     0.0642001 α      in ANC's #2, #1, #12, ...

........................................................................
.............................. CYCLE   16 ..............................
........................................................................
   1    -43.1338022 -0.431338E+02  0.604E-02    3.19       0.0  T
   2    -43.1338033 -0.104794E-05  0.347E-02    3.19       1.0  T
   3    -43.1338023  0.949513E-06  0.891E-03    3.19       2.1  T
   4    -43.1338034 -0.108199E-05  0.465E-03    3.19       4.1  T
   5    -43.1338037 -0.258318E-06  0.110E-03    3.19      17.2  T
   6    -43.1338037 -0.939237E-08  0.438E-04    3.19      43.1  T
     SCC iter.                  ...        0 min,  0.008 sec
     gradient                   ...        0 min,  0.017 sec
 * total energy  :   -42.4945210 Eh     change       -0.2207168E-04 Eh
   gradient norm :     0.0039992 Eh/α   predicted    -0.2187835E-04 (  -0.88%)
   displ. norm   :     0.0736817 α      lambda       -0.2733505E-04
   maximum displ.:     0.0416203 α      in ANC's #2, #6, #1, ...

........................................................................
.............................. CYCLE   17 ..............................
........................................................................
   1    -43.1345265 -0.431345E+02  0.438E-02    3.19       0.0  T
   2    -43.1345269 -0.434884E-06  0.245E-02    3.19       1.0  T
   3    -43.1345269  0.224811E-07  0.445E-03    3.19       4.2  T
   4    -43.1345270 -0.601616E-07  0.281E-03    3.19       6.7  T
   5    -43.1345271 -0.104899E-06  0.395E-04    3.19      47.8  T
   6    -43.1345271 -0.113209E-08  0.229E-04    3.19      82.5  T
     SCC iter.                  ...        0 min,  0.009 sec
     gradient                   ...        0 min,  0.018 sec
 * total energy  :   -42.4945345 Eh     change       -0.1348869E-04 Eh
   gradient norm :     0.0028346 Eh/α   predicted    -0.1374263E-04 (   1.88%)
   displ. norm   :     0.0953552 α      lambda       -0.1935639E-04
   maximum displ.:     0.0767182 α      in ANC's #2, #1, #8, ...

........................................................................
.............................. CYCLE   18 ..............................
........................................................................
   1    -43.1335821 -0.431336E+02  0.527E-02    3.19       0.0  T
   2    -43.1335827 -0.627320E-06  0.302E-02    3.19       1.0  T
   3    -43.1335811  0.160313E-05  0.961E-03    3.19       2.0  T
   4    -43.1335831 -0.198865E-05  0.261E-03    3.19       7.2  T
   5    -43.1335831 -0.101057E-07  0.109E-03    3.19      17.3  T
   6    -43.1335831 -0.203906E-07  0.394E-04    3.19      48.0  T
   7    -43.1335831 -0.129415E-08  0.196E-04    3.19      96.6  T
     SCC iter.                  ...        0 min,  0.010 sec
     gradient                   ...        0 min,  0.018 sec
 * total energy  :   -42.4945418 Eh     change       -0.7305121E-05 Eh
   gradient norm :     0.0027001 Eh/α   predicted    -0.9768461E-05 (  33.72%)
   displ. norm   :     0.0498089 α      lambda       -0.1425313E-04
   maximum displ.:     0.0307672 α      in ANC's #2, #3, #4, ...

........................................................................
.............................. CYCLE   19 ..............................
........................................................................
   1    -43.1343526 -0.431344E+02  0.256E-02    3.19       0.0  T
   2    -43.1343527 -0.159829E-06  0.150E-02    3.19       1.3  T
   3    -43.1343525  0.273365E-06  0.437E-03    3.19       4.3  T
   4    -43.1343528 -0.341537E-06  0.164E-03    3.19      11.5  T
   5    -43.1343528 -0.154691E-07  0.621E-04    3.19      30.5  T
   6    -43.1343528 -0.597693E-08  0.272E-04    3.19      69.5  T
     SCC iter.                  ...        0 min,  0.009 sec
     gradient                   ...        0 min,  0.018 sec
 * total energy  :   -42.4945502 Eh     change       -0.8365911E-05 Eh
   gradient norm :     0.0014478 Eh/α   predicted    -0.7144834E-05 ( -14.60%)
   displ. norm   :     0.0458398 α      lambda       -0.6210339E-05
   maximum displ.:     0.0228860 α      in ANC's #2, #1, #4, ...

........................................................................
.............................. CYCLE   20 ..............................
........................................................................
   1    -43.1343803 -0.431344E+02  0.284E-02    3.19       0.0  T
   2    -43.1343806 -0.270291E-06  0.158E-02    3.19       1.2  T
   3    -43.1343802  0.316465E-06  0.427E-03    3.19       4.4  T
   4    -43.1343807 -0.448003E-06  0.119E-03    3.19      15.8  T
   5    -43.1343807 -0.546915E-08  0.346E-04    3.19      54.6  T
   6    -43.1343807 -0.772935E-09  0.148E-04    3.19     127.8  T
     SCC iter.                  ...        0 min,  0.009 sec
     gradient                   ...        0 min,  0.018 sec
 * total energy  :   -42.4945551 Eh     change       -0.4903081E-05 Eh
   gradient norm :     0.0016575 Eh/α   predicted    -0.3110679E-05 ( -36.56%)
   displ. norm   :     0.0314813 α      lambda       -0.4106117E-05
   maximum displ.:     0.0179482 α      in ANC's #1, #2, #4, ...
 * RMSD in coord.:     0.6196173 α      energy gain  -0.9713268E-02 Eh

generating ANC from model Hessian ...
Using Lindh-Hessian (1995)
 Shifting diagonal of input Hessian by   4.005307783783977E-003
 Lowest  eigenvalues of input Hessian
   -0.000000   -0.000000    0.000000    0.000000    0.000000    0.000000
    0.005000    0.005887    0.006896    0.007607    0.008321    0.009197
    0.009604    0.013347    0.014216    0.015707    0.021739    0.024319
 Highest eigenvalues
    1.565654    1.668251    1.828238    1.878445    2.009142    2.556839
 

........................................................................
.............................. CYCLE   21 ..............................
........................................................................
   1    -43.1347984 -0.431348E+02  0.191E-02    3.20       0.0  T
   2    -43.1347985 -0.139068E-06  0.107E-02    3.20       1.8  T
   3    -43.1347984  0.164538E-06  0.304E-03    3.20       6.2  T
   4    -43.1347986 -0.222000E-06  0.864E-04    3.20      21.9  T
   5    -43.1347986 -0.337490E-08  0.339E-04    3.20      55.8  T
     SCC iter.                  ...        0 min,  0.007 sec
     gradient                   ...        0 min,  0.018 sec
 * total energy  :   -42.4945579 Eh     change       -0.2858572E-05 Eh
   gradient norm :     0.0006205 Eh/α   predicted     0.0000000E+00 (-100.00%)
   displ. norm   :     0.0015527 α      lambda       -0.3232340E-06
   maximum displ.:     0.0012426 α      in ANC's #1, #78, #66, ...

   *** GEOMETRY OPTIMIZATION CONVERGED AFTER 21 ITERATIONS ***

------------------------------------------------------------------------
 total energy gain   :        -0.0097161 Eh       -6.0970 kcal/mol
 total RMSD          :         0.6196173 a0        0.3279 Å
 total power (kW/mol):        -1.2147469 (step)  -30.1594 (real)
------------------------------------------------------------------------

 ANCopt (total)                0 d,  0 h,  0 min,  0.846 sec
 optimizer setup                ...        0 min,  0.000 sec (  0.019%)
 model hessian                  ...        0 min,  0.025 sec (  2.907%)
 ANC generation                 ...        0 min,  0.002 sec (  0.197%)
 coordinate transformation      ...        0 min,  0.000 sec (  0.050%)
 single point calculation       ...        0 min,  0.810 sec ( 95.708%)
 optimization log               ...        0 min,  0.002 sec (  0.280%)
 hessian update                 ...        0 min,  0.000 sec (  0.036%)
 rational function              ...        0 min,  0.005 sec (  0.641%)

================
 final structure:
================
$coord
    2.94996575317339   -2.75591588131324   -0.32723248313401      C 
    4.97657928602344   -0.35823000573922    0.46449819764837      S 
    2.50810801351724    1.83021479718577    0.49311449417674      C 
    0.24424630535449    0.68249868122852   -0.04148785326607      C 
    0.51732925377011   -1.94946026410422   -0.51398564250127      C 
   -1.64512074954773   -3.61282032738357   -1.32464876225536      C 
   -1.40604239330396   -3.98402869113571   -4.02584264131879      C 
   -1.20470197811705   -4.24384484748948   -6.16079649094995      N 
   -4.20826313540867   -2.39932873482736   -0.72109286677836      C 
   -4.20795386746555    0.37354379236672   -1.50446494176243      C 
   -2.34882426726891    1.84739711843366    0.14886636029112      C 
   -3.28091705480124    1.69154745162666    2.66956902275950      O 
   -2.17308681940600    3.37617786799879    4.38513936980205      C 
    3.18338582401352    4.43599874099798    0.99759810376786      C 
    2.15336814633972    6.46949929043198   -0.04920764165793      C 
    3.67432449872175   -4.62412712469553   -0.62884140387960      H 
   -1.49271635613446   -5.47414018336054   -0.42482394219675      H 
   -4.54935530098366   -2.50451345750436    1.30818102385968      H 
   -5.70610909378694   -3.42356829254407   -1.70174453253086      H 
   -6.08976161123292    1.16998844954351   -1.24526409754490      H 
   -3.66878277548675    0.56511061996763   -3.48695770913132      H 
   -2.30888911295567    3.84080541530244   -0.42768266957264      H 
   -3.18713706807196    3.13354775656997    6.15896209575309      H 
   -2.35998736646810    5.33812390525823    3.74189492205677      H 
   -0.16441054035182    2.96956195687027    4.68428832682959      H 
    4.76799620089194    4.65934563687363    2.27577523540728      H 
    0.65688333508233    6.35804717558984   -1.42158664507173      H 
    2.81439257983372    8.33544089206729    0.41591566054405      H 
$end
           -------------------------------------------------
          |                Final Singlepoint                |
           -------------------------------------------------

          ...................................................
          :                      SETUP                      :
          :.................................................:
          :  # basis functions                  79          :
          :  # atomic orbitals                  78          :
          :  # shells                           44          :
          :  # electrons                        78          :
          :  max. iterations                   250          :
          :  Hamiltonian                  GFN2-xTB          :
          :  restarted?                      false          :
          :  GBSA solvation                  false          :
          :  PC potential                    false          :
          :  electronic temp.          300.0000000     K    :
          :  accuracy                    1.0000000          :
          :  -> integral cutoff          0.2500000E+02      :
          :  -> integral neglect         0.1000000E-07      :
          :  -> SCF convergence          0.1000000E-05 Eh   :
          :  -> wf. convergence          0.1000000E-03 e    :
          :  Broyden damping             0.4000000          :
          ...................................................

 iter      E             dE          RMSdq      gap      omega  full diag
   1    -43.1347986 -0.431348E+02  0.179E-04    3.20       0.0  T
   2    -43.1347986  0.137419E-10  0.144E-04    3.20     131.4  T
   3    -43.1347986 -0.537490E-09  0.393E-05    3.20     480.9  T

   *** convergence criteria satisfied after 3 iterations ***

         #    Occupation            Energy/Eh            Energy/eV
      -------------------------------------------------------------
         1        2.0000           -0.7389346             -20.1074
       ...           ...                  ...                  ...
        33        2.0000           -0.4457873             -12.1305
        34        2.0000           -0.4414456             -12.0123
        35        2.0000           -0.4331523             -11.7867
        36        2.0000           -0.4252771             -11.5724
        37        2.0000           -0.4066873             -11.0665
        38        2.0000           -0.4006223             -10.9015
        39        2.0000           -0.3874926             -10.5442 (HOMO)
        40                         -0.2700763              -7.3492 (LUMO)
        41                         -0.2223252              -6.0498
        42                         -0.2145465              -5.8381
        43                         -0.2071708              -5.6374
        44                         -0.1955078              -5.3200
       ...                                ...                  ...
        78                          1.1381996              30.9720
      -------------------------------------------------------------
                  HL-Gap            0.1174163 Eh            3.1951 eV
             Fermi-level           -0.3287844 Eh           -8.9467 eV

 SCC (total)                   0 d,  0 h,  0 min,  0.035 sec
 SCC setup                      ...        0 min,  0.000 sec (  0.656%)
 Dispersion                     ...        0 min,  0.000 sec (  0.721%)
 integral evaluation            ...        0 min,  0.011 sec ( 31.348%)
 zeroth order Hamiltonian       ...        0 min,  0.000 sec (  0.591%)
 iterations                     ...        0 min,  0.005 sec ( 14.085%)
 molecular gradient             ...        0 min,  0.018 sec ( 51.276%)
 printout                       ...        0 min,  0.000 sec (  1.180%)

         :::::::::::::::::::::::::::::::::::::::::::::::::::::
         ::                     SUMMARY                     ::
         :::::::::::::::::::::::::::::::::::::::::::::::::::::
         :: total energy             -42.494557956090 Eh    ::
         :: gradient norm              0.000620962386 Eh/a0 ::
         :: HOMO-LUMO gap              3.195059245153 eV    ::
         ::.................................................::
         :: SCC energy               -43.134798580577 Eh    ::
         :: -> isotropic ES            0.027960265988 Eh    ::
         :: -> anisotropic ES          0.003958762937 Eh    ::
         :: -> anisotropic XC          0.029915261710 Eh    ::
         :: -> dispersion             -0.031377654895 Eh    ::
         :: repulsion energy           0.639791884384 Eh    ::
         :: add. restraining           0.000000000000 Eh    ::
         :::::::::::::::::::::::::::::::::::::::::::::::::::::

           -------------------------------------------------
          |                Property Printout                |
           -------------------------------------------------

    * Orbital Energies and Occupations

         #    Occupation            Energy/Eh            Energy/eV
      -------------------------------------------------------------
         1        2.0000           -0.7389346             -20.1074
       ...           ...                  ...                  ...
        27        2.0000           -0.4755403             -12.9401
        28        2.0000           -0.4744839             -12.9114
        29        2.0000           -0.4720521             -12.8452
        30        2.0000           -0.4584869             -12.4761
        31        2.0000           -0.4567232             -12.4281
        32        2.0000           -0.4544107             -12.3651
        33        2.0000           -0.4457873             -12.1305
        34        2.0000           -0.4414456             -12.0123
        35        2.0000           -0.4331523             -11.7867
        36        2.0000           -0.4252771             -11.5724
        37        2.0000           -0.4066873             -11.0665
        38        2.0000           -0.4006223             -10.9015
        39        2.0000           -0.3874926             -10.5442 (HOMO)
        40                         -0.2700763              -7.3492 (LUMO)
        41                         -0.2223252              -6.0498
        42                         -0.2145465              -5.8381
        43                         -0.2071708              -5.6374
        44                         -0.1955078              -5.3200
        45                         -0.1684005              -4.5824
        46                         -0.1210223              -3.2932
        47                         -0.0110405              -0.3004
        48                          0.0161098               0.4384
        49                          0.0240478               0.6544
        50                          0.0296078               0.8057
       ...                                ...                  ...
        78                          1.1381996              30.9720
      -------------------------------------------------------------
                  HL-Gap            0.1174163 Eh            3.1951 eV
             Fermi-level           -0.3287844 Eh           -8.9467 eV

     #   Z        covCN         q      C6AA      α(0)
     1   6 C      2.933    -0.031    28.774     8.797
     2  16 S      2.340    -0.028   142.199    20.070
     3   6 C      2.988     0.017    27.632     8.623
     4   6 C      3.148    -0.026    28.385     8.716
     5   6 C      3.189     0.000    27.534     8.560
     6   6 C      3.861    -0.006    20.654     6.463
     7   6 C      1.922     0.116    28.247     8.583
     8   7 N      0.911    -0.239    26.245     7.409
     9   6 C      3.815    -0.050    21.450     6.592
    10   6 C      3.808    -0.058    21.611     6.618
    11   6 C      3.750     0.120    18.681     6.164
    12   8 O      1.701    -0.316    19.278     5.928
    13   6 C      3.643     0.045    20.155     6.454
    14   6 C      2.936    -0.028    28.710     8.788
    15   6 C      2.838    -0.087    30.178     9.003
    16   1 H      0.926     0.045     2.382     2.414
    17   1 H      0.924     0.063     2.164     2.301
    18   1 H      0.924     0.063     2.159     2.298
    19   1 H      0.924     0.041     2.430     2.438
    20   1 H      0.925     0.051     2.302     2.373
    21   1 H      0.924     0.043     2.408     2.427
    22   1 H      0.923     0.020     2.736     2.587
    23   1 H      0.925     0.058     2.222     2.331
    24   1 H      0.924     0.025     2.652     2.547
    25   1 H      0.924     0.027     2.625     2.534
    26   1 H      0.925     0.046     2.364     2.405
    27   1 H      0.926     0.041     2.431     2.438
    28   1 H      0.926     0.046     2.367     2.406

 Mol. C6AA /au·bohr⁶  :      10275.278630
 Mol. C8AA /au·bohr⁸  :     269189.799335
 Mol. α(0) /au        :        158.262525


Wiberg/Mayer (AO) data.
largest (>0.10) Wiberg bond orders for each atom
          total WBO             WBO to atom ...
     1  C   3.948        C    5 1.589    S    2 1.194    H   16 0.970    C    3 0.102
     2  S   2.619        C    1 1.194    C    3 1.132
     3  C   3.949        C    4 1.527    S    2 1.132    C   14 1.102    C    1 0.102
     4  C   3.981        C    3 1.527    C    5 1.236    C   11 0.980
     5  C   3.982        C    1 1.589    C    4 1.236    C    6 0.966
     6  C   3.995        C    7 1.023    C    9 0.967    C    5 0.966    H   17 0.933
     7  C   3.941        N    8 2.848    C    6 1.023
     8  N   3.010        C    7 2.848
     9  C   3.993        C   10 1.011    H   19 0.976    H   18 0.972    C    6 0.967
    10  C   3.996        C    9 1.011    C   11 0.988    H   21 0.975    H   20 0.974
    11  C   3.955        C   10 0.988    C    4 0.980    O   12 0.957    H   22 0.953
    12  O   2.082        C   13 1.000    C   11 0.957
    13  C   3.955        O   12 1.000    H   23 0.978    H   24 0.976    H   25 0.974
    14  C   3.991        C   15 1.895    C    3 1.102    H   26 0.959
    15  C   3.990        C   14 1.895    H   28 0.976    H   27 0.972
    16  H   0.997        C    1 0.970
    17  H   0.996        C    6 0.933
    18  H   0.996        C    9 0.972
    19  H   0.997        C    9 0.976
    20  H   0.996        C   10 0.974
    21  H   0.998        C   10 0.975
    22  H   0.999        C   11 0.953
    23  H   0.996        C   13 0.978
    24  H   0.999        C   13 0.976
    25  H   0.999        C   13 0.974
    26  H   0.998        C   14 0.959
    27  H   0.998        C   15 0.972
    28  H   0.997        C   15 0.976

molecular dipole:
                 x           y           z       tot (Debye)
 q only:       -0.068       0.501       0.874
   full:       -0.179       0.595       1.223       3.486
molecular quadrupole (traceless):
                xx          xy          yy          xz          yz          zz
 q only:        2.119       0.995       5.494       0.911      -4.355      -7.613
  q+dip:        1.363      -0.127      10.831       1.182      -7.678     -12.194
   full:        1.584       0.246      10.895       0.629      -7.524     -12.479

           -------------------------------------------------
          |                Geometry Summary                 |
           -------------------------------------------------

      molecular mass/u    :      219.3008000
   center of mass at/Å    :        0.0462972       0.0686594      -0.1187066
  moments of inertia/u·Å² :        0.7005637E+03   0.9794109E+03   0.1372010E+04
rotational constants/cm⁻¹ :        0.2406295E-01   0.1721201E-01   0.1228682E-01

 * 25 selected distances

     #   Z        #   Z                                     value/Å
     1   6 C      2  16 S                                 1.7133332
     2  16 S      3   6 C                                 1.7457605 (max)
     3   6 C      4   6 C                                 1.3726130
     1   6 C      5   6 C                                 1.3597866
     4   6 C      5   6 C                                 1.4223982
     7   6 C      8   7 N                                 1.1430805
     6   6 C      9   6 C                                 1.5342984
     9   6 C     10   6 C                                 1.5247739
    10   6 C     11   6 C                                 1.5302385
    11   6 C     12   8 O                                 1.4245613
    12   8 O     13   6 C                                 1.4009161
    14   6 C     15   6 C                                 1.3273664
     1   6 C     16   1 H                                 1.0722699 (min)
     6   6 C     17   1 H                                 1.0969965
     9   6 C     18   1 H                                 1.0903312
     9   6 C     19   1 H                                 1.0914769
    10   6 C     20   1 H                                 1.0899908
    10   6 C     21   1 H                                 1.0919122
    11   6 C     22   1 H                                 1.0983049
    13   6 C     23   1 H                                 1.0888218
    13   6 C     24   1 H                                 1.0970608
    13   6 C     25   1 H                                 1.0959984
    14   6 C     26   1 H                                 1.0837946
    15   6 C     27   1 H                                 1.0761067
    15   6 C     28   1 H                                 1.0760701

 * 5 distinct bonds (by element types)

   Z      Z             #   av. dist./Å        max./Å        min./Å
   1 H    6 C          13     1.0883950     1.0983049     1.0722699
   6 C    6 C           7     1.4387821     1.5342984     1.3273664
   6 C    7 N           1     1.1430805     1.1430805     1.1430805
   6 C    8 O           2     1.4127387     1.4245613     1.4009161
   6 C   16 S           2     1.7295469     1.7457605     1.7133332


optimized geometry written to: xtbopt.xyz


           -------------------------------------------------
          | TOTAL ENERGY              -42.494557956090 Eh   |
          | GRADIENT NORM               0.000620962386 Eh/α |
          | HOMO-LUMO GAP               3.195059245153 eV   |
           -------------------------------------------------

------------------------------------------------------------------------
 * finished run on 2021/05/19 at 10:59:51.725     
------------------------------------------------------------------------
 total:
 * wall-time:     0 d,  0 h,  0 min,  0.970 sec
 *  cpu-time:     0 d,  0 h,  0 min,  0.952 sec
 * ratio c/w:     0.981 speedup
 SCF:
 * wall-time:     0 d,  0 h,  0 min,  0.049 sec
 *  cpu-time:     0 d,  0 h,  0 min,  0.049 sec
 * ratio c/w:     0.998 speedup
 ANC optimizer:
 * wall-time:     0 d,  0 h,  0 min,  0.882 sec
 *  cpu-time:     0 d,  0 h,  0 min,  0.880 sec
 * ratio c/w:     0.998 speedup

