      -----------------------------------------------------------      
     |                   =====================                   |     
     |                           x T B                           |     
     |                   =====================                   |     
     |                         S. Grimme                         |     
     |          Mulliken Center for Theoretical Chemistry        |     
     |                    University of Bonn                     |     
     |                Version 6.2 RC2 (SAW190805)                |     
      -----------------------------------------------------------      

   This program is distributed in the hope that it will be useful,
   but WITHOUT ANY WARRANTY; without even the implied warranty of
   MERCHANTABILITY or FITNESS FOR A PARTICULAR PURPOSE.
   
   FOR NON-COMMERCIAL, ACADEMIA USE ONLY.
   
   Cite this work as:
   * S. Grimme, C. Bannwarth, P. Shushkov, J. Chem. Theory Comput., 2017,
     13, 1989-2009. DOI: 10.1021/acs.jctc.7b00118
   * C. Bannwarth, S. Ehlert and S. Grimme., J. Chem. Theory Comput., 2019,
     15, 1652-1671. DOI: 10.1021/acs.jctc.8b01176
   * P. Pracht, E. Caldeweyher, S. Ehlert, S. Grimme, ChemRxiv, 2019, preprint.
     DOI: 10.26434/chemrxiv.8326202.v1
   
   for DFT-D4:
   * E. Caldeweyher, C. Bannwarth and S. Grimme, J. Chem. Phys., 2017,
     147, 034112. DOI: 10.1063/1.4993215
   * E. Caldeweyher, S. Ehlert, A. Hansen, H. Neugebauer, S. Spicher,
     C. Bannwarth and S. Grimme, J. Chem. Phys., 2019, 150, 154122.
     DOI: 10.1063/1.5090222
   
   for sTDA-xTB:
   * S. Grimme and C. Bannwarth, J. Chem. Phys., 2016, 145, 054103.
     DOI: 10.1063/1.4959605
   
   in the mass-spec context:
   * V. Asgeirsson, C. Bauer and S. Grimme, Chem. Sci., 2017, 8, 4879.
     DOI: 10.1039/c7sc00601b
   
   for metadynamics refer to:
   * S. Grimme, J. Chem. Theory Comput., 2019, 155, 2847-2862
     DOI: 10.1021/acs.jctc.9b00143
   
   with help from (in alphabetical order)
   C. Bannwarth, F. Bohle, G. Brandenburg, E. Caldeweyher, M. Checinski,
   S. Dohm, S. Ehlert, S. Ehrlich, F. März, H. Neugebauer, J. Pisarek,
   P. Pracht, P. Shushkov, and S. Spicher.
   
 * started run on 2021/05/19 at 10:59:56.360     

           -------------------------------------------------
          |                Calculation Setup                |
           -------------------------------------------------

          program call               : /ihome/ghutchison/geoffh/xtb/xtb 577.xyz -opt
          hostname                   : smp-n144
          coordinate file            : 577.xyz
          omp threads                :                     1
          number of atoms            :                    14
          number of electrons        :                    44
          charge                     :                     0
          spin                       :                   0.0
          first test random number   :      0.57252775070484


########################################################################
# WARNING! Please study the warnings concerning your input carefully
#  - the use of '-opt' is discouraged, please use '--opt' next time
########################################################################

           ------------------------------------------------- 
          |                 G F N 2 - x T B                 |
          | Geometry, Frequencies, Noncovalent interactions |
          |            JCTC 2019 parametrisation            |
           ------------------------------------------------- 
             KAB for C  - Si     :                1.0500
             KAB for H  - Pd     :                0.9500
             k(s)              :                1.8500
             k(p)              :                2.2300
             k(d)              :                2.2300
             k(f)              :                2.0000
             kEN (H0ij)        :               -2.0000
             D4 a1             :                0.5200
             D4 a2             :                5.0000
             D4 s6             :                1.0000
             D4 s8             :                2.7000
             D4 s9             :                5.0000
             alphaj            :                2.0000

  Z AO/shell   Hii/eV     exponent
  1     Wed Apr 25 08:07:45 CEST 2018   EN: 2.200 GM2: 0.406  GM3: 0.0800  RAES: 1.40
     1s    -10.707211    1.230000
  6     Wed Apr 25 08:07:45 CEST 2018   EN: 2.550 GM2: 0.538  GM3: 0.1500  RAES: 3.00
     2s    -13.970922    2.096432
     2p    -10.063292    1.800000
  7     Wed Apr 25 08:07:45 CEST 2018   EN: 3.040 GM2: 0.461  GM3:-0.0640  RAES: 1.90
     2s    -16.686243    2.339881
     2p    -12.523956    2.014332
 16     Tue Apr 24 11:44:34 CEST 2018   EN: 2.580 GM2: 0.340  GM3:-0.0502  RAES: 3.10
     3s    -20.029654    1.981333
     3p    -11.377694    2.025643
     3d     -0.420282    1.702555

           ------------------------------------------------- 
          |        Self-Consistent Charge Iterations        |
           ------------------------------------------------- 

          ...................................................
          :                      SETUP                      :
          :.................................................:
          :  # basis functions                  47          :
          :  # atomic orbitals                  46          :
          :  # shells                           24          :
          :  # electrons                        44          :
          :  max. iterations                   250          :
          :  Hamiltonian                  GFN2-xTB          :
          :  restarted?                      false          :
          :  GBSA solvation                  false          :
          :  PC potential                    false          :
          :  electronic temp.          300.0000000     K    :
          :  accuracy                    1.0000000          :
          :  -> integral cutoff          0.2500000E+02      :
          :  -> integral neglect         0.1000000E-07      :
          :  -> SCF convergence          0.1000000E-05 Eh   :
          :  -> wf. convergence          0.1000000E-03 e    :
          :  Broyden damping             0.4000000          :
          ...................................................

 iter      E             dE          RMSdq      gap      omega  full diag
   1    -23.8913129 -0.238913E+02  0.593E+00    1.64       0.0  T
   2    -23.8857853  0.552754E-02  0.383E+00    1.22       1.0  T
   3    -23.7956530  0.901323E-01  0.331E+00    1.32       1.0  T
   4    -23.9236384 -0.127985E+00  0.773E-01    1.10       1.0  T
   5    -23.9266817 -0.304330E-02  0.377E-01    1.07       1.0  T
   6    -23.9278217 -0.114001E-02  0.161E-01    1.09       1.0  T
   7    -23.9279245 -0.102747E-03  0.521E-02    1.09       1.0  T
   8    -23.9279426 -0.181449E-04  0.206E-02    1.09       1.3  T
   9    -23.9279443 -0.172014E-05  0.121E-02    1.09       2.2  T
  10    -23.9279447 -0.317604E-06  0.432E-03    1.09       6.2  T
  11    -23.9279448 -0.138738E-06  0.221E-03    1.09      12.1  T
  12    -23.9279448 -0.186155E-07  0.103E-03    1.09      26.0  T
  13    -23.9279448 -0.349611E-08  0.289E-04    1.09      92.5  T
  14    -23.9279448 -0.125588E-09  0.118E-04    1.09     227.3  T

   *** convergence criteria satisfied after 14 iterations ***

         #    Occupation            Energy/Eh            Energy/eV
      -------------------------------------------------------------
         1        2.0000           -0.7393688             -20.1192
       ...           ...                  ...                  ...
        16        2.0000           -0.4679901             -12.7347
        17        2.0000           -0.4528194             -12.3218
        18        2.0000           -0.4411106             -12.0032
        19        2.0000           -0.4323560             -11.7650
        20        2.0000           -0.4260213             -11.5926
        21        2.0000           -0.3913065             -10.6480
        22        2.0000           -0.3653622              -9.9420 (HOMO)
        23                         -0.3253761              -8.8539 (LUMO)
        24                         -0.2452981              -6.6749
        25                         -0.2377503              -6.4695
        26                         -0.1620692              -4.4101
        27                         -0.1533850              -4.1738
       ...                                ...                  ...
        46                          0.8780811              23.8938
      -------------------------------------------------------------
                  HL-Gap            0.0399861 Eh            1.0881 eV
             Fermi-level           -0.3453691 Eh           -9.3980 eV

 SCC (total)                   0 d,  0 h,  0 min,  0.021 sec
 SCC setup                      ...        0 min,  0.000 sec (  0.912%)
 Dispersion                     ...        0 min,  0.000 sec (  0.709%)
 integral evaluation            ...        0 min,  0.004 sec ( 21.667%)
 zeroth order Hamiltonian       ...        0 min,  0.000 sec (  0.453%)
 iterations                     ...        0 min,  0.009 sec ( 42.971%)
 molecular gradient             ...        0 min,  0.007 sec ( 31.538%)
 printout                       ...        0 min,  0.000 sec (  1.471%)

         :::::::::::::::::::::::::::::::::::::::::::::::::::::
         ::                     SUMMARY                     ::
         :::::::::::::::::::::::::::::::::::::::::::::::::::::
         :: total energy             -23.551683668806 Eh    ::
         :: gradient norm              0.110365005352 Eh/a0 ::
         :: HOMO-LUMO gap              1.088076205585 eV    ::
         ::.................................................::
         :: SCC energy               -23.927944812425 Eh    ::
         :: -> isotropic ES            0.010779592895 Eh    ::
         :: -> anisotropic ES          0.002057196290 Eh    ::
         :: -> anisotropic XC          0.020369572644 Eh    ::
         :: -> dispersion             -0.012119629472 Eh    ::
         :: repulsion energy           0.376275260158 Eh    ::
         :: add. restraining           0.000000000000 Eh    ::
         :::::::::::::::::::::::::::::::::::::::::::::::::::::

      ----------------------------------------------------------- 
     |                   =====================                   |
     |                        A N C O P T                        |
     |                   =====================                   |
     |               Approximate Normal Coordinate               |
     |                Rational Function Optimizer                |
      ----------------------------------------------------------- 

          ...................................................
          :                      SETUP                      :
          :.................................................:
          :   optimization level            normal          :
          :   max. optcycles                   200          :
          :   ANC micro-cycles                  20          :
          :   degrees of freedom                36          :
          :.................................................:
          :   RF solver                   davidson          :
          :   input Hessian                  false          :
          :   write xtbopt.log                true          :
          :   linear?                        false          :
          :   energy convergence         0.5000000E-05 Eh   :
          :   grad. convergence          0.1000000E-02 Eh/α :
          :   maximium RF displ.         2.0000000          :
          :   Hlow (freq-cutoff)         0.5000000E-02      :
          :   Hmax (freq-cutoff)         5.0000000          :
          :   S6 in model hess.         20.0000000          :
          ...................................................

generating ANC from model Hessian ...
Using Lindh-Hessian (1995)
 Shifting diagonal of input Hessian by   1.878195957711637E-003
 Lowest  eigenvalues of input Hessian
   -0.000000   -0.000000   -0.000000   -0.000000    0.000000    0.000000
    0.005000    0.006082    0.010713    0.013441    0.014401    0.031917
    0.042220    0.046752    0.061866    0.067137    0.080121    0.096218
 Highest eigenvalues
    1.546098    1.804964    1.864111    1.899453    2.142714    2.298657
 

........................................................................
.............................. CYCLE    1 ..............................
........................................................................
   1    -23.9279448 -0.239279E+02  0.225E-05    1.09       0.0  T
   2    -23.9279448  0.105516E-11  0.161E-05    1.09    1664.5  T
   3    -23.9279448 -0.110489E-11  0.143E-05    1.09    1871.5  T
     SCC iter.                  ...        0 min,  0.002 sec
     gradient                   ...        0 min,  0.007 sec
 * total energy  :   -23.5516837 Eh     change       -0.4292460E-09 Eh
   gradient norm :     0.1103650 Eh/α   predicted     0.0000000E+00 (-100.00%)
   displ. norm   :     0.2211058 α      lambda       -0.1541374E-01
   maximum displ.:     0.1076609 α      in ANC's #19, #22, #13, ...

........................................................................
.............................. CYCLE    2 ..............................
........................................................................
   1    -23.9314066 -0.239314E+02  0.379E-01    1.15       0.0  T
   2    -23.9313581  0.484663E-04  0.272E-01    1.14       1.0  T
   3    -23.9314637 -0.105620E-03  0.185E-01    1.15       1.0  T
   4    -23.9315636 -0.998161E-04  0.123E-01    1.15       1.0  T
   5    -23.9317312 -0.167636E-03  0.246E-02    1.14       1.1  T
   6    -23.9317330 -0.183749E-05  0.112E-02    1.14       2.4  T
   7    -23.9317333 -0.281535E-06  0.521E-03    1.14       5.1  T
   8    -23.9317335 -0.193128E-06  0.236E-03    1.14      11.3  T
     SCC iter.                  ...        0 min,  0.005 sec
     gradient                   ...        0 min,  0.006 sec
 * total energy  :   -23.5625915 Eh     change       -0.1090786E-01 Eh
   gradient norm :     0.0545942 Eh/α   predicted    -0.8083637E-02 ( -25.89%)
   displ. norm   :     0.2134123 α      lambda       -0.6019708E-02
   maximum displ.:     0.1045071 α      in ANC's #3, #19, #13, ...

........................................................................
.............................. CYCLE    3 ..............................
........................................................................
   1    -23.9316395 -0.239316E+02  0.323E-01    1.18       0.0  T
   2    -23.9315524  0.870529E-04  0.247E-01    1.17       1.0  T
   3    -23.9317077 -0.155322E-03  0.159E-01    1.18       1.0  T
   4    -23.9317427 -0.349521E-04  0.116E-01    1.18       1.0  T
   5    -23.9318978 -0.155082E-03  0.190E-02    1.18       1.4  T
   6    -23.9318984 -0.620354E-06  0.990E-03    1.18       2.7  T
   7    -23.9318988 -0.428475E-06  0.400E-03    1.18       6.7  T
   8    -23.9318989 -0.844826E-07  0.217E-03    1.18      12.3  T
     SCC iter.                  ...        0 min,  0.005 sec
     gradient                   ...        0 min,  0.006 sec
 * total energy  :   -23.5661592 Eh     change       -0.3567681E-02 Eh
   gradient norm :     0.0222134 Eh/α   predicted    -0.3146940E-02 ( -11.79%)
   displ. norm   :     0.1102140 α      lambda       -0.8760019E-03
   maximum displ.:     0.0603693 α      in ANC's #3, #2, #12, ...

........................................................................
.............................. CYCLE    4 ..............................
........................................................................
   1    -23.9312766 -0.239313E+02  0.152E-01    1.18       0.0  T
   2    -23.9312834 -0.676457E-05  0.961E-02    1.18       1.0  T
   3    -23.9312824  0.961327E-06  0.649E-02    1.18       1.0  T
   4    -23.9313091 -0.266757E-04  0.167E-02    1.18       1.6  T
   5    -23.9313103 -0.123947E-05  0.118E-02    1.18       2.3  T
   6    -23.9313117 -0.131957E-05  0.584E-03    1.18       4.6  T
   7    -23.9313119 -0.231872E-06  0.160E-03    1.18      16.8  T
     SCC iter.                  ...        0 min,  0.004 sec
     gradient                   ...        0 min,  0.006 sec
 * total energy  :   -23.5667280 Eh     change       -0.5687585E-03 Eh
   gradient norm :     0.0127685 Eh/α   predicted    -0.4433217E-03 ( -22.05%)
   displ. norm   :     0.1349293 α      lambda       -0.4885404E-03
   maximum displ.:     0.0886452 α      in ANC's #2, #3, #4, ...

........................................................................
.............................. CYCLE    5 ..............................
........................................................................
   1    -23.9313377 -0.239313E+02  0.138E-01    1.18       0.0  T
   2    -23.9313349  0.282864E-05  0.879E-02    1.19       1.0  T
   3    -23.9313155  0.194052E-04  0.784E-02    1.19       1.0  T
   4    -23.9313528 -0.372991E-04  0.311E-02    1.19       1.0  T
   5    -23.9313641 -0.113432E-04  0.919E-03    1.19       2.9  T
   6    -23.9313648 -0.666806E-06  0.341E-03    1.19       7.8  T
   7    -23.9313649 -0.796515E-07  0.136E-03    1.19      19.7  T
   8    -23.9313649 -0.150804E-07  0.604E-04    1.19      44.2  T
     SCC iter.                  ...        0 min,  0.005 sec
     gradient                   ...        0 min,  0.006 sec
 * total energy  :   -23.5669233 Eh     change       -0.1953186E-03 Eh
   gradient norm :     0.0089518 Eh/α   predicted    -0.2487188E-03 (  27.34%)
   displ. norm   :     0.0561508 α      lambda       -0.1848543E-03
   maximum displ.:     0.0354990 α      in ANC's #2, #8, #6, ...

........................................................................
.............................. CYCLE    6 ..............................
........................................................................
   1    -23.9322601 -0.239323E+02  0.976E-02    1.19       0.0  T
   2    -23.9322526  0.752060E-05  0.581E-02    1.19       1.0  T
   3    -23.9322158  0.367552E-04  0.684E-02    1.19       1.0  T
   4    -23.9322677 -0.519016E-04  0.104E-02    1.19       2.6  T
   5    -23.9322683 -0.586162E-06  0.550E-03    1.19       4.9  T
   6    -23.9322684 -0.152016E-06  0.218E-03    1.19      12.2  T
   7    -23.9322685 -0.346228E-07  0.469E-04    1.19      57.0  T
     SCC iter.                  ...        0 min,  0.004 sec
     gradient                   ...        0 min,  0.006 sec
 * total energy  :   -23.5670267 Eh     change       -0.1033890E-03 Eh
   gradient norm :     0.0057215 Eh/α   predicted    -0.9271897E-04 ( -10.32%)
   displ. norm   :     0.0442274 α      lambda       -0.5359350E-04
   maximum displ.:     0.0386228 α      in ANC's #2, #1, #6, ...

........................................................................
.............................. CYCLE    7 ..............................
........................................................................
   1    -23.9326714 -0.239327E+02  0.776E-02    1.19       0.0  T
   2    -23.9326665  0.489284E-05  0.449E-02    1.19       1.0  T
   3    -23.9326477  0.187867E-04  0.516E-02    1.19       1.0  T
   4    -23.9326773 -0.295682E-04  0.850E-03    1.19       3.1  T
   5    -23.9326779 -0.668393E-06  0.363E-03    1.19       7.4  T
   6    -23.9326780 -0.469073E-07  0.174E-03    1.19      15.4  T
   7    -23.9326780 -0.189319E-07  0.475E-04    1.19      56.3  T
     SCC iter.                  ...        0 min,  0.004 sec
     gradient                   ...        0 min,  0.006 sec
 * total energy  :   -23.5670665 Eh     change       -0.3983081E-04 Eh
   gradient norm :     0.0027802 Eh/α   predicted    -0.2684811E-04 ( -32.59%)
   displ. norm   :     0.0700689 α      lambda       -0.4174347E-04
   maximum displ.:     0.0613151 α      in ANC's #2, #1, #4, ...

........................................................................
.............................. CYCLE    8 ..............................
........................................................................
   1    -23.9328200 -0.239328E+02  0.871E-02    1.19       0.0  T
   2    -23.9328119  0.816048E-05  0.546E-02    1.20       1.0  T
   3    -23.9327948  0.171037E-04  0.573E-02    1.20       1.0  T
   4    -23.9328277 -0.329652E-04  0.121E-02    1.20       2.2  T
   5    -23.9328291 -0.139386E-05  0.497E-03    1.20       5.4  T
   6    -23.9328293 -0.136667E-06  0.214E-03    1.20      12.5  T
   7    -23.9328293 -0.285019E-07  0.555E-04    1.20      48.2  T
   8    -23.9328293 -0.300297E-08  0.204E-04    1.20     130.7  T
     SCC iter.                  ...        0 min,  0.005 sec
     gradient                   ...        0 min,  0.007 sec
 * total energy  :   -23.5670916 Eh     change       -0.2514299E-04 Eh
   gradient norm :     0.0021039 Eh/α   predicted    -0.2097525E-04 ( -16.58%)
   displ. norm   :     0.0445690 α      lambda       -0.1432600E-04
   maximum displ.:     0.0384658 α      in ANC's #2, #1, #6, ...

........................................................................
.............................. CYCLE    9 ..............................
........................................................................
   1    -23.9327818 -0.239328E+02  0.845E-02    1.20       0.0  T
   2    -23.9327821 -0.318378E-06  0.403E-02    1.20       1.0  T
   3    -23.9327639  0.182558E-04  0.411E-02    1.20       1.0  T
   4    -23.9327843 -0.203902E-04  0.569E-03    1.20       4.7  T
   5    -23.9327844 -0.113235E-06  0.371E-03    1.20       7.2  T
   6    -23.9327845 -0.930134E-07  0.753E-04    1.20      35.5  T
   7    -23.9327845 -0.409734E-08  0.242E-04    1.20     110.6  T
     SCC iter.                  ...        0 min,  0.004 sec
     gradient                   ...        0 min,  0.007 sec
 * total energy  :   -23.5671008 Eh     change       -0.9172115E-05 Eh
   gradient norm :     0.0017630 Eh/α   predicted    -0.7177573E-05 ( -21.75%)
   displ. norm   :     0.0475763 α      lambda       -0.8839967E-05
   maximum displ.:     0.0416316 α      in ANC's #2, #1, #4, ...

........................................................................
.............................. CYCLE   10 ..............................
........................................................................
   1    -23.9327336 -0.239327E+02  0.586E-02    1.20       0.0  T
   2    -23.9327339 -0.351051E-06  0.304E-02    1.20       1.0  T
   3    -23.9327287  0.526731E-05  0.219E-02    1.20       1.2  T
   4    -23.9327343 -0.564416E-05  0.505E-03    1.20       5.3  T
   5    -23.9327344 -0.740004E-07  0.300E-03    1.20       8.9  T
   6    -23.9327345 -0.840743E-07  0.422E-04    1.20      63.4  T
   7    -23.9327345 -0.145318E-08  0.189E-04    1.20     141.4  T
     SCC iter.                  ...        0 min,  0.004 sec
     gradient                   ...        0 min,  0.006 sec
 * total energy  :   -23.5671104 Eh     change       -0.9584427E-05 Eh
   gradient norm :     0.0010128 Eh/α   predicted    -0.4424327E-05 ( -53.84%)
   displ. norm   :     0.0408258 α      lambda       -0.6060716E-05
   maximum displ.:     0.0368667 α      in ANC's #2, #1, #5, ...

........................................................................
.............................. CYCLE   11 ..............................
........................................................................
   1    -23.9327412 -0.239327E+02  0.549E-02    1.20       0.0  T
   2    -23.9327416 -0.375890E-06  0.282E-02    1.20       1.0  T
   3    -23.9327366  0.497034E-05  0.217E-02    1.20       1.2  T
   4    -23.9327420 -0.538495E-05  0.467E-03    1.20       5.7  T
   5    -23.9327420 -0.581996E-08  0.321E-03    1.20       8.3  T
   6    -23.9327421 -0.111175E-06  0.666E-04    1.20      40.1  T
   7    -23.9327422 -0.410257E-08  0.169E-04    1.20     157.7  T
     SCC iter.                  ...        0 min,  0.004 sec
     gradient                   ...        0 min,  0.007 sec
 * total energy  :   -23.5671155 Eh     change       -0.5145585E-05 Eh
   gradient norm :     0.0010901 Eh/α   predicted    -0.3032214E-05 ( -41.07%)
   displ. norm   :     0.0256106 α      lambda       -0.3146446E-05
   maximum displ.:     0.0233946 α      in ANC's #2, #1, #3, ...

........................................................................
.............................. CYCLE   12 ..............................
........................................................................
   1    -23.9327678 -0.239328E+02  0.298E-02    1.20       0.0  T
   2    -23.9327677  0.682316E-07  0.164E-02    1.19       1.6  T
   3    -23.9327643  0.341785E-05  0.181E-02    1.19       1.5  T
   4    -23.9327681 -0.382658E-05  0.276E-03    1.19       9.7  T
   5    -23.9327682 -0.333701E-07  0.172E-03    1.19      15.5  T
   6    -23.9327682 -0.242414E-07  0.347E-04    1.19      77.0  T
   7    -23.9327682 -0.750227E-09  0.105E-04    1.19     255.5  T
     SCC iter.                  ...        0 min,  0.004 sec
     gradient                   ...        0 min,  0.006 sec
 * total energy  :   -23.5671185 Eh     change       -0.2997116E-05 Eh
   gradient norm :     0.0009191 Eh/α   predicted    -0.1572191E-05 ( -47.54%)
   displ. norm   :     0.0193643 α      lambda       -0.1664256E-05
   maximum displ.:     0.0187721 α      in ANC's #2, #5, #1, ...

   *** GEOMETRY OPTIMIZATION CONVERGED AFTER 12 ITERATIONS ***

------------------------------------------------------------------------
 total energy gain   :        -0.0154349 Eh       -9.6855 kcal/mol
 total RMSD          :         0.2038317 a0        0.1079 Å
 total power (kW/mol):        -3.3770219 (step) -214.8392 (real)
------------------------------------------------------------------------

 ANCopt (total)                0 d,  0 h,  0 min,  0.189 sec
 optimizer setup                ...        0 min,  0.000 sec (  0.077%)
 model hessian                  ...        0 min,  0.001 sec (  0.575%)
 ANC generation                 ...        0 min,  0.000 sec (  0.191%)
 coordinate transformation      ...        0 min,  0.000 sec (  0.088%)
 single point calculation       ...        0 min,  0.183 sec ( 97.171%)
 optimization log               ...        0 min,  0.001 sec (  0.432%)
 hessian update                 ...        0 min,  0.000 sec (  0.068%)
 rational function              ...        0 min,  0.002 sec (  0.983%)

================
 final structure:
================
$coord
    2.16089939870982    2.18535252703652   -0.22374036232212      C 
   -0.42290092328072    3.27513821809021    0.25646476460280      C 
   -2.19250949652938    1.56421018655020    0.50143583343456      N 
   -0.95919836717979   -0.68706793623717    0.21159196932567      C 
   -1.00413867947006   -3.24583533414367    0.10933155466782      C 
    2.29264321504035   -3.67469670845764   -0.45638507357177      S 
    1.73196332206808   -0.28742766550237   -0.22829658518555      C 
   -0.86393155782721    5.94844477222610    0.41957359797373      C 
   -3.13269128257790    6.94492308007020    0.87688286994227      C 
    3.84782460241257    3.27815443675864   -0.47853030191887      H 
   -2.42010397416250   -4.68753271259825    0.27555309633283      H 
    0.77539330841192    7.14048661053390    0.14731033107061      H 
   -4.74578369074816    5.73571312515610    1.14723083681568      H 
   -3.42120730358975    8.95489891577962    0.99120089747326      H 
$end
           -------------------------------------------------
          |                Final Singlepoint                |
           -------------------------------------------------

          ...................................................
          :                      SETUP                      :
          :.................................................:
          :  # basis functions                  47          :
          :  # atomic orbitals                  46          :
          :  # shells                           24          :
          :  # electrons                        44          :
          :  max. iterations                   250          :
          :  Hamiltonian                  GFN2-xTB          :
          :  restarted?                      false          :
          :  GBSA solvation                  false          :
          :  PC potential                    false          :
          :  electronic temp.          300.0000000     K    :
          :  accuracy                    1.0000000          :
          :  -> integral cutoff          0.2500000E+02      :
          :  -> integral neglect         0.1000000E-07      :
          :  -> SCF convergence          0.1000000E-05 Eh   :
          :  -> wf. convergence          0.1000000E-03 e    :
          :  Broyden damping             0.4000000          :
          ...................................................

 iter      E             dE          RMSdq      gap      omega  full diag
   1    -23.9327682 -0.239328E+02  0.562E-05    1.19       0.0  T
   2    -23.9327682  0.168754E-11  0.347E-05    1.19     771.2  T
   3    -23.9327682 -0.138236E-10  0.242E-05    1.19    1105.7  T

   *** convergence criteria satisfied after 3 iterations ***

         #    Occupation            Energy/Eh            Energy/eV
      -------------------------------------------------------------
         1        2.0000           -0.7319847             -19.9183
       ...           ...                  ...                  ...
        16        2.0000           -0.4692918             -12.7701
        17        2.0000           -0.4495073             -12.2317
        18        2.0000           -0.4403346             -11.9821
        19        2.0000           -0.4289277             -11.6717
        20        2.0000           -0.4249501             -11.5635
        21        2.0000           -0.3891923             -10.5905
        22        2.0000           -0.3675113             -10.0005 (HOMO)
        23                         -0.3236157              -8.8060 (LUMO)
        24                         -0.2498640              -6.7991
        25                         -0.2438811              -6.6363
        26                         -0.1640954              -4.4653
        27                         -0.1555678              -4.2332
       ...                                ...                  ...
        46                          0.7699290              20.9508
      -------------------------------------------------------------
                  HL-Gap            0.0438956 Eh            1.1945 eV
             Fermi-level           -0.3455635 Eh           -9.4033 eV

 SCC (total)                   0 d,  0 h,  0 min,  0.014 sec
 SCC setup                      ...        0 min,  0.000 sec (  1.059%)
 Dispersion                     ...        0 min,  0.000 sec (  0.681%)
 integral evaluation            ...        0 min,  0.004 sec ( 30.005%)
 zeroth order Hamiltonian       ...        0 min,  0.000 sec (  0.591%)
 iterations                     ...        0 min,  0.002 sec ( 16.455%)
 molecular gradient             ...        0 min,  0.007 sec ( 48.964%)
 printout                       ...        0 min,  0.000 sec (  1.887%)

         :::::::::::::::::::::::::::::::::::::::::::::::::::::
         ::                     SUMMARY                     ::
         :::::::::::::::::::::::::::::::::::::::::::::::::::::
         :: total energy             -23.567118544345 Eh    ::
         :: gradient norm              0.000918953880 Eh/a0 ::
         :: HOMO-LUMO gap              1.194459144861 eV    ::
         ::.................................................::
         :: SCC energy               -23.932768180393 Eh    ::
         :: -> isotropic ES            0.010241729157 Eh    ::
         :: -> anisotropic ES          0.001442593296 Eh    ::
         :: -> anisotropic XC          0.019655907420 Eh    ::
         :: -> dispersion             -0.012316449750 Eh    ::
         :: repulsion energy           0.365665473807 Eh    ::
         :: add. restraining           0.000000000000 Eh    ::
         :::::::::::::::::::::::::::::::::::::::::::::::::::::

           -------------------------------------------------
          |                Property Printout                |
           -------------------------------------------------

    * Orbital Energies and Occupations

         #    Occupation            Energy/Eh            Energy/eV
      -------------------------------------------------------------
         1        2.0000           -0.7319847             -19.9183
       ...           ...                  ...                  ...
        10        2.0000           -0.5364489             -14.5975
        11        2.0000           -0.5281085             -14.3706
        12        2.0000           -0.5112202             -13.9110
        13        2.0000           -0.4991469             -13.5825
        14        2.0000           -0.4830381             -13.1441
        15        2.0000           -0.4705052             -12.8031
        16        2.0000           -0.4692918             -12.7701
        17        2.0000           -0.4495073             -12.2317
        18        2.0000           -0.4403346             -11.9821
        19        2.0000           -0.4289277             -11.6717
        20        2.0000           -0.4249501             -11.5635
        21        2.0000           -0.3891923             -10.5905
        22        2.0000           -0.3675113             -10.0005 (HOMO)
        23                         -0.3236157              -8.8060 (LUMO)
        24                         -0.2498640              -6.7991
        25                         -0.2438811              -6.6363
        26                         -0.1640954              -4.4653
        27                         -0.1555678              -4.2332
        28                         -0.1425765              -3.8797
        29                         -0.0116366              -0.3166
        30                          0.0102954               0.2802
        31                          0.0360028               0.9797
        32                          0.0604483               1.6449
        33                          0.0897579               2.4424
       ...                                ...                  ...
        46                          0.7699290              20.9508
      -------------------------------------------------------------
                  HL-Gap            0.0438956 Eh            1.1945 eV
             Fermi-level           -0.3455635 Eh           -9.4033 eV

     #   Z        covCN         q      C6AA      α(0)
     1   6 C      2.982    -0.051    29.270     8.875
     2   6 C      3.262     0.107    24.549     8.003
     3   7 N      1.853    -0.252    27.405     7.759
     4   6 C      3.701     0.071    19.544     6.322
     5   6 C      3.103     0.014    27.562     8.603
     6  16 S      2.423    -0.098   145.148    20.277
     7   6 C      3.292     0.023    25.888     8.164
     8   6 C      2.891    -0.028    28.702     8.784
     9   6 C      2.843    -0.068    29.675     8.928
    10   1 H      0.926     0.045     2.380     2.413
    11   1 H      0.926     0.060     2.198     2.319
    12   1 H      0.925     0.046     2.368     2.406
    13   1 H      0.926     0.075     2.031     2.229
    14   1 H      0.926     0.056     2.250     2.346

 Mol. C6AA /au·bohr⁶  :       3675.634807
 Mol. C8AA /au·bohr⁸  :     107427.659319
 Mol. α(0) /au        :         97.425559


Wiberg/Mayer (AO) data.
largest (>0.10) Wiberg bond orders for each atom
          total WBO             WBO to atom ...
     1  C   3.983        C    7 1.796    C    2 1.012    H   10 0.970
     2  C   3.971        N    3 1.585    C    8 1.135    C    1 1.012    C    5 0.118
     3  N   3.045        C    2 1.585    C    4 1.179
     4  C   3.977        C    5 1.596    N    3 1.179    C    7 1.046
     5  C   3.910        C    4 1.596    S    6 1.084    H   11 0.966    C    2 0.118
     6  S   2.270        C    5 1.084    C    7 0.955
     7  C   3.953        C    1 1.796    C    4 1.046    S    6 0.955
     8  C   3.986        C    9 1.840    C    2 1.135    H   12 0.965
     9  C   3.905        C    8 1.840    H   14 0.977    H   13 0.973
    10  H   0.997        C    1 0.970
    11  H   0.996        C    5 0.966
    12  H   0.997        C    8 0.965
    13  H   0.994        C    9 0.973
    14  H   0.996        C    9 0.977

molecular dipole:
                 x           y           z       tot (Debye)
 q only:       -0.118       0.591       0.041
   full:        0.068       0.605       0.005       1.548
molecular quadrupole (traceless):
                xx          xy          yy          xz          yz          zz
 q only:       -2.102       1.132       5.510      -0.228       0.218      -3.407
  q+dip:       -2.922       5.941       8.152      -0.238      -0.444      -5.230
   full:       -3.723       5.433       6.420       0.363      -0.507      -2.697

           -------------------------------------------------
          |                Geometry Summary                 |
           -------------------------------------------------

      molecular mass/u    :      135.1832000
   center of mass at/Å    :        0.0269082       0.3696853       0.0452844
  moments of inertia/u·Å² :        0.9057709E+02   0.6052614E+03   0.6958293E+03
rotational constants/cm⁻¹ :        0.1861136E+00   0.2785182E-01   0.2422668E-01

 * 12 selected distances

     #   Z        #   Z                                     value/Å
     2   6 C      3   7 N                                 1.3089839
     3   7 N      4   6 C                                 1.3670113
     4   6 C      5   6 C                                 1.3553311
     1   6 C      7   6 C                                 1.3280819
     4   6 C      7   6 C                                 1.4584154 (max)
     2   6 C      8   6 C                                 1.4363708
     8   6 C      9   6 C                                 1.3334187
     1   6 C     10   1 H                                 1.0721359 (min)
     5   6 C     11   1 H                                 1.0729490
     8   6 C     12   1 H                                 1.0822260
     9   6 C     13   1 H                                 1.0763710
     9   6 C     14   1 H                                 1.0762369

 * 3 distinct bonds (by element types)

   Z      Z             #   av. dist./Å        max./Å        min./Å
   1 H    6 C           5     1.0759837     1.0822260     1.0721359
   6 C    6 C           5     1.3823236     1.4584154     1.3280819
   6 C    7 N           2     1.3379976     1.3670113     1.3089839


optimized geometry written to: xtbopt.xyz


           -------------------------------------------------
          | TOTAL ENERGY              -23.567118544345 Eh   |
          | GRADIENT NORM               0.000918953880 Eh/α |
          | HOMO-LUMO GAP               1.194459144861 eV   |
           -------------------------------------------------

------------------------------------------------------------------------
 * finished run on 2021/05/19 at 10:59:56.600     
------------------------------------------------------------------------
 total:
 * wall-time:     0 d,  0 h,  0 min,  0.240 sec
 *  cpu-time:     0 d,  0 h,  0 min,  0.238 sec
 * ratio c/w:     0.994 speedup
 SCF:
 * wall-time:     0 d,  0 h,  0 min,  0.021 sec
 *  cpu-time:     0 d,  0 h,  0 min,  0.021 sec
 * ratio c/w:     0.998 speedup
 ANC optimizer:
 * wall-time:     0 d,  0 h,  0 min,  0.203 sec
 *  cpu-time:     0 d,  0 h,  0 min,  0.202 sec
 * ratio c/w:     0.998 speedup

