      -----------------------------------------------------------      
     |                   =====================                   |     
     |                           x T B                           |     
     |                   =====================                   |     
     |                         S. Grimme                         |     
     |          Mulliken Center for Theoretical Chemistry        |     
     |                    University of Bonn                     |     
     |                Version 6.2 RC2 (SAW190805)                |     
      -----------------------------------------------------------      

   This program is distributed in the hope that it will be useful,
   but WITHOUT ANY WARRANTY; without even the implied warranty of
   MERCHANTABILITY or FITNESS FOR A PARTICULAR PURPOSE.
   
   FOR NON-COMMERCIAL, ACADEMIA USE ONLY.
   
   Cite this work as:
   * S. Grimme, C. Bannwarth, P. Shushkov, J. Chem. Theory Comput., 2017,
     13, 1989-2009. DOI: 10.1021/acs.jctc.7b00118
   * C. Bannwarth, S. Ehlert and S. Grimme., J. Chem. Theory Comput., 2019,
     15, 1652-1671. DOI: 10.1021/acs.jctc.8b01176
   * P. Pracht, E. Caldeweyher, S. Ehlert, S. Grimme, ChemRxiv, 2019, preprint.
     DOI: 10.26434/chemrxiv.8326202.v1
   
   for DFT-D4:
   * E. Caldeweyher, C. Bannwarth and S. Grimme, J. Chem. Phys., 2017,
     147, 034112. DOI: 10.1063/1.4993215
   * E. Caldeweyher, S. Ehlert, A. Hansen, H. Neugebauer, S. Spicher,
     C. Bannwarth and S. Grimme, J. Chem. Phys., 2019, 150, 154122.
     DOI: 10.1063/1.5090222
   
   for sTDA-xTB:
   * S. Grimme and C. Bannwarth, J. Chem. Phys., 2016, 145, 054103.
     DOI: 10.1063/1.4959605
   
   in the mass-spec context:
   * V. Asgeirsson, C. Bauer and S. Grimme, Chem. Sci., 2017, 8, 4879.
     DOI: 10.1039/c7sc00601b
   
   for metadynamics refer to:
   * S. Grimme, J. Chem. Theory Comput., 2019, 155, 2847-2862
     DOI: 10.1021/acs.jctc.9b00143
   
   with help from (in alphabetical order)
   C. Bannwarth, F. Bohle, G. Brandenburg, E. Caldeweyher, M. Checinski,
   S. Dohm, S. Ehlert, S. Ehrlich, F. März, H. Neugebauer, J. Pisarek,
   P. Pracht, P. Shushkov, and S. Spicher.
   
 * started run on 2021/05/19 at 10:59:56.617     

           -------------------------------------------------
          |                Calculation Setup                |
           -------------------------------------------------

          program call               : /ihome/ghutchison/geoffh/xtb/xtb 578.xyz -opt
          hostname                   : smp-n144
          coordinate file            : 578.xyz
          omp threads                :                     1
          number of atoms            :                    15
          number of electrons        :                    42
          charge                     :                     0
          spin                       :                   0.0
          first test random number   :      0.70066538711849


########################################################################
# WARNING! Please study the warnings concerning your input carefully
#  - the use of '-opt' is discouraged, please use '--opt' next time
########################################################################

           ------------------------------------------------- 
          |                 G F N 2 - x T B                 |
          | Geometry, Frequencies, Noncovalent interactions |
          |            JCTC 2019 parametrisation            |
           ------------------------------------------------- 
             KAB for C  - Si     :                1.0500
             KAB for H  - Pd     :                0.9500
             k(s)              :                1.8500
             k(p)              :                2.2300
             k(d)              :                2.2300
             k(f)              :                2.0000
             kEN (H0ij)        :               -2.0000
             D4 a1             :                0.5200
             D4 a2             :                5.0000
             D4 s6             :                1.0000
             D4 s8             :                2.7000
             D4 s9             :                5.0000
             alphaj            :                2.0000

  Z AO/shell   Hii/eV     exponent
  1     Wed Apr 25 08:07:45 CEST 2018   EN: 2.200 GM2: 0.406  GM3: 0.0800  RAES: 1.40
     1s    -10.707211    1.230000
  6     Wed Apr 25 08:07:45 CEST 2018   EN: 2.550 GM2: 0.538  GM3: 0.1500  RAES: 3.00
     2s    -13.970922    2.096432
     2p    -10.063292    1.800000
  7     Wed Apr 25 08:07:45 CEST 2018   EN: 3.040 GM2: 0.461  GM3:-0.0640  RAES: 1.90
     2s    -16.686243    2.339881
     2p    -12.523956    2.014332
  8     Wed Apr 25 08:07:45 CEST 2018   EN: 3.440 GM2: 0.452  GM3:-0.0517  RAES: 1.80
     2s    -20.229985    2.439742
     2p    -15.503117    2.137023

           ------------------------------------------------- 
          |        Self-Consistent Charge Iterations        |
           ------------------------------------------------- 

          ...................................................
          :                      SETUP                      :
          :.................................................:
          :  # basis functions                  39          :
          :  # atomic orbitals                  39          :
          :  # shells                           23          :
          :  # electrons                        42          :
          :  max. iterations                   250          :
          :  Hamiltonian                  GFN2-xTB          :
          :  restarted?                      false          :
          :  GBSA solvation                  false          :
          :  PC potential                    false          :
          :  electronic temp.          300.0000000     K    :
          :  accuracy                    1.0000000          :
          :  -> integral cutoff          0.2500000E+02      :
          :  -> integral neglect         0.1000000E-07      :
          :  -> SCF convergence          0.1000000E-05 Eh   :
          :  -> wf. convergence          0.1000000E-03 e    :
          :  Broyden damping             0.4000000          :
          ...................................................

 iter      E             dE          RMSdq      gap      omega  full diag
   1    -23.6082479 -0.236082E+02  0.457E+00    3.70       0.0  T
   2    -23.6961003 -0.878524E-01  0.285E+00    3.10       1.0  T
   3    -23.7092275 -0.131272E-01  0.165E+00    3.43       1.0  T
   4    -23.7095584 -0.330850E-03  0.585E-01    3.26       1.0  T
   5    -23.7130242 -0.346588E-02  0.105E-01    3.32       1.0  T
   6    -23.7130654 -0.411536E-04  0.642E-02    3.34       1.0  T
   7    -23.7130844 -0.189922E-04  0.262E-02    3.33       1.0  T
   8    -23.7130850 -0.576374E-06  0.911E-03    3.33       2.8  T
   9    -23.7130852 -0.270263E-06  0.389E-03    3.33       6.6  T
  10    -23.7130853 -0.868456E-07  0.140E-03    3.33      18.5  T
  11    -23.7130853 -0.783427E-09  0.694E-04    3.33      37.2  T
  12    -23.7130853 -0.447620E-08  0.191E-04    3.33     135.1  T

   *** convergence criteria satisfied after 12 iterations ***

         #    Occupation            Energy/Eh            Energy/eV
      -------------------------------------------------------------
         1        2.0000           -0.6833819             -18.5958
       ...           ...                  ...                  ...
        15        2.0000           -0.4715671             -12.8320
        16        2.0000           -0.4655505             -12.6683
        17        2.0000           -0.4556687             -12.3994
        18        2.0000           -0.4515685             -12.2878
        19        2.0000           -0.4063573             -11.0575
        20        2.0000           -0.3873073             -10.5392
        21        2.0000           -0.3806744             -10.3587 (HOMO)
        22                         -0.2582544              -7.0275 (LUMO)
        23                         -0.1980873              -5.3902
        24                         -0.1246284              -3.3913
        25                          0.0077557               0.2110
        26                          0.0796750               2.1681
       ...                                ...                  ...
        39                          0.6556522              17.8412
      -------------------------------------------------------------
                  HL-Gap            0.1224200 Eh            3.3312 eV
             Fermi-level           -0.3194644 Eh           -8.6931 eV

 SCC (total)                   0 d,  0 h,  0 min,  0.016 sec
 SCC setup                      ...        0 min,  0.000 sec (  1.320%)
 Dispersion                     ...        0 min,  0.000 sec (  0.996%)
 integral evaluation            ...        0 min,  0.003 sec ( 19.331%)
 zeroth order Hamiltonian       ...        0 min,  0.000 sec (  0.542%)
 iterations                     ...        0 min,  0.007 sec ( 43.588%)
 molecular gradient             ...        0 min,  0.005 sec ( 31.840%)
 printout                       ...        0 min,  0.000 sec (  2.068%)

         :::::::::::::::::::::::::::::::::::::::::::::::::::::
         ::                     SUMMARY                     ::
         :::::::::::::::::::::::::::::::::::::::::::::::::::::
         :: total energy             -23.386060785641 Eh    ::
         :: gradient norm              0.049778443063 Eh/a0 ::
         :: HOMO-LUMO gap              3.331218310075 eV    ::
         ::.................................................::
         :: SCC energy               -23.713085326983 Eh    ::
         :: -> isotropic ES            0.033110141379 Eh    ::
         :: -> anisotropic ES          0.004294997254 Eh    ::
         :: -> anisotropic XC          0.010765798985 Eh    ::
         :: -> dispersion             -0.010544119061 Eh    ::
         :: repulsion energy           0.327010359234 Eh    ::
         :: add. restraining           0.000000000000 Eh    ::
         :::::::::::::::::::::::::::::::::::::::::::::::::::::

      ----------------------------------------------------------- 
     |                   =====================                   |
     |                        A N C O P T                        |
     |                   =====================                   |
     |               Approximate Normal Coordinate               |
     |                Rational Function Optimizer                |
      ----------------------------------------------------------- 

          ...................................................
          :                      SETUP                      :
          :.................................................:
          :   optimization level            normal          :
          :   max. optcycles                   200          :
          :   ANC micro-cycles                  20          :
          :   degrees of freedom                39          :
          :.................................................:
          :   RF solver                   davidson          :
          :   input Hessian                  false          :
          :   write xtbopt.log                true          :
          :   linear?                        false          :
          :   energy convergence         0.5000000E-05 Eh   :
          :   grad. convergence          0.1000000E-02 Eh/α :
          :   maximium RF displ.         2.0000000          :
          :   Hlow (freq-cutoff)         0.5000000E-02      :
          :   Hmax (freq-cutoff)         5.0000000          :
          :   S6 in model hess.         20.0000000          :
          ...................................................

generating ANC from model Hessian ...
Using Lindh-Hessian (1995)
 Shifting diagonal of input Hessian by   1.911436353857855E-003
 Lowest  eigenvalues of input Hessian
   -0.000000   -0.000000   -0.000000   -0.000000   -0.000000    0.000000
    0.005000    0.007798    0.010278    0.015261    0.023775    0.033306
    0.034727    0.048560    0.056748    0.085386    0.094480    0.102879
 Highest eigenvalues
    1.607644    1.774721    1.840380    1.983083    2.004794    2.127116
 

........................................................................
.............................. CYCLE    1 ..............................
........................................................................
   1    -23.7130853 -0.237131E+02  0.597E-05    3.33       0.0  T
   2    -23.7130853 -0.260059E-10  0.246E-05    3.33    1049.0  T
   3    -23.7130853 -0.632738E-11  0.919E-06    3.33    2808.1  T
     SCC iter.                  ...        0 min,  0.002 sec
     gradient                   ...        0 min,  0.005 sec
 * total energy  :   -23.3860608 Eh     change        0.3554561E-09 Eh
   gradient norm :     0.0497801 Eh/α   predicted     0.0000000E+00 (-100.00%)
   displ. norm   :     0.1676996 α      lambda       -0.3161916E-02
   maximum displ.:     0.1007855 α      in ANC's #7, #3, #9, ...

........................................................................
.............................. CYCLE    2 ..............................
........................................................................
   1    -23.7325511 -0.237326E+02  0.141E-01    3.40       0.0  T
   2    -23.7326232 -0.720487E-04  0.773E-02    3.40       1.0  T
   3    -23.7326321 -0.892753E-05  0.467E-02    3.40       1.0  T
   4    -23.7326366 -0.446604E-05  0.152E-02    3.40       1.7  T
   5    -23.7326388 -0.223378E-05  0.325E-03    3.40       7.9  T
   6    -23.7326388 -0.391689E-07  0.197E-03    3.40      13.1  T
     SCC iter.                  ...        0 min,  0.003 sec
     gradient                   ...        0 min,  0.005 sec
 * total energy  :   -23.3880476 Eh     change       -0.1986771E-02 Eh
   gradient norm :     0.0168604 Eh/α   predicted    -0.1625420E-02 ( -18.19%)
   displ. norm   :     0.1086556 α      lambda       -0.4730521E-03
   maximum displ.:     0.0602027 α      in ANC's #3, #7, #2, ...

........................................................................
.............................. CYCLE    3 ..............................
........................................................................
   1    -23.7385231 -0.237385E+02  0.846E-02    3.43       0.0  T
   2    -23.7385485 -0.253547E-04  0.502E-02    3.43       1.0  T
   3    -23.7385524 -0.395352E-05  0.292E-02    3.43       1.0  T
   4    -23.7385542 -0.174607E-05  0.924E-03    3.43       2.8  T
   5    -23.7385550 -0.804126E-06  0.186E-03    3.43      13.9  T
   6    -23.7385550 -0.153400E-07  0.103E-03    3.43      25.1  T
     SCC iter.                  ...        0 min,  0.003 sec
     gradient                   ...        0 min,  0.005 sec
 * total energy  :   -23.3882885 Eh     change       -0.2409564E-03 Eh
   gradient norm :     0.0042760 Eh/α   predicted    -0.2393179E-03 (  -0.68%)
   displ. norm   :     0.0539973 α      lambda       -0.9314630E-04
   maximum displ.:     0.0395782 α      in ANC's #2, #3, #8, ...

........................................................................
.............................. CYCLE    4 ..............................
........................................................................
   1    -23.7384056 -0.237384E+02  0.463E-02    3.43       0.0  T
   2    -23.7384077 -0.216171E-05  0.278E-02    3.44       1.0  T
   3    -23.7384069  0.798607E-06  0.143E-02    3.44       1.8  T
   4    -23.7384084 -0.149742E-05  0.270E-03    3.43       9.6  T
   5    -23.7384085 -0.712993E-07  0.968E-04    3.44      26.7  T
     SCC iter.                  ...        0 min,  0.003 sec
     gradient                   ...        0 min,  0.005 sec
 * total energy  :   -23.3883383 Eh     change       -0.4981850E-04 Eh
   gradient norm :     0.0027171 Eh/α   predicted    -0.4670785E-04 (  -6.24%)
   displ. norm   :     0.0544116 α      lambda       -0.4082925E-04
   maximum displ.:     0.0408676 α      in ANC's #2, #4, #6, ...

........................................................................
.............................. CYCLE    5 ..............................
........................................................................
   1    -23.7373224 -0.237373E+02  0.356E-02    3.43       0.0  T
   2    -23.7373225 -0.184619E-06  0.212E-02    3.43       1.2  T
   3    -23.7373220  0.535215E-06  0.668E-03    3.43       3.9  T
   4    -23.7373226 -0.641718E-06  0.676E-04    3.43      38.2  T
   5    -23.7373226 -0.265141E-08  0.337E-04    3.43      76.6  T
     SCC iter.                  ...        0 min,  0.003 sec
     gradient                   ...        0 min,  0.005 sec
 * total energy  :   -23.3883699 Eh     change       -0.3154959E-04 Eh
   gradient norm :     0.0019454 Eh/α   predicted    -0.2047461E-04 ( -35.10%)
   displ. norm   :     0.1354173 α      lambda       -0.4475542E-04
   maximum displ.:     0.0999802 α      in ANC's #2, #4, #6, ...

........................................................................
.............................. CYCLE    6 ..............................
........................................................................
   1    -23.7358191 -0.237358E+02  0.902E-02    3.43       0.0  T
   2    -23.7358195 -0.407732E-06  0.537E-02    3.43       1.0  T
   3    -23.7358188  0.744622E-06  0.819E-03    3.43       3.2  T
   4    -23.7358198 -0.994320E-06  0.162E-03    3.43      16.0  T
   5    -23.7358198 -0.311796E-08  0.940E-04    3.43      27.5  T
   6    -23.7358198 -0.238510E-08  0.299E-04    3.43      86.5  T
     SCC iter.                  ...        0 min,  0.003 sec
     gradient                   ...        0 min,  0.005 sec
 * total energy  :   -23.3884121 Eh     change       -0.4223745E-04 Eh
   gradient norm :     0.0028663 Eh/α   predicted    -0.2255864E-04 ( -46.59%)
   displ. norm   :     0.0670033 α      lambda       -0.3018071E-04
   maximum displ.:     0.0507963 α      in ANC's #2, #4, #8, ...

........................................................................
.............................. CYCLE    7 ..............................
........................................................................
   1    -23.7360563 -0.237361E+02  0.461E-02    3.43       0.0  T
   2    -23.7360565 -0.102217E-06  0.274E-02    3.43       1.0  T
   3    -23.7360565 -0.398386E-07  0.176E-03    3.43      14.7  T
   4    -23.7360565 -0.174680E-07  0.104E-03    3.43      24.8  T
   5    -23.7360565 -0.277880E-08  0.453E-04    3.43      57.0  T
   6    -23.7360565 -0.634795E-09  0.110E-04    3.43     234.7  T
     SCC iter.                  ...        0 min,  0.003 sec
     gradient                   ...        0 min,  0.005 sec
 * total energy  :   -23.3884387 Eh     change       -0.2654269E-04 Eh
   gradient norm :     0.0025581 Eh/α   predicted    -0.1515725E-04 ( -42.89%)
   displ. norm   :     0.1687732 α      lambda       -0.7148354E-04
   maximum displ.:     0.1273037 α      in ANC's #2, #4, #8, ...

........................................................................
.............................. CYCLE    8 ..............................
........................................................................
   1    -23.7366786 -0.237367E+02  0.116E-01    3.43       0.0  T
   2    -23.7366793 -0.667673E-06  0.691E-02    3.43       1.0  T
   3    -23.7366790  0.219588E-06  0.716E-03    3.43       3.6  T
   4    -23.7366797 -0.635201E-06  0.261E-03    3.43       9.9  T
   5    -23.7366797 -0.125959E-07  0.127E-03    3.43      20.3  T
   6    -23.7366797 -0.285823E-08  0.306E-04    3.43      84.4  T
   7    -23.7366797 -0.604924E-09  0.130E-04    3.43     199.2  T
     SCC iter.                  ...        0 min,  0.004 sec
     gradient                   ...        0 min,  0.005 sec
 * total energy  :   -23.3884857 Eh     change       -0.4705741E-04 Eh
   gradient norm :     0.0023857 Eh/α   predicted    -0.3675891E-04 ( -21.88%)
   displ. norm   :     0.0815489 α      lambda       -0.2483532E-04
   maximum displ.:     0.0623389 α      in ANC's #2, #4, #8, ...

........................................................................
.............................. CYCLE    9 ..............................
........................................................................
   1    -23.7374146 -0.237374E+02  0.563E-02    3.43       0.0  T
   2    -23.7374148 -0.224571E-06  0.335E-02    3.43       1.0  T
   3    -23.7374144  0.391369E-06  0.605E-03    3.43       4.3  T
   4    -23.7374150 -0.536017E-06  0.133E-03    3.43      19.5  T
   5    -23.7374150 -0.152141E-08  0.685E-04    3.43      37.7  T
   6    -23.7374150 -0.127291E-08  0.213E-04    3.43     121.2  T
     SCC iter.                  ...        0 min,  0.003 sec
     gradient                   ...        0 min,  0.005 sec
 * total energy  :   -23.3885022 Eh     change       -0.1643281E-04 Eh
   gradient norm :     0.0014674 Eh/α   predicted    -0.1250181E-04 ( -23.92%)
   displ. norm   :     0.0988886 α      lambda       -0.9244703E-05
   maximum displ.:     0.0781746 α      in ANC's #2, #4, #6, ...

........................................................................
.............................. CYCLE   10 ..............................
........................................................................
   1    -23.7376128 -0.237376E+02  0.661E-02    3.43       0.0  T
   2    -23.7376131 -0.268614E-06  0.392E-02    3.43       1.0  T
   3    -23.7376131  0.890189E-08  0.330E-03    3.43       7.8  T
   4    -23.7376132 -0.101357E-06  0.141E-03    3.43      18.4  T
   5    -23.7376132 -0.995134E-08  0.739E-04    3.43      34.9  T
   6    -23.7376132 -0.116266E-08  0.200E-04    3.43     129.2  T
     SCC iter.                  ...        0 min,  0.003 sec
     gradient                   ...        0 min,  0.005 sec
 * total energy  :   -23.3885092 Eh     change       -0.7004466E-05 Eh
   gradient norm :     0.0010931 Eh/α   predicted    -0.4640466E-05 ( -33.75%)
   displ. norm   :     0.0146843 α      lambda       -0.4303078E-05
   maximum displ.:     0.0083581 α      in ANC's #1, #4, #8, ...

........................................................................
.............................. CYCLE   11 ..............................
........................................................................
   1    -23.7381625 -0.237382E+02  0.136E-02    3.43       0.0  T
   2    -23.7381627 -0.168736E-06  0.761E-03    3.43       3.4  T
   3    -23.7381627  0.156378E-07  0.286E-03    3.43       9.0  T
   4    -23.7381627 -0.282347E-07  0.943E-04    3.43      27.4  T
   5    -23.7381627 -0.783366E-08  0.323E-04    3.43      80.0  T
     SCC iter.                  ...        0 min,  0.003 sec
     gradient                   ...        0 min,  0.005 sec
 * total energy  :   -23.3885072 Eh     change        0.1969011E-05 Eh
   gradient norm :     0.0017364 Eh/α   predicted    -0.2153007E-05 (-209.34%)
   displ. norm   :     0.0215073 α      lambda       -0.5397150E-05
   maximum displ.:     0.0173784 α      in ANC's #2, #4, #6, ...

........................................................................
.............................. CYCLE   12 ..............................
........................................................................
   1    -23.7375281 -0.237375E+02  0.152E-02    3.43       0.0  T
   2    -23.7375282 -0.774474E-07  0.875E-03    3.43       3.0  T
   3    -23.7375282  0.132683E-07  0.168E-03    3.43      15.3  T
   4    -23.7375282 -0.184305E-07  0.569E-04    3.43      45.4  T
   5    -23.7375282 -0.368370E-08  0.200E-04    3.43     129.2  T
     SCC iter.                  ...        0 min,  0.003 sec
     gradient                   ...        0 min,  0.005 sec
 * total energy  :   -23.3885112 Eh     change       -0.3978174E-05 Eh
   gradient norm :     0.0002530 Eh/α   predicted    -0.2697832E-05 ( -32.18%)
   displ. norm   :     0.0039172 α      lambda       -0.2840520E-06
   maximum displ.:     0.0027708 α      in ANC's #5, #4, #21, ...

   *** GEOMETRY OPTIMIZATION CONVERGED AFTER 12 ITERATIONS ***

------------------------------------------------------------------------
 total energy gain   :        -0.0024504 Eh       -1.5376 kcal/mol
 total RMSD          :         0.2036131 a0        0.1077 Å
 total power (kW/mol):        -0.5361224 (step)  -44.9898 (real)
------------------------------------------------------------------------

 ANCopt (total)                0 d,  0 h,  0 min,  0.143 sec
 optimizer setup                ...        0 min,  0.000 sec (  0.097%)
 model hessian                  ...        0 min,  0.002 sec (  1.211%)
 ANC generation                 ...        0 min,  0.000 sec (  0.269%)
 coordinate transformation      ...        0 min,  0.000 sec (  0.114%)
 single point calculation       ...        0 min,  0.137 sec ( 95.661%)
 optimization log               ...        0 min,  0.001 sec (  0.598%)
 hessian update                 ...        0 min,  0.000 sec (  0.085%)
 rational function              ...        0 min,  0.002 sec (  1.404%)

================
 final structure:
================
$coord
   -0.58183137817176    2.04908152968214    0.34274815130195      C 
   -2.04701291295233   -0.06412058432440    0.15848336407651      N 
   -0.57010389136708   -2.10557062135530   -0.23510637360437      C 
    1.91739598037329   -1.31188902330958   -0.30858233716724      C 
    1.87860494320902    1.34989511543248    0.06417978268405      C 
    4.19594713954760   -2.82346381953530   -0.68974624632498      C 
    6.29297628200789   -1.90153010394244   -0.72591630708291      O 
    3.77336025805078   -5.63226222034409   -1.04016441646368      C 
   -1.40477248160441    3.87314130684108    0.65633535919916      H 
   -3.94532474920557   -0.09131046754430    0.29451985478275      H 
   -1.36643588801818   -3.95773560650302   -0.43385076220906      H 
    3.51371329993433    2.54029440672817    0.10905954977356      H 
    2.58285810460066   -5.96000362414119   -2.68315023016407      H 
    2.83509920887107   -6.40906900779113    0.61491007211319      H 
    5.58012768268451   -6.57141408801447   -1.30651964397631      H 
$end
           -------------------------------------------------
          |                Final Singlepoint                |
           -------------------------------------------------

          ...................................................
          :                      SETUP                      :
          :.................................................:
          :  # basis functions                  39          :
          :  # atomic orbitals                  39          :
          :  # shells                           23          :
          :  # electrons                        42          :
          :  max. iterations                   250          :
          :  Hamiltonian                  GFN2-xTB          :
          :  restarted?                      false          :
          :  GBSA solvation                  false          :
          :  PC potential                    false          :
          :  electronic temp.          300.0000000     K    :
          :  accuracy                    1.0000000          :
          :  -> integral cutoff          0.2500000E+02      :
          :  -> integral neglect         0.1000000E-07      :
          :  -> SCF convergence          0.1000000E-05 Eh   :
          :  -> wf. convergence          0.1000000E-03 e    :
          :  Broyden damping             0.4000000          :
          ...................................................

 iter      E             dE          RMSdq      gap      omega  full diag
   1    -23.7375282 -0.237375E+02  0.653E-05    3.43       0.0  T
   2    -23.7375282 -0.251639E-10  0.335E-05    3.43     770.6  T
   3    -23.7375282 -0.132800E-10  0.172E-05    3.43    1503.4  T

   *** convergence criteria satisfied after 3 iterations ***

         #    Occupation            Energy/Eh            Energy/eV
      -------------------------------------------------------------
         1        2.0000           -0.6877377             -18.7143
       ...           ...                  ...                  ...
        15        2.0000           -0.4727901             -12.8653
        16        2.0000           -0.4663906             -12.6911
        17        2.0000           -0.4562060             -12.4140
        18        2.0000           -0.4512562             -12.2793
        19        2.0000           -0.4062884             -11.0557
        20        2.0000           -0.3881743             -10.5628
        21        2.0000           -0.3795009             -10.3267 (HOMO)
        22                         -0.2533793              -6.8948 (LUMO)
        23                         -0.1926531              -5.2424
        24                         -0.1200919              -3.2679
        25                          0.0203112               0.5527
        26                          0.0951492               2.5891
       ...                                ...                  ...
        39                          0.6873783              18.7045
      -------------------------------------------------------------
                  HL-Gap            0.1261217 Eh            3.4319 eV
             Fermi-level           -0.3164401 Eh           -8.6108 eV

 SCC (total)                   0 d,  0 h,  0 min,  0.010 sec
 SCC setup                      ...        0 min,  0.000 sec (  1.284%)
 Dispersion                     ...        0 min,  0.000 sec (  0.793%)
 integral evaluation            ...        0 min,  0.003 sec ( 27.633%)
 zeroth order Hamiltonian       ...        0 min,  0.000 sec (  0.584%)
 iterations                     ...        0 min,  0.002 sec ( 18.895%)
 molecular gradient             ...        0 min,  0.005 sec ( 48.060%)
 printout                       ...        0 min,  0.000 sec (  2.305%)

         :::::::::::::::::::::::::::::::::::::::::::::::::::::
         ::                     SUMMARY                     ::
         :::::::::::::::::::::::::::::::::::::::::::::::::::::
         :: total energy             -23.388511161859 Eh    ::
         :: gradient norm              0.000252292586 Eh/a0 ::
         :: HOMO-LUMO gap              3.431945275850 eV    ::
         ::.................................................::
         :: SCC energy               -23.737528229357 Eh    ::
         :: -> isotropic ES            0.032055521747 Eh    ::
         :: -> anisotropic ES          0.004261583079 Eh    ::
         :: -> anisotropic XC          0.010088373787 Eh    ::
         :: -> dispersion             -0.010632409390 Eh    ::
         :: repulsion energy           0.349002457691 Eh    ::
         :: add. restraining           0.000000000000 Eh    ::
         :::::::::::::::::::::::::::::::::::::::::::::::::::::

           -------------------------------------------------
          |                Property Printout                |
           -------------------------------------------------

    * Orbital Energies and Occupations

         #    Occupation            Energy/Eh            Energy/eV
      -------------------------------------------------------------
         1        2.0000           -0.6877377             -18.7143
       ...           ...                  ...                  ...
         9        2.0000           -0.5495264             -14.9534
        10        2.0000           -0.5328733             -14.5002
        11        2.0000           -0.5192954             -14.1307
        12        2.0000           -0.5165709             -14.0566
        13        2.0000           -0.4966924             -13.5157
        14        2.0000           -0.4920500             -13.3894
        15        2.0000           -0.4727901             -12.8653
        16        2.0000           -0.4663906             -12.6911
        17        2.0000           -0.4562060             -12.4140
        18        2.0000           -0.4512562             -12.2793
        19        2.0000           -0.4062884             -11.0557
        20        2.0000           -0.3881743             -10.5628
        21        2.0000           -0.3795009             -10.3267 (HOMO)
        22                         -0.2533793              -6.8948 (LUMO)
        23                         -0.1926531              -5.2424
        24                         -0.1200919              -3.2679
        25                          0.0203112               0.5527
        26                          0.0951492               2.5891
        27                          0.1257371               3.4215
        28                          0.1582154               4.3053
        29                          0.1760429               4.7904
        30                          0.1874467               5.1007
        31                          0.2000239               5.4429
        32                          0.2221534               6.0451
       ...                                ...                  ...
        39                          0.6873783              18.7045
      -------------------------------------------------------------
                  HL-Gap            0.1261217 Eh            3.4319 eV
             Fermi-level           -0.3164401 Eh           -8.6108 eV

     #   Z        covCN         q      C6AA      α(0)
     1   6 C      3.033    -0.013    28.300     8.726
     2   7 N      2.817    -0.065    22.487     7.043
     3   6 C      3.031    -0.008    28.181     8.707
     4   6 C      3.107    -0.046    28.986     8.821
     5   6 C      3.052    -0.051    29.211     8.864
     6   6 C      2.813     0.235    23.092     7.873
     7   8 O      0.858    -0.377    21.233     6.178
     8   6 C      3.754    -0.138    23.212     6.870
     9   1 H      0.926     0.037     2.494     2.470
    10   1 H      0.860     0.162     1.323     1.802
    11   1 H      0.926     0.039     2.468     2.457
    12   1 H      0.926     0.053     2.284     2.363
    13   1 H      0.925     0.055     2.260     2.351
    14   1 H      0.925     0.055     2.259     2.351
    15   1 H      0.925     0.063     2.169     2.303

 Mol. C6AA /au·bohr⁶  :       2558.406826
 Mol. C8AA /au·bohr⁸  :      60135.328746
 Mol. α(0) /au        :         79.179001


Wiberg/Mayer (AO) data.
largest (>0.10) Wiberg bond orders for each atom
          total WBO             WBO to atom ...
     1  C   3.943        C    5 1.595    N    2 1.208    H    9 0.971    C    3 0.126
     2  N   3.606        C    3 1.276    C    1 1.208    H   10 0.947
     3  C   3.952        C    4 1.460    N    2 1.276    H   11 0.969    C    1 0.126
     4  C   3.977        C    3 1.460    C    5 1.266    C    6 1.067
     5  C   3.985        C    1 1.595    C    4 1.266    H   12 0.972
     6  C   3.934        O    7 1.802    C    4 1.067    C    8 0.992
     7  O   2.052        C    6 1.802
     8  C   3.995        C    6 0.992    H   15 0.985    H   14 0.967    H   13 0.967
     9  H   0.998        C    1 0.971
    10  H   0.973        N    2 0.947
    11  H   0.999        C    3 0.969
    12  H   0.997        C    5 0.972
    13  H   0.997        C    8 0.967
    14  H   0.997        C    8 0.967
    15  H   0.996        C    8 0.985

molecular dipole:
                 x           y           z       tot (Debye)
 q only:       -1.860      -0.164       0.119
   full:       -2.320      -0.278       0.138       5.950
molecular quadrupole (traceless):
                xx          xy          yy          xz          yz          zz
 q only:       -9.624       1.578       7.781       1.065       0.692       1.843
  q+dip:       -9.767       1.603       9.564       0.953       1.174       0.203
   full:      -11.151       1.577       8.972       1.206       0.812       2.179

           -------------------------------------------------
          |                Geometry Summary                 |
           -------------------------------------------------

      molecular mass/u    :      109.1274000
   center of mass at/Å    :        1.0054560      -0.7264649      -0.1677105
  moments of inertia/u·Å² :        0.1037917E+03   0.3225328E+03   0.4231788E+03
rotational constants/cm⁻¹ :        0.1624180E+00   0.5226642E-01   0.3983572E-01

 * 13 selected distances

     #   Z        #   Z                                     value/Å
     1   6 C      2   7 N                                 1.3642446
     2   7 N      3   6 C                                 1.3495256
     3   6 C      4   6 C                                 1.3822557
     1   6 C      5   6 C                                 1.3615607
     4   6 C      5   6 C                                 1.4224489 (max)
     6   6 C      7   8 O                                 1.2123590
     1   6 C      9   1 H                                 1.0718633
     2   7 N     10   1 H                                 1.0072223 (min)
     3   6 C     11   1 H                                 1.0720456
     5   6 C     12   1 H                                 1.0705406
     8   6 C     13   1 H                                 1.0875992
     8   6 C     14   1 H                                 1.0874604
     8   6 C     15   1 H                                 1.0867296

 * 5 distinct bonds (by element types)

   Z      Z             #   av. dist./Å        max./Å        min./Å
   1 H    6 C           6     1.0793731     1.0875992     1.0705406
   6 C    6 C           3     1.3887551     1.4224489     1.3615607
   1 H    7 N           1     1.0072223     1.0072223     1.0072223
   6 C    7 N           2     1.3568851     1.3642446     1.3495256
   6 C    8 O           1     1.2123590     1.2123590     1.2123590


optimized geometry written to: xtbopt.xyz


           -------------------------------------------------
          | TOTAL ENERGY              -23.388511161859 Eh   |
          | GRADIENT NORM               0.000252292586 Eh/α |
          | HOMO-LUMO GAP               3.431945275850 eV   |
           -------------------------------------------------

------------------------------------------------------------------------
 * finished run on 2021/05/19 at 10:59:56.803     
------------------------------------------------------------------------
 total:
 * wall-time:     0 d,  0 h,  0 min,  0.185 sec
 *  cpu-time:     0 d,  0 h,  0 min,  0.184 sec
 * ratio c/w:     0.992 speedup
 SCF:
 * wall-time:     0 d,  0 h,  0 min,  0.016 sec
 *  cpu-time:     0 d,  0 h,  0 min,  0.016 sec
 * ratio c/w:     0.997 speedup
 ANC optimizer:
 * wall-time:     0 d,  0 h,  0 min,  0.154 sec
 *  cpu-time:     0 d,  0 h,  0 min,  0.154 sec
 * ratio c/w:     0.998 speedup

