      -----------------------------------------------------------      
     |                   =====================                   |     
     |                           x T B                           |     
     |                   =====================                   |     
     |                         S. Grimme                         |     
     |          Mulliken Center for Theoretical Chemistry        |     
     |                    University of Bonn                     |     
     |                Version 6.2 RC2 (SAW190805)                |     
      -----------------------------------------------------------      

   This program is distributed in the hope that it will be useful,
   but WITHOUT ANY WARRANTY; without even the implied warranty of
   MERCHANTABILITY or FITNESS FOR A PARTICULAR PURPOSE.
   
   FOR NON-COMMERCIAL, ACADEMIA USE ONLY.
   
   Cite this work as:
   * S. Grimme, C. Bannwarth, P. Shushkov, J. Chem. Theory Comput., 2017,
     13, 1989-2009. DOI: 10.1021/acs.jctc.7b00118
   * C. Bannwarth, S. Ehlert and S. Grimme., J. Chem. Theory Comput., 2019,
     15, 1652-1671. DOI: 10.1021/acs.jctc.8b01176
   * P. Pracht, E. Caldeweyher, S. Ehlert, S. Grimme, ChemRxiv, 2019, preprint.
     DOI: 10.26434/chemrxiv.8326202.v1
   
   for DFT-D4:
   * E. Caldeweyher, C. Bannwarth and S. Grimme, J. Chem. Phys., 2017,
     147, 034112. DOI: 10.1063/1.4993215
   * E. Caldeweyher, S. Ehlert, A. Hansen, H. Neugebauer, S. Spicher,
     C. Bannwarth and S. Grimme, J. Chem. Phys., 2019, 150, 154122.
     DOI: 10.1063/1.5090222
   
   for sTDA-xTB:
   * S. Grimme and C. Bannwarth, J. Chem. Phys., 2016, 145, 054103.
     DOI: 10.1063/1.4959605
   
   in the mass-spec context:
   * V. Asgeirsson, C. Bauer and S. Grimme, Chem. Sci., 2017, 8, 4879.
     DOI: 10.1039/c7sc00601b
   
   for metadynamics refer to:
   * S. Grimme, J. Chem. Theory Comput., 2019, 155, 2847-2862
     DOI: 10.1021/acs.jctc.9b00143
   
   with help from (in alphabetical order)
   C. Bannwarth, F. Bohle, G. Brandenburg, E. Caldeweyher, M. Checinski,
   S. Dohm, S. Ehlert, S. Ehrlich, F. März, H. Neugebauer, J. Pisarek,
   P. Pracht, P. Shushkov, and S. Spicher.
   
 * started run on 2021/05/19 at 10:59:58.578     

           -------------------------------------------------
          |                Calculation Setup                |
           -------------------------------------------------

          program call               : /ihome/ghutchison/geoffh/xtb/xtb 583.xyz -opt
          hostname                   : smp-n144
          coordinate file            : 583.xyz
          omp threads                :                     1
          number of atoms            :                    18
          number of electrons        :                    60
          charge                     :                     0
          spin                       :                   0.0
          first test random number   :      0.50767711976196


########################################################################
# WARNING! Please study the warnings concerning your input carefully
#  - the use of '-opt' is discouraged, please use '--opt' next time
########################################################################

           ------------------------------------------------- 
          |                 G F N 2 - x T B                 |
          | Geometry, Frequencies, Noncovalent interactions |
          |            JCTC 2019 parametrisation            |
           ------------------------------------------------- 
             KAB for C  - Si     :                1.0500
             KAB for H  - Pd     :                0.9500
             k(s)              :                1.8500
             k(p)              :                2.2300
             k(d)              :                2.2300
             k(f)              :                2.0000
             kEN (H0ij)        :               -2.0000
             D4 a1             :                0.5200
             D4 a2             :                5.0000
             D4 s6             :                1.0000
             D4 s8             :                2.7000
             D4 s9             :                5.0000
             alphaj            :                2.0000

  Z AO/shell   Hii/eV     exponent
  1     Wed Apr 25 08:07:45 CEST 2018   EN: 2.200 GM2: 0.406  GM3: 0.0800  RAES: 1.40
     1s    -10.707211    1.230000
  6     Wed Apr 25 08:07:45 CEST 2018   EN: 2.550 GM2: 0.538  GM3: 0.1500  RAES: 3.00
     2s    -13.970922    2.096432
     2p    -10.063292    1.800000
  9     Mon Apr 23 13:58:50 CEST 2018   EN: 3.980 GM2: 0.532  GM3: 0.1426  RAES: 2.40
     2s    -23.458179    2.416361
     2p    -15.746583    2.308399

           ------------------------------------------------- 
          |        Self-Consistent Charge Iterations        |
           ------------------------------------------------- 

          ...................................................
          :                      SETUP                      :
          :.................................................:
          :  # basis functions                  54          :
          :  # atomic orbitals                  54          :
          :  # shells                           30          :
          :  # electrons                        60          :
          :  max. iterations                   250          :
          :  Hamiltonian                  GFN2-xTB          :
          :  restarted?                      false          :
          :  GBSA solvation                  false          :
          :  PC potential                    false          :
          :  electronic temp.          300.0000000     K    :
          :  accuracy                    1.0000000          :
          :  -> integral cutoff          0.2500000E+02      :
          :  -> integral neglect         0.1000000E-07      :
          :  -> SCF convergence          0.1000000E-05 Eh   :
          :  -> wf. convergence          0.1000000E-03 e    :
          :  Broyden damping             0.4000000          :
          ...................................................

 iter      E             dE          RMSdq      gap      omega  full diag
   1    -34.2936691 -0.342937E+02  0.483E+00    1.69       0.0  T
   2    -34.3142801 -0.206110E-01  0.325E+00    1.56       1.0  T
   3    -34.3085109  0.576918E-02  0.196E+00    1.65       1.0  T
   4    -34.3394576 -0.309467E-01  0.321E-01    1.60       1.0  T
   5    -34.3404487 -0.991173E-03  0.130E-01    1.57       1.0  T
   6    -34.3405951 -0.146352E-03  0.704E-02    1.58       1.0  T
   7    -34.3406448 -0.497180E-04  0.281E-02    1.58       1.0  T
   8    -34.3406465 -0.171131E-05  0.162E-02    1.58       1.5  T
   9    -34.3406485 -0.196217E-05  0.898E-03    1.58       2.6  T
  10    -34.3406492 -0.755045E-06  0.143E-03    1.58      16.5  T
  11    -34.3406492 -0.201023E-07  0.661E-04    1.58      35.7  T
  12    -34.3406492 -0.232141E-08  0.397E-04    1.58      59.4  T

   *** convergence criteria satisfied after 12 iterations ***

         #    Occupation            Energy/Eh            Energy/eV
      -------------------------------------------------------------
         1        2.0000           -0.8275791             -22.5196
       ...           ...                  ...                  ...
        24        2.0000           -0.4729960             -12.8709
        25        2.0000           -0.4638817             -12.6229
        26        2.0000           -0.4584842             -12.4760
        27        2.0000           -0.4526167             -12.3163
        28        2.0000           -0.4244858             -11.5508
        29        2.0000           -0.4022439             -10.9456
        30        2.0000           -0.3995430             -10.8721 (HOMO)
        31                         -0.3414923              -9.2925 (LUMO)
        32                         -0.2266168              -6.1666
        33                         -0.1723692              -4.6904
        34                         -0.1703576              -4.6357
        35                         -0.1218042              -3.3145
       ...                                ...                  ...
        54                          0.7578401              20.6219
      -------------------------------------------------------------
                  HL-Gap            0.0580507 Eh            1.5796 eV
             Fermi-level           -0.3704873 Eh          -10.0815 eV

 SCC (total)                   0 d,  0 h,  0 min,  0.026 sec
 SCC setup                      ...        0 min,  0.000 sec (  0.976%)
 Dispersion                     ...        0 min,  0.000 sec (  0.968%)
 integral evaluation            ...        0 min,  0.006 sec ( 22.296%)
 zeroth order Hamiltonian       ...        0 min,  0.000 sec (  0.463%)
 iterations                     ...        0 min,  0.010 sec ( 39.934%)
 molecular gradient             ...        0 min,  0.009 sec ( 33.813%)
 printout                       ...        0 min,  0.000 sec (  1.324%)

         :::::::::::::::::::::::::::::::::::::::::::::::::::::
         ::                     SUMMARY                     ::
         :::::::::::::::::::::::::::::::::::::::::::::::::::::
         :: total energy             -33.845831509221 Eh    ::
         :: gradient norm              0.036855065384 Eh/a0 ::
         :: HOMO-LUMO gap              1.579639358727 eV    ::
         ::.................................................::
         :: SCC energy               -34.340649248563 Eh    ::
         :: -> isotropic ES            0.022925473312 Eh    ::
         :: -> anisotropic ES         -0.000044420562 Eh    ::
         :: -> anisotropic XC          0.007403328593 Eh    ::
         :: -> dispersion             -0.016012888468 Eh    ::
         :: repulsion energy           0.494829944923 Eh    ::
         :: add. restraining           0.000000000000 Eh    ::
         :::::::::::::::::::::::::::::::::::::::::::::::::::::

      ----------------------------------------------------------- 
     |                   =====================                   |
     |                        A N C O P T                        |
     |                   =====================                   |
     |               Approximate Normal Coordinate               |
     |                Rational Function Optimizer                |
      ----------------------------------------------------------- 

          ...................................................
          :                      SETUP                      :
          :.................................................:
          :   optimization level            normal          :
          :   max. optcycles                   200          :
          :   ANC micro-cycles                  20          :
          :   degrees of freedom                48          :
          :.................................................:
          :   RF solver                   davidson          :
          :   input Hessian                  false          :
          :   write xtbopt.log                true          :
          :   linear?                        false          :
          :   energy convergence         0.5000000E-05 Eh   :
          :   grad. convergence          0.1000000E-02 Eh/α :
          :   maximium RF displ.         2.0000000          :
          :   Hlow (freq-cutoff)         0.5000000E-02      :
          :   Hmax (freq-cutoff)         5.0000000          :
          :   S6 in model hess.         20.0000000          :
          ...................................................

generating ANC from model Hessian ...
Using Lindh-Hessian (1995)
 Shifting diagonal of input Hessian by   2.850894341025351E-003
 Lowest  eigenvalues of input Hessian
   -0.000000   -0.000000   -0.000000   -0.000000    0.000000    0.000000
    0.005000    0.006393    0.009534    0.012815    0.020891    0.021226
    0.026407    0.033270    0.040158    0.052893    0.076831    0.097354
 Highest eigenvalues
    1.819556    1.884082    1.900681    2.076506    2.097399    2.140791
 

........................................................................
.............................. CYCLE    1 ..............................
........................................................................
   1    -34.3406492 -0.343406E+02  0.693E-05    1.58       0.0  T
   2    -34.3406492 -0.229150E-10  0.578E-05    1.58     407.7  T
   3    -34.3406492 -0.502425E-10  0.161E-05    1.58    1464.6  T
     SCC iter.                  ...        0 min,  0.003 sec
     gradient                   ...        0 min,  0.009 sec
 * total energy  :   -33.8458315 Eh     change        0.2301346E-07 Eh
   gradient norm :     0.0368570 Eh/α   predicted     0.0000000E+00 (-100.00%)
   displ. norm   :     0.1340972 α      lambda       -0.2277514E-02
   maximum displ.:     0.0857474 α      in ANC's #9, #19, #17, ...

........................................................................
.............................. CYCLE    2 ..............................
........................................................................
   1    -34.3359015 -0.343359E+02  0.727E-02    1.52       0.0  T
   2    -34.3359105 -0.897428E-05  0.520E-02    1.52       1.0  T
   3    -34.3359241 -0.135908E-04  0.318E-02    1.52       1.0  T
   4    -34.3359285 -0.442686E-05  0.818E-03    1.52       2.9  T
   5    -34.3359287 -0.124210E-06  0.623E-03    1.52       3.8  T
   6    -34.3359293 -0.623140E-06  0.158E-03    1.52      14.9  T
   7    -34.3359293 -0.276513E-07  0.577E-04    1.52      40.8  T
     SCC iter.                  ...        0 min,  0.005 sec
     gradient                   ...        0 min,  0.008 sec
 * total energy  :   -33.8472684 Eh     change       -0.1436957E-02 Eh
   gradient norm :     0.0146727 Eh/α   predicted    -0.1159232E-02 ( -19.33%)
   displ. norm   :     0.0485495 α      lambda       -0.3461287E-03
   maximum displ.:     0.0354601 α      in ANC's #19, #14, #17, ...

........................................................................
.............................. CYCLE    3 ..............................
........................................................................
   1    -34.3351521 -0.343352E+02  0.384E-02    1.51       0.0  T
   2    -34.3351558 -0.364755E-05  0.276E-02    1.51       1.0  T
   3    -34.3351605 -0.473157E-05  0.168E-02    1.51       1.4  T
   4    -34.3351616 -0.106822E-05  0.452E-03    1.51       5.2  T
   5    -34.3351617 -0.109077E-06  0.198E-03    1.51      11.9  T
   6    -34.3351617 -0.390497E-07  0.956E-04    1.51      24.7  T
     SCC iter.                  ...        0 min,  0.005 sec
     gradient                   ...        0 min,  0.008 sec
 * total energy  :   -33.8474732 Eh     change       -0.2047941E-03 Eh
   gradient norm :     0.0050059 Eh/α   predicted    -0.1734739E-03 ( -15.29%)
   displ. norm   :     0.0204929 α      lambda       -0.4131792E-04
   maximum displ.:     0.0138338 α      in ANC's #14, #9, #19, ...

........................................................................
.............................. CYCLE    4 ..............................
........................................................................
   1    -34.3355188 -0.343355E+02  0.164E-02    1.52       0.0  T
   2    -34.3355193 -0.506235E-06  0.108E-02    1.52       2.2  T
   3    -34.3355193  0.967518E-09  0.753E-03    1.52       3.1  T
   4    -34.3355198 -0.419757E-06  0.182E-03    1.52      13.0  T
   5    -34.3355198 -0.350979E-07  0.514E-04    1.52      45.9  T
     SCC iter.                  ...        0 min,  0.004 sec
     gradient                   ...        0 min,  0.008 sec
 * total energy  :   -33.8475003 Eh     change       -0.2705137E-04 Eh
   gradient norm :     0.0021949 Eh/α   predicted    -0.2066903E-04 ( -23.59%)
   displ. norm   :     0.0127429 α      lambda       -0.1143198E-04
   maximum displ.:     0.0096467 α      in ANC's #14, #9, #10, ...

........................................................................
.............................. CYCLE    5 ..............................
........................................................................
   1    -34.3358844 -0.343359E+02  0.114E-02    1.53       0.0  T
   2    -34.3358845 -0.939473E-07  0.703E-03    1.53       3.4  T
   3    -34.3358844  0.113869E-06  0.309E-03    1.53       7.6  T
   4    -34.3358845 -0.130027E-06  0.968E-04    1.53      24.3  T
   5    -34.3358846 -0.139156E-07  0.240E-04    1.53      98.1  T
     SCC iter.                  ...        0 min,  0.004 sec
     gradient                   ...        0 min,  0.009 sec
 * total energy  :   -33.8475070 Eh     change       -0.6756576E-05 Eh
   gradient norm :     0.0008164 Eh/α   predicted    -0.5716589E-05 ( -15.39%)
   displ. norm   :     0.0059651 α      lambda       -0.1335197E-05
   maximum displ.:     0.0046048 α      in ANC's #14, #19, #10, ...

........................................................................
.............................. CYCLE    6 ..............................
........................................................................
   1    -34.3360005 -0.343360E+02  0.621E-03    1.53       0.0  T
   2    -34.3360006 -0.683760E-08  0.382E-03    1.53       6.2  T
   3    -34.3360005  0.646507E-07  0.241E-03    1.53       9.8  T
   4    -34.3360006 -0.761593E-07  0.301E-04    1.53      78.4  T
   5    -34.3360006 -0.110008E-08  0.151E-04    1.53     156.3  T
     SCC iter.                  ...        0 min,  0.004 sec
     gradient                   ...        0 min,  0.009 sec
 * total energy  :   -33.8475079 Eh     change       -0.8294271E-06 Eh
   gradient norm :     0.0002929 Eh/α   predicted    -0.6659533E-06 ( -19.71%)
   displ. norm   :     0.0018217 α      lambda       -0.1233685E-06
   maximum displ.:     0.0014901 α      in ANC's #9, #14, #10, ...

   *** GEOMETRY OPTIMIZATION CONVERGED AFTER 6 ITERATIONS ***

------------------------------------------------------------------------
 total energy gain   :        -0.0016764 Eh       -1.0519 kcal/mol
 total RMSD          :         0.0418525 a0        0.0221 Å
 total power (kW/mol):        -0.7335496 (step)  -37.3535 (real)
------------------------------------------------------------------------

 ANCopt (total)                0 d,  0 h,  0 min,  0.118 sec
 optimizer setup                ...        0 min,  0.000 sec (  0.129%)
 model hessian                  ...        0 min,  0.002 sec (  1.848%)
 ANC generation                 ...        0 min,  0.000 sec (  0.383%)
 coordinate transformation      ...        0 min,  0.000 sec (  0.074%)
 single point calculation       ...        0 min,  0.113 sec ( 95.653%)
 optimization log               ...        0 min,  0.001 sec (  0.437%)
 hessian update                 ...        0 min,  0.000 sec (  0.059%)
 rational function              ...        0 min,  0.001 sec (  1.021%)

================
 final structure:
================
$coord
    2.22716048454555    0.49416828213979   -0.00366621855080      C 
    1.36961474668696   -1.90203209256553    0.00191716331797      C 
    2.76168895505683   -4.00259408913764    0.00625976287882      F 
   -1.38438601472690   -1.96016372414666    0.00275615082185      C 
   -2.19078192608130    0.44777974434621   -0.00220597040021      C 
    0.01635217525408    2.11493561937727   -0.00654572538345      C 
   -0.01651445652157    4.68481990068368   -0.01185064933742      C 
    2.19058344023227    6.35197139852943   -0.01626827901540      C 
    1.38412790088335    8.75989730956802   -0.02036648668737      C 
   -1.36982969478821    8.70167309973368   -0.01848598856989      C 
   -2.22728886478119    6.30550499140248   -0.01358387982838      C 
   -2.76203609786675   10.80214661931031   -0.02143415530144      F 
    4.15339308106853    1.11359785342183   -0.00545654244498      H 
   -2.48336046853529   -3.66474240582209    0.00671728253974      H 
   -4.10913900700733    1.09844376398001   -0.00315876335391      H 
    4.10891634753261    5.70123779711858   -0.01634302370294      H 
    2.48309253363449   10.46449652350753   -0.02432722274774      H 
   -4.15350175779490    5.68599021496758   -0.01116375595648      H 
$end
           -------------------------------------------------
          |                Final Singlepoint                |
           -------------------------------------------------

          ...................................................
          :                      SETUP                      :
          :.................................................:
          :  # basis functions                  54          :
          :  # atomic orbitals                  54          :
          :  # shells                           30          :
          :  # electrons                        60          :
          :  max. iterations                   250          :
          :  Hamiltonian                  GFN2-xTB          :
          :  restarted?                      false          :
          :  GBSA solvation                  false          :
          :  PC potential                    false          :
          :  electronic temp.          300.0000000     K    :
          :  accuracy                    1.0000000          :
          :  -> integral cutoff          0.2500000E+02      :
          :  -> integral neglect         0.1000000E-07      :
          :  -> SCF convergence          0.1000000E-05 Eh   :
          :  -> wf. convergence          0.1000000E-03 e    :
          :  Broyden damping             0.4000000          :
          ...................................................

 iter      E             dE          RMSdq      gap      omega  full diag
   1    -34.3360006 -0.343360E+02  0.124E-04    1.53       0.0  T
   2    -34.3360006  0.148383E-09  0.107E-04    1.53     221.1  T
   3    -34.3360006 -0.242878E-09  0.620E-05    1.53     379.9  T

   *** convergence criteria satisfied after 3 iterations ***

         #    Occupation            Energy/Eh            Energy/eV
      -------------------------------------------------------------
         1        2.0000           -0.8295329             -22.5727
       ...           ...                  ...                  ...
        24        2.0000           -0.4735704             -12.8865
        25        2.0000           -0.4638959             -12.6232
        26        2.0000           -0.4577159             -12.4551
        27        2.0000           -0.4518196             -12.2946
        28        2.0000           -0.4222175             -11.4891
        29        2.0000           -0.4015138             -10.9257
        30        2.0000           -0.3983043             -10.8384 (HOMO)
        31                         -0.3419819              -9.3058 (LUMO)
        32                         -0.2241791              -6.1002
        33                         -0.1750875              -4.7644
        34                         -0.1733274              -4.7165
        35                         -0.1231879              -3.3521
       ...                                ...                  ...
        54                          0.7375660              20.0702
      -------------------------------------------------------------
                  HL-Gap            0.0563225 Eh            1.5326 eV
             Fermi-level           -0.3701183 Eh          -10.0714 eV

 SCC (total)                   0 d,  0 h,  0 min,  0.018 sec
 SCC setup                      ...        0 min,  0.000 sec (  0.849%)
 Dispersion                     ...        0 min,  0.000 sec (  0.810%)
 integral evaluation            ...        0 min,  0.006 sec ( 31.216%)
 zeroth order Hamiltonian       ...        0 min,  0.000 sec (  0.540%)
 iterations                     ...        0 min,  0.003 sec ( 16.317%)
 molecular gradient             ...        0 min,  0.009 sec ( 48.180%)
 printout                       ...        0 min,  0.000 sec (  1.822%)

         :::::::::::::::::::::::::::::::::::::::::::::::::::::
         ::                     SUMMARY                     ::
         :::::::::::::::::::::::::::::::::::::::::::::::::::::
         :: total energy             -33.847507882177 Eh    ::
         :: gradient norm              0.000292841989 Eh/a0 ::
         :: HOMO-LUMO gap              1.532612771010 eV    ::
         ::.................................................::
         :: SCC energy               -34.336000567328 Eh    ::
         :: -> isotropic ES            0.022100674724 Eh    ::
         :: -> anisotropic ES          0.000082698529 Eh    ::
         :: -> anisotropic XC          0.007440880499 Eh    ::
         :: -> dispersion             -0.015980753095 Eh    ::
         :: repulsion energy           0.488507405603 Eh    ::
         :: add. restraining           0.000000000000 Eh    ::
         :::::::::::::::::::::::::::::::::::::::::::::::::::::

           -------------------------------------------------
          |                Property Printout                |
           -------------------------------------------------

    * Orbital Energies and Occupations

         #    Occupation            Energy/Eh            Energy/eV
      -------------------------------------------------------------
         1        2.0000           -0.8295329             -22.5727
       ...           ...                  ...                  ...
        18        2.0000           -0.5134839             -13.9726
        19        2.0000           -0.5057982             -13.7635
        20        2.0000           -0.5011554             -13.6371
        21        2.0000           -0.4983380             -13.5605
        22        2.0000           -0.4925004             -13.4016
        23        2.0000           -0.4768819             -12.9766
        24        2.0000           -0.4735704             -12.8865
        25        2.0000           -0.4638959             -12.6232
        26        2.0000           -0.4577159             -12.4551
        27        2.0000           -0.4518196             -12.2946
        28        2.0000           -0.4222175             -11.4891
        29        2.0000           -0.4015138             -10.9257
        30        2.0000           -0.3983043             -10.8384 (HOMO)
        31                         -0.3419819              -9.3058 (LUMO)
        32                         -0.2241791              -6.1002
        33                         -0.1750875              -4.7644
        34                         -0.1733274              -4.7165
        35                         -0.1231879              -3.3521
        36                          0.0350450               0.9536
        37                          0.0642404               1.7481
        38                          0.0716360               1.9493
        39                          0.0874767               2.3804
        40                          0.0978251               2.6620
        41                          0.1356579               3.6914
       ...                                ...                  ...
        54                          0.7375660              20.0702
      -------------------------------------------------------------
                  HL-Gap            0.0563225 Eh            1.5326 eV
             Fermi-level           -0.3701183 Eh          -10.0714 eV

     #   Z        covCN         q      C6AA      α(0)
     1   6 C      2.975    -0.081    30.025     8.988
     2   6 C      2.925     0.174    24.273     8.079
     3   9 F      0.785    -0.202    11.256     3.963
     4   6 C      3.002    -0.046    29.128     8.853
     5   6 C      3.009    -0.048    29.163     8.858
     6   6 C      3.108     0.032    27.133     8.534
     7   6 C      3.108     0.032    27.133     8.534
     8   6 C      3.009    -0.048    29.163     8.858
     9   6 C      3.002    -0.046    29.128     8.853
    10   6 C      2.925     0.174    24.273     8.079
    11   6 C      2.975    -0.081    30.025     8.988
    12   9 F      0.785    -0.202    11.256     3.963
    13   1 H      0.926     0.058     2.224     2.332
    14   1 H      0.926     0.059     2.212     2.326
    15   1 H      0.926     0.054     2.272     2.357
    16   1 H      0.926     0.054     2.272     2.357
    17   1 H      0.926     0.059     2.212     2.326
    18   1 H      0.926     0.058     2.224     2.332

 Mol. C6AA /au·bohr⁶  :       4659.881918
 Mol. C8AA /au·bohr⁸  :     116979.438938
 Mol. α(0) /au        :        108.582422


Wiberg/Mayer (AO) data.
largest (>0.10) Wiberg bond orders for each atom
          total WBO             WBO to atom ...
     1  C   3.977        C    2 1.660    C    6 1.119    H   13 0.968
     2  C   3.835        C    1 1.660    C    4 1.077    F    3 0.983
     3  F   1.123        C    2 0.983
     4  C   3.944        C    5 1.767    C    2 1.077    H   14 0.970
     5  C   3.984        C    4 1.767    C    6 1.082    H   15 0.970
     6  C   3.983        C    7 1.552    C    1 1.119    C    5 1.082
     7  C   3.983        C    6 1.552    C   11 1.119    C    8 1.082
     8  C   3.984        C    9 1.767    C    7 1.082    H   16 0.970
     9  C   3.944        C    8 1.767    C   10 1.077    H   17 0.970
    10  C   3.835        C   11 1.660    C    9 1.077    F   12 0.983
    11  C   3.977        C   10 1.660    C    7 1.119    H   18 0.968
    12  F   1.123        C   10 0.983
    13  H   0.997        C    1 0.968
    14  H   0.996        C    4 0.970
    15  H   0.997        C    5 0.970
    16  H   0.997        C    8 0.970
    17  H   0.996        C    9 0.970
    18  H   0.997        C   11 0.968

molecular dipole:
                 x           y           z       tot (Debye)
 q only:        0.000      -0.000      -0.000
   full:        0.000      -0.000      -0.000       0.001
molecular quadrupole (traceless):
                xx          xy          yy          xz          yz          zz
 q only:        5.704      11.210     -10.397      -0.023       0.024       4.693
  q+dip:        7.865      14.055      -8.836      -0.032       0.012       0.972
   full:        6.326      13.323     -11.199      -0.028       0.025       4.872

           -------------------------------------------------
          |                Geometry Summary                 |
           -------------------------------------------------

      molecular mass/u    :      164.1542000
   center of mass at/Å    :       -0.0000605       1.7991161      -0.0045228
  moments of inertia/u·Å² :        0.1512192E+03   0.1169879E+04   0.1321098E+04
rotational constants/cm⁻¹ :        0.1114781E+00   0.1440973E-01   0.1276032E-01

 * 13 selected distances

     #   Z        #   Z                                     value/Å
     1   6 C      2   6 C                                 1.3467735
     2   6 C      3   9 F                                 1.3335110
     4   6 C      5   6 C                                 1.3437863
     6   6 C      7   6 C                                 1.3600384 (max)
     8   6 C      9   6 C                                 1.3437867
    10   6 C     11   6 C                                 1.3467412
    10   6 C     12   9 F                                 1.3335095
     1   6 C     13   1 H                                 1.0707269 (min)
     4   6 C     14   1 H                                 1.0732452
     5   6 C     15   1 H                                 1.0719541
     8   6 C     16   1 H                                 1.0719537
     9   6 C     17   1 H                                 1.0732515
    11   6 C     18   1 H                                 1.0707311

 * 3 distinct bonds (by element types)

   Z      Z             #   av. dist./Å        max./Å        min./Å
   1 H    6 C           6     1.0719771     1.0732515     1.0707269
   6 C    6 C           5     1.3482252     1.3600384     1.3437863
   6 C    9 F           2     1.3335102     1.3335110     1.3335095


optimized geometry written to: xtbopt.xyz


           -------------------------------------------------
          | TOTAL ENERGY              -33.847507882177 Eh   |
          | GRADIENT NORM               0.000292841989 Eh/α |
          | HOMO-LUMO GAP               1.532612771010 eV   |
           -------------------------------------------------

------------------------------------------------------------------------
 * finished run on 2021/05/19 at 10:59:58.759     
------------------------------------------------------------------------
 total:
 * wall-time:     0 d,  0 h,  0 min,  0.181 sec
 *  cpu-time:     0 d,  0 h,  0 min,  0.179 sec
 * ratio c/w:     0.988 speedup
 SCF:
 * wall-time:     0 d,  0 h,  0 min,  0.026 sec
 *  cpu-time:     0 d,  0 h,  0 min,  0.026 sec
 * ratio c/w:     0.997 speedup
 ANC optimizer:
 * wall-time:     0 d,  0 h,  0 min,  0.136 sec
 *  cpu-time:     0 d,  0 h,  0 min,  0.136 sec
 * ratio c/w:     0.998 speedup

