      -----------------------------------------------------------      
     |                   =====================                   |     
     |                           x T B                           |     
     |                   =====================                   |     
     |                         S. Grimme                         |     
     |          Mulliken Center for Theoretical Chemistry        |     
     |                    University of Bonn                     |     
     |                Version 6.2 RC2 (SAW190805)                |     
      -----------------------------------------------------------      

   This program is distributed in the hope that it will be useful,
   but WITHOUT ANY WARRANTY; without even the implied warranty of
   MERCHANTABILITY or FITNESS FOR A PARTICULAR PURPOSE.
   
   FOR NON-COMMERCIAL, ACADEMIA USE ONLY.
   
   Cite this work as:
   * S. Grimme, C. Bannwarth, P. Shushkov, J. Chem. Theory Comput., 2017,
     13, 1989-2009. DOI: 10.1021/acs.jctc.7b00118
   * C. Bannwarth, S. Ehlert and S. Grimme., J. Chem. Theory Comput., 2019,
     15, 1652-1671. DOI: 10.1021/acs.jctc.8b01176
   * P. Pracht, E. Caldeweyher, S. Ehlert, S. Grimme, ChemRxiv, 2019, preprint.
     DOI: 10.26434/chemrxiv.8326202.v1
   
   for DFT-D4:
   * E. Caldeweyher, C. Bannwarth and S. Grimme, J. Chem. Phys., 2017,
     147, 034112. DOI: 10.1063/1.4993215
   * E. Caldeweyher, S. Ehlert, A. Hansen, H. Neugebauer, S. Spicher,
     C. Bannwarth and S. Grimme, J. Chem. Phys., 2019, 150, 154122.
     DOI: 10.1063/1.5090222
   
   for sTDA-xTB:
   * S. Grimme and C. Bannwarth, J. Chem. Phys., 2016, 145, 054103.
     DOI: 10.1063/1.4959605
   
   in the mass-spec context:
   * V. Asgeirsson, C. Bauer and S. Grimme, Chem. Sci., 2017, 8, 4879.
     DOI: 10.1039/c7sc00601b
   
   for metadynamics refer to:
   * S. Grimme, J. Chem. Theory Comput., 2019, 155, 2847-2862
     DOI: 10.1021/acs.jctc.9b00143
   
   with help from (in alphabetical order)
   C. Bannwarth, F. Bohle, G. Brandenburg, E. Caldeweyher, M. Checinski,
   S. Dohm, S. Ehlert, S. Ehrlich, F. März, H. Neugebauer, J. Pisarek,
   P. Pracht, P. Shushkov, and S. Spicher.
   
 * started run on 2021/05/19 at 10:59:58.778     

           -------------------------------------------------
          |                Calculation Setup                |
           -------------------------------------------------

          program call               : /ihome/ghutchison/geoffh/xtb/xtb 584.xyz -opt
          hostname                   : smp-n144
          coordinate file            : 584.xyz
          omp threads                :                     1
          number of atoms            :                    27
          number of electrons        :                    68
          charge                     :                     0
          spin                       :                   0.0
          first test random number   :      0.70798987484497


########################################################################
# WARNING! Please study the warnings concerning your input carefully
#  - the use of '-opt' is discouraged, please use '--opt' next time
########################################################################

           ------------------------------------------------- 
          |                 G F N 2 - x T B                 |
          | Geometry, Frequencies, Noncovalent interactions |
          |            JCTC 2019 parametrisation            |
           ------------------------------------------------- 
             KAB for C  - Si     :                1.0500
             KAB for H  - Pd     :                0.9500
             k(s)              :                1.8500
             k(p)              :                2.2300
             k(d)              :                2.2300
             k(f)              :                2.0000
             kEN (H0ij)        :               -2.0000
             D4 a1             :                0.5200
             D4 a2             :                5.0000
             D4 s6             :                1.0000
             D4 s8             :                2.7000
             D4 s9             :                5.0000
             alphaj            :                2.0000

  Z AO/shell   Hii/eV     exponent
  1     Wed Apr 25 08:07:45 CEST 2018   EN: 2.200 GM2: 0.406  GM3: 0.0800  RAES: 1.40
     1s    -10.707211    1.230000
  6     Wed Apr 25 08:07:45 CEST 2018   EN: 2.550 GM2: 0.538  GM3: 0.1500  RAES: 3.00
     2s    -13.970922    2.096432
     2p    -10.063292    1.800000
 16     Tue Apr 24 11:44:34 CEST 2018   EN: 2.580 GM2: 0.340  GM3:-0.0502  RAES: 3.10
     3s    -20.029654    1.981333
     3p    -11.377694    2.025643
     3d     -0.420282    1.702555

           ------------------------------------------------- 
          |        Self-Consistent Charge Iterations        |
           ------------------------------------------------- 

          ...................................................
          :                      SETUP                      :
          :.................................................:
          :  # basis functions                  72          :
          :  # atomic orbitals                  71          :
          :  # shells                           41          :
          :  # electrons                        68          :
          :  max. iterations                   250          :
          :  Hamiltonian                  GFN2-xTB          :
          :  restarted?                      false          :
          :  GBSA solvation                  false          :
          :  PC potential                    false          :
          :  electronic temp.          300.0000000     K    :
          :  accuracy                    1.0000000          :
          :  -> integral cutoff          0.2500000E+02      :
          :  -> integral neglect         0.1000000E-07      :
          :  -> SCF convergence          0.1000000E-05 Eh   :
          :  -> wf. convergence          0.1000000E-03 e    :
          :  Broyden damping             0.4000000          :
          ...................................................

 iter      E             dE          RMSdq      gap      omega  full diag
   1    -36.5424957 -0.365425E+02  0.379E+00    3.64       0.0  T
   2    -36.5733759 -0.308803E-01  0.220E+00    3.52       1.0  T
   3    -36.5644557  0.892024E-02  0.938E-01    3.46       1.0  T
   4    -36.5729947 -0.853905E-02  0.490E-01    3.61       1.0  T
   5    -36.5770709 -0.407616E-02  0.985E-02    3.66       1.0  T
   6    -36.5770901 -0.191523E-04  0.570E-02    3.64       1.0  T
   7    -36.5771301 -0.400335E-04  0.250E-02    3.64       1.0  T
   8    -36.5771360 -0.595124E-05  0.757E-03    3.63       2.5  T
   9    -36.5771359  0.139763E-06  0.408E-03    3.63       4.7  T
  10    -36.5771362 -0.255725E-06  0.147E-03    3.63      13.1  T
  11    -36.5771362 -0.200463E-07  0.604E-04    3.63      31.9  T
  12    -36.5771362 -0.121297E-08  0.236E-04    3.63      81.5  T

   *** convergence criteria satisfied after 12 iterations ***

         #    Occupation            Energy/Eh            Energy/eV
      -------------------------------------------------------------
         1        2.0000           -0.7217402             -19.6396
       ...           ...                  ...                  ...
        28        2.0000           -0.4342055             -11.8153
        29        2.0000           -0.4276601             -11.6372
        30        2.0000           -0.4191994             -11.4070
        31        2.0000           -0.4165609             -11.3352
        32        2.0000           -0.3813341             -10.3766
        33        2.0000           -0.3775073             -10.2725
        34        2.0000           -0.3761059             -10.2344 (HOMO)
        35                         -0.2425440              -6.6000 (LUMO)
        36                         -0.2345128              -6.3814
        37                         -0.1904745              -5.1831
        38                         -0.1644867              -4.4759
        39                         -0.1586896              -4.3182
       ...                                ...                  ...
        71                          0.6753763              18.3779
      -------------------------------------------------------------
                  HL-Gap            0.1335618 Eh            3.6344 eV
             Fermi-level           -0.3093250 Eh           -8.4172 eV

 SCC (total)                   0 d,  0 h,  0 min,  0.043 sec
 SCC setup                      ...        0 min,  0.000 sec (  0.763%)
 Dispersion                     ...        0 min,  0.000 sec (  0.947%)
 integral evaluation            ...        0 min,  0.010 sec ( 22.945%)
 zeroth order Hamiltonian       ...        0 min,  0.000 sec (  0.480%)
 iterations                     ...        0 min,  0.016 sec ( 37.334%)
 molecular gradient             ...        0 min,  0.016 sec ( 36.386%)
 printout                       ...        0 min,  0.000 sec (  1.005%)

         :::::::::::::::::::::::::::::::::::::::::::::::::::::
         ::                     SUMMARY                     ::
         :::::::::::::::::::::::::::::::::::::::::::::::::::::
         :: total energy             -36.022833041882 Eh    ::
         :: gradient norm              0.049086982162 Eh/a0 ::
         :: HOMO-LUMO gap              3.634402263053 eV    ::
         ::.................................................::
         :: SCC energy               -36.577136180171 Eh    ::
         :: -> isotropic ES            0.003352225453 Eh    ::
         :: -> anisotropic ES          0.005490098066 Eh    ::
         :: -> anisotropic XC          0.022551742664 Eh    ::
         :: -> dispersion             -0.027850558005 Eh    ::
         :: repulsion energy           0.553949361410 Eh    ::
         :: add. restraining           0.000000000000 Eh    ::
         :::::::::::::::::::::::::::::::::::::::::::::::::::::

      ----------------------------------------------------------- 
     |                   =====================                   |
     |                        A N C O P T                        |
     |                   =====================                   |
     |               Approximate Normal Coordinate               |
     |                Rational Function Optimizer                |
      ----------------------------------------------------------- 

          ...................................................
          :                      SETUP                      :
          :.................................................:
          :   optimization level            normal          :
          :   max. optcycles                   200          :
          :   ANC micro-cycles                  20          :
          :   degrees of freedom                75          :
          :.................................................:
          :   RF solver                   davidson          :
          :   input Hessian                  false          :
          :   write xtbopt.log                true          :
          :   linear?                        false          :
          :   energy convergence         0.5000000E-05 Eh   :
          :   grad. convergence          0.1000000E-02 Eh/α :
          :   maximium RF displ.         2.0000000          :
          :   Hlow (freq-cutoff)         0.5000000E-02      :
          :   Hmax (freq-cutoff)         5.0000000          :
          :   S6 in model hess.         20.0000000          :
          ...................................................

generating ANC from model Hessian ...
Using Lindh-Hessian (1995)
 Shifting diagonal of input Hessian by   4.249880724354933E-003
 Lowest  eigenvalues of input Hessian
   -0.000000   -0.000000   -0.000000   -0.000000    0.000000    0.000000
    0.005000    0.005774    0.005987    0.008458    0.010355    0.011858
    0.014237    0.015341    0.016845    0.017286    0.022033    0.023223
 Highest eigenvalues
    1.499902    1.638080    1.752650    1.817758    1.839002    1.915323
 

........................................................................
.............................. CYCLE    1 ..............................
........................................................................
   1    -36.5771362 -0.365771E+02  0.971E-05    3.63       0.0  T
   2    -36.5771362 -0.423483E-10  0.628E-05    3.63     306.6  T
   3    -36.5771362 -0.231921E-10  0.417E-05    3.63     461.8  T
     SCC iter.                  ...        0 min,  0.005 sec
     gradient                   ...        0 min,  0.015 sec
 * total energy  :   -36.0228331 Eh     change       -0.2655725E-07 Eh
   gradient norm :     0.0490873 Eh/α   predicted     0.0000000E+00 (-100.00%)
   displ. norm   :     0.3333402 α      lambda       -0.6450215E-02
   maximum displ.:     0.1135792 α      in ANC's #5, #17, #2, ...

........................................................................
.............................. CYCLE    2 ..............................
........................................................................
   1    -36.6111213 -0.366111E+02  0.206E-01    3.73       0.0  T
   2    -36.6111621 -0.407231E-04  0.105E-01    3.75       1.0  T
   3    -36.6111363  0.258035E-04  0.458E-02    3.75       1.0  T
   4    -36.6111732 -0.369362E-04  0.196E-02    3.75       1.0  T
   5    -36.6111771 -0.390378E-05  0.662E-03    3.75       2.9  T
   6    -36.6111771 -0.452553E-07  0.172E-03    3.75      11.2  T
   7    -36.6111772 -0.581042E-07  0.723E-04    3.75      26.6  T
     SCC iter.                  ...        0 min,  0.009 sec
     gradient                   ...        0 min,  0.014 sec
 * total energy  :   -36.0269356 Eh     change       -0.4102560E-02 Eh
   gradient norm :     0.0158000 Eh/α   predicted    -0.3583481E-02 ( -12.65%)
   displ. norm   :     0.2919626 α      lambda       -0.1344877E-02
   maximum displ.:     0.1900849 α      in ANC's #5, #2, #6, ...

........................................................................
.............................. CYCLE    3 ..............................
........................................................................
   1    -36.6229687 -0.366230E+02  0.124E-01    3.78       0.0  T
   2    -36.6229795 -0.107905E-04  0.674E-02    3.79       1.0  T
   3    -36.6229683  0.111657E-04  0.299E-02    3.79       1.0  T
   4    -36.6229821 -0.138160E-04  0.111E-02    3.79       1.7  T
   5    -36.6229836 -0.151021E-05  0.339E-03    3.79       5.7  T
   6    -36.6229836 -0.218752E-07  0.148E-03    3.79      13.0  T
   7    -36.6229837 -0.495547E-07  0.324E-04    3.79      59.4  T
     SCC iter.                  ...        0 min,  0.009 sec
     gradient                   ...        0 min,  0.015 sec
 * total energy  :   -36.0278111 Eh     change       -0.8754740E-03 Eh
   gradient norm :     0.0060227 Eh/α   predicted    -0.7297667E-03 ( -16.64%)
   displ. norm   :     0.3065888 α      lambda       -0.7193828E-03
   maximum displ.:     0.1688976 α      in ANC's #2, #5, #3, ...

........................................................................
.............................. CYCLE    4 ..............................
........................................................................
   1    -36.6244825 -0.366245E+02  0.137E-01    3.78       0.0  T
   2    -36.6244874 -0.488509E-05  0.788E-02    3.78       1.0  T
   3    -36.6244746  0.127195E-04  0.261E-02    3.77       1.0  T
   4    -36.6244890 -0.143287E-04  0.736E-03    3.78       2.6  T
   5    -36.6244897 -0.716668E-06  0.231E-03    3.78       8.3  T
   6    -36.6244897 -0.117957E-07  0.114E-03    3.78      16.9  T
     SCC iter.                  ...        0 min,  0.008 sec
     gradient                   ...        0 min,  0.014 sec
 * total energy  :   -36.0283062 Eh     change       -0.4951464E-03 Eh
   gradient norm :     0.0069593 Eh/α   predicted    -0.3935014E-03 ( -20.53%)
   displ. norm   :     0.3481082 α      lambda       -0.5827833E-03
   maximum displ.:     0.1994812 α      in ANC's #2, #3, #6, ...

........................................................................
.............................. CYCLE    5 ..............................
........................................................................
   1    -36.6207926 -0.366208E+02  0.147E-01    3.75       0.0  T
   2    -36.6207954 -0.273443E-05  0.843E-02    3.75       1.0  T
   3    -36.6207908  0.461264E-05  0.169E-02    3.75       1.1  T
   4    -36.6207959 -0.517620E-05  0.705E-03    3.75       2.7  T
   5    -36.6207965 -0.535576E-06  0.170E-03    3.75      11.3  T
   6    -36.6207965 -0.223004E-07  0.675E-04    3.75      28.5  T
     SCC iter.                  ...        0 min,  0.008 sec
     gradient                   ...        0 min,  0.015 sec
 * total energy  :   -36.0286926 Eh     change       -0.3863121E-03 Eh
   gradient norm :     0.0084974 Eh/α   predicted    -0.3267046E-03 ( -15.43%)
   displ. norm   :     0.2418023 α      lambda       -0.3230982E-03
   maximum displ.:     0.1439514 α      in ANC's #2, #3, #6, ...

........................................................................
.............................. CYCLE    6 ..............................
........................................................................
   1    -36.6189346 -0.366189E+02  0.123E-01    3.73       0.0  T
   2    -36.6189378 -0.313303E-05  0.675E-02    3.73       1.0  T
   3    -36.6189363  0.143310E-05  0.135E-02    3.73       1.4  T
   4    -36.6189380 -0.171039E-05  0.787E-03    3.73       2.4  T
   5    -36.6189387 -0.680743E-06  0.144E-03    3.73      13.4  T
   6    -36.6189388 -0.337284E-07  0.381E-04    3.73      50.5  T
     SCC iter.                  ...        0 min,  0.008 sec
     gradient                   ...        0 min,  0.015 sec
 * total energy  :   -36.0289185 Eh     change       -0.2259251E-03 Eh
   gradient norm :     0.0063196 Eh/α   predicted    -0.1709950E-03 ( -24.31%)
   displ. norm   :     0.1996130 α      lambda       -0.2097251E-03
   maximum displ.:     0.1163932 α      in ANC's #2, #3, #6, ...

........................................................................
.............................. CYCLE    7 ..............................
........................................................................
   1    -36.6193368 -0.366193E+02  0.122E-01    3.73       0.0  T
   2    -36.6193415 -0.471445E-05  0.641E-02    3.73       1.0  T
   3    -36.6193398  0.168443E-05  0.146E-02    3.73       1.3  T
   4    -36.6193423 -0.249829E-05  0.807E-03    3.73       2.4  T
   5    -36.6193429 -0.572978E-06  0.165E-03    3.73      11.6  T
   6    -36.6193429 -0.264564E-07  0.593E-04    3.73      32.5  T
     SCC iter.                  ...        0 min,  0.008 sec
     gradient                   ...        0 min,  0.014 sec
 * total energy  :   -36.0290531 Eh     change       -0.1345680E-03 Eh
   gradient norm :     0.0032558 Eh/α   predicted    -0.1090465E-03 ( -18.97%)
   displ. norm   :     0.1322110 α      lambda       -0.8256036E-04
   maximum displ.:     0.0862135 α      in ANC's #3, #2, #6, ...

........................................................................
.............................. CYCLE    8 ..............................
........................................................................
   1    -36.6205986 -0.366206E+02  0.852E-02    3.73       0.0  T
   2    -36.6206007 -0.207167E-05  0.448E-02    3.73       1.0  T
   3    -36.6206000  0.672838E-06  0.965E-03    3.73       2.0  T
   4    -36.6206010 -0.986628E-06  0.555E-03    3.73       3.5  T
   5    -36.6206013 -0.311420E-06  0.809E-04    3.73      23.8  T
   6    -36.6206013 -0.466851E-08  0.323E-04    3.73      59.5  T
     SCC iter.                  ...        0 min,  0.008 sec
     gradient                   ...        0 min,  0.015 sec
 * total energy  :   -36.0291048 Eh     change       -0.5172448E-04 Eh
   gradient norm :     0.0023634 Eh/α   predicted    -0.4200614E-04 ( -18.79%)
   displ. norm   :     0.0990883 α      lambda       -0.5208916E-04
   maximum displ.:     0.0678991 α      in ANC's #3, #2, #5, ...

........................................................................
.............................. CYCLE    9 ..............................
........................................................................
   1    -36.6218589 -0.366219E+02  0.678E-02    3.74       0.0  T
   2    -36.6218601 -0.120384E-05  0.363E-02    3.74       1.0  T
   3    -36.6218593  0.764113E-06  0.864E-03    3.74       2.2  T
   4    -36.6218603 -0.967241E-06  0.457E-03    3.74       4.2  T
   5    -36.6218605 -0.190135E-06  0.915E-04    3.74      21.0  T
   6    -36.6218605 -0.695588E-08  0.432E-04    3.74      44.6  T
     SCC iter.                  ...        0 min,  0.008 sec
     gradient                   ...        0 min,  0.016 sec
 * total energy  :   -36.0291377 Eh     change       -0.3294510E-04 Eh
   gradient norm :     0.0017869 Eh/α   predicted    -0.2630102E-04 ( -20.17%)
   displ. norm   :     0.1309455 α      lambda       -0.3721252E-04
   maximum displ.:     0.0866818 α      in ANC's #3, #1, #5, ...

........................................................................
.............................. CYCLE   10 ..............................
........................................................................
   1    -36.6227401 -0.366227E+02  0.853E-02    3.75       0.0  T
   2    -36.6227417 -0.164102E-05  0.462E-02    3.75       1.0  T
   3    -36.6227411  0.597439E-06  0.930E-03    3.75       2.1  T
   4    -36.6227418 -0.651498E-06  0.581E-03    3.75       3.3  T
   5    -36.6227422 -0.410330E-06  0.116E-03    3.75      16.7  T
   6    -36.6227422 -0.118948E-07  0.461E-04    3.75      41.7  T
   7    -36.6227422 -0.349015E-08  0.205E-04    3.75      94.1  T
     SCC iter.                  ...        0 min,  0.009 sec
     gradient                   ...        0 min,  0.015 sec
 * total energy  :   -36.0291741 Eh     change       -0.3637267E-04 Eh
   gradient norm :     0.0022426 Eh/α   predicted    -0.1874834E-04 ( -48.45%)
   displ. norm   :     0.0694699 α      lambda       -0.2756492E-04
   maximum displ.:     0.0453599 α      in ANC's #3, #1, #4, ...

........................................................................
.............................. CYCLE   11 ..............................
........................................................................
   1    -36.6221468 -0.366221E+02  0.422E-02    3.76       0.0  T
   2    -36.6221470 -0.268375E-06  0.235E-02    3.76       1.0  T
   3    -36.6221470  0.670143E-07  0.384E-03    3.76       5.0  T
   4    -36.6221470 -0.728957E-07  0.227E-03    3.76       8.5  T
   5    -36.6221471 -0.755471E-07  0.336E-04    3.76      57.3  T
   6    -36.6221471 -0.174559E-08  0.153E-04    3.76     125.6  T
     SCC iter.                  ...        0 min,  0.008 sec
     gradient                   ...        0 min,  0.016 sec
 * total energy  :   -36.0291957 Eh     change       -0.2164918E-04 Eh
   gradient norm :     0.0017409 Eh/α   predicted    -0.1385236E-04 ( -36.01%)
   displ. norm   :     0.1493656 α      lambda       -0.2867273E-04
   maximum displ.:     0.0879532 α      in ANC's #3, #1, #4, ...

........................................................................
.............................. CYCLE   12 ..............................
........................................................................
   1    -36.6211070 -0.366211E+02  0.820E-02    3.77       0.0  T
   2    -36.6211078 -0.788291E-06  0.467E-02    3.77       1.0  T
   3    -36.6211070  0.776472E-06  0.797E-03    3.77       2.4  T
   4    -36.6211080 -0.943324E-06  0.365E-03    3.77       5.3  T
   5    -36.6211081 -0.133945E-06  0.508E-04    3.77      37.9  T
   6    -36.6211081 -0.164650E-08  0.240E-04    3.77      80.1  T
     SCC iter.                  ...        0 min,  0.008 sec
     gradient                   ...        0 min,  0.015 sec
 * total energy  :   -36.0292202 Eh     change       -0.2440950E-04 Eh
   gradient norm :     0.0015000 Eh/α   predicted    -0.1447939E-04 ( -40.68%)
   displ. norm   :     0.0743605 α      lambda       -0.1048959E-04
   maximum displ.:     0.0500574 α      in ANC's #3, #1, #4, ...

........................................................................
.............................. CYCLE   13 ..............................
........................................................................
   1    -36.6211497 -0.366211E+02  0.421E-02    3.78       0.0  T
   2    -36.6211499 -0.266271E-06  0.238E-02    3.78       1.0  T
   3    -36.6211497  0.235966E-06  0.439E-03    3.77       4.4  T
   4    -36.6211500 -0.271467E-06  0.212E-03    3.78       9.1  T
   5    -36.6211500 -0.514387E-07  0.522E-04    3.78      36.8  T
   6    -36.6211500 -0.187671E-08  0.218E-04    3.78      88.1  T
     SCC iter.                  ...        0 min,  0.008 sec
     gradient                   ...        0 min,  0.015 sec
 * total energy  :   -36.0292315 Eh     change       -0.1132708E-04 Eh
   gradient norm :     0.0013944 Eh/α   predicted    -0.5258934E-05 ( -53.57%)
   displ. norm   :     0.1168965 α      lambda       -0.1325720E-04
   maximum displ.:     0.0780449 α      in ANC's #3, #1, #4, ...

........................................................................
.............................. CYCLE   14 ..............................
........................................................................
   1    -36.6218929 -0.366219E+02  0.592E-02    3.78       0.0  T
   2    -36.6218932 -0.284291E-06  0.342E-02    3.78       1.0  T
   3    -36.6218931  0.127429E-06  0.387E-03    3.78       5.0  T
   4    -36.6218932 -0.147533E-06  0.226E-03    3.78       8.5  T
   5    -36.6218933 -0.722524E-07  0.534E-04    3.78      36.0  T
   6    -36.6218933 -0.330159E-08  0.201E-04    3.78      95.9  T
     SCC iter.                  ...        0 min,  0.008 sec
     gradient                   ...        0 min,  0.016 sec
 * total energy  :   -36.0292421 Eh     change       -0.1061688E-04 Eh
   gradient norm :     0.0009548 Eh/α   predicted    -0.6671704E-05 ( -37.16%)
   displ. norm   :     0.1164375 α      lambda        0.1061816E-04
   maximum displ.:     0.0780429 α      in ANC's #3, #1, #4, ...

........................................................................
.............................. CYCLE   15 ..............................
........................................................................
   1    -36.6223854 -0.366224E+02  0.591E-02    3.79       0.0  T
   2    -36.6223856 -0.280991E-06  0.342E-02    3.79       1.0  T
   3    -36.6223855  0.117512E-06  0.381E-03    3.79       5.1  T
   4    -36.6223857 -0.135095E-06  0.225E-03    3.79       8.6  T
   5    -36.6223857 -0.728669E-07  0.527E-04    3.79      36.5  T
   6    -36.6223857 -0.329756E-08  0.197E-04    3.79      97.7  T
     SCC iter.                  ...        0 min,  0.008 sec
     gradient                   ...        0 min,  0.015 sec
 * total energy  :   -36.0292349 Eh     change        0.7153757E-05 Eh
   gradient norm :     0.0024310 Eh/α   predicted     0.5339593E-05 ( -25.36%)
   displ. norm   :     0.0470628 α      lambda       -0.1253683E-04
   maximum displ.:     0.0326096 α      in ANC's #3, #1, #4, ...

........................................................................
.............................. CYCLE   16 ..............................
........................................................................
   1    -36.6221342 -0.366221E+02  0.235E-02    3.79       0.0  T
   2    -36.6221342 -0.615942E-07  0.137E-02    3.79       1.4  T
   3    -36.6221342  0.581386E-07  0.192E-03    3.79      10.0  T
   4    -36.6221342 -0.652575E-07  0.855E-04    3.79      22.5  T
   5    -36.6221343 -0.108740E-07  0.272E-04    3.79      70.6  T
     SCC iter.                  ...        0 min,  0.007 sec
     gradient                   ...        0 min,  0.015 sec
 * total energy  :   -36.0292435 Eh     change       -0.8534680E-05 Eh
   gradient norm :     0.0010224 Eh/α   predicted    -0.6285058E-05 ( -26.36%)
   displ. norm   :     0.0398397 α      lambda       -0.3919764E-05
   maximum displ.:     0.0294401 α      in ANC's #3, #2, #1, ...

........................................................................
.............................. CYCLE   17 ..............................
........................................................................
   1    -36.6217114 -0.366217E+02  0.232E-02    3.78       0.0  T
   2    -36.6217115 -0.996897E-07  0.133E-02    3.78       1.5  T
   3    -36.6217114  0.914280E-07  0.245E-03    3.78       7.9  T
   4    -36.6217115 -0.982478E-07  0.115E-03    3.78      16.7  T
   5    -36.6217115 -0.198270E-07  0.351E-04    3.78      54.9  T
   6    -36.6217115 -0.799240E-09  0.113E-04    3.78     170.3  T
     SCC iter.                  ...        0 min,  0.008 sec
     gradient                   ...        0 min,  0.016 sec
 * total energy  :   -36.0292455 Eh     change       -0.1998400E-05 Eh
   gradient norm :     0.0005537 Eh/α   predicted    -0.1964802E-05 (  -1.68%)
   displ. norm   :     0.0173342 α      lambda       -0.1090763E-05
   maximum displ.:     0.0135264 α      in ANC's #1, #3, #4, ...

   *** GEOMETRY OPTIMIZATION CONVERGED AFTER 17 ITERATIONS ***

------------------------------------------------------------------------
 total energy gain   :        -0.0064124 Eh       -4.0239 kcal/mol
 total RMSD          :         0.3649111 a0        0.1931 Å
 total power (kW/mol):        -0.9903440 (step)  -29.1217 (real)
------------------------------------------------------------------------

 ANCopt (total)                0 d,  0 h,  0 min,  0.578 sec
 optimizer setup                ...        0 min,  0.000 sec (  0.026%)
 model hessian                  ...        0 min,  0.013 sec (  2.273%)
 ANC generation                 ...        0 min,  0.001 sec (  0.141%)
 coordinate transformation      ...        0 min,  0.000 sec (  0.059%)
 single point calculation       ...        0 min,  0.558 sec ( 96.455%)
 optimization log               ...        0 min,  0.002 sec (  0.320%)
 hessian update                 ...        0 min,  0.000 sec (  0.042%)
 rational function              ...        0 min,  0.003 sec (  0.487%)

================
 final structure:
================
$coord
    2.91635107840801    2.39780393607328   -1.21009740226907      C 
    5.22538050452666    0.10685944063256   -1.24899125217889      S 
    2.99334192810359   -2.20941242213991   -0.76872874982868      C 
    0.61578140029673   -1.26001016874912   -0.59101345767371      C 
    0.57082391700759    1.41898591468247   -0.84925715179328      C 
   -1.83560820607014    2.90369863189773   -0.79213650807117      C 
   -3.98112895476453    1.39928723696602    0.43146835810472      C 
   -4.08211588649592   -1.24336741980999   -0.77144034980273      C 
   -1.72502248819000   -2.76605795629747   -0.09654290688988      C 
   -3.79760651432380    1.15874113049286    3.27295071520303      C 
   -1.78261888102523    1.81183115044464    4.62299686753930      C 
   -6.07661935394046    0.12686363561973    4.46243838430878      C 
   -6.11691215671459   -1.26888987851119    6.54222103735068      C 
    3.43972502196206    4.33890845596449   -1.46086143813649      H 
    3.58294113444622   -4.14310192033554   -0.63926597664430      H 
   -2.37914901007970    3.34766852446561   -2.73990116488053      H 
   -1.55798497344371    4.69963709307136    0.18591690547387      H 
   -5.76410097959787    2.37133863289500    0.00677554017775      H 
   -4.21346588473995   -1.04058762227510   -2.82189074025500      H 
   -5.75761608891922   -2.25396719012065   -0.11759611125442      H 
   -1.67718678106392   -4.52992057741501   -1.16973645915873      H 
   -1.78764763061056   -3.26116034300178    1.91187605933759      H 
   -0.08374566355763    2.54709176539243    3.78728127738403      H 
   -1.77663179824471    1.63886030764595    6.65048057410440      H 
   -7.83364310425052    0.53015669291936    3.49037357006977      H 
   -4.41217970159343   -1.77471923731390    7.53300145689139      H 
   -7.85680799701600   -1.97418357030776    7.32698561554871      H 
$end
           -------------------------------------------------
          |                Final Singlepoint                |
           -------------------------------------------------

          ...................................................
          :                      SETUP                      :
          :.................................................:
          :  # basis functions                  72          :
          :  # atomic orbitals                  71          :
          :  # shells                           41          :
          :  # electrons                        68          :
          :  max. iterations                   250          :
          :  Hamiltonian                  GFN2-xTB          :
          :  restarted?                      false          :
          :  GBSA solvation                  false          :
          :  PC potential                    false          :
          :  electronic temp.          300.0000000     K    :
          :  accuracy                    1.0000000          :
          :  -> integral cutoff          0.2500000E+02      :
          :  -> integral neglect         0.1000000E-07      :
          :  -> SCF convergence          0.1000000E-05 Eh   :
          :  -> wf. convergence          0.1000000E-03 e    :
          :  Broyden damping             0.4000000          :
          ...................................................

 iter      E             dE          RMSdq      gap      omega  full diag
   1    -36.6217115 -0.366217E+02  0.568E-05    3.78       0.0  T
   2    -36.6217115 -0.293454E-11  0.250E-05    3.78     771.2  T
   3    -36.6217115  0.209610E-11  0.284E-05    3.78     676.6  T

   *** convergence criteria satisfied after 3 iterations ***

         #    Occupation            Energy/Eh            Energy/eV
      -------------------------------------------------------------
         1        2.0000           -0.7211061             -19.6223
       ...           ...                  ...                  ...
        28        2.0000           -0.4334079             -11.7936
        29        2.0000           -0.4279006             -11.6438
        30        2.0000           -0.4211115             -11.4590
        31        2.0000           -0.4172334             -11.3535
        32        2.0000           -0.3842258             -10.4553
        33        2.0000           -0.3791410             -10.3170
        34        2.0000           -0.3785313             -10.3004 (HOMO)
        35                         -0.2394934              -6.5169 (LUMO)
        36                         -0.2334640              -6.3529
        37                         -0.1934111              -5.2630
        38                         -0.1591768              -4.3314
        39                         -0.1537608              -4.1840
       ...                                ...                  ...
        71                          0.6935846              18.8734
      -------------------------------------------------------------
                  HL-Gap            0.1390379 Eh            3.7834 eV
             Fermi-level           -0.3090124 Eh           -8.4087 eV

 SCC (total)                   0 d,  0 h,  0 min,  0.030 sec
 SCC setup                      ...        0 min,  0.000 sec (  0.737%)
 Dispersion                     ...        0 min,  0.000 sec (  0.747%)
 integral evaluation            ...        0 min,  0.009 sec ( 31.103%)
 zeroth order Hamiltonian       ...        0 min,  0.000 sec (  0.594%)
 iterations                     ...        0 min,  0.004 sec ( 14.772%)
 molecular gradient             ...        0 min,  0.015 sec ( 50.673%)
 printout                       ...        0 min,  0.000 sec (  1.198%)

         :::::::::::::::::::::::::::::::::::::::::::::::::::::
         ::                     SUMMARY                     ::
         :::::::::::::::::::::::::::::::::::::::::::::::::::::
         :: total energy             -36.029245486495 Eh    ::
         :: gradient norm              0.000553623486 Eh/a0 ::
         :: HOMO-LUMO gap              3.783413160944 eV    ::
         ::.................................................::
         :: SCC energy               -36.621711481028 Eh    ::
         :: -> isotropic ES            0.003463563824 Eh    ::
         :: -> anisotropic ES          0.004730365865 Eh    ::
         :: -> anisotropic XC          0.021929546858 Eh    ::
         :: -> dispersion             -0.028843481581 Eh    ::
         :: repulsion energy           0.592148428827 Eh    ::
         :: add. restraining           0.000000000000 Eh    ::
         :::::::::::::::::::::::::::::::::::::::::::::::::::::

           -------------------------------------------------
          |                Property Printout                |
           -------------------------------------------------

    * Orbital Energies and Occupations

         #    Occupation            Energy/Eh            Energy/eV
      -------------------------------------------------------------
         1        2.0000           -0.7211061             -19.6223
       ...           ...                  ...                  ...
        22        2.0000           -0.4686968             -12.7539
        23        2.0000           -0.4642924             -12.6340
        24        2.0000           -0.4604287             -12.5289
        25        2.0000           -0.4478053             -12.1854
        26        2.0000           -0.4437312             -12.0745
        27        2.0000           -0.4379502             -11.9172
        28        2.0000           -0.4334079             -11.7936
        29        2.0000           -0.4279006             -11.6438
        30        2.0000           -0.4211115             -11.4590
        31        2.0000           -0.4172334             -11.3535
        32        2.0000           -0.3842258             -10.4553
        33        2.0000           -0.3791410             -10.3170
        34        2.0000           -0.3785313             -10.3004 (HOMO)
        35                         -0.2394934              -6.5169 (LUMO)
        36                         -0.2334640              -6.3529
        37                         -0.1934111              -5.2630
        38                         -0.1591768              -4.3314
        39                         -0.1537608              -4.1840
        40                         -0.1056446              -2.8747
        41                          0.0070281               0.1912
        42                          0.0389366               1.0595
        43                          0.0433875               1.1806
        44                          0.0689729               1.8768
        45                          0.0927821               2.5247
       ...                                ...                  ...
        71                          0.6935846              18.8734
      -------------------------------------------------------------
                  HL-Gap            0.1390379 Eh            3.7834 eV
             Fermi-level           -0.3090124 Eh           -8.4087 eV

     #   Z        covCN         q      C6AA      α(0)
     1   6 C      2.941    -0.035    28.874     8.813
     2  16 S      2.291    -0.054   143.272    20.146
     3   6 C      2.941    -0.034    28.841     8.808
     4   6 C      3.164    -0.005    27.814     8.620
     5   6 C      3.163    -0.004    27.774     8.614
     6   6 C      3.809    -0.056    21.570     6.611
     7   6 C      3.862    -0.017    20.839     6.492
     8   6 C      3.811    -0.051    21.486     6.598
     9   6 C      3.806    -0.053    21.530     6.605
    10   6 C      2.947     0.016    27.658     8.626
    11   6 C      2.845    -0.096    30.403     9.037
    12   6 C      2.898    -0.030    28.744     8.791
    13   6 C      2.838    -0.087    30.182     9.003
    14   1 H      0.926     0.036     2.507     2.476
    15   1 H      0.926     0.036     2.503     2.474
    16   1 H      0.924     0.039     2.456     2.451
    17   1 H      0.924     0.040     2.455     2.450
    18   1 H      0.924     0.033     2.549     2.497
    19   1 H      0.924     0.035     2.523     2.484
    20   1 H      0.924     0.031     2.575     2.509
    21   1 H      0.924     0.035     2.516     2.481
    22   1 H      0.924     0.042     2.418     2.432
    23   1 H      0.926     0.040     2.447     2.446
    24   1 H      0.926     0.036     2.507     2.476
    25   1 H      0.925     0.031     2.577     2.511
    26   1 H      0.926     0.039     2.463     2.454
    27   1 H      0.926     0.035     2.514     2.480

 Mol. C6AA /au·bohr⁶  :       9096.730098
 Mol. C8AA /au·bohr⁸  :     240323.935190
 Mol. α(0) /au        :        151.381897


Wiberg/Mayer (AO) data.
largest (>0.10) Wiberg bond orders for each atom
          total WBO             WBO to atom ...
     1  C   3.942        C    5 1.608    S    2 1.179    H   14 0.971    C    3 0.119
     2  S   2.616        C    3 1.180    C    1 1.179
     3  C   3.943        C    4 1.611    S    2 1.180    H   15 0.971    C    1 0.119
     4  C   3.986        C    3 1.611    C    5 1.217    C    9 1.009
     5  C   3.986        C    1 1.608    C    4 1.217    C    6 1.008
     6  C   3.998        C    5 1.008    C    7 0.994    H   17 0.968    H   16 0.959
     7  C   3.996        C    6 0.994    C   10 0.993    C    8 0.982    H   18 0.957
     8  C   3.998        C    9 1.006    C    7 0.982    H   19 0.977    H   20 0.976
     9  C   3.998        C    4 1.009    C    8 1.006    H   21 0.970    H   22 0.959
    10  C   3.988        C   11 1.872    C   12 1.069    C    7 0.993
    11  C   3.991        C   10 1.872    H   24 0.974    H   23 0.972
    12  C   3.991        C   13 1.920    C   10 1.069    H   25 0.962
    13  C   3.992        C   12 1.920    H   27 0.978    H   26 0.975
    14  H   0.998        C    1 0.971
    15  H   0.998        C    3 0.971
    16  H   0.998        C    6 0.959
    17  H   0.998        C    6 0.968
    18  H   0.998        C    7 0.957
    19  H   0.998        C    8 0.977
    20  H   0.998        C    8 0.976
    21  H   0.999        C    9 0.970
    22  H   0.998        C    9 0.959
    23  H   0.998        C   11 0.972
    24  H   0.998        C   11 0.974
    25  H   0.999        C   12 0.962
    26  H   0.998        C   13 0.975
    27  H   0.998        C   13 0.978

molecular dipole:
                 x           y           z       tot (Debye)
 q only:       -0.494       0.002      -0.063
   full:       -0.783      -0.023      -0.042       1.995
molecular quadrupole (traceless):
                xx          xy          yy          xz          yz          zz
 q only:       -0.916       0.050       1.898       1.476      -0.826      -0.983
  q+dip:       -2.288       0.718       2.586       2.569      -2.432      -0.298
   full:       -3.298       0.178       3.568       2.315      -1.576      -0.270

           -------------------------------------------------
          |                Geometry Summary                 |
           -------------------------------------------------

      molecular mass/u    :      190.3026000
   center of mass at/Å    :       -0.3857239       0.0933950       0.4261869
  moments of inertia/u·Å² :        0.3267858E+03   0.1164877E+04   0.1177246E+04
rotational constants/cm⁻¹ :        0.5158618E-01   0.1447160E-01   0.1431955E-01

 * 26 selected distances

     #   Z        #   Z                                     value/Å
     1   6 C      2  16 S                                 1.7213768 (max)
     2  16 S      3   6 C                                 1.7210683
     3   6 C      4   6 C                                 1.3580117
     1   6 C      5   6 C                                 1.3584289
     4   6 C      5   6 C                                 1.4244338
     5   6 C      6   6 C                                 1.4966037
     6   6 C      7   6 C                                 1.5303859
     7   6 C      8   6 C                                 1.5374226
     4   6 C      9   6 C                                 1.4959949
     8   6 C      9   6 C                                 1.5272942
    10   6 C     11   6 C                                 1.3292072
    12   6 C     13   6 C                                 1.3256125
     1   6 C     14   1 H                                 1.0721149
     3   6 C     15   1 H                                 1.0719651 (min)
     6   6 C     16   1 H                                 1.0955801
     6   6 C     17   1 H                                 1.0920888
     7   6 C     18   1 H                                 1.0978658
     8   6 C     19   1 H                                 1.0925581
     8   6 C     20   1 H                                 1.0917127
     9   6 C     21   1 H                                 1.0928816
     9   6 C     22   1 H                                 1.0951278
    11   6 C     23   1 H                                 1.0747900
    11   6 C     24   1 H                                 1.0768003
    12   6 C     25   1 H                                 1.0838046
    13   6 C     26   1 H                                 1.0771873
    13   6 C     27   1 H                                 1.0767856

 * 3 distinct bonds (by element types)

   Z      Z             #   av. dist./Å        max./Å        min./Å
   1 H    6 C          14     1.0850902     1.0978658     1.0719651
   6 C    6 C          10     1.4383395     1.5374226     1.3256125
   6 C   16 S           2     1.7212225     1.7213768     1.7210683


optimized geometry written to: xtbopt.xyz


           -------------------------------------------------
          | TOTAL ENERGY              -36.029245486495 Eh   |
          | GRADIENT NORM               0.000553623486 Eh/α |
          | HOMO-LUMO GAP               3.783413160944 eV   |
           -------------------------------------------------

------------------------------------------------------------------------
 * finished run on 2021/05/19 at 10:59:59.452     
------------------------------------------------------------------------
 total:
 * wall-time:     0 d,  0 h,  0 min,  0.674 sec
 *  cpu-time:     0 d,  0 h,  0 min,  0.671 sec
 * ratio c/w:     0.996 speedup
 SCF:
 * wall-time:     0 d,  0 h,  0 min,  0.043 sec
 *  cpu-time:     0 d,  0 h,  0 min,  0.043 sec
 * ratio c/w:     0.998 speedup
 ANC optimizer:
 * wall-time:     0 d,  0 h,  0 min,  0.609 sec
 *  cpu-time:     0 d,  0 h,  0 min,  0.607 sec
 * ratio c/w:     0.998 speedup

