      -----------------------------------------------------------      
     |                   =====================                   |     
     |                           x T B                           |     
     |                   =====================                   |     
     |                         S. Grimme                         |     
     |          Mulliken Center for Theoretical Chemistry        |     
     |                    University of Bonn                     |     
     |                Version 6.2 RC2 (SAW190805)                |     
      -----------------------------------------------------------      

   This program is distributed in the hope that it will be useful,
   but WITHOUT ANY WARRANTY; without even the implied warranty of
   MERCHANTABILITY or FITNESS FOR A PARTICULAR PURPOSE.
   
   FOR NON-COMMERCIAL, ACADEMIA USE ONLY.
   
   Cite this work as:
   * S. Grimme, C. Bannwarth, P. Shushkov, J. Chem. Theory Comput., 2017,
     13, 1989-2009. DOI: 10.1021/acs.jctc.7b00118
   * C. Bannwarth, S. Ehlert and S. Grimme., J. Chem. Theory Comput., 2019,
     15, 1652-1671. DOI: 10.1021/acs.jctc.8b01176
   * P. Pracht, E. Caldeweyher, S. Ehlert, S. Grimme, ChemRxiv, 2019, preprint.
     DOI: 10.26434/chemrxiv.8326202.v1
   
   for DFT-D4:
   * E. Caldeweyher, C. Bannwarth and S. Grimme, J. Chem. Phys., 2017,
     147, 034112. DOI: 10.1063/1.4993215
   * E. Caldeweyher, S. Ehlert, A. Hansen, H. Neugebauer, S. Spicher,
     C. Bannwarth and S. Grimme, J. Chem. Phys., 2019, 150, 154122.
     DOI: 10.1063/1.5090222
   
   for sTDA-xTB:
   * S. Grimme and C. Bannwarth, J. Chem. Phys., 2016, 145, 054103.
     DOI: 10.1063/1.4959605
   
   in the mass-spec context:
   * V. Asgeirsson, C. Bauer and S. Grimme, Chem. Sci., 2017, 8, 4879.
     DOI: 10.1039/c7sc00601b
   
   for metadynamics refer to:
   * S. Grimme, J. Chem. Theory Comput., 2019, 155, 2847-2862
     DOI: 10.1021/acs.jctc.9b00143
   
   with help from (in alphabetical order)
   C. Bannwarth, F. Bohle, G. Brandenburg, E. Caldeweyher, M. Checinski,
   S. Dohm, S. Ehlert, S. Ehrlich, F. März, H. Neugebauer, J. Pisarek,
   P. Pracht, P. Shushkov, and S. Spicher.
   
 * started run on 2021/05/19 at 10:59:59.471     

           -------------------------------------------------
          |                Calculation Setup                |
           -------------------------------------------------

          program call               : /ihome/ghutchison/geoffh/xtb/xtb 585.xyz -opt
          hostname                   : smp-n144
          coordinate file            : 585.xyz
          omp threads                :                     1
          number of atoms            :                    36
          number of electrons        :                    92
          charge                     :                     0
          spin                       :                   0.0
          first test random number   :      0.81991483489646


########################################################################
# WARNING! Please study the warnings concerning your input carefully
#  - the use of '-opt' is discouraged, please use '--opt' next time
########################################################################

           ------------------------------------------------- 
          |                 G F N 2 - x T B                 |
          | Geometry, Frequencies, Noncovalent interactions |
          |            JCTC 2019 parametrisation            |
           ------------------------------------------------- 
             KAB for C  - Si     :                1.0500
             KAB for H  - Pd     :                0.9500
             k(s)              :                1.8500
             k(p)              :                2.2300
             k(d)              :                2.2300
             k(f)              :                2.0000
             kEN (H0ij)        :               -2.0000
             D4 a1             :                0.5200
             D4 a2             :                5.0000
             D4 s6             :                1.0000
             D4 s8             :                2.7000
             D4 s9             :                5.0000
             alphaj            :                2.0000

  Z AO/shell   Hii/eV     exponent
  1     Wed Apr 25 08:07:45 CEST 2018   EN: 2.200 GM2: 0.406  GM3: 0.0800  RAES: 1.40
     1s    -10.707211    1.230000
  6     Wed Apr 25 08:07:45 CEST 2018   EN: 2.550 GM2: 0.538  GM3: 0.1500  RAES: 3.00
     2s    -13.970922    2.096432
     2p    -10.063292    1.800000
 16     Tue Apr 24 11:44:34 CEST 2018   EN: 2.580 GM2: 0.340  GM3:-0.0502  RAES: 3.10
     3s    -20.029654    1.981333
     3p    -11.377694    2.025643
     3d     -0.420282    1.702555

           ------------------------------------------------- 
          |        Self-Consistent Charge Iterations        |
           ------------------------------------------------- 

          ...................................................
          :                      SETUP                      :
          :.................................................:
          :  # basis functions                  96          :
          :  # atomic orbitals                  95          :
          :  # shells                           55          :
          :  # electrons                        92          :
          :  max. iterations                   250          :
          :  Hamiltonian                  GFN2-xTB          :
          :  restarted?                      false          :
          :  GBSA solvation                  false          :
          :  PC potential                    false          :
          :  electronic temp.          300.0000000     K    :
          :  accuracy                    1.0000000          :
          :  -> integral cutoff          0.2500000E+02      :
          :  -> integral neglect         0.1000000E-07      :
          :  -> SCF convergence          0.1000000E-05 Eh   :
          :  -> wf. convergence          0.1000000E-03 e    :
          :  Broyden damping             0.4000000          :
          ...................................................

 iter      E             dE          RMSdq      gap      omega  full diag
   1    -49.5243168 -0.495243E+02  0.376E+00    2.79       0.0  T
   2    -49.5601418 -0.358250E-01  0.219E+00    2.79       1.0  T
   3    -49.5469760  0.131658E-01  0.899E-01    2.79       1.0  T
   4    -49.5600151 -0.130391E-01  0.430E-01    2.79       1.0  T
   5    -49.5646230 -0.460789E-02  0.164E-01    2.78       1.0  T
   6    -49.5652388 -0.615725E-03  0.613E-02    2.79       1.0  T
   7    -49.5653116 -0.728234E-04  0.218E-02    2.79       1.0  T
   8    -49.5653145 -0.296817E-05  0.944E-03    2.79       1.8  T
   9    -49.5653156 -0.102554E-05  0.386E-03    2.79       4.3  T
  10    -49.5653157 -0.162217E-06  0.179E-03    2.79       9.3  T
  11    -49.5653158 -0.691353E-07  0.693E-04    2.79      24.1  T
  12    -49.5653158 -0.519830E-08  0.286E-04    2.79      58.3  T

   *** convergence criteria satisfied after 12 iterations ***

         #    Occupation            Energy/Eh            Energy/eV
      -------------------------------------------------------------
         1        2.0000           -0.7297556             -19.8577
       ...           ...                  ...                  ...
        40        2.0000           -0.4154998             -11.3063
        41        2.0000           -0.4116623             -11.2019
        42        2.0000           -0.4061574             -11.0521
        43        2.0000           -0.3947198             -10.7409
        44        2.0000           -0.3914763             -10.6526
        45        2.0000           -0.3820004             -10.3948
        46        2.0000           -0.3657231              -9.9518 (HOMO)
        47                         -0.2632831              -7.1643 (LUMO)
        48                         -0.2342836              -6.3752
        49                         -0.2196782              -5.9777
        50                         -0.2174012              -5.9158
        51                         -0.1951105              -5.3092
       ...                                ...                  ...
        95                          0.7017156              19.0947
      -------------------------------------------------------------
                  HL-Gap            0.1024400 Eh            2.7875 eV
             Fermi-level           -0.3145031 Eh           -8.5581 eV

 SCC (total)                   0 d,  0 h,  0 min,  0.065 sec
 SCC setup                      ...        0 min,  0.000 sec (  0.641%)
 Dispersion                     ...        0 min,  0.001 sec (  0.998%)
 integral evaluation            ...        0 min,  0.017 sec ( 25.556%)
 zeroth order Hamiltonian       ...        0 min,  0.000 sec (  0.414%)
 iterations                     ...        0 min,  0.024 sec ( 36.805%)
 molecular gradient             ...        0 min,  0.023 sec ( 34.766%)
 printout                       ...        0 min,  0.000 sec (  0.738%)

         :::::::::::::::::::::::::::::::::::::::::::::::::::::
         ::                     SUMMARY                     ::
         :::::::::::::::::::::::::::::::::::::::::::::::::::::
         :: total energy             -48.752947246548 Eh    ::
         :: gradient norm              0.051263659004 Eh/a0 ::
         :: HOMO-LUMO gap              2.787533637364 eV    ::
         ::.................................................::
         :: SCC energy               -49.565315810017 Eh    ::
         :: -> isotropic ES            0.003899107589 Eh    ::
         :: -> anisotropic ES          0.007988981627 Eh    ::
         :: -> anisotropic XC          0.031679622452 Eh    ::
         :: -> dispersion             -0.036205290461 Eh    ::
         :: repulsion energy           0.812308276736 Eh    ::
         :: add. restraining           0.000000000000 Eh    ::
         :::::::::::::::::::::::::::::::::::::::::::::::::::::

      ----------------------------------------------------------- 
     |                   =====================                   |
     |                        A N C O P T                        |
     |                   =====================                   |
     |               Approximate Normal Coordinate               |
     |                Rational Function Optimizer                |
      ----------------------------------------------------------- 

          ...................................................
          :                      SETUP                      :
          :.................................................:
          :   optimization level            normal          :
          :   max. optcycles                   200          :
          :   ANC micro-cycles                  20          :
          :   degrees of freedom               102          :
          :.................................................:
          :   RF solver                   davidson          :
          :   input Hessian                  false          :
          :   write xtbopt.log                true          :
          :   linear?                        false          :
          :   energy convergence         0.5000000E-05 Eh   :
          :   grad. convergence          0.1000000E-02 Eh/α :
          :   maximium RF displ.         2.0000000          :
          :   Hlow (freq-cutoff)         0.5000000E-02      :
          :   Hmax (freq-cutoff)         5.0000000          :
          :   S6 in model hess.         20.0000000          :
          ...................................................

generating ANC from model Hessian ...
Using Lindh-Hessian (1995)
 Shifting diagonal of input Hessian by   4.697171143656819E-003
 Lowest  eigenvalues of input Hessian
   -0.000000   -0.000000   -0.000000   -0.000000    0.000000    0.000000
    0.005000    0.005167    0.005450    0.005888    0.006544    0.007377
    0.007680    0.008262    0.009814    0.010952    0.012566    0.014977
 Highest eigenvalues
    1.809147    1.811573    1.884445    1.895281    1.925546    2.048071
 

........................................................................
.............................. CYCLE    1 ..............................
........................................................................
   1    -49.5653158 -0.495653E+02  0.157E-04    2.79       0.0  T
   2    -49.5653158 -0.616822E-10  0.130E-04    2.79     128.3  T
   3    -49.5653158 -0.451529E-09  0.599E-05    2.79     278.4  T
     SCC iter.                  ...        0 min,  0.007 sec
     gradient                   ...        0 min,  0.023 sec
 * total energy  :   -48.7529473 Eh     change       -0.3990301E-08 Eh
   gradient norm :     0.0512629 Eh/α   predicted     0.0000000E+00 (-100.00%)
   displ. norm   :     0.3135540 α      lambda       -0.6933780E-02
   maximum displ.:     0.1294440 α      in ANC's #5, #8, #22, ...

........................................................................
.............................. CYCLE    2 ..............................
........................................................................
   1    -49.6058284 -0.496058E+02  0.186E-01    2.81       0.0  T
   2    -49.6058520 -0.235780E-04  0.981E-02    2.81       1.0  T
   3    -49.6057612  0.908231E-04  0.570E-02    2.81       1.0  T
   4    -49.6058668 -0.105670E-03  0.187E-02    2.81       1.0  T
   5    -49.6058712 -0.433342E-05  0.796E-03    2.81       2.1  T
   6    -49.6058717 -0.518961E-06  0.261E-03    2.81       6.4  T
   7    -49.6058719 -0.196255E-06  0.770E-04    2.81      21.6  T
     SCC iter.                  ...        0 min,  0.013 sec
     gradient                   ...        0 min,  0.021 sec
 * total energy  :   -48.7574510 Eh     change       -0.4503789E-02 Eh
   gradient norm :     0.0179125 Eh/α   predicted    -0.3807744E-02 ( -15.45%)
   displ. norm   :     0.2953565 α      lambda       -0.1515348E-02
   maximum displ.:     0.1659262 α      in ANC's #5, #8, #6, ...

........................................................................
.............................. CYCLE    3 ..............................
........................................................................
   1    -49.6202628 -0.496203E+02  0.136E-01    2.82       0.0  T
   2    -49.6202727 -0.997134E-05  0.714E-02    2.82       1.0  T
   3    -49.6202487  0.240746E-04  0.313E-02    2.82       1.0  T
   4    -49.6202752 -0.265044E-04  0.127E-02    2.82       1.3  T
   5    -49.6202775 -0.234394E-05  0.529E-03    2.82       3.2  T
   6    -49.6202778 -0.254518E-06  0.181E-03    2.82       9.2  T
   7    -49.6202778 -0.817953E-07  0.779E-04    2.82      21.4  T
     SCC iter.                  ...        0 min,  0.013 sec
     gradient                   ...        0 min,  0.021 sec
 * total energy  :   -48.7585172 Eh     change       -0.1066128E-02 Eh
   gradient norm :     0.0056241 Eh/α   predicted    -0.8237718E-03 ( -22.73%)
   displ. norm   :     0.3606359 α      lambda       -0.8782076E-03
   maximum displ.:     0.2161282 α      in ANC's #5, #6, #8, ...

........................................................................
.............................. CYCLE    4 ..............................
........................................................................
   1    -49.6234762 -0.496235E+02  0.171E-01    2.83       0.0  T
   2    -49.6234851 -0.890988E-05  0.909E-02    2.83       1.0  T
   3    -49.6234787  0.646098E-05  0.226E-02    2.83       1.0  T
   4    -49.6234847 -0.601420E-05  0.139E-02    2.83       1.2  T
   5    -49.6234875 -0.279824E-05  0.481E-03    2.83       3.5  T
   6    -49.6234879 -0.385840E-06  0.182E-03    2.83       9.1  T
   7    -49.6234879 -0.575164E-07  0.110E-03    2.83      15.2  T
     SCC iter.                  ...        0 min,  0.013 sec
     gradient                   ...        0 min,  0.021 sec
 * total energy  :   -48.7592000 Eh     change       -0.6828627E-03 Eh
   gradient norm :     0.0060971 Eh/α   predicted    -0.4962189E-03 ( -27.33%)
   displ. norm   :     0.4237550 α      lambda       -0.7560701E-03
   maximum displ.:     0.2464681 α      in ANC's #5, #6, #8, ...

........................................................................
.............................. CYCLE    5 ..............................
........................................................................
   1    -49.6213303 -0.496213E+02  0.174E-01    2.83       0.0  T
   2    -49.6213355 -0.511602E-05  0.986E-02    2.83       1.0  T
   3    -49.6213294  0.607311E-05  0.205E-02    2.83       1.0  T
   4    -49.6213359 -0.650492E-05  0.113E-02    2.83       1.5  T
   5    -49.6213376 -0.169307E-05  0.288E-03    2.83       5.8  T
   6    -49.6213377 -0.789730E-07  0.174E-03    2.83       9.6  T
     SCC iter.                  ...        0 min,  0.012 sec
     gradient                   ...        0 min,  0.021 sec
 * total energy  :   -48.7597747 Eh     change       -0.5746729E-03 Eh
   gradient norm :     0.0075935 Eh/α   predicted    -0.4459482E-03 ( -22.40%)
   displ. norm   :     0.4531251 α      lambda       -0.6483566E-03
   maximum displ.:     0.2615764 α      in ANC's #5, #6, #2, ...

........................................................................
.............................. CYCLE    6 ..............................
........................................................................
   1    -49.6178786 -0.496179E+02  0.175E-01    2.83       0.0  T
   2    -49.6178827 -0.409721E-05  0.100E-01    2.83       1.0  T
   3    -49.6178814  0.123933E-05  0.147E-02    2.83       1.1  T
   4    -49.6178826 -0.114251E-05  0.102E-02    2.83       1.6  T
   5    -49.6178843 -0.174632E-05  0.276E-03    2.83       6.0  T
   6    -49.6178844 -0.452461E-07  0.200E-03    2.83       8.4  T
     SCC iter.                  ...        0 min,  0.012 sec
     gradient                   ...        0 min,  0.021 sec
 * total energy  :   -48.7602387 Eh     change       -0.4639666E-03 Eh
   gradient norm :     0.0089735 Eh/α   predicted    -0.3907693E-03 ( -15.78%)
   displ. norm   :     0.4336668 α      lambda       -0.5338414E-03
   maximum displ.:     0.2478706 α      in ANC's #5, #6, #2, ...

........................................................................
.............................. CYCLE    7 ..............................
........................................................................
   1    -49.6168589 -0.496169E+02  0.169E-01    2.84       0.0  T
   2    -49.6168628 -0.384302E-05  0.972E-02    2.84       1.0  T
   3    -49.6168589  0.389616E-05  0.167E-02    2.84       1.0  T
   4    -49.6168624 -0.353064E-05  0.113E-02    2.84       1.5  T
   5    -49.6168644 -0.202267E-05  0.360E-03    2.84       4.6  T
   6    -49.6168646 -0.184461E-06  0.200E-03    2.84       8.4  T
   7    -49.6168646 -0.145504E-07  0.116E-03    2.84      14.4  T
     SCC iter.                  ...        0 min,  0.013 sec
     gradient                   ...        0 min,  0.021 sec
 * total energy  :   -48.7606434 Eh     change       -0.4047529E-03 Eh
   gradient norm :     0.0091991 Eh/α   predicted    -0.3171203E-03 ( -21.65%)
   displ. norm   :     0.4251056 α      lambda       -0.5140210E-03
   maximum displ.:     0.2309613 α      in ANC's #5, #2, #1, ...

........................................................................
.............................. CYCLE    8 ..............................
........................................................................
   1    -49.6192633 -0.496193E+02  0.181E-01    2.86       0.0  T
   2    -49.6192698 -0.654350E-05  0.100E-01    2.86       1.0  T
   3    -49.6192654  0.445700E-05  0.204E-02    2.86       1.0  T
   4    -49.6192705 -0.511538E-05  0.116E-02    2.86       1.4  T
   5    -49.6192723 -0.178366E-05  0.386E-03    2.86       4.3  T
   6    -49.6192725 -0.208104E-06  0.205E-03    2.86       8.1  T
   7    -49.6192725 -0.318622E-07  0.143E-03    2.86      11.7  T
     SCC iter.                  ...        0 min,  0.014 sec
     gradient                   ...        0 min,  0.022 sec
 * total energy  :   -48.7610371 Eh     change       -0.3936318E-03 Eh
   gradient norm :     0.0062981 Eh/α   predicted    -0.3034570E-03 ( -22.91%)
   displ. norm   :     0.4312172 α      lambda       -0.4233026E-03
   maximum displ.:     0.2029625 α      in ANC's #5, #2, #1, ...

........................................................................
.............................. CYCLE    9 ..............................
........................................................................
   1    -49.6215971 -0.496216E+02  0.210E-01    2.87       0.0  T
   2    -49.6216061 -0.897487E-05  0.115E-01    2.87       1.0  T
   3    -49.6215983  0.781775E-05  0.251E-02    2.87       1.0  T
   4    -49.6216073 -0.901490E-05  0.134E-02    2.87       1.2  T
   5    -49.6216093 -0.199600E-05  0.497E-03    2.87       3.4  T
   6    -49.6216099 -0.562337E-06  0.216E-03    2.87       7.7  T
   7    -49.6216099 -0.435866E-07  0.134E-03    2.87      12.4  T
     SCC iter.                  ...        0 min,  0.014 sec
     gradient                   ...        0 min,  0.022 sec
 * total energy  :   -48.7613557 Eh     change       -0.3186370E-03 Eh
   gradient norm :     0.0066797 Eh/α   predicted    -0.2510082E-03 ( -21.22%)
   displ. norm   :     0.4092988 α      lambda       -0.3560164E-03
   maximum displ.:     0.2012588 α      in ANC's #2, #1, #7, ...

........................................................................
.............................. CYCLE   10 ..............................
........................................................................
   1    -49.6245946 -0.496246E+02  0.239E-01    2.90       0.0  T
   2    -49.6246085 -0.139167E-04  0.125E-01    2.89       1.0  T
   3    -49.6245858  0.227309E-04  0.349E-02    2.89       1.0  T
   4    -49.6246121 -0.263073E-04  0.167E-02    2.89       1.0  T
   5    -49.6246143 -0.214822E-05  0.650E-03    2.89       2.6  T
   6    -49.6246153 -0.106948E-05  0.191E-03    2.89       8.7  T
   7    -49.6246154 -0.241807E-07  0.116E-03    2.89      14.3  T
     SCC iter.                  ...        0 min,  0.013 sec
     gradient                   ...        0 min,  0.022 sec
 * total energy  :   -48.7615973 Eh     change       -0.2415698E-03 Eh
   gradient norm :     0.0057274 Eh/α   predicted    -0.2078362E-03 ( -13.96%)
   displ. norm   :     0.5141216 α      lambda       -0.2956025E-03
   maximum displ.:     0.2688554 α      in ANC's #2, #1, #7, ...

........................................................................
.............................. CYCLE   11 ..............................
........................................................................
   1    -49.6206783 -0.496207E+02  0.279E-01    2.89       0.0  T
   2    -49.6206943 -0.159841E-04  0.149E-01    2.89       1.0  T
   3    -49.6206808  0.134698E-04  0.334E-02    2.89       1.0  T
   4    -49.6206943 -0.135458E-04  0.193E-02    2.89       1.0  T
   5    -49.6206999 -0.556888E-05  0.571E-03    2.89       2.9  T
   6    -49.6207007 -0.823984E-06  0.209E-03    2.89       8.0  T
   7    -49.6207007 -0.434463E-08  0.116E-03    2.89      14.3  T
     SCC iter.                  ...        0 min,  0.013 sec
     gradient                   ...        0 min,  0.022 sec
 * total energy  :   -48.7617311 Eh     change       -0.1338310E-03 Eh
   gradient norm :     0.0095821 Eh/α   predicted    -0.1868697E-03 (  39.63%)
   displ. norm   :     0.1932322 α      lambda       -0.2726157E-03
   maximum displ.:     0.1104506 α      in ANC's #2, #1, #3, ...

........................................................................
.............................. CYCLE   12 ..............................
........................................................................
   1    -49.6260371 -0.496260E+02  0.127E-01    2.90       0.0  T
   2    -49.6260415 -0.438653E-05  0.662E-02    2.90       1.0  T
   3    -49.6260419 -0.376388E-06  0.113E-02    2.90       1.5  T
   4    -49.6260412  0.714698E-06  0.724E-03    2.90       2.3  T
   5    -49.6260426 -0.140083E-05  0.127E-03    2.90      13.1  T
   6    -49.6260426 -0.410474E-07  0.496E-04    2.90      33.6  T
     SCC iter.                  ...        0 min,  0.012 sec
     gradient                   ...        0 min,  0.022 sec
 * total energy  :   -48.7618285 Eh     change       -0.9739290E-04 Eh
   gradient norm :     0.0084761 Eh/α   predicted    -0.1413985E-03 (  45.18%)
   displ. norm   :     0.1762532 α      lambda       -0.2106533E-03
   maximum displ.:     0.1062774 α      in ANC's #2, #1, #7, ...

........................................................................
.............................. CYCLE   13 ..............................
........................................................................
   1    -49.6258314 -0.496258E+02  0.928E-02    2.90       0.0  T
   2    -49.6258351 -0.363827E-05  0.498E-02    2.90       1.0  T
   3    -49.6258294  0.568060E-05  0.162E-02    2.90       1.0  T
   4    -49.6258360 -0.661074E-05  0.647E-03    2.90       2.6  T
   5    -49.6258363 -0.326503E-06  0.271E-03    2.90       6.1  T
   6    -49.6258365 -0.124310E-06  0.105E-03    2.90      15.9  T
     SCC iter.                  ...        0 min,  0.012 sec
     gradient                   ...        0 min,  0.022 sec
 * total energy  :   -48.7619281 Eh     change       -0.9959258E-04 Eh
   gradient norm :     0.0063092 Eh/α   predicted    -0.1086005E-03 (   9.04%)
   displ. norm   :     0.2208892 α      lambda       -0.1006579E-03
   maximum displ.:     0.1465290 α      in ANC's #2, #1, #3, ...

........................................................................
.............................. CYCLE   14 ..............................
........................................................................
   1    -49.6234835 -0.496235E+02  0.114E-01    2.90       0.0  T
   2    -49.6234861 -0.267344E-05  0.609E-02    2.90       1.0  T
   3    -49.6234849  0.120294E-05  0.122E-02    2.90       1.4  T
   4    -49.6234859 -0.981178E-06  0.760E-03    2.90       2.2  T
   5    -49.6234870 -0.111879E-05  0.141E-03    2.90      11.8  T
   6    -49.6234871 -0.355653E-07  0.747E-04    2.90      22.3  T
     SCC iter.                  ...        0 min,  0.012 sec
     gradient                   ...        0 min,  0.022 sec
 * total energy  :   -48.7619924 Eh     change       -0.6432888E-04 Eh
   gradient norm :     0.0030376 Eh/α   predicted    -0.5278815E-04 ( -17.94%)
   displ. norm   :     0.1055498 α      lambda       -0.7484806E-04
   maximum displ.:     0.0708009 α      in ANC's #2, #4, #3, ...

........................................................................
.............................. CYCLE   15 ..............................
........................................................................
   1    -49.6243787 -0.496244E+02  0.411E-02    2.90       0.0  T
   2    -49.6243791 -0.381105E-06  0.231E-02    2.90       1.0  T
   3    -49.6243778  0.133433E-05  0.733E-03    2.90       2.3  T
   4    -49.6243792 -0.145140E-05  0.253E-03    2.90       6.6  T
   5    -49.6243793 -0.676708E-07  0.881E-04    2.90      18.9  T
   6    -49.6243793 -0.155768E-07  0.329E-04    2.90      50.6  T
     SCC iter.                  ...        0 min,  0.012 sec
     gradient                   ...        0 min,  0.023 sec
 * total energy  :   -48.7620445 Eh     change       -0.5212981E-04 Eh
   gradient norm :     0.0026659 Eh/α   predicted    -0.3784133E-04 ( -27.41%)
   displ. norm   :     0.1702940 α      lambda       -0.8274984E-04
   maximum displ.:     0.1120982 α      in ANC's #2, #3, #4, ...

........................................................................
.............................. CYCLE   16 ..............................
........................................................................
   1    -49.6251460 -0.496251E+02  0.698E-02    2.89       0.0  T
   2    -49.6251467 -0.688487E-06  0.392E-02    2.89       1.0  T
   3    -49.6251396  0.714093E-05  0.168E-02    2.90       1.0  T
   4    -49.6251476 -0.800630E-05  0.383E-03    2.89       4.4  T
   5    -49.6251475  0.637089E-07  0.197E-03    2.89       8.4  T
   6    -49.6251477 -0.121680E-06  0.367E-04    2.89      45.4  T
   7    -49.6251477 -0.235197E-08  0.165E-04    2.89     100.9  T
     SCC iter.                  ...        0 min,  0.013 sec
     gradient                   ...        0 min,  0.023 sec
 * total energy  :   -48.7621024 Eh     change       -0.5782494E-04 Eh
   gradient norm :     0.0040742 Eh/α   predicted    -0.4257885E-04 ( -26.37%)
   displ. norm   :     0.2004103 α      lambda       -0.6668516E-04
   maximum displ.:     0.1381222 α      in ANC's #2, #3, #1, ...

........................................................................
.............................. CYCLE   17 ..............................
........................................................................
   1    -49.6245229 -0.496245E+02  0.794E-02    2.90       0.0  T
   2    -49.6245237 -0.755619E-06  0.447E-02    2.90       1.0  T
   3    -49.6245230  0.714629E-06  0.771E-03    2.90       2.2  T
   4    -49.6245238 -0.782369E-06  0.385E-03    2.90       4.3  T
   5    -49.6245240 -0.211160E-06  0.821E-04    2.90      20.3  T
   6    -49.6245240 -0.223311E-07  0.233E-04    2.90      71.6  T
     SCC iter.                  ...        0 min,  0.012 sec
     gradient                   ...        0 min,  0.022 sec
 * total energy  :   -48.7621539 Eh     change       -0.5155102E-04 Eh
   gradient norm :     0.0038496 Eh/α   predicted    -0.3468248E-04 ( -32.72%)
   displ. norm   :     0.1975932 α      lambda       -0.5876440E-04
   maximum displ.:     0.1374283 α      in ANC's #2, #3, #4, ...

........................................................................
.............................. CYCLE   18 ..............................
........................................................................
   1    -49.6244650 -0.496245E+02  0.764E-02    2.90       0.0  T
   2    -49.6244655 -0.574393E-06  0.434E-02    2.90       1.0  T
   3    -49.6244639  0.168475E-05  0.826E-03    2.90       2.0  T
   4    -49.6244656 -0.176608E-05  0.386E-03    2.90       4.3  T
   5    -49.6244658 -0.204432E-06  0.120E-03    2.90      13.9  T
   6    -49.6244659 -0.413988E-07  0.192E-04    2.90      86.8  T
   7    -49.6244659 -0.435143E-09  0.106E-04    2.90     157.8  T
     SCC iter.                  ...        0 min,  0.013 sec
     gradient                   ...        0 min,  0.023 sec
 * total energy  :   -48.7621996 Eh     change       -0.4565573E-04 Eh
   gradient norm :     0.0026654 Eh/α   predicted    -0.3053402E-04 ( -33.12%)
   displ. norm   :     0.1769737 α      lambda       -0.4467718E-04
   maximum displ.:     0.1273634 α      in ANC's #2, #3, #1, ...

........................................................................
.............................. CYCLE   19 ..............................
........................................................................
   1    -49.6239780 -0.496240E+02  0.724E-02    2.90       0.0  T
   2    -49.6239787 -0.643624E-06  0.406E-02    2.90       1.0  T
   3    -49.6239773  0.134647E-05  0.822E-03    2.90       2.0  T
   4    -49.6239788 -0.142473E-05  0.402E-03    2.90       4.1  T
   5    -49.6239790 -0.202248E-06  0.115E-03    2.90      14.5  T
   6    -49.6239790 -0.430660E-07  0.206E-04    2.90      80.8  T
   7    -49.6239790 -0.558572E-09  0.110E-04    2.90     151.9  T
     SCC iter.                  ...        0 min,  0.013 sec
     gradient                   ...        0 min,  0.023 sec
 * total energy  :   -48.7622323 Eh     change       -0.3270255E-04 Eh
   gradient norm :     0.0014962 Eh/α   predicted    -0.2303975E-04 ( -29.55%)
   displ. norm   :     0.2392304 α      lambda       -0.2949340E-04
   maximum displ.:     0.1717230 α      in ANC's #2, #3, #1, ...

........................................................................
.............................. CYCLE   20 ..............................
........................................................................
   1    -49.6243325 -0.496243E+02  0.990E-02    2.91       0.0  T
   2    -49.6243337 -0.119576E-05  0.555E-02    2.91       1.0  T
   3    -49.6243292  0.449266E-05  0.138E-02    2.91       1.2  T
   4    -49.6243341 -0.489774E-05  0.561E-03    2.91       3.0  T
   5    -49.6243344 -0.286252E-06  0.182E-03    2.91       9.2  T
   6    -49.6243345 -0.110963E-06  0.253E-04    2.91      65.8  T
   7    -49.6243345 -0.714415E-09  0.152E-04    2.91     109.9  T
     SCC iter.                  ...        0 min,  0.013 sec
     gradient                   ...        0 min,  0.023 sec
 * total energy  :   -48.7622583 Eh     change       -0.2601599E-04 Eh
   gradient norm :     0.0023117 Eh/α   predicted    -0.1512557E-04 ( -41.86%)
   displ. norm   :     0.0859647 α      lambda       -0.1846331E-04
   maximum displ.:     0.0590750 α      in ANC's #2, #3, #1, ...
 * RMSD in coord.:     0.7690238 α      energy gain  -0.9311040E-02 Eh

generating ANC from model Hessian ...
Using Lindh-Hessian (1995)
 Shifting diagonal of input Hessian by   4.692935104347189E-003
 Lowest  eigenvalues of input Hessian
    0.000000    0.000000    0.000000    0.000000    0.000000    0.000000
    0.005000    0.005183    0.005530    0.006090    0.006701    0.007236
    0.007800    0.008724    0.010532    0.011330    0.012959    0.015568
 Highest eigenvalues
    1.863423    1.892719    1.948997    1.970384    2.024863    2.070389
 

........................................................................
.............................. CYCLE   21 ..............................
........................................................................
   1    -49.6243948 -0.496244E+02  0.408E-02    2.91       0.0  T
   2    -49.6243952 -0.326607E-06  0.220E-02    2.91       1.0  T
   3    -49.6243952 -0.257563E-07  0.350E-03    2.91       4.8  T
   4    -49.6243951  0.121450E-06  0.236E-03    2.91       7.1  T
   5    -49.6243953 -0.181757E-06  0.392E-04    2.91      42.5  T
   6    -49.6243953 -0.436253E-08  0.983E-05    2.91     169.5  T
     SCC iter.                  ...        0 min,  0.012 sec
     gradient                   ...        0 min,  0.023 sec
 * total energy  :   -48.7622732 Eh     change       -0.1495909E-04 Eh
   gradient norm :     0.0019712 Eh/α   predicted     0.0000000E+00 (-100.00%)
   displ. norm   :     0.0720719 α      lambda       -0.2073455E-04
   maximum displ.:     0.0443105 α      in ANC's #4, #3, #6, ...

........................................................................
.............................. CYCLE   22 ..............................
........................................................................
   1    -49.6248661 -0.496249E+02  0.378E-02    2.90       0.0  T
   2    -49.6248664 -0.338421E-06  0.201E-02    2.90       1.0  T
   3    -49.6248661  0.364820E-06  0.497E-03    2.90       3.4  T
   4    -49.6248665 -0.421890E-06  0.247E-03    2.90       6.7  T
   5    -49.6248665 -0.542531E-07  0.828E-04    2.90      20.1  T
   6    -49.6248666 -0.219697E-07  0.165E-04    2.90     101.1  T
     SCC iter.                  ...        0 min,  0.012 sec
     gradient                   ...        0 min,  0.023 sec
 * total energy  :   -48.7622974 Eh     change       -0.2417386E-04 Eh
   gradient norm :     0.0008748 Eh/α   predicted    -0.1040095E-04 ( -56.97%)
   displ. norm   :     0.0718476 α      lambda       -0.1614974E-04
   maximum displ.:     0.0364992 α      in ANC's #4, #3, #6, ...

........................................................................
.............................. CYCLE   23 ..............................
........................................................................
   1    -49.6249337 -0.496249E+02  0.432E-02    2.90       0.0  T
   2    -49.6249342 -0.483083E-06  0.226E-02    2.90       1.0  T
   3    -49.6249335  0.695153E-06  0.638E-03    2.90       2.6  T
   4    -49.6249343 -0.823816E-06  0.292E-03    2.90       5.7  T
   5    -49.6249343 -0.597360E-07  0.808E-04    2.90      20.6  T
   6    -49.6249344 -0.207417E-07  0.174E-04    2.90      95.8  T
     SCC iter.                  ...        0 min,  0.012 sec
     gradient                   ...        0 min,  0.023 sec
 * total energy  :   -48.7623156 Eh     change       -0.1815973E-04 Eh
   gradient norm :     0.0009902 Eh/α   predicted    -0.8093669E-05 ( -55.43%)
   displ. norm   :     0.1424432 α      lambda       -0.2258692E-04
   maximum displ.:     0.0732262 α      in ANC's #4, #3, #6, ...

........................................................................
.............................. CYCLE   24 ..............................
........................................................................
   1    -49.6245377 -0.496245E+02  0.792E-02    2.89       0.0  T
   2    -49.6245392 -0.150628E-05  0.417E-02    2.89       1.0  T
   3    -49.6245387  0.472485E-06  0.849E-03    2.89       2.0  T
   4    -49.6245391 -0.413642E-06  0.530E-03    2.89       3.1  T
   5    -49.6245396 -0.493306E-06  0.105E-03    2.89      15.9  T
   6    -49.6245397 -0.370441E-07  0.238E-04    2.89      70.0  T
   7    -49.6245397 -0.147514E-08  0.847E-05    2.89     196.8  T
     SCC iter.                  ...        0 min,  0.013 sec
     gradient                   ...        0 min,  0.024 sec
 * total energy  :   -48.7623376 Eh     change       -0.2202428E-04 Eh
   gradient norm :     0.0019164 Eh/α   predicted    -0.1139558E-04 ( -48.26%)
   displ. norm   :     0.1402968 α      lambda       -0.1745655E-04
   maximum displ.:     0.0757727 α      in ANC's #4, #3, #6, ...

........................................................................
.............................. CYCLE   25 ..............................
........................................................................
   1    -49.6244108 -0.496244E+02  0.846E-02    2.88       0.0  T
   2    -49.6244126 -0.181272E-05  0.438E-02    2.88       1.0  T
   3    -49.6244126 -0.282242E-08  0.800E-03    2.88       2.1  T
   4    -49.6244124  0.228761E-06  0.587E-03    2.88       2.8  T
   5    -49.6244131 -0.713259E-06  0.788E-04    2.88      21.1  T
   6    -49.6244131 -0.206356E-07  0.250E-04    2.88      66.7  T
     SCC iter.                  ...        0 min,  0.012 sec
     gradient                   ...        0 min,  0.023 sec
 * total energy  :   -48.7623526 Eh     change       -0.1504368E-04 Eh
   gradient norm :     0.0017346 Eh/α   predicted    -0.8809054E-05 ( -41.44%)
   displ. norm   :     0.1012845 α      lambda       -0.1290449E-04
   maximum displ.:     0.0563992 α      in ANC's #3, #4, #7, ...

........................................................................
.............................. CYCLE   26 ..............................
........................................................................
   1    -49.6247899 -0.496248E+02  0.783E-02    2.88       0.0  T
   2    -49.6247918 -0.182396E-05  0.389E-02    2.88       1.0  T
   3    -49.6247918  0.700751E-09  0.714E-03    2.88       2.3  T
   4    -49.6247916  0.124496E-06  0.513E-03    2.88       3.2  T
   5    -49.6247922 -0.596376E-06  0.981E-04    2.88      17.0  T
   6    -49.6247923 -0.242026E-07  0.304E-04    2.88      54.8  T
     SCC iter.                  ...        0 min,  0.012 sec
     gradient                   ...        0 min,  0.023 sec
 * total energy  :   -48.7623660 Eh     change       -0.1338934E-04 Eh
   gradient norm :     0.0009301 Eh/α   predicted    -0.6483175E-05 ( -51.58%)
   displ. norm   :     0.1188043 α      lambda       -0.1300922E-04
   maximum displ.:     0.0690927 α      in ANC's #3, #4, #2, ...

........................................................................
.............................. CYCLE   27 ..............................
........................................................................
   1    -49.6249790 -0.496250E+02  0.854E-02    2.89       0.0  T
   2    -49.6249809 -0.191245E-05  0.437E-02    2.89       1.0  T
   3    -49.6249807  0.165568E-06  0.818E-03    2.89       2.0  T
   4    -49.6249809 -0.139344E-06  0.576E-03    2.89       2.9  T
   5    -49.6249814 -0.567377E-06  0.783E-04    2.89      21.3  T
   6    -49.6249815 -0.221136E-07  0.268E-04    2.89      62.1  T
     SCC iter.                  ...        0 min,  0.012 sec
     gradient                   ...        0 min,  0.023 sec
 * total energy  :   -48.7623807 Eh     change       -0.1463159E-04 Eh
   gradient norm :     0.0009560 Eh/α   predicted    -0.6546821E-05 ( -55.26%)
   displ. norm   :     0.1465906 α      lambda       -0.1409432E-04
   maximum displ.:     0.0858607 α      in ANC's #3, #4, #2, ...

........................................................................
.............................. CYCLE   28 ..............................
........................................................................
   1    -49.6247219 -0.496247E+02  0.120E-01    2.90       0.0  T
   2    -49.6247257 -0.382376E-05  0.605E-02    2.90       1.0  T
   3    -49.6247261 -0.394758E-06  0.105E-02    2.89       1.6  T
   4    -49.6247255  0.659329E-06  0.754E-03    2.90       2.2  T
   5    -49.6247267 -0.123174E-05  0.104E-03    2.89      16.0  T
   6    -49.6247267 -0.384950E-07  0.314E-04    2.89      53.1  T
   7    -49.6247267 -0.650978E-09  0.177E-04    2.89      94.3  T
     SCC iter.                  ...        0 min,  0.013 sec
     gradient                   ...        0 min,  0.023 sec
 * total energy  :   -48.7623976 Eh     change       -0.1694756E-04 Eh
   gradient norm :     0.0013251 Eh/α   predicted    -0.7115356E-05 ( -58.02%)
   displ. norm   :     0.1902277 α      lambda       -0.1701737E-04
   maximum displ.:     0.1120751 α      in ANC's #3, #4, #2, ...

........................................................................
.............................. CYCLE   29 ..............................
........................................................................
   1    -49.6244938 -0.496245E+02  0.149E-01    2.90       0.0  T
   2    -49.6244993 -0.549742E-05  0.762E-02    2.90       1.0  T
   3    -49.6245003 -0.100332E-05  0.126E-02    2.90       1.3  T
   4    -49.6244992  0.105992E-05  0.707E-03    2.90       2.4  T
   5    -49.6245006 -0.143589E-05  0.648E-04    2.90      25.7  T
   6    -49.6245006 -0.106481E-07  0.310E-04    2.90      53.8  T
   7    -49.6245006 -0.815611E-09  0.170E-04    2.90      98.0  T
     SCC iter.                  ...        0 min,  0.013 sec
     gradient                   ...        0 min,  0.023 sec
 * total energy  :   -48.7624169 Eh     change       -0.1932845E-04 Eh
   gradient norm :     0.0012411 Eh/α   predicted    -0.8649260E-05 ( -55.25%)
   displ. norm   :     0.1884965 α      lambda       -0.1322719E-04
   maximum displ.:     0.1145454 α      in ANC's #3, #2, #4, ...

........................................................................
.............................. CYCLE   30 ..............................
........................................................................
   1    -49.6242977 -0.496243E+02  0.149E-01    2.91       0.0  T
   2    -49.6243032 -0.557834E-05  0.759E-02    2.91       1.0  T
   3    -49.6243040 -0.722333E-06  0.131E-02    2.91       1.3  T
   4    -49.6243027  0.130687E-05  0.861E-03    2.91       1.9  T
   5    -49.6243047 -0.199429E-05  0.999E-04    2.91      16.7  T
   6    -49.6243047 -0.316203E-07  0.358E-04    2.91      46.6  T
   7    -49.6243047 -0.107225E-08  0.194E-04    2.91      86.0  T
     SCC iter.                  ...        0 min,  0.013 sec
     gradient                   ...        0 min,  0.023 sec
 * total energy  :   -48.7624309 Eh     change       -0.1399971E-04 Eh
   gradient norm :     0.0008034 Eh/α   predicted    -0.6720270E-05 ( -52.00%)
   displ. norm   :     0.1886571 α      lambda        0.1172252E-05
   maximum displ.:     0.1145498 α      in ANC's #3, #2, #4, ...

........................................................................
.............................. CYCLE   31 ..............................
........................................................................
   1    -49.6234984 -0.496235E+02  0.149E-01    2.91       0.0  T
   2    -49.6235040 -0.557731E-05  0.761E-02    2.91       1.0  T
   3    -49.6235044 -0.361966E-06  0.136E-02    2.91       1.2  T
   4    -49.6235035  0.906703E-06  0.918E-03    2.91       1.8  T
   5    -49.6235055 -0.198574E-05  0.120E-03    2.91      13.9  T
   6    -49.6235055 -0.468332E-07  0.378E-04    2.91      44.0  T
   7    -49.6235055 -0.143245E-08  0.206E-04    2.91      81.1  T
     SCC iter.                  ...        0 min,  0.013 sec
     gradient                   ...        0 min,  0.024 sec
 * total energy  :   -48.7624315 Eh     change       -0.5252398E-06 Eh
   gradient norm :     0.0017039 Eh/α   predicted     0.5903475E-06 (-212.40%)
   displ. norm   :     0.0276556 α      lambda       -0.1059680E-04
   maximum displ.:     0.0128516 α      in ANC's #7, #6, #5, ...

........................................................................
.............................. CYCLE   32 ..............................
........................................................................
   1    -49.6248614 -0.496249E+02  0.280E-02    2.91       0.0  T
   2    -49.6248616 -0.268208E-06  0.138E-02    2.91       1.2  T
   3    -49.6248614  0.237636E-06  0.395E-03    2.91       4.2  T
   4    -49.6248617 -0.331801E-06  0.171E-03    2.91       9.8  T
   5    -49.6248617 -0.237426E-08  0.702E-04    2.91      23.7  T
   6    -49.6248617 -0.141533E-07  0.179E-04    2.91      92.9  T
     SCC iter.                  ...        0 min,  0.012 sec
     gradient                   ...        0 min,  0.023 sec
 * total energy  :   -48.7624398 Eh     change       -0.8342028E-05 Eh
   gradient norm :     0.0006944 Eh/α   predicted    -0.5304250E-05 ( -36.42%)
   displ. norm   :     0.0377903 α      lambda       -0.3798347E-05
   maximum displ.:     0.0258959 α      in ANC's #3, #2, #4, ...

........................................................................
.............................. CYCLE   33 ..............................
........................................................................
   1    -49.6250196 -0.496250E+02  0.185E-02    2.91       0.0  T
   2    -49.6250197 -0.680641E-07  0.101E-02    2.91       1.7  T
   3    -49.6250197  0.218118E-07  0.184E-03    2.91       9.0  T
   4    -49.6250197 -0.106505E-07  0.126E-03    2.91      13.3  T
   5    -49.6250197 -0.308151E-07  0.232E-04    2.91      71.9  T
   6    -49.6250197 -0.174845E-08  0.951E-05    2.91     175.3  T
     SCC iter.                  ...        0 min,  0.012 sec
     gradient                   ...        0 min,  0.023 sec
 * total energy  :   -48.7624442 Eh     change       -0.4384309E-05 Eh
   gradient norm :     0.0005409 Eh/α   predicted    -0.1903272E-05 ( -56.59%)
   displ. norm   :     0.0378908 α      lambda       -0.1696019E-05
   maximum displ.:     0.0259045 α      in ANC's #3, #2, #4, ...

   *** GEOMETRY OPTIMIZATION CONVERGED AFTER 33 ITERATIONS ***

------------------------------------------------------------------------
 total energy gain   :        -0.0094969 Eh       -5.9594 kcal/mol
 total RMSD          :         0.8454224 a0        0.4474 Å
 total power (kW/mol):        -0.7555829 (step)  -14.1307 (real)
------------------------------------------------------------------------

 ANCopt (total)                0 d,  0 h,  0 min,  1.765 sec
 optimizer setup                ...        0 min,  0.000 sec (  0.008%)
 model hessian                  ...        0 min,  0.020 sec (  1.153%)
 ANC generation                 ...        0 min,  0.003 sec (  0.144%)
 coordinate transformation      ...        0 min,  0.001 sec (  0.046%)
 single point calculation       ...        0 min,  1.726 sec ( 97.842%)
 optimization log               ...        0 min,  0.005 sec (  0.257%)
 hessian update                 ...        0 min,  0.001 sec (  0.034%)
 rational function              ...        0 min,  0.007 sec (  0.391%)

================
 final structure:
================
$coord
    0.38232404980582    2.83942290193444   -5.59468834602803      C 
   -1.62171968404151    0.32105645630279   -5.97451987524373      S 
   -0.19768270636753   -1.24267696782477   -3.50217747952781      C 
    1.68422028038705    0.12821270205356   -2.44499957269462      C 
    2.03272199119633    2.52465248222571   -3.62958229066029      C 
    3.93197523800129    4.38614920277895   -2.96758068314954      C 
    4.84917783965583    4.87047423130601   -0.64670328980222      C 
    7.00690080237127    6.70299760303305   -0.33476501392092      C 
    9.48417231750476    5.35178074362684    0.08330739665151      C 
   10.18692072604925    3.34410733251601   -1.45388462978670      C 
   12.46461319272204    2.11893235899313   -1.09022588879645      C 
   14.10364098735874    2.86009754213606    0.82059735630231      C 
   16.61205720435386    1.57823407614274    1.17045564772184      C 
   18.67397396240457    2.96240419533923   -0.30983498046948      C 
   13.40418573746174    4.87453327778768    2.34888417171194      C 
   11.12634260124815    6.10289466070535    1.98690365490982      C 
    3.79538775945583    3.73709949543791    1.62236967621155      C 
    4.93387004487939    3.60411185790174    3.85722752159285      C 
    0.20561876944143    4.44401320599590   -6.81916727925779      H 
   -0.84420962487120   -3.09523280842049   -2.99856904650530      H 
    2.85297020345570   -0.54756766413279   -0.92692490654628      H 
    4.65262953305985    5.46222908328091   -4.55454090541070      H 
    6.63303162657168    7.96245031830072    1.25638337100464      H 
    7.17002359906979    7.85856832031513   -2.04146723155549      H 
    8.93156451570590    2.73334118286570   -2.94426867434291      H 
   12.97601405232997    0.55797727248277   -2.30503154034789      H 
   16.49725219222206   -0.37432772086679    0.51301980256575      H 
   17.11331426460098    1.55633001699659    3.17262717584545      H 
   18.22124466434127    2.98323813445458   -2.31489019588127      H 
   20.49043268935606    2.03466367690840   -0.05551162133846      H 
   18.83399932567582    4.90754028959946    0.33513247526134      H 
   14.65286417315330    5.48320471716787    3.84690737059211      H 
   10.62090837577768    7.66782761662113    3.20143779666037      H 
    1.89280616641062    3.01054882352582    1.42960915362955      H 
    6.83767939019242    4.25188285780467    4.15570936261671      H 
    4.00003678766393    2.78473706960157    5.46919023330990      H 
$end
           -------------------------------------------------
          |                Final Singlepoint                |
           -------------------------------------------------

          ...................................................
          :                      SETUP                      :
          :.................................................:
          :  # basis functions                  96          :
          :  # atomic orbitals                  95          :
          :  # shells                           55          :
          :  # electrons                        92          :
          :  max. iterations                   250          :
          :  Hamiltonian                  GFN2-xTB          :
          :  restarted?                      false          :
          :  GBSA solvation                  false          :
          :  PC potential                    false          :
          :  electronic temp.          300.0000000     K    :
          :  accuracy                    1.0000000          :
          :  -> integral cutoff          0.2500000E+02      :
          :  -> integral neglect         0.1000000E-07      :
          :  -> SCF convergence          0.1000000E-05 Eh   :
          :  -> wf. convergence          0.1000000E-03 e    :
          :  Broyden damping             0.4000000          :
          ...................................................

 iter      E             dE          RMSdq      gap      omega  full diag
   1    -49.6250197 -0.496250E+02  0.382E-05    2.91       0.0  T
   2    -49.6250197 -0.342482E-11  0.207E-05    2.91     806.2  T
   3    -49.6250197 -0.726885E-11  0.180E-05    2.91     928.0  T

   *** convergence criteria satisfied after 3 iterations ***

         #    Occupation            Energy/Eh            Energy/eV
      -------------------------------------------------------------
         1        2.0000           -0.7276978             -19.8017
       ...           ...                  ...                  ...
        40        2.0000           -0.4160790             -11.3221
        41        2.0000           -0.4126855             -11.2297
        42        2.0000           -0.4040037             -10.9935
        43        2.0000           -0.3983143             -10.8387
        44        2.0000           -0.3928643             -10.6904
        45        2.0000           -0.3828283             -10.4173
        46        2.0000           -0.3666415              -9.9768 (HOMO)
        47                         -0.2598027              -7.0696 (LUMO)
        48                         -0.2297520              -6.2519
        49                         -0.2167188              -5.8972
        50                         -0.2147239              -5.8429
        51                         -0.1963993              -5.3443
       ...                                ...                  ...
        95                          0.7062508              19.2181
      -------------------------------------------------------------
                  HL-Gap            0.1068389 Eh            2.9072 eV
             Fermi-level           -0.3132221 Eh           -8.5232 eV

 SCC (total)                   0 d,  0 h,  0 min,  0.048 sec
 SCC setup                      ...        0 min,  0.000 sec (  0.671%)
 Dispersion                     ...        0 min,  0.001 sec (  1.113%)
 integral evaluation            ...        0 min,  0.017 sec ( 34.159%)
 zeroth order Hamiltonian       ...        0 min,  0.000 sec (  0.501%)
 iterations                     ...        0 min,  0.007 sec ( 14.085%)
 molecular gradient             ...        0 min,  0.024 sec ( 48.471%)
 printout                       ...        0 min,  0.000 sec (  0.893%)

         :::::::::::::::::::::::::::::::::::::::::::::::::::::
         ::                     SUMMARY                     ::
         :::::::::::::::::::::::::::::::::::::::::::::::::::::
         :: total energy             -48.762444196610 Eh    ::
         :: gradient norm              0.000540888874 Eh/a0 ::
         :: HOMO-LUMO gap              2.907233764978 eV    ::
         ::.................................................::
         :: SCC energy               -49.625019712020 Eh    ::
         :: -> isotropic ES            0.004123094296 Eh    ::
         :: -> anisotropic ES          0.006436162051 Eh    ::
         :: -> anisotropic XC          0.030754870849 Eh    ::
         :: -> dispersion             -0.037779680057 Eh    ::
         :: repulsion energy           0.862438042895 Eh    ::
         :: add. restraining           0.000000000000 Eh    ::
         :::::::::::::::::::::::::::::::::::::::::::::::::::::

           -------------------------------------------------
          |                Property Printout                |
           -------------------------------------------------

    * Orbital Energies and Occupations

         #    Occupation            Energy/Eh            Energy/eV
      -------------------------------------------------------------
         1        2.0000           -0.7276978             -19.8017
       ...           ...                  ...                  ...
        34        2.0000           -0.4507078             -12.2644
        35        2.0000           -0.4449352             -12.1073
        36        2.0000           -0.4410735             -12.0022
        37        2.0000           -0.4352301             -11.8432
        38        2.0000           -0.4319776             -11.7547
        39        2.0000           -0.4245103             -11.5515
        40        2.0000           -0.4160790             -11.3221
        41        2.0000           -0.4126855             -11.2297
        42        2.0000           -0.4040037             -10.9935
        43        2.0000           -0.3983143             -10.8387
        44        2.0000           -0.3928643             -10.6904
        45        2.0000           -0.3828283             -10.4173
        46        2.0000           -0.3666415              -9.9768 (HOMO)
        47                         -0.2598027              -7.0696 (LUMO)
        48                         -0.2297520              -6.2519
        49                         -0.2167188              -5.8972
        50                         -0.2147239              -5.8429
        51                         -0.1963993              -5.3443
        52                         -0.1715596              -4.6684
        53                         -0.1233563              -3.3567
        54                         -0.1098289              -2.9886
        55                         -0.0894520              -2.4341
        56                          0.0034478               0.0938
        57                          0.0338195               0.9203
       ...                                ...                  ...
        95                          0.7062508              19.2181
      -------------------------------------------------------------
                  HL-Gap            0.1068389 Eh            2.9072 eV
             Fermi-level           -0.3132221 Eh           -8.5232 eV

     #   Z        covCN         q      C6AA      α(0)
     1   6 C      2.948    -0.028    28.711     8.788
     2  16 S      2.289    -0.032   142.369    20.082
     3   6 C      2.935    -0.022    28.543     8.762
     4   6 C      3.119    -0.048    29.017     8.823
     5   6 C      3.149     0.002    27.694     8.608
     6   6 C      2.906    -0.049    29.226     8.865
     7   6 C      2.950     0.014    27.703     8.633
     8   6 C      3.815    -0.066    21.746     6.637
     9   6 C      2.971     0.015    27.677     8.629
    10   6 C      2.924    -0.039    28.973     8.827
    11   6 C      2.924    -0.039    28.965     8.826
    12   6 C      2.971     0.009    27.809     8.650
    13   6 C      3.806    -0.057    21.594     6.615
    14   6 C      3.753    -0.097    22.410     6.750
    15   6 C      2.924    -0.040    28.984     8.829
    16   6 C      2.923    -0.040    29.006     8.832
    17   6 C      2.895    -0.030    28.736     8.789
    18   6 C      2.838    -0.088    30.201     9.006
    19   1 H      0.926     0.040     2.452     2.449
    20   1 H      0.926     0.041     2.437     2.441
    21   1 H      0.926     0.041     2.435     2.440
    22   1 H      0.925     0.029     2.602     2.522
    23   1 H      0.924     0.044     2.391     2.418
    24   1 H      0.924     0.043     2.412     2.428
    25   1 H      0.926     0.029     2.595     2.519
    26   1 H      0.926     0.028     2.621     2.532
    27   1 H      0.924     0.034     2.527     2.486
    28   1 H      0.924     0.035     2.522     2.483
    29   1 H      0.925     0.035     2.515     2.480
    30   1 H      0.925     0.035     2.519     2.482
    31   1 H      0.925     0.035     2.511     2.478
    32   1 H      0.926     0.028     2.619     2.531
    33   1 H      0.925     0.025     2.658     2.550
    34   1 H      0.925     0.038     2.475     2.460
    35   1 H      0.926     0.043     2.412     2.429
    36   1 H      0.926     0.032     2.558     2.501

 Mol. C6AA /au·bohr⁶  :      16728.354150
 Mol. C8AA /au·bohr⁸  :     436466.726906
 Mol. α(0) /au        :        207.581593


Wiberg/Mayer (AO) data.
largest (>0.10) Wiberg bond orders for each atom
          total WBO             WBO to atom ...
     1  C   3.923        C    5 1.545    S    2 1.202    H   19 0.971    C    3 0.110
     2  S   2.633        C    1 1.202    C    3 1.181
     3  C   3.949        C    4 1.653    S    2 1.181    H   20 0.971    C    1 0.110
     4  C   3.987        C    3 1.653    C    5 1.213    H   21 0.961
     5  C   3.986        C    1 1.545    C    4 1.213    C    6 1.094
     6  C   3.988        C    7 1.731    C    5 1.094    H   22 0.960    C   18 0.109
     7  C   3.987        C    6 1.731    C   17 1.105    C    8 0.999
     8  C   3.995        C    7 0.999    C    9 0.992    H   23 0.967    H   24 0.958
     9  C   3.984        C   16 1.409    C   10 1.408    C    8 0.992    C   12 0.106
    10  C   3.992        C   11 1.452    C    9 1.408    H   25 0.968    C   15 0.109
    11  C   3.992        C   10 1.452    C   12 1.409    H   26 0.969    C   16 0.108
    12  C   3.988        C   15 1.411    C   11 1.409    C   13 1.012    C    9 0.106
    13  C   3.997        C   12 1.012    C   14 1.001    H   27 0.975    H   28 0.974
    14  C   3.996        C   13 1.001    H   29 0.989    H   31 0.988    H   30 0.987
    15  C   3.991        C   16 1.447    C   12 1.411    H   32 0.969    C   10 0.109
    16  C   3.991        C   15 1.447    C    9 1.409    H   33 0.969    C   11 0.108
    17  C   3.992        C   18 1.885    C    7 1.105    H   34 0.958
    18  C   3.968        C   17 1.885    H   36 0.979    H   35 0.972    C    6 0.109
    19  H   0.998        C    1 0.971
    20  H   0.998        C    3 0.971
    21  H   0.998        C    4 0.961
    22  H   0.998        C    6 0.960
    23  H   0.996        C    8 0.967
    24  H   0.998        C    8 0.958
    25  H   0.999        C   10 0.968
    26  H   0.999        C   11 0.969
    27  H   0.998        C   13 0.975
    28  H   0.998        C   13 0.974
    29  H   0.999        C   14 0.989
    30  H   0.998        C   14 0.987
    31  H   0.999        C   14 0.988
    32  H   0.999        C   15 0.969
    33  H   0.999        C   16 0.969
    34  H   0.998        C   17 0.958
    35  H   0.998        C   18 0.972
    36  H   0.998        C   18 0.979

molecular dipole:
                 x           y           z       tot (Debye)
 q only:        0.272       0.085       0.108
   full:        0.450       0.124       0.240       1.333
molecular quadrupole (traceless):
                xx          xy          yy          xz          yz          zz
 q only:        4.081       1.302      -0.282       0.086      -0.534      -3.799
  q+dip:        3.652       1.964      -0.019       1.368       0.048      -3.634
   full:        3.655       1.729       1.063      -0.975      -1.077      -4.718

           -------------------------------------------------
          |                Geometry Summary                 |
           -------------------------------------------------

      molecular mass/u    :      254.3892000
   center of mass at/Å    :        3.6117869       1.5642830      -0.6537265
  moments of inertia/u·Å² :        0.5842244E+03   0.3358357E+04   0.3584747E+04
rotational constants/cm⁻¹ :        0.2885472E-01   0.5019607E-02   0.4702600E-02

 * 32 selected distances

     #   Z        #   Z                                     value/Å
     1   6 C      2  16 S                                 1.7149453
     2  16 S      3   6 C                                 1.7217073 (max)
     3   6 C      4   6 C                                 1.3531346
     1   6 C      5   6 C                                 1.3681597
     4   6 C      5   6 C                                 1.4265831
     6   6 C      7   6 C                                 1.3452247
     9   6 C     10   6 C                                 1.3887821
    10   6 C     11   6 C                                 1.3820733
    11   6 C     12   6 C                                 1.3887232
    13   6 C     14   6 C                                 1.5299253
    12   6 C     15   6 C                                 1.3883064
     9   6 C     16   6 C                                 1.3884803
    15   6 C     16   6 C                                 1.3828113
    17   6 C     18   6 C                                 1.3291114
     1   6 C     19   1 H                                 1.0721925
     3   6 C     20   1 H                                 1.0719702 (min)
     4   6 C     21   1 H                                 1.0750515
     6   6 C     22   1 H                                 1.0839397
     8   6 C     23   1 H                                 1.0919214
     8   6 C     24   1 H                                 1.0941033
    10   6 C     25   1 H                                 1.0806363
    11   6 C     26   1 H                                 1.0811111
    13   6 C     27   1 H                                 1.0919403
    13   6 C     28   1 H                                 1.0922646
    14   6 C     29   1 H                                 1.0877965
    14   6 C     30   1 H                                 1.0877013
    14   6 C     31   1 H                                 1.0877323
    15   6 C     32   1 H                                 1.0810966
    16   6 C     33   1 H                                 1.0818501
    17   6 C     34   1 H                                 1.0825328
    18   6 C     35   1 H                                 1.0758303
    18   6 C     36   1 H                                 1.0769561

 * 3 distinct bonds (by element types)

   Z      Z             #   av. dist./Å        max./Å        min./Å
   1 H    6 C          18     1.0831459     1.0941033     1.0719702
   6 C    6 C          12     1.3892763     1.5299253     1.3291114
   6 C   16 S           2     1.7183263     1.7217073     1.7149453


optimized geometry written to: xtbopt.xyz


           -------------------------------------------------
          | TOTAL ENERGY              -48.762444196610 Eh   |
          | GRADIENT NORM               0.000540888874 Eh/α |
          | HOMO-LUMO GAP               2.907233764978 eV   |
           -------------------------------------------------

------------------------------------------------------------------------
 * finished run on 2021/05/19 at 11:00:01.379     
------------------------------------------------------------------------
 total:
 * wall-time:     0 d,  0 h,  0 min,  1.909 sec
 *  cpu-time:     0 d,  0 h,  0 min,  1.903 sec
 * ratio c/w:     0.997 speedup
 SCF:
 * wall-time:     0 d,  0 h,  0 min,  0.065 sec
 *  cpu-time:     0 d,  0 h,  0 min,  0.065 sec
 * ratio c/w:     0.998 speedup
 ANC optimizer:
 * wall-time:     0 d,  0 h,  0 min,  1.814 sec
 *  cpu-time:     0 d,  0 h,  0 min,  1.810 sec
 * ratio c/w:     0.998 speedup

