      -----------------------------------------------------------      
     |                   =====================                   |     
     |                           x T B                           |     
     |                   =====================                   |     
     |                         S. Grimme                         |     
     |          Mulliken Center for Theoretical Chemistry        |     
     |                    University of Bonn                     |     
     |                Version 6.2 RC2 (SAW190805)                |     
      -----------------------------------------------------------      

   This program is distributed in the hope that it will be useful,
   but WITHOUT ANY WARRANTY; without even the implied warranty of
   MERCHANTABILITY or FITNESS FOR A PARTICULAR PURPOSE.
   
   FOR NON-COMMERCIAL, ACADEMIA USE ONLY.
   
   Cite this work as:
   * S. Grimme, C. Bannwarth, P. Shushkov, J. Chem. Theory Comput., 2017,
     13, 1989-2009. DOI: 10.1021/acs.jctc.7b00118
   * C. Bannwarth, S. Ehlert and S. Grimme., J. Chem. Theory Comput., 2019,
     15, 1652-1671. DOI: 10.1021/acs.jctc.8b01176
   * P. Pracht, E. Caldeweyher, S. Ehlert, S. Grimme, ChemRxiv, 2019, preprint.
     DOI: 10.26434/chemrxiv.8326202.v1
   
   for DFT-D4:
   * E. Caldeweyher, C. Bannwarth and S. Grimme, J. Chem. Phys., 2017,
     147, 034112. DOI: 10.1063/1.4993215
   * E. Caldeweyher, S. Ehlert, A. Hansen, H. Neugebauer, S. Spicher,
     C. Bannwarth and S. Grimme, J. Chem. Phys., 2019, 150, 154122.
     DOI: 10.1063/1.5090222
   
   for sTDA-xTB:
   * S. Grimme and C. Bannwarth, J. Chem. Phys., 2016, 145, 054103.
     DOI: 10.1063/1.4959605
   
   in the mass-spec context:
   * V. Asgeirsson, C. Bauer and S. Grimme, Chem. Sci., 2017, 8, 4879.
     DOI: 10.1039/c7sc00601b
   
   for metadynamics refer to:
   * S. Grimme, J. Chem. Theory Comput., 2019, 155, 2847-2862
     DOI: 10.1021/acs.jctc.9b00143
   
   with help from (in alphabetical order)
   C. Bannwarth, F. Bohle, G. Brandenburg, E. Caldeweyher, M. Checinski,
   S. Dohm, S. Ehlert, S. Ehrlich, F. März, H. Neugebauer, J. Pisarek,
   P. Pracht, P. Shushkov, and S. Spicher.
   
 * started run on 2021/05/19 at 11:00:01.400     

           -------------------------------------------------
          |                Calculation Setup                |
           -------------------------------------------------

          program call               : /ihome/ghutchison/geoffh/xtb/xtb 586.xyz -opt
          hostname                   : smp-n144
          coordinate file            : 586.xyz
          omp threads                :                     1
          number of atoms            :                    22
          number of electrons        :                    72
          charge                     :                     0
          spin                       :                   0.0
          first test random number   :      0.91562711812011


########################################################################
# WARNING! Please study the warnings concerning your input carefully
#  - the use of '-opt' is discouraged, please use '--opt' next time
########################################################################

           ------------------------------------------------- 
          |                 G F N 2 - x T B                 |
          | Geometry, Frequencies, Noncovalent interactions |
          |            JCTC 2019 parametrisation            |
           ------------------------------------------------- 
             KAB for C  - Si     :                1.0500
             KAB for H  - Pd     :                0.9500
             k(s)              :                1.8500
             k(p)              :                2.2300
             k(d)              :                2.2300
             k(f)              :                2.0000
             kEN (H0ij)        :               -2.0000
             D4 a1             :                0.5200
             D4 a2             :                5.0000
             D4 s6             :                1.0000
             D4 s8             :                2.7000
             D4 s9             :                5.0000
             alphaj            :                2.0000

  Z AO/shell   Hii/eV     exponent
  1     Wed Apr 25 08:07:45 CEST 2018   EN: 2.200 GM2: 0.406  GM3: 0.0800  RAES: 1.40
     1s    -10.707211    1.230000
  6     Wed Apr 25 08:07:45 CEST 2018   EN: 2.550 GM2: 0.538  GM3: 0.1500  RAES: 3.00
     2s    -13.970922    2.096432
     2p    -10.063292    1.800000
  9     Mon Apr 23 13:58:50 CEST 2018   EN: 3.980 GM2: 0.532  GM3: 0.1426  RAES: 2.40
     2s    -23.458179    2.416361
     2p    -15.746583    2.308399
 16     Tue Apr 24 11:44:34 CEST 2018   EN: 2.580 GM2: 0.340  GM3:-0.0502  RAES: 3.10
     3s    -20.029654    1.981333
     3p    -11.377694    2.025643
     3d     -0.420282    1.702555

           ------------------------------------------------- 
          |        Self-Consistent Charge Iterations        |
           ------------------------------------------------- 

          ...................................................
          :                      SETUP                      :
          :.................................................:
          :  # basis functions                  67          :
          :  # atomic orbitals                  66          :
          :  # shells                           36          :
          :  # electrons                        72          :
          :  max. iterations                   250          :
          :  Hamiltonian                  GFN2-xTB          :
          :  restarted?                      false          :
          :  GBSA solvation                  false          :
          :  PC potential                    false          :
          :  electronic temp.          300.0000000     K    :
          :  accuracy                    1.0000000          :
          :  -> integral cutoff          0.2500000E+02      :
          :  -> integral neglect         0.1000000E-07      :
          :  -> SCF convergence          0.1000000E-05 Eh   :
          :  -> wf. convergence          0.1000000E-03 e    :
          :  Broyden damping             0.4000000          :
          ...................................................

 iter      E             dE          RMSdq      gap      omega  full diag
   1    -41.6285989 -0.416286E+02  0.387E+00    3.86       0.0  T
   2    -41.7081005 -0.795016E-01  0.218E+00    3.86       1.0  T
   3    -41.7111097 -0.300921E-02  0.105E+00    3.85       1.0  T
   4    -41.7121371 -0.102744E-02  0.293E-01    3.79       1.0  T
   5    -41.7131626 -0.102546E-02  0.144E-01    3.81       1.0  T
   6    -41.7133591 -0.196478E-03  0.349E-02    3.81       1.0  T
   7    -41.7133626 -0.354105E-05  0.141E-02    3.81       1.5  T
   8    -41.7133626 -0.261486E-08  0.597E-03    3.81       3.6  T
   9    -41.7133628 -0.218049E-06  0.290E-03    3.81       7.4  T
  10    -41.7133629 -0.812994E-07  0.139E-03    3.81      15.3  T
  11    -41.7133629 -0.113038E-07  0.431E-04    3.81      49.5  T
  12    -41.7133629 -0.981544E-09  0.214E-04    3.81      99.7  T

   *** convergence criteria satisfied after 12 iterations ***

         #    Occupation            Energy/Eh            Energy/eV
      -------------------------------------------------------------
         1        2.0000           -0.8740407             -23.7839
       ...           ...                  ...                  ...
        30        2.0000           -0.4702329             -12.7957
        31        2.0000           -0.4635205             -12.6130
        32        2.0000           -0.4513246             -12.2812
        33        2.0000           -0.4487072             -12.2099
        34        2.0000           -0.4421466             -12.0314
        35        2.0000           -0.4004402             -10.8965
        36        2.0000           -0.3932732             -10.7015 (HOMO)
        37                         -0.2531271              -6.8879 (LUMO)
        38                         -0.2059679              -5.6047
        39                         -0.1878609              -5.1120
        40                         -0.1197014              -3.2572
        41                         -0.0115330              -0.3138
       ...                                ...                  ...
        66                          0.6553107              17.8319
      -------------------------------------------------------------
                  HL-Gap            0.1401461 Eh            3.8136 eV
             Fermi-level           -0.3232002 Eh           -8.7947 eV

 SCC (total)                   0 d,  0 h,  0 min,  0.037 sec
 SCC setup                      ...        0 min,  0.000 sec (  0.771%)
 Dispersion                     ...        0 min,  0.000 sec (  0.752%)
 integral evaluation            ...        0 min,  0.009 sec ( 23.343%)
 zeroth order Hamiltonian       ...        0 min,  0.000 sec (  0.487%)
 iterations                     ...        0 min,  0.014 sec ( 37.061%)
 molecular gradient             ...        0 min,  0.013 sec ( 36.459%)
 printout                       ...        0 min,  0.000 sec (  0.979%)

         :::::::::::::::::::::::::::::::::::::::::::::::::::::
         ::                     SUMMARY                     ::
         :::::::::::::::::::::::::::::::::::::::::::::::::::::
         :: total energy             -41.327732981518 Eh    ::
         :: gradient norm              0.042960480898 Eh/a0 ::
         :: HOMO-LUMO gap              3.813570019191 eV    ::
         ::.................................................::
         :: SCC energy               -41.713362930958 Eh    ::
         :: -> isotropic ES            0.043456098009 Eh    ::
         :: -> anisotropic ES          0.000374299255 Eh    ::
         :: -> anisotropic XC         -0.005970685183 Eh    ::
         :: -> dispersion             -0.021988424546 Eh    ::
         :: repulsion energy           0.385433354481 Eh    ::
         :: add. restraining           0.000000000000 Eh    ::
         :::::::::::::::::::::::::::::::::::::::::::::::::::::

      ----------------------------------------------------------- 
     |                   =====================                   |
     |                        A N C O P T                        |
     |                   =====================                   |
     |               Approximate Normal Coordinate               |
     |                Rational Function Optimizer                |
      ----------------------------------------------------------- 

          ...................................................
          :                      SETUP                      :
          :.................................................:
          :   optimization level            normal          :
          :   max. optcycles                   200          :
          :   ANC micro-cycles                  20          :
          :   degrees of freedom                60          :
          :.................................................:
          :   RF solver                   davidson          :
          :   input Hessian                  false          :
          :   write xtbopt.log                true          :
          :   linear?                        false          :
          :   energy convergence         0.5000000E-05 Eh   :
          :   grad. convergence          0.1000000E-02 Eh/α :
          :   maximium RF displ.         2.0000000          :
          :   Hlow (freq-cutoff)         0.5000000E-02      :
          :   Hmax (freq-cutoff)         5.0000000          :
          :   S6 in model hess.         20.0000000          :
          ...................................................

generating ANC from model Hessian ...
Using Lindh-Hessian (1995)
 Shifting diagonal of input Hessian by   1.836652464052593E-003
 Lowest  eigenvalues of input Hessian
   -0.000000   -0.000000   -0.000000   -0.000000    0.000000    0.000000
    0.005000    0.006267    0.009065    0.010426    0.010702    0.016845
    0.021267    0.023839    0.027931    0.034277    0.040287    0.051583
 Highest eigenvalues
    1.494303    1.625939    1.649330    1.678585    1.743980    1.806021
 

........................................................................
.............................. CYCLE    1 ..............................
........................................................................
   1    -41.7133629 -0.417134E+02  0.560E-05    3.81       0.0  T
   2    -41.7133629 -0.584777E-11  0.314E-05    3.81     678.2  T
   3    -41.7133629  0.164135E-11  0.236E-05    3.81     903.7  T
     SCC iter.                  ...        0 min,  0.004 sec
     gradient                   ...        0 min,  0.013 sec
 * total energy  :   -41.3277330 Eh     change        0.3547029E-10 Eh
   gradient norm :     0.0429601 Eh/α   predicted     0.0000000E+00 (-100.00%)
   displ. norm   :     0.2398225 α      lambda       -0.5045468E-02
   maximum displ.:     0.1081449 α      in ANC's #3, #11, #20, ...

........................................................................
.............................. CYCLE    2 ..............................
........................................................................
   1    -41.7357577 -0.417358E+02  0.200E-01    3.89       0.0  T
   2    -41.7357808 -0.231128E-04  0.110E-01    3.90       1.0  T
   3    -41.7357639  0.169789E-04  0.428E-02    3.89       1.0  T
   4    -41.7357847 -0.208099E-04  0.198E-02    3.90       1.1  T
   5    -41.7357885 -0.385352E-05  0.561E-03    3.90       3.8  T
   6    -41.7357886 -0.693384E-07  0.935E-04    3.90      22.8  T
     SCC iter.                  ...        0 min,  0.007 sec
     gradient                   ...        0 min,  0.013 sec
 * total energy  :   -41.3308594 Eh     change       -0.3126465E-02 Eh
   gradient norm :     0.0133234 Eh/α   predicted    -0.2667828E-02 ( -14.67%)
   displ. norm   :     0.1660863 α      lambda       -0.6812637E-03
   maximum displ.:     0.0997732 α      in ANC's #3, #2, #6, ...

........................................................................
.............................. CYCLE    3 ..............................
........................................................................
   1    -41.7426845 -0.417427E+02  0.174E-01    3.92       0.0  T
   2    -41.7426982 -0.136059E-04  0.877E-02    3.92       1.0  T
   3    -41.7426952  0.299472E-05  0.244E-02    3.92       1.0  T
   4    -41.7427006 -0.539497E-05  0.139E-02    3.92       1.5  T
   5    -41.7427019 -0.136230E-05  0.394E-03    3.92       5.4  T
   6    -41.7427020 -0.744164E-07  0.691E-04    3.92      30.9  T
   7    -41.7427020 -0.251610E-09  0.413E-04    3.92      51.6  T
     SCC iter.                  ...        0 min,  0.007 sec
     gradient                   ...        0 min,  0.013 sec
 * total energy  :   -41.3312658 Eh     change       -0.4063752E-03 Eh
   gradient norm :     0.0041830 Eh/α   predicted    -0.3500568E-03 ( -13.86%)
   displ. norm   :     0.1398325 α      lambda       -0.1929428E-03
   maximum displ.:     0.0773431 α      in ANC's #2, #3, #6, ...

........................................................................
.............................. CYCLE    4 ..............................
........................................................................
   1    -41.7431973 -0.417432E+02  0.871E-02    3.92       0.0  T
   2    -41.7431992 -0.197900E-05  0.515E-02    3.92       1.0  T
   3    -41.7431997 -0.484451E-06  0.695E-03    3.92       3.1  T
   4    -41.7431999 -0.193474E-06  0.417E-03    3.92       5.1  T
   5    -41.7432001 -0.187209E-06  0.152E-03    3.92      14.1  T
   6    -41.7432001 -0.173813E-07  0.491E-04    3.92      43.4  T
     SCC iter.                  ...        0 min,  0.007 sec
     gradient                   ...        0 min,  0.013 sec
 * total energy  :   -41.3314129 Eh     change       -0.1470324E-03 Eh
   gradient norm :     0.0029286 Eh/α   predicted    -0.9835844E-04 ( -33.10%)
   displ. norm   :     0.2340942 α      lambda       -0.2200430E-03
   maximum displ.:     0.1289050 α      in ANC's #2, #5, #3, ...

........................................................................
.............................. CYCLE    5 ..............................
........................................................................
   1    -41.7416974 -0.417417E+02  0.175E-01    3.92       0.0  T
   2    -41.7417065 -0.911582E-05  0.982E-02    3.92       1.0  T
   3    -41.7417096 -0.310051E-05  0.177E-02    3.92       1.2  T
   4    -41.7417089  0.698149E-06  0.999E-03    3.92       2.1  T
   5    -41.7417102 -0.131608E-05  0.266E-03    3.92       8.0  T
   6    -41.7417103 -0.949513E-07  0.722E-04    3.92      29.5  T
   7    -41.7417103  0.234394E-09  0.354E-04    3.92      60.2  T
     SCC iter.                  ...        0 min,  0.007 sec
     gradient                   ...        0 min,  0.013 sec
 * total energy  :   -41.3315666 Eh     change       -0.1537941E-03 Eh
   gradient norm :     0.0035699 Eh/α   predicted    -0.1160542E-03 ( -24.54%)
   displ. norm   :     0.1631682 α      lambda       -0.9697642E-04
   maximum displ.:     0.0943803 α      in ANC's #2, #5, #3, ...

........................................................................
.............................. CYCLE    6 ..............................
........................................................................
   1    -41.7409413 -0.417409E+02  0.106E-01    3.92       0.0  T
   2    -41.7409446 -0.335237E-05  0.636E-02    3.92       1.0  T
   3    -41.7409454 -0.728711E-06  0.986E-03    3.92       2.2  T
   4    -41.7409463 -0.943871E-06  0.505E-03    3.92       4.2  T
   5    -41.7409465 -0.208899E-06  0.170E-03    3.92      12.5  T
   6    -41.7409466 -0.312508E-07  0.532E-04    3.92      40.1  T
   7    -41.7409466 -0.148140E-08  0.308E-04    3.92      69.3  T
     SCC iter.                  ...        0 min,  0.008 sec
     gradient                   ...        0 min,  0.013 sec
 * total energy  :   -41.3316326 Eh     change       -0.6590485E-04 Eh
   gradient norm :     0.0040916 Eh/α   predicted    -0.4977951E-04 ( -24.47%)
   displ. norm   :     0.1085663 α      lambda       -0.5737512E-04
   maximum displ.:     0.0660875 α      in ANC's #2, #5, #3, ...

........................................................................
.............................. CYCLE    7 ..............................
........................................................................
   1    -41.7412175 -0.417412E+02  0.785E-02    3.92       0.0  T
   2    -41.7412194 -0.183295E-05  0.447E-02    3.93       1.0  T
   3    -41.7412195 -0.188515E-06  0.922E-03    3.93       2.3  T
   4    -41.7412199 -0.346215E-06  0.567E-03    3.93       3.8  T
   5    -41.7412202 -0.342380E-06  0.109E-03    3.93      19.6  T
   6    -41.7412202 -0.147180E-07  0.396E-04    3.93      53.8  T
     SCC iter.                  ...        0 min,  0.007 sec
     gradient                   ...        0 min,  0.012 sec
 * total energy  :   -41.3316748 Eh     change       -0.4223087E-04 Eh
   gradient norm :     0.0030663 Eh/α   predicted    -0.2902705E-04 ( -31.27%)
   displ. norm   :     0.0930041 α      lambda       -0.4252133E-04
   maximum displ.:     0.0608375 α      in ANC's #2, #1, #5, ...

........................................................................
.............................. CYCLE    8 ..............................
........................................................................
   1    -41.7420344 -0.417420E+02  0.608E-02    3.93       0.0  T
   2    -41.7420357 -0.131805E-05  0.347E-02    3.93       1.0  T
   3    -41.7420354  0.306576E-06  0.854E-03    3.93       2.5  T
   4    -41.7420361 -0.700456E-06  0.445E-03    3.93       4.8  T
   5    -41.7420363 -0.169060E-06  0.135E-03    3.93      15.8  T
   6    -41.7420363 -0.137952E-07  0.439E-04    3.93      48.6  T
   7    -41.7420363 -0.230257E-08  0.194E-04    3.93     109.6  T
     SCC iter.                  ...        0 min,  0.007 sec
     gradient                   ...        0 min,  0.013 sec
 * total energy  :   -41.3317020 Eh     change       -0.2724170E-04 Eh
   gradient norm :     0.0013660 Eh/α   predicted    -0.2144758E-04 ( -21.27%)
   displ. norm   :     0.0849813 α      lambda       -0.1124424E-04
   maximum displ.:     0.0563677 α      in ANC's #2, #1, #3, ...

........................................................................
.............................. CYCLE    9 ..............................
........................................................................
   1    -41.7423103 -0.417423E+02  0.615E-02    3.93       0.0  T
   2    -41.7423115 -0.120970E-05  0.341E-02    3.93       1.0  T
   3    -41.7423118 -0.274344E-06  0.695E-03    3.93       3.1  T
   4    -41.7423118  0.888747E-08  0.447E-03    3.93       4.8  T
   5    -41.7423120 -0.232280E-06  0.896E-04    3.93      23.8  T
   6    -41.7423120 -0.809170E-08  0.326E-04    3.93      65.4  T
     SCC iter.                  ...        0 min,  0.007 sec
     gradient                   ...        0 min,  0.013 sec
 * total energy  :   -41.3317108 Eh     change       -0.8786969E-05 Eh
   gradient norm :     0.0008351 Eh/α   predicted    -0.5645855E-05 ( -35.75%)
   displ. norm   :     0.0153228 α      lambda       -0.2050652E-05
   maximum displ.:     0.0115738 α      in ANC's #5, #1, #6, ...

........................................................................
.............................. CYCLE   10 ..............................
........................................................................
   1    -41.7423950 -0.417424E+02  0.135E-02    3.93       0.0  T
   2    -41.7423951 -0.721809E-07  0.709E-03    3.93       3.0  T
   3    -41.7423951 -0.644471E-08  0.160E-03    3.93      13.3  T
   4    -41.7423951 -0.757903E-08  0.928E-04    3.93      23.0  T
   5    -41.7423951 -0.340685E-08  0.348E-04    3.93      61.3  T
     SCC iter.                  ...        0 min,  0.006 sec
     gradient                   ...        0 min,  0.014 sec
 * total energy  :   -41.3317123 Eh     change       -0.1479855E-05 Eh
   gradient norm :     0.0004474 Eh/α   predicted    -0.1027501E-05 ( -30.57%)
   displ. norm   :     0.0154724 α      lambda        0.2356502E-05
   maximum displ.:     0.0115759 α      in ANC's #5, #1, #6, ...

   *** GEOMETRY OPTIMIZATION CONVERGED AFTER 10 ITERATIONS ***

------------------------------------------------------------------------
 total energy gain   :        -0.0039793 Eh       -2.4971 kcal/mol
 total RMSD          :         0.2220442 a0        0.1175 Å
 total power (kW/mol):        -1.0447680 (step)  -35.1459 (real)
------------------------------------------------------------------------

 ANCopt (total)                0 d,  0 h,  0 min,  0.297 sec
 optimizer setup                ...        0 min,  0.000 sec (  0.054%)
 model hessian                  ...        0 min,  0.009 sec (  3.081%)
 ANC generation                 ...        0 min,  0.001 sec (  0.207%)
 coordinate transformation      ...        0 min,  0.000 sec (  0.058%)
 single point calculation       ...        0 min,  0.284 sec ( 95.531%)
 optimization log               ...        0 min,  0.001 sec (  0.327%)
 hessian update                 ...        0 min,  0.000 sec (  0.042%)
 rational function              ...        0 min,  0.001 sec (  0.472%)

================
 final structure:
================
$coord
    3.11431018936884    2.17606895893381    0.12262085194048      C 
    5.26967190969429   -0.24076193328685    0.19734843846169      S 
    2.88849195764339   -2.44550583150517    0.04573785413947      C 
    0.55821750624431   -1.37219683827523   -0.05545858353220      C 
    0.69469379688602    1.31327926562092   -0.00953628605529      C 
   -1.61652586540474    2.96563340751017   -0.02642358254099      C 
   -1.86405635977566    4.25419114980877    2.54667289017023      C 
    0.01905193917484    5.91102643302624    2.94738261576353      F 
   -4.01675740675943    5.58621201370242    2.75672659739230      F 
   -1.82434700644766    2.65672518565195    4.50841595859516      F 
   -3.99991199599969    1.45598221990507   -0.69682099240706      C 
   -4.07312806929046   -1.10309970200066    0.63460864891702      C 
   -1.89345353706926   -2.76083172768288   -0.27400078538255      C 
    3.75557415125397    4.09582687717952    0.19501445918023      H 
    3.35290660268771   -4.41647781804500    0.03899893706671      H 
   -1.37309400032576    4.52262139937973   -1.37296949359292      H 
   -4.00959792848632    1.15119205511933   -2.73775126705685      H 
   -5.67072692957394    2.56387155080877   -0.21334622147331      H 
   -5.86747732145344   -2.03187838815466    0.22406628914152      H 
   -3.94635075252635   -0.84788173944637    2.67482557250564      H 
   -2.19754876333181   -3.26691363014129   -2.25736552941208      H 
   -1.81307028834302   -4.51346241806710    0.80871528100991      H 
$end
           -------------------------------------------------
          |                Final Singlepoint                |
           -------------------------------------------------

          ...................................................
          :                      SETUP                      :
          :.................................................:
          :  # basis functions                  67          :
          :  # atomic orbitals                  66          :
          :  # shells                           36          :
          :  # electrons                        72          :
          :  max. iterations                   250          :
          :  Hamiltonian                  GFN2-xTB          :
          :  restarted?                      false          :
          :  GBSA solvation                  false          :
          :  PC potential                    false          :
          :  electronic temp.          300.0000000     K    :
          :  accuracy                    1.0000000          :
          :  -> integral cutoff          0.2500000E+02      :
          :  -> integral neglect         0.1000000E-07      :
          :  -> SCF convergence          0.1000000E-05 Eh   :
          :  -> wf. convergence          0.1000000E-03 e    :
          :  Broyden damping             0.4000000          :
          ...................................................

 iter      E             dE          RMSdq      gap      omega  full diag
   1    -41.7423951 -0.417424E+02  0.206E-04    3.93       0.0  T
   2    -41.7423951 -0.262474E-10  0.777E-05    3.93     274.2  T
   3    -41.7423951  0.326636E-10  0.836E-05    3.93     255.1  T

   *** convergence criteria satisfied after 3 iterations ***

         #    Occupation            Energy/Eh            Energy/eV
      -------------------------------------------------------------
         1        2.0000           -0.8770424             -23.8655
       ...           ...                  ...                  ...
        30        2.0000           -0.4706466             -12.8069
        31        2.0000           -0.4636287             -12.6160
        32        2.0000           -0.4547780             -12.3751
        33        2.0000           -0.4483743             -12.2009
        34        2.0000           -0.4434966             -12.0682
        35        2.0000           -0.4010005             -10.9118
        36        2.0000           -0.3961345             -10.7794 (HOMO)
        37                         -0.2516979              -6.8490 (LUMO)
        38                         -0.2073699              -5.6428
        39                         -0.1816717              -4.9435
        40                         -0.1197859              -3.2595
        41                         -0.0076940              -0.2094
       ...                                ...                  ...
        66                          0.6770208              18.4227
      -------------------------------------------------------------
                  HL-Gap            0.1444366 Eh            3.9303 eV
             Fermi-level           -0.3239162 Eh           -8.8142 eV

 SCC (total)                   0 d,  0 h,  0 min,  0.026 sec
 SCC setup                      ...        0 min,  0.000 sec (  0.673%)
 Dispersion                     ...        0 min,  0.000 sec (  0.609%)
 integral evaluation            ...        0 min,  0.008 sec ( 31.730%)
 zeroth order Hamiltonian       ...        0 min,  0.000 sec (  0.612%)
 iterations                     ...        0 min,  0.004 sec ( 14.600%)
 molecular gradient             ...        0 min,  0.013 sec ( 50.270%)
 printout                       ...        0 min,  0.000 sec (  1.283%)

         :::::::::::::::::::::::::::::::::::::::::::::::::::::
         ::                     SUMMARY                     ::
         :::::::::::::::::::::::::::::::::::::::::::::::::::::
         :: total energy             -41.331712296177 Eh    ::
         :: gradient norm              0.000445868503 Eh/a0 ::
         :: HOMO-LUMO gap              3.930318809698 eV    ::
         ::.................................................::
         :: SCC energy               -41.742395141130 Eh    ::
         :: -> isotropic ES            0.043744919257 Eh    ::
         :: -> anisotropic ES         -0.000235921970 Eh    ::
         :: -> anisotropic XC         -0.007368291679 Eh    ::
         :: -> dispersion             -0.022319045554 Eh    ::
         :: repulsion energy           0.410490900248 Eh    ::
         :: add. restraining           0.000000000000 Eh    ::
         :::::::::::::::::::::::::::::::::::::::::::::::::::::

           -------------------------------------------------
          |                Property Printout                |
           -------------------------------------------------

    * Orbital Energies and Occupations

         #    Occupation            Energy/Eh            Energy/eV
      -------------------------------------------------------------
         1        2.0000           -0.8770424             -23.8655
       ...           ...                  ...                  ...
        24        2.0000           -0.5210449             -14.1784
        25        2.0000           -0.5136406             -13.9769
        26        2.0000           -0.5034777             -13.7003
        27        2.0000           -0.4967026             -13.5160
        28        2.0000           -0.4862552             -13.2317
        29        2.0000           -0.4795857             -13.0502
        30        2.0000           -0.4706466             -12.8069
        31        2.0000           -0.4636287             -12.6160
        32        2.0000           -0.4547780             -12.3751
        33        2.0000           -0.4483743             -12.2009
        34        2.0000           -0.4434966             -12.0682
        35        2.0000           -0.4010005             -10.9118
        36        2.0000           -0.3961345             -10.7794 (HOMO)
        37                         -0.2516979              -6.8490 (LUMO)
        38                         -0.2073699              -5.6428
        39                         -0.1816717              -4.9435
        40                         -0.1197859              -3.2595
        41                         -0.0076940              -0.2094
        42                          0.0087680               0.2386
        43                          0.0251156               0.6834
        44                          0.0271853               0.7397
        45                          0.0372024               1.0123
        46                          0.0447588               1.2179
        47                          0.0731093               1.9894
       ...                                ...                  ...
        66                          0.6770208              18.4227
      -------------------------------------------------------------
                  HL-Gap            0.1444366 Eh            3.9303 eV
             Fermi-level           -0.3239162 Eh           -8.8142 eV

     #   Z        covCN         q      C6AA      α(0)
     1   6 C      2.938    -0.033    28.824     8.805
     2  16 S      2.302    -0.006   141.314    20.008
     3   6 C      2.945    -0.036    28.901     8.817
     4   6 C      3.161    -0.003    27.765     8.613
     5   6 C      3.182    -0.016    27.952     8.630
     6   6 C      3.857    -0.034    21.138     6.539
     7   6 C      3.335     0.484    17.328     6.594
     8   9 F      0.791    -0.212    11.363     3.982
     9   9 F      0.791    -0.212    11.357     3.981
    10   9 F      0.791    -0.204    11.274     3.966
    11   6 C      3.807    -0.058    21.621     6.619
    12   6 C      3.806    -0.059    21.623     6.620
    13   6 C      3.808    -0.059    21.622     6.619
    14   1 H      0.926     0.053     2.286     2.365
    15   1 H      0.926     0.047     2.354     2.399
    16   1 H      0.924     0.061     2.182     2.310
    17   1 H      0.924     0.051     2.305     2.374
    18   1 H      0.924     0.050     2.325     2.384
    19   1 H      0.924     0.041     2.434     2.440
    20   1 H      0.925     0.051     2.303     2.373
    21   1 H      0.924     0.047     2.359     2.402
    22   1 H      0.924     0.046     2.371     2.408

 Mol. C6AA /au·bohr⁶  :       6287.308214
 Mol. C8AA /au·bohr⁸  :     165953.195903
 Mol. α(0) /au        :        121.248400


Wiberg/Mayer (AO) data.
largest (>0.10) Wiberg bond orders for each atom
          total WBO             WBO to atom ...
     1  C   3.951        C    5 1.598    S    2 1.206    H   14 0.970    C    3 0.117
     2  S   2.644        C    1 1.206    C    3 1.189
     3  C   3.944        C    4 1.604    S    2 1.189    H   15 0.971    C    1 0.117
     4  C   3.986        C    3 1.604    C    5 1.226    C   13 1.009
     5  C   3.978        C    1 1.598    C    4 1.226    C    6 0.988
     6  C   3.979        C   11 0.989    C    5 0.988    H   16 0.954    C    7 0.933
     7  C   3.818        F   10 0.952    F    8 0.944    F    9 0.943    C    6 0.933
     8  F   1.067        C    7 0.944
     9  F   1.067        C    7 0.943
    10  F   1.078        C    7 0.952
    11  C   3.992        C   12 1.010    C    6 0.989    H   17 0.975    H   18 0.974
    12  C   3.996        C   11 1.010    C   13 1.005    H   20 0.976    H   19 0.976
    13  C   3.998        C    4 1.009    C   12 1.005    H   22 0.970    H   21 0.959
    14  H   0.997        C    1 0.970
    15  H   0.997        C    3 0.971
    16  H   0.996        C    6 0.954
    17  H   0.997        C   11 0.975
    18  H   0.997        C   11 0.974
    19  H   0.997        C   12 0.976
    20  H   0.997        C   12 0.976
    21  H   0.998        C   13 0.959
    22  H   0.998        C   13 0.970

molecular dipole:
                 x           y           z       tot (Debye)
 q only:       -0.144      -0.895      -1.027
   full:       -0.402      -0.784      -1.070       3.524
molecular quadrupole (traceless):
                xx          xy          yy          xz          yz          zz
 q only:        4.141       2.980      -1.757       2.995      -6.899      -2.384
  q+dip:        0.688       3.178       0.909       3.289      -6.896      -1.597
   full:        0.570       3.189       0.811       3.208      -7.052      -1.381

           -------------------------------------------------
          |                Geometry Summary                 |
           -------------------------------------------------

      molecular mass/u    :      206.2253000
   center of mass at/Å    :       -0.0870860       0.8012912       0.5777689
  moments of inertia/u·Å² :        0.4510375E+03   0.8409780E+03   0.1135299E+04
rotational constants/cm⁻¹ :        0.3737524E-01   0.2004527E-01   0.1484862E-01

 * 22 selected distances

     #   Z        #   Z                                     value/Å
     1   6 C      2  16 S                                 1.7140965
     2  16 S      3   6 C                                 1.7191258 (max)
     3   6 C      4   6 C                                 1.3586993
     1   6 C      5   6 C                                 1.3611705
     4   6 C      5   6 C                                 1.4231343
     6   6 C      7   6 C                                 1.5284411
     7   6 C      8   9 F                                 1.3441278
     7   6 C      9   9 F                                 1.3442065
     7   6 C     10   9 F                                 1.3389241
     6   6 C     11   6 C                                 1.5345236
    11   6 C     12   6 C                                 1.5270194
     4   6 C     13   6 C                                 1.4955001
    12   6 C     13   6 C                                 1.5268050
     1   6 C     14   1 H                                 1.0717546
     3   6 C     15   1 H                                 1.0715620 (min)
     6   6 C     16   1 H                                 1.0968986
    11   6 C     17   1 H                                 1.0920028
    11   6 C     18   1 H                                 1.0912848
    12   6 C     19   1 H                                 1.0910378
    12   6 C     20   1 H                                 1.0901172
    13   6 C     21   1 H                                 1.0950682
    13   6 C     22   1 H                                 1.0909846

 * 4 distinct bonds (by element types)

   Z      Z             #   av. dist./Å        max./Å        min./Å
   1 H    6 C           9     1.0878567     1.0968986     1.0715620
   6 C    6 C           8     1.4694117     1.5345236     1.3586993
   6 C    9 F           3     1.3424195     1.3442065     1.3389241
   6 C   16 S           2     1.7166112     1.7191258     1.7140965


optimized geometry written to: xtbopt.xyz


           -------------------------------------------------
          | TOTAL ENERGY              -41.331712296177 Eh   |
          | GRADIENT NORM               0.000445868503 Eh/α |
          | HOMO-LUMO GAP               3.930318809698 eV   |
           -------------------------------------------------

------------------------------------------------------------------------
 * finished run on 2021/05/19 at 11:00:01.781     
------------------------------------------------------------------------
 total:
 * wall-time:     0 d,  0 h,  0 min,  0.381 sec
 *  cpu-time:     0 d,  0 h,  0 min,  0.380 sec
 * ratio c/w:     0.996 speedup
 SCF:
 * wall-time:     0 d,  0 h,  0 min,  0.037 sec
 *  cpu-time:     0 d,  0 h,  0 min,  0.037 sec
 * ratio c/w:     0.998 speedup
 ANC optimizer:
 * wall-time:     0 d,  0 h,  0 min,  0.324 sec
 *  cpu-time:     0 d,  0 h,  0 min,  0.323 sec
 * ratio c/w:     0.997 speedup

