      -----------------------------------------------------------      
     |                   =====================                   |     
     |                           x T B                           |     
     |                   =====================                   |     
     |                         S. Grimme                         |     
     |          Mulliken Center for Theoretical Chemistry        |     
     |                    University of Bonn                     |     
     |                Version 6.2 RC2 (SAW190805)                |     
      -----------------------------------------------------------      

   This program is distributed in the hope that it will be useful,
   but WITHOUT ANY WARRANTY; without even the implied warranty of
   MERCHANTABILITY or FITNESS FOR A PARTICULAR PURPOSE.
   
   FOR NON-COMMERCIAL, ACADEMIA USE ONLY.
   
   Cite this work as:
   * S. Grimme, C. Bannwarth, P. Shushkov, J. Chem. Theory Comput., 2017,
     13, 1989-2009. DOI: 10.1021/acs.jctc.7b00118
   * C. Bannwarth, S. Ehlert and S. Grimme., J. Chem. Theory Comput., 2019,
     15, 1652-1671. DOI: 10.1021/acs.jctc.8b01176
   * P. Pracht, E. Caldeweyher, S. Ehlert, S. Grimme, ChemRxiv, 2019, preprint.
     DOI: 10.26434/chemrxiv.8326202.v1
   
   for DFT-D4:
   * E. Caldeweyher, C. Bannwarth and S. Grimme, J. Chem. Phys., 2017,
     147, 034112. DOI: 10.1063/1.4993215
   * E. Caldeweyher, S. Ehlert, A. Hansen, H. Neugebauer, S. Spicher,
     C. Bannwarth and S. Grimme, J. Chem. Phys., 2019, 150, 154122.
     DOI: 10.1063/1.5090222
   
   for sTDA-xTB:
   * S. Grimme and C. Bannwarth, J. Chem. Phys., 2016, 145, 054103.
     DOI: 10.1063/1.4959605
   
   in the mass-spec context:
   * V. Asgeirsson, C. Bauer and S. Grimme, Chem. Sci., 2017, 8, 4879.
     DOI: 10.1039/c7sc00601b
   
   for metadynamics refer to:
   * S. Grimme, J. Chem. Theory Comput., 2019, 155, 2847-2862
     DOI: 10.1021/acs.jctc.9b00143
   
   with help from (in alphabetical order)
   C. Bannwarth, F. Bohle, G. Brandenburg, E. Caldeweyher, M. Checinski,
   S. Dohm, S. Ehlert, S. Ehrlich, F. März, H. Neugebauer, J. Pisarek,
   P. Pracht, P. Shushkov, and S. Spicher.
   
 * started run on 2021/05/19 at 10:58:35.145     

           -------------------------------------------------
          |                Calculation Setup                |
           -------------------------------------------------

          program call               : /ihome/ghutchison/geoffh/xtb/xtb 59.xyz -opt
          hostname                   : smp-n58
          coordinate file            : 59.xyz
          omp threads                :                     1
          number of atoms            :                    33
          number of electrons        :                    82
          charge                     :                     0
          spin                       :                   0.0
          first test random number   :      0.37534239790593


########################################################################
# WARNING! Please study the warnings concerning your input carefully
#  - the use of '-opt' is discouraged, please use '--opt' next time
########################################################################

           ------------------------------------------------- 
          |                 G F N 2 - x T B                 |
          | Geometry, Frequencies, Noncovalent interactions |
          |            JCTC 2019 parametrisation            |
           ------------------------------------------------- 
             KAB for C  - Si     :                1.0500
             KAB for H  - Pd     :                0.9500
             k(s)              :                1.8500
             k(p)              :                2.2300
             k(d)              :                2.2300
             k(f)              :                2.0000
             kEN (H0ij)        :               -2.0000
             D4 a1             :                0.5200
             D4 a2             :                5.0000
             D4 s6             :                1.0000
             D4 s8             :                2.7000
             D4 s9             :                5.0000
             alphaj            :                2.0000

  Z AO/shell   Hii/eV     exponent
  1     Wed Apr 25 08:07:45 CEST 2018   EN: 2.200 GM2: 0.406  GM3: 0.0800  RAES: 1.40
     1s    -10.707211    1.230000
  6     Wed Apr 25 08:07:45 CEST 2018   EN: 2.550 GM2: 0.538  GM3: 0.1500  RAES: 3.00
     2s    -13.970922    2.096432
     2p    -10.063292    1.800000
 16     Tue Apr 24 11:44:34 CEST 2018   EN: 2.580 GM2: 0.340  GM3:-0.0502  RAES: 3.10
     3s    -20.029654    1.981333
     3p    -11.377694    2.025643
     3d     -0.420282    1.702555

           ------------------------------------------------- 
          |        Self-Consistent Charge Iterations        |
           ------------------------------------------------- 

          ...................................................
          :                      SETUP                      :
          :.................................................:
          :  # basis functions                  90          :
          :  # atomic orbitals                  88          :
          :  # shells                           50          :
          :  # electrons                        82          :
          :  max. iterations                   250          :
          :  Hamiltonian                  GFN2-xTB          :
          :  restarted?                      false          :
          :  GBSA solvation                  false          :
          :  PC potential                    false          :
          :  electronic temp.          300.0000000     K    :
          :  accuracy                    1.0000000          :
          :  -> integral cutoff          0.2500000E+02      :
          :  -> integral neglect         0.1000000E-07      :
          :  -> SCF convergence          0.1000000E-05 Eh   :
          :  -> wf. convergence          0.1000000E-03 e    :
          :  Broyden damping             0.4000000          :
          ...................................................

 iter      E             dE          RMSdq      gap      omega  full diag
   1    -44.0137918 -0.440138E+02  0.332E+00    3.58       0.0  T
   2    -44.0742349 -0.604431E-01  0.189E+00    3.29       1.0  T
   3    -44.0743471 -0.112186E-03  0.801E-01    3.02       1.0  T
   4    -44.0756763 -0.132925E-02  0.414E-01    2.89       1.0  T
   5    -44.0787333 -0.305697E-02  0.153E-01    2.91       1.0  T
   6    -44.0789407 -0.207429E-03  0.526E-02    2.93       1.0  T
   7    -44.0789538 -0.131019E-04  0.265E-02    2.94       1.0  T
   8    -44.0789630 -0.916197E-05  0.145E-02    2.94       1.2  T
   9    -44.0789658 -0.278733E-05  0.417E-03    2.94       4.2  T
  10    -44.0789658 -0.432529E-07  0.191E-03    2.94       9.1  T
  11    -44.0789658 -0.105567E-07  0.796E-04    2.94      21.9  T
  12    -44.0789658 -0.949036E-09  0.435E-04    2.94      40.0  T

   *** convergence criteria satisfied after 12 iterations ***

         #    Occupation            Energy/Eh            Energy/eV
      -------------------------------------------------------------
         1        2.0000           -0.7314324             -19.9033
       ...           ...                  ...                  ...
        35        2.0000           -0.4371831             -11.8964
        36        2.0000           -0.4311037             -11.7309
        37        2.0000           -0.4260925             -11.5946
        38        2.0000           -0.4220635             -11.4849
        39        2.0000           -0.3967994             -10.7975
        40        2.0000           -0.3783100             -10.2943
        41        2.0000           -0.3521533              -9.5826 (HOMO)
        42                         -0.2441899              -6.6447 (LUMO)
        43                         -0.2045365              -5.5657
        44                         -0.1941745              -5.2838
        45                         -0.1734542              -4.7199
        46                         -0.1385028              -3.7689
       ...                                ...                  ...
        88                          0.7012493              19.0820
      -------------------------------------------------------------
                  HL-Gap            0.1079634 Eh            2.9378 eV
             Fermi-level           -0.2981716 Eh           -8.1137 eV

 SCC (total)                   0 d,  0 h,  0 min,  0.060 sec
 SCC setup                      ...        0 min,  0.000 sec (  0.632%)
 Dispersion                     ...        0 min,  0.001 sec (  0.850%)
 integral evaluation            ...        0 min,  0.014 sec ( 23.841%)
 zeroth order Hamiltonian       ...        0 min,  0.000 sec (  0.487%)
 iterations                     ...        0 min,  0.020 sec ( 34.344%)
 molecular gradient             ...        0 min,  0.023 sec ( 38.973%)
 printout                       ...        0 min,  0.000 sec (  0.781%)

         :::::::::::::::::::::::::::::::::::::::::::::::::::::
         ::                     SUMMARY                     ::
         :::::::::::::::::::::::::::::::::::::::::::::::::::::
         :: total energy             -43.503076349078 Eh    ::
         :: gradient norm              0.065058802636 Eh/a0 ::
         :: HOMO-LUMO gap              2.937832670931 eV    ::
         ::.................................................::
         :: SCC energy               -44.078965816116 Eh    ::
         :: -> isotropic ES            0.006295338519 Eh    ::
         :: -> anisotropic ES          0.007307155442 Eh    ::
         :: -> anisotropic XC          0.023964576290 Eh    ::
         :: -> dispersion             -0.037830459034 Eh    ::
         :: repulsion energy           0.575239005650 Eh    ::
         :: add. restraining           0.000000000000 Eh    ::
         :::::::::::::::::::::::::::::::::::::::::::::::::::::

      ----------------------------------------------------------- 
     |                   =====================                   |
     |                        A N C O P T                        |
     |                   =====================                   |
     |               Approximate Normal Coordinate               |
     |                Rational Function Optimizer                |
      ----------------------------------------------------------- 

          ...................................................
          :                      SETUP                      :
          :.................................................:
          :   optimization level            normal          :
          :   max. optcycles                   200          :
          :   ANC micro-cycles                  20          :
          :   degrees of freedom                93          :
          :.................................................:
          :   RF solver                   davidson          :
          :   input Hessian                  false          :
          :   write xtbopt.log                true          :
          :   linear?                        false          :
          :   energy convergence         0.5000000E-05 Eh   :
          :   grad. convergence          0.1000000E-02 Eh/α :
          :   maximium RF displ.         2.0000000          :
          :   Hlow (freq-cutoff)         0.5000000E-02      :
          :   Hmax (freq-cutoff)         5.0000000          :
          :   S6 in model hess.         20.0000000          :
          ...................................................

generating ANC from model Hessian ...
Using Lindh-Hessian (1995)
 Shifting diagonal of input Hessian by   3.365397039307729E-003
 Lowest  eigenvalues of input Hessian
   -0.000000   -0.000000   -0.000000   -0.000000   -0.000000    0.000000
    0.005000    0.005205    0.005496    0.006162    0.006716    0.007695
    0.008383    0.009897    0.012260    0.013188    0.014384    0.014756
 Highest eigenvalues
    1.287244    1.382279    1.569777    1.710615    1.799492    1.862292
 

........................................................................
.............................. CYCLE    1 ..............................
........................................................................
   1    -44.0789658 -0.440790E+02  0.117E-04    2.94       0.0  T
   2    -44.0789658 -0.611067E-10  0.733E-05    2.94     237.6  T
   3    -44.0789658 -0.171170E-10  0.563E-05    2.94     309.4  T
     SCC iter.                  ...        0 min,  0.006 sec
     gradient                   ...        0 min,  0.023 sec
 * total energy  :   -43.5030764 Eh     change       -0.5088673E-08 Eh
   gradient norm :     0.0650609 Eh/α   predicted     0.0000000E+00 (-100.00%)
   displ. norm   :     0.2955778 α      lambda       -0.9509508E-02
   maximum displ.:     0.0985861 α      in ANC's #18, #22, #42, ...

........................................................................
.............................. CYCLE    2 ..............................
........................................................................
   1    -44.1003561 -0.441004E+02  0.270E-01    2.97       0.0  T
   2    -44.1004122 -0.560990E-04  0.155E-01    2.95       1.0  T
   3    -44.1002540  0.158144E-03  0.108E-01    2.96       1.0  T
   4    -44.1005575 -0.303472E-03  0.253E-02    2.95       1.0  T
   5    -44.1005586 -0.112138E-05  0.116E-02    2.95       1.5  T
   6    -44.1005598 -0.114789E-05  0.399E-03    2.95       4.4  T
   7    -44.1005601 -0.367718E-06  0.163E-03    2.95      10.7  T
     SCC iter.                  ...        0 min,  0.010 sec
     gradient                   ...        0 min,  0.022 sec
 * total energy  :   -43.5088603 Eh     change       -0.5783919E-02 Eh
   gradient norm :     0.0292645 Eh/α   predicted    -0.5170162E-02 ( -10.61%)
   displ. norm   :     0.2429494 α      lambda       -0.2009865E-02
   maximum displ.:     0.1421846 α      in ANC's #9, #10, #3, ...

........................................................................
.............................. CYCLE    3 ..............................
........................................................................
   1    -44.1091624 -0.441092E+02  0.135E-01    2.96       0.0  T
   2    -44.1091861 -0.237507E-04  0.781E-02    2.94       1.0  T
   3    -44.1091593  0.268060E-04  0.542E-02    2.94       1.0  T
   4    -44.1092244 -0.651163E-04  0.127E-02    2.94       1.4  T
   5    -44.1092253 -0.876808E-06  0.610E-03    2.94       2.9  T
   6    -44.1092255 -0.154872E-06  0.224E-03    2.94       7.8  T
   7    -44.1092256 -0.141427E-06  0.876E-04    2.94      19.9  T
     SCC iter.                  ...        0 min,  0.011 sec
     gradient                   ...        0 min,  0.022 sec
 * total energy  :   -43.5100915 Eh     change       -0.1231261E-02 Eh
   gradient norm :     0.0111221 Eh/α   predicted    -0.1064248E-02 ( -13.56%)
   displ. norm   :     0.1803513 α      lambda       -0.4595983E-03
   maximum displ.:     0.0923742 α      in ANC's #9, #3, #6, ...

........................................................................
.............................. CYCLE    4 ..............................
........................................................................
   1    -44.1085892 -0.441086E+02  0.846E-02    2.93       0.0  T
   2    -44.1085938 -0.466774E-05  0.463E-02    2.92       1.0  T
   3    -44.1085776  0.162040E-04  0.299E-02    2.92       1.0  T
   4    -44.1085987 -0.210170E-04  0.686E-03    2.92       2.5  T
   5    -44.1085989 -0.239752E-06  0.359E-03    2.92       4.8  T
   6    -44.1085990 -0.106231E-06  0.113E-03    2.92      15.4  T
   7    -44.1085990 -0.226675E-07  0.624E-04    2.92      27.9  T
     SCC iter.                  ...        0 min,  0.011 sec
     gradient                   ...        0 min,  0.021 sec
 * total energy  :   -43.5103891 Eh     change       -0.2975978E-03 Eh
   gradient norm :     0.0048769 Eh/α   predicted    -0.2372739E-03 ( -20.27%)
   displ. norm   :     0.1325653 α      lambda       -0.1474116E-03
   maximum displ.:     0.0833985 α      in ANC's #3, #4, #7, ...

........................................................................
.............................. CYCLE    5 ..............................
........................................................................
   1    -44.1070306 -0.441070E+02  0.617E-02    2.92       0.0  T
   2    -44.1070320 -0.140708E-05  0.327E-02    2.91       1.0  T
   3    -44.1070285  0.346303E-05  0.137E-02    2.91       1.3  T
   4    -44.1070326 -0.410734E-05  0.461E-03    2.91       3.8  T
   5    -44.1070328 -0.121212E-06  0.192E-03    2.91       9.1  T
   6    -44.1070328 -0.457501E-07  0.586E-04    2.91      29.7  T
     SCC iter.                  ...        0 min,  0.010 sec
     gradient                   ...        0 min,  0.022 sec
 * total energy  :   -43.5104877 Eh     change       -0.9852911E-04 Eh
   gradient norm :     0.0027934 Eh/α   predicted    -0.7500123E-04 ( -23.88%)
   displ. norm   :     0.1020499 α      lambda       -0.6437693E-04
   maximum displ.:     0.0684689 α      in ANC's #3, #4, #2, ...

........................................................................
.............................. CYCLE    6 ..............................
........................................................................
   1    -44.1064761 -0.441065E+02  0.514E-02    2.91       0.0  T
   2    -44.1064768 -0.760195E-06  0.265E-02    2.91       1.0  T
   3    -44.1064769 -0.510855E-07  0.513E-03    2.91       3.4  T
   4    -44.1064768  0.475827E-07  0.321E-03    2.91       5.4  T
   5    -44.1064770 -0.168382E-06  0.906E-04    2.91      19.2  T
   6    -44.1064770 -0.187996E-07  0.297E-04    2.91      58.7  T
     SCC iter.                  ...        0 min,  0.009 sec
     gradient                   ...        0 min,  0.022 sec
 * total energy  :   -43.5105366 Eh     change       -0.4898825E-04 Eh
   gradient norm :     0.0025066 Eh/α   predicted    -0.3252707E-04 ( -33.60%)
   displ. norm   :     0.1136772 α      lambda       -0.5475592E-04
   maximum displ.:     0.0737461 α      in ANC's #3, #4, #1, ...

........................................................................
.............................. CYCLE    7 ..............................
........................................................................
   1    -44.1066372 -0.441066E+02  0.668E-02    2.91       0.0  T
   2    -44.1066385 -0.131826E-05  0.332E-02    2.91       1.0  T
   3    -44.1066386 -0.846404E-07  0.633E-03    2.91       2.8  T
   4    -44.1066384  0.175271E-06  0.447E-03    2.91       3.9  T
   5    -44.1066389 -0.415398E-06  0.847E-04    2.91      20.5  T
   6    -44.1066389 -0.121028E-07  0.346E-04    2.91      50.3  T
     SCC iter.                  ...        0 min,  0.009 sec
     gradient                   ...        0 min,  0.023 sec
 * total energy  :   -43.5105783 Eh     change       -0.4160282E-04 Eh
   gradient norm :     0.0025586 Eh/α   predicted    -0.2773310E-04 ( -33.34%)
   displ. norm   :     0.1126788 α      lambda       -0.3932122E-04
   maximum displ.:     0.0733779 α      in ANC's #3, #1, #2, ...

........................................................................
.............................. CYCLE    8 ..............................
........................................................................
   1    -44.1070969 -0.441071E+02  0.657E-02    2.91       0.0  T
   2    -44.1070981 -0.125874E-05  0.326E-02    2.91       1.0  T
   3    -44.1070981  0.275310E-07  0.656E-03    2.91       2.7  T
   4    -44.1070980  0.761378E-07  0.469E-03    2.91       3.7  T
   5    -44.1070985 -0.431582E-06  0.608E-04    2.91      28.6  T
   6    -44.1070985 -0.421706E-08  0.285E-04    2.91      61.0  T
     SCC iter.                  ...        0 min,  0.010 sec
     gradient                   ...        0 min,  0.022 sec
 * total energy  :   -43.5106074 Eh     change       -0.2918455E-04 Eh
   gradient norm :     0.0021428 Eh/α   predicted    -0.1991453E-04 ( -31.76%)
   displ. norm   :     0.0909587 α      lambda       -0.2348901E-04
   maximum displ.:     0.0608954 α      in ANC's #3, #1, #2, ...

........................................................................
.............................. CYCLE    9 ..............................
........................................................................
   1    -44.1075245 -0.441075E+02  0.496E-02    2.91       0.0  T
   2    -44.1075252 -0.685156E-06  0.249E-02    2.91       1.0  T
   3    -44.1075251  0.799285E-07  0.530E-03    2.91       3.3  T
   4    -44.1075251 -0.125141E-07  0.367E-03    2.91       4.7  T
   5    -44.1075254 -0.249180E-06  0.477E-04    2.91      36.5  T
   6    -44.1075254 -0.374303E-08  0.217E-04    2.91      80.4  T
     SCC iter.                  ...        0 min,  0.009 sec
     gradient                   ...        0 min,  0.022 sec
 * total energy  :   -43.5106251 Eh     change       -0.1763615E-04 Eh
   gradient norm :     0.0013399 Eh/α   predicted    -0.1184222E-04 ( -32.85%)
   displ. norm   :     0.1065168 α      lambda       -0.1488223E-04
   maximum displ.:     0.0732051 α      in ANC's #3, #2, #1, ...

........................................................................
.............................. CYCLE   10 ..............................
........................................................................
   1    -44.1078444 -0.441078E+02  0.492E-02    2.91       0.0  T
   2    -44.1078450 -0.575581E-06  0.259E-02    2.91       1.0  T
   3    -44.1078447  0.281893E-06  0.596E-03    2.91       2.9  T
   4    -44.1078449 -0.217142E-06  0.377E-03    2.91       4.6  T
   5    -44.1078451 -0.232385E-06  0.696E-04    2.91      25.0  T
   6    -44.1078451 -0.114716E-07  0.231E-04    2.91      75.3  T
     SCC iter.                  ...        0 min,  0.009 sec
     gradient                   ...        0 min,  0.021 sec
 * total energy  :   -43.5106398 Eh     change       -0.1472148E-04 Eh
   gradient norm :     0.0011309 Eh/α   predicted    -0.7480100E-05 ( -49.19%)
   displ. norm   :     0.0549773 α      lambda       -0.7214620E-05
   maximum displ.:     0.0369478 α      in ANC's #3, #6, #11, ...

........................................................................
.............................. CYCLE   11 ..............................
........................................................................
   1    -44.1077768 -0.441078E+02  0.234E-02    2.91       0.0  T
   2    -44.1077769 -0.105129E-06  0.130E-02    2.91       1.3  T
   3    -44.1077768  0.599164E-07  0.253E-03    2.91       6.9  T
   4    -44.1077769 -0.447548E-07  0.158E-03    2.91      11.0  T
   5    -44.1077769 -0.453173E-07  0.367E-04    2.91      47.5  T
   6    -44.1077769 -0.269490E-08  0.126E-04    2.91     137.8  T
     SCC iter.                  ...        0 min,  0.009 sec
     gradient                   ...        0 min,  0.023 sec
 * total energy  :   -43.5106487 Eh     change       -0.8922360E-05 Eh
   gradient norm :     0.0010394 Eh/α   predicted    -0.3616863E-05 ( -59.46%)
   displ. norm   :     0.0729915 α      lambda       -0.8914030E-05
   maximum displ.:     0.0443167 α      in ANC's #3, #6, #11, ...

........................................................................
.............................. CYCLE   12 ..............................
........................................................................
   1    -44.1075391 -0.441075E+02  0.331E-02    2.91       0.0  T
   2    -44.1075393 -0.209478E-06  0.182E-02    2.91       1.0  T
   3    -44.1075393 -0.180576E-07  0.282E-03    2.91       6.2  T
   4    -44.1075393  0.260869E-07  0.154E-03    2.91      11.3  T
   5    -44.1075394 -0.563052E-07  0.340E-04    2.91      51.2  T
   6    -44.1075394 -0.241576E-08  0.139E-04    2.91     125.6  T
     SCC iter.                  ...        0 min,  0.010 sec
     gradient                   ...        0 min,  0.023 sec
 * total energy  :   -43.5106581 Eh     change       -0.9406472E-05 Eh
   gradient norm :     0.0007216 Eh/α   predicted    -0.4471661E-05 ( -52.46%)
   displ. norm   :     0.0578944 α      lambda       -0.4642440E-05
   maximum displ.:     0.0381679 α      in ANC's #3, #6, #11, ...

........................................................................
.............................. CYCLE   13 ..............................
........................................................................
   1    -44.1074262 -0.441074E+02  0.258E-02    2.91       0.0  T
   2    -44.1074263 -0.960916E-07  0.144E-02    2.91       1.2  T
   3    -44.1074263  0.173707E-07  0.231E-03    2.91       7.5  T
   4    -44.1074263  0.155326E-07  0.164E-03    2.91      10.6  T
   5    -44.1074264 -0.598003E-07  0.258E-04    2.91      67.4  T
   6    -44.1074264 -0.111568E-08  0.110E-04    2.91     158.2  T
     SCC iter.                  ...        0 min,  0.009 sec
     gradient                   ...        0 min,  0.022 sec
 * total energy  :   -43.5106625 Eh     change       -0.4420087E-05 Eh
   gradient norm :     0.0005744 Eh/α   predicted    -0.2328568E-05 ( -47.32%)
   displ. norm   :     0.0578774 α      lambda        0.2204965E-05
   maximum displ.:     0.0381681 α      in ANC's #3, #6, #11, ...

   *** GEOMETRY OPTIMIZATION CONVERGED AFTER 13 ITERATIONS ***

------------------------------------------------------------------------
 total energy gain   :        -0.0075862 Eh       -4.7604 kcal/mol
 total RMSD          :         0.1943701 a0        0.1029 Å
 total power (kW/mol):        -1.5321191 (step)  -31.8425 (real)
------------------------------------------------------------------------

 ANCopt (total)                0 d,  0 h,  0 min,  0.626 sec
 optimizer setup                ...        0 min,  0.000 sec (  0.023%)
 model hessian                  ...        0 min,  0.022 sec (  3.578%)
 ANC generation                 ...        0 min,  0.001 sec (  0.154%)
 coordinate transformation      ...        0 min,  0.000 sec (  0.044%)
 single point calculation       ...        0 min,  0.598 sec ( 95.540%)
 optimization log               ...        0 min,  0.002 sec (  0.240%)
 hessian update                 ...        0 min,  0.000 sec (  0.030%)
 rational function              ...        0 min,  0.002 sec (  0.262%)

================
 final structure:
================
$coord
    5.66326757915054    1.85044649974018   -1.38908530119679      C 
    4.27708065236583   -0.11580567566189   -2.29447862893762      C 
    1.82055174878062   -0.13985971758399   -1.26037398267863      C 
    1.43704397000770    1.79723381033453    0.41384357968370      C 
    4.02076194736915    3.72399840626393    0.72285420797496      S 
   -1.21202518159528    1.79980964989175    1.29969264225183      C 
   -1.90056084694907   -0.99239717503250    0.90617810337277      C 
   -0.50992123266606   -1.78925805038159   -1.55053744871552      C 
   -2.02481839489474   -1.01674922570185   -3.90982300785509      C 
   -0.65749413322387   -1.47312725725037   -6.40337871076329      C 
    0.24971137221490   -4.58913799160006   -1.54632710692801      C 
   -1.94584677279153   -6.45215852252916   -1.55913447503060      C 
   -4.72450282378193   -1.07494154169300    1.41546428709792      C 
   -5.00962806013369    0.22695191594415    3.99355382053358      C 
   -2.31020754952580    2.39663459305457    4.50635942073568      S 
    7.58227159587932    2.33086046562239   -1.82423340061500      H 
    5.00146513620141   -1.47899871197109   -3.61498606524726      H 
   -2.34555085026710    3.06049399908928    0.10371890739370      H 
   -0.97417204418193   -2.03614376560477    2.44174640089775      H 
   -2.45319223859240    0.99764742517484   -3.76507824416443      H 
   -3.81784871602573   -2.03608399780651   -3.91474750471647      H 
    1.16304321105019   -0.52054918958396   -6.41493538258992      H 
   -1.78196594957077   -0.73030201647774   -7.95646632933744      H 
   -0.35942871867747   -3.47742690749032   -6.73841103985338      H 
    1.40711132889775   -4.93156990135756    0.13077994176228      H 
    1.44566220351379   -4.94307625134625   -3.18756057896736      H 
   -3.11276124756527   -6.22369290149351    0.11454370149700      H 
   -1.22060068298809   -8.37594066195392   -1.57113101003481      H 
   -3.12580013125107   -6.20598166587379   -3.22153532991517      H 
   -5.47981606948420   -2.98695094368493    1.50973181456444      H 
   -5.75555319869563   -0.03261454993531   -0.03393717491737      H 
   -4.94879792927585   -1.13153364588595    5.53817206165209      H 
   -6.74155307584067    1.32688761189607    4.13791541329963      H 
$end
           -------------------------------------------------
          |                Final Singlepoint                |
           -------------------------------------------------

          ...................................................
          :                      SETUP                      :
          :.................................................:
          :  # basis functions                  90          :
          :  # atomic orbitals                  88          :
          :  # shells                           50          :
          :  # electrons                        82          :
          :  max. iterations                   250          :
          :  Hamiltonian                  GFN2-xTB          :
          :  restarted?                      false          :
          :  GBSA solvation                  false          :
          :  PC potential                    false          :
          :  electronic temp.          300.0000000     K    :
          :  accuracy                    1.0000000          :
          :  -> integral cutoff          0.2500000E+02      :
          :  -> integral neglect         0.1000000E-07      :
          :  -> SCF convergence          0.1000000E-05 Eh   :
          :  -> wf. convergence          0.1000000E-03 e    :
          :  Broyden damping             0.4000000          :
          ...................................................

 iter      E             dE          RMSdq      gap      omega  full diag
   1    -44.1074264 -0.441074E+02  0.527E-05    2.91       0.0  T
   2    -44.1074264 -0.143885E-10  0.345E-05    2.91     505.2  T
   3    -44.1074264 -0.350937E-10  0.206E-05    2.91     846.2  T

   *** convergence criteria satisfied after 3 iterations ***

         #    Occupation            Energy/Eh            Energy/eV
      -------------------------------------------------------------
         1        2.0000           -0.7290977             -19.8398
       ...           ...                  ...                  ...
        35        2.0000           -0.4393060             -11.9541
        36        2.0000           -0.4296682             -11.6919
        37        2.0000           -0.4266822             -11.6106
        38        2.0000           -0.4240361             -11.5386
        39        2.0000           -0.3957106             -10.7678
        40        2.0000           -0.3813484             -10.3770
        41        2.0000           -0.3521067              -9.5813 (HOMO)
        42                         -0.2450955              -6.6694 (LUMO)
        43                         -0.2110197              -5.7421
        44                         -0.1989419              -5.4135
        45                         -0.1694958              -4.6122
        46                         -0.1405099              -3.8235
       ...                                ...                  ...
        88                          0.6760768              18.3970
      -------------------------------------------------------------
                  HL-Gap            0.1070112 Eh            2.9119 eV
             Fermi-level           -0.2986011 Eh           -8.1253 eV

 SCC (total)                   0 d,  0 h,  0 min,  0.044 sec
 SCC setup                      ...        0 min,  0.000 sec (  0.599%)
 Dispersion                     ...        0 min,  0.000 sec (  0.679%)
 integral evaluation            ...        0 min,  0.014 sec ( 31.632%)
 zeroth order Hamiltonian       ...        0 min,  0.000 sec (  0.594%)
 iterations                     ...        0 min,  0.006 sec ( 12.644%)
 molecular gradient             ...        0 min,  0.023 sec ( 52.861%)
 printout                       ...        0 min,  0.000 sec (  0.883%)

         :::::::::::::::::::::::::::::::::::::::::::::::::::::
         ::                     SUMMARY                     ::
         :::::::::::::::::::::::::::::::::::::::::::::::::::::
         :: total energy             -43.510662544176 Eh    ::
         :: gradient norm              0.000574294753 Eh/a0 ::
         :: HOMO-LUMO gap              2.911923136582 eV    ::
         ::.................................................::
         :: SCC energy               -44.107426368263 Eh    ::
         :: -> isotropic ES            0.006880560788 Eh    ::
         :: -> anisotropic ES          0.006507544240 Eh    ::
         :: -> anisotropic XC          0.023465503283 Eh    ::
         :: -> dispersion             -0.038036059287 Eh    ::
         :: repulsion energy           0.596121357148 Eh    ::
         :: add. restraining           0.000000000000 Eh    ::
         :::::::::::::::::::::::::::::::::::::::::::::::::::::

           -------------------------------------------------
          |                Property Printout                |
           -------------------------------------------------

    * Orbital Energies and Occupations

         #    Occupation            Energy/Eh            Energy/eV
      -------------------------------------------------------------
         1        2.0000           -0.7290977             -19.8398
       ...           ...                  ...                  ...
        29        2.0000           -0.4624637             -12.5843
        30        2.0000           -0.4605340             -12.5318
        31        2.0000           -0.4552956             -12.3892
        32        2.0000           -0.4511637             -12.2768
        33        2.0000           -0.4491767             -12.2227
        34        2.0000           -0.4415621             -12.0155
        35        2.0000           -0.4393060             -11.9541
        36        2.0000           -0.4296682             -11.6919
        37        2.0000           -0.4266822             -11.6106
        38        2.0000           -0.4240361             -11.5386
        39        2.0000           -0.3957106             -10.7678
        40        2.0000           -0.3813484             -10.3770
        41        2.0000           -0.3521067              -9.5813 (HOMO)
        42                         -0.2450955              -6.6694 (LUMO)
        43                         -0.2110197              -5.7421
        44                         -0.1989419              -5.4135
        45                         -0.1694958              -4.6122
        46                         -0.1405099              -3.8235
        47                         -0.1198413              -3.2610
        48                         -0.0295529              -0.8042
        49                         -0.0103253              -0.2810
        50                          0.0072266               0.1966
        51                          0.0133240               0.3626
        52                          0.0178630               0.4861
       ...                                ...                  ...
        88                          0.6760768              18.3970
      -------------------------------------------------------------
                  HL-Gap            0.1070112 Eh            2.9119 eV
             Fermi-level           -0.2986011 Eh           -8.1253 eV

     #   Z        covCN         q      C6AA      α(0)
     1   6 C      2.952    -0.027    28.669     8.782
     2   6 C      3.085    -0.049    29.103     8.844
     3   6 C      3.243    -0.025    27.639     8.520
     4   6 C      3.060     0.004    27.879     8.659
     5  16 S      2.263    -0.021   141.905    20.049
     6   6 C      3.908     0.039    19.862     6.335
     7   6 C      4.066    -0.020    20.848     6.486
     8   6 C      3.923     0.011    20.323     6.407
     9   6 C      3.804    -0.053    21.523     6.605
    10   6 C      3.751    -0.101    22.498     6.764
    11   6 C      3.804    -0.056    21.582     6.614
    12   6 C      3.751    -0.101    22.496     6.764
    13   6 C      3.846    -0.052    21.482     6.593
    14   6 C      3.805    -0.008    20.725     6.481
    15  16 S      2.084    -0.220   150.434    20.643
    16   1 H      0.926     0.044     2.390     2.418
    17   1 H      0.926     0.038     2.477     2.461
    18   1 H      0.924     0.035     2.517     2.481
    19   1 H      0.923     0.044     2.395     2.420
    20   1 H      0.924     0.028     2.616     2.529
    21   1 H      0.924     0.036     2.501     2.473
    22   1 H      0.925     0.039     2.462     2.454
    23   1 H      0.925     0.034     2.531     2.488
    24   1 H      0.925     0.037     2.484     2.464
    25   1 H      0.924     0.031     2.567     2.506
    26   1 H      0.924     0.041     2.430     2.438
    27   1 H      0.925     0.033     2.541     2.493
    28   1 H      0.925     0.035     2.512     2.479
    29   1 H      0.925     0.037     2.494     2.470
    30   1 H      0.925     0.040     2.446     2.446
    31   1 H      0.924     0.037     2.495     2.470
    32   1 H      0.925     0.045     2.387     2.416
    33   1 H      0.925     0.044     2.401     2.423

 Mol. C6AA /au·bohr⁶  :      13237.357408
 Mol. C8AA /au·bohr⁸  :     364782.743442
 Mol. α(0) /au        :        178.872644


Wiberg/Mayer (AO) data.
largest (>0.10) Wiberg bond orders for each atom
          total WBO             WBO to atom ...
     1  C   3.943        C    2 1.620    S    5 1.186    H   16 0.971    C    4 0.117
     2  C   3.987        C    1 1.620    C    3 1.265    H   17 0.963
     3  C   3.978        C    4 1.536    C    2 1.265    C    8 0.975
     4  C   3.945        C    3 1.536    S    5 1.180    C    6 1.026    C    1 0.117
     5  S   2.633        C    1 1.186    C    4 1.180
     6  C   3.979        C    4 1.026    C    7 0.971    S   15 0.962    H   18 0.947
     7  C   3.987        C   13 1.001    C    6 0.971    H   19 0.963    C    8 0.958
     8  C   3.988        C   11 0.984    C    3 0.975    C    9 0.975    C    7 0.958
     9  C   3.997        C   10 1.019    H   20 0.975    C    8 0.975    H   21 0.972
    10  C   3.996        C    9 1.019    H   23 0.986    H   24 0.985    H   22 0.985
    11  C   3.996        C   12 1.018    C    8 0.984    H   25 0.976    H   26 0.972
    12  C   3.996        C   11 1.018    H   28 0.986    H   29 0.985    H   27 0.984
    13  C   3.996        C   14 1.005    C    7 1.001    H   31 0.977    H   30 0.968
    14  C   3.979        C   13 1.005    H   33 0.981    H   32 0.981    S   15 0.978
    15  S   2.058        C   14 0.978    C    6 0.962
    16  H   0.997        C    1 0.971
    17  H   0.998        C    2 0.963
    18  H   0.999        C    6 0.947
    19  H   0.998        C    7 0.963
    20  H   0.999        C    9 0.975
    21  H   0.998        C    9 0.972
    22  H   0.998        C   10 0.985
    23  H   0.998        C   10 0.986
    24  H   0.999        C   10 0.985
    25  H   0.999        C   11 0.976
    26  H   0.997        C   11 0.972
    27  H   0.999        C   12 0.984
    28  H   0.998        C   12 0.986
    29  H   0.999        C   12 0.985
    30  H   0.998        C   13 0.968
    31  H   0.999        C   13 0.977
    32  H   0.998        C   14 0.981
    33  H   0.998        C   14 0.981

molecular dipole:
                 x           y           z       tot (Debye)
 q only:       -0.280      -0.757      -0.751
   full:       -0.484      -1.067      -1.080       4.051
molecular quadrupole (traceless):
                xx          xy          yy          xz          yz          zz
 q only:        4.709       1.849      -1.129      -0.781      -2.953      -3.580
  q+dip:        8.288      -0.060      -2.037      -1.287      -6.498      -6.252
   full:        8.166       0.653      -2.589      -1.774      -6.312      -5.576

           -------------------------------------------------
          |                Geometry Summary                 |
           -------------------------------------------------

      molecular mass/u    :      238.4052000
   center of mass at/Å    :       -0.0563222       0.0328010      -0.0079569
  moments of inertia/u·Å² :        0.9363693E+03   0.9592041E+03   0.1620810E+04
rotational constants/cm⁻¹ :        0.1800319E-01   0.1757460E-01   0.1040075E-01

 * 32 selected distances

     #   Z        #   Z                                     value/Å
     1   6 C      2   6 C                                 1.3602428
     2   6 C      3   6 C                                 1.4104818
     3   6 C      4   6 C                                 1.3699881
     1   6 C      5  16 S                                 1.7284188 (max)
     4   6 C      5  16 S                                 1.7133831
     4   6 C      6   6 C                                 1.4781298
     6   6 C      7   6 C                                 1.5360143
     7   6 C      8   6 C                                 1.5522418
     8   6 C      9   6 C                                 1.5389792
     9   6 C     10   6 C                                 1.5241478
     8   6 C     11   6 C                                 1.5351967
    11   6 C     12   6 C                                 1.5237627
     7   6 C     13   6 C                                 1.5191014
    13   6 C     14   6 C                                 1.5357786
     1   6 C     16   1 H                                 1.0718587 (min)
     2   6 C     17   1 H                                 1.0749944
     6   6 C     18   1 H                                 1.0979068
     7   6 C     19   1 H                                 1.0980362
     9   6 C     20   1 H                                 1.0924978
     9   6 C     21   1 H                                 1.0914434
    10   6 C     22   1 H                                 1.0873137
    10   6 C     23   1 H                                 1.0881392
    10   6 C     24   1 H                                 1.0868516
    11   6 C     25   1 H                                 1.0934296
    11   6 C     26   1 H                                 1.0908265
    12   6 C     27   1 H                                 1.0864364
    12   6 C     28   1 H                                 1.0879791
    12   6 C     29   1 H                                 1.0866149
    13   6 C     30   1 H                                 1.0890211
    13   6 C     31   1 H                                 1.0909622
    14   6 C     32   1 H                                 1.0890037
    14   6 C     33   1 H                                 1.0883908

 * 3 distinct bonds (by element types)

   Z      Z             #   av. dist./Å        max./Å        min./Å
   1 H    6 C          18     1.0884281     1.0980362     1.0718587
   6 C    6 C          12     1.4903387     1.5522418     1.3602428
   6 C   16 S           2     1.7209010     1.7284188     1.7133831


optimized geometry written to: xtbopt.xyz


           -------------------------------------------------
          | TOTAL ENERGY              -43.510662544176 Eh   |
          | GRADIENT NORM               0.000574294753 Eh/α |
          | HOMO-LUMO GAP               2.911923136582 eV   |
           -------------------------------------------------

------------------------------------------------------------------------
 * finished run on 2021/05/19 at 10:58:35.900     
------------------------------------------------------------------------
 total:
 * wall-time:     0 d,  0 h,  0 min,  0.755 sec
 *  cpu-time:     0 d,  0 h,  0 min,  0.755 sec
 * ratio c/w:     1.000 speedup
 SCF:
 * wall-time:     0 d,  0 h,  0 min,  0.060 sec
 *  cpu-time:     0 d,  0 h,  0 min,  0.060 sec
 * ratio c/w:     1.000 speedup
 ANC optimizer:
 * wall-time:     0 d,  0 h,  0 min,  0.670 sec
 *  cpu-time:     0 d,  0 h,  0 min,  0.670 sec
 * ratio c/w:     1.000 speedup

