      -----------------------------------------------------------      
     |                   =====================                   |     
     |                           x T B                           |     
     |                   =====================                   |     
     |                         S. Grimme                         |     
     |          Mulliken Center for Theoretical Chemistry        |     
     |                    University of Bonn                     |     
     |                Version 6.2 RC2 (SAW190805)                |     
      -----------------------------------------------------------      

   This program is distributed in the hope that it will be useful,
   but WITHOUT ANY WARRANTY; without even the implied warranty of
   MERCHANTABILITY or FITNESS FOR A PARTICULAR PURPOSE.
   
   FOR NON-COMMERCIAL, ACADEMIA USE ONLY.
   
   Cite this work as:
   * S. Grimme, C. Bannwarth, P. Shushkov, J. Chem. Theory Comput., 2017,
     13, 1989-2009. DOI: 10.1021/acs.jctc.7b00118
   * C. Bannwarth, S. Ehlert and S. Grimme., J. Chem. Theory Comput., 2019,
     15, 1652-1671. DOI: 10.1021/acs.jctc.8b01176
   * P. Pracht, E. Caldeweyher, S. Ehlert, S. Grimme, ChemRxiv, 2019, preprint.
     DOI: 10.26434/chemrxiv.8326202.v1
   
   for DFT-D4:
   * E. Caldeweyher, C. Bannwarth and S. Grimme, J. Chem. Phys., 2017,
     147, 034112. DOI: 10.1063/1.4993215
   * E. Caldeweyher, S. Ehlert, A. Hansen, H. Neugebauer, S. Spicher,
     C. Bannwarth and S. Grimme, J. Chem. Phys., 2019, 150, 154122.
     DOI: 10.1063/1.5090222
   
   for sTDA-xTB:
   * S. Grimme and C. Bannwarth, J. Chem. Phys., 2016, 145, 054103.
     DOI: 10.1063/1.4959605
   
   in the mass-spec context:
   * V. Asgeirsson, C. Bauer and S. Grimme, Chem. Sci., 2017, 8, 4879.
     DOI: 10.1039/c7sc00601b
   
   for metadynamics refer to:
   * S. Grimme, J. Chem. Theory Comput., 2019, 155, 2847-2862
     DOI: 10.1021/acs.jctc.9b00143
   
   with help from (in alphabetical order)
   C. Bannwarth, F. Bohle, G. Brandenburg, E. Caldeweyher, M. Checinski,
   S. Dohm, S. Ehlert, S. Ehrlich, F. März, H. Neugebauer, J. Pisarek,
   P. Pracht, P. Shushkov, and S. Spicher.
   
 * started run on 2021/05/19 at 11:00:03.809     

           -------------------------------------------------
          |                Calculation Setup                |
           -------------------------------------------------

          program call               : /ihome/ghutchison/geoffh/xtb/xtb 590.xyz -opt
          hostname                   : smp-n144
          coordinate file            : 590.xyz
          omp threads                :                     1
          number of atoms            :                    19
          number of electrons        :                    59
          charge                     :                     0
          spin                       :                   0.5
          first test random number   :      0.02755207863726


########################################################################
# WARNING! Please study the warnings concerning your input carefully
#  - the use of '-opt' is discouraged, please use '--opt' next time
########################################################################

           ------------------------------------------------- 
          |                 G F N 2 - x T B                 |
          | Geometry, Frequencies, Noncovalent interactions |
          |            JCTC 2019 parametrisation            |
           ------------------------------------------------- 
             KAB for C  - Si     :                1.0500
             KAB for H  - Pd     :                0.9500
             k(s)              :                1.8500
             k(p)              :                2.2300
             k(d)              :                2.2300
             k(f)              :                2.0000
             kEN (H0ij)        :               -2.0000
             D4 a1             :                0.5200
             D4 a2             :                5.0000
             D4 s6             :                1.0000
             D4 s8             :                2.7000
             D4 s9             :                5.0000
             alphaj            :                2.0000

  Z AO/shell   Hii/eV     exponent
  1     Wed Apr 25 08:07:45 CEST 2018   EN: 2.200 GM2: 0.406  GM3: 0.0800  RAES: 1.40
     1s    -10.707211    1.230000
  6     Wed Apr 25 08:07:45 CEST 2018   EN: 2.550 GM2: 0.538  GM3: 0.1500  RAES: 3.00
     2s    -13.970922    2.096432
     2p    -10.063292    1.800000
 16     Tue Apr 24 11:44:34 CEST 2018   EN: 2.580 GM2: 0.340  GM3:-0.0502  RAES: 3.10
     3s    -20.029654    1.981333
     3p    -11.377694    2.025643
     3d     -0.420282    1.702555

           ------------------------------------------------- 
          |        Self-Consistent Charge Iterations        |
           ------------------------------------------------- 

          ...................................................
          :                      SETUP                      :
          :.................................................:
          :  # basis functions                  67          :
          :  # atomic orbitals                  65          :
          :  # shells                           33          :
          :  # electrons                        59          :
          :  max. iterations                   250          :
          :  Hamiltonian                  GFN2-xTB          :
          :  restarted?                      false          :
          :  GBSA solvation                  false          :
          :  PC potential                    false          :
          :  electronic temp.          300.0000000     K    :
          :  accuracy                    1.0000000          :
          :  -> integral cutoff          0.2500000E+02      :
          :  -> integral neglect         0.1000000E-07      :
          :  -> SCF convergence          0.1000000E-05 Eh   :
          :  -> wf. convergence          0.1000000E-03 e    :
          :  Broyden damping             0.4000000          :
          ...................................................

 iter      E             dE          RMSdq      gap      omega  full diag
   1    -31.7634615 -0.317635E+02  0.476E+00    2.06       0.0  T
   2    -31.7800515 -0.165900E-01  0.268E+00    1.81       1.0  T
   3    -31.7601419  0.199096E-01  0.123E+00    2.17       1.0  T
   4    -31.7808306 -0.206887E-01  0.576E-01    1.82       1.0  T
   5    -31.7834181 -0.258747E-02  0.303E-01    2.00       1.0  T
   6    -31.7842562 -0.838132E-03  0.163E-01    1.92       1.0  T
   7    -31.7846496 -0.393366E-03  0.566E-02    1.95       1.0  T
   8    -31.7847036 -0.540056E-04  0.195E-02    1.94       1.2  T
   9    -31.7847050 -0.135786E-05  0.863E-03    1.94       2.7  T
  10    -31.7847051 -0.155968E-06  0.459E-03    1.94       5.0  T
  11    -31.7847053 -0.207754E-06  0.153E-03    1.94      15.0  T
  12    -31.7847053 -0.117095E-07  0.824E-04    1.94      27.9  T
  13    -31.7847053 -0.459091E-08  0.401E-04    1.94      57.3  T

   *** convergence criteria satisfied after 13 iterations ***

         #    Occupation            Energy/Eh            Energy/eV
      -------------------------------------------------------------
         1        2.0000           -0.7427342             -20.2108
       ...           ...                  ...                  ...
        24        2.0000           -0.4450290             -12.1099
        25        2.0000           -0.4405764             -11.9887
        26        2.0000           -0.4301012             -11.7036
        27        2.0000           -0.4031827             -10.9712
        28        2.0000           -0.3921385             -10.6706
        29        2.0000           -0.3568546              -9.7105
        30        1.0000           -0.3356824              -9.1344 (HOMO)
        31                         -0.2642636              -7.1910 (LUMO)
        32                         -0.2331759              -6.3450
        33                         -0.2192018              -5.9648
        34                         -0.2077683              -5.6537
        35                         -0.1730868              -4.7099
       ...                                ...                  ...
        65                          0.7610368              20.7089
      -------------------------------------------------------------
                  HL-Gap            0.0714188 Eh            1.9434 eV
             Fermi-level           -0.3231208 Eh           -8.7926 eV

 SCC (total)                   0 d,  0 h,  0 min,  0.037 sec
 SCC setup                      ...        0 min,  0.000 sec (  0.737%)
 Dispersion                     ...        0 min,  0.000 sec (  0.716%)
 integral evaluation            ...        0 min,  0.009 sec ( 23.633%)
 zeroth order Hamiltonian       ...        0 min,  0.000 sec (  0.470%)
 iterations                     ...        0 min,  0.014 sec ( 38.294%)
 molecular gradient             ...        0 min,  0.013 sec ( 34.993%)
 printout                       ...        0 min,  0.000 sec (  0.994%)

         :::::::::::::::::::::::::::::::::::::::::::::::::::::
         ::                     SUMMARY                     ::
         :::::::::::::::::::::::::::::::::::::::::::::::::::::
         :: total energy             -31.312747286638 Eh    ::
         :: gradient norm              0.176926224389 Eh/a0 ::
         :: HOMO-LUMO gap              1.943405553830 eV    ::
         ::.................................................::
         :: SCC energy               -31.784705336481 Eh    ::
         :: -> isotropic ES            0.002438350773 Eh    ::
         :: -> anisotropic ES          0.002339775672 Eh    ::
         :: -> anisotropic XC          0.015899413152 Eh    ::
         :: -> dispersion             -0.021161360823 Eh    ::
         :: repulsion energy           0.471965499269 Eh    ::
         :: add. restraining           0.000000000000 Eh    ::
         :::::::::::::::::::::::::::::::::::::::::::::::::::::

      ----------------------------------------------------------- 
     |                   =====================                   |
     |                        A N C O P T                        |
     |                   =====================                   |
     |               Approximate Normal Coordinate               |
     |                Rational Function Optimizer                |
      ----------------------------------------------------------- 

          ...................................................
          :                      SETUP                      :
          :.................................................:
          :   optimization level            normal          :
          :   max. optcycles                   200          :
          :   ANC micro-cycles                  20          :
          :   degrees of freedom                51          :
          :.................................................:
          :   RF solver                   davidson          :
          :   input Hessian                  false          :
          :   write xtbopt.log                true          :
          :   linear?                        false          :
          :   energy convergence         0.5000000E-05 Eh   :
          :   grad. convergence          0.1000000E-02 Eh/α :
          :   maximium RF displ.         2.0000000          :
          :   Hlow (freq-cutoff)         0.5000000E-02      :
          :   Hmax (freq-cutoff)         5.0000000          :
          :   S6 in model hess.         20.0000000          :
          ...................................................

generating ANC from model Hessian ...
Using Lindh-Hessian (1995)
 Shifting diagonal of input Hessian by   3.788673754645523E-003
 Lowest  eigenvalues of input Hessian
   -0.000000   -0.000000   -0.000000   -0.000000    0.000000    0.000000
    0.005000    0.007728    0.008429    0.010015    0.015248    0.015482
    0.021447    0.026741    0.031864    0.040763    0.043918    0.050659
 Highest eigenvalues
    1.668048    1.717281    1.829706    1.886662    2.019468    2.024542
 

........................................................................
.............................. CYCLE    1 ..............................
........................................................................
   1    -31.7847053 -0.317847E+02  0.143E-04    1.94       0.0  T
   2    -31.7847053 -0.134257E-10  0.877E-05    1.94     261.6  T
   3    -31.7847053 -0.525624E-10  0.690E-05    1.94     332.3  T
     SCC iter.                  ...        0 min,  0.004 sec
     gradient                   ...        0 min,  0.013 sec
 * total energy  :   -31.3127473 Eh     change       -0.1201204E-08 Eh
   gradient norm :     0.1769249 Eh/α   predicted     0.0000000E+00 (-100.00%)
   displ. norm   :     0.1760475 α      lambda       -0.1910812E-01
   maximum displ.:     0.0784676 α      in ANC's #8, #51, #17, ...

........................................................................
.............................. CYCLE    2 ..............................
........................................................................
   1    -31.8001195 -0.318001E+02  0.472E-01    1.95       0.0  T
   2    -31.8001474 -0.279231E-04  0.266E-01    1.91       1.0  T
   3    -31.7997513  0.396103E-03  0.243E-01    1.96       1.0  T
   4    -31.8004684 -0.717097E-03  0.846E-02    1.91       1.0  T
   5    -31.8005904 -0.121952E-03  0.276E-02    1.93       1.0  T
   6    -31.8005934 -0.297179E-05  0.993E-03    1.93       2.3  T
   7    -31.8005942 -0.847655E-06  0.456E-03    1.93       5.0  T
   8    -31.8005945 -0.299955E-06  0.124E-03    1.93      18.5  T
     SCC iter.                  ...        0 min,  0.008 sec
     gradient                   ...        0 min,  0.012 sec
 * total energy  :   -31.3278299 Eh     change       -0.1508257E-01 Eh
   gradient norm :     0.1047748 Eh/α   predicted    -0.9850166E-02 ( -34.69%)
   displ. norm   :     0.2377006 α      lambda       -0.1641496E-01
   maximum displ.:     0.0969877 α      in ANC's #8, #51, #10, ...

........................................................................
.............................. CYCLE    3 ..............................
........................................................................
   1    -31.8183422 -0.318183E+02  0.591E-01    1.93       0.0  T
   2    -31.8188184 -0.476208E-03  0.323E-01    1.92       1.0  T
   3    -31.8186935  0.124951E-03  0.216E-01    1.93       1.0  T
   4    -31.8190508 -0.357302E-03  0.878E-02    1.92       1.0  T
   5    -31.8191531 -0.102283E-03  0.286E-02    1.92       1.0  T
   6    -31.8191547 -0.167032E-05  0.161E-02    1.92       1.4  T
   7    -31.8191585 -0.375766E-05  0.514E-03    1.92       4.5  T
   8    -31.8191589 -0.364900E-06  0.175E-03    1.92      13.1  T
     SCC iter.                  ...        0 min,  0.008 sec
     gradient                   ...        0 min,  0.012 sec
 * total energy  :   -31.3359818 Eh     change       -0.8151919E-02 Eh
   gradient norm :     0.0211175 Eh/α   predicted    -0.8671232E-02 (   6.37%)
   displ. norm   :     0.1225643 α      lambda       -0.8657161E-03
   maximum displ.:     0.0836519 α      in ANC's #4, #8, #10, ...

........................................................................
.............................. CYCLE    4 ..............................
........................................................................
   1    -31.8127706 -0.318128E+02  0.873E-02    1.92       0.0  T
   2    -31.8127661  0.451673E-05  0.591E-02    1.90       1.0  T
   3    -31.8127714 -0.532065E-05  0.441E-02    1.92       1.0  T
   4    -31.8127945 -0.230180E-04  0.133E-02    1.91       1.7  T
   5    -31.8127959 -0.146715E-05  0.582E-03    1.91       3.9  T
   6    -31.8127960 -0.112929E-06  0.308E-03    1.91       7.5  T
     SCC iter.                  ...        0 min,  0.006 sec
     gradient                   ...        0 min,  0.012 sec
 * total energy  :   -31.3365454 Eh     change       -0.5636206E-03 Eh
   gradient norm :     0.0081278 Eh/α   predicted    -0.4393723E-03 ( -22.04%)
   displ. norm   :     0.1124864 α      lambda       -0.2372255E-03
   maximum displ.:     0.0901010 α      in ANC's #4, #8, #9, ...

........................................................................
.............................. CYCLE    5 ..............................
........................................................................
   1    -31.8110074 -0.318110E+02  0.673E-02    1.90       0.0  T
   2    -31.8110051  0.232639E-05  0.438E-02    1.90       1.0  T
   3    -31.8110015  0.357811E-05  0.366E-02    1.90       1.0  T
   4    -31.8110152 -0.136597E-04  0.900E-03    1.90       2.6  T
   5    -31.8110162 -0.105301E-05  0.369E-03    1.90       6.2  T
   6    -31.8110163 -0.246286E-07  0.230E-03    1.90      10.0  T
   7    -31.8110163 -0.448171E-07  0.104E-03    1.90      22.0  T
     SCC iter.                  ...        0 min,  0.007 sec
     gradient                   ...        0 min,  0.012 sec
 * total energy  :   -31.3366815 Eh     change       -0.1360790E-03 Eh
   gradient norm :     0.0042377 Eh/α   predicted    -0.1201218E-03 ( -11.73%)
   displ. norm   :     0.0569836 α      lambda       -0.4972249E-04
   maximum displ.:     0.0426099 α      in ANC's #4, #2, #3, ...

........................................................................
.............................. CYCLE    6 ..............................
........................................................................
   1    -31.8114201 -0.318114E+02  0.369E-02    1.90       0.0  T
   2    -31.8114201  0.286302E-07  0.222E-02    1.90       1.0  T
   3    -31.8114169  0.322422E-05  0.189E-02    1.90       1.2  T
   4    -31.8114214 -0.456895E-05  0.351E-03    1.90       6.5  T
   5    -31.8114215 -0.105268E-06  0.219E-03    1.90      10.5  T
   6    -31.8114216 -0.592160E-07  0.987E-04    1.90      23.2  T
     SCC iter.                  ...        0 min,  0.006 sec
     gradient                   ...        0 min,  0.012 sec
 * total energy  :   -31.3367117 Eh     change       -0.3016905E-04 Eh
   gradient norm :     0.0028307 Eh/α   predicted    -0.2494231E-04 ( -17.32%)
   displ. norm   :     0.0620331 α      lambda       -0.4086839E-04
   maximum displ.:     0.0463183 α      in ANC's #4, #2, #3, ...

........................................................................
.............................. CYCLE    7 ..............................
........................................................................
   1    -31.8122555 -0.318123E+02  0.428E-02    1.89       0.0  T
   2    -31.8122558 -0.309639E-06  0.256E-02    1.89       1.0  T
   3    -31.8122517  0.402189E-05  0.195E-02    1.89       1.2  T
   4    -31.8122569 -0.517901E-05  0.391E-03    1.89       5.9  T
   5    -31.8122571 -0.136212E-06  0.250E-03    1.89       9.2  T
   6    -31.8122571 -0.803085E-07  0.896E-04    1.89      25.6  T
   7    -31.8122571 -0.404386E-08  0.478E-04    1.89      48.0  T
     SCC iter.                  ...        0 min,  0.007 sec
     gradient                   ...        0 min,  0.012 sec
 * total energy  :   -31.3367387 Eh     change       -0.2703998E-04 Eh
   gradient norm :     0.0016589 Eh/α   predicted    -0.2051458E-04 ( -24.13%)
   displ. norm   :     0.0924392 α      lambda       -0.2120724E-04
   maximum displ.:     0.0602896 α      in ANC's #2, #4, #3, ...

........................................................................
.............................. CYCLE    8 ..............................
........................................................................
   1    -31.8129502 -0.318130E+02  0.635E-02    1.89       0.0  T
   2    -31.8129509 -0.653733E-06  0.367E-02    1.89       1.0  T
   3    -31.8129448  0.605643E-05  0.199E-02    1.89       1.2  T
   4    -31.8129518 -0.698200E-05  0.400E-03    1.89       5.7  T
   5    -31.8129518 -0.926202E-08  0.287E-03    1.89       8.0  T
   6    -31.8129519 -0.115702E-06  0.571E-04    1.89      40.2  T
   7    -31.8129519 -0.165288E-08  0.358E-04    1.89      64.0  T
     SCC iter.                  ...        0 min,  0.007 sec
     gradient                   ...        0 min,  0.013 sec
 * total energy  :   -31.3367574 Eh     change       -0.1872998E-04 Eh
   gradient norm :     0.0022715 Eh/α   predicted    -0.1064584E-04 ( -43.16%)
   displ. norm   :     0.0371766 α      lambda       -0.1095843E-04
   maximum displ.:     0.0249737 α      in ANC's #2, #3, #1, ...

........................................................................
.............................. CYCLE    9 ..............................
........................................................................
   1    -31.8127903 -0.318128E+02  0.254E-02    1.89       0.0  T
   2    -31.8127904 -0.624805E-07  0.143E-02    1.89       1.6  T
   3    -31.8127902  0.124966E-06  0.329E-03    1.89       7.0  T
   4    -31.8127904 -0.122564E-06  0.168E-03    1.89      13.7  T
   5    -31.8127904 -0.234488E-07  0.606E-04    1.89      37.9  T
   6    -31.8127904 -0.596716E-08  0.162E-04    1.89     141.8  T
     SCC iter.                  ...        0 min,  0.006 sec
     gradient                   ...        0 min,  0.013 sec
 * total energy  :   -31.3367669 Eh     change       -0.9471408E-05 Eh
   gradient norm :     0.0017377 Eh/α   predicted    -0.5490314E-05 ( -42.03%)
   displ. norm   :     0.1259089 α      lambda       -0.2151425E-04
   maximum displ.:     0.0849640 α      in ANC's #2, #3, #1, ...

........................................................................
.............................. CYCLE   10 ..............................
........................................................................
   1    -31.8118775 -0.318119E+02  0.870E-02    1.88       0.0  T
   2    -31.8118782 -0.718576E-06  0.493E-02    1.88       1.0  T
   3    -31.8118749  0.329482E-05  0.153E-02    1.88       1.5  T
   4    -31.8118785 -0.360086E-05  0.507E-03    1.88       4.5  T
   5    -31.8118785 -0.421116E-07  0.279E-03    1.88       8.2  T
   6    -31.8118787 -0.147775E-06  0.599E-04    1.88      38.3  T
   7    -31.8118787 -0.473289E-08  0.274E-04    1.88      83.6  T
     SCC iter.                  ...        0 min,  0.007 sec
     gradient                   ...        0 min,  0.012 sec
 * total energy  :   -31.3367880 Eh     change       -0.2111636E-04 Eh
   gradient norm :     0.0020088 Eh/α   predicted    -0.1083935E-04 ( -48.67%)
   displ. norm   :     0.0727477 α      lambda       -0.1272389E-04
   maximum displ.:     0.0479926 α      in ANC's #2, #3, #1, ...

........................................................................
.............................. CYCLE   11 ..............................
........................................................................
   1    -31.8117576 -0.318118E+02  0.492E-02    1.88       0.0  T
   2    -31.8117579 -0.212672E-06  0.276E-02    1.88       1.0  T
   3    -31.8117578  0.591378E-07  0.403E-03    1.88       5.7  T
   4    -31.8117578  0.359389E-07  0.307E-03    1.88       7.5  T
   5    -31.8117579 -0.151170E-06  0.864E-04    1.88      26.6  T
   6    -31.8117579 -0.131435E-07  0.966E-05    1.88     237.5  T
     SCC iter.                  ...        0 min,  0.006 sec
     gradient                   ...        0 min,  0.012 sec
 * total energy  :   -31.3367990 Eh     change       -0.1097522E-04 Eh
   gradient norm :     0.0020399 Eh/α   predicted    -0.6397117E-05 ( -41.71%)
   displ. norm   :     0.1469321 α      lambda       -0.2539352E-04
   maximum displ.:     0.0967306 α      in ANC's #2, #3, #1, ...

........................................................................
.............................. CYCLE   12 ..............................
........................................................................
   1    -31.8116814 -0.318117E+02  0.984E-02    1.88       0.0  T
   2    -31.8116822 -0.777599E-06  0.557E-02    1.88       1.0  T
   3    -31.8116820  0.262642E-06  0.794E-03    1.88       2.9  T
   4    -31.8116821 -0.115977E-06  0.525E-03    1.88       4.4  T
   5    -31.8116824 -0.343867E-06  0.185E-03    1.88      12.4  T
   6    -31.8116825 -0.642656E-07  0.274E-04    1.88      83.7  T
   7    -31.8116825 -0.661771E-09  0.161E-04    1.88     142.2  T
     SCC iter.                  ...        0 min,  0.007 sec
     gradient                   ...        0 min,  0.012 sec
 * total energy  :   -31.3368189 Eh     change       -0.1986815E-04 Eh
   gradient norm :     0.0017123 Eh/α   predicted    -0.1297914E-04 ( -34.67%)
   displ. norm   :     0.2519840 α      lambda       -0.2261528E-04
   maximum displ.:     0.1649725 α      in ANC's #2, #1, #3, ...

........................................................................
.............................. CYCLE   13 ..............................
........................................................................
   1    -31.8114613 -0.318115E+02  0.166E-01    1.87       0.0  T
   2    -31.8114637 -0.242151E-05  0.937E-02    1.87       1.0  T
   3    -31.8114622  0.148307E-05  0.151E-02    1.87       1.5  T
   4    -31.8114630 -0.771345E-06  0.103E-02    1.87       2.2  T
   5    -31.8114643 -0.135536E-05  0.313E-03    1.87       7.3  T
   6    -31.8114645 -0.180569E-06  0.542E-04    1.87      42.3  T
   7    -31.8114645 -0.185220E-08  0.362E-04    1.87      63.3  T
     SCC iter.                  ...        0 min,  0.007 sec
     gradient                   ...        0 min,  0.013 sec
 * total energy  :   -31.3368340 Eh     change       -0.1513162E-04 Eh
   gradient norm :     0.0026612 Eh/α   predicted    -0.1162875E-04 ( -23.15%)
   displ. norm   :     0.0212831 α      lambda       -0.1820949E-04
   maximum displ.:     0.0163612 α      in ANC's #1, #30, #4, ...

........................................................................
.............................. CYCLE   14 ..............................
........................................................................
   1    -31.8127613 -0.318128E+02  0.199E-02    1.87       0.0  T
   2    -31.8127615 -0.142752E-06  0.978E-03    1.88       2.3  T
   3    -31.8127613  0.156923E-06  0.407E-03    1.87       5.6  T
   4    -31.8127615 -0.197810E-06  0.160E-03    1.87      14.4  T
   5    -31.8127615 -0.468660E-08  0.881E-04    1.88      26.0  T
   6    -31.8127615 -0.114826E-07  0.184E-04    1.88     124.9  T
     SCC iter.                  ...        0 min,  0.006 sec
     gradient                   ...        0 min,  0.013 sec
 * total energy  :   -31.3368424 Eh     change       -0.8444793E-05 Eh
   gradient norm :     0.0014676 Eh/α   predicted    -0.9141995E-05 (   8.26%)
   displ. norm   :     0.0789109 α      lambda       -0.6730347E-05
   maximum displ.:     0.0489207 α      in ANC's #1, #2, #4, ...

........................................................................
.............................. CYCLE   15 ..............................
........................................................................
   1    -31.8124708 -0.318125E+02  0.535E-02    1.87       0.0  T
   2    -31.8124711 -0.337356E-06  0.296E-02    1.87       1.0  T
   3    -31.8124703  0.859105E-06  0.868E-03    1.87       2.6  T
   4    -31.8124712 -0.902592E-06  0.376E-03    1.87       6.1  T
   5    -31.8124712 -0.518688E-07  0.185E-03    1.87      12.4  T
   6    -31.8124713 -0.746695E-07  0.289E-04    1.87      79.4  T
   7    -31.8124713 -0.907814E-09  0.124E-04    1.87     185.4  T
     SCC iter.                  ...        0 min,  0.007 sec
     gradient                   ...        0 min,  0.012 sec
 * total energy  :   -31.3368504 Eh     change       -0.7963291E-05 Eh
   gradient norm :     0.0009881 Eh/α   predicted    -0.3375478E-05 ( -57.61%)
   displ. norm   :     0.1150299 α      lambda       -0.6880941E-05
   maximum displ.:     0.0776474 α      in ANC's #1, #2, #4, ...

........................................................................
.............................. CYCLE   16 ..............................
........................................................................
   1    -31.8122566 -0.318123E+02  0.837E-02    1.87       0.0  T
   2    -31.8122577 -0.105391E-05  0.452E-02    1.87       1.0  T
   3    -31.8122574  0.279753E-06  0.892E-03    1.87       2.6  T
   4    -31.8122576 -0.182463E-06  0.574E-03    1.87       4.0  T
   5    -31.8122580 -0.375279E-06  0.124E-03    1.87      18.5  T
   6    -31.8122580 -0.288336E-07  0.292E-04    1.87      78.7  T
   7    -31.8122580 -0.774381E-09  0.169E-04    1.87     135.4  T
     SCC iter.                  ...        0 min,  0.007 sec
     gradient                   ...        0 min,  0.012 sec
 * total energy  :   -31.3368570 Eh     change       -0.6563255E-05 Eh
   gradient norm :     0.0011227 Eh/α   predicted    -0.3465164E-05 ( -47.20%)
   displ. norm   :     0.0663447 α      lambda       -0.3030713E-05
   maximum displ.:     0.0494812 α      in ANC's #1, #2, #4, ...

........................................................................
.............................. CYCLE   17 ..............................
........................................................................
   1    -31.8123911 -0.318124E+02  0.498E-02    1.87       0.0  T
   2    -31.8123916 -0.478745E-06  0.259E-02    1.87       1.0  T
   3    -31.8123916  0.244210E-07  0.528E-03    1.87       4.3  T
   4    -31.8123914  0.146816E-06  0.435E-03    1.87       5.3  T
   5    -31.8123917 -0.274844E-06  0.887E-04    1.87      25.9  T
   6    -31.8123917 -0.138339E-07  0.178E-04    1.87     129.1  T
     SCC iter.                  ...        0 min,  0.006 sec
     gradient                   ...        0 min,  0.012 sec
 * total energy  :   -31.3368592 Eh     change       -0.2268463E-05 Eh
   gradient norm :     0.0010030 Eh/α   predicted    -0.1519308E-05 ( -33.02%)
   displ. norm   :     0.0664152 α      lambda       -0.2505333E-05
   maximum displ.:     0.0500914 α      in ANC's #1, #2, #3, ...

........................................................................
.............................. CYCLE   18 ..............................
........................................................................
   1    -31.8123407 -0.318123E+02  0.504E-02    1.87       0.0  T
   2    -31.8123411 -0.380968E-06  0.272E-02    1.87       1.0  T
   3    -31.8123410  0.715541E-07  0.522E-03    1.87       4.4  T
   4    -31.8123409  0.732218E-07  0.401E-03    1.87       5.7  T
   5    -31.8123411 -0.235711E-06  0.714E-04    1.87      32.1  T
   6    -31.8123412 -0.115559E-07  0.195E-04    1.87     117.9  T
     SCC iter.                  ...        0 min,  0.006 sec
     gradient                   ...        0 min,  0.012 sec
 * total energy  :   -31.3368612 Eh     change       -0.2018152E-05 Eh
   gradient norm :     0.0006326 Eh/α   predicted    -0.1255988E-05 ( -37.77%)
   displ. norm   :     0.0380749 α      lambda       -0.8534508E-06
   maximum displ.:     0.0264466 α      in ANC's #1, #2, #3, ...

   *** GEOMETRY OPTIMIZATION CONVERGED AFTER 18 ITERATIONS ***

------------------------------------------------------------------------
 total energy gain   :        -0.0241140 Eh      -15.1317 kcal/mol
 total RMSD          :         0.3093640 a0        0.1637 Å
 total power (kW/mol):        -3.5172877 (step) -123.9883 (real)
------------------------------------------------------------------------

 ANCopt (total)                0 d,  0 h,  0 min,  0.511 sec
 optimizer setup                ...        0 min,  0.000 sec (  0.027%)
 model hessian                  ...        0 min,  0.002 sec (  0.466%)
 ANC generation                 ...        0 min,  0.001 sec (  0.105%)
 coordinate transformation      ...        0 min,  0.000 sec (  0.050%)
 single point calculation       ...        0 min,  0.502 sec ( 98.225%)
 optimization log               ...        0 min,  0.002 sec (  0.296%)
 hessian update                 ...        0 min,  0.000 sec (  0.039%)
 rational function              ...        0 min,  0.003 sec (  0.574%)

================
 final structure:
================
$coord
    5.29580932335442    0.38387484578445   -0.07944750993519      C 
    3.88515526009643   -2.52125318571323    0.33049583817264      S 
    0.93589076641916   -1.10684670989150    0.26627347461328      C 
   -1.57491112327608   -1.74355040738093    0.43721835906044      C 
   -3.09016644099978    0.50323540842434    0.21991034389199      C 
   -5.40622294313944   -0.56032990087070    0.43658658570805      C 
   -4.20374899715559   -3.76778064110589    0.78172730170624      S 
   -1.44805280318730    2.78522822899734   -0.12070270490358      C 
    1.12040004412142    1.54758589747231   -0.06587739177645      C 
    3.62114621852778    2.38830710690489   -0.26390851893772      C 
    4.30511121537783    5.02313726747902   -0.61903684902231      C 
    6.63631434695115    5.91977111723481   -0.84979789242346      C 
    7.31739716817400    0.45989022920426   -0.16196293870798      H 
   -7.33550946206636    0.03952178339885    0.43660712353038      H 
   -1.67474300942646    4.15792264776039    1.40541245640722      H 
   -1.79983146082863    3.75438651642331   -1.91009545189306      H 
    2.71273073939200    6.30397649601023   -0.69325887445924      H 
    8.27691635909443    4.71970675489670   -0.79048915376648      H 
    6.98371924939722    7.90617389162684   -1.11230631236119      H 
$end
           -------------------------------------------------
          |                Final Singlepoint                |
           -------------------------------------------------

          ...................................................
          :                      SETUP                      :
          :.................................................:
          :  # basis functions                  67          :
          :  # atomic orbitals                  65          :
          :  # shells                           33          :
          :  # electrons                        59          :
          :  max. iterations                   250          :
          :  Hamiltonian                  GFN2-xTB          :
          :  restarted?                      false          :
          :  GBSA solvation                  false          :
          :  PC potential                    false          :
          :  electronic temp.          300.0000000     K    :
          :  accuracy                    1.0000000          :
          :  -> integral cutoff          0.2500000E+02      :
          :  -> integral neglect         0.1000000E-07      :
          :  -> SCF convergence          0.1000000E-05 Eh   :
          :  -> wf. convergence          0.1000000E-03 e    :
          :  Broyden damping             0.4000000          :
          ...................................................

 iter      E             dE          RMSdq      gap      omega  full diag
   1    -31.8123412 -0.318123E+02  0.106E-04    1.87       0.0  T
   2    -31.8123412  0.154188E-11  0.684E-05    1.87     335.4  T
   3    -31.8123412 -0.458691E-10  0.479E-05    1.87     479.0  T

   *** convergence criteria satisfied after 3 iterations ***

         #    Occupation            Energy/Eh            Energy/eV
      -------------------------------------------------------------
         1        2.0000           -0.7392932             -20.1172
       ...           ...                  ...                  ...
        24        2.0000           -0.4435664             -12.0701
        25        2.0000           -0.4426175             -12.0442
        26        2.0000           -0.4227506             -11.5036
        27        2.0000           -0.4102444             -11.1633
        28        2.0000           -0.3930932             -10.6966
        29        2.0000           -0.3639633              -9.9039
        30        1.0000           -0.3300190              -8.9803 (HOMO)
        31                         -0.2612425              -7.1088 (LUMO)
        32                         -0.2341299              -6.3710
        33                         -0.2311483              -6.2899
        34                         -0.2119805              -5.7683
        35                         -0.1730746              -4.7096
       ...                                ...                  ...
        65                          0.7568235              20.5942
      -------------------------------------------------------------
                  HL-Gap            0.0687765 Eh            1.8715 eV
             Fermi-level           -0.3213110 Eh           -8.7433 eV

 SCC (total)                   0 d,  0 h,  0 min,  0.025 sec
 SCC setup                      ...        0 min,  0.000 sec (  0.674%)
 Dispersion                     ...        0 min,  0.000 sec (  0.678%)
 integral evaluation            ...        0 min,  0.008 sec ( 32.732%)
 zeroth order Hamiltonian       ...        0 min,  0.000 sec (  0.583%)
 iterations                     ...        0 min,  0.004 sec ( 14.453%)
 molecular gradient             ...        0 min,  0.012 sec ( 49.359%)
 printout                       ...        0 min,  0.000 sec (  1.343%)

         :::::::::::::::::::::::::::::::::::::::::::::::::::::
         ::                     SUMMARY                     ::
         :::::::::::::::::::::::::::::::::::::::::::::::::::::
         :: total energy             -31.336861227460 Eh    ::
         :: gradient norm              0.000633024518 Eh/a0 ::
         :: HOMO-LUMO gap              1.871503649193 eV    ::
         ::.................................................::
         :: SCC energy               -31.812341159557 Eh    ::
         :: -> isotropic ES            0.002784613846 Eh    ::
         :: -> anisotropic ES          0.001907653874 Eh    ::
         :: -> anisotropic XC          0.016058745411 Eh    ::
         :: -> dispersion             -0.021345753133 Eh    ::
         :: repulsion energy           0.475487181546 Eh    ::
         :: add. restraining           0.000000000000 Eh    ::
         :::::::::::::::::::::::::::::::::::::::::::::::::::::

           -------------------------------------------------
          |                Property Printout                |
           -------------------------------------------------

    * Orbital Energies and Occupations

         #    Occupation            Energy/Eh            Energy/eV
      -------------------------------------------------------------
         1        2.0000           -0.7392932             -20.1172
       ...           ...                  ...                  ...
        18        2.0000           -0.4887344             -13.2991
        19        2.0000           -0.4823424             -13.1252
        20        2.0000           -0.4739545             -12.8970
        21        2.0000           -0.4694403             -12.7741
        22        2.0000           -0.4578447             -12.4586
        23        2.0000           -0.4531653             -12.3313
        24        2.0000           -0.4435664             -12.0701
        25        2.0000           -0.4426175             -12.0442
        26        2.0000           -0.4227506             -11.5036
        27        2.0000           -0.4102444             -11.1633
        28        2.0000           -0.3930932             -10.6966
        29        2.0000           -0.3639633              -9.9039
        30        1.0000           -0.3300190              -8.9803 (HOMO)
        31                         -0.2612425              -7.1088 (LUMO)
        32                         -0.2341299              -6.3710
        33                         -0.2311483              -6.2899
        34                         -0.2119805              -5.7683
        35                         -0.1730746              -4.7096
        36                         -0.1395482              -3.7973
        37                         -0.1351270              -3.6770
        38                         -0.1289384              -3.5086
        39                         -0.0186917              -0.5086
        40                          0.0005574               0.0152
        41                          0.0154361               0.4200
       ...                                ...                  ...
        65                          0.7568235              20.5942
      -------------------------------------------------------------
                  HL-Gap            0.0687765 Eh            1.8715 eV
             Fermi-level           -0.3213110 Eh           -8.7433 eV

     #   Z        covCN         q      C6AA      α(0)
     1   6 C      2.951    -0.025    28.618     8.774
     2  16 S      2.198    -0.017   141.762    20.039
     3   6 C      3.045     0.022    27.468     8.596
     4   6 C      3.283     0.021    26.061     8.209
     5   6 C      3.547    -0.016    21.902     6.847
     6   6 C      3.130    -0.018    28.246     8.701
     7  16 S      2.440    -0.123   146.235    20.353
     8   6 C      3.827    -0.056    21.557     6.606
     9   6 C      3.256    -0.017    27.305     8.450
    10   6 C      3.094     0.001    27.880     8.654
    11   6 C      2.891    -0.029    28.723     8.787
    12   6 C      2.838    -0.086    30.152     8.999
    13   1 H      0.926     0.050     2.315     2.379
    14   1 H      0.927     0.043     2.411     2.428
    15   1 H      0.924     0.062     2.175     2.306
    16   1 H      0.924     0.062     2.175     2.306
    17   1 H      0.925     0.040     2.442     2.444
    18   1 H      0.926     0.042     2.424     2.435
    19   1 H      0.926     0.043     2.411     2.428

 Mol. C6AA /au·bohr⁶  :       7445.541957
 Mol. C8AA /au·bohr⁸  :     232885.127057
 Mol. α(0) /au        :        139.741818

(R)spin-density population

 Mulliken population n(s)   n(p)   n(d)
     1 C   0.1861   0.000  0.186  0.000
     2 S   0.0685   0.000  0.059  0.009
     3 C   0.0058   0.000  0.006  0.000
     4 C   0.2845   0.000  0.285  0.000
     5 C   0.0128   0.000  0.013  0.000
     6 C   0.2100   0.000  0.210  0.000
     7 S   0.0394   0.000  0.024  0.016
     8 C   0.0015   0.000  0.001  0.000
     9 C   0.1818   0.000  0.182  0.000
    10 C   0.0018   0.000  0.002  0.000
    11 C   0.0000   0.000  0.000  0.000
    12 C   0.0011   0.000  0.001  0.000
    13 H   0.0000   0.000  0.000  0.000
    14 H   0.0000   0.000  0.000  0.000
    15 H   0.0033   0.003  0.000  0.000
    16 H   0.0033   0.003  0.000  0.000
    17 H   0.0000   0.000  0.000  0.000
    18 H   0.0000   0.000  0.000  0.000
    19 H   0.0000   0.000  0.000  0.000

Wiberg/Mayer (AO) data.
largest (>0.10) Wiberg bond orders for each atom
          total WBO             WBO to atom ...
     1  C   3.758        C   10 1.436    S    2 1.201    H   13 0.969
     2  S   2.558        C    1 1.201    C    3 1.100
     3  C   3.948        C    4 1.385    C    9 1.270    S    2 1.100
     4  C   3.670        C    3 1.385    C    5 1.132    S    7 1.060
     5  C   3.963        C    6 1.652    C    4 1.132    C    8 1.011
     6  C   3.731        C    5 1.652    S    7 1.000    H   14 0.969
     7  S   2.264        C    4 1.060    C    6 1.000
     8  C   3.997        C    9 1.013    C    5 1.011    H   16 0.945    H   15 0.945
     9  C   3.796        C   10 1.317    C    3 1.270    C    8 1.013
    10  C   3.981        C    1 1.436    C    9 1.317    C   11 1.087
    11  C   3.991        C   12 1.900    C   10 1.087    H   17 0.964
    12  C   3.985        C   11 1.900    H   19 0.978    H   18 0.975
    13  H   0.997        C    1 0.969
    14  H   0.997        C    6 0.969
    15  H   0.993        C    8 0.945
    16  H   0.993        C    8 0.945
    17  H   0.998        C   11 0.964
    18  H   0.998        C   12 0.975
    19  H   0.997        C   12 0.978

molecular dipole:
                 x           y           z       tot (Debye)
 q only:        0.419       0.912      -0.127
   full:        0.394       1.341      -0.179       3.580
molecular quadrupole (traceless):
                xx          xy          yy          xz          yz          zz
 q only:        1.699      -2.464      -0.199       0.270       0.161      -1.499
  q+dip:        5.998      -3.022      -2.562       0.058       0.341      -3.436
   full:        4.238      -3.194      -2.713       0.242       0.607      -1.525

           -------------------------------------------------
          |                Geometry Summary                 |
           -------------------------------------------------

      molecular mass/u    :      191.2853000
   center of mass at/Å    :        0.3575309       0.0215302       0.0695399
  moments of inertia/u·Å² :        0.3076786E+03   0.1047560E+04   0.1352076E+04
rotational constants/cm⁻¹ :        0.5478974E-01   0.1609228E-01   0.1246796E-01

 * 18 selected distances

     #   Z        #   Z                                     value/Å
     1   6 C      2  16 S                                 1.7226949
     2  16 S      3   6 C                                 1.7312130
     3   6 C      4   6 C                                 1.3736956
     4   6 C      5   6 C                                 1.4386682
     5   6 C      6   6 C                                 1.3535189
     4   6 C      7  16 S                                 1.7651836 (max)
     5   6 C      8   6 C                                 1.4986133
     3   6 C      9   6 C                                 1.4189827
     1   6 C     10   6 C                                 1.3856233
     9   6 C     10   6 C                                 1.4000474
    11   6 C     12   6 C                                 1.3273503
     1   6 C     13   1 H                                 1.0714245
     6   6 C     14   1 H                                 1.0691435 (min)
     8   6 C     15   1 H                                 1.0928127
     8   6 C     16   1 H                                 1.0928430
    11   6 C     17   1 H                                 1.0821298
    12   6 C     18   1 H                                 1.0760982
    12   6 C     19   1 H                                 1.0761177

 * 3 distinct bonds (by element types)

   Z      Z             #   av. dist./Å        max./Å        min./Å
   1 H    6 C           7     1.0800813     1.0928430     1.0691435
   6 C    6 C           8     1.3995625     1.4986133     1.3273503
   6 C   16 S           3     1.7396972     1.7651836     1.7226949


optimized geometry written to: xtbopt.xyz


           -------------------------------------------------
          | TOTAL ENERGY              -31.336861227460 Eh   |
          | GRADIENT NORM               0.000633024518 Eh/α |
          | HOMO-LUMO GAP               1.871503649193 eV   |
           -------------------------------------------------

------------------------------------------------------------------------
 * finished run on 2021/05/19 at 11:00:04.403     
------------------------------------------------------------------------
 total:
 * wall-time:     0 d,  0 h,  0 min,  0.594 sec
 *  cpu-time:     0 d,  0 h,  0 min,  0.592 sec
 * ratio c/w:     0.997 speedup
 SCF:
 * wall-time:     0 d,  0 h,  0 min,  0.037 sec
 *  cpu-time:     0 d,  0 h,  0 min,  0.037 sec
 * ratio c/w:     0.997 speedup
 ANC optimizer:
 * wall-time:     0 d,  0 h,  0 min,  0.536 sec
 *  cpu-time:     0 d,  0 h,  0 min,  0.535 sec
 * ratio c/w:     0.998 speedup

