      -----------------------------------------------------------      
     |                   =====================                   |     
     |                           x T B                           |     
     |                   =====================                   |     
     |                         S. Grimme                         |     
     |          Mulliken Center for Theoretical Chemistry        |     
     |                    University of Bonn                     |     
     |                Version 6.2 RC2 (SAW190805)                |     
      -----------------------------------------------------------      

   This program is distributed in the hope that it will be useful,
   but WITHOUT ANY WARRANTY; without even the implied warranty of
   MERCHANTABILITY or FITNESS FOR A PARTICULAR PURPOSE.
   
   FOR NON-COMMERCIAL, ACADEMIA USE ONLY.
   
   Cite this work as:
   * S. Grimme, C. Bannwarth, P. Shushkov, J. Chem. Theory Comput., 2017,
     13, 1989-2009. DOI: 10.1021/acs.jctc.7b00118
   * C. Bannwarth, S. Ehlert and S. Grimme., J. Chem. Theory Comput., 2019,
     15, 1652-1671. DOI: 10.1021/acs.jctc.8b01176
   * P. Pracht, E. Caldeweyher, S. Ehlert, S. Grimme, ChemRxiv, 2019, preprint.
     DOI: 10.26434/chemrxiv.8326202.v1
   
   for DFT-D4:
   * E. Caldeweyher, C. Bannwarth and S. Grimme, J. Chem. Phys., 2017,
     147, 034112. DOI: 10.1063/1.4993215
   * E. Caldeweyher, S. Ehlert, A. Hansen, H. Neugebauer, S. Spicher,
     C. Bannwarth and S. Grimme, J. Chem. Phys., 2019, 150, 154122.
     DOI: 10.1063/1.5090222
   
   for sTDA-xTB:
   * S. Grimme and C. Bannwarth, J. Chem. Phys., 2016, 145, 054103.
     DOI: 10.1063/1.4959605
   
   in the mass-spec context:
   * V. Asgeirsson, C. Bauer and S. Grimme, Chem. Sci., 2017, 8, 4879.
     DOI: 10.1039/c7sc00601b
   
   for metadynamics refer to:
   * S. Grimme, J. Chem. Theory Comput., 2019, 155, 2847-2862
     DOI: 10.1021/acs.jctc.9b00143
   
   with help from (in alphabetical order)
   C. Bannwarth, F. Bohle, G. Brandenburg, E. Caldeweyher, M. Checinski,
   S. Dohm, S. Ehlert, S. Ehrlich, F. März, H. Neugebauer, J. Pisarek,
   P. Pracht, P. Shushkov, and S. Spicher.
   
 * started run on 2021/05/19 at 11:00:04.425     

           -------------------------------------------------
          |                Calculation Setup                |
           -------------------------------------------------

          program call               : /ihome/ghutchison/geoffh/xtb/xtb 591.xyz -opt
          hostname                   : smp-n144
          coordinate file            : 591.xyz
          omp threads                :                     1
          number of atoms            :                    24
          number of electrons        :                    74
          charge                     :                     0
          spin                       :                   0.0
          first test random number   :      0.90830263039364


########################################################################
# WARNING! Please study the warnings concerning your input carefully
#  - the use of '-opt' is discouraged, please use '--opt' next time
########################################################################

           ------------------------------------------------- 
          |                 G F N 2 - x T B                 |
          | Geometry, Frequencies, Noncovalent interactions |
          |            JCTC 2019 parametrisation            |
           ------------------------------------------------- 
             KAB for C  - Si     :                1.0500
             KAB for H  - Pd     :                0.9500
             k(s)              :                1.8500
             k(p)              :                2.2300
             k(d)              :                2.2300
             k(f)              :                2.0000
             kEN (H0ij)        :               -2.0000
             D4 a1             :                0.5200
             D4 a2             :                5.0000
             D4 s6             :                1.0000
             D4 s8             :                2.7000
             D4 s9             :                5.0000
             alphaj            :                2.0000

  Z AO/shell   Hii/eV     exponent
  1     Wed Apr 25 08:07:45 CEST 2018   EN: 2.200 GM2: 0.406  GM3: 0.0800  RAES: 1.40
     1s    -10.707211    1.230000
  6     Wed Apr 25 08:07:45 CEST 2018   EN: 2.550 GM2: 0.538  GM3: 0.1500  RAES: 3.00
     2s    -13.970922    2.096432
     2p    -10.063292    1.800000
  7     Wed Apr 25 08:07:45 CEST 2018   EN: 3.040 GM2: 0.461  GM3:-0.0640  RAES: 1.90
     2s    -16.686243    2.339881
     2p    -12.523956    2.014332

           ------------------------------------------------- 
          |        Self-Consistent Charge Iterations        |
           ------------------------------------------------- 

          ...................................................
          :                      SETUP                      :
          :.................................................:
          :  # basis functions                  72          :
          :  # atomic orbitals                  72          :
          :  # shells                           40          :
          :  # electrons                        74          :
          :  max. iterations                   250          :
          :  Hamiltonian                  GFN2-xTB          :
          :  restarted?                      false          :
          :  GBSA solvation                  false          :
          :  PC potential                    false          :
          :  electronic temp.          300.0000000     K    :
          :  accuracy                    1.0000000          :
          :  -> integral cutoff          0.2500000E+02      :
          :  -> integral neglect         0.1000000E-07      :
          :  -> SCF convergence          0.1000000E-05 Eh   :
          :  -> wf. convergence          0.1000000E-03 e    :
          :  Broyden damping             0.4000000          :
          ...................................................

 iter      E             dE          RMSdq      gap      omega  full diag
   1    -40.3397784 -0.403398E+02  0.644E+00    1.39       0.0  T
   2    -40.2978561  0.419222E-01  0.447E+00    1.39       1.0  T
   3    -40.1636021  0.134254E+00  0.374E+00    1.27       1.0  T
   4    -40.3905198 -0.226918E+00  0.110E+00    1.39       1.0  T
   5    -40.4153918 -0.248719E-01  0.384E-01    1.29       1.0  T
   6    -40.4166297 -0.123787E-02  0.196E-01    1.31       1.0  T
   7    -40.4170899 -0.460204E-03  0.102E-01    1.29       1.0  T
   8    -40.4172637 -0.173854E-03  0.334E-02    1.31       1.0  T
   9    -40.4172723 -0.863700E-05  0.190E-02    1.30       1.1  T
  10    -40.4172760 -0.360779E-05  0.820E-03    1.30       2.5  T
  11    -40.4172768 -0.855205E-06  0.185E-03    1.30      11.0  T
  12    -40.4172768 -0.911557E-08  0.127E-03    1.30      16.0  T
  13    -40.4172768 -0.155713E-07  0.452E-04    1.30      45.1  T
  14    -40.4172768 -0.187762E-08  0.189E-04    1.30     107.7  T

   *** convergence criteria satisfied after 14 iterations ***

         #    Occupation            Energy/Eh            Energy/eV
      -------------------------------------------------------------
         1        2.0000           -0.6906660             -18.7940
       ...           ...                  ...                  ...
        31        2.0000           -0.4476258             -12.1805
        32        2.0000           -0.4435245             -12.0689
        33        2.0000           -0.4374058             -11.9024
        34        2.0000           -0.4329342             -11.7807
        35        2.0000           -0.4275627             -11.6346
        36        2.0000           -0.4096896             -11.1482
        37        2.0000           -0.4034319             -10.9779 (HOMO)
        38                         -0.3555003              -9.6737 (LUMO)
        39                         -0.2805014              -7.6328
        40                         -0.2586836              -7.0391
        41                         -0.2536452              -6.9020
        42                         -0.2391387              -6.5073
       ...                                ...                  ...
        72                          1.1017402              29.9799
      -------------------------------------------------------------
                  HL-Gap            0.0479316 Eh            1.3043 eV
             Fermi-level           -0.3794655 Eh          -10.3258 eV

 SCC (total)                   0 d,  0 h,  0 min,  0.042 sec
 SCC setup                      ...        0 min,  0.000 sec (  0.732%)
 Dispersion                     ...        0 min,  0.000 sec (  1.020%)
 integral evaluation            ...        0 min,  0.010 sec ( 23.468%)
 zeroth order Hamiltonian       ...        0 min,  0.000 sec (  0.425%)
 iterations                     ...        0 min,  0.017 sec ( 39.185%)
 molecular gradient             ...        0 min,  0.014 sec ( 34.188%)
 printout                       ...        0 min,  0.000 sec (  0.859%)

         :::::::::::::::::::::::::::::::::::::::::::::::::::::
         ::                     SUMMARY                     ::
         :::::::::::::::::::::::::::::::::::::::::::::::::::::
         :: total energy             -39.675600948157 Eh    ::
         :: gradient norm              0.252645337664 Eh/a0 ::
         :: HOMO-LUMO gap              1.304284675354 eV    ::
         ::.................................................::
         :: SCC energy               -40.417276835346 Eh    ::
         :: -> isotropic ES            0.018101220524 Eh    ::
         :: -> anisotropic ES          0.002657708891 Eh    ::
         :: -> anisotropic XC          0.054364564297 Eh    ::
         :: -> dispersion             -0.025597910348 Eh    ::
         :: repulsion energy           0.741650016013 Eh    ::
         :: add. restraining           0.000000000000 Eh    ::
         :::::::::::::::::::::::::::::::::::::::::::::::::::::

      ----------------------------------------------------------- 
     |                   =====================                   |
     |                        A N C O P T                        |
     |                   =====================                   |
     |               Approximate Normal Coordinate               |
     |                Rational Function Optimizer                |
      ----------------------------------------------------------- 

          ...................................................
          :                      SETUP                      :
          :.................................................:
          :   optimization level            normal          :
          :   max. optcycles                   200          :
          :   ANC micro-cycles                  20          :
          :   degrees of freedom                66          :
          :.................................................:
          :   RF solver                   davidson          :
          :   input Hessian                  false          :
          :   write xtbopt.log                true          :
          :   linear?                        false          :
          :   energy convergence         0.5000000E-05 Eh   :
          :   grad. convergence          0.1000000E-02 Eh/α :
          :   maximium RF displ.         2.0000000          :
          :   Hlow (freq-cutoff)         0.5000000E-02      :
          :   Hmax (freq-cutoff)         5.0000000          :
          :   S6 in model hess.         20.0000000          :
          ...................................................

generating ANC from model Hessian ...
Using Lindh-Hessian (1995)
 Shifting diagonal of input Hessian by   4.961757769099069E-003
 Lowest  eigenvalues of input Hessian
   -0.000000   -0.000000    0.000000    0.000000    0.000000    0.000000
    0.005000    0.005648    0.006393    0.007016    0.008633    0.009285
    0.010298    0.012628    0.013404    0.016935    0.021491    0.023338
 Highest eigenvalues
    1.833878    1.884071    2.034862    2.039295    2.081611    2.573370
 

........................................................................
.............................. CYCLE    1 ..............................
........................................................................
   1    -40.4172768 -0.404173E+02  0.987E-05    1.30       0.0  T
   2    -40.4172768  0.100208E-09  0.950E-05    1.30     214.8  T
   3    -40.4172768 -0.195506E-09  0.463E-05    1.30     440.7  T
     SCC iter.                  ...        0 min,  0.004 sec
     gradient                   ...        0 min,  0.014 sec
 * total energy  :   -39.6756010 Eh     change       -0.6919741E-08 Eh
   gradient norm :     0.2526448 Eh/α   predicted     0.0000000E+00 (-100.00%)
   displ. norm   :     0.3335816 α      lambda       -0.5684470E-01
   maximum displ.:     0.1608595 α      in ANC's #24, #30, #44, ...

........................................................................
.............................. CYCLE    2 ..............................
........................................................................
   1    -40.5231448 -0.405231E+02  0.446E-01    1.26       0.0  T
   2    -40.5233744 -0.229650E-03  0.282E-01    1.29       1.0  T
   3    -40.5230492  0.325249E-03  0.209E-01    1.27       1.0  T
   4    -40.5236907 -0.641504E-03  0.472E-02    1.27       1.0  T
   5    -40.5237236 -0.329187E-04  0.222E-02    1.27       1.0  T
   6    -40.5237318 -0.814946E-05  0.102E-02    1.28       2.0  T
   7    -40.5237329 -0.118090E-05  0.654E-03    1.28       3.1  T
   8    -40.5237335 -0.600915E-06  0.246E-03    1.28       8.3  T
   9    -40.5237336 -0.455197E-07  0.750E-04    1.28      27.2  T
     SCC iter.                  ...        0 min,  0.010 sec
     gradient                   ...        0 min,  0.013 sec
 * total energy  :   -39.7098586 Eh     change       -0.3425761E-01 Eh
   gradient norm :     0.0532536 Eh/α   predicted    -0.3158510E-01 (  -7.80%)
   displ. norm   :     0.2551817 α      lambda       -0.5008180E-02
   maximum displ.:     0.1108434 α      in ANC's #24, #7, #3, ...

........................................................................
.............................. CYCLE    3 ..............................
........................................................................
   1    -40.5356805 -0.405357E+02  0.178E-01    1.23       0.0  T
   2    -40.5357087 -0.282379E-04  0.126E-01    1.23       1.0  T
   3    -40.5357517 -0.429833E-04  0.755E-02    1.24       1.0  T
   4    -40.5357757 -0.239471E-04  0.392E-02    1.23       1.0  T
   5    -40.5358112 -0.355506E-04  0.121E-02    1.24       1.7  T
   6    -40.5358138 -0.262195E-05  0.329E-03    1.24       6.2  T
   7    -40.5358139 -0.674931E-07  0.223E-03    1.24       9.1  T
     SCC iter.                  ...        0 min,  0.008 sec
     gradient                   ...        0 min,  0.013 sec
 * total energy  :   -39.7130050 Eh     change       -0.3146405E-02 Eh
   gradient norm :     0.0199630 Eh/α   predicted    -0.2667153E-02 ( -15.23%)
   displ. norm   :     0.3000108 α      lambda       -0.1520743E-02
   maximum displ.:     0.1440844 α      in ANC's #5, #3, #7, ...

........................................................................
.............................. CYCLE    4 ..............................
........................................................................
   1    -40.5336882 -0.405337E+02  0.257E-01    1.20       0.0  T
   2    -40.5337144 -0.262496E-04  0.147E-01    1.21       1.0  T
   3    -40.5335851  0.129265E-03  0.852E-02    1.21       1.0  T
   4    -40.5337266 -0.141472E-03  0.202E-02    1.21       1.0  T
   5    -40.5337350 -0.834301E-05  0.960E-03    1.21       2.1  T
   6    -40.5337367 -0.172048E-05  0.304E-03    1.21       6.7  T
   7    -40.5337367 -0.118850E-07  0.171E-03    1.21      11.9  T
   8    -40.5337367 -0.465680E-07  0.627E-04    1.21      32.5  T
     SCC iter.                  ...        0 min,  0.009 sec
     gradient                   ...        0 min,  0.014 sec
 * total energy  :   -39.7135812 Eh     change       -0.5762001E-03 Eh
   gradient norm :     0.0165251 Eh/α   predicted    -0.8288470E-03 (  43.85%)
   displ. norm   :     0.4645863 α      lambda       -0.2290475E-02
   maximum displ.:     0.2790413 α      in ANC's #7, #5, #3, ...

........................................................................
.............................. CYCLE    5 ..............................
........................................................................
   1    -40.5279831 -0.405280E+02  0.395E-01    1.18       0.0  T
   2    -40.5280248 -0.417503E-04  0.225E-01    1.20       1.0  T
   3    -40.5275725  0.452319E-03  0.139E-01    1.19       1.0  T
   4    -40.5280525 -0.480030E-03  0.278E-02    1.20       1.0  T
   5    -40.5280683 -0.158073E-04  0.126E-02    1.20       1.6  T
   6    -40.5280710 -0.271852E-05  0.505E-03    1.20       4.0  T
   7    -40.5280712 -0.119038E-06  0.251E-03    1.20       8.1  T
   8    -40.5280713 -0.867653E-07  0.805E-04    1.20      25.4  T
     SCC iter.                  ...        0 min,  0.009 sec
     gradient                   ...        0 min,  0.014 sec
 * total energy  :   -39.7140539 Eh     change       -0.4727446E-03 Eh
   gradient norm :     0.0408856 Eh/α   predicted    -0.1392426E-02 ( 194.54%)
   displ. norm   :     0.1293670 α      lambda       -0.1413642E-02
   maximum displ.:     0.0571455 α      in ANC's #8, #3, #7, ...

........................................................................
.............................. CYCLE    6 ..............................
........................................................................
   1    -40.5327295 -0.405327E+02  0.135E-01    1.21       0.0  T
   2    -40.5327400 -0.105025E-04  0.808E-02    1.22       1.0  T
   3    -40.5326843  0.556914E-04  0.588E-02    1.21       1.0  T
   4    -40.5327471 -0.628679E-04  0.170E-02    1.21       1.2  T
   5    -40.5327536 -0.650496E-05  0.626E-03    1.21       3.3  T
   6    -40.5327544 -0.762959E-06  0.188E-03    1.21      10.8  T
   7    -40.5327544 -0.254577E-07  0.923E-04    1.21      22.1  T
     SCC iter.                  ...        0 min,  0.008 sec
     gradient                   ...        0 min,  0.014 sec
 * total energy  :   -39.7150124 Eh     change       -0.9585184E-03 Eh
   gradient norm :     0.0143018 Eh/α   predicted    -0.7186511E-03 ( -25.02%)
   displ. norm   :     0.3106394 α      lambda       -0.9756740E-03
   maximum displ.:     0.1586278 α      in ANC's #7, #5, #3, ...

........................................................................
.............................. CYCLE    7 ..............................
........................................................................
   1    -40.5337155 -0.405337E+02  0.208E-01    1.21       0.0  T
   2    -40.5337130  0.253621E-05  0.125E-01    1.23       1.0  T
   3    -40.5333790  0.333909E-03  0.116E-01    1.20       1.0  T
   4    -40.5337317 -0.352700E-03  0.161E-02    1.22       1.3  T
   5    -40.5337369 -0.515376E-05  0.527E-03    1.22       3.9  T
   6    -40.5337373 -0.419528E-06  0.217E-03    1.22       9.4  T
   7    -40.5337373 -0.260658E-07  0.104E-03    1.22      19.7  T
     SCC iter.                  ...        0 min,  0.008 sec
     gradient                   ...        0 min,  0.014 sec
 * total energy  :   -39.7156415 Eh     change       -0.6290706E-03 Eh
   gradient norm :     0.0177939 Eh/α   predicted    -0.5349126E-03 ( -14.97%)
   displ. norm   :     0.4482922 α      lambda       -0.9448086E-03
   maximum displ.:     0.2642461 α      in ANC's #7, #3, #5, ...

........................................................................
.............................. CYCLE    8 ..............................
........................................................................
   1    -40.5267271 -0.405267E+02  0.306E-01    1.22       0.0  T
   2    -40.5267395 -0.123294E-04  0.177E-01    1.23       1.0  T
   3    -40.5266122  0.127307E-03  0.799E-02    1.22       1.0  T
   4    -40.5267496 -0.137420E-03  0.153E-02    1.23       1.3  T
   5    -40.5267538 -0.422843E-05  0.735E-03    1.23       2.8  T
   6    -40.5267544 -0.603719E-06  0.339E-03    1.23       6.0  T
   7    -40.5267545 -0.120967E-06  0.169E-03    1.23      12.1  T
   8    -40.5267546 -0.575974E-07  0.391E-04    1.23      52.2  T
     SCC iter.                  ...        0 min,  0.009 sec
     gradient                   ...        0 min,  0.013 sec
 * total energy  :   -39.7160361 Eh     change       -0.3946221E-03 Eh
   gradient norm :     0.0182769 Eh/α   predicted    -0.5673517E-03 (  43.77%)
   displ. norm   :     0.3330725 α      lambda       -0.1190182E-02
   maximum displ.:     0.2255689 α      in ANC's #5, #7, #3, ...

........................................................................
.............................. CYCLE    9 ..............................
........................................................................
   1    -40.5369462 -0.405369E+02  0.259E-01    1.23       0.0  T
   2    -40.5369609 -0.146280E-04  0.147E-01    1.24       1.0  T
   3    -40.5368806  0.802813E-04  0.594E-02    1.22       1.0  T
   4    -40.5369686 -0.880100E-04  0.126E-02    1.23       1.6  T
   5    -40.5369708 -0.215358E-05  0.723E-03    1.23       2.8  T
   6    -40.5369715 -0.766457E-06  0.321E-03    1.23       6.4  T
   7    -40.5369716 -0.121648E-06  0.138E-03    1.23      14.8  T
   8    -40.5369717 -0.344924E-07  0.444E-04    1.23      46.0  T
     SCC iter.                  ...        0 min,  0.009 sec
     gradient                   ...        0 min,  0.013 sec
 * total energy  :   -39.7164946 Eh     change       -0.4584616E-03 Eh
   gradient norm :     0.0258409 Eh/α   predicted    -0.6611109E-03 (  44.20%)
   displ. norm   :     0.1421501 α      lambda       -0.9881593E-03
   maximum displ.:     0.0630943 α      in ANC's #3, #17, #14, ...

........................................................................
.............................. CYCLE   10 ..............................
........................................................................
   1    -40.5450910 -0.405451E+02  0.118E-01    1.24       0.0  T
   2    -40.5450885  0.250473E-05  0.727E-02    1.23       1.0  T
   3    -40.5449382  0.150295E-03  0.811E-02    1.24       1.0  T
   4    -40.5451033 -0.165176E-03  0.108E-02    1.23       1.9  T
   5    -40.5451050 -0.167006E-05  0.594E-03    1.23       3.4  T
   6    -40.5451056 -0.572177E-06  0.230E-03    1.23       8.9  T
     SCC iter.                  ...        0 min,  0.007 sec
     gradient                   ...        0 min,  0.013 sec
 * total energy  :   -39.7166437 Eh     change       -0.1490981E-03 Eh
   gradient norm :     0.0182254 Eh/α   predicted    -0.5040644E-03 ( 238.08%)
   displ. norm   :     0.3037573 α      lambda       -0.9277955E-03
   maximum displ.:     0.2031677 α      in ANC's #7, #3, #5, ...

........................................................................
.............................. CYCLE   11 ..............................
........................................................................
   1    -40.5353539 -0.405354E+02  0.178E-01    1.21       0.0  T
   2    -40.5353434  0.104671E-04  0.109E-01    1.23       1.0  T
   3    -40.5350534  0.290029E-03  0.116E-01    1.21       1.0  T
   4    -40.5353678 -0.314411E-03  0.168E-02    1.22       1.2  T
   5    -40.5353742 -0.636735E-05  0.501E-03    1.22       4.1  T
   6    -40.5353747 -0.517872E-06  0.191E-03    1.22      10.7  T
   7    -40.5353747 -0.358416E-07  0.992E-04    1.22      20.6  T
     SCC iter.                  ...        0 min,  0.008 sec
     gradient                   ...        0 min,  0.013 sec
 * total energy  :   -39.7169602 Eh     change       -0.3165449E-03 Eh
   gradient norm :     0.0165655 Eh/α   predicted    -0.5067026E-03 (  60.07%)
   displ. norm   :     0.1126466 α      lambda       -0.6974532E-03
   maximum displ.:     0.0627911 α      in ANC's #5, #18, #16, ...

........................................................................
.............................. CYCLE   12 ..............................
........................................................................
   1    -40.5355038 -0.405355E+02  0.821E-02    1.23       0.0  T
   2    -40.5355026  0.123117E-05  0.513E-02    1.22       1.0  T
   3    -40.5354313  0.712892E-04  0.558E-02    1.23       1.0  T
   4    -40.5355094 -0.780940E-04  0.766E-03    1.23       2.7  T
   5    -40.5355102 -0.779454E-06  0.420E-03    1.23       4.9  T
   6    -40.5355104 -0.206782E-06  0.163E-03    1.23      12.5  T
   7    -40.5355104 -0.314007E-07  0.724E-04    1.23      28.2  T
     SCC iter.                  ...        0 min,  0.008 sec
     gradient                   ...        0 min,  0.013 sec
 * total energy  :   -39.7171044 Eh     change       -0.1441199E-03 Eh
   gradient norm :     0.0162461 Eh/α   predicted    -0.3531627E-03 ( 145.05%)
   displ. norm   :     0.1438476 α      lambda       -0.4130214E-03
   maximum displ.:     0.0929192 α      in ANC's #3, #5, #11, ...

........................................................................
.............................. CYCLE   13 ..............................
........................................................................
   1    -40.5369554 -0.405370E+02  0.943E-02    1.22       0.0  T
   2    -40.5369565 -0.108798E-05  0.554E-02    1.22       1.0  T
   3    -40.5369527  0.370842E-05  0.137E-02    1.22       1.5  T
   4    -40.5369569 -0.410871E-05  0.307E-03    1.22       6.6  T
   5    -40.5369569 -0.536135E-07  0.192E-03    1.22      10.6  T
   6    -40.5369569 -0.440458E-07  0.981E-04    1.22      20.8  T
     SCC iter.                  ...        0 min,  0.007 sec
     gradient                   ...        0 min,  0.013 sec
 * total energy  :   -39.7173663 Eh     change       -0.2619226E-03 Eh
   gradient norm :     0.0055114 Eh/α   predicted    -0.2107848E-03 ( -19.52%)
   displ. norm   :     0.2644023 α      lambda       -0.3325985E-03
   maximum displ.:     0.1710690 α      in ANC's #3, #7, #9, ...

........................................................................
.............................. CYCLE   14 ..............................
........................................................................
   1    -40.5374519 -0.405375E+02  0.153E-01    1.22       0.0  T
   2    -40.5374517  0.232768E-06  0.912E-02    1.22       1.0  T
   3    -40.5373679  0.837865E-04  0.603E-02    1.21       1.0  T
   4    -40.5374549 -0.870547E-04  0.752E-03    1.22       2.7  T
   5    -40.5374562 -0.130294E-05  0.317E-03    1.22       6.4  T
   6    -40.5374564 -0.161049E-06  0.137E-03    1.22      14.9  T
   7    -40.5374564 -0.109819E-07  0.674E-04    1.22      30.3  T
     SCC iter.                  ...        0 min,  0.008 sec
     gradient                   ...        0 min,  0.013 sec
 * total energy  :   -39.7175482 Eh     change       -0.1819498E-03 Eh
   gradient norm :     0.0096702 Eh/α   predicted    -0.1779280E-03 (  -2.21%)
   displ. norm   :     0.2811134 α      lambda       -0.3525564E-03
   maximum displ.:     0.2058155 α      in ANC's #3, #4, #7, ...

........................................................................
.............................. CYCLE   15 ..............................
........................................................................
   1    -40.5364426 -0.405364E+02  0.173E-01    1.21       0.0  T
   2    -40.5364437 -0.118350E-05  0.102E-01    1.21       1.0  T
   3    -40.5364302  0.135720E-04  0.240E-02    1.21       1.0  T
   4    -40.5364442 -0.140391E-04  0.577E-03    1.21       3.5  T
   5    -40.5364450 -0.758356E-06  0.239E-03    1.21       8.6  T
   6    -40.5364450 -0.715053E-07  0.989E-04    1.21      20.6  T
     SCC iter.                  ...        0 min,  0.007 sec
     gradient                   ...        0 min,  0.013 sec
 * total energy  :   -39.7177459 Eh     change       -0.1977122E-03 Eh
   gradient norm :     0.0150291 Eh/α   predicted    -0.1902118E-03 (  -3.79%)
   displ. norm   :     0.2833567 α      lambda       -0.5555839E-03
   maximum displ.:     0.1647033 α      in ANC's #3, #4, #5, ...

........................................................................
.............................. CYCLE   16 ..............................
........................................................................
   1    -40.5388391 -0.405388E+02  0.150E-01    1.21       0.0  T
   2    -40.5388394 -0.281536E-06  0.881E-02    1.20       1.0  T
   3    -40.5387936  0.457879E-04  0.424E-02    1.21       1.0  T
   4    -40.5388411 -0.474542E-04  0.532E-03    1.20       3.8  T
   5    -40.5388417 -0.576553E-06  0.198E-03    1.20      10.3  T
   6    -40.5388417 -0.403468E-07  0.948E-04    1.20      21.5  T
     SCC iter.                  ...        0 min,  0.007 sec
     gradient                   ...        0 min,  0.014 sec
 * total energy  :   -39.7181000 Eh     change       -0.3540284E-03 Eh
   gradient norm :     0.0070493 Eh/α   predicted    -0.3000967E-03 ( -15.23%)
   displ. norm   :     0.4818704 α      lambda       -0.4049166E-03
   maximum displ.:     0.3458858 α      in ANC's #3, #4, #7, ...

........................................................................
.............................. CYCLE   17 ..............................
........................................................................
   1    -40.5319450 -0.405319E+02  0.248E-01    1.19       0.0  T
   2    -40.5319422  0.273940E-05  0.147E-01    1.20       1.0  T
   3    -40.5316521  0.290093E-03  0.109E-01    1.18       1.0  T
   4    -40.5319541 -0.301990E-03  0.926E-03    1.19       2.2  T
   5    -40.5319558 -0.165185E-05  0.481E-03    1.19       4.2  T
   6    -40.5319563 -0.524203E-06  0.146E-03    1.19      14.0  T
   7    -40.5319563 -0.271907E-08  0.861E-04    1.19      23.7  T
     SCC iter.                  ...        0 min,  0.008 sec
     gradient                   ...        0 min,  0.014 sec
 * total energy  :   -39.7181607 Eh     change       -0.6071931E-04 Eh
   gradient norm :     0.0137812 Eh/α   predicted    -0.2494695E-03 ( 310.86%)
   displ. norm   :     0.0964608 α      lambda       -0.4676420E-03
   maximum displ.:     0.0457273 α      in ANC's #6, #7, #5, ...

........................................................................
.............................. CYCLE   18 ..............................
........................................................................
   1    -40.5370042 -0.405370E+02  0.536E-02    1.20       0.0  T
   2    -40.5370003  0.390764E-05  0.346E-02    1.20       1.0  T
   3    -40.5369738  0.264430E-04  0.407E-02    1.20       1.0  T
   4    -40.5370089 -0.350783E-04  0.533E-03    1.20       3.8  T
   5    -40.5370092 -0.311955E-06  0.300E-03    1.20       6.8  T
   6    -40.5370094 -0.193583E-06  0.949E-04    1.20      21.5  T
     SCC iter.                  ...        0 min,  0.007 sec
     gradient                   ...        0 min,  0.014 sec
 * total energy  :   -39.7184163 Eh     change       -0.2556004E-03 Eh
   gradient norm :     0.0038889 Eh/α   predicted    -0.2359993E-03 (  -7.67%)
   displ. norm   :     0.2425701 α      lambda       -0.1607643E-03
   maximum displ.:     0.1757138 α      in ANC's #3, #4, #36, ...

........................................................................
.............................. CYCLE   19 ..............................
........................................................................
   1    -40.5374807 -0.405375E+02  0.132E-01    1.20       0.0  T
   2    -40.5374813 -0.575570E-06  0.773E-02    1.20       1.0  T
   3    -40.5374796  0.163412E-05  0.928E-03    1.20       2.2  T
   4    -40.5374815 -0.192398E-05  0.195E-03    1.20      10.5  T
   5    -40.5374816 -0.466402E-07  0.134E-03    1.20      15.2  T
   6    -40.5374816 -0.289868E-07  0.528E-04    1.20      38.7  T
   7    -40.5374816 -0.191612E-08  0.309E-04    1.20      66.1  T
     SCC iter.                  ...        0 min,  0.008 sec
     gradient                   ...        0 min,  0.015 sec
 * total energy  :   -39.7185438 Eh     change       -0.1274766E-03 Eh
   gradient norm :     0.0039246 Eh/α   predicted    -0.8511225E-04 ( -33.23%)
   displ. norm   :     0.4123205 α      lambda       -0.2218776E-03
   maximum displ.:     0.2943986 α      in ANC's #3, #4, #36, ...

........................................................................
.............................. CYCLE   20 ..............................
........................................................................
   1    -40.5364429 -0.405364E+02  0.213E-01    1.20       0.0  T
   2    -40.5364432 -0.320644E-06  0.125E-01    1.20       1.0  T
   3    -40.5363737  0.694598E-04  0.517E-02    1.19       1.0  T
   4    -40.5364461 -0.723858E-04  0.361E-03    1.20       5.7  T
   5    -40.5364463 -0.183756E-06  0.187E-03    1.20      10.9  T
   6    -40.5364463 -0.405450E-07  0.891E-04    1.20      22.9  T
   7    -40.5364463 -0.433307E-08  0.423E-04    1.20      48.2  T
     SCC iter.                  ...        0 min,  0.008 sec
     gradient                   ...        0 min,  0.014 sec
 * total energy  :   -39.7186611 Eh     change       -0.1173190E-03 Eh
   gradient norm :     0.0075570 Eh/α   predicted    -0.1298006E-03 (  10.64%)
   displ. norm   :     0.0622002 α      lambda       -0.8982752E-04
   maximum displ.:     0.0388219 α      in ANC's #6, #3, #36, ...
 * RMSD in coord.:     0.7669893 α      energy gain  -0.4306013E-01 Eh

generating ANC from model Hessian ...
Using Lindh-Hessian (1995)
 Shifting diagonal of input Hessian by   4.999191576363316E-003
 Lowest  eigenvalues of input Hessian
   -0.000000   -0.000000   -0.000000   -0.000000    0.000000    0.000000
    0.005000    0.005186    0.006139    0.006737    0.007563    0.009919
    0.011636    0.013729    0.014734    0.019961    0.020879    0.021802
 Highest eigenvalues
    1.843266    1.901605    2.051139    2.095621    2.645887    2.650122
 

........................................................................
.............................. CYCLE   21 ..............................
........................................................................
   1    -40.5392005 -0.405392E+02  0.378E-02    1.21       0.0  T
   2    -40.5392000  0.453984E-06  0.225E-02    1.21       1.0  T
   3    -40.5391879  0.121637E-04  0.243E-02    1.21       1.0  T
   4    -40.5392011 -0.131864E-04  0.290E-03    1.21       7.0  T
   5    -40.5392013 -0.198669E-06  0.925E-04    1.21      22.1  T
   6    -40.5392013 -0.725991E-08  0.443E-04    1.21      46.0  T
     SCC iter.                  ...        0 min,  0.007 sec
     gradient                   ...        0 min,  0.014 sec
 * total energy  :   -39.7187139 Eh     change       -0.5282390E-04 Eh
   gradient norm :     0.0041701 Eh/α   predicted     0.0000000E+00 (-100.00%)
   displ. norm   :     0.0470796 α      lambda       -0.3703466E-04
   maximum displ.:     0.0253249 α      in ANC's #6, #1, #4, ...

........................................................................
.............................. CYCLE   22 ..............................
........................................................................
   1    -40.5388956 -0.405389E+02  0.451E-02    1.21       0.0  T
   2    -40.5388961 -0.514683E-06  0.253E-02    1.21       1.0  T
   3    -40.5388957  0.432783E-06  0.551E-03    1.21       3.7  T
   4    -40.5388964 -0.681318E-06  0.140E-03    1.21      14.6  T
   5    -40.5388964  0.236121E-08  0.120E-03    1.21      17.0  T
     SCC iter.                  ...        0 min,  0.006 sec
     gradient                   ...        0 min,  0.013 sec
 * total energy  :   -39.7187338 Eh     change       -0.1987857E-04 Eh
   gradient norm :     0.0024154 Eh/α   predicted    -0.1855898E-04 (  -6.64%)
   displ. norm   :     0.1433959 α      lambda       -0.1110606E-03
   maximum displ.:     0.0833694 α      in ANC's #6, #3, #7, ...

........................................................................
.............................. CYCLE   23 ..............................
........................................................................
   1    -40.5379748 -0.405380E+02  0.104E-01    1.20       0.0  T
   2    -40.5379765 -0.179285E-05  0.597E-02    1.20       1.0  T
   3    -40.5379708  0.577750E-05  0.174E-02    1.20       1.2  T
   4    -40.5379776 -0.685924E-05  0.377E-03    1.20       5.4  T
   5    -40.5379776 -0.116477E-07  0.311E-03    1.20       6.6  T
   6    -40.5379778 -0.139362E-06  0.120E-03    1.20      17.0  T
   7    -40.5379778 -0.333344E-07  0.323E-04    1.20      63.2  T
   8    -40.5379778 -0.157714E-08  0.143E-04    1.20     142.3  T
     SCC iter.                  ...        0 min,  0.009 sec
     gradient                   ...        0 min,  0.014 sec
 * total energy  :   -39.7186936 Eh     change        0.4020308E-04 Eh
   gradient norm :     0.0078420 Eh/α   predicted    -0.5667573E-04 (-240.97%)
   displ. norm   :     0.0432325 α      lambda       -0.1499602E-03
   maximum displ.:     0.0220973 α      in ANC's #7, #1, #3, ...

........................................................................
.............................. CYCLE   24 ..............................
........................................................................
   1    -40.5390542 -0.405391E+02  0.583E-02    1.20       0.0  T
   2    -40.5390552 -0.928751E-06  0.327E-02    1.20       1.0  T
   3    -40.5390541  0.109037E-05  0.839E-03    1.20       2.4  T
   4    -40.5390557 -0.159647E-05  0.176E-03    1.20      11.6  T
   5    -40.5390557  0.114458E-07  0.142E-03    1.20      14.4  T
     SCC iter.                  ...        0 min,  0.006 sec
     gradient                   ...        0 min,  0.013 sec
 * total energy  :   -39.7187753 Eh     change       -0.8171787E-04 Eh
   gradient norm :     0.0022928 Eh/α   predicted    -0.7512080E-04 (  -8.07%)
   displ. norm   :     0.0430663 α      lambda       -0.1501847E-04
   maximum displ.:     0.0254042 α      in ANC's #3, #6, #4, ...

........................................................................
.............................. CYCLE   25 ..............................
........................................................................
   1    -40.5390117 -0.405390E+02  0.228E-02    1.20       0.0  T
   2    -40.5390117 -0.412233E-07  0.133E-02    1.20       1.5  T
   3    -40.5390114  0.279990E-06  0.367E-03    1.20       5.6  T
   4    -40.5390117 -0.303276E-06  0.760E-04    1.20      26.9  T
   5    -40.5390117 -0.917084E-08  0.453E-04    1.20      45.0  T
     SCC iter.                  ...        0 min,  0.006 sec
     gradient                   ...        0 min,  0.014 sec
 * total energy  :   -39.7187873 Eh     change       -0.1204122E-04 Eh
   gradient norm :     0.0013141 Eh/α   predicted    -0.7524879E-05 ( -37.51%)
   displ. norm   :     0.1975644 α      lambda       -0.2973646E-04
   maximum displ.:     0.1283833 α      in ANC's #3, #6, #4, ...

........................................................................
.............................. CYCLE   26 ..............................
........................................................................
   1    -40.5384208 -0.405384E+02  0.971E-02    1.20       0.0  T
   2    -40.5384212 -0.424588E-06  0.569E-02    1.20       1.0  T
   3    -40.5384204  0.804922E-06  0.689E-03    1.20       3.0  T
   4    -40.5384215 -0.103706E-05  0.128E-03    1.20      16.0  T
   5    -40.5384215 -0.365727E-08  0.877E-04    1.20      23.3  T
   6    -40.5384215 -0.758698E-08  0.414E-04    1.20      49.3  T
     SCC iter.                  ...        0 min,  0.007 sec
     gradient                   ...        0 min,  0.015 sec
 * total energy  :   -39.7188070 Eh     change       -0.1967283E-04 Eh
   gradient norm :     0.0031535 Eh/α   predicted    -0.1512947E-04 ( -23.09%)
   displ. norm   :     0.0797536 α      lambda       -0.2398680E-04
   maximum displ.:     0.0537077 α      in ANC's #3, #6, #4, ...

........................................................................
.............................. CYCLE   27 ..............................
........................................................................
   1    -40.5384383 -0.405384E+02  0.593E-02    1.20       0.0  T
   2    -40.5384390 -0.744974E-06  0.334E-02    1.20       1.0  T
   3    -40.5384391 -0.367945E-07  0.380E-03    1.20       5.4  T
   4    -40.5384393 -0.275423E-06  0.167E-03    1.20      12.2  T
   5    -40.5384393 -0.520659E-08  0.101E-03    1.20      20.2  T
   6    -40.5384394 -0.237327E-07  0.180E-04    1.20     113.1  T
   7    -40.5384394 -0.648690E-09  0.638E-05    1.20     320.0  T
     SCC iter.                  ...        0 min,  0.008 sec
     gradient                   ...        0 min,  0.015 sec
 * total energy  :   -39.7188057 Eh     change        0.1354601E-05 Eh
   gradient norm :     0.0034592 Eh/α   predicted    -0.1207065E-04 (-991.09%)
   displ. norm   :     0.0355705 α      lambda       -0.3988843E-04
   maximum displ.:     0.0249410 α      in ANC's #3, #2, #1, ...

........................................................................
.............................. CYCLE   28 ..............................
........................................................................
   1    -40.5392424 -0.405392E+02  0.352E-02    1.20       0.0  T
   2    -40.5392428 -0.351859E-06  0.197E-02    1.20       1.0  T
   3    -40.5392428 -0.273241E-08  0.270E-03    1.20       7.5  T
   4    -40.5392429 -0.146149E-06  0.933E-04    1.20      21.9  T
   5    -40.5392429 -0.293497E-08  0.518E-04    1.20      39.4  T
     SCC iter.                  ...        0 min,  0.006 sec
     gradient                   ...        0 min,  0.014 sec
 * total energy  :   -39.7188264 Eh     change       -0.2077561E-04 Eh
   gradient norm :     0.0013294 Eh/α   predicted    -0.1997237E-04 (  -3.87%)
   displ. norm   :     0.0743945 α      lambda       -0.1235359E-04
   maximum displ.:     0.0550300 α      in ANC's #3, #4, #6, ...

........................................................................
.............................. CYCLE   29 ..............................
........................................................................
   1    -40.5391109 -0.405391E+02  0.356E-02    1.20       0.0  T
   2    -40.5391110 -0.103311E-06  0.207E-02    1.20       1.0  T
   3    -40.5391108  0.131497E-06  0.295E-03    1.20       6.9  T
   4    -40.5391110 -0.183526E-06  0.739E-04    1.20      27.6  T
   5    -40.5391110 -0.951665E-09  0.497E-04    1.20      41.0  T
     SCC iter.                  ...        0 min,  0.006 sec
     gradient                   ...        0 min,  0.014 sec
 * total energy  :   -39.7188333 Eh     change       -0.6818098E-05 Eh
   gradient norm :     0.0011009 Eh/α   predicted    -0.6193265E-05 (  -9.16%)
   displ. norm   :     0.1115620 α      lambda       -0.7857439E-05
   maximum displ.:     0.0835927 α      in ANC's #3, #4, #6, ...

........................................................................
.............................. CYCLE   30 ..............................
........................................................................
   1    -40.5387479 -0.405387E+02  0.550E-02    1.20       0.0  T
   2    -40.5387480 -0.856698E-07  0.323E-02    1.20       1.0  T
   3    -40.5387465  0.149938E-05  0.760E-03    1.20       2.7  T
   4    -40.5387481 -0.160219E-05  0.734E-04    1.20      27.8  T
   5    -40.5387481  0.112557E-08  0.520E-04    1.20      39.3  T
   6    -40.5387481 -0.386733E-08  0.183E-04    1.20     111.4  T
     SCC iter.                  ...        0 min,  0.007 sec
     gradient                   ...        0 min,  0.014 sec
 * total energy  :   -39.7188396 Eh     change       -0.6354927E-05 Eh
   gradient norm :     0.0010280 Eh/α   predicted    -0.3951773E-05 ( -37.82%)
   displ. norm   :     0.0374480 α      lambda       -0.3464081E-05
   maximum displ.:     0.0305608 α      in ANC's #3, #1, #4, ...

........................................................................
.............................. CYCLE   31 ..............................
........................................................................
   1    -40.5393852 -0.405394E+02  0.174E-02    1.20       0.0  T
   2    -40.5393852 -0.442852E-08  0.102E-02    1.20       2.0  T
   3    -40.5393844  0.827409E-06  0.582E-03    1.20       3.5  T
   4    -40.5393852 -0.865111E-06  0.606E-04    1.20      33.7  T
   5    -40.5393853 -0.589813E-08  0.290E-04    1.20      70.3  T
     SCC iter.                  ...        0 min,  0.006 sec
     gradient                   ...        0 min,  0.014 sec
 * total energy  :   -39.7188412 Eh     change       -0.1638257E-05 Eh
   gradient norm :     0.0007376 Eh/α   predicted    -0.1733556E-05 (   5.82%)
   displ. norm   :     0.0399219 α      lambda       -0.1230668E-05
   maximum displ.:     0.0297869 α      in ANC's #3, #4, #1, ...

   *** GEOMETRY OPTIMIZATION CONVERGED AFTER 31 ITERATIONS ***

------------------------------------------------------------------------
 total energy gain   :        -0.0432403 Eh      -27.1337 kcal/mol
 total RMSD          :         0.8839009 a0        0.4677 Å
 total power (kW/mol):        -3.6621737 (step) -111.8078 (real)
------------------------------------------------------------------------

 ANCopt (total)                0 d,  0 h,  0 min,  1.015 sec
 optimizer setup                ...        0 min,  0.000 sec (  0.016%)
 model hessian                  ...        0 min,  0.006 sec (  0.577%)
 ANC generation                 ...        0 min,  0.001 sec (  0.132%)
 coordinate transformation      ...        0 min,  0.001 sec (  0.055%)
 single point calculation       ...        0 min,  0.993 sec ( 97.823%)
 optimization log               ...        0 min,  0.003 sec (  0.298%)
 hessian update                 ...        0 min,  0.000 sec (  0.041%)
 rational function              ...        0 min,  0.009 sec (  0.871%)

================
 final structure:
================
$coord
    1.43776939750124   -1.85061871497335    0.26248328840337      C 
    2.27378790885101    0.55199157386174    0.05216066086300      C 
    0.10917610954240    2.23461126080362   -0.00788432332667      C 
   -2.12405840015063    0.58529030259378    0.19267890462203      C 
   -1.29236835653189   -1.84514136154881    0.35128894863221      C 
   -4.65727995285035    1.33104124997130    0.22175746086056      C 
   -6.75886200300916    1.87859254484060    0.25035632098948      N 
    0.11943593659222    4.80117144581547   -0.21437646283105      C 
   -2.02248476588962    6.47154111890383   -0.29039132280868      C 
   -1.20658216966434    8.90900875219248   -0.52529139389479      C 
    1.55206332284560    8.87633943856808   -0.60556753229558      C 
    2.36591240591306    6.45354163271471   -0.42167180062868      C 
    4.90254942463642    5.70770957797315   -0.42835835968355      C 
    7.00840540228182    5.18001891050755   -0.43568183889510      N 
   -2.78540805655634   11.11384370254739   -0.66969146399433      C 
   -1.95476585296596   13.48050396311473   -0.89880243378219      C 
    2.57171457529095   -3.53170527814890    0.35310505093853      H 
    4.19918660022690    1.17173785505811   -0.05800461573509      H 
   -2.45642519147881   -3.50129101875976    0.51632401968678      H 
   -3.95106869654559    5.85944291277654   -0.17984445759965      H 
    2.73668540267443   10.51482561277101   -0.78218518268155      H 
   -4.79482689162635   10.74181490005570   -0.58178904355442      H 
    0.02452880435843   13.93764804395927   -0.99590893424370      H 
   -3.24343926197652   15.05023300623324   -0.99889300572542      H 
$end
           -------------------------------------------------
          |                Final Singlepoint                |
           -------------------------------------------------

          ...................................................
          :                      SETUP                      :
          :.................................................:
          :  # basis functions                  72          :
          :  # atomic orbitals                  72          :
          :  # shells                           40          :
          :  # electrons                        74          :
          :  max. iterations                   250          :
          :  Hamiltonian                  GFN2-xTB          :
          :  restarted?                      false          :
          :  GBSA solvation                  false          :
          :  PC potential                    false          :
          :  electronic temp.          300.0000000     K    :
          :  accuracy                    1.0000000          :
          :  -> integral cutoff          0.2500000E+02      :
          :  -> integral neglect         0.1000000E-07      :
          :  -> SCF convergence          0.1000000E-05 Eh   :
          :  -> wf. convergence          0.1000000E-03 e    :
          :  Broyden damping             0.4000000          :
          ...................................................

 iter      E             dE          RMSdq      gap      omega  full diag
   1    -40.5393853 -0.405394E+02  0.184E-04    1.20       0.0  T
   2    -40.5393853  0.258396E-09  0.137E-04    1.20     149.3  T
   3    -40.5393853 -0.513516E-09  0.982E-05    1.20     207.8  T

   *** convergence criteria satisfied after 3 iterations ***

         #    Occupation            Energy/Eh            Energy/eV
      -------------------------------------------------------------
         1        2.0000           -0.6889957             -18.7485
       ...           ...                  ...                  ...
        31        2.0000           -0.4570013             -12.4356
        32        2.0000           -0.4484875             -12.2040
        33        2.0000           -0.4307612             -11.7216
        34        2.0000           -0.4284167             -11.6578
        35        2.0000           -0.4273224             -11.6280
        36        2.0000           -0.4050637             -11.0223
        37        2.0000           -0.4013103             -10.9202 (HOMO)
        38                         -0.3570868              -9.7168 (LUMO)
        39                         -0.2717368              -7.3943
        40                         -0.2624934              -7.1428
        41                         -0.2240939              -6.0979
        42                         -0.2195591              -5.9745
       ...                                ...                  ...
        72                          1.1775387              32.0425
      -------------------------------------------------------------
                  HL-Gap            0.0442235 Eh            1.2034 eV
             Fermi-level           -0.3791895 Eh          -10.3183 eV

 SCC (total)                   0 d,  0 h,  0 min,  0.030 sec
 SCC setup                      ...        0 min,  0.000 sec (  0.780%)
 Dispersion                     ...        0 min,  0.000 sec (  0.858%)
 integral evaluation            ...        0 min,  0.010 sec ( 33.496%)
 zeroth order Hamiltonian       ...        0 min,  0.000 sec (  0.565%)
 iterations                     ...        0 min,  0.004 sec ( 14.191%)
 molecular gradient             ...        0 min,  0.014 sec ( 48.721%)
 printout                       ...        0 min,  0.000 sec (  1.206%)

         :::::::::::::::::::::::::::::::::::::::::::::::::::::
         ::                     SUMMARY                     ::
         :::::::::::::::::::::::::::::::::::::::::::::::::::::
         :: total energy             -39.718841273874 Eh    ::
         :: gradient norm              0.000737217462 Eh/a0 ::
         :: HOMO-LUMO gap              1.203383470575 eV    ::
         ::.................................................::
         :: SCC energy               -40.539385255167 Eh    ::
         :: -> isotropic ES            0.018842583853 Eh    ::
         :: -> anisotropic ES          0.002078107426 Eh    ::
         :: -> anisotropic XC          0.051814394663 Eh    ::
         :: -> dispersion             -0.025918124207 Eh    ::
         :: repulsion energy           0.820561862310 Eh    ::
         :: add. restraining           0.000000000000 Eh    ::
         :::::::::::::::::::::::::::::::::::::::::::::::::::::

           -------------------------------------------------
          |                Property Printout                |
           -------------------------------------------------

    * Orbital Energies and Occupations

         #    Occupation            Energy/Eh            Energy/eV
      -------------------------------------------------------------
         1        2.0000           -0.6889957             -18.7485
       ...           ...                  ...                  ...
        25        2.0000           -0.4856132             -13.2142
        26        2.0000           -0.4842883             -13.1782
        27        2.0000           -0.4765480             -12.9675
        28        2.0000           -0.4733616             -12.8808
        29        2.0000           -0.4674351             -12.7196
        30        2.0000           -0.4580073             -12.4630
        31        2.0000           -0.4570013             -12.4356
        32        2.0000           -0.4484875             -12.2040
        33        2.0000           -0.4307612             -11.7216
        34        2.0000           -0.4284167             -11.6578
        35        2.0000           -0.4273224             -11.6280
        36        2.0000           -0.4050637             -11.0223
        37        2.0000           -0.4013103             -10.9202 (HOMO)
        38                         -0.3570868              -9.7168 (LUMO)
        39                         -0.2717368              -7.3943
        40                         -0.2624934              -7.1428
        41                         -0.2240939              -6.0979
        42                         -0.2195591              -5.9745
        43                         -0.2127209              -5.7884
        44                         -0.1789256              -4.8688
        45                         -0.1414097              -3.8480
        46                         -0.1242725              -3.3816
        47                         -0.0965937              -2.6284
        48                          0.0434498               1.1823
       ...                                ...                  ...
        72                          1.1775387              32.0425
      -------------------------------------------------------------
                  HL-Gap            0.0442235 Eh            1.2034 eV
             Fermi-level           -0.3791895 Eh          -10.3183 eV

     #   Z        covCN         q      C6AA      α(0)
     1   6 C      3.020    -0.023    28.565     8.767
     2   6 C      2.997    -0.044    29.071     8.844
     3   6 C      3.074     0.035    27.137     8.541
     4   6 C      3.047    -0.003    28.064     8.689
     5   6 C      3.023    -0.014    28.339     8.732
     6   6 C      1.900     0.115    28.271     8.587
     7   7 N      0.911    -0.248    26.454     7.439
     8   6 C      3.062     0.036    27.132     8.542
     9   6 C      2.999    -0.054    29.323     8.883
    10   6 C      3.065     0.024    27.405     8.584
    11   6 C      3.017    -0.017    28.422     8.745
    12   6 C      3.042     0.001    27.963     8.673
    13   6 C      1.901     0.116    28.252     8.584
    14   7 N      0.911    -0.240    26.273     7.413
    15   6 C      2.891    -0.023    28.588     8.766
    16   6 C      2.840    -0.072    29.798     8.946
    17   1 H      0.926     0.046     2.365     2.405
    18   1 H      0.926     0.055     2.254     2.348
    19   1 H      0.926     0.048     2.349     2.397
    20   1 H      0.926     0.057     2.239     2.340
    21   1 H      0.926     0.051     2.313     2.378
    22   1 H      0.925     0.051     2.306     2.375
    23   1 H      0.926     0.053     2.281     2.362
    24   1 H      0.926     0.052     2.298     2.371

 Mol. C6AA /au·bohr⁶  :       9374.469763
 Mol. C8AA /au·bohr⁸  :     240778.514594
 Mol. α(0) /au        :        155.710922


Wiberg/Mayer (AO) data.
largest (>0.10) Wiberg bond orders for each atom
          total WBO             WBO to atom ...
     1  C   3.934        C    2 1.708    C    5 1.137    H   17 0.972
     2  C   3.983        C    1 1.708    C    3 1.122    H   18 0.964
     3  C   3.948        C    8 1.541    C    2 1.122    C    4 1.042
     4  C   3.977        C    5 1.604    C    6 1.135    C    3 1.042
     5  C   3.932        C    4 1.604    C    1 1.137    H   19 0.973    N    7 0.111
     6  C   3.951        N    7 2.758    C    4 1.135
     7  N   2.995        C    6 2.758    C    5 0.111
     8  C   3.982        C    3 1.541    C    9 1.166    C   12 1.024
     9  C   3.986        C   10 1.580    C    8 1.166    H   20 0.963    C   16 0.116
    10  C   3.945        C    9 1.580    C   15 1.140    C   11 1.087
    11  C   3.948        C   12 1.647    C   10 1.087    H   21 0.970    N   14 0.116
    12  C   3.983        C   11 1.647    C   13 1.129    C    8 1.024
    13  C   3.950        N   14 2.764    C   12 1.129
    14  N   2.997        C   13 2.764    C   11 0.116
    15  C   3.985        C   16 1.840    C   10 1.140    H   22 0.962
    16  C   3.921        C   15 1.840    H   24 0.978    H   23 0.974    C    9 0.116
    17  H   0.996        C    1 0.972
    18  H   0.996        C    2 0.964
    19  H   0.997        C    5 0.973
    20  H   0.996        C    9 0.963
    21  H   0.997        C   11 0.970
    22  H   0.997        C   15 0.962
    23  H   0.997        C   16 0.974
    24  H   0.997        C   16 0.978

molecular dipole:
                 x           y           z       tot (Debye)
 q only:       -0.075       0.545      -0.056
   full:       -0.059       0.526      -0.061       1.355
molecular quadrupole (traceless):
                xx          xy          yy          xz          yz          zz
 q only:      -22.560      -7.369      23.600       1.231      -1.753      -1.040
  q+dip:      -29.127      -7.715      33.571       1.349      -2.886      -4.443
   full:      -34.071      -6.742      31.601       1.633      -2.181       2.470

           -------------------------------------------------
          |                Geometry Summary                 |
           -------------------------------------------------

      molecular mass/u    :      204.2306000
   center of mass at/Å    :       -0.1059241       2.4669452      -0.1066418
  moments of inertia/u·Å² :        0.6771960E+03   0.1159361E+04   0.1836531E+04
rotational constants/cm⁻¹ :        0.2489328E-01   0.1454045E-01   0.9179063E-02

 * 19 selected distances

     #   Z        #   Z                                     value/Å
     1   6 C      2   6 C                                 1.3507708
     1   6 C      5   6 C                                 1.4454938 (max)
     4   6 C      5   6 C                                 1.3619365
     6   6 C      7   7 N                                 1.1493357
     3   6 C      8   6 C                                 1.3625647
     8   6 C      9   6 C                                 1.4379351
     9   6 C     10   6 C                                 1.3658642
    11   6 C     12   6 C                                 1.3559869
    13   6 C     14   7 N                                 1.1488316
    10   6 C     15   6 C                                 1.4370685
    15   6 C     16   6 C                                 1.3328061
     1   6 C     17   1 H                                 1.0741250
     2   6 C     18   1 H                                 1.0719441 (min)
     5   6 C     19   1 H                                 1.0747767
     9   6 C     20   1 H                                 1.0723279
    11   6 C     21   1 H                                 1.0740031
    15   6 C     22   1 H                                 1.0824096
    16   6 C     23   1 H                                 1.0761985
    16   6 C     24   1 H                                 1.0760331

 * 3 distinct bonds (by element types)

   Z      Z             #   av. dist./Å        max./Å        min./Å
   1 H    6 C           8     1.0752272     1.0824096     1.0719441
   6 C    6 C           9     1.3833807     1.4454938     1.3328061
   6 C    7 N           2     1.1490836     1.1493357     1.1488316


optimized geometry written to: xtbopt.xyz


           -------------------------------------------------
          | TOTAL ENERGY              -39.718841273874 Eh   |
          | GRADIENT NORM               0.000737217462 Eh/α |
          | HOMO-LUMO GAP               1.203383470575 eV   |
           -------------------------------------------------

------------------------------------------------------------------------
 * finished run on 2021/05/19 at 11:00:05.535     
------------------------------------------------------------------------
 total:
 * wall-time:     0 d,  0 h,  0 min,  1.110 sec
 *  cpu-time:     0 d,  0 h,  0 min,  1.107 sec
 * ratio c/w:     0.997 speedup
 SCF:
 * wall-time:     0 d,  0 h,  0 min,  0.043 sec
 *  cpu-time:     0 d,  0 h,  0 min,  0.042 sec
 * ratio c/w:     0.998 speedup
 ANC optimizer:
 * wall-time:     0 d,  0 h,  0 min,  1.046 sec
 *  cpu-time:     0 d,  0 h,  0 min,  1.043 sec
 * ratio c/w:     0.998 speedup

