      -----------------------------------------------------------      
     |                   =====================                   |     
     |                           x T B                           |     
     |                   =====================                   |     
     |                         S. Grimme                         |     
     |          Mulliken Center for Theoretical Chemistry        |     
     |                    University of Bonn                     |     
     |                Version 6.2 RC2 (SAW190805)                |     
      -----------------------------------------------------------      

   This program is distributed in the hope that it will be useful,
   but WITHOUT ANY WARRANTY; without even the implied warranty of
   MERCHANTABILITY or FITNESS FOR A PARTICULAR PURPOSE.
   
   FOR NON-COMMERCIAL, ACADEMIA USE ONLY.
   
   Cite this work as:
   * S. Grimme, C. Bannwarth, P. Shushkov, J. Chem. Theory Comput., 2017,
     13, 1989-2009. DOI: 10.1021/acs.jctc.7b00118
   * C. Bannwarth, S. Ehlert and S. Grimme., J. Chem. Theory Comput., 2019,
     15, 1652-1671. DOI: 10.1021/acs.jctc.8b01176
   * P. Pracht, E. Caldeweyher, S. Ehlert, S. Grimme, ChemRxiv, 2019, preprint.
     DOI: 10.26434/chemrxiv.8326202.v1
   
   for DFT-D4:
   * E. Caldeweyher, C. Bannwarth and S. Grimme, J. Chem. Phys., 2017,
     147, 034112. DOI: 10.1063/1.4993215
   * E. Caldeweyher, S. Ehlert, A. Hansen, H. Neugebauer, S. Spicher,
     C. Bannwarth and S. Grimme, J. Chem. Phys., 2019, 150, 154122.
     DOI: 10.1063/1.5090222
   
   for sTDA-xTB:
   * S. Grimme and C. Bannwarth, J. Chem. Phys., 2016, 145, 054103.
     DOI: 10.1063/1.4959605
   
   in the mass-spec context:
   * V. Asgeirsson, C. Bauer and S. Grimme, Chem. Sci., 2017, 8, 4879.
     DOI: 10.1039/c7sc00601b
   
   for metadynamics refer to:
   * S. Grimme, J. Chem. Theory Comput., 2019, 155, 2847-2862
     DOI: 10.1021/acs.jctc.9b00143
   
   with help from (in alphabetical order)
   C. Bannwarth, F. Bohle, G. Brandenburg, E. Caldeweyher, M. Checinski,
   S. Dohm, S. Ehlert, S. Ehrlich, F. März, H. Neugebauer, J. Pisarek,
   P. Pracht, P. Shushkov, and S. Spicher.
   
 * started run on 2021/05/19 at 11:00:05.873     

           -------------------------------------------------
          |                Calculation Setup                |
           -------------------------------------------------

          program call               : /ihome/ghutchison/geoffh/xtb/xtb 594.xyz -opt
          hostname                   : smp-n144
          coordinate file            : 594.xyz
          omp threads                :                     1
          number of atoms            :                    32
          number of electrons        :                    78
          charge                     :                     0
          spin                       :                   0.0
          first test random number   :      0.50611349428987


########################################################################
# WARNING! Please study the warnings concerning your input carefully
#  - the use of '-opt' is discouraged, please use '--opt' next time
########################################################################

           ------------------------------------------------- 
          |                 G F N 2 - x T B                 |
          | Geometry, Frequencies, Noncovalent interactions |
          |            JCTC 2019 parametrisation            |
           ------------------------------------------------- 
             KAB for C  - Si     :                1.0500
             KAB for H  - Pd     :                0.9500
             k(s)              :                1.8500
             k(p)              :                2.2300
             k(d)              :                2.2300
             k(f)              :                2.0000
             kEN (H0ij)        :               -2.0000
             D4 a1             :                0.5200
             D4 a2             :                5.0000
             D4 s6             :                1.0000
             D4 s8             :                2.7000
             D4 s9             :                5.0000
             alphaj            :                2.0000

  Z AO/shell   Hii/eV     exponent
  1     Wed Apr 25 08:07:45 CEST 2018   EN: 2.200 GM2: 0.406  GM3: 0.0800  RAES: 1.40
     1s    -10.707211    1.230000
  6     Wed Apr 25 08:07:45 CEST 2018   EN: 2.550 GM2: 0.538  GM3: 0.1500  RAES: 3.00
     2s    -13.970922    2.096432
     2p    -10.063292    1.800000
  8     Wed Apr 25 08:07:45 CEST 2018   EN: 3.440 GM2: 0.452  GM3:-0.0517  RAES: 1.80
     2s    -20.229985    2.439742
     2p    -15.503117    2.137023

           ------------------------------------------------- 
          |        Self-Consistent Charge Iterations        |
           ------------------------------------------------- 

          ...................................................
          :                      SETUP                      :
          :.................................................:
          :  # basis functions                  74          :
          :  # atomic orbitals                  74          :
          :  # shells                           46          :
          :  # electrons                        78          :
          :  max. iterations                   250          :
          :  Hamiltonian                  GFN2-xTB          :
          :  restarted?                      false          :
          :  GBSA solvation                  false          :
          :  PC potential                    false          :
          :  electronic temp.          300.0000000     K    :
          :  accuracy                    1.0000000          :
          :  -> integral cutoff          0.2500000E+02      :
          :  -> integral neglect         0.1000000E-07      :
          :  -> SCF convergence          0.1000000E-05 Eh   :
          :  -> wf. convergence          0.1000000E-03 e    :
          :  Broyden damping             0.4000000          :
          ...................................................

 iter      E             dE          RMSdq      gap      omega  full diag
   1    -43.5109600 -0.435110E+02  0.383E+00    3.66       0.0  T
   2    -43.5796044 -0.686444E-01  0.210E+00    3.77       1.0  T
   3    -43.5800769 -0.472487E-03  0.823E-01    3.58       1.0  T
   4    -43.5816244 -0.154750E-02  0.252E-01    3.79       1.0  T
   5    -43.5826125 -0.988101E-03  0.744E-02    3.73       1.0  T
   6    -43.5826265 -0.140138E-04  0.411E-02    3.73       1.0  T
   7    -43.5826352 -0.869200E-05  0.150E-02    3.73       1.2  T
   8    -43.5826377 -0.253331E-05  0.452E-03    3.73       3.9  T
   9    -43.5826379 -0.152074E-06  0.150E-03    3.73      11.8  T
  10    -43.5826379 -0.180435E-07  0.820E-04    3.73      21.6  T
  11    -43.5826379 -0.894313E-08  0.334E-04    3.73      52.9  T

   *** convergence criteria satisfied after 11 iterations ***

         #    Occupation            Energy/Eh            Energy/eV
      -------------------------------------------------------------
         1        2.0000           -0.7015336             -19.0897
       ...           ...                  ...                  ...
        33        2.0000           -0.4394503             -11.9581
        34        2.0000           -0.4364422             -11.8762
        35        2.0000           -0.4214016             -11.4669
        36        2.0000           -0.4110474             -11.1852
        37        2.0000           -0.4091982             -11.1348
        38        2.0000           -0.3901958             -10.6178
        39        2.0000           -0.3575994              -9.7308 (HOMO)
        40                         -0.2205261              -6.0008 (LUMO)
        41                         -0.2012009              -5.4750
        42                         -0.0896492              -2.4395
        43                          0.0160873               0.4378
        44                          0.0284350               0.7738
       ...                                ...                  ...
        74                          0.6358463              17.3023
      -------------------------------------------------------------
                  HL-Gap            0.1370733 Eh            3.7300 eV
             Fermi-level           -0.2890627 Eh           -7.8658 eV

 SCC (total)                   0 d,  0 h,  0 min,  0.043 sec
 SCC setup                      ...        0 min,  0.000 sec (  0.792%)
 Dispersion                     ...        0 min,  0.000 sec (  1.115%)
 integral evaluation            ...        0 min,  0.010 sec ( 23.167%)
 zeroth order Hamiltonian       ...        0 min,  0.000 sec (  0.439%)
 iterations                     ...        0 min,  0.016 sec ( 36.229%)
 molecular gradient             ...        0 min,  0.016 sec ( 37.176%)
 printout                       ...        0 min,  0.000 sec (  0.960%)

         :::::::::::::::::::::::::::::::::::::::::::::::::::::
         ::                     SUMMARY                     ::
         :::::::::::::::::::::::::::::::::::::::::::::::::::::
         :: total energy             -43.005382865678 Eh    ::
         :: gradient norm              0.045924567817 Eh/a0 ::
         :: HOMO-LUMO gap              3.729954485063 eV    ::
         ::.................................................::
         :: SCC energy               -43.582637910130 Eh    ::
         :: -> isotropic ES            0.034561886786 Eh    ::
         :: -> anisotropic ES          0.008817932232 Eh    ::
         :: -> anisotropic XC          0.015754987240 Eh    ::
         :: -> dispersion             -0.025916899716 Eh    ::
         :: repulsion energy           0.577153337038 Eh    ::
         :: add. restraining           0.000000000000 Eh    ::
         :::::::::::::::::::::::::::::::::::::::::::::::::::::

      ----------------------------------------------------------- 
     |                   =====================                   |
     |                        A N C O P T                        |
     |                   =====================                   |
     |               Approximate Normal Coordinate               |
     |                Rational Function Optimizer                |
      ----------------------------------------------------------- 

          ...................................................
          :                      SETUP                      :
          :.................................................:
          :   optimization level            normal          :
          :   max. optcycles                   200          :
          :   ANC micro-cycles                  20          :
          :   degrees of freedom                90          :
          :.................................................:
          :   RF solver                   davidson          :
          :   input Hessian                  false          :
          :   write xtbopt.log                true          :
          :   linear?                        false          :
          :   energy convergence         0.5000000E-05 Eh   :
          :   grad. convergence          0.1000000E-02 Eh/α :
          :   maximium RF displ.         2.0000000          :
          :   Hlow (freq-cutoff)         0.5000000E-02      :
          :   Hmax (freq-cutoff)         5.0000000          :
          :   S6 in model hess.         20.0000000          :
          ...................................................

generating ANC from model Hessian ...
Using Lindh-Hessian (1995)
 Shifting diagonal of input Hessian by   4.399461617269452E-003
 Lowest  eigenvalues of input Hessian
   -0.000000   -0.000000   -0.000000   -0.000000    0.000000    0.000000
    0.005000    0.005602    0.005805    0.006493    0.006949    0.007626
    0.007997    0.009620    0.010957    0.013357    0.015600    0.016066
 Highest eigenvalues
    1.528530    1.578525    1.810879    1.881109    1.969581    2.079284
 

........................................................................
.............................. CYCLE    1 ..............................
........................................................................
   1    -43.5826379 -0.435826E+02  0.809E-05    3.73       0.0  T
   2    -43.5826379 -0.385398E-10  0.494E-05    3.73     358.0  T
   3    -43.5826379 -0.159801E-10  0.317E-05    3.73     558.3  T
     SCC iter.                  ...        0 min,  0.005 sec
     gradient                   ...        0 min,  0.016 sec
 * total energy  :   -43.0053828 Eh     change        0.5510071E-07 Eh
   gradient norm :     0.0459279 Eh/α   predicted     0.0000000E+00 (-100.00%)
   displ. norm   :     0.2321571 α      lambda       -0.5060785E-02
   maximum displ.:     0.0881401 α      in ANC's #3, #15, #8, ...

........................................................................
.............................. CYCLE    2 ..............................
........................................................................
   1    -43.6044243 -0.436044E+02  0.179E-01    3.82       0.0  T
   2    -43.6044394 -0.150941E-04  0.108E-01    3.80       1.0  T
   3    -43.6044375  0.188425E-05  0.171E-02    3.81       1.0  T
   4    -43.6044429 -0.541032E-05  0.531E-03    3.80       3.3  T
   5    -43.6044432 -0.231165E-06  0.255E-03    3.81       6.9  T
     SCC iter.                  ...        0 min,  0.007 sec
     gradient                   ...        0 min,  0.015 sec
 * total energy  :   -43.0086533 Eh     change       -0.3270536E-02 Eh
   gradient norm :     0.0166257 Eh/α   predicted    -0.2666781E-02 ( -18.46%)
   displ. norm   :     0.2085093 α      lambda       -0.1065337E-02
   maximum displ.:     0.1242175 α      in ANC's #8, #3, #11, ...

........................................................................
.............................. CYCLE    3 ..............................
........................................................................
   1    -43.6122226 -0.436122E+02  0.147E-01    3.83       0.0  T
   2    -43.6122297 -0.707724E-05  0.896E-02    3.83       1.0  T
   3    -43.6122280  0.166120E-05  0.123E-02    3.83       1.4  T
   4    -43.6122318 -0.373389E-05  0.467E-03    3.83       3.8  T
   5    -43.6122321 -0.299969E-06  0.229E-03    3.83       7.7  T
   6    -43.6122321 -0.711489E-08  0.669E-04    3.83      26.4  T
     SCC iter.                  ...        0 min,  0.008 sec
     gradient                   ...        0 min,  0.015 sec
 * total energy  :   -43.0093671 Eh     change       -0.7137289E-03 Eh
   gradient norm :     0.0057961 Eh/α   predicted    -0.5558305E-03 ( -22.12%)
   displ. norm   :     0.2522684 α      lambda       -0.5025852E-03
   maximum displ.:     0.1597501 α      in ANC's #8, #3, #6, ...

........................................................................
.............................. CYCLE    4 ..............................
........................................................................
   1    -43.6133646 -0.436134E+02  0.158E-01    3.82       0.0  T
   2    -43.6133713 -0.668440E-05  0.961E-02    3.82       1.0  T
   3    -43.6133710  0.313364E-06  0.106E-02    3.82       1.7  T
   4    -43.6133735 -0.252241E-05  0.494E-03    3.82       3.6  T
   5    -43.6133738 -0.304764E-06  0.238E-03    3.82       7.4  T
   6    -43.6133738 -0.115588E-07  0.645E-04    3.82      27.4  T
     SCC iter.                  ...        0 min,  0.008 sec
     gradient                   ...        0 min,  0.015 sec
 * total energy  :   -43.0097691 Eh     change       -0.4020159E-03 Eh
   gradient norm :     0.0060290 Eh/α   predicted    -0.2672991E-03 ( -33.51%)
   displ. norm   :     0.3607221 α      lambda       -0.5455440E-03
   maximum displ.:     0.2150791 α      in ANC's #8, #3, #6, ...

........................................................................
.............................. CYCLE    5 ..............................
........................................................................
   1    -43.6115887 -0.436116E+02  0.214E-01    3.80       0.0  T
   2    -43.6115990 -0.103439E-04  0.130E-01    3.81       1.0  T
   3    -43.6116016 -0.259307E-05  0.113E-02    3.81       1.6  T
   4    -43.6116031 -0.151518E-05  0.602E-03    3.81       2.9  T
   5    -43.6116034 -0.223545E-06  0.288E-03    3.81       6.1  T
   6    -43.6116034 -0.372782E-07  0.842E-04    3.81      21.0  T
     SCC iter.                  ...        0 min,  0.008 sec
     gradient                   ...        0 min,  0.016 sec
 * total energy  :   -43.0102132 Eh     change       -0.4440658E-03 Eh
   gradient norm :     0.0077752 Eh/α   predicted    -0.3082911E-03 ( -30.58%)
   displ. norm   :     0.4383561 α      lambda       -0.5467679E-03
   maximum displ.:     0.2535652 α      in ANC's #8, #3, #6, ...

........................................................................
.............................. CYCLE    6 ..............................
........................................................................
   1    -43.6086102 -0.436086E+02  0.252E-01    3.78       0.0  T
   2    -43.6086218 -0.115644E-04  0.153E-01    3.79       1.0  T
   3    -43.6086259 -0.415762E-05  0.124E-02    3.78       1.4  T
   4    -43.6086274 -0.149618E-05  0.679E-03    3.79       2.6  T
   5    -43.6086276 -0.164563E-06  0.277E-03    3.79       6.4  T
   6    -43.6086276 -0.468244E-07  0.755E-04    3.79      23.4  T
     SCC iter.                  ...        0 min,  0.008 sec
     gradient                   ...        0 min,  0.015 sec
 * total energy  :   -43.0106336 Eh     change       -0.4204666E-03 Eh
   gradient norm :     0.0087453 Eh/α   predicted    -0.3259179E-03 ( -22.49%)
   displ. norm   :     0.4159384 α      lambda       -0.4569129E-03
   maximum displ.:     0.2300848 α      in ANC's #8, #3, #6, ...

........................................................................
.............................. CYCLE    7 ..............................
........................................................................
   1    -43.6074228 -0.436074E+02  0.233E-01    3.77       0.0  T
   2    -43.6074322 -0.938682E-05  0.141E-01    3.77       1.0  T
   3    -43.6074304  0.181688E-05  0.169E-02    3.77       1.0  T
   4    -43.6074375 -0.708729E-05  0.676E-03    3.77       2.6  T
   5    -43.6074376 -0.923495E-07  0.261E-03    3.77       6.8  T
   6    -43.6074376 -0.530255E-07  0.723E-04    3.77      24.5  T
     SCC iter.                  ...        0 min,  0.008 sec
     gradient                   ...        0 min,  0.015 sec
 * total energy  :   -43.0109751 Eh     change       -0.3414374E-03 Eh
   gradient norm :     0.0078991 Eh/α   predicted    -0.2680106E-03 ( -21.51%)
   displ. norm   :     0.3396847 α      lambda       -0.3810846E-03
   maximum displ.:     0.1899148 α      in ANC's #3, #6, #8, ...

........................................................................
.............................. CYCLE    8 ..............................
........................................................................
   1    -43.6099614 -0.436100E+02  0.181E-01    3.76       0.0  T
   2    -43.6099682 -0.681002E-05  0.110E-01    3.77       1.0  T
   3    -43.6099603  0.793253E-05  0.199E-02    3.76       1.0  T
   4    -43.6099722 -0.119012E-04  0.529E-03    3.77       3.3  T
   5    -43.6099722 -0.276280E-07  0.225E-03    3.77       7.9  T
   6    -43.6099722 -0.344242E-07  0.632E-04    3.77      28.0  T
     SCC iter.                  ...        0 min,  0.008 sec
     gradient                   ...        0 min,  0.015 sec
 * total energy  :   -43.0112512 Eh     change       -0.2761093E-03 Eh
   gradient norm :     0.0047370 Eh/α   predicted    -0.2125284E-03 ( -23.03%)
   displ. norm   :     0.3905305 α      lambda       -0.2445971E-03
   maximum displ.:     0.2269070 α      in ANC's #3, #6, #8, ...

........................................................................
.............................. CYCLE    9 ..............................
........................................................................
   1    -43.6099420 -0.436099E+02  0.210E-01    3.77       0.0  T
   2    -43.6099477 -0.570522E-05  0.127E-01    3.77       1.0  T
   3    -43.6099512 -0.351589E-05  0.811E-03    3.77       2.2  T
   4    -43.6099512  0.493815E-07  0.365E-03    3.77       4.8  T
   5    -43.6099513 -0.129585E-06  0.106E-03    3.77      16.7  T
   6    -43.6099513 -0.304112E-07  0.362E-04    3.77      48.8  T
     SCC iter.                  ...        0 min,  0.008 sec
     gradient                   ...        0 min,  0.015 sec
 * total energy  :   -43.0114256 Eh     change       -0.1744152E-03 Eh
   gradient norm :     0.0052391 Eh/α   predicted    -0.1409528E-03 ( -19.19%)
   displ. norm   :     0.3074656 α      lambda       -0.2227936E-03
   maximum displ.:     0.1788050 α      in ANC's #3, #6, #8, ...

........................................................................
.............................. CYCLE   10 ..............................
........................................................................
   1    -43.6149181 -0.436149E+02  0.144E-01    3.77       0.0  T
   2    -43.6149210 -0.286975E-05  0.863E-02    3.77       1.0  T
   3    -43.6149209  0.113911E-06  0.869E-03    3.77       2.0  T
   4    -43.6149225 -0.158938E-05  0.379E-03    3.77       4.7  T
   5    -43.6149225 -0.232105E-07  0.151E-03    3.77      11.7  T
   6    -43.6149225 -0.241942E-07  0.434E-04    3.77      40.7  T
     SCC iter.                  ...        0 min,  0.008 sec
     gradient                   ...        0 min,  0.015 sec
 * total energy  :   -43.0115484 Eh     change       -0.1228439E-03 Eh
   gradient norm :     0.0043806 Eh/α   predicted    -0.1219435E-03 (  -0.73%)
   displ. norm   :     0.3738300 α      lambda       -0.1221971E-03
   maximum displ.:     0.2293144 α      in ANC's #3, #6, #8, ...

........................................................................
.............................. CYCLE   11 ..............................
........................................................................
   1    -43.6115047 -0.436115E+02  0.192E-01    3.77       0.0  T
   2    -43.6115098 -0.509313E-05  0.116E-01    3.77       1.0  T
   3    -43.6115095  0.309700E-06  0.119E-02    3.77       1.5  T
   4    -43.6115127 -0.322473E-05  0.534E-03    3.77       3.3  T
   5    -43.6115128 -0.802849E-07  0.164E-03    3.77      10.8  T
   6    -43.6115128 -0.177046E-07  0.473E-04    3.77      37.4  T
     SCC iter.                  ...        0 min,  0.008 sec
     gradient                   ...        0 min,  0.016 sec
 * total energy  :   -43.0116003 Eh     change       -0.5182572E-04 Eh
   gradient norm :     0.0041391 Eh/α   predicted    -0.6963834E-04 (  34.37%)
   displ. norm   :     0.0470838 α      lambda       -0.5486434E-04
   maximum displ.:     0.0235556 α      in ANC's #5, #8, #7, ...

........................................................................
.............................. CYCLE   12 ..............................
........................................................................
   1    -43.6136691 -0.436137E+02  0.240E-02    3.77       0.0  T
   2    -43.6136695 -0.398563E-06  0.145E-02    3.77       1.2  T
   3    -43.6136692  0.231761E-06  0.363E-03    3.77       4.9  T
   4    -43.6136695 -0.322047E-06  0.928E-04    3.77      19.0  T
   5    -43.6136696 -0.150410E-07  0.486E-04    3.77      36.4  T
     SCC iter.                  ...        0 min,  0.007 sec
     gradient                   ...        0 min,  0.015 sec
 * total energy  :   -43.0116378 Eh     change       -0.3753601E-04 Eh
   gradient norm :     0.0020306 Eh/α   predicted    -0.2749956E-04 ( -26.74%)
   displ. norm   :     0.1317987 α      lambda       -0.3848086E-04
   maximum displ.:     0.0892412 α      in ANC's #3, #6, #2, ...

........................................................................
.............................. CYCLE   13 ..............................
........................................................................
   1    -43.6145490 -0.436145E+02  0.491E-02    3.77       0.0  T
   2    -43.6145494 -0.375342E-06  0.293E-02    3.77       1.0  T
   3    -43.6145493  0.590213E-07  0.277E-03    3.77       6.4  T
   4    -43.6145495 -0.169834E-06  0.109E-03    3.77      16.2  T
   5    -43.6145495 -0.899770E-08  0.573E-04    3.77      30.9  T
   6    -43.6145495 -0.145814E-08  0.173E-04    3.77     102.1  T
     SCC iter.                  ...        0 min,  0.008 sec
     gradient                   ...        0 min,  0.016 sec
 * total energy  :   -43.0116651 Eh     change       -0.2735000E-04 Eh
   gradient norm :     0.0021382 Eh/α   predicted    -0.1957532E-04 ( -28.43%)
   displ. norm   :     0.1443996 α      lambda       -0.3036925E-04
   maximum displ.:     0.1013510 α      in ANC's #3, #2, #6, ...

........................................................................
.............................. CYCLE   14 ..............................
........................................................................
   1    -43.6146507 -0.436147E+02  0.520E-02    3.78       0.0  T
   2    -43.6146509 -0.293738E-06  0.311E-02    3.78       1.0  T
   3    -43.6146509  0.240443E-07  0.288E-03    3.78       6.1  T
   4    -43.6146511 -0.158475E-06  0.115E-03    3.78      15.4  T
   5    -43.6146511 -0.362567E-08  0.520E-04    3.78      34.0  T
   6    -43.6146511 -0.134161E-08  0.150E-04    3.78     118.2  T
     SCC iter.                  ...        0 min,  0.008 sec
     gradient                   ...        0 min,  0.016 sec
 * total energy  :   -43.0116889 Eh     change       -0.2371523E-04 Eh
   gradient norm :     0.0025584 Eh/α   predicted    -0.1550203E-04 ( -34.63%)
   displ. norm   :     0.1753627 α      lambda       -0.3944300E-04
   maximum displ.:     0.1219208 α      in ANC's #3, #2, #5, ...

........................................................................
.............................. CYCLE   15 ..............................
........................................................................
   1    -43.6144312 -0.436144E+02  0.583E-02    3.78       0.0  T
   2    -43.6144315 -0.288894E-06  0.347E-02    3.78       1.0  T
   3    -43.6144314  0.141436E-06  0.299E-03    3.78       5.9  T
   4    -43.6144317 -0.271861E-06  0.114E-03    3.78      15.5  T
   5    -43.6144317 -0.823166E-08  0.527E-04    3.78      33.6  T
   6    -43.6144317 -0.163204E-08  0.165E-04    3.78     106.9  T
     SCC iter.                  ...        0 min,  0.008 sec
     gradient                   ...        0 min,  0.016 sec
 * total energy  :   -43.0117186 Eh     change       -0.2973135E-04 Eh
   gradient norm :     0.0027123 Eh/α   predicted    -0.2033062E-04 ( -31.62%)
   displ. norm   :     0.1821362 α      lambda       -0.4130261E-04
   maximum displ.:     0.1136199 α      in ANC's #3, #2, #5, ...

........................................................................
.............................. CYCLE   16 ..............................
........................................................................
   1    -43.6139367 -0.436139E+02  0.587E-02    3.78       0.0  T
   2    -43.6139370 -0.314257E-06  0.349E-02    3.78       1.0  T
   3    -43.6139368  0.203819E-06  0.313E-03    3.78       5.6  T
   4    -43.6139371 -0.319042E-06  0.111E-03    3.78      16.0  T
   5    -43.6139372 -0.125741E-07  0.548E-04    3.78      32.3  T
   6    -43.6139372 -0.105575E-08  0.160E-04    3.78     110.6  T
     SCC iter.                  ...        0 min,  0.008 sec
     gradient                   ...        0 min,  0.016 sec
 * total energy  :   -43.0117479 Eh     change       -0.2935093E-04 Eh
   gradient norm :     0.0028596 Eh/α   predicted    -0.2133936E-04 ( -27.30%)
   displ. norm   :     0.1748214 α      lambda       -0.4387733E-04
   maximum displ.:     0.1086382 α      in ANC's #2, #3, #8, ...

........................................................................
.............................. CYCLE   17 ..............................
........................................................................
   1    -43.6136585 -0.436137E+02  0.619E-02    3.78       0.0  T
   2    -43.6136590 -0.435114E-06  0.370E-02    3.77       1.0  T
   3    -43.6136589  0.799580E-07  0.312E-03    3.77       5.7  T
   4    -43.6136591 -0.231498E-06  0.142E-03    3.77      12.4  T
   5    -43.6136592 -0.204497E-07  0.651E-04    3.77      27.1  T
   6    -43.6136592 -0.832358E-09  0.172E-04    3.77     102.9  T
     SCC iter.                  ...        0 min,  0.008 sec
     gradient                   ...        0 min,  0.016 sec
 * total energy  :   -43.0117751 Eh     change       -0.2720598E-04 Eh
   gradient norm :     0.0032479 Eh/α   predicted    -0.2261128E-04 ( -16.89%)
   displ. norm   :     0.1551280 α      lambda       -0.4011612E-04
   maximum displ.:     0.0944865 α      in ANC's #2, #3, #8, ...

........................................................................
.............................. CYCLE   18 ..............................
........................................................................
   1    -43.6133681 -0.436134E+02  0.588E-02    3.77       0.0  T
   2    -43.6133688 -0.614564E-06  0.352E-02    3.77       1.0  T
   3    -43.6133679  0.839279E-06  0.617E-03    3.77       2.9  T
   4    -43.6133690 -0.111850E-05  0.136E-03    3.77      13.0  T
   5    -43.6133690 -0.631378E-08  0.728E-04    3.77      24.3  T
   6    -43.6133690 -0.194394E-08  0.210E-04    3.77      84.1  T
     SCC iter.                  ...        0 min,  0.008 sec
     gradient                   ...        0 min,  0.016 sec
 * total energy  :   -43.0118034 Eh     change       -0.2820565E-04 Eh
   gradient norm :     0.0028226 Eh/α   predicted    -0.2054098E-04 ( -27.17%)
   displ. norm   :     0.1673460 α      lambda       -0.4101655E-04
   maximum displ.:     0.1011013 α      in ANC's #2, #8, #4, ...

........................................................................
.............................. CYCLE   19 ..............................
........................................................................
   1    -43.6132680 -0.436133E+02  0.631E-02    3.77       0.0  T
   2    -43.6132684 -0.387473E-06  0.377E-02    3.77       1.0  T
   3    -43.6132684  0.232615E-07  0.313E-03    3.77       5.7  T
   4    -43.6132686 -0.202486E-06  0.134E-03    3.77      13.2  T
   5    -43.6132686 -0.431658E-08  0.618E-04    3.77      28.6  T
   6    -43.6132686 -0.310625E-08  0.161E-04    3.77     109.8  T
     SCC iter.                  ...        0 min,  0.008 sec
     gradient                   ...        0 min,  0.016 sec
 * total energy  :   -43.0118344 Eh     change       -0.3106378E-04 Eh
   gradient norm :     0.0027525 Eh/α   predicted    -0.2108509E-04 ( -32.12%)
   displ. norm   :     0.2062165 α      lambda       -0.4662211E-04
   maximum displ.:     0.1180512 α      in ANC's #2, #4, #8, ...

........................................................................
.............................. CYCLE   20 ..............................
........................................................................
   1    -43.6134164 -0.436134E+02  0.757E-02    3.77       0.0  T
   2    -43.6134170 -0.626771E-06  0.452E-02    3.77       1.0  T
   3    -43.6134165  0.463203E-06  0.531E-03    3.77       3.3  T
   4    -43.6134173 -0.751936E-06  0.157E-03    3.77      11.2  T
   5    -43.6134173 -0.659576E-08  0.769E-04    3.77      23.0  T
   6    -43.6134173 -0.314244E-08  0.215E-04    3.77      82.1  T
     SCC iter.                  ...        0 min,  0.008 sec
     gradient                   ...        0 min,  0.016 sec
 * total energy  :   -43.0118671 Eh     change       -0.3270824E-04 Eh
   gradient norm :     0.0030384 Eh/α   predicted    -0.2430293E-04 ( -25.70%)
   displ. norm   :     0.1544201 α      lambda       -0.3495168E-04
   maximum displ.:     0.0833404 α      in ANC's #4, #2, #3, ...
 * RMSD in coord.:     0.6443784 α      energy gain  -0.6484257E-02 Eh

generating ANC from model Hessian ...
Using Lindh-Hessian (1995)
 Shifting diagonal of input Hessian by   4.386236234296650E-003
 Lowest  eigenvalues of input Hessian
   -0.000000   -0.000000   -0.000000    0.000000    0.000000    0.000000
    0.005000    0.005576    0.005828    0.006317    0.007371    0.007821
    0.008176    0.009566    0.011654    0.012937    0.016288    0.016543
 Highest eigenvalues
    1.593097    1.640497    1.855318    1.936494    2.021536    2.149040
 

........................................................................
.............................. CYCLE   21 ..............................
........................................................................
   1    -43.6139258 -0.436139E+02  0.521E-02    3.78       0.0  T
   2    -43.6139260 -0.194100E-06  0.309E-02    3.78       1.0  T
   3    -43.6139259  0.940705E-07  0.233E-03    3.78       7.6  T
   4    -43.6139261 -0.163339E-06  0.819E-04    3.78      21.6  T
   5    -43.6139261 -0.487391E-08  0.389E-04    3.78      45.4  T
     SCC iter.                  ...        0 min,  0.007 sec
     gradient                   ...        0 min,  0.016 sec
 * total energy  :   -43.0118931 Eh     change       -0.2594712E-04 Eh
   gradient norm :     0.0026182 Eh/α   predicted     0.0000000E+00 (-100.00%)
   displ. norm   :     0.0409099 α      lambda       -0.2686917E-04
   maximum displ.:     0.0217901 α      in ANC's #5, #4, #7, ...

........................................................................
.............................. CYCLE   22 ..............................
........................................................................
   1    -43.6141902 -0.436142E+02  0.205E-02    3.78       0.0  T
   2    -43.6141903 -0.978739E-07  0.124E-02    3.78       1.4  T
   3    -43.6141901  0.120814E-06  0.267E-03    3.78       6.6  T
   4    -43.6141903 -0.171191E-06  0.565E-04    3.78      31.3  T
   5    -43.6141903 -0.107865E-08  0.313E-04    3.78      56.5  T
     SCC iter.                  ...        0 min,  0.007 sec
     gradient                   ...        0 min,  0.016 sec
 * total energy  :   -43.0119148 Eh     change       -0.2176373E-04 Eh
   gradient norm :     0.0014449 Eh/α   predicted    -0.1345729E-04 ( -38.17%)
   displ. norm   :     0.0889221 α      lambda       -0.2753805E-04
   maximum displ.:     0.0428282 α      in ANC's #5, #4, #13, ...

........................................................................
.............................. CYCLE   23 ..............................
........................................................................
   1    -43.6143270 -0.436143E+02  0.447E-02    3.78       0.0  T
   2    -43.6143276 -0.533006E-06  0.273E-02    3.78       1.0  T
   3    -43.6143271  0.409318E-06  0.528E-03    3.78       3.4  T
   4    -43.6143278 -0.687936E-06  0.135E-03    3.78      13.1  T
   5    -43.6143278 -0.820941E-08  0.737E-04    3.78      24.0  T
   6    -43.6143278 -0.160774E-08  0.216E-04    3.78      81.9  T
     SCC iter.                  ...        0 min,  0.008 sec
     gradient                   ...        0 min,  0.016 sec
 * total energy  :   -43.0119393 Eh     change       -0.2444248E-04 Eh
   gradient norm :     0.0013330 Eh/α   predicted    -0.1381778E-04 ( -43.47%)
   displ. norm   :     0.0584547 α      lambda       -0.8887526E-05
   maximum displ.:     0.0274170 α      in ANC's #4, #5, #3, ...

........................................................................
.............................. CYCLE   24 ..............................
........................................................................
   1    -43.6141719 -0.436142E+02  0.262E-02    3.78       0.0  T
   2    -43.6141720 -0.934022E-07  0.160E-02    3.78       1.1  T
   3    -43.6141720 -0.269522E-07  0.124E-03    3.78      14.2  T
   4    -43.6141720 -0.302227E-07  0.698E-04    3.78      25.3  T
   5    -43.6141721 -0.268190E-08  0.181E-04    3.78      97.7  T
     SCC iter.                  ...        0 min,  0.007 sec
     gradient                   ...        0 min,  0.016 sec
 * total energy  :   -43.0119497 Eh     change       -0.1038349E-04 Eh
   gradient norm :     0.0011645 Eh/α   predicted    -0.4455756E-05 ( -57.09%)
   displ. norm   :     0.0897997 α      lambda       -0.1040072E-04
   maximum displ.:     0.0413393 α      in ANC's #4, #3, #5, ...

........................................................................
.............................. CYCLE   25 ..............................
........................................................................
   1    -43.6141266 -0.436141E+02  0.353E-02    3.78       0.0  T
   2    -43.6141267 -0.154796E-06  0.214E-02    3.78       1.0  T
   3    -43.6141267  0.288655E-07  0.213E-03    3.78       8.3  T
   4    -43.6141268 -0.119211E-06  0.909E-04    3.78      19.5  T
   5    -43.6141268 -0.223687E-08  0.242E-04    3.78      73.0  T
     SCC iter.                  ...        0 min,  0.007 sec
     gradient                   ...        0 min,  0.016 sec
 * total energy  :   -43.0119604 Eh     change       -0.1069670E-04 Eh
   gradient norm :     0.0006963 Eh/α   predicted    -0.5241674E-05 ( -51.00%)
   displ. norm   :     0.0898325 α      lambda        0.2498982E-06
   maximum displ.:     0.0413393 α      in ANC's #4, #3, #5, ...

........................................................................
.............................. CYCLE   26 ..............................
........................................................................
   1    -43.6139416 -0.436139E+02  0.353E-02    3.78       0.0  T
   2    -43.6139417 -0.156155E-06  0.214E-02    3.78       1.0  T
   3    -43.6139417  0.312054E-07  0.213E-03    3.78       8.3  T
   4    -43.6139418 -0.121714E-06  0.909E-04    3.78      19.4  T
   5    -43.6139418 -0.234154E-08  0.248E-04    3.78      71.1  T
     SCC iter.                  ...        0 min,  0.007 sec
     gradient                   ...        0 min,  0.016 sec
 * total energy  :   -43.0119606 Eh     change       -0.2349934E-06 Eh
   gradient norm :     0.0013035 Eh/α   predicted     0.1245006E-06 (-152.98%)
   displ. norm   :     0.0234188 α      lambda       -0.5721445E-05
   maximum displ.:     0.0103119 α      in ANC's #5, #11, #13, ...

........................................................................
.............................. CYCLE   27 ..............................
........................................................................
   1    -43.6142408 -0.436142E+02  0.134E-02    3.78       0.0  T
   2    -43.6142408 -0.434535E-07  0.836E-03    3.78       2.1  T
   3    -43.6142408  0.832823E-08  0.104E-03    3.78      17.0  T
   4    -43.6142408 -0.352601E-07  0.385E-04    3.78      46.0  T
   5    -43.6142408 -0.241812E-09  0.161E-04    3.78     109.5  T
     SCC iter.                  ...        0 min,  0.007 sec
     gradient                   ...        0 min,  0.016 sec
 * total energy  :   -43.0119668 Eh     change       -0.6238479E-05 Eh
   gradient norm :     0.0006636 Eh/α   predicted    -0.2868002E-05 ( -54.03%)
   displ. norm   :     0.0234122 α      lambda       -0.2079493E-05
   maximum displ.:     0.0103115 α      in ANC's #5, #11, #13, ...

........................................................................
.............................. CYCLE   28 ..............................
........................................................................
   1    -43.6145225 -0.436145E+02  0.135E-02    3.78       0.0  T
   2    -43.6145226 -0.431368E-07  0.842E-03    3.78       2.1  T
   3    -43.6145226  0.936836E-09  0.960E-04    3.78      18.4  T
   4    -43.6145226 -0.277291E-07  0.385E-04    3.78      45.9  T
     SCC iter.                  ...        0 min,  0.006 sec
     gradient                   ...        0 min,  0.016 sec
 * total energy  :   -43.0119685 Eh     change       -0.1653386E-05 Eh
   gradient norm :     0.0007154 Eh/α   predicted    -0.1044279E-05 ( -36.84%)
   displ. norm   :     0.0234273 α      lambda        0.3946399E-05
   maximum displ.:     0.0103121 α      in ANC's #5, #11, #13, ...

   *** GEOMETRY OPTIMIZATION CONVERGED AFTER 28 ITERATIONS ***

------------------------------------------------------------------------
 total energy gain   :        -0.0065856 Eh       -4.1325 kcal/mol
 total RMSD          :         0.6695775 a0        0.3543 Å
 total power (kW/mol):        -0.6175192 (step)  -17.5597 (real)
------------------------------------------------------------------------

 ANCopt (total)                0 d,  0 h,  0 min,  0.985 sec
 optimizer setup                ...        0 min,  0.000 sec (  0.016%)
 model hessian                  ...        0 min,  0.015 sec (  1.572%)
 ANC generation                 ...        0 min,  0.002 sec (  0.204%)
 coordinate transformation      ...        0 min,  0.001 sec (  0.062%)
 single point calculation       ...        0 min,  0.956 sec ( 97.074%)
 optimization log               ...        0 min,  0.003 sec (  0.355%)
 hessian update                 ...        0 min,  0.000 sec (  0.045%)
 rational function              ...        0 min,  0.005 sec (  0.493%)

================
 final structure:
================
$coord
    2.66937645248940    0.41510993984137   -0.08103385883280      C 
    1.30669255065030    2.42208655056204   -1.09191885643402      C 
    2.69124972720383    4.42984735477807   -1.93322501754204      O 
    1.40997858303136    6.51879715849107   -2.98751513816966      C 
    3.38638449957088    8.44554314479768   -3.78865132010102      C 
   -1.31274601765551    2.24971547057722   -1.17000108845435      C 
   -2.56089291064095    0.12771528441381   -0.27728555095522      C 
   -5.39013526079292   -0.04035863712570   -0.45187362022557      C 
   -6.18347819231900   -1.36324472186465   -2.89607157015045      C 
   -1.17059023981928   -1.89206723799790    0.71747658603855      C 
   -2.55876575791586   -3.90450066502163    1.57156997717993      O 
   -1.31840231701046   -6.08095479470766    2.47889727745110      C 
   -0.27502557760150   -7.74027739640154    0.36141721653119      C 
    1.44841020663120   -1.71150867770995    0.81286389785923      C 
    4.70151168014940    0.54836831025690   -0.01004530809174      H 
    0.12469006312056    7.35220796076022   -1.58447270533181      H 
    0.29379173331045    5.91696185511604   -4.63288034764905      H 
    4.47714999709087    9.04898112533243   -2.15785386379939      H 
    2.47183265375277   10.07792835760340   -4.63255634691814      H 
    4.66720365650553    7.60515920692999   -5.15555714095835      H 
   -2.43930732032629    3.77357687559633   -1.92372100701967      H 
   -6.20285790712221    1.85528569707271   -0.40142967966015      H 
   -6.10728628540387   -1.11043014252847    1.15597108349743      H 
   -5.47147164534965   -0.33632666459108   -4.52856632934612      H 
   -8.23195837705153   -1.47069222889636   -3.02697811074795      H 
   -5.42060009728642   -3.26886666936301   -2.94195734363350      H 
   -2.78522723882244   -7.11187054886823    3.50962116058970      H 
    0.17791924838067   -5.57348066772485    3.82187540531478      H 
   -1.79977713324071   -8.30378746695086   -0.89495651962908      H 
    0.58944049025990   -9.42373210929498    1.15890157118966      H 
    1.12900588850461   -6.72330210955831   -0.74073306861751      H 
    2.58140784406498   -3.22017838312452    1.58317010188859      H 
$end
           -------------------------------------------------
          |                Final Singlepoint                |
           -------------------------------------------------

          ...................................................
          :                      SETUP                      :
          :.................................................:
          :  # basis functions                  74          :
          :  # atomic orbitals                  74          :
          :  # shells                           46          :
          :  # electrons                        78          :
          :  max. iterations                   250          :
          :  Hamiltonian                  GFN2-xTB          :
          :  restarted?                      false          :
          :  GBSA solvation                  false          :
          :  PC potential                    false          :
          :  electronic temp.          300.0000000     K    :
          :  accuracy                    1.0000000          :
          :  -> integral cutoff          0.2500000E+02      :
          :  -> integral neglect         0.1000000E-07      :
          :  -> SCF convergence          0.1000000E-05 Eh   :
          :  -> wf. convergence          0.1000000E-03 e    :
          :  Broyden damping             0.4000000          :
          ...................................................

 iter      E             dE          RMSdq      gap      omega  full diag
   1    -43.6145226 -0.436145E+02  0.117E-04    3.78       0.0  T
   2    -43.6145226 -0.198987E-09  0.602E-05    3.78     293.6  T
   3    -43.6145226 -0.142506E-09  0.316E-05    3.78     559.7  T

   *** convergence criteria satisfied after 3 iterations ***

         #    Occupation            Energy/Eh            Energy/eV
      -------------------------------------------------------------
         1        2.0000           -0.7034975             -19.1431
       ...           ...                  ...                  ...
        33        2.0000           -0.4402748             -11.9805
        34        2.0000           -0.4368137             -11.8863
        35        2.0000           -0.4221536             -11.4874
        36        2.0000           -0.4135375             -11.2529
        37        2.0000           -0.4072581             -11.0821
        38        2.0000           -0.3913559             -10.6493
        39        2.0000           -0.3533410              -9.6149 (HOMO)
        40                         -0.2145269              -5.8376 (LUMO)
        41                         -0.1958780              -5.3301
        42                         -0.0793320              -2.1587
        43                          0.0234693               0.6386
        44                          0.0351416               0.9563
       ...                                ...                  ...
        74                          0.6651860              18.1006
      -------------------------------------------------------------
                  HL-Gap            0.1388142 Eh            3.7773 eV
             Fermi-level           -0.2839339 Eh           -7.7262 eV

 SCC (total)                   0 d,  0 h,  0 min,  0.032 sec
 SCC setup                      ...        0 min,  0.000 sec (  0.795%)
 Dispersion                     ...        0 min,  0.000 sec (  0.847%)
 integral evaluation            ...        0 min,  0.010 sec ( 30.810%)
 zeroth order Hamiltonian       ...        0 min,  0.000 sec (  0.543%)
 iterations                     ...        0 min,  0.005 sec ( 14.659%)
 molecular gradient             ...        0 min,  0.016 sec ( 50.981%)
 printout                       ...        0 min,  0.000 sec (  1.204%)

         :::::::::::::::::::::::::::::::::::::::::::::::::::::
         ::                     SUMMARY                     ::
         :::::::::::::::::::::::::::::::::::::::::::::::::::::
         :: total energy             -43.011968480380 Eh    ::
         :: gradient norm              0.000715077045 Eh/a0 ::
         :: HOMO-LUMO gap              3.777325752184 eV    ::
         ::.................................................::
         :: SCC energy               -43.614522586707 Eh    ::
         :: -> isotropic ES            0.033749815325 Eh    ::
         :: -> anisotropic ES          0.007797666388 Eh    ::
         :: -> anisotropic XC          0.014633620682 Eh    ::
         :: -> dispersion             -0.026286972384 Eh    ::
         :: repulsion energy           0.602436517298 Eh    ::
         :: add. restraining           0.000000000000 Eh    ::
         :::::::::::::::::::::::::::::::::::::::::::::::::::::

           -------------------------------------------------
          |                Property Printout                |
           -------------------------------------------------

    * Orbital Energies and Occupations

         #    Occupation            Energy/Eh            Energy/eV
      -------------------------------------------------------------
         1        2.0000           -0.7034975             -19.1431
       ...           ...                  ...                  ...
        27        2.0000           -0.4710379             -12.8176
        28        2.0000           -0.4641302             -12.6296
        29        2.0000           -0.4583019             -12.4710
        30        2.0000           -0.4558945             -12.4055
        31        2.0000           -0.4481982             -12.1961
        32        2.0000           -0.4461166             -12.1395
        33        2.0000           -0.4402748             -11.9805
        34        2.0000           -0.4368137             -11.8863
        35        2.0000           -0.4221536             -11.4874
        36        2.0000           -0.4135375             -11.2529
        37        2.0000           -0.4072581             -11.0821
        38        2.0000           -0.3913559             -10.6493
        39        2.0000           -0.3533410              -9.6149 (HOMO)
        40                         -0.2145269              -5.8376 (LUMO)
        41                         -0.1958780              -5.3301
        42                         -0.0793320              -2.1587
        43                          0.0234693               0.6386
        44                          0.0351416               0.9563
        45                          0.0998594               2.7173
        46                          0.1044390               2.8419
        47                          0.1128022               3.0695
        48                          0.1186342               3.2282
        49                          0.1302890               3.5453
        50                          0.1404724               3.8224
       ...                                ...                  ...
        74                          0.6651860              18.1006
      -------------------------------------------------------------
                  HL-Gap            0.1388142 Eh            3.7773 eV
             Fermi-level           -0.2839339 Eh           -7.7262 eV

     #   Z        covCN         q      C6AA      α(0)
     1   6 C      2.922    -0.063    29.557     8.916
     2   6 C      2.860     0.130    25.143     8.219
     3   8 O      1.706    -0.281    18.664     5.833
     4   6 C      3.691     0.089    19.271     6.282
     5   6 C      3.751    -0.113    22.715     6.797
     6   6 C      2.924    -0.077    29.925     8.971
     7   6 C      2.972    -0.009    28.238     8.716
     8   6 C      3.807    -0.055    21.561     6.610
     9   6 C      3.754    -0.097    22.409     6.750
    10   6 C      2.861     0.125    25.246     8.236
    11   8 O      1.705    -0.281    18.658     5.832
    12   6 C      3.688     0.083    19.389     6.303
    13   6 C      3.750    -0.114    22.750     6.803
    14   6 C      2.917    -0.068    29.703     8.937
    15   1 H      0.926     0.046     2.367     2.406
    16   1 H      0.923     0.026     2.643     2.542
    17   1 H      0.923     0.026     2.644     2.543
    18   1 H      0.925     0.055     2.254     2.348
    19   1 H      0.925     0.044     2.392     2.419
    20   1 H      0.925     0.056     2.251     2.346
    21   1 H      0.926     0.035     2.519     2.482
    22   1 H      0.924     0.033     2.540     2.492
    23   1 H      0.924     0.051     2.312     2.378
    24   1 H      0.925     0.032     2.552     2.498
    25   1 H      0.925     0.034     2.530     2.487
    26   1 H      0.925     0.041     2.434     2.440
    27   1 H      0.924     0.047     2.360     2.402
    28   1 H      0.924     0.027     2.626     2.534
    29   1 H      0.925     0.049     2.337     2.391
    30   1 H      0.925     0.041     2.442     2.444
    31   1 H      0.925     0.048     2.339     2.392
    32   1 H      0.926     0.038     2.473     2.459

 Mol. C6AA /au·bohr⁶  :       9213.967145
 Mol. C8AA /au·bohr⁸  :     207243.962799
 Mol. α(0) /au        :        147.206895


Wiberg/Mayer (AO) data.
largest (>0.10) Wiberg bond orders for each atom
          total WBO             WBO to atom ...
     1  C   3.986        C   14 1.450    C    2 1.360    H   15 0.969    C    7 0.108
     2  C   3.934        C    6 1.367    C    1 1.360    O    3 1.051
     3  O   2.211        C    2 1.051    C    4 0.971
     4  C   3.951        C    5 1.015    O    3 0.971    H   17 0.969    H   16 0.968
     5  C   3.993        C    4 1.015    H   18 0.986    H   20 0.986    H   19 0.986
     6  C   3.985        C    7 1.430    C    2 1.367    H   21 0.964
     7  C   3.987        C    6 1.430    C   10 1.333    C    8 1.013    C    1 0.108
     8  C   3.997        C    7 1.013    C    9 1.001    H   22 0.975    H   23 0.971
     9  C   3.997        C    8 1.001    H   24 0.989    H   26 0.988    H   25 0.987
    10  C   3.935        C   14 1.375    C    7 1.333    O   11 1.045
    11  O   2.214        C   10 1.045    C   12 0.976
    12  C   3.951        C   13 1.008    O   11 0.976    H   27 0.971    H   28 0.966
    13  C   3.993        C   12 1.008    H   29 0.987    H   30 0.986    H   31 0.984
    14  C   3.987        C    1 1.450    C   10 1.375    H   32 0.963
    15  H   0.997        C    1 0.969
    16  H   0.999        C    4 0.968
    17  H   0.999        C    4 0.969
    18  H   0.997        C    5 0.986
    19  H   0.997        C    5 0.986
    20  H   0.997        C    5 0.986
    21  H   0.998        C    6 0.964
    22  H   0.999        C    8 0.975
    23  H   0.997        C    8 0.971
    24  H   0.999        C    9 0.989
    25  H   0.998        C    9 0.987
    26  H   0.998        C    9 0.988
    27  H   0.997        C   12 0.971
    28  H   0.999        C   12 0.966
    29  H   0.998        C   13 0.987
    30  H   0.998        C   13 0.986
    31  H   0.998        C   13 0.984
    32  H   0.998        C   14 0.963

molecular dipole:
                 x           y           z       tot (Debye)
 q only:       -0.064      -0.042      -0.149
   full:       -0.079      -0.053      -0.129       0.406
molecular quadrupole (traceless):
                xx          xy          yy          xz          yz          zz
 q only:       -5.395      -1.313       8.647       0.902      -5.119      -3.253
  q+dip:       -5.047      -3.722       8.635       2.151      -6.357      -3.588
   full:       -6.540      -3.633       8.998       1.921      -5.646      -2.458

           -------------------------------------------------
          |                Geometry Summary                 |
           -------------------------------------------------

      molecular mass/u    :      194.2730000
   center of mass at/Å    :       -0.3029890       0.0660806      -0.3484774
  moments of inertia/u·Å² :        0.4140919E+03   0.1418631E+04   0.1724472E+04
rotational constants/cm⁻¹ :        0.4070988E-01   0.1188303E-01   0.9775535E-02

 * 31 selected distances

     #   Z        #   Z                                     value/Å
     1   6 C      2   6 C                                 1.3907148
     2   6 C      3   8 O                                 1.3652259
     3   8 O      4   6 C                                 1.4117131
     4   6 C      5   6 C                                 1.5208990
     2   6 C      6   6 C                                 1.3897596
     6   6 C      7   6 C                                 1.3857673
     8   6 C      9   6 C                                 1.5294527 (max)
     7   6 C     10   6 C                                 1.4002729
    10   6 C     11   8 O                                 1.3703949
    11   8 O     12   6 C                                 1.4099071
    12   6 C     13   6 C                                 1.5269041
     1   6 C     14   6 C                                 1.3811748
    10   6 C     14   6 C                                 1.3901219
     1   6 C     15   1 H                                 1.0783239 (min)
     4   6 C     16   1 H                                 1.0992463
     4   6 C     17   1 H                                 1.0992765
     5   6 C     18   1 H                                 1.0862202
     5   6 C     19   1 H                                 1.0862016
     5   6 C     20   1 H                                 1.0864480
     6   6 C     21   1 H                                 1.0792346
     8   6 C     22   1 H                                 1.0917647
     8   6 C     23   1 H                                 1.0902237
     9   6 C     24   1 H                                 1.0879134
     9   6 C     25   1 H                                 1.0877074
     9   6 C     26   1 H                                 1.0864878
    12   6 C     27   1 H                                 1.0943553
    12   6 C     28   1 H                                 1.0973379
    13   6 C     29   1 H                                 1.0871838
    13   6 C     30   1 H                                 1.0867222
    13   6 C     31   1 H                                 1.0871056
    14   6 C     32   1 H                                 1.0784237

 * 3 distinct bonds (by element types)

   Z      Z             #   av. dist./Å        max./Å        min./Å
   1 H    6 C          18     1.0883431     1.0992765     1.0783239
   6 C    6 C           9     1.4350075     1.5294527     1.3811748
   6 C    8 O           4     1.3893102     1.4117131     1.3652259


optimized geometry written to: xtbopt.xyz


           -------------------------------------------------
          | TOTAL ENERGY              -43.011968480380 Eh   |
          | GRADIENT NORM               0.000715077045 Eh/α |
          | HOMO-LUMO GAP               3.777325752184 eV   |
           -------------------------------------------------

------------------------------------------------------------------------
 * finished run on 2021/05/19 at 11:00:06.967     
------------------------------------------------------------------------
 total:
 * wall-time:     0 d,  0 h,  0 min,  1.094 sec
 *  cpu-time:     0 d,  0 h,  0 min,  1.080 sec
 * ratio c/w:     0.987 speedup
 SCF:
 * wall-time:     0 d,  0 h,  0 min,  0.044 sec
 *  cpu-time:     0 d,  0 h,  0 min,  0.043 sec
 * ratio c/w:     0.997 speedup
 ANC optimizer:
 * wall-time:     0 d,  0 h,  0 min,  1.017 sec
 *  cpu-time:     0 d,  0 h,  0 min,  1.015 sec
 * ratio c/w:     0.998 speedup

