      -----------------------------------------------------------      
     |                   =====================                   |     
     |                           x T B                           |     
     |                   =====================                   |     
     |                         S. Grimme                         |     
     |          Mulliken Center for Theoretical Chemistry        |     
     |                    University of Bonn                     |     
     |                Version 6.2 RC2 (SAW190805)                |     
      -----------------------------------------------------------      

   This program is distributed in the hope that it will be useful,
   but WITHOUT ANY WARRANTY; without even the implied warranty of
   MERCHANTABILITY or FITNESS FOR A PARTICULAR PURPOSE.
   
   FOR NON-COMMERCIAL, ACADEMIA USE ONLY.
   
   Cite this work as:
   * S. Grimme, C. Bannwarth, P. Shushkov, J. Chem. Theory Comput., 2017,
     13, 1989-2009. DOI: 10.1021/acs.jctc.7b00118
   * C. Bannwarth, S. Ehlert and S. Grimme., J. Chem. Theory Comput., 2019,
     15, 1652-1671. DOI: 10.1021/acs.jctc.8b01176
   * P. Pracht, E. Caldeweyher, S. Ehlert, S. Grimme, ChemRxiv, 2019, preprint.
     DOI: 10.26434/chemrxiv.8326202.v1
   
   for DFT-D4:
   * E. Caldeweyher, C. Bannwarth and S. Grimme, J. Chem. Phys., 2017,
     147, 034112. DOI: 10.1063/1.4993215
   * E. Caldeweyher, S. Ehlert, A. Hansen, H. Neugebauer, S. Spicher,
     C. Bannwarth and S. Grimme, J. Chem. Phys., 2019, 150, 154122.
     DOI: 10.1063/1.5090222
   
   for sTDA-xTB:
   * S. Grimme and C. Bannwarth, J. Chem. Phys., 2016, 145, 054103.
     DOI: 10.1063/1.4959605
   
   in the mass-spec context:
   * V. Asgeirsson, C. Bauer and S. Grimme, Chem. Sci., 2017, 8, 4879.
     DOI: 10.1039/c7sc00601b
   
   for metadynamics refer to:
   * S. Grimme, J. Chem. Theory Comput., 2019, 155, 2847-2862
     DOI: 10.1021/acs.jctc.9b00143
   
   with help from (in alphabetical order)
   C. Bannwarth, F. Bohle, G. Brandenburg, E. Caldeweyher, M. Checinski,
   S. Dohm, S. Ehlert, S. Ehrlich, F. März, H. Neugebauer, J. Pisarek,
   P. Pracht, P. Shushkov, and S. Spicher.
   
 * started run on 2021/05/19 at 11:00:09.993     

           -------------------------------------------------
          |                Calculation Setup                |
           -------------------------------------------------

          program call               : /ihome/ghutchison/geoffh/xtb/xtb 598.xyz -opt
          hostname                   : smp-n144
          coordinate file            : 598.xyz
          omp threads                :                     1
          number of atoms            :                    26
          number of electrons        :                    74
          charge                     :                     0
          spin                       :                   0.0
          first test random number   :      0.07619003275230


########################################################################
# WARNING! Please study the warnings concerning your input carefully
#  - the use of '-opt' is discouraged, please use '--opt' next time
########################################################################

           ------------------------------------------------- 
          |                 G F N 2 - x T B                 |
          | Geometry, Frequencies, Noncovalent interactions |
          |            JCTC 2019 parametrisation            |
           ------------------------------------------------- 
             KAB for C  - Si     :                1.0500
             KAB for H  - Pd     :                0.9500
             k(s)              :                1.8500
             k(p)              :                2.2300
             k(d)              :                2.2300
             k(f)              :                2.0000
             kEN (H0ij)        :               -2.0000
             D4 a1             :                0.5200
             D4 a2             :                5.0000
             D4 s6             :                1.0000
             D4 s8             :                2.7000
             D4 s9             :                5.0000
             alphaj            :                2.0000

  Z AO/shell   Hii/eV     exponent
  1     Wed Apr 25 08:07:45 CEST 2018   EN: 2.200 GM2: 0.406  GM3: 0.0800  RAES: 1.40
     1s    -10.707211    1.230000
  6     Wed Apr 25 08:07:45 CEST 2018   EN: 2.550 GM2: 0.538  GM3: 0.1500  RAES: 3.00
     2s    -13.970922    2.096432
     2p    -10.063292    1.800000
  8     Wed Apr 25 08:07:45 CEST 2018   EN: 3.440 GM2: 0.452  GM3:-0.0517  RAES: 1.80
     2s    -20.229985    2.439742
     2p    -15.503117    2.137023
 16     Tue Apr 24 11:44:34 CEST 2018   EN: 2.580 GM2: 0.340  GM3:-0.0502  RAES: 3.10
     3s    -20.029654    1.981333
     3p    -11.377694    2.025643
     3d     -0.420282    1.702555

           ------------------------------------------------- 
          |        Self-Consistent Charge Iterations        |
           ------------------------------------------------- 

          ...................................................
          :                      SETUP                      :
          :.................................................:
          :  # basis functions                  74          :
          :  # atomic orbitals                  73          :
          :  # shells                           41          :
          :  # electrons                        74          :
          :  max. iterations                   250          :
          :  Hamiltonian                  GFN2-xTB          :
          :  restarted?                      false          :
          :  GBSA solvation                  false          :
          :  PC potential                    false          :
          :  electronic temp.          300.0000000     K    :
          :  accuracy                    1.0000000          :
          :  -> integral cutoff          0.2500000E+02      :
          :  -> integral neglect         0.1000000E-07      :
          :  -> SCF convergence          0.1000000E-05 Eh   :
          :  -> wf. convergence          0.1000000E-03 e    :
          :  Broyden damping             0.4000000          :
          ...................................................

 iter      E             dE          RMSdq      gap      omega  full diag
   1    -41.4726503 -0.414727E+02  0.426E+00    3.83       0.0  T
   2    -41.5287437 -0.560934E-01  0.247E+00    3.25       1.0  T
   3    -41.5233349  0.540875E-02  0.145E+00    3.49       1.0  T
   4    -41.5412262 -0.178912E-01  0.541E-01    3.25       1.0  T
   5    -41.5448495 -0.362334E-02  0.141E-01    3.21       1.0  T
   6    -41.5450487 -0.199158E-03  0.600E-02    3.25       1.0  T
   7    -41.5450632 -0.145637E-04  0.252E-02    3.26       1.0  T
   8    -41.5450701 -0.687132E-05  0.130E-02    3.25       1.5  T
   9    -41.5450712 -0.110529E-05  0.434E-03    3.25       4.5  T
  10    -41.5450713 -0.698742E-07  0.204E-03    3.25       9.6  T
  11    -41.5450713 -0.561260E-07  0.929E-04    3.25      21.1  T
  12    -41.5450713 -0.463103E-08  0.435E-04    3.25      45.1  T

   *** convergence criteria satisfied after 12 iterations ***

         #    Occupation            Energy/Eh            Energy/eV
      -------------------------------------------------------------
         1        2.0000           -0.7481759             -20.3589
       ...           ...                  ...                  ...
        31        2.0000           -0.4453452             -12.1185
        32        2.0000           -0.4384464             -11.9307
        33        2.0000           -0.4325113             -11.7692
        34        2.0000           -0.4218615             -11.4794
        35        2.0000           -0.4153874             -11.3033
        36        2.0000           -0.3857170             -10.4959
        37        2.0000           -0.3817411             -10.3877 (HOMO)
        38                         -0.2622070              -7.1350 (LUMO)
        39                         -0.2412195              -6.5639
        40                         -0.2101054              -5.7173
        41                         -0.1958865              -5.3303
        42                         -0.1734389              -4.7195
       ...                                ...                  ...
        73                          0.6688817              18.2012
      -------------------------------------------------------------
                  HL-Gap            0.1195341 Eh            3.2527 eV
             Fermi-level           -0.3219740 Eh           -8.7614 eV

 SCC (total)                   0 d,  0 h,  0 min,  0.043 sec
 SCC setup                      ...        0 min,  0.000 sec (  0.735%)
 Dispersion                     ...        0 min,  0.000 sec (  0.862%)
 integral evaluation            ...        0 min,  0.010 sec ( 24.043%)
 zeroth order Hamiltonian       ...        0 min,  0.000 sec (  0.468%)
 iterations                     ...        0 min,  0.016 sec ( 37.112%)
 molecular gradient             ...        0 min,  0.015 sec ( 35.733%)
 printout                       ...        0 min,  0.000 sec (  0.923%)

         :::::::::::::::::::::::::::::::::::::::::::::::::::::
         ::                     SUMMARY                     ::
         :::::::::::::::::::::::::::::::::::::::::::::::::::::
         :: total energy             -41.035346988255 Eh    ::
         :: gradient norm              0.073229699086 Eh/a0 ::
         :: HOMO-LUMO gap              3.252688073720 eV    ::
         ::.................................................::
         :: SCC energy               -41.545071336902 Eh    ::
         :: -> isotropic ES            0.042708254384 Eh    ::
         :: -> anisotropic ES          0.002095854432 Eh    ::
         :: -> anisotropic XC          0.015185999109 Eh    ::
         :: -> dispersion             -0.025616634348 Eh    ::
         :: repulsion energy           0.509591078812 Eh    ::
         :: add. restraining           0.000000000000 Eh    ::
         :::::::::::::::::::::::::::::::::::::::::::::::::::::

      ----------------------------------------------------------- 
     |                   =====================                   |
     |                        A N C O P T                        |
     |                   =====================                   |
     |               Approximate Normal Coordinate               |
     |                Rational Function Optimizer                |
      ----------------------------------------------------------- 

          ...................................................
          :                      SETUP                      :
          :.................................................:
          :   optimization level            normal          :
          :   max. optcycles                   200          :
          :   ANC micro-cycles                  20          :
          :   degrees of freedom                72          :
          :.................................................:
          :   RF solver                   davidson          :
          :   input Hessian                  false          :
          :   write xtbopt.log                true          :
          :   linear?                        false          :
          :   energy convergence         0.5000000E-05 Eh   :
          :   grad. convergence          0.1000000E-02 Eh/α :
          :   maximium RF displ.         2.0000000          :
          :   Hlow (freq-cutoff)         0.5000000E-02      :
          :   Hmax (freq-cutoff)         5.0000000          :
          :   S6 in model hess.         20.0000000          :
          ...................................................

generating ANC from model Hessian ...
Using Lindh-Hessian (1995)
 Shifting diagonal of input Hessian by   4.322150070960700E-003
 Lowest  eigenvalues of input Hessian
   -0.000000    0.000000    0.000000    0.000000    0.000000    0.000000
    0.005000    0.005863    0.006492    0.009576    0.009987    0.013676
    0.014363    0.016868    0.019282    0.022750    0.024680    0.029503
 Highest eigenvalues
    1.637822    1.693268    1.748703    1.814015    1.971069    2.223227
 

........................................................................
.............................. CYCLE    1 ..............................
........................................................................
   1    -41.5450713 -0.415451E+02  0.162E-04    3.25       0.0  T
   2    -41.5450713 -0.689795E-10  0.100E-04    3.25     196.2  T
   3    -41.5450713 -0.800782E-11  0.661E-05    3.25     296.7  T
     SCC iter.                  ...        0 min,  0.005 sec
     gradient                   ...        0 min,  0.015 sec
 * total energy  :   -41.0353470 Eh     change       -0.1178407E-08 Eh
   gradient norm :     0.0732315 Eh/α   predicted     0.0000000E+00 (-100.00%)
   displ. norm   :     0.2489319 α      lambda       -0.7967483E-02
   maximum displ.:     0.0975576 α      in ANC's #6, #16, #5, ...

........................................................................
.............................. CYCLE    2 ..............................
........................................................................
   1    -41.5813060 -0.415813E+02  0.197E-01    3.54       0.0  T
   2    -41.5814170 -0.110988E-03  0.110E-01    3.50       1.0  T
   3    -41.5814336 -0.166150E-04  0.744E-02    3.51       1.0  T
   4    -41.5814839 -0.502671E-04  0.227E-02    3.50       1.0  T
   5    -41.5814894 -0.557085E-05  0.799E-03    3.50       2.5  T
   6    -41.5814897 -0.217458E-06  0.258E-03    3.50       7.6  T
   7    -41.5814897 -0.673123E-07  0.112E-03    3.50      17.6  T
     SCC iter.                  ...        0 min,  0.009 sec
     gradient                   ...        0 min,  0.014 sec
 * total energy  :   -41.0403103 Eh     change       -0.4963319E-02 Eh
   gradient norm :     0.0178038 Eh/α   predicted    -0.4230612E-02 ( -14.76%)
   displ. norm   :     0.2282014 α      lambda       -0.1291721E-02
   maximum displ.:     0.1434294 α      in ANC's #6, #9, #5, ...

........................................................................
.............................. CYCLE    3 ..............................
........................................................................
   1    -41.5923340 -0.415923E+02  0.132E-01    3.57       0.0  T
   2    -41.5923539 -0.198790E-04  0.715E-02    3.56       1.0  T
   3    -41.5923378  0.161050E-04  0.442E-02    3.56       1.0  T
   4    -41.5923649 -0.270615E-04  0.120E-02    3.56       1.6  T
   5    -41.5923660 -0.113596E-05  0.490E-03    3.56       4.0  T
   6    -41.5923661 -0.116678E-06  0.126E-03    3.56      15.6  T
   7    -41.5923661 -0.172231E-07  0.571E-04    3.56      34.3  T
     SCC iter.                  ...        0 min,  0.009 sec
     gradient                   ...        0 min,  0.014 sec
 * total energy  :   -41.0411247 Eh     change       -0.8143485E-03 Eh
   gradient norm :     0.0090159 Eh/α   predicted    -0.6795228E-03 ( -16.56%)
   displ. norm   :     0.2234924 α      lambda       -0.5043397E-03
   maximum displ.:     0.1354688 α      in ANC's #6, #9, #8, ...

........................................................................
.............................. CYCLE    4 ..............................
........................................................................
   1    -41.5929049 -0.415929E+02  0.117E-01    3.56       0.0  T
   2    -41.5929147 -0.977900E-05  0.665E-02    3.56       1.0  T
   3    -41.5929098  0.488530E-05  0.208E-02    3.56       1.0  T
   4    -41.5929147 -0.492715E-05  0.952E-03    3.56       2.1  T
   5    -41.5929161 -0.132644E-05  0.256E-03    3.56       7.7  T
   6    -41.5929161 -0.252881E-07  0.772E-04    3.56      25.4  T
     SCC iter.                  ...        0 min,  0.008 sec
     gradient                   ...        0 min,  0.014 sec
 * total energy  :   -41.0414562 Eh     change       -0.3315896E-03 Eh
   gradient norm :     0.0065492 Eh/α   predicted    -0.2647864E-03 ( -20.15%)
   displ. norm   :     0.1938814 α      lambda       -0.2753610E-03
   maximum displ.:     0.0933594 α      in ANC's #6, #9, #7, ...

........................................................................
.............................. CYCLE    5 ..............................
........................................................................
   1    -41.5905569 -0.415906E+02  0.108E-01    3.54       0.0  T
   2    -41.5905637 -0.674635E-05  0.615E-02    3.54       1.0  T
   3    -41.5905619  0.174622E-05  0.149E-02    3.54       1.3  T
   4    -41.5905636 -0.165344E-05  0.849E-03    3.54       2.3  T
   5    -41.5905646 -0.105241E-05  0.262E-03    3.54       7.5  T
   6    -41.5905647 -0.313636E-07  0.841E-04    3.54      23.3  T
     SCC iter.                  ...        0 min,  0.008 sec
     gradient                   ...        0 min,  0.014 sec
 * total energy  :   -41.0416016 Eh     change       -0.1453809E-03 Eh
   gradient norm :     0.0050292 Eh/α   predicted    -0.1428570E-03 (  -1.74%)
   displ. norm   :     0.0923735 α      lambda       -0.1044391E-03
   maximum displ.:     0.0507771 α      in ANC's #8, #3, #1, ...

........................................................................
.............................. CYCLE    6 ..............................
........................................................................
   1    -41.5900620 -0.415901E+02  0.646E-02    3.53       0.0  T
   2    -41.5900629 -0.859972E-06  0.361E-02    3.54       1.0  T
   3    -41.5900596  0.330139E-05  0.147E-02    3.53       1.3  T
   4    -41.5900635 -0.394006E-05  0.376E-03    3.54       5.2  T
   5    -41.5900635 -0.183517E-07  0.110E-03    3.54      17.9  T
   6    -41.5900636 -0.182332E-07  0.371E-04    3.54      52.9  T
     SCC iter.                  ...        0 min,  0.008 sec
     gradient                   ...        0 min,  0.014 sec
 * total energy  :   -41.0416580 Eh     change       -0.5640555E-04 Eh
   gradient norm :     0.0033348 Eh/α   predicted    -0.5268075E-04 (  -6.60%)
   displ. norm   :     0.0923763 α      lambda        0.8124871E-04
   maximum displ.:     0.0507773 α      in ANC's #8, #3, #1, ...

........................................................................
.............................. CYCLE    7 ..............................
........................................................................
   1    -41.5892855 -0.415893E+02  0.647E-02    3.53       0.0  T
   2    -41.5892864 -0.866630E-06  0.361E-02    3.53       1.0  T
   3    -41.5892827  0.374394E-05  0.157E-02    3.53       1.3  T
   4    -41.5892871 -0.446872E-05  0.376E-03    3.53       5.2  T
   5    -41.5892871 -0.116231E-07  0.113E-03    3.53      17.4  T
   6    -41.5892872 -0.200674E-07  0.366E-04    3.53      53.6  T
   7    -41.5892872 -0.142638E-08  0.202E-04    3.53      97.1  T
     SCC iter.                  ...        0 min,  0.009 sec
     gradient                   ...        0 min,  0.015 sec
 * total energy  :   -41.0416170 Eh     change        0.4101897E-04 Eh
   gradient norm :     0.0057389 Eh/α   predicted     0.4097102E-04 (  -0.12%)
   displ. norm   :     0.0548634 α      lambda       -0.1326608E-03
   maximum displ.:     0.0264986 α      in ANC's #8, #9, #6, ...

........................................................................
.............................. CYCLE    8 ..............................
........................................................................
   1    -41.5905187 -0.415905E+02  0.398E-02    3.54       0.0  T
   2    -41.5905191 -0.375265E-06  0.233E-02    3.54       1.0  T
   3    -41.5905185  0.560269E-06  0.633E-03    3.54       3.1  T
   4    -41.5905191 -0.637727E-06  0.188E-03    3.54      10.4  T
   5    -41.5905192 -0.352479E-07  0.648E-04    3.54      30.3  T
     SCC iter.                  ...        0 min,  0.007 sec
     gradient                   ...        0 min,  0.015 sec
 * total energy  :   -41.0416923 Eh     change       -0.7528830E-04 Eh
   gradient norm :     0.0019216 Eh/α   predicted    -0.6653090E-04 ( -11.63%)
   displ. norm   :     0.0641931 α      lambda       -0.2423614E-04
   maximum displ.:     0.0340089 α      in ANC's #3, #4, #1, ...

........................................................................
.............................. CYCLE    9 ..............................
........................................................................
   1    -41.5910590 -0.415911E+02  0.358E-02    3.54       0.0  T
   2    -41.5910594 -0.320737E-06  0.198E-02    3.54       1.0  T
   3    -41.5910593  0.768295E-07  0.419E-03    3.54       4.7  T
   4    -41.5910594 -0.960483E-07  0.261E-03    3.54       7.5  T
   5    -41.5910595 -0.751080E-07  0.585E-04    3.54      33.5  T
   6    -41.5910595 -0.316733E-08  0.225E-04    3.54      87.2  T
     SCC iter.                  ...        0 min,  0.008 sec
     gradient                   ...        0 min,  0.016 sec
 * total energy  :   -41.0417166 Eh     change       -0.2430435E-04 Eh
   gradient norm :     0.0009969 Eh/α   predicted    -0.1214074E-04 ( -50.05%)
   displ. norm   :     0.1250633 α      lambda       -0.2507224E-04
   maximum displ.:     0.0692026 α      in ANC's #3, #1, #4, ...

........................................................................
.............................. CYCLE   10 ..............................
........................................................................
   1    -41.5913113 -0.415913E+02  0.753E-02    3.54       0.0  T
   2    -41.5913123 -0.950964E-06  0.419E-02    3.54       1.0  T
   3    -41.5913117  0.587821E-06  0.893E-03    3.55       2.2  T
   4    -41.5913124 -0.682044E-06  0.500E-03    3.55       3.9  T
   5    -41.5913126 -0.251953E-06  0.701E-04    3.55      28.0  T
   6    -41.5913126 -0.425050E-08  0.427E-04    3.55      46.0  T
     SCC iter.                  ...        0 min,  0.008 sec
     gradient                   ...        0 min,  0.015 sec
 * total energy  :   -41.0417444 Eh     change       -0.2777147E-04 Eh
   gradient norm :     0.0014255 Eh/α   predicted    -0.1262689E-04 ( -54.53%)
   displ. norm   :     0.1320906 α      lambda       -0.2038488E-04
   maximum displ.:     0.0770653 α      in ANC's #1, #3, #4, ...

........................................................................
.............................. CYCLE   11 ..............................
........................................................................
   1    -41.5910470 -0.415910E+02  0.809E-02    3.54       0.0  T
   2    -41.5910484 -0.138145E-05  0.449E-02    3.54       1.0  T
   3    -41.5910480  0.399389E-06  0.899E-03    3.55       2.2  T
   4    -41.5910483 -0.369512E-06  0.590E-03    3.55       3.3  T
   5    -41.5910488 -0.432718E-06  0.919E-04    3.55      21.3  T
   6    -41.5910488 -0.462086E-08  0.477E-04    3.55      41.1  T
     SCC iter.                  ...        0 min,  0.008 sec
     gradient                   ...        0 min,  0.015 sec
 * total energy  :   -41.0417646 Eh     change       -0.2020589E-04 Eh
   gradient norm :     0.0011440 Eh/α   predicted    -0.1027316E-04 ( -49.16%)
   displ. norm   :     0.0876263 α      lambda       -0.1010172E-04
   maximum displ.:     0.0619769 α      in ANC's #1, #3, #4, ...

........................................................................
.............................. CYCLE   12 ..............................
........................................................................
   1    -41.5910917 -0.415911E+02  0.467E-02    3.55       0.0  T
   2    -41.5910921 -0.416699E-06  0.265E-02    3.55       1.0  T
   3    -41.5910920  0.193900E-06  0.513E-03    3.55       3.8  T
   4    -41.5910921 -0.196925E-06  0.316E-03    3.55       6.2  T
   5    -41.5910923 -0.114586E-06  0.674E-04    3.55      29.1  T
   6    -41.5910923 -0.272120E-08  0.311E-04    3.55      63.0  T
     SCC iter.                  ...        0 min,  0.008 sec
     gradient                   ...        0 min,  0.015 sec
 * total energy  :   -41.0417754 Eh     change       -0.1079497E-04 Eh
   gradient norm :     0.0006545 Eh/α   predicted    -0.5071958E-05 ( -53.02%)
   displ. norm   :     0.0532395 α      lambda       -0.6160212E-05
   maximum displ.:     0.0418227 α      in ANC's #1, #3, #2, ...

........................................................................
.............................. CYCLE   13 ..............................
........................................................................
   1    -41.5912154 -0.415912E+02  0.254E-02    3.55       0.0  T
   2    -41.5912155 -0.932011E-07  0.145E-02    3.55       1.4  T
   3    -41.5912155  0.215419E-07  0.238E-03    3.55       8.2  T
   4    -41.5912155 -0.225228E-07  0.157E-03    3.55      12.5  T
   5    -41.5912155 -0.297818E-07  0.293E-04    3.55      66.9  T
   6    -41.5912155 -0.619131E-09  0.158E-04    3.55     124.3  T
     SCC iter.                  ...        0 min,  0.008 sec
     gradient                   ...        0 min,  0.015 sec
 * total energy  :   -41.0417831 Eh     change       -0.7723866E-05 Eh
   gradient norm :     0.0006269 Eh/α   predicted    -0.3086105E-05 ( -60.04%)
   displ. norm   :     0.0641802 α      lambda       -0.7197194E-05
   maximum displ.:     0.0486070 α      in ANC's #1, #3, #2, ...

........................................................................
.............................. CYCLE   14 ..............................
........................................................................
   1    -41.5911795 -0.415912E+02  0.337E-02    3.55       0.0  T
   2    -41.5911797 -0.236365E-06  0.186E-02    3.55       1.1  T
   3    -41.5911797  0.565838E-07  0.378E-03    3.55       5.2  T
   4    -41.5911798 -0.810131E-07  0.236E-03    3.55       8.3  T
   5    -41.5911798 -0.585359E-07  0.401E-04    3.55      48.9  T
   6    -41.5911798 -0.173387E-08  0.228E-04    3.55      86.1  T
     SCC iter.                  ...        0 min,  0.008 sec
     gradient                   ...        0 min,  0.015 sec
 * total energy  :   -41.0417915 Eh     change       -0.8408500E-05 Eh
   gradient norm :     0.0005829 Eh/α   predicted    -0.3607211E-05 ( -57.10%)
   displ. norm   :     0.0623557 α      lambda       -0.5080640E-05
   maximum displ.:     0.0485568 α      in ANC's #1, #2, #3, ...

........................................................................
.............................. CYCLE   15 ..............................
........................................................................
   1    -41.5910782 -0.415911E+02  0.345E-02    3.55       0.0  T
   2    -41.5910785 -0.309297E-06  0.186E-02    3.55       1.1  T
   3    -41.5910785  0.873123E-08  0.367E-03    3.55       5.3  T
   4    -41.5910785 -0.237380E-07  0.242E-03    3.55       8.1  T
   5    -41.5910786 -0.682213E-07  0.510E-04    3.55      38.4  T
   6    -41.5910786 -0.295846E-08  0.235E-04    3.55      83.4  T
     SCC iter.                  ...        0 min,  0.008 sec
     gradient                   ...        0 min,  0.016 sec
 * total energy  :   -41.0417972 Eh     change       -0.5657388E-05 Eh
   gradient norm :     0.0004385 Eh/α   predicted    -0.2546406E-05 ( -54.99%)
   displ. norm   :     0.0405803 α      lambda       -0.2387938E-05
   maximum displ.:     0.0331569 α      in ANC's #1, #2, #3, ...

........................................................................
.............................. CYCLE   16 ..............................
........................................................................
   1    -41.5912477 -0.415912E+02  0.233E-02    3.55       0.0  T
   2    -41.5912478 -0.151229E-06  0.126E-02    3.55       1.6  T
   3    -41.5912478  0.459867E-08  0.260E-03    3.55       7.5  T
   4    -41.5912478 -0.138988E-07  0.175E-03    3.55      11.2  T
   5    -41.5912479 -0.338666E-07  0.371E-04    3.55      52.8  T
   6    -41.5912479 -0.142609E-08  0.165E-04    3.55     119.2  T
     SCC iter.                  ...        0 min,  0.008 sec
     gradient                   ...        0 min,  0.016 sec
 * total energy  :   -41.0418000 Eh     change       -0.2828175E-05 Eh
   gradient norm :     0.0003285 Eh/α   predicted    -0.1199518E-05 ( -57.59%)
   displ. norm   :     0.0281921 α      lambda       -0.1629864E-05
   maximum displ.:     0.0240862 α      in ANC's #1, #2, #8, ...

   *** GEOMETRY OPTIMIZATION CONVERGED AFTER 16 ITERATIONS ***

------------------------------------------------------------------------
 total energy gain   :        -0.0064530 Eh       -4.0493 kcal/mol
 total RMSD          :         0.2368972 a0        0.1254 Å
 total power (kW/mol):        -1.0588983 (step)  -31.0696 (real)
------------------------------------------------------------------------

 ANCopt (total)                0 d,  0 h,  0 min,  0.545 sec
 optimizer setup                ...        0 min,  0.000 sec (  0.030%)
 model hessian                  ...        0 min,  0.009 sec (  1.694%)
 ANC generation                 ...        0 min,  0.001 sec (  0.141%)
 coordinate transformation      ...        0 min,  0.000 sec (  0.054%)
 single point calculation       ...        0 min,  0.530 sec ( 97.121%)
 optimization log               ...        0 min,  0.002 sec (  0.320%)
 hessian update                 ...        0 min,  0.000 sec (  0.042%)
 rational function              ...        0 min,  0.002 sec (  0.410%)

================
 final structure:
================
$coord
    3.08938978315317    2.35202787720768    0.07137986925801      C 
    5.28516561890231   -0.02484587083268   -0.23963837058565      S 
    2.94624415809783   -2.27038155988873   -0.11334129662681      C 
    0.61252423278310   -1.23137002202706    0.15960274726209      C 
    0.69214938950062    1.45535304305669    0.26206141422147      C 
   -1.63477673045503    3.02291448910577    0.61010929548503      C 
   -3.97509553389946    1.51758809659528   -0.15312176496045      C 
   -3.99051846773614   -1.03204533481030    1.19242796138831      C 
   -1.80661305256895   -2.70374376571452    0.24560961365780      C 
   -2.46975536947379   -3.64545024030194   -2.38292423595505      C 
   -2.11524422403102   -2.53490990472085   -4.32904449458011      O 
   -3.60115077627597   -5.92299669771721   -2.22860076861676      O 
   -4.42776385427436   -7.05345364247287   -4.41933068222448      C 
   -5.63255708209212   -9.23522778359301   -4.36565680979819      C 
    3.70932400676339    4.28008278693070    0.09328376038007      H 
    3.43602576223481   -4.23141241738106   -0.25183651082968      H 
   -1.49262520610323    4.75569124476166   -0.49950747284006      H 
   -1.78478062993845    3.56941575286134    2.60130914131042      H 
   -3.96057686885727    1.21699534135301   -2.19322820147635      H 
   -5.67631688084470    2.57827613351900    0.33161401309469      H 
   -5.78167619577010   -2.00816335439759    0.87979932884982      H 
   -3.76609691739743   -0.74232009831649    3.22397254640695      H 
   -1.61648184274236   -4.36223740590223    1.46655285832264      H 
   -4.00459488176070   -6.00890083814426   -6.12678331636031      H 
   -6.00893714966073  -10.19396473355137   -2.61379189126043      H 
   -6.26791532752422  -10.10834265027914   -6.08183006906579      H 
$end
           -------------------------------------------------
          |                Final Singlepoint                |
           -------------------------------------------------

          ...................................................
          :                      SETUP                      :
          :.................................................:
          :  # basis functions                  74          :
          :  # atomic orbitals                  73          :
          :  # shells                           41          :
          :  # electrons                        74          :
          :  max. iterations                   250          :
          :  Hamiltonian                  GFN2-xTB          :
          :  restarted?                      false          :
          :  GBSA solvation                  false          :
          :  PC potential                    false          :
          :  electronic temp.          300.0000000     K    :
          :  accuracy                    1.0000000          :
          :  -> integral cutoff          0.2500000E+02      :
          :  -> integral neglect         0.1000000E-07      :
          :  -> SCF convergence          0.1000000E-05 Eh   :
          :  -> wf. convergence          0.1000000E-03 e    :
          :  Broyden damping             0.4000000          :
          ...................................................

 iter      E             dE          RMSdq      gap      omega  full diag
   1    -41.5912479 -0.415912E+02  0.574E-05    3.55       0.0  T
   2    -41.5912479 -0.141540E-10  0.376E-05    3.55     521.1  T
   3    -41.5912479 -0.223750E-10  0.230E-05    3.55     853.7  T

   *** convergence criteria satisfied after 3 iterations ***

         #    Occupation            Energy/Eh            Energy/eV
      -------------------------------------------------------------
         1        2.0000           -0.7546519             -20.5351
       ...           ...                  ...                  ...
        31        2.0000           -0.4477528             -12.1840
        32        2.0000           -0.4365548             -11.8793
        33        2.0000           -0.4330843             -11.7848
        34        2.0000           -0.4206217             -11.4457
        35        2.0000           -0.4160288             -11.3207
        36        2.0000           -0.3862290             -10.5098
        37        2.0000           -0.3845061             -10.4629 (HOMO)
        38                         -0.2541301              -6.9152 (LUMO)
        39                         -0.2395886              -6.5195
        40                         -0.2011294              -5.4730
        41                         -0.1975331              -5.3751
        42                         -0.1668693              -4.5407
       ...                                ...                  ...
        73                          0.6932013              18.8630
      -------------------------------------------------------------
                  HL-Gap            0.1303760 Eh            3.5477 eV
             Fermi-level           -0.3193181 Eh           -8.6891 eV

 SCC (total)                   0 d,  0 h,  0 min,  0.031 sec
 SCC setup                      ...        0 min,  0.000 sec (  0.672%)
 Dispersion                     ...        0 min,  0.000 sec (  0.711%)
 integral evaluation            ...        0 min,  0.010 sec ( 32.103%)
 zeroth order Hamiltonian       ...        0 min,  0.000 sec (  0.568%)
 iterations                     ...        0 min,  0.004 sec ( 14.212%)
 molecular gradient             ...        0 min,  0.016 sec ( 50.403%)
 printout                       ...        0 min,  0.000 sec (  1.136%)

         :::::::::::::::::::::::::::::::::::::::::::::::::::::
         ::                     SUMMARY                     ::
         :::::::::::::::::::::::::::::::::::::::::::::::::::::
         :: total energy             -41.041799991299 Eh    ::
         :: gradient norm              0.000328783289 Eh/a0 ::
         :: HOMO-LUMO gap              3.547712312047 eV    ::
         ::.................................................::
         :: SCC energy               -41.591247871333 Eh    ::
         :: -> isotropic ES            0.042645780551 Eh    ::
         :: -> anisotropic ES          0.001117822350 Eh    ::
         :: -> anisotropic XC          0.013976898139 Eh    ::
         :: -> dispersion             -0.026000474615 Eh    ::
         :: repulsion energy           0.549311073401 Eh    ::
         :: add. restraining           0.000000000000 Eh    ::
         :::::::::::::::::::::::::::::::::::::::::::::::::::::

           -------------------------------------------------
          |                Property Printout                |
           -------------------------------------------------

    * Orbital Energies and Occupations

         #    Occupation            Energy/Eh            Energy/eV
      -------------------------------------------------------------
         1        2.0000           -0.7546519             -20.5351
       ...           ...                  ...                  ...
        25        2.0000           -0.4824516             -13.1282
        26        2.0000           -0.4752143             -12.9312
        27        2.0000           -0.4702226             -12.7954
        28        2.0000           -0.4677419             -12.7279
        29        2.0000           -0.4619249             -12.5696
        30        2.0000           -0.4502250             -12.2512
        31        2.0000           -0.4477528             -12.1840
        32        2.0000           -0.4365548             -11.8793
        33        2.0000           -0.4330843             -11.7848
        34        2.0000           -0.4206217             -11.4457
        35        2.0000           -0.4160288             -11.3207
        36        2.0000           -0.3862290             -10.5098
        37        2.0000           -0.3845061             -10.4629 (HOMO)
        38                         -0.2541301              -6.9152 (LUMO)
        39                         -0.2395886              -6.5195
        40                         -0.2011294              -5.4730
        41                         -0.1975331              -5.3751
        42                         -0.1668693              -4.5407
        43                         -0.1098353              -2.9888
        44                          0.0024827               0.0676
        45                          0.0231874               0.6310
        46                          0.0355676               0.9678
        47                          0.0410739               1.1177
        48                          0.0830345               2.2595
       ...                                ...                  ...
        73                          0.6932013              18.8630
      -------------------------------------------------------------
                  HL-Gap            0.1303760 Eh            3.5477 eV
             Fermi-level           -0.3193181 Eh           -8.6891 eV

     #   Z        covCN         q      C6AA      α(0)
     1   6 C      2.943    -0.034    28.845     8.809
     2  16 S      2.298    -0.027   142.179    20.069
     3   6 C      2.940    -0.031    28.785     8.799
     4   6 C      3.178    -0.005    27.728     8.598
     5   6 C      3.163    -0.000    27.701     8.602
     6   6 C      3.808    -0.055    21.565     6.610
     7   6 C      3.807    -0.056    21.584     6.614
     8   6 C      3.811    -0.049    21.448     6.592
     9   6 C      3.858    -0.040    21.256     6.557
    10   6 C      2.731     0.358    20.927     7.489
    11   8 O      0.856    -0.393    21.551     6.224
    12   8 O      1.709    -0.241    17.987     5.726
    13   6 C      2.793     0.103    25.698     8.304
    14   6 C      2.835    -0.111    30.788     9.093
    15   1 H      0.926     0.043     2.413     2.429
    16   1 H      0.926     0.039     2.467     2.456
    17   1 H      0.924     0.043     2.412     2.429
    18   1 H      0.924     0.042     2.421     2.433
    19   1 H      0.924     0.053     2.284     2.363
    20   1 H      0.924     0.035     2.521     2.483
    21   1 H      0.924     0.035     2.516     2.480
    22   1 H      0.924     0.047     2.361     2.403
    23   1 H      0.924     0.055     2.256     2.349
    24   1 H      0.925     0.063     2.168     2.302
    25   1 H      0.926     0.067     2.115     2.274
    26   1 H      0.926     0.062     2.171     2.304

 Mol. C6AA /au·bohr⁶  :       8820.697985
 Mol. C8AA /au·bohr⁸  :     232044.255638
 Mol. α(0) /au        :        146.793224


Wiberg/Mayer (AO) data.
largest (>0.10) Wiberg bond orders for each atom
          total WBO             WBO to atom ...
     1  C   3.943        C    5 1.608    S    2 1.183    H   15 0.971    C    3 0.118
     2  S   2.629        C    3 1.194    C    1 1.183
     3  C   3.948        C    4 1.603    S    2 1.194    H   16 0.971    C    1 0.118
     4  C   3.982        C    3 1.603    C    5 1.222    C    9 0.990
     5  C   3.986        C    1 1.608    C    4 1.222    C    6 1.009
     6  C   3.998        C    5 1.009    C    7 1.005    H   17 0.970    H   18 0.960
     7  C   3.996        C    8 1.011    C    6 1.005    H   20 0.976    H   19 0.974
     8  C   3.992        C    7 1.011    H   21 0.977    H   22 0.973    C    9 0.966
     9  C   3.993        C    4 0.990    C    8 0.966    H   23 0.956    C   10 0.947
    10  C   3.911        O   11 1.771    O   12 1.092    C    9 0.947
    11  O   2.064        C   10 1.771    O   12 0.155
    12  O   2.371        C   10 1.092    C   13 1.010    O   11 0.155
    13  C   3.915        C   14 1.914    O   12 1.010    H   24 0.955
    14  C   3.983        C   13 1.914    H   26 0.975    H   25 0.972
    15  H   0.998        C    1 0.971
    16  H   0.998        C    3 0.971
    17  H   0.998        C    6 0.970
    18  H   0.998        C    6 0.960
    19  H   0.997        C    7 0.974
    20  H   0.998        C    7 0.976
    21  H   0.998        C    8 0.977
    22  H   0.998        C    8 0.973
    23  H   0.997        C    9 0.956
    24  H   0.996        C   13 0.955
    25  H   0.995        C   14 0.972
    26  H   0.995        C   14 0.975

molecular dipole:
                 x           y           z       tot (Debye)
 q only:       -0.549      -0.198       0.627
   full:       -0.841      -0.294       0.687       2.859
molecular quadrupole (traceless):
                xx          xy          yy          xz          yz          zz
 q only:       -0.349       4.403       6.703       0.740       3.012      -6.353
  q+dip:       -3.566       4.474       9.473       0.131       2.509      -5.906
   full:       -2.910       3.618       9.039       0.326       2.956      -6.129

           -------------------------------------------------
          |                Geometry Summary                 |
           -------------------------------------------------

      molecular mass/u    :      208.2746000
   center of mass at/Å    :       -0.3934057      -0.9747229      -0.5809721
  moments of inertia/u·Å² :        0.4434913E+03   0.1301967E+04   0.1583337E+04
rotational constants/cm⁻¹ :        0.3801119E-01   0.1294782E-01   0.1064690E-01

 * 26 selected distances

     #   Z        #   Z                                     value/Å
     1   6 C      2  16 S                                 1.7202488 (max)
     2  16 S      3   6 C                                 1.7170913
     3   6 C      4   6 C                                 1.3595111
     1   6 C      5   6 C                                 1.3581566
     4   6 C      5   6 C                                 1.4234100
     5   6 C      6   6 C                                 1.4960817
     6   6 C      7   6 C                                 1.5268961
     7   6 C      8   6 C                                 1.5255890
     4   6 C      9   6 C                                 1.4993103
     8   6 C      9   6 C                                 1.5392131
    10   6 C     11   8 O                                 1.2004701
    10   6 C     12   8 O                                 1.3482175
    12   8 O     13   6 C                                 1.3759138
    13   6 C     14   6 C                                 1.3191855
     1   6 C     15   1 H                                 1.0717889 (min)
     3   6 C     16   1 H                                 1.0721174
     6   6 C     17   1 H                                 1.0914365
     6   6 C     18   1 H                                 1.0955428
     7   6 C     19   1 H                                 1.0912607
     7   6 C     20   1 H                                 1.0914635
     8   6 C     21   1 H                                 1.0920543
     8   6 C     22   1 H                                 1.0923992
     9   6 C     23   1 H                                 1.0944447
    13   6 C     24   1 H                                 1.0826244
    14   6 C     25   1 H                                 1.0753982
    14   6 C     26   1 H                                 1.0729727

 * 4 distinct bonds (by element types)

   Z      Z             #   av. dist./Å        max./Å        min./Å
   1 H    6 C          12     1.0852919     1.0955428     1.0717889
   6 C    6 C           9     1.4497059     1.5392131     1.3191855
   6 C    8 O           3     1.3082004     1.3759138     1.2004701
   6 C   16 S           2     1.7186701     1.7202488     1.7170913


optimized geometry written to: xtbopt.xyz


           -------------------------------------------------
          | TOTAL ENERGY              -41.041799991299 Eh   |
          | GRADIENT NORM               0.000328783289 Eh/α |
          | HOMO-LUMO GAP               3.547712312047 eV   |
           -------------------------------------------------

------------------------------------------------------------------------
 * finished run on 2021/05/19 at 11:00:10.635     
------------------------------------------------------------------------
 total:
 * wall-time:     0 d,  0 h,  0 min,  0.642 sec
 *  cpu-time:     0 d,  0 h,  0 min,  0.640 sec
 * ratio c/w:     0.997 speedup
 SCF:
 * wall-time:     0 d,  0 h,  0 min,  0.043 sec
 *  cpu-time:     0 d,  0 h,  0 min,  0.043 sec
 * ratio c/w:     0.998 speedup
 ANC optimizer:
 * wall-time:     0 d,  0 h,  0 min,  0.577 sec
 *  cpu-time:     0 d,  0 h,  0 min,  0.575 sec
 * ratio c/w:     0.998 speedup

