      -----------------------------------------------------------      
     |                   =====================                   |     
     |                           x T B                           |     
     |                   =====================                   |     
     |                         S. Grimme                         |     
     |          Mulliken Center for Theoretical Chemistry        |     
     |                    University of Bonn                     |     
     |                Version 6.2 RC2 (SAW190805)                |     
      -----------------------------------------------------------      

   This program is distributed in the hope that it will be useful,
   but WITHOUT ANY WARRANTY; without even the implied warranty of
   MERCHANTABILITY or FITNESS FOR A PARTICULAR PURPOSE.
   
   FOR NON-COMMERCIAL, ACADEMIA USE ONLY.
   
   Cite this work as:
   * S. Grimme, C. Bannwarth, P. Shushkov, J. Chem. Theory Comput., 2017,
     13, 1989-2009. DOI: 10.1021/acs.jctc.7b00118
   * C. Bannwarth, S. Ehlert and S. Grimme., J. Chem. Theory Comput., 2019,
     15, 1652-1671. DOI: 10.1021/acs.jctc.8b01176
   * P. Pracht, E. Caldeweyher, S. Ehlert, S. Grimme, ChemRxiv, 2019, preprint.
     DOI: 10.26434/chemrxiv.8326202.v1
   
   for DFT-D4:
   * E. Caldeweyher, C. Bannwarth and S. Grimme, J. Chem. Phys., 2017,
     147, 034112. DOI: 10.1063/1.4993215
   * E. Caldeweyher, S. Ehlert, A. Hansen, H. Neugebauer, S. Spicher,
     C. Bannwarth and S. Grimme, J. Chem. Phys., 2019, 150, 154122.
     DOI: 10.1063/1.5090222
   
   for sTDA-xTB:
   * S. Grimme and C. Bannwarth, J. Chem. Phys., 2016, 145, 054103.
     DOI: 10.1063/1.4959605
   
   in the mass-spec context:
   * V. Asgeirsson, C. Bauer and S. Grimme, Chem. Sci., 2017, 8, 4879.
     DOI: 10.1039/c7sc00601b
   
   for metadynamics refer to:
   * S. Grimme, J. Chem. Theory Comput., 2019, 155, 2847-2862
     DOI: 10.1021/acs.jctc.9b00143
   
   with help from (in alphabetical order)
   C. Bannwarth, F. Bohle, G. Brandenburg, E. Caldeweyher, M. Checinski,
   S. Dohm, S. Ehlert, S. Ehrlich, F. März, H. Neugebauer, J. Pisarek,
   P. Pracht, P. Shushkov, and S. Spicher.
   
 * started run on 2021/05/19 at 11:00:11.287     

           -------------------------------------------------
          |                Calculation Setup                |
           -------------------------------------------------

          program call               : /ihome/ghutchison/geoffh/xtb/xtb 600.xyz -opt
          hostname                   : smp-n144
          coordinate file            : 600.xyz
          omp threads                :                     1
          number of atoms            :                    22
          number of electrons        :                    78
          charge                     :                     0
          spin                       :                   0.0
          first test random number   :      0.50035263203549


########################################################################
# WARNING! Please study the warnings concerning your input carefully
#  - the use of '-opt' is discouraged, please use '--opt' next time
########################################################################

           ------------------------------------------------- 
          |                 G F N 2 - x T B                 |
          | Geometry, Frequencies, Noncovalent interactions |
          |            JCTC 2019 parametrisation            |
           ------------------------------------------------- 
             KAB for C  - Si     :                1.0500
             KAB for H  - Pd     :                0.9500
             k(s)              :                1.8500
             k(p)              :                2.2300
             k(d)              :                2.2300
             k(f)              :                2.0000
             kEN (H0ij)        :               -2.0000
             D4 a1             :                0.5200
             D4 a2             :                5.0000
             D4 s6             :                1.0000
             D4 s8             :                2.7000
             D4 s9             :                5.0000
             alphaj            :                2.0000

  Z AO/shell   Hii/eV     exponent
  1     Wed Apr 25 08:07:45 CEST 2018   EN: 2.200 GM2: 0.406  GM3: 0.0800  RAES: 1.40
     1s    -10.707211    1.230000
  6     Wed Apr 25 08:07:45 CEST 2018   EN: 2.550 GM2: 0.538  GM3: 0.1500  RAES: 3.00
     2s    -13.970922    2.096432
     2p    -10.063292    1.800000
  9     Mon Apr 23 13:58:50 CEST 2018   EN: 3.980 GM2: 0.532  GM3: 0.1426  RAES: 2.40
     2s    -23.458179    2.416361
     2p    -15.746583    2.308399
 16     Tue Apr 24 11:44:34 CEST 2018   EN: 2.580 GM2: 0.340  GM3:-0.0502  RAES: 3.10
     3s    -20.029654    1.981333
     3p    -11.377694    2.025643
     3d     -0.420282    1.702555

           ------------------------------------------------- 
          |        Self-Consistent Charge Iterations        |
           ------------------------------------------------- 

          ...................................................
          :                      SETUP                      :
          :.................................................:
          :  # basis functions                  73          :
          :  # atomic orbitals                  72          :
          :  # shells                           38          :
          :  # electrons                        78          :
          :  max. iterations                   250          :
          :  Hamiltonian                  GFN2-xTB          :
          :  restarted?                      false          :
          :  GBSA solvation                  false          :
          :  PC potential                    false          :
          :  electronic temp.          300.0000000     K    :
          :  accuracy                    1.0000000          :
          :  -> integral cutoff          0.2500000E+02      :
          :  -> integral neglect         0.1000000E-07      :
          :  -> SCF convergence          0.1000000E-05 Eh   :
          :  -> wf. convergence          0.1000000E-03 e    :
          :  Broyden damping             0.4000000          :
          ...................................................

 iter      E             dE          RMSdq      gap      omega  full diag
   1    -44.9583260 -0.449583E+02  0.482E+00    1.97       0.0  T
   2    -45.0213992 -0.630731E-01  0.279E+00    1.98       1.0  T
   3    -45.0198790  0.152019E-02  0.116E+00    1.97       1.0  T
   4    -45.0224470 -0.256802E-02  0.496E-01    1.94       1.0  T
   5    -45.0265903 -0.414331E-02  0.199E-01    1.96       1.0  T
   6    -45.0270309 -0.440627E-03  0.101E-01    1.95       1.0  T
   7    -45.0271818 -0.150842E-03  0.322E-02    1.95       1.0  T
   8    -45.0271935 -0.117512E-04  0.143E-02    1.95       1.5  T
   9    -45.0271950 -0.145160E-05  0.640E-03    1.95       3.3  T
  10    -45.0271951 -0.122831E-06  0.265E-03    1.95       8.0  T
  11    -45.0271951 -0.150364E-07  0.152E-03    1.95      14.0  T
  12    -45.0271952 -0.340268E-07  0.430E-04    1.95      49.6  T
  13    -45.0271952 -0.651866E-09  0.230E-04    1.95      92.6  T

   *** convergence criteria satisfied after 13 iterations ***

         #    Occupation            Energy/Eh            Energy/eV
      -------------------------------------------------------------
         1        2.0000           -0.8660730             -23.5670
       ...           ...                  ...                  ...
        33        2.0000           -0.4656455             -12.6709
        34        2.0000           -0.4593880             -12.5006
        35        2.0000           -0.4522926             -12.3075
        36        2.0000           -0.4506722             -12.2634
        37        2.0000           -0.4327435             -11.7756
        38        2.0000           -0.4198204             -11.4239
        39        2.0000           -0.3790547             -10.3146 (HOMO)
        40                         -0.3073297              -8.3629 (LUMO)
        41                         -0.2554977              -6.9524
        42                         -0.2308595              -6.2820
        43                         -0.2175544              -5.9200
        44                         -0.2008976              -5.4667
       ...                                ...                  ...
        72                          0.7176389              19.5279
      -------------------------------------------------------------
                  HL-Gap            0.0717250 Eh            1.9517 eV
             Fermi-level           -0.3431922 Eh           -9.3387 eV

 SCC (total)                   0 d,  0 h,  0 min,  0.041 sec
 SCC setup                      ...        0 min,  0.000 sec (  0.722%)
 Dispersion                     ...        0 min,  0.000 sec (  0.811%)
 integral evaluation            ...        0 min,  0.010 sec ( 24.608%)
 zeroth order Hamiltonian       ...        0 min,  0.000 sec (  0.441%)
 iterations                     ...        0 min,  0.015 sec ( 37.865%)
 molecular gradient             ...        0 min,  0.014 sec ( 34.478%)
 printout                       ...        0 min,  0.000 sec (  0.934%)

         :::::::::::::::::::::::::::::::::::::::::::::::::::::
         ::                     SUMMARY                     ::
         :::::::::::::::::::::::::::::::::::::::::::::::::::::
         :: total energy             -44.522848482382 Eh    ::
         :: gradient norm              0.104715522991 Eh/a0 ::
         :: HOMO-LUMO gap              1.951736757918 eV    ::
         ::.................................................::
         :: SCC energy               -45.027195161230 Eh    ::
         :: -> isotropic ES            0.044433089621 Eh    ::
         :: -> anisotropic ES         -0.000746769687 Eh    ::
         :: -> anisotropic XC         -0.000078852437 Eh    ::
         :: -> dispersion             -0.023852429543 Eh    ::
         :: repulsion energy           0.504313198764 Eh    ::
         :: add. restraining           0.000000000000 Eh    ::
         :::::::::::::::::::::::::::::::::::::::::::::::::::::

      ----------------------------------------------------------- 
     |                   =====================                   |
     |                        A N C O P T                        |
     |                   =====================                   |
     |               Approximate Normal Coordinate               |
     |                Rational Function Optimizer                |
      ----------------------------------------------------------- 

          ...................................................
          :                      SETUP                      :
          :.................................................:
          :   optimization level            normal          :
          :   max. optcycles                   200          :
          :   ANC micro-cycles                  20          :
          :   degrees of freedom                60          :
          :.................................................:
          :   RF solver                   davidson          :
          :   input Hessian                  false          :
          :   write xtbopt.log                true          :
          :   linear?                        false          :
          :   energy convergence         0.5000000E-05 Eh   :
          :   grad. convergence          0.1000000E-02 Eh/α :
          :   maximium RF displ.         2.0000000          :
          :   Hlow (freq-cutoff)         0.5000000E-02      :
          :   Hmax (freq-cutoff)         5.0000000          :
          :   S6 in model hess.         20.0000000          :
          ...................................................

generating ANC from model Hessian ...
Using Lindh-Hessian (1995)
 Shifting diagonal of input Hessian by   3.668751019537321E-003
 Lowest  eigenvalues of input Hessian
   -0.000000   -0.000000   -0.000000   -0.000000    0.000000    0.000000
    0.005000    0.006559    0.008551    0.009872    0.010735    0.013667
    0.016387    0.017169    0.022218    0.026129    0.031520    0.039992
 Highest eigenvalues
    1.660217    1.720365    1.848475    1.903770    1.991514    2.043354
 

........................................................................
.............................. CYCLE    1 ..............................
........................................................................
   1    -45.0271952 -0.450272E+02  0.821E-05    1.95       0.0  T
   2    -45.0271952 -0.112053E-10  0.592E-05    1.95     360.0  T
   3    -45.0271952 -0.258282E-10  0.409E-05    1.95     521.5  T
     SCC iter.                  ...        0 min,  0.004 sec
     gradient                   ...        0 min,  0.014 sec
 * total energy  :   -44.5228485 Eh     change       -0.6594270E-08 Eh
   gradient norm :     0.1047153 Eh/α   predicted     0.0000000E+00 (-100.00%)
   displ. norm   :     0.2901003 α      lambda       -0.1764970E-01
   maximum displ.:     0.1779541 α      in ANC's #26, #18, #17, ...

........................................................................
.............................. CYCLE    2 ..............................
........................................................................
   1    -45.0629724 -0.450630E+02  0.254E-01    2.04       0.0  T
   2    -45.0630952 -0.122766E-03  0.161E-01    2.03       1.0  T
   3    -45.0630770  0.182203E-04  0.930E-02    2.03       1.0  T
   4    -45.0631721 -0.951321E-04  0.371E-02    2.03       1.0  T
   5    -45.0631929 -0.207943E-04  0.157E-02    2.03       1.4  T
   6    -45.0631968 -0.393541E-05  0.546E-03    2.03       3.9  T
   7    -45.0631971 -0.275968E-06  0.215E-03    2.03       9.9  T
     SCC iter.                  ...        0 min,  0.008 sec
     gradient                   ...        0 min,  0.013 sec
 * total energy  :   -44.5349360 Eh     change       -0.1208751E-01 Eh
   gradient norm :     0.0476249 Eh/α   predicted    -0.9567614E-02 ( -20.85%)
   displ. norm   :     0.2031202 α      lambda       -0.4347149E-02
   maximum displ.:     0.0934754 α      in ANC's #26, #2, #3, ...

........................................................................
.............................. CYCLE    3 ..............................
........................................................................
   1    -45.0783051 -0.450783E+02  0.186E-01    2.11       0.0  T
   2    -45.0783600 -0.549130E-04  0.114E-01    2.11       1.0  T
   3    -45.0783328  0.271801E-04  0.683E-02    2.11       1.0  T
   4    -45.0783845 -0.516787E-04  0.282E-02    2.11       1.0  T
   5    -45.0783993 -0.148093E-04  0.899E-03    2.11       2.4  T
   6    -45.0784004 -0.112635E-05  0.316E-03    2.11       6.8  T
   7    -45.0784005 -0.704856E-07  0.137E-03    2.11      15.5  T
     SCC iter.                  ...        0 min,  0.008 sec
     gradient                   ...        0 min,  0.014 sec
 * total energy  :   -44.5372563 Eh     change       -0.2320320E-02 Eh
   gradient norm :     0.0106660 Eh/α   predicted    -0.2263255E-02 (  -2.46%)
   displ. norm   :     0.1320378 α      lambda       -0.3494375E-03
   maximum displ.:     0.0925620 α      in ANC's #2, #3, #4, ...

........................................................................
.............................. CYCLE    4 ..............................
........................................................................
   1    -45.0769852 -0.450770E+02  0.931E-02    2.11       0.0  T
   2    -45.0769873 -0.207733E-05  0.541E-02    2.11       1.0  T
   3    -45.0769775  0.984669E-05  0.240E-02    2.11       1.0  T
   4    -45.0769879 -0.104494E-04  0.744E-03    2.11       2.9  T
   5    -45.0769887 -0.806020E-06  0.329E-03    2.11       6.5  T
   6    -45.0769889 -0.139099E-06  0.842E-04    2.11      25.3  T
   7    -45.0769889 -0.541904E-08  0.358E-04    2.11      59.6  T
     SCC iter.                  ...        0 min,  0.008 sec
     gradient                   ...        0 min,  0.013 sec
 * total energy  :   -44.5375140 Eh     change       -0.2577168E-03 Eh
   gradient norm :     0.0041965 Eh/α   predicted    -0.1777816E-03 ( -31.02%)
   displ. norm   :     0.1801107 α      lambda       -0.2367371E-03
   maximum displ.:     0.1300393 α      in ANC's #2, #3, #4, ...

........................................................................
.............................. CYCLE    5 ..............................
........................................................................
   1    -45.0755636 -0.450756E+02  0.125E-01    2.11       0.0  T
   2    -45.0755658 -0.214530E-05  0.708E-02    2.11       1.0  T
   3    -45.0755501  0.156940E-04  0.301E-02    2.11       1.0  T
   4    -45.0755669 -0.168288E-04  0.898E-03    2.11       2.4  T
   5    -45.0755673 -0.448265E-06  0.519E-03    2.11       4.1  T
   6    -45.0755678 -0.434762E-06  0.963E-04    2.11      22.1  T
   7    -45.0755678 -0.134186E-07  0.476E-04    2.11      44.8  T
     SCC iter.                  ...        0 min,  0.008 sec
     gradient                   ...        0 min,  0.013 sec
 * total energy  :   -44.5376606 Eh     change       -0.1465728E-03 Eh
   gradient norm :     0.0040811 Eh/α   predicted    -0.1222088E-03 ( -16.62%)
   displ. norm   :     0.1090230 α      lambda       -0.9172907E-04
   maximum displ.:     0.0806832 α      in ANC's #2, #4, #3, ...

........................................................................
.............................. CYCLE    6 ..............................
........................................................................
   1    -45.0759001 -0.450759E+02  0.830E-02    2.10       0.0  T
   2    -45.0759007 -0.575766E-06  0.479E-02    2.10       1.0  T
   3    -45.0758988  0.186640E-05  0.111E-02    2.10       1.9  T
   4    -45.0759008 -0.201563E-05  0.424E-03    2.10       5.0  T
   5    -45.0759009 -0.741502E-07  0.241E-03    2.10       8.8  T
   6    -45.0759010 -0.959789E-07  0.543E-04    2.10      39.3  T
     SCC iter.                  ...        0 min,  0.007 sec
     gradient                   ...        0 min,  0.013 sec
 * total energy  :   -44.5377180 Eh     change       -0.5734994E-04 Eh
   gradient norm :     0.0045077 Eh/α   predicted    -0.4641918E-04 ( -19.06%)
   displ. norm   :     0.0873393 α      lambda       -0.6294085E-04
   maximum displ.:     0.0681779 α      in ANC's #2, #4, #10, ...

........................................................................
.............................. CYCLE    7 ..............................
........................................................................
   1    -45.0766210 -0.450766E+02  0.632E-02    2.10       0.0  T
   2    -45.0766215 -0.447701E-06  0.360E-02    2.10       1.0  T
   3    -45.0766196  0.191130E-05  0.110E-02    2.10       1.9  T
   4    -45.0766216 -0.204807E-05  0.372E-03    2.10       5.7  T
   5    -45.0766217 -0.741446E-07  0.220E-03    2.10       9.7  T
   6    -45.0766218 -0.713929E-07  0.493E-04    2.10      43.2  T
     SCC iter.                  ...        0 min,  0.007 sec
     gradient                   ...        0 min,  0.014 sec
 * total energy  :   -44.5377669 Eh     change       -0.4895522E-04 Eh
   gradient norm :     0.0028288 Eh/α   predicted    -0.3171080E-04 ( -35.22%)
   displ. norm   :     0.1090915 α      lambda       -0.6032185E-04
   maximum displ.:     0.0817610 α      in ANC's #2, #4, #3, ...

........................................................................
.............................. CYCLE    8 ..............................
........................................................................
   1    -45.0772129 -0.450772E+02  0.775E-02    2.09       0.0  T
   2    -45.0772136 -0.715063E-06  0.445E-02    2.09       1.0  T
   3    -45.0772105  0.307491E-05  0.142E-02    2.09       1.5  T
   4    -45.0772139 -0.334798E-05  0.422E-03    2.09       5.1  T
   5    -45.0772140 -0.950997E-07  0.271E-03    2.09       7.9  T
   6    -45.0772141 -0.110334E-06  0.596E-04    2.09      35.8  T
   7    -45.0772141 -0.721630E-08  0.206E-04    2.09     103.4  T
     SCC iter.                  ...        0 min,  0.008 sec
     gradient                   ...        0 min,  0.014 sec
 * total energy  :   -44.5378110 Eh     change       -0.4408107E-04 Eh
   gradient norm :     0.0015445 Eh/α   predicted    -0.3052713E-04 ( -30.75%)
   displ. norm   :     0.1751115 α      lambda       -0.3917767E-04
   maximum displ.:     0.1218550 α      in ANC's #2, #4, #3, ...

........................................................................
.............................. CYCLE    9 ..............................
........................................................................
   1    -45.0769916 -0.450770E+02  0.121E-01    2.07       0.0  T
   2    -45.0769931 -0.148450E-05  0.693E-02    2.07       1.0  T
   3    -45.0769863  0.679137E-05  0.210E-02    2.07       1.0  T
   4    -45.0769935 -0.724799E-05  0.680E-03    2.07       3.1  T
   5    -45.0769937 -0.220650E-06  0.421E-03    2.07       5.1  T
   6    -45.0769940 -0.307268E-06  0.766E-04    2.07      27.8  T
   7    -45.0769941 -0.943194E-08  0.314E-04    2.07      67.9  T
     SCC iter.                  ...        0 min,  0.008 sec
     gradient                   ...        0 min,  0.014 sec
 * total energy  :   -44.5378474 Eh     change       -0.3641954E-04 Eh
   gradient norm :     0.0030497 Eh/α   predicted    -0.1985792E-04 ( -45.47%)
   displ. norm   :     0.0599181 α      lambda       -0.2021934E-04
   maximum displ.:     0.0348584 α      in ANC's #2, #3, #4, ...

........................................................................
.............................. CYCLE   10 ..............................
........................................................................
   1    -45.0772052 -0.450772E+02  0.398E-02    2.07       0.0  T
   2    -45.0772054 -0.120668E-06  0.229E-02    2.07       1.0  T
   3    -45.0772029  0.243070E-05  0.118E-02    2.07       1.8  T
   4    -45.0772055 -0.261112E-05  0.222E-03    2.07       9.6  T
   5    -45.0772056 -0.910116E-08  0.135E-03    2.07      15.7  T
   6    -45.0772056 -0.344201E-07  0.283E-04    2.07      75.3  T
   7    -45.0772056 -0.882210E-09  0.122E-04    2.07     175.0  T
     SCC iter.                  ...        0 min,  0.008 sec
     gradient                   ...        0 min,  0.014 sec
 * total energy  :   -44.5378631 Eh     change       -0.1565854E-04 Eh
   gradient norm :     0.0019584 Eh/α   predicted    -0.1014793E-04 ( -35.19%)
   displ. norm   :     0.1330398 α      lambda       -0.1936467E-04
   maximum displ.:     0.0784775 α      in ANC's #4, #2, #3, ...

........................................................................
.............................. CYCLE   11 ..............................
........................................................................
   1    -45.0767258 -0.450767E+02  0.859E-02    2.07       0.0  T
   2    -45.0767262 -0.449170E-06  0.494E-02    2.07       1.0  T
   3    -45.0767168  0.943710E-05  0.226E-02    2.07       1.0  T
   4    -45.0767269 -0.100967E-04  0.443E-03    2.07       4.8  T
   5    -45.0767269 -0.739945E-07  0.218E-03    2.07       9.8  T
   6    -45.0767270 -0.885836E-07  0.441E-04    2.07      48.3  T
   7    -45.0767270 -0.177351E-08  0.224E-04    2.07      95.1  T
     SCC iter.                  ...        0 min,  0.008 sec
     gradient                   ...        0 min,  0.014 sec
 * total energy  :   -44.5378755 Eh     change       -0.1247570E-04 Eh
   gradient norm :     0.0013646 Eh/α   predicted    -0.9758958E-05 ( -21.78%)
   displ. norm   :     0.0216336 α      lambda       -0.4687709E-05
   maximum displ.:     0.0146536 α      in ANC's #3, #2, #1, ...

........................................................................
.............................. CYCLE   12 ..............................
........................................................................
   1    -45.0772486 -0.450772E+02  0.101E-02    2.07       0.0  T
   2    -45.0772487 -0.130220E-07  0.606E-03    2.07       3.5  T
   3    -45.0772483  0.324792E-06  0.436E-03    2.07       4.9  T
   4    -45.0772487 -0.351963E-06  0.727E-04    2.07      29.3  T
   5    -45.0772487 -0.875196E-08  0.291E-04    2.07      73.3  T
     SCC iter.                  ...        0 min,  0.006 sec
     gradient                   ...        0 min,  0.014 sec
 * total energy  :   -44.5378782 Eh     change       -0.2692602E-05 Eh
   gradient norm :     0.0007681 Eh/α   predicted    -0.2344705E-05 ( -12.92%)
   displ. norm   :     0.0216367 α      lambda        0.7900592E-05
   maximum displ.:     0.0146537 α      in ANC's #3, #2, #1, ...

   *** GEOMETRY OPTIMIZATION CONVERGED AFTER 12 ITERATIONS ***

------------------------------------------------------------------------
 total energy gain   :        -0.0150298 Eh       -9.4313 kcal/mol
 total RMSD          :         0.2339705 a0        0.1238 Å
 total power (kW/mol):        -3.2883847 (step) -101.8483 (real)
------------------------------------------------------------------------

 ANCopt (total)                0 d,  0 h,  0 min,  0.387 sec
 optimizer setup                ...        0 min,  0.000 sec (  0.041%)
 model hessian                  ...        0 min,  0.003 sec (  0.797%)
 ANC generation                 ...        0 min,  0.001 sec (  0.164%)
 coordinate transformation      ...        0 min,  0.000 sec (  0.053%)
 single point calculation       ...        0 min,  0.380 sec ( 97.980%)
 optimization log               ...        0 min,  0.001 sec (  0.291%)
 hessian update                 ...        0 min,  0.000 sec (  0.039%)
 rational function              ...        0 min,  0.002 sec (  0.429%)

================
 final structure:
================
$coord
   -2.91624063889958    2.36206701648136   -0.09726799129840      C 
   -5.08889388000961   -0.00398313510008   -0.16728543159529      S 
   -2.80834808462397   -2.34735167468487   -0.05910565406772      C 
   -0.40248166701298   -1.28247350083091   -0.03571328052698      C 
   -0.48240500311406    1.43814646097894   -0.03544097695763      C 
    1.78626276183646    2.84809766620935    0.01283643980945      C 
    4.02980890906960    1.58111054800020    0.00775268259899      C 
    6.49931500178083    2.96977887717647    0.06217314642703      C 
    6.24276507317944    5.48417041948393    0.23216117191989      F 
    7.95500115637931    2.26517869845772    2.02813628906596      F 
    7.89615000941438    2.53477180382670   -2.02299342902942      F 
    4.13397224016466   -1.09733535229325   -0.09851910379457      C 
    1.97745734309421   -2.49724251393583   -0.12552901191379      C 
   -3.63924188336601   -4.93646791479886    0.02370321346797      C 
   -2.38479285213718   -6.87631524068834    1.01785417442945      C 
   -3.51215179936060    4.29709160647891   -0.09631054632980      H 
    1.70993396385310    4.88539336477859    0.04286514713335      H 
    5.96251039591863   -1.99664796785589   -0.17003459072853      H 
    2.07269932802347   -4.52587589934513   -0.26623615544668      H 
   -5.51371064981050   -5.24557624822266   -0.73760663547057      H 
   -0.57802665617840   -6.66564356357220    1.92020412870684      H 
   -3.17512833709652   -8.74925285548151    0.99941947734595      H 
$end
           -------------------------------------------------
          |                Final Singlepoint                |
           -------------------------------------------------

          ...................................................
          :                      SETUP                      :
          :.................................................:
          :  # basis functions                  73          :
          :  # atomic orbitals                  72          :
          :  # shells                           38          :
          :  # electrons                        78          :
          :  max. iterations                   250          :
          :  Hamiltonian                  GFN2-xTB          :
          :  restarted?                      false          :
          :  GBSA solvation                  false          :
          :  PC potential                    false          :
          :  electronic temp.          300.0000000     K    :
          :  accuracy                    1.0000000          :
          :  -> integral cutoff          0.2500000E+02      :
          :  -> integral neglect         0.1000000E-07      :
          :  -> SCF convergence          0.1000000E-05 Eh   :
          :  -> wf. convergence          0.1000000E-03 e    :
          :  Broyden damping             0.4000000          :
          ...................................................

 iter      E             dE          RMSdq      gap      omega  full diag
   1    -45.0772487 -0.450772E+02  0.144E-04    2.07       0.0  T
   2    -45.0772487 -0.796518E-11  0.648E-05    2.07     329.0  T
   3    -45.0772487 -0.518696E-12  0.819E-05    2.07     260.3  T

   *** convergence criteria satisfied after 3 iterations ***

         #    Occupation            Energy/Eh            Energy/eV
      -------------------------------------------------------------
         1        2.0000           -0.8717410             -23.7213
       ...           ...                  ...                  ...
        33        2.0000           -0.4687159             -12.7544
        34        2.0000           -0.4598797             -12.5140
        35        2.0000           -0.4545181             -12.3681
        36        2.0000           -0.4410831             -12.0025
        37        2.0000           -0.4348723             -11.8335
        38        2.0000           -0.4212967             -11.4641
        39        2.0000           -0.3808810             -10.3643 (HOMO)
        40                         -0.3047382              -8.2923 (LUMO)
        41                         -0.2512660              -6.8373
        42                         -0.2241510              -6.0995
        43                         -0.2183139              -5.9406
        44                         -0.1910961              -5.2000
       ...                                ...                  ...
        72                          0.7138632              19.4252
      -------------------------------------------------------------
                  HL-Gap            0.0761428 Eh            2.0720 eV
             Fermi-level           -0.3428096 Eh           -9.3283 eV

 SCC (total)                   0 d,  0 h,  0 min,  0.029 sec
 SCC setup                      ...        0 min,  0.000 sec (  0.755%)
 Dispersion                     ...        0 min,  0.000 sec (  0.624%)
 integral evaluation            ...        0 min,  0.010 sec ( 33.879%)
 zeroth order Hamiltonian       ...        0 min,  0.000 sec (  0.565%)
 iterations                     ...        0 min,  0.004 sec ( 14.248%)
 molecular gradient             ...        0 min,  0.014 sec ( 48.561%)
 printout                       ...        0 min,  0.000 sec (  1.182%)

         :::::::::::::::::::::::::::::::::::::::::::::::::::::
         ::                     SUMMARY                     ::
         :::::::::::::::::::::::::::::::::::::::::::::::::::::
         :: total energy             -44.537878269311 Eh    ::
         :: gradient norm              0.000769165343 Eh/a0 ::
         :: HOMO-LUMO gap              2.071950081612 eV    ::
         ::.................................................::
         :: SCC energy               -45.077248694098 Eh    ::
         :: -> isotropic ES            0.044304161719 Eh    ::
         :: -> anisotropic ES          0.000077357544 Eh    ::
         :: -> anisotropic XC         -0.003173959020 Eh    ::
         :: -> dispersion             -0.023926975000 Eh    ::
         :: repulsion energy           0.539345699426 Eh    ::
         :: add. restraining           0.000000000000 Eh    ::
         :::::::::::::::::::::::::::::::::::::::::::::::::::::

           -------------------------------------------------
          |                Property Printout                |
           -------------------------------------------------

    * Orbital Energies and Occupations

         #    Occupation            Energy/Eh            Energy/eV
      -------------------------------------------------------------
         1        2.0000           -0.8717410             -23.7213
       ...           ...                  ...                  ...
        27        2.0000           -0.5177096             -14.0876
        28        2.0000           -0.5042654             -13.7218
        29        2.0000           -0.4961077             -13.4998
        30        2.0000           -0.4880696             -13.2811
        31        2.0000           -0.4822996             -13.1240
        32        2.0000           -0.4713137             -12.8251
        33        2.0000           -0.4687159             -12.7544
        34        2.0000           -0.4598797             -12.5140
        35        2.0000           -0.4545181             -12.3681
        36        2.0000           -0.4410831             -12.0025
        37        2.0000           -0.4348723             -11.8335
        38        2.0000           -0.4212967             -11.4641
        39        2.0000           -0.3808810             -10.3643 (HOMO)
        40                         -0.3047382              -8.2923 (LUMO)
        41                         -0.2512660              -6.8373
        42                         -0.2241510              -6.0995
        43                         -0.2183139              -5.9406
        44                         -0.1910961              -5.2000
        45                         -0.1346469              -3.6639
        46                         -0.1146457              -3.1197
        47                         -0.0202388              -0.5507
        48                          0.0106390               0.2895
        49                          0.0182935               0.4978
        50                          0.0431728               1.1748
       ...                                ...                  ...
        72                          0.7138632              19.4252
      -------------------------------------------------------------
                  HL-Gap            0.0761428 Eh            2.0720 eV
             Fermi-level           -0.3428096 Eh           -9.3283 eV

     #   Z        covCN         q      C6AA      α(0)
     1   6 C      2.924    -0.036    28.898     8.816
     2  16 S      2.352     0.036   139.610    19.887
     3   6 C      2.977     0.013    27.719     8.636
     4   6 C      3.163    -0.001    27.724     8.606
     5   6 C      3.183     0.004    27.479     8.556
     6   6 C      2.911    -0.027    28.683     8.782
     7   6 C      2.973    -0.028    28.685     8.785
     8   6 C      3.337     0.485    17.283     6.581
     9   9 F      0.791    -0.208    11.320     3.974
    10   9 F      0.791    -0.211    11.351     3.980
    11   9 F      0.791    -0.212    11.358     3.981
    12   6 C      2.918    -0.030    28.756     8.794
    13   6 C      2.909    -0.027    28.664     8.779
    14   6 C      2.937    -0.029    28.733     8.791
    15   6 C      2.839    -0.088    30.193     9.005
    16   1 H      0.926     0.055     2.260     2.351
    17   1 H      0.926     0.057     2.237     2.339
    18   1 H      0.926     0.052     2.294     2.369
    19   1 H      0.926     0.052     2.298     2.371
    20   1 H      0.925     0.047     2.354     2.400
    21   1 H      0.926     0.049     2.338     2.391
    22   1 H      0.926     0.048     2.340     2.392

 Mol. C6AA /au·bohr⁶  :       8051.859586
 Mol. C8AA /au·bohr⁸  :     220309.806668
 Mol. α(0) /au        :        142.564308


Wiberg/Mayer (AO) data.
largest (>0.10) Wiberg bond orders for each atom
          total WBO             WBO to atom ...
     1  C   3.943        C    5 1.444    S    2 1.259    H   16 0.968    C    3 0.129
     2  S   2.733        C    1 1.259    C    3 1.183
     3  C   3.945        C    4 1.381    S    2 1.183    C   14 1.137    C    1 0.129
     4  C   3.988        C    3 1.381    C   13 1.240    C    5 1.162
     5  C   3.988        C    1 1.444    C    6 1.229    C    4 1.162
     6  C   3.985        C    7 1.571    C    5 1.229    H   17 0.965    C   13 0.114
     7  C   3.969        C    6 1.571    C   12 1.245    C    8 0.952
     8  C   3.819        C    7 0.952    F    9 0.950    F   10 0.941    F   11 0.939
     9  F   1.072        C    8 0.950
    10  F   1.065        C    8 0.941
    11  F   1.065        C    8 0.939
    12  C   3.989        C   13 1.600    C    7 1.245    H   18 0.968
    13  C   3.991        C   12 1.600    C    4 1.240    H   19 0.962    C    6 0.114
    14  C   3.990        C   15 1.858    C    3 1.137    H   20 0.960
    15  C   3.985        C   14 1.858    H   22 0.977    H   21 0.972
    16  H   0.996        C    1 0.968
    17  H   0.996        C    6 0.965
    18  H   0.996        C   12 0.968
    19  H   0.996        C   13 0.962
    20  H   0.997        C   14 0.960
    21  H   0.998        C   15 0.972
    22  H   0.997        C   15 0.977

molecular dipole:
                 x           y           z       tot (Debye)
 q only:       -1.755      -0.917      -0.024
   full:       -1.523      -0.813      -0.021       4.388
molecular quadrupole (traceless):
                xx          xy          yy          xz          yz          zz
 q only:      -10.321      -9.082       7.005       0.079      -0.354       3.316
  q+dip:      -10.233      -9.486      10.620       0.834      -0.547      -0.387
   full:      -12.228      -9.548       9.183       0.263      -0.375       3.044

           -------------------------------------------------
          |                Geometry Summary                 |
           -------------------------------------------------

      molecular mass/u    :      228.2315000
   center of mass at/Å    :        0.7491965       0.1923727       0.0207079
  moments of inertia/u·Å² :        0.4164512E+03   0.1740660E+04   0.2062033E+04
rotational constants/cm⁻¹ :        0.4047925E-01   0.9684623E-02   0.8175247E-02

 * 21 selected distances

     #   Z        #   Z                                     value/Å
     1   6 C      2  16 S                                 1.7002588
     2  16 S      3   6 C                                 1.7313050 (max)
     3   6 C      4   6 C                                 1.3923202
     1   6 C      5   6 C                                 1.3779971
     4   6 C      5   6 C                                 1.4403113
     5   6 C      6   6 C                                 1.4137203
     6   6 C      7   6 C                                 1.3634693
     8   6 C      9   9 F                                 1.3404885
     8   6 C     10   9 F                                 1.3471168
     8   6 C     11   9 F                                 1.3479277
     7   6 C     12   6 C                                 1.4195584
     4   6 C     13   6 C                                 1.4147790
    12   6 C     13   6 C                                 1.3606161
    14   6 C     15   6 C                                 1.3308557
     1   6 C     16   1 H                                 1.0714280 (min)
     6   6 C     17   1 H                                 1.0789640
    12   6 C     18   1 H                                 1.0789806
    13   6 C     19   1 H                                 1.0772654
    14   6 C     20   1 H                                 1.0830403
    15   6 C     21   1 H                                 1.0745064
    15   6 C     22   1 H                                 1.0757883

 * 4 distinct bonds (by element types)

   Z      Z             #   av. dist./Å        max./Å        min./Å
   1 H    6 C           7     1.0771390     1.0830403     1.0714280
   6 C    6 C           9     1.3904030     1.4403113     1.3308557
   6 C    9 F           3     1.3451777     1.3479277     1.3404885
   6 C   16 S           2     1.7157819     1.7313050     1.7002588


optimized geometry written to: xtbopt.xyz


           -------------------------------------------------
          | TOTAL ENERGY              -44.537878269311 Eh   |
          | GRADIENT NORM               0.000769165343 Eh/α |
          | HOMO-LUMO GAP               2.071950081612 eV   |
           -------------------------------------------------

------------------------------------------------------------------------
 * finished run on 2021/05/19 at 11:00:11.767     
------------------------------------------------------------------------
 total:
 * wall-time:     0 d,  0 h,  0 min,  0.480 sec
 *  cpu-time:     0 d,  0 h,  0 min,  0.478 sec
 * ratio c/w:     0.997 speedup
 SCF:
 * wall-time:     0 d,  0 h,  0 min,  0.041 sec
 *  cpu-time:     0 d,  0 h,  0 min,  0.041 sec
 * ratio c/w:     0.998 speedup
 ANC optimizer:
 * wall-time:     0 d,  0 h,  0 min,  0.417 sec
 *  cpu-time:     0 d,  0 h,  0 min,  0.416 sec
 * ratio c/w:     0.998 speedup

