      -----------------------------------------------------------      
     |                   =====================                   |     
     |                           x T B                           |     
     |                   =====================                   |     
     |                         S. Grimme                         |     
     |          Mulliken Center for Theoretical Chemistry        |     
     |                    University of Bonn                     |     
     |                Version 6.2 RC2 (SAW190805)                |     
      -----------------------------------------------------------      

   This program is distributed in the hope that it will be useful,
   but WITHOUT ANY WARRANTY; without even the implied warranty of
   MERCHANTABILITY or FITNESS FOR A PARTICULAR PURPOSE.
   
   FOR NON-COMMERCIAL, ACADEMIA USE ONLY.
   
   Cite this work as:
   * S. Grimme, C. Bannwarth, P. Shushkov, J. Chem. Theory Comput., 2017,
     13, 1989-2009. DOI: 10.1021/acs.jctc.7b00118
   * C. Bannwarth, S. Ehlert and S. Grimme., J. Chem. Theory Comput., 2019,
     15, 1652-1671. DOI: 10.1021/acs.jctc.8b01176
   * P. Pracht, E. Caldeweyher, S. Ehlert, S. Grimme, ChemRxiv, 2019, preprint.
     DOI: 10.26434/chemrxiv.8326202.v1
   
   for DFT-D4:
   * E. Caldeweyher, C. Bannwarth and S. Grimme, J. Chem. Phys., 2017,
     147, 034112. DOI: 10.1063/1.4993215
   * E. Caldeweyher, S. Ehlert, A. Hansen, H. Neugebauer, S. Spicher,
     C. Bannwarth and S. Grimme, J. Chem. Phys., 2019, 150, 154122.
     DOI: 10.1063/1.5090222
   
   for sTDA-xTB:
   * S. Grimme and C. Bannwarth, J. Chem. Phys., 2016, 145, 054103.
     DOI: 10.1063/1.4959605
   
   in the mass-spec context:
   * V. Asgeirsson, C. Bauer and S. Grimme, Chem. Sci., 2017, 8, 4879.
     DOI: 10.1039/c7sc00601b
   
   for metadynamics refer to:
   * S. Grimme, J. Chem. Theory Comput., 2019, 155, 2847-2862
     DOI: 10.1021/acs.jctc.9b00143
   
   with help from (in alphabetical order)
   C. Bannwarth, F. Bohle, G. Brandenburg, E. Caldeweyher, M. Checinski,
   S. Dohm, S. Ehlert, S. Ehrlich, F. März, H. Neugebauer, J. Pisarek,
   P. Pracht, P. Shushkov, and S. Spicher.
   
 * started run on 2021/05/19 at 10:59:22.632     

           -------------------------------------------------
          |                Calculation Setup                |
           -------------------------------------------------

          program call               : /ihome/ghutchison/geoffh/xtb/xtb 602.xyz -opt
          hostname                   : smp-n144
          coordinate file            : 602.xyz
          omp threads                :                     1
          number of atoms            :                    20
          number of electrons        :                    58
          charge                     :                     0
          spin                       :                   0.0
          first test random number   :      0.52388979612413


########################################################################
# WARNING! Please study the warnings concerning your input carefully
#  - the use of '-opt' is discouraged, please use '--opt' next time
########################################################################

           ------------------------------------------------- 
          |                 G F N 2 - x T B                 |
          | Geometry, Frequencies, Noncovalent interactions |
          |            JCTC 2019 parametrisation            |
           ------------------------------------------------- 
             KAB for C  - Si     :                1.0500
             KAB for H  - Pd     :                0.9500
             k(s)              :                1.8500
             k(p)              :                2.2300
             k(d)              :                2.2300
             k(f)              :                2.0000
             kEN (H0ij)        :               -2.0000
             D4 a1             :                0.5200
             D4 a2             :                5.0000
             D4 s6             :                1.0000
             D4 s8             :                2.7000
             D4 s9             :                5.0000
             alphaj            :                2.0000

  Z AO/shell   Hii/eV     exponent
  1     Wed Apr 25 08:07:45 CEST 2018   EN: 2.200 GM2: 0.406  GM3: 0.0800  RAES: 1.40
     1s    -10.707211    1.230000
  6     Wed Apr 25 08:07:45 CEST 2018   EN: 2.550 GM2: 0.538  GM3: 0.1500  RAES: 3.00
     2s    -13.970922    2.096432
     2p    -10.063292    1.800000
  8     Wed Apr 25 08:07:45 CEST 2018   EN: 3.440 GM2: 0.452  GM3:-0.0517  RAES: 1.80
     2s    -20.229985    2.439742
     2p    -15.503117    2.137023

           ------------------------------------------------- 
          |        Self-Consistent Charge Iterations        |
           ------------------------------------------------- 

          ...................................................
          :                      SETUP                      :
          :.................................................:
          :  # basis functions                  56          :
          :  # atomic orbitals                  56          :
          :  # shells                           32          :
          :  # electrons                        58          :
          :  max. iterations                   250          :
          :  Hamiltonian                  GFN2-xTB          :
          :  restarted?                      false          :
          :  GBSA solvation                  false          :
          :  PC potential                    false          :
          :  electronic temp.          300.0000000     K    :
          :  accuracy                    1.0000000          :
          :  -> integral cutoff          0.2500000E+02      :
          :  -> integral neglect         0.1000000E-07      :
          :  -> SCF convergence          0.1000000E-05 Eh   :
          :  -> wf. convergence          0.1000000E-03 e    :
          :  Broyden damping             0.4000000          :
          ...................................................

 iter      E             dE          RMSdq      gap      omega  full diag
   1    -32.1083309 -0.321083E+02  0.532E+00    0.91       0.0  T
   2    -32.1309437 -0.226129E-01  0.309E+00    0.85       1.0  T
   3    -32.0933624  0.375814E-01  0.218E+00    0.88       1.0  T
   4    -32.1325119 -0.391495E-01  0.849E-01    0.78       1.0  T
   5    -32.1402336 -0.772172E-02  0.449E-01    0.76       1.0  T
   6    -32.1431612 -0.292758E-02  0.134E-01    0.76       1.0  T
   7    -32.1434504 -0.289231E-03  0.449E-02    0.76       1.0  T
   8    -32.1434615 -0.110754E-04  0.229E-02    0.76       1.0  T
   9    -32.1434636 -0.215122E-05  0.108E-02    0.76       2.1  T
  10    -32.1434652 -0.159303E-05  0.302E-03    0.76       7.4  T
  11    -32.1434653 -0.414239E-07  0.159E-03    0.76      14.0  T
  12    -32.1434653 -0.207838E-07  0.913E-04    0.76      24.5  T
  13    -32.1434653 -0.595234E-08  0.282E-04    0.76      79.4  T

   *** convergence criteria satisfied after 13 iterations ***

         #    Occupation            Energy/Eh            Energy/eV
      -------------------------------------------------------------
         1        2.0000           -0.7122061             -19.3801
       ...           ...                  ...                  ...
        23        2.0000           -0.4546576             -12.3719
        24        2.0000           -0.4463295             -12.1452
        25        2.0000           -0.4418921             -12.0245
        26        2.0000           -0.4324586             -11.7678
        27        2.0000           -0.4220610             -11.4849
        28        2.0000           -0.3947750             -10.7424
        29        2.0000           -0.3676379             -10.0039 (HOMO)
        30        0.0000           -0.3395776              -9.2404 (LUMO)
        31                         -0.2402987              -6.5389
        32                         -0.2341318              -6.3710
        33                         -0.1946317              -5.2962
        34                         -0.1306476              -3.5551
       ...                                ...                  ...
        56                          0.7553362              20.5537
      -------------------------------------------------------------
                  HL-Gap            0.0280603 Eh            0.7636 eV
             Fermi-level           -0.3536078 Eh           -9.6222 eV

 SCC (total)                   0 d,  0 h,  0 min,  0.028 sec
 SCC setup                      ...        0 min,  0.000 sec (  0.911%)
 Dispersion                     ...        0 min,  0.000 sec (  1.094%)
 integral evaluation            ...        0 min,  0.006 sec ( 21.074%)
 zeroth order Hamiltonian       ...        0 min,  0.000 sec (  0.449%)
 iterations                     ...        0 min,  0.011 sec ( 39.979%)
 molecular gradient             ...        0 min,  0.010 sec ( 35.066%)
 printout                       ...        0 min,  0.000 sec (  1.239%)

         :::::::::::::::::::::::::::::::::::::::::::::::::::::
         ::                     SUMMARY                     ::
         :::::::::::::::::::::::::::::::::::::::::::::::::::::
         :: total energy             -31.590183330978 Eh    ::
         :: gradient norm              0.085098144254 Eh/a0 ::
         :: HOMO-LUMO gap              0.763559561106 eV    ::
         ::.................................................::
         :: SCC energy               -32.143465282707 Eh    ::
         :: -> isotropic ES            0.023400122285 Eh    ::
         :: -> anisotropic ES          0.001004570124 Eh    ::
         :: -> anisotropic XC          0.018333124882 Eh    ::
         :: -> dispersion             -0.019296958863 Eh    ::
         :: repulsion energy           0.553256971960 Eh    ::
         :: add. restraining           0.000000000000 Eh    ::
         :::::::::::::::::::::::::::::::::::::::::::::::::::::

      ----------------------------------------------------------- 
     |                   =====================                   |
     |                        A N C O P T                        |
     |                   =====================                   |
     |               Approximate Normal Coordinate               |
     |                Rational Function Optimizer                |
      ----------------------------------------------------------- 

          ...................................................
          :                      SETUP                      :
          :.................................................:
          :   optimization level            normal          :
          :   max. optcycles                   200          :
          :   ANC micro-cycles                  20          :
          :   degrees of freedom                54          :
          :.................................................:
          :   RF solver                   davidson          :
          :   input Hessian                  false          :
          :   write xtbopt.log                true          :
          :   linear?                        false          :
          :   energy convergence         0.5000000E-05 Eh   :
          :   grad. convergence          0.1000000E-02 Eh/α :
          :   maximium RF displ.         2.0000000          :
          :   Hlow (freq-cutoff)         0.5000000E-02      :
          :   Hmax (freq-cutoff)         5.0000000          :
          :   S6 in model hess.         20.0000000          :
          ...................................................

generating ANC from model Hessian ...
Using Lindh-Hessian (1995)
 Shifting diagonal of input Hessian by   2.651211338233130E-003
 Lowest  eigenvalues of input Hessian
   -0.000000   -0.000000   -0.000000   -0.000000    0.000000    0.000000
    0.005000    0.006393    0.009401    0.010741    0.012157    0.016513
    0.021213    0.022968    0.027976    0.038382    0.047928    0.052491
 Highest eigenvalues
    1.794070    1.805808    1.915713    2.042210    2.138497    2.238990
 

........................................................................
.............................. CYCLE    1 ..............................
........................................................................
   1    -32.1434653 -0.321435E+02  0.137E-04    0.76       0.0  T
   2    -32.1434653  0.364778E-09  0.175E-04    0.76     128.1  T
   3    -32.1434653 -0.460737E-09  0.758E-05    0.76     295.2  T
     SCC iter.                  ...        0 min,  0.003 sec
     gradient                   ...        0 min,  0.010 sec
 * total energy  :   -31.5901833 Eh     change       -0.1005180E-07 Eh
   gradient norm :     0.0850988 Eh/α   predicted     0.0000000E+00 (-100.00%)
   displ. norm   :     0.2120289 α      lambda       -0.8550796E-02
   maximum displ.:     0.0781437 α      in ANC's #14, #9, #22, ...

........................................................................
.............................. CYCLE    2 ..............................
........................................................................
   1    -32.1486191 -0.321486E+02  0.186E-01    0.66       0.0  T
   2    -32.1480346  0.584463E-03  0.240E-01    0.64       1.0  T
   3    -32.1487361 -0.701516E-03  0.129E-01    0.64       1.0  T
   4    -32.1488548 -0.118728E-03  0.460E-02    0.64       1.0  T
   5    -32.1488765 -0.216513E-04  0.180E-02    0.64       1.2  T
   6    -32.1488816 -0.506745E-05  0.449E-03    0.64       5.0  T
   7    -32.1488818 -0.199926E-06  0.195E-03    0.64      11.5  T
     SCC iter.                  ...        0 min,  0.006 sec
     gradient                   ...        0 min,  0.010 sec
 * total energy  :   -31.5956747 Eh     change       -0.5491331E-02 Eh
   gradient norm :     0.0350950 Eh/α   predicted    -0.4467612E-02 ( -18.64%)
   displ. norm   :     0.1446653 α      lambda       -0.1572445E-02
   maximum displ.:     0.0874528 α      in ANC's #2, #9, #3, ...

........................................................................
.............................. CYCLE    3 ..............................
........................................................................
   1    -32.1507591 -0.321508E+02  0.142E-01    0.60       0.0  T
   2    -32.1501551  0.604031E-03  0.212E-01    0.59       1.0  T
   3    -32.1507810 -0.625888E-03  0.101E-01    0.60       1.0  T
   4    -32.1508522 -0.712585E-04  0.308E-02    0.60       1.0  T
   5    -32.1508713 -0.190454E-04  0.880E-03    0.60       2.5  T
   6    -32.1508724 -0.117071E-05  0.261E-03    0.59       8.6  T
   7    -32.1508725 -0.382208E-07  0.155E-03    0.59      14.4  T
     SCC iter.                  ...        0 min,  0.006 sec
     gradient                   ...        0 min,  0.009 sec
 * total energy  :   -31.5965960 Eh     change       -0.9213215E-03 Eh
   gradient norm :     0.0106327 Eh/α   predicted    -0.8026891E-03 ( -12.88%)
   displ. norm   :     0.1200613 α      lambda       -0.2678037E-03
   maximum displ.:     0.0899589 α      in ANC's #2, #1, #4, ...

........................................................................
.............................. CYCLE    4 ..............................
........................................................................
   1    -32.1502424 -0.321502E+02  0.865E-02    0.59       0.0  T
   2    -32.1500309  0.211526E-03  0.123E-01    0.59       1.0  T
   3    -32.1502274 -0.196497E-03  0.657E-02    0.59       1.0  T
   4    -32.1502692 -0.418746E-04  0.946E-03    0.59       2.4  T
   5    -32.1502712 -0.199407E-05  0.198E-03    0.59      11.3  T
   6    -32.1502713 -0.399940E-07  0.971E-04    0.59      23.0  T
     SCC iter.                  ...        0 min,  0.005 sec
     gradient                   ...        0 min,  0.009 sec
 * total energy  :   -31.5967710 Eh     change       -0.1750514E-03 Eh
   gradient norm :     0.0063994 Eh/α   predicted    -0.1358323E-03 ( -22.40%)
   displ. norm   :     0.1356858 α      lambda       -0.1749101E-03
   maximum displ.:     0.1081529 α      in ANC's #2, #1, #4, ...

........................................................................
.............................. CYCLE    5 ..............................
........................................................................
   1    -32.1493780 -0.321494E+02  0.102E-01    0.59       0.0  T
   2    -32.1491412  0.236871E-03  0.133E-01    0.59       1.0  T
   3    -32.1493389 -0.197702E-03  0.814E-02    0.59       1.0  T
   4    -32.1494096 -0.706873E-04  0.714E-03    0.59       3.1  T
   5    -32.1494105 -0.976694E-06  0.238E-03    0.59       9.4  T
   6    -32.1494106 -0.820094E-07  0.101E-03    0.59      22.0  T
     SCC iter.                  ...        0 min,  0.005 sec
     gradient                   ...        0 min,  0.009 sec
 * total energy  :   -31.5968886 Eh     change       -0.1175686E-03 Eh
   gradient norm :     0.0058843 Eh/α   predicted    -0.8906580E-04 ( -24.24%)
   displ. norm   :     0.1187277 α      lambda       -0.1017137E-03
   maximum displ.:     0.0877656 α      in ANC's #2, #1, #4, ...

........................................................................
.............................. CYCLE    6 ..............................
........................................................................
   1    -32.1494804 -0.321495E+02  0.767E-02    0.59       0.0  T
   2    -32.1494041  0.763294E-04  0.819E-02    0.59       1.0  T
   3    -32.1494333 -0.292143E-04  0.696E-02    0.59       1.0  T
   4    -32.1494904 -0.571270E-04  0.997E-03    0.59       2.2  T
   5    -32.1494924 -0.193742E-05  0.295E-03    0.59       7.6  T
   6    -32.1494926 -0.177424E-06  0.822E-04    0.59      27.2  T
     SCC iter.                  ...        0 min,  0.005 sec
     gradient                   ...        0 min,  0.009 sec
 * total energy  :   -31.5969653 Eh     change       -0.7664081E-04 Eh
   gradient norm :     0.0047692 Eh/α   predicted    -0.5157393E-04 ( -32.71%)
   displ. norm   :     0.1324471 α      lambda       -0.8540239E-04
   maximum displ.:     0.0949254 α      in ANC's #2, #1, #3, ...

........................................................................
.............................. CYCLE    7 ..............................
........................................................................
   1    -32.1498787 -0.321499E+02  0.820E-02    0.59       0.0  T
   2    -32.1498404  0.383124E-04  0.692E-02    0.59       1.0  T
   3    -32.1497749  0.655342E-04  0.885E-02    0.59       1.0  T
   4    -32.1498827 -0.107818E-03  0.105E-02    0.59       2.1  T
   5    -32.1498850 -0.233493E-05  0.192E-03    0.59      11.7  T
   6    -32.1498851 -0.653477E-07  0.684E-04    0.59      32.7  T
     SCC iter.                  ...        0 min,  0.005 sec
     gradient                   ...        0 min,  0.010 sec
 * total energy  :   -31.5970305 Eh     change       -0.6523676E-04 Eh
   gradient norm :     0.0041991 Eh/α   predicted    -0.4346021E-04 ( -33.38%)
   displ. norm   :     0.1525716 α      lambda       -0.7457848E-04
   maximum displ.:     0.1073253 α      in ANC's #2, #1, #3, ...

........................................................................
.............................. CYCLE    8 ..............................
........................................................................
   1    -32.1500011 -0.321500E+02  0.873E-02    0.59       0.0  T
   2    -32.1499933  0.773347E-05  0.565E-02    0.59       1.0  T
   3    -32.1497983  0.195033E-03  0.112E-01    0.59       1.0  T
   4    -32.1500015 -0.203228E-03  0.729E-03    0.59       3.1  T
   5    -32.1500027 -0.115652E-05  0.101E-03    0.59      22.1  T
   6    -32.1500027 -0.102043E-07  0.551E-04    0.59      40.6  T
     SCC iter.                  ...        0 min,  0.005 sec
     gradient                   ...        0 min,  0.009 sec
 * total energy  :   -31.5970857 Eh     change       -0.5523835E-04 Eh
   gradient norm :     0.0046666 Eh/α   predicted    -0.3815978E-04 ( -30.92%)
   displ. norm   :     0.2121383 α      lambda       -0.8659327E-04
   maximum displ.:     0.1454123 α      in ANC's #2, #1, #3, ...

........................................................................
.............................. CYCLE    9 ..............................
........................................................................
   1    -32.1497010 -0.321497E+02  0.126E-01    0.58       0.0  T
   2    -32.1497010  0.301957E-08  0.744E-02    0.58       1.0  T
   3    -32.1496599  0.410798E-04  0.505E-02    0.58       1.0  T
   4    -32.1497015 -0.415408E-04  0.449E-03    0.58       5.0  T
   5    -32.1497018 -0.342042E-06  0.140E-03    0.58      16.0  T
   6    -32.1497018 -0.833963E-08  0.853E-04    0.58      26.2  T
     SCC iter.                  ...        0 min,  0.005 sec
     gradient                   ...        0 min,  0.009 sec
 * total energy  :   -31.5971313 Eh     change       -0.4556930E-04 Eh
   gradient norm :     0.0054625 Eh/α   predicted    -0.4524633E-04 (  -0.71%)
   displ. norm   :     0.1025929 α      lambda       -0.5282841E-04
   maximum displ.:     0.0724470 α      in ANC's #1, #2, #3, ...

........................................................................
.............................. CYCLE   10 ..............................
........................................................................
   1    -32.1501850 -0.321502E+02  0.611E-02    0.58       0.0  T
   2    -32.1501467  0.383009E-04  0.590E-02    0.58       1.0  T
   3    -32.1501385  0.819894E-05  0.633E-02    0.58       1.0  T
   4    -32.1501900 -0.515243E-04  0.354E-03    0.58       6.3  T
   5    -32.1501902 -0.220126E-06  0.126E-03    0.58      17.8  T
   6    -32.1501902 -0.238366E-07  0.536E-04    0.58      41.7  T
     SCC iter.                  ...        0 min,  0.005 sec
     gradient                   ...        0 min,  0.009 sec
 * total energy  :   -31.5971643 Eh     change       -0.3296598E-04 Eh
   gradient norm :     0.0037039 Eh/α   predicted    -0.2669254E-04 ( -19.03%)
   displ. norm   :     0.0719084 α      lambda       -0.2375689E-04
   maximum displ.:     0.0525748 α      in ANC's #1, #2, #9, ...

........................................................................
.............................. CYCLE   11 ..............................
........................................................................
   1    -32.1506106 -0.321506E+02  0.466E-02    0.58       0.0  T
   2    -32.1505658  0.447821E-04  0.582E-02    0.58       1.0  T
   3    -32.1505989 -0.330554E-04  0.399E-02    0.58       1.0  T
   4    -32.1506162 -0.172645E-04  0.538E-03    0.58       4.2  T
   5    -32.1506167 -0.576176E-06  0.129E-03    0.58      17.3  T
   6    -32.1506168 -0.232173E-07  0.577E-04    0.58      38.8  T
   7    -32.1506168 -0.130633E-08  0.382E-04    0.58      58.6  T
     SCC iter.                  ...        0 min,  0.006 sec
     gradient                   ...        0 min,  0.010 sec
 * total energy  :   -31.5971805 Eh     change       -0.1619457E-04 Eh
   gradient norm :     0.0018656 Eh/α   predicted    -0.1194051E-04 ( -26.27%)
   displ. norm   :     0.1601704 α      lambda       -0.1505466E-04
   maximum displ.:     0.1138677 α      in ANC's #1, #2, #4, ...

........................................................................
.............................. CYCLE   12 ..............................
........................................................................
   1    -32.1495204 -0.321495E+02  0.936E-02    0.59       0.0  T
   2    -32.1494849  0.355325E-04  0.716E-02    0.59       1.0  T
   3    -32.1493319  0.152954E-03  0.115E-01    0.58       1.0  T
   4    -32.1495239 -0.191967E-03  0.105E-02    0.59       2.1  T
   5    -32.1495261 -0.219990E-05  0.184E-03    0.59      12.2  T
   6    -32.1495261 -0.854912E-08  0.127E-03    0.59      17.7  T
   7    -32.1495261 -0.664962E-08  0.598E-04    0.59      37.4  T
   8    -32.1495261 -0.357737E-08  0.148E-04    0.59     150.9  T
     SCC iter.                  ...        0 min,  0.006 sec
     gradient                   ...        0 min,  0.010 sec
 * total energy  :   -31.5971785 Eh     change        0.1993278E-05 Eh
   gradient norm :     0.0028184 Eh/α   predicted    -0.7617948E-05 (-482.18%)
   displ. norm   :     0.0574506 α      lambda       -0.1892856E-04
   maximum displ.:     0.0445710 α      in ANC's #2, #1, #3, ...

........................................................................
.............................. CYCLE   13 ..............................
........................................................................
   1    -32.1506126 -0.321506E+02  0.326E-02    0.59       0.0  T
   2    -32.1506081  0.449482E-05  0.257E-02    0.59       1.0  T
   3    -32.1505903  0.177920E-04  0.391E-02    0.59       1.0  T
   4    -32.1506131 -0.227623E-04  0.307E-03    0.59       7.3  T
   5    -32.1506133 -0.190693E-06  0.638E-04    0.59      35.1  T
   6    -32.1506133 -0.586866E-08  0.221E-04    0.59     101.1  T
     SCC iter.                  ...        0 min,  0.005 sec
     gradient                   ...        0 min,  0.010 sec
 * total energy  :   -31.5971873 Eh     change       -0.8827997E-05 Eh
   gradient norm :     0.0016321 Eh/α   predicted    -0.9496317E-05 (   7.57%)
   displ. norm   :     0.0344843 α      lambda       -0.5109184E-05
   maximum displ.:     0.0237800 α      in ANC's #1, #2, #9, ...

........................................................................
.............................. CYCLE   14 ..............................
........................................................................
   1    -32.1505465 -0.321505E+02  0.295E-02    0.58       0.0  T
   2    -32.1505183  0.282563E-04  0.447E-02    0.59       1.0  T
   3    -32.1505459 -0.276649E-04  0.214E-02    0.59       1.0  T
   4    -32.1505499 -0.402047E-05  0.524E-03    0.59       4.3  T
   5    -32.1505504 -0.472794E-06  0.960E-04    0.59      23.3  T
   6    -32.1505504 -0.160799E-07  0.389E-04    0.59      57.5  T
     SCC iter.                  ...        0 min,  0.005 sec
     gradient                   ...        0 min,  0.010 sec
 * total energy  :   -31.5971874 Eh     change       -0.1288788E-06 Eh
   gradient norm :     0.0013517 Eh/α   predicted    -0.2561338E-05 (1887.40%)
   displ. norm   :     0.0153405 α      lambda       -0.3368256E-05
   maximum displ.:     0.0122235 α      in ANC's #1, #6, #2, ...

........................................................................
.............................. CYCLE   15 ..............................
........................................................................
   1    -32.1505516 -0.321506E+02  0.129E-02    0.59       0.0  T
   2    -32.1505503  0.128368E-05  0.117E-02    0.59       1.9  T
   3    -32.1505492  0.110523E-05  0.139E-02    0.59       1.6  T
   4    -32.1505518 -0.256141E-05  0.143E-03    0.59      15.7  T
   5    -32.1505518 -0.340219E-07  0.368E-04    0.59      60.7  T
   6    -32.1505518 -0.124651E-08  0.192E-04    0.59     116.6  T
     SCC iter.                  ...        0 min,  0.005 sec
     gradient                   ...        0 min,  0.010 sec
 * total energy  :   -31.5971896 Eh     change       -0.2225244E-05 Eh
   gradient norm :     0.0005662 Eh/α   predicted    -0.1684726E-05 ( -24.29%)
   displ. norm   :     0.0158901 α      lambda        0.4447406E-05
   maximum displ.:     0.0129088 α      in ANC's #1, #6, #2, ...

   *** GEOMETRY OPTIMIZATION CONVERGED AFTER 15 ITERATIONS ***

------------------------------------------------------------------------
 total energy gain   :        -0.0070063 Eh       -4.3965 kcal/mol
 total RMSD          :         0.2866771 a0        0.1517 Å
 total power (kW/mol):        -1.2263389 (step)  -56.6409 (real)
------------------------------------------------------------------------

 ANCopt (total)                0 d,  0 h,  0 min,  0.325 sec
 optimizer setup                ...        0 min,  0.000 sec (  0.049%)
 model hessian                  ...        0 min,  0.002 sec (  0.747%)
 ANC generation                 ...        0 min,  0.001 sec (  0.171%)
 coordinate transformation      ...        0 min,  0.000 sec (  0.069%)
 single point calculation       ...        0 min,  0.317 sec ( 97.460%)
 optimization log               ...        0 min,  0.001 sec (  0.400%)
 hessian update                 ...        0 min,  0.000 sec (  0.057%)
 rational function              ...        0 min,  0.002 sec (  0.752%)

================
 final structure:
================
$coord
    3.03014631180531   -2.03504663386390   -0.41704608793873      C 
    0.57139210394034   -1.36247928663236   -0.13981251483531      C 
   -1.65647336462858   -2.85199438385612    0.17330365632323      C 
   -3.91663783659508   -1.68549365340357    0.41135491922357      C 
   -4.14158200683966    1.01564524994232    0.35955684312365      C 
   -2.09761570080948    2.52433245600171    0.06657740611408      C 
    0.34093041647134    1.41613264229324   -0.19648536066436      C 
    2.68078141622202    2.47447429327159   -0.51467228353303      C 
    4.55192974441592    0.27642507275457   -0.66719063871316      C 
    6.81509420737847    0.41842447053293   -0.93144926989125      O 
    3.30993828847871    5.08474989196151   -0.68159011534809      C 
    5.65007843987115    5.99899694664965   -1.00281760179484      C 
    3.82142512822608   -3.90086373042283   -0.45494805844703      H 
   -1.48782990658928   -4.88476068442402    0.21312780962485      H 
   -5.62407768188016   -2.77921885955560    0.64937994739335      H 
   -6.00438650232200    1.82410077231564    0.56200872575609      H 
   -2.28484658695431    4.55572207385834    0.02962339348122      H 
    1.73317943298301    6.38389236941452   -0.53109513451529      H 
    7.25952394993150    4.76823750695230   -1.15936376498273      H 
    5.99453605166473    8.00066226490982   -1.11500680694449      H 
$end
           -------------------------------------------------
          |                Final Singlepoint                |
           -------------------------------------------------

          ...................................................
          :                      SETUP                      :
          :.................................................:
          :  # basis functions                  56          :
          :  # atomic orbitals                  56          :
          :  # shells                           32          :
          :  # electrons                        58          :
          :  max. iterations                   250          :
          :  Hamiltonian                  GFN2-xTB          :
          :  restarted?                      false          :
          :  GBSA solvation                  false          :
          :  PC potential                    false          :
          :  electronic temp.          300.0000000     K    :
          :  accuracy                    1.0000000          :
          :  -> integral cutoff          0.2500000E+02      :
          :  -> integral neglect         0.1000000E-07      :
          :  -> SCF convergence          0.1000000E-05 Eh   :
          :  -> wf. convergence          0.1000000E-03 e    :
          :  Broyden damping             0.4000000          :
          ...................................................

 iter      E             dE          RMSdq      gap      omega  full diag
   1    -32.1505518 -0.321506E+02  0.120E-04    0.59       0.0  T
   2    -32.1505518  0.106319E-09  0.104E-04    0.59     215.1  T
   3    -32.1505518 -0.177430E-09  0.907E-05    0.59     246.5  T

   *** convergence criteria satisfied after 3 iterations ***

         #    Occupation            Energy/Eh            Energy/eV
      -------------------------------------------------------------
         1        2.0000           -0.7140747             -19.4310
       ...           ...                  ...                  ...
        23        2.0000           -0.4588742             -12.4866
        24        2.0000           -0.4464027             -12.1472
        25        2.0000           -0.4401584             -11.9773
        26        2.0000           -0.4297131             -11.6931
        27        2.0000           -0.4223584             -11.4930
        28        2.0000           -0.3925539             -10.6819
        29        2.0000           -0.3626646              -9.8686 (HOMO)
        30        0.0000           -0.3411443              -9.2830 (LUMO)
        31                         -0.2402868              -6.5385
        32                         -0.2337265              -6.3600
        33                         -0.1924564              -5.2370
        34                         -0.1292819              -3.5179
       ...                                ...                  ...
        56                          0.7350599              20.0020
      -------------------------------------------------------------
                  HL-Gap            0.0215203 Eh            0.5856 eV
             Fermi-level           -0.3519045 Eh           -9.5758 eV

 SCC (total)                   0 d,  0 h,  0 min,  0.020 sec
 SCC setup                      ...        0 min,  0.000 sec (  0.814%)
 Dispersion                     ...        0 min,  0.000 sec (  0.845%)
 integral evaluation            ...        0 min,  0.006 sec ( 30.605%)
 zeroth order Hamiltonian       ...        0 min,  0.000 sec (  0.584%)
 iterations                     ...        0 min,  0.003 sec ( 15.438%)
 molecular gradient             ...        0 min,  0.010 sec ( 49.807%)
 printout                       ...        0 min,  0.000 sec (  1.645%)

         :::::::::::::::::::::::::::::::::::::::::::::::::::::
         ::                     SUMMARY                     ::
         :::::::::::::::::::::::::::::::::::::::::::::::::::::
         :: total energy             -31.597189670679 Eh    ::
         :: gradient norm              0.000565902339 Eh/a0 ::
         :: HOMO-LUMO gap              0.585597720253 eV    ::
         ::.................................................::
         :: SCC energy               -32.150551823439 Eh    ::
         :: -> isotropic ES            0.022380023611 Eh    ::
         :: -> anisotropic ES          0.000996549110 Eh    ::
         :: -> anisotropic XC          0.017967225722 Eh    ::
         :: -> dispersion             -0.019315935106 Eh    ::
         :: repulsion energy           0.553340351417 Eh    ::
         :: add. restraining           0.000000000000 Eh    ::
         :::::::::::::::::::::::::::::::::::::::::::::::::::::

           -------------------------------------------------
          |                Property Printout                |
           -------------------------------------------------

    * Orbital Energies and Occupations

         #    Occupation            Energy/Eh            Energy/eV
      -------------------------------------------------------------
         1        2.0000           -0.7140747             -19.4310
       ...           ...                  ...                  ...
        17        2.0000           -0.5005864             -13.6217
        18        2.0000           -0.4974591             -13.5366
        19        2.0000           -0.4847131             -13.1897
        20        2.0000           -0.4825188             -13.1300
        21        2.0000           -0.4662202             -12.6865
        22        2.0000           -0.4611751             -12.5492
        23        2.0000           -0.4588742             -12.4866
        24        2.0000           -0.4464027             -12.1472
        25        2.0000           -0.4401584             -11.9773
        26        2.0000           -0.4297131             -11.6931
        27        2.0000           -0.4223584             -11.4930
        28        2.0000           -0.3925539             -10.6819
        29        2.0000           -0.3626646              -9.8686 (HOMO)
        30        0.0000           -0.3411443              -9.2830 (LUMO)
        31                         -0.2402868              -6.5385
        32                         -0.2337265              -6.3600
        33                         -0.1924564              -5.2370
        34                         -0.1292819              -3.5179
        35                         -0.0866793              -2.3587
        36                          0.0482561               1.3131
        37                          0.0834009               2.2695
        38                          0.1147740               3.1232
        39                          0.1231258               3.3504
        40                          0.1293029               3.5185
       ...                                ...                  ...
        56                          0.7350599              20.0020
      -------------------------------------------------------------
                  HL-Gap            0.0215203 Eh            0.5856 eV
             Fermi-level           -0.3519045 Eh           -9.5758 eV

     #   Z        covCN         q      C6AA      α(0)
     1   6 C      2.951    -0.092    30.320     9.031
     2   6 C      3.058     0.026    27.368     8.579
     3   6 C      2.902    -0.033    28.811     8.801
     4   6 C      2.913    -0.018    28.455     8.747
     5   6 C      2.913    -0.027    28.665     8.779
     6   6 C      2.902    -0.026    28.644     8.775
     7   6 C      3.050     0.004    27.879     8.660
     8   6 C      3.004    -0.025    28.610     8.774
     9   6 C      2.910     0.237    23.050     7.872
    10   8 O      0.856    -0.325    20.233     6.031
    11   6 C      2.889    -0.016    28.419     8.740
    12   6 C      2.841    -0.076    29.891     8.960
    13   1 H      0.926     0.053     2.287     2.365
    14   1 H      0.926     0.041     2.434     2.440
    15   1 H      0.926     0.039     2.458     2.452
    16   1 H      0.926     0.037     2.483     2.464
    17   1 H      0.926     0.039     2.466     2.456
    18   1 H      0.925     0.038     2.473     2.459
    19   1 H      0.926     0.077     2.011     2.217
    20   1 H      0.926     0.045     2.380     2.412

 Mol. C6AA /au·bohr⁶  :       5641.819150
 Mol. C8AA /au·bohr⁸  :     141844.203073
 Mol. α(0) /au        :        121.015891


Wiberg/Mayer (AO) data.
largest (>0.10) Wiberg bond orders for each atom
          total WBO             WBO to atom ...
     1  C   3.982        C    2 1.612    C    9 1.049    H   13 0.969    C    8 0.116
     2  C   3.984        C    1 1.612    C    3 1.170    C    7 1.039
     3  C   3.982        C    4 1.682    C    2 1.170    H   14 0.967    C    6 0.114
     4  C   3.970        C    3 1.682    C    5 1.182    H   15 0.971
     5  C   3.944        C    6 1.670    C    4 1.182    H   16 0.971
     6  C   3.993        C    5 1.670    C    7 1.190    H   17 0.965    C    3 0.114
     7  C   3.988        C    8 1.533    C    6 1.190    C    2 1.039    C   12 0.120
     8  C   3.985        C    7 1.533    C   11 1.202    C    9 0.936    C    1 0.116
     9  C   3.912        O   10 1.837    C    1 1.049    C    8 0.936
    10  O   2.079        C    9 1.837
    11  C   3.992        C   12 1.771    C    8 1.202    H   18 0.959
    12  C   3.933        C   11 1.771    H   20 0.979    H   19 0.970    C    7 0.120
    13  H   0.996        C    1 0.969
    14  H   0.998        C    3 0.967
    15  H   0.998        C    4 0.971
    16  H   0.998        C    5 0.971
    17  H   0.998        C    6 0.965
    18  H   0.998        C   11 0.959
    19  H   0.994        C   12 0.970
    20  H   0.997        C   12 0.979

molecular dipole:
                 x           y           z       tot (Debye)
 q only:       -1.156       0.221       0.127
   full:       -1.348       0.202       0.150       3.485
molecular quadrupole (traceless):
                xx          xy          yy          xz          yz          zz
 q only:       -7.744       2.178       7.702       1.014      -0.550       0.043
  q+dip:       -6.773       1.542      11.718       0.318      -0.755      -4.945
   full:       -9.735       1.565       9.468       1.321      -0.521       0.267

           -------------------------------------------------
          |                Geometry Summary                 |
           -------------------------------------------------

      molecular mass/u    :      156.1836000
   center of mass at/Å    :        0.7197772       0.5121598      -0.1628280
  moments of inertia/u·Å² :        0.2557161E+03   0.6698811E+03   0.9255914E+03
rotational constants/cm⁻¹ :        0.6592323E-01   0.2516511E-01   0.1821282E-01

 * 17 selected distances

     #   Z        #   Z                                     value/Å
     1   6 C      2   6 C                                 1.3568705
     2   6 C      3   6 C                                 1.4278063 (max)
     3   6 C      4   6 C                                 1.3518108
     5   6 C      6   6 C                                 1.3532639
     6   6 C      7   6 C                                 1.4242456
     7   6 C      8   6 C                                 1.3693562
     9   6 C     10   8 O                                 1.2080909
     8   6 C     11   6 C                                 1.4235988
    11   6 C     12   6 C                                 1.3403226
     1   6 C     13   1 H                                 1.0726558 (min)
     3   6 C     14   1 H                                 1.0795949
     4   6 C     15   1 H                                 1.0803827
     5   6 C     16   1 H                                 1.0799142
     6   6 C     17   1 H                                 1.0796986
    11   6 C     18   1 H                                 1.0840501
    12   6 C     19   1 H                                 1.0753619
    12   6 C     20   1 H                                 1.0764435

 * 3 distinct bonds (by element types)

   Z      Z             #   av. dist./Å        max./Å        min./Å
   1 H    6 C           8     1.0785127     1.0840501     1.0726558
   6 C    6 C           8     1.3809093     1.4278063     1.3403226
   6 C    8 O           1     1.2080909     1.2080909     1.2080909


optimized geometry written to: xtbopt.xyz


           -------------------------------------------------
          | TOTAL ENERGY              -31.597189670679 Eh   |
          | GRADIENT NORM               0.000565902339 Eh/α |
          | HOMO-LUMO GAP               0.585597720253 eV   |
           -------------------------------------------------

------------------------------------------------------------------------
 * finished run on 2021/05/19 at 10:59:23.024     
------------------------------------------------------------------------
 total:
 * wall-time:     0 d,  0 h,  0 min,  0.391 sec
 *  cpu-time:     0 d,  0 h,  0 min,  0.390 sec
 * ratio c/w:     0.997 speedup
 SCF:
 * wall-time:     0 d,  0 h,  0 min,  0.028 sec
 *  cpu-time:     0 d,  0 h,  0 min,  0.028 sec
 * ratio c/w:     0.997 speedup
 ANC optimizer:
 * wall-time:     0 d,  0 h,  0 min,  0.345 sec
 *  cpu-time:     0 d,  0 h,  0 min,  0.344 sec
 * ratio c/w:     0.998 speedup

