      -----------------------------------------------------------      
     |                   =====================                   |     
     |                           x T B                           |     
     |                   =====================                   |     
     |                         S. Grimme                         |     
     |          Mulliken Center for Theoretical Chemistry        |     
     |                    University of Bonn                     |     
     |                Version 6.2 RC2 (SAW190805)                |     
      -----------------------------------------------------------      

   This program is distributed in the hope that it will be useful,
   but WITHOUT ANY WARRANTY; without even the implied warranty of
   MERCHANTABILITY or FITNESS FOR A PARTICULAR PURPOSE.
   
   FOR NON-COMMERCIAL, ACADEMIA USE ONLY.
   
   Cite this work as:
   * S. Grimme, C. Bannwarth, P. Shushkov, J. Chem. Theory Comput., 2017,
     13, 1989-2009. DOI: 10.1021/acs.jctc.7b00118
   * C. Bannwarth, S. Ehlert and S. Grimme., J. Chem. Theory Comput., 2019,
     15, 1652-1671. DOI: 10.1021/acs.jctc.8b01176
   * P. Pracht, E. Caldeweyher, S. Ehlert, S. Grimme, ChemRxiv, 2019, preprint.
     DOI: 10.26434/chemrxiv.8326202.v1
   
   for DFT-D4:
   * E. Caldeweyher, C. Bannwarth and S. Grimme, J. Chem. Phys., 2017,
     147, 034112. DOI: 10.1063/1.4993215
   * E. Caldeweyher, S. Ehlert, A. Hansen, H. Neugebauer, S. Spicher,
     C. Bannwarth and S. Grimme, J. Chem. Phys., 2019, 150, 154122.
     DOI: 10.1063/1.5090222
   
   for sTDA-xTB:
   * S. Grimme and C. Bannwarth, J. Chem. Phys., 2016, 145, 054103.
     DOI: 10.1063/1.4959605
   
   in the mass-spec context:
   * V. Asgeirsson, C. Bauer and S. Grimme, Chem. Sci., 2017, 8, 4879.
     DOI: 10.1039/c7sc00601b
   
   for metadynamics refer to:
   * S. Grimme, J. Chem. Theory Comput., 2019, 155, 2847-2862
     DOI: 10.1021/acs.jctc.9b00143
   
   with help from (in alphabetical order)
   C. Bannwarth, F. Bohle, G. Brandenburg, E. Caldeweyher, M. Checinski,
   S. Dohm, S. Ehlert, S. Ehrlich, F. März, H. Neugebauer, J. Pisarek,
   P. Pracht, P. Shushkov, and S. Spicher.
   
 * started run on 2021/05/19 at 10:59:24.552     

           -------------------------------------------------
          |                Calculation Setup                |
           -------------------------------------------------

          program call               : /ihome/ghutchison/geoffh/xtb/xtb 607.xyz -opt
          hostname                   : smp-n144
          coordinate file            : 607.xyz
          omp threads                :                     1
          number of atoms            :                    11
          number of electrons        :                    36
          charge                     :                     0
          spin                       :                   0.0
          first test random number   :      0.55631514977980


########################################################################
# WARNING! Please study the warnings concerning your input carefully
#  - the use of '-opt' is discouraged, please use '--opt' next time
########################################################################

           ------------------------------------------------- 
          |                 G F N 2 - x T B                 |
          | Geometry, Frequencies, Noncovalent interactions |
          |            JCTC 2019 parametrisation            |
           ------------------------------------------------- 
             KAB for C  - Si     :                1.0500
             KAB for H  - Pd     :                0.9500
             k(s)              :                1.8500
             k(p)              :                2.2300
             k(d)              :                2.2300
             k(f)              :                2.0000
             kEN (H0ij)        :               -2.0000
             D4 a1             :                0.5200
             D4 a2             :                5.0000
             D4 s6             :                1.0000
             D4 s8             :                2.7000
             D4 s9             :                5.0000
             alphaj            :                2.0000

  Z AO/shell   Hii/eV     exponent
  1     Wed Apr 25 08:07:45 CEST 2018   EN: 2.200 GM2: 0.406  GM3: 0.0800  RAES: 1.40
     1s    -10.707211    1.230000
  6     Wed Apr 25 08:07:45 CEST 2018   EN: 2.550 GM2: 0.538  GM3: 0.1500  RAES: 3.00
     2s    -13.970922    2.096432
     2p    -10.063292    1.800000
  7     Wed Apr 25 08:07:45 CEST 2018   EN: 3.040 GM2: 0.461  GM3:-0.0640  RAES: 1.90
     2s    -16.686243    2.339881
     2p    -12.523956    2.014332
 16     Tue Apr 24 11:44:34 CEST 2018   EN: 2.580 GM2: 0.340  GM3:-0.0502  RAES: 3.10
     3s    -20.029654    1.981333
     3p    -11.377694    2.025643
     3d     -0.420282    1.702555

           ------------------------------------------------- 
          |        Self-Consistent Charge Iterations        |
           ------------------------------------------------- 

          ...................................................
          :                      SETUP                      :
          :.................................................:
          :  # basis functions                  38          :
          :  # atomic orbitals                  37          :
          :  # shells                           19          :
          :  # electrons                        36          :
          :  max. iterations                   250          :
          :  Hamiltonian                  GFN2-xTB          :
          :  restarted?                      false          :
          :  GBSA solvation                  false          :
          :  PC potential                    false          :
          :  electronic temp.          300.0000000     K    :
          :  accuracy                    1.0000000          :
          :  -> integral cutoff          0.2500000E+02      :
          :  -> integral neglect         0.1000000E-07      :
          :  -> SCF convergence          0.1000000E-05 Eh   :
          :  -> wf. convergence          0.1000000E-03 e    :
          :  Broyden damping             0.4000000          :
          ...................................................

 iter      E             dE          RMSdq      gap      omega  full diag
   1    -19.8597397 -0.198597E+02  0.494E+00    3.00       0.0  T
   2    -19.8701625 -0.104228E-01  0.276E+00    3.03       1.0  T
   3    -19.8689165  0.124605E-02  0.916E-01    2.62       1.0  T
   4    -19.8714866 -0.257012E-02  0.430E-01    2.81       1.0  T
   5    -19.8723121 -0.825459E-03  0.156E-01    2.74       1.0  T
   6    -19.8722995  0.125810E-04  0.836E-02    2.72       1.0  T
   7    -19.8723474 -0.479193E-04  0.314E-02    2.73       1.0  T
   8    -19.8723487 -0.135769E-05  0.109E-02    2.73       2.8  T
   9    -19.8723490 -0.223697E-06  0.320E-03    2.73       9.4  T
  10    -19.8723490 -0.320148E-07  0.179E-03    2.73      16.8  T
  11    -19.8723490 -0.933996E-08  0.558E-04    2.73      54.1  T
  12    -19.8723490 -0.335422E-09  0.163E-04    2.73     184.7  T

   *** convergence criteria satisfied after 12 iterations ***

         #    Occupation            Energy/Eh            Energy/eV
      -------------------------------------------------------------
         1        2.0000           -0.7579921             -20.6260
       ...           ...                  ...                  ...
        12        2.0000           -0.4826469             -13.1335
        13        2.0000           -0.4733201             -12.8797
        14        2.0000           -0.4638913             -12.6231
        15        2.0000           -0.4399380             -11.9713
        16        2.0000           -0.4191428             -11.4055
        17        2.0000           -0.4161553             -11.3242
        18        2.0000           -0.3980211             -10.8307 (HOMO)
        19                         -0.2975707              -8.0973 (LUMO)
        20                         -0.2532653              -6.8917
        21                         -0.2227704              -6.0619
        22                         -0.1854130              -5.0453
        23                         -0.1336809              -3.6376
       ...                                ...                  ...
        37                          0.6026026              16.3977
      -------------------------------------------------------------
                  HL-Gap            0.1004505 Eh            2.7334 eV
             Fermi-level           -0.3477959 Eh           -9.4640 eV

 SCC (total)                   0 d,  0 h,  0 min,  0.014 sec
 SCC setup                      ...        0 min,  0.000 sec (  1.203%)
 Dispersion                     ...        0 min,  0.000 sec (  0.672%)
 integral evaluation            ...        0 min,  0.003 sec ( 21.403%)
 zeroth order Hamiltonian       ...        0 min,  0.000 sec (  0.545%)
 iterations                     ...        0 min,  0.006 sec ( 43.175%)
 molecular gradient             ...        0 min,  0.004 sec ( 30.594%)
 printout                       ...        0 min,  0.000 sec (  2.057%)

         :::::::::::::::::::::::::::::::::::::::::::::::::::::
         ::                     SUMMARY                     ::
         :::::::::::::::::::::::::::::::::::::::::::::::::::::
         :: total energy             -19.631955926043 Eh    ::
         :: gradient norm              0.086171517519 Eh/a0 ::
         :: HOMO-LUMO gap              2.733396737387 eV    ::
         ::.................................................::
         :: SCC energy               -19.872349014542 Eh    ::
         :: -> isotropic ES            0.011795648176 Eh    ::
         :: -> anisotropic ES          0.004107105943 Eh    ::
         :: -> anisotropic XC          0.019305482783 Eh    ::
         :: -> dispersion             -0.008814752318 Eh    ::
         :: repulsion energy           0.240395919602 Eh    ::
         :: add. restraining           0.000000000000 Eh    ::
         :::::::::::::::::::::::::::::::::::::::::::::::::::::

      ----------------------------------------------------------- 
     |                   =====================                   |
     |                        A N C O P T                        |
     |                   =====================                   |
     |               Approximate Normal Coordinate               |
     |                Rational Function Optimizer                |
      ----------------------------------------------------------- 

          ...................................................
          :                      SETUP                      :
          :.................................................:
          :   optimization level            normal          :
          :   max. optcycles                   200          :
          :   ANC micro-cycles                  20          :
          :   degrees of freedom                27          :
          :.................................................:
          :   RF solver                   davidson          :
          :   input Hessian                  false          :
          :   write xtbopt.log                true          :
          :   linear?                        false          :
          :   energy convergence         0.5000000E-05 Eh   :
          :   grad. convergence          0.1000000E-02 Eh/α :
          :   maximium RF displ.         2.0000000          :
          :   Hlow (freq-cutoff)         0.5000000E-02      :
          :   Hmax (freq-cutoff)         5.0000000          :
          :   S6 in model hess.         20.0000000          :
          ...................................................

generating ANC from model Hessian ...
Using Lindh-Hessian (1995)
 Shifting diagonal of input Hessian by   2.258795783283574E-005
 Lowest  eigenvalues of input Hessian
   -0.000000    0.000000    0.000000    0.000000    0.000000    0.000000
    0.005000    0.009125    0.014634    0.018697    0.037169    0.052422
    0.055496    0.079828    0.099237    0.110104    0.120903    0.180648
 Highest eigenvalues
    1.362189    1.498943    1.575928    1.840448    1.923411    2.011483
 

........................................................................
.............................. CYCLE    1 ..............................
........................................................................
   1    -19.8723490 -0.198723E+02  0.485E-05    2.73       0.0  T
   2    -19.8723490 -0.185096E-11  0.286E-05    2.73    1055.9  T
   3    -19.8723490 -0.568434E-13  0.232E-05    2.73    1302.0  T
     SCC iter.                  ...        0 min,  0.002 sec
     gradient                   ...        0 min,  0.004 sec
 * total energy  :   -19.6319559 Eh     change       -0.1329347E-08 Eh
   gradient norm :     0.0861715 Eh/α   predicted     0.0000000E+00 (-100.00%)
   displ. norm   :     0.1526452 α      lambda       -0.7904761E-02
   maximum displ.:     0.0901526 α      in ANC's #10, #3, #15, ...

........................................................................
.............................. CYCLE    2 ..............................
........................................................................
   1    -19.8933625 -0.198934E+02  0.458E-01    2.66       0.0  T
   2    -19.8937890 -0.426480E-03  0.244E-01    2.77       1.0  T
   3    -19.8938890 -0.100033E-03  0.111E-01    2.71       1.0  T
   4    -19.8939113 -0.223122E-04  0.489E-02    2.72       1.0  T
   5    -19.8939201 -0.872626E-05  0.202E-02    2.72       1.5  T
   6    -19.8939200  0.818198E-07  0.983E-03    2.71       3.1  T
   7    -19.8939207 -0.716742E-06  0.210E-03    2.71      14.3  T
   8    -19.8939207  0.217019E-08  0.131E-03    2.71      23.0  T
     SCC iter.                  ...        0 min,  0.004 sec
     gradient                   ...        0 min,  0.004 sec
 * total energy  :   -19.6374519 Eh     change       -0.5495972E-02 Eh
   gradient norm :     0.0356837 Eh/α   predicted    -0.4044475E-02 ( -26.41%)
   displ. norm   :     0.1082262 α      lambda       -0.2113756E-02
   maximum displ.:     0.0607908 α      in ANC's #3, #10, #12, ...

........................................................................
.............................. CYCLE    3 ..............................
........................................................................
   1    -19.9024276 -0.199024E+02  0.311E-01    2.62       0.0  T
   2    -19.9026989 -0.271345E-03  0.179E-01    2.71       1.0  T
   3    -19.9027762 -0.773123E-04  0.830E-02    2.66       1.0  T
   4    -19.9027791 -0.282140E-05  0.389E-02    2.67       1.0  T
   5    -19.9027853 -0.621857E-05  0.164E-02    2.67       1.8  T
   6    -19.9027859 -0.585223E-06  0.827E-03    2.67       3.6  T
   7    -19.9027861 -0.252909E-06  0.144E-03    2.67      20.9  T
   8    -19.9027861 -0.116603E-08  0.657E-04    2.67      45.9  T
     SCC iter.                  ...        0 min,  0.004 sec
     gradient                   ...        0 min,  0.004 sec
 * total energy  :   -19.6385085 Eh     change       -0.1056649E-02 Eh
   gradient norm :     0.0089574 Eh/α   predicted    -0.1069258E-02 (   1.19%)
   displ. norm   :     0.0322294 α      lambda       -0.9812493E-04
   maximum displ.:     0.0264981 α      in ANC's #3, #7, #9, ...

........................................................................
.............................. CYCLE    4 ..............................
........................................................................
   1    -19.9011512 -0.199012E+02  0.451E-02    2.65       0.0  T
   2    -19.9011527 -0.149663E-05  0.271E-02    2.65       1.1  T
   3    -19.9011520  0.710327E-06  0.164E-02    2.65       1.8  T
   4    -19.9011534 -0.148413E-05  0.470E-03    2.65       6.4  T
   5    -19.9011535 -0.894844E-07  0.206E-03    2.65      14.6  T
   6    -19.9011535 -0.107285E-07  0.985E-04    2.65      30.6  T
     SCC iter.                  ...        0 min,  0.003 sec
     gradient                   ...        0 min,  0.004 sec
 * total energy  :   -19.6385779 Eh     change       -0.6934265E-04 Eh
   gradient norm :     0.0042605 Eh/α   predicted    -0.4911415E-04 ( -29.17%)
   displ. norm   :     0.0289514 α      lambda       -0.3821109E-04
   maximum displ.:     0.0251144 α      in ANC's #3, #9, #1, ...

........................................................................
.............................. CYCLE    5 ..............................
........................................................................
   1    -19.9002224 -0.199002E+02  0.458E-02    2.64       0.0  T
   2    -19.9002245 -0.214467E-05  0.268E-02    2.64       1.1  T
   3    -19.9002243  0.168570E-06  0.149E-02    2.64       2.0  T
   4    -19.9002252 -0.894075E-06  0.598E-03    2.64       5.0  T
   5    -19.9002254 -0.180460E-06  0.228E-03    2.64      13.2  T
   6    -19.9002254 -0.118168E-07  0.101E-03    2.64      30.0  T
     SCC iter.                  ...        0 min,  0.003 sec
     gradient                   ...        0 min,  0.004 sec
 * total energy  :   -19.6385977 Eh     change       -0.1984481E-04 Eh
   gradient norm :     0.0015177 Eh/α   predicted    -0.1912135E-04 (  -3.65%)
   displ. norm   :     0.0124582 α      lambda       -0.3744931E-05
   maximum displ.:     0.0068666 α      in ANC's #1, #8, #2, ...

........................................................................
.............................. CYCLE    6 ..............................
........................................................................
   1    -19.9003265 -0.199003E+02  0.318E-02    2.64       0.0  T
   2    -19.9003270 -0.468013E-06  0.150E-02    2.64       2.0  T
   3    -19.9003270  0.124392E-07  0.482E-03    2.64       6.2  T
   4    -19.9003270 -0.686063E-07  0.222E-03    2.64      13.6  T
   5    -19.9003271 -0.292423E-07  0.857E-04    2.64      35.2  T
   6    -19.9003271 -0.127348E-08  0.250E-04    2.64     120.7  T
     SCC iter.                  ...        0 min,  0.003 sec
     gradient                   ...        0 min,  0.004 sec
 * total energy  :   -19.6385989 Eh     change       -0.1135535E-05 Eh
   gradient norm :     0.0009574 Eh/α   predicted    -0.1873194E-05 (  64.96%)
   displ. norm   :     0.0081569 α      lambda       -0.2421513E-05
   maximum displ.:     0.0049684 α      in ANC's #4, #8, #2, ...

   *** GEOMETRY OPTIMIZATION CONVERGED AFTER 6 ITERATIONS ***

------------------------------------------------------------------------
 total energy gain   :        -0.0066429 Eh       -4.1685 kcal/mol
 total RMSD          :         0.0865047 a0        0.0458 Å
 total power (kW/mol):        -2.9068419 (step) -269.3769 (real)
------------------------------------------------------------------------

 ANCopt (total)                0 d,  0 h,  0 min,  0.065 sec
 optimizer setup                ...        0 min,  0.000 sec (  0.213%)
 model hessian                  ...        0 min,  0.001 sec (  0.943%)
 ANC generation                 ...        0 min,  0.000 sec (  0.408%)
 coordinate transformation      ...        0 min,  0.000 sec (  0.101%)
 single point calculation       ...        0 min,  0.062 sec ( 96.274%)
 optimization log               ...        0 min,  0.000 sec (  0.561%)
 hessian update                 ...        0 min,  0.000 sec (  0.093%)
 rational function              ...        0 min,  0.001 sec (  0.780%)

================
 final structure:
================
$coord
   -0.35248723811813    2.23840077510455    0.14560624336111      C 
    2.18412577850721    0.20599784920064    0.55935611987114      S 
    0.00610108242567   -2.21559235433592   -0.16792039401335      C 
   -2.22943873992720   -1.34445627140298   -0.62078054736334      N 
   -2.42669103385029    1.13003232530757   -0.44791064617903      N 
    0.74195933689145   -4.83293366134635   -0.22729986179999      C 
   -0.86444561119591   -6.67921936466586   -0.79280229836779      C 
   -0.16951226992989    4.24160637261011    0.36548220962375      H 
    2.69980294550217   -5.21032639635587    0.21751297003604      H 
   -2.80641885018966   -6.26576838987344   -1.23241817800226      H 
   -0.27781677622669   -8.62556801385118   -0.83039957406684      H 
$end
           -------------------------------------------------
          |                Final Singlepoint                |
           -------------------------------------------------

          ...................................................
          :                      SETUP                      :
          :.................................................:
          :  # basis functions                  38          :
          :  # atomic orbitals                  37          :
          :  # shells                           19          :
          :  # electrons                        36          :
          :  max. iterations                   250          :
          :  Hamiltonian                  GFN2-xTB          :
          :  restarted?                      false          :
          :  GBSA solvation                  false          :
          :  PC potential                    false          :
          :  electronic temp.          300.0000000     K    :
          :  accuracy                    1.0000000          :
          :  -> integral cutoff          0.2500000E+02      :
          :  -> integral neglect         0.1000000E-07      :
          :  -> SCF convergence          0.1000000E-05 Eh   :
          :  -> wf. convergence          0.1000000E-03 e    :
          :  Broyden damping             0.4000000          :
          ...................................................

 iter      E             dE          RMSdq      gap      omega  full diag
   1    -19.9003271 -0.199003E+02  0.117E-04    2.64       0.0  T
   2    -19.9003271 -0.127223E-10  0.482E-05    2.64     625.6  T
   3    -19.9003271 -0.318323E-11  0.471E-05    2.64     640.3  T

   *** convergence criteria satisfied after 3 iterations ***

         #    Occupation            Energy/Eh            Energy/eV
      -------------------------------------------------------------
         1        2.0000           -0.7526834             -20.4816
       ...           ...                  ...                  ...
        12        2.0000           -0.4829122             -13.1407
        13        2.0000           -0.4731015             -12.8737
        14        2.0000           -0.4616655             -12.5626
        15        2.0000           -0.4387085             -11.9379
        16        2.0000           -0.4230794             -11.5126
        17        2.0000           -0.4162734             -11.3274
        18        2.0000           -0.3928788             -10.6908 (HOMO)
        19                         -0.2958335              -8.0500 (LUMO)
        20                         -0.2407544              -6.5513
        21                         -0.2229807              -6.0676
        22                         -0.1783381              -4.8528
        23                         -0.1351535              -3.6777
       ...                                ...                  ...
        37                          0.6234767              16.9657
      -------------------------------------------------------------
                  HL-Gap            0.0970453 Eh            2.6407 eV
             Fermi-level           -0.3443561 Eh           -9.3704 eV

 SCC (total)                   0 d,  0 h,  0 min,  0.010 sec
 SCC setup                      ...        0 min,  0.000 sec (  1.071%)
 Dispersion                     ...        0 min,  0.000 sec (  0.479%)
 integral evaluation            ...        0 min,  0.003 sec ( 30.378%)
 zeroth order Hamiltonian       ...        0 min,  0.000 sec (  0.583%)
 iterations                     ...        0 min,  0.002 sec ( 18.665%)
 molecular gradient             ...        0 min,  0.004 sec ( 46.120%)
 printout                       ...        0 min,  0.000 sec (  2.234%)

         :::::::::::::::::::::::::::::::::::::::::::::::::::::
         ::                     SUMMARY                     ::
         :::::::::::::::::::::::::::::::::::::::::::::::::::::
         :: total energy             -19.638598862050 Eh    ::
         :: gradient norm              0.000958408744 Eh/a0 ::
         :: HOMO-LUMO gap              2.640736751428 eV    ::
         ::.................................................::
         :: SCC energy               -19.900327079764 Eh    ::
         :: -> isotropic ES            0.009905810830 Eh    ::
         :: -> anisotropic ES          0.003617188067 Eh    ::
         :: -> anisotropic XC          0.019136063437 Eh    ::
         :: -> dispersion             -0.008812631280 Eh    ::
         :: repulsion energy           0.261730972760 Eh    ::
         :: add. restraining           0.000000000000 Eh    ::
         :::::::::::::::::::::::::::::::::::::::::::::::::::::

           -------------------------------------------------
          |                Property Printout                |
           -------------------------------------------------

    * Orbital Energies and Occupations

         #    Occupation            Energy/Eh            Energy/eV
      -------------------------------------------------------------
         1        2.0000           -0.7526834             -20.4816
       ...           ...                  ...                  ...
         6        2.0000           -0.5919209             -16.1070
         7        2.0000           -0.5586290             -15.2011
         8        2.0000           -0.5489025             -14.9364
         9        2.0000           -0.5411405             -14.7252
        10        2.0000           -0.5206016             -14.1663
        11        2.0000           -0.5145709             -14.0022
        12        2.0000           -0.4829122             -13.1407
        13        2.0000           -0.4731015             -12.8737
        14        2.0000           -0.4616655             -12.5626
        15        2.0000           -0.4387085             -11.9379
        16        2.0000           -0.4230794             -11.5126
        17        2.0000           -0.4162734             -11.3274
        18        2.0000           -0.3928788             -10.6908 (HOMO)
        19                         -0.2958335              -8.0500 (LUMO)
        20                         -0.2407544              -6.5513
        21                         -0.2229807              -6.0676
        22                         -0.1783381              -4.8528
        23                         -0.1351535              -3.6777
        24                         -0.0271675              -0.7393
        25                          0.0060352               0.1642
        26                          0.0133869               0.3643
        27                          0.0735202               2.0006
        28                          0.1283766               3.4933
        29                          0.1396266               3.7994
       ...                                ...                  ...
        37                          0.6234767              16.9657
      -------------------------------------------------------------
                  HL-Gap            0.0970453 Eh            2.6407 eV
             Fermi-level           -0.3443561 Eh           -9.3704 eV

     #   Z        covCN         q      C6AA      α(0)
     1   6 C      2.929     0.070    26.428     8.431
     2  16 S      2.212    -0.058   143.442    20.158
     3   6 C      2.979     0.111    25.547     8.291
     4   7 N      2.106    -0.141    24.665     7.368
     5   7 N      2.097    -0.127    24.380     7.325
     6   6 C      2.912    -0.032    28.804     8.801
     7   6 C      2.844    -0.070    29.748     8.939
     8   1 H      0.926     0.059     2.214     2.327
     9   1 H      0.926     0.053     2.282     2.362
    10   1 H      0.926     0.075     2.032     2.229
    11   1 H      0.926     0.061     2.189     2.314

 Mol. C6AA /au·bohr⁶  :       2374.713537
 Mol. C8AA /au·bohr⁸  :      69444.425732
 Mol. α(0) /au        :         78.543533


Wiberg/Mayer (AO) data.
largest (>0.10) Wiberg bond orders for each atom
          total WBO             WBO to atom ...
     1  C   3.958        N    5 1.665    S    2 1.184    H    8 0.964
     2  S   2.678        C    1 1.184    C    3 1.108    N    5 0.163    N    4 0.152
     3  C   3.954        N    4 1.594    C    6 1.115    S    2 1.108
     4  N   3.147        C    3 1.594    N    5 1.249    S    2 0.152
     5  N   3.144        C    1 1.665    N    4 1.249    S    2 0.163
     6  C   3.990        C    7 1.874    C    3 1.115    H    9 0.964
     7  C   3.985        C    6 1.874    H   11 0.976    H   10 0.973
     8  H   0.996        C    1 0.964
     9  H   0.997        C    6 0.964
    10  H   0.994        C    7 0.973
    11  H   0.996        C    7 0.976

molecular dipole:
                 x           y           z       tot (Debye)
 q only:        0.417      -0.449       0.057
   full:        0.857      -0.326       0.172       2.372
molecular quadrupole (traceless):
                xx          xy          yy          xz          yz          zz
 q only:       -4.089       0.340       6.932      -0.225       0.961      -2.843
  q+dip:       -5.901       0.123       8.843      -0.629       1.093      -2.941
   full:       -7.074       0.030       8.278      -1.391       0.842      -1.204

           -------------------------------------------------
          |                Geometry Summary                 |
           -------------------------------------------------

      molecular mass/u    :      112.1490000
   center of mass at/Å    :       -0.0065299      -0.7095849      -0.0521295
  moments of inertia/u·Å² :        0.9875564E+02   0.2664875E+03   0.3652411E+03
rotational constants/cm⁻¹ :        0.1707004E+00   0.6325862E-01   0.4615481E-01

 * 9 selected distances

     #   Z        #   Z                                     value/Å
     1   6 C      2  16 S                                 1.7339142 (max)
     3   6 C      4   7 N                                 1.2920596
     1   6 C      5   7 N                                 1.2835210
     4   7 N      5   7 N                                 1.3167783
     6   6 C      7   6 C                                 1.3291834
     1   6 C      8   1 H                                 1.0708040 (min)
     6   6 C      9   1 H                                 1.0810556
     7   6 C     10   1 H                                 1.0761264
     7   6 C     11   1 H                                 1.0759125

 * 5 distinct bonds (by element types)

   Z      Z             #   av. dist./Å        max./Å        min./Å
   1 H    6 C           4     1.0759746     1.0810556     1.0708040
   6 C    6 C           1     1.3291834     1.3291834     1.3291834
   6 C    7 N           2     1.2877903     1.2920596     1.2835210
   7 N    7 N           1     1.3167783     1.3167783     1.3167783
   6 C   16 S           1     1.7339142     1.7339142     1.7339142


optimized geometry written to: xtbopt.xyz


           -------------------------------------------------
          | TOTAL ENERGY              -19.638598862050 Eh   |
          | GRADIENT NORM               0.000958408744 Eh/α |
          | HOMO-LUMO GAP               2.640736751428 eV   |
           -------------------------------------------------

------------------------------------------------------------------------
 * finished run on 2021/05/19 at 10:59:24.656     
------------------------------------------------------------------------
 total:
 * wall-time:     0 d,  0 h,  0 min,  0.104 sec
 *  cpu-time:     0 d,  0 h,  0 min,  0.103 sec
 * ratio c/w:     0.994 speedup
 SCF:
 * wall-time:     0 d,  0 h,  0 min,  0.015 sec
 *  cpu-time:     0 d,  0 h,  0 min,  0.014 sec
 * ratio c/w:     0.997 speedup
 ANC optimizer:
 * wall-time:     0 d,  0 h,  0 min,  0.075 sec
 *  cpu-time:     0 d,  0 h,  0 min,  0.075 sec
 * ratio c/w:     0.997 speedup

