      -----------------------------------------------------------      
     |                   =====================                   |     
     |                           x T B                           |     
     |                   =====================                   |     
     |                         S. Grimme                         |     
     |          Mulliken Center for Theoretical Chemistry        |     
     |                    University of Bonn                     |     
     |                Version 6.2 RC2 (SAW190805)                |     
      -----------------------------------------------------------      

   This program is distributed in the hope that it will be useful,
   but WITHOUT ANY WARRANTY; without even the implied warranty of
   MERCHANTABILITY or FITNESS FOR A PARTICULAR PURPOSE.
   
   FOR NON-COMMERCIAL, ACADEMIA USE ONLY.
   
   Cite this work as:
   * S. Grimme, C. Bannwarth, P. Shushkov, J. Chem. Theory Comput., 2017,
     13, 1989-2009. DOI: 10.1021/acs.jctc.7b00118
   * C. Bannwarth, S. Ehlert and S. Grimme., J. Chem. Theory Comput., 2019,
     15, 1652-1671. DOI: 10.1021/acs.jctc.8b01176
   * P. Pracht, E. Caldeweyher, S. Ehlert, S. Grimme, ChemRxiv, 2019, preprint.
     DOI: 10.26434/chemrxiv.8326202.v1
   
   for DFT-D4:
   * E. Caldeweyher, C. Bannwarth and S. Grimme, J. Chem. Phys., 2017,
     147, 034112. DOI: 10.1063/1.4993215
   * E. Caldeweyher, S. Ehlert, A. Hansen, H. Neugebauer, S. Spicher,
     C. Bannwarth and S. Grimme, J. Chem. Phys., 2019, 150, 154122.
     DOI: 10.1063/1.5090222
   
   for sTDA-xTB:
   * S. Grimme and C. Bannwarth, J. Chem. Phys., 2016, 145, 054103.
     DOI: 10.1063/1.4959605
   
   in the mass-spec context:
   * V. Asgeirsson, C. Bauer and S. Grimme, Chem. Sci., 2017, 8, 4879.
     DOI: 10.1039/c7sc00601b
   
   for metadynamics refer to:
   * S. Grimme, J. Chem. Theory Comput., 2019, 155, 2847-2862
     DOI: 10.1021/acs.jctc.9b00143
   
   with help from (in alphabetical order)
   C. Bannwarth, F. Bohle, G. Brandenburg, E. Caldeweyher, M. Checinski,
   S. Dohm, S. Ehlert, S. Ehrlich, F. März, H. Neugebauer, J. Pisarek,
   P. Pracht, P. Shushkov, and S. Spicher.
   
 * started run on 2021/05/19 at 10:58:36.325     

           -------------------------------------------------
          |                Calculation Setup                |
           -------------------------------------------------

          program call               : /ihome/ghutchison/geoffh/xtb/xtb 61.xyz -opt
          hostname                   : smp-n58
          coordinate file            : 61.xyz
          omp threads                :                     1
          number of atoms            :                    17
          number of electrons        :                    46
          charge                     :                     0
          spin                       :                   0.0
          first test random number   :      0.07042917003225


########################################################################
# WARNING! Please study the warnings concerning your input carefully
#  - the use of '-opt' is discouraged, please use '--opt' next time
########################################################################

           ------------------------------------------------- 
          |                 G F N 2 - x T B                 |
          | Geometry, Frequencies, Noncovalent interactions |
          |            JCTC 2019 parametrisation            |
           ------------------------------------------------- 
             KAB for C  - Si     :                1.0500
             KAB for H  - Pd     :                0.9500
             k(s)              :                1.8500
             k(p)              :                2.2300
             k(d)              :                2.2300
             k(f)              :                2.0000
             kEN (H0ij)        :               -2.0000
             D4 a1             :                0.5200
             D4 a2             :                5.0000
             D4 s6             :                1.0000
             D4 s8             :                2.7000
             D4 s9             :                5.0000
             alphaj            :                2.0000

  Z AO/shell   Hii/eV     exponent
  1     Wed Apr 25 08:07:45 CEST 2018   EN: 2.200 GM2: 0.406  GM3: 0.0800  RAES: 1.40
     1s    -10.707211    1.230000
  6     Wed Apr 25 08:07:45 CEST 2018   EN: 2.550 GM2: 0.538  GM3: 0.1500  RAES: 3.00
     2s    -13.970922    2.096432
     2p    -10.063292    1.800000
  7     Wed Apr 25 08:07:45 CEST 2018   EN: 3.040 GM2: 0.461  GM3:-0.0640  RAES: 1.90
     2s    -16.686243    2.339881
     2p    -12.523956    2.014332

           ------------------------------------------------- 
          |        Self-Consistent Charge Iterations        |
           ------------------------------------------------- 

          ...................................................
          :                      SETUP                      :
          :.................................................:
          :  # basis functions                  44          :
          :  # atomic orbitals                  44          :
          :  # shells                           26          :
          :  # electrons                        46          :
          :  max. iterations                   250          :
          :  Hamiltonian                  GFN2-xTB          :
          :  restarted?                      false          :
          :  GBSA solvation                  false          :
          :  PC potential                    false          :
          :  electronic temp.          300.0000000     K    :
          :  accuracy                    1.0000000          :
          :  -> integral cutoff          0.2500000E+02      :
          :  -> integral neglect         0.1000000E-07      :
          :  -> SCF convergence          0.1000000E-05 Eh   :
          :  -> wf. convergence          0.1000000E-03 e    :
          :  Broyden damping             0.4000000          :
          ...................................................

 iter      E             dE          RMSdq      gap      omega  full diag
   1    -25.1977132 -0.251977E+02  0.450E+00    3.07       0.0  T
   2    -25.2239232 -0.262100E-01  0.315E+00    3.38       1.0  T
   3    -25.2176346  0.628855E-02  0.159E+00    3.00       1.0  T
   4    -25.2334023 -0.157676E-01  0.531E-01    3.17       1.0  T
   5    -25.2354141 -0.201187E-02  0.166E-01    3.09       1.0  T
   6    -25.2357126 -0.298443E-03  0.561E-02    3.11       1.0  T
   7    -25.2357248 -0.122143E-04  0.236E-02    3.11       1.0  T
   8    -25.2357255 -0.716086E-06  0.487E-03    3.11       5.0  T
   9    -25.2357257 -0.206335E-06  0.227E-03    3.11      10.7  T
  10    -25.2357257 -0.913769E-08  0.691E-04    3.11      35.1  T
  11    -25.2357257 -0.344152E-08  0.301E-04    3.11      80.5  T

   *** convergence criteria satisfied after 11 iterations ***

         #    Occupation            Energy/Eh            Energy/eV
      -------------------------------------------------------------
         1        2.0000           -0.6711265             -18.2623
       ...           ...                  ...                  ...
        17        2.0000           -0.4697678             -12.7830
        18        2.0000           -0.4297948             -11.6953
        19        2.0000           -0.4236247             -11.5274
        20        2.0000           -0.4199392             -11.4271
        21        2.0000           -0.3978194             -10.8252
        22        2.0000           -0.3970158             -10.8033
        23        2.0000           -0.3606221              -9.8130 (HOMO)
        24                         -0.2462978              -6.7021 (LUMO)
        25                         -0.2217738              -6.0348
        26                         -0.2048066              -5.5731
        27                         -0.0908127              -2.4711
        28                         -0.0061841              -0.1683
       ...                                ...                  ...
        44                          0.6367453              17.3267
      -------------------------------------------------------------
                  HL-Gap            0.1143243 Eh            3.1109 eV
             Fermi-level           -0.3034599 Eh           -8.2576 eV

 SCC (total)                   0 d,  0 h,  0 min,  0.018 sec
 SCC setup                      ...        0 min,  0.000 sec (  1.160%)
 Dispersion                     ...        0 min,  0.000 sec (  1.122%)
 integral evaluation            ...        0 min,  0.004 sec ( 20.217%)
 zeroth order Hamiltonian       ...        0 min,  0.000 sec (  0.456%)
 iterations                     ...        0 min,  0.007 sec ( 41.006%)
 molecular gradient             ...        0 min,  0.006 sec ( 34.157%)
 printout                       ...        0 min,  0.000 sec (  1.612%)

         :::::::::::::::::::::::::::::::::::::::::::::::::::::
         ::                     SUMMARY                     ::
         :::::::::::::::::::::::::::::::::::::::::::::::::::::
         :: total energy             -24.847918666412 Eh    ::
         :: gradient norm              0.066521695305 Eh/a0 ::
         :: HOMO-LUMO gap              3.110923012215 eV    ::
         ::.................................................::
         :: SCC energy               -25.235725722254 Eh    ::
         :: -> isotropic ES            0.006553632924 Eh    ::
         :: -> anisotropic ES          0.004280668128 Eh    ::
         :: -> anisotropic XC          0.024203287541 Eh    ::
         :: -> dispersion             -0.013047738729 Eh    ::
         :: repulsion energy           0.387827116938 Eh    ::
         :: add. restraining           0.000000000000 Eh    ::
         :::::::::::::::::::::::::::::::::::::::::::::::::::::

      ----------------------------------------------------------- 
     |                   =====================                   |
     |                        A N C O P T                        |
     |                   =====================                   |
     |               Approximate Normal Coordinate               |
     |                Rational Function Optimizer                |
      ----------------------------------------------------------- 

          ...................................................
          :                      SETUP                      :
          :.................................................:
          :   optimization level            normal          :
          :   max. optcycles                   200          :
          :   ANC micro-cycles                  20          :
          :   degrees of freedom                45          :
          :.................................................:
          :   RF solver                   davidson          :
          :   input Hessian                  false          :
          :   write xtbopt.log                true          :
          :   linear?                        false          :
          :   energy convergence         0.5000000E-05 Eh   :
          :   grad. convergence          0.1000000E-02 Eh/α :
          :   maximium RF displ.         2.0000000          :
          :   Hlow (freq-cutoff)         0.5000000E-02      :
          :   Hmax (freq-cutoff)         5.0000000          :
          :   S6 in model hess.         20.0000000          :
          ...................................................

generating ANC from model Hessian ...
Using Lindh-Hessian (1995)
 Shifting diagonal of input Hessian by   2.665865409258133E-003
 Lowest  eigenvalues of input Hessian
   -0.000000   -0.000000   -0.000000   -0.000000    0.000000    0.000000
    0.005000    0.007147    0.008412    0.013020    0.016704    0.022465
    0.023746    0.027140    0.035161    0.048162    0.053628    0.070849
 Highest eigenvalues
    1.664450    1.690723    1.853089    1.939764    1.971616    2.065532
 

........................................................................
.............................. CYCLE    1 ..............................
........................................................................
   1    -25.2357257 -0.252357E+02  0.146E-04    3.11       0.0  T
   2    -25.2357257 -0.456701E-10  0.933E-05    3.11     260.0  T
   3    -25.2357257 -0.136957E-10  0.594E-05    3.11     408.4  T
     SCC iter.                  ...        0 min,  0.002 sec
     gradient                   ...        0 min,  0.006 sec
 * total energy  :   -24.8479187 Eh     change       -0.1607377E-07 Eh
   gradient norm :     0.0665224 Eh/α   predicted     0.0000000E+00 (-100.00%)
   displ. norm   :     0.3368248 α      lambda       -0.8976803E-02
   maximum displ.:     0.1962585 α      in ANC's #4, #2, #6, ...

........................................................................
.............................. CYCLE    2 ..............................
........................................................................
   1    -25.2679556 -0.252680E+02  0.367E-01    3.30       0.0  T
   2    -25.2680367 -0.811586E-04  0.205E-01    3.33       1.0  T
   3    -25.2679257  0.111020E-03  0.135E-01    3.30       1.0  T
   4    -25.2681214 -0.195710E-03  0.183E-02    3.31       1.3  T
   5    -25.2681227 -0.125023E-05  0.889E-03    3.31       2.7  T
   6    -25.2681229 -0.249715E-06  0.263E-03    3.31       9.2  T
   7    -25.2681229 -0.217106E-07  0.800E-04    3.31      30.3  T
     SCC iter.                  ...        0 min,  0.004 sec
     gradient                   ...        0 min,  0.005 sec
 * total energy  :   -24.8543561 Eh     change       -0.6437446E-02 Eh
   gradient norm :     0.0314011 Eh/α   predicted    -0.4997616E-02 ( -22.37%)
   displ. norm   :     0.3382727 α      lambda       -0.5604667E-02
   maximum displ.:     0.1800529 α      in ANC's #6, #4, #25, ...

........................................................................
.............................. CYCLE    3 ..............................
........................................................................
   1    -25.2873726 -0.252874E+02  0.540E-01    3.38       0.0  T
   2    -25.2876154 -0.242812E-03  0.304E-01    3.44       1.0  T
   3    -25.2875002  0.115269E-03  0.202E-01    3.39       1.0  T
   4    -25.2878688 -0.368626E-03  0.228E-02    3.42       1.1  T
   5    -25.2878707 -0.185808E-05  0.103E-02    3.42       2.3  T
   6    -25.2878711 -0.429466E-06  0.520E-03    3.42       4.7  T
   7    -25.2878712 -0.726415E-07  0.898E-04    3.42      27.0  T
     SCC iter.                  ...        0 min,  0.004 sec
     gradient                   ...        0 min,  0.005 sec
 * total energy  :   -24.8570415 Eh     change       -0.2685380E-02 Eh
   gradient norm :     0.0291816 Eh/α   predicted    -0.3122997E-02 (  16.30%)
   displ. norm   :     0.3052009 α      lambda       -0.2292890E-02
   maximum displ.:     0.1691146 α      in ANC's #4, #2, #1, ...

........................................................................
.............................. CYCLE    4 ..............................
........................................................................
   1    -25.2834634 -0.252835E+02  0.322E-01    3.39       0.0  T
   2    -25.2835411 -0.777091E-04  0.184E-01    3.41       1.0  T
   3    -25.2834771  0.640209E-04  0.114E-01    3.39       1.0  T
   4    -25.2836134 -0.136240E-03  0.158E-02    3.41       1.5  T
   5    -25.2836140 -0.689152E-06  0.771E-03    3.41       3.1  T
   6    -25.2836142 -0.162863E-06  0.323E-03    3.41       7.5  T
   7    -25.2836143 -0.496514E-07  0.514E-04    3.41      47.2  T
     SCC iter.                  ...        0 min,  0.004 sec
     gradient                   ...        0 min,  0.005 sec
 * total energy  :   -24.8578837 Eh     change       -0.8422289E-03 Eh
   gradient norm :     0.0260586 Eh/α   predicted    -0.1253236E-02 (  48.80%)
   displ. norm   :     0.1093447 α      lambda       -0.1082239E-02
   maximum displ.:     0.0618884 α      in ANC's #4, #7, #3, ...

........................................................................
.............................. CYCLE    5 ..............................
........................................................................
   1    -25.2828493 -0.252828E+02  0.114E-01    3.41       0.0  T
   2    -25.2828619 -0.126129E-04  0.647E-02    3.42       1.0  T
   3    -25.2828559  0.596866E-05  0.437E-02    3.41       1.0  T
   4    -25.2828704 -0.144561E-04  0.699E-03    3.42       3.5  T
   5    -25.2828704 -0.467064E-07  0.413E-03    3.42       5.9  T
   6    -25.2828706 -0.149720E-06  0.123E-03    3.42      19.7  T
     SCC iter.                  ...        0 min,  0.004 sec
     gradient                   ...        0 min,  0.006 sec
 * total energy  :   -24.8584834 Eh     change       -0.5996354E-03 Eh
   gradient norm :     0.0077828 Eh/α   predicted    -0.5475889E-03 (  -8.68%)
   displ. norm   :     0.1023515 α      lambda       -0.3525857E-03
   maximum displ.:     0.0588535 α      in ANC's #6, #1, #2, ...

........................................................................
.............................. CYCLE    6 ..............................
........................................................................
   1    -25.2833361 -0.252833E+02  0.119E-01    3.43       0.0  T
   2    -25.2833430 -0.693433E-05  0.658E-02    3.44       1.0  T
   3    -25.2833321  0.108620E-04  0.404E-02    3.43       1.0  T
   4    -25.2833493 -0.171504E-04  0.323E-03    3.43       7.5  T
   5    -25.2833493 -0.747532E-08  0.187E-03    3.43      12.9  T
   6    -25.2833493 -0.213378E-07  0.579E-04    3.43      41.9  T
     SCC iter.                  ...        0 min,  0.003 sec
     gradient                   ...        0 min,  0.005 sec
 * total energy  :   -24.8586702 Eh     change       -0.1867841E-03 Eh
   gradient norm :     0.0104696 Eh/α   predicted    -0.1781407E-03 (  -4.63%)
   displ. norm   :     0.0792212 α      lambda       -0.1867497E-03
   maximum displ.:     0.0521790 α      in ANC's #1, #3, #2, ...

........................................................................
.............................. CYCLE    7 ..............................
........................................................................
   1    -25.2836848 -0.252837E+02  0.110E-01    3.42       0.0  T
   2    -25.2836898 -0.504626E-05  0.598E-02    3.42       1.0  T
   3    -25.2836908 -0.995026E-06  0.803E-03    3.43       3.0  T
   4    -25.2836915 -0.675665E-06  0.327E-03    3.42       7.4  T
   5    -25.2836915 -0.322527E-07  0.121E-03    3.43      20.1  T
   6    -25.2836915 -0.415156E-08  0.483E-04    3.42      50.2  T
     SCC iter.                  ...        0 min,  0.003 sec
     gradient                   ...        0 min,  0.005 sec
 * total energy  :   -24.8587769 Eh     change       -0.1067884E-03 Eh
   gradient norm :     0.0050695 Eh/α   predicted    -0.9395944E-04 ( -12.01%)
   displ. norm   :     0.0248218 α      lambda       -0.4326591E-04
   maximum displ.:     0.0149997 α      in ANC's #6, #11, #13, ...

........................................................................
.............................. CYCLE    8 ..............................
........................................................................
   1    -25.2843319 -0.252843E+02  0.416E-02    3.43       0.0  T
   2    -25.2843336 -0.165566E-05  0.225E-02    3.43       1.1  T
   3    -25.2843329  0.705105E-06  0.157E-02    3.43       1.5  T
   4    -25.2843350 -0.209765E-05  0.141E-03    3.43      17.2  T
   5    -25.2843350 -0.462446E-08  0.696E-04    3.43      34.9  T
     SCC iter.                  ...        0 min,  0.003 sec
     gradient                   ...        0 min,  0.005 sec
 * total energy  :   -24.8588038 Eh     change       -0.2683218E-04 Eh
   gradient norm :     0.0026470 Eh/α   predicted    -0.2164721E-04 ( -19.32%)
   displ. norm   :     0.0327658 α      lambda       -0.2423796E-04
   maximum displ.:     0.0252911 α      in ANC's #2, #1, #4, ...

........................................................................
.............................. CYCLE    9 ..............................
........................................................................
   1    -25.2852303 -0.252852E+02  0.395E-02    3.43       0.0  T
   2    -25.2852314 -0.112134E-05  0.223E-02    3.43       1.1  T
   3    -25.2852304  0.955929E-06  0.134E-02    3.43       1.8  T
   4    -25.2852323 -0.184647E-05  0.140E-03    3.43      17.4  T
   5    -25.2852323 -0.790734E-08  0.713E-04    3.43      34.0  T
   6    -25.2852323 -0.244953E-08  0.307E-04    3.43      79.1  T
     SCC iter.                  ...        0 min,  0.003 sec
     gradient                   ...        0 min,  0.006 sec
 * total energy  :   -24.8588199 Eh     change       -0.1617246E-04 Eh
   gradient norm :     0.0024258 Eh/α   predicted    -0.1213332E-04 ( -24.98%)
   displ. norm   :     0.0572194 α      lambda       -0.3307196E-04
   maximum displ.:     0.0342583 α      in ANC's #2, #1, #6, ...

........................................................................
.............................. CYCLE   10 ..............................
........................................................................
   1    -25.2851938 -0.252852E+02  0.663E-02    3.43       0.0  T
   2    -25.2851957 -0.193689E-05  0.363E-02    3.43       1.0  T
   3    -25.2851941  0.162030E-05  0.150E-02    3.43       1.6  T
   4    -25.2851967 -0.265040E-05  0.179E-03    3.43      13.5  T
   5    -25.2851967 -0.239740E-08  0.985E-04    3.43      24.6  T
   6    -25.2851967 -0.859308E-08  0.180E-04    3.43     134.7  T
     SCC iter.                  ...        0 min,  0.003 sec
     gradient                   ...        0 min,  0.005 sec
 * total energy  :   -24.8588420 Eh     change       -0.2201390E-04 Eh
   gradient norm :     0.0028383 Eh/α   predicted    -0.1659078E-04 ( -24.63%)
   displ. norm   :     0.0834851 α      lambda       -0.3386906E-04
   maximum displ.:     0.0638816 α      in ANC's #2, #1, #6, ...

........................................................................
.............................. CYCLE   11 ..............................
........................................................................
   1    -25.2849990 -0.252850E+02  0.918E-02    3.43       0.0  T
   2    -25.2850021 -0.309729E-05  0.499E-02    3.43       1.0  T
   3    -25.2850031 -0.100114E-05  0.448E-03    3.43       5.4  T
   4    -25.2850032 -0.115020E-06  0.242E-03    3.43      10.0  T
   5    -25.2850032 -0.188956E-07  0.510E-04    3.43      47.6  T
   6    -25.2850032 -0.386225E-08  0.115E-04    3.43     211.3  T
     SCC iter.                  ...        0 min,  0.003 sec
     gradient                   ...        0 min,  0.006 sec
 * total energy  :   -24.8588656 Eh     change       -0.2363641E-04 Eh
   gradient norm :     0.0028987 Eh/α   predicted    -0.1705366E-04 ( -27.85%)
   displ. norm   :     0.0677843 α      lambda       -0.2107525E-04
   maximum displ.:     0.0546873 α      in ANC's #2, #1, #6, ...

........................................................................
.............................. CYCLE   12 ..............................
........................................................................
   1    -25.2844411 -0.252844E+02  0.749E-02    3.42       0.0  T
   2    -25.2844436 -0.255851E-05  0.407E-02    3.42       1.0  T
   3    -25.2844413  0.234005E-05  0.173E-02    3.42       1.4  T
   4    -25.2844450 -0.368904E-05  0.207E-03    3.42      11.7  T
   5    -25.2844450 -0.340829E-08  0.972E-04    3.42      25.0  T
   6    -25.2844450 -0.393303E-08  0.344E-04    3.42      70.6  T
     SCC iter.                  ...        0 min,  0.004 sec
     gradient                   ...        0 min,  0.006 sec
 * total energy  :   -24.8588780 Eh     change       -0.1243571E-04 Eh
   gradient norm :     0.0012908 Eh/α   predicted    -0.1058664E-04 ( -14.87%)
   displ. norm   :     0.0194906 α      lambda       -0.4281137E-05
   maximum displ.:     0.0102735 α      in ANC's #2, #3, #4, ...

........................................................................
.............................. CYCLE   13 ..............................
........................................................................
   1    -25.2845914 -0.252846E+02  0.186E-02    3.42       0.0  T
   2    -25.2845917 -0.268118E-06  0.103E-02    3.43       2.4  T
   3    -25.2845916  0.116060E-06  0.689E-03    3.42       3.5  T
   4    -25.2845919 -0.362131E-06  0.768E-04    3.43      31.6  T
   5    -25.2845919 -0.445937E-08  0.440E-04    3.43      55.2  T
     SCC iter.                  ...        0 min,  0.003 sec
     gradient                   ...        0 min,  0.006 sec
 * total energy  :   -24.8588801 Eh     change       -0.2020859E-05 Eh
   gradient norm :     0.0008790 Eh/α   predicted    -0.2139179E-05 (   5.85%)
   displ. norm   :     0.0076544 α      lambda       -0.1302087E-05
   maximum displ.:     0.0042722 α      in ANC's #1, #3, #6, ...

   *** GEOMETRY OPTIMIZATION CONVERGED AFTER 13 ITERATIONS ***

------------------------------------------------------------------------
 total energy gain   :        -0.0109614 Eh       -6.8784 kcal/mol
 total RMSD          :         0.2242327 a0        0.1187 Å
 total power (kW/mol):        -2.2137788 (step) -167.5679 (real)
------------------------------------------------------------------------

 ANCopt (total)                0 d,  0 h,  0 min,  0.172 sec
 optimizer setup                ...        0 min,  0.000 sec (  0.065%)
 model hessian                  ...        0 min,  0.002 sec (  0.981%)
 ANC generation                 ...        0 min,  0.000 sec (  0.268%)
 coordinate transformation      ...        0 min,  0.000 sec (  0.090%)
 single point calculation       ...        0 min,  0.165 sec ( 96.341%)
 optimization log               ...        0 min,  0.001 sec (  0.516%)
 hessian update                 ...        0 min,  0.000 sec (  0.072%)
 rational function              ...        0 min,  0.002 sec (  1.226%)

================
 final structure:
================
$coord
    2.55345886763709   -2.01008110698358   -3.81455972381479      C 
    4.93947559256125   -2.00344023259874   -3.94378659467073      N 
    6.32602438779973   -1.76998816834377   -1.87145527342451      N 
    8.93542294565269   -1.76115028851132   -1.94188355443966      C 
   10.22898458779094   -1.99751521520522   -4.22476915210141      C 
   12.83754278099152   -1.98474741896251   -4.24544665117206      C 
   14.18719915965789   -1.73945256206208   -2.01405326322013      C 
   12.90341332610769   -1.50447110887065    0.25476388104888      C 
   10.29321025966491   -1.51390074000235    0.30176634324517      C 
    1.51688716182961   -2.20316328759138   -5.54874792112568      H 
    1.49575034525123   -1.83133673049546   -2.05199977359918      H 
    5.46629108229467   -1.58936852543116   -0.15306394178402      H 
    9.15413748379290   -2.18704248117698   -5.94489878749488      H 
   13.82931279258925   -2.16779527768534   -6.02012507519227      H 
   16.22695084728572   -1.73132524504045   -2.04174665764242      H 
   13.94106651416392   -1.31238803683652    2.00217845230975      H 
    9.29326354978707   -1.33062023948742    2.07437903165956      H 
$end
           -------------------------------------------------
          |                Final Singlepoint                |
           -------------------------------------------------

          ...................................................
          :                      SETUP                      :
          :.................................................:
          :  # basis functions                  44          :
          :  # atomic orbitals                  44          :
          :  # shells                           26          :
          :  # electrons                        46          :
          :  max. iterations                   250          :
          :  Hamiltonian                  GFN2-xTB          :
          :  restarted?                      false          :
          :  GBSA solvation                  false          :
          :  PC potential                    false          :
          :  electronic temp.          300.0000000     K    :
          :  accuracy                    1.0000000          :
          :  -> integral cutoff          0.2500000E+02      :
          :  -> integral neglect         0.1000000E-07      :
          :  -> SCF convergence          0.1000000E-05 Eh   :
          :  -> wf. convergence          0.1000000E-03 e    :
          :  Broyden damping             0.4000000          :
          ...................................................

 iter      E             dE          RMSdq      gap      omega  full diag
   1    -25.2845919 -0.252846E+02  0.151E-04    3.43       0.0  T
   2    -25.2845919 -0.387494E-10  0.697E-05    3.43     348.2  T
   3    -25.2845919 -0.184635E-10  0.647E-05    3.43     375.1  T

   *** convergence criteria satisfied after 3 iterations ***

         #    Occupation            Energy/Eh            Energy/eV
      -------------------------------------------------------------
         1        2.0000           -0.6766079             -18.4114
       ...           ...                  ...                  ...
        17        2.0000           -0.4728658             -12.8673
        18        2.0000           -0.4301459             -11.7049
        19        2.0000           -0.4237226             -11.5301
        20        2.0000           -0.4200343             -11.4297
        21        2.0000           -0.4006344             -10.9018
        22        2.0000           -0.3888752             -10.5818
        23        2.0000           -0.3607493              -9.8165 (HOMO)
        24                         -0.2348814              -6.3914 (LUMO)
        25                         -0.2181060              -5.9350
        26                         -0.1912137              -5.2032
        27                         -0.0808242              -2.1993
        28                          0.0030820               0.0839
       ...                                ...                  ...
        44                          0.6740845              18.3428
      -------------------------------------------------------------
                  HL-Gap            0.1258679 Eh            3.4250 eV
             Fermi-level           -0.2978154 Eh           -8.1040 eV

 SCC (total)                   0 d,  0 h,  0 min,  0.013 sec
 SCC setup                      ...        0 min,  0.000 sec (  1.144%)
 Dispersion                     ...        0 min,  0.000 sec (  0.824%)
 integral evaluation            ...        0 min,  0.004 sec ( 28.419%)
 zeroth order Hamiltonian       ...        0 min,  0.000 sec (  0.593%)
 iterations                     ...        0 min,  0.002 sec ( 18.022%)
 molecular gradient             ...        0 min,  0.006 sec ( 48.817%)
 printout                       ...        0 min,  0.000 sec (  1.800%)

         :::::::::::::::::::::::::::::::::::::::::::::::::::::
         ::                     SUMMARY                     ::
         :::::::::::::::::::::::::::::::::::::::::::::::::::::
         :: total energy             -24.858880039887 Eh    ::
         :: gradient norm              0.000878760787 Eh/a0 ::
         :: HOMO-LUMO gap              3.425039281608 eV    ::
         ::.................................................::
         :: SCC energy               -25.284591945401 Eh    ::
         :: -> isotropic ES            0.005977148526 Eh    ::
         :: -> anisotropic ES          0.003674955356 Eh    ::
         :: -> anisotropic XC          0.022285300848 Eh    ::
         :: -> dispersion             -0.013150660270 Eh    ::
         :: repulsion energy           0.425731448414 Eh    ::
         :: add. restraining           0.000000000000 Eh    ::
         :::::::::::::::::::::::::::::::::::::::::::::::::::::

           -------------------------------------------------
          |                Property Printout                |
           -------------------------------------------------

    * Orbital Energies and Occupations

         #    Occupation            Energy/Eh            Energy/eV
      -------------------------------------------------------------
         1        2.0000           -0.6766079             -18.4114
       ...           ...                  ...                  ...
        11        2.0000           -0.5277141             -14.3598
        12        2.0000           -0.5103112             -13.8863
        13        2.0000           -0.4893636             -13.3163
        14        2.0000           -0.4838138             -13.1652
        15        2.0000           -0.4756218             -12.9423
        16        2.0000           -0.4733370             -12.8802
        17        2.0000           -0.4728658             -12.8673
        18        2.0000           -0.4301459             -11.7049
        19        2.0000           -0.4237226             -11.5301
        20        2.0000           -0.4200343             -11.4297
        21        2.0000           -0.4006344             -10.9018
        22        2.0000           -0.3888752             -10.5818
        23        2.0000           -0.3607493              -9.8165 (HOMO)
        24                         -0.2348814              -6.3914 (LUMO)
        25                         -0.2181060              -5.9350
        26                         -0.1912137              -5.2032
        27                         -0.0808242              -2.1993
        28                          0.0030820               0.0839
        29                          0.1142366               3.1085
        30                          0.1330225               3.6197
        31                          0.1476655               4.0182
        32                          0.1499075               4.0792
        33                          0.1809267               4.9233
        34                          0.1931914               5.2570
       ...                                ...                  ...
        44                          0.6740845              18.3428
      -------------------------------------------------------------
                  HL-Gap            0.1258679 Eh            3.4250 eV
             Fermi-level           -0.2978154 Eh           -8.1040 eV

     #   Z        covCN         q      C6AA      α(0)
     1   6 C      2.806    -0.020    28.500     8.746
     2   7 N      1.900    -0.136    24.734     7.373
     3   7 N      2.806    -0.048    22.156     6.991
     4   6 C      2.912     0.064    26.564     8.452
     5   6 C      2.922    -0.048    29.201     8.862
     6   6 C      2.920    -0.028    28.706     8.786
     7   6 C      2.919    -0.041    29.026     8.835
     8   6 C      2.920    -0.029    28.717     8.788
     9   6 C      2.924    -0.058    29.451     8.900
    10   1 H      0.926     0.047     2.352     2.398
    11   1 H      0.924    -0.000     3.064     2.737
    12   1 H      0.860     0.132     1.531     1.939
    13   1 H      0.926     0.053     2.282     2.362
    14   1 H      0.926     0.033     2.550     2.497
    15   1 H      0.926     0.029     2.605     2.524
    16   1 H      0.926     0.030     2.588     2.515
    17   1 H      0.925     0.022     2.703     2.571

 Mol. C6AA /au·bohr⁶  :       3546.854521
 Mol. C8AA /au·bohr⁸  :      84089.479722
 Mol. α(0) /au        :         95.276671


Wiberg/Mayer (AO) data.
largest (>0.10) Wiberg bond orders for each atom
          total WBO             WBO to atom ...
     1  C   3.960        N    2 1.813    H   10 0.971    H   11 0.955    N    3 0.155
     2  N   3.082        C    1 1.813    N    3 1.170
     3  N   3.507        N    2 1.170    C    4 1.110    H   12 0.928    C    1 0.155
     4  C   3.965        C    9 1.355    C    5 1.351    N    3 1.110
     5  C   3.989        C    6 1.463    C    4 1.351    H   13 0.967    C    8 0.106
     6  C   3.992        C    5 1.463    C    7 1.426    H   14 0.971    C    9 0.104
     7  C   3.973        C    8 1.431    C    6 1.426    H   15 0.972
     8  C   3.992        C    9 1.457    C    7 1.431    H   16 0.971    C    5 0.106
     9  C   3.987        C    8 1.457    C    4 1.355    H   17 0.968    C    6 0.104
    10  H   0.997        C    1 0.971
    11  H   1.000        C    1 0.955
    12  H   0.982        N    3 0.928
    13  H   0.997        C    5 0.967
    14  H   0.998        C    6 0.971
    15  H   0.999        C    7 0.972
    16  H   0.999        C    8 0.971
    17  H   1.000        C    9 0.968

molecular dipole:
                 x           y           z       tot (Debye)
 q only:       -0.053       0.023       0.215
   full:       -0.394       0.065       0.627       1.890
molecular quadrupole (traceless):
                xx          xy          yy          xz          yz          zz
 q only:        0.307       0.307      -0.921       1.562      -0.357       0.614
  q+dip:       -0.565       1.610      -2.182       6.053      -0.980       2.747
   full:       -1.910       1.614       0.859       6.346      -1.488       1.051

           -------------------------------------------------
          |                Geometry Summary                 |
           -------------------------------------------------

      molecular mass/u    :      120.1536000
   center of mass at/Å    :        4.8152523      -0.9583179      -1.2668991
  moments of inertia/u·Å² :        0.9804276E+02   0.5129440E+03   0.6109864E+03
rotational constants/cm⁻¹ :        0.1719416E+00   0.3286447E-01   0.2759085E-01

 * 17 selected distances

     #   Z        #   Z                                     value/Å
     1   6 C      2   7 N                                 1.2644812
     2   7 N      3   7 N                                 1.3252245
     3   7 N      4   6 C                                 1.3813452
     4   6 C      5   6 C                                 1.3941322 (max)
     5   6 C      6   6 C                                 1.3804496
     6   6 C      7   6 C                                 1.3860867
     7   6 C      8   6 C                                 1.3850757
     4   6 C      9   6 C                                 1.3939260
     8   6 C      9   6 C                                 1.3814930
     1   6 C     10   1 H                                 1.0740044
     1   6 C     11   1 H                                 1.0918652
     3   7 N     12   1 H                                 1.0212756 (min)
     5   6 C     13   1 H                                 1.0780242
     6   6 C     14   1 H                                 1.0801696
     7   6 C     15   1 H                                 1.0794983
     8   6 C     16   1 H                                 1.0802318
     9   6 C     17   1 H                                 1.0813412

 * 5 distinct bonds (by element types)

   Z      Z             #   av. dist./Å        max./Å        min./Å
   1 H    6 C           7     1.0807335     1.0918652     1.0740044
   6 C    6 C           6     1.3868605     1.3941322     1.3804496
   1 H    7 N           1     1.0212756     1.0212756     1.0212756
   6 C    7 N           2     1.3229132     1.3813452     1.2644812
   7 N    7 N           1     1.3252245     1.3252245     1.3252245


optimized geometry written to: xtbopt.xyz


           -------------------------------------------------
          | TOTAL ENERGY              -24.858880039887 Eh   |
          | GRADIENT NORM               0.000878760787 Eh/α |
          | HOMO-LUMO GAP               3.425039281608 eV   |
           -------------------------------------------------

------------------------------------------------------------------------
 * finished run on 2021/05/19 at 10:58:36.543     
------------------------------------------------------------------------
 total:
 * wall-time:     0 d,  0 h,  0 min,  0.218 sec
 *  cpu-time:     0 d,  0 h,  0 min,  0.217 sec
 * ratio c/w:     0.999 speedup
 SCF:
 * wall-time:     0 d,  0 h,  0 min,  0.018 sec
 *  cpu-time:     0 d,  0 h,  0 min,  0.018 sec
 * ratio c/w:     1.000 speedup
 ANC optimizer:
 * wall-time:     0 d,  0 h,  0 min,  0.185 sec
 *  cpu-time:     0 d,  0 h,  0 min,  0.185 sec
 * ratio c/w:     1.000 speedup

