      -----------------------------------------------------------      
     |                   =====================                   |     
     |                           x T B                           |     
     |                   =====================                   |     
     |                         S. Grimme                         |     
     |          Mulliken Center for Theoretical Chemistry        |     
     |                    University of Bonn                     |     
     |                Version 6.2 RC2 (SAW190805)                |     
      -----------------------------------------------------------      

   This program is distributed in the hope that it will be useful,
   but WITHOUT ANY WARRANTY; without even the implied warranty of
   MERCHANTABILITY or FITNESS FOR A PARTICULAR PURPOSE.
   
   FOR NON-COMMERCIAL, ACADEMIA USE ONLY.
   
   Cite this work as:
   * S. Grimme, C. Bannwarth, P. Shushkov, J. Chem. Theory Comput., 2017,
     13, 1989-2009. DOI: 10.1021/acs.jctc.7b00118
   * C. Bannwarth, S. Ehlert and S. Grimme., J. Chem. Theory Comput., 2019,
     15, 1652-1671. DOI: 10.1021/acs.jctc.8b01176
   * P. Pracht, E. Caldeweyher, S. Ehlert, S. Grimme, ChemRxiv, 2019, preprint.
     DOI: 10.26434/chemrxiv.8326202.v1
   
   for DFT-D4:
   * E. Caldeweyher, C. Bannwarth and S. Grimme, J. Chem. Phys., 2017,
     147, 034112. DOI: 10.1063/1.4993215
   * E. Caldeweyher, S. Ehlert, A. Hansen, H. Neugebauer, S. Spicher,
     C. Bannwarth and S. Grimme, J. Chem. Phys., 2019, 150, 154122.
     DOI: 10.1063/1.5090222
   
   for sTDA-xTB:
   * S. Grimme and C. Bannwarth, J. Chem. Phys., 2016, 145, 054103.
     DOI: 10.1063/1.4959605
   
   in the mass-spec context:
   * V. Asgeirsson, C. Bauer and S. Grimme, Chem. Sci., 2017, 8, 4879.
     DOI: 10.1039/c7sc00601b
   
   for metadynamics refer to:
   * S. Grimme, J. Chem. Theory Comput., 2019, 155, 2847-2862
     DOI: 10.1021/acs.jctc.9b00143
   
   with help from (in alphabetical order)
   C. Bannwarth, F. Bohle, G. Brandenburg, E. Caldeweyher, M. Checinski,
   S. Dohm, S. Ehlert, S. Ehrlich, F. März, H. Neugebauer, J. Pisarek,
   P. Pracht, P. Shushkov, and S. Spicher.
   
 * started run on 2021/05/19 at 10:59:28.193     

           -------------------------------------------------
          |                Calculation Setup                |
           -------------------------------------------------

          program call               : /ihome/ghutchison/geoffh/xtb/xtb 614.xyz -opt
          hostname                   : smp-n144
          coordinate file            : 614.xyz
          omp threads                :                     1
          number of atoms            :                    14
          number of electrons        :                    42
          charge                     :                     0
          spin                       :                   0.0
          first test random number   :      0.80526585944351


########################################################################
# WARNING! Please study the warnings concerning your input carefully
#  - the use of '-opt' is discouraged, please use '--opt' next time
########################################################################

           ------------------------------------------------- 
          |                 G F N 2 - x T B                 |
          | Geometry, Frequencies, Noncovalent interactions |
          |            JCTC 2019 parametrisation            |
           ------------------------------------------------- 
             KAB for C  - Si     :                1.0500
             KAB for H  - Pd     :                0.9500
             k(s)              :                1.8500
             k(p)              :                2.2300
             k(d)              :                2.2300
             k(f)              :                2.0000
             kEN (H0ij)        :               -2.0000
             D4 a1             :                0.5200
             D4 a2             :                5.0000
             D4 s6             :                1.0000
             D4 s8             :                2.7000
             D4 s9             :                5.0000
             alphaj            :                2.0000

  Z AO/shell   Hii/eV     exponent
  1     Wed Apr 25 08:07:45 CEST 2018   EN: 2.200 GM2: 0.406  GM3: 0.0800  RAES: 1.40
     1s    -10.707211    1.230000
  6     Wed Apr 25 08:07:45 CEST 2018   EN: 2.550 GM2: 0.538  GM3: 0.1500  RAES: 3.00
     2s    -13.970922    2.096432
     2p    -10.063292    1.800000
  8     Wed Apr 25 08:07:45 CEST 2018   EN: 3.440 GM2: 0.452  GM3:-0.0517  RAES: 1.80
     2s    -20.229985    2.439742
     2p    -15.503117    2.137023
 16     Tue Apr 24 11:44:34 CEST 2018   EN: 2.580 GM2: 0.340  GM3:-0.0502  RAES: 3.10
     3s    -20.029654    1.981333
     3p    -11.377694    2.025643
     3d     -0.420282    1.702555

           ------------------------------------------------- 
          |        Self-Consistent Charge Iterations        |
           ------------------------------------------------- 

          ...................................................
          :                      SETUP                      :
          :.................................................:
          :  # basis functions                  44          :
          :  # atomic orbitals                  43          :
          :  # shells                           23          :
          :  # electrons                        42          :
          :  max. iterations                   250          :
          :  Hamiltonian                  GFN2-xTB          :
          :  restarted?                      false          :
          :  GBSA solvation                  false          :
          :  PC potential                    false          :
          :  electronic temp.          300.0000000     K    :
          :  accuracy                    1.0000000          :
          :  -> integral cutoff          0.2500000E+02      :
          :  -> integral neglect         0.1000000E-07      :
          :  -> SCF convergence          0.1000000E-05 Eh   :
          :  -> wf. convergence          0.1000000E-03 e    :
          :  Broyden damping             0.4000000          :
          ...................................................

 iter      E             dE          RMSdq      gap      omega  full diag
   1    -23.4357543 -0.234358E+02  0.461E+00    3.44       0.0  T
   2    -23.4528267 -0.170724E-01  0.286E+00    3.32       1.0  T
   3    -23.4424681  0.103587E-01  0.180E+00    3.45       1.0  T
   4    -23.4660982 -0.236301E-01  0.438E-01    3.32       1.0  T
   5    -23.4666751 -0.576964E-03  0.156E-01    3.32       1.0  T
   6    -23.4667653 -0.901344E-04  0.892E-02    3.33       1.0  T
   7    -23.4668234 -0.581581E-04  0.268E-02    3.33       1.0  T
   8    -23.4668259 -0.244713E-05  0.147E-02    3.33       1.8  T
   9    -23.4668266 -0.727041E-06  0.512E-03    3.33       5.2  T
  10    -23.4668268 -0.169674E-06  0.158E-03    3.33      17.0  T
  11    -23.4668268 -0.137689E-07  0.619E-04    3.33      43.2  T
  12    -23.4668268 -0.602888E-09  0.239E-04    3.33     111.8  T

   *** convergence criteria satisfied after 12 iterations ***

         #    Occupation            Energy/Eh            Energy/eV
      -------------------------------------------------------------
         1        2.0000           -0.7355404             -20.0151
       ...           ...                  ...                  ...
        15        2.0000           -0.4756870             -12.9441
        16        2.0000           -0.4683308             -12.7439
        17        2.0000           -0.4620333             -12.5726
        18        2.0000           -0.4475246             -12.1778
        19        2.0000           -0.4141257             -11.2689
        20        2.0000           -0.3999466             -10.8831
        21        2.0000           -0.3728680             -10.1463 (HOMO)
        22                         -0.2505795              -6.8186 (LUMO)
        23                         -0.2116673              -5.7598
        24                         -0.2044945              -5.5646
        25                         -0.1643602              -4.4725
        26                         -0.1185897              -3.2270
       ...                                ...                  ...
        43                          0.6772167              18.4280
      -------------------------------------------------------------
                  HL-Gap            0.1222885 Eh            3.3276 eV
             Fermi-level           -0.3117237 Eh           -8.4824 eV

 SCC (total)                   0 d,  0 h,  0 min,  0.018 sec
 SCC setup                      ...        0 min,  0.000 sec (  1.058%)
 Dispersion                     ...        0 min,  0.000 sec (  0.673%)
 integral evaluation            ...        0 min,  0.004 sec ( 20.989%)
 zeroth order Hamiltonian       ...        0 min,  0.000 sec (  0.462%)
 iterations                     ...        0 min,  0.008 sec ( 42.234%)
 molecular gradient             ...        0 min,  0.006 sec ( 32.629%)
 printout                       ...        0 min,  0.000 sec (  1.685%)

         :::::::::::::::::::::::::::::::::::::::::::::::::::::
         ::                     SUMMARY                     ::
         :::::::::::::::::::::::::::::::::::::::::::::::::::::
         :: total energy             -23.161235059234 Eh    ::
         :: gradient norm              0.035288867998 Eh/a0 ::
         :: HOMO-LUMO gap              3.327639368631 eV    ::
         ::.................................................::
         :: SCC energy               -23.466826799904 Eh    ::
         :: -> isotropic ES            0.013066307754 Eh    ::
         :: -> anisotropic ES          0.002125818847 Eh    ::
         :: -> anisotropic XC          0.009934421026 Eh    ::
         :: -> dispersion             -0.010974468001 Eh    ::
         :: repulsion energy           0.305601679453 Eh    ::
         :: add. restraining           0.000000000000 Eh    ::
         :::::::::::::::::::::::::::::::::::::::::::::::::::::

      ----------------------------------------------------------- 
     |                   =====================                   |
     |                        A N C O P T                        |
     |                   =====================                   |
     |               Approximate Normal Coordinate               |
     |                Rational Function Optimizer                |
      ----------------------------------------------------------- 

          ...................................................
          :                      SETUP                      :
          :.................................................:
          :   optimization level            normal          :
          :   max. optcycles                   200          :
          :   ANC micro-cycles                  20          :
          :   degrees of freedom                36          :
          :.................................................:
          :   RF solver                   davidson          :
          :   input Hessian                  false          :
          :   write xtbopt.log                true          :
          :   linear?                        false          :
          :   energy convergence         0.5000000E-05 Eh   :
          :   grad. convergence          0.1000000E-02 Eh/α :
          :   maximium RF displ.         2.0000000          :
          :   Hlow (freq-cutoff)         0.5000000E-02      :
          :   Hmax (freq-cutoff)         5.0000000          :
          :   S6 in model hess.         20.0000000          :
          ...................................................

generating ANC from model Hessian ...
Using Lindh-Hessian (1995)
 Shifting diagonal of input Hessian by   2.300221910690824E-003
 Lowest  eigenvalues of input Hessian
   -0.000000    0.000000    0.000000    0.000000    0.000000    0.000000
    0.005000    0.006850    0.008428    0.017247    0.021773    0.025145
    0.037157    0.042256    0.051307    0.069409    0.090512    0.098337
 Highest eigenvalues
    1.512860    1.653610    1.710015    1.856305    1.906816    2.115415
 

........................................................................
.............................. CYCLE    1 ..............................
........................................................................
   1    -23.4668268 -0.234668E+02  0.647E-05    3.33       0.0  T
   2    -23.4668268 -0.309086E-11  0.489E-05    3.33     546.0  T
   3    -23.4668268 -0.190710E-10  0.274E-05    3.33     976.1  T
     SCC iter.                  ...        0 min,  0.002 sec
     gradient                   ...        0 min,  0.006 sec
 * total energy  :   -23.1612351 Eh     change       -0.4164857E-08 Eh
   gradient norm :     0.0352902 Eh/α   predicted     0.0000000E+00 (-100.00%)
   displ. norm   :     0.1974559 α      lambda       -0.2434967E-02
   maximum displ.:     0.1056370 α      in ANC's #3, #4, #2, ...

........................................................................
.............................. CYCLE    2 ..............................
........................................................................
   1    -23.4841220 -0.234841E+02  0.288E-01    3.39       0.0  T
   2    -23.4841460 -0.240201E-04  0.139E-01    3.38       1.0  T
   3    -23.4841053  0.406858E-04  0.778E-02    3.39       1.0  T
   4    -23.4841636 -0.582714E-04  0.199E-02    3.38       1.3  T
   5    -23.4841638 -0.170080E-06  0.983E-03    3.38       2.7  T
   6    -23.4841641 -0.326579E-06  0.246E-03    3.38      10.9  T
   7    -23.4841641 -0.278393E-07  0.149E-03    3.38      18.0  T
     SCC iter.                  ...        0 min,  0.004 sec
     gradient                   ...        0 min,  0.006 sec
 * total energy  :   -23.1626932 Eh     change       -0.1458112E-02 Eh
   gradient norm :     0.0110778 Eh/α   predicted    -0.1264952E-02 ( -13.25%)
   displ. norm   :     0.0985609 α      lambda       -0.2562008E-03
   maximum displ.:     0.0862202 α      in ANC's #3, #7, #5, ...

........................................................................
.............................. CYCLE    3 ..............................
........................................................................
   1    -23.4883746 -0.234884E+02  0.103E-01    3.40       0.0  T
   2    -23.4883796 -0.504182E-05  0.524E-02    3.39       1.0  T
   3    -23.4883751  0.450371E-05  0.311E-02    3.40       1.0  T
   4    -23.4883824 -0.730053E-05  0.859E-03    3.39       3.1  T
   5    -23.4883825 -0.118050E-06  0.457E-03    3.39       5.9  T
   6    -23.4883826 -0.665484E-07  0.146E-03    3.39      18.2  T
   7    -23.4883826 -0.111552E-07  0.795E-04    3.39      33.6  T
     SCC iter.                  ...        0 min,  0.004 sec
     gradient                   ...        0 min,  0.005 sec
 * total energy  :   -23.1628388 Eh     change       -0.1455785E-03 Eh
   gradient norm :     0.0042362 Eh/α   predicted    -0.1293454E-03 ( -11.15%)
   displ. norm   :     0.0540604 α      lambda       -0.4927703E-04
   maximum displ.:     0.0486662 α      in ANC's #3, #4, #8, ...

........................................................................
.............................. CYCLE    4 ..............................
........................................................................
   1    -23.4880047 -0.234880E+02  0.524E-02    3.40       0.0  T
   2    -23.4880056 -0.943073E-06  0.270E-02    3.39       1.0  T
   3    -23.4880049  0.749411E-06  0.123E-02    3.40       2.2  T
   4    -23.4880060 -0.108683E-05  0.470E-03    3.40       5.7  T
   5    -23.4880060 -0.404645E-07  0.213E-03    3.39      12.5  T
   6    -23.4880060 -0.185998E-07  0.907E-04    3.40      29.5  T
     SCC iter.                  ...        0 min,  0.003 sec
     gradient                   ...        0 min,  0.005 sec
 * total energy  :   -23.1628706 Eh     change       -0.3181877E-04 Eh
   gradient norm :     0.0016650 Eh/α   predicted    -0.2470996E-04 ( -22.34%)
   displ. norm   :     0.0608879 α      lambda       -0.1797091E-04
   maximum displ.:     0.0498730 α      in ANC's #3, #1, #5, ...

........................................................................
.............................. CYCLE    5 ..............................
........................................................................
   1    -23.4867934 -0.234868E+02  0.550E-02    3.39       0.0  T
   2    -23.4867940 -0.643059E-06  0.295E-02    3.39       1.0  T
   3    -23.4867933  0.737271E-06  0.113E-02    3.39       2.4  T
   4    -23.4867942 -0.957180E-06  0.462E-03    3.39       5.8  T
   5    -23.4867943 -0.433412E-07  0.188E-03    3.39      14.2  T
   6    -23.4867943 -0.196599E-07  0.847E-04    3.39      31.5  T
   7    -23.4867943 -0.338860E-08  0.447E-04    3.39      59.8  T
     SCC iter.                  ...        0 min,  0.004 sec
     gradient                   ...        0 min,  0.006 sec
 * total energy  :   -23.1628821 Eh     change       -0.1150372E-04 Eh
   gradient norm :     0.0014054 Eh/α   predicted    -0.8999283E-05 ( -21.77%)
   displ. norm   :     0.0287776 α      lambda       -0.5818005E-05
   maximum displ.:     0.0207677 α      in ANC's #1, #2, #3, ...

........................................................................
.............................. CYCLE    6 ..............................
........................................................................
   1    -23.4870141 -0.234870E+02  0.265E-02    3.40       0.0  T
   2    -23.4870141 -0.380400E-07  0.156E-02    3.40       1.7  T
   3    -23.4870140  0.913381E-07  0.317E-03    3.40       8.4  T
   4    -23.4870141 -0.107486E-06  0.695E-04    3.40      38.4  T
   5    -23.4870141 -0.145037E-08  0.340E-04    3.40      78.5  T
     SCC iter.                  ...        0 min,  0.003 sec
     gradient                   ...        0 min,  0.006 sec
 * total energy  :   -23.1628873 Eh     change       -0.5215181E-05 Eh
   gradient norm :     0.0009312 Eh/α   predicted    -0.2910021E-05 ( -44.20%)
   displ. norm   :     0.0356942 α      lambda       -0.5329516E-05
   maximum displ.:     0.0306273 α      in ANC's #1, #2, #3, ...

........................................................................
.............................. CYCLE    7 ..............................
........................................................................
   1    -23.4874507 -0.234875E+02  0.363E-02    3.40       0.0  T
   2    -23.4874508 -0.109956E-06  0.210E-02    3.40       1.3  T
   3    -23.4874506  0.203430E-06  0.526E-03    3.40       5.1  T
   4    -23.4874509 -0.248350E-06  0.158E-03    3.40      16.9  T
   5    -23.4874509 -0.307309E-08  0.708E-04    3.40      37.7  T
   6    -23.4874509 -0.467347E-08  0.216E-04    3.40     123.5  T
     SCC iter.                  ...        0 min,  0.003 sec
     gradient                   ...        0 min,  0.006 sec
 * total energy  :   -23.1628922 Eh     change       -0.4910000E-05 Eh
   gradient norm :     0.0006054 Eh/α   predicted    -0.2665544E-05 ( -45.71%)
   displ. norm   :     0.0299915 α      lambda       -0.3217347E-05
   maximum displ.:     0.0250600 α      in ANC's #1, #2, #3, ...

   *** GEOMETRY OPTIMIZATION CONVERGED AFTER 7 ITERATIONS ***

------------------------------------------------------------------------
 total energy gain   :        -0.0016571 Eh       -1.0399 kcal/mol
 total RMSD          :         0.0995760 a0        0.0527 Å
 total power (kW/mol):        -0.6215467 (step)  -45.5574 (real)
------------------------------------------------------------------------

 ANCopt (total)                0 d,  0 h,  0 min,  0.096 sec
 optimizer setup                ...        0 min,  0.000 sec (  0.142%)
 model hessian                  ...        0 min,  0.001 sec (  1.014%)
 ANC generation                 ...        0 min,  0.000 sec (  0.376%)
 coordinate transformation      ...        0 min,  0.000 sec (  0.093%)
 single point calculation       ...        0 min,  0.092 sec ( 96.094%)
 optimization log               ...        0 min,  0.000 sec (  0.496%)
 hessian update                 ...        0 min,  0.000 sec (  0.089%)
 rational function              ...        0 min,  0.001 sec (  1.173%)

================
 final structure:
================
$coord
   -0.58307503426630    1.81098329453827   -0.07078816139415      C 
   -2.59848568353059   -0.71162647888452   -0.35732327345273      S 
   -0.13925913914190   -2.80200137522120   -0.03105179369870      C 
    2.10975369497811   -1.62129188211481    0.30176148282521      C 
    1.86013412095147    1.05572901428810    0.27269621362774      C 
    3.73356684417607    2.78396082675338    0.61856792745907      O 
    6.15574344781259    2.14327241905032    0.03570651365095      C 
    8.08037920746007    3.59720196964885    0.69015832401475      C 
   -1.28775949760308    3.70526044079793   -0.14500768341517      H 
   -0.50676405979162   -4.79215830487147   -0.08476954586761      H 
    3.86062590586748   -2.60731543984431    0.59869405878784      H 
    6.40816153320559    0.41790475245385   -1.03888421415236      H 
    7.79584851259042    5.30801125240319    1.74713553474339      H 
    9.97545406022777    3.10611543051152    0.16473242302504      H 
$end
           -------------------------------------------------
          |                Final Singlepoint                |
           -------------------------------------------------

          ...................................................
          :                      SETUP                      :
          :.................................................:
          :  # basis functions                  44          :
          :  # atomic orbitals                  43          :
          :  # shells                           23          :
          :  # electrons                        42          :
          :  max. iterations                   250          :
          :  Hamiltonian                  GFN2-xTB          :
          :  restarted?                      false          :
          :  GBSA solvation                  false          :
          :  PC potential                    false          :
          :  electronic temp.          300.0000000     K    :
          :  accuracy                    1.0000000          :
          :  -> integral cutoff          0.2500000E+02      :
          :  -> integral neglect         0.1000000E-07      :
          :  -> SCF convergence          0.1000000E-05 Eh   :
          :  -> wf. convergence          0.1000000E-03 e    :
          :  Broyden damping             0.4000000          :
          ...................................................

 iter      E             dE          RMSdq      gap      omega  full diag
   1    -23.4874509 -0.234875E+02  0.112E-04    3.40       0.0  T
   2    -23.4874509 -0.105551E-10  0.452E-05    3.40     591.9  T
   3    -23.4874509 -0.611777E-11  0.500E-05    3.40     534.9  T

   *** convergence criteria satisfied after 3 iterations ***

         #    Occupation            Energy/Eh            Energy/eV
      -------------------------------------------------------------
         1        2.0000           -0.7359304             -20.0257
       ...           ...                  ...                  ...
        15        2.0000           -0.4769622             -12.9788
        16        2.0000           -0.4691993             -12.7676
        17        2.0000           -0.4628815             -12.5956
        18        2.0000           -0.4471303             -12.1670
        19        2.0000           -0.4147569             -11.2861
        20        2.0000           -0.4029067             -10.9636
        21        2.0000           -0.3742774             -10.1846 (HOMO)
        22                         -0.2493589              -6.7854 (LUMO)
        23                         -0.2086563              -5.6778
        24                         -0.2049701              -5.5775
        25                         -0.1619985              -4.4082
        26                         -0.1191055              -3.2410
       ...                                ...                  ...
        43                          0.6939197              18.8825
      -------------------------------------------------------------
                  HL-Gap            0.1249185 Eh            3.3992 eV
             Fermi-level           -0.3118181 Eh           -8.4850 eV

 SCC (total)                   0 d,  0 h,  0 min,  0.012 sec
 SCC setup                      ...        0 min,  0.000 sec (  1.155%)
 Dispersion                     ...        0 min,  0.000 sec (  0.662%)
 integral evaluation            ...        0 min,  0.004 sec ( 29.841%)
 zeroth order Hamiltonian       ...        0 min,  0.000 sec (  0.615%)
 iterations                     ...        0 min,  0.002 sec ( 17.741%)
 molecular gradient             ...        0 min,  0.006 sec ( 47.474%)
 printout                       ...        0 min,  0.000 sec (  2.132%)

         :::::::::::::::::::::::::::::::::::::::::::::::::::::
         ::                     SUMMARY                     ::
         :::::::::::::::::::::::::::::::::::::::::::::::::::::
         :: total energy             -23.162892194918 Eh    ::
         :: gradient norm              0.000605282263 Eh/a0 ::
         :: HOMO-LUMO gap              3.399206267788 eV    ::
         ::.................................................::
         :: SCC energy               -23.487450881441 Eh    ::
         :: -> isotropic ES            0.013112433772 Eh    ::
         :: -> anisotropic ES          0.002005801908 Eh    ::
         :: -> anisotropic XC          0.009435698924 Eh    ::
         :: -> dispersion             -0.011053232944 Eh    ::
         :: repulsion energy           0.324567731399 Eh    ::
         :: add. restraining           0.000000000000 Eh    ::
         :::::::::::::::::::::::::::::::::::::::::::::::::::::

           -------------------------------------------------
          |                Property Printout                |
           -------------------------------------------------

    * Orbital Energies and Occupations

         #    Occupation            Energy/Eh            Energy/eV
      -------------------------------------------------------------
         1        2.0000           -0.7359304             -20.0257
       ...           ...                  ...                  ...
         9        2.0000           -0.5540372             -15.0761
        10        2.0000           -0.5462112             -14.8632
        11        2.0000           -0.5219891             -14.2040
        12        2.0000           -0.5056259             -13.7588
        13        2.0000           -0.4837979             -13.1648
        14        2.0000           -0.4792701             -13.0416
        15        2.0000           -0.4769622             -12.9788
        16        2.0000           -0.4691993             -12.7676
        17        2.0000           -0.4628815             -12.5956
        18        2.0000           -0.4471303             -12.1670
        19        2.0000           -0.4147569             -11.2861
        20        2.0000           -0.4029067             -10.9636
        21        2.0000           -0.3742774             -10.1846 (HOMO)
        22                         -0.2493589              -6.7854 (LUMO)
        23                         -0.2086563              -5.6778
        24                         -0.2049701              -5.5775
        25                         -0.1619985              -4.4082
        26                         -0.1191055              -3.2410
        27                         -0.0063540              -0.1729
        28                          0.0270377               0.7357
        29                          0.0332738               0.9054
        30                          0.0539748               1.4687
        31                          0.1069380               2.9099
        32                          0.1429616               3.8902
       ...                                ...                  ...
        43                          0.6939197              18.8825
      -------------------------------------------------------------
                  HL-Gap            0.1249185 Eh            3.3992 eV
             Fermi-level           -0.3118181 Eh           -8.4850 eV

     #   Z        covCN         q      C6AA      α(0)
     1   6 C      2.936    -0.053    29.323     8.881
     2  16 S      2.308    -0.010   141.484    20.020
     3   6 C      2.942    -0.024    28.610     8.772
     4   6 C      3.110    -0.070    29.580     8.910
     5   6 C      3.077     0.129    25.103     8.214
     6   8 O      1.709    -0.238    17.944     5.719
     7   6 C      2.791     0.104    25.675     8.300
     8   6 C      2.835    -0.126    31.187     9.152
     9   1 H      0.927     0.057     2.235     2.338
    10   1 H      0.926     0.052     2.293     2.368
    11   1 H      0.926     0.044     2.398     2.422
    12   1 H      0.925     0.029     2.598     2.520
    13   1 H      0.926     0.058     2.225     2.333
    14   1 H      0.926     0.048     2.342     2.393

 Mol. C6AA /au·bohr⁶  :       3259.569094
 Mol. C8AA /au·bohr⁸  :      93108.393564
 Mol. α(0) /au        :         92.342961


Wiberg/Mayer (AO) data.
largest (>0.10) Wiberg bond orders for each atom
          total WBO             WBO to atom ...
     1  C   3.935        C    5 1.543    S    2 1.190    H    9 0.970    C    3 0.119
     2  S   2.632        C    3 1.201    C    1 1.190    C    4 0.101
     3  C   3.952        C    4 1.631    S    2 1.201    H   10 0.971    C    1 0.119
     4  C   3.984        C    3 1.631    C    5 1.221    H   11 0.962    S    2 0.101
     5  C   3.929        C    1 1.543    C    4 1.221    O    6 1.034
     6  O   2.331        C    7 1.048    C    5 1.034
     7  C   3.927        C    8 1.883    O    6 1.048    H   12 0.957
     8  C   3.976        C    7 1.883    H   14 0.977    H   13 0.974
     9  H   0.997        C    1 0.970
    10  H   0.997        C    3 0.971
    11  H   0.998        C    4 0.962
    12  H   0.999        C    7 0.957
    13  H   0.997        C    8 0.974
    14  H   0.997        C    8 0.977

molecular dipole:
                 x           y           z       tot (Debye)
 q only:        0.081      -0.347      -0.116
   full:        0.389      -0.416      -0.110       1.475
molecular quadrupole (traceless):
                xx          xy          yy          xz          yz          zz
 q only:        2.231      -1.274      -0.443      -0.648      -0.256      -1.788
  q+dip:        1.051      -3.219       1.583      -1.005       0.245      -2.634
   full:        0.589      -3.190       0.984      -1.269      -0.307      -1.572

           -------------------------------------------------
          |                Geometry Summary                 |
           -------------------------------------------------

      molecular mass/u    :      126.1728000
   center of mass at/Å    :        0.8928194       0.3236063       0.0590844
  moments of inertia/u·Å² :        0.7692232E+02   0.5485128E+03   0.6203451E+03
rotational constants/cm⁻¹ :        0.2191514E+00   0.3073335E-01   0.2717460E-01

 * 14 selected distances

     #   Z        #   Z                                     value/Å
     1   6 C      2  16 S                                 1.7153461
     2  16 S      3   6 C                                 1.7166820 (max)
     3   6 C      4   6 C                                 1.3556545
     1   6 C      5   6 C                                 1.3654067
     4   6 C      5   6 C                                 1.4228469
     5   6 C      6   8 O                                 1.3611446
     6   8 O      7   6 C                                 1.3612460
     7   6 C      8   6 C                                 1.3225664
     1   6 C      9   1 H                                 1.0702438 (min)
     3   6 C     10   1 H                                 1.0713285
     4   6 C     11   1 H                                 1.0748898
     7   6 C     12   1 H                                 1.0838906
     8   6 C     13   1 H                                 1.0747676
     8   6 C     14   1 H                                 1.0726186

 * 4 distinct bonds (by element types)

   Z      Z             #   av. dist./Å        max./Å        min./Å
   1 H    6 C           6     1.0746231     1.0838906     1.0702438
   6 C    6 C           4     1.3666186     1.4228469     1.3225664
   6 C    8 O           2     1.3611953     1.3612460     1.3611446
   6 C   16 S           2     1.7160140     1.7166820     1.7153461


optimized geometry written to: xtbopt.xyz


           -------------------------------------------------
          | TOTAL ENERGY              -23.162892194918 Eh   |
          | GRADIENT NORM               0.000605282263 Eh/α |
          | HOMO-LUMO GAP               3.399206267788 eV   |
           -------------------------------------------------

------------------------------------------------------------------------
 * finished run on 2021/05/19 at 10:59:28.335     
------------------------------------------------------------------------
 total:
 * wall-time:     0 d,  0 h,  0 min,  0.142 sec
 *  cpu-time:     0 d,  0 h,  0 min,  0.141 sec
 * ratio c/w:     0.993 speedup
 SCF:
 * wall-time:     0 d,  0 h,  0 min,  0.018 sec
 *  cpu-time:     0 d,  0 h,  0 min,  0.018 sec
 * ratio c/w:     0.998 speedup
 ANC optimizer:
 * wall-time:     0 d,  0 h,  0 min,  0.108 sec
 *  cpu-time:     0 d,  0 h,  0 min,  0.108 sec
 * ratio c/w:     0.998 speedup

