      -----------------------------------------------------------      
     |                   =====================                   |     
     |                           x T B                           |     
     |                   =====================                   |     
     |                         S. Grimme                         |     
     |          Mulliken Center for Theoretical Chemistry        |     
     |                    University of Bonn                     |     
     |                Version 6.2 RC2 (SAW190805)                |     
      -----------------------------------------------------------      

   This program is distributed in the hope that it will be useful,
   but WITHOUT ANY WARRANTY; without even the implied warranty of
   MERCHANTABILITY or FITNESS FOR A PARTICULAR PURPOSE.
   
   FOR NON-COMMERCIAL, ACADEMIA USE ONLY.
   
   Cite this work as:
   * S. Grimme, C. Bannwarth, P. Shushkov, J. Chem. Theory Comput., 2017,
     13, 1989-2009. DOI: 10.1021/acs.jctc.7b00118
   * C. Bannwarth, S. Ehlert and S. Grimme., J. Chem. Theory Comput., 2019,
     15, 1652-1671. DOI: 10.1021/acs.jctc.8b01176
   * P. Pracht, E. Caldeweyher, S. Ehlert, S. Grimme, ChemRxiv, 2019, preprint.
     DOI: 10.26434/chemrxiv.8326202.v1
   
   for DFT-D4:
   * E. Caldeweyher, C. Bannwarth and S. Grimme, J. Chem. Phys., 2017,
     147, 034112. DOI: 10.1063/1.4993215
   * E. Caldeweyher, S. Ehlert, A. Hansen, H. Neugebauer, S. Spicher,
     C. Bannwarth and S. Grimme, J. Chem. Phys., 2019, 150, 154122.
     DOI: 10.1063/1.5090222
   
   for sTDA-xTB:
   * S. Grimme and C. Bannwarth, J. Chem. Phys., 2016, 145, 054103.
     DOI: 10.1063/1.4959605
   
   in the mass-spec context:
   * V. Asgeirsson, C. Bauer and S. Grimme, Chem. Sci., 2017, 8, 4879.
     DOI: 10.1039/c7sc00601b
   
   for metadynamics refer to:
   * S. Grimme, J. Chem. Theory Comput., 2019, 155, 2847-2862
     DOI: 10.1021/acs.jctc.9b00143
   
   with help from (in alphabetical order)
   C. Bannwarth, F. Bohle, G. Brandenburg, E. Caldeweyher, M. Checinski,
   S. Dohm, S. Ehlert, S. Ehrlich, F. März, H. Neugebauer, J. Pisarek,
   P. Pracht, P. Shushkov, and S. Spicher.
   
 * started run on 2021/05/19 at 10:59:29.660     

           -------------------------------------------------
          |                Calculation Setup                |
           -------------------------------------------------

          program call               : /ihome/ghutchison/geoffh/xtb/xtb 618.xyz -opt
          hostname                   : smp-n144
          coordinate file            : 618.xyz
          omp threads                :                     1
          number of atoms            :                    29
          number of electrons        :                    78
          charge                     :                     0
          spin                       :                   0.0
          first test random number   :      0.62849026844915


########################################################################
# WARNING! Please study the warnings concerning your input carefully
#  - the use of '-opt' is discouraged, please use '--opt' next time
########################################################################

           ------------------------------------------------- 
          |                 G F N 2 - x T B                 |
          | Geometry, Frequencies, Noncovalent interactions |
          |            JCTC 2019 parametrisation            |
           ------------------------------------------------- 
             KAB for C  - Si     :                1.0500
             KAB for H  - Pd     :                0.9500
             k(s)              :                1.8500
             k(p)              :                2.2300
             k(d)              :                2.2300
             k(f)              :                2.0000
             kEN (H0ij)        :               -2.0000
             D4 a1             :                0.5200
             D4 a2             :                5.0000
             D4 s6             :                1.0000
             D4 s8             :                2.7000
             D4 s9             :                5.0000
             alphaj            :                2.0000

  Z AO/shell   Hii/eV     exponent
  1     Wed Apr 25 08:07:45 CEST 2018   EN: 2.200 GM2: 0.406  GM3: 0.0800  RAES: 1.40
     1s    -10.707211    1.230000
  6     Wed Apr 25 08:07:45 CEST 2018   EN: 2.550 GM2: 0.538  GM3: 0.1500  RAES: 3.00
     2s    -13.970922    2.096432
     2p    -10.063292    1.800000
  7     Wed Apr 25 08:07:45 CEST 2018   EN: 3.040 GM2: 0.461  GM3:-0.0640  RAES: 1.90
     2s    -16.686243    2.339881
     2p    -12.523956    2.014332
 16     Tue Apr 24 11:44:34 CEST 2018   EN: 2.580 GM2: 0.340  GM3:-0.0502  RAES: 3.10
     3s    -20.029654    1.981333
     3p    -11.377694    2.025643
     3d     -0.420282    1.702555

           ------------------------------------------------- 
          |        Self-Consistent Charge Iterations        |
           ------------------------------------------------- 

          ...................................................
          :                      SETUP                      :
          :.................................................:
          :  # basis functions                  80          :
          :  # atomic orbitals                  79          :
          :  # shells                           45          :
          :  # electrons                        78          :
          :  max. iterations                   250          :
          :  Hamiltonian                  GFN2-xTB          :
          :  restarted?                      false          :
          :  GBSA solvation                  false          :
          :  PC potential                    false          :
          :  electronic temp.          300.0000000     K    :
          :  accuracy                    1.0000000          :
          :  -> integral cutoff          0.2500000E+02      :
          :  -> integral neglect         0.1000000E-07      :
          :  -> SCF convergence          0.1000000E-05 Eh   :
          :  -> wf. convergence          0.1000000E-03 e    :
          :  Broyden damping             0.4000000          :
          ...................................................

 iter      E             dE          RMSdq      gap      omega  full diag
   1    -42.4393250 -0.424393E+02  0.401E+00    1.78       0.0  T
   2    -42.4815153 -0.421903E-01  0.240E+00    1.66       1.0  T
   3    -42.4725750  0.894027E-02  0.115E+00    1.53       1.0  T
   4    -42.4878761 -0.153010E-01  0.500E-01    1.41       1.0  T
   5    -42.4914036 -0.352755E-02  0.237E-01    1.41       1.0  T
   6    -42.4925925 -0.118887E-02  0.115E-01    1.43       1.0  T
   7    -42.4928041 -0.211612E-03  0.476E-02    1.43       1.0  T
   8    -42.4928615 -0.573979E-04  0.155E-02    1.43       1.2  T
   9    -42.4928635 -0.196823E-05  0.799E-03    1.43       2.3  T
  10    -42.4928638 -0.338276E-06  0.338E-03    1.43       5.5  T
  11    -42.4928640 -0.163863E-06  0.170E-03    1.43      10.9  T
  12    -42.4928640 -0.247053E-07  0.464E-04    1.43      40.0  T
  13    -42.4928640 -0.503157E-09  0.252E-04    1.43      73.7  T

   *** convergence criteria satisfied after 13 iterations ***

         #    Occupation            Energy/Eh            Energy/eV
      -------------------------------------------------------------
         1        2.0000           -0.7401946             -20.1417
       ...           ...                  ...                  ...
        33        2.0000           -0.4393233             -11.9546
        34        2.0000           -0.4314757             -11.7411
        35        2.0000           -0.4273384             -11.6285
        36        2.0000           -0.4147066             -11.2847
        37        2.0000           -0.4020891             -10.9414
        38        2.0000           -0.3669280              -9.9846
        39        2.0000           -0.3608005              -9.8179 (HOMO)
        40                         -0.3082295              -8.3874 (LUMO)
        41                         -0.2473029              -6.7295
        42                         -0.2179608              -5.9310
        43                         -0.2069538              -5.6315
        44                         -0.1738583              -4.7309
       ...                                ...                  ...
        79                          0.6947096              18.9040
      -------------------------------------------------------------
                  HL-Gap            0.0525710 Eh            1.4305 eV
             Fermi-level           -0.3345150 Eh           -9.1026 eV

 SCC (total)                   0 d,  0 h,  0 min,  0.052 sec
 SCC setup                      ...        0 min,  0.000 sec (  0.664%)
 Dispersion                     ...        0 min,  0.000 sec (  0.907%)
 integral evaluation            ...        0 min,  0.012 sec ( 23.337%)
 zeroth order Hamiltonian       ...        0 min,  0.000 sec (  0.449%)
 iterations                     ...        0 min,  0.020 sec ( 38.304%)
 molecular gradient             ...        0 min,  0.018 sec ( 35.409%)
 printout                       ...        0 min,  0.000 sec (  0.823%)

         :::::::::::::::::::::::::::::::::::::::::::::::::::::
         ::                     SUMMARY                     ::
         :::::::::::::::::::::::::::::::::::::::::::::::::::::
         :: total energy             -41.889079819541 Eh    ::
         :: gradient norm              0.111624494073 Eh/a0 ::
         :: HOMO-LUMO gap              1.430529748438 eV    ::
         ::.................................................::
         :: SCC energy               -42.492863981807 Eh    ::
         :: -> isotropic ES            0.019393305203 Eh    ::
         :: -> anisotropic ES          0.005730284419 Eh    ::
         :: -> anisotropic XC          0.031613453885 Eh    ::
         :: -> dispersion             -0.029772711674 Eh    ::
         :: repulsion energy           0.603582763826 Eh    ::
         :: add. restraining           0.000000000000 Eh    ::
         :::::::::::::::::::::::::::::::::::::::::::::::::::::

      ----------------------------------------------------------- 
     |                   =====================                   |
     |                        A N C O P T                        |
     |                   =====================                   |
     |               Approximate Normal Coordinate               |
     |                Rational Function Optimizer                |
      ----------------------------------------------------------- 

          ...................................................
          :                      SETUP                      :
          :.................................................:
          :   optimization level            normal          :
          :   max. optcycles                   200          :
          :   ANC micro-cycles                  20          :
          :   degrees of freedom                81          :
          :.................................................:
          :   RF solver                   davidson          :
          :   input Hessian                  false          :
          :   write xtbopt.log                true          :
          :   linear?                        false          :
          :   energy convergence         0.5000000E-05 Eh   :
          :   grad. convergence          0.1000000E-02 Eh/α :
          :   maximium RF displ.         2.0000000          :
          :   Hlow (freq-cutoff)         0.5000000E-02      :
          :   Hmax (freq-cutoff)         5.0000000          :
          :   S6 in model hess.         20.0000000          :
          ...................................................

generating ANC from model Hessian ...
Using Lindh-Hessian (1995)
 Shifting diagonal of input Hessian by   4.373637557110720E-003
 Lowest  eigenvalues of input Hessian
   -0.000000   -0.000000   -0.000000    0.000000    0.000000    0.000000
    0.005000    0.006069    0.006254    0.006697    0.008121    0.008291
    0.009744    0.011318    0.012348    0.013608    0.018391    0.019493
 Highest eigenvalues
    1.672366    1.785628    1.899344    1.932884    2.015496    2.104138
 

........................................................................
.............................. CYCLE    1 ..............................
........................................................................
   1    -42.4928640 -0.424929E+02  0.798E-05    1.43       0.0  T
   2    -42.4928640  0.545342E-10  0.795E-05    1.43     233.5  T
   3    -42.4928640 -0.179483E-09  0.341E-05    1.43     544.2  T
     SCC iter.                  ...        0 min,  0.005 sec
     gradient                   ...        0 min,  0.018 sec
 * total energy  :   -41.8890798 Eh     change        0.1693223E-09 Eh
   gradient norm :     0.1116242 Eh/α   predicted     0.0000000E+00 (-100.00%)
   displ. norm   :     0.1754284 α      lambda       -0.1165062E-01
   maximum displ.:     0.0549087 α      in ANC's #51, #27, #46, ...

........................................................................
.............................. CYCLE    2 ..............................
........................................................................
   1    -42.5239215 -0.425239E+02  0.253E-01    1.39       0.0  T
   2    -42.5239679 -0.464749E-04  0.151E-01    1.38       1.0  T
   3    -42.5237488  0.219110E-03  0.113E-01    1.37       1.0  T
   4    -42.5240682 -0.319406E-03  0.291E-02    1.36       1.0  T
   5    -42.5240906 -0.223365E-04  0.110E-02    1.36       1.7  T
   6    -42.5240931 -0.250610E-05  0.372E-03    1.36       5.0  T
   7    -42.5240931 -0.319504E-07  0.189E-03    1.36       9.8  T
     SCC iter.                  ...        0 min,  0.010 sec
     gradient                   ...        0 min,  0.017 sec
 * total energy  :   -41.8973796 Eh     change       -0.8299786E-02 Eh
   gradient norm :     0.0540753 Eh/α   predicted    -0.6004589E-02 ( -27.65%)
   displ. norm   :     0.1501873 α      lambda       -0.4055074E-02
   maximum displ.:     0.0704865 α      in ANC's #8, #10, #12, ...

........................................................................
.............................. CYCLE    3 ..............................
........................................................................
   1    -42.5415471 -0.425415E+02  0.212E-01    1.33       0.0  T
   2    -42.5415858 -0.387343E-04  0.122E-01    1.32       1.0  T
   3    -42.5414534  0.132379E-03  0.885E-02    1.32       1.0  T
   4    -42.5416435 -0.190026E-03  0.210E-02    1.31       1.0  T
   5    -42.5416541 -0.106142E-04  0.919E-03    1.31       2.0  T
   6    -42.5416556 -0.149421E-05  0.370E-03    1.31       5.0  T
   7    -42.5416557 -0.119448E-06  0.143E-03    1.31      12.9  T
     SCC iter.                  ...        0 min,  0.010 sec
     gradient                   ...        0 min,  0.017 sec
 * total energy  :   -41.8994174 Eh     change       -0.2037802E-02 Eh
   gradient norm :     0.0110481 Eh/α   predicted    -0.2073273E-02 (   1.74%)
   displ. norm   :     0.0783173 α      lambda       -0.1995184E-03
   maximum displ.:     0.0480080 α      in ANC's #8, #5, #6, ...

........................................................................
.............................. CYCLE    4 ..............................
........................................................................
   1    -42.5397782 -0.425398E+02  0.439E-02    1.31       0.0  T
   2    -42.5397800 -0.179793E-05  0.252E-02    1.31       1.0  T
   3    -42.5397778  0.220903E-05  0.120E-02    1.31       1.5  T
   4    -42.5397807 -0.289844E-05  0.285E-03    1.31       6.5  T
   5    -42.5397808 -0.462681E-07  0.178E-03    1.31      10.4  T
     SCC iter.                  ...        0 min,  0.008 sec
     gradient                   ...        0 min,  0.017 sec
 * total energy  :   -41.8995603 Eh     change       -0.1429346E-03 Eh
   gradient norm :     0.0044864 Eh/α   predicted    -0.1003710E-03 ( -29.78%)
   displ. norm   :     0.1038365 α      lambda       -0.1001665E-03
   maximum displ.:     0.0614489 α      in ANC's #8, #5, #6, ...

........................................................................
.............................. CYCLE    5 ..............................
........................................................................
   1    -42.5388902 -0.425389E+02  0.556E-02    1.32       0.0  T
   2    -42.5388916 -0.139886E-05  0.303E-02    1.32       1.0  T
   3    -42.5388887  0.288461E-05  0.132E-02    1.32       1.4  T
   4    -42.5388923 -0.362740E-05  0.354E-03    1.32       5.2  T
   5    -42.5388923 -0.780783E-08  0.230E-03    1.32       8.1  T
   6    -42.5388924 -0.957883E-07  0.837E-04    1.32      22.2  T
     SCC iter.                  ...        0 min,  0.009 sec
     gradient                   ...        0 min,  0.017 sec
 * total energy  :   -41.8996213 Eh     change       -0.6096388E-04 Eh
   gradient norm :     0.0017521 Eh/α   predicted    -0.5062505E-04 ( -16.96%)
   displ. norm   :     0.0911803 α      lambda       -0.2262142E-04
   maximum displ.:     0.0497258 α      in ANC's #5, #8, #1, ...

........................................................................
.............................. CYCLE    6 ..............................
........................................................................
   1    -42.5389893 -0.425390E+02  0.465E-02    1.32       0.0  T
   2    -42.5389901 -0.811469E-06  0.245E-02    1.32       1.0  T
   3    -42.5389875  0.261309E-05  0.112E-02    1.32       1.7  T
   4    -42.5389906 -0.308765E-05  0.341E-03    1.32       5.4  T
   5    -42.5389906  0.431247E-07  0.250E-03    1.32       7.4  T
   6    -42.5389907 -0.163783E-06  0.431E-04    1.32      43.0  T
   7    -42.5389907 -0.293154E-08  0.179E-04    1.32     103.5  T
     SCC iter.                  ...        0 min,  0.010 sec
     gradient                   ...        0 min,  0.018 sec
 * total energy  :   -41.8996453 Eh     change       -0.2401310E-04 Eh
   gradient norm :     0.0023179 Eh/α   predicted    -0.1135551E-04 ( -52.71%)
   displ. norm   :     0.0685142 α      lambda       -0.2169289E-04
   maximum displ.:     0.0339804 α      in ANC's #1, #5, #2, ...

........................................................................
.............................. CYCLE    7 ..............................
........................................................................
   1    -42.5393384 -0.425393E+02  0.321E-02    1.32       0.0  T
   2    -42.5393387 -0.362852E-06  0.169E-02    1.33       1.1  T
   3    -42.5393382  0.568436E-06  0.544E-03    1.32       3.4  T
   4    -42.5393389 -0.676917E-06  0.235E-03    1.32       7.9  T
   5    -42.5393388  0.398020E-08  0.156E-03    1.32      11.9  T
   6    -42.5393389 -0.638951E-07  0.214E-04    1.32      86.6  T
   7    -42.5393389 -0.844935E-09  0.858E-05    1.32     216.5  T
     SCC iter.                  ...        0 min,  0.010 sec
     gradient                   ...        0 min,  0.018 sec
 * total energy  :   -41.8996634 Eh     change       -0.1808032E-04 Eh
   gradient norm :     0.0015651 Eh/α   predicted    -0.1089795E-04 ( -39.72%)
   displ. norm   :     0.1743692 α      lambda       -0.2772198E-04
   maximum displ.:     0.0931440 α      in ANC's #1, #2, #5, ...

........................................................................
.............................. CYCLE    8 ..............................
........................................................................
   1    -42.5396814 -0.425397E+02  0.805E-02    1.32       0.0  T
   2    -42.5396834 -0.198384E-05  0.426E-02    1.33       1.0  T
   3    -42.5396828  0.643793E-06  0.909E-03    1.32       2.0  T
   4    -42.5396835 -0.692612E-06  0.598E-03    1.33       3.1  T
   5    -42.5396838 -0.371725E-06  0.277E-03    1.33       6.7  T
   6    -42.5396840 -0.213099E-06  0.348E-04    1.33      53.3  T
   7    -42.5396840 -0.261217E-08  0.149E-04    1.33     124.4  T
     SCC iter.                  ...        0 min,  0.010 sec
     gradient                   ...        0 min,  0.018 sec
 * total energy  :   -41.8996879 Eh     change       -0.2445215E-04 Eh
   gradient norm :     0.0017360 Eh/α   predicted    -0.1405089E-04 ( -42.54%)
   displ. norm   :     0.0815890 α      lambda       -0.1161600E-04
   maximum displ.:     0.0531375 α      in ANC's #1, #2, #3, ...

........................................................................
.............................. CYCLE    9 ..............................
........................................................................
   1    -42.5397305 -0.425397E+02  0.318E-02    1.32       0.0  T
   2    -42.5397307 -0.234990E-06  0.175E-02    1.32       1.1  T
   3    -42.5397306  0.177421E-06  0.373E-03    1.32       5.0  T
   4    -42.5397308 -0.192295E-06  0.216E-03    1.32       8.6  T
   5    -42.5397308 -0.482057E-07  0.870E-04    1.32      21.3  T
   6    -42.5397308 -0.198714E-07  0.245E-04    1.32      75.8  T
     SCC iter.                  ...        0 min,  0.009 sec
     gradient                   ...        0 min,  0.018 sec
 * total energy  :   -41.8996992 Eh     change       -0.1137805E-04 Eh
   gradient norm :     0.0014011 Eh/α   predicted    -0.5825425E-05 ( -48.80%)
   displ. norm   :     0.0809961 α      lambda       -0.1476202E-04
   maximum displ.:     0.0547234 α      in ANC's #1, #2, #3, ...

........................................................................
.............................. CYCLE   10 ..............................
........................................................................
   1    -42.5397803 -0.425398E+02  0.320E-02    1.32       0.0  T
   2    -42.5397806 -0.256045E-06  0.181E-02    1.32       1.0  T
   3    -42.5397792  0.143208E-05  0.772E-03    1.32       2.4  T
   4    -42.5397807 -0.156724E-05  0.230E-03    1.32       8.1  T
   5    -42.5397807 -0.143197E-07  0.156E-03    1.32      11.9  T
   6    -42.5397808 -0.629999E-07  0.291E-04    1.32      63.8  T
   7    -42.5397808 -0.848210E-09  0.116E-04    1.32     159.5  T
     SCC iter.                  ...        0 min,  0.010 sec
     gradient                   ...        0 min,  0.018 sec
 * total energy  :   -41.8997151 Eh     change       -0.1591929E-04 Eh
   gradient norm :     0.0008016 Eh/α   predicted    -0.7409134E-05 ( -53.46%)
   displ. norm   :     0.0838962 α      lambda       -0.9247237E-05
   maximum displ.:     0.0607237 α      in ANC's #1, #2, #6, ...

........................................................................
.............................. CYCLE   11 ..............................
........................................................................
   1    -42.5394937 -0.425395E+02  0.294E-02    1.32       0.0  T
   2    -42.5394938 -0.128007E-06  0.167E-02    1.32       1.1  T
   3    -42.5394936  0.266921E-06  0.393E-03    1.32       4.7  T
   4    -42.5394938 -0.270338E-06  0.189E-03    1.32       9.8  T
   5    -42.5394939 -0.366382E-07  0.804E-04    1.32      23.1  T
   6    -42.5394939 -0.187666E-07  0.156E-04    1.32     119.1  T
     SCC iter.                  ...        0 min,  0.009 sec
     gradient                   ...        0 min,  0.018 sec
 * total energy  :   -41.8997259 Eh     change       -0.1074256E-04 Eh
   gradient norm :     0.0009202 Eh/α   predicted    -0.4639998E-05 ( -56.81%)
   displ. norm   :     0.0649571 α      lambda       -0.6046912E-05
   maximum displ.:     0.0500722 α      in ANC's #1, #2, #6, ...

........................................................................
.............................. CYCLE   12 ..............................
........................................................................
   1    -42.5395319 -0.425395E+02  0.216E-02    1.32       0.0  T
   2    -42.5395320 -0.758735E-07  0.121E-02    1.32       1.5  T
   3    -42.5395318  0.180724E-06  0.296E-03    1.32       6.3  T
   4    -42.5395320 -0.193612E-06  0.131E-03    1.32      14.2  T
   5    -42.5395320 -0.628245E-08  0.838E-04    1.32      22.1  T
   6    -42.5395320 -0.191192E-07  0.127E-04    1.32     145.7  T
     SCC iter.                  ...        0 min,  0.009 sec
     gradient                   ...        0 min,  0.018 sec
 * total energy  :   -41.8997333 Eh     change       -0.7403746E-05 Eh
   gradient norm :     0.0007095 Eh/α   predicted    -0.3032178E-05 ( -59.05%)
   displ. norm   :     0.0660382 α      lambda       -0.2011654E-05
   maximum displ.:     0.0514682 α      in ANC's #1, #2, #6, ...

........................................................................
.............................. CYCLE   13 ..............................
........................................................................
   1    -42.5395296 -0.425395E+02  0.220E-02    1.32       0.0  T
   2    -42.5395297 -0.783328E-07  0.123E-02    1.32       1.5  T
   3    -42.5395295  0.180538E-06  0.299E-03    1.32       6.2  T
   4    -42.5395297 -0.191220E-06  0.136E-03    1.32      13.7  T
   5    -42.5395297 -0.881167E-08  0.835E-04    1.32      22.2  T
   6    -42.5395297 -0.191469E-07  0.123E-04    1.32     150.9  T
     SCC iter.                  ...        0 min,  0.009 sec
     gradient                   ...        0 min,  0.018 sec
 * total energy  :   -41.8997376 Eh     change       -0.4345173E-05 Eh
   gradient norm :     0.0007784 Eh/α   predicted    -0.1012117E-05 ( -76.71%)
   displ. norm   :     0.0668204 α      lambda        0.1730242E-05
   maximum displ.:     0.0524666 α      in ANC's #1, #2, #6, ...

   *** GEOMETRY OPTIMIZATION CONVERGED AFTER 13 ITERATIONS ***

------------------------------------------------------------------------
 total energy gain   :        -0.0106578 Eh       -6.6879 kcal/mol
 total RMSD          :         0.1620365 a0        0.0857 Å
 total power (kW/mol):        -2.1524694 (step)  -54.0185 (real)
------------------------------------------------------------------------

 ANCopt (total)                0 d,  0 h,  0 min,  0.518 sec
 optimizer setup                ...        0 min,  0.000 sec (  0.030%)
 model hessian                  ...        0 min,  0.007 sec (  1.391%)
 ANC generation                 ...        0 min,  0.001 sec (  0.179%)
 coordinate transformation      ...        0 min,  0.000 sec (  0.055%)
 single point calculation       ...        0 min,  0.505 sec ( 97.527%)
 optimization log               ...        0 min,  0.002 sec (  0.290%)
 hessian update                 ...        0 min,  0.000 sec (  0.038%)
 rational function              ...        0 min,  0.002 sec (  0.321%)

================
 final structure:
================
$coord
   -2.09421877802032    2.14526045975926    0.17643406300469      C 
    0.34353106502340    1.24712150954593    0.14388391047693      C 
    2.47875103247763    2.65235463463956    0.18116943409527      N 
    4.62885599592270    1.44817847664426    0.14012168629517      C 
    6.94965373222467    3.07794017551511    0.09824166162387      C 
    7.78396434429680    3.58525929395303   -2.62454005602051      C 
    4.74977139130588   -1.26704322784418    0.05761082627703      C 
    7.20525259486510   -2.68543263159906    0.10838279302382      C 
    8.02305108396741   -3.17197980864297    2.84037975398634      C 
    2.71417596766486   -2.66258826754635    0.02525966248303      N 
    0.45999533315634   -1.47109209964647    0.06943154735182      C 
   -1.91713044704229   -2.59395395834990    0.05519915856990      C 
   -4.22303199608208   -0.27536657248037    0.12299194770541      S 
   -2.62250453231349   -5.20942169080389    0.00899156309278      C 
   -0.98185431348534   -7.11963095824884    0.01233286379449      C 
   -2.71765442849990    4.06951805654418    0.22856655564417      H 
    8.48432227046206    2.19749905379367    1.15270175763693      H 
    6.47141552190876    4.87270714754025    0.99207495367641      H 
    8.22353891359553    1.83279377263022   -3.60639871363723      H 
    9.45456578263837    4.78219563835109   -2.64085874461976      H 
    6.28044985361931    4.53984453155679   -3.64879245040852      H 
    8.67726837428906   -1.64935315950850   -0.89135513421754      H 
    6.91307034810606   -4.49666178765435   -0.83258654359275      H 
    8.30163928534137   -1.40515518454597    3.85449694336713      H 
    9.78269677618795   -4.23276033105702    2.87587899027352      H 
    6.57886338556483   -4.25735058000584    3.81883660375869      H 
   -4.63807305967803   -5.56281527921650   -0.02337926742594      H 
    1.02045446897873   -6.77312258244144    0.04639645651613      H 
   -1.61362180115750   -9.05208044907618   -0.01552364361078      H 
$end
           -------------------------------------------------
          |                Final Singlepoint                |
           -------------------------------------------------

          ...................................................
          :                      SETUP                      :
          :.................................................:
          :  # basis functions                  80          :
          :  # atomic orbitals                  79          :
          :  # shells                           45          :
          :  # electrons                        78          :
          :  max. iterations                   250          :
          :  Hamiltonian                  GFN2-xTB          :
          :  restarted?                      false          :
          :  GBSA solvation                  false          :
          :  PC potential                    false          :
          :  electronic temp.          300.0000000     K    :
          :  accuracy                    1.0000000          :
          :  -> integral cutoff          0.2500000E+02      :
          :  -> integral neglect         0.1000000E-07      :
          :  -> SCF convergence          0.1000000E-05 Eh   :
          :  -> wf. convergence          0.1000000E-03 e    :
          :  Broyden damping             0.4000000          :
          ...................................................

 iter      E             dE          RMSdq      gap      omega  full diag
   1    -42.5395297 -0.425395E+02  0.719E-05    1.32       0.0  T
   2    -42.5395297 -0.538591E-11  0.325E-05    1.32     571.8  T
   3    -42.5395297 -0.980549E-11  0.371E-05    1.32     500.7  T

   *** convergence criteria satisfied after 3 iterations ***

         #    Occupation            Energy/Eh            Energy/eV
      -------------------------------------------------------------
         1        2.0000           -0.7396051             -20.1257
       ...           ...                  ...                  ...
        33        2.0000           -0.4400441             -11.9742
        34        2.0000           -0.4331263             -11.7860
        35        2.0000           -0.4284274             -11.6581
        36        2.0000           -0.4096924             -11.1483
        37        2.0000           -0.4001461             -10.8885
        38        2.0000           -0.3675910             -10.0027
        39        2.0000           -0.3472425              -9.4489 (HOMO)
        40                         -0.2985632              -8.1243 (LUMO)
        41                         -0.2393833              -6.5140
        42                         -0.2154953              -5.8639
        43                         -0.2051836              -5.5833
        44                         -0.1688588              -4.5949
       ...                                ...                  ...
        79                          0.7145897              19.4450
      -------------------------------------------------------------
                  HL-Gap            0.0486793 Eh            1.3246 eV
             Fermi-level           -0.3229028 Eh           -8.7866 eV

 SCC (total)                   0 d,  0 h,  0 min,  0.036 sec
 SCC setup                      ...        0 min,  0.000 sec (  0.668%)
 Dispersion                     ...        0 min,  0.000 sec (  0.726%)
 integral evaluation            ...        0 min,  0.011 sec ( 31.831%)
 zeroth order Hamiltonian       ...        0 min,  0.000 sec (  0.565%)
 iterations                     ...        0 min,  0.005 sec ( 14.166%)
 molecular gradient             ...        0 min,  0.018 sec ( 50.870%)
 printout                       ...        0 min,  0.000 sec (  1.029%)

         :::::::::::::::::::::::::::::::::::::::::::::::::::::
         ::                     SUMMARY                     ::
         :::::::::::::::::::::::::::::::::::::::::::::::::::::
         :: total energy             -41.899737648294 Eh    ::
         :: gradient norm              0.000777627661 Eh/a0 ::
         :: HOMO-LUMO gap              1.324631945001 eV    ::
         ::.................................................::
         :: SCC energy               -42.539529736123 Eh    ::
         :: -> isotropic ES            0.019530716873 Eh    ::
         :: -> anisotropic ES          0.004852483159 Eh    ::
         :: -> anisotropic XC          0.031206677324 Eh    ::
         :: -> dispersion             -0.030000555977 Eh    ::
         :: repulsion energy           0.639584834827 Eh    ::
         :: add. restraining           0.000000000000 Eh    ::
         :::::::::::::::::::::::::::::::::::::::::::::::::::::

           -------------------------------------------------
          |                Property Printout                |
           -------------------------------------------------

    * Orbital Energies and Occupations

         #    Occupation            Energy/Eh            Energy/eV
      -------------------------------------------------------------
         1        2.0000           -0.7396051             -20.1257
       ...           ...                  ...                  ...
        27        2.0000           -0.4626373             -12.5890
        28        2.0000           -0.4598411             -12.5129
        29        2.0000           -0.4571301             -12.4391
        30        2.0000           -0.4505838             -12.2610
        31        2.0000           -0.4493089             -12.2263
        32        2.0000           -0.4412088             -12.0059
        33        2.0000           -0.4400441             -11.9742
        34        2.0000           -0.4331263             -11.7860
        35        2.0000           -0.4284274             -11.6581
        36        2.0000           -0.4096924             -11.1483
        37        2.0000           -0.4001461             -10.8885
        38        2.0000           -0.3675910             -10.0027
        39        2.0000           -0.3472425              -9.4489 (HOMO)
        40                         -0.2985632              -8.1243 (LUMO)
        41                         -0.2393833              -6.5140
        42                         -0.2154953              -5.8639
        43                         -0.2051836              -5.5833
        44                         -0.1688588              -4.5949
        45                         -0.1259316              -3.4268
        46                         -0.1046172              -2.8468
        47                         -0.0080138              -0.2181
        48                          0.0234328               0.6376
        49                          0.0336035               0.9144
        50                          0.0879338               2.3928
       ...                                ...                  ...
        79                          0.7145897              19.4450
      -------------------------------------------------------------
                  HL-Gap            0.0486793 Eh            1.3246 eV
             Fermi-level           -0.3229028 Eh           -8.7866 eV

     #   Z        covCN         q      C6AA      α(0)
     1   6 C      2.922    -0.045    29.121     8.849
     2   6 C      3.172     0.065    26.188     8.359
     3   7 N      1.843    -0.243    27.204     7.730
     4   6 C      2.953     0.090    25.990     8.362
     5   6 C      3.810    -0.064    21.712     6.633
     6   6 C      3.753    -0.096    22.398     6.749
     7   6 C      2.952     0.087    26.059     8.373
     8   6 C      3.810    -0.063    21.696     6.630
     9   6 C      3.754    -0.096    22.395     6.748
    10   7 N      1.842    -0.238    27.074     7.711
    11   6 C      3.164     0.060    26.340     8.388
    12   6 C      2.977     0.006    27.871     8.660
    13  16 S      2.367     0.012   140.577    19.955
    14   6 C      2.927    -0.027    28.682     8.783
    15   6 C      2.842    -0.089    30.214     9.008
    16   1 H      0.927     0.057     2.234     2.337
    17   1 H      0.925     0.042     2.424     2.435
    18   1 H      0.924     0.057     2.240     2.340
    19   1 H      0.925     0.034     2.537     2.491
    20   1 H      0.925     0.041     2.441     2.443
    21   1 H      0.925     0.044     2.394     2.419
    22   1 H      0.925     0.042     2.424     2.435
    23   1 H      0.924     0.054     2.267     2.354
    24   1 H      0.925     0.034     2.537     2.491
    25   1 H      0.925     0.040     2.443     2.444
    26   1 H      0.925     0.044     2.397     2.421
    27   1 H      0.925     0.040     2.448     2.447
    28   1 H      0.926     0.070     2.090     2.261
    29   1 H      0.926     0.044     2.395     2.420

 Mol. C6AA /au·bohr⁶  :      10910.445242
 Mol. C8AA /au·bohr⁸  :     283926.893723
 Mol. α(0) /au        :        164.677052


Wiberg/Mayer (AO) data.
largest (>0.10) Wiberg bond orders for each atom
          total WBO             WBO to atom ...
     1  C   3.935        C    2 1.442    S   13 1.240    H   16 0.968    C   12 0.128
     2  C   3.981        C    1 1.442    N    3 1.235    C   11 1.135
     3  N   3.058        C    4 1.575    C    2 1.235
     4  C   3.973        N    3 1.575    C    7 1.175    C    5 1.009
     5  C   3.994        C    4 1.009    C    6 0.996    H   18 0.972    H   17 0.968
     6  C   3.990        C    5 0.996    H   21 0.988    H   19 0.986    H   20 0.985
     7  C   3.974        N   10 1.561    C    4 1.175    C    8 1.009
     8  C   3.994        C    7 1.009    C    9 0.995    H   23 0.972    H   22 0.969
     9  C   3.989        C    8 0.995    H   26 0.988    H   24 0.987    H   25 0.985
    10  N   3.070        C    7 1.561    C   11 1.259
    11  C   3.981        C   12 1.358    N   10 1.259    C    2 1.135
    12  C   3.940        C   11 1.358    S   13 1.179    C   14 1.154    C    1 0.128
    13  S   2.714        C    1 1.240    C   12 1.179
    14  C   3.991        C   15 1.836    C   12 1.154    H   27 0.964
    15  C   3.981        C   14 1.836    H   29 0.978    H   28 0.970
    16  H   0.996        C    1 0.968
    17  H   0.997        C    5 0.968
    18  H   0.996        C    5 0.972
    19  H   0.999        C    6 0.986
    20  H   0.997        C    6 0.985
    21  H   0.998        C    6 0.988
    22  H   0.996        C    8 0.969
    23  H   0.997        C    8 0.972
    24  H   0.999        C    9 0.987
    25  H   0.997        C    9 0.985
    26  H   0.998        C    9 0.988
    27  H   0.998        C   14 0.964
    28  H   0.995        C   15 0.970
    29  H   0.998        C   15 0.978

molecular dipole:
                 x           y           z       tot (Debye)
 q only:        0.427      -0.166       0.001
   full:        0.654      -0.070       0.002       1.671
molecular quadrupole (traceless):
                xx          xy          yy          xz          yz          zz
 q only:        7.746       0.302      -2.176       0.093      -0.731      -5.570
  q+dip:        9.543       0.033      -2.404       0.170      -0.374      -7.139
   full:        7.940       0.216      -4.611       0.163      -0.671      -3.330

           -------------------------------------------------
          |                Geometry Summary                 |
           -------------------------------------------------

      molecular mass/u    :      218.3160000
   center of mass at/Å    :        0.9691382      -0.4085143       0.0513977
  moments of inertia/u·Å² :        0.5801878E+03   0.1275688E+04   0.1734644E+04
rotational constants/cm⁻¹ :        0.2905548E-01   0.1321454E-01   0.9718211E-02

 * 28 selected distances

     #   Z        #   Z                                     value/Å
     1   6 C      2   6 C                                 1.3748772
     2   6 C      3   7 N                                 1.3527943
     3   7 N      4   6 C                                 1.3042557
     5   6 C      6   6 C                                 1.5306846
     4   6 C      7   6 C                                 1.4389202
     8   6 C      9   6 C                                 1.5308989
     7   6 C     10   7 N                                 1.3061400
     2   6 C     11   6 C                                 1.4402755
    10   7 N     11   6 C                                 1.3494481
    11   6 C     12   6 C                                 1.3912178
     1   6 C     13  16 S                                 1.7060643
    12   6 C     13  16 S                                 1.7307919 (max)
    12   6 C     14   6 C                                 1.4337051
    14   6 C     15   6 C                                 1.3325019
     1   6 C     16   1 H                                 1.0707385 (min)
     5   6 C     17   1 H                                 1.0899343
     5   6 C     18   1 H                                 1.0907778
     6   6 C     19   1 H                                 1.0881521
     6   6 C     20   1 H                                 1.0875632
     6   6 C     21   1 H                                 1.0871833
     8   6 C     22   1 H                                 1.0896127
     8   6 C     23   1 H                                 1.0910995
     9   6 C     24   1 H                                 1.0880629
     9   6 C     25   1 H                                 1.0874391
     9   6 C     26   1 H                                 1.0872095
    14   6 C     27   1 H                                 1.0829986
    15   6 C     28   1 H                                 1.0754763
    15   6 C     29   1 H                                 1.0759707

 * 4 distinct bonds (by element types)

   Z      Z             #   av. dist./Å        max./Å        min./Å
   1 H    6 C          14     1.0851585     1.0910995     1.0707385
   6 C    6 C           8     1.4341352     1.5308989     1.3325019
   6 C    7 N           4     1.3281595     1.3527943     1.3042557
   6 C   16 S           2     1.7184281     1.7307919     1.7060643


optimized geometry written to: xtbopt.xyz


           -------------------------------------------------
          | TOTAL ENERGY              -41.899737648294 Eh   |
          | GRADIENT NORM               0.000777627661 Eh/α |
          | HOMO-LUMO GAP               1.324631945001 eV   |
           -------------------------------------------------

------------------------------------------------------------------------
 * finished run on 2021/05/19 at 10:59:30.291     
------------------------------------------------------------------------
 total:
 * wall-time:     0 d,  0 h,  0 min,  0.630 sec
 *  cpu-time:     0 d,  0 h,  0 min,  0.628 sec
 * ratio c/w:     0.997 speedup
 SCF:
 * wall-time:     0 d,  0 h,  0 min,  0.052 sec
 *  cpu-time:     0 d,  0 h,  0 min,  0.052 sec
 * ratio c/w:     0.997 speedup
 ANC optimizer:
 * wall-time:     0 d,  0 h,  0 min,  0.555 sec
 *  cpu-time:     0 d,  0 h,  0 min,  0.553 sec
 * ratio c/w:     0.998 speedup

