      -----------------------------------------------------------      
     |                   =====================                   |     
     |                           x T B                           |     
     |                   =====================                   |     
     |                         S. Grimme                         |     
     |          Mulliken Center for Theoretical Chemistry        |     
     |                    University of Bonn                     |     
     |                Version 6.2 RC2 (SAW190805)                |     
      -----------------------------------------------------------      

   This program is distributed in the hope that it will be useful,
   but WITHOUT ANY WARRANTY; without even the implied warranty of
   MERCHANTABILITY or FITNESS FOR A PARTICULAR PURPOSE.
   
   FOR NON-COMMERCIAL, ACADEMIA USE ONLY.
   
   Cite this work as:
   * S. Grimme, C. Bannwarth, P. Shushkov, J. Chem. Theory Comput., 2017,
     13, 1989-2009. DOI: 10.1021/acs.jctc.7b00118
   * C. Bannwarth, S. Ehlert and S. Grimme., J. Chem. Theory Comput., 2019,
     15, 1652-1671. DOI: 10.1021/acs.jctc.8b01176
   * P. Pracht, E. Caldeweyher, S. Ehlert, S. Grimme, ChemRxiv, 2019, preprint.
     DOI: 10.26434/chemrxiv.8326202.v1
   
   for DFT-D4:
   * E. Caldeweyher, C. Bannwarth and S. Grimme, J. Chem. Phys., 2017,
     147, 034112. DOI: 10.1063/1.4993215
   * E. Caldeweyher, S. Ehlert, A. Hansen, H. Neugebauer, S. Spicher,
     C. Bannwarth and S. Grimme, J. Chem. Phys., 2019, 150, 154122.
     DOI: 10.1063/1.5090222
   
   for sTDA-xTB:
   * S. Grimme and C. Bannwarth, J. Chem. Phys., 2016, 145, 054103.
     DOI: 10.1063/1.4959605
   
   in the mass-spec context:
   * V. Asgeirsson, C. Bauer and S. Grimme, Chem. Sci., 2017, 8, 4879.
     DOI: 10.1039/c7sc00601b
   
   for metadynamics refer to:
   * S. Grimme, J. Chem. Theory Comput., 2019, 155, 2847-2862
     DOI: 10.1021/acs.jctc.9b00143
   
   with help from (in alphabetical order)
   C. Bannwarth, F. Bohle, G. Brandenburg, E. Caldeweyher, M. Checinski,
   S. Dohm, S. Ehlert, S. Ehrlich, F. März, H. Neugebauer, J. Pisarek,
   P. Pracht, P. Shushkov, and S. Spicher.
   
 * started run on 2021/05/19 at 10:59:36.743     

           -------------------------------------------------
          |                Calculation Setup                |
           -------------------------------------------------

          program call               : /ihome/ghutchison/geoffh/xtb/xtb 625.xyz -opt
          hostname                   : smp-n144
          coordinate file            : 625.xyz
          omp threads                :                     1
          number of atoms            :                    28
          number of electrons        :                    76
          charge                     :                     0
          spin                       :                   0.0
          first test random number   :      0.41196483653831


########################################################################
# WARNING! Please study the warnings concerning your input carefully
#  - the use of '-opt' is discouraged, please use '--opt' next time
########################################################################

           ------------------------------------------------- 
          |                 G F N 2 - x T B                 |
          | Geometry, Frequencies, Noncovalent interactions |
          |            JCTC 2019 parametrisation            |
           ------------------------------------------------- 
             KAB for C  - Si     :                1.0500
             KAB for H  - Pd     :                0.9500
             k(s)              :                1.8500
             k(p)              :                2.2300
             k(d)              :                2.2300
             k(f)              :                2.0000
             kEN (H0ij)        :               -2.0000
             D4 a1             :                0.5200
             D4 a2             :                5.0000
             D4 s6             :                1.0000
             D4 s8             :                2.7000
             D4 s9             :                5.0000
             alphaj            :                2.0000

  Z AO/shell   Hii/eV     exponent
  1     Wed Apr 25 08:07:45 CEST 2018   EN: 2.200 GM2: 0.406  GM3: 0.0800  RAES: 1.40
     1s    -10.707211    1.230000
  6     Wed Apr 25 08:07:45 CEST 2018   EN: 2.550 GM2: 0.538  GM3: 0.1500  RAES: 3.00
     2s    -13.970922    2.096432
     2p    -10.063292    1.800000

           ------------------------------------------------- 
          |        Self-Consistent Charge Iterations        |
           ------------------------------------------------- 

          ...................................................
          :                      SETUP                      :
          :.................................................:
          :  # basis functions                  76          :
          :  # atomic orbitals                  76          :
          :  # shells                           44          :
          :  # electrons                        76          :
          :  max. iterations                   250          :
          :  Hamiltonian                  GFN2-xTB          :
          :  restarted?                      false          :
          :  GBSA solvation                  false          :
          :  PC potential                    false          :
          :  electronic temp.          300.0000000     K    :
          :  accuracy                    1.0000000          :
          :  -> integral cutoff          0.2500000E+02      :
          :  -> integral neglect         0.1000000E-07      :
          :  -> SCF convergence          0.1000000E-05 Eh   :
          :  -> wf. convergence          0.1000000E-03 e    :
          :  Broyden damping             0.4000000          :
          ...................................................

 iter      E             dE          RMSdq      gap      omega  full diag
   1    -41.0818807 -0.410819E+02  0.483E+00    2.71       0.0  T
   2    -41.1033452 -0.214646E-01  0.288E+00    2.69       1.0  T
   3    -41.0906661  0.126791E-01  0.776E-01    2.70       1.0  T
   4    -41.1040563 -0.133902E-01  0.306E-01    2.69       1.0  T
   5    -41.1067320 -0.267568E-02  0.648E-02    2.69       1.0  T
   6    -41.1068099 -0.778915E-04  0.335E-02    2.69       1.0  T
   7    -41.1068168 -0.697063E-05  0.145E-02    2.69       1.3  T
   8    -41.1068177 -0.828546E-06  0.517E-03    2.69       3.7  T
   9    -41.1068182 -0.565913E-06  0.109E-03    2.69      17.3  T
  10    -41.1068183 -0.244962E-07  0.395E-04    2.69      47.8  T
  11    -41.1068183 -0.700574E-09  0.209E-04    2.69      90.3  T

   *** convergence criteria satisfied after 11 iterations ***

         #    Occupation            Energy/Eh            Energy/eV
      -------------------------------------------------------------
         1        2.0000           -0.6490088             -17.6604
       ...           ...                  ...                  ...
        32        2.0000           -0.4241913             -11.5428
        33        2.0000           -0.4195130             -11.4155
        34        2.0000           -0.4112687             -11.1912
        35        2.0000           -0.4078814             -11.0990
        36        2.0000           -0.3978206             -10.8252
        37        2.0000           -0.3831087             -10.4249
        38        2.0000           -0.3675410             -10.0013 (HOMO)
        39                         -0.2686987              -7.3117 (LUMO)
        40                         -0.2506594              -6.8208
        41                         -0.2291658              -6.2359
        42                         -0.1958344              -5.3289
        43                         -0.1856327              -5.0513
       ...                                ...                  ...
        76                          0.7071573              19.2427
      -------------------------------------------------------------
                  HL-Gap            0.0988424 Eh            2.6896 eV
             Fermi-level           -0.3181198 Eh           -8.6565 eV

 SCC (total)                   0 d,  0 h,  0 min,  0.045 sec
 SCC setup                      ...        0 min,  0.000 sec (  0.704%)
 Dispersion                     ...        0 min,  0.001 sec (  1.185%)
 integral evaluation            ...        0 min,  0.011 sec ( 23.875%)
 zeroth order Hamiltonian       ...        0 min,  0.000 sec (  0.459%)
 iterations                     ...        0 min,  0.016 sec ( 35.407%)
 molecular gradient             ...        0 min,  0.017 sec ( 37.283%)
 printout                       ...        0 min,  0.000 sec (  0.964%)

         :::::::::::::::::::::::::::::::::::::::::::::::::::::
         ::                     SUMMARY                     ::
         :::::::::::::::::::::::::::::::::::::::::::::::::::::
         :: total energy             -40.344266669451 Eh    ::
         :: gradient norm              0.091665101711 Eh/a0 ::
         :: HOMO-LUMO gap              2.689637440595 eV    ::
         ::.................................................::
         :: SCC energy               -41.106818266678 Eh    ::
         :: -> isotropic ES            0.002005917692 Eh    ::
         :: -> anisotropic ES          0.005565907544 Eh    ::
         :: -> anisotropic XC          0.027896222887 Eh    ::
         :: -> dispersion             -0.030505869393 Eh    ::
         :: repulsion energy           0.762583117124 Eh    ::
         :: add. restraining           0.000000000000 Eh    ::
         :::::::::::::::::::::::::::::::::::::::::::::::::::::

      ----------------------------------------------------------- 
     |                   =====================                   |
     |                        A N C O P T                        |
     |                   =====================                   |
     |               Approximate Normal Coordinate               |
     |                Rational Function Optimizer                |
      ----------------------------------------------------------- 

          ...................................................
          :                      SETUP                      :
          :.................................................:
          :   optimization level            normal          :
          :   max. optcycles                   200          :
          :   ANC micro-cycles                  20          :
          :   degrees of freedom                78          :
          :.................................................:
          :   RF solver                   davidson          :
          :   input Hessian                  false          :
          :   write xtbopt.log                true          :
          :   linear?                        false          :
          :   energy convergence         0.5000000E-05 Eh   :
          :   grad. convergence          0.1000000E-02 Eh/α :
          :   maximium RF displ.         2.0000000          :
          :   Hlow (freq-cutoff)         0.5000000E-02      :
          :   Hmax (freq-cutoff)         5.0000000          :
          :   S6 in model hess.         20.0000000          :
          ...................................................

generating ANC from model Hessian ...
Using Lindh-Hessian (1995)
 Shifting diagonal of input Hessian by   3.812419701534899E-003
 Lowest  eigenvalues of input Hessian
   -0.000000   -0.000000   -0.000000   -0.000000    0.000000    0.000000
    0.005000    0.005777    0.007282    0.008209    0.008810    0.013068
    0.014507    0.016718    0.018958    0.020537    0.021930    0.024527
 Highest eigenvalues
    1.848778    1.901592    1.917974    1.961350    2.041431    2.088767
 

........................................................................
.............................. CYCLE    1 ..............................
........................................................................
   1    -41.1068183 -0.411068E+02  0.407E-05    2.69       0.0  T
   2    -41.1068183 -0.994049E-11  0.253E-05    2.69     745.6  T
   3    -41.1068183 -0.979128E-11  0.147E-05    2.69    1288.0  T
     SCC iter.                  ...        0 min,  0.005 sec
     gradient                   ...        0 min,  0.017 sec
 * total energy  :   -40.3442667 Eh     change       -0.3944272E-08 Eh
   gradient norm :     0.0916652 Eh/α   predicted     0.0000000E+00 (-100.00%)
   displ. norm   :     0.2279623 α      lambda       -0.8202243E-02
   maximum displ.:     0.1005850 α      in ANC's #3, #15, #17, ...

........................................................................
.............................. CYCLE    2 ..............................
........................................................................
   1    -41.1423479 -0.411423E+02  0.113E-01    2.83       0.0  T
   2    -41.1423884 -0.404344E-04  0.722E-02    2.83       1.0  T
   3    -41.1423914 -0.309103E-05  0.379E-02    2.83       1.0  T
   4    -41.1424089 -0.174203E-04  0.807E-03    2.83       2.3  T
   5    -41.1424107 -0.183680E-05  0.259E-03    2.83       7.3  T
   6    -41.1424107 -0.170503E-07  0.129E-03    2.83      14.7  T
     SCC iter.                  ...        0 min,  0.008 sec
     gradient                   ...        0 min,  0.016 sec
 * total energy  :   -40.3496944 Eh     change       -0.5427696E-02 Eh
   gradient norm :     0.0329614 Eh/α   predicted    -0.4314245E-02 ( -20.51%)
   displ. norm   :     0.1826296 α      lambda       -0.1690579E-02
   maximum displ.:     0.1234753 α      in ANC's #3, #8, #7, ...

........................................................................
.............................. CYCLE    3 ..............................
........................................................................
   1    -41.1555956 -0.411556E+02  0.733E-02    2.90       0.0  T
   2    -41.1556086 -0.129537E-04  0.446E-02    2.90       1.0  T
   3    -41.1556061  0.249856E-05  0.237E-02    2.90       1.0  T
   4    -41.1556147 -0.862585E-05  0.440E-03    2.90       4.3  T
   5    -41.1556153 -0.624624E-06  0.136E-03    2.90      13.9  T
   6    -41.1556153 -0.374060E-08  0.718E-04    2.90      26.3  T
     SCC iter.                  ...        0 min,  0.008 sec
     gradient                   ...        0 min,  0.016 sec
 * total energy  :   -40.3506448 Eh     change       -0.9504260E-03 Eh
   gradient norm :     0.0064273 Eh/α   predicted    -0.8734882E-03 (  -8.10%)
   displ. norm   :     0.1151649 α      lambda       -0.2415616E-03
   maximum displ.:     0.0890246 α      in ANC's #3, #2, #5, ...

........................................................................
.............................. CYCLE    4 ..............................
........................................................................
   1    -41.1547735 -0.411548E+02  0.511E-02    2.90       0.0  T
   2    -41.1547742 -0.638469E-06  0.301E-02    2.90       1.0  T
   3    -41.1547715  0.272191E-05  0.997E-03    2.90       1.9  T
   4    -41.1547746 -0.311915E-05  0.145E-03    2.90      13.0  T
   5    -41.1547746 -0.401939E-07  0.576E-04    2.90      32.8  T
   6    -41.1547746 -0.496527E-10  0.303E-04    2.90      62.3  T
     SCC iter.                  ...        0 min,  0.008 sec
     gradient                   ...        0 min,  0.016 sec
 * total energy  :   -40.3507950 Eh     change       -0.1501630E-03 Eh
   gradient norm :     0.0037838 Eh/α   predicted    -0.1223888E-03 ( -18.50%)
   displ. norm   :     0.1306663 α      lambda       -0.1438940E-03
   maximum displ.:     0.0983769 α      in ANC's #3, #5, #2, ...

........................................................................
.............................. CYCLE    5 ..............................
........................................................................
   1    -41.1527245 -0.411527E+02  0.606E-02    2.90       0.0  T
   2    -41.1527248 -0.325173E-06  0.358E-02    2.90       1.0  T
   3    -41.1527225  0.230226E-05  0.838E-03    2.90       2.3  T
   4    -41.1527251 -0.259658E-05  0.987E-04    2.90      19.1  T
   5    -41.1527251 -0.138238E-07  0.460E-04    2.90      41.1  T
   6    -41.1527251 -0.139195E-10  0.218E-04    2.90      86.8  T
     SCC iter.                  ...        0 min,  0.008 sec
     gradient                   ...        0 min,  0.017 sec
 * total energy  :   -40.3508747 Eh     change       -0.7976167E-04 Eh
   gradient norm :     0.0031421 Eh/α   predicted    -0.7317581E-04 (  -8.26%)
   displ. norm   :     0.0846067 α      lambda       -0.5939141E-04
   maximum displ.:     0.0528852 α      in ANC's #3, #5, #2, ...

........................................................................
.............................. CYCLE    6 ..............................
........................................................................
   1    -41.1522082 -0.411522E+02  0.485E-02    2.89       0.0  T
   2    -41.1522083 -0.100478E-06  0.286E-02    2.89       1.0  T
   3    -41.1522078  0.473138E-06  0.398E-03    2.89       4.8  T
   4    -41.1522084 -0.549107E-06  0.563E-04    2.89      33.6  T
   5    -41.1522084 -0.362661E-08  0.328E-04    2.89      57.6  T
     SCC iter.                  ...        0 min,  0.007 sec
     gradient                   ...        0 min,  0.017 sec
 * total energy  :   -40.3509213 Eh     change       -0.4653770E-04 Eh
   gradient norm :     0.0028245 Eh/α   predicted    -0.2990881E-04 ( -35.73%)
   displ. norm   :     0.1395076 α      lambda       -0.7709298E-04
   maximum displ.:     0.0803416 α      in ANC's #3, #5, #2, ...

........................................................................
.............................. CYCLE    7 ..............................
........................................................................
   1    -41.1525112 -0.411525E+02  0.755E-02    2.88       0.0  T
   2    -41.1525115 -0.242416E-06  0.444E-02    2.88       1.0  T
   3    -41.1525107  0.796427E-06  0.520E-03    2.88       3.6  T
   4    -41.1525116 -0.959642E-06  0.658E-04    2.88      28.7  T
   5    -41.1525117 -0.426240E-08  0.390E-04    2.88      48.5  T
     SCC iter.                  ...        0 min,  0.007 sec
     gradient                   ...        0 min,  0.017 sec
 * total energy  :   -40.3509768 Eh     change       -0.5557432E-04 Eh
   gradient norm :     0.0024898 Eh/α   predicted    -0.3929834E-04 ( -29.29%)
   displ. norm   :     0.1347605 α      lambda       -0.4901712E-04
   maximum displ.:     0.0822599 α      in ANC's #5, #3, #2, ...

........................................................................
.............................. CYCLE    8 ..............................
........................................................................
   1    -41.1530142 -0.411530E+02  0.724E-02    2.87       0.0  T
   2    -41.1530144 -0.162679E-06  0.426E-02    2.87       1.0  T
   3    -41.1530141  0.260368E-06  0.365E-03    2.87       5.2  T
   4    -41.1530145 -0.362464E-06  0.516E-04    2.87      36.6  T
   5    -41.1530145 -0.164566E-08  0.329E-04    2.87      57.5  T
     SCC iter.                  ...        0 min,  0.007 sec
     gradient                   ...        0 min,  0.017 sec
 * total energy  :   -40.3510113 Eh     change       -0.3446053E-04 Eh
   gradient norm :     0.0019298 Eh/α   predicted    -0.2495838E-04 ( -27.57%)
   displ. norm   :     0.1507967 α      lambda       -0.2995032E-04
   maximum displ.:     0.0974741 α      in ANC's #5, #2, #3, ...

........................................................................
.............................. CYCLE    9 ..............................
........................................................................
   1    -41.1538398 -0.411538E+02  0.815E-02    2.86       0.0  T
   2    -41.1538400 -0.222225E-06  0.479E-02    2.86       1.0  T
   3    -41.1538398  0.255556E-06  0.412E-03    2.86       4.6  T
   4    -41.1538402 -0.387617E-06  0.578E-04    2.86      32.7  T
   5    -41.1538402 -0.322920E-09  0.360E-04    2.86      52.5  T
     SCC iter.                  ...        0 min,  0.007 sec
     gradient                   ...        0 min,  0.017 sec
 * total energy  :   -40.3510393 Eh     change       -0.2797013E-04 Eh
   gradient norm :     0.0013752 Eh/α   predicted    -0.1512787E-04 ( -45.91%)
   displ. norm   :     0.0923576 α      lambda       -0.1775994E-04
   maximum displ.:     0.0640292 α      in ANC's #5, #2, #4, ...

........................................................................
.............................. CYCLE   10 ..............................
........................................................................
   1    -41.1540122 -0.411540E+02  0.502E-02    2.86       0.0  T
   2    -41.1540123 -0.942268E-07  0.296E-02    2.86       1.0  T
   3    -41.1540119  0.342755E-06  0.401E-03    2.86       4.7  T
   4    -41.1540123 -0.412001E-06  0.476E-04    2.86      39.7  T
   5    -41.1540123 -0.251679E-08  0.274E-04    2.86      68.9  T
     SCC iter.                  ...        0 min,  0.007 sec
     gradient                   ...        0 min,  0.017 sec
 * total energy  :   -40.3510594 Eh     change       -0.2015836E-04 Eh
   gradient norm :     0.0013638 Eh/α   predicted    -0.8922100E-05 ( -55.74%)
   displ. norm   :     0.1850052 α      lambda       -0.2750996E-04
   maximum displ.:     0.1228930 α      in ANC's #5, #2, #4, ...

........................................................................
.............................. CYCLE   11 ..............................
........................................................................
   1    -41.1530834 -0.411531E+02  0.967E-02    2.85       0.0  T
   2    -41.1530838 -0.360413E-06  0.569E-02    2.85       1.0  T
   3    -41.1530830  0.736142E-06  0.596E-03    2.85       3.2  T
   4    -41.1530840 -0.959513E-06  0.877E-04    2.85      21.5  T
   5    -41.1530840 -0.548533E-08  0.509E-04    2.85      37.1  T
     SCC iter.                  ...        0 min,  0.007 sec
     gradient                   ...        0 min,  0.017 sec
 * total energy  :   -40.3510837 Eh     change       -0.2430538E-04 Eh
   gradient norm :     0.0021738 Eh/α   predicted    -0.1396674E-04 ( -42.54%)
   displ. norm   :     0.0738813 α      lambda       -0.1896647E-04
   maximum displ.:     0.0417326 α      in ANC's #5, #1, #2, ...

........................................................................
.............................. CYCLE   12 ..............................
........................................................................
   1    -41.1534763 -0.411535E+02  0.368E-02    2.85       0.0  T
   2    -41.1534764 -0.650561E-07  0.217E-02    2.85       1.0  T
   3    -41.1534761  0.293092E-06  0.323E-03    2.85       5.9  T
   4    -41.1534764 -0.343051E-06  0.364E-04    2.85      51.9  T
   5    -41.1534764 -0.712461E-09  0.226E-04    2.85      83.6  T
     SCC iter.                  ...        0 min,  0.007 sec
     gradient                   ...        0 min,  0.017 sec
 * total energy  :   -40.3510969 Eh     change       -0.1313265E-04 Eh
   gradient norm :     0.0012119 Eh/α   predicted    -0.9535412E-05 ( -27.39%)
   displ. norm   :     0.2024831 α      lambda       -0.1634191E-04
   maximum displ.:     0.1288910 α      in ANC's #5, #2, #1, ...

........................................................................
.............................. CYCLE   13 ..............................
........................................................................
   1    -41.1526624 -0.411527E+02  0.101E-01    2.84       0.0  T
   2    -41.1526628 -0.399512E-06  0.596E-02    2.84       1.0  T
   3    -41.1526600  0.277620E-05  0.104E-02    2.84       1.8  T
   4    -41.1526632 -0.318264E-05  0.762E-04    2.84      24.8  T
   5    -41.1526632 -0.283750E-08  0.526E-04    2.84      35.9  T
   6    -41.1526632 -0.256885E-08  0.195E-04    2.84      97.0  T
     SCC iter.                  ...        0 min,  0.008 sec
     gradient                   ...        0 min,  0.017 sec
 * total energy  :   -40.3511000 Eh     change       -0.3122390E-05 Eh
   gradient norm :     0.0023463 Eh/α   predicted    -0.8322414E-05 ( 166.54%)
   displ. norm   :     0.0357970 α      lambda       -0.1408805E-04
   maximum displ.:     0.0277059 α      in ANC's #5, #2, #4, ...

........................................................................
.............................. CYCLE   14 ..............................
........................................................................
   1    -41.1534849 -0.411535E+02  0.175E-02    2.84       0.0  T
   2    -41.1534850 -0.365063E-07  0.103E-02    2.84       1.8  T
   3    -41.1534848  0.169725E-06  0.294E-03    2.84       6.4  T
   4    -41.1534850 -0.191346E-06  0.263E-04    2.84      71.9  T
   5    -41.1534850 -0.654182E-09  0.141E-04    2.84     134.3  T
     SCC iter.                  ...        0 min,  0.007 sec
     gradient                   ...        0 min,  0.017 sec
 * total energy  :   -40.3511083 Eh     change       -0.8328389E-05 Eh
   gradient norm :     0.0005574 Eh/α   predicted    -0.7054601E-05 ( -15.29%)
   displ. norm   :     0.0294683 α      lambda       -0.3914937E-05
   maximum displ.:     0.0205414 α      in ANC's #1, #2, #3, ...

........................................................................
.............................. CYCLE   15 ..............................
........................................................................
   1    -41.1535792 -0.411536E+02  0.143E-02    2.84       0.0  T
   2    -41.1535792 -0.196063E-07  0.839E-03    2.84       2.3  T
   3    -41.1535791  0.114574E-06  0.237E-03    2.84       8.0  T
   4    -41.1535792 -0.128134E-06  0.204E-04    2.84      92.5  T
   5    -41.1535792 -0.436174E-09  0.123E-04    2.84     153.5  T
     SCC iter.                  ...        0 min,  0.007 sec
     gradient                   ...        0 min,  0.016 sec
 * total energy  :   -40.3511119 Eh     change       -0.3548693E-05 Eh
   gradient norm :     0.0010935 Eh/α   predicted    -0.1959874E-05 ( -44.77%)
   displ. norm   :     0.0364048 α      lambda       -0.3785916E-05
   maximum displ.:     0.0263953 α      in ANC's #1, #2, #3, ...

........................................................................
.............................. CYCLE   16 ..............................
........................................................................
   1    -41.1537949 -0.411538E+02  0.152E-02    2.84       0.0  T
   2    -41.1537949 -0.198166E-07  0.892E-03    2.84       2.1  T
   3    -41.1537949  0.245299E-07  0.980E-04    2.84      19.3  T
   4    -41.1537949 -0.314942E-07  0.209E-04    2.84      90.6  T
     SCC iter.                  ...        0 min,  0.006 sec
     gradient                   ...        0 min,  0.017 sec
 * total energy  :   -40.3511154 Eh     change       -0.3555498E-05 Eh
   gradient norm :     0.0009073 Eh/α   predicted    -0.1896287E-05 ( -46.67%)
   displ. norm   :     0.0666384 α      lambda       -0.4635682E-05
   maximum displ.:     0.0484427 α      in ANC's #1, #2, #3, ...

   *** GEOMETRY OPTIMIZATION CONVERGED AFTER 16 ITERATIONS ***

------------------------------------------------------------------------
 total energy gain   :        -0.0068487 Eh       -4.2977 kcal/mol
 total RMSD          :         0.2481816 a0        0.1313 Å
 total power (kW/mol):        -1.1238360 (step)  -31.3817 (real)
------------------------------------------------------------------------

 ANCopt (total)                0 d,  0 h,  0 min,  0.573 sec
 optimizer setup                ...        0 min,  0.000 sec (  0.025%)
 model hessian                  ...        0 min,  0.004 sec (  0.708%)
 ANC generation                 ...        0 min,  0.001 sec (  0.152%)
 coordinate transformation      ...        0 min,  0.000 sec (  0.055%)
 single point calculation       ...        0 min,  0.562 sec ( 98.082%)
 optimization log               ...        0 min,  0.002 sec (  0.316%)
 hessian update                 ...        0 min,  0.000 sec (  0.040%)
 rational function              ...        0 min,  0.003 sec (  0.444%)

================
 final structure:
================
$coord
    5.29870733863082    1.66582555842839    0.14018991685922      C 
    6.65631098643877   -0.53297254189964    0.13730361545620      C 
    5.41890749736284   -2.88343874438890    0.05527369731366      C 
    2.80414260696941   -2.92285923118569    0.02884937067210      C 
    1.35813463609854   -0.70682052567529    0.04821447866944      C 
    2.64487499491639    1.63870642263369    0.08636016866669      C 
    1.25328983804265    3.93812231068704    0.07148382835480      C 
   -1.30109763838825    3.92839776507241    0.01816382509567      C 
   -2.67893443380931    1.61684696302146   -0.00198983240252      C 
   -1.37184271234143   -0.71633180878443    0.02454168584188      C 
   -2.81491589175526   -2.94265360340059    0.02814878834307      C 
   -5.40893726098900   -2.87517497686291   -0.00259717572723      C 
   -6.68565176509563   -0.56875503656141   -0.04250192258903      C 
   -5.33222809713680    1.63982112120202   -0.04062695711199      C 
    6.94513784284549   -5.17730791534859    0.00983926472184      C 
    6.16554052942620   -7.47894082369391   -0.61023649133762      C 
    6.25702042137313    3.46945485111073    0.18639476867808      H 
    8.69796987481346   -0.48166521492376    0.17817002239197      H 
    1.86804353996276   -4.73085037026221    0.01202480834682      H 
    2.29557387766314    5.69471220231707    0.09680854762855      H 
   -2.35625710355764    5.67722530560216   -0.00323963033581      H 
   -1.88992135072691   -4.75865657062422    0.06271875309010      H 
   -6.47238048546556   -4.61798143334627    0.00468196384130      H 
   -8.72617818813045   -0.53481346064462   -0.07112842089977      H 
   -6.29346717408585    3.44223674010204   -0.06633867892760      H 
    8.91552811373449   -4.89709166904451    0.49401911663984      H 
    4.25074591865624   -7.87751146874002   -1.16676458889999      H 
    7.43635590973558   -9.06696506114178   -0.60408768546577      H 
$end
           -------------------------------------------------
          |                Final Singlepoint                |
           -------------------------------------------------

          ...................................................
          :                      SETUP                      :
          :.................................................:
          :  # basis functions                  76          :
          :  # atomic orbitals                  76          :
          :  # shells                           44          :
          :  # electrons                        76          :
          :  max. iterations                   250          :
          :  Hamiltonian                  GFN2-xTB          :
          :  restarted?                      false          :
          :  GBSA solvation                  false          :
          :  PC potential                    false          :
          :  electronic temp.          300.0000000     K    :
          :  accuracy                    1.0000000          :
          :  -> integral cutoff          0.2500000E+02      :
          :  -> integral neglect         0.1000000E-07      :
          :  -> SCF convergence          0.1000000E-05 Eh   :
          :  -> wf. convergence          0.1000000E-03 e    :
          :  Broyden damping             0.4000000          :
          ...................................................

 iter      E             dE          RMSdq      gap      omega  full diag
   1    -41.1537949 -0.411538E+02  0.974E-05    2.84       0.0  T
   2    -41.1537949 -0.288338E-10  0.449E-05    2.84     420.4  T
   3    -41.1537949 -0.976286E-11  0.415E-05    2.84     455.2  T

   *** convergence criteria satisfied after 3 iterations ***

         #    Occupation            Energy/Eh            Energy/eV
      -------------------------------------------------------------
         1        2.0000           -0.6498816             -17.6842
       ...           ...                  ...                  ...
        32        2.0000           -0.4278483             -11.6423
        33        2.0000           -0.4212620             -11.4631
        34        2.0000           -0.4109287             -11.1819
        35        2.0000           -0.4066822             -11.0664
        36        2.0000           -0.3984652             -10.8428
        37        2.0000           -0.3848562             -10.4725
        38        2.0000           -0.3705446             -10.0830 (HOMO)
        39                         -0.2661059              -7.2411 (LUMO)
        40                         -0.2471262              -6.7246
        41                         -0.2291961              -6.2367
        42                         -0.1929828              -5.2513
        43                         -0.1811520              -4.9294
       ...                                ...                  ...
        76                          0.7162514              19.4902
      -------------------------------------------------------------
                  HL-Gap            0.1044387 Eh            2.8419 eV
             Fermi-level           -0.3183252 Eh           -8.6621 eV

 SCC (total)                   0 d,  0 h,  0 min,  0.033 sec
 SCC setup                      ...        0 min,  0.000 sec (  0.708%)
 Dispersion                     ...        0 min,  0.000 sec (  0.847%)
 integral evaluation            ...        0 min,  0.011 sec ( 31.904%)
 zeroth order Hamiltonian       ...        0 min,  0.000 sec (  0.529%)
 iterations                     ...        0 min,  0.005 sec ( 13.858%)
 molecular gradient             ...        0 min,  0.017 sec ( 50.839%)
 printout                       ...        0 min,  0.000 sec (  1.160%)

         :::::::::::::::::::::::::::::::::::::::::::::::::::::
         ::                     SUMMARY                     ::
         :::::::::::::::::::::::::::::::::::::::::::::::::::::
         :: total energy             -40.351115366132 Eh    ::
         :: gradient norm              0.000907527579 Eh/a0 ::
         :: HOMO-LUMO gap              2.841920777126 eV    ::
         ::.................................................::
         :: SCC energy               -41.153794900936 Eh    ::
         :: -> isotropic ES            0.002049835266 Eh    ::
         :: -> anisotropic ES          0.005523966930 Eh    ::
         :: -> anisotropic XC          0.026482419680 Eh    ::
         :: -> dispersion             -0.030750374760 Eh    ::
         :: repulsion energy           0.802707863670 Eh    ::
         :: add. restraining           0.000000000000 Eh    ::
         :::::::::::::::::::::::::::::::::::::::::::::::::::::

           -------------------------------------------------
          |                Property Printout                |
           -------------------------------------------------

    * Orbital Energies and Occupations

         #    Occupation            Energy/Eh            Energy/eV
      -------------------------------------------------------------
         1        2.0000           -0.6498816             -17.6842
       ...           ...                  ...                  ...
        26        2.0000           -0.4668871             -12.7046
        27        2.0000           -0.4566476             -12.4260
        28        2.0000           -0.4492030             -12.2234
        29        2.0000           -0.4392617             -11.9529
        30        2.0000           -0.4319978             -11.7553
        31        2.0000           -0.4313622             -11.7380
        32        2.0000           -0.4278483             -11.6423
        33        2.0000           -0.4212620             -11.4631
        34        2.0000           -0.4109287             -11.1819
        35        2.0000           -0.4066822             -11.0664
        36        2.0000           -0.3984652             -10.8428
        37        2.0000           -0.3848562             -10.4725
        38        2.0000           -0.3705446             -10.0830 (HOMO)
        39                         -0.2661059              -7.2411 (LUMO)
        40                         -0.2471262              -6.7246
        41                         -0.2291961              -6.2367
        42                         -0.1929828              -5.2513
        43                         -0.1811520              -4.9294
        44                         -0.1430538              -3.8927
        45                         -0.0929422              -2.5291
        46                         -0.0366369              -0.9969
        47                          0.0965806               2.6281
        48                          0.0991969               2.6993
        49                          0.1138081               3.0969
       ...                                ...                  ...
        76                          0.7162514              19.4902
      -------------------------------------------------------------
                  HL-Gap            0.1044387 Eh            2.8419 eV
             Fermi-level           -0.3183252 Eh           -8.6621 eV

     #   Z        covCN         q      C6AA      α(0)
     1   6 C      2.919    -0.037    28.913     8.818
     2   6 C      2.923    -0.036    28.890     8.814
     3   6 C      2.969     0.012    27.736     8.639
     4   6 C      2.925    -0.039    28.978     8.828
     5   6 C      2.977     0.006    27.878     8.661
     6   6 C      2.988     0.010    27.776     8.645
     7   6 C      2.914    -0.036    28.897     8.815
     8   6 C      2.915    -0.036    28.904     8.816
     9   6 C      2.987     0.012    27.741     8.640
    10   6 C      2.979     0.007    27.858     8.658
    11   6 C      2.920    -0.035    28.860     8.810
    12   6 C      2.918    -0.031    28.781     8.797
    13   6 C      2.916    -0.031    28.768     8.795
    14   6 C      2.923    -0.035    28.879     8.813
    15   6 C      2.896    -0.030    28.746     8.791
    16   6 C      2.837    -0.086    30.149     8.998
    17   1 H      0.926     0.030     2.586     2.515
    18   1 H      0.926     0.030     2.591     2.517
    19   1 H      0.926     0.038     2.477     2.461
    20   1 H      0.926     0.030     2.591     2.517
    21   1 H      0.926     0.030     2.590     2.517
    22   1 H      0.926     0.031     2.565     2.505
    23   1 H      0.926     0.029     2.603     2.523
    24   1 H      0.926     0.029     2.600     2.521
    25   1 H      0.926     0.030     2.586     2.515
    26   1 H      0.925     0.034     2.533     2.489
    27   1 H      0.926     0.038     2.475     2.460
    28   1 H      0.926     0.036     2.499     2.472

 Mol. C6AA /au·bohr⁶  :      10971.845383
 Mol. C8AA /au·bohr⁸  :     277587.895611
 Mol. α(0) /au        :        170.348929


Wiberg/Mayer (AO) data.
largest (>0.10) Wiberg bond orders for each atom
          total WBO             WBO to atom ...
     1  C   3.985        C    2 1.536    C    6 1.307    H   17 0.968    C    4 0.102
     2  C   3.985        C    1 1.536    C    3 1.303    H   18 0.968
     3  C   3.983        C    4 1.437    C    2 1.303    C   15 1.090
     4  C   3.991        C    3 1.437    C    5 1.350    H   19 0.957    C    1 0.102
     5  C   3.989        C    4 1.350    C    6 1.277    C   10 1.157
     6  C   3.990        C    1 1.307    C    5 1.277    C    7 1.212
     7  C   3.991        C    8 1.644    C    6 1.212    H   20 0.968
     8  C   3.981        C    7 1.644    C    9 1.206    H   21 0.968
     9  C   3.990        C   14 1.316    C   10 1.286    C    8 1.206
    10  C   3.985        C   11 1.333    C    9 1.286    C    5 1.157
    11  C   3.992        C   12 1.510    C   10 1.333    H   22 0.962    C   14 0.111
    12  C   3.984        C   11 1.510    C   13 1.360    H   23 0.971
    13  C   3.985        C   14 1.517    C   12 1.360    H   24 0.971
    14  C   3.984        C   13 1.517    C    9 1.316    H   25 0.968    C   11 0.111
    15  C   3.990        C   16 1.901    C    3 1.090    H   26 0.964
    16  C   3.975        C   15 1.901    H   28 0.978    H   27 0.973
    17  H   0.998        C    1 0.968
    18  H   0.998        C    2 0.968
    19  H   0.998        C    4 0.957
    20  H   0.998        C    7 0.968
    21  H   0.998        C    8 0.968
    22  H   0.999        C   11 0.962
    23  H   0.999        C   12 0.971
    24  H   0.998        C   13 0.971
    25  H   0.999        C   14 0.968
    26  H   0.998        C   15 0.964
    27  H   0.999        C   16 0.973
    28  H   0.998        C   16 0.978

molecular dipole:
                 x           y           z       tot (Debye)
 q only:        0.001      -0.011       0.004
   full:        0.006       0.005      -0.001       0.020
molecular quadrupole (traceless):
                xx          xy          yy          xz          yz          zz
 q only:        1.519       0.028       1.682       0.241       0.117      -3.201
  q+dip:        6.597       0.303       6.512       0.900       0.625     -13.108
   full:        3.247       0.167       3.162       0.445       0.306      -6.409

           -------------------------------------------------
          |                Geometry Summary                 |
           -------------------------------------------------

      molecular mass/u    :      204.2708000
   center of mass at/Å    :        0.4394981      -0.4339098      -0.0038320
  moments of inertia/u·Å² :        0.4892738E+03   0.1291260E+04   0.1777772E+04
rotational constants/cm⁻¹ :        0.3445439E-01   0.1305518E-01   0.9482449E-02

 * 28 selected distances

     #   Z        #   Z                                     value/Å
     1   6 C      2   6 C                                 1.3674711
     2   6 C      3   6 C                                 1.4063166
     3   6 C      4   6 C                                 1.3839020
     4   6 C      5   6 C                                 1.4002856
     1   6 C      6   6 C                                 1.4047099
     5   6 C      6   6 C                                 1.4158486
     6   6 C      7   6 C                                 1.4223005
     7   6 C      8   6 C                                 1.3520280
     8   6 C      9   6 C                                 1.4240776 (max)
     9   6 C     10   6 C                                 1.4152812
    10   6 C     11   6 C                                 1.4039644
    11   6 C     12   6 C                                 1.3732579
    12   6 C     13   6 C                                 1.3951792
     9   6 C     14   6 C                                 1.4042642
    13   6 C     14   6 C                                 1.3707190
    15   6 C     16   6 C                                 1.3271466
     1   6 C     17   1 H                                 1.0810740
     2   6 C     18   1 H                                 1.0809569
     4   6 C     19   1 H                                 1.0774180
     7   6 C     20   1 H                                 1.0809481
     8   6 C     21   1 H                                 1.0808978
    11   6 C     22   1 H                                 1.0786233
    12   6 C     23   1 H                                 1.0803953
    13   6 C     24   1 H                                 1.0800558
    14   6 C     25   1 H                                 1.0810437
    15   6 C     26   1 H                                 1.0838952
    16   6 C     27   1 H                                 1.0760687 (min)
    16   6 C     28   1 H                                 1.0763042

 * 2 distinct bonds (by element types)

   Z      Z             #   av. dist./Å        max./Å        min./Å
   1 H    6 C          12     1.0798067     1.0838952     1.0760687
   6 C    6 C          16     1.3916720     1.4240776     1.3271466


optimized geometry written to: xtbopt.xyz


           -------------------------------------------------
          | TOTAL ENERGY              -40.351115366132 Eh   |
          | GRADIENT NORM               0.000907527579 Eh/α |
          | HOMO-LUMO GAP               2.841920777126 eV   |
           -------------------------------------------------

------------------------------------------------------------------------
 * finished run on 2021/05/19 at 10:59:37.419     
------------------------------------------------------------------------
 total:
 * wall-time:     0 d,  0 h,  0 min,  0.675 sec
 *  cpu-time:     0 d,  0 h,  0 min,  0.673 sec
 * ratio c/w:     0.996 speedup
 SCF:
 * wall-time:     0 d,  0 h,  0 min,  0.045 sec
 *  cpu-time:     0 d,  0 h,  0 min,  0.045 sec
 * ratio c/w:     0.998 speedup
 ANC optimizer:
 * wall-time:     0 d,  0 h,  0 min,  0.607 sec
 *  cpu-time:     0 d,  0 h,  0 min,  0.605 sec
 * ratio c/w:     0.998 speedup

