      -----------------------------------------------------------      
     |                   =====================                   |     
     |                           x T B                           |     
     |                   =====================                   |     
     |                         S. Grimme                         |     
     |          Mulliken Center for Theoretical Chemistry        |     
     |                    University of Bonn                     |     
     |                Version 6.2 RC2 (SAW190805)                |     
      -----------------------------------------------------------      

   This program is distributed in the hope that it will be useful,
   but WITHOUT ANY WARRANTY; without even the implied warranty of
   MERCHANTABILITY or FITNESS FOR A PARTICULAR PURPOSE.
   
   FOR NON-COMMERCIAL, ACADEMIA USE ONLY.
   
   Cite this work as:
   * S. Grimme, C. Bannwarth, P. Shushkov, J. Chem. Theory Comput., 2017,
     13, 1989-2009. DOI: 10.1021/acs.jctc.7b00118
   * C. Bannwarth, S. Ehlert and S. Grimme., J. Chem. Theory Comput., 2019,
     15, 1652-1671. DOI: 10.1021/acs.jctc.8b01176
   * P. Pracht, E. Caldeweyher, S. Ehlert, S. Grimme, ChemRxiv, 2019, preprint.
     DOI: 10.26434/chemrxiv.8326202.v1
   
   for DFT-D4:
   * E. Caldeweyher, C. Bannwarth and S. Grimme, J. Chem. Phys., 2017,
     147, 034112. DOI: 10.1063/1.4993215
   * E. Caldeweyher, S. Ehlert, A. Hansen, H. Neugebauer, S. Spicher,
     C. Bannwarth and S. Grimme, J. Chem. Phys., 2019, 150, 154122.
     DOI: 10.1063/1.5090222
   
   for sTDA-xTB:
   * S. Grimme and C. Bannwarth, J. Chem. Phys., 2016, 145, 054103.
     DOI: 10.1063/1.4959605
   
   in the mass-spec context:
   * V. Asgeirsson, C. Bauer and S. Grimme, Chem. Sci., 2017, 8, 4879.
     DOI: 10.1039/c7sc00601b
   
   for metadynamics refer to:
   * S. Grimme, J. Chem. Theory Comput., 2019, 155, 2847-2862
     DOI: 10.1021/acs.jctc.9b00143
   
   with help from (in alphabetical order)
   C. Bannwarth, F. Bohle, G. Brandenburg, E. Caldeweyher, M. Checinski,
   S. Dohm, S. Ehlert, S. Ehrlich, F. März, H. Neugebauer, J. Pisarek,
   P. Pracht, P. Shushkov, and S. Spicher.
   
 * started run on 2021/05/19 at 10:59:37.438     

           -------------------------------------------------
          |                Calculation Setup                |
           -------------------------------------------------

          program call               : /ihome/ghutchison/geoffh/xtb/xtb 626.xyz -opt
          hostname                   : smp-n144
          coordinate file            : 626.xyz
          omp threads                :                     1
          number of atoms            :                    26
          number of electrons        :                    70
          charge                     :                     0
          spin                       :                   0.0
          first test random number   :      0.15568963914812


########################################################################
# WARNING! Please study the warnings concerning your input carefully
#  - the use of '-opt' is discouraged, please use '--opt' next time
########################################################################

           ------------------------------------------------- 
          |                 G F N 2 - x T B                 |
          | Geometry, Frequencies, Noncovalent interactions |
          |            JCTC 2019 parametrisation            |
           ------------------------------------------------- 
             KAB for C  - Si     :                1.0500
             KAB for H  - Pd     :                0.9500
             k(s)              :                1.8500
             k(p)              :                2.2300
             k(d)              :                2.2300
             k(f)              :                2.0000
             kEN (H0ij)        :               -2.0000
             D4 a1             :                0.5200
             D4 a2             :                5.0000
             D4 s6             :                1.0000
             D4 s8             :                2.7000
             D4 s9             :                5.0000
             alphaj            :                2.0000

  Z AO/shell   Hii/eV     exponent
  1     Wed Apr 25 08:07:45 CEST 2018   EN: 2.200 GM2: 0.406  GM3: 0.0800  RAES: 1.40
     1s    -10.707211    1.230000
  6     Wed Apr 25 08:07:45 CEST 2018   EN: 2.550 GM2: 0.538  GM3: 0.1500  RAES: 3.00
     2s    -13.970922    2.096432
     2p    -10.063292    1.800000
  7     Wed Apr 25 08:07:45 CEST 2018   EN: 3.040 GM2: 0.461  GM3:-0.0640  RAES: 1.90
     2s    -16.686243    2.339881
     2p    -12.523956    2.014332

           ------------------------------------------------- 
          |        Self-Consistent Charge Iterations        |
           ------------------------------------------------- 

          ...................................................
          :                      SETUP                      :
          :.................................................:
          :  # basis functions                  68          :
          :  # atomic orbitals                  68          :
          :  # shells                           40          :
          :  # electrons                        70          :
          :  max. iterations                   250          :
          :  Hamiltonian                  GFN2-xTB          :
          :  restarted?                      false          :
          :  GBSA solvation                  false          :
          :  PC potential                    false          :
          :  electronic temp.          300.0000000     K    :
          :  accuracy                    1.0000000          :
          :  -> integral cutoff          0.2500000E+02      :
          :  -> integral neglect         0.1000000E-07      :
          :  -> SCF convergence          0.1000000E-05 Eh   :
          :  -> wf. convergence          0.1000000E-03 e    :
          :  Broyden damping             0.4000000          :
          ...................................................

 iter      E             dE          RMSdq      gap      omega  full diag
   1    -38.1490786 -0.381491E+02  0.384E+00    2.85       0.0  T
   2    -38.2488939 -0.998153E-01  0.269E+00    2.54       1.0  T
   3    -38.2619816 -0.130877E-01  0.144E+00    2.62       1.0  T
   4    -38.2609851  0.996571E-03  0.582E-01    2.60       1.0  T
   5    -38.2667912 -0.580609E-02  0.111E-01    2.60       1.0  T
   6    -38.2667916 -0.402772E-06  0.816E-02    2.60       1.0  T
   7    -38.2669171 -0.125556E-03  0.241E-02    2.60       1.0  T
   8    -38.2669180 -0.847554E-06  0.117E-02    2.60       1.7  T
   9    -38.2669193 -0.133600E-05  0.338E-03    2.60       5.8  T
  10    -38.2669195 -0.172366E-06  0.136E-03    2.60      14.4  T
  11    -38.2669195 -0.303868E-08  0.779E-04    2.60      25.2  T
  12    -38.2669195 -0.723969E-08  0.308E-04    2.60      63.7  T

   *** convergence criteria satisfied after 12 iterations ***

         #    Occupation            Energy/Eh            Energy/eV
      -------------------------------------------------------------
         1        2.0000           -0.6632941             -18.0492
       ...           ...                  ...                  ...
        29        2.0000           -0.4263910             -11.6027
        30        2.0000           -0.4225830             -11.4991
        31        2.0000           -0.4135049             -11.2520
        32        2.0000           -0.3898787             -10.6091
        33        2.0000           -0.3767275             -10.2513
        34        2.0000           -0.3652589              -9.9392
        35        2.0000           -0.3423646              -9.3162 (HOMO)
        36                         -0.2466897              -6.7128 (LUMO)
        37                         -0.2060693              -5.6074
        38                         -0.1758104              -4.7840
        39                         -0.1600352              -4.3548
        40                         -0.1143009              -3.1103
       ...                                ...                  ...
        68                          0.7239965              19.7009
      -------------------------------------------------------------
                  HL-Gap            0.0956749 Eh            2.6034 eV
             Fermi-level           -0.2945272 Eh           -8.0145 eV

 SCC (total)                   0 d,  0 h,  0 min,  0.038 sec
 SCC setup                      ...        0 min,  0.000 sec (  0.823%)
 Dispersion                     ...        0 min,  0.000 sec (  1.069%)
 integral evaluation            ...        0 min,  0.009 sec ( 23.061%)
 zeroth order Hamiltonian       ...        0 min,  0.000 sec (  0.437%)
 iterations                     ...        0 min,  0.014 sec ( 38.049%)
 molecular gradient             ...        0 min,  0.013 sec ( 35.400%)
 printout                       ...        0 min,  0.000 sec (  1.014%)

         :::::::::::::::::::::::::::::::::::::::::::::::::::::
         ::                     SUMMARY                     ::
         :::::::::::::::::::::::::::::::::::::::::::::::::::::
         :: total energy             -37.601896936446 Eh    ::
         :: gradient norm              0.059038079561 Eh/a0 ::
         :: HOMO-LUMO gap              2.603446546358 eV    ::
         ::.................................................::
         :: SCC energy               -38.266919495467 Eh    ::
         :: -> isotropic ES            0.009596595485 Eh    ::
         :: -> anisotropic ES          0.009256783708 Eh    ::
         :: -> anisotropic XC          0.024279649060 Eh    ::
         :: -> dispersion             -0.023657910938 Eh    ::
         :: repulsion energy           0.665101789146 Eh    ::
         :: add. restraining           0.000000000000 Eh    ::
         :::::::::::::::::::::::::::::::::::::::::::::::::::::

      ----------------------------------------------------------- 
     |                   =====================                   |
     |                        A N C O P T                        |
     |                   =====================                   |
     |               Approximate Normal Coordinate               |
     |                Rational Function Optimizer                |
      ----------------------------------------------------------- 

          ...................................................
          :                      SETUP                      :
          :.................................................:
          :   optimization level            normal          :
          :   max. optcycles                   200          :
          :   ANC micro-cycles                  20          :
          :   degrees of freedom                72          :
          :.................................................:
          :   RF solver                   davidson          :
          :   input Hessian                  false          :
          :   write xtbopt.log                true          :
          :   linear?                        false          :
          :   energy convergence         0.5000000E-05 Eh   :
          :   grad. convergence          0.1000000E-02 Eh/α :
          :   maximium RF displ.         2.0000000          :
          :   Hlow (freq-cutoff)         0.5000000E-02      :
          :   Hmax (freq-cutoff)         5.0000000          :
          :   S6 in model hess.         20.0000000          :
          ...................................................

generating ANC from model Hessian ...
Using Lindh-Hessian (1995)
 Shifting diagonal of input Hessian by   4.283640370333401E-003
 Lowest  eigenvalues of input Hessian
   -0.000000    0.000000    0.000000    0.000000    0.000000    0.000000
    0.005000    0.005222    0.006091    0.008686    0.009148    0.010695
    0.013405    0.015954    0.016835    0.020798    0.023972    0.025078
 Highest eigenvalues
    1.928612    1.988887    2.031523    2.057921    2.080474    2.178682
 

........................................................................
.............................. CYCLE    1 ..............................
........................................................................
   1    -38.2669195 -0.382669E+02  0.120E-04    2.60       0.0  T
   2    -38.2669195 -0.569287E-10  0.790E-05    2.60     248.3  T
   3    -38.2669195 -0.610854E-10  0.491E-05    2.60     399.3  T
     SCC iter.                  ...        0 min,  0.004 sec
     gradient                   ...        0 min,  0.013 sec
 * total energy  :   -37.6018970 Eh     change       -0.1904799E-07 Eh
   gradient norm :     0.0590431 Eh/α   predicted     0.0000000E+00 (-100.00%)
   displ. norm   :     0.2602591 α      lambda       -0.6439584E-02
   maximum displ.:     0.1071052 α      in ANC's #13, #12, #7, ...

........................................................................
.............................. CYCLE    2 ..............................
........................................................................
   1    -38.2867298 -0.382867E+02  0.168E-01    2.62       0.0  T
   2    -38.2868087 -0.789798E-04  0.103E-01    2.63       1.0  T
   3    -38.2868088 -0.570267E-07  0.649E-02    2.62       1.0  T
   4    -38.2868572 -0.484210E-04  0.201E-02    2.63       1.0  T
   5    -38.2868634 -0.621697E-05  0.565E-03    2.62       3.5  T
   6    -38.2868639 -0.508567E-06  0.255E-03    2.62       7.7  T
   7    -38.2868640 -0.226785E-07  0.770E-04    2.62      25.5  T
     SCC iter.                  ...        0 min,  0.008 sec
     gradient                   ...        0 min,  0.012 sec
 * total energy  :   -37.6063030 Eh     change       -0.4406047E-02 Eh
   gradient norm :     0.0257607 Eh/α   predicted    -0.3437894E-02 ( -21.97%)
   displ. norm   :     0.2611994 α      lambda       -0.1990347E-02
   maximum displ.:     0.1295855 α      in ANC's #7, #6, #2, ...

........................................................................
.............................. CYCLE    3 ..............................
........................................................................
   1    -38.2930988 -0.382931E+02  0.172E-01    2.63       0.0  T
   2    -38.2931448 -0.459925E-04  0.100E-01    2.63       1.0  T
   3    -38.2931123  0.324529E-04  0.553E-02    2.63       1.0  T
   4    -38.2931613 -0.490380E-04  0.144E-02    2.63       1.4  T
   5    -38.2931648 -0.349294E-05  0.413E-03    2.63       4.8  T
   6    -38.2931651 -0.254680E-06  0.191E-03    2.63      10.3  T
     SCC iter.                  ...        0 min,  0.007 sec
     gradient                   ...        0 min,  0.012 sec
 * total energy  :   -37.6075403 Eh     change       -0.1237305E-02 Eh
   gradient norm :     0.0080654 Eh/α   predicted    -0.1063076E-02 ( -14.08%)
   displ. norm   :     0.2229072 α      lambda       -0.5155415E-03
   maximum displ.:     0.1319111 α      in ANC's #2, #7, #6, ...

........................................................................
.............................. CYCLE    4 ..............................
........................................................................
   1    -38.2919041 -0.382919E+02  0.147E-01    2.61       0.0  T
   2    -38.2919105 -0.643136E-05  0.851E-02    2.61       1.0  T
   3    -38.2918976  0.129786E-04  0.260E-02    2.61       1.0  T
   4    -38.2919132 -0.156675E-04  0.458E-03    2.61       4.3  T
   5    -38.2919135 -0.257212E-06  0.205E-03    2.61       9.5  T
   6    -38.2919135 -0.217411E-07  0.104E-03    2.61      18.9  T
     SCC iter.                  ...        0 min,  0.007 sec
     gradient                   ...        0 min,  0.012 sec
 * total energy  :   -37.6079304 Eh     change       -0.3900990E-03 Eh
   gradient norm :     0.0064132 Eh/α   predicted    -0.2705790E-03 ( -30.64%)
   displ. norm   :     0.3202168 α      lambda       -0.5188528E-03
   maximum displ.:     0.2020398 α      in ANC's #2, #7, #6, ...

........................................................................
.............................. CYCLE    5 ..............................
........................................................................
   1    -38.2891836 -0.382892E+02  0.210E-01    2.56       0.0  T
   2    -38.2891894 -0.575874E-05  0.122E-01    2.56       1.0  T
   3    -38.2891705  0.189087E-04  0.316E-02    2.56       1.0  T
   4    -38.2891930 -0.225554E-04  0.445E-03    2.56       4.4  T
   5    -38.2891931 -0.117640E-06  0.251E-03    2.56       7.8  T
   6    -38.2891932 -0.382469E-07  0.940E-04    2.56      20.9  T
     SCC iter.                  ...        0 min,  0.007 sec
     gradient                   ...        0 min,  0.012 sec
 * total energy  :   -37.6082985 Eh     change       -0.3680569E-03 Eh
   gradient norm :     0.0087791 Eh/α   predicted    -0.2860280E-03 ( -22.29%)
   displ. norm   :     0.2730937 α      lambda       -0.3778552E-03
   maximum displ.:     0.1965904 α      in ANC's #2, #7, #8, ...

........................................................................
.............................. CYCLE    6 ..............................
........................................................................
   1    -38.2886159 -0.382886E+02  0.175E-01    2.51       0.0  T
   2    -38.2886196 -0.371063E-05  0.101E-01    2.52       1.0  T
   3    -38.2886047  0.148941E-04  0.276E-02    2.52       1.0  T
   4    -38.2886222 -0.174168E-04  0.366E-03    2.52       5.4  T
   5    -38.2886223 -0.899510E-07  0.198E-03    2.52       9.9  T
   6    -38.2886223 -0.541019E-08  0.906E-04    2.52      21.7  T
     SCC iter.                  ...        0 min,  0.007 sec
     gradient                   ...        0 min,  0.012 sec
 * total energy  :   -37.6085723 Eh     change       -0.2738328E-03 Eh
   gradient norm :     0.0083298 Eh/α   predicted    -0.2030180E-03 ( -25.86%)
   displ. norm   :     0.2336908 α      lambda       -0.3419468E-03
   maximum displ.:     0.1884032 α      in ANC's #2, #4, #7, ...

........................................................................
.............................. CYCLE    7 ..............................
........................................................................
   1    -38.2907868 -0.382908E+02  0.149E-01    2.49       0.0  T
   2    -38.2907908 -0.394027E-05  0.863E-02    2.49       1.0  T
   3    -38.2907804  0.104070E-04  0.228E-02    2.49       1.0  T
   4    -38.2907927 -0.123379E-04  0.390E-03    2.49       5.0  T
   5    -38.2907929 -0.185685E-06  0.189E-03    2.49      10.4  T
   6    -38.2907929 -0.106958E-07  0.907E-04    2.49      21.6  T
     SCC iter.                  ...        0 min,  0.007 sec
     gradient                   ...        0 min,  0.012 sec
 * total energy  :   -37.6088290 Eh     change       -0.2566666E-03 Eh
   gradient norm :     0.0054275 Eh/α   predicted    -0.1803164E-03 ( -29.75%)
   displ. norm   :     0.2514187 α      lambda       -0.2673296E-03
   maximum displ.:     0.2067803 α      in ANC's #2, #4, #8, ...

........................................................................
.............................. CYCLE    8 ..............................
........................................................................
   1    -38.2926618 -0.382927E+02  0.158E-01    2.47       0.0  T
   2    -38.2926659 -0.406196E-05  0.914E-02    2.48       1.0  T
   3    -38.2926575  0.838716E-05  0.205E-02    2.47       1.0  T
   4    -38.2926679 -0.103949E-04  0.352E-03    2.48       5.6  T
   5    -38.2926680 -0.113716E-06  0.193E-03    2.48      10.2  T
   6    -38.2926680 -0.190394E-07  0.853E-04    2.48      23.0  T
     SCC iter.                  ...        0 min,  0.007 sec
     gradient                   ...        0 min,  0.012 sec
 * total energy  :   -37.6090413 Eh     change       -0.2123443E-03 Eh
   gradient norm :     0.0046431 Eh/α   predicted    -0.1421144E-03 ( -33.07%)
   displ. norm   :     0.2459483 α      lambda       -0.2231434E-03
   maximum displ.:     0.2041558 α      in ANC's #2, #4, #5, ...

........................................................................
.............................. CYCLE    9 ..............................
........................................................................
   1    -38.2933282 -0.382933E+02  0.157E-01    2.47       0.0  T
   2    -38.2933314 -0.328015E-05  0.908E-02    2.47       1.0  T
   3    -38.2933278  0.359092E-05  0.140E-02    2.47       1.4  T
   4    -38.2933330 -0.516756E-05  0.284E-03    2.47       6.9  T
   5    -38.2933330 -0.266327E-07  0.147E-03    2.47      13.3  T
   6    -38.2933330 -0.592298E-08  0.564E-04    2.47      34.8  T
     SCC iter.                  ...        0 min,  0.007 sec
     gradient                   ...        0 min,  0.012 sec
 * total energy  :   -37.6092317 Eh     change       -0.1904326E-03 Eh
   gradient norm :     0.0049335 Eh/α   predicted    -0.1183222E-03 ( -37.87%)
   displ. norm   :     0.2558938 α      lambda       -0.2183095E-03
   maximum displ.:     0.2094517 α      in ANC's #2, #4, #6, ...

........................................................................
.............................. CYCLE   10 ..............................
........................................................................
   1    -38.2932336 -0.382932E+02  0.165E-01    2.47       0.0  T
   2    -38.2932364 -0.277453E-05  0.953E-02    2.47       1.0  T
   3    -38.2932356  0.732514E-06  0.953E-03    2.47       2.1  T
   4    -38.2932377 -0.206491E-05  0.271E-03    2.47       7.2  T
   5    -38.2932377  0.351207E-09  0.113E-03    2.47      17.4  T
     SCC iter.                  ...        0 min,  0.006 sec
     gradient                   ...        0 min,  0.012 sec
 * total energy  :   -37.6094205 Eh     change       -0.1887590E-03 Eh
   gradient norm :     0.0044601 Eh/α   predicted    -0.1163033E-03 ( -38.39%)
   displ. norm   :     0.2689223 α      lambda       -0.2143594E-03
   maximum displ.:     0.2233593 α      in ANC's #2, #4, #6, ...

........................................................................
.............................. CYCLE   11 ..............................
........................................................................
   1    -38.2929160 -0.382929E+02  0.178E-01    2.47       0.0  T
   2    -38.2929192 -0.327278E-05  0.103E-01    2.47       1.0  T
   3    -38.2929182  0.105229E-05  0.102E-02    2.47       1.9  T
   4    -38.2929208 -0.257544E-05  0.321E-03    2.47       6.1  T
   5    -38.2929208 -0.287879E-07  0.161E-03    2.47      12.2  T
   6    -38.2929208 -0.191823E-07  0.486E-04    2.47      40.4  T
     SCC iter.                  ...        0 min,  0.007 sec
     gradient                   ...        0 min,  0.012 sec
 * total energy  :   -37.6095969 Eh     change       -0.1764223E-03 Eh
   gradient norm :     0.0044782 Eh/α   predicted    -0.1149371E-03 ( -34.85%)
   displ. norm   :     0.2686100 α      lambda       -0.1903647E-03
   maximum displ.:     0.2237505 α      in ANC's #2, #4, #6, ...

........................................................................
.............................. CYCLE   12 ..............................
........................................................................
   1    -38.2918492 -0.382918E+02  0.180E-01    2.46       0.0  T
   2    -38.2918524 -0.325091E-05  0.104E-01    2.46       1.0  T
   3    -38.2918523  0.151770E-06  0.949E-03    2.46       2.1  T
   4    -38.2918539 -0.158321E-05  0.298E-03    2.46       6.6  T
   5    -38.2918539 -0.738047E-08  0.151E-03    2.46      12.9  T
     SCC iter.                  ...        0 min,  0.006 sec
     gradient                   ...        0 min,  0.012 sec
 * total energy  :   -37.6097472 Eh     change       -0.1502912E-03 Eh
   gradient norm :     0.0031001 Eh/α   predicted    -0.1020512E-03 ( -32.10%)
   displ. norm   :     0.2516714 α      lambda       -0.1611594E-03
   maximum displ.:     0.2148353 α      in ANC's #2, #4, #5, ...

........................................................................
.............................. CYCLE   13 ..............................
........................................................................
   1    -38.2923735 -0.382924E+02  0.174E-01    2.47       0.0  T
   2    -38.2923766 -0.311862E-05  0.100E-01    2.47       1.0  T
   3    -38.2923760  0.574691E-06  0.932E-03    2.46       2.1  T
   4    -38.2923780 -0.197306E-05  0.308E-03    2.47       6.4  T
   5    -38.2923780 -0.351031E-07  0.149E-03    2.47      13.2  T
   6    -38.2923780 -0.125010E-07  0.479E-04    2.47      40.9  T
   7    -38.2923780 -0.441330E-08  0.634E-05    2.47     309.5  T
     SCC iter.                  ...        0 min,  0.008 sec
     gradient                   ...        0 min,  0.013 sec
 * total energy  :   -37.6098822 Eh     change       -0.1349649E-03 Eh
   gradient norm :     0.0035357 Eh/α   predicted    -0.8568587E-04 ( -36.51%)
   displ. norm   :     0.2848319 α      lambda       -0.1725468E-03
   maximum displ.:     0.2494079 α      in ANC's #2, #4, #1, ...

........................................................................
.............................. CYCLE   14 ..............................
........................................................................
   1    -38.2921820 -0.382922E+02  0.199E-01    2.46       0.0  T
   2    -38.2921857 -0.366187E-05  0.114E-01    2.46       1.0  T
   3    -38.2921859 -0.285178E-06  0.851E-03    2.46       2.3  T
   4    -38.2921873 -0.137537E-05  0.335E-03    2.46       5.8  T
   5    -38.2921873 -0.162790E-07  0.158E-03    2.46      12.4  T
   6    -38.2921874 -0.293090E-07  0.394E-04    2.46      49.8  T
   7    -38.2921874 -0.296270E-08  0.731E-05    2.46     268.2  T
     SCC iter.                  ...        0 min,  0.008 sec
     gradient                   ...        0 min,  0.013 sec
 * total energy  :   -37.6100214 Eh     change       -0.1392277E-03 Eh
   gradient norm :     0.0036763 Eh/α   predicted    -0.9327704E-04 ( -33.00%)
   displ. norm   :     0.4416235 α      lambda       -0.2328924E-03
   maximum displ.:     0.3892962 α      in ANC's #2, #4, #1, ...

........................................................................
.............................. CYCLE   15 ..............................
........................................................................
   1    -38.2916892 -0.382917E+02  0.310E-01    2.45       0.0  T
   2    -38.2916985 -0.928502E-05  0.179E-01    2.45       1.0  T
   3    -38.2916998 -0.132324E-05  0.119E-02    2.45       1.7  T
   4    -38.2917025 -0.267367E-05  0.519E-03    2.45       3.8  T
   5    -38.2917026 -0.107146E-06  0.221E-03    2.45       8.9  T
   6    -38.2917027 -0.296021E-07  0.822E-04    2.45      23.8  T
   7    -38.2917027 -0.146693E-07  0.109E-04    2.45     179.8  T
     SCC iter.                  ...        0 min,  0.008 sec
     gradient                   ...        0 min,  0.013 sec
 * total energy  :   -37.6101864 Eh     change       -0.1650423E-03 Eh
   gradient norm :     0.0053228 Eh/α   predicted    -0.1391635E-03 ( -15.68%)
   displ. norm   :     0.3599799 α      lambda       -0.1815974E-03
   maximum displ.:     0.3280353 α      in ANC's #2, #4, #1, ...

........................................................................
.............................. CYCLE   16 ..............................
........................................................................
   1    -38.2932124 -0.382932E+02  0.253E-01    2.45       0.0  T
   2    -38.2932188 -0.643230E-05  0.145E-01    2.45       1.0  T
   3    -38.2932208 -0.198524E-05  0.753E-03    2.45       2.6  T
   4    -38.2932216 -0.780875E-06  0.416E-03    2.45       4.7  T
   5    -38.2932217 -0.990170E-07  0.143E-03    2.45      13.7  T
   6    -38.2932217 -0.182766E-07  0.410E-04    2.45      47.9  T
     SCC iter.                  ...        0 min,  0.007 sec
     gradient                   ...        0 min,  0.012 sec
 * total energy  :   -37.6103144 Eh     change       -0.1279209E-03 Eh
   gradient norm :     0.0056958 Eh/α   predicted    -0.1025704E-03 ( -19.82%)
   displ. norm   :     0.3687028 α      lambda       -0.1805319E-03
   maximum displ.:     0.3236532 α      in ANC's #2, #3, #4, ...

........................................................................
.............................. CYCLE   17 ..............................
........................................................................
   1    -38.2928207 -0.382928E+02  0.256E-01    2.44       0.0  T
   2    -38.2928268 -0.614794E-05  0.148E-01    2.44       1.0  T
   3    -38.2928271 -0.323505E-06  0.114E-02    2.44       1.7  T
   4    -38.2928296 -0.244702E-05  0.438E-03    2.44       4.5  T
   5    -38.2928296 -0.531795E-07  0.200E-03    2.44       9.8  T
   6    -38.2928297 -0.495042E-07  0.462E-04    2.44      42.4  T
     SCC iter.                  ...        0 min,  0.007 sec
     gradient                   ...        0 min,  0.012 sec
 * total energy  :   -37.6104300 Eh     change       -0.1156805E-03 Eh
   gradient norm :     0.0057592 Eh/α   predicted    -0.1025377E-03 ( -11.36%)
   displ. norm   :     0.2923079 α      lambda       -0.2328434E-03
   maximum displ.:     0.2405282 α      in ANC's #2, #3, #40, ...

........................................................................
.............................. CYCLE   18 ..............................
........................................................................
   1    -38.2993780 -0.382994E+02  0.206E-01    2.44       0.0  T
   2    -38.2993833 -0.535602E-05  0.119E-01    2.44       1.0  T
   3    -38.2993823  0.105349E-05  0.136E-02    2.44       1.4  T
   4    -38.2993857 -0.341876E-05  0.376E-03    2.44       5.2  T
   5    -38.2993857 -0.248907E-07  0.207E-03    2.44       9.5  T
   6    -38.2993858 -0.412254E-07  0.609E-04    2.44      32.2  T
     SCC iter.                  ...        0 min,  0.007 sec
     gradient                   ...        0 min,  0.012 sec
 * total energy  :   -37.6105210 Eh     change       -0.9098319E-04 Eh
   gradient norm :     0.0059398 Eh/α   predicted    -0.1263724E-03 (  38.90%)
   displ. norm   :     0.5536824 α      lambda       -0.2525664E-03
   maximum displ.:     0.4961019 α      in ANC's #2, #3, #1, ...

........................................................................
.............................. CYCLE   19 ..............................
........................................................................
   1    -38.2918312 -0.382918E+02  0.379E-01    2.42       0.0  T
   2    -38.2918497 -0.185414E-04  0.218E-01    2.42       1.0  T
   3    -38.2918414  0.835303E-05  0.269E-02    2.42       1.0  T
   4    -38.2918587 -0.173137E-04  0.637E-03    2.42       3.1  T
   5    -38.2918587  0.206810E-07  0.325E-03    2.42       6.0  T
   6    -38.2918588 -0.120465E-06  0.850E-04    2.42      23.1  T
   7    -38.2918588 -0.161967E-07  0.160E-04    2.42     122.9  T
     SCC iter.                  ...        0 min,  0.008 sec
     gradient                   ...        0 min,  0.012 sec
 * total energy  :   -37.6105684 Eh     change       -0.4732305E-04 Eh
   gradient norm :     0.0095370 Eh/α   predicted    -0.1650017E-03 ( 248.67%)
   displ. norm   :     0.1823259 α      lambda       -0.2305395E-03
   maximum displ.:     0.1677861 α      in ANC's #2, #9, #4, ...

........................................................................
.............................. CYCLE   20 ..............................
........................................................................
   1    -38.2953219 -0.382953E+02  0.129E-01    2.44       0.0  T
   2    -38.2953258 -0.385841E-05  0.741E-02    2.44       1.0  T
   3    -38.2953213  0.451435E-05  0.162E-02    2.44       1.2  T
   4    -38.2953273 -0.603425E-05  0.291E-03    2.44       6.7  T
   5    -38.2953274 -0.688675E-07  0.148E-03    2.44      13.2  T
   6    -38.2953274 -0.300113E-08  0.818E-04    2.44      24.0  T
     SCC iter.                  ...        0 min,  0.007 sec
     gradient                   ...        0 min,  0.012 sec
 * total energy  :   -37.6106583 Eh     change       -0.8998793E-04 Eh
   gradient norm :     0.0048597 Eh/α   predicted    -0.1191038E-03 (  32.36%)
   displ. norm   :     0.1002578 α      lambda       -0.9933869E-04
   maximum displ.:     0.0683705 α      in ANC's #2, #3, #4, ...
 * RMSD in coord.:     0.8921257 α      energy gain  -0.8761406E-02 Eh

generating ANC from model Hessian ...
Using Lindh-Hessian (1995)
 Shifting diagonal of input Hessian by   4.195278399536314E-003
 Lowest  eigenvalues of input Hessian
   -0.000000   -0.000000   -0.000000   -0.000000    0.000000    0.000000
    0.005000    0.005284    0.005643    0.008699    0.009229    0.010982
    0.013199    0.015774    0.017829    0.020153    0.025135    0.026418
 Highest eigenvalues
    1.981097    2.049472    2.068183    2.093016    2.102830    2.193681
 

........................................................................
.............................. CYCLE   21 ..............................
........................................................................
   1    -38.2956191 -0.382956E+02  0.735E-02    2.43       0.0  T
   2    -38.2956205 -0.142509E-05  0.427E-02    2.43       1.0  T
   3    -38.2956197  0.871946E-06  0.757E-03    2.43       2.6  T
   4    -38.2956208 -0.115179E-05  0.234E-03    2.43       8.4  T
   5    -38.2956209 -0.895220E-07  0.988E-04    2.43      19.9  T
   6    -38.2956209 -0.348408E-08  0.424E-04    2.43      46.3  T
     SCC iter.                  ...        0 min,  0.007 sec
     gradient                   ...        0 min,  0.013 sec
 * total energy  :   -37.6106898 Eh     change       -0.3141711E-04 Eh
   gradient norm :     0.0044653 Eh/α   predicted     0.0000000E+00 (-100.00%)
   displ. norm   :     0.0643804 α      lambda       -0.6626717E-04
   maximum displ.:     0.0483256 α      in ANC's #1, #4, #12, ...

........................................................................
.............................. CYCLE   22 ..............................
........................................................................
   1    -38.2951320 -0.382951E+02  0.433E-02    2.43       0.0  T
   2    -38.2951324 -0.412524E-06  0.249E-02    2.43       1.0  T
   3    -38.2951315  0.906720E-06  0.672E-03    2.43       2.9  T
   4    -38.2951327 -0.113731E-05  0.111E-03    2.43      17.6  T
   5    -38.2951327 -0.105075E-07  0.609E-04    2.43      32.2  T
     SCC iter.                  ...        0 min,  0.006 sec
     gradient                   ...        0 min,  0.012 sec
 * total energy  :   -37.6107355 Eh     change       -0.4578533E-04 Eh
   gradient norm :     0.0015711 Eh/α   predicted    -0.3327388E-04 ( -27.33%)
   displ. norm   :     0.0766194 α      lambda       -0.2584553E-04
   maximum displ.:     0.0524477 α      in ANC's #4, #1, #5, ...

........................................................................
.............................. CYCLE   23 ..............................
........................................................................
   1    -38.2947068 -0.382947E+02  0.504E-02    2.43       0.0  T
   2    -38.2947073 -0.484598E-06  0.292E-02    2.43       1.0  T
   3    -38.2947064  0.866854E-06  0.662E-03    2.43       3.0  T
   4    -38.2947075 -0.111869E-05  0.131E-03    2.43      15.0  T
   5    -38.2947075 -0.139188E-07  0.713E-04    2.43      27.5  T
   6    -38.2947075 -0.225747E-08  0.249E-04    2.43      78.8  T
     SCC iter.                  ...        0 min,  0.007 sec
     gradient                   ...        0 min,  0.013 sec
 * total energy  :   -37.6107605 Eh     change       -0.2497015E-04 Eh
   gradient norm :     0.0017984 Eh/α   predicted    -0.1296295E-04 ( -48.09%)
   displ. norm   :     0.0752002 α      lambda       -0.1581909E-04
   maximum displ.:     0.0507964 α      in ANC's #1, #4, #3, ...

........................................................................
.............................. CYCLE   24 ..............................
........................................................................
   1    -38.2947454 -0.382947E+02  0.472E-02    2.43       0.0  T
   2    -38.2947457 -0.301613E-06  0.273E-02    2.43       1.0  T
   3    -38.2947458 -0.480706E-07  0.210E-03    2.43       9.3  T
   4    -38.2947459 -0.848801E-07  0.886E-04    2.43      22.1  T
   5    -38.2947459 -0.376073E-08  0.395E-04    2.43      49.7  T
     SCC iter.                  ...        0 min,  0.006 sec
     gradient                   ...        0 min,  0.013 sec
 * total energy  :   -37.6107804 Eh     change       -0.1986579E-04 Eh
   gradient norm :     0.0015724 Eh/α   predicted    -0.7931627E-05 ( -60.07%)
   displ. norm   :     0.1119633 α      lambda       -0.2059371E-04
   maximum displ.:     0.0759802 α      in ANC's #1, #4, #3, ...

........................................................................
.............................. CYCLE   25 ..............................
........................................................................
   1    -38.2949116 -0.382949E+02  0.710E-02    2.42       0.0  T
   2    -38.2949122 -0.653793E-06  0.410E-02    2.42       1.0  T
   3    -38.2949124 -0.191027E-06  0.250E-03    2.42       7.8  T
   4    -38.2949125 -0.851792E-07  0.118E-03    2.42      16.6  T
   5    -38.2949125 -0.438848E-08  0.489E-04    2.42      40.1  T
   6    -38.2949125 -0.159717E-08  0.159E-04    2.42     123.4  T
     SCC iter.                  ...        0 min,  0.007 sec
     gradient                   ...        0 min,  0.013 sec
 * total energy  :   -37.6108041 Eh     change       -0.2372530E-04 Eh
   gradient norm :     0.0008672 Eh/α   predicted    -0.1035768E-04 ( -56.34%)
   displ. norm   :     0.1398205 α      lambda       -0.1888339E-04
   maximum displ.:     0.0967677 α      in ANC's #1, #4, #3, ...

........................................................................
.............................. CYCLE   26 ..............................
........................................................................
   1    -38.2948304 -0.382948E+02  0.890E-02    2.42       0.0  T
   2    -38.2948313 -0.943754E-06  0.514E-02    2.42       1.0  T
   3    -38.2948316 -0.340378E-06  0.261E-03    2.42       7.5  T
   4    -38.2948317 -0.658712E-07  0.145E-03    2.42      13.6  T
   5    -38.2948317 -0.813058E-08  0.453E-04    2.42      43.3  T
   6    -38.2948317 -0.188952E-08  0.138E-04    2.42     142.2  T
     SCC iter.                  ...        0 min,  0.007 sec
     gradient                   ...        0 min,  0.013 sec
 * total energy  :   -37.6108215 Eh     change       -0.1743015E-04 Eh
   gradient norm :     0.0010914 Eh/α   predicted    -0.9524609E-05 ( -45.36%)
   displ. norm   :     0.1396790 α      lambda        0.1191816E-04
   maximum displ.:     0.0965638 α      in ANC's #1, #4, #3, ...

........................................................................
.............................. CYCLE   27 ..............................
........................................................................
   1    -38.2943490 -0.382943E+02  0.884E-02    2.41       0.0  T
   2    -38.2943500 -0.947183E-06  0.511E-02    2.41       1.0  T
   3    -38.2943503 -0.315504E-06  0.281E-03    2.41       7.0  T
   4    -38.2943504 -0.940892E-07  0.146E-03    2.41      13.4  T
   5    -38.2943504 -0.693359E-08  0.478E-04    2.41      41.0  T
   6    -38.2943504 -0.206227E-08  0.161E-04    2.41     121.7  T
     SCC iter.                  ...        0 min,  0.007 sec
     gradient                   ...        0 min,  0.013 sec
 * total energy  :   -37.6108168 Eh     change        0.4760412E-05 Eh
   gradient norm :     0.0024025 Eh/α   predicted     0.6010661E-05 (  26.26%)
   displ. norm   :     0.0146327 α      lambda       -0.2023698E-04
   maximum displ.:     0.0085175 α      in ANC's #17, #10, #16, ...

........................................................................
.............................. CYCLE   28 ..............................
........................................................................
   1    -38.2946428 -0.382946E+02  0.115E-02    2.42       0.0  T
   2    -38.2946429 -0.194544E-07  0.682E-03    2.42       2.9  T
   3    -38.2946428  0.368287E-07  0.141E-03    2.42      13.9  T
   4    -38.2946429 -0.449569E-07  0.319E-04    2.42      61.5  T
   5    -38.2946429 -0.723297E-09  0.176E-04    2.42     111.5  T
     SCC iter.                  ...        0 min,  0.006 sec
     gradient                   ...        0 min,  0.013 sec
 * total energy  :   -37.6108306 Eh     change       -0.1383186E-04 Eh
   gradient norm :     0.0012932 Eh/α   predicted    -0.1013257E-04 ( -26.74%)
   displ. norm   :     0.0307378 α      lambda       -0.9656366E-05
   maximum displ.:     0.0202846 α      in ANC's #4, #3, #1, ...

........................................................................
.............................. CYCLE   29 ..............................
........................................................................
   1    -38.2953499 -0.382953E+02  0.199E-02    2.42       0.0  T
   2    -38.2953500 -0.955119E-07  0.115E-02    2.42       1.7  T
   3    -38.2953498  0.214263E-06  0.356E-03    2.42       5.5  T
   4    -38.2953500 -0.264396E-06  0.586E-04    2.42      33.5  T
   5    -38.2953501 -0.279162E-08  0.320E-04    2.42      61.3  T
     SCC iter.                  ...        0 min,  0.006 sec
     gradient                   ...        0 min,  0.013 sec
 * total energy  :   -37.6108375 Eh     change       -0.6861795E-05 Eh
   gradient norm :     0.0006778 Eh/α   predicted    -0.4830571E-05 ( -29.60%)
   displ. norm   :     0.0263255 α      lambda       -0.3596780E-05
   maximum displ.:     0.0190401 α      in ANC's #1, #3, #4, ...

........................................................................
.............................. CYCLE   30 ..............................
........................................................................
   1    -38.2952786 -0.382953E+02  0.157E-02    2.42       0.0  T
   2    -38.2952786 -0.324865E-07  0.907E-03    2.42       2.2  T
   3    -38.2952785  0.650032E-07  0.200E-03    2.42       9.8  T
   4    -38.2952786 -0.844330E-07  0.334E-04    2.42      58.8  T
   5    -38.2952786 -0.138542E-09  0.202E-04    2.42      97.0  T
     SCC iter.                  ...        0 min,  0.006 sec
     gradient                   ...        0 min,  0.013 sec
 * total energy  :   -37.6108423 Eh     change       -0.4807659E-05 Eh
   gradient norm :     0.0005119 Eh/α   predicted    -0.1799312E-05 ( -62.57%)
   displ. norm   :     0.0588819 α      lambda       -0.6877226E-05
   maximum displ.:     0.0402671 α      in ANC's #1, #3, #4, ...

   *** GEOMETRY OPTIMIZATION CONVERGED AFTER 30 ITERATIONS ***

------------------------------------------------------------------------
 total energy gain   :        -0.0089453 Eh       -5.6133 kcal/mol
 total RMSD          :         0.9387626 a0        0.4968 Å
 total power (kW/mol):        -0.7828663 (step)  -26.7418 (real)
------------------------------------------------------------------------

 ANCopt (total)                0 d,  0 h,  0 min,  0.878 sec
 optimizer setup                ...        0 min,  0.000 sec (  0.018%)
 model hessian                  ...        0 min,  0.008 sec (  0.889%)
 ANC generation                 ...        0 min,  0.001 sec (  0.170%)
 coordinate transformation      ...        0 min,  0.001 sec (  0.066%)
 single point calculation       ...        0 min,  0.857 sec ( 97.564%)
 optimization log               ...        0 min,  0.003 sec (  0.354%)
 hessian update                 ...        0 min,  0.000 sec (  0.047%)
 rational function              ...        0 min,  0.006 sec (  0.678%)

================
 final structure:
================
$coord
    0.13229404476116    1.91270512282454    0.49187279015363      C 
   -1.49846371398107   -0.06273748605426    0.34173402158151      N 
   -0.19529522901973   -2.27153366104194    0.01455802794258      C 
   -1.51379073417920   -4.62890688334890   -0.11948730955741      C 
   -0.52041114680222   -6.91790605431696    0.38189389160037      C 
   -1.85242521186169   -9.26173500742807    0.18684639347716      C 
   -0.73683593760543  -11.48975987082352    0.88199939092505      N 
   -2.36144422176038  -13.43578976486154    0.51922209508741      C 
   -4.57231943626218  -12.47338883821928   -0.43186055159301      C 
   -4.26386225364816   -9.85082882944683   -0.64546031207959      C 
    2.37048745319871   -1.65139473558975   -0.08828744693407      C 
    2.53312041128385    1.00098348747763    0.23176686587314      C 
    4.44537735202129   -3.34047801956930   -0.63140315679999      C 
    6.85837824966075   -2.87059452416910   -0.11911791833011      C 
   -0.52607137911394    3.81036076714463    0.76281047278606      H 
   -3.38898183680588    0.04862531050713    0.51674469871317      H 
   -3.49594827832135   -4.50357776647342   -0.61421629448323      H 
    1.41604507649103   -7.05029110190763    1.02235019503155      H 
    1.02998165707218  -11.63679462207975    1.57044522284550      H 
   -1.84453313143660  -15.34629722702217    0.95381923901364      H 
   -6.22644990457624  -13.53493311632582   -0.92388096922924      H 
   -5.64354886138569   -8.54089057648540   -1.33936971709426      H 
    4.23360208606004    2.09979224683466    0.21533969360656      H 
    3.93493893435703   -5.08143379879105   -1.57791913501803      H 
    7.44479401817781   -1.17363281323144    0.83743018414291      H 
    8.33414935192012   -4.17466289290999   -0.63028860390056      H 
$end
           -------------------------------------------------
          |                Final Singlepoint                |
           -------------------------------------------------

          ...................................................
          :                      SETUP                      :
          :.................................................:
          :  # basis functions                  68          :
          :  # atomic orbitals                  68          :
          :  # shells                           40          :
          :  # electrons                        70          :
          :  max. iterations                   250          :
          :  Hamiltonian                  GFN2-xTB          :
          :  restarted?                      false          :
          :  GBSA solvation                  false          :
          :  PC potential                    false          :
          :  electronic temp.          300.0000000     K    :
          :  accuracy                    1.0000000          :
          :  -> integral cutoff          0.2500000E+02      :
          :  -> integral neglect         0.1000000E-07      :
          :  -> SCF convergence          0.1000000E-05 Eh   :
          :  -> wf. convergence          0.1000000E-03 e    :
          :  Broyden damping             0.4000000          :
          ...................................................

 iter      E             dE          RMSdq      gap      omega  full diag
   1    -38.2952786 -0.382953E+02  0.714E-05    2.42       0.0  T
   2    -38.2952786 -0.101963E-10  0.343E-05    2.42     571.9  T
   3    -38.2952786 -0.109210E-10  0.321E-05    2.42     610.2  T

   *** convergence criteria satisfied after 3 iterations ***

         #    Occupation            Energy/Eh            Energy/eV
      -------------------------------------------------------------
         1        2.0000           -0.6654331             -18.1074
       ...           ...                  ...                  ...
        29        2.0000           -0.4289229             -11.6716
        30        2.0000           -0.4207776             -11.4499
        31        2.0000           -0.4090766             -11.1315
        32        2.0000           -0.3896361             -10.6025
        33        2.0000           -0.3818136             -10.3897
        34        2.0000           -0.3696386             -10.0584
        35        2.0000           -0.3376460              -9.1878 (HOMO)
        36                         -0.2488512              -6.7716 (LUMO)
        37                         -0.1990717              -5.4170
        38                         -0.1703437              -4.6353
        39                         -0.1516764              -4.1273
        40                         -0.1135176              -3.0890
       ...                                ...                  ...
        68                          0.7228371              19.6694
      -------------------------------------------------------------
                  HL-Gap            0.0887948 Eh            2.4162 eV
             Fermi-level           -0.2932486 Eh           -7.9797 eV

 SCC (total)                   0 d,  0 h,  0 min,  0.027 sec
 SCC setup                      ...        0 min,  0.000 sec (  0.780%)
 Dispersion                     ...        0 min,  0.000 sec (  0.858%)
 integral evaluation            ...        0 min,  0.009 sec ( 32.465%)
 zeroth order Hamiltonian       ...        0 min,  0.000 sec (  0.527%)
 iterations                     ...        0 min,  0.004 sec ( 14.896%)
 molecular gradient             ...        0 min,  0.013 sec ( 48.918%)
 printout                       ...        0 min,  0.000 sec (  1.332%)

         :::::::::::::::::::::::::::::::::::::::::::::::::::::
         ::                     SUMMARY                     ::
         :::::::::::::::::::::::::::::::::::::::::::::::::::::
         :: total energy             -37.610842277533 Eh    ::
         :: gradient norm              0.000512060095 Eh/a0 ::
         :: HOMO-LUMO gap              2.416228827739 eV    ::
         ::.................................................::
         :: SCC energy               -38.295278605814 Eh    ::
         :: -> isotropic ES            0.009551557994 Eh    ::
         :: -> anisotropic ES          0.009093967163 Eh    ::
         :: -> anisotropic XC          0.022923566522 Eh    ::
         :: -> dispersion             -0.023756082618 Eh    ::
         :: repulsion energy           0.684546905243 Eh    ::
         :: add. restraining           0.000000000000 Eh    ::
         :::::::::::::::::::::::::::::::::::::::::::::::::::::

           -------------------------------------------------
          |                Property Printout                |
           -------------------------------------------------

    * Orbital Energies and Occupations

         #    Occupation            Energy/Eh            Energy/eV
      -------------------------------------------------------------
         1        2.0000           -0.6654331             -18.1074
       ...           ...                  ...                  ...
        23        2.0000           -0.4619420             -12.5701
        24        2.0000           -0.4565018             -12.4220
        25        2.0000           -0.4551657             -12.3857
        26        2.0000           -0.4443863             -12.0924
        27        2.0000           -0.4400954             -11.9756
        28        2.0000           -0.4317947             -11.7497
        29        2.0000           -0.4289229             -11.6716
        30        2.0000           -0.4207776             -11.4499
        31        2.0000           -0.4090766             -11.1315
        32        2.0000           -0.3896361             -10.6025
        33        2.0000           -0.3818136             -10.3897
        34        2.0000           -0.3696386             -10.0584
        35        2.0000           -0.3376460              -9.1878 (HOMO)
        36                         -0.2488512              -6.7716 (LUMO)
        37                         -0.1990717              -5.4170
        38                         -0.1703437              -4.6353
        39                         -0.1516764              -4.1273
        40                         -0.1135176              -3.0890
        41                         -0.0838227              -2.2809
        42                          0.0306820               0.8349
        43                          0.0428916               1.1671
        44                          0.1212984               3.3007
        45                          0.1240293               3.3750
        46                          0.1303559               3.5472
       ...                                ...                  ...
        68                          0.7228371              19.6694
      -------------------------------------------------------------
                  HL-Gap            0.0887948 Eh            2.4162 eV
             Fermi-level           -0.2932486 Eh           -7.9797 eV

     #   Z        covCN         q      C6AA      α(0)
     1   6 C      3.013    -0.010    28.251     8.719
     2   7 N      2.814    -0.091    23.006     7.124
     3   6 C      3.066     0.030    27.268     8.563
     4   6 C      2.897    -0.053    29.312     8.877
     5   6 C      2.896    -0.053    29.324     8.879
     6   6 C      3.073     0.032    27.200     8.551
     7   7 N      2.822    -0.087    22.932     7.112
     8   6 C      3.029    -0.010    28.247     8.718
     9   6 C      3.047    -0.064    29.541     8.914
    10   6 C      3.061    -0.068    29.622     8.925
    11   6 C      3.099    -0.021    28.415     8.736
    12   6 C      3.044    -0.067    29.634     8.928
    13   6 C      2.889    -0.028    28.697     8.783
    14   6 C      2.840    -0.096    30.409     9.037
    15   1 H      0.926     0.026     2.643     2.542
    16   1 H      0.860     0.155     1.365     1.830
    17   1 H      0.925     0.029     2.603     2.523
    18   1 H      0.925     0.034     2.534     2.489
    19   1 H      0.860     0.155     1.368     1.832
    20   1 H      0.926     0.025     2.652     2.547
    21   1 H      0.926     0.024     2.677     2.559
    22   1 H      0.926     0.023     2.685     2.562
    23   1 H      0.926     0.029     2.607     2.525
    24   1 H      0.925     0.028     2.610     2.526
    25   1 H      0.926     0.033     2.537     2.491
    26   1 H      0.926     0.025     2.660     2.550

 Mol. C6AA /au·bohr⁶  :       8550.837092
 Mol. C8AA /au·bohr⁸  :     207583.557691
 Mol. α(0) /au        :        148.841877


Wiberg/Mayer (AO) data.
largest (>0.10) Wiberg bond orders for each atom
          total WBO             WBO to atom ...
     1  C   3.931        C   12 1.550    N    2 1.228    H   15 0.971    C    3 0.105
     2  N   3.565        C    1 1.228    C    3 1.189    H   16 0.947
     3  C   3.946        C   11 1.369    N    2 1.189    C    4 1.154    C    1 0.105
     4  C   3.990        C    5 1.694    C    3 1.154    H   17 0.960
     5  C   3.990        C    4 1.694    C    6 1.153    H   18 0.959
     6  C   3.946        C   10 1.432    N    7 1.182    C    5 1.153    C    8 0.114
     7  N   3.569        C    8 1.245    C    6 1.182    H   19 0.947
     8  C   3.927        C    9 1.517    N    7 1.245    H   20 0.971    C    6 0.114
     9  C   3.979        C    8 1.517    C   10 1.368    H   21 0.975
    10  C   3.952        C    6 1.432    C    9 1.368    H   22 0.974
    11  C   3.956        C    3 1.369    C   12 1.292    C   13 1.112
    12  C   3.979        C    1 1.550    C   11 1.292    H   23 0.973
    13  C   3.993        C   14 1.884    C   11 1.112    H   24 0.959
    14  C   3.980        C   13 1.884    H   26 0.980    H   25 0.976
    15  H   0.998        C    1 0.971
    16  H   0.975        N    2 0.947
    17  H   0.998        C    4 0.960
    18  H   0.999        C    5 0.959
    19  H   0.976        N    7 0.947
    20  H   0.999        C    8 0.971
    21  H   0.999        C    9 0.975
    22  H   0.999        C   10 0.974
    23  H   0.999        C   12 0.973
    24  H   0.999        C   13 0.959
    25  H   0.999        C   14 0.976
    26  H   0.999        C   14 0.980

molecular dipole:
                 x           y           z       tot (Debye)
 q only:       -0.229      -0.028       0.266
   full:       -0.265      -0.032       0.359       1.137
molecular quadrupole (traceless):
                xx          xy          yy          xz          yz          zz
 q only:       -2.677      -7.185       4.761       0.281      -3.504      -2.084
  q+dip:        0.620     -10.925       8.017       2.043      -4.301      -8.638
   full:       -1.697     -10.843       6.883       0.972      -4.664      -5.186

           -------------------------------------------------
          |                Geometry Summary                 |
           -------------------------------------------------

      molecular mass/u    :      184.2402000
   center of mass at/Å    :       -0.0381045      -2.8537695       0.0443016
  moments of inertia/u·Å² :        0.3253406E+03   0.1537160E+04   0.1837478E+04
rotational constants/cm⁻¹ :        0.5181534E-01   0.1096674E-01   0.9174331E-02

 * 26 selected distances

     #   Z        #   Z                                     value/Å
     1   6 C      2   7 N                                 1.3578616
     2   7 N      3   6 C                                 1.3681123
     3   6 C      4   6 C                                 1.4310901 (max)
     4   6 C      5   6 C                                 1.3468266
     5   6 C      6   6 C                                 1.4303299
     6   6 C      7   7 N                                 1.3689103
     7   7 N      8   6 C                                 1.3551476
     8   6 C      9   6 C                                 1.3716559
     6   6 C     10   6 C                                 1.3854741
     9   6 C     10   6 C                                 1.4019295
     3   6 C     11   6 C                                 1.3979087
     1   6 C     12   6 C                                 1.3659395
    11   6 C     12   6 C                                 1.4163768
    13   6 C     14   6 C                                 1.3288356
     1   6 C     15   1 H                                 1.0725405
     2   7 N     16   1 H                                 1.0064235 (min)
     4   6 C     17   1 H                                 1.0831229
     5   6 C     18   1 H                                 1.0815913
     7   7 N     19   1 H                                 1.0064419
     8   6 C     20   1 H                                 1.0723005
     9   6 C     21   1 H                                 1.0721695
    10   6 C     22   1 H                                 1.0716308
    12   6 C     23   1 H                                 1.0714093
    13   6 C     24   1 H                                 1.0828584
    14   6 C     25   1 H                                 1.0765274
    14   6 C     26   1 H                                 1.0766891

 * 4 distinct bonds (by element types)

   Z      Z             #   av. dist./Å        max./Å        min./Å
   1 H    6 C          10     1.0760840     1.0831229     1.0714093
   6 C    6 C          10     1.3876367     1.4310901     1.3288356
   1 H    7 N           2     1.0064327     1.0064419     1.0064235
   6 C    7 N           4     1.3625080     1.3689103     1.3551476


optimized geometry written to: xtbopt.xyz


           -------------------------------------------------
          | TOTAL ENERGY              -37.610842277533 Eh   |
          | GRADIENT NORM               0.000512060095 Eh/α |
          | HOMO-LUMO GAP               2.416228827739 eV   |
           -------------------------------------------------

------------------------------------------------------------------------
 * finished run on 2021/05/19 at 10:59:38.403     
------------------------------------------------------------------------
 total:
 * wall-time:     0 d,  0 h,  0 min,  0.965 sec
 *  cpu-time:     0 d,  0 h,  0 min,  0.961 sec
 * ratio c/w:     0.997 speedup
 SCF:
 * wall-time:     0 d,  0 h,  0 min,  0.038 sec
 *  cpu-time:     0 d,  0 h,  0 min,  0.038 sec
 * ratio c/w:     0.997 speedup
 ANC optimizer:
 * wall-time:     0 d,  0 h,  0 min,  0.905 sec
 *  cpu-time:     0 d,  0 h,  0 min,  0.903 sec
 * ratio c/w:     0.998 speedup

