      -----------------------------------------------------------      
     |                   =====================                   |     
     |                           x T B                           |     
     |                   =====================                   |     
     |                         S. Grimme                         |     
     |          Mulliken Center for Theoretical Chemistry        |     
     |                    University of Bonn                     |     
     |                Version 6.2 RC2 (SAW190805)                |     
      -----------------------------------------------------------      

   This program is distributed in the hope that it will be useful,
   but WITHOUT ANY WARRANTY; without even the implied warranty of
   MERCHANTABILITY or FITNESS FOR A PARTICULAR PURPOSE.
   
   FOR NON-COMMERCIAL, ACADEMIA USE ONLY.
   
   Cite this work as:
   * S. Grimme, C. Bannwarth, P. Shushkov, J. Chem. Theory Comput., 2017,
     13, 1989-2009. DOI: 10.1021/acs.jctc.7b00118
   * C. Bannwarth, S. Ehlert and S. Grimme., J. Chem. Theory Comput., 2019,
     15, 1652-1671. DOI: 10.1021/acs.jctc.8b01176
   * P. Pracht, E. Caldeweyher, S. Ehlert, S. Grimme, ChemRxiv, 2019, preprint.
     DOI: 10.26434/chemrxiv.8326202.v1
   
   for DFT-D4:
   * E. Caldeweyher, C. Bannwarth and S. Grimme, J. Chem. Phys., 2017,
     147, 034112. DOI: 10.1063/1.4993215
   * E. Caldeweyher, S. Ehlert, A. Hansen, H. Neugebauer, S. Spicher,
     C. Bannwarth and S. Grimme, J. Chem. Phys., 2019, 150, 154122.
     DOI: 10.1063/1.5090222
   
   for sTDA-xTB:
   * S. Grimme and C. Bannwarth, J. Chem. Phys., 2016, 145, 054103.
     DOI: 10.1063/1.4959605
   
   in the mass-spec context:
   * V. Asgeirsson, C. Bauer and S. Grimme, Chem. Sci., 2017, 8, 4879.
     DOI: 10.1039/c7sc00601b
   
   for metadynamics refer to:
   * S. Grimme, J. Chem. Theory Comput., 2019, 155, 2847-2862
     DOI: 10.1021/acs.jctc.9b00143
   
   with help from (in alphabetical order)
   C. Bannwarth, F. Bohle, G. Brandenburg, E. Caldeweyher, M. Checinski,
   S. Dohm, S. Ehlert, S. Ehrlich, F. März, H. Neugebauer, J. Pisarek,
   P. Pracht, P. Shushkov, and S. Spicher.
   
 * started run on 2021/05/19 at 10:59:38.626     

           -------------------------------------------------
          |                Calculation Setup                |
           -------------------------------------------------

          program call               : /ihome/ghutchison/geoffh/xtb/xtb 629.xyz -opt
          hostname                   : smp-n144
          coordinate file            : 629.xyz
          omp threads                :                     1
          number of atoms            :                    28
          number of electrons        :                    82
          charge                     :                     0
          spin                       :                   0.0
          first test random number   :      0.83612751172429


########################################################################
# WARNING! Please study the warnings concerning your input carefully
#  - the use of '-opt' is discouraged, please use '--opt' next time
########################################################################

           ------------------------------------------------- 
          |                 G F N 2 - x T B                 |
          | Geometry, Frequencies, Noncovalent interactions |
          |            JCTC 2019 parametrisation            |
           ------------------------------------------------- 
             KAB for C  - Si     :                1.0500
             KAB for H  - Pd     :                0.9500
             k(s)              :                1.8500
             k(p)              :                2.2300
             k(d)              :                2.2300
             k(f)              :                2.0000
             kEN (H0ij)        :               -2.0000
             D4 a1             :                0.5200
             D4 a2             :                5.0000
             D4 s6             :                1.0000
             D4 s8             :                2.7000
             D4 s9             :                5.0000
             alphaj            :                2.0000

  Z AO/shell   Hii/eV     exponent
  1     Wed Apr 25 08:07:45 CEST 2018   EN: 2.200 GM2: 0.406  GM3: 0.0800  RAES: 1.40
     1s    -10.707211    1.230000
  6     Wed Apr 25 08:07:45 CEST 2018   EN: 2.550 GM2: 0.538  GM3: 0.1500  RAES: 3.00
     2s    -13.970922    2.096432
     2p    -10.063292    1.800000
  7     Wed Apr 25 08:07:45 CEST 2018   EN: 3.040 GM2: 0.461  GM3:-0.0640  RAES: 1.90
     2s    -16.686243    2.339881
     2p    -12.523956    2.014332
 16     Tue Apr 24 11:44:34 CEST 2018   EN: 2.580 GM2: 0.340  GM3:-0.0502  RAES: 3.10
     3s    -20.029654    1.981333
     3p    -11.377694    2.025643
     3d     -0.420282    1.702555

           ------------------------------------------------- 
          |        Self-Consistent Charge Iterations        |
           ------------------------------------------------- 

          ...................................................
          :                      SETUP                      :
          :.................................................:
          :  # basis functions                  88          :
          :  # atomic orbitals                  86          :
          :  # shells                           46          :
          :  # electrons                        82          :
          :  max. iterations                   250          :
          :  Hamiltonian                  GFN2-xTB          :
          :  restarted?                      false          :
          :  GBSA solvation                  false          :
          :  PC potential                    false          :
          :  electronic temp.          300.0000000     K    :
          :  accuracy                    1.0000000          :
          :  -> integral cutoff          0.2500000E+02      :
          :  -> integral neglect         0.1000000E-07      :
          :  -> SCF convergence          0.1000000E-05 Eh   :
          :  -> wf. convergence          0.1000000E-03 e    :
          :  Broyden damping             0.4000000          :
          ...................................................

 iter      E             dE          RMSdq      gap      omega  full diag
   1    -44.6719150 -0.446719E+02  0.404E+00    1.97       0.0  T
   2    -44.6975392 -0.256243E-01  0.239E+00    2.02       1.0  T
   3    -44.6587213  0.388180E-01  0.151E+00    2.13       1.0  T
   4    -44.7071881 -0.484668E-01  0.484E-01    2.01       1.0  T
   5    -44.7096253 -0.243723E-02  0.244E-01    2.07       1.0  T
   6    -44.7108506 -0.122528E-02  0.748E-02    2.04       1.0  T
   7    -44.7109081 -0.574800E-04  0.342E-02    2.05       1.0  T
   8    -44.7109256 -0.175253E-04  0.122E-02    2.04       1.5  T
   9    -44.7109264 -0.744377E-06  0.649E-03    2.04       2.9  T
  10    -44.7109267 -0.312406E-06  0.251E-03    2.04       7.5  T
  11    -44.7109268 -0.931623E-07  0.915E-04    2.04      20.6  T
  12    -44.7109268 -0.440003E-08  0.299E-04    2.04      63.1  T

   *** convergence criteria satisfied after 12 iterations ***

         #    Occupation            Energy/Eh            Energy/eV
      -------------------------------------------------------------
         1        2.0000           -0.7289995             -19.8371
       ...           ...                  ...                  ...
        35        2.0000           -0.4276894             -11.6380
        36        2.0000           -0.4101934             -11.1619
        37        2.0000           -0.3929489             -10.6927
        38        2.0000           -0.3838911             -10.4462
        39        2.0000           -0.3714829             -10.1086
        40        2.0000           -0.3666462              -9.9770
        41        2.0000           -0.3543665              -9.6428 (HOMO)
        42                         -0.2792969              -7.6001 (LUMO)
        43                         -0.2247407              -6.1155
        44                         -0.2114464              -5.7538
        45                         -0.1967564              -5.3540
        46                         -0.1883618              -5.1256
       ...                                ...                  ...
        86                          0.7514249              20.4473
      -------------------------------------------------------------
                  HL-Gap            0.0750696 Eh            2.0427 eV
             Fermi-level           -0.3168317 Eh           -8.6214 eV

 SCC (total)                   0 d,  0 h,  0 min,  0.057 sec
 SCC setup                      ...        0 min,  0.000 sec (  0.650%)
 Dispersion                     ...        0 min,  0.000 sec (  0.784%)
 integral evaluation            ...        0 min,  0.014 sec ( 25.236%)
 zeroth order Hamiltonian       ...        0 min,  0.000 sec (  0.463%)
 iterations                     ...        0 min,  0.020 sec ( 35.137%)
 molecular gradient             ...        0 min,  0.021 sec ( 36.858%)
 printout                       ...        0 min,  0.000 sec (  0.771%)

         :::::::::::::::::::::::::::::::::::::::::::::::::::::
         ::                     SUMMARY                     ::
         :::::::::::::::::::::::::::::::::::::::::::::::::::::
         :: total energy             -44.072551418342 Eh    ::
         :: gradient norm              0.073327165497 Eh/a0 ::
         :: HOMO-LUMO gap              2.042747635598 eV    ::
         ::.................................................::
         :: SCC energy               -44.710926784215 Eh    ::
         :: -> isotropic ES            0.022800770152 Eh    ::
         :: -> anisotropic ES          0.007361566949 Eh    ::
         :: -> anisotropic XC          0.025893613449 Eh    ::
         :: -> dispersion             -0.033820483089 Eh    ::
         :: repulsion energy           0.638162691021 Eh    ::
         :: add. restraining           0.000000000000 Eh    ::
         :::::::::::::::::::::::::::::::::::::::::::::::::::::

      ----------------------------------------------------------- 
     |                   =====================                   |
     |                        A N C O P T                        |
     |                   =====================                   |
     |               Approximate Normal Coordinate               |
     |                Rational Function Optimizer                |
      ----------------------------------------------------------- 

          ...................................................
          :                      SETUP                      :
          :.................................................:
          :   optimization level            normal          :
          :   max. optcycles                   200          :
          :   ANC micro-cycles                  20          :
          :   degrees of freedom                78          :
          :.................................................:
          :   RF solver                   davidson          :
          :   input Hessian                  false          :
          :   write xtbopt.log                true          :
          :   linear?                        false          :
          :   energy convergence         0.5000000E-05 Eh   :
          :   grad. convergence          0.1000000E-02 Eh/α :
          :   maximium RF displ.         2.0000000          :
          :   Hlow (freq-cutoff)         0.5000000E-02      :
          :   Hmax (freq-cutoff)         5.0000000          :
          :   S6 in model hess.         20.0000000          :
          ...................................................

generating ANC from model Hessian ...
Using Lindh-Hessian (1995)
 Shifting diagonal of input Hessian by   4.439011741339094E-003
 Lowest  eigenvalues of input Hessian
   -0.000000   -0.000000   -0.000000    0.000000    0.000000    0.000000
    0.005000    0.006819    0.007080    0.007761    0.008163    0.009317
    0.011517    0.012497    0.014187    0.019811    0.021227    0.022328
 Highest eigenvalues
    1.712990    1.830626    1.917373    1.988275    2.016782    2.099618
 

........................................................................
.............................. CYCLE    1 ..............................
........................................................................
   1    -44.7109268 -0.447109E+02  0.136E-04    2.04       0.0  T
   2    -44.7109268 -0.441460E-10  0.913E-05    2.04     207.1  T
   3    -44.7109268 -0.516778E-10  0.623E-05    2.04     303.2  T
     SCC iter.                  ...        0 min,  0.006 sec
     gradient                   ...        0 min,  0.021 sec
 * total energy  :   -44.0725515 Eh     change       -0.7067787E-07 Eh
   gradient norm :     0.0733278 Eh/α   predicted     0.0000000E+00 (-100.00%)
   displ. norm   :     0.3326820 α      lambda       -0.1149194E-01
   maximum displ.:     0.1528746 α      in ANC's #11, #22, #10, ...

........................................................................
.............................. CYCLE    2 ..............................
........................................................................
   1    -44.7188185 -0.447188E+02  0.255E-01    2.02       0.0  T
   2    -44.7188165  0.195120E-05  0.177E-01    2.03       1.0  T
   3    -44.7188842 -0.676580E-04  0.113E-01    2.03       1.0  T
   4    -44.7191204 -0.236249E-03  0.339E-02    2.02       1.0  T
   5    -44.7191366 -0.161615E-04  0.136E-02    2.03       1.4  T
   6    -44.7191384 -0.176109E-05  0.527E-03    2.03       3.6  T
   7    -44.7191387 -0.324967E-06  0.170E-03    2.03      11.1  T
     SCC iter.                  ...        0 min,  0.011 sec
     gradient                   ...        0 min,  0.019 sec
 * total energy  :   -44.0800514 Eh     change       -0.7499958E-02 Eh
   gradient norm :     0.0328739 Eh/α   predicted    -0.6381925E-02 ( -14.91%)
   displ. norm   :     0.2289426 α      lambda       -0.2443095E-02
   maximum displ.:     0.1401331 α      in ANC's #11, #9, #10, ...

........................................................................
.............................. CYCLE    3 ..............................
........................................................................
   1    -44.7223586 -0.447224E+02  0.162E-01    2.01       0.0  T
   2    -44.7223629 -0.424398E-05  0.106E-01    2.01       1.0  T
   3    -44.7223669 -0.402333E-05  0.724E-02    2.02       1.0  T
   4    -44.7224694 -0.102530E-03  0.213E-02    2.01       1.0  T
   5    -44.7224743 -0.488503E-05  0.986E-03    2.01       1.9  T
   6    -44.7224757 -0.134849E-05  0.385E-03    2.01       4.9  T
   7    -44.7224758 -0.112362E-06  0.124E-03    2.01      15.3  T
     SCC iter.                  ...        0 min,  0.011 sec
     gradient                   ...        0 min,  0.020 sec
 * total energy  :   -44.0815546 Eh     change       -0.1503185E-02 Eh
   gradient norm :     0.0139547 Eh/α   predicted    -0.1285580E-02 ( -14.48%)
   displ. norm   :     0.1573631 α      lambda       -0.4816386E-03
   maximum displ.:     0.0742341 α      in ANC's #11, #5, #9, ...

........................................................................
.............................. CYCLE    4 ..............................
........................................................................
   1    -44.7227207 -0.447227E+02  0.902E-02    2.00       0.0  T
   2    -44.7227257 -0.492031E-05  0.512E-02    2.00       1.0  T
   3    -44.7226995  0.261118E-04  0.393E-02    2.00       1.0  T
   4    -44.7227345 -0.349139E-04  0.101E-02    2.00       1.9  T
   5    -44.7227358 -0.137697E-05  0.466E-03    2.00       4.1  T
   6    -44.7227361 -0.270722E-06  0.198E-03    2.00       9.5  T
   7    -44.7227361 -0.411380E-07  0.709E-04    2.00      26.7  T
     SCC iter.                  ...        0 min,  0.011 sec
     gradient                   ...        0 min,  0.019 sec
 * total energy  :   -44.0818797 Eh     change       -0.3250981E-03 Eh
   gradient norm :     0.0064217 Eh/α   predicted    -0.2467834E-03 ( -24.09%)
   displ. norm   :     0.1397675 α      lambda       -0.1896967E-03
   maximum displ.:     0.0741324 α      in ANC's #5, #3, #1, ...

........................................................................
.............................. CYCLE    5 ..............................
........................................................................
   1    -44.7228410 -0.447228E+02  0.712E-02    1.99       0.0  T
   2    -44.7228438 -0.279624E-05  0.383E-02    1.99       1.0  T
   3    -44.7228404  0.337148E-05  0.145E-02    1.99       1.3  T
   4    -44.7228439 -0.351510E-05  0.687E-03    1.99       2.8  T
   5    -44.7228446 -0.744629E-06  0.302E-03    1.99       6.3  T
   6    -44.7228447 -0.104162E-06  0.122E-03    1.99      15.5  T
   7    -44.7228448 -0.271949E-07  0.545E-04    1.99      34.7  T
     SCC iter.                  ...        0 min,  0.011 sec
     gradient                   ...        0 min,  0.019 sec
 * total energy  :   -44.0820049 Eh     change       -0.1251653E-03 Eh
   gradient norm :     0.0031740 Eh/α   predicted    -0.9670208E-04 ( -22.74%)
   displ. norm   :     0.1201560 α      lambda       -0.8215331E-04
   maximum displ.:     0.0681772 α      in ANC's #5, #1, #3, ...

........................................................................
.............................. CYCLE    6 ..............................
........................................................................
   1    -44.7230105 -0.447230E+02  0.584E-02    1.98       0.0  T
   2    -44.7230115 -0.958196E-06  0.319E-02    1.99       1.0  T
   3    -44.7230091  0.241196E-05  0.107E-02    1.98       1.8  T
   4    -44.7230118 -0.273545E-05  0.418E-03    1.99       4.5  T
   5    -44.7230119 -0.152618E-06  0.141E-03    1.99      13.4  T
   6    -44.7230120 -0.274422E-07  0.549E-04    1.99      34.4  T
   7    -44.7230120 -0.179024E-08  0.344E-04    1.99      55.0  T
     SCC iter.                  ...        0 min,  0.011 sec
     gradient                   ...        0 min,  0.021 sec
 * total energy  :   -44.0820680 Eh     change       -0.6313118E-04 Eh
   gradient norm :     0.0037106 Eh/α   predicted    -0.4167215E-04 ( -33.99%)
   displ. norm   :     0.1585038 α      lambda       -0.8697876E-04
   maximum displ.:     0.0874226 α      in ANC's #5, #1, #6, ...

........................................................................
.............................. CYCLE    7 ..............................
........................................................................
   1    -44.7231980 -0.447232E+02  0.810E-02    1.99       0.0  T
   2    -44.7231998 -0.173099E-05  0.442E-02    1.99       1.0  T
   3    -44.7231918  0.801136E-05  0.190E-02    1.98       1.0  T
   4    -44.7232009 -0.916612E-05  0.523E-03    1.99       3.6  T
   5    -44.7232010 -0.105990E-06  0.203E-03    1.99       9.3  T
   6    -44.7232011 -0.929212E-07  0.744E-04    1.99      25.4  T
   7    -44.7232011 -0.474033E-08  0.425E-04    1.99      44.5  T
     SCC iter.                  ...        0 min,  0.011 sec
     gradient                   ...        0 min,  0.021 sec
 * total energy  :   -44.0821350 Eh     change       -0.6702066E-04 Eh
   gradient norm :     0.0039489 Eh/α   predicted    -0.4458218E-04 ( -33.48%)
   displ. norm   :     0.1734036 α      lambda       -0.7437910E-04
   maximum displ.:     0.0973271 α      in ANC's #1, #5, #6, ...

........................................................................
.............................. CYCLE    8 ..............................
........................................................................
   1    -44.7231878 -0.447232E+02  0.919E-02    1.99       0.0  T
   2    -44.7231903 -0.248782E-05  0.504E-02    1.99       1.0  T
   3    -44.7231827  0.759269E-05  0.196E-02    1.99       1.0  T
   4    -44.7231915 -0.879559E-05  0.574E-03    1.99       3.3  T
   5    -44.7231917 -0.232240E-06  0.252E-03    1.99       7.5  T
   6    -44.7231919 -0.123825E-06  0.931E-04    1.99      20.3  T
   7    -44.7231919 -0.123948E-07  0.467E-04    1.99      40.5  T
     SCC iter.                  ...        0 min,  0.011 sec
     gradient                   ...        0 min,  0.021 sec
 * total energy  :   -44.0821897 Eh     change       -0.5467482E-04 Eh
   gradient norm :     0.0031771 Eh/α   predicted    -0.3831184E-04 ( -29.93%)
   displ. norm   :     0.1445561 α      lambda       -0.4653154E-04
   maximum displ.:     0.0889205 α      in ANC's #1, #5, #6, ...

........................................................................
.............................. CYCLE    9 ..............................
........................................................................
   1    -44.7232738 -0.447233E+02  0.786E-02    1.99       0.0  T
   2    -44.7232758 -0.200645E-05  0.430E-02    1.99       1.0  T
   3    -44.7232737  0.216790E-05  0.123E-02    1.99       1.5  T
   4    -44.7232765 -0.281522E-05  0.468E-03    1.99       4.0  T
   5    -44.7232766 -0.142135E-06  0.230E-03    1.99       8.2  T
   6    -44.7232767 -0.118421E-06  0.744E-04    1.99      25.4  T
   7    -44.7232767 -0.930174E-08  0.349E-04    1.99      54.2  T
     SCC iter.                  ...        0 min,  0.011 sec
     gradient                   ...        0 min,  0.021 sec
 * total energy  :   -44.0822241 Eh     change       -0.3433107E-04 Eh
   gradient norm :     0.0021971 Eh/α   predicted    -0.2375350E-04 ( -30.81%)
   displ. norm   :     0.1097385 α      lambda       -0.3102540E-04
   maximum displ.:     0.0727157 α      in ANC's #1, #5, #6, ...

........................................................................
.............................. CYCLE   10 ..............................
........................................................................
   1    -44.7235079 -0.447235E+02  0.573E-02    1.99       0.0  T
   2    -44.7235091 -0.115067E-05  0.317E-02    1.99       1.0  T
   3    -44.7235086  0.439984E-06  0.678E-03    1.99       2.8  T
   4    -44.7235095 -0.846334E-06  0.266E-03    1.99       7.1  T
   5    -44.7235095 -0.314195E-07  0.134E-03    1.99      14.1  T
   6    -44.7235095 -0.308074E-07  0.560E-04    1.99      33.7  T
   7    -44.7235095 -0.771068E-08  0.198E-04    1.99      95.6  T
     SCC iter.                  ...        0 min,  0.011 sec
     gradient                   ...        0 min,  0.021 sec
 * total energy  :   -44.0822483 Eh     change       -0.2423929E-04 Eh
   gradient norm :     0.0018389 Eh/α   predicted    -0.1570573E-04 ( -35.21%)
   displ. norm   :     0.1570768 α      lambda       -0.2665423E-04
   maximum displ.:     0.1065804 α      in ANC's #1, #6, #3, ...

........................................................................
.............................. CYCLE   11 ..............................
........................................................................
   1    -44.7236823 -0.447237E+02  0.786E-02    1.99       0.0  T
   2    -44.7236846 -0.232068E-05  0.435E-02    1.99       1.0  T
   3    -44.7236837  0.891454E-06  0.867E-03    1.99       2.2  T
   4    -44.7236854 -0.171928E-05  0.350E-03    1.99       5.4  T
   5    -44.7236855 -0.108640E-06  0.133E-03    1.99      14.2  T
   6    -44.7236855 -0.116794E-07  0.615E-04    1.99      30.7  T
   7    -44.7236855 -0.695854E-08  0.242E-04    1.99      78.0  T
     SCC iter.                  ...        0 min,  0.011 sec
     gradient                   ...        0 min,  0.021 sec
 * total energy  :   -44.0822764 Eh     change       -0.2811617E-04 Eh
   gradient norm :     0.0022795 Eh/α   predicted    -0.1347740E-04 ( -52.07%)
   displ. norm   :     0.0691945 α      lambda       -0.1604451E-04
   maximum displ.:     0.0476310 α      in ANC's #1, #3, #6, ...

........................................................................
.............................. CYCLE   12 ..............................
........................................................................
   1    -44.7236786 -0.447237E+02  0.373E-02    1.99       0.0  T
   2    -44.7236791 -0.533878E-06  0.199E-02    1.99       1.0  T
   3    -44.7236791  0.169020E-07  0.350E-03    1.99       5.4  T
   4    -44.7236792 -0.128255E-06  0.215E-03    1.99       8.8  T
   5    -44.7236793 -0.606277E-07  0.723E-04    1.99      26.1  T
   6    -44.7236793 -0.633509E-08  0.314E-04    1.99      60.1  T
     SCC iter.                  ...        0 min,  0.010 sec
     gradient                   ...        0 min,  0.021 sec
 * total energy  :   -44.0822907 Eh     change       -0.1430806E-04 Eh
   gradient norm :     0.0017971 Eh/α   predicted    -0.8062097E-05 ( -43.65%)
   displ. norm   :     0.1847529 α      lambda       -0.2854262E-04
   maximum displ.:     0.1231274 α      in ANC's #1, #3, #6, ...

........................................................................
.............................. CYCLE   13 ..............................
........................................................................
   1    -44.7234634 -0.447235E+02  0.110E-01    1.98       0.0  T
   2    -44.7234677 -0.434505E-05  0.578E-02    1.98       1.0  T
   3    -44.7234681 -0.399266E-06  0.968E-03    1.98       2.0  T
   4    -44.7234685 -0.341898E-06  0.620E-03    1.98       3.0  T
   5    -44.7234690 -0.532232E-06  0.177E-03    1.98      10.6  T
   6    -44.7234691 -0.480640E-07  0.573E-04    1.98      33.0  T
   7    -44.7234691 -0.384634E-08  0.357E-04    1.98      52.9  T
     SCC iter.                  ...        0 min,  0.011 sec
     gradient                   ...        0 min,  0.021 sec
 * total energy  :   -44.0823217 Eh     change       -0.3102806E-04 Eh
   gradient norm :     0.0015090 Eh/α   predicted    -0.1449009E-04 ( -53.30%)
   displ. norm   :     0.1854827 α      lambda       -0.1870798E-04
   maximum displ.:     0.1218260 α      in ANC's #1, #3, #2, ...

........................................................................
.............................. CYCLE   14 ..............................
........................................................................
   1    -44.7231919 -0.447232E+02  0.119E-01    1.98       0.0  T
   2    -44.7231968 -0.496349E-05  0.622E-02    1.98       1.0  T
   3    -44.7231980 -0.115291E-05  0.942E-03    1.98       2.0  T
   4    -44.7231977  0.299651E-06  0.525E-03    1.98       3.6  T
   5    -44.7231982 -0.523165E-06  0.143E-03    1.98      13.2  T
   6    -44.7231983 -0.352819E-07  0.454E-04    1.98      41.6  T
   7    -44.7231983 -0.146855E-09  0.273E-04    1.98      69.3  T
     SCC iter.                  ...        0 min,  0.011 sec
     gradient                   ...        0 min,  0.021 sec
 * total energy  :   -44.0823428 Eh     change       -0.2100680E-04 Eh
   gradient norm :     0.0019118 Eh/α   predicted    -0.9500004E-05 ( -54.78%)
   displ. norm   :     0.1765431 α      lambda       -0.1678283E-04
   maximum displ.:     0.1160271 α      in ANC's #1, #3, #2, ...

........................................................................
.............................. CYCLE   15 ..............................
........................................................................
   1    -44.7233276 -0.447233E+02  0.114E-01    1.98       0.0  T
   2    -44.7233318 -0.418281E-05  0.602E-02    1.98       1.0  T
   3    -44.7233327 -0.880317E-06  0.935E-03    1.98       2.0  T
   4    -44.7233318  0.939785E-06  0.700E-03    1.98       2.7  T
   5    -44.7233330 -0.122111E-05  0.135E-03    1.98      14.0  T
   6    -44.7233330 -0.360531E-07  0.499E-04    1.98      37.9  T
   7    -44.7233330 -0.229744E-08  0.279E-04    1.98      67.8  T
     SCC iter.                  ...        0 min,  0.011 sec
     gradient                   ...        0 min,  0.021 sec
 * total energy  :   -44.0823598 Eh     change       -0.1702203E-04 Eh
   gradient norm :     0.0015341 Eh/α   predicted    -0.8509180E-05 ( -50.01%)
   displ. norm   :     0.1776057 α      lambda       -0.1204562E-04
   maximum displ.:     0.1126776 α      in ANC's #1, #2, #6, ...

........................................................................
.............................. CYCLE   16 ..............................
........................................................................
   1    -44.7228165 -0.447228E+02  0.107E-01    1.98       0.0  T
   2    -44.7228202 -0.364439E-05  0.567E-02    1.98       1.0  T
   3    -44.7228210 -0.791736E-06  0.862E-03    1.98       2.2  T
   4    -44.7228206  0.375584E-06  0.566E-03    1.98       3.3  T
   5    -44.7228212 -0.618818E-06  0.128E-03    1.98      14.7  T
   6    -44.7228213 -0.320454E-07  0.618E-04    1.98      30.6  T
   7    -44.7228213 -0.589794E-08  0.304E-04    1.98      62.2  T
     SCC iter.                  ...        0 min,  0.011 sec
     gradient                   ...        0 min,  0.021 sec
 * total energy  :   -44.0823677 Eh     change       -0.7882961E-05 Eh
   gradient norm :     0.0018306 Eh/α   predicted    -0.6111672E-05 ( -22.47%)
   displ. norm   :     0.0397841 α      lambda       -0.9370726E-05
   maximum displ.:     0.0246756 α      in ANC's #4, #7, #1, ...

........................................................................
.............................. CYCLE   17 ..............................
........................................................................
   1    -44.7239376 -0.447239E+02  0.272E-02    1.99       0.0  T
   2    -44.7239379 -0.273718E-06  0.147E-02    1.99       1.3  T
   3    -44.7239378  0.907329E-07  0.333E-03    1.99       5.7  T
   4    -44.7239380 -0.148811E-06  0.182E-03    1.99      10.4  T
   5    -44.7239380 -0.342865E-07  0.531E-04    1.99      35.6  T
   6    -44.7239380 -0.282349E-08  0.225E-04    1.99      83.9  T
     SCC iter.                  ...        0 min,  0.010 sec
     gradient                   ...        0 min,  0.021 sec
 * total energy  :   -44.0823728 Eh     change       -0.5173018E-05 Eh
   gradient norm :     0.0007172 Eh/α   predicted    -0.4689185E-05 (  -9.35%)
   displ. norm   :     0.0258411 α      lambda       -0.3075098E-05
   maximum displ.:     0.0179209 α      in ANC's #5, #6, #4, ...

........................................................................
.............................. CYCLE   18 ..............................
........................................................................
   1    -44.7236749 -0.447237E+02  0.202E-02    1.98       0.0  T
   2    -44.7236751 -0.146974E-06  0.104E-02    1.98       1.8  T
   3    -44.7236750  0.371045E-07  0.232E-03    1.98       8.1  T
   4    -44.7236751 -0.503719E-07  0.153E-03    1.99      12.4  T
   5    -44.7236751 -0.272684E-07  0.471E-04    1.98      40.1  T
   6    -44.7236751 -0.589960E-08  0.145E-04    1.98     130.7  T
     SCC iter.                  ...        0 min,  0.010 sec
     gradient                   ...        0 min,  0.021 sec
 * total energy  :   -44.0823754 Eh     change       -0.2526697E-05 Eh
   gradient norm :     0.0003793 Eh/α   predicted    -0.1539154E-05 ( -39.08%)
   displ. norm   :     0.0226027 α      lambda       -0.1219121E-05
   maximum displ.:     0.0171819 α      in ANC's #5, #6, #1, ...

   *** GEOMETRY OPTIMIZATION CONVERGED AFTER 18 ITERATIONS ***

------------------------------------------------------------------------
 total energy gain   :        -0.0098239 Eh       -6.1646 kcal/mol
 total RMSD          :         0.3529612 a0        0.1868 Å
 total power (kW/mol):        -1.4329302 (step)  -30.6396 (real)
------------------------------------------------------------------------

 ANCopt (total)                0 d,  0 h,  0 min,  0.842 sec
 optimizer setup                ...        0 min,  0.000 sec (  0.019%)
 model hessian                  ...        0 min,  0.008 sec (  0.909%)
 ANC generation                 ...        0 min,  0.001 sec (  0.102%)
 coordinate transformation      ...        0 min,  0.000 sec (  0.043%)
 single point calculation       ...        0 min,  0.827 sec ( 98.179%)
 optimization log               ...        0 min,  0.002 sec (  0.238%)
 hessian update                 ...        0 min,  0.000 sec (  0.031%)
 rational function              ...        0 min,  0.003 sec (  0.344%)

================
 final structure:
================
$coord
    5.90761519516828   -1.12737177651951   -0.13686998684517      C 
    3.65302163643265   -3.49914663225216   -0.07143796124765      S 
    4.91491443061295    1.24367150193965   -0.06763934053988      C 
    2.25406387629401    1.19908535433259    0.01919914561459      C 
    0.13747304002729    2.97529706646106    0.19404315338670      C 
    0.25307624523392    5.51952311653941    0.15669015751208      C 
   -2.07209225292322    7.11943827332829    0.54085486740095      C 
   -1.44439753633511    9.69708659004343    1.27848116643251      N 
    2.68157653901957    6.91051519370875   -0.34600183654344      C 
    4.36097679693358    6.83053418718866    1.85177164608929      N 
    1.31807033557788   -1.26033706281733    0.05913577102363      C 
   -1.35655717406168   -1.16193755990377    0.24455327328011      C 
   -3.84070363484069   -3.23528818822136    0.30956118162374      S 
   -2.11174497202325    1.36023376355818    0.35052727644065      C 
   -4.76691707620847    1.57668949311556    0.43946708865314      C 
   -5.92473470691905   -0.72134996297866    0.44695716035853      C 
    7.86069628028075   -1.65995910650074   -0.21638165550307      H 
    6.04910770279297    2.92249406618291   -0.01112581942210      H 
   -3.30983045655685    6.17739704524860    1.92067943852226      H 
   -3.09822148700966    7.22629256654987   -1.25778093404338      H 
   -0.71564534026480    9.71676858763947    3.05252896447850      H 
   -3.02335274723146   10.78065460304581    1.28941580358097      H 
    2.19403617787746    8.84902834798415   -0.91257195500690      H 
    3.67567183282476    5.99249403393794   -1.91006168717527      H 
    3.47290918805975    7.57486964820405    3.37904073679679      H 
    5.91368925732937    7.90442301878318    1.51153688259246      H 
   -5.82128150366790    3.31114954545942    0.47785519502693      H 
   -7.91117333009259   -1.11131606408034    0.51981371190069      H 
$end
           -------------------------------------------------
          |                Final Singlepoint                |
           -------------------------------------------------

          ...................................................
          :                      SETUP                      :
          :.................................................:
          :  # basis functions                  88          :
          :  # atomic orbitals                  86          :
          :  # shells                           46          :
          :  # electrons                        82          :
          :  max. iterations                   250          :
          :  Hamiltonian                  GFN2-xTB          :
          :  restarted?                      false          :
          :  GBSA solvation                  false          :
          :  PC potential                    false          :
          :  electronic temp.          300.0000000     K    :
          :  accuracy                    1.0000000          :
          :  -> integral cutoff          0.2500000E+02      :
          :  -> integral neglect         0.1000000E-07      :
          :  -> SCF convergence          0.1000000E-05 Eh   :
          :  -> wf. convergence          0.1000000E-03 e    :
          :  Broyden damping             0.4000000          :
          ...................................................

 iter      E             dE          RMSdq      gap      omega  full diag
   1    -44.7236751 -0.447237E+02  0.754E-05    1.98       0.0  T
   2    -44.7236751 -0.440536E-11  0.368E-05    1.98     513.9  T
   3    -44.7236751 -0.120579E-10  0.365E-05    1.98     517.9  T

   *** convergence criteria satisfied after 3 iterations ***

         #    Occupation            Energy/Eh            Energy/eV
      -------------------------------------------------------------
         1        2.0000           -0.7249433             -19.7267
       ...           ...                  ...                  ...
        35        2.0000           -0.4263887             -11.6026
        36        2.0000           -0.4107036             -11.1758
        37        2.0000           -0.3907369             -10.6325
        38        2.0000           -0.3848815             -10.4732
        39        2.0000           -0.3725082             -10.1365
        40        2.0000           -0.3664441              -9.9715
        41        2.0000           -0.3536360              -9.6229 (HOMO)
        42                         -0.2806904              -7.6380 (LUMO)
        43                         -0.2201634              -5.9910
        44                         -0.2086311              -5.6771
        45                         -0.1975127              -5.3746
        46                         -0.1912044              -5.2029
       ...                                ...                  ...
        86                          0.7335081              19.9598
      -------------------------------------------------------------
                  HL-Gap            0.0729456 Eh            1.9850 eV
             Fermi-level           -0.3171632 Eh           -8.6304 eV

 SCC (total)                   0 d,  0 h,  0 min,  0.042 sec
 SCC setup                      ...        0 min,  0.000 sec (  0.565%)
 Dispersion                     ...        0 min,  0.000 sec (  0.603%)
 integral evaluation            ...        0 min,  0.014 sec ( 33.258%)
 zeroth order Hamiltonian       ...        0 min,  0.000 sec (  0.570%)
 iterations                     ...        0 min,  0.006 sec ( 13.119%)
 molecular gradient             ...        0 min,  0.021 sec ( 50.794%)
 printout                       ...        0 min,  0.000 sec (  0.965%)

         :::::::::::::::::::::::::::::::::::::::::::::::::::::
         ::                     SUMMARY                     ::
         :::::::::::::::::::::::::::::::::::::::::::::::::::::
         :: total energy             -44.082375355117 Eh    ::
         :: gradient norm              0.000379299199 Eh/a0 ::
         :: HOMO-LUMO gap              1.984951063424 eV    ::
         ::.................................................::
         :: SCC energy               -44.723675128257 Eh    ::
         :: -> isotropic ES            0.022309415069 Eh    ::
         :: -> anisotropic ES          0.005899732191 Eh    ::
         :: -> anisotropic XC          0.025101458047 Eh    ::
         :: -> dispersion             -0.034009447361 Eh    ::
         :: repulsion energy           0.641074808423 Eh    ::
         :: add. restraining           0.000000000000 Eh    ::
         :::::::::::::::::::::::::::::::::::::::::::::::::::::

           -------------------------------------------------
          |                Property Printout                |
           -------------------------------------------------

    * Orbital Energies and Occupations

         #    Occupation            Energy/Eh            Energy/eV
      -------------------------------------------------------------
         1        2.0000           -0.7249433             -19.7267
       ...           ...                  ...                  ...
        29        2.0000           -0.4602337             -12.5236
        30        2.0000           -0.4509995             -12.2723
        31        2.0000           -0.4446424             -12.0993
        32        2.0000           -0.4391803             -11.9507
        33        2.0000           -0.4355067             -11.8507
        34        2.0000           -0.4314546             -11.7405
        35        2.0000           -0.4263887             -11.6026
        36        2.0000           -0.4107036             -11.1758
        37        2.0000           -0.3907369             -10.6325
        38        2.0000           -0.3848815             -10.4732
        39        2.0000           -0.3725082             -10.1365
        40        2.0000           -0.3664441              -9.9715
        41        2.0000           -0.3536360              -9.6229 (HOMO)
        42                         -0.2806904              -7.6380 (LUMO)
        43                         -0.2201634              -5.9910
        44                         -0.2086311              -5.6771
        45                         -0.1975127              -5.3746
        46                         -0.1912044              -5.2029
        47                         -0.1431008              -3.8940
        48                         -0.1211406              -3.2964
        49                         -0.1075243              -2.9259
        50                         -0.1041647              -2.8345
        51                         -0.0097704              -0.2659
        52                          0.0081711               0.2223
       ...                                ...                  ...
        86                          0.7335081              19.9598
      -------------------------------------------------------------
                  HL-Gap            0.0729456 Eh            1.9850 eV
             Fermi-level           -0.3171632 Eh           -8.6304 eV

     #   Z        covCN         q      C6AA      α(0)
     1   6 C      2.950    -0.025    28.638     8.777
     2  16 S      2.236    -0.035   142.517    20.093
     3   6 C      3.071    -0.044    29.023     8.833
     4   6 C      3.251    -0.022    27.478     8.484
     5   6 C      3.027    -0.006    28.132     8.700
     6   6 C      2.944     0.007    27.874     8.659
     7   6 C      3.736     0.020    20.316     6.432
     8   7 N      2.629    -0.337    28.665     7.952
     9   6 C      3.736     0.014    20.416     6.448
    10   7 N      2.629    -0.334    28.602     7.943
    11   6 C      3.096     0.011    27.655     8.619
    12   6 C      3.100     0.014    27.579     8.606
    13  16 S      2.236    -0.031   142.322    20.079
    14   6 C      3.241    -0.032    27.841     8.554
    15   6 C      3.075    -0.048    29.096     8.844
    16   6 C      2.947    -0.028    28.688     8.785
    17   1 H      0.926     0.040     2.451     2.448
    18   1 H      0.926     0.058     2.220     2.330
    19   1 H      0.923     0.027     2.636     2.539
    20   1 H      0.924     0.049     2.329     2.387
    21   1 H      0.860     0.138     1.489     1.912
    22   1 H      0.860     0.138     1.489     1.911
    23   1 H      0.923     0.037     2.484     2.465
    24   1 H      0.924     0.047     2.360     2.402
    25   1 H      0.860     0.135     1.510     1.925
    26   1 H      0.860     0.137     1.494     1.914
    27   1 H      0.926     0.031     2.572     2.508
    28   1 H      0.926     0.039     2.458     2.451

 Mol. C6AA /au·bohr⁶  :      12977.536294
 Mol. C8AA /au·bohr⁸  :     373316.151834
 Mol. α(0) /au        :        182.998851


Wiberg/Mayer (AO) data.
largest (>0.10) Wiberg bond orders for each atom
          total WBO             WBO to atom ...
     1  C   3.923        C    3 1.614    S    2 1.168    H   17 0.972
     2  S   2.621        C    1 1.168    C   11 1.162
     3  C   3.987        C    1 1.614    C    4 1.268    H   18 0.956
     4  C   3.977        C   11 1.396    C    3 1.268    C    5 1.074
     5  C   3.986        C    6 1.686    C    4 1.074    C   14 1.073
     6  C   3.984        C    5 1.686    C    7 1.012    C    9 1.009
     7  C   3.985        N    8 1.022    C    6 1.012    H   19 0.955    H   20 0.951
     8  N   3.007        C    7 1.022    H   21 0.968    H   22 0.967
     9  C   3.983        C    6 1.009    N   10 1.005    H   23 0.963    H   24 0.962
    10  N   2.996        C    9 1.005    H   25 0.968    H   26 0.967
    11  C   3.946        C    4 1.396    C   12 1.168    S    2 1.162
    12  C   3.946        C   14 1.393    C   11 1.168    S   13 1.165
    13  S   2.626        C   16 1.172    C   12 1.165
    14  C   3.975        C   12 1.393    C   15 1.269    C    5 1.073
    15  C   3.987        C   16 1.608    C   14 1.269    H   27 0.960
    16  C   3.923        C   15 1.608    S   13 1.172    H   28 0.972
    17  H   0.998        C    1 0.972
    18  H   0.996        C    3 0.956
    19  H   0.998        C    7 0.955
    20  H   0.993        C    7 0.951
    21  H   0.981        N    8 0.968
    22  H   0.980        N    8 0.967
    23  H   0.997        C    9 0.963
    24  H   0.997        C    9 0.962
    25  H   0.982        N   10 0.968
    26  H   0.980        N   10 0.967
    27  H   0.998        C   15 0.960
    28  H   0.998        C   16 0.972

molecular dipole:
                 x           y           z       tot (Debye)
 q only:        0.001       0.977       0.066
   full:       -0.338       1.725       0.320       4.540
molecular quadrupole (traceless):
                xx          xy          yy          xz          yz          zz
 q only:        0.364      -0.218       4.317      -0.859       2.652      -4.681
  q+dip:        2.776      -2.730       5.594      -2.925       7.035      -8.370
   full:        1.992      -2.626       3.961      -2.354       7.310      -5.953

           -------------------------------------------------
          |                Geometry Summary                 |
           -------------------------------------------------

      molecular mass/u    :      248.3602000
   center of mass at/Å    :        0.1171737       0.7833929       0.1751754
  moments of inertia/u·Å² :        0.9045600E+03   0.1296177E+04   0.2161644E+04
rotational constants/cm⁻¹ :        0.1863628E-01   0.1300566E-01   0.7798525E-02

 * 26 selected distances

     #   Z        #   Z                                     value/Å
     1   6 C      2  16 S                                 1.7320182 (max)
     1   6 C      3   6 C                                 1.3607260
     3   6 C      4   6 C                                 1.4090088
     5   6 C      6   6 C                                 1.3478806
     7   6 C      8   7 N                                 1.4571474
     9   6 C     10   7 N                                 1.4643006
     2  16 S     11   6 C                                 1.7132040
     4   6 C     11   6 C                                 1.3926954
    11   6 C     12   6 C                                 1.4197042
    12   6 C     13  16 S                                 1.7126054
    12   6 C     14   6 C                                 1.3943482
    14   6 C     15   6 C                                 1.4105033
    13  16 S     16   6 C                                 1.7295233
    15   6 C     16   6 C                                 1.3617020
     1   6 C     17   1 H                                 1.0720898
     3   6 C     18   1 H                                 1.0725515
     7   6 C     19   1 H                                 1.1003011
     7   6 C     20   1 H                                 1.0972551
     8   7 N     21   1 H                                 1.0149604
     8   7 N     22   1 H                                 1.0133902 (min)
     9   6 C     23   1 H                                 1.0994325
     9   6 C     24   1 H                                 1.0944214
    10   7 N     25   1 H                                 1.0144827
    10   7 N     26   1 H                                 1.0151260
    15   6 C     27   1 H                                 1.0743093
    16   6 C     28   1 H                                 1.0719360

 * 5 distinct bonds (by element types)

   Z      Z             #   av. dist./Å        max./Å        min./Å
   1 H    6 C           8     1.0852871     1.1003011     1.0719360
   6 C    6 C           8     1.3870711     1.4197042     1.3478806
   1 H    7 N           4     1.0144898     1.0151260     1.0133902
   6 C    7 N           2     1.4607240     1.4643006     1.4571474
   6 C   16 S           4     1.7218377     1.7320182     1.7126054


optimized geometry written to: xtbopt.xyz


           -------------------------------------------------
          | TOTAL ENERGY              -44.082375355117 Eh   |
          | GRADIENT NORM               0.000379299199 Eh/α |
          | HOMO-LUMO GAP               1.984951063424 eV   |
           -------------------------------------------------

------------------------------------------------------------------------
 * finished run on 2021/05/19 at 10:59:39.599     
------------------------------------------------------------------------
 total:
 * wall-time:     0 d,  0 h,  0 min,  0.973 sec
 *  cpu-time:     0 d,  0 h,  0 min,  0.965 sec
 * ratio c/w:     0.992 speedup
 SCF:
 * wall-time:     0 d,  0 h,  0 min,  0.057 sec
 *  cpu-time:     0 d,  0 h,  0 min,  0.057 sec
 * ratio c/w:     0.998 speedup
 ANC optimizer:
 * wall-time:     0 d,  0 h,  0 min,  0.885 sec
 *  cpu-time:     0 d,  0 h,  0 min,  0.882 sec
 * ratio c/w:     0.998 speedup

