      -----------------------------------------------------------      
     |                   =====================                   |     
     |                           x T B                           |     
     |                   =====================                   |     
     |                         S. Grimme                         |     
     |          Mulliken Center for Theoretical Chemistry        |     
     |                    University of Bonn                     |     
     |                Version 6.2 RC2 (SAW190805)                |     
      -----------------------------------------------------------      

   This program is distributed in the hope that it will be useful,
   but WITHOUT ANY WARRANTY; without even the implied warranty of
   MERCHANTABILITY or FITNESS FOR A PARTICULAR PURPOSE.
   
   FOR NON-COMMERCIAL, ACADEMIA USE ONLY.
   
   Cite this work as:
   * S. Grimme, C. Bannwarth, P. Shushkov, J. Chem. Theory Comput., 2017,
     13, 1989-2009. DOI: 10.1021/acs.jctc.7b00118
   * C. Bannwarth, S. Ehlert and S. Grimme., J. Chem. Theory Comput., 2019,
     15, 1652-1671. DOI: 10.1021/acs.jctc.8b01176
   * P. Pracht, E. Caldeweyher, S. Ehlert, S. Grimme, ChemRxiv, 2019, preprint.
     DOI: 10.26434/chemrxiv.8326202.v1
   
   for DFT-D4:
   * E. Caldeweyher, C. Bannwarth and S. Grimme, J. Chem. Phys., 2017,
     147, 034112. DOI: 10.1063/1.4993215
   * E. Caldeweyher, S. Ehlert, A. Hansen, H. Neugebauer, S. Spicher,
     C. Bannwarth and S. Grimme, J. Chem. Phys., 2019, 150, 154122.
     DOI: 10.1063/1.5090222
   
   for sTDA-xTB:
   * S. Grimme and C. Bannwarth, J. Chem. Phys., 2016, 145, 054103.
     DOI: 10.1063/1.4959605
   
   in the mass-spec context:
   * V. Asgeirsson, C. Bauer and S. Grimme, Chem. Sci., 2017, 8, 4879.
     DOI: 10.1039/c7sc00601b
   
   for metadynamics refer to:
   * S. Grimme, J. Chem. Theory Comput., 2019, 155, 2847-2862
     DOI: 10.1021/acs.jctc.9b00143
   
   with help from (in alphabetical order)
   C. Bannwarth, F. Bohle, G. Brandenburg, E. Caldeweyher, M. Checinski,
   S. Dohm, S. Ehlert, S. Ehrlich, F. März, H. Neugebauer, J. Pisarek,
   P. Pracht, P. Shushkov, and S. Spicher.
   
 * started run on 2021/05/19 at 10:59:40.000     

           -------------------------------------------------
          |                Calculation Setup                |
           -------------------------------------------------

          program call               : /ihome/ghutchison/geoffh/xtb/xtb 632.xyz -opt
          hostname                   : smp-n144
          coordinate file            : 632.xyz
          omp threads                :                     1
          number of atoms            :                    25
          number of electrons        :                    72
          charge                     :                     0
          spin                       :                   0.0
          first test random number   :      0.09240270958013


########################################################################
# WARNING! Please study the warnings concerning your input carefully
#  - the use of '-opt' is discouraged, please use '--opt' next time
########################################################################

           ------------------------------------------------- 
          |                 G F N 2 - x T B                 |
          | Geometry, Frequencies, Noncovalent interactions |
          |            JCTC 2019 parametrisation            |
           ------------------------------------------------- 
             KAB for C  - Si     :                1.0500
             KAB for H  - Pd     :                0.9500
             k(s)              :                1.8500
             k(p)              :                2.2300
             k(d)              :                2.2300
             k(f)              :                2.0000
             kEN (H0ij)        :               -2.0000
             D4 a1             :                0.5200
             D4 a2             :                5.0000
             D4 s6             :                1.0000
             D4 s8             :                2.7000
             D4 s9             :                5.0000
             alphaj            :                2.0000

  Z AO/shell   Hii/eV     exponent
  1     Wed Apr 25 08:07:45 CEST 2018   EN: 2.200 GM2: 0.406  GM3: 0.0800  RAES: 1.40
     1s    -10.707211    1.230000
  6     Wed Apr 25 08:07:45 CEST 2018   EN: 2.550 GM2: 0.538  GM3: 0.1500  RAES: 3.00
     2s    -13.970922    2.096432
     2p    -10.063292    1.800000
  8     Wed Apr 25 08:07:45 CEST 2018   EN: 3.440 GM2: 0.452  GM3:-0.0517  RAES: 1.80
     2s    -20.229985    2.439742
     2p    -15.503117    2.137023

           ------------------------------------------------- 
          |        Self-Consistent Charge Iterations        |
           ------------------------------------------------- 

          ...................................................
          :                      SETUP                      :
          :.................................................:
          :  # basis functions                  70          :
          :  # atomic orbitals                  70          :
          :  # shells                           40          :
          :  # electrons                        72          :
          :  max. iterations                   250          :
          :  Hamiltonian                  GFN2-xTB          :
          :  restarted?                      false          :
          :  GBSA solvation                  false          :
          :  PC potential                    false          :
          :  electronic temp.          300.0000000     K    :
          :  accuracy                    1.0000000          :
          :  -> integral cutoff          0.2500000E+02      :
          :  -> integral neglect         0.1000000E-07      :
          :  -> SCF convergence          0.1000000E-05 Eh   :
          :  -> wf. convergence          0.1000000E-03 e    :
          :  Broyden damping             0.4000000          :
          ...................................................

 iter      E             dE          RMSdq      gap      omega  full diag
   1    -39.7631525 -0.397632E+02  0.479E+00    3.17       0.0  T
   2    -39.7857718 -0.226193E-01  0.289E+00    3.18       1.0  T
   3    -39.7755075  0.102644E-01  0.101E+00    3.16       1.0  T
   4    -39.7897214 -0.142140E-01  0.230E-01    3.17       1.0  T
   5    -39.7902556 -0.534159E-03  0.671E-02    3.16       1.0  T
   6    -39.7903153 -0.597455E-04  0.358E-02    3.16       1.0  T
   7    -39.7903234 -0.813764E-05  0.159E-02    3.16       1.3  T
   8    -39.7903245 -0.108272E-05  0.776E-03    3.16       2.6  T
   9    -39.7903253 -0.795658E-06  0.211E-03    3.16       9.5  T
  10    -39.7903254 -0.717906E-07  0.794E-04    3.16      25.2  T
  11    -39.7903254 -0.253042E-08  0.431E-04    3.16      46.4  T

   *** convergence criteria satisfied after 11 iterations ***

         #    Occupation            Energy/Eh            Energy/eV
      -------------------------------------------------------------
         1        2.0000           -0.7329014             -19.9433
       ...           ...                  ...                  ...
        30        2.0000           -0.4325872             -11.7713
        31        2.0000           -0.4278573             -11.6426
        32        2.0000           -0.4244942             -11.5511
        33        2.0000           -0.4123325             -11.2201
        34        2.0000           -0.4095873             -11.1454
        35        2.0000           -0.3851518             -10.4805
        36        2.0000           -0.3797090             -10.3324 (HOMO)
        37                         -0.2634091              -7.1677 (LUMO)
        38                         -0.2328099              -6.3351
        39                         -0.2256088              -6.1391
        40                         -0.2074213              -5.6442
        41                         -0.1706373              -4.6433
       ...                                ...                  ...
        70                          0.7342981              19.9813
      -------------------------------------------------------------
                  HL-Gap            0.1162999 Eh            3.1647 eV
             Fermi-level           -0.3215590 Eh           -8.7501 eV

 SCC (total)                   0 d,  0 h,  0 min,  0.038 sec
 SCC setup                      ...        0 min,  0.000 sec (  0.801%)
 Dispersion                     ...        0 min,  0.000 sec (  1.145%)
 integral evaluation            ...        0 min,  0.009 sec ( 24.271%)
 zeroth order Hamiltonian       ...        0 min,  0.000 sec (  0.443%)
 iterations                     ...        0 min,  0.014 sec ( 35.931%)
 molecular gradient             ...        0 min,  0.014 sec ( 36.279%)
 printout                       ...        0 min,  0.000 sec (  0.989%)

         :::::::::::::::::::::::::::::::::::::::::::::::::::::
         ::                     SUMMARY                     ::
         :::::::::::::::::::::::::::::::::::::::::::::::::::::
         :: total energy             -39.123353939747 Eh    ::
         :: gradient norm              0.070728109224 Eh/a0 ::
         :: HOMO-LUMO gap              3.164681169444 eV    ::
         ::.................................................::
         :: SCC energy               -39.790325397100 Eh    ::
         :: -> isotropic ES            0.012782132976 Eh    ::
         :: -> anisotropic ES          0.004437289874 Eh    ::
         :: -> anisotropic XC          0.020546870556 Eh    ::
         :: -> dispersion             -0.025703722986 Eh    ::
         :: repulsion energy           0.667115650360 Eh    ::
         :: add. restraining           0.000000000000 Eh    ::
         :::::::::::::::::::::::::::::::::::::::::::::::::::::

      ----------------------------------------------------------- 
     |                   =====================                   |
     |                        A N C O P T                        |
     |                   =====================                   |
     |               Approximate Normal Coordinate               |
     |                Rational Function Optimizer                |
      ----------------------------------------------------------- 

          ...................................................
          :                      SETUP                      :
          :.................................................:
          :   optimization level            normal          :
          :   max. optcycles                   200          :
          :   ANC micro-cycles                  20          :
          :   degrees of freedom                69          :
          :.................................................:
          :   RF solver                   davidson          :
          :   input Hessian                  false          :
          :   write xtbopt.log                true          :
          :   linear?                        false          :
          :   energy convergence         0.5000000E-05 Eh   :
          :   grad. convergence          0.1000000E-02 Eh/α :
          :   maximium RF displ.         2.0000000          :
          :   Hlow (freq-cutoff)         0.5000000E-02      :
          :   Hmax (freq-cutoff)         5.0000000          :
          :   S6 in model hess.         20.0000000          :
          ...................................................

generating ANC from model Hessian ...
Using Lindh-Hessian (1995)
 Shifting diagonal of input Hessian by   3.879010735460087E-003
 Lowest  eigenvalues of input Hessian
   -0.000000   -0.000000   -0.000000   -0.000000   -0.000000    0.000000
    0.005000    0.006623    0.008371    0.009276    0.010226    0.015751
    0.018187    0.020248    0.020834    0.023508    0.030588    0.035028
 Highest eigenvalues
    1.888872    1.908670    1.995241    2.022332    2.110936    2.132290
 

........................................................................
.............................. CYCLE    1 ..............................
........................................................................
   1    -39.7903254 -0.397903E+02  0.111E-04    3.16       0.0  T
   2    -39.7903254 -0.763549E-10  0.758E-05    3.16     264.0  T
   3    -39.7903254 -0.125375E-09  0.356E-05    3.16     561.1  T
     SCC iter.                  ...        0 min,  0.004 sec
     gradient                   ...        0 min,  0.014 sec
 * total energy  :   -39.1233539 Eh     change        0.2481475E-07 Eh
   gradient norm :     0.0707284 Eh/α   predicted     0.0000000E+00 (-100.00%)
   displ. norm   :     0.2031556 α      lambda       -0.6275257E-02
   maximum displ.:     0.1009742 α      in ANC's #7, #13, #34, ...

........................................................................
.............................. CYCLE    2 ..............................
........................................................................
   1    -39.8220610 -0.398221E+02  0.105E-01    3.20       0.0  T
   2    -39.8220815 -0.204882E-04  0.673E-02    3.19       1.0  T
   3    -39.8220772  0.430431E-05  0.341E-02    3.19       1.0  T
   4    -39.8220935 -0.163336E-04  0.549E-03    3.19       3.6  T
   5    -39.8220942 -0.696055E-06  0.208E-03    3.19       9.6  T
   6    -39.8220942 -0.139077E-07  0.101E-03    3.19      19.8  T
     SCC iter.                  ...        0 min,  0.007 sec
     gradient                   ...        0 min,  0.013 sec
 * total energy  :   -39.1273065 Eh     change       -0.3952608E-02 Eh
   gradient norm :     0.0218714 Eh/α   predicted    -0.3267129E-02 ( -17.34%)
   displ. norm   :     0.1387943 α      lambda       -0.8040429E-03
   maximum displ.:     0.0810110 α      in ANC's #7, #4, #3, ...

........................................................................
.............................. CYCLE    3 ..............................
........................................................................
   1    -39.8309793 -0.398310E+02  0.740E-02    3.19       0.0  T
   2    -39.8309841 -0.485982E-05  0.448E-02    3.19       1.0  T
   3    -39.8309796  0.447177E-05  0.183E-02    3.19       1.1  T
   4    -39.8309860 -0.638312E-05  0.234E-03    3.19       8.5  T
   5    -39.8309861 -0.102786E-06  0.995E-04    3.19      20.1  T
   6    -39.8309861 -0.102971E-07  0.491E-04    3.19      40.7  T
     SCC iter.                  ...        0 min,  0.007 sec
     gradient                   ...        0 min,  0.013 sec
 * total energy  :   -39.1277736 Eh     change       -0.4670595E-03 Eh
   gradient norm :     0.0052714 Eh/α   predicted    -0.4097838E-03 ( -12.26%)
   displ. norm   :     0.1014353 α      lambda       -0.1447658E-03
   maximum displ.:     0.0562236 α      in ANC's #4, #7, #2, ...

........................................................................
.............................. CYCLE    4 ..............................
........................................................................
   1    -39.8308381 -0.398308E+02  0.608E-02    3.18       0.0  T
   2    -39.8308391 -0.988500E-06  0.361E-02    3.18       1.0  T
   3    -39.8308375  0.160432E-05  0.897E-03    3.18       2.2  T
   4    -39.8308394 -0.187674E-05  0.160E-03    3.18      12.5  T
   5    -39.8308394 -0.428306E-07  0.747E-04    3.18      26.8  T
     SCC iter.                  ...        0 min,  0.006 sec
     gradient                   ...        0 min,  0.013 sec
 * total energy  :   -39.1278753 Eh     change       -0.1017351E-03 Eh
   gradient norm :     0.0034750 Eh/α   predicted    -0.7312794E-04 ( -28.12%)
   displ. norm   :     0.1387098 α      lambda       -0.1125313E-03
   maximum displ.:     0.0832066 α      in ANC's #4, #2, #3, ...

........................................................................
.............................. CYCLE    5 ..............................
........................................................................
   1    -39.8293122 -0.398293E+02  0.824E-02    3.16       0.0  T
   2    -39.8293133 -0.110892E-05  0.487E-02    3.16       1.0  T
   3    -39.8293105  0.289362E-05  0.110E-02    3.16       1.8  T
   4    -39.8293138 -0.333664E-05  0.167E-03    3.16      11.9  T
   5    -39.8293138 -0.470097E-07  0.831E-04    3.16      24.1  T
   6    -39.8293138 -0.871125E-08  0.331E-04    3.16      60.5  T
     SCC iter.                  ...        0 min,  0.007 sec
     gradient                   ...        0 min,  0.014 sec
 * total energy  :   -39.1279379 Eh     change       -0.6253713E-04 Eh
   gradient norm :     0.0038793 Eh/α   predicted    -0.5734866E-04 (  -8.30%)
   displ. norm   :     0.0798093 α      lambda       -0.5344603E-04
   maximum displ.:     0.0546841 α      in ANC's #4, #2, #3, ...

........................................................................
.............................. CYCLE    6 ..............................
........................................................................
   1    -39.8287620 -0.398288E+02  0.542E-02    3.15       0.0  T
   2    -39.8287622 -0.185519E-06  0.321E-02    3.15       1.0  T
   3    -39.8287610  0.115863E-05  0.667E-03    3.15       3.0  T
   4    -39.8287623 -0.131074E-05  0.817E-04    3.15      24.5  T
   5    -39.8287623 -0.734980E-08  0.439E-04    3.15      45.6  T
   6    -39.8287623 -0.117696E-08  0.168E-04    3.15     119.1  T
     SCC iter.                  ...        0 min,  0.007 sec
     gradient                   ...        0 min,  0.014 sec
 * total energy  :   -39.1279740 Eh     change       -0.3612378E-04 Eh
   gradient norm :     0.0031251 Eh/α   predicted    -0.2690013E-04 ( -25.53%)
   displ. norm   :     0.0993469 α      lambda       -0.5356264E-04
   maximum displ.:     0.0642755 α      in ANC's #4, #2, #3, ...

........................................................................
.............................. CYCLE    7 ..............................
........................................................................
   1    -39.8290241 -0.398290E+02  0.605E-02    3.14       0.0  T
   2    -39.8290242 -0.169868E-06  0.356E-02    3.14       1.0  T
   3    -39.8290237  0.493108E-06  0.479E-03    3.14       4.2  T
   4    -39.8290243 -0.596219E-06  0.617E-04    3.14      32.4  T
   5    -39.8290243 -0.371706E-08  0.349E-04    3.14      57.2  T
     SCC iter.                  ...        0 min,  0.006 sec
     gradient                   ...        0 min,  0.014 sec
 * total energy  :   -39.1280185 Eh     change       -0.4448573E-04 Eh
   gradient norm :     0.0024734 Eh/α   predicted    -0.2704710E-04 ( -39.20%)
   displ. norm   :     0.1866272 α      lambda       -0.8350075E-04
   maximum displ.:     0.1202592 α      in ANC's #2, #4, #3, ...

........................................................................
.............................. CYCLE    8 ..............................
........................................................................
   1    -39.8292839 -0.398293E+02  0.111E-01    3.13       0.0  T
   2    -39.8292845 -0.547212E-06  0.654E-02    3.13       1.0  T
   3    -39.8292836  0.869614E-06  0.751E-03    3.13       2.7  T
   4    -39.8292847 -0.113643E-05  0.117E-03    3.13      17.1  T
   5    -39.8292847 -0.122159E-07  0.712E-04    3.13      28.1  T
   6    -39.8292847 -0.401504E-08  0.317E-04    3.13      63.0  T
     SCC iter.                  ...        0 min,  0.007 sec
     gradient                   ...        0 min,  0.014 sec
 * total energy  :   -39.1280821 Eh     change       -0.6359611E-04 Eh
   gradient norm :     0.0027687 Eh/α   predicted    -0.4320514E-04 ( -32.06%)
   displ. norm   :     0.2212106 α      lambda       -0.6763496E-04
   maximum displ.:     0.1437901 α      in ANC's #2, #4, #1, ...

........................................................................
.............................. CYCLE    9 ..............................
........................................................................
   1    -39.8290150 -0.398290E+02  0.128E-01    3.11       0.0  T
   2    -39.8290157 -0.676739E-06  0.756E-02    3.11       1.0  T
   3    -39.8290150  0.692038E-06  0.679E-03    3.12       2.9  T
   4    -39.8290160 -0.102971E-05  0.115E-03    3.11      17.3  T
   5    -39.8290160 -0.361717E-08  0.748E-04    3.11      26.7  T
   6    -39.8290160 -0.425676E-08  0.344E-04    3.11      58.1  T
     SCC iter.                  ...        0 min,  0.007 sec
     gradient                   ...        0 min,  0.014 sec
 * total energy  :   -39.1281264 Eh     change       -0.4431297E-04 Eh
   gradient norm :     0.0034743 Eh/α   predicted    -0.3547796E-04 ( -19.94%)
   displ. norm   :     0.1330774 α      lambda       -0.4451527E-04
   maximum displ.:     0.0866443 α      in ANC's #2, #4, #1, ...

........................................................................
.............................. CYCLE   10 ..............................
........................................................................
   1    -39.8297942 -0.398298E+02  0.764E-02    3.11       0.0  T
   2    -39.8297945 -0.274151E-06  0.450E-02    3.11       1.0  T
   3    -39.8297939  0.541884E-06  0.495E-03    3.11       4.0  T
   4    -39.8297946 -0.695515E-06  0.734E-04    3.11      27.2  T
   5    -39.8297946 -0.212825E-08  0.457E-04    3.11      43.8  T
     SCC iter.                  ...        0 min,  0.006 sec
     gradient                   ...        0 min,  0.014 sec
 * total energy  :   -39.1281562 Eh     change       -0.2977849E-04 Eh
   gradient norm :     0.0020509 Eh/α   predicted    -0.2265379E-04 ( -23.93%)
   displ. norm   :     0.1811627 α      lambda       -0.3305067E-04
   maximum displ.:     0.1221617 α      in ANC's #2, #4, #1, ...

........................................................................
.............................. CYCLE   11 ..............................
........................................................................
   1    -39.8290341 -0.398290E+02  0.100E-01    3.10       0.0  T
   2    -39.8290345 -0.333868E-06  0.589E-02    3.10       1.0  T
   3    -39.8290341  0.394492E-06  0.511E-03    3.10       3.9  T
   4    -39.8290347 -0.587793E-06  0.967E-04    3.10      20.7  T
   5    -39.8290347 -0.387021E-08  0.553E-04    3.10      36.2  T
     SCC iter.                  ...        0 min,  0.006 sec
     gradient                   ...        0 min,  0.014 sec
 * total energy  :   -39.1281762 Eh     change       -0.2000003E-04 Eh
   gradient norm :     0.0026452 Eh/α   predicted    -0.1707004E-04 ( -14.65%)
   displ. norm   :     0.1043538 α      lambda       -0.3606939E-04
   maximum displ.:     0.0654980 α      in ANC's #2, #1, #4, ...

........................................................................
.............................. CYCLE   12 ..............................
........................................................................
   1    -39.8299102 -0.398299E+02  0.562E-02    3.10       0.0  T
   2    -39.8299104 -0.254514E-06  0.331E-02    3.10       1.0  T
   3    -39.8299101  0.382310E-06  0.420E-03    3.10       4.8  T
   4    -39.8299105 -0.487097E-06  0.656E-04    3.10      30.5  T
   5    -39.8299106 -0.260087E-08  0.372E-04    3.10      53.7  T
     SCC iter.                  ...        0 min,  0.006 sec
     gradient                   ...        0 min,  0.014 sec
 * total energy  :   -39.1281960 Eh     change       -0.1981268E-04 Eh
   gradient norm :     0.0021806 Eh/α   predicted    -0.1823307E-04 (  -7.97%)
   displ. norm   :     0.1477945 α      lambda       -0.1907265E-04
   maximum displ.:     0.0971031 α      in ANC's #2, #1, #4, ...

........................................................................
.............................. CYCLE   13 ..............................
........................................................................
   1    -39.8290764 -0.398291E+02  0.826E-02    3.09       0.0  T
   2    -39.8290767 -0.241153E-06  0.486E-02    3.09       1.0  T
   3    -39.8290761  0.545041E-06  0.545E-03    3.09       3.7  T
   4    -39.8290768 -0.700579E-06  0.860E-04    3.09      23.2  T
   5    -39.8290768 -0.325419E-08  0.557E-04    3.09      35.9  T
     SCC iter.                  ...        0 min,  0.006 sec
     gradient                   ...        0 min,  0.014 sec
 * total energy  :   -39.1282068 Eh     change       -0.1083627E-04 Eh
   gradient norm :     0.0025418 Eh/α   predicted    -0.9745027E-05 ( -10.07%)
   displ. norm   :     0.0737076 α      lambda       -0.1372286E-04
   maximum displ.:     0.0478191 α      in ANC's #1, #2, #4, ...

........................................................................
.............................. CYCLE   14 ..............................
........................................................................
   1    -39.8293915 -0.398294E+02  0.369E-02    3.09       0.0  T
   2    -39.8293916 -0.639630E-07  0.217E-02    3.09       1.0  T
   3    -39.8293914  0.205307E-06  0.313E-03    3.09       6.4  T
   4    -39.8293916 -0.250945E-06  0.464E-04    3.09      43.1  T
   5    -39.8293916 -0.968065E-09  0.293E-04    3.09      68.3  T
     SCC iter.                  ...        0 min,  0.006 sec
     gradient                   ...        0 min,  0.014 sec
 * total energy  :   -39.1282161 Eh     change       -0.9323799E-05 Eh
   gradient norm :     0.0012633 Eh/α   predicted    -0.6899169E-05 ( -26.00%)
   displ. norm   :     0.1890828 α      lambda       -0.1477095E-04
   maximum displ.:     0.1293199 α      in ANC's #1, #2, #4, ...

........................................................................
.............................. CYCLE   15 ..............................
........................................................................
   1    -39.8296904 -0.398297E+02  0.100E-01    3.08       0.0  T
   2    -39.8296908 -0.439659E-06  0.590E-02    3.08       1.0  T
   3    -39.8296904  0.408065E-06  0.560E-03    3.08       3.6  T
   4    -39.8296911 -0.637865E-06  0.115E-03    3.08      17.4  T
   5    -39.8296911 -0.257911E-08  0.742E-04    3.08      27.0  T
   6    -39.8296911 -0.305061E-08  0.306E-04    3.08      65.4  T
     SCC iter.                  ...        0 min,  0.007 sec
     gradient                   ...        0 min,  0.014 sec
 * total energy  :   -39.1282221 Eh     change       -0.5989532E-05 Eh
   gradient norm :     0.0028814 Eh/α   predicted    -0.7503104E-05 (  25.27%)
   displ. norm   :     0.0201161 α      lambda       -0.8375057E-05
   maximum displ.:     0.0156311 α      in ANC's #1, #4, #6, ...

........................................................................
.............................. CYCLE   16 ..............................
........................................................................
   1    -39.8300371 -0.398300E+02  0.948E-03    3.09       0.0  T
   2    -39.8300371 -0.131124E-07  0.557E-03    3.09       3.6  T
   3    -39.8300370  0.712606E-07  0.205E-03    3.09       9.7  T
   4    -39.8300371 -0.818409E-07  0.248E-04    3.09      80.6  T
   5    -39.8300371 -0.245933E-09  0.164E-04    3.09     122.3  T
     SCC iter.                  ...        0 min,  0.006 sec
     gradient                   ...        0 min,  0.014 sec
 * total energy  :   -39.1282276 Eh     change       -0.5525529E-05 Eh
   gradient norm :     0.0015597 Eh/α   predicted    -0.4189622E-05 ( -24.18%)
   displ. norm   :     0.1681922 α      lambda       -0.9935394E-05
   maximum displ.:     0.0965106 α      in ANC's #1, #2, #4, ...

........................................................................
.............................. CYCLE   17 ..............................
........................................................................
   1    -39.8287663 -0.398288E+02  0.862E-02    3.08       0.0  T
   2    -39.8287667 -0.391919E-06  0.507E-02    3.08       1.0  T
   3    -39.8287660  0.700549E-06  0.663E-03    3.08       3.0  T
   4    -39.8287669 -0.889706E-06  0.997E-04    3.08      20.1  T
   5    -39.8287669 -0.648813E-08  0.585E-04    3.08      34.2  T
     SCC iter.                  ...        0 min,  0.006 sec
     gradient                   ...        0 min,  0.015 sec
 * total energy  :   -39.1282222 Eh     change        0.5401603E-05 Eh
   gradient norm :     0.0032550 Eh/α   predicted    -0.5034976E-05 (-193.21%)
   displ. norm   :     0.0567713 α      lambda       -0.1924860E-04
   maximum displ.:     0.0422511 α      in ANC's #2, #4, #1, ...

........................................................................
.............................. CYCLE   18 ..............................
........................................................................
   1    -39.8297740 -0.398298E+02  0.292E-02    3.08       0.0  T
   2    -39.8297741 -0.553177E-07  0.171E-02    3.08       1.2  T
   3    -39.8297739  0.199250E-06  0.342E-03    3.08       5.8  T
   4    -39.8297741 -0.233790E-06  0.384E-04    3.08      52.1  T
   5    -39.8297741 -0.566011E-09  0.236E-04    3.08      84.6  T
     SCC iter.                  ...        0 min,  0.006 sec
     gradient                   ...        0 min,  0.014 sec
 * total energy  :   -39.1282331 Eh     change       -0.1082542E-04 Eh
   gradient norm :     0.0016525 Eh/α   predicted    -0.9656275E-05 ( -10.80%)
   displ. norm   :     0.0523096 α      lambda       -0.6143342E-05
   maximum displ.:     0.0415073 α      in ANC's #1, #2, #4, ...

........................................................................
.............................. CYCLE   19 ..............................
........................................................................
   1    -39.8298760 -0.398299E+02  0.293E-02    3.08       0.0  T
   2    -39.8298761 -0.119020E-06  0.173E-02    3.08       1.2  T
   3    -39.8298759  0.157269E-06  0.307E-03    3.08       6.5  T
   4    -39.8298761 -0.187585E-06  0.577E-04    3.08      34.7  T
   5    -39.8298761 -0.395285E-08  0.286E-04    3.08      69.9  T
     SCC iter.                  ...        0 min,  0.006 sec
     gradient                   ...        0 min,  0.014 sec
 * total energy  :   -39.1282353 Eh     change       -0.2208050E-05 Eh
   gradient norm :     0.0017243 Eh/α   predicted    -0.3076442E-05 (  39.33%)
   displ. norm   :     0.0445353 α      lambda       -0.2806039E-05
   maximum displ.:     0.0292588 α      in ANC's #1, #4, #2, ...

........................................................................
.............................. CYCLE   20 ..............................
........................................................................
   1    -39.8299355 -0.398299E+02  0.222E-02    3.08       0.0  T
   2    -39.8299355 -0.339461E-07  0.131E-02    3.08       1.5  T
   3    -39.8299355  0.622526E-08  0.926E-04    3.08      21.6  T
   4    -39.8299355 -0.148326E-07  0.390E-04    3.08      51.3  T
     SCC iter.                  ...        0 min,  0.005 sec
     gradient                   ...        0 min,  0.014 sec
 * total energy  :   -39.1282381 Eh     change       -0.2829889E-05 Eh
   gradient norm :     0.0003241 Eh/α   predicted    -0.1405984E-05 ( -50.32%)
   displ. norm   :     0.0806255 α      lambda       -0.1452086E-05
   maximum displ.:     0.0535363 α      in ANC's #1, #4, #2, ...

   *** GEOMETRY OPTIMIZATION CONVERGED AFTER 20 ITERATIONS ***

------------------------------------------------------------------------
 total energy gain   :        -0.0048842 Eh       -3.0649 kcal/mol
 total RMSD          :         0.3780101 a0        0.2000 Å
 total power (kW/mol):        -0.6411683 (step)  -20.8053 (real)
------------------------------------------------------------------------

 ANCopt (total)                0 d,  0 h,  0 min,  0.616 sec
 optimizer setup                ...        0 min,  0.000 sec (  0.027%)
 model hessian                  ...        0 min,  0.003 sec (  0.565%)
 ANC generation                 ...        0 min,  0.001 sec (  0.115%)
 coordinate transformation      ...        0 min,  0.000 sec (  0.062%)
 single point calculation       ...        0 min,  0.604 sec ( 97.917%)
 optimization log               ...        0 min,  0.002 sec (  0.327%)
 hessian update                 ...        0 min,  0.000 sec (  0.045%)
 rational function              ...        0 min,  0.005 sec (  0.737%)

================
 final structure:
================
$coord
    6.41503650483922    0.40712417180346    0.00770000383976      C 
    5.76799455634440   -2.14093354756431    0.12019341484934      C 
    3.27206480837763   -2.90338506215541    0.12806178008682      C 
    1.40718628488046   -1.05985042230843    0.02105857860934      C 
    2.09081289312142    1.51292663058758   -0.09023989120005      C 
    4.58997080883333    2.27703580557176   -0.09927984887179      C 
    0.02401595711492    3.04241894643915   -0.18244104372156      O 
   -2.02705756683258    1.48559498812683   -0.13399704204000      C 
   -1.30841175088882   -1.07686953347268   -0.00835598435645      C 
   -3.16508238361158   -2.93113846610602    0.06091510834119      C 
   -5.65984626277130   -2.18870456973979    0.00439909228160      C 
   -6.37971286447954    0.36302340996165   -0.12739478812448      C 
   -4.52294022123916    2.23284766044833   -0.19359583248964      C 
   -9.06824406045221    0.95821611744525   -0.18644053845558      C 
  -10.10029364310675    3.22214007550304   -0.51535787811474      C 
    8.38516186600626    0.93730119215603    0.00401846507989      H 
    7.25036630797372   -3.54075912129730    0.20250965925669      H 
    2.77184816551278   -4.87865195409620    0.21498106808152      H 
    5.08022017143861    4.25260892823689   -0.18628525291451      H 
   -2.65750838727153   -4.90419467981714    0.15930608214360      H 
   -7.12379283801103   -3.61153874320053    0.05668484055505      H 
   -4.99590821369272    4.21080027186701   -0.27738890325418      H 
  -10.29927022500156   -0.66020898676892    0.04942239020833      H 
   -8.99823768729097    4.90954698468555   -0.78504201566742      H 
  -12.11942433189614    3.46831759946782   -0.53502653379753      H 
$end
           -------------------------------------------------
          |                Final Singlepoint                |
           -------------------------------------------------

          ...................................................
          :                      SETUP                      :
          :.................................................:
          :  # basis functions                  70          :
          :  # atomic orbitals                  70          :
          :  # shells                           40          :
          :  # electrons                        72          :
          :  max. iterations                   250          :
          :  Hamiltonian                  GFN2-xTB          :
          :  restarted?                      false          :
          :  GBSA solvation                  false          :
          :  PC potential                    false          :
          :  electronic temp.          300.0000000     K    :
          :  accuracy                    1.0000000          :
          :  -> integral cutoff          0.2500000E+02      :
          :  -> integral neglect         0.1000000E-07      :
          :  -> SCF convergence          0.1000000E-05 Eh   :
          :  -> wf. convergence          0.1000000E-03 e    :
          :  Broyden damping             0.4000000          :
          ...................................................

 iter      E             dE          RMSdq      gap      omega  full diag
   1    -39.8299355 -0.398299E+02  0.185E-04    3.08       0.0  T
   2    -39.8299355 -0.433005E-10  0.788E-05    3.08     253.7  T
   3    -39.8299355 -0.581935E-11  0.963E-05    3.08     207.6  T

   *** convergence criteria satisfied after 3 iterations ***

         #    Occupation            Energy/Eh            Energy/eV
      -------------------------------------------------------------
         1        2.0000           -0.7332535             -19.9528
       ...           ...                  ...                  ...
        30        2.0000           -0.4324592             -11.7678
        31        2.0000           -0.4264586             -11.6045
        32        2.0000           -0.4235823             -11.5263
        33        2.0000           -0.4145169             -11.2796
        34        2.0000           -0.4126978             -11.2301
        35        2.0000           -0.3872602             -10.5379
        36        2.0000           -0.3781953             -10.2912 (HOMO)
        37                         -0.2649290              -7.2091 (LUMO)
        38                         -0.2293149              -6.2400
        39                         -0.2226446              -6.0585
        40                         -0.2063053              -5.6139
        41                         -0.1623431              -4.4176
       ...                                ...                  ...
        70                          0.7438427              20.2410
      -------------------------------------------------------------
                  HL-Gap            0.1132663 Eh            3.0821 eV
             Fermi-level           -0.3215622 Eh           -8.7502 eV

 SCC (total)                   0 d,  0 h,  0 min,  0.028 sec
 SCC setup                      ...        0 min,  0.000 sec (  0.728%)
 Dispersion                     ...        0 min,  0.000 sec (  0.785%)
 integral evaluation            ...        0 min,  0.009 sec ( 31.756%)
 zeroth order Hamiltonian       ...        0 min,  0.000 sec (  0.550%)
 iterations                     ...        0 min,  0.004 sec ( 14.830%)
 molecular gradient             ...        0 min,  0.014 sec ( 49.936%)
 printout                       ...        0 min,  0.000 sec (  1.221%)

         :::::::::::::::::::::::::::::::::::::::::::::::::::::
         ::                     SUMMARY                     ::
         :::::::::::::::::::::::::::::::::::::::::::::::::::::
         :: total energy             -39.128238051346 Eh    ::
         :: gradient norm              0.000324643269 Eh/a0 ::
         :: HOMO-LUMO gap              3.082134206144 eV    ::
         ::.................................................::
         :: SCC energy               -39.829935497105 Eh    ::
         :: -> isotropic ES            0.012577986722 Eh    ::
         :: -> anisotropic ES          0.004392357452 Eh    ::
         :: -> anisotropic XC          0.019183452376 Eh    ::
         :: -> dispersion             -0.025861521124 Eh    ::
         :: repulsion energy           0.701847216158 Eh    ::
         :: add. restraining           0.000000000000 Eh    ::
         :::::::::::::::::::::::::::::::::::::::::::::::::::::

           -------------------------------------------------
          |                Property Printout                |
           -------------------------------------------------

    * Orbital Energies and Occupations

         #    Occupation            Energy/Eh            Energy/eV
      -------------------------------------------------------------
         1        2.0000           -0.7332535             -19.9528
       ...           ...                  ...                  ...
        24        2.0000           -0.4820107             -13.1162
        25        2.0000           -0.4754217             -12.9369
        26        2.0000           -0.4675792             -12.7235
        27        2.0000           -0.4545816             -12.3698
        28        2.0000           -0.4445830             -12.0977
        29        2.0000           -0.4428162             -12.0496
        30        2.0000           -0.4324592             -11.7678
        31        2.0000           -0.4264586             -11.6045
        32        2.0000           -0.4235823             -11.5263
        33        2.0000           -0.4145169             -11.2796
        34        2.0000           -0.4126978             -11.2301
        35        2.0000           -0.3872602             -10.5379
        36        2.0000           -0.3781953             -10.2912 (HOMO)
        37                         -0.2649290              -7.2091 (LUMO)
        38                         -0.2293149              -6.2400
        39                         -0.2226446              -6.0585
        40                         -0.2063053              -5.6139
        41                         -0.1623431              -4.4176
        42                         -0.0944950              -2.5713
        43                         -0.0638498              -1.7374
        44                          0.0494308               1.3451
        45                          0.0980978               2.6694
        46                          0.1099073               2.9907
        47                          0.1169221               3.1816
       ...                                ...                  ...
        70                          0.7438427              20.2410
      -------------------------------------------------------------
                  HL-Gap            0.1132663 Eh            3.0821 eV
             Fermi-level           -0.3215622 Eh           -8.7502 eV

     #   Z        covCN         q      C6AA      α(0)
     1   6 C      2.926    -0.032    28.804     8.801
     2   6 C      2.921    -0.038    28.957     8.824
     3   6 C      2.913    -0.034    28.836     8.806
     4   6 C      3.055    -0.019    28.422     8.743
     5   6 C      3.101     0.130    25.040     8.200
     6   6 C      2.908    -0.052    29.297     8.875
     7   8 O      1.714    -0.226    17.749     5.688
     8   6 C      3.096     0.128    25.084     8.208
     9   6 C      3.057    -0.021    28.464     8.749
    10   6 C      2.910    -0.035    28.867     8.810
    11   6 C      2.929    -0.044    29.089     8.845
    12   6 C      2.975     0.013    27.709     8.634
    13   6 C      2.913    -0.056    29.400     8.891
    14   6 C      2.896    -0.029    28.731     8.788
    15   6 C      2.837    -0.086    30.134     8.996
    16   1 H      0.926     0.039     2.464     2.455
    17   1 H      0.926     0.036     2.503     2.474
    18   1 H      0.926     0.037     2.485     2.465
    19   1 H      0.926     0.046     2.371     2.408
    20   1 H      0.926     0.037     2.487     2.466
    21   1 H      0.926     0.037     2.495     2.470
    22   1 H      0.926     0.050     2.314     2.379
    23   1 H      0.925     0.037     2.490     2.467
    24   1 H      0.926     0.042     2.425     2.435
    25   1 H      0.926     0.039     2.456     2.451

 Mol. C6AA /au·bohr⁶  :       8891.766627
 Mol. C8AA /au·bohr⁸  :     224408.326563
 Mol. α(0) /au        :        152.331874


Wiberg/Mayer (AO) data.
largest (>0.10) Wiberg bond orders for each atom
          total WBO             WBO to atom ...
     1  C   3.967        C    6 1.458    C    2 1.405    H   16 0.971
     2  C   3.987        C    3 1.473    C    1 1.405    H   17 0.971
     3  C   3.978        C    2 1.473    C    4 1.362    H   18 0.969    C    6 0.109
     4  C   3.985        C    3 1.362    C    5 1.281    C    9 1.141
     5  C   3.921        C    6 1.377    C    4 1.281    O    7 1.066
     6  C   3.986        C    1 1.458    C    5 1.377    H   19 0.968    C    3 0.109
     7  O   2.362        C    5 1.066    C    8 1.061
     8  C   3.925        C   13 1.396    C    9 1.274    O    7 1.061
     9  C   3.986        C   10 1.354    C    8 1.274    C    4 1.141
    10  C   3.981        C   11 1.491    C    9 1.354    H   20 0.969    C   13 0.101
    11  C   3.986        C   10 1.491    C   12 1.342    H   21 0.968
    12  C   3.969        C   13 1.388    C   11 1.342    C   14 1.096
    13  C   3.986        C    8 1.396    C   12 1.388    H   22 0.962    C   10 0.101
    14  C   3.990        C   15 1.896    C   12 1.096    H   23 0.964
    15  C   3.978        C   14 1.896    H   25 0.978    H   24 0.973
    16  H   0.998        C    1 0.971
    17  H   0.998        C    2 0.971
    18  H   0.999        C    3 0.969
    19  H   0.997        C    6 0.968
    20  H   0.998        C   10 0.969
    21  H   0.998        C   11 0.968
    22  H   0.997        C   13 0.962
    23  H   0.998        C   14 0.964
    24  H   0.998        C   15 0.973
    25  H   0.998        C   15 0.978

molecular dipole:
                 x           y           z       tot (Debye)
 q only:       -0.037      -0.299       0.013
   full:       -0.022      -0.269       0.010       0.686
molecular quadrupole (traceless):
                xx          xy          yy          xz          yz          zz
 q only:        5.029      -0.202      -1.051       0.106      -0.206      -3.978
  q+dip:        7.118       0.086       3.627       0.167      -0.989     -10.745
   full:        4.826       0.094       0.527       0.103      -0.432      -5.352

           -------------------------------------------------
          |                Geometry Summary                 |
           -------------------------------------------------

      molecular mass/u    :      194.2324000
   center of mass at/Å    :       -0.6728572       0.1382922      -0.0440914
  moments of inertia/u·Å² :        0.2486718E+03   0.1455735E+04   0.1704101E+04
rotational constants/cm⁻¹ :        0.6779068E-01   0.1158015E-01   0.9892389E-02

 * 26 selected distances

     #   Z        #   Z                                     value/Å
     1   6 C      2   6 C                                 1.3924419
     2   6 C      3   6 C                                 1.3810472
     3   6 C      4   6 C                                 1.3888097
     4   6 C      5   6 C                                 1.4099287
     1   6 C      6   6 C                                 1.3838647
     5   6 C      6   6 C                                 1.3829392
     5   6 C      7   8 O                                 1.3614876
     7   8 O      8   6 C                                 1.3628704
     4   6 C      9   6 C                                 1.4371452 (max)
     8   6 C      9   6 C                                 1.4098837
     9   6 C     10   6 C                                 1.3890613
    10   6 C     11   6 C                                 1.3777167
    11   6 C     12   6 C                                 1.4047532
     8   6 C     13   6 C                                 1.3790494
    12   6 C     13   6 C                                 1.3948846
    14   6 C     15   6 C                                 1.3280836
     1   6 C     16   1 H                                 1.0796377
     2   6 C     17   1 H                                 1.0797957
     3   6 C     18   1 H                                 1.0792428
     6   6 C     19   1 H                                 1.0781204
    10   6 C     20   1 H                                 1.0793482
    11   6 C     21   1 H                                 1.0806534
    13   6 C     22   1 H                                 1.0771086
    14   6 C     23   1 H                                 1.0832449
    15   6 C     24   1 H                                 1.0760139 (min)
    15   6 C     25   1 H                                 1.0764406

 * 3 distinct bonds (by element types)

   Z      Z             #   av. dist./Å        max./Å        min./Å
   1 H    6 C          10     1.0789606     1.0832449     1.0760139
   6 C    6 C          14     1.3899721     1.4371452     1.3280836
   6 C    8 O           2     1.3621790     1.3628704     1.3614876


optimized geometry written to: xtbopt.xyz


           -------------------------------------------------
          | TOTAL ENERGY              -39.128238051346 Eh   |
          | GRADIENT NORM               0.000324643269 Eh/α |
          | HOMO-LUMO GAP               3.082134206144 eV   |
           -------------------------------------------------

------------------------------------------------------------------------
 * finished run on 2021/05/19 at 10:59:40.706     
------------------------------------------------------------------------
 total:
 * wall-time:     0 d,  0 h,  0 min,  0.705 sec
 *  cpu-time:     0 d,  0 h,  0 min,  0.703 sec
 * ratio c/w:     0.996 speedup
 SCF:
 * wall-time:     0 d,  0 h,  0 min,  0.039 sec
 *  cpu-time:     0 d,  0 h,  0 min,  0.038 sec
 * ratio c/w:     0.997 speedup
 ANC optimizer:
 * wall-time:     0 d,  0 h,  0 min,  0.645 sec
 *  cpu-time:     0 d,  0 h,  0 min,  0.644 sec
 * ratio c/w:     0.998 speedup

