      -----------------------------------------------------------      
     |                   =====================                   |     
     |                           x T B                           |     
     |                   =====================                   |     
     |                         S. Grimme                         |     
     |          Mulliken Center for Theoretical Chemistry        |     
     |                    University of Bonn                     |     
     |                Version 6.2 RC2 (SAW190805)                |     
      -----------------------------------------------------------      

   This program is distributed in the hope that it will be useful,
   but WITHOUT ANY WARRANTY; without even the implied warranty of
   MERCHANTABILITY or FITNESS FOR A PARTICULAR PURPOSE.
   
   FOR NON-COMMERCIAL, ACADEMIA USE ONLY.
   
   Cite this work as:
   * S. Grimme, C. Bannwarth, P. Shushkov, J. Chem. Theory Comput., 2017,
     13, 1989-2009. DOI: 10.1021/acs.jctc.7b00118
   * C. Bannwarth, S. Ehlert and S. Grimme., J. Chem. Theory Comput., 2019,
     15, 1652-1671. DOI: 10.1021/acs.jctc.8b01176
   * P. Pracht, E. Caldeweyher, S. Ehlert, S. Grimme, ChemRxiv, 2019, preprint.
     DOI: 10.26434/chemrxiv.8326202.v1
   
   for DFT-D4:
   * E. Caldeweyher, C. Bannwarth and S. Grimme, J. Chem. Phys., 2017,
     147, 034112. DOI: 10.1063/1.4993215
   * E. Caldeweyher, S. Ehlert, A. Hansen, H. Neugebauer, S. Spicher,
     C. Bannwarth and S. Grimme, J. Chem. Phys., 2019, 150, 154122.
     DOI: 10.1063/1.5090222
   
   for sTDA-xTB:
   * S. Grimme and C. Bannwarth, J. Chem. Phys., 2016, 145, 054103.
     DOI: 10.1063/1.4959605
   
   in the mass-spec context:
   * V. Asgeirsson, C. Bauer and S. Grimme, Chem. Sci., 2017, 8, 4879.
     DOI: 10.1039/c7sc00601b
   
   for metadynamics refer to:
   * S. Grimme, J. Chem. Theory Comput., 2019, 155, 2847-2862
     DOI: 10.1021/acs.jctc.9b00143
   
   with help from (in alphabetical order)
   C. Bannwarth, F. Bohle, G. Brandenburg, E. Caldeweyher, M. Checinski,
   S. Dohm, S. Ehlert, S. Ehrlich, F. März, H. Neugebauer, J. Pisarek,
   P. Pracht, P. Shushkov, and S. Spicher.
   
 * started run on 2021/05/19 at 10:59:41.207     

           -------------------------------------------------
          |                Calculation Setup                |
           -------------------------------------------------

          program call               : /ihome/ghutchison/geoffh/xtb/xtb 634.xyz -opt
          hostname                   : smp-n144
          coordinate file            : 634.xyz
          omp threads                :                     1
          number of atoms            :                    20
          number of electrons        :                    56
          charge                     :                     0
          spin                       :                   0.0
          first test random number   :      0.84345199945076


########################################################################
# WARNING! Please study the warnings concerning your input carefully
#  - the use of '-opt' is discouraged, please use '--opt' next time
########################################################################

           ------------------------------------------------- 
          |                 G F N 2 - x T B                 |
          | Geometry, Frequencies, Noncovalent interactions |
          |            JCTC 2019 parametrisation            |
           ------------------------------------------------- 
             KAB for C  - Si     :                1.0500
             KAB for H  - Pd     :                0.9500
             k(s)              :                1.8500
             k(p)              :                2.2300
             k(d)              :                2.2300
             k(f)              :                2.0000
             kEN (H0ij)        :               -2.0000
             D4 a1             :                0.5200
             D4 a2             :                5.0000
             D4 s6             :                1.0000
             D4 s8             :                2.7000
             D4 s9             :                5.0000
             alphaj            :                2.0000

  Z AO/shell   Hii/eV     exponent
  1     Wed Apr 25 08:07:45 CEST 2018   EN: 2.200 GM2: 0.406  GM3: 0.0800  RAES: 1.40
     1s    -10.707211    1.230000
  6     Wed Apr 25 08:07:45 CEST 2018   EN: 2.550 GM2: 0.538  GM3: 0.1500  RAES: 3.00
     2s    -13.970922    2.096432
     2p    -10.063292    1.800000
  7     Wed Apr 25 08:07:45 CEST 2018   EN: 3.040 GM2: 0.461  GM3:-0.0640  RAES: 1.90
     2s    -16.686243    2.339881
     2p    -12.523956    2.014332
 16     Tue Apr 24 11:44:34 CEST 2018   EN: 2.580 GM2: 0.340  GM3:-0.0502  RAES: 3.10
     3s    -20.029654    1.981333
     3p    -11.377694    2.025643
     3d     -0.420282    1.702555

           ------------------------------------------------- 
          |        Self-Consistent Charge Iterations        |
           ------------------------------------------------- 

          ...................................................
          :                      SETUP                      :
          :.................................................:
          :  # basis functions                  62          :
          :  # atomic orbitals                  60          :
          :  # shells                           32          :
          :  # electrons                        56          :
          :  max. iterations                   250          :
          :  Hamiltonian                  GFN2-xTB          :
          :  restarted?                      false          :
          :  GBSA solvation                  false          :
          :  PC potential                    false          :
          :  electronic temp.          300.0000000     K    :
          :  accuracy                    1.0000000          :
          :  -> integral cutoff          0.2500000E+02      :
          :  -> integral neglect         0.1000000E-07      :
          :  -> SCF convergence          0.1000000E-05 Eh   :
          :  -> wf. convergence          0.1000000E-03 e    :
          :  Broyden damping             0.4000000          :
          ...................................................

 iter      E             dE          RMSdq      gap      omega  full diag
   1    -30.4840582 -0.304841E+02  0.492E+00    2.60       0.0  T
   2    -30.5345557 -0.504975E-01  0.332E+00    2.40       1.0  T
   3    -30.5291785  0.537727E-02  0.163E+00    2.34       1.0  T
   4    -30.5521216 -0.229431E-01  0.637E-01    2.13       1.0  T
   5    -30.5551606 -0.303905E-02  0.247E-01    2.14       1.0  T
   6    -30.5551801 -0.195185E-04  0.635E-02    2.14       1.0  T
   7    -30.5551952 -0.151000E-04  0.191E-02    2.15       1.2  T
   8    -30.5551955 -0.257468E-06  0.880E-03    2.15       2.5  T
   9    -30.5551956 -0.762340E-07  0.287E-03    2.15       7.8  T
  10    -30.5551956 -0.139637E-07  0.135E-03    2.15      16.5  T
  11    -30.5551956 -0.296296E-08  0.479E-04    2.15      46.7  T
  12    -30.5551956 -0.266933E-09  0.226E-04    2.15      99.0  T

   *** convergence criteria satisfied after 12 iterations ***

         #    Occupation            Energy/Eh            Energy/eV
      -------------------------------------------------------------
         1        2.0000           -0.7394063             -20.1203
       ...           ...                  ...                  ...
        22        2.0000           -0.4689922             -12.7619
        23        2.0000           -0.4554300             -12.3929
        24        2.0000           -0.4385128             -11.9325
        25        2.0000           -0.4329530             -11.7813
        26        2.0000           -0.3797899             -10.3346
        27        2.0000           -0.3654118              -9.9434
        28        2.0000           -0.3230846              -8.7916 (HOMO)
        29                         -0.2442115              -6.6453 (LUMO)
        30                         -0.2158678              -5.8741
        31                         -0.1868095              -5.0833
        32                         -0.1594265              -4.3382
        33                         -0.1463743              -3.9830
       ...                                ...                  ...
        60                          0.6021422              16.3851
      -------------------------------------------------------------
                  HL-Gap            0.0788731 Eh            2.1462 eV
             Fermi-level           -0.2836481 Eh           -7.7185 eV

 SCC (total)                   0 d,  0 h,  0 min,  0.032 sec
 SCC setup                      ...        0 min,  0.000 sec (  0.841%)
 Dispersion                     ...        0 min,  0.000 sec (  0.746%)
 integral evaluation            ...        0 min,  0.007 sec ( 22.905%)
 zeroth order Hamiltonian       ...        0 min,  0.000 sec (  0.487%)
 iterations                     ...        0 min,  0.012 sec ( 37.773%)
 molecular gradient             ...        0 min,  0.011 sec ( 35.998%)
 printout                       ...        0 min,  0.000 sec (  1.075%)

         :::::::::::::::::::::::::::::::::::::::::::::::::::::
         ::                     SUMMARY                     ::
         :::::::::::::::::::::::::::::::::::::::::::::::::::::
         :: total energy             -30.233638992621 Eh    ::
         :: gradient norm              0.079931794362 Eh/a0 ::
         :: HOMO-LUMO gap              2.146246732094 eV    ::
         ::.................................................::
         :: SCC energy               -30.555195595856 Eh    ::
         :: -> isotropic ES            0.015066447748 Eh    ::
         :: -> anisotropic ES          0.003510402214 Eh    ::
         :: -> anisotropic XC          0.027782678169 Eh    ::
         :: -> dispersion             -0.020627875366 Eh    ::
         :: repulsion energy           0.321488469537 Eh    ::
         :: add. restraining           0.000000000000 Eh    ::
         :::::::::::::::::::::::::::::::::::::::::::::::::::::

      ----------------------------------------------------------- 
     |                   =====================                   |
     |                        A N C O P T                        |
     |                   =====================                   |
     |               Approximate Normal Coordinate               |
     |                Rational Function Optimizer                |
      ----------------------------------------------------------- 

          ...................................................
          :                      SETUP                      :
          :.................................................:
          :   optimization level            normal          :
          :   max. optcycles                   200          :
          :   ANC micro-cycles                  20          :
          :   degrees of freedom                54          :
          :.................................................:
          :   RF solver                   davidson          :
          :   input Hessian                  false          :
          :   write xtbopt.log                true          :
          :   linear?                        false          :
          :   energy convergence         0.5000000E-05 Eh   :
          :   grad. convergence          0.1000000E-02 Eh/α :
          :   maximium RF displ.         2.0000000          :
          :   Hlow (freq-cutoff)         0.5000000E-02      :
          :   Hmax (freq-cutoff)         5.0000000          :
          :   S6 in model hess.         20.0000000          :
          ...................................................

generating ANC from model Hessian ...
Using Lindh-Hessian (1995)
 Shifting diagonal of input Hessian by   2.307596344622697E-003
 Lowest  eigenvalues of input Hessian
   -0.000000   -0.000000   -0.000000    0.000000    0.000000    0.000000
    0.005000    0.007052    0.008801    0.013136    0.014266    0.021006
    0.022900    0.026134    0.029486    0.041335    0.046474    0.050544
 Highest eigenvalues
    1.315269    1.366179    1.468281    1.576924    1.788989    2.091528
 

........................................................................
.............................. CYCLE    1 ..............................
........................................................................
   1    -30.5551956 -0.305552E+02  0.598E-05    2.15       0.0  T
   2    -30.5551956 -0.528644E-11  0.334E-05    2.15     669.3  T
   3    -30.5551956  0.856204E-12  0.240E-05    2.15     932.5  T
     SCC iter.                  ...        0 min,  0.003 sec
     gradient                   ...        0 min,  0.011 sec
 * total energy  :   -30.2336390 Eh     change       -0.1217035E-07 Eh
   gradient norm :     0.0799315 Eh/α   predicted     0.0000000E+00 (-100.00%)
   displ. norm   :     0.3244204 α      lambda       -0.1002180E-01
   maximum displ.:     0.1660952 α      in ANC's #10, #9, #2, ...

........................................................................
.............................. CYCLE    2 ..............................
........................................................................
   1    -30.5699912 -0.305700E+02  0.523E-01    2.11       0.0  T
   2    -30.5700981 -0.106926E-03  0.233E-01    2.12       1.0  T
   3    -30.5701142 -0.160624E-04  0.529E-02    2.13       1.0  T
   4    -30.5701138  0.383124E-06  0.261E-02    2.13       1.0  T
   5    -30.5701164 -0.260188E-05  0.107E-02    2.13       2.1  T
   6    -30.5701176 -0.123533E-05  0.413E-03    2.13       5.4  T
   7    -30.5701177 -0.503807E-07  0.171E-03    2.13      13.1  T
     SCC iter.                  ...        0 min,  0.007 sec
     gradient                   ...        0 min,  0.011 sec
 * total energy  :   -30.2408793 Eh     change       -0.7240338E-02 Eh
   gradient norm :     0.0458228 Eh/α   predicted    -0.5538293E-02 ( -23.51%)
   displ. norm   :     0.3377716 α      lambda       -0.5257702E-02
   maximum displ.:     0.1575349 α      in ANC's #5, #9, #2, ...

........................................................................
.............................. CYCLE    3 ..............................
........................................................................
   1    -30.5760401 -0.305760E+02  0.618E-01    2.07       0.0  T
   2    -30.5762011 -0.161049E-03  0.261E-01    2.08       1.0  T
   3    -30.5761879  0.132405E-04  0.806E-02    2.09       1.0  T
   4    -30.5762223 -0.344018E-04  0.486E-02    2.09       1.0  T
   5    -30.5762383 -0.160376E-04  0.111E-02    2.09       2.0  T
   6    -30.5762386 -0.298575E-06  0.469E-03    2.09       4.8  T
   7    -30.5762387 -0.293022E-07  0.195E-03    2.09      11.5  T
     SCC iter.                  ...        0 min,  0.006 sec
     gradient                   ...        0 min,  0.011 sec
 * total energy  :   -30.2440020 Eh     change       -0.3122610E-02 Eh
   gradient norm :     0.0118128 Eh/α   predicted    -0.2928776E-02 (  -6.21%)
   displ. norm   :     0.2484542 α      lambda       -0.9955385E-03
   maximum displ.:     0.1396880 α      in ANC's #5, #2, #4, ...

........................................................................
.............................. CYCLE    4 ..............................
........................................................................
   1    -30.5743888 -0.305744E+02  0.391E-01    2.08       0.0  T
   2    -30.5744577 -0.689259E-04  0.163E-01    2.09       1.0  T
   3    -30.5744248  0.329307E-04  0.710E-02    2.09       1.0  T
   4    -30.5744806 -0.558223E-04  0.293E-02    2.09       1.0  T
   5    -30.5744833 -0.269221E-05  0.482E-03    2.09       4.6  T
   6    -30.5744833 -0.499679E-07  0.208E-03    2.09      10.7  T
   7    -30.5744833 -0.316685E-08  0.699E-04    2.09      32.0  T
     SCC iter.                  ...        0 min,  0.006 sec
     gradient                   ...        0 min,  0.011 sec
 * total energy  :   -30.2447049 Eh     change       -0.7029137E-03 Eh
   gradient norm :     0.0073711 Eh/α   predicted    -0.5284957E-03 ( -24.81%)
   displ. norm   :     0.2929975 α      lambda       -0.7173611E-03
   maximum displ.:     0.1576480 α      in ANC's #4, #2, #5, ...

........................................................................
.............................. CYCLE    5 ..............................
........................................................................
   1    -30.5725483 -0.305725E+02  0.444E-01    2.11       0.0  T
   2    -30.5726376 -0.892579E-04  0.190E-01    2.12       1.0  T
   3    -30.5725898  0.478484E-04  0.833E-02    2.12       1.0  T
   4    -30.5726678 -0.780101E-04  0.352E-02    2.12       1.0  T
   5    -30.5726721 -0.432694E-05  0.558E-03    2.12       4.0  T
   6    -30.5726721 -0.415762E-07  0.275E-03    2.12       8.1  T
   7    -30.5726721 -0.485359E-08  0.868E-04    2.12      25.7  T
     SCC iter.                  ...        0 min,  0.006 sec
     gradient                   ...        0 min,  0.011 sec
 * total energy  :   -30.2451610 Eh     change       -0.4561453E-03 Eh
   gradient norm :     0.0088584 Eh/α   predicted    -0.3894735E-03 ( -14.62%)
   displ. norm   :     0.1967165 α      lambda       -0.3177570E-03
   maximum displ.:     0.1017195 α      in ANC's #2, #4, #5, ...

........................................................................
.............................. CYCLE    6 ..............................
........................................................................
   1    -30.5734549 -0.305735E+02  0.291E-01    2.15       0.0  T
   2    -30.5734931 -0.382008E-04  0.126E-01    2.15       1.0  T
   3    -30.5734855  0.757368E-05  0.445E-02    2.15       1.0  T
   4    -30.5735009 -0.154184E-04  0.220E-02    2.15       1.0  T
   5    -30.5735034 -0.248536E-05  0.395E-03    2.15       5.7  T
   6    -30.5735034 -0.166695E-07  0.193E-03    2.15      11.6  T
   7    -30.5735034 -0.356766E-08  0.646E-04    2.15      34.6  T
     SCC iter.                  ...        0 min,  0.006 sec
     gradient                   ...        0 min,  0.011 sec
 * total energy  :   -30.2453708 Eh     change       -0.2097474E-03 Eh
   gradient norm :     0.0071529 Eh/α   predicted    -0.1650311E-03 ( -21.32%)
   displ. norm   :     0.1560091 α      lambda       -0.2198271E-03
   maximum displ.:     0.0813847 α      in ANC's #1, #2, #4, ...

........................................................................
.............................. CYCLE    7 ..............................
........................................................................
   1    -30.5755627 -0.305756E+02  0.212E-01    2.18       0.0  T
   2    -30.5755792 -0.165647E-04  0.985E-02    2.17       1.0  T
   3    -30.5755815 -0.222706E-05  0.225E-02    2.17       1.0  T
   4    -30.5755801  0.138378E-05  0.147E-02    2.17       1.5  T
   5    -30.5755827 -0.263720E-05  0.311E-03    2.17       7.2  T
   6    -30.5755827 -0.154397E-07  0.150E-03    2.17      14.9  T
   7    -30.5755827 -0.575095E-08  0.594E-04    2.17      37.6  T
     SCC iter.                  ...        0 min,  0.006 sec
     gradient                   ...        0 min,  0.011 sec
 * total energy  :   -30.2455079 Eh     change       -0.1371181E-03 Eh
   gradient norm :     0.0046123 Eh/α   predicted    -0.1125892E-03 ( -17.89%)
   displ. norm   :     0.1196626 α      lambda       -0.1007231E-03
   maximum displ.:     0.0881857 α      in ANC's #1, #2, #4, ...

........................................................................
.............................. CYCLE    8 ..............................
........................................................................
   1    -30.5761744 -0.305762E+02  0.143E-01    2.19       0.0  T
   2    -30.5761815 -0.713217E-05  0.682E-02    2.19       1.0  T
   3    -30.5761822 -0.689648E-06  0.146E-02    2.19       1.5  T
   4    -30.5761820  0.213378E-06  0.106E-02    2.18       2.1  T
   5    -30.5761830 -0.102427E-05  0.225E-03    2.18       9.9  T
   6    -30.5761830 -0.268949E-07  0.983E-04    2.18      22.8  T
     SCC iter.                  ...        0 min,  0.006 sec
     gradient                   ...        0 min,  0.011 sec
 * total energy  :   -30.2455749 Eh     change       -0.6698666E-04 Eh
   gradient norm :     0.0031367 Eh/α   predicted    -0.5108394E-04 ( -23.74%)
   displ. norm   :     0.0858654 α      lambda       -0.5000557E-04
   maximum displ.:     0.0679804 α      in ANC's #1, #4, #2, ...

........................................................................
.............................. CYCLE    9 ..............................
........................................................................
   1    -30.5764700 -0.305765E+02  0.107E-01    2.18       0.0  T
   2    -30.5764737 -0.370812E-05  0.505E-02    2.18       1.0  T
   3    -30.5764744 -0.627064E-06  0.976E-03    2.18       2.3  T
   4    -30.5764741  0.218467E-06  0.621E-03    2.18       3.6  T
   5    -30.5764745 -0.380762E-06  0.153E-03    2.18      14.6  T
   6    -30.5764745 -0.190445E-07  0.619E-04    2.18      36.1  T
   7    -30.5764745 -0.258961E-09  0.293E-04    2.18      76.3  T
     SCC iter.                  ...        0 min,  0.006 sec
     gradient                   ...        0 min,  0.011 sec
 * total energy  :   -30.2456119 Eh     change       -0.3707492E-04 Eh
   gradient norm :     0.0023040 Eh/α   predicted    -0.2519089E-04 ( -32.05%)
   displ. norm   :     0.0781330 α      lambda       -0.3401404E-04
   maximum displ.:     0.0663798 α      in ANC's #1, #4, #2, ...

........................................................................
.............................. CYCLE   10 ..............................
........................................................................
   1    -30.5763962 -0.305764E+02  0.105E-01    2.18       0.0  T
   2    -30.5763997 -0.346797E-05  0.479E-02    2.18       1.0  T
   3    -30.5764002 -0.489160E-06  0.958E-03    2.18       2.3  T
   4    -30.5764002  0.212828E-08  0.600E-03    2.18       3.7  T
   5    -30.5764005 -0.316203E-06  0.111E-03    2.18      20.1  T
   6    -30.5764005 -0.819061E-08  0.476E-04    2.18      47.0  T
   7    -30.5764005 -0.902638E-10  0.199E-04    2.18     112.5  T
     SCC iter.                  ...        0 min,  0.007 sec
     gradient                   ...        0 min,  0.011 sec
 * total energy  :   -30.2456373 Eh     change       -0.2532769E-04 Eh
   gradient norm :     0.0017720 Eh/α   predicted    -0.1711213E-04 ( -32.44%)
   displ. norm   :     0.0914014 α      lambda       -0.2006032E-04
   maximum displ.:     0.0808787 α      in ANC's #1, #4, #5, ...

........................................................................
.............................. CYCLE   11 ..............................
........................................................................
   1    -30.5763255 -0.305763E+02  0.134E-01    2.18       0.0  T
   2    -30.5763318 -0.625872E-05  0.598E-02    2.18       1.0  T
   3    -30.5763323 -0.445938E-06  0.125E-02    2.18       1.8  T
   4    -30.5763330 -0.728072E-06  0.740E-03    2.18       3.0  T
   5    -30.5763333 -0.302078E-06  0.167E-03    2.18      13.4  T
   6    -30.5763333 -0.171535E-07  0.539E-04    2.18      41.5  T
   7    -30.5763333 -0.115762E-09  0.278E-04    2.18      80.5  T
     SCC iter.                  ...        0 min,  0.006 sec
     gradient                   ...        0 min,  0.011 sec
 * total energy  :   -30.2456580 Eh     change       -0.2073318E-04 Eh
   gradient norm :     0.0017729 Eh/α   predicted    -0.1006798E-04 ( -51.44%)
   displ. norm   :     0.0617464 α      lambda       -0.1152764E-04
   maximum displ.:     0.0529474 α      in ANC's #1, #4, #2, ...

........................................................................
.............................. CYCLE   12 ..............................
........................................................................
   1    -30.5761861 -0.305762E+02  0.993E-02    2.18       0.0  T
   2    -30.5761897 -0.360522E-05  0.433E-02    2.18       1.0  T
   3    -30.5761900 -0.273355E-06  0.856E-03    2.18       2.6  T
   4    -30.5761905 -0.464767E-06  0.493E-03    2.18       4.5  T
   5    -30.5761906 -0.119079E-06  0.116E-03    2.18      19.2  T
   6    -30.5761906 -0.684224E-08  0.411E-04    2.18      54.4  T
   7    -30.5761906 -0.491518E-10  0.192E-04    2.18     116.5  T
     SCC iter.                  ...        0 min,  0.006 sec
     gradient                   ...        0 min,  0.011 sec
 * total energy  :   -30.2456718 Eh     change       -0.1377964E-04 Eh
   gradient norm :     0.0011605 Eh/α   predicted    -0.5776348E-05 ( -58.08%)
   displ. norm   :     0.0940971 α      lambda       -0.1483022E-04
   maximum displ.:     0.0713865 α      in ANC's #1, #2, #4, ...

........................................................................
.............................. CYCLE   13 ..............................
........................................................................
   1    -30.5765659 -0.305766E+02  0.151E-01    2.18       0.0  T
   2    -30.5765744 -0.849515E-05  0.648E-02    2.18       1.0  T
   3    -30.5765762 -0.175242E-05  0.888E-03    2.18       2.5  T
   4    -30.5765761  0.233703E-07  0.390E-03    2.18       5.7  T
   5    -30.5765762 -0.239791E-07  0.176E-03    2.18      12.7  T
   6    -30.5765762 -0.446780E-07  0.592E-04    2.18      37.8  T
   7    -30.5765762 -0.402999E-09  0.246E-04    2.18      90.8  T
     SCC iter.                  ...        0 min,  0.006 sec
     gradient                   ...        0 min,  0.011 sec
 * total energy  :   -30.2456872 Eh     change       -0.1539324E-04 Eh
   gradient norm :     0.0012964 Eh/α   predicted    -0.7444871E-05 ( -51.64%)
   displ. norm   :     0.0932895 α      lambda       -0.5520060E-06
   maximum displ.:     0.0703194 α      in ANC's #1, #2, #4, ...

........................................................................
.............................. CYCLE   14 ..............................
........................................................................
   1    -30.5768284 -0.305768E+02  0.150E-01    2.18       0.0  T
   2    -30.5768368 -0.844743E-05  0.643E-02    2.18       1.0  T
   3    -30.5768386 -0.170628E-05  0.894E-03    2.18       2.5  T
   4    -30.5768385  0.690100E-07  0.476E-03    2.18       4.7  T
   5    -30.5768386 -0.104911E-06  0.192E-03    2.18      11.6  T
   6    -30.5768386 -0.501912E-07  0.583E-04    2.18      38.3  T
   7    -30.5768386 -0.222435E-09  0.249E-04    2.18      89.7  T
     SCC iter.                  ...        0 min,  0.006 sec
     gradient                   ...        0 min,  0.011 sec
 * total energy  :   -30.2456892 Eh     change       -0.2027822E-05 Eh
   gradient norm :     0.0023827 Eh/α   predicted    -0.2796020E-06 ( -86.21%)
   displ. norm   :     0.0623631 α      lambda        0.1515635E-04
   maximum displ.:     0.0471069 α      in ANC's #1, #2, #4, ...

........................................................................
.............................. CYCLE   15 ..............................
........................................................................
   1    -30.5769312 -0.305769E+02  0.996E-02    2.18       0.0  T
   2    -30.5769349 -0.376811E-05  0.428E-02    2.18       1.0  T
   3    -30.5769357 -0.739582E-06  0.609E-03    2.18       3.7  T
   4    -30.5769356  0.381909E-07  0.364E-03    2.18       6.1  T
   5    -30.5769357 -0.833397E-07  0.125E-03    2.18      17.9  T
   6    -30.5769357 -0.186813E-07  0.390E-04    2.18      57.3  T
   7    -30.5769357 -0.754881E-10  0.169E-04    2.18     132.3  T
     SCC iter.                  ...        0 min,  0.006 sec
     gradient                   ...        0 min,  0.011 sec
 * total energy  :   -30.2456834 Eh     change        0.5791049E-05 Eh
   gradient norm :     0.0032102 Eh/α   predicted     0.7607387E-05 (  31.36%)
   displ. norm   :     0.0492318 α      lambda       -0.2304375E-04
   maximum displ.:     0.0334341 α      in ANC's #2, #1, #3, ...

........................................................................
.............................. CYCLE   16 ..............................
........................................................................
   1    -30.5762006 -0.305762E+02  0.676E-02    2.18       0.0  T
   2    -30.5762023 -0.168067E-05  0.285E-02    2.18       1.0  T
   3    -30.5762025 -0.262052E-06  0.502E-03    2.18       4.5  T
   4    -30.5762025  0.188906E-07  0.310E-03    2.18       7.2  T
   5    -30.5762026 -0.798984E-07  0.105E-03    2.18      21.4  T
   6    -30.5762026 -0.833288E-08  0.292E-04    2.18      76.7  T
   7    -30.5762026 -0.741274E-10  0.133E-04    2.18     168.5  T
     SCC iter.                  ...        0 min,  0.006 sec
     gradient                   ...        0 min,  0.011 sec
 * total energy  :   -30.2456977 Eh     change       -0.1429070E-04 Eh
   gradient norm :     0.0016185 Eh/α   predicted    -0.1155024E-04 ( -19.18%)
   displ. norm   :     0.0283269 α      lambda       -0.7624061E-05
   maximum displ.:     0.0157020 α      in ANC's #1, #2, #3, ...

........................................................................
.............................. CYCLE   17 ..............................
........................................................................
   1    -30.5762442 -0.305762E+02  0.574E-02    2.18       0.0  T
   2    -30.5762457 -0.145676E-05  0.247E-02    2.18       1.0  T
   3    -30.5762459 -0.228998E-06  0.428E-03    2.18       5.2  T
   4    -30.5762459 -0.250505E-07  0.267E-03    2.18       8.4  T
   5    -30.5762460 -0.542903E-07  0.712E-04    2.18      31.4  T
   6    -30.5762460 -0.299040E-08  0.223E-04    2.18     100.4  T
     SCC iter.                  ...        0 min,  0.006 sec
     gradient                   ...        0 min,  0.011 sec
 * total energy  :   -30.2457049 Eh     change       -0.7244504E-05 Eh
   gradient norm :     0.0009525 Eh/α   predicted    -0.3816804E-05 ( -47.31%)
   displ. norm   :     0.1062549 α      lambda       -0.9525008E-05
   maximum displ.:     0.0738011 α      in ANC's #1, #2, #4, ...

........................................................................
.............................. CYCLE   18 ..............................
........................................................................
   1    -30.5756559 -0.305757E+02  0.203E-01    2.19       0.0  T
   2    -30.5756738 -0.179456E-04  0.869E-02    2.19       1.0  T
   3    -30.5756764 -0.252941E-05  0.156E-02    2.19       1.4  T
   4    -30.5756771 -0.704702E-06  0.971E-03    2.19       2.3  T
   5    -30.5756778 -0.691027E-06  0.207E-03    2.19      10.8  T
   6    -30.5756778 -0.140468E-07  0.791E-04    2.19      28.3  T
   7    -30.5756778 -0.570520E-09  0.313E-04    2.19      71.5  T
     SCC iter.                  ...        0 min,  0.006 sec
     gradient                   ...        0 min,  0.011 sec
 * total energy  :   -30.2457149 Eh     change       -0.9951967E-05 Eh
   gradient norm :     0.0013701 Eh/α   predicted    -0.4790292E-05 ( -51.87%)
   displ. norm   :     0.1816827 α      lambda       -0.1382736E-04
   maximum displ.:     0.1183893 α      in ANC's #1, #2, #8, ...

........................................................................
.............................. CYCLE   19 ..............................
........................................................................
   1    -30.5756417 -0.305756E+02  0.352E-01    2.19       0.0  T
   2    -30.5756954 -0.537052E-04  0.150E-01    2.19       1.0  T
   3    -30.5757044 -0.899999E-05  0.239E-02    2.19       1.0  T
   4    -30.5757052 -0.790448E-06  0.155E-02    2.19       1.4  T
   5    -30.5757069 -0.172357E-05  0.367E-03    2.19       6.1  T
   6    -30.5757070 -0.873200E-07  0.119E-03    2.19      18.8  T
   7    -30.5757070 -0.133824E-08  0.511E-04    2.19      43.7  T
   8    -30.5757070 -0.541711E-09  0.228E-04    2.19      97.9  T
     SCC iter.                  ...        0 min,  0.007 sec
     gradient                   ...        0 min,  0.011 sec
 * total energy  :   -30.2457276 Eh     change       -0.1266367E-04 Eh
   gradient norm :     0.0024677 Eh/α   predicted    -0.7018246E-05 ( -44.58%)
   displ. norm   :     0.0812178 α      lambda       -0.1154274E-04
   maximum displ.:     0.0539122 α      in ANC's #2, #1, #3, ...

........................................................................
.............................. CYCLE   20 ..............................
........................................................................
   1    -30.5757444 -0.305757E+02  0.172E-01    2.20       0.0  T
   2    -30.5757578 -0.133659E-04  0.734E-02    2.20       1.0  T
   3    -30.5757605 -0.270349E-05  0.102E-02    2.20       2.2  T
   4    -30.5757605 -0.231712E-07  0.367E-03    2.20       6.1  T
   5    -30.5757605 -0.531915E-08  0.933E-04    2.20      24.0  T
   6    -30.5757605 -0.269199E-08  0.619E-04    2.20      36.1  T
     SCC iter.                  ...        0 min,  0.006 sec
     gradient                   ...        0 min,  0.011 sec
 * total energy  :   -30.2457379 Eh     change       -0.1033718E-04 Eh
   gradient norm :     0.0022649 Eh/α   predicted    -0.5811519E-05 ( -43.78%)
   displ. norm   :     0.3359467 α      lambda       -0.5278311E-04
   maximum displ.:     0.2241876 α      in ANC's #2, #1, #8, ...
 * RMSD in coord.:     0.4152915 α      energy gain  -0.1209891E-01 Eh

generating ANC from model Hessian ...
Using Lindh-Hessian (1995)
 Shifting diagonal of input Hessian by   2.139560180233375E-003
 Lowest  eigenvalues of input Hessian
   -0.000000    0.000000    0.000000    0.000000    0.000000    0.000000
    0.005000    0.006627    0.008675    0.012744    0.013268    0.021078
    0.021475    0.025619    0.030332    0.040627    0.048484    0.050763
 Highest eigenvalues
    1.311717    1.318262    1.418254    1.492818    1.744611    2.076653
 

........................................................................
.............................. CYCLE   21 ..............................
........................................................................
   1    -30.5743454 -0.305743E+02  0.747E-01    2.20       0.0  T
   2    -30.5746102 -0.264742E-03  0.318E-01    2.20       1.0  T
   3    -30.5746625 -0.522968E-04  0.456E-02    2.20       1.0  T
   4    -30.5746605  0.192525E-05  0.231E-02    2.20       1.0  T
   5    -30.5746633 -0.277269E-05  0.931E-03    2.20       2.4  T
   6    -30.5746644 -0.111054E-05  0.259E-03    2.20       8.6  T
   7    -30.5746644 -0.163425E-07  0.940E-04    2.20      23.8  T
   8    -30.5746645 -0.214460E-08  0.463E-04    2.20      48.2  T
     SCC iter.                  ...        0 min,  0.007 sec
     gradient                   ...        0 min,  0.011 sec
 * total energy  :   -30.2457668 Eh     change       -0.2890371E-04 Eh
   gradient norm :     0.0039480 Eh/α   predicted     0.0000000E+00 (-100.00%)
   displ. norm   :     0.0504336 α      lambda       -0.4828236E-04
   maximum displ.:     0.0373744 α      in ANC's #1, #3, #8, ...

........................................................................
.............................. CYCLE   22 ..............................
........................................................................
   1    -30.5755466 -0.305755E+02  0.727E-02    2.20       0.0  T
   2    -30.5755489 -0.233916E-05  0.331E-02    2.20       1.0  T
   3    -30.5755481  0.782501E-06  0.114E-02    2.20       2.0  T
   4    -30.5755496 -0.145429E-05  0.457E-03    2.20       4.9  T
   5    -30.5755496 -0.537903E-07  0.156E-03    2.20      14.4  T
   6    -30.5755496 -0.444437E-08  0.407E-04    2.20      55.0  T
   7    -30.5755496 -0.255550E-09  0.245E-04    2.20      91.2  T
     SCC iter.                  ...        0 min,  0.006 sec
     gradient                   ...        0 min,  0.011 sec
 * total energy  :   -30.2458033 Eh     change       -0.3645878E-04 Eh
   gradient norm :     0.0022134 Eh/α   predicted    -0.2420591E-04 ( -33.61%)
   displ. norm   :     0.0535137 α      lambda       -0.3644091E-04
   maximum displ.:     0.0278832 α      in ANC's #8, #1, #4, ...

........................................................................
.............................. CYCLE   23 ..............................
........................................................................
   1    -30.5762528 -0.305763E+02  0.127E-01    2.21       0.0  T
   2    -30.5762606 -0.782175E-05  0.554E-02    2.20       1.0  T
   3    -30.5762599  0.713574E-06  0.153E-02    2.21       1.5  T
   4    -30.5762625 -0.263822E-05  0.645E-03    2.20       3.5  T
   5    -30.5762627 -0.122884E-06  0.244E-03    2.20       9.2  T
   6    -30.5762627 -0.912390E-08  0.557E-04    2.20      40.1  T
   7    -30.5762627 -0.346002E-09  0.313E-04    2.20      71.3  T
     SCC iter.                  ...        0 min,  0.006 sec
     gradient                   ...        0 min,  0.011 sec
 * total energy  :   -30.2458293 Eh     change       -0.2599055E-04 Eh
   gradient norm :     0.0014598 Eh/α   predicted    -0.1827577E-04 ( -29.68%)
   displ. norm   :     0.1113387 α      lambda       -0.2958667E-04
   maximum displ.:     0.0592228 α      in ANC's #1, #8, #2, ...

........................................................................
.............................. CYCLE   24 ..............................
........................................................................
   1    -30.5766188 -0.305766E+02  0.272E-01    2.20       0.0  T
   2    -30.5766545 -0.357531E-04  0.118E-01    2.20       1.0  T
   3    -30.5766547 -0.171346E-06  0.287E-02    2.20       1.0  T
   4    -30.5766627 -0.797568E-05  0.133E-02    2.20       1.7  T
   5    -30.5766632 -0.566722E-06  0.468E-03    2.20       4.8  T
   6    -30.5766633 -0.439313E-07  0.111E-03    2.20      20.2  T
   7    -30.5766633 -0.104516E-08  0.605E-04    2.20      37.0  T
   8    -30.5766633 -0.694023E-09  0.149E-04    2.20     149.9  T
     SCC iter.                  ...        0 min,  0.007 sec
     gradient                   ...        0 min,  0.012 sec
 * total energy  :   -30.2458515 Eh     change       -0.2228083E-04 Eh
   gradient norm :     0.0022666 Eh/α   predicted    -0.1487574E-04 ( -33.24%)
   displ. norm   :     0.0355811 α      lambda       -0.1359826E-04
   maximum displ.:     0.0196372 α      in ANC's #2, #8, #1, ...

........................................................................
.............................. CYCLE   25 ..............................
........................................................................
   1    -30.5764686 -0.305765E+02  0.860E-02    2.20       0.0  T
   2    -30.5764721 -0.349487E-05  0.374E-02    2.20       1.0  T
   3    -30.5764726 -0.467433E-06  0.712E-03    2.20       3.1  T
   4    -30.5764727 -0.188308E-06  0.442E-03    2.20       5.1  T
   5    -30.5764729 -0.119035E-06  0.907E-04    2.20      24.7  T
   6    -30.5764729 -0.312653E-08  0.274E-04    2.20      81.7  T
     SCC iter.                  ...        0 min,  0.006 sec
     gradient                   ...        0 min,  0.011 sec
 * total energy  :   -30.2458618 Eh     change       -0.1025611E-04 Eh
   gradient norm :     0.0017434 Eh/α   predicted    -0.6810427E-05 ( -33.60%)
   displ. norm   :     0.0873704 α      lambda       -0.1715592E-04
   maximum displ.:     0.0558087 α      in ANC's #2, #3, #8, ...

........................................................................
.............................. CYCLE   26 ..............................
........................................................................
   1    -30.5758906 -0.305759E+02  0.183E-01    2.20       0.0  T
   2    -30.5759059 -0.152953E-04  0.806E-02    2.20       1.0  T
   3    -30.5759083 -0.238018E-05  0.153E-02    2.20       1.5  T
   4    -30.5759085 -0.216539E-06  0.995E-03    2.20       2.2  T
   5    -30.5759093 -0.810913E-06  0.137E-03    2.20      16.3  T
   6    -30.5759093 -0.655786E-08  0.540E-04    2.20      41.4  T
   7    -30.5759093 -0.199794E-09  0.220E-04    2.20     101.6  T
     SCC iter.                  ...        0 min,  0.006 sec
     gradient                   ...        0 min,  0.011 sec
 * total energy  :   -30.2458742 Eh     change       -0.1242271E-04 Eh
   gradient norm :     0.0015443 Eh/α   predicted    -0.8608530E-05 ( -30.70%)
   displ. norm   :     0.0215153 α      lambda       -0.4788682E-05
   maximum displ.:     0.0148247 α      in ANC's #2, #3, #4, ...

........................................................................
.............................. CYCLE   27 ..............................
........................................................................
   1    -30.5761508 -0.305762E+02  0.201E-02    2.20       0.0  T
   2    -30.5761509 -0.106879E-06  0.106E-02    2.20       2.1  T
   3    -30.5761509  0.179482E-07  0.261E-03    2.20       8.6  T
   4    -30.5761509 -0.336595E-07  0.136E-03    2.20      16.4  T
   5    -30.5761509 -0.138097E-07  0.341E-04    2.20      65.6  T
   6    -30.5761509 -0.898677E-09  0.100E-04    2.20     223.1  T
     SCC iter.                  ...        0 min,  0.006 sec
     gradient                   ...        0 min,  0.011 sec
 * total energy  :   -30.2458797 Eh     change       -0.5523509E-05 Eh
   gradient norm :     0.0007209 Eh/α   predicted    -0.2410565E-05 ( -56.36%)
   displ. norm   :     0.0407577 α      lambda       -0.4345006E-05
   maximum displ.:     0.0335688 α      in ANC's #2, #3, #5, ...

........................................................................
.............................. CYCLE   28 ..............................
........................................................................
   1    -30.5763725 -0.305764E+02  0.643E-02    2.20       0.0  T
   2    -30.5763742 -0.175899E-05  0.294E-02    2.20       1.0  T
   3    -30.5763744 -0.170433E-06  0.665E-03    2.20       3.4  T
   4    -30.5763745 -0.126897E-06  0.400E-03    2.20       5.6  T
   5    -30.5763747 -0.108869E-06  0.612E-04    2.20      36.5  T
   6    -30.5763747 -0.230491E-08  0.196E-04    2.20     114.1  T
     SCC iter.                  ...        0 min,  0.006 sec
     gradient                   ...        0 min,  0.011 sec
 * total energy  :   -30.2458841 Eh     change       -0.4395988E-05 Eh
   gradient norm :     0.0003608 Eh/α   predicted    -0.2175897E-05 ( -50.50%)
   displ. norm   :     0.0275335 α      lambda       -0.1504740E-05
   maximum displ.:     0.0243379 α      in ANC's #2, #3, #8, ...

   *** GEOMETRY OPTIMIZATION CONVERGED AFTER 28 ITERATIONS ***

------------------------------------------------------------------------
 total energy gain   :        -0.0122451 Eh       -7.6839 kcal/mol
 total RMSD          :         0.4050842 a0        0.2144 Å
 total power (kW/mol):        -1.1482001 (step)  -44.3473 (real)
------------------------------------------------------------------------

 ANCopt (total)                0 d,  0 h,  0 min,  0.725 sec
 optimizer setup                ...        0 min,  0.000 sec (  0.022%)
 model hessian                  ...        0 min,  0.014 sec (  1.863%)
 ANC generation                 ...        0 min,  0.001 sec (  0.146%)
 coordinate transformation      ...        0 min,  0.000 sec (  0.058%)
 single point calculation       ...        0 min,  0.701 sec ( 96.664%)
 optimization log               ...        0 min,  0.002 sec (  0.324%)
 hessian update                 ...        0 min,  0.000 sec (  0.044%)
 rational function              ...        0 min,  0.005 sec (  0.640%)

================
 final structure:
================
$coord
   -1.39709778300679    2.29616968635748    0.82678337664083      N 
    0.11173822416096    1.40155855683854   -1.29008257269948      C 
    2.91151653916413    1.84956505428118   -0.81522101301063      C 
    4.20411705570816   -0.99864877100852    0.67634841803670      S 
    1.13269224726726   -2.49363234584355    0.94997939457014      C 
   -0.42004641683343   -1.44742997144127   -1.25411995784854      C 
   -3.10502414554991   -1.70427047346134   -0.93010502692852      N 
   -4.37764752279711    0.96655993705418    0.48886060682146      S 
   -4.21142524254086   -4.03215773282909   -0.56477664135707      C 
   -6.46831890335362   -4.40262939411420    0.46016339166033      C 
   -1.57064507716522    4.20471675867519    0.88142064640613      H 
   -0.47334237962202    2.22991811398080   -3.10880600640082      H 
    3.21346937188092    3.44614543111658    0.44774820906612      H 
    3.93999524440196    2.15331840747937   -2.57069542096735      H 
    0.27631305735925   -1.96140240388098    2.74834655531042      H 
    1.38426663564702   -4.53092902800020    0.86776196042237      H 
    0.15861362977293   -2.34210146695433   -3.03091231439654      H 
   -3.10624143661371   -5.56933071658419   -1.33635285984198      H 
   -7.54625908710115   -2.85779930354548    1.22737519743653      H 
   -7.28519739063839   -6.25572293421440    0.55427250087671      H 
$end
           -------------------------------------------------
          |                Final Singlepoint                |
           -------------------------------------------------

          ...................................................
          :                      SETUP                      :
          :.................................................:
          :  # basis functions                  62          :
          :  # atomic orbitals                  60          :
          :  # shells                           32          :
          :  # electrons                        56          :
          :  max. iterations                   250          :
          :  Hamiltonian                  GFN2-xTB          :
          :  restarted?                      false          :
          :  GBSA solvation                  false          :
          :  PC potential                    false          :
          :  electronic temp.          300.0000000     K    :
          :  accuracy                    1.0000000          :
          :  -> integral cutoff          0.2500000E+02      :
          :  -> integral neglect         0.1000000E-07      :
          :  -> SCF convergence          0.1000000E-05 Eh   :
          :  -> wf. convergence          0.1000000E-03 e    :
          :  Broyden damping             0.4000000          :
          ...................................................

 iter      E             dE          RMSdq      gap      omega  full diag
   1    -30.5763747 -0.305764E+02  0.871E-05    2.20       0.0  T
   2    -30.5763747 -0.157421E-10  0.296E-05    2.20     756.0  T
   3    -30.5763747 -0.189004E-11  0.188E-05    2.20    1186.4  T

   *** convergence criteria satisfied after 3 iterations ***

         #    Occupation            Energy/Eh            Energy/eV
      -------------------------------------------------------------
         1        2.0000           -0.7357505             -20.0208
       ...           ...                  ...                  ...
        22        2.0000           -0.4647111             -12.6454
        23        2.0000           -0.4548538             -12.3772
        24        2.0000           -0.4428840             -12.0515
        25        2.0000           -0.4299895             -11.7006
        26        2.0000           -0.3817399             -10.3877
        27        2.0000           -0.3645672              -9.9204
        28        2.0000           -0.3375123              -9.1842 (HOMO)
        29                         -0.2566606              -6.9841 (LUMO)
        30                         -0.2196512              -5.9770
        31                         -0.1917308              -5.2173
        32                         -0.1726413              -4.6978
        33                         -0.1419536              -3.8628
       ...                                ...                  ...
        60                          0.6094410              16.5837
      -------------------------------------------------------------
                  HL-Gap            0.0808518 Eh            2.2001 eV
             Fermi-level           -0.2970865 Eh           -8.0841 eV

 SCC (total)                   0 d,  0 h,  0 min,  0.022 sec
 SCC setup                      ...        0 min,  0.000 sec (  0.734%)
 Dispersion                     ...        0 min,  0.000 sec (  0.593%)
 integral evaluation            ...        0 min,  0.007 sec ( 30.633%)
 zeroth order Hamiltonian       ...        0 min,  0.000 sec (  0.593%)
 iterations                     ...        0 min,  0.003 sec ( 15.303%)
 molecular gradient             ...        0 min,  0.011 sec ( 50.520%)
 printout                       ...        0 min,  0.000 sec (  1.391%)

         :::::::::::::::::::::::::::::::::::::::::::::::::::::
         ::                     SUMMARY                     ::
         :::::::::::::::::::::::::::::::::::::::::::::::::::::
         :: total energy             -30.245884140468 Eh    ::
         :: gradient norm              0.000360439107 Eh/a0 ::
         :: HOMO-LUMO gap              2.200089156713 eV    ::
         ::.................................................::
         :: SCC energy               -30.576374655607 Eh    ::
         :: -> isotropic ES            0.014820026483 Eh    ::
         :: -> anisotropic ES          0.001640386369 Eh    ::
         :: -> anisotropic XC          0.027443436615 Eh    ::
         :: -> dispersion             -0.020964127322 Eh    ::
         :: repulsion energy           0.330415482050 Eh    ::
         :: add. restraining           0.000000000000 Eh    ::
         :::::::::::::::::::::::::::::::::::::::::::::::::::::

           -------------------------------------------------
          |                Property Printout                |
           -------------------------------------------------

    * Orbital Energies and Occupations

         #    Occupation            Energy/Eh            Energy/eV
      -------------------------------------------------------------
         1        2.0000           -0.7357505             -20.0208
       ...           ...                  ...                  ...
        16        2.0000           -0.5072765             -13.8037
        17        2.0000           -0.5055992             -13.7581
        18        2.0000           -0.4940572             -13.4440
        19        2.0000           -0.4813443             -13.0980
        20        2.0000           -0.4781971             -13.0124
        21        2.0000           -0.4705200             -12.8035
        22        2.0000           -0.4647111             -12.6454
        23        2.0000           -0.4548538             -12.3772
        24        2.0000           -0.4428840             -12.0515
        25        2.0000           -0.4299895             -11.7006
        26        2.0000           -0.3817399             -10.3877
        27        2.0000           -0.3645672              -9.9204
        28        2.0000           -0.3375123              -9.1842 (HOMO)
        29                         -0.2566606              -6.9841 (LUMO)
        30                         -0.2196512              -5.9770
        31                         -0.1917308              -5.2173
        32                         -0.1726413              -4.6978
        33                         -0.1419536              -3.8628
        34                         -0.0370868              -1.0092
        35                         -0.0220668              -0.6005
        36                         -0.0009024              -0.0246
        37                          0.0033652               0.0916
        38                          0.0056178               0.1529
        39                          0.0150427               0.4093
       ...                                ...                  ...
        60                          0.6094410              16.5837
      -------------------------------------------------------------
                  HL-Gap            0.0808518 Eh            2.2001 eV
             Fermi-level           -0.2970865 Eh           -8.0841 eV

     #   Z        covCN         q      C6AA      α(0)
     1   7 N      2.699    -0.237    26.197     7.602
     2   6 C      4.025     0.070    19.343     6.248
     3   6 C      3.800    -0.019    20.914     6.511
     4  16 S      2.076    -0.194   149.301    20.565
     5   6 C      3.805    -0.012    20.790     6.491
     6   6 C      4.014     0.062    19.460     6.267
     7   7 N      2.746    -0.115    23.512     7.202
     8  16 S      2.174    -0.001   141.090    19.992
     9   6 C      2.883     0.023    27.486     8.595
    10   6 C      2.840    -0.128    31.267     9.164
    11   1 H      0.862     0.159     1.338     1.812
    12   1 H      0.923     0.017     2.777     2.606
    13   1 H      0.925     0.059     2.212     2.326
    14   1 H      0.925     0.052     2.290     2.366
    15   1 H      0.925     0.061     2.186     2.312
    16   1 H      0.925     0.051     2.306     2.375
    17   1 H      0.924     0.039     2.458     2.452
    18   1 H      0.925     0.032     2.558     2.501
    19   1 H      0.926     0.042     2.423     2.434
    20   1 H      0.926     0.038     2.473     2.459

 Mol. C6AA /au·bohr⁶  :       6048.497219
 Mol. C8AA /au·bohr⁸  :     177862.508043
 Mol. α(0) /au        :        122.279241


Wiberg/Mayer (AO) data.
largest (>0.10) Wiberg bond orders for each atom
          total WBO             WBO to atom ...
     1  N   3.119        S    8 1.107    C    2 0.999    H   11 0.945
     2  C   3.982        N    1 0.999    C    3 0.997    C    6 0.975    H   12 0.957
     3  C   3.983        C    2 0.997    S    4 0.981    H   14 0.977    H   13 0.975
     4  S   2.067        C    5 0.993    C    3 0.981
     5  C   3.980        S    4 0.993    C    6 0.983    H   16 0.975    H   15 0.975
     6  C   3.981        N    7 0.995    C    5 0.983    C    2 0.975    H   17 0.956
     7  N   3.374        C    9 1.124    S    8 1.031    C    6 0.995    C   10 0.129
     8  S   2.315        N    1 1.107    N    7 1.031
     9  C   3.963        C   10 1.841    N    7 1.124    H   18 0.953
    10  C   3.973        C    9 1.841    H   20 0.976    H   19 0.965    N    7 0.129
    11  H   0.974        N    1 0.945
    12  H   1.000        C    2 0.957
    13  H   0.996        C    3 0.975
    14  H   0.997        C    3 0.977
    15  H   0.996        C    5 0.975
    16  H   0.997        C    5 0.975
    17  H   0.998        C    6 0.956
    18  H   0.999        C    9 0.953
    19  H   0.998        C   10 0.965
    20  H   0.998        C   10 0.976

molecular dipole:
                 x           y           z       tot (Debye)
 q only:        0.060       0.364      -0.355
   full:       -0.046       0.500      -0.689       2.166
molecular quadrupole (traceless):
                xx          xy          yy          xz          yz          zz
 q only:       -6.439       0.810       5.432      -1.619      -0.246       1.008
  q+dip:      -14.176       2.158      10.352      -2.972      -0.151       3.823
   full:      -13.098       2.628      10.912      -2.603      -0.391       2.186

           -------------------------------------------------
          |                Geometry Summary                 |
           -------------------------------------------------

      molecular mass/u    :      174.2784000
   center of mass at/Å    :       -0.4953014      -0.3458728       0.0071871
  moments of inertia/u·Å² :        0.2557908E+03   0.6720768E+03   0.8458645E+03
rotational constants/cm⁻¹ :        0.6590398E-01   0.2508290E-01   0.1992947E-01

 * 17 selected distances

     #   Z        #   Z                                     value/Å
     1   7 N      2   6 C                                 1.4548080
     2   6 C      3   6 C                                 1.5213236
     2   6 C      6   6 C                                 1.5337766 (max)
     5   6 C      6   6 C                                 1.5303739
     6   6 C      7   7 N                                 1.4375768
     7   7 N      9   6 C                                 1.3775539
     9   6 C     10   6 C                                 1.3262538
     1   7 N     11   1 H                                 1.0145386 (min)
     2   6 C     12   1 H                                 1.1019415
     3   6 C     13   1 H                                 1.0890432
     3   6 C     14   1 H                                 1.0885788
     5   6 C     15   1 H                                 1.0910268
     5   6 C     16   1 H                                 1.0871505
     6   6 C     17   1 H                                 1.0963393
     9   6 C     18   1 H                                 1.0818617
    10   6 C     19   1 H                                 1.0763352
    10   6 C     20   1 H                                 1.0728216

 * 4 distinct bonds (by element types)

   Z      Z             #   av. dist./Å        max./Å        min./Å
   1 H    6 C           9     1.0872332     1.1019415     1.0728216
   6 C    6 C           4     1.4779320     1.5337766     1.3262538
   1 H    7 N           1     1.0145386     1.0145386     1.0145386
   6 C    7 N           3     1.4233129     1.4548080     1.3775539


optimized geometry written to: xtbopt.xyz


           -------------------------------------------------
          | TOTAL ENERGY              -30.245884140468 Eh   |
          | GRADIENT NORM               0.000360439107 Eh/α |
          | HOMO-LUMO GAP               2.200089156713 eV   |
           -------------------------------------------------

------------------------------------------------------------------------
 * finished run on 2021/05/19 at 10:59:42.005     
------------------------------------------------------------------------
 total:
 * wall-time:     0 d,  0 h,  0 min,  0.799 sec
 *  cpu-time:     0 d,  0 h,  0 min,  0.796 sec
 * ratio c/w:     0.997 speedup
 SCF:
 * wall-time:     0 d,  0 h,  0 min,  0.032 sec
 *  cpu-time:     0 d,  0 h,  0 min,  0.032 sec
 * ratio c/w:     0.998 speedup
 ANC optimizer:
 * wall-time:     0 d,  0 h,  0 min,  0.748 sec
 *  cpu-time:     0 d,  0 h,  0 min,  0.746 sec
 * ratio c/w:     0.998 speedup

