      -----------------------------------------------------------      
     |                   =====================                   |     
     |                           x T B                           |     
     |                   =====================                   |     
     |                         S. Grimme                         |     
     |          Mulliken Center for Theoretical Chemistry        |     
     |                    University of Bonn                     |     
     |                Version 6.2 RC2 (SAW190805)                |     
      -----------------------------------------------------------      

   This program is distributed in the hope that it will be useful,
   but WITHOUT ANY WARRANTY; without even the implied warranty of
   MERCHANTABILITY or FITNESS FOR A PARTICULAR PURPOSE.
   
   FOR NON-COMMERCIAL, ACADEMIA USE ONLY.
   
   Cite this work as:
   * S. Grimme, C. Bannwarth, P. Shushkov, J. Chem. Theory Comput., 2017,
     13, 1989-2009. DOI: 10.1021/acs.jctc.7b00118
   * C. Bannwarth, S. Ehlert and S. Grimme., J. Chem. Theory Comput., 2019,
     15, 1652-1671. DOI: 10.1021/acs.jctc.8b01176
   * P. Pracht, E. Caldeweyher, S. Ehlert, S. Grimme, ChemRxiv, 2019, preprint.
     DOI: 10.26434/chemrxiv.8326202.v1
   
   for DFT-D4:
   * E. Caldeweyher, C. Bannwarth and S. Grimme, J. Chem. Phys., 2017,
     147, 034112. DOI: 10.1063/1.4993215
   * E. Caldeweyher, S. Ehlert, A. Hansen, H. Neugebauer, S. Spicher,
     C. Bannwarth and S. Grimme, J. Chem. Phys., 2019, 150, 154122.
     DOI: 10.1063/1.5090222
   
   for sTDA-xTB:
   * S. Grimme and C. Bannwarth, J. Chem. Phys., 2016, 145, 054103.
     DOI: 10.1063/1.4959605
   
   in the mass-spec context:
   * V. Asgeirsson, C. Bauer and S. Grimme, Chem. Sci., 2017, 8, 4879.
     DOI: 10.1039/c7sc00601b
   
   for metadynamics refer to:
   * S. Grimme, J. Chem. Theory Comput., 2019, 155, 2847-2862
     DOI: 10.1021/acs.jctc.9b00143
   
   with help from (in alphabetical order)
   C. Bannwarth, F. Bohle, G. Brandenburg, E. Caldeweyher, M. Checinski,
   S. Dohm, S. Ehlert, S. Ehrlich, F. März, H. Neugebauer, J. Pisarek,
   P. Pracht, P. Shushkov, and S. Spicher.
   
 * started run on 2021/05/19 at 10:59:42.027     

           -------------------------------------------------
          |                Calculation Setup                |
           -------------------------------------------------

          program call               : /ihome/ghutchison/geoffh/xtb/xtb 635.xyz -opt
          hostname                   : smp-n144
          coordinate file            : 635.xyz
          omp threads                :                     1
          number of atoms            :                    22
          number of electrons        :                    66
          charge                     :                     0
          spin                       :                   0.0
          first test random number   :      0.98780223678946


########################################################################
# WARNING! Please study the warnings concerning your input carefully
#  - the use of '-opt' is discouraged, please use '--opt' next time
########################################################################

           ------------------------------------------------- 
          |                 G F N 2 - x T B                 |
          | Geometry, Frequencies, Noncovalent interactions |
          |            JCTC 2019 parametrisation            |
           ------------------------------------------------- 
             KAB for C  - Si     :                1.0500
             KAB for H  - Pd     :                0.9500
             k(s)              :                1.8500
             k(p)              :                2.2300
             k(d)              :                2.2300
             k(f)              :                2.0000
             kEN (H0ij)        :               -2.0000
             D4 a1             :                0.5200
             D4 a2             :                5.0000
             D4 s6             :                1.0000
             D4 s8             :                2.7000
             D4 s9             :                5.0000
             alphaj            :                2.0000

  Z AO/shell   Hii/eV     exponent
  1     Wed Apr 25 08:07:45 CEST 2018   EN: 2.200 GM2: 0.406  GM3: 0.0800  RAES: 1.40
     1s    -10.707211    1.230000
  6     Wed Apr 25 08:07:45 CEST 2018   EN: 2.550 GM2: 0.538  GM3: 0.1500  RAES: 3.00
     2s    -13.970922    2.096432
     2p    -10.063292    1.800000
  8     Wed Apr 25 08:07:45 CEST 2018   EN: 3.440 GM2: 0.452  GM3:-0.0517  RAES: 1.80
     2s    -20.229985    2.439742
     2p    -15.503117    2.137023

           ------------------------------------------------- 
          |        Self-Consistent Charge Iterations        |
           ------------------------------------------------- 

          ...................................................
          :                      SETUP                      :
          :.................................................:
          :  # basis functions                  64          :
          :  # atomic orbitals                  64          :
          :  # shells                           36          :
          :  # electrons                        66          :
          :  max. iterations                   250          :
          :  Hamiltonian                  GFN2-xTB          :
          :  restarted?                      false          :
          :  GBSA solvation                  false          :
          :  PC potential                    false          :
          :  electronic temp.          300.0000000     K    :
          :  accuracy                    1.0000000          :
          :  -> integral cutoff          0.2500000E+02      :
          :  -> integral neglect         0.1000000E-07      :
          :  -> SCF convergence          0.1000000E-05 Eh   :
          :  -> wf. convergence          0.1000000E-03 e    :
          :  Broyden damping             0.4000000          :
          ...................................................

 iter      E             dE          RMSdq      gap      omega  full diag
   1    -36.5478172 -0.365478E+02  0.541E+00    2.45       0.0  T
   2    -36.5759219 -0.281047E-01  0.306E+00    2.06       1.0  T
   3    -36.5627683  0.131537E-01  0.140E+00    2.36       1.0  T
   4    -36.5800713 -0.173030E-01  0.311E-01    2.21       1.0  T
   5    -36.5820912 -0.201994E-02  0.115E-01    2.22       1.0  T
   6    -36.5823444 -0.253140E-03  0.349E-02    2.22       1.0  T
   7    -36.5823491 -0.477727E-05  0.192E-02    2.22       1.1  T
   8    -36.5823509 -0.177761E-05  0.851E-03    2.22       2.5  T
   9    -36.5823518 -0.925611E-06  0.171E-03    2.22      12.5  T
  10    -36.5823519 -0.254294E-07  0.105E-03    2.22      20.2  T
  11    -36.5823519 -0.394792E-08  0.165E-04    2.22     129.1  T
  12    -36.5823519 -0.284217E-09  0.692E-05    2.22     308.0  T

   *** convergence criteria satisfied after 12 iterations ***

         #    Occupation            Energy/Eh            Energy/eV
      -------------------------------------------------------------
         1        2.0000           -0.7047171             -19.1763
       ...           ...                  ...                  ...
        27        2.0000           -0.4392532             -11.9527
        28        2.0000           -0.4371313             -11.8949
        29        2.0000           -0.4334122             -11.7937
        30        2.0000           -0.4218237             -11.4784
        31        2.0000           -0.4185470             -11.3892
        32        2.0000           -0.3945062             -10.7351
        33        2.0000           -0.3884335             -10.5698 (HOMO)
        34                         -0.3069257              -8.3519 (LUMO)
        35                         -0.2590690              -7.0496
        36                         -0.2374649              -6.4617
        37                         -0.2069283              -5.6308
        38                         -0.1864529              -5.0736
       ...                                ...                  ...
        64                          0.7385808              20.0978
      -------------------------------------------------------------
                  HL-Gap            0.0815078 Eh            2.2179 eV
             Fermi-level           -0.3476796 Eh           -9.4608 eV

 SCC (total)                   0 d,  0 h,  0 min,  0.034 sec
 SCC setup                      ...        0 min,  0.000 sec (  0.791%)
 Dispersion                     ...        0 min,  0.000 sec (  0.879%)
 integral evaluation            ...        0 min,  0.008 sec ( 23.329%)
 zeroth order Hamiltonian       ...        0 min,  0.000 sec (  0.478%)
 iterations                     ...        0 min,  0.013 sec ( 37.426%)
 molecular gradient             ...        0 min,  0.012 sec ( 35.886%)
 printout                       ...        0 min,  0.000 sec (  1.034%)

         :::::::::::::::::::::::::::::::::::::::::::::::::::::
         ::                     SUMMARY                     ::
         :::::::::::::::::::::::::::::::::::::::::::::::::::::
         :: total energy             -35.959100668760 Eh    ::
         :: gradient norm              0.043893216596 Eh/a0 ::
         :: HOMO-LUMO gap              2.217939429224 eV    ::
         ::.................................................::
         :: SCC energy               -36.582351862290 Eh    ::
         :: -> isotropic ES            0.025439322595 Eh    ::
         :: -> anisotropic ES          0.000998352535 Eh    ::
         :: -> anisotropic XC          0.019306548263 Eh    ::
         :: -> dispersion             -0.023645345864 Eh    ::
         :: repulsion energy           0.623243600624 Eh    ::
         :: add. restraining           0.000000000000 Eh    ::
         :::::::::::::::::::::::::::::::::::::::::::::::::::::

      ----------------------------------------------------------- 
     |                   =====================                   |
     |                        A N C O P T                        |
     |                   =====================                   |
     |               Approximate Normal Coordinate               |
     |                Rational Function Optimizer                |
      ----------------------------------------------------------- 

          ...................................................
          :                      SETUP                      :
          :.................................................:
          :   optimization level            normal          :
          :   max. optcycles                   200          :
          :   ANC micro-cycles                  20          :
          :   degrees of freedom                60          :
          :.................................................:
          :   RF solver                   davidson          :
          :   input Hessian                  false          :
          :   write xtbopt.log                true          :
          :   linear?                        false          :
          :   energy convergence         0.5000000E-05 Eh   :
          :   grad. convergence          0.1000000E-02 Eh/α :
          :   maximium RF displ.         2.0000000          :
          :   Hlow (freq-cutoff)         0.5000000E-02      :
          :   Hmax (freq-cutoff)         5.0000000          :
          :   S6 in model hess.         20.0000000          :
          ...................................................

generating ANC from model Hessian ...
Using Lindh-Hessian (1995)
 Shifting diagonal of input Hessian by   2.263180633371156E-003
 Lowest  eigenvalues of input Hessian
   -0.000000   -0.000000   -0.000000   -0.000000    0.000000    0.000000
    0.005000    0.005539    0.012630    0.012947    0.014978    0.019786
    0.022169    0.022414    0.028238    0.046034    0.049093    0.056001
 Highest eigenvalues
    1.862626    1.919092    1.999184    2.018824    2.075512    2.278220
 

........................................................................
.............................. CYCLE    1 ..............................
........................................................................
   1    -36.5823519 -0.365824E+02  0.318E-05    2.22       0.0  T
   2    -36.5823519 -0.241585E-11  0.184E-05    2.22    1160.1  T
   3    -36.5823519 -0.100187E-11  0.126E-05    2.22    1689.5  T
     SCC iter.                  ...        0 min,  0.004 sec
     gradient                   ...        0 min,  0.012 sec
 * total energy  :   -35.9591007 Eh     change       -0.1768207E-08 Eh
   gradient norm :     0.0438931 Eh/α   predicted     0.0000000E+00 (-100.00%)
   displ. norm   :     0.1468114 α      lambda       -0.3861166E-02
   maximum displ.:     0.0783566 α      in ANC's #29, #24, #1, ...

........................................................................
.............................. CYCLE    2 ..............................
........................................................................
   1    -36.6030847 -0.366031E+02  0.105E-01    2.24       0.0  T
   2    -36.6031060 -0.212985E-04  0.684E-02    2.25       1.0  T
   3    -36.6030989  0.707261E-05  0.349E-02    2.25       1.0  T
   4    -36.6031160 -0.170677E-04  0.106E-02    2.25       2.0  T
   5    -36.6031184 -0.242666E-05  0.255E-03    2.25       8.4  T
   6    -36.6031185 -0.627541E-07  0.118E-03    2.25      18.0  T
     SCC iter.                  ...        0 min,  0.006 sec
     gradient                   ...        0 min,  0.012 sec
 * total energy  :   -35.9614902 Eh     change       -0.2389557E-02 Eh
   gradient norm :     0.0154479 Eh/α   predicted    -0.1972194E-02 ( -17.47%)
   displ. norm   :     0.0628934 α      lambda       -0.3800606E-03
   maximum displ.:     0.0369051 α      in ANC's #1, #5, #24, ...

........................................................................
.............................. CYCLE    3 ..............................
........................................................................
   1    -36.6077855 -0.366078E+02  0.486E-02    2.27       0.0  T
   2    -36.6077926 -0.713781E-05  0.308E-02    2.27       1.0  T
   3    -36.6077918  0.792042E-06  0.161E-02    2.27       1.3  T
   4    -36.6077944 -0.260237E-05  0.538E-03    2.27       4.0  T
   5    -36.6077950 -0.602271E-06  0.131E-03    2.27      16.2  T
   6    -36.6077951 -0.259366E-07  0.564E-04    2.27      37.8  T
     SCC iter.                  ...        0 min,  0.006 sec
     gradient                   ...        0 min,  0.012 sec
 * total energy  :   -35.9617036 Eh     change       -0.2133815E-03 Eh
   gradient norm :     0.0038551 Eh/α   predicted    -0.1907946E-03 ( -10.59%)
   displ. norm   :     0.0438767 α      lambda       -0.3750329E-04
   maximum displ.:     0.0376896 α      in ANC's #1, #5, #2, ...

........................................................................
.............................. CYCLE    4 ..............................
........................................................................
   1    -36.6073420 -0.366073E+02  0.256E-02    2.28       0.0  T
   2    -36.6073425 -0.486714E-06  0.152E-02    2.28       1.4  T
   3    -36.6073419  0.586209E-06  0.588E-03    2.28       3.6  T
   4    -36.6073426 -0.704957E-06  0.109E-03    2.28      19.6  T
   5    -36.6073426 -0.252943E-07  0.359E-04    2.28      59.4  T
   6    -36.6073426 -0.195027E-08  0.182E-04    2.28     117.2  T
     SCC iter.                  ...        0 min,  0.006 sec
     gradient                   ...        0 min,  0.012 sec
 * total energy  :   -35.9617302 Eh     change       -0.2661496E-04 Eh
   gradient norm :     0.0012907 Eh/α   predicted    -0.1879398E-04 ( -29.39%)
   displ. norm   :     0.0638838 α      lambda       -0.1704414E-04
   maximum displ.:     0.0563551 α      in ANC's #1, #5, #2, ...

........................................................................
.............................. CYCLE    5 ..............................
........................................................................
   1    -36.6064326 -0.366064E+02  0.369E-02    2.28       0.0  T
   2    -36.6064328 -0.215576E-06  0.217E-02    2.28       1.0  T
   3    -36.6064322  0.696353E-06  0.562E-03    2.28       3.8  T
   4    -36.6064330 -0.809860E-06  0.562E-04    2.28      37.9  T
   5    -36.6064330 -0.431375E-08  0.254E-04    2.28      83.8  T
     SCC iter.                  ...        0 min,  0.005 sec
     gradient                   ...        0 min,  0.012 sec
 * total energy  :   -35.9617434 Eh     change       -0.1320461E-04 Eh
   gradient norm :     0.0017214 Eh/α   predicted    -0.8538904E-05 ( -35.33%)
   displ. norm   :     0.0645246 α      lambda        0.1988996E-04
   maximum displ.:     0.0570860 α      in ANC's #1, #5, #2, ...

........................................................................
.............................. CYCLE    6 ..............................
........................................................................
   1    -36.6054182 -0.366054E+02  0.373E-02    2.28       0.0  T
   2    -36.6054184 -0.215471E-06  0.219E-02    2.28       1.0  T
   3    -36.6054177  0.693361E-06  0.561E-03    2.28       3.8  T
   4    -36.6054185 -0.806683E-06  0.559E-04    2.28      38.2  T
   5    -36.6054185 -0.422998E-08  0.253E-04    2.28      84.2  T
     SCC iter.                  ...        0 min,  0.005 sec
     gradient                   ...        0 min,  0.012 sec
 * total energy  :   -35.9617315 Eh     change        0.1188269E-04 Eh
   gradient norm :     0.0041210 Eh/α   predicted     0.9962145E-05 ( -16.16%)
   displ. norm   :     0.0224051 α      lambda       -0.2044188E-04
   maximum displ.:     0.0150051 α      in ANC's #1, #5, #2, ...

........................................................................
.............................. CYCLE    7 ..............................
........................................................................
   1    -36.6061603 -0.366062E+02  0.139E-02    2.28       0.0  T
   2    -36.6061604 -0.123263E-06  0.825E-03    2.28       2.6  T
   3    -36.6061602  0.191016E-06  0.337E-03    2.28       6.3  T
   4    -36.6061605 -0.233500E-06  0.479E-04    2.28      44.5  T
   5    -36.6061605 -0.361383E-08  0.197E-04    2.28     108.1  T
     SCC iter.                  ...        0 min,  0.005 sec
     gradient                   ...        0 min,  0.012 sec
 * total energy  :   -35.9617462 Eh     change       -0.1468430E-04 Eh
   gradient norm :     0.0021648 Eh/α   predicted    -0.1023085E-04 ( -30.33%)
   displ. norm   :     0.0157500 α      lambda       -0.1041968E-04
   maximum displ.:     0.0119066 α      in ANC's #5, #18, #19, ...

........................................................................
.............................. CYCLE    8 ..............................
........................................................................
   1    -36.6068815 -0.366069E+02  0.948E-03    2.28       0.0  T
   2    -36.6068816 -0.114027E-06  0.574E-03    2.28       3.7  T
   3    -36.6068815  0.975961E-07  0.298E-03    2.28       7.1  T
   4    -36.6068817 -0.142936E-06  0.523E-04    2.28      40.7  T
   5    -36.6068817 -0.324967E-08  0.254E-04    2.28      84.1  T
     SCC iter.                  ...        0 min,  0.005 sec
     gradient                   ...        0 min,  0.013 sec
 * total energy  :   -35.9617520 Eh     change       -0.5796702E-05 Eh
   gradient norm :     0.0003686 Eh/α   predicted    -0.5211744E-05 ( -10.09%)
   displ. norm   :     0.0197793 α      lambda       -0.1917706E-05
   maximum displ.:     0.0181369 α      in ANC's #1, #3, #2, ...

........................................................................
.............................. CYCLE    9 ..............................
........................................................................
   1    -36.6069895 -0.366070E+02  0.117E-02    2.28       0.0  T
   2    -36.6069895 -0.148702E-07  0.689E-03    2.28       3.1  T
   3    -36.6069894  0.253713E-07  0.118E-03    2.28      18.0  T
   4    -36.6069895 -0.336022E-07  0.263E-04    2.28      81.2  T
   5    -36.6069895 -0.239488E-09  0.166E-04    2.28     128.3  T
     SCC iter.                  ...        0 min,  0.005 sec
     gradient                   ...        0 min,  0.013 sec
 * total energy  :   -35.9617540 Eh     change       -0.2012895E-05 Eh
   gradient norm :     0.0003779 Eh/α   predicted    -0.9598530E-06 ( -52.31%)
   displ. norm   :     0.0164894 α      lambda       -0.1262780E-05
   maximum displ.:     0.0156547 α      in ANC's #1, #2, #3, ...

   *** GEOMETRY OPTIMIZATION CONVERGED AFTER 9 ITERATIONS ***

------------------------------------------------------------------------
 total energy gain   :        -0.0026534 Eh       -1.6650 kcal/mol
 total RMSD          :         0.0670714 a0        0.0355 Å
 total power (kW/mol):        -0.7740471 (step)  -29.0426 (real)
------------------------------------------------------------------------

 ANCopt (total)                0 d,  0 h,  0 min,  0.240 sec
 optimizer setup                ...        0 min,  0.000 sec (  0.073%)
 model hessian                  ...        0 min,  0.003 sec (  1.185%)
 ANC generation                 ...        0 min,  0.001 sec (  0.273%)
 coordinate transformation      ...        0 min,  0.000 sec (  0.064%)
 single point calculation       ...        0 min,  0.233 sec ( 97.291%)
 optimization log               ...        0 min,  0.001 sec (  0.356%)
 hessian update                 ...        0 min,  0.000 sec (  0.051%)
 rational function              ...        0 min,  0.001 sec (  0.439%)

================
 final structure:
================
$coord
    6.48935481734493    0.24057814363515   -0.05825455060332      C 
    5.67125023061259    2.72501327406272   -0.00660700889902      C 
    3.10795292740275    3.31687761229387    0.02257245367742      C 
    1.38321824910984    1.36264884575642   -0.00307637118907      C 
    2.21936205805156   -1.16076478529488   -0.05227942261654      C 
    4.76030972724473   -1.73988541924082   -0.07962507900900      C 
   -0.00330675505941   -2.88099831587181   -0.07362236540246      C 
   -0.00511328836236   -5.16544552521159   -0.10428858840665      O 
   -2.22323137529245   -1.15737982670801   -0.04325412507491      C 
   -1.38304956846889    1.36475875703764    0.00237494679805      C 
   -3.10467528471439    3.32162377509068    0.03439559519496      C 
   -5.66897280557024    2.73368023775271    0.01541056371235      C 
   -6.49106128322366    0.25049398712494   -0.03239953354578      C 
   -4.76514888113035   -1.73261008580709   -0.06032608944247      C 
    8.48941375057270   -0.16313943772022   -0.08323511155837      H 
    7.04518082328457    4.23488958668536    0.01059725139836      H 
    2.49777051493259    5.26346885685993    0.06283047867706      H 
    5.37536893263202   -3.68432549142515   -0.12036890878145      H 
   -2.49136663043366    5.26729254730289    0.07177944198648      H 
   -7.04050906984339    4.24566788344589    0.03775628754651      H 
   -8.49182932187356   -0.15018212012825   -0.04915156336105      H 
   -5.38333326670279   -3.67612221424717   -0.09824607053437      H 
$end
           -------------------------------------------------
          |                Final Singlepoint                |
           -------------------------------------------------

          ...................................................
          :                      SETUP                      :
          :.................................................:
          :  # basis functions                  64          :
          :  # atomic orbitals                  64          :
          :  # shells                           36          :
          :  # electrons                        66          :
          :  max. iterations                   250          :
          :  Hamiltonian                  GFN2-xTB          :
          :  restarted?                      false          :
          :  GBSA solvation                  false          :
          :  PC potential                    false          :
          :  electronic temp.          300.0000000     K    :
          :  accuracy                    1.0000000          :
          :  -> integral cutoff          0.2500000E+02      :
          :  -> integral neglect         0.1000000E-07      :
          :  -> SCF convergence          0.1000000E-05 Eh   :
          :  -> wf. convergence          0.1000000E-03 e    :
          :  Broyden damping             0.4000000          :
          ...................................................

 iter      E             dE          RMSdq      gap      omega  full diag
   1    -36.6069895 -0.366070E+02  0.613E-05    2.28       0.0  T
   2    -36.6069895 -0.170814E-10  0.308E-05    2.28     691.9  T
   3    -36.6069895 -0.189999E-10  0.227E-05    2.28     941.3  T

   *** convergence criteria satisfied after 3 iterations ***

         #    Occupation            Energy/Eh            Energy/eV
      -------------------------------------------------------------
         1        2.0000           -0.7065827             -19.2271
       ...           ...                  ...                  ...
        27        2.0000           -0.4400686             -11.9749
        28        2.0000           -0.4361904             -11.8693
        29        2.0000           -0.4314078             -11.7392
        30        2.0000           -0.4229857             -11.5100
        31        2.0000           -0.4190537             -11.4030
        32        2.0000           -0.3957891             -10.7700
        33        2.0000           -0.3895185             -10.5993 (HOMO)
        34                         -0.3058385              -8.3223 (LUMO)
        35                         -0.2577101              -7.0126
        36                         -0.2353212              -6.4034
        37                         -0.2046484              -5.5688
        38                         -0.1835574              -4.9949
       ...                                ...                  ...
        64                          0.7443530              20.2549
      -------------------------------------------------------------
                  HL-Gap            0.0836799 Eh            2.2770 eV
             Fermi-level           -0.3476785 Eh           -9.4608 eV

 SCC (total)                   0 d,  0 h,  0 min,  0.025 sec
 SCC setup                      ...        0 min,  0.000 sec (  0.762%)
 Dispersion                     ...        0 min,  0.000 sec (  0.910%)
 integral evaluation            ...        0 min,  0.008 sec ( 30.992%)
 zeroth order Hamiltonian       ...        0 min,  0.000 sec (  0.560%)
 iterations                     ...        0 min,  0.004 sec ( 14.659%)
 molecular gradient             ...        0 min,  0.012 sec ( 50.558%)
 printout                       ...        0 min,  0.000 sec (  1.302%)

         :::::::::::::::::::::::::::::::::::::::::::::::::::::
         ::                     SUMMARY                     ::
         :::::::::::::::::::::::::::::::::::::::::::::::::::::
         :: total energy             -35.961754032504 Eh    ::
         :: gradient norm              0.000378547338 Eh/a0 ::
         :: HOMO-LUMO gap              2.277046810472 eV    ::
         ::.................................................::
         :: SCC energy               -36.606989478672 Eh    ::
         :: -> isotropic ES            0.024805638124 Eh    ::
         :: -> anisotropic ES          0.001129749174 Eh    ::
         :: -> anisotropic XC          0.018491746340 Eh    ::
         :: -> dispersion             -0.023661324649 Eh    ::
         :: repulsion energy           0.645226868105 Eh    ::
         :: add. restraining           0.000000000000 Eh    ::
         :::::::::::::::::::::::::::::::::::::::::::::::::::::

           -------------------------------------------------
          |                Property Printout                |
           -------------------------------------------------

    * Orbital Energies and Occupations

         #    Occupation            Energy/Eh            Energy/eV
      -------------------------------------------------------------
         1        2.0000           -0.7065827             -19.2271
       ...           ...                  ...                  ...
        21        2.0000           -0.4938705             -13.4389
        22        2.0000           -0.4907439             -13.3538
        23        2.0000           -0.4876854             -13.2706
        24        2.0000           -0.4845415             -13.1850
        25        2.0000           -0.4609863             -12.5441
        26        2.0000           -0.4467502             -12.1567
        27        2.0000           -0.4400686             -11.9749
        28        2.0000           -0.4361904             -11.8693
        29        2.0000           -0.4314078             -11.7392
        30        2.0000           -0.4229857             -11.5100
        31        2.0000           -0.4190537             -11.4030
        32        2.0000           -0.3957891             -10.7700
        33        2.0000           -0.3895185             -10.5993 (HOMO)
        34                         -0.3058385              -8.3223 (LUMO)
        35                         -0.2577101              -7.0126
        36                         -0.2353212              -6.4034
        37                         -0.2046484              -5.5688
        38                         -0.1835574              -4.9949
        39                         -0.0932446              -2.5373
        40                         -0.0758086              -2.0629
        41                          0.0735894               2.0025
        42                          0.0842225               2.2918
        43                          0.1200203               3.2659
        44                          0.1258203               3.4237
       ...                                ...                  ...
        64                          0.7443530              20.2549
      -------------------------------------------------------------
                  HL-Gap            0.0836799 Eh            2.2770 eV
             Fermi-level           -0.3476785 Eh           -9.4608 eV

     #   Z        covCN         q      C6AA      α(0)
     1   6 C      2.921    -0.029    28.717     8.788
     2   6 C      2.922    -0.023    28.574     8.766
     3   6 C      2.913    -0.029    28.730     8.789
     4   6 C      3.039     0.007    27.822     8.651
     5   6 C      3.045    -0.024    28.569     8.767
     6   6 C      2.913    -0.014    28.372     8.734
     7   6 C      2.866     0.231    23.175     7.891
     8   8 O      0.856    -0.351    20.729     6.104
     9   6 C      3.045    -0.024    28.569     8.767
    10   6 C      3.039     0.007    27.822     8.651
    11   6 C      2.913    -0.029    28.730     8.789
    12   6 C      2.922    -0.023    28.574     8.766
    13   6 C      2.921    -0.029    28.717     8.788
    14   6 C      2.913    -0.014    28.372     8.734
    15   1 H      0.926     0.041     2.438     2.442
    16   1 H      0.926     0.040     2.449     2.447
    17   1 H      0.926     0.038     2.470     2.457
    18   1 H      0.926     0.054     2.276     2.359
    19   1 H      0.926     0.038     2.470     2.457
    20   1 H      0.926     0.040     2.449     2.447
    21   1 H      0.926     0.041     2.438     2.442
    22   1 H      0.926     0.054     2.276     2.359

 Mol. C6AA /au·bohr⁶  :       7348.042775
 Mol. C8AA /au·bohr⁸  :     187878.557467
 Mol. α(0) /au        :        138.398914


Wiberg/Mayer (AO) data.
largest (>0.10) Wiberg bond orders for each atom
          total WBO             WBO to atom ...
     1  C   3.971        C    2 1.459    C    6 1.406    H   15 0.971    C    4 0.100
     2  C   3.988        C    1 1.459    C    3 1.405    H   16 0.971    C    5 0.101
     3  C   3.980        C    4 1.435    C    2 1.405    H   17 0.968
     4  C   3.988        C    3 1.435    C    5 1.303    C   10 1.054    C    1 0.100
     5  C   3.987        C    6 1.439    C    4 1.303    C    7 1.007    C    2 0.101
     6  C   3.987        C    5 1.439    C    1 1.406    H   18 0.967
     7  C   3.927        O    8 1.812    C    9 1.007    C    5 1.007
     8  O   2.084        C    7 1.812
     9  C   3.987        C   14 1.439    C   10 1.303    C    7 1.007    C   12 0.101
    10  C   3.988        C   11 1.435    C    9 1.303    C    4 1.054    C   13 0.100
    11  C   3.980        C   10 1.435    C   12 1.405    H   19 0.968
    12  C   3.988        C   13 1.459    C   11 1.405    H   20 0.971    C    9 0.101
    13  C   3.971        C   12 1.459    C   14 1.406    H   21 0.971    C   10 0.100
    14  C   3.987        C    9 1.439    C   13 1.406    H   22 0.967
    15  H   0.998        C    1 0.971
    16  H   0.998        C    2 0.971
    17  H   0.998        C    3 0.968
    18  H   0.997        C    6 0.967
    19  H   0.998        C   11 0.968
    20  H   0.998        C   12 0.971
    21  H   0.998        C   13 0.971
    22  H   0.997        C   14 0.967

molecular dipole:
                 x           y           z       tot (Debye)
 q only:        0.001       1.280       0.015
   full:        0.001       1.459       0.016       3.709
molecular quadrupole (traceless):
                xx          xy          yy          xz          yz          zz
 q only:        9.879      -0.015      -7.600      -0.024      -0.109      -2.278
  q+dip:       14.111      -0.017      -5.583      -0.045       0.047      -8.528
   full:       11.150      -0.017      -8.689      -0.027      -0.115      -2.461

           -------------------------------------------------
          |                Geometry Summary                 |
           -------------------------------------------------

      molecular mass/u    :      180.2056000
   center of mass at/Å    :       -0.0005203       0.0252089      -0.0172018
  moments of inertia/u·Å² :        0.3473508E+03   0.8517304E+03   0.1199070E+04
rotational constants/cm⁻¹ :        0.4853201E-01   0.1979222E-01   0.1405892E-01

 * 21 selected distances

     #   Z        #   Z                                     value/Å
     1   6 C      2   6 C                                 1.3844212
     2   6 C      3   6 C                                 1.3922138
     3   6 C      4   6 C                                 1.3793549
     4   6 C      5   6 C                                 1.4069722 (max)
     1   6 C      6   6 C                                 1.3912723
     5   6 C      6   6 C                                 1.3791687
     7   6 C      8   8 O                                 1.2089868
     9   6 C     10   6 C                                 1.4069718
    10   6 C     11   6 C                                 1.3793512
    11   6 C     12   6 C                                 1.3922150
    12   6 C     13   6 C                                 1.3844160
     9   6 C     14   6 C                                 1.3791669
    13   6 C     14   6 C                                 1.3912688
     1   6 C     15   1 H                                 1.0798131
     2   6 C     16   1 H                                 1.0803135
     3   6 C     17   1 H                                 1.0797240
     6   6 C     18   1 H                                 1.0794185 (min)
    11   6 C     19   1 H                                 1.0797255
    12   6 C     20   1 H                                 1.0803148
    13   6 C     21   1 H                                 1.0798192
    14   6 C     22   1 H                                 1.0794216

 * 3 distinct bonds (by element types)

   Z      Z             #   av. dist./Å        max./Å        min./Å
   1 H    6 C           8     1.0798188     1.0803148     1.0794185
   6 C    6 C          12     1.3888994     1.4069722     1.3791669
   6 C    8 O           1     1.2089868     1.2089868     1.2089868


optimized geometry written to: xtbopt.xyz


           -------------------------------------------------
          | TOTAL ENERGY              -35.961754032504 Eh   |
          | GRADIENT NORM               0.000378547338 Eh/α |
          | HOMO-LUMO GAP               2.277046810472 eV   |
           -------------------------------------------------

------------------------------------------------------------------------
 * finished run on 2021/05/19 at 10:59:42.346     
------------------------------------------------------------------------
 total:
 * wall-time:     0 d,  0 h,  0 min,  0.319 sec
 *  cpu-time:     0 d,  0 h,  0 min,  0.318 sec
 * ratio c/w:     0.996 speedup
 SCF:
 * wall-time:     0 d,  0 h,  0 min,  0.035 sec
 *  cpu-time:     0 d,  0 h,  0 min,  0.034 sec
 * ratio c/w:     0.997 speedup
 ANC optimizer:
 * wall-time:     0 d,  0 h,  0 min,  0.265 sec
 *  cpu-time:     0 d,  0 h,  0 min,  0.264 sec
 * ratio c/w:     0.998 speedup

