      -----------------------------------------------------------      
     |                   =====================                   |     
     |                           x T B                           |     
     |                   =====================                   |     
     |                         S. Grimme                         |     
     |          Mulliken Center for Theoretical Chemistry        |     
     |                    University of Bonn                     |     
     |                Version 6.2 RC2 (SAW190805)                |     
      -----------------------------------------------------------      

   This program is distributed in the hope that it will be useful,
   but WITHOUT ANY WARRANTY; without even the implied warranty of
   MERCHANTABILITY or FITNESS FOR A PARTICULAR PURPOSE.
   
   FOR NON-COMMERCIAL, ACADEMIA USE ONLY.
   
   Cite this work as:
   * S. Grimme, C. Bannwarth, P. Shushkov, J. Chem. Theory Comput., 2017,
     13, 1989-2009. DOI: 10.1021/acs.jctc.7b00118
   * C. Bannwarth, S. Ehlert and S. Grimme., J. Chem. Theory Comput., 2019,
     15, 1652-1671. DOI: 10.1021/acs.jctc.8b01176
   * P. Pracht, E. Caldeweyher, S. Ehlert, S. Grimme, ChemRxiv, 2019, preprint.
     DOI: 10.26434/chemrxiv.8326202.v1
   
   for DFT-D4:
   * E. Caldeweyher, C. Bannwarth and S. Grimme, J. Chem. Phys., 2017,
     147, 034112. DOI: 10.1063/1.4993215
   * E. Caldeweyher, S. Ehlert, A. Hansen, H. Neugebauer, S. Spicher,
     C. Bannwarth and S. Grimme, J. Chem. Phys., 2019, 150, 154122.
     DOI: 10.1063/1.5090222
   
   for sTDA-xTB:
   * S. Grimme and C. Bannwarth, J. Chem. Phys., 2016, 145, 054103.
     DOI: 10.1063/1.4959605
   
   in the mass-spec context:
   * V. Asgeirsson, C. Bauer and S. Grimme, Chem. Sci., 2017, 8, 4879.
     DOI: 10.1039/c7sc00601b
   
   for metadynamics refer to:
   * S. Grimme, J. Chem. Theory Comput., 2019, 155, 2847-2862
     DOI: 10.1021/acs.jctc.9b00143
   
   with help from (in alphabetical order)
   C. Bannwarth, F. Bohle, G. Brandenburg, E. Caldeweyher, M. Checinski,
   S. Dohm, S. Ehlert, S. Ehrlich, F. März, H. Neugebauer, J. Pisarek,
   P. Pracht, P. Shushkov, and S. Spicher.
   
 * started run on 2021/05/19 at 10:59:42.502     

           -------------------------------------------------
          |                Calculation Setup                |
           -------------------------------------------------

          program call               : /ihome/ghutchison/geoffh/xtb/xtb 637.xyz -opt
          hostname                   : smp-n144
          coordinate file            : 637.xyz
          omp threads                :                     1
          number of atoms            :                    27
          number of electrons        :                    84
          charge                     :                     0
          spin                       :                   0.0
          first test random number   :      0.11593979776599


########################################################################
# WARNING! Please study the warnings concerning your input carefully
#  - the use of '-opt' is discouraged, please use '--opt' next time
########################################################################

           ------------------------------------------------- 
          |                 G F N 2 - x T B                 |
          | Geometry, Frequencies, Noncovalent interactions |
          |            JCTC 2019 parametrisation            |
           ------------------------------------------------- 
             KAB for C  - Si     :                1.0500
             KAB for H  - Pd     :                0.9500
             k(s)              :                1.8500
             k(p)              :                2.2300
             k(d)              :                2.2300
             k(f)              :                2.0000
             kEN (H0ij)        :               -2.0000
             D4 a1             :                0.5200
             D4 a2             :                5.0000
             D4 s6             :                1.0000
             D4 s8             :                2.7000
             D4 s9             :                5.0000
             alphaj            :                2.0000

  Z AO/shell   Hii/eV     exponent
  1     Wed Apr 25 08:07:45 CEST 2018   EN: 2.200 GM2: 0.406  GM3: 0.0800  RAES: 1.40
     1s    -10.707211    1.230000
  6     Wed Apr 25 08:07:45 CEST 2018   EN: 2.550 GM2: 0.538  GM3: 0.1500  RAES: 3.00
     2s    -13.970922    2.096432
     2p    -10.063292    1.800000
 16     Tue Apr 24 11:44:34 CEST 2018   EN: 2.580 GM2: 0.340  GM3:-0.0502  RAES: 3.10
     3s    -20.029654    1.981333
     3p    -11.377694    2.025643
     3d     -0.420282    1.702555

           ------------------------------------------------- 
          |        Self-Consistent Charge Iterations        |
           ------------------------------------------------- 

          ...................................................
          :                      SETUP                      :
          :.................................................:
          :  # basis functions                  96          :
          :  # atomic orbitals                  93          :
          :  # shells                           47          :
          :  # electrons                        84          :
          :  max. iterations                   250          :
          :  Hamiltonian                  GFN2-xTB          :
          :  restarted?                      false          :
          :  GBSA solvation                  false          :
          :  PC potential                    false          :
          :  electronic temp.          300.0000000     K    :
          :  accuracy                    1.0000000          :
          :  -> integral cutoff          0.2500000E+02      :
          :  -> integral neglect         0.1000000E-07      :
          :  -> SCF convergence          0.1000000E-05 Eh   :
          :  -> wf. convergence          0.1000000E-03 e    :
          :  Broyden damping             0.4000000          :
          ...................................................

 iter      E             dE          RMSdq      gap      omega  full diag
   1    -45.4023001 -0.454023E+02  0.423E+00    1.98       0.0  T
   2    -45.4253995 -0.230994E-01  0.245E+00    2.02       1.0  T
   3    -45.4113463  0.140533E-01  0.102E+00    2.04       1.0  T
   4    -45.4306897 -0.193434E-01  0.390E-01    2.02       1.0  T
   5    -45.4317259 -0.103623E-02  0.128E-01    2.02       1.0  T
   6    -45.4317956 -0.696399E-04  0.689E-02    2.02       1.0  T
   7    -45.4318949 -0.993430E-04  0.193E-02    2.02       1.0  T
   8    -45.4318970 -0.207440E-05  0.108E-02    2.02       1.8  T
   9    -45.4318976 -0.653844E-06  0.384E-03    2.02       5.0  T
  10    -45.4318978 -0.196966E-06  0.185E-03    2.02      10.4  T
  11    -45.4318979 -0.324721E-07  0.859E-04    2.02      22.4  T
  12    -45.4318979 -0.369088E-08  0.430E-04    2.02      44.7  T

   *** convergence criteria satisfied after 12 iterations ***

         #    Occupation            Energy/Eh            Energy/eV
      -------------------------------------------------------------
         1        2.0000           -0.7358378             -20.0232
       ...           ...                  ...                  ...
        36        2.0000           -0.4414039             -12.0112
        37        2.0000           -0.4206820             -11.4473
        38        2.0000           -0.4010442             -10.9130
        39        2.0000           -0.3992838             -10.8651
        40        2.0000           -0.3984549             -10.8425
        41        2.0000           -0.3876970             -10.5498
        42        2.0000           -0.3600868              -9.7985 (HOMO)
        43                         -0.2857762              -7.7764 (LUMO)
        44                         -0.2581486              -7.0246
        45                         -0.2266099              -6.1664
        46                         -0.2086285              -5.6771
        47                         -0.2039055              -5.5486
       ...                                ...                  ...
        93                          0.7145030              19.4426
      -------------------------------------------------------------
                  HL-Gap            0.0743107 Eh            2.0221 eV
             Fermi-level           -0.3229315 Eh           -8.7874 eV

 SCC (total)                   0 d,  0 h,  0 min,  0.062 sec
 SCC setup                      ...        0 min,  0.000 sec (  0.572%)
 Dispersion                     ...        0 min,  0.000 sec (  0.717%)
 integral evaluation            ...        0 min,  0.017 sec ( 27.815%)
 zeroth order Hamiltonian       ...        0 min,  0.000 sec (  0.397%)
 iterations                     ...        0 min,  0.022 sec ( 35.209%)
 molecular gradient             ...        0 min,  0.021 sec ( 34.508%)
 printout                       ...        0 min,  0.000 sec (  0.689%)

         :::::::::::::::::::::::::::::::::::::::::::::::::::::
         ::                     SUMMARY                     ::
         :::::::::::::::::::::::::::::::::::::::::::::::::::::
         :: total energy             -44.756885891154 Eh    ::
         :: gradient norm              0.069362906060 Eh/a0 ::
         :: HOMO-LUMO gap              2.022096409642 eV    ::
         ::.................................................::
         :: SCC energy               -45.431897863833 Eh    ::
         :: -> isotropic ES            0.002665969536 Eh    ::
         :: -> anisotropic ES          0.002263966122 Eh    ::
         :: -> anisotropic XC          0.024309377595 Eh    ::
         :: -> dispersion             -0.033424165107 Eh    ::
         :: repulsion energy           0.675461734806 Eh    ::
         :: add. restraining           0.000000000000 Eh    ::
         :::::::::::::::::::::::::::::::::::::::::::::::::::::

      ----------------------------------------------------------- 
     |                   =====================                   |
     |                        A N C O P T                        |
     |                   =====================                   |
     |               Approximate Normal Coordinate               |
     |                Rational Function Optimizer                |
      ----------------------------------------------------------- 

          ...................................................
          :                      SETUP                      :
          :.................................................:
          :   optimization level            normal          :
          :   max. optcycles                   200          :
          :   ANC micro-cycles                  20          :
          :   degrees of freedom                75          :
          :.................................................:
          :   RF solver                   davidson          :
          :   input Hessian                  false          :
          :   write xtbopt.log                true          :
          :   linear?                        false          :
          :   energy convergence         0.5000000E-05 Eh   :
          :   grad. convergence          0.1000000E-02 Eh/α :
          :   maximium RF displ.         2.0000000          :
          :   Hlow (freq-cutoff)         0.5000000E-02      :
          :   Hmax (freq-cutoff)         5.0000000          :
          :   S6 in model hess.         20.0000000          :
          ...................................................

generating ANC from model Hessian ...
Using Lindh-Hessian (1995)
 Shifting diagonal of input Hessian by   4.643135010920047E-003
 Lowest  eigenvalues of input Hessian
   -0.000000   -0.000000   -0.000000    0.000000    0.000000    0.000000
    0.005000    0.005875    0.006175    0.006691    0.009289    0.010786
    0.010896    0.012302    0.017519    0.017835    0.018060    0.019745
 Highest eigenvalues
    1.776558    1.823194    1.865404    1.901146    1.925921    1.992691
 

........................................................................
.............................. CYCLE    1 ..............................
........................................................................
   1    -45.4318979 -0.454319E+02  0.208E-04    2.02       0.0  T
   2    -45.4318979 -0.144247E-09  0.155E-04    2.02     124.1  T
   3    -45.4318979 -0.330665E-09  0.961E-05    2.02     200.3  T
     SCC iter.                  ...        0 min,  0.006 sec
     gradient                   ...        0 min,  0.021 sec
 * total energy  :   -44.7568859 Eh     change       -0.2688199E-07 Eh
   gradient norm :     0.0693634 Eh/α   predicted     0.0000000E+00 (-100.00%)
   displ. norm   :     0.2685181 α      lambda       -0.7570337E-02
   maximum displ.:     0.1609810 α      in ANC's #12, #20, #10, ...

........................................................................
.............................. CYCLE    2 ..............................
........................................................................
   1    -45.4647021 -0.454647E+02  0.254E-01    1.96       0.0  T
   2    -45.4647783 -0.761356E-04  0.122E-01    1.97       1.0  T
   3    -45.4647307  0.475715E-04  0.615E-02    1.96       1.0  T
   4    -45.4648252 -0.944471E-04  0.222E-02    1.96       1.0  T
   5    -45.4648275 -0.230631E-05  0.122E-02    1.96       1.6  T
   6    -45.4648292 -0.174332E-05  0.368E-03    1.96       5.2  T
   7    -45.4648294 -0.196391E-06  0.109E-03    1.96      17.6  T
     SCC iter.                  ...        0 min,  0.012 sec
     gradient                   ...        0 min,  0.020 sec
 * total energy  :   -44.7620038 Eh     change       -0.5117888E-02 Eh
   gradient norm :     0.0314447 Eh/α   predicted    -0.4058087E-02 ( -20.71%)
   displ. norm   :     0.1531486 α      lambda       -0.1730383E-02
   maximum displ.:     0.1006074 α      in ANC's #12, #20, #10, ...

........................................................................
.............................. CYCLE    3 ..............................
........................................................................
   1    -45.4780361 -0.454780E+02  0.150E-01    1.91       0.0  T
   2    -45.4780748 -0.387276E-04  0.721E-02    1.92       1.0  T
   3    -45.4780635  0.113178E-04  0.367E-02    1.92       1.0  T
   4    -45.4780925 -0.289994E-04  0.150E-02    1.92       1.3  T
   5    -45.4780941 -0.162823E-05  0.737E-03    1.92       2.6  T
   6    -45.4780946 -0.493843E-06  0.278E-03    1.92       6.9  T
   7    -45.4780947 -0.117325E-06  0.683E-04    1.92      28.2  T
     SCC iter.                  ...        0 min,  0.012 sec
     gradient                   ...        0 min,  0.020 sec
 * total energy  :   -44.7629591 Eh     change       -0.9552609E-03 Eh
   gradient norm :     0.0089947 Eh/α   predicted    -0.8854861E-03 (  -7.30%)
   displ. norm   :     0.0286526 α      lambda       -0.1140628E-03
   maximum displ.:     0.0127517 α      in ANC's #28, #12, #2, ...

........................................................................
.............................. CYCLE    4 ..............................
........................................................................
   1    -45.4769988 -0.454770E+02  0.300E-02    1.90       0.0  T
   2    -45.4770014 -0.259575E-05  0.147E-02    1.90       1.3  T
   3    -45.4770012  0.158303E-06  0.790E-03    1.90       2.4  T
   4    -45.4770020 -0.760537E-06  0.385E-03    1.90       5.0  T
   5    -45.4770021 -0.144575E-06  0.142E-03    1.90      13.6  T
   6    -45.4770022 -0.199687E-07  0.644E-04    1.90      29.9  T
     SCC iter.                  ...        0 min,  0.011 sec
     gradient                   ...        0 min,  0.020 sec
 * total energy  :   -44.7630374 Eh     change       -0.7833329E-04 Eh
   gradient norm :     0.0035167 Eh/α   predicted    -0.5716644E-04 ( -27.02%)
   displ. norm   :     0.0275426 α      lambda       -0.3895376E-04
   maximum displ.:     0.0127907 α      in ANC's #2, #1, #28, ...

........................................................................
.............................. CYCLE    5 ..............................
........................................................................
   1    -45.4752386 -0.454752E+02  0.197E-02    1.90       0.0  T
   2    -45.4752397 -0.113130E-05  0.102E-02    1.90       1.9  T
   3    -45.4752396  0.133151E-06  0.606E-03    1.90       3.2  T
   4    -45.4752401 -0.479207E-06  0.282E-03    1.90       6.8  T
   5    -45.4752402 -0.969171E-07  0.104E-03    1.90      18.5  T
   6    -45.4752402 -0.160130E-07  0.387E-04    1.90      49.8  T
   7    -45.4752402 -0.880519E-09  0.114E-04    1.90     168.3  T
     SCC iter.                  ...        0 min,  0.012 sec
     gradient                   ...        0 min,  0.021 sec
 * total energy  :   -44.7630589 Eh     change       -0.2152916E-04 Eh
   gradient norm :     0.0007758 Eh/α   predicted    -0.1949187E-04 (  -9.46%)
   displ. norm   :     0.0195495 α      lambda       -0.2894489E-05
   maximum displ.:     0.0113907 α      in ANC's #2, #1, #12, ...

........................................................................
.............................. CYCLE    6 ..............................
........................................................................
   1    -45.4748332 -0.454748E+02  0.132E-02    1.90       0.0  T
   2    -45.4748333 -0.935551E-07  0.691E-03    1.90       2.8  T
   3    -45.4748330  0.278734E-06  0.382E-03    1.90       5.0  T
   4    -45.4748334 -0.348159E-06  0.113E-03    1.90      17.0  T
   5    -45.4748334 -0.942858E-08  0.535E-04    1.90      36.0  T
   6    -45.4748334 -0.282676E-08  0.204E-04    1.90      94.4  T
     SCC iter.                  ...        0 min,  0.011 sec
     gradient                   ...        0 min,  0.021 sec
 * total energy  :   -44.7630610 Eh     change       -0.2051967E-05 Eh
   gradient norm :     0.0004429 Eh/α   predicted    -0.1447348E-05 ( -29.47%)
   displ. norm   :     0.0199128 α      lambda       -0.1860070E-05
   maximum displ.:     0.0121664 α      in ANC's #1, #2, #4, ...

   *** GEOMETRY OPTIMIZATION CONVERGED AFTER 6 ITERATIONS ***

------------------------------------------------------------------------
 total energy gain   :        -0.0061751 Eh       -3.8749 kcal/mol
 total RMSD          :         0.0802761 a0        0.0425 Å
 total power (kW/mol):        -2.7021161 (step)  -54.2251 (real)
------------------------------------------------------------------------

 ANCopt (total)                0 d,  0 h,  0 min,  0.299 sec
 optimizer setup                ...        0 min,  0.000 sec (  0.054%)
 model hessian                  ...        0 min,  0.002 sec (  0.744%)
 ANC generation                 ...        0 min,  0.001 sec (  0.267%)
 coordinate transformation      ...        0 min,  0.000 sec (  0.040%)
 single point calculation       ...        0 min,  0.294 sec ( 98.174%)
 optimization log               ...        0 min,  0.001 sec (  0.229%)
 hessian update                 ...        0 min,  0.000 sec (  0.029%)
 rational function              ...        0 min,  0.001 sec (  0.297%)

================
 final structure:
================
$coord
    1.66301602213361    1.89111556226380    0.60808049346246      C 
    1.99663882251709   -0.95923496720573    2.12917693636820      S 
    0.21957525947167   -2.47748288876862   -0.19037428459619      C 
   -0.55075520681045   -0.79395739252750   -2.00531944473400      C 
    0.27484600355336    1.68996007495739   -1.54301394962645      C 
   -0.25786201240517   -5.12388397183358   -0.05498031324023      C 
    0.50755562244092   -6.81161141291036    1.76462532697605      C 
   -0.28634893562385   -9.28865776585915    1.30326937318332      C 
   -1.67435764010927   -9.54033208989057   -0.87900426667624      C 
   -2.00865564202508   -6.63631413885512   -2.39634947325417      S 
   -2.75581331789025  -11.76698647834343   -1.92676803634233      C 
   -2.40637045018913  -14.68150637238282   -0.45033537092681      S 
   -4.13090817938554  -16.19183461226628   -2.81046618165377      C 
   -4.90910353480604  -14.48510479627392   -4.60691277576257      C 
   -4.14080458483323  -12.00625387659188   -4.11477728479013      C 
   -4.53057065201255  -18.87317992307184   -2.65446912143463      C 
   -5.76959264363137  -20.25781638972069   -4.35124081310750      C 
    2.52049510825402    3.54278468358930    1.40702683664463      H 
   -1.67173274371083   -1.34767426358765   -3.60786662119846      H 
   -0.14536052766846    3.26216711681977   -2.75996616581812      H 
    1.61254007163835   -6.24975028819466    3.37590545137750      H 
    0.13269941271327  -10.86561531880910    2.51589533100543      H 
   -6.00530444864827  -15.00918027239335   -6.23447064284522      H 
   -4.57039154587729  -10.41664990365228   -5.30780252372157      H 
   -3.72535219099517  -19.77092640492094   -1.00220601442747      H 
   -6.59050429438609  -19.44295257209424   -6.02380282212426      H 
   -5.99219161434238  -22.26415621709321   -4.11571118325232      H 
$end
           -------------------------------------------------
          |                Final Singlepoint                |
           -------------------------------------------------

          ...................................................
          :                      SETUP                      :
          :.................................................:
          :  # basis functions                  96          :
          :  # atomic orbitals                  93          :
          :  # shells                           47          :
          :  # electrons                        84          :
          :  max. iterations                   250          :
          :  Hamiltonian                  GFN2-xTB          :
          :  restarted?                      false          :
          :  GBSA solvation                  false          :
          :  PC potential                    false          :
          :  electronic temp.          300.0000000     K    :
          :  accuracy                    1.0000000          :
          :  -> integral cutoff          0.2500000E+02      :
          :  -> integral neglect         0.1000000E-07      :
          :  -> SCF convergence          0.1000000E-05 Eh   :
          :  -> wf. convergence          0.1000000E-03 e    :
          :  Broyden damping             0.4000000          :
          ...................................................

 iter      E             dE          RMSdq      gap      omega  full diag
   1    -45.4748334 -0.454748E+02  0.817E-05    1.90       0.0  T
   2    -45.4748334 -0.529354E-11  0.507E-05    1.90     379.9  T
   3    -45.4748334 -0.239879E-10  0.374E-05    1.90     514.4  T

   *** convergence criteria satisfied after 3 iterations ***

         #    Occupation            Energy/Eh            Energy/eV
      -------------------------------------------------------------
         1        2.0000           -0.7339652             -19.9722
       ...           ...                  ...                  ...
        36        2.0000           -0.4391657             -11.9503
        37        2.0000           -0.4227055             -11.5024
        38        2.0000           -0.4029612             -10.9651
        39        2.0000           -0.4003904             -10.8952
        40        2.0000           -0.3999792             -10.8840
        41        2.0000           -0.3885942             -10.5742
        42        2.0000           -0.3587409              -9.7618 (HOMO)
        43                         -0.2889884              -7.8638 (LUMO)
        44                         -0.2576152              -7.0101
        45                         -0.2244836              -6.1085
        46                         -0.2172246              -5.9110
        47                         -0.2094891              -5.7005
       ...                                ...                  ...
        93                          0.7022404              19.1089
      -------------------------------------------------------------
                  HL-Gap            0.0697525 Eh            1.8981 eV
             Fermi-level           -0.3238647 Eh           -8.8128 eV

 SCC (total)                   0 d,  0 h,  0 min,  0.046 sec
 SCC setup                      ...        0 min,  0.000 sec (  0.632%)
 Dispersion                     ...        0 min,  0.000 sec (  0.718%)
 integral evaluation            ...        0 min,  0.017 sec ( 37.103%)
 zeroth order Hamiltonian       ...        0 min,  0.000 sec (  0.484%)
 iterations                     ...        0 min,  0.006 sec ( 13.603%)
 molecular gradient             ...        0 min,  0.022 sec ( 46.523%)
 printout                       ...        0 min,  0.000 sec (  0.824%)

         :::::::::::::::::::::::::::::::::::::::::::::::::::::
         ::                     SUMMARY                     ::
         :::::::::::::::::::::::::::::::::::::::::::::::::::::
         :: total energy             -44.763060986525 Eh    ::
         :: gradient norm              0.000442996501 Eh/a0 ::
         :: HOMO-LUMO gap              1.898061530454 eV    ::
         ::.................................................::
         :: SCC energy               -45.474833379245 Eh    ::
         :: -> isotropic ES            0.002631842957 Eh    ::
         :: -> anisotropic ES          0.001873969508 Eh    ::
         :: -> anisotropic XC          0.023554775741 Eh    ::
         :: -> dispersion             -0.033627232889 Eh    ::
         :: repulsion energy           0.712222949083 Eh    ::
         :: add. restraining           0.000000000000 Eh    ::
         :::::::::::::::::::::::::::::::::::::::::::::::::::::

           -------------------------------------------------
          |                Property Printout                |
           -------------------------------------------------

    * Orbital Energies and Occupations

         #    Occupation            Energy/Eh            Energy/eV
      -------------------------------------------------------------
         1        2.0000           -0.7339652             -19.9722
       ...           ...                  ...                  ...
        30        2.0000           -0.4595014             -12.5037
        31        2.0000           -0.4551970             -12.3865
        32        2.0000           -0.4515024             -12.2860
        33        2.0000           -0.4495401             -12.2326
        34        2.0000           -0.4484927             -12.2041
        35        2.0000           -0.4453562             -12.1188
        36        2.0000           -0.4391657             -11.9503
        37        2.0000           -0.4227055             -11.5024
        38        2.0000           -0.4029612             -10.9651
        39        2.0000           -0.4003904             -10.8952
        40        2.0000           -0.3999792             -10.8840
        41        2.0000           -0.3885942             -10.5742
        42        2.0000           -0.3587409              -9.7618 (HOMO)
        43                         -0.2889884              -7.8638 (LUMO)
        44                         -0.2576152              -7.0101
        45                         -0.2244836              -6.1085
        46                         -0.2172246              -5.9110
        47                         -0.2094891              -5.7005
        48                         -0.1991007              -5.4178
        49                         -0.1936379              -5.2692
        50                         -0.1677351              -4.5643
        51                         -0.1501521              -4.0858
        52                         -0.1461376              -3.9766
        53                         -0.1416267              -3.8539
       ...                                ...                  ...
        93                          0.7022404              19.1089
      -------------------------------------------------------------
                  HL-Gap            0.0697525 Eh            1.8981 eV
             Fermi-level           -0.3238647 Eh           -8.8128 eV

     #   Z        covCN         q      C6AA      α(0)
     1   6 C      2.941    -0.019    28.489     8.754
     2  16 S      2.327    -0.031   142.316    20.078
     3   6 C      3.024     0.020    27.536     8.608
     4   6 C      3.110    -0.050    29.099     8.838
     5   6 C      3.107    -0.041    28.878     8.805
     6   6 C      3.022     0.022    27.498     8.602
     7   6 C      3.097    -0.048    29.066     8.835
     8   6 C      3.097    -0.048    29.067     8.836
     9   6 C      3.022     0.022    27.499     8.602
    10  16 S      2.347    -0.046   142.953    20.123
    11   6 C      3.023     0.021    27.522     8.605
    12  16 S      2.361    -0.043   142.838    20.115
    13   6 C      2.989     0.028    27.371     8.582
    14   6 C      3.102    -0.047    29.020     8.828
    15   6 C      3.102    -0.050    29.094     8.839
    16   6 C      2.927    -0.030    28.739     8.792
    17   6 C      2.840    -0.088    30.206     9.007
    18   1 H      0.926     0.046     2.376     2.410
    19   1 H      0.926     0.043     2.413     2.429
    20   1 H      0.926     0.039     2.460     2.453
    21   1 H      0.926     0.044     2.391     2.418
    22   1 H      0.926     0.044     2.392     2.419
    23   1 H      0.926     0.041     2.434     2.440
    24   1 H      0.926     0.042     2.423     2.434
    25   1 H      0.925     0.043     2.403     2.424
    26   1 H      0.926     0.042     2.417     2.431
    27   1 H      0.926     0.044     2.398     2.422

 Mol. C6AA /au·bohr⁶  :      15885.127027
 Mol. C8AA /au·bohr⁸  :     498959.452260
 Mol. α(0) /au        :        207.127817


Wiberg/Mayer (AO) data.
largest (>0.10) Wiberg bond orders for each atom
          total WBO             WBO to atom ...
     1  C   3.925        C    5 1.603    S    2 1.193    H   18 0.970
     2  S   2.600        C    1 1.193    C    3 1.124
     3  C   3.952        C    4 1.505    C    6 1.164    S    2 1.124
     4  C   3.970        C    3 1.505    C    5 1.301    H   19 0.962
     5  C   3.987        C    1 1.603    C    4 1.301    H   20 0.965
     6  C   3.933        C    7 1.480    C    3 1.164    S   10 1.121
     7  C   3.985        C    6 1.480    C    8 1.341    H   21 0.961
     8  C   3.975        C    9 1.475    C    7 1.341    H   22 0.961
     9  C   3.939        C    8 1.475    C   11 1.173    S   10 1.119
    10  S   2.564        C    6 1.121    C    9 1.119
    11  C   3.953        C   15 1.470    C    9 1.173    S   12 1.130
    12  S   2.577        C   13 1.134    C   11 1.130
    13  C   3.928        C   14 1.488    C   16 1.141    S   12 1.134
    14  C   3.987        C   13 1.488    C   15 1.345    H   23 0.962
    15  C   3.974        C   11 1.470    C   14 1.345    H   24 0.961
    16  C   3.991        C   17 1.851    C   13 1.141    H   25 0.964
    17  C   3.963        C   16 1.851    H   27 0.978    H   26 0.975
    18  H   0.997        C    1 0.970
    19  H   0.998        C    4 0.962
    20  H   0.998        C    5 0.965
    21  H   0.998        C    7 0.961
    22  H   0.998        C    8 0.961
    23  H   0.998        C   14 0.962
    24  H   0.998        C   15 0.961
    25  H   0.998        C   16 0.964
    26  H   0.998        C   17 0.975
    27  H   0.998        C   17 0.978

molecular dipole:
                 x           y           z       tot (Debye)
 q only:       -0.051      -0.012      -0.085
   full:       -0.149       0.133      -0.292       0.900
molecular quadrupole (traceless):
                xx          xy          yy          xz          yz          zz
 q only:       -3.706       3.430       5.828       2.532       1.897      -2.122
  q+dip:       -5.655       5.831       6.514       6.124       3.846      -0.859
   full:       -3.707       5.355       5.581       3.398       4.559      -1.874

           -------------------------------------------------
          |                Geometry Summary                 |
           -------------------------------------------------

      molecular mass/u    :      274.4130000
   center of mass at/Å    :       -0.8071208      -4.4417538      -0.5837267
  moments of inertia/u·Å² :        0.2962703E+03   0.3890476E+04   0.4186466E+04
rotational constants/cm⁻¹ :        0.5689949E-01   0.4333051E-02   0.4026697E-02

 * 28 selected distances

     #   Z        #   Z                                     value/Å
     1   6 C      2  16 S                                 1.7187704
     2  16 S      3   6 C                                 1.7425406
     3   6 C      4   6 C                                 1.3719570
     1   6 C      5   6 C                                 1.3589337
     4   6 C      5   6 C                                 1.4065756
     3   6 C      6   6 C                                 1.4248255
     6   6 C      7   6 C                                 1.3743593
     7   6 C      8   6 C                                 1.3979590
     8   6 C      9   6 C                                 1.3750696
     6   6 C     10  16 S                                 1.7418481
     9   6 C     10  16 S                                 1.7428670 (max)
     9   6 C     11   6 C                                 1.4224286
    11   6 C     12  16 S                                 1.7387633
    12  16 S     13   6 C                                 1.7410928
    13   6 C     14   6 C                                 1.3744084
    11   6 C     15   6 C                                 1.3761493
    14   6 C     15   6 C                                 1.3977877
    16   6 C     17   6 C                                 1.3315332
     1   6 C     18   1 H                                 1.0717109 (min)
     4   6 C     19   1 H                                 1.0755911
     5   6 C     20   1 H                                 1.0753347
     7   6 C     21   1 H                                 1.0757931
     8   6 C     22   1 H                                 1.0757874
    14   6 C     23   1 H                                 1.0747975
    15   6 C     24   1 H                                 1.0760264
    16   6 C     25   1 H                                 1.0824617
    17   6 C     26   1 H                                 1.0761132
    17   6 C     27   1 H                                 1.0754705

 * 3 distinct bonds (by element types)

   Z      Z             #   av. dist./Å        max./Å        min./Å
   1 H    6 C          10     1.0759086     1.0824617     1.0717109
   6 C    6 C          12     1.3843322     1.4248255     1.3315332
   6 C   16 S           6     1.7376470     1.7428670     1.7187704


optimized geometry written to: xtbopt.xyz


           -------------------------------------------------
          | TOTAL ENERGY              -44.763060986525 Eh   |
          | GRADIENT NORM               0.000442996501 Eh/α |
          | HOMO-LUMO GAP               1.898061530454 eV   |
           -------------------------------------------------

------------------------------------------------------------------------
 * finished run on 2021/05/19 at 10:59:42.939     
------------------------------------------------------------------------
 total:
 * wall-time:     0 d,  0 h,  0 min,  0.438 sec
 *  cpu-time:     0 d,  0 h,  0 min,  0.436 sec
 * ratio c/w:     0.997 speedup
 SCF:
 * wall-time:     0 d,  0 h,  0 min,  0.063 sec
 *  cpu-time:     0 d,  0 h,  0 min,  0.062 sec
 * ratio c/w:     0.998 speedup
 ANC optimizer:
 * wall-time:     0 d,  0 h,  0 min,  0.346 sec
 *  cpu-time:     0 d,  0 h,  0 min,  0.345 sec
 * ratio c/w:     0.997 speedup

