      -----------------------------------------------------------      
     |                   =====================                   |     
     |                           x T B                           |     
     |                   =====================                   |     
     |                         S. Grimme                         |     
     |          Mulliken Center for Theoretical Chemistry        |     
     |                    University of Bonn                     |     
     |                Version 6.2 RC2 (SAW190805)                |     
      -----------------------------------------------------------      

   This program is distributed in the hope that it will be useful,
   but WITHOUT ANY WARRANTY; without even the implied warranty of
   MERCHANTABILITY or FITNESS FOR A PARTICULAR PURPOSE.
   
   FOR NON-COMMERCIAL, ACADEMIA USE ONLY.
   
   Cite this work as:
   * S. Grimme, C. Bannwarth, P. Shushkov, J. Chem. Theory Comput., 2017,
     13, 1989-2009. DOI: 10.1021/acs.jctc.7b00118
   * C. Bannwarth, S. Ehlert and S. Grimme., J. Chem. Theory Comput., 2019,
     15, 1652-1671. DOI: 10.1021/acs.jctc.8b01176
   * P. Pracht, E. Caldeweyher, S. Ehlert, S. Grimme, ChemRxiv, 2019, preprint.
     DOI: 10.26434/chemrxiv.8326202.v1
   
   for DFT-D4:
   * E. Caldeweyher, C. Bannwarth and S. Grimme, J. Chem. Phys., 2017,
     147, 034112. DOI: 10.1063/1.4993215
   * E. Caldeweyher, S. Ehlert, A. Hansen, H. Neugebauer, S. Spicher,
     C. Bannwarth and S. Grimme, J. Chem. Phys., 2019, 150, 154122.
     DOI: 10.1063/1.5090222
   
   for sTDA-xTB:
   * S. Grimme and C. Bannwarth, J. Chem. Phys., 2016, 145, 054103.
     DOI: 10.1063/1.4959605
   
   in the mass-spec context:
   * V. Asgeirsson, C. Bauer and S. Grimme, Chem. Sci., 2017, 8, 4879.
     DOI: 10.1039/c7sc00601b
   
   for metadynamics refer to:
   * S. Grimme, J. Chem. Theory Comput., 2019, 155, 2847-2862
     DOI: 10.1021/acs.jctc.9b00143
   
   with help from (in alphabetical order)
   C. Bannwarth, F. Bohle, G. Brandenburg, E. Caldeweyher, M. Checinski,
   S. Dohm, S. Ehlert, S. Ehrlich, F. März, H. Neugebauer, J. Pisarek,
   P. Pracht, P. Shushkov, and S. Spicher.
   
 * started run on 2021/05/19 at 10:59:43.203     

           -------------------------------------------------
          |                Calculation Setup                |
           -------------------------------------------------

          program call               : /ihome/ghutchison/geoffh/xtb/xtb 639.xyz -opt
          hostname                   : smp-n144
          coordinate file            : 639.xyz
          omp threads                :                     1
          number of atoms            :                    30
          number of electrons        :                    66
          charge                     :                     0
          spin                       :                   0.0
          first test random number   :      0.27650278783531


########################################################################
# WARNING! Please study the warnings concerning your input carefully
#  - the use of '-opt' is discouraged, please use '--opt' next time
########################################################################

           ------------------------------------------------- 
          |                 G F N 2 - x T B                 |
          | Geometry, Frequencies, Noncovalent interactions |
          |            JCTC 2019 parametrisation            |
           ------------------------------------------------- 
             KAB for C  - Si     :                1.0500
             KAB for H  - Pd     :                0.9500
             k(s)              :                1.8500
             k(p)              :                2.2300
             k(d)              :                2.2300
             k(f)              :                2.0000
             kEN (H0ij)        :               -2.0000
             D4 a1             :                0.5200
             D4 a2             :                5.0000
             D4 s6             :                1.0000
             D4 s8             :                2.7000
             D4 s9             :                5.0000
             alphaj            :                2.0000

  Z AO/shell   Hii/eV     exponent
  1     Wed Apr 25 08:07:45 CEST 2018   EN: 2.200 GM2: 0.406  GM3: 0.0800  RAES: 1.40
     1s    -10.707211    1.230000
  6     Wed Apr 25 08:07:45 CEST 2018   EN: 2.550 GM2: 0.538  GM3: 0.1500  RAES: 3.00
     2s    -13.970922    2.096432
     2p    -10.063292    1.800000

           ------------------------------------------------- 
          |        Self-Consistent Charge Iterations        |
           ------------------------------------------------- 

          ...................................................
          :                      SETUP                      :
          :.................................................:
          :  # basis functions                  66          :
          :  # atomic orbitals                  66          :
          :  # shells                           42          :
          :  # electrons                        66          :
          :  max. iterations                   250          :
          :  Hamiltonian                  GFN2-xTB          :
          :  restarted?                      false          :
          :  GBSA solvation                  false          :
          :  PC potential                    false          :
          :  electronic temp.          300.0000000     K    :
          :  accuracy                    1.0000000          :
          :  -> integral cutoff          0.2500000E+02      :
          :  -> integral neglect         0.1000000E-07      :
          :  -> SCF convergence          0.1000000E-05 Eh   :
          :  -> wf. convergence          0.1000000E-03 e    :
          :  Broyden damping             0.4000000          :
          ...................................................

 iter      E             dE          RMSdq      gap      omega  full diag
   1    -35.3876570 -0.353877E+02  0.322E+00    4.49       0.0  T
   2    -35.4352927 -0.476357E-01  0.181E+00    4.48       1.0  T
   3    -35.4363272 -0.103451E-02  0.681E-01    4.45       1.0  T
   4    -35.4362369  0.903131E-04  0.246E-01    4.45       1.0  T
   5    -35.4373545 -0.111757E-02  0.684E-02    4.45       1.0  T
   6    -35.4373982 -0.436508E-04  0.306E-02    4.45       1.0  T
   7    -35.4373989 -0.743207E-06  0.752E-03    4.45       2.4  T
   8    -35.4373995 -0.596735E-06  0.184E-03    4.45       9.9  T
   9    -35.4373996 -0.682795E-07  0.822E-04    4.45      22.2  T
  10    -35.4373996 -0.105716E-08  0.336E-04    4.45      54.3  T

   *** convergence criteria satisfied after 10 iterations ***

         #    Occupation            Energy/Eh            Energy/eV
      -------------------------------------------------------------
         1        2.0000           -0.6317297             -17.1902
       ...           ...                  ...                  ...
        27        2.0000           -0.4369843             -11.8909
        28        2.0000           -0.4292751             -11.6812
        29        2.0000           -0.4259906             -11.5918
        30        2.0000           -0.4064203             -11.0593
        31        2.0000           -0.4031137             -10.9693
        32        2.0000           -0.3795600             -10.3284
        33        2.0000           -0.3779163             -10.2836 (HOMO)
        34                         -0.2143092              -5.8316 (LUMO)
        35                         -0.2125671              -5.7842
        36                         -0.0952486              -2.5918
        37                          0.0650452               1.7700
        38                          0.0822637               2.2385
       ...                                ...                  ...
        66                          0.6138007              16.7024
      -------------------------------------------------------------
                  HL-Gap            0.1636072 Eh            4.4520 eV
             Fermi-level           -0.2961128 Eh           -8.0576 eV

 SCC (total)                   0 d,  0 h,  0 min,  0.035 sec
 SCC setup                      ...        0 min,  0.000 sec (  0.904%)
 Dispersion                     ...        0 min,  0.000 sec (  1.203%)
 integral evaluation            ...        0 min,  0.008 sec ( 22.098%)
 zeroth order Hamiltonian       ...        0 min,  0.000 sec (  0.499%)
 iterations                     ...        0 min,  0.012 sec ( 34.592%)
 molecular gradient             ...        0 min,  0.014 sec ( 39.463%)
 printout                       ...        0 min,  0.000 sec (  1.062%)

         :::::::::::::::::::::::::::::::::::::::::::::::::::::
         ::                     SUMMARY                     ::
         :::::::::::::::::::::::::::::::::::::::::::::::::::::
         :: total energy             -34.873394311902 Eh    ::
         :: gradient norm              0.038755242917 Eh/a0 ::
         :: HOMO-LUMO gap              4.451977883471 eV    ::
         ::.................................................::
         :: SCC energy               -35.437399562172 Eh    ::
         :: -> isotropic ES            0.004501012134 Eh    ::
         :: -> anisotropic ES          0.009546971459 Eh    ::
         :: -> anisotropic XC          0.021996388073 Eh    ::
         :: -> dispersion             -0.025865577161 Eh    ::
         :: repulsion energy           0.563709159807 Eh    ::
         :: add. restraining           0.000000000000 Eh    ::
         :::::::::::::::::::::::::::::::::::::::::::::::::::::

      ----------------------------------------------------------- 
     |                   =====================                   |
     |                        A N C O P T                        |
     |                   =====================                   |
     |               Approximate Normal Coordinate               |
     |                Rational Function Optimizer                |
      ----------------------------------------------------------- 

          ...................................................
          :                      SETUP                      :
          :.................................................:
          :   optimization level            normal          :
          :   max. optcycles                   200          :
          :   ANC micro-cycles                  20          :
          :   degrees of freedom                84          :
          :.................................................:
          :   RF solver                   davidson          :
          :   input Hessian                  false          :
          :   write xtbopt.log                true          :
          :   linear?                        false          :
          :   energy convergence         0.5000000E-05 Eh   :
          :   grad. convergence          0.1000000E-02 Eh/α :
          :   maximium RF displ.         2.0000000          :
          :   Hlow (freq-cutoff)         0.5000000E-02      :
          :   Hmax (freq-cutoff)         5.0000000          :
          :   S6 in model hess.         20.0000000          :
          ...................................................

generating ANC from model Hessian ...
Using Lindh-Hessian (1995)
 Shifting diagonal of input Hessian by   4.354827390426971E-003
 Lowest  eigenvalues of input Hessian
    0.000000    0.000000    0.000000    0.000000    0.000000    0.000000
    0.005000    0.006067    0.006257    0.006924    0.008225    0.008410
    0.009356    0.010005    0.012405    0.013420    0.014198    0.017573
 Highest eigenvalues
    1.344991    1.494518    1.514208    1.749935    1.877691    1.910373
 

........................................................................
.............................. CYCLE    1 ..............................
........................................................................
   1    -35.4373996 -0.354374E+02  0.112E-04    4.45       0.0  T
   2    -35.4373996 -0.216573E-10  0.689E-05    4.45     265.2  T
   3    -35.4373996  0.194476E-10  0.382E-05    4.45     478.1  T
     SCC iter.                  ...        0 min,  0.004 sec
     gradient                   ...        0 min,  0.014 sec
 * total energy  :   -34.8733944 Eh     change       -0.6762903E-07 Eh
   gradient norm :     0.0387546 Eh/α   predicted     0.0000000E+00 (-100.00%)
   displ. norm   :     0.2840369 α      lambda       -0.5358524E-02
   maximum displ.:     0.0981061 α      in ANC's #5, #2, #11, ...

........................................................................
.............................. CYCLE    2 ..............................
........................................................................
   1    -35.4666545 -0.354667E+02  0.107E-01    4.60       0.0  T
   2    -35.4666686 -0.141300E-04  0.641E-02    4.60       1.0  T
   3    -35.4666679  0.684529E-06  0.122E-02    4.60       1.5  T
   4    -35.4666691 -0.115981E-05  0.282E-03    4.60       6.5  T
   5    -35.4666693 -0.169845E-06  0.111E-03    4.60      16.5  T
     SCC iter.                  ...        0 min,  0.006 sec
     gradient                   ...        0 min,  0.013 sec
 * total energy  :   -34.8767119 Eh     change       -0.3317546E-02 Eh
   gradient norm :     0.0122778 Eh/α   predicted    -0.2895422E-02 ( -12.72%)
   displ. norm   :     0.1927432 α      lambda       -0.6918536E-03
   maximum displ.:     0.1143958 α      in ANC's #5, #2, #11, ...

........................................................................
.............................. CYCLE    3 ..............................
........................................................................
   1    -35.4760128 -0.354760E+02  0.641E-02    4.64       0.0  T
   2    -35.4760162 -0.343349E-05  0.374E-02    4.64       1.0  T
   3    -35.4760159  0.297544E-06  0.631E-03    4.64       2.9  T
   4    -35.4760163 -0.415779E-06  0.152E-03    4.64      12.0  T
   5    -35.4760164 -0.747156E-07  0.547E-04    4.64      33.4  T
     SCC iter.                  ...        0 min,  0.006 sec
     gradient                   ...        0 min,  0.014 sec
 * total energy  :   -34.8771664 Eh     change       -0.4544909E-03 Eh
   gradient norm :     0.0037185 Eh/α   predicted    -0.3587810E-03 ( -21.06%)
   displ. norm   :     0.2031241 α      lambda       -0.2893041E-03
   maximum displ.:     0.1128710 α      in ANC's #5, #2, #3, ...

........................................................................
.............................. CYCLE    4 ..............................
........................................................................
   1    -35.4781543 -0.354782E+02  0.760E-02    4.65       0.0  T
   2    -35.4781553 -0.101648E-05  0.449E-02    4.65       1.0  T
   3    -35.4781548  0.496846E-06  0.453E-03    4.65       4.0  T
   4    -35.4781554 -0.615712E-06  0.139E-03    4.65      13.1  T
   5    -35.4781555 -0.554383E-07  0.508E-04    4.65      35.9  T
   6    -35.4781555 -0.183401E-08  0.204E-04    4.65      89.5  T
     SCC iter.                  ...        0 min,  0.007 sec
     gradient                   ...        0 min,  0.014 sec
 * total energy  :   -34.8773970 Eh     change       -0.2306305E-03 Eh
   gradient norm :     0.0036812 Eh/α   predicted    -0.1506261E-03 ( -34.69%)
   displ. norm   :     0.2821724 α      lambda       -0.3030540E-03
   maximum displ.:     0.1610781 α      in ANC's #2, #5, #3, ...

........................................................................
.............................. CYCLE    5 ..............................
........................................................................
   1    -35.4774247 -0.354774E+02  0.108E-01    4.64       0.0  T
   2    -35.4774254 -0.620583E-06  0.640E-02    4.64       1.0  T
   3    -35.4774252  0.190990E-06  0.362E-03    4.64       5.0  T
   4    -35.4774256 -0.386194E-06  0.124E-03    4.64      14.8  T
   5    -35.4774256 -0.169239E-07  0.537E-04    4.64      34.0  T
   6    -35.4774256 -0.205898E-08  0.188E-04    4.64      96.9  T
     SCC iter.                  ...        0 min,  0.007 sec
     gradient                   ...        0 min,  0.014 sec
 * total energy  :   -34.8776325 Eh     change       -0.2354476E-03 Eh
   gradient norm :     0.0051625 Eh/α   predicted    -0.1636081E-03 ( -30.51%)
   displ. norm   :     0.2895296 α      lambda       -0.2299753E-03
   maximum displ.:     0.1778633 α      in ANC's #2, #5, #3, ...

........................................................................
.............................. CYCLE    6 ..............................
........................................................................
   1    -35.4760072 -0.354760E+02  0.109E-01    4.64       0.0  T
   2    -35.4760077 -0.474301E-06  0.646E-02    4.64       1.0  T
   3    -35.4760076  0.815811E-07  0.310E-03    4.64       5.9  T
   4    -35.4760079 -0.261353E-06  0.113E-03    4.64      16.2  T
   5    -35.4760079 -0.109914E-07  0.455E-04    4.64      40.1  T
     SCC iter.                  ...        0 min,  0.006 sec
     gradient                   ...        0 min,  0.014 sec
 * total energy  :   -34.8777982 Eh     change       -0.1656634E-03 Eh
   gradient norm :     0.0047498 Eh/α   predicted    -0.1246273E-03 ( -24.77%)
   displ. norm   :     0.1810580 α      lambda       -0.1173163E-03
   maximum displ.:     0.1284150 α      in ANC's #2, #3, #5, ...

........................................................................
.............................. CYCLE    7 ..............................
........................................................................
   1    -35.4761613 -0.354762E+02  0.639E-02    4.64       0.0  T
   2    -35.4761616 -0.258395E-06  0.378E-02    4.64       1.0  T
   3    -35.4761612  0.423159E-06  0.368E-03    4.64       5.0  T
   4    -35.4761617 -0.528072E-06  0.722E-04    4.64      25.3  T
   5    -35.4761617 -0.599886E-08  0.323E-04    4.64      56.6  T
     SCC iter.                  ...        0 min,  0.006 sec
     gradient                   ...        0 min,  0.014 sec
 * total energy  :   -34.8778848 Eh     change       -0.8668836E-04 Eh
   gradient norm :     0.0025620 Eh/α   predicted    -0.6058441E-04 ( -30.11%)
   displ. norm   :     0.1202516 α      lambda       -0.6500701E-04
   maximum displ.:     0.0973092 α      in ANC's #2, #6, #10, ...

........................................................................
.............................. CYCLE    8 ..............................
........................................................................
   1    -35.4768514 -0.354769E+02  0.401E-02    4.64       0.0  T
   2    -35.4768515 -0.130767E-06  0.238E-02    4.64       1.0  T
   3    -35.4768512  0.278904E-06  0.284E-03    4.64       6.4  T
   4    -35.4768515 -0.331361E-06  0.501E-04    4.64      36.5  T
   5    -35.4768515 -0.331982E-08  0.223E-04    4.64      82.0  T
     SCC iter.                  ...        0 min,  0.006 sec
     gradient                   ...        0 min,  0.014 sec
 * total energy  :   -34.8779344 Eh     change       -0.4952580E-04 Eh
   gradient norm :     0.0013347 Eh/α   predicted    -0.3298029E-04 ( -33.41%)
   displ. norm   :     0.1385165 α      lambda       -0.4025383E-04
   maximum displ.:     0.1148546 α      in ANC's #2, #6, #10, ...

........................................................................
.............................. CYCLE    9 ..............................
........................................................................
   1    -35.4774533 -0.354775E+02  0.487E-02    4.64       0.0  T
   2    -35.4774534 -0.137472E-06  0.289E-02    4.64       1.0  T
   3    -35.4774533  0.176671E-06  0.246E-03    4.64       7.4  T
   4    -35.4774535 -0.227604E-06  0.588E-04    4.64      31.0  T
   5    -35.4774535 -0.371239E-08  0.260E-04    4.64      70.1  T
     SCC iter.                  ...        0 min,  0.006 sec
     gradient                   ...        0 min,  0.014 sec
 * total energy  :   -34.8779794 Eh     change       -0.4500092E-04 Eh
   gradient norm :     0.0022468 Eh/α   predicted    -0.2032187E-04 ( -54.84%)
   displ. norm   :     0.0697579 α      lambda       -0.2768147E-04
   maximum displ.:     0.0530377 α      in ANC's #2, #8, #5, ...

........................................................................
.............................. CYCLE   10 ..............................
........................................................................
   1    -35.4773333 -0.354773E+02  0.257E-02    4.64       0.0  T
   2    -35.4773334 -0.340737E-07  0.152E-02    4.64       1.2  T
   3    -35.4773334  0.401727E-08  0.922E-04    4.64      19.8  T
   4    -35.4773334 -0.156444E-07  0.331E-04    4.64      55.1  T
     SCC iter.                  ...        0 min,  0.005 sec
     gradient                   ...        0 min,  0.014 sec
 * total energy  :   -34.8780038 Eh     change       -0.2441358E-04 Eh
   gradient norm :     0.0018111 Eh/α   predicted    -0.1390891E-04 ( -43.03%)
   displ. norm   :     0.1561478 α      lambda       -0.3677357E-04
   maximum displ.:     0.1030734 α      in ANC's #2, #1, #3, ...

........................................................................
.............................. CYCLE   11 ..............................
........................................................................
   1    -35.4771075 -0.354771E+02  0.602E-02    4.64       0.0  T
   2    -35.4771076 -0.177652E-06  0.355E-02    4.64       1.0  T
   3    -35.4771075  0.122622E-06  0.273E-03    4.64       6.7  T
   4    -35.4771077 -0.196602E-06  0.733E-04    4.64      24.9  T
   5    -35.4771077 -0.213264E-08  0.312E-04    4.64      58.5  T
     SCC iter.                  ...        0 min,  0.006 sec
     gradient                   ...        0 min,  0.015 sec
 * total energy  :   -34.8780415 Eh     change       -0.3773532E-04 Eh
   gradient norm :     0.0009971 Eh/α   predicted    -0.1858713E-04 ( -50.74%)
   displ. norm   :     0.0927485 α      lambda       -0.1504459E-04
   maximum displ.:     0.0696500 α      in ANC's #2, #1, #3, ...

........................................................................
.............................. CYCLE   12 ..............................
........................................................................
   1    -35.4768391 -0.354768E+02  0.311E-02    4.64       0.0  T
   2    -35.4768392 -0.630876E-07  0.184E-02    4.64       1.0  T
   3    -35.4768392  0.696945E-08  0.107E-03    4.64      17.1  T
   4    -35.4768392 -0.244927E-07  0.452E-04    4.64      40.4  T
   5    -35.4768392 -0.192652E-08  0.193E-04    4.64      94.5  T
     SCC iter.                  ...        0 min,  0.006 sec
     gradient                   ...        0 min,  0.014 sec
 * total energy  :   -34.8780583 Eh     change       -0.1676116E-04 Eh
   gradient norm :     0.0010251 Eh/α   predicted    -0.7551832E-05 ( -54.94%)
   displ. norm   :     0.0981548 α      lambda       -0.1442708E-04
   maximum displ.:     0.0700139 α      in ANC's #2, #1, #7, ...

........................................................................
.............................. CYCLE   13 ..............................
........................................................................
   1    -35.4769295 -0.354769E+02  0.335E-02    4.64       0.0  T
   2    -35.4769296 -0.434345E-07  0.198E-02    4.64       1.0  T
   3    -35.4769295  0.350690E-08  0.943E-04    4.64      19.4  T
   4    -35.4769296 -0.206964E-07  0.355E-04    4.64      51.4  T
     SCC iter.                  ...        0 min,  0.005 sec
     gradient                   ...        0 min,  0.014 sec
 * total energy  :   -34.8780754 Eh     change       -0.1710174E-04 Eh
   gradient norm :     0.0009555 Eh/α   predicted    -0.7246400E-05 ( -57.63%)
   displ. norm   :     0.1352894 α      lambda       -0.1497557E-04
   maximum displ.:     0.0954264 α      in ANC's #2, #1, #7, ...

........................................................................
.............................. CYCLE   14 ..............................
........................................................................
   1    -35.4768678 -0.354769E+02  0.464E-02    4.64       0.0  T
   2    -35.4768679 -0.893704E-07  0.275E-02    4.64       1.0  T
   3    -35.4768679  0.627597E-07  0.170E-03    4.64      10.7  T
   4    -35.4768680 -0.101596E-06  0.540E-04    4.64      33.8  T
   5    -35.4768680 -0.196077E-08  0.175E-04    4.64     104.3  T
     SCC iter.                  ...        0 min,  0.006 sec
     gradient                   ...        0 min,  0.014 sec
 * total energy  :   -34.8780893 Eh     change       -0.1391961E-04 Eh
   gradient norm :     0.0008924 Eh/α   predicted    -0.7550904E-05 ( -45.75%)
   displ. norm   :     0.0543888 α      lambda       -0.3795542E-05
   maximum displ.:     0.0345189 α      in ANC's #2, #5, #6, ...

........................................................................
.............................. CYCLE   15 ..............................
........................................................................
   1    -35.4771134 -0.354771E+02  0.197E-02    4.64       0.0  T
   2    -35.4771134 -0.239273E-07  0.117E-02    4.64       1.6  T
   3    -35.4771134  0.384398E-07  0.120E-03    4.64      15.3  T
   4    -35.4771134 -0.481247E-07  0.231E-04    4.64      78.9  T
   5    -35.4771134 -0.507207E-09  0.110E-04    4.64     166.7  T
     SCC iter.                  ...        0 min,  0.006 sec
     gradient                   ...        0 min,  0.015 sec
 * total energy  :   -34.8780918 Eh     change       -0.2524958E-05 Eh
   gradient norm :     0.0004299 Eh/α   predicted    -0.1900978E-05 ( -24.71%)
   displ. norm   :     0.0138037 α      lambda       -0.1261146E-05
   maximum displ.:     0.0076775 α      in ANC's #6, #5, #8, ...

   *** GEOMETRY OPTIMIZATION CONVERGED AFTER 15 ITERATIONS ***

------------------------------------------------------------------------
 total energy gain   :        -0.0046975 Eh       -2.9477 kcal/mol
 total RMSD          :         0.3096962 a0        0.1639 Å
 total power (kW/mol):        -0.8222221 (step)  -27.4737 (real)
------------------------------------------------------------------------

 ANCopt (total)                0 d,  0 h,  0 min,  0.449 sec
 optimizer setup                ...        0 min,  0.000 sec (  0.035%)
 model hessian                  ...        0 min,  0.012 sec (  2.636%)
 ANC generation                 ...        0 min,  0.001 sec (  0.206%)
 coordinate transformation      ...        0 min,  0.000 sec (  0.069%)
 single point calculation       ...        0 min,  0.431 sec ( 95.917%)
 optimization log               ...        0 min,  0.002 sec (  0.365%)
 hessian update                 ...        0 min,  0.000 sec (  0.048%)
 rational function              ...        0 min,  0.002 sec (  0.487%)

================
 final structure:
================
$coord
    2.59363209780786    0.07509833654603   -1.03385081391527      C 
    1.56770118206443    2.21469929489279    0.09577996494066      C 
    3.38852355520073    4.32081596545908    0.70317661598607      C 
    4.27907715118217    5.64415571343441   -1.70993015312886      C 
   -1.03314740197431    2.32953150873905    0.55597649692764      C 
   -2.20125609567581    4.59086354201089    1.84267699539115      C 
   -2.83692650336411    6.68552115828700   -0.04575065406895      C 
   -2.56619574947208    0.31783669511671   -0.22286259949968      C 
   -5.38498850131343    0.26591532301441    0.19083402994289      C 
   -6.03035755938569   -0.98295515211543    2.71845118344338      C 
   -1.48817363584786   -1.77974730029025   -1.37200323595217      C 
    1.08736243594784   -1.92217778755335   -1.76487939326172      C 
    4.61209980667157   -0.01582165843636   -1.33530592695008      H 
    5.03433858936641    3.52081871156897    1.66416126158031      H 
    2.55332158925002    5.71993360062993    1.95827763223380      H 
    5.23300462513323    4.31744034114420   -2.95559320899113      H 
    5.58509294098991    7.16478073924841   -1.25147209696916      H 
    2.68431558489818    6.43871343934194   -2.73469621589180      H 
   -0.91858326465139    5.33282695469823    3.27635831533654      H 
   -3.91929607243940    4.02924422645698    2.82660150461271      H 
   -1.13203953199231    7.39659266136166   -0.94139995468225      H 
   -3.77288805490051    8.25037984460226    0.90531213685477      H 
   -4.08268068842430    5.97378509347830   -1.51830828848555      H 
   -6.25614748478046   -0.82999923646778   -1.32666760470641      H 
   -6.19237292004333    2.15863630892658    0.12243916433209      H 
   -5.30996076116409   -2.90751140494852    2.76189897953883      H 
   -8.06706065854610   -1.03800617173218    2.99511351731622      H 
   -5.18366570477892    0.04749681298205    4.28286981085721      H 
   -2.69105179816453   -3.32318054779687   -1.95840700448670      H 
    1.91032404894254   -3.57310309431065   -2.63918783965207      H 
$end
           -------------------------------------------------
          |                Final Singlepoint                |
           -------------------------------------------------

          ...................................................
          :                      SETUP                      :
          :.................................................:
          :  # basis functions                  66          :
          :  # atomic orbitals                  66          :
          :  # shells                           42          :
          :  # electrons                        66          :
          :  max. iterations                   250          :
          :  Hamiltonian                  GFN2-xTB          :
          :  restarted?                      false          :
          :  GBSA solvation                  false          :
          :  PC potential                    false          :
          :  electronic temp.          300.0000000     K    :
          :  accuracy                    1.0000000          :
          :  -> integral cutoff          0.2500000E+02      :
          :  -> integral neglect         0.1000000E-07      :
          :  -> SCF convergence          0.1000000E-05 Eh   :
          :  -> wf. convergence          0.1000000E-03 e    :
          :  Broyden damping             0.4000000          :
          ...................................................

 iter      E             dE          RMSdq      gap      omega  full diag
   1    -35.4771134 -0.354771E+02  0.267E-05    4.64       0.0  T
   2    -35.4771134 -0.858336E-11  0.126E-05    4.64    1453.1  T
   3    -35.4771134 -0.346745E-11  0.716E-06    4.64    2550.6  T

   *** convergence criteria satisfied after 3 iterations ***

         #    Occupation            Energy/Eh            Energy/eV
      -------------------------------------------------------------
         1        2.0000           -0.6365815             -17.3223
       ...           ...                  ...                  ...
        27        2.0000           -0.4391682             -11.9504
        28        2.0000           -0.4309692             -11.7273
        29        2.0000           -0.4257763             -11.5860
        30        2.0000           -0.4062747             -11.0553
        31        2.0000           -0.4026746             -10.9573
        32        2.0000           -0.3812845             -10.3753
        33        2.0000           -0.3805030             -10.3540 (HOMO)
        34                         -0.2098622              -5.7106 (LUMO)
        35                         -0.2094146              -5.6985
        36                         -0.0866842              -2.3588
        37                          0.0836366               2.2759
        38                          0.0983252               2.6756
       ...                                ...                  ...
        66                          0.6577860              17.8993
      -------------------------------------------------------------
                  HL-Gap            0.1706408 Eh            4.6434 eV
             Fermi-level           -0.2951826 Eh           -8.0323 eV

 SCC (total)                   0 d,  0 h,  0 min,  0.027 sec
 SCC setup                      ...        0 min,  0.000 sec (  0.775%)
 Dispersion                     ...        0 min,  0.000 sec (  0.894%)
 integral evaluation            ...        0 min,  0.008 sec ( 28.862%)
 zeroth order Hamiltonian       ...        0 min,  0.000 sec (  0.595%)
 iterations                     ...        0 min,  0.004 sec ( 15.429%)
 molecular gradient             ...        0 min,  0.014 sec ( 51.898%)
 printout                       ...        0 min,  0.000 sec (  1.360%)

         :::::::::::::::::::::::::::::::::::::::::::::::::::::
         ::                     SUMMARY                     ::
         :::::::::::::::::::::::::::::::::::::::::::::::::::::
         :: total energy             -34.878091825480 Eh    ::
         :: gradient norm              0.000429891913 Eh/a0 ::
         :: HOMO-LUMO gap              4.643372724908 eV    ::
         ::.................................................::
         :: SCC energy               -35.477113441955 Eh    ::
         :: -> isotropic ES            0.004805412997 Eh    ::
         :: -> anisotropic ES          0.008950056220 Eh    ::
         :: -> anisotropic XC          0.021224432288 Eh    ::
         :: -> dispersion             -0.026459572380 Eh    ::
         :: repulsion energy           0.598709442575 Eh    ::
         :: add. restraining           0.000000000000 Eh    ::
         :::::::::::::::::::::::::::::::::::::::::::::::::::::

           -------------------------------------------------
          |                Property Printout                |
           -------------------------------------------------

    * Orbital Energies and Occupations

         #    Occupation            Energy/Eh            Energy/eV
      -------------------------------------------------------------
         1        2.0000           -0.6365815             -17.3223
       ...           ...                  ...                  ...
        21        2.0000           -0.4680345             -12.7359
        22        2.0000           -0.4635833             -12.6147
        23        2.0000           -0.4524471             -12.3117
        24        2.0000           -0.4462024             -12.1418
        25        2.0000           -0.4445966             -12.0981
        26        2.0000           -0.4422232             -12.0335
        27        2.0000           -0.4391682             -11.9504
        28        2.0000           -0.4309692             -11.7273
        29        2.0000           -0.4257763             -11.5860
        30        2.0000           -0.4062747             -11.0553
        31        2.0000           -0.4026746             -10.9573
        32        2.0000           -0.3812845             -10.3753
        33        2.0000           -0.3805030             -10.3540 (HOMO)
        34                         -0.2098622              -5.7106 (LUMO)
        35                         -0.2094146              -5.6985
        36                         -0.0866842              -2.3588
        37                          0.0836366               2.2759
        38                          0.0983252               2.6756
        39                          0.1170215               3.1843
        40                          0.1248160               3.3964
        41                          0.1273707               3.4659
        42                          0.1350440               3.6747
        43                          0.1375017               3.7416
        44                          0.1431502               3.8953
       ...                                ...                  ...
        66                          0.6577860              17.8993
      -------------------------------------------------------------
                  HL-Gap            0.1706408 Eh            4.6434 eV
             Fermi-level           -0.2951826 Eh           -8.0323 eV

     #   Z        covCN         q      C6AA      α(0)
     1   6 C      2.929    -0.044    29.081     8.844
     2   6 C      2.971     0.003    27.952     8.672
     3   6 C      3.808    -0.057    21.591     6.615
     4   6 C      3.753    -0.095    22.371     6.745
     5   6 C      2.971    -0.003    28.107     8.696
     6   6 C      3.805    -0.057    21.602     6.617
     7   6 C      3.752    -0.095    22.379     6.746
     8   6 C      2.972     0.003    27.960     8.674
     9   6 C      3.807    -0.058    21.606     6.617
    10   6 C      3.753    -0.096    22.391     6.748
    11   6 C      2.928    -0.044    29.099     8.846
    12   6 C      2.915    -0.038    28.937     8.821
    13   1 H      0.926     0.026     2.648     2.544
    14   1 H      0.924     0.033     2.548     2.496
    15   1 H      0.925     0.037     2.489     2.467
    16   1 H      0.925     0.035     2.518     2.482
    17   1 H      0.925     0.031     2.566     2.505
    18   1 H      0.925     0.032     2.559     2.502
    19   1 H      0.924     0.032     2.556     2.500
    20   1 H      0.925     0.039     2.461     2.453
    21   1 H      0.925     0.036     2.499     2.472
    22   1 H      0.925     0.030     2.588     2.516
    23   1 H      0.925     0.031     2.567     2.506
    24   1 H      0.924     0.033     2.543     2.494
    25   1 H      0.925     0.037     2.483     2.464
    26   1 H      0.925     0.035     2.521     2.483
    27   1 H      0.925     0.032     2.555     2.500
    28   1 H      0.925     0.032     2.554     2.499
    29   1 H      0.926     0.025     2.659     2.550
    30   1 H      0.926     0.024     2.672     2.556

 Mol. C6AA /au·bohr⁶  :       7889.231995
 Mol. C8AA /au·bohr⁸  :     178968.227360
 Mol. α(0) /au        :        137.629092


Wiberg/Mayer (AO) data.
largest (>0.10) Wiberg bond orders for each atom
          total WBO             WBO to atom ...
     1  C   3.991        C   12 1.446    C    2 1.410    H   13 0.969    C    8 0.107
     2  C   3.988        C    1 1.410    C    5 1.395    C    3 1.010    C   11 0.106
     3  C   3.997        C    2 1.010    C    4 1.003    H   14 0.971    H   15 0.969
     4  C   3.997        C    3 1.003    H   16 0.987    H   17 0.987    H   18 0.985
     5  C   3.987        C    2 1.395    C    8 1.386    C    6 1.010    C   12 0.104
     6  C   3.997        C    5 1.010    C    7 1.003    H   20 0.970    H   19 0.966
     7  C   3.997        C    6 1.003    H   23 0.987    H   22 0.987    H   21 0.984
     8  C   3.988        C   11 1.420    C    5 1.386    C    9 1.009    C    1 0.107
     9  C   3.997        C    8 1.009    C   10 1.002    H   24 0.974    H   25 0.971
    10  C   3.997        C    9 1.002    H   26 0.988    H   27 0.987    H   28 0.986
    11  C   3.991        C   12 1.436    C    8 1.420    H   29 0.969    C    2 0.106
    12  C   3.992        C    1 1.446    C   11 1.436    H   30 0.971    C    5 0.104
    13  H   0.999        C    1 0.969
    14  H   0.999        C    3 0.971
    15  H   0.998        C    3 0.969
    16  H   0.999        C    4 0.987
    17  H   0.998        C    4 0.987
    18  H   0.999        C    4 0.985
    19  H   0.999        C    6 0.966
    20  H   0.998        C    6 0.970
    21  H   0.999        C    7 0.984
    22  H   0.998        C    7 0.987
    23  H   0.999        C    7 0.987
    24  H   0.999        C    9 0.974
    25  H   0.998        C    9 0.971
    26  H   0.999        C   10 0.988
    27  H   0.998        C   10 0.987
    28  H   0.999        C   10 0.986
    29  H   0.999        C   11 0.969
    30  H   0.998        C   12 0.971

molecular dipole:
                 x           y           z       tot (Debye)
 q only:       -0.114       0.235       0.122
   full:       -0.107       0.233       0.113       0.712
molecular quadrupole (traceless):
                xx          xy          yy          xz          yz          zz
 q only:        0.974       0.321       0.561      -0.487       0.569      -1.534
  q+dip:        3.301       0.498       1.418      -0.745       3.567      -4.719
   full:        1.880       0.415       0.876      -0.546       1.685      -2.756

           -------------------------------------------------
          |                Geometry Summary                 |
           -------------------------------------------------

      molecular mass/u    :      162.2742000
   center of mass at/Å    :       -0.4032640       1.0122214       0.0119209
  moments of inertia/u·Å² :        0.3939232E+03   0.6685286E+03   0.9513506E+03
rotational constants/cm⁻¹ :        0.4279421E-01   0.2521602E-01   0.1771968E-01

 * 27 selected distances

     #   Z        #   Z                                     value/Å
     1   6 C      2   6 C                                 1.3906887
     3   6 C      4   6 C                                 1.5307222 (max)
     2   6 C      5   6 C                                 1.3990090
     6   6 C      7   6 C                                 1.5298465
     5   6 C      8   6 C                                 1.4004458
     9   6 C     10   6 C                                 1.5305053
     8   6 C     11   6 C                                 1.3882726
     1   6 C     12   6 C                                 1.3791504
    11   6 C     12   6 C                                 1.3807394
     1   6 C     13   1 H                                 1.0810450
     3   6 C     14   1 H                                 1.0937717
     3   6 C     15   1 H                                 1.0884047
     4   6 C     16   1 H                                 1.0873051
     4   6 C     17   1 H                                 1.0881204
     4   6 C     18   1 H                                 1.0876790
     6   6 C     19   1 H                                 1.0910811
     6   6 C     20   1 H                                 1.0890238
     7   6 C     21   1 H                                 1.0863546
     7   6 C     22   1 H                                 1.0882704
     7   6 C     23   1 H                                 1.0879578
     9   6 C     24   1 H                                 1.0925630
     9   6 C     25   1 H                                 1.0895065
    10   6 C     26   1 H                                 1.0876847
    10   6 C     27   1 H                                 1.0880652
    10   6 C     28   1 H                                 1.0878582
    11   6 C     29   1 H                                 1.0809955
    12   6 C     30   1 H                                 1.0802523 (min)

 * 2 distinct bonds (by element types)

   Z      Z             #   av. dist./Å        max./Å        min./Å
   1 H    6 C          18     1.0875522     1.0937717     1.0802523
   6 C    6 C           9     1.4365978     1.5307222     1.3791504


optimized geometry written to: xtbopt.xyz


           -------------------------------------------------
          | TOTAL ENERGY              -34.878091825480 Eh   |
          | GRADIENT NORM               0.000429891913 Eh/α |
          | HOMO-LUMO GAP               4.643372724908 eV   |
           -------------------------------------------------

------------------------------------------------------------------------
 * finished run on 2021/05/19 at 10:59:43.736     
------------------------------------------------------------------------
 total:
 * wall-time:     0 d,  0 h,  0 min,  0.533 sec
 *  cpu-time:     0 d,  0 h,  0 min,  0.530 sec
 * ratio c/w:     0.996 speedup
 SCF:
 * wall-time:     0 d,  0 h,  0 min,  0.036 sec
 *  cpu-time:     0 d,  0 h,  0 min,  0.036 sec
 * ratio c/w:     0.998 speedup
 ANC optimizer:
 * wall-time:     0 d,  0 h,  0 min,  0.477 sec
 *  cpu-time:     0 d,  0 h,  0 min,  0.476 sec
 * ratio c/w:     0.998 speedup

