      -----------------------------------------------------------      
     |                   =====================                   |     
     |                           x T B                           |     
     |                   =====================                   |     
     |                         S. Grimme                         |     
     |          Mulliken Center for Theoretical Chemistry        |     
     |                    University of Bonn                     |     
     |                Version 6.2 RC2 (SAW190805)                |     
      -----------------------------------------------------------      

   This program is distributed in the hope that it will be useful,
   but WITHOUT ANY WARRANTY; without even the implied warranty of
   MERCHANTABILITY or FITNESS FOR A PARTICULAR PURPOSE.
   
   FOR NON-COMMERCIAL, ACADEMIA USE ONLY.
   
   Cite this work as:
   * S. Grimme, C. Bannwarth, P. Shushkov, J. Chem. Theory Comput., 2017,
     13, 1989-2009. DOI: 10.1021/acs.jctc.7b00118
   * C. Bannwarth, S. Ehlert and S. Grimme., J. Chem. Theory Comput., 2019,
     15, 1652-1671. DOI: 10.1021/acs.jctc.8b01176
   * P. Pracht, E. Caldeweyher, S. Ehlert, S. Grimme, ChemRxiv, 2019, preprint.
     DOI: 10.26434/chemrxiv.8326202.v1
   
   for DFT-D4:
   * E. Caldeweyher, C. Bannwarth and S. Grimme, J. Chem. Phys., 2017,
     147, 034112. DOI: 10.1063/1.4993215
   * E. Caldeweyher, S. Ehlert, A. Hansen, H. Neugebauer, S. Spicher,
     C. Bannwarth and S. Grimme, J. Chem. Phys., 2019, 150, 154122.
     DOI: 10.1063/1.5090222
   
   for sTDA-xTB:
   * S. Grimme and C. Bannwarth, J. Chem. Phys., 2016, 145, 054103.
     DOI: 10.1063/1.4959605
   
   in the mass-spec context:
   * V. Asgeirsson, C. Bauer and S. Grimme, Chem. Sci., 2017, 8, 4879.
     DOI: 10.1039/c7sc00601b
   
   for metadynamics refer to:
   * S. Grimme, J. Chem. Theory Comput., 2019, 155, 2847-2862
     DOI: 10.1021/acs.jctc.9b00143
   
   with help from (in alphabetical order)
   C. Bannwarth, F. Bohle, G. Brandenburg, E. Caldeweyher, M. Checinski,
   S. Dohm, S. Ehlert, S. Ehrlich, F. März, H. Neugebauer, J. Pisarek,
   P. Pracht, P. Shushkov, and S. Spicher.
   
 * started run on 2021/05/19 at 10:59:43.754     

           -------------------------------------------------
          |                Calculation Setup                |
           -------------------------------------------------

          program call               : /ihome/ghutchison/geoffh/xtb/xtb 640.xyz -opt
          hostname                   : smp-n144
          coordinate file            : 640.xyz
          omp threads                :                     1
          number of atoms            :                    26
          number of electrons        :                    72
          charge                     :                     0
          spin                       :                   0.0
          first test random number   :      0.24407743464530


########################################################################
# WARNING! Please study the warnings concerning your input carefully
#  - the use of '-opt' is discouraged, please use '--opt' next time
########################################################################

           ------------------------------------------------- 
          |                 G F N 2 - x T B                 |
          | Geometry, Frequencies, Noncovalent interactions |
          |            JCTC 2019 parametrisation            |
           ------------------------------------------------- 
             KAB for C  - Si     :                1.0500
             KAB for H  - Pd     :                0.9500
             k(s)              :                1.8500
             k(p)              :                2.2300
             k(d)              :                2.2300
             k(f)              :                2.0000
             kEN (H0ij)        :               -2.0000
             D4 a1             :                0.5200
             D4 a2             :                5.0000
             D4 s6             :                1.0000
             D4 s8             :                2.7000
             D4 s9             :                5.0000
             alphaj            :                2.0000

  Z AO/shell   Hii/eV     exponent
  1     Wed Apr 25 08:07:45 CEST 2018   EN: 2.200 GM2: 0.406  GM3: 0.0800  RAES: 1.40
     1s    -10.707211    1.230000
  6     Wed Apr 25 08:07:45 CEST 2018   EN: 2.550 GM2: 0.538  GM3: 0.1500  RAES: 3.00
     2s    -13.970922    2.096432
     2p    -10.063292    1.800000
  8     Wed Apr 25 08:07:45 CEST 2018   EN: 3.440 GM2: 0.452  GM3:-0.0517  RAES: 1.80
     2s    -20.229985    2.439742
     2p    -15.503117    2.137023

           ------------------------------------------------- 
          |        Self-Consistent Charge Iterations        |
           ------------------------------------------------- 

          ...................................................
          :                      SETUP                      :
          :.................................................:
          :  # basis functions                  68          :
          :  # atomic orbitals                  68          :
          :  # shells                           40          :
          :  # electrons                        72          :
          :  max. iterations                   250          :
          :  Hamiltonian                  GFN2-xTB          :
          :  restarted?                      false          :
          :  GBSA solvation                  false          :
          :  PC potential                    false          :
          :  electronic temp.          300.0000000     K    :
          :  accuracy                    1.0000000          :
          :  -> integral cutoff          0.2500000E+02      :
          :  -> integral neglect         0.1000000E-07      :
          :  -> SCF convergence          0.1000000E-05 Eh   :
          :  -> wf. convergence          0.1000000E-03 e    :
          :  Broyden damping             0.4000000          :
          ...................................................

 iter      E             dE          RMSdq      gap      omega  full diag
   1    -40.3891317 -0.403891E+02  0.468E+00    1.36       0.0  T
   2    -40.4279757 -0.388440E-01  0.296E+00    1.23       1.0  T
   3    -40.4066312  0.213445E-01  0.177E+00    1.32       1.0  T
   4    -40.4452380 -0.386068E-01  0.457E-01    1.23       1.0  T
   5    -40.4468086 -0.157060E-02  0.878E-02    1.24       1.0  T
   6    -40.4467948  0.138479E-04  0.493E-02    1.24       1.0  T
   7    -40.4468092 -0.144645E-04  0.315E-02    1.24       1.0  T
   8    -40.4468239 -0.146444E-04  0.857E-03    1.24       2.3  T
   9    -40.4468247 -0.861896E-06  0.478E-03    1.24       4.1  T
  10    -40.4468251 -0.380445E-06  0.137E-03    1.24      14.3  T
  11    -40.4468251 -0.114252E-07  0.795E-04    1.24      24.7  T
  12    -40.4468251  0.715801E-09  0.493E-04    1.24      39.8  T

   *** convergence criteria satisfied after 12 iterations ***

         #    Occupation            Energy/Eh            Energy/eV
      -------------------------------------------------------------
         1        2.0000           -0.7116597             -19.3652
       ...           ...                  ...                  ...
        30        2.0000           -0.4380476             -11.9199
        31        2.0000           -0.4363472             -11.8736
        32        2.0000           -0.4327308             -11.7752
        33        2.0000           -0.4164914             -11.3333
        34        2.0000           -0.3976923             -10.8218
        35        2.0000           -0.3541552              -9.6371
        36        2.0000           -0.3534164              -9.6169 (HOMO)
        37                         -0.3078361              -8.3766 (LUMO)
        38                         -0.1864917              -5.0747
        39                         -0.1389999              -3.7824
        40                         -0.1369035              -3.7253
        41                         -0.0915824              -2.4921
       ...                                ...                  ...
        68                          0.7660242              20.8446
      -------------------------------------------------------------
                  HL-Gap            0.0455803 Eh            1.2403 eV
             Fermi-level           -0.3304487 Eh           -8.9920 eV

 SCC (total)                   0 d,  0 h,  0 min,  0.038 sec
 SCC setup                      ...        0 min,  0.000 sec (  0.805%)
 Dispersion                     ...        0 min,  0.000 sec (  1.090%)
 integral evaluation            ...        0 min,  0.009 sec ( 22.749%)
 zeroth order Hamiltonian       ...        0 min,  0.000 sec (  0.468%)
 iterations                     ...        0 min,  0.014 sec ( 37.555%)
 molecular gradient             ...        0 min,  0.014 sec ( 36.167%)
 printout                       ...        0 min,  0.000 sec (  1.016%)

         :::::::::::::::::::::::::::::::::::::::::::::::::::::
         ::                     SUMMARY                     ::
         :::::::::::::::::::::::::::::::::::::::::::::::::::::
         :: total energy             -39.853402828432 Eh    ::
         :: gradient norm              0.038167258290 Eh/a0 ::
         :: HOMO-LUMO gap              1.240303870005 eV    ::
         ::.................................................::
         :: SCC energy               -40.446825119393 Eh    ::
         :: -> isotropic ES            0.029277325338 Eh    ::
         :: -> anisotropic ES          0.005344036971 Eh    ::
         :: -> anisotropic XC          0.014547030971 Eh    ::
         :: -> dispersion             -0.023828631327 Eh    ::
         :: repulsion energy           0.593370620969 Eh    ::
         :: add. restraining           0.000000000000 Eh    ::
         :::::::::::::::::::::::::::::::::::::::::::::::::::::

      ----------------------------------------------------------- 
     |                   =====================                   |
     |                        A N C O P T                        |
     |                   =====================                   |
     |               Approximate Normal Coordinate               |
     |                Rational Function Optimizer                |
      ----------------------------------------------------------- 

          ...................................................
          :                      SETUP                      :
          :.................................................:
          :   optimization level            normal          :
          :   max. optcycles                   200          :
          :   ANC micro-cycles                  20          :
          :   degrees of freedom                72          :
          :.................................................:
          :   RF solver                   davidson          :
          :   input Hessian                  false          :
          :   write xtbopt.log                true          :
          :   linear?                        false          :
          :   energy convergence         0.5000000E-05 Eh   :
          :   grad. convergence          0.1000000E-02 Eh/α :
          :   maximium RF displ.         2.0000000          :
          :   Hlow (freq-cutoff)         0.5000000E-02      :
          :   Hmax (freq-cutoff)         5.0000000          :
          :   S6 in model hess.         20.0000000          :
          ...................................................

generating ANC from model Hessian ...
Using Lindh-Hessian (1995)
 Shifting diagonal of input Hessian by   4.604941649691195E-003
 Lowest  eigenvalues of input Hessian
   -0.000000   -0.000000   -0.000000   -0.000000    0.000000    0.000000
    0.005000    0.006770    0.007567    0.007976    0.009285    0.009359
    0.011097    0.011784    0.016487    0.016705    0.021827    0.022544
 Highest eigenvalues
    1.787343    1.897864    1.908527    2.049935    2.068375    2.132654
 

........................................................................
.............................. CYCLE    1 ..............................
........................................................................
   1    -40.4468251 -0.404468E+02  0.112E-04    1.24       0.0  T
   2    -40.4468251 -0.178559E-10  0.717E-05    1.24     273.5  T
   3    -40.4468251  0.432721E-11  0.581E-05    1.24     337.3  T
     SCC iter.                  ...        0 min,  0.004 sec
     gradient                   ...        0 min,  0.014 sec
 * total energy  :   -39.8534029 Eh     change       -0.2423366E-07 Eh
   gradient norm :     0.0381697 Eh/α   predicted     0.0000000E+00 (-100.00%)
   displ. norm   :     0.2190443 α      lambda       -0.3092818E-02
   maximum displ.:     0.0975144 α      in ANC's #4, #19, #5, ...

........................................................................
.............................. CYCLE    2 ..............................
........................................................................
   1    -40.4494628 -0.404495E+02  0.143E-01    1.22       0.0  T
   2    -40.4494916 -0.287813E-04  0.904E-02    1.22       1.0  T
   3    -40.4495020 -0.103668E-04  0.672E-02    1.22       1.0  T
   4    -40.4495353 -0.333501E-04  0.987E-03    1.22       2.0  T
   5    -40.4495370 -0.168676E-05  0.248E-03    1.22       7.9  T
   6    -40.4495371 -0.241986E-07  0.145E-03    1.22      13.5  T
     SCC iter.                  ...        0 min,  0.007 sec
     gradient                   ...        0 min,  0.013 sec
 * total energy  :   -39.8555805 Eh     change       -0.2177642E-02 Eh
   gradient norm :     0.0189746 Eh/α   predicted    -0.1620607E-02 ( -25.58%)
   displ. norm   :     0.2203713 α      lambda       -0.1169135E-02
   maximum displ.:     0.1255429 α      in ANC's #4, #5, #19, ...

........................................................................
.............................. CYCLE    3 ..............................
........................................................................
   1    -40.4512965 -0.404513E+02  0.145E-01    1.21       0.0  T
   2    -40.4513206 -0.240484E-04  0.906E-02    1.22       1.0  T
   3    -40.4513159  0.468900E-05  0.689E-02    1.22       1.0  T
   4    -40.4513565 -0.406135E-04  0.983E-03    1.22       2.0  T
   5    -40.4513582 -0.168319E-05  0.295E-03    1.22       6.7  T
   6    -40.4513582 -0.147137E-07  0.213E-03    1.22       9.2  T
     SCC iter.                  ...        0 min,  0.007 sec
     gradient                   ...        0 min,  0.013 sec
 * total energy  :   -39.8563039 Eh     change       -0.7234232E-03 Eh
   gradient norm :     0.0055492 Eh/α   predicted    -0.6129671E-03 ( -15.27%)
   displ. norm   :     0.1667894 α      lambda       -0.2584199E-03
   maximum displ.:     0.1085791 α      in ANC's #4, #5, #1, ...

........................................................................
.............................. CYCLE    4 ..............................
........................................................................
   1    -40.4515522 -0.404516E+02  0.102E-01    1.22       0.0  T
   2    -40.4515557 -0.344412E-05  0.627E-02    1.22       1.0  T
   3    -40.4515317  0.239411E-04  0.445E-02    1.22       1.0  T
   4    -40.4515611 -0.294118E-04  0.522E-03    1.22       3.8  T
   5    -40.4515615 -0.343227E-06  0.301E-03    1.22       6.5  T
   6    -40.4515616 -0.108614E-06  0.159E-03    1.22      12.3  T
   7    -40.4515616 -0.167158E-07  0.640E-04    1.22      30.6  T
     SCC iter.                  ...        0 min,  0.008 sec
     gradient                   ...        0 min,  0.013 sec
 * total energy  :   -39.8564964 Eh     change       -0.1924705E-03 Eh
   gradient norm :     0.0047909 Eh/α   predicted    -0.1328047E-03 ( -31.00%)
   displ. norm   :     0.1856007 α      lambda       -0.2035222E-03
   maximum displ.:     0.1172405 α      in ANC's #4, #1, #5, ...

........................................................................
.............................. CYCLE    5 ..............................
........................................................................
   1    -40.4518341 -0.404518E+02  0.109E-01    1.22       0.0  T
   2    -40.4518355 -0.145976E-05  0.671E-02    1.22       1.0  T
   3    -40.4518082  0.272954E-04  0.402E-02    1.22       1.0  T
   4    -40.4518390 -0.307429E-04  0.365E-03    1.22       5.4  T
   5    -40.4518391 -0.695605E-07  0.250E-03    1.22       7.8  T
   6    -40.4518391 -0.393815E-07  0.147E-03    1.22      13.3  T
     SCC iter.                  ...        0 min,  0.007 sec
     gradient                   ...        0 min,  0.013 sec
 * total energy  :   -39.8566475 Eh     change       -0.1511358E-03 Eh
   gradient norm :     0.0054302 Eh/α   predicted    -0.1052669E-03 ( -30.35%)
   displ. norm   :     0.1842409 α      lambda       -0.1519746E-03
   maximum displ.:     0.1155441 α      in ANC's #4, #1, #5, ...

........................................................................
.............................. CYCLE    6 ..............................
........................................................................
   1    -40.4521810 -0.404522E+02  0.102E-01    1.22       0.0  T
   2    -40.4521819 -0.828633E-06  0.625E-02    1.22       1.0  T
   3    -40.4521646  0.173079E-04  0.304E-02    1.23       1.0  T
   4    -40.4521837 -0.191388E-04  0.301E-03    1.23       6.5  T
   5    -40.4521837  0.362700E-07  0.251E-03    1.22       7.8  T
   6    -40.4521838 -0.884236E-07  0.964E-04    1.22      20.4  T
     SCC iter.                  ...        0 min,  0.007 sec
     gradient                   ...        0 min,  0.013 sec
 * total energy  :   -39.8567607 Eh     change       -0.1131989E-03 Eh
   gradient norm :     0.0049766 Eh/α   predicted    -0.7857037E-04 ( -30.59%)
   displ. norm   :     0.1840756 α      lambda       -0.1187225E-03
   maximum displ.:     0.1180964 α      in ANC's #1, #4, #2, ...

........................................................................
.............................. CYCLE    7 ..............................
........................................................................
   1    -40.4525494 -0.404525E+02  0.975E-02    1.23       0.0  T
   2    -40.4525503 -0.908179E-06  0.593E-02    1.23       1.0  T
   3    -40.4525415  0.884529E-05  0.215E-02    1.23       1.0  T
   4    -40.4525514 -0.992813E-05  0.268E-03    1.23       7.3  T
   5    -40.4525514 -0.119743E-07  0.183E-03    1.23      10.7  T
   6    -40.4525514 -0.422831E-08  0.127E-03    1.23      15.4  T
     SCC iter.                  ...        0 min,  0.007 sec
     gradient                   ...        0 min,  0.013 sec
 * total energy  :   -39.8568487 Eh     change       -0.8797044E-04 Eh
   gradient norm :     0.0038124 Eh/α   predicted    -0.6137619E-04 ( -30.23%)
   displ. norm   :     0.1535825 α      lambda       -0.7967828E-04
   maximum displ.:     0.1148442 α      in ANC's #1, #4, #2, ...

........................................................................
.............................. CYCLE    8 ..............................
........................................................................
   1    -40.4529536 -0.404530E+02  0.760E-02    1.22       0.0  T
   2    -40.4529543 -0.675468E-06  0.460E-02    1.22       1.0  T
   3    -40.4529522  0.202808E-05  0.110E-02    1.22       1.8  T
   4    -40.4529547 -0.243660E-05  0.224E-03    1.22       8.7  T
   5    -40.4529547 -0.434380E-07  0.121E-03    1.22      16.1  T
   6    -40.4529547  0.231972E-08  0.625E-04    1.22      31.4  T
   7    -40.4529547 -0.627727E-08  0.170E-04    1.22     115.3  T
     SCC iter.                  ...        0 min,  0.008 sec
     gradient                   ...        0 min,  0.014 sec
 * total energy  :   -39.8569070 Eh     change       -0.5834577E-04 Eh
   gradient norm :     0.0022051 Eh/α   predicted    -0.4077913E-04 ( -30.11%)
   displ. norm   :     0.1273057 α      lambda       -0.4740460E-04
   maximum displ.:     0.1023520 α      in ANC's #1, #4, #3, ...

........................................................................
.............................. CYCLE    9 ..............................
........................................................................
   1    -40.4529839 -0.404530E+02  0.621E-02    1.22       0.0  T
   2    -40.4529843 -0.335772E-06  0.375E-02    1.22       1.0  T
   3    -40.4529838  0.476919E-06  0.596E-03    1.22       3.3  T
   4    -40.4529845 -0.673230E-06  0.180E-03    1.22      10.9  T
   5    -40.4529845 -0.161233E-07  0.111E-03    1.22      17.6  T
   6    -40.4529845 -0.385658E-08  0.688E-04    1.22      28.5  T
   7    -40.4529845 -0.864551E-08  0.894E-05    1.22     219.3  T
     SCC iter.                  ...        0 min,  0.008 sec
     gradient                   ...        0 min,  0.014 sec
 * total energy  :   -39.8569429 Eh     change       -0.3588676E-04 Eh
   gradient norm :     0.0015085 Eh/α   predicted    -0.2409010E-04 ( -32.87%)
   displ. norm   :     0.1320658 α      lambda       -0.3546404E-04
   maximum displ.:     0.1154964 α      in ANC's #1, #5, #3, ...

........................................................................
.............................. CYCLE   10 ..............................
........................................................................
   1    -40.4537059 -0.404537E+02  0.597E-02    1.22       0.0  T
   2    -40.4537061 -0.198033E-06  0.356E-02    1.22       1.0  T
   3    -40.4537030  0.309219E-05  0.129E-02    1.22       1.5  T
   4    -40.4537064 -0.339974E-05  0.131E-03    1.22      15.0  T
   5    -40.4537064 -0.573937E-08  0.840E-04    1.22      23.4  T
   6    -40.4537064 -0.291200E-08  0.520E-04    1.22      37.7  T
     SCC iter.                  ...        0 min,  0.007 sec
     gradient                   ...        0 min,  0.014 sec
 * total energy  :   -39.8569749 Eh     change       -0.3192944E-04 Eh
   gradient norm :     0.0031175 Eh/α   predicted    -0.1787625E-04 ( -44.01%)
   displ. norm   :     0.0888026 α      lambda       -0.3581379E-04
   maximum displ.:     0.0712719 α      in ANC's #1, #3, #6, ...

........................................................................
.............................. CYCLE   11 ..............................
........................................................................
   1    -40.4530390 -0.404530E+02  0.453E-02    1.22       0.0  T
   2    -40.4530391 -0.148273E-06  0.272E-02    1.22       1.0  T
   3    -40.4530388  0.254379E-06  0.418E-03    1.22       4.7  T
   4    -40.4530392 -0.341689E-06  0.135E-03    1.22      14.5  T
   5    -40.4530392 -0.945902E-08  0.751E-04    1.22      26.1  T
   6    -40.4530392 -0.365299E-08  0.373E-04    1.22      52.6  T
     SCC iter.                  ...        0 min,  0.007 sec
     gradient                   ...        0 min,  0.014 sec
 * total energy  :   -39.8570011 Eh     change       -0.2626332E-04 Eh
   gradient norm :     0.0023399 Eh/α   predicted    -0.1804910E-04 ( -31.28%)
   displ. norm   :     0.0689334 α      lambda       -0.2693539E-04
   maximum displ.:     0.0518249 α      in ANC's #1, #3, #5, ...

........................................................................
.............................. CYCLE   12 ..............................
........................................................................
   1    -40.4528949 -0.404529E+02  0.356E-02    1.22       0.0  T
   2    -40.4528950 -0.973249E-07  0.213E-02    1.22       1.0  T
   3    -40.4528947  0.205888E-06  0.360E-03    1.22       5.4  T
   4    -40.4528950 -0.250885E-06  0.104E-03    1.22      18.8  T
   5    -40.4528950 -0.102461E-07  0.645E-04    1.22      30.4  T
   6    -40.4528950 -0.229346E-08  0.366E-04    1.22      53.5  T
     SCC iter.                  ...        0 min,  0.007 sec
     gradient                   ...        0 min,  0.014 sec
 * total energy  :   -39.8570233 Eh     change       -0.2223066E-04 Eh
   gradient norm :     0.0016614 Eh/α   predicted    -0.1353377E-04 ( -39.12%)
   displ. norm   :     0.1375589 α      lambda       -0.2970836E-04
   maximum displ.:     0.0993509 α      in ANC's #1, #4, #3, ...

........................................................................
.............................. CYCLE   13 ..............................
........................................................................
   1    -40.4527706 -0.404528E+02  0.742E-02    1.22       0.0  T
   2    -40.4527710 -0.472325E-06  0.447E-02    1.22       1.0  T
   3    -40.4527686  0.249572E-05  0.119E-02    1.22       1.6  T
   4    -40.4527714 -0.284053E-05  0.245E-03    1.22       8.0  T
   5    -40.4527714 -0.418166E-07  0.160E-03    1.22      12.3  T
   6    -40.4527715 -0.188346E-07  0.743E-04    1.22      26.4  T
   7    -40.4527715 -0.745059E-08  0.153E-04    1.22     128.0  T
     SCC iter.                  ...        0 min,  0.008 sec
     gradient                   ...        0 min,  0.014 sec
 * total energy  :   -39.8570528 Eh     change       -0.2943743E-04 Eh
   gradient norm :     0.0013052 Eh/α   predicted    -0.1498264E-04 ( -49.10%)
   displ. norm   :     0.0740881 α      lambda       -0.1188593E-04
   maximum displ.:     0.0621861 α      in ANC's #1, #3, #4, ...

........................................................................
.............................. CYCLE   14 ..............................
........................................................................
   1    -40.4529141 -0.404529E+02  0.373E-02    1.22       0.0  T
   2    -40.4529142 -0.123785E-06  0.227E-02    1.22       1.0  T
   3    -40.4529136  0.617120E-06  0.596E-03    1.22       3.3  T
   4    -40.4529143 -0.728455E-06  0.113E-03    1.22      17.3  T
   5    -40.4529143  0.749822E-09  0.896E-04    1.22      21.9  T
   6    -40.4529143 -0.104230E-07  0.193E-04    1.22     101.8  T
     SCC iter.                  ...        0 min,  0.007 sec
     gradient                   ...        0 min,  0.014 sec
 * total energy  :   -39.8570685 Eh     change       -0.1572322E-04 Eh
   gradient norm :     0.0013092 Eh/α   predicted    -0.5959829E-05 ( -62.10%)
   displ. norm   :     0.0759084 α      lambda       -0.1455842E-04
   maximum displ.:     0.0667887 α      in ANC's #1, #5, #3, ...

........................................................................
.............................. CYCLE   15 ..............................
........................................................................
   1    -40.4531576 -0.404532E+02  0.349E-02    1.22       0.0  T
   2    -40.4531577 -0.130394E-06  0.213E-02    1.22       1.0  T
   3    -40.4531573  0.409399E-06  0.458E-03    1.22       4.3  T
   4    -40.4531578 -0.519934E-06  0.894E-04    1.22      21.9  T
   5    -40.4531578 -0.907356E-09  0.481E-04    1.22      40.8  T
     SCC iter.                  ...        0 min,  0.006 sec
     gradient                   ...        0 min,  0.014 sec
 * total energy  :   -39.8570867 Eh     change       -0.1822500E-04 Eh
   gradient norm :     0.0008591 Eh/α   predicted    -0.7299747E-05 ( -59.95%)
   displ. norm   :     0.0803512 α      lambda       -0.1191484E-04
   maximum displ.:     0.0732196 α      in ANC's #1, #5, #2, ...

........................................................................
.............................. CYCLE   16 ..............................
........................................................................
   1    -40.4531292 -0.404531E+02  0.335E-02    1.22       0.0  T
   2    -40.4531293 -0.102591E-06  0.203E-02    1.22       1.0  T
   3    -40.4531289  0.368156E-06  0.452E-03    1.22       4.3  T
   4    -40.4531293 -0.444480E-06  0.989E-04    1.22      19.8  T
   5    -40.4531293 -0.421706E-08  0.659E-04    1.22      29.8  T
     SCC iter.                  ...        0 min,  0.006 sec
     gradient                   ...        0 min,  0.014 sec
 * total energy  :   -39.8571014 Eh     change       -0.1464907E-04 Eh
   gradient norm :     0.0006404 Eh/α   predicted    -0.5977334E-05 ( -59.20%)
   displ. norm   :     0.0579155 α      lambda       -0.7277271E-05
   maximum displ.:     0.0549591 α      in ANC's #1, #5, #2, ...

........................................................................
.............................. CYCLE   17 ..............................
........................................................................
   1    -40.4531828 -0.404532E+02  0.222E-02    1.22       0.0  T
   2    -40.4531828 -0.272382E-07  0.134E-02    1.22       1.5  T
   3    -40.4531827  0.174858E-06  0.306E-03    1.22       6.4  T
   4    -40.4531829 -0.200335E-06  0.563E-04    1.22      34.8  T
   5    -40.4531829 -0.456886E-09  0.410E-04    1.22      47.9  T
     SCC iter.                  ...        0 min,  0.006 sec
     gradient                   ...        0 min,  0.014 sec
 * total energy  :   -39.8571110 Eh     change       -0.9638333E-05 Eh
   gradient norm :     0.0005876 Eh/α   predicted    -0.3648526E-05 ( -62.15%)
   displ. norm   :     0.0402901 α      lambda       -0.5216205E-05
   maximum displ.:     0.0386568 α      in ANC's #1, #3, #4, ...

........................................................................
.............................. CYCLE   18 ..............................
........................................................................
   1    -40.4532081 -0.404532E+02  0.146E-02    1.22       0.0  T
   2    -40.4532081 -0.311892E-08  0.868E-03    1.22       2.3  T
   3    -40.4532079  0.208292E-06  0.326E-03    1.22       6.0  T
   4    -40.4532082 -0.222410E-06  0.363E-04    1.22      54.0  T
   5    -40.4532082 -0.168045E-08  0.200E-04    1.22      98.2  T
     SCC iter.                  ...        0 min,  0.006 sec
     gradient                   ...        0 min,  0.014 sec
 * total energy  :   -39.8571185 Eh     change       -0.7436954E-05 Eh
   gradient norm :     0.0005614 Eh/α   predicted    -0.2614802E-05 ( -64.84%)
   displ. norm   :     0.0395135 α      lambda       -0.3936314E-05
   maximum displ.:     0.0378470 α      in ANC's #1, #3, #4, ...

........................................................................
.............................. CYCLE   19 ..............................
........................................................................
   1    -40.4532274 -0.404532E+02  0.143E-02    1.22       0.0  T
   2    -40.4532274 -0.176378E-08  0.853E-03    1.22       2.3  T
   3    -40.4532272  0.258065E-06  0.359E-03    1.22       5.5  T
   4    -40.4532274 -0.273989E-06  0.406E-04    1.22      48.3  T
   5    -40.4532274 -0.264593E-08  0.191E-04    1.22     102.8  T
     SCC iter.                  ...        0 min,  0.006 sec
     gradient                   ...        0 min,  0.014 sec
 * total energy  :   -39.8571248 Eh     change       -0.6354806E-05 Eh
   gradient norm :     0.0007268 Eh/α   predicted    -0.1970976E-05 ( -68.98%)
   displ. norm   :     0.0405404 α      lambda       -0.3045566E-05
   maximum displ.:     0.0389183 α      in ANC's #1, #3, #4, ...

........................................................................
.............................. CYCLE   20 ..............................
........................................................................
   1    -40.4532301 -0.404532E+02  0.147E-02    1.22       0.0  T
   2    -40.4532301 -0.200987E-08  0.872E-03    1.22       2.2  T
   3    -40.4532299  0.270588E-06  0.368E-03    1.22       5.3  T
   4    -40.4532302 -0.287384E-06  0.424E-04    1.22      46.2  T
   5    -40.4532302 -0.292957E-08  0.194E-04    1.22     100.8  T
     SCC iter.                  ...        0 min,  0.006 sec
     gradient                   ...        0 min,  0.014 sec
 * total energy  :   -39.8571304 Eh     change       -0.5634142E-05 Eh
   gradient norm :     0.0009840 Eh/α   predicted    -0.1526459E-05 ( -72.91%)
   displ. norm   :     0.0396012 α      lambda       -0.2002624E-05
   maximum displ.:     0.0379396 α      in ANC's #1, #3, #4, ...
 * RMSD in coord.:     0.3546903 α      energy gain  -0.3727620E-02 Eh

generating ANC from model Hessian ...
Using Lindh-Hessian (1995)
 Shifting diagonal of input Hessian by   4.602017578303616E-003
 Lowest  eigenvalues of input Hessian
   -0.000000   -0.000000    0.000000    0.000000    0.000000    0.000000
    0.005000    0.006701    0.007642    0.008106    0.009310    0.009519
    0.011544    0.011757    0.016906    0.017193    0.022357    0.022550
 Highest eigenvalues
    1.805846    1.898345    1.917142    2.044353    2.068668    2.131082
 

........................................................................
.............................. CYCLE   21 ..............................
........................................................................
   1    -40.4532282 -0.404532E+02  0.144E-02    1.22       0.0  T
   2    -40.4532282 -0.181709E-08  0.854E-03    1.22       2.3  T
   3    -40.4532279  0.277778E-06  0.374E-03    1.22       5.2  T
   4    -40.4532282 -0.295334E-06  0.428E-04    1.22      45.8  T
   5    -40.4532282 -0.304538E-08  0.192E-04    1.22     102.4  T
     SCC iter.                  ...        0 min,  0.006 sec
     gradient                   ...        0 min,  0.014 sec
 * total energy  :   -39.8571350 Eh     change       -0.4556479E-05 Eh
   gradient norm :     0.0012863 Eh/α   predicted     0.0000000E+00 (-100.00%)
   displ. norm   :     0.0505308 α      lambda       -0.1005934E-04
   maximum displ.:     0.0441687 α      in ANC's #1, #5, #3, ...

........................................................................
.............................. CYCLE   22 ..............................
........................................................................
   1    -40.4530801 -0.404531E+02  0.228E-02    1.22       0.0  T
   2    -40.4530801 -0.143812E-07  0.137E-02    1.22       1.4  T
   3    -40.4530792  0.882650E-06  0.650E-03    1.22       3.0  T
   4    -40.4530801 -0.936996E-06  0.842E-04    1.22      23.3  T
   5    -40.4530801 -0.109940E-07  0.415E-04    1.22      47.2  T
     SCC iter.                  ...        0 min,  0.006 sec
     gradient                   ...        0 min,  0.014 sec
 * total energy  :   -39.8571446 Eh     change       -0.9595080E-05 Eh
   gradient norm :     0.0006627 Eh/α   predicted    -0.5035647E-05 ( -47.52%)
   displ. norm   :     0.0299256 α      lambda       -0.4543781E-05
   maximum displ.:     0.0238691 α      in ANC's #1, #3, #5, ...

........................................................................
.............................. CYCLE   23 ..............................
........................................................................
   1    -40.4530443 -0.404530E+02  0.137E-02    1.22       0.0  T
   2    -40.4530443 -0.434217E-08  0.827E-03    1.22       2.4  T
   3    -40.4530438  0.488712E-06  0.499E-03    1.22       3.9  T
   4    -40.4530443 -0.523002E-06  0.610E-04    1.22      32.1  T
   5    -40.4530443 -0.617980E-08  0.291E-04    1.22      67.4  T
     SCC iter.                  ...        0 min,  0.006 sec
     gradient                   ...        0 min,  0.014 sec
 * total energy  :   -39.8571499 Eh     change       -0.5261101E-05 Eh
   gradient norm :     0.0003930 Eh/α   predicted    -0.2274080E-05 ( -56.78%)
   displ. norm   :     0.0380940 α      lambda       -0.3732357E-05
   maximum displ.:     0.0308172 α      in ANC's #1, #3, #5, ...

........................................................................
.............................. CYCLE   24 ..............................
........................................................................
   1    -40.4531299 -0.404531E+02  0.161E-02    1.22       0.0  T
   2    -40.4531299 -0.806102E-08  0.965E-03    1.22       2.0  T
   3    -40.4531297  0.289918E-06  0.389E-03    1.22       5.0  T
   4    -40.4531300 -0.310742E-06  0.478E-04    1.22      41.1  T
   5    -40.4531300 -0.230027E-08  0.303E-04    1.22      64.7  T
     SCC iter.                  ...        0 min,  0.006 sec
     gradient                   ...        0 min,  0.014 sec
 * total energy  :   -39.8571544 Eh     change       -0.4555093E-05 Eh
   gradient norm :     0.0004719 Eh/α   predicted    -0.1867977E-05 ( -58.99%)
   displ. norm   :     0.0372648 α      lambda       -0.3080414E-05
   maximum displ.:     0.0305241 α      in ANC's #1, #3, #2, ...

   *** GEOMETRY OPTIMIZATION CONVERGED AFTER 24 ITERATIONS ***

------------------------------------------------------------------------
 total energy gain   :        -0.0037516 Eh       -2.3542 kcal/mol
 total RMSD          :         0.3657794 a0        0.1936 Å
 total power (kW/mol):        -0.4104080 (step)  -13.6134 (real)
------------------------------------------------------------------------

 ANCopt (total)                0 d,  0 h,  0 min,  0.724 sec
 optimizer setup                ...        0 min,  0.000 sec (  0.022%)
 model hessian                  ...        0 min,  0.008 sec (  1.045%)
 ANC generation                 ...        0 min,  0.002 sec (  0.211%)
 coordinate transformation      ...        0 min,  0.000 sec (  0.063%)
 single point calculation       ...        0 min,  0.706 sec ( 97.637%)
 optimization log               ...        0 min,  0.002 sec (  0.343%)
 hessian update                 ...        0 min,  0.000 sec (  0.043%)
 rational function              ...        0 min,  0.003 sec (  0.424%)

================
 final structure:
================
$coord
    0.86070582354705   -1.95013670868205    0.63290140874975      C 
    1.90002050799061    0.36281542855007    0.39880935669981      C 
   -0.10516414052401    2.22569535534726    0.50366830790977      C 
   -2.46632657152691    0.75149733107986    0.84255743794124      C 
   -1.86173304519327   -1.72603920508572    0.91847048847323      C 
   -4.73514106773357    1.90841236162145    1.04727707671930      O 
   -6.82428283582402    0.31231369473109    1.44749667854657      C 
    0.10125964618297    4.77170341619201    0.32101154045996      C 
   -1.91140250203715    6.62958372855911    0.34672132680345      C 
   -0.87374207773654    8.94128536938599    0.09404576528603      C 
    1.85800056950688    8.72369062010813   -0.08965580336898      C 
    2.46726162960579    6.24939601503295    0.03802588248720      C 
    4.74921600672949    5.10163167634038   -0.02779385168031      O 
    6.85716641420639    6.71237206524295   -0.21812941981049      C 
    1.83791227356258   -3.73195218035792    0.61772209725536      H 
    3.85324090953456    0.83038275320243    0.15498279049029      H 
   -3.10571756793999   -3.31248652330162    1.14559172704916      H 
   -8.46766802942427    1.53991173374939    1.60684980408619      H 
   -6.60201009311382   -0.78111345183620    3.18976178530132      H 
   -7.08254198801371   -0.99104466598347   -0.13824596648005      H 
   -3.87077481032275    6.15744229788763    0.52279917514208      H 
   -1.85794674049572   10.71827300250966    0.03281080648871      H 
    3.10416003707273   10.31165400276684   -0.29267454374431      H 
    8.51684856777154    5.49668276864010   -0.20562081903469      H 
    6.94083861800078    8.01947362814101    1.38333532537068      H 
    6.80718560631692    7.80183781125284   -1.97604485794875      H 
$end
           -------------------------------------------------
          |                Final Singlepoint                |
           -------------------------------------------------

          ...................................................
          :                      SETUP                      :
          :.................................................:
          :  # basis functions                  68          :
          :  # atomic orbitals                  68          :
          :  # shells                           40          :
          :  # electrons                        72          :
          :  max. iterations                   250          :
          :  Hamiltonian                  GFN2-xTB          :
          :  restarted?                      false          :
          :  GBSA solvation                  false          :
          :  PC potential                    false          :
          :  electronic temp.          300.0000000     K    :
          :  accuracy                    1.0000000          :
          :  -> integral cutoff          0.2500000E+02      :
          :  -> integral neglect         0.1000000E-07      :
          :  -> SCF convergence          0.1000000E-05 Eh   :
          :  -> wf. convergence          0.1000000E-03 e    :
          :  Broyden damping             0.4000000          :
          ...................................................

 iter      E             dE          RMSdq      gap      omega  full diag
   1    -40.4531300 -0.404531E+02  0.122E-04    1.22       0.0  T
   2    -40.4531300  0.621725E-11  0.583E-05    1.22     336.3  T
   3    -40.4531300  0.197034E-10  0.779E-05    1.22     251.6  T

   *** convergence criteria satisfied after 3 iterations ***

         #    Occupation            Energy/Eh            Energy/eV
      -------------------------------------------------------------
         1        2.0000           -0.7150570             -19.4577
       ...           ...                  ...                  ...
        30        2.0000           -0.4387342             -11.9386
        31        2.0000           -0.4360537             -11.8656
        32        2.0000           -0.4344481             -11.8219
        33        2.0000           -0.4152846             -11.3005
        34        2.0000           -0.3957035             -10.7676
        35        2.0000           -0.3526851              -9.5971
        36        2.0000           -0.3516592              -9.5691 (HOMO)
        37                         -0.3066967              -8.3456 (LUMO)
        38                         -0.1845581              -5.0221
        39                         -0.1383911              -3.7658
        40                         -0.1372977              -3.7361
        41                         -0.0900093              -2.4493
       ...                                ...                  ...
        68                          0.7625113              20.7490
      -------------------------------------------------------------
                  HL-Gap            0.0449624 Eh            1.2235 eV
             Fermi-level           -0.3290401 Eh           -8.9536 eV

 SCC (total)                   0 d,  0 h,  0 min,  0.027 sec
 SCC setup                      ...        0 min,  0.000 sec (  0.773%)
 Dispersion                     ...        0 min,  0.000 sec (  0.769%)
 integral evaluation            ...        0 min,  0.009 sec ( 31.514%)
 zeroth order Hamiltonian       ...        0 min,  0.000 sec (  0.581%)
 iterations                     ...        0 min,  0.004 sec ( 15.202%)
 molecular gradient             ...        0 min,  0.014 sec ( 49.709%)
 printout                       ...        0 min,  0.000 sec (  1.226%)

         :::::::::::::::::::::::::::::::::::::::::::::::::::::
         ::                     SUMMARY                     ::
         :::::::::::::::::::::::::::::::::::::::::::::::::::::
         :: total energy             -39.857154423297 Eh    ::
         :: gradient norm              0.000470735947 Eh/a0 ::
         :: HOMO-LUMO gap              1.223489714653 eV    ::
         ::.................................................::
         :: SCC energy               -40.453129972632 Eh    ::
         :: -> isotropic ES            0.028325636374 Eh    ::
         :: -> anisotropic ES          0.004691684737 Eh    ::
         :: -> anisotropic XC          0.014340006766 Eh    ::
         :: -> dispersion             -0.023886698487 Eh    ::
         :: repulsion energy           0.595932422801 Eh    ::
         :: add. restraining           0.000000000000 Eh    ::
         :::::::::::::::::::::::::::::::::::::::::::::::::::::

           -------------------------------------------------
          |                Property Printout                |
           -------------------------------------------------

    * Orbital Energies and Occupations

         #    Occupation            Energy/Eh            Energy/eV
      -------------------------------------------------------------
         1        2.0000           -0.7150570             -19.4577
       ...           ...                  ...                  ...
        24        2.0000           -0.4741776             -12.9030
        25        2.0000           -0.4694096             -12.7733
        26        2.0000           -0.4597869             -12.5114
        27        2.0000           -0.4447787             -12.1030
        28        2.0000           -0.4447669             -12.1027
        29        2.0000           -0.4399462             -11.9715
        30        2.0000           -0.4387342             -11.9386
        31        2.0000           -0.4360537             -11.8656
        32        2.0000           -0.4344481             -11.8219
        33        2.0000           -0.4152846             -11.3005
        34        2.0000           -0.3957035             -10.7676
        35        2.0000           -0.3526851              -9.5971
        36        2.0000           -0.3516592              -9.5691 (HOMO)
        37                         -0.3066967              -8.3456 (LUMO)
        38                         -0.1845581              -5.0221
        39                         -0.1383911              -3.7658
        40                         -0.1372977              -3.7361
        41                         -0.0900093              -2.4493
        42                          0.0169161               0.4603
        43                          0.0350607               0.9541
        44                          0.0865711               2.3557
        45                          0.1078891               2.9358
        46                          0.1104676               3.0060
        47                          0.1223906               3.3304
       ...                                ...                  ...
        68                          0.7625113              20.7490
      -------------------------------------------------------------
                  HL-Gap            0.0449624 Eh            1.2235 eV
             Fermi-level           -0.3290401 Eh           -8.9536 eV

     #   Z        covCN         q      C6AA      α(0)
     1   6 C      3.035    -0.029    28.688     8.785
     2   6 C      2.986    -0.068    29.678     8.936
     3   6 C      3.073     0.021    27.467     8.593
     4   6 C      2.962     0.127    25.208     8.235
     5   6 C      3.000    -0.092    30.300     9.030
     6   8 O      1.704    -0.254    18.203     5.760
     7   6 C      3.658     0.036    20.245     6.458
     8   6 C      3.073     0.021    27.467     8.593
     9   6 C      2.986    -0.068    29.678     8.936
    10   6 C      3.035    -0.029    28.689     8.785
    11   6 C      3.000    -0.092    30.300     9.030
    12   6 C      2.962     0.127    25.208     8.235
    13   8 O      1.704    -0.254    18.205     5.761
    14   6 C      3.658     0.036    20.245     6.458
    15   1 H      0.926     0.032     2.552     2.498
    16   1 H      0.926     0.052     2.289     2.366
    17   1 H      0.926     0.026     2.648     2.545
    18   1 H      0.925     0.061     2.190     2.314
    19   1 H      0.924     0.043     2.405     2.425
    20   1 H      0.924     0.043     2.406     2.426
    21   1 H      0.926     0.052     2.289     2.366
    22   1 H      0.926     0.032     2.552     2.498
    23   1 H      0.926     0.026     2.648     2.545
    24   1 H      0.925     0.061     2.189     2.314
    25   1 H      0.924     0.043     2.404     2.425
    26   1 H      0.924     0.043     2.405     2.425

 Mol. C6AA /au·bohr⁶  :       7947.849992
 Mol. C8AA /au·bohr⁸  :     190605.537395
 Mol. α(0) /au        :        140.741518


Wiberg/Mayer (AO) data.
largest (>0.10) Wiberg bond orders for each atom
          total WBO             WBO to atom ...
     1  C   3.943        C    2 1.721    C    5 1.112    H   15 0.974
     2  C   3.979        C    1 1.721    C    3 1.123    H   16 0.967
     3  C   3.982        C    8 1.598    C    2 1.123    C    4 1.024
     4  C   3.928        C    5 1.658    O    6 1.073    C    3 1.024
     5  C   3.959        C    4 1.658    C    1 1.112    H   17 0.972    O    6 0.110
     6  O   2.261        C    4 1.073    C    7 0.983    C    5 0.110
     7  C   3.945        O    6 0.983    H   18 0.981    H   19 0.976    H   20 0.976
     8  C   3.982        C    3 1.598    C    9 1.122    C   12 1.024
     9  C   3.979        C   10 1.721    C    8 1.122    H   21 0.967
    10  C   3.943        C    9 1.721    C   11 1.112    H   22 0.974
    11  C   3.959        C   12 1.658    C   10 1.112    H   23 0.972    O   13 0.110
    12  C   3.928        C   11 1.658    O   13 1.073    C    8 1.024
    13  O   2.261        C   12 1.073    C   14 0.982    C   11 0.110
    14  C   3.945        O   13 0.982    H   24 0.981    H   25 0.976    H   26 0.976
    15  H   0.998        C    1 0.974
    16  H   0.997        C    2 0.967
    17  H   0.999        C    5 0.972
    18  H   0.996        C    7 0.981
    19  H   0.998        C    7 0.976
    20  H   0.998        C    7 0.976
    21  H   0.997        C    9 0.967
    22  H   0.998        C   10 0.974
    23  H   0.999        C   11 0.972
    24  H   0.996        C   14 0.981
    25  H   0.998        C   14 0.976
    26  H   0.998        C   14 0.976

molecular dipole:
                 x           y           z       tot (Debye)
 q only:        0.003       0.003       0.038
   full:        0.003       0.003       0.040       0.103
molecular quadrupole (traceless):
                xx          xy          yy          xz          yz          zz
 q only:        9.365       7.804      -2.417      -2.022      -0.821      -6.948
  q+dip:        8.285      10.095       2.637      -2.442      -1.601     -10.923
   full:        8.414      10.353      -0.408      -2.199      -1.241      -8.006

           -------------------------------------------------
          |                Geometry Summary                 |
           -------------------------------------------------

      molecular mass/u    :      188.2256000
   center of mass at/Å    :        0.0009010       1.8528806       0.2397808
  moments of inertia/u·Å² :        0.4090902E+03   0.1016495E+04   0.1418374E+04
rotational constants/cm⁻¹ :        0.4120762E-01   0.1658408E-01   0.1188518E-01

 * 21 selected distances

     #   Z        #   Z                                     value/Å
     1   6 C      2   6 C                                 1.3475561
     4   6 C      5   6 C                                 1.3501264
     4   6 C      6   8 O                                 1.3520331
     6   8 O      7   6 C                                 1.4072753
     3   6 C      8   6 C                                 1.3551620
     9   6 C     10   6 C                                 1.3475381
    11   6 C     12   6 C                                 1.3501422
    12   6 C     13   8 O                                 1.3521500
    13   8 O     14   6 C                                 1.4074690 (max)
     1   6 C     15   1 H                                 1.0754191
     2   6 C     16   1 H                                 1.0706056
     5   6 C     17   1 H                                 1.0735775
     7   6 C     18   1 H                                 1.0887564
     7   6 C     19   1 H                                 1.0948313
     7   6 C     20   1 H                                 1.0947731
     9   6 C     21   1 H                                 1.0705951 (min)
    10   6 C     22   1 H                                 1.0754275
    11   6 C     23   1 H                                 1.0735594
    14   6 C     24   1 H                                 1.0886916
    14   6 C     25   1 H                                 1.0947966
    14   6 C     26   1 H                                 1.0947321

 * 3 distinct bonds (by element types)

   Z      Z             #   av. dist./Å        max./Å        min./Å
   1 H    6 C          12     1.0829804     1.0948313     1.0705951
   6 C    6 C           5     1.3501050     1.3551620     1.3475381
   6 C    8 O           4     1.3797318     1.4074690     1.3520331


optimized geometry written to: xtbopt.xyz


           -------------------------------------------------
          | TOTAL ENERGY              -39.857154423297 Eh   |
          | GRADIENT NORM               0.000470735947 Eh/α |
          | HOMO-LUMO GAP               1.223489714653 eV   |
           -------------------------------------------------

------------------------------------------------------------------------
 * finished run on 2021/05/19 at 10:59:44.565     
------------------------------------------------------------------------
 total:
 * wall-time:     0 d,  0 h,  0 min,  0.810 sec
 *  cpu-time:     0 d,  0 h,  0 min,  0.808 sec
 * ratio c/w:     0.997 speedup
 SCF:
 * wall-time:     0 d,  0 h,  0 min,  0.038 sec
 *  cpu-time:     0 d,  0 h,  0 min,  0.038 sec
 * ratio c/w:     0.998 speedup
 ANC optimizer:
 * wall-time:     0 d,  0 h,  0 min,  0.751 sec
 *  cpu-time:     0 d,  0 h,  0 min,  0.750 sec
 * ratio c/w:     0.998 speedup

