      -----------------------------------------------------------      
     |                   =====================                   |     
     |                           x T B                           |     
     |                   =====================                   |     
     |                         S. Grimme                         |     
     |          Mulliken Center for Theoretical Chemistry        |     
     |                    University of Bonn                     |     
     |                Version 6.2 RC2 (SAW190805)                |     
      -----------------------------------------------------------      

   This program is distributed in the hope that it will be useful,
   but WITHOUT ANY WARRANTY; without even the implied warranty of
   MERCHANTABILITY or FITNESS FOR A PARTICULAR PURPOSE.
   
   FOR NON-COMMERCIAL, ACADEMIA USE ONLY.
   
   Cite this work as:
   * S. Grimme, C. Bannwarth, P. Shushkov, J. Chem. Theory Comput., 2017,
     13, 1989-2009. DOI: 10.1021/acs.jctc.7b00118
   * C. Bannwarth, S. Ehlert and S. Grimme., J. Chem. Theory Comput., 2019,
     15, 1652-1671. DOI: 10.1021/acs.jctc.8b01176
   * P. Pracht, E. Caldeweyher, S. Ehlert, S. Grimme, ChemRxiv, 2019, preprint.
     DOI: 10.26434/chemrxiv.8326202.v1
   
   for DFT-D4:
   * E. Caldeweyher, C. Bannwarth and S. Grimme, J. Chem. Phys., 2017,
     147, 034112. DOI: 10.1063/1.4993215
   * E. Caldeweyher, S. Ehlert, A. Hansen, H. Neugebauer, S. Spicher,
     C. Bannwarth and S. Grimme, J. Chem. Phys., 2019, 150, 154122.
     DOI: 10.1063/1.5090222
   
   for sTDA-xTB:
   * S. Grimme and C. Bannwarth, J. Chem. Phys., 2016, 145, 054103.
     DOI: 10.1063/1.4959605
   
   in the mass-spec context:
   * V. Asgeirsson, C. Bauer and S. Grimme, Chem. Sci., 2017, 8, 4879.
     DOI: 10.1039/c7sc00601b
   
   for metadynamics refer to:
   * S. Grimme, J. Chem. Theory Comput., 2019, 155, 2847-2862
     DOI: 10.1021/acs.jctc.9b00143
   
   with help from (in alphabetical order)
   C. Bannwarth, F. Bohle, G. Brandenburg, E. Caldeweyher, M. Checinski,
   S. Dohm, S. Ehlert, S. Ehrlich, F. März, H. Neugebauer, J. Pisarek,
   P. Pracht, P. Shushkov, and S. Spicher.
   
 * started run on 2021/05/19 at 10:59:45.790     

           -------------------------------------------------
          |                Calculation Setup                |
           -------------------------------------------------

          program call               : /ihome/ghutchison/geoffh/xtb/xtb 645.xyz -opt
          hostname                   : smp-n144
          coordinate file            : 645.xyz
          omp threads                :                     1
          number of atoms            :                    23
          number of electrons        :                    68
          charge                     :                     0
          spin                       :                   0.0
          first test random number   :      0.59606491525914


########################################################################
# WARNING! Please study the warnings concerning your input carefully
#  - the use of '-opt' is discouraged, please use '--opt' next time
########################################################################

           ------------------------------------------------- 
          |                 G F N 2 - x T B                 |
          | Geometry, Frequencies, Noncovalent interactions |
          |            JCTC 2019 parametrisation            |
           ------------------------------------------------- 
             KAB for C  - Si     :                1.0500
             KAB for H  - Pd     :                0.9500
             k(s)              :                1.8500
             k(p)              :                2.2300
             k(d)              :                2.2300
             k(f)              :                2.0000
             kEN (H0ij)        :               -2.0000
             D4 a1             :                0.5200
             D4 a2             :                5.0000
             D4 s6             :                1.0000
             D4 s8             :                2.7000
             D4 s9             :                5.0000
             alphaj            :                2.0000

  Z AO/shell   Hii/eV     exponent
  1     Wed Apr 25 08:07:45 CEST 2018   EN: 2.200 GM2: 0.406  GM3: 0.0800  RAES: 1.40
     1s    -10.707211    1.230000
  6     Wed Apr 25 08:07:45 CEST 2018   EN: 2.550 GM2: 0.538  GM3: 0.1500  RAES: 3.00
     2s    -13.970922    2.096432
     2p    -10.063292    1.800000
  8     Wed Apr 25 08:07:45 CEST 2018   EN: 3.440 GM2: 0.452  GM3:-0.0517  RAES: 1.80
     2s    -20.229985    2.439742
     2p    -15.503117    2.137023

           ------------------------------------------------- 
          |        Self-Consistent Charge Iterations        |
           ------------------------------------------------- 

          ...................................................
          :                      SETUP                      :
          :.................................................:
          :  # basis functions                  62          :
          :  # atomic orbitals                  62          :
          :  # shells                           36          :
          :  # electrons                        68          :
          :  max. iterations                   250          :
          :  Hamiltonian                  GFN2-xTB          :
          :  restarted?                      false          :
          :  GBSA solvation                  false          :
          :  PC potential                    false          :
          :  electronic temp.          300.0000000     K    :
          :  accuracy                    1.0000000          :
          :  -> integral cutoff          0.2500000E+02      :
          :  -> integral neglect         0.1000000E-07      :
          :  -> SCF convergence          0.1000000E-05 Eh   :
          :  -> wf. convergence          0.1000000E-03 e    :
          :  Broyden damping             0.4000000          :
          ...................................................

 iter      E             dE          RMSdq      gap      omega  full diag
   1    -39.1398321 -0.391398E+02  0.436E+00    2.25       0.0  T
   2    -39.1523484 -0.125163E-01  0.259E+00    2.20       1.0  T
   3    -39.1393973  0.129511E-01  0.912E-01    2.27       1.0  T
   4    -39.1541915 -0.147941E-01  0.347E-01    2.25       1.0  T
   5    -39.1557070 -0.151559E-02  0.890E-02    2.24       1.0  T
   6    -39.1557592 -0.521630E-04  0.522E-02    2.25       1.0  T
   7    -39.1557798 -0.205973E-04  0.255E-02    2.24       1.0  T
   8    -39.1557867 -0.693200E-05  0.950E-03    2.24       2.2  T
   9    -39.1557871 -0.365377E-06  0.435E-03    2.24       4.8  T
  10    -39.1557874 -0.254031E-06  0.152E-03    2.24      13.7  T
  11    -39.1557874 -0.199554E-07  0.708E-04    2.24      29.4  T
  12    -39.1557874 -0.252311E-08  0.293E-04    2.24      71.2  T

   *** convergence criteria satisfied after 12 iterations ***

         #    Occupation            Energy/Eh            Energy/eV
      -------------------------------------------------------------
         1        2.0000           -0.7280880             -19.8123
       ...           ...                  ...                  ...
        28        2.0000           -0.4429147             -12.0523
        29        2.0000           -0.4369559             -11.8902
        30        2.0000           -0.4361949             -11.8695
        31        2.0000           -0.4325930             -11.7715
        32        2.0000           -0.4077868             -11.0964
        33        2.0000           -0.3816766             -10.3859
        34        2.0000           -0.3554200              -9.6715 (HOMO)
        35                         -0.2730706              -7.4306 (LUMO)
        36                         -0.2298342              -6.2541
        37                         -0.1742508              -4.7416
        38                         -0.1333987              -3.6300
        39                         -0.1153863              -3.1398
       ...                                ...                  ...
        62                          0.6914572              18.8155
      -------------------------------------------------------------
                  HL-Gap            0.0823495 Eh            2.2408 eV
             Fermi-level           -0.3142453 Eh           -8.5511 eV

 SCC (total)                   0 d,  0 h,  0 min,  0.032 sec
 SCC setup                      ...        0 min,  0.000 sec (  0.878%)
 Dispersion                     ...        0 min,  0.000 sec (  0.987%)
 integral evaluation            ...        0 min,  0.007 sec ( 22.906%)
 zeroth order Hamiltonian       ...        0 min,  0.000 sec (  0.456%)
 iterations                     ...        0 min,  0.013 sec ( 39.211%)
 molecular gradient             ...        0 min,  0.011 sec ( 34.361%)
 printout                       ...        0 min,  0.000 sec (  1.024%)

         :::::::::::::::::::::::::::::::::::::::::::::::::::::
         ::                     SUMMARY                     ::
         :::::::::::::::::::::::::::::::::::::::::::::::::::::
         :: total energy             -38.626953502481 Eh    ::
         :: gradient norm              0.063656139971 Eh/a0 ::
         :: HOMO-LUMO gap              2.240843014392 eV    ::
         ::.................................................::
         :: SCC energy               -39.155787375350 Eh    ::
         :: -> isotropic ES            0.049352341321 Eh    ::
         :: -> anisotropic ES          0.002266148476 Eh    ::
         :: -> anisotropic XC          0.010717207972 Eh    ::
         :: -> dispersion             -0.018600433940 Eh    ::
         :: repulsion energy           0.528889262119 Eh    ::
         :: add. restraining           0.000000000000 Eh    ::
         :::::::::::::::::::::::::::::::::::::::::::::::::::::

      ----------------------------------------------------------- 
     |                   =====================                   |
     |                        A N C O P T                        |
     |                   =====================                   |
     |               Approximate Normal Coordinate               |
     |                Rational Function Optimizer                |
      ----------------------------------------------------------- 

          ...................................................
          :                      SETUP                      :
          :.................................................:
          :   optimization level            normal          :
          :   max. optcycles                   200          :
          :   ANC micro-cycles                  20          :
          :   degrees of freedom                63          :
          :.................................................:
          :   RF solver                   davidson          :
          :   input Hessian                  false          :
          :   write xtbopt.log                true          :
          :   linear?                        false          :
          :   energy convergence         0.5000000E-05 Eh   :
          :   grad. convergence          0.1000000E-02 Eh/α :
          :   maximium RF displ.         2.0000000          :
          :   Hlow (freq-cutoff)         0.5000000E-02      :
          :   Hmax (freq-cutoff)         5.0000000          :
          :   S6 in model hess.         20.0000000          :
          ...................................................

generating ANC from model Hessian ...
Using Lindh-Hessian (1995)
 Shifting diagonal of input Hessian by   3.821376243778250E-003
 Lowest  eigenvalues of input Hessian
   -0.000000   -0.000000   -0.000000    0.000000    0.000000    0.000000
    0.005000    0.005615    0.005887    0.007598    0.008962    0.011560
    0.012961    0.013209    0.018216    0.021558    0.023337    0.029624
 Highest eigenvalues
    1.803983    1.936177    2.041057    2.089598    2.127805    2.185162
 

........................................................................
.............................. CYCLE    1 ..............................
........................................................................
   1    -39.1557874 -0.391558E+02  0.139E-04    2.24       0.0  T
   2    -39.1557874 -0.652918E-10  0.889E-05    2.24     234.6  T
   3    -39.1557874 -0.588187E-10  0.612E-05    2.24     340.8  T
     SCC iter.                  ...        0 min,  0.004 sec
     gradient                   ...        0 min,  0.011 sec
 * total energy  :   -38.6269535 Eh     change        0.2054946E-07 Eh
   gradient norm :     0.0636595 Eh/α   predicted     0.0000000E+00 (-100.00%)
   displ. norm   :     0.2433796 α      lambda       -0.6736595E-02
   maximum displ.:     0.1138191 α      in ANC's #7, #21, #4, ...

........................................................................
.............................. CYCLE    2 ..............................
........................................................................
   1    -39.1674864 -0.391675E+02  0.169E-01    2.25       0.0  T
   2    -39.1676120 -0.125555E-03  0.109E-01    2.25       1.0  T
   3    -39.1676396 -0.276764E-04  0.654E-02    2.25       1.0  T
   4    -39.1676685 -0.288856E-04  0.224E-02    2.25       1.0  T
   5    -39.1676733 -0.476824E-05  0.961E-03    2.25       2.2  T
   6    -39.1676753 -0.198919E-05  0.296E-03    2.25       7.0  T
   7    -39.1676753 -0.957024E-08  0.193E-03    2.25      10.8  T
     SCC iter.                  ...        0 min,  0.007 sec
     gradient                   ...        0 min,  0.010 sec
 * total energy  :   -38.6316035 Eh     change       -0.4650012E-02 Eh
   gradient norm :     0.0272193 Eh/α   predicted    -0.3567825E-02 ( -23.27%)
   displ. norm   :     0.2519405 α      lambda       -0.2089957E-02
   maximum displ.:     0.1609814 α      in ANC's #7, #3, #4, ...

........................................................................
.............................. CYCLE    3 ..............................
........................................................................
   1    -39.1721739 -0.391722E+02  0.174E-01    2.27       0.0  T
   2    -39.1722437 -0.698705E-04  0.108E-01    2.27       1.0  T
   3    -39.1722335  0.102849E-04  0.659E-02    2.27       1.0  T
   4    -39.1722835 -0.500707E-04  0.144E-02    2.27       1.4  T
   5    -39.1722860 -0.245519E-05  0.687E-03    2.27       3.0  T
   6    -39.1722869 -0.962470E-06  0.212E-03    2.27       9.8  T
   7    -39.1722869  0.407529E-08  0.134E-03    2.27      15.5  T
     SCC iter.                  ...        0 min,  0.007 sec
     gradient                   ...        0 min,  0.010 sec
 * total energy  :   -38.6328610 Eh     change       -0.1257516E-02 Eh
   gradient norm :     0.0067901 Eh/α   predicted    -0.1111315E-02 ( -11.63%)
   displ. norm   :     0.2156419 α      lambda       -0.4626108E-03
   maximum displ.:     0.1298597 α      in ANC's #7, #3, #4, ...

........................................................................
.............................. CYCLE    4 ..............................
........................................................................
   1    -39.1718392 -0.391718E+02  0.147E-01    2.28       0.0  T
   2    -39.1718439 -0.467535E-05  0.876E-02    2.28       1.0  T
   3    -39.1718200  0.238765E-04  0.339E-02    2.28       1.0  T
   4    -39.1718473 -0.273332E-04  0.471E-03    2.28       4.4  T
   5    -39.1718476 -0.295532E-06  0.222E-03    2.28       9.4  T
   6    -39.1718477 -0.494731E-07  0.103E-03    2.28      20.2  T
     SCC iter.                  ...        0 min,  0.006 sec
     gradient                   ...        0 min,  0.010 sec
 * total energy  :   -38.6332124 Eh     change       -0.3513686E-03 Eh
   gradient norm :     0.0072350 Eh/α   predicted    -0.2420853E-03 ( -31.10%)
   displ. norm   :     0.3338119 α      lambda       -0.5471160E-03
   maximum displ.:     0.1862835 α      in ANC's #3, #7, #1, ...

........................................................................
.............................. CYCLE    5 ..............................
........................................................................
   1    -39.1702613 -0.391703E+02  0.233E-01    2.27       0.0  T
   2    -39.1702639 -0.256723E-05  0.138E-01    2.28       1.0  T
   3    -39.1702331  0.307401E-04  0.386E-02    2.27       1.0  T
   4    -39.1702668 -0.337079E-04  0.530E-03    2.28       3.9  T
   5    -39.1702672 -0.326744E-06  0.270E-03    2.28       7.7  T
   6    -39.1702672 -0.302857E-07  0.102E-03    2.28      20.4  T
     SCC iter.                  ...        0 min,  0.006 sec
     gradient                   ...        0 min,  0.010 sec
 * total energy  :   -38.6335775 Eh     change       -0.3651175E-03 Eh
   gradient norm :     0.0106168 Eh/α   predicted    -0.3040429E-03 ( -16.73%)
   displ. norm   :     0.2808416 α      lambda       -0.3985989E-03
   maximum displ.:     0.1630781 α      in ANC's #3, #1, #7, ...

........................................................................
.............................. CYCLE    6 ..............................
........................................................................
   1    -39.1698082 -0.391698E+02  0.203E-01    2.26       0.0  T
   2    -39.1698112 -0.300765E-05  0.121E-01    2.26       1.0  T
   3    -39.1697837  0.274908E-04  0.358E-02    2.26       1.0  T
   4    -39.1698138 -0.300289E-04  0.480E-03    2.26       4.3  T
   5    -39.1698140 -0.250423E-06  0.271E-03    2.26       7.7  T
   6    -39.1698141 -0.902147E-07  0.124E-03    2.26      16.8  T
     SCC iter.                  ...        0 min,  0.006 sec
     gradient                   ...        0 min,  0.010 sec
 * total energy  :   -38.6338509 Eh     change       -0.2733933E-03 Eh
   gradient norm :     0.0088531 Eh/α   predicted    -0.2150192E-03 ( -21.35%)
   displ. norm   :     0.2589405 α      lambda       -0.3343867E-03
   maximum displ.:     0.1540680 α      in ANC's #3, #1, #4, ...

........................................................................
.............................. CYCLE    7 ..............................
........................................................................
   1    -39.1719552 -0.391720E+02  0.177E-01    2.25       0.0  T
   2    -39.1719590 -0.380992E-05  0.106E-01    2.25       1.0  T
   3    -39.1719080  0.510080E-04  0.500E-02    2.25       1.0  T
   4    -39.1719642 -0.562517E-04  0.612E-03    2.25       3.4  T
   5    -39.1719649 -0.677989E-06  0.236E-03    2.25       8.8  T
   6    -39.1719650 -0.623290E-07  0.112E-03    2.25      18.5  T
     SCC iter.                  ...        0 min,  0.006 sec
     gradient                   ...        0 min,  0.011 sec
 * total energy  :   -38.6340889 Eh     change       -0.2380465E-03 Eh
   gradient norm :     0.0058970 Eh/α   predicted    -0.1784086E-03 ( -25.05%)
   displ. norm   :     0.2858987 α      lambda       -0.2440224E-03
   maximum displ.:     0.1795734 α      in ANC's #3, #1, #4, ...

........................................................................
.............................. CYCLE    8 ..............................
........................................................................
   1    -39.1726307 -0.391726E+02  0.188E-01    2.24       0.0  T
   2    -39.1726330 -0.229494E-05  0.112E-01    2.24       1.0  T
   3    -39.1725991  0.338894E-04  0.403E-02    2.24       1.0  T
   4    -39.1726361 -0.369405E-04  0.490E-03    2.24       4.3  T
   5    -39.1726365 -0.445272E-06  0.183E-03    2.24      11.4  T
   6    -39.1726365 -0.204961E-07  0.923E-04    2.24      22.6  T
     SCC iter.                  ...        0 min,  0.006 sec
     gradient                   ...        0 min,  0.010 sec
 * total energy  :   -38.6342635 Eh     change       -0.1746099E-03 Eh
   gradient norm :     0.0052950 Eh/α   predicted    -0.1319878E-03 ( -24.41%)
   displ. norm   :     0.2760604 α      lambda       -0.2353367E-03
   maximum displ.:     0.1816178 α      in ANC's #1, #3, #4, ...

........................................................................
.............................. CYCLE    9 ..............................
........................................................................
   1    -39.1745825 -0.391746E+02  0.178E-01    2.24       0.0  T
   2    -39.1745846 -0.204695E-05  0.105E-01    2.24       1.0  T
   3    -39.1745684  0.161878E-04  0.271E-02    2.24       1.0  T
   4    -39.1745866 -0.181901E-04  0.302E-03    2.24       6.9  T
   5    -39.1745867 -0.103242E-06  0.165E-03    2.24      12.6  T
   6    -39.1745867 -0.601813E-08  0.935E-04    2.24      22.3  T
     SCC iter.                  ...        0 min,  0.006 sec
     gradient                   ...        0 min,  0.010 sec
 * total energy  :   -38.6344183 Eh     change       -0.1548005E-03 Eh
   gradient norm :     0.0061684 Eh/α   predicted    -0.1266361E-03 ( -18.19%)
   displ. norm   :     0.3102668 α      lambda       -0.1892454E-03
   maximum displ.:     0.2103877 α      in ANC's #3, #1, #7, ...

........................................................................
.............................. CYCLE   10 ..............................
........................................................................
   1    -39.1728616 -0.391729E+02  0.198E-01    2.23       0.0  T
   2    -39.1728629 -0.123343E-05  0.117E-01    2.23       1.0  T
   3    -39.1728615  0.134056E-05  0.901E-03    2.23       2.3  T
   4    -39.1728635 -0.197153E-05  0.223E-03    2.23       9.4  T
   5    -39.1728635 -0.124855E-07  0.135E-03    2.23      15.4  T
     SCC iter.                  ...        0 min,  0.005 sec
     gradient                   ...        0 min,  0.011 sec
 * total energy  :   -38.6345445 Eh     change       -0.1261445E-03 Eh
   gradient norm :     0.0061606 Eh/α   predicted    -0.1037321E-03 ( -17.77%)
   displ. norm   :     0.2525352 α      lambda       -0.2180239E-03
   maximum displ.:     0.1757557 α      in ANC's #1, #3, #37, ...

........................................................................
.............................. CYCLE   11 ..............................
........................................................................
   1    -39.1757275 -0.391757E+02  0.167E-01    2.24       0.0  T
   2    -39.1757294 -0.189304E-05  0.986E-02    2.24       1.0  T
   3    -39.1757233  0.603608E-05  0.170E-02    2.24       1.2  T
   4    -39.1757302 -0.684351E-05  0.367E-03    2.24       5.7  T
   5    -39.1757303 -0.180473E-06  0.175E-03    2.24      11.9  T
   6    -39.1757304 -0.269030E-07  0.857E-04    2.24      24.3  T
     SCC iter.                  ...        0 min,  0.006 sec
     gradient                   ...        0 min,  0.010 sec
 * total energy  :   -38.6346429 Eh     change       -0.9840556E-04 Eh
   gradient norm :     0.0063849 Eh/α   predicted    -0.1159686E-03 (  17.85%)
   displ. norm   :     0.3511625 α      lambda       -0.2021833E-03
   maximum displ.:     0.2460411 α      in ANC's #3, #1, #37, ...

........................................................................
.............................. CYCLE   12 ..............................
........................................................................
   1    -39.1708930 -0.391709E+02  0.225E-01    2.23       0.0  T
   2    -39.1708952 -0.225494E-05  0.133E-01    2.23       1.0  T
   3    -39.1708429  0.522789E-04  0.518E-02    2.23       1.0  T
   4    -39.1708997 -0.567574E-04  0.487E-03    2.23       4.3  T
   5    -39.1709001 -0.379272E-06  0.223E-03    2.23       9.4  T
   6    -39.1709001 -0.259499E-07  0.104E-03    2.23      20.0  T
     SCC iter.                  ...        0 min,  0.006 sec
     gradient                   ...        0 min,  0.010 sec
 * total energy  :   -38.6346922 Eh     change       -0.4929729E-04 Eh
   gradient norm :     0.0084387 Eh/α   predicted    -0.1135604E-03 ( 130.36%)
   displ. norm   :     0.1093029 α      lambda       -0.1756430E-03
   maximum displ.:     0.0744441 α      in ANC's #3, #1, #4, ...

........................................................................
.............................. CYCLE   13 ..............................
........................................................................
   1    -39.1741254 -0.391741E+02  0.733E-02    2.24       0.0  T
   2    -39.1741260 -0.574499E-06  0.435E-02    2.24       1.0  T
   3    -39.1741186  0.737982E-05  0.191E-02    2.24       1.1  T
   4    -39.1741267 -0.805829E-05  0.234E-03    2.24       8.9  T
   5    -39.1741267 -0.730159E-07  0.108E-03    2.24      19.3  T
   6    -39.1741267 -0.640276E-08  0.559E-04    2.24      37.3  T
     SCC iter.                  ...        0 min,  0.006 sec
     gradient                   ...        0 min,  0.010 sec
 * total energy  :   -38.6347638 Eh     change       -0.7165508E-04 Eh
   gradient norm :     0.0042267 Eh/α   predicted    -0.8887159E-04 (  24.03%)
   displ. norm   :     0.0831264 α      lambda       -0.9048750E-04
   maximum displ.:     0.0519418 α      in ANC's #1, #3, #5, ...

........................................................................
.............................. CYCLE   14 ..............................
........................................................................
   1    -39.1747170 -0.391747E+02  0.602E-02    2.23       0.0  T
   2    -39.1747173 -0.364842E-06  0.360E-02    2.23       1.0  T
   3    -39.1747105  0.680102E-05  0.191E-02    2.23       1.1  T
   4    -39.1747180 -0.747231E-05  0.187E-03    2.23      11.2  T
   5    -39.1747180 -0.258500E-07  0.111E-03    2.23      18.8  T
   6    -39.1747180 -0.100869E-07  0.435E-04    2.23      48.0  T
     SCC iter.                  ...        0 min,  0.006 sec
     gradient                   ...        0 min,  0.010 sec
 * total energy  :   -38.6348070 Eh     change       -0.4318318E-04 Eh
   gradient norm :     0.0038054 Eh/α   predicted    -0.4555937E-04 (   5.50%)
   displ. norm   :     0.1547619 α      lambda       -0.6428098E-04
   maximum displ.:     0.1040840 α      in ANC's #1, #3, #4, ...

........................................................................
.............................. CYCLE   15 ..............................
........................................................................
   1    -39.1742270 -0.391742E+02  0.102E-01    2.23       0.0  T
   2    -39.1742274 -0.407399E-06  0.603E-02    2.23       1.0  T
   3    -39.1742270  0.440589E-06  0.582E-03    2.23       3.6  T
   4    -39.1742277 -0.667943E-06  0.179E-03    2.23      11.6  T
   5    -39.1742277 -0.387964E-08  0.106E-03    2.23      19.7  T
   6    -39.1742277 -0.880458E-08  0.421E-04    2.23      49.5  T
   7    -39.1742277 -0.242122E-08  0.109E-04    2.23     191.9  T
     SCC iter.                  ...        0 min,  0.007 sec
     gradient                   ...        0 min,  0.011 sec
 * total energy  :   -38.6348472 Eh     change       -0.4016580E-04 Eh
   gradient norm :     0.0027115 Eh/α   predicted    -0.3291192E-04 ( -18.06%)
   displ. norm   :     0.1779426 α      lambda       -0.4094194E-04
   maximum displ.:     0.1223327 α      in ANC's #1, #3, #37, ...

........................................................................
.............................. CYCLE   16 ..............................
........................................................................
   1    -39.1728798 -0.391729E+02  0.124E-01    2.23       0.0  T
   2    -39.1728804 -0.545657E-06  0.733E-02    2.23       1.0  T
   3    -39.1728805 -0.111894E-06  0.369E-03    2.23       5.7  T
   4    -39.1728806 -0.176562E-06  0.194E-03    2.23      10.7  T
   5    -39.1728806 -0.607280E-09  0.984E-04    2.23      21.2  T
   6    -39.1728807 -0.125439E-07  0.354E-04    2.23      58.9  T
     SCC iter.                  ...        0 min,  0.006 sec
     gradient                   ...        0 min,  0.011 sec
 * total energy  :   -38.6348633 Eh     change       -0.1607246E-04 Eh
   gradient norm :     0.0035531 Eh/α   predicted    -0.2112075E-04 (  31.41%)
   displ. norm   :     0.0315842 α      lambda       -0.2707707E-04
   maximum displ.:     0.0162311 α      in ANC's #4, #7, #3, ...

........................................................................
.............................. CYCLE   17 ..............................
........................................................................
   1    -39.1746574 -0.391747E+02  0.234E-02    2.23       0.0  T
   2    -39.1746575 -0.115375E-06  0.141E-02    2.23       1.5  T
   3    -39.1746565  0.103964E-05  0.790E-03    2.23       2.6  T
   4    -39.1746577 -0.120379E-05  0.120E-03    2.23      17.4  T
   5    -39.1746577 -0.200029E-07  0.597E-04    2.23      34.9  T
   6    -39.1746577 -0.127171E-08  0.276E-04    2.23      75.5  T
     SCC iter.                  ...        0 min,  0.006 sec
     gradient                   ...        0 min,  0.011 sec
 * total energy  :   -38.6348763 Eh     change       -0.1302442E-04 Eh
   gradient norm :     0.0024049 Eh/α   predicted    -0.1355572E-04 (   4.08%)
   displ. norm   :     0.0438817 α      lambda       -0.1206999E-04
   maximum displ.:     0.0302644 α      in ANC's #1, #3, #5, ...

........................................................................
.............................. CYCLE   18 ..............................
........................................................................
   1    -39.1747489 -0.391747E+02  0.339E-02    2.23       0.0  T
   2    -39.1747490 -0.156595E-06  0.203E-02    2.23       1.0  T
   3    -39.1747476  0.142522E-05  0.836E-03    2.23       2.5  T
   4    -39.1747492 -0.155391E-05  0.121E-03    2.23      17.2  T
   5    -39.1747492 -0.201983E-07  0.526E-04    2.23      39.6  T
   6    -39.1747492 -0.128929E-08  0.265E-04    2.23      78.7  T
     SCC iter.                  ...        0 min,  0.006 sec
     gradient                   ...        0 min,  0.011 sec
 * total energy  :   -38.6348783 Eh     change       -0.2020519E-05 Eh
   gradient norm :     0.0021843 Eh/α   predicted    -0.6049185E-05 ( 199.39%)
   displ. norm   :     0.0391070 α      lambda       -0.9172569E-05
   maximum displ.:     0.0249666 α      in ANC's #3, #1, #5, ...

........................................................................
.............................. CYCLE   19 ..............................
........................................................................
   1    -39.1744578 -0.391745E+02  0.264E-02    2.23       0.0  T
   2    -39.1744579 -0.627894E-07  0.156E-02    2.23       1.3  T
   3    -39.1744576  0.242045E-06  0.345E-03    2.23       6.0  T
   4    -39.1744579 -0.274966E-06  0.649E-04    2.23      32.1  T
   5    -39.1744579 -0.251108E-08  0.380E-04    2.23      54.8  T
     SCC iter.                  ...        0 min,  0.005 sec
     gradient                   ...        0 min,  0.011 sec
 * total energy  :   -38.6348827 Eh     change       -0.4383128E-05 Eh
   gradient norm :     0.0009024 Eh/α   predicted    -0.4596832E-05 (   4.88%)
   displ. norm   :     0.0108493 α      lambda       -0.2406807E-05
   maximum displ.:     0.0047409 α      in ANC's #10, #6, #5, ...

   *** GEOMETRY OPTIMIZATION CONVERGED AFTER 19 ITERATIONS ***

------------------------------------------------------------------------
 total energy gain   :        -0.0079292 Eh       -4.9756 kcal/mol
 total RMSD          :         0.6133781 a0        0.3246 Å
 total power (kW/mol):        -1.0956894 (step)  -43.9567 (real)
------------------------------------------------------------------------

 ANCopt (total)                0 d,  0 h,  0 min,  0.474 sec
 optimizer setup                ...        0 min,  0.000 sec (  0.037%)
 model hessian                  ...        0 min,  0.003 sec (  0.557%)
 ANC generation                 ...        0 min,  0.001 sec (  0.151%)
 coordinate transformation      ...        0 min,  0.000 sec (  0.072%)
 single point calculation       ...        0 min,  0.461 sec ( 97.385%)
 optimization log               ...        0 min,  0.002 sec (  0.384%)
 hessian update                 ...        0 min,  0.000 sec (  0.051%)
 rational function              ...        0 min,  0.005 sec (  1.105%)

================
 final structure:
================
$coord
    5.92690973762264    0.03366142726303   -2.63936840726759      C 
    5.10670183390185    0.73140506343350   -0.36516857884428      C 
    5.98229996632089    2.91526946777432    0.97997601223205      C 
    7.76374514401658    4.47192458146247   -0.00928957599253      O 
    8.21174237677763    6.36144538281101    1.66759772843916      C 
    6.69107462013316    6.01376946833585    3.76979796713397      C 
    5.26000441838280    3.80341621396528    3.32980417565112      C 
    3.52646475663583    2.76167690183332    4.89823947760060      O 
    6.49369771854612    7.42913470305768    5.91542304060307      O 
   10.01120804717844    8.29557249707976    1.12947912429925      C 
   11.37664368413083    8.43712992884709   -1.01508428661552      C 
   13.17725884078697   10.39886539700133   -1.52089661263010      C 
   14.52291157875784   10.54773859944773   -3.64546613089569      C 
    5.20756547758208   -1.62330511650994   -3.56930143324777      H 
    7.34194694169125    1.11337839702633   -3.62449045452507      H 
    3.68587495116953   -0.33784360218792    0.63808921707193      H 
    3.43535480547958    3.80419937743811    6.39305097348567      H 
    7.62267700906868    8.85118664339444    5.80611497198469      H 
   10.24973733374572    9.72224529079542    2.58057531364007      H 
   11.11835203843903    7.00480275909709   -2.44732628446374      H 
   13.41597740266807   11.81403103969707   -0.05983238959531      H 
   14.31877744467302    9.16910613412674   -5.12973161625883      H 
   15.86124478651393   12.04305971111785   -3.97220137543393      H 
$end
           -------------------------------------------------
          |                Final Singlepoint                |
           -------------------------------------------------

          ...................................................
          :                      SETUP                      :
          :.................................................:
          :  # basis functions                  62          :
          :  # atomic orbitals                  62          :
          :  # shells                           36          :
          :  # electrons                        68          :
          :  max. iterations                   250          :
          :  Hamiltonian                  GFN2-xTB          :
          :  restarted?                      false          :
          :  GBSA solvation                  false          :
          :  PC potential                    false          :
          :  electronic temp.          300.0000000     K    :
          :  accuracy                    1.0000000          :
          :  -> integral cutoff          0.2500000E+02      :
          :  -> integral neglect         0.1000000E-07      :
          :  -> SCF convergence          0.1000000E-05 Eh   :
          :  -> wf. convergence          0.1000000E-03 e    :
          :  Broyden damping             0.4000000          :
          ...................................................

 iter      E             dE          RMSdq      gap      omega  full diag
   1    -39.1744579 -0.391745E+02  0.199E-04    2.23       0.0  T
   2    -39.1744579  0.441247E-10  0.146E-04    2.23     142.4  T
   3    -39.1744579 -0.497330E-09  0.637E-05    2.23     327.2  T

   *** convergence criteria satisfied after 3 iterations ***

         #    Occupation            Energy/Eh            Energy/eV
      -------------------------------------------------------------
         1        2.0000           -0.7372637             -20.0620
       ...           ...                  ...                  ...
        28        2.0000           -0.4447980             -12.1036
        29        2.0000           -0.4374429             -11.9034
        30        2.0000           -0.4362792             -11.8718
        31        2.0000           -0.4322722             -11.7627
        32        2.0000           -0.4110880             -11.1863
        33        2.0000           -0.3838826             -10.4460
        34        2.0000           -0.3562964              -9.6953 (HOMO)
        35                         -0.2742508              -7.4627 (LUMO)
        36                         -0.2276190              -6.1938
        37                         -0.1736389              -4.7250
        38                         -0.1284649              -3.4957
        39                         -0.1142013              -3.1076
       ...                                ...                  ...
        62                          0.6835006              18.5990
      -------------------------------------------------------------
                  HL-Gap            0.0820456 Eh            2.2326 eV
             Fermi-level           -0.3152736 Eh           -8.5790 eV

 SCC (total)                   0 d,  0 h,  0 min,  0.023 sec
 SCC setup                      ...        0 min,  0.000 sec (  0.800%)
 Dispersion                     ...        0 min,  0.000 sec (  0.853%)
 integral evaluation            ...        0 min,  0.007 sec ( 31.285%)
 zeroth order Hamiltonian       ...        0 min,  0.000 sec (  0.631%)
 iterations                     ...        0 min,  0.004 sec ( 16.053%)
 molecular gradient             ...        0 min,  0.011 sec ( 48.681%)
 printout                       ...        0 min,  0.000 sec (  1.470%)

         :::::::::::::::::::::::::::::::::::::::::::::::::::::
         ::                     SUMMARY                     ::
         :::::::::::::::::::::::::::::::::::::::::::::::::::::
         :: total energy             -38.634882702589 Eh    ::
         :: gradient norm              0.000901378180 Eh/a0 ::
         :: HOMO-LUMO gap              2.232575169921 eV    ::
         ::.................................................::
         :: SCC energy               -39.174457908353 Eh    ::
         :: -> isotropic ES            0.047944462954 Eh    ::
         :: -> anisotropic ES          0.003016975748 Eh    ::
         :: -> anisotropic XC          0.010469890965 Eh    ::
         :: -> dispersion             -0.018588608692 Eh    ::
         :: repulsion energy           0.539644769910 Eh    ::
         :: add. restraining           0.000000000000 Eh    ::
         :::::::::::::::::::::::::::::::::::::::::::::::::::::

           -------------------------------------------------
          |                Property Printout                |
           -------------------------------------------------

    * Orbital Energies and Occupations

         #    Occupation            Energy/Eh            Energy/eV
      -------------------------------------------------------------
         1        2.0000           -0.7372637             -20.0620
       ...           ...                  ...                  ...
        22        2.0000           -0.5055477             -13.7567
        23        2.0000           -0.5003768             -13.6159
        24        2.0000           -0.4818867             -13.1128
        25        2.0000           -0.4629185             -12.5967
        26        2.0000           -0.4619304             -12.5698
        27        2.0000           -0.4587089             -12.4821
        28        2.0000           -0.4447980             -12.1036
        29        2.0000           -0.4374429             -11.9034
        30        2.0000           -0.4362792             -11.8718
        31        2.0000           -0.4322722             -11.7627
        32        2.0000           -0.4110880             -11.1863
        33        2.0000           -0.3838826             -10.4460
        34        2.0000           -0.3562964              -9.6953 (HOMO)
        35                         -0.2742508              -7.4627 (LUMO)
        36                         -0.2276190              -6.1938
        37                         -0.1736389              -4.7250
        38                         -0.1284649              -3.4957
        39                         -0.1142013              -3.1076
        40                          0.0244001               0.6640
        41                          0.0517119               1.4072
        42                          0.0642706               1.7489
        43                          0.1120226               3.0483
        44                          0.1158704               3.1530
        45                          0.1374852               3.7412
       ...                                ...                  ...
        62                          0.6835006              18.5990
      -------------------------------------------------------------
                  HL-Gap            0.0820456 Eh            2.2326 eV
             Fermi-level           -0.3152736 Eh           -8.5790 eV

     #   Z        covCN         q      C6AA      α(0)
     1   6 C      2.841    -0.087    30.172     9.002
     2   6 C      2.888    -0.034    28.841     8.805
     3   6 C      3.062     0.089    25.956     8.355
     4   8 O      1.727    -0.206    17.419     5.635
     5   6 C      3.054     0.074    26.301     8.411
     6   6 C      2.927     0.076    26.307     8.411
     7   6 C      2.920     0.095    25.898     8.345
     8   8 O      1.659    -0.385    20.556     6.121
     9   8 O      1.658    -0.398    20.813     6.159
    10   6 C      2.896    -0.048    29.201     8.860
    11   6 C      2.903    -0.034    28.836     8.805
    12   6 C      2.894    -0.026    28.645     8.775
    13   6 C      2.842    -0.088    30.192     9.005
    14   1 H      0.926     0.044     2.394     2.419
    15   1 H      0.926     0.052     2.296     2.369
    16   1 H      0.926     0.058     2.221     2.331
    17   1 H      0.805     0.320     0.663     1.279
    18   1 H      0.805     0.304     0.710     1.323
    19   1 H      0.925     0.031     2.576     2.510
    20   1 H      0.926     0.052     2.297     2.370
    21   1 H      0.925     0.032     2.559     2.501
    22   1 H      0.926     0.042     2.428     2.437
    23   1 H      0.926     0.037     2.487     2.466

 Mol. C6AA /au·bohr⁶  :       6412.666553
 Mol. C8AA /au·bohr⁸  :     153926.492546
 Mol. α(0) /au        :        126.693167


Wiberg/Mayer (AO) data.
largest (>0.10) Wiberg bond orders for each atom
          total WBO             WBO to atom ...
     1  C   3.958        C    2 1.849    H   14 0.979    H   15 0.976
     2  C   3.988        C    1 1.849    C    3 1.134    H   16 0.962
     3  C   3.889        C    7 1.403    C    2 1.134    O    4 1.087
     4  O   2.395        C    3 1.087    C    5 1.081
     5  C   3.906        C    6 1.389    C   10 1.169    O    4 1.081
     6  C   3.901        C    5 1.389    C    7 1.251    O    9 1.054
     7  C   3.936        C    3 1.403    C    6 1.251    O    8 1.075
     8  O   2.117        C    7 1.075    H   17 0.880
     9  O   2.092        C    6 1.054    H   18 0.886
    10  C   3.988        C   11 1.685    C    5 1.169    H   19 0.960    C   13 0.119
    11  C   3.969        C   10 1.685    C   12 1.159    H   20 0.962
    12  C   3.991        C   13 1.842    C   11 1.159    H   21 0.964
    13  C   3.928        C   12 1.842    H   23 0.980    H   22 0.977    C   10 0.119
    14  H   0.997        C    1 0.979
    15  H   0.997        C    1 0.976
    16  H   0.996        C    2 0.962
    17  H   0.897        O    8 0.880
    18  H   0.907        O    9 0.886
    19  H   0.999        C   10 0.960
    20  H   0.997        C   11 0.962
    21  H   0.999        C   12 0.964
    22  H   0.998        C   13 0.977
    23  H   0.998        C   13 0.980

molecular dipole:
                 x           y           z       tot (Debye)
 q only:        0.181       0.440       0.247
   full:        0.335       0.773       0.412       2.384
molecular quadrupole (traceless):
                xx          xy          yy          xz          yz          zz
 q only:       -2.484       7.893       4.111       3.005       6.687      -1.627
  q+dip:       -4.042      13.936       6.137       3.941      11.220      -2.096
   full:       -3.142      12.390       6.393       5.619      10.162      -3.250

           -------------------------------------------------
          |                Geometry Summary                 |
           -------------------------------------------------

      molecular mass/u    :      178.1872000
   center of mass at/Å    :        4.1982873       2.9333564       0.5635410
  moments of inertia/u·Å² :        0.4181995E+03   0.1097702E+04   0.1515895E+04
rotational constants/cm⁻¹ :        0.4031003E-01   0.1535721E-01   0.1112058E-01

 * 22 selected distances

     #   Z        #   Z                                     value/Å
     1   6 C      2   6 C                                 1.3315484
     2   6 C      3   6 C                                 1.4341924 (max)
     3   6 C      4   8 O                                 1.3569418
     4   8 O      5   6 C                                 1.3577230
     5   6 C      6   6 C                                 1.3852477
     3   6 C      7   6 C                                 1.3831896
     6   6 C      7   6 C                                 1.4127366
     7   6 C      8   8 O                                 1.3543599
     6   6 C      9   8 O                                 1.3642025
     5   6 C     10   6 C                                 1.4266697
    10   6 C     11   6 C                                 1.3474401
    12   6 C     13   6 C                                 1.3331424
     1   6 C     14   1 H                                 1.0751249
     1   6 C     15   1 H                                 1.0765324
     2   6 C     16   1 H                                 1.0804250
     8   8 O     17   1 H                                 0.9656021
     9   8 O     18   1 H                                 0.9625754 (min)
    10   6 C     19   1 H                                 1.0842288
    11   6 C     20   1 H                                 1.0805578
    12   6 C     21   1 H                                 1.0837660
    13   6 C     22   1 H                                 1.0774109
    13   6 C     23   1 H                                 1.0759199

 * 4 distinct bonds (by element types)

   Z      Z             #   av. dist./Å        max./Å        min./Å
   1 H    6 C           8     1.0792457     1.0842288     1.0751249
   6 C    6 C           8     1.3817709     1.4341924     1.3315484
   1 H    8 O           2     0.9640887     0.9656021     0.9625754
   6 C    8 O           4     1.3583068     1.3642025     1.3543599


optimized geometry written to: xtbopt.xyz


           -------------------------------------------------
          | TOTAL ENERGY              -38.634882702589 Eh   |
          | GRADIENT NORM               0.000901378180 Eh/α |
          | HOMO-LUMO GAP               2.232575169921 eV   |
           -------------------------------------------------

------------------------------------------------------------------------
 * finished run on 2021/05/19 at 10:59:46.338     
------------------------------------------------------------------------
 total:
 * wall-time:     0 d,  0 h,  0 min,  0.548 sec
 *  cpu-time:     0 d,  0 h,  0 min,  0.546 sec
 * ratio c/w:     0.996 speedup
 SCF:
 * wall-time:     0 d,  0 h,  0 min,  0.032 sec
 *  cpu-time:     0 d,  0 h,  0 min,  0.032 sec
 * ratio c/w:     0.994 speedup
 ANC optimizer:
 * wall-time:     0 d,  0 h,  0 min,  0.497 sec
 *  cpu-time:     0 d,  0 h,  0 min,  0.496 sec
 * ratio c/w:     0.998 speedup

