      -----------------------------------------------------------      
     |                   =====================                   |     
     |                           x T B                           |     
     |                   =====================                   |     
     |                         S. Grimme                         |     
     |          Mulliken Center for Theoretical Chemistry        |     
     |                    University of Bonn                     |     
     |                Version 6.2 RC2 (SAW190805)                |     
      -----------------------------------------------------------      

   This program is distributed in the hope that it will be useful,
   but WITHOUT ANY WARRANTY; without even the implied warranty of
   MERCHANTABILITY or FITNESS FOR A PARTICULAR PURPOSE.
   
   FOR NON-COMMERCIAL, ACADEMIA USE ONLY.
   
   Cite this work as:
   * S. Grimme, C. Bannwarth, P. Shushkov, J. Chem. Theory Comput., 2017,
     13, 1989-2009. DOI: 10.1021/acs.jctc.7b00118
   * C. Bannwarth, S. Ehlert and S. Grimme., J. Chem. Theory Comput., 2019,
     15, 1652-1671. DOI: 10.1021/acs.jctc.8b01176
   * P. Pracht, E. Caldeweyher, S. Ehlert, S. Grimme, ChemRxiv, 2019, preprint.
     DOI: 10.26434/chemrxiv.8326202.v1
   
   for DFT-D4:
   * E. Caldeweyher, C. Bannwarth and S. Grimme, J. Chem. Phys., 2017,
     147, 034112. DOI: 10.1063/1.4993215
   * E. Caldeweyher, S. Ehlert, A. Hansen, H. Neugebauer, S. Spicher,
     C. Bannwarth and S. Grimme, J. Chem. Phys., 2019, 150, 154122.
     DOI: 10.1063/1.5090222
   
   for sTDA-xTB:
   * S. Grimme and C. Bannwarth, J. Chem. Phys., 2016, 145, 054103.
     DOI: 10.1063/1.4959605
   
   in the mass-spec context:
   * V. Asgeirsson, C. Bauer and S. Grimme, Chem. Sci., 2017, 8, 4879.
     DOI: 10.1039/c7sc00601b
   
   for metadynamics refer to:
   * S. Grimme, J. Chem. Theory Comput., 2019, 155, 2847-2862
     DOI: 10.1021/acs.jctc.9b00143
   
   with help from (in alphabetical order)
   C. Bannwarth, F. Bohle, G. Brandenburg, E. Caldeweyher, M. Checinski,
   S. Dohm, S. Ehlert, S. Ehrlich, F. März, H. Neugebauer, J. Pisarek,
   P. Pracht, P. Shushkov, and S. Spicher.
   
 * started run on 2021/05/19 at 10:59:46.357     

           -------------------------------------------------
          |                Calculation Setup                |
           -------------------------------------------------

          program call               : /ihome/ghutchison/geoffh/xtb/xtb 646.xyz -opt
          hostname                   : smp-n144
          coordinate file            : 646.xyz
          omp threads                :                     1
          number of atoms            :                    23
          number of electrons        :                    70
          charge                     :                     0
          spin                       :                   0.0
          first test random number   :      0.33246523014248


########################################################################
# WARNING! Please study the warnings concerning your input carefully
#  - the use of '-opt' is discouraged, please use '--opt' next time
########################################################################

           ------------------------------------------------- 
          |                 G F N 2 - x T B                 |
          | Geometry, Frequencies, Noncovalent interactions |
          |            JCTC 2019 parametrisation            |
           ------------------------------------------------- 
             KAB for C  - Si     :                1.0500
             KAB for H  - Pd     :                0.9500
             k(s)              :                1.8500
             k(p)              :                2.2300
             k(d)              :                2.2300
             k(f)              :                2.0000
             kEN (H0ij)        :               -2.0000
             D4 a1             :                0.5200
             D4 a2             :                5.0000
             D4 s6             :                1.0000
             D4 s8             :                2.7000
             D4 s9             :                5.0000
             alphaj            :                2.0000

  Z AO/shell   Hii/eV     exponent
  1     Wed Apr 25 08:07:45 CEST 2018   EN: 2.200 GM2: 0.406  GM3: 0.0800  RAES: 1.40
     1s    -10.707211    1.230000
  6     Wed Apr 25 08:07:45 CEST 2018   EN: 2.550 GM2: 0.538  GM3: 0.1500  RAES: 3.00
     2s    -13.970922    2.096432
     2p    -10.063292    1.800000
  8     Wed Apr 25 08:07:45 CEST 2018   EN: 3.440 GM2: 0.452  GM3:-0.0517  RAES: 1.80
     2s    -20.229985    2.439742
     2p    -15.503117    2.137023
 16     Tue Apr 24 11:44:34 CEST 2018   EN: 2.580 GM2: 0.340  GM3:-0.0502  RAES: 3.10
     3s    -20.029654    1.981333
     3p    -11.377694    2.025643
     3d     -0.420282    1.702555

           ------------------------------------------------- 
          |        Self-Consistent Charge Iterations        |
           ------------------------------------------------- 

          ...................................................
          :                      SETUP                      :
          :.................................................:
          :  # basis functions                  74          :
          :  # atomic orbitals                  72          :
          :  # shells                           38          :
          :  # electrons                        70          :
          :  max. iterations                   250          :
          :  Hamiltonian                  GFN2-xTB          :
          :  restarted?                      false          :
          :  GBSA solvation                  false          :
          :  PC potential                    false          :
          :  electronic temp.          300.0000000     K    :
          :  accuracy                    1.0000000          :
          :  -> integral cutoff          0.2500000E+02      :
          :  -> integral neglect         0.1000000E-07      :
          :  -> SCF convergence          0.1000000E-05 Eh   :
          :  -> wf. convergence          0.1000000E-03 e    :
          :  Broyden damping             0.4000000          :
          ...................................................

 iter      E             dE          RMSdq      gap      omega  full diag
   1    -39.3740772 -0.393741E+02  0.542E+00    3.09       0.0  T
   2    -39.4070796 -0.330023E-01  0.319E+00    3.14       1.0  T
   3    -39.4080649 -0.985349E-03  0.972E-01    3.10       1.0  T
   4    -39.4110458 -0.298091E-02  0.387E-01    3.11       1.0  T
   5    -39.4108146  0.231187E-03  0.250E-01    3.11       1.0  T
   6    -39.4115680 -0.753422E-03  0.971E-02    3.11       1.0  T
   7    -39.4116096 -0.415392E-04  0.450E-02    3.11       1.0  T
   8    -39.4116143 -0.468826E-05  0.174E-02    3.11       1.2  T
   9    -39.4116168 -0.250881E-05  0.731E-03    3.11       2.9  T
  10    -39.4116171 -0.324822E-06  0.361E-03    3.11       5.8  T
  11    -39.4116171 -0.413602E-07  0.150E-03    3.11      13.9  T
  12    -39.4116172 -0.106857E-07  0.780E-04    3.11      26.7  T
  13    -39.4116172 -0.889909E-08  0.216E-04    3.11      96.4  T

   *** convergence criteria satisfied after 13 iterations ***

         #    Occupation            Energy/Eh            Energy/eV
      -------------------------------------------------------------
         1        2.0000           -0.7777518             -21.1637
       ...           ...                  ...                  ...
        29        2.0000           -0.4526322             -12.3167
        30        2.0000           -0.4435085             -12.0685
        31        2.0000           -0.4380231             -11.9192
        32        2.0000           -0.4372080             -11.8970
        33        2.0000           -0.4155377             -11.3074
        34        2.0000           -0.4043106             -11.0019
        35        2.0000           -0.3914424             -10.6517 (HOMO)
        36                         -0.2771932              -7.5428 (LUMO)
        37                         -0.2220591              -6.0425
        38                         -0.2131598              -5.8004
        39                         -0.1799850              -4.8976
        40                         -0.1345047              -3.6601
       ...                                ...                  ...
        72                          1.1313294              30.7850
      -------------------------------------------------------------
                  HL-Gap            0.1142492 Eh            3.1089 eV
             Fermi-level           -0.3343178 Eh           -9.0973 eV

 SCC (total)                   0 d,  0 h,  0 min,  0.043 sec
 SCC setup                      ...        0 min,  0.000 sec (  0.688%)
 Dispersion                     ...        0 min,  0.000 sec (  0.713%)
 integral evaluation            ...        0 min,  0.010 sec ( 24.079%)
 zeroth order Hamiltonian       ...        0 min,  0.000 sec (  0.469%)
 iterations                     ...        0 min,  0.016 sec ( 36.642%)
 molecular gradient             ...        0 min,  0.016 sec ( 36.426%)
 printout                       ...        0 min,  0.000 sec (  0.850%)

         :::::::::::::::::::::::::::::::::::::::::::::::::::::
         ::                     SUMMARY                     ::
         :::::::::::::::::::::::::::::::::::::::::::::::::::::
         :: total energy             -38.944094479241 Eh    ::
         :: gradient norm              0.064184360458 Eh/a0 ::
         :: HOMO-LUMO gap              3.108878689192 eV    ::
         ::.................................................::
         :: SCC energy               -39.411617163330 Eh    ::
         :: -> isotropic ES            0.067289630496 Eh    ::
         :: -> anisotropic ES         -0.003188572318 Eh    ::
         :: -> anisotropic XC          0.014056501883 Eh    ::
         :: -> dispersion             -0.026272111510 Eh    ::
         :: repulsion energy           0.467316019316 Eh    ::
         :: add. restraining           0.000000000000 Eh    ::
         :::::::::::::::::::::::::::::::::::::::::::::::::::::

      ----------------------------------------------------------- 
     |                   =====================                   |
     |                        A N C O P T                        |
     |                   =====================                   |
     |               Approximate Normal Coordinate               |
     |                Rational Function Optimizer                |
      ----------------------------------------------------------- 

          ...................................................
          :                      SETUP                      :
          :.................................................:
          :   optimization level            normal          :
          :   max. optcycles                   200          :
          :   ANC micro-cycles                  20          :
          :   degrees of freedom                63          :
          :.................................................:
          :   RF solver                   davidson          :
          :   input Hessian                  false          :
          :   write xtbopt.log                true          :
          :   linear?                        false          :
          :   energy convergence         0.5000000E-05 Eh   :
          :   grad. convergence          0.1000000E-02 Eh/α :
          :   maximium RF displ.         2.0000000          :
          :   Hlow (freq-cutoff)         0.5000000E-02      :
          :   Hmax (freq-cutoff)         5.0000000          :
          :   S6 in model hess.         20.0000000          :
          ...................................................

generating ANC from model Hessian ...
Using Lindh-Hessian (1995)
 Shifting diagonal of input Hessian by   3.457409295296492E-003
 Lowest  eigenvalues of input Hessian
   -0.000000   -0.000000    0.000000    0.000000    0.000000    0.000000
    0.005000    0.007113    0.008716    0.009976    0.013180    0.019462
    0.022168    0.023863    0.028569    0.031419    0.034568    0.042694
 Highest eigenvalues
    1.626415    1.768703    1.810787    1.974638    2.412051    3.302215
 

........................................................................
.............................. CYCLE    1 ..............................
........................................................................
   1    -39.4116172 -0.394116E+02  0.986E-05    3.11       0.0  T
   2    -39.4116172 -0.387388E-10  0.609E-05    3.11     342.5  T
   3    -39.4116172 -0.218989E-10  0.398E-05    3.11     523.8  T
     SCC iter.                  ...        0 min,  0.004 sec
     gradient                   ...        0 min,  0.015 sec
 * total energy  :   -38.9440945 Eh     change        0.1062073E-07 Eh
   gradient norm :     0.0641844 Eh/α   predicted     0.0000000E+00 (-100.00%)
   displ. norm   :     0.2480629 α      lambda       -0.6223783E-02
   maximum displ.:     0.0991753 α      in ANC's #6, #14, #9, ...

........................................................................
.............................. CYCLE    2 ..............................
........................................................................
   1    -39.4315096 -0.394315E+02  0.298E-01    3.16       0.0  T
   2    -39.4315513 -0.416185E-04  0.149E-01    3.16       1.0  T
   3    -39.4314679  0.833645E-04  0.785E-02    3.16       1.0  T
   4    -39.4315844 -0.116523E-03  0.258E-02    3.16       1.0  T
   5    -39.4315880 -0.361132E-05  0.108E-02    3.16       1.9  T
   6    -39.4315887 -0.652057E-06  0.374E-03    3.16       5.6  T
   7    -39.4315889 -0.256665E-06  0.957E-04    3.16      21.8  T
     SCC iter.                  ...        0 min,  0.008 sec
     gradient                   ...        0 min,  0.015 sec
 * total energy  :   -38.9485244 Eh     change       -0.4429977E-02 Eh
   gradient norm :     0.0291243 Eh/α   predicted    -0.3303383E-02 ( -25.43%)
   displ. norm   :     0.2497248 α      lambda       -0.2452316E-02
   maximum displ.:     0.1182927 α      in ANC's #6, #4, #7, ...

........................................................................
.............................. CYCLE    3 ..............................
........................................................................
   1    -39.4404672 -0.394405E+02  0.273E-01    3.17       0.0  T
   2    -39.4405047 -0.375498E-04  0.138E-01    3.17       1.0  T
   3    -39.4404655  0.392041E-04  0.622E-02    3.17       1.0  T
   4    -39.4405164 -0.508678E-04  0.269E-02    3.17       1.0  T
   5    -39.4405235 -0.713009E-05  0.977E-03    3.17       2.1  T
   6    -39.4405238 -0.330164E-06  0.310E-03    3.17       6.7  T
   7    -39.4405240 -0.176728E-06  0.971E-04    3.17      21.5  T
     SCC iter.                  ...        0 min,  0.008 sec
     gradient                   ...        0 min,  0.015 sec
 * total energy  :   -38.9500031 Eh     change       -0.1478615E-02 Eh
   gradient norm :     0.0090058 Eh/α   predicted    -0.1302636E-02 ( -11.90%)
   displ. norm   :     0.1821689 α      lambda       -0.4935449E-03
   maximum displ.:     0.1016034 α      in ANC's #4, #2, #7, ...

........................................................................
.............................. CYCLE    4 ..............................
........................................................................
   1    -39.4401483 -0.394401E+02  0.167E-01    3.15       0.0  T
   2    -39.4401571 -0.881764E-05  0.856E-02    3.15       1.0  T
   3    -39.4401573 -0.220137E-06  0.216E-02    3.15       1.0  T
   4    -39.4401579 -0.571002E-06  0.108E-02    3.15       1.9  T
   5    -39.4401587 -0.839419E-06  0.492E-03    3.15       4.2  T
   6    -39.4401590 -0.303057E-06  0.837E-04    3.15      24.9  T
   7    -39.4401590 -0.319493E-08  0.441E-04    3.15      47.3  T
     SCC iter.                  ...        0 min,  0.008 sec
     gradient                   ...        0 min,  0.015 sec
 * total energy  :   -38.9503820 Eh     change       -0.3788960E-03 Eh
   gradient norm :     0.0075978 Eh/α   predicted    -0.2549620E-03 ( -32.71%)
   displ. norm   :     0.2914252 α      lambda       -0.5391360E-03
   maximum displ.:     0.1525401 α      in ANC's #7, #4, #2, ...

........................................................................
.............................. CYCLE    5 ..............................
........................................................................
   1    -39.4377264 -0.394377E+02  0.253E-01    3.12       0.0  T
   2    -39.4377433 -0.168572E-04  0.131E-01    3.12       1.0  T
   3    -39.4377405  0.283409E-05  0.328E-02    3.13       1.0  T
   4    -39.4377446 -0.416668E-05  0.179E-02    3.13       1.2  T
   5    -39.4377479 -0.323702E-05  0.615E-03    3.13       3.4  T
   6    -39.4377482 -0.358085E-06  0.151E-03    3.13      13.8  T
   7    -39.4377482 -0.184928E-07  0.796E-04    3.13      26.2  T
     SCC iter.                  ...        0 min,  0.008 sec
     gradient                   ...        0 min,  0.015 sec
 * total energy  :   -38.9507422 Eh     change       -0.3602438E-03 Eh
   gradient norm :     0.0080404 Eh/α   predicted    -0.2924651E-03 ( -18.81%)
   displ. norm   :     0.2160582 α      lambda       -0.2812543E-03
   maximum displ.:     0.1268517 α      in ANC's #7, #4, #2, ...

........................................................................
.............................. CYCLE    6 ..............................
........................................................................
   1    -39.4368862 -0.394369E+02  0.181E-01    3.11       0.0  T
   2    -39.4368936 -0.738457E-05  0.960E-02    3.11       1.0  T
   3    -39.4368852  0.837372E-05  0.296E-02    3.11       1.0  T
   4    -39.4368957 -0.105088E-04  0.132E-02    3.11       1.6  T
   5    -39.4368969 -0.113451E-05  0.370E-03    3.11       5.6  T
   6    -39.4368970 -0.135113E-06  0.105E-03    3.11      19.9  T
   7    -39.4368970 -0.926731E-08  0.576E-04    3.11      36.2  T
     SCC iter.                  ...        0 min,  0.008 sec
     gradient                   ...        0 min,  0.014 sec
 * total energy  :   -38.9509076 Eh     change       -0.1653697E-03 Eh
   gradient norm :     0.0072633 Eh/α   predicted    -0.1471920E-03 ( -10.99%)
   displ. norm   :     0.1345467 α      lambda       -0.1822933E-03
   maximum displ.:     0.0805986 α      in ANC's #7, #2, #4, ...

........................................................................
.............................. CYCLE    7 ..............................
........................................................................
   1    -39.4381262 -0.394381E+02  0.104E-01    3.11       0.0  T
   2    -39.4381289 -0.264462E-05  0.564E-02    3.11       1.0  T
   3    -39.4381235  0.540520E-05  0.211E-02    3.11       1.0  T
   4    -39.4381302 -0.670696E-05  0.719E-03    3.11       2.9  T
   5    -39.4381303 -0.127347E-06  0.214E-03    3.11       9.7  T
   6    -39.4381303 -0.483223E-07  0.753E-04    3.11      27.7  T
     SCC iter.                  ...        0 min,  0.007 sec
     gradient                   ...        0 min,  0.014 sec
 * total energy  :   -38.9510182 Eh     change       -0.1106155E-03 Eh
   gradient norm :     0.0049206 Eh/α   predicted    -0.9280285E-04 ( -16.10%)
   displ. norm   :     0.0601452 α      lambda       -0.8913638E-04
   maximum displ.:     0.0252457 α      in ANC's #7, #4, #5, ...

........................................................................
.............................. CYCLE    8 ..............................
........................................................................
   1    -39.4402409 -0.394402E+02  0.446E-02    3.11       0.0  T
   2    -39.4402417 -0.834272E-06  0.255E-02    3.11       1.0  T
   3    -39.4402401  0.158648E-05  0.115E-02    3.11       1.8  T
   4    -39.4402420 -0.188050E-05  0.359E-03    3.11       5.8  T
   5    -39.4402421 -0.747125E-07  0.137E-03    3.11      15.3  T
   6    -39.4402421 -0.175279E-08  0.336E-04    3.11      62.1  T
     SCC iter.                  ...        0 min,  0.007 sec
     gradient                   ...        0 min,  0.015 sec
 * total energy  :   -38.9510725 Eh     change       -0.5429039E-04 Eh
   gradient norm :     0.0024361 Eh/α   predicted    -0.4473006E-04 ( -17.61%)
   displ. norm   :     0.0663278 α      lambda       -0.3121285E-04
   maximum displ.:     0.0431811 α      in ANC's #4, #2, #5, ...

........................................................................
.............................. CYCLE    9 ..............................
........................................................................
   1    -39.4400976 -0.394401E+02  0.473E-02    3.10       0.0  T
   2    -39.4400980 -0.415607E-06  0.259E-02    3.10       1.0  T
   3    -39.4400971  0.994115E-06  0.858E-03    3.10       2.4  T
   4    -39.4400983 -0.120092E-05  0.301E-03    3.10       6.9  T
   5    -39.4400983 -0.332493E-07  0.863E-04    3.10      24.2  T
   6    -39.4400983 -0.111756E-07  0.257E-04    3.10      81.0  T
     SCC iter.                  ...        0 min,  0.007 sec
     gradient                   ...        0 min,  0.016 sec
 * total energy  :   -38.9510928 Eh     change       -0.2036538E-04 Eh
   gradient norm :     0.0023107 Eh/α   predicted    -0.1568123E-04 ( -23.00%)
   displ. norm   :     0.0462141 α      lambda       -0.2038353E-04
   maximum displ.:     0.0359287 α      in ANC's #4, #5, #2, ...

........................................................................
.............................. CYCLE   10 ..............................
........................................................................
   1    -39.4402862 -0.394403E+02  0.396E-02    3.10       0.0  T
   2    -39.4402867 -0.435014E-06  0.205E-02    3.10       1.0  T
   3    -39.4402859  0.779577E-06  0.774E-03    3.10       2.7  T
   4    -39.4402869 -0.992754E-06  0.277E-03    3.10       7.5  T
   5    -39.4402869 -0.269626E-07  0.929E-04    3.10      22.5  T
   6    -39.4402869 -0.840700E-08  0.332E-04    3.10      62.9  T
     SCC iter.                  ...        0 min,  0.007 sec
     gradient                   ...        0 min,  0.016 sec
 * total energy  :   -38.9511068 Eh     change       -0.1397240E-04 Eh
   gradient norm :     0.0019756 Eh/α   predicted    -0.1021432E-04 ( -26.90%)
   displ. norm   :     0.0736139 α      lambda       -0.1369571E-04
   maximum displ.:     0.0569872 α      in ANC's #4, #5, #2, ...

........................................................................
.............................. CYCLE   11 ..............................
........................................................................
   1    -39.4399492 -0.394399E+02  0.577E-02    3.09       0.0  T
   2    -39.4399500 -0.789867E-06  0.304E-02    3.09       1.0  T
   3    -39.4399498  0.234943E-06  0.688E-03    3.09       3.0  T
   4    -39.4399501 -0.283760E-06  0.396E-03    3.09       5.3  T
   5    -39.4399502 -0.176108E-06  0.123E-03    3.09      17.0  T
   6    -39.4399502 -0.955304E-08  0.395E-04    3.09      52.7  T
   7    -39.4399502 -0.261902E-08  0.147E-04    3.09     142.0  T
     SCC iter.                  ...        0 min,  0.008 sec
     gradient                   ...        0 min,  0.016 sec
 * total energy  :   -38.9511185 Eh     change       -0.1172735E-04 Eh
   gradient norm :     0.0013521 Eh/α   predicted    -0.6865535E-05 ( -41.46%)
   displ. norm   :     0.0323014 α      lambda       -0.5245492E-05
   maximum displ.:     0.0252086 α      in ANC's #4, #2, #6, ...

........................................................................
.............................. CYCLE   12 ..............................
........................................................................
   1    -39.4400061 -0.394400E+02  0.249E-02    3.09       0.0  T
   2    -39.4400062 -0.133656E-06  0.134E-02    3.09       1.6  T
   3    -39.4400058  0.388791E-06  0.555E-03    3.09       3.8  T
   4    -39.4400063 -0.471906E-06  0.162E-03    3.09      12.9  T
   5    -39.4400063 -0.994520E-08  0.399E-04    3.09      52.3  T
   6    -39.4400063 -0.992493E-09  0.102E-04    3.09     204.2  T
     SCC iter.                  ...        0 min,  0.007 sec
     gradient                   ...        0 min,  0.015 sec
 * total energy  :   -38.9511229 Eh     change       -0.4316849E-05 Eh
   gradient norm :     0.0007394 Eh/α   predicted    -0.2626931E-05 ( -39.15%)
   displ. norm   :     0.0208579 α      lambda       -0.2172696E-05
   maximum displ.:     0.0116308 α      in ANC's #2, #4, #5, ...

   *** GEOMETRY OPTIMIZATION CONVERGED AFTER 12 ITERATIONS ***

------------------------------------------------------------------------
 total energy gain   :        -0.0070284 Eh       -4.4104 kcal/mol
 total RMSD          :         0.2803288 a0        0.1483 Å
 total power (kW/mol):        -1.5377505 (step)  -45.0531 (real)
------------------------------------------------------------------------

 ANCopt (total)                0 d,  0 h,  0 min,  0.410 sec
 optimizer setup                ...        0 min,  0.000 sec (  0.039%)
 model hessian                  ...        0 min,  0.006 sec (  1.559%)
 ANC generation                 ...        0 min,  0.001 sec (  0.154%)
 coordinate transformation      ...        0 min,  0.000 sec (  0.054%)
 single point calculation       ...        0 min,  0.398 sec ( 97.224%)
 optimization log               ...        0 min,  0.001 sec (  0.279%)
 hessian update                 ...        0 min,  0.000 sec (  0.038%)
 rational function              ...        0 min,  0.002 sec (  0.458%)

================
 final structure:
================
$coord
    2.78644139448540   -2.40736311656539   -0.23394414257981      C 
    5.15709760817313   -0.21664203180820   -0.10045647351108      S 
    2.98146433759337    2.23714080084520    0.11715171432462      C 
    0.53809633590038    1.32889239169090    0.05928102075299      C 
    0.43836663312741   -1.34960972165325   -0.14805160660587      C 
   -1.91744291229152   -2.91107712164076   -0.37642796186689      C 
   -4.16841052905321   -1.66440872925495    0.86996216757665      C 
   -4.57296447522525    1.31330652418693   -0.78571820516092      S 
   -4.52812292041188    0.84683574996042   -3.45766288591260      O 
   -6.70484971519479    2.65973862817252    0.22572956532881      O 
   -1.72877173511968    2.99306823050110    0.16208014912271      C 
    3.98623613055445    4.76509557733635    0.29701585352321      C 
    2.80320016646024    6.84709080467238    1.06200377550414      C 
    3.24531465177717   -4.37442049992696   -0.38814559947425      H 
   -1.57655275002273   -4.79255859244255    0.40399635077107      H 
   -2.36403401744369   -3.12197285787079   -2.38581668452895      H 
   -3.86220527739004   -1.20855802663331    2.84799018822759      H 
   -5.89195255234063   -2.75829707818938    0.65350293486792      H 
   -2.13171200950184    3.65958166739218    2.06835358346117      H 
   -1.53808167457695    4.60450016788330   -1.10347884955439      H 
    5.96058648301865    4.89181642728635   -0.23035515945788      H 
    0.87650676773237    6.87402262524375    1.69776230475342      H 
    3.78485954501056    8.62731859880252    1.10596810259780      H 
$end
           -------------------------------------------------
          |                Final Singlepoint                |
           -------------------------------------------------

          ...................................................
          :                      SETUP                      :
          :.................................................:
          :  # basis functions                  74          :
          :  # atomic orbitals                  72          :
          :  # shells                           38          :
          :  # electrons                        70          :
          :  max. iterations                   250          :
          :  Hamiltonian                  GFN2-xTB          :
          :  restarted?                      false          :
          :  GBSA solvation                  false          :
          :  PC potential                    false          :
          :  electronic temp.          300.0000000     K    :
          :  accuracy                    1.0000000          :
          :  -> integral cutoff          0.2500000E+02      :
          :  -> integral neglect         0.1000000E-07      :
          :  -> SCF convergence          0.1000000E-05 Eh   :
          :  -> wf. convergence          0.1000000E-03 e    :
          :  Broyden damping             0.4000000          :
          ...................................................

 iter      E             dE          RMSdq      gap      omega  full diag
   1    -39.4400063 -0.394400E+02  0.586E-05    3.09       0.0  T
   2    -39.4400063 -0.309797E-11  0.305E-05    3.09     682.6  T
   3    -39.4400063 -0.137490E-10  0.234E-05    3.09     889.4  T

   *** convergence criteria satisfied after 3 iterations ***

         #    Occupation            Energy/Eh            Energy/eV
      -------------------------------------------------------------
         1        2.0000           -0.7790969             -21.2003
       ...           ...                  ...                  ...
        29        2.0000           -0.4517762             -12.2935
        30        2.0000           -0.4464099             -12.1474
        31        2.0000           -0.4415846             -12.0161
        32        2.0000           -0.4382284             -11.9248
        33        2.0000           -0.4152581             -11.2997
        34        2.0000           -0.4039919             -10.9932
        35        2.0000           -0.3911603             -10.6440 (HOMO)
        36                         -0.2775614              -7.5528 (LUMO)
        37                         -0.2196410              -5.9767
        38                         -0.2120246              -5.7695
        39                         -0.1687577              -4.5921
        40                         -0.1341636              -3.6508
       ...                                ...                  ...
        72                          1.2236975              33.2985
      -------------------------------------------------------------
                  HL-Gap            0.1135989 Eh            3.0912 eV
             Fermi-level           -0.3343609 Eh           -9.0984 eV

 SCC (total)                   0 d,  0 h,  0 min,  0.030 sec
 SCC setup                      ...        0 min,  0.000 sec (  0.682%)
 Dispersion                     ...        0 min,  0.000 sec (  0.610%)
 integral evaluation            ...        0 min,  0.010 sec ( 32.245%)
 zeroth order Hamiltonian       ...        0 min,  0.000 sec (  0.620%)
 iterations                     ...        0 min,  0.004 sec ( 13.804%)
 molecular gradient             ...        0 min,  0.015 sec ( 50.779%)
 printout                       ...        0 min,  0.000 sec (  1.077%)

         :::::::::::::::::::::::::::::::::::::::::::::::::::::
         ::                     SUMMARY                     ::
         :::::::::::::::::::::::::::::::::::::::::::::::::::::
         :: total energy             -38.951122860813 Eh    ::
         :: gradient norm              0.000739346554 Eh/a0 ::
         :: HOMO-LUMO gap              3.091183427450 eV    ::
         ::.................................................::
         :: SCC energy               -39.440006312308 Eh    ::
         :: -> isotropic ES            0.063918050242 Eh    ::
         :: -> anisotropic ES         -0.003726981741 Eh    ::
         :: -> anisotropic XC          0.013109872637 Eh    ::
         :: -> dispersion             -0.026522448611 Eh    ::
         :: repulsion energy           0.488680785632 Eh    ::
         :: add. restraining           0.000000000000 Eh    ::
         :::::::::::::::::::::::::::::::::::::::::::::::::::::

           -------------------------------------------------
          |                Property Printout                |
           -------------------------------------------------

    * Orbital Energies and Occupations

         #    Occupation            Energy/Eh            Energy/eV
      -------------------------------------------------------------
         1        2.0000           -0.7790969             -21.2003
       ...           ...                  ...                  ...
        23        2.0000           -0.4925485             -13.4029
        24        2.0000           -0.4832841             -13.1508
        25        2.0000           -0.4791719             -13.0389
        26        2.0000           -0.4720112             -12.8441
        27        2.0000           -0.4654244             -12.6648
        28        2.0000           -0.4572034             -12.4411
        29        2.0000           -0.4517762             -12.2935
        30        2.0000           -0.4464099             -12.1474
        31        2.0000           -0.4415846             -12.0161
        32        2.0000           -0.4382284             -11.9248
        33        2.0000           -0.4152581             -11.2997
        34        2.0000           -0.4039919             -10.9932
        35        2.0000           -0.3911603             -10.6440 (HOMO)
        36                         -0.2775614              -7.5528 (LUMO)
        37                         -0.2196410              -5.9767
        38                         -0.2120246              -5.7695
        39                         -0.1687577              -4.5921
        40                         -0.1341636              -3.6508
        41                         -0.1251059              -3.4043
        42                         -0.1053041              -2.8655
        43                         -0.0890889              -2.4242
        44                         -0.0549651              -1.4957
        45                         -0.0145993              -0.3973
        46                          0.0198616               0.5405
       ...                                ...                  ...
        72                          1.2236975              33.2985
      -------------------------------------------------------------
                  HL-Gap            0.1135989 Eh            3.0912 eV
             Fermi-level           -0.3343609 Eh           -9.0984 eV

     #   Z        covCN         q      C6AA      α(0)
     1   6 C      2.939    -0.034    28.839     8.807
     2  16 S      2.332    -0.008   141.391    20.013
     3   6 C      2.986     0.014    27.682     8.630
     4   6 C      3.188    -0.020    28.029     8.637
     5   6 C      3.153    -0.016    28.120     8.672
     6   6 C      3.900    -0.069    21.768     6.632
     7   6 C      3.799    -0.133    23.052     6.836
     8  16 S      3.797     0.972   107.453    17.447
     9   8 O      0.860    -0.540    24.684     6.661
    10   8 O      0.860    -0.543    24.762     6.672
    11   6 C      3.800    -0.133    23.045     6.835
    12   6 C      2.940    -0.032    28.788     8.800
    13   6 C      2.837    -0.092    30.307     9.022
    14   1 H      0.926     0.051     2.308     2.376
    15   1 H      0.924     0.059     2.209     2.324
    16   1 H      0.924     0.076     2.016     2.221
    17   1 H      0.925     0.066     2.131     2.283
    18   1 H      0.925     0.077     2.006     2.215
    19   1 H      0.925     0.072     2.066     2.248
    20   1 H      0.925     0.086     1.918     2.166
    21   1 H      0.925     0.051     2.308     2.376
    22   1 H      0.926     0.045     2.382     2.413
    23   1 H      0.926     0.050     2.322     2.383

 Mol. C6AA /au·bohr⁶  :       8650.831366
 Mol. C8AA /au·bohr⁸  :     249549.183014
 Mol. α(0) /au        :        146.668159


Wiberg/Mayer (AO) data.
largest (>0.10) Wiberg bond orders for each atom
          total WBO             WBO to atom ...
     1  C   3.948        C    5 1.576    S    2 1.204    H   14 0.969    C    3 0.100
     2  S   2.631        C    1 1.204    C    3 1.142
     3  C   3.950        C    4 1.492    S    2 1.142    C   12 1.129    C    1 0.100
     4  C   3.980        C    3 1.492    C    5 1.249    C   11 1.019
     5  C   3.985        C    1 1.576    C    4 1.249    C    6 1.007
     6  C   3.992        C    7 1.013    C    5 1.007    H   15 0.966    H   16 0.952
     7  C   3.986        C    6 1.013    H   17 0.973    H   18 0.967    S    8 0.768
     8  S   4.922        O    9 1.663    O   10 1.662    C    7 0.768    C   11 0.766
     9  O   1.958        S    8 1.663    O   10 0.113
    10  O   1.952        S    8 1.662    O    9 0.113
    11  C   3.986        C    4 1.019    H   19 0.956    H   20 0.954    S    8 0.766
    12  C   3.990        C   13 1.868    C    3 1.129    H   21 0.961
    13  C   3.990        C   12 1.868    H   23 0.977    H   22 0.972
    14  H   0.997        C    1 0.969
    15  H   0.996        C    6 0.966
    16  H   0.994        C    6 0.952
    17  H   0.996        C    7 0.973
    18  H   0.993        C    7 0.967
    19  H   0.995        C   11 0.956
    20  H   0.992        C   11 0.954
    21  H   0.997        C   12 0.961
    22  H   0.998        C   13 0.972
    23  H   0.997        C   13 0.977

molecular dipole:
                 x           y           z       tot (Debye)
 q only:        1.489      -0.661       1.007
   full:        1.236      -0.714       1.107       4.591
molecular quadrupole (traceless):
                xx          xy          yy          xz          yz          zz
 q only:      -11.432      10.983      11.835      -6.911       1.189      -0.403
  q+dip:      -14.908      12.356      15.630      -8.216       1.488      -0.722
   full:      -15.468      12.456      15.251      -7.771       1.045       0.217

           -------------------------------------------------
          |                Geometry Summary                 |
           -------------------------------------------------

      molecular mass/u    :      214.2968000
   center of mass at/Å    :       -0.2366279       0.5480406      -0.1325663
  moments of inertia/u·Å² :        0.4636317E+03   0.1032087E+04   0.1377402E+04
rotational constants/cm⁻¹ :        0.3635996E-01   0.1633353E-01   0.1223872E-01

 * 23 selected distances

     #   Z        #   Z                                     value/Å
     1   6 C      2  16 S                                 1.7095856
     2  16 S      3   6 C                                 1.7391975
     3   6 C      4   6 C                                 1.3797541
     1   6 C      5   6 C                                 1.3635610
     4   6 C      5   6 C                                 1.4226216
     5   6 C      6   6 C                                 1.5004928
     6   6 C      7   6 C                                 1.5129774
     7   6 C      8  16 S                                 1.8156048
     8  16 S      9   8 O                                 1.4355141
     8  16 S     10   8 O                                 1.4376530
     4   6 C     11   6 C                                 1.4891183
     8  16 S     11   6 C                                 1.8185039 (max)
    12   6 C     13   6 C                                 1.3302768
     1   6 C     14   1 H                                 1.0719801 (min)
     6   6 C     15   1 H                                 1.0928812
     6   6 C     16   1 H                                 1.0949704
     7   6 C     17   1 H                                 1.0863168
     7   6 C     18   1 H                                 1.0863022
    11   6 C     19   1 H                                 1.0897043
    11   6 C     20   1 H                                 1.0889634
    12   6 C     21   1 H                                 1.0834880
    13   6 C     22   1 H                                 1.0737294
    13   6 C     23   1 H                                 1.0760399

 * 4 distinct bonds (by element types)

   Z      Z             #   av. dist./Å        max./Å        min./Å
   1 H    6 C          10     1.0844376     1.0949704     1.0719801
   6 C    6 C           7     1.4284003     1.5129774     1.3302768
   6 C   16 S           4     1.7707230     1.8185039     1.7095856
   8 O   16 S           2     1.4365836     1.4376530     1.4355141


optimized geometry written to: xtbopt.xyz


           -------------------------------------------------
          | TOTAL ENERGY              -38.951122860813 Eh   |
          | GRADIENT NORM               0.000739346554 Eh/α |
          | HOMO-LUMO GAP               3.091183427450 eV   |
           -------------------------------------------------

------------------------------------------------------------------------
 * finished run on 2021/05/19 at 10:59:46.862     
------------------------------------------------------------------------
 total:
 * wall-time:     0 d,  0 h,  0 min,  0.505 sec
 *  cpu-time:     0 d,  0 h,  0 min,  0.503 sec
 * ratio c/w:     0.997 speedup
 SCF:
 * wall-time:     0 d,  0 h,  0 min,  0.043 sec
 *  cpu-time:     0 d,  0 h,  0 min,  0.043 sec
 * ratio c/w:     0.998 speedup
 ANC optimizer:
 * wall-time:     0 d,  0 h,  0 min,  0.440 sec
 *  cpu-time:     0 d,  0 h,  0 min,  0.439 sec
 * ratio c/w:     0.998 speedup

