      -----------------------------------------------------------      
     |                   =====================                   |     
     |                           x T B                           |     
     |                   =====================                   |     
     |                         S. Grimme                         |     
     |          Mulliken Center for Theoretical Chemistry        |     
     |                    University of Bonn                     |     
     |                Version 6.2 RC2 (SAW190805)                |     
      -----------------------------------------------------------      

   This program is distributed in the hope that it will be useful,
   but WITHOUT ANY WARRANTY; without even the implied warranty of
   MERCHANTABILITY or FITNESS FOR A PARTICULAR PURPOSE.
   
   FOR NON-COMMERCIAL, ACADEMIA USE ONLY.
   
   Cite this work as:
   * S. Grimme, C. Bannwarth, P. Shushkov, J. Chem. Theory Comput., 2017,
     13, 1989-2009. DOI: 10.1021/acs.jctc.7b00118
   * C. Bannwarth, S. Ehlert and S. Grimme., J. Chem. Theory Comput., 2019,
     15, 1652-1671. DOI: 10.1021/acs.jctc.8b01176
   * P. Pracht, E. Caldeweyher, S. Ehlert, S. Grimme, ChemRxiv, 2019, preprint.
     DOI: 10.26434/chemrxiv.8326202.v1
   
   for DFT-D4:
   * E. Caldeweyher, C. Bannwarth and S. Grimme, J. Chem. Phys., 2017,
     147, 034112. DOI: 10.1063/1.4993215
   * E. Caldeweyher, S. Ehlert, A. Hansen, H. Neugebauer, S. Spicher,
     C. Bannwarth and S. Grimme, J. Chem. Phys., 2019, 150, 154122.
     DOI: 10.1063/1.5090222
   
   for sTDA-xTB:
   * S. Grimme and C. Bannwarth, J. Chem. Phys., 2016, 145, 054103.
     DOI: 10.1063/1.4959605
   
   in the mass-spec context:
   * V. Asgeirsson, C. Bauer and S. Grimme, Chem. Sci., 2017, 8, 4879.
     DOI: 10.1039/c7sc00601b
   
   for metadynamics refer to:
   * S. Grimme, J. Chem. Theory Comput., 2019, 155, 2847-2862
     DOI: 10.1021/acs.jctc.9b00143
   
   with help from (in alphabetical order)
   C. Bannwarth, F. Bohle, G. Brandenburg, E. Caldeweyher, M. Checinski,
   S. Dohm, S. Ehlert, S. Ehrlich, F. März, H. Neugebauer, J. Pisarek,
   P. Pracht, P. Shushkov, and S. Spicher.
   
 * started run on 2021/05/19 at 10:59:46.880     

           -------------------------------------------------
          |                Calculation Setup                |
           -------------------------------------------------

          program call               : /ihome/ghutchison/geoffh/xtb/xtb 647.xyz -opt
          hostname                   : smp-n144
          coordinate file            : 647.xyz
          omp threads                :                     1
          number of atoms            :                    32
          number of electrons        :                    92
          charge                     :                     0
          spin                       :                   0.0
          first test random number   :      0.77127680487862


########################################################################
# WARNING! Please study the warnings concerning your input carefully
#  - the use of '-opt' is discouraged, please use '--opt' next time
########################################################################

           ------------------------------------------------- 
          |                 G F N 2 - x T B                 |
          | Geometry, Frequencies, Noncovalent interactions |
          |            JCTC 2019 parametrisation            |
           ------------------------------------------------- 
             KAB for C  - Si     :                1.0500
             KAB for H  - Pd     :                0.9500
             k(s)              :                1.8500
             k(p)              :                2.2300
             k(d)              :                2.2300
             k(f)              :                2.0000
             kEN (H0ij)        :               -2.0000
             D4 a1             :                0.5200
             D4 a2             :                5.0000
             D4 s6             :                1.0000
             D4 s8             :                2.7000
             D4 s9             :                5.0000
             alphaj            :                2.0000

  Z AO/shell   Hii/eV     exponent
  1     Wed Apr 25 08:07:45 CEST 2018   EN: 2.200 GM2: 0.406  GM3: 0.0800  RAES: 1.40
     1s    -10.707211    1.230000
  6     Wed Apr 25 08:07:45 CEST 2018   EN: 2.550 GM2: 0.538  GM3: 0.1500  RAES: 3.00
     2s    -13.970922    2.096432
     2p    -10.063292    1.800000
  7     Wed Apr 25 08:07:45 CEST 2018   EN: 3.040 GM2: 0.461  GM3:-0.0640  RAES: 1.90
     2s    -16.686243    2.339881
     2p    -12.523956    2.014332
 16     Tue Apr 24 11:44:34 CEST 2018   EN: 2.580 GM2: 0.340  GM3:-0.0502  RAES: 3.10
     3s    -20.029654    1.981333
     3p    -11.377694    2.025643
     3d     -0.420282    1.702555

           ------------------------------------------------- 
          |        Self-Consistent Charge Iterations        |
           ------------------------------------------------- 

          ...................................................
          :                      SETUP                      :
          :.................................................:
          :  # basis functions                  98          :
          :  # atomic orbitals                  96          :
          :  # shells                           52          :
          :  # electrons                        92          :
          :  max. iterations                   250          :
          :  Hamiltonian                  GFN2-xTB          :
          :  restarted?                      false          :
          :  GBSA solvation                  false          :
          :  PC potential                    false          :
          :  electronic temp.          300.0000000     K    :
          :  accuracy                    1.0000000          :
          :  -> integral cutoff          0.2500000E+02      :
          :  -> integral neglect         0.1000000E-07      :
          :  -> SCF convergence          0.1000000E-05 Eh   :
          :  -> wf. convergence          0.1000000E-03 e    :
          :  Broyden damping             0.4000000          :
          ...................................................

 iter      E             dE          RMSdq      gap      omega  full diag
   1    -50.0569680 -0.500570E+02  0.421E+00    1.89       0.0  T
   2    -50.0877678 -0.307998E-01  0.246E+00    1.84       1.0  T
   3    -50.0436162  0.441516E-01  0.145E+00    1.89       1.0  T
   4    -50.0950688 -0.514526E-01  0.495E-01    1.81       1.0  T
   5    -50.0985785 -0.350972E-02  0.245E-01    1.84       1.0  T
   6    -50.1000014 -0.142284E-02  0.780E-02    1.83       1.0  T
   7    -50.1000786 -0.772117E-04  0.308E-02    1.83       1.0  T
   8    -50.1000932 -0.146240E-04  0.123E-02    1.83       1.4  T
   9    -50.1000944 -0.117582E-05  0.612E-03    1.83       2.9  T
  10    -50.1000946 -0.214272E-06  0.298E-03    1.83       5.9  T
  11    -50.1000947 -0.131856E-06  0.120E-03    1.83      14.7  T
  12    -50.1000947 -0.165555E-07  0.568E-04    1.83      31.1  T
  13    -50.1000947 -0.273056E-08  0.257E-04    1.83      68.7  T

   *** convergence criteria satisfied after 13 iterations ***

         #    Occupation            Energy/Eh            Energy/eV
      -------------------------------------------------------------
         1        2.0000           -0.7339285             -19.9712
       ...           ...                  ...                  ...
        40        2.0000           -0.4268141             -11.6142
        41        2.0000           -0.4012627             -10.9189
        42        2.0000           -0.3970667             -10.8047
        43        2.0000           -0.3800642             -10.3421
        44        2.0000           -0.3769268             -10.2567
        45        2.0000           -0.3632930              -9.8857
        46        2.0000           -0.3541684              -9.6374 (HOMO)
        47                         -0.2868747              -7.8063 (LUMO)
        48                         -0.2492589              -6.7827
        49                         -0.2244083              -6.1065
        50                         -0.2017972              -5.4912
        51                         -0.1935460              -5.2667
       ...                                ...                  ...
        96                          0.7499215              20.4064
      -------------------------------------------------------------
                  HL-Gap            0.0672937 Eh            1.8312 eV
             Fermi-level           -0.3205216 Eh           -8.7218 eV

 SCC (total)                   0 d,  0 h,  0 min,  0.069 sec
 SCC setup                      ...        0 min,  0.000 sec (  0.601%)
 Dispersion                     ...        0 min,  0.001 sec (  0.811%)
 integral evaluation            ...        0 min,  0.017 sec ( 25.361%)
 zeroth order Hamiltonian       ...        0 min,  0.000 sec (  0.452%)
 iterations                     ...        0 min,  0.025 sec ( 35.677%)
 molecular gradient             ...        0 min,  0.025 sec ( 36.369%)
 printout                       ...        0 min,  0.000 sec (  0.647%)

         :::::::::::::::::::::::::::::::::::::::::::::::::::::
         ::                     SUMMARY                     ::
         :::::::::::::::::::::::::::::::::::::::::::::::::::::
         :: total energy             -49.355135597541 Eh    ::
         :: gradient norm              0.075632268453 Eh/a0 ::
         :: HOMO-LUMO gap              1.831155014009 eV    ::
         ::.................................................::
         :: SCC energy               -50.100094738091 Eh    ::
         :: -> isotropic ES            0.022889280760 Eh    ::
         :: -> anisotropic ES          0.007653297107 Eh    ::
         :: -> anisotropic XC          0.030241090117 Eh    ::
         :: -> dispersion             -0.038816806610 Eh    ::
         :: repulsion energy           0.744756424331 Eh    ::
         :: add. restraining           0.000000000000 Eh    ::
         :::::::::::::::::::::::::::::::::::::::::::::::::::::

      ----------------------------------------------------------- 
     |                   =====================                   |
     |                        A N C O P T                        |
     |                   =====================                   |
     |               Approximate Normal Coordinate               |
     |                Rational Function Optimizer                |
      ----------------------------------------------------------- 

          ...................................................
          :                      SETUP                      :
          :.................................................:
          :   optimization level            normal          :
          :   max. optcycles                   200          :
          :   ANC micro-cycles                  20          :
          :   degrees of freedom                90          :
          :.................................................:
          :   RF solver                   davidson          :
          :   input Hessian                  false          :
          :   write xtbopt.log                true          :
          :   linear?                        false          :
          :   energy convergence         0.5000000E-05 Eh   :
          :   grad. convergence          0.1000000E-02 Eh/α :
          :   maximium RF displ.         2.0000000          :
          :   Hlow (freq-cutoff)         0.5000000E-02      :
          :   Hmax (freq-cutoff)         5.0000000          :
          :   S6 in model hess.         20.0000000          :
          ...................................................

generating ANC from model Hessian ...
Using Lindh-Hessian (1995)
 Shifting diagonal of input Hessian by   4.636181396804212E-003
 Lowest  eigenvalues of input Hessian
   -0.000000   -0.000000   -0.000000   -0.000000    0.000000    0.000000
    0.005000    0.005979    0.006283    0.006666    0.007772    0.008496
    0.009182    0.010151    0.011332    0.013208    0.013634    0.016335
 Highest eigenvalues
    1.827876    1.904476    1.983605    1.998953    2.023076    2.106571
 

........................................................................
.............................. CYCLE    1 ..............................
........................................................................
   1    -50.1000947 -0.501001E+02  0.123E-04    1.83       0.0  T
   2    -50.1000947 -0.392646E-10  0.855E-05    1.83     206.7  T
   3    -50.1000947 -0.517844E-10  0.636E-05    1.83     277.8  T
     SCC iter.                  ...        0 min,  0.006 sec
     gradient                   ...        0 min,  0.025 sec
 * total energy  :   -49.3551357 Eh     change       -0.8444995E-07 Eh
   gradient norm :     0.0756322 Eh/α   predicted     0.0000000E+00 (-100.00%)
   displ. norm   :     0.2950786 α      lambda       -0.1053632E-01
   maximum displ.:     0.0980434 α      in ANC's #8, #13, #26, ...

........................................................................
.............................. CYCLE    2 ..............................
........................................................................
   1    -50.1062064 -0.501062E+02  0.250E-01    1.80       0.0  T
   2    -50.1062041  0.232232E-05  0.163E-01    1.81       1.0  T
   3    -50.1061050  0.991180E-04  0.115E-01    1.81       1.0  T
   4    -50.1064399 -0.334894E-03  0.335E-02    1.80       1.0  T
   5    -50.1064579 -0.180261E-04  0.144E-02    1.81       1.2  T
   6    -50.1064600 -0.208758E-05  0.464E-03    1.81       3.8  T
   7    -50.1064603 -0.331617E-06  0.158E-03    1.81      11.2  T
     SCC iter.                  ...        0 min,  0.013 sec
     gradient                   ...        0 min,  0.023 sec
 * total energy  :   -49.3621787 Eh     change       -0.7042977E-02 Eh
   gradient norm :     0.0327968 Eh/α   predicted    -0.5726872E-02 ( -18.69%)
   displ. norm   :     0.2781597 α      lambda       -0.2782382E-02
   maximum displ.:     0.1544818 α      in ANC's #8, #13, #10, ...

........................................................................
.............................. CYCLE    3 ..............................
........................................................................
   1    -50.1086742 -0.501087E+02  0.182E-01    1.79       0.0  T
   2    -50.1086778 -0.360333E-05  0.112E-01    1.79       1.0  T
   3    -50.1085873  0.904671E-04  0.861E-02    1.80       1.0  T
   4    -50.1087762 -0.188882E-03  0.215E-02    1.79       1.0  T
   5    -50.1087827 -0.647904E-05  0.104E-02    1.79       1.7  T
   6    -50.1087845 -0.182258E-05  0.342E-03    1.79       5.2  T
   7    -50.1087846 -0.105548E-06  0.122E-03    1.79      14.5  T
     SCC iter.                  ...        0 min,  0.013 sec
     gradient                   ...        0 min,  0.023 sec
 * total energy  :   -49.3639061 Eh     change       -0.1727487E-02 Eh
   gradient norm :     0.0127432 Eh/α   predicted    -0.1498840E-02 ( -13.24%)
   displ. norm   :     0.2008810 α      lambda       -0.5691955E-03
   maximum displ.:     0.1409596 α      in ANC's #8, #12, #7, ...

........................................................................
.............................. CYCLE    4 ..............................
........................................................................
   1    -50.1089384 -0.501089E+02  0.110E-01    1.78       0.0  T
   2    -50.1089441 -0.574302E-05  0.607E-02    1.78       1.0  T
   3    -50.1088987  0.454763E-04  0.446E-02    1.79       1.0  T
   4    -50.1089533 -0.546941E-04  0.102E-02    1.78       1.7  T
   5    -50.1089548 -0.144527E-05  0.498E-03    1.78       3.5  T
   6    -50.1089552 -0.423319E-06  0.179E-03    1.78       9.9  T
   7    -50.1089553 -0.525542E-07  0.579E-04    1.78      30.5  T
     SCC iter.                  ...        0 min,  0.013 sec
     gradient                   ...        0 min,  0.023 sec
 * total energy  :   -49.3642993 Eh     change       -0.3931297E-03 Eh
   gradient norm :     0.0064645 Eh/α   predicted    -0.2960963E-03 ( -24.68%)
   displ. norm   :     0.1745515 α      lambda       -0.2568535E-03
   maximum displ.:     0.1161508 α      in ANC's #8, #12, #1, ...

........................................................................
.............................. CYCLE    5 ..............................
........................................................................
   1    -50.1093423 -0.501093E+02  0.876E-02    1.78       0.0  T
   2    -50.1093457 -0.335293E-05  0.479E-02    1.78       1.0  T
   3    -50.1093366  0.907901E-05  0.206E-02    1.78       1.0  T
   4    -50.1093466 -0.100448E-04  0.701E-03    1.78       2.5  T
   5    -50.1093474 -0.723372E-06  0.306E-03    1.78       5.8  T
   6    -50.1093475 -0.161755E-06  0.114E-03    1.78      15.5  T
   7    -50.1093476 -0.331756E-07  0.440E-04    1.78      40.1  T
     SCC iter.                  ...        0 min,  0.013 sec
     gradient                   ...        0 min,  0.023 sec
 * total energy  :   -49.3644715 Eh     change       -0.1722199E-03 Eh
   gradient norm :     0.0042833 Eh/α   predicted    -0.1323398E-03 ( -23.16%)
   displ. norm   :     0.1520456 α      lambda       -0.1338500E-03
   maximum displ.:     0.0947933 α      in ANC's #8, #1, #2, ...

........................................................................
.............................. CYCLE    6 ..............................
........................................................................
   1    -50.1097897 -0.501098E+02  0.878E-02    1.78       0.0  T
   2    -50.1097928 -0.304167E-05  0.464E-02    1.78       1.0  T
   3    -50.1097919  0.821629E-06  0.104E-02    1.78       1.7  T
   4    -50.1097933 -0.141905E-05  0.593E-03    1.78       3.0  T
   5    -50.1097937 -0.399491E-06  0.172E-03    1.78      10.3  T
   6    -50.1097938 -0.536273E-07  0.596E-04    1.78      29.7  T
     SCC iter.                  ...        0 min,  0.011 sec
     gradient                   ...        0 min,  0.023 sec
 * total energy  :   -49.3645623 Eh     change       -0.9080141E-04 Eh
   gradient norm :     0.0047901 Eh/α   predicted    -0.6847430E-04 ( -24.59%)
   displ. norm   :     0.1834225 α      lambda       -0.1192652E-03
   maximum displ.:     0.0941879 α      in ANC's #8, #1, #2, ...

........................................................................
.............................. CYCLE    7 ..............................
........................................................................
   1    -50.1101738 -0.501102E+02  0.105E-01    1.78       0.0  T
   2    -50.1101783 -0.447256E-05  0.555E-02    1.78       1.0  T
   3    -50.1101731  0.517237E-05  0.168E-02    1.77       1.0  T
   4    -50.1101798 -0.669941E-05  0.684E-03    1.78       2.6  T
   5    -50.1101800 -0.215154E-06  0.307E-03    1.78       5.8  T
   6    -50.1101803 -0.281647E-06  0.904E-04    1.78      19.6  T
   7    -50.1101803 -0.186461E-07  0.340E-04    1.78      51.9  T
     SCC iter.                  ...        0 min,  0.013 sec
     gradient                   ...        0 min,  0.023 sec
 * total energy  :   -49.3646465 Eh     change       -0.8419131E-04 Eh
   gradient norm :     0.0046418 Eh/α   predicted    -0.6163919E-04 ( -26.79%)
   displ. norm   :     0.1812017 α      lambda       -0.9883135E-04
   maximum displ.:     0.1010047 α      in ANC's #1, #5, #2, ...

........................................................................
.............................. CYCLE    8 ..............................
........................................................................
   1    -50.1104960 -0.501105E+02  0.103E-01    1.78       0.0  T
   2    -50.1105009 -0.497992E-05  0.546E-02    1.78       1.0  T
   3    -50.1104952  0.577406E-05  0.178E-02    1.78       1.0  T
   4    -50.1105027 -0.749408E-05  0.668E-03    1.78       2.6  T
   5    -50.1105029 -0.242826E-06  0.321E-03    1.78       5.5  T
   6    -50.1105032 -0.271863E-06  0.115E-03    1.78      15.4  T
   7    -50.1105032 -0.361691E-07  0.349E-04    1.78      50.6  T
     SCC iter.                  ...        0 min,  0.013 sec
     gradient                   ...        0 min,  0.023 sec
 * total energy  :   -49.3647251 Eh     change       -0.7859557E-04 Eh
   gradient norm :     0.0032330 Eh/α   predicted    -0.5104198E-04 ( -35.06%)
   displ. norm   :     0.2085624 α      lambda       -0.1051067E-03
   maximum displ.:     0.1243036 α      in ANC's #1, #5, #2, ...

........................................................................
.............................. CYCLE    9 ..............................
........................................................................
   1    -50.1107425 -0.501107E+02  0.111E-01    1.78       0.0  T
   2    -50.1107483 -0.582879E-05  0.591E-02    1.78       1.0  T
   3    -50.1107428  0.550476E-05  0.182E-02    1.78       1.0  T
   4    -50.1107502 -0.742687E-05  0.690E-03    1.78       2.6  T
   5    -50.1107505 -0.292851E-06  0.336E-03    1.78       5.3  T
   6    -50.1107508 -0.276488E-06  0.125E-03    1.78      14.2  T
   7    -50.1107509 -0.429436E-07  0.419E-04    1.78      42.2  T
   8    -50.1107509 -0.177105E-08  0.208E-04    1.78      85.0  T
     SCC iter.                  ...        0 min,  0.014 sec
     gradient                   ...        0 min,  0.025 sec
 * total energy  :   -49.3648101 Eh     change       -0.8498918E-04 Eh
   gradient norm :     0.0034324 Eh/α   predicted    -0.5484042E-04 ( -35.47%)
   displ. norm   :     0.2297409 α      lambda       -0.1020181E-03
   maximum displ.:     0.1404770 α      in ANC's #1, #5, #2, ...

........................................................................
.............................. CYCLE   10 ..............................
........................................................................
   1    -50.1107769 -0.501108E+02  0.109E-01    1.78       0.0  T
   2    -50.1107821 -0.520459E-05  0.596E-02    1.78       1.0  T
   3    -50.1107800  0.214482E-05  0.139E-02    1.78       1.3  T
   4    -50.1107838 -0.380273E-05  0.592E-03    1.78       3.0  T
   5    -50.1107841 -0.252990E-06  0.245E-03    1.78       7.2  T
   6    -50.1107842 -0.118150E-06  0.858E-04    1.78      20.6  T
   7    -50.1107842 -0.145993E-07  0.479E-04    1.78      36.9  T
     SCC iter.                  ...        0 min,  0.013 sec
     gradient                   ...        0 min,  0.025 sec
 * total energy  :   -49.3648960 Eh     change       -0.8596018E-04 Eh
   gradient norm :     0.0048685 Eh/α   predicted    -0.5370356E-04 ( -37.53%)
   displ. norm   :     0.2587459 α      lambda       -0.1140899E-03
   maximum displ.:     0.1606857 α      in ANC's #1, #5, #2, ...

........................................................................
.............................. CYCLE   11 ..............................
........................................................................
   1    -50.1107926 -0.501108E+02  0.113E-01    1.77       0.0  T
   2    -50.1107977 -0.510014E-05  0.625E-02    1.78       1.0  T
   3    -50.1107967  0.985893E-06  0.120E-02    1.77       1.5  T
   4    -50.1107993 -0.253009E-05  0.578E-03    1.78       3.1  T
   5    -50.1107995 -0.290833E-06  0.257E-03    1.78       6.9  T
   6    -50.1107997 -0.112539E-06  0.860E-04    1.78      20.6  T
     SCC iter.                  ...        0 min,  0.011 sec
     gradient                   ...        0 min,  0.024 sec
 * total energy  :   -49.3649938 Eh     change       -0.9776981E-04 Eh
   gradient norm :     0.0054667 Eh/α   predicted    -0.6086691E-04 ( -37.74%)
   displ. norm   :     0.3230740 α      lambda       -0.1421092E-03
   maximum displ.:     0.2036932 α      in ANC's #1, #5, #2, ...

........................................................................
.............................. CYCLE   12 ..............................
........................................................................
   1    -50.1105142 -0.501105E+02  0.134E-01    1.77       0.0  T
   2    -50.1105213 -0.710022E-05  0.749E-02    1.77       1.0  T
   3    -50.1105183  0.298060E-05  0.150E-02    1.77       1.2  T
   4    -50.1105233 -0.500093E-05  0.695E-03    1.77       2.5  T
   5    -50.1105240 -0.619976E-06  0.316E-03    1.77       5.6  T
   6    -50.1105241 -0.160437E-06  0.117E-03    1.77      15.1  T
   7    -50.1105241 -0.185203E-07  0.556E-04    1.77      31.8  T
     SCC iter.                  ...        0 min,  0.013 sec
     gradient                   ...        0 min,  0.023 sec
 * total energy  :   -49.3651132 Eh     change       -0.1193484E-03 Eh
   gradient norm :     0.0053374 Eh/α   predicted    -0.7847948E-04 ( -34.24%)
   displ. norm   :     0.4055374 α      lambda       -0.1787006E-03
   maximum displ.:     0.2608597 α      in ANC's #1, #5, #3, ...

........................................................................
.............................. CYCLE   13 ..............................
........................................................................
   1    -50.1102974 -0.501103E+02  0.162E-01    1.76       0.0  T
   2    -50.1103077 -0.102683E-04  0.914E-02    1.76       1.0  T
   3    -50.1103030  0.464992E-05  0.180E-02    1.76       1.0  T
   4    -50.1103106 -0.756266E-05  0.803E-03    1.76       2.2  T
   5    -50.1103115 -0.947809E-06  0.360E-03    1.76       4.9  T
   6    -50.1103117 -0.170272E-06  0.152E-03    1.76      11.6  T
   7    -50.1103117 -0.373655E-07  0.638E-04    1.76      27.7  T
     SCC iter.                  ...        0 min,  0.013 sec
     gradient                   ...        0 min,  0.024 sec
 * total energy  :   -49.3652500 Eh     change       -0.1368929E-03 Eh
   gradient norm :     0.0053351 Eh/α   predicted    -0.1040457E-03 ( -23.99%)
   displ. norm   :     0.3602962 α      lambda       -0.1550115E-03
   maximum displ.:     0.2388219 α      in ANC's #1, #5, #3, ...

........................................................................
.............................. CYCLE   14 ..............................
........................................................................
   1    -50.1101751 -0.501102E+02  0.144E-01    1.76       0.0  T
   2    -50.1101834 -0.833247E-05  0.810E-02    1.76       1.0  T
   3    -50.1101763  0.713375E-05  0.189E-02    1.76       1.0  T
   4    -50.1101857 -0.947029E-05  0.721E-03    1.76       2.5  T
   5    -50.1101866 -0.848985E-06  0.321E-03    1.76       5.5  T
   6    -50.1101867 -0.126406E-06  0.147E-03    1.76      12.1  T
   7    -50.1101867 -0.329097E-07  0.558E-04    1.76      31.7  T
     SCC iter.                  ...        0 min,  0.013 sec
     gradient                   ...        0 min,  0.023 sec
 * total energy  :   -49.3653630 Eh     change       -0.1129136E-03 Eh
   gradient norm :     0.0052695 Eh/α   predicted    -0.8757133E-04 ( -22.44%)
   displ. norm   :     0.2324256 α      lambda       -0.1358705E-03
   maximum displ.:     0.1540689 α      in ANC's #1, #5, #3, ...

........................................................................
.............................. CYCLE   15 ..............................
........................................................................
   1    -50.1119332 -0.501119E+02  0.103E-01    1.76       0.0  T
   2    -50.1119373 -0.407589E-05  0.571E-02    1.76       1.0  T
   3    -50.1119347  0.257783E-05  0.130E-02    1.76       1.4  T
   4    -50.1119382 -0.342685E-05  0.627E-03    1.76       2.8  T
   5    -50.1119387 -0.560702E-06  0.266E-03    1.76       6.6  T
   6    -50.1119389 -0.141125E-06  0.102E-03    1.76      17.3  T
     SCC iter.                  ...        0 min,  0.011 sec
     gradient                   ...        0 min,  0.023 sec
 * total energy  :   -49.3654326 Eh     change       -0.6962494E-04 Eh
   gradient norm :     0.0055883 Eh/α   predicted    -0.7160538E-04 (   2.84%)
   displ. norm   :     0.4031849 α      lambda       -0.1414167E-03
   maximum displ.:     0.2631871 α      in ANC's #1, #5, #3, ...

........................................................................
.............................. CYCLE   16 ..............................
........................................................................
   1    -50.1088755 -0.501089E+02  0.171E-01    1.75       0.0  T
   2    -50.1088910 -0.155255E-04  0.952E-02    1.76       1.0  T
   3    -50.1088888  0.216651E-05  0.166E-02    1.75       1.1  T
   4    -50.1088949 -0.604478E-05  0.742E-03    1.76       2.4  T
   5    -50.1088957 -0.831715E-06  0.330E-03    1.76       5.4  T
   6    -50.1088958 -0.972545E-07  0.154E-03    1.76      11.5  T
   7    -50.1088958 -0.255022E-07  0.733E-04    1.76      24.1  T
     SCC iter.                  ...        0 min,  0.013 sec
     gradient                   ...        0 min,  0.024 sec
 * total energy  :   -49.3654290 Eh     change        0.3566056E-05 Eh
   gradient norm :     0.0076965 Eh/α   predicted    -0.8220590E-04 (*******%)
   displ. norm   :     0.2283619 α      lambda       -0.1441470E-03
   maximum displ.:     0.1480242 α      in ANC's #1, #5, #3, ...

........................................................................
.............................. CYCLE   17 ..............................
........................................................................
   1    -50.1116615 -0.501117E+02  0.957E-02    1.76       0.0  T
   2    -50.1116662 -0.465566E-05  0.533E-02    1.76       1.0  T
   3    -50.1116625  0.366867E-05  0.137E-02    1.76       1.3  T
   4    -50.1116673 -0.474562E-05  0.523E-03    1.76       3.4  T
   5    -50.1116677 -0.483876E-06  0.221E-03    1.76       8.0  T
   6    -50.1116678 -0.696850E-07  0.101E-03    1.76      17.4  T
     SCC iter.                  ...        0 min,  0.011 sec
     gradient                   ...        0 min,  0.023 sec
 * total energy  :   -49.3654948 Eh     change       -0.6574872E-04 Eh
   gradient norm :     0.0027148 Eh/α   predicted    -0.7583265E-04 (  15.34%)
   displ. norm   :     0.0463802 α      lambda       -0.1566443E-04
   maximum displ.:     0.0253837 α      in ANC's #1, #3, #5, ...

........................................................................
.............................. CYCLE   18 ..............................
........................................................................
   1    -50.1116948 -0.501117E+02  0.246E-02    1.76       0.0  T
   2    -50.1116950 -0.272020E-06  0.134E-02    1.76       1.3  T
   3    -50.1116944  0.583120E-06  0.525E-03    1.76       3.4  T
   4    -50.1116951 -0.679928E-06  0.170E-03    1.76      10.4  T
   5    -50.1116952 -0.373544E-07  0.773E-04    1.76      22.9  T
   6    -50.1116952 -0.118322E-07  0.279E-04    1.76      63.5  T
     SCC iter.                  ...        0 min,  0.011 sec
     gradient                   ...        0 min,  0.025 sec
 * total energy  :   -49.3655055 Eh     change       -0.1077786E-04 Eh
   gradient norm :     0.0014219 Eh/α   predicted    -0.7853815E-05 ( -27.13%)
   displ. norm   :     0.1069700 α      lambda       -0.1585997E-04
   maximum displ.:     0.0504491 α      in ANC's #7, #1, #3, ...

........................................................................
.............................. CYCLE   19 ..............................
........................................................................
   1    -50.1117561 -0.501118E+02  0.665E-02    1.76       0.0  T
   2    -50.1117581 -0.199838E-05  0.353E-02    1.76       1.0  T
   3    -50.1117575  0.584986E-06  0.824E-03    1.76       2.1  T
   4    -50.1117585 -0.971907E-06  0.435E-03    1.76       4.1  T
   5    -50.1117587 -0.166139E-06  0.201E-03    1.76       8.8  T
   6    -50.1117588 -0.105111E-06  0.608E-04    1.76      29.1  T
   7    -50.1117588 -0.108381E-07  0.229E-04    1.76      77.1  T
     SCC iter.                  ...        0 min,  0.013 sec
     gradient                   ...        0 min,  0.025 sec
 * total energy  :   -49.3655165 Eh     change       -0.1097926E-04 Eh
   gradient norm :     0.0018867 Eh/α   predicted    -0.7974490E-05 ( -27.37%)
   displ. norm   :     0.0224826 α      lambda       -0.4171007E-05
   maximum displ.:     0.0129203 α      in ANC's #7, #4, #1, ...

........................................................................
.............................. CYCLE   20 ..............................
........................................................................
   1    -50.1117313 -0.501117E+02  0.185E-02    1.76       0.0  T
   2    -50.1117315 -0.147596E-06  0.962E-03    1.76       1.8  T
   3    -50.1117314  0.115071E-06  0.282E-03    1.76       6.3  T
   4    -50.1117315 -0.145471E-06  0.140E-03    1.76      12.6  T
   5    -50.1117315 -0.160858E-07  0.576E-04    1.76      30.7  T
   6    -50.1117315 -0.956673E-08  0.178E-04    1.76      99.2  T
     SCC iter.                  ...        0 min,  0.012 sec
     gradient                   ...        0 min,  0.025 sec
 * total energy  :   -49.3655214 Eh     change       -0.4847532E-05 Eh
   gradient norm :     0.0010797 Eh/α   predicted    -0.2086462E-05 ( -56.96%)
   displ. norm   :     0.0576965 α      lambda       -0.7092681E-05
   maximum displ.:     0.0316792 α      in ANC's #4, #7, #1, ...
 * RMSD in coord.:     0.5145205 α      energy gain  -0.1038577E-01 Eh

generating ANC from model Hessian ...
Using Lindh-Hessian (1995)
 Shifting diagonal of input Hessian by   4.560343783791848E-003
 Lowest  eigenvalues of input Hessian
   -0.000000   -0.000000   -0.000000   -0.000000    0.000000    0.000000
    0.005000    0.005902    0.006440    0.006692    0.007635    0.008705
    0.009214    0.010251    0.011116    0.013346    0.013936    0.016142
 Highest eigenvalues
    1.809277    1.839996    1.938680    1.947736    2.014643    2.047870
 

........................................................................
.............................. CYCLE   21 ..............................
........................................................................
   1    -50.1118425 -0.501118E+02  0.493E-02    1.76       0.0  T
   2    -50.1118435 -0.993881E-06  0.255E-02    1.76       1.0  T
   3    -50.1118430  0.553794E-06  0.681E-03    1.76       2.6  T
   4    -50.1118437 -0.705751E-06  0.371E-03    1.76       4.8  T
   5    -50.1118438 -0.129932E-06  0.138E-03    1.76      12.8  T
   6    -50.1118439 -0.562154E-07  0.445E-04    1.76      39.7  T
   7    -50.1118439 -0.569727E-08  0.134E-04    1.76     132.1  T
     SCC iter.                  ...        0 min,  0.013 sec
     gradient                   ...        0 min,  0.025 sec
 * total energy  :   -49.3655274 Eh     change       -0.6047622E-05 Eh
   gradient norm :     0.0009211 Eh/α   predicted     0.0000000E+00 (-100.00%)
   displ. norm   :     0.0240268 α      lambda       -0.2910625E-05
   maximum displ.:     0.0126653 α      in ANC's #3, #1, #6, ...

........................................................................
.............................. CYCLE   22 ..............................
........................................................................
   1    -50.1116732 -0.501117E+02  0.142E-02    1.76       0.0  T
   2    -50.1116733 -0.929313E-07  0.767E-03    1.76       2.3  T
   3    -50.1116732  0.914492E-07  0.231E-03    1.76       7.7  T
   4    -50.1116733 -0.123572E-06  0.883E-04    1.76      20.0  T
   5    -50.1116733 -0.400467E-08  0.448E-04    1.76      39.4  T
     SCC iter.                  ...        0 min,  0.010 sec
     gradient                   ...        0 min,  0.025 sec
 * total energy  :   -49.3655308 Eh     change       -0.3398577E-05 Eh
   gradient norm :     0.0002578 Eh/α   predicted    -0.1457604E-05 ( -57.11%)
   displ. norm   :     0.0260969 α      lambda       -0.2014491E-05
   maximum displ.:     0.0125580 α      in ANC's #6, #3, #4, ...

   *** GEOMETRY OPTIMIZATION CONVERGED AFTER 22 ITERATIONS ***

------------------------------------------------------------------------
 total energy gain   :        -0.0103952 Eh       -6.5231 kcal/mol
 total RMSD          :         0.5146905 a0        0.2724 Å
 total power (kW/mol):        -1.2405746 (step)  -22.3300 (real)
------------------------------------------------------------------------

 ANCopt (total)                0 d,  0 h,  0 min,  1.222 sec
 optimizer setup                ...        0 min,  0.000 sec (  0.013%)
 model hessian                  ...        0 min,  0.018 sec (  1.509%)
 ANC generation                 ...        0 min,  0.002 sec (  0.167%)
 coordinate transformation      ...        0 min,  0.000 sec (  0.038%)
 single point calculation       ...        0 min,  1.193 sec ( 97.569%)
 optimization log               ...        0 min,  0.003 sec (  0.224%)
 hessian update                 ...        0 min,  0.000 sec (  0.029%)
 rational function              ...        0 min,  0.004 sec (  0.335%)

================
 final structure:
================
$coord
    5.87993819723966   -0.80857642419144   -0.16730152452890      C 
    3.59158328741718   -3.12858885563797    0.07509181624519      S 
    4.92423560539578    1.58141916544652   -0.18981869811715      C 
    2.26698180009005    1.60355983901394    0.00157584749340      C 
    0.15965564777974    3.40795633565813    0.10644983742441      C 
    0.26031794853186    5.94677252916454    0.26675492946600      C 
   -2.09090135232788    7.53685458120556    0.41642669034571      C 
   -3.41406800034873    7.48204868741799   -2.00609435192176      N 
    2.72367805656979    7.35685246905434    0.10275418868682      C 
    3.37397557098944    7.69240730258203   -2.56214591556650      N 
    1.29804444478546   -0.84527797593703    0.14330806985576      C 
   -1.37524893536849   -0.72014282471585    0.25058204265582      C 
   -3.88354875397146   -2.75328004155570    0.34709691548833      S 
   -2.10893396613759    1.81402565205856    0.17325945210172      C 
   -4.73875306045087    2.08852634043301    0.13416386881829      C 
   -5.98629567894864   -0.19306300960795    0.22894936790613      C 
   -8.65035556270289   -0.70996561105216    0.23184790138898      C 
  -10.47250614504526    1.02150254036081    0.10021055044644      C 
    7.82294623502608   -1.36806334338767   -0.28989857264996      H 
    6.13066740156453    3.20636895932776   -0.36174688615585      H 
   -1.56253559693981    9.46521477463230    0.99936028418020      H 
   -3.36781873316634    6.77107543933052    1.85451450876518      H 
   -2.18911732730775    7.95635165636445   -3.40376035467708      H 
   -4.83517536478481    8.77039244335910   -2.00692179027681      H 
    4.17994407249537    6.35287557796900    1.19824767849901      H 
    2.51783827027914    9.24440234480270    0.92215253664598      H 
    3.50778972780684    5.97952640255512   -3.41584220406035      H 
    5.07004767487669    8.57218690586241   -2.72616627154700      H 
   -5.70816763902615    3.85750520009778   -0.04761612225036      H 
   -9.14412396364329   -2.69201156216053    0.35104996772285      H 
  -10.06679848412258    3.00959358216018   -0.02886301316885      H 
  -12.43463216264602    0.49139538095945    0.11152702104143      H 
$end
           -------------------------------------------------
          |                Final Singlepoint                |
           -------------------------------------------------

          ...................................................
          :                      SETUP                      :
          :.................................................:
          :  # basis functions                  98          :
          :  # atomic orbitals                  96          :
          :  # shells                           52          :
          :  # electrons                        92          :
          :  max. iterations                   250          :
          :  Hamiltonian                  GFN2-xTB          :
          :  restarted?                      false          :
          :  GBSA solvation                  false          :
          :  PC potential                    false          :
          :  electronic temp.          300.0000000     K    :
          :  accuracy                    1.0000000          :
          :  -> integral cutoff          0.2500000E+02      :
          :  -> integral neglect         0.1000000E-07      :
          :  -> SCF convergence          0.1000000E-05 Eh   :
          :  -> wf. convergence          0.1000000E-03 e    :
          :  Broyden damping             0.4000000          :
          ...................................................

 iter      E             dE          RMSdq      gap      omega  full diag
   1    -50.1116733 -0.501117E+02  0.312E-04    1.76       0.0  T
   2    -50.1116733  0.269011E-10  0.109E-04    1.76     161.6  T
   3    -50.1116733  0.717222E-10  0.174E-04    1.76     101.4  T

   *** convergence criteria satisfied after 3 iterations ***

         #    Occupation            Energy/Eh            Energy/eV
      -------------------------------------------------------------
         1        2.0000           -0.7293006             -19.8453
       ...           ...                  ...                  ...
        40        2.0000           -0.4252766             -11.5724
        41        2.0000           -0.4005397             -10.8992
        42        2.0000           -0.3946898             -10.7401
        43        2.0000           -0.3790325             -10.3140
        44        2.0000           -0.3755526             -10.2193
        45        2.0000           -0.3686818             -10.0323
        46        2.0000           -0.3518679              -9.5748 (HOMO)
        47                         -0.2872352              -7.8161 (LUMO)
        48                         -0.2440092              -6.6398
        49                         -0.2203246              -5.9953
        50                         -0.2020187              -5.4972
        51                         -0.1960242              -5.3341
       ...                                ...                  ...
        96                          0.7307518              19.8848
      -------------------------------------------------------------
                  HL-Gap            0.0646327 Eh            1.7587 eV
             Fermi-level           -0.3195516 Eh           -8.6954 eV

 SCC (total)                   0 d,  0 h,  0 min,  0.050 sec
 SCC setup                      ...        0 min,  0.000 sec (  0.645%)
 Dispersion                     ...        0 min,  0.000 sec (  0.832%)
 integral evaluation            ...        0 min,  0.017 sec ( 34.454%)
 zeroth order Hamiltonian       ...        0 min,  0.000 sec (  0.566%)
 iterations                     ...        0 min,  0.007 sec ( 13.203%)
 molecular gradient             ...        0 min,  0.025 sec ( 49.400%)
 printout                       ...        0 min,  0.000 sec (  0.780%)

         :::::::::::::::::::::::::::::::::::::::::::::::::::::
         ::                     SUMMARY                     ::
         :::::::::::::::::::::::::::::::::::::::::::::::::::::
         :: total energy             -49.365530666905 Eh    ::
         :: gradient norm              0.000256701067 Eh/a0 ::
         :: HOMO-LUMO gap              1.758744577703 eV    ::
         ::.................................................::
         :: SCC energy               -50.111673320262 Eh    ::
         :: -> isotropic ES            0.022872142167 Eh    ::
         :: -> anisotropic ES          0.006581844307 Eh    ::
         :: -> anisotropic XC          0.029597781863 Eh    ::
         :: -> dispersion             -0.039375232431 Eh    ::
         :: repulsion energy           0.745890029189 Eh    ::
         :: add. restraining           0.000000000000 Eh    ::
         :::::::::::::::::::::::::::::::::::::::::::::::::::::

           -------------------------------------------------
          |                Property Printout                |
           -------------------------------------------------

    * Orbital Energies and Occupations

         #    Occupation            Energy/Eh            Energy/eV
      -------------------------------------------------------------
         1        2.0000           -0.7293006             -19.8453
       ...           ...                  ...                  ...
        34        2.0000           -0.4477869             -12.1849
        35        2.0000           -0.4439725             -12.0811
        36        2.0000           -0.4394633             -11.9584
        37        2.0000           -0.4389686             -11.9449
        38        2.0000           -0.4352654             -11.8442
        39        2.0000           -0.4275412             -11.6340
        40        2.0000           -0.4252766             -11.5724
        41        2.0000           -0.4005397             -10.8992
        42        2.0000           -0.3946898             -10.7401
        43        2.0000           -0.3790325             -10.3140
        44        2.0000           -0.3755526             -10.2193
        45        2.0000           -0.3686818             -10.0323
        46        2.0000           -0.3518679              -9.5748 (HOMO)
        47                         -0.2872352              -7.8161 (LUMO)
        48                         -0.2440092              -6.6398
        49                         -0.2203246              -5.9953
        50                         -0.2020187              -5.4972
        51                         -0.1960242              -5.3341
        52                         -0.1668910              -4.5413
        53                         -0.1402043              -3.8152
        54                         -0.1259966              -3.4285
        55                         -0.1126758              -3.0661
        56                         -0.1066400              -2.9018
        57                         -0.0143672              -0.3910
       ...                                ...                  ...
        96                          0.7307518              19.8848
      -------------------------------------------------------------
                  HL-Gap            0.0646327 Eh            1.7587 eV
             Fermi-level           -0.3195516 Eh           -8.6954 eV

     #   Z        covCN         q      C6AA      α(0)
     1   6 C      2.947    -0.028    28.709     8.788
     2  16 S      2.234    -0.026   142.139    20.066
     3   6 C      3.076    -0.046    29.049     8.837
     4   6 C      3.236    -0.028    27.797     8.553
     5   6 C      3.024     0.002    27.960     8.674
     6   6 C      2.948     0.009    27.822     8.651
     7   6 C      3.736     0.021    20.301     6.430
     8   7 N      2.631    -0.336    28.645     7.949
     9   6 C      3.736     0.022    20.289     6.428
    10   7 N      2.632    -0.341    28.770     7.966
    11   6 C      3.099     0.014    27.584     8.607
    12   6 C      3.092     0.012    27.638     8.617
    13  16 S      2.270    -0.040   142.709    20.106
    14   6 C      3.240    -0.020    27.568     8.514
    15   6 C      3.066    -0.049    29.136     8.851
    16   6 C      2.997     0.022    27.506     8.603
    17   6 C      2.928    -0.030    28.753     8.794
    18   6 C      2.840    -0.093    30.315     9.023
    19   1 H      0.926     0.040     2.447     2.446
    20   1 H      0.926     0.033     2.549     2.496
    21   1 H      0.923     0.012     2.851     2.641
    22   1 H      0.924     0.046     2.372     2.408
    23   1 H      0.860     0.149     1.409     1.859
    24   1 H      0.860     0.137     1.494     1.915
    25   1 H      0.923     0.018     2.761     2.599
    26   1 H      0.924     0.037     2.496     2.471
    27   1 H      0.860     0.144     1.445     1.883
    28   1 H      0.860     0.138     1.488     1.911
    29   1 H      0.926     0.062     2.176     2.307
    30   1 H      0.925     0.041     2.441     2.443
    31   1 H      0.926     0.040     2.445     2.445
    32   1 H      0.926     0.040     2.453     2.449

 Mol. C6AA /au·bohr⁶  :      16362.439071
 Mol. C8AA /au·bohr⁸  :     462518.948561
 Mol. α(0) /au        :        205.730328


Wiberg/Mayer (AO) data.
largest (>0.10) Wiberg bond orders for each atom
          total WBO             WBO to atom ...
     1  C   3.915        C    3 1.603    S    2 1.173    H   19 0.972
     2  S   2.616        C    1 1.173    C   11 1.165
     3  C   3.986        C    1 1.603    C    4 1.274    H   20 0.958
     4  C   3.962        C   11 1.385    C    3 1.274    C    5 1.071
     5  C   3.986        C    6 1.698    C    4 1.071    C   14 1.067
     6  C   3.983        C    5 1.698    C    7 1.009    C    9 1.008
     7  C   3.987        C    6 1.009    N    8 1.009    H   21 0.967    H   22 0.960
     8  N   2.997        C    7 1.009    H   24 0.967    H   23 0.965
     9  C   3.985        C    6 1.008    N   10 1.007    H   26 0.970    H   25 0.957
    10  N   2.991        C    9 1.007    H   28 0.966    H   27 0.965
    11  C   3.947        C    4 1.385    C   12 1.176    S    2 1.165
    12  C   3.946        C   14 1.365    C   11 1.176    S   13 1.171
    13  S   2.607        C   12 1.171    C   16 1.113
    14  C   3.978        C   12 1.365    C   15 1.313    C    5 1.067
    15  C   3.986        C   16 1.492    C   14 1.313    H   29 0.953
    16  C   3.917        C   15 1.492    C   17 1.146    S   13 1.113
    17  C   3.990        C   18 1.846    C   16 1.146    H   30 0.964
    18  C   3.962        C   17 1.846    H   32 0.978    H   31 0.975
    19  H   0.998        C    1 0.972
    20  H   0.998        C    3 0.958
    21  H   0.999        C    7 0.967
    22  H   0.997        C    7 0.960
    23  H   0.978        N    8 0.965
    24  H   0.980        N    8 0.967
    25  H   0.999        C    9 0.957
    26  H   0.997        C    9 0.970
    27  H   0.979        N   10 0.965
    28  H   0.980        N   10 0.966
    29  H   0.996        C   15 0.953
    30  H   0.998        C   17 0.964
    31  H   0.998        C   18 0.975
    32  H   0.998        C   18 0.978

molecular dipole:
                 x           y           z       tot (Debye)
 q only:        0.092       0.733       0.038
   full:        0.592       1.318       0.128       3.688
molecular quadrupole (traceless):
                xx          xy          yy          xz          yz          zz
 q only:        1.887      -0.197       3.012      -1.082       0.532      -4.899
  q+dip:        6.022       1.319       6.453      -2.467       1.857     -12.475
   full:        4.793       1.461       3.755      -2.425       1.974      -8.548

           -------------------------------------------------
          |                Geometry Summary                 |
           -------------------------------------------------

      molecular mass/u    :      274.3980000
   center of mass at/Å    :       -0.4730202       0.8551431      -0.0689225
  moments of inertia/u·Å² :        0.1179133E+04   0.1605391E+04   0.2705788E+04
rotational constants/cm⁻¹ :        0.1429664E-01   0.1050064E-01   0.6230212E-02

 * 30 selected distances

     #   Z        #   Z                                     value/Å
     1   6 C      2  16 S                                 1.7291858
     1   6 C      3   6 C                                 1.3621513
     3   6 C      4   6 C                                 1.4098498
     5   6 C      6   6 C                                 1.3472128
     7   6 C      8   7 N                                 1.4609876
     9   6 C     10   7 N                                 1.4624047
     2  16 S     11   6 C                                 1.7129724
     4   6 C     11   6 C                                 1.3956376
    11   6 C     12   6 C                                 1.4173323
    12   6 C     13  16 S                                 1.7093761
    12   6 C     14   6 C                                 1.3966954
    14   6 C     15   6 C                                 1.3993540
    13  16 S     16   6 C                                 1.7543016 (max)
    15   6 C     16   6 C                                 1.3769795
    16   6 C     17   6 C                                 1.4360521
    17   6 C     18   6 C                                 1.3319659
     1   6 C     19   1 H                                 1.0719381
     3   6 C     20   1 H                                 1.0748291
     7   6 C     21   1 H                                 1.1021068
     7   6 C     22   1 H                                 1.0954138
     8   7 N     23   1 H                                 1.0149915
     8   7 N     24   1 H                                 1.0150520
     9   6 C     25   1 H                                 1.1009922
     9   6 C     26   1 H                                 1.0943391
    10   7 N     27   1 H                                 1.0152297
    10   7 N     28   1 H                                 1.0148035 (min)
    15   6 C     29   1 H                                 1.0717760
    17   6 C     30   1 H                                 1.0827492
    18   6 C     31   1 H                                 1.0759053
    18   6 C     32   1 H                                 1.0755559

 * 5 distinct bonds (by element types)

   Z      Z             #   av. dist./Å        max./Å        min./Å
   1 H    6 C          10     1.0845606     1.1021068     1.0717760
   6 C    6 C          10     1.3873231     1.4360521     1.3319659
   1 H    7 N           4     1.0150192     1.0152297     1.0148035
   6 C    7 N           2     1.4616962     1.4624047     1.4609876
   6 C   16 S           4     1.7264590     1.7543016     1.7093761


optimized geometry written to: xtbopt.xyz


           -------------------------------------------------
          | TOTAL ENERGY              -49.365530666905 Eh   |
          | GRADIENT NORM               0.000256701067 Eh/α |
          | HOMO-LUMO GAP               1.758744577703 eV   |
           -------------------------------------------------

------------------------------------------------------------------------
 * finished run on 2021/05/19 at 10:59:48.252     
------------------------------------------------------------------------
 total:
 * wall-time:     0 d,  0 h,  0 min,  1.373 sec
 *  cpu-time:     0 d,  0 h,  0 min,  1.368 sec
 * ratio c/w:     0.997 speedup
 SCF:
 * wall-time:     0 d,  0 h,  0 min,  0.069 sec
 *  cpu-time:     0 d,  0 h,  0 min,  0.069 sec
 * ratio c/w:     0.996 speedup
 ANC optimizer:
 * wall-time:     0 d,  0 h,  0 min,  1.273 sec
 *  cpu-time:     0 d,  0 h,  0 min,  1.270 sec
 * ratio c/w:     0.998 speedup

