      -----------------------------------------------------------      
     |                   =====================                   |     
     |                           x T B                           |     
     |                   =====================                   |     
     |                         S. Grimme                         |     
     |          Mulliken Center for Theoretical Chemistry        |     
     |                    University of Bonn                     |     
     |                Version 6.2 RC2 (SAW190805)                |     
      -----------------------------------------------------------      

   This program is distributed in the hope that it will be useful,
   but WITHOUT ANY WARRANTY; without even the implied warranty of
   MERCHANTABILITY or FITNESS FOR A PARTICULAR PURPOSE.
   
   FOR NON-COMMERCIAL, ACADEMIA USE ONLY.
   
   Cite this work as:
   * S. Grimme, C. Bannwarth, P. Shushkov, J. Chem. Theory Comput., 2017,
     13, 1989-2009. DOI: 10.1021/acs.jctc.7b00118
   * C. Bannwarth, S. Ehlert and S. Grimme., J. Chem. Theory Comput., 2019,
     15, 1652-1671. DOI: 10.1021/acs.jctc.8b01176
   * P. Pracht, E. Caldeweyher, S. Ehlert, S. Grimme, ChemRxiv, 2019, preprint.
     DOI: 10.26434/chemrxiv.8326202.v1
   
   for DFT-D4:
   * E. Caldeweyher, C. Bannwarth and S. Grimme, J. Chem. Phys., 2017,
     147, 034112. DOI: 10.1063/1.4993215
   * E. Caldeweyher, S. Ehlert, A. Hansen, H. Neugebauer, S. Spicher,
     C. Bannwarth and S. Grimme, J. Chem. Phys., 2019, 150, 154122.
     DOI: 10.1063/1.5090222
   
   for sTDA-xTB:
   * S. Grimme and C. Bannwarth, J. Chem. Phys., 2016, 145, 054103.
     DOI: 10.1063/1.4959605
   
   in the mass-spec context:
   * V. Asgeirsson, C. Bauer and S. Grimme, Chem. Sci., 2017, 8, 4879.
     DOI: 10.1039/c7sc00601b
   
   for metadynamics refer to:
   * S. Grimme, J. Chem. Theory Comput., 2019, 155, 2847-2862
     DOI: 10.1021/acs.jctc.9b00143
   
   with help from (in alphabetical order)
   C. Bannwarth, F. Bohle, G. Brandenburg, E. Caldeweyher, M. Checinski,
   S. Dohm, S. Ehlert, S. Ehrlich, F. März, H. Neugebauer, J. Pisarek,
   P. Pracht, P. Shushkov, and S. Spicher.
   
 * started run on 2021/05/19 at 10:58:41.216     

           -------------------------------------------------
          |                Calculation Setup                |
           -------------------------------------------------

          program call               : /ihome/ghutchison/geoffh/xtb/xtb 65.xyz -opt
          hostname                   : smp-n58
          coordinate file            : 65.xyz
          omp threads                :                     1
          number of atoms            :                    22
          number of electrons        :                    54
          charge                     :                     0
          spin                       :                   0.0
          first test random number   :      0.30316727877092


########################################################################
# WARNING! Please study the warnings concerning your input carefully
#  - the use of '-opt' is discouraged, please use '--opt' next time
########################################################################

           ------------------------------------------------- 
          |                 G F N 2 - x T B                 |
          | Geometry, Frequencies, Noncovalent interactions |
          |            JCTC 2019 parametrisation            |
           ------------------------------------------------- 
             KAB for C  - Si     :                1.0500
             KAB for H  - Pd     :                0.9500
             k(s)              :                1.8500
             k(p)              :                2.2300
             k(d)              :                2.2300
             k(f)              :                2.0000
             kEN (H0ij)        :               -2.0000
             D4 a1             :                0.5200
             D4 a2             :                5.0000
             D4 s6             :                1.0000
             D4 s8             :                2.7000
             D4 s9             :                5.0000
             alphaj            :                2.0000

  Z AO/shell   Hii/eV     exponent
  1     Wed Apr 25 08:07:45 CEST 2018   EN: 2.200 GM2: 0.406  GM3: 0.0800  RAES: 1.40
     1s    -10.707211    1.230000
  6     Wed Apr 25 08:07:45 CEST 2018   EN: 2.550 GM2: 0.538  GM3: 0.1500  RAES: 3.00
     2s    -13.970922    2.096432
     2p    -10.063292    1.800000
  7     Wed Apr 25 08:07:45 CEST 2018   EN: 3.040 GM2: 0.461  GM3:-0.0640  RAES: 1.90
     2s    -16.686243    2.339881
     2p    -12.523956    2.014332

           ------------------------------------------------- 
          |        Self-Consistent Charge Iterations        |
           ------------------------------------------------- 

          ...................................................
          :                      SETUP                      :
          :.................................................:
          :  # basis functions                  52          :
          :  # atomic orbitals                  52          :
          :  # shells                           32          :
          :  # electrons                        54          :
          :  max. iterations                   250          :
          :  Hamiltonian                  GFN2-xTB          :
          :  restarted?                      false          :
          :  GBSA solvation                  false          :
          :  PC potential                    false          :
          :  electronic temp.          300.0000000     K    :
          :  accuracy                    1.0000000          :
          :  -> integral cutoff          0.2500000E+02      :
          :  -> integral neglect         0.1000000E-07      :
          :  -> SCF convergence          0.1000000E-05 Eh   :
          :  -> wf. convergence          0.1000000E-03 e    :
          :  Broyden damping             0.4000000          :
          ...................................................

 iter      E             dE          RMSdq      gap      omega  full diag
   1    -29.4633386 -0.294633E+02  0.408E+00    3.55       0.0  T
   2    -29.4906838 -0.273452E-01  0.235E+00    3.94       1.0  T
   3    -29.4920452 -0.136139E-02  0.584E-01    3.98       1.0  T
   4    -29.4923709 -0.325741E-03  0.950E-02    3.92       1.0  T
   5    -29.4924263 -0.553903E-04  0.460E-02    3.93       1.0  T
   6    -29.4924295 -0.321137E-05  0.192E-02    3.92       1.1  T
   7    -29.4924321 -0.264749E-05  0.372E-03    3.92       5.7  T
   8    -29.4924322 -0.620801E-07  0.144E-03    3.92      14.8  T
   9    -29.4924322 -0.151668E-08  0.792E-04    3.92      26.9  T
  10    -29.4924322 -0.935918E-08  0.132E-04    3.92     161.2  T

   *** convergence criteria satisfied after 10 iterations ***

         #    Occupation            Energy/Eh            Energy/eV
      -------------------------------------------------------------
         1        2.0000           -0.6389479             -17.3867
       ...           ...                  ...                  ...
        21        2.0000           -0.4466608             -12.1543
        22        2.0000           -0.4190915             -11.4041
        23        2.0000           -0.4134015             -11.2492
        24        2.0000           -0.3960074             -10.7759
        25        2.0000           -0.3875235             -10.5451
        26        2.0000           -0.3658806              -9.9561
        27        2.0000           -0.3652250              -9.9383 (HOMO)
        28                         -0.2211421              -6.0176 (LUMO)
        29                         -0.2195263              -5.9736
        30                         -0.0996074              -2.7105
        31                          0.0553007               1.5048
        32                          0.0595856               1.6214
       ...                                ...                  ...
        52                          0.6233728              16.9628
      -------------------------------------------------------------
                  HL-Gap            0.1440830 Eh            3.9207 eV
             Fermi-level           -0.2931836 Eh           -7.9779 eV

 SCC (total)                   0 d,  0 h,  0 min,  0.021 sec
 SCC setup                      ...        0 min,  0.000 sec (  1.083%)
 Dispersion                     ...        0 min,  0.000 sec (  1.145%)
 integral evaluation            ...        0 min,  0.005 sec ( 22.439%)
 zeroth order Hamiltonian       ...        0 min,  0.000 sec (  0.504%)
 iterations                     ...        0 min,  0.008 sec ( 38.554%)
 molecular gradient             ...        0 min,  0.007 sec ( 34.917%)
 printout                       ...        0 min,  0.000 sec (  1.153%)

         :::::::::::::::::::::::::::::::::::::::::::::::::::::
         ::                     SUMMARY                     ::
         :::::::::::::::::::::::::::::::::::::::::::::::::::::
         :: total energy             -29.047962018104 Eh    ::
         :: gradient norm              0.031800869279 Eh/a0 ::
         :: HOMO-LUMO gap              3.920696974706 eV    ::
         ::.................................................::
         :: SCC energy               -29.492432218561 Eh    ::
         :: -> isotropic ES            0.022289841777 Eh    ::
         :: -> anisotropic ES          0.007143616591 Eh    ::
         :: -> anisotropic XC          0.024523000788 Eh    ::
         :: -> dispersion             -0.017198887630 Eh    ::
         :: repulsion energy           0.444461734104 Eh    ::
         :: add. restraining           0.000000000000 Eh    ::
         :::::::::::::::::::::::::::::::::::::::::::::::::::::

      ----------------------------------------------------------- 
     |                   =====================                   |
     |                        A N C O P T                        |
     |                   =====================                   |
     |               Approximate Normal Coordinate               |
     |                Rational Function Optimizer                |
      ----------------------------------------------------------- 

          ...................................................
          :                      SETUP                      :
          :.................................................:
          :   optimization level            normal          :
          :   max. optcycles                   200          :
          :   ANC micro-cycles                  20          :
          :   degrees of freedom                60          :
          :.................................................:
          :   RF solver                   davidson          :
          :   input Hessian                  false          :
          :   write xtbopt.log                true          :
          :   linear?                        false          :
          :   energy convergence         0.5000000E-05 Eh   :
          :   grad. convergence          0.1000000E-02 Eh/α :
          :   maximium RF displ.         2.0000000          :
          :   Hlow (freq-cutoff)         0.5000000E-02      :
          :   Hmax (freq-cutoff)         5.0000000          :
          :   S6 in model hess.         20.0000000          :
          ...................................................

generating ANC from model Hessian ...
Using Lindh-Hessian (1995)
 Shifting diagonal of input Hessian by   3.880497204716146E-003
 Lowest  eigenvalues of input Hessian
   -0.000000   -0.000000   -0.000000   -0.000000    0.000000    0.000000
    0.005000    0.007036    0.007852    0.009832    0.012149    0.014543
    0.016880    0.018099    0.022050    0.027261    0.029604    0.031343
 Highest eigenvalues
    1.416397    1.504950    1.576475    1.815959    1.889112    1.933689
 

........................................................................
.............................. CYCLE    1 ..............................
........................................................................
   1    -29.4924322 -0.294924E+02  0.570E-05    3.92       0.0  T
   2    -29.4924322 -0.234515E-10  0.357E-05    3.92     597.2  T
   3    -29.4924322 -0.122249E-10  0.182E-05    3.92    1169.6  T
     SCC iter.                  ...        0 min,  0.003 sec
     gradient                   ...        0 min,  0.008 sec
 * total energy  :   -29.0479620 Eh     change        0.1917009E-08 Eh
   gradient norm :     0.0318013 Eh/α   predicted     0.0000000E+00 (-100.00%)
   displ. norm   :     0.2737585 α      lambda       -0.5344384E-02
   maximum displ.:     0.1544413 α      in ANC's #16, #7, #6, ...

........................................................................
.............................. CYCLE    2 ..............................
........................................................................
   1    -29.5117241 -0.295117E+02  0.211E-01    4.03       0.0  T
   2    -29.5117343 -0.102299E-04  0.120E-01    4.03       1.0  T
   3    -29.5117367 -0.244109E-05  0.117E-02    4.03       1.8  T
   4    -29.5117384 -0.168259E-05  0.520E-03    4.03       4.1  T
   5    -29.5117384 -0.354448E-07  0.979E-04    4.03      21.8  T
     SCC iter.                  ...        0 min,  0.004 sec
     gradient                   ...        0 min,  0.008 sec
 * total energy  :   -29.0512000 Eh     change       -0.3238028E-02 Eh
   gradient norm :     0.0078690 Eh/α   predicted    -0.2872456E-02 ( -11.29%)
   displ. norm   :     0.1452329 α      lambda       -0.5542898E-03
   maximum displ.:     0.0870834 α      in ANC's #7, #6, #2, ...

........................................................................
.............................. CYCLE    3 ..............................
........................................................................
   1    -29.5171440 -0.295171E+02  0.115E-01    4.04       0.0  T
   2    -29.5171482 -0.424368E-05  0.650E-02    4.04       1.0  T
   3    -29.5171491 -0.935906E-06  0.674E-03    4.03       3.2  T
   4    -29.5171496 -0.422407E-06  0.301E-03    4.03       7.1  T
   5    -29.5171496 -0.266165E-07  0.131E-03    4.03      16.3  T
   6    -29.5171496 -0.498395E-08  0.331E-04    4.03      64.4  T
     SCC iter.                  ...        0 min,  0.004 sec
     gradient                   ...        0 min,  0.007 sec
 * total energy  :   -29.0515496 Eh     change       -0.3495604E-03 Eh
   gradient norm :     0.0046243 Eh/α   predicted    -0.2830110E-03 ( -19.04%)
   displ. norm   :     0.1088636 α      lambda       -0.1460016E-03
   maximum displ.:     0.0679831 α      in ANC's #7, #2, #1, ...

........................................................................
.............................. CYCLE    4 ..............................
........................................................................
   1    -29.5184001 -0.295184E+02  0.887E-02    4.03       0.0  T
   2    -29.5184029 -0.279986E-05  0.499E-02    4.03       1.0  T
   3    -29.5184035 -0.575870E-06  0.527E-03    4.02       4.0  T
   4    -29.5184038 -0.259465E-06  0.226E-03    4.02       9.4  T
   5    -29.5184038 -0.131986E-07  0.105E-03    4.02      20.2  T
     SCC iter.                  ...        0 min,  0.003 sec
     gradient                   ...        0 min,  0.007 sec
 * total energy  :   -29.0516532 Eh     change       -0.1036154E-03 Eh
   gradient norm :     0.0032339 Eh/α   predicted    -0.7388866E-04 ( -28.69%)
   displ. norm   :     0.1127894 α      lambda       -0.8735253E-04
   maximum displ.:     0.0654700 α      in ANC's #2, #1, #7, ...

........................................................................
.............................. CYCLE    5 ..............................
........................................................................
   1    -29.5187684 -0.295188E+02  0.844E-02    4.02       0.0  T
   2    -29.5187707 -0.235521E-05  0.474E-02    4.02       1.0  T
   3    -29.5187713 -0.577043E-06  0.449E-03    4.02       4.8  T
   4    -29.5187715 -0.180244E-06  0.203E-03    4.02      10.5  T
   5    -29.5187715 -0.595058E-08  0.900E-04    4.02      23.7  T
   6    -29.5187715 -0.394169E-08  0.222E-04    4.02      96.2  T
     SCC iter.                  ...        0 min,  0.004 sec
     gradient                   ...        0 min,  0.008 sec
 * total energy  :   -29.0517157 Eh     change       -0.6243828E-04 Eh
   gradient norm :     0.0017807 Eh/α   predicted    -0.4424806E-04 ( -29.13%)
   displ. norm   :     0.1573901 α      lambda       -0.5108127E-04
   maximum displ.:     0.1010663 α      in ANC's #2, #1, #7, ...

........................................................................
.............................. CYCLE    6 ..............................
........................................................................
   1    -29.5186602 -0.295187E+02  0.104E-01    4.01       0.0  T
   2    -29.5186632 -0.307611E-05  0.584E-02    4.02       1.0  T
   3    -29.5186643 -0.102451E-05  0.450E-03    4.02       4.7  T
   4    -29.5186644 -0.125966E-06  0.236E-03    4.02       9.1  T
   5    -29.5186644  0.191865E-08  0.776E-04    4.02      27.5  T
   6    -29.5186644 -0.826481E-08  0.154E-04    4.02     138.4  T
     SCC iter.                  ...        0 min,  0.005 sec
     gradient                   ...        0 min,  0.008 sec
 * total energy  :   -29.0517634 Eh     change       -0.4770766E-04 Eh
   gradient norm :     0.0017889 Eh/α   predicted    -0.2583704E-04 ( -45.84%)
   displ. norm   :     0.0804741 α      lambda       -0.2021244E-04
   maximum displ.:     0.0601517 α      in ANC's #2, #1, #6, ...

........................................................................
.............................. CYCLE    7 ..............................
........................................................................
   1    -29.5186648 -0.295187E+02  0.478E-02    4.02       0.0  T
   2    -29.5186655 -0.701283E-06  0.267E-02    4.02       1.0  T
   3    -29.5186657 -0.207233E-06  0.225E-03    4.03       9.5  T
   4    -29.5186657 -0.305231E-07  0.120E-03    4.03      17.8  T
   5    -29.5186658 -0.683463E-08  0.449E-04    4.03      47.5  T
   6    -29.5186658 -0.235335E-09  0.120E-04    4.03     178.4  T
     SCC iter.                  ...        0 min,  0.005 sec
     gradient                   ...        0 min,  0.008 sec
 * total energy  :   -29.0517865 Eh     change       -0.2314289E-04 Eh
   gradient norm :     0.0014422 Eh/α   predicted    -0.1013797E-04 ( -56.19%)
   displ. norm   :     0.0682925 α      lambda       -0.1379343E-04
   maximum displ.:     0.0577390 α      in ANC's #2, #1, #6, ...

........................................................................
.............................. CYCLE    8 ..............................
........................................................................
   1    -29.5185297 -0.295185E+02  0.457E-02    4.03       0.0  T
   2    -29.5185304 -0.692377E-06  0.256E-02    4.03       1.0  T
   3    -29.5185305 -0.168859E-06  0.242E-03    4.03       8.8  T
   4    -29.5185306 -0.531717E-07  0.119E-03    4.03      17.8  T
   5    -29.5185306 -0.760113E-08  0.459E-04    4.03      46.5  T
   6    -29.5185306  0.767599E-10  0.126E-04    4.03     169.9  T
     SCC iter.                  ...        0 min,  0.005 sec
     gradient                   ...        0 min,  0.008 sec
 * total energy  :   -29.0518021 Eh     change       -0.1561492E-04 Eh
   gradient norm :     0.0006670 Eh/α   predicted    -0.6912132E-05 ( -55.73%)
   displ. norm   :     0.0492642 α      lambda       -0.7712287E-05
   maximum displ.:     0.0445114 α      in ANC's #2, #7, #1, ...

........................................................................
.............................. CYCLE    9 ..............................
........................................................................
   1    -29.5185963 -0.295186E+02  0.410E-02    4.03       0.0  T
   2    -29.5185968 -0.432853E-06  0.231E-02    4.04       1.0  T
   3    -29.5185969 -0.165328E-06  0.146E-03    4.04      14.6  T
   4    -29.5185969 -0.572484E-08  0.818E-04    4.04      26.1  T
   5    -29.5185969 -0.312880E-08  0.293E-04    4.04      72.8  T
     SCC iter.                  ...        0 min,  0.004 sec
     gradient                   ...        0 min,  0.008 sec
 * total energy  :   -29.0518121 Eh     change       -0.1001549E-04 Eh
   gradient norm :     0.0007551 Eh/α   predicted    -0.3861854E-05 ( -61.44%)
   displ. norm   :     0.0465659 α      lambda       -0.7669492E-05
   maximum displ.:     0.0412649 α      in ANC's #2, #7, #8, ...

........................................................................
.............................. CYCLE   10 ..............................
........................................................................
   1    -29.5185544 -0.295186E+02  0.429E-02    4.04       0.0  T
   2    -29.5185548 -0.440053E-06  0.243E-02    4.04       1.0  T
   3    -29.5185550 -0.179479E-06  0.144E-03    4.04      14.8  T
   4    -29.5185550 -0.647982E-08  0.802E-04    4.04      26.6  T
   5    -29.5185550 -0.252074E-08  0.263E-04    4.04      80.9  T
     SCC iter.                  ...        0 min,  0.004 sec
     gradient                   ...        0 min,  0.007 sec
 * total energy  :   -29.0518225 Eh     change       -0.1032728E-04 Eh
   gradient norm :     0.0008018 Eh/α   predicted    -0.3839153E-05 ( -62.83%)
   displ. norm   :     0.0584524 α      lambda       -0.9177413E-05
   maximum displ.:     0.0503547 α      in ANC's #2, #7, #6, ...

........................................................................
.............................. CYCLE   11 ..............................
........................................................................
   1    -29.5185464 -0.295185E+02  0.530E-02    4.03       0.0  T
   2    -29.5185470 -0.669441E-06  0.300E-02    4.04       1.0  T
   3    -29.5185473 -0.259155E-06  0.204E-03    4.03      10.4  T
   4    -29.5185473 -0.308712E-07  0.108E-03    4.03      19.8  T
   5    -29.5185473 -0.194949E-08  0.313E-04    4.03      68.1  T
   6    -29.5185473 -0.662599E-09  0.876E-05    4.03     243.5  T
     SCC iter.                  ...        0 min,  0.004 sec
     gradient                   ...        0 min,  0.008 sec
 * total energy  :   -29.0518346 Eh     change       -0.1208866E-04 Eh
   gradient norm :     0.0007384 Eh/α   predicted    -0.4598907E-05 ( -61.96%)
   displ. norm   :     0.0608872 α      lambda       -0.8660905E-05
   maximum displ.:     0.0555155 α      in ANC's #2, #7, #6, ...

........................................................................
.............................. CYCLE   12 ..............................
........................................................................
   1    -29.5185515 -0.295186E+02  0.505E-02    4.03       0.0  T
   2    -29.5185522 -0.664319E-06  0.286E-02    4.03       1.0  T
   3    -29.5185525 -0.240830E-06  0.213E-03    4.03      10.0  T
   4    -29.5185525 -0.341827E-07  0.109E-03    4.03      19.5  T
   5    -29.5185525 -0.145730E-08  0.345E-04    4.03      61.9  T
   6    -29.5185525 -0.933110E-09  0.735E-05    4.03     290.2  T
     SCC iter.                  ...        0 min,  0.004 sec
     gradient                   ...        0 min,  0.008 sec
 * total energy  :   -29.0518461 Eh     change       -0.1152241E-04 Eh
   gradient norm :     0.0005558 Eh/α   predicted    -0.4337875E-05 ( -62.35%)
   displ. norm   :     0.0547663 α      lambda       -0.7197229E-05
   maximum displ.:     0.0516877 α      in ANC's #2, #1, #8, ...

........................................................................
.............................. CYCLE   13 ..............................
........................................................................
   1    -29.5185531 -0.295186E+02  0.411E-02    4.03       0.0  T
   2    -29.5185536 -0.474773E-06  0.231E-02    4.03       1.0  T
   3    -29.5185538 -0.165031E-06  0.177E-03    4.03      12.1  T
   4    -29.5185538 -0.198447E-07  0.919E-04    4.03      23.2  T
   5    -29.5185538 -0.410118E-09  0.310E-04    4.03      68.7  T
     SCC iter.                  ...        0 min,  0.004 sec
     gradient                   ...        0 min,  0.007 sec
 * total energy  :   -29.0518562 Eh     change       -0.1010970E-04 Eh
   gradient norm :     0.0004488 Eh/α   predicted    -0.3604706E-05 ( -64.34%)
   displ. norm   :     0.0509446 α      lambda       -0.6749287E-05
   maximum displ.:     0.0476919 α      in ANC's #2, #1, #8, ...

........................................................................
.............................. CYCLE   14 ..............................
........................................................................
   1    -29.5186448 -0.295186E+02  0.353E-02    4.03       0.0  T
   2    -29.5186452 -0.353090E-06  0.198E-02    4.03       1.1  T
   3    -29.5186453 -0.120631E-06  0.149E-03    4.03      14.3  T
   4    -29.5186453 -0.113283E-07  0.786E-04    4.03      27.1  T
   5    -29.5186453 -0.529425E-10  0.234E-04    4.03      91.1  T
     SCC iter.                  ...        0 min,  0.004 sec
     gradient                   ...        0 min,  0.008 sec
 * total energy  :   -29.0518661 Eh     change       -0.9903610E-05 Eh
   gradient norm :     0.0004307 Eh/α   predicted    -0.3380882E-05 ( -65.86%)
   displ. norm   :     0.0586958 α      lambda       -0.8179384E-05
   maximum displ.:     0.0527037 α      in ANC's #2, #1, #8, ...

........................................................................
.............................. CYCLE   15 ..............................
........................................................................
   1    -29.5186732 -0.295187E+02  0.388E-02    4.03       0.0  T
   2    -29.5186736 -0.407667E-06  0.218E-02    4.03       1.0  T
   3    -29.5186737 -0.140218E-06  0.154E-03    4.03      13.8  T
   4    -29.5186737 -0.910310E-08  0.828E-04    4.03      25.7  T
   5    -29.5186737 -0.240792E-09  0.163E-04    4.03     130.6  T
     SCC iter.                  ...        0 min,  0.004 sec
     gradient                   ...        0 min,  0.008 sec
 * total energy  :   -29.0518781 Eh     change       -0.1198370E-04 Eh
   gradient norm :     0.0005535 Eh/α   predicted    -0.4097031E-05 ( -65.81%)
   displ. norm   :     0.0791743 α      lambda       -0.1106643E-04
   maximum displ.:     0.0676561 α      in ANC's #2, #1, #6, ...

........................................................................
.............................. CYCLE   16 ..............................
........................................................................
   1    -29.5186581 -0.295187E+02  0.509E-02    4.03       0.0  T
   2    -29.5186587 -0.655804E-06  0.285E-02    4.04       1.0  T
   3    -29.5186589 -0.224966E-06  0.194E-03    4.04      11.0  T
   4    -29.5186590 -0.113605E-07  0.104E-03    4.04      20.6  T
   5    -29.5186590 -0.601847E-09  0.221E-04    4.04      96.3  T
   6    -29.5186590 -0.803126E-10  0.802E-05    4.04     265.8  T
     SCC iter.                  ...        0 min,  0.004 sec
     gradient                   ...        0 min,  0.008 sec
 * total energy  :   -29.0518942 Eh     change       -0.1616966E-04 Eh
   gradient norm :     0.0005843 Eh/α   predicted    -0.5549040E-05 ( -65.68%)
   displ. norm   :     0.1168683 α      lambda       -0.1576765E-04
   maximum displ.:     0.0966001 α      in ANC's #2, #1, #6, ...

........................................................................
.............................. CYCLE   17 ..............................
........................................................................
   1    -29.5186211 -0.295186E+02  0.739E-02    4.04       0.0  T
   2    -29.5186224 -0.131573E-05  0.415E-02    4.04       1.0  T
   3    -29.5186229 -0.453431E-06  0.274E-03    4.04       7.8  T
   4    -29.5186229 -0.175708E-07  0.144E-03    4.04      14.8  T
   5    -29.5186229 -0.141226E-08  0.376E-04    4.04      56.7  T
   6    -29.5186229 -0.266507E-09  0.140E-04    4.04     152.6  T
     SCC iter.                  ...        0 min,  0.005 sec
     gradient                   ...        0 min,  0.008 sec
 * total energy  :   -29.0519168 Eh     change       -0.2253138E-04 Eh
   gradient norm :     0.0006160 Eh/α   predicted    -0.7933486E-05 ( -64.79%)
   displ. norm   :     0.1715398 α      lambda       -0.2139069E-04
   maximum displ.:     0.1397150 α      in ANC's #2, #1, #6, ...

........................................................................
.............................. CYCLE   18 ..............................
........................................................................
   1    -29.5183847 -0.295184E+02  0.108E-01    4.04       0.0  T
   2    -29.5183875 -0.276444E-05  0.607E-02    4.05       1.0  T
   3    -29.5183884 -0.950175E-06  0.396E-03    4.05       5.4  T
   4    -29.5183885 -0.341907E-07  0.206E-03    4.05      10.4  T
   5    -29.5183885 -0.331301E-08  0.529E-04    4.05      40.3  T
   6    -29.5183885 -0.406967E-09  0.137E-04    4.05     156.1  T
     SCC iter.                  ...        0 min,  0.005 sec
     gradient                   ...        0 min,  0.008 sec
 * total energy  :   -29.0519461 Eh     change       -0.2929400E-04 Eh
   gradient norm :     0.0008917 Eh/α   predicted    -0.1083668E-04 ( -63.01%)
   displ. norm   :     0.3362793 α      lambda       -0.3672978E-04
   maximum displ.:     0.2739953 α      in ANC's #2, #1, #6, ...

........................................................................
.............................. CYCLE   19 ..............................
........................................................................
   1    -29.5174148 -0.295174E+02  0.212E-01    4.06       0.0  T
   2    -29.5174255 -0.106927E-04  0.119E-01    4.07       1.0  T
   3    -29.5174292 -0.362456E-05  0.778E-03    4.07       2.7  T
   4    -29.5174293 -0.137110E-06  0.404E-03    4.06       5.3  T
   5    -29.5174293 -0.124798E-07  0.114E-03    4.06      18.7  T
   6    -29.5174293 -0.224934E-08  0.335E-04    4.06      63.6  T
   7    -29.5174293 -0.153220E-08  0.117E-04    4.06     182.4  T
     SCC iter.                  ...        0 min,  0.005 sec
     gradient                   ...        0 min,  0.008 sec
 * total energy  :   -29.0519839 Eh     change       -0.3780492E-04 Eh
   gradient norm :     0.0031890 Eh/α   predicted    -0.1928971E-04 ( -48.98%)
   displ. norm   :     0.1491958 α      lambda       -0.2293511E-04
   maximum displ.:     0.1219166 α      in ANC's #2, #1, #16, ...

........................................................................
.............................. CYCLE   20 ..............................
........................................................................
   1    -29.5175924 -0.295176E+02  0.959E-02    4.07       0.0  T
   2    -29.5175945 -0.210490E-05  0.538E-02    4.07       1.0  T
   3    -29.5175952 -0.749725E-06  0.344E-03    4.07       6.2  T
   4    -29.5175953 -0.219094E-07  0.179E-03    4.07      11.9  T
   5    -29.5175953 -0.229382E-08  0.462E-04    4.07      46.2  T
   6    -29.5175953 -0.450399E-09  0.183E-04    4.07     116.6  T
     SCC iter.                  ...        0 min,  0.004 sec
     gradient                   ...        0 min,  0.008 sec
 * total energy  :   -29.0520020 Eh     change       -0.1811673E-04 Eh
   gradient norm :     0.0032419 Eh/α   predicted    -0.1172604E-04 ( -35.28%)
   displ. norm   :     0.2081008 α      lambda       -0.4036131E-04
   maximum displ.:     0.1717576 α      in ANC's #2, #1, #16, ...
 * RMSD in coord.:     0.3785349 α      energy gain  -0.4039973E-02 Eh

generating ANC from model Hessian ...
Using Lindh-Hessian (1995)
 Shifting diagonal of input Hessian by   3.779736251462632E-003
 Lowest  eigenvalues of input Hessian
   -0.000000   -0.000000   -0.000000   -0.000000   -0.000000    0.000000
    0.005000    0.007087    0.008050    0.009716    0.012316    0.014597
    0.017222    0.019613    0.022888    0.028609    0.031450    0.032141
 Highest eigenvalues
    1.437901    1.571810    1.621898    1.894850    1.976389    2.027328
 

........................................................................
.............................. CYCLE   21 ..............................
........................................................................
   1    -29.5183161 -0.295183E+02  0.133E-01    4.07       0.0  T
   2    -29.5183202 -0.408444E-05  0.750E-02    4.08       1.0  T
   3    -29.5183217 -0.143569E-05  0.487E-03    4.08       4.4  T
   4    -29.5183217 -0.588368E-07  0.260E-03    4.08       8.2  T
   5    -29.5183217 -0.431464E-08  0.580E-04    4.08      36.8  T
   6    -29.5183217 -0.543785E-09  0.201E-04    4.08     106.1  T
     SCC iter.                  ...        0 min,  0.004 sec
     gradient                   ...        0 min,  0.008 sec
 * total energy  :   -29.0520324 Eh     change       -0.3043531E-04 Eh
   gradient norm :     0.0023518 Eh/α   predicted     0.0000000E+00 (-100.00%)
   displ. norm   :     0.0296336 α      lambda       -0.1800200E-04
   maximum displ.:     0.0244231 α      in ANC's #2, #7, #10, ...

........................................................................
.............................. CYCLE   22 ..............................
........................................................................
   1    -29.5186149 -0.295186E+02  0.279E-02    4.07       0.0  T
   2    -29.5186152 -0.270734E-06  0.158E-02    4.07       1.3  T
   3    -29.5186152 -0.648782E-07  0.152E-03    4.07      14.0  T
   4    -29.5186153 -0.233821E-07  0.617E-04    4.07      34.5  T
   5    -29.5186153 -0.916529E-09  0.302E-04    4.07      70.7  T
     SCC iter.                  ...        0 min,  0.004 sec
     gradient                   ...        0 min,  0.008 sec
 * total energy  :   -29.0520472 Eh     change       -0.1476241E-04 Eh
   gradient norm :     0.0010717 Eh/α   predicted    -0.9009614E-05 ( -38.97%)
   displ. norm   :     0.0718821 α      lambda       -0.1859057E-04
   maximum displ.:     0.0524034 α      in ANC's #2, #7, #10, ...

........................................................................
.............................. CYCLE   23 ..............................
........................................................................
   1    -29.5190007 -0.295190E+02  0.721E-02    4.06       0.0  T
   2    -29.5190022 -0.141535E-05  0.409E-02    4.06       1.0  T
   3    -29.5190026 -0.436856E-06  0.341E-03    4.06       6.2  T
   4    -29.5190027 -0.130650E-06  0.150E-03    4.06      14.2  T
   5    -29.5190027 -0.284730E-08  0.641E-04    4.06      33.2  T
   6    -29.5190027 -0.224322E-08  0.104E-04    4.06     205.4  T
     SCC iter.                  ...        0 min,  0.004 sec
     gradient                   ...        0 min,  0.007 sec
 * total energy  :   -29.0520642 Eh     change       -0.1702563E-04 Eh
   gradient norm :     0.0012154 Eh/α   predicted    -0.9316978E-05 ( -45.28%)
   displ. norm   :     0.0492436 α      lambda       -0.6622668E-05
   maximum displ.:     0.0409990 α      in ANC's #2, #7, #10, ...

........................................................................
.............................. CYCLE   24 ..............................
........................................................................
   1    -29.5189148 -0.295189E+02  0.483E-02    4.06       0.0  T
   2    -29.5189154 -0.562089E-06  0.273E-02    4.06       1.0  T
   3    -29.5189156 -0.230310E-06  0.168E-03    4.06      12.7  T
   4    -29.5189156 -0.120544E-07  0.932E-04    4.06      22.9  T
   5    -29.5189156 -0.215528E-08  0.285E-04    4.06      74.8  T
     SCC iter.                  ...        0 min,  0.003 sec
     gradient                   ...        0 min,  0.008 sec
 * total energy  :   -29.0520724 Eh     change       -0.8189066E-05 Eh
   gradient norm :     0.0010267 Eh/α   predicted    -0.3319011E-05 ( -59.47%)
   displ. norm   :     0.0491870 α      lambda       -0.3049046E-05
   maximum displ.:     0.0410001 α      in ANC's #2, #7, #10, ...

........................................................................
.............................. CYCLE   25 ..............................
........................................................................
   1    -29.5187433 -0.295187E+02  0.483E-02    4.06       0.0  T
   2    -29.5187439 -0.569735E-06  0.273E-02    4.06       1.0  T
   3    -29.5187441 -0.230380E-06  0.167E-03    4.06      12.7  T
   4    -29.5187441 -0.109120E-07  0.923E-04    4.06      23.1  T
   5    -29.5187441 -0.246215E-08  0.308E-04    4.06      69.3  T
     SCC iter.                  ...        0 min,  0.003 sec
     gradient                   ...        0 min,  0.007 sec
 * total energy  :   -29.0520769 Eh     change       -0.4476941E-05 Eh
   gradient norm :     0.0011926 Eh/α   predicted    -0.1530086E-05 ( -65.82%)
   displ. norm   :     0.0287459 α      lambda       -0.4192588E-05
   maximum displ.:     0.0265931 α      in ANC's #2, #7, #16, ...

........................................................................
.............................. CYCLE   26 ..............................
........................................................................
   1    -29.5187608 -0.295188E+02  0.257E-02    4.07       0.0  T
   2    -29.5187610 -0.154884E-06  0.144E-02    4.07       1.5  T
   3    -29.5187610 -0.620384E-07  0.918E-04    4.07      23.2  T
   4    -29.5187610 -0.227558E-08  0.529E-04    4.07      40.3  T
     SCC iter.                  ...        0 min,  0.003 sec
     gradient                   ...        0 min,  0.008 sec
 * total energy  :   -29.0520819 Eh     change       -0.5016721E-05 Eh
   gradient norm :     0.0006408 Eh/α   predicted    -0.2108336E-05 ( -57.97%)
   displ. norm   :     0.0308273 α      lambda       -0.3897164E-05
   maximum displ.:     0.0290352 α      in ANC's #2, #6, #16, ...

........................................................................
.............................. CYCLE   27 ..............................
........................................................................
   1    -29.5187589 -0.295188E+02  0.225E-02    4.07       0.0  T
   2    -29.5187590 -0.122032E-06  0.126E-02    4.07       1.7  T
   3    -29.5187590 -0.372942E-07  0.110E-03    4.07      19.4  T
   4    -29.5187590 -0.129390E-07  0.562E-04    4.07      37.9  T
   5    -29.5187590 -0.602224E-09  0.111E-04    4.07     191.5  T
     SCC iter.                  ...        0 min,  0.003 sec
     gradient                   ...        0 min,  0.007 sec
 * total energy  :   -29.0520865 Eh     change       -0.4571988E-05 Eh
   gradient norm :     0.0005694 Eh/α   predicted    -0.1951232E-05 ( -57.32%)
   displ. norm   :     0.0288202 α      lambda       -0.2917419E-05
   maximum displ.:     0.0262661 α      in ANC's #2, #6, #1, ...

   *** GEOMETRY OPTIMIZATION CONVERGED AFTER 27 ITERATIONS ***

------------------------------------------------------------------------
 total energy gain   :        -0.0041245 Eh       -2.5881 kcal/mol
 total RMSD          :         0.4173753 a0        0.2209 Å
 total power (kW/mol):        -0.4010647 (step)  -22.6073 (real)
------------------------------------------------------------------------

 ANCopt (total)                0 d,  0 h,  0 min,  0.479 sec
 optimizer setup                ...        0 min,  0.000 sec (  0.021%)
 model hessian                  ...        0 min,  0.008 sec (  1.715%)
 ANC generation                 ...        0 min,  0.001 sec (  0.239%)
 coordinate transformation      ...        0 min,  0.000 sec (  0.083%)
 single point calculation       ...        0 min,  0.462 sec ( 96.494%)
 optimization log               ...        0 min,  0.002 sec (  0.461%)
 hessian update                 ...        0 min,  0.000 sec (  0.060%)
 rational function              ...        0 min,  0.003 sec (  0.623%)

================
 final structure:
================
$coord
    2.60460109819191   -0.51676835876884    0.20062201864733      C 
    1.74243954205974    1.94212492633199    0.38962206561198      C 
   -0.82901425728980    2.46082799084799    0.38257557943667      C 
   -1.80318613300588    5.12575403301240    0.59436537728983      C 
   -3.78572676009204    5.56888982045440   -1.26771631802483      N 
   -2.52075404004864    0.46736541265802    0.16140118256171      C 
   -1.65815798764914   -1.98997476025946   -0.04494825599451      C 
    0.91279704877392   -2.51051813222865   -0.01725087549638      C 
    1.88685574460284   -5.17528664789902   -0.23196931414945      C 
    3.96299117451990   -5.29064481042963   -2.04032534734361      N 
    4.60374811968938   -0.91862930918386    0.19634365625599      H 
    3.08474715788336    3.47444655229454    0.55227591184033      H 
   -0.20574144327810    6.45745064779245    0.43478346563659      H 
   -2.65567852242477    5.39204021076970    2.46488672897567      H 
   -3.09089011139753    5.30457002352240   -3.03584772680185      H 
   -4.42085416889505    7.37290241031563   -1.14685063225385      H 
   -4.51896185927126    0.87251958614500    0.12847570212649      H 
   -3.00005622892134   -3.52090439080883   -0.22328826214356      H 
    0.30543135901630   -6.45025866489739   -0.70541519463290      H 
    2.64486222894164   -5.77256309314516    1.60240597331361      H 
    3.35699581688186   -4.71667961478005   -3.76720450910655      H 
    4.60155618507250   -7.08985152994489   -2.20691546727250      H 
$end
           -------------------------------------------------
          |                Final Singlepoint                |
           -------------------------------------------------

          ...................................................
          :                      SETUP                      :
          :.................................................:
          :  # basis functions                  52          :
          :  # atomic orbitals                  52          :
          :  # shells                           32          :
          :  # electrons                        54          :
          :  max. iterations                   250          :
          :  Hamiltonian                  GFN2-xTB          :
          :  restarted?                      false          :
          :  GBSA solvation                  false          :
          :  PC potential                    false          :
          :  electronic temp.          300.0000000     K    :
          :  accuracy                    1.0000000          :
          :  -> integral cutoff          0.2500000E+02      :
          :  -> integral neglect         0.1000000E-07      :
          :  -> SCF convergence          0.1000000E-05 Eh   :
          :  -> wf. convergence          0.1000000E-03 e    :
          :  Broyden damping             0.4000000          :
          ...................................................

 iter      E             dE          RMSdq      gap      omega  full diag
   1    -29.5187590 -0.295188E+02  0.358E-05    4.07       0.0  T
   2    -29.5187590 -0.946798E-11  0.193E-05    4.07    1104.2  T
   3    -29.5187590 -0.948930E-11  0.851E-06    4.07    2506.7  T

   *** convergence criteria satisfied after 3 iterations ***

         #    Occupation            Energy/Eh            Energy/eV
      -------------------------------------------------------------
         1        2.0000           -0.6396514             -17.4058
       ...           ...                  ...                  ...
        21        2.0000           -0.4465548             -12.1514
        22        2.0000           -0.4160966             -11.3226
        23        2.0000           -0.4107273             -11.1765
        24        2.0000           -0.3953473             -10.7579
        25        2.0000           -0.3863211             -10.5123
        26        2.0000           -0.3656052              -9.9486
        27        2.0000           -0.3640488              -9.9063 (HOMO)
        28                         -0.2145440              -5.8380 (LUMO)
        29                         -0.2130797              -5.7982
        30                         -0.0882609              -2.4017
        31                          0.0560294               1.5246
        32                          0.0616888               1.6786
       ...                                ...                  ...
        52                          0.6638618              18.0646
      -------------------------------------------------------------
                  HL-Gap            0.1495047 Eh            4.0682 eV
             Fermi-level           -0.2892964 Eh           -7.8722 eV

 SCC (total)                   0 d,  0 h,  0 min,  0.015 sec
 SCC setup                      ...        0 min,  0.000 sec (  0.924%)
 Dispersion                     ...        0 min,  0.000 sec (  0.890%)
 integral evaluation            ...        0 min,  0.005 sec ( 30.325%)
 zeroth order Hamiltonian       ...        0 min,  0.000 sec (  0.534%)
 iterations                     ...        0 min,  0.002 sec ( 16.473%)
 molecular gradient             ...        0 min,  0.007 sec ( 48.967%)
 printout                       ...        0 min,  0.000 sec (  1.616%)

         :::::::::::::::::::::::::::::::::::::::::::::::::::::
         ::                     SUMMARY                     ::
         :::::::::::::::::::::::::::::::::::::::::::::::::::::
         :: total energy             -29.052086475168 Eh    ::
         :: gradient norm              0.000569067327 Eh/a0 ::
         :: HOMO-LUMO gap              4.068230649124 eV    ::
         ::.................................................::
         :: SCC energy               -29.518759041560 Eh    ::
         :: -> isotropic ES            0.022093634510 Eh    ::
         :: -> anisotropic ES          0.006648332885 Eh    ::
         :: -> anisotropic XC          0.023467175164 Eh    ::
         :: -> dispersion             -0.017364937660 Eh    ::
         :: repulsion energy           0.466669373974 Eh    ::
         :: add. restraining           0.000000000000 Eh    ::
         :::::::::::::::::::::::::::::::::::::::::::::::::::::

           -------------------------------------------------
          |                Property Printout                |
           -------------------------------------------------

    * Orbital Energies and Occupations

         #    Occupation            Energy/Eh            Energy/eV
      -------------------------------------------------------------
         1        2.0000           -0.6396514             -17.4058
       ...           ...                  ...                  ...
        15        2.0000           -0.4889781             -13.3058
        16        2.0000           -0.4795521             -13.0493
        17        2.0000           -0.4747698             -12.9191
        18        2.0000           -0.4680382             -12.7360
        19        2.0000           -0.4628889             -12.5958
        20        2.0000           -0.4517276             -12.2921
        21        2.0000           -0.4465548             -12.1514
        22        2.0000           -0.4160966             -11.3226
        23        2.0000           -0.4107273             -11.1765
        24        2.0000           -0.3953473             -10.7579
        25        2.0000           -0.3863211             -10.5123
        26        2.0000           -0.3656052              -9.9486
        27        2.0000           -0.3640488              -9.9063 (HOMO)
        28                         -0.2145440              -5.8380 (LUMO)
        29                         -0.2130797              -5.7982
        30                         -0.0882609              -2.4017
        31                          0.0560294               1.5246
        32                          0.0616888               1.6786
        33                          0.0999532               2.7199
        34                          0.1093299               2.9750
        35                          0.1327068               3.6111
        36                          0.1355530               3.6886
        37                          0.1606478               4.3714
        38                          0.1659311               4.5152
       ...                                ...                  ...
        52                          0.6638618              18.0646
      -------------------------------------------------------------
                  HL-Gap            0.1495047 Eh            4.0682 eV
             Fermi-level           -0.2892964 Eh           -7.8722 eV

     #   Z        covCN         q      C6AA      α(0)
     1   6 C      2.924    -0.036    28.901     8.816
     2   6 C      2.923    -0.040    29.005     8.832
     3   6 C      2.971     0.003    27.944     8.671
     4   6 C      3.736     0.021    20.303     6.430
     5   7 N      2.631    -0.337    28.687     7.955
     6   6 C      2.924    -0.036    28.901     8.816
     7   6 C      2.923    -0.040    29.005     8.832
     8   6 C      2.971     0.003    27.944     8.671
     9   6 C      3.736     0.021    20.303     6.430
    10   7 N      2.631    -0.337    28.687     7.955
    11   1 H      0.926     0.048     2.347     2.396
    12   1 H      0.925     0.027     2.629     2.535
    13   1 H      0.923     0.005     2.965     2.693
    14   1 H      0.924     0.039     2.461     2.453
    15   1 H      0.860     0.135     1.504     1.921
    16   1 H      0.860     0.135     1.510     1.925
    17   1 H      0.926     0.048     2.347     2.396
    18   1 H      0.925     0.027     2.629     2.536
    19   1 H      0.923     0.005     2.965     2.693
    20   1 H      0.924     0.039     2.461     2.453
    21   1 H      0.860     0.135     1.504     1.921
    22   1 H      0.860     0.135     1.510     1.925

 Mol. C6AA /au·bohr⁶  :       4834.361281
 Mol. C8AA /au·bohr⁸  :     110791.384915
 Mol. α(0) /au        :        109.254866


Wiberg/Mayer (AO) data.
largest (>0.10) Wiberg bond orders for each atom
          total WBO             WBO to atom ...
     1  C   3.991        C    2 1.449    C    8 1.411    H   11 0.968    C    6 0.112
     2  C   3.992        C    1 1.449    C    3 1.414    H   12 0.968    C    7 0.107
     3  C   3.988        C    2 1.414    C    6 1.410    C    4 1.005    C    8 0.107
     4  C   3.987        N    5 1.018    C    3 1.005    H   13 0.967    H   14 0.962
     5  N   3.001        C    4 1.018    H   15 0.969    H   16 0.969
     6  C   3.991        C    7 1.449    C    3 1.410    H   17 0.968    C    1 0.112
     7  C   3.992        C    6 1.449    C    8 1.414    H   18 0.968    C    2 0.107
     8  C   3.988        C    7 1.414    C    1 1.411    C    9 1.005    C    3 0.107
     9  C   3.987        N   10 1.018    C    8 1.005    H   19 0.967    H   20 0.962
    10  N   3.001        C    9 1.018    H   21 0.969    H   22 0.969
    11  H   0.997        C    1 0.968
    12  H   0.999        C    2 0.968
    13  H   1.000        C    4 0.967
    14  H   0.998        C    4 0.962
    15  H   0.982        N    5 0.969
    16  H   0.981        N    5 0.969
    17  H   0.997        C    6 0.968
    18  H   0.999        C    7 0.968
    19  H   1.000        C    9 0.967
    20  H   0.998        C    9 0.962
    21  H   0.982        N   10 0.969
    22  H   0.981        N   10 0.969

molecular dipole:
                 x           y           z       tot (Debye)
 q only:        0.003       0.008      -0.093
   full:        0.010       0.031      -0.351       0.895
molecular quadrupole (traceless):
                xx          xy          yy          xz          yz          zz
 q only:       -3.291      -0.817       3.937      -0.146       0.392      -0.646
  q+dip:       -8.816       0.466      12.744      -0.106       1.515      -3.927
   full:      -10.357      -0.159      11.617      -0.267       1.157      -1.260

           -------------------------------------------------
          |                Geometry Summary                 |
           -------------------------------------------------

      molecular mass/u    :      136.1962000
   center of mass at/Å    :        0.0280693       0.0075597      -0.1354350
  moments of inertia/u·Å² :        0.1319957E+03   0.7514589E+03   0.8222886E+03
rotational constants/cm⁻¹ :        0.1277135E+00   0.2243321E-01   0.2050087E-01

 * 20 selected distances

     #   Z        #   Z                                     value/Å
     1   6 C      2   6 C                                 1.3824800
     2   6 C      3   6 C                                 1.3881679
     4   6 C      5   7 N                                 1.4582828 (max)
     3   6 C      6   6 C                                 1.3885025
     6   6 C      7   6 C                                 1.3824773
     1   6 C      8   6 C                                 1.3884937
     7   6 C      8   6 C                                 1.3881745
     9   6 C     10   7 N                                 1.4582456
     1   6 C     11   1 H                                 1.0790675
     2   6 C     12   1 H                                 1.0814208
     4   6 C     13   1 H                                 1.1037770
     4   6 C     14   1 H                                 1.0968789
     5   7 N     15   1 H                                 1.0149934
     5   7 N     16   1 H                                 1.0140970 (min)
     6   6 C     17   1 H                                 1.0790635
     7   6 C     18   1 H                                 1.0814190
     9   6 C     19   1 H                                 1.1037638
     9   6 C     20   1 H                                 1.0968462
    10   7 N     21   1 H                                 1.0149694
    10   7 N     22   1 H                                 1.0141254

 * 4 distinct bonds (by element types)

   Z      Z             #   av. dist./Å        max./Å        min./Å
   1 H    6 C           8     1.0902796     1.1037770     1.0790635
   6 C    6 C           6     1.3863827     1.3885025     1.3824773
   1 H    7 N           4     1.0145463     1.0149934     1.0140970
   6 C    7 N           2     1.4582642     1.4582828     1.4582456


optimized geometry written to: xtbopt.xyz


           -------------------------------------------------
          | TOTAL ENERGY              -29.052086475168 Eh   |
          | GRADIENT NORM               0.000569067327 Eh/α |
          | HOMO-LUMO GAP               4.068230649124 eV   |
           -------------------------------------------------

------------------------------------------------------------------------
 * finished run on 2021/05/19 at 10:58:41.748     
------------------------------------------------------------------------
 total:
 * wall-time:     0 d,  0 h,  0 min,  0.532 sec
 *  cpu-time:     0 d,  0 h,  0 min,  0.532 sec
 * ratio c/w:     0.999 speedup
 SCF:
 * wall-time:     0 d,  0 h,  0 min,  0.022 sec
 *  cpu-time:     0 d,  0 h,  0 min,  0.022 sec
 * ratio c/w:     1.000 speedup
 ANC optimizer:
 * wall-time:     0 d,  0 h,  0 min,  0.495 sec
 *  cpu-time:     0 d,  0 h,  0 min,  0.495 sec
 * ratio c/w:     1.000 speedup

