      -----------------------------------------------------------      
     |                   =====================                   |     
     |                           x T B                           |     
     |                   =====================                   |     
     |                         S. Grimme                         |     
     |          Mulliken Center for Theoretical Chemistry        |     
     |                    University of Bonn                     |     
     |                Version 6.2 RC2 (SAW190805)                |     
      -----------------------------------------------------------      

   This program is distributed in the hope that it will be useful,
   but WITHOUT ANY WARRANTY; without even the implied warranty of
   MERCHANTABILITY or FITNESS FOR A PARTICULAR PURPOSE.
   
   FOR NON-COMMERCIAL, ACADEMIA USE ONLY.
   
   Cite this work as:
   * S. Grimme, C. Bannwarth, P. Shushkov, J. Chem. Theory Comput., 2017,
     13, 1989-2009. DOI: 10.1021/acs.jctc.7b00118
   * C. Bannwarth, S. Ehlert and S. Grimme., J. Chem. Theory Comput., 2019,
     15, 1652-1671. DOI: 10.1021/acs.jctc.8b01176
   * P. Pracht, E. Caldeweyher, S. Ehlert, S. Grimme, ChemRxiv, 2019, preprint.
     DOI: 10.26434/chemrxiv.8326202.v1
   
   for DFT-D4:
   * E. Caldeweyher, C. Bannwarth and S. Grimme, J. Chem. Phys., 2017,
     147, 034112. DOI: 10.1063/1.4993215
   * E. Caldeweyher, S. Ehlert, A. Hansen, H. Neugebauer, S. Spicher,
     C. Bannwarth and S. Grimme, J. Chem. Phys., 2019, 150, 154122.
     DOI: 10.1063/1.5090222
   
   for sTDA-xTB:
   * S. Grimme and C. Bannwarth, J. Chem. Phys., 2016, 145, 054103.
     DOI: 10.1063/1.4959605
   
   in the mass-spec context:
   * V. Asgeirsson, C. Bauer and S. Grimme, Chem. Sci., 2017, 8, 4879.
     DOI: 10.1039/c7sc00601b
   
   for metadynamics refer to:
   * S. Grimme, J. Chem. Theory Comput., 2019, 155, 2847-2862
     DOI: 10.1021/acs.jctc.9b00143
   
   with help from (in alphabetical order)
   C. Bannwarth, F. Bohle, G. Brandenburg, E. Caldeweyher, M. Checinski,
   S. Dohm, S. Ehlert, S. Ehrlich, F. März, H. Neugebauer, J. Pisarek,
   P. Pracht, P. Shushkov, and S. Spicher.
   
 * started run on 2021/05/19 at 10:59:48.803     

           -------------------------------------------------
          |                Calculation Setup                |
           -------------------------------------------------

          program call               : /ihome/ghutchison/geoffh/xtb/xtb 650.xyz -opt
          hostname                   : smp-n144
          coordinate file            : 650.xyz
          omp threads                :                     1
          number of atoms            :                    20
          number of electrons        :                    68
          charge                     :                     0
          spin                       :                   0.0
          first test random number   :      0.92451523131867


########################################################################
# WARNING! Please study the warnings concerning your input carefully
#  - the use of '-opt' is discouraged, please use '--opt' next time
########################################################################

           ------------------------------------------------- 
          |                 G F N 2 - x T B                 |
          | Geometry, Frequencies, Noncovalent interactions |
          |            JCTC 2019 parametrisation            |
           ------------------------------------------------- 
             KAB for C  - Si     :                1.0500
             KAB for H  - Pd     :                0.9500
             k(s)              :                1.8500
             k(p)              :                2.2300
             k(d)              :                2.2300
             k(f)              :                2.0000
             kEN (H0ij)        :               -2.0000
             D4 a1             :                0.5200
             D4 a2             :                5.0000
             D4 s6             :                1.0000
             D4 s8             :                2.7000
             D4 s9             :                5.0000
             alphaj            :                2.0000

  Z AO/shell   Hii/eV     exponent
  1     Wed Apr 25 08:07:45 CEST 2018   EN: 2.200 GM2: 0.406  GM3: 0.0800  RAES: 1.40
     1s    -10.707211    1.230000
  6     Wed Apr 25 08:07:45 CEST 2018   EN: 2.550 GM2: 0.538  GM3: 0.1500  RAES: 3.00
     2s    -13.970922    2.096432
     2p    -10.063292    1.800000
 16     Tue Apr 24 11:44:34 CEST 2018   EN: 2.580 GM2: 0.340  GM3:-0.0502  RAES: 3.10
     3s    -20.029654    1.981333
     3p    -11.377694    2.025643
     3d     -0.420282    1.702555

           ------------------------------------------------- 
          |        Self-Consistent Charge Iterations        |
           ------------------------------------------------- 

          ...................................................
          :                      SETUP                      :
          :.................................................:
          :  # basis functions                  80          :
          :  # atomic orbitals                  77          :
          :  # shells                           37          :
          :  # electrons                        68          :
          :  max. iterations                   250          :
          :  Hamiltonian                  GFN2-xTB          :
          :  restarted?                      false          :
          :  GBSA solvation                  false          :
          :  PC potential                    false          :
          :  electronic temp.          300.0000000     K    :
          :  accuracy                    1.0000000          :
          :  -> integral cutoff          0.2500000E+02      :
          :  -> integral neglect         0.1000000E-07      :
          :  -> SCF convergence          0.1000000E-05 Eh   :
          :  -> wf. convergence          0.1000000E-03 e    :
          :  Broyden damping             0.4000000          :
          ...................................................

 iter      E             dE          RMSdq      gap      omega  full diag
   1    -36.7781601 -0.367782E+02  0.461E+00    1.03       0.0  T
   2    -36.7971198 -0.189597E-01  0.317E+00    0.75       1.0  T
   3    -36.7967778  0.341994E-03  0.184E+00    1.09       1.0  T
   4    -36.8164778 -0.197001E-01  0.488E-01    0.67       1.0  T
   5    -36.8179939 -0.151608E-02  0.381E-01    0.73       1.0  T
   6    -36.8193642 -0.137030E-02  0.117E-01    0.72       1.0  T
   7    -36.8195700 -0.205818E-03  0.280E-02    0.71       1.0  T
   8    -36.8195742 -0.414806E-05  0.142E-02    0.71       1.6  T
   9    -36.8195752 -0.998418E-06  0.787E-03    0.71       2.8  T
  10    -36.8195757 -0.480403E-06  0.345E-03    0.71       6.5  T
  11    -36.8195757 -0.396962E-07  0.171E-03    0.71      13.1  T
  12    -36.8195757 -0.485829E-08  0.826E-04    0.71      27.1  T
  13    -36.8195757 -0.857371E-08  0.350E-04    0.71      64.0  T

   *** convergence criteria satisfied after 13 iterations ***

         #    Occupation            Energy/Eh            Energy/eV
      -------------------------------------------------------------
         1        2.0000           -0.7540619             -20.5191
       ...           ...                  ...                  ...
        28        2.0000           -0.4519123             -12.2972
        29        2.0000           -0.4469494             -12.1621
        30        2.0000           -0.4189959             -11.4015
        31        2.0000           -0.4170291             -11.3479
        32        2.0000           -0.4052580             -11.0276
        33        2.0000           -0.3735338             -10.1644
        34        2.0000           -0.3598339              -9.7916 (HOMO)
        35        0.0000           -0.3336222              -9.0783 (LUMO)
        36                         -0.2764081              -7.5214
        37                         -0.2452892              -6.6747
        38                         -0.2209796              -6.0132
        39                         -0.2122174              -5.7747
       ...                                ...                  ...
        77                          0.7325424              19.9335
      -------------------------------------------------------------
                  HL-Gap            0.0262117 Eh            0.7133 eV
             Fermi-level           -0.3467280 Eh           -9.4350 eV

 SCC (total)                   0 d,  0 h,  0 min,  0.049 sec
 SCC setup                      ...        0 min,  0.000 sec (  0.615%)
 Dispersion                     ...        0 min,  0.000 sec (  0.636%)
 integral evaluation            ...        0 min,  0.012 sec ( 25.637%)
 zeroth order Hamiltonian       ...        0 min,  0.000 sec (  0.459%)
 iterations                     ...        0 min,  0.018 sec ( 36.889%)
 molecular gradient             ...        0 min,  0.017 sec ( 34.887%)
 printout                       ...        0 min,  0.000 sec (  0.765%)

         :::::::::::::::::::::::::::::::::::::::::::::::::::::
         ::                     SUMMARY                     ::
         :::::::::::::::::::::::::::::::::::::::::::::::::::::
         :: total energy             -36.279327252346 Eh    ::
         :: gradient norm              0.067758698091 Eh/a0 ::
         :: HOMO-LUMO gap              0.713257535400 eV    ::
         ::.................................................::
         :: SCC energy               -36.819575721637 Eh    ::
         :: -> isotropic ES            0.005914427938 Eh    ::
         :: -> anisotropic ES          0.001465331860 Eh    ::
         :: -> anisotropic XC          0.018169599329 Eh    ::
         :: -> dispersion             -0.027036057295 Eh    ::
         :: repulsion energy           0.540328309353 Eh    ::
         :: add. restraining           0.000000000000 Eh    ::
         :::::::::::::::::::::::::::::::::::::::::::::::::::::

      ----------------------------------------------------------- 
     |                   =====================                   |
     |                        A N C O P T                        |
     |                   =====================                   |
     |               Approximate Normal Coordinate               |
     |                Rational Function Optimizer                |
      ----------------------------------------------------------- 

          ...................................................
          :                      SETUP                      :
          :.................................................:
          :   optimization level            normal          :
          :   max. optcycles                   200          :
          :   ANC micro-cycles                  20          :
          :   degrees of freedom                54          :
          :.................................................:
          :   RF solver                   davidson          :
          :   input Hessian                  false          :
          :   write xtbopt.log                true          :
          :   linear?                        false          :
          :   energy convergence         0.5000000E-05 Eh   :
          :   grad. convergence          0.1000000E-02 Eh/α :
          :   maximium RF displ.         2.0000000          :
          :   Hlow (freq-cutoff)         0.5000000E-02      :
          :   Hmax (freq-cutoff)         5.0000000          :
          :   S6 in model hess.         20.0000000          :
          ...................................................

generating ANC from model Hessian ...
Using Lindh-Hessian (1995)
 Shifting diagonal of input Hessian by   3.213928713560132E-003
 Lowest  eigenvalues of input Hessian
   -0.000000   -0.000000   -0.000000   -0.000000    0.000000    0.000000
    0.005000    0.006402    0.008840    0.010338    0.012351    0.016119
    0.020003    0.028660    0.031425    0.038184    0.043028    0.050327
 Highest eigenvalues
    1.831090    1.905567    1.982036    2.006352    2.011713    2.095420
 

........................................................................
.............................. CYCLE    1 ..............................
........................................................................
   1    -36.8195757 -0.368196E+02  0.202E-04    0.71       0.0  T
   2    -36.8195757 -0.316192E-11  0.152E-04    0.71     146.8  T
   3    -36.8195757 -0.285112E-09  0.868E-05    0.71     257.7  T
     SCC iter.                  ...        0 min,  0.005 sec
     gradient                   ...        0 min,  0.017 sec
 * total energy  :   -36.2793273 Eh     change       -0.7008651E-09 Eh
   gradient norm :     0.0677594 Eh/α   predicted     0.0000000E+00 (-100.00%)
   displ. norm   :     0.2180560 α      lambda       -0.6388380E-02
   maximum displ.:     0.1341618 α      in ANC's #8, #3, #2, ...

........................................................................
.............................. CYCLE    2 ..............................
........................................................................
   1    -36.8256659 -0.368257E+02  0.249E-01    0.67       0.0  T
   2    -36.8256191  0.468388E-04  0.191E-01    0.72       1.0  T
   3    -36.8258199 -0.200819E-03  0.946E-02    0.69       1.0  T
   4    -36.8258926 -0.726861E-04  0.334E-02    0.70       1.0  T
   5    -36.8259007 -0.805880E-05  0.185E-02    0.70       1.2  T
   6    -36.8259047 -0.399310E-05  0.665E-03    0.70       3.4  T
   7    -36.8259050 -0.329307E-06  0.233E-03    0.70       9.6  T
   8    -36.8259050 -0.508654E-07  0.127E-03    0.70      17.7  T
     SCC iter.                  ...        0 min,  0.010 sec
     gradient                   ...        0 min,  0.016 sec
 * total energy  :   -36.2837365 Eh     change       -0.4409259E-02 Eh
   gradient norm :     0.0299668 Eh/α   predicted    -0.3346096E-02 ( -24.11%)
   displ. norm   :     0.2366944 α      lambda       -0.2126471E-02
   maximum displ.:     0.1334153 α      in ANC's #8, #3, #4, ...

........................................................................
.............................. CYCLE    3 ..............................
........................................................................
   1    -36.8267220 -0.368267E+02  0.195E-01    0.67       0.0  T
   2    -36.8267135  0.851474E-05  0.137E-01    0.69       1.0  T
   3    -36.8267548 -0.412990E-04  0.830E-02    0.67       1.0  T
   4    -36.8268208 -0.659552E-04  0.271E-02    0.68       1.0  T
   5    -36.8268266 -0.580878E-05  0.145E-02    0.68       1.5  T
   6    -36.8268290 -0.248498E-05  0.622E-03    0.68       3.6  T
   7    -36.8268294 -0.333101E-06  0.203E-03    0.68      11.0  T
   8    -36.8268294 -0.258106E-07  0.128E-03    0.68      17.5  T
     SCC iter.                  ...        0 min,  0.010 sec
     gradient                   ...        0 min,  0.016 sec
 * total energy  :   -36.2849855 Eh     change       -0.1249014E-02 Eh
   gradient norm :     0.0104773 Eh/α   predicted    -0.1122818E-02 ( -10.10%)
   displ. norm   :     0.1852992 α      lambda       -0.4700385E-03
   maximum displ.:     0.1007327 α      in ANC's #2, #3, #4, ...

........................................................................
.............................. CYCLE    4 ..............................
........................................................................
   1    -36.8251900 -0.368252E+02  0.124E-01    0.67       0.0  T
   2    -36.8251945 -0.452894E-05  0.725E-02    0.68       1.0  T
   3    -36.8251703  0.242255E-04  0.489E-02    0.67       1.0  T
   4    -36.8251978 -0.275640E-04  0.130E-02    0.67       1.7  T
   5    -36.8252000 -0.219900E-05  0.619E-03    0.67       3.6  T
   6    -36.8252004 -0.382835E-06  0.281E-03    0.67       8.0  T
   7    -36.8252005 -0.106341E-06  0.963E-04    0.67      23.2  T
     SCC iter.                  ...        0 min,  0.009 sec
     gradient                   ...        0 min,  0.016 sec
 * total energy  :   -36.2852294 Eh     change       -0.2438677E-03 Eh
   gradient norm :     0.0072655 Eh/α   predicted    -0.2430893E-03 (  -0.32%)
   displ. norm   :     0.1385976 α      lambda       -0.2355085E-03
   maximum displ.:     0.0811599 α      in ANC's #2, #3, #4, ...

........................................................................
.............................. CYCLE    5 ..............................
........................................................................
   1    -36.8244169 -0.368244E+02  0.103E-01    0.67       0.0  T
   2    -36.8244186 -0.168617E-05  0.577E-02    0.67       1.0  T
   3    -36.8244171  0.144660E-05  0.132E-02    0.67       1.7  T
   4    -36.8244187 -0.157224E-05  0.676E-03    0.67       3.3  T
   5    -36.8244191 -0.359584E-06  0.276E-03    0.67       8.1  T
   6    -36.8244191 -0.782242E-07  0.889E-04    0.67      25.2  T
     SCC iter.                  ...        0 min,  0.008 sec
     gradient                   ...        0 min,  0.016 sec
 * total energy  :   -36.2853717 Eh     change       -0.1423427E-03 Eh
   gradient norm :     0.0049565 Eh/α   predicted    -0.1200236E-03 ( -15.68%)
   displ. norm   :     0.1087883 α      lambda       -0.1060341E-03
   maximum displ.:     0.0792390 α      in ANC's #2, #3, #1, ...

........................................................................
.............................. CYCLE    6 ..............................
........................................................................
   1    -36.8251058 -0.368251E+02  0.900E-02    0.67       0.0  T
   2    -36.8251068 -0.942425E-06  0.495E-02    0.67       1.0  T
   3    -36.8250967  0.100861E-04  0.248E-02    0.67       1.0  T
   4    -36.8251079 -0.111864E-04  0.678E-03    0.67       3.3  T
   5    -36.8251079  0.311583E-08  0.408E-03    0.67       5.5  T
   6    -36.8251082 -0.297017E-06  0.567E-04    0.67      39.5  T
   7    -36.8251082 -0.280229E-08  0.333E-04    0.67      67.2  T
     SCC iter.                  ...        0 min,  0.009 sec
     gradient                   ...        0 min,  0.016 sec
 * total energy  :   -36.2854559 Eh     change       -0.8416992E-04 Eh
   gradient norm :     0.0041340 Eh/α   predicted    -0.5364630E-04 ( -36.26%)
   displ. norm   :     0.1571861 α      lambda       -0.1211446E-03
   maximum displ.:     0.1141502 α      in ANC's #2, #1, #3, ...

........................................................................
.............................. CYCLE    7 ..............................
........................................................................
   1    -36.8261833 -0.368262E+02  0.132E-01    0.67       0.0  T
   2    -36.8261862 -0.292945E-05  0.707E-02    0.67       1.0  T
   3    -36.8261777  0.852250E-05  0.260E-02    0.68       1.0  T
   4    -36.8261868 -0.910076E-05  0.109E-02    0.67       2.0  T
   5    -36.8261874 -0.667294E-06  0.528E-03    0.67       4.2  T
   6    -36.8261879 -0.466052E-06  0.136E-03    0.67      16.4  T
   7    -36.8261879 -0.324783E-07  0.395E-04    0.67      56.6  T
     SCC iter.                  ...        0 min,  0.009 sec
     gradient                   ...        0 min,  0.016 sec
 * total energy  :   -36.2855466 Eh     change       -0.9069202E-04 Eh
   gradient norm :     0.0041930 Eh/α   predicted    -0.6207835E-04 ( -31.55%)
   displ. norm   :     0.1612438 α      lambda       -0.8333777E-04
   maximum displ.:     0.1223310 α      in ANC's #2, #1, #3, ...

........................................................................
.............................. CYCLE    8 ..............................
........................................................................
   1    -36.8262943 -0.368263E+02  0.136E-01    0.67       0.0  T
   2    -36.8262972 -0.297731E-05  0.721E-02    0.67       1.0  T
   3    -36.8262974 -0.147911E-06  0.133E-02    0.67       1.7  T
   4    -36.8262970  0.430604E-06  0.780E-03    0.67       2.9  T
   5    -36.8262979 -0.897887E-06  0.276E-03    0.67       8.1  T
   6    -36.8262979 -0.735288E-07  0.132E-03    0.67      17.0  T
     SCC iter.                  ...        0 min,  0.008 sec
     gradient                   ...        0 min,  0.016 sec
 * total energy  :   -36.2856101 Eh     change       -0.6351913E-04 Eh
   gradient norm :     0.0039422 Eh/α   predicted    -0.4275658E-04 ( -32.69%)
   displ. norm   :     0.1495001 α      lambda       -0.6498842E-04
   maximum displ.:     0.1174205 α      in ANC's #2, #1, #4, ...

........................................................................
.............................. CYCLE    9 ..............................
........................................................................
   1    -36.8266031 -0.368266E+02  0.129E-01    0.67       0.0  T
   2    -36.8266061 -0.296731E-05  0.673E-02    0.67       1.0  T
   3    -36.8266061 -0.563932E-07  0.144E-02    0.67       1.6  T
   4    -36.8266052  0.947776E-06  0.925E-03    0.67       2.4  T
   5    -36.8266066 -0.146216E-05  0.324E-03    0.67       6.9  T
   6    -36.8266067 -0.558468E-07  0.155E-03    0.67      14.4  T
   7    -36.8266067 -0.273711E-07  0.379E-04    0.67      59.0  T
   8    -36.8266067 -0.232779E-08  0.153E-04    0.67     146.3  T
     SCC iter.                  ...        0 min,  0.010 sec
     gradient                   ...        0 min,  0.017 sec
 * total energy  :   -36.2856570 Eh     change       -0.4686160E-04 Eh
   gradient norm :     0.0025155 Eh/α   predicted    -0.3322555E-04 ( -29.10%)
   displ. norm   :     0.1253123 α      lambda       -0.3910199E-04
   maximum displ.:     0.1034792 α      in ANC's #2, #1, #4, ...

........................................................................
.............................. CYCLE   10 ..............................
........................................................................
   1    -36.8264859 -0.368265E+02  0.111E-01    0.67       0.0  T
   2    -36.8264882 -0.236051E-05  0.570E-02    0.67       1.0  T
   3    -36.8264878  0.479388E-06  0.141E-02    0.67       1.6  T
   4    -36.8264873  0.413987E-06  0.910E-03    0.67       2.5  T
   5    -36.8264888 -0.145583E-05  0.254E-03    0.67       8.8  T
   6    -36.8264888  0.189862E-07  0.184E-03    0.67      12.1  T
   7    -36.8264888 -0.609893E-07  0.242E-04    0.67      92.3  T
   8    -36.8264888 -0.531216E-09  0.142E-04    0.67     158.0  T
     SCC iter.                  ...        0 min,  0.010 sec
     gradient                   ...        0 min,  0.017 sec
 * total energy  :   -36.2856837 Eh     change       -0.2670686E-04 Eh
   gradient norm :     0.0018069 Eh/α   predicted    -0.1985943E-04 ( -25.64%)
   displ. norm   :     0.1438499 α      lambda       -0.2098056E-04
   maximum displ.:     0.1196210 α      in ANC's #2, #1, #3, ...

........................................................................
.............................. CYCLE   11 ..............................
........................................................................
   1    -36.8266896 -0.368267E+02  0.126E-01    0.67       0.0  T
   2    -36.8266929 -0.331414E-05  0.638E-02    0.67       1.0  T
   3    -36.8266917  0.126197E-05  0.187E-02    0.67       1.2  T
   4    -36.8266901  0.156997E-05  0.142E-02    0.67       1.6  T
   5    -36.8266937 -0.358434E-05  0.369E-03    0.67       6.1  T
   6    -36.8266937 -0.191265E-07  0.221E-03    0.67      10.1  T
   7    -36.8266938 -0.802838E-07  0.376E-04    0.67      59.5  T
   8    -36.8266938 -0.111331E-08  0.236E-04    0.67      94.7  T
     SCC iter.                  ...        0 min,  0.010 sec
     gradient                   ...        0 min,  0.017 sec
 * total energy  :   -36.2856964 Eh     change       -0.1275012E-04 Eh
   gradient norm :     0.0018274 Eh/α   predicted    -0.1059061E-04 ( -16.94%)
   displ. norm   :     0.0207062 α      lambda       -0.5954151E-05
   maximum displ.:     0.0117514 α      in ANC's #3, #2, #7, ...

........................................................................
.............................. CYCLE   12 ..............................
........................................................................
   1    -36.8267376 -0.368267E+02  0.149E-02    0.67       0.0  T
   2    -36.8267377 -0.124040E-06  0.759E-03    0.67       2.9  T
   3    -36.8267376  0.901347E-07  0.373E-03    0.67       6.0  T
   4    -36.8267377 -0.104410E-06  0.149E-03    0.67      15.0  T
   5    -36.8267378 -0.223485E-07  0.684E-04    0.67      32.7  T
   6    -36.8267378 -0.228786E-08  0.278E-04    0.67      80.4  T
     SCC iter.                  ...        0 min,  0.008 sec
     gradient                   ...        0 min,  0.016 sec
 * total energy  :   -36.2856994 Eh     change       -0.2934450E-05 Eh
   gradient norm :     0.0013710 Eh/α   predicted    -0.2982231E-05 (   1.63%)
   displ. norm   :     0.0227191 α      lambda       -0.2776091E-05
   maximum displ.:     0.0154355 α      in ANC's #2, #4, #1, ...

........................................................................
.............................. CYCLE   13 ..............................
........................................................................
   1    -36.8268409 -0.368268E+02  0.188E-02    0.67       0.0  T
   2    -36.8268409 -0.876042E-07  0.995E-03    0.67       2.2  T
   3    -36.8268407  0.278228E-06  0.472E-03    0.67       4.7  T
   4    -36.8268410 -0.315623E-06  0.165E-03    0.67      13.5  T
   5    -36.8268410 -0.147578E-07  0.809E-04    0.67      27.6  T
   6    -36.8268410 -0.367634E-08  0.369E-04    0.67      60.6  T
     SCC iter.                  ...        0 min,  0.008 sec
     gradient                   ...        0 min,  0.017 sec
 * total energy  :   -36.2857008 Eh     change       -0.1388653E-05 Eh
   gradient norm :     0.0007086 Eh/α   predicted    -0.1391233E-05 (   0.19%)
   displ. norm   :     0.0057826 α      lambda       -0.1077134E-05
   maximum displ.:     0.0032837 α      in ANC's #7, #1, #11, ...

   *** GEOMETRY OPTIMIZATION CONVERGED AFTER 13 ITERATIONS ***

------------------------------------------------------------------------
 total energy gain   :        -0.0063735 Eh       -3.9994 kcal/mol
 total RMSD          :         0.3048989 a0        0.1613 Å
 total power (kW/mol):        -1.2872030 (step)  -33.9039 (real)
------------------------------------------------------------------------

 ANCopt (total)                0 d,  0 h,  0 min,  0.494 sec
 optimizer setup                ...        0 min,  0.000 sec (  0.030%)
 model hessian                  ...        0 min,  0.002 sec (  0.343%)
 ANC generation                 ...        0 min,  0.001 sec (  0.118%)
 coordinate transformation      ...        0 min,  0.000 sec (  0.040%)
 single point calculation       ...        0 min,  0.487 sec ( 98.686%)
 optimization log               ...        0 min,  0.001 sec (  0.225%)
 hessian update                 ...        0 min,  0.000 sec (  0.031%)
 rational function              ...        0 min,  0.002 sec (  0.357%)

================
 final structure:
================
$coord
   -2.65626622704792    0.35057334119946   -0.32757890819567      C 
   -1.28923206038580   -0.73197112954914    2.44867692366195      S 
   -1.21100723565452   -0.06787299062568   -2.41366360084328      C 
    1.06571676179524   -1.29149068733963   -1.78775159712428      C 
    3.31112833701836   -2.22328332270517   -3.06435096661321      C 
    3.94644677932738   -2.10360808314576   -6.08484055976364      S 
    1.27950030735109   -1.77239894683705    0.79920228820403      C 
    3.63710119249200   -3.00997693612969    1.24557136197171      C 
    5.33695779980043   -4.21265618497731    3.70506239709481      S 
    4.87770896755287   -3.29131672289764   -1.06924591381516      C 
    7.22248688151793   -4.49207687210476   -0.83404123268852      C 
    7.76733973848627   -5.12133517022521    1.63089304806283      C 
   10.00133460628847   -6.36368829920244    2.53558731612159      C 
   10.46705701138040   -6.94149085362832    4.93891925300021      C 
   -4.47266822490970    1.23991733242970   -0.22311896173558      H 
   -1.74676212119663    0.47069611699387   -4.29664473902066      H 
    8.47025761568295   -4.88694447956493   -2.38769536704581      H 
   11.36061337737263   -6.82546832854311    1.07981393971137      H 
    9.14084227334301   -6.49641301158988    6.41868753127320      H 
   12.18248132141772   -7.87623334611750    5.49713308137934      H 
$end
           -------------------------------------------------
          |                Final Singlepoint                |
           -------------------------------------------------

          ...................................................
          :                      SETUP                      :
          :.................................................:
          :  # basis functions                  80          :
          :  # atomic orbitals                  77          :
          :  # shells                           37          :
          :  # electrons                        68          :
          :  max. iterations                   250          :
          :  Hamiltonian                  GFN2-xTB          :
          :  restarted?                      false          :
          :  GBSA solvation                  false          :
          :  PC potential                    false          :
          :  electronic temp.          300.0000000     K    :
          :  accuracy                    1.0000000          :
          :  -> integral cutoff          0.2500000E+02      :
          :  -> integral neglect         0.1000000E-07      :
          :  -> SCF convergence          0.1000000E-05 Eh   :
          :  -> wf. convergence          0.1000000E-03 e    :
          :  Broyden damping             0.4000000          :
          ...................................................

 iter      E             dE          RMSdq      gap      omega  full diag
   1    -36.8268410 -0.368268E+02  0.293E-04    0.67       0.0  T
   2    -36.8268410  0.388667E-10  0.103E-04    0.67     217.3  T
   3    -36.8268410  0.957101E-11  0.151E-04    0.67     147.8  T

   *** convergence criteria satisfied after 3 iterations ***

         #    Occupation            Energy/Eh            Energy/eV
      -------------------------------------------------------------
         1        2.0000           -0.7508605             -20.4320
       ...           ...                  ...                  ...
        28        2.0000           -0.4508329             -12.2678
        29        2.0000           -0.4471712             -12.1681
        30        2.0000           -0.4202347             -11.4352
        31        2.0000           -0.4166968             -11.3389
        32        2.0000           -0.4054408             -11.0326
        33        2.0000           -0.3731876             -10.1550
        34        2.0000           -0.3607620              -9.8168 (HOMO)
        35        0.0000           -0.3360552              -9.1445 (LUMO)
        36                         -0.2755220              -7.4973
        37                         -0.2433475              -6.6218
        38                         -0.2221109              -6.0439
        39                         -0.2156328              -5.8677
       ...                                ...                  ...
        77                          0.7132317              19.4080
      -------------------------------------------------------------
                  HL-Gap            0.0247068 Eh            0.6723 eV
             Fermi-level           -0.3484086 Eh           -9.4807 eV

 SCC (total)                   0 d,  0 h,  0 min,  0.034 sec
 SCC setup                      ...        0 min,  0.000 sec (  0.602%)
 Dispersion                     ...        0 min,  0.000 sec (  0.514%)
 integral evaluation            ...        0 min,  0.012 sec ( 35.061%)
 zeroth order Hamiltonian       ...        0 min,  0.000 sec (  0.546%)
 iterations                     ...        0 min,  0.004 sec ( 13.067%)
 molecular gradient             ...        0 min,  0.017 sec ( 49.068%)
 printout                       ...        0 min,  0.000 sec (  0.993%)

         :::::::::::::::::::::::::::::::::::::::::::::::::::::
         ::                     SUMMARY                     ::
         :::::::::::::::::::::::::::::::::::::::::::::::::::::
         :: total energy             -36.285700863442 Eh    ::
         :: gradient norm              0.000707888622 Eh/a0 ::
         :: HOMO-LUMO gap              0.672306199744 eV    ::
         ::.................................................::
         :: SCC energy               -36.826840996355 Eh    ::
         :: -> isotropic ES            0.005560327478 Eh    ::
         :: -> anisotropic ES          0.001038554264 Eh    ::
         :: -> anisotropic XC          0.017712784910 Eh    ::
         :: -> dispersion             -0.026962084223 Eh    ::
         :: repulsion energy           0.541225031353 Eh    ::
         :: add. restraining           0.000000000000 Eh    ::
         :::::::::::::::::::::::::::::::::::::::::::::::::::::

           -------------------------------------------------
          |                Property Printout                |
           -------------------------------------------------

    * Orbital Energies and Occupations

         #    Occupation            Energy/Eh            Energy/eV
      -------------------------------------------------------------
         1        2.0000           -0.7508605             -20.4320
       ...           ...                  ...                  ...
        22        2.0000           -0.4772940             -12.9878
        23        2.0000           -0.4727959             -12.8654
        24        2.0000           -0.4709805             -12.8160
        25        2.0000           -0.4663140             -12.6890
        26        2.0000           -0.4623083             -12.5801
        27        2.0000           -0.4600621             -12.5189
        28        2.0000           -0.4508329             -12.2678
        29        2.0000           -0.4471712             -12.1681
        30        2.0000           -0.4202347             -11.4352
        31        2.0000           -0.4166968             -11.3389
        32        2.0000           -0.4054408             -11.0326
        33        2.0000           -0.3731876             -10.1550
        34        2.0000           -0.3607620              -9.8168 (HOMO)
        35        0.0000           -0.3360552              -9.1445 (LUMO)
        36                         -0.2755220              -7.4973
        37                         -0.2433475              -6.6218
        38                         -0.2221109              -6.0439
        39                         -0.2156328              -5.8677
        40                         -0.1893249              -5.1518
        41                         -0.1644230              -4.4742
        42                         -0.1523037              -4.1444
        43                         -0.1470134              -4.0004
        44                         -0.1432921              -3.8992
        45                         -0.1294205              -3.5217
       ...                                ...                  ...
        77                          0.7132317              19.4080
      -------------------------------------------------------------
                  HL-Gap            0.0247068 Eh            0.6723 eV
             Fermi-level           -0.3484086 Eh           -9.4807 eV

     #   Z        covCN         q      C6AA      α(0)
     1   6 C      2.953    -0.027    28.685     8.784
     2  16 S      2.249     0.024   140.088    19.921
     3   6 C      3.065    -0.030    28.691     8.783
     4   6 C      3.298    -0.027    26.901     8.309
     5   6 C      3.019     0.089    25.993     8.363
     6  16 S      1.039    -0.216   148.310    20.597
     7   6 C      3.090     0.012    27.642     8.618
     8   6 C      3.087     0.010    27.689     8.626
     9  16 S      2.264     0.014   140.481    19.949
    10   6 C      3.284    -0.027    27.111     8.370
    11   6 C      3.062    -0.038    28.891     8.814
    12   6 C      2.999     0.020    27.538     8.608
    13   6 C      2.915    -0.031    28.761     8.794
    14   6 C      2.840    -0.086    30.138     8.997
    15   1 H      0.926     0.053     2.286     2.364
    16   1 H      0.926     0.059     2.209     2.324
    17   1 H      0.926     0.058     2.228     2.334
    18   1 H      0.925     0.048     2.348     2.396
    19   1 H      0.926     0.049     2.334     2.389
    20   1 H      0.926     0.047     2.364     2.404

 Mol. C6AA /au·bohr⁶  :      10627.218477
 Mol. C8AA /au·bohr⁸  :     354310.756138
 Mol. α(0) /au        :        169.745233


Wiberg/Mayer (AO) data.
largest (>0.10) Wiberg bond orders for each atom
          total WBO             WBO to atom ...
     1  C   3.908        C    3 1.613    S    2 1.168    H   15 0.970
     2  S   2.610        C    7 1.201    C    1 1.168
     3  C   3.989        C    1 1.613    C    4 1.267    H   16 0.961
     4  C   3.964        C    7 1.368    C    3 1.267    C    5 1.111
     5  C   3.965        S    6 1.654    C    4 1.111    C   10 1.099
     6  S   1.895        C    5 1.654
     7  C   3.950        C    4 1.368    S    2 1.201    C    8 1.145
     8  C   3.953        C   10 1.355    S    9 1.201    C    7 1.145
     9  S   2.594        C    8 1.201    C   12 1.110
    10  C   3.977        C    8 1.355    C   11 1.302    C    5 1.099
    11  C   3.989        C   12 1.497    C   10 1.302    H   17 0.961
    12  C   3.920        C   11 1.497    C   13 1.146    S    9 1.110
    13  C   3.988        C   14 1.853    C   12 1.146    H   18 0.957
    14  C   3.964        C   13 1.853    H   20 0.978    H   19 0.972
    15  H   0.996        C    1 0.970
    16  H   0.996        C    3 0.961
    17  H   0.996        C   11 0.961
    18  H   0.997        C   13 0.957
    19  H   0.998        C   14 0.972
    20  H   0.997        C   14 0.978

molecular dipole:
                 x           y           z       tot (Debye)
 q only:       -0.125      -0.099       1.116
   full:       -0.126      -0.069       0.916       2.358
molecular quadrupole (traceless):
                xx          xy          yy          xz          yz          zz
 q only:        7.551      -6.001       1.503       8.715      -5.078      -9.054
  q+dip:       11.367      -8.864       0.861       8.713      -4.596     -12.227
   full:       10.427      -6.579       3.367       8.985      -3.964     -13.794

           -------------------------------------------------
          |                Geometry Summary                 |
           -------------------------------------------------

      molecular mass/u    :      234.3484000
   center of mass at/Å    :        1.8993890      -1.4939502       0.0636910
  moments of inertia/u·Å² :        0.6222997E+03   0.1363458E+04   0.1985758E+04
rotational constants/cm⁻¹ :        0.2708925E-01   0.1236388E-01   0.8489268E-02

 * 21 selected distances

     #   Z        #   Z                                     value/Å
     1   6 C      2  16 S                                 1.7348850
     1   6 C      3   6 C                                 1.3610888
     3   6 C      4   6 C                                 1.4073010
     4   6 C      5   6 C                                 1.4530534
     5   6 C      6  16 S                                 1.6345761
     2  16 S      7   6 C                                 1.7066801
     4   6 C      7   6 C                                 1.3969986
     7   6 C      8   6 C                                 1.4286930
     8   6 C      9  16 S                                 1.7053180
     8   6 C     10   6 C                                 1.3977332
    10   6 C     11   6 C                                 1.3995843
     9  16 S     12   6 C                                 1.7578431 (max)
    11   6 C     12   6 C                                 1.3767492
    12   6 C     13   6 C                                 1.4349045
    13   6 C     14   6 C                                 1.3310420
     1   6 C     15   1 H                                 1.0716540 (min)
     3   6 C     16   1 H                                 1.0744655
    11   6 C     17   1 H                                 1.0749847
    13   6 C     18   1 H                                 1.0819256
    14   6 C     19   1 H                                 1.0775814
    14   6 C     20   1 H                                 1.0751583

 * 3 distinct bonds (by element types)

   Z      Z             #   av. dist./Å        max./Å        min./Å
   1 H    6 C           6     1.0759616     1.0819256     1.0716540
   6 C    6 C          10     1.3987148     1.4530534     1.3310420
   6 C   16 S           5     1.7078605     1.7578431     1.6345761


optimized geometry written to: xtbopt.xyz


           -------------------------------------------------
          | TOTAL ENERGY              -36.285700863442 Eh   |
          | GRADIENT NORM               0.000707888622 Eh/α |
          | HOMO-LUMO GAP               0.672306199744 eV   |
           -------------------------------------------------

------------------------------------------------------------------------
 * finished run on 2021/05/19 at 10:59:49.405     
------------------------------------------------------------------------
 total:
 * wall-time:     0 d,  0 h,  0 min,  0.602 sec
 *  cpu-time:     0 d,  0 h,  0 min,  0.599 sec
 * ratio c/w:     0.996 speedup
 SCF:
 * wall-time:     0 d,  0 h,  0 min,  0.049 sec
 *  cpu-time:     0 d,  0 h,  0 min,  0.049 sec
 * ratio c/w:     0.998 speedup
 ANC optimizer:
 * wall-time:     0 d,  0 h,  0 min,  0.528 sec
 *  cpu-time:     0 d,  0 h,  0 min,  0.527 sec
 * ratio c/w:     0.998 speedup

