      -----------------------------------------------------------      
     |                   =====================                   |     
     |                           x T B                           |     
     |                   =====================                   |     
     |                         S. Grimme                         |     
     |          Mulliken Center for Theoretical Chemistry        |     
     |                    University of Bonn                     |     
     |                Version 6.2 RC2 (SAW190805)                |     
      -----------------------------------------------------------      

   This program is distributed in the hope that it will be useful,
   but WITHOUT ANY WARRANTY; without even the implied warranty of
   MERCHANTABILITY or FITNESS FOR A PARTICULAR PURPOSE.
   
   FOR NON-COMMERCIAL, ACADEMIA USE ONLY.
   
   Cite this work as:
   * S. Grimme, C. Bannwarth, P. Shushkov, J. Chem. Theory Comput., 2017,
     13, 1989-2009. DOI: 10.1021/acs.jctc.7b00118
   * C. Bannwarth, S. Ehlert and S. Grimme., J. Chem. Theory Comput., 2019,
     15, 1652-1671. DOI: 10.1021/acs.jctc.8b01176
   * P. Pracht, E. Caldeweyher, S. Ehlert, S. Grimme, ChemRxiv, 2019, preprint.
     DOI: 10.26434/chemrxiv.8326202.v1
   
   for DFT-D4:
   * E. Caldeweyher, C. Bannwarth and S. Grimme, J. Chem. Phys., 2017,
     147, 034112. DOI: 10.1063/1.4993215
   * E. Caldeweyher, S. Ehlert, A. Hansen, H. Neugebauer, S. Spicher,
     C. Bannwarth and S. Grimme, J. Chem. Phys., 2019, 150, 154122.
     DOI: 10.1063/1.5090222
   
   for sTDA-xTB:
   * S. Grimme and C. Bannwarth, J. Chem. Phys., 2016, 145, 054103.
     DOI: 10.1063/1.4959605
   
   in the mass-spec context:
   * V. Asgeirsson, C. Bauer and S. Grimme, Chem. Sci., 2017, 8, 4879.
     DOI: 10.1039/c7sc00601b
   
   for metadynamics refer to:
   * S. Grimme, J. Chem. Theory Comput., 2019, 155, 2847-2862
     DOI: 10.1021/acs.jctc.9b00143
   
   with help from (in alphabetical order)
   C. Bannwarth, F. Bohle, G. Brandenburg, E. Caldeweyher, M. Checinski,
   S. Dohm, S. Ehlert, S. Ehrlich, F. März, H. Neugebauer, J. Pisarek,
   P. Pracht, P. Shushkov, and S. Spicher.
   
 * started run on 2021/05/19 at 10:59:54.199     

           -------------------------------------------------
          |                Calculation Setup                |
           -------------------------------------------------

          program call               : /ihome/ghutchison/geoffh/xtb/xtb 658.xyz -opt
          hostname                   : smp-n144
          coordinate file            : 658.xyz
          omp threads                :                     1
          number of atoms            :                    31
          number of electrons        :                    94
          charge                     :                     0
          spin                       :                   0.0
          first test random number   :      0.85966460037580


########################################################################
# WARNING! Please study the warnings concerning your input carefully
#  - the use of '-opt' is discouraged, please use '--opt' next time
########################################################################

           ------------------------------------------------- 
          |                 G F N 2 - x T B                 |
          | Geometry, Frequencies, Noncovalent interactions |
          |            JCTC 2019 parametrisation            |
           ------------------------------------------------- 
             KAB for C  - Si     :                1.0500
             KAB for H  - Pd     :                0.9500
             k(s)              :                1.8500
             k(p)              :                2.2300
             k(d)              :                2.2300
             k(f)              :                2.0000
             kEN (H0ij)        :               -2.0000
             D4 a1             :                0.5200
             D4 a2             :                5.0000
             D4 s6             :                1.0000
             D4 s8             :                2.7000
             D4 s9             :                5.0000
             alphaj            :                2.0000

  Z AO/shell   Hii/eV     exponent
  1     Wed Apr 25 08:07:45 CEST 2018   EN: 2.200 GM2: 0.406  GM3: 0.0800  RAES: 1.40
     1s    -10.707211    1.230000
  6     Wed Apr 25 08:07:45 CEST 2018   EN: 2.550 GM2: 0.538  GM3: 0.1500  RAES: 3.00
     2s    -13.970922    2.096432
     2p    -10.063292    1.800000
  8     Wed Apr 25 08:07:45 CEST 2018   EN: 3.440 GM2: 0.452  GM3:-0.0517  RAES: 1.80
     2s    -20.229985    2.439742
     2p    -15.503117    2.137023
 16     Tue Apr 24 11:44:34 CEST 2018   EN: 2.580 GM2: 0.340  GM3:-0.0502  RAES: 3.10
     3s    -20.029654    1.981333
     3p    -11.377694    2.025643
     3d     -0.420282    1.702555

           ------------------------------------------------- 
          |        Self-Consistent Charge Iterations        |
           ------------------------------------------------- 

          ...................................................
          :                      SETUP                      :
          :.................................................:
          :  # basis functions                  94          :
          :  # atomic orbitals                  93          :
          :  # shells                           51          :
          :  # electrons                        94          :
          :  max. iterations                   250          :
          :  Hamiltonian                  GFN2-xTB          :
          :  restarted?                      false          :
          :  GBSA solvation                  false          :
          :  PC potential                    false          :
          :  electronic temp.          300.0000000     K    :
          :  accuracy                    1.0000000          :
          :  -> integral cutoff          0.2500000E+02      :
          :  -> integral neglect         0.1000000E-07      :
          :  -> SCF convergence          0.1000000E-05 Eh   :
          :  -> wf. convergence          0.1000000E-03 e    :
          :  Broyden damping             0.4000000          :
          ...................................................

 iter      E             dE          RMSdq      gap      omega  full diag
   1    -52.4022215 -0.524022E+02  0.519E+00    2.15       0.0  T
   2    -52.4618053 -0.595838E-01  0.287E+00    1.92       1.0  T
   3    -52.4434919  0.183135E-01  0.169E+00    2.11       1.0  T
   4    -52.4723926 -0.289007E-01  0.508E-01    2.05       1.0  T
   5    -52.4789350 -0.654240E-02  0.190E-01    2.06       1.0  T
   6    -52.4795334 -0.598468E-03  0.782E-02    2.06       1.0  T
   7    -52.4796133 -0.799014E-04  0.371E-02    2.06       1.0  T
   8    -52.4796346 -0.212300E-04  0.127E-02    2.06       1.4  T
   9    -52.4796348 -0.193353E-06  0.691E-03    2.06       2.6  T
  10    -52.4796354 -0.659635E-06  0.184E-03    2.06       9.8  T
  11    -52.4796354 -0.273958E-07  0.115E-03    2.06      15.6  T
  12    -52.4796355 -0.112871E-07  0.483E-04    2.06      37.2  T
  13    -52.4796355 -0.202406E-08  0.200E-04    2.06      89.7  T

   *** convergence criteria satisfied after 13 iterations ***

         #    Occupation            Energy/Eh            Energy/eV
      -------------------------------------------------------------
         1        2.0000           -0.7549369             -20.5429
       ...           ...                  ...                  ...
        41        2.0000           -0.4342640             -11.8169
        42        2.0000           -0.4238558             -11.5337
        43        2.0000           -0.4194780             -11.4146
        44        2.0000           -0.4135972             -11.2546
        45        2.0000           -0.4021561             -10.9432
        46        2.0000           -0.3999339             -10.8828
        47        2.0000           -0.3936275             -10.7111 (HOMO)
        48                         -0.3179730              -8.6525 (LUMO)
        49                         -0.2990059              -8.1364
        50                         -0.2573606              -7.0031
        51                         -0.2334714              -6.3531
        52                         -0.2176624              -5.9229
       ...                                ...                  ...
        93                          0.7253320              19.7373
      -------------------------------------------------------------
                  HL-Gap            0.0756545 Eh            2.0587 eV
             Fermi-level           -0.3558002 Eh           -9.6818 eV

 SCC (total)                   0 d,  0 h,  0 min,  0.065 sec
 SCC setup                      ...        0 min,  0.000 sec (  0.611%)
 Dispersion                     ...        0 min,  0.001 sec (  0.903%)
 integral evaluation            ...        0 min,  0.016 sec ( 25.124%)
 zeroth order Hamiltonian       ...        0 min,  0.000 sec (  0.421%)
 iterations                     ...        0 min,  0.024 sec ( 37.540%)
 molecular gradient             ...        0 min,  0.022 sec ( 34.631%)
 printout                       ...        0 min,  0.000 sec (  0.682%)

         :::::::::::::::::::::::::::::::::::::::::::::::::::::
         ::                     SUMMARY                     ::
         :::::::::::::::::::::::::::::::::::::::::::::::::::::
         :: total energy             -51.723902646285 Eh    ::
         :: gradient norm              0.049903799016 Eh/a0 ::
         :: HOMO-LUMO gap              2.058663296987 eV    ::
         ::.................................................::
         :: SCC energy               -52.479635463093 Eh    ::
         :: -> isotropic ES            0.056374581081 Eh    ::
         :: -> anisotropic ES          0.000747429877 Eh    ::
         :: -> anisotropic XC          0.021521147675 Eh    ::
         :: -> dispersion             -0.035802225056 Eh    ::
         :: repulsion energy           0.755873674698 Eh    ::
         :: add. restraining           0.000000000000 Eh    ::
         :::::::::::::::::::::::::::::::::::::::::::::::::::::

      ----------------------------------------------------------- 
     |                   =====================                   |
     |                        A N C O P T                        |
     |                   =====================                   |
     |               Approximate Normal Coordinate               |
     |                Rational Function Optimizer                |
      ----------------------------------------------------------- 

          ...................................................
          :                      SETUP                      :
          :.................................................:
          :   optimization level            normal          :
          :   max. optcycles                   200          :
          :   ANC micro-cycles                  20          :
          :   degrees of freedom                87          :
          :.................................................:
          :   RF solver                   davidson          :
          :   input Hessian                  false          :
          :   write xtbopt.log                true          :
          :   linear?                        false          :
          :   energy convergence         0.5000000E-05 Eh   :
          :   grad. convergence          0.1000000E-02 Eh/α :
          :   maximium RF displ.         2.0000000          :
          :   Hlow (freq-cutoff)         0.5000000E-02      :
          :   Hmax (freq-cutoff)         5.0000000          :
          :   S6 in model hess.         20.0000000          :
          ...................................................

generating ANC from model Hessian ...
Using Lindh-Hessian (1995)
 Shifting diagonal of input Hessian by   4.223841584462698E-003
 Lowest  eigenvalues of input Hessian
   -0.000000   -0.000000    0.000000    0.000000    0.000000    0.000000
    0.005000    0.005336    0.006267    0.007576    0.007808    0.009173
    0.010758    0.010918    0.014402    0.015805    0.018171    0.019921
 Highest eigenvalues
    1.860931    1.876369    1.958777    2.002795    2.147352    2.237846
 

........................................................................
.............................. CYCLE    1 ..............................
........................................................................
   1    -52.4796355 -0.524796E+02  0.820E-05    2.06       0.0  T
   2    -52.4796355 -0.329905E-10  0.522E-05    2.06     344.4  T
   3    -52.4796355 -0.226947E-10  0.326E-05    2.06     550.6  T
     SCC iter.                  ...        0 min,  0.006 sec
     gradient                   ...        0 min,  0.022 sec
 * total energy  :   -51.7239027 Eh     change       -0.1080336E-07 Eh
   gradient norm :     0.0499044 Eh/α   predicted     0.0000000E+00 (-100.00%)
   displ. norm   :     0.2698371 α      lambda       -0.4956183E-02
   maximum displ.:     0.1366067 α      in ANC's #15, #5, #3, ...

........................................................................
.............................. CYCLE    2 ..............................
........................................................................
   1    -52.5105211 -0.525105E+02  0.149E-01    2.07       0.0  T
   2    -52.5105704 -0.492795E-04  0.743E-02    2.07       1.0  T
   3    -52.5105527  0.177220E-04  0.393E-02    2.07       1.0  T
   4    -52.5105830 -0.303261E-04  0.159E-02    2.07       1.1  T
   5    -52.5105853 -0.228954E-05  0.619E-03    2.07       2.9  T
   6    -52.5105857 -0.359843E-06  0.242E-03    2.07       7.4  T
   7    -52.5105858 -0.137868E-06  0.945E-04    2.07      19.0  T
     SCC iter.                  ...        0 min,  0.012 sec
     gradient                   ...        0 min,  0.021 sec
 * total energy  :   -51.7272718 Eh     change       -0.3369094E-02 Eh
   gradient norm :     0.0212019 Eh/α   predicted    -0.2658543E-02 ( -21.09%)
   displ. norm   :     0.2318466 α      lambda       -0.1367050E-02
   maximum displ.:     0.1117779 α      in ANC's #5, #15, #6, ...

........................................................................
.............................. CYCLE    3 ..............................
........................................................................
   1    -52.5228066 -0.525228E+02  0.102E-01    2.07       0.0  T
   2    -52.5228341 -0.275214E-04  0.534E-02    2.07       1.0  T
   3    -52.5228267  0.741712E-05  0.293E-02    2.07       1.0  T
   4    -52.5228403 -0.135500E-04  0.125E-02    2.07       1.4  T
   5    -52.5228416 -0.135188E-05  0.484E-03    2.07       3.7  T
   6    -52.5228419 -0.293469E-06  0.186E-03    2.07       9.6  T
     SCC iter.                  ...        0 min,  0.011 sec
     gradient                   ...        0 min,  0.021 sec
 * total energy  :   -51.7281026 Eh     change       -0.8308967E-03 Eh
   gradient norm :     0.0055069 Eh/α   predicted    -0.7202693E-03 ( -13.31%)
   displ. norm   :     0.1504323 α      lambda       -0.2513821E-03
   maximum displ.:     0.0881531 α      in ANC's #5, #3, #6, ...

........................................................................
.............................. CYCLE    4 ..............................
........................................................................
   1    -52.5227386 -0.525227E+02  0.553E-02    2.07       0.0  T
   2    -52.5227418 -0.319357E-05  0.312E-02    2.07       1.0  T
   3    -52.5227363  0.556479E-05  0.185E-02    2.07       1.0  T
   4    -52.5227433 -0.704447E-05  0.525E-03    2.07       3.4  T
   5    -52.5227435 -0.221746E-06  0.242E-03    2.07       7.4  T
   6    -52.5227436 -0.108925E-06  0.790E-04    2.07      22.7  T
     SCC iter.                  ...        0 min,  0.011 sec
     gradient                   ...        0 min,  0.021 sec
 * total energy  :   -51.7282744 Eh     change       -0.1717222E-03 Eh
   gradient norm :     0.0035031 Eh/α   predicted    -0.1285396E-03 ( -25.15%)
   displ. norm   :     0.1349017 α      lambda       -0.1172347E-03
   maximum displ.:     0.0742107 α      in ANC's #5, #3, #6, ...

........................................................................
.............................. CYCLE    5 ..............................
........................................................................
   1    -52.5209908 -0.525210E+02  0.458E-02    2.07       0.0  T
   2    -52.5209914 -0.616836E-06  0.271E-02    2.07       1.0  T
   3    -52.5209860  0.542360E-05  0.154E-02    2.07       1.2  T
   4    -52.5209922 -0.617225E-05  0.220E-03    2.07       8.2  T
   5    -52.5209922 -0.537708E-07  0.116E-03    2.07      15.5  T
   6    -52.5209923 -0.230077E-07  0.469E-04    2.07      38.3  T
   7    -52.5209923 -0.526562E-09  0.256E-04    2.07      70.2  T
     SCC iter.                  ...        0 min,  0.013 sec
     gradient                   ...        0 min,  0.023 sec
 * total energy  :   -51.7283523 Eh     change       -0.7788103E-04 Eh
   gradient norm :     0.0029840 Eh/α   predicted    -0.5970416E-04 ( -23.34%)
   displ. norm   :     0.1041334 α      lambda       -0.5494953E-04
   maximum displ.:     0.0522712 α      in ANC's #5, #3, #6, ...

........................................................................
.............................. CYCLE    6 ..............................
........................................................................
   1    -52.5201421 -0.525201E+02  0.414E-02    2.07       0.0  T
   2    -52.5201427 -0.672571E-06  0.239E-02    2.07       1.0  T
   3    -52.5201409  0.185344E-05  0.948E-03    2.07       1.9  T
   4    -52.5201431 -0.216848E-05  0.287E-03    2.07       6.3  T
   5    -52.5201431 -0.577587E-07  0.138E-03    2.07      13.0  T
   6    -52.5201431 -0.291571E-07  0.487E-04    2.07      36.9  T
   7    -52.5201432 -0.304934E-08  0.247E-04    2.07      72.7  T
     SCC iter.                  ...        0 min,  0.012 sec
     gradient                   ...        0 min,  0.023 sec
 * total energy  :   -51.7283887 Eh     change       -0.3644446E-04 Eh
   gradient norm :     0.0021034 Eh/α   predicted    -0.2777292E-04 ( -23.79%)
   displ. norm   :     0.0881770 α      lambda       -0.3197852E-04
   maximum displ.:     0.0386096 α      in ANC's #6, #2, #3, ...

........................................................................
.............................. CYCLE    7 ..............................
........................................................................
   1    -52.5204178 -0.525204E+02  0.350E-02    2.06       0.0  T
   2    -52.5204183 -0.447546E-06  0.203E-02    2.06       1.0  T
   3    -52.5204176  0.660934E-06  0.586E-03    2.06       3.1  T
   4    -52.5204184 -0.797216E-06  0.216E-03    2.06       8.3  T
   5    -52.5204185 -0.429919E-07  0.107E-03    2.06      16.7  T
   6    -52.5204185 -0.193824E-07  0.444E-04    2.06      40.5  T
   7    -52.5204185 -0.242132E-08  0.201E-04    2.06      89.3  T
     SCC iter.                  ...        0 min,  0.013 sec
     gradient                   ...        0 min,  0.023 sec
 * total energy  :   -51.7284098 Eh     change       -0.2105576E-04 Eh
   gradient norm :     0.0015925 Eh/α   predicted    -0.1612211E-04 ( -23.43%)
   displ. norm   :     0.0904935 α      lambda       -0.1675917E-04
   maximum displ.:     0.0495484 α      in ANC's #2, #1, #6, ...

........................................................................
.............................. CYCLE    8 ..............................
........................................................................
   1    -52.5215467 -0.525215E+02  0.392E-02    2.06       0.0  T
   2    -52.5215473 -0.547227E-06  0.230E-02    2.06       1.0  T
   3    -52.5215467  0.607642E-06  0.614E-03    2.06       2.9  T
   4    -52.5215475 -0.814030E-06  0.242E-03    2.06       7.4  T
   5    -52.5215475 -0.561124E-07  0.937E-04    2.06      19.2  T
   6    -52.5215475 -0.853182E-08  0.487E-04    2.06      36.9  T
     SCC iter.                  ...        0 min,  0.011 sec
     gradient                   ...        0 min,  0.023 sec
 * total energy  :   -51.7284209 Eh     change       -0.1112021E-04 Eh
   gradient norm :     0.0015017 Eh/α   predicted    -0.8424662E-05 ( -24.24%)
   displ. norm   :     0.0366443 α      lambda       -0.8593838E-05
   maximum displ.:     0.0206379 α      in ANC's #2, #7, #1, ...

........................................................................
.............................. CYCLE    9 ..............................
........................................................................
   1    -52.5219454 -0.525219E+02  0.186E-02    2.06       0.0  T
   2    -52.5219455 -0.127922E-06  0.106E-02    2.07       1.7  T
   3    -52.5219453  0.227627E-06  0.354E-03    2.07       5.1  T
   4    -52.5219455 -0.272299E-06  0.134E-03    2.07      13.4  T
   5    -52.5219455 -0.139528E-07  0.579E-04    2.07      31.0  T
   6    -52.5219455 -0.502760E-08  0.207E-04    2.07      86.6  T
     SCC iter.                  ...        0 min,  0.011 sec
     gradient                   ...        0 min,  0.022 sec
 * total energy  :   -51.7284261 Eh     change       -0.5258797E-05 Eh
   gradient norm :     0.0011275 Eh/α   predicted    -0.4300776E-05 ( -18.22%)
   displ. norm   :     0.0267650 α      lambda       -0.5586729E-05
   maximum displ.:     0.0150846 α      in ANC's #5, #2, #7, ...

........................................................................
.............................. CYCLE   10 ..............................
........................................................................
   1    -52.5216450 -0.525216E+02  0.136E-02    2.07       0.0  T
   2    -52.5216451 -0.129801E-06  0.762E-03    2.07       2.4  T
   3    -52.5216450  0.133288E-06  0.282E-03    2.07       6.4  T
   4    -52.5216451 -0.168042E-06  0.100E-03    2.07      17.9  T
   5    -52.5216451 -0.708626E-08  0.493E-04    2.07      36.5  T
   6    -52.5216451 -0.388338E-08  0.206E-04    2.07      87.1  T
     SCC iter.                  ...        0 min,  0.011 sec
     gradient                   ...        0 min,  0.022 sec
 * total energy  :   -51.7284315 Eh     change       -0.5382303E-05 Eh
   gradient norm :     0.0007504 Eh/α   predicted    -0.2795660E-05 ( -48.06%)
   displ. norm   :     0.0372073 α      lambda       -0.3182723E-05
   maximum displ.:     0.0224925 α      in ANC's #2, #1, #7, ...

........................................................................
.............................. CYCLE   11 ..............................
........................................................................
   1    -52.5212743 -0.525213E+02  0.154E-02    2.07       0.0  T
   2    -52.5212743 -0.477035E-07  0.886E-03    2.07       2.0  T
   3    -52.5212743  0.326519E-07  0.157E-03    2.07      11.5  T
   4    -52.5212744 -0.438662E-07  0.759E-04    2.07      23.7  T
   5    -52.5212744 -0.651396E-08  0.266E-04    2.07      67.6  T
     SCC iter.                  ...        0 min,  0.009 sec
     gradient                   ...        0 min,  0.023 sec
 * total energy  :   -51.7284347 Eh     change       -0.3150704E-05 Eh
   gradient norm :     0.0005092 Eh/α   predicted    -0.1596489E-05 ( -49.33%)
   displ. norm   :     0.0401623 α      lambda       -0.2031311E-05
   maximum displ.:     0.0242698 α      in ANC's #2, #1, #3, ...

   *** GEOMETRY OPTIMIZATION CONVERGED AFTER 11 ITERATIONS ***

------------------------------------------------------------------------
 total energy gain   :        -0.0045320 Eh       -2.8439 kcal/mol
 total RMSD          :         0.1692344 a0        0.0896 Å
 total power (kW/mol):        -1.0817098 (step)  -21.1921 (real)
------------------------------------------------------------------------

 ANCopt (total)                0 d,  0 h,  0 min,  0.561 sec
 optimizer setup                ...        0 min,  0.000 sec (  0.024%)
 model hessian                  ...        0 min,  0.006 sec (  1.019%)
 ANC generation                 ...        0 min,  0.001 sec (  0.176%)
 coordinate transformation      ...        0 min,  0.000 sec (  0.042%)
 single point calculation       ...        0 min,  0.551 sec ( 98.051%)
 optimization log               ...        0 min,  0.001 sec (  0.250%)
 hessian update                 ...        0 min,  0.000 sec (  0.031%)
 rational function              ...        0 min,  0.002 sec (  0.271%)

================
 final structure:
================
$coord
   -5.17336605127989   -2.51474886172790    0.05947341323320      C 
   -7.47640817459599   -0.25303187395663    0.05768469817037      S 
   -5.23814899311613    2.16739173209029    0.06514563332460      C 
   -2.81477900342323    1.18610205793789    0.06396191784653      C 
   -2.79606455757958   -1.50955375709680    0.06253868128312      C 
   -0.47571715809265   -3.02629418480444    0.06707725176044      C 
   -0.49006913658775   -5.32629367740753    0.09330774089641      O 
    1.87890601316371   -1.52647679090188    0.03120128966454      C 
    4.18040412759574   -2.80362340510156   -0.00142789234697      C 
    6.43796469140390   -1.49737100414556   -0.05366890168675      C 
    6.46212860224261    1.13304404098518   -0.07712744414012      C 
    8.90801886222279    2.56342329780221   -0.05687632295969      C 
    9.76480064908503    3.03803985110844    2.66524092134934      C 
    4.17077215482294    2.40719523655434   -0.02904986702828      C 
    1.87761989746565    1.12354760014054    0.02140041848432      C 
   -0.47142658624675    2.65653864451533    0.05973391107345      C 
   -0.39957637920868    4.95915504062354    0.08443867312069      O 
   -5.97348133145040    4.77798729288149    0.07070585411899      C 
   -8.35732021569487    5.58103405806270    0.07067191138090      C 
   -5.65897404869583   -4.48234716835534    0.05669133559585      H 
    4.14295607165974   -4.84444183068987    0.01105276707989      H 
    8.20381707530578   -2.52221194586679   -0.08562088304042      H 
    8.66781512576200    4.37225395767067   -1.01752929192052      H 
   10.35941973362494    1.48447606992781   -1.04957663575315      H 
    8.35046586048667    4.13191737554212    3.67834423245011      H 
   11.53738693322370    4.07656001972717    2.68456161445027      H 
   10.03603906371103    1.25607494360998    3.65306044782242      H 
    4.12040495543303    4.44917341707598   -0.03922257201928      H 
   -4.41163490653262    6.09635625274354    0.07653564922280      H 
   -9.92736998744657    4.28086297941477    0.06463676643708      H 
   -8.80787532932323    7.56274136238844    0.07498989746922      H 
$end
           -------------------------------------------------
          |                Final Singlepoint                |
           -------------------------------------------------

          ...................................................
          :                      SETUP                      :
          :.................................................:
          :  # basis functions                  94          :
          :  # atomic orbitals                  93          :
          :  # shells                           51          :
          :  # electrons                        94          :
          :  max. iterations                   250          :
          :  Hamiltonian                  GFN2-xTB          :
          :  restarted?                      false          :
          :  GBSA solvation                  false          :
          :  PC potential                    false          :
          :  electronic temp.          300.0000000     K    :
          :  accuracy                    1.0000000          :
          :  -> integral cutoff          0.2500000E+02      :
          :  -> integral neglect         0.1000000E-07      :
          :  -> SCF convergence          0.1000000E-05 Eh   :
          :  -> wf. convergence          0.1000000E-03 e    :
          :  Broyden damping             0.4000000          :
          ...................................................

 iter      E             dE          RMSdq      gap      omega  full diag
   1    -52.5212744 -0.525213E+02  0.164E-04    2.07       0.0  T
   2    -52.5212744 -0.103242E-10  0.704E-05    2.07     255.0  T
   3    -52.5212744 -0.110234E-09  0.797E-05    2.07     225.3  T

   *** convergence criteria satisfied after 3 iterations ***

         #    Occupation            Energy/Eh            Energy/eV
      -------------------------------------------------------------
         1        2.0000           -0.7516866             -20.4544
       ...           ...                  ...                  ...
        41        2.0000           -0.4354414             -11.8490
        42        2.0000           -0.4255425             -11.5796
        43        2.0000           -0.4208661             -11.4523
        44        2.0000           -0.4151953             -11.2980
        45        2.0000           -0.4028941             -10.9633
        46        2.0000           -0.3993307             -10.8663
        47        2.0000           -0.3934916             -10.7075 (HOMO)
        48                         -0.3175634              -8.6413 (LUMO)
        49                         -0.2974924              -8.0952
        50                         -0.2551311              -6.9425
        51                         -0.2311570              -6.2901
        52                         -0.2196046              -5.9757
       ...                                ...                  ...
        93                          0.7390641              20.1110
      -------------------------------------------------------------
                  HL-Gap            0.0759281 Eh            2.0661 eV
             Fermi-level           -0.3555275 Eh           -9.6744 eV

 SCC (total)                   0 d,  0 h,  0 min,  0.047 sec
 SCC setup                      ...        0 min,  0.000 sec (  0.625%)
 Dispersion                     ...        0 min,  0.000 sec (  0.940%)
 integral evaluation            ...        0 min,  0.016 sec ( 34.410%)
 zeroth order Hamiltonian       ...        0 min,  0.000 sec (  0.512%)
 iterations                     ...        0 min,  0.006 sec ( 13.787%)
 molecular gradient             ...        0 min,  0.023 sec ( 48.752%)
 printout                       ...        0 min,  0.000 sec (  0.873%)

         :::::::::::::::::::::::::::::::::::::::::::::::::::::
         ::                     SUMMARY                     ::
         :::::::::::::::::::::::::::::::::::::::::::::::::::::
         :: total energy             -51.728434723588 Eh    ::
         :: gradient norm              0.000509312559 Eh/a0 ::
         :: HOMO-LUMO gap              2.066109538870 eV    ::
         ::.................................................::
         :: SCC energy               -52.521274359717 Eh    ::
         :: -> isotropic ES            0.055030215054 Eh    ::
         :: -> anisotropic ES          0.000194475271 Eh    ::
         :: -> anisotropic XC          0.020524718054 Eh    ::
         :: -> dispersion             -0.036146979390 Eh    ::
         :: repulsion energy           0.792968039215 Eh    ::
         :: add. restraining           0.000000000000 Eh    ::
         :::::::::::::::::::::::::::::::::::::::::::::::::::::

           -------------------------------------------------
          |                Property Printout                |
           -------------------------------------------------

    * Orbital Energies and Occupations

         #    Occupation            Energy/Eh            Energy/eV
      -------------------------------------------------------------
         1        2.0000           -0.7516866             -20.4544
       ...           ...                  ...                  ...
        35        2.0000           -0.4713556             -12.8262
        36        2.0000           -0.4676053             -12.7242
        37        2.0000           -0.4546538             -12.3718
        38        2.0000           -0.4540195             -12.3545
        39        2.0000           -0.4498315             -12.2405
        40        2.0000           -0.4461030             -12.1391
        41        2.0000           -0.4354414             -11.8490
        42        2.0000           -0.4255425             -11.5796
        43        2.0000           -0.4208661             -11.4523
        44        2.0000           -0.4151953             -11.2980
        45        2.0000           -0.4028941             -10.9633
        46        2.0000           -0.3993307             -10.8663
        47        2.0000           -0.3934916             -10.7075 (HOMO)
        48                         -0.3175634              -8.6413 (LUMO)
        49                         -0.2974924              -8.0952
        50                         -0.2551311              -6.9425
        51                         -0.2311570              -6.2901
        52                         -0.2196046              -5.9757
        53                         -0.2017364              -5.4895
        54                         -0.1778191              -4.8387
        55                         -0.1427545              -3.8845
        56                         -0.1382635              -3.7623
        57                         -0.0761704              -2.0727
        58                         -0.0218658              -0.5950
       ...                                ...                  ...
        93                          0.7390641              20.1110
      -------------------------------------------------------------
                  HL-Gap            0.0759281 Eh            2.0661 eV
             Fermi-level           -0.3555275 Eh           -9.6744 eV

     #   Z        covCN         q      C6AA      α(0)
     1   6 C      2.934    -0.007    28.194     8.708
     2  16 S      2.309     0.027   139.955    19.911
     3   6 C      2.987     0.040    27.105     8.540
     4   6 C      3.147    -0.039    28.679     8.761
     5   6 C      3.160    -0.030    28.411     8.714
     6   6 C      2.827     0.226    23.254     7.902
     7   8 O      0.858    -0.376    21.216     6.176
     8   6 C      2.976    -0.017    28.429     8.746
     9   6 C      2.922    -0.018    28.458     8.748
    10   6 C      2.922    -0.030    28.749     8.793
    11   6 C      2.969     0.026    27.430     8.591
    12   6 C      3.807    -0.060    21.650     6.624
    13   6 C      3.754    -0.099    22.455     6.757
    14   6 C      2.930    -0.026    28.647     8.778
    15   6 C      2.973    -0.014    28.348     8.733
    16   6 C      2.826     0.227    23.230     7.898
    17   8 O      0.858    -0.383    21.351     6.195
    18   6 C      2.917    -0.031    28.780     8.797
    19   6 C      2.841    -0.077    29.910     8.963
    20   1 H      0.926     0.074     2.037     2.232
    21   1 H      0.926     0.066     2.131     2.283
    22   1 H      0.926     0.046     2.375     2.410
    23   1 H      0.924     0.046     2.372     2.408
    24   1 H      0.924     0.043     2.409     2.427
    25   1 H      0.925     0.041     2.434     2.440
    26   1 H      0.925     0.042     2.417     2.431
    27   1 H      0.925     0.039     2.467     2.456
    28   1 H      0.926     0.067     2.124     2.279
    29   1 H      0.925     0.088     1.898     2.155
    30   1 H      0.926     0.054     2.269     2.356
    31   1 H      0.926     0.056     2.252     2.347

 Mol. C6AA /au·bohr⁶  :      14858.185525
 Mol. C8AA /au·bohr⁸  :     399836.830091
 Mol. α(0) /au        :        194.556044


Wiberg/Mayer (AO) data.
largest (>0.10) Wiberg bond orders for each atom
          total WBO             WBO to atom ...
     1  C   3.954        C    5 1.545    S    2 1.227    H   20 0.965
     2  S   2.679        C    1 1.227    C    3 1.143
     3  C   3.953        C    4 1.455    C   18 1.150    S    2 1.143
     4  C   3.983        C    3 1.455    C    5 1.199    C   16 1.059
     5  C   3.984        C    1 1.545    C    4 1.199    C    6 1.038
     6  C   3.938        O    7 1.758    C    5 1.038    C    8 1.032
     7  O   2.037        C    6 1.758
     8  C   3.987        C    9 1.387    C   15 1.327    C    6 1.032
     9  C   3.984        C   10 1.453    C    8 1.387    H   21 0.964
    10  C   3.986        C    9 1.453    C   11 1.393    H   22 0.968
    11  C   3.982        C   14 1.408    C   10 1.393    C   12 1.016
    12  C   3.995        C   11 1.016    C   13 0.997    H   24 0.973    H   23 0.973
    13  C   3.993        C   12 0.997    H   27 0.988    H   25 0.988    H   26 0.985
    14  C   3.983        C   11 1.408    C   15 1.404    H   28 0.962
    15  C   3.988        C   14 1.404    C    8 1.327    C   16 1.022
    16  C   3.941        O   17 1.743    C    4 1.059    C   15 1.022
    17  O   2.046        C   16 1.743
    18  C   3.985        C   19 1.852    C    3 1.150    H   29 0.944
    19  C   3.979        C   18 1.852    H   31 0.977    H   30 0.969
    20  H   0.994        C    1 0.965
    21  H   0.995        C    9 0.964
    22  H   0.997        C   10 0.968
    23  H   0.997        C   12 0.973
    24  H   0.997        C   12 0.973
    25  H   0.998        C   13 0.988
    26  H   0.997        C   13 0.985
    27  H   0.998        C   13 0.988
    28  H   0.995        C   14 0.962
    29  H   0.992        C   18 0.944
    30  H   0.997        C   19 0.969
    31  H   0.996        C   19 0.977

molecular dipole:
                 x           y           z       tot (Debye)
 q only:        0.147       0.530       0.019
   full:        0.359       0.434       0.015       1.433
molecular quadrupole (traceless):
                xx          xy          yy          xz          yz          zz
 q only:       22.557      -1.924     -16.864       0.699       0.364      -5.693
  q+dip:       23.470      -1.854     -14.960       0.285       0.149      -8.510
   full:       20.086      -1.701     -18.007       0.533       0.253      -2.078

           -------------------------------------------------
          |                Geometry Summary                 |
           -------------------------------------------------

      molecular mass/u    :      268.3296000
   center of mass at/Å    :       -0.1347465       0.3496675       0.0968830
  moments of inertia/u·Å² :        0.7076362E+03   0.2360856E+04   0.3015316E+04
rotational constants/cm⁻¹ :        0.2382245E-01   0.7140476E-02   0.5590669E-02

 * 28 selected distances

     #   Z        #   Z                                     value/Å
     1   6 C      2  16 S                                 1.7081339
     2  16 S      3   6 C                                 1.7445450 (max)
     3   6 C      4   6 C                                 1.3835383
     1   6 C      5   6 C                                 1.3658504
     4   6 C      5   6 C                                 1.4265143
     6   6 C      7   8 O                                 1.2172103
     8   6 C      9   6 C                                 1.3929592
     9   6 C     10   6 C                                 1.3804940
    10   6 C     11   6 C                                 1.3920699
    12   6 C     13   6 C                                 1.5308924
    11   6 C     14   6 C                                 1.3876242
     8   6 C     15   6 C                                 1.4023424
    14   6 C     15   6 C                                 1.3909255
    16   6 C     17   8 O                                 1.2191554
     3   6 C     18   6 C                                 1.4352272
    18   6 C     19   6 C                                 1.3311277
     1   6 C     20   1 H                                 1.0724513 (min)
     9   6 C     21   1 H                                 1.0801567
    10   6 C     22   1 H                                 1.0805528
    12   6 C     23   1 H                                 1.0912375
    12   6 C     24   1 H                                 1.0917153
    13   6 C     25   1 H                                 1.0874933
    13   6 C     26   1 H                                 1.0871933
    13   6 C     27   1 H                                 1.0876822
    14   6 C     28   1 H                                 1.0809105
    18   6 C     29   1 H                                 1.0815812
    19   6 C     30   1 H                                 1.0787350
    19   6 C     31   1 H                                 1.0754390

 * 4 distinct bonds (by element types)

   Z      Z             #   av. dist./Å        max./Å        min./Å
   1 H    6 C          12     1.0829290     1.0917153     1.0724513
   6 C    6 C          12     1.4016304     1.5308924     1.3311277
   6 C    8 O           2     1.2181828     1.2191554     1.2172103
   6 C   16 S           2     1.7263395     1.7445450     1.7081339


optimized geometry written to: xtbopt.xyz


           -------------------------------------------------
          | TOTAL ENERGY              -51.728434723588 Eh   |
          | GRADIENT NORM               0.000509312559 Eh/α |
          | HOMO-LUMO GAP               2.066109538870 eV   |
           -------------------------------------------------

------------------------------------------------------------------------
 * finished run on 2021/05/19 at 10:59:54.902     
------------------------------------------------------------------------
 total:
 * wall-time:     0 d,  0 h,  0 min,  0.702 sec
 *  cpu-time:     0 d,  0 h,  0 min,  0.700 sec
 * ratio c/w:     0.997 speedup
 SCF:
 * wall-time:     0 d,  0 h,  0 min,  0.065 sec
 *  cpu-time:     0 d,  0 h,  0 min,  0.065 sec
 * ratio c/w:     0.997 speedup
 ANC optimizer:
 * wall-time:     0 d,  0 h,  0 min,  0.609 sec
 *  cpu-time:     0 d,  0 h,  0 min,  0.608 sec
 * ratio c/w:     0.998 speedup

