      -----------------------------------------------------------      
     |                   =====================                   |     
     |                           x T B                           |     
     |                   =====================                   |     
     |                         S. Grimme                         |     
     |          Mulliken Center for Theoretical Chemistry        |     
     |                    University of Bonn                     |     
     |                Version 6.2 RC2 (SAW190805)                |     
      -----------------------------------------------------------      

   This program is distributed in the hope that it will be useful,
   but WITHOUT ANY WARRANTY; without even the implied warranty of
   MERCHANTABILITY or FITNESS FOR A PARTICULAR PURPOSE.
   
   FOR NON-COMMERCIAL, ACADEMIA USE ONLY.
   
   Cite this work as:
   * S. Grimme, C. Bannwarth, P. Shushkov, J. Chem. Theory Comput., 2017,
     13, 1989-2009. DOI: 10.1021/acs.jctc.7b00118
   * C. Bannwarth, S. Ehlert and S. Grimme., J. Chem. Theory Comput., 2019,
     15, 1652-1671. DOI: 10.1021/acs.jctc.8b01176
   * P. Pracht, E. Caldeweyher, S. Ehlert, S. Grimme, ChemRxiv, 2019, preprint.
     DOI: 10.26434/chemrxiv.8326202.v1
   
   for DFT-D4:
   * E. Caldeweyher, C. Bannwarth and S. Grimme, J. Chem. Phys., 2017,
     147, 034112. DOI: 10.1063/1.4993215
   * E. Caldeweyher, S. Ehlert, A. Hansen, H. Neugebauer, S. Spicher,
     C. Bannwarth and S. Grimme, J. Chem. Phys., 2019, 150, 154122.
     DOI: 10.1063/1.5090222
   
   for sTDA-xTB:
   * S. Grimme and C. Bannwarth, J. Chem. Phys., 2016, 145, 054103.
     DOI: 10.1063/1.4959605
   
   in the mass-spec context:
   * V. Asgeirsson, C. Bauer and S. Grimme, Chem. Sci., 2017, 8, 4879.
     DOI: 10.1039/c7sc00601b
   
   for metadynamics refer to:
   * S. Grimme, J. Chem. Theory Comput., 2019, 155, 2847-2862
     DOI: 10.1021/acs.jctc.9b00143
   
   with help from (in alphabetical order)
   C. Bannwarth, F. Bohle, G. Brandenburg, E. Caldeweyher, M. Checinski,
   S. Dohm, S. Ehlert, S. Ehrlich, F. März, H. Neugebauer, J. Pisarek,
   P. Pracht, P. Shushkov, and S. Spicher.
   
 * started run on 2021/05/19 at 10:59:54.921     

           -------------------------------------------------
          |                Calculation Setup                |
           -------------------------------------------------

          program call               : /ihome/ghutchison/geoffh/xtb/xtb 659.xyz -opt
          hostname                   : smp-n144
          coordinate file            : 659.xyz
          omp threads                :                     1
          number of atoms            :                    30
          number of electrons        :                    82
          charge                     :                     0
          spin                       :                   0.0
          first test random number   :      0.01133940180943


########################################################################
# WARNING! Please study the warnings concerning your input carefully
#  - the use of '-opt' is discouraged, please use '--opt' next time
########################################################################

           ------------------------------------------------- 
          |                 G F N 2 - x T B                 |
          | Geometry, Frequencies, Noncovalent interactions |
          |            JCTC 2019 parametrisation            |
           ------------------------------------------------- 
             KAB for C  - Si     :                1.0500
             KAB for H  - Pd     :                0.9500
             k(s)              :                1.8500
             k(p)              :                2.2300
             k(d)              :                2.2300
             k(f)              :                2.0000
             kEN (H0ij)        :               -2.0000
             D4 a1             :                0.5200
             D4 a2             :                5.0000
             D4 s6             :                1.0000
             D4 s8             :                2.7000
             D4 s9             :                5.0000
             alphaj            :                2.0000

  Z AO/shell   Hii/eV     exponent
  1     Wed Apr 25 08:07:45 CEST 2018   EN: 2.200 GM2: 0.406  GM3: 0.0800  RAES: 1.40
     1s    -10.707211    1.230000
  6     Wed Apr 25 08:07:45 CEST 2018   EN: 2.550 GM2: 0.538  GM3: 0.1500  RAES: 3.00
     2s    -13.970922    2.096432
     2p    -10.063292    1.800000
 16     Tue Apr 24 11:44:34 CEST 2018   EN: 2.580 GM2: 0.340  GM3:-0.0502  RAES: 3.10
     3s    -20.029654    1.981333
     3p    -11.377694    2.025643
     3d     -0.420282    1.702555

           ------------------------------------------------- 
          |        Self-Consistent Charge Iterations        |
           ------------------------------------------------- 

          ...................................................
          :                      SETUP                      :
          :.................................................:
          :  # basis functions                  90          :
          :  # atomic orbitals                  88          :
          :  # shells                           48          :
          :  # electrons                        82          :
          :  max. iterations                   250          :
          :  Hamiltonian                  GFN2-xTB          :
          :  restarted?                      false          :
          :  GBSA solvation                  false          :
          :  PC potential                    false          :
          :  electronic temp.          300.0000000     K    :
          :  accuracy                    1.0000000          :
          :  -> integral cutoff          0.2500000E+02      :
          :  -> integral neglect         0.1000000E-07      :
          :  -> SCF convergence          0.1000000E-05 Eh   :
          :  -> wf. convergence          0.1000000E-03 e    :
          :  Broyden damping             0.4000000          :
          ...................................................

 iter      E             dE          RMSdq      gap      omega  full diag
   1    -44.2261358 -0.442261E+02  0.413E+00    2.78       0.0  T
   2    -44.2607170 -0.345812E-01  0.238E+00    2.58       1.0  T
   3    -44.2322149  0.285020E-01  0.131E+00    2.59       1.0  T
   4    -44.2669107 -0.346958E-01  0.549E-01    2.59       1.0  T
   5    -44.2707291 -0.381836E-02  0.192E-01    2.56       1.0  T
   6    -44.2710862 -0.357110E-03  0.897E-02    2.58       1.0  T
   7    -44.2712052 -0.119033E-03  0.259E-02    2.57       1.0  T
   8    -44.2712197 -0.144828E-04  0.118E-02    2.57       1.6  T
   9    -44.2712200 -0.282330E-06  0.450E-03    2.57       4.1  T
  10    -44.2712203 -0.275993E-06  0.186E-03    2.57       9.8  T
  11    -44.2712203 -0.110225E-07  0.878E-04    2.57      20.8  T
  12    -44.2712203 -0.454875E-08  0.307E-04    2.57      59.5  T

   *** convergence criteria satisfied after 12 iterations ***

         #    Occupation            Energy/Eh            Energy/eV
      -------------------------------------------------------------
         1        2.0000           -0.7264102             -19.7666
       ...           ...                  ...                  ...
        35        2.0000           -0.4280304             -11.6473
        36        2.0000           -0.4260872             -11.5944
        37        2.0000           -0.4175232             -11.3614
        38        2.0000           -0.4148040             -11.2874
        39        2.0000           -0.3917162             -10.6591
        40        2.0000           -0.3897044             -10.6044
        41        2.0000           -0.3548629              -9.6563 (HOMO)
        42                         -0.2602972              -7.0830 (LUMO)
        43                         -0.2432682              -6.6197
        44                         -0.2002330              -5.4486
        45                         -0.1992272              -5.4212
        46                         -0.1897367              -5.1630
       ...                                ...                  ...
        88                          0.7019667              19.1015
      -------------------------------------------------------------
                  HL-Gap            0.0945657 Eh            2.5733 eV
             Fermi-level           -0.3075801 Eh           -8.3697 eV

 SCC (total)                   0 d,  0 h,  0 min,  0.060 sec
 SCC setup                      ...        0 min,  0.000 sec (  0.729%)
 Dispersion                     ...        0 min,  0.000 sec (  0.835%)
 integral evaluation            ...        0 min,  0.015 sec ( 25.065%)
 zeroth order Hamiltonian       ...        0 min,  0.000 sec (  0.459%)
 iterations                     ...        0 min,  0.020 sec ( 34.243%)
 molecular gradient             ...        0 min,  0.023 sec ( 37.814%)
 printout                       ...        0 min,  0.000 sec (  0.741%)

         :::::::::::::::::::::::::::::::::::::::::::::::::::::
         ::                     SUMMARY                     ::
         :::::::::::::::::::::::::::::::::::::::::::::::::::::
         :: total energy             -43.620685749056 Eh    ::
         :: gradient norm              0.087789519790 Eh/a0 ::
         :: HOMO-LUMO gap              2.573262325638 eV    ::
         ::.................................................::
         :: SCC energy               -44.271220286071 Eh    ::
         :: -> isotropic ES            0.003265296305 Eh    ::
         :: -> anisotropic ES          0.005623003384 Eh    ::
         :: -> anisotropic XC          0.021553304720 Eh    ::
         :: -> dispersion             -0.036065127697 Eh    ::
         :: repulsion energy           0.650177709478 Eh    ::
         :: add. restraining           0.000000000000 Eh    ::
         :::::::::::::::::::::::::::::::::::::::::::::::::::::

      ----------------------------------------------------------- 
     |                   =====================                   |
     |                        A N C O P T                        |
     |                   =====================                   |
     |               Approximate Normal Coordinate               |
     |                Rational Function Optimizer                |
      ----------------------------------------------------------- 

          ...................................................
          :                      SETUP                      :
          :.................................................:
          :   optimization level            normal          :
          :   max. optcycles                   200          :
          :   ANC micro-cycles                  20          :
          :   degrees of freedom                84          :
          :.................................................:
          :   RF solver                   davidson          :
          :   input Hessian                  false          :
          :   write xtbopt.log                true          :
          :   linear?                        false          :
          :   energy convergence         0.5000000E-05 Eh   :
          :   grad. convergence          0.1000000E-02 Eh/α :
          :   maximium RF displ.         2.0000000          :
          :   Hlow (freq-cutoff)         0.5000000E-02      :
          :   Hmax (freq-cutoff)         5.0000000          :
          :   S6 in model hess.         20.0000000          :
          ...................................................

generating ANC from model Hessian ...
Using Lindh-Hessian (1995)
 Shifting diagonal of input Hessian by   4.345755117858088E-003
 Lowest  eigenvalues of input Hessian
   -0.000000   -0.000000    0.000000    0.000000    0.000000    0.000000
    0.005000    0.006339    0.006408    0.006972    0.008062    0.009774
    0.010251    0.011062    0.013592    0.015860    0.017690    0.018008
 Highest eigenvalues
    1.679872    1.725211    1.814179    1.816490    1.894135    1.977873
 

........................................................................
.............................. CYCLE    1 ..............................
........................................................................
   1    -44.2712203 -0.442712E+02  0.119E-04    2.57       0.0  T
   2    -44.2712203 -0.869917E-10  0.787E-05    2.57     232.0  T
   3    -44.2712203 -0.748415E-10  0.492E-05    2.57     370.7  T
     SCC iter.                  ...        0 min,  0.006 sec
     gradient                   ...        0 min,  0.022 sec
 * total energy  :   -43.6206858 Eh     change       -0.1573461E-07 Eh
   gradient norm :     0.0877889 Eh/α   predicted     0.0000000E+00 (-100.00%)
   displ. norm   :     0.3284358 α      lambda       -0.1414617E-01
   maximum displ.:     0.1835292 α      in ANC's #22, #27, #35, ...

........................................................................
.............................. CYCLE    2 ..............................
........................................................................
   1    -44.3065474 -0.443065E+02  0.275E-01    2.76       0.0  T
   2    -44.3066070 -0.595372E-04  0.146E-01    2.75       1.0  T
   3    -44.3064993  0.107660E-03  0.101E-01    2.75       1.0  T
   4    -44.3067226 -0.223260E-03  0.297E-02    2.75       1.0  T
   5    -44.3067311 -0.853889E-05  0.146E-02    2.75       1.3  T
   6    -44.3067329 -0.181365E-05  0.286E-03    2.75       6.4  T
   7    -44.3067330 -0.100023E-06  0.948E-04    2.75      19.3  T
     SCC iter.                  ...        0 min,  0.011 sec
     gradient                   ...        0 min,  0.021 sec
 * total energy  :   -43.6298960 Eh     change       -0.9210252E-02 Eh
   gradient norm :     0.0325248 Eh/α   predicted    -0.7836063E-02 ( -14.92%)
   displ. norm   :     0.1494679 α      lambda       -0.2003438E-02
   maximum displ.:     0.0744745 α      in ANC's #22, #27, #20, ...

........................................................................
.............................. CYCLE    3 ..............................
........................................................................
   1    -44.3204183 -0.443204E+02  0.133E-01    2.83       0.0  T
   2    -44.3204424 -0.241092E-04  0.706E-02    2.82       1.0  T
   3    -44.3204304  0.120579E-04  0.481E-02    2.82       1.0  T
   4    -44.3204769 -0.465189E-04  0.150E-02    2.82       1.2  T
   5    -44.3204792 -0.229839E-05  0.678E-03    2.82       2.7  T
   6    -44.3204795 -0.282468E-06  0.211E-03    2.82       8.6  T
   7    -44.3204795 -0.570584E-07  0.431E-04    2.82      42.4  T
     SCC iter.                  ...        0 min,  0.011 sec
     gradient                   ...        0 min,  0.021 sec
 * total energy  :   -43.6309646 Eh     change       -0.1068538E-02 Eh
   gradient norm :     0.0083052 Eh/α   predicted    -0.1024104E-02 (  -4.16%)
   displ. norm   :     0.0711010 α      lambda       -0.1241981E-03
   maximum displ.:     0.0535594 α      in ANC's #1, #4, #7, ...

........................................................................
.............................. CYCLE    4 ..............................
........................................................................
   1    -44.3199873 -0.443200E+02  0.359E-02    2.83       0.0  T
   2    -44.3199888 -0.148525E-05  0.196E-02    2.82       1.0  T
   3    -44.3199867  0.202119E-05  0.139E-02    2.83       1.3  T
   4    -44.3199904 -0.366339E-05  0.389E-03    2.82       4.7  T
   5    -44.3199906 -0.164869E-06  0.151E-03    2.82      12.1  T
   6    -44.3199906 -0.129989E-07  0.546E-04    2.82      33.5  T
     SCC iter.                  ...        0 min,  0.010 sec
     gradient                   ...        0 min,  0.021 sec
 * total energy  :   -43.6310649 Eh     change       -0.1003846E-03 Eh
   gradient norm :     0.0044055 Eh/α   predicted    -0.6241637E-04 ( -37.82%)
   displ. norm   :     0.1369703 α      lambda       -0.1429259E-03
   maximum displ.:     0.1070764 α      in ANC's #1, #4, #7, ...

........................................................................
.............................. CYCLE    5 ..............................
........................................................................
   1    -44.3184642 -0.443185E+02  0.582E-02    2.83       0.0  T
   2    -44.3184673 -0.314777E-05  0.318E-02    2.82       1.0  T
   3    -44.3184611  0.624371E-05  0.211E-02    2.82       1.0  T
   4    -44.3184697 -0.859074E-05  0.577E-03    2.82       3.2  T
   5    -44.3184701 -0.408156E-06  0.208E-03    2.82       8.8  T
   6    -44.3184701 -0.179806E-07  0.818E-04    2.82      22.3  T
     SCC iter.                  ...        0 min,  0.010 sec
     gradient                   ...        0 min,  0.021 sec
 * total energy  :   -43.6311570 Eh     change       -0.9207186E-04 Eh
   gradient norm :     0.0019216 Eh/α   predicted    -0.7281053E-04 ( -20.92%)
   displ. norm   :     0.1222979 α      lambda       -0.3515420E-04
   maximum displ.:     0.1035583 α      in ANC's #1, #4, #7, ...

........................................................................
.............................. CYCLE    6 ..............................
........................................................................
   1    -44.3181813 -0.443182E+02  0.415E-02    2.82       0.0  T
   2    -44.3181820 -0.727933E-06  0.234E-02    2.82       1.0  T
   3    -44.3181795  0.250417E-05  0.117E-02    2.82       1.6  T
   4    -44.3181824 -0.286395E-05  0.308E-03    2.82       5.9  T
   5    -44.3181825 -0.115994E-06  0.105E-03    2.82      17.4  T
   6    -44.3181825 -0.492597E-08  0.433E-04    2.82      42.1  T
   7    -44.3181825 -0.548003E-08  0.103E-04    2.82     177.3  T
     SCC iter.                  ...        0 min,  0.011 sec
     gradient                   ...        0 min,  0.023 sec
 * total energy  :   -43.6311963 Eh     change       -0.3925222E-04 Eh
   gradient norm :     0.0032885 Eh/α   predicted    -0.1769691E-04 ( -54.91%)
   displ. norm   :     0.0813866 α      lambda        0.7209647E-05
   maximum displ.:     0.0688667 α      in ANC's #1, #4, #7, ...

........................................................................
.............................. CYCLE    7 ..............................
........................................................................
   1    -44.3178906 -0.443179E+02  0.276E-02    2.82       0.0  T
   2    -44.3178909 -0.323002E-06  0.156E-02    2.82       1.2  T
   3    -44.3178898  0.111064E-05  0.781E-03    2.82       2.3  T
   4    -44.3178910 -0.127223E-05  0.204E-03    2.82       9.0  T
   5    -44.3178911 -0.502792E-07  0.703E-04    2.82      26.0  T
   6    -44.3178911 -0.232020E-08  0.297E-04    2.82      61.4  T
     SCC iter.                  ...        0 min,  0.010 sec
     gradient                   ...        0 min,  0.022 sec
 * total energy  :   -43.6312071 Eh     change       -0.1086038E-04 Eh
   gradient norm :     0.0046018 Eh/α   predicted     0.3628549E-05 (-133.41%)
   displ. norm   :     0.0323363 α      lambda       -0.2510356E-04
   maximum displ.:     0.0289589 α      in ANC's #1, #4, #8, ...

........................................................................
.............................. CYCLE    8 ..............................
........................................................................
   1    -44.3184221 -0.443184E+02  0.118E-02    2.82       0.0  T
   2    -44.3184223 -0.121721E-06  0.664E-03    2.82       2.8  T
   3    -44.3184220  0.269559E-06  0.419E-03    2.82       4.4  T
   4    -44.3184223 -0.347392E-06  0.119E-03    2.82      15.4  T
   5    -44.3184224 -0.206571E-07  0.400E-04    2.82      45.7  T
     SCC iter.                  ...        0 min,  0.009 sec
     gradient                   ...        0 min,  0.021 sec
 * total energy  :   -43.6312295 Eh     change       -0.2241063E-04 Eh
   gradient norm :     0.0034787 Eh/α   predicted    -0.1256828E-04 ( -43.92%)
   displ. norm   :     0.0657305 α      lambda       -0.4916021E-04
   maximum displ.:     0.0597740 α      in ANC's #1, #8, #35, ...

........................................................................
.............................. CYCLE    9 ..............................
........................................................................
   1    -44.3193100 -0.443193E+02  0.266E-02    2.82       0.0  T
   2    -44.3193110 -0.104837E-05  0.145E-02    2.82       1.3  T
   3    -44.3193101  0.921574E-06  0.979E-03    2.82       1.9  T
   4    -44.3193117 -0.156221E-05  0.311E-03    2.82       5.9  T
   5    -44.3193118 -0.132206E-06  0.107E-03    2.82      17.0  T
   6    -44.3193118 -0.518474E-08  0.467E-04    2.82      39.1  T
   7    -44.3193118 -0.388697E-08  0.125E-04    2.82     146.1  T
     SCC iter.                  ...        0 min,  0.011 sec
     gradient                   ...        0 min,  0.023 sec
 * total energy  :   -43.6312634 Eh     change       -0.3388063E-04 Eh
   gradient norm :     0.0010330 Eh/α   predicted    -0.2468799E-04 ( -27.13%)
   displ. norm   :     0.0808612 α      lambda       -0.1661529E-04
   maximum displ.:     0.0767819 α      in ANC's #1, #4, #7, ...

........................................................................
.............................. CYCLE   10 ..............................
........................................................................
   1    -44.3196844 -0.443197E+02  0.243E-02    2.82       0.0  T
   2    -44.3196848 -0.387856E-06  0.138E-02    2.82       1.3  T
   3    -44.3196837  0.111325E-05  0.831E-03    2.82       2.2  T
   4    -44.3196850 -0.135186E-05  0.213E-03    2.82       8.6  T
   5    -44.3196851 -0.707510E-07  0.692E-04    2.82      26.4  T
   6    -44.3196851 -0.223142E-08  0.301E-04    2.82      60.7  T
     SCC iter.                  ...        0 min,  0.010 sec
     gradient                   ...        0 min,  0.023 sec
 * total energy  :   -43.6312816 Eh     change       -0.1817939E-04 Eh
   gradient norm :     0.0017959 Eh/α   predicted    -0.8332266E-05 ( -54.17%)
   displ. norm   :     0.0421360 α      lambda       -0.9137766E-05
   maximum displ.:     0.0412042 α      in ANC's #1, #3, #7, ...

........................................................................
.............................. CYCLE   11 ..............................
........................................................................
   1    -44.3195825 -0.443196E+02  0.126E-02    2.82       0.0  T
   2    -44.3195825 -0.495355E-07  0.696E-03    2.82       2.6  T
   3    -44.3195825  0.629677E-07  0.191E-03    2.82       9.5  T
   4    -44.3195825 -0.687464E-07  0.898E-04    2.82      20.3  T
   5    -44.3195825 -0.102890E-07  0.315E-04    2.82      58.0  T
     SCC iter.                  ...        0 min,  0.008 sec
     gradient                   ...        0 min,  0.022 sec
 * total energy  :   -43.6312941 Eh     change       -0.1250251E-04 Eh
   gradient norm :     0.0012866 Eh/α   predicted    -0.4574488E-05 ( -63.41%)
   displ. norm   :     0.0440258 α      lambda       -0.9766241E-05
   maximum displ.:     0.0421398 α      in ANC's #1, #4, #3, ...

........................................................................
.............................. CYCLE   12 ..............................
........................................................................
   1    -44.3193152 -0.443193E+02  0.173E-02    2.82       0.0  T
   2    -44.3193154 -0.204441E-06  0.884E-03    2.82       2.1  T
   3    -44.3193151  0.278976E-06  0.408E-03    2.82       4.5  T
   4    -44.3193155 -0.344158E-06  0.147E-03    2.82      12.4  T
   5    -44.3193155 -0.221610E-07  0.564E-04    2.82      32.4  T
   6    -44.3193155 -0.142923E-08  0.197E-04    2.82      92.9  T
     SCC iter.                  ...        0 min,  0.010 sec
     gradient                   ...        0 min,  0.023 sec
 * total energy  :   -43.6313065 Eh     change       -0.1237176E-04 Eh
   gradient norm :     0.0004808 Eh/α   predicted    -0.4887987E-05 ( -60.49%)
   displ. norm   :     0.0471977 α      lambda       -0.7926894E-05
   maximum displ.:     0.0433812 α      in ANC's #1, #4, #3, ...

........................................................................
.............................. CYCLE   13 ..............................
........................................................................
   1    -44.3192125 -0.443192E+02  0.195E-02    2.82       0.0  T
   2    -44.3192126 -0.162046E-06  0.997E-03    2.82       1.8  T
   3    -44.3192125  0.185845E-06  0.340E-03    2.82       5.4  T
   4    -44.3192127 -0.226797E-06  0.146E-03    2.82      12.5  T
   5    -44.3192127 -0.201395E-07  0.350E-04    2.82      52.2  T
   6    -44.3192127 -0.564377E-09  0.785E-05    2.82     232.5  T
     SCC iter.                  ...        0 min,  0.010 sec
     gradient                   ...        0 min,  0.023 sec
 * total energy  :   -43.6313165 Eh     change       -0.1002233E-04 Eh
   gradient norm :     0.0006587 Eh/α   predicted    -0.3969707E-05 ( -60.39%)
   displ. norm   :     0.0415048 α      lambda       -0.5668476E-05
   maximum displ.:     0.0375569 α      in ANC's #1, #4, #7, ...

........................................................................
.............................. CYCLE   14 ..............................
........................................................................
   1    -44.3191354 -0.443191E+02  0.168E-02    2.82       0.0  T
   2    -44.3191355 -0.109991E-06  0.848E-03    2.82       2.2  T
   3    -44.3191354  0.186997E-07  0.194E-03    2.82       9.4  T
   4    -44.3191355 -0.282142E-07  0.123E-03    2.82      14.9  T
   5    -44.3191355 -0.200503E-07  0.199E-04    2.82      91.9  T
   6    -44.3191355 -0.516444E-09  0.730E-05    2.82     250.2  T
     SCC iter.                  ...        0 min,  0.010 sec
     gradient                   ...        0 min,  0.023 sec
 * total energy  :   -43.6313242 Eh     change       -0.7711908E-05 Eh
   gradient norm :     0.0007458 Eh/α   predicted    -0.2838694E-05 ( -63.19%)
   displ. norm   :     0.0368408 α      lambda       -0.4632821E-05
   maximum displ.:     0.0336148 α      in ANC's #1, #7, #4, ...

........................................................................
.............................. CYCLE   15 ..............................
........................................................................
   1    -44.3191745 -0.443192E+02  0.137E-02    2.82       0.0  T
   2    -44.3191746 -0.629635E-07  0.711E-03    2.82       2.6  T
   3    -44.3191746 -0.113852E-07  0.125E-03    2.82      14.6  T
   4    -44.3191746  0.431270E-08  0.669E-04    2.82      27.3  T
   5    -44.3191746 -0.747410E-08  0.156E-04    2.82     117.1  T
     SCC iter.                  ...        0 min,  0.009 sec
     gradient                   ...        0 min,  0.022 sec
 * total energy  :   -43.6313306 Eh     change       -0.6391253E-05 Eh
   gradient norm :     0.0005098 Eh/α   predicted    -0.2321581E-05 ( -63.68%)
   displ. norm   :     0.0360656 α      lambda       -0.3540323E-05
   maximum displ.:     0.0327641 α      in ANC's #1, #7, #4, ...

........................................................................
.............................. CYCLE   16 ..............................
........................................................................
   1    -44.3192060 -0.443192E+02  0.135E-02    2.82       0.0  T
   2    -44.3192061 -0.617460E-07  0.701E-03    2.82       2.6  T
   3    -44.3192061 -0.115141E-07  0.123E-03    2.82      14.8  T
   4    -44.3192061  0.265063E-08  0.611E-04    2.82      29.9  T
   5    -44.3192061 -0.562286E-08  0.113E-04    2.82     161.2  T
     SCC iter.                  ...        0 min,  0.009 sec
     gradient                   ...        0 min,  0.022 sec
 * total energy  :   -43.6313358 Eh     change       -0.5170134E-05 Eh
   gradient norm :     0.0003210 Eh/α   predicted    -0.1772793E-05 ( -65.71%)
   displ. norm   :     0.0349281 α      lambda       -0.2305456E-05
   maximum displ.:     0.0315085 α      in ANC's #1, #7, #4, ...

........................................................................
.............................. CYCLE   17 ..............................
........................................................................
   1    -44.3192321 -0.443192E+02  0.133E-02    2.82       0.0  T
   2    -44.3192321 -0.597109E-07  0.685E-03    2.82       2.7  T
   3    -44.3192321 -0.113774E-07  0.120E-03    2.82      15.2  T
   4    -44.3192321  0.261510E-08  0.580E-04    2.82      31.5  T
   5    -44.3192321 -0.508676E-08  0.123E-04    2.82     148.9  T
     SCC iter.                  ...        0 min,  0.009 sec
     gradient                   ...        0 min,  0.023 sec
 * total energy  :   -43.6313397 Eh     change       -0.3904575E-05 Eh
   gradient norm :     0.0002970 Eh/α   predicted    -0.1156853E-05 ( -70.37%)
   displ. norm   :     0.0340290 α      lambda       -0.1164323E-05
   maximum displ.:     0.0305094 α      in ANC's #1, #7, #4, ...

   *** GEOMETRY OPTIMIZATION CONVERGED AFTER 17 ITERATIONS ***

------------------------------------------------------------------------
 total energy gain   :        -0.0106539 Eh       -6.6854 kcal/mol
 total RMSD          :         0.1809785 a0        0.0958 Å
 total power (kW/mol):        -1.6454037 (step)  -34.3575 (real)
------------------------------------------------------------------------

 ANCopt (total)                0 d,  0 h,  0 min,  0.814 sec
 optimizer setup                ...        0 min,  0.000 sec (  0.017%)
 model hessian                  ...        0 min,  0.007 sec (  0.865%)
 ANC generation                 ...        0 min,  0.001 sec (  0.119%)
 coordinate transformation      ...        0 min,  0.000 sec (  0.044%)
 single point calculation       ...        0 min,  0.800 sec ( 98.304%)
 optimization log               ...        0 min,  0.002 sec (  0.246%)
 hessian update                 ...        0 min,  0.000 sec (  0.033%)
 rational function              ...        0 min,  0.002 sec (  0.238%)

================
 final structure:
================
$coord
   -4.72070327478577   -2.51541438058231    0.27257558387617      C 
   -6.57327118283933   -0.77220959507741    0.26585021931861      C 
   -5.47398235970338    2.31016757651252    0.24564595169849      S 
   -2.35696587633743    1.23736879215789    0.24471900657767      C 
   -2.24072290273273   -1.43551952449249    0.26268722879661      C 
    0.09206068213548   -2.66709691696182    0.27676494518448      C 
    0.26161642893394   -5.49966001241441    0.29857391199407      C 
    0.28586302644222   -6.55196698855870   -2.39454395387894      C 
    2.25995289763288   -1.16614939415899    0.19956179386827      C 
    2.05583199300523    1.50148418702697    0.18238896840114      C 
   -0.23431741188169    2.77222928334534    0.23055757764830      C 
   -0.40374133129149    5.59753769594103    0.18568316434538      C 
   -0.50620055369361    6.58260464625178   -2.52919004440515      C 
    5.02131000219901    2.93858719162427    0.09831900258554      S 
    6.48074757700920    0.00942789722156    0.08211107391748      C 
    4.85043012411362   -1.94239868052421    0.13914484784413      C 
   -5.08291856909273   -4.51444579394423    0.27194526530143      H 
   -8.57721875080479   -1.07900802573590    0.26376870029339      H 
   -1.34361914787199   -6.28426265495494    1.32713353128610      H 
    1.97734083541768   -6.08619880189053    1.27970365516937      H 
   -1.42667206335301   -6.00610241369982   -3.39180205424684      H 
    0.40254970243454   -8.60405982319404   -2.36123231604937      H 
    1.89915239944837   -5.81779706716315   -3.43556048098283      H 
    1.24545269567842    6.39279970536799    1.13921779095998      H 
   -2.10373253138513    6.19359180475586    1.19386498129157      H 
    1.17927850846550    6.01370719005599   -3.55883963441243      H 
   -0.61864586888178    8.63390305980075   -2.53599946627038      H 
   -2.15550380050628    5.83125184887792   -3.49876791880441      H 
    8.50614043885008   -0.05592040296617    0.02349757569797      H 
    5.44851908856480   -3.88397052243863    0.12618314155150      H 
$end
           -------------------------------------------------
          |                Final Singlepoint                |
           -------------------------------------------------

          ...................................................
          :                      SETUP                      :
          :.................................................:
          :  # basis functions                  90          :
          :  # atomic orbitals                  88          :
          :  # shells                           48          :
          :  # electrons                        82          :
          :  max. iterations                   250          :
          :  Hamiltonian                  GFN2-xTB          :
          :  restarted?                      false          :
          :  GBSA solvation                  false          :
          :  PC potential                    false          :
          :  electronic temp.          300.0000000     K    :
          :  accuracy                    1.0000000          :
          :  -> integral cutoff          0.2500000E+02      :
          :  -> integral neglect         0.1000000E-07      :
          :  -> SCF convergence          0.1000000E-05 Eh   :
          :  -> wf. convergence          0.1000000E-03 e    :
          :  Broyden damping             0.4000000          :
          ...................................................

 iter      E             dE          RMSdq      gap      omega  full diag
   1    -44.3192321 -0.443192E+02  0.761E-05    2.82       0.0  T
   2    -44.3192321 -0.795808E-12  0.350E-05    2.82     522.3  T
   3    -44.3192321 -0.211955E-10  0.351E-05    2.82     520.1  T

   *** convergence criteria satisfied after 3 iterations ***

         #    Occupation            Energy/Eh            Energy/eV
      -------------------------------------------------------------
         1        2.0000           -0.7238884             -19.6980
       ...           ...                  ...                  ...
        35        2.0000           -0.4283813             -11.6568
        36        2.0000           -0.4269621             -11.6182
        37        2.0000           -0.4201392             -11.4326
        38        2.0000           -0.4183842             -11.3848
        39        2.0000           -0.3934065             -10.7051
        40        2.0000           -0.3865468             -10.5185
        41        2.0000           -0.3579219              -9.7396 (HOMO)
        42                         -0.2541277              -6.9152 (LUMO)
        43                         -0.2457352              -6.6868
        44                         -0.2062298              -5.6118
        45                         -0.1963341              -5.3425
        46                         -0.1946593              -5.2969
       ...                                ...                  ...
        88                          0.7183734              19.5479
      -------------------------------------------------------------
                  HL-Gap            0.1037943 Eh            2.8244 eV
             Fermi-level           -0.3060248 Eh           -8.3274 eV

 SCC (total)                   0 d,  0 h,  0 min,  0.043 sec
 SCC setup                      ...        0 min,  0.000 sec (  0.603%)
 Dispersion                     ...        0 min,  0.000 sec (  0.693%)
 integral evaluation            ...        0 min,  0.014 sec ( 33.182%)
 zeroth order Hamiltonian       ...        0 min,  0.000 sec (  0.591%)
 iterations                     ...        0 min,  0.006 sec ( 12.821%)
 molecular gradient             ...        0 min,  0.022 sec ( 51.017%)
 printout                       ...        0 min,  0.000 sec (  0.970%)

         :::::::::::::::::::::::::::::::::::::::::::::::::::::
         ::                     SUMMARY                     ::
         :::::::::::::::::::::::::::::::::::::::::::::::::::::
         :: total energy             -43.631339674105 Eh    ::
         :: gradient norm              0.000296592102 Eh/a0 ::
         :: HOMO-LUMO gap              2.824385342473 eV    ::
         ::.................................................::
         :: SCC energy               -44.319232145755 Eh    ::
         :: -> isotropic ES            0.003515558599 Eh    ::
         :: -> anisotropic ES          0.004786880125 Eh    ::
         :: -> anisotropic XC          0.021210497984 Eh    ::
         :: -> dispersion             -0.036541471464 Eh    ::
         :: repulsion energy           0.687505243431 Eh    ::
         :: add. restraining           0.000000000000 Eh    ::
         :::::::::::::::::::::::::::::::::::::::::::::::::::::

           -------------------------------------------------
          |                Property Printout                |
           -------------------------------------------------

    * Orbital Energies and Occupations

         #    Occupation            Energy/Eh            Energy/eV
      -------------------------------------------------------------
         1        2.0000           -0.7238884             -19.6980
       ...           ...                  ...                  ...
        29        2.0000           -0.4621734             -12.5764
        30        2.0000           -0.4535427             -12.3415
        31        2.0000           -0.4531138             -12.3299
        32        2.0000           -0.4509433             -12.2708
        33        2.0000           -0.4477204             -12.1831
        34        2.0000           -0.4351202             -11.8402
        35        2.0000           -0.4283813             -11.6568
        36        2.0000           -0.4269621             -11.6182
        37        2.0000           -0.4201392             -11.4326
        38        2.0000           -0.4183842             -11.3848
        39        2.0000           -0.3934065             -10.7051
        40        2.0000           -0.3865468             -10.5185
        41        2.0000           -0.3579219              -9.7396 (HOMO)
        42                         -0.2541277              -6.9152 (LUMO)
        43                         -0.2457352              -6.6868
        44                         -0.2062298              -5.6118
        45                         -0.1963341              -5.3425
        46                         -0.1946593              -5.2969
        47                         -0.1722274              -4.6865
        48                         -0.1235094              -3.3609
        49                         -0.1029345              -2.8010
        50                         -0.0976127              -2.6562
        51                         -0.0061427              -0.1672
        52                          0.0035716               0.0972
       ...                                ...                  ...
        88                          0.7183734              19.5479
      -------------------------------------------------------------
                  HL-Gap            0.1037943 Eh            2.8244 eV
             Fermi-level           -0.3060248 Eh           -8.3274 eV

     #   Z        covCN         q      C6AA      α(0)
     1   6 C      3.073    -0.048    29.120     8.848
     2   6 C      2.931    -0.012    28.305     8.725
     3  16 S      2.248    -0.069   143.941    20.193
     4   6 C      3.020     0.021    27.514     8.604
     5   6 C      3.133    -0.012    28.093     8.677
     6   6 C      2.964    -0.001    28.058     8.688
     7   6 C      3.805    -0.053    21.513     6.603
     8   6 C      3.753    -0.096    22.395     6.748
     9   6 C      3.133    -0.012    28.093     8.677
    10   6 C      3.020     0.021    27.514     8.604
    11   6 C      3.011    -0.009    28.221     8.714
    12   6 C      3.805    -0.054    21.545     6.608
    13   6 C      3.753    -0.098    22.430     6.753
    14  16 S      2.248    -0.069   143.942    20.193
    15   6 C      2.931    -0.012    28.305     8.725
    16   6 C      3.073    -0.048    29.119     8.848
    17   1 H      0.926     0.037     2.488     2.467
    18   1 H      0.926     0.041     2.441     2.443
    19   1 H      0.924     0.038     2.472     2.459
    20   1 H      0.924     0.038     2.472     2.459
    21   1 H      0.925     0.037     2.494     2.470
    22   1 H      0.925     0.036     2.508     2.477
    23   1 H      0.925     0.037     2.494     2.470
    24   1 H      0.924     0.046     2.374     2.409
    25   1 H      0.924     0.046     2.374     2.409
    26   1 H      0.925     0.040     2.451     2.448
    27   1 H      0.925     0.040     2.454     2.450
    28   1 H      0.925     0.040     2.450     2.448
    29   1 H      0.926     0.041     2.440     2.443
    30   1 H      0.926     0.037     2.488     2.467

 Mol. C6AA /au·bohr⁶  :      13843.992508
 Mol. C8AA /au·bohr⁸  :     396780.025076
 Mol. α(0) /au        :        188.524735


Wiberg/Mayer (AO) data.
largest (>0.10) Wiberg bond orders for each atom
          total WBO             WBO to atom ...
     1  C   3.985        C    2 1.698    C    5 1.179    H   17 0.960    S    3 0.102
     2  C   3.947        C    1 1.698    S    3 1.140    H   18 0.970
     3  S   2.518        C    2 1.140    C    4 1.096    C    1 0.102
     4  C   3.953        C   11 1.378    C    5 1.261    S    3 1.096
     5  C   3.985        C    6 1.348    C    4 1.261    C    1 1.179
     6  C   3.987        C    9 1.348    C    5 1.348    C    7 1.012    C   11 0.102
     7  C   3.997        C    6 1.012    C    8 0.999    H   20 0.971    H   19 0.971
     8  C   3.995        C    7 0.999    H   23 0.988    H   21 0.988    H   22 0.986
     9  C   3.985        C    6 1.348    C   10 1.261    C   16 1.179
    10  C   3.953        C   11 1.378    C    9 1.261    S   14 1.096
    11  C   3.987        C    4 1.378    C   10 1.378    C   12 1.013    C    6 0.102
    12  C   3.996        C   11 1.013    C   13 0.999    H   24 0.968    H   25 0.968
    13  C   3.995        C   12 0.999    H   26 0.988    H   28 0.988    H   27 0.986
    14  S   2.518        C   15 1.139    C   10 1.096    C   16 0.102
    15  C   3.947        C   16 1.698    S   14 1.139    H   29 0.970
    16  C   3.985        C   15 1.698    C    9 1.179    H   30 0.960    S   14 0.102
    17  H   0.998        C    1 0.960
    18  H   0.998        C    2 0.970
    19  H   0.997        C    7 0.971
    20  H   0.997        C    7 0.971
    21  H   0.999        C    8 0.988
    22  H   0.997        C    8 0.986
    23  H   0.999        C    8 0.988
    24  H   0.998        C   12 0.968
    25  H   0.998        C   12 0.968
    26  H   0.998        C   13 0.988
    27  H   0.997        C   13 0.986
    28  H   0.998        C   13 0.988
    29  H   0.998        C   15 0.970
    30  H   0.998        C   16 0.960

molecular dipole:
                 x           y           z       tot (Debye)
 q only:        0.015      -0.283      -0.077
   full:        0.049      -0.832      -0.068       2.125
molecular quadrupole (traceless):
                xx          xy          yy          xz          yz          zz
 q only:       -1.585      -0.312       4.039       0.016      -0.297      -2.455
  q+dip:        2.558       0.045       3.213      -0.090      -0.350      -5.770
   full:        0.776       0.004       2.131      -0.026      -0.313      -2.906

           -------------------------------------------------
          |                Geometry Summary                 |
           -------------------------------------------------

      molecular mass/u    :      246.3846000
   center of mass at/Å    :       -0.0519094       0.2162478      -0.0636938
  moments of inertia/u·Å² :        0.9172796E+03   0.1130140E+04   0.1925200E+04
rotational constants/cm⁻¹ :        0.1837786E-01   0.1491641E-01   0.8756303E-02

 * 30 selected distances

     #   Z        #   Z                                     value/Å
     1   6 C      2   6 C                                 1.3461105
     2   6 C      3  16 S                                 1.7317841
     3  16 S      4   6 C                                 1.7444150 (max)
     1   6 C      5   6 C                                 1.4313803
     4   6 C      5   6 C                                 1.4158006
     5   6 C      6   6 C                                 1.3959512
     7   6 C      8   6 C                                 1.5301206
     6   6 C      9   6 C                                 1.3959211
     9   6 C     10   6 C                                 1.4158067
     4   6 C     11   6 C                                 1.3861650
    10   6 C     11   6 C                                 1.3861917
    12   6 C     13   6 C                                 1.5292574
    10   6 C     14  16 S                                 1.7443911
    14  16 S     15   6 C                                 1.7318085
     9   6 C     16   6 C                                 1.4314011
    15   6 C     16   6 C                                 1.3461103
     1   6 C     17   1 H                                 1.0750672
     2   6 C     18   1 H                                 1.0727998
     7   6 C     19   1 H                                 1.0909676
     7   6 C     20   1 H                                 1.0909722
     8   6 C     21   1 H                                 1.0877481
     8   6 C     22   1 H                                 1.0878178
     8   6 C     23   1 H                                 1.0877680
    12   6 C     24   1 H                                 1.0924032
    12   6 C     25   1 H                                 1.0924251
    13   6 C     26   1 H                                 1.0876701
    13   6 C     27   1 H                                 1.0871361
    13   6 C     28   1 H                                 1.0876895
    15   6 C     29   1 H                                 1.0727980 (min)
    16   6 C     30   1 H                                 1.0751001

 * 3 distinct bonds (by element types)

   Z      Z             #   av. dist./Å        max./Å        min./Å
   1 H    6 C          14     1.0848831     1.0924251     1.0727980
   6 C    6 C          12     1.4175180     1.5301206     1.3461103
   6 C   16 S           4     1.7380997     1.7444150     1.7317841


optimized geometry written to: xtbopt.xyz


           -------------------------------------------------
          | TOTAL ENERGY              -43.631339674105 Eh   |
          | GRADIENT NORM               0.000296592102 Eh/α |
          | HOMO-LUMO GAP               2.824385342473 eV   |
           -------------------------------------------------

------------------------------------------------------------------------
 * finished run on 2021/05/19 at 10:59:55.865     
------------------------------------------------------------------------
 total:
 * wall-time:     0 d,  0 h,  0 min,  0.945 sec
 *  cpu-time:     0 d,  0 h,  0 min,  0.942 sec
 * ratio c/w:     0.997 speedup
 SCF:
 * wall-time:     0 d,  0 h,  0 min,  0.060 sec
 *  cpu-time:     0 d,  0 h,  0 min,  0.060 sec
 * ratio c/w:     0.997 speedup
 ANC optimizer:
 * wall-time:     0 d,  0 h,  0 min,  0.858 sec
 *  cpu-time:     0 d,  0 h,  0 min,  0.856 sec
 * ratio c/w:     0.997 speedup

