      -----------------------------------------------------------      
     |                   =====================                   |     
     |                           x T B                           |     
     |                   =====================                   |     
     |                         S. Grimme                         |     
     |          Mulliken Center for Theoretical Chemistry        |     
     |                    University of Bonn                     |     
     |                Version 6.2 RC2 (SAW190805)                |     
      -----------------------------------------------------------      

   This program is distributed in the hope that it will be useful,
   but WITHOUT ANY WARRANTY; without even the implied warranty of
   MERCHANTABILITY or FITNESS FOR A PARTICULAR PURPOSE.
   
   FOR NON-COMMERCIAL, ACADEMIA USE ONLY.
   
   Cite this work as:
   * S. Grimme, C. Bannwarth, P. Shushkov, J. Chem. Theory Comput., 2017,
     13, 1989-2009. DOI: 10.1021/acs.jctc.7b00118
   * C. Bannwarth, S. Ehlert and S. Grimme., J. Chem. Theory Comput., 2019,
     15, 1652-1671. DOI: 10.1021/acs.jctc.8b01176
   * P. Pracht, E. Caldeweyher, S. Ehlert, S. Grimme, ChemRxiv, 2019, preprint.
     DOI: 10.26434/chemrxiv.8326202.v1
   
   for DFT-D4:
   * E. Caldeweyher, C. Bannwarth and S. Grimme, J. Chem. Phys., 2017,
     147, 034112. DOI: 10.1063/1.4993215
   * E. Caldeweyher, S. Ehlert, A. Hansen, H. Neugebauer, S. Spicher,
     C. Bannwarth and S. Grimme, J. Chem. Phys., 2019, 150, 154122.
     DOI: 10.1063/1.5090222
   
   for sTDA-xTB:
   * S. Grimme and C. Bannwarth, J. Chem. Phys., 2016, 145, 054103.
     DOI: 10.1063/1.4959605
   
   in the mass-spec context:
   * V. Asgeirsson, C. Bauer and S. Grimme, Chem. Sci., 2017, 8, 4879.
     DOI: 10.1039/c7sc00601b
   
   for metadynamics refer to:
   * S. Grimme, J. Chem. Theory Comput., 2019, 155, 2847-2862
     DOI: 10.1021/acs.jctc.9b00143
   
   with help from (in alphabetical order)
   C. Bannwarth, F. Bohle, G. Brandenburg, E. Caldeweyher, M. Checinski,
   S. Dohm, S. Ehlert, S. Ehrlich, F. März, H. Neugebauer, J. Pisarek,
   P. Pracht, P. Shushkov, and S. Spicher.
   
 * started run on 2021/05/19 at 10:58:41.764     

           -------------------------------------------------
          |                Calculation Setup                |
           -------------------------------------------------

          program call               : /ihome/ghutchison/geoffh/xtb/xtb 66.xyz -opt
          hostname                   : smp-n58
          coordinate file            : 66.xyz
          omp threads                :                     1
          number of atoms            :                    20
          number of electrons        :                    68
          charge                     :                     0
          spin                       :                   0.0
          first test random number   :      0.38266688563241


########################################################################
# WARNING! Please study the warnings concerning your input carefully
#  - the use of '-opt' is discouraged, please use '--opt' next time
########################################################################

           ------------------------------------------------- 
          |                 G F N 2 - x T B                 |
          | Geometry, Frequencies, Noncovalent interactions |
          |            JCTC 2019 parametrisation            |
           ------------------------------------------------- 
             KAB for C  - Si     :                1.0500
             KAB for H  - Pd     :                0.9500
             k(s)              :                1.8500
             k(p)              :                2.2300
             k(d)              :                2.2300
             k(f)              :                2.0000
             kEN (H0ij)        :               -2.0000
             D4 a1             :                0.5200
             D4 a2             :                5.0000
             D4 s6             :                1.0000
             D4 s8             :                2.7000
             D4 s9             :                5.0000
             alphaj            :                2.0000

  Z AO/shell   Hii/eV     exponent
  1     Wed Apr 25 08:07:45 CEST 2018   EN: 2.200 GM2: 0.406  GM3: 0.0800  RAES: 1.40
     1s    -10.707211    1.230000
  6     Wed Apr 25 08:07:45 CEST 2018   EN: 2.550 GM2: 0.538  GM3: 0.1500  RAES: 3.00
     2s    -13.970922    2.096432
     2p    -10.063292    1.800000
  8     Wed Apr 25 08:07:45 CEST 2018   EN: 3.440 GM2: 0.452  GM3:-0.0517  RAES: 1.80
     2s    -20.229985    2.439742
     2p    -15.503117    2.137023
  9     Mon Apr 23 13:58:50 CEST 2018   EN: 3.980 GM2: 0.532  GM3: 0.1426  RAES: 2.40
     2s    -23.458179    2.416361
     2p    -15.746583    2.308399
 16     Tue Apr 24 11:44:34 CEST 2018   EN: 2.580 GM2: 0.340  GM3:-0.0502  RAES: 3.10
     3s    -20.029654    1.981333
     3p    -11.377694    2.025643
     3d     -0.420282    1.702555

           ------------------------------------------------- 
          |        Self-Consistent Charge Iterations        |
           ------------------------------------------------- 

          ...................................................
          :                      SETUP                      :
          :.................................................:
          :  # basis functions                  71          :
          :  # atomic orbitals                  69          :
          :  # shells                           35          :
          :  # electrons                        68          :
          :  max. iterations                   250          :
          :  Hamiltonian                  GFN2-xTB          :
          :  restarted?                      false          :
          :  GBSA solvation                  false          :
          :  PC potential                    false          :
          :  electronic temp.          300.0000000     K    :
          :  accuracy                    1.0000000          :
          :  -> integral cutoff          0.2500000E+02      :
          :  -> integral neglect         0.1000000E-07      :
          :  -> SCF convergence          0.1000000E-05 Eh   :
          :  -> wf. convergence          0.1000000E-03 e    :
          :  Broyden damping             0.4000000          :
          ...................................................

 iter      E             dE          RMSdq      gap      omega  full diag
   1    -38.4550534 -0.384551E+02  0.498E+00    2.31       0.0  T
   2    -38.4858852 -0.308318E-01  0.271E+00    2.03       1.0  T
   3    -38.4808295  0.505572E-02  0.217E+00    2.21       1.0  T
   4    -38.5177576 -0.369281E-01  0.813E-01    2.06       1.0  T
   5    -38.5266188 -0.886119E-02  0.258E-01    2.06       1.0  T
   6    -38.5266857 -0.668783E-04  0.133E-01    2.05       1.0  T
   7    -38.5269004 -0.214723E-03  0.399E-02    2.06       1.0  T
   8    -38.5269178 -0.173668E-04  0.151E-02    2.05       1.5  T
   9    -38.5269178 -0.696870E-07  0.715E-03    2.06       3.1  T
  10    -38.5269182 -0.379669E-06  0.228E-03    2.05       9.8  T
  11    -38.5269182 -0.708181E-08  0.108E-03    2.05      20.8  T
  12    -38.5269182 -0.588984E-08  0.449E-04    2.05      49.8  T
  13    -38.5269182 -0.812619E-09  0.164E-04    2.05     135.9  T

   *** convergence criteria satisfied after 13 iterations ***

         #    Occupation            Energy/Eh            Energy/eV
      -------------------------------------------------------------
         1        2.0000           -0.8543515             -23.2481
       ...           ...                  ...                  ...
        28        2.0000           -0.4624748             -12.5846
        29        2.0000           -0.4516645             -12.2904
        30        2.0000           -0.4437263             -12.0744
        31        2.0000           -0.4422182             -12.0334
        32        2.0000           -0.4190382             -11.4026
        33        2.0000           -0.4010571             -10.9133
        34        2.0000           -0.3861945             -10.5089 (HOMO)
        35                         -0.3106883              -8.4543 (LUMO)
        36                         -0.2643183              -7.1925
        37                         -0.2442414              -6.6461
        38                         -0.2235859              -6.0841
        39                         -0.2104754              -5.7273
       ...                                ...                  ...
        69                          0.7310032              19.8916
      -------------------------------------------------------------
                  HL-Gap            0.0755062 Eh            2.0546 eV
             Fermi-level           -0.3484414 Eh           -9.4816 eV

 SCC (total)                   0 d,  0 h,  0 min,  0.038 sec
 SCC setup                      ...        0 min,  0.000 sec (  0.733%)
 Dispersion                     ...        0 min,  0.000 sec (  0.727%)
 integral evaluation            ...        0 min,  0.009 sec ( 24.696%)
 zeroth order Hamiltonian       ...        0 min,  0.000 sec (  0.437%)
 iterations                     ...        0 min,  0.015 sec ( 39.343%)
 molecular gradient             ...        0 min,  0.013 sec ( 32.995%)
 printout                       ...        0 min,  0.000 sec (  0.927%)

         :::::::::::::::::::::::::::::::::::::::::::::::::::::
         ::                     SUMMARY                     ::
         :::::::::::::::::::::::::::::::::::::::::::::::::::::
         :: total energy             -38.093240088091 Eh    ::
         :: gradient norm              0.101909191942 Eh/a0 ::
         :: HOMO-LUMO gap              2.054628666126 eV    ::
         ::.................................................::
         :: SCC energy               -38.526918225185 Eh    ::
         :: -> isotropic ES            0.036727772671 Eh    ::
         :: -> anisotropic ES          0.002251656785 Eh    ::
         :: -> anisotropic XC          0.006618283134 Eh    ::
         :: -> dispersion             -0.021431218133 Eh    ::
         :: repulsion energy           0.433748883579 Eh    ::
         :: add. restraining           0.000000000000 Eh    ::
         :::::::::::::::::::::::::::::::::::::::::::::::::::::

      ----------------------------------------------------------- 
     |                   =====================                   |
     |                        A N C O P T                        |
     |                   =====================                   |
     |               Approximate Normal Coordinate               |
     |                Rational Function Optimizer                |
      ----------------------------------------------------------- 

          ...................................................
          :                      SETUP                      :
          :.................................................:
          :   optimization level            normal          :
          :   max. optcycles                   200          :
          :   ANC micro-cycles                  20          :
          :   degrees of freedom                54          :
          :.................................................:
          :   RF solver                   davidson          :
          :   input Hessian                  false          :
          :   write xtbopt.log                true          :
          :   linear?                        false          :
          :   energy convergence         0.5000000E-05 Eh   :
          :   grad. convergence          0.1000000E-02 Eh/α :
          :   maximium RF displ.         2.0000000          :
          :   Hlow (freq-cutoff)         0.5000000E-02      :
          :   Hmax (freq-cutoff)         5.0000000          :
          :   S6 in model hess.         20.0000000          :
          ...................................................

generating ANC from model Hessian ...
Using Lindh-Hessian (1995)
 Shifting diagonal of input Hessian by   3.915690992478195E-003
 Lowest  eigenvalues of input Hessian
   -0.000000   -0.000000   -0.000000   -0.000000    0.000000    0.000000
    0.005000    0.006598    0.007450    0.011063    0.013875    0.016231
    0.016609    0.023234    0.026737    0.036267    0.046431    0.048247
 Highest eigenvalues
    1.546295    1.694704    1.836670    2.040119    2.116304    2.146364
 

........................................................................
.............................. CYCLE    1 ..............................
........................................................................
   1    -38.5269182 -0.385269E+02  0.665E-05    2.05       0.0  T
   2    -38.5269182 -0.129887E-10  0.456E-05    2.05     490.8  T
   3    -38.5269182 -0.117950E-10  0.271E-05    2.05     824.1  T
     SCC iter.                  ...        0 min,  0.004 sec
     gradient                   ...        0 min,  0.013 sec
 * total energy  :   -38.0932401 Eh     change        0.2798895E-07 Eh
   gradient norm :     0.1019096 Eh/α   predicted     0.0000000E+00 (-100.00%)
   displ. norm   :     0.2206714 α      lambda       -0.1332637E-01
   maximum displ.:     0.1389475 α      in ANC's #20, #25, #22, ...

........................................................................
.............................. CYCLE    2 ..............................
........................................................................
   1    -38.5420370 -0.385420E+02  0.453E-01    2.12       0.0  T
   2    -38.5420622 -0.251636E-04  0.272E-01    2.12       1.0  T
   3    -38.5418960  0.166184E-03  0.196E-01    2.11       1.0  T
   4    -38.5425041 -0.608074E-03  0.564E-02    2.11       1.0  T
   5    -38.5425227 -0.186259E-04  0.310E-02    2.11       1.0  T
   6    -38.5425287 -0.594955E-05  0.109E-02    2.11       2.1  T
   7    -38.5425299 -0.125143E-05  0.290E-03    2.11       7.7  T
   8    -38.5425299 -0.326228E-07  0.159E-03    2.11      14.1  T
     SCC iter.                  ...        0 min,  0.008 sec
     gradient                   ...        0 min,  0.011 sec
 * total energy  :   -38.1019244 Eh     change       -0.8684300E-02 Eh
   gradient norm :     0.0407066 Eh/α   predicted    -0.6987704E-02 ( -19.54%)
   displ. norm   :     0.1269717 α      lambda       -0.2377443E-02
   maximum displ.:     0.0722698 α      in ANC's #20, #3, #25, ...

........................................................................
.............................. CYCLE    3 ..............................
........................................................................
   1    -38.5480249 -0.385480E+02  0.227E-01    2.14       0.0  T
   2    -38.5480610 -0.360807E-04  0.131E-01    2.14       1.0  T
   3    -38.5480145  0.465234E-04  0.922E-02    2.14       1.0  T
   4    -38.5481337 -0.119245E-03  0.322E-02    2.14       1.0  T
   5    -38.5481407 -0.698725E-05  0.165E-02    2.14       1.4  T
   6    -38.5481426 -0.185135E-05  0.564E-03    2.14       4.0  T
   7    -38.5481429 -0.298613E-06  0.201E-03    2.14      11.1  T
     SCC iter.                  ...        0 min,  0.007 sec
     gradient                   ...        0 min,  0.011 sec
 * total energy  :   -38.1032763 Eh     change       -0.1351966E-02 Eh
   gradient norm :     0.0117113 Eh/α   predicted    -0.1207890E-02 ( -10.66%)
   displ. norm   :     0.0818620 α      lambda       -0.2237297E-03
   maximum displ.:     0.0680660 α      in ANC's #3, #9, #7, ...

........................................................................
.............................. CYCLE    4 ..............................
........................................................................
   1    -38.5479767 -0.385480E+02  0.640E-02    2.14       0.0  T
   2    -38.5479821 -0.538662E-05  0.361E-02    2.14       1.0  T
   3    -38.5479810  0.113677E-05  0.227E-02    2.14       1.0  T
   4    -38.5479847 -0.369673E-05  0.814E-03    2.14       2.7  T
   5    -38.5479852 -0.511172E-06  0.366E-03    2.14       6.1  T
   6    -38.5479853 -0.694981E-07  0.166E-03    2.14      13.4  T
   7    -38.5479853 -0.165015E-07  0.117E-03    2.14      19.2  T
     SCC iter.                  ...        0 min,  0.008 sec
     gradient                   ...        0 min,  0.012 sec
 * total energy  :   -38.1034309 Eh     change       -0.1545392E-03 Eh
   gradient norm :     0.0049116 Eh/α   predicted    -0.1126249E-03 ( -27.12%)
   displ. norm   :     0.0749222 α      lambda       -0.8271948E-04
   maximum displ.:     0.0682352 α      in ANC's #3, #9, #7, ...

........................................................................
.............................. CYCLE    5 ..............................
........................................................................
   1    -38.5477467 -0.385477E+02  0.462E-02    2.14       0.0  T
   2    -38.5477480 -0.129238E-05  0.267E-02    2.14       1.0  T
   3    -38.5477453  0.266250E-05  0.192E-02    2.14       1.2  T
   4    -38.5477490 -0.369967E-05  0.710E-03    2.14       3.1  T
   5    -38.5477495 -0.470568E-06  0.308E-03    2.14       7.3  T
   6    -38.5477496 -0.533995E-07  0.165E-03    2.14      13.5  T
   7    -38.5477496 -0.194528E-07  0.746E-04    2.14      30.0  T
     SCC iter.                  ...        0 min,  0.008 sec
     gradient                   ...        0 min,  0.012 sec
 * total energy  :   -38.1034822 Eh     change       -0.5135199E-04 Eh
   gradient norm :     0.0014645 Eh/α   predicted    -0.4159472E-04 ( -19.00%)
   displ. norm   :     0.0565138 α      lambda       -0.1461684E-04
   maximum displ.:     0.0550117 α      in ANC's #3, #9, #7, ...

........................................................................
.............................. CYCLE    6 ..............................
........................................................................
   1    -38.5478399 -0.385478E+02  0.290E-02    2.14       0.0  T
   2    -38.5478399  0.322437E-07  0.172E-02    2.14       1.3  T
   3    -38.5478376  0.231200E-05  0.140E-02    2.14       1.6  T
   4    -38.5478405 -0.290178E-05  0.324E-03    2.14       6.9  T
   5    -38.5478405 -0.378148E-07  0.149E-03    2.14      15.0  T
   6    -38.5478406 -0.182997E-07  0.667E-04    2.14      33.5  T
   7    -38.5478406 -0.655376E-09  0.394E-04    2.14      56.8  T
     SCC iter.                  ...        0 min,  0.007 sec
     gradient                   ...        0 min,  0.012 sec
 * total energy  :   -38.1034962 Eh     change       -0.1402957E-04 Eh
   gradient norm :     0.0014130 Eh/α   predicted    -0.7319706E-05 ( -47.83%)
   displ. norm   :     0.0564993 α      lambda        0.7692744E-05
   maximum displ.:     0.0550078 α      in ANC's #3, #9, #7, ...

........................................................................
.............................. CYCLE    7 ..............................
........................................................................
   1    -38.5478707 -0.385479E+02  0.290E-02    2.14       0.0  T
   2    -38.5478706  0.402612E-07  0.172E-02    2.14       1.3  T
   3    -38.5478683  0.232107E-05  0.140E-02    2.14       1.6  T
   4    -38.5478712 -0.292434E-05  0.320E-03    2.14       7.0  T
   5    -38.5478713 -0.351595E-07  0.146E-03    2.14      15.3  T
   6    -38.5478713 -0.180024E-07  0.658E-04    2.14      34.0  T
   7    -38.5478713 -0.641855E-09  0.381E-04    2.14      58.6  T
     SCC iter.                  ...        0 min,  0.007 sec
     gradient                   ...        0 min,  0.012 sec
 * total energy  :   -38.1034945 Eh     change        0.1789619E-05 Eh
   gradient norm :     0.0029102 Eh/α   predicted     0.3851313E-05 ( 115.20%)
   displ. norm   :     0.0088401 α      lambda       -0.9096929E-05
   maximum displ.:     0.0051937 α      in ANC's #3, #7, #9, ...

........................................................................
.............................. CYCLE    8 ..............................
........................................................................
   1    -38.5479403 -0.385479E+02  0.958E-03    2.14       0.0  T
   2    -38.5479404 -0.417373E-07  0.577E-03    2.14       3.9  T
   3    -38.5479402  0.107562E-06  0.442E-03    2.14       5.1  T
   4    -38.5479405 -0.231534E-06  0.132E-03    2.14      16.9  T
   5    -38.5479405 -0.134661E-07  0.637E-04    2.14      35.1  T
   6    -38.5479405 -0.220678E-08  0.284E-04    2.14      78.7  T
     SCC iter.                  ...        0 min,  0.006 sec
     gradient                   ...        0 min,  0.012 sec
 * total energy  :   -38.1035013 Eh     change       -0.6797748E-05 Eh
   gradient norm :     0.0015932 Eh/α   predicted    -0.4549314E-05 ( -33.08%)
   displ. norm   :     0.0132248 α      lambda       -0.4387691E-05
   maximum displ.:     0.0077816 α      in ANC's #3, #7, #9, ...

........................................................................
.............................. CYCLE    9 ..............................
........................................................................
   1    -38.5480344 -0.385480E+02  0.144E-02    2.14       0.0  T
   2    -38.5480345 -0.989985E-07  0.869E-03    2.14       2.6  T
   3    -38.5480342  0.235451E-06  0.664E-03    2.14       3.4  T
   4    -38.5480347 -0.514148E-06  0.202E-03    2.14      11.1  T
   5    -38.5480348 -0.321637E-07  0.970E-04    2.14      23.1  T
   6    -38.5480348 -0.497870E-08  0.440E-04    2.14      50.8  T
     SCC iter.                  ...        0 min,  0.007 sec
     gradient                   ...        0 min,  0.013 sec
 * total energy  :   -38.1035028 Eh     change       -0.1583429E-05 Eh
   gradient norm :     0.0007782 Eh/α   predicted    -0.2195529E-05 (  38.66%)
   displ. norm   :     0.0132295 α      lambda        0.1165310E-04
   maximum displ.:     0.0077780 α      in ANC's #3, #7, #9, ...

   *** GEOMETRY OPTIMIZATION CONVERGED AFTER 9 ITERATIONS ***

------------------------------------------------------------------------
 total energy gain   :        -0.0102628 Eh       -6.4400 kcal/mol
 total RMSD          :         0.1063334 a0        0.0563 Å
 total power (kW/mol):        -2.9938720 (step) -104.3249 (real)
------------------------------------------------------------------------

 ANCopt (total)                0 d,  0 h,  0 min,  0.258 sec
 optimizer setup                ...        0 min,  0.000 sec (  0.058%)
 model hessian                  ...        0 min,  0.002 sec (  0.793%)
 ANC generation                 ...        0 min,  0.001 sec (  0.204%)
 coordinate transformation      ...        0 min,  0.000 sec (  0.045%)
 single point calculation       ...        0 min,  0.253 sec ( 98.050%)
 optimization log               ...        0 min,  0.001 sec (  0.281%)
 hessian update                 ...        0 min,  0.000 sec (  0.036%)
 rational function              ...        0 min,  0.001 sec (  0.326%)

================
 final structure:
================
$coord
    3.43733376020575   -1.79464501257164    0.01879003409049      C 
    4.81051975725295    1.15632624605669   -0.05174624304170      S 
    1.95172341465388    2.67105657036158   -0.08848409433577      C 
    0.00261816915387    0.96703959123242   -0.04888236583929      C 
    0.87632471367123   -1.59701204035036    0.01253736048416      C 
   -1.60586082917075   -3.75416521986343    0.06171133046787      S 
   -3.81448113852454   -1.26333729494050    0.00361555850770      C 
   -6.48554895820172   -2.00951883958304    0.02367200665099      C 
   -7.05432293557157   -4.22454250528769    0.07214637701826      O 
   -8.39003502318454    0.11689551254457   -0.02538512268260      C 
  -11.08936432344202   -0.87371049075901   -0.00072828010534      C 
   -2.68374550852318    1.05322670606529   -0.05196601063532      C 
   -3.94250952520124    3.25036972256904   -0.10431391430493      F 
    4.59234018330392   -3.45321687335182    0.05884082913165      H 
    1.85826095883104    4.69175357589413   -0.13680085028637      H 
   -8.04957764403222    1.25788404210771   -1.71307940922270      H 
   -8.04759220529744    1.33402988226191    1.60772285648773      H 
  -11.42120818972223   -2.07073342853618   -1.63662127739057      H 
  -12.42385294563113    0.68711750473553   -0.03258574654528      H 
  -11.41675886031747   -1.99903746143204    1.68613395527900      H 
$end
           -------------------------------------------------
          |                Final Singlepoint                |
           -------------------------------------------------

          ...................................................
          :                      SETUP                      :
          :.................................................:
          :  # basis functions                  71          :
          :  # atomic orbitals                  69          :
          :  # shells                           35          :
          :  # electrons                        68          :
          :  max. iterations                   250          :
          :  Hamiltonian                  GFN2-xTB          :
          :  restarted?                      false          :
          :  GBSA solvation                  false          :
          :  PC potential                    false          :
          :  electronic temp.          300.0000000     K    :
          :  accuracy                    1.0000000          :
          :  -> integral cutoff          0.2500000E+02      :
          :  -> integral neglect         0.1000000E-07      :
          :  -> SCF convergence          0.1000000E-05 Eh   :
          :  -> wf. convergence          0.1000000E-03 e    :
          :  Broyden damping             0.4000000          :
          ...................................................

 iter      E             dE          RMSdq      gap      omega  full diag
   1    -38.5480348 -0.385480E+02  0.208E-04    2.14       0.0  T
   2    -38.5480348 -0.434213E-10  0.112E-04    2.14     199.2  T
   3    -38.5480348 -0.121148E-10  0.870E-05    2.14     257.1  T

   *** convergence criteria satisfied after 3 iterations ***

         #    Occupation            Energy/Eh            Energy/eV
      -------------------------------------------------------------
         1        2.0000           -0.8429519             -22.9379
       ...           ...                  ...                  ...
        28        2.0000           -0.4655093             -12.6672
        29        2.0000           -0.4560567             -12.4099
        30        2.0000           -0.4470211             -12.1641
        31        2.0000           -0.4430472             -12.0559
        32        2.0000           -0.4173720             -11.3573
        33        2.0000           -0.4045092             -11.0073
        34        2.0000           -0.3860098             -10.5039 (HOMO)
        35                         -0.3073471              -8.3633 (LUMO)
        36                         -0.2604804              -7.0880
        37                         -0.2346447              -6.3850
        38                         -0.2201528              -5.9907
        39                         -0.2090017              -5.6872
       ...                                ...                  ...
        69                          0.7218445              19.6424
      -------------------------------------------------------------
                  HL-Gap            0.0786627 Eh            2.1405 eV
             Fermi-level           -0.3466784 Eh           -9.4336 eV

 SCC (total)                   0 d,  0 h,  0 min,  0.026 sec
 SCC setup                      ...        0 min,  0.000 sec (  0.608%)
 Dispersion                     ...        0 min,  0.000 sec (  0.485%)
 integral evaluation            ...        0 min,  0.009 sec ( 33.890%)
 zeroth order Hamiltonian       ...        0 min,  0.000 sec (  0.554%)
 iterations                     ...        0 min,  0.004 sec ( 14.548%)
 molecular gradient             ...        0 min,  0.013 sec ( 48.537%)
 printout                       ...        0 min,  0.000 sec (  1.170%)

         :::::::::::::::::::::::::::::::::::::::::::::::::::::
         ::                     SUMMARY                     ::
         :::::::::::::::::::::::::::::::::::::::::::::::::::::
         :: total energy             -38.103502860157 Eh    ::
         :: gradient norm              0.000777622059 Eh/a0 ::
         :: HOMO-LUMO gap              2.140520983931 eV    ::
         ::.................................................::
         :: SCC energy               -38.548034788818 Eh    ::
         :: -> isotropic ES            0.036319434499 Eh    ::
         :: -> anisotropic ES          0.002293367426 Eh    ::
         :: -> anisotropic XC          0.006492538944 Eh    ::
         :: -> dispersion             -0.021505139327 Eh    ::
         :: repulsion energy           0.444608776401 Eh    ::
         :: add. restraining           0.000000000000 Eh    ::
         :::::::::::::::::::::::::::::::::::::::::::::::::::::

           -------------------------------------------------
          |                Property Printout                |
           -------------------------------------------------

    * Orbital Energies and Occupations

         #    Occupation            Energy/Eh            Energy/eV
      -------------------------------------------------------------
         1        2.0000           -0.8429519             -22.9379
       ...           ...                  ...                  ...
        22        2.0000           -0.5017597             -13.6536
        23        2.0000           -0.4995559             -13.5936
        24        2.0000           -0.4903597             -13.3434
        25        2.0000           -0.4899927             -13.3334
        26        2.0000           -0.4717836             -12.8379
        27        2.0000           -0.4659806             -12.6800
        28        2.0000           -0.4655093             -12.6672
        29        2.0000           -0.4560567             -12.4099
        30        2.0000           -0.4470211             -12.1641
        31        2.0000           -0.4430472             -12.0559
        32        2.0000           -0.4173720             -11.3573
        33        2.0000           -0.4045092             -11.0073
        34        2.0000           -0.3860098             -10.5039 (HOMO)
        35                         -0.3073471              -8.3633 (LUMO)
        36                         -0.2604804              -7.0880
        37                         -0.2346447              -6.3850
        38                         -0.2201528              -5.9907
        39                         -0.2090017              -5.6872
        40                         -0.1639580              -4.4615
        41                         -0.1496324              -4.0717
        42                         -0.1288777              -3.5069
        43                         -0.0278473              -0.7578
        44                         -0.0180714              -0.4917
        45                          0.0011997               0.0326
       ...                                ...                  ...
        69                          0.7218445              19.6424
      -------------------------------------------------------------
                  HL-Gap            0.0786627 Eh            2.1405 eV
             Fermi-level           -0.3466784 Eh           -9.4336 eV

     #   Z        covCN         q      C6AA      α(0)
     1   6 C      2.936    -0.040    29.006     8.833
     2  16 S      2.348     0.050   139.021    19.845
     3   6 C      2.926    -0.027    28.688     8.784
     4   6 C      3.312    -0.021    26.500     8.215
     5   6 C      3.212     0.016    26.997     8.456
     6  16 S      2.232    -0.003   141.164    19.997
     7   6 C      2.977    -0.027    28.668     8.783
     8   6 C      2.856     0.234    23.108     7.879
     9   8 O      0.859    -0.353    20.762     6.109
    10   6 C      3.803    -0.077    21.963     6.672
    11   6 C      3.753    -0.101    22.487     6.762
    12   6 C      2.907     0.155    24.644     8.140
    13   9 F      0.785    -0.209    11.329     3.976
    14   1 H      0.927     0.065     2.145     2.290
    15   1 H      0.927     0.067     2.118     2.276
    16   1 H      0.924     0.064     2.148     2.292
    17   1 H      0.924     0.064     2.149     2.292
    18   1 H      0.925     0.051     2.304     2.374
    19   1 H      0.925     0.040     2.454     2.450
    20   1 H      0.925     0.051     2.303     2.373

 Mol. C6AA /au·bohr⁶  :       7637.176964
 Mol. C8AA /au·bohr⁸  :     230784.509906
 Mol. α(0) /au        :        138.796580


Wiberg/Mayer (AO) data.
largest (>0.10) Wiberg bond orders for each atom
          total WBO             WBO to atom ...
     1  C   3.944        C    5 1.559    S    2 1.197    H   14 0.968    C    3 0.131
     2  S   2.695        C    3 1.244    C    1 1.197
     3  C   3.938        C    4 1.481    S    2 1.244    H   15 0.967    C    1 0.131
     4  C   3.982        C    3 1.481    C   12 1.164    C    5 1.163
     5  C   3.961        C    1 1.559    C    4 1.163    S    6 1.093
     6  S   2.518        C    5 1.093    C    7 1.085    C   12 0.100
     7  C   3.953        C   12 1.535    S    6 1.085    C    8 1.060
     8  C   3.932        O    9 1.803    C    7 1.060    C   10 0.987
     9  O   2.064        C    8 1.803
    10  C   3.996        C   11 1.019    C    8 0.987    H   17 0.950    H   16 0.950
    11  C   3.993        C   10 1.019    H   19 0.987    H   18 0.986    H   20 0.986
    12  C   3.882        C    7 1.535    C    4 1.164    F   13 0.968    S    6 0.100
    13  F   1.117        C   12 0.968
    14  H   0.995        C    1 0.968
    15  H   0.995        C    3 0.967
    16  H   0.995        C   10 0.950
    17  H   0.995        C   10 0.950
    18  H   0.997        C   11 0.986
    19  H   0.998        C   11 0.987
    20  H   0.997        C   11 0.986

molecular dipole:
                 x           y           z       tot (Debye)
 q only:        1.034       0.715      -0.015
   full:        0.820       1.000      -0.022       3.287
molecular quadrupole (traceless):
                xx          xy          yy          xz          yz          zz
 q only:        4.078      -8.476      -6.174       0.144       0.162       2.096
  q+dip:        2.227     -11.486      -7.090       0.219       0.234       4.862
   full:        1.618     -11.957      -7.742       0.230       0.279       6.123

           -------------------------------------------------
          |                Geometry Summary                 |
           -------------------------------------------------

      molecular mass/u    :      214.2721000
   center of mass at/Å    :       -1.0987930      -0.2999732      -0.0063209
  moments of inertia/u·Å² :        0.3147996E+03   0.1390544E+04   0.1699112E+04
rotational constants/cm⁻¹ :        0.5355036E-01   0.1212305E-01   0.9921438E-02

 * 18 selected distances

     #   Z        #   Z                                     value/Å
     1   6 C      2  16 S                                 1.7227826
     2  16 S      3   6 C                                 1.7121542
     3   6 C      4   6 C                                 1.3701761
     1   6 C      5   6 C                                 1.3592611
     4   6 C      5   6 C                                 1.4338161
     5   6 C      6  16 S                                 1.7404199 (max)
     8   6 C      9   8 O                                 1.2104383
    10   6 C     11   6 C                                 1.5216296
     4   6 C     12   6 C                                 1.4222949
     7   6 C     12   6 C                                 1.3644280
    12   6 C     13   9 F                                 1.3402572
     1   6 C     14   1 H                                 1.0697374 (min)
     3   6 C     15   1 H                                 1.0707554
    10   6 C     16   1 H                                 1.0929884
    10   6 C     17   1 H                                 1.0929432
    11   6 C     18   1 H                                 1.0869577
    11   6 C     19   1 H                                 1.0868197
    11   6 C     20   1 H                                 1.0869476

 * 5 distinct bonds (by element types)

   Z      Z             #   av. dist./Å        max./Å        min./Å
   1 H    6 C           7     1.0838785     1.0929884     1.0697374
   6 C    6 C           6     1.4119343     1.5216296     1.3592611
   6 C    8 O           1     1.2104383     1.2104383     1.2104383
   6 C    9 F           1     1.3402572     1.3402572     1.3402572
   6 C   16 S           3     1.7251189     1.7404199     1.7121542


optimized geometry written to: xtbopt.xyz


           -------------------------------------------------
          | TOTAL ENERGY              -38.103502860157 Eh   |
          | GRADIENT NORM               0.000777622059 Eh/α |
          | HOMO-LUMO GAP               2.140520983931 eV   |
           -------------------------------------------------

------------------------------------------------------------------------
 * finished run on 2021/05/19 at 10:58:42.108     
------------------------------------------------------------------------
 total:
 * wall-time:     0 d,  0 h,  0 min,  0.344 sec
 *  cpu-time:     0 d,  0 h,  0 min,  0.344 sec
 * ratio c/w:     0.999 speedup
 SCF:
 * wall-time:     0 d,  0 h,  0 min,  0.038 sec
 *  cpu-time:     0 d,  0 h,  0 min,  0.038 sec
 * ratio c/w:     1.000 speedup
 ANC optimizer:
 * wall-time:     0 d,  0 h,  0 min,  0.285 sec
 *  cpu-time:     0 d,  0 h,  0 min,  0.285 sec
 * ratio c/w:     1.000 speedup

