      -----------------------------------------------------------      
     |                   =====================                   |     
     |                           x T B                           |     
     |                   =====================                   |     
     |                         S. Grimme                         |     
     |          Mulliken Center for Theoretical Chemistry        |     
     |                    University of Bonn                     |     
     |                Version 6.2 RC2 (SAW190805)                |     
      -----------------------------------------------------------      

   This program is distributed in the hope that it will be useful,
   but WITHOUT ANY WARRANTY; without even the implied warranty of
   MERCHANTABILITY or FITNESS FOR A PARTICULAR PURPOSE.
   
   FOR NON-COMMERCIAL, ACADEMIA USE ONLY.
   
   Cite this work as:
   * S. Grimme, C. Bannwarth, P. Shushkov, J. Chem. Theory Comput., 2017,
     13, 1989-2009. DOI: 10.1021/acs.jctc.7b00118
   * C. Bannwarth, S. Ehlert and S. Grimme., J. Chem. Theory Comput., 2019,
     15, 1652-1671. DOI: 10.1021/acs.jctc.8b01176
   * P. Pracht, E. Caldeweyher, S. Ehlert, S. Grimme, ChemRxiv, 2019, preprint.
     DOI: 10.26434/chemrxiv.8326202.v1
   
   for DFT-D4:
   * E. Caldeweyher, C. Bannwarth and S. Grimme, J. Chem. Phys., 2017,
     147, 034112. DOI: 10.1063/1.4993215
   * E. Caldeweyher, S. Ehlert, A. Hansen, H. Neugebauer, S. Spicher,
     C. Bannwarth and S. Grimme, J. Chem. Phys., 2019, 150, 154122.
     DOI: 10.1063/1.5090222
   
   for sTDA-xTB:
   * S. Grimme and C. Bannwarth, J. Chem. Phys., 2016, 145, 054103.
     DOI: 10.1063/1.4959605
   
   in the mass-spec context:
   * V. Asgeirsson, C. Bauer and S. Grimme, Chem. Sci., 2017, 8, 4879.
     DOI: 10.1039/c7sc00601b
   
   for metadynamics refer to:
   * S. Grimme, J. Chem. Theory Comput., 2019, 155, 2847-2862
     DOI: 10.1021/acs.jctc.9b00143
   
   with help from (in alphabetical order)
   C. Bannwarth, F. Bohle, G. Brandenburg, E. Caldeweyher, M. Checinski,
   S. Dohm, S. Ehlert, S. Ehrlich, F. März, H. Neugebauer, J. Pisarek,
   P. Pracht, P. Shushkov, and S. Spicher.
   
 * started run on 2021/05/19 at 10:59:57.241     

           -------------------------------------------------
          |                Calculation Setup                |
           -------------------------------------------------

          program call               : /ihome/ghutchison/geoffh/xtb/xtb 662.xyz -opt
          hostname                   : smp-n144
          coordinate file            : 662.xyz
          omp threads                :                     1
          number of atoms            :                    23
          number of electrons        :                    66
          charge                     :                     0
          spin                       :                   0.0
          first test random number   :      0.43550200109261


########################################################################
# WARNING! Please study the warnings concerning your input carefully
#  - the use of '-opt' is discouraged, please use '--opt' next time
########################################################################

           ------------------------------------------------- 
          |                 G F N 2 - x T B                 |
          | Geometry, Frequencies, Noncovalent interactions |
          |            JCTC 2019 parametrisation            |
           ------------------------------------------------- 
             KAB for C  - Si     :                1.0500
             KAB for H  - Pd     :                0.9500
             k(s)              :                1.8500
             k(p)              :                2.2300
             k(d)              :                2.2300
             k(f)              :                2.0000
             kEN (H0ij)        :               -2.0000
             D4 a1             :                0.5200
             D4 a2             :                5.0000
             D4 s6             :                1.0000
             D4 s8             :                2.7000
             D4 s9             :                5.0000
             alphaj            :                2.0000

  Z AO/shell   Hii/eV     exponent
  1     Wed Apr 25 08:07:45 CEST 2018   EN: 2.200 GM2: 0.406  GM3: 0.0800  RAES: 1.40
     1s    -10.707211    1.230000
  6     Wed Apr 25 08:07:45 CEST 2018   EN: 2.550 GM2: 0.538  GM3: 0.1500  RAES: 3.00
     2s    -13.970922    2.096432
     2p    -10.063292    1.800000
  7     Wed Apr 25 08:07:45 CEST 2018   EN: 3.040 GM2: 0.461  GM3:-0.0640  RAES: 1.90
     2s    -16.686243    2.339881
     2p    -12.523956    2.014332
 16     Tue Apr 24 11:44:34 CEST 2018   EN: 2.580 GM2: 0.340  GM3:-0.0502  RAES: 3.10
     3s    -20.029654    1.981333
     3p    -11.377694    2.025643
     3d     -0.420282    1.702555

           ------------------------------------------------- 
          |        Self-Consistent Charge Iterations        |
           ------------------------------------------------- 

          ...................................................
          :                      SETUP                      :
          :.................................................:
          :  # basis functions                  68          :
          :  # atomic orbitals                  67          :
          :  # shells                           37          :
          :  # electrons                        66          :
          :  max. iterations                   250          :
          :  Hamiltonian                  GFN2-xTB          :
          :  restarted?                      false          :
          :  GBSA solvation                  false          :
          :  PC potential                    false          :
          :  electronic temp.          300.0000000     K    :
          :  accuracy                    1.0000000          :
          :  -> integral cutoff          0.2500000E+02      :
          :  -> integral neglect         0.1000000E-07      :
          :  -> SCF convergence          0.1000000E-05 Eh   :
          :  -> wf. convergence          0.1000000E-03 e    :
          :  Broyden damping             0.4000000          :
          ...................................................

 iter      E             dE          RMSdq      gap      omega  full diag
   1    -36.0354650 -0.360355E+02  0.419E+00    1.81       0.0  T
   2    -36.0636732 -0.282082E-01  0.251E+00    1.71       1.0  T
   3    -36.0547388  0.893435E-02  0.119E+00    1.56       1.0  T
   4    -36.0708512 -0.161124E-01  0.395E-01    1.47       1.0  T
   5    -36.0726226 -0.177134E-02  0.176E-01    1.48       1.0  T
   6    -36.0731021 -0.479516E-03  0.909E-02    1.49       1.0  T
   7    -36.0731997 -0.976240E-04  0.459E-02    1.49       1.0  T
   8    -36.0732342 -0.345095E-04  0.162E-02    1.49       1.3  T
   9    -36.0732364 -0.219559E-05  0.728E-03    1.49       2.9  T
  10    -36.0732366 -0.131254E-06  0.225E-03    1.49       9.3  T
  11    -36.0732366  0.205343E-08  0.160E-03    1.49      13.0  T
  12    -36.0732366 -0.337955E-07  0.522E-04    1.49      39.9  T
  13    -36.0732366 -0.137403E-08  0.260E-04    1.49      80.2  T

   *** convergence criteria satisfied after 13 iterations ***

         #    Occupation            Energy/Eh            Energy/eV
      -------------------------------------------------------------
         1        2.0000           -0.7398083             -20.1312
       ...           ...                  ...                  ...
        27        2.0000           -0.4477215             -12.1831
        28        2.0000           -0.4387208             -11.9382
        29        2.0000           -0.4274647             -11.6319
        30        2.0000           -0.4163033             -11.3282
        31        2.0000           -0.4011588             -10.9161
        32        2.0000           -0.3680334             -10.0147
        33        2.0000           -0.3630983              -9.8804 (HOMO)
        34                         -0.3083190              -8.3898 (LUMO)
        35                         -0.2476919              -6.7400
        36                         -0.2172900              -5.9128
        37                         -0.2044712              -5.5639
        38                         -0.1754124              -4.7732
       ...                                ...                  ...
        67                          0.6984988              19.0071
      -------------------------------------------------------------
                  HL-Gap            0.0547793 Eh            1.4906 eV
             Fermi-level           -0.3357086 Eh           -9.1351 eV

 SCC (total)                   0 d,  0 h,  0 min,  0.038 sec
 SCC setup                      ...        0 min,  0.000 sec (  0.792%)
 Dispersion                     ...        0 min,  0.000 sec (  0.922%)
 integral evaluation            ...        0 min,  0.009 sec ( 22.624%)
 zeroth order Hamiltonian       ...        0 min,  0.000 sec (  0.466%)
 iterations                     ...        0 min,  0.015 sec ( 38.890%)
 molecular gradient             ...        0 min,  0.013 sec ( 35.134%)
 printout                       ...        0 min,  0.000 sec (  1.030%)

         :::::::::::::::::::::::::::::::::::::::::::::::::::::
         ::                     SUMMARY                     ::
         :::::::::::::::::::::::::::::::::::::::::::::::::::::
         :: total energy             -35.560823869050 Eh    ::
         :: gradient norm              0.112233802525 Eh/a0 ::
         :: HOMO-LUMO gap              1.490621071943 eV    ::
         ::.................................................::
         :: SCC energy               -36.073236594841 Eh    ::
         :: -> isotropic ES            0.019739655214 Eh    ::
         :: -> anisotropic ES          0.004087286877 Eh    ::
         :: -> anisotropic XC          0.027980724235 Eh    ::
         :: -> dispersion             -0.023390682100 Eh    ::
         :: repulsion energy           0.512404616805 Eh    ::
         :: add. restraining           0.000000000000 Eh    ::
         :::::::::::::::::::::::::::::::::::::::::::::::::::::

      ----------------------------------------------------------- 
     |                   =====================                   |
     |                        A N C O P T                        |
     |                   =====================                   |
     |               Approximate Normal Coordinate               |
     |                Rational Function Optimizer                |
      ----------------------------------------------------------- 

          ...................................................
          :                      SETUP                      :
          :.................................................:
          :   optimization level            normal          :
          :   max. optcycles                   200          :
          :   ANC micro-cycles                  20          :
          :   degrees of freedom                63          :
          :.................................................:
          :   RF solver                   davidson          :
          :   input Hessian                  false          :
          :   write xtbopt.log                true          :
          :   linear?                        false          :
          :   energy convergence         0.5000000E-05 Eh   :
          :   grad. convergence          0.1000000E-02 Eh/α :
          :   maximium RF displ.         2.0000000          :
          :   Hlow (freq-cutoff)         0.5000000E-02      :
          :   Hmax (freq-cutoff)         5.0000000          :
          :   S6 in model hess.         20.0000000          :
          ...................................................

generating ANC from model Hessian ...
Using Lindh-Hessian (1995)
 Shifting diagonal of input Hessian by   3.777224030088277E-003
 Lowest  eigenvalues of input Hessian
   -0.000000   -0.000000   -0.000000   -0.000000    0.000000    0.000000
    0.005000    0.006537    0.008692    0.009521    0.010675    0.011684
    0.013287    0.013626    0.020557    0.024233    0.029248    0.029915
 Highest eigenvalues
    1.680001    1.723437    1.873190    1.960458    1.999319    2.105047
 

........................................................................
.............................. CYCLE    1 ..............................
........................................................................
   1    -36.0732366 -0.360732E+02  0.756E-05    1.49       0.0  T
   2    -36.0732366  0.449560E-10  0.747E-05    1.49     279.2  T
   3    -36.0732366 -0.121922E-09  0.351E-05    1.49     594.3  T
     SCC iter.                  ...        0 min,  0.004 sec
     gradient                   ...        0 min,  0.013 sec
 * total energy  :   -35.5608239 Eh     change       -0.5946106E-09 Eh
   gradient norm :     0.1122334 Eh/α   predicted     0.0000000E+00 (-100.00%)
   displ. norm   :     0.1790361 α      lambda       -0.1191287E-01
   maximum displ.:     0.0892622 α      in ANC's #40, #23, #11, ...

........................................................................
.............................. CYCLE    2 ..............................
........................................................................
   1    -36.1046437 -0.361046E+02  0.303E-01    1.44       0.0  T
   2    -36.1047019 -0.582284E-04  0.179E-01    1.43       1.0  T
   3    -36.1045101  0.191841E-03  0.126E-01    1.42       1.0  T
   4    -36.1048305 -0.320434E-03  0.179E-02    1.41       1.2  T
   5    -36.1048324 -0.185412E-05  0.137E-02    1.41       1.5  T
   6    -36.1048358 -0.345156E-05  0.457E-03    1.41       4.6  T
   7    -36.1048360 -0.127923E-06  0.188E-03    1.41      11.1  T
     SCC iter.                  ...        0 min,  0.008 sec
     gradient                   ...        0 min,  0.013 sec
 * total energy  :   -35.5692741 Eh     change       -0.8450243E-02 Eh
   gradient norm :     0.0541926 Eh/α   predicted    -0.6147362E-02 ( -27.25%)
   displ. norm   :     0.1629531 α      lambda       -0.4105011E-02
   maximum displ.:     0.0762382 α      in ANC's #4, #2, #40, ...

........................................................................
.............................. CYCLE    3 ..............................
........................................................................
   1    -36.1217381 -0.361217E+02  0.255E-01    1.37       0.0  T
   2    -36.1217784 -0.402924E-04  0.145E-01    1.37       1.0  T
   3    -36.1216470  0.131459E-03  0.983E-02    1.36       1.0  T
   4    -36.1218375 -0.190568E-03  0.157E-02    1.35       1.3  T
   5    -36.1218402 -0.264754E-05  0.101E-02    1.35       2.1  T
   6    -36.1218418 -0.156942E-05  0.445E-03    1.35       4.7  T
   7    -36.1218419 -0.178849E-06  0.163E-03    1.35      12.8  T
     SCC iter.                  ...        0 min,  0.008 sec
     gradient                   ...        0 min,  0.012 sec
 * total energy  :   -35.5713378 Eh     change       -0.2063718E-02 Eh
   gradient norm :     0.0114997 Eh/α   predicted    -0.2107010E-02 (   2.10%)
   displ. norm   :     0.1142556 α      lambda       -0.3082957E-03
   maximum displ.:     0.0730760 α      in ANC's #2, #4, #5, ...

........................................................................
.............................. CYCLE    4 ..............................
........................................................................
   1    -36.1195069 -0.361195E+02  0.672E-02    1.35       0.0  T
   2    -36.1195088 -0.185743E-05  0.393E-02    1.35       1.0  T
   3    -36.1195029  0.588342E-05  0.181E-02    1.35       1.1  T
   4    -36.1195096 -0.671074E-05  0.447E-03    1.35       4.7  T
   5    -36.1195098 -0.135025E-06  0.299E-03    1.35       7.0  T
   6    -36.1195099 -0.150414E-06  0.104E-03    1.35      20.0  T
     SCC iter.                  ...        0 min,  0.007 sec
     gradient                   ...        0 min,  0.012 sec
 * total energy  :   -35.5715504 Eh     change       -0.2125440E-03 Eh
   gradient norm :     0.0052622 Eh/α   predicted    -0.1561622E-03 ( -26.53%)
   displ. norm   :     0.1643597 α      lambda       -0.2492948E-03
   maximum displ.:     0.1071404 α      in ANC's #2, #4, #5, ...

........................................................................
.............................. CYCLE    5 ..............................
........................................................................
   1    -36.1169013 -0.361169E+02  0.102E-01    1.35       0.0  T
   2    -36.1169034 -0.203504E-05  0.597E-02    1.35       1.0  T
   3    -36.1168953  0.809789E-05  0.209E-02    1.35       1.0  T
   4    -36.1169043 -0.901627E-05  0.490E-03    1.35       4.3  T
   5    -36.1169044 -0.137465E-06  0.337E-03    1.35       6.2  T
   6    -36.1169046 -0.192584E-06  0.121E-03    1.35      17.3  T
   7    -36.1169046 -0.171807E-07  0.463E-04    1.35      45.0  T
     SCC iter.                  ...        0 min,  0.008 sec
     gradient                   ...        0 min,  0.013 sec
 * total energy  :   -35.5716847 Eh     change       -0.1343286E-03 Eh
   gradient norm :     0.0051830 Eh/α   predicted    -0.1280205E-03 (  -4.70%)
   displ. norm   :     0.1109173 α      lambda       -0.1026770E-03
   maximum displ.:     0.0769627 α      in ANC's #2, #4, #1, ...

........................................................................
.............................. CYCLE    6 ..............................
........................................................................
   1    -36.1173681 -0.361174E+02  0.679E-02    1.35       0.0  T
   2    -36.1173689 -0.823902E-06  0.388E-02    1.36       1.0  T
   3    -36.1173661  0.284197E-05  0.115E-02    1.36       1.8  T
   4    -36.1173691 -0.302907E-05  0.387E-03    1.36       5.4  T
   5    -36.1173693 -0.164560E-06  0.220E-03    1.36       9.5  T
   6    -36.1173694 -0.798625E-07  0.718E-04    1.36      29.0  T
     SCC iter.                  ...        0 min,  0.007 sec
     gradient                   ...        0 min,  0.012 sec
 * total energy  :   -35.5717633 Eh     change       -0.7856334E-04 Eh
   gradient norm :     0.0052571 Eh/α   predicted    -0.5197154E-04 ( -33.85%)
   displ. norm   :     0.1608012 α      lambda       -0.1297553E-03
   maximum displ.:     0.1113736 α      in ANC's #2, #1, #4, ...

........................................................................
.............................. CYCLE    7 ..............................
........................................................................
   1    -36.1186627 -0.361187E+02  0.953E-02    1.36       0.0  T
   2    -36.1186643 -0.158493E-05  0.547E-02    1.36       1.0  T
   3    -36.1186596  0.465402E-05  0.152E-02    1.36       1.4  T
   4    -36.1186649 -0.529198E-05  0.442E-03    1.36       4.7  T
   5    -36.1186650 -0.553344E-07  0.291E-03    1.36       7.2  T
   6    -36.1186651 -0.131424E-06  0.100E-03    1.36      20.8  T
     SCC iter.                  ...        0 min,  0.007 sec
     gradient                   ...        0 min,  0.012 sec
 * total energy  :   -35.5718621 Eh     change       -0.9880931E-04 Eh
   gradient norm :     0.0038242 Eh/α   predicted    -0.6656277E-04 ( -32.64%)
   displ. norm   :     0.2044708 α      lambda       -0.1104585E-03
   maximum displ.:     0.1460514 α      in ANC's #2, #1, #4, ...

........................................................................
.............................. CYCLE    8 ..............................
........................................................................
   1    -36.1187953 -0.361188E+02  0.118E-01    1.36       0.0  T
   2    -36.1187968 -0.142215E-05  0.678E-02    1.37       1.0  T
   3    -36.1187960  0.777679E-06  0.899E-03    1.36       2.3  T
   4    -36.1187972 -0.121132E-05  0.406E-03    1.37       5.1  T
   5    -36.1187973 -0.130967E-06  0.940E-04    1.37      22.2  T
   6    -36.1187973 -0.149095E-07  0.405E-04    1.37      51.5  T
     SCC iter.                  ...        0 min,  0.007 sec
     gradient                   ...        0 min,  0.013 sec
 * total energy  :   -35.5719441 Eh     change       -0.8202991E-04 Eh
   gradient norm :     0.0035651 Eh/α   predicted    -0.5754058E-04 ( -29.85%)
   displ. norm   :     0.2239237 α      lambda       -0.9843849E-04
   maximum displ.:     0.1604525 α      in ANC's #2, #1, #4, ...

........................................................................
.............................. CYCLE    9 ..............................
........................................................................
   1    -36.1191439 -0.361191E+02  0.129E-01    1.36       0.0  T
   2    -36.1191458 -0.188393E-05  0.738E-02    1.36       1.0  T
   3    -36.1191447  0.106674E-05  0.112E-02    1.36       1.9  T
   4    -36.1191462 -0.148976E-05  0.570E-03    1.36       3.7  T
   5    -36.1191465 -0.240711E-06  0.226E-03    1.36       9.2  T
   6    -36.1191466 -0.879225E-07  0.764E-04    1.36      27.3  T
   7    -36.1191466 -0.105987E-07  0.297E-04    1.36      70.1  T
     SCC iter.                  ...        0 min,  0.008 sec
     gradient                   ...        0 min,  0.013 sec
 * total energy  :   -35.5720119 Eh     change       -0.6778140E-04 Eh
   gradient norm :     0.0034075 Eh/α   predicted    -0.5168767E-04 ( -23.74%)
   displ. norm   :     0.1722637 α      lambda       -0.5807061E-04
   maximum displ.:     0.1158982 α      in ANC's #2, #1, #6, ...

........................................................................
.............................. CYCLE   10 ..............................
........................................................................
   1    -36.1192552 -0.361193E+02  0.992E-02    1.36       0.0  T
   2    -36.1192566 -0.133904E-05  0.565E-02    1.36       1.0  T
   3    -36.1192556  0.102059E-05  0.915E-03    1.36       2.3  T
   4    -36.1192568 -0.126343E-05  0.471E-03    1.36       4.4  T
   5    -36.1192571 -0.228784E-06  0.182E-03    1.36      11.5  T
   6    -36.1192571 -0.477058E-07  0.860E-04    1.36      24.2  T
   7    -36.1192571 -0.142626E-07  0.208E-04    1.36     100.2  T
     SCC iter.                  ...        0 min,  0.008 sec
     gradient                   ...        0 min,  0.013 sec
 * total energy  :   -35.5720534 Eh     change       -0.4155175E-04 Eh
   gradient norm :     0.0028366 Eh/α   predicted    -0.2989815E-04 ( -28.05%)
   displ. norm   :     0.1870848 α      lambda       -0.4952844E-04
   maximum displ.:     0.1088079 α      in ANC's #2, #1, #6, ...

........................................................................
.............................. CYCLE   11 ..............................
........................................................................
   1    -36.1190404 -0.361190E+02  0.107E-01    1.36       0.0  T
   2    -36.1190419 -0.149878E-05  0.611E-02    1.35       1.0  T
   3    -36.1190373  0.465596E-05  0.166E-02    1.35       1.3  T
   4    -36.1190423 -0.506066E-05  0.582E-03    1.35       3.6  T
   5    -36.1190425 -0.183301E-06  0.321E-03    1.35       6.5  T
   6    -36.1190427 -0.221155E-06  0.728E-04    1.35      28.6  T
   7    -36.1190428 -0.705323E-08  0.248E-04    1.35      84.2  T
     SCC iter.                  ...        0 min,  0.008 sec
     gradient                   ...        0 min,  0.013 sec
 * total energy  :   -35.5720872 Eh     change       -0.3380330E-04 Eh
   gradient norm :     0.0024358 Eh/α   predicted    -0.2563137E-04 ( -24.17%)
   displ. norm   :     0.1915539 α      lambda       -0.4713707E-04
   maximum displ.:     0.0875424 α      in ANC's #2, #6, #1, ...

........................................................................
.............................. CYCLE   12 ..............................
........................................................................
   1    -36.1188270 -0.361188E+02  0.101E-01    1.35       0.0  T
   2    -36.1188280 -0.105683E-05  0.585E-02    1.35       1.0  T
   3    -36.1188273  0.770288E-06  0.803E-03    1.35       2.6  T
   4    -36.1188283 -0.100688E-05  0.387E-03    1.35       5.4  T
   5    -36.1188284 -0.894182E-07  0.216E-03    1.35       9.6  T
   6    -36.1188285 -0.950410E-07  0.610E-04    1.35      34.2  T
   7    -36.1188285 -0.557993E-08  0.184E-04    1.35     113.3  T
     SCC iter.                  ...        0 min,  0.008 sec
     gradient                   ...        0 min,  0.013 sec
 * total energy  :   -35.5721221 Eh     change       -0.3488842E-04 Eh
   gradient norm :     0.0033346 Eh/α   predicted    -0.2443593E-04 ( -29.96%)
   displ. norm   :     0.2500928 α      lambda       -0.7360676E-04
   maximum displ.:     0.1273727 α      in ANC's #6, #1, #7, ...

........................................................................
.............................. CYCLE   13 ..............................
........................................................................
   1    -36.1186071 -0.361186E+02  0.129E-01    1.35       0.0  T
   2    -36.1186086 -0.150652E-05  0.753E-02    1.35       1.0  T
   3    -36.1186041  0.446508E-05  0.159E-02    1.35       1.3  T
   4    -36.1186090 -0.489905E-05  0.500E-03    1.35       4.2  T
   5    -36.1186093 -0.266606E-06  0.189E-03    1.35      11.0  T
   6    -36.1186093 -0.443389E-07  0.563E-04    1.35      37.0  T
   7    -36.1186093 -0.421822E-08  0.203E-04    1.35     102.6  T
     SCC iter.                  ...        0 min,  0.008 sec
     gradient                   ...        0 min,  0.013 sec
 * total energy  :   -35.5721741 Eh     change       -0.5196058E-04 Eh
   gradient norm :     0.0063191 Eh/α   predicted    -0.3910876E-04 ( -24.73%)
   displ. norm   :     0.2502091 α      lambda        0.1131305E-04
   maximum displ.:     0.1273732 α      in ANC's #6, #1, #7, ...

........................................................................
.............................. CYCLE   14 ..............................
........................................................................
   1    -36.1167021 -0.361167E+02  0.129E-01    1.35       0.0  T
   2    -36.1167044 -0.230613E-05  0.750E-02    1.35       1.0  T
   3    -36.1166999  0.451672E-05  0.162E-02    1.35       1.3  T
   4    -36.1167045 -0.460824E-05  0.643E-03    1.35       3.2  T
   5    -36.1167052 -0.657457E-06  0.197E-03    1.35      10.6  T
   6    -36.1167052 -0.238093E-07  0.775E-04    1.35      26.9  T
     SCC iter.                  ...        0 min,  0.007 sec
     gradient                   ...        0 min,  0.012 sec
 * total energy  :   -35.5721267 Eh     change        0.4737520E-04 Eh
   gradient norm :     0.0122696 Eh/α   predicted     0.6010227E-05 ( -87.31%)
   displ. norm   :     0.0889658 α      lambda       -0.2339267E-03
   maximum displ.:     0.0462667 α      in ANC's #2, #5, #1, ...

........................................................................
.............................. CYCLE   15 ..............................
........................................................................
   1    -36.1190566 -0.361191E+02  0.614E-02    1.36       0.0  T
   2    -36.1190585 -0.186329E-05  0.340E-02    1.36       1.0  T
   3    -36.1190523  0.613480E-05  0.195E-02    1.36       1.1  T
   4    -36.1190589 -0.653533E-05  0.575E-03    1.36       3.6  T
   5    -36.1190592 -0.376789E-06  0.220E-03    1.36       9.5  T
   6    -36.1190593 -0.327013E-07  0.122E-03    1.36      17.1  T
     SCC iter.                  ...        0 min,  0.007 sec
     gradient                   ...        0 min,  0.012 sec
 * total energy  :   -35.5722689 Eh     change       -0.1421677E-03 Eh
   gradient norm :     0.0069073 Eh/α   predicted    -0.1178896E-03 ( -17.08%)
   displ. norm   :     0.1220957 α      lambda       -0.1364520E-03
   maximum displ.:     0.0718852 α      in ANC's #2, #6, #5, ...

........................................................................
.............................. CYCLE   16 ..............................
........................................................................
   1    -36.1220747 -0.361221E+02  0.645E-02    1.36       0.0  T
   2    -36.1220756 -0.839919E-06  0.371E-02    1.36       1.0  T
   3    -36.1220723  0.327973E-05  0.126E-02    1.36       1.7  T
   4    -36.1220757 -0.341300E-05  0.436E-03    1.36       4.8  T
   5    -36.1220759 -0.198911E-06  0.220E-03    1.36       9.5  T
   6    -36.1220760 -0.747123E-07  0.678E-04    1.36      30.8  T
     SCC iter.                  ...        0 min,  0.007 sec
     gradient                   ...        0 min,  0.012 sec
 * total energy  :   -35.5723568 Eh     change       -0.8787381E-04 Eh
   gradient norm :     0.0068245 Eh/α   predicted    -0.6924484E-04 ( -21.20%)
   displ. norm   :     0.4767804 α      lambda       -0.4987223E-03
   maximum displ.:     0.2963146 α      in ANC's #6, #4, #7, ...

........................................................................
.............................. CYCLE   17 ..............................
........................................................................
   1    -36.1173118 -0.361173E+02  0.249E-01    1.38       0.0  T
   2    -36.1173213 -0.947189E-05  0.144E-01    1.39       1.0  T
   3    -36.1172955  0.257781E-04  0.372E-02    1.38       1.0  T
   4    -36.1173222 -0.266540E-04  0.142E-02    1.39       1.5  T
   5    -36.1173242 -0.202538E-05  0.738E-03    1.39       2.8  T
   6    -36.1173252 -0.101947E-05  0.241E-03    1.39       8.7  T
   7    -36.1173253 -0.777543E-07  0.593E-04    1.39      35.2  T
     SCC iter.                  ...        0 min,  0.008 sec
     gradient                   ...        0 min,  0.013 sec
 * total energy  :   -35.5726647 Eh     change       -0.3079901E-03 Eh
   gradient norm :     0.0102427 Eh/α   predicted    -0.3060487E-03 (  -0.63%)
   displ. norm   :     0.4596131 α      lambda       -0.4096445E-03
   maximum displ.:     0.2744082 α      in ANC's #6, #5, #4, ...

........................................................................
.............................. CYCLE   18 ..............................
........................................................................
   1    -36.1118839 -0.361119E+02  0.231E-01    1.40       0.0  T
   2    -36.1119025 -0.185639E-04  0.134E-01    1.40       1.0  T
   3    -36.1118957  0.671009E-05  0.233E-02    1.40       1.0  T
   4    -36.1119015 -0.580118E-05  0.121E-02    1.40       1.7  T
   5    -36.1119044 -0.285132E-05  0.419E-03    1.40       5.0  T
   6    -36.1119044 -0.160711E-07  0.290E-03    1.40       7.2  T
   7    -36.1119046 -0.165099E-06  0.713E-04    1.40      29.2  T
     SCC iter.                  ...        0 min,  0.008 sec
     gradient                   ...        0 min,  0.012 sec
 * total energy  :   -35.5721595 Eh     change        0.5052827E-03 Eh
   gradient norm :     0.0282220 Eh/α   predicted    -0.2480929E-03 (-149.10%)
   displ. norm   :     0.3008884 α      lambda       -0.1782614E-02
   maximum displ.:     0.1625817 α      in ANC's #6, #4, #7, ...

........................................................................
.............................. CYCLE   19 ..............................
........................................................................
   1    -36.1202699 -0.361203E+02  0.165E-01    1.39       0.0  T
   2    -36.1202888 -0.188585E-04  0.936E-02    1.38       1.0  T
   3    -36.1202657  0.230521E-04  0.371E-02    1.38       1.0  T
   4    -36.1202918 -0.260561E-04  0.113E-02    1.38       1.8  T
   5    -36.1202937 -0.194545E-05  0.391E-03    1.38       5.3  T
   6    -36.1202937  0.140461E-07  0.317E-03    1.38       6.6  T
     SCC iter.                  ...        0 min,  0.007 sec
     gradient                   ...        0 min,  0.012 sec
 * total energy  :   -35.5729511 Eh     change       -0.7915906E-03 Eh
   gradient norm :     0.0087894 Eh/α   predicted    -0.9720064E-03 (  22.79%)
   displ. norm   :     0.1123071 α      lambda       -0.2475273E-03
   maximum displ.:     0.0679297 α      in ANC's #6, #5, #7, ...

........................................................................
.............................. CYCLE   20 ..............................
........................................................................
   1    -36.1188593 -0.361189E+02  0.629E-02    1.38       0.0  T
   2    -36.1188606 -0.129948E-05  0.375E-02    1.38       1.0  T
   3    -36.1188538  0.677029E-05  0.181E-02    1.38       1.1  T
   4    -36.1188608 -0.701848E-05  0.487E-03    1.38       4.3  T
   5    -36.1188612 -0.364169E-06  0.180E-03    1.38      11.6  T
   6    -36.1188612 -0.210791E-07  0.860E-04    1.38      24.2  T
     SCC iter.                  ...        0 min,  0.007 sec
     gradient                   ...        0 min,  0.012 sec
 * total energy  :   -35.5730698 Eh     change       -0.1187662E-03 Eh
   gradient norm :     0.0080511 Eh/α   predicted    -0.1253274E-03 (   5.52%)
   displ. norm   :     0.2150362 α      lambda       -0.2216455E-03
   maximum displ.:     0.1370931 α      in ANC's #2, #6, #5, ...
 * RMSD in coord.:     0.4805980 α      energy gain  -0.1224595E-01 Eh

generating ANC from model Hessian ...
Using Lindh-Hessian (1995)
 Shifting diagonal of input Hessian by   3.696714518269054E-003
 Lowest  eigenvalues of input Hessian
   -0.000000   -0.000000   -0.000000   -0.000000   -0.000000    0.000000
    0.005000    0.006759    0.008725    0.009864    0.011377    0.012334
    0.014068    0.014269    0.021706    0.024570    0.030630    0.031369
 Highest eigenvalues
    1.725330    1.814712    1.966640    2.006016    2.073760    2.210601
 

........................................................................
.............................. CYCLE   21 ..............................
........................................................................
   1    -36.1186848 -0.361187E+02  0.116E-01    1.38       0.0  T
   2    -36.1186857 -0.962861E-06  0.675E-02    1.38       1.0  T
   3    -36.1186841  0.163769E-05  0.972E-03    1.38       2.1  T
   4    -36.1186859 -0.179885E-05  0.436E-03    1.38       4.8  T
   5    -36.1186860 -0.150040E-06  0.234E-03    1.38       8.9  T
   6    -36.1186861 -0.984198E-07  0.727E-04    1.38      28.7  T
   7    -36.1186861 -0.924210E-08  0.176E-04    1.38     118.6  T
     SCC iter.                  ...        0 min,  0.008 sec
     gradient                   ...        0 min,  0.013 sec
 * total energy  :   -35.5732560 Eh     change       -0.1862192E-03 Eh
   gradient norm :     0.0065909 Eh/α   predicted     0.0000000E+00 (-100.00%)
   displ. norm   :     0.0976943 α      lambda       -0.1595543E-03
   maximum displ.:     0.0583001 α      in ANC's #5, #1, #4, ...

........................................................................
.............................. CYCLE   22 ..............................
........................................................................
   1    -36.1206335 -0.361206E+02  0.527E-02    1.38       0.0  T
   2    -36.1206339 -0.345781E-06  0.308E-02    1.38       1.0  T
   3    -36.1206325  0.139410E-05  0.815E-03    1.38       2.6  T
   4    -36.1206339 -0.144196E-05  0.274E-03    1.38       7.6  T
   5    -36.1206341 -0.117125E-06  0.101E-03    1.38      20.6  T
     SCC iter.                  ...        0 min,  0.006 sec
     gradient                   ...        0 min,  0.012 sec
 * total energy  :   -35.5733836 Eh     change       -0.1276076E-03 Eh
   gradient norm :     0.0022185 Eh/α   predicted    -0.8054128E-04 ( -36.88%)
   displ. norm   :     0.2125057 α      lambda       -0.2260927E-03
   maximum displ.:     0.1331383 α      in ANC's #5, #6, #4, ...

........................................................................
.............................. CYCLE   23 ..............................
........................................................................
   1    -36.1217958 -0.361218E+02  0.106E-01    1.38       0.0  T
   2    -36.1217967 -0.834123E-06  0.625E-02    1.38       1.0  T
   3    -36.1217951  0.154467E-05  0.884E-03    1.38       2.4  T
   4    -36.1217967 -0.163591E-05  0.362E-03    1.38       5.8  T
   5    -36.1217969 -0.191334E-06  0.182E-03    1.38      11.5  T
   6    -36.1217970 -0.472047E-07  0.555E-04    1.38      37.6  T
   7    -36.1217970 -0.420248E-08  0.179E-04    1.38     116.8  T
     SCC iter.                  ...        0 min,  0.008 sec
     gradient                   ...        0 min,  0.013 sec
 * total energy  :   -35.5735720 Eh     change       -0.1883883E-03 Eh
   gradient norm :     0.0046896 Eh/α   predicted    -0.1181669E-03 ( -37.27%)
   displ. norm   :     0.3800057 α      lambda       -0.3231055E-03
   maximum displ.:     0.2243421 α      in ANC's #5, #6, #7, ...

........................................................................
.............................. CYCLE   24 ..............................
........................................................................
   1    -36.1194135 -0.361194E+02  0.186E-01    1.38       0.0  T
   2    -36.1194178 -0.424207E-05  0.109E-01    1.38       1.0  T
   3    -36.1194171  0.676292E-06  0.957E-03    1.38       2.2  T
   4    -36.1194181 -0.967602E-06  0.492E-03    1.38       4.2  T
   5    -36.1194184 -0.291115E-06  0.217E-03    1.38       9.6  T
   6    -36.1194184 -0.256236E-07  0.131E-03    1.38      15.9  T
     SCC iter.                  ...        0 min,  0.007 sec
     gradient                   ...        0 min,  0.012 sec
 * total energy  :   -35.5736865 Eh     change       -0.1144478E-03 Eh
   gradient norm :     0.0138786 Eh/α   predicted    -0.1848903E-03 (  61.55%)
   displ. norm   :     0.0699015 α      lambda       -0.2662938E-03
   maximum displ.:     0.0384135 α      in ANC's #5, #4, #6, ...

........................................................................
.............................. CYCLE   25 ..............................
........................................................................
   1    -36.1214857 -0.361215E+02  0.430E-02    1.38       0.0  T
   2    -36.1214874 -0.176088E-05  0.241E-02    1.38       1.0  T
   3    -36.1214873  0.156697E-06  0.606E-03    1.38       3.4  T
   4    -36.1214874 -0.996917E-07  0.312E-03    1.38       6.7  T
   5    -36.1214876 -0.195835E-06  0.120E-03    1.38      17.4  T
   6    -36.1214876 -0.119216E-07  0.658E-04    1.38      31.7  T
     SCC iter.                  ...        0 min,  0.007 sec
     gradient                   ...        0 min,  0.012 sec
 * total energy  :   -35.5738391 Eh     change       -0.1526261E-03 Eh
   gradient norm :     0.0056176 Eh/α   predicted    -0.1338268E-03 ( -12.32%)
   displ. norm   :     0.1677191 α      lambda       -0.1682686E-03
   maximum displ.:     0.0944818 α      in ANC's #5, #7, #1, ...

........................................................................
.............................. CYCLE   26 ..............................
........................................................................
   1    -36.1213059 -0.361213E+02  0.836E-02    1.38       0.0  T
   2    -36.1213064 -0.423480E-06  0.486E-02    1.38       1.0  T
   3    -36.1213056  0.789364E-06  0.735E-03    1.38       2.8  T
   4    -36.1213063 -0.743073E-06  0.403E-03    1.38       5.2  T
   5    -36.1213065 -0.202842E-06  0.118E-03    1.38      17.6  T
   6    -36.1213065 -0.293886E-07  0.262E-04    1.38      79.7  T
     SCC iter.                  ...        0 min,  0.007 sec
     gradient                   ...        0 min,  0.013 sec
 * total energy  :   -35.5739764 Eh     change       -0.1372850E-03 Eh
   gradient norm :     0.0034672 Eh/α   predicted    -0.8650171E-04 ( -36.99%)
   displ. norm   :     0.3549002 α      lambda       -0.2405641E-03
   maximum displ.:     0.1993714 α      in ANC's #5, #7, #1, ...

........................................................................
.............................. CYCLE   27 ..............................
........................................................................
   1    -36.1183396 -0.361183E+02  0.176E-01    1.38       0.0  T
   2    -36.1183427 -0.306512E-05  0.102E-01    1.38       1.0  T
   3    -36.1183416  0.105393E-05  0.118E-02    1.38       1.8  T
   4    -36.1183414  0.249614E-06  0.100E-02    1.38       2.1  T
   5    -36.1183433 -0.186947E-05  0.245E-03    1.38       8.5  T
   6    -36.1183433 -0.524294E-07  0.543E-04    1.38      38.4  T
   7    -36.1183433 -0.620368E-08  0.154E-04    1.38     135.3  T
     SCC iter.                  ...        0 min,  0.008 sec
     gradient                   ...        0 min,  0.013 sec
 * total energy  :   -35.5740590 Eh     change       -0.8264144E-04 Eh
   gradient norm :     0.0095543 Eh/α   predicted    -0.1354321E-03 (  63.88%)
   displ. norm   :     0.0702590 α      lambda       -0.1795222E-03
   maximum displ.:     0.0433654 α      in ANC's #5, #6, #4, ...

........................................................................
.............................. CYCLE   28 ..............................
........................................................................
   1    -36.1211164 -0.361211E+02  0.382E-02    1.38       0.0  T
   2    -36.1211180 -0.158435E-05  0.216E-02    1.38       1.0  T
   3    -36.1211174  0.556650E-06  0.781E-03    1.38       2.7  T
   4    -36.1211178 -0.334405E-06  0.444E-03    1.38       4.7  T
   5    -36.1211181 -0.359360E-06  0.109E-03    1.38      19.1  T
   6    -36.1211181 -0.177259E-07  0.517E-04    1.38      40.4  T
     SCC iter.                  ...        0 min,  0.007 sec
     gradient                   ...        0 min,  0.013 sec
 * total energy  :   -35.5741395 Eh     change       -0.8047524E-04 Eh
   gradient norm :     0.0030586 Eh/α   predicted    -0.9021267E-04 (  12.10%)
   displ. norm   :     0.1061974 α      lambda       -0.5540529E-04
   maximum displ.:     0.0566437 α      in ANC's #5, #1, #7, ...

........................................................................
.............................. CYCLE   29 ..............................
........................................................................
   1    -36.1212353 -0.361212E+02  0.518E-02    1.39       0.0  T
   2    -36.1212355 -0.152789E-06  0.302E-02    1.39       1.0  T
   3    -36.1212352  0.289938E-06  0.453E-03    1.39       4.6  T
   4    -36.1212354 -0.252710E-06  0.248E-03    1.39       8.4  T
   5    -36.1212355 -0.889534E-07  0.729E-04    1.39      28.6  T
   6    -36.1212355 -0.895982E-08  0.221E-04    1.39      94.4  T
     SCC iter.                  ...        0 min,  0.007 sec
     gradient                   ...        0 min,  0.013 sec
 * total energy  :   -35.5741847 Eh     change       -0.4515726E-04 Eh
   gradient norm :     0.0026424 Eh/α   predicted    -0.2801558E-04 ( -37.96%)
   displ. norm   :     0.3180474 α      lambda       -0.1210779E-03
   maximum displ.:     0.1647274 α      in ANC's #5, #1, #7, ...

........................................................................
.............................. CYCLE   30 ..............................
........................................................................
   1    -36.1196204 -0.361196E+02  0.157E-01    1.39       0.0  T
   2    -36.1196226 -0.221465E-05  0.916E-02    1.39       1.0  T
   3    -36.1196217  0.928629E-06  0.103E-02    1.39       2.0  T
   4    -36.1196223 -0.595008E-06  0.705E-03    1.39       3.0  T
   5    -36.1196230 -0.742998E-06  0.257E-03    1.39       8.1  T
   6    -36.1196231 -0.679744E-07  0.127E-03    1.39      16.4  T
   7    -36.1196232 -0.380668E-07  0.195E-04    1.39     106.7  T
   8    -36.1196232 -0.238678E-09  0.109E-04    1.39     190.8  T
     SCC iter.                  ...        0 min,  0.009 sec
     gradient                   ...        0 min,  0.013 sec
 * total energy  :   -35.5742059 Eh     change       -0.2125740E-04 Eh
   gradient norm :     0.0069963 Eh/α   predicted    -0.6666578E-04 ( 213.61%)
   displ. norm   :     0.1028110 α      lambda       -0.1208627E-03
   maximum displ.:     0.0550261 α      in ANC's #5, #7, #6, ...

........................................................................
.............................. CYCLE   31 ..............................
........................................................................
   1    -36.1219543 -0.361220E+02  0.542E-02    1.39       0.0  T
   2    -36.1219554 -0.105256E-05  0.309E-02    1.39       1.0  T
   3    -36.1219550  0.391776E-06  0.616E-03    1.39       3.4  T
   4    -36.1219551 -0.167370E-06  0.420E-03    1.39       5.0  T
   5    -36.1219555 -0.322388E-06  0.139E-03    1.39      15.0  T
   6    -36.1219555 -0.119789E-07  0.724E-04    1.39      28.8  T
     SCC iter.                  ...        0 min,  0.007 sec
     gradient                   ...        0 min,  0.013 sec
 * total energy  :   -35.5742578 Eh     change       -0.5191665E-04 Eh
   gradient norm :     0.0017187 Eh/α   predicted    -0.6107182E-04 (  17.63%)
   displ. norm   :     0.1183437 α      lambda       -0.2129295E-04
   maximum displ.:     0.0570399 α      in ANC's #5, #1, #4, ...

........................................................................
.............................. CYCLE   32 ..............................
........................................................................
   1    -36.1219814 -0.361220E+02  0.594E-02    1.39       0.0  T
   2    -36.1219816 -0.177089E-06  0.349E-02    1.39       1.0  T
   3    -36.1219815  0.102789E-06  0.308E-03    1.39       6.8  T
   4    -36.1219816 -0.160633E-06  0.141E-03    1.39      14.8  T
   5    -36.1219816 -0.181161E-07  0.576E-04    1.39      36.2  T
   6    -36.1219816 -0.526387E-08  0.127E-04    1.39     164.3  T
     SCC iter.                  ...        0 min,  0.007 sec
     gradient                   ...        0 min,  0.013 sec
 * total energy  :   -35.5742828 Eh     change       -0.2499493E-04 Eh
   gradient norm :     0.0014925 Eh/α   predicted    -0.1071321E-04 ( -57.14%)
   displ. norm   :     0.1916928 α      lambda       -0.2397212E-04
   maximum displ.:     0.0982237 α      in ANC's #5, #1, #4, ...

........................................................................
.............................. CYCLE   33 ..............................
........................................................................
   1    -36.1214535 -0.361215E+02  0.952E-02    1.39       0.0  T
   2    -36.1214539 -0.457554E-06  0.560E-02    1.39       1.0  T
   3    -36.1214539  0.703518E-07  0.392E-03    1.39       5.3  T
   4    -36.1214540 -0.173167E-06  0.229E-03    1.39       9.1  T
   5    -36.1214541 -0.566821E-07  0.103E-03    1.39      20.2  T
   6    -36.1214541 -0.151948E-07  0.382E-04    1.39      54.6  T
   7    -36.1214541 -0.270141E-08  0.112E-04    1.39     187.0  T
     SCC iter.                  ...        0 min,  0.008 sec
     gradient                   ...        0 min,  0.013 sec
 * total energy  :   -35.5742983 Eh     change       -0.1543862E-04 Eh
   gradient norm :     0.0022518 Eh/α   predicted    -0.1218444E-04 ( -21.08%)
   displ. norm   :     0.0229048 α      lambda       -0.1251783E-04
   maximum displ.:     0.0169314 α      in ANC's #6, #2, #4, ...

........................................................................
.............................. CYCLE   34 ..............................
........................................................................
   1    -36.1220032 -0.361220E+02  0.130E-02    1.39       0.0  T
   2    -36.1220033 -0.965746E-07  0.734E-03    1.38       2.8  T
   3    -36.1220032  0.997516E-07  0.257E-03    1.39       8.1  T
   4    -36.1220033 -0.109273E-06  0.926E-04    1.38      22.5  T
   5    -36.1220033 -0.126136E-07  0.321E-04    1.38      64.9  T
     SCC iter.                  ...        0 min,  0.006 sec
     gradient                   ...        0 min,  0.013 sec
 * total energy  :   -35.5743057 Eh     change       -0.7433355E-05 Eh
   gradient norm :     0.0008024 Eh/α   predicted    -0.6262782E-05 ( -15.75%)
   displ. norm   :     0.0389029 α      lambda       -0.2880123E-05
   maximum displ.:     0.0197546 α      in ANC's #5, #6, #2, ...

........................................................................
.............................. CYCLE   35 ..............................
........................................................................
   1    -36.1222815 -0.361223E+02  0.194E-02    1.38       0.0  T
   2    -36.1222815 -0.330256E-07  0.114E-02    1.38       1.8  T
   3    -36.1222814  0.913478E-07  0.206E-03    1.38      10.1  T
   4    -36.1222815 -0.987238E-07  0.576E-04    1.38      36.2  T
   5    -36.1222816 -0.577845E-08  0.208E-04    1.38     100.3  T
     SCC iter.                  ...        0 min,  0.006 sec
     gradient                   ...        0 min,  0.013 sec
 * total energy  :   -35.5743083 Eh     change       -0.2544804E-05 Eh
   gradient norm :     0.0004786 Eh/α   predicted    -0.1441303E-05 ( -43.36%)
   displ. norm   :     0.0386356 α      lambda        0.1210040E-05
   maximum displ.:     0.0197532 α      in ANC's #5, #6, #2, ...

   *** GEOMETRY OPTIMIZATION CONVERGED AFTER 35 ITERATIONS ***

------------------------------------------------------------------------
 total energy gain   :        -0.0134844 Eh       -8.4616 kcal/mol
 total RMSD          :         0.7073466 a0        0.3743 Å
 total power (kW/mol):        -1.0115215 (step)  -34.0770 (real)
------------------------------------------------------------------------

 ANCopt (total)                0 d,  0 h,  0 min,  1.039 sec
 optimizer setup                ...        0 min,  0.000 sec (  0.015%)
 model hessian                  ...        0 min,  0.007 sec (  0.645%)
 ANC generation                 ...        0 min,  0.001 sec (  0.125%)
 coordinate transformation      ...        0 min,  0.001 sec (  0.060%)
 single point calculation       ...        0 min,  1.016 sec ( 97.821%)
 optimization log               ...        0 min,  0.003 sec (  0.319%)
 hessian update                 ...        0 min,  0.000 sec (  0.043%)
 rational function              ...        0 min,  0.008 sec (  0.767%)

================
 final structure:
================
$coord
   -2.72503524343664    2.54094439522229   -0.09938256382992      C 
   -0.34866838576961    1.49608800137096   -0.05062751941204      C 
    1.87694411422320    2.75307291857952    0.11071724820173      N 
    3.92615571270470    1.38908434465466    0.12594182060361      C 
    6.38435992920464    2.76389792160633    0.29348254601061      C 
    3.86276378868262   -1.33046230531935   -0.01306478136451      C 
    6.25003752303188   -2.83347177061529    0.02276754564615      C 
    1.74699177349221   -2.58496775905239   -0.17089367489771      N 
   -0.41018519935325   -1.21875628173374   -0.19819748497983      C 
   -2.84420309229580   -2.18747992031248   -0.36050833587994      C 
   -5.00714618196610    0.26792224341101   -0.32476851632810      S 
   -3.52903484220867   -4.79746753202843   -0.53990188737260      C 
   -5.88279128920066   -5.67242881366948   -0.70024299645598      C 
   -3.23278336875903    4.49797320015744   -0.01780148159875      H 
    6.02028470743588    4.78092117160568    0.40913340666915      H 
    7.53884730191791    2.37571656845500   -1.36575844518460      H 
    7.43621479547255    2.16329464297214    1.95707032536784      H 
    7.46140115541748   -2.30357854020650   -1.55371356691022      H 
    5.79214773310811   -4.82963184781495   -0.11244793930414      H 
    7.28822011806356   -2.49283158203806    1.76635260325451      H 
   -1.92373324274876   -6.06388506698958   -0.53893490339143      H 
   -7.48575002218793   -4.41548346511664   -0.70498851839787      H 
   -6.27466849307169   -7.66154927674895   -0.83373389075032      H 
$end
           -------------------------------------------------
          |                Final Singlepoint                |
           -------------------------------------------------

          ...................................................
          :                      SETUP                      :
          :.................................................:
          :  # basis functions                  68          :
          :  # atomic orbitals                  67          :
          :  # shells                           37          :
          :  # electrons                        66          :
          :  max. iterations                   250          :
          :  Hamiltonian                  GFN2-xTB          :
          :  restarted?                      false          :
          :  GBSA solvation                  false          :
          :  PC potential                    false          :
          :  electronic temp.          300.0000000     K    :
          :  accuracy                    1.0000000          :
          :  -> integral cutoff          0.2500000E+02      :
          :  -> integral neglect         0.1000000E-07      :
          :  -> SCF convergence          0.1000000E-05 Eh   :
          :  -> wf. convergence          0.1000000E-03 e    :
          :  Broyden damping             0.4000000          :
          ...................................................

 iter      E             dE          RMSdq      gap      omega  full diag
   1    -36.1222816 -0.361223E+02  0.194E-04    1.38       0.0  T
   2    -36.1222816  0.298563E-09  0.147E-04    1.38     141.5  T
   3    -36.1222816 -0.556007E-09  0.908E-05    1.38     229.7  T

   *** convergence criteria satisfied after 3 iterations ***

         #    Occupation            Energy/Eh            Energy/eV
      -------------------------------------------------------------
         1        2.0000           -0.7384193             -20.0934
       ...           ...                  ...                  ...
        27        2.0000           -0.4516091             -12.2889
        28        2.0000           -0.4369178             -11.8891
        29        2.0000           -0.4300216             -11.7015
        30        2.0000           -0.4120674             -11.2129
        31        2.0000           -0.4001105             -10.8876
        32        2.0000           -0.3687667             -10.0347
        33        2.0000           -0.3496962              -9.5157 (HOMO)
        34                         -0.2988077              -8.1310 (LUMO)
        35                         -0.2401122              -6.5338
        36                         -0.2144442              -5.8353
        37                         -0.2033392              -5.5331
        38                         -0.1690143              -4.5991
       ...                                ...                  ...
        67                          0.7126399              19.3919
      -------------------------------------------------------------
                  HL-Gap            0.0508885 Eh            1.3847 eV
             Fermi-level           -0.3242520 Eh           -8.8233 eV

 SCC (total)                   0 d,  0 h,  0 min,  0.026 sec
 SCC setup                      ...        0 min,  0.000 sec (  0.733%)
 Dispersion                     ...        0 min,  0.000 sec (  0.760%)
 integral evaluation            ...        0 min,  0.008 sec ( 31.811%)
 zeroth order Hamiltonian       ...        0 min,  0.000 sec (  0.592%)
 iterations                     ...        0 min,  0.004 sec ( 15.028%)
 molecular gradient             ...        0 min,  0.013 sec ( 49.441%)
 printout                       ...        0 min,  0.000 sec (  1.363%)

         :::::::::::::::::::::::::::::::::::::::::::::::::::::
         ::                     SUMMARY                     ::
         :::::::::::::::::::::::::::::::::::::::::::::::::::::
         :: total energy             -35.574308257622 Eh    ::
         :: gradient norm              0.000478882271 Eh/a0 ::
         :: HOMO-LUMO gap              1.384747803848 eV    ::
         ::.................................................::
         :: SCC energy               -36.122281553131 Eh    ::
         :: -> isotropic ES            0.019544017524 Eh    ::
         :: -> anisotropic ES          0.003313413187 Eh    ::
         :: -> anisotropic XC          0.027454890778 Eh    ::
         :: -> dispersion             -0.023505976648 Eh    ::
         :: repulsion energy           0.547972198943 Eh    ::
         :: add. restraining           0.000000000000 Eh    ::
         :::::::::::::::::::::::::::::::::::::::::::::::::::::

           -------------------------------------------------
          |                Property Printout                |
           -------------------------------------------------

    * Orbital Energies and Occupations

         #    Occupation            Energy/Eh            Energy/eV
      -------------------------------------------------------------
         1        2.0000           -0.7384193             -20.0934
       ...           ...                  ...                  ...
        21        2.0000           -0.4812485             -13.0954
        22        2.0000           -0.4766444             -12.9702
        23        2.0000           -0.4677971             -12.7294
        24        2.0000           -0.4659083             -12.6780
        25        2.0000           -0.4598631             -12.5135
        26        2.0000           -0.4571822             -12.4406
        27        2.0000           -0.4516091             -12.2889
        28        2.0000           -0.4369178             -11.8891
        29        2.0000           -0.4300216             -11.7015
        30        2.0000           -0.4120674             -11.2129
        31        2.0000           -0.4001105             -10.8876
        32        2.0000           -0.3687667             -10.0347
        33        2.0000           -0.3496962              -9.5157 (HOMO)
        34                         -0.2988077              -8.1310 (LUMO)
        35                         -0.2401122              -6.5338
        36                         -0.2144442              -5.8353
        37                         -0.2033392              -5.5331
        38                         -0.1690143              -4.5991
        39                         -0.1275330              -3.4703
        40                         -0.1043797              -2.8403
        41                         -0.0083846              -0.2282
        42                          0.0241156               0.6562
        43                          0.0355054               0.9662
        44                          0.0991678               2.6985
       ...                                ...                  ...
        67                          0.7126399              19.3919
      -------------------------------------------------------------
                  HL-Gap            0.0508885 Eh            1.3847 eV
             Fermi-level           -0.3242520 Eh           -8.8233 eV

     #   Z        covCN         q      C6AA      α(0)
     1   6 C      2.925    -0.044    29.105     8.847
     2   6 C      3.168     0.063    26.235     8.369
     3   7 N      1.841    -0.244    27.211     7.731
     4   6 C      2.953     0.093    25.934     8.353
     5   6 C      3.761    -0.117    22.783     6.804
     6   6 C      2.954     0.091    25.984     8.361
     7   6 C      3.761    -0.116    22.772     6.803
     8   7 N      1.841    -0.242    27.159     7.723
     9   6 C      3.175     0.058    26.315     8.378
    10   6 C      2.976     0.005    27.903     8.665
    11  16 S      2.344     0.016   140.397    19.943
    12   6 C      2.913    -0.027    28.683     8.782
    13   6 C      2.841    -0.088    30.208     9.007
    14   1 H      0.927     0.058     2.224     2.332
    15   1 H      0.925     0.065     2.141     2.288
    16   1 H      0.925     0.054     2.274     2.358
    17   1 H      0.925     0.053     2.277     2.360
    18   1 H      0.925     0.053     2.277     2.360
    19   1 H      0.925     0.064     2.152     2.294
    20   1 H      0.925     0.053     2.277     2.360
    21   1 H      0.925     0.060     2.196     2.317
    22   1 H      0.926     0.046     2.364     2.404
    23   1 H      0.926     0.044     2.392     2.419

 Mol. C6AA /au·bohr⁶  :       7866.829366
 Mol. C8AA /au·bohr⁸  :     212098.037653
 Mol. α(0) /au        :        141.258160


Wiberg/Mayer (AO) data.
largest (>0.10) Wiberg bond orders for each atom
          total WBO             WBO to atom ...
     1  C   3.937        C    2 1.448    S   11 1.238    H   14 0.967    C   10 0.126
     2  C   3.981        C    1 1.448    N    3 1.228    C    9 1.136
     3  N   3.056        C    4 1.581    C    2 1.228
     4  C   3.975        N    3 1.581    C    6 1.164    C    5 1.028
     5  C   3.993        C    4 1.028    H   15 0.983    H   17 0.966    H   16 0.965
     6  C   3.957        N    8 1.568    C    4 1.164    C    7 1.028
     7  C   3.993        C    6 1.028    H   19 0.983    H   18 0.965    H   20 0.965
     8  N   3.063        C    6 1.568    C    9 1.251
     9  C   3.982        C   10 1.365    N    8 1.251    C    2 1.136
    10  C   3.941        C    9 1.365    S   11 1.172    C   12 1.157    C    1 0.126
    11  S   2.711        C    1 1.238    C   10 1.172
    12  C   3.990        C   13 1.842    C   10 1.157    H   21 0.955
    13  C   3.965        C   12 1.842    H   23 0.978    H   22 0.972
    14  H   0.996        C    1 0.967
    15  H   0.996        C    5 0.983
    16  H   0.993        C    5 0.965
    17  H   0.993        C    5 0.966
    18  H   0.993        C    7 0.965
    19  H   0.996        C    7 0.983
    20  H   0.993        C    7 0.965
    21  H   0.996        C   12 0.955
    22  H   0.998        C   13 0.972
    23  H   0.997        C   13 0.978

molecular dipole:
                 x           y           z       tot (Debye)
 q only:        0.384      -0.156       0.006
   full:        0.713      -0.109       0.022       1.834
molecular quadrupole (traceless):
                xx          xy          yy          xz          yz          zz
 q only:        8.525       0.466      -2.786       0.588       0.211      -5.739
  q+dip:        9.314      -0.240      -3.405       0.538       0.158      -5.909
   full:        7.974      -0.176      -5.245       0.337      -0.106      -2.729

           -------------------------------------------------
          |                Geometry Summary                 |
           -------------------------------------------------

      molecular mass/u    :      190.2624000
   center of mass at/Å    :       -0.0854375      -0.3377170      -0.0848607
  moments of inertia/u·Å² :        0.3463613E+03   0.1001503E+04   0.1341593E+04
rotational constants/cm⁻¹ :        0.4867066E-01   0.1683233E-01   0.1256538E-01

 * 21 selected distances

     #   Z        #   Z                                     value/Å
     1   6 C      2   6 C                                 1.3739485
     2   6 C      3   7 N                                 1.3552925
     3   7 N      4   6 C                                 1.3026754
     6   6 C      8   7 N                                 1.3043103
     2   6 C      9   6 C                                 1.4391229
     8   7 N      9   6 C                                 1.3512883
     9   6 C     10   6 C                                 1.3889480
     1   6 C     11  16 S                                 1.7086329
    10   6 C     11  16 S                                 1.7316795 (max)
    10   6 C     12   6 C                                 1.4310515
    12   6 C     13   6 C                                 1.3315341
     1   6 C     14   1 H                                 1.0707736 (min)
     5   6 C     15   1 H                                 1.0863364
     5   6 C     16   1 H                                 1.0892065
     5   6 C     17   1 H                                 1.0889546
     7   6 C     18   1 H                                 1.0888047
     7   6 C     19   1 H                                 1.0861164
     7   6 C     20   1 H                                 1.0888647
    12   6 C     21   1 H                                 1.0820100
    13   6 C     22   1 H                                 1.0779395
    13   6 C     23   1 H                                 1.0751533

 * 4 distinct bonds (by element types)

   Z      Z             #   av. dist./Å        max./Å        min./Å
   1 H    6 C          10     1.0834160     1.0892065     1.0707736
   6 C    6 C           5     1.3929210     1.4391229     1.3315341
   6 C    7 N           4     1.3283916     1.3552925     1.3026754
   6 C   16 S           2     1.7201562     1.7316795     1.7086329


optimized geometry written to: xtbopt.xyz


           -------------------------------------------------
          | TOTAL ENERGY              -35.574308257622 Eh   |
          | GRADIENT NORM               0.000478882271 Eh/α |
          | HOMO-LUMO GAP               1.384747803848 eV   |
           -------------------------------------------------

------------------------------------------------------------------------
 * finished run on 2021/05/19 at 10:59:58.366     
------------------------------------------------------------------------
 total:
 * wall-time:     0 d,  0 h,  0 min,  1.125 sec
 *  cpu-time:     0 d,  0 h,  0 min,  1.121 sec
 * ratio c/w:     0.997 speedup
 SCF:
 * wall-time:     0 d,  0 h,  0 min,  0.038 sec
 *  cpu-time:     0 d,  0 h,  0 min,  0.038 sec
 * ratio c/w:     0.997 speedup
 ANC optimizer:
 * wall-time:     0 d,  0 h,  0 min,  1.066 sec
 *  cpu-time:     0 d,  0 h,  0 min,  1.063 sec
 * ratio c/w:     0.998 speedup

