      -----------------------------------------------------------      
     |                   =====================                   |     
     |                           x T B                           |     
     |                   =====================                   |     
     |                         S. Grimme                         |     
     |          Mulliken Center for Theoretical Chemistry        |     
     |                    University of Bonn                     |     
     |                Version 6.2 RC2 (SAW190805)                |     
      -----------------------------------------------------------      

   This program is distributed in the hope that it will be useful,
   but WITHOUT ANY WARRANTY; without even the implied warranty of
   MERCHANTABILITY or FITNESS FOR A PARTICULAR PURPOSE.
   
   FOR NON-COMMERCIAL, ACADEMIA USE ONLY.
   
   Cite this work as:
   * S. Grimme, C. Bannwarth, P. Shushkov, J. Chem. Theory Comput., 2017,
     13, 1989-2009. DOI: 10.1021/acs.jctc.7b00118
   * C. Bannwarth, S. Ehlert and S. Grimme., J. Chem. Theory Comput., 2019,
     15, 1652-1671. DOI: 10.1021/acs.jctc.8b01176
   * P. Pracht, E. Caldeweyher, S. Ehlert, S. Grimme, ChemRxiv, 2019, preprint.
     DOI: 10.26434/chemrxiv.8326202.v1
   
   for DFT-D4:
   * E. Caldeweyher, C. Bannwarth and S. Grimme, J. Chem. Phys., 2017,
     147, 034112. DOI: 10.1063/1.4993215
   * E. Caldeweyher, S. Ehlert, A. Hansen, H. Neugebauer, S. Spicher,
     C. Bannwarth and S. Grimme, J. Chem. Phys., 2019, 150, 154122.
     DOI: 10.1063/1.5090222
   
   for sTDA-xTB:
   * S. Grimme and C. Bannwarth, J. Chem. Phys., 2016, 145, 054103.
     DOI: 10.1063/1.4959605
   
   in the mass-spec context:
   * V. Asgeirsson, C. Bauer and S. Grimme, Chem. Sci., 2017, 8, 4879.
     DOI: 10.1039/c7sc00601b
   
   for metadynamics refer to:
   * S. Grimme, J. Chem. Theory Comput., 2019, 155, 2847-2862
     DOI: 10.1021/acs.jctc.9b00143
   
   with help from (in alphabetical order)
   C. Bannwarth, F. Bohle, G. Brandenburg, E. Caldeweyher, M. Checinski,
   S. Dohm, S. Ehlert, S. Ehrlich, F. März, H. Neugebauer, J. Pisarek,
   P. Pracht, P. Shushkov, and S. Spicher.
   
 * started run on 2021/05/19 at 10:59:58.410     

           -------------------------------------------------
          |                Calculation Setup                |
           -------------------------------------------------

          program call               : /ihome/ghutchison/geoffh/xtb/xtb 663.xyz -opt
          hostname                   : smp-n144
          coordinate file            : 663.xyz
          omp threads                :                     1
          number of atoms            :                    33
          number of electrons        :                    88
          charge                     :                     0
          spin                       :                   0.0
          first test random number   :      0.96426507223515


########################################################################
# WARNING! Please study the warnings concerning your input carefully
#  - the use of '-opt' is discouraged, please use '--opt' next time
########################################################################

           ------------------------------------------------- 
          |                 G F N 2 - x T B                 |
          | Geometry, Frequencies, Noncovalent interactions |
          |            JCTC 2019 parametrisation            |
           ------------------------------------------------- 
             KAB for C  - Si     :                1.0500
             KAB for H  - Pd     :                0.9500
             k(s)              :                1.8500
             k(p)              :                2.2300
             k(d)              :                2.2300
             k(f)              :                2.0000
             kEN (H0ij)        :               -2.0000
             D4 a1             :                0.5200
             D4 a2             :                5.0000
             D4 s6             :                1.0000
             D4 s8             :                2.7000
             D4 s9             :                5.0000
             alphaj            :                2.0000

  Z AO/shell   Hii/eV     exponent
  1     Wed Apr 25 08:07:45 CEST 2018   EN: 2.200 GM2: 0.406  GM3: 0.0800  RAES: 1.40
     1s    -10.707211    1.230000
  6     Wed Apr 25 08:07:45 CEST 2018   EN: 2.550 GM2: 0.538  GM3: 0.1500  RAES: 3.00
     2s    -13.970922    2.096432
     2p    -10.063292    1.800000
 16     Tue Apr 24 11:44:34 CEST 2018   EN: 2.580 GM2: 0.340  GM3:-0.0502  RAES: 3.10
     3s    -20.029654    1.981333
     3p    -11.377694    2.025643
     3d     -0.420282    1.702555

           ------------------------------------------------- 
          |        Self-Consistent Charge Iterations        |
           ------------------------------------------------- 

          ...................................................
          :                      SETUP                      :
          :.................................................:
          :  # basis functions                  96          :
          :  # atomic orbitals                  94          :
          :  # shells                           52          :
          :  # electrons                        88          :
          :  max. iterations                   250          :
          :  Hamiltonian                  GFN2-xTB          :
          :  restarted?                      false          :
          :  GBSA solvation                  false          :
          :  PC potential                    false          :
          :  electronic temp.          300.0000000     K    :
          :  accuracy                    1.0000000          :
          :  -> integral cutoff          0.2500000E+02      :
          :  -> integral neglect         0.1000000E-07      :
          :  -> SCF convergence          0.1000000E-05 Eh   :
          :  -> wf. convergence          0.1000000E-03 e    :
          :  Broyden damping             0.4000000          :
          ...................................................

 iter      E             dE          RMSdq      gap      omega  full diag
   1    -47.3652965 -0.473653E+02  0.376E+00    3.04       0.0  T
   2    -47.4009562 -0.356597E-01  0.222E+00    3.01       1.0  T
   3    -47.3741740  0.267822E-01  0.125E+00    3.01       1.0  T
   4    -47.4088240 -0.346500E-01  0.468E-01    3.02       1.0  T
   5    -47.4120124 -0.318847E-02  0.186E-01    3.00       1.0  T
   6    -47.4126889 -0.676442E-03  0.816E-02    3.01       1.0  T
   7    -47.4128093 -0.120375E-03  0.242E-02    3.01       1.0  T
   8    -47.4128140 -0.472241E-05  0.147E-02    3.01       1.2  T
   9    -47.4128172 -0.319380E-05  0.519E-03    3.01       3.4  T
  10    -47.4128173 -0.164099E-06  0.194E-03    3.01       9.0  T
  11    -47.4128174 -0.380864E-07  0.109E-03    3.01      16.0  T
  12    -47.4128174 -0.165374E-07  0.437E-04    3.01      39.8  T
  13    -47.4128174 -0.787246E-09  0.182E-04    3.01      95.8  T

   *** convergence criteria satisfied after 13 iterations ***

         #    Occupation            Energy/Eh            Energy/eV
      -------------------------------------------------------------
         1        2.0000           -0.7278128             -19.8048
       ...           ...                  ...                  ...
        38        2.0000           -0.4276938             -11.6381
        39        2.0000           -0.4226874             -11.5019
        40        2.0000           -0.4064697             -11.0606
        41        2.0000           -0.3902414             -10.6190
        42        2.0000           -0.3893640             -10.5951
        43        2.0000           -0.3710592             -10.0970
        44        2.0000           -0.3675226             -10.0008 (HOMO)
        45                         -0.2569432              -6.9918 (LUMO)
        46                         -0.2358984              -6.4191
        47                         -0.2260910              -6.1522
        48                         -0.1997096              -5.4344
        49                         -0.1947081              -5.2983
       ...                                ...                  ...
        94                          0.7152785              19.4637
      -------------------------------------------------------------
                  HL-Gap            0.1105794 Eh            3.0090 eV
             Fermi-level           -0.3122329 Eh           -8.4963 eV

 SCC (total)                   0 d,  0 h,  0 min,  0.066 sec
 SCC setup                      ...        0 min,  0.000 sec (  0.584%)
 Dispersion                     ...        0 min,  0.001 sec (  0.850%)
 integral evaluation            ...        0 min,  0.017 sec ( 25.640%)
 zeroth order Hamiltonian       ...        0 min,  0.000 sec (  0.395%)
 iterations                     ...        0 min,  0.025 sec ( 37.768%)
 molecular gradient             ...        0 min,  0.022 sec ( 33.978%)
 printout                       ...        0 min,  0.000 sec (  0.698%)

         :::::::::::::::::::::::::::::::::::::::::::::::::::::
         ::                     SUMMARY                     ::
         :::::::::::::::::::::::::::::::::::::::::::::::::::::
         :: total energy             -46.689378360367 Eh    ::
         :: gradient norm              0.065359122510 Eh/a0 ::
         :: HOMO-LUMO gap              3.009018743493 eV    ::
         ::.................................................::
         :: SCC energy               -47.412817394230 Eh    ::
         :: -> isotropic ES            0.004156147058 Eh    ::
         :: -> anisotropic ES          0.005704214337 Eh    ::
         :: -> anisotropic XC          0.027940103866 Eh    ::
         :: -> dispersion             -0.034809112566 Eh    ::
         :: repulsion energy           0.723395425120 Eh    ::
         :: add. restraining           0.000000000000 Eh    ::
         :::::::::::::::::::::::::::::::::::::::::::::::::::::

      ----------------------------------------------------------- 
     |                   =====================                   |
     |                        A N C O P T                        |
     |                   =====================                   |
     |               Approximate Normal Coordinate               |
     |                Rational Function Optimizer                |
      ----------------------------------------------------------- 

          ...................................................
          :                      SETUP                      :
          :.................................................:
          :   optimization level            normal          :
          :   max. optcycles                   200          :
          :   ANC micro-cycles                  20          :
          :   degrees of freedom                93          :
          :.................................................:
          :   RF solver                   davidson          :
          :   input Hessian                  false          :
          :   write xtbopt.log                true          :
          :   linear?                        false          :
          :   energy convergence         0.5000000E-05 Eh   :
          :   grad. convergence          0.1000000E-02 Eh/α :
          :   maximium RF displ.         2.0000000          :
          :   Hlow (freq-cutoff)         0.5000000E-02      :
          :   Hmax (freq-cutoff)         5.0000000          :
          :   S6 in model hess.         20.0000000          :
          ...................................................

generating ANC from model Hessian ...
Using Lindh-Hessian (1995)
 Shifting diagonal of input Hessian by   4.704777366506587E-003
 Lowest  eigenvalues of input Hessian
   -0.000000   -0.000000    0.000000    0.000000    0.000000    0.000000
    0.005000    0.005127    0.005672    0.006014    0.007052    0.007223
    0.008598    0.009480    0.009984    0.011202    0.013729    0.015254
 Highest eigenvalues
    1.764340    1.791967    1.798239    1.827759    1.921238    2.028365
 

........................................................................
.............................. CYCLE    1 ..............................
........................................................................
   1    -47.4128174 -0.474128E+02  0.980E-05    3.01       0.0  T
   2    -47.4128174 -0.745359E-11  0.800E-05    3.01     217.5  T
   3    -47.4128174 -0.162544E-09  0.337E-05    3.01     517.2  T
     SCC iter.                  ...        0 min,  0.006 sec
     gradient                   ...        0 min,  0.022 sec
 * total energy  :   -46.6893784 Eh     change       -0.1974491E-07 Eh
   gradient norm :     0.0653597 Eh/α   predicted     0.0000000E+00 (-100.00%)
   displ. norm   :     0.2683577 α      lambda       -0.6863402E-02
   maximum displ.:     0.1015424 α      in ANC's #13, #39, #6, ...

........................................................................
.............................. CYCLE    2 ..............................
........................................................................
   1    -47.4468529 -0.474469E+02  0.208E-01    3.07       0.0  T
   2    -47.4469067 -0.538313E-04  0.107E-01    3.07       1.0  T
   3    -47.4468897  0.169746E-04  0.382E-02    3.08       1.0  T
   4    -47.4469129 -0.231595E-04  0.192E-02    3.07       1.0  T
   5    -47.4469182 -0.525773E-05  0.731E-03    3.07       2.4  T
   6    -47.4469185 -0.310415E-06  0.218E-03    3.07       8.0  T
   7    -47.4469186 -0.116925E-06  0.738E-04    3.07      23.6  T
     SCC iter.                  ...        0 min,  0.013 sec
     gradient                   ...        0 min,  0.020 sec
 * total energy  :   -46.6937978 Eh     change       -0.4419430E-02 Eh
   gradient norm :     0.0257022 Eh/α   predicted    -0.3678844E-02 ( -16.76%)
   displ. norm   :     0.1940588 α      lambda       -0.1368833E-02
   maximum displ.:     0.0877283 α      in ANC's #6, #5, #13, ...

........................................................................
.............................. CYCLE    3 ..............................
........................................................................
   1    -47.4598936 -0.474599E+02  0.118E-01    3.11       0.0  T
   2    -47.4599157 -0.220143E-04  0.577E-02    3.11       1.0  T
   3    -47.4599102  0.544640E-05  0.237E-02    3.11       1.0  T
   4    -47.4599183 -0.808112E-05  0.119E-02    3.11       1.5  T
   5    -47.4599204 -0.214575E-05  0.468E-03    3.11       3.7  T
   6    -47.4599205 -0.115033E-06  0.208E-03    3.11       8.4  T
     SCC iter.                  ...        0 min,  0.011 sec
     gradient                   ...        0 min,  0.021 sec
 * total energy  :   -46.6946059 Eh     change       -0.8080412E-03 Eh
   gradient norm :     0.0080797 Eh/α   predicted    -0.7101966E-03 ( -12.11%)
   displ. norm   :     0.1622369 α      lambda       -0.3554383E-03
   maximum displ.:     0.0750424 α      in ANC's #6, #5, #1, ...

........................................................................
.............................. CYCLE    4 ..............................
........................................................................
   1    -47.4601963 -0.474602E+02  0.865E-02    3.10       0.0  T
   2    -47.4602009 -0.456810E-05  0.467E-02    3.10       1.0  T
   3    -47.4601966  0.427089E-05  0.168E-02    3.10       1.0  T
   4    -47.4602014 -0.481726E-05  0.741E-03    3.10       2.4  T
   5    -47.4602022 -0.778851E-06  0.258E-03    3.10       6.7  T
   6    -47.4602022 -0.467663E-07  0.105E-03    3.10      16.6  T
     SCC iter.                  ...        0 min,  0.011 sec
     gradient                   ...        0 min,  0.021 sec
 * total energy  :   -46.6948323 Eh     change       -0.2264327E-03 Eh
   gradient norm :     0.0046676 Eh/α   predicted    -0.1824097E-03 ( -19.44%)
   displ. norm   :     0.2100290 α      lambda       -0.2653019E-03
   maximum displ.:     0.0979782 α      in ANC's #5, #6, #3, ...

........................................................................
.............................. CYCLE    5 ..............................
........................................................................
   1    -47.4574847 -0.474575E+02  0.112E-01    3.10       0.0  T
   2    -47.4574887 -0.390857E-05  0.590E-02    3.10       1.0  T
   3    -47.4574880  0.666499E-06  0.126E-02    3.10       1.4  T
   4    -47.4574886 -0.581793E-06  0.797E-03    3.10       2.2  T
   5    -47.4574894 -0.876104E-06  0.248E-03    3.10       7.0  T
   6    -47.4574895 -0.971081E-07  0.906E-04    3.10      19.2  T
     SCC iter.                  ...        0 min,  0.011 sec
     gradient                   ...        0 min,  0.021 sec
 * total energy  :   -46.6950034 Eh     change       -0.1711319E-03 Eh
   gradient norm :     0.0050737 Eh/α   predicted    -0.1385040E-03 ( -19.07%)
   displ. norm   :     0.1957132 α      lambda       -0.1638231E-03
   maximum displ.:     0.1015528 α      in ANC's #3, #1, #5, ...

........................................................................
.............................. CYCLE    6 ..............................
........................................................................
   1    -47.4551030 -0.474551E+02  0.119E-01    3.08       0.0  T
   2    -47.4551060 -0.300086E-05  0.625E-02    3.08       1.0  T
   3    -47.4551057  0.251459E-06  0.122E-02    3.08       1.4  T
   4    -47.4551052  0.517128E-06  0.858E-03    3.08       2.0  T
   5    -47.4551068 -0.158289E-05  0.161E-03    3.08      10.8  T
   6    -47.4551068 -0.429282E-07  0.824E-04    3.08      21.1  T
     SCC iter.                  ...        0 min,  0.011 sec
     gradient                   ...        0 min,  0.021 sec
 * total energy  :   -46.6951295 Eh     change       -0.1261073E-03 Eh
   gradient norm :     0.0053812 Eh/α   predicted    -0.8504930E-04 ( -32.56%)
   displ. norm   :     0.2428117 α      lambda       -0.1829698E-03
   maximum displ.:     0.1366736 α      in ANC's #3, #1, #5, ...

........................................................................
.............................. CYCLE    7 ..............................
........................................................................
   1    -47.4538974 -0.474539E+02  0.157E-01    3.06       0.0  T
   2    -47.4539031 -0.568522E-05  0.821E-02    3.06       1.0  T
   3    -47.4539021  0.105254E-05  0.166E-02    3.06       1.1  T
   4    -47.4539024 -0.290872E-06  0.112E-02    3.06       1.6  T
   5    -47.4539047 -0.235840E-05  0.235E-03    3.06       7.4  T
   6    -47.4539049 -0.130434E-06  0.100E-03    3.06      17.4  T
     SCC iter.                  ...        0 min,  0.011 sec
     gradient                   ...        0 min,  0.021 sec
 * total energy  :   -46.6952782 Eh     change       -0.1486593E-03 Eh
   gradient norm :     0.0052200 Eh/α   predicted    -0.9688113E-04 ( -34.83%)
   displ. norm   :     0.3018899 α      lambda       -0.2136192E-03
   maximum displ.:     0.1812517 α      in ANC's #3, #1, #5, ...

........................................................................
.............................. CYCLE    8 ..............................
........................................................................
   1    -47.4543073 -0.474543E+02  0.190E-01    3.05       0.0  T
   2    -47.4543154 -0.805428E-05  0.101E-01    3.05       1.0  T
   3    -47.4543136  0.172426E-05  0.201E-02    3.05       1.0  T
   4    -47.4543142 -0.586742E-06  0.134E-02    3.05       1.3  T
   5    -47.4543176 -0.339300E-05  0.278E-03    3.05       6.3  T
   6    -47.4543178 -0.160709E-06  0.129E-03    3.05      13.5  T
   7    -47.4543178 -0.184538E-07  0.805E-04    3.05      21.6  T
     SCC iter.                  ...        0 min,  0.013 sec
     gradient                   ...        0 min,  0.021 sec
 * total energy  :   -46.6954543 Eh     change       -0.1761338E-03 Eh
   gradient norm :     0.0047637 Eh/α   predicted    -0.1165447E-03 ( -33.83%)
   displ. norm   :     0.3606654 α      lambda       -0.2315243E-03
   maximum displ.:     0.2252028 α      in ANC's #3, #1, #2, ...

........................................................................
.............................. CYCLE    9 ..............................
........................................................................
   1    -47.4554687 -0.474555E+02  0.242E-01    3.03       0.0  T
   2    -47.4554823 -0.135683E-04  0.126E-01    3.03       1.0  T
   3    -47.4554812  0.112775E-05  0.245E-02    3.03       1.0  T
   4    -47.4554800  0.116058E-05  0.171E-02    3.03       1.0  T
   5    -47.4554860 -0.595502E-05  0.285E-03    3.03       6.1  T
   6    -47.4554861 -0.144416E-06  0.147E-03    3.03      11.9  T
   7    -47.4554861 -0.251167E-07  0.907E-04    3.03      19.2  T
     SCC iter.                  ...        0 min,  0.013 sec
     gradient                   ...        0 min,  0.021 sec
 * total energy  :   -46.6956467 Eh     change       -0.1923435E-03 Eh
   gradient norm :     0.0044347 Eh/α   predicted    -0.1308207E-03 ( -31.99%)
   displ. norm   :     0.4036851 α      lambda       -0.2304202E-03
   maximum displ.:     0.2599250 α      in ANC's #3, #1, #2, ...

........................................................................
.............................. CYCLE   10 ..............................
........................................................................
   1    -47.4568114 -0.474568E+02  0.267E-01    3.01       0.0  T
   2    -47.4568266 -0.152544E-04  0.140E-01    3.01       1.0  T
   3    -47.4568273 -0.616471E-06  0.256E-02    3.01       1.0  T
   4    -47.4568226  0.461188E-05  0.183E-02    3.01       1.0  T
   5    -47.4568306 -0.799525E-05  0.251E-03    3.01       6.9  T
   6    -47.4568307 -0.839274E-07  0.147E-03    3.01      11.8  T
   7    -47.4568308 -0.221828E-07  0.902E-04    3.01      19.3  T
     SCC iter.                  ...        0 min,  0.013 sec
     gradient                   ...        0 min,  0.021 sec
 * total energy  :   -46.6958359 Eh     change       -0.1892103E-03 Eh
   gradient norm :     0.0042381 Eh/α   predicted    -0.1339895E-03 ( -29.18%)
   displ. norm   :     0.4254833 α      lambda       -0.2025986E-03
   maximum displ.:     0.2787597 α      in ANC's #3, #1, #2, ...

........................................................................
.............................. CYCLE   11 ..............................
........................................................................
   1    -47.4572756 -0.474573E+02  0.297E-01    3.00       0.0  T
   2    -47.4572948 -0.191684E-04  0.153E-01    3.00       1.0  T
   3    -47.4572965 -0.172131E-05  0.279E-02    3.00       1.0  T
   4    -47.4572895  0.694417E-05  0.200E-02    3.00       1.0  T
   5    -47.4572997 -0.101882E-04  0.252E-03    3.00       6.9  T
   6    -47.4572998 -0.878967E-07  0.146E-03    3.00      11.9  T
   7    -47.4572998 -0.136476E-07  0.766E-04    3.00      22.7  T
     SCC iter.                  ...        0 min,  0.013 sec
     gradient                   ...        0 min,  0.021 sec
 * total energy  :   -46.6959977 Eh     change       -0.1618419E-03 Eh
   gradient norm :     0.0044256 Eh/α   predicted    -0.1196452E-03 ( -26.07%)
   displ. norm   :     0.4483432 α      lambda       -0.1797231E-03
   maximum displ.:     0.2985268 α      in ANC's #3, #1, #2, ...

........................................................................
.............................. CYCLE   12 ..............................
........................................................................
   1    -47.4579349 -0.474579E+02  0.301E-01    2.99       0.0  T
   2    -47.4579533 -0.184029E-04  0.157E-01    2.99       1.0  T
   3    -47.4579556 -0.232403E-05  0.277E-02    2.99       1.0  T
   4    -47.4579476  0.794987E-05  0.192E-02    2.99       1.0  T
   5    -47.4579580 -0.103842E-04  0.235E-03    2.99       7.4  T
   6    -47.4579581 -0.546743E-07  0.147E-03    2.99      11.9  T
   7    -47.4579581 -0.123952E-07  0.834E-04    2.99      20.9  T
     SCC iter.                  ...        0 min,  0.013 sec
     gradient                   ...        0 min,  0.021 sec
 * total energy  :   -46.6961296 Eh     change       -0.1319176E-03 Eh
   gradient norm :     0.0043884 Eh/α   predicted    -0.1079269E-03 ( -18.19%)
   displ. norm   :     0.3885143 α      lambda       -0.1208724E-03
   maximum displ.:     0.2534680 α      in ANC's #3, #1, #5, ...

........................................................................
.............................. CYCLE   13 ..............................
........................................................................
   1    -47.4572022 -0.474572E+02  0.264E-01    2.98       0.0  T
   2    -47.4572171 -0.148830E-04  0.137E-01    2.98       1.0  T
   3    -47.4572182 -0.107491E-05  0.250E-02    2.98       1.0  T
   4    -47.4572133  0.495687E-05  0.178E-02    2.98       1.0  T
   5    -47.4572210 -0.774063E-05  0.240E-03    2.98       7.3  T
   6    -47.4572211 -0.683287E-07  0.140E-03    2.98      12.4  T
   7    -47.4572211 -0.168446E-07  0.880E-04    2.98      19.8  T
     SCC iter.                  ...        0 min,  0.013 sec
     gradient                   ...        0 min,  0.021 sec
 * total energy  :   -46.6962120 Eh     change       -0.8241724E-04 Eh
   gradient norm :     0.0039649 Eh/α   predicted    -0.6955895E-04 ( -15.60%)
   displ. norm   :     0.3260683 α      lambda       -0.1412750E-03
   maximum displ.:     0.2097795 α      in ANC's #3, #1, #5, ...

........................................................................
.............................. CYCLE   14 ..............................
........................................................................
   1    -47.4625287 -0.474625E+02  0.231E-01    2.99       0.0  T
   2    -47.4625404 -0.117256E-04  0.119E-01    2.99       1.0  T
   3    -47.4625397  0.663641E-06  0.229E-02    2.99       1.0  T
   4    -47.4625389  0.836862E-06  0.157E-02    2.99       1.1  T
   5    -47.4625435 -0.466026E-05  0.252E-03    2.99       6.9  T
   6    -47.4625436 -0.107140E-06  0.121E-03    2.99      14.3  T
   7    -47.4625437 -0.105414E-07  0.767E-04    2.99      22.7  T
   8    -47.4625437 -0.210801E-08  0.249E-04    2.99      70.0  T
     SCC iter.                  ...        0 min,  0.015 sec
     gradient                   ...        0 min,  0.023 sec
 * total energy  :   -46.6962566 Eh     change       -0.4450988E-04 Eh
   gradient norm :     0.0057721 Eh/α   predicted    -0.7814928E-04 (  75.58%)
   displ. norm   :     0.3625899 α      lambda       -0.1271208E-03
   maximum displ.:     0.2269221 α      in ANC's #3, #1, #5, ...

........................................................................
.............................. CYCLE   15 ..............................
........................................................................
   1    -47.4569499 -0.474569E+02  0.237E-01    2.96       0.0  T
   2    -47.4569611 -0.112209E-04  0.124E-01    2.96       1.0  T
   3    -47.4569604  0.673046E-06  0.233E-02    2.96       1.0  T
   4    -47.4569571  0.325531E-05  0.168E-02    2.96       1.0  T
   5    -47.4569642 -0.703370E-05  0.258E-03    2.96       6.7  T
   6    -47.4569643 -0.108206E-06  0.133E-03    2.96      13.1  T
   7    -47.4569643 -0.868958E-08  0.826E-04    2.96      21.1  T
     SCC iter.                  ...        0 min,  0.013 sec
     gradient                   ...        0 min,  0.021 sec
 * total energy  :   -46.6963152 Eh     change       -0.5864054E-04 Eh
   gradient norm :     0.0044293 Eh/α   predicted    -0.7191772E-04 (  22.64%)
   displ. norm   :     0.0803644 α      lambda       -0.8206537E-04
   maximum displ.:     0.0376278 α      in ANC's #7, #5, #3, ...

........................................................................
.............................. CYCLE   16 ..............................
........................................................................
   1    -47.4583658 -0.474584E+02  0.541E-02    2.97       0.0  T
   2    -47.4583667 -0.846931E-06  0.284E-02    2.97       1.0  T
   3    -47.4583654  0.131669E-05  0.908E-03    2.97       1.9  T
   4    -47.4583670 -0.164698E-05  0.374E-03    2.97       4.7  T
   5    -47.4583671 -0.499144E-07  0.118E-03    2.97      14.7  T
   6    -47.4583671 -0.343472E-07  0.350E-04    2.97      49.8  T
     SCC iter.                  ...        0 min,  0.011 sec
     gradient                   ...        0 min,  0.021 sec
 * total energy  :   -46.6963543 Eh     change       -0.3912621E-04 Eh
   gradient norm :     0.0040208 Eh/α   predicted    -0.4129957E-04 (   5.55%)
   displ. norm   :     0.1585322 α      lambda       -0.7267440E-04
   maximum displ.:     0.0759211 α      in ANC's #1, #3, #5, ...

........................................................................
.............................. CYCLE   17 ..............................
........................................................................
   1    -47.4586246 -0.474586E+02  0.126E-01    2.96       0.0  T
   2    -47.4586287 -0.412457E-05  0.630E-02    2.96       1.0  T
   3    -47.4586278  0.916874E-06  0.131E-02    2.96       1.3  T
   4    -47.4586288 -0.107253E-05  0.838E-03    2.96       2.1  T
   5    -47.4586299 -0.106928E-05  0.153E-03    2.96      11.4  T
   6    -47.4586299 -0.408284E-07  0.771E-04    2.96      22.6  T
     SCC iter.                  ...        0 min,  0.011 sec
     gradient                   ...        0 min,  0.021 sec
 * total energy  :   -46.6964057 Eh     change       -0.5137038E-04 Eh
   gradient norm :     0.0034372 Eh/α   predicted    -0.3725353E-04 ( -27.48%)
   displ. norm   :     0.3337279 α      lambda       -0.1241381E-03
   maximum displ.:     0.1495645 α      in ANC's #5, #1, #4, ...

........................................................................
.............................. CYCLE   18 ..............................
........................................................................
   1    -47.4597351 -0.474597E+02  0.227E-01    2.95       0.0  T
   2    -47.4597468 -0.117303E-04  0.117E-01    2.95       1.0  T
   3    -47.4597463  0.481248E-06  0.223E-02    2.95       1.0  T
   4    -47.4597439  0.240808E-05  0.162E-02    2.95       1.1  T
   5    -47.4597501 -0.613977E-05  0.238E-03    2.95       7.3  T
   6    -47.4597501 -0.660009E-07  0.141E-03    2.95      12.4  T
   7    -47.4597502 -0.126106E-07  0.897E-04    2.95      19.4  T
   8    -47.4597502 -0.640997E-08  0.262E-04    2.95      66.5  T
     SCC iter.                  ...        0 min,  0.014 sec
     gradient                   ...        0 min,  0.023 sec
 * total energy  :   -46.6964744 Eh     change       -0.6873197E-04 Eh
   gradient norm :     0.0031108 Eh/α   predicted    -0.6898440E-04 (   0.37%)
   displ. norm   :     0.3411902 α      lambda       -0.6798632E-04
   maximum displ.:     0.1778143 α      in ANC's #1, #3, #5, ...

........................................................................
.............................. CYCLE   19 ..............................
........................................................................
   1    -47.4565245 -0.474565E+02  0.216E-01    2.94       0.0  T
   2    -47.4565343 -0.971391E-05  0.113E-01    2.94       1.0  T
   3    -47.4565356 -0.130311E-05  0.198E-02    2.94       1.0  T
   4    -47.4565321  0.347907E-05  0.131E-02    2.94       1.3  T
   5    -47.4565367 -0.462867E-05  0.221E-03    2.94       7.9  T
   6    -47.4565368 -0.618968E-07  0.128E-03    2.94      13.6  T
   7    -47.4565368 -0.111543E-07  0.828E-04    2.94      21.0  T
   8    -47.4565368 -0.450812E-08  0.240E-04    2.94      72.6  T
     SCC iter.                  ...        0 min,  0.014 sec
     gradient                   ...        0 min,  0.022 sec
 * total energy  :   -46.6965029 Eh     change       -0.2851820E-04 Eh
   gradient norm :     0.0046355 Eh/α   predicted    -0.3795366E-04 (  33.09%)
   displ. norm   :     0.1220284 α      lambda       -0.6528563E-04
   maximum displ.:     0.0558053 α      in ANC's #7, #4, #5, ...

........................................................................
.............................. CYCLE   20 ..............................
........................................................................
   1    -47.4593299 -0.474593E+02  0.942E-02    2.96       0.0  T
   2    -47.4593324 -0.241572E-05  0.481E-02    2.96       1.0  T
   3    -47.4593320  0.319157E-06  0.968E-03    2.96       1.8  T
   4    -47.4593324 -0.316645E-06  0.628E-03    2.96       2.8  T
   5    -47.4593330 -0.639971E-06  0.127E-03    2.96      13.7  T
   6    -47.4593330 -0.437007E-07  0.404E-04    2.96      43.0  T
     SCC iter.                  ...        0 min,  0.011 sec
     gradient                   ...        0 min,  0.021 sec
 * total energy  :   -46.6965385 Eh     change       -0.3550685E-04 Eh
   gradient norm :     0.0033169 Eh/α   predicted    -0.3313069E-04 (  -6.69%)
   displ. norm   :     0.2218621 α      lambda       -0.6466685E-04
   maximum displ.:     0.1049527 α      in ANC's #5, #4, #1, ...
 * RMSD in coord.:     0.7881471 α      energy gain  -0.7160090E-02 Eh

generating ANC from model Hessian ...
Using Lindh-Hessian (1995)
 Shifting diagonal of input Hessian by   4.696189985126228E-003
 Lowest  eigenvalues of input Hessian
   -0.000000   -0.000000    0.000000    0.000000    0.000000    0.000000
    0.005000    0.005136    0.005678    0.006106    0.007288    0.007362
    0.008837    0.009680    0.010469    0.011455    0.014171    0.016414
 Highest eigenvalues
    1.851880    1.878643    1.883817    1.891594    1.984508    2.044060
 

........................................................................
.............................. CYCLE   21 ..............................
........................................................................
   1    -47.4596746 -0.474597E+02  0.169E-01    2.96       0.0  T
   2    -47.4596821 -0.751765E-05  0.849E-02    2.96       1.0  T
   3    -47.4596814  0.676704E-06  0.169E-02    2.96       1.0  T
   4    -47.4596824 -0.990913E-06  0.107E-02    2.96       1.6  T
   5    -47.4596841 -0.163738E-05  0.243E-03    2.96       7.2  T
   6    -47.4596842 -0.132014E-06  0.904E-04    2.96      19.3  T
   7    -47.4596842 -0.130146E-07  0.480E-04    2.96      36.3  T
     SCC iter.                  ...        0 min,  0.013 sec
     gradient                   ...        0 min,  0.022 sec
 * total energy  :   -46.6965548 Eh     change       -0.1631869E-04 Eh
   gradient norm :     0.0050933 Eh/α   predicted     0.0000000E+00 (-100.00%)
   displ. norm   :     0.0487011 α      lambda       -0.5112010E-04
   maximum displ.:     0.0281746 α      in ANC's #5, #9, #3, ...

........................................................................
.............................. CYCLE   22 ..............................
........................................................................
   1    -47.4593878 -0.474594E+02  0.348E-02    2.96       0.0  T
   2    -47.4593881 -0.377995E-06  0.180E-02    2.96       1.0  T
   3    -47.4593874  0.719242E-06  0.624E-03    2.96       2.8  T
   4    -47.4593883 -0.853837E-06  0.257E-03    2.96       6.8  T
   5    -47.4593883 -0.320995E-07  0.985E-04    2.96      17.7  T
     SCC iter.                  ...        0 min,  0.010 sec
     gradient                   ...        0 min,  0.021 sec
 * total energy  :   -46.6965877 Eh     change       -0.3290514E-04 Eh
   gradient norm :     0.0014824 Eh/α   predicted    -0.2562112E-04 ( -22.14%)
   displ. norm   :     0.0756580 α      lambda       -0.2411471E-04
   maximum displ.:     0.0440942 α      in ANC's #5, #9, #10, ...

........................................................................
.............................. CYCLE   23 ..............................
........................................................................
   1    -47.4592089 -0.474592E+02  0.406E-02    2.97       0.0  T
   2    -47.4592093 -0.400760E-06  0.226E-02    2.97       1.0  T
   3    -47.4592066  0.272372E-05  0.111E-02    2.97       1.6  T
   4    -47.4592098 -0.315436E-05  0.249E-03    2.97       7.0  T
   5    -47.4592098  0.786649E-09  0.128E-03    2.97      13.6  T
   6    -47.4592098 -0.357016E-07  0.346E-04    2.97      50.3  T
   7    -47.4592098 -0.232309E-08  0.147E-04    2.97     118.6  T
     SCC iter.                  ...        0 min,  0.013 sec
     gradient                   ...        0 min,  0.022 sec
 * total energy  :   -46.6966040 Eh     change       -0.1636115E-04 Eh
   gradient norm :     0.0029425 Eh/α   predicted    -0.1209052E-04 ( -26.10%)
   displ. norm   :     0.0436565 α      lambda       -0.1687884E-04
   maximum displ.:     0.0259418 α      in ANC's #5, #9, #10, ...

........................................................................
.............................. CYCLE   24 ..............................
........................................................................
   1    -47.4593180 -0.474593E+02  0.255E-02    2.98       0.0  T
   2    -47.4593181 -0.129798E-06  0.137E-02    2.98       1.3  T
   3    -47.4593181  0.316188E-07  0.260E-03    2.98       6.7  T
   4    -47.4593181 -0.185006E-07  0.173E-03    2.98      10.1  T
   5    -47.4593182 -0.501430E-07  0.316E-04    2.98      55.2  T
   6    -47.4593182 -0.232278E-08  0.127E-04    2.98     136.7  T
     SCC iter.                  ...        0 min,  0.011 sec
     gradient                   ...        0 min,  0.022 sec
 * total energy  :   -46.6966165 Eh     change       -0.1249378E-04 Eh
   gradient norm :     0.0024185 Eh/α   predicted    -0.8455908E-05 ( -32.32%)
   displ. norm   :     0.0675650 α      lambda       -0.1891327E-04
   maximum displ.:     0.0423127 α      in ANC's #5, #9, #10, ...

........................................................................
.............................. CYCLE   25 ..............................
........................................................................
   1    -47.4595304 -0.474595E+02  0.450E-02    2.98       0.0  T
   2    -47.4595309 -0.486992E-06  0.235E-02    2.98       1.0  T
   3    -47.4595310 -0.366765E-07  0.419E-03    2.98       4.2  T
   4    -47.4595309  0.859483E-07  0.291E-03    2.98       6.0  T
   5    -47.4595310 -0.173298E-06  0.362E-04    2.98      48.1  T
   6    -47.4595311 -0.234462E-08  0.170E-04    2.98     102.2  T
     SCC iter.                  ...        0 min,  0.011 sec
     gradient                   ...        0 min,  0.022 sec
 * total energy  :   -46.6966296 Eh     change       -0.1305855E-04 Eh
   gradient norm :     0.0009893 Eh/α   predicted    -0.9502963E-05 ( -27.23%)
   displ. norm   :     0.1013244 α      lambda       -0.1011527E-05
   maximum displ.:     0.0634713 α      in ANC's #5, #9, #10, ...

........................................................................
.............................. CYCLE   26 ..............................
........................................................................
   1    -47.4596365 -0.474596E+02  0.673E-02    3.00       0.0  T
   2    -47.4596376 -0.109076E-05  0.352E-02    3.00       1.0  T
   3    -47.4596377 -0.544496E-07  0.635E-03    3.00       2.7  T
   4    -47.4596375  0.170393E-06  0.448E-03    3.00       3.9  T
   5    -47.4596379 -0.396873E-06  0.544E-04    3.00      32.0  T
   6    -47.4596379 -0.541626E-08  0.247E-04    3.00      70.5  T
     SCC iter.                  ...        0 min,  0.011 sec
     gradient                   ...        0 min,  0.022 sec
 * total energy  :   -46.6966273 Eh     change        0.2246313E-05 Eh
   gradient norm :     0.0031549 Eh/α   predicted    -0.5112988E-06 (-122.76%)
   displ. norm   :     0.0183243 α      lambda       -0.1193977E-04
   maximum displ.:     0.0111781 α      in ANC's #9, #10, #5, ...

........................................................................
.............................. CYCLE   27 ..............................
........................................................................
   1    -47.4597183 -0.474597E+02  0.184E-02    2.99       0.0  T
   2    -47.4597184 -0.122134E-06  0.906E-03    2.99       1.9  T
   3    -47.4597183  0.554551E-07  0.248E-03    2.99       7.0  T
   4    -47.4597184 -0.829136E-07  0.123E-03    2.99      14.2  T
   5    -47.4597184 -0.969693E-08  0.267E-04    2.99      65.1  T
   6    -47.4597184 -0.109718E-08  0.113E-04    2.99     154.2  T
     SCC iter.                  ...        0 min,  0.011 sec
     gradient                   ...        0 min,  0.022 sec
 * total energy  :   -46.6966361 Eh     change       -0.8786992E-05 Eh
   gradient norm :     0.0016676 Eh/α   predicted    -0.5972032E-05 ( -32.04%)
   displ. norm   :     0.0275333 α      lambda       -0.4861024E-05
   maximum displ.:     0.0167703 α      in ANC's #9, #10, #5, ...

........................................................................
.............................. CYCLE   28 ..............................
........................................................................
   1    -47.4598121 -0.474598E+02  0.279E-02    2.99       0.0  T
   2    -47.4598124 -0.278227E-06  0.137E-02    2.99       1.3  T
   3    -47.4598123  0.143586E-06  0.383E-03    2.99       4.5  T
   4    -47.4598125 -0.208796E-06  0.187E-03    2.99       9.3  T
   5    -47.4598125 -0.221725E-07  0.418E-04    2.99      41.7  T
   6    -47.4598125 -0.262553E-08  0.183E-04    2.99      95.0  T
     SCC iter.                  ...        0 min,  0.011 sec
     gradient                   ...        0 min,  0.022 sec
 * total energy  :   -46.6966376 Eh     change       -0.1428908E-05 Eh
   gradient norm :     0.0008969 Eh/α   predicted    -0.2435893E-05 (  70.47%)
   displ. norm   :     0.0332967 α      lambda       -0.5255282E-05
   maximum displ.:     0.0213548 α      in ANC's #5, #7, #4, ...

   *** GEOMETRY OPTIMIZATION CONVERGED AFTER 28 ITERATIONS ***

------------------------------------------------------------------------
 total energy gain   :        -0.0072592 Eh       -4.5552 kcal/mol
 total RMSD          :         0.7932563 a0        0.4198 Å
 total power (kW/mol):        -0.6806793 (step)  -13.1591 (real)
------------------------------------------------------------------------

 ANCopt (total)                0 d,  0 h,  0 min,  1.448 sec
 optimizer setup                ...        0 min,  0.000 sec (  0.010%)
 model hessian                  ...        0 min,  0.016 sec (  1.087%)
 ANC generation                 ...        0 min,  0.002 sec (  0.155%)
 coordinate transformation      ...        0 min,  0.001 sec (  0.043%)
 single point calculation       ...        0 min,  1.415 sec ( 97.717%)
 optimization log               ...        0 min,  0.006 sec (  0.440%)
 hessian update                 ...        0 min,  0.000 sec (  0.032%)
 rational function              ...        0 min,  0.006 sec (  0.391%)

================
 final structure:
================
$coord
   -0.27833198864777    0.55190267408424    0.86284068838022      C 
   -3.14635395676946   -0.58964816643765    1.85436971402098      S 
   -3.19661260168014    1.52351846255423    4.32759313659869      C 
   -1.10321164014873    2.99016877306696    4.37448012974483      C 
    0.60172892190705    2.46626163815875    2.35398654805437      C 
    3.01160744063943    3.75691192496756    2.10941689602201      C 
    4.34333144808998    4.21457035143507    0.00911869683885      C 
    6.97465697023935    5.31542765184861    0.18656621516497      C 
    8.87644961073997    3.30661207384646   -0.39370233335102      C 
   11.09101762630916    3.71228106722996   -2.77727991962841      S 
   12.37735848565570    0.74645028980940   -2.21888602508124      C 
   14.50749996908883   -0.20731466504896   -3.79496253843016      C 
   13.57448334932623   -1.12383818025032   -6.37452610525347      C 
   11.12521536673288   -0.44421148334142   -0.32002012770698      C 
    9.13587768492125    1.00601895474616    0.71727519224317      C 
    3.52660775753973    3.72600656918701   -2.58685201091680      C 
    1.28687327698041    4.33007669880837   -3.52856735717335      C 
    0.61292104042273   -0.27331367222353   -0.75613644535794      H 
   -4.77396616413101    1.53127786578387    5.59801859370002      H 
   -0.76213239569504    4.42692061029633    5.77168285690370      H 
    3.80015243508272    4.36473363217016    3.90075831611038      H 
    7.30061493525783    6.05472825355623    2.08900341328140      H 
    7.18818667134348    6.86654395599715   -1.15874867802097      H 
   15.42663167988317   -1.76356590452185   -2.79788272352636      H 
   15.89626514199215    1.29544575029180   -4.07226721406973      H 
   12.20518990125296   -2.63821733590243   -6.14153665851280      H 
   15.14656600921789   -1.82460447544344   -7.49495000982199      H 
   12.67612688738081    0.41758423847554   -7.39450415280546      H 
   11.61151243852571   -2.30721648299453    0.33330444734071      H 
    7.93968613644712    0.36346244772417    2.23026216512658      H 
    4.97807806477988    2.96283316210959   -3.81538539254973      H 
   -0.17085167801948    5.15583706086135   -2.37336122953671      H 
    0.82768166469263    4.01485915816434   -5.48524312540574      H 
$end
           -------------------------------------------------
          |                Final Singlepoint                |
           -------------------------------------------------

          ...................................................
          :                      SETUP                      :
          :.................................................:
          :  # basis functions                  96          :
          :  # atomic orbitals                  94          :
          :  # shells                           52          :
          :  # electrons                        88          :
          :  max. iterations                   250          :
          :  Hamiltonian                  GFN2-xTB          :
          :  restarted?                      false          :
          :  GBSA solvation                  false          :
          :  PC potential                    false          :
          :  electronic temp.          300.0000000     K    :
          :  accuracy                    1.0000000          :
          :  -> integral cutoff          0.2500000E+02      :
          :  -> integral neglect         0.1000000E-07      :
          :  -> SCF convergence          0.1000000E-05 Eh   :
          :  -> wf. convergence          0.1000000E-03 e    :
          :  Broyden damping             0.4000000          :
          ...................................................

 iter      E             dE          RMSdq      gap      omega  full diag
   1    -47.4598125 -0.474598E+02  0.107E-04    2.99       0.0  T
   2    -47.4598125  0.660805E-11  0.519E-05    2.99     335.7  T
   3    -47.4598125 -0.678995E-10  0.518E-05    2.99     335.9  T

   *** convergence criteria satisfied after 3 iterations ***

         #    Occupation            Energy/Eh            Energy/eV
      -------------------------------------------------------------
         1        2.0000           -0.7269868             -19.7823
       ...           ...                  ...                  ...
        38        2.0000           -0.4288528             -11.6697
        39        2.0000           -0.4253595             -11.5746
        40        2.0000           -0.4064452             -11.0599
        41        2.0000           -0.3927392             -10.6870
        42        2.0000           -0.3890557             -10.5867
        43        2.0000           -0.3739818             -10.1766
        44        2.0000           -0.3673432              -9.9959 (HOMO)
        45                         -0.2574584              -7.0058 (LUMO)
        46                         -0.2351752              -6.3994
        47                         -0.2261926              -6.1550
        48                         -0.1989530              -5.4138
        49                         -0.1968991              -5.3579
       ...                                ...                  ...
        94                          0.7254217              19.7397
      -------------------------------------------------------------
                  HL-Gap            0.1098848 Eh            2.9901 eV
             Fermi-level           -0.3124008 Eh           -8.5009 eV

 SCC (total)                   0 d,  0 h,  0 min,  0.047 sec
 SCC setup                      ...        0 min,  0.000 sec (  0.657%)
 Dispersion                     ...        0 min,  0.000 sec (  0.927%)
 integral evaluation            ...        0 min,  0.016 sec ( 34.988%)
 zeroth order Hamiltonian       ...        0 min,  0.000 sec (  0.537%)
 iterations                     ...        0 min,  0.006 sec ( 13.826%)
 molecular gradient             ...        0 min,  0.023 sec ( 48.053%)
 printout                       ...        0 min,  0.000 sec (  0.891%)

         :::::::::::::::::::::::::::::::::::::::::::::::::::::
         ::                     SUMMARY                     ::
         :::::::::::::::::::::::::::::::::::::::::::::::::::::
         :: total energy             -46.696637539151 Eh    ::
         :: gradient norm              0.000897050406 Eh/a0 ::
         :: HOMO-LUMO gap              2.990118006673 eV    ::
         ::.................................................::
         :: SCC energy               -47.459812517965 Eh    ::
         :: -> isotropic ES            0.004312707670 Eh    ::
         :: -> anisotropic ES          0.005057044115 Eh    ::
         :: -> anisotropic XC          0.027312013148 Eh    ::
         :: -> dispersion             -0.035826436678 Eh    ::
         :: repulsion energy           0.763009274516 Eh    ::
         :: add. restraining           0.000000000000 Eh    ::
         :::::::::::::::::::::::::::::::::::::::::::::::::::::

           -------------------------------------------------
          |                Property Printout                |
           -------------------------------------------------

    * Orbital Energies and Occupations

         #    Occupation            Energy/Eh            Energy/eV
      -------------------------------------------------------------
         1        2.0000           -0.7269868             -19.7823
       ...           ...                  ...                  ...
        32        2.0000           -0.4560680             -12.4102
        33        2.0000           -0.4532222             -12.3328
        34        2.0000           -0.4484498             -12.2029
        35        2.0000           -0.4396720             -11.9641
        36        2.0000           -0.4359502             -11.8628
        37        2.0000           -0.4341217             -11.8131
        38        2.0000           -0.4288528             -11.6697
        39        2.0000           -0.4253595             -11.5746
        40        2.0000           -0.4064452             -11.0599
        41        2.0000           -0.3927392             -10.6870
        42        2.0000           -0.3890557             -10.5867
        43        2.0000           -0.3739818             -10.1766
        44        2.0000           -0.3673432              -9.9959 (HOMO)
        45                         -0.2574584              -7.0058 (LUMO)
        46                         -0.2351752              -6.3994
        47                         -0.2261926              -6.1550
        48                         -0.1989530              -5.4138
        49                         -0.1968991              -5.3579
        50                         -0.1819863              -4.9521
        51                         -0.1604608              -4.3664
        52                         -0.1295583              -3.5255
        53                         -0.1131285              -3.0784
        54                         -0.1091755              -2.9708
        55                         -0.0040617              -0.1105
       ...                                ...                  ...
        94                          0.7254217              19.7397
      -------------------------------------------------------------
                  HL-Gap            0.1098848 Eh            2.9901 eV
             Fermi-level           -0.3124008 Eh           -8.5009 eV

     #   Z        covCN         q      C6AA      α(0)
     1   6 C      2.945    -0.026    28.647     8.778
     2  16 S      2.299    -0.030   142.306    20.078
     3   6 C      2.934    -0.022    28.548     8.763
     4   6 C      3.126    -0.050    29.038     8.824
     5   6 C      3.152     0.003    27.671     8.603
     6   6 C      2.901    -0.049    29.220     8.863
     7   6 C      2.952     0.009    27.812     8.650
     8   6 C      3.834    -0.059    21.614     6.615
     9   6 C      2.991     0.022    27.498     8.602
    10  16 S      2.359    -0.069   143.913    20.191
    11   6 C      2.986     0.020    27.563     8.612
    12   6 C      3.824    -0.053    21.503     6.599
    13   6 C      3.754    -0.100    22.461     6.758
    14   6 C      3.120    -0.058    29.255     8.858
    15   6 C      3.115    -0.058    29.258     8.860
    16   6 C      2.893    -0.027    28.676     8.780
    17   6 C      2.838    -0.086    30.148     8.998
    18   1 H      0.927     0.041     2.435     2.440
    19   1 H      0.926     0.042     2.424     2.435
    20   1 H      0.926     0.035     2.511     2.478
    21   1 H      0.925     0.035     2.516     2.480
    22   1 H      0.924     0.047     2.362     2.403
    23   1 H      0.924     0.051     2.313     2.378
    24   1 H      0.924     0.040     2.445     2.446
    25   1 H      0.924     0.043     2.408     2.427
    26   1 H      0.925     0.038     2.476     2.460
    27   1 H      0.925     0.038     2.470     2.458
    28   1 H      0.925     0.042     2.420     2.433
    29   1 H      0.926     0.030     2.585     2.514
    30   1 H      0.926     0.031     2.573     2.508
    31   1 H      0.925     0.040     2.449     2.447
    32   1 H      0.926     0.040     2.453     2.449
    33   1 H      0.926     0.039     2.464     2.455

 Mol. C6AA /au·bohr⁶  :      16145.641653
 Mol. C8AA /au·bohr⁸  :     454860.229912
 Mol. α(0) /au        :        204.642405


Wiberg/Mayer (AO) data.
largest (>0.10) Wiberg bond orders for each atom
          total WBO             WBO to atom ...
     1  C   3.945        C    5 1.553    S    2 1.201    H   18 0.970    C    3 0.111
     2  S   2.639        C    1 1.201    C    3 1.182
     3  C   3.949        C    4 1.653    S    2 1.182    H   19 0.971    C    1 0.111
     4  C   3.985        C    3 1.653    C    5 1.217    H   20 0.965
     5  C   3.986        C    1 1.553    C    4 1.217    C    6 1.084
     6  C   3.987        C    7 1.772    C    5 1.084    H   21 0.957
     7  C   3.986        C    6 1.772    C   16 1.066    C    8 0.982
     8  C   3.995        C    9 1.007    C    7 0.982    H   23 0.966    H   22 0.957
     9  C   3.945        C   15 1.605    S   10 1.150    C    8 1.007    C   11 0.111
    10  S   2.575        C    9 1.150    C   11 1.148
    11  C   3.945        C   14 1.609    S   10 1.148    C   12 1.025    C    9 0.111
    12  C   3.997        C   11 1.025    C   13 1.000    H   24 0.971    H   25 0.970
    13  C   3.995        C   12 1.000    H   26 0.989    H   28 0.987    H   27 0.986
    14  C   3.986        C   11 1.609    C   15 1.264    H   29 0.965
    15  C   3.986        C    9 1.605    C   14 1.264    H   30 0.964
    16  C   3.992        C   17 1.927    C    7 1.066    H   31 0.957
    17  C   3.991        C   16 1.927    H   33 0.977    H   32 0.976
    18  H   0.998        C    1 0.970
    19  H   0.998        C    3 0.971
    20  H   0.999        C    4 0.965
    21  H   0.999        C    6 0.957
    22  H   0.997        C    8 0.957
    23  H   0.996        C    8 0.966
    24  H   0.998        C   12 0.971
    25  H   0.998        C   12 0.970
    26  H   0.999        C   13 0.989
    27  H   0.998        C   13 0.986
    28  H   0.998        C   13 0.987
    29  H   0.999        C   14 0.965
    30  H   0.999        C   15 0.964
    31  H   0.997        C   16 0.957
    32  H   0.998        C   17 0.976
    33  H   0.998        C   17 0.977

molecular dipole:
                 x           y           z       tot (Debye)
 q only:        0.231       0.063      -0.092
   full:        0.387       0.033       0.183       1.092
molecular quadrupole (traceless):
                xx          xy          yy          xz          yz          zz
 q only:        2.509      -2.024      -2.299      -3.884       2.190      -0.211
  q+dip:        2.365      -6.423      -4.255      -2.701       4.815       1.890
   full:        2.157      -6.832      -3.393      -1.880       4.794       1.237

           -------------------------------------------------
          |                Geometry Summary                 |
           -------------------------------------------------

      molecular mass/u    :      260.4114000
   center of mass at/Å    :        2.8115307       1.0470133      -0.2086700
  moments of inertia/u·Å² :        0.5625558E+03   0.3287815E+04   0.3357515E+04
rotational constants/cm⁻¹ :        0.2996615E-01   0.5127306E-02   0.5020866E-02

 * 29 selected distances

     #   Z        #   Z                                     value/Å
     1   6 C      2  16 S                                 1.7156950
     2  16 S      3   6 C                                 1.7216433
     3   6 C      4   6 C                                 1.3528310
     1   6 C      5   6 C                                 1.3659328
     4   6 C      5   6 C                                 1.4261985
     6   6 C      7   6 C                                 1.3381168
     9   6 C     10  16 S                                 1.7350496
    10  16 S     11   6 C                                 1.7360425 (max)
    12   6 C     13   6 C                                 1.5304739
    11   6 C     14   6 C                                 1.3585774
     9   6 C     15   6 C                                 1.3588941
    14   6 C     15   6 C                                 1.4136675
    16   6 C     17   6 C                                 1.3248615
     1   6 C     18   1 H                                 1.0710319 (min)
     3   6 C     19   1 H                                 1.0717747
     4   6 C     20   1 H                                 1.0757754
     6   6 C     21   1 H                                 1.0845106
     8   6 C     22   1 H                                 1.0937572
     8   6 C     23   1 H                                 1.0923927
    12   6 C     24   1 H                                 1.0923235
    12   6 C     25   1 H                                 1.0927037
    13   6 C     26   1 H                                 1.0874036
    13   6 C     27   1 H                                 1.0867950
    13   6 C     28   1 H                                 1.0875053
    14   6 C     29   1 H                                 1.0759497
    15   6 C     30   1 H                                 1.0757905
    16   6 C     31   1 H                                 1.0842962
    17   6 C     32   1 H                                 1.0768911
    17   6 C     33   1 H                                 1.0765603

 * 3 distinct bonds (by element types)

   Z      Z             #   av. dist./Å        max./Å        min./Å
   1 H    6 C          16     1.0828413     1.0937572     1.0710319
   6 C    6 C           9     1.3855060     1.5304739     1.3248615
   6 C   16 S           4     1.7271076     1.7360425     1.7156950


optimized geometry written to: xtbopt.xyz


           -------------------------------------------------
          | TOTAL ENERGY              -46.696637539151 Eh   |
          | GRADIENT NORM               0.000897050406 Eh/α |
          | HOMO-LUMO GAP               2.990118006673 eV   |
           -------------------------------------------------

------------------------------------------------------------------------
 * finished run on 2021/05/19 at 11:00:00.002     
------------------------------------------------------------------------
 total:
 * wall-time:     0 d,  0 h,  0 min,  1.591 sec
 *  cpu-time:     0 d,  0 h,  0 min,  1.584 sec
 * ratio c/w:     0.995 speedup
 SCF:
 * wall-time:     0 d,  0 h,  0 min,  0.066 sec
 *  cpu-time:     0 d,  0 h,  0 min,  0.066 sec
 * ratio c/w:     0.998 speedup
 ANC optimizer:
 * wall-time:     0 d,  0 h,  0 min,  1.496 sec
 *  cpu-time:     0 d,  0 h,  0 min,  1.490 sec
 * ratio c/w:     0.996 speedup

