      -----------------------------------------------------------      
     |                   =====================                   |     
     |                           x T B                           |     
     |                   =====================                   |     
     |                         S. Grimme                         |     
     |          Mulliken Center for Theoretical Chemistry        |     
     |                    University of Bonn                     |     
     |                Version 6.2 RC2 (SAW190805)                |     
      -----------------------------------------------------------      

   This program is distributed in the hope that it will be useful,
   but WITHOUT ANY WARRANTY; without even the implied warranty of
   MERCHANTABILITY or FITNESS FOR A PARTICULAR PURPOSE.
   
   FOR NON-COMMERCIAL, ACADEMIA USE ONLY.
   
   Cite this work as:
   * S. Grimme, C. Bannwarth, P. Shushkov, J. Chem. Theory Comput., 2017,
     13, 1989-2009. DOI: 10.1021/acs.jctc.7b00118
   * C. Bannwarth, S. Ehlert and S. Grimme., J. Chem. Theory Comput., 2019,
     15, 1652-1671. DOI: 10.1021/acs.jctc.8b01176
   * P. Pracht, E. Caldeweyher, S. Ehlert, S. Grimme, ChemRxiv, 2019, preprint.
     DOI: 10.26434/chemrxiv.8326202.v1
   
   for DFT-D4:
   * E. Caldeweyher, C. Bannwarth and S. Grimme, J. Chem. Phys., 2017,
     147, 034112. DOI: 10.1063/1.4993215
   * E. Caldeweyher, S. Ehlert, A. Hansen, H. Neugebauer, S. Spicher,
     C. Bannwarth and S. Grimme, J. Chem. Phys., 2019, 150, 154122.
     DOI: 10.1063/1.5090222
   
   for sTDA-xTB:
   * S. Grimme and C. Bannwarth, J. Chem. Phys., 2016, 145, 054103.
     DOI: 10.1063/1.4959605
   
   in the mass-spec context:
   * V. Asgeirsson, C. Bauer and S. Grimme, Chem. Sci., 2017, 8, 4879.
     DOI: 10.1039/c7sc00601b
   
   for metadynamics refer to:
   * S. Grimme, J. Chem. Theory Comput., 2019, 155, 2847-2862
     DOI: 10.1021/acs.jctc.9b00143
   
   with help from (in alphabetical order)
   C. Bannwarth, F. Bohle, G. Brandenburg, E. Caldeweyher, M. Checinski,
   S. Dohm, S. Ehlert, S. Ehrlich, F. März, H. Neugebauer, J. Pisarek,
   P. Pracht, P. Shushkov, and S. Spicher.
   
 * started run on 2021/05/19 at 11:00:00.020     

           -------------------------------------------------
          |                Calculation Setup                |
           -------------------------------------------------

          program call               : /ihome/ghutchison/geoffh/xtb/xtb 664.xyz -opt
          hostname                   : smp-n144
          coordinate file            : 664.xyz
          omp threads                :                     1
          number of atoms            :                    14
          number of electrons        :                    42
          charge                     :                     0
          spin                       :                   0.0
          first test random number   :      0.26761459919961


########################################################################
# WARNING! Please study the warnings concerning your input carefully
#  - the use of '-opt' is discouraged, please use '--opt' next time
########################################################################

           ------------------------------------------------- 
          |                 G F N 2 - x T B                 |
          | Geometry, Frequencies, Noncovalent interactions |
          |            JCTC 2019 parametrisation            |
           ------------------------------------------------- 
             KAB for C  - Si     :                1.0500
             KAB for H  - Pd     :                0.9500
             k(s)              :                1.8500
             k(p)              :                2.2300
             k(d)              :                2.2300
             k(f)              :                2.0000
             kEN (H0ij)        :               -2.0000
             D4 a1             :                0.5200
             D4 a2             :                5.0000
             D4 s6             :                1.0000
             D4 s8             :                2.7000
             D4 s9             :                5.0000
             alphaj            :                2.0000

  Z AO/shell   Hii/eV     exponent
  1     Wed Apr 25 08:07:45 CEST 2018   EN: 2.200 GM2: 0.406  GM3: 0.0800  RAES: 1.40
     1s    -10.707211    1.230000
  6     Wed Apr 25 08:07:45 CEST 2018   EN: 2.550 GM2: 0.538  GM3: 0.1500  RAES: 3.00
     2s    -13.970922    2.096432
     2p    -10.063292    1.800000
  8     Wed Apr 25 08:07:45 CEST 2018   EN: 3.440 GM2: 0.452  GM3:-0.0517  RAES: 1.80
     2s    -20.229985    2.439742
     2p    -15.503117    2.137023

           ------------------------------------------------- 
          |        Self-Consistent Charge Iterations        |
           ------------------------------------------------- 

          ...................................................
          :                      SETUP                      :
          :.................................................:
          :  # basis functions                  38          :
          :  # atomic orbitals                  38          :
          :  # shells                           22          :
          :  # electrons                        42          :
          :  max. iterations                   250          :
          :  Hamiltonian                  GFN2-xTB          :
          :  restarted?                      false          :
          :  GBSA solvation                  false          :
          :  PC potential                    false          :
          :  electronic temp.          300.0000000     K    :
          :  accuracy                    1.0000000          :
          :  -> integral cutoff          0.2500000E+02      :
          :  -> integral neglect         0.1000000E-07      :
          :  -> SCF convergence          0.1000000E-05 Eh   :
          :  -> wf. convergence          0.1000000E-03 e    :
          :  Broyden damping             0.4000000          :
          ...................................................

 iter      E             dE          RMSdq      gap      omega  full diag
   1    -24.2919137 -0.242919E+02  0.473E+00    3.02       0.0  T
   2    -24.3016981 -0.978441E-02  0.292E+00    3.02       1.0  T
   3    -24.2868675  0.148306E-01  0.152E+00    3.14       1.0  T
   4    -24.3062564 -0.193889E-01  0.261E-01    3.05       1.0  T
   5    -24.3065969 -0.340560E-03  0.153E-01    3.09       1.0  T
   6    -24.3067557 -0.158728E-03  0.551E-02    3.07       1.0  T
   7    -24.3067651 -0.944164E-05  0.299E-02    3.07       1.0  T
   8    -24.3067699 -0.478501E-05  0.907E-03    3.07       2.9  T
   9    -24.3067701 -0.257442E-06  0.446E-03    3.07       6.0  T
  10    -24.3067702 -0.913024E-07  0.135E-03    3.07      19.8  T
  11    -24.3067702 -0.522081E-08  0.572E-04    3.07      46.7  T
  12    -24.3067702 -0.778673E-09  0.219E-04    3.07     122.0  T

   *** convergence criteria satisfied after 12 iterations ***

         #    Occupation            Energy/Eh            Energy/eV
      -------------------------------------------------------------
         1        2.0000           -0.7306300             -19.8815
       ...           ...                  ...                  ...
        15        2.0000           -0.4824032             -13.1269
        16        2.0000           -0.4752820             -12.9331
        17        2.0000           -0.4583199             -12.4715
        18        2.0000           -0.4463688             -12.1463
        19        2.0000           -0.4396468             -11.9634
        20        2.0000           -0.4020677             -10.9408
        21        2.0000           -0.3698355             -10.0637 (HOMO)
        22                         -0.2570572              -6.9949 (LUMO)
        23                         -0.1706969              -4.6449
        24                         -0.1303179              -3.5461
        25                          0.0405693               1.1039
        26                          0.0627879               1.7085
       ...                                ...                  ...
        38                          0.6950427              18.9131
      -------------------------------------------------------------
                  HL-Gap            0.1127783 Eh            3.0689 eV
             Fermi-level           -0.3134464 Eh           -8.5293 eV

 SCC (total)                   0 d,  0 h,  0 min,  0.015 sec
 SCC setup                      ...        0 min,  0.000 sec (  1.209%)
 Dispersion                     ...        0 min,  0.000 sec (  0.816%)
 integral evaluation            ...        0 min,  0.003 sec ( 19.845%)
 zeroth order Hamiltonian       ...        0 min,  0.000 sec (  0.463%)
 iterations                     ...        0 min,  0.007 sec ( 43.789%)
 molecular gradient             ...        0 min,  0.005 sec ( 31.447%)
 printout                       ...        0 min,  0.000 sec (  2.103%)

         :::::::::::::::::::::::::::::::::::::::::::::::::::::
         ::                     SUMMARY                     ::
         :::::::::::::::::::::::::::::::::::::::::::::::::::::
         :: total energy             -23.993730172127 Eh    ::
         :: gradient norm              0.055517088793 Eh/a0 ::
         :: HOMO-LUMO gap              3.068853273530 eV    ::
         ::.................................................::
         :: SCC energy               -24.306770237233 Eh    ::
         :: -> isotropic ES            0.029499837334 Eh    ::
         :: -> anisotropic ES          0.002089728404 Eh    ::
         :: -> anisotropic XC          0.006644673570 Eh    ::
         :: -> dispersion             -0.009542513063 Eh    ::
         :: repulsion energy           0.313039287050 Eh    ::
         :: add. restraining           0.000000000000 Eh    ::
         :::::::::::::::::::::::::::::::::::::::::::::::::::::

      ----------------------------------------------------------- 
     |                   =====================                   |
     |                        A N C O P T                        |
     |                   =====================                   |
     |               Approximate Normal Coordinate               |
     |                Rational Function Optimizer                |
      ----------------------------------------------------------- 

          ...................................................
          :                      SETUP                      :
          :.................................................:
          :   optimization level            normal          :
          :   max. optcycles                   200          :
          :   ANC micro-cycles                  20          :
          :   degrees of freedom                36          :
          :.................................................:
          :   RF solver                   davidson          :
          :   input Hessian                  false          :
          :   write xtbopt.log                true          :
          :   linear?                        false          :
          :   energy convergence         0.5000000E-05 Eh   :
          :   grad. convergence          0.1000000E-02 Eh/α :
          :   maximium RF displ.         2.0000000          :
          :   Hlow (freq-cutoff)         0.5000000E-02      :
          :   Hmax (freq-cutoff)         5.0000000          :
          :   S6 in model hess.         20.0000000          :
          ...................................................

generating ANC from model Hessian ...
Using Lindh-Hessian (1995)
 Shifting diagonal of input Hessian by   7.554228721043795E-004
 Lowest  eigenvalues of input Hessian
   -0.000000   -0.000000   -0.000000    0.000000    0.000000    0.000000
    0.005000    0.006382    0.010552    0.014502    0.028259    0.037679
    0.044671    0.045565    0.055659    0.080343    0.084080    0.095595
 Highest eigenvalues
    1.523555    1.742057    1.865354    1.944023    2.055390    2.148035
 

........................................................................
.............................. CYCLE    1 ..............................
........................................................................
   1    -24.3067702 -0.243068E+02  0.829E-05    3.07       0.0  T
   2    -24.3067702 -0.615330E-11  0.539E-05    3.07     495.7  T
   3    -24.3067702  0.409628E-11  0.380E-05    3.07     703.6  T
     SCC iter.                  ...        0 min,  0.002 sec
     gradient                   ...        0 min,  0.005 sec
 * total energy  :   -23.9937302 Eh     change        0.5703882E-08 Eh
   gradient norm :     0.0555180 Eh/α   predicted     0.0000000E+00 (-100.00%)
   displ. norm   :     0.1393675 α      lambda       -0.3069818E-02
   maximum displ.:     0.0874970 α      in ANC's #3, #9, #1, ...

........................................................................
.............................. CYCLE    2 ..............................
........................................................................
   1    -24.3169656 -0.243170E+02  0.168E-01    3.18       0.0  T
   2    -24.3170583 -0.926576E-04  0.981E-02    3.16       1.0  T
   3    -24.3170774 -0.191232E-04  0.570E-02    3.17       1.0  T
   4    -24.3170871 -0.971868E-05  0.149E-02    3.17       1.8  T
   5    -24.3170882 -0.103139E-05  0.484E-03    3.16       5.5  T
   6    -24.3170883 -0.150370E-06  0.199E-03    3.16      13.4  T
     SCC iter.                  ...        0 min,  0.003 sec
     gradient                   ...        0 min,  0.005 sec
 * total energy  :   -23.9958872 Eh     change       -0.2156987E-02 Eh
   gradient norm :     0.0256953 Eh/α   predicted    -0.1564722E-02 ( -27.46%)
   displ. norm   :     0.1383303 α      lambda       -0.1111855E-02
   maximum displ.:     0.1124752 α      in ANC's #3, #9, #1, ...

........................................................................
.............................. CYCLE    3 ..............................
........................................................................
   1    -24.3213205 -0.243213E+02  0.162E-01    3.26       0.0  T
   2    -24.3213863 -0.658062E-04  0.941E-02    3.25       1.0  T
   3    -24.3214012 -0.148927E-04  0.575E-02    3.25       1.0  T
   4    -24.3214125 -0.113095E-04  0.121E-02    3.25       2.2  T
   5    -24.3214130 -0.528411E-06  0.502E-03    3.25       5.3  T
   6    -24.3214132 -0.202382E-06  0.228E-03    3.25      11.7  T
     SCC iter.                  ...        0 min,  0.003 sec
     gradient                   ...        0 min,  0.005 sec
 * total energy  :   -23.9964811 Eh     change       -0.5939240E-03 Eh
   gradient norm :     0.0051445 Eh/α   predicted    -0.5665642E-03 (  -4.61%)
   displ. norm   :     0.0772674 α      lambda       -0.1328213E-03
   maximum displ.:     0.0485776 α      in ANC's #1, #3, #7, ...

........................................................................
.............................. CYCLE    4 ..............................
........................................................................
   1    -24.3207270 -0.243207E+02  0.664E-02    3.26       0.0  T
   2    -24.3207289 -0.187105E-05  0.396E-02    3.26       1.0  T
   3    -24.3207262  0.273702E-05  0.226E-02    3.26       1.2  T
   4    -24.3207300 -0.387020E-05  0.347E-03    3.26       7.7  T
   5    -24.3207301 -0.902616E-07  0.142E-03    3.26      18.8  T
   6    -24.3207301 -0.140791E-07  0.724E-04    3.26      36.9  T
     SCC iter.                  ...        0 min,  0.003 sec
     gradient                   ...        0 min,  0.005 sec
 * total energy  :   -23.9965336 Eh     change       -0.5255024E-04 Eh
   gradient norm :     0.0034394 Eh/α   predicted    -0.6680724E-04 (  27.13%)
   displ. norm   :     0.0444749 α      lambda       -0.5666896E-04
   maximum displ.:     0.0257661 α      in ANC's #1, #3, #7, ...

........................................................................
.............................. CYCLE    5 ..............................
........................................................................
   1    -24.3201084 -0.243201E+02  0.376E-02    3.26       0.0  T
   2    -24.3201085 -0.170603E-06  0.225E-02    3.26       1.2  T
   3    -24.3201078  0.764981E-06  0.931E-03    3.26       2.9  T
   4    -24.3201086 -0.869239E-06  0.125E-03    3.26      21.4  T
   5    -24.3201086 -0.840764E-08  0.613E-04    3.26      43.6  T
   6    -24.3201086 -0.346887E-09  0.346E-04    3.26      77.2  T
     SCC iter.                  ...        0 min,  0.003 sec
     gradient                   ...        0 min,  0.005 sec
 * total energy  :   -23.9965680 Eh     change       -0.3436853E-04 Eh
   gradient norm :     0.0019046 Eh/α   predicted    -0.2839268E-04 ( -17.39%)
   displ. norm   :     0.0565160 α      lambda       -0.1415538E-04
   maximum displ.:     0.0493910 α      in ANC's #1, #2, #3, ...

........................................................................
.............................. CYCLE    6 ..............................
........................................................................
   1    -24.3200360 -0.243200E+02  0.474E-02    3.25       0.0  T
   2    -24.3200364 -0.388643E-06  0.282E-02    3.26       1.0  T
   3    -24.3200355  0.837741E-06  0.906E-03    3.26       2.9  T
   4    -24.3200365 -0.101003E-05  0.117E-03    3.26      22.9  T
   5    -24.3200366 -0.500368E-08  0.684E-04    3.26      39.1  T
   6    -24.3200366 -0.126704E-08  0.380E-04    3.26      70.3  T
     SCC iter.                  ...        0 min,  0.003 sec
     gradient                   ...        0 min,  0.005 sec
 * total energy  :   -23.9965813 Eh     change       -0.1328957E-04 Eh
   gradient norm :     0.0012897 Eh/α   predicted    -0.7088581E-05 ( -46.66%)
   displ. norm   :     0.0418597 α      lambda       -0.7612114E-05
   maximum displ.:     0.0376670 α      in ANC's #1, #2, #5, ...

........................................................................
.............................. CYCLE    7 ..............................
........................................................................
   1    -24.3203786 -0.243204E+02  0.320E-02    3.25       0.0  T
   2    -24.3203786 -0.640413E-07  0.188E-02    3.25       1.4  T
   3    -24.3203781  0.527816E-06  0.797E-03    3.25       3.4  T
   4    -24.3203787 -0.603837E-06  0.637E-04    3.25      42.0  T
   5    -24.3203787 -0.386464E-08  0.281E-04    3.25      95.1  T
     SCC iter.                  ...        0 min,  0.003 sec
     gradient                   ...        0 min,  0.005 sec
 * total energy  :   -23.9965902 Eh     change       -0.8936971E-05 Eh
   gradient norm :     0.0008280 Eh/α   predicted    -0.3808402E-05 ( -57.39%)
   displ. norm   :     0.0423723 α      lambda       -0.5998214E-05
   maximum displ.:     0.0359342 α      in ANC's #1, #2, #4, ...

........................................................................
.............................. CYCLE    8 ..............................
........................................................................
   1    -24.3205182 -0.243205E+02  0.332E-02    3.25       0.0  T
   2    -24.3205182 -0.626030E-07  0.196E-02    3.25       1.4  T
   3    -24.3205179  0.360840E-06  0.636E-03    3.25       4.2  T
   4    -24.3205183 -0.410498E-06  0.737E-04    3.25      36.2  T
   5    -24.3205183 -0.306353E-08  0.379E-04    3.25      70.5  T
     SCC iter.                  ...        0 min,  0.003 sec
     gradient                   ...        0 min,  0.005 sec
 * total energy  :   -23.9965966 Eh     change       -0.6397842E-05 Eh
   gradient norm :     0.0007661 Eh/α   predicted    -0.3001965E-05 ( -53.08%)
   displ. norm   :     0.0369616 α      lambda       -0.3701177E-05
   maximum displ.:     0.0316343 α      in ANC's #1, #2, #5, ...

........................................................................
.............................. CYCLE    9 ..............................
........................................................................
   1    -24.3204292 -0.243204E+02  0.275E-02    3.25       0.0  T
   2    -24.3204292 -0.262704E-07  0.162E-02    3.25       1.6  T
   3    -24.3204292  0.454355E-07  0.207E-03    3.25      12.9  T
   4    -24.3204292 -0.581825E-07  0.337E-04    3.25      79.3  T
   5    -24.3204292 -0.227725E-09  0.230E-04    3.25     116.1  T
     SCC iter.                  ...        0 min,  0.003 sec
     gradient                   ...        0 min,  0.005 sec
 * total energy  :   -23.9966005 Eh     change       -0.3868381E-05 Eh
   gradient norm :     0.0005446 Eh/α   predicted    -0.1850043E-05 ( -52.18%)
   displ. norm   :     0.0238679 α      lambda       -0.1645860E-05
   maximum displ.:     0.0221600 α      in ANC's #1, #2, #7, ...

   *** GEOMETRY OPTIMIZATION CONVERGED AFTER 9 ITERATIONS ***

------------------------------------------------------------------------
 total energy gain   :        -0.0028703 Eh       -1.8012 kcal/mol
 total RMSD          :         0.1257493 a0        0.0665 Å
 total power (kW/mol):        -0.8373352 (step)  -74.5571 (real)
------------------------------------------------------------------------

 ANCopt (total)                0 d,  0 h,  0 min,  0.101 sec
 optimizer setup                ...        0 min,  0.000 sec (  0.146%)
 model hessian                  ...        0 min,  0.001 sec (  1.335%)
 ANC generation                 ...        0 min,  0.000 sec (  0.325%)
 coordinate transformation      ...        0 min,  0.000 sec (  0.108%)
 single point calculation       ...        0 min,  0.096 sec ( 95.354%)
 optimization log               ...        0 min,  0.001 sec (  0.641%)
 hessian update                 ...        0 min,  0.000 sec (  0.094%)
 rational function              ...        0 min,  0.001 sec (  1.384%)

================
 final structure:
================
$coord
   -2.07101712664372    0.00841793731357    0.32804752080425      C 
   -0.41782217926413    1.93821815781368    0.25501558180067      O 
    1.91052812899568    0.96303768575131   -0.12410229786590      C 
    1.75387181652471   -1.62619552576296   -0.29503998683868      C 
   -0.83075339734477   -2.23712562728011   -0.00133719305823      C 
   -1.91830640176623   -4.55950374781555   -0.03186369891987      O 
    4.00847776775420    2.68971288843521   -0.27774444561336      C 
    6.39828171188183    2.03032117550553   -0.68644116959684      C 
   -4.02681413694061    0.43380486189600    0.61353818126150      H 
    3.28035288041230   -2.92343386747481   -0.58840629199338      H 
   -0.62493054525967   -5.81447128777749   -0.29253444705459      H 
    3.49440261658225    4.65290026260727   -0.03402519833257      H 
    6.95124183776026    0.09038540781139   -0.94031576024677      H 
    7.87840231777221    3.41927322445456   -0.77954309417106      H 
$end
           -------------------------------------------------
          |                Final Singlepoint                |
           -------------------------------------------------

          ...................................................
          :                      SETUP                      :
          :.................................................:
          :  # basis functions                  38          :
          :  # atomic orbitals                  38          :
          :  # shells                           22          :
          :  # electrons                        42          :
          :  max. iterations                   250          :
          :  Hamiltonian                  GFN2-xTB          :
          :  restarted?                      false          :
          :  GBSA solvation                  false          :
          :  PC potential                    false          :
          :  electronic temp.          300.0000000     K    :
          :  accuracy                    1.0000000          :
          :  -> integral cutoff          0.2500000E+02      :
          :  -> integral neglect         0.1000000E-07      :
          :  -> SCF convergence          0.1000000E-05 Eh   :
          :  -> wf. convergence          0.1000000E-03 e    :
          :  Broyden damping             0.4000000          :
          ...................................................

 iter      E             dE          RMSdq      gap      omega  full diag
   1    -24.3204292 -0.243204E+02  0.104E-04    3.25       0.0  T
   2    -24.3204292 -0.699174E-11  0.416E-05    3.25     642.9  T
   3    -24.3204292 -0.756373E-11  0.526E-05    3.25     508.0  T

   *** convergence criteria satisfied after 3 iterations ***

         #    Occupation            Energy/Eh            Energy/eV
      -------------------------------------------------------------
         1        2.0000           -0.7377173             -20.0743
       ...           ...                  ...                  ...
        15        2.0000           -0.4836816             -13.1616
        16        2.0000           -0.4765228             -12.9668
        17        2.0000           -0.4584090             -12.4739
        18        2.0000           -0.4460879             -12.1387
        19        2.0000           -0.4387886             -11.9400
        20        2.0000           -0.4033445             -10.9756
        21        2.0000           -0.3721880             -10.1278 (HOMO)
        22                         -0.2525856              -6.8732 (LUMO)
        23                         -0.1719482              -4.6789
        24                         -0.1295982              -3.5265
        25                          0.0508553               1.3838
        26                          0.0803251               2.1858
       ...                                ...                  ...
        38                          0.7085774              19.2814
      -------------------------------------------------------------
                  HL-Gap            0.1196024 Eh            3.2545 eV
             Fermi-level           -0.3123868 Eh           -8.5005 eV

 SCC (total)                   0 d,  0 h,  0 min,  0.010 sec
 SCC setup                      ...        0 min,  0.000 sec (  1.287%)
 Dispersion                     ...        0 min,  0.000 sec (  0.768%)
 integral evaluation            ...        0 min,  0.003 sec ( 27.278%)
 zeroth order Hamiltonian       ...        0 min,  0.000 sec (  0.809%)
 iterations                     ...        0 min,  0.002 sec ( 19.856%)
 molecular gradient             ...        0 min,  0.005 sec ( 47.077%)
 printout                       ...        0 min,  0.000 sec (  2.442%)

         :::::::::::::::::::::::::::::::::::::::::::::::::::::
         ::                     SUMMARY                     ::
         :::::::::::::::::::::::::::::::::::::::::::::::::::::
         :: total energy             -23.996600478557 Eh    ::
         :: gradient norm              0.000545711760 Eh/a0 ::
         :: HOMO-LUMO gap              3.254547052020 eV    ::
         ::.................................................::
         :: SCC energy               -24.320429233316 Eh    ::
         :: -> isotropic ES            0.028828798568 Eh    ::
         :: -> anisotropic ES          0.002233784518 Eh    ::
         :: -> anisotropic XC          0.006182931743 Eh    ::
         :: -> dispersion             -0.009539571641 Eh    ::
         :: repulsion energy           0.323828953033 Eh    ::
         :: add. restraining           0.000000000000 Eh    ::
         :::::::::::::::::::::::::::::::::::::::::::::::::::::

           -------------------------------------------------
          |                Property Printout                |
           -------------------------------------------------

    * Orbital Energies and Occupations

         #    Occupation            Energy/Eh            Energy/eV
      -------------------------------------------------------------
         1        2.0000           -0.7377173             -20.0743
       ...           ...                  ...                  ...
         9        2.0000           -0.5678397             -15.4517
        10        2.0000           -0.5604948             -15.2518
        11        2.0000           -0.5309399             -14.4476
        12        2.0000           -0.5237793             -14.2528
        13        2.0000           -0.5143776             -13.9969
        14        2.0000           -0.5027977             -13.6818
        15        2.0000           -0.4836816             -13.1616
        16        2.0000           -0.4765228             -12.9668
        17        2.0000           -0.4584090             -12.4739
        18        2.0000           -0.4460879             -12.1387
        19        2.0000           -0.4387886             -11.9400
        20        2.0000           -0.4033445             -10.9756
        21        2.0000           -0.3721880             -10.1278 (HOMO)
        22                         -0.2525856              -6.8732 (LUMO)
        23                         -0.1719482              -4.6789
        24                         -0.1295982              -3.5265
        25                          0.0508553               1.3838
        26                          0.0803251               2.1858
        27                          0.1230543               3.3485
        28                          0.1265516               3.4436
        29                          0.1589615               4.3256
        30                          0.1763985               4.8000
        31                          0.1975320               5.3751
        32                          0.2454102               6.6780
       ...                                ...                  ...
        38                          0.7085774              19.2814
      -------------------------------------------------------------
                  HL-Gap            0.1196024 Eh            3.2545 eV
             Fermi-level           -0.3123868 Eh           -8.5005 eV

     #   Z        covCN         q      C6AA      α(0)
     1   6 C      3.041     0.038    27.118     8.541
     2   8 O      1.730    -0.187    17.132     5.589
     3   6 C      3.096     0.112    25.429     8.265
     4   6 C      3.012    -0.105    30.624     9.078
     5   6 C      2.934     0.119    25.386     8.263
     6   8 O      1.659    -0.398    20.812     6.158
     7   6 C      2.887    -0.037    28.909     8.815
     8   6 C      2.840    -0.091    30.282     9.018
     9   1 H      0.927     0.060     2.203     2.321
    10   1 H      0.926     0.037     2.487     2.466
    11   1 H      0.805     0.307     0.701     1.315
    12   1 H      0.925     0.055     2.262     2.352
    13   1 H      0.926     0.044     2.392     2.418
    14   1 H      0.926     0.048     2.349     2.397

 Mol. C6AA /au·bohr⁶  :       2378.484951
 Mol. C8AA /au·bohr⁸  :      56908.053081
 Mol. α(0) /au        :         76.996601


Wiberg/Mayer (AO) data.
largest (>0.10) Wiberg bond orders for each atom
          total WBO             WBO to atom ...
     1  C   3.897        C    5 1.504    O    2 1.125    H    9 0.966    C    3 0.137
     2  O   2.434        C    1 1.125    C    3 1.110
     3  C   3.911        C    4 1.491    C    7 1.115    O    2 1.110    C    1 0.137
     4  C   3.974        C    3 1.491    C    5 1.274    H   10 0.973
     5  C   3.935        C    1 1.504    C    4 1.274    O    6 1.062
     6  O   2.098        C    5 1.062    H   11 0.889
     7  C   3.990        C    8 1.873    C    3 1.115    H   12 0.963
     8  C   3.990        C    7 1.873    H   14 0.978    H   13 0.976
     9  H   0.996        C    1 0.966
    10  H   0.999        C    4 0.973
    11  H   0.906        O    6 0.889
    12  H   0.997        C    7 0.963
    13  H   0.998        C    8 0.976
    14  H   0.997        C    8 0.978

molecular dipole:
                 x           y           z       tot (Debye)
 q only:        0.529      -0.264      -0.089
   full:        0.653      -0.374      -0.112       1.934
molecular quadrupole (traceless):
                xx          xy          yy          xz          yz          zz
 q only:        0.107      -1.997       2.323      -0.468       0.604      -2.430
  q+dip:        0.104      -4.912       4.268      -0.973       1.305      -4.371
   full:       -0.698      -4.330       3.457      -0.580       1.024      -2.759

           -------------------------------------------------
          |                Geometry Summary                 |
           -------------------------------------------------

      molecular mass/u    :      110.1122000
   center of mass at/Å    :        0.5472147      -0.0967096      -0.0536231
  moments of inertia/u·Å² :        0.9177222E+02   0.3665477E+03   0.4583106E+03
rotational constants/cm⁻¹ :        0.1836899E+00   0.4599029E-01   0.3678211E-01

 * 14 selected distances

     #   Z        #   Z                                     value/Å
     1   6 C      2   8 O                                 1.3452469
     2   8 O      3   6 C                                 1.3507940
     3   6 C      4   6 C                                 1.3756461
     1   6 C      5   6 C                                 1.3686384
     4   6 C      5   6 C                                 1.4139815
     5   6 C      6   8 O                                 1.3571249
     3   6 C      7   6 C                                 1.4401407 (max)
     7   6 C      8   6 C                                 1.3295934
     1   6 C      9   1 H                                 1.0698809
     4   6 C     10   1 H                                 1.0713763
     6   8 O     11   1 H                                 0.9635843 (min)
     7   6 C     12   1 H                                 1.0816177
     8   6 C     13   1 H                                 1.0758797
     8   6 C     14   1 H                                 1.0752346

 * 4 distinct bonds (by element types)

   Z      Z             #   av. dist./Å        max./Å        min./Å
   1 H    6 C           5     1.0747978     1.0816177     1.0698809
   6 C    6 C           5     1.3856000     1.4401407     1.3295934
   1 H    8 O           1     0.9635843     0.9635843     0.9635843
   6 C    8 O           3     1.3510553     1.3571249     1.3452469


optimized geometry written to: xtbopt.xyz


           -------------------------------------------------
          | TOTAL ENERGY              -23.996600478557 Eh   |
          | GRADIENT NORM               0.000545711760 Eh/α |
          | HOMO-LUMO GAP               3.254547052020 eV   |
           -------------------------------------------------

------------------------------------------------------------------------
 * finished run on 2021/05/19 at 11:00:00.162     
------------------------------------------------------------------------
 total:
 * wall-time:     0 d,  0 h,  0 min,  0.142 sec
 *  cpu-time:     0 d,  0 h,  0 min,  0.141 sec
 * ratio c/w:     0.990 speedup
 SCF:
 * wall-time:     0 d,  0 h,  0 min,  0.016 sec
 *  cpu-time:     0 d,  0 h,  0 min,  0.015 sec
 * ratio c/w:     0.997 speedup
 ANC optimizer:
 * wall-time:     0 d,  0 h,  0 min,  0.112 sec
 *  cpu-time:     0 d,  0 h,  0 min,  0.111 sec
 * ratio c/w:     0.998 speedup

