      -----------------------------------------------------------      
     |                   =====================                   |     
     |                           x T B                           |     
     |                   =====================                   |     
     |                         S. Grimme                         |     
     |          Mulliken Center for Theoretical Chemistry        |     
     |                    University of Bonn                     |     
     |                Version 6.2 RC2 (SAW190805)                |     
      -----------------------------------------------------------      

   This program is distributed in the hope that it will be useful,
   but WITHOUT ANY WARRANTY; without even the implied warranty of
   MERCHANTABILITY or FITNESS FOR A PARTICULAR PURPOSE.
   
   FOR NON-COMMERCIAL, ACADEMIA USE ONLY.
   
   Cite this work as:
   * S. Grimme, C. Bannwarth, P. Shushkov, J. Chem. Theory Comput., 2017,
     13, 1989-2009. DOI: 10.1021/acs.jctc.7b00118
   * C. Bannwarth, S. Ehlert and S. Grimme., J. Chem. Theory Comput., 2019,
     15, 1652-1671. DOI: 10.1021/acs.jctc.8b01176
   * P. Pracht, E. Caldeweyher, S. Ehlert, S. Grimme, ChemRxiv, 2019, preprint.
     DOI: 10.26434/chemrxiv.8326202.v1
   
   for DFT-D4:
   * E. Caldeweyher, C. Bannwarth and S. Grimme, J. Chem. Phys., 2017,
     147, 034112. DOI: 10.1063/1.4993215
   * E. Caldeweyher, S. Ehlert, A. Hansen, H. Neugebauer, S. Spicher,
     C. Bannwarth and S. Grimme, J. Chem. Phys., 2019, 150, 154122.
     DOI: 10.1063/1.5090222
   
   for sTDA-xTB:
   * S. Grimme and C. Bannwarth, J. Chem. Phys., 2016, 145, 054103.
     DOI: 10.1063/1.4959605
   
   in the mass-spec context:
   * V. Asgeirsson, C. Bauer and S. Grimme, Chem. Sci., 2017, 8, 4879.
     DOI: 10.1039/c7sc00601b
   
   for metadynamics refer to:
   * S. Grimme, J. Chem. Theory Comput., 2019, 155, 2847-2862
     DOI: 10.1021/acs.jctc.9b00143
   
   with help from (in alphabetical order)
   C. Bannwarth, F. Bohle, G. Brandenburg, E. Caldeweyher, M. Checinski,
   S. Dohm, S. Ehlert, S. Ehrlich, F. März, H. Neugebauer, J. Pisarek,
   P. Pracht, P. Shushkov, and S. Spicher.
   
 * started run on 2021/05/19 at 11:00:00.718     

           -------------------------------------------------
          |                Calculation Setup                |
           -------------------------------------------------

          program call               : /ihome/ghutchison/geoffh/xtb/xtb 666.xyz -opt
          hostname                   : smp-n144
          coordinate file            : 666.xyz
          omp threads                :                     1
          number of atoms            :                    24
          number of electrons        :                    54
          charge                     :                     0
          spin                       :                   0.0
          first test random number   :      0.17190231597596


########################################################################
# WARNING! Please study the warnings concerning your input carefully
#  - the use of '-opt' is discouraged, please use '--opt' next time
########################################################################

           ------------------------------------------------- 
          |                 G F N 2 - x T B                 |
          | Geometry, Frequencies, Noncovalent interactions |
          |            JCTC 2019 parametrisation            |
           ------------------------------------------------- 
             KAB for C  - Si     :                1.0500
             KAB for H  - Pd     :                0.9500
             k(s)              :                1.8500
             k(p)              :                2.2300
             k(d)              :                2.2300
             k(f)              :                2.0000
             kEN (H0ij)        :               -2.0000
             D4 a1             :                0.5200
             D4 a2             :                5.0000
             D4 s6             :                1.0000
             D4 s8             :                2.7000
             D4 s9             :                5.0000
             alphaj            :                2.0000

  Z AO/shell   Hii/eV     exponent
  1     Wed Apr 25 08:07:45 CEST 2018   EN: 2.200 GM2: 0.406  GM3: 0.0800  RAES: 1.40
     1s    -10.707211    1.230000
  6     Wed Apr 25 08:07:45 CEST 2018   EN: 2.550 GM2: 0.538  GM3: 0.1500  RAES: 3.00
     2s    -13.970922    2.096432
     2p    -10.063292    1.800000

           ------------------------------------------------- 
          |        Self-Consistent Charge Iterations        |
           ------------------------------------------------- 

          ...................................................
          :                      SETUP                      :
          :.................................................:
          :  # basis functions                  54          :
          :  # atomic orbitals                  54          :
          :  # shells                           34          :
          :  # electrons                        54          :
          :  max. iterations                   250          :
          :  Hamiltonian                  GFN2-xTB          :
          :  restarted?                      false          :
          :  GBSA solvation                  false          :
          :  PC potential                    false          :
          :  electronic temp.          300.0000000     K    :
          :  accuracy                    1.0000000          :
          :  -> integral cutoff          0.2500000E+02      :
          :  -> integral neglect         0.1000000E-07      :
          :  -> SCF convergence          0.1000000E-05 Eh   :
          :  -> wf. convergence          0.1000000E-03 e    :
          :  Broyden damping             0.4000000          :
          ...................................................

 iter      E             dE          RMSdq      gap      omega  full diag
   1    -28.9953963 -0.289954E+02  0.361E+00    4.32       0.0  T
   2    -29.0280292 -0.326329E-01  0.209E+00    4.46       1.0  T
   3    -29.0277588  0.270404E-03  0.694E-01    4.25       1.0  T
   4    -29.0290823 -0.132347E-02  0.273E-01    4.41       1.0  T
   5    -29.0300665 -0.984157E-03  0.643E-02    4.36       1.0  T
   6    -29.0300866 -0.201476E-04  0.354E-02    4.35       1.0  T
   7    -29.0300915 -0.486191E-05  0.149E-02    4.36       1.4  T
   8    -29.0300927 -0.124123E-05  0.133E-03    4.36      15.3  T
   9    -29.0300927 -0.100877E-07  0.675E-04    4.36      30.3  T
  10    -29.0300927  0.701242E-09  0.293E-04    4.36      69.7  T

   *** convergence criteria satisfied after 10 iterations ***

         #    Occupation            Energy/Eh            Energy/eV
      -------------------------------------------------------------
         1        2.0000           -0.6325896             -17.2136
       ...           ...                  ...                  ...
        21        2.0000           -0.4443898             -12.0925
        22        2.0000           -0.4375202             -11.9055
        23        2.0000           -0.4300134             -11.7013
        24        2.0000           -0.4118643             -11.2074
        25        2.0000           -0.4077080             -11.0943
        26        2.0000           -0.3839619             -10.4481
        27        2.0000           -0.3737181             -10.1694 (HOMO)
        28                         -0.2134804              -5.8091 (LUMO)
        29                         -0.2089816              -5.6867
        30                         -0.0914967              -2.4898
        31                          0.0857878               2.3344
        32                          0.0999017               2.7185
       ...                                ...                  ...
        54                          0.6220276              16.9262
      -------------------------------------------------------------
                  HL-Gap            0.1602377 Eh            4.3603 eV
             Fermi-level           -0.2935993 Eh           -7.9892 eV

 SCC (total)                   0 d,  0 h,  0 min,  0.026 sec
 SCC setup                      ...        0 min,  0.000 sec (  1.049%)
 Dispersion                     ...        0 min,  0.000 sec (  1.191%)
 integral evaluation            ...        0 min,  0.005 sec ( 20.300%)
 zeroth order Hamiltonian       ...        0 min,  0.000 sec (  0.489%)
 iterations                     ...        0 min,  0.009 sec ( 36.799%)
 molecular gradient             ...        0 min,  0.010 sec ( 38.549%)
 printout                       ...        0 min,  0.000 sec (  1.405%)

         :::::::::::::::::::::::::::::::::::::::::::::::::::::
         ::                     SUMMARY                     ::
         :::::::::::::::::::::::::::::::::::::::::::::::::::::
         :: total energy             -28.551604724401 Eh    ::
         :: gradient norm              0.034768949704 Eh/a0 ::
         :: HOMO-LUMO gap              4.360291039012 eV    ::
         ::.................................................::
         :: SCC energy               -29.030092720908 Eh    ::
         :: -> isotropic ES            0.004085584889 Eh    ::
         :: -> anisotropic ES          0.007284169832 Eh    ::
         :: -> anisotropic XC          0.018407647025 Eh    ::
         :: -> dispersion             -0.019136665622 Eh    ::
         :: repulsion energy           0.478380425999 Eh    ::
         :: add. restraining           0.000000000000 Eh    ::
         :::::::::::::::::::::::::::::::::::::::::::::::::::::

      ----------------------------------------------------------- 
     |                   =====================                   |
     |                        A N C O P T                        |
     |                   =====================                   |
     |               Approximate Normal Coordinate               |
     |                Rational Function Optimizer                |
      ----------------------------------------------------------- 

          ...................................................
          :                      SETUP                      :
          :.................................................:
          :   optimization level            normal          :
          :   max. optcycles                   200          :
          :   ANC micro-cycles                  20          :
          :   degrees of freedom                66          :
          :.................................................:
          :   RF solver                   davidson          :
          :   input Hessian                  false          :
          :   write xtbopt.log                true          :
          :   linear?                        false          :
          :   energy convergence         0.5000000E-05 Eh   :
          :   grad. convergence          0.1000000E-02 Eh/α :
          :   maximium RF displ.         2.0000000          :
          :   Hlow (freq-cutoff)         0.5000000E-02      :
          :   Hmax (freq-cutoff)         5.0000000          :
          :   S6 in model hess.         20.0000000          :
          ...................................................

generating ANC from model Hessian ...
Using Lindh-Hessian (1995)
 Shifting diagonal of input Hessian by   3.095279458069885E-003
 Lowest  eigenvalues of input Hessian
   -0.000000   -0.000000   -0.000000   -0.000000   -0.000000    0.000000
    0.005000    0.005169    0.006139    0.009009    0.010493    0.011636
    0.012976    0.014604    0.016488    0.016717    0.023058    0.030191
 Highest eigenvalues
    1.360561    1.497492    1.562529    1.795409    1.886544    1.917673
 

........................................................................
.............................. CYCLE    1 ..............................
........................................................................
   1    -29.0300927 -0.290301E+02  0.824E-05    4.36       0.0  T
   2    -29.0300927 -0.177316E-10  0.493E-05    4.36     413.9  T
   3    -29.0300927 -0.106581E-11  0.324E-05    4.36     630.1  T
     SCC iter.                  ...        0 min,  0.003 sec
     gradient                   ...        0 min,  0.010 sec
 * total energy  :   -28.5516047 Eh     change       -0.1376971E-07 Eh
   gradient norm :     0.0347689 Eh/α   predicted     0.0000000E+00 (-100.00%)
   displ. norm   :     0.1770834 α      lambda       -0.3411634E-02
   maximum displ.:     0.0730948 α      in ANC's #6, #15, #35, ...

........................................................................
.............................. CYCLE    2 ..............................
........................................................................
   1    -29.0555335 -0.290555E+02  0.934E-02    4.48       0.0  T
   2    -29.0555425 -0.899379E-05  0.557E-02    4.48       1.0  T
   3    -29.0555418  0.663092E-06  0.122E-02    4.48       1.7  T
   4    -29.0555427 -0.943265E-06  0.294E-03    4.48       6.9  T
   5    -29.0555429 -0.199620E-06  0.959E-04    4.48      21.3  T
     SCC iter.                  ...        0 min,  0.005 sec
     gradient                   ...        0 min,  0.010 sec
 * total energy  :   -28.5536470 Eh     change       -0.2042263E-02 Eh
   gradient norm :     0.0098448 Eh/α   predicted    -0.1759317E-02 ( -13.85%)
   displ. norm   :     0.0957037 α      lambda       -0.2677916E-03
   maximum displ.:     0.0784396 α      in ANC's #6, #3, #5, ...

........................................................................
.............................. CYCLE    3 ..............................
........................................................................
   1    -29.0616181 -0.290616E+02  0.427E-02    4.51       0.0  T
   2    -29.0616192 -0.113352E-05  0.250E-02    4.51       1.0  T
   3    -29.0616188  0.367668E-06  0.582E-03    4.51       3.5  T
   4    -29.0616193 -0.457285E-06  0.137E-03    4.51      14.9  T
   5    -29.0616193 -0.378855E-07  0.391E-04    4.51      52.2  T
     SCC iter.                  ...        0 min,  0.005 sec
     gradient                   ...        0 min,  0.009 sec
 * total energy  :   -28.5538113 Eh     change       -0.1643487E-03 Eh
   gradient norm :     0.0026307 Eh/α   predicted    -0.1351246E-03 ( -17.78%)
   displ. norm   :     0.0979035 α      lambda       -0.8342296E-04
   maximum displ.:     0.0783982 α      in ANC's #6, #5, #3, ...

........................................................................
.............................. CYCLE    4 ..............................
........................................................................
   1    -29.0625188 -0.290625E+02  0.460E-02    4.52       0.0  T
   2    -29.0625191 -0.323672E-06  0.272E-02    4.52       1.0  T
   3    -29.0625188  0.252598E-06  0.352E-03    4.52       5.8  T
   4    -29.0625191 -0.302854E-06  0.760E-04    4.52      26.9  T
   5    -29.0625191 -0.132164E-07  0.239E-04    4.52      85.4  T
     SCC iter.                  ...        0 min,  0.005 sec
     gradient                   ...        0 min,  0.010 sec
 * total energy  :   -28.5538809 Eh     change       -0.6954890E-04 Eh
   gradient norm :     0.0023980 Eh/α   predicted    -0.4211504E-04 ( -39.45%)
   displ. norm   :     0.1632447 α      lambda       -0.1146170E-03
   maximum displ.:     0.1124427 α      in ANC's #6, #5, #7, ...

........................................................................
.............................. CYCLE    5 ..............................
........................................................................
   1    -29.0618109 -0.290618E+02  0.790E-02    4.52       0.0  T
   2    -29.0618114 -0.438598E-06  0.467E-02    4.52       1.0  T
   3    -29.0618112  0.157815E-06  0.312E-03    4.52       6.5  T
   4    -29.0618115 -0.231810E-06  0.920E-04    4.52      22.2  T
   5    -29.0618115 -0.180886E-07  0.306E-04    4.52      66.7  T
     SCC iter.                  ...        0 min,  0.005 sec
     gradient                   ...        0 min,  0.010 sec
 * total energy  :   -28.5539772 Eh     change       -0.9626828E-04 Eh
   gradient norm :     0.0045174 Eh/α   predicted    -0.5883579E-04 ( -38.88%)
   displ. norm   :     0.2253991 α      lambda       -0.1364588E-03
   maximum displ.:     0.1554141 α      in ANC's #6, #5, #7, ...

........................................................................
.............................. CYCLE    6 ..............................
........................................................................
   1    -29.0600127 -0.290600E+02  0.109E-01    4.51       0.0  T
   2    -29.0600134 -0.665519E-06  0.641E-02    4.51       1.0  T
   3    -29.0600134 -0.469650E-07  0.214E-03    4.51       9.5  T
   4    -29.0600135 -0.655324E-07  0.917E-04    4.51      22.3  T
     SCC iter.                  ...        0 min,  0.004 sec
     gradient                   ...        0 min,  0.009 sec
 * total energy  :   -28.5540762 Eh     change       -0.9898411E-04 Eh
   gradient norm :     0.0069130 Eh/α   predicted    -0.7169639E-04 ( -27.57%)
   displ. norm   :     0.2030232 α      lambda       -0.1203157E-03
   maximum displ.:     0.1443911 α      in ANC's #6, #5, #1, ...

........................................................................
.............................. CYCLE    7 ..............................
........................................................................
   1    -29.0588032 -0.290588E+02  0.974E-02    4.51       0.0  T
   2    -29.0588035 -0.306212E-06  0.576E-02    4.51       1.0  T
   3    -29.0588035  0.326327E-07  0.246E-03    4.51       8.3  T
   4    -29.0588036 -0.128642E-06  0.759E-04    4.51      26.9  T
     SCC iter.                  ...        0 min,  0.004 sec
     gradient                   ...        0 min,  0.009 sec
 * total energy  :   -28.5541600 Eh     change       -0.8382021E-04 Eh
   gradient norm :     0.0073799 Eh/α   predicted    -0.6263801E-04 ( -25.27%)
   displ. norm   :     0.1466543 α      lambda       -0.1617063E-03
   maximum displ.:     0.1049312 α      in ANC's #6, #5, #1, ...

........................................................................
.............................. CYCLE    8 ..............................
........................................................................
   1    -29.0598325 -0.290598E+02  0.702E-02    4.51       0.0  T
   2    -29.0598330 -0.480129E-06  0.414E-02    4.51       1.0  T
   3    -29.0598328  0.177753E-06  0.360E-03    4.51       5.7  T
   4    -29.0598331 -0.246409E-06  0.104E-03    4.51      19.6  T
   5    -29.0598331 -0.191576E-07  0.385E-04    4.51      53.0  T
     SCC iter.                  ...        0 min,  0.005 sec
     gradient                   ...        0 min,  0.009 sec
 * total energy  :   -28.5542660 Eh     change       -0.1060432E-03 Eh
   gradient norm :     0.0031235 Eh/α   predicted    -0.8259261E-04 ( -22.11%)
   displ. norm   :     0.2730962 α      lambda       -0.1322265E-03
   maximum displ.:     0.1949359 α      in ANC's #6, #5, #7, ...

........................................................................
.............................. CYCLE    9 ..............................
........................................................................
   1    -29.0592050 -0.290592E+02  0.130E-01    4.51       0.0  T
   2    -29.0592063 -0.131386E-05  0.770E-02    4.51       1.0  T
   3    -29.0592060  0.321344E-06  0.477E-03    4.51       4.3  T
   4    -29.0592065 -0.495087E-06  0.159E-03    4.51      12.8  T
   5    -29.0592066 -0.603320E-07  0.535E-04    4.51      38.1  T
   6    -29.0592066 -0.676952E-09  0.244E-04    4.51      83.6  T
     SCC iter.                  ...        0 min,  0.005 sec
     gradient                   ...        0 min,  0.010 sec
 * total energy  :   -28.5543118 Eh     change       -0.4576557E-04 Eh
   gradient norm :     0.0074074 Eh/α   predicted    -0.7104807E-04 (  55.24%)
   displ. norm   :     0.0675303 α      lambda       -0.1245942E-03
   maximum displ.:     0.0411955 α      in ANC's #3, #6, #1, ...

........................................................................
.............................. CYCLE   10 ..............................
........................................................................
   1    -29.0624632 -0.290625E+02  0.334E-02    4.52       0.0  T
   2    -29.0624642 -0.103198E-05  0.189E-02    4.52       1.1  T
   3    -29.0624640  0.217323E-06  0.497E-03    4.52       4.1  T
   4    -29.0624642 -0.236095E-06  0.160E-03    4.52      12.7  T
   5    -29.0624643 -0.675319E-07  0.361E-04    4.52      56.5  T
     SCC iter.                  ...        0 min,  0.005 sec
     gradient                   ...        0 min,  0.010 sec
 * total energy  :   -28.5543781 Eh     change       -0.6634212E-04 Eh
   gradient norm :     0.0028206 Eh/α   predicted    -0.6258569E-04 (  -5.66%)
   displ. norm   :     0.1105874 α      lambda       -0.4720389E-04
   maximum displ.:     0.0659749 α      in ANC's #6, #5, #3, ...

........................................................................
.............................. CYCLE   11 ..............................
........................................................................
   1    -29.0626563 -0.290627E+02  0.522E-02    4.52       0.0  T
   2    -29.0626564 -0.728733E-07  0.310E-02    4.52       1.0  T
   3    -29.0626563  0.105869E-06  0.218E-03    4.52       9.4  T
   4    -29.0626564 -0.143897E-06  0.341E-04    4.52      59.9  T
   5    -29.0626564 -0.729717E-09  0.165E-04    4.52     123.7  T
     SCC iter.                  ...        0 min,  0.005 sec
     gradient                   ...        0 min,  0.010 sec
 * total energy  :   -28.5544182 Eh     change       -0.4011526E-04 Eh
   gradient norm :     0.0027876 Eh/α   predicted    -0.2389119E-04 ( -40.44%)
   displ. norm   :     0.2685937 α      lambda       -0.9801907E-04
   maximum displ.:     0.1516687 α      in ANC's #6, #5, #3, ...

........................................................................
.............................. CYCLE   12 ..............................
........................................................................
   1    -29.0607472 -0.290607E+02  0.126E-01    4.52       0.0  T
   2    -29.0607481 -0.964150E-06  0.749E-02    4.52       1.0  T
   3    -29.0607480  0.184936E-06  0.404E-03    4.52       5.0  T
   4    -29.0607483 -0.338443E-06  0.136E-03    4.52      15.0  T
   5    -29.0607483 -0.384328E-07  0.463E-04    4.52      44.1  T
   6    -29.0607483 -0.190379E-09  0.186E-04    4.52     109.5  T
     SCC iter.                  ...        0 min,  0.005 sec
     gradient                   ...        0 min,  0.010 sec
 * total energy  :   -28.5544549 Eh     change       -0.3664633E-04 Eh
   gradient norm :     0.0045797 Eh/α   predicted    -0.5254977E-04 (  43.40%)
   displ. norm   :     0.0738956 α      lambda       -0.6403986E-04
   maximum displ.:     0.0521300 α      in ANC's #6, #5, #1, ...

........................................................................
.............................. CYCLE   13 ..............................
........................................................................
   1    -29.0618946 -0.290619E+02  0.360E-02    4.52       0.0  T
   2    -29.0618951 -0.561287E-06  0.209E-02    4.52       1.0  T
   3    -29.0618950  0.183981E-06  0.373E-03    4.52       5.5  T
   4    -29.0618952 -0.211191E-06  0.115E-03    4.52      17.7  T
   5    -29.0618952 -0.332669E-07  0.328E-04    4.52      62.3  T
     SCC iter.                  ...        0 min,  0.004 sec
     gradient                   ...        0 min,  0.009 sec
 * total energy  :   -28.5544809 Eh     change       -0.2599007E-04 Eh
   gradient norm :     0.0014493 Eh/α   predicted    -0.3219515E-04 (  23.87%)
   displ. norm   :     0.0849237 α      lambda       -0.1133065E-04
   maximum displ.:     0.0410866 α      in ANC's #5, #6, #2, ...

........................................................................
.............................. CYCLE   14 ..............................
........................................................................
   1    -29.0618012 -0.290618E+02  0.400E-02    4.52       0.0  T
   2    -29.0618012 -0.811899E-07  0.237E-02    4.52       1.0  T
   3    -29.0618012  0.741665E-08  0.104E-03    4.52      19.6  T
   4    -29.0618013 -0.213292E-07  0.426E-04    4.52      48.0  T
   5    -29.0618013 -0.371447E-08  0.142E-04    4.52     143.7  T
     SCC iter.                  ...        0 min,  0.005 sec
     gradient                   ...        0 min,  0.010 sec
 * total energy  :   -28.5544925 Eh     change       -0.1165784E-04 Eh
   gradient norm :     0.0009900 Eh/α   predicted    -0.5685250E-05 ( -51.23%)
   displ. norm   :     0.0639720 α      lambda       -0.6637075E-05
   maximum displ.:     0.0410248 α      in ANC's #2, #5, #6, ...

........................................................................
.............................. CYCLE   15 ..............................
........................................................................
   1    -29.0619256 -0.290619E+02  0.296E-02    4.52       0.0  T
   2    -29.0619256 -0.254019E-07  0.175E-02    4.52       1.2  T
   3    -29.0619256  0.786013E-08  0.825E-04    4.52      24.8  T
   4    -29.0619256 -0.180171E-07  0.220E-04    4.52      92.6  T
     SCC iter.                  ...        0 min,  0.004 sec
     gradient                   ...        0 min,  0.010 sec
 * total energy  :   -28.5544992 Eh     change       -0.6670416E-05 Eh
   gradient norm :     0.0008972 Eh/α   predicted    -0.3325874E-05 ( -50.14%)
   displ. norm   :     0.0453922 α      lambda       -0.3888516E-05
   maximum displ.:     0.0330585 α      in ANC's #2, #5, #3, ...

........................................................................
.............................. CYCLE   16 ..............................
........................................................................
   1    -29.0619975 -0.290620E+02  0.195E-02    4.52       0.0  T
   2    -29.0619975 -0.148829E-07  0.115E-02    4.52       1.8  T
   3    -29.0619975  0.295550E-08  0.592E-04    4.52      34.5  T
   4    -29.0619975 -0.809842E-08  0.218E-04    4.52      93.8  T
     SCC iter.                  ...        0 min,  0.004 sec
     gradient                   ...        0 min,  0.010 sec
 * total energy  :   -28.5545028 Eh     change       -0.3577100E-05 Eh
   gradient norm :     0.0006351 Eh/α   predicted    -0.1949602E-05 ( -45.50%)
   displ. norm   :     0.0451384 α      lambda        0.1301797E-05
   maximum displ.:     0.0330591 α      in ANC's #2, #5, #3, ...

   *** GEOMETRY OPTIMIZATION CONVERGED AFTER 16 ITERATIONS ***

------------------------------------------------------------------------
 total energy gain   :        -0.0028981 Eh       -1.8186 kcal/mol
 total RMSD          :         0.3193621 a0        0.1690 Å
 total power (kW/mol):        -0.4755526 (step)  -23.1561 (real)
------------------------------------------------------------------------

 ANCopt (total)                0 d,  0 h,  0 min,  0.329 sec
 optimizer setup                ...        0 min,  0.000 sec (  0.042%)
 model hessian                  ...        0 min,  0.006 sec (  1.965%)
 ANC generation                 ...        0 min,  0.001 sec (  0.214%)
 coordinate transformation      ...        0 min,  0.000 sec (  0.088%)
 single point calculation       ...        0 min,  0.316 sec ( 96.022%)
 optimization log               ...        0 min,  0.002 sec (  0.481%)
 hessian update                 ...        0 min,  0.000 sec (  0.064%)
 rational function              ...        0 min,  0.003 sec (  0.817%)

================
 final structure:
================
$coord
    1.52569439538807    2.34869511736757    0.22555848993041      C 
    2.61529721685994   -0.02742931099637    0.05696918418853      C 
    5.42774506182873   -0.36973005528945    0.03431393708626      C 
    1.02653537493304   -2.10974942292654   -0.08619432945475      C 
   -1.58461032143282   -1.87722891620676   -0.06508431373502      C 
   -3.16831959142056   -4.23703317141763   -0.15269591421816      C 
   -3.60181156317572   -5.27977284953932    2.50899736779516      C 
   -2.66326629217565    0.52640525233049    0.11008711313390      C 
   -5.47388522951553    0.90294340211842    0.11936374388592      C 
   -1.07448336643612    2.60885655021791    0.24753403321184      C 
    2.71142751882053    4.00813146064557    0.33414630807408      H 
    6.38897282990894    1.44596213850099   -0.00172948620287      H 
    6.00973257069755   -1.45640723177138   -1.61417586819033      H 
    6.03744289032639   -1.39780716505168    1.71175700906994      H 
    1.85120825187585   -3.97550682044406   -0.22297770754722      H 
   -2.19556446617266   -5.66893643086127   -1.27780692177965      H 
   -4.98609650383705   -3.85942611171316   -1.04597676744425      H 
   -1.80442011702888   -5.73433644667477    3.39639871426923      H 
   -4.74864031926956   -6.98461788897808    2.43743152505986      H 
   -4.56166238086128   -3.89504490109694    3.68582144835034      H 
   -6.36842022163644   -0.18763890940427    1.61721427353703      H 
   -6.29051301740602    0.30607115512379   -1.67606415623418      H 
   -5.92894759850065    2.88701008629716    0.39978017264451      H 
   -1.88951725019483    4.47816558091492    0.37574263711414      H 
$end
           -------------------------------------------------
          |                Final Singlepoint                |
           -------------------------------------------------

          ...................................................
          :                      SETUP                      :
          :.................................................:
          :  # basis functions                  54          :
          :  # atomic orbitals                  54          :
          :  # shells                           34          :
          :  # electrons                        54          :
          :  max. iterations                   250          :
          :  Hamiltonian                  GFN2-xTB          :
          :  restarted?                      false          :
          :  GBSA solvation                  false          :
          :  PC potential                    false          :
          :  electronic temp.          300.0000000     K    :
          :  accuracy                    1.0000000          :
          :  -> integral cutoff          0.2500000E+02      :
          :  -> integral neglect         0.1000000E-07      :
          :  -> SCF convergence          0.1000000E-05 Eh   :
          :  -> wf. convergence          0.1000000E-03 e    :
          :  Broyden damping             0.4000000          :
          ...................................................

 iter      E             dE          RMSdq      gap      omega  full diag
   1    -29.0619975 -0.290620E+02  0.787E-05    4.52       0.0  T
   2    -29.0619975 -0.131912E-10  0.352E-05    4.52     580.4  T
   3    -29.0619975  0.261835E-11  0.308E-05    4.52     662.2  T

   *** convergence criteria satisfied after 3 iterations ***

         #    Occupation            Energy/Eh            Energy/eV
      -------------------------------------------------------------
         1        2.0000           -0.6363306             -17.3154
       ...           ...                  ...                  ...
        21        2.0000           -0.4455379             -12.1237
        22        2.0000           -0.4401851             -11.9780
        23        2.0000           -0.4311143             -11.7312
        24        2.0000           -0.4121387             -11.2149
        25        2.0000           -0.4070168             -11.0755
        26        2.0000           -0.3861683             -10.5082
        27        2.0000           -0.3752059             -10.2099 (HOMO)
        28                         -0.2092364              -5.6936 (LUMO)
        29                         -0.2066481              -5.6232
        30                         -0.0835214              -2.2727
        31                          0.0972849               2.6473
        32                          0.1085857               2.9548
       ...                                ...                  ...
        54                          0.6584700              17.9179
      -------------------------------------------------------------
                  HL-Gap            0.1659695 Eh            4.5163 eV
             Fermi-level           -0.2922212 Eh           -7.9517 eV

 SCC (total)                   0 d,  0 h,  0 min,  0.019 sec
 SCC setup                      ...        0 min,  0.000 sec (  0.920%)
 Dispersion                     ...        0 min,  0.000 sec (  0.961%)
 integral evaluation            ...        0 min,  0.005 sec ( 28.158%)
 zeroth order Hamiltonian       ...        0 min,  0.000 sec (  0.607%)
 iterations                     ...        0 min,  0.003 sec ( 16.872%)
 molecular gradient             ...        0 min,  0.010 sec ( 50.402%)
 printout                       ...        0 min,  0.000 sec (  1.803%)

         :::::::::::::::::::::::::::::::::::::::::::::::::::::
         ::                     SUMMARY                     ::
         :::::::::::::::::::::::::::::::::::::::::::::::::::::
         :: total energy             -28.554502795172 Eh    ::
         :: gradient norm              0.000635270420 Eh/a0 ::
         :: HOMO-LUMO gap              4.516260138558 eV    ::
         ::.................................................::
         :: SCC energy               -29.061997507359 Eh    ::
         :: -> isotropic ES            0.004267231427 Eh    ::
         :: -> anisotropic ES          0.006952054120 Eh    ::
         :: -> anisotropic XC          0.017529543645 Eh    ::
         :: -> dispersion             -0.019323941888 Eh    ::
         :: repulsion energy           0.507385291354 Eh    ::
         :: add. restraining           0.000000000000 Eh    ::
         :::::::::::::::::::::::::::::::::::::::::::::::::::::

           -------------------------------------------------
          |                Property Printout                |
           -------------------------------------------------

    * Orbital Energies and Occupations

         #    Occupation            Energy/Eh            Energy/eV
      -------------------------------------------------------------
         1        2.0000           -0.6363306             -17.3154
       ...           ...                  ...                  ...
        15        2.0000           -0.4818776             -13.1126
        16        2.0000           -0.4747379             -12.9183
        17        2.0000           -0.4671700             -12.7123
        18        2.0000           -0.4645139             -12.6401
        19        2.0000           -0.4605040             -12.5310
        20        2.0000           -0.4470981             -12.1662
        21        2.0000           -0.4455379             -12.1237
        22        2.0000           -0.4401851             -11.9780
        23        2.0000           -0.4311143             -11.7312
        24        2.0000           -0.4121387             -11.2149
        25        2.0000           -0.4070168             -11.0755
        26        2.0000           -0.3861683             -10.5082
        27        2.0000           -0.3752059             -10.2099 (HOMO)
        28                         -0.2092364              -5.6936 (LUMO)
        29                         -0.2066481              -5.6232
        30                         -0.0835214              -2.2727
        31                          0.0972849               2.6473
        32                          0.1085857               2.9548
        33                          0.1328024               3.6137
        34                          0.1347319               3.6662
        35                          0.1418212               3.8592
        36                          0.1507246               4.1014
        37                          0.1686855               4.5902
        38                          0.1785463               4.8585
       ...                                ...                  ...
        54                          0.6584700              17.9179
      -------------------------------------------------------------
                  HL-Gap            0.1659695 Eh            4.5163 eV
             Fermi-level           -0.2922212 Eh           -7.9517 eV

     #   Z        covCN         q      C6AA      α(0)
     1   6 C      2.924    -0.046    29.131     8.851
     2   6 C      2.965     0.010    27.783     8.646
     3   6 C      3.757    -0.107    22.594     6.777
     4   6 C      2.932    -0.051    29.258     8.871
     5   6 C      2.973     0.002    27.981     8.677
     6   6 C      3.807    -0.058    21.607     6.617
     7   6 C      3.753    -0.095    22.376     6.745
     8   6 C      2.969     0.004    27.932     8.669
     9   6 C      3.757    -0.105    22.550     6.770
    10   6 C      2.924    -0.043    29.074     8.842
    11   1 H      0.926     0.025     2.665     2.553
    12   1 H      0.925     0.038     2.477     2.461
    13   1 H      0.925     0.042     2.425     2.435
    14   1 H      0.925     0.043     2.415     2.430
    15   1 H      0.925     0.027     2.633     2.538
    16   1 H      0.924     0.033     2.549     2.497
    17   1 H      0.924     0.037     2.491     2.468
    18   1 H      0.925     0.034     2.524     2.485
    19   1 H      0.925     0.032     2.555     2.500
    20   1 H      0.925     0.032     2.553     2.499
    21   1 H      0.925     0.043     2.409     2.427
    22   1 H      0.924     0.040     2.447     2.446
    23   1 H      0.925     0.037     2.488     2.466
    24   1 H      0.925     0.025     2.657     2.549

 Mol. C6AA /au·bohr⁶  :       5337.065013
 Mol. C8AA /au·bohr⁸  :     122976.003930
 Mol. α(0) /au        :        114.219011


Wiberg/Mayer (AO) data.
largest (>0.10) Wiberg bond orders for each atom
          total WBO             WBO to atom ...
     1  C   3.991        C   10 1.440    C    2 1.414    H   11 0.969    C    5 0.105
     2  C   3.989        C    1 1.414    C    4 1.409    C    3 1.023    C    8 0.104
     3  C   3.996        C    2 1.023    H   12 0.986    H   13 0.976    H   14 0.973
     4  C   3.991        C    5 1.429    C    2 1.409    H   15 0.968    C   10 0.107
     5  C   3.988        C    4 1.429    C    8 1.377    C    6 1.011    C    1 0.105
     6  C   3.997        C    5 1.011    C    7 1.002    H   16 0.974    H   17 0.972
     7  C   3.997        C    6 1.002    H   18 0.988    H   20 0.987    H   19 0.987
     8  C   3.989        C   10 1.420    C    5 1.377    C    9 1.024    C    2 0.104
     9  C   3.997        C    8 1.024    H   23 0.985    H   21 0.974    H   22 0.970
    10  C   3.991        C    1 1.440    C    8 1.420    H   24 0.969    C    4 0.107
    11  H   0.999        C    1 0.969
    12  H   0.998        C    3 0.986
    13  H   0.998        C    3 0.976
    14  H   0.998        C    3 0.973
    15  H   0.999        C    4 0.968
    16  H   0.999        C    6 0.974
    17  H   0.998        C    6 0.972
    18  H   0.999        C    7 0.988
    19  H   0.998        C    7 0.987
    20  H   0.999        C    7 0.987
    21  H   0.998        C    9 0.974
    22  H   0.998        C    9 0.970
    23  H   0.998        C    9 0.985
    24  H   0.999        C   10 0.969

molecular dipole:
                 x           y           z       tot (Debye)
 q only:       -0.089      -0.148       0.007
   full:       -0.089      -0.164       0.016       0.476
molecular quadrupole (traceless):
                xx          xy          yy          xz          yz          zz
 q only:        2.437       0.225      -0.363      -0.065      -0.062      -2.075
  q+dip:        3.706      -0.104       2.001       0.080       0.578      -5.708
   full:        2.806       0.027       0.519       0.012       0.162      -3.325

           -------------------------------------------------
          |                Geometry Summary                 |
           -------------------------------------------------

      molecular mass/u    :      134.2206000
   center of mass at/Å    :       -0.3927988      -0.4354351       0.1742740
  moments of inertia/u·Å² :        0.2527735E+03   0.4794059E+03   0.6841906E+03
rotational constants/cm⁻¹ :        0.6669067E-01   0.3516359E-01   0.2463879E-01

 * 21 selected distances

     #   Z        #   Z                                     value/Å
     1   6 C      2   6 C                                 1.3861640
     2   6 C      4   6 C                                 1.3880913
     4   6 C      5   6 C                                 1.3872716
     6   6 C      7   6 C                                 1.5300300 (max)
     5   6 C      8   6 C                                 1.3972325
     1   6 C     10   6 C                                 1.3828741
     8   6 C     10   6 C                                 1.3879913
     1   6 C     11   1 H                                 1.0808027 (min)
     3   6 C     12   1 H                                 1.0873268
     3   6 C     13   1 H                                 1.0892694
     3   6 C     14   1 H                                 1.0899625
     4   6 C     15   1 H                                 1.0818855
     6   6 C     16   1 H                                 1.0925267
     6   6 C     17   1 H                                 1.0902658
     7   6 C     18   1 H                                 1.0876782
     7   6 C     19   1 H                                 1.0879496
     7   6 C     20   1 H                                 1.0875462
     9   6 C     21   1 H                                 1.0887581
     9   6 C     22   1 H                                 1.0905031
     9   6 C     23   1 H                                 1.0873576
    10   6 C     24   1 H                                 1.0812626

 * 2 distinct bonds (by element types)

   Z      Z             #   av. dist./Å        max./Å        min./Å
   1 H    6 C          14     1.0873639     1.0925267     1.0808027
   6 C    6 C           7     1.4085221     1.5300300     1.3828741


optimized geometry written to: xtbopt.xyz


           -------------------------------------------------
          | TOTAL ENERGY              -28.554502795172 Eh   |
          | GRADIENT NORM               0.000635270420 Eh/α |
          | HOMO-LUMO GAP               4.516260138558 eV   |
           -------------------------------------------------

------------------------------------------------------------------------
 * finished run on 2021/05/19 at 11:00:01.124     
------------------------------------------------------------------------
 total:
 * wall-time:     0 d,  0 h,  0 min,  0.405 sec
 *  cpu-time:     0 d,  0 h,  0 min,  0.390 sec
 * ratio c/w:     0.961 speedup
 SCF:
 * wall-time:     0 d,  0 h,  0 min,  0.026 sec
 *  cpu-time:     0 d,  0 h,  0 min,  0.026 sec
 * ratio c/w:     0.997 speedup
 ANC optimizer:
 * wall-time:     0 d,  0 h,  0 min,  0.348 sec
 *  cpu-time:     0 d,  0 h,  0 min,  0.347 sec
 * ratio c/w:     0.998 speedup

