      -----------------------------------------------------------      
     |                   =====================                   |     
     |                           x T B                           |     
     |                   =====================                   |     
     |                         S. Grimme                         |     
     |          Mulliken Center for Theoretical Chemistry        |     
     |                    University of Bonn                     |     
     |                Version 6.2 RC2 (SAW190805)                |     
      -----------------------------------------------------------      

   This program is distributed in the hope that it will be useful,
   but WITHOUT ANY WARRANTY; without even the implied warranty of
   MERCHANTABILITY or FITNESS FOR A PARTICULAR PURPOSE.
   
   FOR NON-COMMERCIAL, ACADEMIA USE ONLY.
   
   Cite this work as:
   * S. Grimme, C. Bannwarth, P. Shushkov, J. Chem. Theory Comput., 2017,
     13, 1989-2009. DOI: 10.1021/acs.jctc.7b00118
   * C. Bannwarth, S. Ehlert and S. Grimme., J. Chem. Theory Comput., 2019,
     15, 1652-1671. DOI: 10.1021/acs.jctc.8b01176
   * P. Pracht, E. Caldeweyher, S. Ehlert, S. Grimme, ChemRxiv, 2019, preprint.
     DOI: 10.26434/chemrxiv.8326202.v1
   
   for DFT-D4:
   * E. Caldeweyher, C. Bannwarth and S. Grimme, J. Chem. Phys., 2017,
     147, 034112. DOI: 10.1063/1.4993215
   * E. Caldeweyher, S. Ehlert, A. Hansen, H. Neugebauer, S. Spicher,
     C. Bannwarth and S. Grimme, J. Chem. Phys., 2019, 150, 154122.
     DOI: 10.1063/1.5090222
   
   for sTDA-xTB:
   * S. Grimme and C. Bannwarth, J. Chem. Phys., 2016, 145, 054103.
     DOI: 10.1063/1.4959605
   
   in the mass-spec context:
   * V. Asgeirsson, C. Bauer and S. Grimme, Chem. Sci., 2017, 8, 4879.
     DOI: 10.1039/c7sc00601b
   
   for metadynamics refer to:
   * S. Grimme, J. Chem. Theory Comput., 2019, 155, 2847-2862
     DOI: 10.1021/acs.jctc.9b00143
   
   with help from (in alphabetical order)
   C. Bannwarth, F. Bohle, G. Brandenburg, E. Caldeweyher, M. Checinski,
   S. Dohm, S. Ehlert, S. Ehrlich, F. März, H. Neugebauer, J. Pisarek,
   P. Pracht, P. Shushkov, and S. Spicher.
   
 * started run on 2021/05/19 at 11:00:01.580     

           -------------------------------------------------
          |                Calculation Setup                |
           -------------------------------------------------

          program call               : /ihome/ghutchison/geoffh/xtb/xtb 668.xyz -opt
          hostname                   : smp-n144
          coordinate file            : 668.xyz
          omp threads                :                     1
          number of atoms            :                    25
          number of electrons        :                    72
          charge                     :                     0
          spin                       :                   0.0
          first test random number   :      0.10705168503308


########################################################################
# WARNING! Please study the warnings concerning your input carefully
#  - the use of '-opt' is discouraged, please use '--opt' next time
########################################################################

           ------------------------------------------------- 
          |                 G F N 2 - x T B                 |
          | Geometry, Frequencies, Noncovalent interactions |
          |            JCTC 2019 parametrisation            |
           ------------------------------------------------- 
             KAB for C  - Si     :                1.0500
             KAB for H  - Pd     :                0.9500
             k(s)              :                1.8500
             k(p)              :                2.2300
             k(d)              :                2.2300
             k(f)              :                2.0000
             kEN (H0ij)        :               -2.0000
             D4 a1             :                0.5200
             D4 a2             :                5.0000
             D4 s6             :                1.0000
             D4 s8             :                2.7000
             D4 s9             :                5.0000
             alphaj            :                2.0000

  Z AO/shell   Hii/eV     exponent
  1     Wed Apr 25 08:07:45 CEST 2018   EN: 2.200 GM2: 0.406  GM3: 0.0800  RAES: 1.40
     1s    -10.707211    1.230000
  6     Wed Apr 25 08:07:45 CEST 2018   EN: 2.550 GM2: 0.538  GM3: 0.1500  RAES: 3.00
     2s    -13.970922    2.096432
     2p    -10.063292    1.800000
 16     Tue Apr 24 11:44:34 CEST 2018   EN: 2.580 GM2: 0.340  GM3:-0.0502  RAES: 3.10
     3s    -20.029654    1.981333
     3p    -11.377694    2.025643
     3d     -0.420282    1.702555

           ------------------------------------------------- 
          |        Self-Consistent Charge Iterations        |
           ------------------------------------------------- 

          ...................................................
          :                      SETUP                      :
          :.................................................:
          :  # basis functions                  76          :
          :  # atomic orbitals                  75          :
          :  # shells                           41          :
          :  # electrons                        72          :
          :  max. iterations                   250          :
          :  Hamiltonian                  GFN2-xTB          :
          :  restarted?                      false          :
          :  GBSA solvation                  false          :
          :  PC potential                    false          :
          :  electronic temp.          300.0000000     K    :
          :  accuracy                    1.0000000          :
          :  -> integral cutoff          0.2500000E+02      :
          :  -> integral neglect         0.1000000E-07      :
          :  -> SCF convergence          0.1000000E-05 Eh   :
          :  -> wf. convergence          0.1000000E-03 e    :
          :  Broyden damping             0.4000000          :
          ...................................................

 iter      E             dE          RMSdq      gap      omega  full diag
   1    -38.9294695 -0.389295E+02  0.499E+00    3.12       0.0  T
   2    -38.9537432 -0.242737E-01  0.286E+00    2.95       1.0  T
   3    -38.9450428  0.870043E-02  0.883E-01    2.88       1.0  T
   4    -38.9549662 -0.992343E-02  0.366E-01    2.95       1.0  T
   5    -38.9570089 -0.204269E-02  0.120E-01    2.94       1.0  T
   6    -38.9572082 -0.199316E-03  0.663E-02    2.94       1.0  T
   7    -38.9572742 -0.659741E-04  0.163E-02    2.94       1.2  T
   8    -38.9572768 -0.264249E-05  0.983E-03    2.94       2.0  T
   9    -38.9572776 -0.821828E-06  0.298E-03    2.94       6.7  T
  10    -38.9572777 -0.639430E-07  0.115E-03    2.94      17.3  T
  11    -38.9572777 -0.121975E-07  0.413E-04    2.94      48.5  T
  12    -38.9572777 -0.527344E-09  0.169E-04    2.94     118.0  T

   *** convergence criteria satisfied after 12 iterations ***

         #    Occupation            Energy/Eh            Energy/eV
      -------------------------------------------------------------
         1        2.0000           -0.7261038             -19.7583
       ...           ...                  ...                  ...
        30        2.0000           -0.4268238             -11.6145
        31        2.0000           -0.4251476             -11.5689
        32        2.0000           -0.4216132             -11.4727
        33        2.0000           -0.4151898             -11.2979
        34        2.0000           -0.4023164             -10.9476
        35        2.0000           -0.3869160             -10.5285
        36        2.0000           -0.3671888              -9.9917 (HOMO)
        37                         -0.2592500              -7.0546 (LUMO)
        38                         -0.2441681              -6.6442
        39                         -0.2291902              -6.2366
        40                         -0.2086464              -5.6776
        41                         -0.1923476              -5.2340
       ...                                ...                  ...
        75                          0.7119232              19.3724
      -------------------------------------------------------------
                  HL-Gap            0.1079388 Eh            2.9372 eV
             Fermi-level           -0.3132194 Eh           -8.5231 eV

 SCC (total)                   0 d,  0 h,  0 min,  0.046 sec
 SCC setup                      ...        0 min,  0.000 sec (  0.704%)
 Dispersion                     ...        0 min,  0.000 sec (  0.912%)
 integral evaluation            ...        0 min,  0.011 sec ( 24.027%)
 zeroth order Hamiltonian       ...        0 min,  0.000 sec (  0.457%)
 iterations                     ...        0 min,  0.017 sec ( 36.917%)
 molecular gradient             ...        0 min,  0.016 sec ( 35.996%)
 printout                       ...        0 min,  0.000 sec (  0.870%)

         :::::::::::::::::::::::::::::::::::::::::::::::::::::
         ::                     SUMMARY                     ::
         :::::::::::::::::::::::::::::::::::::::::::::::::::::
         :: total energy             -38.293633606426 Eh    ::
         :: gradient norm              0.077117510557 Eh/a0 ::
         :: HOMO-LUMO gap              2.937163984374 eV    ::
         ::.................................................::
         :: SCC energy               -38.957277713118 Eh    ::
         :: -> isotropic ES            0.002048169277 Eh    ::
         :: -> anisotropic ES          0.004573621875 Eh    ::
         :: -> anisotropic XC          0.024539258684 Eh    ::
         :: -> dispersion             -0.029415033630 Eh    ::
         :: repulsion energy           0.663649956307 Eh    ::
         :: add. restraining           0.000000000000 Eh    ::
         :::::::::::::::::::::::::::::::::::::::::::::::::::::

      ----------------------------------------------------------- 
     |                   =====================                   |
     |                        A N C O P T                        |
     |                   =====================                   |
     |               Approximate Normal Coordinate               |
     |                Rational Function Optimizer                |
      ----------------------------------------------------------- 

          ...................................................
          :                      SETUP                      :
          :.................................................:
          :   optimization level            normal          :
          :   max. optcycles                   200          :
          :   ANC micro-cycles                  20          :
          :   degrees of freedom                69          :
          :.................................................:
          :   RF solver                   davidson          :
          :   input Hessian                  false          :
          :   write xtbopt.log                true          :
          :   linear?                        false          :
          :   energy convergence         0.5000000E-05 Eh   :
          :   grad. convergence          0.1000000E-02 Eh/α :
          :   maximium RF displ.         2.0000000          :
          :   Hlow (freq-cutoff)         0.5000000E-02      :
          :   Hmax (freq-cutoff)         5.0000000          :
          :   S6 in model hess.         20.0000000          :
          ...................................................

generating ANC from model Hessian ...
Using Lindh-Hessian (1995)
 Shifting diagonal of input Hessian by   3.463474851847013E-003
 Lowest  eigenvalues of input Hessian
   -0.000000   -0.000000    0.000000    0.000000    0.000000    0.000000
    0.005000    0.005544    0.007082    0.008073    0.009348    0.014272
    0.016252    0.018906    0.021687    0.023355    0.024630    0.029451
 Highest eigenvalues
    1.828930    1.852335    1.906703    1.951965    1.982836    2.011613
 

........................................................................
.............................. CYCLE    1 ..............................
........................................................................
   1    -38.9572777 -0.389573E+02  0.839E-05    2.94       0.0  T
   2    -38.9572777 -0.153335E-10  0.558E-05    2.94     358.4  T
   3    -38.9572777 -0.116387E-10  0.404E-05    2.94     494.9  T
     SCC iter.                  ...        0 min,  0.005 sec
     gradient                   ...        0 min,  0.016 sec
 * total energy  :   -38.2936336 Eh     change        0.7251700E-08 Eh
   gradient norm :     0.0771181 Eh/α   predicted     0.0000000E+00 (-100.00%)
   displ. norm   :     0.3218609 α      lambda       -0.1048330E-01
   maximum displ.:     0.1718909 α      in ANC's #14, #16, #15, ...

........................................................................
.............................. CYCLE    2 ..............................
........................................................................
   1    -38.9949536 -0.389950E+02  0.287E-01    3.03       0.0  T
   2    -38.9950140 -0.603975E-04  0.144E-01    3.01       1.0  T
   3    -38.9949351  0.789020E-04  0.673E-02    3.02       1.0  T
   4    -38.9950582 -0.123116E-03  0.237E-02    3.01       1.0  T
   5    -38.9950603 -0.208914E-05  0.112E-02    3.01       1.8  T
   6    -38.9950622 -0.192881E-05  0.251E-03    3.01       8.0  T
   7    -38.9950623 -0.548933E-07  0.119E-03    3.01      16.8  T
     SCC iter.                  ...        0 min,  0.009 sec
     gradient                   ...        0 min,  0.015 sec
 * total energy  :   -38.3004545 Eh     change       -0.6820946E-02 Eh
   gradient norm :     0.0259431 Eh/α   predicted    -0.5784662E-02 ( -15.19%)
   displ. norm   :     0.2247255 α      lambda       -0.1736285E-02
   maximum displ.:     0.1205027 α      in ANC's #3, #5, #7, ...

........................................................................
.............................. CYCLE    3 ..............................
........................................................................
   1    -39.0074177 -0.390074E+02  0.179E-01    3.04       0.0  T
   2    -39.0074396 -0.219849E-04  0.918E-02    3.02       1.0  T
   3    -39.0074114  0.282140E-04  0.403E-02    3.02       1.0  T
   4    -39.0074507 -0.393212E-04  0.151E-02    3.02       1.3  T
   5    -39.0074521 -0.136784E-05  0.609E-03    3.02       3.3  T
   6    -39.0074526 -0.498610E-06  0.182E-03    3.02      11.0  T
   7    -39.0074527 -0.423829E-07  0.579E-04    3.02      34.5  T
     SCC iter.                  ...        0 min,  0.009 sec
     gradient                   ...        0 min,  0.016 sec
 * total energy  :   -38.3014683 Eh     change       -0.1013718E-02 Eh
   gradient norm :     0.0080384 Eh/α   predicted    -0.9119985E-03 ( -10.03%)
   displ. norm   :     0.1701941 α      lambda       -0.3625850E-03
   maximum displ.:     0.1093980 α      in ANC's #3, #5, #2, ...

........................................................................
.............................. CYCLE    4 ..............................
........................................................................
   1    -39.0076676 -0.390077E+02  0.118E-01    3.01       0.0  T
   2    -39.0076705 -0.285623E-05  0.676E-02    3.00       1.0  T
   3    -39.0076595  0.109456E-04  0.234E-02    3.00       1.0  T
   4    -39.0076719 -0.123153E-04  0.681E-03    3.00       2.9  T
   5    -39.0076722 -0.374936E-06  0.273E-03    3.00       7.3  T
   6    -39.0076723 -0.113452E-06  0.684E-04    3.00      29.2  T
     SCC iter.                  ...        0 min,  0.008 sec
     gradient                   ...        0 min,  0.015 sec
 * total energy  :   -38.3017416 Eh     change       -0.2733492E-03 Eh
   gradient norm :     0.0051992 Eh/α   predicted    -0.1865444E-03 ( -31.76%)
   displ. norm   :     0.2939901 α      lambda       -0.4318237E-03
   maximum displ.:     0.1860104 α      in ANC's #3, #2, #5, ...

........................................................................
.............................. CYCLE    5 ..............................
........................................................................
   1    -39.0047297 -0.390047E+02  0.185E-01    2.99       0.0  T
   2    -39.0047342 -0.456697E-05  0.108E-01    2.98       1.0  T
   3    -39.0047176  0.166492E-04  0.273E-02    2.98       1.0  T
   4    -39.0047361 -0.185127E-04  0.677E-03    2.98       3.0  T
   5    -39.0047366 -0.509193E-06  0.283E-03    2.98       7.1  T
   6    -39.0047367 -0.103636E-06  0.936E-04    2.98      21.4  T
     SCC iter.                  ...        0 min,  0.008 sec
     gradient                   ...        0 min,  0.015 sec
 * total energy  :   -38.3020222 Eh     change       -0.2805828E-03 Eh
   gradient norm :     0.0077392 Eh/α   predicted    -0.2345767E-03 ( -16.40%)
   displ. norm   :     0.2159178 α      lambda       -0.2494743E-03
   maximum displ.:     0.1284377 α      in ANC's #3, #5, #2, ...

........................................................................
.............................. CYCLE    6 ..............................
........................................................................
   1    -39.0029597 -0.390030E+02  0.148E-01    2.96       0.0  T
   2    -39.0029605 -0.869626E-06  0.866E-02    2.96       1.0  T
   3    -39.0029549  0.566389E-05  0.167E-02    2.96       1.2  T
   4    -39.0029613 -0.642300E-05  0.293E-03    2.96       6.8  T
   5    -39.0029613 -0.132846E-07  0.149E-03    2.96      13.4  T
   6    -39.0029613 -0.380223E-07  0.412E-04    2.96      48.6  T
     SCC iter.                  ...        0 min,  0.008 sec
     gradient                   ...        0 min,  0.015 sec
 * total energy  :   -38.3021979 Eh     change       -0.1757342E-03 Eh
   gradient norm :     0.0090574 Eh/α   predicted    -0.1305536E-03 ( -25.71%)
   displ. norm   :     0.2295818 α      lambda       -0.2876988E-03
   maximum displ.:     0.1301051 α      in ANC's #3, #2, #5, ...

........................................................................
.............................. CYCLE    7 ..............................
........................................................................
   1    -39.0032093 -0.390032E+02  0.154E-01    2.94       0.0  T
   2    -39.0032107 -0.143686E-05  0.894E-02    2.94       1.0  T
   3    -39.0032090  0.169334E-05  0.118E-02    2.95       1.7  T
   4    -39.0032110 -0.204066E-05  0.481E-03    2.95       4.2  T
   5    -39.0032112 -0.200929E-06  0.168E-03    2.95      11.9  T
   6    -39.0032113 -0.523485E-07  0.391E-04    2.95      51.2  T
     SCC iter.                  ...        0 min,  0.008 sec
     gradient                   ...        0 min,  0.015 sec
 * total energy  :   -38.3024163 Eh     change       -0.2183305E-03 Eh
   gradient norm :     0.0072939 Eh/α   predicted    -0.1514369E-03 ( -30.64%)
   displ. norm   :     0.2752281 α      lambda       -0.2942451E-03
   maximum displ.:     0.1391325 α      in ANC's #4, #2, #3, ...

........................................................................
.............................. CYCLE    8 ..............................
........................................................................
   1    -39.0041257 -0.390041E+02  0.191E-01    2.93       0.0  T
   2    -39.0041297 -0.400946E-05  0.110E-01    2.94       1.0  T
   3    -39.0041260  0.369197E-05  0.179E-02    2.94       1.1  T
   4    -39.0041302 -0.418971E-05  0.786E-03    2.94       2.5  T
   5    -39.0041308 -0.660883E-06  0.253E-03    2.94       7.9  T
   6    -39.0041309 -0.937108E-07  0.804E-04    2.94      24.9  T
     SCC iter.                  ...        0 min,  0.008 sec
     gradient                   ...        0 min,  0.015 sec
 * total energy  :   -38.3026342 Eh     change       -0.2179616E-03 Eh
   gradient norm :     0.0049920 Eh/α   predicted    -0.1582689E-03 ( -27.39%)
   displ. norm   :     0.2321672 α      lambda       -0.2234566E-03
   maximum displ.:     0.1423188 α      in ANC's #4, #2, #1, ...

........................................................................
.............................. CYCLE    9 ..............................
........................................................................
   1    -39.0066042 -0.390066E+02  0.161E-01    2.93       0.0  T
   2    -39.0066086 -0.438530E-05  0.914E-02    2.94       1.0  T
   3    -39.0066056  0.294969E-05  0.166E-02    2.94       1.2  T
   4    -39.0066090 -0.339317E-05  0.766E-03    2.94       2.6  T
   5    -39.0066097 -0.647060E-06  0.220E-03    2.94       9.1  T
   6    -39.0066097 -0.545458E-07  0.967E-04    2.94      20.7  T
     SCC iter.                  ...        0 min,  0.008 sec
     gradient                   ...        0 min,  0.015 sec
 * total energy  :   -38.3027823 Eh     change       -0.1481148E-03 Eh
   gradient norm :     0.0031857 Eh/α   predicted    -0.1177547E-03 ( -20.50%)
   displ. norm   :     0.4224383 α      lambda       -0.2065752E-03
   maximum displ.:     0.2379664 α      in ANC's #4, #2, #5, ...

........................................................................
.............................. CYCLE   10 ..............................
........................................................................
   1    -39.0015385 -0.390015E+02  0.277E-01    2.91       0.0  T
   2    -39.0015456 -0.707094E-05  0.159E-01    2.92       1.0  T
   3    -39.0015280  0.175211E-04  0.335E-02    2.92       1.0  T
   4    -39.0015482 -0.201575E-04  0.115E-02    2.92       1.7  T
   5    -39.0015490 -0.808354E-06  0.381E-03    2.92       5.2  T
   6    -39.0015492 -0.235757E-06  0.892E-04    2.92      22.4  T
   7    -39.0015492 -0.705566E-08  0.433E-04    2.92      46.2  T
     SCC iter.                  ...        0 min,  0.009 sec
     gradient                   ...        0 min,  0.016 sec
 * total energy  :   -38.3026796 Eh     change        0.1027312E-03 Eh
   gradient norm :     0.0142507 Eh/α   predicted    -0.1217206E-03 (-218.48%)
   displ. norm   :     0.1743173 α      lambda       -0.5034305E-03
   maximum displ.:     0.0910389 α      in ANC's #3, #2, #5, ...

........................................................................
.............................. CYCLE   11 ..............................
........................................................................
   1    -39.0070221 -0.390070E+02  0.108E-01    2.93       0.0  T
   2    -39.0070232 -0.112487E-05  0.629E-02    2.93       1.0  T
   3    -39.0070188  0.440254E-05  0.160E-02    2.93       1.2  T
   4    -39.0070238 -0.501057E-05  0.347E-03    2.93       5.8  T
   5    -39.0070239 -0.545925E-07  0.150E-03    2.93      13.3  T
   6    -39.0070239 -0.288292E-07  0.488E-04    2.93      41.0  T
     SCC iter.                  ...        0 min,  0.008 sec
     gradient                   ...        0 min,  0.015 sec
 * total energy  :   -38.3029129 Eh     change       -0.2333334E-03 Eh
   gradient norm :     0.0034682 Eh/α   predicted    -0.2593711E-03 (  11.16%)
   displ. norm   :     0.1097154 α      lambda       -0.5841209E-04
   maximum displ.:     0.0657615 α      in ANC's #4, #2, #1, ...

........................................................................
.............................. CYCLE   12 ..............................
........................................................................
   1    -39.0071768 -0.390072E+02  0.644E-02    2.93       0.0  T
   2    -39.0071771 -0.310182E-06  0.372E-02    2.93       1.0  T
   3    -39.0071769  0.208546E-06  0.464E-03    2.93       4.3  T
   4    -39.0071772 -0.283320E-06  0.224E-03    2.93       8.9  T
   5    -39.0071772 -0.421783E-07  0.698E-04    2.93      28.6  T
   6    -39.0071773 -0.936319E-08  0.165E-04    2.93     121.4  T
     SCC iter.                  ...        0 min,  0.008 sec
     gradient                   ...        0 min,  0.016 sec
 * total energy  :   -38.3029636 Eh     change       -0.5065553E-04 Eh
   gradient norm :     0.0034375 Eh/α   predicted    -0.2956018E-04 ( -41.64%)
   displ. norm   :     0.4843614 α      lambda       -0.2175948E-03
   maximum displ.:     0.2763192 α      in ANC's #4, #2, #1, ...

........................................................................
.............................. CYCLE   13 ..............................
........................................................................
   1    -39.0029635 -0.390030E+02  0.290E-01    2.91       0.0  T
   2    -39.0029692 -0.566366E-05  0.169E-01    2.91       1.0  T
   3    -39.0029577  0.114767E-04  0.266E-02    2.91       1.0  T
   4    -39.0029713 -0.136520E-04  0.922E-03    2.91       2.2  T
   5    -39.0029718 -0.474744E-06  0.388E-03    2.91       5.1  T
   6    -39.0029720 -0.243223E-06  0.989E-04    2.91      20.2  T
   7    -39.0029721 -0.486071E-08  0.569E-04    2.91      35.2  T
     SCC iter.                  ...        0 min,  0.009 sec
     gradient                   ...        0 min,  0.016 sec
 * total energy  :   -38.3030144 Eh     change       -0.5083853E-04 Eh
   gradient norm :     0.0089561 Eh/α   predicted    -0.1343338E-03 ( 164.24%)
   displ. norm   :     0.1414593 α      lambda       -0.1593045E-03
   maximum displ.:     0.0948710 α      in ANC's #4, #2, #1, ...

........................................................................
.............................. CYCLE   14 ..............................
........................................................................
   1    -39.0064833 -0.390065E+02  0.968E-02    2.92       0.0  T
   2    -39.0064842 -0.879511E-06  0.558E-02    2.92       1.0  T
   3    -39.0064815  0.270881E-05  0.131E-02    2.92       1.5  T
   4    -39.0064846 -0.312095E-05  0.390E-03    2.92       5.1  T
   5    -39.0064847 -0.608670E-07  0.151E-03    2.92      13.2  T
   6    -39.0064847 -0.353688E-07  0.366E-04    2.92      54.7  T
     SCC iter.                  ...        0 min,  0.008 sec
     gradient                   ...        0 min,  0.015 sec
 * total energy  :   -38.3030820 Eh     change       -0.6756827E-04 Eh
   gradient norm :     0.0021866 Eh/α   predicted    -0.8125608E-04 (  20.26%)
   displ. norm   :     0.0977153 α      lambda       -0.2663171E-04
   maximum displ.:     0.0623959 α      in ANC's #2, #4, #1, ...

........................................................................
.............................. CYCLE   15 ..............................
........................................................................
   1    -39.0062095 -0.390062E+02  0.582E-02    2.91       0.0  T
   2    -39.0062097 -0.173654E-06  0.340E-02    2.91       1.0  T
   3    -39.0062097  0.391399E-07  0.281E-03    2.92       7.1  T
   4    -39.0062098 -0.963009E-07  0.127E-03    2.91      15.8  T
   5    -39.0062098 -0.118339E-07  0.297E-04    2.91      67.3  T
   6    -39.0062098 -0.971298E-09  0.144E-04    2.91     138.7  T
     SCC iter.                  ...        0 min,  0.008 sec
     gradient                   ...        0 min,  0.016 sec
 * total energy  :   -38.3031030 Eh     change       -0.2103844E-04 Eh
   gradient norm :     0.0020046 Eh/α   predicted    -0.1344366E-04 ( -36.10%)
   displ. norm   :     0.3437736 α      lambda       -0.8060673E-04
   maximum displ.:     0.2231327 α      in ANC's #2, #4, #1, ...

........................................................................
.............................. CYCLE   16 ..............................
........................................................................
   1    -39.0040462 -0.390040E+02  0.198E-01    2.91       0.0  T
   2    -39.0040480 -0.176459E-05  0.115E-01    2.91       1.0  T
   3    -39.0040446  0.333568E-05  0.149E-02    2.91       1.3  T
   4    -39.0040488 -0.418884E-05  0.451E-03    2.91       4.4  T
   5    -39.0040489 -0.880067E-07  0.195E-03    2.91      10.3  T
   6    -39.0040490 -0.610388E-07  0.522E-04    2.91      38.3  T
   7    -39.0040490 -0.654779E-09  0.305E-04    2.91      65.5  T
     SCC iter.                  ...        0 min,  0.009 sec
     gradient                   ...        0 min,  0.016 sec
 * total energy  :   -38.3031111 Eh     change       -0.8056893E-05 Eh
   gradient norm :     0.0053893 Eh/α   predicted    -0.4507025E-04 ( 459.40%)
   displ. norm   :     0.1017457 α      lambda       -0.8168597E-04
   maximum displ.:     0.0589871 α      in ANC's #4, #5, #2, ...

........................................................................
.............................. CYCLE   17 ..............................
........................................................................
   1    -39.0062602 -0.390063E+02  0.540E-02    2.91       0.0  T
   2    -39.0062607 -0.511121E-06  0.312E-02    2.91       1.0  T
   3    -39.0062588  0.187917E-05  0.106E-02    2.91       1.9  T
   4    -39.0062610 -0.212234E-05  0.181E-03    2.91      11.0  T
   5    -39.0062610 -0.175578E-07  0.736E-04    2.91      27.2  T
     SCC iter.                  ...        0 min,  0.007 sec
     gradient                   ...        0 min,  0.015 sec
 * total energy  :   -38.3031391 Eh     change       -0.2799423E-04 Eh
   gradient norm :     0.0034989 Eh/α   predicted    -0.4126696E-04 (  47.41%)
   displ. norm   :     0.0236715 α      lambda       -0.2012046E-04
   maximum displ.:     0.0145186 α      in ANC's #5, #2, #11, ...

........................................................................
.............................. CYCLE   18 ..............................
........................................................................
   1    -39.0064661 -0.390065E+02  0.137E-02    2.91       0.0  T
   2    -39.0064663 -0.171536E-06  0.789E-03    2.91       2.5  T
   3    -39.0064662  0.777659E-07  0.240E-03    2.91       8.3  T
   4    -39.0064663 -0.914399E-07  0.997E-04    2.91      20.1  T
   5    -39.0064663 -0.141038E-07  0.343E-04    2.91      58.3  T
     SCC iter.                  ...        0 min,  0.007 sec
     gradient                   ...        0 min,  0.016 sec
 * total energy  :   -38.3031480 Eh     change       -0.8891758E-05 Eh
   gradient norm :     0.0014220 Eh/α   predicted    -0.1007385E-04 (  13.29%)
   displ. norm   :     0.1094636 α      lambda       -0.8989158E-05
   maximum displ.:     0.0743465 α      in ANC's #2, #4, #5, ...

........................................................................
.............................. CYCLE   19 ..............................
........................................................................
   1    -39.0058453 -0.390058E+02  0.660E-02    2.91       0.0  T
   2    -39.0058456 -0.216020E-06  0.385E-02    2.91       1.0  T
   3    -39.0058452  0.345141E-06  0.486E-03    2.91       4.1  T
   4    -39.0058457 -0.436954E-06  0.156E-03    2.91      12.8  T
   5    -39.0058457 -0.124006E-07  0.690E-04    2.91      29.0  T
   6    -39.0058457 -0.740928E-08  0.194E-04    2.91     103.2  T
     SCC iter.                  ...        0 min,  0.008 sec
     gradient                   ...        0 min,  0.016 sec
 * total energy  :   -38.3031560 Eh     change       -0.7990477E-05 Eh
   gradient norm :     0.0016126 Eh/α   predicted    -0.4521391E-05 ( -43.42%)
   displ. norm   :     0.0601368 α      lambda       -0.6567574E-05
   maximum displ.:     0.0372972 α      in ANC's #2, #4, #5, ...

........................................................................
.............................. CYCLE   20 ..............................
........................................................................
   1    -39.0061708 -0.390062E+02  0.361E-02    2.91       0.0  T
   2    -39.0061709 -0.787340E-07  0.211E-02    2.91       1.0  T
   3    -39.0061708  0.139514E-06  0.301E-03    2.91       6.6  T
   4    -39.0061709 -0.170835E-06  0.904E-04    2.91      22.1  T
   5    -39.0061709 -0.446064E-08  0.422E-04    2.91      47.4  T
     SCC iter.                  ...        0 min,  0.007 sec
     gradient                   ...        0 min,  0.016 sec
 * total energy  :   -38.3031628 Eh     change       -0.6785509E-05 Eh
   gradient norm :     0.0009958 Eh/α   predicted    -0.3293461E-05 ( -51.46%)
   displ. norm   :     0.1295663 α      lambda       -0.8195314E-05
   maximum displ.:     0.0712047 α      in ANC's #2, #4, #5, ...
 * RMSD in coord.:     0.5470933 α      energy gain  -0.9529152E-02 Eh

generating ANC from model Hessian ...
Using Lindh-Hessian (1995)
 Shifting diagonal of input Hessian by   3.366479727522480E-003
 Lowest  eigenvalues of input Hessian
   -0.000000   -0.000000   -0.000000   -0.000000   -0.000000    0.000000
    0.005000    0.005458    0.006396    0.008007    0.009759    0.015362
    0.018000    0.019053    0.022485    0.025102    0.027952    0.030790
 Highest eigenvalues
    1.887061    1.925465    1.976413    2.013479    2.068379    2.097161
 

........................................................................
.............................. CYCLE   21 ..............................
........................................................................
   1    -39.0059849 -0.390060E+02  0.774E-02    2.90       0.0  T
   2    -39.0059853 -0.381092E-06  0.450E-02    2.90       1.0  T
   3    -39.0059851  0.150863E-06  0.463E-03    2.90       4.3  T
   4    -39.0059854 -0.263555E-06  0.209E-03    2.90       9.6  T
   5    -39.0059854 -0.362623E-07  0.364E-04    2.90      55.0  T
   6    -39.0059854 -0.108201E-08  0.200E-04    2.90      99.8  T
     SCC iter.                  ...        0 min,  0.008 sec
     gradient                   ...        0 min,  0.016 sec
 * total energy  :   -38.3031683 Eh     change       -0.5532867E-05 Eh
   gradient norm :     0.0014314 Eh/α   predicted     0.0000000E+00 (-100.00%)
   displ. norm   :     0.0311287 α      lambda       -0.7497867E-05
   maximum displ.:     0.0217252 α      in ANC's #4, #1, #5, ...

........................................................................
.............................. CYCLE   22 ..............................
........................................................................
   1    -39.0065845 -0.390066E+02  0.156E-02    2.91       0.0  T
   2    -39.0065845 -0.404135E-07  0.888E-03    2.91       2.3  T
   3    -39.0065845  0.174757E-07  0.149E-03    2.91      13.4  T
   4    -39.0065845 -0.245227E-07  0.675E-04    2.91      29.6  T
   5    -39.0065845 -0.409374E-08  0.169E-04    2.91     118.3  T
     SCC iter.                  ...        0 min,  0.007 sec
     gradient                   ...        0 min,  0.016 sec
 * total energy  :   -38.3031733 Eh     change       -0.4974690E-05 Eh
   gradient norm :     0.0006442 Eh/α   predicted    -0.3751061E-05 ( -24.60%)
   displ. norm   :     0.0122442 α      lambda       -0.1559850E-05
   maximum displ.:     0.0077342 α      in ANC's #4, #1, #14, ...

   *** GEOMETRY OPTIMIZATION CONVERGED AFTER 22 ITERATIONS ***

------------------------------------------------------------------------
 total energy gain   :        -0.0095397 Eh       -5.9862 kcal/mol
 total RMSD          :         0.5471773 a0        0.2896 Å
 total power (kW/mol):        -1.1384715 (step)  -31.8992 (real)
------------------------------------------------------------------------

 ANCopt (total)                0 d,  0 h,  0 min,  0.785 sec
 optimizer setup                ...        0 min,  0.000 sec (  0.020%)
 model hessian                  ...        0 min,  0.006 sec (  0.799%)
 ANC generation                 ...        0 min,  0.001 sec (  0.180%)
 coordinate transformation      ...        0 min,  0.000 sec (  0.052%)
 single point calculation       ...        0 min,  0.768 sec ( 97.786%)
 optimization log               ...        0 min,  0.002 sec (  0.282%)
 hessian update                 ...        0 min,  0.000 sec (  0.037%)
 rational function              ...        0 min,  0.005 sec (  0.659%)

================
 final structure:
================
$coord
   -5.50882545339923    2.74183952360408   -0.00677279632735      C 
   -6.41938450889337    0.28614660086457    0.00593976529191      C 
   -4.82241735635838   -1.81033935143066    0.09362724424566      C 
   -2.22364981593703   -1.32235921543699    0.12888476858337      C 
   -1.27786979394875    1.16240384231852    0.07865084748507      C 
   -2.94256265356381    3.19660214398809    0.02634232997330      C 
    1.44333536251629    1.24333546236112    0.05984636248529      C 
    2.50924532529701   -1.18412788900744    0.07890439706405      C 
    0.21739594540206   -3.55909915627372    0.14558680212242      S 
    5.10087513361046   -1.55093443561326    0.06199851897638      C 
    6.64990076427855    0.54930850340465    0.01898067328851      C 
    5.62600584531043    2.97202271511241   -0.00530755266082      C 
    3.04371133109130    3.33078379453170    0.01471953167553      C 
   -5.97549555410014   -4.31149984235000    0.10875067716991      C 
   -4.92340088907794   -6.47826661202068    0.80375857067175      C 
   -6.82190865894149    4.30284347419447   -0.05717596663233      H 
   -8.43637702285236   -0.02938569131146   -0.03650650876211      H 
   -2.21800831640960    5.10243394182652   -0.00378050534014      H 
    5.87461485127352   -3.43742634680399    0.08020394667251      H 
    8.67574209889354    0.30779685621241    0.00371064615642      H 
    6.87178263681674    4.58781729781859   -0.04028735293669      H 
    2.26027326882741    5.21437177822618   -0.00350566849172      H 
   -7.93619712223373   -4.31339661773533   -0.48189647433137      H 
   -3.01017601844982   -6.62090358382666    1.47288099606880      H 
   -5.98121239891060   -8.21616937564111    0.75249407006897      H 
$end
           -------------------------------------------------
          |                Final Singlepoint                |
           -------------------------------------------------

          ...................................................
          :                      SETUP                      :
          :.................................................:
          :  # basis functions                  76          :
          :  # atomic orbitals                  75          :
          :  # shells                           41          :
          :  # electrons                        72          :
          :  max. iterations                   250          :
          :  Hamiltonian                  GFN2-xTB          :
          :  restarted?                      false          :
          :  GBSA solvation                  false          :
          :  PC potential                    false          :
          :  electronic temp.          300.0000000     K    :
          :  accuracy                    1.0000000          :
          :  -> integral cutoff          0.2500000E+02      :
          :  -> integral neglect         0.1000000E-07      :
          :  -> SCF convergence          0.1000000E-05 Eh   :
          :  -> wf. convergence          0.1000000E-03 e    :
          :  Broyden damping             0.4000000          :
          ...................................................

 iter      E             dE          RMSdq      gap      omega  full diag
   1    -39.0065845 -0.390066E+02  0.923E-05    2.91       0.0  T
   2    -39.0065845 -0.308233E-10  0.372E-05    2.91     538.2  T
   3    -39.0065845 -0.200799E-10  0.334E-05    2.91     599.4  T

   *** convergence criteria satisfied after 3 iterations ***

         #    Occupation            Energy/Eh            Energy/eV
      -------------------------------------------------------------
         1        2.0000           -0.7228355             -19.6694
       ...           ...                  ...                  ...
        30        2.0000           -0.4309064             -11.7256
        31        2.0000           -0.4263569             -11.6018
        32        2.0000           -0.4224205             -11.4946
        33        2.0000           -0.4210297             -11.4568
        34        2.0000           -0.4006633             -10.9026
        35        2.0000           -0.3870837             -10.5331
        36        2.0000           -0.3683652             -10.0237 (HOMO)
        37                         -0.2615954              -7.1184 (LUMO)
        38                         -0.2470766              -6.7233
        39                         -0.2287978              -6.2259
        40                         -0.2047843              -5.5725
        41                         -0.2010068              -5.4697
       ...                                ...                  ...
        75                          0.7254137              19.7395
      -------------------------------------------------------------
                  HL-Gap            0.1067697 Eh            2.9054 eV
             Fermi-level           -0.3149803 Eh           -8.5711 eV

 SCC (total)                   0 d,  0 h,  0 min,  0.033 sec
 SCC setup                      ...        0 min,  0.000 sec (  0.664%)
 Dispersion                     ...        0 min,  0.000 sec (  0.734%)
 integral evaluation            ...        0 min,  0.011 sec ( 32.079%)
 zeroth order Hamiltonian       ...        0 min,  0.000 sec (  0.546%)
 iterations                     ...        0 min,  0.005 sec ( 13.866%)
 molecular gradient             ...        0 min,  0.017 sec ( 50.876%)
 printout                       ...        0 min,  0.000 sec (  1.070%)

         :::::::::::::::::::::::::::::::::::::::::::::::::::::
         ::                     SUMMARY                     ::
         :::::::::::::::::::::::::::::::::::::::::::::::::::::
         :: total energy             -38.303173290367 Eh    ::
         :: gradient norm              0.000644718475 Eh/a0 ::
         :: HOMO-LUMO gap              2.905352496818 eV    ::
         ::.................................................::
         :: SCC energy               -39.006584528238 Eh    ::
         :: -> isotropic ES            0.002173302457 Eh    ::
         :: -> anisotropic ES          0.003529034455 Eh    ::
         :: -> anisotropic XC          0.023213198212 Eh    ::
         :: -> dispersion             -0.029720332721 Eh    ::
         :: repulsion energy           0.703430267440 Eh    ::
         :: add. restraining           0.000000000000 Eh    ::
         :::::::::::::::::::::::::::::::::::::::::::::::::::::

           -------------------------------------------------
          |                Property Printout                |
           -------------------------------------------------

    * Orbital Energies and Occupations

         #    Occupation            Energy/Eh            Energy/eV
      -------------------------------------------------------------
         1        2.0000           -0.7228355             -19.6694
       ...           ...                  ...                  ...
        24        2.0000           -0.4747202             -12.9178
        25        2.0000           -0.4666568             -12.6984
        26        2.0000           -0.4483799             -12.2010
        27        2.0000           -0.4439519             -12.0805
        28        2.0000           -0.4389157             -11.9435
        29        2.0000           -0.4361830             -11.8691
        30        2.0000           -0.4309064             -11.7256
        31        2.0000           -0.4263569             -11.6018
        32        2.0000           -0.4224205             -11.4946
        33        2.0000           -0.4210297             -11.4568
        34        2.0000           -0.4006633             -10.9026
        35        2.0000           -0.3870837             -10.5331
        36        2.0000           -0.3683652             -10.0237 (HOMO)
        37                         -0.2615954              -7.1184 (LUMO)
        38                         -0.2470766              -6.7233
        39                         -0.2287978              -6.2259
        40                         -0.2047843              -5.5725
        41                         -0.2010068              -5.4697
        42                         -0.1699878              -4.6256
        43                         -0.1213038              -3.3008
        44                         -0.1102360              -2.9997
        45                         -0.0787063              -2.1417
        46                         -0.0082053              -0.2233
        47                          0.0378271               1.0293
       ...                                ...                  ...
        75                          0.7254137              19.7395
      -------------------------------------------------------------
                  HL-Gap            0.1067697 Eh            2.9054 eV
             Fermi-level           -0.3149803 Eh           -8.5711 eV

     #   Z        covCN         q      C6AA      α(0)
     1   6 C      2.915    -0.036    28.891     8.814
     2   6 C      2.934    -0.037    28.922     8.820
     3   6 C      2.980     0.006    27.887     8.662
     4   6 C      2.998     0.035    27.212     8.557
     5   6 C      3.115    -0.004    27.961     8.662
     6   6 C      2.917    -0.034    28.851     8.808
     7   6 C      3.110    -0.004    27.964     8.663
     8   6 C      3.004     0.038    27.143     8.546
     9  16 S      2.223    -0.093   144.927    20.262
    10   6 C      2.936    -0.039    28.961     8.826
    11   6 C      2.924    -0.030    28.760     8.795
    12   6 C      2.919    -0.035    28.867     8.811
    13   6 C      2.918    -0.032    28.800     8.800
    14   6 C      2.896    -0.028    28.711     8.785
    15   6 C      2.837    -0.085    30.114     8.993
    16   1 H      0.926     0.033     2.541     2.493
    17   1 H      0.926     0.036     2.507     2.476
    18   1 H      0.926     0.035     2.511     2.478
    19   1 H      0.926     0.039     2.461     2.453
    20   1 H      0.926     0.036     2.508     2.477
    21   1 H      0.926     0.033     2.537     2.491
    22   1 H      0.926     0.035     2.518     2.481
    23   1 H      0.925     0.036     2.502     2.474
    24   1 H      0.926     0.055     2.260     2.351
    25   1 H      0.926     0.040     2.444     2.445

 Mol. C6AA /au·bohr⁶  :      10502.170996
 Mol. C8AA /au·bohr⁸  :     292373.622166
 Mol. α(0) /au        :        167.422013


Wiberg/Mayer (AO) data.
largest (>0.10) Wiberg bond orders for each atom
          total WBO             WBO to atom ...
     1  C   3.989        C    6 1.459    C    2 1.423    H   16 0.970
     2  C   3.982        C    1 1.423    C    3 1.387    H   17 0.968
     3  C   3.988        C    2 1.387    C    4 1.331    C   14 1.091
     4  C   3.958        C    3 1.331    C    5 1.311    S    9 1.087
     5  C   3.988        C    6 1.357    C    4 1.311    C    7 1.126
     6  C   3.992        C    1 1.459    C    5 1.357    H   18 0.966
     7  C   3.987        C   13 1.358    C    8 1.306    C    5 1.126
     8  C   3.961        C   10 1.388    C    7 1.306    S    9 1.079
     9  S   2.499        C    4 1.087    C    8 1.079
    10  C   3.989        C   11 1.462    C    8 1.388    H   19 0.969    C   13 0.108
    11  C   3.983        C   10 1.462    C   12 1.400    H   20 0.970
    12  C   3.989        C   13 1.475    C   11 1.400    H   21 0.971
    13  C   3.992        C   12 1.475    C    7 1.358    H   22 0.966    C   10 0.108
    14  C   3.991        C   15 1.899    C    3 1.091    H   23 0.962
    15  C   3.990        C   14 1.899    H   25 0.976    H   24 0.963
    16  H   0.997        C    1 0.970
    17  H   0.998        C    2 0.968
    18  H   0.998        C    6 0.966
    19  H   0.998        C   10 0.969
    20  H   0.998        C   11 0.970
    21  H   0.998        C   12 0.971
    22  H   0.999        C   13 0.966
    23  H   0.998        C   14 0.962
    24  H   0.997        C   15 0.963
    25  H   0.997        C   15 0.976

molecular dipole:
                 x           y           z       tot (Debye)
 q only:       -0.052       0.192       0.011
   full:       -0.059       0.465      -0.014       1.193
molecular quadrupole (traceless):
                xx          xy          yy          xz          yz          zz
 q only:        3.541       0.905       0.351       0.120      -0.365      -3.891
  q+dip:        8.467       0.685       2.114       0.818      -0.699     -10.581
   full:        6.089       0.812      -0.508       0.349      -0.332      -5.581

           -------------------------------------------------
          |                Geometry Summary                 |
           -------------------------------------------------

      molecular mass/u    :      210.2930000
   center of mass at/Å    :       -0.3034498      -0.3305145       0.0604007
  moments of inertia/u·Å² :        0.4588889E+03   0.1138970E+04   0.1594898E+04
rotational constants/cm⁻¹ :        0.3673576E-01   0.1480077E-01   0.1056973E-01

 * 26 selected distances

     #   Z        #   Z                                     value/Å
     1   6 C      2   6 C                                 1.3859704
     2   6 C      3   6 C                                 1.3953880
     3   6 C      4   6 C                                 1.3993673
     4   6 C      5   6 C                                 1.4071609
     1   6 C      6   6 C                                 1.3792770
     5   6 C      6   6 C                                 1.3912332
     5   6 C      7   6 C                                 1.4406710
     7   6 C      8   6 C                                 1.4029791
     4   6 C      9  16 S                                 1.7520474 (max)
     8   6 C      9  16 S                                 1.7468869
     8   6 C     10   6 C                                 1.3851287
    10   6 C     11   6 C                                 1.3811781
    11   6 C     12   6 C                                 1.3918966
     7   6 C     13   6 C                                 1.3921164
    12   6 C     13   6 C                                 1.3796571
    14   6 C     15   6 C                                 1.3266229
     1   6 C     16   1 H                                 1.0797630
     2   6 C     17   1 H                                 1.0805615
     6   6 C     18   1 H                                 1.0790651
    10   6 C     19   1 H                                 1.0790359
    11   6 C     20   1 H                                 1.0796505
    12   6 C     21   1 H                                 1.0798297
    13   6 C     22   1 H                                 1.0795749
    14   6 C     23   1 H                                 1.0836148
    15   6 C     24   1 H                                 1.0752199 (min)
    15   6 C     25   1 H                                 1.0769634

 * 3 distinct bonds (by element types)

   Z      Z             #   av. dist./Å        max./Å        min./Å
   1 H    6 C          10     1.0793279     1.0836148     1.0752199
   6 C    6 C          14     1.3899033     1.4406710     1.3266229
   6 C   16 S           2     1.7494671     1.7520474     1.7468869


optimized geometry written to: xtbopt.xyz


           -------------------------------------------------
          | TOTAL ENERGY              -38.303173290367 Eh   |
          | GRADIENT NORM               0.000644718475 Eh/α |
          | HOMO-LUMO GAP               2.905352496818 eV   |
           -------------------------------------------------

------------------------------------------------------------------------
 * finished run on 2021/05/19 at 11:00:02.468     
------------------------------------------------------------------------
 total:
 * wall-time:     0 d,  0 h,  0 min,  0.888 sec
 *  cpu-time:     0 d,  0 h,  0 min,  0.885 sec
 * ratio c/w:     0.997 speedup
 SCF:
 * wall-time:     0 d,  0 h,  0 min,  0.046 sec
 *  cpu-time:     0 d,  0 h,  0 min,  0.046 sec
 * ratio c/w:     0.997 speedup
 ANC optimizer:
 * wall-time:     0 d,  0 h,  0 min,  0.819 sec
 *  cpu-time:     0 d,  0 h,  0 min,  0.817 sec
 * ratio c/w:     0.998 speedup

