      -----------------------------------------------------------      
     |                   =====================                   |     
     |                           x T B                           |     
     |                   =====================                   |     
     |                         S. Grimme                         |     
     |          Mulliken Center for Theoretical Chemistry        |     
     |                    University of Bonn                     |     
     |                Version 6.2 RC2 (SAW190805)                |     
      -----------------------------------------------------------      

   This program is distributed in the hope that it will be useful,
   but WITHOUT ANY WARRANTY; without even the implied warranty of
   MERCHANTABILITY or FITNESS FOR A PARTICULAR PURPOSE.
   
   FOR NON-COMMERCIAL, ACADEMIA USE ONLY.
   
   Cite this work as:
   * S. Grimme, C. Bannwarth, P. Shushkov, J. Chem. Theory Comput., 2017,
     13, 1989-2009. DOI: 10.1021/acs.jctc.7b00118
   * C. Bannwarth, S. Ehlert and S. Grimme., J. Chem. Theory Comput., 2019,
     15, 1652-1671. DOI: 10.1021/acs.jctc.8b01176
   * P. Pracht, E. Caldeweyher, S. Ehlert, S. Grimme, ChemRxiv, 2019, preprint.
     DOI: 10.26434/chemrxiv.8326202.v1
   
   for DFT-D4:
   * E. Caldeweyher, C. Bannwarth and S. Grimme, J. Chem. Phys., 2017,
     147, 034112. DOI: 10.1063/1.4993215
   * E. Caldeweyher, S. Ehlert, A. Hansen, H. Neugebauer, S. Spicher,
     C. Bannwarth and S. Grimme, J. Chem. Phys., 2019, 150, 154122.
     DOI: 10.1063/1.5090222
   
   for sTDA-xTB:
   * S. Grimme and C. Bannwarth, J. Chem. Phys., 2016, 145, 054103.
     DOI: 10.1063/1.4959605
   
   in the mass-spec context:
   * V. Asgeirsson, C. Bauer and S. Grimme, Chem. Sci., 2017, 8, 4879.
     DOI: 10.1039/c7sc00601b
   
   for metadynamics refer to:
   * S. Grimme, J. Chem. Theory Comput., 2019, 155, 2847-2862
     DOI: 10.1021/acs.jctc.9b00143
   
   with help from (in alphabetical order)
   C. Bannwarth, F. Bohle, G. Brandenburg, E. Caldeweyher, M. Checinski,
   S. Dohm, S. Ehlert, S. Ehrlich, F. März, H. Neugebauer, J. Pisarek,
   P. Pracht, P. Shushkov, and S. Spicher.
   
 * started run on 2021/05/19 at 11:00:02.486     

           -------------------------------------------------
          |                Calculation Setup                |
           -------------------------------------------------

          program call               : /ihome/ghutchison/geoffh/xtb/xtb 669.xyz -opt
          hostname                   : smp-n144
          coordinate file            : 669.xyz
          omp threads                :                     1
          number of atoms            :                    30
          number of electrons        :                    76
          charge                     :                     0
          spin                       :                   0.0
          first test random number   :      0.21165208098964


########################################################################
# WARNING! Please study the warnings concerning your input carefully
#  - the use of '-opt' is discouraged, please use '--opt' next time
########################################################################

           ------------------------------------------------- 
          |                 G F N 2 - x T B                 |
          | Geometry, Frequencies, Noncovalent interactions |
          |            JCTC 2019 parametrisation            |
           ------------------------------------------------- 
             KAB for C  - Si     :                1.0500
             KAB for H  - Pd     :                0.9500
             k(s)              :                1.8500
             k(p)              :                2.2300
             k(d)              :                2.2300
             k(f)              :                2.0000
             kEN (H0ij)        :               -2.0000
             D4 a1             :                0.5200
             D4 a2             :                5.0000
             D4 s6             :                1.0000
             D4 s8             :                2.7000
             D4 s9             :                5.0000
             alphaj            :                2.0000

  Z AO/shell   Hii/eV     exponent
  1     Wed Apr 25 08:07:45 CEST 2018   EN: 2.200 GM2: 0.406  GM3: 0.0800  RAES: 1.40
     1s    -10.707211    1.230000
  6     Wed Apr 25 08:07:45 CEST 2018   EN: 2.550 GM2: 0.538  GM3: 0.1500  RAES: 3.00
     2s    -13.970922    2.096432
     2p    -10.063292    1.800000
  8     Wed Apr 25 08:07:45 CEST 2018   EN: 3.440 GM2: 0.452  GM3:-0.0517  RAES: 1.80
     2s    -20.229985    2.439742
     2p    -15.503117    2.137023

           ------------------------------------------------- 
          |        Self-Consistent Charge Iterations        |
           ------------------------------------------------- 

          ...................................................
          :                      SETUP                      :
          :.................................................:
          :  # basis functions                  72          :
          :  # atomic orbitals                  72          :
          :  # shells                           44          :
          :  # electrons                        76          :
          :  max. iterations                   250          :
          :  Hamiltonian                  GFN2-xTB          :
          :  restarted?                      false          :
          :  GBSA solvation                  false          :
          :  PC potential                    false          :
          :  electronic temp.          300.0000000     K    :
          :  accuracy                    1.0000000          :
          :  -> integral cutoff          0.2500000E+02      :
          :  -> integral neglect         0.1000000E-07      :
          :  -> SCF convergence          0.1000000E-05 Eh   :
          :  -> wf. convergence          0.1000000E-03 e    :
          :  Broyden damping             0.4000000          :
          ...................................................

 iter      E             dE          RMSdq      gap      omega  full diag
   1    -42.4654391 -0.424654E+02  0.425E+00    3.12       0.0  T
   2    -42.5276225 -0.621834E-01  0.239E+00    3.21       1.0  T
   3    -42.5270392  0.583328E-03  0.862E-01    3.03       1.0  T
   4    -42.5298313 -0.279213E-02  0.266E-01    3.24       1.0  T
   5    -42.5310527 -0.122145E-02  0.773E-02    3.18       1.0  T
   6    -42.5310740 -0.212289E-04  0.443E-02    3.19       1.0  T
   7    -42.5310908 -0.168754E-04  0.208E-02    3.18       1.0  T
   8    -42.5310961 -0.530152E-05  0.768E-03    3.18       2.4  T
   9    -42.5310971 -0.913244E-06  0.324E-03    3.18       5.6  T
  10    -42.5310972 -0.177621E-06  0.106E-03    3.18      17.3  T
  11    -42.5310972 -0.364436E-08  0.475E-04    3.18      38.4  T
  12    -42.5310972 -0.102805E-08  0.236E-04    3.18      77.3  T

   *** convergence criteria satisfied after 12 iterations ***

         #    Occupation            Energy/Eh            Energy/eV
      -------------------------------------------------------------
         1        2.0000           -0.7038790             -19.1535
       ...           ...                  ...                  ...
        32        2.0000           -0.4417168             -12.0197
        33        2.0000           -0.4365820             -11.8800
        34        2.0000           -0.4168149             -11.3421
        35        2.0000           -0.4130577             -11.2399
        36        2.0000           -0.4080201             -11.1028
        37        2.0000           -0.3838926             -10.4463
        38        2.0000           -0.3563652              -9.6972 (HOMO)
        39                         -0.2393829              -6.5139 (LUMO)
        40                         -0.2059139              -5.6032
        41                         -0.1753879              -4.7725
        42                         -0.0825577              -2.2465
        43                          0.0101001               0.2748
       ...                                ...                  ...
        72                          0.6431228              17.5003
      -------------------------------------------------------------
                  HL-Gap            0.1169823 Eh            3.1833 eV
             Fermi-level           -0.2978740 Eh           -8.1056 eV

 SCC (total)                   0 d,  0 h,  0 min,  0.041 sec
 SCC setup                      ...        0 min,  0.000 sec (  0.815%)
 Dispersion                     ...        0 min,  0.000 sec (  1.078%)
 integral evaluation            ...        0 min,  0.009 sec ( 22.870%)
 zeroth order Hamiltonian       ...        0 min,  0.000 sec (  0.446%)
 iterations                     ...        0 min,  0.015 sec ( 37.265%)
 molecular gradient             ...        0 min,  0.015 sec ( 36.385%)
 printout                       ...        0 min,  0.000 sec (  1.010%)

         :::::::::::::::::::::::::::::::::::::::::::::::::::::
         ::                     SUMMARY                     ::
         :::::::::::::::::::::::::::::::::::::::::::::::::::::
         :: total energy             -41.949041722625 Eh    ::
         :: gradient norm              0.043395973366 Eh/a0 ::
         :: HOMO-LUMO gap              3.183250134989 eV    ::
         ::.................................................::
         :: SCC energy               -42.531097235077 Eh    ::
         :: -> isotropic ES            0.033409282806 Eh    ::
         :: -> anisotropic ES          0.007905916053 Eh    ::
         :: -> anisotropic XC          0.017404309242 Eh    ::
         :: -> dispersion             -0.024630791331 Eh    ::
         :: repulsion energy           0.582070385954 Eh    ::
         :: add. restraining           0.000000000000 Eh    ::
         :::::::::::::::::::::::::::::::::::::::::::::::::::::

      ----------------------------------------------------------- 
     |                   =====================                   |
     |                        A N C O P T                        |
     |                   =====================                   |
     |               Approximate Normal Coordinate               |
     |                Rational Function Optimizer                |
      ----------------------------------------------------------- 

          ...................................................
          :                      SETUP                      :
          :.................................................:
          :   optimization level            normal          :
          :   max. optcycles                   200          :
          :   ANC micro-cycles                  20          :
          :   degrees of freedom                84          :
          :.................................................:
          :   RF solver                   davidson          :
          :   input Hessian                  false          :
          :   write xtbopt.log                true          :
          :   linear?                        false          :
          :   energy convergence         0.5000000E-05 Eh   :
          :   grad. convergence          0.1000000E-02 Eh/α :
          :   maximium RF displ.         2.0000000          :
          :   Hlow (freq-cutoff)         0.5000000E-02      :
          :   Hmax (freq-cutoff)         5.0000000          :
          :   S6 in model hess.         20.0000000          :
          ...................................................

generating ANC from model Hessian ...
Using Lindh-Hessian (1995)
 Shifting diagonal of input Hessian by   4.421823212225762E-003
 Lowest  eigenvalues of input Hessian
   -0.000000   -0.000000    0.000000    0.000000    0.000000    0.000000
    0.005000    0.005920    0.006288    0.006588    0.006773    0.007503
    0.008990    0.009850    0.012564    0.013889    0.015345    0.017884
 Highest eigenvalues
    1.567149    1.815548    1.873198    1.889793    1.981085    2.084884
 

........................................................................
.............................. CYCLE    1 ..............................
........................................................................
   1    -42.5310972 -0.425311E+02  0.606E-05    3.18       0.0  T
   2    -42.5310972 -0.671463E-11  0.363E-05    3.18     503.2  T
   3    -42.5310972  0.252243E-11  0.215E-05    3.18     848.3  T
     SCC iter.                  ...        0 min,  0.005 sec
     gradient                   ...        0 min,  0.015 sec
 * total energy  :   -41.9490417 Eh     change        0.1372121E-07 Eh
   gradient norm :     0.0433978 Eh/α   predicted     0.0000000E+00 (-100.00%)
   displ. norm   :     0.2310805 α      lambda       -0.4428911E-02
   maximum displ.:     0.0951446 α      in ANC's #8, #10, #19, ...

........................................................................
.............................. CYCLE    2 ..............................
........................................................................
   1    -42.5577426 -0.425577E+02  0.128E-01    3.22       0.0  T
   2    -42.5577465 -0.397333E-05  0.761E-02    3.22       1.0  T
   3    -42.5577433  0.323955E-05  0.124E-02    3.22       1.5  T
   4    -42.5577475 -0.422387E-05  0.375E-03    3.22       4.9  T
   5    -42.5577477 -0.187942E-06  0.191E-03    3.22       9.5  T
     SCC iter.                  ...        0 min,  0.006 sec
     gradient                   ...        0 min,  0.014 sec
 * total energy  :   -41.9518691 Eh     change       -0.2827409E-02 Eh
   gradient norm :     0.0144050 Eh/α   predicted    -0.2332705E-02 ( -17.50%)
   displ. norm   :     0.2229216 α      lambda       -0.9200519E-03
   maximum displ.:     0.1429282 α      in ANC's #8, #10, #6, ...

........................................................................
.............................. CYCLE    3 ..............................
........................................................................
   1    -42.5662909 -0.425663E+02  0.121E-01    3.22       0.0  T
   2    -42.5662951 -0.417972E-05  0.724E-02    3.22       1.0  T
   3    -42.5662926  0.253409E-05  0.110E-02    3.22       1.7  T
   4    -42.5662958 -0.324588E-05  0.424E-03    3.22       4.3  T
   5    -42.5662962 -0.356815E-06  0.196E-03    3.22       9.3  T
   6    -42.5662962 -0.259371E-07  0.105E-03    3.22      17.5  T
     SCC iter.                  ...        0 min,  0.008 sec
     gradient                   ...        0 min,  0.014 sec
 * total energy  :   -41.9524308 Eh     change       -0.5617083E-03 Eh
   gradient norm :     0.0057777 Eh/α   predicted    -0.4828904E-03 ( -14.03%)
   displ. norm   :     0.2314869 α      lambda       -0.4821314E-03
   maximum displ.:     0.1552015 α      in ANC's #8, #7, #10, ...

........................................................................
.............................. CYCLE    4 ..............................
........................................................................
   1    -42.5673879 -0.425674E+02  0.137E-01    3.19       0.0  T
   2    -42.5673933 -0.545236E-05  0.825E-02    3.20       1.0  T
   3    -42.5673746  0.186974E-04  0.280E-02    3.20       1.0  T
   4    -42.5673960 -0.213896E-04  0.468E-03    3.20       3.9  T
   5    -42.5673963 -0.238849E-06  0.237E-03    3.20       7.7  T
   6    -42.5673963 -0.391043E-07  0.115E-03    3.20      15.9  T
     SCC iter.                  ...        0 min,  0.008 sec
     gradient                   ...        0 min,  0.014 sec
 * total energy  :   -41.9527272 Eh     change       -0.2963353E-03 Eh
   gradient norm :     0.0070760 Eh/α   predicted    -0.2540161E-03 ( -14.28%)
   displ. norm   :     0.2514869 α      lambda       -0.3645157E-03
   maximum displ.:     0.1619289 α      in ANC's #8, #7, #1, ...

........................................................................
.............................. CYCLE    5 ..............................
........................................................................
   1    -42.5647066 -0.425647E+02  0.144E-01    3.17       0.0  T
   2    -42.5647115 -0.487186E-05  0.873E-02    3.17       1.0  T
   3    -42.5647019  0.954612E-05  0.193E-02    3.17       1.0  T
   4    -42.5647137 -0.117362E-04  0.465E-03    3.17       3.9  T
   5    -42.5647138 -0.168670E-06  0.277E-03    3.17       6.6  T
   6    -42.5647139 -0.663202E-07  0.124E-03    3.17      14.7  T
     SCC iter.                  ...        0 min,  0.008 sec
     gradient                   ...        0 min,  0.014 sec
 * total energy  :   -41.9530195 Eh     change       -0.2923382E-03 Eh
   gradient norm :     0.0063618 Eh/α   predicted    -0.1937984E-03 ( -33.71%)
   displ. norm   :     0.3221926 α      lambda       -0.3873594E-03
   maximum displ.:     0.1992031 α      in ANC's #8, #7, #1, ...

........................................................................
.............................. CYCLE    6 ..............................
........................................................................
   1    -42.5613591 -0.425614E+02  0.191E-01    3.14       0.0  T
   2    -42.5613657 -0.661251E-05  0.116E-01    3.15       1.0  T
   3    -42.5613610  0.471577E-05  0.169E-02    3.15       1.1  T
   4    -42.5613690 -0.803517E-05  0.559E-03    3.15       3.3  T
   5    -42.5613692 -0.112640E-06  0.332E-03    3.15       5.5  T
   6    -42.5613692 -0.824864E-07  0.140E-03    3.15      13.0  T
   7    -42.5613693 -0.288488E-07  0.236E-04    3.15      77.3  T
     SCC iter.                  ...        0 min,  0.009 sec
     gradient                   ...        0 min,  0.014 sec
 * total energy  :   -41.9533095 Eh     change       -0.2900458E-03 Eh
   gradient norm :     0.0053136 Eh/α   predicted    -0.2137863E-03 ( -26.29%)
   displ. norm   :     0.3192698 α      lambda       -0.2748316E-03
   maximum displ.:     0.1884754 α      in ANC's #8, #7, #1, ...

........................................................................
.............................. CYCLE    7 ..............................
........................................................................
   1    -42.5599269 -0.425599E+02  0.192E-01    3.13       0.0  T
   2    -42.5599327 -0.578166E-05  0.116E-01    3.13       1.0  T
   3    -42.5599334 -0.675260E-06  0.108E-02    3.13       1.7  T
   4    -42.5599357 -0.233423E-05  0.526E-03    3.13       3.5  T
   5    -42.5599358 -0.140320E-06  0.232E-03    3.13       7.9  T
   6    -42.5599359 -0.244219E-07  0.794E-04    3.13      23.0  T
     SCC iter.                  ...        0 min,  0.008 sec
     gradient                   ...        0 min,  0.014 sec
 * total energy  :   -41.9535093 Eh     change       -0.1997229E-03 Eh
   gradient norm :     0.0058236 Eh/α   predicted    -0.1514285E-03 ( -24.18%)
   displ. norm   :     0.2749456 α      lambda       -0.2153176E-03
   maximum displ.:     0.1593013 α      in ANC's #7, #8, #1, ...

........................................................................
.............................. CYCLE    8 ..............................
........................................................................
   1    -42.5612645 -0.425613E+02  0.164E-01    3.12       0.0  T
   2    -42.5612685 -0.395161E-05  0.992E-02    3.12       1.0  T
   3    -42.5612697 -0.117906E-05  0.799E-03    3.12       2.3  T
   4    -42.5612706 -0.911384E-06  0.438E-03    3.12       4.2  T
   5    -42.5612707 -0.906227E-07  0.183E-03    3.12      10.0  T
   6    -42.5612707 -0.214367E-07  0.407E-04    3.12      44.8  T
     SCC iter.                  ...        0 min,  0.007 sec
     gradient                   ...        0 min,  0.014 sec
 * total energy  :   -41.9536692 Eh     change       -0.1598887E-03 Eh
   gradient norm :     0.0053612 Eh/α   predicted    -0.1157977E-03 ( -27.58%)
   displ. norm   :     0.2531271 α      lambda       -0.1707451E-03
   maximum displ.:     0.1386442 α      in ANC's #7, #8, #1, ...

........................................................................
.............................. CYCLE    9 ..............................
........................................................................
   1    -42.5636464 -0.425636E+02  0.143E-01    3.12       0.0  T
   2    -42.5636488 -0.240158E-05  0.861E-02    3.12       1.0  T
   3    -42.5636494 -0.620587E-06  0.698E-03    3.12       2.6  T
   4    -42.5636502 -0.784323E-06  0.377E-03    3.12       4.8  T
   5    -42.5636503 -0.437464E-07  0.145E-03    3.12      12.6  T
   6    -42.5636503 -0.313576E-07  0.520E-04    3.12      35.1  T
     SCC iter.                  ...        0 min,  0.008 sec
     gradient                   ...        0 min,  0.014 sec
 * total energy  :   -41.9537926 Eh     change       -0.1234441E-03 Eh
   gradient norm :     0.0037666 Eh/α   predicted    -0.9084353E-04 ( -26.41%)
   displ. norm   :     0.2165941 α      lambda       -0.9675274E-04
   maximum displ.:     0.1115365 α      in ANC's #7, #1, #8, ...

........................................................................
.............................. CYCLE   10 ..............................
........................................................................
   1    -42.5647467 -0.425647E+02  0.115E-01    3.12       0.0  T
   2    -42.5647482 -0.143783E-05  0.693E-02    3.12       1.0  T
   3    -42.5647468  0.135026E-05  0.898E-03    3.12       2.0  T
   4    -42.5647491 -0.223675E-05  0.306E-03    3.12       6.0  T
   5    -42.5647491 -0.112248E-07  0.157E-03    3.12      11.6  T
   6    -42.5647491 -0.255289E-07  0.487E-04    3.12      37.5  T
   7    -42.5647491 -0.354388E-08  0.146E-04    3.12     125.0  T
     SCC iter.                  ...        0 min,  0.008 sec
     gradient                   ...        0 min,  0.015 sec
 * total energy  :   -41.9538604 Eh     change       -0.6779522E-04 Eh
   gradient norm :     0.0025130 Eh/α   predicted    -0.5065012E-04 ( -25.29%)
   displ. norm   :     0.1430132 α      lambda       -0.4831754E-04
   maximum displ.:     0.0805137 α      in ANC's #1, #6, #7, ...

........................................................................
.............................. CYCLE   11 ..............................
........................................................................
   1    -42.5657971 -0.425658E+02  0.647E-02    3.12       0.0  T
   2    -42.5657977 -0.614986E-06  0.386E-02    3.12       1.0  T
   3    -42.5657972  0.583375E-06  0.542E-03    3.12       3.4  T
   4    -42.5657980 -0.811076E-06  0.173E-03    3.12      10.6  T
   5    -42.5657980 -0.263120E-07  0.998E-04    3.12      18.3  T
   6    -42.5657980 -0.733650E-08  0.412E-04    3.12      44.3  T
     SCC iter.                  ...        0 min,  0.008 sec
     gradient                   ...        0 min,  0.015 sec
 * total energy  :   -41.9538920 Eh     change       -0.3161243E-04 Eh
   gradient norm :     0.0017436 Eh/α   predicted    -0.2466493E-04 ( -21.98%)
   displ. norm   :     0.1847258 α      lambda       -0.2771815E-04
   maximum displ.:     0.1206771 α      in ANC's #1, #8, #7, ...

........................................................................
.............................. CYCLE   12 ..............................
........................................................................
   1    -42.5645478 -0.425645E+02  0.853E-02    3.11       0.0  T
   2    -42.5645486 -0.774020E-06  0.510E-02    3.11       1.0  T
   3    -42.5645473  0.132927E-05  0.783E-03    3.11       2.3  T
   4    -42.5645490 -0.171465E-05  0.202E-03    3.11       9.0  T
   5    -42.5645490 -0.205042E-07  0.114E-03    3.11      16.0  T
   6    -42.5645490 -0.744541E-08  0.493E-04    3.11      37.1  T
   7    -42.5645490 -0.236860E-08  0.127E-04    3.11     144.1  T
     SCC iter.                  ...        0 min,  0.009 sec
     gradient                   ...        0 min,  0.015 sec
 * total energy  :   -41.9539128 Eh     change       -0.2079098E-04 Eh
   gradient norm :     0.0020165 Eh/α   predicted    -0.1409226E-04 ( -32.22%)
   displ. norm   :     0.0585354 α      lambda       -0.2574814E-04
   maximum displ.:     0.0318507 α      in ANC's #1, #7, #12, ...

........................................................................
.............................. CYCLE   13 ..............................
........................................................................
   1    -42.5658132 -0.425658E+02  0.315E-02    3.11       0.0  T
   2    -42.5658134 -0.230385E-06  0.191E-02    3.11       1.0  T
   3    -42.5658133  0.141857E-06  0.324E-03    3.11       5.6  T
   4    -42.5658135 -0.236681E-06  0.113E-03    3.11      16.1  T
   5    -42.5658135 -0.131133E-07  0.621E-04    3.11      29.4  T
   6    -42.5658135 -0.179870E-08  0.222E-04    3.11      82.2  T
     SCC iter.                  ...        0 min,  0.008 sec
     gradient                   ...        0 min,  0.015 sec
 * total energy  :   -41.9539308 Eh     change       -0.1803552E-04 Eh
   gradient norm :     0.0022509 Eh/α   predicted    -0.1291923E-04 ( -28.37%)
   displ. norm   :     0.1097274 α      lambda       -0.4537320E-04
   maximum displ.:     0.0769942 α      in ANC's #1, #12, #7, ...

........................................................................
.............................. CYCLE   14 ..............................
........................................................................
   1    -42.5653738 -0.425654E+02  0.509E-02    3.11       0.0  T
   2    -42.5653742 -0.456086E-06  0.307E-02    3.11       1.0  T
   3    -42.5653729  0.130634E-05  0.726E-03    3.11       2.5  T
   4    -42.5653745 -0.161492E-05  0.156E-03    3.11      11.7  T
   5    -42.5653745 -0.508826E-08  0.983E-04    3.11      18.6  T
   6    -42.5653745 -0.102719E-07  0.316E-04    3.11      57.8  T
     SCC iter.                  ...        0 min,  0.008 sec
     gradient                   ...        0 min,  0.015 sec
 * total energy  :   -41.9539598 Eh     change       -0.2899511E-04 Eh
   gradient norm :     0.0030214 Eh/α   predicted    -0.2296208E-04 ( -20.81%)
   displ. norm   :     0.1018219 α      lambda       -0.3262355E-04
   maximum displ.:     0.0632162 α      in ANC's #1, #7, #3, ...

........................................................................
.............................. CYCLE   15 ..............................
........................................................................
   1    -42.5653501 -0.425654E+02  0.514E-02    3.11       0.0  T
   2    -42.5653506 -0.502223E-06  0.311E-02    3.11       1.0  T
   3    -42.5653497  0.924902E-06  0.680E-03    3.11       2.7  T
   4    -42.5653510 -0.124835E-05  0.163E-03    3.11      11.2  T
   5    -42.5653510 -0.310168E-08  0.107E-03    3.11      17.1  T
   6    -42.5653510 -0.139454E-07  0.260E-04    3.11      70.2  T
   7    -42.5653510 -0.414772E-09  0.791E-05    3.11     230.9  T
     SCC iter.                  ...        0 min,  0.009 sec
     gradient                   ...        0 min,  0.015 sec
 * total energy  :   -41.9539849 Eh     change       -0.2509292E-04 Eh
   gradient norm :     0.0018683 Eh/α   predicted    -0.1648418E-04 ( -34.31%)
   displ. norm   :     0.1347651 α      lambda       -0.2558468E-04
   maximum displ.:     0.0986513 α      in ANC's #1, #3, #7, ...

........................................................................
.............................. CYCLE   16 ..............................
........................................................................
   1    -42.5646010 -0.425646E+02  0.591E-02    3.11       0.0  T
   2    -42.5646017 -0.687763E-06  0.357E-02    3.11       1.0  T
   3    -42.5646010  0.739064E-06  0.664E-03    3.11       2.7  T
   4    -42.5646020 -0.109161E-05  0.169E-03    3.11      10.8  T
   5    -42.5646021 -0.538375E-08  0.982E-04    3.11      18.6  T
   6    -42.5646021 -0.819787E-08  0.432E-04    3.11      42.2  T
     SCC iter.                  ...        0 min,  0.008 sec
     gradient                   ...        0 min,  0.015 sec
 * total energy  :   -41.9540101 Eh     change       -0.2516759E-04 Eh
   gradient norm :     0.0016989 Eh/α   predicted    -0.1289712E-04 ( -48.76%)
   displ. norm   :     0.0793127 α      lambda       -0.1385965E-04
   maximum displ.:     0.0671424 α      in ANC's #1, #3, #8, ...

........................................................................
.............................. CYCLE   17 ..............................
........................................................................
   1    -42.5646266 -0.425646E+02  0.291E-02    3.11       0.0  T
   2    -42.5646267 -0.106307E-06  0.174E-02    3.11       1.1  T
   3    -42.5646267  0.702689E-07  0.227E-03    3.11       8.0  T
   4    -42.5646268 -0.111070E-06  0.711E-04    3.11      25.7  T
   5    -42.5646268 -0.342274E-08  0.368E-04    3.11      49.6  T
     SCC iter.                  ...        0 min,  0.007 sec
     gradient                   ...        0 min,  0.015 sec
 * total energy  :   -41.9540259 Eh     change       -0.1578733E-04 Eh
   gradient norm :     0.0016555 Eh/α   predicted    -0.6953757E-05 ( -55.95%)
   displ. norm   :     0.1313587 α      lambda       -0.2189425E-04
   maximum displ.:     0.1043909 α      in ANC's #1, #3, #8, ...

........................................................................
.............................. CYCLE   18 ..............................
........................................................................
   1    -42.5649667 -0.425650E+02  0.521E-02    3.10       0.0  T
   2    -42.5649670 -0.223987E-06  0.310E-02    3.10       1.0  T
   3    -42.5649666  0.361751E-06  0.397E-03    3.10       4.6  T
   4    -42.5649671 -0.485785E-06  0.113E-03    3.10      16.2  T
   5    -42.5649671 -0.491637E-08  0.648E-04    3.10      28.2  T
   6    -42.5649671 -0.304470E-08  0.236E-04    3.10      77.5  T
     SCC iter.                  ...        0 min,  0.008 sec
     gradient                   ...        0 min,  0.015 sec
 * total energy  :   -41.9540501 Eh     change       -0.2420077E-04 Eh
   gradient norm :     0.0016894 Eh/α   predicted    -0.1103384E-04 ( -54.41%)
   displ. norm   :     0.2534800 α      lambda       -0.3420090E-04
   maximum displ.:     0.2121986 α      in ANC's #1, #3, #2, ...

........................................................................
.............................. CYCLE   19 ..............................
........................................................................
   1    -42.5646280 -0.425646E+02  0.981E-02    3.10       0.0  T
   2    -42.5646288 -0.727118E-06  0.585E-02    3.10       1.0  T
   3    -42.5646285  0.269412E-06  0.532E-03    3.10       3.4  T
   4    -42.5646291 -0.642740E-06  0.201E-03    3.10       9.1  T
   5    -42.5646291 -0.599074E-08  0.945E-04    3.10      19.3  T
   6    -42.5646292 -0.922960E-08  0.397E-04    3.10      46.0  T
     SCC iter.                  ...        0 min,  0.008 sec
     gradient                   ...        0 min,  0.015 sec
 * total energy  :   -41.9540848 Eh     change       -0.3476887E-04 Eh
   gradient norm :     0.0030611 Eh/α   predicted    -0.1759036E-04 ( -49.41%)
   displ. norm   :     0.1406468 α      lambda       -0.3422402E-04
   maximum displ.:     0.1204647 α      in ANC's #1, #3, #2, ...

........................................................................
.............................. CYCLE   20 ..............................
........................................................................
   1    -42.5647356 -0.425647E+02  0.488E-02    3.10       0.0  T
   2    -42.5647358 -0.146752E-06  0.291E-02    3.10       1.0  T
   3    -42.5647358 -0.202231E-07  0.171E-03    3.10      10.7  T
   4    -42.5647358 -0.542135E-07  0.907E-04    3.10      20.1  T
   5    -42.5647359 -0.310792E-08  0.410E-04    3.10      44.5  T
     SCC iter.                  ...        0 min,  0.007 sec
     gradient                   ...        0 min,  0.015 sec
 * total energy  :   -41.9541133 Eh     change       -0.2844071E-04 Eh
   gradient norm :     0.0018706 Eh/α   predicted    -0.1745317E-04 ( -38.63%)
   displ. norm   :     0.2502472 α      lambda       -0.3843795E-04
   maximum displ.:     0.2187107 α      in ANC's #1, #2, #3, ...
 * RMSD in coord.:     0.5248916 α      energy gain  -0.5071566E-02 Eh

generating ANC from model Hessian ...
Using Lindh-Hessian (1995)
 Shifting diagonal of input Hessian by   4.387607864941420E-003
 Lowest  eigenvalues of input Hessian
   -0.000000   -0.000000   -0.000000    0.000000    0.000000    0.000000
    0.005000    0.006035    0.006396    0.006523    0.007038    0.007412
    0.009331    0.010241    0.013342    0.014263    0.015528    0.018600
 Highest eigenvalues
    1.625656    1.870291    1.933621    1.966893    2.045564    2.164235
 

........................................................................
.............................. CYCLE   21 ..............................
........................................................................
   1    -42.5652290 -0.425652E+02  0.895E-02    3.10       0.0  T
   2    -42.5652296 -0.570423E-06  0.533E-02    3.10       1.0  T
   3    -42.5652296  0.539922E-08  0.403E-03    3.10       4.5  T
   4    -42.5652299 -0.294215E-06  0.174E-03    3.10      10.5  T
   5    -42.5652299 -0.290242E-08  0.930E-04    3.10      19.6  T
   6    -42.5652299 -0.953650E-08  0.308E-04    3.10      59.2  T
     SCC iter.                  ...        0 min,  0.008 sec
     gradient                   ...        0 min,  0.015 sec
 * total energy  :   -41.9541560 Eh     change       -0.4266173E-04 Eh
   gradient norm :     0.0017585 Eh/α   predicted     0.0000000E+00 (-100.00%)
   displ. norm   :     0.0519461 α      lambda       -0.1272634E-04
   maximum displ.:     0.0432540 α      in ANC's #1, #4, #5, ...

........................................................................
.............................. CYCLE   22 ..............................
........................................................................
   1    -42.5650631 -0.425651E+02  0.205E-02    3.09       0.0  T
   2    -42.5650632 -0.571081E-07  0.122E-02    3.10       1.5  T
   3    -42.5650630  0.137765E-06  0.242E-03    3.09       7.5  T
   4    -42.5650632 -0.162943E-06  0.372E-04    3.10      49.1  T
   5    -42.5650632 -0.715850E-09  0.230E-04    3.10      79.4  T
     SCC iter.                  ...        0 min,  0.007 sec
     gradient                   ...        0 min,  0.015 sec
 * total energy  :   -41.9541670 Eh     change       -0.1106913E-04 Eh
   gradient norm :     0.0007110 Eh/α   predicted    -0.6378614E-05 ( -42.37%)
   displ. norm   :     0.0339745 α      lambda       -0.6314476E-05
   maximum displ.:     0.0235695 α      in ANC's #1, #5, #4, ...

........................................................................
.............................. CYCLE   23 ..............................
........................................................................
   1    -42.5650543 -0.425651E+02  0.140E-02    3.09       0.0  T
   2    -42.5650543 -0.290803E-07  0.826E-03    3.09       2.2  T
   3    -42.5650542  0.934930E-07  0.217E-03    3.09       8.4  T
   4    -42.5650543 -0.108775E-06  0.305E-04    3.09      59.8  T
   5    -42.5650543 -0.102646E-08  0.196E-04    3.09      93.4  T
     SCC iter.                  ...        0 min,  0.007 sec
     gradient                   ...        0 min,  0.015 sec
 * total energy  :   -41.9541722 Eh     change       -0.5153168E-05 Eh
   gradient norm :     0.0010283 Eh/α   predicted    -0.3162077E-05 ( -38.64%)
   displ. norm   :     0.0387730 α      lambda       -0.5038580E-05
   maximum displ.:     0.0278108 α      in ANC's #1, #5, #4, ...

........................................................................
.............................. CYCLE   24 ..............................
........................................................................
   1    -42.5651470 -0.425651E+02  0.150E-02    3.10       0.0  T
   2    -42.5651470 -0.244406E-07  0.891E-03    3.10       2.0  T
   3    -42.5651469  0.287373E-07  0.131E-03    3.10      14.0  T
   4    -42.5651470 -0.416180E-07  0.330E-04    3.10      55.3  T
   5    -42.5651470 -0.121254E-09  0.185E-04    3.10      98.8  T
     SCC iter.                  ...        0 min,  0.007 sec
     gradient                   ...        0 min,  0.015 sec
 * total energy  :   -41.9541777 Eh     change       -0.5496982E-05 Eh
   gradient norm :     0.0006206 Eh/α   predicted    -0.2524397E-05 ( -54.08%)
   displ. norm   :     0.0487973 α      lambda       -0.4494973E-05
   maximum displ.:     0.0356891 α      in ANC's #1, #6, #5, ...

........................................................................
.............................. CYCLE   25 ..............................
........................................................................
   1    -42.5651607 -0.425652E+02  0.199E-02    3.09       0.0  T
   2    -42.5651607 -0.329061E-07  0.119E-02    3.09       1.5  T
   3    -42.5651607  0.363471E-09  0.100E-03    3.09      18.3  T
   4    -42.5651607 -0.191519E-07  0.444E-04    3.09      41.2  T
   5    -42.5651607 -0.481023E-09  0.130E-04    3.09     140.6  T
     SCC iter.                  ...        0 min,  0.007 sec
     gradient                   ...        0 min,  0.015 sec
 * total energy  :   -41.9541829 Eh     change       -0.5278707E-05 Eh
   gradient norm :     0.0006264 Eh/α   predicted    -0.2252724E-05 ( -57.32%)
   displ. norm   :     0.0514542 α      lambda       -0.3897899E-05
   maximum displ.:     0.0383682 α      in ANC's #1, #6, #5, ...

........................................................................
.............................. CYCLE   26 ..............................
........................................................................
   1    -42.5651094 -0.425651E+02  0.224E-02    3.09       0.0  T
   2    -42.5651094 -0.430636E-07  0.134E-02    3.09       1.4  T
   3    -42.5651094  0.101195E-07  0.126E-03    3.09      14.5  T
   4    -42.5651094 -0.349091E-07  0.529E-04    3.09      34.5  T
   5    -42.5651094 -0.314039E-09  0.260E-04    3.09      70.1  T
     SCC iter.                  ...        0 min,  0.007 sec
     gradient                   ...        0 min,  0.015 sec
 * total energy  :   -41.9541879 Eh     change       -0.4905146E-05 Eh
   gradient norm :     0.0005081 Eh/α   predicted    -0.1951695E-05 ( -60.21%)
   displ. norm   :     0.0552715 α      lambda       -0.3916035E-05
   maximum displ.:     0.0411679 α      in ANC's #1, #6, #5, ...

   *** GEOMETRY OPTIMIZATION CONVERGED AFTER 26 ITERATIONS ***

------------------------------------------------------------------------
 total energy gain   :        -0.0051461 Eh       -3.2292 kcal/mol
 total RMSD          :         0.5460057 a0        0.2889 Å
 total power (kW/mol):        -0.5196602 (step)  -15.7550 (real)
------------------------------------------------------------------------

 ANCopt (total)                0 d,  0 h,  0 min,  0.858 sec
 optimizer setup                ...        0 min,  0.000 sec (  0.018%)
 model hessian                  ...        0 min,  0.010 sec (  1.151%)
 ANC generation                 ...        0 min,  0.002 sec (  0.217%)
 coordinate transformation      ...        0 min,  0.001 sec (  0.065%)
 single point calculation       ...        0 min,  0.835 sec ( 97.404%)
 optimization log               ...        0 min,  0.003 sec (  0.339%)
 hessian update                 ...        0 min,  0.000 sec (  0.045%)
 rational function              ...        0 min,  0.005 sec (  0.559%)

================
 final structure:
================
$coord
    2.45754019144584    0.46515659953938   -0.41832956140331      C 
    1.01886271566500    2.64544750525747   -0.72635399808167      C 
    2.04502092416174    4.93877510788631   -1.29340275227104      O 
    4.69819498970537    5.22755066066184   -1.28412787192255      C 
    5.26162019884198    8.02588228909941   -1.63330673680724      C 
   -1.62127739485790    2.50317472404544   -0.41960056461588      C 
   -2.69321471976602    0.17824404516461    0.22588937791222      C 
   -1.24886883582190   -1.98314735523673    0.54179612860525      C 
    1.35387246613417   -1.81516335558457    0.19808905460551      C 
   -2.16344707094260   -4.30892201397342    1.17566350642182      O 
   -4.77802299698052   -4.58340745194112    1.63411298300493      C 
   -5.24838576794410   -7.31458703741491    2.39588348950120      C 
   -3.34701539824040    4.63148654481571   -0.70312775021719      C 
   -2.88599227019987    6.88589388944290   -1.70453847295272      C 
    4.47939283301047    0.52310438012275   -0.66603652953715      H 
    5.54976810121234    4.13145539149371   -2.83009125770709      H 
    5.48700270006727    4.56187054995066    0.51775021561936      H 
    4.50809445983843    8.67762554716798   -3.42877857657375      H 
    7.28981018518365    8.34152677372570   -1.60071913425018      H 
    4.38489618322501    9.10684122665619   -0.12313245741182      H 
   -4.71748780733747    0.10769108073686    0.46520017668311      H 
    2.48841342940845   -3.49149761736542    0.42995213936134      H 
   -5.85888963481711   -4.12191769495635   -0.07981530857947      H 
   -5.37500208919973   -3.30393691608730    3.15838585565645      H 
   -4.66345038071414   -8.57384744042621    0.88395509301499      H 
   -7.24405365392986   -7.60060547570884    2.78163913998053      H 
   -4.16214701614580   -7.76660754522658    4.07890519089735      H 
   -5.24111993378159    4.23900825318493   -0.02519131570847      H 
   -1.06995793471293    7.40039283626416   -2.44666332667214      H 
   -4.35513134621595    8.29233315388608   -1.81593354913227      H 
$end
           -------------------------------------------------
          |                Final Singlepoint                |
           -------------------------------------------------

          ...................................................
          :                      SETUP                      :
          :.................................................:
          :  # basis functions                  72          :
          :  # atomic orbitals                  72          :
          :  # shells                           44          :
          :  # electrons                        76          :
          :  max. iterations                   250          :
          :  Hamiltonian                  GFN2-xTB          :
          :  restarted?                      false          :
          :  GBSA solvation                  false          :
          :  PC potential                    false          :
          :  electronic temp.          300.0000000     K    :
          :  accuracy                    1.0000000          :
          :  -> integral cutoff          0.2500000E+02      :
          :  -> integral neglect         0.1000000E-07      :
          :  -> SCF convergence          0.1000000E-05 Eh   :
          :  -> wf. convergence          0.1000000E-03 e    :
          :  Broyden damping             0.4000000          :
          ...................................................

 iter      E             dE          RMSdq      gap      omega  full diag
   1    -42.5651094 -0.425651E+02  0.111E-04    3.09       0.0  T
   2    -42.5651094 -0.203855E-10  0.445E-05    3.09     409.9  T
   3    -42.5651094 -0.313065E-10  0.545E-05    3.09     335.0  T

   *** convergence criteria satisfied after 3 iterations ***

         #    Occupation            Energy/Eh            Energy/eV
      -------------------------------------------------------------
         1        2.0000           -0.7068573             -19.2346
       ...           ...                  ...                  ...
        32        2.0000           -0.4404249             -11.9846
        33        2.0000           -0.4306822             -11.7195
        34        2.0000           -0.4257712             -11.5858
        35        2.0000           -0.4134617             -11.2509
        36        2.0000           -0.4061650             -11.0523
        37        2.0000           -0.3824205             -10.4062
        38        2.0000           -0.3547087              -9.6521 (HOMO)
        39                         -0.2410237              -6.5586 (LUMO)
        40                         -0.2018406              -5.4924
        41                         -0.1613002              -4.3892
        42                         -0.0685385              -1.8650
        43                          0.0175416               0.4773
       ...                                ...                  ...
        72                          0.6892179              18.7546
      -------------------------------------------------------------
                  HL-Gap            0.1136850 Eh            3.0935 eV
             Fermi-level           -0.2978662 Eh           -8.1054 eV

 SCC (total)                   0 d,  0 h,  0 min,  0.030 sec
 SCC setup                      ...        0 min,  0.000 sec (  0.738%)
 Dispersion                     ...        0 min,  0.000 sec (  0.861%)
 integral evaluation            ...        0 min,  0.009 sec ( 31.284%)
 zeroth order Hamiltonian       ...        0 min,  0.000 sec (  0.573%)
 iterations                     ...        0 min,  0.004 sec ( 14.872%)
 molecular gradient             ...        0 min,  0.015 sec ( 50.107%)
 printout                       ...        0 min,  0.000 sec (  1.323%)

         :::::::::::::::::::::::::::::::::::::::::::::::::::::
         ::                     SUMMARY                     ::
         :::::::::::::::::::::::::::::::::::::::::::::::::::::
         :: total energy             -41.954187846273 Eh    ::
         :: gradient norm              0.000508338103 Eh/a0 ::
         :: HOMO-LUMO gap              3.093526207482 eV    ::
         ::.................................................::
         :: SCC energy               -42.565109439119 Eh    ::
         :: -> isotropic ES            0.032374666143 Eh    ::
         :: -> anisotropic ES          0.006912209659 Eh    ::
         :: -> anisotropic XC          0.015809964338 Eh    ::
         :: -> dispersion             -0.024850604210 Eh    ::
         :: repulsion energy           0.610966134469 Eh    ::
         :: add. restraining           0.000000000000 Eh    ::
         :::::::::::::::::::::::::::::::::::::::::::::::::::::

           -------------------------------------------------
          |                Property Printout                |
           -------------------------------------------------

    * Orbital Energies and Occupations

         #    Occupation            Energy/Eh            Energy/eV
      -------------------------------------------------------------
         1        2.0000           -0.7068573             -19.2346
       ...           ...                  ...                  ...
        26        2.0000           -0.4712874             -12.8244
        27        2.0000           -0.4652312             -12.6596
        28        2.0000           -0.4600155             -12.5177
        29        2.0000           -0.4588794             -12.4867
        30        2.0000           -0.4511205             -12.2756
        31        2.0000           -0.4449394             -12.1074
        32        2.0000           -0.4404249             -11.9846
        33        2.0000           -0.4306822             -11.7195
        34        2.0000           -0.4257712             -11.5858
        35        2.0000           -0.4134617             -11.2509
        36        2.0000           -0.4061650             -11.0523
        37        2.0000           -0.3824205             -10.4062
        38        2.0000           -0.3547087              -9.6521 (HOMO)
        39                         -0.2410237              -6.5586 (LUMO)
        40                         -0.2018406              -5.4924
        41                         -0.1613002              -4.3892
        42                         -0.0685385              -1.8650
        43                          0.0175416               0.4773
        44                          0.0315646               0.8589
        45                          0.0988187               2.6890
        46                          0.1045083               2.8438
        47                          0.1118189               3.0427
        48                          0.1230895               3.3494
        49                          0.1387430               3.7754
       ...                                ...                  ...
        72                          0.6892179              18.7546
      -------------------------------------------------------------
                  HL-Gap            0.1136850 Eh            3.0935 eV
             Fermi-level           -0.2978662 Eh           -8.1054 eV

     #   Z        covCN         q      C6AA      α(0)
     1   6 C      2.916    -0.069    29.718     8.939
     2   6 C      2.860     0.129    25.162     8.222
     3   8 O      1.705    -0.270    18.472     5.803
     4   6 C      3.689     0.087    19.307     6.289
     5   6 C      3.751    -0.112    22.702     6.795
     6   6 C      2.968    -0.008    28.215     8.713
     7   6 C      2.931    -0.075    29.880     8.965
     8   6 C      2.858     0.132    25.114     8.214
     9   6 C      2.921    -0.058    29.444     8.898
    10   8 O      1.706    -0.280    18.653     5.831
    11   6 C      3.691     0.089    19.277     6.283
    12   6 C      3.751    -0.113    22.716     6.797
    13   6 C      2.898    -0.026    28.654     8.777
    14   6 C      2.836    -0.090    30.247     9.013
    15   1 H      0.926     0.036     2.501     2.473
    16   1 H      0.923     0.027     2.623     2.533
    17   1 H      0.923     0.028     2.614     2.528
    18   1 H      0.925     0.055     2.264     2.353
    19   1 H      0.925     0.045     2.382     2.414
    20   1 H      0.925     0.056     2.244     2.343
    21   1 H      0.926     0.036     2.503     2.474
    22   1 H      0.926     0.048     2.340     2.392
    23   1 H      0.923     0.026     2.637     2.540
    24   1 H      0.923     0.027     2.636     2.539
    25   1 H      0.925     0.056     2.248     2.345
    26   1 H      0.925     0.045     2.385     2.415
    27   1 H      0.925     0.056     2.249     2.345
    28   1 H      0.925     0.030     2.588     2.516
    29   1 H      0.926     0.060     2.203     2.321
    30   1 H      0.926     0.032     2.555     2.500

 Mol. C6AA /au·bohr⁶  :       8880.547103
 Mol. C8AA /au·bohr⁸  :     204179.834247
 Mol. α(0) /au        :        146.567578


Wiberg/Mayer (AO) data.
largest (>0.10) Wiberg bond orders for each atom
          total WBO             WBO to atom ...
     1  C   3.988        C    9 1.454    C    2 1.372    H   15 0.965
     2  C   3.935        C    1 1.372    C    6 1.301    O    3 1.059
     3  O   2.231        C    2 1.059    C    4 0.969
     4  C   3.950        C    5 1.014    O    3 0.969    H   17 0.968    H   16 0.968
     5  C   3.993        C    4 1.014    H   18 0.986    H   20 0.986    H   19 0.985
     6  C   3.986        C    7 1.380    C    2 1.301    C   13 1.100
     7  C   3.986        C    8 1.386    C    6 1.380    H   21 0.963
     8  C   3.936        C    7 1.386    C    9 1.346    O   10 1.052
     9  C   3.988        C    1 1.454    C    8 1.346    H   22 0.969
    10  O   2.212        C    8 1.052    C   11 0.970
    11  C   3.951        C   12 1.015    O   10 0.970    H   24 0.969    H   23 0.968
    12  C   3.993        C   11 1.015    H   25 0.986    H   27 0.986    H   26 0.985
    13  C   3.991        C   14 1.892    C    6 1.100    H   28 0.963
    14  C   3.991        C   13 1.892    H   30 0.978    H   29 0.970
    15  H   0.998        C    1 0.965
    16  H   0.999        C    4 0.968
    17  H   0.999        C    4 0.968
    18  H   0.997        C    5 0.986
    19  H   0.997        C    5 0.985
    20  H   0.997        C    5 0.986
    21  H   0.998        C    7 0.963
    22  H   0.997        C    9 0.969
    23  H   0.999        C   11 0.968
    24  H   0.999        C   11 0.969
    25  H   0.997        C   12 0.986
    26  H   0.997        C   12 0.985
    27  H   0.997        C   12 0.986
    28  H   0.999        C   13 0.963
    29  H   0.996        C   14 0.970
    30  H   0.998        C   14 0.978

molecular dipole:
                 x           y           z       tot (Debye)
 q only:        0.088       0.073       0.081
   full:        0.088       0.032       0.099       0.346
molecular quadrupole (traceless):
                xx          xy          yy          xz          yz          zz
 q only:        5.626       9.201       0.554      -3.007      -2.225      -6.180
  q+dip:        9.626       7.488      -2.904      -3.708      -1.843      -6.723
   full:        8.750       8.545      -3.505      -3.310      -1.153      -5.245

           -------------------------------------------------
          |                Geometry Summary                 |
           -------------------------------------------------

      molecular mass/u    :      192.2572000
   center of mass at/Å    :       -0.2612933       0.5761547      -0.0697306
  moments of inertia/u·Å² :        0.3267516E+03   0.1553987E+04   0.1862618E+04
rotational constants/cm⁻¹ :        0.5159158E-01   0.1084799E-01   0.9050504E-02

 * 29 selected distances

     #   Z        #   Z                                     value/Å
     1   6 C      2   6 C                                 1.3918811
     2   6 C      3   8 O                                 1.3629676
     3   8 O      4   6 C                                 1.4122997
     4   6 C      5   6 C                                 1.5217903 (max)
     2   6 C      6   6 C                                 1.4085143
     6   6 C      7   6 C                                 1.3971692
     7   6 C      8   6 C                                 1.3857520
     1   6 C      9   6 C                                 1.3797137
     8   6 C      9   6 C                                 1.3921099
     8   6 C     10   8 O                                 1.3643611
    10   8 O     11   6 C                                 1.4121723
    11   6 C     12   6 C                                 1.5209476
    13   6 C     14   6 C                                 1.3279838
     1   6 C     15   1 H                                 1.0783543
     4   6 C     16   1 H                                 1.0994419
     4   6 C     17   1 H                                 1.0988697
     5   6 C     18   1 H                                 1.0865917
     5   6 C     19   1 H                                 1.0863286
     5   6 C     20   1 H                                 1.0867791
     7   6 C     21   1 H                                 1.0793048
     9   6 C     22   1 H                                 1.0781511
    11   6 C     23   1 H                                 1.0997210
    11   6 C     24   1 H                                 1.0994715
    12   6 C     25   1 H                                 1.0862726
    12   6 C     26   1 H                                 1.0862070
    12   6 C     27   1 H                                 1.0866574
    13   6 C     28   1 H                                 1.0846545
    14   6 C     29   1 H                                 1.0732570 (min)
    14   6 C     30   1 H                                 1.0778666

 * 3 distinct bonds (by element types)

   Z      Z             #   av. dist./Å        max./Å        min./Å
   1 H    6 C          16     1.0867456     1.0997210     1.0732570
   6 C    6 C           9     1.4139847     1.5217903     1.3279838
   6 C    8 O           4     1.3879502     1.4122997     1.3629676


optimized geometry written to: xtbopt.xyz


           -------------------------------------------------
          | TOTAL ENERGY              -41.954187846273 Eh   |
          | GRADIENT NORM               0.000508338103 Eh/α |
          | HOMO-LUMO GAP               3.093526207482 eV   |
           -------------------------------------------------

------------------------------------------------------------------------
 * finished run on 2021/05/19 at 11:00:03.438     
------------------------------------------------------------------------
 total:
 * wall-time:     0 d,  0 h,  0 min,  0.952 sec
 *  cpu-time:     0 d,  0 h,  0 min,  0.949 sec
 * ratio c/w:     0.997 speedup
 SCF:
 * wall-time:     0 d,  0 h,  0 min,  0.042 sec
 *  cpu-time:     0 d,  0 h,  0 min,  0.042 sec
 * ratio c/w:     0.998 speedup
 ANC optimizer:
 * wall-time:     0 d,  0 h,  0 min,  0.888 sec
 *  cpu-time:     0 d,  0 h,  0 min,  0.886 sec
 * ratio c/w:     0.998 speedup

