      -----------------------------------------------------------      
     |                   =====================                   |     
     |                           x T B                           |     
     |                   =====================                   |     
     |                         S. Grimme                         |     
     |          Mulliken Center for Theoretical Chemistry        |     
     |                    University of Bonn                     |     
     |                Version 6.2 RC2 (SAW190805)                |     
      -----------------------------------------------------------      

   This program is distributed in the hope that it will be useful,
   but WITHOUT ANY WARRANTY; without even the implied warranty of
   MERCHANTABILITY or FITNESS FOR A PARTICULAR PURPOSE.
   
   FOR NON-COMMERCIAL, ACADEMIA USE ONLY.
   
   Cite this work as:
   * S. Grimme, C. Bannwarth, P. Shushkov, J. Chem. Theory Comput., 2017,
     13, 1989-2009. DOI: 10.1021/acs.jctc.7b00118
   * C. Bannwarth, S. Ehlert and S. Grimme., J. Chem. Theory Comput., 2019,
     15, 1652-1671. DOI: 10.1021/acs.jctc.8b01176
   * P. Pracht, E. Caldeweyher, S. Ehlert, S. Grimme, ChemRxiv, 2019, preprint.
     DOI: 10.26434/chemrxiv.8326202.v1
   
   for DFT-D4:
   * E. Caldeweyher, C. Bannwarth and S. Grimme, J. Chem. Phys., 2017,
     147, 034112. DOI: 10.1063/1.4993215
   * E. Caldeweyher, S. Ehlert, A. Hansen, H. Neugebauer, S. Spicher,
     C. Bannwarth and S. Grimme, J. Chem. Phys., 2019, 150, 154122.
     DOI: 10.1063/1.5090222
   
   for sTDA-xTB:
   * S. Grimme and C. Bannwarth, J. Chem. Phys., 2016, 145, 054103.
     DOI: 10.1063/1.4959605
   
   in the mass-spec context:
   * V. Asgeirsson, C. Bauer and S. Grimme, Chem. Sci., 2017, 8, 4879.
     DOI: 10.1039/c7sc00601b
   
   for metadynamics refer to:
   * S. Grimme, J. Chem. Theory Comput., 2019, 155, 2847-2862
     DOI: 10.1021/acs.jctc.9b00143
   
   with help from (in alphabetical order)
   C. Bannwarth, F. Bohle, G. Brandenburg, E. Caldeweyher, M. Checinski,
   S. Dohm, S. Ehlert, S. Ehrlich, F. März, H. Neugebauer, J. Pisarek,
   P. Pracht, P. Shushkov, and S. Spicher.
   
 * started run on 2021/05/19 at 11:00:03.456     

           -------------------------------------------------
          |                Calculation Setup                |
           -------------------------------------------------

          program call               : /ihome/ghutchison/geoffh/xtb/xtb 670.xyz -opt
          hostname                   : smp-n144
          coordinate file            : 670.xyz
          omp threads                :                     1
          number of atoms            :                    19
          number of electrons        :                    64
          charge                     :                     0
          spin                       :                   0.0
          first test random number   :      0.26029011147314


########################################################################
# WARNING! Please study the warnings concerning your input carefully
#  - the use of '-opt' is discouraged, please use '--opt' next time
########################################################################

           ------------------------------------------------- 
          |                 G F N 2 - x T B                 |
          | Geometry, Frequencies, Noncovalent interactions |
          |            JCTC 2019 parametrisation            |
           ------------------------------------------------- 
             KAB for C  - Si     :                1.0500
             KAB for H  - Pd     :                0.9500
             k(s)              :                1.8500
             k(p)              :                2.2300
             k(d)              :                2.2300
             k(f)              :                2.0000
             kEN (H0ij)        :               -2.0000
             D4 a1             :                0.5200
             D4 a2             :                5.0000
             D4 s6             :                1.0000
             D4 s8             :                2.7000
             D4 s9             :                5.0000
             alphaj            :                2.0000

  Z AO/shell   Hii/eV     exponent
  1     Wed Apr 25 08:07:45 CEST 2018   EN: 2.200 GM2: 0.406  GM3: 0.0800  RAES: 1.40
     1s    -10.707211    1.230000
  6     Wed Apr 25 08:07:45 CEST 2018   EN: 2.550 GM2: 0.538  GM3: 0.1500  RAES: 3.00
     2s    -13.970922    2.096432
     2p    -10.063292    1.800000
 16     Tue Apr 24 11:44:34 CEST 2018   EN: 2.580 GM2: 0.340  GM3:-0.0502  RAES: 3.10
     3s    -20.029654    1.981333
     3p    -11.377694    2.025643
     3d     -0.420282    1.702555

           ------------------------------------------------- 
          |        Self-Consistent Charge Iterations        |
           ------------------------------------------------- 

          ...................................................
          :                      SETUP                      :
          :.................................................:
          :  # basis functions                  76          :
          :  # atomic orbitals                  73          :
          :  # shells                           35          :
          :  # electrons                        64          :
          :  max. iterations                   250          :
          :  Hamiltonian                  GFN2-xTB          :
          :  restarted?                      false          :
          :  GBSA solvation                  false          :
          :  PC potential                    false          :
          :  electronic temp.          300.0000000     K    :
          :  accuracy                    1.0000000          :
          :  -> integral cutoff          0.2500000E+02      :
          :  -> integral neglect         0.1000000E-07      :
          :  -> SCF convergence          0.1000000E-05 Eh   :
          :  -> wf. convergence          0.1000000E-03 e    :
          :  Broyden damping             0.4000000          :
          ...................................................

 iter      E             dE          RMSdq      gap      omega  full diag
   1    -34.6358707 -0.346359E+02  0.498E+00    2.54       0.0  T
   2    -34.6531134 -0.172427E-01  0.281E+00    2.47       1.0  T
   3    -34.6377853  0.153281E-01  0.119E+00    2.54       1.0  T
   4    -34.6579419 -0.201566E-01  0.484E-01    2.48       1.0  T
   5    -34.6589058 -0.963928E-03  0.212E-01    2.49       1.0  T
   6    -34.6591247 -0.218843E-03  0.109E-01    2.49       1.0  T
   7    -34.6592869 -0.162192E-03  0.266E-02    2.48       1.0  T
   8    -34.6592887 -0.187278E-05  0.147E-02    2.48       1.6  T
   9    -34.6592891 -0.382357E-06  0.845E-03    2.48       2.7  T
  10    -34.6592897 -0.558547E-06  0.305E-03    2.48       7.5  T
  11    -34.6592897 -0.471695E-07  0.154E-03    2.48      14.9  T
  12    -34.6592897 -0.100857E-07  0.710E-04    2.48      32.3  T
  13    -34.6592897 -0.278142E-08  0.464E-04    2.48      49.5  T

   *** convergence criteria satisfied after 13 iterations ***

         #    Occupation            Energy/Eh            Energy/eV
      -------------------------------------------------------------
         1        2.0000           -0.7428841             -20.2149
       ...           ...                  ...                  ...
        26        2.0000           -0.4491006             -12.2206
        27        2.0000           -0.4400911             -11.9755
        28        2.0000           -0.4344812             -11.8228
        29        2.0000           -0.4219521             -11.4819
        30        2.0000           -0.4002357             -10.8910
        31        2.0000           -0.3892039             -10.5908
        32        2.0000           -0.3643329              -9.9140 (HOMO)
        33                         -0.2730263              -7.4294 (LUMO)
        34                         -0.2623755              -7.1396
        35                         -0.2410431              -6.5591
        36                         -0.2188818              -5.9561
        37                         -0.2116096              -5.7582
       ...                                ...                  ...
        73                          0.7916501              21.5419
      -------------------------------------------------------------
                  HL-Gap            0.0913066 Eh            2.4846 eV
             Fermi-level           -0.3186796 Eh           -8.6717 eV

 SCC (total)                   0 d,  0 h,  0 min,  0.044 sec
 SCC setup                      ...        0 min,  0.000 sec (  0.576%)
 Dispersion                     ...        0 min,  0.000 sec (  0.490%)
 integral evaluation            ...        0 min,  0.011 sec ( 24.855%)
 zeroth order Hamiltonian       ...        0 min,  0.000 sec (  0.430%)
 iterations                     ...        0 min,  0.017 sec ( 38.034%)
 molecular gradient             ...        0 min,  0.015 sec ( 34.644%)
 printout                       ...        0 min,  0.000 sec (  0.855%)

         :::::::::::::::::::::::::::::::::::::::::::::::::::::
         ::                     SUMMARY                     ::
         :::::::::::::::::::::::::::::::::::::::::::::::::::::
         :: total energy             -34.149595711451 Eh    ::
         :: gradient norm              0.094262788159 Eh/a0 ::
         :: HOMO-LUMO gap              2.484580007777 eV    ::
         ::.................................................::
         :: SCC energy               -34.659289749853 Eh    ::
         :: -> isotropic ES            0.002036338199 Eh    ::
         :: -> anisotropic ES          0.001975957706 Eh    ::
         :: -> anisotropic XC          0.016034832779 Eh    ::
         :: -> dispersion             -0.024748657933 Eh    ::
         :: repulsion energy           0.509738359112 Eh    ::
         :: add. restraining           0.000000000000 Eh    ::
         :::::::::::::::::::::::::::::::::::::::::::::::::::::

      ----------------------------------------------------------- 
     |                   =====================                   |
     |                        A N C O P T                        |
     |                   =====================                   |
     |               Approximate Normal Coordinate               |
     |                Rational Function Optimizer                |
      ----------------------------------------------------------- 

          ...................................................
          :                      SETUP                      :
          :.................................................:
          :   optimization level            normal          :
          :   max. optcycles                   200          :
          :   ANC micro-cycles                  20          :
          :   degrees of freedom                51          :
          :.................................................:
          :   RF solver                   davidson          :
          :   input Hessian                  false          :
          :   write xtbopt.log                true          :
          :   linear?                        false          :
          :   energy convergence         0.5000000E-05 Eh   :
          :   grad. convergence          0.1000000E-02 Eh/α :
          :   maximium RF displ.         2.0000000          :
          :   Hlow (freq-cutoff)         0.5000000E-02      :
          :   Hmax (freq-cutoff)         5.0000000          :
          :   S6 in model hess.         20.0000000          :
          ...................................................

generating ANC from model Hessian ...
Using Lindh-Hessian (1995)
 Shifting diagonal of input Hessian by   3.406291815404522E-003
 Lowest  eigenvalues of input Hessian
   -0.000000   -0.000000   -0.000000   -0.000000   -0.000000    0.000000
    0.005000    0.006982    0.009267    0.010357    0.014167    0.022277
    0.022602    0.027065    0.031764    0.040306    0.044252    0.052335
 Highest eigenvalues
    1.775696    1.817618    1.830537    1.954081    2.073915    2.200044
 

........................................................................
.............................. CYCLE    1 ..............................
........................................................................
   1    -34.6592898 -0.346593E+02  0.154E-04    2.48       0.0  T
   2    -34.6592898 -0.332747E-10  0.109E-04    2.48     209.8  T
   3    -34.6592898 -0.912337E-10  0.772E-05    2.48     297.3  T
     SCC iter.                  ...        0 min,  0.004 sec
     gradient                   ...        0 min,  0.015 sec
 * total energy  :   -34.1495957 Eh     change        0.1606083E-07 Eh
   gradient norm :     0.0942633 Eh/α   predicted     0.0000000E+00 (-100.00%)
   displ. norm   :     0.3327567 α      lambda       -0.1800040E-01
   maximum displ.:     0.2040571 α      in ANC's #11, #10, #23, ...

........................................................................
.............................. CYCLE    2 ..............................
........................................................................
   1    -34.6676809 -0.346677E+02  0.473E-01    2.48       0.0  T
   2    -34.6677655 -0.845851E-04  0.255E-01    2.49       1.0  T
   3    -34.6674809  0.284610E-03  0.182E-01    2.48       1.0  T
   4    -34.6679842 -0.503332E-03  0.434E-02    2.48       1.0  T
   5    -34.6679908 -0.658083E-05  0.273E-02    2.48       1.0  T
   6    -34.6679934 -0.259210E-05  0.914E-03    2.48       2.5  T
   7    -34.6679943 -0.973490E-06  0.321E-03    2.48       7.1  T
   8    -34.6679943  0.452360E-08  0.199E-03    2.48      11.5  T
     SCC iter.                  ...        0 min,  0.009 sec
     gradient                   ...        0 min,  0.014 sec
 * total energy  :   -34.1618486 Eh     change       -0.1225286E-01 Eh
   gradient norm :     0.0397295 Eh/α   predicted    -0.9996767E-02 ( -18.41%)
   displ. norm   :     0.2310361 α      lambda       -0.4552833E-02
   maximum displ.:     0.1380001 α      in ANC's #11, #3, #10, ...

........................................................................
.............................. CYCLE    3 ..............................
........................................................................
   1    -34.6671059 -0.346671E+02  0.267E-01    2.48       0.0  T
   2    -34.6671350 -0.291166E-04  0.160E-01    2.49       1.0  T
   3    -34.6670928  0.422091E-04  0.110E-01    2.48       1.0  T
   4    -34.6672375 -0.144697E-03  0.302E-02    2.49       1.0  T
   5    -34.6672425 -0.496369E-05  0.179E-02    2.49       1.3  T
   6    -34.6672440 -0.155120E-05  0.502E-03    2.49       4.6  T
   7    -34.6672443 -0.267021E-06  0.222E-03    2.49      10.4  T
     SCC iter.                  ...        0 min,  0.008 sec
     gradient                   ...        0 min,  0.014 sec
 * total energy  :   -34.1644266 Eh     change       -0.2578073E-02 Eh
   gradient norm :     0.0100596 Eh/α   predicted    -0.2397930E-02 (  -6.99%)
   displ. norm   :     0.1240265 α      lambda       -0.3327975E-03
   maximum displ.:     0.1003309 α      in ANC's #3, #1, #11, ...

........................................................................
.............................. CYCLE    4 ..............................
........................................................................
   1    -34.6646798 -0.346647E+02  0.800E-02    2.49       0.0  T
   2    -34.6646812 -0.143796E-05  0.473E-02    2.49       1.0  T
   3    -34.6646717  0.957373E-05  0.349E-02    2.49       1.0  T
   4    -34.6646866 -0.148821E-04  0.823E-03    2.49       2.8  T
   5    -34.6646868 -0.250912E-06  0.473E-03    2.49       4.8  T
   6    -34.6646870 -0.198854E-06  0.161E-03    2.49      14.3  T
   7    -34.6646870 -0.636199E-08  0.104E-03    2.49      22.1  T
     SCC iter.                  ...        0 min,  0.008 sec
     gradient                   ...        0 min,  0.014 sec
 * total energy  :   -34.1646606 Eh     change       -0.2339848E-03 Eh
   gradient norm :     0.0043888 Eh/α   predicted    -0.1689587E-03 ( -27.79%)
   displ. norm   :     0.1286853 α      lambda       -0.1629015E-03
   maximum displ.:     0.1023883 α      in ANC's #3, #1, #2, ...

........................................................................
.............................. CYCLE    5 ..............................
........................................................................
   1    -34.6634806 -0.346635E+02  0.916E-02    2.49       0.0  T
   2    -34.6634821 -0.152403E-05  0.508E-02    2.49       1.0  T
   3    -34.6634698  0.122538E-04  0.323E-02    2.49       1.0  T
   4    -34.6634851 -0.152118E-04  0.773E-03    2.49       3.0  T
   5    -34.6634851 -0.703726E-08  0.380E-03    2.49       6.0  T
   6    -34.6634852 -0.189496E-06  0.154E-03    2.49      14.9  T
   7    -34.6634853 -0.123650E-07  0.903E-04    2.49      25.4  T
     SCC iter.                  ...        0 min,  0.008 sec
     gradient                   ...        0 min,  0.014 sec
 * total energy  :   -34.1647697 Eh     change       -0.1090696E-03 Eh
   gradient norm :     0.0023312 Eh/α   predicted    -0.8280059E-04 ( -24.08%)
   displ. norm   :     0.1073915 α      lambda       -0.7015916E-04
   maximum displ.:     0.0716413 α      in ANC's #3, #1, #2, ...

........................................................................
.............................. CYCLE    6 ..............................
........................................................................
   1    -34.6636317 -0.346636E+02  0.790E-02    2.49       0.0  T
   2    -34.6636328 -0.109642E-05  0.427E-02    2.49       1.0  T
   3    -34.6636273  0.557288E-05  0.213E-02    2.49       1.1  T
   4    -34.6636339 -0.663581E-05  0.565E-03    2.49       4.1  T
   5    -34.6636339 -0.208491E-07  0.240E-03    2.49       9.5  T
   6    -34.6636340 -0.616344E-07  0.862E-04    2.49      26.6  T
   7    -34.6636340 -0.457901E-08  0.602E-04    2.49      38.1  T
     SCC iter.                  ...        0 min,  0.008 sec
     gradient                   ...        0 min,  0.015 sec
 * total energy  :   -34.1648165 Eh     change       -0.4682916E-04 Eh
   gradient norm :     0.0029422 Eh/α   predicted    -0.3548864E-04 ( -24.22%)
   displ. norm   :     0.1097343 α      lambda       -0.5633664E-04
   maximum displ.:     0.0672690 α      in ANC's #3, #1, #2, ...

........................................................................
.............................. CYCLE    7 ..............................
........................................................................
   1    -34.6642818 -0.346643E+02  0.836E-02    2.49       0.0  T
   2    -34.6642828 -0.104940E-05  0.455E-02    2.49       1.0  T
   3    -34.6642776  0.520527E-05  0.208E-02    2.49       1.1  T
   4    -34.6642837 -0.604942E-05  0.557E-03    2.49       4.1  T
   5    -34.6642837 -0.846810E-08  0.243E-03    2.49       9.4  T
   6    -34.6642838 -0.786141E-07  0.703E-04    2.49      32.6  T
   7    -34.6642838 -0.384426E-08  0.444E-04    2.49      51.7  T
     SCC iter.                  ...        0 min,  0.008 sec
     gradient                   ...        0 min,  0.015 sec
 * total energy  :   -34.1648570 Eh     change       -0.4048708E-04 Eh
   gradient norm :     0.0027229 Eh/α   predicted    -0.2851136E-04 ( -29.58%)
   displ. norm   :     0.1321755 α      lambda       -0.5254976E-04
   maximum displ.:     0.0796023 α      in ANC's #1, #2, #3, ...

........................................................................
.............................. CYCLE    8 ..............................
........................................................................
   1    -34.6647660 -0.346648E+02  0.105E-01    2.49       0.0  T
   2    -34.6647677 -0.164743E-05  0.560E-02    2.49       1.0  T
   3    -34.6647619  0.582114E-05  0.227E-02    2.49       1.0  T
   4    -34.6647687 -0.680734E-05  0.681E-03    2.49       3.4  T
   5    -34.6647687 -0.639126E-07  0.201E-03    2.49      11.4  T
   6    -34.6647688 -0.666857E-07  0.449E-04    2.49      51.1  T
   7    -34.6647688 -0.814047E-09  0.288E-04    2.49      79.7  T
     SCC iter.                  ...        0 min,  0.008 sec
     gradient                   ...        0 min,  0.015 sec
 * total energy  :   -34.1648975 Eh     change       -0.4052207E-04 Eh
   gradient norm :     0.0020698 Eh/α   predicted    -0.2673765E-04 ( -34.02%)
   displ. norm   :     0.1237149 α      lambda       -0.4458143E-04
   maximum displ.:     0.0800618 α      in ANC's #1, #2, #3, ...

........................................................................
.............................. CYCLE    9 ..............................
........................................................................
   1    -34.6649181 -0.346649E+02  0.102E-01    2.49       0.0  T
   2    -34.6649198 -0.171498E-05  0.540E-02    2.49       1.0  T
   3    -34.6649177  0.209944E-05  0.157E-02    2.49       1.5  T
   4    -34.6649203 -0.253956E-05  0.707E-03    2.49       3.2  T
   5    -34.6649205 -0.221481E-06  0.154E-03    2.49      14.9  T
   6    -34.6649205 -0.444439E-07  0.368E-04    2.49      62.3  T
   7    -34.6649205 -0.884718E-09  0.218E-04    2.49     105.2  T
     SCC iter.                  ...        0 min,  0.008 sec
     gradient                   ...        0 min,  0.015 sec
 * total energy  :   -34.1649319 Eh     change       -0.3442337E-04 Eh
   gradient norm :     0.0015937 Eh/α   predicted    -0.2263666E-04 ( -34.24%)
   displ. norm   :     0.1750470 α      lambda       -0.3342421E-04
   maximum displ.:     0.1183558 α      in ANC's #2, #1, #4, ...

........................................................................
.............................. CYCLE   10 ..............................
........................................................................
   1    -34.6644571 -0.346645E+02  0.149E-01    2.48       0.0  T
   2    -34.6644610 -0.393567E-05  0.781E-02    2.48       1.0  T
   3    -34.6644604  0.672096E-06  0.160E-02    2.48       1.4  T
   4    -34.6644612 -0.852658E-06  0.106E-02    2.48       2.2  T
   5    -34.6644622 -0.963664E-06  0.148E-03    2.48      15.5  T
   6    -34.6644622 -0.273778E-07  0.439E-04    2.48      52.3  T
   7    -34.6644622 -0.237527E-09  0.287E-04    2.48      80.0  T
     SCC iter.                  ...        0 min,  0.008 sec
     gradient                   ...        0 min,  0.015 sec
 * total energy  :   -34.1649656 Eh     change       -0.3362783E-04 Eh
   gradient norm :     0.0021024 Eh/α   predicted    -0.1694265E-04 ( -49.62%)
   displ. norm   :     0.0710233 α      lambda       -0.1842122E-04
   maximum displ.:     0.0490702 α      in ANC's #2, #1, #3, ...

........................................................................
.............................. CYCLE   11 ..............................
........................................................................
   1    -34.6645868 -0.346646E+02  0.594E-02    2.48       0.0  T
   2    -34.6645875 -0.656203E-06  0.310E-02    2.48       1.0  T
   3    -34.6645869  0.611259E-06  0.870E-03    2.48       2.6  T
   4    -34.6645876 -0.767304E-06  0.413E-03    2.48       5.5  T
   5    -34.6645877 -0.789820E-07  0.962E-04    2.48      23.8  T
   6    -34.6645877 -0.147742E-07  0.210E-04    2.48     109.3  T
     SCC iter.                  ...        0 min,  0.007 sec
     gradient                   ...        0 min,  0.015 sec
 * total energy  :   -34.1649806 Eh     change       -0.1503200E-04 Eh
   gradient norm :     0.0014963 Eh/α   predicted    -0.9257540E-05 ( -38.41%)
   displ. norm   :     0.1948217 α      lambda       -0.2584840E-04
   maximum displ.:     0.1369552 α      in ANC's #2, #1, #5, ...

........................................................................
.............................. CYCLE   12 ..............................
........................................................................
   1    -34.6640600 -0.346641E+02  0.166E-01    2.48       0.0  T
   2    -34.6640650 -0.497792E-05  0.865E-02    2.48       1.0  T
   3    -34.6640611  0.390536E-05  0.233E-02    2.48       1.0  T
   4    -34.6640660 -0.486690E-05  0.118E-02    2.48       2.0  T
   5    -34.6640667 -0.772889E-06  0.183E-03    2.48      12.6  T
   6    -34.6640668 -0.605392E-07  0.478E-04    2.48      48.0  T
   7    -34.6640668 -0.428535E-09  0.270E-04    2.48      85.1  T
     SCC iter.                  ...        0 min,  0.008 sec
     gradient                   ...        0 min,  0.015 sec
 * total energy  :   -34.1649994 Eh     change       -0.1883571E-04 Eh
   gradient norm :     0.0015887 Eh/α   predicted    -0.1314275E-04 ( -30.22%)
   displ. norm   :     0.0240686 α      lambda       -0.5668069E-05
   maximum displ.:     0.0134583 α      in ANC's #1, #3, #2, ...

........................................................................
.............................. CYCLE   13 ..............................
........................................................................
   1    -34.6650555 -0.346651E+02  0.170E-02    2.48       0.0  T
   2    -34.6650556 -0.575064E-07  0.907E-03    2.48       2.5  T
   3    -34.6650552  0.373305E-06  0.564E-03    2.48       4.1  T
   4    -34.6650556 -0.446712E-06  0.121E-03    2.48      18.9  T
   5    -34.6650556  0.293241E-08  0.712E-04    2.48      32.2  T
   6    -34.6650556 -0.618034E-08  0.181E-04    2.48     126.5  T
     SCC iter.                  ...        0 min,  0.007 sec
     gradient                   ...        0 min,  0.015 sec
 * total energy  :   -34.1650027 Eh     change       -0.3231015E-05 Eh
   gradient norm :     0.0008663 Eh/α   predicted    -0.2835385E-05 ( -12.24%)
   displ. norm   :     0.0249733 α      lambda       -0.1529969E-05
   maximum displ.:     0.0172243 α      in ANC's #2, #1, #4, ...

   *** GEOMETRY OPTIMIZATION CONVERGED AFTER 13 ITERATIONS ***

------------------------------------------------------------------------
 total energy gain   :        -0.0154070 Eh       -9.6680 kcal/mol
 total RMSD          :         0.2974705 a0        0.1574 Å
 total power (kW/mol):        -3.1116131 (step)  -89.5743 (real)
------------------------------------------------------------------------

 ANCopt (total)                0 d,  0 h,  0 min,  0.452 sec
 optimizer setup                ...        0 min,  0.000 sec (  0.036%)
 model hessian                  ...        0 min,  0.002 sec (  0.389%)
 ANC generation                 ...        0 min,  0.001 sec (  0.125%)
 coordinate transformation      ...        0 min,  0.000 sec (  0.042%)
 single point calculation       ...        0 min,  0.445 sec ( 98.572%)
 optimization log               ...        0 min,  0.001 sec (  0.245%)
 hessian update                 ...        0 min,  0.000 sec (  0.033%)
 rational function              ...        0 min,  0.002 sec (  0.380%)

================
 final structure:
================
$coord
    2.76366867204567   -2.90751639214151    0.25472417411083      C 
    5.86299263012152   -1.92488625237328    0.10072640611655      S 
    5.00496165583928    1.20340885255574   -0.19579305745898      C 
    2.45334984052276    1.43895307643650   -0.17335707644073      C 
    1.13687175676640   -0.92146481012614    0.08575249030774      C 
   -1.54310405341131   -0.54436910675207    0.09590333982314      C 
   -2.13605525481787    1.99498012126234   -0.14649872676617      C 
    0.42809280622174    4.05411391812625   -0.39744673844337      S 
   -5.32982104213547    2.54866680778572   -0.14540525298096      S 
   -5.91398567239883   -0.70473683952195    0.18977742818185      C 
   -3.71648662330239   -2.06788798544697    0.28675890607719      C 
   -8.49816452527516   -1.53950730325793    0.32061298836795      C 
   -9.24442878089214   -3.92511986044655    0.58840139266932      C 
    2.34686820061419   -4.87678237357316    0.45915644596425      H 
    6.42379515312054    2.63503683631913   -0.36399322659642      H 
   -3.64930376131424   -4.08668304551913    0.48540314424854      H 
   -9.89069656158809   -0.04801444432933    0.18606208156439      H 
   -7.92467690589500   -5.46346533636812    0.73301203222220      H 
  -11.21611049789798   -4.41006686991335    0.67127319893942      H 
$end
           -------------------------------------------------
          |                Final Singlepoint                |
           -------------------------------------------------

          ...................................................
          :                      SETUP                      :
          :.................................................:
          :  # basis functions                  76          :
          :  # atomic orbitals                  73          :
          :  # shells                           35          :
          :  # electrons                        64          :
          :  max. iterations                   250          :
          :  Hamiltonian                  GFN2-xTB          :
          :  restarted?                      false          :
          :  GBSA solvation                  false          :
          :  PC potential                    false          :
          :  electronic temp.          300.0000000     K    :
          :  accuracy                    1.0000000          :
          :  -> integral cutoff          0.2500000E+02      :
          :  -> integral neglect         0.1000000E-07      :
          :  -> SCF convergence          0.1000000E-05 Eh   :
          :  -> wf. convergence          0.1000000E-03 e    :
          :  Broyden damping             0.4000000          :
          ...................................................

 iter      E             dE          RMSdq      gap      omega  full diag
   1    -34.6650556 -0.346651E+02  0.115E-04    2.48       0.0  T
   2    -34.6650556 -0.128750E-10  0.536E-05    2.48     427.8  T
   3    -34.6650556 -0.178346E-10  0.546E-05    2.48     420.1  T

   *** convergence criteria satisfied after 3 iterations ***

         #    Occupation            Energy/Eh            Energy/eV
      -------------------------------------------------------------
         1        2.0000           -0.7423558             -20.2005
       ...           ...                  ...                  ...
        26        2.0000           -0.4517222             -12.2920
        27        2.0000           -0.4421966             -12.0328
        28        2.0000           -0.4354945             -11.8504
        29        2.0000           -0.4216008             -11.4723
        30        2.0000           -0.4008818             -10.9085
        31        2.0000           -0.3878723             -10.5545
        32        2.0000           -0.3660137              -9.9597 (HOMO)
        33                         -0.2747647              -7.4767 (LUMO)
        34                         -0.2602006              -7.0804
        35                         -0.2287397              -6.2243
        36                         -0.2192555              -5.9662
        37                         -0.2173042              -5.9131
       ...                                ...                  ...
        73                          0.7586701              20.6445
      -------------------------------------------------------------
                  HL-Gap            0.0912489 Eh            2.4830 eV
             Fermi-level           -0.3203892 Eh           -8.7182 eV

 SCC (total)                   0 d,  0 h,  0 min,  0.031 sec
 SCC setup                      ...        0 min,  0.000 sec (  0.567%)
 Dispersion                     ...        0 min,  0.000 sec (  0.413%)
 integral evaluation            ...        0 min,  0.011 sec ( 35.071%)
 zeroth order Hamiltonian       ...        0 min,  0.000 sec (  0.564%)
 iterations                     ...        0 min,  0.004 sec ( 13.259%)
 molecular gradient             ...        0 min,  0.015 sec ( 48.859%)
 printout                       ...        0 min,  0.000 sec (  1.096%)

         :::::::::::::::::::::::::::::::::::::::::::::::::::::
         ::                     SUMMARY                     ::
         :::::::::::::::::::::::::::::::::::::::::::::::::::::
         :: total energy             -34.165002679026 Eh    ::
         :: gradient norm              0.000866986342 Eh/a0 ::
         :: HOMO-LUMO gap              2.483009975644 eV    ::
         ::.................................................::
         :: SCC energy               -34.665055641606 Eh    ::
         :: -> isotropic ES            0.001821762132 Eh    ::
         :: -> anisotropic ES          0.001852438348 Eh    ::
         :: -> anisotropic XC          0.015239052769 Eh    ::
         :: -> dispersion             -0.024860569256 Eh    ::
         :: repulsion energy           0.500118445065 Eh    ::
         :: add. restraining           0.000000000000 Eh    ::
         :::::::::::::::::::::::::::::::::::::::::::::::::::::

           -------------------------------------------------
          |                Property Printout                |
           -------------------------------------------------

    * Orbital Energies and Occupations

         #    Occupation            Energy/Eh            Energy/eV
      -------------------------------------------------------------
         1        2.0000           -0.7423558             -20.2005
       ...           ...                  ...                  ...
        20        2.0000           -0.4877851             -13.2733
        21        2.0000           -0.4822988             -13.1240
        22        2.0000           -0.4693736             -12.7723
        23        2.0000           -0.4674628             -12.7203
        24        2.0000           -0.4568938             -12.4327
        25        2.0000           -0.4553065             -12.3895
        26        2.0000           -0.4517222             -12.2920
        27        2.0000           -0.4421966             -12.0328
        28        2.0000           -0.4354945             -11.8504
        29        2.0000           -0.4216008             -11.4723
        30        2.0000           -0.4008818             -10.9085
        31        2.0000           -0.3878723             -10.5545
        32        2.0000           -0.3660137              -9.9597 (HOMO)
        33                         -0.2747647              -7.4767 (LUMO)
        34                         -0.2602006              -7.0804
        35                         -0.2287397              -6.2243
        36                         -0.2192555              -5.9662
        37                         -0.2173042              -5.9131
        38                         -0.2091973              -5.6925
        39                         -0.1718853              -4.6772
        40                         -0.1566390              -4.2624
        41                         -0.1290079              -3.5105
        42                         -0.1243861              -3.3847
        43                         -0.0997502              -2.7143
       ...                                ...                  ...
        73                          0.7586701              20.6445
      -------------------------------------------------------------
                  HL-Gap            0.0912489 Eh            2.4830 eV
             Fermi-level           -0.3203892 Eh           -8.7182 eV

     #   Z        covCN         q      C6AA      α(0)
     1   6 C      2.932    -0.032    28.796     8.801
     2  16 S      2.339    -0.002   141.124    19.994
     3   6 C      2.934    -0.036    28.900     8.816
     4   6 C      3.219     0.025    26.747     8.410
     5   6 C      3.280    -0.009    26.784     8.328
     6   6 C      3.246    -0.017    27.420     8.482
     7   6 C      3.032     0.046    26.948     8.515
     8  16 S      2.170    -0.078   144.299    20.218
     9  16 S      2.318    -0.034   142.452    20.088
    10   6 C      2.993     0.024    27.465     8.597
    11   6 C      3.073    -0.053    29.230     8.865
    12   6 C      2.927    -0.029    28.734     8.791
    13   6 C      2.840    -0.089    30.218     9.009
    14   1 H      0.927     0.052     2.295     2.369
    15   1 H      0.927     0.053     2.277     2.360
    16   1 H      0.926     0.047     2.362     2.403
    17   1 H      0.925     0.045     2.384     2.415
    18   1 H      0.926     0.042     2.418     2.432
    19   1 H      0.926     0.045     2.378     2.412

 Mol. C6AA /au·bohr⁶  :       9602.285290
 Mol. C8AA /au·bohr⁸  :     322118.549060
 Mol. α(0) /au        :        161.301977


Wiberg/Mayer (AO) data.
largest (>0.10) Wiberg bond orders for each atom
          total WBO             WBO to atom ...
     1  C   3.941        C    5 1.536    S    2 1.198    H   14 0.969    C    3 0.122
     2  S   2.644        C    1 1.198    C    3 1.186
     3  C   3.940        C    4 1.580    S    2 1.186    H   15 0.969    C    1 0.122
     4  C   3.950        C    3 1.580    C    5 1.164    S    8 1.052
     5  C   3.982        C    1 1.536    C    4 1.164    C    6 1.115
     6  C   3.978        C    7 1.408    C   11 1.254    C    5 1.115
     7  C   3.922        C    6 1.408    S    9 1.181    S    8 1.097
     8  S   2.452        C    7 1.097    C    4 1.052
     9  S   2.577        C    7 1.181    C   10 1.099
    10  C   3.941        C   11 1.539    C   12 1.134    S    9 1.099
    11  C   3.987        C   10 1.539    C    6 1.254    H   16 0.960
    12  C   3.988        C   13 1.859    C   10 1.134    H   17 0.964
    13  C   3.975        C   12 1.859    H   19 0.978    H   18 0.975
    14  H   0.997        C    1 0.969
    15  H   0.997        C    3 0.969
    16  H   0.998        C   11 0.960
    17  H   0.998        C   12 0.964
    18  H   0.998        C   13 0.975
    19  H   0.997        C   13 0.978

molecular dipole:
                 x           y           z       tot (Debye)
 q only:       -0.021      -0.457       0.046
   full:       -0.096      -0.609       0.063       1.575
molecular quadrupole (traceless):
                xx          xy          yy          xz          yz          zz
 q only:        3.744       2.191      -0.935      -0.337      -0.246      -2.809
  q+dip:        2.900       5.335       0.653      -0.648      -0.558      -3.553
   full:        2.018       5.723      -0.322      -0.639      -0.268      -1.696

           -------------------------------------------------
          |                Geometry Summary                 |
           -------------------------------------------------

      molecular mass/u    :      222.3374000
   center of mass at/Å    :       -0.5469815       0.0900333       0.0088140
  moments of inertia/u·Å² :        0.4010133E+03   0.1450473E+04   0.1851485E+04
rotational constants/cm⁻¹ :        0.4203759E-01   0.1162216E-01   0.9104925E-02

 * 20 selected distances

     #   Z        #   Z                                     value/Å
     1   6 C      2  16 S                                 1.7224770
     2  16 S      3   6 C                                 1.7237190
     3   6 C      4   6 C                                 1.3560478
     1   6 C      5   6 C                                 1.3614797
     4   6 C      5   6 C                                 1.4367747
     5   6 C      6   6 C                                 1.4321628
     6   6 C      7   6 C                                 1.3858631
     4   6 C      8  16 S                                 1.7543602
     7   6 C      8  16 S                                 1.7453115
     7   6 C      9  16 S                                 1.7152781
     9  16 S     10   6 C                                 1.7581297 (max)
     6   6 C     11   6 C                                 1.4081612
    10   6 C     11   6 C                                 1.3693926
    12   6 C     13   6 C                                 1.3303066
     1   6 C     14   1 H                                 1.0706557
     3   6 C     15   1 H                                 1.0703176 (min)
    11   6 C     16   1 H                                 1.0740482
    12   6 C     17   1 H                                 1.0821384
    13   6 C     18   1 H                                 1.0753064
    13   6 C     19   1 H                                 1.0753593

 * 3 distinct bonds (by element types)

   Z      Z             #   av. dist./Å        max./Å        min./Å
   1 H    6 C           6     1.0746376     1.0821384     1.0703176
   6 C    6 C           8     1.3850236     1.4367747     1.3303066
   6 C   16 S           6     1.7365459     1.7581297     1.7152781


optimized geometry written to: xtbopt.xyz


           -------------------------------------------------
          | TOTAL ENERGY              -34.165002679026 Eh   |
          | GRADIENT NORM               0.000866986342 Eh/α |
          | HOMO-LUMO GAP               2.483009975644 eV   |
           -------------------------------------------------

------------------------------------------------------------------------
 * finished run on 2021/05/19 at 11:00:04.008     
------------------------------------------------------------------------
 total:
 * wall-time:     0 d,  0 h,  0 min,  0.551 sec
 *  cpu-time:     0 d,  0 h,  0 min,  0.549 sec
 * ratio c/w:     0.995 speedup
 SCF:
 * wall-time:     0 d,  0 h,  0 min,  0.045 sec
 *  cpu-time:     0 d,  0 h,  0 min,  0.045 sec
 * ratio c/w:     0.998 speedup
 ANC optimizer:
 * wall-time:     0 d,  0 h,  0 min,  0.483 sec
 *  cpu-time:     0 d,  0 h,  0 min,  0.482 sec
 * ratio c/w:     0.997 speedup

