      -----------------------------------------------------------      
     |                   =====================                   |     
     |                           x T B                           |     
     |                   =====================                   |     
     |                         S. Grimme                         |     
     |          Mulliken Center for Theoretical Chemistry        |     
     |                    University of Bonn                     |     
     |                Version 6.2 RC2 (SAW190805)                |     
      -----------------------------------------------------------      

   This program is distributed in the hope that it will be useful,
   but WITHOUT ANY WARRANTY; without even the implied warranty of
   MERCHANTABILITY or FITNESS FOR A PARTICULAR PURPOSE.
   
   FOR NON-COMMERCIAL, ACADEMIA USE ONLY.
   
   Cite this work as:
   * S. Grimme, C. Bannwarth, P. Shushkov, J. Chem. Theory Comput., 2017,
     13, 1989-2009. DOI: 10.1021/acs.jctc.7b00118
   * C. Bannwarth, S. Ehlert and S. Grimme., J. Chem. Theory Comput., 2019,
     15, 1652-1671. DOI: 10.1021/acs.jctc.8b01176
   * P. Pracht, E. Caldeweyher, S. Ehlert, S. Grimme, ChemRxiv, 2019, preprint.
     DOI: 10.26434/chemrxiv.8326202.v1
   
   for DFT-D4:
   * E. Caldeweyher, C. Bannwarth and S. Grimme, J. Chem. Phys., 2017,
     147, 034112. DOI: 10.1063/1.4993215
   * E. Caldeweyher, S. Ehlert, A. Hansen, H. Neugebauer, S. Spicher,
     C. Bannwarth and S. Grimme, J. Chem. Phys., 2019, 150, 154122.
     DOI: 10.1063/1.5090222
   
   for sTDA-xTB:
   * S. Grimme and C. Bannwarth, J. Chem. Phys., 2016, 145, 054103.
     DOI: 10.1063/1.4959605
   
   in the mass-spec context:
   * V. Asgeirsson, C. Bauer and S. Grimme, Chem. Sci., 2017, 8, 4879.
     DOI: 10.1039/c7sc00601b
   
   for metadynamics refer to:
   * S. Grimme, J. Chem. Theory Comput., 2019, 155, 2847-2862
     DOI: 10.1021/acs.jctc.9b00143
   
   with help from (in alphabetical order)
   C. Bannwarth, F. Bohle, G. Brandenburg, E. Caldeweyher, M. Checinski,
   S. Dohm, S. Ehlert, S. Ehrlich, F. März, H. Neugebauer, J. Pisarek,
   P. Pracht, P. Shushkov, and S. Spicher.
   
 * started run on 2021/05/19 at 11:00:04.505     

           -------------------------------------------------
          |                Calculation Setup                |
           -------------------------------------------------

          program call               : /ihome/ghutchison/geoffh/xtb/xtb 672.xyz -opt
          hostname                   : smp-n144
          coordinate file            : 672.xyz
          omp threads                :                     1
          number of atoms            :                    25
          number of electrons        :                    74
          charge                     :                     0
          spin                       :                   0.0
          first test random number   :      0.85234011218366


########################################################################
# WARNING! Please study the warnings concerning your input carefully
#  - the use of '-opt' is discouraged, please use '--opt' next time
########################################################################

           ------------------------------------------------- 
          |                 G F N 2 - x T B                 |
          | Geometry, Frequencies, Noncovalent interactions |
          |            JCTC 2019 parametrisation            |
           ------------------------------------------------- 
             KAB for C  - Si     :                1.0500
             KAB for H  - Pd     :                0.9500
             k(s)              :                1.8500
             k(p)              :                2.2300
             k(d)              :                2.2300
             k(f)              :                2.0000
             kEN (H0ij)        :               -2.0000
             D4 a1             :                0.5200
             D4 a2             :                5.0000
             D4 s6             :                1.0000
             D4 s8             :                2.7000
             D4 s9             :                5.0000
             alphaj            :                2.0000

  Z AO/shell   Hii/eV     exponent
  1     Wed Apr 25 08:07:45 CEST 2018   EN: 2.200 GM2: 0.406  GM3: 0.0800  RAES: 1.40
     1s    -10.707211    1.230000
  6     Wed Apr 25 08:07:45 CEST 2018   EN: 2.550 GM2: 0.538  GM3: 0.1500  RAES: 3.00
     2s    -13.970922    2.096432
     2p    -10.063292    1.800000
  7     Wed Apr 25 08:07:45 CEST 2018   EN: 3.040 GM2: 0.461  GM3:-0.0640  RAES: 1.90
     2s    -16.686243    2.339881
     2p    -12.523956    2.014332
 16     Tue Apr 24 11:44:34 CEST 2018   EN: 2.580 GM2: 0.340  GM3:-0.0502  RAES: 3.10
     3s    -20.029654    1.981333
     3p    -11.377694    2.025643
     3d     -0.420282    1.702555

           ------------------------------------------------- 
          |        Self-Consistent Charge Iterations        |
           ------------------------------------------------- 

          ...................................................
          :                      SETUP                      :
          :.................................................:
          :  # basis functions                  76          :
          :  # atomic orbitals                  75          :
          :  # shells                           41          :
          :  # electrons                        74          :
          :  max. iterations                   250          :
          :  Hamiltonian                  GFN2-xTB          :
          :  restarted?                      false          :
          :  GBSA solvation                  false          :
          :  PC potential                    false          :
          :  electronic temp.          300.0000000     K    :
          :  accuracy                    1.0000000          :
          :  -> integral cutoff          0.2500000E+02      :
          :  -> integral neglect         0.1000000E-07      :
          :  -> SCF convergence          0.1000000E-05 Eh   :
          :  -> wf. convergence          0.1000000E-03 e    :
          :  Broyden damping             0.4000000          :
          ...................................................

 iter      E             dE          RMSdq      gap      omega  full diag
   1    -40.2950989 -0.402951E+02  0.533E+00    2.96       0.0  T
   2    -40.2730054  0.220935E-01  0.358E+00    3.00       1.0  T
   3    -40.1365913  0.136414E+00  0.316E+00    3.01       1.0  T
   4    -40.3317926 -0.195201E+00  0.879E-01    2.99       1.0  T
   5    -40.3456969 -0.139043E-01  0.370E-01    2.98       1.0  T
   6    -40.3472979 -0.160096E-02  0.975E-02    2.99       1.0  T
   7    -40.3473594 -0.615339E-04  0.452E-02    2.98       1.0  T
   8    -40.3473762 -0.167663E-04  0.233E-02    2.98       1.0  T
   9    -40.3473814 -0.515974E-05  0.845E-03    2.99       2.4  T
  10    -40.3473821 -0.706844E-06  0.356E-03    2.99       5.6  T
  11    -40.3473822 -0.107445E-06  0.149E-03    2.99      13.4  T
  12    -40.3473822 -0.190401E-07  0.704E-04    2.99      28.4  T
  13    -40.3473822 -0.482923E-08  0.300E-04    2.99      66.6  T

   *** convergence criteria satisfied after 13 iterations ***

         #    Occupation            Energy/Eh            Energy/eV
      -------------------------------------------------------------
         1        2.0000           -0.7484741             -20.3670
       ...           ...                  ...                  ...
        31        2.0000           -0.4544058             -12.3650
        32        2.0000           -0.4492721             -12.2253
        33        2.0000           -0.4458114             -12.1311
        34        2.0000           -0.4409719             -11.9995
        35        2.0000           -0.4362060             -11.8698
        36        2.0000           -0.4075046             -11.0888
        37        2.0000           -0.3917356             -10.6597 (HOMO)
        38                         -0.2820361              -7.6746 (LUMO)
        39                         -0.2608886              -7.0991
        40                         -0.2585944              -7.0367
        41                         -0.2355582              -6.4099
        42                         -0.2272321              -6.1833
       ...                                ...                  ...
        75                          1.0101345              27.4872
      -------------------------------------------------------------
                  HL-Gap            0.1096995 Eh            2.9851 eV
             Fermi-level           -0.3368858 Eh           -9.1671 eV

 SCC (total)                   0 d,  0 h,  0 min,  0.046 sec
 SCC setup                      ...        0 min,  0.000 sec (  0.665%)
 Dispersion                     ...        0 min,  0.000 sec (  0.900%)
 integral evaluation            ...        0 min,  0.011 sec ( 23.720%)
 zeroth order Hamiltonian       ...        0 min,  0.000 sec (  0.456%)
 iterations                     ...        0 min,  0.017 sec ( 37.784%)
 molecular gradient             ...        0 min,  0.016 sec ( 35.478%)
 printout                       ...        0 min,  0.000 sec (  0.872%)

         :::::::::::::::::::::::::::::::::::::::::::::::::::::
         ::                     SUMMARY                     ::
         :::::::::::::::::::::::::::::::::::::::::::::::::::::
         :: total energy             -39.752438204107 Eh    ::
         :: gradient norm              0.270847659053 Eh/a0 ::
         :: HOMO-LUMO gap              2.985075257587 eV    ::
         ::.................................................::
         :: SCC energy               -40.347382202122 Eh    ::
         :: -> isotropic ES            0.017726903750 Eh    ::
         :: -> anisotropic ES          0.004930128049 Eh    ::
         :: -> anisotropic XC          0.048966904597 Eh    ::
         :: -> dispersion             -0.028495667624 Eh    ::
         :: repulsion energy           0.594625635006 Eh    ::
         :: add. restraining           0.000000000000 Eh    ::
         :::::::::::::::::::::::::::::::::::::::::::::::::::::

      ----------------------------------------------------------- 
     |                   =====================                   |
     |                        A N C O P T                        |
     |                   =====================                   |
     |               Approximate Normal Coordinate               |
     |                Rational Function Optimizer                |
      ----------------------------------------------------------- 

          ...................................................
          :                      SETUP                      :
          :.................................................:
          :   optimization level            normal          :
          :   max. optcycles                   200          :
          :   ANC micro-cycles                  20          :
          :   degrees of freedom                69          :
          :.................................................:
          :   RF solver                   davidson          :
          :   input Hessian                  false          :
          :   write xtbopt.log                true          :
          :   linear?                        false          :
          :   energy convergence         0.5000000E-05 Eh   :
          :   grad. convergence          0.1000000E-02 Eh/α :
          :   maximium RF displ.         2.0000000          :
          :   Hlow (freq-cutoff)         0.5000000E-02      :
          :   Hmax (freq-cutoff)         5.0000000          :
          :   S6 in model hess.         20.0000000          :
          ...................................................

generating ANC from model Hessian ...
Using Lindh-Hessian (1995)
 Shifting diagonal of input Hessian by   4.165707400153606E-003
 Lowest  eigenvalues of input Hessian
   -0.000000   -0.000000   -0.000000   -0.000000    0.000000    0.000000
    0.005000    0.005356    0.007134    0.007374    0.008882    0.009728
    0.010880    0.013615    0.015918    0.019036    0.021791    0.025281
 Highest eigenvalues
    1.602060    1.763582    1.798250    1.958890    1.989558    2.420464
 

........................................................................
.............................. CYCLE    1 ..............................
........................................................................
   1    -40.3473822 -0.403474E+02  0.121E-04    2.99       0.0  T
   2    -40.3473822 -0.286491E-10  0.871E-05    2.99     229.6  T
   3    -40.3473822 -0.804192E-10  0.638E-05    2.99     313.2  T
     SCC iter.                  ...        0 min,  0.005 sec
     gradient                   ...        0 min,  0.016 sec
 * total energy  :   -39.7524382 Eh     change        0.4538222E-07 Eh
   gradient norm :     0.2708469 Eh/α   predicted     0.0000000E+00 (-100.00%)
   displ. norm   :     0.3299775 α      lambda       -0.5663340E-01
   maximum displ.:     0.1154501 α      in ANC's #31, #67, #17, ...

........................................................................
.............................. CYCLE    2 ..............................
........................................................................
   1    -40.4723164 -0.404723E+02  0.461E-01    3.04       0.0  T
   2    -40.4725295 -0.213059E-03  0.272E-01    3.05       1.0  T
   3    -40.4721429  0.386536E-03  0.210E-01    3.05       1.0  T
   4    -40.4728167 -0.673715E-03  0.347E-02    3.05       1.0  T
   5    -40.4728330 -0.163357E-04  0.140E-02    3.05       1.4  T
   6    -40.4728339 -0.878502E-06  0.754E-03    3.05       2.7  T
   7    -40.4728348 -0.914892E-06  0.260E-03    3.05       7.7  T
   8    -40.4728348 -0.234881E-07  0.109E-03    3.05      18.3  T
     SCC iter.                  ...        0 min,  0.010 sec
     gradient                   ...        0 min,  0.016 sec
 * total energy  :   -39.7855837 Eh     change       -0.3314555E-01 Eh
   gradient norm :     0.0435489 Eh/α   predicted    -0.3139997E-01 (  -5.27%)
   displ. norm   :     0.3460273 α      lambda       -0.5039083E-02
   maximum displ.:     0.2004443 α      in ANC's #6, #3, #17, ...

........................................................................
.............................. CYCLE    3 ..............................
........................................................................
   1    -40.4866228 -0.404866E+02  0.251E-01    3.06       0.0  T
   2    -40.4866373 -0.144294E-04  0.155E-01    3.07       1.0  T
   3    -40.4865152  0.122038E-03  0.108E-01    3.06       1.0  T
   4    -40.4867521 -0.236883E-03  0.197E-02    3.06       1.0  T
   5    -40.4867533 -0.118842E-05  0.969E-03    3.06       2.1  T
   6    -40.4867545 -0.124389E-05  0.282E-03    3.06       7.1  T
   7    -40.4867547 -0.117567E-06  0.953E-04    3.06      21.0  T
     SCC iter.                  ...        0 min,  0.009 sec
     gradient                   ...        0 min,  0.016 sec
 * total energy  :   -39.7889828 Eh     change       -0.3399098E-02 Eh
   gradient norm :     0.0138354 Eh/α   predicted    -0.2821244E-02 ( -17.00%)
   displ. norm   :     0.3720282 α      lambda       -0.1765367E-02
   maximum displ.:     0.2212085 α      in ANC's #6, #3, #1, ...

........................................................................
.............................. CYCLE    4 ..............................
........................................................................
   1    -40.4901110 -0.404901E+02  0.302E-01    3.07       0.0  T
   2    -40.4901304 -0.194471E-04  0.172E-01    3.07       1.0  T
   3    -40.4899468  0.183568E-03  0.935E-02    3.07       1.0  T
   4    -40.4901604 -0.213584E-03  0.101E-02    3.07       2.0  T
   5    -40.4901609 -0.441939E-06  0.446E-03    3.07       4.5  T
   6    -40.4901611 -0.203227E-06  0.175E-03    3.07      11.4  T
   7    -40.4901611 -0.320525E-07  0.737E-04    3.07      27.1  T
     SCC iter.                  ...        0 min,  0.009 sec
     gradient                   ...        0 min,  0.016 sec
 * total energy  :   -39.7900218 Eh     change       -0.1038997E-02 Eh
   gradient norm :     0.0190269 Eh/α   predicted    -0.1004864E-02 (  -3.29%)
   displ. norm   :     0.3997364 α      lambda       -0.1544897E-02
   maximum displ.:     0.2373998 α      in ANC's #6, #8, #5, ...

........................................................................
.............................. CYCLE    5 ..............................
........................................................................
   1    -40.4962898 -0.404963E+02  0.304E-01    3.07       0.0  T
   2    -40.4963091 -0.193813E-04  0.172E-01    3.07       1.0  T
   3    -40.4962186  0.905782E-04  0.674E-02    3.07       1.0  T
   4    -40.4963256 -0.107039E-03  0.107E-02    3.07       1.9  T
   5    -40.4963257 -0.103958E-06  0.518E-03    3.07       3.9  T
   6    -40.4963260 -0.272961E-06  0.229E-03    3.07       8.7  T
   7    -40.4963260 -0.650747E-07  0.793E-04    3.07      25.2  T
     SCC iter.                  ...        0 min,  0.009 sec
     gradient                   ...        0 min,  0.016 sec
 * total energy  :   -39.7897432 Eh     change        0.2785719E-03 Eh
   gradient norm :     0.0187313 Eh/α   predicted    -0.8958804E-03 (-421.60%)
   displ. norm   :     0.1565521 α      lambda       -0.1760641E-02
   maximum displ.:     0.0919427 α      in ANC's #1, #2, #10, ...

........................................................................
.............................. CYCLE    6 ..............................
........................................................................
   1    -40.4922544 -0.404923E+02  0.298E-01    3.07       0.0  T
   2    -40.4922769 -0.225287E-04  0.165E-01    3.07       1.0  T
   3    -40.4921695  0.107399E-03  0.697E-02    3.07       1.0  T
   4    -40.4922985 -0.129040E-03  0.808E-03    3.07       2.5  T
   5    -40.4922988 -0.296349E-06  0.485E-03    3.07       4.1  T
   6    -40.4922991 -0.277922E-06  0.136E-03    3.07      14.7  T
   7    -40.4922991 -0.105907E-07  0.677E-04    3.07      29.5  T
     SCC iter.                  ...        0 min,  0.009 sec
     gradient                   ...        0 min,  0.016 sec
 * total energy  :   -39.7907569 Eh     change       -0.1013624E-02 Eh
   gradient norm :     0.0082183 Eh/α   predicted    -0.9018959E-03 ( -11.02%)
   displ. norm   :     0.1376247 α      lambda       -0.3439769E-03
   maximum displ.:     0.0702030 α      in ANC's #1, #6, #2, ...

........................................................................
.............................. CYCLE    7 ..............................
........................................................................
   1    -40.4897099 -0.404897E+02  0.139E-01    3.07       0.0  T
   2    -40.4897146 -0.471508E-05  0.781E-02    3.07       1.0  T
   3    -40.4896768  0.378500E-04  0.423E-02    3.07       1.0  T
   4    -40.4897217 -0.449108E-04  0.510E-03    3.07       3.9  T
   5    -40.4897218 -0.100693E-06  0.320E-03    3.07       6.3  T
   6    -40.4897219 -0.127912E-06  0.818E-04    3.07      24.4  T
   7    -40.4897219 -0.371035E-08  0.437E-04    3.07      45.7  T
     SCC iter.                  ...        0 min,  0.009 sec
     gradient                   ...        0 min,  0.016 sec
 * total energy  :   -39.7908963 Eh     change       -0.1394582E-03 Eh
   gradient norm :     0.0102641 Eh/α   predicted    -0.1752513E-03 (  25.67%)
   displ. norm   :     0.1666288 α      lambda       -0.2639115E-03
   maximum displ.:     0.0858178 α      in ANC's #2, #1, #6, ...

........................................................................
.............................. CYCLE    8 ..............................
........................................................................
   1    -40.4922464 -0.404922E+02  0.163E-01    3.07       0.0  T
   2    -40.4922531 -0.667141E-05  0.905E-02    3.07       1.0  T
   3    -40.4922463  0.684118E-05  0.200E-02    3.07       1.0  T
   4    -40.4922565 -0.101963E-04  0.417E-03    3.07       4.8  T
   5    -40.4922565 -0.797158E-07  0.224E-03    3.07       8.9  T
   6    -40.4922566 -0.432193E-07  0.815E-04    3.07      24.5  T
     SCC iter.                  ...        0 min,  0.008 sec
     gradient                   ...        0 min,  0.016 sec
 * total energy  :   -39.7909808 Eh     change       -0.8453137E-04 Eh
   gradient norm :     0.0100121 Eh/α   predicted    -0.1356229E-03 (  60.44%)
   displ. norm   :     0.1383139 α      lambda       -0.2562458E-03
   maximum displ.:     0.0643184 α      in ANC's #6, #10, #4, ...

........................................................................
.............................. CYCLE    9 ..............................
........................................................................
   1    -40.4941350 -0.404941E+02  0.923E-02    3.07       0.0  T
   2    -40.4941372 -0.215101E-05  0.524E-02    3.07       1.0  T
   3    -40.4941349  0.221472E-05  0.119E-02    3.07       1.7  T
   4    -40.4941378 -0.289536E-05  0.447E-03    3.07       4.5  T
   5    -40.4941380 -0.118101E-06  0.202E-03    3.07       9.9  T
   6    -40.4941380 -0.505681E-07  0.806E-04    3.07      24.8  T
     SCC iter.                  ...        0 min,  0.008 sec
     gradient                   ...        0 min,  0.016 sec
 * total energy  :   -39.7910744 Eh     change       -0.9357647E-04 Eh
   gradient norm :     0.0086071 Eh/α   predicted    -0.1305755E-03 (  39.54%)
   displ. norm   :     0.0668605 α      lambda       -0.9078241E-04
   maximum displ.:     0.0440641 α      in ANC's #4, #2, #1, ...

........................................................................
.............................. CYCLE   10 ..............................
........................................................................
   1    -40.4926050 -0.404926E+02  0.535E-02    3.08       0.0  T
   2    -40.4926057 -0.709652E-06  0.302E-02    3.08       1.0  T
   3    -40.4926055  0.211368E-06  0.469E-03    3.08       4.3  T
   4    -40.4926060 -0.426820E-06  0.201E-03    3.08      10.0  T
   5    -40.4926060 -0.382555E-07  0.721E-04    3.08      27.7  T
     SCC iter.                  ...        0 min,  0.007 sec
     gradient                   ...        0 min,  0.016 sec
 * total energy  :   -39.7911366 Eh     change       -0.6220062E-04 Eh
   gradient norm :     0.0024108 Eh/α   predicted    -0.4559448E-04 ( -26.70%)
   displ. norm   :     0.1228269 α      lambda       -0.9457563E-04
   maximum displ.:     0.0852622 α      in ANC's #4, #2, #3, ...

........................................................................
.............................. CYCLE   11 ..............................
........................................................................
   1    -40.4940150 -0.404940E+02  0.793E-02    3.08       0.0  T
   2    -40.4940159 -0.902290E-06  0.456E-02    3.08       1.0  T
   3    -40.4940088  0.708555E-05  0.185E-02    3.08       1.1  T
   4    -40.4940169 -0.814540E-05  0.222E-03    3.08       9.0  T
   5    -40.4940169  0.229008E-09  0.107E-03    3.08      18.7  T
   6    -40.4940169 -0.157322E-07  0.351E-04    3.08      56.9  T
   7    -40.4940169 -0.152042E-08  0.153E-04    3.08     130.8  T
     SCC iter.                  ...        0 min,  0.009 sec
     gradient                   ...        0 min,  0.017 sec
 * total energy  :   -39.7911886 Eh     change       -0.5199279E-04 Eh
   gradient norm :     0.0032424 Eh/α   predicted    -0.4800222E-04 (  -7.68%)
   displ. norm   :     0.1630428 α      lambda       -0.7712674E-04
   maximum displ.:     0.1020344 α      in ANC's #2, #4, #1, ...

........................................................................
.............................. CYCLE   12 ..............................
........................................................................
   1    -40.4924377 -0.404924E+02  0.111E-01    3.08       0.0  T
   2    -40.4924396 -0.195709E-05  0.625E-02    3.08       1.0  T
   3    -40.4924396  0.246158E-07  0.722E-03    3.08       2.8  T
   4    -40.4924403 -0.741830E-06  0.348E-03    3.08       5.7  T
   5    -40.4924404 -0.974533E-07  0.855E-04    3.08      23.4  T
   6    -40.4924404 -0.866642E-08  0.423E-04    3.08      47.2  T
     SCC iter.                  ...        0 min,  0.008 sec
     gradient                   ...        0 min,  0.017 sec
 * total energy  :   -39.7912480 Eh     change       -0.5934687E-04 Eh
   gradient norm :     0.0058638 Eh/α   predicted    -0.3959778E-04 ( -33.28%)
   displ. norm   :     0.2100152 α      lambda       -0.9214022E-04
   maximum displ.:     0.1338315 α      in ANC's #4, #2, #5, ...

........................................................................
.............................. CYCLE   13 ..............................
........................................................................
   1    -40.4919913 -0.404920E+02  0.135E-01    3.09       0.0  T
   2    -40.4919941 -0.272312E-05  0.764E-02    3.09       1.0  T
   3    -40.4919935  0.520954E-06  0.106E-02    3.09       1.9  T
   4    -40.4919948 -0.127006E-05  0.567E-03    3.09       3.5  T
   5    -40.4919951 -0.329505E-06  0.106E-03    3.09      18.9  T
   6    -40.4919951 -0.128245E-07  0.555E-04    3.09      36.1  T
     SCC iter.                  ...        0 min,  0.008 sec
     gradient                   ...        0 min,  0.016 sec
 * total energy  :   -39.7913172 Eh     change       -0.6919600E-04 Eh
   gradient norm :     0.0043820 Eh/α   predicted    -0.4810306E-04 ( -30.48%)
   displ. norm   :     0.1761942 α      lambda       -0.5939102E-04
   maximum displ.:     0.1182168 α      in ANC's #4, #2, #5, ...

........................................................................
.............................. CYCLE   14 ..............................
........................................................................
   1    -40.4924373 -0.404924E+02  0.113E-01    3.09       0.0  T
   2    -40.4924392 -0.185333E-05  0.637E-02    3.09       1.0  T
   3    -40.4924387  0.516926E-06  0.959E-03    3.09       2.1  T
   4    -40.4924397 -0.103840E-05  0.471E-03    3.09       4.2  T
   5    -40.4924399 -0.195943E-06  0.993E-04    3.09      20.1  T
   6    -40.4924399 -0.153777E-07  0.420E-04    3.09      47.6  T
     SCC iter.                  ...        0 min,  0.008 sec
     gradient                   ...        0 min,  0.016 sec
 * total energy  :   -39.7913610 Eh     change       -0.4382585E-04 Eh
   gradient norm :     0.0020459 Eh/α   predicted    -0.3061861E-04 ( -30.14%)
   displ. norm   :     0.1408337 α      lambda       -0.3663671E-04
   maximum displ.:     0.0970056 α      in ANC's #4, #2, #5, ...

........................................................................
.............................. CYCLE   15 ..............................
........................................................................
   1    -40.4931938 -0.404932E+02  0.916E-02    3.10       0.0  T
   2    -40.4931951 -0.123258E-05  0.514E-02    3.10       1.0  T
   3    -40.4931951  0.206660E-07  0.690E-03    3.10       2.9  T
   4    -40.4931953 -0.250938E-06  0.420E-03    3.10       4.8  T
   5    -40.4931955 -0.215626E-06  0.726E-04    3.10      27.5  T
   6    -40.4931955 -0.811589E-08  0.325E-04    3.10      61.5  T
     SCC iter.                  ...        0 min,  0.008 sec
     gradient                   ...        0 min,  0.017 sec
 * total energy  :   -39.7913886 Eh     change       -0.2758818E-04 Eh
   gradient norm :     0.0017415 Eh/α   predicted    -0.1868390E-04 ( -32.28%)
   displ. norm   :     0.1874759 α      lambda       -0.2427111E-04
   maximum displ.:     0.1324622 α      in ANC's #4, #2, #5, ...

........................................................................
.............................. CYCLE   16 ..............................
........................................................................
   1    -40.4935106 -0.404935E+02  0.124E-01    3.10       0.0  T
   2    -40.4935128 -0.215795E-05  0.695E-02    3.10       1.0  T
   3    -40.4935115  0.134732E-05  0.123E-02    3.10       1.6  T
   4    -40.4935134 -0.195784E-05  0.570E-03    3.10       3.5  T
   5    -40.4935137 -0.282408E-06  0.107E-03    3.10      18.6  T
   6    -40.4935137 -0.206127E-07  0.470E-04    3.10      42.6  T
   7    -40.4935137 -0.943380E-09  0.242E-04    3.10      82.7  T
     SCC iter.                  ...        0 min,  0.009 sec
     gradient                   ...        0 min,  0.017 sec
 * total energy  :   -39.7914104 Eh     change       -0.2184908E-04 Eh
   gradient norm :     0.0015689 Eh/α   predicted    -0.1233026E-04 ( -43.57%)
   displ. norm   :     0.0680407 α      lambda       -0.9917312E-05
   maximum displ.:     0.0519447 α      in ANC's #4, #2, #1, ...

........................................................................
.............................. CYCLE   17 ..............................
........................................................................
   1    -40.4947557 -0.404948E+02  0.472E-02    3.11       0.0  T
   2    -40.4947560 -0.376038E-06  0.264E-02    3.11       1.0  T
   3    -40.4947560  0.751174E-07  0.403E-03    3.11       5.0  T
   4    -40.4947561 -0.150802E-06  0.227E-03    3.11       8.8  T
   5    -40.4947562 -0.637569E-07  0.470E-04    3.11      42.6  T
   6    -40.4947562 -0.344897E-08  0.198E-04    3.11     101.2  T
     SCC iter.                  ...        0 min,  0.008 sec
     gradient                   ...        0 min,  0.017 sec
 * total energy  :   -39.7914169 Eh     change       -0.6510990E-05 Eh
   gradient norm :     0.0017715 Eh/α   predicted    -0.4969776E-05 ( -23.67%)
   displ. norm   :     0.0748311 α      lambda       -0.8499323E-05
   maximum displ.:     0.0548886 α      in ANC's #4, #2, #5, ...

........................................................................
.............................. CYCLE   18 ..............................
........................................................................
   1    -40.4938368 -0.404938E+02  0.497E-02    3.12       0.0  T
   2    -40.4938371 -0.285749E-06  0.284E-02    3.12       1.0  T
   3    -40.4938363  0.857021E-06  0.740E-03    3.12       2.7  T
   4    -40.4938373 -0.103061E-05  0.185E-03    3.12      10.8  T
   5    -40.4938373 -0.722324E-08  0.608E-04    3.12      32.9  T
   6    -40.4938373 -0.711336E-08  0.197E-04    3.12     101.8  T
     SCC iter.                  ...        0 min,  0.008 sec
     gradient                   ...        0 min,  0.017 sec
 * total energy  :   -39.7914237 Eh     change       -0.6793040E-05 Eh
   gradient norm :     0.0011092 Eh/α   predicted    -0.4263629E-05 ( -37.24%)
   displ. norm   :     0.0747521 α      lambda        0.6730427E-05
   maximum displ.:     0.0548895 α      in ANC's #4, #2, #5, ...

........................................................................
.............................. CYCLE   19 ..............................
........................................................................
   1    -40.4927267 -0.404927E+02  0.498E-02    3.12       0.0  T
   2    -40.4927270 -0.285740E-06  0.284E-02    3.12       1.0  T
   3    -40.4927261  0.921916E-06  0.761E-03    3.12       2.6  T
   4    -40.4927272 -0.110169E-05  0.186E-03    3.12      10.8  T
   5    -40.4927272 -0.646646E-08  0.627E-04    3.12      31.9  T
   6    -40.4927272 -0.753608E-08  0.200E-04    3.12     100.0  T
     SCC iter.                  ...        0 min,  0.008 sec
     gradient                   ...        0 min,  0.016 sec
 * total energy  :   -39.7914174 Eh     change        0.6335458E-05 Eh
   gradient norm :     0.0030973 Eh/α   predicted     0.3372689E-05 ( -46.76%)
   displ. norm   :     0.0544584 α      lambda       -0.1366382E-04
   maximum displ.:     0.0369975 α      in ANC's #4, #2, #5, ...

........................................................................
.............................. CYCLE   20 ..............................
........................................................................
   1    -40.4936322 -0.404936E+02  0.367E-02    3.12       0.0  T
   2    -40.4936325 -0.208528E-06  0.207E-02    3.12       1.0  T
   3    -40.4936323  0.196491E-06  0.401E-03    3.12       5.0  T
   4    -40.4936325 -0.278470E-06  0.146E-03    3.12      13.7  T
   5    -40.4936326 -0.136824E-07  0.336E-04    3.12      59.5  T
   6    -40.4936326 -0.118391E-08  0.174E-04    3.12     115.3  T
     SCC iter.                  ...        0 min,  0.008 sec
     gradient                   ...        0 min,  0.017 sec
 * total energy  :   -39.7914261 Eh     change       -0.8749047E-05 Eh
   gradient norm :     0.0011318 Eh/α   predicted    -0.6853605E-05 ( -21.66%)
   displ. norm   :     0.0575106 α      lambda       -0.5489169E-05
   maximum displ.:     0.0372737 α      in ANC's #4, #2, #6, ...
 * RMSD in coord.:     0.4269820 α      energy gain  -0.3898793E-01 Eh

generating ANC from model Hessian ...
Using Lindh-Hessian (1995)
 Shifting diagonal of input Hessian by   3.728476932246796E-003
 Lowest  eigenvalues of input Hessian
   -0.000000   -0.000000   -0.000000    0.000000    0.000000    0.000000
    0.005000    0.006802    0.007196    0.008041    0.008758    0.009299
    0.012381    0.014554    0.015294    0.022113    0.025007    0.030069
 Highest eigenvalues
    1.671849    1.830485    1.879022    2.017534    2.555520    2.556369
 

........................................................................
.............................. CYCLE   21 ..............................
........................................................................
   1    -40.4939953 -0.404940E+02  0.406E-02    3.12       0.0  T
   2    -40.4939957 -0.331240E-06  0.222E-02    3.12       1.0  T
   3    -40.4939956  0.109860E-06  0.434E-03    3.12       4.6  T
   4    -40.4939957 -0.189629E-06  0.219E-03    3.12       9.1  T
   5    -40.4939958 -0.394178E-07  0.522E-04    3.12      38.3  T
   6    -40.4939958 -0.532417E-08  0.181E-04    3.12     110.6  T
     SCC iter.                  ...        0 min,  0.008 sec
     gradient                   ...        0 min,  0.017 sec
 * total energy  :   -39.7914283 Eh     change       -0.2118564E-05 Eh
   gradient norm :     0.0008708 Eh/α   predicted     0.0000000E+00 (-100.00%)
   displ. norm   :     0.0166653 α      lambda       -0.2747427E-05
   maximum displ.:     0.0096718 α      in ANC's #5, #1, #9, ...

   *** GEOMETRY OPTIMIZATION CONVERGED AFTER 21 ITERATIONS ***

------------------------------------------------------------------------
 total energy gain   :        -0.0389901 Eh      -24.4666 kcal/mol
 total RMSD          :         0.4269820 a0        0.2259 Å
 total power (kW/mol):        -4.8746841 (step) -131.7653 (real)
------------------------------------------------------------------------

 ANCopt (total)                0 d,  0 h,  0 min,  0.777 sec
 optimizer setup                ...        0 min,  0.000 sec (  0.021%)
 model hessian                  ...        0 min,  0.017 sec (  2.161%)
 ANC generation                 ...        0 min,  0.001 sec (  0.184%)
 coordinate transformation      ...        0 min,  0.000 sec (  0.050%)
 single point calculation       ...        0 min,  0.749 sec ( 96.445%)
 optimization log               ...        0 min,  0.002 sec (  0.280%)
 hessian update                 ...        0 min,  0.000 sec (  0.034%)
 rational function              ...        0 min,  0.005 sec (  0.650%)

================
 final structure:
================
$coord
    2.77161012110398   -2.87513905196545   -0.06904609967428      C 
    5.18630478935055   -0.80514022459849   -0.66503674157924      S 
    3.12560309963635    1.76144682954917   -0.59865590384779      C 
    0.68998114590757    0.96955196827680   -0.16463403356187      C 
    0.50098241515479   -1.68560131197609    0.15109931433162      C 
   -1.97492655415419   -3.03742174199955    0.53683324749080      C 
   -2.59090184718030   -4.30084070886845   -1.81287159192292      C 
   -3.06179321517932   -5.25218062096223   -3.69379445986837      N 
   -4.09372718077615   -1.18546784569335    1.24193811993830      C 
   -4.02897816897088    1.10104520446885   -0.51231128355457      C 
   -1.60923935579460    2.64014579596802   -0.05527724166683      C 
   -1.73137644738582    3.78467228026116    2.42791072694805      C 
   -1.84202487939915    4.62442940954564    4.41522265293811      N 
    4.17537960909708    4.23852051003244   -1.04815039995657      C 
    3.21029054512740    6.44602952882223   -0.33556039052686      C 
    3.15577419207856   -4.85923030500349    0.07484449074422      H 
   -1.77172261213925   -4.49324324393944    1.99821435030096      H 
   -3.83674120735653   -0.56919649853774    3.19613283288524      H 
   -5.91764064997952   -2.14026695847529    1.10038492904203      H 
   -5.67575172666868    2.29745384236048   -0.17660890482092      H 
   -4.07275796119429    0.47385217232564   -2.47901804973624      H 
   -1.44253265770195    4.15726632830496   -1.45837080124805      H 
    5.96549050702524    4.20695169375395   -2.04172686982792      H 
    1.51059545909667    6.62076924348463    0.76277637457392      H 
    4.16692909714956    8.18346759868878   -0.78333385689417      H 
$end
           -------------------------------------------------
          |                Final Singlepoint                |
           -------------------------------------------------

          ...................................................
          :                      SETUP                      :
          :.................................................:
          :  # basis functions                  76          :
          :  # atomic orbitals                  75          :
          :  # shells                           41          :
          :  # electrons                        74          :
          :  max. iterations                   250          :
          :  Hamiltonian                  GFN2-xTB          :
          :  restarted?                      false          :
          :  GBSA solvation                  false          :
          :  PC potential                    false          :
          :  electronic temp.          300.0000000     K    :
          :  accuracy                    1.0000000          :
          :  -> integral cutoff          0.2500000E+02      :
          :  -> integral neglect         0.1000000E-07      :
          :  -> SCF convergence          0.1000000E-05 Eh   :
          :  -> wf. convergence          0.1000000E-03 e    :
          :  Broyden damping             0.4000000          :
          ...................................................

 iter      E             dE          RMSdq      gap      omega  full diag
   1    -40.4939958 -0.404940E+02  0.827E-05    3.12       0.0  T
   2    -40.4939958 -0.119371E-10  0.488E-05    3.12     409.7  T
   3    -40.4939958 -0.551026E-10  0.304E-05    3.12     657.9  T

   *** convergence criteria satisfied after 3 iterations ***

         #    Occupation            Energy/Eh            Energy/eV
      -------------------------------------------------------------
         1        2.0000           -0.7465928             -20.3158
       ...           ...                  ...                  ...
        31        2.0000           -0.4574957             -12.4491
        32        2.0000           -0.4485572             -12.2059
        33        2.0000           -0.4446910             -12.1007
        34        2.0000           -0.4384161             -11.9299
        35        2.0000           -0.4335262             -11.7968
        36        2.0000           -0.4076194             -11.0919
        37        2.0000           -0.3937113             -10.7134 (HOMO)
        38                         -0.2791564              -7.5962 (LUMO)
        39                         -0.2301433              -6.2625
        40                         -0.2243380              -6.1045
        41                         -0.2191197              -5.9625
        42                         -0.2153747              -5.8606
       ...                                ...                  ...
        75                          1.1291860              30.7267
      -------------------------------------------------------------
                  HL-Gap            0.1145548 Eh            3.1172 eV
             Fermi-level           -0.3364339 Eh           -9.1548 eV

 SCC (total)                   0 d,  0 h,  0 min,  0.033 sec
 SCC setup                      ...        0 min,  0.000 sec (  0.630%)
 Dispersion                     ...        0 min,  0.000 sec (  0.732%)
 integral evaluation            ...        0 min,  0.010 sec ( 31.744%)
 zeroth order Hamiltonian       ...        0 min,  0.000 sec (  0.576%)
 iterations                     ...        0 min,  0.005 sec ( 13.862%)
 molecular gradient             ...        0 min,  0.017 sec ( 51.205%)
 printout                       ...        0 min,  0.000 sec (  1.079%)

         :::::::::::::::::::::::::::::::::::::::::::::::::::::
         ::                     SUMMARY                     ::
         :::::::::::::::::::::::::::::::::::::::::::::::::::::
         :: total energy             -39.791428235675 Eh    ::
         :: gradient norm              0.000870441633 Eh/a0 ::
         :: HOMO-LUMO gap              3.117195285269 eV    ::
         ::.................................................::
         :: SCC energy               -40.493995794347 Eh    ::
         :: -> isotropic ES            0.018385173164 Eh    ::
         :: -> anisotropic ES          0.003725920441 Eh    ::
         :: -> anisotropic XC          0.046390362036 Eh    ::
         :: -> dispersion             -0.029457087432 Eh    ::
         :: repulsion energy           0.702240948308 Eh    ::
         :: add. restraining           0.000000000000 Eh    ::
         :::::::::::::::::::::::::::::::::::::::::::::::::::::

           -------------------------------------------------
          |                Property Printout                |
           -------------------------------------------------

    * Orbital Energies and Occupations

         #    Occupation            Energy/Eh            Energy/eV
      -------------------------------------------------------------
         1        2.0000           -0.7465928             -20.3158
       ...           ...                  ...                  ...
        25        2.0000           -0.4907827             -13.3549
        26        2.0000           -0.4800853             -13.0638
        27        2.0000           -0.4765844             -12.9685
        28        2.0000           -0.4739672             -12.8973
        29        2.0000           -0.4651179             -12.6565
        30        2.0000           -0.4613472             -12.5539
        31        2.0000           -0.4574957             -12.4491
        32        2.0000           -0.4485572             -12.2059
        33        2.0000           -0.4446910             -12.1007
        34        2.0000           -0.4384161             -11.9299
        35        2.0000           -0.4335262             -11.7968
        36        2.0000           -0.4076194             -11.0919
        37        2.0000           -0.3937113             -10.7134 (HOMO)
        38                         -0.2791564              -7.5962 (LUMO)
        39                         -0.2301433              -6.2625
        40                         -0.2243380              -6.1045
        41                         -0.2191197              -5.9625
        42                         -0.2153747              -5.8606
        43                         -0.2087074              -5.6792
        44                         -0.2052722              -5.5857
        45                         -0.1658915              -4.5141
        46                         -0.1298471              -3.5333
        47                         -0.0186973              -0.5088
        48                          0.0156904               0.4270
       ...                                ...                  ...
        75                          1.1291860              30.7267
      -------------------------------------------------------------
                  HL-Gap            0.1145548 Eh            3.1172 eV
             Fermi-level           -0.3364339 Eh           -9.1548 eV

     #   Z        covCN         q      C6AA      α(0)
     1   6 C      2.936    -0.032    28.793     8.800
     2  16 S      2.343    -0.013   141.601    20.028
     3   6 C      2.986     0.014    27.692     8.632
     4   6 C      3.174    -0.011    27.884     8.624
     5   6 C      3.184    -0.004    27.671     8.585
     6   6 C      3.861    -0.006    20.641     6.461
     7   6 C      1.920     0.115    28.271     8.587
     8   7 N      0.911    -0.234    26.136     7.394
     9   6 C      3.814    -0.046    21.386     6.582
    10   6 C      3.815    -0.046    21.389     6.582
    11   6 C      3.860    -0.004    20.619     6.458
    12   6 C      1.918     0.118    28.193     8.575
    13   7 N      0.911    -0.238    26.228     7.407
    14   6 C      2.934    -0.030    28.760     8.795
    15   6 C      2.838    -0.087    30.168     9.001
    16   1 H      0.926     0.047     2.352     2.398
    17   1 H      0.924     0.064     2.151     2.293
    18   1 H      0.924     0.049     2.339     2.392
    19   1 H      0.924     0.043     2.406     2.425
    20   1 H      0.924     0.043     2.411     2.428
    21   1 H      0.924     0.048     2.350     2.397
    22   1 H      0.924     0.067     2.116     2.275
    23   1 H      0.925     0.048     2.341     2.393
    24   1 H      0.926     0.047     2.357     2.401
    25   1 H      0.926     0.049     2.332     2.388

 Mol. C6AA /au·bohr⁶  :       9636.667132
 Mol. C8AA /au·bohr⁸  :     261451.549278
 Mol. α(0) /au        :        154.301832


Wiberg/Mayer (AO) data.
largest (>0.10) Wiberg bond orders for each atom
          total WBO             WBO to atom ...
     1  C   3.950        C    5 1.576    S    2 1.204    H   16 0.970    C    3 0.101
     2  S   2.626        C    1 1.204    C    3 1.139
     3  C   3.949        C    4 1.502    S    2 1.139    C   14 1.123    C    1 0.101
     4  C   3.980        C    3 1.502    C    5 1.246    C   11 0.970
     5  C   3.981        C    1 1.576    C    4 1.246    C    6 0.967
     6  C   3.995        C    7 1.022    C    9 0.968    C    5 0.967    H   17 0.932
     7  C   3.942        N    8 2.851    C    6 1.022
     8  N   3.012        C    7 2.851
     9  C   3.995        C   10 1.011    H   19 0.975    H   18 0.973    C    6 0.968
    10  C   3.995        C    9 1.011    H   20 0.975    H   21 0.973    C   11 0.966
    11  C   3.996        C   12 1.021    C    4 0.970    C   10 0.966    H   22 0.929
    12  C   3.942        N   13 2.844    C   11 1.021
    13  N   3.009        C   12 2.844
    14  C   3.990        C   15 1.874    C    3 1.123    H   23 0.960
    15  C   3.990        C   14 1.874    H   25 0.976    H   24 0.970
    16  H   0.997        C    1 0.970
    17  H   0.996        C    6 0.932
    18  H   0.998        C    9 0.973
    19  H   0.997        C    9 0.975
    20  H   0.997        C   10 0.975
    21  H   0.998        C   10 0.973
    22  H   0.995        C   11 0.929
    23  H   0.997        C   14 0.960
    24  H   0.998        C   15 0.970
    25  H   0.997        C   15 0.976

molecular dipole:
                 x           y           z       tot (Debye)
 q only:        0.142       0.204      -0.070
   full:        0.060       0.166      -0.039       0.460
molecular quadrupole (traceless):
                xx          xy          yy          xz          yz          zz
 q only:        6.329      -0.728      -0.716      -2.091     -13.182      -5.612
  q+dip:        6.817      -1.660       0.921      -3.423     -19.569      -7.738
   full:        7.920      -1.702       1.125      -2.998     -21.432      -9.045

           -------------------------------------------------
          |                Geometry Summary                 |
           -------------------------------------------------

      molecular mass/u    :      214.2844000
   center of mass at/Å    :        0.1751499       0.1821304      -0.0342984
  moments of inertia/u·Å² :        0.6904763E+03   0.9305529E+03   0.1398783E+04
rotational constants/cm⁻¹ :        0.2441450E-01   0.1811572E-01   0.1205164E-01

 * 21 selected distances

     #   Z        #   Z                                     value/Å
     1   6 C      2  16 S                                 1.7123485
     2  16 S      3   6 C                                 1.7421322 (max)
     3   6 C      4   6 C                                 1.3746113
     1   6 C      5   6 C                                 1.3614584
     4   6 C      5   6 C                                 1.4184761
     7   6 C      8   7 N                                 1.1429074
     6   6 C      9   6 C                                 1.5351816
     9   6 C     10   6 C                                 1.5254378
    10   6 C     11   6 C                                 1.5366971
    12   6 C     13   7 N                                 1.1431752
    14   6 C     15   6 C                                 1.3295180
     1   6 C     16   1 H                                 1.0721430 (min)
     6   6 C     17   1 H                                 1.0968586
     9   6 C     18   1 H                                 1.0928131
     9   6 C     19   1 H                                 1.0919966
    10   6 C     20   1 H                                 1.0916906
    10   6 C     21   1 H                                 1.0926227
    11   6 C     22   1 H                                 1.0970851
    14   6 C     23   1 H                                 1.0835462
    15   6 C     24   1 H                                 1.0748737
    15   6 C     25   1 H                                 1.0759814

 * 4 distinct bonds (by element types)

   Z      Z             #   av. dist./Å        max./Å        min./Å
   1 H    6 C          10     1.0869611     1.0970851     1.0721430
   6 C    6 C           7     1.4401972     1.5366971     1.3295180
   6 C    7 N           2     1.1430413     1.1431752     1.1429074
   6 C   16 S           2     1.7272403     1.7421322     1.7123485


optimized geometry written to: xtbopt.xyz


           -------------------------------------------------
          | TOTAL ENERGY              -39.791428235675 Eh   |
          | GRADIENT NORM               0.000870441633 Eh/α |
          | HOMO-LUMO GAP               3.117195285269 eV   |
           -------------------------------------------------

------------------------------------------------------------------------
 * finished run on 2021/05/19 at 11:00:05.385     
------------------------------------------------------------------------
 total:
 * wall-time:     0 d,  0 h,  0 min,  0.879 sec
 *  cpu-time:     0 d,  0 h,  0 min,  0.876 sec
 * ratio c/w:     0.997 speedup
 SCF:
 * wall-time:     0 d,  0 h,  0 min,  0.046 sec
 *  cpu-time:     0 d,  0 h,  0 min,  0.046 sec
 * ratio c/w:     0.998 speedup
 ANC optimizer:
 * wall-time:     0 d,  0 h,  0 min,  0.810 sec
 *  cpu-time:     0 d,  0 h,  0 min,  0.808 sec
 * ratio c/w:     0.998 speedup

