      -----------------------------------------------------------      
     |                   =====================                   |     
     |                           x T B                           |     
     |                   =====================                   |     
     |                         S. Grimme                         |     
     |          Mulliken Center for Theoretical Chemistry        |     
     |                    University of Bonn                     |     
     |                Version 6.2 RC2 (SAW190805)                |     
      -----------------------------------------------------------      

   This program is distributed in the hope that it will be useful,
   but WITHOUT ANY WARRANTY; without even the implied warranty of
   MERCHANTABILITY or FITNESS FOR A PARTICULAR PURPOSE.
   
   FOR NON-COMMERCIAL, ACADEMIA USE ONLY.
   
   Cite this work as:
   * S. Grimme, C. Bannwarth, P. Shushkov, J. Chem. Theory Comput., 2017,
     13, 1989-2009. DOI: 10.1021/acs.jctc.7b00118
   * C. Bannwarth, S. Ehlert and S. Grimme., J. Chem. Theory Comput., 2019,
     15, 1652-1671. DOI: 10.1021/acs.jctc.8b01176
   * P. Pracht, E. Caldeweyher, S. Ehlert, S. Grimme, ChemRxiv, 2019, preprint.
     DOI: 10.26434/chemrxiv.8326202.v1
   
   for DFT-D4:
   * E. Caldeweyher, C. Bannwarth and S. Grimme, J. Chem. Phys., 2017,
     147, 034112. DOI: 10.1063/1.4993215
   * E. Caldeweyher, S. Ehlert, A. Hansen, H. Neugebauer, S. Spicher,
     C. Bannwarth and S. Grimme, J. Chem. Phys., 2019, 150, 154122.
     DOI: 10.1063/1.5090222
   
   for sTDA-xTB:
   * S. Grimme and C. Bannwarth, J. Chem. Phys., 2016, 145, 054103.
     DOI: 10.1063/1.4959605
   
   in the mass-spec context:
   * V. Asgeirsson, C. Bauer and S. Grimme, Chem. Sci., 2017, 8, 4879.
     DOI: 10.1039/c7sc00601b
   
   for metadynamics refer to:
   * S. Grimme, J. Chem. Theory Comput., 2019, 155, 2847-2862
     DOI: 10.1021/acs.jctc.9b00143
   
   with help from (in alphabetical order)
   C. Bannwarth, F. Bohle, G. Brandenburg, E. Caldeweyher, M. Checinski,
   S. Dohm, S. Ehlert, S. Ehrlich, F. März, H. Neugebauer, J. Pisarek,
   P. Pracht, P. Shushkov, and S. Spicher.
   
 * started run on 2021/05/19 at 11:00:05.404     

           -------------------------------------------------
          |                Calculation Setup                |
           -------------------------------------------------

          program call               : /ihome/ghutchison/geoffh/xtb/xtb 673.xyz -opt
          hostname                   : smp-n144
          coordinate file            : 673.xyz
          omp threads                :                     1
          number of atoms            :                    21
          number of electrons        :                    64
          charge                     :                     0
          spin                       :                   0.0
          first test random number   :      0.33246523014248


########################################################################
# WARNING! Please study the warnings concerning your input carefully
#  - the use of '-opt' is discouraged, please use '--opt' next time
########################################################################

           ------------------------------------------------- 
          |                 G F N 2 - x T B                 |
          | Geometry, Frequencies, Noncovalent interactions |
          |            JCTC 2019 parametrisation            |
           ------------------------------------------------- 
             KAB for C  - Si     :                1.0500
             KAB for H  - Pd     :                0.9500
             k(s)              :                1.8500
             k(p)              :                2.2300
             k(d)              :                2.2300
             k(f)              :                2.0000
             kEN (H0ij)        :               -2.0000
             D4 a1             :                0.5200
             D4 a2             :                5.0000
             D4 s6             :                1.0000
             D4 s8             :                2.7000
             D4 s9             :                5.0000
             alphaj            :                2.0000

  Z AO/shell   Hii/eV     exponent
  1     Wed Apr 25 08:07:45 CEST 2018   EN: 2.200 GM2: 0.406  GM3: 0.0800  RAES: 1.40
     1s    -10.707211    1.230000
  6     Wed Apr 25 08:07:45 CEST 2018   EN: 2.550 GM2: 0.538  GM3: 0.1500  RAES: 3.00
     2s    -13.970922    2.096432
     2p    -10.063292    1.800000
  7     Wed Apr 25 08:07:45 CEST 2018   EN: 3.040 GM2: 0.461  GM3:-0.0640  RAES: 1.90
     2s    -16.686243    2.339881
     2p    -12.523956    2.014332
 16     Tue Apr 24 11:44:34 CEST 2018   EN: 2.580 GM2: 0.340  GM3:-0.0502  RAES: 3.10
     3s    -20.029654    1.981333
     3p    -11.377694    2.025643
     3d     -0.420282    1.702555

           ------------------------------------------------- 
          |        Self-Consistent Charge Iterations        |
           ------------------------------------------------- 

          ...................................................
          :                      SETUP                      :
          :.................................................:
          :  # basis functions                  66          :
          :  # atomic orbitals                  65          :
          :  # shells                           35          :
          :  # electrons                        64          :
          :  max. iterations                   250          :
          :  Hamiltonian                  GFN2-xTB          :
          :  restarted?                      false          :
          :  GBSA solvation                  false          :
          :  PC potential                    false          :
          :  electronic temp.          300.0000000     K    :
          :  accuracy                    1.0000000          :
          :  -> integral cutoff          0.2500000E+02      :
          :  -> integral neglect         0.1000000E-07      :
          :  -> SCF convergence          0.1000000E-05 Eh   :
          :  -> wf. convergence          0.1000000E-03 e    :
          :  Broyden damping             0.4000000          :
          ...................................................

 iter      E             dE          RMSdq      gap      omega  full diag
   1    -34.9103259 -0.349103E+02  0.531E+00    3.77       0.0  T
   2    -34.8800333  0.302925E-01  0.373E+00    3.80       1.0  T
   3    -34.8073872  0.726461E-01  0.308E+00    3.82       1.0  T
   4    -34.9468787 -0.139491E+00  0.917E-01    3.78       1.0  T
   5    -34.9606584 -0.137798E-01  0.355E-01    3.77       1.0  T
   6    -34.9617753 -0.111690E-02  0.832E-02    3.78       1.0  T
   7    -34.9618034 -0.280114E-04  0.329E-02    3.78       1.0  T
   8    -34.9618020  0.133642E-05  0.144E-02    3.78       1.5  T
   9    -34.9618048 -0.278189E-05  0.614E-03    3.78       3.6  T
  10    -34.9618052 -0.356533E-06  0.170E-03    3.78      12.9  T
  11    -34.9618052 -0.922087E-08  0.701E-04    3.78      31.1  T
  12    -34.9618052 -0.368190E-08  0.337E-04    3.78      64.8  T

   *** convergence criteria satisfied after 12 iterations ***

         #    Occupation            Energy/Eh            Energy/eV
      -------------------------------------------------------------
         1        2.0000           -0.7501833             -20.4135
       ...           ...                  ...                  ...
        26        2.0000           -0.4651291             -12.6568
        27        2.0000           -0.4574097             -12.4468
        28        2.0000           -0.4503522             -12.2547
        29        2.0000           -0.4431927             -12.0599
        30        2.0000           -0.4383561             -11.9283
        31        2.0000           -0.4095707             -11.1450
        32        2.0000           -0.4064143             -11.0591 (HOMO)
        33                         -0.2675115              -7.2794 (LUMO)
        34                         -0.2617462              -7.1225
        35                         -0.2581901              -7.0257
        36                         -0.2316219              -6.3028
        37                         -0.2268202              -6.1721
       ...                                ...                  ...
        65                          1.0104230              27.4950
      -------------------------------------------------------------
                  HL-Gap            0.1389028 Eh            3.7797 eV
             Fermi-level           -0.3369629 Eh           -9.1692 eV

 SCC (total)                   0 d,  0 h,  0 min,  0.036 sec
 SCC setup                      ...        0 min,  0.000 sec (  0.780%)
 Dispersion                     ...        0 min,  0.000 sec (  0.852%)
 integral evaluation            ...        0 min,  0.009 sec ( 23.956%)
 zeroth order Hamiltonian       ...        0 min,  0.000 sec (  0.494%)
 iterations                     ...        0 min,  0.013 sec ( 37.411%)
 molecular gradient             ...        0 min,  0.013 sec ( 35.353%)
 printout                       ...        0 min,  0.000 sec (  1.006%)

         :::::::::::::::::::::::::::::::::::::::::::::::::::::
         ::                     SUMMARY                     ::
         :::::::::::::::::::::::::::::::::::::::::::::::::::::
         :: total energy             -34.469346028247 Eh    ::
         :: gradient norm              0.273218941771 Eh/a0 ::
         :: HOMO-LUMO gap              3.779737047560 eV    ::
         ::.................................................::
         :: SCC energy               -34.961805167450 Eh    ::
         :: -> isotropic ES            0.017136580553 Eh    ::
         :: -> anisotropic ES          0.005005042987 Eh    ::
         :: -> anisotropic XC          0.044080667802 Eh    ::
         :: -> dispersion             -0.022568339251 Eh    ::
         :: repulsion energy           0.492245102195 Eh    ::
         :: add. restraining           0.000000000000 Eh    ::
         :::::::::::::::::::::::::::::::::::::::::::::::::::::

      ----------------------------------------------------------- 
     |                   =====================                   |
     |                        A N C O P T                        |
     |                   =====================                   |
     |               Approximate Normal Coordinate               |
     |                Rational Function Optimizer                |
      ----------------------------------------------------------- 

          ...................................................
          :                      SETUP                      :
          :.................................................:
          :   optimization level            normal          :
          :   max. optcycles                   200          :
          :   ANC micro-cycles                  20          :
          :   degrees of freedom                57          :
          :.................................................:
          :   RF solver                   davidson          :
          :   input Hessian                  false          :
          :   write xtbopt.log                true          :
          :   linear?                        false          :
          :   energy convergence         0.5000000E-05 Eh   :
          :   grad. convergence          0.1000000E-02 Eh/α :
          :   maximium RF displ.         2.0000000          :
          :   Hlow (freq-cutoff)         0.5000000E-02      :
          :   Hmax (freq-cutoff)         5.0000000          :
          :   S6 in model hess.         20.0000000          :
          ...................................................

generating ANC from model Hessian ...
Using Lindh-Hessian (1995)
 Shifting diagonal of input Hessian by   3.803732426477129E-003
 Lowest  eigenvalues of input Hessian
   -0.000000    0.000000    0.000000    0.000000    0.000000    0.000000
    0.005000    0.006638    0.007583    0.009416    0.010195    0.014082
    0.018790    0.023403    0.026519    0.029214    0.035648    0.045590
 Highest eigenvalues
    1.488912    1.622306    1.723517    1.788509    1.960418    2.424970
 

........................................................................
.............................. CYCLE    1 ..............................
........................................................................
   1    -34.9618052 -0.349618E+02  0.151E-04    3.78       0.0  T
   2    -34.9618052  0.457661E-10  0.116E-04    3.78     187.5  T
   3    -34.9618052 -0.157044E-09  0.773E-05    3.78     282.3  T
     SCC iter.                  ...        0 min,  0.004 sec
     gradient                   ...        0 min,  0.013 sec
 * total energy  :   -34.4693460 Eh     change        0.4431675E-07 Eh
   gradient norm :     0.2732184 Eh/α   predicted     0.0000000E+00 (-100.00%)
   displ. norm   :     0.3246417 α      lambda       -0.5663406E-01
   maximum displ.:     0.1134261 α      in ANC's #56, #25, #13, ...

........................................................................
.............................. CYCLE    2 ..............................
........................................................................
   1    -35.0880693 -0.350881E+02  0.493E-01    3.88       0.0  T
   2    -35.0882988 -0.229497E-03  0.288E-01    3.88       1.0  T
   3    -35.0879191  0.379694E-03  0.218E-01    3.89       1.0  T
   4    -35.0885073 -0.588284E-03  0.359E-02    3.89       1.0  T
   5    -35.0885270 -0.196208E-04  0.123E-02    3.89       1.8  T
   6    -35.0885275 -0.569951E-06  0.599E-03    3.89       3.6  T
   7    -35.0885280 -0.449270E-06  0.286E-03    3.89       7.6  T
     SCC iter.                  ...        0 min,  0.007 sec
     gradient                   ...        0 min,  0.012 sec
 * total energy  :   -34.5021798 Eh     change       -0.3283378E-01 Eh
   gradient norm :     0.0428680 Eh/α   predicted    -0.3130142E-01 (  -4.67%)
   displ. norm   :     0.3889181 α      lambda       -0.4845585E-02
   maximum displ.:     0.2509445 α      in ANC's #5, #4, #9, ...

........................................................................
.............................. CYCLE    3 ..............................
........................................................................
   1    -35.0998727 -0.350999E+02  0.291E-01    3.91       0.0  T
   2    -35.0998950 -0.222687E-04  0.176E-01    3.92       1.0  T
   3    -35.0996943  0.200641E-03  0.123E-01    3.91       1.0  T
   4    -35.0999654 -0.271079E-03  0.179E-02    3.91       1.2  T
   5    -35.0999674 -0.203939E-05  0.690E-03    3.91       3.2  T
   6    -35.0999675 -0.872661E-07  0.320E-03    3.91       6.8  T
   7    -35.0999677 -0.162942E-06  0.878E-04    3.91      24.8  T
     SCC iter.                  ...        0 min,  0.007 sec
     gradient                   ...        0 min,  0.012 sec
 * total energy  :   -34.5056079 Eh     change       -0.3428117E-02 Eh
   gradient norm :     0.0138705 Eh/α   predicted    -0.2789259E-02 ( -18.64%)
   displ. norm   :     0.4704589 α      lambda       -0.2631815E-02
   maximum displ.:     0.3202980 α      in ANC's #5, #7, #4, ...

........................................................................
.............................. CYCLE    4 ..............................
........................................................................
   1    -35.1048013 -0.351048E+02  0.328E-01    3.92       0.0  T
   2    -35.1048200 -0.187064E-04  0.190E-01    3.93       1.0  T
   3    -35.1045911  0.228908E-03  0.116E-01    3.92       1.0  T
   4    -35.1048590 -0.267826E-03  0.127E-02    3.93       1.7  T
   5    -35.1048598 -0.888758E-06  0.496E-03    3.93       4.4  T
   6    -35.1048599 -0.212441E-07  0.193E-03    3.93      11.3  T
   7    -35.1048599 -0.432195E-07  0.838E-04    3.93      26.0  T
     SCC iter.                  ...        0 min,  0.007 sec
     gradient                   ...        0 min,  0.012 sec
 * total energy  :   -34.5074552 Eh     change       -0.1847307E-02 Eh
   gradient norm :     0.0160703 Eh/α   predicted    -0.1607171E-02 ( -13.00%)
   displ. norm   :     0.5405810 α      lambda       -0.2323816E-02
   maximum displ.:     0.3711172 α      in ANC's #5, #7, #4, ...

........................................................................
.............................. CYCLE    5 ..............................
........................................................................
   1    -35.1037608 -0.351038E+02  0.383E-01    3.92       0.0  T
   2    -35.1037896 -0.288362E-04  0.217E-01    3.92       1.0  T
   3    -35.1037587  0.309095E-04  0.515E-02    3.92       1.0  T
   4    -35.1038040 -0.452312E-04  0.126E-02    3.92       1.7  T
   5    -35.1038041 -0.140876E-06  0.715E-03    3.92       3.1  T
   6    -35.1038048 -0.657637E-06  0.199E-03    3.92      10.9  T
   7    -35.1038048 -0.424670E-07  0.861E-04    3.92      25.3  T
     SCC iter.                  ...        0 min,  0.007 sec
     gradient                   ...        0 min,  0.012 sec
 * total energy  :   -34.5086519 Eh     change       -0.1196734E-02 Eh
   gradient norm :     0.0256854 Eh/α   predicted    -0.1501452E-02 (  25.46%)
   displ. norm   :     0.3921220 α      lambda       -0.1759589E-02
   maximum displ.:     0.2584928 α      in ANC's #5, #1, #2, ...

........................................................................
.............................. CYCLE    6 ..............................
........................................................................
   1    -35.1020528 -0.351021E+02  0.352E-01    3.92       0.0  T
   2    -35.1020803 -0.274258E-04  0.194E-01    3.92       1.0  T
   3    -35.1020326  0.476179E-04  0.559E-02    3.93       1.0  T
   4    -35.1020959 -0.632234E-04  0.112E-02    3.92       1.9  T
   5    -35.1020960 -0.162571E-06  0.534E-03    3.92       4.1  T
   6    -35.1020964 -0.338409E-06  0.160E-03    3.92      13.6  T
     SCC iter.                  ...        0 min,  0.007 sec
     gradient                   ...        0 min,  0.012 sec
 * total energy  :   -34.5098038 Eh     change       -0.1151831E-02 Eh
   gradient norm :     0.0250083 Eh/α   predicted    -0.1015089E-02 ( -11.87%)
   displ. norm   :     0.4186303 α      lambda       -0.1927314E-02
   maximum displ.:     0.2407878 α      in ANC's #5, #7, #4, ...

........................................................................
.............................. CYCLE    7 ..............................
........................................................................
   1    -35.1114794 -0.351115E+02  0.473E-01    3.91       0.0  T
   2    -35.1115505 -0.710799E-04  0.262E-01    3.92       1.0  T
   3    -35.1114178  0.132746E-03  0.906E-02    3.92       1.0  T
   4    -35.1115852 -0.167436E-03  0.200E-02    3.92       1.1  T
   5    -35.1115876 -0.243665E-05  0.727E-03    3.92       3.0  T
   6    -35.1115878 -0.159856E-06  0.374E-03    3.92       5.8  T
   7    -35.1115880 -0.195195E-06  0.128E-03    3.92      17.0  T
     SCC iter.                  ...        0 min,  0.007 sec
     gradient                   ...        0 min,  0.012 sec
 * total energy  :   -34.5087309 Eh     change        0.1072896E-02 Eh
   gradient norm :     0.0655092 Eh/α   predicted    -0.1132541E-02 (-205.56%)
   displ. norm   :     0.1639303 α      lambda       -0.3218529E-02
   maximum displ.:     0.0910353 α      in ANC's #1, #2, #7, ...

........................................................................
.............................. CYCLE    8 ..............................
........................................................................
   1    -35.1092239 -0.351092E+02  0.355E-01    3.93       0.0  T
   2    -35.1092622 -0.382645E-04  0.197E-01    3.92       1.0  T
   3    -35.1092507  0.114819E-04  0.365E-02    3.93       1.0  T
   4    -35.1092766 -0.259153E-04  0.107E-02    3.93       2.0  T
   5    -35.1092774 -0.779098E-06  0.486E-03    3.93       4.5  T
   6    -35.1092776 -0.205148E-06  0.189E-03    3.93      11.6  T
     SCC iter.                  ...        0 min,  0.006 sec
     gradient                   ...        0 min,  0.012 sec
 * total energy  :   -34.5105265 Eh     change       -0.1795657E-02 Eh
   gradient norm :     0.0068758 Eh/α   predicted    -0.1652512E-02 (  -7.97%)
   displ. norm   :     0.2003840 α      lambda       -0.2965867E-03
   maximum displ.:     0.1328215 α      in ANC's #5, #7, #1, ...

........................................................................
.............................. CYCLE    9 ..............................
........................................................................
   1    -35.1020001 -0.351020E+02  0.159E-01    3.93       0.0  T
   2    -35.1020053 -0.516434E-05  0.894E-02    3.93       1.0  T
   3    -35.1020002  0.503979E-05  0.203E-02    3.93       1.1  T
   4    -35.1020075 -0.730646E-05  0.543E-03    3.93       4.0  T
   5    -35.1020076 -0.100260E-06  0.263E-03    3.93       8.3  T
   6    -35.1020077 -0.730015E-07  0.898E-04    3.93      24.3  T
     SCC iter.                  ...        0 min,  0.007 sec
     gradient                   ...        0 min,  0.012 sec
 * total energy  :   -34.5105373 Eh     change       -0.1076442E-04 Eh
   gradient norm :     0.0171667 Eh/α   predicted    -0.1542486E-03 (1332.95%)
   displ. norm   :     0.0679506 α      lambda       -0.2250880E-03
   maximum displ.:     0.0390224 α      in ANC's #5, #4, #7, ...

........................................................................
.............................. CYCLE   10 ..............................
........................................................................
   1    -35.1087498 -0.351087E+02  0.518E-02    3.93       0.0  T
   2    -35.1087509 -0.106719E-05  0.291E-02    3.93       1.0  T
   3    -35.1087507  0.164523E-06  0.519E-03    3.93       4.2  T
   4    -35.1087510 -0.271567E-06  0.288E-03    3.93       7.6  T
   5    -35.1087511 -0.106669E-06  0.104E-03    3.93      21.1  T
     SCC iter.                  ...        0 min,  0.006 sec
     gradient                   ...        0 min,  0.012 sec
 * total energy  :   -34.5106611 Eh     change       -0.1238543E-03 Eh
   gradient norm :     0.0033901 Eh/α   predicted    -0.1130656E-03 (  -8.71%)
   displ. norm   :     0.0548952 α      lambda       -0.3895806E-04
   maximum displ.:     0.0368422 α      in ANC's #1, #5, #4, ...

........................................................................
.............................. CYCLE   11 ..............................
........................................................................
   1    -35.1091193 -0.351091E+02  0.529E-02    3.93       0.0  T
   2    -35.1091201 -0.805825E-06  0.284E-02    3.93       1.0  T
   3    -35.1091192  0.868756E-06  0.802E-03    3.93       2.7  T
   4    -35.1091204 -0.117303E-05  0.257E-03    3.93       8.5  T
   5    -35.1091204 -0.367545E-07  0.115E-03    3.93      19.0  T
   6    -35.1091204 -0.125441E-07  0.424E-04    3.93      51.5  T
   7    -35.1091204 -0.237196E-08  0.123E-04    3.93     177.4  T
     SCC iter.                  ...        0 min,  0.007 sec
     gradient                   ...        0 min,  0.013 sec
 * total energy  :   -34.5106869 Eh     change       -0.2577004E-04 Eh
   gradient norm :     0.0036935 Eh/α   predicted    -0.1954127E-04 ( -24.17%)
   displ. norm   :     0.0901914 α      lambda       -0.4409947E-04
   maximum displ.:     0.0612294 α      in ANC's #1, #5, #7, ...

........................................................................
.............................. CYCLE   12 ..............................
........................................................................
   1    -35.1106808 -0.351107E+02  0.717E-02    3.93       0.0  T
   2    -35.1106821 -0.134244E-05  0.391E-02    3.93       1.0  T
   3    -35.1106814  0.668795E-06  0.865E-03    3.93       2.5  T
   4    -35.1106826 -0.111331E-05  0.324E-03    3.93       6.7  T
   5    -35.1106826 -0.502580E-07  0.120E-03    3.93      18.3  T
   6    -35.1106826 -0.116667E-07  0.603E-04    3.93      36.2  T
   7    -35.1106826 -0.622937E-08  0.168E-04    3.93     130.2  T
     SCC iter.                  ...        0 min,  0.007 sec
     gradient                   ...        0 min,  0.013 sec
 * total energy  :   -34.5107141 Eh     change       -0.2717641E-04 Eh
   gradient norm :     0.0026363 Eh/α   predicted    -0.2223089E-04 ( -18.20%)
   displ. norm   :     0.0767387 α      lambda       -0.2793794E-04
   maximum displ.:     0.0596935 α      in ANC's #1, #3, #5, ...

........................................................................
.............................. CYCLE   13 ..............................
........................................................................
   1    -35.1102086 -0.351102E+02  0.733E-02    3.93       0.0  T
   2    -35.1102099 -0.123179E-05  0.397E-02    3.93       1.0  T
   3    -35.1102093  0.539846E-06  0.821E-03    3.93       2.7  T
   4    -35.1102103 -0.978766E-06  0.335E-03    3.93       6.5  T
   5    -35.1102104 -0.588445E-07  0.104E-03    3.93      21.1  T
   6    -35.1102104 -0.167838E-07  0.370E-04    3.93      58.9  T
   7    -35.1102104 -0.114368E-08  0.167E-04    3.93     130.8  T
     SCC iter.                  ...        0 min,  0.007 sec
     gradient                   ...        0 min,  0.013 sec
 * total energy  :   -34.5107342 Eh     change       -0.2007385E-04 Eh
   gradient norm :     0.0026332 Eh/α   predicted    -0.1405617E-04 ( -29.98%)
   displ. norm   :     0.1242328 α      lambda       -0.3785320E-04
   maximum displ.:     0.0903153 α      in ANC's #1, #3, #4, ...

........................................................................
.............................. CYCLE   14 ..............................
........................................................................
   1    -35.1095046 -0.351095E+02  0.939E-02    3.93       0.0  T
   2    -35.1095062 -0.160892E-05  0.518E-02    3.93       1.0  T
   3    -35.1095066 -0.363219E-06  0.570E-03    3.93       3.8  T
   4    -35.1095066 -0.164742E-07  0.407E-03    3.93       5.4  T
   5    -35.1095068 -0.211742E-06  0.745E-04    3.93      29.3  T
   6    -35.1095068 -0.478023E-08  0.381E-04    3.93      57.2  T
     SCC iter.                  ...        0 min,  0.007 sec
     gradient                   ...        0 min,  0.013 sec
 * total energy  :   -34.5107580 Eh     change       -0.2387637E-04 Eh
   gradient norm :     0.0026015 Eh/α   predicted    -0.1922070E-04 ( -19.50%)
   displ. norm   :     0.0939050 α      lambda       -0.2700920E-04
   maximum displ.:     0.0583697 α      in ANC's #3, #1, #4, ...

........................................................................
.............................. CYCLE   15 ..............................
........................................................................
   1    -35.1094567 -0.351095E+02  0.646E-02    3.93       0.0  T
   2    -35.1094575 -0.829102E-06  0.355E-02    3.93       1.0  T
   3    -35.1094552  0.231559E-05  0.128E-02    3.93       1.7  T
   4    -35.1094580 -0.279606E-05  0.351E-03    3.93       6.2  T
   5    -35.1094580 -0.405405E-07  0.887E-04    3.93      24.6  T
   6    -35.1094580 -0.880613E-08  0.372E-04    3.93      58.7  T
     SCC iter.                  ...        0 min,  0.006 sec
     gradient                   ...        0 min,  0.013 sec
 * total energy  :   -34.5107717 Eh     change       -0.1368498E-04 Eh
   gradient norm :     0.0022313 Eh/α   predicted    -0.1362909E-04 (  -0.41%)
   displ. norm   :     0.0543857 α      lambda       -0.1367765E-04
   maximum displ.:     0.0362282 α      in ANC's #3, #1, #4, ...

........................................................................
.............................. CYCLE   16 ..............................
........................................................................
   1    -35.1095252 -0.351095E+02  0.437E-02    3.93       0.0  T
   2    -35.1095257 -0.420371E-06  0.238E-02    3.93       1.0  T
   3    -35.1095255  0.139969E-06  0.473E-03    3.93       4.6  T
   4    -35.1095258 -0.267521E-06  0.209E-03    3.93      10.4  T
   5    -35.1095258 -0.291351E-07  0.623E-04    3.93      35.0  T
   6    -35.1095258 -0.426455E-08  0.280E-04    3.93      77.8  T
     SCC iter.                  ...        0 min,  0.006 sec
     gradient                   ...        0 min,  0.013 sec
 * total energy  :   -34.5107808 Eh     change       -0.9065184E-05 Eh
   gradient norm :     0.0022246 Eh/α   predicted    -0.6859709E-05 ( -24.33%)
   displ. norm   :     0.0433934 α      lambda       -0.1181753E-04
   maximum displ.:     0.0315177 α      in ANC's #3, #1, #4, ...

........................................................................
.............................. CYCLE   17 ..............................
........................................................................
   1    -35.1097737 -0.351098E+02  0.360E-02    3.93       0.0  T
   2    -35.1097740 -0.290022E-06  0.201E-02    3.93       1.1  T
   3    -35.1097737  0.297737E-06  0.492E-03    3.93       4.4  T
   4    -35.1097742 -0.430171E-06  0.106E-03    3.93      20.6  T
   5    -35.1097742 -0.682442E-08  0.496E-04    3.93      44.0  T
   6    -35.1097742 -0.528587E-09  0.257E-04    3.93      84.8  T
     SCC iter.                  ...        0 min,  0.006 sec
     gradient                   ...        0 min,  0.013 sec
 * total energy  :   -34.5107892 Eh     change       -0.8437183E-05 Eh
   gradient norm :     0.0019953 Eh/α   predicted    -0.5923146E-05 ( -29.80%)
   displ. norm   :     0.1012070 α      lambda       -0.1129139E-04
   maximum displ.:     0.0678359 α      in ANC's #3, #1, #4, ...

........................................................................
.............................. CYCLE   18 ..............................
........................................................................
   1    -35.1095407 -0.351095E+02  0.820E-02    3.93       0.0  T
   2    -35.1095421 -0.134333E-05  0.452E-02    3.93       1.0  T
   3    -35.1095418  0.275581E-06  0.759E-03    3.93       2.9  T
   4    -35.1095426 -0.754041E-06  0.325E-03    3.93       6.7  T
   5    -35.1095426 -0.635579E-07  0.941E-04    3.93      23.2  T
   6    -35.1095426 -0.778117E-08  0.439E-04    3.93      49.7  T
     SCC iter.                  ...        0 min,  0.006 sec
     gradient                   ...        0 min,  0.013 sec
 * total energy  :   -34.5107970 Eh     change       -0.7782407E-05 Eh
   gradient norm :     0.0021544 Eh/α   predicted    -0.5674628E-05 ( -27.08%)
   displ. norm   :     0.0157115 α      lambda       -0.5184319E-05
   maximum displ.:     0.0115679 α      in ANC's #3, #1, #7, ...

........................................................................
.............................. CYCLE   19 ..............................
........................................................................
   1    -35.1098276 -0.351098E+02  0.135E-02    3.93       0.0  T
   2    -35.1098277 -0.556102E-07  0.746E-03    3.93       2.9  T
   3    -35.1098275  0.159698E-06  0.332E-03    3.93       6.6  T
   4    -35.1098277 -0.193161E-06  0.697E-04    3.93      31.3  T
   5    -35.1098277 -0.337358E-08  0.251E-04    3.93      87.0  T
     SCC iter.                  ...        0 min,  0.006 sec
     gradient                   ...        0 min,  0.013 sec
 * total energy  :   -34.5108001 Eh     change       -0.3125135E-05 Eh
   gradient norm :     0.0009504 Eh/α   predicted    -0.2594133E-05 ( -16.99%)
   displ. norm   :     0.0302572 α      lambda       -0.3395474E-05
   maximum displ.:     0.0191894 α      in ANC's #1, #3, #7, ...

   *** GEOMETRY OPTIMIZATION CONVERGED AFTER 19 ITERATIONS ***

------------------------------------------------------------------------
 total energy gain   :        -0.0414541 Eh      -26.0128 kcal/mol
 total RMSD          :         0.5341942 a0        0.2827 Å
 total power (kW/mol):        -5.7283009 (step) -201.6790 (real)
------------------------------------------------------------------------

 ANCopt (total)                0 d,  0 h,  0 min,  0.540 sec
 optimizer setup                ...        0 min,  0.000 sec (  0.028%)
 model hessian                  ...        0 min,  0.006 sec (  1.136%)
 ANC generation                 ...        0 min,  0.001 sec (  0.118%)
 coordinate transformation      ...        0 min,  0.000 sec (  0.055%)
 single point calculation       ...        0 min,  0.525 sec ( 97.194%)
 optimization log               ...        0 min,  0.002 sec (  0.315%)
 hessian update                 ...        0 min,  0.000 sec (  0.043%)
 rational function              ...        0 min,  0.005 sec (  0.888%)

================
 final structure:
================
$coord
    3.04865068902025    1.99287315158332   -0.21222512512489      C 
    5.30867794316533   -0.33494143143410   -0.11211155472581      S 
    3.02058613133728   -2.62837349220583    0.06877157383441      C 
    0.64876549620718   -1.64098228386905    0.06100076750959      C 
    0.66474629716584    1.03983958613413   -0.11947112457662      C 
   -1.72444386493034    2.58275824572680   -0.08302173860760      C 
   -1.99996713405297    3.62246017069415    2.43509748287962      C 
   -2.20139698910960    4.39433696973185    4.44197181463528      N 
   -4.02814815675556    0.94026950142377   -0.73192693452993      C 
   -4.01576324848797   -1.47325628641808    0.84673148641347      C 
   -1.76232680031371   -3.14908036159002    0.10842315789839      C 
   -2.14855766341923   -4.17189429649725   -2.40149343331453      C 
   -2.44075007793034   -4.92520211175582   -4.40429071750919      N 
    3.61467422608577    3.93443937280113   -0.32724598447515      H 
    3.55984744652083   -4.57870612587673    0.16488745861096      H 
   -1.57263835210462    4.17200547737616   -1.40392701038247      H 
   -3.97301863640593    0.45937932847801   -2.73972847849929      H 
   -5.75574884751217    2.00877637031313   -0.37133796583253      H 
   -5.77194822207217   -2.51671937456831    0.55545464335069      H 
   -3.87327539649358   -0.99202705091268    2.85068755897240      H 
   -1.58623534874174   -4.74466026833574    1.41808709424408      H 
$end
           -------------------------------------------------
          |                Final Singlepoint                |
           -------------------------------------------------

          ...................................................
          :                      SETUP                      :
          :.................................................:
          :  # basis functions                  66          :
          :  # atomic orbitals                  65          :
          :  # shells                           35          :
          :  # electrons                        64          :
          :  max. iterations                   250          :
          :  Hamiltonian                  GFN2-xTB          :
          :  restarted?                      false          :
          :  GBSA solvation                  false          :
          :  PC potential                    false          :
          :  electronic temp.          300.0000000     K    :
          :  accuracy                    1.0000000          :
          :  -> integral cutoff          0.2500000E+02      :
          :  -> integral neglect         0.1000000E-07      :
          :  -> SCF convergence          0.1000000E-05 Eh   :
          :  -> wf. convergence          0.1000000E-03 e    :
          :  Broyden damping             0.4000000          :
          ...................................................

 iter      E             dE          RMSdq      gap      omega  full diag
   1    -35.1098277 -0.351098E+02  0.136E-04    3.93       0.0  T
   2    -35.1098277 -0.466542E-10  0.819E-05    3.93     266.5  T
   3    -35.1098277 -0.113175E-09  0.383E-05    3.93     570.5  T

   *** convergence criteria satisfied after 3 iterations ***

         #    Occupation            Energy/Eh            Energy/eV
      -------------------------------------------------------------
         1        2.0000           -0.7484395             -20.3661
       ...           ...                  ...                  ...
        26        2.0000           -0.4674351             -12.7196
        27        2.0000           -0.4586876             -12.4815
        28        2.0000           -0.4536389             -12.3441
        29        2.0000           -0.4392406             -11.9523
        30        2.0000           -0.4373320             -11.9004
        31        2.0000           -0.4092081             -11.1351
        32        2.0000           -0.4088853             -11.1263 (HOMO)
        33                         -0.2644462              -7.1959 (LUMO)
        34                         -0.2267693              -6.1707
        35                         -0.2226086              -6.0575
        36                         -0.2190849              -5.9616
        37                         -0.2156597              -5.8684
       ...                                ...                  ...
        65                          1.1289845              30.7212
      -------------------------------------------------------------
                  HL-Gap            0.1444392 Eh            3.9304 eV
             Fermi-level           -0.3366657 Eh           -9.1611 eV

 SCC (total)                   0 d,  0 h,  0 min,  0.025 sec
 SCC setup                      ...        0 min,  0.000 sec (  0.716%)
 Dispersion                     ...        0 min,  0.000 sec (  0.677%)
 integral evaluation            ...        0 min,  0.008 sec ( 31.458%)
 zeroth order Hamiltonian       ...        0 min,  0.000 sec (  0.613%)
 iterations                     ...        0 min,  0.004 sec ( 14.910%)
 molecular gradient             ...        0 min,  0.013 sec ( 50.065%)
 printout                       ...        0 min,  0.000 sec (  1.318%)

         :::::::::::::::::::::::::::::::::::::::::::::::::::::
         ::                     SUMMARY                     ::
         :::::::::::::::::::::::::::::::::::::::::::::::::::::
         :: total energy             -34.510800122787 Eh    ::
         :: gradient norm              0.000951274543 Eh/a0 ::
         :: HOMO-LUMO gap              3.930389784815 eV    ::
         ::.................................................::
         :: SCC energy               -35.109827724754 Eh    ::
         :: -> isotropic ES            0.017543547257 Eh    ::
         :: -> anisotropic ES          0.003578164706 Eh    ::
         :: -> anisotropic XC          0.041922311848 Eh    ::
         :: -> dispersion             -0.023596337770 Eh    ::
         :: repulsion energy           0.598806203183 Eh    ::
         :: add. restraining           0.000000000000 Eh    ::
         :::::::::::::::::::::::::::::::::::::::::::::::::::::

           -------------------------------------------------
          |                Property Printout                |
           -------------------------------------------------

    * Orbital Energies and Occupations

         #    Occupation            Energy/Eh            Energy/eV
      -------------------------------------------------------------
         1        2.0000           -0.7484395             -20.3661
       ...           ...                  ...                  ...
        20        2.0000           -0.4971554             -13.5283
        21        2.0000           -0.4920549             -13.3895
        22        2.0000           -0.4900264             -13.3343
        23        2.0000           -0.4898688             -13.3300
        24        2.0000           -0.4770916             -12.9823
        25        2.0000           -0.4766383             -12.9700
        26        2.0000           -0.4674351             -12.7196
        27        2.0000           -0.4586876             -12.4815
        28        2.0000           -0.4536389             -12.3441
        29        2.0000           -0.4392406             -11.9523
        30        2.0000           -0.4373320             -11.9004
        31        2.0000           -0.4092081             -11.1351
        32        2.0000           -0.4088853             -11.1263 (HOMO)
        33                         -0.2644462              -7.1959 (LUMO)
        34                         -0.2267693              -6.1707
        35                         -0.2226086              -6.0575
        36                         -0.2190849              -5.9616
        37                         -0.2156597              -5.8684
        38                         -0.2081312              -5.6635
        39                         -0.1809383              -4.9236
        40                         -0.1304401              -3.5495
        41                         -0.0173749              -0.4728
        42                          0.0144852               0.3942
        43                          0.0194313               0.5288
       ...                                ...                  ...
        65                          1.1289845              30.7212
      -------------------------------------------------------------
                  HL-Gap            0.1444392 Eh            3.9304 eV
             Fermi-level           -0.3366657 Eh           -9.1611 eV

     #   Z        covCN         q      C6AA      α(0)
     1   6 C      2.941    -0.033    28.822     8.805
     2  16 S      2.303     0.004   140.902    19.978
     3   6 C      2.941    -0.033    28.820     8.805
     4   6 C      3.189    -0.004    27.632     8.575
     5   6 C      3.189    -0.004    27.633     8.575
     6   6 C      3.860    -0.005    20.637     6.460
     7   6 C      1.919     0.115    28.259     8.585
     8   7 N      0.911    -0.234    26.122     7.392
     9   6 C      3.813    -0.046    21.388     6.582
    10   6 C      3.813    -0.046    21.387     6.582
    11   6 C      3.860    -0.006    20.637     6.461
    12   6 C      1.919     0.115    28.256     8.585
    13   7 N      0.911    -0.234    26.124     7.392
    14   1 H      0.926     0.048     2.339     2.392
    15   1 H      0.926     0.048     2.340     2.392
    16   1 H      0.924     0.064     2.149     2.293
    17   1 H      0.924     0.049     2.339     2.391
    18   1 H      0.924     0.044     2.399     2.422
    19   1 H      0.924     0.044     2.400     2.422
    20   1 H      0.924     0.048     2.339     2.392
    21   1 H      0.924     0.064     2.151     2.293

 Mol. C6AA /au·bohr⁶  :       7106.640520
 Mol. C8AA /au·bohr⁸  :     195833.505861
 Mol. α(0) /au        :        131.775804


Wiberg/Mayer (AO) data.
largest (>0.10) Wiberg bond orders for each atom
          total WBO             WBO to atom ...
     1  C   3.949        C    5 1.597    S    2 1.200    H   14 0.970    C    3 0.115
     2  S   2.652        C    3 1.200    C    1 1.200
     3  C   3.949        C    4 1.597    S    2 1.200    H   15 0.970    C    1 0.115
     4  C   3.982        C    3 1.597    C    5 1.225    C   11 0.968
     5  C   3.982        C    1 1.597    C    4 1.225    C    6 0.968
     6  C   3.996        C    7 1.022    C    5 0.968    C    9 0.967    H   16 0.933
     7  C   3.942        N    8 2.851    C    6 1.022
     8  N   3.013        C    7 2.851
     9  C   3.995        C   10 1.011    H   18 0.975    H   17 0.973    C    6 0.967
    10  C   3.995        C    9 1.011    H   19 0.975    H   20 0.973    C   11 0.967
    11  C   3.996        C   12 1.022    C    4 0.968    C   10 0.967    H   21 0.933
    12  C   3.942        N   13 2.851    C   11 1.022
    13  N   3.013        C   12 2.851
    14  H   0.997        C    1 0.970
    15  H   0.997        C    3 0.970
    16  H   0.996        C    6 0.933
    17  H   0.998        C    9 0.973
    18  H   0.997        C    9 0.975
    19  H   0.997        C   10 0.975
    20  H   0.998        C   10 0.973
    21  H   0.996        C   11 0.933

molecular dipole:
                 x           y           z       tot (Debye)
 q only:        0.071      -0.005       0.001
   full:       -0.025      -0.007       0.003       0.068
molecular quadrupole (traceless):
                xx          xy          yy          xz          yz          zz
 q only:        7.036      -0.317      -0.227      -0.369     -12.826      -6.809
  q+dip:        7.098      -0.372       2.267      -0.472     -19.440      -9.365
   full:        8.356      -0.405       3.079      -0.551     -20.949     -11.436

           -------------------------------------------------
          |                Geometry Summary                 |
           -------------------------------------------------

      molecular mass/u    :      188.2466000
   center of mass at/Å    :       -0.0279798      -0.1549066      -0.0091533
  moments of inertia/u·Å² :        0.6132789E+03   0.6287378E+03   0.1093542E+04
rotational constants/cm⁻¹ :        0.2748771E-01   0.2681186E-01   0.1541562E-01

 * 18 selected distances

     #   Z        #   Z                                     value/Å
     1   6 C      2  16 S                                 1.7177054 (max)
     2  16 S      3   6 C                                 1.7170080
     3   6 C      4   6 C                                 1.3595361
     1   6 C      5   6 C                                 1.3594683
     4   6 C      5   6 C                                 1.4218661
     7   6 C      8   7 N                                 1.1428161
     6   6 C      9   6 C                                 1.5360641
     9   6 C     10   6 C                                 1.5261441
    10   6 C     11   6 C                                 1.5365709
    12   6 C     13   7 N                                 1.1428325
     1   6 C     14   1 H                                 1.0719323 (min)
     3   6 C     15   1 H                                 1.0720037
     6   6 C     16   1 H                                 1.0965011
     9   6 C     17   1 H                                 1.0929223
     9   6 C     18   1 H                                 1.0917397
    10   6 C     19   1 H                                 1.0919330
    10   6 C     20   1 H                                 1.0931993
    11   6 C     21   1 H                                 1.0963172

 * 4 distinct bonds (by element types)

   Z      Z             #   av. dist./Å        max./Å        min./Å
   1 H    6 C           8     1.0883186     1.0965011     1.0719323
   6 C    6 C           6     1.4566083     1.5365709     1.3594683
   6 C    7 N           2     1.1428243     1.1428325     1.1428161
   6 C   16 S           2     1.7173567     1.7177054     1.7170080


optimized geometry written to: xtbopt.xyz


           -------------------------------------------------
          | TOTAL ENERGY              -34.510800122787 Eh   |
          | GRADIENT NORM               0.000951274543 Eh/α |
          | HOMO-LUMO GAP               3.930389784815 eV   |
           -------------------------------------------------

------------------------------------------------------------------------
 * finished run on 2021/05/19 at 11:00:06.042     
------------------------------------------------------------------------
 total:
 * wall-time:     0 d,  0 h,  0 min,  0.638 sec
 *  cpu-time:     0 d,  0 h,  0 min,  0.619 sec
 * ratio c/w:     0.971 speedup
 SCF:
 * wall-time:     0 d,  0 h,  0 min,  0.036 sec
 *  cpu-time:     0 d,  0 h,  0 min,  0.036 sec
 * ratio c/w:     0.998 speedup
 ANC optimizer:
 * wall-time:     0 d,  0 h,  0 min,  0.565 sec
 *  cpu-time:     0 d,  0 h,  0 min,  0.564 sec
 * ratio c/w:     0.997 speedup

