      -----------------------------------------------------------      
     |                   =====================                   |     
     |                           x T B                           |     
     |                   =====================                   |     
     |                         S. Grimme                         |     
     |          Mulliken Center for Theoretical Chemistry        |     
     |                    University of Bonn                     |     
     |                Version 6.2 RC2 (SAW190805)                |     
      -----------------------------------------------------------      

   This program is distributed in the hope that it will be useful,
   but WITHOUT ANY WARRANTY; without even the implied warranty of
   MERCHANTABILITY or FITNESS FOR A PARTICULAR PURPOSE.
   
   FOR NON-COMMERCIAL, ACADEMIA USE ONLY.
   
   Cite this work as:
   * S. Grimme, C. Bannwarth, P. Shushkov, J. Chem. Theory Comput., 2017,
     13, 1989-2009. DOI: 10.1021/acs.jctc.7b00118
   * C. Bannwarth, S. Ehlert and S. Grimme., J. Chem. Theory Comput., 2019,
     15, 1652-1671. DOI: 10.1021/acs.jctc.8b01176
   * P. Pracht, E. Caldeweyher, S. Ehlert, S. Grimme, ChemRxiv, 2019, preprint.
     DOI: 10.26434/chemrxiv.8326202.v1
   
   for DFT-D4:
   * E. Caldeweyher, C. Bannwarth and S. Grimme, J. Chem. Phys., 2017,
     147, 034112. DOI: 10.1063/1.4993215
   * E. Caldeweyher, S. Ehlert, A. Hansen, H. Neugebauer, S. Spicher,
     C. Bannwarth and S. Grimme, J. Chem. Phys., 2019, 150, 154122.
     DOI: 10.1063/1.5090222
   
   for sTDA-xTB:
   * S. Grimme and C. Bannwarth, J. Chem. Phys., 2016, 145, 054103.
     DOI: 10.1063/1.4959605
   
   in the mass-spec context:
   * V. Asgeirsson, C. Bauer and S. Grimme, Chem. Sci., 2017, 8, 4879.
     DOI: 10.1039/c7sc00601b
   
   for metadynamics refer to:
   * S. Grimme, J. Chem. Theory Comput., 2019, 155, 2847-2862
     DOI: 10.1021/acs.jctc.9b00143
   
   with help from (in alphabetical order)
   C. Bannwarth, F. Bohle, G. Brandenburg, E. Caldeweyher, M. Checinski,
   S. Dohm, S. Ehlert, S. Ehrlich, F. März, H. Neugebauer, J. Pisarek,
   P. Pracht, P. Shushkov, and S. Spicher.
   
 * started run on 2021/05/19 at 11:00:09.781     

           -------------------------------------------------
          |                Calculation Setup                |
           -------------------------------------------------

          program call               : /ihome/ghutchison/geoffh/xtb/xtb 684.xyz -opt
          hostname                   : smp-n144
          coordinate file            : 684.xyz
          omp threads                :                     1
          number of atoms            :                    27
          number of electrons        :                    72
          charge                     :                     0
          spin                       :                   0.0
          first test random number   :      0.42661381199126


########################################################################
# WARNING! Please study the warnings concerning your input carefully
#  - the use of '-opt' is discouraged, please use '--opt' next time
########################################################################

           ------------------------------------------------- 
          |                 G F N 2 - x T B                 |
          | Geometry, Frequencies, Noncovalent interactions |
          |            JCTC 2019 parametrisation            |
           ------------------------------------------------- 
             KAB for C  - Si     :                1.0500
             KAB for H  - Pd     :                0.9500
             k(s)              :                1.8500
             k(p)              :                2.2300
             k(d)              :                2.2300
             k(f)              :                2.0000
             kEN (H0ij)        :               -2.0000
             D4 a1             :                0.5200
             D4 a2             :                5.0000
             D4 s6             :                1.0000
             D4 s8             :                2.7000
             D4 s9             :                5.0000
             alphaj            :                2.0000

  Z AO/shell   Hii/eV     exponent
  1     Wed Apr 25 08:07:45 CEST 2018   EN: 2.200 GM2: 0.406  GM3: 0.0800  RAES: 1.40
     1s    -10.707211    1.230000
  6     Wed Apr 25 08:07:45 CEST 2018   EN: 2.550 GM2: 0.538  GM3: 0.1500  RAES: 3.00
     2s    -13.970922    2.096432
     2p    -10.063292    1.800000
  8     Wed Apr 25 08:07:45 CEST 2018   EN: 3.440 GM2: 0.452  GM3:-0.0517  RAES: 1.80
     2s    -20.229985    2.439742
     2p    -15.503117    2.137023
 16     Tue Apr 24 11:44:34 CEST 2018   EN: 2.580 GM2: 0.340  GM3:-0.0502  RAES: 3.10
     3s    -20.029654    1.981333
     3p    -11.377694    2.025643
     3d     -0.420282    1.702555

           ------------------------------------------------- 
          |        Self-Consistent Charge Iterations        |
           ------------------------------------------------- 

          ...................................................
          :                      SETUP                      :
          :.................................................:
          :  # basis functions                  72          :
          :  # atomic orbitals                  71          :
          :  # shells                           41          :
          :  # electrons                        72          :
          :  max. iterations                   250          :
          :  Hamiltonian                  GFN2-xTB          :
          :  restarted?                      false          :
          :  GBSA solvation                  false          :
          :  PC potential                    false          :
          :  electronic temp.          300.0000000     K    :
          :  accuracy                    1.0000000          :
          :  -> integral cutoff          0.2500000E+02      :
          :  -> integral neglect         0.1000000E-07      :
          :  -> SCF convergence          0.1000000E-05 Eh   :
          :  -> wf. convergence          0.1000000E-03 e    :
          :  Broyden damping             0.4000000          :
          ...................................................

 iter      E             dE          RMSdq      gap      omega  full diag
   1    -40.3297401 -0.403297E+02  0.506E+00    2.91       0.0  T
   2    -40.3732157 -0.434756E-01  0.299E+00    2.77       1.0  T
   3    -40.3677754  0.544025E-02  0.102E+00    2.87       1.0  T
   4    -40.3731810 -0.540562E-02  0.570E-01    2.78       1.0  T
   5    -40.3776714 -0.449035E-02  0.271E-01    2.80       1.0  T
   6    -40.3779639 -0.292516E-03  0.131E-01    2.80       1.0  T
   7    -40.3781714 -0.207515E-03  0.638E-02    2.79       1.0  T
   8    -40.3781943 -0.228394E-04  0.283E-02    2.79       1.0  T
   9    -40.3781972 -0.293370E-05  0.806E-03    2.79       2.4  T
  10    -40.3781976 -0.388834E-06  0.490E-03    2.79       3.9  T
  11    -40.3781977 -0.161001E-06  0.210E-03    2.79       9.2  T
  12    -40.3781978 -0.444114E-07  0.478E-04    2.79      40.3  T
  13    -40.3781978 -0.632561E-09  0.202E-04    2.79      95.2  T

   *** convergence criteria satisfied after 13 iterations ***

         #    Occupation            Energy/Eh            Energy/eV
      -------------------------------------------------------------
         1        2.0000           -0.7686594             -20.9163
       ...           ...                  ...                  ...
        30        2.0000           -0.4531892             -12.3319
        31        2.0000           -0.4428299             -12.0500
        32        2.0000           -0.4396094             -11.9624
        33        2.0000           -0.4344354             -11.8216
        34        2.0000           -0.4275290             -11.6337
        35        2.0000           -0.4050211             -11.0212
        36        2.0000           -0.3966316             -10.7929 (HOMO)
        37                         -0.2939774              -7.9995 (LUMO)
        38                         -0.2295025              -6.2451
        39                         -0.1851577              -5.0384
        40                         -0.1381856              -3.7602
        41                         -0.0923138              -2.5120
       ...                                ...                  ...
        71                          1.1360496              30.9135
      -------------------------------------------------------------
                  HL-Gap            0.1026542 Eh            2.7934 eV
             Fermi-level           -0.3453045 Eh           -9.3962 eV

 SCC (total)                   0 d,  0 h,  0 min,  0.043 sec
 SCC setup                      ...        0 min,  0.000 sec (  0.715%)
 Dispersion                     ...        0 min,  0.000 sec (  0.850%)
 integral evaluation            ...        0 min,  0.010 sec ( 22.441%)
 zeroth order Hamiltonian       ...        0 min,  0.000 sec (  0.474%)
 iterations                     ...        0 min,  0.016 sec ( 37.810%)
 molecular gradient             ...        0 min,  0.016 sec ( 36.623%)
 printout                       ...        0 min,  0.000 sec (  0.961%)

         :::::::::::::::::::::::::::::::::::::::::::::::::::::
         ::                     SUMMARY                     ::
         :::::::::::::::::::::::::::::::::::::::::::::::::::::
         :: total energy             -39.842963003678 Eh    ::
         :: gradient norm              0.065266428732 Eh/a0 ::
         :: HOMO-LUMO gap              2.793363515044 eV    ::
         ::.................................................::
         :: SCC energy               -40.378197787669 Eh    ::
         :: -> isotropic ES            0.066456866374 Eh    ::
         :: -> anisotropic ES         -0.003430499564 Eh    ::
         :: -> anisotropic XC          0.017940316591 Eh    ::
         :: -> dispersion             -0.026614776084 Eh    ::
         :: repulsion energy           0.534957715839 Eh    ::
         :: add. restraining           0.000000000000 Eh    ::
         :::::::::::::::::::::::::::::::::::::::::::::::::::::

      ----------------------------------------------------------- 
     |                   =====================                   |
     |                        A N C O P T                        |
     |                   =====================                   |
     |               Approximate Normal Coordinate               |
     |                Rational Function Optimizer                |
      ----------------------------------------------------------- 

          ...................................................
          :                      SETUP                      :
          :.................................................:
          :   optimization level            normal          :
          :   max. optcycles                   200          :
          :   ANC micro-cycles                  20          :
          :   degrees of freedom                75          :
          :.................................................:
          :   RF solver                   davidson          :
          :   input Hessian                  false          :
          :   write xtbopt.log                true          :
          :   linear?                        false          :
          :   energy convergence         0.5000000E-05 Eh   :
          :   grad. convergence          0.1000000E-02 Eh/α :
          :   maximium RF displ.         2.0000000          :
          :   Hlow (freq-cutoff)         0.5000000E-02      :
          :   Hmax (freq-cutoff)         5.0000000          :
          :   S6 in model hess.         20.0000000          :
          ...................................................

generating ANC from model Hessian ...
Using Lindh-Hessian (1995)
 Shifting diagonal of input Hessian by   3.947462660687569E-003
 Lowest  eigenvalues of input Hessian
   -0.000000   -0.000000   -0.000000   -0.000000    0.000000    0.000000
    0.005000    0.005790    0.006379    0.007349    0.008159    0.008979
    0.009811    0.012037    0.012416    0.015426    0.017246    0.019550
 Highest eigenvalues
    1.623490    1.793116    1.860422    1.983932    2.581746    3.381017
 

........................................................................
.............................. CYCLE    1 ..............................
........................................................................
   1    -40.3781978 -0.403782E+02  0.765E-05    2.79       0.0  T
   2    -40.3781978 -0.503064E-11  0.469E-05    2.79     410.1  T
   3    -40.3781978  0.128892E-10  0.324E-05    2.79     594.0  T
     SCC iter.                  ...        0 min,  0.005 sec
     gradient                   ...        0 min,  0.016 sec
 * total energy  :   -39.8429630 Eh     change        0.3122246E-08 Eh
   gradient norm :     0.0652662 Eh/α   predicted     0.0000000E+00 (-100.00%)
   displ. norm   :     0.2186848 α      lambda       -0.6051691E-02
   maximum displ.:     0.0796987 α      in ANC's #7, #11, #15, ...

........................................................................
.............................. CYCLE    2 ..............................
........................................................................
   1    -40.3977805 -0.403978E+02  0.214E-01    2.87       0.0  T
   2    -40.3978090 -0.284805E-04  0.105E-01    2.88       1.0  T
   3    -40.3977802  0.287706E-04  0.488E-02    2.87       1.0  T
   4    -40.3978155 -0.353531E-04  0.200E-02    2.88       1.0  T
   5    -40.3978197 -0.418008E-05  0.803E-03    2.88       2.4  T
   6    -40.3978199 -0.144396E-06  0.361E-03    2.87       5.3  T
   7    -40.3978201 -0.246234E-06  0.717E-04    2.88      26.8  T
     SCC iter.                  ...        0 min,  0.009 sec
     gradient                   ...        0 min,  0.015 sec
 * total energy  :   -39.8472607 Eh     change       -0.4297662E-02 Eh
   gradient norm :     0.0333405 Eh/α   predicted    -0.3170562E-02 ( -26.23%)
   displ. norm   :     0.2006359 α      lambda       -0.2848857E-02
   maximum displ.:     0.0989142 α      in ANC's #7, #31, #3, ...

........................................................................
.............................. CYCLE    3 ..............................
........................................................................
   1    -40.4083977 -0.404084E+02  0.249E-01    2.92       0.0  T
   2    -40.4084275 -0.297679E-04  0.117E-01    2.93       1.0  T
   3    -40.4084215  0.602248E-05  0.351E-02    2.92       1.0  T
   4    -40.4084269 -0.539152E-05  0.208E-02    2.92       1.0  T
   5    -40.4084327 -0.581403E-05  0.778E-03    2.92       2.5  T
   6    -40.4084330 -0.291518E-06  0.242E-03    2.92       8.0  T
   7    -40.4084331 -0.107947E-06  0.633E-04    2.92      30.4  T
     SCC iter.                  ...        0 min,  0.009 sec
     gradient                   ...        0 min,  0.014 sec
 * total energy  :   -39.8490091 Eh     change       -0.1748425E-02 Eh
   gradient norm :     0.0108770 Eh/α   predicted    -0.1481778E-02 ( -15.25%)
   displ. norm   :     0.1593016 α      lambda       -0.5702781E-03
   maximum displ.:     0.0946472 α      in ANC's #7, #3, #2, ...

........................................................................
.............................. CYCLE    4 ..............................
........................................................................
   1    -40.4074972 -0.404075E+02  0.144E-01    2.91       0.0  T
   2    -40.4075028 -0.560251E-05  0.704E-02    2.92       1.0  T
   3    -40.4075013  0.154805E-05  0.191E-02    2.91       1.0  T
   4    -40.4075021 -0.790453E-06  0.125E-02    2.92       1.5  T
   5    -40.4075041 -0.200553E-05  0.357E-03    2.91       5.4  T
   6    -40.4075042 -0.770271E-07  0.105E-03    2.91      18.3  T
   7    -40.4075042 -0.239544E-07  0.326E-04    2.91      59.0  T
     SCC iter.                  ...        0 min,  0.009 sec
     gradient                   ...        0 min,  0.014 sec
 * total energy  :   -39.8493943 Eh     change       -0.3851815E-03 Eh
   gradient norm :     0.0077032 Eh/α   predicted    -0.2923753E-03 ( -24.09%)
   displ. norm   :     0.1938878 α      lambda       -0.3239969E-03
   maximum displ.:     0.1116015 α      in ANC's #7, #4, #3, ...

........................................................................
.............................. CYCLE    5 ..............................
........................................................................
   1    -40.4049445 -0.404049E+02  0.142E-01    2.89       0.0  T
   2    -40.4049483 -0.383355E-05  0.743E-02    2.89       1.0  T
   3    -40.4049423  0.599347E-05  0.220E-02    2.89       1.0  T
   4    -40.4049488 -0.642669E-05  0.111E-02    2.89       1.7  T
   5    -40.4049500 -0.126064E-05  0.248E-03    2.89       7.8  T
   6    -40.4049501 -0.481430E-07  0.103E-03    2.89      18.7  T
     SCC iter.                  ...        0 min,  0.007 sec
     gradient                   ...        0 min,  0.014 sec
 * total energy  :   -39.8495878 Eh     change       -0.1935637E-03 Eh
   gradient norm :     0.0076646 Eh/α   predicted    -0.1680894E-03 ( -13.16%)
   displ. norm   :     0.1651973 α      lambda       -0.1888955E-03
   maximum displ.:     0.0886650 α      in ANC's #7, #3, #4, ...

........................................................................
.............................. CYCLE    6 ..............................
........................................................................
   1    -40.4033638 -0.404034E+02  0.113E-01    2.86       0.0  T
   2    -40.4033660 -0.228384E-05  0.628E-02    2.86       1.0  T
   3    -40.4033615  0.455753E-05  0.175E-02    2.86       1.1  T
   4    -40.4033667 -0.516014E-05  0.749E-03    2.86       2.6  T
   5    -40.4033670 -0.366226E-06  0.237E-03    2.86       8.1  T
   6    -40.4033671 -0.522364E-07  0.118E-03    2.86      16.4  T
     SCC iter.                  ...        0 min,  0.007 sec
     gradient                   ...        0 min,  0.015 sec
 * total energy  :   -39.8497117 Eh     change       -0.1238411E-03 Eh
   gradient norm :     0.0064637 Eh/α   predicted    -0.9702570E-04 ( -21.65%)
   displ. norm   :     0.1739305 α      lambda       -0.1604606E-03
   maximum displ.:     0.0909189 α      in ANC's #7, #3, #4, ...

........................................................................
.............................. CYCLE    7 ..............................
........................................................................
   1    -40.4031455 -0.404031E+02  0.113E-01    2.84       0.0  T
   2    -40.4031482 -0.265705E-05  0.637E-02    2.84       1.0  T
   3    -40.4031462  0.204098E-05  0.135E-02    2.84       1.4  T
   4    -40.4031485 -0.238205E-05  0.681E-03    2.84       2.8  T
   5    -40.4031490 -0.460187E-06  0.223E-03    2.84       8.6  T
   6    -40.4031490 -0.411341E-07  0.586E-04    2.84      32.8  T
     SCC iter.                  ...        0 min,  0.007 sec
     gradient                   ...        0 min,  0.014 sec
 * total energy  :   -39.8498378 Eh     change       -0.1261041E-03 Eh
   gradient norm :     0.0053138 Eh/α   predicted    -0.8266626E-04 ( -34.45%)
   displ. norm   :     0.2340592 α      lambda       -0.1915570E-03
   maximum displ.:     0.1190725 α      in ANC's #7, #3, #5, ...

........................................................................
.............................. CYCLE    8 ..............................
........................................................................
   1    -40.4040713 -0.404041E+02  0.150E-01    2.82       0.0  T
   2    -40.4040754 -0.419502E-05  0.844E-02    2.82       1.0  T
   3    -40.4040730  0.243659E-05  0.164E-02    2.82       1.2  T
   4    -40.4040753 -0.224083E-05  0.102E-02    2.82       1.9  T
   5    -40.4040767 -0.145320E-05  0.255E-03    2.82       7.6  T
   6    -40.4040767 -0.458418E-07  0.961E-04    2.82      20.0  T
     SCC iter.                  ...        0 min,  0.008 sec
     gradient                   ...        0 min,  0.014 sec
 * total energy  :   -39.8499745 Eh     change       -0.1367265E-03 Eh
   gradient norm :     0.0061288 Eh/α   predicted    -0.1010261E-03 ( -26.11%)
   displ. norm   :     0.2126873 α      lambda       -0.1161627E-03
   maximum displ.:     0.1048465 α      in ANC's #7, #5, #3, ...

........................................................................
.............................. CYCLE    9 ..............................
........................................................................
   1    -40.4046572 -0.404047E+02  0.137E-01    2.80       0.0  T
   2    -40.4046600 -0.283445E-05  0.764E-02    2.80       1.0  T
   3    -40.4046576  0.242702E-05  0.152E-02    2.80       1.3  T
   4    -40.4046600 -0.236213E-05  0.886E-03    2.80       2.2  T
   5    -40.4046611 -0.111559E-05  0.125E-03    2.80      15.4  T
   6    -40.4046611 -0.943403E-08  0.652E-04    2.80      29.5  T
     SCC iter.                  ...        0 min,  0.008 sec
     gradient                   ...        0 min,  0.014 sec
 * total energy  :   -39.8500602 Eh     change       -0.8568223E-04 Eh
   gradient norm :     0.0068697 Eh/α   predicted    -0.6071492E-04 ( -29.14%)
   displ. norm   :     0.1985732 α      lambda       -0.9860712E-04
   maximum displ.:     0.0945461 α      in ANC's #5, #3, #7, ...

........................................................................
.............................. CYCLE   10 ..............................
........................................................................
   1    -40.4059175 -0.404059E+02  0.130E-01    2.79       0.0  T
   2    -40.4059203 -0.282358E-05  0.720E-02    2.79       1.0  T
   3    -40.4059180  0.232295E-05  0.153E-02    2.79       1.3  T
   4    -40.4059204 -0.243244E-05  0.842E-03    2.79       2.3  T
   5    -40.4059213 -0.888630E-06  0.159E-03    2.79      12.1  T
   6    -40.4059214 -0.284647E-07  0.528E-04    2.79      36.5  T
     SCC iter.                  ...        0 min,  0.008 sec
     gradient                   ...        0 min,  0.014 sec
 * total energy  :   -39.8501273 Eh     change       -0.6712604E-04 Eh
   gradient norm :     0.0054350 Eh/α   predicted    -0.5124831E-04 ( -23.65%)
   displ. norm   :     0.1789561 α      lambda       -0.5577519E-04
   maximum displ.:     0.0886244 α      in ANC's #5, #7, #4, ...

........................................................................
.............................. CYCLE   11 ..............................
........................................................................
   1    -40.4051200 -0.404051E+02  0.118E-01    2.78       0.0  T
   2    -40.4051224 -0.239482E-05  0.660E-02    2.78       1.0  T
   3    -40.4051207  0.178152E-05  0.132E-02    2.78       1.5  T
   4    -40.4051226 -0.194120E-05  0.696E-03    2.78       2.8  T
   5    -40.4051232 -0.636749E-06  0.188E-03    2.78      10.3  T
   6    -40.4051233 -0.490645E-07  0.725E-04    2.78      26.5  T
     SCC iter.                  ...        0 min,  0.008 sec
     gradient                   ...        0 min,  0.015 sec
 * total energy  :   -39.8501541 Eh     change       -0.2674021E-04 Eh
   gradient norm :     0.0041579 Eh/α   predicted    -0.2878781E-04 (   7.66%)
   displ. norm   :     0.0461771 α      lambda       -0.4633356E-04
   maximum displ.:     0.0196837 α      in ANC's #3, #4, #5, ...

........................................................................
.............................. CYCLE   12 ..............................
........................................................................
   1    -40.4072560 -0.404073E+02  0.428E-02    2.79       0.0  T
   2    -40.4072570 -0.102175E-05  0.233E-02    2.79       1.0  T
   3    -40.4072561  0.942596E-06  0.864E-03    2.79       2.2  T
   4    -40.4072572 -0.113330E-05  0.339E-03    2.79       5.7  T
   5    -40.4072573 -0.924054E-07  0.157E-03    2.79      12.3  T
   6    -40.4072573  0.122482E-08  0.776E-04    2.79      24.8  T
     SCC iter.                  ...        0 min,  0.007 sec
     gradient                   ...        0 min,  0.015 sec
 * total energy  :   -39.8501674 Eh     change       -0.1338585E-04 Eh
   gradient norm :     0.0027335 Eh/α   predicted    -0.2321659E-04 (  73.44%)
   displ. norm   :     0.0357034 α      lambda       -0.1831609E-04
   maximum displ.:     0.0167844 α      in ANC's #7, #4, #5, ...

........................................................................
.............................. CYCLE   13 ..............................
........................................................................
   1    -40.4061135 -0.404061E+02  0.216E-02    2.78       0.0  T
   2    -40.4061136 -0.171245E-06  0.122E-02    2.78       1.6  T
   3    -40.4061135  0.155228E-06  0.329E-03    2.78       5.8  T
   4    -40.4061136 -0.157255E-06  0.159E-03    2.78      12.1  T
   5    -40.4061137 -0.365855E-07  0.529E-04    2.78      36.4  T
   6    -40.4061137 -0.303743E-09  0.250E-04    2.78      77.0  T
     SCC iter.                  ...        0 min,  0.007 sec
     gradient                   ...        0 min,  0.015 sec
 * total energy  :   -39.8501761 Eh     change       -0.8620301E-05 Eh
   gradient norm :     0.0014447 Eh/α   predicted    -0.9171015E-05 (   6.39%)
   displ. norm   :     0.0356353 α      lambda       -0.8793507E-05
   maximum displ.:     0.0191142 α      in ANC's #1, #9, #3, ...

........................................................................
.............................. CYCLE   14 ..............................
........................................................................
   1    -40.4057088 -0.404057E+02  0.165E-02    2.78       0.0  T
   2    -40.4057089 -0.108621E-06  0.916E-03    2.78       2.1  T
   3    -40.4057087  0.176899E-06  0.381E-03    2.78       5.0  T
   4    -40.4057089 -0.194763E-06  0.135E-03    2.78      14.3  T
   5    -40.4057089 -0.216652E-07  0.541E-04    2.78      35.6  T
   6    -40.4057089 -0.182289E-08  0.232E-04    2.78      83.1  T
     SCC iter.                  ...        0 min,  0.007 sec
     gradient                   ...        0 min,  0.015 sec
 * total energy  :   -39.8501797 Eh     change       -0.3625981E-05 Eh
   gradient norm :     0.0014033 Eh/α   predicted    -0.4400151E-05 (  21.35%)
   displ. norm   :     0.0207934 α      lambda       -0.4454687E-05
   maximum displ.:     0.0143793 α      in ANC's #1, #12, #5, ...

........................................................................
.............................. CYCLE   15 ..............................
........................................................................
   1    -40.4060617 -0.404061E+02  0.136E-02    2.78       0.0  T
   2    -40.4060618 -0.447198E-07  0.735E-03    2.78       2.6  T
   3    -40.4060617  0.578906E-07  0.222E-03    2.78       8.7  T
   4    -40.4060618 -0.720710E-07  0.892E-04    2.78      21.6  T
   5    -40.4060618 -0.374452E-08  0.215E-04    2.78      89.5  T
     SCC iter.                  ...        0 min,  0.007 sec
     gradient                   ...        0 min,  0.015 sec
 * total energy  :   -39.8501840 Eh     change       -0.4288734E-05 Eh
   gradient norm :     0.0005851 Eh/α   predicted    -0.2232364E-05 ( -47.95%)
   displ. norm   :     0.0277070 α      lambda       -0.2025981E-05
   maximum displ.:     0.0202422 α      in ANC's #1, #5, #9, ...

   *** GEOMETRY OPTIMIZATION CONVERGED AFTER 15 ITERATIONS ***

------------------------------------------------------------------------
 total energy gain   :        -0.0072210 Eh       -4.5312 kcal/mol
 total RMSD          :         0.3352513 a0        0.1774 Å
 total power (kW/mol):        -1.2639104 (step)  -38.2726 (real)
------------------------------------------------------------------------

 ANCopt (total)                0 d,  0 h,  0 min,  0.495 sec
 optimizer setup                ...        0 min,  0.000 sec (  0.029%)
 model hessian                  ...        0 min,  0.008 sec (  1.640%)
 ANC generation                 ...        0 min,  0.001 sec (  0.163%)
 coordinate transformation      ...        0 min,  0.000 sec (  0.060%)
 single point calculation       ...        0 min,  0.480 sec ( 96.954%)
 optimization log               ...        0 min,  0.002 sec (  0.332%)
 hessian update                 ...        0 min,  0.000 sec (  0.042%)
 rational function              ...        0 min,  0.003 sec (  0.582%)

================
 final structure:
================
$coord
    1.49299426971859   -2.35543591563377   -0.10901724788098      C 
    3.69224257283127   -1.15148456278622    0.07924572740449      C 
    6.22564051958818   -2.39642178330712    0.35430676575057      C 
    6.12697552023841   -5.27260095973709    0.32845874392112      C 
    3.51684340365280    1.63889490548791    0.05849881609407      C 
    5.85390412187857    3.23547491125476   -0.14669713079933      C 
    6.60687146402433    3.51920036944376   -2.92668125390929      C 
    1.15706147748477    2.55000719064062    0.00872454911069      C 
   -1.00242337904686   -0.08640108940784   -0.26165807624731      S 
   -2.18295590682427   -0.04334962584952   -2.71064900875609      O 
   -2.62843416780343   -0.30308539009061    1.90370892731316      O 
    0.04165326590862    5.02519592686596   -0.04228334821325      C 
    0.71111042167238    7.00215478174205    1.35462377143077      C 
    1.11654642327307   -4.34000781197582   -0.09605777393107      H 
    7.05998906285710   -1.76410503816582    2.13698107128918      H 
    7.46068026688530   -1.74567425299839   -1.16647856084291      H 
    4.97905727953511   -5.97485191925312    1.87978906792548      H 
    8.02449640532416   -6.03548539153689    0.53080317524543      H 
    5.33805094294109   -5.95624379693313   -1.44030710275103      H 
    7.40376100667050    2.39218071983191    0.91555813377423      H 
    5.48528775916843    5.10582504071082    0.62446908217638      H 
    6.92594699240750    1.68908087902190   -3.80324675358206      H 
    8.32708516026007    4.63127978683704   -3.08455418609911      H 
    5.10974695898728    4.47154594705198   -3.96182987747999      H 
   -1.59689626642760    5.13547419770804   -1.26585523533968      H 
    2.24888248950889    6.92084846305201    2.68515576270330      H 
   -0.30649514985210    8.75928935127340    1.25019790459423      H 
$end
           -------------------------------------------------
          |                Final Singlepoint                |
           -------------------------------------------------

          ...................................................
          :                      SETUP                      :
          :.................................................:
          :  # basis functions                  72          :
          :  # atomic orbitals                  71          :
          :  # shells                           41          :
          :  # electrons                        72          :
          :  max. iterations                   250          :
          :  Hamiltonian                  GFN2-xTB          :
          :  restarted?                      false          :
          :  GBSA solvation                  false          :
          :  PC potential                    false          :
          :  electronic temp.          300.0000000     K    :
          :  accuracy                    1.0000000          :
          :  -> integral cutoff          0.2500000E+02      :
          :  -> integral neglect         0.1000000E-07      :
          :  -> SCF convergence          0.1000000E-05 Eh   :
          :  -> wf. convergence          0.1000000E-03 e    :
          :  Broyden damping             0.4000000          :
          ...................................................

 iter      E             dE          RMSdq      gap      omega  full diag
   1    -40.4060618 -0.404061E+02  0.133E-04    2.78       0.0  T
   2    -40.4060618  0.447145E-10  0.896E-05    2.78     214.9  T
   3    -40.4060618 -0.191456E-09  0.524E-05    2.78     367.1  T

   *** convergence criteria satisfied after 3 iterations ***

         #    Occupation            Energy/Eh            Energy/eV
      -------------------------------------------------------------
         1        2.0000           -0.7674118             -20.8823
       ...           ...                  ...                  ...
        30        2.0000           -0.4524850             -12.3127
        31        2.0000           -0.4421349             -12.0311
        32        2.0000           -0.4403828             -11.9834
        33        2.0000           -0.4315707             -11.7436
        34        2.0000           -0.4291648             -11.6782
        35        2.0000           -0.4053275             -11.0295
        36        2.0000           -0.3952971             -10.7566 (HOMO)
        37                         -0.2930059              -7.9731 (LUMO)
        38                         -0.2251857              -6.1276
        39                         -0.1716068              -4.6697
        40                         -0.1341477              -3.6503
        41                         -0.0936338              -2.5479
       ...                                ...                  ...
        71                          1.2240859              33.3091
      -------------------------------------------------------------
                  HL-Gap            0.1022913 Eh            2.7835 eV
             Fermi-level           -0.3441515 Eh           -9.3648 eV

 SCC (total)                   0 d,  0 h,  0 min,  0.030 sec
 SCC setup                      ...        0 min,  0.000 sec (  0.662%)
 Dispersion                     ...        0 min,  0.000 sec (  0.716%)
 integral evaluation            ...        0 min,  0.009 sec ( 30.287%)
 zeroth order Hamiltonian       ...        0 min,  0.000 sec (  0.593%)
 iterations                     ...        0 min,  0.004 sec ( 14.684%)
 molecular gradient             ...        0 min,  0.016 sec ( 51.626%)
 printout                       ...        0 min,  0.000 sec (  1.225%)

         :::::::::::::::::::::::::::::::::::::::::::::::::::::
         ::                     SUMMARY                     ::
         :::::::::::::::::::::::::::::::::::::::::::::::::::::
         :: total energy             -39.850183962986 Eh    ::
         :: gradient norm              0.000583913841 Eh/a0 ::
         :: HOMO-LUMO gap              2.783486665730 eV    ::
         ::.................................................::
         :: SCC energy               -40.406061796118 Eh    ::
         :: -> isotropic ES            0.064461030811 Eh    ::
         :: -> anisotropic ES         -0.003569282164 Eh    ::
         :: -> anisotropic XC          0.017068746916 Eh    ::
         :: -> dispersion             -0.026719004634 Eh    ::
         :: repulsion energy           0.555599149940 Eh    ::
         :: add. restraining           0.000000000000 Eh    ::
         :::::::::::::::::::::::::::::::::::::::::::::::::::::

           -------------------------------------------------
          |                Property Printout                |
           -------------------------------------------------

    * Orbital Energies and Occupations

         #    Occupation            Energy/Eh            Energy/eV
      -------------------------------------------------------------
         1        2.0000           -0.7674118             -20.8823
       ...           ...                  ...                  ...
        24        2.0000           -0.4788262             -13.0295
        25        2.0000           -0.4748691             -12.9218
        26        2.0000           -0.4711124             -12.8196
        27        2.0000           -0.4659893             -12.6802
        28        2.0000           -0.4609908             -12.5442
        29        2.0000           -0.4589236             -12.4879
        30        2.0000           -0.4524850             -12.3127
        31        2.0000           -0.4421349             -12.0311
        32        2.0000           -0.4403828             -11.9834
        33        2.0000           -0.4315707             -11.7436
        34        2.0000           -0.4291648             -11.6782
        35        2.0000           -0.4053275             -11.0295
        36        2.0000           -0.3952971             -10.7566 (HOMO)
        37                         -0.2930059              -7.9731 (LUMO)
        38                         -0.2251857              -6.1276
        39                         -0.1716068              -4.6697
        40                         -0.1341477              -3.6503
        41                         -0.0936338              -2.5479
        42                         -0.0638541              -1.7376
        43                         -0.0042773              -0.1164
        44                          0.0376891               1.0256
        45                          0.0924593               2.5159
        46                          0.1017191               2.7679
        47                          0.1069361               2.9099
       ...                                ...                  ...
        71                          1.2240859              33.3091
      -------------------------------------------------------------
                  HL-Gap            0.1022913 Eh            2.7835 eV
             Fermi-level           -0.3441515 Eh           -9.3648 eV

     #   Z        covCN         q      C6AA      α(0)
     1   6 C      2.907    -0.144    31.703     9.232
     2   6 C      3.149     0.014    27.430     8.567
     3   6 C      3.805    -0.056    21.579     6.613
     4   6 C      3.752    -0.111    22.682     6.792
     5   6 C      3.141    -0.002    27.830     8.633
     6   6 C      3.805    -0.058    21.615     6.619
     7   6 C      3.754    -0.103    22.522     6.767
     8   6 C      2.963    -0.081    30.021     8.987
     9  16 S      4.056     0.967   107.604    17.459
    10   8 O      0.860    -0.535    24.578     6.647
    11   8 O      0.860    -0.535    24.565     6.645
    12   6 C      2.921    -0.020    28.501     8.755
    13   6 C      2.839    -0.083    30.074     8.987
    14   1 H      0.927     0.084     1.939     2.177
    15   1 H      0.924     0.058     2.220     2.330
    16   1 H      0.924     0.063     2.168     2.303
    17   1 H      0.925     0.045     2.385     2.415
    18   1 H      0.925     0.047     2.358     2.402
    19   1 H      0.925     0.045     2.385     2.415
    20   1 H      0.925     0.051     2.301     2.372
    21   1 H      0.925     0.054     2.268     2.355
    22   1 H      0.925     0.040     2.444     2.445
    23   1 H      0.925     0.047     2.358     2.402
    24   1 H      0.925     0.044     2.392     2.418
    25   1 H      0.925     0.062     2.175     2.306
    26   1 H      0.926     0.049     2.327     2.385
    27   1 H      0.926     0.057     2.239     2.340

 Mol. C6AA /au·bohr⁶  :       8544.254437
 Mol. C8AA /au·bohr⁸  :     216252.333494
 Mol. α(0) /au        :        143.768510


Wiberg/Mayer (AO) data.
largest (>0.10) Wiberg bond orders for each atom
          total WBO             WBO to atom ...
     1  C   3.967        C    2 1.818    H   14 0.959    S    9 0.775    C    8 0.154
     2  C   3.983        C    1 1.818    C    5 1.053    C    3 1.014
     3  C   3.995        C    4 1.019    C    2 1.014    H   15 0.954    H   16 0.953
     4  C   3.994        C    3 1.019    H   19 0.986    H   17 0.986    H   18 0.986
     5  C   3.983        C    8 1.730    C    2 1.053    C    6 1.010
     6  C   3.995        C    5 1.010    C    7 0.995    H   21 0.970    H   20 0.967
     7  C   3.994        C    6 0.995    H   24 0.988    H   22 0.985    H   23 0.984
     8  C   3.974        C    5 1.730    C   12 1.116    S    9 0.736    C    1 0.154
     9  S   4.914        O   11 1.661    O   10 1.654    C    1 0.775    C    8 0.736
    10  O   1.969        S    9 1.654    O   11 0.117
    11  O   1.970        S    9 1.661    O   10 0.117
    12  C   3.988        C   13 1.881    C    8 1.116    H   25 0.949
    13  C   3.988        C   12 1.881    H   27 0.976    H   26 0.973
    14  H   0.992        C    1 0.959
    15  H   0.996        C    3 0.954
    16  H   0.996        C    3 0.953
    17  H   0.998        C    4 0.986
    18  H   0.997        C    4 0.986
    19  H   0.998        C    4 0.986
    20  H   0.997        C    6 0.967
    21  H   0.997        C    6 0.970
    22  H   0.998        C    7 0.985
    23  H   0.997        C    7 0.984
    24  H   0.998        C    7 0.988
    25  H   0.996        C   12 0.949
    26  H   0.998        C   13 0.973
    27  H   0.996        C   13 0.976

molecular dipole:
                 x           y           z       tot (Debye)
 q only:        2.614       0.348       0.157
   full:        2.614       0.279       0.173       6.697
molecular quadrupole (traceless):
                xx          xy          yy          xz          yz          zz
 q only:        2.832      -1.249       7.287      -0.345       0.220     -10.119
  q+dip:        3.233      -1.915       8.708       1.246       0.979     -11.941
   full:        2.324      -1.717       8.207       0.349       0.510     -10.532

           -------------------------------------------------
          |                Geometry Summary                 |
           -------------------------------------------------

      molecular mass/u    :      198.2794000
   center of mass at/Å    :        1.0261346       0.3916557      -0.1031079
  moments of inertia/u·Å² :        0.6062602E+03   0.7611537E+03   0.1170378E+04
rotational constants/cm⁻¹ :        0.2780594E-01   0.2214747E-01   0.1440358E-01

 * 23 selected distances

     #   Z        #   Z                                     value/Å
     1   6 C      2   6 C                                 1.3305031
     3   6 C      4   6 C                                 1.5229653
     6   6 C      7   6 C                                 1.5314880
     5   6 C      8   6 C                                 1.3388471
     1   6 C      9  16 S                                 1.7866240
     8   6 C      9  16 S                                 1.8090689 (max)
     9  16 S     10   8 O                                 1.4388433
     9  16 S     11   8 O                                 1.4375398
    12   6 C     13   6 C                                 1.3290557
     1   6 C     14   1 H                                 1.0689389 (min)
     3   6 C     15   1 H                                 1.0939887
     3   6 C     16   1 H                                 1.0924125
     4   6 C     17   1 H                                 1.0867475
     4   6 C     18   1 H                                 1.0875232
     4   6 C     19   1 H                                 1.0868510
     6   6 C     20   1 H                                 1.0898467
     6   6 C     21   1 H                                 1.0882006
     7   6 C     22   1 H                                 1.0870071
     7   6 C     23   1 H                                 1.0871701
     7   6 C     24   1 H                                 1.0870538
    12   6 C     25   1 H                                 1.0837331
    13   6 C     26   1 H                                 1.0769335
    13   6 C     27   1 H                                 1.0759291

 * 4 distinct bonds (by element types)

   Z      Z             #   av. dist./Å        max./Å        min./Å
   1 H    6 C          14     1.0851668     1.0939887     1.0689389
   6 C    6 C           5     1.4105718     1.5314880     1.3290557
   6 C   16 S           2     1.7978465     1.8090689     1.7866240
   8 O   16 S           2     1.4381915     1.4388433     1.4375398


optimized geometry written to: xtbopt.xyz


           -------------------------------------------------
          | TOTAL ENERGY              -39.850183962986 Eh   |
          | GRADIENT NORM               0.000583913841 Eh/α |
          | HOMO-LUMO GAP               2.783486665730 eV   |
           -------------------------------------------------

------------------------------------------------------------------------
 * finished run on 2021/05/19 at 11:00:10.372     
------------------------------------------------------------------------
 total:
 * wall-time:     0 d,  0 h,  0 min,  0.591 sec
 *  cpu-time:     0 d,  0 h,  0 min,  0.589 sec
 * ratio c/w:     0.995 speedup
 SCF:
 * wall-time:     0 d,  0 h,  0 min,  0.043 sec
 *  cpu-time:     0 d,  0 h,  0 min,  0.043 sec
 * ratio c/w:     0.997 speedup
 ANC optimizer:
 * wall-time:     0 d,  0 h,  0 min,  0.526 sec
 *  cpu-time:     0 d,  0 h,  0 min,  0.525 sec
 * ratio c/w:     0.998 speedup

