      -----------------------------------------------------------      
     |                   =====================                   |     
     |                           x T B                           |     
     |                   =====================                   |     
     |                         S. Grimme                         |     
     |          Mulliken Center for Theoretical Chemistry        |     
     |                    University of Bonn                     |     
     |                Version 6.2 RC2 (SAW190805)                |     
      -----------------------------------------------------------      

   This program is distributed in the hope that it will be useful,
   but WITHOUT ANY WARRANTY; without even the implied warranty of
   MERCHANTABILITY or FITNESS FOR A PARTICULAR PURPOSE.
   
   FOR NON-COMMERCIAL, ACADEMIA USE ONLY.
   
   Cite this work as:
   * S. Grimme, C. Bannwarth, P. Shushkov, J. Chem. Theory Comput., 2017,
     13, 1989-2009. DOI: 10.1021/acs.jctc.7b00118
   * C. Bannwarth, S. Ehlert and S. Grimme., J. Chem. Theory Comput., 2019,
     15, 1652-1671. DOI: 10.1021/acs.jctc.8b01176
   * P. Pracht, E. Caldeweyher, S. Ehlert, S. Grimme, ChemRxiv, 2019, preprint.
     DOI: 10.26434/chemrxiv.8326202.v1
   
   for DFT-D4:
   * E. Caldeweyher, C. Bannwarth and S. Grimme, J. Chem. Phys., 2017,
     147, 034112. DOI: 10.1063/1.4993215
   * E. Caldeweyher, S. Ehlert, A. Hansen, H. Neugebauer, S. Spicher,
     C. Bannwarth and S. Grimme, J. Chem. Phys., 2019, 150, 154122.
     DOI: 10.1063/1.5090222
   
   for sTDA-xTB:
   * S. Grimme and C. Bannwarth, J. Chem. Phys., 2016, 145, 054103.
     DOI: 10.1063/1.4959605
   
   in the mass-spec context:
   * V. Asgeirsson, C. Bauer and S. Grimme, Chem. Sci., 2017, 8, 4879.
     DOI: 10.1039/c7sc00601b
   
   for metadynamics refer to:
   * S. Grimme, J. Chem. Theory Comput., 2019, 155, 2847-2862
     DOI: 10.1021/acs.jctc.9b00143
   
   with help from (in alphabetical order)
   C. Bannwarth, F. Bohle, G. Brandenburg, E. Caldeweyher, M. Checinski,
   S. Dohm, S. Ehlert, S. Ehrlich, F. März, H. Neugebauer, J. Pisarek,
   P. Pracht, P. Shushkov, and S. Spicher.
   
 * started run on 2021/05/19 at 11:00:12.582     

           -------------------------------------------------
          |                Calculation Setup                |
           -------------------------------------------------

          program call               : /ihome/ghutchison/geoffh/xtb/xtb 689.xyz -opt
          hostname                   : smp-n144
          coordinate file            : 689.xyz
          omp threads                :                     1
          number of atoms            :                    34
          number of electrons        :                    86
          charge                     :                     0
          spin                       :                   0.0
          first test random number   :      0.78748948124079


########################################################################
# WARNING! Please study the warnings concerning your input carefully
#  - the use of '-opt' is discouraged, please use '--opt' next time
########################################################################

           ------------------------------------------------- 
          |                 G F N 2 - x T B                 |
          | Geometry, Frequencies, Noncovalent interactions |
          |            JCTC 2019 parametrisation            |
           ------------------------------------------------- 
             KAB for C  - Si     :                1.0500
             KAB for H  - Pd     :                0.9500
             k(s)              :                1.8500
             k(p)              :                2.2300
             k(d)              :                2.2300
             k(f)              :                2.0000
             kEN (H0ij)        :               -2.0000
             D4 a1             :                0.5200
             D4 a2             :                5.0000
             D4 s6             :                1.0000
             D4 s8             :                2.7000
             D4 s9             :                5.0000
             alphaj            :                2.0000

  Z AO/shell   Hii/eV     exponent
  1     Wed Apr 25 08:07:45 CEST 2018   EN: 2.200 GM2: 0.406  GM3: 0.0800  RAES: 1.40
     1s    -10.707211    1.230000
  6     Wed Apr 25 08:07:45 CEST 2018   EN: 2.550 GM2: 0.538  GM3: 0.1500  RAES: 3.00
     2s    -13.970922    2.096432
     2p    -10.063292    1.800000
  8     Wed Apr 25 08:07:45 CEST 2018   EN: 3.440 GM2: 0.452  GM3:-0.0517  RAES: 1.80
     2s    -20.229985    2.439742
     2p    -15.503117    2.137023

           ------------------------------------------------- 
          |        Self-Consistent Charge Iterations        |
           ------------------------------------------------- 

          ...................................................
          :                      SETUP                      :
          :.................................................:
          :  # basis functions                  82          :
          :  # atomic orbitals                  82          :
          :  # shells                           50          :
          :  # electrons                        86          :
          :  max. iterations                   250          :
          :  Hamiltonian                  GFN2-xTB          :
          :  restarted?                      false          :
          :  GBSA solvation                  false          :
          :  PC potential                    false          :
          :  electronic temp.          300.0000000     K    :
          :  accuracy                    1.0000000          :
          :  -> integral cutoff          0.2500000E+02      :
          :  -> integral neglect         0.1000000E-07      :
          :  -> SCF convergence          0.1000000E-05 Eh   :
          :  -> wf. convergence          0.1000000E-03 e    :
          :  Broyden damping             0.4000000          :
          ...................................................

 iter      E             dE          RMSdq      gap      omega  full diag
   1    -47.8480548 -0.478481E+02  0.440E+00    2.63       0.0  T
   2    -47.9134046 -0.653498E-01  0.253E+00    2.71       1.0  T
   3    -47.9069650  0.643958E-02  0.975E-01    2.56       1.0  T
   4    -47.9138416 -0.687653E-02  0.418E-01    2.73       1.0  T
   5    -47.9185327 -0.469111E-02  0.142E-01    2.72       1.0  T
   6    -47.9188820 -0.349377E-03  0.619E-02    2.70       1.0  T
   7    -47.9189138 -0.317914E-04  0.342E-02    2.70       1.0  T
   8    -47.9189261 -0.122333E-04  0.130E-02    2.70       1.3  T
   9    -47.9189279 -0.180853E-05  0.419E-03    2.70       4.1  T
  10    -47.9189281 -0.219965E-06  0.176E-03    2.70       9.7  T
  11    -47.9189282 -0.586738E-07  0.727E-04    2.70      23.6  T
  12    -47.9189282 -0.367698E-08  0.299E-04    2.70      57.4  T

   *** convergence criteria satisfied after 12 iterations ***

         #    Occupation            Energy/Eh            Energy/eV
      -------------------------------------------------------------
         1        2.0000           -0.7046597             -19.1748
       ...           ...                  ...                  ...
        37        2.0000           -0.4340922             -11.8123
        38        2.0000           -0.4214652             -11.4687
        39        2.0000           -0.4186750             -11.3927
        40        2.0000           -0.4115099             -11.1978
        41        2.0000           -0.4044074             -11.0045
        42        2.0000           -0.3705483             -10.0831
        43        2.0000           -0.3549849              -9.6596 (HOMO)
        44                         -0.2556604              -6.9569 (LUMO)
        45                         -0.2107151              -5.7338
        46                         -0.1950577              -5.3078
        47                         -0.1355984              -3.6898
        48                         -0.0768283              -2.0906
       ...                                ...                  ...
        82                          0.6819640              18.5572
      -------------------------------------------------------------
                  HL-Gap            0.0993245 Eh            2.7028 eV
             Fermi-level           -0.3053227 Eh           -8.3083 eV

 SCC (total)                   0 d,  0 h,  0 min,  0.051 sec
 SCC setup                      ...        0 min,  0.000 sec (  0.730%)
 Dispersion                     ...        0 min,  0.001 sec (  1.097%)
 integral evaluation            ...        0 min,  0.012 sec ( 23.519%)
 zeroth order Hamiltonian       ...        0 min,  0.000 sec (  0.421%)
 iterations                     ...        0 min,  0.020 sec ( 38.113%)
 molecular gradient             ...        0 min,  0.018 sec ( 35.168%)
 printout                       ...        0 min,  0.000 sec (  0.849%)

         :::::::::::::::::::::::::::::::::::::::::::::::::::::
         ::                     SUMMARY                     ::
         :::::::::::::::::::::::::::::::::::::::::::::::::::::
         :: total energy             -47.234323021756 Eh    ::
         :: gradient norm              0.043491483142 Eh/a0 ::
         :: HOMO-LUMO gap              2.702756525618 eV    ::
         ::.................................................::
         :: SCC energy               -47.918928156720 Eh    ::
         :: -> isotropic ES            0.033586090417 Eh    ::
         :: -> anisotropic ES          0.008291999952 Eh    ::
         :: -> anisotropic XC          0.021464178555 Eh    ::
         :: -> dispersion             -0.028379231563 Eh    ::
         :: repulsion energy           0.684716190192 Eh    ::
         :: add. restraining           0.000000000000 Eh    ::
         :::::::::::::::::::::::::::::::::::::::::::::::::::::

      ----------------------------------------------------------- 
     |                   =====================                   |
     |                        A N C O P T                        |
     |                   =====================                   |
     |               Approximate Normal Coordinate               |
     |                Rational Function Optimizer                |
      ----------------------------------------------------------- 

          ...................................................
          :                      SETUP                      :
          :.................................................:
          :   optimization level            normal          :
          :   max. optcycles                   200          :
          :   ANC micro-cycles                  20          :
          :   degrees of freedom                96          :
          :.................................................:
          :   RF solver                   davidson          :
          :   input Hessian                  false          :
          :   write xtbopt.log                true          :
          :   linear?                        false          :
          :   energy convergence         0.5000000E-05 Eh   :
          :   grad. convergence          0.1000000E-02 Eh/α :
          :   maximium RF displ.         2.0000000          :
          :   Hlow (freq-cutoff)         0.5000000E-02      :
          :   Hmax (freq-cutoff)         5.0000000          :
          :   S6 in model hess.         20.0000000          :
          ...................................................

generating ANC from model Hessian ...
Using Lindh-Hessian (1995)
 Shifting diagonal of input Hessian by   4.485193490642746E-003
 Lowest  eigenvalues of input Hessian
   -0.000000   -0.000000   -0.000000    0.000000    0.000000    0.000000
    0.005000    0.005245    0.005535    0.006020    0.006191    0.006992
    0.007258    0.007949    0.009923    0.010601    0.012973    0.014485
 Highest eigenvalues
    1.753625    1.840463    1.849861    1.968276    2.047345    2.078212
 

........................................................................
.............................. CYCLE    1 ..............................
........................................................................
   1    -47.9189282 -0.479189E+02  0.927E-05    2.70       0.0  T
   2    -47.9189282 -0.459295E-10  0.569E-05    2.70     301.3  T
   3    -47.9189282 -0.285283E-10  0.363E-05    2.70     472.8  T
     SCC iter.                  ...        0 min,  0.006 sec
     gradient                   ...        0 min,  0.018 sec
 * total energy  :   -47.2343230 Eh     change        0.4091005E-07 Eh
   gradient norm :     0.0434944 Eh/α   predicted     0.0000000E+00 (-100.00%)
   displ. norm   :     0.2816486 α      lambda       -0.5194088E-02
   maximum displ.:     0.1232360 α      in ANC's #11, #19, #7, ...

........................................................................
.............................. CYCLE    2 ..............................
........................................................................
   1    -47.9463289 -0.479463E+02  0.124E-01    2.69       0.0  T
   2    -47.9463362 -0.732053E-05  0.749E-02    2.70       1.0  T
   3    -47.9462926  0.435865E-04  0.402E-02    2.70       1.0  T
   4    -47.9463418 -0.491433E-04  0.708E-03    2.70       2.4  T
   5    -47.9463428 -0.101399E-05  0.296E-03    2.70       5.8  T
   6    -47.9463429 -0.989242E-07  0.144E-03    2.70      11.9  T
     SCC iter.                  ...        0 min,  0.010 sec
     gradient                   ...        0 min,  0.017 sec
 * total energy  :   -47.2377489 Eh     change       -0.3425955E-02 Eh
   gradient norm :     0.0164634 Eh/α   predicted    -0.2803070E-02 ( -18.18%)
   displ. norm   :     0.2577691 α      lambda       -0.1252314E-02
   maximum displ.:     0.1570046 α      in ANC's #11, #7, #6, ...

........................................................................
.............................. CYCLE    3 ..............................
........................................................................
   1    -47.9566452 -0.479566E+02  0.105E-01    2.66       0.0  T
   2    -47.9566487 -0.352005E-05  0.622E-02    2.67       1.0  T
   3    -47.9566359  0.127920E-04  0.213E-02    2.67       1.0  T
   4    -47.9566502 -0.143237E-04  0.455E-03    2.67       3.8  T
   5    -47.9566506 -0.401571E-06  0.204E-03    2.67       8.4  T
   6    -47.9566507 -0.503535E-07  0.109E-03    2.67      15.8  T
     SCC iter.                  ...        0 min,  0.010 sec
     gradient                   ...        0 min,  0.017 sec
 * total energy  :   -47.2385771 Eh     change       -0.8282051E-03 Eh
   gradient norm :     0.0053717 Eh/α   predicted    -0.6677802E-03 ( -19.37%)
   displ. norm   :     0.2647581 α      lambda       -0.5234077E-03
   maximum displ.:     0.1656759 α      in ANC's #11, #7, #6, ...

........................................................................
.............................. CYCLE    4 ..............................
........................................................................
   1    -47.9576201 -0.479576E+02  0.111E-01    2.63       0.0  T
   2    -47.9576223 -0.216687E-05  0.655E-02    2.63       1.0  T
   3    -47.9576214  0.924065E-06  0.743E-03    2.64       2.3  T
   4    -47.9576228 -0.137222E-05  0.273E-03    2.64       6.3  T
   5    -47.9576229 -0.114520E-06  0.144E-03    2.64      11.9  T
     SCC iter.                  ...        0 min,  0.008 sec
     gradient                   ...        0 min,  0.017 sec
 * total energy  :   -47.2389671 Eh     change       -0.3899997E-03 Eh
   gradient norm :     0.0056899 Eh/α   predicted    -0.2800489E-03 ( -28.19%)
   displ. norm   :     0.3152634 α      lambda       -0.4432564E-03
   maximum displ.:     0.1775357 α      in ANC's #11, #7, #6, ...

........................................................................
.............................. CYCLE    5 ..............................
........................................................................
   1    -47.9554450 -0.479554E+02  0.136E-01    2.60       0.0  T
   2    -47.9554468 -0.184626E-05  0.806E-02    2.60       1.0  T
   3    -47.9554450  0.182222E-05  0.863E-03    2.60       2.0  T
   4    -47.9554473 -0.233610E-05  0.341E-03    2.60       5.0  T
   5    -47.9554475 -0.194128E-06  0.169E-03    2.60      10.2  T
   6    -47.9554476 -0.263960E-07  0.785E-04    2.60      21.8  T
     SCC iter.                  ...        0 min,  0.009 sec
     gradient                   ...        0 min,  0.017 sec
 * total energy  :   -47.2392544 Eh     change       -0.2872414E-03 Eh
   gradient norm :     0.0069897 Eh/α   predicted    -0.2436569E-03 ( -15.17%)
   displ. norm   :     0.2468864 α      lambda       -0.2526019E-03
   maximum displ.:     0.1239253 α      in ANC's #11, #7, #9, ...

........................................................................
.............................. CYCLE    6 ..............................
........................................................................
   1    -47.9537646 -0.479538E+02  0.103E-01    2.59       0.0  T
   2    -47.9537654 -0.782955E-06  0.613E-02    2.59       1.0  T
   3    -47.9537628  0.258455E-05  0.946E-03    2.59       1.8  T
   4    -47.9537659 -0.308215E-05  0.229E-03    2.59       7.5  T
   5    -47.9537660 -0.504915E-07  0.144E-03    2.59      11.9  T
   6    -47.9537660 -0.193972E-07  0.397E-04    2.59      43.2  T
     SCC iter.                  ...        0 min,  0.009 sec
     gradient                   ...        0 min,  0.017 sec
 * total energy  :   -47.2393863 Eh     change       -0.1319226E-03 Eh
   gradient norm :     0.0066325 Eh/α   predicted    -0.1340101E-03 (   1.58%)
   displ. norm   :     0.1165134 α      lambda       -0.1217357E-03
   maximum displ.:     0.0528472 α      in ANC's #3, #7, #9, ...

........................................................................
.............................. CYCLE    7 ..............................
........................................................................
   1    -47.9550077 -0.479550E+02  0.495E-02    2.60       0.0  T
   2    -47.9550082 -0.557180E-06  0.296E-02    2.60       1.0  T
   3    -47.9550080  0.192990E-06  0.376E-03    2.60       4.6  T
   4    -47.9550084 -0.336929E-06  0.129E-03    2.60      13.3  T
   5    -47.9550084 -0.179161E-07  0.692E-04    2.60      24.8  T
     SCC iter.                  ...        0 min,  0.008 sec
     gradient                   ...        0 min,  0.017 sec
 * total energy  :   -47.2394618 Eh     change       -0.7546549E-04 Eh
   gradient norm :     0.0031005 Eh/α   predicted    -0.6169626E-04 ( -18.25%)
   displ. norm   :     0.0946575 α      lambda       -0.5422774E-04
   maximum displ.:     0.0556976 α      in ANC's #3, #1, #9, ...

........................................................................
.............................. CYCLE    8 ..............................
........................................................................
   1    -47.9559245 -0.479559E+02  0.405E-02    2.61       0.0  T
   2    -47.9559250 -0.520627E-06  0.243E-02    2.61       1.0  T
   3    -47.9559248  0.244559E-06  0.397E-03    2.61       4.3  T
   4    -47.9559252 -0.368777E-06  0.142E-03    2.61      12.0  T
   5    -47.9559252 -0.264636E-07  0.731E-04    2.61      23.4  T
   6    -47.9559252 -0.547066E-08  0.382E-04    2.61      44.9  T
     SCC iter.                  ...        0 min,  0.009 sec
     gradient                   ...        0 min,  0.018 sec
 * total energy  :   -47.2395021 Eh     change       -0.4033148E-04 Eh
   gradient norm :     0.0017060 Eh/α   predicted    -0.2736032E-04 ( -32.16%)
   displ. norm   :     0.1734434 α      lambda       -0.4925633E-04
   maximum displ.:     0.1119478 α      in ANC's #3, #1, #10, ...

........................................................................
.............................. CYCLE    9 ..............................
........................................................................
   1    -47.9571628 -0.479572E+02  0.720E-02    2.62       0.0  T
   2    -47.9571640 -0.126833E-05  0.436E-02    2.62       1.0  T
   3    -47.9571635  0.578379E-06  0.616E-03    2.62       2.8  T
   4    -47.9571645 -0.101445E-05  0.263E-03    2.62       6.5  T
   5    -47.9571646 -0.946798E-07  0.145E-03    2.62      11.8  T
   6    -47.9571646 -0.183474E-07  0.627E-04    2.62      27.4  T
   7    -47.9571646 -0.311208E-08  0.231E-04    2.62      74.4  T
     SCC iter.                  ...        0 min,  0.011 sec
     gradient                   ...        0 min,  0.018 sec
 * total energy  :   -47.2395459 Eh     change       -0.4382471E-04 Eh
   gradient norm :     0.0036714 Eh/α   predicted    -0.2496004E-04 ( -43.05%)
   displ. norm   :     0.0708711 α      lambda       -0.2815516E-04
   maximum displ.:     0.0489415 α      in ANC's #3, #1, #10, ...

........................................................................
.............................. CYCLE   10 ..............................
........................................................................
   1    -47.9569888 -0.479570E+02  0.267E-02    2.61       0.0  T
   2    -47.9569889 -0.122438E-06  0.162E-02    2.61       1.1  T
   3    -47.9569889  0.186817E-07  0.173E-03    2.61       9.9  T
   4    -47.9569890 -0.828362E-07  0.709E-04    2.61      24.2  T
   5    -47.9569890 -0.233941E-08  0.332E-04    2.61      51.6  T
     SCC iter.                  ...        0 min,  0.008 sec
     gradient                   ...        0 min,  0.018 sec
 * total energy  :   -47.2395694 Eh     change       -0.2343385E-04 Eh
   gradient norm :     0.0029972 Eh/α   predicted    -0.1414850E-04 ( -39.62%)
   displ. norm   :     0.1281469 α      lambda       -0.4964114E-04
   maximum displ.:     0.0851575 α      in ANC's #3, #1, #10, ...

........................................................................
.............................. CYCLE   11 ..............................
........................................................................
   1    -47.9567720 -0.479568E+02  0.477E-02    2.61       0.0  T
   2    -47.9567726 -0.566454E-06  0.287E-02    2.61       1.0  T
   3    -47.9567724  0.168075E-06  0.371E-03    2.61       4.6  T
   4    -47.9567727 -0.354762E-06  0.132E-03    2.61      13.0  T
   5    -47.9567728 -0.129795E-07  0.737E-04    2.61      23.3  T
   6    -47.9567728 -0.324916E-08  0.339E-04    2.61      50.6  T
     SCC iter.                  ...        0 min,  0.009 sec
     gradient                   ...        0 min,  0.018 sec
 * total energy  :   -47.2396067 Eh     change       -0.3734291E-04 Eh
   gradient norm :     0.0013801 Eh/α   predicted    -0.2522942E-04 ( -32.44%)
   displ. norm   :     0.2128681 α      lambda       -0.3431306E-04
   maximum displ.:     0.1385415 α      in ANC's #3, #1, #13, ...

........................................................................
.............................. CYCLE   12 ..............................
........................................................................
   1    -47.9553494 -0.479553E+02  0.762E-02    2.60       0.0  T
   2    -47.9553503 -0.862686E-06  0.456E-02    2.60       1.0  T
   3    -47.9553500  0.219543E-06  0.496E-03    2.60       3.5  T
   4    -47.9553506 -0.571058E-06  0.199E-03    2.60       8.6  T
   5    -47.9553506 -0.143641E-07  0.127E-03    2.60      13.5  T
   6    -47.9553506 -0.205516E-07  0.507E-04    2.60      33.8  T
   7    -47.9553506 -0.234467E-08  0.192E-04    2.60      89.2  T
     SCC iter.                  ...        0 min,  0.011 sec
     gradient                   ...        0 min,  0.018 sec
 * total energy  :   -47.2396345 Eh     change       -0.2777982E-04 Eh
   gradient norm :     0.0023772 Eh/α   predicted    -0.1750409E-04 ( -36.99%)
   displ. norm   :     0.0670408 α      lambda       -0.1686315E-04
   maximum displ.:     0.0441101 α      in ANC's #1, #3, #5, ...

........................................................................
.............................. CYCLE   13 ..............................
........................................................................
   1    -47.9559817 -0.479560E+02  0.248E-02    2.60       0.0  T
   2    -47.9559818 -0.725636E-07  0.147E-02    2.60       1.2  T
   3    -47.9559818  0.476072E-07  0.170E-03    2.60      10.1  T
   4    -47.9559818 -0.703196E-07  0.625E-04    2.60      27.5  T
   5    -47.9559818 -0.473202E-08  0.348E-04    2.60      49.3  T
     SCC iter.                  ...        0 min,  0.008 sec
     gradient                   ...        0 min,  0.018 sec
 * total energy  :   -47.2396466 Eh     change       -0.1214125E-04 Eh
   gradient norm :     0.0019979 Eh/α   predicted    -0.8471061E-05 ( -30.23%)
   displ. norm   :     0.1246512 α      lambda       -0.1683089E-04
   maximum displ.:     0.0831457 α      in ANC's #1, #3, #7, ...

........................................................................
.............................. CYCLE   14 ..............................
........................................................................
   1    -47.9564551 -0.479565E+02  0.444E-02    2.60       0.0  T
   2    -47.9564554 -0.294065E-06  0.263E-02    2.60       1.0  T
   3    -47.9564552  0.194741E-06  0.312E-03    2.60       5.5  T
   4    -47.9564555 -0.284275E-06  0.870E-04    2.60      19.7  T
   5    -47.9564555 -0.672744E-08  0.484E-04    2.60      35.4  T
     SCC iter.                  ...        0 min,  0.008 sec
     gradient                   ...        0 min,  0.018 sec
 * total energy  :   -47.2396622 Eh     change       -0.1556886E-04 Eh
   gradient norm :     0.0010303 Eh/α   predicted    -0.8478294E-05 ( -45.54%)
   displ. norm   :     0.0831703 α      lambda       -0.8247726E-05
   maximum displ.:     0.0567647 α      in ANC's #1, #3, #5, ...

........................................................................
.............................. CYCLE   15 ..............................
........................................................................
   1    -47.9568250 -0.479568E+02  0.307E-02    2.61       0.0  T
   2    -47.9568251 -0.144999E-06  0.182E-02    2.60       1.0  T
   3    -47.9568250  0.114474E-06  0.250E-03    2.61       6.9  T
   4    -47.9568252 -0.150945E-06  0.911E-04    2.60      18.8  T
   5    -47.9568252 -0.132276E-07  0.457E-04    2.60      37.6  T
     SCC iter.                  ...        0 min,  0.008 sec
     gradient                   ...        0 min,  0.018 sec
 * total energy  :   -47.2396694 Eh     change       -0.7159759E-05 Eh
   gradient norm :     0.0013900 Eh/α   predicted    -0.4138377E-05 ( -42.20%)
   displ. norm   :     0.0698690 α      lambda       -0.6666142E-05
   maximum displ.:     0.0470583 α      in ANC's #1, #5, #3, ...

........................................................................
.............................. CYCLE   16 ..............................
........................................................................
   1    -47.9564490 -0.479564E+02  0.277E-02    2.60       0.0  T
   2    -47.9564491 -0.839451E-07  0.164E-02    2.60       1.0  T
   3    -47.9564491 -0.372290E-08  0.128E-03    2.60      13.4  T
   4    -47.9564491 -0.288728E-07  0.666E-04    2.60      25.7  T
   5    -47.9564492 -0.368748E-08  0.388E-04    2.60      44.2  T
     SCC iter.                  ...        0 min,  0.008 sec
     gradient                   ...        0 min,  0.018 sec
 * total energy  :   -47.2396767 Eh     change       -0.7331937E-05 Eh
   gradient norm :     0.0009449 Eh/α   predicted    -0.3344185E-05 ( -54.39%)
   displ. norm   :     0.0706889 α      lambda       -0.9074197E-06
   maximum displ.:     0.0482685 α      in ANC's #1, #5, #3, ...

........................................................................
.............................. CYCLE   17 ..............................
........................................................................
   1    -47.9559818 -0.479560E+02  0.279E-02    2.60       0.0  T
   2    -47.9559819 -0.867871E-07  0.165E-02    2.60       1.0  T
   3    -47.9559819 -0.462181E-08  0.128E-03    2.60      13.4  T
   4    -47.9559820 -0.299611E-07  0.627E-04    2.60      27.3  T
   5    -47.9559820 -0.243760E-08  0.377E-04    2.60      45.5  T
     SCC iter.                  ...        0 min,  0.008 sec
     gradient                   ...        0 min,  0.018 sec
 * total energy  :   -47.2396782 Eh     change       -0.1535558E-05 Eh
   gradient norm :     0.0014675 Eh/α   predicted    -0.4579722E-06 ( -70.18%)
   displ. norm   :     0.0705141 α      lambda        0.6734805E-05
   maximum displ.:     0.0480106 α      in ANC's #1, #5, #3, ...

........................................................................
.............................. CYCLE   18 ..............................
........................................................................
   1    -47.9554325 -0.479554E+02  0.278E-02    2.60       0.0  T
   2    -47.9554326 -0.878266E-07  0.165E-02    2.60       1.0  T
   3    -47.9554326 -0.726001E-08  0.124E-03    2.60      13.9  T
   4    -47.9554326 -0.274063E-07  0.609E-04    2.60      28.2  T
   5    -47.9554326 -0.218049E-08  0.363E-04    2.60      47.2  T
     SCC iter.                  ...        0 min,  0.008 sec
     gradient                   ...        0 min,  0.018 sec
 * total energy  :   -47.2396735 Eh     change        0.4715183E-05 Eh
   gradient norm :     0.0024343 Eh/α   predicted     0.3374700E-05 ( -28.43%)
   displ. norm   :     0.0344001 α      lambda       -0.1265696E-04
   maximum displ.:     0.0177133 α      in ANC's #3, #7, #1, ...

........................................................................
.............................. CYCLE   19 ..............................
........................................................................
   1    -47.9561134 -0.479561E+02  0.130E-02    2.60       0.0  T
   2    -47.9561134 -0.480072E-07  0.771E-03    2.60       2.2  T
   3    -47.9561133  0.952620E-07  0.201E-03    2.60       8.5  T
   4    -47.9561134 -0.101607E-06  0.599E-04    2.60      28.7  T
   5    -47.9561134 -0.804737E-08  0.187E-04    2.60      91.5  T
     SCC iter.                  ...        0 min,  0.008 sec
     gradient                   ...        0 min,  0.018 sec
 * total energy  :   -47.2396831 Eh     change       -0.9604610E-05 Eh
   gradient norm :     0.0013489 Eh/α   predicted    -0.6337171E-05 ( -34.02%)
   displ. norm   :     0.0612042 α      lambda       -0.1253094E-04
   maximum displ.:     0.0336777 α      in ANC's #7, #3, #6, ...

........................................................................
.............................. CYCLE   20 ..............................
........................................................................
   1    -47.9567849 -0.479568E+02  0.246E-02    2.60       0.0  T
   2    -47.9567851 -0.189039E-06  0.145E-02    2.60       1.2  T
   3    -47.9567848  0.316097E-06  0.363E-03    2.60       4.7  T
   4    -47.9567851 -0.344415E-06  0.106E-03    2.60      16.2  T
   5    -47.9567852 -0.250561E-07  0.389E-04    2.60      44.1  T
   6    -47.9567852 -0.197311E-08  0.198E-04    2.60      86.5  T
     SCC iter.                  ...        0 min,  0.009 sec
     gradient                   ...        0 min,  0.018 sec
 * total energy  :   -47.2396917 Eh     change       -0.8554344E-05 Eh
   gradient norm :     0.0012845 Eh/α   predicted    -0.6278389E-05 ( -26.61%)
   displ. norm   :     0.0636015 α      lambda       -0.5610809E-05
   maximum displ.:     0.0405310 α      in ANC's #1, #5, #2, ...
 * RMSD in coord.:     0.3371792 α      energy gain  -0.5368642E-02 Eh

generating ANC from model Hessian ...
Using Lindh-Hessian (1995)
 Shifting diagonal of input Hessian by   4.432682336525350E-003
 Lowest  eigenvalues of input Hessian
   -0.000000   -0.000000   -0.000000    0.000000    0.000000    0.000000
    0.005000    0.005318    0.005637    0.006059    0.006303    0.007050
    0.007367    0.008091    0.010396    0.011057    0.013520    0.014943
 Highest eigenvalues
    1.813401    1.889273    1.915301    2.020691    2.109521    2.153983
 

........................................................................
.............................. CYCLE   21 ..............................
........................................................................
   1    -47.9569910 -0.479570E+02  0.258E-02    2.60       0.0  T
   2    -47.9569910 -0.552919E-07  0.152E-02    2.60       1.1  T
   3    -47.9569910 -0.110030E-07  0.828E-04    2.60      20.7  T
   4    -47.9569911 -0.800480E-08  0.511E-04    2.60      33.6  T
     SCC iter.                  ...        0 min,  0.007 sec
     gradient                   ...        0 min,  0.018 sec
 * total energy  :   -47.2396978 Eh     change       -0.6143018E-05 Eh
   gradient norm :     0.0011257 Eh/α   predicted     0.0000000E+00 (-100.00%)
   displ. norm   :     0.0333353 α      lambda       -0.6046280E-05
   maximum displ.:     0.0182128 α      in ANC's #1, #5, #7, ...

........................................................................
.............................. CYCLE   22 ..............................
........................................................................
   1    -47.9563027 -0.479563E+02  0.130E-02    2.60       0.0  T
   2    -47.9563028 -0.397227E-07  0.766E-03    2.60       2.2  T
   3    -47.9563028  0.552620E-08  0.716E-04    2.60      23.9  T
   4    -47.9563028 -0.846840E-08  0.327E-04    2.60      52.5  T
     SCC iter.                  ...        0 min,  0.007 sec
     gradient                   ...        0 min,  0.018 sec
 * total energy  :   -47.2397037 Eh     change       -0.5934543E-05 Eh
   gradient norm :     0.0003500 Eh/α   predicted    -0.3031189E-05 ( -48.92%)
   displ. norm   :     0.0267186 α      lambda       -0.2634059E-05
   maximum displ.:     0.0135471 α      in ANC's #5, #1, #11, ...

........................................................................
.............................. CYCLE   23 ..............................
........................................................................
   1    -47.9562023 -0.479562E+02  0.106E-02    2.60       0.0  T
   2    -47.9562023 -0.584527E-08  0.628E-03    2.60       2.7  T
   3    -47.9562023  0.585057E-07  0.153E-03    2.60      11.2  T
   4    -47.9562023 -0.648533E-07  0.143E-04    2.60     119.5  T
   5    -47.9562023 -0.198199E-09  0.832E-05    2.60     206.0  T
     SCC iter.                  ...        0 min,  0.008 sec
     gradient                   ...        0 min,  0.018 sec
 * total energy  :   -47.2397070 Eh     change       -0.3235655E-05 Eh
   gradient norm :     0.0004778 Eh/α   predicted    -0.1320437E-05 ( -59.19%)
   displ. norm   :     0.0783318 α      lambda       -0.6232874E-05
   maximum displ.:     0.0420723 α      in ANC's #5, #1, #11, ...

   *** GEOMETRY OPTIMIZATION CONVERGED AFTER 23 ITERATIONS ***

------------------------------------------------------------------------
 total energy gain   :        -0.0053840 Eh       -3.3785 kcal/mol
 total RMSD          :         0.3392760 a0        0.1795 Å
 total power (kW/mol):        -0.6145901 (step)  -15.3873 (real)
------------------------------------------------------------------------

 ANCopt (total)                0 d,  0 h,  0 min,  0.919 sec
 optimizer setup                ...        0 min,  0.000 sec (  0.016%)
 model hessian                  ...        0 min,  0.013 sec (  1.377%)
 ANC generation                 ...        0 min,  0.002 sec (  0.251%)
 coordinate transformation      ...        0 min,  0.001 sec (  0.056%)
 single point calculation       ...        0 min,  0.895 sec ( 97.383%)
 optimization log               ...        0 min,  0.003 sec (  0.326%)
 hessian update                 ...        0 min,  0.000 sec (  0.041%)
 rational function              ...        0 min,  0.004 sec (  0.391%)

================
 final structure:
================
$coord
    2.97372578091313    0.18428487234261   -0.57371563416698      C 
    1.75261617114357    2.50278048559372   -0.48938713460331      C 
    2.92084168262691    4.79871545427632   -0.37296257121686      O 
    5.58755787437421    4.88088978041155   -0.32493223563481      C 
    6.37457373384976    7.64195904663711   -0.19273679987732      C 
   -0.87638078417821    2.55513800232841   -0.51652837586229      C 
   -2.31115261703206    0.36122834665635   -0.63600187385501      C 
   -1.04085124377988   -1.99147485576545   -0.72032743316613      C 
    1.57512873405104   -2.03159268183886   -0.68852425420239      C 
   -2.54543796378602   -4.09015257848147   -0.80237179518417      O 
   -1.46867523861950   -6.49030805040669   -1.23407998041580      C 
   -0.65075128970149   -6.86719806798555   -3.97444020348016      C 
   -5.04999007145513    0.38964065818990   -0.65282648239778      C 
   -6.54302266751096    2.40524235637139   -1.02765141095497      C 
   -9.25864484941793    2.25468822370889   -1.01675622482973      C 
  -10.77388667816581    4.22342642285462   -1.41688970170778      C 
    5.00716119476922    0.05056525104890   -0.54852161781050      H 
    6.36252719061021    3.99811156965700   -2.03919372293231      H 
    6.30627200047745    3.85233914480725    1.33149953492777      H 
    5.65478289184438    8.65274442064916   -1.82886480289287      H 
    8.42244894393615    7.78598879599975   -0.15457513710300      H 
    5.60298364753728    8.50806530480600    1.50181581089297      H 
   -1.78434833432158    4.37466934796950   -0.41622597982508      H 
    2.59612121367644   -3.79534496476128   -0.73909039849338      H 
   -2.98680245696879   -7.81561296471689   -0.77070863253828      H 
    0.11008454500569   -6.84074345456302    0.06433533861998      H 
   -2.25489462800817   -6.56918217550044   -5.22357157208658      H 
    0.05390170207669   -8.77888698099136   -4.23248726813259      H 
    0.82519206861570   -5.53297334570254   -4.48885113522153      H 
   -5.92043647343217   -1.43717482432731   -0.36705969107119      H 
   -5.74760922662144    4.25392644708947   -1.37931536029462      H 
  -10.05954590062008    0.40612894873139   -0.65741344921788      H 
  -10.02857011924111    6.08348691977028   -1.78242200669723      H 
  -12.80033765544339    4.04886560006921   -1.39707275136869      H 
$end
           -------------------------------------------------
          |                Final Singlepoint                |
           -------------------------------------------------

          ...................................................
          :                      SETUP                      :
          :.................................................:
          :  # basis functions                  82          :
          :  # atomic orbitals                  82          :
          :  # shells                           50          :
          :  # electrons                        86          :
          :  max. iterations                   250          :
          :  Hamiltonian                  GFN2-xTB          :
          :  restarted?                      false          :
          :  GBSA solvation                  false          :
          :  PC potential                    false          :
          :  electronic temp.          300.0000000     K    :
          :  accuracy                    1.0000000          :
          :  -> integral cutoff          0.2500000E+02      :
          :  -> integral neglect         0.1000000E-07      :
          :  -> SCF convergence          0.1000000E-05 Eh   :
          :  -> wf. convergence          0.1000000E-03 e    :
          :  Broyden damping             0.4000000          :
          ...................................................

 iter      E             dE          RMSdq      gap      omega  full diag
   1    -47.9562023 -0.479562E+02  0.310E-05    2.60       0.0  T
   2    -47.9562023 -0.634515E-11  0.131E-05    2.60    1312.3  T
   3    -47.9562023 -0.444800E-11  0.118E-05    2.60    1456.9  T

   *** convergence criteria satisfied after 3 iterations ***

         #    Occupation            Energy/Eh            Energy/eV
      -------------------------------------------------------------
         1        2.0000           -0.7084890             -19.2790
       ...           ...                  ...                  ...
        37        2.0000           -0.4319286             -11.7534
        38        2.0000           -0.4202057             -11.4344
        39        2.0000           -0.4178484             -11.3702
        40        2.0000           -0.4110310             -11.1847
        41        2.0000           -0.4097334             -11.1494
        42        2.0000           -0.3705625             -10.0835
        43        2.0000           -0.3535361              -9.6202 (HOMO)
        44                         -0.2581216              -7.0238 (LUMO)
        45                         -0.2059701              -5.6047
        46                         -0.1911310              -5.2009
        47                         -0.1297708              -3.5312
        48                         -0.0668124              -1.8181
       ...                                ...                  ...
        82                          0.7185641              19.5531
      -------------------------------------------------------------
                  HL-Gap            0.0954145 Eh            2.5964 eV
             Fermi-level           -0.3058289 Eh           -8.3220 eV

 SCC (total)                   0 d,  0 h,  0 min,  0.036 sec
 SCC setup                      ...        0 min,  0.000 sec (  0.733%)
 Dispersion                     ...        0 min,  0.000 sec (  0.893%)
 integral evaluation            ...        0 min,  0.012 sec ( 32.526%)
 zeroth order Hamiltonian       ...        0 min,  0.000 sec (  0.501%)
 iterations                     ...        0 min,  0.005 sec ( 14.664%)
 molecular gradient             ...        0 min,  0.018 sec ( 49.427%)
 printout                       ...        0 min,  0.000 sec (  1.124%)

         :::::::::::::::::::::::::::::::::::::::::::::::::::::
         ::                     SUMMARY                     ::
         :::::::::::::::::::::::::::::::::::::::::::::::::::::
         :: total energy             -47.239706981124 Eh    ::
         :: gradient norm              0.000477863249 Eh/a0 ::
         :: HOMO-LUMO gap              2.596360229398 eV    ::
         ::.................................................::
         :: SCC energy               -47.956202328042 Eh    ::
         :: -> isotropic ES            0.033097015084 Eh    ::
         :: -> anisotropic ES          0.007343861069 Eh    ::
         :: -> anisotropic XC          0.020078623871 Eh    ::
         :: -> dispersion             -0.028585729565 Eh    ::
         :: repulsion energy           0.716636635311 Eh    ::
         :: add. restraining           0.000000000000 Eh    ::
         :::::::::::::::::::::::::::::::::::::::::::::::::::::

           -------------------------------------------------
          |                Property Printout                |
           -------------------------------------------------

    * Orbital Energies and Occupations

         #    Occupation            Energy/Eh            Energy/eV
      -------------------------------------------------------------
         1        2.0000           -0.7084890             -19.2790
       ...           ...                  ...                  ...
        31        2.0000           -0.4597572             -12.5106
        32        2.0000           -0.4575196             -12.4497
        33        2.0000           -0.4495211             -12.2321
        34        2.0000           -0.4466442             -12.1538
        35        2.0000           -0.4445424             -12.0966
        36        2.0000           -0.4433816             -12.0650
        37        2.0000           -0.4319286             -11.7534
        38        2.0000           -0.4202057             -11.4344
        39        2.0000           -0.4178484             -11.3702
        40        2.0000           -0.4110310             -11.1847
        41        2.0000           -0.4097334             -11.1494
        42        2.0000           -0.3705625             -10.0835
        43        2.0000           -0.3535361              -9.6202 (HOMO)
        44                         -0.2581216              -7.0238 (LUMO)
        45                         -0.2059701              -5.6047
        46                         -0.1911310              -5.2009
        47                         -0.1297708              -3.5312
        48                         -0.0668124              -1.8181
        49                          0.0201207               0.5475
        50                          0.0298977               0.8136
        51                          0.0982531               2.6736
        52                          0.0992846               2.7017
        53                          0.1149091               3.1268
        54                          0.1170020               3.1838
       ...                                ...                  ...
        82                          0.7185641              19.5531
      -------------------------------------------------------------
                  HL-Gap            0.0954145 Eh            2.5964 eV
             Fermi-level           -0.3058289 Eh           -8.3220 eV

     #   Z        covCN         q      C6AA      α(0)
     1   6 C      2.918    -0.072    29.790     8.950
     2   6 C      2.859     0.132    25.105     8.213
     3   8 O      1.706    -0.280    18.644     5.830
     4   6 C      3.691     0.089    19.273     6.282
     5   6 C      3.751    -0.113    22.718     6.797
     6   6 C      2.926    -0.062    29.547     8.914
     7   6 C      2.969    -0.005    28.145     8.702
     8   6 C      2.862     0.130    25.160     8.222
     9   6 C      2.916    -0.070    29.739     8.943
    10   8 O      1.704    -0.277    18.591     5.822
    11   6 C      3.688     0.082    19.393     6.303
    12   6 C      3.750    -0.115    22.761     6.804
    13   6 C      2.905    -0.035    28.860     8.809
    14   6 C      2.899    -0.037    28.909     8.816
    15   6 C      2.895    -0.025    28.632     8.773
    16   6 C      2.841    -0.089    30.236     9.011
    17   1 H      0.926     0.032     2.563     2.503
    18   1 H      0.923     0.026     2.648     2.545
    19   1 H      0.923     0.026     2.645     2.543
    20   1 H      0.925     0.056     2.245     2.343
    21   1 H      0.925     0.045     2.387     2.416
    22   1 H      0.925     0.056     2.244     2.343
    23   1 H      0.926     0.056     2.250     2.346
    24   1 H      0.926     0.036     2.506     2.476
    25   1 H      0.924     0.049     2.329     2.387
    26   1 H      0.924     0.028     2.618     2.530
    27   1 H      0.925     0.051     2.306     2.375
    28   1 H      0.925     0.042     2.422     2.434
    29   1 H      0.925     0.048     2.348     2.396
    30   1 H      0.925     0.054     2.275     2.359
    31   1 H      0.926     0.038     2.469     2.457
    32   1 H      0.925     0.033     2.539     2.492
    33   1 H      0.926     0.037     2.491     2.468
    34   1 H      0.926     0.033     2.541     2.493

 Mol. C6AA /au·bohr⁶  :      11688.617676
 Mol. C8AA /au·bohr⁸  :     270982.273197
 Mol. α(0) /au        :        169.096293


Wiberg/Mayer (AO) data.
largest (>0.10) Wiberg bond orders for each atom
          total WBO             WBO to atom ...
     1  C   3.975        C    9 1.413    C    2 1.374    H   17 0.967
     2  C   3.935        C    1 1.374    C    6 1.359    O    3 1.052
     3  O   2.213        C    2 1.052    C    4 0.971
     4  C   3.951        C    5 1.015    O    3 0.971    H   19 0.969    H   18 0.969
     5  C   3.992        C    4 1.015    H   22 0.986    H   20 0.986    H   21 0.985
     6  C   3.970        C    7 1.405    C    2 1.359    H   23 0.962
     7  C   3.986        C    6 1.405    C    8 1.268    C   13 1.120
     8  C   3.922        C    9 1.406    C    7 1.268    O   10 1.055
     9  C   3.987        C    1 1.413    C    8 1.406    H   24 0.963
    10  O   2.222        C    8 1.055    C   11 0.972
    11  C   3.949        C   12 1.009    O   10 0.972    H   25 0.971    H   26 0.966
    12  C   3.992        C   11 1.009    H   27 0.987    H   28 0.985    H   29 0.984
    13  C   3.989        C   14 1.740    C    7 1.120    H   30 0.959    C   16 0.128
    14  C   3.990        C   13 1.740    C   15 1.145    H   31 0.959
    15  C   3.991        C   16 1.857    C   14 1.145    H   32 0.964
    16  C   3.946        C   15 1.857    H   34 0.980    H   33 0.977    C   13 0.128
    17  H   0.999        C    1 0.967
    18  H   0.999        C    4 0.969
    19  H   0.999        C    4 0.969
    20  H   0.997        C    5 0.986
    21  H   0.997        C    5 0.985
    22  H   0.997        C    5 0.986
    23  H   0.996        C    6 0.962
    24  H   0.998        C    9 0.963
    25  H   0.997        C   11 0.971
    26  H   0.999        C   11 0.966
    27  H   0.997        C   12 0.987
    28  H   0.998        C   12 0.985
    29  H   0.998        C   12 0.984
    30  H   0.997        C   13 0.959
    31  H   0.998        C   14 0.959
    32  H   0.999        C   15 0.964
    33  H   0.999        C   16 0.977
    34  H   0.998        C   16 0.980

molecular dipole:
                 x           y           z       tot (Debye)
 q only:        0.675      -0.338      -0.159
   full:        0.974      -0.553      -0.152       2.873
molecular quadrupole (traceless):
                xx          xy          yy          xz          yz          zz
 q only:        0.093       4.131       5.009      -0.331       2.312      -5.102
  q+dip:        2.852       2.224       5.792      -0.205       1.069      -8.643
   full:        1.111       2.933       4.386      -0.434       1.747      -5.497

           -------------------------------------------------
          |                Geometry Summary                 |
           -------------------------------------------------

      molecular mass/u    :      218.2950000
   center of mass at/Å    :       -0.5853148       0.3466640      -0.4941382
  moments of inertia/u·Å² :        0.1020698E+04   0.1559847E+04   0.2507792E+04
rotational constants/cm⁻¹ :        0.1651578E-01   0.1080723E-01   0.6722102E-02

 * 32 selected distances

     #   Z        #   Z                                     value/Å
     1   6 C      2   6 C                                 1.3873774
     2   6 C      3   8 O                                 1.3645821
     3   8 O      4   6 C                                 1.4120642
     4   6 C      5   6 C                                 1.5209012
     2   6 C      6   6 C                                 1.3915554
     6   6 C      7   6 C                                 1.3886325
     7   6 C      8   6 C                                 1.4155851
     1   6 C      9   6 C                                 1.3879552
     8   6 C      9   6 C                                 1.3845822
     8   6 C     10   8 O                                 1.3671795
    10   8 O     11   6 C                                 1.4106854
    11   6 C     12   6 C                                 1.5264375 (max)
    13   6 C     14   6 C                                 1.3420973
    15   6 C     16   6 C                                 1.3315928
     1   6 C     17   1 H                                 1.0784543
     4   6 C     18   1 H                                 1.0996919
     4   6 C     19   1 H                                 1.0996493
     5   6 C     20   1 H                                 1.0866447
     5   6 C     21   1 H                                 1.0865536
     5   6 C     22   1 H                                 1.0866832
     6   6 C     23   1 H                                 1.0773872
     9   6 C     24   1 H                                 1.0787697
    11   6 C     25   1 H                                 1.0942404
    11   6 C     26   1 H                                 1.0974746
    12   6 C     27   1 H                                 1.0873812
    12   6 C     28   1 H                                 1.0867707
    12   6 C     29   1 H                                 1.0874796
    13   6 C     30   1 H                                 1.0814646
    14   6 C     31   1 H                                 1.0811265
    15   6 C     32   1 H                                 1.0829068
    16   6 C     33   1 H                                 1.0778778
    16   6 C     34   1 H                                 1.0763741 (min)

 * 3 distinct bonds (by element types)

   Z      Z             #   av. dist./Å        max./Å        min./Å
   1 H    6 C          18     1.0859406     1.0996919     1.0763741
   6 C    6 C          10     1.4076717     1.5264375     1.3315928
   6 C    8 O           4     1.3886278     1.4120642     1.3645821


optimized geometry written to: xtbopt.xyz


           -------------------------------------------------
          | TOTAL ENERGY              -47.239706981124 Eh   |
          | GRADIENT NORM               0.000477863249 Eh/α |
          | HOMO-LUMO GAP               2.596360229398 eV   |
           -------------------------------------------------

------------------------------------------------------------------------
 * finished run on 2021/05/19 at 11:00:13.613     
------------------------------------------------------------------------
 total:
 * wall-time:     0 d,  0 h,  0 min,  1.031 sec
 *  cpu-time:     0 d,  0 h,  0 min,  1.028 sec
 * ratio c/w:     0.997 speedup
 SCF:
 * wall-time:     0 d,  0 h,  0 min,  0.052 sec
 *  cpu-time:     0 d,  0 h,  0 min,  0.051 sec
 * ratio c/w:     0.998 speedup
 ANC optimizer:
 * wall-time:     0 d,  0 h,  0 min,  0.956 sec
 *  cpu-time:     0 d,  0 h,  0 min,  0.953 sec
 * ratio c/w:     0.998 speedup

