      -----------------------------------------------------------      
     |                   =====================                   |     
     |                           x T B                           |     
     |                   =====================                   |     
     |                         S. Grimme                         |     
     |          Mulliken Center for Theoretical Chemistry        |     
     |                    University of Bonn                     |     
     |                Version 6.2 RC2 (SAW190805)                |     
      -----------------------------------------------------------      

   This program is distributed in the hope that it will be useful,
   but WITHOUT ANY WARRANTY; without even the implied warranty of
   MERCHANTABILITY or FITNESS FOR A PARTICULAR PURPOSE.
   
   FOR NON-COMMERCIAL, ACADEMIA USE ONLY.
   
   Cite this work as:
   * S. Grimme, C. Bannwarth, P. Shushkov, J. Chem. Theory Comput., 2017,
     13, 1989-2009. DOI: 10.1021/acs.jctc.7b00118
   * C. Bannwarth, S. Ehlert and S. Grimme., J. Chem. Theory Comput., 2019,
     15, 1652-1671. DOI: 10.1021/acs.jctc.8b01176
   * P. Pracht, E. Caldeweyher, S. Ehlert, S. Grimme, ChemRxiv, 2019, preprint.
     DOI: 10.26434/chemrxiv.8326202.v1
   
   for DFT-D4:
   * E. Caldeweyher, C. Bannwarth and S. Grimme, J. Chem. Phys., 2017,
     147, 034112. DOI: 10.1063/1.4993215
   * E. Caldeweyher, S. Ehlert, A. Hansen, H. Neugebauer, S. Spicher,
     C. Bannwarth and S. Grimme, J. Chem. Phys., 2019, 150, 154122.
     DOI: 10.1063/1.5090222
   
   for sTDA-xTB:
   * S. Grimme and C. Bannwarth, J. Chem. Phys., 2016, 145, 054103.
     DOI: 10.1063/1.4959605
   
   in the mass-spec context:
   * V. Asgeirsson, C. Bauer and S. Grimme, Chem. Sci., 2017, 8, 4879.
     DOI: 10.1039/c7sc00601b
   
   for metadynamics refer to:
   * S. Grimme, J. Chem. Theory Comput., 2019, 155, 2847-2862
     DOI: 10.1021/acs.jctc.9b00143
   
   with help from (in alphabetical order)
   C. Bannwarth, F. Bohle, G. Brandenburg, E. Caldeweyher, M. Checinski,
   S. Dohm, S. Ehlert, S. Ehrlich, F. März, H. Neugebauer, J. Pisarek,
   P. Pracht, P. Shushkov, and S. Spicher.
   
 * started run on 2021/05/19 at 10:58:43.169     

           -------------------------------------------------
          |                Calculation Setup                |
           -------------------------------------------------

          program call               : /ihome/ghutchison/geoffh/xtb/xtb 69.xyz -opt
          hostname                   : smp-n58
          coordinate file            : 69.xyz
          omp threads                :                     1
          number of atoms            :                    21
          number of electrons        :                    68
          charge                     :                     0
          spin                       :                   0.0
          first test random number   :      0.08088106050849


########################################################################
# WARNING! Please study the warnings concerning your input carefully
#  - the use of '-opt' is discouraged, please use '--opt' next time
########################################################################

           ------------------------------------------------- 
          |                 G F N 2 - x T B                 |
          | Geometry, Frequencies, Noncovalent interactions |
          |            JCTC 2019 parametrisation            |
           ------------------------------------------------- 
             KAB for C  - Si     :                1.0500
             KAB for H  - Pd     :                0.9500
             k(s)              :                1.8500
             k(p)              :                2.2300
             k(d)              :                2.2300
             k(f)              :                2.0000
             kEN (H0ij)        :               -2.0000
             D4 a1             :                0.5200
             D4 a2             :                5.0000
             D4 s6             :                1.0000
             D4 s8             :                2.7000
             D4 s9             :                5.0000
             alphaj            :                2.0000

  Z AO/shell   Hii/eV     exponent
  1     Wed Apr 25 08:07:45 CEST 2018   EN: 2.200 GM2: 0.406  GM3: 0.0800  RAES: 1.40
     1s    -10.707211    1.230000
  6     Wed Apr 25 08:07:45 CEST 2018   EN: 2.550 GM2: 0.538  GM3: 0.1500  RAES: 3.00
     2s    -13.970922    2.096432
     2p    -10.063292    1.800000
  8     Wed Apr 25 08:07:45 CEST 2018   EN: 3.440 GM2: 0.452  GM3:-0.0517  RAES: 1.80
     2s    -20.229985    2.439742
     2p    -15.503117    2.137023
 16     Tue Apr 24 11:44:34 CEST 2018   EN: 2.580 GM2: 0.340  GM3:-0.0502  RAES: 3.10
     3s    -20.029654    1.981333
     3p    -11.377694    2.025643
     3d     -0.420282    1.702555

           ------------------------------------------------- 
          |        Self-Consistent Charge Iterations        |
           ------------------------------------------------- 

          ...................................................
          :                      SETUP                      :
          :.................................................:
          :  # basis functions                  78          :
          :  # atomic orbitals                  75          :
          :  # shells                           37          :
          :  # electrons                        68          :
          :  max. iterations                   250          :
          :  Hamiltonian                  GFN2-xTB          :
          :  restarted?                      false          :
          :  GBSA solvation                  false          :
          :  PC potential                    false          :
          :  electronic temp.          300.0000000     K    :
          :  accuracy                    1.0000000          :
          :  -> integral cutoff          0.2500000E+02      :
          :  -> integral neglect         0.1000000E-07      :
          :  -> SCF convergence          0.1000000E-05 Eh   :
          :  -> wf. convergence          0.1000000E-03 e    :
          :  Broyden damping             0.4000000          :
          ...................................................

 iter      E             dE          RMSdq      gap      omega  full diag
   1    -37.4554037 -0.374554E+02  0.548E+00    2.89       0.0  T
   2    -37.5021438 -0.467401E-01  0.296E+00    2.15       1.0  T
   3    -37.4957972  0.634662E-02  0.159E+00    2.42       1.0  T
   4    -37.5158889 -0.200917E-01  0.414E-01    2.03       1.0  T
   5    -37.5156108  0.278068E-03  0.255E-01    2.07       1.0  T
   6    -37.5163160 -0.705186E-03  0.972E-02    2.08       1.0  T
   7    -37.5164262 -0.110188E-03  0.275E-02    2.07       1.0  T
   8    -37.5164272 -0.102886E-05  0.164E-02    2.07       1.3  T
   9    -37.5164276 -0.402573E-06  0.102E-02    2.07       2.1  T
  10    -37.5164285 -0.932159E-06  0.274E-03    2.07       8.0  T
  11    -37.5164285 -0.246527E-07  0.144E-03    2.07      15.2  T
  12    -37.5164285 -0.971767E-09  0.807E-04    2.07      27.0  T
  13    -37.5164286 -0.480485E-08  0.300E-04    2.07      72.6  T

   *** convergence criteria satisfied after 13 iterations ***

         #    Occupation            Energy/Eh            Energy/eV
      -------------------------------------------------------------
         1        2.0000           -0.7510286             -20.4365
       ...           ...                  ...                  ...
        28        2.0000           -0.4535787             -12.3425
        29        2.0000           -0.4435661             -12.0700
        30        2.0000           -0.4295546             -11.6888
        31        2.0000           -0.4222408             -11.4898
        32        2.0000           -0.4037094             -10.9855
        33        2.0000           -0.3834239             -10.4335
        34        2.0000           -0.3719516             -10.1213 (HOMO)
        35                         -0.2959199              -8.0524 (LUMO)
        36                         -0.2815020              -7.6601
        37                         -0.2422279              -6.5914
        38                         -0.2316548              -6.3036
        39                         -0.2108917              -5.7387
       ...                                ...                  ...
        75                          0.6514150              17.7259
      -------------------------------------------------------------
                  HL-Gap            0.0760317 Eh            2.0689 eV
             Fermi-level           -0.3339358 Eh           -9.0869 eV

 SCC (total)                   0 d,  0 h,  0 min,  0.045 sec
 SCC setup                      ...        0 min,  0.000 sec (  0.604%)
 Dispersion                     ...        0 min,  0.000 sec (  0.545%)
 integral evaluation            ...        0 min,  0.011 sec ( 23.798%)
 zeroth order Hamiltonian       ...        0 min,  0.000 sec (  0.406%)
 iterations                     ...        0 min,  0.016 sec ( 36.474%)
 molecular gradient             ...        0 min,  0.017 sec ( 37.243%)
 printout                       ...        0 min,  0.000 sec (  0.817%)

         :::::::::::::::::::::::::::::::::::::::::::::::::::::
         ::                     SUMMARY                     ::
         :::::::::::::::::::::::::::::::::::::::::::::::::::::
         :: total energy             -37.086480473738 Eh    ::
         :: gradient norm              0.082706337394 Eh/a0 ::
         :: HOMO-LUMO gap              2.068927372286 eV    ::
         ::.................................................::
         :: SCC energy               -37.516428550753 Eh    ::
         :: -> isotropic ES            0.028289540610 Eh    ::
         :: -> anisotropic ES          0.001706672486 Eh    ::
         :: -> anisotropic XC          0.019010151163 Eh    ::
         :: -> dispersion             -0.027601284456 Eh    ::
         :: repulsion energy           0.429718995933 Eh    ::
         :: add. restraining           0.000000000000 Eh    ::
         :::::::::::::::::::::::::::::::::::::::::::::::::::::

      ----------------------------------------------------------- 
     |                   =====================                   |
     |                        A N C O P T                        |
     |                   =====================                   |
     |               Approximate Normal Coordinate               |
     |                Rational Function Optimizer                |
      ----------------------------------------------------------- 

          ...................................................
          :                      SETUP                      :
          :.................................................:
          :   optimization level            normal          :
          :   max. optcycles                   200          :
          :   ANC micro-cycles                  20          :
          :   degrees of freedom                57          :
          :.................................................:
          :   RF solver                   davidson          :
          :   input Hessian                  false          :
          :   write xtbopt.log                true          :
          :   linear?                        false          :
          :   energy convergence         0.5000000E-05 Eh   :
          :   grad. convergence          0.1000000E-02 Eh/α :
          :   maximium RF displ.         2.0000000          :
          :   Hlow (freq-cutoff)         0.5000000E-02      :
          :   Hmax (freq-cutoff)         5.0000000          :
          :   S6 in model hess.         20.0000000          :
          ...................................................

generating ANC from model Hessian ...
Using Lindh-Hessian (1995)
 Shifting diagonal of input Hessian by   3.743956937343322E-003
 Lowest  eigenvalues of input Hessian
   -0.000000   -0.000000    0.000000    0.000000    0.000000    0.000000
    0.005000    0.006455    0.006929    0.009511    0.011151    0.014634
    0.016750    0.024318    0.027549    0.029032    0.034821    0.037335
 Highest eigenvalues
    1.519561    1.633923    1.755991    1.807538    1.968506    2.014847
 

........................................................................
.............................. CYCLE    1 ..............................
........................................................................
   1    -37.5164286 -0.375164E+02  0.166E-04    2.07       0.0  T
   2    -37.5164286 -0.564881E-10  0.112E-04    2.07     194.4  T
   3    -37.5164286 -0.119606E-09  0.741E-05    2.07     294.3  T
     SCC iter.                  ...        0 min,  0.004 sec
     gradient                   ...        0 min,  0.016 sec
 * total energy  :   -37.0864805 Eh     change       -0.1781994E-07 Eh
   gradient norm :     0.0827046 Eh/α   predicted     0.0000000E+00 (-100.00%)
   displ. norm   :     0.2949559 α      lambda       -0.8245245E-02
   maximum displ.:     0.1634238 α      in ANC's #3, #13, #2, ...

........................................................................
.............................. CYCLE    2 ..............................
........................................................................
   1    -37.5383022 -0.375383E+02  0.459E-01    2.30       0.0  T
   2    -37.5384611 -0.158931E-03  0.219E-01    2.22       1.0  T
   3    -37.5383522  0.108882E-03  0.982E-02    2.21       1.0  T
   4    -37.5385020 -0.149738E-03  0.371E-02    2.21       1.0  T
   5    -37.5385099 -0.794680E-05  0.178E-02    2.21       1.2  T
   6    -37.5385117 -0.179549E-05  0.611E-03    2.21       3.6  T
   7    -37.5385117 -0.145725E-07  0.349E-03    2.21       6.3  T
   8    -37.5385119 -0.162366E-06  0.145E-03    2.21      15.1  T
     SCC iter.                  ...        0 min,  0.009 sec
     gradient                   ...        0 min,  0.015 sec
 * total energy  :   -37.0918809 Eh     change       -0.5400449E-02 Eh
   gradient norm :     0.0288880 Eh/α   predicted    -0.4481300E-02 ( -17.02%)
   displ. norm   :     0.2835109 α      lambda       -0.2361814E-02
   maximum displ.:     0.1736951 α      in ANC's #3, #2, #6, ...

........................................................................
.............................. CYCLE    3 ..............................
........................................................................
   1    -37.5477220 -0.375477E+02  0.260E-01    2.31       0.0  T
   2    -37.5477787 -0.567111E-04  0.135E-01    2.27       1.0  T
   3    -37.5477398  0.388722E-04  0.614E-02    2.26       1.0  T
   4    -37.5477915 -0.516573E-04  0.247E-02    2.26       1.0  T
   5    -37.5477958 -0.428963E-05  0.121E-02    2.26       1.8  T
   6    -37.5477967 -0.975530E-06  0.365E-03    2.26       6.0  T
   7    -37.5477967  0.264180E-08  0.212E-03    2.26      10.3  T
     SCC iter.                  ...        0 min,  0.009 sec
     gradient                   ...        0 min,  0.014 sec
 * total energy  :   -37.0933255 Eh     change       -0.1444516E-02 Eh
   gradient norm :     0.0131204 Eh/α   predicted    -0.1275826E-02 ( -11.68%)
   displ. norm   :     0.2903878 α      lambda       -0.9959786E-03
   maximum displ.:     0.1883042 α      in ANC's #3, #4, #2, ...

........................................................................
.............................. CYCLE    4 ..............................
........................................................................
   1    -37.5465396 -0.375465E+02  0.260E-01    2.22       0.0  T
   2    -37.5465620 -0.223153E-04  0.140E-01    2.24       1.0  T
   3    -37.5465383  0.236629E-04  0.511E-02    2.24       1.0  T
   4    -37.5465697 -0.313718E-04  0.228E-02    2.24       1.0  T
   5    -37.5465720 -0.232512E-05  0.106E-02    2.24       2.1  T
   6    -37.5465730 -0.103910E-05  0.283E-03    2.24       7.7  T
   7    -37.5465731 -0.222443E-07  0.167E-03    2.24      13.1  T
     SCC iter.                  ...        0 min,  0.007 sec
     gradient                   ...        0 min,  0.015 sec
 * total energy  :   -37.0940383 Eh     change       -0.7128036E-03 Eh
   gradient norm :     0.0093158 Eh/α   predicted    -0.5399835E-03 ( -24.25%)
   displ. norm   :     0.3389483 α      lambda       -0.7078492E-03
   maximum displ.:     0.2021064 α      in ANC's #3, #4, #2, ...

........................................................................
.............................. CYCLE    5 ..............................
........................................................................
   1    -37.5432927 -0.375433E+02  0.272E-01    2.20       0.0  T
   2    -37.5433144 -0.216662E-04  0.146E-01    2.22       1.0  T
   3    -37.5433021  0.122504E-04  0.428E-02    2.22       1.0  T
   4    -37.5433186 -0.164888E-04  0.221E-02    2.22       1.0  T
   5    -37.5433221 -0.349402E-05  0.777E-03    2.22       2.8  T
   6    -37.5433225 -0.461391E-06  0.311E-03    2.22       7.0  T
   7    -37.5433226 -0.524665E-07  0.175E-03    2.22      12.5  T
   8    -37.5433226 -0.112268E-07  0.990E-04    2.22      22.0  T
     SCC iter.                  ...        0 min,  0.008 sec
     gradient                   ...        0 min,  0.015 sec
 * total energy  :   -37.0944976 Eh     change       -0.4593831E-03 Eh
   gradient norm :     0.0108230 Eh/α   predicted    -0.3945967E-03 ( -14.10%)
   displ. norm   :     0.1998521 α      lambda       -0.3312052E-03
   maximum displ.:     0.1206380 α      in ANC's #3, #4, #2, ...

........................................................................
.............................. CYCLE    6 ..............................
........................................................................
   1    -37.5441312 -0.375441E+02  0.175E-01    2.22       0.0  T
   2    -37.5441387 -0.752484E-05  0.918E-02    2.23       1.0  T
   3    -37.5441360  0.270963E-05  0.245E-02    2.23       1.0  T
   4    -37.5441397 -0.371542E-05  0.136E-02    2.23       1.6  T
   5    -37.5441410 -0.129516E-05  0.485E-03    2.23       4.5  T
   6    -37.5441413 -0.279094E-06  0.148E-03    2.23      14.7  T
   7    -37.5441413 -0.779036E-08  0.834E-04    2.23      26.2  T
     SCC iter.                  ...        0 min,  0.009 sec
     gradient                   ...        0 min,  0.016 sec
 * total energy  :   -37.0947053 Eh     change       -0.2076908E-03 Eh
   gradient norm :     0.0088640 Eh/α   predicted    -0.1722188E-03 ( -17.08%)
   displ. norm   :     0.1529065 α      lambda       -0.2345657E-03
   maximum displ.:     0.0890894 α      in ANC's #3, #4, #2, ...

........................................................................
.............................. CYCLE    7 ..............................
........................................................................
   1    -37.5461984 -0.375462E+02  0.152E-01    2.23       0.0  T
   2    -37.5462044 -0.592946E-05  0.757E-02    2.24       1.0  T
   3    -37.5461989  0.541841E-05  0.250E-02    2.24       1.0  T
   4    -37.5462062 -0.726857E-05  0.121E-02    2.24       1.8  T
   5    -37.5462069 -0.649995E-06  0.341E-03    2.24       6.4  T
   6    -37.5462070 -0.131952E-06  0.111E-03    2.24      19.6  T
   7    -37.5462070 -0.331494E-08  0.587E-04    2.24      37.2  T
     SCC iter.                  ...        0 min,  0.009 sec
     gradient                   ...        0 min,  0.015 sec
 * total energy  :   -37.0948300 Eh     change       -0.1247123E-03 Eh
   gradient norm :     0.0065749 Eh/α   predicted    -0.1200253E-03 (  -3.76%)
   displ. norm   :     0.0759365 α      lambda       -0.9423099E-04
   maximum displ.:     0.0461471 α      in ANC's #4, #2, #3, ...

........................................................................
.............................. CYCLE    8 ..............................
........................................................................
   1    -37.5473119 -0.375473E+02  0.890E-02    2.25       0.0  T
   2    -37.5473141 -0.221859E-05  0.437E-02    2.25       1.0  T
   3    -37.5473132  0.866293E-06  0.124E-02    2.25       1.8  T
   4    -37.5473145 -0.126503E-05  0.650E-03    2.25       3.4  T
   5    -37.5473147 -0.217424E-06  0.164E-03    2.25      13.3  T
   6    -37.5473147 -0.185249E-07  0.668E-04    2.25      32.7  T
     SCC iter.                  ...        0 min,  0.007 sec
     gradient                   ...        0 min,  0.015 sec
 * total energy  :   -37.0948936 Eh     change       -0.6359273E-04 Eh
   gradient norm :     0.0036480 Eh/α   predicted    -0.4738888E-04 ( -25.48%)
   displ. norm   :     0.0961282 α      lambda       -0.6134703E-04
   maximum displ.:     0.0684545 α      in ANC's #4, #2, #1, ...

........................................................................
.............................. CYCLE    9 ..............................
........................................................................
   1    -37.5470147 -0.375470E+02  0.953E-02    2.25       0.0  T
   2    -37.5470166 -0.188282E-05  0.490E-02    2.25       1.0  T
   3    -37.5470154  0.118114E-05  0.133E-02    2.25       1.6  T
   4    -37.5470169 -0.147693E-05  0.748E-03    2.25       2.9  T
   5    -37.5470173 -0.367157E-06  0.139E-03    2.25      15.7  T
   6    -37.5470173 -0.133251E-07  0.702E-04    2.25      31.1  T
   7    -37.5470173 -0.155129E-08  0.414E-04    2.25      52.7  T
     SCC iter.                  ...        0 min,  0.008 sec
     gradient                   ...        0 min,  0.015 sec
 * total energy  :   -37.0949340 Eh     change       -0.4034854E-04 Eh
   gradient norm :     0.0024645 Eh/α   predicted    -0.3095970E-04 ( -23.27%)
   displ. norm   :     0.0730583 α      lambda       -0.3581984E-04
   maximum displ.:     0.0449358 α      in ANC's #4, #2, #1, ...

........................................................................
.............................. CYCLE   10 ..............................
........................................................................
   1    -37.5473608 -0.375474E+02  0.727E-02    2.26       0.0  T
   2    -37.5473619 -0.115502E-05  0.367E-02    2.25       1.0  T
   3    -37.5473614  0.506224E-06  0.939E-03    2.25       2.3  T
   4    -37.5473621 -0.679768E-06  0.530E-03    2.25       4.1  T
   5    -37.5473623 -0.168485E-06  0.128E-03    2.25      17.0  T
   6    -37.5473623 -0.148890E-07  0.607E-04    2.25      35.9  T
   7    -37.5473623 -0.246528E-08  0.331E-04    2.25      66.0  T
     SCC iter.                  ...        0 min,  0.008 sec
     gradient                   ...        0 min,  0.015 sec
 * total energy  :   -37.0949574 Eh     change       -0.2337493E-04 Eh
   gradient norm :     0.0032705 Eh/α   predicted    -0.1800770E-04 ( -22.96%)
   displ. norm   :     0.0993469 α      lambda       -0.2987794E-04
   maximum displ.:     0.0638790 α      in ANC's #4, #2, #1, ...

........................................................................
.............................. CYCLE   11 ..............................
........................................................................
   1    -37.5465357 -0.375465E+02  0.850E-02    2.25       0.0  T
   2    -37.5465366 -0.978581E-06  0.454E-02    2.25       1.0  T
   3    -37.5465365  0.894727E-07  0.840E-03    2.25       2.6  T
   4    -37.5465365  0.620373E-07  0.580E-03    2.25       3.8  T
   5    -37.5465369 -0.418106E-06  0.957E-04    2.25      22.8  T
   6    -37.5465369 -0.116312E-07  0.454E-04    2.25      48.1  T
     SCC iter.                  ...        0 min,  0.008 sec
     gradient                   ...        0 min,  0.017 sec
 * total energy  :   -37.0949784 Eh     change       -0.2101499E-04 Eh
   gradient norm :     0.0034691 Eh/α   predicted    -0.1508708E-04 ( -28.21%)
   displ. norm   :     0.1084073 α      lambda       -0.3463600E-04
   maximum displ.:     0.0618333 α      in ANC's #2, #4, #1, ...

........................................................................
.............................. CYCLE   12 ..............................
........................................................................
   1    -37.5463107 -0.375463E+02  0.896E-02    2.24       0.0  T
   2    -37.5463117 -0.107516E-05  0.487E-02    2.25       1.0  T
   3    -37.5463116  0.123908E-06  0.887E-03    2.25       2.5  T
   4    -37.5463116 -0.308648E-07  0.570E-03    2.25       3.8  T
   5    -37.5463120 -0.386167E-06  0.111E-03    2.25      19.7  T
   6    -37.5463120 -0.132669E-07  0.493E-04    2.25      44.3  T
   7    -37.5463120 -0.507448E-09  0.301E-04    2.25      72.6  T
     SCC iter.                  ...        0 min,  0.009 sec
     gradient                   ...        0 min,  0.016 sec
 * total energy  :   -37.0950037 Eh     change       -0.2533916E-04 Eh
   gradient norm :     0.0025901 Eh/α   predicted    -0.1752410E-04 ( -30.84%)
   displ. norm   :     0.1316004 α      lambda       -0.3662543E-04
   maximum displ.:     0.0872591 α      in ANC's #2, #1, #4, ...

........................................................................
.............................. CYCLE   13 ..............................
........................................................................
   1    -37.5462256 -0.375462E+02  0.103E-01    2.25       0.0  T
   2    -37.5462267 -0.115034E-05  0.576E-02    2.24       1.0  T
   3    -37.5462257  0.102619E-05  0.119E-02    2.25       1.8  T
   4    -37.5462268 -0.115326E-05  0.634E-03    2.24       3.4  T
   5    -37.5462272 -0.374272E-06  0.120E-03    2.24      18.2  T
   6    -37.5462272 -0.115667E-07  0.649E-04    2.24      33.6  T
   7    -37.5462272 -0.534463E-09  0.374E-04    2.24      58.4  T
     SCC iter.                  ...        0 min,  0.008 sec
     gradient                   ...        0 min,  0.015 sec
 * total energy  :   -37.0950292 Eh     change       -0.2549020E-04 Eh
   gradient norm :     0.0022494 Eh/α   predicted    -0.1863072E-04 ( -26.91%)
   displ. norm   :     0.1175589 α      lambda       -0.3401850E-04
   maximum displ.:     0.0746171 α      in ANC's #2, #1, #3, ...

........................................................................
.............................. CYCLE   14 ..............................
........................................................................
   1    -37.5466602 -0.375467E+02  0.927E-02    2.23       0.0  T
   2    -37.5466614 -0.116873E-05  0.517E-02    2.24       1.0  T
   3    -37.5466595  0.192634E-05  0.137E-02    2.24       1.6  T
   4    -37.5466618 -0.227078E-05  0.599E-03    2.24       3.6  T
   5    -37.5466620 -0.213687E-06  0.144E-03    2.24      15.1  T
   6    -37.5466620 -0.161048E-07  0.635E-04    2.24      34.4  T
   7    -37.5466620  0.103363E-09  0.413E-04    2.24      52.8  T
     SCC iter.                  ...        0 min,  0.008 sec
     gradient                   ...        0 min,  0.016 sec
 * total energy  :   -37.0950485 Eh     change       -0.1930642E-04 Eh
   gradient norm :     0.0022629 Eh/α   predicted    -0.1724756E-04 ( -10.66%)
   displ. norm   :     0.1053714 α      lambda       -0.1658888E-04
   maximum displ.:     0.0734392 α      in ANC's #2, #1, #4, ...

........................................................................
.............................. CYCLE   15 ..............................
........................................................................
   1    -37.5463328 -0.375463E+02  0.808E-02    2.24       0.0  T
   2    -37.5463335 -0.708158E-06  0.451E-02    2.24       1.0  T
   3    -37.5463326  0.876303E-06  0.995E-03    2.24       2.2  T
   4    -37.5463336 -0.102080E-05  0.478E-03    2.24       4.6  T
   5    -37.5463338 -0.159369E-06  0.105E-03    2.24      20.7  T
   6    -37.5463338 -0.114693E-07  0.486E-04    2.24      44.9  T
   7    -37.5463338  0.318536E-10  0.276E-04    2.24      79.2  T
     SCC iter.                  ...        0 min,  0.008 sec
     gradient                   ...        0 min,  0.015 sec
 * total energy  :   -37.0950569 Eh     change       -0.8417437E-05 Eh
   gradient norm :     0.0018538 Eh/α   predicted    -0.8387239E-05 (  -0.36%)
   displ. norm   :     0.0268353 α      lambda       -0.9495682E-05
   maximum displ.:     0.0140067 α      in ANC's #1, #2, #7, ...

........................................................................
.............................. CYCLE   16 ..............................
........................................................................
   1    -37.5473285 -0.375473E+02  0.288E-02    2.25       0.0  T
   2    -37.5473290 -0.465411E-06  0.140E-02    2.24       1.6  T
   3    -37.5473287  0.264189E-06  0.523E-03    2.24       4.2  T
   4    -37.5473291 -0.343389E-06  0.228E-03    2.24       9.6  T
   5    -37.5473291 -0.306652E-07  0.882E-04    2.24      24.7  T
   6    -37.5473291 -0.234582E-08  0.327E-04    2.24      66.7  T
     SCC iter.                  ...        0 min,  0.007 sec
     gradient                   ...        0 min,  0.015 sec
 * total energy  :   -37.0950614 Eh     change       -0.4460752E-05 Eh
   gradient norm :     0.0013488 Eh/α   predicted    -0.4754026E-05 (   6.57%)
   displ. norm   :     0.0401120 α      lambda       -0.3904702E-05
   maximum displ.:     0.0262590 α      in ANC's #4, #2, #1, ...

........................................................................
.............................. CYCLE   17 ..............................
........................................................................
   1    -37.5466491 -0.375466E+02  0.352E-02    2.24       0.0  T
   2    -37.5466493 -0.221524E-06  0.192E-02    2.24       1.1  T
   3    -37.5466491  0.202568E-06  0.493E-03    2.24       4.4  T
   4    -37.5466493 -0.229754E-06  0.252E-03    2.24       8.6  T
   5    -37.5466494 -0.466307E-07  0.661E-04    2.24      33.0  T
   6    -37.5466494 -0.495173E-08  0.221E-04    2.24      98.6  T
     SCC iter.                  ...        0 min,  0.008 sec
     gradient                   ...        0 min,  0.017 sec
 * total energy  :   -37.0950635 Eh     change       -0.2102072E-05 Eh
   gradient norm :     0.0013655 Eh/α   predicted    -0.1958616E-05 (  -6.82%)
   displ. norm   :     0.0275760 α      lambda       -0.2298640E-05
   maximum displ.:     0.0187020 α      in ANC's #4, #1, #2, ...

........................................................................
.............................. CYCLE   18 ..............................
........................................................................
   1    -37.5466424 -0.375466E+02  0.223E-02    2.24       0.0  T
   2    -37.5466426 -0.118497E-06  0.117E-02    2.24       1.9  T
   3    -37.5466425  0.228772E-07  0.258E-03    2.24       8.5  T
   4    -37.5466426 -0.288589E-07  0.148E-03    2.24      14.7  T
   5    -37.5466426 -0.174927E-07  0.462E-04    2.24      47.2  T
   6    -37.5466426 -0.298412E-08  0.142E-04    2.24     153.8  T
     SCC iter.                  ...        0 min,  0.008 sec
     gradient                   ...        0 min,  0.016 sec
 * total energy  :   -37.0950641 Eh     change       -0.6401339E-06 Eh
   gradient norm :     0.0014124 Eh/α   predicted    -0.1154255E-05 (  80.31%)
   displ. norm   :     0.0098990 α      lambda       -0.1662569E-05
   maximum displ.:     0.0068511 α      in ANC's #1, #2, #4, ...

........................................................................
.............................. CYCLE   19 ..............................
........................................................................
   1    -37.5468043 -0.375468E+02  0.959E-03    2.24       0.0  T
   2    -37.5468044 -0.559945E-07  0.541E-03    2.24       4.0  T
   3    -37.5468044  0.121445E-07  0.156E-03    2.24      14.0  T
   4    -37.5468044 -0.168577E-07  0.765E-04    2.24      28.5  T
   5    -37.5468044 -0.452894E-08  0.343E-04    2.24      63.6  T
     SCC iter.                  ...        0 min,  0.006 sec
     gradient                   ...        0 min,  0.016 sec
 * total energy  :   -37.0950654 Eh     change       -0.1225122E-05 Eh
   gradient norm :     0.0003967 Eh/α   predicted    -0.8334943E-06 ( -31.97%)
   displ. norm   :     0.0092464 α      lambda        0.1751718E-05
   maximum displ.:     0.0058666 α      in ANC's #1, #2, #4, ...

   *** GEOMETRY OPTIMIZATION CONVERGED AFTER 19 ITERATIONS ***

------------------------------------------------------------------------
 total energy gain   :        -0.0085849 Eh       -5.3871 kcal/mol
 total RMSD          :         0.4096902 a0        0.2168 Å
 total power (kW/mol):        -1.1862955 (step)  -34.0568 (real)
------------------------------------------------------------------------

 ANCopt (total)                0 d,  0 h,  0 min,  0.662 sec
 optimizer setup                ...        0 min,  0.000 sec (  0.021%)
 model hessian                  ...        0 min,  0.004 sec (  0.558%)
 ANC generation                 ...        0 min,  0.001 sec (  0.100%)
 coordinate transformation      ...        0 min,  0.000 sec (  0.041%)
 single point calculation       ...        0 min,  0.651 sec ( 98.315%)
 optimization log               ...        0 min,  0.002 sec (  0.238%)
 hessian update                 ...        0 min,  0.000 sec (  0.032%)
 rational function              ...        0 min,  0.004 sec (  0.533%)

================
 final structure:
================
$coord
   -3.30110924743336   -2.44465302653868    1.02262606362204      C 
   -5.37244178707558   -0.02677022629157    1.61189277731185      S 
   -3.38831396314262    2.16489373279105    0.17183032105932      C 
   -1.24083053852543    1.00433493377444   -0.71005441250789      C 
   -1.20036355989906   -1.64214717786961   -0.22714447007930      C 
    1.09248380528607   -3.84104858819164   -1.23670616975853      S 
    4.12126032379540   -2.22817770509265   -0.60660296388725      C 
    3.74950207186686   -0.27860401300990    1.42563968061937      C 
    3.54502910354358   -0.78616647967189    3.63098866265885      O 
    3.55080750793846    2.39823684122626    0.46174498921053      C 
    1.31155259116531    2.59324909364638   -2.16457856251542      S 
   -4.19987154193513    4.76644985821497    0.09640096607816      C 
   -3.38577385158195    6.53476738762123   -1.49141202133841      C 
   -3.74590364738604   -4.33745984137911    1.58378937809484      H 
    4.79961245585239   -1.41494744576517   -2.37023690110418      H 
    5.36776351110007   -3.73002266857082    0.04776139436321      H 
    5.35771902084113    3.01379874580750   -0.31423289807161      H 
    2.95685760527503    3.67471537384007    1.96709601965778      H 
   -5.65378556082551    5.21680615420525    1.46362850806973      H 
   -2.00149195990891    6.15703386918012   -2.93148175919425      H 
   -4.10710836274704    8.43334473533727   -1.38922345332845      H 
$end
           -------------------------------------------------
          |                Final Singlepoint                |
           -------------------------------------------------

          ...................................................
          :                      SETUP                      :
          :.................................................:
          :  # basis functions                  78          :
          :  # atomic orbitals                  75          :
          :  # shells                           37          :
          :  # electrons                        68          :
          :  max. iterations                   250          :
          :  Hamiltonian                  GFN2-xTB          :
          :  restarted?                      false          :
          :  GBSA solvation                  false          :
          :  PC potential                    false          :
          :  electronic temp.          300.0000000     K    :
          :  accuracy                    1.0000000          :
          :  -> integral cutoff          0.2500000E+02      :
          :  -> integral neglect         0.1000000E-07      :
          :  -> SCF convergence          0.1000000E-05 Eh   :
          :  -> wf. convergence          0.1000000E-03 e    :
          :  Broyden damping             0.4000000          :
          ...................................................

 iter      E             dE          RMSdq      gap      omega  full diag
   1    -37.5468044 -0.375468E+02  0.175E-04    2.24       0.0  T
   2    -37.5468044 -0.161720E-10  0.770E-05    2.24     283.4  T
   3    -37.5468044 -0.453966E-10  0.798E-05    2.24     273.5  T

   *** convergence criteria satisfied after 3 iterations ***

         #    Occupation            Energy/Eh            Energy/eV
      -------------------------------------------------------------
         1        2.0000           -0.7488698             -20.3778
       ...           ...                  ...                  ...
        28        2.0000           -0.4516664             -12.2905
        29        2.0000           -0.4509099             -12.2699
        30        2.0000           -0.4279848             -11.6461
        31        2.0000           -0.4207998             -11.4505
        32        2.0000           -0.4024452             -10.9511
        33        2.0000           -0.3845085             -10.4630
        34        2.0000           -0.3723630             -10.1325 (HOMO)
        35                         -0.2900371              -7.8923 (LUMO)
        36                         -0.2831720              -7.7055
        37                         -0.2425891              -6.6012
        38                         -0.2311396              -6.2896
        39                         -0.2091522              -5.6913
       ...                                ...                  ...
        75                          0.6566966              17.8696
      -------------------------------------------------------------
                  HL-Gap            0.0823259 Eh            2.2402 eV
             Fermi-level           -0.3312000 Eh           -9.0124 eV

 SCC (total)                   0 d,  0 h,  0 min,  0.030 sec
 SCC setup                      ...        0 min,  0.000 sec (  0.515%)
 Dispersion                     ...        0 min,  0.000 sec (  0.422%)
 integral evaluation            ...        0 min,  0.011 sec ( 35.893%)
 zeroth order Hamiltonian       ...        0 min,  0.000 sec (  0.544%)
 iterations                     ...        0 min,  0.004 sec ( 12.613%)
 molecular gradient             ...        0 min,  0.015 sec ( 49.000%)
 printout                       ...        0 min,  0.000 sec (  0.884%)

         :::::::::::::::::::::::::::::::::::::::::::::::::::::
         ::                     SUMMARY                     ::
         :::::::::::::::::::::::::::::::::::::::::::::::::::::
         :: total energy             -37.095065351031 Eh    ::
         :: gradient norm              0.000396400310 Eh/a0 ::
         :: HOMO-LUMO gap              2.240201093840 eV    ::
         ::.................................................::
         :: SCC energy               -37.546804398995 Eh    ::
         :: -> isotropic ES            0.027125295482 Eh    ::
         :: -> anisotropic ES          0.000916407521 Eh    ::
         :: -> anisotropic XC          0.018583302440 Eh    ::
         :: -> dispersion             -0.028074872506 Eh    ::
         :: repulsion energy           0.451511232380 Eh    ::
         :: add. restraining           0.000000000000 Eh    ::
         :::::::::::::::::::::::::::::::::::::::::::::::::::::

           -------------------------------------------------
          |                Property Printout                |
           -------------------------------------------------

    * Orbital Energies and Occupations

         #    Occupation            Energy/Eh            Energy/eV
      -------------------------------------------------------------
         1        2.0000           -0.7488698             -20.3778
       ...           ...                  ...                  ...
        22        2.0000           -0.5026782             -13.6786
        23        2.0000           -0.4961298             -13.5004
        24        2.0000           -0.4848244             -13.1927
        25        2.0000           -0.4768739             -12.9764
        26        2.0000           -0.4711941             -12.8218
        27        2.0000           -0.4633136             -12.6074
        28        2.0000           -0.4516664             -12.2905
        29        2.0000           -0.4509099             -12.2699
        30        2.0000           -0.4279848             -11.6461
        31        2.0000           -0.4207998             -11.4505
        32        2.0000           -0.4024452             -10.9511
        33        2.0000           -0.3845085             -10.4630
        34        2.0000           -0.3723630             -10.1325 (HOMO)
        35                         -0.2900371              -7.8923 (LUMO)
        36                         -0.2831720              -7.7055
        37                         -0.2425891              -6.6012
        38                         -0.2311396              -6.2896
        39                         -0.2091522              -5.6913
        40                         -0.1972772              -5.3682
        41                         -0.1778088              -4.8384
        42                         -0.1609010              -4.3783
        43                         -0.1403516              -3.8192
        44                         -0.1239431              -3.3727
        45                         -0.0332647              -0.9052
       ...                                ...                  ...
        75                          0.6566966              17.8696
      -------------------------------------------------------------
                  HL-Gap            0.0823259 Eh            2.2402 eV
             Fermi-level           -0.3312000 Eh           -9.0124 eV

     #   Z        covCN         q      C6AA      α(0)
     1   6 C      2.986    -0.031    28.774     8.799
     2  16 S      2.348    -0.000   141.062    19.990
     3   6 C      3.010     0.020    27.533     8.607
     4   6 C      3.165     0.018    27.259     8.532
     5   6 C      3.175     0.028    26.979     8.483
     6  16 S      2.049    -0.128   146.415    20.366
     7   6 C      3.796    -0.034    21.186     6.554
     8   6 C      2.888     0.243    22.949     7.854
     9   8 O      0.857    -0.338    20.486     6.068
    10   6 C      3.797    -0.036    21.225     6.560
    11  16 S      2.032    -0.157   147.668    20.453
    12   6 C      2.933    -0.026    28.664     8.780
    13   6 C      2.839    -0.081    30.023     8.979
    14   1 H      0.927     0.064     2.156     2.296
    15   1 H      0.925     0.069     2.094     2.263
    16   1 H      0.925     0.080     1.978     2.199
    17   1 H      0.925     0.077     2.015     2.220
    18   1 H      0.925     0.070     2.087     2.259
    19   1 H      0.925     0.050     2.321     2.382
    20   1 H      0.926     0.062     2.176     2.307
    21   1 H      0.926     0.051     2.307     2.375

 Mol. C6AA /au·bohr⁶  :       9608.361569
 Mol. C8AA /au·bohr⁸  :     313016.288229
 Mol. α(0) /au        :        158.327973


Wiberg/Mayer (AO) data.
largest (>0.10) Wiberg bond orders for each atom
          total WBO             WBO to atom ...
     1  C   3.948        C    5 1.562    S    2 1.191    H   14 0.967
     2  S   2.643        C    1 1.191    C    3 1.140
     3  C   3.952        C    4 1.500    S    2 1.140    C   12 1.123
     4  C   3.956        C    3 1.500    C    5 1.223    S   11 1.008
     5  C   3.960        C    1 1.562    C    4 1.223    S    6 1.027
     6  S   2.220        C    5 1.027    C    7 0.943
     7  C   3.979        C    8 0.998    H   15 0.973    H   16 0.958    S    6 0.943
     8  C   3.928        O    9 1.861    C    7 0.998    C   10 0.988
     9  O   2.102        C    8 1.861
    10  C   3.981        C    8 0.988    H   18 0.970    S   11 0.959    H   17 0.946
    11  S   2.184        C    4 1.008    C   10 0.959
    12  C   3.987        C   13 1.872    C    3 1.123    H   19 0.960
    13  C   3.987        C   12 1.872    H   21 0.976    H   20 0.969
    14  H   0.996        C    1 0.967
    15  H   0.995        C    7 0.973
    16  H   0.993        C    7 0.958
    17  H   0.993        C   10 0.946
    18  H   0.995        C   10 0.970
    19  H   0.997        C   12 0.960
    20  H   0.996        C   13 0.969
    21  H   0.997        C   13 0.976

molecular dipole:
                 x           y           z       tot (Debye)
 q only:       -0.013       0.593      -0.436
   full:        0.310       0.666      -0.238       1.963
molecular quadrupole (traceless):
                xx          xy          yy          xz          yz          zz
 q only:        6.427      -0.587       2.338      -4.980       1.198      -8.765
  q+dip:        6.785      -0.435       3.766      -6.032       1.138     -10.551
   full:        8.679       0.378       2.300      -4.158       1.715     -10.979

           -------------------------------------------------
          |                Geometry Summary                 |
           -------------------------------------------------

      molecular mass/u    :      228.3416000
   center of mass at/Å    :       -0.2295375       0.2019013       0.0011249
  moments of inertia/u·Å² :        0.6065746E+03   0.9592850E+03   0.1266536E+04
rotational constants/cm⁻¹ :        0.2779152E-01   0.1757312E-01   0.1331003E-01

 * 15 selected distances

     #   Z        #   Z                                     value/Å
     1   6 C      2  16 S                                 1.7134079
     2  16 S      3   6 C                                 1.7401754 (max)
     3   6 C      4   6 C                                 1.3734472
     1   6 C      5   6 C                                 1.3614441
     4   6 C      5   6 C                                 1.4237432
     8   6 C      9   8 O                                 1.2024082
    12   6 C     13   6 C                                 1.3293679
     1   6 C     14   1 H                                 1.0709094 (min)
     7   6 C     15   1 H                                 1.0886026
     7   6 C     16   1 H                                 1.0893215
    10   6 C     17   1 H                                 1.0904117
    10   6 C     18   1 H                                 1.0907030
    12   6 C     19   1 H                                 1.0826814
    13   6 C     20   1 H                                 1.0757693
    13   6 C     21   1 H                                 1.0761131

 * 4 distinct bonds (by element types)

   Z      Z             #   av. dist./Å        max./Å        min./Å
   1 H    6 C           8     1.0830640     1.0907030     1.0709094
   6 C    6 C           4     1.3720006     1.4237432     1.3293679
   6 C    8 O           1     1.2024082     1.2024082     1.2024082
   6 C   16 S           2     1.7267917     1.7401754     1.7134079


optimized geometry written to: xtbopt.xyz


           -------------------------------------------------
          | TOTAL ENERGY              -37.095065351031 Eh   |
          | GRADIENT NORM               0.000396400310 Eh/α |
          | HOMO-LUMO GAP               2.240201093840 eV   |
           -------------------------------------------------

------------------------------------------------------------------------
 * finished run on 2021/05/19 at 10:58:43.928     
------------------------------------------------------------------------
 total:
 * wall-time:     0 d,  0 h,  0 min,  0.758 sec
 *  cpu-time:     0 d,  0 h,  0 min,  0.758 sec
 * ratio c/w:     1.000 speedup
 SCF:
 * wall-time:     0 d,  0 h,  0 min,  0.045 sec
 *  cpu-time:     0 d,  0 h,  0 min,  0.045 sec
 * ratio c/w:     1.000 speedup
 ANC optimizer:
 * wall-time:     0 d,  0 h,  0 min,  0.692 sec
 *  cpu-time:     0 d,  0 h,  0 min,  0.692 sec
 * ratio c/w:     1.000 speedup

