      -----------------------------------------------------------      
     |                   =====================                   |     
     |                           x T B                           |     
     |                   =====================                   |     
     |                         S. Grimme                         |     
     |          Mulliken Center for Theoretical Chemistry        |     
     |                    University of Bonn                     |     
     |                Version 6.2 RC2 (SAW190805)                |     
      -----------------------------------------------------------      

   This program is distributed in the hope that it will be useful,
   but WITHOUT ANY WARRANTY; without even the implied warranty of
   MERCHANTABILITY or FITNESS FOR A PARTICULAR PURPOSE.
   
   FOR NON-COMMERCIAL, ACADEMIA USE ONLY.
   
   Cite this work as:
   * S. Grimme, C. Bannwarth, P. Shushkov, J. Chem. Theory Comput., 2017,
     13, 1989-2009. DOI: 10.1021/acs.jctc.7b00118
   * C. Bannwarth, S. Ehlert and S. Grimme., J. Chem. Theory Comput., 2019,
     15, 1652-1671. DOI: 10.1021/acs.jctc.8b01176
   * P. Pracht, E. Caldeweyher, S. Ehlert, S. Grimme, ChemRxiv, 2019, preprint.
     DOI: 10.26434/chemrxiv.8326202.v1
   
   for DFT-D4:
   * E. Caldeweyher, C. Bannwarth and S. Grimme, J. Chem. Phys., 2017,
     147, 034112. DOI: 10.1063/1.4993215
   * E. Caldeweyher, S. Ehlert, A. Hansen, H. Neugebauer, S. Spicher,
     C. Bannwarth and S. Grimme, J. Chem. Phys., 2019, 150, 154122.
     DOI: 10.1063/1.5090222
   
   for sTDA-xTB:
   * S. Grimme and C. Bannwarth, J. Chem. Phys., 2016, 145, 054103.
     DOI: 10.1063/1.4959605
   
   in the mass-spec context:
   * V. Asgeirsson, C. Bauer and S. Grimme, Chem. Sci., 2017, 8, 4879.
     DOI: 10.1039/c7sc00601b
   
   for metadynamics refer to:
   * S. Grimme, J. Chem. Theory Comput., 2019, 155, 2847-2862
     DOI: 10.1021/acs.jctc.9b00143
   
   with help from (in alphabetical order)
   C. Bannwarth, F. Bohle, G. Brandenburg, E. Caldeweyher, M. Checinski,
   S. Dohm, S. Ehlert, S. Ehrlich, F. März, H. Neugebauer, J. Pisarek,
   P. Pracht, P. Shushkov, and S. Spicher.
   
 * started run on 2021/05/19 at 11:00:14.335     

           -------------------------------------------------
          |                Calculation Setup                |
           -------------------------------------------------

          program call               : /ihome/ghutchison/geoffh/xtb/xtb 691.xyz -opt
          hostname                   : smp-n144
          coordinate file            : 691.xyz
          omp threads                :                     1
          number of atoms            :                    20
          number of electrons        :                    52
          charge                     :                     0
          spin                       :                   0.0
          first test random number   :      0.44282648881909


########################################################################
# WARNING! Please study the warnings concerning your input carefully
#  - the use of '-opt' is discouraged, please use '--opt' next time
########################################################################

           ------------------------------------------------- 
          |                 G F N 2 - x T B                 |
          | Geometry, Frequencies, Noncovalent interactions |
          |            JCTC 2019 parametrisation            |
           ------------------------------------------------- 
             KAB for C  - Si     :                1.0500
             KAB for H  - Pd     :                0.9500
             k(s)              :                1.8500
             k(p)              :                2.2300
             k(d)              :                2.2300
             k(f)              :                2.0000
             kEN (H0ij)        :               -2.0000
             D4 a1             :                0.5200
             D4 a2             :                5.0000
             D4 s6             :                1.0000
             D4 s8             :                2.7000
             D4 s9             :                5.0000
             alphaj            :                2.0000

  Z AO/shell   Hii/eV     exponent
  1     Wed Apr 25 08:07:45 CEST 2018   EN: 2.200 GM2: 0.406  GM3: 0.0800  RAES: 1.40
     1s    -10.707211    1.230000
  6     Wed Apr 25 08:07:45 CEST 2018   EN: 2.550 GM2: 0.538  GM3: 0.1500  RAES: 3.00
     2s    -13.970922    2.096432
     2p    -10.063292    1.800000
 16     Tue Apr 24 11:44:34 CEST 2018   EN: 2.580 GM2: 0.340  GM3:-0.0502  RAES: 3.10
     3s    -20.029654    1.981333
     3p    -11.377694    2.025643
     3d     -0.420282    1.702555

           ------------------------------------------------- 
          |        Self-Consistent Charge Iterations        |
           ------------------------------------------------- 

          ...................................................
          :                      SETUP                      :
          :.................................................:
          :  # basis functions                  56          :
          :  # atomic orbitals                  55          :
          :  # shells                           31          :
          :  # electrons                        52          :
          :  max. iterations                   250          :
          :  Hamiltonian                  GFN2-xTB          :
          :  restarted?                      false          :
          :  GBSA solvation                  false          :
          :  PC potential                    false          :
          :  electronic temp.          300.0000000     K    :
          :  accuracy                    1.0000000          :
          :  -> integral cutoff          0.2500000E+02      :
          :  -> integral neglect         0.1000000E-07      :
          :  -> SCF convergence          0.1000000E-05 Eh   :
          :  -> wf. convergence          0.1000000E-03 e    :
          :  Broyden damping             0.4000000          :
          ...................................................

 iter      E             dE          RMSdq      gap      omega  full diag
   1    -27.9490293 -0.279490E+02  0.425E+00    2.76       0.0  T
   2    -27.9814365 -0.324072E-01  0.250E+00    2.54       1.0  T
   3    -27.9741079  0.732866E-02  0.102E+00    2.57       1.0  T
   4    -27.9817686 -0.766068E-02  0.592E-01    2.52       1.0  T
   5    -27.9852773 -0.350878E-02  0.198E-01    2.54       1.0  T
   6    -27.9854681 -0.190761E-03  0.967E-02    2.53       1.0  T
   7    -27.9855601 -0.920190E-04  0.392E-02    2.53       1.0  T
   8    -27.9855753 -0.152311E-04  0.165E-02    2.53       1.4  T
   9    -27.9855757 -0.348897E-06  0.721E-03    2.53       3.1  T
  10    -27.9855760 -0.301733E-06  0.341E-03    2.53       6.6  T
  11    -27.9855761 -0.885305E-07  0.142E-03    2.53      15.8  T
  12    -27.9855761 -0.761375E-08  0.462E-04    2.53      48.4  T
  13    -27.9855761 -0.154802E-09  0.191E-04    2.53     116.8  T

   *** convergence criteria satisfied after 13 iterations ***

         #    Occupation            Energy/Eh            Energy/eV
      -------------------------------------------------------------
         1        2.0000           -0.7168431             -19.5063
       ...           ...                  ...                  ...
        20        2.0000           -0.4484426             -12.2027
        21        2.0000           -0.4435545             -12.0697
        22        2.0000           -0.4348020             -11.8316
        23        2.0000           -0.4226060             -11.4997
        24        2.0000           -0.4036704             -10.9844
        25        2.0000           -0.3994589             -10.8698
        26        2.0000           -0.3467618              -9.4359 (HOMO)
        27                         -0.2536502              -6.9022 (LUMO)
        28                         -0.2104277              -5.7260
        29                         -0.2084289              -5.6716
        30                         -0.1331545              -3.6233
        31                         -0.1097126              -2.9854
       ...                                ...                  ...
        55                          0.7104738              19.3330
      -------------------------------------------------------------
                  HL-Gap            0.0931115 Eh            2.5337 eV
             Fermi-level           -0.3002060 Eh           -8.1690 eV

 SCC (total)                   0 d,  0 h,  0 min,  0.028 sec
 SCC setup                      ...        0 min,  0.000 sec (  0.946%)
 Dispersion                     ...        0 min,  0.000 sec (  0.918%)
 integral evaluation            ...        0 min,  0.006 sec ( 21.136%)
 zeroth order Hamiltonian       ...        0 min,  0.000 sec (  0.471%)
 iterations                     ...        0 min,  0.011 sec ( 40.750%)
 molecular gradient             ...        0 min,  0.010 sec ( 34.398%)
 printout                       ...        0 min,  0.000 sec (  1.197%)

         :::::::::::::::::::::::::::::::::::::::::::::::::::::
         ::                     SUMMARY                     ::
         :::::::::::::::::::::::::::::::::::::::::::::::::::::
         :: total energy             -27.555199916418 Eh    ::
         :: gradient norm              0.034603759548 Eh/a0 ::
         :: HOMO-LUMO gap              2.533693991068 eV    ::
         ::.................................................::
         :: SCC energy               -27.985576083978 Eh    ::
         :: -> isotropic ES            0.003588619321 Eh    ::
         :: -> anisotropic ES          0.004136929757 Eh    ::
         :: -> anisotropic XC          0.018562212699 Eh    ::
         :: -> dispersion             -0.018835168993 Eh    ::
         :: repulsion energy           0.430303453238 Eh    ::
         :: add. restraining           0.000000000000 Eh    ::
         :::::::::::::::::::::::::::::::::::::::::::::::::::::

      ----------------------------------------------------------- 
     |                   =====================                   |
     |                        A N C O P T                        |
     |                   =====================                   |
     |               Approximate Normal Coordinate               |
     |                Rational Function Optimizer                |
      ----------------------------------------------------------- 

          ...................................................
          :                      SETUP                      :
          :.................................................:
          :   optimization level            normal          :
          :   max. optcycles                   200          :
          :   ANC micro-cycles                  20          :
          :   degrees of freedom                54          :
          :.................................................:
          :   RF solver                   davidson          :
          :   input Hessian                  false          :
          :   write xtbopt.log                true          :
          :   linear?                        false          :
          :   energy convergence         0.5000000E-05 Eh   :
          :   grad. convergence          0.1000000E-02 Eh/α :
          :   maximium RF displ.         2.0000000          :
          :   Hlow (freq-cutoff)         0.5000000E-02      :
          :   Hmax (freq-cutoff)         5.0000000          :
          :   S6 in model hess.         20.0000000          :
          ...................................................

generating ANC from model Hessian ...
Using Lindh-Hessian (1995)
 Shifting diagonal of input Hessian by   2.618047916841299E-003
 Lowest  eigenvalues of input Hessian
   -0.000000   -0.000000   -0.000000   -0.000000   -0.000000    0.000000
    0.005000    0.006975    0.009348    0.010621    0.013474    0.016899
    0.022038    0.024611    0.033738    0.040144    0.042899    0.050389
 Highest eigenvalues
    1.385846    1.551910    1.699161    1.786489    1.864357    2.050080
 

........................................................................
.............................. CYCLE    1 ..............................
........................................................................
   1    -27.9855761 -0.279856E+02  0.445E-05    2.53       0.0  T
   2    -27.9855761 -0.375167E-11  0.253E-05    2.53     884.7  T
   3    -27.9855761  0.508038E-12  0.191E-05    2.53    1171.4  T
     SCC iter.                  ...        0 min,  0.003 sec
     gradient                   ...        0 min,  0.009 sec
 * total energy  :   -27.5551999 Eh     change       -0.1645926E-08 Eh
   gradient norm :     0.0346050 Eh/α   predicted     0.0000000E+00 (-100.00%)
   displ. norm   :     0.2404014 α      lambda       -0.3673853E-02
   maximum displ.:     0.1401445 α      in ANC's #1, #2, #7, ...

........................................................................
.............................. CYCLE    2 ..............................
........................................................................
   1    -27.9940315 -0.279940E+02  0.203E-01    2.50       0.0  T
   2    -27.9940331 -0.162594E-05  0.127E-01    2.51       1.0  T
   3    -27.9939200  0.113172E-03  0.992E-02    2.50       1.0  T
   4    -27.9940734 -0.153433E-03  0.161E-02    2.51       1.4  T
   5    -27.9940741 -0.706249E-06  0.818E-03    2.51       2.7  T
   6    -27.9940745 -0.340228E-06  0.329E-03    2.51       6.8  T
   7    -27.9940746 -0.167436E-06  0.118E-03    2.51      18.9  T
     SCC iter.                  ...        0 min,  0.006 sec
     gradient                   ...        0 min,  0.009 sec
 * total energy  :   -27.5573925 Eh     change       -0.2192585E-02 Eh
   gradient norm :     0.0094110 Eh/α   predicted    -0.1943103E-02 ( -11.38%)
   displ. norm   :     0.2013535 α      lambda       -0.6506495E-03
   maximum displ.:     0.1388276 α      in ANC's #1, #2, #3, ...

........................................................................
.............................. CYCLE    3 ..............................
........................................................................
   1    -27.9966477 -0.279966E+02  0.151E-01    2.51       0.0  T
   2    -27.9966493 -0.165420E-05  0.854E-02    2.51       1.0  T
   3    -27.9965939  0.553880E-04  0.631E-02    2.50       1.0  T
   4    -27.9966600 -0.660872E-04  0.113E-02    2.51       2.0  T
   5    -27.9966598  0.212447E-06  0.586E-03    2.51       3.8  T
   6    -27.9966604 -0.539426E-06  0.107E-03    2.51      20.8  T
   7    -27.9966604 -0.886698E-08  0.598E-04    2.51      37.4  T
     SCC iter.                  ...        0 min,  0.006 sec
     gradient                   ...        0 min,  0.009 sec
 * total energy  :   -27.5578395 Eh     change       -0.4469903E-03 Eh
   gradient norm :     0.0042700 Eh/α   predicted    -0.3385241E-03 ( -24.27%)
   displ. norm   :     0.2367149 α      lambda       -0.4216865E-03
   maximum displ.:     0.1737532 α      in ANC's #1, #2, #3, ...

........................................................................
.............................. CYCLE    4 ..............................
........................................................................
   1    -27.9964732 -0.279965E+02  0.195E-01    2.51       0.0  T
   2    -27.9964780 -0.476991E-05  0.106E-01    2.52       1.0  T
   3    -27.9964438  0.341241E-04  0.495E-02    2.51       1.0  T
   4    -27.9964821 -0.383130E-04  0.148E-02    2.52       1.5  T
   5    -27.9964827 -0.569202E-06  0.423E-03    2.52       5.3  T
   6    -27.9964830 -0.298906E-06  0.949E-04    2.51      23.6  T
   7    -27.9964830 -0.347601E-08  0.559E-04    2.51      40.0  T
     SCC iter.                  ...        0 min,  0.006 sec
     gradient                   ...        0 min,  0.009 sec
 * total energy  :   -27.5581207 Eh     change       -0.2812313E-03 Eh
   gradient norm :     0.0049954 Eh/α   predicted    -0.2226602E-03 ( -20.83%)
   displ. norm   :     0.2100387 α      lambda       -0.2700326E-03
   maximum displ.:     0.1658630 α      in ANC's #1, #2, #3, ...

........................................................................
.............................. CYCLE    5 ..............................
........................................................................
   1    -27.9954193 -0.279954E+02  0.158E-01    2.53       0.0  T
   2    -27.9954229 -0.357148E-05  0.851E-02    2.53       1.0  T
   3    -27.9954226  0.323248E-06  0.165E-02    2.53       1.4  T
   4    -27.9954212  0.137742E-05  0.132E-02    2.53       1.7  T
   5    -27.9954238 -0.258302E-05  0.160E-03    2.53      14.0  T
   6    -27.9954238 -0.312093E-07  0.681E-04    2.53      32.8  T
     SCC iter.                  ...        0 min,  0.005 sec
     gradient                   ...        0 min,  0.009 sec
 * total energy  :   -27.5583199 Eh     change       -0.1991669E-03 Eh
   gradient norm :     0.0055112 Eh/α   predicted    -0.1409741E-03 ( -29.22%)
   displ. norm   :     0.1771423 α      lambda       -0.2093813E-03
   maximum displ.:     0.1443033 α      in ANC's #1, #2, #7, ...

........................................................................
.............................. CYCLE    6 ..............................
........................................................................
   1    -27.9954477 -0.279954E+02  0.149E-01    2.53       0.0  T
   2    -27.9954507 -0.297050E-05  0.800E-02    2.53       1.0  T
   3    -27.9954300  0.206828E-04  0.394E-02    2.54       1.0  T
   4    -27.9954535 -0.234998E-04  0.108E-02    2.54       2.1  T
   5    -27.9954536 -0.150042E-06  0.335E-03    2.54       6.7  T
   6    -27.9954538 -0.202082E-06  0.583E-04    2.54      38.4  T
   7    -27.9954539 -0.204162E-08  0.311E-04    2.54      71.9  T
     SCC iter.                  ...        0 min,  0.006 sec
     gradient                   ...        0 min,  0.009 sec
 * total energy  :   -27.5584969 Eh     change       -0.1770215E-03 Eh
   gradient norm :     0.0049662 Eh/α   predicted    -0.1079809E-03 ( -39.00%)
   displ. norm   :     0.2435301 α      lambda       -0.2737753E-03
   maximum displ.:     0.2057705 α      in ANC's #1, #2, #8, ...

........................................................................
.............................. CYCLE    7 ..............................
........................................................................
   1    -27.9960249 -0.279960E+02  0.209E-01    2.54       0.0  T
   2    -27.9960310 -0.615291E-05  0.112E-01    2.54       1.0  T
   3    -27.9959782  0.528550E-04  0.622E-02    2.54       1.0  T
   4    -27.9960387 -0.605636E-04  0.150E-02    2.54       1.5  T
   5    -27.9960387 -0.339125E-08  0.603E-03    2.54       3.7  T
   6    -27.9960394 -0.623196E-06  0.111E-03    2.54      20.2  T
   7    -27.9960394 -0.139466E-07  0.432E-04    2.54      51.7  T
     SCC iter.                  ...        0 min,  0.006 sec
     gradient                   ...        0 min,  0.009 sec
 * total energy  :   -27.5587189 Eh     change       -0.2219755E-03 Eh
   gradient norm :     0.0046686 Eh/α   predicted    -0.1450064E-03 ( -34.67%)
   displ. norm   :     0.2930715 α      lambda       -0.2618204E-03
   maximum displ.:     0.2541001 α      in ANC's #1, #2, #3, ...

........................................................................
.............................. CYCLE    8 ..............................
........................................................................
   1    -27.9961104 -0.279961E+02  0.240E-01    2.53       0.0  T
   2    -27.9961191 -0.867880E-05  0.128E-01    2.54       1.0  T
   3    -27.9960730  0.460515E-04  0.593E-02    2.54       1.0  T
   4    -27.9961252 -0.522201E-04  0.171E-02    2.54       1.3  T
   5    -27.9961259 -0.625133E-06  0.533E-03    2.54       4.2  T
   6    -27.9961263 -0.459891E-06  0.147E-03    2.54      15.2  T
   7    -27.9961263 -0.319388E-07  0.458E-04    2.54      48.8  T
     SCC iter.                  ...        0 min,  0.006 sec
     gradient                   ...        0 min,  0.009 sec
 * total energy  :   -27.5589258 Eh     change       -0.2068776E-03 Eh
   gradient norm :     0.0054333 Eh/α   predicted    -0.1421588E-03 ( -31.28%)
   displ. norm   :     0.3364981 α      lambda       -0.2638819E-03
   maximum displ.:     0.3020873 α      in ANC's #1, #2, #3, ...

........................................................................
.............................. CYCLE    9 ..............................
........................................................................
   1    -27.9963064 -0.279963E+02  0.269E-01    2.53       0.0  T
   2    -27.9963190 -0.125140E-04  0.143E-01    2.53       1.0  T
   3    -27.9962897  0.292182E-04  0.510E-02    2.53       1.0  T
   4    -27.9963225 -0.327544E-04  0.202E-02    2.53       1.1  T
   5    -27.9963245 -0.199862E-05  0.497E-03    2.53       4.5  T
   6    -27.9963248 -0.360165E-06  0.175E-03    2.53      12.8  T
   7    -27.9963249 -0.474617E-07  0.495E-04    2.53      45.2  T
     SCC iter.                  ...        0 min,  0.006 sec
     gradient                   ...        0 min,  0.009 sec
 * total energy  :   -27.5591188 Eh     change       -0.1930728E-03 Eh
   gradient norm :     0.0062896 Eh/α   predicted    -0.1468812E-03 ( -23.92%)
   displ. norm   :     0.3284721 α      lambda       -0.2191776E-03
   maximum displ.:     0.2939720 α      in ANC's #1, #3, #2, ...

........................................................................
.............................. CYCLE   10 ..............................
........................................................................
   1    -27.9967971 -0.279968E+02  0.244E-01    2.52       0.0  T
   2    -27.9968072 -0.100920E-04  0.129E-01    2.52       1.0  T
   3    -27.9968077 -0.468868E-06  0.242E-02    2.52       1.0  T
   4    -27.9968048  0.286317E-05  0.186E-02    2.52       1.2  T
   5    -27.9968095 -0.466350E-05  0.297E-03    2.52       7.5  T
   6    -27.9968096 -0.136401E-06  0.721E-04    2.52      31.0  T
   7    -27.9968096 -0.145887E-08  0.396E-04    2.52      56.5  T
     SCC iter.                  ...        0 min,  0.006 sec
     gradient                   ...        0 min,  0.009 sec
 * total energy  :   -27.5592571 Eh     change       -0.1382774E-03 Eh
   gradient norm :     0.0053050 Eh/α   predicted    -0.1214155E-03 ( -12.19%)
   displ. norm   :     0.2498539 α      lambda       -0.1391450E-03
   maximum displ.:     0.2180654 α      in ANC's #1, #3, #33, ...

........................................................................
.............................. CYCLE   11 ..............................
........................................................................
   1    -27.9967925 -0.279968E+02  0.177E-01    2.52       0.0  T
   2    -27.9967966 -0.416208E-05  0.966E-02    2.52       1.0  T
   3    -27.9967942  0.243031E-05  0.206E-02    2.52       1.1  T
   4    -27.9967956 -0.138431E-05  0.144E-02    2.52       1.6  T
   5    -27.9967978 -0.223920E-05  0.218E-03    2.52      10.3  T
   6    -27.9967979 -0.684102E-07  0.768E-04    2.52      29.1  T
     SCC iter.                  ...        0 min,  0.005 sec
     gradient                   ...        0 min,  0.009 sec
 * total energy  :   -27.5593331 Eh     change       -0.7598114E-04 Eh
   gradient norm :     0.0052314 Eh/α   predicted    -0.7392462E-04 (  -2.71%)
   displ. norm   :     0.0802500 α      lambda       -0.7187635E-04
   maximum displ.:     0.0529714 α      in ANC's #1, #3, #2, ...

........................................................................
.............................. CYCLE   12 ..............................
........................................................................
   1    -27.9994424 -0.279994E+02  0.475E-02    2.53       0.0  T
   2    -27.9994425 -0.168633E-06  0.278E-02    2.53       1.0  T
   3    -27.9994380  0.454729E-05  0.170E-02    2.53       1.3  T
   4    -27.9994430 -0.504952E-05  0.315E-03    2.53       7.1  T
   5    -27.9994431 -0.247499E-07  0.145E-03    2.53      15.4  T
   6    -27.9994431 -0.276033E-07  0.404E-04    2.53      55.3  T
     SCC iter.                  ...        0 min,  0.005 sec
     gradient                   ...        0 min,  0.009 sec
 * total energy  :   -27.5593501 Eh     change       -0.1699515E-04 Eh
   gradient norm :     0.0042847 Eh/α   predicted    -0.3617123E-04 ( 112.83%)
   displ. norm   :     0.2598321 α      lambda       -0.1166118E-03
   maximum displ.:     0.2112779 α      in ANC's #1, #3, #2, ...

........................................................................
.............................. CYCLE   13 ..............................
........................................................................
   1    -27.9965379 -0.279965E+02  0.170E-01    2.53       0.0  T
   2    -27.9965411 -0.316902E-05  0.947E-02    2.53       1.0  T
   3    -27.9965325  0.854921E-05  0.264E-02    2.53       1.0  T
   4    -27.9965414 -0.882277E-05  0.123E-02    2.53       1.8  T
   5    -27.9965425 -0.113552E-05  0.278E-03    2.53       8.1  T
   6    -27.9965426 -0.124961E-06  0.706E-04    2.53      31.7  T
     SCC iter.                  ...        0 min,  0.005 sec
     gradient                   ...        0 min,  0.009 sec
 * total energy  :   -27.5593582 Eh     change       -0.8081830E-05 Eh
   gradient norm :     0.0054809 Eh/α   predicted    -0.6224289E-04 ( 670.16%)
   displ. norm   :     0.1348844 α      lambda       -0.8203354E-04
   maximum displ.:     0.1124658 α      in ANC's #1, #3, #2, ...

........................................................................
.............................. CYCLE   14 ..............................
........................................................................
   1    -27.9979779 -0.279980E+02  0.907E-02    2.53       0.0  T
   2    -27.9979789 -0.102075E-05  0.501E-02    2.53       1.0  T
   3    -27.9979712  0.768843E-05  0.230E-02    2.53       1.0  T
   4    -27.9979798 -0.857290E-05  0.647E-03    2.53       3.5  T
   5    -27.9979798 -0.791724E-07  0.251E-03    2.53       8.9  T
   6    -27.9979799 -0.105094E-06  0.411E-04    2.53      54.4  T
     SCC iter.                  ...        0 min,  0.005 sec
     gradient                   ...        0 min,  0.009 sec
 * total energy  :   -27.5593955 Eh     change       -0.3733187E-04 Eh
   gradient norm :     0.0013802 Eh/α   predicted    -0.4176284E-04 (  11.87%)
   displ. norm   :     0.0413700 α      lambda       -0.7597871E-05
   maximum displ.:     0.0234985 α      in ANC's #1, #3, #2, ...

........................................................................
.............................. CYCLE   15 ..............................
........................................................................
   1    -27.9979393 -0.279979E+02  0.306E-02    2.53       0.0  T
   2    -27.9979395 -0.177118E-06  0.167E-02    2.53       1.3  T
   3    -27.9979394  0.128845E-06  0.408E-03    2.53       5.5  T
   4    -27.9979395 -0.163606E-06  0.191E-03    2.53      11.7  T
   5    -27.9979395 -0.143086E-07  0.790E-04    2.53      28.3  T
   6    -27.9979395 -0.764513E-08  0.286E-04    2.53      78.1  T
     SCC iter.                  ...        0 min,  0.005 sec
     gradient                   ...        0 min,  0.009 sec
 * total energy  :   -27.5594034 Eh     change       -0.7940902E-05 Eh
   gradient norm :     0.0016611 Eh/α   predicted    -0.3813347E-05 ( -51.98%)
   displ. norm   :     0.1969726 α      lambda       -0.2603000E-04
   maximum displ.:     0.1342489 α      in ANC's #1, #2, #3, ...

........................................................................
.............................. CYCLE   16 ..............................
........................................................................
   1    -27.9965432 -0.279965E+02  0.155E-01    2.53       0.0  T
   2    -27.9965459 -0.273892E-05  0.857E-02    2.53       1.0  T
   3    -27.9965304  0.154796E-04  0.338E-02    2.54       1.0  T
   4    -27.9965478 -0.173547E-04  0.948E-03    2.53       2.4  T
   5    -27.9965479 -0.135188E-06  0.333E-03    2.53       6.7  T
   6    -27.9965481 -0.161221E-06  0.803E-04    2.53      27.8  T
   7    -27.9965481 -0.686728E-08  0.382E-04    2.53      58.5  T
     SCC iter.                  ...        0 min,  0.006 sec
     gradient                   ...        0 min,  0.009 sec
 * total energy  :   -27.5593868 Eh     change        0.1668745E-04 Eh
   gradient norm :     0.0061630 Eh/α   predicted    -0.1324127E-04 (-179.35%)
   displ. norm   :     0.0752658 α      lambda       -0.4285407E-04
   maximum displ.:     0.0627897 α      in ANC's #1, #3, #2, ...

........................................................................
.............................. CYCLE   17 ..............................
........................................................................
   1    -27.9976553 -0.279977E+02  0.567E-02    2.54       0.0  T
   2    -27.9976557 -0.382209E-06  0.318E-02    2.54       1.0  T
   3    -27.9976534  0.238000E-05  0.131E-02    2.53       1.7  T
   4    -27.9976560 -0.261843E-05  0.355E-03    2.54       6.3  T
   5    -27.9976560 -0.355928E-07  0.124E-03    2.54      18.1  T
   6    -27.9976560 -0.209777E-07  0.332E-04    2.54      67.4  T
     SCC iter.                  ...        0 min,  0.005 sec
     gradient                   ...        0 min,  0.009 sec
 * total energy  :   -27.5594136 Eh     change       -0.2686492E-04 Eh
   gradient norm :     0.0019104 Eh/α   predicted    -0.2155586E-04 ( -19.76%)
   displ. norm   :     0.0245015 α      lambda       -0.8499827E-05
   maximum displ.:     0.0130065 α      in ANC's #1, #6, #4, ...

........................................................................
.............................. CYCLE   18 ..............................
........................................................................
   1    -27.9979976 -0.279980E+02  0.281E-02    2.53       0.0  T
   2    -27.9979977 -0.148739E-06  0.151E-02    2.53       1.5  T
   3    -27.9979962  0.155679E-05  0.107E-02    2.53       2.1  T
   4    -27.9979980 -0.184350E-05  0.205E-03    2.53      10.9  T
   5    -27.9979980  0.108950E-07  0.127E-03    2.53      17.6  T
   6    -27.9979980 -0.197120E-07  0.240E-04    2.53      93.1  T
   7    -27.9979980 -0.624205E-09  0.934E-05    2.53     239.3  T
     SCC iter.                  ...        0 min,  0.006 sec
     gradient                   ...        0 min,  0.009 sec
 * total energy  :   -27.5594181 Eh     change       -0.4458160E-05 Eh
   gradient norm :     0.0017245 Eh/α   predicted    -0.4254660E-05 (  -4.56%)
   displ. norm   :     0.0179452 α      lambda       -0.2644193E-05
   maximum displ.:     0.0147229 α      in ANC's #1, #2, #4, ...

........................................................................
.............................. CYCLE   19 ..............................
........................................................................
   1    -27.9981479 -0.279981E+02  0.177E-02    2.53       0.0  T
   2    -27.9981480 -0.101248E-06  0.857E-03    2.53       2.6  T
   3    -27.9981480 -0.473969E-08  0.178E-03    2.53      12.6  T
   4    -27.9981480 -0.226569E-08  0.133E-03    2.53      16.8  T
   5    -27.9981480 -0.150631E-07  0.314E-04    2.53      71.1  T
   6    -27.9981480 -0.104684E-08  0.980E-05    2.53     228.2  T
     SCC iter.                  ...        0 min,  0.005 sec
     gradient                   ...        0 min,  0.009 sec
 * total energy  :   -27.5594205 Eh     change       -0.2458699E-05 Eh
   gradient norm :     0.0011047 Eh/α   predicted    -0.1323431E-05 ( -46.17%)
   displ. norm   :     0.0284680 α      lambda       -0.2671622E-05
   maximum displ.:     0.0216601 α      in ANC's #2, #5, #3, ...

........................................................................
.............................. CYCLE   20 ..............................
........................................................................
   1    -27.9979872 -0.279980E+02  0.232E-02    2.53       0.0  T
   2    -27.9979873 -0.979358E-07  0.125E-02    2.53       1.8  T
   3    -27.9979873  0.396398E-08  0.232E-03    2.53       9.6  T
   4    -27.9979873 -0.699522E-08  0.151E-03    2.53      14.8  T
   5    -27.9979873 -0.193098E-07  0.525E-04    2.53      42.6  T
   6    -27.9979873 -0.344883E-08  0.154E-04    2.53     145.3  T
     SCC iter.                  ...        0 min,  0.005 sec
     gradient                   ...        0 min,  0.009 sec
 * total energy  :   -27.5594230 Eh     change       -0.2488768E-05 Eh
   gradient norm :     0.0004745 Eh/α   predicted    -0.1337764E-05 ( -46.25%)
   displ. norm   :     0.0281362 α      lambda       -0.1845946E-05
   maximum displ.:     0.0216299 α      in ANC's #2, #3, #5, ...

   *** GEOMETRY OPTIMIZATION CONVERGED AFTER 20 ITERATIONS ***

------------------------------------------------------------------------
 total energy gain   :        -0.0042231 Eh       -2.6500 kcal/mol
 total RMSD          :         0.5761698 a0        0.3049 Å
 total power (kW/mol):        -0.5543891 (step)  -26.2546 (real)
------------------------------------------------------------------------

 ANCopt (total)                0 d,  0 h,  0 min,  0.422 sec
 optimizer setup                ...        0 min,  0.000 sec (  0.034%)
 model hessian                  ...        0 min,  0.004 sec (  0.951%)
 ANC generation                 ...        0 min,  0.001 sec (  0.129%)
 coordinate transformation      ...        0 min,  0.000 sec (  0.064%)
 single point calculation       ...        0 min,  0.410 sec ( 97.103%)
 optimization log               ...        0 min,  0.002 sec (  0.404%)
 hessian update                 ...        0 min,  0.000 sec (  0.055%)
 rational function              ...        0 min,  0.004 sec (  0.985%)

================
 final structure:
================
$coord
   -2.45365496655065   -2.55657007182846    0.29486634441451      C 
   -4.05640118100263   -0.59806655770432    0.36299872084741      C 
   -2.73977098855223    1.77483876246433   -0.14115914434385      C 
   -0.28932449267712    1.16350351904170   -0.58888445485298      C 
    0.09625019985557   -1.64225091005768   -0.51304193645197      C 
    2.47770633941602   -2.00905531225307    1.06690790417769      C 
    4.34256600205674   -0.07889084696620    0.00844381733730      C 
    2.52891309228093    2.82136044393038   -0.66142643132514      S 
   -3.79121125946467    4.28596974463503   -0.09373140074713      C 
   -6.20317318936969    4.85443794726956    0.32554253927649      C 
   -2.88793101851917   -4.51700879308349    0.59263343911856      H 
   -6.03672751848274   -0.69754805936118    0.80347941189892      H 
    0.46396019404060   -2.33847954243524   -2.43507147094802      H 
    3.24421619945581   -3.91582191254326    0.92608040342315      H 
    2.06344999084053   -1.59632218273236    3.04501122983590      H 
    5.16095251623110   -0.72151919594635   -1.77158077125004      H 
    5.85258030115259    0.40628430685972    1.31670468259879      H 
   -2.43085995925696    5.77720739768159   -0.44133472495964      H 
   -7.61080696043662    3.42687917058844    0.67023237412465      H 
   -6.85372055863292    6.78119854393428    0.33979326409703      H 
$end
           -------------------------------------------------
          |                Final Singlepoint                |
           -------------------------------------------------

          ...................................................
          :                      SETUP                      :
          :.................................................:
          :  # basis functions                  56          :
          :  # atomic orbitals                  55          :
          :  # shells                           31          :
          :  # electrons                        52          :
          :  max. iterations                   250          :
          :  Hamiltonian                  GFN2-xTB          :
          :  restarted?                      false          :
          :  GBSA solvation                  false          :
          :  PC potential                    false          :
          :  electronic temp.          300.0000000     K    :
          :  accuracy                    1.0000000          :
          :  -> integral cutoff          0.2500000E+02      :
          :  -> integral neglect         0.1000000E-07      :
          :  -> SCF convergence          0.1000000E-05 Eh   :
          :  -> wf. convergence          0.1000000E-03 e    :
          :  Broyden damping             0.4000000          :
          ...................................................

 iter      E             dE          RMSdq      gap      omega  full diag
   1    -27.9979873 -0.279980E+02  0.881E-05    2.53       0.0  T
   2    -27.9979873 -0.224176E-11  0.317E-05    2.53     705.9  T
   3    -27.9979873 -0.160938E-11  0.466E-05    2.53     479.8  T

   *** convergence criteria satisfied after 3 iterations ***

         #    Occupation            Energy/Eh            Energy/eV
      -------------------------------------------------------------
         1        2.0000           -0.7174670             -19.5233
       ...           ...                  ...                  ...
        20        2.0000           -0.4461469             -12.1403
        21        2.0000           -0.4449661             -12.1081
        22        2.0000           -0.4370986             -11.8941
        23        2.0000           -0.4199749             -11.4281
        24        2.0000           -0.4049937             -11.0204
        25        2.0000           -0.3999493             -10.8832
        26        2.0000           -0.3469766              -9.4417 (HOMO)
        27                         -0.2538916              -6.9087 (LUMO)
        28                         -0.2105868              -5.7304
        29                         -0.2069129              -5.6304
        30                         -0.1303862              -3.5480
        31                         -0.1095395              -2.9807
       ...                                ...                  ...
        55                          0.7118009              19.3691
      -------------------------------------------------------------
                  HL-Gap            0.0930850 Eh            2.5330 eV
             Fermi-level           -0.3004341 Eh           -8.1752 eV

 SCC (total)                   0 d,  0 h,  0 min,  0.019 sec
 SCC setup                      ...        0 min,  0.000 sec (  0.873%)
 Dispersion                     ...        0 min,  0.000 sec (  0.873%)
 integral evaluation            ...        0 min,  0.006 sec ( 29.562%)
 zeroth order Hamiltonian       ...        0 min,  0.000 sec (  0.575%)
 iterations                     ...        0 min,  0.003 sec ( 16.332%)
 molecular gradient             ...        0 min,  0.009 sec ( 49.922%)
 printout                       ...        0 min,  0.000 sec (  1.607%)

         :::::::::::::::::::::::::::::::::::::::::::::::::::::
         ::                     SUMMARY                     ::
         :::::::::::::::::::::::::::::::::::::::::::::::::::::
         :: total energy             -27.559423030067 Eh    ::
         :: gradient norm              0.000474154911 Eh/a0 ::
         :: HOMO-LUMO gap              2.532971704450 eV    ::
         ::.................................................::
         :: SCC energy               -27.997987314677 Eh    ::
         :: -> isotropic ES            0.003723734558 Eh    ::
         :: -> anisotropic ES          0.004069960030 Eh    ::
         :: -> anisotropic XC          0.018003381966 Eh    ::
         :: -> dispersion             -0.018701227734 Eh    ::
         :: repulsion energy           0.438516989350 Eh    ::
         :: add. restraining           0.000000000000 Eh    ::
         :::::::::::::::::::::::::::::::::::::::::::::::::::::

           -------------------------------------------------
          |                Property Printout                |
           -------------------------------------------------

    * Orbital Energies and Occupations

         #    Occupation            Energy/Eh            Energy/eV
      -------------------------------------------------------------
         1        2.0000           -0.7174670             -19.5233
       ...           ...                  ...                  ...
        14        2.0000           -0.4949745             -13.4689
        15        2.0000           -0.4868894             -13.2489
        16        2.0000           -0.4773248             -12.9887
        17        2.0000           -0.4651681             -12.6579
        18        2.0000           -0.4626648             -12.5898
        19        2.0000           -0.4517853             -12.2937
        20        2.0000           -0.4461469             -12.1403
        21        2.0000           -0.4449661             -12.1081
        22        2.0000           -0.4370986             -11.8941
        23        2.0000           -0.4199749             -11.4281
        24        2.0000           -0.4049937             -11.0204
        25        2.0000           -0.3999493             -10.8832
        26        2.0000           -0.3469766              -9.4417 (HOMO)
        27                         -0.2538916              -6.9087 (LUMO)
        28                         -0.2105868              -5.7304
        29                         -0.2069129              -5.6304
        30                         -0.1303862              -3.5480
        31                         -0.1095395              -2.9807
        32                         -0.0229302              -0.6240
        33                          0.0001308               0.0036
        34                          0.0421228               1.1462
        35                          0.0497979               1.3551
        36                          0.0997254               2.7137
        37                          0.1086563               2.9567
       ...                                ...                  ...
        55                          0.7118009              19.3691
      -------------------------------------------------------------
                  HL-Gap            0.0930850 Eh            2.5330 eV
             Fermi-level           -0.3004341 Eh           -8.1752 eV

     #   Z        covCN         q      C6AA      α(0)
     1   6 C      2.976    -0.058    29.443     8.901
     2   6 C      3.018    -0.038    28.933     8.823
     3   6 C      3.036    -0.013    28.300     8.726
     4   6 C      3.081     0.028    27.297     8.565
     5   6 C      4.010    -0.016    20.783     6.476
     6   6 C      3.871    -0.047    21.376     6.574
     7   6 C      3.807    -0.009    20.736     6.482
     8  16 S      2.074    -0.140   146.932    20.401
     9   6 C      2.890    -0.026    28.659     8.777
    10   6 C      2.839    -0.090    30.241     9.012
    11   1 H      0.926     0.030     2.584     2.514
    12   1 H      0.926     0.036     2.504     2.475
    13   1 H      0.923     0.057     2.230     2.335
    14   1 H      0.925     0.043     2.409     2.427
    15   1 H      0.924     0.047     2.362     2.403
    16   1 H      0.924     0.045     2.381     2.413
    17   1 H      0.925     0.048     2.340     2.392
    18   1 H      0.925     0.034     2.524     2.484
    19   1 H      0.926     0.037     2.488     2.467
    20   1 H      0.926     0.032     2.556     2.500

 Mol. C6AA /au·bohr⁶  :       5411.513973
 Mol. C8AA /au·bohr⁸  :     148662.643125
 Mol. α(0) /au        :        117.148637


Wiberg/Mayer (AO) data.
largest (>0.10) Wiberg bond orders for each atom
          total WBO             WBO to atom ...
     1  C   3.982        C    2 1.816    C    5 1.015    H   11 0.971
     2  C   3.988        C    1 1.816    C    3 1.100    H   12 0.968
     3  C   3.983        C    4 1.590    C    9 1.122    C    2 1.100
     4  C   3.953        C    3 1.590    S    8 1.101    C    5 1.001    C   10 0.109
     5  C   3.993        C    1 1.015    C    4 1.001    C    6 0.977    H   13 0.922
     6  C   3.993        C    7 1.011    H   15 0.978    C    5 0.977    H   14 0.970
     7  C   3.979        C    6 1.011    H   17 0.978    H   16 0.978    S    8 0.976
     8  S   2.334        C    4 1.101    C    7 0.976
     9  C   3.992        C   10 1.869    C    3 1.122    H   18 0.963
    10  C   3.985        C    9 1.869    H   20 0.979    H   19 0.975    C    4 0.109
    11  H   0.999        C    1 0.971
    12  H   0.998        C    2 0.968
    13  H   0.993        C    5 0.922
    14  H   0.998        C    6 0.970
    15  H   0.998        C    6 0.978
    16  H   0.998        C    7 0.978
    17  H   0.997        C    7 0.978
    18  H   0.998        C    9 0.963
    19  H   0.998        C   10 0.975
    20  H   0.998        C   10 0.979

molecular dipole:
                 x           y           z       tot (Debye)
 q only:        0.360      -0.646       0.071
   full:        0.402      -0.995       0.066       2.732
molecular quadrupole (traceless):
                xx          xy          yy          xz          yz          zz
 q only:        1.957      -1.870      -1.347       0.366       0.379      -0.611
  q+dip:        4.097      -3.693      -2.057      -0.623       1.471      -2.040
   full:        3.296      -3.458      -2.501       0.244       1.181      -0.795

           -------------------------------------------------
          |                Geometry Summary                 |
           -------------------------------------------------

      molecular mass/u    :      150.2380000
   center of mass at/Å    :       -0.2802742       0.5475789      -0.0333349
  moments of inertia/u·Å² :        0.2432701E+03   0.5281903E+03   0.7445981E+03
rotational constants/cm⁻¹ :        0.6929594E-01   0.3191583E-01   0.2263991E-01

 * 18 selected distances

     #   Z        #   Z                                     value/Å
     1   6 C      2   6 C                                 1.3396834
     3   6 C      4   6 C                                 1.3573037
     1   6 C      5   6 C                                 1.4958702
     4   6 C      5   6 C                                 1.4992329
     5   6 C      6   6 C                                 1.5247396
     6   6 C      7   6 C                                 1.5267092
     4   6 C      8  16 S                                 1.7306778 (max)
     9   6 C     10   6 C                                 1.3299633
     1   6 C     11   1 H                                 1.0741882 (min)
     2   6 C     12   1 H                                 1.0748438
     5   6 C     13   1 H                                 1.0991284
     6   6 C     14   1 H                                 1.0900446
     6   6 C     15   1 H                                 1.0915491
     7   6 C     16   1 H                                 1.0910828
     7   6 C     17   1 H                                 1.0879818
     9   6 C     18   1 H                                 1.0838674
    10   6 C     19   1 H                                 1.0764782
    10   6 C     20   1 H                                 1.0761729

 * 3 distinct bonds (by element types)

   Z      Z             #   av. dist./Å        max./Å        min./Å
   1 H    6 C          10     1.0845337     1.0991284     1.0741882
   6 C    6 C           7     1.4390718     1.5267092     1.3299633
   6 C   16 S           1     1.7306778     1.7306778     1.7306778


optimized geometry written to: xtbopt.xyz


           -------------------------------------------------
          | TOTAL ENERGY              -27.559423030067 Eh   |
          | GRADIENT NORM               0.000474154911 Eh/α |
          | HOMO-LUMO GAP               2.532971704450 eV   |
           -------------------------------------------------

------------------------------------------------------------------------
 * finished run on 2021/05/19 at 11:00:14.823     
------------------------------------------------------------------------
 total:
 * wall-time:     0 d,  0 h,  0 min,  0.488 sec
 *  cpu-time:     0 d,  0 h,  0 min,  0.485 sec
 * ratio c/w:     0.995 speedup
 SCF:
 * wall-time:     0 d,  0 h,  0 min,  0.028 sec
 *  cpu-time:     0 d,  0 h,  0 min,  0.028 sec
 * ratio c/w:     0.998 speedup
 ANC optimizer:
 * wall-time:     0 d,  0 h,  0 min,  0.442 sec
 *  cpu-time:     0 d,  0 h,  0 min,  0.441 sec
 * ratio c/w:     0.998 speedup

