      -----------------------------------------------------------      
     |                   =====================                   |     
     |                           x T B                           |     
     |                   =====================                   |     
     |                         S. Grimme                         |     
     |          Mulliken Center for Theoretical Chemistry        |     
     |                    University of Bonn                     |     
     |                Version 6.2 RC2 (SAW190805)                |     
      -----------------------------------------------------------      

   This program is distributed in the hope that it will be useful,
   but WITHOUT ANY WARRANTY; without even the implied warranty of
   MERCHANTABILITY or FITNESS FOR A PARTICULAR PURPOSE.
   
   FOR NON-COMMERCIAL, ACADEMIA USE ONLY.
   
   Cite this work as:
   * S. Grimme, C. Bannwarth, P. Shushkov, J. Chem. Theory Comput., 2017,
     13, 1989-2009. DOI: 10.1021/acs.jctc.7b00118
   * C. Bannwarth, S. Ehlert and S. Grimme., J. Chem. Theory Comput., 2019,
     15, 1652-1671. DOI: 10.1021/acs.jctc.8b01176
   * P. Pracht, E. Caldeweyher, S. Ehlert, S. Grimme, ChemRxiv, 2019, preprint.
     DOI: 10.26434/chemrxiv.8326202.v1
   
   for DFT-D4:
   * E. Caldeweyher, C. Bannwarth and S. Grimme, J. Chem. Phys., 2017,
     147, 034112. DOI: 10.1063/1.4993215
   * E. Caldeweyher, S. Ehlert, A. Hansen, H. Neugebauer, S. Spicher,
     C. Bannwarth and S. Grimme, J. Chem. Phys., 2019, 150, 154122.
     DOI: 10.1063/1.5090222
   
   for sTDA-xTB:
   * S. Grimme and C. Bannwarth, J. Chem. Phys., 2016, 145, 054103.
     DOI: 10.1063/1.4959605
   
   in the mass-spec context:
   * V. Asgeirsson, C. Bauer and S. Grimme, Chem. Sci., 2017, 8, 4879.
     DOI: 10.1039/c7sc00601b
   
   for metadynamics refer to:
   * S. Grimme, J. Chem. Theory Comput., 2019, 155, 2847-2862
     DOI: 10.1021/acs.jctc.9b00143
   
   with help from (in alphabetical order)
   C. Bannwarth, F. Bohle, G. Brandenburg, E. Caldeweyher, M. Checinski,
   S. Dohm, S. Ehlert, S. Ehrlich, F. März, H. Neugebauer, J. Pisarek,
   P. Pracht, P. Shushkov, and S. Spicher.
   
 * started run on 2021/05/19 at 11:00:15.591     

           -------------------------------------------------
          |                Calculation Setup                |
           -------------------------------------------------

          program call               : /ihome/ghutchison/geoffh/xtb/xtb 695.xyz -opt
          hostname                   : smp-n144
          coordinate file            : 695.xyz
          omp threads                :                     1
          number of atoms            :                    26
          number of electrons        :                    90
          charge                     :                     0
          spin                       :                   0.0
          first test random number   :      0.87431357582875


########################################################################
# WARNING! Please study the warnings concerning your input carefully
#  - the use of '-opt' is discouraged, please use '--opt' next time
########################################################################

           ------------------------------------------------- 
          |                 G F N 2 - x T B                 |
          | Geometry, Frequencies, Noncovalent interactions |
          |            JCTC 2019 parametrisation            |
           ------------------------------------------------- 
             KAB for C  - Si     :                1.0500
             KAB for H  - Pd     :                0.9500
             k(s)              :                1.8500
             k(p)              :                2.2300
             k(d)              :                2.2300
             k(f)              :                2.0000
             kEN (H0ij)        :               -2.0000
             D4 a1             :                0.5200
             D4 a2             :                5.0000
             D4 s6             :                1.0000
             D4 s8             :                2.7000
             D4 s9             :                5.0000
             alphaj            :                2.0000

  Z AO/shell   Hii/eV     exponent
  1     Wed Apr 25 08:07:45 CEST 2018   EN: 2.200 GM2: 0.406  GM3: 0.0800  RAES: 1.40
     1s    -10.707211    1.230000
  6     Wed Apr 25 08:07:45 CEST 2018   EN: 2.550 GM2: 0.538  GM3: 0.1500  RAES: 3.00
     2s    -13.970922    2.096432
     2p    -10.063292    1.800000
  8     Wed Apr 25 08:07:45 CEST 2018   EN: 3.440 GM2: 0.452  GM3:-0.0517  RAES: 1.80
     2s    -20.229985    2.439742
     2p    -15.503117    2.137023
  9     Mon Apr 23 13:58:50 CEST 2018   EN: 3.980 GM2: 0.532  GM3: 0.1426  RAES: 2.40
     2s    -23.458179    2.416361
     2p    -15.746583    2.308399
 16     Tue Apr 24 11:44:34 CEST 2018   EN: 2.580 GM2: 0.340  GM3:-0.0502  RAES: 3.10
     3s    -20.029654    1.981333
     3p    -11.377694    2.025643
     3d     -0.420282    1.702555

           ------------------------------------------------- 
          |        Self-Consistent Charge Iterations        |
           ------------------------------------------------- 

          ...................................................
          :                      SETUP                      :
          :.................................................:
          :  # basis functions                  83          :
          :  # atomic orbitals                  82          :
          :  # shells                           44          :
          :  # electrons                        90          :
          :  max. iterations                   250          :
          :  Hamiltonian                  GFN2-xTB          :
          :  restarted?                      false          :
          :  GBSA solvation                  false          :
          :  PC potential                    false          :
          :  electronic temp.          300.0000000     K    :
          :  accuracy                    1.0000000          :
          :  -> integral cutoff          0.2500000E+02      :
          :  -> integral neglect         0.1000000E-07      :
          :  -> SCF convergence          0.1000000E-05 Eh   :
          :  -> wf. convergence          0.1000000E-03 e    :
          :  Broyden damping             0.4000000          :
          ...................................................

 iter      E             dE          RMSdq      gap      omega  full diag
   1    -52.2242406 -0.522242E+02  0.480E+00    1.88       0.0  T
   2    -52.2917093 -0.674687E-01  0.277E+00    1.83       1.0  T
   3    -52.2542157  0.374936E-01  0.184E+00    2.05       1.0  T
   4    -52.2844091 -0.301934E-01  0.989E-01    1.77       1.0  T
   5    -52.3065877 -0.221786E-01  0.211E-01    1.84       1.0  T
   6    -52.3071531 -0.565387E-03  0.913E-02    1.83       1.0  T
   7    -52.3072011 -0.480325E-04  0.390E-02    1.83       1.0  T
   8    -52.3072156 -0.144609E-04  0.163E-02    1.83       1.2  T
   9    -52.3072181 -0.251864E-05  0.859E-03    1.83       2.3  T
  10    -52.3072183 -0.191301E-06  0.244E-03    1.83       8.0  T
  11    -52.3072183 -0.468043E-07  0.126E-03    1.83      15.6  T
  12    -52.3072184 -0.160041E-07  0.688E-04    1.83      28.5  T
  13    -52.3072184 -0.251566E-08  0.260E-04    1.83      75.4  T

   *** convergence criteria satisfied after 13 iterations ***

         #    Occupation            Energy/Eh            Energy/eV
      -------------------------------------------------------------
         1        2.0000           -0.8590991             -23.3773
       ...           ...                  ...                  ...
        39        2.0000           -0.4647655             -12.6469
        40        2.0000           -0.4536544             -12.3446
        41        2.0000           -0.4489358             -12.2162
        42        2.0000           -0.4414951             -12.0137
        43        2.0000           -0.4313126             -11.7366
        44        2.0000           -0.4068531             -11.0710
        45        2.0000           -0.3718227             -10.1178 (HOMO)
        46                         -0.3045955              -8.2885 (LUMO)
        47                         -0.2542110              -6.9174
        48                         -0.2222021              -6.0464
        49                         -0.2132084              -5.8017
        50                         -0.1901588              -5.1745
       ...                                ...                  ...
        82                          0.7213550              19.6291
      -------------------------------------------------------------
                  HL-Gap            0.0672272 Eh            1.8293 eV
             Fermi-level           -0.3382091 Eh           -9.2031 eV

 SCC (total)                   0 d,  0 h,  0 min,  0.052 sec
 SCC setup                      ...        0 min,  0.000 sec (  0.656%)
 Dispersion                     ...        0 min,  0.000 sec (  0.784%)
 integral evaluation            ...        0 min,  0.013 sec ( 25.152%)
 zeroth order Hamiltonian       ...        0 min,  0.000 sec (  0.453%)
 iterations                     ...        0 min,  0.020 sec ( 37.830%)
 molecular gradient             ...        0 min,  0.018 sec ( 34.234%)
 printout                       ...        0 min,  0.000 sec (  0.792%)

         :::::::::::::::::::::::::::::::::::::::::::::::::::::
         ::                     SUMMARY                     ::
         :::::::::::::::::::::::::::::::::::::::::::::::::::::
         :: total energy             -51.756803487985 Eh    ::
         :: gradient norm              0.104116168763 Eh/a0 ::
         :: HOMO-LUMO gap              1.829345674486 eV    ::
         ::.................................................::
         :: SCC energy               -52.307218357519 Eh    ::
         :: -> isotropic ES            0.059174660562 Eh    ::
         :: -> anisotropic ES          0.000157370754 Eh    ::
         :: -> anisotropic XC         -0.002250662673 Eh    ::
         :: -> dispersion             -0.027996523199 Eh    ::
         :: repulsion energy           0.550352677691 Eh    ::
         :: add. restraining           0.000000000000 Eh    ::
         :::::::::::::::::::::::::::::::::::::::::::::::::::::

      ----------------------------------------------------------- 
     |                   =====================                   |
     |                        A N C O P T                        |
     |                   =====================                   |
     |               Approximate Normal Coordinate               |
     |                Rational Function Optimizer                |
      ----------------------------------------------------------- 

          ...................................................
          :                      SETUP                      :
          :.................................................:
          :   optimization level            normal          :
          :   max. optcycles                   200          :
          :   ANC micro-cycles                  20          :
          :   degrees of freedom                72          :
          :.................................................:
          :   RF solver                   davidson          :
          :   input Hessian                  false          :
          :   write xtbopt.log                true          :
          :   linear?                        false          :
          :   energy convergence         0.5000000E-05 Eh   :
          :   grad. convergence          0.1000000E-02 Eh/α :
          :   maximium RF displ.         2.0000000          :
          :   Hlow (freq-cutoff)         0.5000000E-02      :
          :   Hmax (freq-cutoff)         5.0000000          :
          :   S6 in model hess.         20.0000000          :
          ...................................................

generating ANC from model Hessian ...
Using Lindh-Hessian (1995)
 Shifting diagonal of input Hessian by   4.074712585218679E-003
 Lowest  eigenvalues of input Hessian
   -0.000000    0.000000    0.000000    0.000000    0.000000    0.000000
    0.005000    0.005938    0.007154    0.008155    0.008708    0.009428
    0.011204    0.011771    0.015696    0.016494    0.018684    0.021827
 Highest eigenvalues
    1.700424    1.745402    1.824443    1.938116    1.986438    2.064904
 

........................................................................
.............................. CYCLE    1 ..............................
........................................................................
   1    -52.3072184 -0.523072E+02  0.117E-04    1.83       0.0  T
   2    -52.3072184 -0.169678E-10  0.801E-05    1.83     245.0  T
   3    -52.3072184 -0.749623E-11  0.635E-05    1.83     308.6  T
     SCC iter.                  ...        0 min,  0.005 sec
     gradient                   ...        0 min,  0.018 sec
 * total energy  :   -51.7568035 Eh     change       -0.1437704E-07 Eh
   gradient norm :     0.1041171 Eh/α   predicted     0.0000000E+00 (-100.00%)
   displ. norm   :     0.3117352 α      lambda       -0.1776382E-01
   maximum displ.:     0.1450592 α      in ANC's #31, #32, #19, ...

........................................................................
.............................. CYCLE    2 ..............................
........................................................................
   1    -52.3433957 -0.523434E+02  0.267E-01    1.92       0.0  T
   2    -52.3435312 -0.135557E-03  0.165E-01    1.90       1.0  T
   3    -52.3435310  0.250154E-06  0.103E-01    1.91       1.0  T
   4    -52.3436783 -0.147319E-03  0.342E-02    1.90       1.0  T
   5    -52.3436964 -0.181151E-04  0.184E-02    1.91       1.1  T
   6    -52.3437022 -0.581932E-05  0.674E-03    1.91       2.9  T
   7    -52.3437027 -0.495754E-06  0.233E-03    1.91       8.4  T
   8    -52.3437028 -0.901845E-07  0.797E-04    1.91      24.6  T
     SCC iter.                  ...        0 min,  0.011 sec
     gradient                   ...        0 min,  0.016 sec
 * total energy  :   -51.7691658 Eh     change       -0.1236234E-01 Eh
   gradient norm :     0.0492533 Eh/α   predicted    -0.9745042E-02 ( -21.17%)
   displ. norm   :     0.2566859 α      lambda       -0.5164384E-02
   maximum displ.:     0.1422239 α      in ANC's #7, #6, #32, ...

........................................................................
.............................. CYCLE    3 ..............................
........................................................................
   1    -52.3611265 -0.523611E+02  0.196E-01    1.99       0.0  T
   2    -52.3611932 -0.666962E-04  0.125E-01    1.98       1.0  T
   3    -52.3611807  0.124939E-04  0.803E-02    1.99       1.0  T
   4    -52.3612565 -0.757181E-04  0.289E-02    1.98       1.0  T
   5    -52.3612769 -0.203859E-04  0.931E-03    1.98       2.1  T
   6    -52.3612781 -0.128440E-05  0.361E-03    1.98       5.4  T
   7    -52.3612782 -0.112878E-06  0.153E-03    1.98      12.8  T
     SCC iter.                  ...        0 min,  0.010 sec
     gradient                   ...        0 min,  0.016 sec
 * total energy  :   -51.7719690 Eh     change       -0.2803189E-02 Eh
   gradient norm :     0.0113701 Eh/α   predicted    -0.2752332E-02 (  -1.81%)
   displ. norm   :     0.1959327 α      lambda       -0.5542788E-03
   maximum displ.:     0.1084602 α      in ANC's #7, #6, #3, ...

........................................................................
.............................. CYCLE    4 ..............................
........................................................................
   1    -52.3596208 -0.523596E+02  0.124E-01    1.98       0.0  T
   2    -52.3596234 -0.258422E-05  0.710E-02    1.98       1.0  T
   3    -52.3595869  0.365559E-04  0.415E-02    1.98       1.0  T
   4    -52.3596261 -0.392565E-04  0.924E-03    1.98       2.1  T
   5    -52.3596270 -0.905273E-06  0.466E-03    1.98       4.2  T
   6    -52.3596273 -0.320376E-06  0.119E-03    1.98      16.5  T
   7    -52.3596274 -0.173817E-07  0.598E-04    1.98      32.8  T
     SCC iter.                  ...        0 min,  0.010 sec
     gradient                   ...        0 min,  0.016 sec
 * total energy  :   -51.7723800 Eh     change       -0.4109862E-03 Eh
   gradient norm :     0.0058046 Eh/α   predicted    -0.2877794E-03 ( -29.98%)
   displ. norm   :     0.2858637 α      lambda       -0.5254318E-03
   maximum displ.:     0.1522571 α      in ANC's #6, #7, #5, ...

........................................................................
.............................. CYCLE    5 ..............................
........................................................................
   1    -52.3568192 -0.523568E+02  0.185E-01    1.97       0.0  T
   2    -52.3568217 -0.250997E-05  0.108E-01    1.97       1.0  T
   3    -52.3567546  0.671223E-04  0.550E-02    1.98       1.0  T
   4    -52.3568262 -0.716026E-04  0.926E-03    1.97       2.1  T
   5    -52.3568269 -0.673588E-06  0.482E-03    1.97       4.1  T
   6    -52.3568272 -0.352875E-06  0.122E-03    1.97      16.1  T
   7    -52.3568272 -0.105409E-07  0.701E-04    1.97      28.0  T
     SCC iter.                  ...        0 min,  0.010 sec
     gradient                   ...        0 min,  0.016 sec
 * total energy  :   -51.7726878 Eh     change       -0.3078294E-03 Eh
   gradient norm :     0.0078612 Eh/α   predicted    -0.2841862E-03 (  -7.68%)
   displ. norm   :     0.1964581 α      lambda       -0.2743435E-03
   maximum displ.:     0.1238932 α      in ANC's #6, #3, #5, ...

........................................................................
.............................. CYCLE    6 ..............................
........................................................................
   1    -52.3570178 -0.523570E+02  0.124E-01    1.96       0.0  T
   2    -52.3570188 -0.983145E-06  0.715E-02    1.96       1.0  T
   3    -52.3569913  0.274445E-04  0.353E-02    1.97       1.0  T
   4    -52.3570207 -0.293737E-04  0.544E-03    1.96       3.6  T
   5    -52.3570208 -0.985586E-07  0.260E-03    1.97       7.5  T
   6    -52.3570209 -0.103906E-06  0.968E-04    1.96      20.3  T
     SCC iter.                  ...        0 min,  0.009 sec
     gradient                   ...        0 min,  0.016 sec
 * total energy  :   -51.7728762 Eh     change       -0.1884022E-03 Eh
   gradient norm :     0.0087349 Eh/α   predicted    -0.1424687E-03 ( -24.38%)
   displ. norm   :     0.2344458 α      lambda       -0.3057187E-03
   maximum displ.:     0.1507694 α      in ANC's #6, #3, #5, ...

........................................................................
.............................. CYCLE    7 ..............................
........................................................................
   1    -52.3587995 -0.523588E+02  0.148E-01    1.95       0.0  T
   2    -52.3588013 -0.187594E-05  0.853E-02    1.95       1.0  T
   3    -52.3587755  0.257966E-04  0.360E-02    1.96       1.0  T
   4    -52.3588033 -0.277740E-04  0.731E-03    1.95       2.7  T
   5    -52.3588034 -0.692471E-07  0.491E-03    1.95       4.0  T
   6    -52.3588038 -0.463663E-06  0.117E-03    1.95      16.7  T
   7    -52.3588039 -0.282310E-07  0.481E-04    1.95      40.8  T
     SCC iter.                  ...        0 min,  0.010 sec
     gradient                   ...        0 min,  0.016 sec
 * total energy  :   -51.7731066 Eh     change       -0.2303262E-03 Eh
   gradient norm :     0.0063052 Eh/α   predicted    -0.1612682E-03 ( -29.98%)
   displ. norm   :     0.3242010 α      lambda       -0.2888828E-03
   maximum displ.:     0.1905205 α      in ANC's #6, #2, #5, ...

........................................................................
.............................. CYCLE    8 ..............................
........................................................................
   1    -52.3587210 -0.523587E+02  0.185E-01    1.94       0.0  T
   2    -52.3587232 -0.218975E-05  0.109E-01    1.94       1.0  T
   3    -52.3587168  0.636508E-05  0.180E-02    1.94       1.1  T
   4    -52.3587245 -0.768462E-05  0.438E-03    1.94       4.5  T
   5    -52.3587246 -0.766577E-07  0.226E-03    1.94       8.7  T
   6    -52.3587247 -0.522993E-07  0.860E-04    1.94      22.8  T
     SCC iter.                  ...        0 min,  0.009 sec
     gradient                   ...        0 min,  0.016 sec
 * total energy  :   -51.7732871 Eh     change       -0.1805294E-03 Eh
   gradient norm :     0.0062710 Eh/α   predicted    -0.1596248E-03 ( -11.58%)
   displ. norm   :     0.3243814 α      lambda        0.1219335E-03
   maximum displ.:     0.1905436 α      in ANC's #6, #2, #5, ...

........................................................................
.............................. CYCLE    9 ..............................
........................................................................
   1    -52.3559443 -0.523559E+02  0.179E-01    1.93       0.0  T
   2    -52.3559464 -0.210982E-05  0.105E-01    1.93       1.0  T
   3    -52.3559382  0.824499E-05  0.194E-02    1.92       1.0  T
   4    -52.3559473 -0.915240E-05  0.590E-03    1.93       3.3  T
   5    -52.3559477 -0.363052E-06  0.339E-03    1.93       5.8  T
   6    -52.3559478 -0.173802E-06  0.124E-03    1.93      15.8  T
   7    -52.3559479 -0.135007E-07  0.586E-04    1.93      33.5  T
     SCC iter.                  ...        0 min,  0.010 sec
     gradient                   ...        0 min,  0.016 sec
 * total energy  :   -51.7731330 Eh     change        0.1540795E-03 Eh
   gradient norm :     0.0143754 Eh/α   predicted     0.6738067E-04 ( -56.27%)
   displ. norm   :     0.1289975 α      lambda       -0.6170857E-03
   maximum displ.:     0.0694039 α      in ANC's #6, #7, #5, ...

........................................................................
.............................. CYCLE   10 ..............................
........................................................................
   1    -52.3626402 -0.523626E+02  0.680E-02    1.94       0.0  T
   2    -52.3626412 -0.106370E-05  0.400E-02    1.93       1.0  T
   3    -52.3626287  0.125244E-04  0.271E-02    1.94       1.0  T
   4    -52.3626427 -0.139507E-04  0.482E-03    1.93       4.1  T
   5    -52.3626429 -0.181825E-06  0.312E-03    1.93       6.3  T
   6    -52.3626430 -0.176966E-06  0.103E-03    1.93      19.0  T
   7    -52.3626430 -0.990334E-08  0.411E-04    1.93      47.7  T
     SCC iter.                  ...        0 min,  0.010 sec
     gradient                   ...        0 min,  0.016 sec
 * total energy  :   -51.7733771 Eh     change       -0.2440642E-03 Eh
   gradient norm :     0.0066733 Eh/α   predicted    -0.3136845E-03 (  28.53%)
   displ. norm   :     0.0602858 α      lambda       -0.1104926E-03
   maximum displ.:     0.0337323 α      in ANC's #6, #7, #3, ...

........................................................................
.............................. CYCLE   11 ..............................
........................................................................
   1    -52.3610868 -0.523611E+02  0.393E-02    1.94       0.0  T
   2    -52.3610879 -0.108692E-05  0.237E-02    1.94       1.0  T
   3    -52.3610852  0.270003E-05  0.133E-02    1.94       1.5  T
   4    -52.3610886 -0.334882E-05  0.271E-03    1.94       7.2  T
   5    -52.3610887 -0.897189E-07  0.130E-03    1.94      15.1  T
   6    -52.3610887 -0.239444E-07  0.797E-04    1.94      24.6  T
     SCC iter.                  ...        0 min,  0.009 sec
     gradient                   ...        0 min,  0.016 sec
 * total energy  :   -51.7734381 Eh     change       -0.6101759E-04 Eh
   gradient norm :     0.0020331 Eh/α   predicted    -0.5545186E-04 (  -9.12%)
   displ. norm   :     0.0925947 α      lambda       -0.5307658E-04
   maximum displ.:     0.0612546 α      in ANC's #2, #1, #5, ...

........................................................................
.............................. CYCLE   12 ..............................
........................................................................
   1    -52.3602976 -0.523603E+02  0.564E-02    1.94       0.0  T
   2    -52.3602980 -0.378682E-06  0.328E-02    1.94       1.0  T
   3    -52.3602959  0.208447E-05  0.991E-03    1.94       2.0  T
   4    -52.3602981 -0.221411E-05  0.327E-03    1.94       6.0  T
   5    -52.3602982 -0.839119E-07  0.184E-03    1.94      10.7  T
   6    -52.3602982 -0.643838E-07  0.463E-04    1.94      42.4  T
   7    -52.3602982 -0.268908E-08  0.200E-04    1.94      98.1  T
     SCC iter.                  ...        0 min,  0.010 sec
     gradient                   ...        0 min,  0.018 sec
 * total energy  :   -51.7734758 Eh     change       -0.3772042E-04 Eh
   gradient norm :     0.0028060 Eh/α   predicted    -0.2676599E-04 ( -29.04%)
   displ. norm   :     0.2216755 α      lambda       -0.8875267E-04
   maximum displ.:     0.1477758 α      in ANC's #2, #1, #5, ...

........................................................................
.............................. CYCLE   13 ..............................
........................................................................
   1    -52.3595978 -0.523596E+02  0.120E-01    1.94       0.0  T
   2    -52.3595994 -0.155976E-05  0.701E-02    1.94       1.0  T
   3    -52.3595991  0.310770E-06  0.923E-03    1.94       2.1  T
   4    -52.3595996 -0.537008E-06  0.599E-03    1.94       3.3  T
   5    -52.3596001 -0.444892E-06  0.197E-03    1.94      10.0  T
   6    -52.3596001 -0.662203E-07  0.783E-04    1.94      25.0  T
   7    -52.3596001 -0.643230E-08  0.436E-04    1.94      45.0  T
     SCC iter.                  ...        0 min,  0.010 sec
     gradient                   ...        0 min,  0.018 sec
 * total energy  :   -51.7735333 Eh     change       -0.5746323E-04 Eh
   gradient norm :     0.0035848 Eh/α   predicted    -0.4656413E-04 ( -18.97%)
   displ. norm   :     0.1532571 α      lambda       -0.5483785E-04
   maximum displ.:     0.1037235 α      in ANC's #2, #1, #4, ...

........................................................................
.............................. CYCLE   14 ..............................
........................................................................
   1    -52.3597861 -0.523598E+02  0.822E-02    1.94       0.0  T
   2    -52.3597868 -0.673546E-06  0.481E-02    1.94       1.0  T
   3    -52.3597839  0.291391E-05  0.127E-02    1.94       1.5  T
   4    -52.3597871 -0.326952E-05  0.398E-03    1.94       4.9  T
   5    -52.3597872 -0.802471E-07  0.184E-03    1.94      10.6  T
   6    -52.3597873 -0.718129E-07  0.527E-04    1.94      37.2  T
   7    -52.3597873 -0.204214E-08  0.273E-04    1.94      71.9  T
     SCC iter.                  ...        0 min,  0.010 sec
     gradient                   ...        0 min,  0.018 sec
 * total energy  :   -51.7735731 Eh     change       -0.3978920E-04 Eh
   gradient norm :     0.0031398 Eh/α   predicted    -0.2806540E-04 ( -29.46%)
   displ. norm   :     0.1774948 α      lambda       -0.6082842E-04
   maximum displ.:     0.1152410 α      in ANC's #2, #1, #4, ...

........................................................................
.............................. CYCLE   15 ..............................
........................................................................
   1    -52.3610171 -0.523610E+02  0.866E-02    1.94       0.0  T
   2    -52.3610180 -0.856118E-06  0.511E-02    1.94       1.0  T
   3    -52.3610181 -0.113540E-06  0.512E-03    1.94       3.8  T
   4    -52.3610183 -0.183444E-06  0.312E-03    1.94       6.3  T
   5    -52.3610184 -0.108134E-06  0.150E-03    1.94      13.0  T
   6    -52.3610184 -0.426615E-07  0.594E-04    1.94      33.0  T
   7    -52.3610184 -0.276345E-08  0.311E-04    1.94      63.0  T
     SCC iter.                  ...        0 min,  0.010 sec
     gradient                   ...        0 min,  0.018 sec
 * total energy  :   -51.7736001 Eh     change       -0.2704064E-04 Eh
   gradient norm :     0.0028579 Eh/α   predicted    -0.3137287E-04 (  16.02%)
   displ. norm   :     0.1418111 α      lambda       -0.3658221E-04
   maximum displ.:     0.0908958 α      in ANC's #2, #1, #4, ...

........................................................................
.............................. CYCLE   16 ..............................
........................................................................
   1    -52.3603968 -0.523604E+02  0.734E-02    1.93       0.0  T
   2    -52.3603971 -0.342831E-06  0.433E-02    1.93       1.0  T
   3    -52.3603929  0.416584E-05  0.144E-02    1.94       1.4  T
   4    -52.3603975 -0.452980E-05  0.216E-03    1.93       9.1  T
   5    -52.3603975 -0.174422E-07  0.143E-03    1.93      13.7  T
   6    -52.3603975 -0.295917E-07  0.527E-04    1.93      37.2  T
   7    -52.3603975 -0.414739E-08  0.189E-04    1.93     103.6  T
     SCC iter.                  ...        0 min,  0.010 sec
     gradient                   ...        0 min,  0.018 sec
 * total energy  :   -51.7736148 Eh     change       -0.1464338E-04 Eh
   gradient norm :     0.0024060 Eh/α   predicted    -0.1866331E-04 (  27.45%)
   displ. norm   :     0.0443218 α      lambda       -0.1035933E-04
   maximum displ.:     0.0280086 α      in ANC's #2, #1, #5, ...

........................................................................
.............................. CYCLE   17 ..............................
........................................................................
   1    -52.3610855 -0.523611E+02  0.266E-02    1.94       0.0  T
   2    -52.3610857 -0.138961E-06  0.153E-02    1.94       1.3  T
   3    -52.3610856  0.482264E-07  0.291E-03    1.94       6.7  T
   4    -52.3610857 -0.500028E-07  0.192E-03    1.94      10.2  T
   5    -52.3610857 -0.424727E-07  0.753E-04    1.94      26.0  T
   6    -52.3610857 -0.958671E-08  0.287E-04    1.94      68.2  T
     SCC iter.                  ...        0 min,  0.009 sec
     gradient                   ...        0 min,  0.018 sec
 * total energy  :   -51.7736211 Eh     change       -0.6322605E-05 Eh
   gradient norm :     0.0011737 Eh/α   predicted    -0.5191301E-05 ( -17.89%)
   displ. norm   :     0.0662678 α      lambda        0.3312251E-05
   maximum displ.:     0.0420165 α      in ANC's #2, #1, #5, ...

........................................................................
.............................. CYCLE   18 ..............................
........................................................................
   1    -52.3620434 -0.523620E+02  0.399E-02    1.94       0.0  T
   2    -52.3620437 -0.306754E-06  0.229E-02    1.94       1.0  T
   3    -52.3620435  0.140636E-06  0.453E-03    1.94       4.3  T
   4    -52.3620437 -0.138684E-06  0.295E-03    1.94       6.7  T
   5    -52.3620438 -0.100751E-06  0.116E-03    1.94      17.0  T
   6    -52.3620438 -0.239837E-07  0.415E-04    1.94      47.3  T
   7    -52.3620438 -0.304509E-08  0.172E-04    1.94     113.7  T
     SCC iter.                  ...        0 min,  0.010 sec
     gradient                   ...        0 min,  0.018 sec
 * total energy  :   -51.7736165 Eh     change        0.4592784E-05 Eh
   gradient norm :     0.0022454 Eh/α   predicted     0.1659050E-05 ( -63.88%)
   displ. norm   :     0.0628805 α      lambda       -0.1256735E-04
   maximum displ.:     0.0421559 α      in ANC's #2, #1, #4, ...

........................................................................
.............................. CYCLE   19 ..............................
........................................................................
   1    -52.3612295 -0.523612E+02  0.322E-02    1.94       0.0  T
   2    -52.3612296 -0.824109E-07  0.189E-02    1.94       1.0  T
   3    -52.3612290  0.618603E-06  0.553E-03    1.94       3.5  T
   4    -52.3612297 -0.669461E-06  0.118E-03    1.94      16.6  T
   5    -52.3612297 -0.147334E-07  0.598E-04    1.94      32.8  T
   6    -52.3612297 -0.417769E-08  0.231E-04    1.94      85.1  T
     SCC iter.                  ...        0 min,  0.009 sec
     gradient                   ...        0 min,  0.018 sec
 * total energy  :   -51.7736237 Eh     change       -0.7232833E-05 Eh
   gradient norm :     0.0011795 Eh/α   predicted    -0.6308904E-05 ( -12.77%)
   displ. norm   :     0.0642393 α      lambda       -0.4684186E-05
   maximum displ.:     0.0456330 α      in ANC's #2, #1, #4, ...

........................................................................
.............................. CYCLE   20 ..............................
........................................................................
   1    -52.3605768 -0.523606E+02  0.362E-02    1.94       0.0  T
   2    -52.3605770 -0.185428E-06  0.209E-02    1.94       1.0  T
   3    -52.3605768  0.227828E-06  0.422E-03    1.94       4.6  T
   4    -52.3605770 -0.247932E-06  0.202E-03    1.94       9.7  T
   5    -52.3605771 -0.399332E-07  0.874E-04    1.94      22.4  T
   6    -52.3605771 -0.118893E-07  0.376E-04    1.94      52.1  T
     SCC iter.                  ...        0 min,  0.009 sec
     gradient                   ...        0 min,  0.018 sec
 * total energy  :   -51.7736244 Eh     change       -0.6829700E-06 Eh
   gradient norm :     0.0013824 Eh/α   predicted    -0.2346763E-05 ( 243.61%)
   displ. norm   :     0.0342420 α      lambda       -0.2448749E-05
   maximum displ.:     0.0222101 α      in ANC's #1, #2, #5, ...
 * RMSD in coord.:     0.4338765 α      energy gain  -0.1682092E-01 Eh

generating ANC from model Hessian ...
Using Lindh-Hessian (1995)
 Shifting diagonal of input Hessian by   4.004542166971101E-003
 Lowest  eigenvalues of input Hessian
   -0.000000   -0.000000   -0.000000    0.000000    0.000000    0.000000
    0.005000    0.006245    0.007511    0.008274    0.008985    0.010064
    0.011920    0.012843    0.016542    0.018256    0.021007    0.022216
 Highest eigenvalues
    1.742460    1.837410    1.947855    1.973625    2.036625    2.163846
 

........................................................................
.............................. CYCLE   21 ..............................
........................................................................
   1    -52.3609352 -0.523609E+02  0.183E-02    1.94       0.0  T
   2    -52.3609352 -0.442898E-07  0.107E-02    1.94       1.8  T
   3    -52.3609351  0.132026E-06  0.280E-03    1.94       7.0  T
   4    -52.3609352 -0.151250E-06  0.947E-04    1.94      20.7  T
   5    -52.3609352 -0.537815E-08  0.405E-04    1.94      48.5  T
     SCC iter.                  ...        0 min,  0.008 sec
     gradient                   ...        0 min,  0.018 sec
 * total energy  :   -51.7736264 Eh     change       -0.2033434E-05 Eh
   gradient norm :     0.0002714 Eh/α   predicted     0.0000000E+00 (-100.00%)
   displ. norm   :     0.0113350 α      lambda       -0.4309441E-06
   maximum displ.:     0.0090975 α      in ANC's #1, #2, #4, ...

   *** GEOMETRY OPTIMIZATION CONVERGED AFTER 21 ITERATIONS ***

------------------------------------------------------------------------
 total energy gain   :        -0.0168230 Eh      -10.5566 kcal/mol
 total RMSD          :         0.4338765 a0        0.2296 Å
 total power (kW/mol):        -2.1032694 (step)  -52.0379 (real)
------------------------------------------------------------------------

 ANCopt (total)                0 d,  0 h,  0 min,  0.849 sec
 optimizer setup                ...        0 min,  0.000 sec (  0.018%)
 model hessian                  ...        0 min,  0.008 sec (  0.895%)
 ANC generation                 ...        0 min,  0.001 sec (  0.176%)
 coordinate transformation      ...        0 min,  0.000 sec (  0.046%)
 single point calculation       ...        0 min,  0.831 sec ( 97.857%)
 optimization log               ...        0 min,  0.002 sec (  0.259%)
 hessian update                 ...        0 min,  0.000 sec (  0.034%)
 rational function              ...        0 min,  0.005 sec (  0.561%)

================
 final structure:
================
$coord
   -4.51108358009935    2.67448387957458    0.31785955290845      C 
   -6.08503827460200   -0.11360561023232    0.59585151612801      S 
   -3.34215624947597   -1.88517576026768    0.32165452500555      C 
   -1.25973086716725   -0.30364820920350    0.02220600809513      C 
   -1.94838395657454    2.32233148107651    0.02024791889921      C 
   -0.05696687482604    4.18366737047987   -0.27095218012244      C 
    2.39507194224832    3.45104548609121   -0.54070594764422      C 
    4.46344207095744    5.36681099954292   -0.86109682170140      C 
    3.58491928300689    7.75148896668910   -0.84129327096934      F 
    6.20643092225072    5.25574709765438    0.98111843335881      F 
    5.71389665164985    5.10799183181101   -3.05541033585329      F 
    3.11047456080016    0.83621517631549   -0.53436926136444      C 
    5.61888475574440    0.42559338887842   -0.81395788071633      O 
    6.51308968154151   -2.07849002854935   -0.81906073628608      C 
    1.30395711338980   -0.99427738594700   -0.25921586325894      C 
   -3.38408017274735   -4.59109450643408    0.40904944080340      C 
   -5.44906096715544   -6.00030836212366    0.70699172463691      C 
   -5.52504184387859    4.42568641715944    0.38430591735003      H 
   -0.57086825328136    6.15627844170544   -0.27745415531382      H 
    8.55097745342557   -1.93297598513715   -1.05179829843611      H 
    5.71538859817991   -3.15988232042582   -2.39121527510166      H 
    6.08988150865533   -3.03264263720025    0.96644211719805      H 
    1.80407727430655   -2.96688046985480   -0.25279115058854      H 
   -1.56073112087803   -5.49385086408839    0.21101905509557      H 
   -7.29189222157921   -5.15918311491939    0.90921989628986      H 
   -5.35595072757584   -8.02903579200076    0.75562630712728      H 
$end
           -------------------------------------------------
          |                Final Singlepoint                |
           -------------------------------------------------

          ...................................................
          :                      SETUP                      :
          :.................................................:
          :  # basis functions                  83          :
          :  # atomic orbitals                  82          :
          :  # shells                           44          :
          :  # electrons                        90          :
          :  max. iterations                   250          :
          :  Hamiltonian                  GFN2-xTB          :
          :  restarted?                      false          :
          :  GBSA solvation                  false          :
          :  PC potential                    false          :
          :  electronic temp.          300.0000000     K    :
          :  accuracy                    1.0000000          :
          :  -> integral cutoff          0.2500000E+02      :
          :  -> integral neglect         0.1000000E-07      :
          :  -> SCF convergence          0.1000000E-05 Eh   :
          :  -> wf. convergence          0.1000000E-03 e    :
          :  Broyden damping             0.4000000          :
          ...................................................

 iter      E             dE          RMSdq      gap      omega  full diag
   1    -52.3609352 -0.523609E+02  0.264E-04    1.94       0.0  T
   2    -52.3609352  0.105530E-09  0.109E-04    1.94     179.5  T
   3    -52.3609352 -0.964704E-10  0.156E-04    1.94     125.7  T

   *** convergence criteria satisfied after 3 iterations ***

         #    Occupation            Energy/Eh            Energy/eV
      -------------------------------------------------------------
         1        2.0000           -0.8660382             -23.5661
       ...           ...                  ...                  ...
        39        2.0000           -0.4675379             -12.7224
        40        2.0000           -0.4529301             -12.3249
        41        2.0000           -0.4438485             -12.0777
        42        2.0000           -0.4418931             -12.0245
        43        2.0000           -0.4329168             -11.7803
        44        2.0000           -0.4065758             -11.0635
        45        2.0000           -0.3721780             -10.1275 (HOMO)
        46                         -0.3009938              -8.1905 (LUMO)
        47                         -0.2488069              -6.7704
        48                         -0.2151087              -5.8534
        49                         -0.2126547              -5.7866
        50                         -0.1799313              -4.8962
       ...                                ...                  ...
        82                          0.7168992              19.5078
      -------------------------------------------------------------
                  HL-Gap            0.0711842 Eh            1.9370 eV
             Fermi-level           -0.3365859 Eh           -9.1590 eV

 SCC (total)                   0 d,  0 h,  0 min,  0.036 sec
 SCC setup                      ...        0 min,  0.000 sec (  0.620%)
 Dispersion                     ...        0 min,  0.000 sec (  0.635%)
 integral evaluation            ...        0 min,  0.012 sec ( 34.195%)
 zeroth order Hamiltonian       ...        0 min,  0.000 sec (  0.562%)
 iterations                     ...        0 min,  0.005 sec ( 13.770%)
 molecular gradient             ...        0 min,  0.018 sec ( 49.029%)
 printout                       ...        0 min,  0.000 sec (  1.046%)

         :::::::::::::::::::::::::::::::::::::::::::::::::::::
         ::                     SUMMARY                     ::
         :::::::::::::::::::::::::::::::::::::::::::::::::::::
         :: total energy             -51.773626374237 Eh    ::
         :: gradient norm              0.000275338425 Eh/a0 ::
         :: HOMO-LUMO gap              1.937020920714 eV    ::
         ::.................................................::
         :: SCC energy               -52.360935248885 Eh    ::
         :: -> isotropic ES            0.057993410578 Eh    ::
         :: -> anisotropic ES          0.001043654134 Eh    ::
         :: -> anisotropic XC         -0.005803977420 Eh    ::
         :: -> dispersion             -0.028177434156 Eh    ::
         :: repulsion energy           0.587271053768 Eh    ::
         :: add. restraining           0.000000000000 Eh    ::
         :::::::::::::::::::::::::::::::::::::::::::::::::::::

           -------------------------------------------------
          |                Property Printout                |
           -------------------------------------------------

    * Orbital Energies and Occupations

         #    Occupation            Energy/Eh            Energy/eV
      -------------------------------------------------------------
         1        2.0000           -0.8660382             -23.5661
       ...           ...                  ...                  ...
        33        2.0000           -0.4928980             -13.4124
        34        2.0000           -0.4923205             -13.3967
        35        2.0000           -0.4893956             -13.3171
        36        2.0000           -0.4797400             -13.0544
        37        2.0000           -0.4702093             -12.7950
        38        2.0000           -0.4675960             -12.7239
        39        2.0000           -0.4675379             -12.7224
        40        2.0000           -0.4529301             -12.3249
        41        2.0000           -0.4438485             -12.0777
        42        2.0000           -0.4418931             -12.0245
        43        2.0000           -0.4329168             -11.7803
        44        2.0000           -0.4065758             -11.0635
        45        2.0000           -0.3721780             -10.1275 (HOMO)
        46                         -0.3009938              -8.1905 (LUMO)
        47                         -0.2488069              -6.7704
        48                         -0.2151087              -5.8534
        49                         -0.2126547              -5.7866
        50                         -0.1799313              -4.8962
        51                         -0.1342871              -3.6541
        52                         -0.1097872              -2.9875
        53                         -0.0177620              -0.4833
        54                          0.0140973               0.3836
        55                          0.0164431               0.4474
        56                          0.0262387               0.7140
       ...                                ...                  ...
        82                          0.7168992              19.5078
      -------------------------------------------------------------
                  HL-Gap            0.0711842 Eh            1.9370 eV
             Fermi-level           -0.3365859 Eh           -9.1590 eV

     #   Z        covCN         q      C6AA      α(0)
     1   6 C      2.925    -0.033    28.832     8.806
     2  16 S      2.328     0.033   139.702    19.893
     3   6 C      2.980     0.008    27.836     8.654
     4   6 C      3.164    -0.004    27.790     8.616
     5   6 C      3.177    -0.003    27.684     8.591
     6   6 C      2.910    -0.027    28.678     8.781
     7   6 C      2.972    -0.045    29.111     8.850
     8   6 C      3.336     0.491    17.215     6.571
     9   9 F      0.791    -0.213    11.365     3.982
    10   9 F      0.791    -0.204    11.274     3.966
    11   9 F      0.791    -0.204    11.275     3.967
    12   6 C      2.864     0.147    24.804     8.164
    13   8 O      1.706    -0.253    18.197     5.759
    14   6 C      3.646     0.034    20.330     6.480
    15   6 C      2.908    -0.075    29.869     8.961
    16   6 C      2.920    -0.031    28.763     8.795
    17   6 C      2.841    -0.090    30.248     9.013
    18   1 H      0.926     0.055     2.255     2.348
    19   1 H      0.926     0.065     2.144     2.290
    20   1 H      0.925     0.074     2.046     2.237
    21   1 H      0.924     0.046     2.366     2.405
    22   1 H      0.924     0.046     2.366     2.405
    23   1 H      0.926     0.047     2.363     2.404
    24   1 H      0.925     0.043     2.413     2.429
    25   1 H      0.926     0.048     2.348     2.396
    26   1 H      0.926     0.045     2.382     2.414

 Mol. C6AA /au·bohr⁶  :      10251.525869
 Mol. C8AA /au·bohr⁸  :     272317.133458
 Mol. α(0) /au        :        159.178635


Wiberg/Mayer (AO) data.
largest (>0.10) Wiberg bond orders for each atom
          total WBO             WBO to atom ...
     1  C   3.947        C    5 1.443    S    2 1.262    H   18 0.969    C    3 0.124
     2  S   2.717        C    1 1.262    C    3 1.163
     3  C   3.943        C    4 1.375    S    2 1.163    C   16 1.158    C    1 0.124
     4  C   3.988        C    3 1.375    C   15 1.245    C    5 1.163
     5  C   3.987        C    1 1.443    C    6 1.225    C    4 1.163
     6  C   3.983        C    7 1.588    C    5 1.225    H   19 0.963    C   15 0.103
     7  C   3.968        C    6 1.588    C   12 1.178    C    8 0.953
     8  C   3.826        C    7 0.953    F   10 0.947    F   11 0.946    F    9 0.944
     9  F   1.065        C    8 0.944
    10  F   1.073        C    8 0.947
    11  F   1.073        C    8 0.946
    12  C   3.923        C   15 1.501    C    7 1.178    O   13 1.084
    13  O   2.249        C   12 1.084    C   14 0.978
    14  C   3.938        O   13 0.978    H   20 0.978    H   22 0.976    H   21 0.976
    15  C   3.983        C   12 1.501    C    4 1.245    H   23 0.960    C    6 0.103
    16  C   3.991        C   17 1.841    C    3 1.158    H   24 0.955
    17  C   3.963        C   16 1.841    H   26 0.978    H   25 0.972
    18  H   0.996        C    1 0.969
    19  H   0.995        C    6 0.963
    20  H   0.994        C   14 0.978
    21  H   0.997        C   14 0.976
    22  H   0.997        C   14 0.976
    23  H   0.997        C   15 0.960
    24  H   0.998        C   16 0.955
    25  H   0.998        C   17 0.972
    26  H   0.997        C   17 0.978

molecular dipole:
                 x           y           z       tot (Debye)
 q only:       -1.158      -1.575       0.200
   full:       -0.922      -1.579       0.172       4.668
molecular quadrupole (traceless):
                xx          xy          yy          xz          yz          zz
 q only:        1.830     -16.886      -2.723       0.797       2.494       0.893
  q+dip:        0.096     -18.360       0.974       0.753       2.503      -1.070
   full:       -1.740     -19.115      -0.176       1.376       2.725       1.916

           -------------------------------------------------
          |                Geometry Summary                 |
           -------------------------------------------------

      molecular mass/u    :      258.2577000
   center of mass at/Å    :        0.3385996       0.7454257      -0.1391882
  moments of inertia/u·Å² :        0.6115320E+03   0.1986092E+04   0.2506296E+04
rotational constants/cm⁻¹ :        0.2756623E-01   0.8487842E-02   0.6726115E-02

 * 26 selected distances

     #   Z        #   Z                                     value/Å
     1   6 C      2  16 S                                 1.7006325
     2  16 S      3   6 C                                 1.7339780 (max)
     3   6 C      4   6 C                                 1.3927916
     1   6 C      5   6 C                                 1.3778960
     4   6 C      5   6 C                                 1.4365985
     5   6 C      6   6 C                                 1.4126979
     6   6 C      7   6 C                                 1.3617445
     8   6 C      9   9 F                                 1.3448687
     8   6 C     10   9 F                                 1.3433290
     8   6 C     11   9 F                                 1.3434888
     7   6 C     12   6 C                                 1.4345661
    12   6 C     13   8 O                                 1.3531738
    13   8 O     14   6 C                                 1.4070606
     4   6 C     15   6 C                                 1.4128798
    12   6 C     15   6 C                                 1.3687104
     3   6 C     16   6 C                                 1.4328291
    16   6 C     17   6 C                                 1.3323081
     1   6 C     18   1 H                                 1.0714026 (min)
     6   6 C     19   1 H                                 1.0787083
    14   6 C     20   1 H                                 1.0881418
    14   6 C     21   1 H                                 1.0944386
    14   6 C     22   1 H                                 1.0944548
    15   6 C     23   1 H                                 1.0768886
    16   6 C     24   1 H                                 1.0817485
    17   6 C     25   1 H                                 1.0772904
    17   6 C     26   1 H                                 1.0749946

 * 5 distinct bonds (by element types)

   Z      Z             #   av. dist./Å        max./Å        min./Å
   1 H    6 C           9     1.0820076     1.0944548     1.0714026
   6 C    6 C          10     1.3963022     1.4365985     1.3323081
   6 C    8 O           2     1.3801172     1.4070606     1.3531738
   6 C    9 F           3     1.3438955     1.3448687     1.3433290
   6 C   16 S           2     1.7173052     1.7339780     1.7006325


optimized geometry written to: xtbopt.xyz


           -------------------------------------------------
          | TOTAL ENERGY              -51.773626374237 Eh   |
          | GRADIENT NORM               0.000275338425 Eh/α |
          | HOMO-LUMO GAP               1.937020920714 eV   |
           -------------------------------------------------

------------------------------------------------------------------------
 * finished run on 2021/05/19 at 11:00:16.553     
------------------------------------------------------------------------
 total:
 * wall-time:     0 d,  0 h,  0 min,  0.962 sec
 *  cpu-time:     0 d,  0 h,  0 min,  0.959 sec
 * ratio c/w:     0.997 speedup
 SCF:
 * wall-time:     0 d,  0 h,  0 min,  0.052 sec
 *  cpu-time:     0 d,  0 h,  0 min,  0.052 sec
 * ratio c/w:     0.998 speedup
 ANC optimizer:
 * wall-time:     0 d,  0 h,  0 min,  0.885 sec
 *  cpu-time:     0 d,  0 h,  0 min,  0.883 sec
 * ratio c/w:     0.998 speedup

