      -----------------------------------------------------------      
     |                   =====================                   |     
     |                           x T B                           |     
     |                   =====================                   |     
     |                         S. Grimme                         |     
     |          Mulliken Center for Theoretical Chemistry        |     
     |                    University of Bonn                     |     
     |                Version 6.2 RC2 (SAW190805)                |     
      -----------------------------------------------------------      

   This program is distributed in the hope that it will be useful,
   but WITHOUT ANY WARRANTY; without even the implied warranty of
   MERCHANTABILITY or FITNESS FOR A PARTICULAR PURPOSE.
   
   FOR NON-COMMERCIAL, ACADEMIA USE ONLY.
   
   Cite this work as:
   * S. Grimme, C. Bannwarth, P. Shushkov, J. Chem. Theory Comput., 2017,
     13, 1989-2009. DOI: 10.1021/acs.jctc.7b00118
   * C. Bannwarth, S. Ehlert and S. Grimme., J. Chem. Theory Comput., 2019,
     15, 1652-1671. DOI: 10.1021/acs.jctc.8b01176
   * P. Pracht, E. Caldeweyher, S. Ehlert, S. Grimme, ChemRxiv, 2019, preprint.
     DOI: 10.26434/chemrxiv.8326202.v1
   
   for DFT-D4:
   * E. Caldeweyher, C. Bannwarth and S. Grimme, J. Chem. Phys., 2017,
     147, 034112. DOI: 10.1063/1.4993215
   * E. Caldeweyher, S. Ehlert, A. Hansen, H. Neugebauer, S. Spicher,
     C. Bannwarth and S. Grimme, J. Chem. Phys., 2019, 150, 154122.
     DOI: 10.1063/1.5090222
   
   for sTDA-xTB:
   * S. Grimme and C. Bannwarth, J. Chem. Phys., 2016, 145, 054103.
     DOI: 10.1063/1.4959605
   
   in the mass-spec context:
   * V. Asgeirsson, C. Bauer and S. Grimme, Chem. Sci., 2017, 8, 4879.
     DOI: 10.1039/c7sc00601b
   
   for metadynamics refer to:
   * S. Grimme, J. Chem. Theory Comput., 2019, 155, 2847-2862
     DOI: 10.1021/acs.jctc.9b00143
   
   with help from (in alphabetical order)
   C. Bannwarth, F. Bohle, G. Brandenburg, E. Caldeweyher, M. Checinski,
   S. Dohm, S. Ehlert, S. Ehrlich, F. März, H. Neugebauer, J. Pisarek,
   P. Pracht, P. Shushkov, and S. Spicher.
   
 * started run on 2021/05/19 at 11:00:16.574     

           -------------------------------------------------
          |                Calculation Setup                |
           -------------------------------------------------

          program call               : /ihome/ghutchison/geoffh/xtb/xtb 696.xyz -opt
          hostname                   : smp-n144
          coordinate file            : 696.xyz
          omp threads                :                     1
          number of atoms            :                    26
          number of electrons        :                    64
          charge                     :                     0
          spin                       :                   0.0
          first test random number   :      0.08195081910389


########################################################################
# WARNING! Please study the warnings concerning your input carefully
#  - the use of '-opt' is discouraged, please use '--opt' next time
########################################################################

           ------------------------------------------------- 
          |                 G F N 2 - x T B                 |
          | Geometry, Frequencies, Noncovalent interactions |
          |            JCTC 2019 parametrisation            |
           ------------------------------------------------- 
             KAB for C  - Si     :                1.0500
             KAB for H  - Pd     :                0.9500
             k(s)              :                1.8500
             k(p)              :                2.2300
             k(d)              :                2.2300
             k(f)              :                2.0000
             kEN (H0ij)        :               -2.0000
             D4 a1             :                0.5200
             D4 a2             :                5.0000
             D4 s6             :                1.0000
             D4 s8             :                2.7000
             D4 s9             :                5.0000
             alphaj            :                2.0000

  Z AO/shell   Hii/eV     exponent
  1     Wed Apr 25 08:07:45 CEST 2018   EN: 2.200 GM2: 0.406  GM3: 0.0800  RAES: 1.40
     1s    -10.707211    1.230000
  6     Wed Apr 25 08:07:45 CEST 2018   EN: 2.550 GM2: 0.538  GM3: 0.1500  RAES: 3.00
     2s    -13.970922    2.096432
     2p    -10.063292    1.800000
 16     Tue Apr 24 11:44:34 CEST 2018   EN: 2.580 GM2: 0.340  GM3:-0.0502  RAES: 3.10
     3s    -20.029654    1.981333
     3p    -11.377694    2.025643
     3d     -0.420282    1.702555

           ------------------------------------------------- 
          |        Self-Consistent Charge Iterations        |
           ------------------------------------------------- 

          ...................................................
          :                      SETUP                      :
          :.................................................:
          :  # basis functions                  68          :
          :  # atomic orbitals                  67          :
          :  # shells                           39          :
          :  # electrons                        64          :
          :  max. iterations                   250          :
          :  Hamiltonian                  GFN2-xTB          :
          :  restarted?                      false          :
          :  GBSA solvation                  false          :
          :  PC potential                    false          :
          :  electronic temp.          300.0000000     K    :
          :  accuracy                    1.0000000          :
          :  -> integral cutoff          0.2500000E+02      :
          :  -> integral neglect         0.1000000E-07      :
          :  -> SCF convergence          0.1000000E-05 Eh   :
          :  -> wf. convergence          0.1000000E-03 e    :
          :  Broyden damping             0.4000000          :
          ...................................................

 iter      E             dE          RMSdq      gap      omega  full diag
   1    -34.3872629 -0.343873E+02  0.351E+00    3.17       0.0  T
   2    -34.4267124 -0.394495E-01  0.197E+00    3.20       1.0  T
   3    -34.4258397  0.872676E-03  0.731E-01    3.18       1.0  T
   4    -34.4260812 -0.241514E-03  0.407E-01    3.19       1.0  T
   5    -34.4290639 -0.298264E-02  0.119E-01    3.18       1.0  T
   6    -34.4291397 -0.757929E-04  0.567E-02    3.18       1.0  T
   7    -34.4291920 -0.523407E-04  0.215E-02    3.18       1.0  T
   8    -34.4291964 -0.438576E-05  0.111E-02    3.18       1.8  T
   9    -34.4291970 -0.577625E-06  0.401E-03    3.18       4.9  T
  10    -34.4291971 -0.101723E-06  0.177E-03    3.18      11.1  T
  11    -34.4291971 -0.991961E-08  0.931E-04    3.18      21.1  T
  12    -34.4291971 -0.751820E-08  0.433E-04    3.18      45.3  T

   *** convergence criteria satisfied after 12 iterations ***

         #    Occupation            Energy/Eh            Energy/eV
      -------------------------------------------------------------
         1        2.0000           -0.7218322             -19.6421
       ...           ...                  ...                  ...
        26        2.0000           -0.4389055             -11.9432
        27        2.0000           -0.4311977             -11.7335
        28        2.0000           -0.4243141             -11.5462
        29        2.0000           -0.4158236             -11.3151
        30        2.0000           -0.4125769             -11.2268
        31        2.0000           -0.3770723             -10.2607
        32        2.0000           -0.3655021              -9.9458 (HOMO)
        33                         -0.2485924              -6.7645 (LUMO)
        34                         -0.2024334              -5.5085
        35                         -0.1872740              -5.0960
        36                         -0.1569780              -4.2716
        37                         -0.0996777              -2.7124
       ...                                ...                  ...
        67                          0.6733351              18.3224
      -------------------------------------------------------------
                  HL-Gap            0.1169097 Eh            3.1813 eV
             Fermi-level           -0.3070473 Eh           -8.3552 eV

 SCC (total)                   0 d,  0 h,  0 min,  0.038 sec
 SCC setup                      ...        0 min,  0.000 sec (  0.804%)
 Dispersion                     ...        0 min,  0.000 sec (  0.977%)
 integral evaluation            ...        0 min,  0.008 sec ( 22.146%)
 zeroth order Hamiltonian       ...        0 min,  0.000 sec (  0.471%)
 iterations                     ...        0 min,  0.014 sec ( 37.508%)
 molecular gradient             ...        0 min,  0.014 sec ( 36.925%)
 printout                       ...        0 min,  0.000 sec (  1.028%)

         :::::::::::::::::::::::::::::::::::::::::::::::::::::
         ::                     SUMMARY                     ::
         :::::::::::::::::::::::::::::::::::::::::::::::::::::
         :: total energy             -33.917344827358 Eh    ::
         :: gradient norm              0.056859552898 Eh/a0 ::
         :: HOMO-LUMO gap              3.181273870123 eV    ::
         ::.................................................::
         :: SCC energy               -34.429197088306 Eh    ::
         :: -> isotropic ES            0.003410040544 Eh    ::
         :: -> anisotropic ES          0.005650397459 Eh    ::
         :: -> anisotropic XC          0.019439987955 Eh    ::
         :: -> dispersion             -0.025682347065 Eh    ::
         :: repulsion energy           0.511587137788 Eh    ::
         :: add. restraining           0.000000000000 Eh    ::
         :::::::::::::::::::::::::::::::::::::::::::::::::::::

      ----------------------------------------------------------- 
     |                   =====================                   |
     |                        A N C O P T                        |
     |                   =====================                   |
     |               Approximate Normal Coordinate               |
     |                Rational Function Optimizer                |
      ----------------------------------------------------------- 

          ...................................................
          :                      SETUP                      :
          :.................................................:
          :   optimization level            normal          :
          :   max. optcycles                   200          :
          :   ANC micro-cycles                  20          :
          :   degrees of freedom                72          :
          :.................................................:
          :   RF solver                   davidson          :
          :   input Hessian                  false          :
          :   write xtbopt.log                true          :
          :   linear?                        false          :
          :   energy convergence         0.5000000E-05 Eh   :
          :   grad. convergence          0.1000000E-02 Eh/α :
          :   maximium RF displ.         2.0000000          :
          :   Hlow (freq-cutoff)         0.5000000E-02      :
          :   Hmax (freq-cutoff)         5.0000000          :
          :   S6 in model hess.         20.0000000          :
          ...................................................

generating ANC from model Hessian ...
Using Lindh-Hessian (1995)
 Shifting diagonal of input Hessian by   3.734374855620658E-003
 Lowest  eigenvalues of input Hessian
   -0.000000   -0.000000   -0.000000    0.000000    0.000000    0.000000
    0.005000    0.005975    0.007800    0.009326    0.010794    0.011823
    0.013141    0.015647    0.016773    0.022108    0.027678    0.029610
 Highest eigenvalues
    1.416332    1.544458    1.623668    1.775224    1.819007    1.969111
 

........................................................................
.............................. CYCLE    1 ..............................
........................................................................
   1    -34.4291971 -0.344292E+02  0.194E-04    3.18       0.0  T
   2    -34.4291971 -0.604530E-10  0.127E-04    3.18     154.2  T
   3    -34.4291971 -0.226805E-10  0.998E-05    3.18     196.4  T
     SCC iter.                  ...        0 min,  0.004 sec
     gradient                   ...        0 min,  0.014 sec
 * total energy  :   -33.9173449 Eh     change       -0.4620232E-07 Eh
   gradient norm :     0.0568596 Eh/α   predicted     0.0000000E+00 (-100.00%)
   displ. norm   :     0.2317952 α      lambda       -0.4878943E-02
   maximum displ.:     0.1147519 α      in ANC's #2, #7, #19, ...

........................................................................
.............................. CYCLE    2 ..............................
........................................................................
   1    -34.4504560 -0.344505E+02  0.189E-01    3.24       0.0  T
   2    -34.4504849 -0.289842E-04  0.103E-01    3.24       1.0  T
   3    -34.4504426  0.423661E-04  0.645E-02    3.24       1.0  T
   4    -34.4505359 -0.933688E-04  0.190E-02    3.24       1.0  T
   5    -34.4505376 -0.161571E-05  0.101E-02    3.24       1.9  T
   6    -34.4505387 -0.113729E-05  0.264E-03    3.24       7.4  T
   7    -34.4505388 -0.115856E-06  0.640E-04    3.24      30.6  T
     SCC iter.                  ...        0 min,  0.008 sec
     gradient                   ...        0 min,  0.013 sec
 * total energy  :   -33.9205606 Eh     change       -0.3215698E-02 Eh
   gradient norm :     0.0200554 Eh/α   predicted    -0.2570546E-02 ( -20.06%)
   displ. norm   :     0.2053755 α      lambda       -0.1112545E-02
   maximum displ.:     0.1142442 α      in ANC's #2, #7, #5, ...

........................................................................
.............................. CYCLE    3 ..............................
........................................................................
   1    -34.4576814 -0.344577E+02  0.131E-01    3.26       0.0  T
   2    -34.4576929 -0.115035E-04  0.704E-02    3.26       1.0  T
   3    -34.4576668  0.260655E-04  0.442E-02    3.26       1.0  T
   4    -34.4577086 -0.418447E-04  0.128E-02    3.26       1.5  T
   5    -34.4577094 -0.709631E-06  0.622E-03    3.26       3.2  T
   6    -34.4577098 -0.486367E-06  0.169E-03    3.26      11.6  T
   7    -34.4577099 -0.493027E-07  0.475E-04    3.26      41.3  T
     SCC iter.                  ...        0 min,  0.008 sec
     gradient                   ...        0 min,  0.013 sec
 * total energy  :   -33.9212371 Eh     change       -0.6764855E-03 Eh
   gradient norm :     0.0050000 Eh/α   predicted    -0.5797403E-03 ( -14.30%)
   displ. norm   :     0.1657760 α      lambda       -0.2713716E-03
   maximum displ.:     0.1136987 α      in ANC's #2, #7, #6, ...

........................................................................
.............................. CYCLE    4 ..............................
........................................................................
   1    -34.4570961 -0.344571E+02  0.857E-02    3.26       0.0  T
   2    -34.4570982 -0.205190E-05  0.478E-02    3.26       1.0  T
   3    -34.4570913  0.685882E-05  0.191E-02    3.26       1.0  T
   4    -34.4570991 -0.775058E-05  0.607E-03    3.26       3.2  T
   5    -34.4570994 -0.374792E-06  0.214E-03    3.26       9.2  T
   6    -34.4570995 -0.421722E-07  0.813E-04    3.26      24.1  T
     SCC iter.                  ...        0 min,  0.007 sec
     gradient                   ...        0 min,  0.013 sec
 * total energy  :   -33.9214422 Eh     change       -0.2051516E-03 Eh
   gradient norm :     0.0048185 Eh/α   predicted    -0.1394321E-03 ( -32.03%)
   displ. norm   :     0.2047155 α      lambda       -0.2265645E-03
   maximum displ.:     0.1400655 α      in ANC's #2, #6, #4, ...

........................................................................
.............................. CYCLE    5 ..............................
........................................................................
   1    -34.4550893 -0.344551E+02  0.111E-01    3.24       0.0  T
   2    -34.4550910 -0.168365E-05  0.633E-02    3.24       1.0  T
   3    -34.4550907  0.318032E-06  0.834E-03    3.24       2.4  T
   4    -34.4550910 -0.349849E-06  0.495E-03    3.24       4.0  T
   5    -34.4550913 -0.327588E-06  0.157E-03    3.24      12.5  T
   6    -34.4550914 -0.289353E-07  0.423E-04    3.24      46.3  T
     SCC iter.                  ...        0 min,  0.007 sec
     gradient                   ...        0 min,  0.013 sec
 * total energy  :   -33.9216075 Eh     change       -0.1653211E-03 Eh
   gradient norm :     0.0043419 Eh/α   predicted    -0.1180480E-03 ( -28.59%)
   displ. norm   :     0.1765235 α      lambda       -0.1365511E-03
   maximum displ.:     0.1240369 α      in ANC's #2, #6, #4, ...

........................................................................
.............................. CYCLE    6 ..............................
........................................................................
   1    -34.4541622 -0.344542E+02  0.975E-02    3.22       0.0  T
   2    -34.4541629 -0.734577E-06  0.566E-02    3.22       1.0  T
   3    -34.4541594  0.356454E-05  0.139E-02    3.22       1.4  T
   4    -34.4541634 -0.401904E-05  0.340E-03    3.22       5.8  T
   5    -34.4541634 -0.602764E-07  0.105E-03    3.22      18.6  T
   6    -34.4541634 -0.927893E-08  0.470E-04    3.22      41.7  T
     SCC iter.                  ...        0 min,  0.007 sec
     gradient                   ...        0 min,  0.013 sec
 * total energy  :   -33.9217101 Eh     change       -0.1025521E-03 Eh
   gradient norm :     0.0041474 Eh/α   predicted    -0.7040513E-04 ( -31.35%)
   displ. norm   :     0.1709699 α      lambda       -0.1196575E-03
   maximum displ.:     0.1218945 α      in ANC's #2, #4, #6, ...

........................................................................
.............................. CYCLE    7 ..............................
........................................................................
   1    -34.4544082 -0.344544E+02  0.101E-01    3.20       0.0  T
   2    -34.4544090 -0.854630E-06  0.590E-02    3.20       1.0  T
   3    -34.4544014  0.759509E-05  0.198E-02    3.20       1.0  T
   4    -34.4544099 -0.849256E-05  0.314E-03    3.20       6.2  T
   5    -34.4544099 -0.247307E-07  0.973E-04    3.20      20.2  T
   6    -34.4544100 -0.734661E-08  0.519E-04    3.20      37.8  T
     SCC iter.                  ...        0 min,  0.007 sec
     gradient                   ...        0 min,  0.013 sec
 * total energy  :   -33.9217995 Eh     change       -0.8937141E-04 Eh
   gradient norm :     0.0039988 Eh/α   predicted    -0.6157881E-04 ( -31.10%)
   displ. norm   :     0.2001280 α      lambda       -0.1313393E-03
   maximum displ.:     0.1449340 α      in ANC's #2, #4, #6, ...

........................................................................
.............................. CYCLE    8 ..............................
........................................................................
   1    -34.4552226 -0.344552E+02  0.115E-01    3.18       0.0  T
   2    -34.4552239 -0.126076E-05  0.669E-02    3.18       1.0  T
   3    -34.4552142  0.971105E-05  0.229E-02    3.18       1.0  T
   4    -34.4552250 -0.108673E-04  0.331E-03    3.18       5.9  T
   5    -34.4552251 -0.462402E-07  0.103E-03    3.18      19.0  T
   6    -34.4552251 -0.250739E-08  0.548E-04    3.18      35.8  T
   7    -34.4552251 -0.164091E-08  0.288E-04    3.18      68.2  T
     SCC iter.                  ...        0 min,  0.008 sec
     gradient                   ...        0 min,  0.014 sec
 * total energy  :   -33.9218916 Eh     change       -0.9214944E-04 Eh
   gradient norm :     0.0043071 Eh/α   predicted    -0.6830074E-04 ( -25.88%)
   displ. norm   :     0.2210573 α      lambda       -0.1277470E-03
   maximum displ.:     0.1609580 α      in ANC's #2, #4, #1, ...

........................................................................
.............................. CYCLE    9 ..............................
........................................................................
   1    -34.4560405 -0.344560E+02  0.132E-01    3.16       0.0  T
   2    -34.4560427 -0.222143E-05  0.760E-02    3.16       1.0  T
   3    -34.4560329  0.977540E-05  0.248E-02    3.16       1.0  T
   4    -34.4560441 -0.111475E-04  0.543E-03    3.16       3.6  T
   5    -34.4560442 -0.989092E-07  0.136E-03    3.16      14.4  T
   6    -34.4560442 -0.142177E-07  0.594E-04    3.16      33.0  T
     SCC iter.                  ...        0 min,  0.007 sec
     gradient                   ...        0 min,  0.013 sec
 * total energy  :   -33.9219843 Eh     change       -0.9274576E-04 Eh
   gradient norm :     0.0042001 Eh/α   predicted    -0.6699512E-04 ( -27.76%)
   displ. norm   :     0.2404585 α      lambda       -0.1195788E-03
   maximum displ.:     0.1723163 α      in ANC's #2, #4, #1, ...

........................................................................
.............................. CYCLE   10 ..............................
........................................................................
   1    -34.4563902 -0.344564E+02  0.140E-01    3.14       0.0  T
   2    -34.4563925 -0.230304E-05  0.802E-02    3.14       1.0  T
   3    -34.4563868  0.572309E-05  0.199E-02    3.14       1.0  T
   4    -34.4563934 -0.661779E-05  0.612E-03    3.14       3.2  T
   5    -34.4563936 -0.189847E-06  0.152E-03    3.14      12.9  T
   6    -34.4563936 -0.301312E-07  0.649E-04    3.14      30.2  T
     SCC iter.                  ...        0 min,  0.007 sec
     gradient                   ...        0 min,  0.013 sec
 * total energy  :   -33.9220711 Eh     change       -0.8674652E-04 Eh
   gradient norm :     0.0039698 Eh/α   predicted    -0.6325366E-04 ( -27.08%)
   displ. norm   :     0.2308948 α      lambda       -0.9531012E-04
   maximum displ.:     0.1619605 α      in ANC's #2, #4, #1, ...

........................................................................
.............................. CYCLE   11 ..............................
........................................................................
   1    -34.4565119 -0.344565E+02  0.134E-01    3.13       0.0  T
   2    -34.4565142 -0.226181E-05  0.760E-02    3.13       1.0  T
   3    -34.4565084  0.576771E-05  0.195E-02    3.13       1.0  T
   4    -34.4565152 -0.678745E-05  0.631E-03    3.13       3.1  T
   5    -34.4565153 -0.123819E-06  0.193E-03    3.13      10.1  T
   6    -34.4565154 -0.809227E-07  0.488E-04    3.13      40.2  T
   7    -34.4565154 -0.262249E-08  0.272E-04    3.13      72.0  T
     SCC iter.                  ...        0 min,  0.008 sec
     gradient                   ...        0 min,  0.014 sec
 * total energy  :   -33.9221352 Eh     change       -0.6413060E-04 Eh
   gradient norm :     0.0033558 Eh/α   predicted    -0.5019622E-04 ( -21.73%)
   displ. norm   :     0.2431349 α      lambda       -0.6509735E-04
   maximum displ.:     0.1698124 α      in ANC's #2, #4, #1, ...

........................................................................
.............................. CYCLE   12 ..............................
........................................................................
   1    -34.4545461 -0.344545E+02  0.142E-01    3.11       0.0  T
   2    -34.4545483 -0.220688E-05  0.811E-02    3.11       1.0  T
   3    -34.4545450  0.331145E-05  0.150E-02    3.11       1.3  T
   4    -34.4545489 -0.390917E-05  0.638E-03    3.11       3.1  T
   5    -34.4545492 -0.328119E-06  0.161E-03    3.11      12.2  T
   6    -34.4545493 -0.471633E-07  0.540E-04    3.11      36.3  T
   7    -34.4545493 -0.454916E-08  0.269E-04    3.11      72.9  T
     SCC iter.                  ...        0 min,  0.008 sec
     gradient                   ...        0 min,  0.014 sec
 * total energy  :   -33.9221634 Eh     change       -0.2821581E-04 Eh
   gradient norm :     0.0049645 Eh/α   predicted    -0.3447496E-04 (  22.18%)
   displ. norm   :     0.1560030 α      lambda       -0.1137339E-03
   maximum displ.:     0.0796965 α      in ANC's #2, #6, #1, ...

........................................................................
.............................. CYCLE   13 ..............................
........................................................................
   1    -34.4568722 -0.344569E+02  0.916E-02    3.12       0.0  T
   2    -34.4568735 -0.125857E-05  0.520E-02    3.12       1.0  T
   3    -34.4568700  0.350525E-05  0.137E-02    3.12       1.4  T
   4    -34.4568740 -0.402150E-05  0.488E-03    3.12       4.0  T
   5    -34.4568742 -0.157262E-06  0.136E-03    3.12      14.5  T
   6    -34.4568742 -0.334736E-07  0.467E-04    3.12      42.0  T
     SCC iter.                  ...        0 min,  0.007 sec
     gradient                   ...        0 min,  0.013 sec
 * total energy  :   -33.9221971 Eh     change       -0.3370295E-04 Eh
   gradient norm :     0.0047430 Eh/α   predicted    -0.5825162E-04 (  72.84%)
   displ. norm   :     0.1398016 α      lambda       -0.8816584E-04
   maximum displ.:     0.0898177 α      in ANC's #2, #4, #1, ...

........................................................................
.............................. CYCLE   14 ..............................
........................................................................
   1    -34.4560980 -0.344561E+02  0.742E-02    3.11       0.0  T
   2    -34.4560987 -0.704188E-06  0.429E-02    3.11       1.0  T
   3    -34.4560948  0.390539E-05  0.152E-02    3.11       1.3  T
   4    -34.4560992 -0.446232E-05  0.252E-03    3.11       7.8  T
   5    -34.4560993 -0.179922E-07  0.109E-03    3.11      17.9  T
   6    -34.4560993 -0.612664E-08  0.463E-04    3.11      42.4  T
     SCC iter.                  ...        0 min,  0.007 sec
     gradient                   ...        0 min,  0.013 sec
 * total energy  :   -33.9222564 Eh     change       -0.5928177E-04 Eh
   gradient norm :     0.0033149 Eh/α   predicted    -0.4494485E-04 ( -24.18%)
   displ. norm   :     0.2046145 α      lambda       -0.7945941E-04
   maximum displ.:     0.1187314 α      in ANC's #2, #1, #4, ...

........................................................................
.............................. CYCLE   15 ..............................
........................................................................
   1    -34.4545607 -0.344546E+02  0.113E-01    3.09       0.0  T
   2    -34.4545618 -0.114635E-05  0.657E-02    3.09       1.0  T
   3    -34.4545529  0.887232E-05  0.226E-02    3.09       1.0  T
   4    -34.4545629 -0.999283E-05  0.342E-03    3.09       5.7  T
   5    -34.4545630 -0.268718E-07  0.141E-03    3.09      13.9  T
   6    -34.4545630 -0.167345E-07  0.513E-04    3.09      38.2  T
   7    -34.4545630 -0.372346E-08  0.298E-04    3.09      65.8  T
     SCC iter.                  ...        0 min,  0.008 sec
     gradient                   ...        0 min,  0.014 sec
 * total energy  :   -33.9223049 Eh     change       -0.4850607E-04 Eh
   gradient norm :     0.0047045 Eh/α   predicted    -0.4139592E-04 ( -14.66%)
   displ. norm   :     0.1639286 α      lambda       -0.1197382E-03
   maximum displ.:     0.0831171 α      in ANC's #6, #1, #5, ...

........................................................................
.............................. CYCLE   16 ..............................
........................................................................
   1    -34.4565329 -0.344565E+02  0.749E-02    3.10       0.0  T
   2    -34.4565337 -0.798207E-06  0.434E-02    3.10       1.0  T
   3    -34.4565271  0.663551E-05  0.193E-02    3.10       1.0  T
   4    -34.4565346 -0.756609E-05  0.301E-03    3.10       6.5  T
   5    -34.4565347 -0.210252E-07  0.103E-03    3.10      19.1  T
   6    -34.4565347 -0.689317E-08  0.395E-04    3.10      49.6  T
     SCC iter.                  ...        0 min,  0.007 sec
     gradient                   ...        0 min,  0.013 sec
 * total energy  :   -33.9223528 Eh     change       -0.4781949E-04 Eh
   gradient norm :     0.0057889 Eh/α   predicted    -0.6148176E-04 (  28.57%)
   displ. norm   :     0.1493836 α      lambda       -0.8087964E-04
   maximum displ.:     0.0922303 α      in ANC's #1, #2, #6, ...

........................................................................
.............................. CYCLE   17 ..............................
........................................................................
   1    -34.4553655 -0.344554E+02  0.820E-02    3.08       0.0  T
   2    -34.4553664 -0.912990E-06  0.473E-02    3.08       1.0  T
   3    -34.4553637  0.271635E-05  0.126E-02    3.08       1.6  T
   4    -34.4553668 -0.307933E-05  0.340E-03    3.08       5.8  T
   5    -34.4553668 -0.569823E-07  0.104E-03    3.08      18.8  T
   6    -34.4553668 -0.119781E-07  0.438E-04    3.08      44.8  T
     SCC iter.                  ...        0 min,  0.007 sec
     gradient                   ...        0 min,  0.013 sec
 * total energy  :   -33.9224141 Eh     change       -0.6135564E-04 Eh
   gradient norm :     0.0050783 Eh/α   predicted    -0.4134398E-04 ( -32.62%)
   displ. norm   :     0.2353833 α      lambda       -0.1198674E-03
   maximum displ.:     0.1563046 α      in ANC's #1, #6, #3, ...

........................................................................
.............................. CYCLE   18 ..............................
........................................................................
   1    -34.4541750 -0.344542E+02  0.116E-01    3.06       0.0  T
   2    -34.4541766 -0.157415E-05  0.675E-02    3.06       1.0  T
   3    -34.4541697  0.694036E-05  0.189E-02    3.06       1.0  T
   4    -34.4541775 -0.779053E-05  0.435E-03    3.06       4.5  T
   5    -34.4541776 -0.960481E-07  0.137E-03    3.06      14.3  T
   6    -34.4541776 -0.180958E-07  0.629E-04    3.06      31.2  T
     SCC iter.                  ...        0 min,  0.007 sec
     gradient                   ...        0 min,  0.013 sec
 * total energy  :   -33.9224967 Eh     change       -0.8256767E-04 Eh
   gradient norm :     0.0054078 Eh/α   predicted    -0.6325498E-04 ( -23.39%)
   displ. norm   :     0.2503944 α      lambda       -0.1186495E-03
   maximum displ.:     0.1766244 α      in ANC's #1, #3, #6, ...

........................................................................
.............................. CYCLE   19 ..............................
........................................................................
   1    -34.4541811 -0.344542E+02  0.113E-01    3.04       0.0  T
   2    -34.4541831 -0.202513E-05  0.667E-02    3.04       1.0  T
   3    -34.4541696  0.134854E-04  0.273E-02    3.04       1.0  T
   4    -34.4541846 -0.149704E-04  0.315E-03    3.04       6.2  T
   5    -34.4541847 -0.661343E-07  0.116E-03    3.04      16.9  T
   6    -34.4541847  0.118329E-08  0.617E-04    3.04      31.8  T
     SCC iter.                  ...        0 min,  0.007 sec
     gradient                   ...        0 min,  0.013 sec
 * total energy  :   -33.9225816 Eh     change       -0.8492403E-04 Eh
   gradient norm :     0.0083688 Eh/α   predicted    -0.6304481E-04 ( -25.76%)
   displ. norm   :     0.5971348 α      lambda       -0.2754557E-03
   maximum displ.:     0.4068941 α      in ANC's #1, #3, #4, ...

........................................................................
.............................. CYCLE   20 ..............................
........................................................................
   1    -34.4481452 -0.344481E+02  0.260E-01    3.00       0.0  T
   2    -34.4481496 -0.437460E-05  0.153E-01    3.00       1.0  T
   3    -34.4481205  0.290338E-04  0.389E-02    3.00       1.0  T
   4    -34.4481531 -0.325146E-04  0.568E-03    3.00       3.5  T
   5    -34.4481532 -0.171166E-06  0.210E-03    3.00       9.4  T
   6    -34.4481532 -0.282649E-07  0.100E-03    3.00      19.5  T
     SCC iter.                  ...        0 min,  0.007 sec
     gradient                   ...        0 min,  0.013 sec
 * total energy  :   -33.9226559 Eh     change       -0.7428728E-04 Eh
   gradient norm :     0.0146021 Eh/α   predicted    -0.1868417E-03 ( 151.51%)
   displ. norm   :     0.3458258 α      lambda       -0.7545585E-03
   maximum displ.:     0.2209745 α      in ANC's #2, #5, #3, ...
 * RMSD in coord.:     0.6162905 α      energy gain  -0.5311059E-02 Eh

generating ANC from model Hessian ...
Using Lindh-Hessian (1995)
 Shifting diagonal of input Hessian by   3.877304973663270E-003
 Lowest  eigenvalues of input Hessian
   -0.000000   -0.000000    0.000000    0.000000    0.000000    0.000000
    0.005000    0.006348    0.007897    0.008364    0.011467    0.012679
    0.014282    0.016499    0.017818    0.023887    0.027595    0.031566
 Highest eigenvalues
    1.436782    1.512410    1.687672    1.825816    1.879801    2.049187
 

........................................................................
.............................. CYCLE   21 ..............................
........................................................................
   1    -34.4583842 -0.344584E+02  0.164E-01    3.04       0.0  T
   2    -34.4583950 -0.108244E-04  0.914E-02    3.04       1.0  T
   3    -34.4583831  0.119917E-04  0.292E-02    3.04       1.0  T
   4    -34.4583970 -0.139217E-04  0.112E-02    3.04       1.8  T
   5    -34.4583983 -0.128847E-05  0.408E-03    3.04       4.8  T
   6    -34.4583984 -0.940457E-07  0.132E-03    3.04      14.8  T
   7    -34.4583984 -0.346123E-07  0.483E-04    3.04      40.6  T
   8    -34.4583984 -0.193592E-08  0.214E-04    3.04      91.6  T
     SCC iter.                  ...        0 min,  0.009 sec
     gradient                   ...        0 min,  0.014 sec
 * total energy  :   -33.9226546 Eh     change        0.1323476E-05 Eh
   gradient norm :     0.0249198 Eh/α   predicted     0.0000000E+00 (-100.00%)
   displ. norm   :     0.1396417 α      lambda       -0.8680255E-03
   maximum displ.:     0.0864919 α      in ANC's #1, #6, #4, ...

........................................................................
.............................. CYCLE   22 ..............................
........................................................................
   1    -34.4568605 -0.344569E+02  0.965E-02    3.03       0.0  T
   2    -34.4568658 -0.530945E-05  0.543E-02    3.03       1.0  T
   3    -34.4568548  0.110366E-04  0.290E-02    3.03       1.0  T
   4    -34.4568683 -0.135280E-04  0.646E-03    3.03       3.0  T
   5    -34.4568686 -0.294896E-06  0.264E-03    3.03       7.4  T
   6    -34.4568686 -0.252416E-07  0.644E-04    3.03      30.5  T
     SCC iter.                  ...        0 min,  0.007 sec
     gradient                   ...        0 min,  0.013 sec
 * total energy  :   -33.9232301 Eh     change       -0.5755230E-03 Eh
   gradient norm :     0.0070421 Eh/α   predicted    -0.4424815E-03 ( -23.12%)
   displ. norm   :     0.1550482 α      lambda       -0.2872944E-03
   maximum displ.:     0.0830275 α      in ANC's #6, #1, #4, ...

........................................................................
.............................. CYCLE   23 ..............................
........................................................................
   1    -34.4562681 -0.344563E+02  0.866E-02    3.02       0.0  T
   2    -34.4562704 -0.236979E-05  0.494E-02    3.02       1.0  T
   3    -34.4562647  0.568012E-05  0.195E-02    3.02       1.0  T
   4    -34.4562713 -0.651174E-05  0.502E-03    3.02       3.9  T
   5    -34.4562715 -0.242912E-06  0.178E-03    3.02      11.0  T
   6    -34.4562715 -0.147132E-07  0.474E-04    3.02      41.4  T
     SCC iter.                  ...        0 min,  0.007 sec
     gradient                   ...        0 min,  0.013 sec
 * total energy  :   -33.9234314 Eh     change       -0.2013404E-03 Eh
   gradient norm :     0.0049737 Eh/α   predicted    -0.1471044E-03 ( -26.94%)
   displ. norm   :     0.2340679 α      lambda       -0.2528807E-03
   maximum displ.:     0.1178277 α      in ANC's #1, #6, #4, ...

........................................................................
.............................. CYCLE   24 ..............................
........................................................................
   1    -34.4552010 -0.344552E+02  0.118E-01    3.02       0.0  T
   2    -34.4552033 -0.233308E-05  0.678E-02    3.02       1.0  T
   3    -34.4552000  0.326960E-05  0.150E-02    3.02       1.3  T
   4    -34.4552036 -0.358610E-05  0.615E-03    3.02       3.2  T
   5    -34.4552041 -0.449814E-06  0.188E-03    3.02      10.4  T
   6    -34.4552041 -0.206910E-07  0.563E-04    3.02      34.9  T
     SCC iter.                  ...        0 min,  0.007 sec
     gradient                   ...        0 min,  0.013 sec
 * total energy  :   -33.9236141 Eh     change       -0.1826555E-03 Eh
   gradient norm :     0.0099746 Eh/α   predicted    -0.1333678E-03 ( -26.98%)
   displ. norm   :     0.2769568 α      lambda       -0.2758936E-03
   maximum displ.:     0.1489449 α      in ANC's #1, #4, #6, ...

........................................................................
.............................. CYCLE   25 ..............................
........................................................................
   1    -34.4541200 -0.344541E+02  0.135E-01    3.01       0.0  T
   2    -34.4541218 -0.179614E-05  0.785E-02    3.01       1.0  T
   3    -34.4541208  0.102226E-05  0.874E-03    3.01       2.2  T
   4    -34.4541221 -0.123298E-05  0.467E-03    3.01       4.2  T
   5    -34.4541224 -0.333419E-06  0.138E-03    3.01      14.3  T
   6    -34.4541224 -0.129358E-07  0.457E-04    3.01      42.9  T
     SCC iter.                  ...        0 min,  0.007 sec
     gradient                   ...        0 min,  0.013 sec
 * total energy  :   -33.9238252 Eh     change       -0.2111680E-03 Eh
   gradient norm :     0.0120865 Eh/α   predicted    -0.1485285E-03 ( -29.66%)
   displ. norm   :     0.3200285 α      lambda       -0.3893156E-03
   maximum displ.:     0.1928550 α      in ANC's #1, #4, #3, ...

........................................................................
.............................. CYCLE   26 ..............................
........................................................................
   1    -34.4544283 -0.344544E+02  0.153E-01    3.02       0.0  T
   2    -34.4544300 -0.163966E-05  0.895E-02    3.02       1.0  T
   3    -34.4544268  0.319775E-05  0.130E-02    3.02       1.5  T
   4    -34.4544306 -0.384548E-05  0.371E-03    3.02       5.3  T
   5    -34.4544307 -0.129103E-06  0.137E-03    3.02      14.4  T
   6    -34.4544308 -0.116052E-07  0.543E-04    3.02      36.1  T
     SCC iter.                  ...        0 min,  0.007 sec
     gradient                   ...        0 min,  0.013 sec
 * total energy  :   -33.9241117 Eh     change       -0.2864751E-03 Eh
   gradient norm :     0.0097716 Eh/α   predicted    -0.2146048E-03 ( -25.09%)
   displ. norm   :     0.2654563 α      lambda       -0.3948968E-03
   maximum displ.:     0.1889518 α      in ANC's #1, #3, #6, ...

........................................................................
.............................. CYCLE   27 ..............................
........................................................................
   1    -34.4573795 -0.344574E+02  0.133E-01    3.02       0.0  T
   2    -34.4573811 -0.163371E-05  0.780E-02    3.02       1.0  T
   3    -34.4573735  0.759489E-05  0.190E-02    3.02       1.0  T
   4    -34.4573821 -0.852708E-05  0.316E-03    3.02       6.2  T
   5    -34.4573821 -0.580288E-07  0.144E-03    3.02      13.6  T
   6    -34.4573821 -0.589969E-08  0.717E-04    3.02      27.4  T
     SCC iter.                  ...        0 min,  0.007 sec
     gradient                   ...        0 min,  0.013 sec
 * total energy  :   -33.9243563 Eh     change       -0.2445712E-03 Eh
   gradient norm :     0.0052413 Eh/α   predicted    -0.2113659E-03 ( -13.58%)
   displ. norm   :     0.3855978 α      lambda       -0.2529776E-03
   maximum displ.:     0.2514590 α      in ANC's #1, #4, #3, ...

........................................................................
.............................. CYCLE   28 ..............................
........................................................................
   1    -34.4542738 -0.344543E+02  0.192E-01    3.02       0.0  T
   2    -34.4542761 -0.230599E-05  0.112E-01    3.02       1.0  T
   3    -34.4542715  0.459378E-05  0.175E-02    3.02       1.1  T
   4    -34.4542771 -0.564122E-05  0.501E-03    3.02       3.9  T
   5    -34.4542773 -0.133382E-06  0.177E-03    3.02      11.1  T
   6    -34.4542773 -0.332067E-07  0.669E-04    3.02      29.3  T
     SCC iter.                  ...        0 min,  0.007 sec
     gradient                   ...        0 min,  0.013 sec
 * total energy  :   -33.9244434 Eh     change       -0.8710994E-04 Eh
   gradient norm :     0.0085597 Eh/α   predicted    -0.1452961E-03 (  66.80%)
   displ. norm   :     0.0645206 α      lambda       -0.2028620E-03
   maximum displ.:     0.0304306 α      in ANC's #5, #4, #6, ...

........................................................................
.............................. CYCLE   29 ..............................
........................................................................
   1    -34.4589121 -0.344589E+02  0.361E-02    3.03       0.0  T
   2    -34.4589131 -0.100306E-05  0.200E-02    3.03       1.0  T
   3    -34.4589121  0.979840E-06  0.900E-03    3.03       2.2  T
   4    -34.4589133 -0.118378E-05  0.308E-03    3.03       6.4  T
   5    -34.4589134 -0.145429E-06  0.875E-04    3.03      22.4  T
   6    -34.4589134 -0.126116E-08  0.415E-04    3.03      47.2  T
     SCC iter.                  ...        0 min,  0.007 sec
     gradient                   ...        0 min,  0.013 sec
 * total energy  :   -33.9245439 Eh     change       -0.1005034E-03 Eh
   gradient norm :     0.0053196 Eh/α   predicted    -0.1018545E-03 (   1.34%)
   displ. norm   :     0.1278974 α      lambda       -0.1077929E-03
   maximum displ.:     0.0911494 α      in ANC's #1, #2, #4, ...

........................................................................
.............................. CYCLE   30 ..............................
........................................................................
   1    -34.4590800 -0.344591E+02  0.759E-02    3.03       0.0  T
   2    -34.4590810 -0.100288E-05  0.437E-02    3.03       1.0  T
   3    -34.4590788  0.214008E-05  0.114E-02    3.03       1.7  T
   4    -34.4590813 -0.244344E-05  0.336E-03    3.03       5.8  T
   5    -34.4590814 -0.978348E-07  0.110E-03    3.03      17.8  T
   6    -34.4590814 -0.609692E-08  0.511E-04    3.03      38.4  T
     SCC iter.                  ...        0 min,  0.007 sec
     gradient                   ...        0 min,  0.013 sec
 * total energy  :   -33.9246007 Eh     change       -0.5676606E-04 Eh
   gradient norm :     0.0039835 Eh/α   predicted    -0.5478010E-04 (  -3.50%)
   displ. norm   :     0.1723328 α      lambda       -0.8368932E-04
   maximum displ.:     0.1171554 α      in ANC's #1, #2, #4, ...

........................................................................
.............................. CYCLE   31 ..............................
........................................................................
   1    -34.4586429 -0.344586E+02  0.929E-02    3.03       0.0  T
   2    -34.4586440 -0.108826E-05  0.532E-02    3.03       1.0  T
   3    -34.4586398  0.423336E-05  0.151E-02    3.03       1.3  T
   4    -34.4586446 -0.483423E-05  0.400E-03    3.03       4.9  T
   5    -34.4586447 -0.851259E-07  0.170E-03    3.03      11.5  T
   6    -34.4586447 -0.395889E-07  0.481E-04    3.03      40.8  T
   7    -34.4586447 -0.496883E-08  0.135E-04    3.03     145.2  T
     SCC iter.                  ...        0 min,  0.008 sec
     gradient                   ...        0 min,  0.014 sec
 * total energy  :   -33.9246577 Eh     change       -0.5698937E-04 Eh
   gradient norm :     0.0043510 Eh/α   predicted    -0.4308771E-04 ( -24.39%)
   displ. norm   :     0.1497191 α      lambda       -0.7813696E-04
   maximum displ.:     0.0992768 α      in ANC's #2, #1, #4, ...

........................................................................
.............................. CYCLE   32 ..............................
........................................................................
   1    -34.4580847 -0.344581E+02  0.872E-02    3.04       0.0  T
   2    -34.4580857 -0.108735E-05  0.487E-02    3.04       1.0  T
   3    -34.4580837  0.200516E-05  0.118E-02    3.04       1.7  T
   4    -34.4580861 -0.232717E-05  0.486E-03    3.04       4.0  T
   5    -34.4580862 -0.164040E-06  0.117E-03    3.04      16.7  T
   6    -34.4580863 -0.278685E-07  0.275E-04    3.04      71.4  T
     SCC iter.                  ...        0 min,  0.007 sec
     gradient                   ...        0 min,  0.013 sec
 * total energy  :   -33.9247167 Eh     change       -0.5902131E-04 Eh
   gradient norm :     0.0041071 Eh/α   predicted    -0.3994474E-04 ( -32.32%)
   displ. norm   :     0.2295777 α      lambda       -0.1171295E-03
   maximum displ.:     0.1696248 α      in ANC's #2, #6, #1, ...

........................................................................
.............................. CYCLE   33 ..............................
........................................................................
   1    -34.4576741 -0.344577E+02  0.137E-01    3.04       0.0  T
   2    -34.4576770 -0.296283E-05  0.755E-02    3.04       1.0  T
   3    -34.4576762  0.831471E-06  0.135E-02    3.04       1.5  T
   4    -34.4576769 -0.689673E-06  0.856E-03    3.04       2.3  T
   5    -34.4576779 -0.102334E-05  0.992E-04    3.04      19.8  T
   6    -34.4576779 -0.188969E-07  0.371E-04    3.04      52.8  T
     SCC iter.                  ...        0 min,  0.007 sec
     gradient                   ...        0 min,  0.013 sec
 * total energy  :   -33.9248030 Eh     change       -0.8628568E-04 Eh
   gradient norm :     0.0040709 Eh/α   predicted    -0.6165534E-04 ( -28.55%)
   displ. norm   :     0.3121470 α      lambda       -0.1252444E-03
   maximum displ.:     0.2464377 α      in ANC's #2, #6, #1, ...

........................................................................
.............................. CYCLE   34 ..............................
........................................................................
   1    -34.4557560 -0.344558E+02  0.182E-01    3.04       0.0  T
   2    -34.4557613 -0.525550E-05  0.101E-01    3.04       1.0  T
   3    -34.4557576  0.369477E-05  0.199E-02    3.04       1.0  T
   4    -34.4557619 -0.429149E-05  0.103E-02    3.04       1.9  T
   5    -34.4557629 -0.106869E-05  0.213E-03    3.04       9.2  T
   6    -34.4557630 -0.730485E-07  0.866E-04    3.04      22.6  T
     SCC iter.                  ...        0 min,  0.007 sec
     gradient                   ...        0 min,  0.013 sec
 * total energy  :   -33.9248758 Eh     change       -0.7281485E-04 Eh
   gradient norm :     0.0054244 Eh/α   predicted    -0.6872597E-04 (  -5.62%)
   displ. norm   :     0.1965992 α      lambda       -0.1177621E-03
   maximum displ.:     0.1286139 α      in ANC's #2, #6, #5, ...

........................................................................
.............................. CYCLE   35 ..............................
........................................................................
   1    -34.4574165 -0.344574E+02  0.968E-02    3.04       0.0  T
   2    -34.4574186 -0.207794E-05  0.542E-02    3.04       1.0  T
   3    -34.4574128  0.571906E-05  0.175E-02    3.04       1.1  T
   4    -34.4574196 -0.679112E-05  0.546E-03    3.04       3.6  T
   5    -34.4574197 -0.114220E-06  0.186E-03    3.04      10.5  T
   6    -34.4574198 -0.494550E-07  0.682E-04    3.04      28.8  T
     SCC iter.                  ...        0 min,  0.007 sec
     gradient                   ...        0 min,  0.013 sec
 * total energy  :   -33.9249142 Eh     change       -0.3842948E-04 Eh
   gradient norm :     0.0052559 Eh/α   predicted    -0.6115760E-04 (  59.14%)
   displ. norm   :     0.0978285 α      lambda       -0.8317452E-04
   maximum displ.:     0.0677267 α      in ANC's #2, #1, #4, ...

........................................................................
.............................. CYCLE   36 ..............................
........................................................................
   1    -34.4579014 -0.344579E+02  0.581E-02    3.04       0.0  T
   2    -34.4579019 -0.478959E-06  0.339E-02    3.04       1.0  T
   3    -34.4579006  0.125480E-05  0.862E-03    3.04       2.3  T
   4    -34.4579020 -0.139974E-05  0.165E-03    3.04      11.9  T
   5    -34.4579020 -0.281874E-07  0.626E-04    3.04      31.3  T
     SCC iter.                  ...        0 min,  0.006 sec
     gradient                   ...        0 min,  0.013 sec
 * total energy  :   -33.9249620 Eh     change       -0.4781006E-04 Eh
   gradient norm :     0.0031179 Eh/α   predicted    -0.4198782E-04 ( -12.18%)
   displ. norm   :     0.0554706 α      lambda       -0.4384475E-04
   maximum displ.:     0.0342777 α      in ANC's #1, #2, #4, ...

........................................................................
.............................. CYCLE   37 ..............................
........................................................................
   1    -34.4597754 -0.344598E+02  0.265E-02    3.06       0.0  T
   2    -34.4597761 -0.690305E-06  0.156E-02    3.06       1.3  T
   3    -34.4597751  0.100080E-05  0.802E-03    3.06       2.4  T
   4    -34.4597763 -0.118109E-05  0.215E-03    3.06       9.1  T
   5    -34.4597764 -0.429343E-07  0.759E-04    3.06      25.8  T
   6    -34.4597764 -0.108775E-08  0.417E-04    3.06      47.0  T
     SCC iter.                  ...        0 min,  0.007 sec
     gradient                   ...        0 min,  0.014 sec
 * total energy  :   -33.9249680 Eh     change       -0.5939724E-05 Eh
   gradient norm :     0.0055913 Eh/α   predicted    -0.2199108E-04 ( 270.24%)
   displ. norm   :     0.0949297 α      lambda       -0.4087312E-04
   maximum displ.:     0.0807416 α      in ANC's #2, #1, #4, ...

........................................................................
.............................. CYCLE   38 ..............................
........................................................................
   1    -34.4586201 -0.344586E+02  0.612E-02    3.05       0.0  T
   2    -34.4586206 -0.540093E-06  0.344E-02    3.05       1.0  T
   3    -34.4586205  0.144818E-06  0.554E-03    3.05       3.5  T
   4    -34.4586206 -0.928557E-07  0.356E-03    3.05       5.5  T
   5    -34.4586208 -0.194895E-06  0.567E-04    3.05      34.6  T
   6    -34.4586208 -0.350462E-08  0.220E-04    3.05      89.1  T
     SCC iter.                  ...        0 min,  0.007 sec
     gradient                   ...        0 min,  0.013 sec
 * total energy  :   -33.9249957 Eh     change       -0.2776822E-04 Eh
   gradient norm :     0.0024541 Eh/α   predicted    -0.2062154E-04 ( -25.74%)
   displ. norm   :     0.0727169 α      lambda       -0.2972228E-04
   maximum displ.:     0.0583610 α      in ANC's #2, #4, #1, ...

........................................................................
.............................. CYCLE   39 ..............................
........................................................................
   1    -34.4585444 -0.344585E+02  0.411E-02    3.05       0.0  T
   2    -34.4585447 -0.294326E-06  0.234E-02    3.05       1.0  T
   3    -34.4585440  0.762276E-06  0.663E-03    3.05       3.0  T
   4    -34.4585448 -0.867290E-06  0.222E-03    3.05       8.8  T
   5    -34.4585449 -0.352865E-07  0.779E-04    3.05      25.2  T
   6    -34.4585449 -0.717552E-08  0.291E-04    3.05      67.3  T
     SCC iter.                  ...        0 min,  0.007 sec
     gradient                   ...        0 min,  0.014 sec
 * total energy  :   -33.9250169 Eh     change       -0.2112261E-04 Eh
   gradient norm :     0.0018723 Eh/α   predicted    -0.1494458E-04 ( -29.25%)
   displ. norm   :     0.2445159 α      lambda       -0.3479141E-04
   maximum displ.:     0.2039921 α      in ANC's #2, #4, #44, ...

........................................................................
.............................. CYCLE   40 ..............................
........................................................................
   1    -34.4569098 -0.344569E+02  0.141E-01    3.06       0.0  T
   2    -34.4569120 -0.223855E-05  0.798E-02    3.06       1.0  T
   3    -34.4569040  0.802192E-05  0.225E-02    3.06       1.0  T
   4    -34.4569132 -0.921069E-05  0.707E-03    3.06       2.8  T
   5    -34.4569134 -0.200775E-06  0.162E-03    3.06      12.1  T
   6    -34.4569135 -0.610900E-07  0.429E-04    3.06      45.8  T
   7    -34.4569135 -0.234159E-08  0.211E-04    3.06      93.1  T
     SCC iter.                  ...        0 min,  0.008 sec
     gradient                   ...        0 min,  0.014 sec
 * total energy  :   -33.9250404 Eh     change       -0.2350112E-04 Eh
   gradient norm :     0.0038468 Eh/α   predicted    -0.1785899E-04 ( -24.01%)
   displ. norm   :     0.0824096 α      lambda       -0.3910009E-04
   maximum displ.:     0.0636582 α      in ANC's #1, #6, #4, ...

........................................................................
.............................. CYCLE   41 ..............................
........................................................................
   1    -34.4588701 -0.344589E+02  0.351E-02    3.07       0.0  T
   2    -34.4588703 -0.150362E-06  0.202E-02    3.07       1.0  T
   3    -34.4588698  0.466284E-06  0.513E-03    3.07       3.8  T
   4    -34.4588703 -0.546270E-06  0.150E-03    3.07      13.0  T
   5    -34.4588703 -0.632683E-08  0.448E-04    3.07      43.8  T
   6    -34.4588703 -0.313614E-08  0.164E-04    3.07     119.4  T
     SCC iter.                  ...        0 min,  0.007 sec
     gradient                   ...        0 min,  0.014 sec
 * total energy  :   -33.9250578 Eh     change       -0.1742913E-04 Eh
   gradient norm :     0.0027869 Eh/α   predicted    -0.1968563E-04 (  12.95%)
   displ. norm   :     0.0335786 α      lambda       -0.1701663E-04
   maximum displ.:     0.0196242 α      in ANC's #4, #2, #47, ...

........................................................................
.............................. CYCLE   42 ..............................
........................................................................
   1    -34.4591939 -0.344592E+02  0.192E-02    3.07       0.0  T
   2    -34.4591940 -0.118084E-06  0.112E-02    3.07       1.7  T
   3    -34.4591935  0.518088E-06  0.527E-03    3.07       3.7  T
   4    -34.4591941 -0.600294E-06  0.786E-04    3.07      25.0  T
   5    -34.4591941 -0.797179E-08  0.292E-04    3.07      67.2  T
     SCC iter.                  ...        0 min,  0.006 sec
     gradient                   ...        0 min,  0.014 sec
 * total energy  :   -33.9250702 Eh     change       -0.1238694E-04 Eh
   gradient norm :     0.0024830 Eh/α   predicted    -0.8520487E-05 ( -31.21%)
   displ. norm   :     0.0628809 α      lambda       -0.1580167E-04
   maximum displ.:     0.0394201 α      in ANC's #2, #4, #47, ...
 * RMSD in coord.:     0.5378119 α      energy gain  -0.2414288E-02 Eh

generating ANC from model Hessian ...
Using Lindh-Hessian (1995)
 Shifting diagonal of input Hessian by   3.688153413514930E-003
 Lowest  eigenvalues of input Hessian
   -0.000000   -0.000000   -0.000000    0.000000    0.000000    0.000000
    0.005000    0.006382    0.008092    0.008761    0.011255    0.012429
    0.014268    0.016905    0.018206    0.023393    0.027908    0.030687
 Highest eigenvalues
    1.425673    1.522438    1.679524    1.832674    1.890212    2.021116
 

........................................................................
.............................. CYCLE   43 ..............................
........................................................................
   1    -34.4591828 -0.344592E+02  0.368E-02    3.07       0.0  T
   2    -34.4591830 -0.268643E-06  0.212E-02    3.07       1.0  T
   3    -34.4591821  0.935446E-06  0.662E-03    3.07       3.0  T
   4    -34.4591832 -0.106592E-05  0.160E-03    3.07      12.3  T
   5    -34.4591832 -0.248631E-07  0.519E-04    3.07      37.8  T
   6    -34.4591832 -0.159794E-08  0.272E-04    3.07      72.0  T
     SCC iter.                  ...        0 min,  0.007 sec
     gradient                   ...        0 min,  0.014 sec
 * total energy  :   -33.9250796 Eh     change       -0.9434599E-05 Eh
   gradient norm :     0.0022259 Eh/α   predicted     0.0000000E+00 (-100.00%)
   displ. norm   :     0.0228274 α      lambda       -0.1502576E-04
   maximum displ.:     0.0150569 α      in ANC's #3, #5, #15, ...

........................................................................
.............................. CYCLE   44 ..............................
........................................................................
   1    -34.4590975 -0.344591E+02  0.167E-02    3.07       0.0  T
   2    -34.4590975 -0.375378E-07  0.968E-03    3.07       2.0  T
   3    -34.4590975  0.562348E-08  0.135E-03    3.07      14.5  T
   4    -34.4590975 -0.445463E-08  0.813E-04    3.07      24.1  T
   5    -34.4590975 -0.101246E-07  0.192E-04    3.07     102.4  T
     SCC iter.                  ...        0 min,  0.006 sec
     gradient                   ...        0 min,  0.014 sec
 * total energy  :   -33.9250861 Eh     change       -0.6470362E-05 Eh
   gradient norm :     0.0008802 Eh/α   predicted    -0.7557178E-05 (  16.80%)
   displ. norm   :     0.0223840 α      lambda       -0.4793073E-05
   maximum displ.:     0.0144216 α      in ANC's #5, #3, #4, ...

........................................................................
.............................. CYCLE   45 ..............................
........................................................................
   1    -34.4590515 -0.344591E+02  0.127E-02    3.07       0.0  T
   2    -34.4590516 -0.245012E-07  0.738E-03    3.07       2.7  T
   3    -34.4590516  0.734917E-08  0.926E-04    3.07      21.2  T
   4    -34.4590516 -0.795545E-08  0.519E-04    3.07      37.8  T
     SCC iter.                  ...        0 min,  0.005 sec
     gradient                   ...        0 min,  0.014 sec
 * total energy  :   -33.9250883 Eh     change       -0.2175634E-05 Eh
   gradient norm :     0.0007246 Eh/α   predicted    -0.2406357E-05 (  10.60%)
   displ. norm   :     0.0112126 α      lambda       -0.1863842E-05
   maximum displ.:     0.0060167 α      in ANC's #3, #10, #4, ...

   *** GEOMETRY OPTIMIZATION CONVERGED AFTER 45 ITERATIONS ***

------------------------------------------------------------------------
 total energy gain   :        -0.0077434 Eh       -4.8591 kcal/mol
 total RMSD          :         1.1024016 a0        0.5834 Å
 total power (kW/mol):        -0.4517859 (step)  -14.6982 (real)
------------------------------------------------------------------------

 ANCopt (total)                0 d,  0 h,  0 min,  1.383 sec
 optimizer setup                ...        0 min,  0.000 sec (  0.011%)
 model hessian                  ...        0 min,  0.043 sec (  3.142%)
 ANC generation                 ...        0 min,  0.002 sec (  0.160%)
 coordinate transformation      ...        0 min,  0.001 sec (  0.060%)
 single point calculation       ...        0 min,  1.317 sec ( 95.202%)
 optimization log               ...        0 min,  0.005 sec (  0.335%)
 hessian update                 ...        0 min,  0.001 sec (  0.044%)
 rational function              ...        0 min,  0.012 sec (  0.848%)

================
 final structure:
================
$coord
    2.54690520296194   -2.37487011645002    0.70159392104351      C 
    4.91582392715404   -0.19180488271829    1.04859224790137      S 
    2.80175933517542    2.29285436141892    0.55316257902389      C 
    0.39189818486255    1.39528716843207    0.18175151204246      C 
    0.26004171963508   -1.28443955801816    0.26124365460831      C 
   -2.15593048030270   -2.72586303402086   -0.04483642178968      C 
   -4.26326087637070   -1.02805999825671   -1.04558523429641      C 
   -4.33717195351029    1.50880358924667    0.34141734004029      C 
   -4.69340600280904    1.19051479608718    3.18766338939992      C 
   -1.91117776742830    2.98215334545503   -0.23215597425209      C 
    3.82622081492495    4.81441658959075    0.61304791686820      C 
    2.78289178311188    6.91321346496140   -0.29726154141591      C 
    2.97920095844030   -4.34941499904808    0.84448128966532      H 
   -2.70435962831635   -3.51665584370541    1.78479147340280      H 
   -1.86045878299040   -4.31872804751167   -1.32594054761072      H 
   -6.07578107929843   -1.99435760411052   -0.84908116460212      H 
   -3.95523423133915   -0.66906134323961   -3.05566608519798      H 
   -5.94124581338684    2.59627841086733   -0.39128042887013      H 
   -3.01113935016084    0.38965516198582    4.05214492495813      H 
   -6.29189346810348   -0.04057383250368    3.58375145656830      H 
   -5.05163045699388    3.01544931244003    4.06481896361701      H 
   -1.81659268713410    4.66574061967711    0.95946589416640      H 
   -1.95047879401083    3.60813422238519   -2.20486264214154      H 
    5.67918785179395    4.92974489072674    1.47547790157243      H 
    0.99426446008174    6.93996355123609   -1.25456744752007      H 
    3.74084757550461    8.70046827623450   -0.13202047277617      H 
$end
           -------------------------------------------------
          |                Final Singlepoint                |
           -------------------------------------------------

          ...................................................
          :                      SETUP                      :
          :.................................................:
          :  # basis functions                  68          :
          :  # atomic orbitals                  67          :
          :  # shells                           39          :
          :  # electrons                        64          :
          :  max. iterations                   250          :
          :  Hamiltonian                  GFN2-xTB          :
          :  restarted?                      false          :
          :  GBSA solvation                  false          :
          :  PC potential                    false          :
          :  electronic temp.          300.0000000     K    :
          :  accuracy                    1.0000000          :
          :  -> integral cutoff          0.2500000E+02      :
          :  -> integral neglect         0.1000000E-07      :
          :  -> SCF convergence          0.1000000E-05 Eh   :
          :  -> wf. convergence          0.1000000E-03 e    :
          :  Broyden damping             0.4000000          :
          ...................................................

 iter      E             dE          RMSdq      gap      omega  full diag
   1    -34.4590516 -0.344591E+02  0.312E-04    3.07       0.0  T
   2    -34.4590516 -0.823093E-10  0.121E-04    3.07     161.8  T
   3    -34.4590516 -0.532054E-10  0.142E-04    3.07     137.7  T

   *** convergence criteria satisfied after 3 iterations ***

         #    Occupation            Energy/Eh            Energy/eV
      -------------------------------------------------------------
         1        2.0000           -0.7209266             -19.6174
       ...           ...                  ...                  ...
        26        2.0000           -0.4371767             -11.8962
        27        2.0000           -0.4356599             -11.8549
        28        2.0000           -0.4233717             -11.5205
        29        2.0000           -0.4195145             -11.4156
        30        2.0000           -0.4139871             -11.2652
        31        2.0000           -0.3796402             -10.3305
        32        2.0000           -0.3665119              -9.9733 (HOMO)
        33                         -0.2537205              -6.9041 (LUMO)
        34                         -0.1969453              -5.3592
        35                         -0.1879932              -5.1156
        36                         -0.1403280              -3.8185
        37                         -0.1065413              -2.8991
       ...                                ...                  ...
        67                          0.6887347              18.7414
      -------------------------------------------------------------
                  HL-Gap            0.1127914 Eh            3.0692 eV
             Fermi-level           -0.3101162 Eh           -8.4387 eV

 SCC (total)                   0 d,  0 h,  0 min,  0.027 sec
 SCC setup                      ...        0 min,  0.000 sec (  0.703%)
 Dispersion                     ...        0 min,  0.000 sec (  0.829%)
 integral evaluation            ...        0 min,  0.008 sec ( 29.821%)
 zeroth order Hamiltonian       ...        0 min,  0.000 sec (  0.573%)
 iterations                     ...        0 min,  0.004 sec ( 15.035%)
 molecular gradient             ...        0 min,  0.014 sec ( 51.480%)
 printout                       ...        0 min,  0.000 sec (  1.343%)

         :::::::::::::::::::::::::::::::::::::::::::::::::::::
         ::                     SUMMARY                     ::
         :::::::::::::::::::::::::::::::::::::::::::::::::::::
         :: total energy             -33.925088260934 Eh    ::
         :: gradient norm              0.000724627418 Eh/a0 ::
         :: HOMO-LUMO gap              3.069209643265 eV    ::
         ::.................................................::
         :: SCC energy               -34.459051565075 Eh    ::
         :: -> isotropic ES            0.003671965679 Eh    ::
         :: -> anisotropic ES          0.004879019471 Eh    ::
         :: -> anisotropic XC          0.018835627695 Eh    ::
         :: -> dispersion             -0.026030537880 Eh    ::
         :: repulsion energy           0.533700906519 Eh    ::
         :: add. restraining           0.000000000000 Eh    ::
         :::::::::::::::::::::::::::::::::::::::::::::::::::::

           -------------------------------------------------
          |                Property Printout                |
           -------------------------------------------------

    * Orbital Energies and Occupations

         #    Occupation            Energy/Eh            Energy/eV
      -------------------------------------------------------------
         1        2.0000           -0.7209266             -19.6174
       ...           ...                  ...                  ...
        20        2.0000           -0.4741263             -12.9016
        21        2.0000           -0.4677887             -12.7292
        22        2.0000           -0.4557070             -12.4004
        23        2.0000           -0.4526617             -12.3176
        24        2.0000           -0.4495956             -12.2341
        25        2.0000           -0.4414172             -12.0116
        26        2.0000           -0.4371767             -11.8962
        27        2.0000           -0.4356599             -11.8549
        28        2.0000           -0.4233717             -11.5205
        29        2.0000           -0.4195145             -11.4156
        30        2.0000           -0.4139871             -11.2652
        31        2.0000           -0.3796402             -10.3305
        32        2.0000           -0.3665119              -9.9733 (HOMO)
        33                         -0.2537205              -6.9041 (LUMO)
        34                         -0.1969453              -5.3592
        35                         -0.1879932              -5.1156
        36                         -0.1403280              -3.8185
        37                         -0.1065413              -2.8991
        38                          0.0045668               0.1243
        39                          0.0393880               1.0718
        40                          0.0417195               1.1352
        41                          0.0801456               2.1809
        42                          0.0852313               2.3193
        43                          0.0969184               2.6373
       ...                                ...                  ...
        67                          0.6887347              18.7414
      -------------------------------------------------------------
                  HL-Gap            0.1127914 Eh            3.0692 eV
             Fermi-level           -0.3101162 Eh           -8.4387 eV

     #   Z        covCN         q      C6AA      α(0)
     1   6 C      2.937    -0.033    28.824     8.805
     2  16 S      2.334    -0.064   143.714    20.177
     3   6 C      2.986     0.012    27.745     8.640
     4   6 C      3.150    -0.009    27.963     8.650
     5   6 C      3.159    -0.006    27.858     8.629
     6   6 C      3.807    -0.054    21.544     6.608
     7   6 C      3.808    -0.056    21.570     6.611
     8   6 C      3.854    -0.010    20.715     6.473
     9   6 C      3.754    -0.104    22.542     6.770
    10   6 C      3.810    -0.056    21.578     6.612
    11   6 C      2.938    -0.029    28.737     8.792
    12   6 C      2.838    -0.095    30.384     9.033
    13   1 H      0.926     0.036     2.504     2.475
    14   1 H      0.924     0.042     2.417     2.431
    15   1 H      0.924     0.035     2.516     2.481
    16   1 H      0.924     0.029     2.599     2.521
    17   1 H      0.924     0.033     2.550     2.497
    18   1 H      0.924     0.024     2.669     2.555
    19   1 H      0.925     0.041     2.435     2.440
    20   1 H      0.925     0.034     2.535     2.490
    21   1 H      0.925     0.032     2.561     2.503
    22   1 H      0.924     0.044     2.395     2.420
    23   1 H      0.924     0.038     2.470     2.458
    24   1 H      0.925     0.040     2.449     2.447
    25   1 H      0.926     0.040     2.443     2.444
    26   1 H      0.926     0.037     2.491     2.468

 Mol. C6AA /au·bohr⁶  :       7973.063799
 Mol. C8AA /au·bohr⁸  :     209321.404246
 Mol. α(0) /au        :        140.430602


Wiberg/Mayer (AO) data.
largest (>0.10) Wiberg bond orders for each atom
          total WBO             WBO to atom ...
     1  C   3.945        C    5 1.582    S    2 1.189    H   13 0.971    C    3 0.104
     2  S   2.600        C    1 1.189    C    3 1.122
     3  C   3.944        C    4 1.503    C   11 1.133    S    2 1.122    C    1 0.104
     4  C   3.985        C    3 1.503    C    5 1.243    C   10 1.012
     5  C   3.985        C    1 1.582    C    4 1.243    C    6 1.007
     6  C   3.998        C    5 1.007    C    7 1.006    H   15 0.968    H   14 0.961
     7  C   3.998        C    6 1.006    C    8 0.998    H   17 0.978    H   16 0.977
     8  C   3.996        C    9 1.010    C    7 0.998    C   10 0.992    H   18 0.969
     9  C   3.996        C    8 1.010    H   21 0.987    H   20 0.986    H   19 0.985
    10  C   3.998        C    4 1.012    C    8 0.992    H   22 0.963    H   23 0.957
    11  C   3.991        C   12 1.863    C    3 1.133    H   24 0.963
    12  C   3.991        C   11 1.863    H   26 0.978    H   25 0.973
    13  H   0.998        C    1 0.971
    14  H   0.998        C    6 0.961
    15  H   0.998        C    6 0.968
    16  H   0.998        C    7 0.977
    17  H   0.999        C    7 0.978
    18  H   0.998        C    8 0.969
    19  H   0.998        C    9 0.985
    20  H   0.999        C    9 0.986
    21  H   0.999        C    9 0.987
    22  H   0.998        C   10 0.963
    23  H   0.999        C   10 0.957
    24  H   0.998        C   11 0.963
    25  H   0.998        C   12 0.973
    26  H   0.998        C   12 0.978

molecular dipole:
                 x           y           z       tot (Debye)
 q only:       -0.526      -0.009      -0.035
   full:       -0.760      -0.058      -0.095       1.951
molecular quadrupole (traceless):
                xx          xy          yy          xz          yz          zz
 q only:       -1.157       0.110       1.894      -0.086      -0.156      -0.736
  q+dip:       -2.885       0.060       4.703       0.432      -0.666      -1.818
   full:       -3.483       0.110       4.106      -0.334      -0.362      -0.623

           -------------------------------------------------
          |                Geometry Summary                 |
           -------------------------------------------------

      molecular mass/u    :      178.2916000
   center of mass at/Å    :        0.2228092       0.5292725       0.2728106
  moments of inertia/u·Å² :        0.4133835E+03   0.7112996E+03   0.1005932E+04
rotational constants/cm⁻¹ :        0.4077964E-01   0.2369976E-01   0.1675823E-01

 * 26 selected distances

     #   Z        #   Z                                     value/Å
     1   6 C      2  16 S                                 1.7145635
     2  16 S      3   6 C                                 1.7461447 (max)
     3   6 C      4   6 C                                 1.3749451
     1   6 C      5   6 C                                 1.3607875
     4   6 C      5   6 C                                 1.4203891
     5   6 C      6   6 C                                 1.4975163
     6   6 C      7   6 C                                 1.5268277
     7   6 C      8   6 C                                 1.5304952
     8   6 C      9   6 C                                 1.5272359
     4   6 C     10   6 C                                 1.4961426
     8   6 C     10   6 C                                 1.5323491
    11   6 C     12   6 C                                 1.3305570
     1   6 C     13   1 H                                 1.0723022 (min)
     6   6 C     14   1 H                                 1.0939601
     6   6 C     15   1 H                                 1.0929465
     7   6 C     16   1 H                                 1.0918986
     7   6 C     17   1 H                                 1.0927460
     8   6 C     18   1 H                                 1.0963680
     9   6 C     19   1 H                                 1.0869056
     9   6 C     20   1 H                                 1.0880517
     9   6 C     21   1 H                                 1.0881141
    10   6 C     22   1 H                                 1.0926421
    10   6 C     23   1 H                                 1.0954056
    11   6 C     24   1 H                                 1.0832729
    12   6 C     25   1 H                                 1.0736350
    12   6 C     26   1 H                                 1.0766207

 * 3 distinct bonds (by element types)

   Z      Z             #   av. dist./Å        max./Å        min./Å
   1 H    6 C          14     1.0874906     1.0963680     1.0723022
   6 C    6 C          10     1.4597245     1.5323491     1.3305570
   6 C   16 S           2     1.7303541     1.7461447     1.7145635


optimized geometry written to: xtbopt.xyz


           -------------------------------------------------
          | TOTAL ENERGY              -33.925088260934 Eh   |
          | GRADIENT NORM               0.000724627418 Eh/α |
          | HOMO-LUMO GAP               3.069209643265 eV   |
           -------------------------------------------------

------------------------------------------------------------------------
 * finished run on 2021/05/19 at 11:00:18.043     
------------------------------------------------------------------------
 total:
 * wall-time:     0 d,  0 h,  0 min,  1.469 sec
 *  cpu-time:     0 d,  0 h,  0 min,  1.465 sec
 * ratio c/w:     0.997 speedup
 SCF:
 * wall-time:     0 d,  0 h,  0 min,  0.038 sec
 *  cpu-time:     0 d,  0 h,  0 min,  0.038 sec
 * ratio c/w:     0.998 speedup
 ANC optimizer:
 * wall-time:     0 d,  0 h,  0 min,  1.411 sec
 *  cpu-time:     0 d,  0 h,  0 min,  1.407 sec
 * ratio c/w:     0.998 speedup

