      -----------------------------------------------------------      
     |                   =====================                   |     
     |                           x T B                           |     
     |                   =====================                   |     
     |                         S. Grimme                         |     
     |          Mulliken Center for Theoretical Chemistry        |     
     |                    University of Bonn                     |     
     |                Version 6.2 RC2 (SAW190805)                |     
      -----------------------------------------------------------      

   This program is distributed in the hope that it will be useful,
   but WITHOUT ANY WARRANTY; without even the implied warranty of
   MERCHANTABILITY or FITNESS FOR A PARTICULAR PURPOSE.
   
   FOR NON-COMMERCIAL, ACADEMIA USE ONLY.
   
   Cite this work as:
   * S. Grimme, C. Bannwarth, P. Shushkov, J. Chem. Theory Comput., 2017,
     13, 1989-2009. DOI: 10.1021/acs.jctc.7b00118
   * C. Bannwarth, S. Ehlert and S. Grimme., J. Chem. Theory Comput., 2019,
     15, 1652-1671. DOI: 10.1021/acs.jctc.8b01176
   * P. Pracht, E. Caldeweyher, S. Ehlert, S. Grimme, ChemRxiv, 2019, preprint.
     DOI: 10.26434/chemrxiv.8326202.v1
   
   for DFT-D4:
   * E. Caldeweyher, C. Bannwarth and S. Grimme, J. Chem. Phys., 2017,
     147, 034112. DOI: 10.1063/1.4993215
   * E. Caldeweyher, S. Ehlert, A. Hansen, H. Neugebauer, S. Spicher,
     C. Bannwarth and S. Grimme, J. Chem. Phys., 2019, 150, 154122.
     DOI: 10.1063/1.5090222
   
   for sTDA-xTB:
   * S. Grimme and C. Bannwarth, J. Chem. Phys., 2016, 145, 054103.
     DOI: 10.1063/1.4959605
   
   in the mass-spec context:
   * V. Asgeirsson, C. Bauer and S. Grimme, Chem. Sci., 2017, 8, 4879.
     DOI: 10.1039/c7sc00601b
   
   for metadynamics refer to:
   * S. Grimme, J. Chem. Theory Comput., 2019, 155, 2847-2862
     DOI: 10.1021/acs.jctc.9b00143
   
   with help from (in alphabetical order)
   C. Bannwarth, F. Bohle, G. Brandenburg, E. Caldeweyher, M. Checinski,
   S. Dohm, S. Ehlert, S. Ehrlich, F. März, H. Neugebauer, J. Pisarek,
   P. Pracht, P. Shushkov, and S. Spicher.
   
 * started run on 2021/05/19 at 11:00:18.270     

           -------------------------------------------------
          |                Calculation Setup                |
           -------------------------------------------------

          program call               : /ihome/ghutchison/geoffh/xtb/xtb 698.xyz -opt
          hostname                   : smp-n144
          coordinate file            : 698.xyz
          omp threads                :                     1
          number of atoms            :                    27
          number of electrons        :                    80
          charge                     :                     0
          spin                       :                   0.0
          first test random number   :      0.75506420395358


########################################################################
# WARNING! Please study the warnings concerning your input carefully
#  - the use of '-opt' is discouraged, please use '--opt' next time
########################################################################

           ------------------------------------------------- 
          |                 G F N 2 - x T B                 |
          | Geometry, Frequencies, Noncovalent interactions |
          |            JCTC 2019 parametrisation            |
           ------------------------------------------------- 
             KAB for C  - Si     :                1.0500
             KAB for H  - Pd     :                0.9500
             k(s)              :                1.8500
             k(p)              :                2.2300
             k(d)              :                2.2300
             k(f)              :                2.0000
             kEN (H0ij)        :               -2.0000
             D4 a1             :                0.5200
             D4 a2             :                5.0000
             D4 s6             :                1.0000
             D4 s8             :                2.7000
             D4 s9             :                5.0000
             alphaj            :                2.0000

  Z AO/shell   Hii/eV     exponent
  1     Wed Apr 25 08:07:45 CEST 2018   EN: 2.200 GM2: 0.406  GM3: 0.0800  RAES: 1.40
     1s    -10.707211    1.230000
  6     Wed Apr 25 08:07:45 CEST 2018   EN: 2.550 GM2: 0.538  GM3: 0.1500  RAES: 3.00
     2s    -13.970922    2.096432
     2p    -10.063292    1.800000
  7     Wed Apr 25 08:07:45 CEST 2018   EN: 3.040 GM2: 0.461  GM3:-0.0640  RAES: 1.90
     2s    -16.686243    2.339881
     2p    -12.523956    2.014332
  8     Wed Apr 25 08:07:45 CEST 2018   EN: 3.440 GM2: 0.452  GM3:-0.0517  RAES: 1.80
     2s    -20.229985    2.439742
     2p    -15.503117    2.137023
 16     Tue Apr 24 11:44:34 CEST 2018   EN: 2.580 GM2: 0.340  GM3:-0.0502  RAES: 3.10
     3s    -20.029654    1.981333
     3p    -11.377694    2.025643
     3d     -0.420282    1.702555

           ------------------------------------------------- 
          |        Self-Consistent Charge Iterations        |
           ------------------------------------------------- 

          ...................................................
          :                      SETUP                      :
          :.................................................:
          :  # basis functions                  78          :
          :  # atomic orbitals                  77          :
          :  # shells                           43          :
          :  # electrons                        80          :
          :  max. iterations                   250          :
          :  Hamiltonian                  GFN2-xTB          :
          :  restarted?                      false          :
          :  GBSA solvation                  false          :
          :  PC potential                    false          :
          :  electronic temp.          300.0000000     K    :
          :  accuracy                    1.0000000          :
          :  -> integral cutoff          0.2500000E+02      :
          :  -> integral neglect         0.1000000E-07      :
          :  -> SCF convergence          0.1000000E-05 Eh   :
          :  -> wf. convergence          0.1000000E-03 e    :
          :  Broyden damping             0.4000000          :
          ...................................................

 iter      E             dE          RMSdq      gap      omega  full diag
   1    -44.9626052 -0.449626E+02  0.451E+00    2.74       0.0  T
   2    -45.1203853 -0.157780E+00  0.248E+00    1.44       1.0  T
   3    -45.1278563 -0.747102E-02  0.144E+00    1.17       1.0  T
   4    -45.1290910 -0.123468E-02  0.883E-01    0.68       1.0  T
   5    -45.1383962 -0.930523E-02  0.118E-01    0.49       1.0  T
   6    -45.1384399 -0.436683E-04  0.703E-02    0.51       1.0  T
   7    -45.1384857 -0.457820E-04  0.295E-02    0.53       1.0  T
   8    -45.1384974 -0.117214E-04  0.129E-02    0.54       1.5  T
   9    -45.1384985 -0.106255E-05  0.553E-03    0.54       3.5  T
  10    -45.1384987 -0.193592E-06  0.229E-03    0.54       8.4  T
  11    -45.1384988 -0.855032E-07  0.818E-04    0.54      23.5  T
  12    -45.1384988 -0.592796E-08  0.368E-04    0.54      52.3  T

   *** convergence criteria satisfied after 12 iterations ***

         #    Occupation            Energy/Eh            Energy/eV
      -------------------------------------------------------------
         1        2.0000           -0.7714783             -20.9930
       ...           ...                  ...                  ...
        34        2.0000           -0.4526286             -12.3167
        35        2.0000           -0.4472858             -12.1713
        36        2.0000           -0.4376875             -11.9101
        37        2.0000           -0.4349628             -11.8359
        38        2.0000           -0.4140802             -11.2677
        39        2.0000           -0.4116787             -11.2023
        40        1.9999           -0.3468068              -9.4371 (HOMO)
        41        0.0001           -0.3269775              -8.8975 (LUMO)
        42                         -0.2689471              -7.3184
        43                         -0.2184712              -5.9449
        44                         -0.2126539              -5.7866
        45                         -0.1735601              -4.7228
       ...                                ...                  ...
        77                          0.6393723              17.3982
      -------------------------------------------------------------
                  HL-Gap            0.0198293 Eh            0.5396 eV
             Fermi-level           -0.3368921 Eh           -9.1673 eV

 SCC (total)                   0 d,  0 h,  0 min,  0.047 sec
 SCC setup                      ...        0 min,  0.000 sec (  0.697%)
 Dispersion                     ...        0 min,  0.000 sec (  0.887%)
 integral evaluation            ...        0 min,  0.011 sec ( 23.838%)
 zeroth order Hamiltonian       ...        0 min,  0.000 sec (  0.479%)
 iterations                     ...        0 min,  0.018 sec ( 37.405%)
 molecular gradient             ...        0 min,  0.017 sec ( 35.703%)
 printout                       ...        0 min,  0.000 sec (  0.882%)

         :::::::::::::::::::::::::::::::::::::::::::::::::::::
         ::                     SUMMARY                     ::
         :::::::::::::::::::::::::::::::::::::::::::::::::::::
         :: total energy             -44.631815723347 Eh    ::
         :: gradient norm              0.083837904784 Eh/a0 ::
         :: HOMO-LUMO gap              0.539583882467 eV    ::
         ::.................................................::
         :: SCC energy               -45.138498765180 Eh    ::
         :: -> isotropic ES            0.053703460712 Eh    ::
         :: -> anisotropic ES          0.011162828091 Eh    ::
         :: -> anisotropic XC          0.015140609572 Eh    ::
         :: -> dispersion             -0.028018064909 Eh    ::
         :: repulsion energy           0.506425539275 Eh    ::
         :: add. restraining           0.000000000000 Eh    ::
         :::::::::::::::::::::::::::::::::::::::::::::::::::::

      ----------------------------------------------------------- 
     |                   =====================                   |
     |                        A N C O P T                        |
     |                   =====================                   |
     |               Approximate Normal Coordinate               |
     |                Rational Function Optimizer                |
      ----------------------------------------------------------- 

          ...................................................
          :                      SETUP                      :
          :.................................................:
          :   optimization level            normal          :
          :   max. optcycles                   200          :
          :   ANC micro-cycles                  20          :
          :   degrees of freedom                75          :
          :.................................................:
          :   RF solver                   davidson          :
          :   input Hessian                  false          :
          :   write xtbopt.log                true          :
          :   linear?                        false          :
          :   energy convergence         0.5000000E-05 Eh   :
          :   grad. convergence          0.1000000E-02 Eh/α :
          :   maximium RF displ.         2.0000000          :
          :   Hlow (freq-cutoff)         0.5000000E-02      :
          :   Hmax (freq-cutoff)         5.0000000          :
          :   S6 in model hess.         20.0000000          :
          ...................................................

generating ANC from model Hessian ...
Using Lindh-Hessian (1995)
 Shifting diagonal of input Hessian by   3.809833969189301E-003
 Lowest  eigenvalues of input Hessian
   -0.000000    0.000000    0.000000    0.000000    0.000000    0.000000
    0.005000    0.005438    0.006991    0.007634    0.008731    0.012050
    0.012505    0.016218    0.017095    0.018785    0.021084    0.023168
 Highest eigenvalues
    1.735245    1.746046    1.784257    1.806035    2.116304    2.361518
 

........................................................................
.............................. CYCLE    1 ..............................
........................................................................
   1    -45.1384988 -0.451385E+02  0.134E-04    0.54       0.0  T
   2    -45.1384988 -0.523812E-10  0.825E-05    0.54     233.3  T
   3    -45.1384988 -0.812150E-11  0.562E-05    0.54     342.2  T
     SCC iter.                  ...        0 min,  0.005 sec
     gradient                   ...        0 min,  0.017 sec
 * total energy  :   -44.6318157 Eh     change        0.2708205E-07 Eh
   gradient norm :     0.0838395 Eh/α   predicted     0.0000000E+00 (-100.00%)
   displ. norm   :     0.3461214 α      lambda       -0.1265323E-01
   maximum displ.:     0.1734830 α      in ANC's #7, #17, #29, ...

........................................................................
.............................. CYCLE    2 ..............................
........................................................................
   1    -45.1770974 -0.451771E+02  0.274E-01    0.96       0.0  T
   2    -45.1774992 -0.401843E-03  0.129E-01    0.87       1.0  T
   3    -45.1774992 -0.214777E-07  0.645E-02    0.85       1.0  T
   4    -45.1774901  0.919016E-05  0.391E-02    0.84       1.0  T
   5    -45.1775194 -0.293459E-04  0.798E-03    0.84       2.4  T
   6    -45.1775194 -0.246585E-07  0.354E-03    0.84       5.4  T
   7    -45.1775195 -0.124717E-06  0.149E-03    0.84      12.9  T
     SCC iter.                  ...        0 min,  0.009 sec
     gradient                   ...        0 min,  0.016 sec
 * total energy  :   -44.6400913 Eh     change       -0.8275646E-02 Eh
   gradient norm :     0.0260083 Eh/α   predicted    -0.7084548E-02 ( -14.39%)
   displ. norm   :     0.3071524 α      lambda       -0.2676351E-02
   maximum displ.:     0.2239556 α      in ANC's #7, #10, #17, ...

........................................................................
.............................. CYCLE    3 ..............................
........................................................................
   1    -45.1934292 -0.451934E+02  0.234E-01    1.01       0.0  T
   2    -45.1935174 -0.881613E-04  0.131E-01    0.98       1.0  T
   3    -45.1935090  0.835607E-05  0.437E-02    0.97       1.0  T
   4    -45.1935169 -0.790724E-05  0.227E-02    0.97       1.0  T
   5    -45.1935272 -0.103469E-04  0.567E-03    0.97       3.4  T
   6    -45.1935273 -0.712747E-07  0.286E-03    0.97       6.7  T
   7    -45.1935274 -0.502380E-07  0.136E-03    0.97      14.2  T
     SCC iter.                  ...        0 min,  0.009 sec
     gradient                   ...        0 min,  0.016 sec
 * total energy  :   -44.6414470 Eh     change       -0.1355659E-02 Eh
   gradient norm :     0.0113158 Eh/α   predicted    -0.1464431E-02 (   8.02%)
   displ. norm   :     0.1793729 α      lambda       -0.9192306E-03
   maximum displ.:     0.0894794 α      in ANC's #7, #10, #2, ...

........................................................................
.............................. CYCLE    4 ..............................
........................................................................
   1    -45.1971349 -0.451971E+02  0.162E-01    1.03       0.0  T
   2    -45.1971506 -0.156612E-04  0.932E-02    1.01       1.0  T
   3    -45.1971479  0.265239E-05  0.196E-02    1.00       1.0  T
   4    -45.1971525 -0.458177E-05  0.998E-03    1.01       1.9  T
   5    -45.1971541 -0.160324E-05  0.354E-03    1.01       5.4  T
   6    -45.1971542 -0.883616E-07  0.158E-03    1.01      12.2  T
   7    -45.1971542 -0.134446E-07  0.661E-04    1.01      29.1  T
     SCC iter.                  ...        0 min,  0.009 sec
     gradient                   ...        0 min,  0.016 sec
 * total energy  :   -44.6414815 Eh     change       -0.3450158E-04 Eh
   gradient norm :     0.0164466 Eh/α   predicted    -0.4744035E-03 (1275.02%)
   displ. norm   :     0.0989938 α      lambda       -0.7406739E-03
   maximum displ.:     0.0430907 α      in ANC's #2, #5, #8, ...

........................................................................
.............................. CYCLE    5 ..............................
........................................................................
   1    -45.1934579 -0.451935E+02  0.140E-01    0.93       0.0  T
   2    -45.1934755 -0.175637E-04  0.815E-02    0.95       1.0  T
   3    -45.1934714  0.410663E-05  0.233E-02    0.96       1.0  T
   4    -45.1934773 -0.590807E-05  0.100E-02    0.96       1.9  T
   5    -45.1934789 -0.164134E-05  0.381E-03    0.96       5.1  T
   6    -45.1934790 -0.118037E-06  0.172E-03    0.96      11.2  T
   7    -45.1934790 -0.112652E-07  0.706E-04    0.96      27.3  T
     SCC iter.                  ...        0 min,  0.009 sec
     gradient                   ...        0 min,  0.016 sec
 * total energy  :   -44.6419006 Eh     change       -0.4190571E-03 Eh
   gradient norm :     0.0039578 Eh/α   predicted    -0.3739683E-03 ( -10.76%)
   displ. norm   :     0.1047730 α      lambda       -0.1437880E-03
   maximum displ.:     0.0673558 α      in ANC's #2, #8, #5, ...

........................................................................
.............................. CYCLE    6 ..............................
........................................................................
   1    -45.1925218 -0.451925E+02  0.954E-02    0.94       0.0  T
   2    -45.1925249 -0.311859E-05  0.514E-02    0.95       1.0  T
   3    -45.1925240  0.895031E-06  0.116E-02    0.95       1.7  T
   4    -45.1925259 -0.188191E-05  0.537E-03    0.95       3.6  T
   5    -45.1925261 -0.197446E-06  0.161E-03    0.95      11.9  T
   6    -45.1925261 -0.322002E-07  0.633E-04    0.95      30.4  T
   7    -45.1925262 -0.456765E-08  0.328E-04    0.95      58.7  T
     SCC iter.                  ...        0 min,  0.009 sec
     gradient                   ...        0 min,  0.017 sec
 * total energy  :   -44.6420092 Eh     change       -0.1086049E-03 Eh
   gradient norm :     0.0038656 Eh/α   predicted    -0.7269031E-04 ( -33.07%)
   displ. norm   :     0.2097813 α      lambda       -0.1996061E-03
   maximum displ.:     0.1316802 α      in ANC's #2, #8, #1, ...

........................................................................
.............................. CYCLE    7 ..............................
........................................................................
   1    -45.1913648 -0.451914E+02  0.194E-01    0.93       0.0  T
   2    -45.1913770 -0.121318E-04  0.105E-01    0.94       1.0  T
   3    -45.1913751  0.189193E-05  0.213E-02    0.94       1.0  T
   4    -45.1913812 -0.613919E-05  0.998E-03    0.94       1.9  T
   5    -45.1913819 -0.674111E-06  0.273E-03    0.94       7.1  T
   6    -45.1913820 -0.103977E-06  0.114E-03    0.94      16.9  T
   7    -45.1913820 -0.102782E-07  0.633E-04    0.94      30.4  T
   8    -45.1913820 -0.223108E-08  0.156E-04    0.94     123.1  T
     SCC iter.                  ...        0 min,  0.010 sec
     gradient                   ...        0 min,  0.017 sec
 * total energy  :   -44.6421554 Eh     change       -0.1462258E-03 Eh
   gradient norm :     0.0059382 Eh/α   predicted    -0.1042027E-03 ( -28.74%)
   displ. norm   :     0.2231368 α      lambda       -0.1686976E-03
   maximum displ.:     0.1452282 α      in ANC's #2, #1, #8, ...

........................................................................
.............................. CYCLE    8 ..............................
........................................................................
   1    -45.1910808 -0.451911E+02  0.200E-01    0.94       0.0  T
   2    -45.1910937 -0.128907E-04  0.108E-01    0.94       1.0  T
   3    -45.1910926  0.117221E-05  0.207E-02    0.94       1.0  T
   4    -45.1910984 -0.587443E-05  0.980E-03    0.94       2.0  T
   5    -45.1910991 -0.668235E-06  0.254E-03    0.94       7.6  T
   6    -45.1910992 -0.893048E-07  0.115E-03    0.94      16.8  T
     SCC iter.                  ...        0 min,  0.008 sec
     gradient                   ...        0 min,  0.016 sec
 * total energy  :   -44.6422809 Eh     change       -0.1254709E-03 Eh
   gradient norm :     0.0068479 Eh/α   predicted    -0.8855228E-04 ( -29.42%)
   displ. norm   :     0.2393520 α      lambda       -0.1757731E-03
   maximum displ.:     0.1542314 α      in ANC's #2, #1, #8, ...

........................................................................
.............................. CYCLE    9 ..............................
........................................................................
   1    -45.1918136 -0.451918E+02  0.208E-01    0.95       0.0  T
   2    -45.1918269 -0.133777E-04  0.114E-01    0.95       1.0  T
   3    -45.1918264  0.505254E-06  0.203E-02    0.95       1.0  T
   4    -45.1918319 -0.546136E-05  0.981E-03    0.95       2.0  T
   5    -45.1918326 -0.737471E-06  0.241E-03    0.95       8.0  T
   6    -45.1918327 -0.696787E-07  0.119E-03    0.95      16.2  T
     SCC iter.                  ...        0 min,  0.008 sec
     gradient                   ...        0 min,  0.016 sec
 * total energy  :   -44.6424164 Eh     change       -0.1355221E-03 Eh
   gradient norm :     0.0065074 Eh/α   predicted    -0.9292975E-04 ( -31.43%)
   displ. norm   :     0.2614449 α      lambda       -0.1918818E-03
   maximum displ.:     0.1462612 α      in ANC's #2, #1, #4, ...

........................................................................
.............................. CYCLE   10 ..............................
........................................................................
   1    -45.1930358 -0.451930E+02  0.217E-01    0.97       0.0  T
   2    -45.1930496 -0.138316E-04  0.121E-01    0.96       1.0  T
   3    -45.1930508 -0.115173E-05  0.186E-02    0.96       1.0  T
   4    -45.1930546 -0.380600E-05  0.977E-03    0.96       2.0  T
   5    -45.1930555 -0.925552E-06  0.209E-03    0.96       9.2  T
   6    -45.1930555 -0.261179E-07  0.116E-03    0.96      16.5  T
     SCC iter.                  ...        0 min,  0.008 sec
     gradient                   ...        0 min,  0.016 sec
 * total energy  :   -44.6425578 Eh     change       -0.1414116E-03 Eh
   gradient norm :     0.0049492 Eh/α   predicted    -0.1025006E-03 ( -27.52%)
   displ. norm   :     0.2346049 α      lambda       -0.1338562E-03
   maximum displ.:     0.1340042 α      in ANC's #1, #3, #2, ...

........................................................................
.............................. CYCLE   11 ..............................
........................................................................
   1    -45.1932678 -0.451933E+02  0.195E-01    0.97       0.0  T
   2    -45.1932793 -0.114893E-04  0.110E-01    0.97       1.0  T
   3    -45.1932810 -0.173307E-05  0.149E-02    0.97       1.3  T
   4    -45.1932834 -0.237655E-05  0.728E-03    0.97       2.6  T
   5    -45.1932837 -0.274872E-06  0.364E-03    0.97       5.3  T
   6    -45.1932838 -0.191340E-06  0.994E-04    0.97      19.4  T
   7    -45.1932838 -0.297769E-08  0.537E-04    0.97      35.8  T
     SCC iter.                  ...        0 min,  0.010 sec
     gradient                   ...        0 min,  0.016 sec
 * total energy  :   -44.6426558 Eh     change       -0.9804714E-04 Eh
   gradient norm :     0.0042211 Eh/α   predicted    -0.7061807E-04 ( -27.98%)
   displ. norm   :     0.1923020 α      lambda       -0.1292409E-03
   maximum displ.:     0.1155047 α      in ANC's #1, #3, #5, ...

........................................................................
.............................. CYCLE   12 ..............................
........................................................................
   1    -45.1954233 -0.451954E+02  0.137E-01    1.02       0.0  T
   2    -45.1954291 -0.585531E-05  0.783E-02    1.01       1.0  T
   3    -45.1954272  0.190610E-05  0.143E-02    1.01       1.3  T
   4    -45.1954307 -0.343370E-05  0.536E-03    1.01       3.6  T
   5    -45.1954310 -0.362360E-06  0.198E-03    1.01       9.7  T
   6    -45.1954310 -0.101282E-07  0.707E-04    1.01      27.2  T
     SCC iter.                  ...        0 min,  0.008 sec
     gradient                   ...        0 min,  0.016 sec
 * total energy  :   -44.6427181 Eh     change       -0.6224771E-04 Eh
   gradient norm :     0.0067411 Eh/α   predicted    -0.6701175E-04 (   7.65%)
   displ. norm   :     0.3194387 α      lambda       -0.1774315E-03
   maximum displ.:     0.1858169 α      in ANC's #1, #3, #4, ...

........................................................................
.............................. CYCLE   13 ..............................
........................................................................
   1    -45.1914635 -0.451915E+02  0.284E-01    0.97       0.0  T
   2    -45.1914939 -0.304063E-04  0.161E-01    0.98       1.0  T
   3    -45.1914866  0.729022E-05  0.305E-02    0.99       1.0  T
   4    -45.1915028 -0.161745E-04  0.113E-02    0.99       1.7  T
   5    -45.1915044 -0.163504E-05  0.492E-03    0.99       3.9  T
   6    -45.1915046 -0.125325E-06  0.198E-03    0.99       9.7  T
   7    -45.1915046 -0.207628E-07  0.846E-04    0.99      22.8  T
     SCC iter.                  ...        0 min,  0.009 sec
     gradient                   ...        0 min,  0.016 sec
 * total energy  :   -44.6427705 Eh     change       -0.5243307E-04 Eh
   gradient norm :     0.0088119 Eh/α   predicted    -0.9778128E-04 (  86.49%)
   displ. norm   :     0.1167121 α      lambda       -0.1572385E-03
   maximum displ.:     0.0810327 α      in ANC's #2, #1, #5, ...

........................................................................
.............................. CYCLE   14 ..............................
........................................................................
   1    -45.1941434 -0.451941E+02  0.919E-02    1.01       0.0  T
   2    -45.1941475 -0.408801E-05  0.505E-02    1.00       1.0  T
   3    -45.1941456  0.190491E-05  0.138E-02    1.00       1.4  T
   4    -45.1941485 -0.291829E-05  0.550E-03    1.00       3.5  T
   5    -45.1941488 -0.286717E-06  0.196E-03    1.00       9.8  T
   6    -45.1941488 -0.194201E-07  0.803E-04    1.00      24.0  T
     SCC iter.                  ...        0 min,  0.008 sec
     gradient                   ...        0 min,  0.016 sec
 * total energy  :   -44.6428662 Eh     change       -0.9568841E-04 Eh
   gradient norm :     0.0045680 Eh/α   predicted    -0.7969095E-04 ( -16.72%)
   displ. norm   :     0.1513764 α      lambda       -0.1277854E-03
   maximum displ.:     0.0863274 α      in ANC's #2, #1, #3, ...

........................................................................
.............................. CYCLE   15 ..............................
........................................................................
   1    -45.1941206 -0.451941E+02  0.109E-01    1.05       0.0  T
   2    -45.1941287 -0.809743E-05  0.616E-02    1.04       1.0  T
   3    -45.1941184  0.103239E-04  0.275E-02    1.04       1.0  T
   4    -45.1941317 -0.132771E-04  0.599E-03    1.04       3.2  T
   5    -45.1941321 -0.465347E-06  0.252E-03    1.04       7.6  T
   6    -45.1941322 -0.414703E-07  0.845E-04    1.04      22.8  T
     SCC iter.                  ...        0 min,  0.008 sec
     gradient                   ...        0 min,  0.016 sec
 * total energy  :   -44.6429592 Eh     change       -0.9298962E-04 Eh
   gradient norm :     0.0057161 Eh/α   predicted    -0.6536162E-04 ( -29.71%)
   displ. norm   :     0.3368269 α      lambda       -0.2022248E-03
   maximum displ.:     0.1843239 α      in ANC's #1, #3, #2, ...

........................................................................
.............................. CYCLE   16 ..............................
........................................................................
   1    -45.1913349 -0.451913E+02  0.253E-01    1.05       0.0  T
   2    -45.1913514 -0.165324E-04  0.145E-01    1.06       1.0  T
   3    -45.1912710  0.804121E-04  0.668E-02    1.05       1.0  T
   4    -45.1913682 -0.971590E-04  0.757E-03    1.06       2.5  T
   5    -45.1913683 -0.929614E-07  0.368E-03    1.06       5.2  T
   6    -45.1913683 -0.671043E-07  0.151E-03    1.06      12.7  T
   7    -45.1913684 -0.205242E-07  0.807E-04    1.06      23.8  T
     SCC iter.                  ...        0 min,  0.009 sec
     gradient                   ...        0 min,  0.016 sec
 * total energy  :   -44.6430931 Eh     change       -0.1338690E-03 Eh
   gradient norm :     0.0045230 Eh/α   predicted    -0.1125872E-03 ( -15.90%)
   displ. norm   :     0.2023425 α      lambda       -0.1268312E-03
   maximum displ.:     0.1376651 α      in ANC's #2, #1, #3, ...

........................................................................
.............................. CYCLE   17 ..............................
........................................................................
   1    -45.1911104 -0.451911E+02  0.152E-01    1.07       0.0  T
   2    -45.1911166 -0.621317E-05  0.863E-02    1.08       1.0  T
   3    -45.1910988  0.178063E-04  0.324E-02    1.08       1.0  T
   4    -45.1911208 -0.220078E-04  0.552E-03    1.08       3.5  T
   5    -45.1911209 -0.999457E-07  0.257E-03    1.08       7.5  T
   6    -45.1911210 -0.497300E-07  0.817E-04    1.08      23.5  T
     SCC iter.                  ...        0 min,  0.008 sec
     gradient                   ...        0 min,  0.016 sec
 * total energy  :   -44.6431772 Eh     change       -0.8416380E-04 Eh
   gradient norm :     0.0064755 Eh/α   predicted    -0.6601313E-04 ( -21.57%)
   displ. norm   :     0.1377202 α      lambda       -0.1421331E-03
   maximum displ.:     0.1288248 α      in ANC's #2, #5, #8, ...

........................................................................
.............................. CYCLE   18 ..............................
........................................................................
   1    -45.1944128 -0.451944E+02  0.892E-02    1.08       0.0  T
   2    -45.1944156 -0.284712E-05  0.481E-02    1.08       1.0  T
   3    -45.1944123  0.331073E-05  0.159E-02    1.08       1.2  T
   4    -45.1944167 -0.436409E-05  0.526E-03    1.09       3.7  T
   5    -45.1944168 -0.118712E-06  0.165E-03    1.09      11.7  T
   6    -45.1944168 -0.205341E-07  0.702E-04    1.09      27.4  T
     SCC iter.                  ...        0 min,  0.008 sec
     gradient                   ...        0 min,  0.016 sec
 * total energy  :   -44.6432551 Eh     change       -0.7783384E-04 Eh
   gradient norm :     0.0045699 Eh/α   predicted    -0.7241540E-04 (  -6.96%)
   displ. norm   :     0.1851383 α      lambda       -0.1092242E-03
   maximum displ.:     0.1317971 α      in ANC's #2, #1, #3, ...

........................................................................
.............................. CYCLE   19 ..............................
........................................................................
   1    -45.1938080 -0.451938E+02  0.134E-01    1.10       0.0  T
   2    -45.1938123 -0.431767E-05  0.750E-02    1.11       1.0  T
   3    -45.1938042  0.815482E-05  0.232E-02    1.11       1.0  T
   4    -45.1938145 -0.103252E-04  0.600E-03    1.11       3.2  T
   5    -45.1938146 -0.113609E-06  0.202E-03    1.11       9.5  T
   6    -45.1938147 -0.390855E-07  0.682E-04    1.11      28.2  T
     SCC iter.                  ...        0 min,  0.008 sec
     gradient                   ...        0 min,  0.016 sec
 * total energy  :   -44.6433330 Eh     change       -0.7789154E-04 Eh
   gradient norm :     0.0028385 Eh/α   predicted    -0.5648783E-04 ( -27.48%)
   displ. norm   :     0.1576981 α      lambda       -0.7255032E-04
   maximum displ.:     0.1276700 α      in ANC's #2, #1, #3, ...

........................................................................
.............................. CYCLE   20 ..............................
........................................................................
   1    -45.1928221 -0.451928E+02  0.115E-01    1.12       0.0  T
   2    -45.1928265 -0.438635E-05  0.656E-02    1.13       1.0  T
   3    -45.1928170  0.945380E-05  0.237E-02    1.12       1.0  T
   4    -45.1928286 -0.116105E-04  0.500E-03    1.13       3.8  T
   5    -45.1928289 -0.260704E-06  0.252E-03    1.13       7.6  T
   6    -45.1928289 -0.326728E-07  0.681E-04    1.13      28.3  T
   7    -45.1928289 -0.928580E-09  0.435E-04    1.13      44.2  T
     SCC iter.                  ...        0 min,  0.009 sec
     gradient                   ...        0 min,  0.017 sec
 * total energy  :   -44.6433798 Eh     change       -0.4685865E-04 Eh
   gradient norm :     0.0033076 Eh/α   predicted    -0.3717827E-04 ( -20.66%)
   displ. norm   :     0.1020803 α      lambda       -0.4493548E-04
   maximum displ.:     0.0940800 α      in ANC's #2, #8, #6, ...
 * RMSD in coord.:     0.4273017 α      energy gain  -0.1156409E-01 Eh

generating ANC from model Hessian ...
Using Lindh-Hessian (1995)
 Shifting diagonal of input Hessian by   3.652644517924560E-003
 Lowest  eigenvalues of input Hessian
   -0.000000   -0.000000    0.000000    0.000000    0.000000    0.000000
    0.005000    0.005380    0.007072    0.008107    0.009501    0.012931
    0.014307    0.018529    0.019635    0.020417    0.022278    0.024426
 Highest eigenvalues
    1.767917    1.838524    1.896172    2.022925    2.112787    2.610830
 

........................................................................
.............................. CYCLE   21 ..............................
........................................................................
   1    -45.1930033 -0.451930E+02  0.710E-02    1.14       0.0  T
   2    -45.1930046 -0.130282E-05  0.399E-02    1.14       1.0  T
   3    -45.1930001  0.449794E-05  0.163E-02    1.14       1.2  T
   4    -45.1930057 -0.555505E-05  0.299E-03    1.14       6.4  T
   5    -45.1930057 -0.111671E-07  0.105E-03    1.14      18.4  T
   6    -45.1930057 -0.716275E-08  0.467E-04    1.14      41.2  T
   7    -45.1930057 -0.892676E-09  0.266E-04    1.14      72.4  T
     SCC iter.                  ...        0 min,  0.010 sec
     gradient                   ...        0 min,  0.017 sec
 * total energy  :   -44.6434129 Eh     change       -0.3309397E-04 Eh
   gradient norm :     0.0022887 Eh/α   predicted     0.0000000E+00 (-100.00%)
   displ. norm   :     0.0494983 α      lambda       -0.2392965E-04
   maximum displ.:     0.0374773 α      in ANC's #2, #3, #1, ...

........................................................................
.............................. CYCLE   22 ..............................
........................................................................
   1    -45.1929212 -0.451929E+02  0.350E-02    1.13       0.0  T
   2    -45.1929216 -0.401149E-06  0.196E-02    1.13       1.0  T
   3    -45.1929210  0.605446E-06  0.623E-03    1.13       3.1  T
   4    -45.1929217 -0.785130E-06  0.160E-03    1.13      12.0  T
   5    -45.1929218 -0.153541E-07  0.629E-04    1.13      30.6  T
   6    -45.1929218 -0.123197E-08  0.318E-04    1.13      60.6  T
     SCC iter.                  ...        0 min,  0.008 sec
     gradient                   ...        0 min,  0.017 sec
 * total energy  :   -44.6434332 Eh     change       -0.2029063E-04 Eh
   gradient norm :     0.0010613 Eh/α   predicted    -0.1199454E-04 ( -40.89%)
   displ. norm   :     0.0816179 α      lambda       -0.2227379E-04
   maximum displ.:     0.0493946 α      in ANC's #2, #3, #10, ...

........................................................................
.............................. CYCLE   23 ..............................
........................................................................
   1    -45.1926671 -0.451927E+02  0.692E-02    1.13       0.0  T
   2    -45.1926686 -0.146956E-05  0.389E-02    1.13       1.0  T
   3    -45.1926657  0.293015E-05  0.132E-02    1.13       1.5  T
   4    -45.1926695 -0.383868E-05  0.249E-03    1.13       7.7  T
   5    -45.1926695 -0.156872E-07  0.110E-03    1.13      17.5  T
   6    -45.1926695 -0.529477E-08  0.602E-04    1.13      32.0  T
   7    -45.1926696 -0.488018E-08  0.211E-04    1.13      91.0  T
     SCC iter.                  ...        0 min,  0.009 sec
     gradient                   ...        0 min,  0.017 sec
 * total energy  :   -44.6434559 Eh     change       -0.2271143E-04 Eh
   gradient norm :     0.0018136 Eh/α   predicted    -0.1117057E-04 ( -50.82%)
   displ. norm   :     0.1313786 α      lambda       -0.2713153E-04
   maximum displ.:     0.0801127 α      in ANC's #2, #3, #10, ...

........................................................................
.............................. CYCLE   24 ..............................
........................................................................
   1    -45.1922397 -0.451922E+02  0.113E-01    1.14       0.0  T
   2    -45.1922430 -0.325740E-05  0.642E-02    1.14       1.0  T
   3    -45.1922345  0.853501E-05  0.221E-02    1.14       1.0  T
   4    -45.1922454 -0.109398E-04  0.381E-03    1.14       5.0  T
   5    -45.1922454 -0.940851E-08  0.179E-03    1.14      10.7  T
   6    -45.1922454 -0.298996E-07  0.781E-04    1.14      24.6  T
   7    -45.1922454 -0.533254E-08  0.373E-04    1.14      51.6  T
     SCC iter.                  ...        0 min,  0.010 sec
     gradient                   ...        0 min,  0.017 sec
 * total energy  :   -44.6434736 Eh     change       -0.1770142E-04 Eh
   gradient norm :     0.0034415 Eh/α   predicted    -0.1367024E-04 ( -22.77%)
   displ. norm   :     0.0567543 α      lambda       -0.2191221E-04
   maximum displ.:     0.0364179 α      in ANC's #2, #3, #1, ...

........................................................................
.............................. CYCLE   25 ..............................
........................................................................
   1    -45.1922898 -0.451923E+02  0.440E-02    1.14       0.0  T
   2    -45.1922904 -0.526510E-06  0.249E-02    1.14       1.0  T
   3    -45.1922904 -0.222114E-07  0.343E-03    1.14       5.6  T
   4    -45.1922906 -0.175115E-06  0.156E-03    1.14      12.4  T
   5    -45.1922906 -0.124009E-07  0.815E-04    1.14      23.6  T
   6    -45.1922906 -0.672737E-08  0.272E-04    1.14      70.7  T
     SCC iter.                  ...        0 min,  0.008 sec
     gradient                   ...        0 min,  0.017 sec
 * total energy  :   -44.6434912 Eh     change       -0.1753781E-04 Eh
   gradient norm :     0.0024271 Eh/α   predicted    -0.1099231E-04 ( -37.32%)
   displ. norm   :     0.0929898 α      lambda       -0.2603991E-04
   maximum displ.:     0.0592382 α      in ANC's #2, #3, #1, ...

........................................................................
.............................. CYCLE   26 ..............................
........................................................................
   1    -45.1925656 -0.451926E+02  0.729E-02    1.15       0.0  T
   2    -45.1925671 -0.144997E-05  0.410E-02    1.15       1.0  T
   3    -45.1925674 -0.334993E-06  0.439E-03    1.15       4.4  T
   4    -45.1925676 -0.204160E-06  0.206E-03    1.15       9.4  T
   5    -45.1925676 -0.933052E-08  0.776E-04    1.15      24.8  T
   6    -45.1925676 -0.616467E-10  0.455E-04    1.15      42.3  T
     SCC iter.                  ...        0 min,  0.008 sec
     gradient                   ...        0 min,  0.017 sec
 * total energy  :   -44.6435083 Eh     change       -0.1711930E-04 Eh
   gradient norm :     0.0011820 Eh/α   predicted    -0.1313478E-04 ( -23.28%)
   displ. norm   :     0.1085289 α      lambda       -0.9407037E-05
   maximum displ.:     0.0671082 α      in ANC's #2, #3, #1, ...

........................................................................
.............................. CYCLE   27 ..............................
........................................................................
   1    -45.1925589 -0.451926E+02  0.815E-02    1.16       0.0  T
   2    -45.1925603 -0.148845E-05  0.459E-02    1.16       1.0  T
   3    -45.1925608 -0.476719E-06  0.391E-03    1.16       4.9  T
   4    -45.1925610 -0.136443E-06  0.217E-03    1.16       8.9  T
   5    -45.1925610 -0.100027E-07  0.109E-03    1.16      17.7  T
   6    -45.1925610 -0.140867E-07  0.398E-04    1.16      48.4  T
   7    -45.1925610 -0.786244E-09  0.155E-04    1.16     124.4  T
     SCC iter.                  ...        0 min,  0.010 sec
     gradient                   ...        0 min,  0.017 sec
 * total energy  :   -44.6435156 Eh     change       -0.7303713E-05 Eh
   gradient norm :     0.0010030 Eh/α   predicted    -0.4729674E-05 ( -35.24%)
   displ. norm   :     0.0411443 α      lambda       -0.3718742E-05
   maximum displ.:     0.0227887 α      in ANC's #2, #1, #3, ...

........................................................................
.............................. CYCLE   28 ..............................
........................................................................
   1    -45.1926012 -0.451926E+02  0.347E-02    1.16       0.0  T
   2    -45.1926015 -0.266599E-06  0.194E-02    1.16       1.0  T
   3    -45.1926014  0.620046E-07  0.306E-03    1.16       6.3  T
   4    -45.1926016 -0.184635E-06  0.117E-03    1.16      16.5  T
   5    -45.1926016 -0.534349E-08  0.493E-04    1.16      39.0  T
   6    -45.1926016 -0.229375E-08  0.200E-04    1.16      96.3  T
     SCC iter.                  ...        0 min,  0.008 sec
     gradient                   ...        0 min,  0.017 sec
 * total energy  :   -44.6435182 Eh     change       -0.2609729E-05 Eh
   gradient norm :     0.0005630 Eh/α   predicted    -0.1861050E-05 ( -28.69%)
   displ. norm   :     0.0131555 α      lambda       -0.1551962E-05
   maximum displ.:     0.0111373 α      in ANC's #1, #13, #4, ...

   *** GEOMETRY OPTIMIZATION CONVERGED AFTER 28 ITERATIONS ***

------------------------------------------------------------------------
 total energy gain   :        -0.0117025 Eh       -7.3434 kcal/mol
 total RMSD          :         0.4145225 a0        0.2194 Å
 total power (kW/mol):        -1.0973146 (step)  -28.9175 (real)
------------------------------------------------------------------------

 ANCopt (total)                0 d,  0 h,  0 min,  1.063 sec
 optimizer setup                ...        0 min,  0.000 sec (  0.014%)
 model hessian                  ...        0 min,  0.024 sec (  2.296%)
 ANC generation                 ...        0 min,  0.002 sec (  0.146%)
 coordinate transformation      ...        0 min,  0.001 sec (  0.051%)
 single point calculation       ...        0 min,  1.025 sec ( 96.422%)
 optimization log               ...        0 min,  0.003 sec (  0.288%)
 hessian update                 ...        0 min,  0.000 sec (  0.036%)
 rational function              ...        0 min,  0.006 sec (  0.584%)

================
 final structure:
================
$coord
    2.94374462159437    2.19735092482621    0.07719555984318      C 
    5.26838939274884   -0.06827455619792    0.07243153416871      S 
    3.06233484788490   -2.42390003598812   -0.17478825368586      C 
    0.66180249718809   -1.49498486691618   -0.24594258885302      C 
    0.58949158666234    1.18835163246707   -0.11680750328177      C 
   -1.83609257437307    2.65641262078753   -0.09025374452808      C 
   -3.95776507227316    1.05087106860368   -1.26580680239872      C 
   -4.08620612685325   -1.58304984436039   -0.09145428833163      C 
   -1.66708940000709   -3.09286196330816   -0.50620054459662      C 
   -1.56485408521752   -4.21297924615895   -3.10300815097916      N 
   -2.93408316066413   -3.36197105878012   -4.70844113144236      O 
   -0.05270673499486   -5.89260543746916   -3.40754308267574      O 
   -2.36200177818803    3.44411136964684    2.47719584344991      N 
   -4.09018992168966    5.32859704307394    2.95493367196684      C 
   -5.35173804144985    5.61720205237807    5.10421393134127      C 
    3.44282170545238    4.15354281582756    0.22479581758687      H 
    3.64653667124235   -4.36015729736318   -0.28671132132165      H 
   -1.60818047931558    4.38750769242323   -1.20743526995762      H 
   -3.64168238230617    0.88268180860029   -3.29468612055536      H 
   -5.75858193272778    2.01237199858311   -0.97240036364882      H 
   -5.67438154263596   -2.61473681871966   -0.90921246693444      H 
   -4.41487976528411   -1.42565673202110    1.93967991366195      H 
   -1.55279831897486   -4.71458889915238    0.77633651308054      H 
   -2.34374609636705    2.03830017281955    3.76924435120145      H 
   -4.27440923223300    6.68215935164486    1.43376703409523      H 
   -5.17684637698413    4.28981101687797    6.63678608637989      H 
   -6.55413469475993    7.22074148901048    5.41106659327420      H 
$end
           -------------------------------------------------
          |                Final Singlepoint                |
           -------------------------------------------------

          ...................................................
          :                      SETUP                      :
          :.................................................:
          :  # basis functions                  78          :
          :  # atomic orbitals                  77          :
          :  # shells                           43          :
          :  # electrons                        80          :
          :  max. iterations                   250          :
          :  Hamiltonian                  GFN2-xTB          :
          :  restarted?                      false          :
          :  GBSA solvation                  false          :
          :  PC potential                    false          :
          :  electronic temp.          300.0000000     K    :
          :  accuracy                    1.0000000          :
          :  -> integral cutoff          0.2500000E+02      :
          :  -> integral neglect         0.1000000E-07      :
          :  -> SCF convergence          0.1000000E-05 Eh   :
          :  -> wf. convergence          0.1000000E-03 e    :
          :  Broyden damping             0.4000000          :
          ...................................................

 iter      E             dE          RMSdq      gap      omega  full diag
   1    -45.1926016 -0.451926E+02  0.973E-05    1.16       0.0  T
   2    -45.1926016 -0.303828E-10  0.663E-05    1.16     290.2  T
   3    -45.1926016 -0.105636E-09  0.293E-05    1.16     656.5  T

   *** convergence criteria satisfied after 3 iterations ***

         #    Occupation            Energy/Eh            Energy/eV
      -------------------------------------------------------------
         1        2.0000           -0.7829902             -21.3062
       ...           ...                  ...                  ...
        34        2.0000           -0.4536700             -12.3450
        35        2.0000           -0.4442605             -12.0889
        36        2.0000           -0.4417726             -12.0212
        37        2.0000           -0.4372705             -11.8987
        38        2.0000           -0.4102327             -11.1630
        39        2.0000           -0.4091274             -11.1329
        40        2.0000           -0.3546321              -9.6500 (HOMO)
        41                         -0.3119340              -8.4882 (LUMO)
        42                         -0.2625759              -7.1451
        43                         -0.2153246              -5.8593
        44                         -0.1984633              -5.4005
        45                         -0.1808170              -4.9203
       ...                                ...                  ...
        77                          0.6668017              18.1446
      -------------------------------------------------------------
                  HL-Gap            0.0426981 Eh            1.1619 eV
             Fermi-level           -0.3332831 Eh           -9.0691 eV

 SCC (total)                   0 d,  0 h,  0 min,  0.033 sec
 SCC setup                      ...        0 min,  0.000 sec (  0.656%)
 Dispersion                     ...        0 min,  0.000 sec (  0.706%)
 integral evaluation            ...        0 min,  0.011 sec ( 31.979%)
 zeroth order Hamiltonian       ...        0 min,  0.000 sec (  0.596%)
 iterations                     ...        0 min,  0.005 sec ( 14.343%)
 molecular gradient             ...        0 min,  0.017 sec ( 50.477%)
 printout                       ...        0 min,  0.000 sec (  1.087%)

         :::::::::::::::::::::::::::::::::::::::::::::::::::::
         ::                     SUMMARY                     ::
         :::::::::::::::::::::::::::::::::::::::::::::::::::::
         :: total energy             -44.643518191925 Eh    ::
         :: gradient norm              0.000563582356 Eh/a0 ::
         :: HOMO-LUMO gap              1.161874294516 eV    ::
         ::.................................................::
         :: SCC energy               -45.192601617929 Eh    ::
         :: -> isotropic ES            0.054361550832 Eh    ::
         :: -> anisotropic ES          0.012398652402 Eh    ::
         :: -> anisotropic XC          0.013225690794 Eh    ::
         :: -> dispersion             -0.028875558801 Eh    ::
         :: repulsion energy           0.548809855646 Eh    ::
         :: add. restraining           0.000000000000 Eh    ::
         :::::::::::::::::::::::::::::::::::::::::::::::::::::

           -------------------------------------------------
          |                Property Printout                |
           -------------------------------------------------

    * Orbital Energies and Occupations

         #    Occupation            Energy/Eh            Energy/eV
      -------------------------------------------------------------
         1        2.0000           -0.7829902             -21.3062
       ...           ...                  ...                  ...
        28        2.0000           -0.4851510             -13.2016
        29        2.0000           -0.4793830             -13.0447
        30        2.0000           -0.4749227             -12.9233
        31        2.0000           -0.4670818             -12.7099
        32        2.0000           -0.4649053             -12.6507
        33        2.0000           -0.4598744             -12.5138
        34        2.0000           -0.4536700             -12.3450
        35        2.0000           -0.4442605             -12.0889
        36        2.0000           -0.4417726             -12.0212
        37        2.0000           -0.4372705             -11.8987
        38        2.0000           -0.4102327             -11.1630
        39        2.0000           -0.4091274             -11.1329
        40        2.0000           -0.3546321              -9.6500 (HOMO)
        41                         -0.3119340              -8.4882 (LUMO)
        42                         -0.2625759              -7.1451
        43                         -0.2153246              -5.8593
        44                         -0.1984633              -5.4005
        45                         -0.1808170              -4.9203
        46                         -0.1288505              -3.5062
        47                         -0.0383905              -1.0447
        48                         -0.0156482              -0.4258
        49                          0.0159262               0.4334
        50                          0.0187603               0.5105
        51                          0.0332654               0.9052
       ...                                ...                  ...
        77                          0.6668017              18.1446
      -------------------------------------------------------------
                  HL-Gap            0.0426981 Eh            1.1619 eV
             Fermi-level           -0.3332831 Eh           -9.0691 eV

     #   Z        covCN         q      C6AA      α(0)
     1   6 C      2.945    -0.032    28.789     8.800
     2  16 S      2.306     0.017   140.364    19.940
     3   6 C      2.938    -0.034    28.842     8.808
     4   6 C      3.184    -0.014    27.913     8.622
     5   6 C      3.169    -0.014    27.994     8.644
     6   6 C      3.795     0.044    19.837     6.342
     7   6 C      3.806    -0.072    21.865     6.657
     8   6 C      3.805    -0.057    21.592     6.615
     9   6 C      3.791    -0.016    20.876     6.507
    10   7 N      2.757     0.545    13.534     5.464
    11   8 O      0.927    -0.366    20.983     6.143
    12   8 O      0.928    -0.380    21.246     6.182
    13   7 N      2.691    -0.192    25.167     7.451
    14   6 C      2.824     0.024    27.449     8.585
    15   6 C      2.839    -0.141    31.608     9.213
    16   1 H      0.926     0.056     2.245     2.343
    17   1 H      0.926     0.065     2.136     2.285
    18   1 H      0.924     0.048     2.341     2.393
    19   1 H      0.924     0.062     2.173     2.305
    20   1 H      0.924     0.047     2.362     2.404
    21   1 H      0.924     0.058     2.223     2.332
    22   1 H      0.924     0.050     2.322     2.383
    23   1 H      0.924     0.075     2.036     2.231
    24   1 H      0.860     0.149     1.408     1.859
    25   1 H      0.925     0.028     2.614     2.528
    26   1 H      0.926     0.020     2.729     2.583
    27   1 H      0.926     0.029     2.604     2.523

 Mol. C6AA /au·bohr⁶  :       9605.095465
 Mol. C8AA /au·bohr⁸  :     248039.869421
 Mol. α(0) /au        :        152.143605


Wiberg/Mayer (AO) data.
largest (>0.10) Wiberg bond orders for each atom
          total WBO             WBO to atom ...
     1  C   3.949        C    5 1.601    S    2 1.201    H   16 0.969    C    3 0.114
     2  S   2.661        C    3 1.214    C    1 1.201
     3  C   3.951        C    4 1.584    S    2 1.214    H   17 0.967    C    1 0.114
     4  C   3.975        C    3 1.584    C    5 1.227    C    9 0.976
     5  C   3.984        C    1 1.601    C    4 1.227    C    6 0.989
     6  C   3.982        N   13 0.990    C    5 0.989    C    7 0.977    H   18 0.955
     7  C   3.994        C    8 1.009    C    6 0.977    H   20 0.974    H   19 0.971
     8  C   3.992        C    7 1.009    C    9 0.998    H   22 0.970    H   21 0.970
     9  C   3.967        C    8 0.998    C    4 0.976    H   23 0.948    N   10 0.878
    10  N   3.904        O   11 1.489    O   12 1.481    C    9 0.878
    11  O   1.964        N   10 1.489    O   12 0.369
    12  O   1.951        N   10 1.481    O   11 0.369
    13  N   3.313        C   14 1.148    C    6 0.990    H   24 0.945    C   15 0.147
    14  C   3.970        C   15 1.837    N   13 1.148    H   25 0.961
    15  C   3.970        C   14 1.837    H   27 0.978    H   26 0.977    N   13 0.147
    16  H   0.996        C    1 0.969
    17  H   0.995        C    3 0.967
    18  H   0.997        C    6 0.955
    19  H   0.996        C    7 0.971
    20  H   0.997        C    7 0.974
    21  H   0.996        C    8 0.970
    22  H   0.998        C    8 0.970
    23  H   0.994        C    9 0.948
    24  H   0.978        N   13 0.945
    25  H   0.999        C   14 0.961
    26  H   1.000        C   15 0.977
    27  H   0.998        C   15 0.978

molecular dipole:
                 x           y           z       tot (Debye)
 q only:        0.118       0.567       0.992
   full:       -0.217       0.388       1.052       2.903
molecular quadrupole (traceless):
                xx          xy          yy          xz          yz          zz
 q only:        7.505       2.825      -2.118      -0.764     -13.679      -5.387
  q+dip:        4.941       3.735       0.093      -2.582     -16.046      -5.034
   full:        4.939       4.146      -0.018      -2.377     -15.812      -4.922

           -------------------------------------------------
          |                Geometry Summary                 |
           -------------------------------------------------

      molecular mass/u    :      224.2770000
   center of mass at/Å    :       -0.3137975      -0.0681785      -0.1294484
  moments of inertia/u·Å² :        0.6965017E+03   0.1151986E+04   0.1686897E+04
rotational constants/cm⁻¹ :        0.2420329E-01   0.1463354E-01   0.9993280E-02

 * 25 selected distances

     #   Z        #   Z                                     value/Å
     1   6 C      2  16 S                                 1.7177533 (max)
     2  16 S      3   6 C                                 1.7128321
     3   6 C      4   6 C                                 1.3626188
     1   6 C      5   6 C                                 1.3592981
     4   6 C      5   6 C                                 1.4221189
     6   6 C      7   6 C                                 1.5392768
     7   6 C      8   6 C                                 1.5275855
     8   6 C      9   6 C                                 1.5248822
    10   7 N     11   8 O                                 1.2039705
    10   7 N     12   8 O                                 1.2067650
     6   6 C     13   7 N                                 1.4481337
    13   7 N     14   6 C                                 1.3764870
    14   6 C     15   6 C                                 1.3276131
     1   6 C     16   1 H                                 1.0711822
     3   6 C     17   1 H                                 1.0718826
     6   6 C     18   1 H                                 1.0969078
     7   6 C     19   1 H                                 1.0902268
     7   6 C     20   1 H                                 1.0913776
     8   6 C     21   1 H                                 1.0916207
     8   6 C     22   1 H                                 1.0919923
     9   6 C     23   1 H                                 1.0957882
    13   7 N     24   1 H                                 1.0104415 (min)
    14   6 C     25   1 H                                 1.0819075
    15   6 C     26   1 H                                 1.0768896
    15   6 C     27   1 H                                 1.0729720

 * 6 distinct bonds (by element types)

   Z      Z             #   av. dist./Å        max./Å        min./Å
   1 H    6 C          11     1.0847952     1.0969078     1.0711822
   6 C    6 C           7     1.4376276     1.5392768     1.3276131
   1 H    7 N           1     1.0104415     1.0104415     1.0104415
   6 C    7 N           2     1.4123103     1.4481337     1.3764870
   7 N    8 O           2     1.2053677     1.2067650     1.2039705
   6 C   16 S           2     1.7152927     1.7177533     1.7128321


optimized geometry written to: xtbopt.xyz


           -------------------------------------------------
          | TOTAL ENERGY              -44.643518191925 Eh   |
          | GRADIENT NORM               0.000563582356 Eh/α |
          | HOMO-LUMO GAP               1.161874294516 eV   |
           -------------------------------------------------

------------------------------------------------------------------------
 * finished run on 2021/05/19 at 11:00:19.437     
------------------------------------------------------------------------
 total:
 * wall-time:     0 d,  0 h,  0 min,  1.167 sec
 *  cpu-time:     0 d,  0 h,  0 min,  1.163 sec
 * ratio c/w:     0.997 speedup
 SCF:
 * wall-time:     0 d,  0 h,  0 min,  0.047 sec
 *  cpu-time:     0 d,  0 h,  0 min,  0.047 sec
 * ratio c/w:     0.998 speedup
 ANC optimizer:
 * wall-time:     0 d,  0 h,  0 min,  1.097 sec
 *  cpu-time:     0 d,  0 h,  0 min,  1.094 sec
 * ratio c/w:     0.998 speedup

