      -----------------------------------------------------------      
     |                   =====================                   |     
     |                           x T B                           |     
     |                   =====================                   |     
     |                         S. Grimme                         |     
     |          Mulliken Center for Theoretical Chemistry        |     
     |                    University of Bonn                     |     
     |                Version 6.2 RC2 (SAW190805)                |     
      -----------------------------------------------------------      

   This program is distributed in the hope that it will be useful,
   but WITHOUT ANY WARRANTY; without even the implied warranty of
   MERCHANTABILITY or FITNESS FOR A PARTICULAR PURPOSE.
   
   FOR NON-COMMERCIAL, ACADEMIA USE ONLY.
   
   Cite this work as:
   * S. Grimme, C. Bannwarth, P. Shushkov, J. Chem. Theory Comput., 2017,
     13, 1989-2009. DOI: 10.1021/acs.jctc.7b00118
   * C. Bannwarth, S. Ehlert and S. Grimme., J. Chem. Theory Comput., 2019,
     15, 1652-1671. DOI: 10.1021/acs.jctc.8b01176
   * P. Pracht, E. Caldeweyher, S. Ehlert, S. Grimme, ChemRxiv, 2019, preprint.
     DOI: 10.26434/chemrxiv.8326202.v1
   
   for DFT-D4:
   * E. Caldeweyher, C. Bannwarth and S. Grimme, J. Chem. Phys., 2017,
     147, 034112. DOI: 10.1063/1.4993215
   * E. Caldeweyher, S. Ehlert, A. Hansen, H. Neugebauer, S. Spicher,
     C. Bannwarth and S. Grimme, J. Chem. Phys., 2019, 150, 154122.
     DOI: 10.1063/1.5090222
   
   for sTDA-xTB:
   * S. Grimme and C. Bannwarth, J. Chem. Phys., 2016, 145, 054103.
     DOI: 10.1063/1.4959605
   
   in the mass-spec context:
   * V. Asgeirsson, C. Bauer and S. Grimme, Chem. Sci., 2017, 8, 4879.
     DOI: 10.1039/c7sc00601b
   
   for metadynamics refer to:
   * S. Grimme, J. Chem. Theory Comput., 2019, 155, 2847-2862
     DOI: 10.1021/acs.jctc.9b00143
   
   with help from (in alphabetical order)
   C. Bannwarth, F. Bohle, G. Brandenburg, E. Caldeweyher, M. Checinski,
   S. Dohm, S. Ehlert, S. Ehrlich, F. März, H. Neugebauer, J. Pisarek,
   P. Pracht, P. Shushkov, and S. Spicher.
   
 * started run on 2021/05/19 at 11:00:19.455     

           -------------------------------------------------
          |                Calculation Setup                |
           -------------------------------------------------

          program call               : /ihome/ghutchison/geoffh/xtb/xtb 699.xyz -opt
          hostname                   : smp-n144
          coordinate file            : 699.xyz
          omp threads                :                     1
          number of atoms            :                    22
          number of electrons        :                    66
          charge                     :                     0
          spin                       :                   0.0
          first test random number   :      0.80370215806862


########################################################################
# WARNING! Please study the warnings concerning your input carefully
#  - the use of '-opt' is discouraged, please use '--opt' next time
########################################################################

           ------------------------------------------------- 
          |                 G F N 2 - x T B                 |
          | Geometry, Frequencies, Noncovalent interactions |
          |            JCTC 2019 parametrisation            |
           ------------------------------------------------- 
             KAB for C  - Si     :                1.0500
             KAB for H  - Pd     :                0.9500
             k(s)              :                1.8500
             k(p)              :                2.2300
             k(d)              :                2.2300
             k(f)              :                2.0000
             kEN (H0ij)        :               -2.0000
             D4 a1             :                0.5200
             D4 a2             :                5.0000
             D4 s6             :                1.0000
             D4 s8             :                2.7000
             D4 s9             :                5.0000
             alphaj            :                2.0000

  Z AO/shell   Hii/eV     exponent
  1     Wed Apr 25 08:07:45 CEST 2018   EN: 2.200 GM2: 0.406  GM3: 0.0800  RAES: 1.40
     1s    -10.707211    1.230000
  6     Wed Apr 25 08:07:45 CEST 2018   EN: 2.550 GM2: 0.538  GM3: 0.1500  RAES: 3.00
     2s    -13.970922    2.096432
     2p    -10.063292    1.800000
  8     Wed Apr 25 08:07:45 CEST 2018   EN: 3.440 GM2: 0.452  GM3:-0.0517  RAES: 1.80
     2s    -20.229985    2.439742
     2p    -15.503117    2.137023
 16     Tue Apr 24 11:44:34 CEST 2018   EN: 2.580 GM2: 0.340  GM3:-0.0502  RAES: 3.10
     3s    -20.029654    1.981333
     3p    -11.377694    2.025643
     3d     -0.420282    1.702555

           ------------------------------------------------- 
          |        Self-Consistent Charge Iterations        |
           ------------------------------------------------- 

          ...................................................
          :                      SETUP                      :
          :.................................................:
          :  # basis functions                  70          :
          :  # atomic orbitals                  68          :
          :  # shells                           36          :
          :  # electrons                        66          :
          :  max. iterations                   250          :
          :  Hamiltonian                  GFN2-xTB          :
          :  restarted?                      false          :
          :  GBSA solvation                  false          :
          :  PC potential                    false          :
          :  electronic temp.          300.0000000     K    :
          :  accuracy                    1.0000000          :
          :  -> integral cutoff          0.2500000E+02      :
          :  -> integral neglect         0.1000000E-07      :
          :  -> SCF convergence          0.1000000E-05 Eh   :
          :  -> wf. convergence          0.1000000E-03 e    :
          :  Broyden damping             0.4000000          :
          ...................................................

 iter      E             dE          RMSdq      gap      omega  full diag
   1    -37.1610871 -0.371611E+02  0.484E+00    3.55       0.0  T
   2    -37.2022407 -0.411535E-01  0.272E+00    3.52       1.0  T
   3    -37.1966698  0.557090E-02  0.108E+00    3.30       1.0  T
   4    -37.2052582 -0.858844E-02  0.471E-01    3.35       1.0  T
   5    -37.2072122 -0.195399E-02  0.216E-01    3.29       1.0  T
   6    -37.2072926 -0.803509E-04  0.875E-02    3.31       1.0  T
   7    -37.2073721 -0.795527E-04  0.347E-02    3.32       1.0  T
   8    -37.2073776 -0.548767E-05  0.206E-02    3.32       1.0  T
   9    -37.2073798 -0.222306E-05  0.601E-03    3.32       3.5  T
  10    -37.2073799 -0.103191E-06  0.219E-03    3.32       9.7  T
  11    -37.2073799 -0.739054E-08  0.110E-03    3.32      19.4  T
  12    -37.2073799 -0.139768E-08  0.375E-04    3.32      56.9  T
  13    -37.2073799 -0.275826E-09  0.178E-04    3.32     119.6  T

   *** convergence criteria satisfied after 13 iterations ***

         #    Occupation            Energy/Eh            Energy/eV
      -------------------------------------------------------------
         1        2.0000           -0.7350322             -20.0012
       ...           ...                  ...                  ...
        27        2.0000           -0.4601723             -12.5219
        28        2.0000           -0.4568856             -12.4325
        29        2.0000           -0.4519782             -12.2990
        30        2.0000           -0.4326603             -11.7733
        31        2.0000           -0.3890827             -10.5875
        32        2.0000           -0.3772977             -10.2668
        33        2.0000           -0.3705381             -10.0829 (HOMO)
        34                         -0.2485633              -6.7638 (LUMO)
        35                         -0.2133398              -5.8053
        36                         -0.2061331              -5.6092
        37                         -0.1689762              -4.5981
        38                         -0.1482347              -4.0337
       ...                                ...                  ...
        68                          0.6760088              18.3951
      -------------------------------------------------------------
                  HL-Gap            0.1219747 Eh            3.3191 eV
             Fermi-level           -0.3095507 Eh           -8.4233 eV

 SCC (total)                   0 d,  0 h,  0 min,  0.039 sec
 SCC setup                      ...        0 min,  0.000 sec (  0.761%)
 Dispersion                     ...        0 min,  0.000 sec (  0.715%)
 integral evaluation            ...        0 min,  0.009 sec ( 23.284%)
 zeroth order Hamiltonian       ...        0 min,  0.000 sec (  0.491%)
 iterations                     ...        0 min,  0.015 sec ( 38.093%)
 molecular gradient             ...        0 min,  0.014 sec ( 35.542%)
 printout                       ...        0 min,  0.000 sec (  0.979%)

         :::::::::::::::::::::::::::::::::::::::::::::::::::::
         ::                     SUMMARY                     ::
         :::::::::::::::::::::::::::::::::::::::::::::::::::::
         :: total energy             -36.834692759991 Eh    ::
         :: gradient norm              0.055725350813 Eh/a0 ::
         :: HOMO-LUMO gap              3.319100664488 eV    ::
         ::.................................................::
         :: SCC energy               -37.207379943951 Eh    ::
         :: -> isotropic ES            0.033966547259 Eh    ::
         :: -> anisotropic ES          0.001149726979 Eh    ::
         :: -> anisotropic XC          0.011061280523 Eh    ::
         :: -> dispersion             -0.022849436634 Eh    ::
         :: repulsion energy           0.372512330995 Eh    ::
         :: add. restraining           0.000000000000 Eh    ::
         :::::::::::::::::::::::::::::::::::::::::::::::::::::

      ----------------------------------------------------------- 
     |                   =====================                   |
     |                        A N C O P T                        |
     |                   =====================                   |
     |               Approximate Normal Coordinate               |
     |                Rational Function Optimizer                |
      ----------------------------------------------------------- 

          ...................................................
          :                      SETUP                      :
          :.................................................:
          :   optimization level            normal          :
          :   max. optcycles                   200          :
          :   ANC micro-cycles                  20          :
          :   degrees of freedom                60          :
          :.................................................:
          :   RF solver                   davidson          :
          :   input Hessian                  false          :
          :   write xtbopt.log                true          :
          :   linear?                        false          :
          :   energy convergence         0.5000000E-05 Eh   :
          :   grad. convergence          0.1000000E-02 Eh/α :
          :   maximium RF displ.         2.0000000          :
          :   Hlow (freq-cutoff)         0.5000000E-02      :
          :   Hmax (freq-cutoff)         5.0000000          :
          :   S6 in model hess.         20.0000000          :
          ...................................................

generating ANC from model Hessian ...
Using Lindh-Hessian (1995)
 Shifting diagonal of input Hessian by   4.053558238338155E-003
 Lowest  eigenvalues of input Hessian
   -0.000000   -0.000000   -0.000000    0.000000    0.000000    0.000000
    0.005000    0.006498    0.007155    0.009700    0.010466    0.014297
    0.016513    0.024494    0.025583    0.031274    0.036593    0.048347
 Highest eigenvalues
    1.414227    1.470074    1.548868    1.791318    2.017170    2.053930
 

........................................................................
.............................. CYCLE    1 ..............................
........................................................................
   1    -37.2073799 -0.372074E+02  0.457E-05    3.32       0.0  T
   2    -37.2073799 -0.579803E-11  0.250E-05    3.32     852.9  T
   3    -37.2073799 -0.390799E-12  0.177E-05    3.32    1205.0  T
     SCC iter.                  ...        0 min,  0.004 sec
     gradient                   ...        0 min,  0.014 sec
 * total energy  :   -36.8346928 Eh     change       -0.3633325E-08 Eh
   gradient norm :     0.0557258 Eh/α   predicted     0.0000000E+00 (-100.00%)
   displ. norm   :     0.2808617 α      lambda       -0.6792579E-02
   maximum displ.:     0.1169491 α      in ANC's #6, #10, #13, ...

........................................................................
.............................. CYCLE    2 ..............................
........................................................................
   1    -37.2192362 -0.372192E+02  0.476E-01    3.35       0.0  T
   2    -37.2193521 -0.115908E-03  0.233E-01    3.32       1.0  T
   3    -37.2192822  0.699032E-04  0.826E-02    3.32       1.0  T
   4    -37.2193933 -0.111022E-03  0.325E-02    3.31       1.0  T
   5    -37.2193951 -0.183209E-05  0.127E-02    3.31       1.7  T
   6    -37.2193965 -0.143753E-05  0.499E-03    3.31       4.3  T
   7    -37.2193967 -0.181092E-06  0.296E-03    3.31       7.2  T
     SCC iter.                  ...        0 min,  0.008 sec
     gradient                   ...        0 min,  0.013 sec
 * total energy  :   -36.8388511 Eh     change       -0.4158324E-02 Eh
   gradient norm :     0.0244685 Eh/α   predicted    -0.3664201E-02 ( -11.88%)
   displ. norm   :     0.1538402 α      lambda       -0.1210602E-02
   maximum displ.:     0.0637604 α      in ANC's #8, #6, #3, ...

........................................................................
.............................. CYCLE    3 ..............................
........................................................................
   1    -37.2245915 -0.372246E+02  0.158E-01    3.34       0.0  T
   2    -37.2246113 -0.197719E-04  0.869E-02    3.31       1.0  T
   3    -37.2245917  0.195265E-04  0.462E-02    3.30       1.0  T
   4    -37.2246225 -0.307212E-04  0.141E-02    3.29       1.5  T
   5    -37.2246231 -0.610528E-06  0.715E-03    3.29       3.0  T
   6    -37.2246234 -0.287637E-06  0.301E-03    3.29       7.1  T
   7    -37.2246234 -0.719480E-07  0.172E-03    3.29      12.4  T
     SCC iter.                  ...        0 min,  0.008 sec
     gradient                   ...        0 min,  0.013 sec
 * total energy  :   -36.8395903 Eh     change       -0.7391651E-03 Eh
   gradient norm :     0.0083742 Eh/α   predicted    -0.6196264E-03 ( -16.17%)
   displ. norm   :     0.1016741 α      lambda       -0.2126854E-03
   maximum displ.:     0.0729616 α      in ANC's #3, #4, #5, ...

........................................................................
.............................. CYCLE    4 ..............................
........................................................................
   1    -37.2250727 -0.372251E+02  0.894E-02    3.30       0.0  T
   2    -37.2250770 -0.423944E-05  0.502E-02    3.29       1.0  T
   3    -37.2250704  0.656000E-05  0.257E-02    3.28       1.0  T
   4    -37.2250792 -0.877157E-05  0.793E-03    3.28       2.7  T
   5    -37.2250794 -0.230100E-06  0.383E-03    3.28       5.6  T
   6    -37.2250795 -0.858860E-07  0.153E-03    3.28      14.0  T
   7    -37.2250795 -0.174217E-07  0.867E-04    3.28      24.6  T
     SCC iter.                  ...        0 min,  0.008 sec
     gradient                   ...        0 min,  0.013 sec
 * total energy  :   -36.8397376 Eh     change       -0.1473361E-03 Eh
   gradient norm :     0.0033648 Eh/α   predicted    -0.1074684E-03 ( -27.06%)
   displ. norm   :     0.1093043 α      lambda       -0.1037026E-03
   maximum displ.:     0.0895595 α      in ANC's #3, #4, #5, ...

........................................................................
.............................. CYCLE    5 ..............................
........................................................................
   1    -37.2245055 -0.372245E+02  0.962E-02    3.29       0.0  T
   2    -37.2245085 -0.299406E-05  0.521E-02    3.28       1.0  T
   3    -37.2245038  0.471691E-05  0.216E-02    3.27       1.0  T
   4    -37.2245098 -0.600786E-05  0.769E-03    3.27       2.8  T
   5    -37.2245100 -0.194289E-06  0.245E-03    3.27       8.7  T
   6    -37.2245100 -0.410648E-07  0.927E-04    3.27      23.0  T
   7    -37.2245100 -0.317578E-08  0.520E-04    3.27      41.0  T
     SCC iter.                  ...        0 min,  0.008 sec
     gradient                   ...        0 min,  0.014 sec
 * total energy  :   -36.8398114 Eh     change       -0.7378832E-04 Eh
   gradient norm :     0.0026848 Eh/α   predicted    -0.5247113E-04 ( -28.89%)
   displ. norm   :     0.0868732 α      lambda       -0.5241280E-04
   maximum displ.:     0.0758212 α      in ANC's #3, #4, #5, ...

........................................................................
.............................. CYCLE    6 ..............................
........................................................................
   1    -37.2241283 -0.372241E+02  0.737E-02    3.28       0.0  T
   2    -37.2241297 -0.131706E-05  0.399E-02    3.27       1.0  T
   3    -37.2241279  0.171879E-05  0.134E-02    3.27       1.6  T
   4    -37.2241302 -0.220669E-05  0.540E-03    3.27       3.9  T
   5    -37.2241303 -0.103984E-06  0.118E-03    3.27      18.1  T
   6    -37.2241303 -0.135475E-07  0.525E-04    3.27      40.6  T
   7    -37.2241303 -0.156823E-08  0.284E-04    3.27      75.0  T
     SCC iter.                  ...        0 min,  0.008 sec
     gradient                   ...        0 min,  0.014 sec
 * total energy  :   -36.8398538 Eh     change       -0.4245029E-04 Eh
   gradient norm :     0.0027545 Eh/α   predicted    -0.2640637E-04 ( -37.79%)
   displ. norm   :     0.0809161 α      lambda       -0.4522651E-04
   maximum displ.:     0.0725779 α      in ANC's #3, #5, #4, ...

........................................................................
.............................. CYCLE    7 ..............................
........................................................................
   1    -37.2241330 -0.372241E+02  0.686E-02    3.27       0.0  T
   2    -37.2241340 -0.102709E-05  0.370E-02    3.27       1.0  T
   3    -37.2241335  0.557934E-06  0.935E-03    3.27       2.3  T
   4    -37.2241343 -0.801209E-06  0.489E-03    3.27       4.4  T
   5    -37.2241344 -0.128508E-06  0.116E-03    3.27      18.4  T
   6    -37.2241344 -0.189729E-07  0.407E-04    3.27      52.4  T
   7    -37.2241344 -0.852189E-09  0.237E-04    3.27      89.9  T
     SCC iter.                  ...        0 min,  0.008 sec
     gradient                   ...        0 min,  0.014 sec
 * total energy  :   -36.8398927 Eh     change       -0.3890857E-04 Eh
   gradient norm :     0.0023727 Eh/α   predicted    -0.2276331E-04 ( -41.50%)
   displ. norm   :     0.0934520 α      lambda       -0.4781972E-04
   maximum displ.:     0.0857741 α      in ANC's #3, #5, #2, ...

........................................................................
.............................. CYCLE    8 ..............................
........................................................................
   1    -37.2242886 -0.372243E+02  0.758E-02    3.27       0.0  T
   2    -37.2242897 -0.116321E-05  0.412E-02    3.27       1.0  T
   3    -37.2242899 -0.181886E-06  0.753E-03    3.27       2.8  T
   4    -37.2242899  0.763569E-07  0.445E-03    3.28       4.8  T
   5    -37.2242901 -0.230089E-06  0.107E-03    3.28      19.9  T
   6    -37.2242901 -0.155607E-07  0.420E-04    3.28      50.8  T
   7    -37.2242901 -0.110717E-09  0.234E-04    3.28      91.0  T
     SCC iter.                  ...        0 min,  0.008 sec
     gradient                   ...        0 min,  0.014 sec
 * total energy  :   -36.8399344 Eh     change       -0.4167022E-04 Eh
   gradient norm :     0.0021002 Eh/α   predicted    -0.2412341E-04 ( -42.11%)
   displ. norm   :     0.1044045 α      lambda       -0.4687278E-04
   maximum displ.:     0.0968366 α      in ANC's #3, #2, #5, ...

........................................................................
.............................. CYCLE    9 ..............................
........................................................................
   1    -37.2244962 -0.372245E+02  0.796E-02    3.28       0.0  T
   2    -37.2244975 -0.123603E-05  0.437E-02    3.28       1.0  T
   3    -37.2244977 -0.199155E-06  0.778E-03    3.28       2.7  T
   4    -37.2244975  0.129905E-06  0.439E-03    3.28       4.9  T
   5    -37.2244978 -0.290867E-06  0.775E-04    3.28      27.5  T
   6    -37.2244978 -0.459205E-08  0.409E-04    3.28      52.1  T
     SCC iter.                  ...        0 min,  0.007 sec
     gradient                   ...        0 min,  0.014 sec
 * total energy  :   -36.8399748 Eh     change       -0.4040703E-04 Eh
   gradient norm :     0.0018500 Eh/α   predicted    -0.2369338E-04 ( -41.36%)
   displ. norm   :     0.1732178 α      lambda       -0.4290768E-04
   maximum displ.:     0.1622692 α      in ANC's #3, #2, #5, ...

........................................................................
.............................. CYCLE   10 ..............................
........................................................................
   1    -37.2245280 -0.372245E+02  0.124E-01    3.28       0.0  T
   2    -37.2245309 -0.289971E-05  0.686E-02    3.28       1.0  T
   3    -37.2245301  0.829917E-06  0.143E-02    3.28       1.5  T
   4    -37.2245312 -0.115272E-05  0.814E-03    3.28       2.6  T
   5    -37.2245319 -0.658049E-06  0.106E-03    3.28      20.1  T
   6    -37.2245319 -0.199593E-08  0.577E-04    3.28      37.0  T
   7    -37.2245319 -0.187789E-09  0.353E-04    3.28      60.3  T
     SCC iter.                  ...        0 min,  0.008 sec
     gradient                   ...        0 min,  0.014 sec
 * total energy  :   -36.8400220 Eh     change       -0.4716673E-04 Eh
   gradient norm :     0.0021703 Eh/α   predicted    -0.2174467E-04 ( -53.90%)
   displ. norm   :     0.1207217 α      lambda       -0.3154800E-04
   maximum displ.:     0.1132076 α      in ANC's #3, #2, #39, ...

........................................................................
.............................. CYCLE   11 ..............................
........................................................................
   1    -37.2246523 -0.372247E+02  0.831E-02    3.28       0.0  T
   2    -37.2246535 -0.120433E-05  0.459E-02    3.28       1.0  T
   3    -37.2246529  0.600563E-06  0.998E-03    3.28       2.1  T
   4    -37.2246537 -0.783294E-06  0.541E-03    3.28       3.9  T
   5    -37.2246539 -0.239366E-06  0.986E-04    3.28      21.6  T
   6    -37.2246539 -0.831231E-08  0.499E-04    3.28      42.7  T
     SCC iter.                  ...        0 min,  0.007 sec
     gradient                   ...        0 min,  0.014 sec
 * total energy  :   -36.8400457 Eh     change       -0.2370486E-04 Eh
   gradient norm :     0.0020454 Eh/α   predicted    -0.1600414E-04 ( -32.49%)
   displ. norm   :     0.1260189 α      lambda       -0.2689357E-04
   maximum displ.:     0.1195283 α      in ANC's #3, #39, #2, ...

........................................................................
.............................. CYCLE   12 ..............................
........................................................................
   1    -37.2247417 -0.372247E+02  0.795E-02    3.28       0.0  T
   2    -37.2247427 -0.933213E-06  0.443E-02    3.28       1.0  T
   3    -37.2247419  0.798472E-06  0.989E-03    3.28       2.2  T
   4    -37.2247428 -0.967869E-06  0.495E-03    3.28       4.3  T
   5    -37.2247430 -0.173220E-06  0.108E-03    3.28      19.7  T
   6    -37.2247430 -0.140839E-07  0.444E-04    3.28      48.1  T
   7    -37.2247430 -0.151631E-08  0.253E-04    3.28      84.1  T
     SCC iter.                  ...        0 min,  0.008 sec
     gradient                   ...        0 min,  0.014 sec
 * total energy  :   -36.8400645 Eh     change       -0.1882671E-04 Eh
   gradient norm :     0.0018993 Eh/α   predicted    -0.1366083E-04 ( -27.44%)
   displ. norm   :     0.1253198 α      lambda       -0.2119076E-04
   maximum displ.:     0.1159299 α      in ANC's #3, #39, #28, ...

........................................................................
.............................. CYCLE   13 ..............................
........................................................................
   1    -37.2254055 -0.372254E+02  0.672E-02    3.28       0.0  T
   2    -37.2254061 -0.582835E-06  0.386E-02    3.28       1.0  T
   3    -37.2254054  0.720176E-06  0.830E-03    3.28       2.6  T
   4    -37.2254062 -0.809476E-06  0.340E-03    3.28       6.3  T
   5    -37.2254063 -0.899088E-07  0.118E-03    3.28      18.1  T
   6    -37.2254063 -0.127414E-07  0.328E-04    3.28      65.1  T
   7    -37.2254063 -0.104081E-08  0.191E-04    3.28     111.6  T
     SCC iter.                  ...        0 min,  0.008 sec
     gradient                   ...        0 min,  0.014 sec
 * total energy  :   -36.8400832 Eh     change       -0.1871396E-04 Eh
   gradient norm :     0.0014834 Eh/α   predicted    -0.1067372E-04 ( -42.96%)
   displ. norm   :     0.2036690 α      lambda       -0.1944228E-04
   maximum displ.:     0.1905951 α      in ANC's #3, #39, #5, ...

........................................................................
.............................. CYCLE   14 ..............................
........................................................................
   1    -37.2233621 -0.372234E+02  0.105E-01    3.28       0.0  T
   2    -37.2233629 -0.783092E-06  0.611E-02    3.28       1.0  T
   3    -37.2233622  0.710246E-06  0.880E-03    3.27       2.4  T
   4    -37.2233630 -0.833379E-06  0.364E-03    3.27       5.9  T
   5    -37.2233631 -0.110009E-06  0.150E-03    3.27      14.2  T
   6    -37.2233632 -0.215001E-07  0.390E-04    3.27      54.7  T
   7    -37.2233632 -0.810360E-09  0.258E-04    3.27      82.7  T
     SCC iter.                  ...        0 min,  0.008 sec
     gradient                   ...        0 min,  0.014 sec
 * total energy  :   -36.8400572 Eh     change        0.2602049E-04 Eh
   gradient norm :     0.0053561 Eh/α   predicted    -0.9901841E-05 (-138.05%)
   displ. norm   :     0.0961480 α      lambda       -0.7162894E-04
   maximum displ.:     0.0896274 α      in ANC's #3, #2, #5, ...

........................................................................
.............................. CYCLE   15 ..............................
........................................................................
   1    -37.2246396 -0.372246E+02  0.662E-02    3.27       0.0  T
   2    -37.2246404 -0.869178E-06  0.365E-02    3.28       1.0  T
   3    -37.2246399  0.488131E-06  0.873E-03    3.27       2.4  T
   4    -37.2246406 -0.640219E-06  0.440E-03    3.28       4.8  T
   5    -37.2246407 -0.122882E-06  0.137E-03    3.27      15.6  T
   6    -37.2246407 -0.181792E-07  0.466E-04    3.27      45.8  T
     SCC iter.                  ...        0 min,  0.007 sec
     gradient                   ...        0 min,  0.013 sec
 * total energy  :   -36.8400994 Eh     change       -0.4217145E-04 Eh
   gradient norm :     0.0016326 Eh/α   predicted    -0.3615354E-04 ( -14.27%)
   displ. norm   :     0.0556973 α      lambda       -0.1128998E-04
   maximum displ.:     0.0386771 α      in ANC's #5, #2, #3, ...

........................................................................
.............................. CYCLE   16 ..............................
........................................................................
   1    -37.2251784 -0.372252E+02  0.572E-02    3.27       0.0  T
   2    -37.2251792 -0.856142E-06  0.310E-02    3.27       1.0  T
   3    -37.2251789  0.298538E-06  0.829E-03    3.27       2.6  T
   4    -37.2251794 -0.487328E-06  0.464E-03    3.27       4.6  T
   5    -37.2251795 -0.127216E-06  0.107E-03    3.27      19.9  T
   6    -37.2251795 -0.114677E-07  0.445E-04    3.27      47.9  T
   7    -37.2251795 -0.811617E-09  0.279E-04    3.27      76.5  T
     SCC iter.                  ...        0 min,  0.008 sec
     gradient                   ...        0 min,  0.014 sec
 * total energy  :   -36.8401080 Eh     change       -0.8584548E-05 Eh
   gradient norm :     0.0009154 Eh/α   predicted    -0.5654249E-05 ( -34.13%)
   displ. norm   :     0.0322077 α      lambda       -0.2771144E-05
   maximum displ.:     0.0208616 α      in ANC's #2, #5, #3, ...

........................................................................
.............................. CYCLE   17 ..............................
........................................................................
   1    -37.2251223 -0.372251E+02  0.246E-02    3.27       0.0  T
   2    -37.2251224 -0.121580E-06  0.136E-02    3.27       1.6  T
   3    -37.2251224  0.120188E-08  0.284E-03    3.27       7.5  T
   4    -37.2251224 -0.394500E-08  0.196E-03    3.27      10.9  T
   5    -37.2251225 -0.416707E-07  0.248E-04    3.27      86.1  T
   6    -37.2251225 -0.242743E-09  0.142E-04    3.27     150.4  T
     SCC iter.                  ...        0 min,  0.007 sec
     gradient                   ...        0 min,  0.014 sec
 * total energy  :   -36.8401111 Eh     change       -0.3098443E-05 Eh
   gradient norm :     0.0006761 Eh/α   predicted    -0.1388863E-05 ( -55.18%)
   displ. norm   :     0.0450444 α      lambda       -0.3137942E-05
   maximum displ.:     0.0256776 α      in ANC's #3, #2, #5, ...

   *** GEOMETRY OPTIMIZATION CONVERGED AFTER 17 ITERATIONS ***

------------------------------------------------------------------------
 total energy gain   :        -0.0054183 Eh       -3.4000 kcal/mol
 total RMSD          :         0.2867446 a0        0.1517 Å
 total power (kW/mol):        -0.8368084 (step)  -27.1865 (real)
------------------------------------------------------------------------

 ANCopt (total)                0 d,  0 h,  0 min,  0.523 sec
 optimizer setup                ...        0 min,  0.000 sec (  0.029%)
 model hessian                  ...        0 min,  0.005 sec (  1.039%)
 ANC generation                 ...        0 min,  0.001 sec (  0.120%)
 coordinate transformation      ...        0 min,  0.000 sec (  0.052%)
 single point calculation       ...        0 min,  0.511 sec ( 97.683%)
 optimization log               ...        0 min,  0.002 sec (  0.303%)
 hessian update                 ...        0 min,  0.000 sec (  0.042%)
 rational function              ...        0 min,  0.003 sec (  0.531%)

================
 final structure:
================
$coord
   -3.37228884761800    1.80181610298261    0.85718934370755      C 
   -5.20060312583495   -0.87190347492126    0.65821595030573      S 
   -2.67810063478397   -2.61420791673724   -0.36811889090854      C 
   -0.54189487845405   -1.19660762461277   -0.58930588172379      C 
   -0.93739640692867    1.38358302313498    0.13125746454413      C 
    0.78867135612579    3.29036889657288    0.14385692005707      O 
    3.33214029413789    2.62540859877273   -0.33415903053662      C 
    4.22115297058122    0.41500192689118    1.30585439691755      C 
    3.79748828886827   -2.11012540280500   -0.03106943207413      C 
    3.69583567450880   -4.63186197383362    2.38567002257657      S 
    3.67966155866921   -7.32387353752166    0.26667251851412      C 
    1.65694975524422   -2.19196378949766   -1.56459881732044      O 
   -4.17648333256301    3.55415057105709    1.46528766091711      H 
   -2.89147490215753   -4.57871314553343   -0.80396508891242      H 
    4.39482321018350    4.33737452698062    0.11136143906121      H 
    3.59209368669263    2.18117603953026   -2.34595869501535      H 
    3.16299502022215    0.44443752865771    3.07977348970275      H 
    6.22077982619670    0.59552123709406    1.75756256356231      H 
    5.36732010677146   -2.56638247066237   -1.29947810108164      H 
    3.24208018484433   -8.97406067618535    1.39867068722540      H 
    5.52991637500767   -7.52721373090783   -0.60104954608371      H 
    2.23309223881699   -7.02572019505718   -1.15698043885956      H 
$end
           -------------------------------------------------
          |                Final Singlepoint                |
           -------------------------------------------------

          ...................................................
          :                      SETUP                      :
          :.................................................:
          :  # basis functions                  70          :
          :  # atomic orbitals                  68          :
          :  # shells                           36          :
          :  # electrons                        66          :
          :  max. iterations                   250          :
          :  Hamiltonian                  GFN2-xTB          :
          :  restarted?                      false          :
          :  GBSA solvation                  false          :
          :  PC potential                    false          :
          :  electronic temp.          300.0000000     K    :
          :  accuracy                    1.0000000          :
          :  -> integral cutoff          0.2500000E+02      :
          :  -> integral neglect         0.1000000E-07      :
          :  -> SCF convergence          0.1000000E-05 Eh   :
          :  -> wf. convergence          0.1000000E-03 e    :
          :  Broyden damping             0.4000000          :
          ...................................................

 iter      E             dE          RMSdq      gap      omega  full diag
   1    -37.2251225 -0.372251E+02  0.432E-05    3.27       0.0  T
   2    -37.2251225 -0.102034E-10  0.226E-05    3.27     941.8  T
   3    -37.2251225 -0.243716E-11  0.165E-05    3.27    1294.1  T

   *** convergence criteria satisfied after 3 iterations ***

         #    Occupation            Energy/Eh            Energy/eV
      -------------------------------------------------------------
         1        2.0000           -0.7369175             -20.0525
       ...           ...                  ...                  ...
        27        2.0000           -0.4602087             -12.5229
        28        2.0000           -0.4538264             -12.3492
        29        2.0000           -0.4513885             -12.2829
        30        2.0000           -0.4285317             -11.6609
        31        2.0000           -0.3944991             -10.7349
        32        2.0000           -0.3795950             -10.3293
        33        2.0000           -0.3689396             -10.0394 (HOMO)
        34                         -0.2487076              -6.7677 (LUMO)
        35                         -0.2135173              -5.8101
        36                         -0.2093458              -5.6966
        37                         -0.1706565              -4.6438
        38                         -0.1468717              -3.9966
       ...                                ...                  ...
        68                          0.6797128              18.4959
      -------------------------------------------------------------
                  HL-Gap            0.1202320 Eh            3.2717 eV
             Fermi-level           -0.3088236 Eh           -8.4035 eV

 SCC (total)                   0 d,  0 h,  0 min,  0.027 sec
 SCC setup                      ...        0 min,  0.000 sec (  0.672%)
 Dispersion                     ...        0 min,  0.000 sec (  0.579%)
 integral evaluation            ...        0 min,  0.009 sec ( 31.635%)
 zeroth order Hamiltonian       ...        0 min,  0.000 sec (  0.606%)
 iterations                     ...        0 min,  0.004 sec ( 14.363%)
 molecular gradient             ...        0 min,  0.014 sec ( 50.709%)
 printout                       ...        0 min,  0.000 sec (  1.233%)

         :::::::::::::::::::::::::::::::::::::::::::::::::::::
         ::                     SUMMARY                     ::
         :::::::::::::::::::::::::::::::::::::::::::::::::::::
         :: total energy             -36.840111060931 Eh    ::
         :: gradient norm              0.000676696560 Eh/a0 ::
         :: HOMO-LUMO gap              3.271679069669 eV    ::
         ::.................................................::
         :: SCC energy               -37.225122474760 Eh    ::
         :: -> isotropic ES            0.034622882131 Eh    ::
         :: -> anisotropic ES          0.000217031053 Eh    ::
         :: -> anisotropic XC          0.010760052181 Eh    ::
         :: -> dispersion             -0.023142887310 Eh    ::
         :: repulsion energy           0.384838089374 Eh    ::
         :: add. restraining           0.000000000000 Eh    ::
         :::::::::::::::::::::::::::::::::::::::::::::::::::::

           -------------------------------------------------
          |                Property Printout                |
           -------------------------------------------------

    * Orbital Energies and Occupations

         #    Occupation            Energy/Eh            Energy/eV
      -------------------------------------------------------------
         1        2.0000           -0.7369175             -20.0525
       ...           ...                  ...                  ...
        21        2.0000           -0.5016058             -13.6494
        22        2.0000           -0.4939136             -13.4401
        23        2.0000           -0.4905563             -13.3487
        24        2.0000           -0.4793548             -13.0439
        25        2.0000           -0.4788782             -13.0309
        26        2.0000           -0.4717438             -12.8368
        27        2.0000           -0.4602087             -12.5229
        28        2.0000           -0.4538264             -12.3492
        29        2.0000           -0.4513885             -12.2829
        30        2.0000           -0.4285317             -11.6609
        31        2.0000           -0.3944991             -10.7349
        32        2.0000           -0.3795950             -10.3293
        33        2.0000           -0.3689396             -10.0394 (HOMO)
        34                         -0.2487076              -6.7677 (LUMO)
        35                         -0.2135173              -5.8101
        36                         -0.2093458              -5.6966
        37                         -0.1706565              -4.6438
        38                         -0.1468717              -3.9966
        39                         -0.1217160              -3.3121
        40                         -0.0296853              -0.8078
        41                         -0.0140603              -0.3826
        42                         -0.0096977              -0.2639
        43                          0.0080517               0.2191
        44                          0.0260046               0.7076
       ...                                ...                  ...
        68                          0.6797128              18.4959
      -------------------------------------------------------------
                  HL-Gap            0.1202320 Eh            3.2717 eV
             Fermi-level           -0.3088236 Eh           -8.4035 eV

     #   Z        covCN         q      C6AA      α(0)
     1   6 C      2.938    -0.061    29.509     8.909
     2  16 S      2.303    -0.006   141.308    20.007
     3   6 C      2.933    -0.047    29.161     8.856
     4   6 C      3.069     0.108    25.558     8.290
     5   6 C      3.053     0.115    25.424     8.269
     6   8 O      1.704    -0.273    18.533     5.812
     7   6 C      3.700     0.085    19.314     6.285
     8   6 C      3.839    -0.074    21.891     6.656
     9   6 C      3.744     0.164    18.034     6.058
    10  16 S      1.985    -0.231   150.947    20.678
    11   6 C      3.745    -0.045    21.459     6.608
    12   8 O      1.713    -0.292    18.848     5.862
    13   1 H      0.927     0.064     2.154     2.295
    14   1 H      0.927     0.063     2.159     2.298
    15   1 H      0.924     0.057     2.230     2.335
    16   1 H      0.923     0.041     2.432     2.439
    17   1 H      0.924     0.066     2.129     2.282
    18   1 H      0.925     0.052     2.301     2.372
    19   1 H      0.924     0.043     2.416     2.431
    20   1 H      0.925     0.063     2.162     2.299
    21   1 H      0.925     0.049     2.329     2.386
    22   1 H      0.925     0.060     2.201     2.320

 Mol. C6AA /au·bohr⁶  :       7472.476361
 Mol. C8AA /au·bohr⁸  :     218939.724018
 Mol. α(0) /au        :        135.747739


Wiberg/Mayer (AO) data.
largest (>0.10) Wiberg bond orders for each atom
          total WBO             WBO to atom ...
     1  C   3.931        C    5 1.552    S    2 1.177    H   13 0.969    C    3 0.114
     2  S   2.631        C    3 1.199    C    1 1.177
     3  C   3.944        C    4 1.569    S    2 1.199    H   14 0.969    C    1 0.114
     4  C   3.926        C    3 1.569    C    5 1.178    O   12 0.998
     5  C   3.936        C    1 1.552    C    4 1.178    O    6 1.051
     6  O   2.219        C    5 1.051    C    7 0.971
     7  C   3.948        C    8 0.996    O    6 0.971    H   15 0.970    H   16 0.967
     8  C   3.994        C    7 0.996    C    9 0.991    H   18 0.976    H   17 0.969
     9  C   3.943        O   12 0.995    C    8 0.991    H   19 0.961    S   10 0.935
    10  S   2.085        C   11 1.013    C    9 0.935
    11  C   3.976        S   10 1.013    H   21 0.985    H   22 0.982    H   20 0.980
    12  O   2.193        C    4 0.998    C    9 0.995
    13  H   0.996        C    1 0.969
    14  H   0.996        C    3 0.969
    15  H   0.996        C    7 0.970
    16  H   0.998        C    7 0.967
    17  H   0.996        C    8 0.969
    18  H   0.997        C    8 0.976
    19  H   0.997        C    9 0.961
    20  H   0.996        C   11 0.980
    21  H   0.998        C   11 0.985
    22  H   0.996        C   11 0.982

molecular dipole:
                 x           y           z       tot (Debye)
 q only:        0.385      -0.092      -0.184
   full:        0.842      -0.118      -0.642       2.709
molecular quadrupole (traceless):
                xx          xy          yy          xz          yz          zz
 q only:        4.176       1.428       1.394      -2.093       2.933      -5.570
  q+dip:        1.713       0.425       4.315      -4.297       5.696      -6.028
   full:        1.112       0.221       4.677      -3.872       5.519      -5.789

           -------------------------------------------------
          |                Geometry Summary                 |
           -------------------------------------------------

      molecular mass/u    :      202.2858000
   center of mass at/Å    :        0.2821687      -0.6877331       0.2389636
  moments of inertia/u·Å² :        0.4618943E+03   0.8596412E+03   0.1187710E+04
rotational constants/cm⁻¹ :        0.3649673E-01   0.1961008E-01   0.1419339E-01

 * 21 selected distances

     #   Z        #   Z                                     value/Å
     1   6 C      2  16 S                                 1.7172679 (max)
     2  16 S      3   6 C                                 1.7108070
     3   6 C      4   6 C                                 1.3617335
     1   6 C      5   6 C                                 1.3626286
     4   6 C      5   6 C                                 1.4329879
     5   6 C      6   8 O                                 1.3610560
     6   8 O      7   6 C                                 1.4139935
     7   6 C      8   6 C                                 1.5305838
     8   6 C      9   6 C                                 1.5285004
     4   6 C     12   8 O                                 1.3775743
     9   6 C     12   8 O                                 1.3940899
     1   6 C     13   1 H                                 1.0698269 (min)
     3   6 C     14   1 H                                 1.0708188
     7   6 C     15   1 H                                 1.0920315
     7   6 C     16   1 H                                 1.0988881
     8   6 C     17   1 H                                 1.0931518
     8   6 C     18   1 H                                 1.0890174
     9   6 C     19   1 H                                 1.0949498
    11   6 C     20   1 H                                 1.0839760
    11   6 C     21   1 H                                 1.0867775
    11   6 C     22   1 H                                 1.0855547

 * 4 distinct bonds (by element types)

   Z      Z             #   av. dist./Å        max./Å        min./Å
   1 H    6 C          10     1.0864993     1.0988881     1.0698269
   6 C    6 C           5     1.4432868     1.5305838     1.3617335
   6 C    8 O           4     1.3866784     1.4139935     1.3610560
   6 C   16 S           2     1.7140374     1.7172679     1.7108070


optimized geometry written to: xtbopt.xyz


           -------------------------------------------------
          | TOTAL ENERGY              -36.840111060931 Eh   |
          | GRADIENT NORM               0.000676696560 Eh/α |
          | HOMO-LUMO GAP               3.271679069669 eV   |
           -------------------------------------------------

------------------------------------------------------------------------
 * finished run on 2021/05/19 at 11:00:20.066     
------------------------------------------------------------------------
 total:
 * wall-time:     0 d,  0 h,  0 min,  0.611 sec
 *  cpu-time:     0 d,  0 h,  0 min,  0.608 sec
 * ratio c/w:     0.996 speedup
 SCF:
 * wall-time:     0 d,  0 h,  0 min,  0.039 sec
 *  cpu-time:     0 d,  0 h,  0 min,  0.039 sec
 * ratio c/w:     0.998 speedup
 ANC optimizer:
 * wall-time:     0 d,  0 h,  0 min,  0.551 sec
 *  cpu-time:     0 d,  0 h,  0 min,  0.550 sec
 * ratio c/w:     0.998 speedup

