      -----------------------------------------------------------      
     |                   =====================                   |     
     |                           x T B                           |     
     |                   =====================                   |     
     |                         S. Grimme                         |     
     |          Mulliken Center for Theoretical Chemistry        |     
     |                    University of Bonn                     |     
     |                Version 6.2 RC2 (SAW190805)                |     
      -----------------------------------------------------------      

   This program is distributed in the hope that it will be useful,
   but WITHOUT ANY WARRANTY; without even the implied warranty of
   MERCHANTABILITY or FITNESS FOR A PARTICULAR PURPOSE.
   
   FOR NON-COMMERCIAL, ACADEMIA USE ONLY.
   
   Cite this work as:
   * S. Grimme, C. Bannwarth, P. Shushkov, J. Chem. Theory Comput., 2017,
     13, 1989-2009. DOI: 10.1021/acs.jctc.7b00118
   * C. Bannwarth, S. Ehlert and S. Grimme., J. Chem. Theory Comput., 2019,
     15, 1652-1671. DOI: 10.1021/acs.jctc.8b01176
   * P. Pracht, E. Caldeweyher, S. Ehlert, S. Grimme, ChemRxiv, 2019, preprint.
     DOI: 10.26434/chemrxiv.8326202.v1
   
   for DFT-D4:
   * E. Caldeweyher, C. Bannwarth and S. Grimme, J. Chem. Phys., 2017,
     147, 034112. DOI: 10.1063/1.4993215
   * E. Caldeweyher, S. Ehlert, A. Hansen, H. Neugebauer, S. Spicher,
     C. Bannwarth and S. Grimme, J. Chem. Phys., 2019, 150, 154122.
     DOI: 10.1063/1.5090222
   
   for sTDA-xTB:
   * S. Grimme and C. Bannwarth, J. Chem. Phys., 2016, 145, 054103.
     DOI: 10.1063/1.4959605
   
   in the mass-spec context:
   * V. Asgeirsson, C. Bauer and S. Grimme, Chem. Sci., 2017, 8, 4879.
     DOI: 10.1039/c7sc00601b
   
   for metadynamics refer to:
   * S. Grimme, J. Chem. Theory Comput., 2019, 155, 2847-2862
     DOI: 10.1021/acs.jctc.9b00143
   
   with help from (in alphabetical order)
   C. Bannwarth, F. Bohle, G. Brandenburg, E. Caldeweyher, M. Checinski,
   S. Dohm, S. Ehlert, S. Ehrlich, F. März, H. Neugebauer, J. Pisarek,
   P. Pracht, P. Shushkov, and S. Spicher.
   
 * started run on 2021/05/19 at 11:00:03.989     

           -------------------------------------------------
          |                Calculation Setup                |
           -------------------------------------------------

          program call               : /ihome/ghutchison/geoffh/xtb/xtb 701.xyz -opt
          hostname                   : smp-n83
          coordinate file            : 701.xyz
          omp threads                :                     1
          number of atoms            :                    20
          number of electrons        :                    52
          charge                     :                     0
          spin                       :                   0.0
          first test random number   :      0.90517522764387


########################################################################
# WARNING! Please study the warnings concerning your input carefully
#  - the use of '-opt' is discouraged, please use '--opt' next time
########################################################################

           ------------------------------------------------- 
          |                 G F N 2 - x T B                 |
          | Geometry, Frequencies, Noncovalent interactions |
          |            JCTC 2019 parametrisation            |
           ------------------------------------------------- 
             KAB for C  - Si     :                1.0500
             KAB for H  - Pd     :                0.9500
             k(s)              :                1.8500
             k(p)              :                2.2300
             k(d)              :                2.2300
             k(f)              :                2.0000
             kEN (H0ij)        :               -2.0000
             D4 a1             :                0.5200
             D4 a2             :                5.0000
             D4 s6             :                1.0000
             D4 s8             :                2.7000
             D4 s9             :                5.0000
             alphaj            :                2.0000

  Z AO/shell   Hii/eV     exponent
  1     Wed Apr 25 08:07:45 CEST 2018   EN: 2.200 GM2: 0.406  GM3: 0.0800  RAES: 1.40
     1s    -10.707211    1.230000
  6     Wed Apr 25 08:07:45 CEST 2018   EN: 2.550 GM2: 0.538  GM3: 0.1500  RAES: 3.00
     2s    -13.970922    2.096432
     2p    -10.063292    1.800000
  8     Wed Apr 25 08:07:45 CEST 2018   EN: 3.440 GM2: 0.452  GM3:-0.0517  RAES: 1.80
     2s    -20.229985    2.439742
     2p    -15.503117    2.137023

           ------------------------------------------------- 
          |        Self-Consistent Charge Iterations        |
           ------------------------------------------------- 

          ...................................................
          :                      SETUP                      :
          :.................................................:
          :  # basis functions                  50          :
          :  # atomic orbitals                  50          :
          :  # shells                           30          :
          :  # electrons                        52          :
          :  max. iterations                   250          :
          :  Hamiltonian                  GFN2-xTB          :
          :  restarted?                      false          :
          :  GBSA solvation                  false          :
          :  PC potential                    false          :
          :  electronic temp.          300.0000000     K    :
          :  accuracy                    1.0000000          :
          :  -> integral cutoff          0.2500000E+02      :
          :  -> integral neglect         0.1000000E-07      :
          :  -> SCF convergence          0.1000000E-05 Eh   :
          :  -> wf. convergence          0.1000000E-03 e    :
          :  Broyden damping             0.4000000          :
          ...................................................

 iter      E             dE          RMSdq      gap      omega  full diag
   1    -28.8038212 -0.288038E+02  0.448E+00    2.89       0.0  T
   2    -28.8233265 -0.195053E-01  0.275E+00    2.89       1.0  T
   3    -28.8110018  0.123247E-01  0.107E+00    2.87       1.0  T
   4    -28.8263509 -0.153491E-01  0.344E-01    2.90       1.0  T
   5    -28.8275778 -0.122686E-02  0.867E-02    2.89       1.0  T
   6    -28.8276277 -0.499251E-04  0.612E-02    2.89       1.0  T
   7    -28.8276643 -0.365765E-04  0.240E-02    2.89       1.0  T
   8    -28.8276655 -0.122603E-05  0.102E-02    2.89       2.2  T
   9    -28.8276661 -0.610002E-06  0.385E-03    2.89       5.8  T
  10    -28.8276663 -0.157092E-06  0.133E-03    2.89      16.8  T
  11    -28.8276663 -0.760797E-08  0.667E-04    2.89      33.5  T
  12    -28.8276663 -0.139875E-08  0.188E-04    2.89     119.2  T

   *** convergence criteria satisfied after 12 iterations ***

         #    Occupation            Energy/Eh            Energy/eV
      -------------------------------------------------------------
         1        2.0000           -0.7328130             -19.9409
       ...           ...                  ...                  ...
        20        2.0000           -0.4568755             -12.4322
        21        2.0000           -0.4477468             -12.1838
        22        2.0000           -0.4347053             -11.8289
        23        2.0000           -0.4266996             -11.6111
        24        2.0000           -0.4233832             -11.5208
        25        2.0000           -0.3881750             -10.5628
        26        2.0000           -0.3661834              -9.9644 (HOMO)
        27                         -0.2598542              -7.0710 (LUMO)
        28                         -0.2073392              -5.6420
        29                         -0.1658747              -4.5137
        30                         -0.1031462              -2.8068
        31                          0.0785401               2.1372
       ...                                ...                  ...
        50                          0.7017334              19.0951
      -------------------------------------------------------------
                  HL-Gap            0.1063293 Eh            2.8934 eV
             Fermi-level           -0.3130188 Eh           -8.5177 eV

 SCC (total)                   0 d,  0 h,  0 min,  0.023 sec
 SCC setup                      ...        0 min,  0.000 sec (  1.144%)
 Dispersion                     ...        0 min,  0.000 sec (  1.188%)
 integral evaluation            ...        0 min,  0.005 sec ( 21.222%)
 zeroth order Hamiltonian       ...        0 min,  0.000 sec (  0.471%)
 iterations                     ...        0 min,  0.010 sec ( 41.419%)
 molecular gradient             ...        0 min,  0.008 sec ( 32.965%)
 printout                       ...        0 min,  0.000 sec (  1.361%)

         :::::::::::::::::::::::::::::::::::::::::::::::::::::
         ::                     SUMMARY                     ::
         :::::::::::::::::::::::::::::::::::::::::::::::::::::
         :: total energy             -28.376576729420 Eh    ::
         :: gradient norm              0.042435856498 Eh/a0 ::
         :: HOMO-LUMO gap              2.893366410437 eV    ::
         ::.................................................::
         :: SCC energy               -28.827666262334 Eh    ::
         :: -> isotropic ES            0.009683511298 Eh    ::
         :: -> anisotropic ES          0.003680938768 Eh    ::
         :: -> anisotropic XC          0.016162217310 Eh    ::
         :: -> dispersion             -0.014890566985 Eh    ::
         :: repulsion energy           0.451127573403 Eh    ::
         :: add. restraining           0.000000000000 Eh    ::
         :::::::::::::::::::::::::::::::::::::::::::::::::::::

      ----------------------------------------------------------- 
     |                   =====================                   |
     |                        A N C O P T                        |
     |                   =====================                   |
     |               Approximate Normal Coordinate               |
     |                Rational Function Optimizer                |
      ----------------------------------------------------------- 

          ...................................................
          :                      SETUP                      :
          :.................................................:
          :   optimization level            normal          :
          :   max. optcycles                   200          :
          :   ANC micro-cycles                  20          :
          :   degrees of freedom                54          :
          :.................................................:
          :   RF solver                   davidson          :
          :   input Hessian                  false          :
          :   write xtbopt.log                true          :
          :   linear?                        false          :
          :   energy convergence         0.5000000E-05 Eh   :
          :   grad. convergence          0.1000000E-02 Eh/α :
          :   maximium RF displ.         2.0000000          :
          :   Hlow (freq-cutoff)         0.5000000E-02      :
          :   Hmax (freq-cutoff)         5.0000000          :
          :   S6 in model hess.         20.0000000          :
          ...................................................

generating ANC from model Hessian ...
Using Lindh-Hessian (1995)
 Shifting diagonal of input Hessian by   3.318112235909088E-003
 Lowest  eigenvalues of input Hessian
   -0.000000   -0.000000   -0.000000   -0.000000    0.000000    0.000000
    0.005000    0.005486    0.006213    0.009440    0.011345    0.012959
    0.015003    0.017772    0.025153    0.027385    0.039329    0.044256
 Highest eigenvalues
    1.661213    1.756470    1.863405    1.884971    1.973737    2.103188
 

........................................................................
.............................. CYCLE    1 ..............................
........................................................................
   1    -28.8276663 -0.288277E+02  0.941E-05    2.89       0.0  T
   2    -28.8276663 -0.121396E-10  0.587E-05    2.89     381.2  T
   3    -28.8276663 -0.728306E-11  0.408E-05    2.89     547.7  T
     SCC iter.                  ...        0 min,  0.003 sec
     gradient                   ...        0 min,  0.008 sec
 * total energy  :   -28.3765767 Eh     change        0.2040146E-09 Eh
   gradient norm :     0.0424363 Eh/α   predicted     0.0000000E+00 (-100.00%)
   displ. norm   :     0.1141253 α      lambda       -0.2409373E-02
   maximum displ.:     0.0551839 α      in ANC's #3, #15, #7, ...

........................................................................
.............................. CYCLE    2 ..............................
........................................................................
   1    -28.8438619 -0.288439E+02  0.962E-02    2.92       0.0  T
   2    -28.8438991 -0.372245E-04  0.670E-02    2.92       1.0  T
   3    -28.8439388 -0.397174E-04  0.348E-02    2.92       1.0  T
   4    -28.8439405 -0.164901E-05  0.128E-02    2.92       1.8  T
   5    -28.8439421 -0.161388E-05  0.435E-03    2.92       5.1  T
   6    -28.8439423 -0.259992E-06  0.157E-03    2.92      14.2  T
     SCC iter.                  ...        0 min,  0.004 sec
     gradient                   ...        0 min,  0.007 sec
 * total energy  :   -28.3781701 Eh     change       -0.1593363E-02 Eh
   gradient norm :     0.0161492 Eh/α   predicted    -0.1220393E-02 ( -23.41%)
   displ. norm   :     0.0849311 α      lambda       -0.5005000E-03
   maximum displ.:     0.0473028 α      in ANC's #3, #7, #15, ...

........................................................................
.............................. CYCLE    3 ..............................
........................................................................
   1    -28.8495719 -0.288496E+02  0.632E-02    2.94       0.0  T
   2    -28.8495909 -0.189830E-04  0.449E-02    2.94       1.0  T
   3    -28.8496115 -0.205652E-04  0.219E-02    2.94       1.0  T
   4    -28.8496118 -0.321694E-06  0.832E-03    2.94       2.7  T
   5    -28.8496124 -0.582840E-06  0.351E-03    2.94       6.4  T
   6    -28.8496125 -0.172912E-06  0.973E-04    2.94      23.0  T
   7    -28.8496125 -0.263652E-08  0.528E-04    2.94      42.3  T
     SCC iter.                  ...        0 min,  0.005 sec
     gradient                   ...        0 min,  0.007 sec
 * total energy  :   -28.3784596 Eh     change       -0.2895357E-03 Eh
   gradient norm :     0.0053431 Eh/α   predicted    -0.2520616E-03 ( -12.94%)
   displ. norm   :     0.0547962 α      lambda       -0.6923910E-04
   maximum displ.:     0.0405971 α      in ANC's #3, #7, #2, ...

........................................................................
.............................. CYCLE    4 ..............................
........................................................................
   1    -28.8492996 -0.288493E+02  0.269E-02    2.94       0.0  T
   2    -28.8493015 -0.197344E-05  0.178E-02    2.94       1.3  T
   3    -28.8493029 -0.136749E-05  0.105E-02    2.94       2.1  T
   4    -28.8493034 -0.482330E-06  0.285E-03    2.94       7.8  T
   5    -28.8493035 -0.654039E-07  0.151E-03    2.94      14.8  T
     SCC iter.                  ...        0 min,  0.004 sec
     gradient                   ...        0 min,  0.007 sec
 * total energy  :   -28.3785068 Eh     change       -0.4713421E-04 Eh
   gradient norm :     0.0027234 Eh/α   predicted    -0.3473828E-04 ( -26.30%)
   displ. norm   :     0.0564312 α      lambda       -0.3420086E-04
   maximum displ.:     0.0449290 α      in ANC's #3, #7, #2, ...

........................................................................
.............................. CYCLE    5 ..............................
........................................................................
   1    -28.8483660 -0.288484E+02  0.269E-02    2.94       0.0  T
   2    -28.8483666 -0.580257E-06  0.164E-02    2.94       1.4  T
   3    -28.8483658  0.795011E-06  0.973E-03    2.94       2.3  T
   4    -28.8483670 -0.121029E-05  0.157E-03    2.94      14.2  T
   5    -28.8483670 -0.182835E-07  0.973E-04    2.94      23.0  T
   6    -28.8483670 -0.104179E-07  0.426E-04    2.94      52.5  T
     SCC iter.                  ...        0 min,  0.004 sec
     gradient                   ...        0 min,  0.008 sec
 * total energy  :   -28.3785232 Eh     change       -0.1639083E-04 Eh
   gradient norm :     0.0014248 Eh/α   predicted    -0.1716561E-04 (   4.73%)
   displ. norm   :     0.0390069 α      lambda       -0.1072567E-04
   maximum displ.:     0.0326022 α      in ANC's #3, #2, #12, ...

........................................................................
.............................. CYCLE    6 ..............................
........................................................................
   1    -28.8479616 -0.288480E+02  0.195E-02    2.94       0.0  T
   2    -28.8479617 -0.540732E-07  0.117E-02    2.94       1.9  T
   3    -28.8479614  0.326712E-06  0.458E-03    2.94       4.9  T
   4    -28.8479617 -0.380778E-06  0.625E-04    2.94      35.8  T
   5    -28.8479618 -0.194019E-08  0.438E-04    2.94      51.0  T
     SCC iter.                  ...        0 min,  0.004 sec
     gradient                   ...        0 min,  0.008 sec
 * total energy  :   -28.3785283 Eh     change       -0.5128447E-05 Eh
   gradient norm :     0.0014430 Eh/α   predicted    -0.5367698E-05 (   4.67%)
   displ. norm   :     0.0177047 α      lambda       -0.5714828E-05
   maximum displ.:     0.0140192 α      in ANC's #3, #7, #6, ...

........................................................................
.............................. CYCLE    7 ..............................
........................................................................
   1    -28.8483172 -0.288483E+02  0.954E-03    2.94       0.0  T
   2    -28.8483173 -0.610950E-07  0.582E-03    2.94       3.8  T
   3    -28.8483171  0.118842E-06  0.337E-03    2.94       6.6  T
   4    -28.8483173 -0.159051E-06  0.554E-04    2.94      40.3  T
   5    -28.8483173 -0.323802E-08  0.335E-04    2.94      66.8  T
     SCC iter.                  ...        0 min,  0.004 sec
     gradient                   ...        0 min,  0.008 sec
 * total energy  :   -28.3785343 Eh     change       -0.6052457E-05 Eh
   gradient norm :     0.0005883 Eh/α   predicted    -0.2859624E-05 ( -52.75%)
   displ. norm   :     0.0178239 α      lambda       -0.1114576E-05
   maximum displ.:     0.0140206 α      in ANC's #3, #7, #6, ...

........................................................................
.............................. CYCLE    8 ..............................
........................................................................
   1    -28.8486594 -0.288487E+02  0.949E-03    2.94       0.0  T
   2    -28.8486595 -0.592490E-07  0.579E-03    2.94       3.9  T
   3    -28.8486594  0.122866E-06  0.341E-03    2.94       6.6  T
   4    -28.8486595 -0.163318E-06  0.593E-04    2.94      37.7  T
   5    -28.8486595 -0.389701E-08  0.334E-04    2.94      66.9  T
     SCC iter.                  ...        0 min,  0.004 sec
     gradient                   ...        0 min,  0.008 sec
 * total energy  :   -28.3785354 Eh     change       -0.1037863E-05 Eh
   gradient norm :     0.0008688 Eh/α   predicted    -0.5598097E-06 ( -46.06%)
   displ. norm   :     0.0178949 α      lambda       -0.2326675E-05
   maximum displ.:     0.0146631 α      in ANC's #3, #2, #6, ...

   *** GEOMETRY OPTIMIZATION CONVERGED AFTER 8 ITERATIONS ***

------------------------------------------------------------------------
 total energy gain   :        -0.0019586 Eh       -1.2291 kcal/mol
 total RMSD          :         0.0741720 a0        0.0393 Å
 total power (kW/mol):        -0.6428020 (step)  -36.8275 (real)
------------------------------------------------------------------------

 ANCopt (total)                0 d,  0 h,  0 min,  0.140 sec
 optimizer setup                ...        0 min,  0.000 sec (  0.090%)
 model hessian                  ...        0 min,  0.003 sec (  2.026%)
 ANC generation                 ...        0 min,  0.001 sec (  0.420%)
 coordinate transformation      ...        0 min,  0.000 sec (  0.084%)
 single point calculation       ...        0 min,  0.134 sec ( 95.712%)
 optimization log               ...        0 min,  0.001 sec (  0.490%)
 hessian update                 ...        0 min,  0.000 sec (  0.068%)
 rational function              ...        0 min,  0.001 sec (  0.709%)

================
 final structure:
================
$coord
    2.26258694294389    1.25344971012654    0.24376331111943      C 
    2.67325555006901   -1.24191779933707    0.38159510185343      O 
    0.39377696640458   -2.37656029548895    0.29437943912967      C 
   -1.49644327521256   -0.64833251963346    0.09923799398057      C 
   -4.26001757365820   -1.14156584370566   -0.04853741987129      C 
   -0.27248685111139    1.77387388469538    0.06400105281152      C 
   -1.51486454034653    4.18681678378283   -0.12357952708843      C 
   -0.34977860312359    6.43878778967675   -0.12490911425168      C 
   -1.66892223188020    8.80901804141286   -0.31490674824174      C 
   -0.52297463555201   11.04891720801518   -0.31316165090429      C 
    3.88980900955019    2.45744327049588    0.28657095498550      H 
    0.36315996211697   -4.39989095927659    0.38523278024074      H 
   -4.62587482753631   -3.15992724791804    0.05537736455582      H 
   -5.02855821243703   -0.42110659883050   -1.81777018525532      H 
   -5.24362763491345   -0.21015722313182    1.50178605301386      H 
   -3.55399014625942    4.11913905189077   -0.27025293202658      H 
    1.68528330538968    6.53718198732001    0.02536722536545      H 
   -3.70672028614366    8.70420859916558   -0.46715026554612      H 
    1.50211111430970   11.20609419980343   -0.16746952425905      H 
   -1.55835495102824   12.79233342256986   -0.46498515838659      H 
$end
           -------------------------------------------------
          |                Final Singlepoint                |
           -------------------------------------------------

          ...................................................
          :                      SETUP                      :
          :.................................................:
          :  # basis functions                  50          :
          :  # atomic orbitals                  50          :
          :  # shells                           30          :
          :  # electrons                        52          :
          :  max. iterations                   250          :
          :  Hamiltonian                  GFN2-xTB          :
          :  restarted?                      false          :
          :  GBSA solvation                  false          :
          :  PC potential                    false          :
          :  electronic temp.          300.0000000     K    :
          :  accuracy                    1.0000000          :
          :  -> integral cutoff          0.2500000E+02      :
          :  -> integral neglect         0.1000000E-07      :
          :  -> SCF convergence          0.1000000E-05 Eh   :
          :  -> wf. convergence          0.1000000E-03 e    :
          :  Broyden damping             0.4000000          :
          ...................................................

 iter      E             dE          RMSdq      gap      omega  full diag
   1    -28.8486595 -0.288487E+02  0.155E-04    2.94       0.0  T
   2    -28.8486595 -0.798650E-11  0.810E-05    2.94     275.9  T
   3    -28.8486595  0.238671E-10  0.639E-05    2.94     349.9  T

   *** convergence criteria satisfied after 3 iterations ***

         #    Occupation            Energy/Eh            Energy/eV
      -------------------------------------------------------------
         1        2.0000           -0.7360321             -20.0285
       ...           ...                  ...                  ...
        20        2.0000           -0.4566310             -12.4256
        21        2.0000           -0.4476347             -12.1808
        22        2.0000           -0.4339920             -11.8095
        23        2.0000           -0.4256770             -11.5833
        24        2.0000           -0.4229126             -11.5080
        25        2.0000           -0.3907074             -10.6317
        26        2.0000           -0.3665127              -9.9733 (HOMO)
        27                         -0.2585476              -7.0354 (LUMO)
        28                         -0.2016659              -5.4876
        29                         -0.1627661              -4.4291
        30                         -0.1026807              -2.7941
        31                          0.0857044               2.3321
       ...                                ...                  ...
        50                          0.7143976              19.4397
      -------------------------------------------------------------
                  HL-Gap            0.1079651 Eh            2.9379 eV
             Fermi-level           -0.3125302 Eh           -8.5044 eV

 SCC (total)                   0 d,  0 h,  0 min,  0.016 sec
 SCC setup                      ...        0 min,  0.000 sec (  0.978%)
 Dispersion                     ...        0 min,  0.000 sec (  0.940%)
 integral evaluation            ...        0 min,  0.005 sec ( 30.431%)
 zeroth order Hamiltonian       ...        0 min,  0.000 sec (  0.622%)
 iterations                     ...        0 min,  0.003 sec ( 17.232%)
 molecular gradient             ...        0 min,  0.008 sec ( 47.846%)
 printout                       ...        0 min,  0.000 sec (  1.658%)

         :::::::::::::::::::::::::::::::::::::::::::::::::::::
         ::                     SUMMARY                     ::
         :::::::::::::::::::::::::::::::::::::::::::::::::::::
         :: total energy             -28.378535371581 Eh    ::
         :: gradient norm              0.000867623706 Eh/a0 ::
         :: HOMO-LUMO gap              2.937879978106 eV    ::
         ::.................................................::
         :: SCC energy               -28.848659518666 Eh    ::
         :: -> isotropic ES            0.009378990044 Eh    ::
         :: -> anisotropic ES          0.003834201411 Eh    ::
         :: -> anisotropic XC          0.015130023584 Eh    ::
         :: -> dispersion             -0.014934443964 Eh    ::
         :: repulsion energy           0.470161473555 Eh    ::
         :: add. restraining           0.000000000000 Eh    ::
         :::::::::::::::::::::::::::::::::::::::::::::::::::::

           -------------------------------------------------
          |                Property Printout                |
           -------------------------------------------------

    * Orbital Energies and Occupations

         #    Occupation            Energy/Eh            Energy/eV
      -------------------------------------------------------------
         1        2.0000           -0.7360321             -20.0285
       ...           ...                  ...                  ...
        14        2.0000           -0.5004358             -13.6176
        15        2.0000           -0.4904982             -13.3471
        16        2.0000           -0.4865236             -13.2390
        17        2.0000           -0.4849270             -13.1955
        18        2.0000           -0.4668769             -12.7044
        19        2.0000           -0.4574839             -12.4488
        20        2.0000           -0.4566310             -12.4256
        21        2.0000           -0.4476347             -12.1808
        22        2.0000           -0.4339920             -11.8095
        23        2.0000           -0.4256770             -11.5833
        24        2.0000           -0.4229126             -11.5080
        25        2.0000           -0.3907074             -10.6317
        26        2.0000           -0.3665127              -9.9733 (HOMO)
        27                         -0.2585476              -7.0354 (LUMO)
        28                         -0.2016659              -5.4876
        29                         -0.1627661              -4.4291
        30                         -0.1026807              -2.7941
        31                          0.0857044               2.3321
        32                          0.0928416               2.5263
        33                          0.1128160               3.0699
        34                          0.1268714               3.4523
        35                          0.1434636               3.9038
        36                          0.1636639               4.4535
        37                          0.1761450               4.7931
       ...                                ...                  ...
        50                          0.7143976              19.4397
      -------------------------------------------------------------
                  HL-Gap            0.1079651 Eh            2.9379 eV
             Fermi-level           -0.3125302 Eh           -8.5044 eV

     #   Z        covCN         q      C6AA      α(0)
     1   6 C      3.065     0.063    26.536     8.447
     2   8 O      1.727    -0.182    17.048     5.575
     3   6 C      3.067     0.053    26.749     8.481
     4   6 C      3.058    -0.019    28.418     8.742
     5   6 C      3.754    -0.105    22.557     6.772
     6   6 C      3.067    -0.024    28.535     8.759
     7   6 C      2.897    -0.039    28.958     8.823
     8   6 C      2.901    -0.040    29.000     8.830
     9   6 C      2.894    -0.025    28.634     8.773
    10   6 C      2.842    -0.089    30.223     9.010
    11   1 H      0.926     0.046     2.369     2.407
    12   1 H      0.926     0.043     2.408     2.427
    13   1 H      0.925     0.040     2.446     2.446
    14   1 H      0.925     0.049     2.333     2.389
    15   1 H      0.925     0.049     2.332     2.388
    16   1 H      0.925     0.041     2.430     2.438
    17   1 H      0.926     0.033     2.538     2.491
    18   1 H      0.925     0.033     2.547     2.496
    19   1 H      0.926     0.038     2.481     2.463
    20   1 H      0.926     0.035     2.521     2.483

 Mol. C6AA /au·bohr⁶  :       4491.368908
 Mol. C8AA /au·bohr⁸  :     107019.932157
 Mol. α(0) /au        :        106.639038


Wiberg/Mayer (AO) data.
largest (>0.10) Wiberg bond orders for each atom
          total WBO             WBO to atom ...
     1  C   3.879        C    6 1.512    O    2 1.147    H   11 0.966    C    3 0.139
     2  O   2.441        C    1 1.147    C    3 1.115
     3  C   3.899        C    4 1.603    O    2 1.115    H   12 0.967    C    1 0.139
     4  C   3.975        C    3 1.603    C    6 1.206    C    5 1.033
     5  C   3.997        C    4 1.033    H   13 0.985    H   15 0.973    H   14 0.972
     6  C   3.982        C    1 1.512    C    4 1.206    C    7 1.125
     7  C   3.991        C    8 1.742    C    6 1.125    H   16 0.963    C   10 0.130
     8  C   3.991        C    7 1.742    C    9 1.146    H   17 0.963
     9  C   3.992        C   10 1.858    C    8 1.146    H   18 0.964
    10  C   3.949        C    9 1.858    H   20 0.980    H   19 0.977    C    7 0.130
    11  H   0.998        C    1 0.966
    12  H   0.998        C    3 0.967
    13  H   0.998        C    5 0.985
    14  H   0.997        C    5 0.972
    15  H   0.997        C    5 0.973
    16  H   0.998        C    7 0.963
    17  H   0.999        C    8 0.963
    18  H   0.999        C    9 0.964
    19  H   0.999        C   10 0.977
    20  H   0.998        C   10 0.980

molecular dipole:
                 x           y           z       tot (Debye)
 q only:       -0.387      -0.054      -0.023
   full:       -0.341      -0.088      -0.019       0.897
molecular quadrupole (traceless):
                xx          xy          yy          xz          yz          zz
 q only:        1.522       1.802      -0.023       0.032       0.023      -1.499
  q+dip:        3.782       2.020       1.616       0.486      -0.205      -5.398
   full:        2.252       2.091       0.346       0.173      -0.036      -2.598

           -------------------------------------------------
          |                Geometry Summary                 |
           -------------------------------------------------

      molecular mass/u    :      134.1774000
   center of mass at/Å    :       -0.2479352       1.4612338       0.0097714
  moments of inertia/u·Å² :        0.1625532E+03   0.7673049E+03   0.9267128E+03
rotational constants/cm⁻¹ :        0.1037053E+00   0.2196993E-01   0.1819078E-01

 * 18 selected distances

     #   Z        #   Z                                     value/Å
     1   6 C      2   8 O                                 1.3402406
     2   8 O      3   6 C                                 1.3482127
     3   6 C      4   6 C                                 1.3592527
     4   6 C      5   6 C                                 1.4875868 (max)
     1   6 C      6   6 C                                 1.3727795
     4   6 C      6   6 C                                 1.4362455
     7   6 C      8   6 C                                 1.3417331
     9   6 C     10   6 C                                 1.3314196
     1   6 C     11   1 H                                 1.0714088 (min)
     3   6 C     12   1 H                                 1.0719019
     5   6 C     13   1 H                                 1.0868678
     5   6 C     14   1 H                                 1.0896299
     5   6 C     15   1 H                                 1.0894517
     7   6 C     16   1 H                                 1.0824394
     8   6 C     17   1 H                                 1.0810952
     9   6 C     18   1 H                                 1.0827831
    10   6 C     19   1 H                                 1.0776137
    10   6 C     20   1 H                                 1.0760092

 * 3 distinct bonds (by element types)

   Z      Z             #   av. dist./Å        max./Å        min./Å
   1 H    6 C          10     1.0809201     1.0896299     1.0714088
   6 C    6 C           6     1.3881695     1.4875868     1.3314196
   6 C    8 O           2     1.3442266     1.3482127     1.3402406


optimized geometry written to: xtbopt.xyz


           -------------------------------------------------
          | TOTAL ENERGY              -28.378535371581 Eh   |
          | GRADIENT NORM               0.000867623706 Eh/α |
          | HOMO-LUMO GAP               2.937879978106 eV   |
           -------------------------------------------------

------------------------------------------------------------------------
 * finished run on 2021/05/19 at 11:00:04.185     
------------------------------------------------------------------------
 total:
 * wall-time:     0 d,  0 h,  0 min,  0.197 sec
 *  cpu-time:     0 d,  0 h,  0 min,  0.196 sec
 * ratio c/w:     0.998 speedup
 SCF:
 * wall-time:     0 d,  0 h,  0 min,  0.023 sec
 *  cpu-time:     0 d,  0 h,  0 min,  0.023 sec
 * ratio c/w:     1.000 speedup
 ANC optimizer:
 * wall-time:     0 d,  0 h,  0 min,  0.156 sec
 *  cpu-time:     0 d,  0 h,  0 min,  0.156 sec
 * ratio c/w:     1.000 speedup

