      -----------------------------------------------------------      
     |                   =====================                   |     
     |                           x T B                           |     
     |                   =====================                   |     
     |                         S. Grimme                         |     
     |          Mulliken Center for Theoretical Chemistry        |     
     |                    University of Bonn                     |     
     |                Version 6.2 RC2 (SAW190805)                |     
      -----------------------------------------------------------      

   This program is distributed in the hope that it will be useful,
   but WITHOUT ANY WARRANTY; without even the implied warranty of
   MERCHANTABILITY or FITNESS FOR A PARTICULAR PURPOSE.
   
   FOR NON-COMMERCIAL, ACADEMIA USE ONLY.
   
   Cite this work as:
   * S. Grimme, C. Bannwarth, P. Shushkov, J. Chem. Theory Comput., 2017,
     13, 1989-2009. DOI: 10.1021/acs.jctc.7b00118
   * C. Bannwarth, S. Ehlert and S. Grimme., J. Chem. Theory Comput., 2019,
     15, 1652-1671. DOI: 10.1021/acs.jctc.8b01176
   * P. Pracht, E. Caldeweyher, S. Ehlert, S. Grimme, ChemRxiv, 2019, preprint.
     DOI: 10.26434/chemrxiv.8326202.v1
   
   for DFT-D4:
   * E. Caldeweyher, C. Bannwarth and S. Grimme, J. Chem. Phys., 2017,
     147, 034112. DOI: 10.1063/1.4993215
   * E. Caldeweyher, S. Ehlert, A. Hansen, H. Neugebauer, S. Spicher,
     C. Bannwarth and S. Grimme, J. Chem. Phys., 2019, 150, 154122.
     DOI: 10.1063/1.5090222
   
   for sTDA-xTB:
   * S. Grimme and C. Bannwarth, J. Chem. Phys., 2016, 145, 054103.
     DOI: 10.1063/1.4959605
   
   in the mass-spec context:
   * V. Asgeirsson, C. Bauer and S. Grimme, Chem. Sci., 2017, 8, 4879.
     DOI: 10.1039/c7sc00601b
   
   for metadynamics refer to:
   * S. Grimme, J. Chem. Theory Comput., 2019, 155, 2847-2862
     DOI: 10.1021/acs.jctc.9b00143
   
   with help from (in alphabetical order)
   C. Bannwarth, F. Bohle, G. Brandenburg, E. Caldeweyher, M. Checinski,
   S. Dohm, S. Ehlert, S. Ehrlich, F. März, H. Neugebauer, J. Pisarek,
   P. Pracht, P. Shushkov, and S. Spicher.
   
 * started run on 2021/05/19 at 11:00:06.449     

           -------------------------------------------------
          |                Calculation Setup                |
           -------------------------------------------------

          program call               : /ihome/ghutchison/geoffh/xtb/xtb 706.xyz -opt
          hostname                   : smp-n83
          coordinate file            : 706.xyz
          omp threads                :                     1
          number of atoms            :                    28
          number of electrons        :                    74
          charge                     :                     0
          spin                       :                   0.0
          first test random number   :      0.80946294488588


########################################################################
# WARNING! Please study the warnings concerning your input carefully
#  - the use of '-opt' is discouraged, please use '--opt' next time
########################################################################

           ------------------------------------------------- 
          |                 G F N 2 - x T B                 |
          | Geometry, Frequencies, Noncovalent interactions |
          |            JCTC 2019 parametrisation            |
           ------------------------------------------------- 
             KAB for C  - Si     :                1.0500
             KAB for H  - Pd     :                0.9500
             k(s)              :                1.8500
             k(p)              :                2.2300
             k(d)              :                2.2300
             k(f)              :                2.0000
             kEN (H0ij)        :               -2.0000
             D4 a1             :                0.5200
             D4 a2             :                5.0000
             D4 s6             :                1.0000
             D4 s8             :                2.7000
             D4 s9             :                5.0000
             alphaj            :                2.0000

  Z AO/shell   Hii/eV     exponent
  1     Wed Apr 25 08:07:45 CEST 2018   EN: 2.200 GM2: 0.406  GM3: 0.0800  RAES: 1.40
     1s    -10.707211    1.230000
  6     Wed Apr 25 08:07:45 CEST 2018   EN: 2.550 GM2: 0.538  GM3: 0.1500  RAES: 3.00
     2s    -13.970922    2.096432
     2p    -10.063292    1.800000
  7     Wed Apr 25 08:07:45 CEST 2018   EN: 3.040 GM2: 0.461  GM3:-0.0640  RAES: 1.90
     2s    -16.686243    2.339881
     2p    -12.523956    2.014332

           ------------------------------------------------- 
          |        Self-Consistent Charge Iterations        |
           ------------------------------------------------- 

          ...................................................
          :                      SETUP                      :
          :.................................................:
          :  # basis functions                  73          :
          :  # atomic orbitals                  73          :
          :  # shells                           43          :
          :  # electrons                        74          :
          :  max. iterations                   250          :
          :  Hamiltonian                  GFN2-xTB          :
          :  restarted?                      false          :
          :  GBSA solvation                  false          :
          :  PC potential                    false          :
          :  electronic temp.          300.0000000     K    :
          :  accuracy                    1.0000000          :
          :  -> integral cutoff          0.2500000E+02      :
          :  -> integral neglect         0.1000000E-07      :
          :  -> SCF convergence          0.1000000E-05 Eh   :
          :  -> wf. convergence          0.1000000E-03 e    :
          :  Broyden damping             0.4000000          :
          ...................................................

 iter      E             dE          RMSdq      gap      omega  full diag
   1    -40.1860535 -0.401861E+02  0.416E+00    2.73       0.0  T
   2    -40.2328770 -0.468235E-01  0.261E+00    3.21       1.0  T
   3    -40.2243058  0.857124E-02  0.112E+00    3.03       1.0  T
   4    -40.2377197 -0.134139E-01  0.321E-01    3.11       1.0  T
   5    -40.2406148 -0.289507E-02  0.105E-01    3.12       1.0  T
   6    -40.2408092 -0.194466E-03  0.456E-02    3.12       1.0  T
   7    -40.2408350 -0.257766E-04  0.205E-02    3.11       1.0  T
   8    -40.2408356 -0.586779E-06  0.587E-03    3.11       3.2  T
   9    -40.2408361 -0.502998E-06  0.179E-03    3.11      10.6  T
  10    -40.2408361 -0.648488E-07  0.653E-04    3.11      28.9  T
  11    -40.2408361 -0.170738E-08  0.314E-04    3.11      60.2  T

   *** convergence criteria satisfied after 11 iterations ***

         #    Occupation            Energy/Eh            Energy/eV
      -------------------------------------------------------------
         1        2.0000           -0.6684896             -18.1905
       ...           ...                  ...                  ...
        31        2.0000           -0.4288443             -11.6694
        32        2.0000           -0.4136729             -11.2566
        33        2.0000           -0.4136476             -11.2559
        34        2.0000           -0.4132330             -11.2446
        35        2.0000           -0.3959921             -10.7755
        36        2.0000           -0.3729143             -10.1475
        37        2.0000           -0.3567309              -9.7071 (HOMO)
        38                         -0.2423089              -6.5936 (LUMO)
        39                         -0.2194038              -5.9703
        40                         -0.1894215              -5.1544
        41                         -0.1813911              -4.9359
        42                         -0.0918798              -2.5002
       ...                                ...                  ...
        73                          0.7286385              19.8273
      -------------------------------------------------------------
                  HL-Gap            0.1144220 Eh            3.1136 eV
             Fermi-level           -0.2995199 Eh           -8.1504 eV

 SCC (total)                   0 d,  0 h,  0 min,  0.043 sec
 SCC setup                      ...        0 min,  0.000 sec (  0.767%)
 Dispersion                     ...        0 min,  0.000 sec (  1.074%)
 integral evaluation            ...        0 min,  0.010 sec ( 23.727%)
 zeroth order Hamiltonian       ...        0 min,  0.000 sec (  0.462%)
 iterations                     ...        0 min,  0.015 sec ( 35.773%)
 molecular gradient             ...        0 min,  0.016 sec ( 37.051%)
 printout                       ...        0 min,  0.000 sec (  1.023%)

         :::::::::::::::::::::::::::::::::::::::::::::::::::::
         ::                     SUMMARY                     ::
         :::::::::::::::::::::::::::::::::::::::::::::::::::::
         :: total energy             -39.554154846068 Eh    ::
         :: gradient norm              0.071242948886 Eh/a0 ::
         :: HOMO-LUMO gap              3.113580375617 eV    ::
         ::.................................................::
         :: SCC energy               -40.240836149680 Eh    ::
         :: -> isotropic ES            0.004688311827 Eh    ::
         :: -> anisotropic ES          0.007513218783 Eh    ::
         :: -> anisotropic XC          0.023616777204 Eh    ::
         :: -> dispersion             -0.029520356979 Eh    ::
         :: repulsion energy           0.686540498054 Eh    ::
         :: add. restraining           0.000000000000 Eh    ::
         :::::::::::::::::::::::::::::::::::::::::::::::::::::

      ----------------------------------------------------------- 
     |                   =====================                   |
     |                        A N C O P T                        |
     |                   =====================                   |
     |               Approximate Normal Coordinate               |
     |                Rational Function Optimizer                |
      ----------------------------------------------------------- 

          ...................................................
          :                      SETUP                      :
          :.................................................:
          :   optimization level            normal          :
          :   max. optcycles                   200          :
          :   ANC micro-cycles                  20          :
          :   degrees of freedom                78          :
          :.................................................:
          :   RF solver                   davidson          :
          :   input Hessian                  false          :
          :   write xtbopt.log                true          :
          :   linear?                        false          :
          :   energy convergence         0.5000000E-05 Eh   :
          :   grad. convergence          0.1000000E-02 Eh/α :
          :   maximium RF displ.         2.0000000          :
          :   Hlow (freq-cutoff)         0.5000000E-02      :
          :   Hmax (freq-cutoff)         5.0000000          :
          :   S6 in model hess.         20.0000000          :
          ...................................................

generating ANC from model Hessian ...
Using Lindh-Hessian (1995)
 Shifting diagonal of input Hessian by   2.985403364792593E-003
 Lowest  eigenvalues of input Hessian
   -0.000000   -0.000000   -0.000000   -0.000000   -0.000000    0.000000
    0.005000    0.005216    0.006181    0.006589    0.009639    0.012316
    0.013984    0.016063    0.019310    0.021573    0.023253    0.023564
 Highest eigenvalues
    1.859536    1.875583    1.998106    2.016422    2.092340    2.127246
 

........................................................................
.............................. CYCLE    1 ..............................
........................................................................
   1    -40.2408362 -0.402408E+02  0.785E-05    3.11       0.0  T
   2    -40.2408362 -0.570779E-10  0.463E-05    3.11     408.1  T
   3    -40.2408362 -0.238813E-10  0.261E-05    3.11     723.5  T
     SCC iter.                  ...        0 min,  0.005 sec
     gradient                   ...        0 min,  0.016 sec
 * total energy  :   -39.5541548 Eh     change        0.4128108E-07 Eh
   gradient norm :     0.0712436 Eh/α   predicted     0.0000000E+00 (-100.00%)
   displ. norm   :     0.2565984 α      lambda       -0.8182487E-02
   maximum displ.:     0.1979203 α      in ANC's #16, #17, #30, ...

........................................................................
.............................. CYCLE    2 ..............................
........................................................................
   1    -40.2728739 -0.402729E+02  0.118E-01    3.20       0.0  T
   2    -40.2729090 -0.350787E-04  0.700E-02    3.21       1.0  T
   3    -40.2729070  0.205323E-05  0.358E-02    3.21       1.0  T
   4    -40.2729194 -0.123784E-04  0.689E-03    3.21       2.7  T
   5    -40.2729202 -0.825085E-06  0.276E-03    3.21       6.8  T
   6    -40.2729202 -0.553533E-07  0.132E-03    3.21      14.3  T
     SCC iter.                  ...        0 min,  0.008 sec
     gradient                   ...        0 min,  0.015 sec
 * total energy  :   -39.5592949 Eh     change       -0.5140136E-02 Eh
   gradient norm :     0.0213162 Eh/α   predicted    -0.4360634E-02 ( -15.17%)
   displ. norm   :     0.0989493 α      lambda       -0.8170802E-03
   maximum displ.:     0.0718794 α      in ANC's #16, #6, #17, ...

........................................................................
.............................. CYCLE    3 ..............................
........................................................................
   1    -40.2820620 -0.402821E+02  0.518E-02    3.23       0.0  T
   2    -40.2820729 -0.108984E-04  0.304E-02    3.24       1.0  T
   3    -40.2820734 -0.546429E-06  0.163E-02    3.23       1.2  T
   4    -40.2820752 -0.179712E-05  0.400E-03    3.24       4.7  T
   5    -40.2820756 -0.338449E-06  0.111E-03    3.24      17.0  T
     SCC iter.                  ...        0 min,  0.007 sec
     gradient                   ...        0 min,  0.015 sec
 * total energy  :   -39.5597278 Eh     change       -0.4328229E-03 Eh
   gradient norm :     0.0038033 Eh/α   predicted    -0.4125536E-03 (  -4.68%)
   displ. norm   :     0.0349091 α      lambda       -0.3357747E-04
   maximum displ.:     0.0236582 α      in ANC's #1, #3, #6, ...

........................................................................
.............................. CYCLE    4 ..............................
........................................................................
   1    -40.2816710 -0.402817E+02  0.164E-02    3.23       0.0  T
   2    -40.2816718 -0.733476E-06  0.937E-03    3.24       2.0  T
   3    -40.2816717  0.796785E-07  0.427E-03    3.23       4.4  T
   4    -40.2816719 -0.188373E-06  0.107E-03    3.23      17.6  T
   5    -40.2816719 -0.249593E-07  0.280E-04    3.23      67.4  T
   6    -40.2816719 -0.394415E-09  0.152E-04    3.23     124.2  T
     SCC iter.                  ...        0 min,  0.008 sec
     gradient                   ...        0 min,  0.016 sec
 * total energy  :   -39.5597524 Eh     change       -0.2460342E-04 Eh
   gradient norm :     0.0013941 Eh/α   predicted    -0.1681913E-04 ( -31.64%)
   displ. norm   :     0.0743002 α      lambda       -0.2084205E-04
   maximum displ.:     0.0574416 α      in ANC's #1, #3, #6, ...

........................................................................
.............................. CYCLE    5 ..............................
........................................................................
   1    -40.2808238 -0.402808E+02  0.355E-02    3.23       0.0  T
   2    -40.2808249 -0.111074E-05  0.201E-02    3.23       1.0  T
   3    -40.2808246  0.343180E-06  0.544E-03    3.23       3.5  T
   4    -40.2808251 -0.531837E-06  0.139E-03    3.23      13.6  T
   5    -40.2808251 -0.358904E-07  0.515E-04    3.23      36.7  T
   6    -40.2808251  0.673595E-11  0.230E-04    3.23      82.2  T
     SCC iter.                  ...        0 min,  0.008 sec
     gradient                   ...        0 min,  0.016 sec
 * total energy  :   -39.5597685 Eh     change       -0.1610730E-04 Eh
   gradient norm :     0.0020106 Eh/α   predicted    -0.1044971E-04 ( -35.12%)
   displ. norm   :     0.0238429 α      lambda       -0.7150749E-05
   maximum displ.:     0.0200504 α      in ANC's #1, #3, #8, ...

........................................................................
.............................. CYCLE    6 ..............................
........................................................................
   1    -40.2809492 -0.402809E+02  0.118E-02    3.23       0.0  T
   2    -40.2809492 -0.448836E-07  0.680E-03    3.23       2.8  T
   3    -40.2809492  0.105583E-07  0.104E-03    3.23      18.2  T
   4    -40.2809492 -0.254693E-07  0.310E-04    3.23      61.0  T
   5    -40.2809492 -0.712092E-09  0.149E-04    3.23     127.0  T
     SCC iter.                  ...        0 min,  0.007 sec
     gradient                   ...        0 min,  0.016 sec
 * total energy  :   -39.5597752 Eh     change       -0.6702855E-05 Eh
   gradient norm :     0.0015904 Eh/α   predicted    -0.3578237E-05 ( -46.62%)
   displ. norm   :     0.0733404 α      lambda       -0.1451698E-04
   maximum displ.:     0.0591982 α      in ANC's #1, #3, #8, ...

........................................................................
.............................. CYCLE    7 ..............................
........................................................................
   1    -40.2813876 -0.402814E+02  0.381E-02    3.24       0.0  T
   2    -40.2813882 -0.637260E-06  0.219E-02    3.23       1.0  T
   3    -40.2813880  0.235516E-06  0.428E-03    3.24       4.4  T
   4    -40.2813884 -0.416286E-06  0.110E-03    3.23      17.1  T
   5    -40.2813884 -0.127093E-07  0.524E-04    3.23      36.0  T
   6    -40.2813884 -0.731362E-10  0.185E-04    3.23     102.2  T
     SCC iter.                  ...        0 min,  0.008 sec
     gradient                   ...        0 min,  0.016 sec
 * total energy  :   -39.5597899 Eh     change       -0.1468835E-04 Eh
   gradient norm :     0.0006728 Eh/α   predicted    -0.7277004E-05 ( -50.46%)
   displ. norm   :     0.0537131 α      lambda       -0.5044371E-05
   maximum displ.:     0.0449810 α      in ANC's #1, #3, #2, ...

........................................................................
.............................. CYCLE    8 ..............................
........................................................................
   1    -40.2814380 -0.402814E+02  0.254E-02    3.24       0.0  T
   2    -40.2814381 -0.128040E-06  0.146E-02    3.23       1.3  T
   3    -40.2814382 -0.508548E-07  0.861E-04    3.23      21.9  T
   4    -40.2814382 -0.568456E-09  0.478E-04    3.23      39.6  T
     SCC iter.                  ...        0 min,  0.006 sec
     gradient                   ...        0 min,  0.016 sec
 * total energy  :   -39.5597958 Eh     change       -0.5930144E-05 Eh
   gradient norm :     0.0007331 Eh/α   predicted    -0.2530196E-05 ( -57.33%)
   displ. norm   :     0.0329489 α      lambda       -0.2841637E-05
   maximum displ.:     0.0288785 α      in ANC's #1, #3, #2, ...

........................................................................
.............................. CYCLE    9 ..............................
........................................................................
   1    -40.2813873 -0.402814E+02  0.150E-02    3.23       0.0  T
   2    -40.2813873 -0.500040E-07  0.864E-03    3.23       2.2  T
   3    -40.2813873  0.370185E-08  0.927E-04    3.23      20.4  T
   4    -40.2813873 -0.196372E-07  0.356E-04    3.23      53.2  T
     SCC iter.                  ...        0 min,  0.006 sec
     gradient                   ...        0 min,  0.016 sec
 * total energy  :   -39.5597992 Eh     change       -0.3396691E-05 Eh
   gradient norm :     0.0003315 Eh/α   predicted    -0.1422521E-05 ( -58.12%)
   displ. norm   :     0.0206133 α      lambda       -0.1520468E-05
   maximum displ.:     0.0196176 α      in ANC's #1, #2, #3, ...

   *** GEOMETRY OPTIMIZATION CONVERGED AFTER 9 ITERATIONS ***

------------------------------------------------------------------------
 total energy gain   :        -0.0056443 Eh       -3.5419 kcal/mol
 total RMSD          :         0.0906359 a0        0.0480 Å
 total power (kW/mol):        -1.6465810 (step)  -47.3180 (real)
------------------------------------------------------------------------

 ANCopt (total)                0 d,  0 h,  0 min,  0.313 sec
 optimizer setup                ...        0 min,  0.000 sec (  0.048%)
 model hessian                  ...        0 min,  0.007 sec (  2.166%)
 ANC generation                 ...        0 min,  0.001 sec (  0.275%)
 coordinate transformation      ...        0 min,  0.000 sec (  0.060%)
 single point calculation       ...        0 min,  0.302 sec ( 96.468%)
 optimization log               ...        0 min,  0.001 sec (  0.339%)
 hessian update                 ...        0 min,  0.000 sec (  0.044%)
 rational function              ...        0 min,  0.001 sec (  0.395%)

================
 final structure:
================
$coord
    4.66762003170822   -2.16734442631775    0.00014193036921      C 
    2.12559036739613   -1.51976285057696   -0.03302133252681      C 
    0.02322021859204   -3.04514727936230   -0.08397082369585      N 
    0.03309250476616   -5.76130118402536   -0.01814701062136      C 
    0.01775676228720   -6.77041373381620    2.68800314275483      C 
   -2.09207811809879   -1.53744262669100   -0.04208565036413      C 
   -1.34980265871443    1.03280444717609   -0.03107541740316      C 
    1.36154530323191    1.04418517582858   -0.02550754265534      C 
    3.16170331677479    2.95326541698050   -0.00343915697428      C 
    5.68496420595072    2.29313703821069    0.02102150378049      C 
    6.42203467723139   -0.23440155985543    0.02623818980921      C 
   -3.16622346568746    2.92649103158768   -0.01572983782770      C 
   -5.68384627907598    2.24485579859257   -0.00159874930471      C 
   -6.39946210232954   -0.28885391964279   -0.00044631562242      C 
   -4.62857669468926   -2.20678770396338   -0.01995279426575      C 
    5.27416539728602   -4.11587340475359    0.01293839176533      H 
    1.71451624761129   -6.43334021078515   -1.01430553220499      H 
   -1.62910805604382   -6.44619005427749   -1.03790350910808      H 
    1.67698271056756   -6.10670608513276    3.70298500670639      H 
    0.02204176132017   -8.82436532974263    2.68021347523027      H 
   -1.65729713633120   -6.11364819767475    3.68123107562604      H 
    2.58997124766113    4.91192571664727   -0.00301403616558      H 
    7.11545906109714    3.74859768392337    0.04031506897258      H 
    8.41125701529113   -0.69276426885819    0.05486128190449      H 
   -2.61124839087996    4.88995890626743   -0.01239784684505      H 
   -7.12674436291740    3.68807456236013    0.01260919606610      H 
   -8.38482106129377   -0.76411207991646    0.01982979955153      H 
   -5.21836998995868   -4.16045639637954   -0.01060287601356      H 
$end
           -------------------------------------------------
          |                Final Singlepoint                |
           -------------------------------------------------

          ...................................................
          :                      SETUP                      :
          :.................................................:
          :  # basis functions                  73          :
          :  # atomic orbitals                  73          :
          :  # shells                           43          :
          :  # electrons                        74          :
          :  max. iterations                   250          :
          :  Hamiltonian                  GFN2-xTB          :
          :  restarted?                      false          :
          :  GBSA solvation                  false          :
          :  PC potential                    false          :
          :  electronic temp.          300.0000000     K    :
          :  accuracy                    1.0000000          :
          :  -> integral cutoff          0.2500000E+02      :
          :  -> integral neglect         0.1000000E-07      :
          :  -> SCF convergence          0.1000000E-05 Eh   :
          :  -> wf. convergence          0.1000000E-03 e    :
          :  Broyden damping             0.4000000          :
          ...................................................

 iter      E             dE          RMSdq      gap      omega  full diag
   1    -40.2813873 -0.402814E+02  0.128E-04    3.23       0.0  T
   2    -40.2813873 -0.732641E-10  0.511E-05    3.23     369.9  T
   3    -40.2813873 -0.291394E-10  0.516E-05    3.23     366.4  T

   *** convergence criteria satisfied after 3 iterations ***

         #    Occupation            Energy/Eh            Energy/eV
      -------------------------------------------------------------
         1        2.0000           -0.6695571             -18.2196
       ...           ...                  ...                  ...
        31        2.0000           -0.4286754             -11.6649
        32        2.0000           -0.4155505             -11.3077
        33        2.0000           -0.4131134             -11.2414
        34        2.0000           -0.4117065             -11.2031
        35        2.0000           -0.3986825             -10.8487
        36        2.0000           -0.3716436             -10.1129
        37        2.0000           -0.3571502              -9.7186 (HOMO)
        38                         -0.2382870              -6.4841 (LUMO)
        39                         -0.2151866              -5.8555
        40                         -0.1875700              -5.1040
        41                         -0.1793635              -4.8807
        42                         -0.0862490              -2.3470
       ...                                ...                  ...
        73                          0.7537622              20.5109
      -------------------------------------------------------------
                  HL-Gap            0.1188632 Eh            3.2344 eV
             Fermi-level           -0.2977186 Eh           -8.1013 eV

 SCC (total)                   0 d,  0 h,  0 min,  0.032 sec
 SCC setup                      ...        0 min,  0.000 sec (  0.730%)
 Dispersion                     ...        0 min,  0.000 sec (  0.852%)
 integral evaluation            ...        0 min,  0.010 sec ( 31.489%)
 zeroth order Hamiltonian       ...        0 min,  0.000 sec (  0.565%)
 iterations                     ...        0 min,  0.005 sec ( 14.835%)
 molecular gradient             ...        0 min,  0.016 sec ( 50.158%)
 printout                       ...        0 min,  0.000 sec (  1.211%)

         :::::::::::::::::::::::::::::::::::::::::::::::::::::
         ::                     SUMMARY                     ::
         :::::::::::::::::::::::::::::::::::::::::::::::::::::
         :: total energy             -39.559799217926 Eh    ::
         :: gradient norm              0.000332406415 Eh/a0 ::
         :: HOMO-LUMO gap              3.234433381068 eV    ::
         ::.................................................::
         :: SCC energy               -40.281387333049 Eh    ::
         :: -> isotropic ES            0.004787368287 Eh    ::
         :: -> anisotropic ES          0.007061952758 Eh    ::
         :: -> anisotropic XC          0.022284361213 Eh    ::
         :: -> dispersion             -0.029784714988 Eh    ::
         :: repulsion energy           0.721432013231 Eh    ::
         :: add. restraining           0.000000000000 Eh    ::
         :::::::::::::::::::::::::::::::::::::::::::::::::::::

           -------------------------------------------------
          |                Property Printout                |
           -------------------------------------------------

    * Orbital Energies and Occupations

         #    Occupation            Energy/Eh            Energy/eV
      -------------------------------------------------------------
         1        2.0000           -0.6695571             -18.2196
       ...           ...                  ...                  ...
        25        2.0000           -0.4682209             -12.7409
        26        2.0000           -0.4651863             -12.6584
        27        2.0000           -0.4625331             -12.5862
        28        2.0000           -0.4525372             -12.3142
        29        2.0000           -0.4384260             -11.9302
        30        2.0000           -0.4316998             -11.7471
        31        2.0000           -0.4286754             -11.6649
        32        2.0000           -0.4155505             -11.3077
        33        2.0000           -0.4131134             -11.2414
        34        2.0000           -0.4117065             -11.2031
        35        2.0000           -0.3986825             -10.8487
        36        2.0000           -0.3716436             -10.1129
        37        2.0000           -0.3571502              -9.7186 (HOMO)
        38                         -0.2382870              -6.4841 (LUMO)
        39                         -0.2151866              -5.8555
        40                         -0.1875700              -5.1040
        41                         -0.1793635              -4.8807
        42                         -0.0862490              -2.3470
        43                         -0.0528126              -1.4371
        44                          0.0111451               0.3033
        45                          0.1039720               2.8292
        46                          0.1049737               2.8565
        47                          0.1160780               3.1586
        48                          0.1186328               3.2282
       ...                                ...                  ...
        73                          0.7537622              20.5109
      -------------------------------------------------------------
                  HL-Gap            0.1188632 Eh            3.2344 eV
             Fermi-level           -0.2977186 Eh           -8.1013 eV

     #   Z        covCN         q      C6AA      α(0)
     1   6 C      2.910    -0.053    29.327     8.880
     2   6 C      3.082     0.044    26.914     8.505
     3   7 N      2.797    -0.052    22.238     7.004
     4   6 C      3.738     0.006    20.562     6.470
     5   6 C      3.752    -0.109    22.654     6.787
     6   6 C      3.082     0.044    26.914     8.505
     7   6 C      3.070    -0.019    28.411     8.740
     8   6 C      3.070    -0.019    28.411     8.740
     9   6 C      2.912    -0.033    28.824     8.804
    10   6 C      2.920    -0.043    29.062     8.840
    11   6 C      2.924    -0.035    28.861     8.810
    12   6 C      2.912    -0.033    28.824     8.804
    13   6 C      2.920    -0.043    29.062     8.840
    14   6 C      2.924    -0.035    28.861     8.810
    15   6 C      2.910    -0.053    29.327     8.880
    16   1 H      0.926     0.022     2.703     2.571
    17   1 H      0.924     0.047     2.360     2.402
    18   1 H      0.924     0.047     2.361     2.403
    19   1 H      0.925     0.046     2.371     2.408
    20   1 H      0.925     0.043     2.406     2.426
    21   1 H      0.925     0.046     2.370     2.407
    22   1 H      0.926     0.029     2.605     2.524
    23   1 H      0.926     0.025     2.656     2.549
    24   1 H      0.926     0.026     2.645     2.543
    25   1 H      0.926     0.029     2.605     2.524
    26   1 H      0.926     0.025     2.656     2.549
    27   1 H      0.926     0.026     2.645     2.543
    28   1 H      0.926     0.022     2.702     2.571

 Mol. C6AA /au·bohr⁶  :       9759.422536
 Mol. C8AA /au·bohr⁸  :     238836.674228
 Mol. α(0) /au        :        157.838527


Wiberg/Mayer (AO) data.
largest (>0.10) Wiberg bond orders for each atom
          total WBO             WBO to atom ...
     1  C   3.985        C   11 1.470    C    2 1.354    H   16 0.967    C    9 0.106
     2  C   3.964        C    1 1.354    C    8 1.254    N    3 1.148
     3  N   3.560        C    2 1.148    C    6 1.148    C    4 0.996
     4  C   3.977        C    5 1.005    N    3 0.996    H   17 0.969    H   18 0.969
     5  C   3.992        C    4 1.005    H   19 0.987    H   21 0.987    H   20 0.985
     6  C   3.964        C   15 1.354    C    7 1.254    N    3 1.148
     7  C   3.985        C   12 1.367    C    6 1.254    C    8 1.150
     8  C   3.985        C    9 1.367    C    2 1.254    C    7 1.150
     9  C   3.982        C   10 1.473    C    8 1.367    H   22 0.969    C    1 0.106
    10  C   3.983        C    9 1.473    C   11 1.395    H   23 0.972
    11  C   3.970        C    1 1.470    C   10 1.395    H   24 0.972
    12  C   3.982        C   13 1.473    C    7 1.367    H   25 0.969    C   15 0.106
    13  C   3.983        C   12 1.473    C   14 1.395    H   26 0.972
    14  C   3.970        C   15 1.470    C   13 1.395    H   27 0.972
    15  C   3.985        C   14 1.470    C    6 1.354    H   28 0.967    C   12 0.106
    16  H   0.999        C    1 0.967
    17  H   0.997        C    4 0.969
    18  H   0.997        C    4 0.969
    19  H   0.998        C    5 0.987
    20  H   0.997        C    5 0.985
    21  H   0.998        C    5 0.987
    22  H   0.999        C    9 0.969
    23  H   0.999        C   10 0.972
    24  H   0.999        C   11 0.972
    25  H   0.999        C   12 0.969
    26  H   0.999        C   13 0.972
    27  H   0.999        C   14 0.972
    28  H   0.999        C   15 0.967

molecular dipole:
                 x           y           z       tot (Debye)
 q only:        0.002      -0.745       0.070
   full:        0.003      -0.854       0.063       2.176
molecular quadrupole (traceless):
                xx          xy          yy          xz          yz          zz
 q only:       -3.800      -0.046       6.400      -0.002      -0.743      -2.599
  q+dip:       -0.106      -0.051       9.902       0.024      -0.191      -9.796
   full:       -2.703      -0.053       7.833       0.007      -0.390      -5.129

           -------------------------------------------------
          |                Geometry Summary                 |
           -------------------------------------------------

      molecular mass/u    :      195.2634000
   center of mass at/Å    :        0.0063875      -0.4478844       0.1018325
  moments of inertia/u·Å² :        0.5418341E+03   0.8633057E+03   0.1357982E+04
rotational constants/cm⁻¹ :        0.3111217E-01   0.1952684E-01   0.1241373E-01

 * 30 selected distances

     #   Z        #   Z                                     value/Å
     1   6 C      2   6 C                                 1.3882586
     2   6 C      3   7 N                                 1.3747770
     3   7 N      4   6 C                                 1.4377584
     4   6 C      5   6 C                                 1.5283783 (max)
     3   7 N      6   6 C                                 1.3747832
     6   6 C      7   6 C                                 1.4157113
     2   6 C      8   6 C                                 1.4157495
     7   6 C      8   6 C                                 1.4347993
     8   6 C      9   6 C                                 1.3885881
     9   6 C     10   6 C                                 1.3802515
     1   6 C     11   6 C                                 1.3814385
    10   6 C     11   6 C                                 1.3932295
     7   6 C     12   6 C                                 1.3885907
    12   6 C     13   6 C                                 1.3802553
    13   6 C     14   6 C                                 1.3932336
     6   6 C     15   6 C                                 1.3882547
    14   6 C     15   6 C                                 1.3814350
     1   6 C     16   1 H                                 1.0799400
     4   6 C     17   1 H                                 1.0936385
     4   6 C     18   1 H                                 1.0937323
     5   6 C     19   1 H                                 1.0875496
     5   6 C     20   1 H                                 1.0869147
     5   6 C     21   1 H                                 1.0875395
     9   6 C     22   1 H                                 1.0797327
    10   6 C     23   1 H                                 1.0799694
    11   6 C     24   1 H                                 1.0803412
    12   6 C     25   1 H                                 1.0797310 (min)
    13   6 C     26   1 H                                 1.0799673
    14   6 C     27   1 H                                 1.0803425
    15   6 C     28   1 H                                 1.0799320

 * 3 distinct bonds (by element types)

   Z      Z             #   av. dist./Å        max./Å        min./Å
   1 H    6 C          13     1.0837947     1.0937323     1.0797310
   6 C    6 C          14     1.4041553     1.5283783     1.3802515
   6 C    7 N           3     1.3957729     1.4377584     1.3747770


optimized geometry written to: xtbopt.xyz


           -------------------------------------------------
          | TOTAL ENERGY              -39.559799217926 Eh   |
          | GRADIENT NORM               0.000332406415 Eh/α |
          | HOMO-LUMO GAP               3.234433381068 eV   |
           -------------------------------------------------

------------------------------------------------------------------------
 * finished run on 2021/05/19 at 11:00:06.862     
------------------------------------------------------------------------
 total:
 * wall-time:     0 d,  0 h,  0 min,  0.413 sec
 *  cpu-time:     0 d,  0 h,  0 min,  0.412 sec
 * ratio c/w:     0.999 speedup
 SCF:
 * wall-time:     0 d,  0 h,  0 min,  0.044 sec
 *  cpu-time:     0 d,  0 h,  0 min,  0.044 sec
 * ratio c/w:     1.000 speedup
 ANC optimizer:
 * wall-time:     0 d,  0 h,  0 min,  0.346 sec
 *  cpu-time:     0 d,  0 h,  0 min,  0.346 sec
 * ratio c/w:     1.000 speedup

