      -----------------------------------------------------------      
     |                   =====================                   |     
     |                           x T B                           |     
     |                   =====================                   |     
     |                         S. Grimme                         |     
     |          Mulliken Center for Theoretical Chemistry        |     
     |                    University of Bonn                     |     
     |                Version 6.2 RC2 (SAW190805)                |     
      -----------------------------------------------------------      

   This program is distributed in the hope that it will be useful,
   but WITHOUT ANY WARRANTY; without even the implied warranty of
   MERCHANTABILITY or FITNESS FOR A PARTICULAR PURPOSE.
   
   FOR NON-COMMERCIAL, ACADEMIA USE ONLY.
   
   Cite this work as:
   * S. Grimme, C. Bannwarth, P. Shushkov, J. Chem. Theory Comput., 2017,
     13, 1989-2009. DOI: 10.1021/acs.jctc.7b00118
   * C. Bannwarth, S. Ehlert and S. Grimme., J. Chem. Theory Comput., 2019,
     15, 1652-1671. DOI: 10.1021/acs.jctc.8b01176
   * P. Pracht, E. Caldeweyher, S. Ehlert, S. Grimme, ChemRxiv, 2019, preprint.
     DOI: 10.26434/chemrxiv.8326202.v1
   
   for DFT-D4:
   * E. Caldeweyher, C. Bannwarth and S. Grimme, J. Chem. Phys., 2017,
     147, 034112. DOI: 10.1063/1.4993215
   * E. Caldeweyher, S. Ehlert, A. Hansen, H. Neugebauer, S. Spicher,
     C. Bannwarth and S. Grimme, J. Chem. Phys., 2019, 150, 154122.
     DOI: 10.1063/1.5090222
   
   for sTDA-xTB:
   * S. Grimme and C. Bannwarth, J. Chem. Phys., 2016, 145, 054103.
     DOI: 10.1063/1.4959605
   
   in the mass-spec context:
   * V. Asgeirsson, C. Bauer and S. Grimme, Chem. Sci., 2017, 8, 4879.
     DOI: 10.1039/c7sc00601b
   
   for metadynamics refer to:
   * S. Grimme, J. Chem. Theory Comput., 2019, 155, 2847-2862
     DOI: 10.1021/acs.jctc.9b00143
   
   with help from (in alphabetical order)
   C. Bannwarth, F. Bohle, G. Brandenburg, E. Caldeweyher, M. Checinski,
   S. Dohm, S. Ehlert, S. Ehrlich, F. März, H. Neugebauer, J. Pisarek,
   P. Pracht, P. Shushkov, and S. Spicher.
   
 * started run on 2021/05/19 at 11:00:06.881     

           -------------------------------------------------
          |                Calculation Setup                |
           -------------------------------------------------

          program call               : /ihome/ghutchison/geoffh/xtb/xtb 707.xyz -opt
          hostname                   : smp-n83
          coordinate file            : 707.xyz
          omp threads                :                     1
          number of atoms            :                    23
          number of electrons        :                    58
          charge                     :                     0
          spin                       :                   0.0
          first test random number   :      0.48101262882635


########################################################################
# WARNING! Please study the warnings concerning your input carefully
#  - the use of '-opt' is discouraged, please use '--opt' next time
########################################################################

           ------------------------------------------------- 
          |                 G F N 2 - x T B                 |
          | Geometry, Frequencies, Noncovalent interactions |
          |            JCTC 2019 parametrisation            |
           ------------------------------------------------- 
             KAB for C  - Si     :                1.0500
             KAB for H  - Pd     :                0.9500
             k(s)              :                1.8500
             k(p)              :                2.2300
             k(d)              :                2.2300
             k(f)              :                2.0000
             kEN (H0ij)        :               -2.0000
             D4 a1             :                0.5200
             D4 a2             :                5.0000
             D4 s6             :                1.0000
             D4 s8             :                2.7000
             D4 s9             :                5.0000
             alphaj            :                2.0000

  Z AO/shell   Hii/eV     exponent
  1     Wed Apr 25 08:07:45 CEST 2018   EN: 2.200 GM2: 0.406  GM3: 0.0800  RAES: 1.40
     1s    -10.707211    1.230000
  6     Wed Apr 25 08:07:45 CEST 2018   EN: 2.550 GM2: 0.538  GM3: 0.1500  RAES: 3.00
     2s    -13.970922    2.096432
     2p    -10.063292    1.800000
 16     Tue Apr 24 11:44:34 CEST 2018   EN: 2.580 GM2: 0.340  GM3:-0.0502  RAES: 3.10
     3s    -20.029654    1.981333
     3p    -11.377694    2.025643
     3d     -0.420282    1.702555

           ------------------------------------------------- 
          |        Self-Consistent Charge Iterations        |
           ------------------------------------------------- 

          ...................................................
          :                      SETUP                      :
          :.................................................:
          :  # basis functions                  62          :
          :  # atomic orbitals                  61          :
          :  # shells                           35          :
          :  # electrons                        58          :
          :  max. iterations                   250          :
          :  Hamiltonian                  GFN2-xTB          :
          :  restarted?                      false          :
          :  GBSA solvation                  false          :
          :  PC potential                    false          :
          :  electronic temp.          300.0000000     K    :
          :  accuracy                    1.0000000          :
          :  -> integral cutoff          0.2500000E+02      :
          :  -> integral neglect         0.1000000E-07      :
          :  -> SCF convergence          0.1000000E-05 Eh   :
          :  -> wf. convergence          0.1000000E-03 e    :
          :  Broyden damping             0.4000000          :
          ...................................................

 iter      E             dE          RMSdq      gap      omega  full diag
   1    -31.1726196 -0.311726E+02  0.365E+00    3.81       0.0  T
   2    -31.2013792 -0.287596E-01  0.208E+00    3.88       1.0  T
   3    -31.1979396  0.343961E-02  0.844E-01    3.83       1.0  T
   4    -31.2007414 -0.280181E-02  0.474E-01    3.84       1.0  T
   5    -31.2038526 -0.311121E-02  0.105E-01    3.83       1.0  T
   6    -31.2038767 -0.240700E-04  0.600E-02    3.83       1.0  T
   7    -31.2039196 -0.429407E-04  0.236E-02    3.84       1.0  T
   8    -31.2039243 -0.467055E-05  0.828E-03    3.84       2.5  T
   9    -31.2039244 -0.854906E-07  0.254E-03    3.84       8.2  T
  10    -31.2039244 -0.309241E-07  0.107E-03    3.84      19.5  T
  11    -31.2039244 -0.229491E-09  0.574E-04    3.84      36.3  T
  12    -31.2039244 -0.402162E-08  0.253E-04    3.84      82.6  T

   *** convergence criteria satisfied after 12 iterations ***

         #    Occupation            Energy/Eh            Energy/eV
      -------------------------------------------------------------
         1        2.0000           -0.7227877             -19.6681
       ...           ...                  ...                  ...
        23        2.0000           -0.4446240             -12.0988
        24        2.0000           -0.4304528             -11.7132
        25        2.0000           -0.4253635             -11.5747
        26        2.0000           -0.4200979             -11.4314
        27        2.0000           -0.4003656             -10.8945
        28        2.0000           -0.3791508             -10.3172
        29        2.0000           -0.3766964             -10.2504 (HOMO)
        30                         -0.2357533              -6.4152 (LUMO)
        31                         -0.2096858              -5.7058
        32                         -0.1910019              -5.1974
        33                         -0.1652158              -4.4957
        34                         -0.1058825              -2.8812
       ...                                ...                  ...
        61                          0.6739458              18.3390
      -------------------------------------------------------------
                  HL-Gap            0.1409431 Eh            3.8353 eV
             Fermi-level           -0.3062249 Eh           -8.3328 eV

 SCC (total)                   0 d,  0 h,  0 min,  0.033 sec
 SCC setup                      ...        0 min,  0.000 sec (  0.921%)
 Dispersion                     ...        0 min,  0.000 sec (  0.956%)
 integral evaluation            ...        0 min,  0.007 sec ( 22.356%)
 zeroth order Hamiltonian       ...        0 min,  0.000 sec (  0.454%)
 iterations                     ...        0 min,  0.013 sec ( 39.145%)
 molecular gradient             ...        0 min,  0.011 sec ( 34.924%)
 printout                       ...        0 min,  0.000 sec (  1.078%)

         :::::::::::::::::::::::::::::::::::::::::::::::::::::
         ::                     SUMMARY                     ::
         :::::::::::::::::::::::::::::::::::::::::::::::::::::
         :: total energy             -30.746617396233 Eh    ::
         :: gradient norm              0.045875480814 Eh/a0 ::
         :: HOMO-LUMO gap              3.835257408799 eV    ::
         ::.................................................::
         :: SCC energy               -31.203924401008 Eh    ::
         :: -> isotropic ES            0.002657308067 Eh    ::
         :: -> anisotropic ES          0.004323689858 Eh    ::
         :: -> anisotropic XC          0.018175448213 Eh    ::
         :: -> dispersion             -0.021974009563 Eh    ::
         :: repulsion energy           0.457151548498 Eh    ::
         :: add. restraining           0.000000000000 Eh    ::
         :::::::::::::::::::::::::::::::::::::::::::::::::::::

      ----------------------------------------------------------- 
     |                   =====================                   |
     |                        A N C O P T                        |
     |                   =====================                   |
     |               Approximate Normal Coordinate               |
     |                Rational Function Optimizer                |
      ----------------------------------------------------------- 

          ...................................................
          :                      SETUP                      :
          :.................................................:
          :   optimization level            normal          :
          :   max. optcycles                   200          :
          :   ANC micro-cycles                  20          :
          :   degrees of freedom                63          :
          :.................................................:
          :   RF solver                   davidson          :
          :   input Hessian                  false          :
          :   write xtbopt.log                true          :
          :   linear?                        false          :
          :   energy convergence         0.5000000E-05 Eh   :
          :   grad. convergence          0.1000000E-02 Eh/α :
          :   maximium RF displ.         2.0000000          :
          :   Hlow (freq-cutoff)         0.5000000E-02      :
          :   Hmax (freq-cutoff)         5.0000000          :
          :   S6 in model hess.         20.0000000          :
          ...................................................

generating ANC from model Hessian ...
Using Lindh-Hessian (1995)
 Shifting diagonal of input Hessian by   3.107453281095969E-003
 Lowest  eigenvalues of input Hessian
   -0.000000   -0.000000   -0.000000   -0.000000    0.000000    0.000000
    0.005000    0.005520    0.007311    0.009903    0.011759    0.015544
    0.019758    0.021693    0.023541    0.024945    0.030439    0.034524
 Highest eigenvalues
    1.438858    1.497766    1.640506    1.750679    1.816516    1.844247
 

........................................................................
.............................. CYCLE    1 ..............................
........................................................................
   1    -31.2039244 -0.312039E+02  0.995E-05    3.84       0.0  T
   2    -31.2039244 -0.579696E-10  0.643E-05    3.84     324.3  T
   3    -31.2039244 -0.354632E-10  0.385E-05    3.84     541.5  T
     SCC iter.                  ...        0 min,  0.004 sec
     gradient                   ...        0 min,  0.011 sec
 * total energy  :   -30.7466174 Eh     change       -0.2363776E-07 Eh
   gradient norm :     0.0458756 Eh/α   predicted     0.0000000E+00 (-100.00%)
   displ. norm   :     0.2463893 α      lambda       -0.4320732E-02
   maximum displ.:     0.1103463 α      in ANC's #1, #5, #9, ...

........................................................................
.............................. CYCLE    2 ..............................
........................................................................
   1    -31.2318372 -0.312318E+02  0.153E-01    3.91       0.0  T
   2    -31.2318669 -0.296920E-04  0.749E-02    3.91       1.0  T
   3    -31.2318550  0.118609E-04  0.391E-02    3.91       1.0  T
   4    -31.2318741 -0.190753E-04  0.175E-02    3.91       1.2  T
   5    -31.2318773 -0.319990E-05  0.639E-03    3.91       3.3  T
   6    -31.2318773 -0.189409E-07  0.272E-03    3.91       7.7  T
   7    -31.2318774 -0.135164E-06  0.454E-04    3.91      45.9  T
     SCC iter.                  ...        0 min,  0.007 sec
     gradient                   ...        0 min,  0.011 sec
 * total energy  :   -30.7492848 Eh     change       -0.2667343E-02 Eh
   gradient norm :     0.0136135 Eh/α   predicted    -0.2291530E-02 ( -14.09%)
   displ. norm   :     0.1821931 α      lambda       -0.6659211E-03
   maximum displ.:     0.1014461 α      in ANC's #5, #1, #9, ...

........................................................................
.............................. CYCLE    3 ..............................
........................................................................
   1    -31.2396979 -0.312397E+02  0.909E-02    3.93       0.0  T
   2    -31.2397059 -0.797994E-05  0.466E-02    3.94       1.0  T
   3    -31.2397007  0.523274E-05  0.243E-02    3.94       1.0  T
   4    -31.2397080 -0.729414E-05  0.102E-02    3.94       2.1  T
   5    -31.2397090 -0.105765E-05  0.329E-03    3.94       6.3  T
   6    -31.2397090 -0.148209E-07  0.135E-03    3.94      15.5  T
   7    -31.2397091 -0.341059E-07  0.248E-04    3.94      84.2  T
     SCC iter.                  ...        0 min,  0.007 sec
     gradient                   ...        0 min,  0.011 sec
 * total energy  :   -30.7496986 Eh     change       -0.4138748E-03 Eh
   gradient norm :     0.0049766 Eh/α   predicted    -0.3440188E-03 ( -16.88%)
   displ. norm   :     0.1977869 α      lambda       -0.3270006E-03
   maximum displ.:     0.1207119 α      in ANC's #1, #2, #5, ...

........................................................................
.............................. CYCLE    4 ..............................
........................................................................
   1    -31.2406136 -0.312406E+02  0.915E-02    3.94       0.0  T
   2    -31.2406169 -0.323747E-05  0.506E-02    3.94       1.0  T
   3    -31.2406138  0.309087E-05  0.165E-02    3.94       1.3  T
   4    -31.2406171 -0.332669E-05  0.699E-03    3.94       3.0  T
   5    -31.2406178 -0.658234E-06  0.200E-03    3.94      10.4  T
   6    -31.2406178 -0.741850E-08  0.842E-04    3.94      24.8  T
     SCC iter.                  ...        0 min,  0.006 sec
     gradient                   ...        0 min,  0.011 sec
 * total energy  :   -30.7499025 Eh     change       -0.2038371E-03 Eh
   gradient norm :     0.0048452 Eh/α   predicted    -0.1698969E-03 ( -16.65%)
   displ. norm   :     0.2122317 α      lambda       -0.2602752E-03
   maximum displ.:     0.1380899 α      in ANC's #1, #2, #5, ...

........................................................................
.............................. CYCLE    5 ..............................
........................................................................
   1    -31.2380996 -0.312381E+02  0.103E-01    3.94       0.0  T
   2    -31.2381011 -0.155180E-05  0.588E-02    3.94       1.0  T
   3    -31.2380989  0.225294E-05  0.138E-02    3.94       1.5  T
   4    -31.2381014 -0.255636E-05  0.516E-03    3.94       4.0  T
   5    -31.2381017 -0.228915E-06  0.156E-03    3.94      13.4  T
   6    -31.2381017 -0.115343E-07  0.667E-04    3.94      31.2  T
     SCC iter.                  ...        0 min,  0.006 sec
     gradient                   ...        0 min,  0.011 sec
 * total energy  :   -30.7500612 Eh     change       -0.1587605E-03 Eh
   gradient norm :     0.0047300 Eh/α   predicted    -0.1360003E-03 ( -14.34%)
   displ. norm   :     0.1528296 α      lambda       -0.1382239E-03
   maximum displ.:     0.0988652 α      in ANC's #1, #2, #3, ...

........................................................................
.............................. CYCLE    6 ..............................
........................................................................
   1    -31.2364552 -0.312365E+02  0.859E-02    3.94       0.0  T
   2    -31.2364563 -0.100867E-05  0.475E-02    3.94       1.0  T
   3    -31.2364545  0.172349E-05  0.122E-02    3.94       1.7  T
   4    -31.2364566 -0.202746E-05  0.514E-03    3.94       4.1  T
   5    -31.2364567 -0.164680E-06  0.609E-04    3.94      34.2  T
   6    -31.2364567 -0.335307E-08  0.298E-04    3.94      70.0  T
     SCC iter.                  ...        0 min,  0.006 sec
     gradient                   ...        0 min,  0.011 sec
 * total energy  :   -30.7501677 Eh     change       -0.1064688E-03 Eh
   gradient norm :     0.0038562 Eh/α   predicted    -0.7072717E-04 ( -33.57%)
   displ. norm   :     0.1819568 α      lambda       -0.1385282E-03
   maximum displ.:     0.1157037 α      in ANC's #1, #2, #3, ...

........................................................................
.............................. CYCLE    7 ..............................
........................................................................
   1    -31.2361287 -0.312361E+02  0.114E-01    3.94       0.0  T
   2    -31.2361308 -0.208181E-05  0.626E-02    3.94       1.0  T
   3    -31.2361284  0.243234E-05  0.150E-02    3.94       1.4  T
   4    -31.2361312 -0.277693E-05  0.750E-03    3.94       2.8  T
   5    -31.2361316 -0.468863E-06  0.139E-03    3.94      15.0  T
   6    -31.2361316 -0.200580E-07  0.556E-04    3.94      37.5  T
   7    -31.2361316 -0.405605E-08  0.263E-04    3.94      79.4  T
     SCC iter.                  ...        0 min,  0.007 sec
     gradient                   ...        0 min,  0.011 sec
 * total energy  :   -30.7502800 Eh     change       -0.1122898E-03 Eh
   gradient norm :     0.0035379 Eh/α   predicted    -0.7155835E-04 ( -36.27%)
   displ. norm   :     0.2545272 α      lambda       -0.1604680E-03
   maximum displ.:     0.1614721 α      in ANC's #2, #1, #3, ...

........................................................................
.............................. CYCLE    8 ..............................
........................................................................
   1    -31.2363384 -0.312363E+02  0.162E-01    3.94       0.0  T
   2    -31.2363425 -0.415483E-05  0.884E-02    3.94       1.0  T
   3    -31.2363409  0.164994E-05  0.168E-02    3.94       1.2  T
   4    -31.2363424 -0.156786E-05  0.107E-02    3.94       1.9  T
   5    -31.2363438 -0.136329E-05  0.175E-03    3.94      11.9  T
   6    -31.2363438 -0.340044E-07  0.755E-04    3.94      27.6  T
   7    -31.2363438 -0.614733E-08  0.387E-04    3.94      53.9  T
     SCC iter.                  ...        0 min,  0.007 sec
     gradient                   ...        0 min,  0.011 sec
 * total energy  :   -30.7504092 Eh     change       -0.1291767E-03 Eh
   gradient norm :     0.0039309 Eh/α   predicted    -0.8543293E-04 ( -33.86%)
   displ. norm   :     0.3252924 α      lambda       -0.1715231E-03
   maximum displ.:     0.2051383 α      in ANC's #2, #1, #3, ...

........................................................................
.............................. CYCLE    9 ..............................
........................................................................
   1    -31.2366470 -0.312366E+02  0.209E-01    3.95       0.0  T
   2    -31.2366538 -0.680793E-05  0.114E-01    3.95       1.0  T
   3    -31.2366544 -0.604331E-06  0.179E-02    3.95       1.2  T
   4    -31.2366531  0.132056E-05  0.120E-02    3.95       1.7  T
   5    -31.2366556 -0.251571E-05  0.161E-03    3.95      12.9  T
   6    -31.2366556 -0.273238E-07  0.807E-04    3.95      25.8  T
   7    -31.2366556 -0.360575E-08  0.485E-04    3.95      43.0  T
     SCC iter.                  ...        0 min,  0.007 sec
     gradient                   ...        0 min,  0.011 sec
 * total energy  :   -30.7505387 Eh     change       -0.1295711E-03 Eh
   gradient norm :     0.0047403 Eh/α   predicted    -0.9483803E-04 ( -26.81%)
   displ. norm   :     0.3133796 α      lambda       -0.1394999E-03
   maximum displ.:     0.1978593 α      in ANC's #1, #2, #3, ...

........................................................................
.............................. CYCLE   10 ..............................
........................................................................
   1    -31.2376180 -0.312376E+02  0.202E-01    3.95       0.0  T
   2    -31.2376245 -0.643973E-05  0.109E-01    3.95       1.0  T
   3    -31.2376259 -0.143736E-05  0.165E-02    3.95       1.3  T
   4    -31.2376253  0.571534E-06  0.634E-03    3.95       3.3  T
   5    -31.2376261 -0.760247E-06  0.137E-03    3.95      15.2  T
   6    -31.2376261 -0.213089E-07  0.684E-04    3.95      30.5  T
     SCC iter.                  ...        0 min,  0.006 sec
     gradient                   ...        0 min,  0.011 sec
 * total energy  :   -30.7506355 Eh     change       -0.9679876E-04 Eh
   gradient norm :     0.0038943 Eh/α   predicted    -0.7660277E-04 ( -20.86%)
   displ. norm   :     0.1826764 α      lambda       -0.6158838E-04
   maximum displ.:     0.1129780 α      in ANC's #1, #2, #3, ...

........................................................................
.............................. CYCLE   11 ..............................
........................................................................
   1    -31.2386814 -0.312387E+02  0.116E-01    3.95       0.0  T
   2    -31.2386835 -0.208115E-05  0.634E-02    3.95       1.0  T
   3    -31.2386834  0.104590E-06  0.108E-02    3.95       1.9  T
   4    -31.2386835 -0.425722E-07  0.701E-03    3.95       3.0  T
   5    -31.2386841 -0.635541E-06  0.103E-03    3.95      20.3  T
   6    -31.2386841 -0.134753E-07  0.507E-04    3.95      41.1  T
   7    -31.2386841 -0.179936E-08  0.285E-04    3.95      73.1  T
     SCC iter.                  ...        0 min,  0.007 sec
     gradient                   ...        0 min,  0.011 sec
 * total energy  :   -30.7506768 Eh     change       -0.4121257E-04 Eh
   gradient norm :     0.0019453 Eh/α   predicted    -0.3182200E-04 ( -22.79%)
   displ. norm   :     0.1827986 α      lambda       -0.2006833E-04
   maximum displ.:     0.1068663 α      in ANC's #1, #2, #3, ...

........................................................................
.............................. CYCLE   12 ..............................
........................................................................
   1    -31.2382086 -0.312382E+02  0.115E-01    3.95       0.0  T
   2    -31.2382104 -0.180341E-05  0.642E-02    3.95       1.0  T
   3    -31.2382090  0.140928E-05  0.132E-02    3.95       1.6  T
   4    -31.2382107 -0.171663E-05  0.666E-03    3.95       3.1  T
   5    -31.2382110 -0.315343E-06  0.132E-03    3.95      15.8  T
   6    -31.2382110 -0.253073E-07  0.593E-04    3.95      35.2  T
   7    -31.2382110 -0.408307E-08  0.283E-04    3.95      73.6  T
     SCC iter.                  ...        0 min,  0.007 sec
     gradient                   ...        0 min,  0.011 sec
 * total energy  :   -30.7506883 Eh     change       -0.1157713E-04 Eh
   gradient norm :     0.0017653 Eh/α   predicted    -0.1018501E-04 ( -12.02%)
   displ. norm   :     0.0572718 α      lambda       -0.1470433E-04
   maximum displ.:     0.0397572 α      in ANC's #2, #1, #6, ...

........................................................................
.............................. CYCLE   13 ..............................
........................................................................
   1    -31.2406197 -0.312406E+02  0.331E-02    3.95       0.0  T
   2    -31.2406199 -0.241766E-06  0.177E-02    3.95       1.2  T
   3    -31.2406197  0.233622E-06  0.496E-03    3.95       4.2  T
   4    -31.2406200 -0.285291E-06  0.227E-03    3.95       9.2  T
   5    -31.2406200 -0.327891E-07  0.584E-04    3.95      35.7  T
   6    -31.2406200 -0.304513E-08  0.176E-04    3.95     118.8  T
     SCC iter.                  ...        0 min,  0.006 sec
     gradient                   ...        0 min,  0.011 sec
 * total energy  :   -30.7506786 Eh     change        0.9691420E-05 Eh
   gradient norm :     0.0037982 Eh/α   predicted    -0.7364839E-05 (-175.99%)
   displ. norm   :     0.0184194 α      lambda       -0.2187027E-04
   maximum displ.:     0.0102319 α      in ANC's #5, #6, #10, ...

........................................................................
.............................. CYCLE   14 ..............................
........................................................................
   1    -31.2394759 -0.312395E+02  0.963E-03    3.95       0.0  T
   2    -31.2394759 -0.292923E-07  0.554E-03    3.95       3.8  T
   3    -31.2394758  0.793482E-07  0.234E-03    3.95       8.9  T
   4    -31.2394759 -0.922278E-07  0.591E-04    3.95      35.3  T
   5    -31.2394759 -0.271826E-08  0.226E-04    3.95      92.2  T
     SCC iter.                  ...        0 min,  0.005 sec
     gradient                   ...        0 min,  0.011 sec
 * total energy  :   -30.7506935 Eh     change       -0.1487679E-04 Eh
   gradient norm :     0.0016545 Eh/α   predicted    -0.1094493E-04 ( -26.43%)
   displ. norm   :     0.0259282 α      lambda       -0.6955345E-05
   maximum displ.:     0.0152309 α      in ANC's #2, #3, #6, ...

........................................................................
.............................. CYCLE   15 ..............................
........................................................................
   1    -31.2382267 -0.312382E+02  0.175E-02    3.95       0.0  T
   2    -31.2382267 -0.506235E-07  0.102E-02    3.95       2.0  T
   3    -31.2382266  0.111240E-06  0.271E-03    3.95       7.7  T
   4    -31.2382268 -0.124593E-06  0.797E-04    3.95      26.1  T
   5    -31.2382268 -0.552771E-08  0.303E-04    3.95      68.9  T
     SCC iter.                  ...        0 min,  0.005 sec
     gradient                   ...        0 min,  0.011 sec
 * total energy  :   -30.7506957 Eh     change       -0.2171605E-05 Eh
   gradient norm :     0.0019541 Eh/α   predicted    -0.3479462E-05 (  60.23%)
   displ. norm   :     0.0172983 α      lambda       -0.3890100E-05
   maximum displ.:     0.0110549 α      in ANC's #3, #1, #5, ...

........................................................................
.............................. CYCLE   16 ..............................
........................................................................
   1    -31.2384722 -0.312385E+02  0.120E-02    3.95       0.0  T
   2    -31.2384723 -0.565159E-07  0.661E-03    3.95       3.2  T
   3    -31.2384723 -0.450728E-08  0.118E-03    3.95      17.7  T
   4    -31.2384723 -0.225864E-09  0.563E-04    3.95      37.0  T
   5    -31.2384723 -0.180184E-08  0.243E-04    3.95      86.0  T
     SCC iter.                  ...        0 min,  0.005 sec
     gradient                   ...        0 min,  0.011 sec
 * total energy  :   -30.7506975 Eh     change       -0.1845929E-05 Eh
   gradient norm :     0.0012129 Eh/α   predicted    -0.1949365E-05 (   5.60%)
   displ. norm   :     0.0125347 α      lambda       -0.2749724E-05
   maximum displ.:     0.0059909 α      in ANC's #2, #5, #4, ...

........................................................................
.............................. CYCLE   17 ..............................
........................................................................
   1    -31.2389283 -0.312389E+02  0.841E-03    3.95       0.0  T
   2    -31.2389283 -0.111823E-07  0.494E-03    3.95       4.2  T
   3    -31.2389283  0.302257E-07  0.136E-03    3.95      15.4  T
   4    -31.2389284 -0.338645E-07  0.293E-04    3.95      71.1  T
   5    -31.2389284 -0.883912E-09  0.110E-04    3.95     188.7  T
     SCC iter.                  ...        0 min,  0.005 sec
     gradient                   ...        0 min,  0.011 sec
 * total energy  :   -30.7506996 Eh     change       -0.2111786E-05 Eh
   gradient norm :     0.0005223 Eh/α   predicted    -0.1376049E-05 ( -34.84%)
   displ. norm   :     0.0249167 α      lambda       -0.1788736E-05
   maximum displ.:     0.0183756 α      in ANC's #2, #3, #4, ...

   *** GEOMETRY OPTIMIZATION CONVERGED AFTER 17 ITERATIONS ***

------------------------------------------------------------------------
 total energy gain   :        -0.0040822 Eh       -2.5616 kcal/mol
 total RMSD          :         0.4398363 a0        0.2328 Å
 total power (kW/mol):        -0.6304671 (step)  -24.1175 (real)
------------------------------------------------------------------------

 ANCopt (total)                0 d,  0 h,  0 min,  0.444 sec
 optimizer setup                ...        0 min,  0.000 sec (  0.036%)
 model hessian                  ...        0 min,  0.011 sec (  2.400%)
 ANC generation                 ...        0 min,  0.001 sec (  0.157%)
 coordinate transformation      ...        0 min,  0.000 sec (  0.070%)
 single point calculation       ...        0 min,  0.427 sec ( 96.016%)
 optimization log               ...        0 min,  0.002 sec (  0.367%)
 hessian update                 ...        0 min,  0.000 sec (  0.054%)
 rational function              ...        0 min,  0.003 sec (  0.652%)

================
 final structure:
================
$coord
    2.94249850976225    2.27612177440710   -0.01938039119486      C 
    5.03253317096049   -0.08651162696517    0.76994350331216      S 
    2.61214272006762   -2.25746859380779    0.84847425542757      C 
    0.33505285528235   -1.21059093072145    0.29350567414368      C 
    0.52844524562230    1.42608195275942   -0.21458367228930      C 
   -1.70703104581930    2.99900640478847   -0.93595919342941      C 
   -4.17464547852056    1.74835222774902   -0.07093478228200      C 
   -4.20343200042044   -1.01117382267236   -0.97470379843642      C 
   -2.13937015429645   -2.58225508593030    0.29327179627757      C 
   -4.44012878780512    1.92092853920892    2.74526079458419      C 
   -6.52581599766267    2.62569969698518    3.91434533844010      C 
    3.63237544259904    4.16032542470678   -0.29795038265281      H 
    3.02389457229142   -4.18652753626462    1.30983160916520      H 
   -1.74331878406589    3.20921671058041   -2.99441978766682      H 
   -1.53938702177192    4.88997108862172   -0.12444789836631      H 
   -5.76902423540233    2.73378577207911   -0.95008585100038      H 
   -3.92342890492399   -1.02923070734666   -3.02062825815881      H 
   -6.04506043108308   -1.85104580708910   -0.57582384438512      H 
   -1.93948168440764   -4.39762634195995   -0.67094530910499      H 
   -2.68349348278930   -2.98789769164447    2.24703363838630      H 
   -2.76903356000323    1.43589121022011    3.81886345290808      H 
   -8.21010002058467    3.13553358784484    2.88698053294526      H 
   -6.64914956603033    2.72484687377985    5.94308836236286      H 
$end
           -------------------------------------------------
          |                Final Singlepoint                |
           -------------------------------------------------

          ...................................................
          :                      SETUP                      :
          :.................................................:
          :  # basis functions                  62          :
          :  # atomic orbitals                  61          :
          :  # shells                           35          :
          :  # electrons                        58          :
          :  max. iterations                   250          :
          :  Hamiltonian                  GFN2-xTB          :
          :  restarted?                      false          :
          :  GBSA solvation                  false          :
          :  PC potential                    false          :
          :  electronic temp.          300.0000000     K    :
          :  accuracy                    1.0000000          :
          :  -> integral cutoff          0.2500000E+02      :
          :  -> integral neglect         0.1000000E-07      :
          :  -> SCF convergence          0.1000000E-05 Eh   :
          :  -> wf. convergence          0.1000000E-03 e    :
          :  Broyden damping             0.4000000          :
          ...................................................

 iter      E             dE          RMSdq      gap      omega  full diag
   1    -31.2389284 -0.312389E+02  0.534E-05    3.95       0.0  T
   2    -31.2389284 -0.100933E-10  0.291E-05    3.95     715.4  T
   3    -31.2389284 -0.154330E-10  0.173E-05    3.95    1204.6  T

   *** convergence criteria satisfied after 3 iterations ***

         #    Occupation            Energy/Eh            Energy/eV
      -------------------------------------------------------------
         1        2.0000           -0.7220893             -19.6490
       ...           ...                  ...                  ...
        23        2.0000           -0.4444245             -12.0934
        24        2.0000           -0.4299664             -11.7000
        25        2.0000           -0.4271219             -11.6226
        26        2.0000           -0.4211696             -11.4606
        27        2.0000           -0.4013077             -10.9201
        28        2.0000           -0.3804356             -10.3522
        29        2.0000           -0.3798798             -10.3371 (HOMO)
        30                         -0.2347171              -6.3870 (LUMO)
        31                         -0.2041039              -5.5539
        32                         -0.1938281              -5.2743
        33                         -0.1598415              -4.3495
        34                         -0.1064485              -2.8966
       ...                                ...                  ...
        61                          0.6921218              18.8336
      -------------------------------------------------------------
                  HL-Gap            0.1451627 Eh            3.9501 eV
             Fermi-level           -0.3072984 Eh           -8.3620 eV

 SCC (total)                   0 d,  0 h,  0 min,  0.023 sec
 SCC setup                      ...        0 min,  0.000 sec (  0.847%)
 Dispersion                     ...        0 min,  0.000 sec (  0.763%)
 integral evaluation            ...        0 min,  0.007 sec ( 30.686%)
 zeroth order Hamiltonian       ...        0 min,  0.000 sec (  0.576%)
 iterations                     ...        0 min,  0.004 sec ( 15.829%)
 molecular gradient             ...        0 min,  0.011 sec ( 49.695%)
 printout                       ...        0 min,  0.000 sec (  1.391%)

         :::::::::::::::::::::::::::::::::::::::::::::::::::::
         ::                     SUMMARY                     ::
         :::::::::::::::::::::::::::::::::::::::::::::::::::::
         :: total energy             -30.750699646134 Eh    ::
         :: gradient norm              0.000521905711 Eh/a0 ::
         :: HOMO-LUMO gap              3.950078152677 eV    ::
         ::.................................................::
         :: SCC energy               -31.238928352096 Eh    ::
         :: -> isotropic ES            0.002744340925 Eh    ::
         :: -> anisotropic ES          0.003788825076 Eh    ::
         :: -> anisotropic XC          0.017630560879 Eh    ::
         :: -> dispersion             -0.022527990682 Eh    ::
         :: repulsion energy           0.488056182674 Eh    ::
         :: add. restraining           0.000000000000 Eh    ::
         :::::::::::::::::::::::::::::::::::::::::::::::::::::

           -------------------------------------------------
          |                Property Printout                |
           -------------------------------------------------

    * Orbital Energies and Occupations

         #    Occupation            Energy/Eh            Energy/eV
      -------------------------------------------------------------
         1        2.0000           -0.7220893             -19.6490
       ...           ...                  ...                  ...
        17        2.0000           -0.4802141             -13.0673
        18        2.0000           -0.4724677             -12.8565
        19        2.0000           -0.4689952             -12.7620
        20        2.0000           -0.4649710             -12.6525
        21        2.0000           -0.4536966             -12.3457
        22        2.0000           -0.4483900             -12.2013
        23        2.0000           -0.4444245             -12.0934
        24        2.0000           -0.4299664             -11.7000
        25        2.0000           -0.4271219             -11.6226
        26        2.0000           -0.4211696             -11.4606
        27        2.0000           -0.4013077             -10.9201
        28        2.0000           -0.3804356             -10.3522
        29        2.0000           -0.3798798             -10.3371 (HOMO)
        30                         -0.2347171              -6.3870 (LUMO)
        31                         -0.2041039              -5.5539
        32                         -0.1938281              -5.2743
        33                         -0.1598415              -4.3495
        34                         -0.1064485              -2.8966
        35                          0.0061703               0.1679
        36                          0.0380438               1.0352
        37                          0.0425098               1.1568
        38                          0.0824230               2.2428
        39                          0.0894828               2.4350
        40                          0.1050921               2.8597
       ...                                ...                  ...
        61                          0.6921218              18.8336
      -------------------------------------------------------------
                  HL-Gap            0.1451627 Eh            3.9501 eV
             Fermi-level           -0.3072984 Eh           -8.3620 eV

     #   Z        covCN         q      C6AA      α(0)
     1   6 C      2.941    -0.034    28.850     8.809
     2  16 S      2.291    -0.052   143.225    20.142
     3   6 C      2.942    -0.035    28.861     8.811
     4   6 C      3.163    -0.006    27.828     8.622
     5   6 C      3.164    -0.005    27.802     8.618
     6   6 C      3.812    -0.055    21.544     6.607
     7   6 C      3.860    -0.015    20.798     6.486
     8   6 C      3.809    -0.052    21.507     6.601
     9   6 C      3.806    -0.053    21.525     6.605
    10   6 C      2.891    -0.027    28.677     8.780
    11   6 C      2.837    -0.094    30.364     9.030
    12   1 H      0.926     0.036     2.500     2.473
    13   1 H      0.926     0.036     2.502     2.473
    14   1 H      0.924     0.040     2.446     2.446
    15   1 H      0.924     0.036     2.498     2.472
    16   1 H      0.924     0.032     2.558     2.501
    17   1 H      0.924     0.035     2.517     2.481
    18   1 H      0.924     0.031     2.575     2.509
    19   1 H      0.924     0.036     2.508     2.477
    20   1 H      0.924     0.042     2.425     2.435
    21   1 H      0.925     0.037     2.489     2.467
    22   1 H      0.926     0.033     2.539     2.492
    23   1 H      0.926     0.034     2.532     2.488

 Mol. C6AA /au·bohr⁶  :       6638.677420
 Mol. C8AA /au·bohr⁸  :     177609.032724
 Mol. α(0) /au        :        128.825366


Wiberg/Mayer (AO) data.
largest (>0.10) Wiberg bond orders for each atom
          total WBO             WBO to atom ...
     1  C   3.942        C    5 1.608    S    2 1.181    H   12 0.971    C    3 0.120
     2  S   2.618        C    1 1.181    C    3 1.181
     3  C   3.943        C    4 1.609    S    2 1.181    H   13 0.971    C    1 0.120
     4  C   3.986        C    3 1.609    C    5 1.219    C    9 1.008
     5  C   3.986        C    1 1.608    C    4 1.219    C    6 1.009
     6  C   3.998        C    5 1.009    C    7 0.983    H   15 0.970    H   14 0.959
     7  C   3.996        C   10 1.014    C    6 0.983    C    8 0.980    H   16 0.965
     8  C   3.998        C    9 1.006    C    7 0.980    H   18 0.978    H   17 0.977
     9  C   3.998        C    4 1.008    C    8 1.006    H   19 0.969    H   20 0.961
    10  C   3.991        C   11 1.981    C    7 1.014    H   21 0.964
    11  C   3.991        C   10 1.981    H   23 0.977    H   22 0.975
    12  H   0.998        C    1 0.971
    13  H   0.998        C    3 0.971
    14  H   0.998        C    6 0.959
    15  H   0.998        C    6 0.970
    16  H   0.998        C    7 0.965
    17  H   0.998        C    8 0.977
    18  H   0.998        C    8 0.978
    19  H   0.999        C    9 0.969
    20  H   0.998        C    9 0.961
    21  H   0.999        C   10 0.964
    22  H   0.999        C   11 0.975
    23  H   0.998        C   11 0.977

molecular dipole:
                 x           y           z       tot (Debye)
 q only:       -0.411      -0.025      -0.160
   full:       -0.656      -0.018      -0.211       1.752
molecular quadrupole (traceless):
                xx          xy          yy          xz          yz          zz
 q only:       -1.685       0.463       1.862       0.728      -0.916      -0.177
  q+dip:       -3.577       0.061       3.057       0.368      -1.449       0.520
   full:       -4.381       0.497       3.736       0.286      -1.346       0.645

           -------------------------------------------------
          |                Geometry Summary                 |
           -------------------------------------------------

      molecular mass/u    :      164.2648000
   center of mass at/Å    :       -0.2416038       0.2461453       0.3315941
  moments of inertia/u·Å² :        0.2463381E+03   0.8059877E+03   0.8771900E+03
rotational constants/cm⁻¹ :        0.6843291E-01   0.2091549E-01   0.1921777E-01

 * 23 selected distances

     #   Z        #   Z                                     value/Å
     1   6 C      2  16 S                                 1.7207062
     2  16 S      3   6 C                                 1.7210477 (max)
     3   6 C      4   6 C                                 1.3583560
     1   6 C      5   6 C                                 1.3582781
     4   6 C      5   6 C                                 1.4246175
     5   6 C      6   6 C                                 1.4959747
     6   6 C      7   6 C                                 1.5338405
     7   6 C      8   6 C                                 1.5366757
     4   6 C      9   6 C                                 1.4971351
     8   6 C      9   6 C                                 1.5278851
    10   6 C     11   6 C                                 1.3190800
     1   6 C     12   1 H                                 1.0719928
     3   6 C     13   1 H                                 1.0719803 (min)
     6   6 C     14   1 H                                 1.0951240
     6   6 C     15   1 H                                 1.0925175
     7   6 C     16   1 H                                 1.0955413
     8   6 C     17   1 H                                 1.0927907
     8   6 C     18   1 H                                 1.0917076
     9   6 C     19   1 H                                 1.0928814
     9   6 C     20   1 H                                 1.0944892
    10   6 C     21   1 H                                 1.0819628
    11   6 C     22   1 H                                 1.0783046
    11   6 C     23   1 H                                 1.0768256

 * 3 distinct bonds (by element types)

   Z      Z             #   av. dist./Å        max./Å        min./Å
   1 H    6 C          12     1.0863432     1.0955413     1.0719803
   6 C    6 C           9     1.4502047     1.5366757     1.3190800
   6 C   16 S           2     1.7208770     1.7210477     1.7207062


optimized geometry written to: xtbopt.xyz


           -------------------------------------------------
          | TOTAL ENERGY              -30.750699646134 Eh   |
          | GRADIENT NORM               0.000521905711 Eh/α |
          | HOMO-LUMO GAP               3.950078152677 eV   |
           -------------------------------------------------

------------------------------------------------------------------------
 * finished run on 2021/05/19 at 11:00:07.402     
------------------------------------------------------------------------
 total:
 * wall-time:     0 d,  0 h,  0 min,  0.521 sec
 *  cpu-time:     0 d,  0 h,  0 min,  0.520 sec
 * ratio c/w:     0.998 speedup
 SCF:
 * wall-time:     0 d,  0 h,  0 min,  0.033 sec
 *  cpu-time:     0 d,  0 h,  0 min,  0.033 sec
 * ratio c/w:     1.000 speedup
 ANC optimizer:
 * wall-time:     0 d,  0 h,  0 min,  0.468 sec
 *  cpu-time:     0 d,  0 h,  0 min,  0.468 sec
 * ratio c/w:     1.000 speedup

