      -----------------------------------------------------------      
     |                   =====================                   |     
     |                           x T B                           |     
     |                   =====================                   |     
     |                         S. Grimme                         |     
     |          Mulliken Center for Theoretical Chemistry        |     
     |                    University of Bonn                     |     
     |                Version 6.2 RC2 (SAW190805)                |     
      -----------------------------------------------------------      

   This program is distributed in the hope that it will be useful,
   but WITHOUT ANY WARRANTY; without even the implied warranty of
   MERCHANTABILITY or FITNESS FOR A PARTICULAR PURPOSE.
   
   FOR NON-COMMERCIAL, ACADEMIA USE ONLY.
   
   Cite this work as:
   * S. Grimme, C. Bannwarth, P. Shushkov, J. Chem. Theory Comput., 2017,
     13, 1989-2009. DOI: 10.1021/acs.jctc.7b00118
   * C. Bannwarth, S. Ehlert and S. Grimme., J. Chem. Theory Comput., 2019,
     15, 1652-1671. DOI: 10.1021/acs.jctc.8b01176
   * P. Pracht, E. Caldeweyher, S. Ehlert, S. Grimme, ChemRxiv, 2019, preprint.
     DOI: 10.26434/chemrxiv.8326202.v1
   
   for DFT-D4:
   * E. Caldeweyher, C. Bannwarth and S. Grimme, J. Chem. Phys., 2017,
     147, 034112. DOI: 10.1063/1.4993215
   * E. Caldeweyher, S. Ehlert, A. Hansen, H. Neugebauer, S. Spicher,
     C. Bannwarth and S. Grimme, J. Chem. Phys., 2019, 150, 154122.
     DOI: 10.1063/1.5090222
   
   for sTDA-xTB:
   * S. Grimme and C. Bannwarth, J. Chem. Phys., 2016, 145, 054103.
     DOI: 10.1063/1.4959605
   
   in the mass-spec context:
   * V. Asgeirsson, C. Bauer and S. Grimme, Chem. Sci., 2017, 8, 4879.
     DOI: 10.1039/c7sc00601b
   
   for metadynamics refer to:
   * S. Grimme, J. Chem. Theory Comput., 2019, 155, 2847-2862
     DOI: 10.1021/acs.jctc.9b00143
   
   with help from (in alphabetical order)
   C. Bannwarth, F. Bohle, G. Brandenburg, E. Caldeweyher, M. Checinski,
   S. Dohm, S. Ehlert, S. Ehrlich, F. März, H. Neugebauer, J. Pisarek,
   P. Pracht, P. Shushkov, and S. Spicher.
   
 * started run on 2021/05/19 at 10:58:46.157     

           -------------------------------------------------
          |                Calculation Setup                |
           -------------------------------------------------

          program call               : /ihome/ghutchison/geoffh/xtb/xtb 71.xyz -opt
          hostname                   : smp-n58
          coordinate file            : 71.xyz
          omp threads                :                     1
          number of atoms            :                    22
          number of electrons        :                    60
          charge                     :                     0
          spin                       :                   0.0
          first test random number   :      0.82304216127777


########################################################################
# WARNING! Please study the warnings concerning your input carefully
#  - the use of '-opt' is discouraged, please use '--opt' next time
########################################################################

           ------------------------------------------------- 
          |                 G F N 2 - x T B                 |
          | Geometry, Frequencies, Noncovalent interactions |
          |            JCTC 2019 parametrisation            |
           ------------------------------------------------- 
             KAB for C  - Si     :                1.0500
             KAB for H  - Pd     :                0.9500
             k(s)              :                1.8500
             k(p)              :                2.2300
             k(d)              :                2.2300
             k(f)              :                2.0000
             kEN (H0ij)        :               -2.0000
             D4 a1             :                0.5200
             D4 a2             :                5.0000
             D4 s6             :                1.0000
             D4 s8             :                2.7000
             D4 s9             :                5.0000
             alphaj            :                2.0000

  Z AO/shell   Hii/eV     exponent
  1     Wed Apr 25 08:07:45 CEST 2018   EN: 2.200 GM2: 0.406  GM3: 0.0800  RAES: 1.40
     1s    -10.707211    1.230000
  6     Wed Apr 25 08:07:45 CEST 2018   EN: 2.550 GM2: 0.538  GM3: 0.1500  RAES: 3.00
     2s    -13.970922    2.096432
     2p    -10.063292    1.800000
  7     Wed Apr 25 08:07:45 CEST 2018   EN: 3.040 GM2: 0.461  GM3:-0.0640  RAES: 1.90
     2s    -16.686243    2.339881
     2p    -12.523956    2.014332

           ------------------------------------------------- 
          |        Self-Consistent Charge Iterations        |
           ------------------------------------------------- 

          ...................................................
          :                      SETUP                      :
          :.................................................:
          :  # basis functions                  58          :
          :  # atomic orbitals                  58          :
          :  # shells                           34          :
          :  # electrons                        60          :
          :  max. iterations                   250          :
          :  Hamiltonian                  GFN2-xTB          :
          :  restarted?                      false          :
          :  GBSA solvation                  false          :
          :  PC potential                    false          :
          :  electronic temp.          300.0000000     K    :
          :  accuracy                    1.0000000          :
          :  -> integral cutoff          0.2500000E+02      :
          :  -> integral neglect         0.1000000E-07      :
          :  -> SCF convergence          0.1000000E-05 Eh   :
          :  -> wf. convergence          0.1000000E-03 e    :
          :  Broyden damping             0.4000000          :
          ...................................................

 iter      E             dE          RMSdq      gap      omega  full diag
   1    -32.7234936 -0.327235E+02  0.415E+00    1.04       0.0  T
   2    -32.8007792 -0.772855E-01  0.318E+00    1.43       1.0  T
   3    -32.8408122 -0.400330E-01  0.182E+00    1.36       1.0  T
   4    -32.8424859 -0.167374E-02  0.742E-01    1.31       1.0  T
   5    -32.8502709 -0.778500E-02  0.171E-01    1.31       1.0  T
   6    -32.8505677 -0.296842E-03  0.114E-01    1.32       1.0  T
   7    -32.8507546 -0.186879E-03  0.327E-02    1.33       1.0  T
   8    -32.8507572 -0.256485E-05  0.179E-02    1.32       1.2  T
   9    -32.8507566  0.586093E-06  0.146E-02    1.32       1.5  T
  10    -32.8507610 -0.444472E-05  0.298E-03    1.32       7.1  T
  11    -32.8507612 -0.115564E-06  0.822E-04    1.32      25.9  T
  12    -32.8507612 -0.162238E-08  0.515E-04    1.32      41.4  T

   *** convergence criteria satisfied after 12 iterations ***

         #    Occupation            Energy/Eh            Energy/eV
      -------------------------------------------------------------
         1        2.0000           -0.6428122             -17.4918
       ...           ...                  ...                  ...
        24        2.0000           -0.4252338             -11.5712
        25        2.0000           -0.4209037             -11.4534
        26        2.0000           -0.4103559             -11.1664
        27        2.0000           -0.4095085             -11.1433
        28        2.0000           -0.3711134             -10.0985
        29        2.0000           -0.3457306              -9.4078
        30        2.0000           -0.3350492              -9.1172 (HOMO)
        31                         -0.2864762              -7.7954 (LUMO)
        32                         -0.1776732              -4.8347
        33                         -0.1240912              -3.3767
        34                         -0.1208456              -3.2884
        35                         -0.0701809              -1.9097
       ...                                ...                  ...
        58                          0.8116015              22.0848
      -------------------------------------------------------------
                  HL-Gap            0.0485729 Eh            1.3217 eV
             Fermi-level           -0.3107627 Eh           -8.4563 eV

 SCC (total)                   0 d,  0 h,  0 min,  0.027 sec
 SCC setup                      ...        0 min,  0.000 sec (  0.981%)
 Dispersion                     ...        0 min,  0.000 sec (  1.212%)
 integral evaluation            ...        0 min,  0.006 sec ( 22.879%)
 zeroth order Hamiltonian       ...        0 min,  0.000 sec (  0.449%)
 iterations                     ...        0 min,  0.011 sec ( 40.806%)
 molecular gradient             ...        0 min,  0.009 sec ( 32.443%)
 printout                       ...        0 min,  0.000 sec (  1.056%)

         :::::::::::::::::::::::::::::::::::::::::::::::::::::
         ::                     SUMMARY                     ::
         :::::::::::::::::::::::::::::::::::::::::::::::::::::
         :: total energy             -32.266893559203 Eh    ::
         :: gradient norm              0.057508255454 Eh/a0 ::
         :: HOMO-LUMO gap              1.321736833837 eV    ::
         ::.................................................::
         :: SCC energy               -32.850761162488 Eh    ::
         :: -> isotropic ES            0.019387476521 Eh    ::
         :: -> anisotropic ES          0.008758398983 Eh    ::
         :: -> anisotropic XC          0.019687475676 Eh    ::
         :: -> dispersion             -0.019795143217 Eh    ::
         :: repulsion energy           0.583953946940 Eh    ::
         :: add. restraining           0.000000000000 Eh    ::
         :::::::::::::::::::::::::::::::::::::::::::::::::::::

      ----------------------------------------------------------- 
     |                   =====================                   |
     |                        A N C O P T                        |
     |                   =====================                   |
     |               Approximate Normal Coordinate               |
     |                Rational Function Optimizer                |
      ----------------------------------------------------------- 

          ...................................................
          :                      SETUP                      :
          :.................................................:
          :   optimization level            normal          :
          :   max. optcycles                   200          :
          :   ANC micro-cycles                  20          :
          :   degrees of freedom                60          :
          :.................................................:
          :   RF solver                   davidson          :
          :   input Hessian                  false          :
          :   write xtbopt.log                true          :
          :   linear?                        false          :
          :   energy convergence         0.5000000E-05 Eh   :
          :   grad. convergence          0.1000000E-02 Eh/α :
          :   maximium RF displ.         2.0000000          :
          :   Hlow (freq-cutoff)         0.5000000E-02      :
          :   Hmax (freq-cutoff)         5.0000000          :
          :   S6 in model hess.         20.0000000          :
          ...................................................

generating ANC from model Hessian ...
Using Lindh-Hessian (1995)
 Shifting diagonal of input Hessian by   3.813681915385465E-003
 Lowest  eigenvalues of input Hessian
   -0.000000   -0.000000   -0.000000   -0.000000    0.000000    0.000000
    0.005000    0.006409    0.007942    0.010797    0.015994    0.016492
    0.020384    0.022364    0.027808    0.028896    0.033674    0.039950
 Highest eigenvalues
    1.836789    1.894563    1.912702    2.098080    2.132372    2.166047
 

........................................................................
.............................. CYCLE    1 ..............................
........................................................................
   1    -32.8507612 -0.328508E+02  0.133E-04    1.32       0.0  T
   2    -32.8507612 -0.830482E-10  0.909E-05    1.32     234.5  T
   3    -32.8507612 -0.109097E-09  0.437E-05    1.32     487.5  T
     SCC iter.                  ...        0 min,  0.003 sec
     gradient                   ...        0 min,  0.009 sec
 * total energy  :   -32.2668936 Eh     change       -0.5451525E-08 Eh
   gradient norm :     0.0575088 Eh/α   predicted     0.0000000E+00 (-100.00%)
   displ. norm   :     0.2355061 α      lambda       -0.5209613E-02
   maximum displ.:     0.1330538 α      in ANC's #13, #9, #15, ...

........................................................................
.............................. CYCLE    2 ..............................
........................................................................
   1    -32.8457447 -0.328457E+02  0.181E-01    1.23       0.0  T
   2    -32.8457593 -0.146528E-04  0.105E-01    1.23       1.0  T
   3    -32.8457366  0.226718E-04  0.358E-02    1.23       1.0  T
   4    -32.8457551 -0.185039E-04  0.203E-02    1.23       1.1  T
   5    -32.8457646 -0.942017E-05  0.543E-03    1.23       3.9  T
   6    -32.8457647 -0.154761E-06  0.265E-03    1.23       8.0  T
   7    -32.8457648 -0.103926E-06  0.104E-03    1.23      20.5  T
     SCC iter.                  ...        0 min,  0.005 sec
     gradient                   ...        0 min,  0.008 sec
 * total energy  :   -32.2703712 Eh     change       -0.3477591E-02 Eh
   gradient norm :     0.0245522 Eh/α   predicted    -0.2749290E-02 ( -20.94%)
   displ. norm   :     0.1606183 α      lambda       -0.1386780E-02
   maximum displ.:     0.1096484 α      in ANC's #6, #13, #15, ...

........................................................................
.............................. CYCLE    3 ..............................
........................................................................
   1    -32.8441195 -0.328441E+02  0.163E-01    1.17       0.0  T
   2    -32.8441326 -0.131018E-04  0.937E-02    1.18       1.0  T
   3    -32.8440788  0.538304E-04  0.588E-02    1.17       1.0  T
   4    -32.8441448 -0.660114E-04  0.105E-02    1.18       2.0  T
   5    -32.8441456 -0.781309E-06  0.769E-03    1.18       2.8  T
   6    -32.8441466 -0.105452E-05  0.368E-03    1.18       5.8  T
   7    -32.8441468 -0.177590E-06  0.126E-03    1.18      16.9  T
     SCC iter.                  ...        0 min,  0.005 sec
     gradient                   ...        0 min,  0.009 sec
 * total energy  :   -32.2711932 Eh     change       -0.8220372E-03 Eh
   gradient norm :     0.0089011 Eh/α   predicted    -0.7112885E-03 ( -13.47%)
   displ. norm   :     0.0743796 α      lambda       -0.2599752E-03
   maximum displ.:     0.0394966 α      in ANC's #6, #1, #14, ...

........................................................................
.............................. CYCLE    4 ..............................
........................................................................
   1    -32.8449772 -0.328450E+02  0.970E-02    1.16       0.0  T
   2    -32.8449818 -0.467379E-05  0.579E-02    1.16       1.0  T
   3    -32.8449652  0.166845E-04  0.427E-02    1.16       1.0  T
   4    -32.8449965 -0.313424E-04  0.541E-03    1.16       3.9  T
   5    -32.8449968 -0.308955E-06  0.251E-03    1.16       8.5  T
   6    -32.8449968 -0.353781E-07  0.146E-03    1.16      14.6  T
     SCC iter.                  ...        0 min,  0.005 sec
     gradient                   ...        0 min,  0.009 sec
 * total energy  :   -32.2713681 Eh     change       -0.1749494E-03 Eh
   gradient norm :     0.0060787 Eh/α   predicted    -0.1307527E-03 ( -25.26%)
   displ. norm   :     0.0826395 α      lambda       -0.1708128E-03
   maximum displ.:     0.0437028 α      in ANC's #1, #6, #14, ...

........................................................................
.............................. CYCLE    5 ..............................
........................................................................
   1    -32.8466393 -0.328466E+02  0.104E-01    1.15       0.0  T
   2    -32.8466447 -0.541129E-05  0.631E-02    1.16       1.0  T
   3    -32.8466318  0.129858E-04  0.461E-02    1.15       1.0  T
   4    -32.8466636 -0.318353E-04  0.112E-02    1.15       1.9  T
   5    -32.8466661 -0.250487E-05  0.453E-03    1.15       4.7  T
   6    -32.8466664 -0.337657E-06  0.221E-03    1.15       9.6  T
   7    -32.8466665 -0.611026E-07  0.969E-04    1.15      22.0  T
     SCC iter.                  ...        0 min,  0.006 sec
     gradient                   ...        0 min,  0.009 sec
 * total energy  :   -32.2714735 Eh     change       -0.1053589E-03 Eh
   gradient norm :     0.0045406 Eh/α   predicted    -0.8599106E-04 ( -18.38%)
   displ. norm   :     0.0443832 α      lambda       -0.5063002E-04
   maximum displ.:     0.0329113 α      in ANC's #1, #7, #2, ...

........................................................................
.............................. CYCLE    6 ..............................
........................................................................
   1    -32.8480323 -0.328480E+02  0.548E-02    1.16       0.0  T
   2    -32.8480335 -0.120858E-05  0.323E-02    1.16       1.0  T
   3    -32.8480274  0.603727E-05  0.231E-02    1.16       1.0  T
   4    -32.8480370 -0.956423E-05  0.458E-03    1.16       4.7  T
   5    -32.8480374 -0.404437E-06  0.201E-03    1.16      10.6  T
   6    -32.8480375 -0.558247E-07  0.113E-03    1.16      18.9  T
     SCC iter.                  ...        0 min,  0.005 sec
     gradient                   ...        0 min,  0.009 sec
 * total energy  :   -32.2715067 Eh     change       -0.3319600E-04 Eh
   gradient norm :     0.0025172 Eh/α   predicted    -0.2537268E-04 ( -23.57%)
   displ. norm   :     0.0365394 α      lambda       -0.1975811E-04
   maximum displ.:     0.0295691 α      in ANC's #1, #2, #7, ...

........................................................................
.............................. CYCLE    7 ..............................
........................................................................
   1    -32.8485957 -0.328486E+02  0.385E-02    1.16       0.0  T
   2    -32.8485963 -0.596801E-06  0.216E-02    1.16       1.0  T
   3    -32.8485939  0.241046E-05  0.118E-02    1.16       1.8  T
   4    -32.8485969 -0.300865E-05  0.149E-03    1.16      14.3  T
   5    -32.8485969 -0.263257E-07  0.902E-04    1.16      23.6  T
   6    -32.8485969 -0.395709E-08  0.613E-04    1.16      34.8  T
     SCC iter.                  ...        0 min,  0.005 sec
     gradient                   ...        0 min,  0.009 sec
 * total energy  :   -32.2715201 Eh     change       -0.1341694E-04 Eh
   gradient norm :     0.0013018 Eh/α   predicted    -0.9893382E-05 ( -26.26%)
   displ. norm   :     0.0416528 α      lambda       -0.7760092E-05
   maximum displ.:     0.0352987 α      in ANC's #1, #2, #7, ...

........................................................................
.............................. CYCLE    8 ..............................
........................................................................
   1    -32.8486471 -0.328486E+02  0.375E-02    1.16       0.0  T
   2    -32.8486477 -0.562859E-06  0.207E-02    1.15       1.0  T
   3    -32.8486473  0.390910E-06  0.538E-03    1.16       4.0  T
   4    -32.8486477 -0.432532E-06  0.262E-03    1.15       8.1  T
   5    -32.8486479 -0.132916E-06  0.129E-03    1.15      16.5  T
   6    -32.8486479 -0.325712E-07  0.437E-04    1.15      48.8  T
   7    -32.8486479 -0.143609E-08  0.187E-04    1.15     114.0  T
     SCC iter.                  ...        0 min,  0.006 sec
     gradient                   ...        0 min,  0.009 sec
 * total energy  :   -32.2715261 Eh     change       -0.5957586E-05 Eh
   gradient norm :     0.0010138 Eh/α   predicted    -0.3883412E-05 ( -34.82%)
   displ. norm   :     0.0416041 α      lambda        0.8000448E-05
   maximum displ.:     0.0352415 α      in ANC's #1, #2, #7, ...

........................................................................
.............................. CYCLE    9 ..............................
........................................................................
   1    -32.8486545 -0.328487E+02  0.375E-02    1.15       0.0  T
   2    -32.8486551 -0.575977E-06  0.207E-02    1.15       1.0  T
   3    -32.8486550  0.104006E-06  0.398E-03    1.15       5.4  T
   4    -32.8486552 -0.255249E-06  0.145E-03    1.15      14.7  T
   5    -32.8486553 -0.363359E-07  0.552E-04    1.15      38.6  T
   6    -32.8486553 -0.108123E-08  0.308E-04    1.15      69.2  T
     SCC iter.                  ...        0 min,  0.005 sec
     gradient                   ...        0 min,  0.009 sec
 * total energy  :   -32.2715206 Eh     change        0.5462276E-05 Eh
   gradient norm :     0.0022948 Eh/α   predicted     0.4003290E-05 ( -26.71%)
   displ. norm   :     0.0210029 α      lambda       -0.8760648E-05
   maximum displ.:     0.0154827 α      in ANC's #1, #2, #6, ...

........................................................................
.............................. CYCLE   10 ..............................
........................................................................
   1    -32.8485651 -0.328486E+02  0.224E-02    1.15       0.0  T
   2    -32.8485653 -0.240453E-06  0.123E-02    1.15       1.7  T
   3    -32.8485650  0.267348E-06  0.400E-03    1.15       5.3  T
   4    -32.8485653 -0.227055E-06  0.224E-03    1.15       9.5  T
   5    -32.8485654 -0.117706E-06  0.751E-04    1.15      28.4  T
   6    -32.8485654 -0.984732E-08  0.293E-04    1.15      72.8  T
     SCC iter.                  ...        0 min,  0.005 sec
     gradient                   ...        0 min,  0.009 sec
 * total energy  :   -32.2715267 Eh     change       -0.6103109E-05 Eh
   gradient norm :     0.0010329 Eh/α   predicted    -0.4382469E-05 ( -28.19%)
   displ. norm   :     0.0150365 α      lambda       -0.2929347E-05
   maximum displ.:     0.0065921 α      in ANC's #6, #2, #7, ...

........................................................................
.............................. CYCLE   11 ..............................
........................................................................
   1    -32.8484902 -0.328485E+02  0.204E-02    1.15       0.0  T
   2    -32.8484904 -0.224845E-06  0.112E-02    1.15       1.9  T
   3    -32.8484902  0.275465E-06  0.416E-03    1.15       5.1  T
   4    -32.8484904 -0.286454E-06  0.180E-03    1.15      11.8  T
   5    -32.8484905 -0.616393E-07  0.913E-04    1.15      23.4  T
   6    -32.8484905 -0.169693E-07  0.319E-04    1.15      66.9  T
     SCC iter.                  ...        0 min,  0.005 sec
     gradient                   ...        0 min,  0.009 sec
 * total energy  :   -32.2715284 Eh     change       -0.1687207E-05 Eh
   gradient norm :     0.0003499 Eh/α   predicted    -0.1465566E-05 ( -13.14%)
   displ. norm   :     0.0121207 α      lambda       -0.6372020E-06
   maximum displ.:     0.0115483 α      in ANC's #1, #2, #7, ...

   *** GEOMETRY OPTIMIZATION CONVERGED AFTER 11 ITERATIONS ***

------------------------------------------------------------------------
 total energy gain   :        -0.0046348 Eh       -2.9084 kcal/mol
 total RMSD          :         0.1131246 a0        0.0599 Å
 total power (kW/mol):        -1.1062521 (step)  -52.7392 (real)
------------------------------------------------------------------------

 ANCopt (total)                0 d,  0 h,  0 min,  0.231 sec
 optimizer setup                ...        0 min,  0.000 sec (  0.057%)
 model hessian                  ...        0 min,  0.003 sec (  1.275%)
 ANC generation                 ...        0 min,  0.001 sec (  0.235%)
 coordinate transformation      ...        0 min,  0.000 sec (  0.070%)
 single point calculation       ...        0 min,  0.224 sec ( 97.073%)
 optimization log               ...        0 min,  0.001 sec (  0.402%)
 hessian update                 ...        0 min,  0.000 sec (  0.053%)
 rational function              ...        0 min,  0.001 sec (  0.548%)

================
 final structure:
================
$coord
    2.25766455006421    0.53642890861130   -0.06397540911009      C 
    1.49113337761983   -1.92472904572830   -0.06522849618655      C 
   -1.26715492557994   -1.98557597481591   -0.07724251368782      C 
   -2.11883261476537    0.40744026526033   -0.07751198562948      C 
    0.05901049746200    2.10834987673388   -0.07467450801436      C 
   -0.05432129941394    4.69745619161850   -0.07715653087008      C 
    2.12348367098478    6.39839100974791   -0.08348117949737      C 
    1.27175645231817    8.79138414636936   -0.08777795641878      C 
   -1.48650024876972    8.73049503695665   -0.07543933780863      C 
   -2.25297167578265    6.26934835683109   -0.06933682846195      C 
   -2.93780667548599   10.86883153310796   -0.19780244830989      N 
    2.94236190608143   -4.06330214622908   -0.18352645712657      N 
    4.17453729296148    1.19630683462882   -0.05983263919263      H 
   -2.36121589557410   -3.69850352249616   -0.08480708064280      H 
   -4.05079873713680    1.02311810712166   -0.08190011324510      H 
    4.05546142081967    5.78269656826788   -0.08681973107272      H 
    2.36580595405307   10.50430390538912   -0.09873551223867      H 
   -4.16981853104578    5.60941531464935   -0.06377662088356      H 
   -2.12808224810259   12.49610828574474    0.36364066646846      H 
   -4.78229178044782   10.68192988627634    0.22972474452403      H 
    4.78693569367365   -3.87576233797569    0.24324833649890      H 
    2.13260972491900   -5.68961415714162    0.38057692531891      H 
$end
           -------------------------------------------------
          |                Final Singlepoint                |
           -------------------------------------------------

          ...................................................
          :                      SETUP                      :
          :.................................................:
          :  # basis functions                  58          :
          :  # atomic orbitals                  58          :
          :  # shells                           34          :
          :  # electrons                        60          :
          :  max. iterations                   250          :
          :  Hamiltonian                  GFN2-xTB          :
          :  restarted?                      false          :
          :  GBSA solvation                  false          :
          :  PC potential                    false          :
          :  electronic temp.          300.0000000     K    :
          :  accuracy                    1.0000000          :
          :  -> integral cutoff          0.2500000E+02      :
          :  -> integral neglect         0.1000000E-07      :
          :  -> SCF convergence          0.1000000E-05 Eh   :
          :  -> wf. convergence          0.1000000E-03 e    :
          :  Broyden damping             0.4000000          :
          ...................................................

 iter      E             dE          RMSdq      gap      omega  full diag
   1    -32.8484905 -0.328485E+02  0.175E-04    1.15       0.0  T
   2    -32.8484905  0.353850E-11  0.939E-05    1.15     227.2  T
   3    -32.8484905 -0.107740E-09  0.986E-05    1.15     216.2  T

   *** convergence criteria satisfied after 3 iterations ***

         #    Occupation            Energy/Eh            Energy/eV
      -------------------------------------------------------------
         1        2.0000           -0.6383829             -17.3713
       ...           ...                  ...                  ...
        24        2.0000           -0.4236208             -11.5273
        25        2.0000           -0.4207959             -11.4504
        26        2.0000           -0.4083191             -11.1109
        27        2.0000           -0.4059463             -11.0464
        28        2.0000           -0.3679678             -10.0129
        29        2.0000           -0.3421822              -9.3113
        30        2.0000           -0.3278739              -8.9219 (HOMO)
        31                         -0.2854710              -7.7681 (LUMO)
        32                         -0.1714278              -4.6648
        33                         -0.1236162              -3.3638
        34                         -0.1202315              -3.2717
        35                         -0.0674044              -1.8342
       ...                                ...                  ...
        58                          0.7806710              21.2431
      -------------------------------------------------------------
                  HL-Gap            0.0424029 Eh            1.1538 eV
             Fermi-level           -0.3066724 Eh           -8.3450 eV

 SCC (total)                   0 d,  0 h,  0 min,  0.018 sec
 SCC setup                      ...        0 min,  0.000 sec (  0.840%)
 Dispersion                     ...        0 min,  0.000 sec (  0.862%)
 integral evaluation            ...        0 min,  0.006 sec ( 32.544%)
 zeroth order Hamiltonian       ...        0 min,  0.000 sec (  0.508%)
 iterations                     ...        0 min,  0.003 sec ( 15.327%)
 molecular gradient             ...        0 min,  0.009 sec ( 48.268%)
 printout                       ...        0 min,  0.000 sec (  1.432%)

         :::::::::::::::::::::::::::::::::::::::::::::::::::::
         ::                     SUMMARY                     ::
         :::::::::::::::::::::::::::::::::::::::::::::::::::::
         :: total energy             -32.271528382127 Eh    ::
         :: gradient norm              0.000347720826 Eh/a0 ::
         :: HOMO-LUMO gap              1.153842455700 eV    ::
         ::.................................................::
         :: SCC energy               -32.848490526886 Eh    ::
         :: -> isotropic ES            0.019520826757 Eh    ::
         :: -> anisotropic ES          0.009113910171 Eh    ::
         :: -> anisotropic XC          0.019039978452 Eh    ::
         :: -> dispersion             -0.019717993494 Eh    ::
         :: repulsion energy           0.577054605700 Eh    ::
         :: add. restraining           0.000000000000 Eh    ::
         :::::::::::::::::::::::::::::::::::::::::::::::::::::

           -------------------------------------------------
          |                Property Printout                |
           -------------------------------------------------

    * Orbital Energies and Occupations

         #    Occupation            Energy/Eh            Energy/eV
      -------------------------------------------------------------
         1        2.0000           -0.6383829             -17.3713
       ...           ...                  ...                  ...
        18        2.0000           -0.4704614             -12.8019
        19        2.0000           -0.4575917             -12.4517
        20        2.0000           -0.4498221             -12.2403
        21        2.0000           -0.4447814             -12.1031
        22        2.0000           -0.4345401             -11.8244
        23        2.0000           -0.4306458             -11.7185
        24        2.0000           -0.4236208             -11.5273
        25        2.0000           -0.4207959             -11.4504
        26        2.0000           -0.4083191             -11.1109
        27        2.0000           -0.4059463             -11.0464
        28        2.0000           -0.3679678             -10.0129
        29        2.0000           -0.3421822              -9.3113
        30        2.0000           -0.3278739              -8.9219 (HOMO)
        31                         -0.2854710              -7.7681 (LUMO)
        32                         -0.1714278              -4.6648
        33                         -0.1236162              -3.3638
        34                         -0.1202315              -3.2717
        35                         -0.0674044              -1.8342
        36                          0.0315313               0.8580
        37                          0.0393517               1.0708
        38                          0.1099796               2.9927
        39                          0.1251151               3.4046
        40                          0.1444745               3.9314
        41                          0.1453816               3.9560
       ...                                ...                  ...
        58                          0.7806710              21.2431
      -------------------------------------------------------------
                  HL-Gap            0.0424029 Eh            1.1538 eV
             Fermi-level           -0.3066724 Eh           -8.3450 eV

     #   Z        covCN         q      C6AA      α(0)
     1   6 C      2.996    -0.106    30.677     9.086
     2   6 C      3.019     0.072    26.378     8.425
     3   6 C      3.015    -0.059    29.442     8.901
     4   6 C      3.005    -0.049    29.194     8.863
     5   6 C      3.093     0.015    27.576     8.607
     6   6 C      3.093     0.015    27.576     8.607
     7   6 C      3.006    -0.049    29.194     8.863
     8   6 C      3.015    -0.059    29.442     8.901
     9   6 C      3.019     0.072    26.378     8.425
    10   6 C      2.996    -0.106    30.677     9.086
    11   7 N      2.634    -0.259    26.718     7.677
    12   7 N      2.634    -0.259    26.718     7.677
    13   1 H      0.926     0.014     2.820     2.626
    14   1 H      0.926     0.019     2.748     2.592
    15   1 H      0.926     0.028     2.615     2.529
    16   1 H      0.926     0.028     2.615     2.529
    17   1 H      0.926     0.019     2.748     2.592
    18   1 H      0.926     0.014     2.820     2.626
    19   1 H      0.860     0.164     1.311     1.794
    20   1 H      0.860     0.161     1.326     1.804
    21   1 H      0.860     0.161     1.326     1.804
    22   1 H      0.860     0.164     1.311     1.794

 Mol. C6AA /au·bohr⁶  :       6129.541509
 Mol. C8AA /au·bohr⁸  :     149375.949882
 Mol. α(0) /au        :        125.804574


Wiberg/Mayer (AO) data.
largest (>0.10) Wiberg bond orders for each atom
          total WBO             WBO to atom ...
     1  C   3.957        C    2 1.540    C    5 1.197    H   13 0.971
     2  C   3.903        C    1 1.540    N   12 1.176    C    3 1.078
     3  C   3.935        C    4 1.760    C    2 1.078    H   14 0.972
     4  C   3.978        C    3 1.760    C    5 1.084    H   15 0.972
     5  C   3.985        C    6 1.465    C    1 1.197    C    4 1.084
     6  C   3.985        C    5 1.465    C   10 1.197    C    7 1.084
     7  C   3.978        C    8 1.760    C    6 1.084    H   16 0.972
     8  C   3.935        C    7 1.760    C    9 1.078    H   17 0.972
     9  C   3.903        C   10 1.540    N   11 1.176    C    8 1.078
    10  C   3.957        C    9 1.540    C    6 1.197    H   18 0.971
    11  N   3.253        C    9 1.176    H   20 0.955    H   19 0.954
    12  N   3.253        C    2 1.176    H   21 0.955    H   22 0.954
    13  H   1.000        C    1 0.971
    14  H   0.999        C    3 0.972
    15  H   0.999        C    4 0.972
    16  H   0.999        C    7 0.972
    17  H   0.999        C    8 0.972
    18  H   1.000        C   10 0.971
    19  H   0.971        N   11 0.954
    20  H   0.973        N   11 0.955
    21  H   0.973        N   12 0.955
    22  H   0.971        N   12 0.954

molecular dipole:
                 x           y           z       tot (Debye)
 q only:        0.000      -0.000       0.306
   full:        0.000       0.000       0.666       1.692
molecular quadrupole (traceless):
                xx          xy          yy          xz          yz          zz
 q only:       -3.273      -9.758      13.447       0.010       1.543     -10.173
  q+dip:       -0.976     -10.252      19.222       0.010       3.366     -18.246
   full:       -2.203     -10.445      17.010       0.011       3.372     -14.807

           -------------------------------------------------
          |                Geometry Summary                 |
           -------------------------------------------------

      molecular mass/u    :      158.2024000
   center of mass at/Å    :        0.0012263       1.8007275      -0.0455719
  moments of inertia/u·Å² :        0.1514001E+03   0.1106355E+04   0.1257218E+04
rotational constants/cm⁻¹ :        0.1113449E+00   0.1523709E-01   0.1340868E-01

 * 19 selected distances

     #   Z        #   Z                                     value/Å
     1   6 C      2   6 C                                 1.3640944
     3   6 C      4   6 C                                 1.3441396
     1   6 C      5   6 C                                 1.4302605 (max)
     5   6 C      6   6 C                                 1.3714088
     7   6 C      8   6 C                                 1.3441388
     6   6 C     10   6 C                                 1.4302448
     9   6 C     10   6 C                                 1.3640829
     9   6 C     11   7 N                                 1.3691020
     2   6 C     12   7 N                                 1.3690823
     1   6 C     13   1 H                                 1.0727896
     3   6 C     14   1 H                                 1.0755646
     4   6 C     15   1 H                                 1.0730133
     7   6 C     16   1 H                                 1.0730208
     8   6 C     17   1 H                                 1.0755661
    10   6 C     18   1 H                                 1.0727879
    11   7 N     19   1 H                                 1.0066756
    11   7 N     20   1 H                                 1.0068057
    12   7 N     21   1 H                                 1.0067951
    12   7 N     22   1 H                                 1.0066618 (min)

 * 4 distinct bonds (by element types)

   Z      Z             #   av. dist./Å        max./Å        min./Å
   1 H    6 C           6     1.0737904     1.0755661     1.0727879
   6 C    6 C           7     1.3783385     1.4302605     1.3441388
   1 H    7 N           4     1.0067346     1.0068057     1.0066618
   6 C    7 N           2     1.3690921     1.3691020     1.3690823


optimized geometry written to: xtbopt.xyz


           -------------------------------------------------
          | TOTAL ENERGY              -32.271528382127 Eh   |
          | GRADIENT NORM               0.000347720826 Eh/α |
          | HOMO-LUMO GAP               1.153842455700 eV   |
           -------------------------------------------------

------------------------------------------------------------------------
 * finished run on 2021/05/19 at 10:58:46.451     
------------------------------------------------------------------------
 total:
 * wall-time:     0 d,  0 h,  0 min,  0.293 sec
 *  cpu-time:     0 d,  0 h,  0 min,  0.293 sec
 * ratio c/w:     0.999 speedup
 SCF:
 * wall-time:     0 d,  0 h,  0 min,  0.027 sec
 *  cpu-time:     0 d,  0 h,  0 min,  0.027 sec
 * ratio c/w:     1.000 speedup
 ANC optimizer:
 * wall-time:     0 d,  0 h,  0 min,  0.249 sec
 *  cpu-time:     0 d,  0 h,  0 min,  0.249 sec
 * ratio c/w:     1.000 speedup

