      -----------------------------------------------------------      
     |                   =====================                   |     
     |                           x T B                           |     
     |                   =====================                   |     
     |                         S. Grimme                         |     
     |          Mulliken Center for Theoretical Chemistry        |     
     |                    University of Bonn                     |     
     |                Version 6.2 RC2 (SAW190805)                |     
      -----------------------------------------------------------      

   This program is distributed in the hope that it will be useful,
   but WITHOUT ANY WARRANTY; without even the implied warranty of
   MERCHANTABILITY or FITNESS FOR A PARTICULAR PURPOSE.
   
   FOR NON-COMMERCIAL, ACADEMIA USE ONLY.
   
   Cite this work as:
   * S. Grimme, C. Bannwarth, P. Shushkov, J. Chem. Theory Comput., 2017,
     13, 1989-2009. DOI: 10.1021/acs.jctc.7b00118
   * C. Bannwarth, S. Ehlert and S. Grimme., J. Chem. Theory Comput., 2019,
     15, 1652-1671. DOI: 10.1021/acs.jctc.8b01176
   * P. Pracht, E. Caldeweyher, S. Ehlert, S. Grimme, ChemRxiv, 2019, preprint.
     DOI: 10.26434/chemrxiv.8326202.v1
   
   for DFT-D4:
   * E. Caldeweyher, C. Bannwarth and S. Grimme, J. Chem. Phys., 2017,
     147, 034112. DOI: 10.1063/1.4993215
   * E. Caldeweyher, S. Ehlert, A. Hansen, H. Neugebauer, S. Spicher,
     C. Bannwarth and S. Grimme, J. Chem. Phys., 2019, 150, 154122.
     DOI: 10.1063/1.5090222
   
   for sTDA-xTB:
   * S. Grimme and C. Bannwarth, J. Chem. Phys., 2016, 145, 054103.
     DOI: 10.1063/1.4959605
   
   in the mass-spec context:
   * V. Asgeirsson, C. Bauer and S. Grimme, Chem. Sci., 2017, 8, 4879.
     DOI: 10.1039/c7sc00601b
   
   for metadynamics refer to:
   * S. Grimme, J. Chem. Theory Comput., 2019, 155, 2847-2862
     DOI: 10.1021/acs.jctc.9b00143
   
   with help from (in alphabetical order)
   C. Bannwarth, F. Bohle, G. Brandenburg, E. Caldeweyher, M. Checinski,
   S. Dohm, S. Ehlert, S. Ehrlich, F. März, H. Neugebauer, J. Pisarek,
   P. Pracht, P. Shushkov, and S. Spicher.
   
 * started run on 2021/05/19 at 11:00:09.356     

           -------------------------------------------------
          |                Calculation Setup                |
           -------------------------------------------------

          program call               : /ihome/ghutchison/geoffh/xtb/xtb 712.xyz -opt
          hostname                   : smp-n83
          coordinate file            : 712.xyz
          omp threads                :                     1
          number of atoms            :                    29
          number of electrons        :                    86
          charge                     :                     0
          spin                       :                   0.0
          first test random number   :      0.28802436100415


########################################################################
# WARNING! Please study the warnings concerning your input carefully
#  - the use of '-opt' is discouraged, please use '--opt' next time
########################################################################

           ------------------------------------------------- 
          |                 G F N 2 - x T B                 |
          | Geometry, Frequencies, Noncovalent interactions |
          |            JCTC 2019 parametrisation            |
           ------------------------------------------------- 
             KAB for C  - Si     :                1.0500
             KAB for H  - Pd     :                0.9500
             k(s)              :                1.8500
             k(p)              :                2.2300
             k(d)              :                2.2300
             k(f)              :                2.0000
             kEN (H0ij)        :               -2.0000
             D4 a1             :                0.5200
             D4 a2             :                5.0000
             D4 s6             :                1.0000
             D4 s8             :                2.7000
             D4 s9             :                5.0000
             alphaj            :                2.0000

  Z AO/shell   Hii/eV     exponent
  1     Wed Apr 25 08:07:45 CEST 2018   EN: 2.200 GM2: 0.406  GM3: 0.0800  RAES: 1.40
     1s    -10.707211    1.230000
  6     Wed Apr 25 08:07:45 CEST 2018   EN: 2.550 GM2: 0.538  GM3: 0.1500  RAES: 3.00
     2s    -13.970922    2.096432
     2p    -10.063292    1.800000
  7     Wed Apr 25 08:07:45 CEST 2018   EN: 3.040 GM2: 0.461  GM3:-0.0640  RAES: 1.90
     2s    -16.686243    2.339881
     2p    -12.523956    2.014332
 16     Tue Apr 24 11:44:34 CEST 2018   EN: 2.580 GM2: 0.340  GM3:-0.0502  RAES: 3.10
     3s    -20.029654    1.981333
     3p    -11.377694    2.025643
     3d     -0.420282    1.702555

           ------------------------------------------------- 
          |        Self-Consistent Charge Iterations        |
           ------------------------------------------------- 

          ...................................................
          :                      SETUP                      :
          :.................................................:
          :  # basis functions                  86          :
          :  # atomic orbitals                  85          :
          :  # shells                           47          :
          :  # electrons                        86          :
          :  max. iterations                   250          :
          :  Hamiltonian                  GFN2-xTB          :
          :  restarted?                      false          :
          :  GBSA solvation                  false          :
          :  PC potential                    false          :
          :  electronic temp.          300.0000000     K    :
          :  accuracy                    1.0000000          :
          :  -> integral cutoff          0.2500000E+02      :
          :  -> integral neglect         0.1000000E-07      :
          :  -> SCF convergence          0.1000000E-05 Eh   :
          :  -> wf. convergence          0.1000000E-03 e    :
          :  Broyden damping             0.4000000          :
          ...................................................

 iter      E             dE          RMSdq      gap      omega  full diag
   1    -47.2999958 -0.473000E+02  0.403E+00    1.36       0.0  T
   2    -47.3555939 -0.555981E-01  0.261E+00    1.04       1.0  T
   3    -47.3572210 -0.162712E-02  0.120E+00    1.00       1.0  T
   4    -47.3699007 -0.126797E-01  0.288E-01    0.74       1.0  T
   5    -47.3703360 -0.435368E-03  0.125E-01    0.75       1.0  T
   6    -47.3704607 -0.124652E-03  0.716E-02    0.75       1.0  T
   7    -47.3705183 -0.576058E-04  0.410E-02    0.76       1.0  T
   8    -47.3705515 -0.331495E-04  0.186E-02    0.76       1.0  T
   9    -47.3705540 -0.255596E-05  0.101E-02    0.76       1.8  T
  10    -47.3705566 -0.257707E-05  0.179E-03    0.76      10.4  T
  11    -47.3705566 -0.251089E-08  0.638E-04    0.76      29.1  T
  12    -47.3705566 -0.194955E-08  0.305E-04    0.76      60.9  T

   *** convergence criteria satisfied after 12 iterations ***

         #    Occupation            Energy/Eh            Energy/eV
      -------------------------------------------------------------
         1        2.0000           -0.7613401             -20.7171
       ...           ...                  ...                  ...
        37        2.0000           -0.4371671             -11.8959
        38        2.0000           -0.4216486             -11.4736
        39        2.0000           -0.4183283             -11.3833
        40        2.0000           -0.4132488             -11.2451
        41        2.0000           -0.4115253             -11.1982
        42        2.0000           -0.3866489             -10.5213
        43        2.0000           -0.3599348              -9.7943 (HOMO)
        44        0.0000           -0.3321328              -9.0378 (LUMO)
        45                         -0.2816209              -7.6633
        46                         -0.2390128              -6.5039
        47                         -0.2236853              -6.0868
        48                         -0.2112647              -5.7488
       ...                                ...                  ...
        85                          0.6695915              18.2205
      -------------------------------------------------------------
                  HL-Gap            0.0278021 Eh            0.7565 eV
             Fermi-level           -0.3460338 Eh           -9.4161 eV

 SCC (total)                   0 d,  0 h,  0 min,  0.055 sec
 SCC setup                      ...        0 min,  0.000 sec (  0.701%)
 Dispersion                     ...        0 min,  0.001 sec (  0.914%)
 integral evaluation            ...        0 min,  0.014 sec ( 25.970%)
 zeroth order Hamiltonian       ...        0 min,  0.000 sec (  0.422%)
 iterations                     ...        0 min,  0.020 sec ( 36.874%)
 molecular gradient             ...        0 min,  0.019 sec ( 34.164%)
 printout                       ...        0 min,  0.000 sec (  0.852%)

         :::::::::::::::::::::::::::::::::::::::::::::::::::::
         ::                     SUMMARY                     ::
         :::::::::::::::::::::::::::::::::::::::::::::::::::::
         :: total energy             -46.750220440258 Eh    ::
         :: gradient norm              0.124367596562 Eh/a0 ::
         :: HOMO-LUMO gap              0.756532925826 eV    ::
         ::.................................................::
         :: SCC energy               -47.370556594145 Eh    ::
         :: -> isotropic ES            0.034260693709 Eh    ::
         :: -> anisotropic ES          0.007032264758 Eh    ::
         :: -> anisotropic XC          0.037312918414 Eh    ::
         :: -> dispersion             -0.031608150891 Eh    ::
         :: repulsion energy           0.620372246797 Eh    ::
         :: add. restraining           0.000000000000 Eh    ::
         :::::::::::::::::::::::::::::::::::::::::::::::::::::

      ----------------------------------------------------------- 
     |                   =====================                   |
     |                        A N C O P T                        |
     |                   =====================                   |
     |               Approximate Normal Coordinate               |
     |                Rational Function Optimizer                |
      ----------------------------------------------------------- 

          ...................................................
          :                      SETUP                      :
          :.................................................:
          :   optimization level            normal          :
          :   max. optcycles                   200          :
          :   ANC micro-cycles                  20          :
          :   degrees of freedom                81          :
          :.................................................:
          :   RF solver                   davidson          :
          :   input Hessian                  false          :
          :   write xtbopt.log                true          :
          :   linear?                        false          :
          :   energy convergence         0.5000000E-05 Eh   :
          :   grad. convergence          0.1000000E-02 Eh/α :
          :   maximium RF displ.         2.0000000          :
          :   Hlow (freq-cutoff)         0.5000000E-02      :
          :   Hmax (freq-cutoff)         5.0000000          :
          :   S6 in model hess.         20.0000000          :
          ...................................................

generating ANC from model Hessian ...
Using Lindh-Hessian (1995)
 Shifting diagonal of input Hessian by   3.675024775825500E-003
 Lowest  eigenvalues of input Hessian
   -0.000000    0.000000    0.000000    0.000000    0.000000    0.000000
    0.005000    0.005045    0.005981    0.006334    0.008967    0.009282
    0.010519    0.011892    0.018420    0.018774    0.022031    0.025636
 Highest eigenvalues
    1.712037    1.855048    1.959179    1.967241    2.038772    2.161268
 

........................................................................
.............................. CYCLE    1 ..............................
........................................................................
   1    -47.3705566 -0.473706E+02  0.179E-04    0.76       0.0  T
   2    -47.3705566 -0.211060E-09  0.895E-05    0.76     207.5  T
   3    -47.3705566 -0.917524E-10  0.598E-05    0.76     310.7  T
     SCC iter.                  ...        0 min,  0.006 sec
     gradient                   ...        0 min,  0.019 sec
 * total energy  :   -46.7502204 Eh     change        0.2965645E-07 Eh
   gradient norm :     0.1243682 Eh/α   predicted     0.0000000E+00 (-100.00%)
   displ. norm   :     0.1981378 α      lambda       -0.1482395E-01
   maximum displ.:     0.0740647 α      in ANC's #51, #32, #8, ...

........................................................................
.............................. CYCLE    2 ..............................
........................................................................
   1    -47.4079420 -0.474079E+02  0.375E-01    0.79       0.0  T
   2    -47.4082185 -0.276512E-03  0.166E-01    0.79       1.0  T
   3    -47.4081374  0.811433E-04  0.879E-02    0.79       1.0  T
   4    -47.4083059 -0.168501E-03  0.342E-02    0.79       1.0  T
   5    -47.4083233 -0.174285E-04  0.139E-02    0.78       1.3  T
   6    -47.4083233 -0.261823E-08  0.619E-03    0.79       3.0  T
   7    -47.4083241 -0.864893E-06  0.305E-03    0.79       6.1  T
   8    -47.4083244 -0.233403E-06  0.107E-03    0.79      17.3  T
     SCC iter.                  ...        0 min,  0.013 sec
     gradient                   ...        0 min,  0.017 sec
 * total energy  :   -46.7608279 Eh     change       -0.1060747E-01 Eh
   gradient norm :     0.0677820 Eh/α   predicted    -0.7703038E-02 ( -27.38%)
   displ. norm   :     0.1530629 α      lambda       -0.6228319E-02
   maximum displ.:     0.0855344 α      in ANC's #8, #70, #79, ...

........................................................................
.............................. CYCLE    3 ..............................
........................................................................
   1    -47.4343860 -0.474344E+02  0.290E-01    0.85       0.0  T
   2    -47.4345949 -0.208928E-03  0.121E-01    0.83       1.0  T
   3    -47.4345862  0.868717E-05  0.752E-02    0.83       1.0  T
   4    -47.4346646 -0.783755E-04  0.293E-02    0.83       1.0  T
   5    -47.4346775 -0.129478E-04  0.919E-03    0.82       2.0  T
   6    -47.4346785 -0.987387E-06  0.274E-03    0.83       6.8  T
   7    -47.4346786 -0.336857E-07  0.111E-03    0.83      16.7  T
     SCC iter.                  ...        0 min,  0.011 sec
     gradient                   ...        0 min,  0.017 sec
 * total energy  :   -46.7640606 Eh     change       -0.3232729E-02 Eh
   gradient norm :     0.0205997 Eh/α   predicted    -0.3187122E-02 (  -1.41%)
   displ. norm   :     0.0823373 α      lambda       -0.4622704E-03
   maximum displ.:     0.0606491 α      in ANC's #8, #3, #6, ...

........................................................................
.............................. CYCLE    4 ..............................
........................................................................
   1    -47.4322594 -0.474323E+02  0.103E-01    0.86       0.0  T
   2    -47.4322735 -0.140993E-04  0.420E-02    0.84       1.0  T
   3    -47.4322734  0.558555E-07  0.164E-02    0.85       1.1  T
   4    -47.4322759 -0.253764E-05  0.745E-03    0.85       2.5  T
   5    -47.4322762 -0.258710E-06  0.363E-03    0.85       5.1  T
   6    -47.4322764 -0.194769E-06  0.160E-03    0.85      11.6  T
     SCC iter.                  ...        0 min,  0.010 sec
     gradient                   ...        0 min,  0.017 sec
 * total energy  :   -46.7643934 Eh     change       -0.3328125E-03 Eh
   gradient norm :     0.0096832 Eh/α   predicted    -0.2327047E-03 ( -30.08%)
   displ. norm   :     0.0947507 α      lambda       -0.1998032E-03
   maximum displ.:     0.0582867 α      in ANC's #8, #3, #2, ...

........................................................................
.............................. CYCLE    5 ..............................
........................................................................
   1    -47.4301795 -0.474302E+02  0.920E-02    0.87       0.0  T
   2    -47.4301899 -0.103922E-04  0.388E-02    0.87       1.0  T
   3    -47.4301895  0.453457E-06  0.154E-02    0.86       1.2  T
   4    -47.4301917 -0.223976E-05  0.695E-03    0.87       2.7  T
   5    -47.4301921 -0.386246E-06  0.321E-03    0.87       5.8  T
   6    -47.4301923 -0.169580E-06  0.128E-03    0.87      14.5  T
   7    -47.4301923 -0.239825E-07  0.571E-04    0.87      32.5  T
     SCC iter.                  ...        0 min,  0.011 sec
     gradient                   ...        0 min,  0.018 sec
 * total energy  :   -46.7645005 Eh     change       -0.1070288E-03 Eh
   gradient norm :     0.0023618 Eh/α   predicted    -0.1007988E-03 (  -5.82%)
   displ. norm   :     0.0397896 α      lambda       -0.1850244E-04
   maximum displ.:     0.0275596 α      in ANC's #3, #2, #8, ...

........................................................................
.............................. CYCLE    6 ..............................
........................................................................
   1    -47.4301794 -0.474302E+02  0.344E-02    0.87       0.0  T
   2    -47.4301804 -0.985196E-06  0.155E-02    0.87       1.2  T
   3    -47.4301804 -0.287213E-07  0.397E-03    0.87       4.7  T
   4    -47.4301805 -0.111571E-06  0.241E-03    0.87       7.7  T
   5    -47.4301806 -0.818144E-07  0.631E-04    0.87      29.4  T
   6    -47.4301806 -0.553759E-08  0.251E-04    0.87      73.9  T
     SCC iter.                  ...        0 min,  0.010 sec
     gradient                   ...        0 min,  0.019 sec
 * total energy  :   -46.7645144 Eh     change       -0.1397166E-04 Eh
   gradient norm :     0.0016743 Eh/α   predicted    -0.9287221E-05 ( -33.53%)
   displ. norm   :     0.0912745 α      lambda       -0.2090185E-04
   maximum displ.:     0.0641323 α      in ANC's #3, #2, #7, ...

........................................................................
.............................. CYCLE    7 ..............................
........................................................................
   1    -47.4304822 -0.474305E+02  0.643E-02    0.87       0.0  T
   2    -47.4304849 -0.269735E-05  0.309E-02    0.87       1.0  T
   3    -47.4304851 -0.174364E-06  0.679E-03    0.87       2.7  T
   4    -47.4304852 -0.142729E-06  0.443E-03    0.87       4.2  T
   5    -47.4304856 -0.322729E-06  0.110E-03    0.87      16.9  T
   6    -47.4304856 -0.222835E-07  0.560E-04    0.87      33.2  T
   7    -47.4304856 -0.806882E-08  0.146E-04    0.87     127.2  T
     SCC iter.                  ...        0 min,  0.011 sec
     gradient                   ...        0 min,  0.019 sec
 * total energy  :   -46.7645371 Eh     change       -0.2267309E-04 Eh
   gradient norm :     0.0019847 Eh/α   predicted    -0.1049221E-04 ( -53.72%)
   displ. norm   :     0.0886251 α      lambda       -0.1552123E-04
   maximum displ.:     0.0625395 α      in ANC's #3, #2, #7, ...

........................................................................
.............................. CYCLE    8 ..............................
........................................................................
   1    -47.4306942 -0.474307E+02  0.723E-02    0.87       0.0  T
   2    -47.4306978 -0.357292E-05  0.333E-02    0.87       1.0  T
   3    -47.4306985 -0.741037E-06  0.605E-03    0.87       3.1  T
   4    -47.4306984  0.824637E-07  0.237E-03    0.87       7.8  T
   5    -47.4306986 -0.128411E-06  0.386E-04    0.87      48.1  T
   6    -47.4306986 -0.221813E-08  0.233E-04    0.87      79.6  T
     SCC iter.                  ...        0 min,  0.010 sec
     gradient                   ...        0 min,  0.019 sec
 * total energy  :   -46.7645577 Eh     change       -0.2064305E-04 Eh
   gradient norm :     0.0022465 Eh/α   predicted    -0.7790660E-05 ( -62.26%)
   displ. norm   :     0.0860875 α      lambda       -0.2174970E-04
   maximum displ.:     0.0596639 α      in ANC's #3, #2, #4, ...

........................................................................
.............................. CYCLE    9 ..............................
........................................................................
   1    -47.4306568 -0.474307E+02  0.719E-02    0.87       0.0  T
   2    -47.4306604 -0.357064E-05  0.329E-02    0.87       1.0  T
   3    -47.4306612 -0.748639E-06  0.594E-03    0.87       3.1  T
   4    -47.4306610  0.132892E-06  0.229E-03    0.87       8.1  T
   5    -47.4306612 -0.155778E-06  0.614E-04    0.87      30.2  T
   6    -47.4306612 -0.869684E-08  0.240E-04    0.87      77.3  T
     SCC iter.                  ...        0 min,  0.010 sec
     gradient                   ...        0 min,  0.019 sec
 * total energy  :   -46.7645775 Eh     change       -0.1972458E-04 Eh
   gradient norm :     0.0017794 Eh/α   predicted    -0.1095752E-04 ( -44.45%)
   displ. norm   :     0.2054127 α      lambda       -0.2965482E-04
   maximum displ.:     0.1421181 α      in ANC's #3, #2, #4, ...

........................................................................
.............................. CYCLE   10 ..............................
........................................................................
   1    -47.4303436 -0.474303E+02  0.174E-01    0.87       0.0  T
   2    -47.4303650 -0.214060E-04  0.795E-02    0.87       1.0  T
   3    -47.4303695 -0.453284E-05  0.141E-02    0.87       1.3  T
   4    -47.4303692  0.285642E-06  0.380E-03    0.87       4.9  T
   5    -47.4303696 -0.395312E-06  0.765E-04    0.87      24.3  T
   6    -47.4303696 -0.116491E-07  0.333E-04    0.87      55.8  T
     SCC iter.                  ...        0 min,  0.010 sec
     gradient                   ...        0 min,  0.019 sec
 * total energy  :   -46.7646105 Eh     change       -0.3300216E-04 Eh
   gradient norm :     0.0010050 Eh/α   predicted    -0.1511815E-04 ( -54.19%)
   displ. norm   :     0.1471540 α      lambda       -0.1288583E-04
   maximum displ.:     0.1042492 α      in ANC's #3, #2, #4, ...

........................................................................
.............................. CYCLE   11 ..............................
........................................................................
   1    -47.4304216 -0.474304E+02  0.121E-01    0.87       0.0  T
   2    -47.4304317 -0.101056E-04  0.554E-02    0.87       1.0  T
   3    -47.4304338 -0.209889E-05  0.101E-02    0.87       1.8  T
   4    -47.4304332  0.595979E-06  0.469E-03    0.87       4.0  T
   5    -47.4304339 -0.730424E-06  0.489E-04    0.87      38.0  T
   6    -47.4304339 -0.166117E-08  0.306E-04    0.87      60.6  T
     SCC iter.                  ...        0 min,  0.010 sec
     gradient                   ...        0 min,  0.019 sec
 * total energy  :   -46.7646250 Eh     change       -0.1451921E-04 Eh
   gradient norm :     0.0010859 Eh/α   predicted    -0.6505267E-05 ( -55.20%)
   displ. norm   :     0.1079075 α      lambda       -0.7372306E-05
   maximum displ.:     0.0775687 α      in ANC's #3, #2, #1, ...

........................................................................
.............................. CYCLE   12 ..............................
........................................................................
   1    -47.4306008 -0.474306E+02  0.940E-02    0.87       0.0  T
   2    -47.4306072 -0.636199E-05  0.426E-02    0.87       1.0  T
   3    -47.4306085 -0.126635E-05  0.755E-03    0.87       2.5  T
   4    -47.4306080  0.420128E-06  0.442E-03    0.87       4.2  T
   5    -47.4306086 -0.564705E-06  0.372E-04    0.87      50.0  T
   6    -47.4306086 -0.857199E-09  0.259E-04    0.87      71.8  T
     SCC iter.                  ...        0 min,  0.010 sec
     gradient                   ...        0 min,  0.019 sec
 * total energy  :   -46.7646330 Eh     change       -0.8028975E-05 Eh
   gradient norm :     0.0009105 Eh/α   predicted    -0.3705818E-05 ( -53.84%)
   displ. norm   :     0.1080311 α      lambda       -0.8680638E-06
   maximum displ.:     0.0775685 α      in ANC's #3, #2, #1, ...

........................................................................
.............................. CYCLE   13 ..............................
........................................................................
   1    -47.4305899 -0.474306E+02  0.940E-02    0.87       0.0  T
   2    -47.4305963 -0.637330E-05  0.426E-02    0.87       1.0  T
   3    -47.4305975 -0.124251E-05  0.763E-03    0.87       2.4  T
   4    -47.4305970  0.538960E-06  0.514E-03    0.87       3.6  T
   5    -47.4305977 -0.684270E-06  0.988E-04    0.87      18.8  T
   6    -47.4305977 -0.263401E-07  0.307E-04    0.87      60.4  T
     SCC iter.                  ...        0 min,  0.010 sec
     gradient                   ...        0 min,  0.019 sec
 * total energy  :   -46.7646350 Eh     change       -0.1947110E-05 Eh
   gradient norm :     0.0012966 Eh/α   predicted    -0.4378915E-06 ( -77.51%)
   displ. norm   :     0.0366124 α      lambda       -0.4847057E-05
   maximum displ.:     0.0252641 α      in ANC's #3, #2, #7, ...

........................................................................
.............................. CYCLE   14 ..............................
........................................................................
   1    -47.4309096 -0.474309E+02  0.236E-02    0.87       0.0  T
   2    -47.4309099 -0.316603E-06  0.119E-02    0.87       1.6  T
   3    -47.4309099 -0.171200E-07  0.263E-03    0.87       7.1  T
   4    -47.4309099 -0.242716E-08  0.163E-03    0.87      11.4  T
   5    -47.4309100 -0.554262E-07  0.384E-04    0.87      48.4  T
   6    -47.4309100 -0.166850E-08  0.189E-04    0.87      98.5  T
     SCC iter.                  ...        0 min,  0.010 sec
     gradient                   ...        0 min,  0.019 sec
 * total energy  :   -46.7646386 Eh     change       -0.3618985E-05 Eh
   gradient norm :     0.0006489 Eh/α   predicted    -0.2425310E-05 ( -32.98%)
   displ. norm   :     0.0147333 α      lambda       -0.1026416E-05
   maximum displ.:     0.0085820 α      in ANC's #7, #3, #6, ...

   *** GEOMETRY OPTIMIZATION CONVERGED AFTER 14 ITERATIONS ***

------------------------------------------------------------------------
 total energy gain   :        -0.0144181 Eh       -9.0475 kcal/mol
 total RMSD          :         0.2057949 a0        0.1089 Å
 total power (kW/mol):        -2.7039158 (step)  -61.4801 (real)
------------------------------------------------------------------------

 ANCopt (total)                0 d,  0 h,  0 min,  0.616 sec
 optimizer setup                ...        0 min,  0.000 sec (  0.024%)
 model hessian                  ...        0 min,  0.007 sec (  1.146%)
 ANC generation                 ...        0 min,  0.001 sec (  0.152%)
 coordinate transformation      ...        0 min,  0.000 sec (  0.050%)
 single point calculation       ...        0 min,  0.602 sec ( 97.825%)
 optimization log               ...        0 min,  0.002 sec (  0.267%)
 hessian update                 ...        0 min,  0.000 sec (  0.035%)
 rational function              ...        0 min,  0.002 sec (  0.345%)

================
 final structure:
================
$coord
    0.44339262271027    2.41404701474605   -0.08901822144498      C 
    2.62578744817632    0.95706022240429   -0.03623664940956      C 
    5.02373033016783    1.77556082970396    0.04637744955351      N 
    6.86216477593971   -0.62213833895007    0.08557861599406      S 
    4.80059263149071   -2.83013947279510    0.00423537075386      N 
    2.49304848986578   -1.78238174279953   -0.05957485674881      C 
    0.18024066623522   -3.02025394163060   -0.14527156777212      C 
   -1.99395907719486   -1.55169345247943   -0.20525332733254      C 
   -1.86280567754432    1.16384824587589   -0.16521464109682      C 
   -4.03018840807103    2.53799547668372   -0.18191322280381      N 
   -6.19328928086475    1.37521726598634   -0.26253301425253      C 
   -8.50145123322187    3.01319868820463   -0.13167606681924      C 
   -9.36057372004821    3.29638062049615    2.61667855497189      C 
   -6.32249139252294   -1.34107199908148   -0.36804847632177      C 
   -8.76714097451310   -2.74660409810616   -0.64354484086991      C 
   -9.46479893945731   -2.97559854253241   -3.44237542617608      C 
   -4.28160035705298   -2.70874640337097   -0.32310433572572      N 
    0.51806261620037    4.44784805239571   -0.06391423330279      H 
    0.05806587954633   -5.05174846938413   -0.17209489113483      H 
  -10.02785888875036    2.22730103941583   -1.26921983466838      H 
   -8.00378249723031    4.87165022371159   -0.87081579000539      H 
   -9.82518817609036    1.47033732887238    3.44034607580975      H 
  -11.02087471519565    4.50254159782041    2.71788927866949      H 
   -7.86015774105654    4.14617155828762    3.73338044965002      H 
  -10.28080649969102   -1.80106879133457    0.38376487674900      H 
   -8.50636285704888   -4.63617494354163    0.13720279784518      H 
   -9.66248080987088   -1.12179392482270   -4.30955980915964      H 
  -11.23992349284605   -3.98900771022713   -3.64864745298594      H 
   -7.99762394340094   -4.00545880631683   -4.44581243339746      H 
$end
           -------------------------------------------------
          |                Final Singlepoint                |
           -------------------------------------------------

          ...................................................
          :                      SETUP                      :
          :.................................................:
          :  # basis functions                  86          :
          :  # atomic orbitals                  85          :
          :  # shells                           47          :
          :  # electrons                        86          :
          :  max. iterations                   250          :
          :  Hamiltonian                  GFN2-xTB          :
          :  restarted?                      false          :
          :  GBSA solvation                  false          :
          :  PC potential                    false          :
          :  electronic temp.          300.0000000     K    :
          :  accuracy                    1.0000000          :
          :  -> integral cutoff          0.2500000E+02      :
          :  -> integral neglect         0.1000000E-07      :
          :  -> SCF convergence          0.1000000E-05 Eh   :
          :  -> wf. convergence          0.1000000E-03 e    :
          :  Broyden damping             0.4000000          :
          ...................................................

 iter      E             dE          RMSdq      gap      omega  full diag
   1    -47.4309100 -0.474309E+02  0.123E-04    0.87       0.0  T
   2    -47.4309100  0.116742E-10  0.463E-05    0.87     401.5  T
   3    -47.4309100  0.464553E-10  0.807E-05    0.87     230.2  T

   *** convergence criteria satisfied after 3 iterations ***

         #    Occupation            Energy/Eh            Energy/eV
      -------------------------------------------------------------
         1        2.0000           -0.7658061             -20.8386
       ...           ...                  ...                  ...
        37        2.0000           -0.4387614             -11.9393
        38        2.0000           -0.4153391             -11.3020
        39        2.0000           -0.4128431             -11.2340
        40        2.0000           -0.4108780             -11.1806
        41        2.0000           -0.4095851             -11.1454
        42        2.0000           -0.3882686             -10.5653
        43        2.0000           -0.3526100              -9.5950 (HOMO)
        44                         -0.3205449              -8.7225 (LUMO)
        45                         -0.2711063              -7.3772
        46                         -0.2384465              -6.4885
        47                         -0.2132088              -5.8017
        48                         -0.2045081              -5.5649
       ...                                ...                  ...
        85                          0.7489223              20.3792
      -------------------------------------------------------------
                  HL-Gap            0.0320651 Eh            0.8725 eV
             Fermi-level           -0.3365775 Eh           -9.1587 eV

 SCC (total)                   0 d,  0 h,  0 min,  0.040 sec
 SCC setup                      ...        0 min,  0.000 sec (  0.630%)
 Dispersion                     ...        0 min,  0.000 sec (  0.720%)
 integral evaluation            ...        0 min,  0.014 sec ( 35.059%)
 zeroth order Hamiltonian       ...        0 min,  0.000 sec (  0.528%)
 iterations                     ...        0 min,  0.006 sec ( 14.161%)
 molecular gradient             ...        0 min,  0.019 sec ( 47.702%)
 printout                       ...        0 min,  0.000 sec (  1.071%)

         :::::::::::::::::::::::::::::::::::::::::::::::::::::
         ::                     SUMMARY                     ::
         :::::::::::::::::::::::::::::::::::::::::::::::::::::
         :: total energy             -46.764638585848 Eh    ::
         :: gradient norm              0.000648718780 Eh/a0 ::
         :: HOMO-LUMO gap              0.872536042377 eV    ::
         ::.................................................::
         :: SCC energy               -47.430909981354 Eh    ::
         :: -> isotropic ES            0.035739803152 Eh    ::
         :: -> anisotropic ES          0.007124159887 Eh    ::
         :: -> anisotropic XC          0.036925880594 Eh    ::
         :: -> dispersion             -0.031849731171 Eh    ::
         :: repulsion energy           0.666295948296 Eh    ::
         :: add. restraining           0.000000000000 Eh    ::
         :::::::::::::::::::::::::::::::::::::::::::::::::::::

           -------------------------------------------------
          |                Property Printout                |
           -------------------------------------------------

    * Orbital Energies and Occupations

         #    Occupation            Energy/Eh            Energy/eV
      -------------------------------------------------------------
         1        2.0000           -0.7658061             -20.8386
       ...           ...                  ...                  ...
        31        2.0000           -0.4700232             -12.7900
        32        2.0000           -0.4581558             -12.4671
        33        2.0000           -0.4545349             -12.3685
        34        2.0000           -0.4532462             -12.3335
        35        2.0000           -0.4503448             -12.2545
        36        2.0000           -0.4444472             -12.0940
        37        2.0000           -0.4387614             -11.9393
        38        2.0000           -0.4153391             -11.3020
        39        2.0000           -0.4128431             -11.2340
        40        2.0000           -0.4108780             -11.1806
        41        2.0000           -0.4095851             -11.1454
        42        2.0000           -0.3882686             -10.5653
        43        2.0000           -0.3526100              -9.5950 (HOMO)
        44                         -0.3205449              -8.7225 (LUMO)
        45                         -0.2711063              -7.3772
        46                         -0.2384465              -6.4885
        47                         -0.2132088              -5.8017
        48                         -0.2045081              -5.5649
        49                         -0.1636341              -4.4527
        50                         -0.1395716              -3.7979
        51                         -0.0806284              -2.1940
        52                          0.0093841               0.2554
        53                          0.0282658               0.7692
        54                          0.0448919               1.2216
       ...                                ...                  ...
        85                          0.7489223              20.3792
      -------------------------------------------------------------
                  HL-Gap            0.0320651 Eh            0.8725 eV
             Fermi-level           -0.3365775 Eh           -9.1587 eV

     #   Z        covCN         q      C6AA      α(0)
     1   6 C      2.912    -0.053    29.305     8.877
     2   6 C      3.349     0.073    23.784     7.689
     3   7 N      1.850    -0.270    27.866     7.824
     4  16 S      2.688     0.369   126.910    18.961
     5   7 N      1.850    -0.270    27.867     7.824
     6   6 C      3.349     0.073    23.786     7.689
     7   6 C      2.912    -0.053    29.305     8.877
     8   6 C      2.961     0.075    26.324     8.416
     9   6 C      2.961     0.075    26.324     8.416
    10   7 N      1.851    -0.235    26.992     7.700
    11   6 C      2.938     0.093    25.934     8.352
    12   6 C      3.810    -0.065    21.730     6.635
    13   6 C      3.754    -0.097    22.409     6.750
    14   6 C      2.938     0.093    25.933     8.352
    15   6 C      3.810    -0.065    21.730     6.635
    16   6 C      3.754    -0.097    22.409     6.750
    17   7 N      1.851    -0.235    26.991     7.700
    18   1 H      0.926     0.067     2.120     2.277
    19   1 H      0.926     0.067     2.120     2.277
    20   1 H      0.925     0.044     2.390     2.418
    21   1 H      0.924     0.059     2.208     2.324
    22   1 H      0.925     0.035     2.523     2.484
    23   1 H      0.925     0.043     2.410     2.428
    24   1 H      0.925     0.045     2.378     2.411
    25   1 H      0.925     0.044     2.390     2.418
    26   1 H      0.924     0.059     2.209     2.324
    27   1 H      0.925     0.034     2.523     2.484
    28   1 H      0.925     0.043     2.410     2.428
    29   1 H      0.925     0.046     2.375     2.410

 Mol. C6AA /au·bohr⁶  :      12143.610467
 Mol. C8AA /au·bohr⁸  :     315581.665393
 Mol. α(0) /au        :        172.127607


Wiberg/Mayer (AO) data.
largest (>0.10) Wiberg bond orders for each atom
          total WBO             WBO to atom ...
     1  C   3.983        C    9 1.385    C    2 1.334    H   18 0.963    C    7 0.136
     2  C   3.974        N    3 1.335    C    1 1.334    C    6 1.125
     3  N   3.074        S    4 1.466    C    2 1.335    N    5 0.184
     4  S   3.226        N    3 1.466    N    5 1.466
     5  N   3.074        S    4 1.466    C    6 1.335    N    3 0.184
     6  C   3.974        N    5 1.335    C    7 1.334    C    2 1.125
     7  C   3.983        C    8 1.385    C    6 1.334    H   19 0.963    C    1 0.136
     8  C   3.981        C    7 1.385    N   17 1.238    C    9 1.159
     9  C   3.981        C    1 1.385    N   10 1.238    C    8 1.159
    10  N   3.061        C   11 1.586    C    9 1.238
    11  C   3.948        N   10 1.586    C   14 1.160    C   12 1.011
    12  C   3.994        C   11 1.011    C   13 0.994    H   21 0.971    H   20 0.968
    13  C   3.989        C   12 0.994    H   24 0.988    H   22 0.986    H   23 0.985
    14  C   3.948        N   17 1.586    C   11 1.160    C   15 1.011
    15  C   3.994        C   14 1.011    C   16 0.994    H   26 0.971    H   25 0.968
    16  C   3.989        C   15 0.994    H   29 0.988    H   27 0.987    H   28 0.985
    17  N   3.061        C   14 1.586    C    8 1.238
    18  H   0.995        C    1 0.963
    19  H   0.995        C    7 0.963
    20  H   0.996        C   12 0.968
    21  H   0.996        C   12 0.971
    22  H   0.999        C   13 0.986
    23  H   0.997        C   13 0.985
    24  H   0.998        C   13 0.988
    25  H   0.996        C   15 0.968
    26  H   0.996        C   15 0.971
    27  H   0.999        C   16 0.987
    28  H   0.997        C   16 0.985
    29  H   0.998        C   16 0.988

molecular dipole:
                 x           y           z       tot (Debye)
 q only:       -0.536       0.026      -0.016
   full:       -0.877       0.042      -0.027       2.233
molecular quadrupole (traceless):
                xx          xy          yy          xz          yz          zz
 q only:       17.348      -1.111      -9.760       0.903       0.843      -7.588
  q+dip:       17.449      -1.000     -10.611       0.933       0.494      -6.838
   full:       16.133      -1.098     -13.957       0.747       0.466      -2.176

           -------------------------------------------------
          |                Geometry Summary                 |
           -------------------------------------------------

      molecular mass/u    :      244.3136000
   center of mass at/Å    :       -0.8980268      -0.1092236      -0.0936570
  moments of inertia/u·Å² :        0.4399776E+03   0.2303372E+04   0.2625035E+04
rotational constants/cm⁻¹ :        0.3831475E-01   0.7318675E-02   0.6421870E-02

 * 28 selected distances

     #   Z        #   Z                                     value/Å
     1   6 C      2   6 C                                 1.3888704
     2   6 C      3   7 N                                 1.3415346
     3   7 N      4  16 S                                 1.5989859
     4  16 S      5   7 N                                 1.5991283 (max)
     2   6 C      6   6 C                                 1.4514037
     5   7 N      6   6 C                                 1.3415064
     6   6 C      7   6 C                                 1.3889015
     7   6 C      8   6 C                                 1.3887664
     1   6 C      9   6 C                                 1.3887605
     8   6 C      9   6 C                                 1.4388339
     9   6 C     10   7 N                                 1.3580494
    10   7 N     11   6 C                                 1.3002649
    12   6 C     13   6 C                                 1.5311190
    15   6 C     16   6 C                                 1.5311996
     8   6 C     17   7 N                                 1.3580345
    14   6 C     17   7 N                                 1.3002898
     1   6 C     18   1 H                                 1.0770483 (min)
     7   6 C     19   1 H                                 1.0770566
    12   6 C     20   1 H                                 1.0898433
    12   6 C     21   1 H                                 1.0906501
    13   6 C     22   1 H                                 1.0881934
    13   6 C     23   1 H                                 1.0872844
    13   6 C     24   1 H                                 1.0871233
    15   6 C     25   1 H                                 1.0897179
    15   6 C     26   1 H                                 1.0906766
    16   6 C     27   1 H                                 1.0880583
    16   6 C     28   1 H                                 1.0871487
    16   6 C     29   1 H                                 1.0870827

 * 4 distinct bonds (by element types)

   Z      Z             #   av. dist./Å        max./Å        min./Å
   1 H    6 C          12     1.0866570     1.0906766     1.0770483
   6 C    6 C           8     1.4384819     1.5311996     1.3887605
   6 C    7 N           6     1.3332800     1.3580494     1.3002649
   7 N   16 S           2     1.5990571     1.5991283     1.5989859


optimized geometry written to: xtbopt.xyz


           -------------------------------------------------
          | TOTAL ENERGY              -46.764638585848 Eh   |
          | GRADIENT NORM               0.000648718780 Eh/α |
          | HOMO-LUMO GAP               0.872536042377 eV   |
           -------------------------------------------------

------------------------------------------------------------------------
 * finished run on 2021/05/19 at 11:00:10.107     
------------------------------------------------------------------------
 total:
 * wall-time:     0 d,  0 h,  0 min,  0.752 sec
 *  cpu-time:     0 d,  0 h,  0 min,  0.738 sec
 * ratio c/w:     0.981 speedup
 SCF:
 * wall-time:     0 d,  0 h,  0 min,  0.055 sec
 *  cpu-time:     0 d,  0 h,  0 min,  0.055 sec
 * ratio c/w:     1.000 speedup
 ANC optimizer:
 * wall-time:     0 d,  0 h,  0 min,  0.656 sec
 *  cpu-time:     0 d,  0 h,  0 min,  0.656 sec
 * ratio c/w:     1.000 speedup

