      -----------------------------------------------------------      
     |                   =====================                   |     
     |                           x T B                           |     
     |                   =====================                   |     
     |                         S. Grimme                         |     
     |          Mulliken Center for Theoretical Chemistry        |     
     |                    University of Bonn                     |     
     |                Version 6.2 RC2 (SAW190805)                |     
      -----------------------------------------------------------      

   This program is distributed in the hope that it will be useful,
   but WITHOUT ANY WARRANTY; without even the implied warranty of
   MERCHANTABILITY or FITNESS FOR A PARTICULAR PURPOSE.
   
   FOR NON-COMMERCIAL, ACADEMIA USE ONLY.
   
   Cite this work as:
   * S. Grimme, C. Bannwarth, P. Shushkov, J. Chem. Theory Comput., 2017,
     13, 1989-2009. DOI: 10.1021/acs.jctc.7b00118
   * C. Bannwarth, S. Ehlert and S. Grimme., J. Chem. Theory Comput., 2019,
     15, 1652-1671. DOI: 10.1021/acs.jctc.8b01176
   * P. Pracht, E. Caldeweyher, S. Ehlert, S. Grimme, ChemRxiv, 2019, preprint.
     DOI: 10.26434/chemrxiv.8326202.v1
   
   for DFT-D4:
   * E. Caldeweyher, C. Bannwarth and S. Grimme, J. Chem. Phys., 2017,
     147, 034112. DOI: 10.1063/1.4993215
   * E. Caldeweyher, S. Ehlert, A. Hansen, H. Neugebauer, S. Spicher,
     C. Bannwarth and S. Grimme, J. Chem. Phys., 2019, 150, 154122.
     DOI: 10.1063/1.5090222
   
   for sTDA-xTB:
   * S. Grimme and C. Bannwarth, J. Chem. Phys., 2016, 145, 054103.
     DOI: 10.1063/1.4959605
   
   in the mass-spec context:
   * V. Asgeirsson, C. Bauer and S. Grimme, Chem. Sci., 2017, 8, 4879.
     DOI: 10.1039/c7sc00601b
   
   for metadynamics refer to:
   * S. Grimme, J. Chem. Theory Comput., 2019, 155, 2847-2862
     DOI: 10.1021/acs.jctc.9b00143
   
   with help from (in alphabetical order)
   C. Bannwarth, F. Bohle, G. Brandenburg, E. Caldeweyher, M. Checinski,
   S. Dohm, S. Ehlert, S. Ehrlich, F. März, H. Neugebauer, J. Pisarek,
   P. Pracht, P. Shushkov, and S. Spicher.
   
 * started run on 2021/05/19 at 11:00:11.396     

           -------------------------------------------------
          |                Calculation Setup                |
           -------------------------------------------------

          program call               : /ihome/ghutchison/geoffh/xtb/xtb 718.xyz -opt
          hostname                   : smp-n83
          coordinate file            : 718.xyz
          omp threads                :                     1
          number of atoms            :                    30
          number of electrons        :                    82
          charge                     :                     0
          spin                       :                   0.0
          first test random number   :      0.60915026524000


########################################################################
# WARNING! Please study the warnings concerning your input carefully
#  - the use of '-opt' is discouraged, please use '--opt' next time
########################################################################

           ------------------------------------------------- 
          |                 G F N 2 - x T B                 |
          | Geometry, Frequencies, Noncovalent interactions |
          |            JCTC 2019 parametrisation            |
           ------------------------------------------------- 
             KAB for C  - Si     :                1.0500
             KAB for H  - Pd     :                0.9500
             k(s)              :                1.8500
             k(p)              :                2.2300
             k(d)              :                2.2300
             k(f)              :                2.0000
             kEN (H0ij)        :               -2.0000
             D4 a1             :                0.5200
             D4 a2             :                5.0000
             D4 s6             :                1.0000
             D4 s8             :                2.7000
             D4 s9             :                5.0000
             alphaj            :                2.0000

  Z AO/shell   Hii/eV     exponent
  1     Wed Apr 25 08:07:45 CEST 2018   EN: 2.200 GM2: 0.406  GM3: 0.0800  RAES: 1.40
     1s    -10.707211    1.230000
  6     Wed Apr 25 08:07:45 CEST 2018   EN: 2.550 GM2: 0.538  GM3: 0.1500  RAES: 3.00
     2s    -13.970922    2.096432
     2p    -10.063292    1.800000
  8     Wed Apr 25 08:07:45 CEST 2018   EN: 3.440 GM2: 0.452  GM3:-0.0517  RAES: 1.80
     2s    -20.229985    2.439742
     2p    -15.503117    2.137023

           ------------------------------------------------- 
          |        Self-Consistent Charge Iterations        |
           ------------------------------------------------- 

          ...................................................
          :                      SETUP                      :
          :.................................................:
          :  # basis functions                  78          :
          :  # atomic orbitals                  78          :
          :  # shells                           46          :
          :  # electrons                        82          :
          :  max. iterations                   250          :
          :  Hamiltonian                  GFN2-xTB          :
          :  restarted?                      false          :
          :  GBSA solvation                  false          :
          :  PC potential                    false          :
          :  electronic temp.          300.0000000     K    :
          :  accuracy                    1.0000000          :
          :  -> integral cutoff          0.2500000E+02      :
          :  -> integral neglect         0.1000000E-07      :
          :  -> SCF convergence          0.1000000E-05 Eh   :
          :  -> wf. convergence          0.1000000E-03 e    :
          :  Broyden damping             0.4000000          :
          ...................................................

 iter      E             dE          RMSdq      gap      omega  full diag
   1    -45.7641961 -0.457642E+02  0.473E+00    1.47       0.0  T
   2    -45.8099449 -0.457489E-01  0.288E+00    1.30       1.0  T
   3    -45.7806665  0.292784E-01  0.160E+00    1.47       1.0  T
   4    -45.8232076 -0.425411E-01  0.457E-01    1.35       1.0  T
   5    -45.8260903 -0.288269E-02  0.213E-01    1.37       1.0  T
   6    -45.8271500 -0.105972E-02  0.829E-02    1.35       1.0  T
   7    -45.8271850 -0.349640E-04  0.539E-02    1.37       1.0  T
   8    -45.8272389 -0.538812E-04  0.251E-02    1.36       1.0  T
   9    -45.8272475 -0.861297E-05  0.748E-03    1.36       2.4  T
  10    -45.8272481 -0.620317E-06  0.272E-03    1.36       6.7  T
  11    -45.8272482 -0.843681E-07  0.152E-03    1.36      12.0  T
  12    -45.8272482 -0.270301E-07  0.667E-04    1.36      27.4  T
  13    -45.8272482 -0.115648E-09  0.324E-04    1.36      56.4  T

   *** convergence criteria satisfied after 13 iterations ***

         #    Occupation            Energy/Eh            Energy/eV
      -------------------------------------------------------------
         1        2.0000           -0.7146961             -19.4479
       ...           ...                  ...                  ...
        35        2.0000           -0.4331915             -11.7877
        36        2.0000           -0.4305431             -11.7157
        37        2.0000           -0.4260969             -11.5947
        38        2.0000           -0.3971508             -10.8070
        39        2.0000           -0.3872831             -10.5385
        40        2.0000           -0.3641832              -9.9099
        41        2.0000           -0.3545016              -9.6465 (HOMO)
        42                         -0.3044518              -8.2846 (LUMO)
        43                         -0.2163632              -5.8875
        44                         -0.1903521              -5.1797
        45                         -0.1387339              -3.7751
        46                         -0.1356257              -3.6906
       ...                                ...                  ...
        78                          0.7735485              21.0493
      -------------------------------------------------------------
                  HL-Gap            0.0500498 Eh            1.3619 eV
             Fermi-level           -0.3294767 Eh           -8.9655 eV

 SCC (total)                   0 d,  0 h,  0 min,  0.049 sec
 SCC setup                      ...        0 min,  0.000 sec (  0.735%)
 Dispersion                     ...        0 min,  0.001 sec (  1.037%)
 integral evaluation            ...        0 min,  0.012 sec ( 23.586%)
 zeroth order Hamiltonian       ...        0 min,  0.000 sec (  0.447%)
 iterations                     ...        0 min,  0.019 sec ( 38.605%)
 molecular gradient             ...        0 min,  0.017 sec ( 34.582%)
 printout                       ...        0 min,  0.000 sec (  0.892%)

         :::::::::::::::::::::::::::::::::::::::::::::::::::::
         ::                     SUMMARY                     ::
         :::::::::::::::::::::::::::::::::::::::::::::::::::::
         :: total energy             -45.131601273176 Eh    ::
         :: gradient norm              0.063176581686 Eh/a0 ::
         :: HOMO-LUMO gap              1.361924785604 eV    ::
         ::.................................................::
         :: SCC energy               -45.827248232810 Eh    ::
         :: -> isotropic ES            0.029390518378 Eh    ::
         :: -> anisotropic ES          0.006759369600 Eh    ::
         :: -> anisotropic XC          0.019467169018 Eh    ::
         :: -> dispersion             -0.029219015172 Eh    ::
         :: repulsion energy           0.695628808942 Eh    ::
         :: add. restraining           0.000000000000 Eh    ::
         :::::::::::::::::::::::::::::::::::::::::::::::::::::

      ----------------------------------------------------------- 
     |                   =====================                   |
     |                        A N C O P T                        |
     |                   =====================                   |
     |               Approximate Normal Coordinate               |
     |                Rational Function Optimizer                |
      ----------------------------------------------------------- 

          ...................................................
          :                      SETUP                      :
          :.................................................:
          :   optimization level            normal          :
          :   max. optcycles                   200          :
          :   ANC micro-cycles                  20          :
          :   degrees of freedom                84          :
          :.................................................:
          :   RF solver                   davidson          :
          :   input Hessian                  false          :
          :   write xtbopt.log                true          :
          :   linear?                        false          :
          :   energy convergence         0.5000000E-05 Eh   :
          :   grad. convergence          0.1000000E-02 Eh/α :
          :   maximium RF displ.         2.0000000          :
          :   Hlow (freq-cutoff)         0.5000000E-02      :
          :   Hmax (freq-cutoff)         5.0000000          :
          :   S6 in model hess.         20.0000000          :
          ...................................................

generating ANC from model Hessian ...
Using Lindh-Hessian (1995)
 Shifting diagonal of input Hessian by   4.592691429138072E-003
 Lowest  eigenvalues of input Hessian
   -0.000000   -0.000000   -0.000000    0.000000    0.000000    0.000000
    0.005000    0.005352    0.006546    0.007212    0.007958    0.008532
    0.009488    0.010114    0.010748    0.011284    0.013763    0.016526
 Highest eigenvalues
    1.826294    1.883649    1.965099    2.068340    2.098528    2.123071
 

........................................................................
.............................. CYCLE    1 ..............................
........................................................................
   1    -45.8272482 -0.458272E+02  0.984E-05    1.36       0.0  T
   2    -45.8272482 -0.193126E-10  0.613E-05    1.36     297.9  T
   3    -45.8272482 -0.102034E-10  0.478E-05    1.36     381.8  T
     SCC iter.                  ...        0 min,  0.005 sec
     gradient                   ...        0 min,  0.017 sec
 * total energy  :   -45.1316013 Eh     change        0.2241929E-07 Eh
   gradient norm :     0.0631758 Eh/α   predicted     0.0000000E+00 (-100.00%)
   displ. norm   :     0.2314930 α      lambda       -0.5882898E-02
   maximum displ.:     0.0984811 α      in ANC's #3, #8, #33, ...

........................................................................
.............................. CYCLE    2 ..............................
........................................................................
   1    -45.8339603 -0.458340E+02  0.153E-01    1.31       0.0  T
   2    -45.8339821 -0.217369E-04  0.100E-01    1.31       1.0  T
   3    -45.8339805  0.152697E-05  0.709E-02    1.31       1.0  T
   4    -45.8340533 -0.728146E-04  0.128E-02    1.31       1.4  T
   5    -45.8340555 -0.218589E-05  0.816E-03    1.31       2.2  T
   6    -45.8340573 -0.177269E-05  0.263E-03    1.31       6.9  T
   7    -45.8340574 -0.107410E-06  0.151E-03    1.31      12.1  T
     SCC iter.                  ...        0 min,  0.010 sec
     gradient                   ...        0 min,  0.016 sec
 * total energy  :   -45.1356267 Eh     change       -0.4025408E-02 Eh
   gradient norm :     0.0269633 Eh/α   predicted    -0.3099085E-02 ( -23.01%)
   displ. norm   :     0.2713270 α      lambda       -0.2035728E-02
   maximum displ.:     0.1612515 α      in ANC's #8, #3, #13, ...

........................................................................
.............................. CYCLE    3 ..............................
........................................................................
   1    -45.8374166 -0.458374E+02  0.141E-01    1.28       0.0  T
   2    -45.8374343 -0.176680E-04  0.900E-02    1.29       1.0  T
   3    -45.8374438 -0.954744E-05  0.657E-02    1.28       1.0  T
   4    -45.8375057 -0.619343E-04  0.125E-02    1.28       1.5  T
   5    -45.8375077 -0.198529E-05  0.796E-03    1.28       2.3  T
   6    -45.8375093 -0.159267E-05  0.288E-03    1.28       6.3  T
   7    -45.8375095 -0.156172E-06  0.150E-03    1.28      12.1  T
     SCC iter.                  ...        0 min,  0.010 sec
     gradient                   ...        0 min,  0.016 sec
 * total energy  :   -45.1367441 Eh     change       -0.1117408E-02 Eh
   gradient norm :     0.0082990 Eh/α   predicted    -0.1092801E-02 (  -2.20%)
   displ. norm   :     0.1707217 α      lambda       -0.4417801E-03
   maximum displ.:     0.1035222 α      in ANC's #8, #3, #2, ...

........................................................................
.............................. CYCLE    4 ..............................
........................................................................
   1    -45.8379920 -0.458380E+02  0.808E-02    1.28       0.0  T
   2    -45.8379950 -0.302449E-05  0.505E-02    1.28       1.0  T
   3    -45.8379741  0.208859E-04  0.371E-02    1.28       1.0  T
   4    -45.8380054 -0.312696E-04  0.446E-03    1.28       4.1  T
   5    -45.8380057 -0.272052E-06  0.264E-03    1.28       6.9  T
   6    -45.8380058 -0.120357E-06  0.135E-03    1.28      13.5  T
     SCC iter.                  ...        0 min,  0.009 sec
     gradient                   ...        0 min,  0.016 sec
 * total energy  :   -45.1369603 Eh     change       -0.2162219E-03 Eh
   gradient norm :     0.0065523 Eh/α   predicted    -0.2273278E-03 (   5.14%)
   displ. norm   :     0.1284560 α      lambda       -0.1922333E-03
   maximum displ.:     0.0705947 α      in ANC's #3, #8, #2, ...

........................................................................
.............................. CYCLE    5 ..............................
........................................................................
   1    -45.8378563 -0.458379E+02  0.474E-02    1.28       0.0  T
   2    -45.8378562  0.767552E-07  0.290E-02    1.28       1.0  T
   3    -45.8378398  0.164747E-04  0.244E-02    1.28       1.0  T
   4    -45.8378573 -0.175746E-04  0.573E-03    1.28       3.2  T
   5    -45.8378584 -0.104949E-05  0.151E-03    1.28      12.1  T
   6    -45.8378584 -0.398561E-07  0.765E-04    1.28      23.9  T
     SCC iter.                  ...        0 min,  0.009 sec
     gradient                   ...        0 min,  0.016 sec
 * total energy  :   -45.1371034 Eh     change       -0.1431394E-03 Eh
   gradient norm :     0.0042411 Eh/α   predicted    -0.9770426E-04 ( -31.74%)
   displ. norm   :     0.1774079 α      lambda       -0.1558666E-03
   maximum displ.:     0.0991578 α      in ANC's #2, #3, #8, ...

........................................................................
.............................. CYCLE    6 ..............................
........................................................................
   1    -45.8378825 -0.458379E+02  0.643E-02    1.28       0.0  T
   2    -45.8378826 -0.642174E-07  0.385E-02    1.28       1.0  T
   3    -45.8378668  0.158089E-04  0.230E-02    1.28       1.0  T
   4    -45.8378831 -0.162881E-04  0.428E-03    1.28       4.3  T
   5    -45.8378836 -0.554434E-06  0.144E-03    1.28      12.7  T
   6    -45.8378836 -0.204787E-07  0.772E-04    1.28      23.7  T
     SCC iter.                  ...        0 min,  0.009 sec
     gradient                   ...        0 min,  0.016 sec
 * total energy  :   -45.1372134 Eh     change       -0.1099524E-03 Eh
   gradient norm :     0.0035101 Eh/α   predicted    -0.8038643E-04 ( -26.89%)
   displ. norm   :     0.1614532 α      lambda       -0.9091210E-04
   maximum displ.:     0.1046343 α      in ANC's #2, #3, #7, ...

........................................................................
.............................. CYCLE    7 ..............................
........................................................................
   1    -45.8380135 -0.458380E+02  0.597E-02    1.28       0.0  T
   2    -45.8380138 -0.323359E-06  0.353E-02    1.28       1.0  T
   3    -45.8380122  0.165462E-05  0.888E-03    1.28       2.1  T
   4    -45.8380141 -0.186691E-05  0.142E-03    1.28      12.8  T
   5    -45.8380141 -0.736321E-08  0.122E-03    1.28      15.0  T
   6    -45.8380141 -0.285861E-07  0.569E-04    1.28      32.1  T
   7    -45.8380141 -0.283892E-08  0.269E-04    1.28      67.8  T
     SCC iter.                  ...        0 min,  0.010 sec
     gradient                   ...        0 min,  0.017 sec
 * total energy  :   -45.1372878 Eh     change       -0.7445135E-04 Eh
   gradient norm :     0.0037119 Eh/α   predicted    -0.4664289E-04 ( -37.35%)
   displ. norm   :     0.1948105 α      lambda       -0.1080126E-03
   maximum displ.:     0.1327566 α      in ANC's #2, #3, #7, ...

........................................................................
.............................. CYCLE    8 ..............................
........................................................................
   1    -45.8381807 -0.458382E+02  0.747E-02    1.28       0.0  T
   2    -45.8381813 -0.557148E-06  0.440E-02    1.28       1.0  T
   3    -45.8381744  0.690084E-05  0.153E-02    1.28       1.2  T
   4    -45.8381814 -0.705041E-05  0.377E-03    1.28       4.8  T
   5    -45.8381818 -0.376971E-06  0.145E-03    1.28      12.6  T
   6    -45.8381818 -0.419931E-07  0.677E-04    1.28      27.0  T
   7    -45.8381818 -0.136688E-08  0.367E-04    1.28      49.7  T
     SCC iter.                  ...        0 min,  0.010 sec
     gradient                   ...        0 min,  0.017 sec
 * total energy  :   -45.1373804 Eh     change       -0.9260623E-04 Eh
   gradient norm :     0.0033065 Eh/α   predicted    -0.5605601E-04 ( -39.47%)
   displ. norm   :     0.2547795 α      lambda       -0.1351666E-03
   maximum displ.:     0.1754558 α      in ANC's #2, #3, #7, ...

........................................................................
.............................. CYCLE    9 ..............................
........................................................................
   1    -45.8380663 -0.458381E+02  0.102E-01    1.28       0.0  T
   2    -45.8380672 -0.934223E-06  0.604E-02    1.27       1.0  T
   3    -45.8380515  0.157778E-04  0.222E-02    1.27       1.0  T
   4    -45.8380677 -0.162048E-04  0.442E-03    1.27       4.1  T
   5    -45.8380682 -0.484573E-06  0.195E-03    1.27       9.4  T
   6    -45.8380682 -0.900401E-07  0.853E-04    1.27      21.4  T
   7    -45.8380682 -0.195466E-08  0.400E-04    1.27      45.7  T
     SCC iter.                  ...        0 min,  0.010 sec
     gradient                   ...        0 min,  0.017 sec
 * total energy  :   -45.1374936 Eh     change       -0.1131926E-03 Eh
   gradient norm :     0.0034147 Eh/α   predicted    -0.7197236E-04 ( -36.42%)
   displ. norm   :     0.2729126 α      lambda       -0.1286655E-03
   maximum displ.:     0.1903386 α      in ANC's #2, #4, #7, ...

........................................................................
.............................. CYCLE   10 ..............................
........................................................................
   1    -45.8377375 -0.458377E+02  0.114E-01    1.27       0.0  T
   2    -45.8377388 -0.127563E-05  0.672E-02    1.26       1.0  T
   3    -45.8377313  0.748987E-05  0.157E-02    1.27       1.2  T
   4    -45.8377389 -0.759099E-05  0.421E-03    1.26       4.3  T
   5    -45.8377394 -0.440701E-06  0.193E-03    1.26       9.5  T
   6    -45.8377394 -0.829629E-07  0.901E-04    1.26      20.3  T
   7    -45.8377395 -0.456578E-08  0.291E-04    1.26      62.7  T
     SCC iter.                  ...        0 min,  0.010 sec
     gradient                   ...        0 min,  0.017 sec
 * total energy  :   -45.1375947 Eh     change       -0.1010715E-03 Eh
   gradient norm :     0.0038276 Eh/α   predicted    -0.6913383E-04 ( -31.60%)
   displ. norm   :     0.2054892 α      lambda       -0.8976347E-04
   maximum displ.:     0.1466997 α      in ANC's #2, #4, #7, ...

........................................................................
.............................. CYCLE   11 ..............................
........................................................................
   1    -45.8380988 -0.458381E+02  0.899E-02    1.26       0.0  T
   2    -45.8380997 -0.925847E-06  0.530E-02    1.26       1.0  T
   3    -45.8380983  0.147028E-05  0.900E-03    1.26       2.0  T
   4    -45.8380999 -0.165847E-05  0.240E-03    1.26       7.6  T
   5    -45.8381000 -0.414276E-07  0.187E-03    1.26       9.8  T
   6    -45.8381000 -0.892056E-07  0.702E-04    1.26      26.0  T
   7    -45.8381000 -0.172464E-08  0.224E-04    1.26      81.6  T
     SCC iter.                  ...        0 min,  0.010 sec
     gradient                   ...        0 min,  0.017 sec
 * total energy  :   -45.1376642 Eh     change       -0.6950484E-04 Eh
   gradient norm :     0.0034327 Eh/α   predicted    -0.4677724E-04 ( -32.70%)
   displ. norm   :     0.1781207 α      lambda       -0.7236453E-04
   maximum displ.:     0.1241236 α      in ANC's #2, #4, #5, ...

........................................................................
.............................. CYCLE   12 ..............................
........................................................................
   1    -45.8382004 -0.458382E+02  0.810E-02    1.25       0.0  T
   2    -45.8382010 -0.652696E-06  0.482E-02    1.25       1.0  T
   3    -45.8381858  0.152385E-04  0.223E-02    1.25       1.0  T
   4    -45.8382013 -0.154824E-04  0.502E-03    1.25       3.6  T
   5    -45.8382019 -0.669776E-06  0.174E-03    1.25      10.5  T
   6    -45.8382020 -0.475178E-07  0.765E-04    1.25      23.9  T
   7    -45.8382020 -0.198952E-10  0.399E-04    1.25      45.8  T
     SCC iter.                  ...        0 min,  0.010 sec
     gradient                   ...        0 min,  0.017 sec
 * total energy  :   -45.1377200 Eh     change       -0.5584157E-04 Eh
   gradient norm :     0.0023321 Eh/α   predicted    -0.3733123E-04 ( -33.15%)
   displ. norm   :     0.1804222 α      lambda       -0.6691425E-04
   maximum displ.:     0.1160167 α      in ANC's #2, #4, #5, ...

........................................................................
.............................. CYCLE   13 ..............................
........................................................................
   1    -45.8388135 -0.458388E+02  0.841E-02    1.25       0.0  T
   2    -45.8388141 -0.531708E-06  0.503E-02    1.25       1.0  T
   3    -45.8387945  0.195357E-04  0.246E-02    1.25       1.0  T
   4    -45.8388148 -0.202305E-04  0.421E-03    1.25       4.3  T
   5    -45.8388152 -0.379068E-06  0.187E-03    1.25       9.8  T
   6    -45.8388152 -0.350306E-07  0.939E-04    1.25      19.4  T
   7    -45.8388152 -0.434631E-08  0.351E-04    1.25      52.1  T
     SCC iter.                  ...        0 min,  0.010 sec
     gradient                   ...        0 min,  0.017 sec
 * total energy  :   -45.1377678 Eh     change       -0.4779896E-04 Eh
   gradient norm :     0.0029298 Eh/α   predicted    -0.3454888E-04 ( -27.72%)
   displ. norm   :     0.1861793 α      lambda       -0.5714128E-04
   maximum displ.:     0.1146046 α      in ANC's #2, #4, #5, ...

........................................................................
.............................. CYCLE   14 ..............................
........................................................................
   1    -45.8378617 -0.458379E+02  0.882E-02    1.25       0.0  T
   2    -45.8378622 -0.480361E-06  0.530E-02    1.25       1.0  T
   3    -45.8378316  0.306066E-04  0.304E-02    1.25       1.0  T
   4    -45.8378635 -0.318702E-04  0.384E-03    1.25       4.8  T
   5    -45.8378637 -0.264719E-06  0.197E-03    1.25       9.3  T
   6    -45.8378638 -0.433448E-07  0.101E-03    1.25      18.2  T
   7    -45.8378638 -0.513570E-08  0.382E-04    1.25      47.8  T
   8    -45.8378638 -0.264629E-08  0.162E-04    1.25     112.7  T
     SCC iter.                  ...        0 min,  0.011 sec
     gradient                   ...        0 min,  0.017 sec
 * total energy  :   -45.1378046 Eh     change       -0.3672623E-04 Eh
   gradient norm :     0.0028348 Eh/α   predicted    -0.2956398E-04 ( -19.50%)
   displ. norm   :     0.1516116 α      lambda       -0.5000609E-04
   maximum displ.:     0.0685662 α      in ANC's #2, #5, #3, ...

........................................................................
.............................. CYCLE   15 ..............................
........................................................................
   1    -45.8387453 -0.458387E+02  0.694E-02    1.25       0.0  T
   2    -45.8387459 -0.582495E-06  0.416E-02    1.25       1.0  T
   3    -45.8387447  0.125409E-05  0.713E-03    1.25       2.6  T
   4    -45.8387460 -0.136599E-05  0.324E-03    1.25       5.6  T
   5    -45.8387462 -0.212427E-06  0.159E-03    1.25      11.5  T
   6    -45.8387463 -0.186224E-07  0.874E-04    1.25      20.9  T
   7    -45.8387463 -0.110628E-07  0.247E-04    1.25      73.9  T
     SCC iter.                  ...        0 min,  0.010 sec
     gradient                   ...        0 min,  0.017 sec
 * total energy  :   -45.1378386 Eh     change       -0.3405826E-04 Eh
   gradient norm :     0.0032900 Eh/α   predicted    -0.2557834E-04 ( -24.90%)
   displ. norm   :     0.1572887 α      lambda       -0.4691513E-04
   maximum displ.:     0.0734612 α      in ANC's #5, #2, #1, ...

........................................................................
.............................. CYCLE   16 ..............................
........................................................................
   1    -45.8383653 -0.458384E+02  0.726E-02    1.25       0.0  T
   2    -45.8383657 -0.470077E-06  0.432E-02    1.25       1.0  T
   3    -45.8383556  0.101791E-04  0.186E-02    1.25       1.0  T
   4    -45.8383661 -0.104962E-04  0.390E-03    1.25       4.7  T
   5    -45.8383664 -0.389841E-06  0.177E-03    1.25      10.3  T
   6    -45.8383665 -0.458505E-07  0.817E-04    1.25      22.4  T
   7    -45.8383665 -0.464908E-10  0.419E-04    1.25      43.6  T
     SCC iter.                  ...        0 min,  0.010 sec
     gradient                   ...        0 min,  0.017 sec
 * total energy  :   -45.1378723 Eh     change       -0.3365133E-04 Eh
   gradient norm :     0.0027369 Eh/α   predicted    -0.2403869E-04 ( -28.57%)
   displ. norm   :     0.1430538 α      lambda       -0.5082861E-04
   maximum displ.:     0.0705878 α      in ANC's #5, #7, #1, ...

........................................................................
.............................. CYCLE   17 ..............................
........................................................................
   1    -45.8387978 -0.458388E+02  0.616E-02    1.25       0.0  T
   2    -45.8387972  0.576493E-06  0.369E-02    1.24       1.0  T
   3    -45.8387640  0.331944E-04  0.332E-02    1.25       1.0  T
   4    -45.8387989 -0.349047E-04  0.386E-03    1.24       4.7  T
   5    -45.8387993 -0.377918E-06  0.135E-03    1.24      13.5  T
   6    -45.8387993 -0.219857E-07  0.656E-04    1.24      27.8  T
   7    -45.8387993  0.149200E-08  0.407E-04    1.24      44.9  T
     SCC iter.                  ...        0 min,  0.010 sec
     gradient                   ...        0 min,  0.017 sec
 * total energy  :   -45.1379000 Eh     change       -0.2773088E-04 Eh
   gradient norm :     0.0022070 Eh/α   predicted    -0.2593532E-04 (  -6.47%)
   displ. norm   :     0.0933055 α      lambda       -0.2583155E-04
   maximum displ.:     0.0498821 α      in ANC's #2, #5, #9, ...

........................................................................
.............................. CYCLE   18 ..............................
........................................................................
   1    -45.8380110 -0.458380E+02  0.441E-02    1.24       0.0  T
   2    -45.8380107  0.278679E-06  0.263E-02    1.24       1.0  T
   3    -45.8379955  0.152162E-04  0.221E-02    1.24       1.0  T
   4    -45.8380114 -0.159426E-04  0.214E-03    1.24       8.5  T
   5    -45.8380116 -0.120787E-06  0.733E-04    1.24      24.9  T
   6    -45.8380116 -0.494784E-08  0.396E-04    1.24      46.2  T
     SCC iter.                  ...        0 min,  0.009 sec
     gradient                   ...        0 min,  0.017 sec
 * total energy  :   -45.1379171 Eh     change       -0.1704676E-04 Eh
   gradient norm :     0.0021944 Eh/α   predicted    -0.1303258E-04 ( -23.55%)
   displ. norm   :     0.0856216 α      lambda       -0.2723196E-04
   maximum displ.:     0.0426131 α      in ANC's #2, #5, #3, ...

........................................................................
.............................. CYCLE   19 ..............................
........................................................................
   1    -45.8381677 -0.458382E+02  0.385E-02    1.24       0.0  T
   2    -45.8381674  0.349457E-06  0.234E-02    1.24       1.0  T
   3    -45.8381519  0.154844E-04  0.224E-02    1.24       1.0  T
   4    -45.8381682 -0.163562E-04  0.214E-03    1.24       8.5  T
   5    -45.8381683 -0.100381E-06  0.816E-04    1.24      22.4  T
   6    -45.8381684 -0.227805E-08  0.462E-04    1.24      39.5  T
     SCC iter.                  ...        0 min,  0.009 sec
     gradient                   ...        0 min,  0.017 sec
 * total energy  :   -45.1379370 Eh     change       -0.1989340E-04 Eh
   gradient norm :     0.0018899 Eh/α   predicted    -0.1371879E-04 ( -31.04%)
   displ. norm   :     0.1798857 α      lambda       -0.2464358E-04
   maximum displ.:     0.1109673 α      in ANC's #2, #5, #1, ...

........................................................................
.............................. CYCLE   20 ..............................
........................................................................
   1    -45.8379298 -0.458379E+02  0.801E-02    1.23       0.0  T
   2    -45.8379303 -0.500891E-06  0.477E-02    1.23       1.0  T
   3    -45.8379240  0.625074E-05  0.149E-02    1.23       1.2  T
   4    -45.8379304 -0.639931E-05  0.381E-03    1.23       4.8  T
   5    -45.8379308 -0.367123E-06  0.154E-03    1.23      11.9  T
   6    -45.8379308 -0.190521E-07  0.737E-04    1.23      24.8  T
   7    -45.8379308 -0.275047E-08  0.257E-04    1.23      71.1  T
     SCC iter.                  ...        0 min,  0.010 sec
     gradient                   ...        0 min,  0.017 sec
 * total energy  :   -45.1379579 Eh     change       -0.2098329E-04 Eh
   gradient norm :     0.0020616 Eh/α   predicted    -0.1249997E-04 ( -40.43%)
   displ. norm   :     0.0506760 α      lambda       -0.1088248E-04
   maximum displ.:     0.0345533 α      in ANC's #2, #3, #1, ...
 * RMSD in coord.:     0.4547190 α      energy gain  -0.6356665E-02 Eh

generating ANC from model Hessian ...
Using Lindh-Hessian (1995)
 Shifting diagonal of input Hessian by   4.577616390170691E-003
 Lowest  eigenvalues of input Hessian
   -0.000000   -0.000000    0.000000    0.000000    0.000000    0.000000
    0.005000    0.005370    0.006493    0.007397    0.008210    0.008658
    0.009658    0.010213    0.010813    0.011499    0.013942    0.016450
 Highest eigenvalues
    1.824875    1.876818    1.978191    2.053211    2.106643    2.120090
 

........................................................................
.............................. CYCLE   21 ..............................
........................................................................
   1    -45.8383730 -0.458384E+02  0.201E-02    1.23       0.0  T
   2    -45.8383729  0.627552E-07  0.121E-02    1.23       1.5  T
   3    -45.8383695  0.339173E-05  0.102E-02    1.23       1.8  T
   4    -45.8383731 -0.355561E-05  0.777E-04    1.23      23.5  T
   5    -45.8383731 -0.108394E-07  0.401E-04    1.23      45.5  T
   6    -45.8383731 -0.790777E-09  0.189E-04    1.23      96.5  T
     SCC iter.                  ...        0 min,  0.009 sec
     gradient                   ...        0 min,  0.017 sec
 * total energy  :   -45.1379663 Eh     change       -0.8353624E-05 Eh
   gradient norm :     0.0017046 Eh/α   predicted     0.0000000E+00 (-100.00%)
   displ. norm   :     0.0278171 α      lambda       -0.6021306E-05
   maximum displ.:     0.0158377 α      in ANC's #1, #2, #3, ...

........................................................................
.............................. CYCLE   22 ..............................
........................................................................
   1    -45.8386689 -0.458387E+02  0.101E-02    1.23       0.0  T
   2    -45.8386688  0.134238E-06  0.667E-03    1.23       2.7  T
   3    -45.8386677  0.107634E-05  0.712E-03    1.23       2.6  T
   4    -45.8386690 -0.134741E-05  0.143E-03    1.23      12.8  T
   5    -45.8386691 -0.517927E-07  0.359E-04    1.23      50.9  T
   6    -45.8386691 -0.164159E-08  0.175E-04    1.23     104.3  T
     SCC iter.                  ...        0 min,  0.009 sec
     gradient                   ...        0 min,  0.017 sec
 * total energy  :   -45.1379721 Eh     change       -0.5835688E-05 Eh
   gradient norm :     0.0005729 Eh/α   predicted    -0.3018502E-05 ( -48.28%)
   displ. norm   :     0.0272843 α      lambda        0.2123545E-05
   maximum displ.:     0.0148804 α      in ANC's #1, #2, #3, ...

........................................................................
.............................. CYCLE   23 ..............................
........................................................................
   1    -45.8389508 -0.458390E+02  0.994E-03    1.23       0.0  T
   2    -45.8389507  0.133298E-06  0.657E-03    1.24       2.8  T
   3    -45.8389496  0.102869E-05  0.701E-03    1.23       2.6  T
   4    -45.8389509 -0.129919E-05  0.140E-03    1.23      13.0  T
   5    -45.8389510 -0.499034E-07  0.356E-04    1.23      51.3  T
   6    -45.8389510 -0.160642E-08  0.174E-04    1.23     104.8  T
     SCC iter.                  ...        0 min,  0.008 sec
     gradient                   ...        0 min,  0.017 sec
 * total energy  :   -45.1379715 Eh     change        0.6068395E-06 Eh
   gradient norm :     0.0015935 Eh/α   predicted     0.1060084E-05 (  74.69%)
   displ. norm   :     0.0094149 α      lambda       -0.4024857E-05
   maximum displ.:     0.0037399 α      in ANC's #22, #1, #5, ...

........................................................................
.............................. CYCLE   24 ..............................
........................................................................
   1    -45.8387844 -0.458388E+02  0.794E-03    1.23       0.0  T
   2    -45.8387843  0.927270E-07  0.516E-03    1.23       3.5  T
   3    -45.8387834  0.873701E-06  0.597E-03    1.23       3.1  T
   4    -45.8387845 -0.102970E-05  0.678E-04    1.23      26.9  T
   5    -45.8387845 -0.109630E-07  0.155E-04    1.23     117.7  T
   6    -45.8387845 -0.473626E-09  0.651E-05    1.23     280.5  T
     SCC iter.                  ...        0 min,  0.009 sec
     gradient                   ...        0 min,  0.017 sec
 * total energy  :   -45.1379743 Eh     change       -0.2730585E-05 Eh
   gradient norm :     0.0007882 Eh/α   predicted    -0.2012714E-05 ( -26.29%)
   displ. norm   :     0.0115076 α      lambda       -0.1826393E-05
   maximum displ.:     0.0066221 α      in ANC's #1, #2, #13, ...

   *** GEOMETRY OPTIMIZATION CONVERGED AFTER 24 ITERATIONS ***

------------------------------------------------------------------------
 total energy gain   :        -0.0063730 Eh       -3.9991 kcal/mol
 total RMSD          :         0.4599936 a0        0.2434 Å
 total power (kW/mol):        -0.6971771 (step)  -17.7305 (real)
------------------------------------------------------------------------

 ANCopt (total)                0 d,  0 h,  0 min,  0.944 sec
 optimizer setup                ...        0 min,  0.000 sec (  0.017%)
 model hessian                  ...        0 min,  0.011 sec (  1.211%)
 ANC generation                 ...        0 min,  0.002 sec (  0.196%)
 coordinate transformation      ...        0 min,  0.001 sec (  0.059%)
 single point calculation       ...        0 min,  0.920 sec ( 97.487%)
 optimization log               ...        0 min,  0.003 sec (  0.301%)
 hessian update                 ...        0 min,  0.000 sec (  0.040%)
 rational function              ...        0 min,  0.005 sec (  0.525%)

================
 final structure:
================
$coord
    1.86829839983359    0.96030883460161   -0.22181119545594      C 
    1.05750296042066   -1.42752163295284    0.04783295705890      C 
   -1.69362845076784   -1.40217691900147    0.23218651915789      C 
   -2.85087707765840   -3.66689255191702    0.38660564040000      O 
   -5.50142292074549   -3.79268209808456    0.55813209764732      C 
   -2.54528026627095    1.04028416101974    0.10334019643101      C 
   -0.31474387069227    2.64502541263633   -0.11909724864402      C 
   -0.10110109576530    5.21667317496326    0.01293960305964      C 
    2.20615989966455    6.63228408741121   -0.33444803290778      C 
    1.67320283065787    9.11731793060597    0.01070843312413      C 
    3.15346193613886   11.18042407523498   -0.12296959977826      O 
    5.71811844263563   10.76438280218783   -0.69735274413587      C 
   -1.00437255156973    9.38167685060842    0.64447499284526      C 
   -2.05747630951830    7.07359629720363    0.62798704768873      C 
   -5.15646789179740    1.92477516605830   -0.02744818072968      C 
   -6.01936946116150    3.44978776594432   -1.82117136726465      C 
    3.79080888792990    1.58249616540594   -0.36435744298716      H 
    2.14735211554911   -3.13693601369867    0.10917363929841      H 
   -5.98516632910680   -5.78176856211760    0.33071766976580      H 
   -6.40901759973626   -2.68088323605721   -0.92739992304641      H 
   -6.15917058955661   -3.14422291619492    2.40746337309021      H 
    3.98962864981556    5.81792598132674   -0.84065982888466      H 
    6.61977666491845   12.61338962442717   -0.69720311101195      H 
    5.92948118948091    9.88796280854795   -2.55820795508723      H 
    6.60874541651895    9.55471582211562    0.72377843456133      H 
   -1.88108001923738   11.16460769411982    1.05129313516169      H 
   -3.97771468065578    6.60668739805553    1.06496833541244      H 
   -6.44113568356680    1.24994164393101    1.41657297093819      H 
   -4.80874135958031    4.14679139003947   -3.30064654638406      H 
   -7.95961402035135    4.06340276807417   -1.86529004630000      H 
$end
           -------------------------------------------------
          |                Final Singlepoint                |
           -------------------------------------------------

          ...................................................
          :                      SETUP                      :
          :.................................................:
          :  # basis functions                  78          :
          :  # atomic orbitals                  78          :
          :  # shells                           46          :
          :  # electrons                        82          :
          :  max. iterations                   250          :
          :  Hamiltonian                  GFN2-xTB          :
          :  restarted?                      false          :
          :  GBSA solvation                  false          :
          :  PC potential                    false          :
          :  electronic temp.          300.0000000     K    :
          :  accuracy                    1.0000000          :
          :  -> integral cutoff          0.2500000E+02      :
          :  -> integral neglect         0.1000000E-07      :
          :  -> SCF convergence          0.1000000E-05 Eh   :
          :  -> wf. convergence          0.1000000E-03 e    :
          :  Broyden damping             0.4000000          :
          ...................................................

 iter      E             dE          RMSdq      gap      omega  full diag
   1    -45.8387845 -0.458388E+02  0.338E-05    1.23       0.0  T
   2    -45.8387845  0.184741E-12  0.243E-05    1.23     750.3  T
   3    -45.8387845 -0.206910E-10  0.110E-05    1.23    1664.9  T

   *** convergence criteria satisfied after 3 iterations ***

         #    Occupation            Energy/Eh            Energy/eV
      -------------------------------------------------------------
         1        2.0000           -0.7197577             -19.5856
       ...           ...                  ...                  ...
        35        2.0000           -0.4328767             -11.7792
        36        2.0000           -0.4318014             -11.7499
        37        2.0000           -0.4223672             -11.4932
        38        2.0000           -0.3995929             -10.8735
        39        2.0000           -0.3848878             -10.4733
        40        2.0000           -0.3624955              -9.8640
        41        2.0000           -0.3502831              -9.5317 (HOMO)
        42                         -0.3049326              -8.2976 (LUMO)
        43                         -0.2148499              -5.8464
        44                         -0.1799204              -4.8959
        45                         -0.1400852              -3.8119
        46                         -0.1354490              -3.6858
       ...                                ...                  ...
        78                          0.7573318              20.6080
      -------------------------------------------------------------
                  HL-Gap            0.0453505 Eh            1.2341 eV
             Fermi-level           -0.3276079 Eh           -8.9147 eV

 SCC (total)                   0 d,  0 h,  0 min,  0.035 sec
 SCC setup                      ...        0 min,  0.000 sec (  0.743%)
 Dispersion                     ...        0 min,  0.000 sec (  0.803%)
 integral evaluation            ...        0 min,  0.011 sec ( 33.096%)
 zeroth order Hamiltonian       ...        0 min,  0.000 sec (  0.537%)
 iterations                     ...        0 min,  0.005 sec ( 14.610%)
 molecular gradient             ...        0 min,  0.017 sec ( 48.900%)
 printout                       ...        0 min,  0.000 sec (  1.125%)

         :::::::::::::::::::::::::::::::::::::::::::::::::::::
         ::                     SUMMARY                     ::
         :::::::::::::::::::::::::::::::::::::::::::::::::::::
         :: total energy             -45.137974241758 Eh    ::
         :: gradient norm              0.000788717010 Eh/a0 ::
         :: HOMO-LUMO gap              1.234050343357 eV    ::
         ::.................................................::
         :: SCC energy               -45.838784478721 Eh    ::
         :: -> isotropic ES            0.028523308082 Eh    ::
         :: -> anisotropic ES          0.006180136524 Eh    ::
         :: -> anisotropic XC          0.018853009601 Eh    ::
         :: -> dispersion             -0.029518113464 Eh    ::
         :: repulsion energy           0.700778179906 Eh    ::
         :: add. restraining           0.000000000000 Eh    ::
         :::::::::::::::::::::::::::::::::::::::::::::::::::::

           -------------------------------------------------
          |                Property Printout                |
           -------------------------------------------------

    * Orbital Energies and Occupations

         #    Occupation            Energy/Eh            Energy/eV
      -------------------------------------------------------------
         1        2.0000           -0.7197577             -19.5856
       ...           ...                  ...                  ...
        29        2.0000           -0.4617842             -12.5658
        30        2.0000           -0.4611427             -12.5483
        31        2.0000           -0.4555271             -12.3955
        32        2.0000           -0.4508760             -12.2690
        33        2.0000           -0.4431298             -12.0582
        34        2.0000           -0.4372589             -11.8984
        35        2.0000           -0.4328767             -11.7792
        36        2.0000           -0.4318014             -11.7499
        37        2.0000           -0.4223672             -11.4932
        38        2.0000           -0.3995929             -10.8735
        39        2.0000           -0.3848878             -10.4733
        40        2.0000           -0.3624955              -9.8640
        41        2.0000           -0.3502831              -9.5317 (HOMO)
        42                         -0.3049326              -8.2976 (LUMO)
        43                         -0.2148499              -5.8464
        44                         -0.1799204              -4.8959
        45                         -0.1400852              -3.8119
        46                         -0.1354490              -3.6858
        47                         -0.0915032              -2.4899
        48                          0.0281701               0.7665
        49                          0.0343456               0.9346
        50                          0.0860198               2.3407
        51                          0.0945594               2.5731
        52                          0.1106027               3.0097
       ...                                ...                  ...
        78                          0.7573318              20.6080
      -------------------------------------------------------------
                  HL-Gap            0.0453505 Eh            1.2341 eV
             Fermi-level           -0.3276079 Eh           -8.9147 eV

     #   Z        covCN         q      C6AA      α(0)
     1   6 C      2.996    -0.051    29.260     8.873
     2   6 C      3.005    -0.052    29.278     8.876
     3   6 C      2.981     0.134    25.071     8.213
     4   8 O      1.705    -0.250    18.136     5.750
     5   6 C      3.643     0.036    20.314     6.479
     6   6 C      3.030    -0.056    29.371     8.890
     7   6 C      3.090     0.017    27.530     8.600
     8   6 C      3.089     0.024    27.366     8.575
     9   6 C      2.989    -0.109    30.756     9.097
    10   6 C      2.995     0.142    24.904     8.186
    11   8 O      1.704    -0.249    18.120     5.747
    12   6 C      3.657     0.035    20.272     6.462
    13   6 C      3.011    -0.051    29.260     8.873
    14   6 C      3.000    -0.050    29.222     8.867
    15   6 C      2.887    -0.024    28.601     8.768
    16   6 C      2.840    -0.094    30.357     9.029
    17   1 H      0.926     0.041     2.440     2.443
    18   1 H      0.926     0.045     2.382     2.414
    19   1 H      0.925     0.061     2.188     2.313
    20   1 H      0.924     0.049     2.334     2.389
    21   1 H      0.924     0.044     2.395     2.420
    22   1 H      0.926     0.028     2.612     2.528
    23   1 H      0.925     0.062     2.171     2.304
    24   1 H      0.924     0.046     2.376     2.410
    25   1 H      0.924     0.045     2.377     2.411
    26   1 H      0.926     0.044     2.396     2.421
    27   1 H      0.926     0.045     2.386     2.415
    28   1 H      0.925     0.026     2.648     2.545
    29   1 H      0.926     0.036     2.508     2.476
    30   1 H      0.926     0.028     2.610     2.527

 Mol. C6AA /au·bohr⁶  :      10618.126149
 Mol. C8AA /au·bohr⁸  :     255434.694044
 Mol. α(0) /au        :        163.302403


Wiberg/Mayer (AO) data.
largest (>0.10) Wiberg bond orders for each atom
          total WBO             WBO to atom ...
     1  C   3.981        C    2 1.750    C    7 1.090    H   17 0.969
     2  C   3.935        C    1 1.750    C    3 1.077    H   18 0.971
     3  C   3.879        C    6 1.526    O    4 1.088    C    2 1.077
     4  O   2.255        C    3 1.088    C    5 0.980
     5  C   3.944        O    4 0.980    H   19 0.980    H   21 0.976    H   20 0.973
     6  C   3.965        C    3 1.526    C    7 1.111    C   15 1.070
     7  C   3.984        C    8 1.518    C    6 1.111    C    1 1.090
     8  C   3.982        C    7 1.518    C    9 1.152    C   14 1.081
     9  C   3.962        C   10 1.589    C    8 1.152    H   22 0.969
    10  C   3.876        C    9 1.589    O   11 1.092    C   13 1.064
    11  O   2.252        C   10 1.092    C   12 0.981
    12  C   3.944        O   11 0.981    H   23 0.981    H   25 0.976    H   24 0.976
    13  C   3.941        C   14 1.773    C   10 1.064    H   26 0.972
    14  C   3.982        C   13 1.773    C    8 1.081    H   27 0.967
    15  C   3.993        C   16 1.914    C    6 1.070    H   28 0.958
    16  C   3.990        C   15 1.914    H   30 0.978    H   29 0.977
    17  H   0.997        C    1 0.969
    18  H   0.997        C    2 0.971
    19  H   0.996        C    5 0.980
    20  H   0.995        C    5 0.973
    21  H   0.995        C    5 0.976
    22  H   0.999        C    9 0.969
    23  H   0.996        C   12 0.981
    24  H   0.996        C   12 0.976
    25  H   0.997        C   12 0.976
    26  H   0.997        C   13 0.972
    27  H   0.997        C   14 0.967
    28  H   0.999        C   15 0.958
    29  H   0.999        C   16 0.977
    30  H   0.998        C   16 0.978

molecular dipole:
                 x           y           z       tot (Debye)
 q only:        0.104      -0.096      -0.012
   full:        0.086      -0.112      -0.005       0.358
molecular quadrupole (traceless):
                xx          xy          yy          xz          yz          zz
 q only:       10.014      10.696      -4.893      -2.493      -1.624      -5.121
  q+dip:       12.057      10.615      -4.541      -3.566      -2.752      -7.516
   full:       11.913      11.269      -7.039      -3.004      -2.228      -4.875

           -------------------------------------------------
          |                Geometry Summary                 |
           -------------------------------------------------

      molecular mass/u    :      214.2634000
   center of mass at/Å    :       -0.3763581       1.9563853      -0.0273514
  moments of inertia/u·Å² :        0.3874279E+03   0.1850198E+04   0.2184989E+04
rotational constants/cm⁻¹ :        0.4351167E-01   0.9111261E-02   0.7715203E-02

 * 25 selected distances

     #   Z        #   Z                                     value/Å
     1   6 C      2   6 C                                 1.3420494
     3   6 C      4   8 O                                 1.3483128
     4   8 O      5   6 C                                 1.4071178
     3   6 C      6   6 C                                 1.3705107
     7   6 C      8   6 C                                 1.3673319
     8   6 C      9   6 C                                 1.4441873 (max)
     9   6 C     10   6 C                                 1.3572720
    10   6 C     11   8 O                                 1.3455516
    11   8 O     12   6 C                                 1.4080958
    13   6 C     14   6 C                                 1.3425400
    15   6 C     16   6 C                                 1.3269277
     1   6 C     17   1 H                                 1.0719573
     2   6 C     18   1 H                                 1.0732820
     5   6 C     19   1 H                                 1.0899240
     5   6 C     20   1 H                                 1.0930592
     5   6 C     21   1 H                                 1.0938950
     9   6 C     22   1 H                                 1.0715272
    12   6 C     23   1 H                                 1.0885903
    12   6 C     24   1 H                                 1.0942035
    12   6 C     25   1 H                                 1.0942747
    13   6 C     26   1 H                                 1.0731944
    14   6 C     27   1 H                                 1.0710150 (min)
    15   6 C     28   1 H                                 1.0833240
    16   6 C     29   1 H                                 1.0767530
    16   6 C     30   1 H                                 1.0771089

 * 3 distinct bonds (by element types)

   Z      Z             #   av. dist./Å        max./Å        min./Å
   1 H    6 C          14     1.0822935     1.0942747     1.0710150
   6 C    6 C           7     1.3644027     1.4441873     1.3269277
   6 C    8 O           4     1.3772695     1.4080958     1.3455516


optimized geometry written to: xtbopt.xyz


           -------------------------------------------------
          | TOTAL ENERGY              -45.137974241758 Eh   |
          | GRADIENT NORM               0.000788717010 Eh/α |
          | HOMO-LUMO GAP               1.234050343357 eV   |
           -------------------------------------------------

------------------------------------------------------------------------
 * finished run on 2021/05/19 at 11:00:12.449     
------------------------------------------------------------------------
 total:
 * wall-time:     0 d,  0 h,  0 min,  1.053 sec
 *  cpu-time:     0 d,  0 h,  0 min,  1.053 sec
 * ratio c/w:     0.999 speedup
 SCF:
 * wall-time:     0 d,  0 h,  0 min,  0.049 sec
 *  cpu-time:     0 d,  0 h,  0 min,  0.049 sec
 * ratio c/w:     1.000 speedup
 ANC optimizer:
 * wall-time:     0 d,  0 h,  0 min,  0.979 sec
 *  cpu-time:     0 d,  0 h,  0 min,  0.979 sec
 * ratio c/w:     1.000 speedup

