      -----------------------------------------------------------      
     |                   =====================                   |     
     |                           x T B                           |     
     |                   =====================                   |     
     |                         S. Grimme                         |     
     |          Mulliken Center for Theoretical Chemistry        |     
     |                    University of Bonn                     |     
     |                Version 6.2 RC2 (SAW190805)                |     
      -----------------------------------------------------------      

   This program is distributed in the hope that it will be useful,
   but WITHOUT ANY WARRANTY; without even the implied warranty of
   MERCHANTABILITY or FITNESS FOR A PARTICULAR PURPOSE.
   
   FOR NON-COMMERCIAL, ACADEMIA USE ONLY.
   
   Cite this work as:
   * S. Grimme, C. Bannwarth, P. Shushkov, J. Chem. Theory Comput., 2017,
     13, 1989-2009. DOI: 10.1021/acs.jctc.7b00118
   * C. Bannwarth, S. Ehlert and S. Grimme., J. Chem. Theory Comput., 2019,
     15, 1652-1671. DOI: 10.1021/acs.jctc.8b01176
   * P. Pracht, E. Caldeweyher, S. Ehlert, S. Grimme, ChemRxiv, 2019, preprint.
     DOI: 10.26434/chemrxiv.8326202.v1
   
   for DFT-D4:
   * E. Caldeweyher, C. Bannwarth and S. Grimme, J. Chem. Phys., 2017,
     147, 034112. DOI: 10.1063/1.4993215
   * E. Caldeweyher, S. Ehlert, A. Hansen, H. Neugebauer, S. Spicher,
     C. Bannwarth and S. Grimme, J. Chem. Phys., 2019, 150, 154122.
     DOI: 10.1063/1.5090222
   
   for sTDA-xTB:
   * S. Grimme and C. Bannwarth, J. Chem. Phys., 2016, 145, 054103.
     DOI: 10.1063/1.4959605
   
   in the mass-spec context:
   * V. Asgeirsson, C. Bauer and S. Grimme, Chem. Sci., 2017, 8, 4879.
     DOI: 10.1039/c7sc00601b
   
   for metadynamics refer to:
   * S. Grimme, J. Chem. Theory Comput., 2019, 155, 2847-2862
     DOI: 10.1021/acs.jctc.9b00143
   
   with help from (in alphabetical order)
   C. Bannwarth, F. Bohle, G. Brandenburg, E. Caldeweyher, M. Checinski,
   S. Dohm, S. Ehlert, S. Ehrlich, F. März, H. Neugebauer, J. Pisarek,
   P. Pracht, P. Shushkov, and S. Spicher.
   
 * started run on 2021/08/31 at 16:00:19.946     

           -------------------------------------------------
          |                Calculation Setup                |
           -------------------------------------------------

          program call               : /ihome/ghutchison/geoffh/xtb/xtb 718don.xyz -opt
          hostname                   : smp-n65
          coordinate file            : 718don.xyz
          omp threads                :                     1
          number of atoms            :                    27
          number of electrons        :                    72
          charge                     :                     0
          spin                       :                   0.0
          first test random number   :      0.41606924280798


########################################################################
# WARNING! Please study the warnings concerning your input carefully
#  - the use of '-opt' is discouraged, please use '--opt' next time
########################################################################

           ------------------------------------------------- 
          |                 G F N 2 - x T B                 |
          | Geometry, Frequencies, Noncovalent interactions |
          |            JCTC 2019 parametrisation            |
           ------------------------------------------------- 
             KAB for C  - Si     :                1.0500
             KAB for H  - Pd     :                0.9500
             k(s)              :                1.8500
             k(p)              :                2.2300
             k(d)              :                2.2300
             k(f)              :                2.0000
             kEN (H0ij)        :               -2.0000
             D4 a1             :                0.5200
             D4 a2             :                5.0000
             D4 s6             :                1.0000
             D4 s8             :                2.7000
             D4 s9             :                5.0000
             alphaj            :                2.0000

  Z AO/shell   Hii/eV     exponent
  1     Wed Apr 25 08:07:45 CEST 2018   EN: 2.200 GM2: 0.406  GM3: 0.0800  RAES: 1.40
     1s    -10.707211    1.230000
  6     Wed Apr 25 08:07:45 CEST 2018   EN: 2.550 GM2: 0.538  GM3: 0.1500  RAES: 3.00
     2s    -13.970922    2.096432
     2p    -10.063292    1.800000
  8     Wed Apr 25 08:07:45 CEST 2018   EN: 3.440 GM2: 0.452  GM3:-0.0517  RAES: 1.80
     2s    -20.229985    2.439742
     2p    -15.503117    2.137023
 16     Tue Apr 24 11:44:34 CEST 2018   EN: 2.580 GM2: 0.340  GM3:-0.0502  RAES: 3.10
     3s    -20.029654    1.981333
     3p    -11.377694    2.025643
     3d     -0.420282    1.702555

           ------------------------------------------------- 
          |        Self-Consistent Charge Iterations        |
           ------------------------------------------------- 

          ...................................................
          :                      SETUP                      :
          :.................................................:
          :  # basis functions                  72          :
          :  # atomic orbitals                  71          :
          :  # shells                           41          :
          :  # electrons                        72          :
          :  max. iterations                   250          :
          :  Hamiltonian                  GFN2-xTB          :
          :  restarted?                      false          :
          :  GBSA solvation                  false          :
          :  PC potential                    false          :
          :  electronic temp.          300.0000000     K    :
          :  accuracy                    1.0000000          :
          :  -> integral cutoff          0.2500000E+02      :
          :  -> integral neglect         0.1000000E-07      :
          :  -> SCF convergence          0.1000000E-05 Eh   :
          :  -> wf. convergence          0.1000000E-03 e    :
          :  Broyden damping             0.4000000          :
          ...................................................

 iter      E             dE          RMSdq      gap      omega  full diag
   1    -40.2999961 -0.403000E+02  0.405E+00    3.85       0.0  T
   2    -40.3604034 -0.604073E-01  0.213E+00    3.89       1.0  T
   3    -40.3595401  0.863363E-03  0.886E-01    3.86       1.0  T
   4    -40.3600042 -0.464151E-03  0.408E-01    3.82       1.0  T
   5    -40.3632871 -0.328286E-02  0.117E-01    3.84       1.0  T
   6    -40.3633660 -0.789032E-04  0.420E-02    3.84       1.0  T
   7    -40.3633776 -0.116303E-04  0.167E-02    3.85       1.2  T
   8    -40.3633779 -0.305712E-06  0.501E-03    3.84       3.8  T
   9    -40.3633779  0.521299E-07  0.306E-03    3.84       6.3  T
  10    -40.3633780 -0.150043E-06  0.106E-03    3.84      18.2  T
  11    -40.3633780 -0.120883E-07  0.445E-04    3.84      43.3  T
  12    -40.3633780 -0.657110E-10  0.119E-04    3.84     161.2  T

   *** convergence criteria satisfied after 12 iterations ***

         #    Occupation            Energy/Eh            Energy/eV
      -------------------------------------------------------------
         1        2.0000           -0.7268815             -19.7795
       ...           ...                  ...                  ...
        30        2.0000           -0.4485199             -12.2048
        31        2.0000           -0.4353515             -11.8465
        32        2.0000           -0.4342191             -11.8157
        33        2.0000           -0.4045602             -11.0086
        34        2.0000           -0.4007730             -10.9056
        35        2.0000           -0.3852482             -10.4831
        36        2.0000           -0.3826191             -10.4116 (HOMO)
        37                         -0.2413439              -6.5673 (LUMO)
        38                         -0.1954721              -5.3191
        39                         -0.1797410              -4.8910
        40                         -0.1086987              -2.9578
        41                         -0.0068287              -0.1858
       ...                                ...                  ...
        71                          0.6667137              18.1422
      -------------------------------------------------------------
                  HL-Gap            0.1412752 Eh            3.8443 eV
             Fermi-level           -0.3119815 Eh           -8.4894 eV

 SCC (total)                   0 d,  0 h,  0 min,  0.111 sec
 SCC setup                      ...        0 min,  0.000 sec (  0.275%)
 Dispersion                     ...        0 min,  0.000 sec (  0.335%)
 integral evaluation            ...        0 min,  0.012 sec ( 10.733%)
 zeroth order Hamiltonian       ...        0 min,  0.000 sec (  0.175%)
 iterations                     ...        0 min,  0.083 sec ( 74.890%)
 molecular gradient             ...        0 min,  0.015 sec ( 13.245%)
 printout                       ...        0 min,  0.000 sec (  0.307%)

         :::::::::::::::::::::::::::::::::::::::::::::::::::::
         ::                     SUMMARY                     ::
         :::::::::::::::::::::::::::::::::::::::::::::::::::::
         :: total energy             -39.913215249417 Eh    ::
         :: gradient norm              0.047143521832 Eh/a0 ::
         :: HOMO-LUMO gap              3.844292978488 eV    ::
         ::.................................................::
         :: SCC energy               -40.363378031383 Eh    ::
         :: -> isotropic ES            0.039043427178 Eh    ::
         :: -> anisotropic ES          0.004619116989 Eh    ::
         :: -> anisotropic XC          0.009355398556 Eh    ::
         :: -> dispersion             -0.025206925194 Eh    ::
         :: repulsion energy           0.450010057739 Eh    ::
         :: add. restraining           0.000000000000 Eh    ::
         :::::::::::::::::::::::::::::::::::::::::::::::::::::

      ----------------------------------------------------------- 
     |                   =====================                   |
     |                        A N C O P T                        |
     |                   =====================                   |
     |               Approximate Normal Coordinate               |
     |                Rational Function Optimizer                |
      ----------------------------------------------------------- 

          ...................................................
          :                      SETUP                      :
          :.................................................:
          :   optimization level            normal          :
          :   max. optcycles                   200          :
          :   ANC micro-cycles                  20          :
          :   degrees of freedom                75          :
          :.................................................:
          :   RF solver                   davidson          :
          :   input Hessian                  false          :
          :   write xtbopt.log                true          :
          :   linear?                        false          :
          :   energy convergence         0.5000000E-05 Eh   :
          :   grad. convergence          0.1000000E-02 Eh/α :
          :   maximium RF displ.         2.0000000          :
          :   Hlow (freq-cutoff)         0.5000000E-02      :
          :   Hmax (freq-cutoff)         5.0000000          :
          :   S6 in model hess.         20.0000000          :
          ...................................................

generating ANC from model Hessian ...
Using Lindh-Hessian (1995)
 Shifting diagonal of input Hessian by   3.821741310219394E-003
 Lowest  eigenvalues of input Hessian
   -0.000000   -0.000000    0.000000    0.000000    0.000000    0.000000
    0.005000    0.005929    0.006959    0.007418    0.008931    0.009648
    0.011498    0.012071    0.018948    0.022006    0.022374    0.023391
 Highest eigenvalues
    1.486981    1.488885    1.516126    1.643696    1.734544    1.795584
 

........................................................................
.............................. CYCLE    1 ..............................
........................................................................
   1    -40.3633780 -0.403634E+02  0.501E-05    3.84       0.0  T
   2    -40.3633780 -0.675016E-11  0.309E-05    3.84     622.5  T
   3    -40.3633780  0.888178E-12  0.184E-05    3.84    1045.7  T
     SCC iter.                  ...        0 min,  0.004 sec
     gradient                   ...        0 min,  0.015 sec
 * total energy  :   -39.9132153 Eh     change       -0.1384709E-07 Eh
   gradient norm :     0.0471438 Eh/α   predicted     0.0000000E+00 (-100.00%)
   displ. norm   :     0.3560631 α      lambda       -0.6309362E-02
   maximum displ.:     0.1951409 α      in ANC's #10, #5, #2, ...

........................................................................
.............................. CYCLE    2 ..............................
........................................................................
   1    -40.3843729 -0.403844E+02  0.213E-01    3.93       0.0  T
   2    -40.3844136 -0.407095E-04  0.111E-01    3.94       1.0  T
   3    -40.3844098  0.378347E-05  0.323E-02    3.94       1.0  T
   4    -40.3844146 -0.478189E-05  0.197E-02    3.94       1.0  T
   5    -40.3844197 -0.513910E-05  0.665E-03    3.94       2.9  T
   6    -40.3844200 -0.227034E-06  0.162E-03    3.94      11.9  T
   7    -40.3844200 -0.883064E-08  0.106E-03    3.94      18.2  T
     SCC iter.                  ...        0 min,  0.008 sec
     gradient                   ...        0 min,  0.014 sec
 * total energy  :   -39.9174680 Eh     change       -0.4252732E-02 Eh
   gradient norm :     0.0187265 Eh/α   predicted    -0.3554635E-02 ( -16.42%)
   displ. norm   :     0.2748221 α      lambda       -0.1553584E-02
   maximum displ.:     0.1453100 α      in ANC's #10, #5, #2, ...

........................................................................
.............................. CYCLE    3 ..............................
........................................................................
   1    -40.3922653 -0.403923E+02  0.158E-01    3.97       0.0  T
   2    -40.3922861 -0.207541E-04  0.862E-02    3.98       1.0  T
   3    -40.3922777  0.836028E-05  0.291E-02    3.98       1.0  T
   4    -40.3922876 -0.988038E-05  0.150E-02    3.98       1.3  T
   5    -40.3922907 -0.311480E-05  0.457E-03    3.98       4.2  T
   6    -40.3922908 -0.508482E-07  0.132E-03    3.98      14.6  T
   7    -40.3922908 -0.753924E-08  0.870E-04    3.98      22.1  T
     SCC iter.                  ...        0 min,  0.008 sec
     gradient                   ...        0 min,  0.014 sec
 * total energy  :   -39.9184558 Eh     change       -0.9878095E-03 Eh
   gradient norm :     0.0067801 Eh/α   predicted    -0.8354843E-03 ( -15.42%)
   displ. norm   :     0.2157770 α      lambda       -0.4317834E-03
   maximum displ.:     0.1245674 α      in ANC's #2, #5, #8, ...

........................................................................
.............................. CYCLE    4 ..............................
........................................................................
   1    -40.3925568 -0.403926E+02  0.107E-01    3.97       0.0  T
   2    -40.3925613 -0.448624E-05  0.617E-02    3.97       1.0  T
   3    -40.3925591  0.218714E-05  0.138E-02    3.97       1.4  T
   4    -40.3925616 -0.248654E-05  0.680E-03    3.97       2.8  T
   5    -40.3925623 -0.691188E-06  0.220E-03    3.97       8.7  T
   6    -40.3925624 -0.275088E-07  0.815E-04    3.97      23.6  T
     SCC iter.                  ...        0 min,  0.007 sec
     gradient                   ...        0 min,  0.014 sec
 * total energy  :   -39.9187720 Eh     change       -0.3162342E-03 Eh
   gradient norm :     0.0041571 Eh/α   predicted    -0.2259448E-03 ( -28.55%)
   displ. norm   :     0.2153719 α      lambda       -0.2607565E-03
   maximum displ.:     0.1255927 α      in ANC's #2, #5, #8, ...

........................................................................
.............................. CYCLE    5 ..............................
........................................................................
   1    -40.3914153 -0.403914E+02  0.105E-01    3.96       0.0  T
   2    -40.3914173 -0.194324E-05  0.620E-02    3.96       1.0  T
   3    -40.3914168  0.468918E-06  0.795E-03    3.96       2.4  T
   4    -40.3914175 -0.644659E-06  0.416E-03    3.97       4.6  T
   5    -40.3914176 -0.185467E-06  0.191E-03    3.96      10.1  T
   6    -40.3914177 -0.482586E-07  0.540E-04    3.96      35.6  T
     SCC iter.                  ...        0 min,  0.007 sec
     gradient                   ...        0 min,  0.014 sec
 * total energy  :   -39.9189502 Eh     change       -0.1781464E-03 Eh
   gradient norm :     0.0033574 Eh/α   predicted    -0.1364278E-03 ( -23.42%)
   displ. norm   :     0.1421174 α      lambda       -0.9353649E-04
   maximum displ.:     0.0853218 α      in ANC's #2, #8, #5, ...

........................................................................
.............................. CYCLE    6 ..............................
........................................................................
   1    -40.3910507 -0.403911E+02  0.762E-02    3.96       0.0  T
   2    -40.3910514 -0.748157E-06  0.454E-02    3.96       1.0  T
   3    -40.3910509  0.543668E-06  0.669E-03    3.96       2.9  T
   4    -40.3910516 -0.707793E-06  0.334E-03    3.96       5.8  T
   5    -40.3910517 -0.118155E-06  0.116E-03    3.96      16.5  T
   6    -40.3910517 -0.110179E-07  0.382E-04    3.96      50.4  T
   7    -40.3910517 -0.532197E-09  0.238E-04    3.96      80.8  T
     SCC iter.                  ...        0 min,  0.008 sec
     gradient                   ...        0 min,  0.015 sec
 * total energy  :   -39.9190154 Eh     change       -0.6526131E-04 Eh
   gradient norm :     0.0028273 Eh/α   predicted    -0.4771732E-04 ( -26.88%)
   displ. norm   :     0.1010193 α      lambda       -0.4781663E-04
   maximum displ.:     0.0618476 α      in ANC's #2, #8, #5, ...

........................................................................
.............................. CYCLE    7 ..............................
........................................................................
   1    -40.3913510 -0.403914E+02  0.661E-02    3.96       0.0  T
   2    -40.3913518 -0.845396E-06  0.390E-02    3.96       1.0  T
   3    -40.3913512  0.600031E-06  0.771E-03    3.96       2.5  T
   4    -40.3913520 -0.760444E-06  0.422E-03    3.96       4.6  T
   5    -40.3913522 -0.214229E-06  0.996E-04    3.96      19.3  T
   6    -40.3913522 -0.470749E-08  0.349E-04    3.96      55.2  T
     SCC iter.                  ...        0 min,  0.007 sec
     gradient                   ...        0 min,  0.015 sec
 * total energy  :   -39.9190506 Eh     change       -0.3517901E-04 Eh
   gradient norm :     0.0018013 Eh/α   predicted    -0.2415289E-04 ( -31.34%)
   displ. norm   :     0.1412371 α      lambda       -0.3251180E-04
   maximum displ.:     0.0851723 α      in ANC's #2, #8, #3, ...

........................................................................
.............................. CYCLE    8 ..............................
........................................................................
   1    -40.3920387 -0.403920E+02  0.103E-01    3.97       0.0  T
   2    -40.3920410 -0.226776E-05  0.596E-02    3.97       1.0  T
   3    -40.3920405  0.432778E-06  0.116E-02    3.97       1.7  T
   4    -40.3920411 -0.596672E-06  0.734E-03    3.97       2.6  T
   5    -40.3920419 -0.762317E-06  0.142E-03    3.97      13.6  T
   6    -40.3920419 -0.136544E-07  0.562E-04    3.97      34.3  T
   7    -40.3920419  0.834390E-10  0.369E-04    3.97      52.1  T
     SCC iter.                  ...        0 min,  0.008 sec
     gradient                   ...        0 min,  0.015 sec
 * total energy  :   -39.9190762 Eh     change       -0.2559231E-04 Eh
   gradient norm :     0.0017298 Eh/α   predicted    -0.1640101E-04 ( -35.91%)
   displ. norm   :     0.1414353 α      lambda        0.3095074E-04
   maximum displ.:     0.0851707 α      in ANC's #2, #8, #3, ...

........................................................................
.............................. CYCLE    9 ..............................
........................................................................
   1    -40.3923324 -0.403923E+02  0.103E-01    3.97       0.0  T
   2    -40.3923347 -0.226534E-05  0.597E-02    3.97       1.0  T
   3    -40.3923342  0.442526E-06  0.116E-02    3.97       1.7  T
   4    -40.3923348 -0.616978E-06  0.733E-03    3.97       2.6  T
   5    -40.3923356 -0.761589E-06  0.137E-03    3.97      14.1  T
   6    -40.3923356 -0.125394E-07  0.523E-04    3.97      36.8  T
   7    -40.3923356  0.712369E-09  0.300E-04    3.97      64.1  T
     SCC iter.                  ...        0 min,  0.008 sec
     gradient                   ...        0 min,  0.015 sec
 * total energy  :   -39.9190537 Eh     change        0.2249283E-04 Eh
   gradient norm :     0.0040145 Eh/α   predicted     0.1561179E-04 ( -30.59%)
   displ. norm   :     0.0771136 α      lambda       -0.3918344E-04
   maximum displ.:     0.0475232 α      in ANC's #8, #2, #5, ...

........................................................................
.............................. CYCLE   10 ..............................
........................................................................
   1    -40.3924058 -0.403924E+02  0.521E-02    3.97       0.0  T
   2    -40.3924064 -0.616104E-06  0.311E-02    3.97       1.0  T
   3    -40.3924057  0.730570E-06  0.711E-03    3.97       2.7  T
   4    -40.3924066 -0.917735E-06  0.327E-03    3.97       5.9  T
   5    -40.3924067 -0.116748E-06  0.847E-04    3.97      22.7  T
   6    -40.3924067 -0.187285E-08  0.280E-04    3.97      68.7  T
     SCC iter.                  ...        0 min,  0.007 sec
     gradient                   ...        0 min,  0.014 sec
 * total energy  :   -39.9190813 Eh     change       -0.2754686E-04 Eh
   gradient norm :     0.0020446 Eh/α   predicted    -0.1971149E-04 ( -28.44%)
   displ. norm   :     0.0459944 α      lambda       -0.1648309E-04
   maximum displ.:     0.0353475 α      in ANC's #8, #5, #2, ...

........................................................................
.............................. CYCLE   11 ..............................
........................................................................
   1    -40.3921911 -0.403922E+02  0.273E-02    3.97       0.0  T
   2    -40.3921914 -0.245299E-06  0.166E-02    3.97       1.2  T
   3    -40.3921908  0.599702E-06  0.536E-03    3.97       3.6  T
   4    -40.3921915 -0.712127E-06  0.135E-03    3.97      14.3  T
   5    -40.3921915 -0.200864E-07  0.493E-04    3.97      39.0  T
   6    -40.3921915 -0.228376E-09  0.174E-04    3.97     110.3  T
     SCC iter.                  ...        0 min,  0.007 sec
     gradient                   ...        0 min,  0.015 sec
 * total energy  :   -39.9190919 Eh     change       -0.1061972E-04 Eh
   gradient norm :     0.0005639 Eh/α   predicted    -0.8261180E-05 ( -22.21%)
   displ. norm   :     0.0467360 α      lambda       -0.6414468E-05
   maximum displ.:     0.0218499 α      in ANC's #8, #3, #2, ...

........................................................................
.............................. CYCLE   12 ..............................
........................................................................
   1    -40.3921252 -0.403921E+02  0.280E-02    3.97       0.0  T
   2    -40.3921254 -0.216489E-06  0.151E-02    3.97       1.3  T
   3    -40.3921252  0.213106E-06  0.409E-03    3.97       4.7  T
   4    -40.3921255 -0.272396E-06  0.189E-03    3.97      10.2  T
   5    -40.3921255 -0.215568E-07  0.381E-04    3.97      50.5  T
   6    -40.3921255 -0.170380E-08  0.199E-04    3.97      96.6  T
     SCC iter.                  ...        0 min,  0.007 sec
     gradient                   ...        0 min,  0.015 sec
 * total energy  :   -39.9190987 Eh     change       -0.6819708E-05 Eh
   gradient norm :     0.0006527 Eh/α   predicted    -0.3211333E-05 ( -52.91%)
   displ. norm   :     0.0695406 α      lambda       -0.6445833E-05
   maximum displ.:     0.0386734 α      in ANC's #2, #3, #1, ...

........................................................................
.............................. CYCLE   13 ..............................
........................................................................
   1    -40.3920153 -0.403920E+02  0.438E-02    3.97       0.0  T
   2    -40.3920156 -0.351135E-06  0.244E-02    3.97       1.0  T
   3    -40.3920157 -0.628178E-07  0.433E-03    3.97       4.4  T
   4    -40.3920156  0.728136E-07  0.243E-03    3.97       7.9  T
   5    -40.3920157 -0.125484E-06  0.386E-04    3.97      49.8  T
   6    -40.3920157 -0.160299E-08  0.206E-04    3.97      93.4  T
     SCC iter.                  ...        0 min,  0.007 sec
     gradient                   ...        0 min,  0.015 sec
 * total energy  :   -39.9191059 Eh     change       -0.7188462E-05 Eh
   gradient norm :     0.0007246 Eh/α   predicted    -0.3233022E-05 ( -55.02%)
   displ. norm   :     0.0914042 α      lambda       -0.6613678E-05
   maximum displ.:     0.0550636 α      in ANC's #2, #1, #3, ...

........................................................................
.............................. CYCLE   14 ..............................
........................................................................
   1    -40.3919014 -0.403919E+02  0.607E-02    3.97       0.0  T
   2    -40.3919021 -0.713943E-06  0.342E-02    3.97       1.0  T
   3    -40.3919021  0.167879E-08  0.663E-03    3.97       2.9  T
   4    -40.3919020  0.887729E-07  0.470E-03    3.97       4.1  T
   5    -40.3919024 -0.354238E-06  0.600E-04    3.97      32.1  T
   6    -40.3919024 -0.304954E-08  0.301E-04    3.97      63.9  T
     SCC iter.                  ...        0 min,  0.007 sec
     gradient                   ...        0 min,  0.015 sec
 * total energy  :   -39.9191122 Eh     change       -0.6315374E-05 Eh
   gradient norm :     0.0006802 Eh/α   predicted    -0.3320202E-05 ( -47.43%)
   displ. norm   :     0.0908672 α      lambda        0.2818739E-05
   maximum displ.:     0.0550618 α      in ANC's #2, #3, #1, ...

........................................................................
.............................. CYCLE   15 ..............................
........................................................................
   1    -40.3916144 -0.403916E+02  0.605E-02    3.97       0.0  T
   2    -40.3916152 -0.711282E-06  0.341E-02    3.97       1.0  T
   3    -40.3916152 -0.222176E-07  0.656E-03    3.97       2.9  T
   4    -40.3916151  0.116506E-06  0.466E-03    3.97       4.1  T
   5    -40.3916154 -0.356601E-06  0.582E-04    3.97      33.1  T
   6    -40.3916154 -0.264777E-08  0.297E-04    3.97      64.8  T
     SCC iter.                  ...        0 min,  0.007 sec
     gradient                   ...        0 min,  0.015 sec
 * total energy  :   -39.9191101 Eh     change        0.2130516E-05 Eh
   gradient norm :     0.0016345 Eh/α   predicted     0.1411105E-05 ( -33.77%)
   displ. norm   :     0.0912825 α      lambda        0.1606445E-04
   maximum displ.:     0.0550562 α      in ANC's #2, #1, #3, ...

........................................................................
.............................. CYCLE   16 ..............................
........................................................................
   1    -40.3911502 -0.403912E+02  0.605E-02    3.97       0.0  T
   2    -40.3911509 -0.716511E-06  0.341E-02    3.97       1.0  T
   3    -40.3911509 -0.713899E-08  0.663E-03    3.97       2.9  T
   4    -40.3911509  0.982241E-07  0.471E-03    3.97       4.1  T
   5    -40.3911512 -0.358082E-06  0.577E-04    3.97      33.4  T
   6    -40.3911512 -0.242723E-08  0.303E-04    3.97      63.6  T
     SCC iter.                  ...        0 min,  0.007 sec
     gradient                   ...        0 min,  0.015 sec
 * total energy  :   -39.9190965 Eh     change        0.1355901E-04 Eh
   gradient norm :     0.0030619 Eh/α   predicted     0.8059680E-05 ( -40.56%)
   displ. norm   :     0.0634241 α      lambda       -0.2570469E-04
   maximum displ.:     0.0346329 α      in ANC's #2, #3, #4, ...

........................................................................
.............................. CYCLE   17 ..............................
........................................................................
   1    -40.3917147 -0.403917E+02  0.517E-02    3.97       0.0  T
   2    -40.3917155 -0.753302E-06  0.276E-02    3.97       1.0  T
   3    -40.3917154  0.675400E-07  0.634E-03    3.97       3.0  T
   4    -40.3917155 -0.816205E-07  0.434E-03    3.97       4.4  T
   5    -40.3917158 -0.233697E-06  0.433E-04    3.97      44.5  T
   6    -40.3917158 -0.130546E-08  0.235E-04    3.97      81.9  T
     SCC iter.                  ...        0 min,  0.007 sec
     gradient                   ...        0 min,  0.015 sec
 * total energy  :   -39.9191138 Eh     change       -0.1726875E-04 Eh
   gradient norm :     0.0013607 Eh/α   predicted    -0.1290683E-04 ( -25.26%)
   displ. norm   :     0.0432324 α      lambda       -0.6822678E-05
   maximum displ.:     0.0273326 α      in ANC's #3, #4, #2, ...

........................................................................
.............................. CYCLE   18 ..............................
........................................................................
   1    -40.3922104 -0.403922E+02  0.379E-02    3.97       0.0  T
   2    -40.3922109 -0.431695E-06  0.198E-02    3.97       1.0  T
   3    -40.3922109 -0.287843E-07  0.425E-03    3.97       4.5  T
   4    -40.3922109  0.273120E-07  0.304E-03    3.97       6.3  T
   5    -40.3922110 -0.129870E-06  0.333E-04    3.97      57.7  T
   6    -40.3922110 -0.787061E-09  0.176E-04    3.97     109.4  T
     SCC iter.                  ...        0 min,  0.007 sec
     gradient                   ...        0 min,  0.015 sec
 * total energy  :   -39.9191182 Eh     change       -0.4397011E-05 Eh
   gradient norm :     0.0004014 Eh/α   predicted    -0.3418617E-05 ( -22.25%)
   displ. norm   :     0.0157341 α      lambda       -0.1019739E-05
   maximum displ.:     0.0093191 α      in ANC's #2, #5, #1, ...

   *** GEOMETRY OPTIMIZATION CONVERGED AFTER 18 ITERATIONS ***

------------------------------------------------------------------------
 total energy gain   :        -0.0059029 Eh       -3.7042 kcal/mol
 total RMSD          :         0.2618819 a0        0.1386 Å
 total power (kW/mol):        -0.8610096 (step)  -26.9199 (real)
------------------------------------------------------------------------

 ANCopt (total)                0 d,  0 h,  0 min,  0.576 sec
 optimizer setup                ...        0 min,  0.000 sec (  0.019%)
 model hessian                  ...        0 min,  0.009 sec (  1.598%)
 ANC generation                 ...        0 min,  0.001 sec (  0.125%)
 coordinate transformation      ...        0 min,  0.000 sec (  0.040%)
 single point calculation       ...        0 min,  0.560 sec ( 97.343%)
 optimization log               ...        0 min,  0.002 sec (  0.302%)
 hessian update                 ...        0 min,  0.000 sec (  0.056%)
 rational function              ...        0 min,  0.002 sec (  0.339%)

================
 final structure:
================
$coord
    2.43689272054600    2.14245572163290    0.72250620477453      C 
    4.67708356369141   -0.09268177738657    0.00549062704269      S 
    2.37538780592676   -2.26364293840292   -0.71179001109479      C 
    0.01246912518309   -1.30616672994905   -0.41047423425915      C 
    0.04845124886760    1.25344658672062    0.41392211075583      C 
   -2.31062874983189    2.77204502535506    0.84366768840658      C 
   -2.62133378942861    4.01301806728942   -0.81296202602400      H 
   -1.92266458574240    4.29837179679579    3.00524495485283      O 
   -3.69149595429239    6.25005182989246    3.32330418570420      C 
   -4.58115802383796    0.98315393286192    1.09806973586960      C 
   -4.61838493577208   -0.91801198818157   -1.06550752089628      C 
   -2.38632397804974   -2.75988075559304   -0.84737713135939      C 
   -2.71616876000709   -4.01800367171431    0.79247626952921      H 
   -2.04582372828012   -4.26247372194609   -3.03407766163983      O 
   -3.86659009118269   -6.16129851783405   -3.37629551698285      C 
    3.00138023601740    3.98170301701249    1.34831943914559      H 
    2.88888497126648   -4.11837250074475   -1.33615205848833      H 
   -2.98086392515089    7.42366902638245    4.85582413011806      H 
   -5.56446128023142    5.53171687934860    3.83661442653055      H 
   -3.86211110383574    7.39571262581489    1.60326098311577      H 
   -6.33280862629614    2.07251963126822    1.09232009594387      H 
   -4.43604354255290   -0.00385764454922    2.90574897177536      H 
   -4.47627479580686    0.06744465761738   -2.87458895497568      H 
   -6.39478888646300   -1.96654462756639   -1.03554490659648      H 
   -3.20170747060422   -7.31788557487294   -4.94177913292797      H 
   -5.72526650219364   -5.38442800650092   -3.85364506090564      H 
   -4.04920289275344   -7.34016657316671   -1.68036820462536      H 
$end
           -------------------------------------------------
          |                Final Singlepoint                |
           -------------------------------------------------

          ...................................................
          :                      SETUP                      :
          :.................................................:
          :  # basis functions                  72          :
          :  # atomic orbitals                  71          :
          :  # shells                           41          :
          :  # electrons                        72          :
          :  max. iterations                   250          :
          :  Hamiltonian                  GFN2-xTB          :
          :  restarted?                      false          :
          :  GBSA solvation                  false          :
          :  PC potential                    false          :
          :  electronic temp.          300.0000000     K    :
          :  accuracy                    1.0000000          :
          :  -> integral cutoff          0.2500000E+02      :
          :  -> integral neglect         0.1000000E-07      :
          :  -> SCF convergence          0.1000000E-05 Eh   :
          :  -> wf. convergence          0.1000000E-03 e    :
          :  Broyden damping             0.4000000          :
          ...................................................

 iter      E             dE          RMSdq      gap      omega  full diag
   1    -40.3922110 -0.403922E+02  0.868E-05    3.97       0.0  T
   2    -40.3922110 -0.521183E-10  0.571E-05    3.97     337.1  T
   3    -40.3922110 -0.969891E-10  0.200E-05    3.97     964.4  T

   *** convergence criteria satisfied after 3 iterations ***

         #    Occupation            Energy/Eh            Energy/eV
      -------------------------------------------------------------
         1        2.0000           -0.7251647             -19.7327
       ...           ...                  ...                  ...
        30        2.0000           -0.4493277             -12.2268
        31        2.0000           -0.4349575             -11.8358
        32        2.0000           -0.4345875             -11.8257
        33        2.0000           -0.4055603             -11.0359
        34        2.0000           -0.4017361             -10.9318
        35        2.0000           -0.3846929             -10.4680
        36        2.0000           -0.3846602             -10.4671 (HOMO)
        37                         -0.2388815              -6.5003 (LUMO)
        38                         -0.1965965              -5.3497
        39                         -0.1706029              -4.6423
        40                         -0.1086178              -2.9556
        41                          0.0047427               0.1291
       ...                                ...                  ...
        71                          0.6915745              18.8187
      -------------------------------------------------------------
                  HL-Gap            0.1457787 Eh            3.9668 eV
             Fermi-level           -0.3117708 Eh           -8.4837 eV

 SCC (total)                   0 d,  0 h,  0 min,  0.029 sec
 SCC setup                      ...        0 min,  0.000 sec (  0.648%)
 Dispersion                     ...        0 min,  0.000 sec (  0.733%)
 integral evaluation            ...        0 min,  0.009 sec ( 31.285%)
 zeroth order Hamiltonian       ...        0 min,  0.000 sec (  0.557%)
 iterations                     ...        0 min,  0.004 sec ( 13.901%)
 molecular gradient             ...        0 min,  0.015 sec ( 51.709%)
 printout                       ...        0 min,  0.000 sec (  0.992%)

         :::::::::::::::::::::::::::::::::::::::::::::::::::::
         ::                     SUMMARY                     ::
         :::::::::::::::::::::::::::::::::::::::::::::::::::::
         :: total energy             -39.919118178006 Eh    ::
         :: gradient norm              0.000401822817 Eh/a0 ::
         :: HOMO-LUMO gap              3.966839572467 eV    ::
         ::.................................................::
         :: SCC energy               -40.392210994717 Eh    ::
         :: -> isotropic ES            0.037437810681 Eh    ::
         :: -> anisotropic ES          0.003923003191 Eh    ::
         :: -> anisotropic XC          0.008976615562 Eh    ::
         :: -> dispersion             -0.025495411367 Eh    ::
         :: repulsion energy           0.472941861645 Eh    ::
         :: add. restraining           0.000000000000 Eh    ::
         :::::::::::::::::::::::::::::::::::::::::::::::::::::

           -------------------------------------------------
          |                Property Printout                |
           -------------------------------------------------

    * Orbital Energies and Occupations

         #    Occupation            Energy/Eh            Energy/eV
      -------------------------------------------------------------
         1        2.0000           -0.7251647             -19.7327
       ...           ...                  ...                  ...
        24        2.0000           -0.4797209             -13.0539
        25        2.0000           -0.4680795             -12.7371
        26        2.0000           -0.4664680             -12.6932
        27        2.0000           -0.4654700             -12.6661
        28        2.0000           -0.4611179             -12.5477
        29        2.0000           -0.4512134             -12.2781
        30        2.0000           -0.4493277             -12.2268
        31        2.0000           -0.4349575             -11.8358
        32        2.0000           -0.4345875             -11.8257
        33        2.0000           -0.4055603             -11.0359
        34        2.0000           -0.4017361             -10.9318
        35        2.0000           -0.3846929             -10.4680
        36        2.0000           -0.3846602             -10.4671 (HOMO)
        37                         -0.2388815              -6.5003 (LUMO)
        38                         -0.1965965              -5.3497
        39                         -0.1706029              -4.6423
        40                         -0.1086178              -2.9556
        41                          0.0047427               0.1291
        42                          0.0113390               0.3086
        43                          0.0338328               0.9206
        44                          0.0376040               1.0233
        45                          0.0491854               1.3384
        46                          0.0728461               1.9822
        47                          0.0774943               2.1087
       ...                                ...                  ...
        71                          0.6915745              18.8187
      -------------------------------------------------------------
                  HL-Gap            0.1457787 Eh            3.9668 eV
             Fermi-level           -0.3117708 Eh           -8.4837 eV

     #   Z        covCN         q      C6AA      α(0)
     1   6 C      2.941    -0.024    28.601     8.771
     2  16 S      2.309    -0.015   141.663    20.032
     3   6 C      2.941    -0.024    28.600     8.771
     4   6 C      3.174    -0.016    28.004     8.643
     5   6 C      3.174    -0.016    28.001     8.642
     6   6 C      3.752     0.120    18.682     6.164
     7   1 H      0.922     0.018     2.768     2.602
     8   8 O      1.701    -0.317    19.296     5.931
     9   6 C      3.645     0.043    20.183     6.457
    10   6 C      3.806    -0.067    21.773     6.643
    11   6 C      3.806    -0.067    21.773     6.643
    12   6 C      3.752     0.120    18.684     6.164
    13   1 H      0.922     0.018     2.770     2.603
    14   8 O      1.701    -0.317    19.297     5.931
    15   6 C      3.645     0.043    20.183     6.457
    16   1 H      0.927     0.057     2.239     2.340
    17   1 H      0.927     0.056     2.241     2.341
    18   1 H      0.925     0.058     2.217     2.328
    19   1 H      0.924     0.029     2.607     2.525
    20   1 H      0.924     0.027     2.629     2.535
    21   1 H      0.924     0.035     2.510     2.478
    22   1 H      0.924     0.044     2.390     2.418
    23   1 H      0.924     0.044     2.390     2.418
    24   1 H      0.924     0.035     2.511     2.478
    25   1 H      0.925     0.059     2.216     2.328
    26   1 H      0.924     0.029     2.607     2.525
    27   1 H      0.924     0.027     2.630     2.536

 Mol. C6AA /au·bohr⁶  :       8230.206648
 Mol. C8AA /au·bohr⁸  :     209365.986515
 Mol. α(0) /au        :        139.702609


Wiberg/Mayer (AO) data.
largest (>0.10) Wiberg bond orders for each atom
          total WBO             WBO to atom ...
     1  C   3.948        C    5 1.609    S    2 1.194    H   16 0.969    C    3 0.116
     2  S   2.636        C    3 1.194    C    1 1.194
     3  C   3.949        C    4 1.609    S    2 1.194    H   17 0.969    C    1 0.116
     4  C   3.983        C    3 1.609    C    5 1.224    C   12 0.986
     5  C   3.983        C    1 1.609    C    4 1.224    C    6 0.986
     6  C   3.955        C    5 0.986    C   10 0.981    O    8 0.972    H    7 0.945
     7  H   1.000        C    6 0.945
     8  O   2.076        C    9 0.998    C    6 0.972
     9  C   3.954        O    8 0.998    H   18 0.979    H   19 0.977    H   20 0.976
    10  C   3.997        C   11 1.008    C    6 0.981    H   22 0.976    H   21 0.975
    11  C   3.997        C   10 1.008    C   12 0.981    H   23 0.976    H   24 0.975
    12  C   3.955        C    4 0.986    C   11 0.981    O   14 0.971    H   13 0.945
    13  H   1.000        C   12 0.945
    14  O   2.076        C   15 0.998    C   12 0.971
    15  C   3.954        O   14 0.998    H   25 0.979    H   26 0.977    H   27 0.976
    16  H   0.996        C    1 0.969
    17  H   0.996        C    3 0.969
    18  H   0.996        C    9 0.979
    19  H   0.999        C    9 0.977
    20  H   0.999        C    9 0.976
    21  H   0.998        C   10 0.975
    22  H   0.998        C   10 0.976
    23  H   0.998        C   11 0.976
    24  H   0.998        C   11 0.975
    25  H   0.996        C   15 0.979
    26  H   0.999        C   15 0.977
    27  H   0.999        C   15 0.976

molecular dipole:
                 x           y           z       tot (Debye)
 q only:       -0.706       0.008       0.001
   full:       -1.384       0.015      -0.000       3.518
molecular quadrupole (traceless):
                xx          xy          yy          xz          yz          zz
 q only:        2.868       0.028       3.671       0.038       0.954      -6.538
  q+dip:        1.769       0.098       6.054      -0.004      -1.685      -7.823
   full:        1.139       0.114       6.299       0.009      -0.759      -7.438

           -------------------------------------------------
          |                Geometry Summary                 |
           -------------------------------------------------

      molecular mass/u    :      198.2794000
   center of mass at/Å    :       -0.4257957      -0.0057436      -0.0013514
  moments of inertia/u·Å² :        0.6053203E+03   0.8279900E+03   0.1393661E+04
rotational constants/cm⁻¹ :        0.2784911E-01   0.2035970E-01   0.1209593E-01

 * 26 selected distances

     #   Z        #   Z                                     value/Å
     1   6 C      2  16 S                                 1.7170482 (max)
     2  16 S      3   6 C                                 1.7168004
     3   6 C      4   6 C                                 1.3585472
     1   6 C      5   6 C                                 1.3584728
     4   6 C      5   6 C                                 1.4231371
     6   6 C      7   1 H                                 1.1076091
     6   6 C      8   8 O                                 1.4152505
     8   8 O      9   6 C                                 1.4039643
     6   6 C     10   6 C                                 1.5355403
    10   6 C     11   6 C                                 1.5242587
    11   6 C     12   6 C                                 1.5357229
    12   6 C     13   1 H                                 1.1075858
    12   6 C     14   8 O                                 1.4155255
    14   8 O     15   6 C                                 1.4038504
     1   6 C     16   1 H                                 1.0706028 (min)
     3   6 C     17   1 H                                 1.0706564
     9   6 C     18   1 H                                 1.0884846
     9   6 C     19   1 H                                 1.0957281
     9   6 C     20   1 H                                 1.0973504
    10   6 C     21   1 H                                 1.0915723
    10   6 C     22   1 H                                 1.0925882
    11   6 C     23   1 H                                 1.0927345
    11   6 C     24   1 H                                 1.0916876
    15   6 C     25   1 H                                 1.0884215
    15   6 C     26   1 H                                 1.0955463
    15   6 C     27   1 H                                 1.0972292

 * 4 distinct bonds (by element types)

   Z      Z             #   av. dist./Å        max./Å        min./Å
   1 H    6 C          14     1.0919855     1.1076091     1.0706028
   6 C    6 C           6     1.4559465     1.5357229     1.3584728
   6 C    8 O           4     1.4096477     1.4155255     1.4038504
   6 C   16 S           2     1.7169243     1.7170482     1.7168004


optimized geometry written to: xtbopt.xyz


           -------------------------------------------------
          | TOTAL ENERGY              -39.919118178006 Eh   |
          | GRADIENT NORM               0.000401822817 Eh/α |
          | HOMO-LUMO GAP               3.966839572467 eV   |
           -------------------------------------------------

------------------------------------------------------------------------
 * finished run on 2021/08/31 at 16:00:21.074     
------------------------------------------------------------------------
 total:
 * wall-time:     0 d,  0 h,  0 min,  1.128 sec
 *  cpu-time:     0 d,  0 h,  0 min,  0.669 sec
 * ratio c/w:     0.594 speedup
 SCF:
 * wall-time:     0 d,  0 h,  0 min,  0.111 sec
 *  cpu-time:     0 d,  0 h,  0 min,  0.042 sec
 * ratio c/w:     0.374 speedup
 ANC optimizer:
 * wall-time:     0 d,  0 h,  0 min,  0.606 sec
 *  cpu-time:     0 d,  0 h,  0 min,  0.605 sec
 * ratio c/w:     0.998 speedup

