      -----------------------------------------------------------      
     |                   =====================                   |     
     |                           x T B                           |     
     |                   =====================                   |     
     |                         S. Grimme                         |     
     |          Mulliken Center for Theoretical Chemistry        |     
     |                    University of Bonn                     |     
     |                Version 6.2 RC2 (SAW190805)                |     
      -----------------------------------------------------------      

   This program is distributed in the hope that it will be useful,
   but WITHOUT ANY WARRANTY; without even the implied warranty of
   MERCHANTABILITY or FITNESS FOR A PARTICULAR PURPOSE.
   
   FOR NON-COMMERCIAL, ACADEMIA USE ONLY.
   
   Cite this work as:
   * S. Grimme, C. Bannwarth, P. Shushkov, J. Chem. Theory Comput., 2017,
     13, 1989-2009. DOI: 10.1021/acs.jctc.7b00118
   * C. Bannwarth, S. Ehlert and S. Grimme., J. Chem. Theory Comput., 2019,
     15, 1652-1671. DOI: 10.1021/acs.jctc.8b01176
   * P. Pracht, E. Caldeweyher, S. Ehlert, S. Grimme, ChemRxiv, 2019, preprint.
     DOI: 10.26434/chemrxiv.8326202.v1
   
   for DFT-D4:
   * E. Caldeweyher, C. Bannwarth and S. Grimme, J. Chem. Phys., 2017,
     147, 034112. DOI: 10.1063/1.4993215
   * E. Caldeweyher, S. Ehlert, A. Hansen, H. Neugebauer, S. Spicher,
     C. Bannwarth and S. Grimme, J. Chem. Phys., 2019, 150, 154122.
     DOI: 10.1063/1.5090222
   
   for sTDA-xTB:
   * S. Grimme and C. Bannwarth, J. Chem. Phys., 2016, 145, 054103.
     DOI: 10.1063/1.4959605
   
   in the mass-spec context:
   * V. Asgeirsson, C. Bauer and S. Grimme, Chem. Sci., 2017, 8, 4879.
     DOI: 10.1039/c7sc00601b
   
   for metadynamics refer to:
   * S. Grimme, J. Chem. Theory Comput., 2019, 155, 2847-2862
     DOI: 10.1021/acs.jctc.9b00143
   
   with help from (in alphabetical order)
   C. Bannwarth, F. Bohle, G. Brandenburg, E. Caldeweyher, M. Checinski,
   S. Dohm, S. Ehlert, S. Ehrlich, F. März, H. Neugebauer, J. Pisarek,
   P. Pracht, P. Shushkov, and S. Spicher.
   
 * started run on 2021/05/19 at 11:00:15.438     

           -------------------------------------------------
          |                Calculation Setup                |
           -------------------------------------------------

          program call               : /ihome/ghutchison/geoffh/xtb/xtb 721.xyz -opt
          hostname                   : smp-n83
          coordinate file            : 721.xyz
          omp threads                :                     1
          number of atoms            :                    24
          number of electrons        :                    88
          charge                     :                     0
          spin                       :                   0.0
          first test random number   :      0.02129734950619


########################################################################
# WARNING! Please study the warnings concerning your input carefully
#  - the use of '-opt' is discouraged, please use '--opt' next time
########################################################################

           ------------------------------------------------- 
          |                 G F N 2 - x T B                 |
          | Geometry, Frequencies, Noncovalent interactions |
          |            JCTC 2019 parametrisation            |
           ------------------------------------------------- 
             KAB for C  - Si     :                1.0500
             KAB for H  - Pd     :                0.9500
             k(s)              :                1.8500
             k(p)              :                2.2300
             k(d)              :                2.2300
             k(f)              :                2.0000
             kEN (H0ij)        :               -2.0000
             D4 a1             :                0.5200
             D4 a2             :                5.0000
             D4 s6             :                1.0000
             D4 s8             :                2.7000
             D4 s9             :                5.0000
             alphaj            :                2.0000

  Z AO/shell   Hii/eV     exponent
  1     Wed Apr 25 08:07:45 CEST 2018   EN: 2.200 GM2: 0.406  GM3: 0.0800  RAES: 1.40
     1s    -10.707211    1.230000
  6     Wed Apr 25 08:07:45 CEST 2018   EN: 2.550 GM2: 0.538  GM3: 0.1500  RAES: 3.00
     2s    -13.970922    2.096432
     2p    -10.063292    1.800000
  8     Wed Apr 25 08:07:45 CEST 2018   EN: 3.440 GM2: 0.452  GM3:-0.0517  RAES: 1.80
     2s    -20.229985    2.439742
     2p    -15.503117    2.137023
  9     Mon Apr 23 13:58:50 CEST 2018   EN: 3.980 GM2: 0.532  GM3: 0.1426  RAES: 2.40
     2s    -23.458179    2.416361
     2p    -15.746583    2.308399
 16     Tue Apr 24 11:44:34 CEST 2018   EN: 2.580 GM2: 0.340  GM3:-0.0502  RAES: 3.10
     3s    -20.029654    1.981333
     3p    -11.377694    2.025643
     3d     -0.420282    1.702555

           ------------------------------------------------- 
          |        Self-Consistent Charge Iterations        |
           ------------------------------------------------- 

          ...................................................
          :                      SETUP                      :
          :.................................................:
          :  # basis functions                  81          :
          :  # atomic orbitals                  80          :
          :  # shells                           42          :
          :  # electrons                        88          :
          :  max. iterations                   250          :
          :  Hamiltonian                  GFN2-xTB          :
          :  restarted?                      false          :
          :  GBSA solvation                  false          :
          :  PC potential                    false          :
          :  electronic temp.          300.0000000     K    :
          :  accuracy                    1.0000000          :
          :  -> integral cutoff          0.2500000E+02      :
          :  -> integral neglect         0.1000000E-07      :
          :  -> SCF convergence          0.1000000E-05 Eh   :
          :  -> wf. convergence          0.1000000E-03 e    :
          :  Broyden damping             0.4000000          :
          ...................................................

 iter      E             dE          RMSdq      gap      omega  full diag
   1    -51.1742512 -0.511743E+02  0.511E+00    1.82       0.0  T
   2    -51.2417267 -0.674755E-01  0.288E+00    1.58       1.0  T
   3    -51.2340377  0.768898E-02  0.156E+00    1.67       1.0  T
   4    -51.2418711 -0.783343E-02  0.708E-01    1.41       1.0  T
   5    -51.2521447 -0.102735E-01  0.231E-01    1.48       1.0  T
   6    -51.2530677 -0.923067E-03  0.840E-02    1.49       1.0  T
   7    -51.2531258 -0.580963E-04  0.374E-02    1.50       1.0  T
   8    -51.2531442 -0.184076E-04  0.137E-02    1.49       1.5  T
   9    -51.2531451 -0.891820E-06  0.610E-03    1.49       3.3  T
  10    -51.2531453 -0.189035E-06  0.292E-03    1.49       7.0  T
  11    -51.2531454 -0.817021E-07  0.114E-03    1.49      17.9  T
  12    -51.2531454 -0.111018E-07  0.611E-04    1.49      33.4  T
  13    -51.2531454 -0.218031E-08  0.293E-04    1.49      69.8  T

   *** convergence criteria satisfied after 13 iterations ***

         #    Occupation            Energy/Eh            Energy/eV
      -------------------------------------------------------------
         1        2.0000           -0.8831295             -24.0312
       ...           ...                  ...                  ...
        38        2.0000           -0.4654944             -12.6667
        39        2.0000           -0.4614007             -12.5554
        40        2.0000           -0.4541010             -12.3567
        41        2.0000           -0.4381528             -11.9227
        42        2.0000           -0.4345158             -11.8238
        43        2.0000           -0.4258422             -11.5878
        44        2.0000           -0.3848758             -10.4730 (HOMO)
        45                         -0.3299525              -8.9785 (LUMO)
        46                         -0.3042518              -8.2791
        47                         -0.2486023              -6.7648
        48                         -0.2269320              -6.1751
        49                         -0.2202737              -5.9940
       ...                                ...                  ...
        80                          0.7136109              19.4183
      -------------------------------------------------------------
                  HL-Gap            0.0549234 Eh            1.4945 eV
             Fermi-level           -0.3574141 Eh           -9.7257 eV

 SCC (total)                   0 d,  0 h,  0 min,  0.063 sec
 SCC setup                      ...        0 min,  0.000 sec (  0.535%)
 Dispersion                     ...        0 min,  0.000 sec (  0.654%)
 integral evaluation            ...        0 min,  0.013 sec ( 20.916%)
 zeroth order Hamiltonian       ...        0 min,  0.000 sec (  0.324%)
 iterations                     ...        0 min,  0.032 sec ( 50.450%)
 molecular gradient             ...        0 min,  0.017 sec ( 26.385%)
 printout                       ...        0 min,  0.000 sec (  0.649%)

         :::::::::::::::::::::::::::::::::::::::::::::::::::::
         ::                     SUMMARY                     ::
         :::::::::::::::::::::::::::::::::::::::::::::::::::::
         :: total energy             -50.703231975498 Eh    ::
         :: gradient norm              0.122263596904 Eh/a0 ::
         :: HOMO-LUMO gap              1.494540946546 eV    ::
         ::.................................................::
         :: SCC energy               -51.253145425121 Eh    ::
         :: -> isotropic ES            0.064579501725 Eh    ::
         :: -> anisotropic ES          0.000924807044 Eh    ::
         :: -> anisotropic XC         -0.001363989455 Eh    ::
         :: -> dispersion             -0.026686434663 Eh    ::
         :: repulsion energy           0.549972418946 Eh    ::
         :: add. restraining           0.000000000000 Eh    ::
         :::::::::::::::::::::::::::::::::::::::::::::::::::::

      ----------------------------------------------------------- 
     |                   =====================                   |
     |                        A N C O P T                        |
     |                   =====================                   |
     |               Approximate Normal Coordinate               |
     |                Rational Function Optimizer                |
      ----------------------------------------------------------- 

          ...................................................
          :                      SETUP                      :
          :.................................................:
          :   optimization level            normal          :
          :   max. optcycles                   200          :
          :   ANC micro-cycles                  20          :
          :   degrees of freedom                66          :
          :.................................................:
          :   RF solver                   davidson          :
          :   input Hessian                  false          :
          :   write xtbopt.log                true          :
          :   linear?                        false          :
          :   energy convergence         0.5000000E-05 Eh   :
          :   grad. convergence          0.1000000E-02 Eh/α :
          :   maximium RF displ.         2.0000000          :
          :   Hlow (freq-cutoff)         0.5000000E-02      :
          :   Hmax (freq-cutoff)         5.0000000          :
          :   S6 in model hess.         20.0000000          :
          ...................................................

generating ANC from model Hessian ...
Using Lindh-Hessian (1995)
 Shifting diagonal of input Hessian by   4.211802021425228E-003
 Lowest  eigenvalues of input Hessian
   -0.000000   -0.000000    0.000000    0.000000    0.000000    0.000000
    0.005000    0.006310    0.007313    0.008518    0.009331    0.012523
    0.013196    0.014943    0.019921    0.021874    0.025808    0.027340
 Highest eigenvalues
    1.692753    1.783391    1.924328    1.972556    2.049482    2.080554
 

........................................................................
.............................. CYCLE    1 ..............................
........................................................................
   1    -51.2531454 -0.512531E+02  0.133E-04    1.49       0.0  T
   2    -51.2531454 -0.287699E-10  0.858E-05    1.49     238.0  T
   3    -51.2531454 -0.293099E-10  0.643E-05    1.49     317.2  T
     SCC iter.                  ...        0 min,  0.005 sec
     gradient                   ...        0 min,  0.016 sec
 * total energy  :   -50.7032320 Eh     change       -0.7022571E-08 Eh
   gradient norm :     0.1222639 Eh/α   predicted     0.0000000E+00 (-100.00%)
   displ. norm   :     0.3031016 α      lambda       -0.2078328E-01
   maximum displ.:     0.1269615 α      in ANC's #28, #27, #29, ...

........................................................................
.............................. CYCLE    2 ..............................
........................................................................
   1    -51.2956193 -0.512956E+02  0.319E-01    1.63       0.0  T
   2    -51.2957366 -0.117302E-03  0.190E-01    1.58       1.0  T
   3    -51.2955336  0.202970E-03  0.125E-01    1.60       1.0  T
   4    -51.2958390 -0.305422E-03  0.452E-02    1.60       1.0  T
   5    -51.2958650 -0.259761E-04  0.226E-02    1.59       1.0  T
   6    -51.2958713 -0.628871E-05  0.895E-03    1.59       2.3  T
   7    -51.2958727 -0.137943E-05  0.260E-03    1.59       7.9  T
   8    -51.2958728 -0.913809E-07  0.105E-03    1.59      19.4  T
     SCC iter.                  ...        0 min,  0.010 sec
     gradient                   ...        0 min,  0.015 sec
 * total energy  :   -50.7177829 Eh     change       -0.1455093E-01 Eh
   gradient norm :     0.0583076 Eh/α   predicted    -0.1134632E-01 ( -22.02%)
   displ. norm   :     0.2458603 α      lambda       -0.6652290E-02
   maximum displ.:     0.1220560 α      in ANC's #4, #28, #27, ...

........................................................................
.............................. CYCLE    3 ..............................
........................................................................
   1    -51.3150111 -0.513150E+02  0.243E-01    1.68       0.0  T
   2    -51.3150559 -0.447996E-04  0.147E-01    1.66       1.0  T
   3    -51.3149523  0.103578E-03  0.827E-02    1.68       1.0  T
   4    -51.3150879 -0.135594E-03  0.192E-02    1.67       1.1  T
   5    -51.3150934 -0.550591E-05  0.864E-03    1.67       2.4  T
   6    -51.3150944 -0.100383E-05  0.523E-03    1.67       3.9  T
   7    -51.3150948 -0.447451E-06  0.160E-03    1.67      12.8  T
     SCC iter.                  ...        0 min,  0.009 sec
     gradient                   ...        0 min,  0.015 sec
 * total energy  :   -50.7214854 Eh     change       -0.3702492E-02 Eh
   gradient norm :     0.0147528 Eh/α   predicted    -0.3527207E-02 (  -4.73%)
   displ. norm   :     0.1997232 α      lambda       -0.7579545E-03
   maximum displ.:     0.1541823 α      in ANC's #4, #3, #6, ...

........................................................................
.............................. CYCLE    4 ..............................
........................................................................
   1    -51.3129417 -0.513129E+02  0.134E-01    1.67       0.0  T
   2    -51.3129435 -0.175777E-05  0.789E-02    1.67       1.0  T
   3    -51.3128710  0.725038E-04  0.595E-02    1.67       1.0  T
   4    -51.3129505 -0.795316E-04  0.118E-02    1.67       1.7  T
   5    -51.3129523 -0.180543E-05  0.564E-03    1.67       3.6  T
   6    -51.3129527 -0.373359E-06  0.161E-03    1.67      12.7  T
   7    -51.3129527 -0.188865E-07  0.786E-04    1.67      26.0  T
     SCC iter.                  ...        0 min,  0.009 sec
     gradient                   ...        0 min,  0.016 sec
 * total energy  :   -50.7220574 Eh     change       -0.5719689E-03 Eh
   gradient norm :     0.0072754 Eh/α   predicted    -0.3940981E-03 ( -31.10%)
   displ. norm   :     0.2834610 α      lambda       -0.6407988E-03
   maximum displ.:     0.2028601 α      in ANC's #4, #3, #2, ...

........................................................................
.............................. CYCLE    5 ..............................
........................................................................
   1    -51.3102817 -0.513103E+02  0.183E-01    1.66       0.0  T
   2    -51.3102833 -0.168609E-05  0.110E-01    1.67       1.0  T
   3    -51.3101328  0.150558E-03  0.834E-02    1.67       1.0  T
   4    -51.3102966 -0.163855E-03  0.128E-02    1.67       1.6  T
   5    -51.3102990 -0.233396E-05  0.576E-03    1.67       3.5  T
   6    -51.3102993 -0.336595E-06  0.221E-03    1.67       9.2  T
   7    -51.3102993 -0.322624E-07  0.942E-04    1.67      21.7  T
     SCC iter.                  ...        0 min,  0.009 sec
     gradient                   ...        0 min,  0.015 sec
 * total energy  :   -50.7225135 Eh     change       -0.4560804E-03 Eh
   gradient norm :     0.0083371 Eh/α   predicted    -0.3461523E-03 ( -24.10%)
   displ. norm   :     0.3008437 α      lambda       -0.4730764E-03
   maximum displ.:     0.1968758 α      in ANC's #4, #3, #2, ...

........................................................................
.............................. CYCLE    6 ..............................
........................................................................
   1    -51.3091688 -0.513092E+02  0.185E-01    1.66       0.0  T
   2    -51.3091717 -0.288710E-05  0.109E-01    1.66       1.0  T
   3    -51.3090458  0.125884E-03  0.758E-02    1.66       1.0  T
   4    -51.3091824 -0.136558E-03  0.116E-02    1.66       1.8  T
   5    -51.3091834 -0.949754E-06  0.634E-03    1.66       3.2  T
   6    -51.3091838 -0.446728E-06  0.225E-03    1.66       9.1  T
   7    -51.3091839 -0.619729E-07  0.961E-04    1.66      21.2  T
     SCC iter.                  ...        0 min,  0.009 sec
     gradient                   ...        0 min,  0.015 sec
 * total energy  :   -50.7228501 Eh     change       -0.3366016E-03 Eh
   gradient norm :     0.0118549 Eh/α   predicted    -0.2579481E-03 ( -23.37%)
   displ. norm   :     0.3812951 α      lambda       -0.5724172E-03
   maximum displ.:     0.2353729 α      in ANC's #4, #3, #2, ...

........................................................................
.............................. CYCLE    7 ..............................
........................................................................
   1    -51.3087906 -0.513088E+02  0.237E-01    1.64       0.0  T
   2    -51.3087966 -0.601211E-05  0.140E-01    1.64       1.0  T
   3    -51.3086360  0.160534E-03  0.860E-02    1.65       1.0  T
   4    -51.3088100 -0.174011E-03  0.130E-02    1.64       1.6  T
   5    -51.3088107 -0.684566E-06  0.761E-03    1.64       2.7  T
   6    -51.3088115 -0.763205E-06  0.276E-03    1.64       7.4  T
   7    -51.3088116 -0.819655E-07  0.129E-03    1.64      15.9  T
     SCC iter.                  ...        0 min,  0.009 sec
     gradient                   ...        0 min,  0.015 sec
 * total energy  :   -50.7232452 Eh     change       -0.3951537E-03 Eh
   gradient norm :     0.0127517 Eh/α   predicted    -0.3278198E-03 ( -17.04%)
   displ. norm   :     0.3271842 α      lambda       -0.5281944E-03
   maximum displ.:     0.1969364 α      in ANC's #3, #4, #2, ...

........................................................................
.............................. CYCLE    8 ..............................
........................................................................
   1    -51.3116704 -0.513117E+02  0.191E-01    1.63       0.0  T
   2    -51.3116753 -0.492111E-05  0.114E-01    1.63       1.0  T
   3    -51.3116532  0.220775E-04  0.356E-02    1.63       1.0  T
   4    -51.3116791 -0.258307E-04  0.911E-03    1.63       2.2  T
   5    -51.3116794 -0.293453E-06  0.590E-03    1.63       3.5  T
   6    -51.3116799 -0.530443E-06  0.192E-03    1.63      10.6  T
   7    -51.3116799 -0.298810E-07  0.106E-03    1.63      19.2  T
     SCC iter.                  ...        0 min,  0.009 sec
     gradient                   ...        0 min,  0.015 sec
 * total energy  :   -50.7236310 Eh     change       -0.3858186E-03 Eh
   gradient norm :     0.0084658 Eh/α   predicted    -0.2923711E-03 ( -24.22%)
   displ. norm   :     0.3721873 α      lambda       -0.4213390E-03
   maximum displ.:     0.2457735 α      in ANC's #3, #4, #2, ...

........................................................................
.............................. CYCLE    9 ..............................
........................................................................
   1    -51.3122591 -0.513123E+02  0.213E-01    1.61       0.0  T
   2    -51.3122672 -0.810419E-05  0.127E-01    1.62       1.0  T
   3    -51.3122483  0.188183E-04  0.344E-02    1.62       1.0  T
   4    -51.3122701 -0.217959E-04  0.109E-02    1.61       1.9  T
   5    -51.3122718 -0.168494E-05  0.540E-03    1.62       3.8  T
   6    -51.3122719 -0.112890E-06  0.335E-03    1.62       6.1  T
   7    -51.3122721 -0.158660E-06  0.906E-04    1.62      22.5  T
   8    -51.3122721 -0.492493E-08  0.413E-04    1.62      49.4  T
     SCC iter.                  ...        0 min,  0.010 sec
     gradient                   ...        0 min,  0.015 sec
 * total energy  :   -50.7239118 Eh     change       -0.2807584E-03 Eh
   gradient norm :     0.0072066 Eh/α   predicted    -0.2398637E-03 ( -14.57%)
   displ. norm   :     0.2417220 α      lambda       -0.3267223E-03
   maximum displ.:     0.1700446 α      in ANC's #3, #2, #4, ...

........................................................................
.............................. CYCLE   10 ..............................
........................................................................
   1    -51.3178639 -0.513179E+02  0.145E-01    1.62       0.0  T
   2    -51.3178710 -0.713221E-05  0.874E-02    1.62       1.0  T
   3    -51.3178593  0.116845E-04  0.283E-02    1.62       1.0  T
   4    -51.3178736 -0.142319E-04  0.774E-03    1.62       2.6  T
   5    -51.3178742 -0.645077E-06  0.396E-03    1.62       5.2  T
   6    -51.3178742  0.691647E-08  0.297E-03    1.62       6.9  T
   7    -51.3178744 -0.165970E-06  0.801E-04    1.62      25.5  T
     SCC iter.                  ...        0 min,  0.010 sec
     gradient                   ...        0 min,  0.015 sec
 * total energy  :   -50.7240101 Eh     change       -0.9833533E-04 Eh
   gradient norm :     0.0087083 Eh/α   predicted    -0.1729064E-03 (  75.83%)
   displ. norm   :     0.3897314 α      lambda       -0.3183926E-03
   maximum displ.:     0.2631474 α      in ANC's #3, #4, #2, ...

........................................................................
.............................. CYCLE   11 ..............................
........................................................................
   1    -51.3111419 -0.513111E+02  0.219E-01    1.59       0.0  T
   2    -51.3111513 -0.939875E-05  0.130E-01    1.60       1.0  T
   3    -51.3111354  0.158988E-04  0.326E-02    1.60       1.0  T
   4    -51.3111563 -0.208956E-04  0.910E-03    1.60       2.2  T
   5    -51.3111564 -0.156324E-06  0.623E-03    1.60       3.3  T
   6    -51.3111569 -0.477077E-06  0.329E-03    1.60       6.2  T
   7    -51.3111571 -0.141533E-06  0.123E-03    1.60      16.6  T
   8    -51.3111571 -0.874640E-08  0.615E-04    1.60      33.2  T
     SCC iter.                  ...        0 min,  0.011 sec
     gradient                   ...        0 min,  0.015 sec
 * total energy  :   -50.7240914 Eh     change       -0.8130794E-04 Eh
   gradient norm :     0.0101996 Eh/α   predicted    -0.1833769E-03 ( 125.53%)
   displ. norm   :     0.1140142 α      lambda       -0.1745697E-03
   maximum displ.:     0.0673513 α      in ANC's #4, #3, #2, ...

........................................................................
.............................. CYCLE   12 ..............................
........................................................................
   1    -51.3143844 -0.513144E+02  0.720E-02    1.62       0.0  T
   2    -51.3143856 -0.118688E-05  0.424E-02    1.61       1.0  T
   3    -51.3143796  0.598576E-05  0.184E-02    1.62       1.1  T
   4    -51.3143860 -0.633808E-05  0.582E-03    1.62       3.5  T
   5    -51.3143864 -0.478429E-06  0.260E-03    1.62       7.8  T
   6    -51.3143865 -0.731487E-07  0.916E-04    1.62      22.3  T
     SCC iter.                  ...        0 min,  0.008 sec
     gradient                   ...        0 min,  0.015 sec
 * total energy  :   -50.7241675 Eh     change       -0.7611986E-04 Eh
   gradient norm :     0.0040651 Eh/α   predicted    -0.8842143E-04 (  16.16%)
   displ. norm   :     0.0816814 α      lambda       -0.6065224E-04
   maximum displ.:     0.0600248 α      in ANC's #3, #2, #4, ...

........................................................................
.............................. CYCLE   13 ..............................
........................................................................
   1    -51.3142785 -0.513143E+02  0.582E-02    1.61       0.0  T
   2    -51.3142788 -0.318309E-06  0.353E-02    1.61       1.0  T
   3    -51.3142611  0.177489E-04  0.288E-02    1.62       1.0  T
   4    -51.3142803 -0.192362E-04  0.289E-03    1.61       7.1  T
   5    -51.3142804 -0.612126E-07  0.145E-03    1.61      14.1  T
   6    -51.3142804 -0.641744E-08  0.753E-04    1.61      27.1  T
     SCC iter.                  ...        0 min,  0.008 sec
     gradient                   ...        0 min,  0.015 sec
 * total energy  :   -50.7241829 Eh     change       -0.1539323E-04 Eh
   gradient norm :     0.0059856 Eh/α   predicted    -0.3052944E-04 (  98.33%)
   displ. norm   :     0.1156438 α      lambda       -0.5495987E-04
   maximum displ.:     0.0832378 α      in ANC's #3, #4, #2, ...

........................................................................
.............................. CYCLE   14 ..............................
........................................................................
   1    -51.3143299 -0.513143E+02  0.658E-02    1.62       0.0  T
   2    -51.3143307 -0.884144E-06  0.389E-02    1.62       1.0  T
   3    -51.3143289  0.186861E-05  0.119E-02    1.62       1.7  T
   4    -51.3143312 -0.231362E-05  0.376E-03    1.62       5.4  T
   5    -51.3143312 -0.152737E-07  0.243E-03    1.62       8.4  T
   6    -51.3143313 -0.927478E-07  0.963E-04    1.62      21.2  T
     SCC iter.                  ...        0 min,  0.008 sec
     gradient                   ...        0 min,  0.015 sec
 * total energy  :   -50.7242175 Eh     change       -0.3452159E-04 Eh
   gradient norm :     0.0019820 Eh/α   predicted    -0.2784789E-04 ( -19.33%)
   displ. norm   :     0.2364798 α      lambda       -0.2436246E-04
   maximum displ.:     0.1656843 α      in ANC's #3, #2, #4, ...

........................................................................
.............................. CYCLE   15 ..............................
........................................................................
   1    -51.3127527 -0.513128E+02  0.137E-01    1.61       0.0  T
   2    -51.3127568 -0.416245E-05  0.817E-02    1.61       1.0  T
   3    -51.3127428  0.140204E-04  0.268E-02    1.61       1.0  T
   4    -51.3127586 -0.158268E-04  0.868E-03    1.61       2.4  T
   5    -51.3127594 -0.766383E-06  0.460E-03    1.61       4.4  T
   6    -51.3127597 -0.262949E-06  0.185E-03    1.61      11.1  T
   7    -51.3127597 -0.280144E-07  0.814E-04    1.61      25.1  T
   8    -51.3127597 -0.400021E-08  0.381E-04    1.61      53.6  T
     SCC iter.                  ...        0 min,  0.010 sec
     gradient                   ...        0 min,  0.016 sec
 * total energy  :   -50.7242135 Eh     change        0.3935583E-05 Eh
   gradient norm :     0.0060661 Eh/α   predicted    -0.1248519E-04 (-417.24%)
   displ. norm   :     0.0248454 α      lambda       -0.3503683E-04
   maximum displ.:     0.0141562 α      in ANC's #4, #2, #3, ...

........................................................................
.............................. CYCLE   16 ..............................
........................................................................
   1    -51.3142891 -0.513143E+02  0.195E-02    1.62       0.0  T
   2    -51.3142902 -0.108574E-05  0.118E-02    1.62       1.7  T
   3    -51.3142895  0.710693E-06  0.891E-03    1.62       2.3  T
   4    -51.3142904 -0.927161E-06  0.398E-03    1.62       5.1  T
   5    -51.3142907 -0.276295E-06  0.121E-03    1.62      16.9  T
   6    -51.3142907 -0.262306E-07  0.474E-04    1.62      43.0  T
     SCC iter.                  ...        0 min,  0.008 sec
     gradient                   ...        0 min,  0.016 sec
 * total energy  :   -50.7242335 Eh     change       -0.1995266E-04 Eh
   gradient norm :     0.0017299 Eh/α   predicted    -0.1753590E-04 ( -12.11%)
   displ. norm   :     0.0558295 α      lambda       -0.1062049E-04
   maximum displ.:     0.0343492 α      in ANC's #3, #4, #5, ...

........................................................................
.............................. CYCLE   17 ..............................
........................................................................
   1    -51.3154050 -0.513154E+02  0.317E-02    1.61       0.0  T
   2    -51.3154060 -0.980591E-06  0.191E-02    1.62       1.1  T
   3    -51.3154046  0.137990E-05  0.905E-03    1.62       2.3  T
   4    -51.3154059 -0.127128E-05  0.437E-03    1.62       4.7  T
   5    -51.3154063 -0.428589E-06  0.879E-04    1.62      23.2  T
   6    -51.3154063 -0.669891E-08  0.452E-04    1.62      45.2  T
     SCC iter.                  ...        0 min,  0.008 sec
     gradient                   ...        0 min,  0.017 sec
 * total energy  :   -50.7242273 Eh     change        0.6139509E-05 Eh
   gradient norm :     0.0035335 Eh/α   predicted    -0.5320568E-05 (-186.66%)
   displ. norm   :     0.0276323 α      lambda       -0.1477511E-04
   maximum displ.:     0.0161896 α      in ANC's #3, #4, #2, ...

........................................................................
.............................. CYCLE   18 ..............................
........................................................................
   1    -51.3149884 -0.513150E+02  0.167E-02    1.62       0.0  T
   2    -51.3149888 -0.389551E-06  0.100E-02    1.62       2.0  T
   3    -51.3149883  0.506660E-06  0.585E-03    1.62       3.5  T
   4    -51.3149888 -0.470492E-06  0.270E-03    1.62       7.6  T
   5    -51.3149889 -0.162488E-06  0.642E-04    1.62      31.8  T
   6    -51.3149889 -0.508911E-08  0.323E-04    1.62      63.2  T
     SCC iter.                  ...        0 min,  0.008 sec
     gradient                   ...        0 min,  0.017 sec
 * total energy  :   -50.7242369 Eh     change       -0.9556685E-05 Eh
   gradient norm :     0.0014697 Eh/α   predicted    -0.7394131E-05 ( -22.63%)
   displ. norm   :     0.0413805 α      lambda        0.2113316E-05
   maximum displ.:     0.0242850 α      in ANC's #3, #4, #2, ...

........................................................................
.............................. CYCLE   19 ..............................
........................................................................
   1    -51.3143121 -0.513143E+02  0.249E-02    1.62       0.0  T
   2    -51.3143130 -0.876376E-06  0.150E-02    1.62       1.4  T
   3    -51.3143118  0.114820E-05  0.875E-03    1.62       2.3  T
   4    -51.3143129 -0.104614E-05  0.412E-03    1.62       5.0  T
   5    -51.3143133 -0.379965E-06  0.900E-04    1.62      22.7  T
   6    -51.3143133 -0.926563E-08  0.472E-04    1.62      43.3  T
     SCC iter.                  ...        0 min,  0.008 sec
     gradient                   ...        0 min,  0.017 sec
 * total energy  :   -50.7242312 Eh     change        0.5721660E-05 Eh
   gradient norm :     0.0032866 Eh/α   predicted     0.1052792E-05 ( -81.60%)
   displ. norm   :     0.0136461 α      lambda       -0.1155802E-04
   maximum displ.:     0.0088988 α      in ANC's #5, #4, #3, ...

........................................................................
.............................. CYCLE   20 ..............................
........................................................................
   1    -51.3145957 -0.513146E+02  0.120E-02    1.62       0.0  T
   2    -51.3145961 -0.305942E-06  0.707E-03    1.62       2.9  T
   3    -51.3145959  0.152745E-06  0.413E-03    1.62       4.9  T
   4    -51.3145961 -0.164169E-06  0.180E-03    1.62      11.3  T
   5    -51.3145961 -0.626495E-07  0.743E-04    1.62      27.5  T
   6    -51.3145961 -0.889630E-08  0.324E-04    1.62      63.0  T
     SCC iter.                  ...        0 min,  0.009 sec
     gradient                   ...        0 min,  0.016 sec
 * total energy  :   -50.7242382 Eh     change       -0.7063442E-05 Eh
   gradient norm :     0.0007653 Eh/α   predicted    -0.5780682E-05 ( -18.16%)
   displ. norm   :     0.0190886 α      lambda       -0.2982976E-05
   maximum displ.:     0.0104193 α      in ANC's #5, #4, #3, ...
 * RMSD in coord.:     0.5938208 α      energy gain  -0.2100626E-01 Eh

generating ANC from model Hessian ...
Using Lindh-Hessian (1995)
 Shifting diagonal of input Hessian by   4.150454181385709E-003
 Lowest  eigenvalues of input Hessian
   -0.000000   -0.000000   -0.000000    0.000000    0.000000    0.000000
    0.005000    0.006447    0.007779    0.008020    0.010091    0.013440
    0.013593    0.015959    0.021604    0.022593    0.027669    0.027768
 Highest eigenvalues
    1.768370    1.885556    1.933300    2.019248    2.108637    2.226510
 

........................................................................
.............................. CYCLE   21 ..............................
........................................................................
   1    -51.3148266 -0.513148E+02  0.131E-02    1.62       0.0  T
   2    -51.3148268 -0.168296E-06  0.785E-03    1.62       2.6  T
   3    -51.3148264  0.383768E-06  0.472E-03    1.62       4.3  T
   4    -51.3148268 -0.394370E-06  0.190E-03    1.62      10.8  T
   5    -51.3148269 -0.701603E-07  0.575E-04    1.62      35.5  T
   6    -51.3148269 -0.238524E-08  0.290E-04    1.62      70.3  T
     SCC iter.                  ...        0 min,  0.008 sec
     gradient                   ...        0 min,  0.016 sec
 * total energy  :   -50.7242393 Eh     change       -0.1088058E-05 Eh
   gradient norm :     0.0010858 Eh/α   predicted     0.0000000E+00 (-100.00%)
   displ. norm   :     0.0022036 α      lambda       -0.6305007E-06
   maximum displ.:     0.0014839 α      in ANC's #1, #66, #52, ...

........................................................................
.............................. CYCLE   22 ..............................
........................................................................
   1    -51.3148950 -0.513149E+02  0.429E-03    1.62       0.0  T
   2    -51.3148952 -0.196590E-06  0.278E-03    1.62       7.3  T
   3    -51.3148953 -0.567502E-07  0.190E-03    1.62      10.8  T
   4    -51.3148953 -0.324767E-07  0.109E-03    1.62      18.7  T
   5    -51.3148953 -0.906095E-08  0.351E-04    1.62      58.2  T
   6    -51.3148953 -0.197256E-08  0.137E-04    1.62     148.9  T
     SCC iter.                  ...        0 min,  0.008 sec
     gradient                   ...        0 min,  0.016 sec
 * total energy  :   -50.7242398 Eh     change       -0.4432061E-06 Eh
   gradient norm :     0.0009937 Eh/α   predicted    -0.3176757E-06 ( -28.32%)
   displ. norm   :     0.0026242 α      lambda        0.3130610E-05
   maximum displ.:     0.0020572 α      in ANC's #1, #66, #52, ...

   *** GEOMETRY OPTIMIZATION CONVERGED AFTER 22 ITERATIONS ***

------------------------------------------------------------------------
 total energy gain   :        -0.0210078 Eh      -13.1826 kcal/mol
 total RMSD          :         0.5938358 a0        0.3142 Å
 total power (kW/mol):        -2.5070888 (step)  -64.7152 (real)
------------------------------------------------------------------------

 ANCopt (total)                0 d,  0 h,  0 min,  0.852 sec
 optimizer setup                ...        0 min,  0.000 sec (  0.018%)
 model hessian                  ...        0 min,  0.006 sec (  0.729%)
 ANC generation                 ...        0 min,  0.001 sec (  0.159%)
 coordinate transformation      ...        0 min,  0.000 sec (  0.050%)
 single point calculation       ...        0 min,  0.835 sec ( 97.954%)
 optimization log               ...        0 min,  0.002 sec (  0.257%)
 hessian update                 ...        0 min,  0.000 sec (  0.035%)
 rational function              ...        0 min,  0.005 sec (  0.633%)

================
 final structure:
================
$coord
   -3.02713190276081    2.31029790709825    0.12960470134551      C 
   -5.26848297916017    0.01752708094265    0.17949986397805      S 
   -3.05309541219299   -2.39749542879075    0.06338556866961      C 
   -0.62287101686323   -1.40271806376984   -0.01313971484933      C 
   -0.61125297927205    1.31820132222792    0.02698378053620      C 
    1.69121398464538    2.63115384155650   -0.03519334190771      C 
    3.94050439072964    1.31118297227368   -0.14643331700127      C 
    6.24748993930038    2.81711318706346   -0.20941231902554      C 
    6.34376919784813    5.09343214996386   -0.09653193537556      O 
    8.78718671574487    1.34699448580076   -0.45247627667764      C 
    8.87499623833100   -0.08774783196059   -2.54914083703197      F 
   10.74511291111395    2.92181977300591   -0.56011147809065      F 
    9.19629350553111   -0.20930507141840    1.51548312789705      F 
    3.92326167668822   -1.38453633228759   -0.19296522918182      C 
    1.71522859060833   -2.69665002345915   -0.12454026521977      C 
   -3.78642765566233   -5.00556375567831    0.06040586708674      C 
   -6.16107157518185   -5.83767777045708    0.10748343543335      C 
   -3.56089848409808    4.26311523393831    0.17790781727452      H 
    1.72222881214353    4.67064868779462   -0.00188763127960      H 
    5.67588498150772   -2.41490298778776   -0.27870113834266      H 
    1.73675522756319   -4.73458446589461   -0.15775371208065      H 
   -2.23934810596182   -6.33994542154272    0.01786382737248      H 
   -7.74053906517903   -4.55304247929274    0.14722178856081      H 
   -6.59211901302592   -7.82240402534876    0.10903486159565      H 
$end
           -------------------------------------------------
          |                Final Singlepoint                |
           -------------------------------------------------

          ...................................................
          :                      SETUP                      :
          :.................................................:
          :  # basis functions                  81          :
          :  # atomic orbitals                  80          :
          :  # shells                           42          :
          :  # electrons                        88          :
          :  max. iterations                   250          :
          :  Hamiltonian                  GFN2-xTB          :
          :  restarted?                      false          :
          :  GBSA solvation                  false          :
          :  PC potential                    false          :
          :  electronic temp.          300.0000000     K    :
          :  accuracy                    1.0000000          :
          :  -> integral cutoff          0.2500000E+02      :
          :  -> integral neglect         0.1000000E-07      :
          :  -> SCF convergence          0.1000000E-05 Eh   :
          :  -> wf. convergence          0.1000000E-03 e    :
          :  Broyden damping             0.4000000          :
          ...................................................

 iter      E             dE          RMSdq      gap      omega  full diag
   1    -51.3148953 -0.513149E+02  0.709E-05    1.62       0.0  T
   2    -51.3148953 -0.668621E-11  0.324E-05    1.62     630.1  T
   3    -51.3148953 -0.195399E-11  0.353E-05    1.62     577.5  T

   *** convergence criteria satisfied after 3 iterations ***

         #    Occupation            Energy/Eh            Energy/eV
      -------------------------------------------------------------
         1        2.0000           -0.8833224             -24.0364
       ...           ...                  ...                  ...
        38        2.0000           -0.4676821             -12.7263
        39        2.0000           -0.4629145             -12.5965
        40        2.0000           -0.4488664             -12.2143
        41        2.0000           -0.4418189             -12.0225
        42        2.0000           -0.4325066             -11.7691
        43        2.0000           -0.4297275             -11.6935
        44        2.0000           -0.3879006             -10.5553 (HOMO)
        45                         -0.3284357              -8.9372 (LUMO)
        46                         -0.3010158              -8.1911
        47                         -0.2387616              -6.4970
        48                         -0.2238803              -6.0921
        49                         -0.2211643              -6.0182
       ...                                ...                  ...
        80                          0.7103061              19.3284
      -------------------------------------------------------------
                  HL-Gap            0.0594649 Eh            1.6181 eV
             Fermi-level           -0.3581682 Eh           -9.7463 eV

 SCC (total)                   0 d,  0 h,  0 min,  0.035 sec
 SCC setup                      ...        0 min,  0.000 sec (  0.595%)
 Dispersion                     ...        0 min,  0.000 sec (  0.644%)
 integral evaluation            ...        0 min,  0.013 sec ( 36.611%)
 zeroth order Hamiltonian       ...        0 min,  0.000 sec (  0.523%)
 iterations                     ...        0 min,  0.005 sec ( 13.439%)
 molecular gradient             ...        0 min,  0.016 sec ( 47.020%)
 printout                       ...        0 min,  0.000 sec (  0.992%)

         :::::::::::::::::::::::::::::::::::::::::::::::::::::
         ::                     SUMMARY                     ::
         :::::::::::::::::::::::::::::::::::::::::::::::::::::
         :: total energy             -50.724239744835 Eh    ::
         :: gradient norm              0.000992749360 Eh/a0 ::
         :: HOMO-LUMO gap              1.618122484829 eV    ::
         ::.................................................::
         :: SCC energy               -51.314895334444 Eh    ::
         :: -> isotropic ES            0.063707957722 Eh    ::
         :: -> anisotropic ES          0.001225402117 Eh    ::
         :: -> anisotropic XC         -0.004431223430 Eh    ::
         :: -> dispersion             -0.026764020682 Eh    ::
         :: repulsion energy           0.590750830080 Eh    ::
         :: add. restraining           0.000000000000 Eh    ::
         :::::::::::::::::::::::::::::::::::::::::::::::::::::

           -------------------------------------------------
          |                Property Printout                |
           -------------------------------------------------

    * Orbital Energies and Occupations

         #    Occupation            Energy/Eh            Energy/eV
      -------------------------------------------------------------
         1        2.0000           -0.8833224             -24.0364
       ...           ...                  ...                  ...
        32        2.0000           -0.5107915             -13.8993
        33        2.0000           -0.5042229             -13.7206
        34        2.0000           -0.4986393             -13.5687
        35        2.0000           -0.4877760             -13.2731
        36        2.0000           -0.4874243             -13.2635
        37        2.0000           -0.4711182             -12.8198
        38        2.0000           -0.4676821             -12.7263
        39        2.0000           -0.4629145             -12.5965
        40        2.0000           -0.4488664             -12.2143
        41        2.0000           -0.4418189             -12.0225
        42        2.0000           -0.4325066             -11.7691
        43        2.0000           -0.4297275             -11.6935
        44        2.0000           -0.3879006             -10.5553 (HOMO)
        45                         -0.3284357              -8.9372 (LUMO)
        46                         -0.3010158              -8.1911
        47                         -0.2387616              -6.4970
        48                         -0.2238803              -6.0921
        49                         -0.2211643              -6.0182
        50                         -0.1826046              -4.9689
        51                         -0.1468263              -3.9953
        52                         -0.1110474              -3.0218
        53                         -0.0292514              -0.7960
        54                         -0.0005456              -0.0148
        55                          0.0039784               0.1083
       ...                                ...                  ...
        80                          0.7103061              19.3284
      -------------------------------------------------------------
                  HL-Gap            0.0594649 Eh            1.6181 eV
             Fermi-level           -0.3581682 Eh           -9.7463 eV

     #   Z        covCN         q      C6AA      α(0)
     1   6 C      2.924    -0.033    28.813     8.803
     2  16 S      2.326     0.059   138.647    19.818
     3   6 C      2.979     0.011    27.755     8.642
     4   6 C      3.164    -0.001    27.703     8.602
     5   6 C      3.172     0.006    27.496     8.566
     6   6 C      2.921    -0.010    28.264     8.718
     7   6 C      2.967    -0.013    28.335     8.731
     8   6 C      2.823     0.204    23.678     7.973
     9   8 O      0.857    -0.314    20.031     6.001
    10   6 C      3.325     0.465    17.717     6.690
    11   9 F      0.790    -0.204    11.275     3.966
    12   9 F      0.791    -0.183    11.059     3.928
    13   9 F      0.790    -0.203    11.271     3.966
    14   6 C      2.914    -0.032    28.804     8.801
    15   6 C      2.908    -0.025    28.638     8.775
    16   6 C      2.919    -0.030    28.756     8.794
    17   6 C      2.841    -0.086    30.136     8.997
    18   1 H      0.926     0.061     2.187     2.313
    19   1 H      0.926     0.071     2.073     2.251
    20   1 H      0.926     0.057     2.239     2.340
    21   1 H      0.926     0.047     2.354     2.399
    22   1 H      0.925     0.050     2.320     2.382
    23   1 H      0.926     0.051     2.310     2.377
    24   1 H      0.926     0.051     2.308     2.376

 Mol. C6AA /au·bohr⁶  :       9758.118430
 Mol. C8AA /au·bohr⁸  :     264533.308263
 Mol. α(0) /au        :        156.207149


Wiberg/Mayer (AO) data.
largest (>0.10) Wiberg bond orders for each atom
          total WBO             WBO to atom ...
     1  C   3.951        C    5 1.412    S    2 1.284    H   18 0.968    C    3 0.117
     2  S   2.738        C    1 1.284    C    3 1.163
     3  C   3.940        C    4 1.388    S    2 1.163    C   16 1.154    C    1 0.117
     4  C   3.989        C    3 1.388    C   15 1.233    C    5 1.152
     5  C   3.988        C    1 1.412    C    6 1.277    C    4 1.152
     6  C   3.982        C    7 1.465    C    5 1.277    H   19 0.962
     7  C   3.984        C    6 1.465    C   14 1.216    C    8 1.088
     8  C   3.929        O    9 1.826    C    7 1.088    C   10 0.874
     9  O   2.093        C    8 1.826
    10  C   3.817        F   12 0.973    F   11 0.946    F   13 0.946    C    8 0.874
    11  F   1.074        C   10 0.946
    12  F   1.098        C   10 0.973
    13  F   1.074        C   10 0.946
    14  C   3.969        C   15 1.619    C    7 1.216    H   20 0.966
    15  C   3.992        C   14 1.619    C    4 1.233    H   21 0.964
    16  C   3.991        C   17 1.846    C    3 1.154    H   22 0.954
    17  C   3.963        C   16 1.846    H   24 0.978    H   23 0.971
    18  H   0.995        C    1 0.968
    19  H   0.994        C    6 0.962
    20  H   0.996        C   14 0.966
    21  H   0.997        C   15 0.964
    22  H   0.997        C   16 0.954
    23  H   0.997        C   17 0.971
    24  H   0.997        C   17 0.978

molecular dipole:
                 x           y           z       tot (Debye)
 q only:       -2.658      -0.957       0.100
   full:       -2.391      -1.000       0.087       6.590
molecular quadrupole (traceless):
                xx          xy          yy          xz          yz          zz
 q only:      -16.284      -8.706       8.596       1.158       0.214       7.688
  q+dip:      -15.420     -11.161      11.202       0.906       0.334       4.219
   full:      -18.232     -10.922       9.300       1.221       0.184       8.932

           -------------------------------------------------
          |                Geometry Summary                 |
           -------------------------------------------------

      molecular mass/u    :      256.2419000
   center of mass at/Å    :        1.1927990       0.0638172      -0.0733110
  moments of inertia/u·Å² :        0.4290592E+03   0.2568260E+04   0.2908484E+04
rotational constants/cm⁻¹ :        0.3928976E-01   0.6563835E-02   0.5796020E-02

 * 23 selected distances

     #   Z        #   Z                                     value/Å
     1   6 C      2  16 S                                 1.6969142
     2  16 S      3   6 C                                 1.7353269 (max)
     3   6 C      4   6 C                                 1.3901789
     1   6 C      5   6 C                                 1.3830934
     4   6 C      5   6 C                                 1.4400183
     5   6 C      6   6 C                                 1.4029750
     6   6 C      7   6 C                                 1.3813457
     8   6 C      9   8 O                                 1.2071321
    10   6 C     11   9 F                                 1.3452138
    10   6 C     12   9 F                                 1.3308713
    10   6 C     13   9 F                                 1.3452245
     7   6 C     14   6 C                                 1.4267550
     4   6 C     15   6 C                                 1.4153271
    14   6 C     15   6 C                                 1.3596596
     3   6 C     16   6 C                                 1.4336510
    16   6 C     17   6 C                                 1.3317578
     1   6 C     18   1 H                                 1.0715984 (min)
     6   6 C     19   1 H                                 1.0795230
    14   6 C     20   1 H                                 1.0768068
    15   6 C     21   1 H                                 1.0786319
    16   6 C     22   1 H                                 1.0813669
    17   6 C     23   1 H                                 1.0775723
    17   6 C     24   1 H                                 1.0747566

 * 5 distinct bonds (by element types)

   Z      Z             #   av. dist./Å        max./Å        min./Å
   1 H    6 C           7     1.0771794     1.0813669     1.0715984
   6 C    6 C          10     1.3964762     1.4400183     1.3317578
   6 C    8 O           1     1.2071321     1.2071321     1.2071321
   6 C    9 F           3     1.3404365     1.3452245     1.3308713
   6 C   16 S           2     1.7161205     1.7353269     1.6969142


optimized geometry written to: xtbopt.xyz


           -------------------------------------------------
          | TOTAL ENERGY              -50.724239744835 Eh   |
          | GRADIENT NORM               0.000992749360 Eh/α |
          | HOMO-LUMO GAP               1.618122484829 eV   |
           -------------------------------------------------

------------------------------------------------------------------------
 * finished run on 2021/05/19 at 11:00:16.445     
------------------------------------------------------------------------
 total:
 * wall-time:     0 d,  0 h,  0 min,  1.006 sec
 *  cpu-time:     0 d,  0 h,  0 min,  0.963 sec
 * ratio c/w:     0.957 speedup
 SCF:
 * wall-time:     0 d,  0 h,  0 min,  0.063 sec
 *  cpu-time:     0 d,  0 h,  0 min,  0.050 sec
 * ratio c/w:     0.794 speedup
 ANC optimizer:
 * wall-time:     0 d,  0 h,  0 min,  0.887 sec
 *  cpu-time:     0 d,  0 h,  0 min,  0.887 sec
 * ratio c/w:     1.000 speedup

