      -----------------------------------------------------------      
     |                   =====================                   |     
     |                           x T B                           |     
     |                   =====================                   |     
     |                         S. Grimme                         |     
     |          Mulliken Center for Theoretical Chemistry        |     
     |                    University of Bonn                     |     
     |                Version 6.2 RC2 (SAW190805)                |     
      -----------------------------------------------------------      

   This program is distributed in the hope that it will be useful,
   but WITHOUT ANY WARRANTY; without even the implied warranty of
   MERCHANTABILITY or FITNESS FOR A PARTICULAR PURPOSE.
   
   FOR NON-COMMERCIAL, ACADEMIA USE ONLY.
   
   Cite this work as:
   * S. Grimme, C. Bannwarth, P. Shushkov, J. Chem. Theory Comput., 2017,
     13, 1989-2009. DOI: 10.1021/acs.jctc.7b00118
   * C. Bannwarth, S. Ehlert and S. Grimme., J. Chem. Theory Comput., 2019,
     15, 1652-1671. DOI: 10.1021/acs.jctc.8b01176
   * P. Pracht, E. Caldeweyher, S. Ehlert, S. Grimme, ChemRxiv, 2019, preprint.
     DOI: 10.26434/chemrxiv.8326202.v1
   
   for DFT-D4:
   * E. Caldeweyher, C. Bannwarth and S. Grimme, J. Chem. Phys., 2017,
     147, 034112. DOI: 10.1063/1.4993215
   * E. Caldeweyher, S. Ehlert, A. Hansen, H. Neugebauer, S. Spicher,
     C. Bannwarth and S. Grimme, J. Chem. Phys., 2019, 150, 154122.
     DOI: 10.1063/1.5090222
   
   for sTDA-xTB:
   * S. Grimme and C. Bannwarth, J. Chem. Phys., 2016, 145, 054103.
     DOI: 10.1063/1.4959605
   
   in the mass-spec context:
   * V. Asgeirsson, C. Bauer and S. Grimme, Chem. Sci., 2017, 8, 4879.
     DOI: 10.1039/c7sc00601b
   
   for metadynamics refer to:
   * S. Grimme, J. Chem. Theory Comput., 2019, 155, 2847-2862
     DOI: 10.1021/acs.jctc.9b00143
   
   with help from (in alphabetical order)
   C. Bannwarth, F. Bohle, G. Brandenburg, E. Caldeweyher, M. Checinski,
   S. Dohm, S. Ehlert, S. Ehrlich, F. März, H. Neugebauer, J. Pisarek,
   P. Pracht, P. Shushkov, and S. Spicher.
   
 * started run on 2021/05/19 at 11:00:21.181     

           -------------------------------------------------
          |                Calculation Setup                |
           -------------------------------------------------

          program call               : /ihome/ghutchison/geoffh/xtb/xtb 729.xyz -opt
          hostname                   : smp-n83
          coordinate file            : 729.xyz
          omp threads                :                     1
          number of atoms            :                    27
          number of electrons        :                    78
          charge                     :                     0
          spin                       :                   0.0
          first test random number   :      0.93027609357306


########################################################################
# WARNING! Please study the warnings concerning your input carefully
#  - the use of '-opt' is discouraged, please use '--opt' next time
########################################################################

           ------------------------------------------------- 
          |                 G F N 2 - x T B                 |
          | Geometry, Frequencies, Noncovalent interactions |
          |            JCTC 2019 parametrisation            |
           ------------------------------------------------- 
             KAB for C  - Si     :                1.0500
             KAB for H  - Pd     :                0.9500
             k(s)              :                1.8500
             k(p)              :                2.2300
             k(d)              :                2.2300
             k(f)              :                2.0000
             kEN (H0ij)        :               -2.0000
             D4 a1             :                0.5200
             D4 a2             :                5.0000
             D4 s6             :                1.0000
             D4 s8             :                2.7000
             D4 s9             :                5.0000
             alphaj            :                2.0000

  Z AO/shell   Hii/eV     exponent
  1     Wed Apr 25 08:07:45 CEST 2018   EN: 2.200 GM2: 0.406  GM3: 0.0800  RAES: 1.40
     1s    -10.707211    1.230000
  6     Wed Apr 25 08:07:45 CEST 2018   EN: 2.550 GM2: 0.538  GM3: 0.1500  RAES: 3.00
     2s    -13.970922    2.096432
     2p    -10.063292    1.800000
  7     Wed Apr 25 08:07:45 CEST 2018   EN: 3.040 GM2: 0.461  GM3:-0.0640  RAES: 1.90
     2s    -16.686243    2.339881
     2p    -12.523956    2.014332
 16     Tue Apr 24 11:44:34 CEST 2018   EN: 2.580 GM2: 0.340  GM3:-0.0502  RAES: 3.10
     3s    -20.029654    1.981333
     3p    -11.377694    2.025643
     3d     -0.420282    1.702555

           ------------------------------------------------- 
          |        Self-Consistent Charge Iterations        |
           ------------------------------------------------- 

          ...................................................
          :                      SETUP                      :
          :.................................................:
          :  # basis functions                  78          :
          :  # atomic orbitals                  77          :
          :  # shells                           43          :
          :  # electrons                        78          :
          :  max. iterations                   250          :
          :  Hamiltonian                  GFN2-xTB          :
          :  restarted?                      false          :
          :  GBSA solvation                  false          :
          :  PC potential                    false          :
          :  electronic temp.          300.0000000     K    :
          :  accuracy                    1.0000000          :
          :  -> integral cutoff          0.2500000E+02      :
          :  -> integral neglect         0.1000000E-07      :
          :  -> SCF convergence          0.1000000E-05 Eh   :
          :  -> wf. convergence          0.1000000E-03 e    :
          :  Broyden damping             0.4000000          :
          ...................................................

 iter      E             dE          RMSdq      gap      omega  full diag
   1    -42.9013346 -0.429013E+02  0.416E+00    1.73       0.0  T
   2    -42.9404391 -0.391045E-01  0.255E+00    1.71       1.0  T
   3    -42.9264143  0.140248E-01  0.130E+00    1.52       1.0  T
   4    -42.9513407 -0.249263E-01  0.504E-01    1.45       1.0  T
   5    -42.9557189 -0.437825E-02  0.176E-01    1.45       1.0  T
   6    -42.9563101 -0.591169E-03  0.891E-02    1.46       1.0  T
   7    -42.9564011 -0.910003E-04  0.453E-02    1.46       1.0  T
   8    -42.9564352 -0.340548E-04  0.187E-02    1.46       1.0  T
   9    -42.9564415 -0.638524E-05  0.780E-03    1.46       2.5  T
  10    -42.9564418 -0.300329E-06  0.394E-03    1.46       4.9  T
  11    -42.9564421 -0.252403E-06  0.137E-03    1.46      14.0  T
  12    -42.9564421 -0.114957E-07  0.535E-04    1.46      35.9  T
  13    -42.9564421 -0.175498E-08  0.230E-04    1.46      83.7  T

   *** convergence criteria satisfied after 13 iterations ***

         #    Occupation            Energy/Eh            Energy/eV
      -------------------------------------------------------------
         1        2.0000           -0.7492997             -20.3895
       ...           ...                  ...                  ...
        33        2.0000           -0.4339187             -11.8075
        34        2.0000           -0.4315043             -11.7418
        35        2.0000           -0.4108230             -11.1791
        36        2.0000           -0.3864565             -10.5160
        37        2.0000           -0.3793640             -10.3230
        38        2.0000           -0.3778817             -10.2827
        39        2.0000           -0.3714120             -10.1066 (HOMO)
        40                         -0.3178191              -8.6483 (LUMO)
        41                         -0.2562668              -6.9734
        42                         -0.2284836              -6.2174
        43                         -0.2154159              -5.8618
        44                         -0.1901133              -5.1732
       ...                                ...                  ...
        77                          0.6855886              18.6558
      -------------------------------------------------------------
                  HL-Gap            0.0535929 Eh            1.4583 eV
             Fermi-level           -0.3446155 Eh           -9.3775 eV

 SCC (total)                   0 d,  0 h,  0 min,  0.049 sec
 SCC setup                      ...        0 min,  0.000 sec (  0.731%)
 Dispersion                     ...        0 min,  0.000 sec (  0.883%)
 integral evaluation            ...        0 min,  0.012 sec ( 24.377%)
 zeroth order Hamiltonian       ...        0 min,  0.000 sec (  0.470%)
 iterations                     ...        0 min,  0.019 sec ( 38.096%)
 molecular gradient             ...        0 min,  0.017 sec ( 34.400%)
 printout                       ...        0 min,  0.000 sec (  0.926%)

         :::::::::::::::::::::::::::::::::::::::::::::::::::::
         ::                     SUMMARY                     ::
         :::::::::::::::::::::::::::::::::::::::::::::::::::::
         :: total energy             -42.395157841828 Eh    ::
         :: gradient norm              0.119123747104 Eh/a0 ::
         :: HOMO-LUMO gap              1.458337714049 eV    ::
         ::.................................................::
         :: SCC energy               -42.956442103482 Eh    ::
         :: -> isotropic ES            0.037705077382 Eh    ::
         :: -> anisotropic ES          0.004127748573 Eh    ::
         :: -> anisotropic XC          0.037006033324 Eh    ::
         :: -> dispersion             -0.028362464897 Eh    ::
         :: repulsion energy           0.561110959666 Eh    ::
         :: add. restraining           0.000000000000 Eh    ::
         :::::::::::::::::::::::::::::::::::::::::::::::::::::

      ----------------------------------------------------------- 
     |                   =====================                   |
     |                        A N C O P T                        |
     |                   =====================                   |
     |               Approximate Normal Coordinate               |
     |                Rational Function Optimizer                |
      ----------------------------------------------------------- 

          ...................................................
          :                      SETUP                      :
          :.................................................:
          :   optimization level            normal          :
          :   max. optcycles                   200          :
          :   ANC micro-cycles                  20          :
          :   degrees of freedom                75          :
          :.................................................:
          :   RF solver                   davidson          :
          :   input Hessian                  false          :
          :   write xtbopt.log                true          :
          :   linear?                        false          :
          :   energy convergence         0.5000000E-05 Eh   :
          :   grad. convergence          0.1000000E-02 Eh/α :
          :   maximium RF displ.         2.0000000          :
          :   Hlow (freq-cutoff)         0.5000000E-02      :
          :   Hmax (freq-cutoff)         5.0000000          :
          :   S6 in model hess.         20.0000000          :
          ...................................................

generating ANC from model Hessian ...
Using Lindh-Hessian (1995)
 Shifting diagonal of input Hessian by   4.276664190151477E-003
 Lowest  eigenvalues of input Hessian
   -0.000000   -0.000000    0.000000    0.000000    0.000000    0.000000
    0.005000    0.006471    0.007000    0.007258    0.007836    0.009295
    0.009328    0.011067    0.012545    0.018324    0.020435    0.021360
 Highest eigenvalues
    1.648822    1.773249    1.884927    1.925975    2.011541    2.095665
 

........................................................................
.............................. CYCLE    1 ..............................
........................................................................
   1    -42.9564421 -0.429564E+02  0.114E-04    1.46       0.0  T
   2    -42.9564421  0.179838E-10  0.807E-05    1.46     238.4  T
   3    -42.9564421 -0.929532E-10  0.631E-05    1.46     304.9  T
     SCC iter.                  ...        0 min,  0.005 sec
     gradient                   ...        0 min,  0.017 sec
 * total energy  :   -42.3951579 Eh     change       -0.1773979E-07 Eh
   gradient norm :     0.1191237 Eh/α   predicted     0.0000000E+00 (-100.00%)
   displ. norm   :     0.1908487 α      lambda       -0.1424003E-01
   maximum displ.:     0.1058597 α      in ANC's #48, #10, #6, ...

........................................................................
.............................. CYCLE    2 ..............................
........................................................................
   1    -42.9916639 -0.429917E+02  0.315E-01    1.43       0.0  T
   2    -42.9917535 -0.895955E-04  0.197E-01    1.44       1.0  T
   3    -42.9916376  0.115890E-03  0.142E-01    1.42       1.0  T
   4    -42.9920248 -0.387254E-03  0.349E-02    1.41       1.0  T
   5    -42.9920548 -0.300065E-04  0.130E-02    1.41       1.5  T
   6    -42.9920580 -0.316630E-05  0.494E-03    1.41       3.9  T
   7    -42.9920580 -0.344506E-07  0.270E-03    1.41       7.1  T
     SCC iter.                  ...        0 min,  0.009 sec
     gradient                   ...        0 min,  0.016 sec
 * total energy  :   -42.4053908 Eh     change       -0.1023291E-01 Eh
   gradient norm :     0.0577245 Eh/α   predicted    -0.7379347E-02 ( -27.89%)
   displ. norm   :     0.2143587 α      lambda       -0.5291253E-02
   maximum displ.:     0.0973783 α      in ANC's #10, #6, #3, ...

........................................................................
.............................. CYCLE    3 ..............................
........................................................................
   1    -43.0119093 -0.430119E+02  0.284E-01    1.38       0.0  T
   2    -43.0119796 -0.703119E-04  0.165E-01    1.38       1.0  T
   3    -43.0117692  0.210416E-03  0.121E-01    1.37       1.0  T
   4    -43.0120957 -0.326513E-03  0.268E-02    1.36       1.0  T
   5    -43.0121118 -0.160426E-04  0.113E-02    1.36       1.7  T
   6    -43.0121137 -0.193403E-05  0.483E-03    1.36       4.0  T
   7    -43.0121138 -0.150843E-06  0.203E-03    1.36       9.5  T
     SCC iter.                  ...        0 min,  0.009 sec
     gradient                   ...        0 min,  0.016 sec
 * total energy  :   -42.4081077 Eh     change       -0.2716899E-02 Eh
   gradient norm :     0.0131998 Eh/α   predicted    -0.2767204E-02 (   1.85%)
   displ. norm   :     0.1717806 α      lambda       -0.5410346E-03
   maximum displ.:     0.1017660 α      in ANC's #3, #6, #10, ...

........................................................................
.............................. CYCLE    4 ..............................
........................................................................
   1    -43.0097784 -0.430098E+02  0.112E-01    1.36       0.0  T
   2    -43.0097834 -0.498985E-05  0.642E-02    1.35       1.0  T
   3    -43.0097745  0.887505E-05  0.216E-02    1.36       1.0  T
   4    -43.0097854 -0.108558E-04  0.537E-03    1.35       3.6  T
   5    -43.0097856 -0.185960E-06  0.235E-03    1.35       8.2  T
   6    -43.0097856 -0.217404E-07  0.121E-03    1.35      15.9  T
     SCC iter.                  ...        0 min,  0.008 sec
     gradient                   ...        0 min,  0.016 sec
 * total energy  :   -42.4085322 Eh     change       -0.4244945E-03 Eh
   gradient norm :     0.0059495 Eh/α   predicted    -0.2785019E-03 ( -34.39%)
   displ. norm   :     0.2858233 α      lambda       -0.5276629E-03
   maximum displ.:     0.1843771 α      in ANC's #3, #6, #10, ...

........................................................................
.............................. CYCLE    5 ..............................
........................................................................
   1    -43.0070106 -0.430070E+02  0.181E-01    1.35       0.0  T
   2    -43.0070181 -0.754108E-05  0.103E-01    1.35       1.0  T
   3    -43.0070078  0.102920E-04  0.242E-02    1.35       1.0  T
   4    -43.0070202 -0.123429E-04  0.878E-03    1.35       2.2  T
   5    -43.0070207 -0.471924E-06  0.472E-03    1.35       4.1  T
   6    -43.0070210 -0.309672E-06  0.221E-03    1.35       8.7  T
   7    -43.0070211 -0.121281E-06  0.448E-04    1.35      42.9  T
     SCC iter.                  ...        0 min,  0.009 sec
     gradient                   ...        0 min,  0.016 sec
 * total energy  :   -42.4088844 Eh     change       -0.3522082E-03 Eh
   gradient norm :     0.0073227 Eh/α   predicted    -0.2853960E-03 ( -18.97%)
   displ. norm   :     0.2143564 α      lambda       -0.2755476E-03
   maximum displ.:     0.1394925 α      in ANC's #3, #6, #2, ...

........................................................................
.............................. CYCLE    6 ..............................
........................................................................
   1    -43.0068235 -0.430068E+02  0.142E-01    1.35       0.0  T
   2    -43.0068268 -0.327093E-05  0.810E-02    1.35       1.0  T
   3    -43.0068256  0.121180E-05  0.129E-02    1.35       1.5  T
   4    -43.0068266 -0.101412E-05  0.842E-03    1.35       2.3  T
   5    -43.0068275 -0.917571E-06  0.295E-03    1.35       6.5  T
   6    -43.0068277 -0.152690E-06  0.133E-03    1.35      14.5  T
     SCC iter.                  ...        0 min,  0.008 sec
     gradient                   ...        0 min,  0.016 sec
 * total energy  :   -42.4090717 Eh     change       -0.1873280E-03 Eh
   gradient norm :     0.0095032 Eh/α   predicted    -0.1441177E-03 ( -23.07%)
   displ. norm   :     0.2142787 α      lambda        0.7968298E-05
   maximum displ.:     0.1394927 α      in ANC's #3, #6, #2, ...

........................................................................
.............................. CYCLE    7 ..............................
........................................................................
   1    -43.0052966 -0.430053E+02  0.140E-01    1.35       0.0  T
   2    -43.0053000 -0.339124E-05  0.794E-02    1.35       1.0  T
   3    -43.0052979  0.216144E-05  0.146E-02    1.35       1.3  T
   4    -43.0052997 -0.179905E-05  0.907E-03    1.35       2.1  T
   5    -43.0053008 -0.113813E-05  0.313E-03    1.35       6.1  T
   6    -43.0053010 -0.168625E-06  0.135E-03    1.35      14.3  T
   7    -43.0053010 -0.449778E-07  0.264E-04    1.35      72.8  T
     SCC iter.                  ...        0 min,  0.009 sec
     gradient                   ...        0 min,  0.016 sec
 * total energy  :   -42.4090547 Eh     change        0.1695446E-04 Eh
   gradient norm :     0.0151370 Eh/α   predicted     0.4166296E-05 ( -75.43%)
   displ. norm   :     0.0786490 α      lambda       -0.3994672E-03
   maximum displ.:     0.0414119 α      in ANC's #3, #6, #19, ...

........................................................................
.............................. CYCLE    8 ..............................
........................................................................
   1    -43.0079622 -0.430080E+02  0.478E-02    1.35       0.0  T
   2    -43.0079630 -0.785262E-06  0.271E-02    1.35       1.0  T
   3    -43.0079593  0.369373E-05  0.137E-02    1.35       1.4  T
   4    -43.0079634 -0.401722E-05  0.414E-03    1.35       4.7  T
   5    -43.0079635 -0.186638E-06  0.214E-03    1.35       9.0  T
   6    -43.0079636 -0.649569E-07  0.648E-04    1.35      29.7  T
     SCC iter.                  ...        0 min,  0.008 sec
     gradient                   ...        0 min,  0.016 sec
 * total energy  :   -42.4093215 Eh     change       -0.2667094E-03 Eh
   gradient norm :     0.0086566 Eh/α   predicted    -0.2009693E-03 ( -24.65%)
   displ. norm   :     0.1378866 α      lambda       -0.2643736E-03
   maximum displ.:     0.0840321 α      in ANC's #3, #6, #2, ...

........................................................................
.............................. CYCLE    9 ..............................
........................................................................
   1    -43.0113428 -0.430113E+02  0.815E-02    1.35       0.0  T
   2    -43.0113446 -0.174977E-05  0.466E-02    1.36       1.0  T
   3    -43.0113327  0.118627E-04  0.242E-02    1.35       1.0  T
   4    -43.0113457 -0.129579E-04  0.581E-03    1.35       3.3  T
   5    -43.0113461 -0.458463E-06  0.303E-03    1.35       6.3  T
   6    -43.0113463 -0.144492E-06  0.809E-04    1.35      23.8  T
   7    -43.0113463 -0.108462E-07  0.261E-04    1.35      73.7  T
     SCC iter.                  ...        0 min,  0.009 sec
     gradient                   ...        0 min,  0.016 sec
 * total energy  :   -42.4095033 Eh     change       -0.1818392E-03 Eh
   gradient norm :     0.0041915 Eh/α   predicted    -0.1347010E-03 ( -25.92%)
   displ. norm   :     0.3701133 α      lambda       -0.2906202E-03
   maximum displ.:     0.2388630 α      in ANC's #3, #6, #5, ...

........................................................................
.............................. CYCLE   10 ..............................
........................................................................
   1    -43.0092010 -0.430092E+02  0.211E-01    1.35       0.0  T
   2    -43.0092069 -0.593264E-05  0.120E-01    1.35       1.0  T
   3    -43.0092054  0.153030E-05  0.165E-02    1.35       1.2  T
   4    -43.0092076 -0.222379E-05  0.924E-03    1.35       2.1  T
   5    -43.0092086 -0.102797E-05  0.344E-03    1.35       5.6  T
   6    -43.0092089 -0.264867E-06  0.116E-03    1.35      16.7  T
   7    -43.0092089 -0.292604E-07  0.416E-04    1.35      46.2  T
     SCC iter.                  ...        0 min,  0.010 sec
     gradient                   ...        0 min,  0.016 sec
 * total energy  :   -42.4096168 Eh     change       -0.1134649E-03 Eh
   gradient norm :     0.0098233 Eh/α   predicted    -0.1652209E-03 (  45.61%)
   displ. norm   :     0.0711060 α      lambda       -0.2156280E-03
   maximum displ.:     0.0304670 α      in ANC's #1, #8, #7, ...

........................................................................
.............................. CYCLE   11 ..............................
........................................................................
   1    -43.0107201 -0.430107E+02  0.602E-02    1.35       0.0  T
   2    -43.0107211 -0.105694E-05  0.333E-02    1.35       1.0  T
   3    -43.0107100  0.111060E-04  0.244E-02    1.35       1.0  T
   4    -43.0107225 -0.124647E-04  0.474E-03    1.35       4.1  T
   5    -43.0107225 -0.473802E-07  0.287E-03    1.35       6.7  T
   6    -43.0107227 -0.149395E-06  0.975E-04    1.35      19.7  T
     SCC iter.                  ...        0 min,  0.008 sec
     gradient                   ...        0 min,  0.016 sec
 * total energy  :   -42.4097347 Eh     change       -0.1179137E-03 Eh
   gradient norm :     0.0051364 Eh/α   predicted    -0.1083681E-03 (  -8.10%)
   displ. norm   :     0.1298463 α      lambda       -0.8707981E-04
   maximum displ.:     0.0626286 α      in ANC's #3, #5, #1, ...

........................................................................
.............................. CYCLE   12 ..............................
........................................................................
   1    -43.0107746 -0.430108E+02  0.708E-02    1.35       0.0  T
   2    -43.0107756 -0.928792E-06  0.400E-02    1.35       1.0  T
   3    -43.0107746  0.943893E-06  0.798E-03    1.35       2.4  T
   4    -43.0107758 -0.113490E-05  0.374E-03    1.35       5.1  T
   5    -43.0107759 -0.123684E-06  0.151E-03    1.35      12.7  T
   6    -43.0107759 -0.498253E-07  0.527E-04    1.35      36.5  T
     SCC iter.                  ...        0 min,  0.008 sec
     gradient                   ...        0 min,  0.016 sec
 * total energy  :   -42.4097928 Eh     change       -0.5813604E-04 Eh
   gradient norm :     0.0044564 Eh/α   predicted    -0.4427481E-04 ( -23.84%)
   displ. norm   :     0.2692402 α      lambda       -0.1285889E-03
   maximum displ.:     0.1335452 α      in ANC's #3, #1, #5, ...

........................................................................
.............................. CYCLE   13 ..............................
........................................................................
   1    -43.0087793 -0.430088E+02  0.153E-01    1.35       0.0  T
   2    -43.0087823 -0.306478E-05  0.875E-02    1.34       1.0  T
   3    -43.0087667  0.156192E-04  0.264E-02    1.35       1.0  T
   4    -43.0087833 -0.165609E-04  0.861E-03    1.34       2.2  T
   5    -43.0087839 -0.659464E-06  0.409E-03    1.34       4.7  T
   6    -43.0087843 -0.360245E-06  0.916E-04    1.34      21.0  T
   7    -43.0087843 -0.134364E-07  0.309E-04    1.34      62.3  T
     SCC iter.                  ...        0 min,  0.009 sec
     gradient                   ...        0 min,  0.016 sec
 * total energy  :   -42.4098481 Eh     change       -0.5533200E-04 Eh
   gradient norm :     0.0049426 Eh/α   predicted    -0.6895904E-04 (  24.63%)
   displ. norm   :     0.2694703 α      lambda        0.2100991E-03
   maximum displ.:     0.1334978 α      in ANC's #3, #1, #5, ...

........................................................................
.............................. CYCLE   14 ..............................
........................................................................
   1    -43.0048734 -0.430049E+02  0.150E-01    1.34       0.0  T
   2    -43.0048767 -0.334394E-05  0.860E-02    1.34       1.0  T
   3    -43.0048713  0.547715E-05  0.176E-02    1.34       1.1  T
   4    -43.0048775 -0.621506E-05  0.749E-03    1.34       2.6  T
   5    -43.0048777 -0.257344E-06  0.456E-03    1.34       4.2  T
   6    -43.0048782 -0.488981E-06  0.105E-03    1.34      18.3  T
   7    -43.0048782 -0.173441E-07  0.327E-04    1.34      58.8  T
     SCC iter.                  ...        0 min,  0.010 sec
     gradient                   ...        0 min,  0.016 sec
 * total energy  :   -42.4096809 Eh     change        0.1672089E-03 Eh
   gradient norm :     0.0136818 Eh/α   predicted     0.1126758E-03 ( -32.61%)
   displ. norm   :     0.2066405 α      lambda       -0.4103348E-03
   maximum displ.:     0.1305680 α      in ANC's #3, #6, #1, ...

........................................................................
.............................. CYCLE   15 ..............................
........................................................................
   1    -43.0104452 -0.430104E+02  0.128E-01    1.34       0.0  T
   2    -43.0104475 -0.234840E-05  0.725E-02    1.34       1.0  T
   3    -43.0104368  0.107399E-04  0.236E-02    1.34       1.0  T
   4    -43.0104485 -0.117260E-04  0.727E-03    1.34       2.6  T
   5    -43.0104485  0.213448E-08  0.496E-03    1.34       3.9  T
   6    -43.0104491 -0.619041E-06  0.553E-04    1.34      34.8  T
   7    -43.0104491 -0.233712E-08  0.262E-04    1.34      73.4  T
     SCC iter.                  ...        0 min,  0.009 sec
     gradient                   ...        0 min,  0.016 sec
 * total energy  :   -42.4098758 Eh     change       -0.1948249E-03 Eh
   gradient norm :     0.0039570 Eh/α   predicted    -0.2139322E-03 (   9.81%)
   displ. norm   :     0.0631114 α      lambda       -0.5704610E-04
   maximum displ.:     0.0387586 α      in ANC's #7, #10, #8, ...

........................................................................
.............................. CYCLE   16 ..............................
........................................................................
   1    -43.0106335 -0.430106E+02  0.386E-02    1.34       0.0  T
   2    -43.0106347 -0.118217E-05  0.222E-02    1.35       1.0  T
   3    -43.0106296  0.505906E-05  0.160E-02    1.35       1.2  T
   4    -43.0106354 -0.583668E-05  0.461E-03    1.35       4.2  T
   5    -43.0106358 -0.331805E-06  0.207E-03    1.35       9.3  T
   6    -43.0106358 -0.708511E-07  0.733E-04    1.35      26.3  T
   7    -43.0106358 -0.210267E-08  0.249E-04    1.35      77.2  T
     SCC iter.                  ...        0 min,  0.009 sec
     gradient                   ...        0 min,  0.017 sec
 * total energy  :   -42.4098792 Eh     change       -0.3474884E-05 Eh
   gradient norm :     0.0038617 Eh/α   predicted    -0.2864031E-04 ( 724.21%)
   displ. norm   :     0.0434752 α      lambda       -0.3981300E-04
   maximum displ.:     0.0290023 α      in ANC's #1, #5, #9, ...

........................................................................
.............................. CYCLE   17 ..............................
........................................................................
   1    -43.0110083 -0.430110E+02  0.228E-02    1.35       0.0  T
   2    -43.0110084 -0.182268E-06  0.127E-02    1.35       1.5  T
   3    -43.0110070  0.144914E-05  0.810E-03    1.35       2.4  T
   4    -43.0110086 -0.161611E-05  0.194E-03    1.35       9.9  T
   5    -43.0110086 -0.283827E-07  0.108E-03    1.35      17.8  T
   6    -43.0110086 -0.146005E-07  0.356E-04    1.35      54.1  T
   7    -43.0110086 -0.118101E-08  0.121E-04    1.35     158.5  T
     SCC iter.                  ...        0 min,  0.009 sec
     gradient                   ...        0 min,  0.017 sec
 * total energy  :   -42.4099032 Eh     change       -0.2395172E-04 Eh
   gradient norm :     0.0010633 Eh/α   predicted    -0.1994911E-04 ( -16.71%)
   displ. norm   :     0.0890241 α      lambda       -0.1399322E-04
   maximum displ.:     0.0694490 α      in ANC's #1, #5, #45, ...

........................................................................
.............................. CYCLE   18 ..............................
........................................................................
   1    -43.0111007 -0.430111E+02  0.439E-02    1.35       0.0  T
   2    -43.0111011 -0.400774E-06  0.245E-02    1.35       1.0  T
   3    -43.0111003  0.787310E-06  0.672E-03    1.35       2.9  T
   4    -43.0111012 -0.893801E-06  0.263E-03    1.35       7.3  T
   5    -43.0111013 -0.622613E-07  0.113E-03    1.35      17.0  T
   6    -43.0111013 -0.261121E-07  0.220E-04    1.35      87.6  T
   7    -43.0111013 -0.636838E-09  0.115E-04    1.35     167.8  T
     SCC iter.                  ...        0 min,  0.009 sec
     gradient                   ...        0 min,  0.017 sec
 * total energy  :   -42.4099162 Eh     change       -0.1303564E-04 Eh
   gradient norm :     0.0016641 Eh/α   predicted    -0.7021350E-05 ( -46.14%)
   displ. norm   :     0.1396594 α      lambda       -0.1648273E-04
   maximum displ.:     0.1102720 α      in ANC's #1, #5, #9, ...

........................................................................
.............................. CYCLE   19 ..............................
........................................................................
   1    -43.0110153 -0.430110E+02  0.686E-02    1.35       0.0  T
   2    -43.0110162 -0.933383E-06  0.383E-02    1.35       1.0  T
   3    -43.0110154  0.775519E-06  0.793E-03    1.35       2.4  T
   4    -43.0110164 -0.944892E-06  0.411E-03    1.35       4.7  T
   5    -43.0110165 -0.147900E-06  0.178E-03    1.35      10.8  T
   6    -43.0110166 -0.747895E-07  0.518E-04    1.35      37.2  T
   7    -43.0110166 -0.557394E-08  0.164E-04    1.35     117.3  T
     SCC iter.                  ...        0 min,  0.010 sec
     gradient                   ...        0 min,  0.017 sec
 * total energy  :   -42.4099311 Eh     change       -0.1486971E-04 Eh
   gradient norm :     0.0012362 Eh/α   predicted    -0.8313257E-05 ( -44.09%)
   displ. norm   :     0.0518605 α      lambda       -0.6109716E-05
   maximum displ.:     0.0451388 α      in ANC's #1, #5, #3, ...

........................................................................
.............................. CYCLE   20 ..............................
........................................................................
   1    -43.0109520 -0.430110E+02  0.245E-02    1.35       0.0  T
   2    -43.0109521 -0.102620E-06  0.139E-02    1.35       1.4  T
   3    -43.0109518  0.292872E-06  0.406E-03    1.35       4.7  T
   4    -43.0109521 -0.355352E-06  0.997E-04    1.35      19.3  T
   5    -43.0109521  0.581243E-08  0.665E-04    1.35      29.0  T
     SCC iter.                  ...        0 min,  0.007 sec
     gradient                   ...        0 min,  0.017 sec
 * total energy  :   -42.4099362 Eh     change       -0.5078376E-05 Eh
   gradient norm :     0.0014793 Eh/α   predicted    -0.3065947E-05 ( -39.63%)
   displ. norm   :     0.0333748 α      lambda       -0.3721415E-05
   maximum displ.:     0.0295215 α      in ANC's #1, #2, #3, ...
 * RMSD in coord.:     0.4302627 α      energy gain  -0.1477833E-01 Eh

generating ANC from model Hessian ...
Using Lindh-Hessian (1995)
 Shifting diagonal of input Hessian by   4.258589946990027E-003
 Lowest  eigenvalues of input Hessian
   -0.000000   -0.000000   -0.000000    0.000000    0.000000    0.000000
    0.005000    0.006644    0.007513    0.007590    0.007866    0.009709
    0.009764    0.011313    0.013000    0.019964    0.021814    0.023379
 Highest eigenvalues
    1.798093    1.814901    1.937454    2.033349    2.068377    2.204356
 

........................................................................
.............................. CYCLE   21 ..............................
........................................................................
   1    -43.0111036 -0.430111E+02  0.156E-02    1.35       0.0  T
   2    -43.0111036 -0.575216E-07  0.864E-03    1.35       2.2  T
   3    -43.0111035  0.129019E-06  0.255E-03    1.35       7.5  T
   4    -43.0111036 -0.148036E-06  0.944E-04    1.35      20.4  T
   5    -43.0111036 -0.792936E-08  0.393E-04    1.35      48.9  T
     SCC iter.                  ...        0 min,  0.007 sec
     gradient                   ...        0 min,  0.017 sec
 * total energy  :   -42.4099408 Eh     change       -0.4602121E-05 Eh
   gradient norm :     0.0008464 Eh/α   predicted     0.0000000E+00 (-100.00%)
   displ. norm   :     0.0380635 α      lambda       -0.6124459E-05
   maximum displ.:     0.0301064 α      in ANC's #1, #4, #9, ...

   *** GEOMETRY OPTIMIZATION CONVERGED AFTER 21 ITERATIONS ***

------------------------------------------------------------------------
 total energy gain   :        -0.0147829 Eh       -9.2764 kcal/mol
 total RMSD          :         0.4302627 a0        0.2277 Å
 total power (kW/mol):        -1.8482179 (step)  -48.6350 (real)
------------------------------------------------------------------------

 ANCopt (total)                0 d,  0 h,  0 min,  0.798 sec
 optimizer setup                ...        0 min,  0.000 sec (  0.019%)
 model hessian                  ...        0 min,  0.010 sec (  1.282%)
 ANC generation                 ...        0 min,  0.002 sec (  0.196%)
 coordinate transformation      ...        0 min,  0.000 sec (  0.056%)
 single point calculation       ...        0 min,  0.777 sec ( 97.370%)
 optimization log               ...        0 min,  0.002 sec (  0.289%)
 hessian update                 ...        0 min,  0.000 sec (  0.036%)
 rational function              ...        0 min,  0.005 sec (  0.580%)

================
 final structure:
================
$coord
   -1.64092785306577    2.47331628670031    0.56723976097473      C 
   -3.96748054843858    0.24269084795388    0.45661251399814      S 
   -1.87485349006271   -2.23073124322500   -0.00107581803275      C 
    0.58296325140873   -1.30402532156475   -0.05530676780664      C 
    0.70120326263350    1.39472510141377    0.26421104338467      C 
    2.94401698481010    2.63073314829283    0.23660555704664      N 
    4.97024001660793    1.26772074767761   -0.07400441846936      C 
    7.45880904949097    2.65920699383899   -0.12033648372368      C 
    7.26512986037565    5.37653624072248    0.11909242813138      N 
    4.85928221419455   -1.43473764008174   -0.36298017138017      C 
    7.23131032270072   -2.98529249079138   -0.68405609449706      C 
    6.82778679797087   -5.67979141975225   -0.91774609326643      N 
    2.72355787088910   -2.66541126407785   -0.35809675864740      N 
   -2.80977755836997   -4.75945842338227   -0.27602933653052      C 
   -1.35671783456828   -6.78067039977673   -0.65425324567078      C 
   -2.09318673513846    4.42620636102746    0.84074260025936      H 
    8.43604746953603    2.23026502514954   -1.89494807573439      H 
    8.64885032457440    1.95476333377110    1.42186538235007      H 
    6.17465460097251    6.06478079361811   -1.30181672509992      H 
    6.35572135287369    5.80760969578377    1.75256974330747      H 
    8.47430387242268   -2.65321363170856    0.93901227162029      H 
    8.23818375770280   -2.33198812967049   -2.37182189034197      H 
    5.90113868491344   -6.32376170574175    0.63363000117465      H 
    5.69065206243030   -6.02716162673843   -2.42333717461278      H 
   -4.84548937235036   -4.94308466275398   -0.17025468988850      H 
    0.66401574098261   -6.60851293840641   -0.76224488980462      H 
   -2.15789111402307   -8.63742143854707   -0.85632944597232      H 
$end
           -------------------------------------------------
          |                Final Singlepoint                |
           -------------------------------------------------

          ...................................................
          :                      SETUP                      :
          :.................................................:
          :  # basis functions                  78          :
          :  # atomic orbitals                  77          :
          :  # shells                           43          :
          :  # electrons                        78          :
          :  max. iterations                   250          :
          :  Hamiltonian                  GFN2-xTB          :
          :  restarted?                      false          :
          :  GBSA solvation                  false          :
          :  PC potential                    false          :
          :  electronic temp.          300.0000000     K    :
          :  accuracy                    1.0000000          :
          :  -> integral cutoff          0.2500000E+02      :
          :  -> integral neglect         0.1000000E-07      :
          :  -> SCF convergence          0.1000000E-05 Eh   :
          :  -> wf. convergence          0.1000000E-03 e    :
          :  Broyden damping             0.4000000          :
          ...................................................

 iter      E             dE          RMSdq      gap      omega  full diag
   1    -43.0111036 -0.430111E+02  0.219E-04    1.35       0.0  T
   2    -43.0111036  0.865441E-11  0.902E-05    1.35     213.3  T
   3    -43.0111036 -0.258282E-10  0.123E-04    1.35     156.6  T

   *** convergence criteria satisfied after 3 iterations ***

         #    Occupation            Energy/Eh            Energy/eV
      -------------------------------------------------------------
         1        2.0000           -0.7466389             -20.3171
       ...           ...                  ...                  ...
        33        2.0000           -0.4359917             -11.8639
        34        2.0000           -0.4238380             -11.5332
        35        2.0000           -0.4074428             -11.0871
        36        2.0000           -0.3815246             -10.3818
        37        2.0000           -0.3760270             -10.2322
        38        2.0000           -0.3744179             -10.1884
        39        2.0000           -0.3556220              -9.6770 (HOMO)
        40                         -0.3061235              -8.3300 (LUMO)
        41                         -0.2478450              -6.7442
        42                         -0.2231245              -6.0715
        43                         -0.2121959              -5.7741
        44                         -0.1762692              -4.7965
       ...                                ...                  ...
        77                          0.7041551              19.1610
      -------------------------------------------------------------
                  HL-Gap            0.0494986 Eh            1.3469 eV
             Fermi-level           -0.3308727 Eh           -9.0035 eV

 SCC (total)                   0 d,  0 h,  0 min,  0.034 sec
 SCC setup                      ...        0 min,  0.000 sec (  0.678%)
 Dispersion                     ...        0 min,  0.000 sec (  0.735%)
 integral evaluation            ...        0 min,  0.011 sec ( 33.528%)
 zeroth order Hamiltonian       ...        0 min,  0.000 sec (  0.609%)
 iterations                     ...        0 min,  0.005 sec ( 13.986%)
 molecular gradient             ...        0 min,  0.017 sec ( 49.185%)
 printout                       ...        0 min,  0.000 sec (  1.121%)

         :::::::::::::::::::::::::::::::::::::::::::::::::::::
         ::                     SUMMARY                     ::
         :::::::::::::::::::::::::::::::::::::::::::::::::::::
         :: total energy             -42.409940795059 Eh    ::
         :: gradient norm              0.000845944032 Eh/a0 ::
         :: HOMO-LUMO gap              1.346924247987 eV    ::
         ::.................................................::
         :: SCC energy               -43.011103649083 Eh    ::
         :: -> isotropic ES            0.037471136748 Eh    ::
         :: -> anisotropic ES          0.003719085776 Eh    ::
         :: -> anisotropic XC          0.036306473527 Eh    ::
         :: -> dispersion             -0.028504138070 Eh    ::
         :: repulsion energy           0.601003299693 Eh    ::
         :: add. restraining           0.000000000000 Eh    ::
         :::::::::::::::::::::::::::::::::::::::::::::::::::::

           -------------------------------------------------
          |                Property Printout                |
           -------------------------------------------------

    * Orbital Energies and Occupations

         #    Occupation            Energy/Eh            Energy/eV
      -------------------------------------------------------------
         1        2.0000           -0.7466389             -20.3171
       ...           ...                  ...                  ...
        27        2.0000           -0.4779535             -13.0058
        28        2.0000           -0.4691519             -12.7663
        29        2.0000           -0.4599316             -12.5154
        30        2.0000           -0.4592442             -12.4967
        31        2.0000           -0.4533433             -12.3361
        32        2.0000           -0.4450059             -12.1092
        33        2.0000           -0.4359917             -11.8639
        34        2.0000           -0.4238380             -11.5332
        35        2.0000           -0.4074428             -11.0871
        36        2.0000           -0.3815246             -10.3818
        37        2.0000           -0.3760270             -10.2322
        38        2.0000           -0.3744179             -10.1884
        39        2.0000           -0.3556220              -9.6770 (HOMO)
        40                         -0.3061235              -8.3300 (LUMO)
        41                         -0.2478450              -6.7442
        42                         -0.2231245              -6.0715
        43                         -0.2121959              -5.7741
        44                         -0.1762692              -4.7965
        45                         -0.1328892              -3.6161
        46                         -0.1123103              -3.0561
        47                         -0.0150587              -0.4098
        48                          0.0166004               0.4517
        49                          0.0266163               0.7243
        50                          0.0506243               1.3776
       ...                                ...                  ...
        77                          0.7041551              19.1610
      -------------------------------------------------------------
                  HL-Gap            0.0494986 Eh            1.3469 eV
             Fermi-level           -0.3308727 Eh           -9.0035 eV

     #   Z        covCN         q      C6AA      α(0)
     1   6 C      2.923    -0.046    29.139     8.852
     2  16 S      2.369     0.017   140.348    19.939
     3   6 C      2.977     0.006    27.886     8.662
     4   6 C      3.166     0.059    26.334     8.386
     5   6 C      3.175     0.064    26.179     8.356
     6   7 N      1.840    -0.245    27.233     7.734
     7   6 C      2.952     0.072    26.392     8.426
     8   6 C      3.739     0.011    20.476     6.457
     9   7 N      2.629    -0.332    28.555     7.936
    10   6 C      2.950     0.069    26.466     8.438
    11   6 C      3.739     0.011    20.468     6.455
    12   7 N      2.629    -0.333    28.562     7.937
    13   7 N      1.840    -0.239    27.094     7.714
    14   6 C      2.928    -0.027    28.673     8.781
    15   6 C      2.841    -0.088    30.194     9.005
    16   1 H      0.927     0.058     2.226     2.333
    17   1 H      0.924     0.048     2.349     2.397
    18   1 H      0.924     0.049     2.339     2.392
    19   1 H      0.860     0.149     1.409     1.859
    20   1 H      0.860     0.150     1.399     1.853
    21   1 H      0.924     0.048     2.346     2.395
    22   1 H      0.924     0.048     2.343     2.394
    23   1 H      0.860     0.149     1.410     1.860
    24   1 H      0.860     0.149     1.409     1.859
    25   1 H      0.925     0.042     2.426     2.436
    26   1 H      0.926     0.066     2.130     2.282
    27   1 H      0.926     0.046     2.373     2.409

 Mol. C6AA /au·bohr⁶  :      10166.442977
 Mol. C8AA /au·bohr⁸  :     265153.957639
 Mol. α(0) /au        :        159.547628


Wiberg/Mayer (AO) data.
largest (>0.10) Wiberg bond orders for each atom
          total WBO             WBO to atom ...
     1  C   3.936        C    5 1.447    S    2 1.240    H   16 0.968    C    3 0.125
     2  S   2.713        C    1 1.240    C    3 1.179
     3  C   3.940        C    4 1.363    S    2 1.179    C   14 1.153    C    1 0.125
     4  C   3.981        C    3 1.363    N   13 1.247    C    5 1.138
     5  C   3.981        C    1 1.447    N    6 1.225    C    4 1.138
     6  N   3.060        C    7 1.583    C    5 1.225
     7  C   3.972        N    6 1.583    C   10 1.160    C    8 0.995
     8  C   3.990        N    9 1.039    C    7 0.995    H   17 0.953    H   18 0.951
     9  N   3.011        C    8 1.039    H   19 0.963    H   20 0.962
    10  C   3.973        N   13 1.571    C    7 1.160    C   11 0.995
    11  C   3.990        N   12 1.039    C   10 0.995    H   21 0.952    H   22 0.952
    12  N   3.012        C   11 1.039    H   23 0.963    H   24 0.963
    13  N   3.071        C   10 1.571    C    4 1.247
    14  C   3.991        C   15 1.838    C    3 1.153    H   25 0.964
    15  C   3.982        C   14 1.838    H   27 0.978    H   26 0.970
    16  H   0.996        C    1 0.968
    17  H   0.994        C    8 0.953
    18  H   0.994        C    8 0.951
    19  H   0.978        N    9 0.963
    20  H   0.977        N    9 0.962
    21  H   0.993        C   11 0.952
    22  H   0.993        C   11 0.952
    23  H   0.978        N   12 0.963
    24  H   0.978        N   12 0.963
    25  H   0.998        C   14 0.964
    26  H   0.996        C   15 0.970
    27  H   0.997        C   15 0.978

molecular dipole:
                 x           y           z       tot (Debye)
 q only:       -0.091      -0.185      -0.021
   full:       -0.539      -0.088       0.020       1.389
molecular quadrupole (traceless):
                xx          xy          yy          xz          yz          zz
 q only:        1.739      -0.062       0.192      -0.287       0.294      -1.931
  q+dip:       -4.366      -0.341      -0.890       0.542      -0.415       5.255
   full:       -6.333      -0.188      -1.856       0.908      -0.949       8.190

           -------------------------------------------------
          |                Geometry Summary                 |
           -------------------------------------------------

      molecular mass/u    :      220.2916000
   center of mass at/Å    :        1.0019860      -0.3715117      -0.0462410
  moments of inertia/u·Å² :        0.6680349E+03   0.1146536E+04   0.1802629E+04
rotational constants/cm⁻¹ :        0.2523466E-01   0.1470310E-01   0.9351691E-02

 * 26 selected distances

     #   Z        #   Z                                     value/Å
     1   6 C      2  16 S                                 1.7066090
     2  16 S      3   6 C                                 1.7315003 (max)
     3   6 C      4   6 C                                 1.3902956
     1   6 C      5   6 C                                 1.3739019
     4   6 C      5   6 C                                 1.4394522
     5   6 C      6   7 N                                 1.3552199
     6   7 N      7   6 C                                 1.3026643
     8   6 C      9   7 N                                 1.4471538
     7   6 C     10   6 C                                 1.4394302
    11   6 C     12   7 N                                 1.4470620
     4   6 C     13   7 N                                 1.3519623
    10   6 C     13   7 N                                 1.3043870
     3   6 C     14   6 C                                 1.4340746
    14   6 C     15   6 C                                 1.3324063
     1   6 C     16   1 H                                 1.0706031
     8   6 C     17   1 H                                 1.0958228
     8   6 C     18   1 H                                 1.0961541
     9   7 N     19   1 H                                 1.0153862
     9   7 N     20   1 H                                 1.0152892
    11   6 C     21   1 H                                 1.0960052
    11   6 C     22   1 H                                 1.0959406
    12   7 N     23   1 H                                 1.0151576 (min)
    12   7 N     24   1 H                                 1.0152133
    14   6 C     25   1 H                                 1.0830734
    15   6 C     26   1 H                                 1.0747204
    15   6 C     27   1 H                                 1.0754462

 * 5 distinct bonds (by element types)

   Z      Z             #   av. dist./Å        max./Å        min./Å
   1 H    6 C           8     1.0859707     1.0961541     1.0706031
   6 C    6 C           6     1.4015935     1.4394522     1.3324063
   1 H    7 N           4     1.0152616     1.0153862     1.0151576
   6 C    7 N           6     1.3680749     1.4471538     1.3026643
   6 C   16 S           2     1.7190547     1.7315003     1.7066090


optimized geometry written to: xtbopt.xyz


           -------------------------------------------------
          | TOTAL ENERGY              -42.409940795059 Eh   |
          | GRADIENT NORM               0.000845944032 Eh/α |
          | HOMO-LUMO GAP               1.346924247987 eV   |
           -------------------------------------------------

------------------------------------------------------------------------
 * finished run on 2021/05/19 at 11:00:22.088     
------------------------------------------------------------------------
 total:
 * wall-time:     0 d,  0 h,  0 min,  0.906 sec
 *  cpu-time:     0 d,  0 h,  0 min,  0.905 sec
 * ratio c/w:     0.999 speedup
 SCF:
 * wall-time:     0 d,  0 h,  0 min,  0.049 sec
 *  cpu-time:     0 d,  0 h,  0 min,  0.049 sec
 * ratio c/w:     0.998 speedup
 ANC optimizer:
 * wall-time:     0 d,  0 h,  0 min,  0.833 sec
 *  cpu-time:     0 d,  0 h,  0 min,  0.833 sec
 * ratio c/w:     1.000 speedup

