      -----------------------------------------------------------      
     |                   =====================                   |     
     |                           x T B                           |     
     |                   =====================                   |     
     |                         S. Grimme                         |     
     |          Mulliken Center for Theoretical Chemistry        |     
     |                    University of Bonn                     |     
     |                Version 6.2 RC2 (SAW190805)                |     
      -----------------------------------------------------------      

   This program is distributed in the hope that it will be useful,
   but WITHOUT ANY WARRANTY; without even the implied warranty of
   MERCHANTABILITY or FITNESS FOR A PARTICULAR PURPOSE.
   
   FOR NON-COMMERCIAL, ACADEMIA USE ONLY.
   
   Cite this work as:
   * S. Grimme, C. Bannwarth, P. Shushkov, J. Chem. Theory Comput., 2017,
     13, 1989-2009. DOI: 10.1021/acs.jctc.7b00118
   * C. Bannwarth, S. Ehlert and S. Grimme., J. Chem. Theory Comput., 2019,
     15, 1652-1671. DOI: 10.1021/acs.jctc.8b01176
   * P. Pracht, E. Caldeweyher, S. Ehlert, S. Grimme, ChemRxiv, 2019, preprint.
     DOI: 10.26434/chemrxiv.8326202.v1
   
   for DFT-D4:
   * E. Caldeweyher, C. Bannwarth and S. Grimme, J. Chem. Phys., 2017,
     147, 034112. DOI: 10.1063/1.4993215
   * E. Caldeweyher, S. Ehlert, A. Hansen, H. Neugebauer, S. Spicher,
     C. Bannwarth and S. Grimme, J. Chem. Phys., 2019, 150, 154122.
     DOI: 10.1063/1.5090222
   
   for sTDA-xTB:
   * S. Grimme and C. Bannwarth, J. Chem. Phys., 2016, 145, 054103.
     DOI: 10.1063/1.4959605
   
   in the mass-spec context:
   * V. Asgeirsson, C. Bauer and S. Grimme, Chem. Sci., 2017, 8, 4879.
     DOI: 10.1039/c7sc00601b
   
   for metadynamics refer to:
   * S. Grimme, J. Chem. Theory Comput., 2019, 155, 2847-2862
     DOI: 10.1021/acs.jctc.9b00143
   
   with help from (in alphabetical order)
   C. Bannwarth, F. Bohle, G. Brandenburg, E. Caldeweyher, M. Checinski,
   S. Dohm, S. Ehlert, S. Ehrlich, F. März, H. Neugebauer, J. Pisarek,
   P. Pracht, P. Shushkov, and S. Spicher.
   
 * started run on 2021/05/19 at 10:58:46.753     

           -------------------------------------------------
          |                Calculation Setup                |
           -------------------------------------------------

          program call               : /ihome/ghutchison/geoffh/xtb/xtb 73.xyz -opt
          hostname                   : smp-n58
          coordinate file            : 73.xyz
          omp threads                :                     1
          number of atoms            :                    18
          number of electrons        :                    48
          charge                     :                     0
          spin                       :                   0.0
          first test random number   :      0.27230562695580


########################################################################
# WARNING! Please study the warnings concerning your input carefully
#  - the use of '-opt' is discouraged, please use '--opt' next time
########################################################################

           ------------------------------------------------- 
          |                 G F N 2 - x T B                 |
          | Geometry, Frequencies, Noncovalent interactions |
          |            JCTC 2019 parametrisation            |
           ------------------------------------------------- 
             KAB for C  - Si     :                1.0500
             KAB for H  - Pd     :                0.9500
             k(s)              :                1.8500
             k(p)              :                2.2300
             k(d)              :                2.2300
             k(f)              :                2.0000
             kEN (H0ij)        :               -2.0000
             D4 a1             :                0.5200
             D4 a2             :                5.0000
             D4 s6             :                1.0000
             D4 s8             :                2.7000
             D4 s9             :                5.0000
             alphaj            :                2.0000

  Z AO/shell   Hii/eV     exponent
  1     Wed Apr 25 08:07:45 CEST 2018   EN: 2.200 GM2: 0.406  GM3: 0.0800  RAES: 1.40
     1s    -10.707211    1.230000
  6     Wed Apr 25 08:07:45 CEST 2018   EN: 2.550 GM2: 0.538  GM3: 0.1500  RAES: 3.00
     2s    -13.970922    2.096432
     2p    -10.063292    1.800000

           ------------------------------------------------- 
          |        Self-Consistent Charge Iterations        |
           ------------------------------------------------- 

          ...................................................
          :                      SETUP                      :
          :.................................................:
          :  # basis functions                  48          :
          :  # atomic orbitals                  48          :
          :  # shells                           28          :
          :  # electrons                        48          :
          :  max. iterations                   250          :
          :  Hamiltonian                  GFN2-xTB          :
          :  restarted?                      false          :
          :  GBSA solvation                  false          :
          :  PC potential                    false          :
          :  electronic temp.          300.0000000     K    :
          :  accuracy                    1.0000000          :
          :  -> integral cutoff          0.2500000E+02      :
          :  -> integral neglect         0.1000000E-07      :
          :  -> SCF convergence          0.1000000E-05 Eh   :
          :  -> wf. convergence          0.1000000E-03 e    :
          :  Broyden damping             0.4000000          :
          ...................................................

 iter      E             dE          RMSdq      gap      omega  full diag
   1    -25.8759703 -0.258760E+02  0.505E+00    1.59       0.0  T
   2    -25.8922529 -0.162826E-01  0.302E+00    1.12       1.0  T
   3    -25.8398677  0.523852E-01  0.221E+00    1.80       1.0  T
   4    -25.9028519 -0.629843E-01  0.349E-01    1.30       1.0  T
   5    -25.9036150 -0.763107E-03  0.198E-01    1.30       1.0  T
   6    -25.9041378 -0.522791E-03  0.624E-02    1.30       1.0  T
   7    -25.9041790 -0.411770E-04  0.320E-02    1.31       1.0  T
   8    -25.9041798 -0.794659E-06  0.177E-02    1.30       1.3  T
   9    -25.9041836 -0.379481E-05  0.458E-03    1.30       5.2  T
  10    -25.9041838 -0.221850E-06  0.146E-03    1.30      16.1  T
  11    -25.9041838 -0.243832E-07  0.422E-04    1.30      55.8  T
  12    -25.9041838 -0.358423E-09  0.653E-05    1.30     361.0  T

   *** convergence criteria satisfied after 12 iterations ***

         #    Occupation            Energy/Eh            Energy/eV
      -------------------------------------------------------------
         1        2.0000           -0.6487883             -17.6544
       ...           ...                  ...                  ...
        18        2.0000           -0.4465783             -12.1520
        19        2.0000           -0.4429015             -12.0520
        20        2.0000           -0.4197077             -11.4208
        21        2.0000           -0.4152429             -11.2993
        22        2.0000           -0.4120247             -11.2118
        23        2.0000           -0.4016528             -10.9295
        24        2.0000           -0.3502831              -9.5317 (HOMO)
        25                         -0.3024446              -8.2299 (LUMO)
        26                         -0.2117414              -5.7618
        27                         -0.1864205              -5.0728
        28                         -0.1185021              -3.2246
        29                         -0.0727884              -1.9807
       ...                                ...                  ...
        48                          0.7532880              20.4980
      -------------------------------------------------------------
                  HL-Gap            0.0478386 Eh            1.3018 eV
             Fermi-level           -0.3263639 Eh           -8.8808 eV

 SCC (total)                   0 d,  0 h,  0 min,  0.019 sec
 SCC setup                      ...        0 min,  0.000 sec (  1.125%)
 Dispersion                     ...        0 min,  0.000 sec (  1.137%)
 integral evaluation            ...        0 min,  0.004 sec ( 21.904%)
 zeroth order Hamiltonian       ...        0 min,  0.000 sec (  0.454%)
 iterations                     ...        0 min,  0.008 sec ( 39.678%)
 molecular gradient             ...        0 min,  0.007 sec ( 34.214%)
 printout                       ...        0 min,  0.000 sec (  1.252%)

         :::::::::::::::::::::::::::::::::::::::::::::::::::::
         ::                     SUMMARY                     ::
         :::::::::::::::::::::::::::::::::::::::::::::::::::::
         :: total energy             -25.405937088859 Eh    ::
         :: gradient norm              0.048898435338 Eh/a0 ::
         :: HOMO-LUMO gap              1.301753348334 eV    ::
         ::.................................................::
         :: SCC energy               -25.904183849128 Eh    ::
         :: -> isotropic ES            0.001853918987 Eh    ::
         :: -> anisotropic ES          0.003467982616 Eh    ::
         :: -> anisotropic XC          0.018773317816 Eh    ::
         :: -> dispersion             -0.016203004856 Eh    ::
         :: repulsion energy           0.498241722993 Eh    ::
         :: add. restraining           0.000000000000 Eh    ::
         :::::::::::::::::::::::::::::::::::::::::::::::::::::

      ----------------------------------------------------------- 
     |                   =====================                   |
     |                        A N C O P T                        |
     |                   =====================                   |
     |               Approximate Normal Coordinate               |
     |                Rational Function Optimizer                |
      ----------------------------------------------------------- 

          ...................................................
          :                      SETUP                      :
          :.................................................:
          :   optimization level            normal          :
          :   max. optcycles                   200          :
          :   ANC micro-cycles                  20          :
          :   degrees of freedom                48          :
          :.................................................:
          :   RF solver                   davidson          :
          :   input Hessian                  false          :
          :   write xtbopt.log                true          :
          :   linear?                        false          :
          :   energy convergence         0.5000000E-05 Eh   :
          :   grad. convergence          0.1000000E-02 Eh/α :
          :   maximium RF displ.         2.0000000          :
          :   Hlow (freq-cutoff)         0.5000000E-02      :
          :   Hmax (freq-cutoff)         5.0000000          :
          :   S6 in model hess.         20.0000000          :
          ...................................................

generating ANC from model Hessian ...
Using Lindh-Hessian (1995)
 Shifting diagonal of input Hessian by   1.426722396133305E-003
 Lowest  eigenvalues of input Hessian
   -0.000000   -0.000000   -0.000000    0.000000    0.000000    0.000000
    0.005000    0.007404    0.013350    0.014105    0.018263    0.020265
    0.021701    0.032927    0.046975    0.053822    0.056064    0.059923
 Highest eigenvalues
    1.758850    1.768368    1.805689    1.945244    2.058982    2.087932
 

........................................................................
.............................. CYCLE    1 ..............................
........................................................................
   1    -25.9041838 -0.259042E+02  0.361E-05    1.30       0.0  T
   2    -25.9041838 -0.139622E-11  0.232E-05    1.30    1016.1  T
   3    -25.9041838 -0.428457E-11  0.147E-05    1.30    1602.4  T
     SCC iter.                  ...        0 min,  0.002 sec
     gradient                   ...        0 min,  0.007 sec
 * total energy  :   -25.4059371 Eh     change       -0.1987878E-08 Eh
   gradient norm :     0.0488984 Eh/α   predicted     0.0000000E+00 (-100.00%)
   displ. norm   :     0.1658448 α      lambda       -0.4088800E-02
   maximum displ.:     0.1262574 α      in ANC's #11, #25, #17, ...

........................................................................
.............................. CYCLE    2 ..............................
........................................................................
   1    -25.9101849 -0.259102E+02  0.121E-01    1.17       0.0  T
   2    -25.9101853 -0.461928E-06  0.975E-02    1.14       1.0  T
   3    -25.9102614 -0.760407E-04  0.507E-02    1.16       1.0  T
   4    -25.9102637 -0.235392E-05  0.227E-02    1.15       1.0  T
   5    -25.9102715 -0.779009E-05  0.647E-03    1.16       3.6  T
   6    -25.9102718 -0.327670E-06  0.310E-03    1.16       7.6  T
   7    -25.9102718  0.141249E-07  0.228E-03    1.16      10.3  T
     SCC iter.                  ...        0 min,  0.004 sec
     gradient                   ...        0 min,  0.007 sec
 * total energy  :   -25.4084383 Eh     change       -0.2501161E-02 Eh
   gradient norm :     0.0180319 Eh/α   predicted    -0.2100631E-02 ( -16.01%)
   displ. norm   :     0.0524942 α      lambda       -0.4060352E-03
   maximum displ.:     0.0331022 α      in ANC's #5, #11, #17, ...

........................................................................
.............................. CYCLE    3 ..............................
........................................................................
   1    -25.9117709 -0.259118E+02  0.451E-02    1.11       0.0  T
   2    -25.9117710 -0.142314E-06  0.318E-02    1.10       1.0  T
   3    -25.9117753 -0.422644E-05  0.206E-02    1.11       1.1  T
   4    -25.9117773 -0.209059E-05  0.694E-03    1.10       3.4  T
   5    -25.9117781 -0.736521E-06  0.186E-03    1.10      12.7  T
   6    -25.9117781 -0.199047E-07  0.115E-03    1.10      20.5  T
     SCC iter.                  ...        0 min,  0.004 sec
     gradient                   ...        0 min,  0.007 sec
 * total energy  :   -25.4086696 Eh     change       -0.2313186E-03 Eh
   gradient norm :     0.0054442 Eh/α   predicted    -0.2035764E-03 ( -11.99%)
   displ. norm   :     0.0204806 α      lambda       -0.3737326E-04
   maximum displ.:     0.0169932 α      in ANC's #5, #15, #42, ...

........................................................................
.............................. CYCLE    4 ..............................
........................................................................
   1    -25.9113726 -0.259114E+02  0.130E-02    1.09       0.0  T
   2    -25.9113725  0.161954E-07  0.794E-03    1.09       3.0  T
   3    -25.9113718  0.775634E-06  0.819E-03    1.09       2.9  T
   4    -25.9113726 -0.840615E-06  0.193E-03    1.09      12.2  T
   5    -25.9113727 -0.483891E-07  0.341E-04    1.09      69.0  T
     SCC iter.                  ...        0 min,  0.003 sec
     gradient                   ...        0 min,  0.007 sec
 * total energy  :   -25.4086944 Eh     change       -0.2486707E-04 Eh
   gradient norm :     0.0018135 Eh/α   predicted    -0.1869350E-04 ( -24.83%)
   displ. norm   :     0.0225250 α      lambda       -0.1043431E-04
   maximum displ.:     0.0170615 α      in ANC's #5, #15, #17, ...

........................................................................
.............................. CYCLE    5 ..............................
........................................................................
   1    -25.9109474 -0.259109E+02  0.125E-02    1.09       0.0  T
   2    -25.9109474 -0.416289E-07  0.779E-03    1.09       3.0  T
   3    -25.9109469  0.539791E-06  0.642E-03    1.09       3.7  T
   4    -25.9109474 -0.571052E-06  0.188E-03    1.09      12.6  T
   5    -25.9109475 -0.416892E-07  0.519E-04    1.09      45.4  T
   6    -25.9109475 -0.305089E-08  0.267E-04    1.09      88.4  T
     SCC iter.                  ...        0 min,  0.003 sec
     gradient                   ...        0 min,  0.006 sec
 * total energy  :   -25.4086996 Eh     change       -0.5158660E-05 Eh
   gradient norm :     0.0011400 Eh/α   predicted    -0.5218077E-05 (   1.15%)
   displ. norm   :     0.0052383 α      lambda       -0.1552318E-05
   maximum displ.:     0.0024994 α      in ANC's #8, #10, #5, ...

........................................................................
.............................. CYCLE    6 ..............................
........................................................................
   1    -25.9111418 -0.259111E+02  0.449E-03    1.09       0.0  T
   2    -25.9111418 -0.789427E-09  0.269E-03    1.09       8.8  T
   3    -25.9111417  0.417125E-07  0.173E-03    1.09      13.6  T
   4    -25.9111418 -0.428427E-07  0.365E-04    1.09      64.6  T
   5    -25.9111418 -0.165086E-08  0.937E-05    1.09     251.4  T
     SCC iter.                  ...        0 min,  0.003 sec
     gradient                   ...        0 min,  0.006 sec
 * total energy  :   -25.4087004 Eh     change       -0.8401906E-06 Eh
   gradient norm :     0.0002816 Eh/α   predicted    -0.7756326E-06 (  -7.68%)
   displ. norm   :     0.0047411 α      lambda       -0.6921606E-06
   maximum displ.:     0.0029472 α      in ANC's #8, #10, #15, ...

   *** GEOMETRY OPTIMIZATION CONVERGED AFTER 6 ITERATIONS ***

------------------------------------------------------------------------
 total energy gain   :        -0.0027633 Eh       -1.7340 kcal/mol
 total RMSD          :         0.0525092 a0        0.0278 Å
 total power (kW/mol):        -1.2091948 (step)  -77.4174 (real)
------------------------------------------------------------------------

 ANCopt (total)                0 d,  0 h,  0 min,  0.094 sec
 optimizer setup                ...        0 min,  0.000 sec (  0.108%)
 model hessian                  ...        0 min,  0.002 sec (  2.128%)
 ANC generation                 ...        0 min,  0.000 sec (  0.445%)
 coordinate transformation      ...        0 min,  0.000 sec (  0.082%)
 single point calculation       ...        0 min,  0.089 sec ( 95.053%)
 optimization log               ...        0 min,  0.000 sec (  0.501%)
 hessian update                 ...        0 min,  0.000 sec (  0.064%)
 rational function              ...        0 min,  0.001 sec (  1.181%)

================
 final structure:
================
$coord
    2.97902278135531   -2.23920008600186    0.00180193143959      C 
    0.53826518465450   -1.43861811806205    0.00085972694323      C 
   -1.80462664135782   -2.76814618069214    0.00226924317722      C 
   -3.99040907719399   -1.44325811421427    0.00105541109019      C 
   -4.01578936062593    1.26530256164029   -0.00199531516960      C 
   -1.85515745546313    2.63093526978352   -0.00360790722596      C 
    0.51214353496426    1.34543972276087   -0.00212971205021      C 
    2.93752538150089    2.19183722754173   -0.00276632276008      C 
    4.59913239369042   -0.00810102646589   -0.00153967043185      C 
    7.12854742417191    0.01453994602288   -0.00150850836390      C 
    3.66525870367544   -4.14801344492575    0.00398033452130      H 
   -1.79107193761934   -4.81004891447982    0.00438626142900      H 
   -5.78768284625456   -2.41330809438900    0.00233442650962      H 
   -5.83086317662836    2.20156351971153   -0.00251766268541      H 
   -1.88000739023692    4.67271830019122   -0.00549334532355      H 
    3.58733565898143    4.11338369506186   -0.00455537132733      H 
    8.18037664152273    1.75852080574840   -0.00088164555446      H 
    8.21042609992100   -1.71101166005691    0.00299488635840      H 
$end
           -------------------------------------------------
          |                Final Singlepoint                |
           -------------------------------------------------

          ...................................................
          :                      SETUP                      :
          :.................................................:
          :  # basis functions                  48          :
          :  # atomic orbitals                  48          :
          :  # shells                           28          :
          :  # electrons                        48          :
          :  max. iterations                   250          :
          :  Hamiltonian                  GFN2-xTB          :
          :  restarted?                      false          :
          :  GBSA solvation                  false          :
          :  PC potential                    false          :
          :  electronic temp.          300.0000000     K    :
          :  accuracy                    1.0000000          :
          :  -> integral cutoff          0.2500000E+02      :
          :  -> integral neglect         0.1000000E-07      :
          :  -> SCF convergence          0.1000000E-05 Eh   :
          :  -> wf. convergence          0.1000000E-03 e    :
          :  Broyden damping             0.4000000          :
          ...................................................

 iter      E             dE          RMSdq      gap      omega  full diag
   1    -25.9111418 -0.259111E+02  0.600E-05    1.09       0.0  T
   2    -25.9111418  0.159623E-10  0.438E-05    1.09     537.7  T
   3    -25.9111418 -0.304148E-10  0.353E-05    1.09     667.2  T

   *** convergence criteria satisfied after 3 iterations ***

         #    Occupation            Energy/Eh            Energy/eV
      -------------------------------------------------------------
         1        2.0000           -0.6470974             -17.6084
       ...           ...                  ...                  ...
        18        2.0000           -0.4470770             -12.1656
        19        2.0000           -0.4432316             -12.0609
        20        2.0000           -0.4211293             -11.4595
        21        2.0000           -0.4141423             -11.2694
        22        2.0000           -0.4099044             -11.1541
        23        2.0000           -0.4031247             -10.9696
        24        2.0000           -0.3465967              -9.4314 (HOMO)
        25                         -0.3063947              -8.3374 (LUMO)
        26                         -0.2116299              -5.7587
        27                         -0.1852425              -5.0407
        28                         -0.1196491              -3.2558
        29                         -0.0696540              -1.8954
       ...                                ...                  ...
        48                          0.7433774              20.2283
      -------------------------------------------------------------
                  HL-Gap            0.0402020 Eh            1.0940 eV
             Fermi-level           -0.3264957 Eh           -8.8844 eV

 SCC (total)                   0 d,  0 h,  0 min,  0.014 sec
 SCC setup                      ...        0 min,  0.000 sec (  0.990%)
 Dispersion                     ...        0 min,  0.000 sec (  0.806%)
 integral evaluation            ...        0 min,  0.004 sec ( 28.527%)
 zeroth order Hamiltonian       ...        0 min,  0.000 sec (  0.505%)
 iterations                     ...        0 min,  0.002 sec ( 15.393%)
 molecular gradient             ...        0 min,  0.007 sec ( 51.847%)
 printout                       ...        0 min,  0.000 sec (  1.643%)

         :::::::::::::::::::::::::::::::::::::::::::::::::::::
         ::                     SUMMARY                     ::
         :::::::::::::::::::::::::::::::::::::::::::::::::::::
         :: total energy             -25.408700443823 Eh    ::
         :: gradient norm              0.000281480545 Eh/a0 ::
         :: HOMO-LUMO gap              1.093952815462 eV    ::
         ::.................................................::
         :: SCC energy               -25.911141756334 Eh    ::
         :: -> isotropic ES            0.001951467347 Eh    ::
         :: -> anisotropic ES          0.003357610119 Eh    ::
         :: -> anisotropic XC          0.018390640980 Eh    ::
         :: -> dispersion             -0.016206214951 Eh    ::
         :: repulsion energy           0.502439047381 Eh    ::
         :: add. restraining           0.000000000000 Eh    ::
         :::::::::::::::::::::::::::::::::::::::::::::::::::::

           -------------------------------------------------
          |                Property Printout                |
           -------------------------------------------------

    * Orbital Energies and Occupations

         #    Occupation            Energy/Eh            Energy/eV
      -------------------------------------------------------------
         1        2.0000           -0.6470974             -17.6084
       ...           ...                  ...                  ...
        12        2.0000           -0.5000487             -13.6070
        13        2.0000           -0.4874794             -13.2650
        14        2.0000           -0.4853211             -13.2063
        15        2.0000           -0.4711570             -12.8208
        16        2.0000           -0.4614078             -12.5555
        17        2.0000           -0.4515017             -12.2860
        18        2.0000           -0.4470770             -12.1656
        19        2.0000           -0.4432316             -12.0609
        20        2.0000           -0.4211293             -11.4595
        21        2.0000           -0.4141423             -11.2694
        22        2.0000           -0.4099044             -11.1541
        23        2.0000           -0.4031247             -10.9696
        24        2.0000           -0.3465967              -9.4314 (HOMO)
        25                         -0.3063947              -8.3374 (LUMO)
        26                         -0.2116299              -5.7587
        27                         -0.1852425              -5.0407
        28                         -0.1196491              -3.2558
        29                         -0.0696540              -1.8954
        30                          0.0978649               2.6630
        31                          0.0979506               2.6654
        32                          0.1128903               3.0719
        33                          0.1384843               3.7683
        34                          0.1595756               4.3423
        35                          0.1686179               4.5883
       ...                                ...                  ...
        48                          0.7433774              20.2283
      -------------------------------------------------------------
                  HL-Gap            0.0402020 Eh            1.0940 eV
             Fermi-level           -0.3264957 Eh           -8.8844 eV

     #   Z        covCN         q      C6AA      α(0)
     1   6 C      2.978    -0.066    29.636     8.930
     2   6 C      3.082     0.009    27.733     8.633
     3   6 C      2.902    -0.034    28.838     8.805
     4   6 C      2.914    -0.028    28.711     8.787
     5   6 C      2.914    -0.028    28.711     8.787
     6   6 C      2.902    -0.034    28.838     8.805
     7   6 C      3.082     0.009    27.732     8.633
     8   6 C      2.978    -0.066    29.637     8.930
     9   6 C      3.076     0.029    27.277     8.563
    10   6 C      2.840    -0.062    29.543     8.908
    11   1 H      0.926     0.027     2.626     2.534
    12   1 H      0.926     0.028     2.619     2.531
    13   1 H      0.926     0.026     2.639     2.540
    14   1 H      0.926     0.026     2.639     2.540
    15   1 H      0.926     0.028     2.619     2.531
    16   1 H      0.926     0.027     2.626     2.534
    17   1 H      0.926     0.055     2.261     2.351
    18   1 H      0.926     0.055     2.260     2.351

 Mol. C6AA /au·bohr⁶  :       4389.732225
 Mol. C8AA /au·bohr⁸  :     110308.790586
 Mol. α(0) /au        :        107.692589


Wiberg/Mayer (AO) data.
largest (>0.10) Wiberg bond orders for each atom
          total WBO             WBO to atom ...
     1  C   3.984        C    2 1.610    C    9 1.089    H   11 0.972    C    8 0.143
     2  C   3.988        C    1 1.610    C    3 1.177    C    7 1.049
     3  C   3.992        C    4 1.678    C    2 1.177    H   12 0.968    C    6 0.116
     4  C   3.966        C    3 1.678    C    5 1.190    H   13 0.972
     5  C   3.966        C    6 1.678    C    4 1.190    H   14 0.972
     6  C   3.992        C    5 1.678    C    7 1.177    H   15 0.968    C    3 0.116
     7  C   3.988        C    8 1.610    C    6 1.177    C    2 1.049
     8  C   3.984        C    7 1.610    C    9 1.090    H   16 0.972    C    1 0.143
     9  C   3.984        C   10 1.761    C    8 1.090    C    1 1.089
    10  C   3.931        C    9 1.761    H   17 0.975    H   18 0.975
    11  H   0.999        C    1 0.972
    12  H   0.999        C    3 0.968
    13  H   0.999        C    4 0.972
    14  H   0.999        C    5 0.972
    15  H   0.999        C    6 0.968
    16  H   0.999        C    8 0.972
    17  H   0.996        C   10 0.975
    18  H   0.996        C   10 0.975

molecular dipole:
                 x           y           z       tot (Debye)
 q only:        0.347       0.003       0.000
   full:        0.374       0.003       0.000       0.951
molecular quadrupole (traceless):
                xx          xy          yy          xz          yz          zz
 q only:        4.408       0.022      -1.021       0.002      -0.002      -3.386
  q+dip:        8.502       0.034       1.513       0.005      -0.012     -10.015
   full:        5.847       0.025      -0.203       0.005      -0.005      -5.643

           -------------------------------------------------
          |                Geometry Summary                 |
           -------------------------------------------------

      molecular mass/u    :      128.1732000
   center of mass at/Å    :        0.3833041      -0.0236777      -0.0003739
  moments of inertia/u·Å² :        0.1344510E+03   0.4806039E+03   0.6150549E+03
rotational constants/cm⁻¹ :        0.1253812E+00   0.3507594E-01   0.2740834E-01

 * 16 selected distances

     #   Z        #   Z                                     value/Å
     1   6 C      2   6 C                                 1.3592987
     2   6 C      3   6 C                                 1.4255203
     3   6 C      4   6 C                                 1.3525604
     4   6 C      5   6 C                                 1.4333726 (max)
     5   6 C      6   6 C                                 1.3525926
     6   6 C      7   6 C                                 1.4255033
     7   6 C      8   6 C                                 1.3593642
     9   6 C     10   6 C                                 1.3385625
     1   6 C     11   1 H                                 1.0733944 (min)
     3   6 C     12   1 H                                 1.0805529
     4   6 C     13   1 H                                 1.0807649
     5   6 C     14   1 H                                 1.0807502
     6   6 C     15   1 H                                 1.0805456
     8   6 C     16   1 H                                 1.0734081
    10   6 C     17   1 H                                 1.0777321
    10   6 C     18   1 H                                 1.0777576

 * 2 distinct bonds (by element types)

   Z      Z             #   av. dist./Å        max./Å        min./Å
   1 H    6 C           8     1.0781132     1.0807649     1.0733944
   6 C    6 C           8     1.3808468     1.4333726     1.3385625


optimized geometry written to: xtbopt.xyz


           -------------------------------------------------
          | TOTAL ENERGY              -25.408700443823 Eh   |
          | GRADIENT NORM               0.000281480545 Eh/α |
          | HOMO-LUMO GAP               1.093952815462 eV   |
           -------------------------------------------------

------------------------------------------------------------------------
 * finished run on 2021/05/19 at 10:58:46.896     
------------------------------------------------------------------------
 total:
 * wall-time:     0 d,  0 h,  0 min,  0.143 sec
 *  cpu-time:     0 d,  0 h,  0 min,  0.142 sec
 * ratio c/w:     0.998 speedup
 SCF:
 * wall-time:     0 d,  0 h,  0 min,  0.019 sec
 *  cpu-time:     0 d,  0 h,  0 min,  0.019 sec
 * ratio c/w:     1.000 speedup
 ANC optimizer:
 * wall-time:     0 d,  0 h,  0 min,  0.108 sec
 *  cpu-time:     0 d,  0 h,  0 min,  0.108 sec
 * ratio c/w:     1.000 speedup

