      -----------------------------------------------------------      
     |                   =====================                   |     
     |                           x T B                           |     
     |                   =====================                   |     
     |                         S. Grimme                         |     
     |          Mulliken Center for Theoretical Chemistry        |     
     |                    University of Bonn                     |     
     |                Version 6.2 RC2 (SAW190805)                |     
      -----------------------------------------------------------      

   This program is distributed in the hope that it will be useful,
   but WITHOUT ANY WARRANTY; without even the implied warranty of
   MERCHANTABILITY or FITNESS FOR A PARTICULAR PURPOSE.
   
   FOR NON-COMMERCIAL, ACADEMIA USE ONLY.
   
   Cite this work as:
   * S. Grimme, C. Bannwarth, P. Shushkov, J. Chem. Theory Comput., 2017,
     13, 1989-2009. DOI: 10.1021/acs.jctc.7b00118
   * C. Bannwarth, S. Ehlert and S. Grimme., J. Chem. Theory Comput., 2019,
     15, 1652-1671. DOI: 10.1021/acs.jctc.8b01176
   * P. Pracht, E. Caldeweyher, S. Ehlert, S. Grimme, ChemRxiv, 2019, preprint.
     DOI: 10.26434/chemrxiv.8326202.v1
   
   for DFT-D4:
   * E. Caldeweyher, C. Bannwarth and S. Grimme, J. Chem. Phys., 2017,
     147, 034112. DOI: 10.1063/1.4993215
   * E. Caldeweyher, S. Ehlert, A. Hansen, H. Neugebauer, S. Spicher,
     C. Bannwarth and S. Grimme, J. Chem. Phys., 2019, 150, 154122.
     DOI: 10.1063/1.5090222
   
   for sTDA-xTB:
   * S. Grimme and C. Bannwarth, J. Chem. Phys., 2016, 145, 054103.
     DOI: 10.1063/1.4959605
   
   in the mass-spec context:
   * V. Asgeirsson, C. Bauer and S. Grimme, Chem. Sci., 2017, 8, 4879.
     DOI: 10.1039/c7sc00601b
   
   for metadynamics refer to:
   * S. Grimme, J. Chem. Theory Comput., 2019, 155, 2847-2862
     DOI: 10.1021/acs.jctc.9b00143
   
   with help from (in alphabetical order)
   C. Bannwarth, F. Bohle, G. Brandenburg, E. Caldeweyher, M. Checinski,
   S. Dohm, S. Ehlert, S. Ehrlich, F. März, H. Neugebauer, J. Pisarek,
   P. Pracht, P. Shushkov, and S. Spicher.
   
 * started run on 2021/05/19 at 11:00:25.942     

           -------------------------------------------------
          |                Calculation Setup                |
           -------------------------------------------------

          program call               : /ihome/ghutchison/geoffh/xtb/xtb 735.xyz -opt
          hostname                   : smp-n83
          coordinate file            : 735.xyz
          omp threads                :                     1
          number of atoms            :                    29
          number of electrons        :                    84
          charge                     :                     0
          spin                       :                   0.0
          first test random number   :      0.61491105159160


########################################################################
# WARNING! Please study the warnings concerning your input carefully
#  - the use of '-opt' is discouraged, please use '--opt' next time
########################################################################

           ------------------------------------------------- 
          |                 G F N 2 - x T B                 |
          | Geometry, Frequencies, Noncovalent interactions |
          |            JCTC 2019 parametrisation            |
           ------------------------------------------------- 
             KAB for C  - Si     :                1.0500
             KAB for H  - Pd     :                0.9500
             k(s)              :                1.8500
             k(p)              :                2.2300
             k(d)              :                2.2300
             k(f)              :                2.0000
             kEN (H0ij)        :               -2.0000
             D4 a1             :                0.5200
             D4 a2             :                5.0000
             D4 s6             :                1.0000
             D4 s8             :                2.7000
             D4 s9             :                5.0000
             alphaj            :                2.0000

  Z AO/shell   Hii/eV     exponent
  1     Wed Apr 25 08:07:45 CEST 2018   EN: 2.200 GM2: 0.406  GM3: 0.0800  RAES: 1.40
     1s    -10.707211    1.230000
  6     Wed Apr 25 08:07:45 CEST 2018   EN: 2.550 GM2: 0.538  GM3: 0.1500  RAES: 3.00
     2s    -13.970922    2.096432
     2p    -10.063292    1.800000
  7     Wed Apr 25 08:07:45 CEST 2018   EN: 3.040 GM2: 0.461  GM3:-0.0640  RAES: 1.90
     2s    -16.686243    2.339881
     2p    -12.523956    2.014332
  8     Wed Apr 25 08:07:45 CEST 2018   EN: 3.440 GM2: 0.452  GM3:-0.0517  RAES: 1.80
     2s    -20.229985    2.439742
     2p    -15.503117    2.137023
 16     Tue Apr 24 11:44:34 CEST 2018   EN: 2.580 GM2: 0.340  GM3:-0.0502  RAES: 3.10
     3s    -20.029654    1.981333
     3p    -11.377694    2.025643
     3d     -0.420282    1.702555

           ------------------------------------------------- 
          |        Self-Consistent Charge Iterations        |
           ------------------------------------------------- 

          ...................................................
          :                      SETUP                      :
          :.................................................:
          :  # basis functions                  83          :
          :  # atomic orbitals                  82          :
          :  # shells                           46          :
          :  # electrons                        84          :
          :  max. iterations                   250          :
          :  Hamiltonian                  GFN2-xTB          :
          :  restarted?                      false          :
          :  GBSA solvation                  false          :
          :  PC potential                    false          :
          :  electronic temp.          300.0000000     K    :
          :  accuracy                    1.0000000          :
          :  -> integral cutoff          0.2500000E+02      :
          :  -> integral neglect         0.1000000E-07      :
          :  -> SCF convergence          0.1000000E-05 Eh   :
          :  -> wf. convergence          0.1000000E-03 e    :
          :  Broyden damping             0.4000000          :
          ...................................................

 iter      E             dE          RMSdq      gap      omega  full diag
   1    -46.7234291 -0.467234E+02  0.427E+00    1.77       0.0  T
   2    -46.7717823 -0.483533E-01  0.255E+00    1.72       1.0  T
   3    -46.7595116  0.122707E-01  0.125E+00    1.52       1.0  T
   4    -46.7797722 -0.202606E-01  0.549E-01    1.45       1.0  T
   5    -46.7853582 -0.558601E-02  0.200E-01    1.46       1.0  T
   6    -46.7860112 -0.653005E-03  0.114E-01    1.47       1.0  T
   7    -46.7862174 -0.206275E-03  0.496E-02    1.47       1.0  T
   8    -46.7862676 -0.501644E-04  0.194E-02    1.47       1.0  T
   9    -46.7862719 -0.425290E-05  0.927E-03    1.47       2.0  T
  10    -46.7862724 -0.515266E-06  0.434E-03    1.47       4.3  T
  11    -46.7862727 -0.271977E-06  0.193E-03    1.47       9.6  T
  12    -46.7862727 -0.302159E-07  0.550E-04    1.47      33.7  T
  13    -46.7862727 -0.203222E-08  0.271E-04    1.47      68.6  T

   *** convergence criteria satisfied after 13 iterations ***

         #    Occupation            Energy/Eh            Energy/eV
      -------------------------------------------------------------
         1        2.0000           -0.7528957             -20.4873
       ...           ...                  ...                  ...
        36        2.0000           -0.4368865             -11.8883
        37        2.0000           -0.4330683             -11.7844
        38        2.0000           -0.4153795             -11.3031
        39        2.0000           -0.4015077             -10.9256
        40        2.0000           -0.3867112             -10.5229
        41        2.0000           -0.3816300             -10.3847
        42        2.0000           -0.3766431             -10.2490 (HOMO)
        43                         -0.3225162              -8.7761 (LUMO)
        44                         -0.2599084              -7.0725
        45                         -0.2328616              -6.3365
        46                         -0.2186465              -5.9497
        47                         -0.1947234              -5.2987
       ...                                ...                  ...
        82                          0.6862830              18.6747
      -------------------------------------------------------------
                  HL-Gap            0.0541268 Eh            1.4729 eV
             Fermi-level           -0.3495796 Eh           -9.5125 eV

 SCC (total)                   0 d,  0 h,  0 min,  0.067 sec
 SCC setup                      ...        0 min,  0.000 sec (  0.564%)
 Dispersion                     ...        0 min,  0.000 sec (  0.691%)
 integral evaluation            ...        0 min,  0.027 sec ( 39.832%)
 zeroth order Hamiltonian       ...        0 min,  0.000 sec (  0.390%)
 iterations                     ...        0 min,  0.020 sec ( 29.762%)
 molecular gradient             ...        0 min,  0.019 sec ( 28.008%)
 printout                       ...        0 min,  0.000 sec (  0.666%)

         :::::::::::::::::::::::::::::::::::::::::::::::::::::
         ::                     SUMMARY                     ::
         :::::::::::::::::::::::::::::::::::::::::::::::::::::
         :: total energy             -46.200709694944 Eh    ::
         :: gradient norm              0.121569799959 Eh/a0 ::
         :: HOMO-LUMO gap              1.472865924658 eV    ::
         ::.................................................::
         :: SCC energy               -46.786272685046 Eh    ::
         :: -> isotropic ES            0.053339559025 Eh    ::
         :: -> anisotropic ES          0.002092933712 Eh    ::
         :: -> anisotropic XC          0.030725535041 Eh    ::
         :: -> dispersion             -0.030424742703 Eh    ::
         :: repulsion energy           0.585384027502 Eh    ::
         :: add. restraining           0.000000000000 Eh    ::
         :::::::::::::::::::::::::::::::::::::::::::::::::::::

      ----------------------------------------------------------- 
     |                   =====================                   |
     |                        A N C O P T                        |
     |                   =====================                   |
     |               Approximate Normal Coordinate               |
     |                Rational Function Optimizer                |
      ----------------------------------------------------------- 

          ...................................................
          :                      SETUP                      :
          :.................................................:
          :   optimization level            normal          :
          :   max. optcycles                   200          :
          :   ANC micro-cycles                  20          :
          :   degrees of freedom                81          :
          :.................................................:
          :   RF solver                   davidson          :
          :   input Hessian                  false          :
          :   write xtbopt.log                true          :
          :   linear?                        false          :
          :   energy convergence         0.5000000E-05 Eh   :
          :   grad. convergence          0.1000000E-02 Eh/α :
          :   maximium RF displ.         2.0000000          :
          :   Hlow (freq-cutoff)         0.5000000E-02      :
          :   Hmax (freq-cutoff)         5.0000000          :
          :   S6 in model hess.         20.0000000          :
          ...................................................

generating ANC from model Hessian ...
Using Lindh-Hessian (1995)
 Shifting diagonal of input Hessian by   4.313071943073156E-003
 Lowest  eigenvalues of input Hessian
   -0.000000   -0.000000   -0.000000    0.000000    0.000000    0.000000
    0.005000    0.005876    0.006548    0.007200    0.007810    0.008961
    0.009432    0.010710    0.012166    0.015150    0.018129    0.021190
 Highest eigenvalues
    1.649839    1.775460    1.889359    1.933946    2.018238    2.107024
 

........................................................................
.............................. CYCLE    1 ..............................
........................................................................
   1    -46.7862727 -0.467863E+02  0.137E-04    1.47       0.0  T
   2    -46.7862727  0.407709E-10  0.105E-04    1.47     177.5  T
   3    -46.7862727 -0.222954E-09  0.724E-05    1.47     256.5  T
     SCC iter.                  ...        0 min,  0.005 sec
     gradient                   ...        0 min,  0.019 sec
 * total energy  :   -46.2007097 Eh     change        0.2450108E-08 Eh
   gradient norm :     0.1215700 Eh/α   predicted     0.0000000E+00 (-100.00%)
   displ. norm   :     0.2044055 α      lambda       -0.1461469E-01
   maximum displ.:     0.0886199 α      in ANC's #52, #6, #45, ...

........................................................................
.............................. CYCLE    2 ..............................
........................................................................
   1    -46.8193781 -0.468194E+02  0.296E-01    1.45       0.0  T
   2    -46.8194570 -0.788522E-04  0.183E-01    1.45       1.0  T
   3    -46.8192972  0.159768E-03  0.136E-01    1.44       1.0  T
   4    -46.8196879 -0.390659E-03  0.370E-02    1.43       1.0  T
   5    -46.8197243 -0.364231E-04  0.129E-02    1.43       1.4  T
   6    -46.8197275 -0.324094E-05  0.486E-03    1.43       3.8  T
   7    -46.8197276 -0.535307E-07  0.250E-03    1.43       7.4  T
     SCC iter.                  ...        0 min,  0.010 sec
     gradient                   ...        0 min,  0.017 sec
 * total energy  :   -46.2111185 Eh     change       -0.1040881E-01 Eh
   gradient norm :     0.0594718 Eh/α   predicted    -0.7612661E-02 ( -26.86%)
   displ. norm   :     0.2148292 α      lambda       -0.5440528E-02
   maximum displ.:     0.1330421 α      in ANC's #6, #52, #4, ...

........................................................................
.............................. CYCLE    3 ..............................
........................................................................
   1    -46.8388833 -0.468389E+02  0.267E-01    1.40       0.0  T
   2    -46.8389526 -0.693691E-04  0.155E-01    1.40       1.0  T
   3    -46.8387564  0.196260E-03  0.115E-01    1.39       1.0  T
   4    -46.8390654 -0.309047E-03  0.279E-02    1.39       1.0  T
   5    -46.8390837 -0.182930E-04  0.115E-02    1.38       1.6  T
   6    -46.8390860 -0.223901E-05  0.475E-03    1.38       3.9  T
   7    -46.8390861 -0.164866E-06  0.194E-03    1.38       9.6  T
     SCC iter.                  ...        0 min,  0.010 sec
     gradient                   ...        0 min,  0.018 sec
 * total energy  :   -46.2139121 Eh     change       -0.2793558E-02 Eh
   gradient norm :     0.0134276 Eh/α   predicted    -0.2845813E-02 (   1.87%)
   displ. norm   :     0.1863849 α      lambda       -0.5988322E-03
   maximum displ.:     0.1450679 α      in ANC's #6, #4, #3, ...

........................................................................
.............................. CYCLE    4 ..............................
........................................................................
   1    -46.8364952 -0.468365E+02  0.115E-01    1.38       0.0  T
   2    -46.8365000 -0.483312E-05  0.649E-02    1.38       1.0  T
   3    -46.8364910  0.900171E-05  0.219E-02    1.38       1.0  T
   4    -46.8365020 -0.109637E-04  0.627E-03    1.38       3.0  T
   5    -46.8365020  0.227468E-07  0.397E-03    1.38       4.7  T
   6    -46.8365023 -0.297942E-06  0.155E-03    1.38      12.0  T
   7    -46.8365023 -0.577088E-07  0.402E-04    1.38      46.2  T
     SCC iter.                  ...        0 min,  0.010 sec
     gradient                   ...        0 min,  0.018 sec
 * total energy  :   -46.2143834 Eh     change       -0.4713292E-03 Eh
   gradient norm :     0.0063063 Eh/α   predicted    -0.3098192E-03 ( -34.27%)
   displ. norm   :     0.2975614 α      lambda       -0.5907512E-03
   maximum displ.:     0.2055644 α      in ANC's #6, #3, #4, ...

........................................................................
.............................. CYCLE    5 ..............................
........................................................................
   1    -46.8336918 -0.468337E+02  0.173E-01    1.37       0.0  T
   2    -46.8336992 -0.739769E-05  0.976E-02    1.37       1.0  T
   3    -46.8336919  0.731252E-05  0.223E-02    1.38       1.0  T
   4    -46.8337012 -0.937636E-05  0.888E-03    1.37       2.1  T
   5    -46.8337018 -0.599794E-06  0.266E-03    1.37       7.0  T
   6    -46.8337019 -0.111445E-06  0.835E-04    1.38      22.2  T
     SCC iter.                  ...        0 min,  0.009 sec
     gradient                   ...        0 min,  0.018 sec
 * total energy  :   -46.2147965 Eh     change       -0.4131042E-03 Eh
   gradient norm :     0.0075177 Eh/α   predicted    -0.3215312E-03 ( -22.17%)
   displ. norm   :     0.2629389 α      lambda       -0.3550773E-03
   maximum displ.:     0.1759420 α      in ANC's #6, #3, #4, ...

........................................................................
.............................. CYCLE    6 ..............................
........................................................................
   1    -46.8331901 -0.468332E+02  0.155E-01    1.37       0.0  T
   2    -46.8331945 -0.437520E-05  0.882E-02    1.38       1.0  T
   3    -46.8331907  0.379717E-05  0.177E-02    1.38       1.0  T
   4    -46.8331945 -0.374371E-05  0.996E-03    1.38       1.9  T
   5    -46.8331957 -0.127712E-05  0.352E-03    1.38       5.3  T
   6    -46.8331960 -0.260261E-06  0.151E-03    1.38      12.3  T
   7    -46.8331961 -0.563900E-07  0.398E-04    1.38      46.6  T
     SCC iter.                  ...        0 min,  0.010 sec
     gradient                   ...        0 min,  0.017 sec
 * total energy  :   -46.2150445 Eh     change       -0.2480567E-03 Eh
   gradient norm :     0.0103732 Eh/α   predicted    -0.1898143E-03 ( -23.48%)
   displ. norm   :     0.2996297 α      lambda       -0.3892384E-03
   maximum displ.:     0.1982938 α      in ANC's #6, #3, #4, ...

........................................................................
.............................. CYCLE    7 ..............................
........................................................................
   1    -46.8337183 -0.468337E+02  0.167E-01    1.38       0.0  T
   2    -46.8337238 -0.550641E-05  0.939E-02    1.38       1.0  T
   3    -46.8337237  0.836942E-07  0.132E-02    1.38       1.4  T
   4    -46.8337237 -0.130530E-07  0.902E-03    1.38       2.1  T
   5    -46.8337255 -0.174731E-05  0.275E-03    1.38       6.8  T
   6    -46.8337256 -0.125289E-06  0.131E-03    1.38      14.1  T
     SCC iter.                  ...        0 min,  0.009 sec
     gradient                   ...        0 min,  0.017 sec
 * total energy  :   -46.2153204 Eh     change       -0.2758384E-03 Eh
   gradient norm :     0.0097714 Eh/α   predicted    -0.2120987E-03 ( -23.11%)
   displ. norm   :     0.2950372 α      lambda       -0.4306821E-03
   maximum displ.:     0.1705609 α      in ANC's #6, #3, #2, ...

........................................................................
.............................. CYCLE    8 ..............................
........................................................................
   1    -46.8371101 -0.468371E+02  0.170E-01    1.38       0.0  T
   2    -46.8371165 -0.643742E-05  0.968E-02    1.39       1.0  T
   3    -46.8371002  0.163596E-04  0.292E-02    1.38       1.0  T
   4    -46.8371185 -0.183439E-04  0.105E-02    1.38       1.8  T
   5    -46.8371190 -0.443734E-06  0.654E-03    1.39       2.8  T
   6    -46.8371199 -0.947295E-06  0.135E-03    1.39      13.7  T
   7    -46.8371199 -0.289765E-07  0.607E-04    1.38      30.6  T
     SCC iter.                  ...        0 min,  0.010 sec
     gradient                   ...        0 min,  0.017 sec
 * total energy  :   -46.2156094 Eh     change       -0.2890561E-03 Eh
   gradient norm :     0.0049719 Eh/α   predicted    -0.2340866E-03 ( -19.02%)
   displ. norm   :     0.3659456 α      lambda       -0.3073672E-03
   maximum displ.:     0.1995343 α      in ANC's #6, #3, #2, ...

........................................................................
.............................. CYCLE    9 ..............................
........................................................................
   1    -46.8360060 -0.468360E+02  0.190E-01    1.38       0.0  T
   2    -46.8360118 -0.585374E-05  0.109E-01    1.38       1.0  T
   3    -46.8360108  0.103488E-05  0.157E-02    1.38       1.2  T
   4    -46.8360119 -0.116351E-05  0.105E-02    1.38       1.8  T
   5    -46.8360135 -0.160456E-05  0.446E-03    1.38       4.2  T
   6    -46.8360140 -0.473808E-06  0.118E-03    1.38      15.8  T
   7    -46.8360140 -0.214623E-07  0.593E-04    1.38      31.3  T
     SCC iter.                  ...        0 min,  0.010 sec
     gradient                   ...        0 min,  0.017 sec
 * total energy  :   -46.2157568 Eh     change       -0.1473113E-03 Eh
   gradient norm :     0.0088802 Eh/α   predicted    -0.1742693E-03 (  18.30%)
   displ. norm   :     0.1514278 α      lambda       -0.2867419E-03
   maximum displ.:     0.0903495 α      in ANC's #2, #5, #3, ...

........................................................................
.............................. CYCLE   10 ..............................
........................................................................
   1    -46.8403501 -0.468404E+02  0.872E-02    1.38       0.0  T
   2    -46.8403523 -0.221522E-05  0.483E-02    1.38       1.0  T
   3    -46.8403332  0.190986E-04  0.308E-02    1.38       1.0  T
   4    -46.8403540 -0.207753E-04  0.772E-03    1.38       2.4  T
   5    -46.8403546 -0.618921E-06  0.353E-03    1.38       5.3  T
   6    -46.8403548 -0.192251E-06  0.145E-03    1.38      12.8  T
   7    -46.8403548 -0.385328E-07  0.382E-04    1.38      48.7  T
     SCC iter.                  ...        0 min,  0.010 sec
     gradient                   ...        0 min,  0.017 sec
 * total energy  :   -46.2159006 Eh     change       -0.1438276E-03 Eh
   gradient norm :     0.0073561 Eh/α   predicted    -0.1466593E-03 (   1.97%)
   displ. norm   :     0.2412876 α      lambda       -0.1989945E-03
   maximum displ.:     0.1218306 α      in ANC's #2, #3, #1, ...

........................................................................
.............................. CYCLE   11 ..............................
........................................................................
   1    -46.8385023 -0.468385E+02  0.126E-01    1.37       0.0  T
   2    -46.8385048 -0.256592E-05  0.721E-02    1.37       1.0  T
   3    -46.8384929  0.119646E-04  0.245E-02    1.38       1.0  T
   4    -46.8385059 -0.130609E-04  0.759E-03    1.37       2.4  T
   5    -46.8385060 -0.766894E-07  0.452E-03    1.37       4.1  T
   6    -46.8385066 -0.596593E-06  0.975E-04    1.37      19.1  T
   7    -46.8385066 -0.143617E-07  0.434E-04    1.37      42.8  T
     SCC iter.                  ...        0 min,  0.010 sec
     gradient                   ...        0 min,  0.017 sec
 * total energy  :   -46.2160202 Eh     change       -0.1196635E-03 Eh
   gradient norm :     0.0063237 Eh/α   predicted    -0.1052940E-03 ( -12.01%)
   displ. norm   :     0.2428124 α      lambda       -0.1591468E-03
   maximum displ.:     0.1371986 α      in ANC's #2, #3, #5, ...

........................................................................
.............................. CYCLE   12 ..............................
........................................................................
   1    -46.8370074 -0.468370E+02  0.111E-01    1.38       0.0  T
   2    -46.8370098 -0.237489E-05  0.643E-02    1.37       1.0  T
   3    -46.8370078  0.201756E-05  0.122E-02    1.38       1.5  T
   4    -46.8370104 -0.258428E-05  0.598E-03    1.37       3.1  T
   5    -46.8370106 -0.266040E-06  0.277E-03    1.37       6.7  T
   6    -46.8370108 -0.155239E-06  0.108E-03    1.38      17.2  T
     SCC iter.                  ...        0 min,  0.009 sec
     gradient                   ...        0 min,  0.018 sec
 * total energy  :   -46.2161135 Eh     change       -0.9328477E-04 Eh
   gradient norm :     0.0064482 Eh/α   predicted    -0.8427309E-04 (  -9.66%)
   displ. norm   :     0.1947787 α      lambda       -0.1591641E-03
   maximum displ.:     0.1166877 α      in ANC's #2, #5, #1, ...

........................................................................
.............................. CYCLE   13 ..............................
........................................................................
   1    -46.8364742 -0.468365E+02  0.100E-01    1.37       0.0  T
   2    -46.8364765 -0.223886E-05  0.577E-02    1.37       1.0  T
   3    -46.8364577  0.187264E-04  0.273E-02    1.38       1.0  T
   4    -46.8364781 -0.204155E-04  0.675E-03    1.38       2.8  T
   5    -46.8364784 -0.272168E-06  0.382E-03    1.38       4.9  T
   6    -46.8364786 -0.213363E-06  0.110E-03    1.38      16.9  T
   7    -46.8364786 -0.133521E-07  0.470E-04    1.38      39.5  T
     SCC iter.                  ...        0 min,  0.010 sec
     gradient                   ...        0 min,  0.018 sec
 * total energy  :   -46.2161943 Eh     change       -0.8073048E-04 Eh
   gradient norm :     0.0052363 Eh/α   predicted    -0.8260965E-04 (   2.33%)
   displ. norm   :     0.1251638 α      lambda       -0.9729723E-04
   maximum displ.:     0.0726560 α      in ANC's #2, #5, #1, ...

........................................................................
.............................. CYCLE   14 ..............................
........................................................................
   1    -46.8388560 -0.468389E+02  0.751E-02    1.38       0.0  T
   2    -46.8388579 -0.182171E-05  0.416E-02    1.38       1.0  T
   3    -46.8388547  0.312923E-05  0.136E-02    1.38       1.4  T
   4    -46.8388584 -0.367531E-05  0.537E-03    1.38       3.5  T
   5    -46.8388586 -0.164602E-06  0.305E-03    1.38       6.1  T
   6    -46.8388588 -0.207396E-06  0.795E-04    1.38      23.3  T
   7    -46.8388588 -0.738889E-08  0.354E-04    1.38      52.4  T
     SCC iter.                  ...        0 min,  0.010 sec
     gradient                   ...        0 min,  0.018 sec
 * total energy  :   -46.2162341 Eh     change       -0.3987865E-04 Eh
   gradient norm :     0.0055515 Eh/α   predicted    -0.4941177E-04 (  23.91%)
   displ. norm   :     0.2211657 α      lambda       -0.9063971E-04
   maximum displ.:     0.1245087 α      in ANC's #2, #3, #1, ...

........................................................................
.............................. CYCLE   15 ..............................
........................................................................
   1    -46.8374836 -0.468375E+02  0.106E-01    1.38       0.0  T
   2    -46.8374854 -0.183872E-05  0.612E-02    1.38       1.0  T
   3    -46.8374794  0.602438E-05  0.169E-02    1.38       1.1  T
   4    -46.8374860 -0.658863E-05  0.629E-03    1.38       3.0  T
   5    -46.8374862 -0.259095E-06  0.347E-03    1.38       5.4  T
   6    -46.8374865 -0.295910E-06  0.869E-04    1.38      21.4  T
   7    -46.8374865 -0.103295E-07  0.388E-04    1.38      47.9  T
     SCC iter.                  ...        0 min,  0.010 sec
     gradient                   ...        0 min,  0.017 sec
 * total energy  :   -46.2162819 Eh     change       -0.4773019E-04 Eh
   gradient norm :     0.0036781 Eh/α   predicted    -0.4753973E-04 (  -0.40%)
   displ. norm   :     0.0771123 α      lambda       -0.5132793E-04
   maximum displ.:     0.0472727 α      in ANC's #2, #1, #11, ...

........................................................................
.............................. CYCLE   16 ..............................
........................................................................
   1    -46.8383546 -0.468384E+02  0.400E-02    1.38       0.0  T
   2    -46.8383551 -0.482634E-06  0.230E-02    1.38       1.0  T
   3    -46.8383542  0.896877E-06  0.643E-03    1.38       2.9  T
   4    -46.8383553 -0.108429E-05  0.210E-03    1.38       8.8  T
   5    -46.8383553 -0.517141E-07  0.867E-04    1.38      21.4  T
   6    -46.8383553 -0.210339E-08  0.534E-04    1.38      34.7  T
     SCC iter.                  ...        0 min,  0.009 sec
     gradient                   ...        0 min,  0.019 sec
 * total energy  :   -46.2163143 Eh     change       -0.3242493E-04 Eh
   gradient norm :     0.0023319 Eh/α   predicted    -0.2581801E-04 ( -20.38%)
   displ. norm   :     0.1149702 α      lambda       -0.3007000E-04
   maximum displ.:     0.0779433 α      in ANC's #2, #1, #3, ...

........................................................................
.............................. CYCLE   17 ..............................
........................................................................
   1    -46.8386548 -0.468387E+02  0.539E-02    1.38       0.0  T
   2    -46.8386554 -0.562076E-06  0.314E-02    1.38       1.0  T
   3    -46.8386555 -0.154914E-06  0.290E-03    1.38       6.4  T
   4    -46.8386555  0.173843E-07  0.228E-03    1.38       8.1  T
   5    -46.8386556 -0.804657E-07  0.106E-03    1.38      17.5  T
   6    -46.8386556 -0.190098E-07  0.348E-04    1.38      53.3  T
   7    -46.8386556 -0.148105E-08  0.154E-04    1.38     120.9  T
     SCC iter.                  ...        0 min,  0.011 sec
     gradient                   ...        0 min,  0.018 sec
 * total energy  :   -46.2163356 Eh     change       -0.2130468E-04 Eh
   gradient norm :     0.0022596 Eh/α   predicted    -0.1523557E-04 ( -28.49%)
   displ. norm   :     0.1055361 α      lambda       -0.2135779E-04
   maximum displ.:     0.0735405 α      in ANC's #2, #1, #4, ...

........................................................................
.............................. CYCLE   18 ..............................
........................................................................
   1    -46.8388580 -0.468389E+02  0.513E-02    1.38       0.0  T
   2    -46.8388585 -0.454816E-06  0.301E-02    1.38       1.0  T
   3    -46.8388577  0.725289E-06  0.605E-03    1.38       3.1  T
   4    -46.8388587 -0.955832E-06  0.190E-03    1.38       9.8  T
   5    -46.8388587 -0.503178E-08  0.114E-03    1.38      16.3  T
   6    -46.8388587 -0.257541E-07  0.262E-04    1.38      70.8  T
   7    -46.8388587 -0.896939E-09  0.133E-04    1.38     139.5  T
     SCC iter.                  ...        0 min,  0.010 sec
     gradient                   ...        0 min,  0.019 sec
 * total energy  :   -46.2163511 Eh     change       -0.1546867E-04 Eh
   gradient norm :     0.0018277 Eh/α   predicted    -0.1080094E-04 ( -30.18%)
   displ. norm   :     0.1257179 α      lambda       -0.1338921E-04
   maximum displ.:     0.0902331 α      in ANC's #2, #1, #4, ...

........................................................................
.............................. CYCLE   19 ..............................
........................................................................
   1    -46.8388952 -0.468389E+02  0.636E-02    1.38       0.0  T
   2    -46.8388960 -0.778876E-06  0.374E-02    1.38       1.0  T
   3    -46.8388944  0.160631E-05  0.843E-03    1.38       2.2  T
   4    -46.8388964 -0.198640E-05  0.264E-03    1.38       7.0  T
   5    -46.8388964 -0.360883E-07  0.176E-03    1.38      10.5  T
   6    -46.8388965 -0.468750E-07  0.551E-04    1.38      33.7  T
   7    -46.8388965 -0.490077E-08  0.179E-04    1.38     103.7  T
     SCC iter.                  ...        0 min,  0.010 sec
     gradient                   ...        0 min,  0.019 sec
 * total energy  :   -46.2163632 Eh     change       -0.1212198E-04 Eh
   gradient norm :     0.0013498 Eh/α   predicted    -0.6743524E-05 ( -44.37%)
   displ. norm   :     0.1262771 α      lambda        0.7834109E-05
   maximum displ.:     0.0902321 α      in ANC's #2, #1, #4, ...

........................................................................
.............................. CYCLE   20 ..............................
........................................................................
   1    -46.8386502 -0.468387E+02  0.638E-02    1.38       0.0  T
   2    -46.8386510 -0.790065E-06  0.375E-02    1.38       1.0  T
   3    -46.8386495  0.156790E-05  0.837E-03    1.38       2.2  T
   4    -46.8386514 -0.194542E-05  0.265E-03    1.38       7.0  T
   5    -46.8386514 -0.387798E-07  0.176E-03    1.38      10.6  T
   6    -46.8386515 -0.455605E-07  0.569E-04    1.38      32.7  T
   7    -46.8386515 -0.533321E-08  0.179E-04    1.38     103.6  T
     SCC iter.                  ...        0 min,  0.010 sec
     gradient                   ...        0 min,  0.019 sec
 * total energy  :   -46.2163595 Eh     change        0.3642081E-05 Eh
   gradient norm :     0.0022089 Eh/α   predicted     0.3940321E-05 (   8.19%)
   displ. norm   :     0.0842021 α      lambda        0.2651880E-04
   maximum displ.:     0.0601547 α      in ANC's #2, #1, #4, ...
 * RMSD in coord.:     0.5842706 α      energy gain  -0.1564985E-01 Eh

generating ANC from model Hessian ...
Using Lindh-Hessian (1995)
 Shifting diagonal of input Hessian by   4.315392710504045E-003
 Lowest  eigenvalues of input Hessian
   -0.000000   -0.000000    0.000000    0.000000    0.000000    0.000000
    0.005000    0.006034    0.006918    0.007596    0.007773    0.008832
    0.009305    0.011033    0.011859    0.015543    0.017774    0.022880
 Highest eigenvalues
    1.794992    1.813045    1.936876    2.036025    2.064642    2.208973
 

........................................................................
.............................. CYCLE   21 ..............................
........................................................................
   1    -46.8383382 -0.468383E+02  0.426E-02    1.38       0.0  T
   2    -46.8383386 -0.356625E-06  0.251E-02    1.38       1.0  T
   3    -46.8383379  0.683406E-06  0.555E-03    1.38       3.3  T
   4    -46.8383387 -0.849223E-06  0.178E-03    1.38      10.4  T
   5    -46.8383388 -0.192367E-07  0.117E-03    1.38      15.9  T
   6    -46.8383388 -0.195216E-07  0.392E-04    1.38      47.3  T
   7    -46.8383388 -0.258150E-08  0.120E-04    1.38     154.9  T
     SCC iter.                  ...        0 min,  0.011 sec
     gradient                   ...        0 min,  0.019 sec
 * total energy  :   -46.2163480 Eh     change        0.1159434E-04 Eh
   gradient norm :     0.0031138 Eh/α   predicted     0.0000000E+00 (-100.00%)
   displ. norm   :     0.0373690 α      lambda       -0.3399239E-04
   maximum displ.:     0.0152270 α      in ANC's #7, #3, #5, ...

........................................................................
.............................. CYCLE   22 ..............................
........................................................................
   1    -46.8388116 -0.468388E+02  0.209E-02    1.38       0.0  T
   2    -46.8388117 -0.153897E-06  0.122E-02    1.38       1.5  T
   3    -46.8388107  0.105335E-05  0.644E-03    1.38       2.9  T
   4    -46.8388118 -0.115574E-05  0.167E-03    1.38      11.1  T
   5    -46.8388118 -0.259095E-07  0.110E-03    1.38      16.9  T
   6    -46.8388119 -0.219152E-07  0.293E-04    1.38      63.3  T
   7    -46.8388119 -0.106714E-08  0.131E-04    1.38     142.2  T
     SCC iter.                  ...        0 min,  0.010 sec
     gradient                   ...        0 min,  0.019 sec
 * total energy  :   -46.2163681 Eh     change       -0.2014880E-04 Eh
   gradient norm :     0.0014929 Eh/α   predicted    -0.1702006E-04 ( -15.53%)
   displ. norm   :     0.0568445 α      lambda       -0.1956619E-04
   maximum displ.:     0.0203075 α      in ANC's #3, #7, #5, ...

........................................................................
.............................. CYCLE   23 ..............................
........................................................................
   1    -46.8393289 -0.468393E+02  0.340E-02    1.38       0.0  T
   2    -46.8393293 -0.353634E-06  0.199E-02    1.38       1.0  T
   3    -46.8393264  0.286639E-05  0.105E-02    1.38       1.8  T
   4    -46.8393296 -0.315255E-05  0.245E-03    1.38       7.6  T
   5    -46.8393296 -0.641770E-07  0.161E-03    1.38      11.5  T
   6    -46.8393297 -0.431152E-07  0.477E-04    1.38      39.0  T
   7    -46.8393297 -0.241455E-08  0.208E-04    1.38      89.4  T
     SCC iter.                  ...        0 min,  0.011 sec
     gradient                   ...        0 min,  0.019 sec
 * total energy  :   -46.2163793 Eh     change       -0.1124784E-04 Eh
   gradient norm :     0.0018025 Eh/α   predicted    -0.9797599E-05 ( -12.89%)
   displ. norm   :     0.0323252 α      lambda       -0.8768076E-05
   maximum displ.:     0.0185055 α      in ANC's #3, #5, #14, ...

........................................................................
.............................. CYCLE   24 ..............................
........................................................................
   1    -46.8390458 -0.468390E+02  0.211E-02    1.38       0.0  T
   2    -46.8390459 -0.856154E-07  0.122E-02    1.38       1.5  T
   3    -46.8390456  0.290685E-06  0.365E-03    1.38       5.1  T
   4    -46.8390460 -0.323640E-06  0.122E-03    1.38      15.2  T
   5    -46.8390460 -0.134947E-07  0.536E-04    1.38      34.6  T
   6    -46.8390460 -0.455471E-08  0.191E-04    1.38      97.4  T
     SCC iter.                  ...        0 min,  0.009 sec
     gradient                   ...        0 min,  0.019 sec
 * total energy  :   -46.2163879 Eh     change       -0.8531611E-05 Eh
   gradient norm :     0.0009926 Eh/α   predicted    -0.4386735E-05 ( -48.58%)
   displ. norm   :     0.0421930 α      lambda       -0.5677860E-05
   maximum displ.:     0.0261551 α      in ANC's #3, #5, #2, ...

........................................................................
.............................. CYCLE   25 ..............................
........................................................................
   1    -46.8387778 -0.468388E+02  0.264E-02    1.38       0.0  T
   2    -46.8387780 -0.175611E-06  0.149E-02    1.38       1.2  T
   3    -46.8387778  0.147648E-06  0.309E-03    1.38       6.0  T
   4    -46.8387780 -0.201815E-06  0.140E-03    1.38      13.3  T
   5    -46.8387780 -0.177471E-07  0.524E-04    1.38      35.4  T
   6    -46.8387780 -0.464402E-08  0.243E-04    1.38      76.5  T
     SCC iter.                  ...        0 min,  0.009 sec
     gradient                   ...        0 min,  0.019 sec
 * total energy  :   -46.2163934 Eh     change       -0.5478507E-05 Eh
   gradient norm :     0.0006340 Eh/α   predicted    -0.2842807E-05 ( -48.11%)
   displ. norm   :     0.0426917 α      lambda       -0.2945167E-05
   maximum displ.:     0.0265621 α      in ANC's #3, #5, #2, ...

........................................................................
.............................. CYCLE   26 ..............................
........................................................................
   1    -46.8388318 -0.468388E+02  0.246E-02    1.38       0.0  T
   2    -46.8388319 -0.871123E-07  0.143E-02    1.38       1.3  T
   3    -46.8388319 -0.207026E-07  0.126E-03    1.38      14.8  T
   4    -46.8388319 -0.703233E-08  0.847E-04    1.38      21.9  T
   5    -46.8388319 -0.109574E-07  0.339E-04    1.38      54.8  T
     SCC iter.                  ...        0 min,  0.008 sec
     gradient                   ...        0 min,  0.018 sec
 * total energy  :   -46.2163966 Eh     change       -0.3291837E-05 Eh
   gradient norm :     0.0005530 Eh/α   predicted    -0.1475007E-05 ( -55.19%)
   displ. norm   :     0.0400128 α      lambda       -0.2107414E-05
   maximum displ.:     0.0244829 α      in ANC's #3, #2, #5, ...

   *** GEOMETRY OPTIMIZATION CONVERGED AFTER 26 ITERATIONS ***

------------------------------------------------------------------------
 total energy gain   :        -0.0156870 Eh       -9.8437 kcal/mol
 total RMSD          :         0.5702637 a0        0.3018 Å
 total power (kW/mol):        -1.5840805 (step)  -37.1970 (real)
------------------------------------------------------------------------

 ANCopt (total)                0 d,  0 h,  0 min,  1.107 sec
 optimizer setup                ...        0 min,  0.000 sec (  0.014%)
 model hessian                  ...        0 min,  0.012 sec (  1.124%)
 ANC generation                 ...        0 min,  0.002 sec (  0.163%)
 coordinate transformation      ...        0 min,  0.001 sec (  0.054%)
 single point calculation       ...        0 min,  1.081 sec ( 97.673%)
 optimization log               ...        0 min,  0.003 sec (  0.269%)
 hessian update                 ...        0 min,  0.000 sec (  0.037%)
 rational function              ...        0 min,  0.006 sec (  0.512%)

================
 final structure:
================
$coord
   -1.62233188205508    2.41038497410831   -0.11639872131660      C 
   -3.98126271571827    0.21890280182694    0.05433133016621      S 
   -1.91772412591692   -2.31742099802203    0.14624511548118      C 
    0.55741113660405   -1.44080015776203    0.04554108542368      C 
    0.71068810244880    1.26968841166015   -0.10849905145526      C 
    2.97686502654411    2.45513818882786   -0.22377849737896      N 
    5.00099166386116    1.04916651294246   -0.19211412616532      C 
    7.51879744464448    2.34771989955527   -0.30161709422465      C 
    7.31428813344964    5.12462328501429   -1.11704873250220      C 
    5.99665024528476    6.62116840651163    0.61995777335868      O 
    4.84331701922085   -1.66272432161138   -0.00937400734742      C 
    7.18910190439860   -3.28519595282979    0.08718745379302      C 
    6.72816033095917   -5.96298664074306    0.39053720242259      N 
    2.68528081419968   -2.84962735671214    0.10313804710671      N 
   -2.88292143632558   -4.84531944086458    0.30031328817888      C 
   -1.44821222481462   -6.91330787632674    0.36214959686808      C 
   -2.05037360280004    4.38536974028040   -0.21771316375852      H 
    8.76384911157028    1.34609736408315   -1.60606014520379      H 
    8.37628574593918    2.26275014869541    1.57887200625186      H 
    6.41326770291394    5.20987229444506   -2.98889294924444      H 
    9.20832290400794    5.93745907862439   -1.26066202265328      H 
    4.31691047321782    5.89571880022242    0.74630336970489      H 
    8.38233369316150   -2.64888170946098    1.65516892158809      H 
    8.26695232689481   -3.01545351675898   -1.66138339035606      H 
    5.73375796829149   -6.26425096418198    2.00385847597735      H 
    5.63599085467503   -6.59142365268609   -1.05641982351973      H 
   -4.92243913458427   -4.98854292543781    0.36717815359220      H 
    0.57836215502453   -6.78171105763183    0.29776777460902      H 
   -2.27183716160723   -8.76787925665822    0.47964932091702      H 
$end
           -------------------------------------------------
          |                Final Singlepoint                |
           -------------------------------------------------

          ...................................................
          :                      SETUP                      :
          :.................................................:
          :  # basis functions                  83          :
          :  # atomic orbitals                  82          :
          :  # shells                           46          :
          :  # electrons                        84          :
          :  max. iterations                   250          :
          :  Hamiltonian                  GFN2-xTB          :
          :  restarted?                      false          :
          :  GBSA solvation                  false          :
          :  PC potential                    false          :
          :  electronic temp.          300.0000000     K    :
          :  accuracy                    1.0000000          :
          :  -> integral cutoff          0.2500000E+02      :
          :  -> integral neglect         0.1000000E-07      :
          :  -> SCF convergence          0.1000000E-05 Eh   :
          :  -> wf. convergence          0.1000000E-03 e    :
          :  Broyden damping             0.4000000          :
          ...................................................

 iter      E             dE          RMSdq      gap      omega  full diag
   1    -46.8388319 -0.468388E+02  0.248E-04    1.38       0.0  T
   2    -46.8388319  0.277417E-09  0.127E-04    1.38     146.6  T
   3    -46.8388319 -0.323439E-09  0.154E-04    1.38     120.7  T

   *** convergence criteria satisfied after 3 iterations ***

         #    Occupation            Energy/Eh            Energy/eV
      -------------------------------------------------------------
         1        2.0000           -0.7500750             -20.4106
       ...           ...                  ...                  ...
        36        2.0000           -0.4399060             -11.9705
        37        2.0000           -0.4279361             -11.6447
        38        2.0000           -0.4118011             -11.2057
        39        2.0000           -0.4046156             -11.0102
        40        2.0000           -0.3813083             -10.3759
        41        2.0000           -0.3794913             -10.3265
        42        2.0000           -0.3610917              -9.8258 (HOMO)
        43                         -0.3103544              -8.4452 (LUMO)
        44                         -0.2519926              -6.8571
        45                         -0.2272439              -6.1836
        46                         -0.2151407              -5.8543
        47                         -0.1799551              -4.8968
       ...                                ...                  ...
        82                          0.7022569              19.1094
      -------------------------------------------------------------
                  HL-Gap            0.0507373 Eh            1.3806 eV
             Fermi-level           -0.3357230 Eh           -9.1355 eV

 SCC (total)                   0 d,  0 h,  0 min,  0.038 sec
 SCC setup                      ...        0 min,  0.000 sec (  0.684%)
 Dispersion                     ...        0 min,  0.000 sec (  0.715%)
 integral evaluation            ...        0 min,  0.013 sec ( 33.841%)
 zeroth order Hamiltonian       ...        0 min,  0.000 sec (  0.580%)
 iterations                     ...        0 min,  0.005 sec ( 13.597%)
 molecular gradient             ...        0 min,  0.019 sec ( 49.429%)
 printout                       ...        0 min,  0.000 sec (  1.022%)

         :::::::::::::::::::::::::::::::::::::::::::::::::::::
         ::                     SUMMARY                     ::
         :::::::::::::::::::::::::::::::::::::::::::::::::::::
         :: total energy             -46.216396646080 Eh    ::
         :: gradient norm              0.000551714992 Eh/a0 ::
         :: HOMO-LUMO gap              1.380632254645 eV    ::
         ::.................................................::
         :: SCC energy               -46.838831939286 Eh    ::
         :: -> isotropic ES            0.051829807136 Eh    ::
         :: -> anisotropic ES          0.001977184884 Eh    ::
         :: -> anisotropic XC          0.029902173998 Eh    ::
         :: -> dispersion             -0.030618140373 Eh    ::
         :: repulsion energy           0.622270793143 Eh    ::
         :: add. restraining           0.000000000000 Eh    ::
         :::::::::::::::::::::::::::::::::::::::::::::::::::::

           -------------------------------------------------
          |                Property Printout                |
           -------------------------------------------------

    * Orbital Energies and Occupations

         #    Occupation            Energy/Eh            Energy/eV
      -------------------------------------------------------------
         1        2.0000           -0.7500750             -20.4106
       ...           ...                  ...                  ...
        30        2.0000           -0.4747687             -12.9191
        31        2.0000           -0.4680629             -12.7366
        32        2.0000           -0.4631177             -12.6021
        33        2.0000           -0.4581274             -12.4663
        34        2.0000           -0.4480975             -12.1934
        35        2.0000           -0.4457174             -12.1286
        36        2.0000           -0.4399060             -11.9705
        37        2.0000           -0.4279361             -11.6447
        38        2.0000           -0.4118011             -11.2057
        39        2.0000           -0.4046156             -11.0102
        40        2.0000           -0.3813083             -10.3759
        41        2.0000           -0.3794913             -10.3265
        42        2.0000           -0.3610917              -9.8258 (HOMO)
        43                         -0.3103544              -8.4452 (LUMO)
        44                         -0.2519926              -6.8571
        45                         -0.2272439              -6.1836
        46                         -0.2151407              -5.8543
        47                         -0.1799551              -4.8968
        48                         -0.1360356              -3.7017
        49                         -0.1166787              -3.1750
        50                         -0.0180105              -0.4901
        51                          0.0135886               0.3698
        52                          0.0236924               0.6447
        53                          0.0466706               1.2700
       ...                                ...                  ...
        82                          0.7022569              19.1094
      -------------------------------------------------------------
                  HL-Gap            0.0507373 Eh            1.3806 eV
             Fermi-level           -0.3357230 Eh           -9.1355 eV

     #   Z        covCN         q      C6AA      α(0)
     1   6 C      2.922    -0.048    29.191     8.860
     2  16 S      2.370     0.026   140.017    19.916
     3   6 C      2.977     0.006    27.889     8.663
     4   6 C      3.165     0.060    26.325     8.385
     5   6 C      3.172     0.063    26.222     8.365
     6   7 N      1.840    -0.247    27.302     7.744
     7   6 C      2.948     0.089    26.024     8.367
     8   6 C      3.807    -0.081    22.032     6.682
     9   6 C      3.675     0.086    19.377     6.307
    10   8 O      1.655    -0.446    21.763     6.298
    11   6 C      2.949     0.069    26.451     8.435
    12   6 C      3.739     0.012    20.457     6.454
    13   7 N      2.629    -0.333    28.564     7.938
    14   7 N      1.840    -0.237    27.053     7.708
    15   6 C      2.928    -0.027    28.673     8.781
    16   6 C      2.841    -0.087    30.176     9.003
    17   1 H      0.927     0.059     2.211     2.325
    18   1 H      0.924     0.046     2.371     2.408
    19   1 H      0.924     0.065     2.146     2.291
    20   1 H      0.923     0.022     2.699     2.569
    21   1 H      0.924     0.045     2.385     2.415
    22   1 H      0.804     0.307     0.699     1.313
    23   1 H      0.924     0.050     2.323     2.384
    24   1 H      0.924     0.048     2.339     2.392
    25   1 H      0.860     0.148     1.412     1.861
    26   1 H      0.860     0.149     1.406     1.857
    27   1 H      0.925     0.043     2.412     2.429
    28   1 H      0.926     0.067     2.123     2.279
    29   1 H      0.926     0.047     2.357     2.401

 Mol. C6AA /au·bohr⁶  :      11277.557421
 Mol. C8AA /au·bohr⁸  :     291947.588912
 Mol. α(0) /au        :        166.827949


Wiberg/Mayer (AO) data.
largest (>0.10) Wiberg bond orders for each atom
          total WBO             WBO to atom ...
     1  C   3.936        C    5 1.446    S    2 1.242    H   17 0.967    C    3 0.125
     2  S   2.718        C    1 1.242    C    3 1.182
     3  C   3.940        C    4 1.361    S    2 1.182    C   15 1.153    C    1 0.125
     4  C   3.981        C    3 1.361    N   14 1.250    C    5 1.138
     5  C   3.981        C    1 1.446    N    6 1.225    C    4 1.138
     6  N   3.082        C    7 1.574    C    5 1.225
     7  C   3.974        N    6 1.574    C   11 1.163    C    8 1.016
     8  C   3.994        C    7 1.016    C    9 0.990    H   18 0.960    H   19 0.948
     9  C   3.967        O   10 1.017    C    8 0.990    H   21 0.973    H   20 0.969
    10  O   1.958        C    9 1.017    H   22 0.867
    11  C   3.973        N   14 1.568    C    7 1.163    C   12 0.995
    12  C   3.990        N   13 1.039    C   11 0.995    H   23 0.953    H   24 0.950
    13  N   3.013        C   12 1.039    H   25 0.963    H   26 0.962
    14  N   3.072        C   11 1.568    C    4 1.250
    15  C   3.990        C   16 1.838    C    3 1.153    H   27 0.964
    16  C   3.982        C   15 1.838    H   29 0.977    H   28 0.969
    17  H   0.996        C    1 0.967
    18  H   0.995        C    8 0.960
    19  H   0.991        C    8 0.948
    20  H   0.999        C    9 0.969
    21  H   0.997        C    9 0.973
    22  H   0.905        O   10 0.867
    23  H   0.993        C   12 0.953
    24  H   0.993        C   12 0.950
    25  H   0.978        N   13 0.963
    26  H   0.978        N   13 0.962
    27  H   0.998        C   15 0.964
    28  H   0.996        C   16 0.969
    29  H   0.997        C   16 0.977

molecular dipole:
                 x           y           z       tot (Debye)
 q only:       -0.218      -0.716      -0.178
   full:       -0.410      -0.672      -0.289       2.131
molecular quadrupole (traceless):
                xx          xy          yy          xz          yz          zz
 q only:        6.156      -4.793      -5.900      -2.970      -2.266      -0.255
  q+dip:        5.234      -2.803     -10.049      -3.687      -3.123       4.815
   full:        3.524      -2.650     -11.311      -3.990      -2.703       7.788

           -------------------------------------------------
          |                Geometry Summary                 |
           -------------------------------------------------

      molecular mass/u    :      235.3032000
   center of mass at/Å    :        1.1293312      -0.2012224       0.0065497
  moments of inertia/u·Å² :        0.7765816E+03   0.1344573E+04   0.2093697E+04
rotational constants/cm⁻¹ :        0.2170748E-01   0.1253754E-01   0.8051608E-02

 * 27 selected distances

     #   Z        #   Z                                     value/Å
     1   6 C      2  16 S                                 1.7062416
     2  16 S      3   6 C                                 1.7309499 (max)
     3   6 C      4   6 C                                 1.3905284
     1   6 C      5   6 C                                 1.3742554
     4   6 C      5   6 C                                 1.4389312
     5   6 C      6   7 N                                 1.3547494
     6   7 N      7   6 C                                 1.3042741
     8   6 C      9   6 C                                 1.5353388
     9   6 C     10   8 O                                 1.3993721
    12   6 C     13   7 N                                 1.4467992
     4   6 C     14   7 N                                 1.3507959
    11   6 C     14   7 N                                 1.3046681
     3   6 C     15   6 C                                 1.4342181
    15   6 C     16   6 C                                 1.3323072
     1   6 C     17   1 H                                 1.0707244
     8   6 C     18   1 H                                 1.0915649
     8   6 C     19   1 H                                 1.0946099
     9   6 C     20   1 H                                 1.1002442
     9   6 C     21   1 H                                 1.0933236
    10   8 O     22   1 H                                 0.9705414 (min)
    12   6 C     23   1 H                                 1.0956990
    12   6 C     24   1 H                                 1.0963070
    13   7 N     25   1 H                                 1.0154692
    13   7 N     26   1 H                                 1.0153382
    15   6 C     27   1 H                                 1.0825027
    16   6 C     28   1 H                                 1.0752156
    16   6 C     29   1 H                                 1.0756235

 * 7 distinct bonds (by element types)

   Z      Z             #   av. dist./Å        max./Å        min./Å
   1 H    6 C          10     1.0875815     1.1002442     1.0707244
   6 C    6 C           6     1.4175965     1.5353388     1.3323072
   1 H    7 N           2     1.0154037     1.0154692     1.0153382
   6 C    7 N           5     1.3522573     1.4467992     1.3042741
   1 H    8 O           1     0.9705414     0.9705414     0.9705414
   6 C    8 O           1     1.3993721     1.3993721     1.3993721
   6 C   16 S           2     1.7185957     1.7309499     1.7062416


optimized geometry written to: xtbopt.xyz


           -------------------------------------------------
          | TOTAL ENERGY              -46.216396646080 Eh   |
          | GRADIENT NORM               0.000551714992 Eh/α |
          | HOMO-LUMO GAP               1.380632254645 eV   |
           -------------------------------------------------

------------------------------------------------------------------------
 * finished run on 2021/05/19 at 11:00:27.193     
------------------------------------------------------------------------
 total:
 * wall-time:     0 d,  0 h,  0 min,  1.250 sec
 *  cpu-time:     0 d,  0 h,  0 min,  1.225 sec
 * ratio c/w:     0.979 speedup
 SCF:
 * wall-time:     0 d,  0 h,  0 min,  0.067 sec
 *  cpu-time:     0 d,  0 h,  0 min,  0.054 sec
 * ratio c/w:     0.806 speedup
 ANC optimizer:
 * wall-time:     0 d,  0 h,  0 min,  1.146 sec
 *  cpu-time:     0 d,  0 h,  0 min,  1.145 sec
 * ratio c/w:     1.000 speedup

