      -----------------------------------------------------------      
     |                   =====================                   |     
     |                           x T B                           |     
     |                   =====================                   |     
     |                         S. Grimme                         |     
     |          Mulliken Center for Theoretical Chemistry        |     
     |                    University of Bonn                     |     
     |                Version 6.2 RC2 (SAW190805)                |     
      -----------------------------------------------------------      

   This program is distributed in the hope that it will be useful,
   but WITHOUT ANY WARRANTY; without even the implied warranty of
   MERCHANTABILITY or FITNESS FOR A PARTICULAR PURPOSE.
   
   FOR NON-COMMERCIAL, ACADEMIA USE ONLY.
   
   Cite this work as:
   * S. Grimme, C. Bannwarth, P. Shushkov, J. Chem. Theory Comput., 2017,
     13, 1989-2009. DOI: 10.1021/acs.jctc.7b00118
   * C. Bannwarth, S. Ehlert and S. Grimme., J. Chem. Theory Comput., 2019,
     15, 1652-1671. DOI: 10.1021/acs.jctc.8b01176
   * P. Pracht, E. Caldeweyher, S. Ehlert, S. Grimme, ChemRxiv, 2019, preprint.
     DOI: 10.26434/chemrxiv.8326202.v1
   
   for DFT-D4:
   * E. Caldeweyher, C. Bannwarth and S. Grimme, J. Chem. Phys., 2017,
     147, 034112. DOI: 10.1063/1.4993215
   * E. Caldeweyher, S. Ehlert, A. Hansen, H. Neugebauer, S. Spicher,
     C. Bannwarth and S. Grimme, J. Chem. Phys., 2019, 150, 154122.
     DOI: 10.1063/1.5090222
   
   for sTDA-xTB:
   * S. Grimme and C. Bannwarth, J. Chem. Phys., 2016, 145, 054103.
     DOI: 10.1063/1.4959605
   
   in the mass-spec context:
   * V. Asgeirsson, C. Bauer and S. Grimme, Chem. Sci., 2017, 8, 4879.
     DOI: 10.1039/c7sc00601b
   
   for metadynamics refer to:
   * S. Grimme, J. Chem. Theory Comput., 2019, 155, 2847-2862
     DOI: 10.1021/acs.jctc.9b00143
   
   with help from (in alphabetical order)
   C. Bannwarth, F. Bohle, G. Brandenburg, E. Caldeweyher, M. Checinski,
   S. Dohm, S. Ehlert, S. Ehrlich, F. März, H. Neugebauer, J. Pisarek,
   P. Pracht, P. Shushkov, and S. Spicher.
   
 * started run on 2021/05/19 at 10:58:46.912     

           -------------------------------------------------
          |                Calculation Setup                |
           -------------------------------------------------

          program call               : /ihome/ghutchison/geoffh/xtb/xtb 74.xyz -opt
          hostname                   : smp-n58
          coordinate file            : 74.xyz
          omp threads                :                     1
          number of atoms            :                    31
          number of electrons        :                    72
          charge                     :                     0
          spin                       :                   0.0
          first test random number   :      0.31049176649740


########################################################################
# WARNING! Please study the warnings concerning your input carefully
#  - the use of '-opt' is discouraged, please use '--opt' next time
########################################################################

           ------------------------------------------------- 
          |                 G F N 2 - x T B                 |
          | Geometry, Frequencies, Noncovalent interactions |
          |            JCTC 2019 parametrisation            |
           ------------------------------------------------- 
             KAB for C  - Si     :                1.0500
             KAB for H  - Pd     :                0.9500
             k(s)              :                1.8500
             k(p)              :                2.2300
             k(d)              :                2.2300
             k(f)              :                2.0000
             kEN (H0ij)        :               -2.0000
             D4 a1             :                0.5200
             D4 a2             :                5.0000
             D4 s6             :                1.0000
             D4 s8             :                2.7000
             D4 s9             :                5.0000
             alphaj            :                2.0000

  Z AO/shell   Hii/eV     exponent
  1     Wed Apr 25 08:07:45 CEST 2018   EN: 2.200 GM2: 0.406  GM3: 0.0800  RAES: 1.40
     1s    -10.707211    1.230000
  6     Wed Apr 25 08:07:45 CEST 2018   EN: 2.550 GM2: 0.538  GM3: 0.1500  RAES: 3.00
     2s    -13.970922    2.096432
     2p    -10.063292    1.800000
  7     Wed Apr 25 08:07:45 CEST 2018   EN: 3.040 GM2: 0.461  GM3:-0.0640  RAES: 1.90
     2s    -16.686243    2.339881
     2p    -12.523956    2.014332

           ------------------------------------------------- 
          |        Self-Consistent Charge Iterations        |
           ------------------------------------------------- 

          ...................................................
          :                      SETUP                      :
          :.................................................:
          :  # basis functions                  70          :
          :  # atomic orbitals                  70          :
          :  # shells                           44          :
          :  # electrons                        72          :
          :  max. iterations                   250          :
          :  Hamiltonian                  GFN2-xTB          :
          :  restarted?                      false          :
          :  GBSA solvation                  false          :
          :  PC potential                    false          :
          :  electronic temp.          300.0000000     K    :
          :  accuracy                    1.0000000          :
          :  -> integral cutoff          0.2500000E+02      :
          :  -> integral neglect         0.1000000E-07      :
          :  -> SCF convergence          0.1000000E-05 Eh   :
          :  -> wf. convergence          0.1000000E-03 e    :
          :  Broyden damping             0.4000000          :
          ...................................................

 iter      E             dE          RMSdq      gap      omega  full diag
   1    -39.0295686 -0.390296E+02  0.316E+00    4.57       0.0  T
   2    -39.1029830 -0.734144E-01  0.212E+00    4.27       1.0  T
   3    -39.1103362 -0.735326E-02  0.108E+00    4.68       1.0  T
   4    -39.1139907 -0.365445E-02  0.476E-01    4.47       1.0  T
   5    -39.1174027 -0.341200E-02  0.158E-01    4.54       1.0  T
   6    -39.1178436 -0.440933E-03  0.618E-02    4.57       1.0  T
   7    -39.1178940 -0.503750E-04  0.238E-02    4.57       1.0  T
   8    -39.1178938  0.133550E-06  0.105E-02    4.57       1.7  T
   9    -39.1178956 -0.178104E-05  0.190E-03    4.57       9.5  T
  10    -39.1178956 -0.290117E-07  0.874E-04    4.57      20.5  T
  11    -39.1178957 -0.456513E-08  0.414E-04    4.57      43.4  T

   *** convergence criteria satisfied after 11 iterations ***

         #    Occupation            Energy/Eh            Energy/eV
      -------------------------------------------------------------
         1        2.0000           -0.6726585             -18.3040
       ...           ...                  ...                  ...
        30        2.0000           -0.4275086             -11.6331
        31        2.0000           -0.4249822             -11.5644
        32        2.0000           -0.4167465             -11.3402
        33        2.0000           -0.3874809             -10.5439
        34        2.0000           -0.3824496             -10.4070
        35        2.0000           -0.3787779             -10.3071
        36        2.0000           -0.3697790             -10.0622 (HOMO)
        37                         -0.2016984              -5.4885 (LUMO)
        38                         -0.1960355              -5.3344
        39                         -0.1491832              -4.0595
        40                         -0.0101093              -0.2751
        41                          0.0727998               1.9810
       ...                                ...                  ...
        70                          0.6414920              17.4559
      -------------------------------------------------------------
                  HL-Gap            0.1680806 Eh            4.5737 eV
             Fermi-level           -0.2857387 Eh           -7.7753 eV

 SCC (total)                   0 d,  0 h,  0 min,  0.038 sec
 SCC setup                      ...        0 min,  0.000 sec (  0.854%)
 Dispersion                     ...        0 min,  0.000 sec (  1.199%)
 integral evaluation            ...        0 min,  0.009 sec ( 22.700%)
 zeroth order Hamiltonian       ...        0 min,  0.000 sec (  0.465%)
 iterations                     ...        0 min,  0.015 sec ( 38.459%)
 molecular gradient             ...        0 min,  0.013 sec ( 35.257%)
 printout                       ...        0 min,  0.000 sec (  0.938%)

         :::::::::::::::::::::::::::::::::::::::::::::::::::::
         ::                     SUMMARY                     ::
         :::::::::::::::::::::::::::::::::::::::::::::::::::::
         :: total energy             -38.551183862805 Eh    ::
         :: gradient norm              0.053494409415 Eh/a0 ::
         :: HOMO-LUMO gap              4.573706563239 eV    ::
         ::.................................................::
         :: SCC energy               -39.117895651721 Eh    ::
         :: -> isotropic ES            0.013957103567 Eh    ::
         :: -> anisotropic ES          0.007578658695 Eh    ::
         :: -> anisotropic XC          0.028536170827 Eh    ::
         :: -> dispersion             -0.025120173603 Eh    ::
         :: repulsion energy           0.566620736720 Eh    ::
         :: add. restraining           0.000000000000 Eh    ::
         :::::::::::::::::::::::::::::::::::::::::::::::::::::

      ----------------------------------------------------------- 
     |                   =====================                   |
     |                        A N C O P T                        |
     |                   =====================                   |
     |               Approximate Normal Coordinate               |
     |                Rational Function Optimizer                |
      ----------------------------------------------------------- 

          ...................................................
          :                      SETUP                      :
          :.................................................:
          :   optimization level            normal          :
          :   max. optcycles                   200          :
          :   ANC micro-cycles                  20          :
          :   degrees of freedom                87          :
          :.................................................:
          :   RF solver                   davidson          :
          :   input Hessian                  false          :
          :   write xtbopt.log                true          :
          :   linear?                        false          :
          :   energy convergence         0.5000000E-05 Eh   :
          :   grad. convergence          0.1000000E-02 Eh/α :
          :   maximium RF displ.         2.0000000          :
          :   Hlow (freq-cutoff)         0.5000000E-02      :
          :   Hmax (freq-cutoff)         5.0000000          :
          :   S6 in model hess.         20.0000000          :
          ...................................................

generating ANC from model Hessian ...
Using Lindh-Hessian (1995)
 Shifting diagonal of input Hessian by   4.265931690648781E-003
 Lowest  eigenvalues of input Hessian
   -0.000000   -0.000000   -0.000000    0.000000    0.000000    0.000000
    0.005000    0.005198    0.005995    0.006153    0.007408    0.008278
    0.009184    0.009812    0.011236    0.011856    0.013196    0.015676
 Highest eigenvalues
    1.575191    1.737361    1.828852    1.855194    1.978582    2.006465
 

........................................................................
.............................. CYCLE    1 ..............................
........................................................................
   1    -39.1178957 -0.391179E+02  0.144E-04    4.57       0.0  T
   2    -39.1178957 -0.127642E-09  0.833E-05    4.57     215.7  T
   3    -39.1178957 -0.609433E-10  0.538E-05    4.57     334.0  T
     SCC iter.                  ...        0 min,  0.004 sec
     gradient                   ...        0 min,  0.014 sec
 * total energy  :   -38.5511838 Eh     change        0.1504602E-07 Eh
   gradient norm :     0.0534953 Eh/α   predicted     0.0000000E+00 (-100.00%)
   displ. norm   :     0.2397495 α      lambda       -0.5401774E-02
   maximum displ.:     0.1330313 α      in ANC's #9, #8, #32, ...

........................................................................
.............................. CYCLE    2 ..............................
........................................................................
   1    -39.1429605 -0.391430E+02  0.159E-01    4.70       0.0  T
   2    -39.1430383 -0.778027E-04  0.855E-02    4.69       1.0  T
   3    -39.1430338  0.456591E-05  0.396E-02    4.71       1.0  T
   4    -39.1430505 -0.167050E-04  0.126E-02    4.69       1.4  T
   5    -39.1430531 -0.268498E-05  0.462E-03    4.70       3.9  T
   6    -39.1430533 -0.167965E-06  0.236E-03    4.70       7.6  T
     SCC iter.                  ...        0 min,  0.007 sec
     gradient                   ...        0 min,  0.013 sec
 * total energy  :   -38.5545110 Eh     change       -0.3327150E-02 Eh
   gradient norm :     0.0143043 Eh/α   predicted    -0.2856136E-02 ( -14.16%)
   displ. norm   :     0.2000284 α      lambda       -0.7749314E-03
   maximum displ.:     0.1375809 α      in ANC's #9, #8, #10, ...

........................................................................
.............................. CYCLE    3 ..............................
........................................................................
   1    -39.1516802 -0.391517E+02  0.842E-02    4.75       0.0  T
   2    -39.1516972 -0.170217E-04  0.480E-02    4.74       1.0  T
   3    -39.1516942  0.301153E-05  0.221E-02    4.75       1.0  T
   4    -39.1517006 -0.642152E-05  0.590E-03    4.74       3.0  T
   5    -39.1517013 -0.652236E-06  0.215E-03    4.74       8.3  T
   6    -39.1517013 -0.673751E-07  0.904E-04    4.74      19.9  T
     SCC iter.                  ...        0 min,  0.008 sec
     gradient                   ...        0 min,  0.014 sec
 * total energy  :   -38.5550121 Eh     change       -0.5010923E-03 Eh
   gradient norm :     0.0040746 Eh/α   predicted    -0.4029703E-03 ( -19.58%)
   displ. norm   :     0.1902183 α      lambda       -0.2846450E-03
   maximum displ.:     0.1139042 α      in ANC's #8, #9, #10, ...

........................................................................
.............................. CYCLE    4 ..............................
........................................................................
   1    -39.1533188 -0.391533E+02  0.788E-02    4.76       0.0  T
   2    -39.1533226 -0.381974E-05  0.462E-02    4.75       1.0  T
   3    -39.1533198  0.279372E-05  0.124E-02    4.76       1.4  T
   4    -39.1533236 -0.377803E-05  0.249E-03    4.75       7.2  T
   5    -39.1533237 -0.771929E-07  0.127E-03    4.75      14.2  T
   6    -39.1533237 -0.178727E-07  0.518E-04    4.75      34.7  T
     SCC iter.                  ...        0 min,  0.007 sec
     gradient                   ...        0 min,  0.013 sec
 * total energy  :   -38.5552252 Eh     change       -0.2131057E-03 Eh
   gradient norm :     0.0043966 Eh/α   predicted    -0.1474758E-03 ( -30.80%)
   displ. norm   :     0.2774895 α      lambda       -0.2952109E-03
   maximum displ.:     0.1513145 α      in ANC's #8, #10, #9, ...

........................................................................
.............................. CYCLE    5 ..............................
........................................................................
   1    -39.1524925 -0.391525E+02  0.115E-01    4.76       0.0  T
   2    -39.1524951 -0.260464E-05  0.675E-02    4.75       1.0  T
   3    -39.1524936  0.154235E-05  0.937E-03    4.76       1.9  T
   4    -39.1524960 -0.238381E-05  0.249E-03    4.75       7.2  T
   5    -39.1524960 -0.196188E-07  0.140E-03    4.75      12.8  T
     SCC iter.                  ...        0 min,  0.006 sec
     gradient                   ...        0 min,  0.012 sec
 * total energy  :   -38.5554263 Eh     change       -0.2010596E-03 Eh
   gradient norm :     0.0058767 Eh/α   predicted    -0.1589989E-03 ( -20.92%)
   displ. norm   :     0.2977554 α      lambda       -0.2746760E-03
   maximum displ.:     0.1603149 α      in ANC's #8, #10, #7, ...

........................................................................
.............................. CYCLE    6 ..............................
........................................................................
   1    -39.1503957 -0.391504E+02  0.126E-01    4.74       0.0  T
   2    -39.1503971 -0.147766E-05  0.741E-02    4.74       1.0  T
   3    -39.1503973 -0.180645E-06  0.471E-03    4.74       3.8  T
   4    -39.1503976 -0.299657E-06  0.249E-03    4.74       7.2  T
   5    -39.1503977 -0.561892E-07  0.100E-03    4.74      17.9  T
     SCC iter.                  ...        0 min,  0.006 sec
     gradient                   ...        0 min,  0.012 sec
 * total energy  :   -38.5555958 Eh     change       -0.1695307E-03 Eh
   gradient norm :     0.0065143 Eh/α   predicted    -0.1495274E-03 ( -11.80%)
   displ. norm   :     0.2424578 α      lambda       -0.2373755E-03
   maximum displ.:     0.1255601 α      in ANC's #8, #10, #7, ...

........................................................................
.............................. CYCLE    7 ..............................
........................................................................
   1    -39.1501651 -0.391502E+02  0.928E-02    4.73       0.0  T
   2    -39.1501662 -0.112098E-05  0.547E-02    4.73       1.0  T
   3    -39.1501656  0.618361E-06  0.594E-03    4.73       3.0  T
   4    -39.1501665 -0.907959E-06  0.175E-03    4.73      10.3  T
   5    -39.1501666 -0.406406E-07  0.887E-04    4.73      20.3  T
     SCC iter.                  ...        0 min,  0.006 sec
     gradient                   ...        0 min,  0.012 sec
 * total energy  :   -38.5557771 Eh     change       -0.1813633E-03 Eh
   gradient norm :     0.0052893 Eh/α   predicted    -0.1256668E-03 ( -30.71%)
   displ. norm   :     0.2963694 α      lambda       -0.2798624E-03
   maximum displ.:     0.1254935 α      in ANC's #7, #8, #1, ...

........................................................................
.............................. CYCLE    8 ..............................
........................................................................
   1    -39.1519538 -0.391520E+02  0.105E-01    4.73       0.0  T
   2    -39.1519557 -0.188865E-05  0.623E-02    4.73       1.0  T
   3    -39.1519543  0.142952E-05  0.850E-03    4.73       2.1  T
   4    -39.1519563 -0.198139E-05  0.159E-03    4.73      11.3  T
   5    -39.1519563 -0.120937E-07  0.882E-04    4.73      20.4  T
     SCC iter.                  ...        0 min,  0.006 sec
     gradient                   ...        0 min,  0.013 sec
 * total energy  :   -38.5559621 Eh     change       -0.1849262E-03 Eh
   gradient norm :     0.0037296 Eh/α   predicted    -0.1522223E-03 ( -17.68%)
   displ. norm   :     0.3125703 α      lambda       -0.1405715E-03
   maximum displ.:     0.1509389 α      in ANC's #8, #7, #10, ...

........................................................................
.............................. CYCLE    9 ..............................
........................................................................
   1    -39.1500990 -0.391501E+02  0.114E-01    4.73       0.0  T
   2    -39.1501000 -0.109168E-05  0.671E-02    4.73       1.0  T
   3    -39.1500990  0.102907E-05  0.766E-03    4.73       2.3  T
   4    -39.1501004 -0.140829E-05  0.204E-03    4.73       8.8  T
   5    -39.1501005 -0.475469E-07  0.967E-04    4.73      18.6  T
   6    -39.1501005 -0.589859E-08  0.307E-04    4.73      58.5  T
     SCC iter.                  ...        0 min,  0.007 sec
     gradient                   ...        0 min,  0.013 sec
 * total energy  :   -38.5560285 Eh     change       -0.6638707E-04 Eh
   gradient norm :     0.0053331 Eh/α   predicted    -0.7715440E-04 (  16.22%)
   displ. norm   :     0.1018880 α      lambda       -0.9418869E-04
   maximum displ.:     0.0555555 α      in ANC's #1, #3, #4, ...

........................................................................
.............................. CYCLE   10 ..............................
........................................................................
   1    -39.1535096 -0.391535E+02  0.346E-02    4.74       0.0  T
   2    -39.1535103 -0.663389E-06  0.201E-02    4.74       1.0  T
   3    -39.1535100  0.262607E-06  0.428E-03    4.74       4.2  T
   4    -39.1535103 -0.330580E-06  0.167E-03    4.74      10.8  T
   5    -39.1535104 -0.531679E-07  0.565E-04    4.74      31.8  T
     SCC iter.                  ...        0 min,  0.006 sec
     gradient                   ...        0 min,  0.012 sec
 * total energy  :   -38.5560751 Eh     change       -0.4662615E-04 Eh
   gradient norm :     0.0024989 Eh/α   predicted    -0.4758364E-04 (   2.05%)
   displ. norm   :     0.1383859 α      lambda       -0.4714618E-04
   maximum displ.:     0.0653116 α      in ANC's #3, #1, #8, ...

........................................................................
.............................. CYCLE   11 ..............................
........................................................................
   1    -39.1533016 -0.391533E+02  0.485E-02    4.74       0.0  T
   2    -39.1533018 -0.276784E-06  0.286E-02    4.74       1.0  T
   3    -39.1533013  0.517325E-06  0.503E-03    4.74       3.6  T
   4    -39.1533019 -0.632473E-06  0.102E-03    4.74      17.6  T
   5    -39.1533020 -0.104560E-07  0.559E-04    4.74      32.1  T
   6    -39.1533020 -0.270721E-08  0.155E-04    4.74     116.2  T
     SCC iter.                  ...        0 min,  0.008 sec
     gradient                   ...        0 min,  0.014 sec
 * total energy  :   -38.5560989 Eh     change       -0.2379735E-04 Eh
   gradient norm :     0.0023185 Eh/α   predicted    -0.2402698E-04 (   0.96%)
   displ. norm   :     0.0784679 α      lambda       -0.2662107E-04
   maximum displ.:     0.0450139 α      in ANC's #3, #1, #8, ...

........................................................................
.............................. CYCLE   12 ..............................
........................................................................
   1    -39.1533537 -0.391534E+02  0.271E-02    4.74       0.0  T
   2    -39.1533538 -0.974332E-07  0.160E-02    4.74       1.1  T
   3    -39.1533537  0.118249E-06  0.253E-03    4.74       7.1  T
   4    -39.1533538 -0.148422E-06  0.562E-04    4.74      31.9  T
   5    -39.1533538 -0.413360E-08  0.300E-04    4.74      59.8  T
     SCC iter.                  ...        0 min,  0.007 sec
     gradient                   ...        0 min,  0.015 sec
 * total energy  :   -38.5561189 Eh     change       -0.1997135E-04 Eh
   gradient norm :     0.0013946 Eh/α   predicted    -0.1339306E-04 ( -32.94%)
   displ. norm   :     0.1349150 α      lambda       -0.2530170E-04
   maximum displ.:     0.0851952 α      in ANC's #3, #1, #4, ...

........................................................................
.............................. CYCLE   13 ..............................
........................................................................
   1    -39.1536176 -0.391536E+02  0.472E-02    4.73       0.0  T
   2    -39.1536177 -0.182530E-06  0.279E-02    4.73       1.0  T
   3    -39.1536176  0.984185E-07  0.271E-03    4.73       6.6  T
   4    -39.1536178 -0.158778E-06  0.815E-04    4.73      22.0  T
   5    -39.1536178 -0.540652E-08  0.433E-04    4.73      41.5  T
     SCC iter.                  ...        0 min,  0.006 sec
     gradient                   ...        0 min,  0.013 sec
 * total energy  :   -38.5561430 Eh     change       -0.2413048E-04 Eh
   gradient norm :     0.0021099 Eh/α   predicted    -0.1275751E-04 ( -47.13%)
   displ. norm   :     0.0885910 α      lambda       -0.2013950E-04
   maximum displ.:     0.0591463 α      in ANC's #3, #1, #4, ...

........................................................................
.............................. CYCLE   14 ..............................
........................................................................
   1    -39.1535128 -0.391535E+02  0.305E-02    4.73       0.0  T
   2    -39.1535129 -0.799367E-07  0.180E-02    4.73       1.0  T
   3    -39.1535129 -0.173523E-07  0.971E-04    4.73      18.5  T
   4    -39.1535129 -0.116865E-07  0.519E-04    4.73      34.6  T
     SCC iter.                  ...        0 min,  0.005 sec
     gradient                   ...        0 min,  0.013 sec
 * total energy  :   -38.5561605 Eh     change       -0.1747177E-04 Eh
   gradient norm :     0.0018536 Eh/α   predicted    -0.1014919E-04 ( -41.91%)
   displ. norm   :     0.3254793 α      lambda       -0.5103479E-04
   maximum displ.:     0.2089933 α      in ANC's #3, #1, #4, ...

........................................................................
.............................. CYCLE   15 ..............................
........................................................................
   1    -39.1527953 -0.391528E+02  0.114E-01    4.74       0.0  T
   2    -39.1527969 -0.155388E-05  0.672E-02    4.73       1.0  T
   3    -39.1527968  0.887460E-07  0.548E-03    4.74       3.3  T
   4    -39.1527974 -0.575884E-06  0.242E-03    4.73       7.4  T
   5    -39.1527974 -0.432530E-07  0.994E-04    4.73      18.1  T
   6    -39.1527974 -0.110149E-07  0.367E-04    4.73      49.0  T
     SCC iter.                  ...        0 min,  0.007 sec
     gradient                   ...        0 min,  0.013 sec
 * total energy  :   -38.5562008 Eh     change       -0.4036815E-04 Eh
   gradient norm :     0.0028451 Eh/α   predicted    -0.2672032E-04 ( -33.81%)
   displ. norm   :     0.0852741 α      lambda       -0.2688857E-04
   maximum displ.:     0.0473945 α      in ANC's #3, #1, #2, ...

........................................................................
.............................. CYCLE   16 ..............................
........................................................................
   1    -39.1532936 -0.391533E+02  0.301E-02    4.74       0.0  T
   2    -39.1532939 -0.206871E-06  0.176E-02    4.74       1.0  T
   3    -39.1532938  0.214534E-07  0.181E-03    4.74       9.9  T
   4    -39.1532939 -0.634881E-07  0.746E-04    4.74      24.1  T
   5    -39.1532939 -0.659043E-08  0.328E-04    4.74      54.8  T
     SCC iter.                  ...        0 min,  0.007 sec
     gradient                   ...        0 min,  0.015 sec
 * total energy  :   -38.5562151 Eh     change       -0.1425769E-04 Eh
   gradient norm :     0.0014403 Eh/α   predicted    -0.1354594E-04 (  -4.99%)
   displ. norm   :     0.1237676 α      lambda       -0.1414238E-04
   maximum displ.:     0.0739902 α      in ANC's #3, #1, #4, ...

........................................................................
.............................. CYCLE   17 ..............................
........................................................................
   1    -39.1535820 -0.391536E+02  0.413E-02    4.74       0.0  T
   2    -39.1535822 -0.208433E-06  0.243E-02    4.74       1.0  T
   3    -39.1535821  0.512641E-07  0.237E-03    4.74       7.6  T
   4    -39.1535823 -0.120307E-06  0.820E-04    4.74      21.9  T
   5    -39.1535823 -0.252786E-08  0.404E-04    4.74      44.4  T
     SCC iter.                  ...        0 min,  0.006 sec
     gradient                   ...        0 min,  0.015 sec
 * total energy  :   -38.5562300 Eh     change       -0.1490761E-04 Eh
   gradient norm :     0.0013814 Eh/α   predicted    -0.7121072E-05 ( -52.23%)
   displ. norm   :     0.1422685 α      lambda       -0.1522968E-04
   maximum displ.:     0.0839363 α      in ANC's #1, #3, #4, ...

........................................................................
.............................. CYCLE   18 ..............................
........................................................................
   1    -39.1533039 -0.391533E+02  0.484E-02    4.74       0.0  T
   2    -39.1533040 -0.142453E-06  0.285E-02    4.74       1.0  T
   3    -39.1533040  0.331506E-07  0.209E-03    4.74       8.6  T
   4    -39.1533041 -0.906409E-07  0.737E-04    4.74      24.4  T
   5    -39.1533041 -0.201696E-08  0.368E-04    4.74      48.8  T
     SCC iter.                  ...        0 min,  0.006 sec
     gradient                   ...        0 min,  0.013 sec
 * total energy  :   -38.5562443 Eh     change       -0.1432020E-04 Eh
   gradient norm :     0.0012247 Eh/α   predicted    -0.7686252E-05 ( -46.33%)
   displ. norm   :     0.1423444 α      lambda        0.4117680E-05
   maximum displ.:     0.0840657 α      in ANC's #1, #3, #4, ...

........................................................................
.............................. CYCLE   19 ..............................
........................................................................
   1    -39.1527367 -0.391527E+02  0.484E-02    4.74       0.0  T
   2    -39.1527368 -0.147513E-06  0.286E-02    4.74       1.0  T
   3    -39.1527368  0.361123E-07  0.214E-03    4.74       8.4  T
   4    -39.1527369 -0.949510E-07  0.737E-04    4.74      24.4  T
   5    -39.1527369 -0.178396E-08  0.369E-04    4.74      48.7  T
     SCC iter.                  ...        0 min,  0.006 sec
     gradient                   ...        0 min,  0.013 sec
 * total energy  :   -38.5562408 Eh     change        0.3508662E-05 Eh
   gradient norm :     0.0025336 Eh/α   predicted     0.2077340E-05 ( -40.79%)
   displ. norm   :     0.0945727 α      lambda        0.2958812E-04
   maximum displ.:     0.0554831 α      in ANC's #1, #3, #4, ...

........................................................................
.............................. CYCLE   20 ..............................
........................................................................
   1    -39.1522026 -0.391522E+02  0.322E-02    4.74       0.0  T
   2    -39.1522027 -0.685957E-07  0.190E-02    4.74       1.0  T
   3    -39.1522027  0.114111E-07  0.138E-03    4.74      13.0  T
   4    -39.1522027 -0.378952E-07  0.477E-04    4.74      37.7  T
   5    -39.1522027 -0.634387E-09  0.220E-04    4.74      81.7  T
     SCC iter.                  ...        0 min,  0.006 sec
     gradient                   ...        0 min,  0.013 sec
 * total energy  :   -38.5562275 Eh     change        0.1327544E-04 Eh
   gradient norm :     0.0036301 Eh/α   predicted     0.1492480E-04 (  12.42%)
   displ. norm   :     0.0942342 α      lambda        0.4502360E-04
   maximum displ.:     0.0548866 α      in ANC's #1, #3, #4, ...
 * RMSD in coord.:     0.4802902 α      energy gain  -0.5043667E-02 Eh

generating ANC from model Hessian ...
Using Lindh-Hessian (1995)
 Shifting diagonal of input Hessian by   4.216636506865002E-003
 Lowest  eigenvalues of input Hessian
   -0.000000   -0.000000   -0.000000    0.000000    0.000000    0.000000
    0.005000    0.005274    0.005949    0.006005    0.007402    0.008445
    0.009238    0.010405    0.011451    0.012136    0.013304    0.016163
 Highest eigenvalues
    1.611636    1.800842    1.878415    1.954281    2.071550    2.085678
 

........................................................................
.............................. CYCLE   21 ..............................
........................................................................
   1    -39.1515448 -0.391515E+02  0.320E-02    4.74       0.0  T
   2    -39.1515448 -0.716028E-07  0.189E-02    4.74       1.0  T
   3    -39.1515448  0.927673E-08  0.135E-03    4.74      13.3  T
   4    -39.1515449 -0.356883E-07  0.478E-04    4.74      37.5  T
   5    -39.1515449 -0.794117E-09  0.213E-04    4.74      84.2  T
     SCC iter.                  ...        0 min,  0.007 sec
     gradient                   ...        0 min,  0.013 sec
 * total energy  :   -38.5562043 Eh     change        0.2319037E-04 Eh
   gradient norm :     0.0048316 Eh/α   predicted     0.0000000E+00 (-100.00%)
   displ. norm   :     0.0409759 α      lambda       -0.8283876E-04
   maximum displ.:     0.0219307 α      in ANC's #7, #12, #4, ...

........................................................................
.............................. CYCLE   22 ..............................
........................................................................
   1    -39.1532804 -0.391533E+02  0.257E-02    4.74       0.0  T
   2    -39.1532807 -0.347229E-06  0.149E-02    4.74       1.2  T
   3    -39.1532806  0.612386E-07  0.293E-03    4.74       6.1  T
   4    -39.1532808 -0.146925E-06  0.996E-04    4.74      18.0  T
     SCC iter.                  ...        0 min,  0.005 sec
     gradient                   ...        0 min,  0.012 sec
 * total energy  :   -38.5562542 Eh     change       -0.4990194E-04 Eh
   gradient norm :     0.0017039 Eh/α   predicted    -0.4148946E-04 ( -16.86%)
   displ. norm   :     0.0444661 α      lambda       -0.1634491E-04
   maximum displ.:     0.0261011 α      in ANC's #7, #12, #9, ...

........................................................................
.............................. CYCLE   23 ..............................
........................................................................
   1    -39.1540081 -0.391540E+02  0.231E-02    4.74       0.0  T
   2    -39.1540084 -0.288280E-06  0.132E-02    4.74       1.4  T
   3    -39.1540081  0.278253E-06  0.411E-03    4.74       4.4  T
   4    -39.1540085 -0.400913E-06  0.982E-04    4.74      18.3  T
   5    -39.1540085 -0.384004E-08  0.510E-04    4.74      35.2  T
     SCC iter.                  ...        0 min,  0.006 sec
     gradient                   ...        0 min,  0.013 sec
 * total energy  :   -38.5562646 Eh     change       -0.1037298E-04 Eh
   gradient norm :     0.0011570 Eh/α   predicted    -0.8180136E-05 ( -21.14%)
   displ. norm   :     0.0314703 α      lambda       -0.7432549E-05
   maximum displ.:     0.0163039 α      in ANC's #7, #9, #11, ...

........................................................................
.............................. CYCLE   24 ..............................
........................................................................
   1    -39.1537193 -0.391537E+02  0.167E-02    4.74       0.0  T
   2    -39.1537194 -0.100609E-06  0.975E-03    4.74       1.8  T
   3    -39.1537194  0.892739E-07  0.226E-03    4.74       8.0  T
   4    -39.1537195 -0.130182E-06  0.612E-04    4.74      29.4  T
   5    -39.1537195 -0.565834E-09  0.330E-04    4.74      54.5  T
     SCC iter.                  ...        0 min,  0.007 sec
     gradient                   ...        0 min,  0.014 sec
 * total energy  :   -38.5562687 Eh     change       -0.4113547E-05 Eh
   gradient norm :     0.0010006 Eh/α   predicted    -0.3719271E-05 (  -9.58%)
   displ. norm   :     0.0265452 α      lambda       -0.5304933E-05
   maximum displ.:     0.0109141 α      in ANC's #11, #7, #9, ...

........................................................................
.............................. CYCLE   25 ..............................
........................................................................
   1    -39.1532997 -0.391533E+02  0.126E-02    4.74       0.0  T
   2    -39.1532998 -0.551307E-07  0.734E-03    4.74       2.4  T
   3    -39.1532998  0.193132E-07  0.118E-03    4.74      15.2  T
   4    -39.1532998 -0.365144E-07  0.384E-04    4.74      46.8  T
   5    -39.1532998 -0.973635E-09  0.143E-04    4.74     125.8  T
     SCC iter.                  ...        0 min,  0.007 sec
     gradient                   ...        0 min,  0.015 sec
 * total energy  :   -38.5562728 Eh     change       -0.4039387E-05 Eh
   gradient norm :     0.0005533 Eh/α   predicted    -0.2653483E-05 ( -34.31%)
   displ. norm   :     0.0222797 α      lambda       -0.1938964E-05
   maximum displ.:     0.0108667 α      in ANC's #7, #5, #3, ...

   *** GEOMETRY OPTIMIZATION CONVERGED AFTER 25 ITERATIONS ***

------------------------------------------------------------------------
 total energy gain   :        -0.0050889 Eh       -3.1933 kcal/mol
 total RMSD          :         0.4832569 a0        0.2557 Å
 total power (kW/mol):        -0.5344367 (step)  -17.9780 (real)
------------------------------------------------------------------------

 ANCopt (total)                0 d,  0 h,  0 min,  0.743 sec
 optimizer setup                ...        0 min,  0.000 sec (  0.019%)
 model hessian                  ...        0 min,  0.020 sec (  2.708%)
 ANC generation                 ...        0 min,  0.002 sec (  0.237%)
 coordinate transformation      ...        0 min,  0.001 sec (  0.068%)
 single point calculation       ...        0 min,  0.712 sec ( 95.796%)
 optimization log               ...        0 min,  0.003 sec (  0.369%)
 hessian update                 ...        0 min,  0.000 sec (  0.048%)
 rational function              ...        0 min,  0.004 sec (  0.563%)

================
 final structure:
================
$coord
   -3.63063725701770    1.60023805826313    0.09757353197228      C 
   -1.33817308127301    2.70753084483641    0.14443778254506      N 
   -0.66705453716367    5.34597508639211    0.29541545157697      C 
   -2.94630186425089    7.09256081595654    0.25415182612922      C 
    0.50443552984925    0.99950994865842    0.03183103141085      N 
   -0.59758291360625   -1.24502372312164   -0.08802410760588      C 
   -3.24891842228067   -0.97507411997880   -0.05695235354758      C 
   -5.22315649335873   -2.98888324068397   -0.13152548389660      C 
   -5.60211344496716   -4.21082608158556    2.46046115330311      C 
    0.92247950440535   -3.61558107254299   -0.18349595211926      C 
    2.09717321960188   -4.16714924403362    2.40215565540982      C 
    3.62074386072833   -6.54466704445446    2.54609973450510      C 
    4.06654566823910   -8.15319701541541    0.69286073786280      C 
   -5.35852389063894    2.65025781837313    0.16260730299965      H 
    0.58691231082144    5.76713490028610   -1.29724958167481      H 
    0.41970629342542    5.63384743607604    2.03551854859843      H 
   -4.03113776208220    6.83822321333961   -1.47266002725580      H 
   -2.30579408091150    9.04226334878972    0.33669383193725      H 
   -4.16665007899686    6.74432152026964    1.87063164331088      H 
   -4.68079115978036   -4.44240164025812   -1.49558574839401      H 
   -7.00551612263986   -2.15760149706972   -0.76144997382969      H 
   -3.87413208578108   -5.13495867061383    3.07894133118423      H 
   -7.10054477281857   -5.61683036482543    2.38072182545821      H 
   -6.11219022018240   -2.78670443774353    3.85391377955761      H 
    2.43245191717350   -3.39221200079575   -1.57082297531245      H 
   -0.28913728145455   -5.18323385104508   -0.75357362300244      H 
    0.59984951062521   -4.26710528151401    3.82880374636540      H 
    3.30483931463937   -2.57182801147491    2.92455949944026      H 
    4.40477982213999   -6.90941355317402    4.40327179907585      H 
    3.33811798129733   -7.88900295850001   -1.18732841005028      H 
    5.19694151124058   -9.82108789346693    0.98134438995995      H 
$end
           -------------------------------------------------
          |                Final Singlepoint                |
           -------------------------------------------------

          ...................................................
          :                      SETUP                      :
          :.................................................:
          :  # basis functions                  70          :
          :  # atomic orbitals                  70          :
          :  # shells                           44          :
          :  # electrons                        72          :
          :  max. iterations                   250          :
          :  Hamiltonian                  GFN2-xTB          :
          :  restarted?                      false          :
          :  GBSA solvation                  false          :
          :  PC potential                    false          :
          :  electronic temp.          300.0000000     K    :
          :  accuracy                    1.0000000          :
          :  -> integral cutoff          0.2500000E+02      :
          :  -> integral neglect         0.1000000E-07      :
          :  -> SCF convergence          0.1000000E-05 Eh   :
          :  -> wf. convergence          0.1000000E-03 e    :
          :  Broyden damping             0.4000000          :
          ...................................................

 iter      E             dE          RMSdq      gap      omega  full diag
   1    -39.1532998 -0.391533E+02  0.555E-05    4.74       0.0  T
   2    -39.1532998 -0.170317E-10  0.263E-05    4.74     681.9  T
   3    -39.1532998 -0.145093E-10  0.176E-05    4.74    1018.6  T

   *** convergence criteria satisfied after 3 iterations ***

         #    Occupation            Energy/Eh            Energy/eV
      -------------------------------------------------------------
         1        2.0000           -0.6760865             -18.3972
       ...           ...                  ...                  ...
        30        2.0000           -0.4296782             -11.6921
        31        2.0000           -0.4257532             -11.5853
        32        2.0000           -0.4172213             -11.3532
        33        2.0000           -0.3891585             -10.5895
        34        2.0000           -0.3811074             -10.3705
        35        2.0000           -0.3731878             -10.1550
        36        2.0000           -0.3699083             -10.0657 (HOMO)
        37                         -0.1956764              -5.3246 (LUMO)
        38                         -0.1895853              -5.1589
        39                         -0.1441101              -3.9214
        40                          0.0060543               0.1647
        41                          0.0809507               2.2028
       ...                                ...                  ...
        70                          0.6611126              17.9898
      -------------------------------------------------------------
                  HL-Gap            0.1742319 Eh            4.7411 eV
             Fermi-level           -0.2827923 Eh           -7.6952 eV

 SCC (total)                   0 d,  0 h,  0 min,  0.027 sec
 SCC setup                      ...        0 min,  0.000 sec (  0.806%)
 Dispersion                     ...        0 min,  0.000 sec (  0.982%)
 integral evaluation            ...        0 min,  0.009 sec ( 31.867%)
 zeroth order Hamiltonian       ...        0 min,  0.000 sec (  0.588%)
 iterations                     ...        0 min,  0.004 sec ( 16.295%)
 molecular gradient             ...        0 min,  0.013 sec ( 48.103%)
 printout                       ...        0 min,  0.000 sec (  1.195%)

         :::::::::::::::::::::::::::::::::::::::::::::::::::::
         ::                     SUMMARY                     ::
         :::::::::::::::::::::::::::::::::::::::::::::::::::::
         :: total energy             -38.556272770405 Eh    ::
         :: gradient norm              0.000553441282 Eh/a0 ::
         :: HOMO-LUMO gap              4.741092492548 eV    ::
         ::.................................................::
         :: SCC energy               -39.153299808117 Eh    ::
         :: -> isotropic ES            0.014473576065 Eh    ::
         :: -> anisotropic ES          0.006800406730 Eh    ::
         :: -> anisotropic XC          0.028333845292 Eh    ::
         :: -> dispersion             -0.025166524847 Eh    ::
         :: repulsion energy           0.596922365587 Eh    ::
         :: add. restraining           0.000000000000 Eh    ::
         :::::::::::::::::::::::::::::::::::::::::::::::::::::

           -------------------------------------------------
          |                Property Printout                |
           -------------------------------------------------

    * Orbital Energies and Occupations

         #    Occupation            Energy/Eh            Energy/eV
      -------------------------------------------------------------
         1        2.0000           -0.6760865             -18.3972
       ...           ...                  ...                  ...
        24        2.0000           -0.4665010             -12.6941
        25        2.0000           -0.4636662             -12.6170
        26        2.0000           -0.4531684             -12.3313
        27        2.0000           -0.4472171             -12.1694
        28        2.0000           -0.4368904             -11.8884
        29        2.0000           -0.4330499             -11.7839
        30        2.0000           -0.4296782             -11.6921
        31        2.0000           -0.4257532             -11.5853
        32        2.0000           -0.4172213             -11.3532
        33        2.0000           -0.3891585             -10.5895
        34        2.0000           -0.3811074             -10.3705
        35        2.0000           -0.3731878             -10.1550
        36        2.0000           -0.3699083             -10.0657 (HOMO)
        37                         -0.1956764              -5.3246 (LUMO)
        38                         -0.1895853              -5.1589
        39                         -0.1441101              -3.9214
        40                          0.0060543               0.1647
        41                          0.0809507               2.2028
        42                          0.1010360               2.7493
        43                          0.1210047               3.2927
        44                          0.1226626               3.3378
        45                          0.1313515               3.5743
        46                          0.1385069               3.7690
        47                          0.1412536               3.8437
       ...                                ...                  ...
        70                          0.6611126              17.9898
      -------------------------------------------------------------
                  HL-Gap            0.1742319 Eh            4.7411 eV
             Fermi-level           -0.2827923 Eh           -7.6952 eV

     #   Z        covCN         q      C6AA      α(0)
     1   6 C      3.027    -0.030    28.725     8.791
     2   7 N      3.020     0.072    19.985     6.640
     3   6 C      3.741    -0.006    20.756     6.500
     4   6 C      3.752    -0.111    22.692     6.793
     5   7 N      2.016    -0.264    27.645     7.798
     6   6 C      3.154     0.056    26.467     8.413
     7   6 C      3.067    -0.045    29.043     8.837
     8   6 C      3.802    -0.049    21.457     6.595
     9   6 C      3.753    -0.096    22.401     6.749
    10   6 C      3.805    -0.060    21.643     6.623
    11   6 C      3.808    -0.053    21.515     6.603
    12   6 C      2.885    -0.028    28.702     8.783
    13   6 C      2.835    -0.097    30.441     9.041
    14   1 H      0.926     0.028     2.615     2.529
    15   1 H      0.924     0.061     2.192     2.315
    16   1 H      0.924     0.058     2.225     2.333
    17   1 H      0.925     0.050     2.324     2.384
    18   1 H      0.925     0.050     2.322     2.383
    19   1 H      0.925     0.049     2.331     2.387
    20   1 H      0.924     0.030     2.586     2.515
    21   1 H      0.924     0.027     2.634     2.538
    22   1 H      0.925     0.036     2.501     2.473
    23   1 H      0.925     0.030     2.589     2.516
    24   1 H      0.925     0.031     2.577     2.510
    25   1 H      0.924     0.046     2.369     2.407
    26   1 H      0.924     0.037     2.493     2.469
    27   1 H      0.924     0.038     2.482     2.464
    28   1 H      0.924     0.052     2.299     2.371
    29   1 H      0.925     0.026     2.643     2.542
    30   1 H      0.926     0.036     2.496     2.471
    31   1 H      0.926     0.029     2.594     2.519

 Mol. C6AA /au·bohr⁶  :       8565.383172
 Mol. C8AA /au·bohr⁸  :     191451.604719
 Mol. α(0) /au        :        142.292309


Wiberg/Mayer (AO) data.
largest (>0.10) Wiberg bond orders for each atom
          total WBO             WBO to atom ...
     1  C   3.954        C    7 1.475    N    2 1.274    H   14 0.967    N    5 0.156
     2  N   3.664        C    1 1.274    N    5 1.199    C    3 0.985
     3  C   3.974        C    4 1.020    N    2 0.985    H   15 0.965    H   16 0.964
     4  C   3.993        C    3 1.020    H   17 0.986    H   19 0.985    H   18 0.984
     5  N   2.951        C    6 1.475    N    2 1.199    C    1 0.156
     6  C   3.975        N    5 1.475    C    7 1.321    C   10 1.014
     7  C   3.975        C    1 1.475    C    6 1.321    C    8 1.016
     8  C   3.998        C    7 1.016    C    9 1.004    H   21 0.977    H   20 0.971
     9  C   3.997        C    8 1.004    H   24 0.989    H   23 0.987    H   22 0.986
    10  C   3.997        C    6 1.014    C   11 0.990    H   26 0.973    H   25 0.968
    11  C   3.997        C   12 1.028    C   10 0.990    H   27 0.958    H   28 0.958
    12  C   3.991        C   13 1.974    C   11 1.028    H   29 0.966
    13  C   3.991        C   12 1.974    H   31 0.977    H   30 0.974
    14  H   0.999        C    1 0.967
    15  H   0.996        C    3 0.965
    16  H   0.996        C    3 0.964
    17  H   0.998        C    4 0.986
    18  H   0.997        C    4 0.984
    19  H   0.998        C    4 0.985
    20  H   0.999        C    8 0.971
    21  H   0.999        C    8 0.977
    22  H   0.999        C    9 0.986
    23  H   0.998        C    9 0.987
    24  H   0.999        C    9 0.989
    25  H   0.998        C   10 0.968
    26  H   0.998        C   10 0.973
    27  H   0.999        C   11 0.958
    28  H   0.997        C   11 0.958
    29  H   0.999        C   12 0.966
    30  H   0.999        C   13 0.974
    31  H   0.999        C   13 0.977

molecular dipole:
                 x           y           z       tot (Debye)
 q only:       -0.334       0.848       0.090
   full:       -0.707       0.811       0.127       2.753
molecular quadrupole (traceless):
                xx          xy          yy          xz          yz          zz
 q only:       -2.723      -1.443       5.184       0.082       0.576      -2.461
  q+dip:       -2.399      -2.361       4.818       0.216       1.470      -2.419
   full:       -2.691      -2.144       4.666       0.142       0.814      -1.975

           -------------------------------------------------
          |                Geometry Summary                 |
           -------------------------------------------------

      molecular mass/u    :      178.2766000
   center of mass at/Å    :       -0.5080013      -0.5529769       0.3546514
  moments of inertia/u·Å² :        0.4108524E+03   0.1180624E+04   0.1481931E+04
rotational constants/cm⁻¹ :        0.4103087E-01   0.1427857E-01   0.1137545E-01

 * 30 selected distances

     #   Z        #   Z                                     value/Å
     1   6 C      2   7 N                                 1.3474484
     2   7 N      3   6 C                                 1.4428775
     3   6 C      4   6 C                                 1.5196910
     2   7 N      5   7 N                                 1.3308805
     5   7 N      6   6 C                                 1.3247138
     1   6 C      7   6 C                                 1.3801102
     6   6 C      7   6 C                                 1.4103759
     7   6 C      8   6 C                                 1.4928619
     8   6 C      9   6 C                                 1.5296013
     6   6 C     10   6 C                                 1.4910453
    10   6 C     11   6 C                                 1.5309352 (max)
    12   6 C     13   6 C                                 1.3198282
     1   6 C     14   1 H                                 1.0705039 (min)
     3   6 C     15   1 H                                 1.0955874
     3   6 C     16   1 H                                 1.0962885
     4   6 C     17   1 H                                 1.0875121
     4   6 C     18   1 H                                 1.0868641
     4   6 C     19   1 H                                 1.0875239
     8   6 C     20   1 H                                 1.0931752
     8   6 C     21   1 H                                 1.0928042
     9   6 C     22   1 H                                 1.0873863
     9   6 C     23   1 H                                 1.0881643
     9   6 C     24   1 H                                 1.0883584
    10   6 C     25   1 H                                 1.0915154
    10   6 C     26   1 H                                 1.0909960
    11   6 C     27   1 H                                 1.0957029
    11   6 C     28   1 H                                 1.0943116
    12   6 C     29   1 H                                 1.0840827
    13   6 C     30   1 H                                 1.0761333
    13   6 C     31   1 H                                 1.0770906

 * 4 distinct bonds (by element types)

   Z      Z             #   av. dist./Å        max./Å        min./Å
   1 H    6 C          18     1.0880001     1.0962885     1.0705039
   6 C    6 C           8     1.4593061     1.5309352     1.3198282
   6 C    7 N           3     1.3716799     1.4428775     1.3247138
   7 N    7 N           1     1.3308805     1.3308805     1.3308805


optimized geometry written to: xtbopt.xyz


           -------------------------------------------------
          | TOTAL ENERGY              -38.556272770405 Eh   |
          | GRADIENT NORM               0.000553441282 Eh/α |
          | HOMO-LUMO GAP               4.741092492548 eV   |
           -------------------------------------------------

------------------------------------------------------------------------
 * finished run on 2021/05/19 at 10:58:47.741     
------------------------------------------------------------------------
 total:
 * wall-time:     0 d,  0 h,  0 min,  0.829 sec
 *  cpu-time:     0 d,  0 h,  0 min,  0.829 sec
 * ratio c/w:     1.000 speedup
 SCF:
 * wall-time:     0 d,  0 h,  0 min,  0.038 sec
 *  cpu-time:     0 d,  0 h,  0 min,  0.038 sec
 * ratio c/w:     1.000 speedup
 ANC optimizer:
 * wall-time:     0 d,  0 h,  0 min,  0.770 sec
 *  cpu-time:     0 d,  0 h,  0 min,  0.770 sec
 * ratio c/w:     1.000 speedup

