      -----------------------------------------------------------      
     |                   =====================                   |     
     |                           x T B                           |     
     |                   =====================                   |     
     |                         S. Grimme                         |     
     |          Mulliken Center for Theoretical Chemistry        |     
     |                    University of Bonn                     |     
     |                Version 6.2 RC2 (SAW190805)                |     
      -----------------------------------------------------------      

   This program is distributed in the hope that it will be useful,
   but WITHOUT ANY WARRANTY; without even the implied warranty of
   MERCHANTABILITY or FITNESS FOR A PARTICULAR PURPOSE.
   
   FOR NON-COMMERCIAL, ACADEMIA USE ONLY.
   
   Cite this work as:
   * S. Grimme, C. Bannwarth, P. Shushkov, J. Chem. Theory Comput., 2017,
     13, 1989-2009. DOI: 10.1021/acs.jctc.7b00118
   * C. Bannwarth, S. Ehlert and S. Grimme., J. Chem. Theory Comput., 2019,
     15, 1652-1671. DOI: 10.1021/acs.jctc.8b01176
   * P. Pracht, E. Caldeweyher, S. Ehlert, S. Grimme, ChemRxiv, 2019, preprint.
     DOI: 10.26434/chemrxiv.8326202.v1
   
   for DFT-D4:
   * E. Caldeweyher, C. Bannwarth and S. Grimme, J. Chem. Phys., 2017,
     147, 034112. DOI: 10.1063/1.4993215
   * E. Caldeweyher, S. Ehlert, A. Hansen, H. Neugebauer, S. Spicher,
     C. Bannwarth and S. Grimme, J. Chem. Phys., 2019, 150, 154122.
     DOI: 10.1063/1.5090222
   
   for sTDA-xTB:
   * S. Grimme and C. Bannwarth, J. Chem. Phys., 2016, 145, 054103.
     DOI: 10.1063/1.4959605
   
   in the mass-spec context:
   * V. Asgeirsson, C. Bauer and S. Grimme, Chem. Sci., 2017, 8, 4879.
     DOI: 10.1039/c7sc00601b
   
   for metadynamics refer to:
   * S. Grimme, J. Chem. Theory Comput., 2019, 155, 2847-2862
     DOI: 10.1021/acs.jctc.9b00143
   
   with help from (in alphabetical order)
   C. Bannwarth, F. Bohle, G. Brandenburg, E. Caldeweyher, M. Checinski,
   S. Dohm, S. Ehlert, S. Ehrlich, F. März, H. Neugebauer, J. Pisarek,
   P. Pracht, P. Shushkov, and S. Spicher.
   
 * started run on 2021/05/19 at 11:00:29.172     

           -------------------------------------------------
          |                Calculation Setup                |
           -------------------------------------------------

          program call               : /ihome/ghutchison/geoffh/xtb/xtb 740.xyz -opt
          hostname                   : smp-n83
          coordinate file            : 740.xyz
          omp threads                :                     1
          number of atoms            :                    28
          number of electrons        :                    74
          charge                     :                     0
          spin                       :                   0.0
          first test random number   :      0.53853877204274


########################################################################
# WARNING! Please study the warnings concerning your input carefully
#  - the use of '-opt' is discouraged, please use '--opt' next time
########################################################################

           ------------------------------------------------- 
          |                 G F N 2 - x T B                 |
          | Geometry, Frequencies, Noncovalent interactions |
          |            JCTC 2019 parametrisation            |
           ------------------------------------------------- 
             KAB for C  - Si     :                1.0500
             KAB for H  - Pd     :                0.9500
             k(s)              :                1.8500
             k(p)              :                2.2300
             k(d)              :                2.2300
             k(f)              :                2.0000
             kEN (H0ij)        :               -2.0000
             D4 a1             :                0.5200
             D4 a2             :                5.0000
             D4 s6             :                1.0000
             D4 s8             :                2.7000
             D4 s9             :                5.0000
             alphaj            :                2.0000

  Z AO/shell   Hii/eV     exponent
  1     Wed Apr 25 08:07:45 CEST 2018   EN: 2.200 GM2: 0.406  GM3: 0.0800  RAES: 1.40
     1s    -10.707211    1.230000
  6     Wed Apr 25 08:07:45 CEST 2018   EN: 2.550 GM2: 0.538  GM3: 0.1500  RAES: 3.00
     2s    -13.970922    2.096432
     2p    -10.063292    1.800000
 16     Tue Apr 24 11:44:34 CEST 2018   EN: 2.580 GM2: 0.340  GM3:-0.0502  RAES: 3.10
     3s    -20.029654    1.981333
     3p    -11.377694    2.025643
     3d     -0.420282    1.702555

           ------------------------------------------------- 
          |        Self-Consistent Charge Iterations        |
           ------------------------------------------------- 

          ...................................................
          :                      SETUP                      :
          :.................................................:
          :  # basis functions                  82          :
          :  # atomic orbitals                  80          :
          :  # shells                           44          :
          :  # electrons                        74          :
          :  max. iterations                   250          :
          :  Hamiltonian                  GFN2-xTB          :
          :  restarted?                      false          :
          :  GBSA solvation                  false          :
          :  PC potential                    false          :
          :  electronic temp.          300.0000000     K    :
          :  accuracy                    1.0000000          :
          :  -> integral cutoff          0.2500000E+02      :
          :  -> integral neglect         0.1000000E-07      :
          :  -> SCF convergence          0.1000000E-05 Eh   :
          :  -> wf. convergence          0.1000000E-03 e    :
          :  Broyden damping             0.4000000          :
          ...................................................

 iter      E             dE          RMSdq      gap      omega  full diag
   1    -39.8410542 -0.398411E+02  0.403E+00    2.67       0.0  T
   2    -39.8786475 -0.375933E-01  0.214E+00    2.65       1.0  T
   3    -39.8741996  0.444790E-02  0.852E-01    2.66       1.0  T
   4    -39.8786774 -0.447777E-02  0.465E-01    2.65       1.0  T
   5    -39.8819576 -0.328015E-02  0.128E-01    2.66       1.0  T
   6    -39.8819722 -0.146142E-04  0.499E-02    2.65       1.0  T
   7    -39.8820110 -0.388567E-04  0.198E-02    2.66       1.0  T
   8    -39.8820121 -0.108938E-05  0.118E-02    2.66       1.6  T
   9    -39.8820129 -0.784633E-06  0.453E-03    2.66       4.2  T
  10    -39.8820131 -0.183170E-06  0.221E-03    2.66       8.5  T
  11    -39.8820131 -0.316507E-07  0.123E-03    2.66      15.4  T
  12    -39.8820131 -0.110242E-07  0.439E-04    2.66      43.1  T
  13    -39.8820131 -0.153479E-08  0.175E-04    2.66     108.0  T

   *** convergence criteria satisfied after 13 iterations ***

         #    Occupation            Energy/Eh            Energy/eV
      -------------------------------------------------------------
         1        2.0000           -0.7271482             -19.7867
       ...           ...                  ...                  ...
        31        2.0000           -0.4357380             -11.8570
        32        2.0000           -0.4333657             -11.7925
        33        2.0000           -0.4278498             -11.6424
        34        2.0000           -0.4187127             -11.3938
        35        2.0000           -0.4015310             -10.9262
        36        2.0000           -0.3786561             -10.3038
        37        2.0000           -0.3627660              -9.8714 (HOMO)
        38                         -0.2651326              -7.2146 (LUMO)
        39                         -0.2209684              -6.0129
        40                         -0.2165667              -5.8931
        41                         -0.1894517              -5.1552
        42                         -0.1782974              -4.8517
       ...                                ...                  ...
        80                          0.6797273              18.4963
      -------------------------------------------------------------
                  HL-Gap            0.0976333 Eh            2.6567 eV
             Fermi-level           -0.3139493 Eh           -8.5430 eV

 SCC (total)                   0 d,  0 h,  0 min,  0.051 sec
 SCC setup                      ...        0 min,  0.000 sec (  0.678%)
 Dispersion                     ...        0 min,  0.000 sec (  0.826%)
 integral evaluation            ...        0 min,  0.013 sec ( 24.609%)
 zeroth order Hamiltonian       ...        0 min,  0.000 sec (  0.455%)
 iterations                     ...        0 min,  0.019 sec ( 36.601%)
 molecular gradient             ...        0 min,  0.018 sec ( 35.892%)
 printout                       ...        0 min,  0.000 sec (  0.838%)

         :::::::::::::::::::::::::::::::::::::::::::::::::::::
         ::                     SUMMARY                     ::
         :::::::::::::::::::::::::::::::::::::::::::::::::::::
         :: total energy             -39.302882434108 Eh    ::
         :: gradient norm              0.065342560708 Eh/a0 ::
         :: HOMO-LUMO gap              2.656738380892 eV    ::
         ::.................................................::
         :: SCC energy               -39.882013124995 Eh    ::
         :: -> isotropic ES            0.003481921698 Eh    ::
         :: -> anisotropic ES          0.004499065853 Eh    ::
         :: -> anisotropic XC          0.020405509884 Eh    ::
         :: -> dispersion             -0.030567851273 Eh    ::
         :: repulsion energy           0.578999833484 Eh    ::
         :: add. restraining           0.000000000000 Eh    ::
         :::::::::::::::::::::::::::::::::::::::::::::::::::::

      ----------------------------------------------------------- 
     |                   =====================                   |
     |                        A N C O P T                        |
     |                   =====================                   |
     |               Approximate Normal Coordinate               |
     |                Rational Function Optimizer                |
      ----------------------------------------------------------- 

          ...................................................
          :                      SETUP                      :
          :.................................................:
          :   optimization level            normal          :
          :   max. optcycles                   200          :
          :   ANC micro-cycles                  20          :
          :   degrees of freedom                78          :
          :.................................................:
          :   RF solver                   davidson          :
          :   input Hessian                  false          :
          :   write xtbopt.log                true          :
          :   linear?                        false          :
          :   energy convergence         0.5000000E-05 Eh   :
          :   grad. convergence          0.1000000E-02 Eh/α :
          :   maximium RF displ.         2.0000000          :
          :   Hlow (freq-cutoff)         0.5000000E-02      :
          :   Hmax (freq-cutoff)         5.0000000          :
          :   S6 in model hess.         20.0000000          :
          ...................................................

generating ANC from model Hessian ...
Using Lindh-Hessian (1995)
 Shifting diagonal of input Hessian by   4.070899945946971E-003
 Lowest  eigenvalues of input Hessian
   -0.000000   -0.000000   -0.000000    0.000000    0.000000    0.000000
    0.005000    0.005500    0.005909    0.006804    0.007117    0.008965
    0.009632    0.010320    0.012562    0.015727    0.017652    0.018556
 Highest eigenvalues
    1.612008    1.700918    1.746423    1.811878    1.856230    1.981031
 

........................................................................
.............................. CYCLE    1 ..............................
........................................................................
   1    -39.8820131 -0.398820E+02  0.736E-05    2.66       0.0  T
   2    -39.8820131 -0.926548E-11  0.477E-05    2.66     396.2  T
   3    -39.8820131 -0.406857E-10  0.301E-05    2.66     628.9  T
     SCC iter.                  ...        0 min,  0.005 sec
     gradient                   ...        0 min,  0.018 sec
 * total energy  :   -39.3028824 Eh     change        0.1578650E-07 Eh
   gradient norm :     0.0653425 Eh/α   predicted     0.0000000E+00 (-100.00%)
   displ. norm   :     0.2505387 α      lambda       -0.6957642E-02
   maximum displ.:     0.0986038 α      in ANC's #8, #14, #15, ...

........................................................................
.............................. CYCLE    2 ..............................
........................................................................
   1    -39.9016918 -0.399017E+02  0.253E-01    2.69       0.0  T
   2    -39.9017329 -0.411234E-04  0.142E-01    2.70       1.0  T
   3    -39.9016365  0.964706E-04  0.969E-02    2.69       1.0  T
   4    -39.9018207 -0.184206E-03  0.190E-02    2.70       1.0  T
   5    -39.9018207 -0.439404E-07  0.112E-02    2.70       1.7  T
   6    -39.9018221 -0.141765E-05  0.310E-03    2.70       6.1  T
   7    -39.9018223 -0.174167E-06  0.104E-03    2.70      18.2  T
     SCC iter.                  ...        0 min,  0.010 sec
     gradient                   ...        0 min,  0.017 sec
 * total energy  :   -39.3074492 Eh     change       -0.4566759E-02 Eh
   gradient norm :     0.0246424 Eh/α   predicted    -0.3697184E-02 ( -19.04%)
   displ. norm   :     0.2481120 α      lambda       -0.1602783E-02
   maximum displ.:     0.1612748 α      in ANC's #8, #6, #14, ...

........................................................................
.............................. CYCLE    3 ..............................
........................................................................
   1    -39.9088915 -0.399089E+02  0.201E-01    2.69       0.0  T
   2    -39.9089107 -0.191813E-04  0.113E-01    2.69       1.0  T
   3    -39.9088364  0.742957E-04  0.721E-02    2.69       1.0  T
   4    -39.9089440 -0.107593E-03  0.140E-02    2.69       1.3  T
   5    -39.9089437  0.297786E-06  0.742E-03    2.69       2.5  T
   6    -39.9089446 -0.856230E-06  0.183E-03    2.69      10.3  T
   7    -39.9089446 -0.427853E-07  0.899E-04    2.69      21.0  T
     SCC iter.                  ...        0 min,  0.010 sec
     gradient                   ...        0 min,  0.017 sec
 * total energy  :   -39.3084501 Eh     change       -0.1000911E-02 Eh
   gradient norm :     0.0073483 Eh/α   predicted    -0.8507249E-03 ( -15.00%)
   displ. norm   :     0.2378629 α      lambda       -0.5317134E-03
   maximum displ.:     0.1517598 α      in ANC's #8, #6, #4, ...

........................................................................
.............................. CYCLE    4 ..............................
........................................................................
   1    -39.9088361 -0.399088E+02  0.152E-01    2.67       0.0  T
   2    -39.9088414 -0.531309E-05  0.863E-02    2.67       1.0  T
   3    -39.9088056  0.358270E-04  0.439E-02    2.67       1.0  T
   4    -39.9088484 -0.427858E-04  0.841E-03    2.67       2.2  T
   5    -39.9088484 -0.121333E-07  0.389E-03    2.67       4.9  T
   6    -39.9088487 -0.251944E-06  0.107E-03    2.67      17.7  T
   7    -39.9088487 -0.122678E-07  0.557E-04    2.67      33.9  T
     SCC iter.                  ...        0 min,  0.010 sec
     gradient                   ...        0 min,  0.018 sec
 * total energy  :   -39.3088070 Eh     change       -0.3568767E-03 Eh
   gradient norm :     0.0082788 Eh/α   predicted    -0.2809008E-03 ( -21.29%)
   displ. norm   :     0.2481026 α      lambda       -0.4212743E-03
   maximum displ.:     0.1478935 α      in ANC's #8, #6, #4, ...

........................................................................
.............................. CYCLE    5 ..............................
........................................................................
   1    -39.9072734 -0.399073E+02  0.168E-01    2.64       0.0  T
   2    -39.9072776 -0.422167E-05  0.945E-02    2.64       1.0  T
   3    -39.9072649  0.127518E-04  0.274E-02    2.64       1.0  T
   4    -39.9072798 -0.149011E-04  0.909E-03    2.64       2.1  T
   5    -39.9072801 -0.359671E-06  0.243E-03    2.64       7.8  T
   6    -39.9072802 -0.106192E-06  0.840E-04    2.64      22.5  T
     SCC iter.                  ...        0 min,  0.009 sec
     gradient                   ...        0 min,  0.018 sec
 * total energy  :   -39.3090656 Eh     change       -0.2586194E-03 Eh
   gradient norm :     0.0089148 Eh/α   predicted    -0.2236159E-03 ( -13.53%)
   displ. norm   :     0.1959363 α      lambda       -0.2692606E-03
   maximum displ.:     0.1027693 α      in ANC's #8, #6, #4, ...

........................................................................
.............................. CYCLE    6 ..............................
........................................................................
   1    -39.9071277 -0.399071E+02  0.131E-01    2.62       0.0  T
   2    -39.9071308 -0.307143E-05  0.720E-02    2.62       1.0  T
   3    -39.9071289  0.185505E-05  0.151E-02    2.62       1.2  T
   4    -39.9071311 -0.216620E-05  0.819E-03    2.62       2.3  T
   5    -39.9071317 -0.652699E-06  0.168E-03    2.62      11.3  T
   6    -39.9071318 -0.606760E-07  0.440E-04    2.62      42.9  T
     SCC iter.                  ...        0 min,  0.008 sec
     gradient                   ...        0 min,  0.017 sec
 * total energy  :   -39.3092625 Eh     change       -0.1969322E-03 Eh
   gradient norm :     0.0074289 Eh/α   predicted    -0.1398062E-03 ( -29.01%)
   displ. norm   :     0.2347852 α      lambda       -0.2929092E-03
   maximum displ.:     0.1088589 α      in ANC's #4, #6, #2, ...

........................................................................
.............................. CYCLE    7 ..............................
........................................................................
   1    -39.9084559 -0.399085E+02  0.136E-01    2.62       0.0  T
   2    -39.9084588 -0.288772E-05  0.768E-02    2.62       1.0  T
   3    -39.9084483  0.104606E-04  0.250E-02    2.62       1.0  T
   4    -39.9084605 -0.121769E-04  0.672E-03    2.62       2.8  T
   5    -39.9084606 -0.903846E-07  0.266E-03    2.62       7.1  T
   6    -39.9084607 -0.140533E-06  0.694E-04    2.62      27.2  T
     SCC iter.                  ...        0 min,  0.008 sec
     gradient                   ...        0 min,  0.017 sec
 * total energy  :   -39.3094768 Eh     change       -0.2143308E-03 Eh
   gradient norm :     0.0060072 Eh/α   predicted    -0.1545284E-03 ( -27.90%)
   displ. norm   :     0.3048604 α      lambda       -0.2592243E-03
   maximum displ.:     0.1603578 α      in ANC's #4, #2, #6, ...

........................................................................
.............................. CYCLE    8 ..............................
........................................................................
   1    -39.9078915 -0.399079E+02  0.168E-01    2.61       0.0  T
   2    -39.9078951 -0.355495E-05  0.958E-02    2.61       1.0  T
   3    -39.9078902  0.490100E-05  0.195E-02    2.61       1.0  T
   4    -39.9078960 -0.580217E-05  0.814E-03    2.61       2.3  T
   5    -39.9078965 -0.493554E-06  0.212E-03    2.61       8.9  T
   6    -39.9078965 -0.652415E-07  0.838E-04    2.61      22.5  T
     SCC iter.                  ...        0 min,  0.008 sec
     gradient                   ...        0 min,  0.017 sec
 * total energy  :   -39.3096446 Eh     change       -0.1677817E-03 Eh
   gradient norm :     0.0081680 Eh/α   predicted    -0.1416616E-03 ( -15.57%)
   displ. norm   :     0.2344602 α      lambda       -0.2797864E-03
   maximum displ.:     0.1383779 α      in ANC's #2, #4, #5, ...

........................................................................
.............................. CYCLE    9 ..............................
........................................................................
   1    -39.9117560 -0.399118E+02  0.115E-01    2.62       0.0  T
   2    -39.9117588 -0.279024E-05  0.660E-02    2.62       1.0  T
   3    -39.9117468  0.120307E-04  0.268E-02    2.62       1.0  T
   4    -39.9117605 -0.137436E-04  0.595E-03    2.62       3.2  T
   5    -39.9117606 -0.112643E-06  0.273E-03    2.62       6.9  T
   6    -39.9117607 -0.855966E-07  0.107E-03    2.62      17.7  T
     SCC iter.                  ...        0 min,  0.009 sec
     gradient                   ...        0 min,  0.017 sec
 * total energy  :   -39.3097597 Eh     change       -0.1150495E-03 Eh
   gradient norm :     0.0075052 Eh/α   predicted    -0.1475847E-03 (  28.28%)
   displ. norm   :     0.2992806 α      lambda       -0.2107271E-03
   maximum displ.:     0.1616699 α      in ANC's #4, #2, #6, ...

........................................................................
.............................. CYCLE   10 ..............................
........................................................................
   1    -39.9086244 -0.399086E+02  0.144E-01    2.61       0.0  T
   2    -39.9086268 -0.237988E-05  0.828E-02    2.61       1.0  T
   3    -39.9086251  0.163788E-05  0.129E-02    2.61       1.5  T
   4    -39.9086269 -0.182212E-05  0.721E-03    2.61       2.6  T
   5    -39.9086276 -0.635211E-06  0.118E-03    2.61      16.0  T
   6    -39.9086276 -0.200426E-07  0.450E-04    2.61      42.0  T
     SCC iter.                  ...        0 min,  0.008 sec
     gradient                   ...        0 min,  0.018 sec
 * total energy  :   -39.3098251 Eh     change       -0.6542668E-04 Eh
   gradient norm :     0.0082967 Eh/α   predicted    -0.1148012E-03 (  75.47%)
   displ. norm   :     0.0590340 α      lambda       -0.1480740E-03
   maximum displ.:     0.0251228 α      in ANC's #6, #8, #12, ...

........................................................................
.............................. CYCLE   11 ..............................
........................................................................
   1    -39.9099332 -0.399099E+02  0.361E-02    2.61       0.0  T
   2    -39.9099340 -0.809209E-06  0.197E-02    2.61       1.0  T
   3    -39.9099321  0.195117E-05  0.123E-02    2.61       1.5  T
   4    -39.9099349 -0.284679E-05  0.258E-03    2.61       7.3  T
   5    -39.9099349 -0.423017E-08  0.965E-04    2.61      19.6  T
     SCC iter.                  ...        0 min,  0.007 sec
     gradient                   ...        0 min,  0.018 sec
 * total energy  :   -39.3099119 Eh     change       -0.8676557E-04 Eh
   gradient norm :     0.0033281 Eh/α   predicted    -0.7429504E-04 ( -14.37%)
   displ. norm   :     0.1122234 α      lambda       -0.6375695E-04
   maximum displ.:     0.0715977 α      in ANC's #2, #4, #5, ...

........................................................................
.............................. CYCLE   12 ..............................
........................................................................
   1    -39.9101360 -0.399101E+02  0.598E-02    2.60       0.0  T
   2    -39.9101367 -0.758031E-06  0.329E-02    2.60       1.0  T
   3    -39.9101351  0.159130E-05  0.101E-02    2.60       1.9  T
   4    -39.9101370 -0.192706E-05  0.369E-03    2.60       5.1  T
   5    -39.9101371 -0.551407E-07  0.104E-03    2.60      18.1  T
   6    -39.9101371 -0.208694E-07  0.249E-04    2.60      76.0  T
   7    -39.9101371 -0.570097E-09  0.142E-04    2.60     133.5  T
     SCC iter.                  ...        0 min,  0.009 sec
     gradient                   ...        0 min,  0.018 sec
 * total energy  :   -39.3099553 Eh     change       -0.4347458E-04 Eh
   gradient norm :     0.0025843 Eh/α   predicted    -0.3228131E-04 ( -25.75%)
   displ. norm   :     0.2031944 α      lambda       -0.6113273E-04
   maximum displ.:     0.1257999 α      in ANC's #2, #4, #5, ...

........................................................................
.............................. CYCLE   13 ..............................
........................................................................
   1    -39.9098746 -0.399099E+02  0.926E-02    2.61       0.0  T
   2    -39.9098761 -0.145912E-05  0.521E-02    2.61       1.0  T
   3    -39.9098741  0.196770E-05  0.125E-02    2.61       1.5  T
   4    -39.9098764 -0.226700E-05  0.537E-03    2.61       3.5  T
   5    -39.9098766 -0.226905E-06  0.118E-03    2.61      16.0  T
   6    -39.9098767 -0.235901E-07  0.421E-04    2.61      44.9  T
   7    -39.9098767 -0.396212E-08  0.133E-04    2.61     141.8  T
     SCC iter.                  ...        0 min,  0.009 sec
     gradient                   ...        0 min,  0.019 sec
 * total energy  :   -39.3099851 Eh     change       -0.2972793E-04 Eh
   gradient norm :     0.0036553 Eh/α   predicted    -0.3183024E-04 (   7.07%)
   displ. norm   :     0.1406170 α      lambda       -0.3318337E-04
   maximum displ.:     0.0927785 α      in ANC's #2, #4, #6, ...

........................................................................
.............................. CYCLE   14 ..............................
........................................................................
   1    -39.9086909 -0.399087E+02  0.698E-02    2.60       0.0  T
   2    -39.9086915 -0.640467E-06  0.402E-02    2.60       1.0  T
   3    -39.9086905  0.104007E-05  0.848E-03    2.60       2.2  T
   4    -39.9086916 -0.116547E-05  0.336E-03    2.60       5.6  T
   5    -39.9086917 -0.101019E-06  0.921E-04    2.60      20.5  T
   6    -39.9086917 -0.105869E-07  0.307E-04    2.60      61.6  T
     SCC iter.                  ...        0 min,  0.008 sec
     gradient                   ...        0 min,  0.018 sec
 * total energy  :   -39.3099973 Eh     change       -0.1226432E-04 Eh
   gradient norm :     0.0029915 Eh/α   predicted    -0.1692156E-04 (  37.97%)
   displ. norm   :     0.0384977 α      lambda       -0.2922077E-04
   maximum displ.:     0.0211647 α      in ANC's #5, #2, #8, ...

........................................................................
.............................. CYCLE   15 ..............................
........................................................................
   1    -39.9102144 -0.399102E+02  0.183E-02    2.60       0.0  T
   2    -39.9102145 -0.125553E-06  0.102E-02    2.60       1.9  T
   3    -39.9102140  0.557097E-06  0.630E-03    2.60       3.0  T
   4    -39.9102147 -0.706542E-06  0.120E-03    2.60      15.8  T
   5    -39.9102147  0.482609E-08  0.746E-04    2.60      25.3  T
   6    -39.9102147 -0.106238E-07  0.166E-04    2.60     113.7  T
     SCC iter.                  ...        0 min,  0.008 sec
     gradient                   ...        0 min,  0.019 sec
 * total energy  :   -39.3100093 Eh     change       -0.1195678E-04 Eh
   gradient norm :     0.0024155 Eh/α   predicted    -0.1463273E-04 (  22.38%)
   displ. norm   :     0.0385756 α      lambda        0.4490318E-04
   maximum displ.:     0.0211671 α      in ANC's #5, #2, #8, ...

........................................................................
.............................. CYCLE   16 ..............................
........................................................................
   1    -39.9116906 -0.399117E+02  0.183E-02    2.61       0.0  T
   2    -39.9116907 -0.128134E-06  0.102E-02    2.61       1.9  T
   3    -39.9116902  0.540442E-06  0.622E-03    2.61       3.0  T
   4    -39.9116908 -0.688072E-06  0.119E-03    2.61      15.9  T
   5    -39.9116908  0.446651E-08  0.727E-04    2.61      26.0  T
   6    -39.9116909 -0.100215E-07  0.168E-04    2.61     112.4  T
     SCC iter.                  ...        0 min,  0.008 sec
     gradient                   ...        0 min,  0.019 sec
 * total energy  :   -39.3099869 Eh     change        0.2237443E-04 Eh
   gradient norm :     0.0054977 Eh/α   predicted     0.2248042E-04 (   0.47%)
   displ. norm   :     0.0449568 α      lambda       -0.5995122E-04
   maximum displ.:     0.0219842 α      in ANC's #4, #6, #8, ...

........................................................................
.............................. CYCLE   17 ..............................
........................................................................
   1    -39.9103047 -0.399103E+02  0.261E-02    2.61       0.0  T
   2    -39.9103049 -0.229526E-06  0.145E-02    2.61       1.3  T
   3    -39.9103038  0.106799E-05  0.856E-03    2.61       2.2  T
   4    -39.9103052 -0.131181E-05  0.162E-03    2.61      11.7  T
   5    -39.9103051  0.969655E-08  0.981E-04    2.61      19.3  T
     SCC iter.                  ...        0 min,  0.007 sec
     gradient                   ...        0 min,  0.018 sec
 * total energy  :   -39.3100211 Eh     change       -0.3417869E-04 Eh
   gradient norm :     0.0011722 Eh/α   predicted    -0.3004143E-04 ( -12.10%)
   displ. norm   :     0.0741828 α      lambda       -0.9613217E-05
   maximum displ.:     0.0573052 α      in ANC's #2, #6, #4, ...

........................................................................
.............................. CYCLE   18 ..............................
........................................................................
   1    -39.9100056 -0.399100E+02  0.292E-02    2.60       0.0  T
   2    -39.9100057 -0.549753E-07  0.172E-02    2.60       1.1  T
   3    -39.9100055  0.224979E-06  0.348E-03    2.60       5.4  T
   4    -39.9100057 -0.264519E-06  0.760E-04    2.60      24.9  T
   5    -39.9100057 -0.151630E-09  0.270E-04    2.60      70.1  T
     SCC iter.                  ...        0 min,  0.007 sec
     gradient                   ...        0 min,  0.018 sec
 * total energy  :   -39.3100328 Eh     change       -0.1165398E-04 Eh
   gradient norm :     0.0009339 Eh/α   predicted    -0.4822142E-05 ( -58.62%)
   displ. norm   :     0.1171912 α      lambda       -0.1680016E-04
   maximum displ.:     0.0740860 α      in ANC's #2, #5, #6, ...

........................................................................
.............................. CYCLE   19 ..............................
........................................................................
   1    -39.9105478 -0.399105E+02  0.453E-02    2.61       0.0  T
   2    -39.9105482 -0.381377E-06  0.252E-02    2.61       1.0  T
   3    -39.9105481  0.681118E-07  0.470E-03    2.61       4.0  T
   4    -39.9105482 -0.681678E-07  0.280E-03    2.61       6.7  T
   5    -39.9105483 -0.115379E-06  0.492E-04    2.61      38.4  T
   6    -39.9105483 -0.235686E-08  0.279E-04    2.61      67.8  T
     SCC iter.                  ...        0 min,  0.008 sec
     gradient                   ...        0 min,  0.019 sec
 * total energy  :   -39.3100521 Eh     change       -0.1930170E-04 Eh
   gradient norm :     0.0012775 Eh/α   predicted    -0.8454312E-05 ( -56.20%)
   displ. norm   :     0.2312174 α      lambda       -0.2535750E-04
   maximum displ.:     0.1722542 α      in ANC's #2, #5, #6, ...

........................................................................
.............................. CYCLE   20 ..............................
........................................................................
   1    -39.9099790 -0.399100E+02  0.862E-02    2.61       0.0  T
   2    -39.9099799 -0.870560E-06  0.492E-02    2.61       1.0  T
   3    -39.9099800 -0.976768E-07  0.629E-03    2.61       3.0  T
   4    -39.9099798  0.220816E-06  0.413E-03    2.61       4.6  T
   5    -39.9099802 -0.377334E-06  0.789E-04    2.61      23.9  T
   6    -39.9099802 -0.463447E-08  0.494E-04    2.61      38.3  T
     SCC iter.                  ...        0 min,  0.008 sec
     gradient                   ...        0 min,  0.019 sec
 * total energy  :   -39.3100789 Eh     change       -0.2681847E-04 Eh
   gradient norm :     0.0019172 Eh/α   predicted    -0.1298307E-04 ( -51.59%)
   displ. norm   :     0.2302638 α      lambda       -0.2579994E-04
   maximum displ.:     0.1778513 α      in ANC's #2, #5, #6, ...
 * RMSD in coord.:     0.4948784 α      energy gain  -0.7196439E-02 Eh

generating ANC from model Hessian ...
Using Lindh-Hessian (1995)
 Shifting diagonal of input Hessian by   4.053823760977001E-003
 Lowest  eigenvalues of input Hessian
   -0.000000   -0.000000   -0.000000   -0.000000   -0.000000   -0.000000
    0.005000    0.005516    0.006110    0.007085    0.007587    0.008436
    0.009898    0.010140    0.012721    0.016114    0.017859    0.019392
 Highest eigenvalues
    1.628588    1.745620    1.782042    1.853243    1.918908    2.032728
 

........................................................................
.............................. CYCLE   21 ..............................
........................................................................
   1    -39.9100418 -0.399100E+02  0.879E-02    2.61       0.0  T
   2    -39.9100428 -0.963750E-06  0.499E-02    2.61       1.0  T
   3    -39.9100430 -0.229025E-06  0.635E-03    2.61       3.0  T
   4    -39.9100429  0.125266E-06  0.277E-03    2.61       6.8  T
   5    -39.9100430 -0.172750E-06  0.685E-04    2.61      27.6  T
   6    -39.9100430 -0.311218E-09  0.441E-04    2.61      42.8  T
     SCC iter.                  ...        0 min,  0.008 sec
     gradient                   ...        0 min,  0.018 sec
 * total energy  :   -39.3101076 Eh     change       -0.2867703E-04 Eh
   gradient norm :     0.0019639 Eh/α   predicted     0.0000000E+00 (-100.00%)
   displ. norm   :     0.0623060 α      lambda       -0.2175194E-04
   maximum displ.:     0.0405075 α      in ANC's #2, #8, #5, ...

........................................................................
.............................. CYCLE   22 ..............................
........................................................................
   1    -39.9106301 -0.399106E+02  0.346E-02    2.61       0.0  T
   2    -39.9106304 -0.307833E-06  0.186E-02    2.61       1.0  T
   3    -39.9106304  0.575754E-07  0.387E-03    2.61       4.9  T
   4    -39.9106304 -0.749966E-07  0.244E-03    2.61       7.7  T
   5    -39.9106305 -0.657194E-07  0.455E-04    2.61      41.5  T
   6    -39.9106305 -0.387590E-08  0.124E-04    2.61     152.4  T
     SCC iter.                  ...        0 min,  0.009 sec
     gradient                   ...        0 min,  0.019 sec
 * total energy  :   -39.3101283 Eh     change       -0.2074851E-04 Eh
   gradient norm :     0.0006693 Eh/α   predicted    -0.1089492E-04 ( -47.49%)
   displ. norm   :     0.0622661 α      lambda        0.9548226E-05
   maximum displ.:     0.0405079 α      in ANC's #2, #8, #5, ...

........................................................................
.............................. CYCLE   23 ..............................
........................................................................
   1    -39.9111259 -0.399111E+02  0.346E-02    2.61       0.0  T
   2    -39.9111262 -0.304826E-06  0.186E-02    2.61       1.0  T
   3    -39.9111262  0.522772E-07  0.382E-03    2.61       4.9  T
   4    -39.9111263 -0.660235E-07  0.245E-03    2.61       7.7  T
   5    -39.9111263 -0.684603E-07  0.449E-04    2.61      42.1  T
   6    -39.9111263 -0.373028E-08  0.125E-04    2.61     151.2  T
     SCC iter.                  ...        0 min,  0.008 sec
     gradient                   ...        0 min,  0.019 sec
 * total energy  :   -39.3101258 Eh     change        0.2520236E-05 Eh
   gradient norm :     0.0024295 Eh/α   predicted     0.4782258E-05 (  89.75%)
   displ. norm   :     0.0174722 α      lambda       -0.1830959E-04
   maximum displ.:     0.0090131 α      in ANC's #8, #17, #16, ...

........................................................................
.............................. CYCLE   24 ..............................
........................................................................
   1    -39.9108992 -0.399109E+02  0.166E-02    2.61       0.0  T
   2    -39.9108993 -0.947903E-07  0.847E-03    2.61       2.2  T
   3    -39.9108993 -0.143351E-07  0.161E-03    2.61      11.8  T
   4    -39.9108993  0.166680E-07  0.112E-03    2.61      16.8  T
   5    -39.9108993 -0.239064E-07  0.148E-04    2.61     127.4  T
   6    -39.9108993 -0.260805E-09  0.676E-05    2.61     279.4  T
     SCC iter.                  ...        0 min,  0.009 sec
     gradient                   ...        0 min,  0.018 sec
 * total energy  :   -39.3101383 Eh     change       -0.1247640E-04 Eh
   gradient norm :     0.0017352 Eh/α   predicted    -0.9158730E-05 ( -26.59%)
   displ. norm   :     0.0469354 α      lambda       -0.1481383E-04
   maximum displ.:     0.0269552 α      in ANC's #8, #2, #4, ...

........................................................................
.............................. CYCLE   25 ..............................
........................................................................
   1    -39.9100154 -0.399100E+02  0.295E-02    2.61       0.0  T
   2    -39.9100157 -0.275497E-06  0.156E-02    2.61       1.2  T
   3    -39.9100156  0.459019E-07  0.340E-03    2.61       5.6  T
   4    -39.9100157 -0.517773E-07  0.221E-03    2.61       8.6  T
   5    -39.9100157 -0.587752E-07  0.400E-04    2.61      47.3  T
   6    -39.9100157 -0.147517E-08  0.188E-04    2.61     100.4  T
     SCC iter.                  ...        0 min,  0.008 sec
     gradient                   ...        0 min,  0.018 sec
 * total energy  :   -39.3101466 Eh     change       -0.8347183E-05 Eh
   gradient norm :     0.0009593 Eh/α   predicted    -0.7415315E-05 ( -11.16%)
   displ. norm   :     0.0344465 α      lambda       -0.5558788E-05
   maximum displ.:     0.0227020 α      in ANC's #2, #8, #4, ...

........................................................................
.............................. CYCLE   26 ..............................
........................................................................
   1    -39.9101818 -0.399102E+02  0.189E-02    2.61       0.0  T
   2    -39.9101819 -0.841618E-07  0.102E-02    2.61       1.9  T
   3    -39.9101819 -0.960982E-08  0.175E-03    2.61      10.8  T
   4    -39.9101819  0.143546E-07  0.115E-03    2.61      16.4  T
   5    -39.9101819 -0.253812E-07  0.145E-04    2.61     130.7  T
   6    -39.9101819 -0.322743E-09  0.604E-05    2.61     313.0  T
     SCC iter.                  ...        0 min,  0.008 sec
     gradient                   ...        0 min,  0.018 sec
 * total energy  :   -39.3101528 Eh     change       -0.6208241E-05 Eh
   gradient norm :     0.0006051 Eh/α   predicted    -0.2781121E-05 ( -55.20%)
   displ. norm   :     0.0687237 α      lambda       -0.7390355E-05
   maximum displ.:     0.0442881 α      in ANC's #2, #8, #4, ...

........................................................................
.............................. CYCLE   27 ..............................
........................................................................
   1    -39.9105483 -0.399105E+02  0.287E-02    2.61       0.0  T
   2    -39.9105484 -0.965020E-07  0.165E-02    2.61       1.1  T
   3    -39.9105484  0.777161E-08  0.215E-03    2.61       8.8  T
   4    -39.9105484 -0.110639E-08  0.134E-03    2.61      14.1  T
   5    -39.9105485 -0.337080E-07  0.157E-04    2.61     120.8  T
   6    -39.9105485 -0.256755E-09  0.732E-05    2.61     258.2  T
     SCC iter.                  ...        0 min,  0.009 sec
     gradient                   ...        0 min,  0.018 sec
 * total energy  :   -39.3101608 Eh     change       -0.7996331E-05 Eh
   gradient norm :     0.0004003 Eh/α   predicted    -0.3703198E-05 ( -53.69%)
   displ. norm   :     0.0943760 α      lambda       -0.6578455E-05
   maximum displ.:     0.0598605 α      in ANC's #2, #4, #8, ...

........................................................................
.............................. CYCLE   28 ..............................
........................................................................
   1    -39.9105198 -0.399105E+02  0.416E-02    2.61       0.0  T
   2    -39.9105201 -0.256151E-06  0.233E-02    2.61       1.0  T
   3    -39.9105201  0.237657E-07  0.370E-03    2.61       5.1  T
   4    -39.9105201  0.223834E-08  0.238E-03    2.61       8.0  T
   5    -39.9105202 -0.100368E-06  0.217E-04    2.61      87.1  T
   6    -39.9105202 -0.562551E-09  0.128E-04    2.61     147.9  T
     SCC iter.                  ...        0 min,  0.008 sec
     gradient                   ...        0 min,  0.019 sec
 * total energy  :   -39.3101689 Eh     change       -0.8050562E-05 Eh
   gradient norm :     0.0004381 Eh/α   predicted    -0.3306849E-05 ( -58.92%)
   displ. norm   :     0.0965047 α      lambda       -0.6305124E-05
   maximum displ.:     0.0624013 α      in ANC's #2, #4, #6, ...

........................................................................
.............................. CYCLE   29 ..............................
........................................................................
   1    -39.9104746 -0.399105E+02  0.414E-02    2.61       0.0  T
   2    -39.9104749 -0.268982E-06  0.231E-02    2.61       1.0  T
   3    -39.9104749  0.458378E-07  0.395E-03    2.61       4.8  T
   4    -39.9104749 -0.119215E-07  0.258E-03    2.61       7.3  T
   5    -39.9104750 -0.111507E-06  0.337E-04    2.61      56.0  T
   6    -39.9104750 -0.192145E-08  0.149E-04    2.61     126.8  T
     SCC iter.                  ...        0 min,  0.008 sec
     gradient                   ...        0 min,  0.018 sec
 * total energy  :   -39.3101764 Eh     change       -0.7517420E-05 Eh
   gradient norm :     0.0003827 Eh/α   predicted    -0.3166760E-05 ( -57.87%)
   displ. norm   :     0.0980781 α      lambda       -0.5763563E-05
   maximum displ.:     0.0656091 α      in ANC's #2, #4, #6, ...

........................................................................
.............................. CYCLE   30 ..............................
........................................................................
   1    -39.9104954 -0.399105E+02  0.420E-02    2.61       0.0  T
   2    -39.9104957 -0.315251E-06  0.232E-02    2.61       1.0  T
   3    -39.9104957  0.432900E-07  0.417E-03    2.61       4.5  T
   4    -39.9104957 -0.249371E-07  0.262E-03    2.61       7.2  T
   5    -39.9104958 -0.109423E-06  0.266E-04    2.61      71.1  T
   6    -39.9104958 -0.513239E-09  0.178E-04    2.61     106.5  T
     SCC iter.                  ...        0 min,  0.008 sec
     gradient                   ...        0 min,  0.019 sec
 * total energy  :   -39.3101832 Eh     change       -0.6823657E-05 Eh
   gradient norm :     0.0004008 Eh/α   predicted    -0.2897734E-05 ( -57.53%)
   displ. norm   :     0.0738675 α      lambda       -0.4420348E-05
   maximum displ.:     0.0519114 α      in ANC's #2, #6, #4, ...

........................................................................
.............................. CYCLE   31 ..............................
........................................................................
   1    -39.9105061 -0.399105E+02  0.293E-02    2.61       0.0  T
   2    -39.9105063 -0.115888E-06  0.165E-02    2.61       1.1  T
   3    -39.9105063 -0.810566E-09  0.247E-03    2.61       7.7  T
   4    -39.9105062  0.205912E-07  0.162E-03    2.61      11.6  T
   5    -39.9105063 -0.533534E-07  0.188E-04    2.61     100.4  T
   6    -39.9105063 -0.144802E-09  0.132E-04    2.61     142.9  T
     SCC iter.                  ...        0 min,  0.009 sec
     gradient                   ...        0 min,  0.019 sec
 * total energy  :   -39.3101888 Eh     change       -0.5605609E-05 Eh
   gradient norm :     0.0003172 Eh/α   predicted    -0.2219406E-05 ( -60.41%)
   displ. norm   :     0.0681973 α      lambda       -0.4338977E-05
   maximum displ.:     0.0494519 α      in ANC's #2, #1, #7, ...

........................................................................
.............................. CYCLE   32 ..............................
........................................................................
   1    -39.9105508 -0.399106E+02  0.265E-02    2.61       0.0  T
   2    -39.9105509 -0.646056E-07  0.152E-02    2.61       1.2  T
   3    -39.9105509 -0.153638E-08  0.177E-03    2.61      10.7  T
   4    -39.9105509  0.112606E-07  0.119E-03    2.61      15.9  T
   5    -39.9105509 -0.298930E-07  0.190E-04    2.61      99.2  T
   6    -39.9105509 -0.238835E-09  0.121E-04    2.61     155.9  T
     SCC iter.                  ...        0 min,  0.009 sec
     gradient                   ...        0 min,  0.018 sec
 * total energy  :   -39.3101944 Eh     change       -0.5604431E-05 Eh
   gradient norm :     0.0002343 Eh/α   predicted    -0.2177941E-05 ( -61.14%)
   displ. norm   :     0.0600606 α      lambda       -0.3676651E-05
   maximum displ.:     0.0451296 α      in ANC's #2, #1, #7, ...

........................................................................
.............................. CYCLE   33 ..............................
........................................................................
   1    -39.9105189 -0.399105E+02  0.228E-02    2.61       0.0  T
   2    -39.9105189 -0.271705E-07  0.134E-02    2.61       1.4  T
   3    -39.9105189  0.182531E-07  0.132E-03    2.61      14.3  T
   4    -39.9105189 -0.208284E-07  0.791E-04    2.61      23.9  T
   5    -39.9105189 -0.851860E-08  0.172E-04    2.61     110.2  T
     SCC iter.                  ...        0 min,  0.007 sec
     gradient                   ...        0 min,  0.019 sec
 * total energy  :   -39.3101989 Eh     change       -0.4521561E-05 Eh
   gradient norm :     0.0002154 Eh/α   predicted    -0.1844161E-05 ( -59.21%)
   displ. norm   :     0.0605254 α      lambda       -0.1092613E-05
   maximum displ.:     0.0451297 α      in ANC's #2, #1, #7, ...

   *** GEOMETRY OPTIMIZATION CONVERGED AFTER 33 ITERATIONS ***

------------------------------------------------------------------------
 total energy gain   :        -0.0073165 Eh       -4.5912 kcal/mol
 total RMSD          :         0.5601944 a0        0.2964 Å
 total power (kW/mol):        -0.5821048 (step)  -14.2188 (real)
------------------------------------------------------------------------

 ANCopt (total)                0 d,  0 h,  0 min,  1.351 sec
 optimizer setup                ...        0 min,  0.000 sec (  0.011%)
 model hessian                  ...        0 min,  0.011 sec (  0.809%)
 ANC generation                 ...        0 min,  0.002 sec (  0.125%)
 coordinate transformation      ...        0 min,  0.001 sec (  0.052%)
 single point calculation       ...        0 min,  1.325 sec ( 98.050%)
 optimization log               ...        0 min,  0.004 sec (  0.270%)
 hessian update                 ...        0 min,  0.000 sec (  0.036%)
 rational function              ...        0 min,  0.007 sec (  0.499%)

================
 final structure:
================
$coord
   -3.86497517759976   -2.16465311167797   -0.04885899300122      C 
   -3.97627333255516    1.10787817765147   -0.15830921196695      S 
   -0.70974723591916    1.23588856078764   -0.04925819167606      C 
    0.31750827170575   -1.17245765328731    0.06351421295768      C 
   -1.49137023122736   -3.14372661104073    0.06789535224411      C 
   -0.84329203025985   -5.89217864525179    0.11904381243188      C 
    0.20498318776300   -6.74579024720723   -2.43473594753592      C 
    3.57304193841830   -1.04307721998026    0.19033084615612      S 
    3.49548336970628    2.27971028856018    0.10036520228728      C 
    1.07326628987766    3.21503108133448   -0.04345353927320      C 
    0.33168805427601    5.94274837643550   -0.06808310148119      C 
    0.06813520289858    6.95426993956715    2.62729976626759      C 
    5.80823224769089    3.69810658894309    0.18938338407137      C 
    8.10205757076373    2.70038085632975    0.44131862935959      C 
   -5.61541638105538   -3.18543134822495   -0.06911219669970      H 
   -2.52745575947724   -6.98673225239351    0.58665129424046      H 
    0.57917937832278   -6.21798291308836    1.58016196516041      H 
   -1.18914499486797   -6.44746994787315   -3.91582820576634      H 
    0.68530355082228   -8.74246035144768   -2.37616123535284      H 
    1.89711441477635   -5.67823599024696   -2.90412967822749      H 
   -1.48030621047298    6.11938769942824   -1.04098790946853      H 
    1.72888586114633    7.05710865127758   -1.09727775281000      H 
   -1.35274489415391    5.87947778141346    3.65243942893048      H 
   -0.50012847397163    8.92863191535891    2.59653874237039      H 
    1.85484949599454    6.79521104509620    3.63194345172903      H 
    5.58729597713672    5.72610072835002    0.04951910653357      H 
    8.37614860466615    0.68877860963539    0.59965739496256      H 
    9.76968427526172    3.86048797020739    0.50072947740309      H 
$end
           -------------------------------------------------
          |                Final Singlepoint                |
           -------------------------------------------------

          ...................................................
          :                      SETUP                      :
          :.................................................:
          :  # basis functions                  82          :
          :  # atomic orbitals                  80          :
          :  # shells                           44          :
          :  # electrons                        74          :
          :  max. iterations                   250          :
          :  Hamiltonian                  GFN2-xTB          :
          :  restarted?                      false          :
          :  GBSA solvation                  false          :
          :  PC potential                    false          :
          :  electronic temp.          300.0000000     K    :
          :  accuracy                    1.0000000          :
          :  -> integral cutoff          0.2500000E+02      :
          :  -> integral neglect         0.1000000E-07      :
          :  -> SCF convergence          0.1000000E-05 Eh   :
          :  -> wf. convergence          0.1000000E-03 e    :
          :  Broyden damping             0.4000000          :
          ...................................................

 iter      E             dE          RMSdq      gap      omega  full diag
   1    -39.9105189 -0.399105E+02  0.938E-05    2.61       0.0  T
   2    -39.9105189 -0.199520E-10  0.445E-05    2.61     424.5  T
   3    -39.9105189 -0.423555E-10  0.380E-05    2.61     497.4  T

   *** convergence criteria satisfied after 3 iterations ***

         #    Occupation            Energy/Eh            Energy/eV
      -------------------------------------------------------------
         1        2.0000           -0.7274258             -19.7943
       ...           ...                  ...                  ...
        31        2.0000           -0.4373112             -11.8998
        32        2.0000           -0.4341876             -11.8148
        33        2.0000           -0.4307887             -11.7224
        34        2.0000           -0.4199709             -11.4280
        35        2.0000           -0.4067658             -11.0687
        36        2.0000           -0.3745332             -10.1916
        37        2.0000           -0.3646148              -9.9217 (HOMO)
        38                         -0.2685990              -7.3090 (LUMO)
        39                         -0.2165484              -5.8926
        40                         -0.2155871              -5.8664
        41                         -0.1898633              -5.1664
        42                         -0.1748189              -4.7571
       ...                                ...                  ...
        80                          0.6984203              19.0050
      -------------------------------------------------------------
                  HL-Gap            0.0960158 Eh            2.6127 eV
             Fermi-level           -0.3166069 Eh           -8.6153 eV

 SCC (total)                   0 d,  0 h,  0 min,  0.037 sec
 SCC setup                      ...        0 min,  0.000 sec (  0.644%)
 Dispersion                     ...        0 min,  0.000 sec (  0.699%)
 integral evaluation            ...        0 min,  0.012 sec ( 33.275%)
 zeroth order Hamiltonian       ...        0 min,  0.000 sec (  0.569%)
 iterations                     ...        0 min,  0.005 sec ( 13.248%)
 molecular gradient             ...        0 min,  0.019 sec ( 50.306%)
 printout                       ...        0 min,  0.000 sec (  1.116%)

         :::::::::::::::::::::::::::::::::::::::::::::::::::::
         ::                     SUMMARY                     ::
         :::::::::::::::::::::::::::::::::::::::::::::::::::::
         :: total energy             -39.310198928583 Eh    ::
         :: gradient norm              0.000215549139 Eh/a0 ::
         :: HOMO-LUMO gap              2.612723759493 eV    ::
         ::.................................................::
         :: SCC energy               -39.910518898263 Eh    ::
         :: -> isotropic ES            0.003734346587 Eh    ::
         :: -> anisotropic ES          0.003808767782 Eh    ::
         :: -> anisotropic XC          0.020034023365 Eh    ::
         :: -> dispersion             -0.030884043305 Eh    ::
         :: repulsion energy           0.600189715741 Eh    ::
         :: add. restraining           0.000000000000 Eh    ::
         :::::::::::::::::::::::::::::::::::::::::::::::::::::

           -------------------------------------------------
          |                Property Printout                |
           -------------------------------------------------

    * Orbital Energies and Occupations

         #    Occupation            Energy/Eh            Energy/eV
      -------------------------------------------------------------
         1        2.0000           -0.7274258             -19.7943
       ...           ...                  ...                  ...
        25        2.0000           -0.4663338             -12.6896
        26        2.0000           -0.4603712             -12.5273
        27        2.0000           -0.4548954             -12.3783
        28        2.0000           -0.4526634             -12.3176
        29        2.0000           -0.4465808             -12.1521
        30        2.0000           -0.4414655             -12.0129
        31        2.0000           -0.4373112             -11.8998
        32        2.0000           -0.4341876             -11.8148
        33        2.0000           -0.4307887             -11.7224
        34        2.0000           -0.4199709             -11.4280
        35        2.0000           -0.4067658             -11.0687
        36        2.0000           -0.3745332             -10.1916
        37        2.0000           -0.3646148              -9.9217 (HOMO)
        38                         -0.2685990              -7.3090 (LUMO)
        39                         -0.2165484              -5.8926
        40                         -0.2155871              -5.8664
        41                         -0.1898633              -5.1664
        42                         -0.1748189              -4.7571
        43                         -0.1497102              -4.0738
        44                         -0.1316266              -3.5817
        45                         -0.1121798              -3.0526
        46                         -0.0181094              -0.4928
        47                          0.0086325               0.2349
        48                          0.0231622               0.6303
       ...                                ...                  ...
        80                          0.6984203              19.0050
      -------------------------------------------------------------
                  HL-Gap            0.0960158 Eh            2.6127 eV
             Fermi-level           -0.3166069 Eh           -8.6153 eV

     #   Z        covCN         q      C6AA      α(0)
     1   6 C      2.961    -0.030    28.747     8.794
     2  16 S      2.247    -0.063   143.656    20.173
     3   6 C      3.200     0.007    27.304     8.516
     4   6 C      3.203     0.009    27.243     8.503
     5   6 C      3.108    -0.007    28.042     8.676
     6   6 C      3.804    -0.051    21.490     6.600
     7   6 C      3.754    -0.099    22.454     6.757
     8  16 S      2.276    -0.068   143.885    20.189
     9   6 C      3.005     0.015    27.662     8.627
    10   6 C      3.104    -0.014    28.225     8.705
    11   6 C      3.804    -0.050    21.463     6.596
    12   6 C      3.754    -0.098    22.428     6.753
    13   6 C      2.919    -0.030    28.745     8.792
    14   6 C      2.841    -0.088    30.196     9.005
    15   1 H      0.926     0.042     2.426     2.436
    16   1 H      0.924     0.036     2.500     2.473
    17   1 H      0.924     0.045     2.381     2.413
    18   1 H      0.925     0.037     2.493     2.469
    19   1 H      0.925     0.039     2.469     2.457
    20   1 H      0.925     0.044     2.398     2.422
    21   1 H      0.924     0.044     2.390     2.418
    22   1 H      0.924     0.037     2.485     2.465
    23   1 H      0.925     0.040     2.448     2.447
    24   1 H      0.925     0.038     2.472     2.459
    25   1 H      0.925     0.037     2.484     2.464
    26   1 H      0.925     0.041     2.435     2.440
    27   1 H      0.926     0.047     2.361     2.403
    28   1 H      0.926     0.039     2.462     2.453

 Mol. C6AA /au·bohr⁶  :      11444.194285
 Mol. C8AA /au·bohr⁸  :     327809.834488
 Mol. α(0) /au        :        170.905264


Wiberg/Mayer (AO) data.
largest (>0.10) Wiberg bond orders for each atom
          total WBO             WBO to atom ...
     1  C   3.926        C    5 1.604    S    2 1.153    H   15 0.970
     2  S   2.555        C    1 1.153    C    3 1.109
     3  C   3.945        C    4 1.383    C   10 1.249    S    2 1.109
     4  C   3.948        C    3 1.383    C    5 1.224    S    8 1.120
     5  C   3.984        C    1 1.604    C    4 1.224    C    6 1.009
     6  C   3.997        C    5 1.009    C    7 1.002    H   16 0.976    H   17 0.968
     7  C   3.995        C    6 1.002    H   18 0.989    H   20 0.987    H   19 0.986
     8  S   2.545        C    4 1.120    C    9 1.094
     9  C   3.947        C   10 1.500    C   13 1.143    S    8 1.094
    10  C   3.984        C    9 1.500    C    3 1.249    C   11 1.010
    11  C   3.997        C   10 1.010    C   12 0.999    H   21 0.972    H   22 0.970
    12  C   3.996        C   11 0.999    H   23 0.988    H   25 0.988    H   24 0.986
    13  C   3.988        C   14 1.858    C    9 1.143    H   26 0.955
    14  C   3.966        C   13 1.858    H   28 0.978    H   27 0.971
    15  H   0.998        C    1 0.970
    16  H   0.998        C    6 0.976
    17  H   0.998        C    6 0.968
    18  H   0.999        C    7 0.989
    19  H   0.997        C    7 0.986
    20  H   0.998        C    7 0.987
    21  H   0.997        C   11 0.972
    22  H   0.998        C   11 0.970
    23  H   0.998        C   12 0.988
    24  H   0.997        C   12 0.986
    25  H   0.999        C   12 0.988
    26  H   0.998        C   13 0.955
    27  H   0.998        C   14 0.971
    28  H   0.998        C   14 0.978

molecular dipole:
                 x           y           z       tot (Debye)
 q only:        0.044       0.018       0.009
   full:       -0.011       0.018       0.014       0.066
molecular quadrupole (traceless):
                xx          xy          yy          xz          yz          zz
 q only:       -2.790       2.057       5.761      -0.126       0.913      -2.972
  q+dip:       -1.862       5.763       7.279       0.476       0.059      -5.418
   full:       -3.525       5.877       6.872       0.059       0.517      -3.347

           -------------------------------------------------
          |                Geometry Summary                 |
           -------------------------------------------------

      molecular mass/u    :      222.3626000
   center of mass at/Å    :        0.3690286       0.2210827       0.0343136
  moments of inertia/u·Å² :        0.6643907E+03   0.1074072E+04   0.1659468E+04
rotational constants/cm⁻¹ :        0.2537307E-01   0.1569507E-01   0.1015846E-01

 * 28 selected distances

     #   Z        #   Z                                     value/Å
     1   6 C      2  16 S                                 1.7337181
     2  16 S      3   6 C                                 1.7308604
     3   6 C      4   6 C                                 1.3868183
     1   6 C      5   6 C                                 1.3601211
     4   6 C      5   6 C                                 1.4157803
     5   6 C      6   6 C                                 1.4945497
     6   6 C      7   6 C                                 1.5290682
     4   6 C      8  16 S                                 1.7254199
     8  16 S      9   6 C                                 1.7594667 (max)
     3   6 C     10   6 C                                 1.4096567
     9   6 C     10   6 C                                 1.3761300
    11   6 C     12   6 C                                 1.5298372
     9   6 C     13   6 C                                 1.4364584
    13   6 C     14   6 C                                 1.3303902
     1   6 C     15   1 H                                 1.0723438 (min)
     6   6 C     16   1 H                                 1.0913262
     6   6 C     17   1 H                                 1.0927785
     7   6 C     18   1 H                                 1.0878709
     7   6 C     19   1 H                                 1.0871766
     7   6 C     20   1 H                                 1.0874960
    11   6 C     21   1 H                                 1.0923465
    11   6 C     22   1 H                                 1.0913378
    12   6 C     23   1 H                                 1.0877122
    12   6 C     24   1 H                                 1.0873241
    12   6 C     25   1 H                                 1.0879654
    13   6 C     26   1 H                                 1.0820524
    14   6 C     27   1 H                                 1.0775926
    14   6 C     28   1 H                                 1.0754617

 * 3 distinct bonds (by element types)

   Z      Z             #   av. dist./Å        max./Å        min./Å
   1 H    6 C          14     1.0857703     1.0927785     1.0723438
   6 C    6 C          10     1.4268810     1.5298372     1.3303902
   6 C   16 S           4     1.7373663     1.7594667     1.7254199


optimized geometry written to: xtbopt.xyz


           -------------------------------------------------
          | TOTAL ENERGY              -39.310198928583 Eh   |
          | GRADIENT NORM               0.000215549139 Eh/α |
          | HOMO-LUMO GAP               2.612723759493 eV   |
           -------------------------------------------------

------------------------------------------------------------------------
 * finished run on 2021/05/19 at 11:00:30.641     
------------------------------------------------------------------------
 total:
 * wall-time:     0 d,  0 h,  0 min,  1.469 sec
 *  cpu-time:     0 d,  0 h,  0 min,  1.452 sec
 * ratio c/w:     0.988 speedup
 SCF:
 * wall-time:     0 d,  0 h,  0 min,  0.052 sec
 *  cpu-time:     0 d,  0 h,  0 min,  0.052 sec
 * ratio c/w:     1.000 speedup
 ANC optimizer:
 * wall-time:     0 d,  0 h,  0 min,  1.389 sec
 *  cpu-time:     0 d,  0 h,  0 min,  1.375 sec
 * ratio c/w:     0.991 speedup

