      -----------------------------------------------------------      
     |                   =====================                   |     
     |                           x T B                           |     
     |                   =====================                   |     
     |                         S. Grimme                         |     
     |          Mulliken Center for Theoretical Chemistry        |     
     |                    University of Bonn                     |     
     |                Version 6.2 RC2 (SAW190805)                |     
      -----------------------------------------------------------      

   This program is distributed in the hope that it will be useful,
   but WITHOUT ANY WARRANTY; without even the implied warranty of
   MERCHANTABILITY or FITNESS FOR A PARTICULAR PURPOSE.
   
   FOR NON-COMMERCIAL, ACADEMIA USE ONLY.
   
   Cite this work as:
   * S. Grimme, C. Bannwarth, P. Shushkov, J. Chem. Theory Comput., 2017,
     13, 1989-2009. DOI: 10.1021/acs.jctc.7b00118
   * C. Bannwarth, S. Ehlert and S. Grimme., J. Chem. Theory Comput., 2019,
     15, 1652-1671. DOI: 10.1021/acs.jctc.8b01176
   * P. Pracht, E. Caldeweyher, S. Ehlert, S. Grimme, ChemRxiv, 2019, preprint.
     DOI: 10.26434/chemrxiv.8326202.v1
   
   for DFT-D4:
   * E. Caldeweyher, C. Bannwarth and S. Grimme, J. Chem. Phys., 2017,
     147, 034112. DOI: 10.1063/1.4993215
   * E. Caldeweyher, S. Ehlert, A. Hansen, H. Neugebauer, S. Spicher,
     C. Bannwarth and S. Grimme, J. Chem. Phys., 2019, 150, 154122.
     DOI: 10.1063/1.5090222
   
   for sTDA-xTB:
   * S. Grimme and C. Bannwarth, J. Chem. Phys., 2016, 145, 054103.
     DOI: 10.1063/1.4959605
   
   in the mass-spec context:
   * V. Asgeirsson, C. Bauer and S. Grimme, Chem. Sci., 2017, 8, 4879.
     DOI: 10.1039/c7sc00601b
   
   for metadynamics refer to:
   * S. Grimme, J. Chem. Theory Comput., 2019, 155, 2847-2862
     DOI: 10.1021/acs.jctc.9b00143
   
   with help from (in alphabetical order)
   C. Bannwarth, F. Bohle, G. Brandenburg, E. Caldeweyher, M. Checinski,
   S. Dohm, S. Ehlert, S. Ehrlich, F. März, H. Neugebauer, J. Pisarek,
   P. Pracht, P. Shushkov, and S. Spicher.
   
 * started run on 2021/05/19 at 11:00:31.571     

           -------------------------------------------------
          |                Calculation Setup                |
           -------------------------------------------------

          program call               : /ihome/ghutchison/geoffh/xtb/xtb 743.xyz -opt
          hostname                   : smp-n83
          coordinate file            : 743.xyz
          omp threads                :                     1
          number of atoms            :                    18
          number of electrons        :                    46
          charge                     :                     0
          spin                       :                   0.0
          first test random number   :      0.45747546427204


########################################################################
# WARNING! Please study the warnings concerning your input carefully
#  - the use of '-opt' is discouraged, please use '--opt' next time
########################################################################

           ------------------------------------------------- 
          |                 G F N 2 - x T B                 |
          | Geometry, Frequencies, Noncovalent interactions |
          |            JCTC 2019 parametrisation            |
           ------------------------------------------------- 
             KAB for C  - Si     :                1.0500
             KAB for H  - Pd     :                0.9500
             k(s)              :                1.8500
             k(p)              :                2.2300
             k(d)              :                2.2300
             k(f)              :                2.0000
             kEN (H0ij)        :               -2.0000
             D4 a1             :                0.5200
             D4 a2             :                5.0000
             D4 s6             :                1.0000
             D4 s8             :                2.7000
             D4 s9             :                5.0000
             alphaj            :                2.0000

  Z AO/shell   Hii/eV     exponent
  1     Wed Apr 25 08:07:45 CEST 2018   EN: 2.200 GM2: 0.406  GM3: 0.0800  RAES: 1.40
     1s    -10.707211    1.230000
  6     Wed Apr 25 08:07:45 CEST 2018   EN: 2.550 GM2: 0.538  GM3: 0.1500  RAES: 3.00
     2s    -13.970922    2.096432
     2p    -10.063292    1.800000
  7     Wed Apr 25 08:07:45 CEST 2018   EN: 3.040 GM2: 0.461  GM3:-0.0640  RAES: 1.90
     2s    -16.686243    2.339881
     2p    -12.523956    2.014332

           ------------------------------------------------- 
          |        Self-Consistent Charge Iterations        |
           ------------------------------------------------- 

          ...................................................
          :                      SETUP                      :
          :.................................................:
          :  # basis functions                  42          :
          :  # atomic orbitals                  42          :
          :  # shells                           26          :
          :  # electrons                        46          :
          :  max. iterations                   250          :
          :  Hamiltonian                  GFN2-xTB          :
          :  restarted?                      false          :
          :  GBSA solvation                  false          :
          :  PC potential                    false          :
          :  electronic temp.          300.0000000     K    :
          :  accuracy                    1.0000000          :
          :  -> integral cutoff          0.2500000E+02      :
          :  -> integral neglect         0.1000000E-07      :
          :  -> SCF convergence          0.1000000E-05 Eh   :
          :  -> wf. convergence          0.1000000E-03 e    :
          :  Broyden damping             0.4000000          :
          ...................................................

 iter      E             dE          RMSdq      gap      omega  full diag
   1    -25.5775780 -0.255776E+02  0.318E+00    9.93       0.0  T
   2    -25.6033249 -0.257469E-01  0.190E+00   10.03       1.0  T
   3    -25.6045870 -0.126210E-02  0.729E-01    9.79       1.0  T
   4    -25.6052748 -0.687761E-03  0.146E-01    9.78       1.0  T
   5    -25.6053843 -0.109493E-03  0.438E-02    9.76       1.0  T
   6    -25.6053853 -0.986001E-06  0.111E-02    9.77       2.1  T
   7    -25.6053858 -0.499937E-06  0.270E-03    9.77       8.7  T
   8    -25.6053858 -0.148561E-07  0.737E-04    9.77      32.0  T
   9    -25.6053858 -0.122204E-08  0.180E-04    9.77     130.9  T

   *** convergence criteria satisfied after 9 iterations ***

         #    Occupation            Energy/Eh            Energy/eV
      -------------------------------------------------------------
         1        2.0000           -0.6790095             -18.4768
       ...           ...                  ...                  ...
        17        2.0000           -0.4698662             -12.7857
        18        2.0000           -0.4631545             -12.6031
        19        2.0000           -0.4457663             -12.1299
        20        2.0000           -0.3934766             -10.7070
        21        2.0000           -0.3794561             -10.3255
        22        2.0000           -0.3756947             -10.2232
        23        2.0000           -0.3548850              -9.6569 (HOMO)
        24                          0.0040126               0.1092 (LUMO)
        25                          0.0264304               0.7192
        26                          0.0291631               0.7936
        27                          0.0565991               1.5401
        28                          0.0800216               2.1775
       ...                                ...                  ...
        42                          0.3301188               8.9830
      -------------------------------------------------------------
                  HL-Gap            0.3588976 Eh            9.7661 eV
             Fermi-level           -0.1754362 Eh           -4.7739 eV

 SCC (total)                   0 d,  0 h,  0 min,  0.017 sec
 SCC setup                      ...        0 min,  0.000 sec (  1.356%)
 Dispersion                     ...        0 min,  0.000 sec (  1.072%)
 integral evaluation            ...        0 min,  0.004 sec ( 20.713%)
 zeroth order Hamiltonian       ...        0 min,  0.000 sec (  0.493%)
 iterations                     ...        0 min,  0.007 sec ( 37.904%)
 molecular gradient             ...        0 min,  0.006 sec ( 36.426%)
 printout                       ...        0 min,  0.000 sec (  1.744%)

         :::::::::::::::::::::::::::::::::::::::::::::::::::::
         ::                     SUMMARY                     ::
         :::::::::::::::::::::::::::::::::::::::::::::::::::::
         :: total energy             -25.334555375132 Eh    ::
         :: gradient norm              0.037378419934 Eh/a0 ::
         :: HOMO-LUMO gap              9.766101300703 eV    ::
         ::.................................................::
         :: SCC energy               -25.605385775739 Eh    ::
         :: -> isotropic ES            0.036512073472 Eh    ::
         :: -> anisotropic ES          0.005051813579 Eh    ::
         :: -> anisotropic XC          0.026305966488 Eh    ::
         :: -> dispersion             -0.013907807289 Eh    ::
         :: repulsion energy           0.270791788929 Eh    ::
         :: add. restraining           0.000000000000 Eh    ::
         :::::::::::::::::::::::::::::::::::::::::::::::::::::

      ----------------------------------------------------------- 
     |                   =====================                   |
     |                        A N C O P T                        |
     |                   =====================                   |
     |               Approximate Normal Coordinate               |
     |                Rational Function Optimizer                |
      ----------------------------------------------------------- 

          ...................................................
          :                      SETUP                      :
          :.................................................:
          :   optimization level            normal          :
          :   max. optcycles                   200          :
          :   ANC micro-cycles                  20          :
          :   degrees of freedom                48          :
          :.................................................:
          :   RF solver                   davidson          :
          :   input Hessian                  false          :
          :   write xtbopt.log                true          :
          :   linear?                        false          :
          :   energy convergence         0.5000000E-05 Eh   :
          :   grad. convergence          0.1000000E-02 Eh/α :
          :   maximium RF displ.         2.0000000          :
          :   Hlow (freq-cutoff)         0.5000000E-02      :
          :   Hmax (freq-cutoff)         5.0000000          :
          :   S6 in model hess.         20.0000000          :
          ...................................................

generating ANC from model Hessian ...
Using Lindh-Hessian (1995)
 Shifting diagonal of input Hessian by   0.000000000000000E+000
 Lowest  eigenvalues of input Hessian
   -0.000000   -0.000000    0.000000    0.000000    0.000000    0.000000
    0.009143    0.011936    0.020610    0.028749    0.035900    0.050407
    0.056288    0.061705    0.062683    0.065779    0.068514    0.075222
 Highest eigenvalues
    1.372720    1.417106    1.449898    1.478144    1.500722    1.525908
 

........................................................................
.............................. CYCLE    1 ..............................
........................................................................
   1    -25.6053858 -0.256054E+02  0.833E-05    9.77       0.0  T
   2    -25.6053858 -0.126441E-10  0.466E-05    9.77     505.9  T
   3    -25.6053858 -0.557776E-12  0.192E-05    9.77    1226.3  T
     SCC iter.                  ...        0 min,  0.002 sec
     gradient                   ...        0 min,  0.006 sec
 * total energy  :   -25.3345554 Eh     change       -0.8904113E-08 Eh
   gradient norm :     0.0373784 Eh/α   predicted     0.0000000E+00 (-100.00%)
   displ. norm   :     0.3458988 α      lambda       -0.8358262E-02
   maximum displ.:     0.1750577 α      in ANC's #4, #6, #8, ...

........................................................................
.............................. CYCLE    2 ..............................
........................................................................
   1    -25.6046126 -0.256046E+02  0.339E-01    9.49       0.0  T
   2    -25.6046632 -0.506003E-04  0.189E-01    9.49       1.0  T
   3    -25.6046745 -0.112569E-04  0.217E-02    9.50       1.1  T
   4    -25.6046767 -0.225213E-05  0.967E-03    9.50       2.4  T
   5    -25.6046768 -0.757501E-07  0.301E-03    9.50       7.8  T
   6    -25.6046768 -0.166069E-07  0.697E-04    9.50      33.8  T
     SCC iter.                  ...        0 min,  0.004 sec
     gradient                   ...        0 min,  0.006 sec
 * total energy  :   -25.3399352 Eh     change       -0.5379861E-02 Eh
   gradient norm :     0.0170675 Eh/α   predicted    -0.4679151E-02 ( -13.02%)
   displ. norm   :     0.2313528 α      lambda       -0.2142652E-02
   maximum displ.:     0.1006629 α      in ANC's #3, #4, #11, ...

........................................................................
.............................. CYCLE    3 ..............................
........................................................................
   1    -25.6041792 -0.256042E+02  0.222E-01    9.38       0.0  T
   2    -25.6042027 -0.235335E-04  0.125E-01    9.38       1.0  T
   3    -25.6042075 -0.477972E-05  0.169E-02    9.38       1.4  T
   4    -25.6042088 -0.130355E-05  0.659E-03    9.38       3.6  T
   5    -25.6042088 -0.163476E-07  0.131E-03    9.38      18.0  T
   6    -25.6042088 -0.220231E-08  0.198E-04    9.38     118.8  T
     SCC iter.                  ...        0 min,  0.004 sec
     gradient                   ...        0 min,  0.006 sec
 * total energy  :   -25.3412877 Eh     change       -0.1352421E-02 Eh
   gradient norm :     0.0114117 Eh/α   predicted    -0.1128664E-02 ( -16.54%)
   displ. norm   :     0.1349257 α      lambda       -0.5414279E-03
   maximum displ.:     0.0798570 α      in ANC's #3, #2, #4, ...

........................................................................
.............................. CYCLE    4 ..............................
........................................................................
   1    -25.6066284 -0.256066E+02  0.136E-01    9.36       0.0  T
   2    -25.6066378 -0.944865E-05  0.762E-02    9.35       1.0  T
   3    -25.6066394 -0.155203E-05  0.110E-02    9.35       2.1  T
   4    -25.6066400 -0.631036E-06  0.361E-03    9.35       6.5  T
   5    -25.6066400 -0.680634E-08  0.122E-03    9.35      19.3  T
   6    -25.6066400 -0.293232E-08  0.319E-04    9.35      74.0  T
     SCC iter.                  ...        0 min,  0.004 sec
     gradient                   ...        0 min,  0.006 sec
 * total energy  :   -25.3416649 Eh     change       -0.3772678E-03 Eh
   gradient norm :     0.0070313 Eh/α   predicted    -0.2756436E-03 ( -26.94%)
   displ. norm   :     0.1187121 α      lambda       -0.2714467E-03
   maximum displ.:     0.0836811 α      in ANC's #3, #2, #11, ...

........................................................................
.............................. CYCLE    5 ..............................
........................................................................
   1    -25.6095664 -0.256096E+02  0.124E-01    9.37       0.0  T
   2    -25.6095728 -0.636650E-05  0.692E-02    9.36       1.0  T
   3    -25.6095739 -0.114081E-05  0.803E-03    9.36       2.9  T
   4    -25.6095743 -0.391577E-06  0.286E-03    9.36       8.2  T
   5    -25.6095743 -0.107131E-07  0.124E-03    9.36      19.0  T
     SCC iter.                  ...        0 min,  0.003 sec
     gradient                   ...        0 min,  0.006 sec
 * total energy  :   -25.3418423 Eh     change       -0.1773407E-03 Eh
   gradient norm :     0.0029739 Eh/α   predicted    -0.1376375E-03 ( -22.39%)
   displ. norm   :     0.0940839 α      lambda       -0.9508136E-04
   maximum displ.:     0.0692073 α      in ANC's #3, #2, #7, ...

........................................................................
.............................. CYCLE    6 ..............................
........................................................................
   1    -25.6107269 -0.256107E+02  0.960E-02    9.38       0.0  T
   2    -25.6107296 -0.266954E-05  0.538E-02    9.37       1.0  T
   3    -25.6107303 -0.767409E-06  0.398E-03    9.37       5.9  T
   4    -25.6107304 -0.881581E-07  0.191E-03    9.37      12.3  T
   5    -25.6107304 -0.653749E-08  0.814E-04    9.37      28.9  T
   6    -25.6107304 -0.493674E-09  0.137E-04    9.37     172.3  T
     SCC iter.                  ...        0 min,  0.004 sec
     gradient                   ...        0 min,  0.006 sec
 * total energy  :   -25.3419147 Eh     change       -0.7241041E-04 Eh
   gradient norm :     0.0029758 Eh/α   predicted    -0.4796012E-04 ( -33.77%)
   displ. norm   :     0.1806842 α      lambda       -0.1328531E-03
   maximum displ.:     0.1281207 α      in ANC's #3, #2, #1, ...

........................................................................
.............................. CYCLE    7 ..............................
........................................................................
   1    -25.6111384 -0.256111E+02  0.178E-01    9.40       0.0  T
   2    -25.6111470 -0.864402E-05  0.997E-02    9.40       1.0  T
   3    -25.6111496 -0.264142E-05  0.726E-03    9.39       3.2  T
   4    -25.6111500 -0.355549E-06  0.342E-03    9.39       6.9  T
   5    -25.6111500 -0.114882E-07  0.127E-03    9.39      18.5  T
   6    -25.6111500 -0.160346E-08  0.245E-04    9.39      96.2  T
   7    -25.6111500 -0.389115E-09  0.887E-05    9.39     265.8  T
     SCC iter.                  ...        0 min,  0.004 sec
     gradient                   ...        0 min,  0.006 sec
 * total energy  :   -25.3420201 Eh     change       -0.1054076E-03 Eh
   gradient norm :     0.0052326 Eh/α   predicted    -0.6859913E-04 ( -34.92%)
   displ. norm   :     0.3829360 α      lambda       -0.2516309E-03
   maximum displ.:     0.2618160 α      in ANC's #3, #2, #1, ...

........................................................................
.............................. CYCLE    8 ..............................
........................................................................
   1    -25.6092178 -0.256092E+02  0.367E-01    9.44       0.0  T
   2    -25.6092561 -0.383040E-04  0.206E-01    9.44       1.0  T
   3    -25.6092669 -0.107532E-04  0.164E-02    9.43       1.4  T
   4    -25.6092689 -0.207766E-05  0.701E-03    9.43       3.4  T
   5    -25.6092690 -0.235068E-07  0.224E-03    9.43      10.5  T
   6    -25.6092690 -0.640970E-08  0.478E-04    9.43      49.3  T
     SCC iter.                  ...        0 min,  0.004 sec
     gradient                   ...        0 min,  0.006 sec
 * total energy  :   -25.3421969 Eh     change       -0.1768229E-03 Eh
   gradient norm :     0.0115164 Eh/α   predicted    -0.1442617E-03 ( -18.41%)
   displ. norm   :     0.2931519 α      lambda       -0.2732349E-03
   maximum displ.:     0.1846536 α      in ANC's #3, #2, #1, ...

........................................................................
.............................. CYCLE    9 ..............................
........................................................................
   1    -25.6072353 -0.256072E+02  0.279E-01    9.47       0.0  T
   2    -25.6072592 -0.238369E-04  0.157E-01    9.48       1.0  T
   3    -25.6072649 -0.574435E-05  0.141E-02    9.47       1.7  T
   4    -25.6072666 -0.173923E-05  0.546E-03    9.48       4.3  T
   5    -25.6072667 -0.904046E-08  0.141E-03    9.48      16.8  T
   6    -25.6072667 -0.467982E-08  0.369E-04    9.48      63.9  T
     SCC iter.                  ...        0 min,  0.004 sec
     gradient                   ...        0 min,  0.006 sec
 * total energy  :   -25.3424073 Eh     change       -0.2103934E-03 Eh
   gradient norm :     0.0153086 Eh/α   predicted    -0.1483578E-03 ( -29.49%)
   displ. norm   :     0.3226724 α      lambda       -0.7652672E-03
   maximum displ.:     0.1748182 α      in ANC's #4, #1, #3, ...

........................................................................
.............................. CYCLE   10 ..............................
........................................................................
   1    -25.6067574 -0.256068E+02  0.322E-01    9.54       0.0  T
   2    -25.6068018 -0.443979E-04  0.180E-01    9.55       1.0  T
   3    -25.6068090 -0.721975E-05  0.214E-02    9.55       1.1  T
   4    -25.6068124 -0.333939E-05  0.737E-03    9.55       3.2  T
   5    -25.6068124 -0.475297E-07  0.273E-03    9.55       8.6  T
   6    -25.6068124 -0.466314E-08  0.654E-04    9.55      36.0  T
     SCC iter.                  ...        0 min,  0.004 sec
     gradient                   ...        0 min,  0.006 sec
 * total energy  :   -25.3428101 Eh     change       -0.4027920E-03 Eh
   gradient norm :     0.0198891 Eh/α   predicted    -0.4224700E-03 (   4.89%)
   displ. norm   :     0.1003471 α      lambda       -0.5141497E-03
   maximum displ.:     0.0771911 α      in ANC's #1, #3, #5, ...

........................................................................
.............................. CYCLE   11 ..............................
........................................................................
   1    -25.6084231 -0.256084E+02  0.829E-02    9.52       0.0  T
   2    -25.6084266 -0.357533E-05  0.463E-02    9.53       1.0  T
   3    -25.6084271 -0.511068E-06  0.646E-03    9.53       3.7  T
   4    -25.6084274 -0.228153E-06  0.261E-03    9.53       9.0  T
   5    -25.6084274 -0.108427E-07  0.101E-03    9.53      23.4  T
     SCC iter.                  ...        0 min,  0.003 sec
     gradient                   ...        0 min,  0.006 sec
 * total energy  :   -25.3432030 Eh     change       -0.3928702E-03 Eh
   gradient norm :     0.0145256 Eh/α   predicted    -0.2596638E-03 ( -33.91%)
   displ. norm   :     0.4416343 α      lambda       -0.8534208E-03
   maximum displ.:     0.2881624 α      in ANC's #1, #3, #4, ...

........................................................................
.............................. CYCLE   12 ..............................
........................................................................
   1    -25.6050368 -0.256050E+02  0.358E-01    9.52       0.0  T
   2    -25.6050800 -0.431774E-04  0.201E-01    9.53       1.0  T
   3    -25.6050876 -0.760525E-05  0.220E-02    9.52       1.1  T
   4    -25.6050925 -0.491321E-05  0.819E-03    9.53       2.9  T
   5    -25.6050925 -0.135425E-07  0.185E-03    9.53      12.8  T
   6    -25.6050925 -0.181905E-07  0.497E-04    9.53      47.4  T
     SCC iter.                  ...        0 min,  0.004 sec
     gradient                   ...        0 min,  0.006 sec
 * total energy  :   -25.3436723 Eh     change       -0.4693498E-03 Eh
   gradient norm :     0.0145183 Eh/α   predicted    -0.5099458E-03 (   8.65%)
   displ. norm   :     0.2109140 α      lambda       -0.1075659E-02
   maximum displ.:     0.1250506 α      in ANC's #1, #2, #4, ...

........................................................................
.............................. CYCLE   13 ..............................
........................................................................
   1    -25.6136521 -0.256137E+02  0.193E-01    9.55       0.0  T
   2    -25.6136751 -0.230004E-04  0.109E-01    9.54       1.0  T
   3    -25.6136771 -0.201370E-05  0.175E-02    9.55       1.4  T
   4    -25.6136791 -0.192170E-05  0.596E-03    9.55       4.0  T
   5    -25.6136792 -0.839849E-07  0.262E-03    9.55       9.0  T
   6    -25.6136792 -0.482925E-08  0.651E-04    9.55      36.2  T
     SCC iter.                  ...        0 min,  0.004 sec
     gradient                   ...        0 min,  0.006 sec
 * total energy  :   -25.3438267 Eh     change       -0.1543996E-03 Eh
   gradient norm :     0.0181521 Eh/α   predicted    -0.5617557E-03 ( 263.83%)
   displ. norm   :     0.2397589 α      lambda       -0.7716723E-03
   maximum displ.:     0.1327333 α      in ANC's #1, #3, #4, ...

........................................................................
.............................. CYCLE   14 ..............................
........................................................................
   1    -25.6090631 -0.256091E+02  0.220E-01    9.60       0.0  T
   2    -25.6090806 -0.174676E-04  0.123E-01    9.61       1.0  T
   3    -25.6090841 -0.355784E-05  0.126E-02    9.61       1.9  T
   4    -25.6090850 -0.890056E-06  0.501E-03    9.61       4.7  T
   5    -25.6090851 -0.281646E-07  0.182E-03    9.61      13.0  T
   6    -25.6090851 -0.208021E-08  0.400E-04    9.61      58.9  T
     SCC iter.                  ...        0 min,  0.004 sec
     gradient                   ...        0 min,  0.006 sec
 * total energy  :   -25.3442339 Eh     change       -0.4071598E-03 Eh
   gradient norm :     0.0094253 Eh/α   predicted    -0.4080141E-03 (   0.21%)
   displ. norm   :     0.0532537 α      lambda       -0.1896780E-03
   maximum displ.:     0.0292061 α      in ANC's #2, #4, #1, ...

........................................................................
.............................. CYCLE   15 ..............................
........................................................................
   1    -25.6099516 -0.256100E+02  0.701E-02    9.63       0.0  T
   2    -25.6099552 -0.351826E-05  0.388E-02    9.63       1.0  T
   3    -25.6099555 -0.307139E-06  0.733E-03    9.63       3.2  T
   4    -25.6099557 -0.261138E-06  0.200E-03    9.63      11.8  T
   5    -25.6099557 -0.424303E-08  0.788E-04    9.63      29.9  T
     SCC iter.                  ...        0 min,  0.003 sec
     gradient                   ...        0 min,  0.006 sec
 * total energy  :   -25.3443529 Eh     change       -0.1189795E-03 Eh
   gradient norm :     0.0049267 Eh/α   predicted    -0.9510779E-04 ( -20.06%)
   displ. norm   :     0.1469311 α      lambda       -0.1408032E-03
   maximum displ.:     0.1136706 α      in ANC's #1, #2, #3, ...

........................................................................
.............................. CYCLE   16 ..............................
........................................................................
   1    -25.6107084 -0.256107E+02  0.112E-01    9.66       0.0  T
   2    -25.6107112 -0.278196E-05  0.633E-02    9.66       1.0  T
   3    -25.6107121 -0.893470E-06  0.479E-03    9.66       4.9  T
   4    -25.6107122 -0.139073E-06  0.248E-03    9.66       9.5  T
   5    -25.6107122 -0.944437E-08  0.691E-04    9.66      34.1  T
     SCC iter.                  ...        0 min,  0.003 sec
     gradient                   ...        0 min,  0.006 sec
 * total energy  :   -25.3444509 Eh     change       -0.9803126E-04 Eh
   gradient norm :     0.0039030 Eh/α   predicted    -0.7192237E-04 ( -26.63%)
   displ. norm   :     0.1181431 α      lambda       -0.7790727E-04
   maximum displ.:     0.0996858 α      in ANC's #1, #5, #2, ...

........................................................................
.............................. CYCLE   17 ..............................
........................................................................
   1    -25.6118508 -0.256119E+02  0.827E-02    9.68       0.0  T
   2    -25.6118525 -0.173435E-05  0.468E-02    9.68       1.0  T
   3    -25.6118529 -0.398511E-06  0.435E-03    9.68       5.4  T
   4    -25.6118531 -0.160918E-06  0.201E-03    9.68      11.7  T
   5    -25.6118531 -0.556082E-08  0.682E-04    9.68      34.6  T
   6    -25.6118531 -0.350113E-09  0.113E-04    9.68     208.6  T
     SCC iter.                  ...        0 min,  0.004 sec
     gradient                   ...        0 min,  0.006 sec
 * total energy  :   -25.3444983 Eh     change       -0.4742015E-04 Eh
   gradient norm :     0.0023211 Eh/α   predicted    -0.3949797E-04 ( -16.71%)
   displ. norm   :     0.0674130 α      lambda       -0.1897456E-04
   maximum displ.:     0.0488251 α      in ANC's #1, #2, #5, ...

........................................................................
.............................. CYCLE   18 ..............................
........................................................................
   1    -25.6116921 -0.256117E+02  0.540E-02    9.68       0.0  T
   2    -25.6116930 -0.929389E-06  0.305E-02    9.68       1.0  T
   3    -25.6116932 -0.185335E-06  0.279E-03    9.68       8.5  T
   4    -25.6116933 -0.597960E-07  0.120E-03    9.68      19.6  T
   5    -25.6116933 -0.207153E-08  0.480E-04    9.68      49.1  T
   6    -25.6116933 -0.108948E-09  0.999E-05    9.68     236.0  T
     SCC iter.                  ...        0 min,  0.004 sec
     gradient                   ...        0 min,  0.006 sec
 * total energy  :   -25.3445094 Eh     change       -0.1112277E-04 Eh
   gradient norm :     0.0017554 Eh/α   predicted    -0.9532381E-05 ( -14.30%)
   displ. norm   :     0.0290617 α      lambda       -0.8462040E-05
   maximum displ.:     0.0180103 α      in ANC's #2, #3, #1, ...

........................................................................
.............................. CYCLE   19 ..............................
........................................................................
   1    -25.6125097 -0.256125E+02  0.272E-02    9.68       0.0  T
   2    -25.6125101 -0.410326E-06  0.152E-02    9.68       1.6  T
   3    -25.6125102 -0.669394E-07  0.163E-03    9.68      14.5  T
   4    -25.6125102 -0.618146E-08  0.603E-04    9.68      39.1  T
   5    -25.6125102 -0.582727E-09  0.275E-04    9.68      85.7  T
     SCC iter.                  ...        0 min,  0.003 sec
     gradient                   ...        0 min,  0.006 sec
 * total energy  :   -25.3445137 Eh     change       -0.4275765E-05 Eh
   gradient norm :     0.0015690 Eh/α   predicted    -0.4231884E-05 (  -1.03%)
   displ. norm   :     0.0225602 α      lambda       -0.5068330E-05
   maximum displ.:     0.0138205 α      in ANC's #2, #1, #3, ...

........................................................................
.............................. CYCLE   20 ..............................
........................................................................
   1    -25.6120030 -0.256120E+02  0.190E-02    9.68       0.0  T
   2    -25.6120031 -0.105878E-06  0.107E-02    9.68       2.2  T
   3    -25.6120031 -0.228924E-07  0.104E-03    9.68      22.6  T
   4    -25.6120031 -0.801868E-08  0.449E-04    9.68      52.5  T
   5    -25.6120031 -0.116739E-09  0.122E-04    9.68     192.9  T
     SCC iter.                  ...        0 min,  0.003 sec
     gradient                   ...        0 min,  0.006 sec
 * total energy  :   -25.3445159 Eh     change       -0.2175872E-05 Eh
   gradient norm :     0.0009624 Eh/α   predicted    -0.2534812E-05 (  16.50%)
   displ. norm   :     0.0321944 α      lambda       -0.4497778E-05
   maximum displ.:     0.0276390 α      in ANC's #1, #2, #4, ...

   *** GEOMETRY OPTIMIZATION CONVERGED AFTER 20 ITERATIONS ***

------------------------------------------------------------------------
 total energy gain   :        -0.0099605 Eh       -6.2503 kcal/mol
 total RMSD          :         0.6037150 a0        0.3195 Å
 total power (kW/mol):        -1.3075659 (step)  -92.3292 (real)
------------------------------------------------------------------------

 ANCopt (total)                0 d,  0 h,  0 min,  0.283 sec
 optimizer setup                ...        0 min,  0.000 sec (  0.043%)
 model hessian                  ...        0 min,  0.010 sec (  3.481%)
 ANC generation                 ...        0 min,  0.001 sec (  0.197%)
 coordinate transformation      ...        0 min,  0.000 sec (  0.103%)
 single point calculation       ...        0 min,  0.266 sec ( 93.756%)
 optimization log               ...        0 min,  0.002 sec (  0.564%)
 hessian update                 ...        0 min,  0.000 sec (  0.089%)
 rational function              ...        0 min,  0.004 sec (  1.335%)

================
 final structure:
================
$coord
    1.55687055507939    2.25832126089302    0.79193149606501      N 
    3.62225511220713    0.44243581390000    0.83160848485589      C 
    2.43177025077058   -1.99945757430350    0.52019784080064      N 
    0.25456568154208   -1.56375459089633   -1.11179640480544      C 
   -0.18131495276938    1.38867394411522   -1.12664731137220      C 
   -2.77360999529848    1.75572104902471   -0.31826634945050      N 
   -3.30345608330659   -0.49901107865914    1.16483758926290      C 
   -2.03468736533356   -2.62945981405369   -0.05900832467068      N 
    2.11235616986731    4.06955520489546    0.55601983770007      H 
    4.67034661178619    0.56759710890741    2.60406962145810      H 
    4.95108492046828    0.70979691175407   -0.76313498398821      H 
    1.77331370101329   -2.65015367985058    2.19958788149648      H 
    0.66019517600370   -2.32136983812883   -2.99459126205651      H 
    0.13672682861396    2.24457975558804   -2.99419056556545      H 
   -3.93082772898883    1.85510925551536   -1.84588486526866      H 
   -5.32056837129272   -0.82993678571839    1.38927325617546      H 
   -2.43181514300316   -0.21863569404763    3.01941636266607      H 
   -3.13434558188768   -3.38216211989288   -1.43572062919853      H 
$end
           -------------------------------------------------
          |                Final Singlepoint                |
           -------------------------------------------------

          ...................................................
          :                      SETUP                      :
          :.................................................:
          :  # basis functions                  42          :
          :  # atomic orbitals                  42          :
          :  # shells                           26          :
          :  # electrons                        46          :
          :  max. iterations                   250          :
          :  Hamiltonian                  GFN2-xTB          :
          :  restarted?                      false          :
          :  GBSA solvation                  false          :
          :  PC potential                    false          :
          :  electronic temp.          300.0000000     K    :
          :  accuracy                    1.0000000          :
          :  -> integral cutoff          0.2500000E+02      :
          :  -> integral neglect         0.1000000E-07      :
          :  -> SCF convergence          0.1000000E-05 Eh   :
          :  -> wf. convergence          0.1000000E-03 e    :
          :  Broyden damping             0.4000000          :
          ...................................................

 iter      E             dE          RMSdq      gap      omega  full diag
   1    -25.6120031 -0.256120E+02  0.192E-05    9.68       0.0  T
   2    -25.6120031 -0.222400E-11  0.850E-06    9.68    2774.2  T
   3    -25.6120031 -0.294875E-12  0.464E-06    9.68    5083.5  T

   *** convergence criteria satisfied after 3 iterations ***

         #    Occupation            Energy/Eh            Energy/eV
      -------------------------------------------------------------
         1        2.0000           -0.6728203             -18.3084
       ...           ...                  ...                  ...
        17        2.0000           -0.4633437             -12.6082
        18        2.0000           -0.4577911             -12.4571
        19        2.0000           -0.4457324             -12.1290
        20        2.0000           -0.3894647             -10.5979
        21        2.0000           -0.3776558             -10.2765
        22        2.0000           -0.3661508              -9.9635
        23        2.0000           -0.3611752              -9.8281 (HOMO)
        24                         -0.0054593              -0.1486 (LUMO)
        25                          0.0273204               0.7434
        26                          0.0410533               1.1171
        27                          0.0605082               1.6465
        28                          0.0813173               2.2128
       ...                                ...                  ...
        42                          0.3281417               8.9292
      -------------------------------------------------------------
                  HL-Gap            0.3557159 Eh            9.6795 eV
             Fermi-level           -0.1833172 Eh           -4.9883 eV

 SCC (total)                   0 d,  0 h,  0 min,  0.012 sec
 SCC setup                      ...        0 min,  0.000 sec (  1.191%)
 Dispersion                     ...        0 min,  0.000 sec (  0.776%)
 integral evaluation            ...        0 min,  0.003 sec ( 27.097%)
 zeroth order Hamiltonian       ...        0 min,  0.000 sec (  0.621%)
 iterations                     ...        0 min,  0.002 sec ( 17.899%)
 molecular gradient             ...        0 min,  0.006 sec ( 49.904%)
 printout                       ...        0 min,  0.000 sec (  2.129%)

         :::::::::::::::::::::::::::::::::::::::::::::::::::::
         ::                     SUMMARY                     ::
         :::::::::::::::::::::::::::::::::::::::::::::::::::::
         :: total energy             -25.344515884632 Eh    ::
         :: gradient norm              0.000963676897 Eh/a0 ::
         :: HOMO-LUMO gap              9.679522683766 eV    ::
         ::.................................................::
         :: SCC energy               -25.612003124823 Eh    ::
         :: -> isotropic ES            0.035147658944 Eh    ::
         :: -> anisotropic ES          0.005420061935 Eh    ::
         :: -> anisotropic XC          0.025042789302 Eh    ::
         :: -> dispersion             -0.013805110667 Eh    ::
         :: repulsion energy           0.267449688887 Eh    ::
         :: add. restraining           0.000000000000 Eh    ::
         :::::::::::::::::::::::::::::::::::::::::::::::::::::

           -------------------------------------------------
          |                Property Printout                |
           -------------------------------------------------

    * Orbital Energies and Occupations

         #    Occupation            Energy/Eh            Energy/eV
      -------------------------------------------------------------
         1        2.0000           -0.6728203             -18.3084
       ...           ...                  ...                  ...
        11        2.0000           -0.5350508             -14.5595
        12        2.0000           -0.5248236             -14.2812
        13        2.0000           -0.5059849             -13.7685
        14        2.0000           -0.5011781             -13.6377
        15        2.0000           -0.4835022             -13.1568
        16        2.0000           -0.4809111             -13.0863
        17        2.0000           -0.4633437             -12.6082
        18        2.0000           -0.4577911             -12.4571
        19        2.0000           -0.4457324             -12.1290
        20        2.0000           -0.3894647             -10.5979
        21        2.0000           -0.3776558             -10.2765
        22        2.0000           -0.3661508              -9.9635
        23        2.0000           -0.3611752              -9.8281 (HOMO)
        24                         -0.0054593              -0.1486 (LUMO)
        25                          0.0273204               0.7434
        26                          0.0410533               1.1171
        27                          0.0605082               1.6465
        28                          0.0813173               2.2128
        29                          0.0869575               2.3662
        30                          0.0920529               2.5049
        31                          0.0991439               2.6978
        32                          0.1276006               3.4722
        33                          0.1403542               3.8192
        34                          0.1543694               4.2006
       ...                                ...                  ...
        42                          0.3281417               8.9292
      -------------------------------------------------------------
                  HL-Gap            0.3557159 Eh            9.6795 eV
             Fermi-level           -0.1833172 Eh           -4.9883 eV

     #   Z        covCN         q      C6AA      α(0)
     1   7 N      2.699    -0.277    27.151     7.739
     2   6 C      3.752     0.090    19.139     6.239
     3   7 N      2.691    -0.277    27.162     7.740
     4   6 C      3.820     0.111    18.753     6.163
     5   6 C      3.828     0.117    18.655     6.146
     6   7 N      2.687    -0.279    27.194     7.745
     7   6 C      3.782     0.083    19.227     6.246
     8   7 N      2.686    -0.285    27.345     7.766
     9   1 H      0.860     0.141     1.467     1.897
    10   1 H      0.924     0.038     2.476     2.461
    11   1 H      0.922     0.009     2.911     2.668
    12   1 H      0.860     0.166     1.296     1.783
    13   1 H      0.924     0.013     2.840     2.635
    14   1 H      0.923    -0.012     3.281     2.833
    15   1 H      0.860     0.138     1.487     1.910
    16   1 H      0.925     0.031     2.571     2.508
    17   1 H      0.924     0.055     2.253     2.348
    18   1 H      0.860     0.138     1.483     1.908

 Mol. C6AA /au·bohr⁶  :       2795.127327
 Mol. C8AA /au·bohr⁸  :      58729.763907
 Mol. α(0) /au        :         78.734552


Wiberg/Mayer (AO) data.
largest (>0.10) Wiberg bond orders for each atom
          total WBO             WBO to atom ...
     1  N   3.070        C    5 1.009    C    2 0.993    H    9 0.956
     2  C   3.980        N    3 1.020    N    1 0.993    H   10 0.973    H   11 0.963
     3  N   3.065        C    2 1.020    C    4 0.996    H   12 0.946
     4  C   3.978        N    8 1.017    N    3 0.996    H   13 0.967    C    5 0.926
     5  C   3.978        N    1 1.009    N    6 1.008    H   14 0.962    C    4 0.926
     6  N   3.084        C    5 1.008    C    7 1.004    H   15 0.958
     7  C   3.975        N    6 1.004    N    8 0.995    H   16 0.978    H   17 0.967
     8  N   3.082        C    4 1.017    C    7 0.995    H   18 0.959
     9  H   0.980        N    1 0.956
    10  H   0.999        C    2 0.973
    11  H   1.000        C    2 0.963
    12  H   0.972        N    3 0.946
    13  H   1.000        C    4 0.967
    14  H   1.000        C    5 0.962
    15  H   0.981        N    6 0.958
    16  H   0.999        C    7 0.978
    17  H   0.997        C    7 0.967
    18  H   0.981        N    8 0.959

molecular dipole:
                 x           y           z       tot (Debye)
 q only:       -0.148       0.027      -0.050
   full:       -0.316       0.260      -0.667       1.990
molecular quadrupole (traceless):
                xx          xy          yy          xz          yz          zz
 q only:        1.658       2.369      -2.204       1.772      -0.597       0.546
  q+dip:        1.829       5.802      -5.371       3.756      -1.342       3.542
   full:        2.436       5.925      -5.051       3.931      -1.426       2.614

           -------------------------------------------------
          |                Geometry Summary                 |
           -------------------------------------------------

      molecular mass/u    :      114.1498000
   center of mass at/Å    :       -0.0337921      -0.0526168       0.0459889
  moments of inertia/u·Å² :        0.1351001E+03   0.2256678E+03   0.2983821E+03
rotational constants/cm⁻¹ :        0.1247788E+00   0.7470109E-01   0.5649680E-01

 * 18 selected distances

     #   Z        #   Z                                     value/Å
     1   7 N      2   6 C                                 1.4554614
     2   6 C      3   7 N                                 1.4469950
     3   7 N      4   6 C                                 1.4582134
     1   7 N      5   6 C                                 1.4451985
     5   6 C      6   7 N                                 1.4500033
     6   7 N      7   6 C                                 1.4553963
     4   6 C      8   7 N                                 1.4477394
     7   6 C      8   7 N                                 1.4632861 (max)
     1   7 N      9   1 H                                 1.0102695 (min)
     2   6 C     10   1 H                                 1.0916684
     2   6 C     11   1 H                                 1.1075463
     3   7 N     12   1 H                                 1.0147685
     4   6 C     13   1 H                                 1.0952094
     5   6 C     14   1 H                                 1.1000580
     6   7 N     15   1 H                                 1.0155033
     7   6 C     16   1 H                                 1.0881801
     7   6 C     17   1 H                                 1.0944930
     8   7 N     18   1 H                                 1.0139160

 * 3 distinct bonds (by element types)

   Z      Z             #   av. dist./Å        max./Å        min./Å
   1 H    6 C           6     1.0961925     1.1075463     1.0881801
   1 H    7 N           4     1.0136143     1.0155033     1.0102695
   6 C    7 N           8     1.4527867     1.4632861     1.4451985


optimized geometry written to: xtbopt.xyz


           -------------------------------------------------
          | TOTAL ENERGY              -25.344515884632 Eh   |
          | GRADIENT NORM               0.000963676897 Eh/α |
          | HOMO-LUMO GAP               9.679522683766 eV   |
           -------------------------------------------------

------------------------------------------------------------------------
 * finished run on 2021/05/19 at 11:00:31.901     
------------------------------------------------------------------------
 total:
 * wall-time:     0 d,  0 h,  0 min,  0.330 sec
 *  cpu-time:     0 d,  0 h,  0 min,  0.329 sec
 * ratio c/w:     0.997 speedup
 SCF:
 * wall-time:     0 d,  0 h,  0 min,  0.017 sec
 *  cpu-time:     0 d,  0 h,  0 min,  0.017 sec
 * ratio c/w:     1.000 speedup
 ANC optimizer:
 * wall-time:     0 d,  0 h,  0 min,  0.296 sec
 *  cpu-time:     0 d,  0 h,  0 min,  0.296 sec
 * ratio c/w:     1.000 speedup

