      -----------------------------------------------------------      
     |                   =====================                   |     
     |                           x T B                           |     
     |                   =====================                   |     
     |                         S. Grimme                         |     
     |          Mulliken Center for Theoretical Chemistry        |     
     |                    University of Bonn                     |     
     |                Version 6.2 RC2 (SAW190805)                |     
      -----------------------------------------------------------      

   This program is distributed in the hope that it will be useful,
   but WITHOUT ANY WARRANTY; without even the implied warranty of
   MERCHANTABILITY or FITNESS FOR A PARTICULAR PURPOSE.
   
   FOR NON-COMMERCIAL, ACADEMIA USE ONLY.
   
   Cite this work as:
   * S. Grimme, C. Bannwarth, P. Shushkov, J. Chem. Theory Comput., 2017,
     13, 1989-2009. DOI: 10.1021/acs.jctc.7b00118
   * C. Bannwarth, S. Ehlert and S. Grimme., J. Chem. Theory Comput., 2019,
     15, 1652-1671. DOI: 10.1021/acs.jctc.8b01176
   * P. Pracht, E. Caldeweyher, S. Ehlert, S. Grimme, ChemRxiv, 2019, preprint.
     DOI: 10.26434/chemrxiv.8326202.v1
   
   for DFT-D4:
   * E. Caldeweyher, C. Bannwarth and S. Grimme, J. Chem. Phys., 2017,
     147, 034112. DOI: 10.1063/1.4993215
   * E. Caldeweyher, S. Ehlert, A. Hansen, H. Neugebauer, S. Spicher,
     C. Bannwarth and S. Grimme, J. Chem. Phys., 2019, 150, 154122.
     DOI: 10.1063/1.5090222
   
   for sTDA-xTB:
   * S. Grimme and C. Bannwarth, J. Chem. Phys., 2016, 145, 054103.
     DOI: 10.1063/1.4959605
   
   in the mass-spec context:
   * V. Asgeirsson, C. Bauer and S. Grimme, Chem. Sci., 2017, 8, 4879.
     DOI: 10.1039/c7sc00601b
   
   for metadynamics refer to:
   * S. Grimme, J. Chem. Theory Comput., 2019, 155, 2847-2862
     DOI: 10.1021/acs.jctc.9b00143
   
   with help from (in alphabetical order)
   C. Bannwarth, F. Bohle, G. Brandenburg, E. Caldeweyher, M. Checinski,
   S. Dohm, S. Ehlert, S. Ehrlich, F. März, H. Neugebauer, J. Pisarek,
   P. Pracht, P. Shushkov, and S. Spicher.
   
 * started run on 2021/05/19 at 11:00:32.110     

           -------------------------------------------------
          |                Calculation Setup                |
           -------------------------------------------------

          program call               : /ihome/ghutchison/geoffh/xtb/xtb 745.xyz -opt
          hostname                   : smp-n83
          coordinate file            : 745.xyz
          omp threads                :                     1
          number of atoms            :                    18
          number of electrons        :                    60
          charge                     :                     0
          spin                       :                   0.0
          first test random number   :      0.55318774749569


########################################################################
# WARNING! Please study the warnings concerning your input carefully
#  - the use of '-opt' is discouraged, please use '--opt' next time
########################################################################

           ------------------------------------------------- 
          |                 G F N 2 - x T B                 |
          | Geometry, Frequencies, Noncovalent interactions |
          |            JCTC 2019 parametrisation            |
           ------------------------------------------------- 
             KAB for C  - Si     :                1.0500
             KAB for H  - Pd     :                0.9500
             k(s)              :                1.8500
             k(p)              :                2.2300
             k(d)              :                2.2300
             k(f)              :                2.0000
             kEN (H0ij)        :               -2.0000
             D4 a1             :                0.5200
             D4 a2             :                5.0000
             D4 s6             :                1.0000
             D4 s8             :                2.7000
             D4 s9             :                5.0000
             alphaj            :                2.0000

  Z AO/shell   Hii/eV     exponent
  1     Wed Apr 25 08:07:45 CEST 2018   EN: 2.200 GM2: 0.406  GM3: 0.0800  RAES: 1.40
     1s    -10.707211    1.230000
  6     Wed Apr 25 08:07:45 CEST 2018   EN: 2.550 GM2: 0.538  GM3: 0.1500  RAES: 3.00
     2s    -13.970922    2.096432
     2p    -10.063292    1.800000
  9     Mon Apr 23 13:58:50 CEST 2018   EN: 3.980 GM2: 0.532  GM3: 0.1426  RAES: 2.40
     2s    -23.458179    2.416361
     2p    -15.746583    2.308399

           ------------------------------------------------- 
          |        Self-Consistent Charge Iterations        |
           ------------------------------------------------- 

          ...................................................
          :                      SETUP                      :
          :.................................................:
          :  # basis functions                  54          :
          :  # atomic orbitals                  54          :
          :  # shells                           30          :
          :  # electrons                        60          :
          :  max. iterations                   250          :
          :  Hamiltonian                  GFN2-xTB          :
          :  restarted?                      false          :
          :  GBSA solvation                  false          :
          :  PC potential                    false          :
          :  electronic temp.          300.0000000     K    :
          :  accuracy                    1.0000000          :
          :  -> integral cutoff          0.2500000E+02      :
          :  -> integral neglect         0.1000000E-07      :
          :  -> SCF convergence          0.1000000E-05 Eh   :
          :  -> wf. convergence          0.1000000E-03 e    :
          :  Broyden damping             0.4000000          :
          ...................................................

 iter      E             dE          RMSdq      gap      omega  full diag
   1    -34.2908840 -0.342909E+02  0.497E+00    1.44       0.0  T
   2    -34.3049919 -0.141079E-01  0.348E+00    1.41       1.0  T
   3    -34.2989906  0.600138E-02  0.210E+00    1.43       1.0  T
   4    -34.3324242 -0.334337E-01  0.294E-01    1.38       1.0  T
   5    -34.3327312 -0.306941E-03  0.786E-02    1.39       1.0  T
   6    -34.3327444 -0.132457E-04  0.433E-02    1.39       1.0  T
   7    -34.3327545 -0.100898E-04  0.260E-02    1.39       1.0  T
   8    -34.3327602 -0.566137E-05  0.106E-02    1.39       2.2  T
   9    -34.3327596  0.572488E-06  0.830E-03    1.39       2.8  T
  10    -34.3327607 -0.112633E-05  0.107E-03    1.39      22.0  T
  11    -34.3327607 -0.107642E-07  0.552E-04    1.39      42.7  T
  12    -34.3327607  0.866876E-09  0.421E-04    1.39      56.0  T

   *** convergence criteria satisfied after 12 iterations ***

         #    Occupation            Energy/Eh            Energy/eV
      -------------------------------------------------------------
         1        2.0000           -0.8257356             -22.4694
       ...           ...                  ...                  ...
        24        2.0000           -0.4689560             -12.7609
        25        2.0000           -0.4676385             -12.7251
        26        2.0000           -0.4625126             -12.5856
        27        2.0000           -0.4406946             -11.9919
        28        2.0000           -0.4290610             -11.6753
        29        2.0000           -0.3940513             -10.7227
        30        2.0000           -0.3930956             -10.6967 (HOMO)
        31                         -0.3421318              -9.3099 (LUMO)
        32                         -0.2194590              -5.9718
        33                         -0.1718448              -4.6761
        34                         -0.1702046              -4.6315
        35                         -0.1175006              -3.1974
       ...                                ...                  ...
        54                          0.7624283              20.7467
      -------------------------------------------------------------
                  HL-Gap            0.0509638 Eh            1.3868 eV
             Fermi-level           -0.3674670 Eh           -9.9993 eV

 SCC (total)                   0 d,  0 h,  0 min,  0.026 sec
 SCC setup                      ...        0 min,  0.000 sec (  0.979%)
 Dispersion                     ...        0 min,  0.000 sec (  0.932%)
 integral evaluation            ...        0 min,  0.006 sec ( 22.828%)
 zeroth order Hamiltonian       ...        0 min,  0.000 sec (  0.495%)
 iterations                     ...        0 min,  0.010 sec ( 39.668%)
 molecular gradient             ...        0 min,  0.009 sec ( 33.761%)
 printout                       ...        0 min,  0.000 sec (  1.127%)

         :::::::::::::::::::::::::::::::::::::::::::::::::::::
         ::                     SUMMARY                     ::
         :::::::::::::::::::::::::::::::::::::::::::::::::::::
         :: total energy             -33.839803908636 Eh    ::
         :: gradient norm              0.031608932716 Eh/a0 ::
         :: HOMO-LUMO gap              1.386795742607 eV    ::
         ::.................................................::
         :: SCC energy               -34.332760731091 Eh    ::
         :: -> isotropic ES            0.021815186546 Eh    ::
         :: -> anisotropic ES         -0.000499246297 Eh    ::
         :: -> anisotropic XC          0.007208832941 Eh    ::
         :: -> dispersion             -0.016314674417 Eh    ::
         :: repulsion energy           0.492942814185 Eh    ::
         :: add. restraining           0.000000000000 Eh    ::
         :::::::::::::::::::::::::::::::::::::::::::::::::::::

      ----------------------------------------------------------- 
     |                   =====================                   |
     |                        A N C O P T                        |
     |                   =====================                   |
     |               Approximate Normal Coordinate               |
     |                Rational Function Optimizer                |
      ----------------------------------------------------------- 

          ...................................................
          :                      SETUP                      :
          :.................................................:
          :   optimization level            normal          :
          :   max. optcycles                   200          :
          :   ANC micro-cycles                  20          :
          :   degrees of freedom                48          :
          :.................................................:
          :   RF solver                   davidson          :
          :   input Hessian                  false          :
          :   write xtbopt.log                true          :
          :   linear?                        false          :
          :   energy convergence         0.5000000E-05 Eh   :
          :   grad. convergence          0.1000000E-02 Eh/α :
          :   maximium RF displ.         2.0000000          :
          :   Hlow (freq-cutoff)         0.5000000E-02      :
          :   Hmax (freq-cutoff)         5.0000000          :
          :   S6 in model hess.         20.0000000          :
          ...................................................

generating ANC from model Hessian ...
Using Lindh-Hessian (1995)
 Shifting diagonal of input Hessian by   3.027838011606647E-003
 Lowest  eigenvalues of input Hessian
   -0.000000   -0.000000   -0.000000   -0.000000   -0.000000    0.000000
    0.005000    0.006959    0.010423    0.012866    0.020597    0.020916
    0.025207    0.032736    0.041220    0.053864    0.078102    0.094309
 Highest eigenvalues
    1.813452    1.906228    1.912869    2.070923    2.086253    2.177844
 

........................................................................
.............................. CYCLE    1 ..............................
........................................................................
   1    -34.3327607 -0.343328E+02  0.132E-04    1.39       0.0  T
   2    -34.3327607  0.707701E-11  0.105E-04    1.39     225.4  T
   3    -34.3327607 -0.141164E-09  0.393E-05    1.39     599.1  T
     SCC iter.                  ...        0 min,  0.003 sec
     gradient                   ...        0 min,  0.009 sec
 * total energy  :   -33.8398039 Eh     change       -0.1260454E-07 Eh
   gradient norm :     0.0316097 Eh/α   predicted     0.0000000E+00 (-100.00%)
   displ. norm   :     0.1641912 α      lambda       -0.2605819E-02
   maximum displ.:     0.1282694 α      in ANC's #9, #19, #10, ...

........................................................................
.............................. CYCLE    2 ..............................
........................................................................
   1    -34.3277326 -0.343277E+02  0.835E-02    1.34       0.0  T
   2    -34.3277372 -0.452585E-05  0.566E-02    1.34       1.0  T
   3    -34.3277332  0.393611E-05  0.405E-02    1.34       1.0  T
   4    -34.3277478 -0.146028E-04  0.631E-03    1.34       3.7  T
   5    -34.3277482 -0.369618E-06  0.246E-03    1.34       9.6  T
   6    -34.3277482  0.283457E-07  0.211E-03    1.34      11.2  T
     SCC iter.                  ...        0 min,  0.005 sec
     gradient                   ...        0 min,  0.008 sec
 * total energy  :   -33.8414284 Eh     change       -0.1624506E-02 Eh
   gradient norm :     0.0136503 Eh/α   predicted    -0.1338032E-02 ( -17.63%)
   displ. norm   :     0.0518060 α      lambda       -0.3619910E-03
   maximum displ.:     0.0377461 α      in ANC's #19, #9, #14, ...

........................................................................
.............................. CYCLE    3 ..............................
........................................................................
   1    -34.3268937 -0.343269E+02  0.496E-02    1.34       0.0  T
   2    -34.3268965 -0.285913E-05  0.312E-02    1.35       1.0  T
   3    -34.3268937  0.282404E-05  0.216E-02    1.35       1.1  T
   4    -34.3268977 -0.393552E-05  0.534E-03    1.35       4.4  T
   5    -34.3268980 -0.354657E-06  0.133E-03    1.35      17.8  T
   6    -34.3268980  0.138117E-08  0.114E-03    1.35      20.6  T
     SCC iter.                  ...        0 min,  0.005 sec
     gradient                   ...        0 min,  0.008 sec
 * total energy  :   -33.8416461 Eh     change       -0.2177211E-03 Eh
   gradient norm :     0.0061992 Eh/α   predicted    -0.1814828E-03 ( -16.64%)
   displ. norm   :     0.0208327 α      lambda       -0.5358140E-04
   maximum displ.:     0.0115852 α      in ANC's #14, #19, #9, ...

........................................................................
.............................. CYCLE    4 ..............................
........................................................................
   1    -34.3272324 -0.343272E+02  0.237E-02    1.36       0.0  T
   2    -34.3272331 -0.661124E-06  0.141E-02    1.36       1.7  T
   3    -34.3272328  0.314532E-06  0.842E-03    1.36       2.8  T
   4    -34.3272332 -0.394418E-06  0.259E-03    1.36       9.1  T
   5    -34.3272333 -0.113763E-06  0.499E-04    1.36      47.2  T
     SCC iter.                  ...        0 min,  0.004 sec
     gradient                   ...        0 min,  0.008 sec
 * total energy  :   -33.8416812 Eh     change       -0.3508723E-04 Eh
   gradient norm :     0.0027177 Eh/α   predicted    -0.2680170E-04 ( -23.61%)
   displ. norm   :     0.0146285 α      lambda       -0.1512823E-04
   maximum displ.:     0.0081310 α      in ANC's #10, #14, #9, ...

........................................................................
.............................. CYCLE    5 ..............................
........................................................................
   1    -34.3276188 -0.343276E+02  0.133E-02    1.37       0.0  T
   2    -34.3276189 -0.123908E-06  0.801E-03    1.37       2.9  T
   3    -34.3276187  0.193728E-06  0.614E-03    1.37       3.8  T
   4    -34.3276190 -0.330985E-06  0.135E-03    1.37      17.5  T
   5    -34.3276191 -0.319069E-07  0.454E-04    1.37      51.9  T
   6    -34.3276191 -0.190947E-08  0.263E-04    1.37      89.6  T
     SCC iter.                  ...        0 min,  0.005 sec
     gradient                   ...        0 min,  0.009 sec
 * total energy  :   -33.8416901 Eh     change       -0.8887312E-05 Eh
   gradient norm :     0.0008748 Eh/α   predicted    -0.7567261E-05 ( -14.85%)
   displ. norm   :     0.0098360 α      lambda       -0.1979151E-05
   maximum displ.:     0.0062120 α      in ANC's #2, #10, #14, ...

........................................................................
.............................. CYCLE    6 ..............................
........................................................................
   1    -34.3277477 -0.343277E+02  0.742E-03    1.37       0.0  T
   2    -34.3277477 -0.107853E-09  0.484E-03    1.37       4.9  T
   3    -34.3277477  0.180167E-07  0.353E-03    1.37       6.7  T
   4    -34.3277478 -0.122725E-06  0.358E-04    1.37      65.9  T
   5    -34.3277478 -0.716263E-09  0.215E-04    1.37     109.7  T
     SCC iter.                  ...        0 min,  0.004 sec
     gradient                   ...        0 min,  0.009 sec
 * total energy  :   -33.8416913 Eh     change       -0.1156125E-05 Eh
   gradient norm :     0.0005321 Eh/α   predicted    -0.9899364E-06 ( -14.37%)
   displ. norm   :     0.0037586 α      lambda       -0.5222970E-06
   maximum displ.:     0.0018488 α      in ANC's #7, #11, #9, ...

   *** GEOMETRY OPTIMIZATION CONVERGED AFTER 6 ITERATIONS ***

------------------------------------------------------------------------
 total energy gain   :        -0.0018874 Eh       -1.1843 kcal/mol
 total RMSD          :         0.0495802 a0        0.0262 Å
 total power (kW/mol):        -0.8258818 (step)  -41.2597 (real)
------------------------------------------------------------------------

 ANCopt (total)                0 d,  0 h,  0 min,  0.120 sec
 optimizer setup                ...        0 min,  0.000 sec (  0.107%)
 model hessian                  ...        0 min,  0.002 sec (  1.500%)
 ANC generation                 ...        0 min,  0.000 sec (  0.376%)
 coordinate transformation      ...        0 min,  0.000 sec (  0.070%)
 single point calculation       ...        0 min,  0.115 sec ( 96.025%)
 optimization log               ...        0 min,  0.001 sec (  0.418%)
 hessian update                 ...        0 min,  0.000 sec (  0.062%)
 rational function              ...        0 min,  0.001 sec (  1.052%)

================
 final structure:
================
$coord
    1.35838647492576   -1.96267566803421    0.00788663826228      C 
    2.18762770546212    0.44088672552659   -0.00004436097506      C 
    0.00477763933256    2.11896981429891   -0.00350550295091      C 
   -2.18327001157962    0.41427339550079    0.00276041416649      C 
   -1.40081486117648   -1.99733908545045    0.00931720763431      C 
   -4.58065333588040    1.22365187402866    0.00190538065106      F 
   -0.02398674106086    4.68066777368315   -0.01580436556342      C 
   -2.20685257776279    6.35868280970588   -0.02586542339636      C 
   -1.37768432616596    8.76217122726148   -0.04218989144948      C 
    1.38149995400623    8.79691153925684   -0.04437643509095      C 
    2.16399734322269    6.38534839920689   -0.02856097838294      C 
    4.56138204510928    5.57598330255544   -0.02444114094669      F 
    2.49460027084090   -3.64489031553944    0.01230777462685      H 
    4.10950181435130    1.07960438817317   -0.00313125653078      H 
   -2.55041770171274   -3.66717755699055    0.01488827383908      H 
   -4.12867661466326    5.71982282636336   -0.02047098585689      H 
   -2.51399456687771   10.44429915841386   -0.05269289427140      H 
    2.53108175022400   10.46673077384654   -0.05632353856540      H 
$end
           -------------------------------------------------
          |                Final Singlepoint                |
           -------------------------------------------------

          ...................................................
          :                      SETUP                      :
          :.................................................:
          :  # basis functions                  54          :
          :  # atomic orbitals                  54          :
          :  # shells                           30          :
          :  # electrons                        60          :
          :  max. iterations                   250          :
          :  Hamiltonian                  GFN2-xTB          :
          :  restarted?                      false          :
          :  GBSA solvation                  false          :
          :  PC potential                    false          :
          :  electronic temp.          300.0000000     K    :
          :  accuracy                    1.0000000          :
          :  -> integral cutoff          0.2500000E+02      :
          :  -> integral neglect         0.1000000E-07      :
          :  -> SCF convergence          0.1000000E-05 Eh   :
          :  -> wf. convergence          0.1000000E-03 e    :
          :  Broyden damping             0.4000000          :
          ...................................................

 iter      E             dE          RMSdq      gap      omega  full diag
   1    -34.3277478 -0.343277E+02  0.162E-04    1.37       0.0  T
   2    -34.3277478  0.112820E-09  0.966E-05    1.37     244.1  T
   3    -34.3277478 -0.147800E-09  0.103E-04    1.37     228.0  T

   *** convergence criteria satisfied after 3 iterations ***

         #    Occupation            Energy/Eh            Energy/eV
      -------------------------------------------------------------
         1        2.0000           -0.8254127             -22.4606
       ...           ...                  ...                  ...
        24        2.0000           -0.4700324             -12.7902
        25        2.0000           -0.4662423             -12.6871
        26        2.0000           -0.4648050             -12.6480
        27        2.0000           -0.4391298             -11.9493
        28        2.0000           -0.4274891             -11.6326
        29        2.0000           -0.3934847             -10.7073
        30        2.0000           -0.3925238             -10.6811 (HOMO)
        31                         -0.3420230              -9.3069 (LUMO)
        32                         -0.2195012              -5.9729
        33                         -0.1726883              -4.6991
        34                         -0.1715107              -4.6670
        35                         -0.1216512              -3.3103
       ...                                ...                  ...
        54                          0.7383323              20.0910
      -------------------------------------------------------------
                  HL-Gap            0.0505008 Eh            1.3742 eV
             Fermi-level           -0.3671269 Eh           -9.9900 eV

 SCC (total)                   0 d,  0 h,  0 min,  0.019 sec
 SCC setup                      ...        0 min,  0.000 sec (  0.842%)
 Dispersion                     ...        0 min,  0.000 sec (  0.778%)
 integral evaluation            ...        0 min,  0.006 sec ( 31.922%)
 zeroth order Hamiltonian       ...        0 min,  0.000 sec (  0.575%)
 iterations                     ...        0 min,  0.003 sec ( 16.326%)
 molecular gradient             ...        0 min,  0.009 sec ( 47.533%)
 printout                       ...        0 min,  0.000 sec (  1.744%)

         :::::::::::::::::::::::::::::::::::::::::::::::::::::
         ::                     SUMMARY                     ::
         :::::::::::::::::::::::::::::::::::::::::::::::::::::
         :: total energy             -33.841691254390 Eh    ::
         :: gradient norm              0.000532407383 Eh/a0 ::
         :: HOMO-LUMO gap              1.374197328708 eV    ::
         ::.................................................::
         :: SCC energy               -34.327747789852 Eh    ::
         :: -> isotropic ES            0.021747097087 Eh    ::
         :: -> anisotropic ES         -0.000769114083 Eh    ::
         :: -> anisotropic XC          0.007602264645 Eh    ::
         :: -> dispersion             -0.016233829234 Eh    ::
         :: repulsion energy           0.486044996250 Eh    ::
         :: add. restraining           0.000000000000 Eh    ::
         :::::::::::::::::::::::::::::::::::::::::::::::::::::

           -------------------------------------------------
          |                Property Printout                |
           -------------------------------------------------

    * Orbital Energies and Occupations

         #    Occupation            Energy/Eh            Energy/eV
      -------------------------------------------------------------
         1        2.0000           -0.8254127             -22.4606
       ...           ...                  ...                  ...
        18        2.0000           -0.5095128             -13.8646
        19        2.0000           -0.5003029             -13.6139
        20        2.0000           -0.4980205             -13.5518
        21        2.0000           -0.4977651             -13.5449
        22        2.0000           -0.4762873             -12.9604
        23        2.0000           -0.4734973             -12.8845
        24        2.0000           -0.4700324             -12.7902
        25        2.0000           -0.4662423             -12.6871
        26        2.0000           -0.4648050             -12.6480
        27        2.0000           -0.4391298             -11.9493
        28        2.0000           -0.4274891             -11.6326
        29        2.0000           -0.3934847             -10.7073
        30        2.0000           -0.3925238             -10.6811 (HOMO)
        31                         -0.3420230              -9.3069 (LUMO)
        32                         -0.2195012              -5.9729
        33                         -0.1726883              -4.6991
        34                         -0.1715107              -4.6670
        35                         -0.1216512              -3.3103
        36                          0.0323092               0.8792
        37                          0.0440940               1.1999
        38                          0.0546583               1.4873
        39                          0.0894686               2.4346
        40                          0.1129333               3.0731
        41                          0.1306342               3.5547
       ...                                ...                  ...
        54                          0.7383323              20.0910
      -------------------------------------------------------------
                  HL-Gap            0.0505008 Eh            1.3742 eV
             Fermi-level           -0.3671269 Eh           -9.9900 eV

     #   Z        covCN         q      C6AA      α(0)
     1   6 C      3.041    -0.027    28.646     8.778
     2   6 C      2.993    -0.056    29.381     8.891
     3   6 C      3.067     0.026    27.344     8.575
     4   6 C      2.878     0.153    24.675     8.143
     5   6 C      2.997    -0.057    29.413     8.896
     6   9 F      0.785    -0.212    11.364     3.982
     7   6 C      3.067     0.026    27.344     8.575
     8   6 C      2.993    -0.056    29.381     8.891
     9   6 C      3.041    -0.027    28.645     8.778
    10   6 C      2.997    -0.057    29.413     8.896
    11   6 C      2.878     0.153    24.675     8.143
    12   9 F      0.785    -0.212    11.364     3.982
    13   1 H      0.926     0.050     2.314     2.379
    14   1 H      0.926     0.066     2.134     2.284
    15   1 H      0.926     0.057     2.232     2.336
    16   1 H      0.926     0.066     2.134     2.284
    17   1 H      0.926     0.050     2.314     2.379
    18   1 H      0.926     0.057     2.232     2.336

 Mol. C6AA /au·bohr⁶  :       4655.947196
 Mol. C8AA /au·bohr⁸  :     116872.822018
 Mol. α(0) /au        :        108.530592


Wiberg/Mayer (AO) data.
largest (>0.10) Wiberg bond orders for each atom
          total WBO             WBO to atom ...
     1  C   3.942        C    2 1.756    C    5 1.091    H   13 0.972
     2  C   3.981        C    1 1.756    C    3 1.101    H   14 0.968
     3  C   3.983        C    7 1.589    C    2 1.101    C    4 1.052
     4  C   3.878        C    5 1.706    C    3 1.052    F    6 0.968
     5  C   3.953        C    4 1.706    C    1 1.091    H   15 0.971
     6  F   1.115        C    4 0.968
     7  C   3.983        C    3 1.589    C    8 1.101    C   11 1.052
     8  C   3.981        C    9 1.756    C    7 1.101    H   16 0.968
     9  C   3.942        C    8 1.756    C   10 1.091    H   17 0.972
    10  C   3.953        C   11 1.706    C    9 1.091    H   18 0.971
    11  C   3.878        C   10 1.706    C    7 1.052    F   12 0.968
    12  F   1.115        C   11 0.968
    13  H   0.997        C    1 0.972
    14  H   0.996        C    2 0.968
    15  H   0.996        C    5 0.971
    16  H   0.996        C    8 0.968
    17  H   0.997        C    9 0.972
    18  H   0.996        C   10 0.971

molecular dipole:
                 x           y           z       tot (Debye)
 q only:       -0.000      -0.000      -0.001
   full:       -0.000      -0.000      -0.002       0.004
molecular quadrupole (traceless):
                xx          xy          yy          xz          yz          zz
 q only:       -7.860      -4.419       8.682       0.025      -0.050      -0.822
  q+dip:       -9.677      -2.646      14.369       0.016      -0.099      -4.692
   full:      -10.225      -3.158      11.001       0.021      -0.064      -0.776

           -------------------------------------------------
          |                Geometry Summary                 |
           -------------------------------------------------

      molecular mass/u    :      164.1542000
   center of mass at/Å    :       -0.0050978       1.7990937      -0.0071583
  moments of inertia/u·Å² :        0.2977868E+03   0.6600785E+03   0.9578645E+03
rotational constants/cm⁻¹ :        0.5660974E-01   0.2553883E-01   0.1759918E-01

 * 13 selected distances

     #   Z        #   Z                                     value/Å
     1   6 C      2   6 C                                 1.3454862
     4   6 C      5   6 C                                 1.3416657
     4   6 C      6   9 F                                 1.3389901
     3   6 C      7   6 C                                 1.3556934 (max)
     8   6 C      9   6 C                                 1.3454578
    10   6 C     11   6 C                                 1.3416693
    11   6 C     12   9 F                                 1.3389902
     1   6 C     13   1 H                                 1.0742230
     2   6 C     14   1 H                                 1.0717074 (min)
     5   6 C     15   1 H                                 1.0728054
     8   6 C     16   1 H                                 1.0717086
     9   6 C     17   1 H                                 1.0742254
    10   6 C     18   1 H                                 1.0728052

 * 3 distinct bonds (by element types)

   Z      Z             #   av. dist./Å        max./Å        min./Å
   1 H    6 C           6     1.0729125     1.0742254     1.0717074
   6 C    6 C           5     1.3459945     1.3556934     1.3416657
   6 C    9 F           2     1.3389901     1.3389902     1.3389901


optimized geometry written to: xtbopt.xyz


           -------------------------------------------------
          | TOTAL ENERGY              -33.841691254390 Eh   |
          | GRADIENT NORM               0.000532407383 Eh/α |
          | HOMO-LUMO GAP               1.374197328708 eV   |
           -------------------------------------------------

------------------------------------------------------------------------
 * finished run on 2021/05/19 at 11:00:32.295     
------------------------------------------------------------------------
 total:
 * wall-time:     0 d,  0 h,  0 min,  0.185 sec
 *  cpu-time:     0 d,  0 h,  0 min,  0.183 sec
 * ratio c/w:     0.994 speedup
 SCF:
 * wall-time:     0 d,  0 h,  0 min,  0.026 sec
 *  cpu-time:     0 d,  0 h,  0 min,  0.026 sec
 * ratio c/w:     1.000 speedup
 ANC optimizer:
 * wall-time:     0 d,  0 h,  0 min,  0.139 sec
 *  cpu-time:     0 d,  0 h,  0 min,  0.139 sec
 * ratio c/w:     1.000 speedup

