      -----------------------------------------------------------      
     |                   =====================                   |     
     |                           x T B                           |     
     |                   =====================                   |     
     |                         S. Grimme                         |     
     |          Mulliken Center for Theoretical Chemistry        |     
     |                    University of Bonn                     |     
     |                Version 6.2 RC2 (SAW190805)                |     
      -----------------------------------------------------------      

   This program is distributed in the hope that it will be useful,
   but WITHOUT ANY WARRANTY; without even the implied warranty of
   MERCHANTABILITY or FITNESS FOR A PARTICULAR PURPOSE.
   
   FOR NON-COMMERCIAL, ACADEMIA USE ONLY.
   
   Cite this work as:
   * S. Grimme, C. Bannwarth, P. Shushkov, J. Chem. Theory Comput., 2017,
     13, 1989-2009. DOI: 10.1021/acs.jctc.7b00118
   * C. Bannwarth, S. Ehlert and S. Grimme., J. Chem. Theory Comput., 2019,
     15, 1652-1671. DOI: 10.1021/acs.jctc.8b01176
   * P. Pracht, E. Caldeweyher, S. Ehlert, S. Grimme, ChemRxiv, 2019, preprint.
     DOI: 10.26434/chemrxiv.8326202.v1
   
   for DFT-D4:
   * E. Caldeweyher, C. Bannwarth and S. Grimme, J. Chem. Phys., 2017,
     147, 034112. DOI: 10.1063/1.4993215
   * E. Caldeweyher, S. Ehlert, A. Hansen, H. Neugebauer, S. Spicher,
     C. Bannwarth and S. Grimme, J. Chem. Phys., 2019, 150, 154122.
     DOI: 10.1063/1.5090222
   
   for sTDA-xTB:
   * S. Grimme and C. Bannwarth, J. Chem. Phys., 2016, 145, 054103.
     DOI: 10.1063/1.4959605
   
   in the mass-spec context:
   * V. Asgeirsson, C. Bauer and S. Grimme, Chem. Sci., 2017, 8, 4879.
     DOI: 10.1039/c7sc00601b
   
   for metadynamics refer to:
   * S. Grimme, J. Chem. Theory Comput., 2019, 155, 2847-2862
     DOI: 10.1021/acs.jctc.9b00143
   
   with help from (in alphabetical order)
   C. Bannwarth, F. Bohle, G. Brandenburg, E. Caldeweyher, M. Checinski,
   S. Dohm, S. Ehlert, S. Ehrlich, F. März, H. Neugebauer, J. Pisarek,
   P. Pracht, P. Shushkov, and S. Spicher.
   
 * started run on 2021/05/19 at 11:00:34.146     

           -------------------------------------------------
          |                Calculation Setup                |
           -------------------------------------------------

          program call               : /ihome/ghutchison/geoffh/xtb/xtb 749.xyz -opt
          hostname                   : smp-n83
          coordinate file            : 749.xyz
          omp threads                :                     1
          number of atoms            :                    21
          number of electrons        :                    60
          charge                     :                     0
          spin                       :                   0.0
          first test random number   :      0.90673892901875


########################################################################
# WARNING! Please study the warnings concerning your input carefully
#  - the use of '-opt' is discouraged, please use '--opt' next time
########################################################################

           ------------------------------------------------- 
          |                 G F N 2 - x T B                 |
          | Geometry, Frequencies, Noncovalent interactions |
          |            JCTC 2019 parametrisation            |
           ------------------------------------------------- 
             KAB for C  - Si     :                1.0500
             KAB for H  - Pd     :                0.9500
             k(s)              :                1.8500
             k(p)              :                2.2300
             k(d)              :                2.2300
             k(f)              :                2.0000
             kEN (H0ij)        :               -2.0000
             D4 a1             :                0.5200
             D4 a2             :                5.0000
             D4 s6             :                1.0000
             D4 s8             :                2.7000
             D4 s9             :                5.0000
             alphaj            :                2.0000

  Z AO/shell   Hii/eV     exponent
  1     Wed Apr 25 08:07:45 CEST 2018   EN: 2.200 GM2: 0.406  GM3: 0.0800  RAES: 1.40
     1s    -10.707211    1.230000
  6     Wed Apr 25 08:07:45 CEST 2018   EN: 2.550 GM2: 0.538  GM3: 0.1500  RAES: 3.00
     2s    -13.970922    2.096432
     2p    -10.063292    1.800000
  8     Wed Apr 25 08:07:45 CEST 2018   EN: 3.440 GM2: 0.452  GM3:-0.0517  RAES: 1.80
     2s    -20.229985    2.439742
     2p    -15.503117    2.137023
 16     Tue Apr 24 11:44:34 CEST 2018   EN: 2.580 GM2: 0.340  GM3:-0.0502  RAES: 3.10
     3s    -20.029654    1.981333
     3p    -11.377694    2.025643
     3d     -0.420282    1.702555

           ------------------------------------------------- 
          |        Self-Consistent Charge Iterations        |
           ------------------------------------------------- 

          ...................................................
          :                      SETUP                      :
          :.................................................:
          :  # basis functions                  60          :
          :  # atomic orbitals                  59          :
          :  # shells                           33          :
          :  # electrons                        60          :
          :  max. iterations                   250          :
          :  Hamiltonian                  GFN2-xTB          :
          :  restarted?                      false          :
          :  GBSA solvation                  false          :
          :  PC potential                    false          :
          :  electronic temp.          300.0000000     K    :
          :  accuracy                    1.0000000          :
          :  -> integral cutoff          0.2500000E+02      :
          :  -> integral neglect         0.1000000E-07      :
          :  -> SCF convergence          0.1000000E-05 Eh   :
          :  -> wf. convergence          0.1000000E-03 e    :
          :  Broyden damping             0.4000000          :
          ...................................................

 iter      E             dE          RMSdq      gap      omega  full diag
   1    -33.9143012 -0.339143E+02  0.466E+00    2.98       0.0  T
   2    -33.9488023 -0.345011E-01  0.251E+00    2.99       1.0  T
   3    -33.9471175  0.168478E-02  0.866E-01    2.98       1.0  T
   4    -33.9483248 -0.120728E-02  0.458E-01    2.98       1.0  T
   5    -33.9509832 -0.265838E-02  0.133E-01    2.98       1.0  T
   6    -33.9509706  0.126354E-04  0.732E-02    2.98       1.0  T
   7    -33.9510302 -0.596809E-04  0.255E-02    2.98       1.0  T
   8    -33.9510323 -0.207834E-05  0.155E-02    2.98       1.4  T
   9    -33.9510340 -0.168220E-05  0.362E-03    2.98       6.0  T
  10    -33.9510341 -0.490583E-07  0.169E-03    2.98      12.9  T
  11    -33.9510341 -0.164915E-07  0.100E-03    2.98      21.7  T
  12    -33.9510341 -0.496348E-08  0.518E-04    2.98      42.1  T
  13    -33.9510341 -0.191072E-08  0.143E-04    2.98     152.4  T

   *** convergence criteria satisfied after 13 iterations ***

         #    Occupation            Energy/Eh            Energy/eV
      -------------------------------------------------------------
         1        2.0000           -0.7292332             -19.8434
       ...           ...                  ...                  ...
        24        2.0000           -0.4572194             -12.4416
        25        2.0000           -0.4458380             -12.1319
        26        2.0000           -0.4376544             -11.9092
        27        2.0000           -0.4226413             -11.5007
        28        2.0000           -0.4197996             -11.4233
        29        2.0000           -0.3712888             -10.1033
        30        2.0000           -0.3656967              -9.9511 (HOMO)
        31                         -0.2560801              -6.9683 (LUMO)
        32                         -0.2031680              -5.5285
        33                         -0.1921166              -5.2278
        34                         -0.1486770              -4.0457
        35                         -0.1117182              -3.0400
       ...                                ...                  ...
        59                          0.6749601              18.3666
      -------------------------------------------------------------
                  HL-Gap            0.1096166 Eh            2.9828 eV
             Fermi-level           -0.3108884 Eh           -8.4597 eV

 SCC (total)                   0 d,  0 h,  0 min,  0.032 sec
 SCC setup                      ...        0 min,  0.000 sec (  0.921%)
 Dispersion                     ...        0 min,  0.000 sec (  0.963%)
 integral evaluation            ...        0 min,  0.007 sec ( 22.327%)
 zeroth order Hamiltonian       ...        0 min,  0.000 sec (  0.485%)
 iterations                     ...        0 min,  0.013 sec ( 40.732%)
 molecular gradient             ...        0 min,  0.011 sec ( 33.286%)
 printout                       ...        0 min,  0.000 sec (  1.105%)

         :::::::::::::::::::::::::::::::::::::::::::::::::::::
         ::                     SUMMARY                     ::
         :::::::::::::::::::::::::::::::::::::::::::::::::::::
         :: total energy             -33.551576777076 Eh    ::
         :: gradient norm              0.046544260920 Eh/a0 ::
         :: HOMO-LUMO gap              2.982818879332 eV    ::
         ::.................................................::
         :: SCC energy               -33.951034076525 Eh    ::
         :: -> isotropic ES            0.029077558143 Eh    ::
         :: -> anisotropic ES          0.001800122913 Eh    ::
         :: -> anisotropic XC          0.009768723878 Eh    ::
         :: -> dispersion             -0.018879406140 Eh    ::
         :: repulsion energy           0.399376954323 Eh    ::
         :: add. restraining           0.000000000000 Eh    ::
         :::::::::::::::::::::::::::::::::::::::::::::::::::::

      ----------------------------------------------------------- 
     |                   =====================                   |
     |                        A N C O P T                        |
     |                   =====================                   |
     |               Approximate Normal Coordinate               |
     |                Rational Function Optimizer                |
      ----------------------------------------------------------- 

          ...................................................
          :                      SETUP                      :
          :.................................................:
          :   optimization level            normal          :
          :   max. optcycles                   200          :
          :   ANC micro-cycles                  20          :
          :   degrees of freedom                57          :
          :.................................................:
          :   RF solver                   davidson          :
          :   input Hessian                  false          :
          :   write xtbopt.log                true          :
          :   linear?                        false          :
          :   energy convergence         0.5000000E-05 Eh   :
          :   grad. convergence          0.1000000E-02 Eh/α :
          :   maximium RF displ.         2.0000000          :
          :   Hlow (freq-cutoff)         0.5000000E-02      :
          :   Hmax (freq-cutoff)         5.0000000          :
          :   S6 in model hess.         20.0000000          :
          ...................................................

generating ANC from model Hessian ...
Using Lindh-Hessian (1995)
 Shifting diagonal of input Hessian by   3.893700489033926E-003
 Lowest  eigenvalues of input Hessian
   -0.000000   -0.000000   -0.000000   -0.000000   -0.000000    0.000000
    0.005000    0.006677    0.007402    0.008401    0.009420    0.009841
    0.010791    0.015414    0.017605    0.022359    0.026897    0.036254
 Highest eigenvalues
    1.447578    1.595217    1.820672    1.915185    1.996617    2.048139
 

........................................................................
.............................. CYCLE    1 ..............................
........................................................................
   1    -33.9510341 -0.339510E+02  0.636E-05    2.98       0.0  T
   2    -33.9510341 -0.311928E-11  0.399E-05    2.98     546.8  T
   3    -33.9510341  0.373745E-11  0.223E-05    2.98     977.5  T
     SCC iter.                  ...        0 min,  0.003 sec
     gradient                   ...        0 min,  0.010 sec
 * total energy  :   -33.5515768 Eh     change        0.8351158E-08 Eh
   gradient norm :     0.0465443 Eh/α   predicted     0.0000000E+00 (-100.00%)
   displ. norm   :     0.2655344 α      lambda       -0.4317755E-02
   maximum displ.:     0.1279494 α      in ANC's #3, #5, #1, ...

........................................................................
.............................. CYCLE    2 ..............................
........................................................................
   1    -33.9642179 -0.339642E+02  0.283E-01    3.04       0.0  T
   2    -33.9642349 -0.170093E-04  0.145E-01    3.04       1.0  T
   3    -33.9641714  0.634437E-04  0.680E-02    3.04       1.0  T
   4    -33.9642510 -0.795965E-04  0.221E-02    3.04       1.0  T
   5    -33.9642522 -0.112899E-05  0.273E-03    3.04       8.0  T
   6    -33.9642522 -0.481105E-07  0.154E-03    3.04      14.2  T
     SCC iter.                  ...        0 min,  0.006 sec
     gradient                   ...        0 min,  0.010 sec
 * total energy  :   -33.5545456 Eh     change       -0.2968840E-02 Eh
   gradient norm :     0.0191624 Eh/α   predicted    -0.2311136E-02 ( -22.15%)
   displ. norm   :     0.2551827 α      lambda       -0.1329437E-02
   maximum displ.:     0.1508088 α      in ANC's #3, #5, #1, ...

........................................................................
.............................. CYCLE    3 ..............................
........................................................................
   1    -33.9692222 -0.339692E+02  0.170E-01    3.07       0.0  T
   2    -33.9692270 -0.478701E-05  0.976E-02    3.07       1.0  T
   3    -33.9691810  0.459873E-04  0.568E-02    3.07       1.0  T
   4    -33.9692373 -0.563579E-04  0.118E-02    3.07       1.9  T
   5    -33.9692376 -0.204409E-06  0.251E-03    3.07       8.7  T
   6    -33.9692376 -0.520485E-07  0.147E-03    3.07      14.8  T
     SCC iter.                  ...        0 min,  0.006 sec
     gradient                   ...        0 min,  0.010 sec
 * total energy  :   -33.5553987 Eh     change       -0.8531387E-03 Eh
   gradient norm :     0.0048499 Eh/α   predicted    -0.7080088E-03 ( -17.01%)
   displ. norm   :     0.2283740 α      lambda       -0.4128125E-03
   maximum displ.:     0.1543807 α      in ANC's #3, #1, #5, ...

........................................................................
.............................. CYCLE    4 ..............................
........................................................................
   1    -33.9688234 -0.339688E+02  0.152E-01    3.06       0.0  T
   2    -33.9688259 -0.251069E-05  0.876E-02    3.06       1.0  T
   3    -33.9688104  0.155138E-04  0.312E-02    3.06       1.0  T
   4    -33.9688281 -0.177077E-04  0.767E-03    3.06       2.8  T
   5    -33.9688283 -0.225279E-06  0.235E-03    3.06       9.3  T
   6    -33.9688284 -0.549526E-07  0.110E-03    3.06      19.8  T
     SCC iter.                  ...        0 min,  0.006 sec
     gradient                   ...        0 min,  0.010 sec
 * total energy  :   -33.5557121 Eh     change       -0.3133250E-03 Eh
   gradient norm :     0.0052561 Eh/α   predicted    -0.2171715E-03 ( -30.69%)
   displ. norm   :     0.2674988 α      lambda       -0.3492621E-03
   maximum displ.:     0.1710466 α      in ANC's #3, #1, #5, ...

........................................................................
.............................. CYCLE    5 ..............................
........................................................................
   1    -33.9674318 -0.339674E+02  0.165E-01    3.04       0.0  T
   2    -33.9674341 -0.229572E-05  0.973E-02    3.04       1.0  T
   3    -33.9674266  0.744340E-05  0.214E-02    3.04       1.0  T
   4    -33.9674352 -0.854919E-05  0.473E-03    3.04       4.6  T
   5    -33.9674353 -0.124389E-06  0.226E-03    3.04       9.7  T
   6    -33.9674353 -0.330803E-07  0.114E-03    3.04      19.1  T
     SCC iter.                  ...        0 min,  0.006 sec
     gradient                   ...        0 min,  0.010 sec
 * total energy  :   -33.5559722 Eh     change       -0.2601076E-03 Eh
   gradient norm :     0.0062204 Eh/α   predicted    -0.1871337E-03 ( -28.06%)
   displ. norm   :     0.2886767 α      lambda       -0.3175956E-03
   maximum displ.:     0.1819966 α      in ANC's #3, #1, #2, ...

........................................................................
.............................. CYCLE    6 ..............................
........................................................................
   1    -33.9663582 -0.339664E+02  0.195E-01    3.01       0.0  T
   2    -33.9663616 -0.335912E-05  0.114E-01    3.02       1.0  T
   3    -33.9663516  0.999921E-05  0.261E-02    3.02       1.0  T
   4    -33.9663629 -0.113481E-04  0.703E-03    3.02       3.1  T
   5    -33.9663632 -0.242606E-06  0.267E-03    3.02       8.2  T
   6    -33.9663632 -0.643858E-07  0.116E-03    3.02      18.8  T
     SCC iter.                  ...        0 min,  0.006 sec
     gradient                   ...        0 min,  0.010 sec
 * total energy  :   -33.5561904 Eh     change       -0.2182453E-03 Eh
   gradient norm :     0.0071392 Eh/α   predicted    -0.1720418E-03 ( -21.17%)
   displ. norm   :     0.2729765 α      lambda       -0.2764166E-03
   maximum displ.:     0.1760681 α      in ANC's #1, #3, #2, ...

........................................................................
.............................. CYCLE    7 ..............................
........................................................................
   1    -33.9668048 -0.339668E+02  0.174E-01    3.00       0.0  T
   2    -33.9668067 -0.190008E-05  0.101E-01    3.00       1.0  T
   3    -33.9667959  0.108100E-04  0.273E-02    3.00       1.0  T
   4    -33.9668082 -0.122524E-04  0.630E-03    3.00       3.5  T
   5    -33.9668083 -0.101247E-06  0.204E-03    3.00      10.7  T
   6    -33.9668083 -0.447716E-07  0.900E-04    3.00      24.3  T
     SCC iter.                  ...        0 min,  0.006 sec
     gradient                   ...        0 min,  0.010 sec
 * total energy  :   -33.5563978 Eh     change       -0.2073862E-03 Eh
   gradient norm :     0.0065526 Eh/α   predicted    -0.1485088E-03 ( -28.39%)
   displ. norm   :     0.3017219 α      lambda       -0.2950459E-03
   maximum displ.:     0.2104974 α      in ANC's #1, #3, #6, ...

........................................................................
.............................. CYCLE    8 ..............................
........................................................................
   1    -33.9688427 -0.339688E+02  0.201E-01    2.98       0.0  T
   2    -33.9688457 -0.303079E-05  0.116E-01    2.99       1.0  T
   3    -33.9688287  0.170079E-04  0.359E-02    2.99       1.0  T
   4    -33.9688481 -0.194269E-04  0.950E-03    2.99       2.3  T
   5    -33.9688483 -0.231244E-06  0.189E-03    2.99      11.5  T
   6    -33.9688484 -0.263191E-07  0.998E-04    2.99      21.9  T
     SCC iter.                  ...        0 min,  0.006 sec
     gradient                   ...        0 min,  0.010 sec
 * total energy  :   -33.5566185 Eh     change       -0.2206489E-03 Eh
   gradient norm :     0.0046362 Eh/α   predicted    -0.1609532E-03 ( -27.05%)
   displ. norm   :     0.3813714 α      lambda       -0.2325067E-03
   maximum displ.:     0.2667423 α      in ANC's #1, #3, #6, ...

........................................................................
.............................. CYCLE    9 ..............................
........................................................................
   1    -33.9675052 -0.339675E+02  0.250E-01    2.97       0.0  T
   2    -33.9675097 -0.445857E-05  0.142E-01    2.97       1.0  T
   3    -33.9674963  0.134351E-04  0.348E-02    2.97       1.0  T
   4    -33.9675117 -0.154749E-04  0.129E-02    2.97       1.7  T
   5    -33.9675125 -0.751760E-06  0.216E-03    2.97      10.1  T
   6    -33.9675125 -0.503472E-07  0.104E-03    2.97      21.0  T
     SCC iter.                  ...        0 min,  0.006 sec
     gradient                   ...        0 min,  0.010 sec
 * total energy  :   -33.5567650 Eh     change       -0.1465111E-03 Eh
   gradient norm :     0.0061492 Eh/α   predicted    -0.1331680E-03 (  -9.11%)
   displ. norm   :     0.2363627 α      lambda       -0.1776762E-03
   maximum displ.:     0.1841418 α      in ANC's #1, #6, #3, ...

........................................................................
.............................. CYCLE   10 ..............................
........................................................................
   1    -33.9707445 -0.339707E+02  0.161E-01    2.98       0.0  T
   2    -33.9707479 -0.336846E-05  0.898E-02    2.98       1.0  T
   3    -33.9707353  0.125627E-04  0.329E-02    2.98       1.0  T
   4    -33.9707501 -0.147898E-04  0.103E-02    2.98       2.1  T
   5    -33.9707504 -0.251348E-06  0.236E-03    2.98       9.2  T
   6    -33.9707505 -0.746426E-07  0.934E-04    2.98      23.4  T
     SCC iter.                  ...        0 min,  0.006 sec
     gradient                   ...        0 min,  0.010 sec
 * total energy  :   -33.5568549 Eh     change       -0.8996967E-04 Eh
   gradient norm :     0.0036865 Eh/α   predicted    -0.9380150E-04 (   4.26%)
   displ. norm   :     0.2487215 α      lambda       -0.7753427E-04
   maximum displ.:     0.1925859 α      in ANC's #1, #3, #6, ...

........................................................................
.............................. CYCLE   11 ..............................
........................................................................
   1    -33.9686703 -0.339687E+02  0.173E-01    2.96       0.0  T
   2    -33.9686730 -0.265718E-05  0.984E-02    2.96       1.0  T
   3    -33.9686641  0.889088E-05  0.271E-02    2.96       1.0  T
   4    -33.9686743 -0.101957E-04  0.940E-03    2.96       2.3  T
   5    -33.9686746 -0.343483E-06  0.260E-03    2.96       8.4  T
   6    -33.9686747 -0.102997E-06  0.767E-04    2.96      28.5  T
   7    -33.9686747 -0.261452E-08  0.479E-04    2.96      45.6  T
     SCC iter.                  ...        0 min,  0.006 sec
     gradient                   ...        0 min,  0.010 sec
 * total energy  :   -33.5568864 Eh     change       -0.3143209E-04 Eh
   gradient norm :     0.0062734 Eh/α   predicted    -0.4116569E-04 (  30.97%)
   displ. norm   :     0.0633652 α      lambda       -0.5675935E-04
   maximum displ.:     0.0434665 α      in ANC's #1, #2, #7, ...

........................................................................
.............................. CYCLE   12 ..............................
........................................................................
   1    -33.9698335 -0.339698E+02  0.457E-02    2.96       0.0  T
   2    -33.9698341 -0.635611E-06  0.260E-02    2.96       1.0  T
   3    -33.9698330  0.115357E-05  0.957E-03    2.96       2.3  T
   4    -33.9698344 -0.140204E-05  0.330E-03    2.96       6.6  T
   5    -33.9698344 -0.531421E-07  0.120E-03    2.96      18.2  T
   6    -33.9698344 -0.109412E-07  0.481E-04    2.96      45.3  T
     SCC iter.                  ...        0 min,  0.006 sec
     gradient                   ...        0 min,  0.010 sec
 * total energy  :   -33.5569264 Eh     change       -0.4002661E-04 Eh
   gradient norm :     0.0031691 Eh/α   predicted    -0.2849394E-04 ( -28.81%)
   displ. norm   :     0.1663557 α      lambda       -0.7583422E-04
   maximum displ.:     0.1373553 α      in ANC's #1, #3, #2, ...

........................................................................
.............................. CYCLE   13 ..............................
........................................................................
   1    -33.9704289 -0.339704E+02  0.114E-01    2.96       0.0  T
   2    -33.9704313 -0.246410E-05  0.665E-02    2.97       1.0  T
   3    -33.9704253  0.605915E-05  0.208E-02    2.96       1.1  T
   4    -33.9704324 -0.717199E-05  0.665E-03    2.97       3.3  T
   5    -33.9704326 -0.214968E-06  0.227E-03    2.97       9.6  T
   6    -33.9704327 -0.448942E-07  0.108E-03    2.96      20.2  T
   7    -33.9704327 -0.125997E-07  0.407E-04    2.96      53.7  T
   8    -33.9704327 -0.330978E-09  0.186E-04    2.96     117.5  T
     SCC iter.                  ...        0 min,  0.007 sec
     gradient                   ...        0 min,  0.011 sec
 * total energy  :   -33.5569611 Eh     change       -0.3469857E-04 Eh
   gradient norm :     0.0034730 Eh/α   predicted    -0.3896739E-04 (  12.30%)
   displ. norm   :     0.2066884 α      lambda       -0.6015375E-04
   maximum displ.:     0.1732808 α      in ANC's #1, #3, #5, ...

........................................................................
.............................. CYCLE   14 ..............................
........................................................................
   1    -33.9707384 -0.339707E+02  0.147E-01    2.96       0.0  T
   2    -33.9707412 -0.283560E-05  0.838E-02    2.96       1.0  T
   3    -33.9707377  0.353664E-05  0.192E-02    2.96       1.1  T
   4    -33.9707420 -0.434889E-05  0.913E-03    2.96       2.4  T
   5    -33.9707425 -0.526098E-06  0.225E-03    2.96       9.7  T
   6    -33.9707426 -0.568558E-07  0.103E-03    2.96      21.3  T
   7    -33.9707426 -0.817894E-08  0.489E-04    2.96      44.6  T
   8    -33.9707426 -0.734403E-09  0.188E-04    2.96     116.3  T
     SCC iter.                  ...        0 min,  0.007 sec
     gradient                   ...        0 min,  0.011 sec
 * total energy  :   -33.5569978 Eh     change       -0.3675044E-04 Eh
   gradient norm :     0.0043138 Eh/α   predicted    -0.3136318E-04 ( -14.66%)
   displ. norm   :     0.1923948 α      lambda       -0.4517998E-04
   maximum displ.:     0.1656798 α      in ANC's #1, #3, #5, ...

........................................................................
.............................. CYCLE   15 ..............................
........................................................................
   1    -33.9697954 -0.339698E+02  0.134E-01    2.95       0.0  T
   2    -33.9697975 -0.211953E-05  0.763E-02    2.95       1.0  T
   3    -33.9697950  0.255209E-05  0.178E-02    2.95       1.2  T
   4    -33.9697981 -0.315189E-05  0.877E-03    2.95       2.5  T
   5    -33.9697986 -0.450411E-06  0.198E-03    2.95      11.0  T
   6    -33.9697986 -0.504535E-07  0.794E-04    2.95      27.5  T
     SCC iter.                  ...        0 min,  0.006 sec
     gradient                   ...        0 min,  0.010 sec
 * total energy  :   -33.5570316 Eh     change       -0.3371372E-04 Eh
   gradient norm :     0.0036969 Eh/α   predicted    -0.2342703E-04 ( -30.51%)
   displ. norm   :     0.3021583 α      lambda       -0.1034317E-03
   maximum displ.:     0.2420684 α      in ANC's #1, #2, #6, ...

........................................................................
.............................. CYCLE   16 ..............................
........................................................................
   1    -33.9704142 -0.339704E+02  0.212E-01    2.94       0.0  T
   2    -33.9704198 -0.558694E-05  0.123E-01    2.94       1.0  T
   3    -33.9704127  0.714410E-05  0.290E-02    2.94       1.0  T
   4    -33.9704217 -0.900646E-05  0.136E-02    2.94       1.6  T
   5    -33.9704228 -0.109419E-05  0.269E-03    2.94       8.1  T
   6    -33.9704228 -0.504100E-07  0.134E-03    2.94      16.3  T
   7    -33.9704228 -0.110945E-07  0.756E-04    2.94      28.9  T
   8    -33.9704228 -0.252053E-08  0.198E-04    2.94     110.1  T
     SCC iter.                  ...        0 min,  0.007 sec
     gradient                   ...        0 min,  0.011 sec
 * total energy  :   -33.5570802 Eh     change       -0.4862305E-04 Eh
   gradient norm :     0.0044751 Eh/α   predicted    -0.5645420E-04 (  16.11%)
   displ. norm   :     0.2338096 α      lambda       -0.7248493E-04
   maximum displ.:     0.1851994 α      in ANC's #1, #3, #2, ...

........................................................................
.............................. CYCLE   17 ..............................
........................................................................
   1    -33.9683122 -0.339683E+02  0.153E-01    2.93       0.0  T
   2    -33.9683146 -0.240974E-05  0.891E-02    2.93       1.0  T
   3    -33.9683129  0.170851E-05  0.167E-02    2.93       1.3  T
   4    -33.9683152 -0.233086E-05  0.893E-03    2.93       2.4  T
   5    -33.9683158 -0.614531E-06  0.166E-03    2.93      13.2  T
   6    -33.9683158 -0.160014E-07  0.837E-04    2.93      26.1  T
     SCC iter.                  ...        0 min,  0.006 sec
     gradient                   ...        0 min,  0.010 sec
 * total energy  :   -33.5571094 Eh     change       -0.2921312E-04 Eh
   gradient norm :     0.0051853 Eh/α   predicted    -0.3822911E-04 (  30.86%)
   displ. norm   :     0.1526565 α      lambda       -0.8781815E-04
   maximum displ.:     0.1053966 α      in ANC's #1, #6, #3, ...

........................................................................
.............................. CYCLE   18 ..............................
........................................................................
   1    -33.9707526 -0.339708E+02  0.959E-02    2.94       0.0  T
   2    -33.9707537 -0.108040E-05  0.548E-02    2.94       1.0  T
   3    -33.9707533  0.409699E-06  0.920E-03    2.94       2.4  T
   4    -33.9707538 -0.492847E-06  0.493E-03    2.94       4.4  T
   5    -33.9707540 -0.210373E-06  0.131E-03    2.94      16.6  T
   6    -33.9707540 -0.126798E-07  0.581E-04    2.94      37.6  T
     SCC iter.                  ...        0 min,  0.006 sec
     gradient                   ...        0 min,  0.010 sec
 * total energy  :   -33.5571293 Eh     change       -0.1990965E-04 Eh
   gradient norm :     0.0062589 Eh/α   predicted    -0.4493390E-04 ( 125.69%)
   displ. norm   :     0.1062834 α      lambda       -0.9037535E-04
   maximum displ.:     0.0664071 α      in ANC's #1, #2, #3, ...

........................................................................
.............................. CYCLE   19 ..............................
........................................................................
   1    -33.9701608 -0.339702E+02  0.844E-02    2.93       0.0  T
   2    -33.9701622 -0.139879E-05  0.481E-02    2.93       1.0  T
   3    -33.9701577  0.449517E-05  0.184E-02    2.93       1.2  T
   4    -33.9701630 -0.525628E-05  0.526E-03    2.93       4.1  T
   5    -33.9701631 -0.957961E-07  0.192E-03    2.93      11.4  T
   6    -33.9701631 -0.376498E-07  0.732E-04    2.93      29.8  T
     SCC iter.                  ...        0 min,  0.006 sec
     gradient                   ...        0 min,  0.010 sec
 * total energy  :   -33.5571802 Eh     change       -0.5088046E-04 Eh
   gradient norm :     0.0027625 Eh/α   predicted    -0.4570288E-04 ( -10.18%)
   displ. norm   :     0.1271409 α      lambda       -0.3632311E-04
   maximum displ.:     0.0799836 α      in ANC's #1, #2, #3, ...

........................................................................
.............................. CYCLE   20 ..............................
........................................................................
   1    -33.9695040 -0.339695E+02  0.848E-02    2.93       0.0  T
   2    -33.9695049 -0.940958E-06  0.492E-02    2.93       1.0  T
   3    -33.9695031  0.182173E-05  0.126E-02    2.93       1.7  T
   4    -33.9695053 -0.216389E-05  0.493E-03    2.93       4.4  T
   5    -33.9695054 -0.133724E-06  0.146E-03    2.93      15.0  T
   6    -33.9695054 -0.237876E-07  0.565E-04    2.93      38.6  T
   7    -33.9695054 -0.207984E-08  0.306E-04    2.93      71.4  T
     SCC iter.                  ...        0 min,  0.006 sec
     gradient                   ...        0 min,  0.010 sec
 * total energy  :   -33.5572032 Eh     change       -0.2301903E-04 Eh
   gradient norm :     0.0029788 Eh/α   predicted    -0.1845860E-04 ( -19.81%)
   displ. norm   :     0.0819655 α      lambda       -0.3635994E-04
   maximum displ.:     0.0561099 α      in ANC's #7, #1, #3, ...
 * RMSD in coord.:     0.7206802 α      energy gain  -0.5626431E-02 Eh

generating ANC from model Hessian ...
Using Lindh-Hessian (1995)
 Shifting diagonal of input Hessian by   3.916387716753775E-003
 Lowest  eigenvalues of input Hessian
   -0.000000   -0.000000   -0.000000    0.000000    0.000000    0.000000
    0.005000    0.007377    0.007446    0.008404    0.008906    0.009125
    0.011397    0.015743    0.018535    0.023791    0.026942    0.033945
 Highest eigenvalues
    1.464613    1.614306    1.859912    1.943765    2.037003    2.085885
 

........................................................................
.............................. CYCLE   21 ..............................
........................................................................
   1    -33.9701266 -0.339701E+02  0.544E-02    2.93       0.0  T
   2    -33.9701272 -0.590494E-06  0.309E-02    2.93       1.0  T
   3    -33.9701265  0.747342E-06  0.896E-03    2.93       2.4  T
   4    -33.9701274 -0.966573E-06  0.381E-03    2.93       5.7  T
   5    -33.9701275 -0.707612E-07  0.888E-04    2.93      24.6  T
   6    -33.9701275 -0.978695E-08  0.324E-04    2.93      67.4  T
     SCC iter.                  ...        0 min,  0.006 sec
     gradient                   ...        0 min,  0.011 sec
 * total energy  :   -33.5572125 Eh     change       -0.9306505E-05 Eh
   gradient norm :     0.0029639 Eh/α   predicted     0.0000000E+00 (-100.00%)
   displ. norm   :     0.0432612 α      lambda       -0.3319051E-04
   maximum displ.:     0.0319601 α      in ANC's #3, #2, #1, ...

........................................................................
.............................. CYCLE   22 ..............................
........................................................................
   1    -33.9703864 -0.339704E+02  0.296E-02    2.93       0.0  T
   2    -33.9703865 -0.112437E-06  0.174E-02    2.93       1.3  T
   3    -33.9703861  0.330911E-06  0.506E-03    2.93       4.3  T
   4    -33.9703865 -0.399657E-06  0.147E-03    2.93      14.8  T
   5    -33.9703866 -0.679418E-08  0.475E-04    2.93      45.9  T
   6    -33.9703866 -0.195439E-08  0.225E-04    2.93      96.8  T
     SCC iter.                  ...        0 min,  0.006 sec
     gradient                   ...        0 min,  0.010 sec
 * total energy  :   -33.5572355 Eh     change       -0.2301141E-04 Eh
   gradient norm :     0.0007692 Eh/α   predicted    -0.1662786E-04 ( -27.74%)
   displ. norm   :     0.0561382 α      lambda       -0.1244401E-04
   maximum displ.:     0.0405948 α      in ANC's #3, #2, #6, ...

........................................................................
.............................. CYCLE   23 ..............................
........................................................................
   1    -33.9704371 -0.339704E+02  0.409E-02    2.93       0.0  T
   2    -33.9704373 -0.202275E-06  0.248E-02    2.93       1.0  T
   3    -33.9704367  0.613140E-06  0.638E-03    2.93       3.4  T
   4    -33.9704375 -0.765193E-06  0.133E-03    2.93      16.4  T
   5    -33.9704375 -0.359939E-08  0.628E-04    2.93      34.7  T
   6    -33.9704375 -0.155043E-08  0.301E-04    2.93      72.6  T
     SCC iter.                  ...        0 min,  0.006 sec
     gradient                   ...        0 min,  0.011 sec
 * total energy  :   -33.5572464 Eh     change       -0.1082544E-04 Eh
   gradient norm :     0.0013668 Eh/α   predicted    -0.6230983E-05 ( -42.44%)
   displ. norm   :     0.0579262 α      lambda       -0.9951091E-05
   maximum displ.:     0.0390222 α      in ANC's #3, #2, #6, ...

........................................................................
.............................. CYCLE   24 ..............................
........................................................................
   1    -33.9703452 -0.339703E+02  0.473E-02    2.93       0.0  T
   2    -33.9703455 -0.303382E-06  0.280E-02    2.93       1.0  T
   3    -33.9703452  0.282495E-06  0.572E-03    2.93       3.8  T
   4    -33.9703457 -0.412355E-06  0.281E-03    2.93       7.8  T
   5    -33.9703457 -0.549008E-07  0.451E-04    2.93      48.3  T
   6    -33.9703457 -0.231893E-09  0.285E-04    2.93      76.5  T
     SCC iter.                  ...        0 min,  0.006 sec
     gradient                   ...        0 min,  0.011 sec
 * total energy  :   -33.5572560 Eh     change       -0.9602589E-05 Eh
   gradient norm :     0.0014582 Eh/α   predicted    -0.4985744E-05 ( -48.08%)
   displ. norm   :     0.0643741 α      lambda       -0.1047071E-04
   maximum displ.:     0.0455096 α      in ANC's #3, #2, #5, ...

........................................................................
.............................. CYCLE   25 ..............................
........................................................................
   1    -33.9703194 -0.339703E+02  0.562E-02    2.93       0.0  T
   2    -33.9703198 -0.452635E-06  0.331E-02    2.93       1.0  T
   3    -33.9703191  0.681823E-06  0.815E-03    2.93       2.7  T
   4    -33.9703200 -0.893279E-06  0.358E-03    2.93       6.1  T
   5    -33.9703201 -0.708040E-07  0.947E-04    2.93      23.0  T
   6    -33.9703201 -0.115340E-07  0.386E-04    2.93      56.5  T
     SCC iter.                  ...        0 min,  0.006 sec
     gradient                   ...        0 min,  0.011 sec
 * total energy  :   -33.5572683 Eh     change       -0.1234715E-04 Eh
   gradient norm :     0.0009178 Eh/α   predicted    -0.5246123E-05 ( -57.51%)
   displ. norm   :     0.0976898 α      lambda       -0.1095573E-04
   maximum displ.:     0.0670252 α      in ANC's #3, #2, #5, ...

........................................................................
.............................. CYCLE   26 ..............................
........................................................................
   1    -33.9703187 -0.339703E+02  0.856E-02    2.93       0.0  T
   2    -33.9703197 -0.107526E-05  0.512E-02    2.93       1.0  T
   3    -33.9703173  0.246917E-05  0.144E-02    2.93       1.5  T
   4    -33.9703204 -0.311334E-05  0.482E-03    2.93       4.5  T
   5    -33.9703205 -0.903608E-07  0.162E-03    2.93      13.5  T
   6    -33.9703205 -0.312445E-07  0.603E-04    2.93      36.2  T
   7    -33.9703205 -0.185015E-08  0.318E-04    2.93      68.5  T
     SCC iter.                  ...        0 min,  0.006 sec
     gradient                   ...        0 min,  0.011 sec
 * total energy  :   -33.5572808 Eh     change       -0.1254405E-04 Eh
   gradient norm :     0.0007379 Eh/α   predicted    -0.5503394E-05 ( -56.13%)
   displ. norm   :     0.1070082 α      lambda       -0.8285819E-05
   maximum displ.:     0.0738026 α      in ANC's #3, #2, #5, ...

........................................................................
.............................. CYCLE   27 ..............................
........................................................................
   1    -33.9702246 -0.339702E+02  0.102E-01    2.92       0.0  T
   2    -33.9702263 -0.163629E-05  0.594E-02    2.92       1.0  T
   3    -33.9702242  0.210674E-05  0.158E-02    2.92       1.4  T
   4    -33.9702269 -0.274094E-05  0.729E-03    2.92       3.0  T
   5    -33.9702272 -0.288114E-06  0.173E-03    2.92      12.6  T
   6    -33.9702272 -0.402832E-07  0.649E-04    2.92      33.6  T
   7    -33.9702272 -0.123507E-08  0.374E-04    2.92      58.4  T
     SCC iter.                  ...        0 min,  0.007 sec
     gradient                   ...        0 min,  0.011 sec
 * total energy  :   -33.5572895 Eh     change       -0.8649799E-05 Eh
   gradient norm :     0.0006538 Eh/α   predicted    -0.4166423E-05 ( -51.83%)
   displ. norm   :     0.0874135 α      lambda       -0.5128273E-05
   maximum displ.:     0.0598671 α      in ANC's #3, #2, #1, ...

........................................................................
.............................. CYCLE   28 ..............................
........................................................................
   1    -33.9703655 -0.339704E+02  0.814E-02    2.92       0.0  T
   2    -33.9703664 -0.898379E-06  0.479E-02    2.92       1.0  T
   3    -33.9703649  0.147555E-05  0.125E-02    2.92       1.7  T
   4    -33.9703668 -0.192626E-05  0.509E-03    2.92       4.3  T
   5    -33.9703669 -0.118449E-06  0.127E-03    2.92      17.2  T
   6    -33.9703669 -0.201795E-07  0.504E-04    2.92      43.3  T
   7    -33.9703669 -0.356209E-09  0.282E-04    2.92      77.3  T
     SCC iter.                  ...        0 min,  0.006 sec
     gradient                   ...        0 min,  0.010 sec
 * total energy  :   -33.5572947 Eh     change       -0.5225645E-05 Eh
   gradient norm :     0.0004964 Eh/α   predicted    -0.2577592E-05 ( -50.67%)
   displ. norm   :     0.0649865 α      lambda       -0.3449599E-05
   maximum displ.:     0.0438145 α      in ANC's #3, #1, #2, ...

........................................................................
.............................. CYCLE   29 ..............................
........................................................................
   1    -33.9705226 -0.339705E+02  0.616E-02    2.92       0.0  T
   2    -33.9705231 -0.512183E-06  0.356E-02    2.92       1.0  T
   3    -33.9705228  0.338126E-06  0.779E-03    2.92       2.8  T
   4    -33.9705233 -0.473405E-06  0.430E-03    2.92       5.1  T
   5    -33.9705234 -0.132761E-06  0.798E-04    2.92      27.3  T
   6    -33.9705234 -0.704932E-08  0.375E-04    2.92      58.3  T
     SCC iter.                  ...        0 min,  0.006 sec
     gradient                   ...        0 min,  0.010 sec
 * total energy  :   -33.5572988 Eh     change       -0.4105800E-05 Eh
   gradient norm :     0.0004604 Eh/α   predicted    -0.1730212E-05 ( -57.86%)
   displ. norm   :     0.0591194 α      lambda       -0.3275518E-05
   maximum displ.:     0.0379692 α      in ANC's #3, #1, #5, ...

   *** GEOMETRY OPTIMIZATION CONVERGED AFTER 29 ITERATIONS ***

------------------------------------------------------------------------
 total energy gain   :        -0.0057220 Eh       -3.5906 kcal/mol
 total RMSD          :         0.7789058 a0        0.4122 Å
 total power (kW/mol):        -0.5180427 (step)  -21.3723 (real)
------------------------------------------------------------------------

 ANCopt (total)                0 d,  0 h,  0 min,  0.703 sec
 optimizer setup                ...        0 min,  0.000 sec (  0.024%)
 model hessian                  ...        0 min,  0.006 sec (  0.883%)
 ANC generation                 ...        0 min,  0.001 sec (  0.176%)
 coordinate transformation      ...        0 min,  0.000 sec (  0.068%)
 single point calculation       ...        0 min,  0.683 sec ( 97.156%)
 optimization log               ...        0 min,  0.003 sec (  0.361%)
 hessian update                 ...        0 min,  0.000 sec (  0.052%)
 rational function              ...        0 min,  0.007 sec (  1.024%)

================
 final structure:
================
$coord
   -0.85583367729759    2.21178334582514    0.54972966998972      C 
   -2.79071878726963   -0.27769981224019    1.30119783530991      S 
   -0.43542275673862   -2.45727479372473    0.60026550218351      C 
    1.74438184854993   -1.25615102356213   -0.17886439906739      C 
    1.48108119744943    1.44003916620925   -0.21166487304082      C 
    3.41736219055524    2.97711654349303   -0.95894940476473      O 
    2.93459969065617    5.58948981925212   -0.95924243479070      C 
    3.80923088617248   -2.63926140405979   -0.82412080333864      O 
    6.15507947144801   -1.41040720908351   -1.13001362156447      C 
   -0.99354688815716   -5.10324842735117    0.88594854868077      C 
    0.52160383656856   -7.00980748732125    0.26295703136864      C 
   -1.57820063242412    4.09467659827225    0.70319867146669      H 
    4.66900295146619    6.47894845057550   -1.61751213431509      H 
    2.48455465919743    6.27352616764794    0.94039293732146      H 
    1.38247299781748    6.06731855396149   -2.24043719365319      H 
    6.65613433058612   -0.30356846631229    0.53896648816740      H 
    6.16032992489438   -0.17933767675359   -2.78631648267217      H 
    7.52870851441085   -2.92224655652442   -1.38964030113210      H 
   -2.84263528553662   -5.47980915201223    1.67867067814431      H 
    2.35792240247584   -6.69668153125835   -0.54288796657303      H 
   -0.05682611396852   -8.93855583399719    0.55041260249594      H 
$end
           -------------------------------------------------
          |                Final Singlepoint                |
           -------------------------------------------------

          ...................................................
          :                      SETUP                      :
          :.................................................:
          :  # basis functions                  60          :
          :  # atomic orbitals                  59          :
          :  # shells                           33          :
          :  # electrons                        60          :
          :  max. iterations                   250          :
          :  Hamiltonian                  GFN2-xTB          :
          :  restarted?                      false          :
          :  GBSA solvation                  false          :
          :  PC potential                    false          :
          :  electronic temp.          300.0000000     K    :
          :  accuracy                    1.0000000          :
          :  -> integral cutoff          0.2500000E+02      :
          :  -> integral neglect         0.1000000E-07      :
          :  -> SCF convergence          0.1000000E-05 Eh   :
          :  -> wf. convergence          0.1000000E-03 e    :
          :  Broyden damping             0.4000000          :
          ...................................................

 iter      E             dE          RMSdq      gap      omega  full diag
   1    -33.9705234 -0.339705E+02  0.164E-04    2.92       0.0  T
   2    -33.9705234 -0.103874E-09  0.769E-05    2.92     283.8  T
   3    -33.9705234 -0.131038E-09  0.541E-05    2.92     403.4  T

   *** convergence criteria satisfied after 3 iterations ***

         #    Occupation            Energy/Eh            Energy/eV
      -------------------------------------------------------------
         1        2.0000           -0.7270752             -19.7847
       ...           ...                  ...                  ...
        24        2.0000           -0.4521403             -12.3034
        25        2.0000           -0.4469361             -12.1618
        26        2.0000           -0.4418539             -12.0235
        27        2.0000           -0.4225346             -11.4978
        28        2.0000           -0.4219786             -11.4826
        29        2.0000           -0.3707810             -10.0895
        30        2.0000           -0.3610630              -9.8250 (HOMO)
        31                         -0.2537395              -6.9046 (LUMO)
        32                         -0.2049104              -5.5759
        33                         -0.1855458              -5.0490
        34                         -0.1357381              -3.6936
        35                         -0.1150995              -3.1320
       ...                                ...                  ...
        59                          0.6795954              18.4927
      -------------------------------------------------------------
                  HL-Gap            0.1073235 Eh            2.9204 eV
             Fermi-level           -0.3074013 Eh           -8.3648 eV

 SCC (total)                   0 d,  0 h,  0 min,  0.022 sec
 SCC setup                      ...        0 min,  0.000 sec (  0.792%)
 Dispersion                     ...        0 min,  0.000 sec (  0.713%)
 integral evaluation            ...        0 min,  0.007 sec ( 31.571%)
 zeroth order Hamiltonian       ...        0 min,  0.000 sec (  0.621%)
 iterations                     ...        0 min,  0.003 sec ( 16.085%)
 molecular gradient             ...        0 min,  0.010 sec ( 48.494%)
 printout                       ...        0 min,  0.000 sec (  1.486%)

         :::::::::::::::::::::::::::::::::::::::::::::::::::::
         ::                     SUMMARY                     ::
         :::::::::::::::::::::::::::::::::::::::::::::::::::::
         :: total energy             -33.557298822097 Eh    ::
         :: gradient norm              0.000459418728 Eh/a0 ::
         :: HOMO-LUMO gap              2.920421969392 eV    ::
         ::.................................................::
         :: SCC energy               -33.970523420056 Eh    ::
         :: -> isotropic ES            0.028389280108 Eh    ::
         :: -> anisotropic ES          0.001221368399 Eh    ::
         :: -> anisotropic XC          0.009127645418 Eh    ::
         :: -> dispersion             -0.018902630999 Eh    ::
         :: repulsion energy           0.413156261238 Eh    ::
         :: add. restraining           0.000000000000 Eh    ::
         :::::::::::::::::::::::::::::::::::::::::::::::::::::

           -------------------------------------------------
          |                Property Printout                |
           -------------------------------------------------

    * Orbital Energies and Occupations

         #    Occupation            Energy/Eh            Energy/eV
      -------------------------------------------------------------
         1        2.0000           -0.7270752             -19.7847
       ...           ...                  ...                  ...
        18        2.0000           -0.4994985             -13.5920
        19        2.0000           -0.4940323             -13.4433
        20        2.0000           -0.4853769             -13.2078
        21        2.0000           -0.4763769             -12.9629
        22        2.0000           -0.4658750             -12.6771
        23        2.0000           -0.4641913             -12.6313
        24        2.0000           -0.4521403             -12.3034
        25        2.0000           -0.4469361             -12.1618
        26        2.0000           -0.4418539             -12.0235
        27        2.0000           -0.4225346             -11.4978
        28        2.0000           -0.4219786             -11.4826
        29        2.0000           -0.3707810             -10.0895
        30        2.0000           -0.3610630              -9.8250 (HOMO)
        31                         -0.2537395              -6.9046 (LUMO)
        32                         -0.2049104              -5.5759
        33                         -0.1855458              -5.0490
        34                         -0.1357381              -3.6936
        35                         -0.1150995              -3.1320
        36                         -0.0071543              -0.1947
        37                          0.0205327               0.5587
        38                          0.0361782               0.9845
        39                          0.0395971               1.0775
        40                          0.0452560               1.2315
        41                          0.1008095               2.7432
       ...                                ...                  ...
        59                          0.6795954              18.4927
      -------------------------------------------------------------
                  HL-Gap            0.1073235 Eh            2.9204 eV
             Fermi-level           -0.3074013 Eh           -8.3648 eV

     #   Z        covCN         q      C6AA      α(0)
     1   6 C      2.928    -0.067    29.675     8.934
     2  16 S      2.330    -0.055   143.335    20.150
     3   6 C      2.982    -0.005    28.131     8.700
     4   6 C      3.036     0.109    25.556     8.292
     5   6 C      3.051     0.105    25.627     8.302
     6   8 O      1.704    -0.275    18.563     5.817
     7   6 C      3.651     0.038    20.244     6.463
     8   8 O      1.704    -0.259    18.290     5.774
     9   6 C      3.642     0.037    20.290     6.476
    10   6 C      2.932    -0.027    28.665     8.781
    11   6 C      2.839    -0.094    30.347     9.028
    12   1 H      0.927     0.049     2.327     2.385
    13   1 H      0.925     0.062     2.171     2.304
    14   1 H      0.924     0.040     2.455     2.450
    15   1 H      0.924     0.040     2.446     2.446
    16   1 H      0.924     0.047     2.364     2.404
    17   1 H      0.924     0.053     2.283     2.363
    18   1 H      0.925     0.058     2.222     2.331
    19   1 H      0.925     0.043     2.410     2.428
    20   1 H      0.926     0.059     2.215     2.327
    21   1 H      0.926     0.040     2.445     2.445

 Mol. C6AA /au·bohr⁶  :       5833.175255
 Mol. C8AA /au·bohr⁸  :     154900.341815
 Mol. α(0) /au        :        120.599770


Wiberg/Mayer (AO) data.
largest (>0.10) Wiberg bond orders for each atom
          total WBO             WBO to atom ...
     1  C   3.930        C    5 1.540    S    2 1.169    H   12 0.968
     2  S   2.578        C    1 1.169    C    3 1.119
     3  C   3.937        C    4 1.455    C   10 1.139    S    2 1.119
     4  C   3.935        C    3 1.455    C    5 1.181    O    8 1.063
     5  C   3.931        C    1 1.540    C    4 1.181    O    6 1.040
     6  O   2.211        C    5 1.040    C    7 0.984
     7  C   3.946        O    6 0.984    H   13 0.980    H   14 0.977    H   15 0.977
     8  O   2.239        C    4 1.063    C    9 0.976
     9  C   3.941        H   18 0.980    H   16 0.979    H   17 0.976    O    8 0.976
    10  C   3.990        C   11 1.856    C    3 1.139    H   19 0.963
    11  C   3.990        C   10 1.856    H   21 0.978    H   20 0.972
    12  H   0.997        C    1 0.968
    13  H   0.996        C    7 0.980
    14  H   0.998        C    7 0.977
    15  H   0.998        C    7 0.977
    16  H   0.998        C    9 0.979
    17  H   0.997        C    9 0.976
    18  H   0.996        C    9 0.980
    19  H   0.998        C   10 0.963
    20  H   0.997        C   11 0.972
    21  H   0.998        C   11 0.978

molecular dipole:
                 x           y           z       tot (Debye)
 q only:        0.408       0.627      -0.063
   full:        0.686       0.957      -0.153       3.019
molecular quadrupole (traceless):
                xx          xy          yy          xz          yz          zz
 q only:        1.396       1.850       3.237      -1.000      -0.964      -4.633
  q+dip:       -0.356       1.593       4.420      -0.311      -0.878      -4.064
   full:       -0.598       2.001       4.375       0.227      -0.971      -3.777

           -------------------------------------------------
          |                Geometry Summary                 |
           -------------------------------------------------

      molecular mass/u    :      170.2258000
   center of mass at/Å    :        0.5591361      -0.3144455       0.0211940
  moments of inertia/u·Å² :        0.3716709E+03   0.5941750E+03   0.9573562E+03
rotational constants/cm⁻¹ :        0.4535634E-01   0.2837149E-01   0.1760853E-01

 * 20 selected distances

     #   Z        #   Z                                     value/Å
     1   6 C      2  16 S                                 1.7152211
     2  16 S      3   6 C                                 1.7381900 (max)
     3   6 C      4   6 C                                 1.3800563
     1   6 C      5   6 C                                 1.3632331
     4   6 C      5   6 C                                 1.4336548
     5   6 C      6   8 O                                 1.3666944
     6   8 O      7   6 C                                 1.4058153
     4   6 C      8   8 O                                 1.3587549
     8   8 O      9   6 C                                 1.4106975
    10   6 C     11   6 C                                 1.3302013
     1   6 C     12   1 H                                 1.0702803 (min)
     7   6 C     13   1 H                                 1.0886927
     7   6 C     14   1 H                                 1.0946503
     7   6 C     15   1 H                                 1.0946269
     9   6 C     16   1 H                                 1.0924201
     9   6 C     17   1 H                                 1.0920684
     9   6 C     18   1 H                                 1.0896325
    10   6 C     19   1 H                                 1.0831128
    11   6 C     20   1 H                                 1.0740473
    11   6 C     21   1 H                                 1.0763629

 * 4 distinct bonds (by element types)

   Z      Z             #   av. dist./Å        max./Å        min./Å
   1 H    6 C          10     1.0855894     1.0946503     1.0702803
   6 C    6 C           4     1.3767864     1.4336548     1.3302013
   6 C    8 O           4     1.3854905     1.4106975     1.3587549
   6 C   16 S           2     1.7267056     1.7381900     1.7152211


optimized geometry written to: xtbopt.xyz


           -------------------------------------------------
          | TOTAL ENERGY              -33.557298822097 Eh   |
          | GRADIENT NORM               0.000459418728 Eh/α |
          | HOMO-LUMO GAP               2.920421969392 eV   |
           -------------------------------------------------

------------------------------------------------------------------------
 * finished run on 2021/05/19 at 11:00:34.944     
------------------------------------------------------------------------
 total:
 * wall-time:     0 d,  0 h,  0 min,  0.798 sec
 *  cpu-time:     0 d,  0 h,  0 min,  0.776 sec
 * ratio c/w:     0.972 speedup
 SCF:
 * wall-time:     0 d,  0 h,  0 min,  0.032 sec
 *  cpu-time:     0 d,  0 h,  0 min,  0.032 sec
 * ratio c/w:     0.996 speedup
 ANC optimizer:
 * wall-time:     0 d,  0 h,  0 min,  0.725 sec
 *  cpu-time:     0 d,  0 h,  0 min,  0.725 sec
 * ratio c/w:     1.000 speedup

