      -----------------------------------------------------------      
     |                   =====================                   |     
     |                           x T B                           |     
     |                   =====================                   |     
     |                         S. Grimme                         |     
     |          Mulliken Center for Theoretical Chemistry        |     
     |                    University of Bonn                     |     
     |                Version 6.2 RC2 (SAW190805)                |     
      -----------------------------------------------------------      

   This program is distributed in the hope that it will be useful,
   but WITHOUT ANY WARRANTY; without even the implied warranty of
   MERCHANTABILITY or FITNESS FOR A PARTICULAR PURPOSE.
   
   FOR NON-COMMERCIAL, ACADEMIA USE ONLY.
   
   Cite this work as:
   * S. Grimme, C. Bannwarth, P. Shushkov, J. Chem. Theory Comput., 2017,
     13, 1989-2009. DOI: 10.1021/acs.jctc.7b00118
   * C. Bannwarth, S. Ehlert and S. Grimme., J. Chem. Theory Comput., 2019,
     15, 1652-1671. DOI: 10.1021/acs.jctc.8b01176
   * P. Pracht, E. Caldeweyher, S. Ehlert, S. Grimme, ChemRxiv, 2019, preprint.
     DOI: 10.26434/chemrxiv.8326202.v1
   
   for DFT-D4:
   * E. Caldeweyher, C. Bannwarth and S. Grimme, J. Chem. Phys., 2017,
     147, 034112. DOI: 10.1063/1.4993215
   * E. Caldeweyher, S. Ehlert, A. Hansen, H. Neugebauer, S. Spicher,
     C. Bannwarth and S. Grimme, J. Chem. Phys., 2019, 150, 154122.
     DOI: 10.1063/1.5090222
   
   for sTDA-xTB:
   * S. Grimme and C. Bannwarth, J. Chem. Phys., 2016, 145, 054103.
     DOI: 10.1063/1.4959605
   
   in the mass-spec context:
   * V. Asgeirsson, C. Bauer and S. Grimme, Chem. Sci., 2017, 8, 4879.
     DOI: 10.1039/c7sc00601b
   
   for metadynamics refer to:
   * S. Grimme, J. Chem. Theory Comput., 2019, 155, 2847-2862
     DOI: 10.1021/acs.jctc.9b00143
   
   with help from (in alphabetical order)
   C. Bannwarth, F. Bohle, G. Brandenburg, E. Caldeweyher, M. Checinski,
   S. Dohm, S. Ehlert, S. Ehrlich, F. März, H. Neugebauer, J. Pisarek,
   P. Pracht, P. Shushkov, and S. Spicher.
   
 * started run on 2021/05/19 at 10:58:47.760     

           -------------------------------------------------
          |                Calculation Setup                |
           -------------------------------------------------

          program call               : /ihome/ghutchison/geoffh/xtb/xtb 75.xyz -opt
          hostname                   : smp-n58
          coordinate file            : 75.xyz
          omp threads                :                     1
          number of atoms            :                    26
          number of electrons        :                    82
          charge                     :                     0
          spin                       :                   0.0
          first test random number   :      0.31205539196949


########################################################################
# WARNING! Please study the warnings concerning your input carefully
#  - the use of '-opt' is discouraged, please use '--opt' next time
########################################################################

           ------------------------------------------------- 
          |                 G F N 2 - x T B                 |
          | Geometry, Frequencies, Noncovalent interactions |
          |            JCTC 2019 parametrisation            |
           ------------------------------------------------- 
             KAB for C  - Si     :                1.0500
             KAB for H  - Pd     :                0.9500
             k(s)              :                1.8500
             k(p)              :                2.2300
             k(d)              :                2.2300
             k(f)              :                2.0000
             kEN (H0ij)        :               -2.0000
             D4 a1             :                0.5200
             D4 a2             :                5.0000
             D4 s6             :                1.0000
             D4 s8             :                2.7000
             D4 s9             :                5.0000
             alphaj            :                2.0000

  Z AO/shell   Hii/eV     exponent
  1     Wed Apr 25 08:07:45 CEST 2018   EN: 2.200 GM2: 0.406  GM3: 0.0800  RAES: 1.40
     1s    -10.707211    1.230000
  6     Wed Apr 25 08:07:45 CEST 2018   EN: 2.550 GM2: 0.538  GM3: 0.1500  RAES: 3.00
     2s    -13.970922    2.096432
     2p    -10.063292    1.800000
  9     Mon Apr 23 13:58:50 CEST 2018   EN: 3.980 GM2: 0.532  GM3: 0.1426  RAES: 2.40
     2s    -23.458179    2.416361
     2p    -15.746583    2.308399
 16     Tue Apr 24 11:44:34 CEST 2018   EN: 2.580 GM2: 0.340  GM3:-0.0502  RAES: 3.10
     3s    -20.029654    1.981333
     3p    -11.377694    2.025643
     3d     -0.420282    1.702555

           ------------------------------------------------- 
          |        Self-Consistent Charge Iterations        |
           ------------------------------------------------- 

          ...................................................
          :                      SETUP                      :
          :.................................................:
          :  # basis functions                  77          :
          :  # atomic orbitals                  76          :
          :  # shells                           42          :
          :  # electrons                        82          :
          :  max. iterations                   250          :
          :  Hamiltonian                  GFN2-xTB          :
          :  restarted?                      false          :
          :  GBSA solvation                  false          :
          :  PC potential                    false          :
          :  electronic temp.          300.0000000     K    :
          :  accuracy                    1.0000000          :
          :  -> integral cutoff          0.2500000E+02      :
          :  -> integral neglect         0.1000000E-07      :
          :  -> SCF convergence          0.1000000E-05 Eh   :
          :  -> wf. convergence          0.1000000E-03 e    :
          :  Broyden damping             0.4000000          :
          ...................................................

 iter      E             dE          RMSdq      gap      omega  full diag
   1    -47.0088629 -0.470089E+02  0.407E+00    3.06       0.0  T
   2    -47.0930403 -0.841774E-01  0.230E+00    3.09       1.0  T
   3    -47.0949458 -0.190548E-02  0.103E+00    3.09       1.0  T
   4    -47.0962924 -0.134659E-02  0.335E-01    3.08       1.0  T
   5    -47.0981510 -0.185861E-02  0.144E-01    3.08       1.0  T
   6    -47.0983690 -0.218056E-03  0.428E-02    3.08       1.0  T
   7    -47.0983772 -0.813028E-05  0.207E-02    3.08       1.0  T
   8    -47.0983807 -0.358490E-05  0.125E-02    3.08       1.6  T
   9    -47.0983817 -0.951829E-06  0.453E-03    3.08       4.3  T
  10    -47.0983819 -0.200380E-06  0.184E-03    3.08      10.7  T
  11    -47.0983819 -0.133808E-07  0.749E-04    3.08      26.2  T
  12    -47.0983819 -0.225833E-08  0.316E-04    3.08      62.1  T

   *** convergence criteria satisfied after 12 iterations ***

         #    Occupation            Energy/Eh            Energy/eV
      -------------------------------------------------------------
         1        2.0000           -0.8753327             -23.8190
       ...           ...                  ...                  ...
        35        2.0000           -0.4559139             -12.4060
        36        2.0000           -0.4539846             -12.3535
        37        2.0000           -0.4465758             -12.1519
        38        2.0000           -0.4339975             -11.8097
        39        2.0000           -0.4281246             -11.6499
        40        2.0000           -0.3893337             -10.5943
        41        2.0000           -0.3751541             -10.2085 (HOMO)
        42                         -0.2618621              -7.1256 (LUMO)
        43                         -0.2065171              -5.6196
        44                         -0.1988642              -5.4114
        45                         -0.1599473              -4.3524
        46                         -0.1114929              -3.0339
       ...                                ...                  ...
        76                          0.6622951              18.0220
      -------------------------------------------------------------
                  HL-Gap            0.1132919 Eh            3.0828 eV
             Fermi-level           -0.3185081 Eh           -8.6670 eV

 SCC (total)                   0 d,  0 h,  0 min,  0.045 sec
 SCC setup                      ...        0 min,  0.000 sec (  0.641%)
 Dispersion                     ...        0 min,  0.000 sec (  0.728%)
 integral evaluation            ...        0 min,  0.010 sec ( 23.306%)
 zeroth order Hamiltonian       ...        0 min,  0.000 sec (  0.473%)
 iterations                     ...        0 min,  0.016 sec ( 36.804%)
 molecular gradient             ...        0 min,  0.017 sec ( 37.044%)
 printout                       ...        0 min,  0.000 sec (  0.856%)

         :::::::::::::::::::::::::::::::::::::::::::::::::::::
         ::                     SUMMARY                     ::
         :::::::::::::::::::::::::::::::::::::::::::::::::::::
         :: total energy             -46.605763014628 Eh    ::
         :: gradient norm              0.051804784476 Eh/a0 ::
         :: HOMO-LUMO gap              3.082830639793 eV    ::
         ::.................................................::
         :: SCC energy               -47.098381909982 Eh    ::
         :: -> isotropic ES            0.044523056356 Eh    ::
         :: -> anisotropic ES          0.001635969848 Eh    ::
         :: -> anisotropic XC         -0.001485444008 Eh    ::
         :: -> dispersion             -0.027259780840 Eh    ::
         :: repulsion energy           0.492333510268 Eh    ::
         :: add. restraining           0.000000000000 Eh    ::
         :::::::::::::::::::::::::::::::::::::::::::::::::::::

      ----------------------------------------------------------- 
     |                   =====================                   |
     |                        A N C O P T                        |
     |                   =====================                   |
     |               Approximate Normal Coordinate               |
     |                Rational Function Optimizer                |
      ----------------------------------------------------------- 

          ...................................................
          :                      SETUP                      :
          :.................................................:
          :   optimization level            normal          :
          :   max. optcycles                   200          :
          :   ANC micro-cycles                  20          :
          :   degrees of freedom                72          :
          :.................................................:
          :   RF solver                   davidson          :
          :   input Hessian                  false          :
          :   write xtbopt.log                true          :
          :   linear?                        false          :
          :   energy convergence         0.5000000E-05 Eh   :
          :   grad. convergence          0.1000000E-02 Eh/α :
          :   maximium RF displ.         2.0000000          :
          :   Hlow (freq-cutoff)         0.5000000E-02      :
          :   Hmax (freq-cutoff)         5.0000000          :
          :   S6 in model hess.         20.0000000          :
          ...................................................

generating ANC from model Hessian ...
Using Lindh-Hessian (1995)
 Shifting diagonal of input Hessian by   3.923320667151764E-003
 Lowest  eigenvalues of input Hessian
   -0.000000   -0.000000   -0.000000   -0.000000    0.000000    0.000000
    0.005000    0.006493    0.008493    0.009353    0.011195    0.012732
    0.013438    0.017315    0.018651    0.022621    0.028516    0.030049
 Highest eigenvalues
    1.625825    1.666670    1.699852    1.778077    1.827295    1.977002
 

........................................................................
.............................. CYCLE    1 ..............................
........................................................................
   1    -47.0983819 -0.470984E+02  0.192E-04    3.08       0.0  T
   2    -47.0983819  0.142109E-11  0.177E-04    3.08     110.8  T
   3    -47.0983819 -0.533390E-09  0.687E-05    3.08     285.5  T
     SCC iter.                  ...        0 min,  0.005 sec
     gradient                   ...        0 min,  0.015 sec
 * total energy  :   -46.6057631 Eh     change       -0.5090249E-07 Eh
   gradient norm :     0.0518049 Eh/α   predicted     0.0000000E+00 (-100.00%)
   displ. norm   :     0.2191338 α      lambda       -0.5163427E-02
   maximum displ.:     0.0799226 α      in ANC's #3, #2, #4, ...

........................................................................
.............................. CYCLE    2 ..............................
........................................................................
   1    -47.1185283 -0.471185E+02  0.209E-01    3.13       0.0  T
   2    -47.1185585 -0.302513E-04  0.114E-01    3.13       1.0  T
   3    -47.1184977  0.608322E-04  0.689E-02    3.13       1.0  T
   4    -47.1185960 -0.982908E-04  0.213E-02    3.13       1.0  T
   5    -47.1185974 -0.136389E-05  0.101E-02    3.13       1.9  T
   6    -47.1185986 -0.124774E-05  0.287E-03    3.13       6.8  T
   7    -47.1185988 -0.159166E-06  0.784E-04    3.13      25.0  T
     SCC iter.                  ...        0 min,  0.008 sec
     gradient                   ...        0 min,  0.016 sec
 * total energy  :   -46.6091520 Eh     change       -0.3388952E-02 Eh
   gradient norm :     0.0179943 Eh/α   predicted    -0.2705692E-02 ( -20.16%)
   displ. norm   :     0.1981568 α      lambda       -0.1090173E-02
   maximum displ.:     0.1043181 α      in ANC's #3, #2, #5, ...

........................................................................
.............................. CYCLE    3 ..............................
........................................................................
   1    -47.1256489 -0.471256E+02  0.135E-01    3.14       0.0  T
   2    -47.1256587 -0.987489E-05  0.750E-02    3.15       1.0  T
   3    -47.1256324  0.263724E-04  0.417E-02    3.15       1.0  T
   4    -47.1256687 -0.363673E-04  0.125E-02    3.15       1.6  T
   5    -47.1256693 -0.563305E-06  0.528E-03    3.15       3.7  T
   6    -47.1256697 -0.403554E-06  0.153E-03    3.15      12.8  T
   7    -47.1256697 -0.423645E-07  0.498E-04    3.15      39.4  T
     SCC iter.                  ...        0 min,  0.008 sec
     gradient                   ...        0 min,  0.014 sec
 * total energy  :   -46.6098086 Eh     change       -0.6566091E-03 Eh
   gradient norm :     0.0046098 Eh/α   predicted    -0.5664957E-03 ( -13.72%)
   displ. norm   :     0.1676912 α      lambda       -0.2588998E-03
   maximum displ.:     0.0861220 α      in ANC's #3, #2, #5, ...

........................................................................
.............................. CYCLE    4 ..............................
........................................................................
   1    -47.1255335 -0.471255E+02  0.100E-01    3.14       0.0  T
   2    -47.1255361 -0.257982E-05  0.581E-02    3.14       1.0  T
   3    -47.1255330  0.309080E-05  0.153E-02    3.14       1.3  T
   4    -47.1255373 -0.430622E-05  0.598E-03    3.14       3.3  T
   5    -47.1255376 -0.288074E-06  0.160E-03    3.14      12.2  T
   6    -47.1255377 -0.300107E-07  0.710E-04    3.14      27.6  T
     SCC iter.                  ...        0 min,  0.007 sec
     gradient                   ...        0 min,  0.015 sec
 * total energy  :   -46.6100110 Eh     change       -0.2023449E-03 Eh
   gradient norm :     0.0042167 Eh/α   predicted    -0.1331025E-03 ( -34.22%)
   displ. norm   :     0.2734600 α      lambda       -0.2978224E-03
   maximum displ.:     0.1401679 α      in ANC's #6, #2, #3, ...

........................................................................
.............................. CYCLE    5 ..............................
........................................................................
   1    -47.1234293 -0.471234E+02  0.169E-01    3.12       0.0  T
   2    -47.1234366 -0.730265E-05  0.992E-02    3.12       1.0  T
   3    -47.1234401 -0.349189E-05  0.118E-02    3.12       1.7  T
   4    -47.1234402 -0.521673E-07  0.519E-03    3.13       3.8  T
   5    -47.1234404 -0.241797E-06  0.203E-03    3.12       9.7  T
   6    -47.1234405 -0.631760E-07  0.787E-04    3.12      24.9  T
     SCC iter.                  ...        0 min,  0.007 sec
     gradient                   ...        0 min,  0.014 sec
 * total energy  :   -46.6102131 Eh     change       -0.2020909E-03 Eh
   gradient norm :     0.0050868 Eh/α   predicted    -0.1600471E-03 ( -20.80%)
   displ. norm   :     0.2010087 α      lambda       -0.1495854E-03
   maximum displ.:     0.1160406 α      in ANC's #6, #2, #3, ...

........................................................................
.............................. CYCLE    6 ..............................
........................................................................
   1    -47.1225912 -0.471226E+02  0.131E-01    3.11       0.0  T
   2    -47.1225956 -0.434411E-05  0.779E-02    3.11       1.0  T
   3    -47.1225917  0.381038E-05  0.186E-02    3.11       1.1  T
   4    -47.1225982 -0.646025E-05  0.617E-03    3.11       3.2  T
   5    -47.1225984 -0.195363E-06  0.162E-03    3.11      12.1  T
   6    -47.1225984 -0.300960E-07  0.658E-04    3.11      29.8  T
     SCC iter.                  ...        0 min,  0.007 sec
     gradient                   ...        0 min,  0.014 sec
 * total energy  :   -46.6103050 Eh     change       -0.9195118E-04 Eh
   gradient norm :     0.0061289 Eh/α   predicted    -0.7781676E-04 ( -15.37%)
   displ. norm   :     0.1275690 α      lambda       -0.1131903E-03
   maximum displ.:     0.0673171 α      in ANC's #6, #2, #3, ...

........................................................................
.............................. CYCLE    7 ..............................
........................................................................
   1    -47.1234026 -0.471234E+02  0.817E-02    3.11       0.0  T
   2    -47.1234043 -0.173385E-05  0.483E-02    3.11       1.0  T
   3    -47.1233988  0.548684E-05  0.183E-02    3.11       1.1  T
   4    -47.1234057 -0.688211E-05  0.383E-03    3.11       5.1  T
   5    -47.1234058 -0.577379E-07  0.131E-03    3.11      14.9  T
   6    -47.1234058 -0.152513E-07  0.568E-04    3.11      34.5  T
     SCC iter.                  ...        0 min,  0.008 sec
     gradient                   ...        0 min,  0.016 sec
 * total energy  :   -46.6103857 Eh     change       -0.8063680E-04 Eh
   gradient norm :     0.0045307 Eh/α   predicted    -0.5751670E-04 ( -28.67%)
   displ. norm   :     0.1139018 α      lambda       -0.9716770E-04
   maximum displ.:     0.0641951 α      in ANC's #6, #2, #4, ...

........................................................................
.............................. CYCLE    8 ..............................
........................................................................
   1    -47.1251421 -0.471251E+02  0.726E-02    3.10       0.0  T
   2    -47.1251440 -0.194357E-05  0.434E-02    3.10       1.0  T
   3    -47.1251374  0.657805E-05  0.209E-02    3.10       1.0  T
   4    -47.1251455 -0.800714E-05  0.331E-03    3.10       5.9  T
   5    -47.1251455 -0.882191E-07  0.129E-03    3.10      15.2  T
   6    -47.1251455 -0.388553E-08  0.603E-04    3.10      32.5  T
     SCC iter.                  ...        0 min,  0.008 sec
     gradient                   ...        0 min,  0.016 sec
 * total energy  :   -46.6104463 Eh     change       -0.6064067E-04 Eh
   gradient norm :     0.0022146 Eh/α   predicted    -0.4921487E-04 ( -18.84%)
   displ. norm   :     0.1141757 α      lambda        0.2035773E-04
   maximum displ.:     0.0641766 α      in ANC's #6, #2, #4, ...

........................................................................
.............................. CYCLE    9 ..............................
........................................................................
   1    -47.1265187 -0.471265E+02  0.723E-02    3.10       0.0  T
   2    -47.1265205 -0.177764E-05  0.432E-02    3.10       1.0  T
   3    -47.1265141  0.636609E-05  0.204E-02    3.10       1.0  T
   4    -47.1265219 -0.775115E-05  0.321E-03    3.10       6.1  T
   5    -47.1265220 -0.721926E-07  0.126E-03    3.10      15.5  T
   6    -47.1265220 -0.454266E-08  0.609E-04    3.10      32.2  T
   7    -47.1265220 -0.446531E-08  0.287E-04    3.10      68.4  T
     SCC iter.                  ...        0 min,  0.008 sec
     gradient                   ...        0 min,  0.015 sec
 * total energy  :   -46.6104412 Eh     change        0.5124973E-05 Eh
   gradient norm :     0.0044260 Eh/α   predicted     0.1030668E-04 ( 101.11%)
   displ. norm   :     0.0636031 α      lambda       -0.6439043E-04
   maximum displ.:     0.0474274 α      in ANC's #6, #2, #3, ...

........................................................................
.............................. CYCLE   10 ..............................
........................................................................
   1    -47.1250894 -0.471251E+02  0.409E-02    3.09       0.0  T
   2    -47.1250908 -0.130903E-05  0.250E-02    3.09       1.0  T
   3    -47.1250896  0.112012E-05  0.912E-03    3.09       2.1  T
   4    -47.1250912 -0.155162E-05  0.266E-03    3.09       7.4  T
   5    -47.1250913 -0.116398E-06  0.925E-04    3.09      21.2  T
     SCC iter.                  ...        0 min,  0.006 sec
     gradient                   ...        0 min,  0.014 sec
 * total energy  :   -46.6104764 Eh     change       -0.3520948E-04 Eh
   gradient norm :     0.0028233 Eh/α   predicted    -0.3232929E-04 (  -8.18%)
   displ. norm   :     0.0486091 α      lambda       -0.2764735E-04
   maximum displ.:     0.0294038 α      in ANC's #3, #6, #1, ...

........................................................................
.............................. CYCLE   11 ..............................
........................................................................
   1    -47.1250515 -0.471251E+02  0.331E-02    3.10       0.0  T
   2    -47.1250519 -0.419394E-06  0.193E-02    3.10       1.0  T
   3    -47.1250501  0.180568E-05  0.106E-02    3.10       1.9  T
   4    -47.1250523 -0.225164E-05  0.208E-03    3.10       9.4  T
   5    -47.1250524 -0.147662E-07  0.841E-04    3.10      23.3  T
   6    -47.1250524 -0.801997E-08  0.322E-04    3.10      61.0  T
     SCC iter.                  ...        0 min,  0.008 sec
     gradient                   ...        0 min,  0.016 sec
 * total energy  :   -46.6104901 Eh     change       -0.1372672E-04 Eh
   gradient norm :     0.0008900 Eh/α   predicted    -0.1385941E-04 (   0.97%)
   displ. norm   :     0.0956299 α      lambda       -0.1280826E-04
   maximum displ.:     0.0584450 α      in ANC's #2, #6, #4, ...

........................................................................
.............................. CYCLE   12 ..............................
........................................................................
   1    -47.1245585 -0.471246E+02  0.593E-02    3.09       0.0  T
   2    -47.1245593 -0.806279E-06  0.357E-02    3.09       1.0  T
   3    -47.1245581  0.119263E-05  0.927E-03    3.09       2.1  T
   4    -47.1245599 -0.178823E-05  0.204E-03    3.09       9.6  T
   5    -47.1245599 -0.522596E-08  0.781E-04    3.09      25.1  T
   6    -47.1245599 -0.948398E-08  0.328E-04    3.09      59.9  T
     SCC iter.                  ...        0 min,  0.008 sec
     gradient                   ...        0 min,  0.016 sec
 * total energy  :   -46.6105001 Eh     change       -0.9998852E-05 Eh
   gradient norm :     0.0010200 Eh/α   predicted    -0.6431972E-05 ( -35.67%)
   displ. norm   :     0.0332412 α      lambda       -0.3750565E-05
   maximum displ.:     0.0242302 α      in ANC's #2, #6, #8, ...

........................................................................
.............................. CYCLE   13 ..............................
........................................................................
   1    -47.1250756 -0.471251E+02  0.200E-02    3.09       0.0  T
   2    -47.1250757 -0.101472E-06  0.117E-02    3.09       1.7  T
   3    -47.1250756  0.165253E-06  0.359E-03    3.09       5.5  T
   4    -47.1250758 -0.219286E-06  0.108E-03    3.09      18.2  T
   5    -47.1250758 -0.610071E-08  0.360E-04    3.09      54.5  T
   6    -47.1250758 -0.117029E-08  0.116E-04    3.09     168.6  T
     SCC iter.                  ...        0 min,  0.007 sec
     gradient                   ...        0 min,  0.015 sec
 * total energy  :   -46.6105032 Eh     change       -0.3143376E-05 Eh
   gradient norm :     0.0004859 Eh/α   predicted    -0.1877540E-05 ( -40.27%)
   displ. norm   :     0.0333351 α      lambda        0.2403089E-05
   maximum displ.:     0.0242268 α      in ANC's #2, #6, #8, ...

   *** GEOMETRY OPTIMIZATION CONVERGED AFTER 13 ITERATIONS ***

------------------------------------------------------------------------
 total energy gain   :        -0.0047402 Eh       -2.9745 kcal/mol
 total RMSD          :         0.2593718 a0        0.1373 Å
 total power (kW/mol):        -0.9573439 (step)  -27.9706 (real)
------------------------------------------------------------------------

 ANCopt (total)                0 d,  0 h,  0 min,  0.445 sec
 optimizer setup                ...        0 min,  0.000 sec (  0.032%)
 model hessian                  ...        0 min,  0.013 sec (  2.847%)
 ANC generation                 ...        0 min,  0.001 sec (  0.170%)
 coordinate transformation      ...        0 min,  0.000 sec (  0.051%)
 single point calculation       ...        0 min,  0.427 sec ( 96.035%)
 optimization log               ...        0 min,  0.001 sec (  0.287%)
 hessian update                 ...        0 min,  0.000 sec (  0.036%)
 rational function              ...        0 min,  0.002 sec (  0.375%)

================
 final structure:
================
$coord
    2.66060256668075   -2.29794403630024    0.32510281939957      C 
    4.79942027877327    0.10837707767006    0.02080435644503      S 
    2.38670989145634    2.33162002909661   -0.27156312604936      C 
    0.05749641081913    1.19274757437754   -0.09804972788672      C 
    0.22891676780295   -1.46142324955345    0.24121660383416      C 
   -2.02254537182768   -3.15504192402649    0.55093956506966      C 
   -4.48205790485874   -1.82970108715795   -0.20454547894001      C 
   -4.81568270035898   -1.89741578495220   -3.06464904257479      C 
   -2.78899098866159   -1.17842723605438   -4.39299186205404      F 
   -5.36422384365357   -4.25378840739246   -3.85374493985363      F 
   -6.73863968796981   -0.43166727040553   -3.84532983237983      F 
   -4.55512050167456    0.86444202166280    0.84660067402604      C 
   -2.44000546968814    2.51218147769774   -0.22574594034211      C 
    3.12726195005271    4.93042303122315   -0.61140841081448      C 
    1.71670047119740    6.82138937128808   -1.47845231921431      C 
    3.31274648163077   -4.20246887269696    0.54972546700279      H 
   -2.16919730975688   -3.71989685626134    2.53440129264998      H 
   -1.76896807834574   -4.87712254653290   -0.56085811426664      H 
   -6.09515471038455   -2.89591445824111    0.53877385880995      H 
   -4.35671645758685    0.73527221161445    2.89605366089386      H 
   -6.38111420836474    1.72934119494626    0.43281078138376      H 
   -2.34946333510916    4.28067593394862    0.83501417485281      H 
   -2.85955100621424    2.98865875632549   -2.19323371846930      H 
    5.08219981110826    5.29808105626372   -0.12732893196591      H 
   -0.20615047928828    6.58870924180246   -2.08459143999409      H 
    2.49348050852494    8.69333289672397   -1.65055776780938      H 
$end
           -------------------------------------------------
          |                Final Singlepoint                |
           -------------------------------------------------

          ...................................................
          :                      SETUP                      :
          :.................................................:
          :  # basis functions                  77          :
          :  # atomic orbitals                  76          :
          :  # shells                           42          :
          :  # electrons                        82          :
          :  max. iterations                   250          :
          :  Hamiltonian                  GFN2-xTB          :
          :  restarted?                      false          :
          :  GBSA solvation                  false          :
          :  PC potential                    false          :
          :  electronic temp.          300.0000000     K    :
          :  accuracy                    1.0000000          :
          :  -> integral cutoff          0.2500000E+02      :
          :  -> integral neglect         0.1000000E-07      :
          :  -> SCF convergence          0.1000000E-05 Eh   :
          :  -> wf. convergence          0.1000000E-03 e    :
          :  Broyden damping             0.4000000          :
          ...................................................

 iter      E             dE          RMSdq      gap      omega  full diag
   1    -47.1250758 -0.471251E+02  0.614E-05    3.09       0.0  T
   2    -47.1250758 -0.378009E-11  0.324E-05    3.09     604.9  T
   3    -47.1250758 -0.313705E-10  0.219E-05    3.09     893.8  T

   *** convergence criteria satisfied after 3 iterations ***

         #    Occupation            Energy/Eh            Energy/eV
      -------------------------------------------------------------
         1        2.0000           -0.8770354             -23.8653
       ...           ...                  ...                  ...
        35        2.0000           -0.4577392             -12.4557
        36        2.0000           -0.4558571             -12.4045
        37        2.0000           -0.4457875             -12.1305
        38        2.0000           -0.4328851             -11.7794
        39        2.0000           -0.4314775             -11.7411
        40        2.0000           -0.3915846             -10.6556
        41        2.0000           -0.3769882             -10.2584 (HOMO)
        42                         -0.2633755              -7.1668 (LUMO)
        43                         -0.2061874              -5.6106
        44                         -0.1987858              -5.4092
        45                         -0.1511533              -4.1131
        46                         -0.1154871              -3.1426
       ...                                ...                  ...
        76                          0.6774405              18.4341
      -------------------------------------------------------------
                  HL-Gap            0.1136128 Eh            3.0916 eV
             Fermi-level           -0.3201819 Eh           -8.7126 eV

 SCC (total)                   0 d,  0 h,  0 min,  0.030 sec
 SCC setup                      ...        0 min,  0.000 sec (  0.618%)
 Dispersion                     ...        0 min,  0.000 sec (  0.696%)
 integral evaluation            ...        0 min,  0.010 sec ( 34.414%)
 zeroth order Hamiltonian       ...        0 min,  0.000 sec (  0.567%)
 iterations                     ...        0 min,  0.004 sec ( 13.523%)
 molecular gradient             ...        0 min,  0.015 sec ( 48.989%)
 printout                       ...        0 min,  0.000 sec (  1.020%)

         :::::::::::::::::::::::::::::::::::::::::::::::::::::
         ::                     SUMMARY                     ::
         :::::::::::::::::::::::::::::::::::::::::::::::::::::
         :: total energy             -46.610503248050 Eh    ::
         :: gradient norm              0.000485751984 Eh/a0 ::
         :: HOMO-LUMO gap              3.091560693276 eV    ::
         ::.................................................::
         :: SCC energy               -47.125075786057 Eh    ::
         :: -> isotropic ES            0.044874661995 Eh    ::
         :: -> anisotropic ES          0.001348590506 Eh    ::
         :: -> anisotropic XC         -0.002862556387 Eh    ::
         :: -> dispersion             -0.027511748213 Eh    ::
         :: repulsion energy           0.514290645748 Eh    ::
         :: add. restraining           0.000000000000 Eh    ::
         :::::::::::::::::::::::::::::::::::::::::::::::::::::

           -------------------------------------------------
          |                Property Printout                |
           -------------------------------------------------

    * Orbital Energies and Occupations

         #    Occupation            Energy/Eh            Energy/eV
      -------------------------------------------------------------
         1        2.0000           -0.8770354             -23.8653
       ...           ...                  ...                  ...
        29        2.0000           -0.5035741             -13.7029
        30        2.0000           -0.4928438             -13.4110
        31        2.0000           -0.4903821             -13.3440
        32        2.0000           -0.4755142             -12.9394
        33        2.0000           -0.4694225             -12.7736
        34        2.0000           -0.4622491             -12.5784
        35        2.0000           -0.4577392             -12.4557
        36        2.0000           -0.4558571             -12.4045
        37        2.0000           -0.4457875             -12.1305
        38        2.0000           -0.4328851             -11.7794
        39        2.0000           -0.4314775             -11.7411
        40        2.0000           -0.3915846             -10.6556
        41        2.0000           -0.3769882             -10.2584 (HOMO)
        42                         -0.2633755              -7.1668 (LUMO)
        43                         -0.2061874              -5.6106
        44                         -0.1987858              -5.4092
        45                         -0.1511533              -4.1131
        46                         -0.1154871              -3.1426
        47                         -0.0056055              -0.1525
        48                          0.0088690               0.2413
        49                          0.0165833               0.4513
        50                          0.0313232               0.8523
        51                          0.0324089               0.8819
        52                          0.0351222               0.9557
       ...                                ...                  ...
        76                          0.6774405              18.4341
      -------------------------------------------------------------
                  HL-Gap            0.1136128 Eh            3.0916 eV
             Fermi-level           -0.3201819 Eh           -8.7126 eV

     #   Z        covCN         q      C6AA      α(0)
     1   6 C      2.937    -0.033    28.824     8.805
     2  16 S      2.343    -0.034   142.459    20.088
     3   6 C      2.987     0.014    27.700     8.633
     4   6 C      3.153    -0.011    28.000     8.654
     5   6 C      3.164    -0.009    27.890     8.631
     6   6 C      3.810    -0.057    21.599     6.615
     7   6 C      3.856    -0.034    21.143     6.540
     8   6 C      3.332     0.484    17.361     6.607
     9   9 F      0.791    -0.201    11.246     3.961
    10   9 F      0.791    -0.216    11.400     3.988
    11   9 F      0.791    -0.212    11.362     3.982
    12   6 C      3.807    -0.059    21.625     6.620
    13   6 C      3.806    -0.056    21.583     6.614
    14   6 C      2.937    -0.030    28.746     8.793
    15   6 C      2.838    -0.093    30.332     9.025
    16   1 H      0.926     0.043     2.408     2.427
    17   1 H      0.924     0.055     2.259     2.351
    18   1 H      0.924     0.053     2.279     2.361
    19   1 H      0.924     0.059     2.206     2.323
    20   1 H      0.924     0.052     2.289     2.366
    21   1 H      0.924     0.049     2.329     2.387
    22   1 H      0.924     0.052     2.301     2.372
    23   1 H      0.924     0.054     2.274     2.358
    24   1 H      0.925     0.044     2.395     2.420
    25   1 H      0.926     0.044     2.396     2.421
    26   1 H      0.926     0.042     2.420     2.432

 Mol. C6AA /au·bohr⁶  :       8674.885198
 Mol. C8AA /au·bohr⁸  :     226728.417112
 Mol. α(0) /au        :        143.774157


Wiberg/Mayer (AO) data.
largest (>0.10) Wiberg bond orders for each atom
          total WBO             WBO to atom ...
     1  C   3.948        C    5 1.577    S    2 1.200    H   16 0.970    C    3 0.103
     2  S   2.615        C    1 1.200    C    3 1.130
     3  C   3.946        C    4 1.501    C   14 1.131    S    2 1.130    C    1 0.103
     4  C   3.985        C    3 1.501    C    5 1.250    C   13 1.012
     5  C   3.984        C    1 1.577    C    4 1.250    C    6 1.006
     6  C   3.993        C    5 1.006    C    7 0.990    H   18 0.967    H   17 0.961
     7  C   3.981        C   12 0.993    C    6 0.990    H   19 0.961    C    8 0.945
     8  C   3.819        F    9 0.956    C    7 0.945    F   11 0.944    F   10 0.941
     9  F   1.080        C    8 0.956
    10  F   1.062        C    8 0.941
    11  F   1.066        C    8 0.944
    12  C   3.992        C   13 1.005    C    7 0.993    H   21 0.975    H   20 0.975
    13  C   3.997        C    4 1.012    C   12 1.005    H   22 0.963    H   23 0.957
    14  C   3.991        C   15 1.866    C    3 1.131    H   24 0.962
    15  C   3.991        C   14 1.866    H   26 0.977    H   25 0.973
    16  H   0.998        C    1 0.970
    17  H   0.997        C    6 0.961
    18  H   0.997        C    6 0.967
    19  H   0.996        C    7 0.961
    20  H   0.997        C   12 0.975
    21  H   0.997        C   12 0.975
    22  H   0.997        C   13 0.963
    23  H   0.997        C   13 0.957
    24  H   0.998        C   14 0.962
    25  H   0.998        C   15 0.973
    26  H   0.998        C   15 0.977

molecular dipole:
                 x           y           z       tot (Debye)
 q only:        0.086       0.278       1.222
   full:       -0.261       0.127       1.233       3.219
molecular quadrupole (traceless):
                xx          xy          yy          xz          yz          zz
 q only:       -0.903      -2.150       5.675      -8.865      -4.219      -4.772
  q+dip:       -2.392      -2.210       7.591      -8.523      -5.111      -5.199
   full:       -2.948      -2.142       7.333      -9.002      -4.711      -4.386

           -------------------------------------------------
          |                Geometry Summary                 |
           -------------------------------------------------

      molecular mass/u    :      232.2631000
   center of mass at/Å    :       -0.5518465       0.0068984      -0.6284016
  moments of inertia/u·Å² :        0.5302965E+03   0.1326449E+04   0.1571262E+04
rotational constants/cm⁻¹ :        0.3178907E-01   0.1270885E-01   0.1072872E-01

 * 25 selected distances

     #   Z        #   Z                                     value/Å
     1   6 C      2  16 S                                 1.7112581
     2  16 S      3   6 C                                 1.7430314 (max)
     3   6 C      4   6 C                                 1.3750845
     1   6 C      5   6 C                                 1.3615289
     4   6 C      5   6 C                                 1.4188573
     6   6 C      7   6 C                                 1.5315534
     7   6 C      8   6 C                                 1.5241851
     8   6 C      9   9 F                                 1.3375648
     8   6 C     10   9 F                                 1.3466560
     8   6 C     11   9 F                                 1.3445315
     7   6 C     12   6 C                                 1.5308371
     4   6 C     13   6 C                                 1.4962460
    12   6 C     13   6 C                                 1.5280935
    14   6 C     15   6 C                                 1.3300365
     1   6 C     16   1 H                                 1.0718892 (min)
     6   6 C     17   1 H                                 1.0940909
     6   6 C     18   1 H                                 1.0929730
     7   6 C     19   1 H                                 1.0962295
    12   6 C     20   1 H                                 1.0917360
    12   6 C     21   1 H                                 1.0913793
    13   6 C     22   1 H                                 1.0923355
    13   6 C     23   1 H                                 1.0940101
    14   6 C     24   1 H                                 1.0833652
    15   6 C     25   1 H                                 1.0739692
    15   6 C     26   1 H                                 1.0763497

 * 4 distinct bonds (by element types)

   Z      Z             #   av. dist./Å        max./Å        min./Å
   1 H    6 C          11     1.0871207     1.0962295     1.0718892
   6 C    6 C           9     1.4551581     1.5315534     1.3300365
   6 C    9 F           3     1.3429174     1.3466560     1.3375648
   6 C   16 S           2     1.7271448     1.7430314     1.7112581


optimized geometry written to: xtbopt.xyz


           -------------------------------------------------
          | TOTAL ENERGY              -46.610503248050 Eh   |
          | GRADIENT NORM               0.000485751984 Eh/α |
          | HOMO-LUMO GAP               3.091560693276 eV   |
           -------------------------------------------------

------------------------------------------------------------------------
 * finished run on 2021/05/19 at 10:58:48.301     
------------------------------------------------------------------------
 total:
 * wall-time:     0 d,  0 h,  0 min,  0.541 sec
 *  cpu-time:     0 d,  0 h,  0 min,  0.541 sec
 * ratio c/w:     1.000 speedup
 SCF:
 * wall-time:     0 d,  0 h,  0 min,  0.045 sec
 *  cpu-time:     0 d,  0 h,  0 min,  0.045 sec
 * ratio c/w:     1.000 speedup
 ANC optimizer:
 * wall-time:     0 d,  0 h,  0 min,  0.475 sec
 *  cpu-time:     0 d,  0 h,  0 min,  0.475 sec
 * ratio c/w:     1.000 speedup

