      -----------------------------------------------------------      
     |                   =====================                   |     
     |                           x T B                           |     
     |                   =====================                   |     
     |                         S. Grimme                         |     
     |          Mulliken Center for Theoretical Chemistry        |     
     |                    University of Bonn                     |     
     |                Version 6.2 RC2 (SAW190805)                |     
      -----------------------------------------------------------      

   This program is distributed in the hope that it will be useful,
   but WITHOUT ANY WARRANTY; without even the implied warranty of
   MERCHANTABILITY or FITNESS FOR A PARTICULAR PURPOSE.
   
   FOR NON-COMMERCIAL, ACADEMIA USE ONLY.
   
   Cite this work as:
   * S. Grimme, C. Bannwarth, P. Shushkov, J. Chem. Theory Comput., 2017,
     13, 1989-2009. DOI: 10.1021/acs.jctc.7b00118
   * C. Bannwarth, S. Ehlert and S. Grimme., J. Chem. Theory Comput., 2019,
     15, 1652-1671. DOI: 10.1021/acs.jctc.8b01176
   * P. Pracht, E. Caldeweyher, S. Ehlert, S. Grimme, ChemRxiv, 2019, preprint.
     DOI: 10.26434/chemrxiv.8326202.v1
   
   for DFT-D4:
   * E. Caldeweyher, C. Bannwarth and S. Grimme, J. Chem. Phys., 2017,
     147, 034112. DOI: 10.1063/1.4993215
   * E. Caldeweyher, S. Ehlert, A. Hansen, H. Neugebauer, S. Spicher,
     C. Bannwarth and S. Grimme, J. Chem. Phys., 2019, 150, 154122.
     DOI: 10.1063/1.5090222
   
   for sTDA-xTB:
   * S. Grimme and C. Bannwarth, J. Chem. Phys., 2016, 145, 054103.
     DOI: 10.1063/1.4959605
   
   in the mass-spec context:
   * V. Asgeirsson, C. Bauer and S. Grimme, Chem. Sci., 2017, 8, 4879.
     DOI: 10.1039/c7sc00601b
   
   for metadynamics refer to:
   * S. Grimme, J. Chem. Theory Comput., 2019, 155, 2847-2862
     DOI: 10.1021/acs.jctc.9b00143
   
   with help from (in alphabetical order)
   C. Bannwarth, F. Bohle, G. Brandenburg, E. Caldeweyher, M. Checinski,
   S. Dohm, S. Ehlert, S. Ehrlich, F. März, H. Neugebauer, J. Pisarek,
   P. Pracht, P. Shushkov, and S. Spicher.
   
 * started run on 2021/05/19 at 11:00:36.716     

           -------------------------------------------------
          |                Calculation Setup                |
           -------------------------------------------------

          program call               : /ihome/ghutchison/geoffh/xtb/xtb 751.xyz -opt
          hostname                   : smp-n83
          coordinate file            : 751.xyz
          omp threads                :                     1
          number of atoms            :                    28
          number of electrons        :                    92
          charge                     :                     0
          spin                       :                   0.0
          first test random number   :      0.19387577915538


########################################################################
# WARNING! Please study the warnings concerning your input carefully
#  - the use of '-opt' is discouraged, please use '--opt' next time
########################################################################

           ------------------------------------------------- 
          |                 G F N 2 - x T B                 |
          | Geometry, Frequencies, Noncovalent interactions |
          |            JCTC 2019 parametrisation            |
           ------------------------------------------------- 
             KAB for C  - Si     :                1.0500
             KAB for H  - Pd     :                0.9500
             k(s)              :                1.8500
             k(p)              :                2.2300
             k(d)              :                2.2300
             k(f)              :                2.0000
             kEN (H0ij)        :               -2.0000
             D4 a1             :                0.5200
             D4 a2             :                5.0000
             D4 s6             :                1.0000
             D4 s8             :                2.7000
             D4 s9             :                5.0000
             alphaj            :                2.0000

  Z AO/shell   Hii/eV     exponent
  1     Wed Apr 25 08:07:45 CEST 2018   EN: 2.200 GM2: 0.406  GM3: 0.0800  RAES: 1.40
     1s    -10.707211    1.230000
  6     Wed Apr 25 08:07:45 CEST 2018   EN: 2.550 GM2: 0.538  GM3: 0.1500  RAES: 3.00
     2s    -13.970922    2.096432
     2p    -10.063292    1.800000
  8     Wed Apr 25 08:07:45 CEST 2018   EN: 3.440 GM2: 0.452  GM3:-0.0517  RAES: 1.80
     2s    -20.229985    2.439742
     2p    -15.503117    2.137023
  9     Mon Apr 23 13:58:50 CEST 2018   EN: 3.980 GM2: 0.532  GM3: 0.1426  RAES: 2.40
     2s    -23.458179    2.416361
     2p    -15.746583    2.308399
 16     Tue Apr 24 11:44:34 CEST 2018   EN: 2.580 GM2: 0.340  GM3:-0.0502  RAES: 3.10
     3s    -20.029654    1.981333
     3p    -11.377694    2.025643
     3d     -0.420282    1.702555

           ------------------------------------------------- 
          |        Self-Consistent Charge Iterations        |
           ------------------------------------------------- 

          ...................................................
          :                      SETUP                      :
          :.................................................:
          :  # basis functions                  85          :
          :  # atomic orbitals                  84          :
          :  # shells                           46          :
          :  # electrons                        92          :
          :  max. iterations                   250          :
          :  Hamiltonian                  GFN2-xTB          :
          :  restarted?                      false          :
          :  GBSA solvation                  false          :
          :  PC potential                    false          :
          :  electronic temp.          300.0000000     K    :
          :  accuracy                    1.0000000          :
          :  -> integral cutoff          0.2500000E+02      :
          :  -> integral neglect         0.1000000E-07      :
          :  -> SCF convergence          0.1000000E-05 Eh   :
          :  -> wf. convergence          0.1000000E-03 e    :
          :  Broyden damping             0.4000000          :
          ...................................................

 iter      E             dE          RMSdq      gap      omega  full diag
   1    -53.2102303 -0.532102E+02  0.442E+00    2.89       0.0  T
   2    -53.2924922 -0.822619E-01  0.244E+00    1.86       1.0  T
   3    -53.2928603 -0.368089E-03  0.143E+00    1.92       1.0  T
   4    -53.3072876 -0.144273E-01  0.332E-01    1.31       1.0  T
   5    -53.3086406 -0.135296E-02  0.150E-01    1.41       1.0  T
   6    -53.3087941 -0.153519E-03  0.809E-02    1.45       1.0  T
   7    -53.3088924 -0.982859E-04  0.251E-02    1.45       1.0  T
   8    -53.3088956 -0.319935E-05  0.139E-02    1.45       1.4  T
   9    -53.3088981 -0.246437E-05  0.608E-03    1.45       3.1  T
  10    -53.3088984 -0.348933E-06  0.242E-03    1.45       7.8  T
  11    -53.3088984 -0.286628E-07  0.133E-03    1.45      14.2  T
  12    -53.3088985 -0.212115E-07  0.513E-04    1.45      36.8  T
  13    -53.3088985 -0.552717E-09  0.258E-04    1.45      73.3  T

   *** convergence criteria satisfied after 13 iterations ***

         #    Occupation            Energy/Eh            Energy/eV
      -------------------------------------------------------------
         1        2.0000           -0.8943273             -24.3359
       ...           ...                  ...                  ...
        40        2.0000           -0.4540227             -12.3546
        41        2.0000           -0.4492323             -12.2242
        42        2.0000           -0.4469633             -12.1625
        43        2.0000           -0.4406128             -11.9897
        44        2.0000           -0.4347574             -11.8304
        45        2.0000           -0.4006694             -10.9028
        46        2.0000           -0.3835786             -10.4377 (HOMO)
        47                         -0.3301512              -8.9839 (LUMO)
        48                         -0.2751559              -7.4874
        49                         -0.2135590              -5.8112
        50                         -0.2071325              -5.6364
        51                         -0.1637083              -4.4547
       ...                                ...                  ...
        84                          0.6567718              17.8717
      -------------------------------------------------------------
                  HL-Gap            0.0534275 Eh            1.4538 eV
             Fermi-level           -0.3568649 Eh           -9.7108 eV

 SCC (total)                   0 d,  0 h,  0 min,  0.055 sec
 SCC setup                      ...        0 min,  0.000 sec (  0.651%)
 Dispersion                     ...        0 min,  0.000 sec (  0.791%)
 integral evaluation            ...        0 min,  0.014 sec ( 25.261%)
 zeroth order Hamiltonian       ...        0 min,  0.000 sec (  0.453%)
 iterations                     ...        0 min,  0.020 sec ( 36.795%)
 molecular gradient             ...        0 min,  0.019 sec ( 35.160%)
 printout                       ...        0 min,  0.000 sec (  0.794%)

         :::::::::::::::::::::::::::::::::::::::::::::::::::::
         ::                     SUMMARY                     ::
         :::::::::::::::::::::::::::::::::::::::::::::::::::::
         :: total energy             -52.778422569624 Eh    ::
         :: gradient norm              0.104586910846 Eh/a0 ::
         :: HOMO-LUMO gap              1.453835194340 eV    ::
         ::.................................................::
         :: SCC energy               -53.308898457583 Eh    ::
         :: -> isotropic ES            0.061847805919 Eh    ::
         :: -> anisotropic ES          0.003327066819 Eh    ::
         :: -> anisotropic XC         -0.002166781915 Eh    ::
         :: -> dispersion             -0.030132237191 Eh    ::
         :: repulsion energy           0.530237275530 Eh    ::
         :: add. restraining           0.000000000000 Eh    ::
         :::::::::::::::::::::::::::::::::::::::::::::::::::::

      ----------------------------------------------------------- 
     |                   =====================                   |
     |                        A N C O P T                        |
     |                   =====================                   |
     |               Approximate Normal Coordinate               |
     |                Rational Function Optimizer                |
      ----------------------------------------------------------- 

          ...................................................
          :                      SETUP                      :
          :.................................................:
          :   optimization level            normal          :
          :   max. optcycles                   200          :
          :   ANC micro-cycles                  20          :
          :   degrees of freedom                78          :
          :.................................................:
          :   RF solver                   davidson          :
          :   input Hessian                  false          :
          :   write xtbopt.log                true          :
          :   linear?                        false          :
          :   energy convergence         0.5000000E-05 Eh   :
          :   grad. convergence          0.1000000E-02 Eh/α :
          :   maximium RF displ.         2.0000000          :
          :   Hlow (freq-cutoff)         0.5000000E-02      :
          :   Hmax (freq-cutoff)         5.0000000          :
          :   S6 in model hess.         20.0000000          :
          ...................................................

generating ANC from model Hessian ...
Using Lindh-Hessian (1995)
 Shifting diagonal of input Hessian by   4.106185957147440E-003
 Lowest  eigenvalues of input Hessian
   -0.000000   -0.000000   -0.000000   -0.000000    0.000000    0.000000
    0.005000    0.006335    0.006489    0.007964    0.008735    0.010070
    0.011444    0.014259    0.016370    0.018882    0.020460    0.021318
 Highest eigenvalues
    1.619784    1.661579    1.706919    1.800948    1.981830    2.024019
 

........................................................................
.............................. CYCLE    1 ..............................
........................................................................
   1    -53.3088985 -0.533089E+02  0.917E-05    1.45       0.0  T
   2    -53.3088985 -0.199663E-10  0.603E-05    1.45     313.5  T
   3    -53.3088985  0.377298E-11  0.405E-05    1.45     466.6  T
     SCC iter.                  ...        0 min,  0.005 sec
     gradient                   ...        0 min,  0.019 sec
 * total energy  :   -52.7784226 Eh     change       -0.1388324E-07 Eh
   gradient norm :     0.1045849 Eh/α   predicted     0.0000000E+00 (-100.00%)
   displ. norm   :     0.2883219 α      lambda       -0.1110722E-01
   maximum displ.:     0.1132385 α      in ANC's #15, #7, #11, ...

........................................................................
.............................. CYCLE    2 ..............................
........................................................................
   1    -53.3425214 -0.533425E+02  0.271E-01    1.85       0.0  T
   2    -53.3426173 -0.959202E-04  0.146E-01    1.77       1.0  T
   3    -53.3425572  0.600990E-04  0.751E-02    1.79       1.0  T
   4    -53.3426527 -0.954880E-04  0.263E-02    1.77       1.0  T
   5    -53.3426564 -0.364743E-05  0.128E-02    1.77       1.5  T
   6    -53.3426588 -0.244291E-05  0.435E-03    1.78       4.3  T
   7    -53.3426591 -0.277813E-06  0.178E-03    1.78      10.6  T
     SCC iter.                  ...        0 min,  0.010 sec
     gradient                   ...        0 min,  0.018 sec
 * total energy  :   -52.7859239 Eh     change       -0.7501336E-02 Eh
   gradient norm :     0.0401523 Eh/α   predicted    -0.6015293E-02 ( -19.81%)
   displ. norm   :     0.2877665 α      lambda       -0.3261568E-02
   maximum displ.:     0.1390199 α      in ANC's #7, #5, #10, ...

........................................................................
.............................. CYCLE    3 ..............................
........................................................................
   1    -53.3580751 -0.533581E+02  0.207E-01    1.97       0.0  T
   2    -53.3581041 -0.289469E-04  0.117E-01    1.96       1.0  T
   3    -53.3580712  0.328597E-04  0.489E-02    1.97       1.0  T
   4    -53.3581149 -0.436744E-04  0.170E-02    1.96       1.1  T
   5    -53.3581169 -0.201961E-05  0.617E-03    1.96       3.1  T
   6    -53.3581174 -0.507843E-06  0.185E-03    1.96      10.2  T
   7    -53.3581174 -0.319450E-07  0.110E-03    1.96      17.2  T
     SCC iter.                  ...        0 min,  0.011 sec
     gradient                   ...        0 min,  0.018 sec
 * total energy  :   -52.7879346 Eh     change       -0.2010722E-02 Eh
   gradient norm :     0.0132557 Eh/α   predicted    -0.1765829E-02 ( -12.18%)
   displ. norm   :     0.2301944 α      lambda       -0.7948700E-03
   maximum displ.:     0.1147059 α      in ANC's #7, #5, #10, ...

........................................................................
.............................. CYCLE    4 ..............................
........................................................................
   1    -53.3581677 -0.533582E+02  0.137E-01    1.98       0.0  T
   2    -53.3581773 -0.959336E-05  0.807E-02    2.01       1.0  T
   3    -53.3581706  0.668821E-05  0.241E-02    2.02       1.0  T
   4    -53.3581788 -0.827534E-05  0.102E-02    2.02       1.8  T
   5    -53.3581800 -0.119255E-05  0.362E-03    2.02       5.2  T
   6    -53.3581802 -0.109244E-06  0.152E-03    2.02      12.4  T
   7    -53.3581802 -0.302429E-07  0.770E-04    2.02      24.5  T
     SCC iter.                  ...        0 min,  0.010 sec
     gradient                   ...        0 min,  0.018 sec
 * total energy  :   -52.7884720 Eh     change       -0.5373538E-03 Eh
   gradient norm :     0.0064641 Eh/α   predicted    -0.4184958E-03 ( -22.12%)
   displ. norm   :     0.2191587 α      lambda       -0.3804193E-03
   maximum displ.:     0.1155634 α      in ANC's #5, #7, #10, ...

........................................................................
.............................. CYCLE    5 ..............................
........................................................................
   1    -53.3559914 -0.533560E+02  0.138E-01    2.01       0.0  T
   2    -53.3560023 -0.108466E-04  0.791E-02    2.04       1.0  T
   3    -53.3559961  0.617126E-05  0.242E-02    2.04       1.0  T
   4    -53.3560039 -0.781130E-05  0.117E-02    2.05       1.6  T
   5    -53.3560055 -0.158487E-05  0.416E-03    2.04       4.5  T
   6    -53.3560057 -0.175385E-06  0.152E-03    2.04      12.4  T
   7    -53.3560057 -0.201333E-07  0.763E-04    2.04      24.8  T
     SCC iter.                  ...        0 min,  0.011 sec
     gradient                   ...        0 min,  0.018 sec
 * total energy  :   -52.7886790 Eh     change       -0.2070373E-03 Eh
   gradient norm :     0.0055772 Eh/α   predicted    -0.1993488E-03 (  -3.71%)
   displ. norm   :     0.1103750 α      lambda       -0.1314535E-03
   maximum displ.:     0.0604034 α      in ANC's #5, #3, #10, ...

........................................................................
.............................. CYCLE    6 ..............................
........................................................................
   1    -53.3557352 -0.533557E+02  0.686E-02    2.04       0.0  T
   2    -53.3557373 -0.208688E-05  0.402E-02    2.05       1.0  T
   3    -53.3557349  0.240137E-05  0.127E-02    2.06       1.5  T
   4    -53.3557382 -0.324660E-05  0.481E-03    2.06       3.9  T
   5    -53.3557383 -0.179117E-06  0.215E-03    2.05       8.8  T
   6    -53.3557384 -0.686998E-07  0.853E-04    2.05      22.1  T
     SCC iter.                  ...        0 min,  0.009 sec
     gradient                   ...        0 min,  0.019 sec
 * total energy  :   -52.7887514 Eh     change       -0.7236615E-04 Eh
   gradient norm :     0.0042917 Eh/α   predicted    -0.6652796E-04 (  -8.07%)
   displ. norm   :     0.0680752 α      lambda       -0.5663611E-04
   maximum displ.:     0.0355639 α      in ANC's #5, #3, #1, ...

........................................................................
.............................. CYCLE    7 ..............................
........................................................................
   1    -53.3564700 -0.533565E+02  0.413E-02    2.06       0.0  T
   2    -53.3564708 -0.709671E-06  0.251E-02    2.06       1.0  T
   3    -53.3564693  0.144422E-05  0.840E-03    2.06       2.2  T
   4    -53.3564712 -0.191268E-05  0.213E-03    2.06       8.9  T
   5    -53.3564712 -0.257711E-07  0.107E-03    2.06      17.7  T
     SCC iter.                  ...        0 min,  0.008 sec
     gradient                   ...        0 min,  0.018 sec
 * total energy  :   -52.7887930 Eh     change       -0.4158099E-04 Eh
   gradient norm :     0.0022802 Eh/α   predicted    -0.2845036E-04 ( -31.58%)
   displ. norm   :     0.0892259 α      lambda       -0.4278200E-04
   maximum displ.:     0.0474373 α      in ANC's #1, #3, #5, ...

........................................................................
.............................. CYCLE    8 ..............................
........................................................................
   1    -53.3571576 -0.533572E+02  0.539E-02    2.05       0.0  T
   2    -53.3571588 -0.120001E-05  0.326E-02    2.06       1.0  T
   3    -53.3571582  0.589339E-06  0.765E-03    2.05       2.5  T
   4    -53.3571595 -0.126663E-05  0.265E-03    2.06       7.1  T
   5    -53.3571595 -0.583377E-07  0.841E-04    2.06      22.5  T
   6    -53.3571595 -0.497217E-08  0.424E-04    2.06      44.6  T
     SCC iter.                  ...        0 min,  0.009 sec
     gradient                   ...        0 min,  0.020 sec
 * total energy  :   -52.7888231 Eh     change       -0.3016230E-04 Eh
   gradient norm :     0.0022663 Eh/α   predicted    -0.2156398E-04 ( -28.51%)
   displ. norm   :     0.0912241 α      lambda       -0.2936570E-04
   maximum displ.:     0.0518819 α      in ANC's #1, #3, #5, ...

........................................................................
.............................. CYCLE    9 ..............................
........................................................................
   1    -53.3575730 -0.533576E+02  0.523E-02    2.06       0.0  T
   2    -53.3575741 -0.107453E-05  0.319E-02    2.06       1.0  T
   3    -53.3575745 -0.406432E-06  0.384E-03    2.06       4.9  T
   4    -53.3575747 -0.180931E-06  0.207E-03    2.06       9.1  T
   5    -53.3575747 -0.582851E-07  0.627E-04    2.06      30.1  T
   6    -53.3575747 -0.410355E-08  0.293E-04    2.06      64.6  T
     SCC iter.                  ...        0 min,  0.009 sec
     gradient                   ...        0 min,  0.020 sec
 * total energy  :   -52.7888475 Eh     change       -0.2437891E-04 Eh
   gradient norm :     0.0032021 Eh/α   predicted    -0.1480620E-04 ( -39.27%)
   displ. norm   :     0.1768389 α      lambda       -0.5716599E-04
   maximum displ.:     0.1016054 α      in ANC's #1, #3, #5, ...

........................................................................
.............................. CYCLE   10 ..............................
........................................................................
   1    -53.3577796 -0.533578E+02  0.101E-01    2.06       0.0  T
   2    -53.3577836 -0.395484E-05  0.620E-02    2.07       1.0  T
   3    -53.3577858 -0.219707E-05  0.546E-03    2.07       3.5  T
   4    -53.3577858  0.117389E-07  0.334E-03    2.07       5.7  T
   5    -53.3577860 -0.224174E-06  0.948E-04    2.07      19.9  T
   6    -53.3577860 -0.104432E-07  0.465E-04    2.07      40.6  T
     SCC iter.                  ...        0 min,  0.009 sec
     gradient                   ...        0 min,  0.019 sec
 * total energy  :   -52.7888936 Eh     change       -0.4603089E-04 Eh
   gradient norm :     0.0047104 Eh/α   predicted    -0.2947746E-04 ( -35.96%)
   displ. norm   :     0.2535131 α      lambda       -0.8358489E-04
   maximum displ.:     0.1523532 α      in ANC's #1, #3, #5, ...

........................................................................
.............................. CYCLE   11 ..............................
........................................................................
   1    -53.3575915 -0.533576E+02  0.141E-01    2.07       0.0  T
   2    -53.3575990 -0.749841E-05  0.866E-02    2.07       1.0  T
   3    -53.3576033 -0.431281E-05  0.662E-03    2.07       2.9  T
   4    -53.3576034 -0.724995E-07  0.377E-03    2.07       5.0  T
   5    -53.3576036 -0.182298E-06  0.151E-03    2.07      12.5  T
   6    -53.3576036 -0.394465E-07  0.550E-04    2.07      34.4  T
     SCC iter.                  ...        0 min,  0.009 sec
     gradient                   ...        0 min,  0.018 sec
 * total energy  :   -52.7889514 Eh     change       -0.5781751E-04 Eh
   gradient norm :     0.0062237 Eh/α   predicted    -0.4448354E-04 ( -23.06%)
   displ. norm   :     0.1632456 α      lambda       -0.8096841E-04
   maximum displ.:     0.1058987 α      in ANC's #1, #3, #11, ...

........................................................................
.............................. CYCLE   12 ..............................
........................................................................
   1    -53.3577840 -0.533578E+02  0.866E-02    2.08       0.0  T
   2    -53.3577866 -0.255425E-05  0.532E-02    2.08       1.0  T
   3    -53.3577878 -0.119039E-05  0.478E-03    2.08       4.0  T
   4    -53.3577881 -0.303043E-06  0.243E-03    2.08       7.8  T
   5    -53.3577881 -0.383167E-07  0.118E-03    2.08      16.1  T
     SCC iter.                  ...        0 min,  0.008 sec
     gradient                   ...        0 min,  0.019 sec
 * total energy  :   -52.7890055 Eh     change       -0.5411386E-04 Eh
   gradient norm :     0.0039320 Eh/α   predicted    -0.4156502E-04 ( -23.19%)
   displ. norm   :     0.2047468 α      lambda       -0.5847993E-04
   maximum displ.:     0.1359106 α      in ANC's #1, #3, #9, ...

........................................................................
.............................. CYCLE   13 ..............................
........................................................................
   1    -53.3564582 -0.533565E+02  0.117E-01    2.07       0.0  T
   2    -53.3564637 -0.552133E-05  0.720E-02    2.07       1.0  T
   3    -53.3564655 -0.177022E-05  0.855E-03    2.07       2.2  T
   4    -53.3564667 -0.124885E-05  0.368E-03    2.07       5.1  T
   5    -53.3564669 -0.130441E-06  0.182E-03    2.07      10.4  T
   6    -53.3564669 -0.441863E-07  0.639E-04    2.07      29.6  T
   7    -53.3564669 -0.361725E-08  0.345E-04    2.07      54.7  T
     SCC iter.                  ...        0 min,  0.010 sec
     gradient                   ...        0 min,  0.020 sec
 * total energy  :   -52.7890350 Eh     change       -0.2955728E-04 Eh
   gradient norm :     0.0040161 Eh/α   predicted    -0.3046629E-04 (   3.08%)
   displ. norm   :     0.0753171 α      lambda       -0.6633734E-04
   maximum displ.:     0.0382609 α      in ANC's #4, #1, #5, ...

........................................................................
.............................. CYCLE   14 ..............................
........................................................................
   1    -53.3569554 -0.533570E+02  0.529E-02    2.07       0.0  T
   2    -53.3569574 -0.201710E-05  0.309E-02    2.06       1.0  T
   3    -53.3569564  0.964524E-06  0.951E-03    2.06       2.0  T
   4    -53.3569579 -0.142964E-05  0.405E-03    2.06       4.7  T
   5    -53.3569580 -0.156701E-06  0.194E-03    2.06       9.7  T
   6    -53.3569581 -0.363414E-07  0.658E-04    2.06      28.7  T
     SCC iter.                  ...        0 min,  0.009 sec
     gradient                   ...        0 min,  0.018 sec
 * total energy  :   -52.7890631 Eh     change       -0.2809841E-04 Eh
   gradient norm :     0.0039494 Eh/α   predicted    -0.3335790E-04 (  18.72%)
   displ. norm   :     0.0768431 α      lambda       -0.2959115E-04
   maximum displ.:     0.0519121 α      in ANC's #1, #9, #11, ...

........................................................................
.............................. CYCLE   15 ..............................
........................................................................
   1    -53.3570109 -0.533570E+02  0.492E-02    2.06       0.0  T
   2    -53.3570119 -0.980899E-06  0.302E-02    2.06       1.0  T
   3    -53.3570116  0.246780E-06  0.593E-03    2.06       3.2  T
   4    -53.3570124 -0.756638E-06  0.193E-03    2.06       9.8  T
   5    -53.3570124 -0.337763E-07  0.849E-04    2.06      22.3  T
   6    -53.3570124 -0.538051E-08  0.372E-04    2.06      50.8  T
     SCC iter.                  ...        0 min,  0.009 sec
     gradient                   ...        0 min,  0.019 sec
 * total energy  :   -52.7890883 Eh     change       -0.2512091E-04 Eh
   gradient norm :     0.0026972 Eh/α   predicted    -0.1488500E-04 ( -40.75%)
   displ. norm   :     0.2147564 α      lambda       -0.7300526E-04
   maximum displ.:     0.1332086 α      in ANC's #1, #9, #11, ...

........................................................................
.............................. CYCLE   16 ..............................
........................................................................
   1    -53.3571187 -0.533571E+02  0.139E-01    2.05       0.0  T
   2    -53.3571258 -0.709240E-05  0.843E-02    2.04       1.0  T
   3    -53.3571216  0.417350E-05  0.200E-02    2.03       1.0  T
   4    -53.3571294 -0.782783E-05  0.718E-03    2.03       2.6  T
   5    -53.3571298 -0.393641E-06  0.241E-03    2.03       7.9  T
   6    -53.3571299 -0.512591E-07  0.115E-03    2.03      16.4  T
   7    -53.3571299 -0.157197E-07  0.603E-04    2.03      31.3  T
   8    -53.3571299 -0.301494E-08  0.253E-04    2.03      74.7  T
     SCC iter.                  ...        0 min,  0.012 sec
     gradient                   ...        0 min,  0.020 sec
 * total energy  :   -52.7891299 Eh     change       -0.4165949E-04 Eh
   gradient norm :     0.0032165 Eh/α   predicted    -0.3818682E-04 (  -8.34%)
   displ. norm   :     0.0770978 α      lambda       -0.3075656E-04
   maximum displ.:     0.0506825 α      in ANC's #2, #4, #3, ...

........................................................................
.............................. CYCLE   17 ..............................
........................................................................
   1    -53.3578853 -0.533579E+02  0.442E-02    2.04       0.0  T
   2    -53.3578864 -0.110955E-05  0.254E-02    2.03       1.0  T
   3    -53.3578860  0.404077E-06  0.663E-03    2.03       2.9  T
   4    -53.3578866 -0.562481E-06  0.325E-03    2.03       5.8  T
   5    -53.3578867 -0.119416E-06  0.130E-03    2.03      14.6  T
   6    -53.3578867 -0.171209E-07  0.413E-04    2.03      45.7  T
   7    -53.3578867 -0.120178E-08  0.242E-04    2.03      77.9  T
     SCC iter.                  ...        0 min,  0.011 sec
     gradient                   ...        0 min,  0.020 sec
 * total energy  :   -52.7891498 Eh     change       -0.1992527E-04 Eh
   gradient norm :     0.0020745 Eh/α   predicted    -0.1547068E-04 ( -22.36%)
   displ. norm   :     0.1116358 α      lambda       -0.2347582E-04
   maximum displ.:     0.0625474 α      in ANC's #1, #2, #9, ...

........................................................................
.............................. CYCLE   18 ..............................
........................................................................
   1    -53.3575826 -0.533576E+02  0.709E-02    2.02       0.0  T
   2    -53.3575840 -0.144692E-05  0.425E-02    2.02       1.0  T
   3    -53.3575836  0.462836E-06  0.883E-03    2.02       2.1  T
   4    -53.3575848 -0.122363E-05  0.403E-03    2.02       4.7  T
   5    -53.3575849 -0.135880E-06  0.123E-03    2.02      15.4  T
   6    -53.3575849 -0.198782E-07  0.538E-04    2.02      35.1  T
   7    -53.3575849 -0.735568E-09  0.289E-04    2.02      65.4  T
     SCC iter.                  ...        0 min,  0.011 sec
     gradient                   ...        0 min,  0.020 sec
 * total energy  :   -52.7891690 Eh     change       -0.1916329E-04 Eh
   gradient norm :     0.0014778 Eh/α   predicted    -0.1188669E-04 ( -37.97%)
   displ. norm   :     0.2087105 α      lambda       -0.2972421E-04
   maximum displ.:     0.1150054 α      in ANC's #1, #2, #4, ...

........................................................................
.............................. CYCLE   19 ..............................
........................................................................
   1    -53.3571504 -0.533572E+02  0.123E-01    2.01       0.0  T
   2    -53.3571546 -0.428036E-05  0.740E-02    2.01       1.0  T
   3    -53.3571547 -0.320211E-07  0.129E-02    2.01       1.5  T
   4    -53.3571568 -0.209116E-05  0.669E-03    2.01       2.8  T
   5    -53.3571573 -0.514723E-06  0.159E-03    2.01      11.9  T
   6    -53.3571573 -0.219440E-07  0.833E-04    2.01      22.7  T
   7    -53.3571573 -0.986574E-09  0.442E-04    2.01      42.7  T
     SCC iter.                  ...        0 min,  0.011 sec
     gradient                   ...        0 min,  0.020 sec
 * total energy  :   -52.7891988 Eh     change       -0.2982301E-04 Eh
   gradient norm :     0.0022538 Eh/α   predicted    -0.1515119E-04 ( -49.20%)
   displ. norm   :     0.1387798 α      lambda        0.8772186E-05
   maximum displ.:     0.0760088 α      in ANC's #1, #2, #4, ...

........................................................................
.............................. CYCLE   20 ..............................
........................................................................
   1    -53.3564753 -0.533565E+02  0.819E-02    2.00       0.0  T
   2    -53.3564773 -0.196452E-05  0.494E-02    2.00       1.0  T
   3    -53.3564773 -0.378885E-07  0.858E-03    2.00       2.2  T
   4    -53.3564782 -0.904253E-06  0.446E-03    2.00       4.2  T
   5    -53.3564784 -0.227028E-06  0.123E-03    2.00      15.4  T
   6    -53.3564785 -0.169575E-07  0.555E-04    2.00      34.0  T
   7    -53.3564785  0.444587E-10  0.316E-04    2.00      59.9  T
     SCC iter.                  ...        0 min,  0.011 sec
     gradient                   ...        0 min,  0.019 sec
 * total energy  :   -52.7891998 Eh     change       -0.9511822E-06 Eh
   gradient norm :     0.0043411 Eh/α   predicted     0.4467920E-05 (-569.72%)
   displ. norm   :     0.0473407 α      lambda       -0.2267921E-04
   maximum displ.:     0.0243485 α      in ANC's #1, #9, #2, ...
 * RMSD in coord.:     0.3919501 α      energy gain  -0.1077721E-01 Eh

generating ANC from model Hessian ...
Using Lindh-Hessian (1995)
 Shifting diagonal of input Hessian by   4.104118332545313E-003
 Lowest  eigenvalues of input Hessian
   -0.000000   -0.000000   -0.000000    0.000000    0.000000    0.000000
    0.005000    0.006334    0.007018    0.008014    0.009513    0.010450
    0.011974    0.014935    0.017592    0.020144    0.021942    0.022150
 Highest eigenvalues
    1.706743    1.732304    1.777635    1.861030    2.031778    2.190036
 

........................................................................
.............................. CYCLE   21 ..............................
........................................................................
   1    -53.3574351 -0.533574E+02  0.276E-02    2.01       0.0  T
   2    -53.3574355 -0.459475E-06  0.169E-02    2.01       1.1  T
   3    -53.3574355 -0.172453E-07  0.285E-03    2.01       6.6  T
   4    -53.3574357 -0.123230E-06  0.107E-03    2.01      17.7  T
   5    -53.3574357 -0.834966E-08  0.663E-04    2.01      28.5  T
   6    -53.3574357 -0.545445E-08  0.210E-04    2.01      89.9  T
     SCC iter.                  ...        0 min,  0.009 sec
     gradient                   ...        0 min,  0.019 sec
 * total energy  :   -52.7892142 Eh     change       -0.1445458E-04 Eh
   gradient norm :     0.0023879 Eh/α   predicted     0.0000000E+00 (-100.00%)
   displ. norm   :     0.0330252 α      lambda       -0.1701929E-04
   maximum displ.:     0.0272594 α      in ANC's #2, #4, #5, ...

........................................................................
.............................. CYCLE   22 ..............................
........................................................................
   1    -53.3576740 -0.533577E+02  0.187E-02    2.01       0.0  T
   2    -53.3576741 -0.942741E-07  0.107E-02    2.01       1.8  T
   3    -53.3576738  0.344381E-06  0.458E-03    2.01       4.1  T
   4    -53.3576742 -0.405218E-06  0.118E-03    2.01      16.1  T
   5    -53.3576742 -0.252852E-08  0.494E-04    2.01      38.2  T
   6    -53.3576742 -0.417742E-08  0.159E-04    2.01     118.9  T
     SCC iter.                  ...        0 min,  0.009 sec
     gradient                   ...        0 min,  0.020 sec
 * total energy  :   -52.7892262 Eh     change       -0.1199687E-04 Eh
   gradient norm :     0.0009546 Eh/α   predicted    -0.8518931E-05 ( -28.99%)
   displ. norm   :     0.0497330 α      lambda        0.5468355E-06
   maximum displ.:     0.0408894 α      in ANC's #2, #4, #5, ...

........................................................................
.............................. CYCLE   23 ..............................
........................................................................
   1    -53.3579760 -0.533580E+02  0.282E-02    2.01       0.0  T
   2    -53.3579762 -0.215354E-06  0.161E-02    2.01       1.2  T
   3    -53.3579755  0.726468E-06  0.671E-03    2.01       2.8  T
   4    -53.3579763 -0.857888E-06  0.179E-03    2.01      10.6  T
   5    -53.3579763 -0.650149E-08  0.759E-04    2.01      24.9  T
   6    -53.3579763 -0.983039E-08  0.235E-04    2.01      80.3  T
     SCC iter.                  ...        0 min,  0.009 sec
     gradient                   ...        0 min,  0.020 sec
 * total energy  :   -52.7892255 Eh     change        0.7442019E-06 Eh
   gradient norm :     0.0023459 Eh/α   predicted     0.2720657E-06 ( -63.44%)
   displ. norm   :     0.0144739 α      lambda       -0.1339919E-04
   maximum displ.:     0.0078873 α      in ANC's #17, #2, #4, ...

........................................................................
.............................. CYCLE   24 ..............................
........................................................................
   1    -53.3579426 -0.533579E+02  0.102E-02    2.01       0.0  T
   2    -53.3579426 -0.125098E-07  0.608E-03    2.01       3.1  T
   3    -53.3579425  0.654718E-07  0.177E-03    2.01      10.7  T
   4    -53.3579426 -0.740399E-07  0.368E-04    2.01      51.4  T
   5    -53.3579426 -0.417742E-09  0.186E-04    2.01     101.9  T
     SCC iter.                  ...        0 min,  0.008 sec
     gradient                   ...        0 min,  0.020 sec
 * total energy  :   -52.7892341 Eh     change       -0.8593431E-05 Eh
   gradient norm :     0.0017430 Eh/α   predicted    -0.6704236E-05 ( -21.98%)
   displ. norm   :     0.0342982 α      lambda       -0.9205474E-05
   maximum displ.:     0.0216881 α      in ANC's #2, #4, #1, ...

........................................................................
.............................. CYCLE   25 ..............................
........................................................................
   1    -53.3576257 -0.533576E+02  0.188E-02    2.00       0.0  T
   2    -53.3576258 -0.126726E-06  0.108E-02    2.01       1.8  T
   3    -53.3576256  0.183807E-06  0.343E-03    2.01       5.5  T
   4    -53.3576258 -0.222124E-06  0.126E-03    2.01      14.9  T
   5    -53.3576259 -0.969589E-08  0.614E-04    2.01      30.8  T
   6    -53.3576259 -0.560136E-08  0.141E-04    2.01     134.4  T
     SCC iter.                  ...        0 min,  0.009 sec
     gradient                   ...        0 min,  0.020 sec
 * total energy  :   -52.7892405 Eh     change       -0.6405255E-05 Eh
   gradient norm :     0.0009871 Eh/α   predicted    -0.4619752E-05 ( -27.88%)
   displ. norm   :     0.0329895 α      lambda       -0.4184063E-05
   maximum displ.:     0.0251467 α      in ANC's #2, #4, #1, ...

........................................................................
.............................. CYCLE   26 ..............................
........................................................................
   1    -53.3576241 -0.533576E+02  0.174E-02    2.01       0.0  T
   2    -53.3576241 -0.465483E-07  0.100E-02    2.01       1.9  T
   3    -53.3576241 -0.541384E-08  0.135E-03    2.01      14.0  T
   4    -53.3576241 -0.397849E-08  0.795E-04    2.01      23.8  T
   5    -53.3576242 -0.898397E-08  0.198E-04    2.01      95.6  T
     SCC iter.                  ...        0 min,  0.008 sec
     gradient                   ...        0 min,  0.020 sec
 * total energy  :   -52.7892459 Eh     change       -0.5365823E-05 Eh
   gradient norm :     0.0006933 Eh/α   predicted    -0.2096098E-05 ( -60.94%)
   displ. norm   :     0.0610547 α      lambda       -0.6314905E-05
   maximum displ.:     0.0456741 α      in ANC's #2, #4, #1, ...

........................................................................
.............................. CYCLE   27 ..............................
........................................................................
   1    -53.3577202 -0.533577E+02  0.317E-02    2.01       0.0  T
   2    -53.3577204 -0.157578E-06  0.181E-02    2.01       1.0  T
   3    -53.3577204  0.149718E-07  0.286E-03    2.01       6.6  T
   4    -53.3577204 -0.218508E-07  0.198E-03    2.01       9.5  T
   5    -53.3577204 -0.604921E-07  0.330E-04    2.01      57.3  T
   6    -53.3577204 -0.135666E-08  0.173E-04    2.01     109.2  T
     SCC iter.                  ...        0 min,  0.009 sec
     gradient                   ...        0 min,  0.020 sec
 * total energy  :   -52.7892533 Eh     change       -0.7409357E-05 Eh
   gradient norm :     0.0003967 Eh/α   predicted    -0.3164631E-05 ( -57.29%)
   displ. norm   :     0.0637251 α      lambda       -0.4709760E-05
   maximum displ.:     0.0475075 α      in ANC's #2, #4, #1, ...

........................................................................
.............................. CYCLE   28 ..............................
........................................................................
   1    -53.3577315 -0.533577E+02  0.344E-02    2.01       0.0  T
   2    -53.3577317 -0.220939E-06  0.196E-02    2.01       1.0  T
   3    -53.3577316  0.749918E-07  0.383E-03    2.01       4.9  T
   4    -53.3577318 -0.122555E-06  0.218E-03    2.01       8.7  T
   5    -53.3577318 -0.510890E-07  0.411E-04    2.01      45.9  T
   6    -53.3577318 -0.308185E-08  0.206E-04    2.01      91.8  T
     SCC iter.                  ...        0 min,  0.010 sec
     gradient                   ...        0 min,  0.020 sec
 * total energy  :   -52.7892591 Eh     change       -0.5828515E-05 Eh
   gradient norm :     0.0004127 Eh/α   predicted    -0.2362572E-05 ( -59.47%)
   displ. norm   :     0.0640046 α      lambda       -0.2489134E-05
   maximum displ.:     0.0475084 α      in ANC's #2, #4, #1, ...

........................................................................
.............................. CYCLE   29 ..............................
........................................................................
   1    -53.3576557 -0.533577E+02  0.345E-02    2.01       0.0  T
   2    -53.3576560 -0.225104E-06  0.196E-02    2.01       1.0  T
   3    -53.3576559  0.553166E-07  0.373E-03    2.01       5.1  T
   4    -53.3576560 -0.972172E-07  0.221E-03    2.01       8.5  T
   5    -53.3576561 -0.567602E-07  0.399E-04    2.01      47.4  T
   6    -53.3576561 -0.273319E-08  0.206E-04    2.01      91.7  T
     SCC iter.                  ...        0 min,  0.009 sec
     gradient                   ...        0 min,  0.020 sec
 * total energy  :   -52.7892629 Eh     change       -0.3761375E-05 Eh
   gradient norm :     0.0006533 Eh/α   predicted    -0.1248348E-05 ( -66.81%)
   displ. norm   :     0.0635211 α      lambda       -0.1326449E-06
   maximum displ.:     0.0475084 α      in ANC's #2, #4, #1, ...

   *** GEOMETRY OPTIMIZATION CONVERGED AFTER 29 ITERATIONS ***

------------------------------------------------------------------------
 total energy gain   :        -0.0108403 Eh       -6.8024 kcal/mol
 total RMSD          :         0.4081575 a0        0.2160 Å
 total power (kW/mol):        -0.9814192 (step)  -22.1776 (real)
------------------------------------------------------------------------

 ANCopt (total)                0 d,  0 h,  0 min,  1.283 sec
 optimizer setup                ...        0 min,  0.000 sec (  0.012%)
 model hessian                  ...        0 min,  0.020 sec (  1.543%)
 ANC generation                 ...        0 min,  0.002 sec (  0.129%)
 coordinate transformation      ...        0 min,  0.001 sec (  0.049%)
 single point calculation       ...        0 min,  1.250 sec ( 97.414%)
 optimization log               ...        0 min,  0.003 sec (  0.254%)
 hessian update                 ...        0 min,  0.000 sec (  0.033%)
 rational function              ...        0 min,  0.005 sec (  0.424%)

================
 final structure:
================
$coord
    2.36968928817019   -2.50899983046736   -0.31768092563553      C 
    4.78721308040818   -0.36572194395755   -0.34844677524467      S 
    2.69381048259500    2.11993905692972    0.18635443871145      C 
    0.24747724009753    1.26322900255924    0.35338350120321      C 
    0.07536223892377   -1.39708010673728    0.06554748531127      C 
   -2.41570787993031   -2.79782761091340    0.17457963530042      C 
   -3.00462928737455   -3.46178625999697   -2.52736586656734      C 
   -4.37683886885248   -2.35051842857103   -3.94194312237478      O 
   -1.57350640275786   -5.81796358473097   -3.59118300743795      C 
   -0.71123827707334   -7.38807182643990   -1.79378914285338      F 
   -3.09313969997616   -7.17982836694364   -5.07434607092446      F 
    0.42660911870256   -5.13065617461176   -4.98458688816388      F 
   -4.48298913246590   -1.15278576563588    1.35868279468374      C 
   -4.46102292411995    1.52431526440601    0.28860127790709      C 
   -1.99981704688575    2.87460970774571    0.94609295573680      C 
    3.57946600256361    4.68026643147961    0.41966742783933      C 
    5.98730295778025    5.38229580220289    0.26579739226414      C 
    2.79869296076330   -4.47384450296595   -0.55271892179234      H 
   -2.17209208497330   -4.54156962034627    1.26027098647353      H 
   -4.17098669605800   -1.08372660740037    3.39767437756619      H 
   -6.31696748363936   -2.02994300135097    1.01301820919153      H 
   -6.05012450712168    2.58290024867439    1.06652715272042      H 
   -4.69148949130967    1.44740987908420   -1.75555348089696      H 
   -1.97160789756807    3.31585205108979    2.96917479794796      H 
   -1.88846257362189    4.66086128520379   -0.07910650940220      H 
    2.12210819434131    6.07714650386449    0.74527338342988      H 
    7.47280781339708    4.02597131007553   -0.05075085896184      H 
    6.54490208239914    7.32764347499302    0.45027116959324      H 
$end
           -------------------------------------------------
          |                Final Singlepoint                |
           -------------------------------------------------

          ...................................................
          :                      SETUP                      :
          :.................................................:
          :  # basis functions                  85          :
          :  # atomic orbitals                  84          :
          :  # shells                           46          :
          :  # electrons                        92          :
          :  max. iterations                   250          :
          :  Hamiltonian                  GFN2-xTB          :
          :  restarted?                      false          :
          :  GBSA solvation                  false          :
          :  PC potential                    false          :
          :  electronic temp.          300.0000000     K    :
          :  accuracy                    1.0000000          :
          :  -> integral cutoff          0.2500000E+02      :
          :  -> integral neglect         0.1000000E-07      :
          :  -> SCF convergence          0.1000000E-05 Eh   :
          :  -> wf. convergence          0.1000000E-03 e    :
          :  Broyden damping             0.4000000          :
          ...................................................

 iter      E             dE          RMSdq      gap      omega  full diag
   1    -53.3576561 -0.533577E+02  0.867E-05    2.01       0.0  T
   2    -53.3576561 -0.217781E-10  0.462E-05    2.01     409.4  T
   3    -53.3576561 -0.487290E-10  0.360E-05    2.01     524.7  T

   *** convergence criteria satisfied after 3 iterations ***

         #    Occupation            Energy/Eh            Energy/eV
      -------------------------------------------------------------
         1        2.0000           -0.8944280             -24.3386
       ...           ...                  ...                  ...
        40        2.0000           -0.4559728             -12.4077
        41        2.0000           -0.4488590             -12.2141
        42        2.0000           -0.4477296             -12.1833
        43        2.0000           -0.4406712             -11.9913
        44        2.0000           -0.4321663             -11.7598
        45        2.0000           -0.4021924             -10.9442
        46        2.0000           -0.3855169             -10.4905 (HOMO)
        47                         -0.3117449              -8.4830 (LUMO)
        48                         -0.2746300              -7.4731
        49                         -0.2117010              -5.7607
        50                         -0.2076734              -5.6511
        51                         -0.1586459              -4.3170
       ...                                ...                  ...
        84                          0.6603236              17.9683
      -------------------------------------------------------------
                  HL-Gap            0.0737720 Eh            2.0074 eV
             Fermi-level           -0.3486309 Eh           -9.4867 eV

 SCC (total)                   0 d,  0 h,  0 min,  0.040 sec
 SCC setup                      ...        0 min,  0.000 sec (  0.628%)
 Dispersion                     ...        0 min,  0.000 sec (  0.658%)
 integral evaluation            ...        0 min,  0.014 sec ( 34.414%)
 zeroth order Hamiltonian       ...        0 min,  0.000 sec (  0.565%)
 iterations                     ...        0 min,  0.005 sec ( 13.502%)
 molecular gradient             ...        0 min,  0.020 sec ( 49.038%)
 printout                       ...        0 min,  0.000 sec (  1.060%)

         :::::::::::::::::::::::::::::::::::::::::::::::::::::
         ::                     SUMMARY                     ::
         :::::::::::::::::::::::::::::::::::::::::::::::::::::
         :: total energy             -52.789262873911 Eh    ::
         :: gradient norm              0.000652782671 Eh/a0 ::
         :: HOMO-LUMO gap              2.007438966660 eV    ::
         ::.................................................::
         :: SCC energy               -53.357656074982 Eh    ::
         :: -> isotropic ES            0.060665014019 Eh    ::
         :: -> anisotropic ES          0.002369412647 Eh    ::
         :: -> anisotropic XC         -0.003947010419 Eh    ::
         :: -> dispersion             -0.030906526592 Eh    ::
         :: repulsion energy           0.568125723962 Eh    ::
         :: add. restraining           0.000000000000 Eh    ::
         :::::::::::::::::::::::::::::::::::::::::::::::::::::

           -------------------------------------------------
          |                Property Printout                |
           -------------------------------------------------

    * Orbital Energies and Occupations

         #    Occupation            Energy/Eh            Energy/eV
      -------------------------------------------------------------
         1        2.0000           -0.8944280             -24.3386
       ...           ...                  ...                  ...
        34        2.0000           -0.4960823             -13.4991
        35        2.0000           -0.4880926             -13.2817
        36        2.0000           -0.4871293             -13.2555
        37        2.0000           -0.4792310             -13.0405
        38        2.0000           -0.4662683             -12.6878
        39        2.0000           -0.4624115             -12.5829
        40        2.0000           -0.4559728             -12.4077
        41        2.0000           -0.4488590             -12.2141
        42        2.0000           -0.4477296             -12.1833
        43        2.0000           -0.4406712             -11.9913
        44        2.0000           -0.4321663             -11.7598
        45        2.0000           -0.4021924             -10.9442
        46        2.0000           -0.3855169             -10.4905 (HOMO)
        47                         -0.3117449              -8.4830 (LUMO)
        48                         -0.2746300              -7.4731
        49                         -0.2117010              -5.7607
        50                         -0.2076734              -5.6511
        51                         -0.1586459              -4.3170
        52                         -0.1273068              -3.4642
        53                         -0.0281853              -0.7670
        54                         -0.0136389              -0.3711
        55                          0.0233907               0.6365
        56                          0.0266199               0.7244
        57                          0.0317238               0.8632
       ...                                ...                  ...
        84                          0.6603236              17.9683
      -------------------------------------------------------------
                  HL-Gap            0.0737720 Eh            2.0074 eV
             Fermi-level           -0.3486309 Eh           -9.4867 eV

     #   Z        covCN         q      C6AA      α(0)
     1   6 C      2.935    -0.037    28.918     8.819
     2  16 S      2.315    -0.005   141.245    20.003
     3   6 C      2.993     0.011    27.763     8.643
     4   6 C      3.149    -0.010    27.982     8.653
     5   6 C      3.180    -0.009    27.809     8.609
     6   6 C      3.857    -0.031    21.093     6.532
     7   6 C      2.826     0.216    23.436     7.933
     8   8 O      0.857    -0.282    19.463     5.915
     9   6 C      3.324     0.462    17.771     6.702
    10   9 F      0.790    -0.205    11.283     3.968
    11   9 F      0.790    -0.184    11.073     3.931
    12   9 F      0.790    -0.192    11.148     3.944
    13   6 C      3.808    -0.053    21.520     6.604
    14   6 C      3.806    -0.061    21.672     6.627
    15   6 C      3.807    -0.056    21.573     6.612
    16   6 C      2.918    -0.031    28.776     8.797
    17   6 C      2.841    -0.086    30.150     8.999
    18   1 H      0.926     0.054     2.273     2.358
    19   1 H      0.924     0.067     2.114     2.274
    20   1 H      0.924     0.049     2.334     2.389
    21   1 H      0.924     0.046     2.371     2.408
    22   1 H      0.924     0.041     2.440     2.443
    23   1 H      0.925     0.061     2.188     2.313
    24   1 H      0.924     0.047     2.357     2.401
    25   1 H      0.924     0.047     2.364     2.404
    26   1 H      0.925     0.044     2.397     2.421
    27   1 H      0.926     0.051     2.304     2.374
    28   1 H      0.926     0.046     2.371     2.408

 Mol. C6AA /au·bohr⁶  :      10452.844839
 Mol. C8AA /au·bohr⁸  :     271706.901130
 Mol. α(0) /au        :        157.481248


Wiberg/Mayer (AO) data.
largest (>0.10) Wiberg bond orders for each atom
          total WBO             WBO to atom ...
     1  C   3.954        C    5 1.561    S    2 1.214    H   18 0.969
     2  S   2.631        C    1 1.214    C    3 1.127
     3  C   3.948        C    4 1.501    C   16 1.135    S    2 1.127
     4  C   3.985        C    3 1.501    C    5 1.244    C   15 1.011
     5  C   3.974        C    1 1.561    C    4 1.244    C    6 0.940
     6  C   3.987        C   13 0.986    C    7 0.981    H   19 0.945    C    5 0.940
     7  C   3.920        O    8 1.907    C    6 0.981    C    9 0.868
     8  O   2.136        C    7 1.907
     9  C   3.821        F   11 0.967    F   12 0.955    F   10 0.948    C    7 0.868
    10  F   1.075        C    9 0.948
    11  F   1.095        C    9 0.967
    12  F   1.087        C    9 0.955
    13  C   3.993        C   14 1.010    C    6 0.986    H   20 0.975    H   21 0.975
    14  C   3.994        C   13 1.010    C   15 1.005    H   22 0.976    H   23 0.973
    15  C   3.998        C    4 1.011    C   14 1.005    H   25 0.966    H   24 0.957
    16  C   3.991        C   17 1.868    C    3 1.135    H   26 0.956
    17  C   3.989        C   16 1.868    H   28 0.978    H   27 0.971
    18  H   0.997        C    1 0.969
    19  H   0.995        C    6 0.945
    20  H   0.997        C   13 0.975
    21  H   0.997        C   13 0.975
    22  H   0.997        C   14 0.976
    23  H   0.996        C   14 0.973
    24  H   0.998        C   15 0.957
    25  H   0.998        C   15 0.966
    26  H   0.998        C   16 0.956
    27  H   0.997        C   17 0.971
    28  H   0.997        C   17 0.978

molecular dipole:
                 x           y           z       tot (Debye)
 q only:        0.053       1.130       1.382
   full:       -0.152       0.941       1.446       4.401
molecular quadrupole (traceless):
                xx          xy          yy          xz          yz          zz
 q only:        5.889      -0.872      -1.322      -6.122      -8.206      -4.567
  q+dip:        3.144      -1.203       2.741      -7.589      -7.425      -5.885
   full:        2.674      -0.361       2.196      -7.523      -7.965      -4.870

           -------------------------------------------------
          |                Geometry Summary                 |
           -------------------------------------------------

      molecular mass/u    :      260.2735000
   center of mass at/Å    :       -0.0507426      -0.8084269      -0.6494887
  moments of inertia/u·Å² :        0.6952576E+03   0.1647658E+04   0.2083195E+04
rotational constants/cm⁻¹ :        0.2424660E-01   0.1023127E-01   0.8092203E-02

 * 25 selected distances

     #   Z        #   Z                                     value/Å
     1   6 C      2  16 S                                 1.7097428
     2  16 S      3   6 C                                 1.7428224 (max)
     3   6 C      4   6 C                                 1.3744759
     1   6 C      5   6 C                                 1.3643300
     4   6 C      5   6 C                                 1.4189173
     7   6 C      8   8 O                                 1.1972633
     9   6 C     10   9 F                                 1.3428357
     9   6 C     11   9 F                                 1.3349259
     9   6 C     12   9 F                                 1.3402325
     6   6 C     13   6 C                                 1.5320495
    13   6 C     14   6 C                                 1.5256858
     4   6 C     15   6 C                                 1.4965694
    14   6 C     15   6 C                                 1.5257498
    16   6 C     17   6 C                                 1.3297204
     1   6 C     18   1 H                                 1.0714894 (min)
     6   6 C     19   1 H                                 1.0946055
    13   6 C     20   1 H                                 1.0921585
    13   6 C     21   1 H                                 1.0912304
    14   6 C     22   1 H                                 1.0910571
    14   6 C     23   1 H                                 1.0893340
    15   6 C     24   1 H                                 1.0958379
    15   6 C     25   1 H                                 1.0914566
    16   6 C     26   1 H                                 1.0820588
    17   6 C     27   1 H                                 1.0775670
    17   6 C     28   1 H                                 1.0753274

 * 5 distinct bonds (by element types)

   Z      Z             #   av. dist./Å        max./Å        min./Å
   1 H    6 C          11     1.0865566     1.0958379     1.0714894
   6 C    6 C           8     1.4459373     1.5320495     1.3297204
   6 C    8 O           1     1.1972633     1.1972633     1.1972633
   6 C    9 F           3     1.3393314     1.3428357     1.3349259
   6 C   16 S           2     1.7262826     1.7428224     1.7097428


optimized geometry written to: xtbopt.xyz


           -------------------------------------------------
          | TOTAL ENERGY              -52.789262873911 Eh   |
          | GRADIENT NORM               0.000652782671 Eh/α |
          | HOMO-LUMO GAP               2.007438966660 eV   |
           -------------------------------------------------

------------------------------------------------------------------------
 * finished run on 2021/05/19 at 11:00:38.123     
------------------------------------------------------------------------
 total:
 * wall-time:     0 d,  0 h,  0 min,  1.406 sec
 *  cpu-time:     0 d,  0 h,  0 min,  1.406 sec
 * ratio c/w:     1.000 speedup
 SCF:
 * wall-time:     0 d,  0 h,  0 min,  0.056 sec
 *  cpu-time:     0 d,  0 h,  0 min,  0.056 sec
 * ratio c/w:     1.000 speedup
 ANC optimizer:
 * wall-time:     0 d,  0 h,  0 min,  1.324 sec
 *  cpu-time:     0 d,  0 h,  0 min,  1.324 sec
 * ratio c/w:     1.000 speedup

