      -----------------------------------------------------------      
     |                   =====================                   |     
     |                           x T B                           |     
     |                   =====================                   |     
     |                         S. Grimme                         |     
     |          Mulliken Center for Theoretical Chemistry        |     
     |                    University of Bonn                     |     
     |                Version 6.2 RC2 (SAW190805)                |     
      -----------------------------------------------------------      

   This program is distributed in the hope that it will be useful,
   but WITHOUT ANY WARRANTY; without even the implied warranty of
   MERCHANTABILITY or FITNESS FOR A PARTICULAR PURPOSE.
   
   FOR NON-COMMERCIAL, ACADEMIA USE ONLY.
   
   Cite this work as:
   * S. Grimme, C. Bannwarth, P. Shushkov, J. Chem. Theory Comput., 2017,
     13, 1989-2009. DOI: 10.1021/acs.jctc.7b00118
   * C. Bannwarth, S. Ehlert and S. Grimme., J. Chem. Theory Comput., 2019,
     15, 1652-1671. DOI: 10.1021/acs.jctc.8b01176
   * P. Pracht, E. Caldeweyher, S. Ehlert, S. Grimme, ChemRxiv, 2019, preprint.
     DOI: 10.26434/chemrxiv.8326202.v1
   
   for DFT-D4:
   * E. Caldeweyher, C. Bannwarth and S. Grimme, J. Chem. Phys., 2017,
     147, 034112. DOI: 10.1063/1.4993215
   * E. Caldeweyher, S. Ehlert, A. Hansen, H. Neugebauer, S. Spicher,
     C. Bannwarth and S. Grimme, J. Chem. Phys., 2019, 150, 154122.
     DOI: 10.1063/1.5090222
   
   for sTDA-xTB:
   * S. Grimme and C. Bannwarth, J. Chem. Phys., 2016, 145, 054103.
     DOI: 10.1063/1.4959605
   
   in the mass-spec context:
   * V. Asgeirsson, C. Bauer and S. Grimme, Chem. Sci., 2017, 8, 4879.
     DOI: 10.1039/c7sc00601b
   
   for metadynamics refer to:
   * S. Grimme, J. Chem. Theory Comput., 2019, 155, 2847-2862
     DOI: 10.1021/acs.jctc.9b00143
   
   with help from (in alphabetical order)
   C. Bannwarth, F. Bohle, G. Brandenburg, E. Caldeweyher, M. Checinski,
   S. Dohm, S. Ehlert, S. Ehrlich, F. März, H. Neugebauer, J. Pisarek,
   P. Pracht, P. Shushkov, and S. Spicher.
   
 * started run on 2021/05/19 at 11:00:39.170     

           -------------------------------------------------
          |                Calculation Setup                |
           -------------------------------------------------

          program call               : /ihome/ghutchison/geoffh/xtb/xtb 754.xyz -opt
          hostname                   : smp-n83
          coordinate file            : 754.xyz
          omp threads                :                     1
          number of atoms            :                    22
          number of electrons        :                    64
          charge                     :                     0
          spin                       :                   0.0
          first test random number   :      0.53853877204274


########################################################################
# WARNING! Please study the warnings concerning your input carefully
#  - the use of '-opt' is discouraged, please use '--opt' next time
########################################################################

           ------------------------------------------------- 
          |                 G F N 2 - x T B                 |
          | Geometry, Frequencies, Noncovalent interactions |
          |            JCTC 2019 parametrisation            |
           ------------------------------------------------- 
             KAB for C  - Si     :                1.0500
             KAB for H  - Pd     :                0.9500
             k(s)              :                1.8500
             k(p)              :                2.2300
             k(d)              :                2.2300
             k(f)              :                2.0000
             kEN (H0ij)        :               -2.0000
             D4 a1             :                0.5200
             D4 a2             :                5.0000
             D4 s6             :                1.0000
             D4 s8             :                2.7000
             D4 s9             :                5.0000
             alphaj            :                2.0000

  Z AO/shell   Hii/eV     exponent
  1     Wed Apr 25 08:07:45 CEST 2018   EN: 2.200 GM2: 0.406  GM3: 0.0800  RAES: 1.40
     1s    -10.707211    1.230000
  6     Wed Apr 25 08:07:45 CEST 2018   EN: 2.550 GM2: 0.538  GM3: 0.1500  RAES: 3.00
     2s    -13.970922    2.096432
     2p    -10.063292    1.800000
 16     Tue Apr 24 11:44:34 CEST 2018   EN: 2.580 GM2: 0.340  GM3:-0.0502  RAES: 3.10
     3s    -20.029654    1.981333
     3p    -11.377694    2.025643
     3d     -0.420282    1.702555

           ------------------------------------------------- 
          |        Self-Consistent Charge Iterations        |
           ------------------------------------------------- 

          ...................................................
          :                      SETUP                      :
          :.................................................:
          :  # basis functions                  76          :
          :  # atomic orbitals                  73          :
          :  # shells                           37          :
          :  # electrons                        64          :
          :  max. iterations                   250          :
          :  Hamiltonian                  GFN2-xTB          :
          :  restarted?                      false          :
          :  GBSA solvation                  false          :
          :  PC potential                    false          :
          :  electronic temp.          300.0000000     K    :
          :  accuracy                    1.0000000          :
          :  -> integral cutoff          0.2500000E+02      :
          :  -> integral neglect         0.1000000E-07      :
          :  -> SCF convergence          0.1000000E-05 Eh   :
          :  -> wf. convergence          0.1000000E-03 e    :
          :  Broyden damping             0.4000000          :
          ...................................................

 iter      E             dE          RMSdq      gap      omega  full diag
   1    -34.4367021 -0.344367E+02  0.473E+00    2.97       0.0  T
   2    -34.4792258 -0.425237E-01  0.265E+00    2.49       1.0  T
   3    -34.4754177  0.380805E-02  0.986E-01    2.35       1.0  T
   4    -34.4805122 -0.509444E-02  0.532E-01    2.27       1.0  T
   5    -34.4834637 -0.295154E-02  0.236E-01    2.33       1.0  T
   6    -34.4837421 -0.278356E-03  0.721E-02    2.33       1.0  T
   7    -34.4837707 -0.285883E-04  0.388E-02    2.34       1.0  T
   8    -34.4837842 -0.134917E-04  0.216E-02    2.33       1.0  T
   9    -34.4837861 -0.195975E-05  0.995E-03    2.33       2.1  T
  10    -34.4837865 -0.345785E-06  0.363E-03    2.33       5.9  T
  11    -34.4837865 -0.799627E-07  0.199E-03    2.33      10.7  T
  12    -34.4837866 -0.127760E-07  0.116E-03    2.33      18.4  T
  13    -34.4837866 -0.837586E-08  0.448E-04    2.33      47.6  T
  14    -34.4837866 -0.164460E-08  0.175E-04    2.33     122.2  T

   *** convergence criteria satisfied after 14 iterations ***

         #    Occupation            Energy/Eh            Energy/eV
      -------------------------------------------------------------
         1        2.0000           -0.7440851             -20.2476
       ...           ...                  ...                  ...
        26        2.0000           -0.4512420             -12.2789
        27        2.0000           -0.4414929             -12.0136
        28        2.0000           -0.4357293             -11.8568
        29        2.0000           -0.4103570             -11.1664
        30        2.0000           -0.3920012             -10.6669
        31        2.0000           -0.3646824              -9.9235
        32        2.0000           -0.3606656              -9.8142 (HOMO)
        33                         -0.2749097              -7.4807 (LUMO)
        34                         -0.2366150              -6.4386
        35                         -0.2230783              -6.0703
        36                         -0.1991248              -5.4185
        37                         -0.1913943              -5.2081
       ...                                ...                  ...
        73                          0.6622840              18.0217
      -------------------------------------------------------------
                  HL-Gap            0.0857559 Eh            2.3335 eV
             Fermi-level           -0.3177877 Eh           -8.6474 eV

 SCC (total)                   0 d,  0 h,  0 min,  0.047 sec
 SCC setup                      ...        0 min,  0.000 sec (  0.655%)
 Dispersion                     ...        0 min,  0.000 sec (  0.589%)
 integral evaluation            ...        0 min,  0.011 sec ( 23.763%)
 zeroth order Hamiltonian       ...        0 min,  0.000 sec (  0.438%)
 iterations                     ...        0 min,  0.018 sec ( 38.497%)
 molecular gradient             ...        0 min,  0.016 sec ( 35.162%)
 printout                       ...        0 min,  0.000 sec (  0.783%)

         :::::::::::::::::::::::::::::::::::::::::::::::::::::
         ::                     SUMMARY                     ::
         :::::::::::::::::::::::::::::::::::::::::::::::::::::
         :: total energy             -34.056152249295 Eh    ::
         :: gradient norm              0.050672538608 Eh/a0 ::
         :: HOMO-LUMO gap              2.333536117460 eV    ::
         ::.................................................::
         :: SCC energy               -34.483786569383 Eh    ::
         :: -> isotropic ES            0.005257306024 Eh    ::
         :: -> anisotropic ES          0.002797336943 Eh    ::
         :: -> anisotropic XC          0.020948322282 Eh    ::
         :: -> dispersion             -0.027392867457 Eh    ::
         :: repulsion energy           0.427410831900 Eh    ::
         :: add. restraining           0.000000000000 Eh    ::
         :::::::::::::::::::::::::::::::::::::::::::::::::::::

      ----------------------------------------------------------- 
     |                   =====================                   |
     |                        A N C O P T                        |
     |                   =====================                   |
     |               Approximate Normal Coordinate               |
     |                Rational Function Optimizer                |
      ----------------------------------------------------------- 

          ...................................................
          :                      SETUP                      :
          :.................................................:
          :   optimization level            normal          :
          :   max. optcycles                   200          :
          :   ANC micro-cycles                  20          :
          :   degrees of freedom                60          :
          :.................................................:
          :   RF solver                   davidson          :
          :   input Hessian                  false          :
          :   write xtbopt.log                true          :
          :   linear?                        false          :
          :   energy convergence         0.5000000E-05 Eh   :
          :   grad. convergence          0.1000000E-02 Eh/α :
          :   maximium RF displ.         2.0000000          :
          :   Hlow (freq-cutoff)         0.5000000E-02      :
          :   Hmax (freq-cutoff)         5.0000000          :
          :   S6 in model hess.         20.0000000          :
          ...................................................

generating ANC from model Hessian ...
Using Lindh-Hessian (1995)
 Shifting diagonal of input Hessian by   3.843522067586850E-003
 Lowest  eigenvalues of input Hessian
   -0.000000   -0.000000   -0.000000   -0.000000    0.000000    0.000000
    0.005000    0.006525    0.006839    0.009361    0.011203    0.014666
    0.016176    0.021105    0.023983    0.026367    0.033914    0.037766
 Highest eigenvalues
    1.407270    1.514258    1.636396    1.763945    1.820624    1.970011
 

........................................................................
.............................. CYCLE    1 ..............................
........................................................................
   1    -34.4837866 -0.344838E+02  0.717E-05    2.33       0.0  T
   2    -34.4837866 -0.155325E-10  0.390E-05    2.33     546.3  T
   3    -34.4837866 -0.333245E-11  0.289E-05    2.33     737.2  T
     SCC iter.                  ...        0 min,  0.004 sec
     gradient                   ...        0 min,  0.016 sec
 * total energy  :   -34.0561522 Eh     change        0.8822333E-08 Eh
   gradient norm :     0.0506725 Eh/α   predicted     0.0000000E+00 (-100.00%)
   displ. norm   :     0.3254053 α      lambda       -0.5579398E-02
   maximum displ.:     0.1694431 α      in ANC's #3, #5, #13, ...

........................................................................
.............................. CYCLE    2 ..............................
........................................................................
   1    -34.4987951 -0.344988E+02  0.539E-01    2.40       0.0  T
   2    -34.4988691 -0.740611E-04  0.249E-01    2.40       1.0  T
   3    -34.4987776  0.914875E-04  0.834E-02    2.38       1.0  T
   4    -34.4989022 -0.124605E-03  0.307E-02    2.39       1.0  T
   5    -34.4989046 -0.238805E-05  0.674E-03    2.39       3.2  T
   6    -34.4989049 -0.281320E-06  0.319E-03    2.39       6.7  T
   7    -34.4989051 -0.149762E-06  0.141E-03    2.39      15.1  T
     SCC iter.                  ...        0 min,  0.009 sec
     gradient                   ...        0 min,  0.015 sec
 * total energy  :   -34.0599356 Eh     change       -0.3783319E-02 Eh
   gradient norm :     0.0215458 Eh/α   predicted    -0.3085122E-02 ( -18.45%)
   displ. norm   :     0.2880114 α      lambda       -0.1851994E-02
   maximum displ.:     0.1507664 α      in ANC's #3, #5, #4, ...

........................................................................
.............................. CYCLE    3 ..............................
........................................................................
   1    -34.5056548 -0.345057E+02  0.306E-01    2.42       0.0  T
   2    -34.5056811 -0.263038E-04  0.148E-01    2.41       1.0  T
   3    -34.5056363  0.448120E-04  0.580E-02    2.40       1.0  T
   4    -34.5056950 -0.586724E-04  0.200E-02    2.40       1.1  T
   5    -34.5056959 -0.881208E-06  0.602E-03    2.40       3.5  T
   6    -34.5056962 -0.364337E-06  0.187E-03    2.40      11.4  T
   7    -34.5056962 -0.151282E-09  0.140E-03    2.40      15.2  T
     SCC iter.                  ...        0 min,  0.008 sec
     gradient                   ...        0 min,  0.015 sec
 * total energy  :   -34.0611142 Eh     change       -0.1178658E-02 Eh
   gradient norm :     0.0079451 Eh/α   predicted    -0.1002825E-02 ( -14.92%)
   displ. norm   :     0.2433769 α      lambda       -0.5651735E-03
   maximum displ.:     0.1359844 α      in ANC's #3, #4, #5, ...

........................................................................
.............................. CYCLE    4 ..............................
........................................................................
   1    -34.5048372 -0.345048E+02  0.193E-01    2.39       0.0  T
   2    -34.5048457 -0.846453E-05  0.995E-02    2.39       1.0  T
   3    -34.5048325  0.131944E-04  0.341E-02    2.39       1.0  T
   4    -34.5048490 -0.165419E-04  0.137E-02    2.39       1.6  T
   5    -34.5048497 -0.682393E-06  0.316E-03    2.39       6.7  T
   6    -34.5048498 -0.914571E-07  0.115E-03    2.39      18.6  T
   7    -34.5048498 -0.290744E-08  0.844E-04    2.39      25.2  T
     SCC iter.                  ...        0 min,  0.009 sec
     gradient                   ...        0 min,  0.016 sec
 * total energy  :   -34.0615095 Eh     change       -0.3953272E-03 Eh
   gradient norm :     0.0066786 Eh/α   predicted    -0.2993244E-03 ( -24.28%)
   displ. norm   :     0.2146285 α      lambda       -0.3065347E-03
   maximum displ.:     0.1216437 α      in ANC's #3, #4, #7, ...

........................................................................
.............................. CYCLE    5 ..............................
........................................................................
   1    -34.5037836 -0.345038E+02  0.173E-01    2.37       0.0  T
   2    -34.5037889 -0.528366E-05  0.910E-02    2.37       1.0  T
   3    -34.5037894 -0.569775E-06  0.166E-02    2.37       1.3  T
   4    -34.5037896 -0.143468E-06  0.843E-03    2.37       2.5  T
   5    -34.5037901 -0.487078E-06  0.240E-03    2.37       8.9  T
   6    -34.5037902 -0.945772E-07  0.745E-04    2.37      28.6  T
     SCC iter.                  ...        0 min,  0.008 sec
     gradient                   ...        0 min,  0.016 sec
 * total energy  :   -34.0617121 Eh     change       -0.2025400E-03 Eh
   gradient norm :     0.0048582 Eh/α   predicted    -0.1603289E-03 ( -20.84%)
   displ. norm   :     0.2146791 α      lambda        0.3225659E-04
   maximum displ.:     0.1216445 α      in ANC's #3, #4, #7, ...

........................................................................
.............................. CYCLE    6 ..............................
........................................................................
   1    -34.5015784 -0.345016E+02  0.174E-01    2.35       0.0  T
   2    -34.5015836 -0.526230E-05  0.917E-02    2.35       1.0  T
   3    -34.5015842 -0.529856E-06  0.167E-02    2.35       1.3  T
   4    -34.5015843 -0.127233E-06  0.870E-03    2.35       2.5  T
   5    -34.5015848 -0.526423E-06  0.265E-03    2.35       8.0  T
   6    -34.5015849 -0.116051E-06  0.752E-04    2.35      28.3  T
     SCC iter.                  ...        0 min,  0.008 sec
     gradient                   ...        0 min,  0.016 sec
 * total energy  :   -34.0616848 Eh     change        0.2728262E-04 Eh
   gradient norm :     0.0076964 Eh/α   predicted     0.1687141E-04 ( -38.16%)
   displ. norm   :     0.0952777 α      lambda       -0.2120340E-03
   maximum displ.:     0.0499840 α      in ANC's #5, #6, #3, ...

........................................................................
.............................. CYCLE    7 ..............................
........................................................................
   1    -34.5043073 -0.345043E+02  0.125E-01    2.35       0.0  T
   2    -34.5043108 -0.350217E-05  0.595E-02    2.35       1.0  T
   3    -34.5043085  0.235357E-05  0.165E-02    2.35       1.3  T
   4    -34.5043121 -0.360257E-05  0.718E-03    2.35       3.0  T
   5    -34.5043122 -0.867036E-07  0.185E-03    2.35      11.5  T
   6    -34.5043122 -0.334538E-07  0.780E-04    2.35      27.3  T
     SCC iter.                  ...        0 min,  0.008 sec
     gradient                   ...        0 min,  0.016 sec
 * total energy  :   -34.0618105 Eh     change       -0.1256625E-03 Eh
   gradient norm :     0.0041310 Eh/α   predicted    -0.1069801E-03 ( -14.87%)
   displ. norm   :     0.0842791 α      lambda       -0.1172142E-03
   maximum displ.:     0.0508026 α      in ANC's #6, #5, #2, ...

........................................................................
.............................. CYCLE    8 ..............................
........................................................................
   1    -34.5056912 -0.345057E+02  0.151E-01    2.35       0.0  T
   2    -34.5056965 -0.531358E-05  0.702E-02    2.35       1.0  T
   3    -34.5056938  0.272838E-05  0.173E-02    2.35       1.2  T
   4    -34.5056983 -0.451007E-05  0.767E-03    2.35       2.8  T
   5    -34.5056984 -0.145517E-06  0.206E-03    2.35      10.3  T
   6    -34.5056985 -0.260066E-07  0.940E-04    2.35      22.7  T
     SCC iter.                  ...        0 min,  0.007 sec
     gradient                   ...        0 min,  0.016 sec
 * total energy  :   -34.0618863 Eh     change       -0.7585315E-04 Eh
   gradient norm :     0.0023862 Eh/α   predicted    -0.5902841E-04 ( -22.18%)
   displ. norm   :     0.2124295 α      lambda       -0.1566245E-03
   maximum displ.:     0.1062505 α      in ANC's #3, #2, #6, ...

........................................................................
.............................. CYCLE    9 ..............................
........................................................................
   1    -34.5057849 -0.345058E+02  0.316E-01    2.33       0.0  T
   2    -34.5058065 -0.216592E-04  0.150E-01    2.34       1.0  T
   3    -34.5058042  0.234561E-05  0.297E-02    2.34       1.0  T
   4    -34.5058110 -0.682763E-05  0.178E-02    2.34       1.2  T
   5    -34.5058129 -0.186809E-05  0.314E-03    2.34       6.8  T
   6    -34.5058129 -0.198289E-07  0.185E-03    2.34      11.5  T
   7    -34.5058129 -0.105599E-08  0.112E-03    2.34      19.0  T
   8    -34.5058129 -0.106147E-07  0.376E-04    2.34      56.7  T
   9    -34.5058129 -0.115809E-08  0.144E-04    2.34     148.3  T
     SCC iter.                  ...        0 min,  0.011 sec
     gradient                   ...        0 min,  0.016 sec
 * total energy  :   -34.0620138 Eh     change       -0.1274517E-03 Eh
   gradient norm :     0.0035174 Eh/α   predicted    -0.8184761E-04 ( -35.78%)
   displ. norm   :     0.4847958 α      lambda       -0.2826310E-03
   maximum displ.:     0.2779330 α      in ANC's #3, #2, #1, ...

........................................................................
.............................. CYCLE   10 ..............................
........................................................................
   1    -34.5022300 -0.345022E+02  0.661E-01    2.30       0.0  T
   2    -34.5023251 -0.951014E-04  0.315E-01    2.30       1.0  T
   3    -34.5023326 -0.748145E-05  0.551E-02    2.30       1.0  T
   4    -34.5023339 -0.125760E-05  0.389E-02    2.30       1.0  T
   5    -34.5023501 -0.162129E-04  0.592E-03    2.30       3.6  T
   6    -34.5023501 -0.217542E-07  0.350E-03    2.30       6.1  T
   7    -34.5023501 -0.233797E-07  0.167E-03    2.30      12.7  T
   8    -34.5023501 -0.173326E-07  0.762E-04    2.30      28.0  T
   9    -34.5023501 -0.562243E-08  0.304E-04    2.30      70.1  T
     SCC iter.                  ...        0 min,  0.011 sec
     gradient                   ...        0 min,  0.016 sec
 * total energy  :   -34.0621824 Eh     change       -0.1686591E-03 Eh
   gradient norm :     0.0099902 Eh/α   predicted    -0.1745287E-03 (   3.48%)
   displ. norm   :     0.1431853 α      lambda       -0.1479171E-03
   maximum displ.:     0.1051115 α      in ANC's #3, #2, #5, ...

........................................................................
.............................. CYCLE   11 ..............................
........................................................................
   1    -34.5032698 -0.345033E+02  0.193E-01    2.29       0.0  T
   2    -34.5032787 -0.890551E-05  0.910E-02    2.29       1.0  T
   3    -34.5032804 -0.167683E-05  0.145E-02    2.29       1.5  T
   4    -34.5032793  0.112714E-05  0.107E-02    2.29       2.0  T
   5    -34.5032808 -0.157048E-05  0.177E-03    2.29      12.1  T
   6    -34.5032808 -0.120558E-08  0.105E-03    2.29      20.3  T
     SCC iter.                  ...        0 min,  0.008 sec
     gradient                   ...        0 min,  0.015 sec
 * total energy  :   -34.0622997 Eh     change       -0.1172598E-03 Eh
   gradient norm :     0.0073451 Eh/α   predicted    -0.7548479E-04 ( -35.63%)
   displ. norm   :     0.3325983 α      lambda       -0.2626644E-03
   maximum displ.:     0.2380723 α      in ANC's #3, #2, #6, ...

........................................................................
.............................. CYCLE   12 ..............................
........................................................................
   1    -34.5039490 -0.345039E+02  0.395E-01    2.28       0.0  T
   2    -34.5039867 -0.376529E-04  0.188E-01    2.29       1.0  T
   3    -34.5039937 -0.698833E-05  0.312E-02    2.29       1.0  T
   4    -34.5039890  0.462266E-05  0.209E-02    2.29       1.0  T
   5    -34.5039955 -0.643954E-05  0.441E-03    2.29       4.8  T
   6    -34.5039956 -0.931569E-07  0.243E-03    2.29       8.8  T
   7    -34.5039956 -0.786336E-08  0.123E-03    2.29      17.3  T
     SCC iter.                  ...        0 min,  0.009 sec
     gradient                   ...        0 min,  0.016 sec
 * total energy  :   -34.0624767 Eh     change       -0.1769881E-03 Eh
   gradient norm :     0.0044201 Eh/α   predicted    -0.1458666E-03 ( -17.58%)
   displ. norm   :     0.3804000 α      lambda       -0.2019534E-03
   maximum displ.:     0.2720967 α      in ANC's #3, #2, #5, ...

........................................................................
.............................. CYCLE   13 ..............................
........................................................................
   1    -34.5018670 -0.345019E+02  0.449E-01    2.26       0.0  T
   2    -34.5019167 -0.496775E-04  0.215E-01    2.27       1.0  T
   3    -34.5019249 -0.825797E-05  0.374E-02    2.27       1.0  T
   4    -34.5019196  0.527393E-05  0.245E-02    2.28       1.0  T
   5    -34.5019282 -0.852451E-05  0.519E-03    2.27       4.1  T
   6    -34.5019283 -0.180486E-06  0.271E-03    2.27       7.9  T
   7    -34.5019284 -0.814139E-08  0.144E-03    2.27      14.8  T
     SCC iter.                  ...        0 min,  0.009 sec
     gradient                   ...        0 min,  0.015 sec
 * total energy  :   -34.0625854 Eh     change       -0.1087133E-03 Eh
   gradient norm :     0.0072159 Eh/α   predicted    -0.1155901E-03 (   6.33%)
   displ. norm   :     0.1795043 α      lambda       -0.2090738E-03
   maximum displ.:     0.1072006 α      in ANC's #3, #2, #1, ...

........................................................................
.............................. CYCLE   14 ..............................
........................................................................
   1    -34.5074380 -0.345074E+02  0.134E-01    2.28       0.0  T
   2    -34.5074441 -0.613900E-05  0.670E-02    2.29       1.0  T
   3    -34.5074424  0.167478E-05  0.182E-02    2.28       1.2  T
   4    -34.5074450 -0.254740E-05  0.101E-02    2.29       2.1  T
   5    -34.5074456 -0.626798E-06  0.362E-03    2.29       5.9  T
   6    -34.5074458 -0.148267E-06  0.111E-03    2.29      19.2  T
   7    -34.5074458 -0.236362E-08  0.718E-04    2.29      29.7  T
     SCC iter.                  ...        0 min,  0.008 sec
     gradient                   ...        0 min,  0.015 sec
 * total energy  :   -34.0626262 Eh     change       -0.4076217E-04 Eh
   gradient norm :     0.0088587 Eh/α   predicted    -0.1079064E-03 ( 164.72%)
   displ. norm   :     0.3335744 α      lambda       -0.2578190E-03
   maximum displ.:     0.2096790 α      in ANC's #3, #2, #6, ...

........................................................................
.............................. CYCLE   15 ..............................
........................................................................
   1    -34.5028523 -0.345029E+02  0.425E-01    2.27       0.0  T
   2    -34.5028980 -0.456862E-04  0.201E-01    2.27       1.0  T
   3    -34.5029010 -0.307349E-05  0.365E-02    2.28       1.0  T
   4    -34.5029031 -0.209337E-05  0.247E-02    2.28       1.0  T
   5    -34.5029096 -0.648875E-05  0.422E-03    2.28       5.1  T
   6    -34.5029097 -0.628099E-07  0.261E-03    2.28       8.2  T
   7    -34.5029097 -0.181672E-07  0.133E-03    2.28      16.0  T
     SCC iter.                  ...        0 min,  0.008 sec
     gradient                   ...        0 min,  0.016 sec
 * total energy  :   -34.0627318 Eh     change       -0.1056025E-03 Eh
   gradient norm :     0.0084421 Eh/α   predicted    -0.1432535E-03 (  35.65%)
   displ. norm   :     0.0656967 α      lambda       -0.9563432E-04
   maximum displ.:     0.0482872 α      in ANC's #3, #2, #6, ...

........................................................................
.............................. CYCLE   16 ..............................
........................................................................
   1    -34.5045027 -0.345045E+02  0.687E-02    2.27       0.0  T
   2    -34.5045046 -0.194987E-05  0.321E-02    2.27       1.0  T
   3    -34.5045043  0.313590E-06  0.826E-03    2.27       2.6  T
   4    -34.5045049 -0.608221E-06  0.464E-03    2.27       4.6  T
   5    -34.5045051 -0.129951E-06  0.155E-03    2.27      13.8  T
   6    -34.5045051 -0.104109E-07  0.561E-04    2.27      38.0  T
     SCC iter.                  ...        0 min,  0.007 sec
     gradient                   ...        0 min,  0.016 sec
 * total energy  :   -34.0627838 Eh     change       -0.5205567E-04 Eh
   gradient norm :     0.0027145 Eh/α   predicted    -0.4802634E-04 (  -7.74%)
   displ. norm   :     0.1251451 α      lambda       -0.6686628E-04
   maximum displ.:     0.0726159 α      in ANC's #3, #2, #5, ...

........................................................................
.............................. CYCLE   17 ..............................
........................................................................
   1    -34.5049203 -0.345049E+02  0.172E-01    2.26       0.0  T
   2    -34.5049283 -0.803942E-05  0.807E-02    2.27       1.0  T
   3    -34.5049277  0.672259E-06  0.167E-02    2.27       1.3  T
   4    -34.5049302 -0.247517E-05  0.928E-03    2.27       2.3  T
   5    -34.5049305 -0.373374E-06  0.246E-03    2.27       8.7  T
   6    -34.5049306 -0.544891E-07  0.870E-04    2.27      24.5  T
   7    -34.5049306 -0.177494E-09  0.439E-04    2.27      48.5  T
     SCC iter.                  ...        0 min,  0.008 sec
     gradient                   ...        0 min,  0.016 sec
 * total energy  :   -34.0628180 Eh     change       -0.3420523E-04 Eh
   gradient norm :     0.0039159 Eh/α   predicted    -0.3396184E-04 (  -0.71%)
   displ. norm   :     0.1660611 α      lambda       -0.6530934E-04
   maximum displ.:     0.0991416 α      in ANC's #2, #3, #1, ...

........................................................................
.............................. CYCLE   18 ..............................
........................................................................
   1    -34.5051088 -0.345051E+02  0.214E-01    2.26       0.0  T
   2    -34.5051213 -0.124534E-04  0.101E-01    2.26       1.0  T
   3    -34.5051218 -0.536092E-06  0.190E-02    2.27       1.1  T
   4    -34.5051232 -0.138220E-05  0.122E-02    2.27       1.7  T
   5    -34.5051243 -0.115826E-05  0.305E-03    2.27       7.0  T
   6    -34.5051244 -0.972233E-07  0.117E-03    2.27      18.2  T
   7    -34.5051244  0.116862E-08  0.747E-04    2.27      28.5  T
   8    -34.5051244 -0.424627E-08  0.330E-04    2.27      64.6  T
     SCC iter.                  ...        0 min,  0.010 sec
     gradient                   ...        0 min,  0.016 sec
 * total energy  :   -34.0628640 Eh     change       -0.4601318E-04 Eh
   gradient norm :     0.0027471 Eh/α   predicted    -0.3355767E-04 ( -27.07%)
   displ. norm   :     0.1440549 α      lambda       -0.5412962E-04
   maximum displ.:     0.0804437 α      in ANC's #2, #1, #3, ...

........................................................................
.............................. CYCLE   19 ..............................
........................................................................
   1    -34.5061926 -0.345062E+02  0.178E-01    2.26       0.0  T
   2    -34.5062014 -0.879296E-05  0.836E-02    2.27       1.0  T
   3    -34.5062023 -0.833631E-06  0.149E-02    2.27       1.4  T
   4    -34.5062027 -0.454805E-06  0.985E-03    2.27       2.2  T
   5    -34.5062035 -0.766136E-06  0.290E-03    2.27       7.4  T
   6    -34.5062036 -0.973048E-07  0.887E-04    2.27      24.0  T
   7    -34.5062036  0.997204E-09  0.549E-04    2.27      38.9  T
     SCC iter.                  ...        0 min,  0.008 sec
     gradient                   ...        0 min,  0.016 sec
 * total energy  :   -34.0628992 Eh     change       -0.3516997E-04 Eh
   gradient norm :     0.0032340 Eh/α   predicted    -0.2762954E-04 ( -21.44%)
   displ. norm   :     0.2215450 α      lambda       -0.4684179E-04
   maximum displ.:     0.1324809 α      in ANC's #2, #3, #1, ...

........................................................................
.............................. CYCLE   20 ..............................
........................................................................
   1    -34.5044870 -0.345045E+02  0.280E-01    2.26       0.0  T
   2    -34.5045090 -0.220293E-04  0.132E-01    2.26       1.0  T
   3    -34.5045118 -0.274550E-05  0.231E-02    2.26       1.0  T
   4    -34.5045116  0.199680E-06  0.158E-02    2.26       1.4  T
   5    -34.5045142 -0.256515E-05  0.374E-03    2.26       5.7  T
   6    -34.5045143 -0.138759E-06  0.144E-03    2.26      14.8  T
   7    -34.5045143 -0.436387E-09  0.865E-04    2.26      24.6  T
   8    -34.5045143 -0.527296E-08  0.420E-04    2.26      50.8  T
     SCC iter.                  ...        0 min,  0.010 sec
     gradient                   ...        0 min,  0.017 sec
 * total energy  :   -34.0629201 Eh     change       -0.2091939E-04 Eh
   gradient norm :     0.0029936 Eh/α   predicted    -0.2457443E-04 (  17.47%)
   displ. norm   :     0.1059264 α      lambda       -0.5647920E-04
   maximum displ.:     0.0768391 α      in ANC's #1, #3, #9, ...
 * RMSD in coord.:     0.6674435 α      energy gain  -0.6767869E-02 Eh

generating ANC from model Hessian ...
Using Lindh-Hessian (1995)
 Shifting diagonal of input Hessian by   3.807803372638862E-003
 Lowest  eigenvalues of input Hessian
   -0.000000   -0.000000   -0.000000    0.000000    0.000000    0.000000
    0.005000    0.006391    0.006514    0.008798    0.010771    0.014702
    0.015617    0.021887    0.023781    0.024502    0.034989    0.035511
 Highest eigenvalues
    1.421662    1.514233    1.664335    1.798478    1.866206    2.021709
 

........................................................................
.............................. CYCLE   21 ..............................
........................................................................
   1    -34.5065095 -0.345065E+02  0.110E-01    2.26       0.0  T
   2    -34.5065129 -0.334033E-05  0.518E-02    2.27       1.0  T
   3    -34.5065131 -0.259650E-06  0.971E-03    2.27       2.2  T
   4    -34.5065132 -0.924421E-07  0.663E-03    2.27       3.2  T
   5    -34.5065137 -0.414885E-06  0.166E-03    2.27      12.9  T
   6    -34.5065137 -0.300609E-07  0.623E-04    2.27      34.2  T
   7    -34.5065137 -0.613959E-09  0.350E-04    2.27      60.9  T
     SCC iter.                  ...        0 min,  0.008 sec
     gradient                   ...        0 min,  0.016 sec
 * total energy  :   -34.0629375 Eh     change       -0.1735759E-04 Eh
   gradient norm :     0.0031403 Eh/α   predicted     0.0000000E+00 (-100.00%)
   displ. norm   :     0.0347117 α      lambda       -0.3202652E-04
   maximum displ.:     0.0222852 α      in ANC's #1, #4, #9, ...

........................................................................
.............................. CYCLE   22 ..............................
........................................................................
   1    -34.5055050 -0.345055E+02  0.304E-02    2.27       0.0  T
   2    -34.5055053 -0.266948E-06  0.153E-02    2.27       1.4  T
   3    -34.5055052  0.497744E-07  0.371E-03    2.27       5.8  T
   4    -34.5055053 -0.751267E-07  0.218E-03    2.27       9.8  T
   5    -34.5055054 -0.330794E-07  0.836E-04    2.27      25.5  T
   6    -34.5055054 -0.981240E-08  0.173E-04    2.27     123.6  T
     SCC iter.                  ...        0 min,  0.007 sec
     gradient                   ...        0 min,  0.016 sec
 * total energy  :   -34.0629584 Eh     change       -0.2092850E-04 Eh
   gradient norm :     0.0010023 Eh/α   predicted    -0.1603296E-04 ( -23.39%)
   displ. norm   :     0.0346493 α      lambda       -0.6563410E-05
   maximum displ.:     0.0216108 α      in ANC's #1, #4, #5, ...

........................................................................
.............................. CYCLE   23 ..............................
........................................................................
   1    -34.5049988 -0.345050E+02  0.299E-02    2.27       0.0  T
   2    -34.5049990 -0.204050E-06  0.152E-02    2.26       1.4  T
   3    -34.5049989  0.126506E-06  0.420E-03    2.27       5.1  T
   4    -34.5049990 -0.142125E-06  0.239E-03    2.26       8.9  T
   5    -34.5049991 -0.463336E-07  0.588E-04    2.26      36.3  T
   6    -34.5049991 -0.333519E-08  0.196E-04    2.27     108.9  T
     SCC iter.                  ...        0 min,  0.007 sec
     gradient                   ...        0 min,  0.016 sec
 * total energy  :   -34.0629635 Eh     change       -0.5069778E-05 Eh
   gradient norm :     0.0007287 Eh/α   predicted    -0.3301149E-05 ( -34.89%)
   displ. norm   :     0.0234964 α      lambda       -0.2561909E-05
   maximum displ.:     0.0176860 α      in ANC's #1, #4, #2, ...

........................................................................
.............................. CYCLE   24 ..............................
........................................................................
   1    -34.5051280 -0.345051E+02  0.214E-02    2.27       0.0  T
   2    -34.5051281 -0.110943E-06  0.104E-02    2.27       2.0  T
   3    -34.5051281  0.319204E-08  0.220E-03    2.27       9.7  T
   4    -34.5051281 -0.775884E-08  0.150E-03    2.27      14.2  T
   5    -34.5051281 -0.233524E-07  0.217E-04    2.27      98.0  T
   6    -34.5051281 -0.265992E-09  0.123E-04    2.27     173.2  T
     SCC iter.                  ...        0 min,  0.008 sec
     gradient                   ...        0 min,  0.016 sec
 * total energy  :   -34.0629666 Eh     change       -0.3081803E-05 Eh
   gradient norm :     0.0005504 Eh/α   predicted    -0.1281582E-05 ( -58.41%)
   displ. norm   :     0.0441385 α      lambda       -0.4178080E-05
   maximum displ.:     0.0314346 α      in ANC's #1, #4, #2, ...

   *** GEOMETRY OPTIMIZATION CONVERGED AFTER 24 ITERATIONS ***

------------------------------------------------------------------------
 total energy gain   :        -0.0068143 Eh       -4.2760 kcal/mol
 total RMSD          :         0.6619655 a0        0.3503 Å
 total power (kW/mol):        -0.7454566 (step)  -20.5389 (real)
------------------------------------------------------------------------

 ANCopt (total)                0 d,  0 h,  0 min,  0.871 sec
 optimizer setup                ...        0 min,  0.000 sec (  0.017%)
 model hessian                  ...        0 min,  0.010 sec (  1.189%)
 ANC generation                 ...        0 min,  0.001 sec (  0.146%)
 coordinate transformation      ...        0 min,  0.000 sec (  0.050%)
 single point calculation       ...        0 min,  0.849 sec ( 97.465%)
 optimization log               ...        0 min,  0.002 sec (  0.253%)
 hessian update                 ...        0 min,  0.000 sec (  0.035%)
 rational function              ...        0 min,  0.006 sec (  0.676%)

================
 final structure:
================
$coord
   -3.35712160099868   -2.40139385659260    0.94035922026243      C 
   -5.43849809484171    0.02774410298086    1.45845901442451      S 
   -3.40527172701675    2.20813653648316    0.05487511788180      C 
   -1.24746258101756    1.02936262533149   -0.77642848770843      C 
   -1.22690666494294   -1.61315724375072   -0.27051145367348      C 
    1.10340583521136   -3.81495482854338   -1.17062046790354      S 
    4.11588287189472   -2.19031755250244   -0.52922333302291      C 
    3.92991762020254   -0.10581017695826    1.44221576283680      C 
    3.60674881916939    2.49281708731703    0.24586943023853      C 
    1.29320798216496    2.54142845362071   -2.32569504271018      S 
   -4.22741827621597    4.80451561929135   -0.00953535297949      C 
   -3.18980287451406    6.69346211615958   -1.30279295673739      C 
   -3.82359264847521   -4.28941730955580    1.50106914051004      H 
    4.82095186166688   -1.45713179114707   -2.32106984885372      H 
    5.34633536477465   -3.71493838700340    0.10391851830684      H 
    5.65563694375469   -0.07585995571781    2.57746019497487      H 
    2.35810447676381   -0.49062226222611    2.72623544992301      H 
    5.35441971130936    3.11476995910769   -0.64926690711170      H 
    3.02608243339009    3.88974679078846    1.64519048375927      H 
   -5.89262932506510    5.15674682290323    1.12869402407279      H 
   -1.56840821513225    6.44166755324969   -2.49994122307832      H 
   -3.96590559507616    8.57013656790565   -1.19158236349720      H 
$end
           -------------------------------------------------
          |                Final Singlepoint                |
           -------------------------------------------------

          ...................................................
          :                      SETUP                      :
          :.................................................:
          :  # basis functions                  76          :
          :  # atomic orbitals                  73          :
          :  # shells                           37          :
          :  # electrons                        64          :
          :  max. iterations                   250          :
          :  Hamiltonian                  GFN2-xTB          :
          :  restarted?                      false          :
          :  GBSA solvation                  false          :
          :  PC potential                    false          :
          :  electronic temp.          300.0000000     K    :
          :  accuracy                    1.0000000          :
          :  -> integral cutoff          0.2500000E+02      :
          :  -> integral neglect         0.1000000E-07      :
          :  -> SCF convergence          0.1000000E-05 Eh   :
          :  -> wf. convergence          0.1000000E-03 e    :
          :  Broyden damping             0.4000000          :
          ...................................................

 iter      E             dE          RMSdq      gap      omega  full diag
   1    -34.5051281 -0.345051E+02  0.685E-05    2.27       0.0  T
   2    -34.5051281 -0.362377E-11  0.358E-05    2.27     596.2  T
   3    -34.5051281 -0.280664E-10  0.266E-05    2.27     802.1  T

   *** convergence criteria satisfied after 3 iterations ***

         #    Occupation            Energy/Eh            Energy/eV
      -------------------------------------------------------------
         1        2.0000           -0.7417196             -20.1832
       ...           ...                  ...                  ...
        26        2.0000           -0.4495734             -12.2335
        27        2.0000           -0.4455610             -12.1243
        28        2.0000           -0.4386727             -11.9369
        29        2.0000           -0.4125453             -11.2259
        30        2.0000           -0.3926331             -10.6841
        31        2.0000           -0.3693032             -10.0493
        32        2.0000           -0.3605497              -9.8111 (HOMO)
        33                         -0.2772996              -7.5457 (LUMO)
        34                         -0.2336025              -6.3566
        35                         -0.2231747              -6.0729
        36                         -0.1991458              -5.4190
        37                         -0.1912283              -5.2036
       ...                                ...                  ...
        73                          0.6667007              18.1418
      -------------------------------------------------------------
                  HL-Gap            0.0832501 Eh            2.2653 eV
             Fermi-level           -0.3189247 Eh           -8.6784 eV

 SCC (total)                   0 d,  0 h,  0 min,  0.032 sec
 SCC setup                      ...        0 min,  0.000 sec (  0.532%)
 Dispersion                     ...        0 min,  0.000 sec (  0.420%)
 integral evaluation            ...        0 min,  0.011 sec ( 33.242%)
 zeroth order Hamiltonian       ...        0 min,  0.000 sec (  0.582%)
 iterations                     ...        0 min,  0.004 sec ( 13.666%)
 molecular gradient             ...        0 min,  0.016 sec ( 50.309%)
 printout                       ...        0 min,  0.000 sec (  1.061%)

         :::::::::::::::::::::::::::::::::::::::::::::::::::::
         ::                     SUMMARY                     ::
         :::::::::::::::::::::::::::::::::::::::::::::::::::::
         :: total energy             -34.062966545127 Eh    ::
         :: gradient norm              0.000550265830 Eh/a0 ::
         :: HOMO-LUMO gap              2.265349611753 eV    ::
         ::.................................................::
         :: SCC energy               -34.505128100933 Eh    ::
         :: -> isotropic ES            0.005247709217 Eh    ::
         :: -> anisotropic ES          0.001805310162 Eh    ::
         :: -> anisotropic XC          0.020596421691 Eh    ::
         :: -> dispersion             -0.027613132819 Eh    ::
         :: repulsion energy           0.441945461107 Eh    ::
         :: add. restraining           0.000000000000 Eh    ::
         :::::::::::::::::::::::::::::::::::::::::::::::::::::

           -------------------------------------------------
          |                Property Printout                |
           -------------------------------------------------

    * Orbital Energies and Occupations

         #    Occupation            Energy/Eh            Energy/eV
      -------------------------------------------------------------
         1        2.0000           -0.7417196             -20.1832
       ...           ...                  ...                  ...
        20        2.0000           -0.4833588             -13.1529
        21        2.0000           -0.4800956             -13.0641
        22        2.0000           -0.4782995             -13.0152
        23        2.0000           -0.4660880             -12.6829
        24        2.0000           -0.4576718             -12.4539
        25        2.0000           -0.4521280             -12.3030
        26        2.0000           -0.4495734             -12.2335
        27        2.0000           -0.4455610             -12.1243
        28        2.0000           -0.4386727             -11.9369
        29        2.0000           -0.4125453             -11.2259
        30        2.0000           -0.3926331             -10.6841
        31        2.0000           -0.3693032             -10.0493
        32        2.0000           -0.3605497              -9.8111 (HOMO)
        33                         -0.2772996              -7.5457 (LUMO)
        34                         -0.2336025              -6.3566
        35                         -0.2231747              -6.0729
        36                         -0.1991458              -5.4190
        37                         -0.1912283              -5.2036
        38                         -0.1643067              -4.4710
        39                         -0.1565507              -4.2600
        40                         -0.1292737              -3.5177
        41                         -0.1180889              -3.2134
        42                         -0.0202961              -0.5523
        43                         -0.0138155              -0.3759
       ...                                ...                  ...
        73                          0.6667007              18.1418
      -------------------------------------------------------------
                  HL-Gap            0.0832501 Eh            2.2653 eV
             Fermi-level           -0.3189247 Eh           -8.6784 eV

     #   Z        covCN         q      C6AA      α(0)
     1   6 C      2.985    -0.034    28.850     8.811
     2  16 S      2.349    -0.026   142.121    20.065
     3   6 C      3.006     0.019    27.563     8.612
     4   6 C      3.162     0.026    27.101     8.509
     5   6 C      3.175     0.036    26.801     8.454
     6  16 S      2.026    -0.179   148.643    20.520
     7   6 C      3.794    -0.001    20.609     6.465
     8   6 C      3.838    -0.047    21.385     6.579
     9   6 C      3.795    -0.004    20.660     6.472
    10  16 S      2.017    -0.185   148.922    20.539
    11   6 C      2.938    -0.027    28.666     8.781
    12   6 C      2.838    -0.084    30.086     8.989
    13   1 H      0.926     0.058     2.227     2.334
    14   1 H      0.925     0.060     2.198     2.319
    15   1 H      0.925     0.050     2.314     2.379
    16   1 H      0.924     0.043     2.412     2.429
    17   1 H      0.924     0.046     2.365     2.405
    18   1 H      0.925     0.052     2.298     2.371
    19   1 H      0.925     0.043     2.406     2.425
    20   1 H      0.925     0.045     2.383     2.414
    21   1 H      0.926     0.063     2.169     2.303
    22   1 H      0.926     0.046     2.367     2.406

 Mol. C6AA /au·bohr⁶  :       9395.575166
 Mol. C8AA /au·bohr⁸  :     303821.599928
 Mol. α(0) /au        :        156.579585


Wiberg/Mayer (AO) data.
largest (>0.10) Wiberg bond orders for each atom
          total WBO             WBO to atom ...
     1  C   3.945        C    5 1.558    S    2 1.185    H   13 0.968
     2  S   2.627        C    1 1.185    C    3 1.131
     3  C   3.950        C    4 1.500    S    2 1.131    C   11 1.130
     4  C   3.960        C    3 1.500    C    5 1.221    S   10 1.009
     5  C   3.962        C    1 1.558    C    4 1.221    S    6 1.034
     6  S   2.204        C    5 1.034    C    7 0.971
     7  C   3.974        C    8 1.014    H   14 0.974    H   15 0.973    S    6 0.971
     8  C   3.996        C    7 1.014    C    9 1.011    H   17 0.971    H   16 0.966
     9  C   3.981        C    8 1.011    H   19 0.977    H   18 0.972    S   10 0.970
    10  S   2.161        C    4 1.009    C    9 0.970
    11  C   3.987        C   12 1.865    C    3 1.130    H   20 0.962
    12  C   3.988        C   11 1.865    H   22 0.977    H   21 0.969
    13  H   0.996        C    1 0.968
    14  H   0.996        C    7 0.974
    15  H   0.997        C    7 0.973
    16  H   0.998        C    8 0.966
    17  H   0.998        C    8 0.971
    18  H   0.996        C    9 0.972
    19  H   0.998        C    9 0.977
    20  H   0.997        C   11 0.962
    21  H   0.996        C   12 0.969
    22  H   0.997        C   12 0.977

molecular dipole:
                 x           y           z       tot (Debye)
 q only:        0.403       0.427       0.650
   full:        0.677       0.484       0.918       3.150
molecular quadrupole (traceless):
                xx          xy          yy          xz          yz          zz
 q only:        5.023      -1.000      -1.103       1.003      -0.298      -3.920
  q+dip:        5.662      -0.869      -0.863       0.852      -0.610      -4.799
   full:        6.328      -0.320      -1.742       2.538      -0.008      -4.586

           -------------------------------------------------
          |                Geometry Summary                 |
           -------------------------------------------------

      molecular mass/u    :      214.3580000
   center of mass at/Å    :       -0.3609051       0.2677812      -0.1598543
  moments of inertia/u·Å² :        0.5432233E+03   0.8325264E+03   0.1222994E+04
rotational constants/cm⁻¹ :        0.3103260E-01   0.2024877E-01   0.1378390E-01

 * 18 selected distances

     #   Z        #   Z                                     value/Å
     1   6 C      2  16 S                                 1.7148337
     2  16 S      3   6 C                                 1.7437309 (max)
     3   6 C      4   6 C                                 1.3734891
     1   6 C      5   6 C                                 1.3620883
     4   6 C      5   6 C                                 1.4238002
     7   6 C      8   6 C                                 1.5214492
     8   6 C      9   6 C                                 1.5234926
    11   6 C     12   6 C                                 1.3300447
     1   6 C     13   1 H                                 1.0710610 (min)
     7   6 C     14   1 H                                 1.0903360
     7   6 C     15   1 H                                 1.0895592
     8   6 C     16   1 H                                 1.0932070
     8   6 C     17   1 H                                 1.0931557
     9   6 C     18   1 H                                 1.0899572
     9   6 C     19   1 H                                 1.0905014
    11   6 C     20   1 H                                 1.0835298
    12   6 C     21   1 H                                 1.0748273
    12   6 C     22   1 H                                 1.0762755

 * 3 distinct bonds (by element types)

   Z      Z             #   av. dist./Å        max./Å        min./Å
   1 H    6 C          10     1.0852410     1.0932070     1.0710610
   6 C    6 C           6     1.4223940     1.5234926     1.3300447
   6 C   16 S           2     1.7292823     1.7437309     1.7148337


optimized geometry written to: xtbopt.xyz


           -------------------------------------------------
          | TOTAL ENERGY              -34.062966545127 Eh   |
          | GRADIENT NORM               0.000550265830 Eh/α |
          | HOMO-LUMO GAP               2.265349611753 eV   |
           -------------------------------------------------

------------------------------------------------------------------------
 * finished run on 2021/05/19 at 11:00:40.145     
------------------------------------------------------------------------
 total:
 * wall-time:     0 d,  0 h,  0 min,  0.974 sec
 *  cpu-time:     0 d,  0 h,  0 min,  0.973 sec
 * ratio c/w:     0.999 speedup
 SCF:
 * wall-time:     0 d,  0 h,  0 min,  0.047 sec
 *  cpu-time:     0 d,  0 h,  0 min,  0.047 sec
 * ratio c/w:     1.000 speedup
 ANC optimizer:
 * wall-time:     0 d,  0 h,  0 min,  0.904 sec
 *  cpu-time:     0 d,  0 h,  0 min,  0.904 sec
 * ratio c/w:     1.000 speedup

