      -----------------------------------------------------------      
     |                   =====================                   |     
     |                           x T B                           |     
     |                   =====================                   |     
     |                         S. Grimme                         |     
     |          Mulliken Center for Theoretical Chemistry        |     
     |                    University of Bonn                     |     
     |                Version 6.2 RC2 (SAW190805)                |     
      -----------------------------------------------------------      

   This program is distributed in the hope that it will be useful,
   but WITHOUT ANY WARRANTY; without even the implied warranty of
   MERCHANTABILITY or FITNESS FOR A PARTICULAR PURPOSE.
   
   FOR NON-COMMERCIAL, ACADEMIA USE ONLY.
   
   Cite this work as:
   * S. Grimme, C. Bannwarth, P. Shushkov, J. Chem. Theory Comput., 2017,
     13, 1989-2009. DOI: 10.1021/acs.jctc.7b00118
   * C. Bannwarth, S. Ehlert and S. Grimme., J. Chem. Theory Comput., 2019,
     15, 1652-1671. DOI: 10.1021/acs.jctc.8b01176
   * P. Pracht, E. Caldeweyher, S. Ehlert, S. Grimme, ChemRxiv, 2019, preprint.
     DOI: 10.26434/chemrxiv.8326202.v1
   
   for DFT-D4:
   * E. Caldeweyher, C. Bannwarth and S. Grimme, J. Chem. Phys., 2017,
     147, 034112. DOI: 10.1063/1.4993215
   * E. Caldeweyher, S. Ehlert, A. Hansen, H. Neugebauer, S. Spicher,
     C. Bannwarth and S. Grimme, J. Chem. Phys., 2019, 150, 154122.
     DOI: 10.1063/1.5090222
   
   for sTDA-xTB:
   * S. Grimme and C. Bannwarth, J. Chem. Phys., 2016, 145, 054103.
     DOI: 10.1063/1.4959605
   
   in the mass-spec context:
   * V. Asgeirsson, C. Bauer and S. Grimme, Chem. Sci., 2017, 8, 4879.
     DOI: 10.1039/c7sc00601b
   
   for metadynamics refer to:
   * S. Grimme, J. Chem. Theory Comput., 2019, 155, 2847-2862
     DOI: 10.1021/acs.jctc.9b00143
   
   with help from (in alphabetical order)
   C. Bannwarth, F. Bohle, G. Brandenburg, E. Caldeweyher, M. Checinski,
   S. Dohm, S. Ehlert, S. Ehrlich, F. März, H. Neugebauer, J. Pisarek,
   P. Pracht, P. Shushkov, and S. Spicher.
   
 * started run on 2021/05/19 at 11:00:40.256     

           -------------------------------------------------
          |                Calculation Setup                |
           -------------------------------------------------

          program call               : /ihome/ghutchison/geoffh/xtb/xtb 755.xyz -opt
          hostname                   : smp-n83
          coordinate file            : 755.xyz
          omp threads                :                     1
          number of atoms            :                    23
          number of electrons        :                    76
          charge                     :                     0
          spin                       :                   0.0
          first test random number   :      0.81835113352157


########################################################################
# WARNING! Please study the warnings concerning your input carefully
#  - the use of '-opt' is discouraged, please use '--opt' next time
########################################################################

           ------------------------------------------------- 
          |                 G F N 2 - x T B                 |
          | Geometry, Frequencies, Noncovalent interactions |
          |            JCTC 2019 parametrisation            |
           ------------------------------------------------- 
             KAB for C  - Si     :                1.0500
             KAB for H  - Pd     :                0.9500
             k(s)              :                1.8500
             k(p)              :                2.2300
             k(d)              :                2.2300
             k(f)              :                2.0000
             kEN (H0ij)        :               -2.0000
             D4 a1             :                0.5200
             D4 a2             :                5.0000
             D4 s6             :                1.0000
             D4 s8             :                2.7000
             D4 s9             :                5.0000
             alphaj            :                2.0000

  Z AO/shell   Hii/eV     exponent
  1     Wed Apr 25 08:07:45 CEST 2018   EN: 2.200 GM2: 0.406  GM3: 0.0800  RAES: 1.40
     1s    -10.707211    1.230000
  6     Wed Apr 25 08:07:45 CEST 2018   EN: 2.550 GM2: 0.538  GM3: 0.1500  RAES: 3.00
     2s    -13.970922    2.096432
     2p    -10.063292    1.800000
  8     Wed Apr 25 08:07:45 CEST 2018   EN: 3.440 GM2: 0.452  GM3:-0.0517  RAES: 1.80
     2s    -20.229985    2.439742
     2p    -15.503117    2.137023
 16     Tue Apr 24 11:44:34 CEST 2018   EN: 2.580 GM2: 0.340  GM3:-0.0502  RAES: 3.10
     3s    -20.029654    1.981333
     3p    -11.377694    2.025643
     3d     -0.420282    1.702555

           ------------------------------------------------- 
          |        Self-Consistent Charge Iterations        |
           ------------------------------------------------- 

          ...................................................
          :                      SETUP                      :
          :.................................................:
          :  # basis functions                  74          :
          :  # atomic orbitals                  73          :
          :  # shells                           39          :
          :  # electrons                        76          :
          :  max. iterations                   250          :
          :  Hamiltonian                  GFN2-xTB          :
          :  restarted?                      false          :
          :  GBSA solvation                  false          :
          :  PC potential                    false          :
          :  electronic temp.          300.0000000     K    :
          :  accuracy                    1.0000000          :
          :  -> integral cutoff          0.2500000E+02      :
          :  -> integral neglect         0.1000000E-07      :
          :  -> SCF convergence          0.1000000E-05 Eh   :
          :  -> wf. convergence          0.1000000E-03 e    :
          :  Broyden damping             0.4000000          :
          ...................................................

 iter      E             dE          RMSdq      gap      omega  full diag
   1    -43.5236608 -0.435237E+02  0.500E+00    1.76       0.0  T
   2    -43.5577444 -0.340836E-01  0.294E+00    1.83       1.0  T
   3    -43.5171430  0.406014E-01  0.206E+00    2.07       1.0  T
   4    -43.5526484 -0.355054E-01  0.100E+00    1.79       1.0  T
   5    -43.5747124 -0.220640E-01  0.217E-01    1.86       1.0  T
   6    -43.5750906 -0.378203E-03  0.947E-02    1.85       1.0  T
   7    -43.5751572 -0.666257E-04  0.445E-02    1.84       1.0  T
   8    -43.5751806 -0.233622E-04  0.158E-02    1.85       1.3  T
   9    -43.5751817 -0.114395E-05  0.879E-03    1.85       2.4  T
  10    -43.5751819 -0.201848E-06  0.322E-03    1.85       6.5  T
  11    -43.5751820 -0.109658E-06  0.141E-03    1.85      14.8  T
  12    -43.5751820 -0.103884E-07  0.770E-04    1.85      27.1  T
  13    -43.5751820 -0.469777E-08  0.316E-04    1.85      66.0  T

   *** convergence criteria satisfied after 13 iterations ***

         #    Occupation            Energy/Eh            Energy/eV
      -------------------------------------------------------------
         1        2.0000           -0.7498375             -20.4041
       ...           ...                  ...                  ...
        32        2.0000           -0.4510817             -12.2746
        33        2.0000           -0.4493562             -12.2276
        34        2.0000           -0.4471700             -12.1681
        35        2.0000           -0.4299362             -11.6992
        36        2.0000           -0.4104304             -11.1684
        37        2.0000           -0.4035300             -10.9806
        38        2.0000           -0.3739484             -10.1757 (HOMO)
        39                         -0.3060371              -8.3277 (LUMO)
        40                         -0.2661861              -7.2433
        41                         -0.2326007              -6.3294
        42                         -0.2153652              -5.8604
        43                         -0.2043315              -5.5601
       ...                                ...                  ...
        73                          0.7202461              19.5989
      -------------------------------------------------------------
                  HL-Gap            0.0679113 Eh            1.8480 eV
             Fermi-level           -0.3399927 Eh           -9.2517 eV

 SCC (total)                   0 d,  0 h,  0 min,  0.044 sec
 SCC setup                      ...        0 min,  0.000 sec (  0.739%)
 Dispersion                     ...        0 min,  0.000 sec (  0.817%)
 integral evaluation            ...        0 min,  0.011 sec ( 24.717%)
 zeroth order Hamiltonian       ...        0 min,  0.000 sec (  0.450%)
 iterations                     ...        0 min,  0.017 sec ( 38.521%)
 molecular gradient             ...        0 min,  0.015 sec ( 33.752%)
 printout                       ...        0 min,  0.000 sec (  0.888%)

         :::::::::::::::::::::::::::::::::::::::::::::::::::::
         ::                     SUMMARY                     ::
         :::::::::::::::::::::::::::::::::::::::::::::::::::::
         :: total energy             -43.030509225156 Eh    ::
         :: gradient norm              0.107361672473 Eh/a0 ::
         :: HOMO-LUMO gap              1.847960961832 eV    ::
         ::.................................................::
         :: SCC energy               -43.575182020920 Eh    ::
         :: -> isotropic ES            0.071429209484 Eh    ::
         :: -> anisotropic ES          0.001074796852 Eh    ::
         :: -> anisotropic XC          0.011443474640 Eh    ::
         :: -> dispersion             -0.025542952142 Eh    ::
         :: repulsion energy           0.544623044398 Eh    ::
         :: add. restraining           0.000000000000 Eh    ::
         :::::::::::::::::::::::::::::::::::::::::::::::::::::

      ----------------------------------------------------------- 
     |                   =====================                   |
     |                        A N C O P T                        |
     |                   =====================                   |
     |               Approximate Normal Coordinate               |
     |                Rational Function Optimizer                |
      ----------------------------------------------------------- 

          ...................................................
          :                      SETUP                      :
          :.................................................:
          :   optimization level            normal          :
          :   max. optcycles                   200          :
          :   ANC micro-cycles                  20          :
          :   degrees of freedom                63          :
          :.................................................:
          :   RF solver                   davidson          :
          :   input Hessian                  false          :
          :   write xtbopt.log                true          :
          :   linear?                        false          :
          :   energy convergence         0.5000000E-05 Eh   :
          :   grad. convergence          0.1000000E-02 Eh/α :
          :   maximium RF displ.         2.0000000          :
          :   Hlow (freq-cutoff)         0.5000000E-02      :
          :   Hmax (freq-cutoff)         5.0000000          :
          :   S6 in model hess.         20.0000000          :
          ...................................................

generating ANC from model Hessian ...
Using Lindh-Hessian (1995)
 Shifting diagonal of input Hessian by   3.719492875442963E-003
 Lowest  eigenvalues of input Hessian
   -0.000000   -0.000000   -0.000000   -0.000000   -0.000000    0.000000
    0.005000    0.006265    0.008026    0.008932    0.009636    0.011283
    0.016225    0.020898    0.022862    0.026145    0.031446    0.036454
 Highest eigenvalues
    1.804233    1.852722    1.909265    1.998729    2.052933    2.258842
 

........................................................................
.............................. CYCLE    1 ..............................
........................................................................
   1    -43.5751820 -0.435752E+02  0.154E-04    1.85       0.0  T
   2    -43.5751820 -0.875957E-10  0.113E-04    1.85     185.2  T
   3    -43.5751820 -0.218392E-09  0.561E-05    1.85     371.7  T
     SCC iter.                  ...        0 min,  0.004 sec
     gradient                   ...        0 min,  0.015 sec
 * total energy  :   -43.0305092 Eh     change        0.7104816E-08 Eh
   gradient norm :     0.1073634 Eh/α   predicted     0.0000000E+00 (-100.00%)
   displ. norm   :     0.3160930 α      lambda       -0.1859204E-01
   maximum displ.:     0.1549606 α      in ANC's #28, #27, #17, ...

........................................................................
.............................. CYCLE    2 ..............................
........................................................................
   1    -43.6116826 -0.436117E+02  0.285E-01    1.94       0.0  T
   2    -43.6117982 -0.115622E-03  0.172E-01    1.93       1.0  T
   3    -43.6116999  0.983076E-04  0.102E-01    1.93       1.0  T
   4    -43.6118590 -0.159114E-03  0.287E-02    1.92       1.0  T
   5    -43.6118679 -0.886365E-05  0.156E-02    1.93       1.3  T
   6    -43.6118713 -0.346557E-05  0.773E-03    1.93       2.7  T
   7    -43.6118724 -0.106481E-05  0.244E-03    1.93       8.6  T
   8    -43.6118724 -0.460544E-07  0.118E-03    1.93      17.6  T
     SCC iter.                  ...        0 min,  0.010 sec
     gradient                   ...        0 min,  0.014 sec
 * total energy  :   -43.0434647 Eh     change       -0.1295546E-01 Eh
   gradient norm :     0.0491317 Eh/α   predicted    -0.1022483E-01 ( -21.08%)
   displ. norm   :     0.2409929 α      lambda       -0.5427764E-02
   maximum displ.:     0.0898539 α      in ANC's #17, #28, #27, ...

........................................................................
.............................. CYCLE    3 ..............................
........................................................................
   1    -43.6267835 -0.436268E+02  0.219E-01    2.01       0.0  T
   2    -43.6268301 -0.466103E-04  0.133E-01    2.00       1.0  T
   3    -43.6267490  0.810522E-04  0.817E-02    2.01       1.0  T
   4    -43.6268529 -0.103892E-03  0.263E-02    2.00       1.0  T
   5    -43.6268654 -0.124777E-04  0.121E-02    2.00       1.7  T
   6    -43.6268679 -0.248091E-05  0.354E-03    2.00       5.9  T
   7    -43.6268680 -0.102511E-06  0.169E-03    2.00      12.3  T
     SCC iter.                  ...        0 min,  0.009 sec
     gradient                   ...        0 min,  0.014 sec
 * total energy  :   -43.0464514 Eh     change       -0.2986702E-02 Eh
   gradient norm :     0.0124472 Eh/α   predicted    -0.2871501E-02 (  -3.86%)
   displ. norm   :     0.1181006 α      lambda       -0.3963411E-03
   maximum displ.:     0.0458895 α      in ANC's #4, #5, #2, ...

........................................................................
.............................. CYCLE    4 ..............................
........................................................................
   1    -43.6252960 -0.436253E+02  0.919E-02    2.00       0.0  T
   2    -43.6252987 -0.269619E-05  0.537E-02    2.00       1.0  T
   3    -43.6252790  0.197325E-04  0.336E-02    2.01       1.0  T
   4    -43.6253001 -0.210386E-04  0.854E-03    2.00       2.4  T
   5    -43.6253012 -0.116821E-05  0.368E-03    2.00       5.7  T
   6    -43.6253014 -0.172514E-06  0.121E-03    2.00      17.2  T
   7    -43.6253014 -0.837761E-08  0.629E-04    2.00      33.2  T
     SCC iter.                  ...        0 min,  0.009 sec
     gradient                   ...        0 min,  0.014 sec
 * total energy  :   -43.0467283 Eh     change       -0.2768802E-03 Eh
   gradient norm :     0.0060457 Eh/α   predicted    -0.2009350E-03 ( -27.43%)
   displ. norm   :     0.1521703 α      lambda       -0.2277928E-03
   maximum displ.:     0.0692423 α      in ANC's #2, #4, #5, ...

........................................................................
.............................. CYCLE    5 ..............................
........................................................................
   1    -43.6240712 -0.436241E+02  0.118E-01    2.00       0.0  T
   2    -43.6240731 -0.186247E-05  0.667E-02    2.00       1.0  T
   3    -43.6240315  0.415469E-04  0.491E-02    2.00       1.0  T
   4    -43.6240775 -0.460176E-04  0.967E-03    2.00       2.2  T
   5    -43.6240784 -0.810756E-06  0.541E-03    2.00       3.9  T
   6    -43.6240787 -0.363318E-06  0.138E-03    2.00      15.1  T
   7    -43.6240787 -0.230979E-07  0.661E-04    2.00      31.5  T
     SCC iter.                  ...        0 min,  0.009 sec
     gradient                   ...        0 min,  0.014 sec
 * total energy  :   -43.0468573 Eh     change       -0.1290657E-03 Eh
   gradient norm :     0.0039646 Eh/α   predicted    -0.1165357E-03 (  -9.71%)
   displ. norm   :     0.0920672 α      lambda       -0.8396124E-04
   maximum displ.:     0.0553853 α      in ANC's #4, #2, #6, ...

........................................................................
.............................. CYCLE    6 ..............................
........................................................................
   1    -43.6246154 -0.436246E+02  0.726E-02    1.99       0.0  T
   2    -43.6246161 -0.680772E-06  0.420E-02    1.99       1.0  T
   3    -43.6246040  0.120306E-04  0.264E-02    1.99       1.0  T
   4    -43.6246171 -0.130400E-04  0.550E-03    1.99       3.8  T
   5    -43.6246175 -0.380456E-06  0.288E-03    1.99       7.2  T
   6    -43.6246176 -0.104369E-06  0.708E-04    1.99      29.5  T
   7    -43.6246176 -0.455312E-08  0.339E-04    1.99      61.4  T
     SCC iter.                  ...        0 min,  0.008 sec
     gradient                   ...        0 min,  0.015 sec
 * total energy  :   -43.0469062 Eh     change       -0.4882885E-04 Eh
   gradient norm :     0.0042257 Eh/α   predicted    -0.4233662E-04 ( -13.30%)
   displ. norm   :     0.0922095 α      lambda        0.4724231E-04
   maximum displ.:     0.0553838 α      in ANC's #4, #2, #6, ...

........................................................................
.............................. CYCLE    7 ..............................
........................................................................
   1    -43.6248322 -0.436248E+02  0.722E-02    1.98       0.0  T
   2    -43.6248328 -0.678498E-06  0.418E-02    1.98       1.0  T
   3    -43.6248204  0.124302E-04  0.268E-02    1.98       1.0  T
   4    -43.6248339 -0.134862E-04  0.555E-03    1.98       3.8  T
   5    -43.6248343 -0.393044E-06  0.287E-03    1.98       7.3  T
   6    -43.6248344 -0.102512E-06  0.718E-04    1.98      29.0  T
     SCC iter.                  ...        0 min,  0.007 sec
     gradient                   ...        0 min,  0.014 sec
 * total energy  :   -43.0468834 Eh     change        0.2274390E-04 Eh
   gradient norm :     0.0066702 Eh/α   predicted     0.2382080E-04 (   4.73%)
   displ. norm   :     0.0308958 α      lambda       -0.1024201E-03
   maximum displ.:     0.0140237 α      in ANC's #13, #16, #10, ...

........................................................................
.............................. CYCLE    8 ..............................
........................................................................
   1    -43.6254536 -0.436255E+02  0.302E-02    1.98       0.0  T
   2    -43.6254538 -0.252101E-06  0.182E-02    1.98       1.1  T
   3    -43.6254520  0.181831E-05  0.105E-02    1.98       2.0  T
   4    -43.6254539 -0.193326E-05  0.274E-03    1.98       7.6  T
   5    -43.6254540 -0.129586E-06  0.106E-03    1.98      19.6  T
     SCC iter.                  ...        0 min,  0.007 sec
     gradient                   ...        0 min,  0.014 sec
 * total energy  :   -43.0469494 Eh     change       -0.6599093E-04 Eh
   gradient norm :     0.0030860 Eh/α   predicted    -0.5126059E-04 ( -22.32%)
   displ. norm   :     0.0636548 α      lambda       -0.4220623E-04
   maximum displ.:     0.0420566 α      in ANC's #4, #2, #1, ...

........................................................................
.............................. CYCLE    9 ..............................
........................................................................
   1    -43.6257441 -0.436257E+02  0.386E-02    1.98       0.0  T
   2    -43.6257443 -0.270720E-06  0.226E-02    1.98       1.0  T
   3    -43.6257435  0.790473E-06  0.705E-03    1.98       3.0  T
   4    -43.6257445 -0.933436E-06  0.111E-03    1.98      18.8  T
   5    -43.6257445 -0.511173E-08  0.565E-04    1.98      36.9  T
   6    -43.6257445 -0.308966E-08  0.217E-04    1.98      96.2  T
     SCC iter.                  ...        0 min,  0.008 sec
     gradient                   ...        0 min,  0.015 sec
 * total energy  :   -43.0469792 Eh     change       -0.2982124E-04 Eh
   gradient norm :     0.0016098 Eh/α   predicted    -0.2118987E-04 ( -28.94%)
   displ. norm   :     0.1633910 α      lambda       -0.4148489E-04
   maximum displ.:     0.1105573 α      in ANC's #4, #2, #1, ...

........................................................................
.............................. CYCLE   10 ..............................
........................................................................
   1    -43.6256066 -0.436256E+02  0.102E-01    1.97       0.0  T
   2    -43.6256080 -0.140307E-05  0.599E-02    1.97       1.0  T
   3    -43.6256018  0.624562E-05  0.199E-02    1.97       1.0  T
   4    -43.6256088 -0.702654E-05  0.444E-03    1.97       4.7  T
   5    -43.6256089 -0.126393E-06  0.286E-03    1.97       7.3  T
   6    -43.6256090 -0.102041E-06  0.110E-03    1.97      19.0  T
   7    -43.6256091 -0.183890E-07  0.450E-04    1.97      46.3  T
   8    -43.6256091 -0.119525E-08  0.247E-04    1.97      84.4  T
     SCC iter.                  ...        0 min,  0.010 sec
     gradient                   ...        0 min,  0.015 sec
 * total energy  :   -43.0470062 Eh     change       -0.2702325E-04 Eh
   gradient norm :     0.0036100 Eh/α   predicted    -0.2099112E-04 ( -22.32%)
   displ. norm   :     0.0715516 α      lambda       -0.3241058E-04
   maximum displ.:     0.0469814 α      in ANC's #4, #2, #1, ...

........................................................................
.............................. CYCLE   11 ..............................
........................................................................
   1    -43.6254630 -0.436255E+02  0.466E-02    1.97       0.0  T
   2    -43.6254631 -0.168869E-06  0.273E-02    1.97       1.0  T
   3    -43.6254613  0.184048E-05  0.102E-02    1.97       2.0  T
   4    -43.6254633 -0.197861E-05  0.231E-03    1.97       9.0  T
   5    -43.6254633 -0.245615E-07  0.153E-03    1.97      13.6  T
   6    -43.6254633 -0.394211E-07  0.359E-04    1.97      58.0  T
   7    -43.6254633 -0.102485E-08  0.193E-04    1.97     107.9  T
     SCC iter.                  ...        0 min,  0.009 sec
     gradient                   ...        0 min,  0.015 sec
 * total energy  :   -43.0470286 Eh     change       -0.2235978E-04 Eh
   gradient norm :     0.0027610 Eh/α   predicted    -0.1628898E-04 ( -27.15%)
   displ. norm   :     0.0771707 α      lambda       -0.2314125E-04
   maximum displ.:     0.0490339 α      in ANC's #4, #2, #1, ...

........................................................................
.............................. CYCLE   12 ..............................
........................................................................
   1    -43.6255265 -0.436255E+02  0.494E-02    1.97       0.0  T
   2    -43.6255266 -0.103781E-06  0.287E-02    1.97       1.0  T
   3    -43.6255214  0.517630E-05  0.165E-02    1.97       1.3  T
   4    -43.6255270 -0.552322E-05  0.243E-03    1.97       8.6  T
   5    -43.6255270 -0.291335E-07  0.146E-03    1.97      14.3  T
   6    -43.6255270 -0.376271E-07  0.395E-04    1.97      52.8  T
   7    -43.6255270 -0.234282E-08  0.136E-04    1.97     153.3  T
     SCC iter.                  ...        0 min,  0.008 sec
     gradient                   ...        0 min,  0.015 sec
 * total energy  :   -43.0470443 Eh     change       -0.1571196E-04 Eh
   gradient norm :     0.0013150 Eh/α   predicted    -0.1164228E-04 ( -25.90%)
   displ. norm   :     0.1077593 α      lambda       -0.1035601E-04
   maximum displ.:     0.0658391 α      in ANC's #4, #2, #1, ...

........................................................................
.............................. CYCLE   13 ..............................
........................................................................
   1    -43.6253602 -0.436254E+02  0.676E-02    1.97       0.0  T
   2    -43.6253604 -0.155653E-06  0.393E-02    1.97       1.0  T
   3    -43.6253519  0.845607E-05  0.207E-02    1.97       1.0  T
   4    -43.6253609 -0.901538E-05  0.294E-03    1.97       7.1  T
   5    -43.6253610 -0.297211E-07  0.164E-03    1.97      12.7  T
   6    -43.6253610 -0.478690E-07  0.485E-04    1.97      43.0  T
   7    -43.6253610 -0.320853E-08  0.212E-04    1.97      98.2  T
     SCC iter.                  ...        0 min,  0.009 sec
     gradient                   ...        0 min,  0.015 sec
 * total energy  :   -43.0470521 Eh     change       -0.7750373E-05 Eh
   gradient norm :     0.0012388 Eh/α   predicted    -0.5206586E-05 ( -32.82%)
   displ. norm   :     0.0208175 α      lambda       -0.3454027E-05
   maximum displ.:     0.0139050 α      in ANC's #1, #2, #3, ...

........................................................................
.............................. CYCLE   14 ..............................
........................................................................
   1    -43.6259032 -0.436259E+02  0.123E-02    1.97       0.0  T
   2    -43.6259032 -0.335087E-07  0.735E-03    1.97       2.8  T
   3    -43.6259031  0.100735E-06  0.258E-03    1.97       8.1  T
   4    -43.6259033 -0.114757E-06  0.857E-04    1.97      24.3  T
   5    -43.6259033 -0.775433E-08  0.486E-04    1.97      42.9  T
     SCC iter.                  ...        0 min,  0.006 sec
     gradient                   ...        0 min,  0.015 sec
 * total energy  :   -43.0470535 Eh     change       -0.1418543E-05 Eh
   gradient norm :     0.0008641 Eh/α   predicted    -0.1728222E-05 (  21.83%)
   displ. norm   :     0.0290141 α      lambda       -0.2145164E-05
   maximum displ.:     0.0173018 α      in ANC's #2, #1, #4, ...

   *** GEOMETRY OPTIMIZATION CONVERGED AFTER 14 ITERATIONS ***

------------------------------------------------------------------------
 total energy gain   :        -0.0165443 Eh      -10.3817 kcal/mol
 total RMSD          :         0.2355494 a0        0.1246 Å
 total power (kW/mol):        -3.1026399 (step)  -90.6054 (real)
------------------------------------------------------------------------

 ANCopt (total)                0 d,  0 h,  0 min,  0.479 sec
 optimizer setup                ...        0 min,  0.000 sec (  0.032%)
 model hessian                  ...        0 min,  0.003 sec (  0.665%)
 ANC generation                 ...        0 min,  0.001 sec (  0.147%)
 coordinate transformation      ...        0 min,  0.000 sec (  0.058%)
 single point calculation       ...        0 min,  0.470 sec ( 98.101%)
 optimization log               ...        0 min,  0.001 sec (  0.282%)
 hessian update                 ...        0 min,  0.000 sec (  0.040%)
 rational function              ...        0 min,  0.002 sec (  0.484%)

================
 final structure:
================
$coord
   -2.94499024944701    2.27763564307749   -0.11395891637430      C 
   -5.07542860678745   -0.12065416868331   -0.02936270376520      S 
   -2.74818627803790   -2.43106754285000    0.02407605912406      C 
   -0.36871383669736   -1.32138393967726   -0.08949685559522      C 
   -0.49248969758436    1.39363076557909   -0.14893748852646      C 
    1.75425882516491    2.81411507009145   -0.24514197799806      C 
    4.06982922159959    1.65650606232374   -0.34269996545986      C 
    6.31981166661100    3.37095448856046   -0.42218051744215      C 
    6.08449685862435    5.63334673305119   -0.36669716293809      O 
    8.60495146290221    2.31467894200640   -0.55141508990089      O 
    4.17727123358836   -1.04955625685125   -0.38946358712835      C 
    6.49664452292301   -2.20149500006631   -0.57705020528245      O 
    2.03034067664615   -2.47762956030414   -0.26387068221092      C 
   -3.53890247008700   -5.02614257867845    0.20072276990019      C 
   -2.21119124183376   -6.94172245071983    1.14627125153817      C 
   -3.56859123673467    4.20369250671767   -0.12913148100641      H 
    1.68474704498260    4.85268924764025   -0.25264871511450      H 
    8.50575240991286    0.47980500366389   -0.59121451153702      H 
    6.28319582508940   -4.01209436679742   -0.62193661334225      H 
    2.16647348131915   -4.51245229853944   -0.35604292535660      H 
   -5.45123192220118   -5.36808279957861   -0.44334858734746      H 
   -0.35904916128379   -6.70460289722603    1.94353540621696      H 
   -2.98408429973968   -8.82079809115439    1.20358620877017      H 
$end
           -------------------------------------------------
          |                Final Singlepoint                |
           -------------------------------------------------

          ...................................................
          :                      SETUP                      :
          :.................................................:
          :  # basis functions                  74          :
          :  # atomic orbitals                  73          :
          :  # shells                           39          :
          :  # electrons                        76          :
          :  max. iterations                   250          :
          :  Hamiltonian                  GFN2-xTB          :
          :  restarted?                      false          :
          :  GBSA solvation                  false          :
          :  PC potential                    false          :
          :  electronic temp.          300.0000000     K    :
          :  accuracy                    1.0000000          :
          :  -> integral cutoff          0.2500000E+02      :
          :  -> integral neglect         0.1000000E-07      :
          :  -> SCF convergence          0.1000000E-05 Eh   :
          :  -> wf. convergence          0.1000000E-03 e    :
          :  Broyden damping             0.4000000          :
          ...................................................

 iter      E             dE          RMSdq      gap      omega  full diag
   1    -43.6259033 -0.436259E+02  0.280E-04    1.97       0.0  T
   2    -43.6259033  0.718714E-10  0.127E-04    1.97     164.1  T
   3    -43.6259033 -0.142990E-09  0.167E-04    1.97     124.5  T

   *** convergence criteria satisfied after 3 iterations ***

         #    Occupation            Energy/Eh            Energy/eV
      -------------------------------------------------------------
         1        2.0000           -0.7503972             -20.4193
       ...           ...                  ...                  ...
        32        2.0000           -0.4553939             -12.3919
        33        2.0000           -0.4489399             -12.2163
        34        2.0000           -0.4399956             -11.9729
        35        2.0000           -0.4297136             -11.6931
        36        2.0000           -0.4107583             -11.1773
        37        2.0000           -0.4070621             -11.0767
        38        2.0000           -0.3746313             -10.1942 (HOMO)
        39                         -0.3022614              -8.2250 (LUMO)
        40                         -0.2633634              -7.1665
        41                         -0.2221460              -6.0449
        42                         -0.2152667              -5.8577
        43                         -0.2000021              -5.4423
       ...                                ...                  ...
        73                          0.7196630              19.5830
      -------------------------------------------------------------
                  HL-Gap            0.0723699 Eh            1.9693 eV
             Fermi-level           -0.3384464 Eh           -9.2096 eV

 SCC (total)                   0 d,  0 h,  0 min,  0.030 sec
 SCC setup                      ...        0 min,  0.000 sec (  0.688%)
 Dispersion                     ...        0 min,  0.000 sec (  0.652%)
 integral evaluation            ...        0 min,  0.010 sec ( 34.515%)
 zeroth order Hamiltonian       ...        0 min,  0.000 sec (  0.623%)
 iterations                     ...        0 min,  0.004 sec ( 13.869%)
 molecular gradient             ...        0 min,  0.015 sec ( 48.259%)
 printout                       ...        0 min,  0.000 sec (  1.218%)

         :::::::::::::::::::::::::::::::::::::::::::::::::::::
         ::                     SUMMARY                     ::
         :::::::::::::::::::::::::::::::::::::::::::::::::::::
         :: total energy             -43.047053527229 Eh    ::
         :: gradient norm              0.000865651286 Eh/a0 ::
         :: HOMO-LUMO gap              1.969284798616 eV    ::
         ::.................................................::
         :: SCC energy               -43.625903263162 Eh    ::
         :: -> isotropic ES            0.069744958817 Eh    ::
         :: -> anisotropic ES          0.002048794729 Eh    ::
         :: -> anisotropic XC          0.009226669038 Eh    ::
         :: -> dispersion             -0.025495927152 Eh    ::
         :: repulsion energy           0.578817491806 Eh    ::
         :: add. restraining           0.000000000000 Eh    ::
         :::::::::::::::::::::::::::::::::::::::::::::::::::::

           -------------------------------------------------
          |                Property Printout                |
           -------------------------------------------------

    * Orbital Energies and Occupations

         #    Occupation            Energy/Eh            Energy/eV
      -------------------------------------------------------------
         1        2.0000           -0.7503972             -20.4193
       ...           ...                  ...                  ...
        26        2.0000           -0.4989943             -13.5783
        27        2.0000           -0.4819535             -13.1146
        28        2.0000           -0.4719741             -12.8431
        29        2.0000           -0.4694105             -12.7733
        30        2.0000           -0.4653794             -12.6636
        31        2.0000           -0.4618211             -12.5668
        32        2.0000           -0.4553939             -12.3919
        33        2.0000           -0.4489399             -12.2163
        34        2.0000           -0.4399956             -11.9729
        35        2.0000           -0.4297136             -11.6931
        36        2.0000           -0.4107583             -11.1773
        37        2.0000           -0.4070621             -11.0767
        38        2.0000           -0.3746313             -10.1942 (HOMO)
        39                         -0.3022614              -8.2250 (LUMO)
        40                         -0.2633634              -7.1665
        41                         -0.2221460              -6.0449
        42                         -0.2152667              -5.8577
        43                         -0.2000021              -5.4423
        44                         -0.1672455              -4.5510
        45                         -0.1312684              -3.5720
        46                         -0.0951914              -2.5903
        47                         -0.0171264              -0.4660
        48                          0.0097443               0.2652
        49                          0.0136804               0.3723
       ...                                ...                  ...
        73                          0.7196630              19.5830
      -------------------------------------------------------------
                  HL-Gap            0.0723699 Eh            1.9693 eV
             Fermi-level           -0.3384464 Eh           -9.2096 eV

     #   Z        covCN         q      C6AA      α(0)
     1   6 C      2.924    -0.031    28.783     8.798
     2  16 S      2.353     0.029   139.885    19.906
     3   6 C      2.976     0.008    27.836     8.654
     4   6 C      3.163    -0.002    27.732     8.607
     5   6 C      3.178    -0.002    27.658     8.587
     6   6 C      2.921    -0.022    28.553     8.763
     7   6 C      2.961    -0.053    29.305     8.879
     8   6 C      2.698     0.357    20.932     7.488
     9   8 O      0.857    -0.393    21.532     6.221
    10   8 O      1.659    -0.379    20.451     6.105
    11   6 C      2.841     0.137    25.003     8.195
    12   8 O      1.659    -0.408    21.007     6.187
    13   6 C      2.908    -0.076    29.891     8.965
    14   6 C      2.937    -0.029    28.726     8.790
    15   6 C      2.839    -0.091    30.286     9.019
    16   1 H      0.926     0.057     2.240     2.340
    17   1 H      0.926     0.076     2.024     2.225
    18   1 H      0.804     0.348     0.594     1.210
    19   1 H      0.805     0.308     0.698     1.312
    20   1 H      0.926     0.037     2.489     2.467
    21   1 H      0.925     0.045     2.383     2.414
    22   1 H      0.926     0.041     2.435     2.440
    23   1 H      0.926     0.044     2.397     2.421

 Mol. C6AA /au·bohr⁶  :       8822.950162
 Mol. C8AA /au·bohr⁸  :     241894.251897
 Mol. α(0) /au        :        149.994433


Wiberg/Mayer (AO) data.
largest (>0.10) Wiberg bond orders for each atom
          total WBO             WBO to atom ...
     1  C   3.946        C    5 1.432    S    2 1.269    H   16 0.968    C    3 0.128
     2  S   2.720        C    1 1.269    C    3 1.165
     3  C   3.940        C    4 1.385    S    2 1.165    C   14 1.140    C    1 0.128
     4  C   3.988        C    3 1.385    C   13 1.240    C    5 1.157
     5  C   3.988        C    1 1.432    C    6 1.246    C    4 1.157
     6  C   3.982        C    7 1.540    C    5 1.246    H   17 0.959    C   13 0.103
     7  C   3.981        C    6 1.540    C   11 1.191    C    8 0.994
     8  C   3.924        O    9 1.739    O   10 1.147    C    7 0.994
     9  O   2.043        C    8 1.739    O   10 0.165
    10  O   2.207        C    8 1.147    H   18 0.825    O    9 0.165
    11  C   3.930        C   13 1.532    C    7 1.191    O   12 1.044
    12  O   2.113        C   11 1.044    H   19 0.875
    13  C   3.984        C   11 1.532    C    4 1.240    H   20 0.957    C    6 0.103
    14  C   3.990        C   15 1.854    C    3 1.140    H   21 0.961
    15  C   3.982        C   14 1.854    H   23 0.977    H   22 0.973
    16  H   0.996        C    1 0.968
    17  H   0.994        C    6 0.959
    18  H   0.879        O   10 0.825
    19  H   0.905        O   12 0.875
    20  H   0.998        C   13 0.957
    21  H   0.997        C   14 0.961
    22  H   0.998        C   15 0.973
    23  H   0.997        C   15 0.977

molecular dipole:
                 x           y           z       tot (Debye)
 q only:       -1.141      -1.940      -0.004
   full:       -1.077      -2.423      -0.012       6.741
molecular quadrupole (traceless):
                xx          xy          yy          xz          yz          zz
 q only:       -3.035     -21.359      -0.954       0.501       1.195       3.988
  q+dip:       -6.175     -26.635       2.707       1.295       1.160       3.468
   full:       -7.848     -27.125       0.965       0.973       1.459       6.883

           -------------------------------------------------
          |                Geometry Summary                 |
           -------------------------------------------------

      molecular mass/u    :      220.2424000
   center of mass at/Å    :        0.6131804      -0.0597481      -0.0765203
  moments of inertia/u·Å² :        0.4666247E+03   0.1466718E+04   0.1923826E+04
rotational constants/cm⁻¹ :        0.3612674E-01   0.1149344E-01   0.8762556E-02

 * 22 selected distances

     #   Z        #   Z                                     value/Å
     1   6 C      2  16 S                                 1.6981329
     2  16 S      3   6 C                                 1.7355822 (max)
     3   6 C      4   6 C                                 1.3906579
     1   6 C      5   6 C                                 1.3796664
     4   6 C      5   6 C                                 1.4385602
     5   6 C      6   6 C                                 1.4075429
     6   6 C      7   6 C                                 1.3709105
     8   6 C      9   8 O                                 1.2040231
     8   6 C     10   8 O                                 1.3339344
     7   6 C     11   6 C                                 1.4333285
    11   6 C     12   8 O                                 1.3739916
     4   6 C     13   6 C                                 1.4122960
    11   6 C     13   6 C                                 1.3661055
    14   6 C     15   6 C                                 1.3309966
     1   6 C     16   1 H                                 1.0713459
     6   6 C     17   1 H                                 1.0794014
    10   8 O     18   1 H                                 0.9726196
    12   8 O     19   1 H                                 0.9650553 (min)
    13   6 C     20   1 H                                 1.0802906
    14   6 C     21   1 H                                 1.0830379
    15   6 C     22   1 H                                 1.0744105
    15   6 C     23   1 H                                 1.0756202

 * 5 distinct bonds (by element types)

   Z      Z             #   av. dist./Å        max./Å        min./Å
   1 H    6 C           6     1.0773511     1.0830379     1.0713459
   6 C    6 C           9     1.3922294     1.4385602     1.3309966
   1 H    8 O           2     0.9688374     0.9726196     0.9650553
   6 C    8 O           3     1.3039830     1.3739916     1.2040231
   6 C   16 S           2     1.7168576     1.7355822     1.6981329


optimized geometry written to: xtbopt.xyz


           -------------------------------------------------
          | TOTAL ENERGY              -43.047053527229 Eh   |
          | GRADIENT NORM               0.000865651286 Eh/α |
          | HOMO-LUMO GAP               1.969284798616 eV   |
           -------------------------------------------------

------------------------------------------------------------------------
 * finished run on 2021/05/19 at 11:00:40.834     
------------------------------------------------------------------------
 total:
 * wall-time:     0 d,  0 h,  0 min,  0.578 sec
 *  cpu-time:     0 d,  0 h,  0 min,  0.577 sec
 * ratio c/w:     0.998 speedup
 SCF:
 * wall-time:     0 d,  0 h,  0 min,  0.044 sec
 *  cpu-time:     0 d,  0 h,  0 min,  0.044 sec
 * ratio c/w:     1.000 speedup
 ANC optimizer:
 * wall-time:     0 d,  0 h,  0 min,  0.510 sec
 *  cpu-time:     0 d,  0 h,  0 min,  0.510 sec
 * ratio c/w:     1.000 speedup

