      -----------------------------------------------------------      
     |                   =====================                   |     
     |                           x T B                           |     
     |                   =====================                   |     
     |                         S. Grimme                         |     
     |          Mulliken Center for Theoretical Chemistry        |     
     |                    University of Bonn                     |     
     |                Version 6.2 RC2 (SAW190805)                |     
      -----------------------------------------------------------      

   This program is distributed in the hope that it will be useful,
   but WITHOUT ANY WARRANTY; without even the implied warranty of
   MERCHANTABILITY or FITNESS FOR A PARTICULAR PURPOSE.
   
   FOR NON-COMMERCIAL, ACADEMIA USE ONLY.
   
   Cite this work as:
   * S. Grimme, C. Bannwarth, P. Shushkov, J. Chem. Theory Comput., 2017,
     13, 1989-2009. DOI: 10.1021/acs.jctc.7b00118
   * C. Bannwarth, S. Ehlert and S. Grimme., J. Chem. Theory Comput., 2019,
     15, 1652-1671. DOI: 10.1021/acs.jctc.8b01176
   * P. Pracht, E. Caldeweyher, S. Ehlert, S. Grimme, ChemRxiv, 2019, preprint.
     DOI: 10.26434/chemrxiv.8326202.v1
   
   for DFT-D4:
   * E. Caldeweyher, C. Bannwarth and S. Grimme, J. Chem. Phys., 2017,
     147, 034112. DOI: 10.1063/1.4993215
   * E. Caldeweyher, S. Ehlert, A. Hansen, H. Neugebauer, S. Spicher,
     C. Bannwarth and S. Grimme, J. Chem. Phys., 2019, 150, 154122.
     DOI: 10.1063/1.5090222
   
   for sTDA-xTB:
   * S. Grimme and C. Bannwarth, J. Chem. Phys., 2016, 145, 054103.
     DOI: 10.1063/1.4959605
   
   in the mass-spec context:
   * V. Asgeirsson, C. Bauer and S. Grimme, Chem. Sci., 2017, 8, 4879.
     DOI: 10.1039/c7sc00601b
   
   for metadynamics refer to:
   * S. Grimme, J. Chem. Theory Comput., 2019, 155, 2847-2862
     DOI: 10.1021/acs.jctc.9b00143
   
   with help from (in alphabetical order)
   C. Bannwarth, F. Bohle, G. Brandenburg, E. Caldeweyher, M. Checinski,
   S. Dohm, S. Ehlert, S. Ehrlich, F. März, H. Neugebauer, J. Pisarek,
   P. Pracht, P. Shushkov, and S. Spicher.
   
 * started run on 2021/05/19 at 11:00:42.385     

           -------------------------------------------------
          |                Calculation Setup                |
           -------------------------------------------------

          program call               : /ihome/ghutchison/geoffh/xtb/xtb 759.xyz -opt
          hostname                   : smp-n83
          coordinate file            : 759.xyz
          omp threads                :                     1
          number of atoms            :                    22
          number of electrons        :                    62
          charge                     :                     0
          spin                       :                   0.0
          first test random number   :      0.76238869168006


########################################################################
# WARNING! Please study the warnings concerning your input carefully
#  - the use of '-opt' is discouraged, please use '--opt' next time
########################################################################

           ------------------------------------------------- 
          |                 G F N 2 - x T B                 |
          | Geometry, Frequencies, Noncovalent interactions |
          |            JCTC 2019 parametrisation            |
           ------------------------------------------------- 
             KAB for C  - Si     :                1.0500
             KAB for H  - Pd     :                0.9500
             k(s)              :                1.8500
             k(p)              :                2.2300
             k(d)              :                2.2300
             k(f)              :                2.0000
             kEN (H0ij)        :               -2.0000
             D4 a1             :                0.5200
             D4 a2             :                5.0000
             D4 s6             :                1.0000
             D4 s8             :                2.7000
             D4 s9             :                5.0000
             alphaj            :                2.0000

  Z AO/shell   Hii/eV     exponent
  1     Wed Apr 25 08:07:45 CEST 2018   EN: 2.200 GM2: 0.406  GM3: 0.0800  RAES: 1.40
     1s    -10.707211    1.230000
  6     Wed Apr 25 08:07:45 CEST 2018   EN: 2.550 GM2: 0.538  GM3: 0.1500  RAES: 3.00
     2s    -13.970922    2.096432
     2p    -10.063292    1.800000
  8     Wed Apr 25 08:07:45 CEST 2018   EN: 3.440 GM2: 0.452  GM3:-0.0517  RAES: 1.80
     2s    -20.229985    2.439742
     2p    -15.503117    2.137023
 16     Tue Apr 24 11:44:34 CEST 2018   EN: 2.580 GM2: 0.340  GM3:-0.0502  RAES: 3.10
     3s    -20.029654    1.981333
     3p    -11.377694    2.025643
     3d     -0.420282    1.702555

           ------------------------------------------------- 
          |        Self-Consistent Charge Iterations        |
           ------------------------------------------------- 

          ...................................................
          :                      SETUP                      :
          :.................................................:
          :  # basis functions                  64          :
          :  # atomic orbitals                  63          :
          :  # shells                           35          :
          :  # electrons                        62          :
          :  max. iterations                   250          :
          :  Hamiltonian                  GFN2-xTB          :
          :  restarted?                      false          :
          :  GBSA solvation                  false          :
          :  PC potential                    false          :
          :  electronic temp.          300.0000000     K    :
          :  accuracy                    1.0000000          :
          :  -> integral cutoff          0.2500000E+02      :
          :  -> integral neglect         0.1000000E-07      :
          :  -> SCF convergence          0.1000000E-05 Eh   :
          :  -> wf. convergence          0.1000000E-03 e    :
          :  Broyden damping             0.4000000          :
          ...................................................

 iter      E             dE          RMSdq      gap      omega  full diag
   1    -34.2376125 -0.342376E+02  0.427E+00    2.16       0.0  T
   2    -34.2610121 -0.233996E-01  0.243E+00    2.17       1.0  T
   3    -34.2442900  0.167221E-01  0.121E+00    2.25       1.0  T
   4    -34.2577596 -0.134696E-01  0.649E-01    2.15       1.0  T
   5    -34.2645050 -0.674541E-02  0.206E-01    2.18       1.0  T
   6    -34.2651312 -0.626150E-03  0.835E-02    2.18       1.0  T
   7    -34.2651721 -0.408915E-04  0.397E-02    2.17       1.0  T
   8    -34.2651921 -0.200293E-04  0.159E-02    2.18       1.3  T
   9    -34.2651933 -0.119746E-05  0.723E-03    2.18       3.0  T
  10    -34.2651934 -0.103081E-06  0.388E-03    2.18       5.5  T
  11    -34.2651936 -0.216712E-06  0.103E-03    2.18      20.7  T
  12    -34.2651936 -0.551679E-08  0.556E-04    2.18      38.3  T
  13    -34.2651936 -0.837076E-09  0.217E-04    2.18      98.3  T

   *** convergence criteria satisfied after 13 iterations ***

         #    Occupation            Energy/Eh            Energy/eV
      -------------------------------------------------------------
         1        2.0000           -0.7262718             -19.7629
       ...           ...                  ...                  ...
        25        2.0000           -0.4406876             -11.9917
        26        2.0000           -0.4327977             -11.7770
        27        2.0000           -0.4278582             -11.6426
        28        2.0000           -0.4232456             -11.5171
        29        2.0000           -0.4159744             -11.3192
        30        2.0000           -0.3759650             -10.2305
        31        2.0000           -0.3520219              -9.5790 (HOMO)
        32                         -0.2720276              -7.4022 (LUMO)
        33                         -0.1975463              -5.3755
        34                         -0.1935979              -5.2681
        35                         -0.1912735              -5.2048
        36                         -0.1133367              -3.0840
       ...                                ...                  ...
        63                          0.7527171              20.4825
      -------------------------------------------------------------
                  HL-Gap            0.0799943 Eh            2.1768 eV
             Fermi-level           -0.3120248 Eh           -8.4906 eV

 SCC (total)                   0 d,  0 h,  0 min,  0.035 sec
 SCC setup                      ...        0 min,  0.000 sec (  0.840%)
 Dispersion                     ...        0 min,  0.000 sec (  0.859%)
 integral evaluation            ...        0 min,  0.008 sec ( 22.740%)
 zeroth order Hamiltonian       ...        0 min,  0.000 sec (  0.464%)
 iterations                     ...        0 min,  0.014 sec ( 40.543%)
 molecular gradient             ...        0 min,  0.012 sec ( 33.333%)
 printout                       ...        0 min,  0.000 sec (  1.057%)

         :::::::::::::::::::::::::::::::::::::::::::::::::::::
         ::                     SUMMARY                     ::
         :::::::::::::::::::::::::::::::::::::::::::::::::::::
         :: total energy             -33.791956251074 Eh    ::
         :: gradient norm              0.108974454793 Eh/a0 ::
         :: HOMO-LUMO gap              2.176755486436 eV    ::
         ::.................................................::
         :: SCC energy               -34.265193621098 Eh    ::
         :: -> isotropic ES            0.016592207085 Eh    ::
         :: -> anisotropic ES          0.003688778080 Eh    ::
         :: -> anisotropic XC          0.013493777678 Eh    ::
         :: -> dispersion             -0.021585675997 Eh    ::
         :: repulsion energy           0.473176085766 Eh    ::
         :: add. restraining           0.000000000000 Eh    ::
         :::::::::::::::::::::::::::::::::::::::::::::::::::::

      ----------------------------------------------------------- 
     |                   =====================                   |
     |                        A N C O P T                        |
     |                   =====================                   |
     |               Approximate Normal Coordinate               |
     |                Rational Function Optimizer                |
      ----------------------------------------------------------- 

          ...................................................
          :                      SETUP                      :
          :.................................................:
          :   optimization level            normal          :
          :   max. optcycles                   200          :
          :   ANC micro-cycles                  20          :
          :   degrees of freedom                60          :
          :.................................................:
          :   RF solver                   davidson          :
          :   input Hessian                  false          :
          :   write xtbopt.log                true          :
          :   linear?                        false          :
          :   energy convergence         0.5000000E-05 Eh   :
          :   grad. convergence          0.1000000E-02 Eh/α :
          :   maximium RF displ.         2.0000000          :
          :   Hlow (freq-cutoff)         0.5000000E-02      :
          :   Hmax (freq-cutoff)         5.0000000          :
          :   S6 in model hess.         20.0000000          :
          ...................................................

generating ANC from model Hessian ...
Using Lindh-Hessian (1995)
 Shifting diagonal of input Hessian by   3.230529546996208E-003
 Lowest  eigenvalues of input Hessian
   -0.000000   -0.000000   -0.000000    0.000000    0.000000    0.000000
    0.005000    0.006529    0.006976    0.009122    0.010015    0.013692
    0.014275    0.017366    0.022567    0.026343    0.034147    0.038739
 Highest eigenvalues
    1.592416    1.699706    1.751839    1.854016    1.974524    2.061784
 

........................................................................
.............................. CYCLE    1 ..............................
........................................................................
   1    -34.2651936 -0.342652E+02  0.943E-05    2.18       0.0  T
   2    -34.2651936 -0.880362E-11  0.587E-05    2.18     363.0  T
   3    -34.2651936  0.125127E-10  0.512E-05    2.18     416.7  T
     SCC iter.                  ...        0 min,  0.004 sec
     gradient                   ...        0 min,  0.012 sec
 * total energy  :   -33.7919563 Eh     change       -0.1851554E-07 Eh
   gradient norm :     0.1089753 Eh/α   predicted     0.0000000E+00 (-100.00%)
   displ. norm   :     0.3238467 α      lambda       -0.1896433E-01
   maximum displ.:     0.1771695 α      in ANC's #28, #19, #25, ...

........................................................................
.............................. CYCLE    2 ..............................
........................................................................
   1    -34.2978204 -0.342978E+02  0.285E-01    2.30       0.0  T
   2    -34.2979139 -0.934868E-04  0.182E-01    2.29       1.0  T
   3    -34.2978769  0.369848E-04  0.117E-01    2.30       1.0  T
   4    -34.2980342 -0.157265E-03  0.299E-02    2.29       1.0  T
   5    -34.2980493 -0.150784E-04  0.121E-02    2.29       1.8  T
   6    -34.2980514 -0.209743E-05  0.507E-03    2.29       4.2  T
   7    -34.2980516 -0.252833E-06  0.214E-03    2.29       9.9  T
     SCC iter.                  ...        0 min,  0.007 sec
     gradient                   ...        0 min,  0.011 sec
 * total energy  :   -33.8052878 Eh     change       -0.1333156E-01 Eh
   gradient norm :     0.0530898 Eh/α   predicted    -0.1047662E-01 ( -21.41%)
   displ. norm   :     0.2317807 α      lambda       -0.5651196E-02
   maximum displ.:     0.1132987 α      in ANC's #28, #4, #25, ...

........................................................................
.............................. CYCLE    3 ..............................
........................................................................
   1    -34.3134374 -0.343134E+02  0.231E-01    2.42       0.0  T
   2    -34.3134942 -0.568194E-04  0.143E-01    2.41       1.0  T
   3    -34.3134558  0.383786E-04  0.899E-02    2.42       1.0  T
   4    -34.3135536 -0.977988E-04  0.224E-02    2.41       1.0  T
   5    -34.3135609 -0.727237E-05  0.102E-02    2.41       2.1  T
   6    -34.3135618 -0.945745E-06  0.436E-03    2.41       4.9  T
   7    -34.3135621 -0.272523E-06  0.131E-03    2.41      16.3  T
     SCC iter.                  ...        0 min,  0.007 sec
     gradient                   ...        0 min,  0.011 sec
 * total energy  :   -33.8082855 Eh     change       -0.2997663E-02 Eh
   gradient norm :     0.0123110 Eh/α   predicted    -0.2977399E-02 (  -0.68%)
   displ. norm   :     0.1515322 α      lambda       -0.4192578E-03
   maximum displ.:     0.0905351 α      in ANC's #1, #4, #2, ...

........................................................................
.............................. CYCLE    4 ..............................
........................................................................
   1    -34.3112065 -0.343112E+02  0.109E-01    2.42       0.0  T
   2    -34.3112104 -0.385758E-05  0.653E-02    2.42       1.0  T
   3    -34.3111972  0.132380E-04  0.291E-02    2.42       1.0  T
   4    -34.3112116 -0.144675E-04  0.920E-03    2.42       2.3  T
   5    -34.3112125 -0.902669E-06  0.448E-03    2.42       4.8  T
   6    -34.3112128 -0.251578E-06  0.130E-03    2.42      16.4  T
   7    -34.3112128 -0.109230E-07  0.583E-04    2.42      36.6  T
     SCC iter.                  ...        0 min,  0.007 sec
     gradient                   ...        0 min,  0.011 sec
 * total energy  :   -33.8086030 Eh     change       -0.3175021E-03 Eh
   gradient norm :     0.0059441 Eh/α   predicted    -0.2144421E-03 ( -32.46%)
   displ. norm   :     0.2211141 α      lambda       -0.3497343E-03
   maximum displ.:     0.1504035 α      in ANC's #1, #2, #4, ...

........................................................................
.............................. CYCLE    5 ..............................
........................................................................
   1    -34.3094466 -0.343094E+02  0.165E-01    2.42       0.0  T
   2    -34.3094531 -0.658329E-05  0.986E-02    2.42       1.0  T
   3    -34.3094198  0.333692E-04  0.459E-02    2.43       1.0  T
   4    -34.3094566 -0.368556E-04  0.128E-02    2.42       1.7  T
   5    -34.3094578 -0.119751E-05  0.728E-03    2.42       2.9  T
   6    -34.3094586 -0.782566E-06  0.181E-03    2.42      11.8  T
   7    -34.3094586 -0.155651E-07  0.832E-04    2.42      25.6  T
     SCC iter.                  ...        0 min,  0.007 sec
     gradient                   ...        0 min,  0.011 sec
 * total energy  :   -33.8088431 Eh     change       -0.2401399E-03 Eh
   gradient norm :     0.0061180 Eh/α   predicted    -0.1834177E-03 ( -23.62%)
   displ. norm   :     0.1587303 α      lambda       -0.1712119E-03
   maximum displ.:     0.1238191 α      in ANC's #1, #2, #3, ...

........................................................................
.............................. CYCLE    6 ..............................
........................................................................
   1    -34.3097121 -0.343097E+02  0.126E-01    2.42       0.0  T
   2    -34.3097156 -0.351197E-05  0.729E-02    2.43       1.0  T
   3    -34.3097001  0.154987E-04  0.325E-02    2.43       1.0  T
   4    -34.3097175 -0.173840E-04  0.107E-02    2.43       2.0  T
   5    -34.3097177 -0.273616E-06  0.662E-03    2.43       3.2  T
   6    -34.3097185 -0.748630E-06  0.114E-03    2.43      18.7  T
   7    -34.3097185 -0.644015E-08  0.554E-04    2.43      38.5  T
     SCC iter.                  ...        0 min,  0.007 sec
     gradient                   ...        0 min,  0.011 sec
 * total energy  :   -33.8089794 Eh     change       -0.1362214E-03 Eh
   gradient norm :     0.0071337 Eh/α   predicted    -0.8776700E-04 ( -35.57%)
   displ. norm   :     0.1829217 α      lambda       -0.1878186E-03
   maximum displ.:     0.1513843 α      in ANC's #1, #2, #3, ...

........................................................................
.............................. CYCLE    7 ..............................
........................................................................
   1    -34.3109903 -0.343110E+02  0.143E-01    2.42       0.0  T
   2    -34.3109946 -0.421275E-05  0.818E-02    2.42       1.0  T
   3    -34.3109833  0.112471E-04  0.293E-02    2.43       1.0  T
   4    -34.3109963 -0.129654E-04  0.116E-02    2.43       1.8  T
   5    -34.3109964 -0.117542E-06  0.717E-03    2.43       3.0  T
   6    -34.3109973 -0.957143E-06  0.110E-03    2.43      19.4  T
   7    -34.3109974 -0.509596E-08  0.590E-04    2.43      36.1  T
     SCC iter.                  ...        0 min,  0.007 sec
     gradient                   ...        0 min,  0.011 sec
 * total energy  :   -33.8091246 Eh     change       -0.1452560E-03 Eh
   gradient norm :     0.0056326 Eh/α   predicted    -0.9705917E-04 ( -33.18%)
   displ. norm   :     0.1919228 α      lambda       -0.1337572E-03
   maximum displ.:     0.1648892 α      in ANC's #1, #2, #3, ...

........................................................................
.............................. CYCLE    8 ..............................
........................................................................
   1    -34.3116067 -0.343116E+02  0.149E-01    2.42       0.0  T
   2    -34.3116110 -0.433614E-05  0.842E-02    2.42       1.0  T
   3    -34.3116099  0.113394E-05  0.183E-02    2.42       1.2  T
   4    -34.3116112 -0.132427E-05  0.120E-02    2.42       1.8  T
   5    -34.3116125 -0.130214E-05  0.451E-03    2.42       4.7  T
   6    -34.3116129 -0.401115E-06  0.931E-04    2.42      22.9  T
   7    -34.3116129 -0.570225E-09  0.512E-04    2.42      41.6  T
     SCC iter.                  ...        0 min,  0.007 sec
     gradient                   ...        0 min,  0.011 sec
 * total energy  :   -33.8092220 Eh     change       -0.9741038E-04 Eh
   gradient norm :     0.0034975 Eh/α   predicted    -0.6934534E-04 ( -28.81%)
   displ. norm   :     0.1284168 α      lambda       -0.6680707E-04
   maximum displ.:     0.1209879 α      in ANC's #1, #2, #11, ...

........................................................................
.............................. CYCLE    9 ..............................
........................................................................
   1    -34.3124970 -0.343125E+02  0.942E-02    2.42       0.0  T
   2    -34.3124989 -0.183912E-05  0.514E-02    2.42       1.0  T
   3    -34.3124990 -0.866446E-07  0.101E-02    2.42       2.1  T
   4    -34.3124982  0.751204E-06  0.878E-03    2.42       2.4  T
   5    -34.3124995 -0.125892E-05  0.116E-03    2.42      18.3  T
   6    -34.3124995 -0.158057E-07  0.534E-04    2.42      39.9  T
   7    -34.3124995 -0.222936E-08  0.270E-04    2.42      78.8  T
     SCC iter.                  ...        0 min,  0.007 sec
     gradient                   ...        0 min,  0.012 sec
 * total energy  :   -33.8092659 Eh     change       -0.4388602E-04 Eh
   gradient norm :     0.0023323 Eh/α   predicted    -0.3396079E-04 ( -22.62%)
   displ. norm   :     0.1111347 α      lambda       -0.3427560E-04
   maximum displ.:     0.1030308 α      in ANC's #1, #8, #3, ...

........................................................................
.............................. CYCLE   10 ..............................
........................................................................
   1    -34.3120555 -0.343121E+02  0.836E-02    2.42       0.0  T
   2    -34.3120569 -0.143728E-05  0.465E-02    2.42       1.0  T
   3    -34.3120561  0.787604E-06  0.115E-02    2.42       1.9  T
   4    -34.3120570 -0.821160E-06  0.724E-03    2.42       2.9  T
   5    -34.3120574 -0.439073E-06  0.272E-03    2.42       7.9  T
   6    -34.3120575 -0.139410E-06  0.588E-04    2.42      36.3  T
   7    -34.3120575 -0.242472E-08  0.293E-04    2.42      72.7  T
     SCC iter.                  ...        0 min,  0.007 sec
     gradient                   ...        0 min,  0.012 sec
 * total energy  :   -33.8092880 Eh     change       -0.2210373E-04 Eh
   gradient norm :     0.0015562 Eh/α   predicted    -0.1734974E-04 ( -21.51%)
   displ. norm   :     0.0694040 α      lambda       -0.1600815E-04
   maximum displ.:     0.0610456 α      in ANC's #1, #2, #3, ...

........................................................................
.............................. CYCLE   11 ..............................
........................................................................
   1    -34.3124193 -0.343124E+02  0.492E-02    2.42       0.0  T
   2    -34.3124200 -0.686475E-06  0.254E-02    2.42       1.0  T
   3    -34.3124194  0.579287E-06  0.758E-03    2.42       2.8  T
   4    -34.3124202 -0.726236E-06  0.362E-03    2.42       5.9  T
   5    -34.3124202 -0.397607E-07  0.204E-03    2.42      10.5  T
   6    -34.3124203 -0.691638E-07  0.438E-04    2.42      48.7  T
   7    -34.3124203 -0.287694E-08  0.143E-04    2.42     148.9  T
     SCC iter.                  ...        0 min,  0.007 sec
     gradient                   ...        0 min,  0.012 sec
 * total energy  :   -33.8093055 Eh     change       -0.1752485E-04 Eh
   gradient norm :     0.0014500 Eh/α   predicted    -0.8021740E-05 ( -54.23%)
   displ. norm   :     0.0936135 α      lambda       -0.1563374E-04
   maximum displ.:     0.0800914 α      in ANC's #1, #3, #2, ...

........................................................................
.............................. CYCLE   12 ..............................
........................................................................
   1    -34.3122279 -0.343122E+02  0.661E-02    2.42       0.0  T
   2    -34.3122289 -0.104068E-05  0.342E-02    2.42       1.0  T
   3    -34.3122283  0.632857E-06  0.874E-03    2.42       2.4  T
   4    -34.3122289 -0.685053E-06  0.523E-03    2.42       4.1  T
   5    -34.3122292 -0.229710E-06  0.185E-03    2.42      11.5  T
   6    -34.3122292 -0.590188E-07  0.336E-04    2.42      63.4  T
   7    -34.3122292 -0.188798E-08  0.110E-04    2.42     193.5  T
     SCC iter.                  ...        0 min,  0.007 sec
     gradient                   ...        0 min,  0.012 sec
 * total energy  :   -33.8093222 Eh     change       -0.1661562E-04 Eh
   gradient norm :     0.0014032 Eh/α   predicted    -0.7848412E-05 ( -52.76%)
   displ. norm   :     0.0661031 α      lambda       -0.9482475E-05
   maximum displ.:     0.0479111 α      in ANC's #1, #3, #2, ...

........................................................................
.............................. CYCLE   13 ..............................
........................................................................
   1    -34.3121538 -0.343122E+02  0.491E-02    2.42       0.0  T
   2    -34.3121543 -0.546541E-06  0.254E-02    2.42       1.0  T
   3    -34.3121532  0.107822E-05  0.901E-03    2.42       2.4  T
   4    -34.3121545 -0.124510E-05  0.370E-03    2.42       5.8  T
   5    -34.3121545 -0.684566E-07  0.930E-04    2.42      22.9  T
   6    -34.3121546 -0.181873E-07  0.187E-04    2.42     113.8  T
     SCC iter.                  ...        0 min,  0.006 sec
     gradient                   ...        0 min,  0.012 sec
 * total energy  :   -33.8093311 Eh     change       -0.8952284E-05 Eh
   gradient norm :     0.0011114 Eh/α   predicted    -0.4754209E-05 ( -46.89%)
   displ. norm   :     0.0587105 α      lambda       -0.5092426E-05
   maximum displ.:     0.0374870 α      in ANC's #1, #3, #5, ...

........................................................................
.............................. CYCLE   14 ..............................
........................................................................
   1    -34.3121963 -0.343122E+02  0.363E-02    2.42       0.0  T
   2    -34.3121965 -0.248552E-06  0.198E-02    2.42       1.1  T
   3    -34.3121964  0.109030E-06  0.429E-03    2.42       5.0  T
   4    -34.3121965 -0.151769E-06  0.226E-03    2.42       9.4  T
   5    -34.3121966 -0.326699E-07  0.640E-04    2.42      33.3  T
   6    -34.3121966 -0.610807E-08  0.273E-04    2.42      78.1  T
     SCC iter.                  ...        0 min,  0.006 sec
     gradient                   ...        0 min,  0.012 sec
 * total energy  :   -33.8093357 Eh     change       -0.4640161E-05 Eh
   gradient norm :     0.0005026 Eh/α   predicted    -0.2554775E-05 ( -44.94%)
   displ. norm   :     0.0228214 α      lambda       -0.1015782E-05
   maximum displ.:     0.0154562 α      in ANC's #1, #5, #4, ...

   *** GEOMETRY OPTIMIZATION CONVERGED AFTER 14 ITERATIONS ***

------------------------------------------------------------------------
 total energy gain   :        -0.0173795 Eh      -10.9058 kcal/mol
 total RMSD          :         0.3190958 a0        0.1689 Å
 total power (kW/mol):        -3.2592759 (step) -119.8503 (real)
------------------------------------------------------------------------

 ANCopt (total)                0 d,  0 h,  0 min,  0.381 sec
 optimizer setup                ...        0 min,  0.000 sec (  0.042%)
 model hessian                  ...        0 min,  0.003 sec (  0.903%)
 ANC generation                 ...        0 min,  0.001 sec (  0.178%)
 coordinate transformation      ...        0 min,  0.000 sec (  0.066%)
 single point calculation       ...        0 min,  0.372 sec ( 97.652%)
 optimization log               ...        0 min,  0.001 sec (  0.349%)
 hessian update                 ...        0 min,  0.000 sec (  0.048%)
 rational function              ...        0 min,  0.002 sec (  0.523%)

================
 final structure:
================
$coord
   -3.14314077248513   -2.32102681245522    0.19427682209407      C 
   -5.25051342172402    0.10569340757041    0.50742797608922      S 
   -2.89273085351143    2.31760311841332    0.56383537119826      C 
   -0.54401280111517    1.23319554361447    0.34883876478473      C 
   -0.69075660994551   -1.47121122138292    0.13404967271513      C 
    1.57348190205971   -2.88352667940639   -0.10023446772885      C 
    3.85092962749999   -1.69902939209035   -0.12099843407423      C 
    6.28229463434286   -3.11949825543315   -0.36337093251260      C 
    3.97994599249082    1.00957625906013    0.09319942284967      C 
    6.38317306550466    1.94458974154898    0.04478754291937      O 
    6.71942985869184    4.56754586838566    0.25911249540507      C 
    1.84777138724354    2.43907066410591    0.32194043140023      C 
   -3.81363744143607   -4.22774720480749    0.07330612192834      H 
   -3.36065290168728    4.27858342693765    0.74964282788216      H 
    1.45778528257815   -4.91496199570184   -0.25962265996436      H 
    5.93912532096799   -5.14174159910873   -0.46483558515033      H 
    7.49950423890821   -2.71642363317167    1.24585393897589      H 
    7.28672268540578   -2.51688038548008   -2.05569746628683      H 
    8.75278377192981    4.87955171234052    0.18813279104414      H 
    5.97877257978568    5.28420466174984    2.05407054773881      H 
    5.81694342333154    5.58068003353319   -1.30378967364273      H 
    1.90641799440027    4.46943112652151    0.48383674130248      H 
$end
           -------------------------------------------------
          |                Final Singlepoint                |
           -------------------------------------------------

          ...................................................
          :                      SETUP                      :
          :.................................................:
          :  # basis functions                  64          :
          :  # atomic orbitals                  63          :
          :  # shells                           35          :
          :  # electrons                        62          :
          :  max. iterations                   250          :
          :  Hamiltonian                  GFN2-xTB          :
          :  restarted?                      false          :
          :  GBSA solvation                  false          :
          :  PC potential                    false          :
          :  electronic temp.          300.0000000     K    :
          :  accuracy                    1.0000000          :
          :  -> integral cutoff          0.2500000E+02      :
          :  -> integral neglect         0.1000000E-07      :
          :  -> SCF convergence          0.1000000E-05 Eh   :
          :  -> wf. convergence          0.1000000E-03 e    :
          :  Broyden damping             0.4000000          :
          ...................................................

 iter      E             dE          RMSdq      gap      omega  full diag
   1    -34.3121966 -0.343122E+02  0.167E-04    2.42       0.0  T
   2    -34.3121966 -0.397904E-12  0.642E-05    2.42     332.1  T
   3    -34.3121966  0.618456E-10  0.101E-04    2.42     211.1  T

   *** convergence criteria satisfied after 3 iterations ***

         #    Occupation            Energy/Eh            Energy/eV
      -------------------------------------------------------------
         1        2.0000           -0.7273313             -19.7917
       ...           ...                  ...                  ...
        25        2.0000           -0.4433186             -12.0633
        26        2.0000           -0.4387280             -11.9384
        27        2.0000           -0.4250263             -11.5656
        28        2.0000           -0.4199453             -11.4273
        29        2.0000           -0.4139041             -11.2629
        30        2.0000           -0.3782050             -10.2915
        31        2.0000           -0.3548661              -9.6564 (HOMO)
        32                         -0.2658727              -7.2348 (LUMO)
        33                         -0.1925795              -5.2404
        34                         -0.1907720              -5.1912
        35                         -0.1860287              -5.0621
        36                         -0.1098242              -2.9885
       ...                                ...                  ...
        63                          0.7489115              20.3789
      -------------------------------------------------------------
                  HL-Gap            0.0889934 Eh            2.4216 eV
             Fermi-level           -0.3103694 Eh           -8.4456 eV

 SCC (total)                   0 d,  0 h,  0 min,  0.024 sec
 SCC setup                      ...        0 min,  0.000 sec (  0.714%)
 Dispersion                     ...        0 min,  0.000 sec (  0.758%)
 integral evaluation            ...        0 min,  0.008 sec ( 31.807%)
 zeroth order Hamiltonian       ...        0 min,  0.000 sec (  0.564%)
 iterations                     ...        0 min,  0.004 sec ( 15.128%)
 molecular gradient             ...        0 min,  0.012 sec ( 49.276%)
 printout                       ...        0 min,  0.000 sec (  1.546%)

         :::::::::::::::::::::::::::::::::::::::::::::::::::::
         ::                     SUMMARY                     ::
         :::::::::::::::::::::::::::::::::::::::::::::::::::::
         :: total energy             -33.809335749006 Eh    ::
         :: gradient norm              0.000503371171 Eh/a0 ::
         :: HOMO-LUMO gap              2.421634556883 eV    ::
         ::.................................................::
         :: SCC energy               -34.312196584147 Eh    ::
         :: -> isotropic ES            0.015852476805 Eh    ::
         :: -> anisotropic ES          0.003582361338 Eh    ::
         :: -> anisotropic XC          0.011809813513 Eh    ::
         :: -> dispersion             -0.021622058959 Eh    ::
         :: repulsion energy           0.502811300939 Eh    ::
         :: add. restraining           0.000000000000 Eh    ::
         :::::::::::::::::::::::::::::::::::::::::::::::::::::

           -------------------------------------------------
          |                Property Printout                |
           -------------------------------------------------

    * Orbital Energies and Occupations

         #    Occupation            Energy/Eh            Energy/eV
      -------------------------------------------------------------
         1        2.0000           -0.7273313             -19.7917
       ...           ...                  ...                  ...
        19        2.0000           -0.4810980             -13.0913
        20        2.0000           -0.4793877             -13.0448
        21        2.0000           -0.4695012             -12.7758
        22        2.0000           -0.4666720             -12.6988
        23        2.0000           -0.4624016             -12.5826
        24        2.0000           -0.4580910             -12.4653
        25        2.0000           -0.4433186             -12.0633
        26        2.0000           -0.4387280             -11.9384
        27        2.0000           -0.4250263             -11.5656
        28        2.0000           -0.4199453             -11.4273
        29        2.0000           -0.4139041             -11.2629
        30        2.0000           -0.3782050             -10.2915
        31        2.0000           -0.3548661              -9.6564 (HOMO)
        32                         -0.2658727              -7.2348 (LUMO)
        33                         -0.1925795              -5.2404
        34                         -0.1907720              -5.1912
        35                         -0.1860287              -5.0621
        36                         -0.1098242              -2.9885
        37                         -0.0802272              -2.1831
        38                          0.0051461               0.1400
        39                          0.0337286               0.9178
        40                          0.0352262               0.9586
        41                          0.0447501               1.2177
        42                          0.0973301               2.6485
       ...                                ...                  ...
        63                          0.7489115              20.3789
      -------------------------------------------------------------
                  HL-Gap            0.0889934 Eh            2.4216 eV
             Fermi-level           -0.3103694 Eh           -8.4456 eV

     #   Z        covCN         q      C6AA      α(0)
     1   6 C      2.930    -0.035    28.882     8.813
     2  16 S      2.306    -0.011   141.514    20.022
     3   6 C      2.931    -0.040    28.996     8.831
     4   6 C      3.179    -0.003    27.682     8.590
     5   6 C      3.179    -0.007    27.762     8.602
     6   6 C      2.912    -0.049    29.218     8.864
     7   6 C      2.962     0.003    27.960     8.673
     8   6 C      3.759    -0.107    22.591     6.776
     9   6 C      2.867     0.133    25.087     8.210
    10   8 O      1.705    -0.267    18.428     5.796
    11   6 C      3.645     0.039    20.253     6.468
    12   6 C      2.905    -0.083    30.074     8.992
    13   1 H      0.926     0.040     2.449     2.447
    14   1 H      0.926     0.038     2.478     2.462
    15   1 H      0.926     0.034     2.532     2.488
    16   1 H      0.925     0.041     2.434     2.440
    17   1 H      0.925     0.055     2.256     2.349
    18   1 H      0.925     0.055     2.261     2.352
    19   1 H      0.925     0.059     2.211     2.325
    20   1 H      0.924     0.038     2.471     2.458
    21   1 H      0.924     0.038     2.472     2.459
    22   1 H      0.926     0.029     2.595     2.519

 Mol. C6AA /au·bohr⁶  :       6941.172722
 Mol. C8AA /au·bohr⁸  :     188380.374664
 Mol. α(0) /au        :        132.936111


Wiberg/Mayer (AO) data.
largest (>0.10) Wiberg bond orders for each atom
          total WBO             WBO to atom ...
     1  C   3.934        C    5 1.478    S    2 1.232    H   13 0.971    C    3 0.152
     2  S   2.703        C    1 1.232    C    3 1.222
     3  C   3.935        C    4 1.478    S    2 1.222    H   14 0.971    C    1 0.152
     4  C   3.988        C    3 1.478    C   12 1.208    C    5 1.153
     5  C   3.988        C    1 1.478    C    6 1.204    C    4 1.153
     6  C   3.990        C    7 1.613    C    5 1.204    H   15 0.966
     7  C   3.988        C    6 1.613    C    9 1.162    C    8 1.030
     8  C   3.994        C    7 1.030    H   16 0.986    H   17 0.969    H   18 0.969
     9  C   3.932        C   12 1.544    C    7 1.162    O   10 1.056
    10  O   2.227        C    9 1.056    C   11 0.989
    11  C   3.950        O   10 0.989    H   19 0.980    H   20 0.976    H   21 0.976
    12  C   3.982        C    9 1.544    C    4 1.208    H   22 0.964
    13  H   0.998        C    1 0.971
    14  H   0.998        C    3 0.971
    15  H   0.998        C    6 0.966
    16  H   0.998        C    8 0.986
    17  H   0.993        C    8 0.969
    18  H   0.993        C    8 0.969
    19  H   0.996        C   11 0.980
    20  H   0.998        C   11 0.976
    21  H   0.998        C   11 0.976
    22  H   0.998        C   12 0.964

molecular dipole:
                 x           y           z       tot (Debye)
 q only:        0.339       0.216       0.004
   full:        0.539       0.370       0.005       1.661
molecular quadrupole (traceless):
                xx          xy          yy          xz          yz          zz
 q only:        0.019       3.068       4.004       0.189       0.600      -4.023
  q+dip:       -2.732       4.004       8.003       0.405       1.028      -5.271
   full:       -3.996       4.268       7.468       0.591       0.826      -3.471

           -------------------------------------------------
          |                Geometry Summary                 |
           -------------------------------------------------

      molecular mass/u    :      178.2484000
   center of mass at/Å    :        0.5211384       0.1199024       0.0999988
  moments of inertia/u·Å² :        0.2795186E+03   0.9592319E+03   0.1232434E+04
rotational constants/cm⁻¹ :        0.6030952E-01   0.1757409E-01   0.1367833E-01

 * 21 selected distances

     #   Z        #   Z                                     value/Å
     1   6 C      2  16 S                                 1.7088456
     2  16 S      3   6 C                                 1.7110409 (max)
     3   6 C      4   6 C                                 1.3736854
     1   6 C      5   6 C                                 1.3738243
     4   6 C      5   6 C                                 1.4377157
     5   6 C      6   6 C                                 1.4175927
     6   6 C      7   6 C                                 1.3584747
     9   6 C     10   8 O                                 1.3648357
    10   8 O     11   6 C                                 1.4039565
     4   6 C     12   6 C                                 1.4175127
     9   6 C     12   6 C                                 1.3637941
     1   6 C     13   1 H                                 1.0714738
     3   6 C     14   1 H                                 1.0713610 (min)
     6   6 C     15   1 H                                 1.0800299
     8   6 C     16   1 H                                 1.0867513
     8   6 C     17   1 H                                 1.0888294
     8   6 C     18   1 H                                 1.0891277
    11   6 C     19   1 H                                 1.0892460
    11   6 C     20   1 H                                 1.0952879
    11   6 C     21   1 H                                 1.0952289
    12   6 C     22   1 H                                 1.0782775

 * 4 distinct bonds (by element types)

   Z      Z             #   av. dist./Å        max./Å        min./Å
   1 H    6 C          10     1.0845614     1.0952879     1.0713610
   6 C    6 C           7     1.3917999     1.4377157     1.3584747
   6 C    8 O           2     1.3843961     1.4039565     1.3648357
   6 C   16 S           2     1.7099432     1.7110409     1.7088456


optimized geometry written to: xtbopt.xyz


           -------------------------------------------------
          | TOTAL ENERGY              -33.809335749006 Eh   |
          | GRADIENT NORM               0.000503371171 Eh/α |
          | HOMO-LUMO GAP               2.421634556883 eV   |
           -------------------------------------------------

------------------------------------------------------------------------
 * finished run on 2021/05/19 at 11:00:42.847     
------------------------------------------------------------------------
 total:
 * wall-time:     0 d,  0 h,  0 min,  0.462 sec
 *  cpu-time:     0 d,  0 h,  0 min,  0.461 sec
 * ratio c/w:     0.998 speedup
 SCF:
 * wall-time:     0 d,  0 h,  0 min,  0.036 sec
 *  cpu-time:     0 d,  0 h,  0 min,  0.035 sec
 * ratio c/w:     0.996 speedup
 ANC optimizer:
 * wall-time:     0 d,  0 h,  0 min,  0.406 sec
 *  cpu-time:     0 d,  0 h,  0 min,  0.406 sec
 * ratio c/w:     1.000 speedup

