      -----------------------------------------------------------      
     |                   =====================                   |     
     |                           x T B                           |     
     |                   =====================                   |     
     |                         S. Grimme                         |     
     |          Mulliken Center for Theoretical Chemistry        |     
     |                    University of Bonn                     |     
     |                Version 6.2 RC2 (SAW190805)                |     
      -----------------------------------------------------------      

   This program is distributed in the hope that it will be useful,
   but WITHOUT ANY WARRANTY; without even the implied warranty of
   MERCHANTABILITY or FITNESS FOR A PARTICULAR PURPOSE.
   
   FOR NON-COMMERCIAL, ACADEMIA USE ONLY.
   
   Cite this work as:
   * S. Grimme, C. Bannwarth, P. Shushkov, J. Chem. Theory Comput., 2017,
     13, 1989-2009. DOI: 10.1021/acs.jctc.7b00118
   * C. Bannwarth, S. Ehlert and S. Grimme., J. Chem. Theory Comput., 2019,
     15, 1652-1671. DOI: 10.1021/acs.jctc.8b01176
   * P. Pracht, E. Caldeweyher, S. Ehlert, S. Grimme, ChemRxiv, 2019, preprint.
     DOI: 10.26434/chemrxiv.8326202.v1
   
   for DFT-D4:
   * E. Caldeweyher, C. Bannwarth and S. Grimme, J. Chem. Phys., 2017,
     147, 034112. DOI: 10.1063/1.4993215
   * E. Caldeweyher, S. Ehlert, A. Hansen, H. Neugebauer, S. Spicher,
     C. Bannwarth and S. Grimme, J. Chem. Phys., 2019, 150, 154122.
     DOI: 10.1063/1.5090222
   
   for sTDA-xTB:
   * S. Grimme and C. Bannwarth, J. Chem. Phys., 2016, 145, 054103.
     DOI: 10.1063/1.4959605
   
   in the mass-spec context:
   * V. Asgeirsson, C. Bauer and S. Grimme, Chem. Sci., 2017, 8, 4879.
     DOI: 10.1039/c7sc00601b
   
   for metadynamics refer to:
   * S. Grimme, J. Chem. Theory Comput., 2019, 155, 2847-2862
     DOI: 10.1021/acs.jctc.9b00143
   
   with help from (in alphabetical order)
   C. Bannwarth, F. Bohle, G. Brandenburg, E. Caldeweyher, M. Checinski,
   S. Dohm, S. Ehlert, S. Ehrlich, F. März, H. Neugebauer, J. Pisarek,
   P. Pracht, P. Shushkov, and S. Spicher.
   
 * started run on 2021/05/19 at 11:00:43.440     

           -------------------------------------------------
          |                Calculation Setup                |
           -------------------------------------------------

          program call               : /ihome/ghutchison/geoffh/xtb/xtb 762.xyz -opt
          hostname                   : smp-n83
          coordinate file            : 762.xyz
          omp threads                :                     1
          number of atoms            :                    23
          number of electrons        :                    86
          charge                     :                     0
          spin                       :                   0.0
          first test random number   :      0.97735042268167


########################################################################
# WARNING! Please study the warnings concerning your input carefully
#  - the use of '-opt' is discouraged, please use '--opt' next time
########################################################################

           ------------------------------------------------- 
          |                 G F N 2 - x T B                 |
          | Geometry, Frequencies, Noncovalent interactions |
          |            JCTC 2019 parametrisation            |
           ------------------------------------------------- 
             KAB for C  - Si     :                1.0500
             KAB for H  - Pd     :                0.9500
             k(s)              :                1.8500
             k(p)              :                2.2300
             k(d)              :                2.2300
             k(f)              :                2.0000
             kEN (H0ij)        :               -2.0000
             D4 a1             :                0.5200
             D4 a2             :                5.0000
             D4 s6             :                1.0000
             D4 s8             :                2.7000
             D4 s9             :                5.0000
             alphaj            :                2.0000

  Z AO/shell   Hii/eV     exponent
  1     Wed Apr 25 08:07:45 CEST 2018   EN: 2.200 GM2: 0.406  GM3: 0.0800  RAES: 1.40
     1s    -10.707211    1.230000
  6     Wed Apr 25 08:07:45 CEST 2018   EN: 2.550 GM2: 0.538  GM3: 0.1500  RAES: 3.00
     2s    -13.970922    2.096432
     2p    -10.063292    1.800000
  7     Wed Apr 25 08:07:45 CEST 2018   EN: 3.040 GM2: 0.461  GM3:-0.0640  RAES: 1.90
     2s    -16.686243    2.339881
     2p    -12.523956    2.014332
  9     Mon Apr 23 13:58:50 CEST 2018   EN: 3.980 GM2: 0.532  GM3: 0.1426  RAES: 2.40
     2s    -23.458179    2.416361
     2p    -15.746583    2.308399
 16     Tue Apr 24 11:44:34 CEST 2018   EN: 2.580 GM2: 0.340  GM3:-0.0502  RAES: 3.10
     3s    -20.029654    1.981333
     3p    -11.377694    2.025643
     3d     -0.420282    1.702555

           ------------------------------------------------- 
          |        Self-Consistent Charge Iterations        |
           ------------------------------------------------- 

          ...................................................
          :                      SETUP                      :
          :.................................................:
          :  # basis functions                  80          :
          :  # atomic orbitals                  79          :
          :  # shells                           41          :
          :  # electrons                        86          :
          :  max. iterations                   250          :
          :  Hamiltonian                  GFN2-xTB          :
          :  restarted?                      false          :
          :  GBSA solvation                  false          :
          :  PC potential                    false          :
          :  electronic temp.          300.0000000     K    :
          :  accuracy                    1.0000000          :
          :  -> integral cutoff          0.2500000E+02      :
          :  -> integral neglect         0.1000000E-07      :
          :  -> SCF convergence          0.1000000E-05 Eh   :
          :  -> wf. convergence          0.1000000E-03 e    :
          :  Broyden damping             0.4000000          :
          ...................................................

 iter      E             dE          RMSdq      gap      omega  full diag
   1    -49.5491517 -0.495492E+02  0.551E+00    1.88       0.0  T
   2    -49.6014009 -0.522492E-01  0.347E+00    1.88       1.0  T
   3    -49.5593302  0.420707E-01  0.236E+00    1.85       1.0  T
   4    -49.6301590 -0.708288E-01  0.779E-01    1.86       1.0  T
   5    -49.6398870 -0.972797E-02  0.268E-01    1.85       1.0  T
   6    -49.6408255 -0.938541E-03  0.136E-01    1.85       1.0  T
   7    -49.6410388 -0.213312E-03  0.513E-02    1.85       1.0  T
   8    -49.6410814 -0.425477E-04  0.211E-02    1.85       1.0  T
   9    -49.6410836 -0.227746E-05  0.851E-03    1.85       2.5  T
  10    -49.6410842 -0.598685E-06  0.385E-03    1.85       5.4  T
  11    -49.6410844 -0.139847E-06  0.158E-03    1.85      13.2  T
  12    -49.6410844 -0.867363E-08  0.881E-04    1.85      23.7  T
  13    -49.6410844 -0.802437E-08  0.395E-04    1.85      52.8  T

   *** convergence criteria satisfied after 13 iterations ***

         #    Occupation            Energy/Eh            Energy/eV
      -------------------------------------------------------------
         1        2.0000           -0.8728884             -23.7525
       ...           ...                  ...                  ...
        37        2.0000           -0.4720524             -12.8452
        38        2.0000           -0.4674944             -12.7212
        39        2.0000           -0.4629861             -12.5985
        40        2.0000           -0.4485007             -12.2043
        41        2.0000           -0.4335406             -11.7972
        42        2.0000           -0.4327216             -11.7750
        43        2.0000           -0.3943625             -10.7311 (HOMO)
        44                         -0.3263166              -8.8795 (LUMO)
        45                         -0.2833124              -7.7093
        46                         -0.2643610              -7.1936
        47                         -0.2308423              -6.2815
        48                         -0.2221471              -6.0449
       ...                                ...                  ...
        79                          1.0693347              29.0981
      -------------------------------------------------------------
                  HL-Gap            0.0680458 Eh            1.8516 eV
             Fermi-level           -0.3603396 Eh           -9.8053 eV

 SCC (total)                   0 d,  0 h,  0 min,  0.049 sec
 SCC setup                      ...        0 min,  0.000 sec (  0.671%)
 Dispersion                     ...        0 min,  0.000 sec (  0.771%)
 integral evaluation            ...        0 min,  0.012 sec ( 25.424%)
 zeroth order Hamiltonian       ...        0 min,  0.000 sec (  0.428%)
 iterations                     ...        0 min,  0.019 sec ( 38.326%)
 molecular gradient             ...        0 min,  0.016 sec ( 33.439%)
 printout                       ...        0 min,  0.000 sec (  0.834%)

         :::::::::::::::::::::::::::::::::::::::::::::::::::::
         ::                     SUMMARY                     ::
         :::::::::::::::::::::::::::::::::::::::::::::::::::::
         :: total energy             -49.040546064001 Eh    ::
         :: gradient norm              0.107362273395 Eh/a0 ::
         :: HOMO-LUMO gap              1.851621187606 eV    ::
         ::.................................................::
         :: SCC energy               -49.641084401903 Eh    ::
         :: -> isotropic ES            0.052982632319 Eh    ::
         :: -> anisotropic ES          0.000235934118 Eh    ::
         :: -> anisotropic XC          0.014790193381 Eh    ::
         :: -> dispersion             -0.026698113730 Eh    ::
         :: repulsion energy           0.600525931868 Eh    ::
         :: add. restraining           0.000000000000 Eh    ::
         :::::::::::::::::::::::::::::::::::::::::::::::::::::

      ----------------------------------------------------------- 
     |                   =====================                   |
     |                        A N C O P T                        |
     |                   =====================                   |
     |               Approximate Normal Coordinate               |
     |                Rational Function Optimizer                |
      ----------------------------------------------------------- 

          ...................................................
          :                      SETUP                      :
          :.................................................:
          :   optimization level            normal          :
          :   max. optcycles                   200          :
          :   ANC micro-cycles                  20          :
          :   degrees of freedom                63          :
          :.................................................:
          :   RF solver                   davidson          :
          :   input Hessian                  false          :
          :   write xtbopt.log                true          :
          :   linear?                        false          :
          :   energy convergence         0.5000000E-05 Eh   :
          :   grad. convergence          0.1000000E-02 Eh/α :
          :   maximium RF displ.         2.0000000          :
          :   Hlow (freq-cutoff)         0.5000000E-02      :
          :   Hmax (freq-cutoff)         5.0000000          :
          :   S6 in model hess.         20.0000000          :
          ...................................................

generating ANC from model Hessian ...
Using Lindh-Hessian (1995)
 Shifting diagonal of input Hessian by   4.765679148019925E-003
 Lowest  eigenvalues of input Hessian
   -0.000000   -0.000000   -0.000000    0.000000    0.000000    0.000000
    0.005000    0.005901    0.008000    0.009711    0.010327    0.011673
    0.014314    0.015727    0.017337    0.021309    0.024143    0.026233
 Highest eigenvalues
    1.700819    1.788629    1.929745    1.974221    2.053134    2.505422
 

........................................................................
.............................. CYCLE    1 ..............................
........................................................................
   1    -49.6410844 -0.496411E+02  0.164E-04    1.85       0.0  T
   2    -49.6410844 -0.512586E-10  0.110E-04    1.85     189.3  T
   3    -49.6410844 -0.371543E-10  0.827E-05    1.85     252.3  T
     SCC iter.                  ...        0 min,  0.005 sec
     gradient                   ...        0 min,  0.016 sec
 * total energy  :   -49.0405460 Eh     change        0.3911613E-07 Eh
   gradient norm :     0.1073633 Eh/α   predicted     0.0000000E+00 (-100.00%)
   displ. norm   :     0.3000212 α      lambda       -0.1847179E-01
   maximum displ.:     0.1759857 α      in ANC's #27, #22, #17, ...

........................................................................
.............................. CYCLE    2 ..............................
........................................................................
   1    -49.6901652 -0.496902E+02  0.281E-01    1.92       0.0  T
   2    -49.6902674 -0.102267E-03  0.176E-01    1.91       1.0  T
   3    -49.6902005  0.669723E-04  0.114E-01    1.92       1.0  T
   4    -49.6904150 -0.214558E-03  0.344E-02    1.91       1.0  T
   5    -49.6904303 -0.152816E-04  0.147E-02    1.91       1.4  T
   6    -49.6904317 -0.141389E-05  0.817E-03    1.91       2.6  T
   7    -49.6904327 -0.101202E-05  0.343E-03    1.91       6.1  T
   8    -49.6904330 -0.226914E-06  0.903E-04    1.91      23.1  T
     SCC iter.                  ...        0 min,  0.011 sec
     gradient                   ...        0 min,  0.015 sec
 * total energy  :   -49.0529420 Eh     change       -0.1239599E-01 Eh
   gradient norm :     0.0486780 Eh/α   predicted    -0.1006724E-01 ( -18.79%)
   displ. norm   :     0.2279343 α      lambda       -0.4557408E-02
   maximum displ.:     0.1000065 α      in ANC's #5, #27, #3, ...

........................................................................
.............................. CYCLE    3 ..............................
........................................................................
   1    -49.7044591 -0.497045E+02  0.200E-01    1.98       0.0  T
   2    -49.7045039 -0.447962E-04  0.123E-01    1.97       1.0  T
   3    -49.7044410  0.628716E-04  0.750E-02    1.97       1.0  T
   4    -49.7045414 -0.100425E-03  0.202E-02    1.97       1.0  T
   5    -49.7045481 -0.668645E-05  0.667E-03    1.97       3.1  T
   6    -49.7045484 -0.302639E-06  0.326E-03    1.97       6.4  T
   7    -49.7045485 -0.959321E-07  0.182E-03    1.97      11.4  T
     SCC iter.                  ...        0 min,  0.009 sec
     gradient                   ...        0 min,  0.015 sec
 * total energy  :   -49.0553246 Eh     change       -0.2382557E-02 Eh
   gradient norm :     0.0130248 Eh/α   predicted    -0.2397110E-02 (   0.61%)
   displ. norm   :     0.2714140 α      lambda       -0.1056985E-02
   maximum displ.:     0.1574485 α      in ANC's #5, #3, #1, ...

........................................................................
.............................. CYCLE    4 ..............................
........................................................................
   1    -49.6991006 -0.496991E+02  0.376E-01    1.98       0.0  T
   2    -49.6991435 -0.429373E-04  0.209E-01    1.98       1.0  T
   3    -49.6991332  0.102924E-04  0.374E-02    1.98       1.0  T
   4    -49.6991632 -0.300003E-04  0.982E-03    1.98       2.1  T
   5    -49.6991633 -0.488846E-07  0.709E-03    1.98       2.9  T
   6    -49.6991640 -0.719758E-06  0.241E-03    1.98       8.7  T
   7    -49.6991641 -0.678047E-07  0.111E-03    1.98      18.9  T
     SCC iter.                  ...        0 min,  0.009 sec
     gradient                   ...        0 min,  0.015 sec
 * total energy  :   -49.0545759 Eh     change        0.7486433E-03 Eh
   gradient norm :     0.0292830 Eh/α   predicted    -0.5674258E-03 (-175.79%)
   displ. norm   :     0.1814601 α      lambda       -0.2646444E-02
   maximum displ.:     0.1075282 α      in ANC's #1, #6, #7, ...

........................................................................
.............................. CYCLE    5 ..............................
........................................................................
   1    -49.7042346 -0.497042E+02  0.280E-01    1.98       0.0  T
   2    -49.7042610 -0.264146E-04  0.155E-01    1.98       1.0  T
   3    -49.7042537  0.727096E-05  0.279E-02    1.98       1.0  T
   4    -49.7042725 -0.188145E-04  0.734E-03    1.98       2.8  T
   5    -49.7042728 -0.273476E-06  0.475E-03    1.98       4.4  T
   6    -49.7042731 -0.258436E-06  0.195E-03    1.98      10.7  T
     SCC iter.                  ...        0 min,  0.008 sec
     gradient                   ...        0 min,  0.015 sec
 * total energy  :   -49.0558588 Eh     change       -0.1282896E-02 Eh
   gradient norm :     0.0129642 Eh/α   predicted    -0.1366797E-02 (   6.54%)
   displ. norm   :     0.1052954 α      lambda       -0.2720457E-03
   maximum displ.:     0.0599742 α      in ANC's #5, #3, #2, ...

........................................................................
.............................. CYCLE    6 ..............................
........................................................................
   1    -49.7019872 -0.497020E+02  0.816E-02    1.97       0.0  T
   2    -49.7019883 -0.107255E-05  0.476E-02    1.97       1.0  T
   3    -49.7019824  0.583387E-05  0.170E-02    1.97       1.2  T
   4    -49.7019888 -0.634550E-05  0.370E-03    1.97       5.6  T
   5    -49.7019889 -0.144995E-06  0.196E-03    1.97      10.6  T
   6    -49.7019890 -0.374356E-07  0.872E-04    1.97      23.9  T
     SCC iter.                  ...        0 min,  0.008 sec
     gradient                   ...        0 min,  0.015 sec
 * total energy  :   -49.0560474 Eh     change       -0.1885772E-03 Eh
   gradient norm :     0.0045569 Eh/α   predicted    -0.1375336E-03 ( -27.07%)
   displ. norm   :     0.2833425 α      lambda       -0.3456578E-03
   maximum displ.:     0.1810422 α      in ANC's #3, #5, #2, ...

........................................................................
.............................. CYCLE    7 ..............................
........................................................................
   1    -49.6999750 -0.497000E+02  0.181E-01    1.95       0.0  T
   2    -49.6999773 -0.230689E-05  0.104E-01    1.95       1.0  T
   3    -49.6999690  0.829090E-05  0.210E-02    1.96       1.0  T
   4    -49.6999774 -0.839426E-05  0.887E-03    1.96       2.4  T
   5    -49.6999784 -0.957295E-06  0.335E-03    1.95       6.2  T
   6    -49.6999785 -0.138313E-06  0.937E-04    1.96      22.3  T
   7    -49.6999785 -0.151883E-07  0.394E-04    1.96      52.9  T
     SCC iter.                  ...        0 min,  0.009 sec
     gradient                   ...        0 min,  0.015 sec
 * total energy  :   -49.0562912 Eh     change       -0.2437710E-03 Eh
   gradient norm :     0.0102852 Eh/α   predicted    -0.1867074E-03 ( -23.41%)
   displ. norm   :     0.3026015 α      lambda       -0.3618270E-03
   maximum displ.:     0.1889423 α      in ANC's #3, #5, #2, ...

........................................................................
.............................. CYCLE    8 ..............................
........................................................................
   1    -49.7009492 -0.497009E+02  0.196E-01    1.94       0.0  T
   2    -49.7009517 -0.249397E-05  0.113E-01    1.94       1.0  T
   3    -49.7009351  0.165241E-04  0.305E-02    1.94       1.0  T
   4    -49.7009529 -0.177384E-04  0.865E-03    1.94       2.4  T
   5    -49.7009532 -0.310970E-06  0.421E-03    1.94       4.9  T
   6    -49.7009535 -0.307458E-06  0.117E-03    1.94      17.9  T
   7    -49.7009535 -0.269016E-07  0.421E-04    1.94      49.6  T
     SCC iter.                  ...        0 min,  0.009 sec
     gradient                   ...        0 min,  0.015 sec
 * total energy  :   -49.0565228 Eh     change       -0.2316323E-03 Eh
   gradient norm :     0.0096176 Eh/α   predicted    -0.1974830E-03 ( -14.74%)
   displ. norm   :     0.2359049 α      lambda       -0.3251760E-03
   maximum displ.:     0.1465614 α      in ANC's #3, #2, #5, ...

........................................................................
.............................. CYCLE    9 ..............................
........................................................................
   1    -49.7040624 -0.497041E+02  0.133E-01    1.93       0.0  T
   2    -49.7040640 -0.153497E-05  0.765E-02    1.93       1.0  T
   3    -49.7040553  0.867932E-05  0.226E-02    1.93       1.0  T
   4    -49.7040648 -0.947656E-05  0.610E-03    1.93       3.4  T
   5    -49.7040648 -0.683427E-07  0.400E-03    1.93       5.2  T
   6    -49.7040651 -0.287423E-06  0.939E-04    1.93      22.2  T
   7    -49.7040651 -0.157781E-07  0.451E-04    1.93      46.2  T
     SCC iter.                  ...        0 min,  0.009 sec
     gradient                   ...        0 min,  0.015 sec
 * total energy  :   -49.0567037 Eh     change       -0.1808629E-03 Eh
   gradient norm :     0.0070622 Eh/α   predicted    -0.1716372E-03 (  -5.10%)
   displ. norm   :     0.2937807 α      lambda       -0.2320216E-03
   maximum displ.:     0.1883284 α      in ANC's #3, #2, #5, ...

........................................................................
.............................. CYCLE   10 ..............................
........................................................................
   1    -49.7031761 -0.497032E+02  0.162E-01    1.92       0.0  T
   2    -49.7031780 -0.192969E-05  0.945E-02    1.92       1.0  T
   3    -49.7031761  0.186517E-05  0.113E-02    1.92       1.8  T
   4    -49.7031786 -0.247688E-05  0.412E-03    1.92       5.1  T
   5    -49.7031787 -0.859755E-07  0.239E-03    1.92       8.7  T
   6    -49.7031788 -0.111839E-06  0.979E-04    1.92      21.3  T
     SCC iter.                  ...        0 min,  0.009 sec
     gradient                   ...        0 min,  0.015 sec
 * total energy  :   -49.0568241 Eh     change       -0.1204272E-03 Eh
   gradient norm :     0.0073764 Eh/α   predicted    -0.1260239E-03 (   4.65%)
   displ. norm   :     0.1621136 α      lambda       -0.2697631E-03
   maximum displ.:     0.1268585 α      in ANC's #2, #3, #36, ...

........................................................................
.............................. CYCLE   11 ..............................
........................................................................
   1    -49.7074544 -0.497075E+02  0.120E-01    1.93       0.0  T
   2    -49.7074571 -0.269984E-05  0.682E-02    1.93       1.0  T
   3    -49.7074127  0.443624E-04  0.518E-02    1.93       1.0  T
   4    -49.7074620 -0.492974E-04  0.887E-03    1.93       2.4  T
   5    -49.7074623 -0.283047E-06  0.513E-03    1.93       4.1  T
   6    -49.7074627 -0.374773E-06  0.211E-03    1.93       9.9  T
   7    -49.7074627 -0.584182E-07  0.689E-04    1.93      30.3  T
     SCC iter.                  ...        0 min,  0.010 sec
     gradient                   ...        0 min,  0.015 sec
 * total energy  :   -49.0568414 Eh     change       -0.1730801E-04 Eh
   gradient norm :     0.0115892 Eh/α   predicted    -0.1384292E-03 ( 699.80%)
   displ. norm   :     0.1576644 α      lambda       -0.2497812E-03
   maximum displ.:     0.0986007 α      in ANC's #3, #2, #5, ...

........................................................................
.............................. CYCLE   12 ..............................
........................................................................
   1    -49.7039956 -0.497040E+02  0.909E-02    1.92       0.0  T
   2    -49.7039969 -0.138166E-05  0.525E-02    1.92       1.0  T
   3    -49.7039896  0.730653E-05  0.212E-02    1.92       1.0  T
   4    -49.7039974 -0.780782E-05  0.551E-03    1.92       3.8  T
   5    -49.7039978 -0.329679E-06  0.264E-03    1.92       7.9  T
   6    -49.7039979 -0.848523E-07  0.123E-03    1.92      17.0  T
     SCC iter.                  ...        0 min,  0.008 sec
     gradient                   ...        0 min,  0.015 sec
 * total energy  :   -49.0569721 Eh     change       -0.1306512E-03 Eh
   gradient norm :     0.0070740 Eh/α   predicted    -0.1279963E-03 (  -2.03%)
   displ. norm   :     0.0661464 α      lambda       -0.1225384E-03
   maximum displ.:     0.0384456 α      in ANC's #2, #4, #3, ...

........................................................................
.............................. CYCLE   13 ..............................
........................................................................
   1    -49.7044480 -0.497044E+02  0.540E-02    1.93       0.0  T
   2    -49.7044497 -0.167310E-05  0.323E-02    1.93       1.0  T
   3    -49.7044395  0.101223E-04  0.237E-02    1.93       1.0  T
   4    -49.7044506 -0.110804E-04  0.481E-03    1.93       4.3  T
   5    -49.7044509 -0.295186E-06  0.199E-03    1.93      10.5  T
   6    -49.7044509 -0.284991E-07  0.102E-03    1.93      20.4  T
     SCC iter.                  ...        0 min,  0.008 sec
     gradient                   ...        0 min,  0.015 sec
 * total energy  :   -49.0569658 Eh     change        0.6272295E-05 Eh
   gradient norm :     0.0094940 Eh/α   predicted    -0.6153889E-04 (*******%)
   displ. norm   :     0.0963653 α      lambda       -0.1084486E-03
   maximum displ.:     0.0692694 α      in ANC's #2, #3, #5, ...

........................................................................
.............................. CYCLE   14 ..............................
........................................................................
   1    -49.7040647 -0.497041E+02  0.678E-02    1.92       0.0  T
   2    -49.7040654 -0.684644E-06  0.393E-02    1.92       1.0  T
   3    -49.7040577  0.766206E-05  0.201E-02    1.92       1.0  T
   4    -49.7040659 -0.819566E-05  0.374E-03    1.92       5.6  T
   5    -49.7040660 -0.682382E-07  0.180E-03    1.92      11.6  T
   6    -49.7040660 -0.317701E-07  0.879E-04    1.92      23.7  T
     SCC iter.                  ...        0 min,  0.008 sec
     gradient                   ...        0 min,  0.015 sec
 * total energy  :   -49.0570302 Eh     change       -0.6441996E-04 Eh
   gradient norm :     0.0023925 Eh/α   predicted    -0.5472858E-04 ( -15.04%)
   displ. norm   :     0.0714169 α      lambda       -0.2320298E-04
   maximum displ.:     0.0593689 α      in ANC's #2, #3, #5, ...

........................................................................
.............................. CYCLE   15 ..............................
........................................................................
   1    -49.7044750 -0.497045E+02  0.443E-02    1.92       0.0  T
   2    -49.7044753 -0.270158E-06  0.256E-02    1.92       1.0  T
   3    -49.7044743  0.106091E-05  0.760E-03    1.92       2.7  T
   4    -49.7044754 -0.115419E-05  0.278E-03    1.92       7.5  T
   5    -49.7044755 -0.570959E-07  0.124E-03    1.92      16.8  T
   6    -49.7044755 -0.217918E-07  0.363E-04    1.92      57.4  T
   7    -49.7044755 -0.132947E-08  0.159E-04    1.92     131.2  T
     SCC iter.                  ...        0 min,  0.009 sec
     gradient                   ...        0 min,  0.016 sec
 * total energy  :   -49.0570457 Eh     change       -0.1549987E-04 Eh
   gradient norm :     0.0020694 Eh/α   predicted    -0.1166136E-04 ( -24.76%)
   displ. norm   :     0.0714191 α      lambda       -0.6839864E-06
   maximum displ.:     0.0593690 α      in ANC's #2, #3, #5, ...

........................................................................
.............................. CYCLE   16 ..............................
........................................................................
   1    -49.7047703 -0.497048E+02  0.443E-02    1.92       0.0  T
   2    -49.7047705 -0.276469E-06  0.256E-02    1.92       1.0  T
   3    -49.7047695  0.100405E-05  0.742E-03    1.92       2.8  T
   4    -49.7047706 -0.109275E-05  0.279E-03    1.92       7.5  T
   5    -49.7047707 -0.597919E-07  0.125E-03    1.92      16.7  T
   6    -49.7047707 -0.219477E-07  0.372E-04    1.92      56.0  T
   7    -49.7047707 -0.145373E-08  0.158E-04    1.92     131.8  T
     SCC iter.                  ...        0 min,  0.009 sec
     gradient                   ...        0 min,  0.016 sec
 * total energy  :   -49.0570463 Eh     change       -0.5701281E-06 Eh
   gradient norm :     0.0039945 Eh/α   predicted    -0.3483488E-06 ( -38.90%)
   displ. norm   :     0.1156523 α      lambda       -0.2652243E-04
   maximum displ.:     0.0828480 α      in ANC's #2, #3, #5, ...

........................................................................
.............................. CYCLE   17 ..............................
........................................................................
   1    -49.7039402 -0.497039E+02  0.596E-02    1.92       0.0  T
   2    -49.7039405 -0.317407E-06  0.349E-02    1.92       1.0  T
   3    -49.7039399  0.635759E-06  0.612E-03    1.92       3.4  T
   4    -49.7039407 -0.766303E-06  0.214E-03    1.92       9.8  T
   5    -49.7039407 -0.245594E-07  0.134E-03    1.92      15.5  T
   6    -49.7039407 -0.261051E-07  0.433E-04    1.92      48.1  T
   7    -49.7039407 -0.184109E-08  0.186E-04    1.92     111.9  T
     SCC iter.                  ...        0 min,  0.010 sec
     gradient                   ...        0 min,  0.017 sec
 * total energy  :   -49.0570563 Eh     change       -0.1006903E-04 Eh
   gradient norm :     0.0034312 Eh/α   predicted    -0.1343928E-04 (  33.47%)
   displ. norm   :     0.0457458 α      lambda       -0.1998958E-04
   maximum displ.:     0.0293321 α      in ANC's #3, #2, #1, ...

........................................................................
.............................. CYCLE   18 ..............................
........................................................................
   1    -49.7051302 -0.497051E+02  0.318E-02    1.93       0.0  T
   2    -49.7051303 -0.180844E-06  0.182E-02    1.93       1.1  T
   3    -49.7051302  0.147395E-06  0.359E-03    1.93       5.8  T
   4    -49.7051303 -0.147639E-06  0.206E-03    1.93      10.1  T
   5    -49.7051304 -0.547671E-07  0.904E-04    1.93      23.1  T
   6    -49.7051304 -0.108557E-07  0.275E-04    1.93      75.8  T
     SCC iter.                  ...        0 min,  0.008 sec
     gradient                   ...        0 min,  0.016 sec
 * total energy  :   -49.0570634 Eh     change       -0.7030523E-05 Eh
   gradient norm :     0.0013410 Eh/α   predicted    -0.1002010E-04 (  42.52%)
   displ. norm   :     0.0687530 α      lambda       -0.8635635E-05
   maximum displ.:     0.0477048 α      in ANC's #2, #3, #5, ...

........................................................................
.............................. CYCLE   19 ..............................
........................................................................
   1    -49.7047105 -0.497047E+02  0.368E-02    1.93       0.0  T
   2    -49.7047106 -0.978764E-07  0.218E-02    1.93       1.0  T
   3    -49.7047094  0.120982E-05  0.888E-03    1.93       2.3  T
   4    -49.7047107 -0.134637E-05  0.124E-03    1.93      16.8  T
   5    -49.7047107 -0.387005E-08  0.924E-04    1.93      22.6  T
   6    -49.7047108 -0.130774E-07  0.245E-04    1.93      85.1  T
     SCC iter.                  ...        0 min,  0.008 sec
     gradient                   ...        0 min,  0.016 sec
 * total energy  :   -49.0570680 Eh     change       -0.4609920E-05 Eh
   gradient norm :     0.0010263 Eh/α   predicted    -0.4328224E-05 (  -6.11%)
   displ. norm   :     0.0679981 α      lambda       -0.5215212E-05
   maximum displ.:     0.0523444 α      in ANC's #2, #3, #5, ...

........................................................................
.............................. CYCLE   20 ..............................
........................................................................
   1    -49.7047097 -0.497047E+02  0.370E-02    1.92       0.0  T
   2    -49.7047099 -0.137469E-06  0.219E-02    1.92       1.0  T
   3    -49.7047091  0.739346E-06  0.673E-03    1.92       3.1  T
   4    -49.7047100 -0.846260E-06  0.131E-03    1.92      15.9  T
   5    -49.7047100 -0.130965E-08  0.929E-04    1.92      22.4  T
   6    -49.7047100 -0.120835E-07  0.298E-04    1.92      69.9  T
     SCC iter.                  ...        0 min,  0.008 sec
     gradient                   ...        0 min,  0.016 sec
 * total energy  :   -49.0570717 Eh     change       -0.3677646E-05 Eh
   gradient norm :     0.0013506 Eh/α   predicted    -0.2616479E-05 ( -28.85%)
   displ. norm   :     0.0678922 α      lambda        0.7612149E-05
   maximum displ.:     0.0523426 α      in ANC's #2, #3, #5, ...
 * RMSD in coord.:     0.4979624 α      energy gain  -0.1652560E-01 Eh

generating ANC from model Hessian ...
Using Lindh-Hessian (1995)
 Shifting diagonal of input Hessian by   4.629169940125114E-003
 Lowest  eigenvalues of input Hessian
   -0.000000    0.000000    0.000000    0.000000    0.000000    0.000000
    0.005000    0.005864    0.008366    0.009724    0.010569    0.012464
    0.015704    0.017415    0.019155    0.022724    0.025893    0.026327
 Highest eigenvalues
    1.789540    1.881702    1.959513    2.024641    2.102117    2.625122
 

........................................................................
.............................. CYCLE   21 ..............................
........................................................................
   1    -49.7046155 -0.497046E+02  0.369E-02    1.92       0.0  T
   2    -49.7046156 -0.138207E-06  0.219E-02    1.92       1.0  T
   3    -49.7046149  0.735029E-06  0.668E-03    1.92       3.1  T
   4    -49.7046157 -0.840678E-06  0.133E-03    1.92      15.7  T
   5    -49.7046157 -0.236955E-08  0.922E-04    1.92      22.6  T
   6    -49.7046158 -0.115012E-07  0.307E-04    1.92      68.0  T
     SCC iter.                  ...        0 min,  0.008 sec
     gradient                   ...        0 min,  0.016 sec
 * total energy  :   -49.0570657 Eh     change        0.5939593E-05 Eh
   gradient norm :     0.0033210 Eh/α   predicted     0.0000000E+00 (-100.00%)
   displ. norm   :     0.0152776 α      lambda       -0.1144020E-04
   maximum displ.:     0.0102604 α      in ANC's #1, #2, #24, ...

........................................................................
.............................. CYCLE   22 ..............................
........................................................................
   1    -49.7048316 -0.497048E+02  0.197E-02    1.93       0.0  T
   2    -49.7048317 -0.131472E-06  0.109E-02    1.93       1.9  T
   3    -49.7048310  0.668700E-06  0.618E-03    1.93       3.4  T
   4    -49.7048318 -0.766748E-06  0.820E-04    1.93      25.4  T
   5    -49.7048318 -0.419816E-08  0.512E-04    1.93      40.7  T
     SCC iter.                  ...        0 min,  0.007 sec
     gradient                   ...        0 min,  0.016 sec
 * total energy  :   -49.0570704 Eh     change       -0.4694484E-05 Eh
   gradient norm :     0.0009097 Eh/α   predicted    -0.5721337E-05 (  21.87%)
   displ. norm   :     0.0545428 α      lambda       -0.1803047E-04
   maximum displ.:     0.0371731 α      in ANC's #1, #3, #7, ...

   *** GEOMETRY OPTIMIZATION CONVERGED AFTER 22 ITERATIONS ***

------------------------------------------------------------------------
 total energy gain   :        -0.0165244 Eh      -10.3692 kcal/mol
 total RMSD          :         0.4966035 a0        0.2628 Å
 total power (kW/mol):        -1.9720312 (step)  -51.5337 (real)
------------------------------------------------------------------------

 ANCopt (total)                0 d,  0 h,  0 min,  0.842 sec
 optimizer setup                ...        0 min,  0.000 sec (  0.019%)
 model hessian                  ...        0 min,  0.006 sec (  0.672%)
 ANC generation                 ...        0 min,  0.001 sec (  0.155%)
 coordinate transformation      ...        0 min,  0.000 sec (  0.051%)
 single point calculation       ...        0 min,  0.825 sec ( 97.953%)
 optimization log               ...        0 min,  0.002 sec (  0.254%)
 hessian update                 ...        0 min,  0.000 sec (  0.035%)
 rational function              ...        0 min,  0.006 sec (  0.693%)

================
 final structure:
================
$coord
   -2.72950791373858    2.53899788040767    0.23509386916981      C 
   -4.95985355236725    0.21934568986751    0.27992347494062      S 
   -2.73430934020339   -2.16862719652982    0.15999843376984      C 
   -0.30306743650360   -1.14789329677228    0.08742401115777      C 
   -0.31699535142135    1.57270656115220    0.13060303450758      C 
    1.98980902677673    2.92272684429534    0.06376365613271      C 
    4.20759446483778    1.62164064660449   -0.04430689997847      C 
    6.69555469974017    2.98806499477900   -0.12080046859594      C 
    6.42064064332623    5.50915396877568   -0.07842884824865      F 
    8.18194658871991    2.40537704815386    1.85398661049055      F 
    8.02822331581347    2.45721277903942   -2.21624660157100      F 
    4.23985015492526   -1.08143558387010   -0.08875520022454      C 
    6.56143211529369   -2.40106758187577   -0.20499603198665      C 
    8.40724571133703   -3.52964045319582   -0.28545004582117      N 
    2.02298155959713   -2.43150428288744   -0.02272122847288      C 
   -3.43078642987872   -4.78564503333234    0.14141975541430      C 
   -5.79730437833398   -5.64498376290662    0.18603541078537      C 
   -3.28732062310286    4.48474904940074    0.28601636917071      H 
    1.96492226673232    4.96099170876979    0.09740651061561      H 
    2.08592496457183   -4.46933421107316   -0.05772885333509      H 
   -1.86946529078250   -6.10244064516697    0.08614614387933      H 
   -7.39158041349232   -4.38022476470430    0.24147035410653      H 
   -6.20601173677967   -7.63446769415702    0.17092221234520      H 
$end
           -------------------------------------------------
          |                Final Singlepoint                |
           -------------------------------------------------

          ...................................................
          :                      SETUP                      :
          :.................................................:
          :  # basis functions                  80          :
          :  # atomic orbitals                  79          :
          :  # shells                           41          :
          :  # electrons                        86          :
          :  max. iterations                   250          :
          :  Hamiltonian                  GFN2-xTB          :
          :  restarted?                      false          :
          :  GBSA solvation                  false          :
          :  PC potential                    false          :
          :  electronic temp.          300.0000000     K    :
          :  accuracy                    1.0000000          :
          :  -> integral cutoff          0.2500000E+02      :
          :  -> integral neglect         0.1000000E-07      :
          :  -> SCF convergence          0.1000000E-05 Eh   :
          :  -> wf. convergence          0.1000000E-03 e    :
          :  Broyden damping             0.4000000          :
          ...................................................

 iter      E             dE          RMSdq      gap      omega  full diag
   1    -49.7048318 -0.497048E+02  0.322E-04    1.93       0.0  T
   2    -49.7048318  0.637712E-10  0.138E-04    1.93     151.5  T
   3    -49.7048318 -0.288360E-09  0.174E-04    1.93     119.6  T

   *** convergence criteria satisfied after 3 iterations ***

         #    Occupation            Energy/Eh            Energy/eV
      -------------------------------------------------------------
         1        2.0000           -0.8790108             -23.9191
       ...           ...                  ...                  ...
        37        2.0000           -0.4700407             -12.7905
        38        2.0000           -0.4692194             -12.7681
        39        2.0000           -0.4591284             -12.4935
        40        2.0000           -0.4523236             -12.3084
        41        2.0000           -0.4342932             -11.8177
        42        2.0000           -0.4326842             -11.7739
        43        2.0000           -0.3953789             -10.7588 (HOMO)
        44                         -0.3246272              -8.8336 (LUMO)
        45                         -0.2774834              -7.5507
        46                         -0.2605036              -7.0887
        47                         -0.2299866              -6.2583
        48                         -0.2166262              -5.8947
       ...                                ...                  ...
        79                          1.1613666              31.6024
      -------------------------------------------------------------
                  HL-Gap            0.0707517 Eh            1.9253 eV
             Fermi-level           -0.3600030 Eh           -9.7962 eV

 SCC (total)                   0 d,  0 h,  0 min,  0.035 sec
 SCC setup                      ...        0 min,  0.000 sec (  0.651%)
 Dispersion                     ...        0 min,  0.000 sec (  0.596%)
 integral evaluation            ...        0 min,  0.012 sec ( 35.872%)
 zeroth order Hamiltonian       ...        0 min,  0.000 sec (  0.558%)
 iterations                     ...        0 min,  0.005 sec ( 14.069%)
 molecular gradient             ...        0 min,  0.016 sec ( 46.956%)
 printout                       ...        0 min,  0.000 sec (  1.131%)

         :::::::::::::::::::::::::::::::::::::::::::::::::::::
         ::                     SUMMARY                     ::
         :::::::::::::::::::::::::::::::::::::::::::::::::::::
         :: total energy             -49.057070353827 Eh    ::
         :: gradient norm              0.000911241276 Eh/a0 ::
         :: HOMO-LUMO gap              1.925251883235 eV    ::
         ::.................................................::
         :: SCC energy               -49.704831797251 Eh    ::
         :: -> isotropic ES            0.052891088444 Eh    ::
         :: -> anisotropic ES          0.001297598217 Eh    ::
         :: -> anisotropic XC          0.011354849628 Eh    ::
         :: -> dispersion             -0.026856943777 Eh    ::
         :: repulsion energy           0.647771870674 Eh    ::
         :: add. restraining           0.000000000000 Eh    ::
         :::::::::::::::::::::::::::::::::::::::::::::::::::::

           -------------------------------------------------
          |                Property Printout                |
           -------------------------------------------------

    * Orbital Energies and Occupations

         #    Occupation            Energy/Eh            Energy/eV
      -------------------------------------------------------------
         1        2.0000           -0.8790108             -23.9191
       ...           ...                  ...                  ...
        31        2.0000           -0.5093057             -13.8589
        32        2.0000           -0.5060193             -13.7695
        33        2.0000           -0.4913782             -13.3711
        34        2.0000           -0.4894977             -13.3199
        35        2.0000           -0.4859456             -13.2233
        36        2.0000           -0.4828620             -13.1393
        37        2.0000           -0.4700407             -12.7905
        38        2.0000           -0.4692194             -12.7681
        39        2.0000           -0.4591284             -12.4935
        40        2.0000           -0.4523236             -12.3084
        41        2.0000           -0.4342932             -11.8177
        42        2.0000           -0.4326842             -11.7739
        43        2.0000           -0.3953789             -10.7588 (HOMO)
        44                         -0.3246272              -8.8336 (LUMO)
        45                         -0.2774834              -7.5507
        46                         -0.2605036              -7.0887
        47                         -0.2299866              -6.2583
        48                         -0.2166262              -5.8947
        49                         -0.2010707              -5.4714
        50                         -0.1716439              -4.6707
        51                         -0.1518639              -4.1324
        52                         -0.1120934              -3.0502
        53                         -0.0341637              -0.9296
        54                         -0.0010204              -0.0278
       ...                                ...                  ...
        79                          1.1613666              31.6024
      -------------------------------------------------------------
                  HL-Gap            0.0707517 Eh            1.9253 eV
             Fermi-level           -0.3600030 Eh           -9.7962 eV

     #   Z        covCN         q      C6AA      α(0)
     1   6 C      2.926    -0.036    28.904     8.817
     2  16 S      2.329     0.063   138.511    19.808
     3   6 C      2.978     0.014    27.690     8.632
     4   6 C      3.168    -0.003    27.737     8.605
     5   6 C      3.173     0.006    27.499     8.565
     6   6 C      2.911    -0.025    28.621     8.773
     7   6 C      2.975    -0.025    28.627     8.776
     8   6 C      3.336     0.490    17.240     6.576
     9   9 F      0.791    -0.208    11.322     3.975
    10   9 F      0.791    -0.205    11.284     3.968
    11   9 F      0.791    -0.205    11.284     3.968
    12   6 C      2.970     0.019    27.571     8.613
    13   6 C      1.913     0.112    28.329     8.596
    14   7 N      0.911    -0.208    25.517     7.306
    15   6 C      2.923    -0.017    28.431     8.744
    16   6 C      2.920    -0.030    28.747     8.792
    17   6 C      2.841    -0.083    30.063     8.986
    18   1 H      0.926     0.061     2.190     2.314
    19   1 H      0.926     0.064     2.157     2.297
    20   1 H      0.926     0.055     2.258     2.350
    21   1 H      0.925     0.052     2.297     2.370
    22   1 H      0.926     0.054     2.273     2.358
    23   1 H      0.926     0.055     2.262     2.352

 Mol. C6AA /au·bohr⁶  :       9647.231749
 Mol. C8AA /au·bohr⁸  :     264864.283542
 Mol. α(0) /au        :        155.539923


Wiberg/Mayer (AO) data.
largest (>0.10) Wiberg bond orders for each atom
          total WBO             WBO to atom ...
     1  C   3.943        C    5 1.453    S    2 1.255    H   18 0.968    C    3 0.117
     2  S   2.742        C    1 1.255    C    3 1.190
     3  C   3.937        C    4 1.357    S    2 1.190    C   16 1.158    C    1 0.117
     4  C   3.989        C    3 1.357    C   15 1.270    C    5 1.156
     5  C   3.981        C    1 1.453    C    6 1.224    C    4 1.156
     6  C   3.984        C    7 1.589    C    5 1.224    H   19 0.963
     7  C   3.972        C    6 1.589    C   12 1.188    C    8 0.951
     8  C   3.825        C    7 0.951    F    9 0.947    F   11 0.946    F   10 0.946
     9  F   1.070        C    8 0.947
    10  F   1.073        C    8 0.946
    11  F   1.073        C    8 0.946
    12  C   3.971        C   15 1.495    C    7 1.188    C   13 1.095
    13  C   3.948        N   14 2.808    C   12 1.095
    14  N   2.978        C   13 2.808
    15  C   3.990        C   12 1.495    C    4 1.270    H   20 0.963
    16  C   3.991        C   17 1.840    C    3 1.158    H   21 0.954
    17  C   3.959        C   16 1.840    H   23 0.977    H   22 0.971
    18  H   0.995        C    1 0.968
    19  H   0.994        C    6 0.963
    20  H   0.996        C   15 0.963
    21  H   0.997        C   16 0.954
    22  H   0.997        C   17 0.971
    23  H   0.996        C   17 0.977

molecular dipole:
                 x           y           z       tot (Debye)
 q only:       -2.956      -0.424       0.105
   full:       -3.111      -0.122       0.115       7.919
molecular quadrupole (traceless):
                xx          xy          yy          xz          yz          zz
 q only:      -18.115      -0.567      10.255       0.611       0.019       7.860
  q+dip:      -22.757       2.688      15.723       0.803       0.027       7.034
   full:      -26.018       3.728      14.376       1.096      -0.102      11.642

           -------------------------------------------------
          |                Geometry Summary                 |
           -------------------------------------------------

      molecular mass/u    :      253.2413000
   center of mass at/Å    :        1.0424092       0.0942484       0.0077595
  moments of inertia/u·Å² :        0.5540499E+03   0.2023789E+04   0.2489553E+04
rotational constants/cm⁻¹ :        0.3042620E-01   0.8329737E-02   0.6771350E-02

 * 22 selected distances

     #   Z        #   Z                                     value/Å
     1   6 C      2  16 S                                 1.7030333
     2  16 S      3   6 C                                 1.7285430 (max)
     3   6 C      4   6 C                                 1.3958751
     1   6 C      5   6 C                                 1.3763548
     4   6 C      5   6 C                                 1.4398798
     5   6 C      6   6 C                                 1.4148313
     6   6 C      7   6 C                                 1.3618556
     8   6 C      9   9 F                                 1.3421987
     8   6 C     10   9 F                                 1.3438050
     8   6 C     11   9 F                                 1.3438086
     7   6 C     12   6 C                                 1.4307017
    13   6 C     14   7 N                                 1.1456630
     4   6 C     15   6 C                                 1.4070835
    12   6 C     15   6 C                                 1.3739823
     3   6 C     16   6 C                                 1.4331042
    16   6 C     17   6 C                                 1.3325247
     1   6 C     18   1 H                                 1.0714625 (min)
     6   6 C     19   1 H                                 1.0788307
    15   6 C     20   1 H                                 1.0790466
    16   6 C     21   1 H                                 1.0812232
    17   6 C     22   1 H                                 1.0772890
    17   6 C     23   1 H                                 1.0748053

 * 5 distinct bonds (by element types)

   Z      Z             #   av. dist./Å        max./Å        min./Å
   1 H    6 C           6     1.0771096     1.0812232     1.0714625
   6 C    6 C          10     1.3966193     1.4398798     1.3325247
   6 C    7 N           1     1.1456630     1.1456630     1.1456630
   6 C    9 F           3     1.3432708     1.3438086     1.3421987
   6 C   16 S           2     1.7157882     1.7285430     1.7030333


optimized geometry written to: xtbopt.xyz


           -------------------------------------------------
          | TOTAL ENERGY              -49.057070353827 Eh   |
          | GRADIENT NORM               0.000911241276 Eh/α |
          | HOMO-LUMO GAP               1.925251883235 eV   |
           -------------------------------------------------

------------------------------------------------------------------------
 * finished run on 2021/05/19 at 11:00:44.403     
------------------------------------------------------------------------
 total:
 * wall-time:     0 d,  0 h,  0 min,  0.963 sec
 *  cpu-time:     0 d,  0 h,  0 min,  0.950 sec
 * ratio c/w:     0.987 speedup
 SCF:
 * wall-time:     0 d,  0 h,  0 min,  0.049 sec
 *  cpu-time:     0 d,  0 h,  0 min,  0.049 sec
 * ratio c/w:     1.000 speedup
 ANC optimizer:
 * wall-time:     0 d,  0 h,  0 min,  0.877 sec
 *  cpu-time:     0 d,  0 h,  0 min,  0.877 sec
 * ratio c/w:     1.000 speedup

