      -----------------------------------------------------------      
     |                   =====================                   |     
     |                           x T B                           |     
     |                   =====================                   |     
     |                         S. Grimme                         |     
     |          Mulliken Center for Theoretical Chemistry        |     
     |                    University of Bonn                     |     
     |                Version 6.2 RC2 (SAW190805)                |     
      -----------------------------------------------------------      

   This program is distributed in the hope that it will be useful,
   but WITHOUT ANY WARRANTY; without even the implied warranty of
   MERCHANTABILITY or FITNESS FOR A PARTICULAR PURPOSE.
   
   FOR NON-COMMERCIAL, ACADEMIA USE ONLY.
   
   Cite this work as:
   * S. Grimme, C. Bannwarth, P. Shushkov, J. Chem. Theory Comput., 2017,
     13, 1989-2009. DOI: 10.1021/acs.jctc.7b00118
   * C. Bannwarth, S. Ehlert and S. Grimme., J. Chem. Theory Comput., 2019,
     15, 1652-1671. DOI: 10.1021/acs.jctc.8b01176
   * P. Pracht, E. Caldeweyher, S. Ehlert, S. Grimme, ChemRxiv, 2019, preprint.
     DOI: 10.26434/chemrxiv.8326202.v1
   
   for DFT-D4:
   * E. Caldeweyher, C. Bannwarth and S. Grimme, J. Chem. Phys., 2017,
     147, 034112. DOI: 10.1063/1.4993215
   * E. Caldeweyher, S. Ehlert, A. Hansen, H. Neugebauer, S. Spicher,
     C. Bannwarth and S. Grimme, J. Chem. Phys., 2019, 150, 154122.
     DOI: 10.1063/1.5090222
   
   for sTDA-xTB:
   * S. Grimme and C. Bannwarth, J. Chem. Phys., 2016, 145, 054103.
     DOI: 10.1063/1.4959605
   
   in the mass-spec context:
   * V. Asgeirsson, C. Bauer and S. Grimme, Chem. Sci., 2017, 8, 4879.
     DOI: 10.1039/c7sc00601b
   
   for metadynamics refer to:
   * S. Grimme, J. Chem. Theory Comput., 2019, 155, 2847-2862
     DOI: 10.1021/acs.jctc.9b00143
   
   with help from (in alphabetical order)
   C. Bannwarth, F. Bohle, G. Brandenburg, E. Caldeweyher, M. Checinski,
   S. Dohm, S. Ehlert, S. Ehrlich, F. März, H. Neugebauer, J. Pisarek,
   P. Pracht, P. Shushkov, and S. Spicher.
   
 * started run on 2021/05/19 at 11:00:44.985     

           -------------------------------------------------
          |                Calculation Setup                |
           -------------------------------------------------

          program call               : /ihome/ghutchison/geoffh/xtb/xtb 764.xyz -opt
          hostname                   : smp-n83
          coordinate file            : 764.xyz
          omp threads                :                     1
          number of atoms            :                    24
          number of electrons        :                    72
          charge                     :                     0
          spin                       :                   0.0
          first test random number   :      0.66511270708152


########################################################################
# WARNING! Please study the warnings concerning your input carefully
#  - the use of '-opt' is discouraged, please use '--opt' next time
########################################################################

           ------------------------------------------------- 
          |                 G F N 2 - x T B                 |
          | Geometry, Frequencies, Noncovalent interactions |
          |            JCTC 2019 parametrisation            |
           ------------------------------------------------- 
             KAB for C  - Si     :                1.0500
             KAB for H  - Pd     :                0.9500
             k(s)              :                1.8500
             k(p)              :                2.2300
             k(d)              :                2.2300
             k(f)              :                2.0000
             kEN (H0ij)        :               -2.0000
             D4 a1             :                0.5200
             D4 a2             :                5.0000
             D4 s6             :                1.0000
             D4 s8             :                2.7000
             D4 s9             :                5.0000
             alphaj            :                2.0000

  Z AO/shell   Hii/eV     exponent
  1     Wed Apr 25 08:07:45 CEST 2018   EN: 2.200 GM2: 0.406  GM3: 0.0800  RAES: 1.40
     1s    -10.707211    1.230000
  6     Wed Apr 25 08:07:45 CEST 2018   EN: 2.550 GM2: 0.538  GM3: 0.1500  RAES: 3.00
     2s    -13.970922    2.096432
     2p    -10.063292    1.800000
  8     Wed Apr 25 08:07:45 CEST 2018   EN: 3.440 GM2: 0.452  GM3:-0.0517  RAES: 1.80
     2s    -20.229985    2.439742
     2p    -15.503117    2.137023
 16     Tue Apr 24 11:44:34 CEST 2018   EN: 2.580 GM2: 0.340  GM3:-0.0502  RAES: 3.10
     3s    -20.029654    1.981333
     3p    -11.377694    2.025643
     3d     -0.420282    1.702555

           ------------------------------------------------- 
          |        Self-Consistent Charge Iterations        |
           ------------------------------------------------- 

          ...................................................
          :                      SETUP                      :
          :.................................................:
          :  # basis functions                  78          :
          :  # atomic orbitals                  76          :
          :  # shells                           40          :
          :  # electrons                        72          :
          :  max. iterations                   250          :
          :  Hamiltonian                  GFN2-xTB          :
          :  restarted?                      false          :
          :  GBSA solvation                  false          :
          :  PC potential                    false          :
          :  electronic temp.          300.0000000     K    :
          :  accuracy                    1.0000000          :
          :  -> integral cutoff          0.2500000E+02      :
          :  -> integral neglect         0.1000000E-07      :
          :  -> SCF convergence          0.1000000E-05 Eh   :
          :  -> wf. convergence          0.1000000E-03 e    :
          :  Broyden damping             0.4000000          :
          ...................................................

 iter      E             dE          RMSdq      gap      omega  full diag
   1    -39.6413747 -0.396414E+02  0.478E+00    1.92       0.0  T
   2    -39.6832204 -0.418458E-01  0.246E+00    1.87       1.0  T
   3    -39.6793518  0.386864E-02  0.128E+00    1.92       1.0  T
   4    -39.6897918 -0.104400E-01  0.375E-01    1.86       1.0  T
   5    -39.6905804 -0.788649E-03  0.205E-01    1.88       1.0  T
   6    -39.6910658 -0.485344E-03  0.105E-01    1.88       1.0  T
   7    -39.6912369 -0.171129E-03  0.483E-02    1.88       1.0  T
   8    -39.6912719 -0.349542E-04  0.164E-02    1.88       1.2  T
   9    -39.6912720 -0.153009E-06  0.869E-03    1.88       2.3  T
  10    -39.6912727 -0.734421E-06  0.302E-03    1.88       6.8  T
  11    -39.6912728 -0.719568E-07  0.133E-03    1.88      15.4  T
  12    -39.6912728 -0.406823E-08  0.613E-04    1.88      33.3  T
  13    -39.6912728 -0.912316E-09  0.202E-04    1.88     101.1  T

   *** convergence criteria satisfied after 13 iterations ***

         #    Occupation            Energy/Eh            Energy/eV
      -------------------------------------------------------------
         1        2.0000           -0.7504161             -20.4199
       ...           ...                  ...                  ...
        30        2.0000           -0.4512541             -12.2792
        31        2.0000           -0.4486059             -12.2072
        32        2.0000           -0.4429371             -12.0529
        33        2.0000           -0.4183420             -11.3837
        34        2.0000           -0.4081516             -11.1064
        35        2.0000           -0.3955595             -10.7637
        36        2.0000           -0.3749910             -10.2040 (HOMO)
        37                         -0.3060444              -8.3279 (LUMO)
        38                         -0.2639535              -7.1825
        39                         -0.2375802              -6.4649
        40                         -0.2215648              -6.0291
        41                         -0.2127805              -5.7901
       ...                                ...                  ...
        76                          0.7399500              20.1351
      -------------------------------------------------------------
                  HL-Gap            0.0689466 Eh            1.8761 eV
             Fermi-level           -0.3405177 Eh           -9.2660 eV

 SCC (total)                   0 d,  0 h,  0 min,  0.047 sec
 SCC setup                      ...        0 min,  0.000 sec (  0.685%)
 Dispersion                     ...        0 min,  0.000 sec (  0.764%)
 integral evaluation            ...        0 min,  0.012 sec ( 24.707%)
 zeroth order Hamiltonian       ...        0 min,  0.000 sec (  0.412%)
 iterations                     ...        0 min,  0.018 sec ( 38.296%)
 molecular gradient             ...        0 min,  0.016 sec ( 34.106%)
 printout                       ...        0 min,  0.000 sec (  0.909%)

         :::::::::::::::::::::::::::::::::::::::::::::::::::::
         ::                     SUMMARY                     ::
         :::::::::::::::::::::::::::::::::::::::::::::::::::::
         :: total energy             -39.151927995396 Eh    ::
         :: gradient norm              0.106653002335 Eh/a0 ::
         :: HOMO-LUMO gap              1.876132959882 eV    ::
         ::.................................................::
         :: SCC energy               -39.691272819714 Eh    ::
         :: -> isotropic ES            0.029118302263 Eh    ::
         :: -> anisotropic ES          0.002978877720 Eh    ::
         :: -> anisotropic XC          0.017670804897 Eh    ::
         :: -> dispersion             -0.025986629793 Eh    ::
         :: repulsion energy           0.539420616407 Eh    ::
         :: add. restraining           0.000000000000 Eh    ::
         :::::::::::::::::::::::::::::::::::::::::::::::::::::

      ----------------------------------------------------------- 
     |                   =====================                   |
     |                        A N C O P T                        |
     |                   =====================                   |
     |               Approximate Normal Coordinate               |
     |                Rational Function Optimizer                |
      ----------------------------------------------------------- 

          ...................................................
          :                      SETUP                      :
          :.................................................:
          :   optimization level            normal          :
          :   max. optcycles                   200          :
          :   ANC micro-cycles                  20          :
          :   degrees of freedom                66          :
          :.................................................:
          :   RF solver                   davidson          :
          :   input Hessian                  false          :
          :   write xtbopt.log                true          :
          :   linear?                        false          :
          :   energy convergence         0.5000000E-05 Eh   :
          :   grad. convergence          0.1000000E-02 Eh/α :
          :   maximium RF displ.         2.0000000          :
          :   Hlow (freq-cutoff)         0.5000000E-02      :
          :   Hmax (freq-cutoff)         5.0000000          :
          :   S6 in model hess.         20.0000000          :
          ...................................................

generating ANC from model Hessian ...
Using Lindh-Hessian (1995)
 Shifting diagonal of input Hessian by   4.023057051440383E-003
 Lowest  eigenvalues of input Hessian
   -0.000000   -0.000000   -0.000000    0.000000    0.000000    0.000000
    0.005000    0.005842    0.006164    0.007667    0.009485    0.010191
    0.012832    0.014434    0.015954    0.016444    0.022934    0.029213
 Highest eigenvalues
    1.671246    1.721052    1.849610    1.983765    2.070563    2.120253
 

........................................................................
.............................. CYCLE    1 ..............................
........................................................................
   1    -39.6912728 -0.396913E+02  0.956E-05    1.88       0.0  T
   2    -39.6912728 -0.459011E-11  0.707E-05    1.88     288.7  T
   3    -39.6912728 -0.452260E-10  0.445E-05    1.88     459.0  T
     SCC iter.                  ...        0 min,  0.005 sec
     gradient                   ...        0 min,  0.016 sec
 * total energy  :   -39.1519280 Eh     change       -0.5883010E-09 Eh
   gradient norm :     0.1066526 Eh/α   predicted     0.0000000E+00 (-100.00%)
   displ. norm   :     0.2701617 α      lambda       -0.1536968E-01
   maximum displ.:     0.1193362 α      in ANC's #18, #12, #28, ...

........................................................................
.............................. CYCLE    2 ..............................
........................................................................
   1    -39.7116540 -0.397117E+02  0.357E-01    1.95       0.0  T
   2    -39.7117496 -0.956066E-04  0.206E-01    1.92       1.0  T
   3    -39.7114240  0.325661E-03  0.159E-01    1.92       1.0  T
   4    -39.7119770 -0.552989E-03  0.500E-02    1.93       1.0  T
   5    -39.7119957 -0.187620E-04  0.254E-02    1.92       1.0  T
   6    -39.7120001 -0.434899E-05  0.109E-02    1.92       1.9  T
   7    -39.7120013 -0.121947E-05  0.382E-03    1.92       5.3  T
   8    -39.7120014 -0.964231E-07  0.177E-03    1.92      11.5  T
     SCC iter.                  ...        0 min,  0.010 sec
     gradient                   ...        0 min,  0.015 sec
 * total energy  :   -39.1620328 Eh     change       -0.1010477E-01 Eh
   gradient norm :     0.0394149 Eh/α   predicted    -0.8245738E-02 ( -18.40%)
   displ. norm   :     0.2058429 α      lambda       -0.2874893E-02
   maximum displ.:     0.0810155 α      in ANC's #4, #6, #9, ...

........................................................................
.............................. CYCLE    3 ..............................
........................................................................
   1    -39.7208483 -0.397208E+02  0.177E-01    1.95       0.0  T
   2    -39.7208723 -0.240422E-04  0.101E-01    1.94       1.0  T
   3    -39.7207826  0.897029E-04  0.699E-02    1.94       1.0  T
   4    -39.7208951 -0.112530E-03  0.238E-02    1.95       1.0  T
   5    -39.7208999 -0.473129E-05  0.120E-02    1.94       1.7  T
   6    -39.7209009 -0.103131E-05  0.502E-03    1.94       4.1  T
   7    -39.7209012 -0.275975E-06  0.202E-03    1.95      10.1  T
     SCC iter.                  ...        0 min,  0.009 sec
     gradient                   ...        0 min,  0.015 sec
 * total energy  :   -39.1636508 Eh     change       -0.1618063E-02 Eh
   gradient norm :     0.0115192 Eh/α   predicted    -0.1498360E-02 (  -7.40%)
   displ. norm   :     0.1297016 α      lambda       -0.3287945E-03
   maximum displ.:     0.0920729 α      in ANC's #4, #6, #7, ...

........................................................................
.............................. CYCLE    4 ..............................
........................................................................
   1    -39.7211643 -0.397212E+02  0.819E-02    1.94       0.0  T
   2    -39.7211661 -0.177929E-05  0.471E-02    1.94       1.0  T
   3    -39.7211542  0.119348E-04  0.281E-02    1.94       1.0  T
   4    -39.7211675 -0.133680E-04  0.694E-03    1.94       2.9  T
   5    -39.7211680 -0.484673E-06  0.354E-03    1.94       5.8  T
   6    -39.7211682 -0.142309E-06  0.155E-03    1.94      13.2  T
   7    -39.7211682 -0.275426E-07  0.729E-04    1.94      28.0  T
     SCC iter.                  ...        0 min,  0.009 sec
     gradient                   ...        0 min,  0.015 sec
 * total energy  :   -39.1638915 Eh     change       -0.2406876E-03 Eh
   gradient norm :     0.0055623 Eh/α   predicted    -0.1671627E-03 ( -30.55%)
   displ. norm   :     0.1647789 α      lambda       -0.2276705E-03
   maximum displ.:     0.1270837 α      in ANC's #4, #7, #5, ...

........................................................................
.............................. CYCLE    5 ..............................
........................................................................
   1    -39.7207573 -0.397208E+02  0.108E-01    1.93       0.0  T
   2    -39.7207591 -0.185702E-05  0.624E-02    1.94       1.0  T
   3    -39.7207344  0.247515E-04  0.367E-02    1.94       1.0  T
   4    -39.7207615 -0.270842E-04  0.807E-03    1.94       2.5  T
   5    -39.7207622 -0.711639E-06  0.360E-03    1.94       5.7  T
   6    -39.7207623 -0.124325E-06  0.121E-03    1.94      16.9  T
   7    -39.7207623 -0.917785E-08  0.712E-04    1.94      28.7  T
     SCC iter.                  ...        0 min,  0.009 sec
     gradient                   ...        0 min,  0.015 sec
 * total energy  :   -39.1640361 Eh     change       -0.1446153E-03 Eh
   gradient norm :     0.0037389 Eh/α   predicted    -0.1169269E-03 ( -19.15%)
   displ. norm   :     0.1647583 α      lambda        0.7694570E-04
   maximum displ.:     0.1270840 α      in ANC's #4, #7, #5, ...

........................................................................
.............................. CYCLE    6 ..............................
........................................................................
   1    -39.7195817 -0.397196E+02  0.107E-01    1.93       0.0  T
   2    -39.7195834 -0.168985E-05  0.618E-02    1.93       1.0  T
   3    -39.7195563  0.271438E-04  0.386E-02    1.93       1.0  T
   4    -39.7195862 -0.299424E-04  0.791E-03    1.93       2.6  T
   5    -39.7195868 -0.636966E-06  0.361E-03    1.93       5.7  T
   6    -39.7195870 -0.125550E-06  0.122E-03    1.93      16.8  T
   7    -39.7195870 -0.983376E-08  0.710E-04    1.93      28.8  T
   8    -39.7195870 -0.215193E-08  0.431E-04    1.93      47.4  T
     SCC iter.                  ...        0 min,  0.010 sec
     gradient                   ...        0 min,  0.016 sec
 * total energy  :   -39.1640019 Eh     change        0.3421328E-04 Eh
   gradient norm :     0.0100648 Eh/α   predicted     0.3951717E-04 (  15.50%)
   displ. norm   :     0.0669671 α      lambda       -0.1640152E-03
   maximum displ.:     0.0354575 α      in ANC's #6, #5, #4, ...

........................................................................
.............................. CYCLE    7 ..............................
........................................................................
   1    -39.7209199 -0.397209E+02  0.520E-02    1.94       0.0  T
   2    -39.7209209 -0.106409E-05  0.288E-02    1.93       1.0  T
   3    -39.7209154  0.559370E-05  0.194E-02    1.93       1.1  T
   4    -39.7209220 -0.660144E-05  0.517E-03    1.93       4.0  T
   5    -39.7209221 -0.188500E-06  0.274E-03    1.93       7.4  T
   6    -39.7209222 -0.711825E-07  0.101E-03    1.93      20.1  T
     SCC iter.                  ...        0 min,  0.008 sec
     gradient                   ...        0 min,  0.015 sec
 * total energy  :   -39.1641007 Eh     change       -0.9881510E-04 Eh
   gradient norm :     0.0045977 Eh/α   predicted    -0.8237672E-04 ( -16.64%)
   displ. norm   :     0.0562927 α      lambda       -0.6743488E-04
   maximum displ.:     0.0392823 α      in ANC's #4, #6, #1, ...

........................................................................
.............................. CYCLE    8 ..............................
........................................................................
   1    -39.7214950 -0.397215E+02  0.449E-02    1.93       0.0  T
   2    -39.7214956 -0.592497E-06  0.238E-02    1.93       1.0  T
   3    -39.7214926  0.300187E-05  0.138E-02    1.93       1.5  T
   4    -39.7214960 -0.346087E-05  0.356E-03    1.93       5.7  T
   5    -39.7214961 -0.549607E-07  0.190E-03    1.93      10.8  T
   6    -39.7214961 -0.424052E-07  0.612E-04    1.93      33.4  T
     SCC iter.                  ...        0 min,  0.008 sec
     gradient                   ...        0 min,  0.015 sec
 * total energy  :   -39.1641519 Eh     change       -0.5113470E-04 Eh
   gradient norm :     0.0019204 Eh/α   predicted    -0.3382853E-04 ( -33.84%)
   displ. norm   :     0.2142972 α      lambda       -0.9209573E-04
   maximum displ.:     0.1727030 α      in ANC's #4, #6, #1, ...

........................................................................
.............................. CYCLE    9 ..............................
........................................................................
   1    -39.7213176 -0.397213E+02  0.152E-01    1.93       0.0  T
   2    -39.7213216 -0.401491E-05  0.839E-02    1.93       1.0  T
   3    -39.7213152  0.643725E-05  0.232E-02    1.93       1.0  T
   4    -39.7213224 -0.721869E-05  0.102E-02    1.93       2.0  T
   5    -39.7213229 -0.492023E-06  0.453E-03    1.93       4.5  T
   6    -39.7213233 -0.410096E-06  0.121E-03    1.93      16.8  T
   7    -39.7213234 -0.274620E-07  0.431E-04    1.93      47.4  T
   8    -39.7213234 -0.702940E-10  0.272E-04    1.93      75.1  T
     SCC iter.                  ...        0 min,  0.010 sec
     gradient                   ...        0 min,  0.016 sec
 * total energy  :   -39.1642427 Eh     change       -0.9081329E-04 Eh
   gradient norm :     0.0040194 Eh/α   predicted    -0.4699055E-04 ( -48.26%)
   displ. norm   :     0.1416709 α      lambda       -0.7895107E-04
   maximum displ.:     0.1178056 α      in ANC's #4, #1, #6, ...

........................................................................
.............................. CYCLE   10 ..............................
........................................................................
   1    -39.7207813 -0.397208E+02  0.954E-02    1.92       0.0  T
   2    -39.7207826 -0.130329E-05  0.529E-02    1.92       1.0  T
   3    -39.7207817  0.940168E-06  0.105E-02    1.92       1.9  T
   4    -39.7207827 -0.977749E-06  0.596E-03    1.92       3.4  T
   5    -39.7207830 -0.326370E-06  0.206E-03    1.92       9.9  T
   6    -39.7207831 -0.924146E-07  0.356E-04    1.92      57.3  T
     SCC iter.                  ...        0 min,  0.008 sec
     gradient                   ...        0 min,  0.015 sec
 * total energy  :   -39.1643028 Eh     change       -0.6006881E-04 Eh
   gradient norm :     0.0039726 Eh/α   predicted    -0.4027145E-04 ( -32.96%)
   displ. norm   :     0.2518549 α      lambda       -0.1160442E-03
   maximum displ.:     0.2135895 α      in ANC's #4, #1, #6, ...

........................................................................
.............................. CYCLE   11 ..............................
........................................................................
   1    -39.7198979 -0.397199E+02  0.180E-01    1.91       0.0  T
   2    -39.7199037 -0.578860E-05  0.979E-02    1.91       1.0  T
   3    -39.7199011  0.259320E-05  0.201E-02    1.91       1.0  T
   4    -39.7199043 -0.324180E-05  0.110E-02    1.91       1.9  T
   5    -39.7199054 -0.113575E-05  0.240E-03    1.91       8.5  T
   6    -39.7199055 -0.976067E-07  0.768E-04    1.91      26.6  T
   7    -39.7199056 -0.847961E-08  0.370E-04    1.91      55.2  T
     SCC iter.                  ...        0 min,  0.009 sec
     gradient                   ...        0 min,  0.016 sec
 * total energy  :   -39.1643790 Eh     change       -0.7619805E-04 Eh
   gradient norm :     0.0044062 Eh/α   predicted    -0.6170293E-04 ( -19.02%)
   displ. norm   :     0.1412982 α      lambda       -0.6508706E-04
   maximum displ.:     0.1211245 α      in ANC's #4, #1, #6, ...

........................................................................
.............................. CYCLE   12 ..............................
........................................................................
   1    -39.7206209 -0.397206E+02  0.108E-01    1.91       0.0  T
   2    -39.7206234 -0.241784E-05  0.578E-02    1.91       1.0  T
   3    -39.7206212  0.216291E-05  0.144E-02    1.91       1.4  T
   4    -39.7206234 -0.223928E-05  0.816E-03    1.91       2.5  T
   5    -39.7206240 -0.621222E-06  0.282E-03    1.91       7.2  T
   6    -39.7206242 -0.164917E-06  0.436E-04    1.91      46.8  T
     SCC iter.                  ...        0 min,  0.008 sec
     gradient                   ...        0 min,  0.015 sec
 * total energy  :   -39.1644250 Eh     change       -0.4603228E-04 Eh
   gradient norm :     0.0031010 Eh/α   predicted    -0.3319474E-04 ( -27.89%)
   displ. norm   :     0.1977641 α      lambda       -0.4912344E-04
   maximum displ.:     0.1681464 α      in ANC's #4, #1, #6, ...

........................................................................
.............................. CYCLE   13 ..............................
........................................................................
   1    -39.7203898 -0.397204E+02  0.142E-01    1.91       0.0  T
   2    -39.7203937 -0.397893E-05  0.761E-02    1.91       1.0  T
   3    -39.7203921  0.161644E-05  0.156E-02    1.91       1.3  T
   4    -39.7203928 -0.699569E-06  0.113E-02    1.91       1.8  T
   5    -39.7203948 -0.203107E-05  0.252E-03    1.91       8.1  T
   6    -39.7203950 -0.122798E-06  0.427E-04    1.91      47.8  T
   7    -39.7203950 -0.161189E-08  0.217E-04    1.91      94.3  T
     SCC iter.                  ...        0 min,  0.009 sec
     gradient                   ...        0 min,  0.016 sec
 * total energy  :   -39.1644541 Eh     change       -0.2915680E-04 Eh
   gradient norm :     0.0038037 Eh/α   predicted    -0.2552688E-04 ( -12.45%)
   displ. norm   :     0.1464325 α      lambda       -0.5861144E-04
   maximum displ.:     0.1251320 α      in ANC's #4, #1, #6, ...

........................................................................
.............................. CYCLE   14 ..............................
........................................................................
   1    -39.7220068 -0.397220E+02  0.123E-01    1.91       0.0  T
   2    -39.7220098 -0.306159E-05  0.646E-02    1.91       1.0  T
   3    -39.7219932  0.166554E-04  0.308E-02    1.91       1.0  T
   4    -39.7220122 -0.189700E-04  0.849E-03    1.91       2.4  T
   5    -39.7220124 -0.193139E-06  0.184E-03    1.91      11.1  T
   6    -39.7220124 -0.676363E-07  0.493E-04    1.91      41.4  T
   7    -39.7220124 -0.394768E-08  0.202E-04    1.91     101.1  T
     SCC iter.                  ...        0 min,  0.009 sec
     gradient                   ...        0 min,  0.016 sec
 * total energy  :   -39.1644825 Eh     change       -0.2840773E-04 Eh
   gradient norm :     0.0019410 Eh/α   predicted    -0.2993645E-04 (   5.38%)
   displ. norm   :     0.3058921 α      lambda       -0.2855858E-04
   maximum displ.:     0.2661335 α      in ANC's #4, #1, #6, ...

........................................................................
.............................. CYCLE   15 ..............................
........................................................................
   1    -39.7190274 -0.397190E+02  0.225E-01    1.90       0.0  T
   2    -39.7190374 -0.994035E-05  0.120E-01    1.90       1.0  T
   3    -39.7190393 -0.191612E-05  0.190E-02    1.90       1.1  T
   4    -39.7190357  0.359231E-05  0.133E-02    1.90       1.5  T
   5    -39.7190399 -0.419043E-05  0.139E-03    1.90      14.7  T
   6    -39.7190399 -0.337458E-07  0.502E-04    1.90      40.7  T
   7    -39.7190399 -0.222673E-08  0.251E-04    1.90      81.4  T
     SCC iter.                  ...        0 min,  0.009 sec
     gradient                   ...        0 min,  0.016 sec
 * total energy  :   -39.1644679 Eh     change        0.1464046E-04 Eh
   gradient norm :     0.0054262 Eh/α   predicted    -0.1487402E-04 (-201.60%)
   displ. norm   :     0.1079764 α      lambda       -0.6293393E-04
   maximum displ.:     0.0918979 α      in ANC's #4, #1, #6, ...

........................................................................
.............................. CYCLE   16 ..............................
........................................................................
   1    -39.7212184 -0.397212E+02  0.864E-02    1.91       0.0  T
   2    -39.7212200 -0.154979E-05  0.459E-02    1.91       1.0  T
   3    -39.7212196  0.402480E-06  0.918E-03    1.91       2.2  T
   4    -39.7212197 -0.165414E-06  0.657E-03    1.91       3.1  T
   5    -39.7212204 -0.639371E-06  0.178E-03    1.91      11.5  T
   6    -39.7212204 -0.621744E-07  0.291E-04    1.91      70.1  T
     SCC iter.                  ...        0 min,  0.008 sec
     gradient                   ...        0 min,  0.015 sec
 * total energy  :   -39.1645012 Eh     change       -0.3327209E-04 Eh
   gradient norm :     0.0022827 Eh/α   predicted    -0.3183646E-04 (  -4.31%)
   displ. norm   :     0.0127142 α      lambda       -0.9782917E-05
   maximum displ.:     0.0087478 α      in ANC's #6, #10, #8, ...

........................................................................
.............................. CYCLE   17 ..............................
........................................................................
   1    -39.7216312 -0.397216E+02  0.100E-02    1.91       0.0  T
   2    -39.7216313 -0.955427E-07  0.573E-03    1.91       3.6  T
   3    -39.7216312  0.862622E-07  0.281E-03    1.91       7.3  T
   4    -39.7216313 -0.100126E-06  0.106E-03    1.91      19.3  T
   5    -39.7216313 -0.102323E-07  0.468E-04    1.91      43.6  T
   6    -39.7216313 -0.913566E-09  0.262E-04    1.91      77.8  T
     SCC iter.                  ...        0 min,  0.008 sec
     gradient                   ...        0 min,  0.016 sec
 * total energy  :   -39.1645056 Eh     change       -0.4436024E-05 Eh
   gradient norm :     0.0009507 Eh/α   predicted    -0.4893988E-05 (  10.32%)
   displ. norm   :     0.0680937 α      lambda       -0.4946366E-05
   maximum displ.:     0.0575837 α      in ANC's #4, #1, #8, ...

   *** GEOMETRY OPTIMIZATION CONVERGED AFTER 17 ITERATIONS ***

------------------------------------------------------------------------
 total energy gain   :        -0.0125776 Eh       -7.8926 kcal/mol
 total RMSD          :         0.3726178 a0        0.1972 Å
 total power (kW/mol):        -1.9425023 (step)  -53.2307 (real)
------------------------------------------------------------------------

 ANCopt (total)                0 d,  0 h,  0 min,  0.620 sec
 optimizer setup                ...        0 min,  0.000 sec (  0.025%)
 model hessian                  ...        0 min,  0.003 sec (  0.466%)
 ANC generation                 ...        0 min,  0.001 sec (  0.115%)
 coordinate transformation      ...        0 min,  0.000 sec (  0.054%)
 single point calculation       ...        0 min,  0.610 sec ( 98.275%)
 optimization log               ...        0 min,  0.002 sec (  0.276%)
 hessian update                 ...        0 min,  0.000 sec (  0.037%)
 rational function              ...        0 min,  0.004 sec (  0.575%)

================
 final structure:
================
$coord
   -3.10132612932148   -2.96987921959271    0.40362400856092      C 
   -5.23559598845476   -0.53195079323276    0.16474296420477      S 
   -2.88787361551348    1.75450476286898   -0.12016565508756      C 
   -0.52628284743447    0.62355087066942   -0.01240914639853      C 
   -0.70145093034814   -2.06616004066936    0.28171962315413      C 
    2.24880880343226   -3.49939469429344    0.42289351272691      S 
    3.70870034120794   -0.52451703328355    0.11874701908561      C 
    6.46583791500119   -0.24300756017462    0.09954225071790      C 
    7.43641790341986    1.82313855879874   -0.08711962898336      O 
    7.95110583936986   -2.67313875328109    0.32199200478771      C 
   10.78932048525755   -2.21376419167873    0.30063470453717      C 
    2.02852277835889    1.41863278172218   -0.08614089260976      C 
   -3.65894940883525    4.33784857509351   -0.40873153102629      C 
   -2.16027416100645    6.30424787680189   -0.88678823222883      C 
   -3.74418414139142   -4.87624063777115    0.61448637926647      H 
    7.39976726376214   -3.90501077926593   -1.24325454339975      H 
    7.37808722252961   -3.61683500770027    2.06893866095954      H 
   11.34466530220939   -1.29287269066134   -1.44963890806525      H 
   11.80762093548576   -3.98931174808904    0.47382874543472      H 
   11.31879192774404   -0.98493082363336    1.85941067950756      H 
    2.66362307144071    3.33796233862967   -0.26394329982492      H 
   -5.67551212468288    4.63120664784128   -0.22225809102903      H 
   -0.15321688382361    6.12054898215125   -1.13059787590486      H 
   -2.92926684405209    8.17705232515502   -1.07164169285276      H 
$end
           -------------------------------------------------
          |                Final Singlepoint                |
           -------------------------------------------------

          ...................................................
          :                      SETUP                      :
          :.................................................:
          :  # basis functions                  78          :
          :  # atomic orbitals                  76          :
          :  # shells                           40          :
          :  # electrons                        72          :
          :  max. iterations                   250          :
          :  Hamiltonian                  GFN2-xTB          :
          :  restarted?                      false          :
          :  GBSA solvation                  false          :
          :  PC potential                    false          :
          :  electronic temp.          300.0000000     K    :
          :  accuracy                    1.0000000          :
          :  -> integral cutoff          0.2500000E+02      :
          :  -> integral neglect         0.1000000E-07      :
          :  -> SCF convergence          0.1000000E-05 Eh   :
          :  -> wf. convergence          0.1000000E-03 e    :
          :  Broyden damping             0.4000000          :
          ...................................................

 iter      E             dE          RMSdq      gap      omega  full diag
   1    -39.7216313 -0.397216E+02  0.165E-04    1.91       0.0  T
   2    -39.7216313 -0.354561E-11  0.653E-05    1.91     312.4  T
   3    -39.7216313  0.695835E-10  0.935E-05    1.91     218.3  T

   *** convergence criteria satisfied after 3 iterations ***

         #    Occupation            Energy/Eh            Energy/eV
      -------------------------------------------------------------
         1        2.0000           -0.7490908             -20.3838
       ...           ...                  ...                  ...
        30        2.0000           -0.4537160             -12.3462
        31        2.0000           -0.4460118             -12.1366
        32        2.0000           -0.4445856             -12.0978
        33        2.0000           -0.4186356             -11.3917
        34        2.0000           -0.4060632             -11.0495
        35        2.0000           -0.3973475             -10.8124
        36        2.0000           -0.3746355             -10.1944 (HOMO)
        37                         -0.3045298              -8.2867 (LUMO)
        38                         -0.2611108              -7.1052
        39                         -0.2289526              -6.2301
        40                         -0.2150899              -5.8529
        41                         -0.2129526              -5.7947
       ...                                ...                  ...
        76                          0.7313357              19.9007
      -------------------------------------------------------------
                  HL-Gap            0.0701057 Eh            1.9077 eV
             Fermi-level           -0.3395827 Eh           -9.2405 eV

 SCC (total)                   0 d,  0 h,  0 min,  0.033 sec
 SCC setup                      ...        0 min,  0.000 sec (  0.682%)
 Dispersion                     ...        0 min,  0.000 sec (  0.633%)
 integral evaluation            ...        0 min,  0.012 sec ( 35.397%)
 zeroth order Hamiltonian       ...        0 min,  0.000 sec (  0.563%)
 iterations                     ...        0 min,  0.005 sec ( 14.018%)
 molecular gradient             ...        0 min,  0.016 sec ( 47.426%)
 printout                       ...        0 min,  0.000 sec (  1.128%)

         :::::::::::::::::::::::::::::::::::::::::::::::::::::
         ::                     SUMMARY                     ::
         :::::::::::::::::::::::::::::::::::::::::::::::::::::
         :: total energy             -39.164505607133 Eh    ::
         :: gradient norm              0.000949344846 Eh/a0 ::
         :: HOMO-LUMO gap              1.907673856789 eV    ::
         ::.................................................::
         :: SCC energy               -39.721631316607 Eh    ::
         :: -> isotropic ES            0.028012389600 Eh    ::
         :: -> anisotropic ES          0.002794205717 Eh    ::
         :: -> anisotropic XC          0.016756533652 Eh    ::
         :: -> dispersion             -0.026166268979 Eh    ::
         :: repulsion energy           0.557208925737 Eh    ::
         :: add. restraining           0.000000000000 Eh    ::
         :::::::::::::::::::::::::::::::::::::::::::::::::::::

           -------------------------------------------------
          |                Property Printout                |
           -------------------------------------------------

    * Orbital Energies and Occupations

         #    Occupation            Energy/Eh            Energy/eV
      -------------------------------------------------------------
         1        2.0000           -0.7490908             -20.3838
       ...           ...                  ...                  ...
        24        2.0000           -0.4744529             -12.9105
        25        2.0000           -0.4714431             -12.8286
        26        2.0000           -0.4685068             -12.7487
        27        2.0000           -0.4670764             -12.7098
        28        2.0000           -0.4606527             -12.5350
        29        2.0000           -0.4544200             -12.3654
        30        2.0000           -0.4537160             -12.3462
        31        2.0000           -0.4460118             -12.1366
        32        2.0000           -0.4445856             -12.0978
        33        2.0000           -0.4186356             -11.3917
        34        2.0000           -0.4060632             -11.0495
        35        2.0000           -0.3973475             -10.8124
        36        2.0000           -0.3746355             -10.1944 (HOMO)
        37                         -0.3045298              -8.2867 (LUMO)
        38                         -0.2611108              -7.1052
        39                         -0.2289526              -6.2301
        40                         -0.2150899              -5.8529
        41                         -0.2129526              -5.7947
        42                         -0.1894579              -5.1554
        43                         -0.1439569              -3.9173
        44                         -0.1417546              -3.8573
        45                         -0.1233409              -3.3563
        46                         -0.0246973              -0.6720
        47                         -0.0124389              -0.3385
       ...                                ...                  ...
        76                          0.7313357              19.9007
      -------------------------------------------------------------
                  HL-Gap            0.0701057 Eh            1.9077 eV
             Fermi-level           -0.3395827 Eh           -9.2405 eV

     #   Z        covCN         q      C6AA      α(0)
     1   6 C      2.930    -0.038    28.955     8.825
     2  16 S      2.381     0.005   140.834    19.974
     3   6 C      2.979     0.020    27.556     8.611
     4   6 C      3.287    -0.012    26.718     8.303
     5   6 C      3.218     0.029    26.657     8.396
     6  16 S      2.201    -0.080   144.378    20.223
     7   6 C      2.985     0.000    28.017     8.683
     8   6 C      2.835     0.228    23.210     7.895
     9   8 O      0.858    -0.367    21.030     6.148
    10   6 C      3.804    -0.077    21.974     6.674
    11   6 C      3.753    -0.099    22.457     6.758
    12   6 C      3.041    -0.026    28.610     8.773
    13   6 C      2.936    -0.029    28.713     8.788
    14   6 C      2.839    -0.085    30.115     8.993
    15   1 H      0.927     0.056     2.252     2.347
    16   1 H      0.924     0.060     2.204     2.322
    17   1 H      0.924     0.060     2.203     2.321
    18   1 H      0.925     0.051     2.313     2.378
    19   1 H      0.925     0.037     2.483     2.464
    20   1 H      0.925     0.051     2.312     2.378
    21   1 H      0.926     0.066     2.130     2.282
    22   1 H      0.925     0.048     2.348     2.396
    23   1 H      0.926     0.052     2.291     2.367
    24   1 H      0.926     0.050     2.318     2.381

 Mol. C6AA /au·bohr⁶  :      10019.533398
 Mol. C8AA /au·bohr⁸  :     296211.447869
 Mol. α(0) /au        :        160.679019


Wiberg/Mayer (AO) data.
largest (>0.10) Wiberg bond orders for each atom
          total WBO             WBO to atom ...
     1  C   3.944        C    5 1.549    S    2 1.191    H   15 0.968    C    3 0.107
     2  S   2.652        C    1 1.191    C    3 1.164
     3  C   3.936        C    4 1.387    S    2 1.164    C   13 1.152    C    1 0.107
     4  C   3.983        C    3 1.387    C   12 1.218    C    5 1.169
     5  C   3.957        C    1 1.549    C    4 1.169    S    6 1.087
     6  S   2.485        C    5 1.087    C    7 1.078    C   12 0.101
     7  C   3.949        C   12 1.584    S    6 1.078    C    8 1.059
     8  C   3.928        O    9 1.793    C    7 1.059    C   10 0.990
     9  O   2.042        C    8 1.793
    10  C   3.996        C   11 1.020    C    8 0.990    H   17 0.949    H   16 0.949
    11  C   3.993        C   10 1.020    H   19 0.987    H   18 0.986    H   20 0.986
    12  C   3.989        C    7 1.584    C    4 1.218    H   21 0.953    S    6 0.101
    13  C   3.990        C   14 1.838    C    3 1.152    H   22 0.962
    14  C   3.971        C   13 1.838    H   24 0.977    H   23 0.971
    15  H   0.996        C    1 0.968
    16  H   0.996        C   10 0.949
    17  H   0.996        C   10 0.949
    18  H   0.997        C   11 0.986
    19  H   0.998        C   11 0.987
    20  H   0.997        C   11 0.986
    21  H   0.995        C   12 0.953
    22  H   0.997        C   13 0.962
    23  H   0.997        C   14 0.971
    24  H   0.997        C   14 0.977

molecular dipole:
                 x           y           z       tot (Debye)
 q only:       -0.852      -0.447       0.028
   full:       -0.820      -0.492       0.028       2.430
molecular quadrupole (traceless):
                xx          xy          yy          xz          yz          zz
 q only:       -2.665     -10.254       3.424       0.737      -0.668      -0.760
  q+dip:       -5.256     -10.479       5.521       0.463      -0.962      -0.265
   full:       -6.480     -10.481       4.357       0.651      -0.517       2.123

           -------------------------------------------------
          |                Geometry Summary                 |
           -------------------------------------------------

      molecular mass/u    :      222.3194000
   center of mass at/Å    :        0.6617792      -0.1224041       0.0409943
  moments of inertia/u·Å² :        0.4384835E+03   0.1589681E+04   0.2021334E+04
rotational constants/cm⁻¹ :        0.3844530E-01   0.1060441E-01   0.8339854E-02

 * 22 selected distances

     #   Z        #   Z                                     value/Å
     1   6 C      2  16 S                                 1.7192697
     2  16 S      3   6 C                                 1.7407320 (max)
     3   6 C      4   6 C                                 1.3867856
     1   6 C      5   6 C                                 1.3585507
     4   6 C      5   6 C                                 1.4348161
     5   6 C      6  16 S                                 1.7372918
     8   6 C      9   8 O                                 1.2120156
    10   6 C     11   6 C                                 1.5215060
     4   6 C     12   6 C                                 1.4164389
     7   6 C     12   6 C                                 1.3636773
     3   6 C     13   6 C                                 1.4347920
    13   6 C     14   6 C                                 1.3325700
     1   6 C     15   1 H                                 1.0704490 (min)
    10   6 C     16   1 H                                 1.0936802
    10   6 C     17   1 H                                 1.0935849
    11   6 C     18   1 H                                 1.0870577
    11   6 C     19   1 H                                 1.0870055
    11   6 C     20   1 H                                 1.0870896
    12   6 C     21   1 H                                 1.0739551
    13   6 C     22   1 H                                 1.0828571
    14   6 C     23   1 H                                 1.0743038
    14   6 C     24   1 H                                 1.0757950

 * 4 distinct bonds (by element types)

   Z      Z             #   av. dist./Å        max./Å        min./Å
   1 H    6 C          10     1.0825778     1.0936802     1.0704490
   6 C    6 C           8     1.4061421     1.5215060     1.3325700
   6 C    8 O           1     1.2120156     1.2120156     1.2120156
   6 C   16 S           3     1.7324312     1.7407320     1.7192697


optimized geometry written to: xtbopt.xyz


           -------------------------------------------------
          | TOTAL ENERGY              -39.164505607133 Eh   |
          | GRADIENT NORM               0.000949344846 Eh/α |
          | HOMO-LUMO GAP               1.907673856789 eV   |
           -------------------------------------------------

------------------------------------------------------------------------
 * finished run on 2021/05/19 at 11:00:45.711     
------------------------------------------------------------------------
 total:
 * wall-time:     0 d,  0 h,  0 min,  0.725 sec
 *  cpu-time:     0 d,  0 h,  0 min,  0.725 sec
 * ratio c/w:     0.999 speedup
 SCF:
 * wall-time:     0 d,  0 h,  0 min,  0.047 sec
 *  cpu-time:     0 d,  0 h,  0 min,  0.047 sec
 * ratio c/w:     1.000 speedup
 ANC optimizer:
 * wall-time:     0 d,  0 h,  0 min,  0.654 sec
 *  cpu-time:     0 d,  0 h,  0 min,  0.654 sec
 * ratio c/w:     1.000 speedup

