      -----------------------------------------------------------      
     |                   =====================                   |     
     |                           x T B                           |     
     |                   =====================                   |     
     |                         S. Grimme                         |     
     |          Mulliken Center for Theoretical Chemistry        |     
     |                    University of Bonn                     |     
     |                Version 6.2 RC2 (SAW190805)                |     
      -----------------------------------------------------------      

   This program is distributed in the hope that it will be useful,
   but WITHOUT ANY WARRANTY; without even the implied warranty of
   MERCHANTABILITY or FITNESS FOR A PARTICULAR PURPOSE.
   
   FOR NON-COMMERCIAL, ACADEMIA USE ONLY.
   
   Cite this work as:
   * S. Grimme, C. Bannwarth, P. Shushkov, J. Chem. Theory Comput., 2017,
     13, 1989-2009. DOI: 10.1021/acs.jctc.7b00118
   * C. Bannwarth, S. Ehlert and S. Grimme., J. Chem. Theory Comput., 2019,
     15, 1652-1671. DOI: 10.1021/acs.jctc.8b01176
   * P. Pracht, E. Caldeweyher, S. Ehlert, S. Grimme, ChemRxiv, 2019, preprint.
     DOI: 10.26434/chemrxiv.8326202.v1
   
   for DFT-D4:
   * E. Caldeweyher, C. Bannwarth and S. Grimme, J. Chem. Phys., 2017,
     147, 034112. DOI: 10.1063/1.4993215
   * E. Caldeweyher, S. Ehlert, A. Hansen, H. Neugebauer, S. Spicher,
     C. Bannwarth and S. Grimme, J. Chem. Phys., 2019, 150, 154122.
     DOI: 10.1063/1.5090222
   
   for sTDA-xTB:
   * S. Grimme and C. Bannwarth, J. Chem. Phys., 2016, 145, 054103.
     DOI: 10.1063/1.4959605
   
   in the mass-spec context:
   * V. Asgeirsson, C. Bauer and S. Grimme, Chem. Sci., 2017, 8, 4879.
     DOI: 10.1039/c7sc00601b
   
   for metadynamics refer to:
   * S. Grimme, J. Chem. Theory Comput., 2019, 155, 2847-2862
     DOI: 10.1021/acs.jctc.9b00143
   
   with help from (in alphabetical order)
   C. Bannwarth, F. Bohle, G. Brandenburg, E. Caldeweyher, M. Checinski,
   S. Dohm, S. Ehlert, S. Ehrlich, F. März, H. Neugebauer, J. Pisarek,
   P. Pracht, P. Shushkov, and S. Spicher.
   
 * started run on 2021/05/19 at 11:00:46.574     

           -------------------------------------------------
          |                Calculation Setup                |
           -------------------------------------------------

          program call               : /ihome/ghutchison/geoffh/xtb/xtb 768.xyz -opt
          hostname                   : smp-n83
          coordinate file            : 768.xyz
          omp threads                :                     1
          number of atoms            :                    27
          number of electrons        :                    72
          charge                     :                     0
          spin                       :                   0.0
          first test random number   :      0.46479995199851


########################################################################
# WARNING! Please study the warnings concerning your input carefully
#  - the use of '-opt' is discouraged, please use '--opt' next time
########################################################################

           ------------------------------------------------- 
          |                 G F N 2 - x T B                 |
          | Geometry, Frequencies, Noncovalent interactions |
          |            JCTC 2019 parametrisation            |
           ------------------------------------------------- 
             KAB for C  - Si     :                1.0500
             KAB for H  - Pd     :                0.9500
             k(s)              :                1.8500
             k(p)              :                2.2300
             k(d)              :                2.2300
             k(f)              :                2.0000
             kEN (H0ij)        :               -2.0000
             D4 a1             :                0.5200
             D4 a2             :                5.0000
             D4 s6             :                1.0000
             D4 s8             :                2.7000
             D4 s9             :                5.0000
             alphaj            :                2.0000

  Z AO/shell   Hii/eV     exponent
  1     Wed Apr 25 08:07:45 CEST 2018   EN: 2.200 GM2: 0.406  GM3: 0.0800  RAES: 1.40
     1s    -10.707211    1.230000
  6     Wed Apr 25 08:07:45 CEST 2018   EN: 2.550 GM2: 0.538  GM3: 0.1500  RAES: 3.00
     2s    -13.970922    2.096432
     2p    -10.063292    1.800000
  8     Wed Apr 25 08:07:45 CEST 2018   EN: 3.440 GM2: 0.452  GM3:-0.0517  RAES: 1.80
     2s    -20.229985    2.439742
     2p    -15.503117    2.137023
 16     Tue Apr 24 11:44:34 CEST 2018   EN: 2.580 GM2: 0.340  GM3:-0.0502  RAES: 3.10
     3s    -20.029654    1.981333
     3p    -11.377694    2.025643
     3d     -0.420282    1.702555

           ------------------------------------------------- 
          |        Self-Consistent Charge Iterations        |
           ------------------------------------------------- 

          ...................................................
          :                      SETUP                      :
          :.................................................:
          :  # basis functions                  72          :
          :  # atomic orbitals                  71          :
          :  # shells                           41          :
          :  # electrons                        72          :
          :  max. iterations                   250          :
          :  Hamiltonian                  GFN2-xTB          :
          :  restarted?                      false          :
          :  GBSA solvation                  false          :
          :  PC potential                    false          :
          :  electronic temp.          300.0000000     K    :
          :  accuracy                    1.0000000          :
          :  -> integral cutoff          0.2500000E+02      :
          :  -> integral neglect         0.1000000E-07      :
          :  -> SCF convergence          0.1000000E-05 Eh   :
          :  -> wf. convergence          0.1000000E-03 e    :
          :  Broyden damping             0.4000000          :
          ...................................................

 iter      E             dE          RMSdq      gap      omega  full diag
   1    -40.3245474 -0.403245E+02  0.418E+00    2.91       0.0  T
   2    -40.3745827 -0.500353E-01  0.225E+00    2.88       1.0  T
   3    -40.3708717  0.371103E-02  0.919E-01    2.84       1.0  T
   4    -40.3721686 -0.129686E-02  0.550E-01    2.89       1.0  T
   5    -40.3778581 -0.568953E-02  0.133E-01    2.87       1.0  T
   6    -40.3778934 -0.352946E-04  0.702E-02    2.88       1.0  T
   7    -40.3779406 -0.471781E-04  0.270E-02    2.88       1.0  T
   8    -40.3779480 -0.741693E-05  0.139E-02    2.87       1.4  T
   9    -40.3779488 -0.859353E-06  0.474E-03    2.87       4.1  T
  10    -40.3779490 -0.206260E-06  0.142E-03    2.87      13.6  T
  11    -40.3779490 -0.341145E-08  0.903E-04    2.87      21.3  T
  12    -40.3779490 -0.239054E-08  0.486E-04    2.87      39.6  T

   *** convergence criteria satisfied after 12 iterations ***

         #    Occupation            Energy/Eh            Energy/eV
      -------------------------------------------------------------
         1        2.0000           -0.7264753             -19.7684
       ...           ...                  ...                  ...
        30        2.0000           -0.4502437             -12.2518
        31        2.0000           -0.4402592             -11.9801
        32        2.0000           -0.4304009             -11.7118
        33        2.0000           -0.4252221             -11.5709
        34        2.0000           -0.4185762             -11.3900
        35        2.0000           -0.3681845             -10.0188
        36        2.0000           -0.3602741              -9.8036 (HOMO)
        37                         -0.2546462              -6.9293 (LUMO)
        38                         -0.1994994              -5.4287
        39                         -0.1874537              -5.1009
        40                         -0.1452627              -3.9528
        41                         -0.1116784              -3.0389
       ...                                ...                  ...
        71                          0.6807126              18.5231
      -------------------------------------------------------------
                  HL-Gap            0.1056280 Eh            2.8743 eV
             Fermi-level           -0.3074601 Eh           -8.3664 eV

 SCC (total)                   0 d,  0 h,  0 min,  0.042 sec
 SCC setup                      ...        0 min,  0.000 sec (  0.788%)
 Dispersion                     ...        0 min,  0.000 sec (  0.936%)
 integral evaluation            ...        0 min,  0.010 sec ( 24.297%)
 zeroth order Hamiltonian       ...        0 min,  0.000 sec (  0.459%)
 iterations                     ...        0 min,  0.016 sec ( 37.197%)
 molecular gradient             ...        0 min,  0.015 sec ( 35.180%)
 printout                       ...        0 min,  0.000 sec (  1.014%)

         :::::::::::::::::::::::::::::::::::::::::::::::::::::
         ::                     SUMMARY                     ::
         :::::::::::::::::::::::::::::::::::::::::::::::::::::
         :: total energy             -39.885919020050 Eh    ::
         :: gradient norm              0.045895245180 Eh/a0 ::
         :: HOMO-LUMO gap              2.874282920091 eV    ::
         ::.................................................::
         :: SCC energy               -40.377949048543 Eh    ::
         :: -> isotropic ES            0.032013993527 Eh    ::
         :: -> anisotropic ES          0.003203990500 Eh    ::
         :: -> anisotropic XC          0.013609027079 Eh    ::
         :: -> dispersion             -0.023325448956 Eh    ::
         :: repulsion energy           0.491959636425 Eh    ::
         :: add. restraining           0.000000000000 Eh    ::
         :::::::::::::::::::::::::::::::::::::::::::::::::::::

      ----------------------------------------------------------- 
     |                   =====================                   |
     |                        A N C O P T                        |
     |                   =====================                   |
     |               Approximate Normal Coordinate               |
     |                Rational Function Optimizer                |
      ----------------------------------------------------------- 

          ...................................................
          :                      SETUP                      :
          :.................................................:
          :   optimization level            normal          :
          :   max. optcycles                   200          :
          :   ANC micro-cycles                  20          :
          :   degrees of freedom                75          :
          :.................................................:
          :   RF solver                   davidson          :
          :   input Hessian                  false          :
          :   write xtbopt.log                true          :
          :   linear?                        false          :
          :   energy convergence         0.5000000E-05 Eh   :
          :   grad. convergence          0.1000000E-02 Eh/α :
          :   maximium RF displ.         2.0000000          :
          :   Hlow (freq-cutoff)         0.5000000E-02      :
          :   Hmax (freq-cutoff)         5.0000000          :
          :   S6 in model hess.         20.0000000          :
          ...................................................

generating ANC from model Hessian ...
Using Lindh-Hessian (1995)
 Shifting diagonal of input Hessian by   4.098239874569691E-003
 Lowest  eigenvalues of input Hessian
   -0.000000   -0.000000   -0.000000   -0.000000    0.000000    0.000000
    0.005000    0.005475    0.005959    0.006237    0.006941    0.007321
    0.009898    0.011616    0.014260    0.014838    0.018677    0.019825
 Highest eigenvalues
    1.485132    1.676888    1.724019    1.955245    1.974978    2.044563
 

........................................................................
.............................. CYCLE    1 ..............................
........................................................................
   1    -40.3779491 -0.403779E+02  0.116E-04    2.87       0.0  T
   2    -40.3779491 -0.291891E-10  0.766E-05    2.87     251.3  T
   3    -40.3779491  0.179270E-10  0.568E-05    2.87     339.0  T
     SCC iter.                  ...        0 min,  0.005 sec
     gradient                   ...        0 min,  0.015 sec
 * total energy  :   -39.8859191 Eh     change       -0.4568868E-07 Eh
   gradient norm :     0.0458944 Eh/α   predicted     0.0000000E+00 (-100.00%)
   displ. norm   :     0.2833686 α      lambda       -0.4753014E-02
   maximum displ.:     0.1472598 α      in ANC's #7, #4, #1, ...

........................................................................
.............................. CYCLE    2 ..............................
........................................................................
   1    -40.3939199 -0.403939E+02  0.343E-01    2.90       0.0  T
   2    -40.3939680 -0.481166E-04  0.174E-01    2.91       1.0  T
   3    -40.3939031  0.649237E-04  0.669E-02    2.90       1.0  T
   4    -40.3939896 -0.865134E-04  0.258E-02    2.90       1.0  T
   5    -40.3939901 -0.506703E-06  0.114E-02    2.91       1.7  T
   6    -40.3939925 -0.236486E-05  0.243E-03    2.90       7.9  T
   7    -40.3939925 -0.721371E-07  0.123E-03    2.90      15.7  T
     SCC iter.                  ...        0 min,  0.009 sec
     gradient                   ...        0 min,  0.014 sec
 * total energy  :   -39.8891018 Eh     change       -0.3182759E-02 Eh
   gradient norm :     0.0178336 Eh/α   predicted    -0.2567365E-02 ( -19.34%)
   displ. norm   :     0.2833445 α      lambda        0.2835802E-04
   maximum displ.:     0.1472610 α      in ANC's #7, #4, #1, ...

........................................................................
.............................. CYCLE    3 ..............................
........................................................................
   1    -40.4056207 -0.404056E+02  0.346E-01    2.93       0.0  T
   2    -40.4056716 -0.508344E-04  0.176E-01    2.93       1.0  T
   3    -40.4055890  0.825996E-04  0.733E-02    2.93       1.0  T
   4    -40.4056981 -0.109154E-03  0.259E-02    2.93       1.0  T
   5    -40.4056983 -0.171215E-06  0.119E-02    2.93       1.6  T
   6    -40.4057007 -0.238400E-05  0.253E-03    2.93       7.6  T
   7    -40.4057008 -0.841939E-07  0.122E-03    2.93      15.8  T
     SCC iter.                  ...        0 min,  0.009 sec
     gradient                   ...        0 min,  0.014 sec
 * total energy  :   -39.8891350 Eh     change       -0.3315272E-04 Eh
   gradient norm :     0.0216169 Eh/α   predicted     0.1531718E-04 (-146.20%)
   displ. norm   :     0.1664237 α      lambda       -0.1703854E-02
   maximum displ.:     0.0872985 α      in ANC's #7, #23, #3, ...

........................................................................
.............................. CYCLE    4 ..............................
........................................................................
   1    -40.4013479 -0.404013E+02  0.199E-01    2.92       0.0  T
   2    -40.4013646 -0.167617E-04  0.102E-01    2.92       1.0  T
   3    -40.4013620  0.259359E-05  0.257E-02    2.92       1.0  T
   4    -40.4013666 -0.452654E-05  0.149E-02    2.92       1.3  T
   5    -40.4013684 -0.188813E-05  0.342E-03    2.92       5.6  T
   6    -40.4013686 -0.112587E-06  0.161E-03    2.92      11.9  T
     SCC iter.                  ...        0 min,  0.008 sec
     gradient                   ...        0 min,  0.014 sec
 * total energy  :   -39.8902387 Eh     change       -0.1103685E-02 Eh
   gradient norm :     0.0081367 Eh/α   predicted    -0.8755267E-03 ( -20.67%)
   displ. norm   :     0.2836165 α      lambda       -0.8301703E-03
   maximum displ.:     0.1670354 α      in ANC's #7, #4, #3, ...

........................................................................
.............................. CYCLE    5 ..............................
........................................................................
   1    -40.3976605 -0.403977E+02  0.174E-01    2.91       0.0  T
   2    -40.3976736 -0.131025E-04  0.994E-02    2.91       1.0  T
   3    -40.3976403  0.333518E-04  0.428E-02    2.91       1.0  T
   4    -40.3976799 -0.396365E-04  0.101E-02    2.91       1.9  T
   5    -40.3976802 -0.336330E-06  0.525E-03    2.91       3.7  T
   6    -40.3976806 -0.342537E-06  0.229E-03    2.91       8.4  T
   7    -40.3976806 -0.624959E-07  0.668E-04    2.91      28.8  T
     SCC iter.                  ...        0 min,  0.009 sec
     gradient                   ...        0 min,  0.014 sec
 * total energy  :   -39.8908085 Eh     change       -0.5698861E-03 Eh
   gradient norm :     0.0062880 Eh/α   predicted    -0.4484818E-03 ( -21.30%)
   displ. norm   :     0.3698618 α      lambda       -0.6848284E-03
   maximum displ.:     0.1938587 α      in ANC's #7, #4, #3, ...

........................................................................
.............................. CYCLE    6 ..............................
........................................................................
   1    -40.3959083 -0.403959E+02  0.238E-01    2.89       0.0  T
   2    -40.3959239 -0.155999E-04  0.135E-01    2.90       1.0  T
   3    -40.3958762  0.477508E-04  0.510E-02    2.89       1.0  T
   4    -40.3959326 -0.564870E-04  0.149E-02    2.90       1.3  T
   5    -40.3959327 -0.718931E-07  0.768E-03    2.90       2.5  T
   6    -40.3959337 -0.995302E-06  0.218E-03    2.90       8.8  T
   7    -40.3959338 -0.501166E-07  0.819E-04    2.90      23.5  T
     SCC iter.                  ...        0 min,  0.009 sec
     gradient                   ...        0 min,  0.014 sec
 * total energy  :   -39.8913040 Eh     change       -0.4954331E-03 Eh
   gradient norm :     0.0091192 Eh/α   predicted    -0.3892564E-03 ( -21.43%)
   displ. norm   :     0.3977928 α      lambda       -0.6283875E-03
   maximum displ.:     0.2051931 α      in ANC's #4, #1, #7, ...

........................................................................
.............................. CYCLE    7 ..............................
........................................................................
   1    -40.3963333 -0.403963E+02  0.256E-01    2.88       0.0  T
   2    -40.3963476 -0.142551E-04  0.143E-01    2.89       1.0  T
   3    -40.3963122  0.354040E-04  0.462E-02    2.88       1.0  T
   4    -40.3963546 -0.423966E-04  0.161E-02    2.89       1.2  T
   5    -40.3963549 -0.307787E-06  0.722E-03    2.89       2.7  T
   6    -40.3963559 -0.984232E-06  0.170E-03    2.89      11.3  T
   7    -40.3963559 -0.237241E-07  0.769E-04    2.89      25.0  T
     SCC iter.                  ...        0 min,  0.009 sec
     gradient                   ...        0 min,  0.014 sec
 * total energy  :   -39.8917930 Eh     change       -0.4890034E-03 Eh
   gradient norm :     0.0094618 Eh/α   predicted    -0.3639126E-03 ( -25.58%)
   displ. norm   :     0.4097118 α      lambda       -0.6139758E-03
   maximum displ.:     0.2216009 α      in ANC's #1, #4, #3, ...

........................................................................
.............................. CYCLE    8 ..............................
........................................................................
   1    -40.3999066 -0.403999E+02  0.271E-01    2.88       0.0  T
   2    -40.3999198 -0.132492E-04  0.150E-01    2.88       1.0  T
   3    -40.3999112  0.863377E-05  0.337E-02    2.88       1.0  T
   4    -40.3999220 -0.107810E-04  0.179E-02    2.88       1.1  T
   5    -40.3999250 -0.301712E-05  0.397E-03    2.88       4.8  T
   6    -40.3999253 -0.276972E-06  0.148E-03    2.88      13.0  T
   7    -40.3999253 -0.697371E-08  0.880E-04    2.88      21.9  T
     SCC iter.                  ...        0 min,  0.009 sec
     gradient                   ...        0 min,  0.014 sec
 * total energy  :   -39.8922373 Eh     change       -0.4442693E-03 Eh
   gradient norm :     0.0063671 Eh/α   predicted    -0.3585260E-03 ( -19.30%)
   displ. norm   :     0.3602670 α      lambda       -0.3320583E-03
   maximum displ.:     0.2042426 α      in ANC's #1, #4, #3, ...

........................................................................
.............................. CYCLE    9 ..............................
........................................................................
   1    -40.4006616 -0.404007E+02  0.227E-01    2.88       0.0  T
   2    -40.4006692 -0.756337E-05  0.128E-01    2.88       1.0  T
   3    -40.4006629  0.621158E-05  0.271E-02    2.88       1.0  T
   4    -40.4006698 -0.684289E-05  0.156E-02    2.88       1.2  T
   5    -40.4006724 -0.261590E-05  0.281E-03    2.88       6.9  T
   6    -40.4006725 -0.107005E-06  0.136E-03    2.88      14.1  T
     SCC iter.                  ...        0 min,  0.008 sec
     gradient                   ...        0 min,  0.014 sec
 * total energy  :   -39.8924656 Eh     change       -0.2283678E-03 Eh
   gradient norm :     0.0053983 Eh/α   predicted    -0.1875926E-03 ( -17.86%)
   displ. norm   :     0.2203538 α      lambda       -0.1686679E-03
   maximum displ.:     0.1424107 α      in ANC's #1, #4, #6, ...

........................................................................
.............................. CYCLE   10 ..............................
........................................................................
   1    -40.4034277 -0.404034E+02  0.144E-01    2.88       0.0  T
   2    -40.4034314 -0.377106E-05  0.796E-02    2.88       1.0  T
   3    -40.4034304  0.101708E-05  0.158E-02    2.88       1.2  T
   4    -40.4034311 -0.629801E-06  0.105E-02    2.88       1.8  T
   5    -40.4034327 -0.168343E-05  0.163E-03    2.88      11.8  T
   6    -40.4034328 -0.217736E-07  0.904E-04    2.88      21.3  T
     SCC iter.                  ...        0 min,  0.008 sec
     gradient                   ...        0 min,  0.014 sec
 * total energy  :   -39.8925665 Eh     change       -0.1008873E-03 Eh
   gradient norm :     0.0040357 Eh/α   predicted    -0.8843159E-04 ( -12.35%)
   displ. norm   :     0.1807576 α      lambda       -0.7830538E-04
   maximum displ.:     0.1122648 α      in ANC's #1, #3, #6, ...

........................................................................
.............................. CYCLE   11 ..............................
........................................................................
   1    -40.4022578 -0.404023E+02  0.114E-01    2.88       0.0  T
   2    -40.4022597 -0.186650E-05  0.636E-02    2.88       1.0  T
   3    -40.4022599 -0.239577E-06  0.104E-02    2.88       1.8  T
   4    -40.4022594  0.549089E-06  0.659E-03    2.88       2.9  T
   5    -40.4022603 -0.883303E-06  0.128E-03    2.88      15.1  T
   6    -40.4022603 -0.269665E-07  0.499E-04    2.88      38.6  T
     SCC iter.                  ...        0 min,  0.008 sec
     gradient                   ...        0 min,  0.014 sec
 * total energy  :   -39.8926185 Eh     change       -0.5203104E-04 Eh
   gradient norm :     0.0033621 Eh/α   predicted    -0.4043280E-04 ( -22.29%)
   displ. norm   :     0.1260267 α      lambda       -0.7272016E-04
   maximum displ.:     0.0789443 α      in ANC's #1, #6, #8, ...

........................................................................
.............................. CYCLE   12 ..............................
........................................................................
   1    -40.4033464 -0.404033E+02  0.676E-02    2.88       0.0  T
   2    -40.4033475 -0.102704E-05  0.375E-02    2.88       1.0  T
   3    -40.4033453  0.214095E-05  0.123E-02    2.88       1.6  T
   4    -40.4033478 -0.248022E-05  0.456E-03    2.88       4.2  T
   5    -40.4033479 -0.993222E-07  0.194E-03    2.88       9.9  T
   6    -40.4033480 -0.613797E-07  0.409E-04    2.88      47.1  T
   7    -40.4033480 -0.211761E-08  0.216E-04    2.88      89.3  T
     SCC iter.                  ...        0 min,  0.009 sec
     gradient                   ...        0 min,  0.015 sec
 * total energy  :   -39.8926732 Eh     change       -0.5462012E-04 Eh
   gradient norm :     0.0027746 Eh/α   predicted    -0.3693972E-04 ( -32.37%)
   displ. norm   :     0.2321823 α      lambda       -0.1100098E-03
   maximum displ.:     0.1382918 α      in ANC's #1, #6, #8, ...

........................................................................
.............................. CYCLE   13 ..............................
........................................................................
   1    -40.4025757 -0.404026E+02  0.126E-01    2.89       0.0  T
   2    -40.4025783 -0.264678E-05  0.705E-02    2.89       1.0  T
   3    -40.4025746  0.367970E-05  0.177E-02    2.89       1.1  T
   4    -40.4025789 -0.427230E-05  0.819E-03    2.89       2.4  T
   5    -40.4025794 -0.455018E-06  0.263E-03    2.89       7.3  T
   6    -40.4025795 -0.134499E-06  0.674E-04    2.89      28.5  T
   7    -40.4025795 -0.392849E-08  0.398E-04    2.89      48.3  T
     SCC iter.                  ...        0 min,  0.009 sec
     gradient                   ...        0 min,  0.015 sec
 * total energy  :   -39.8927456 Eh     change       -0.7241337E-04 Eh
   gradient norm :     0.0045960 Eh/α   predicted    -0.5797316E-04 ( -19.94%)
   displ. norm   :     0.1930362 α      lambda       -0.9210256E-04
   maximum displ.:     0.1123368 α      in ANC's #1, #6, #2, ...

........................................................................
.............................. CYCLE   14 ..............................
........................................................................
   1    -40.4024292 -0.404024E+02  0.924E-02    2.89       0.0  T
   2    -40.4024306 -0.140773E-05  0.517E-02    2.89       1.0  T
   3    -40.4024306  0.123340E-07  0.841E-03    2.89       2.3  T
   4    -40.4024306  0.131423E-07  0.533E-03    2.89       3.6  T
   5    -40.4024310 -0.402579E-06  0.117E-03    2.89      16.5  T
   6    -40.4024310 -0.249659E-07  0.423E-04    2.89      45.5  T
     SCC iter.                  ...        0 min,  0.008 sec
     gradient                   ...        0 min,  0.014 sec
 * total energy  :   -39.8928058 Eh     change       -0.6018780E-04 Eh
   gradient norm :     0.0044309 Eh/α   predicted    -0.4776811E-04 ( -20.63%)
   displ. norm   :     0.1728333 α      lambda       -0.6401933E-04
   maximum displ.:     0.1030315 α      in ANC's #1, #6, #8, ...

........................................................................
.............................. CYCLE   15 ..............................
........................................................................
   1    -40.4020931 -0.404021E+02  0.930E-02    2.89       0.0  T
   2    -40.4020948 -0.174209E-05  0.517E-02    2.89       1.0  T
   3    -40.4020919  0.294847E-05  0.153E-02    2.89       1.3  T
   4    -40.4020953 -0.341323E-05  0.669E-03    2.89       2.9  T
   5    -40.4020956 -0.304930E-06  0.163E-03    2.89      11.8  T
   6    -40.4020956 -0.441688E-07  0.460E-04    2.89      41.9  T
     SCC iter.                  ...        0 min,  0.008 sec
     gradient                   ...        0 min,  0.014 sec
 * total energy  :   -39.8928495 Eh     change       -0.4377324E-04 Eh
   gradient norm :     0.0038479 Eh/α   predicted    -0.3296850E-04 ( -24.68%)
   displ. norm   :     0.1336844 α      lambda       -0.5592161E-04
   maximum displ.:     0.0912438 α      in ANC's #1, #2, #8, ...

........................................................................
.............................. CYCLE   16 ..............................
........................................................................
   1    -40.4027232 -0.404027E+02  0.779E-02    2.89       0.0  T
   2    -40.4027250 -0.178685E-05  0.419E-02    2.89       1.0  T
   3    -40.4027217  0.331756E-05  0.158E-02    2.89       1.2  T
   4    -40.4027257 -0.407027E-05  0.581E-03    2.89       3.3  T
   5    -40.4027258 -0.115750E-06  0.224E-03    2.89       8.6  T
   6    -40.4027259 -0.851964E-07  0.595E-04    2.89      32.3  T
   7    -40.4027259 -0.481396E-08  0.316E-04    2.89      60.9  T
     SCC iter.                  ...        0 min,  0.009 sec
     gradient                   ...        0 min,  0.015 sec
 * total energy  :   -39.8928831 Eh     change       -0.3358084E-04 Eh
   gradient norm :     0.0018689 Eh/α   predicted    -0.2846191E-04 ( -15.24%)
   displ. norm   :     0.1653621 α      lambda       -0.2624570E-04
   maximum displ.:     0.1226941 α      in ANC's #1, #8, #2, ...

........................................................................
.............................. CYCLE   17 ..............................
........................................................................
   1    -40.4019170 -0.404019E+02  0.967E-02    2.88       0.0  T
   2    -40.4019193 -0.227646E-05  0.517E-02    2.88       1.0  T
   3    -40.4019175  0.173988E-05  0.140E-02    2.88       1.4  T
   4    -40.4019197 -0.221583E-05  0.702E-03    2.88       2.7  T
   5    -40.4019201 -0.332520E-06  0.165E-03    2.88      11.7  T
   6    -40.4019201 -0.488949E-07  0.596E-04    2.88      32.3  T
   7    -40.4019201 -0.436325E-08  0.315E-04    2.88      61.2  T
     SCC iter.                  ...        0 min,  0.009 sec
     gradient                   ...        0 min,  0.015 sec
 * total energy  :   -39.8928994 Eh     change       -0.1625374E-04 Eh
   gradient norm :     0.0025217 Eh/α   predicted    -0.1328551E-04 ( -18.26%)
   displ. norm   :     0.0453502 α      lambda       -0.2279860E-04
   maximum displ.:     0.0317821 α      in ANC's #1, #6, #5, ...

........................................................................
.............................. CYCLE   18 ..............................
........................................................................
   1    -40.4027852 -0.404028E+02  0.274E-02    2.88       0.0  T
   2    -40.4027855 -0.226282E-06  0.145E-02    2.88       1.3  T
   3    -40.4027855 -0.412916E-08  0.297E-03    2.88       6.5  T
   4    -40.4027855 -0.118396E-08  0.182E-03    2.88      10.6  T
   5    -40.4027855 -0.386155E-07  0.613E-04    2.88      31.4  T
   6    -40.4027855 -0.629331E-08  0.168E-04    2.88     114.3  T
     SCC iter.                  ...        0 min,  0.008 sec
     gradient                   ...        0 min,  0.015 sec
 * total energy  :   -39.8929141 Eh     change       -0.1475498E-04 Eh
   gradient norm :     0.0019255 Eh/α   predicted    -0.1142519E-04 ( -22.57%)
   displ. norm   :     0.0792547 α      lambda       -0.1745210E-04
   maximum displ.:     0.0667479 α      in ANC's #1, #6, #5, ...

........................................................................
.............................. CYCLE   19 ..............................
........................................................................
   1    -40.4034493 -0.404034E+02  0.396E-02    2.88       0.0  T
   2    -40.4034498 -0.461951E-06  0.219E-02    2.88       1.0  T
   3    -40.4034490  0.752139E-06  0.755E-03    2.88       2.5  T
   4    -40.4034499 -0.880373E-06  0.303E-03    2.88       6.4  T
   5    -40.4034500 -0.541583E-07  0.104E-03    2.88      18.5  T
   6    -40.4034500 -0.143173E-07  0.337E-04    2.88      57.1  T
   7    -40.4034500 -0.183356E-08  0.162E-04    2.88     119.0  T
     SCC iter.                  ...        0 min,  0.009 sec
     gradient                   ...        0 min,  0.015 sec
 * total energy  :   -39.8929268 Eh     change       -0.1262962E-04 Eh
   gradient norm :     0.0021020 Eh/α   predicted    -0.8753141E-05 ( -30.69%)
   displ. norm   :     0.0319269 α      lambda       -0.8210463E-05
   maximum displ.:     0.0279512 α      in ANC's #1, #8, #5, ...

........................................................................
.............................. CYCLE   20 ..............................
........................................................................
   1    -40.4031889 -0.404032E+02  0.213E-02    2.88       0.0  T
   2    -40.4031891 -0.147287E-06  0.109E-02    2.88       1.8  T
   3    -40.4031890  0.542387E-07  0.283E-03    2.88       6.8  T
   4    -40.4031891 -0.817116E-07  0.158E-03    2.88      12.2  T
   5    -40.4031891 -0.157401E-07  0.501E-04    2.88      38.4  T
   6    -40.4031891 -0.442229E-08  0.120E-04    2.88     160.5  T
     SCC iter.                  ...        0 min,  0.008 sec
     gradient                   ...        0 min,  0.015 sec
 * total energy  :   -39.8929331 Eh     change       -0.6309636E-05 Eh
   gradient norm :     0.0012908 Eh/α   predicted    -0.4114034E-05 ( -34.80%)
   displ. norm   :     0.0591103 α      lambda       -0.7996782E-05
   maximum displ.:     0.0516255 α      in ANC's #1, #8, #9, ...
 * RMSD in coord.:     0.6132923 α      energy gain  -0.7014044E-02 Eh

generating ANC from model Hessian ...
Using Lindh-Hessian (1995)
 Shifting diagonal of input Hessian by   4.085232311400018E-003
 Lowest  eigenvalues of input Hessian
   -0.000000   -0.000000   -0.000000    0.000000    0.000000    0.000000
    0.005000    0.005673    0.006003    0.006252    0.006972    0.007570
    0.010008    0.011627    0.014498    0.015335    0.020196    0.021354
 Highest eigenvalues
    1.502492    1.688527    1.785691    1.989748    2.022284    2.105224
 

........................................................................
.............................. CYCLE   21 ..............................
........................................................................
   1    -40.4029095 -0.404029E+02  0.322E-02    2.89       0.0  T
   2    -40.4029098 -0.224666E-06  0.178E-02    2.89       1.1  T
   3    -40.4029095  0.290896E-06  0.479E-03    2.89       4.0  T
   4    -40.4029098 -0.335529E-06  0.253E-03    2.89       7.6  T
   5    -40.4029099 -0.570716E-07  0.672E-04    2.89      28.6  T
   6    -40.4029099 -0.534717E-08  0.268E-04    2.89      71.9  T
     SCC iter.                  ...        0 min,  0.008 sec
     gradient                   ...        0 min,  0.015 sec
 * total energy  :   -39.8929393 Eh     change       -0.6223074E-05 Eh
   gradient norm :     0.0010115 Eh/α   predicted     0.0000000E+00 (-100.00%)
   displ. norm   :     0.0353316 α      lambda       -0.5615086E-05
   maximum displ.:     0.0283228 α      in ANC's #1, #4, #8, ...

........................................................................
.............................. CYCLE   22 ..............................
........................................................................
   1    -40.4029062 -0.404029E+02  0.169E-02    2.88       0.0  T
   2    -40.4029062 -0.485396E-07  0.963E-03    2.88       2.0  T
   3    -40.4029060  0.220479E-06  0.331E-03    2.88       5.8  T
   4    -40.4029063 -0.249724E-06  0.970E-04    2.88      19.8  T
   5    -40.4029063 -0.330705E-08  0.413E-04    2.88      46.6  T
     SCC iter.                  ...        0 min,  0.007 sec
     gradient                   ...        0 min,  0.015 sec
 * total energy  :   -39.8929451 Eh     change       -0.5851119E-05 Eh
   gradient norm :     0.0003497 Eh/α   predicted    -0.2813512E-05 ( -51.91%)
   displ. norm   :     0.0265595 α      lambda       -0.2846212E-05
   maximum displ.:     0.0174830 α      in ANC's #1, #4, #8, ...

........................................................................
.............................. CYCLE   23 ..............................
........................................................................
   1    -40.4029049 -0.404029E+02  0.128E-02    2.88       0.0  T
   2    -40.4029049 -0.247062E-07  0.736E-03    2.88       2.6  T
   3    -40.4029048  0.855456E-07  0.214E-03    2.88       9.0  T
   4    -40.4029049 -0.988929E-07  0.687E-04    2.88      28.0  T
   5    -40.4029049 -0.137941E-08  0.264E-04    2.88      72.8  T
     SCC iter.                  ...        0 min,  0.006 sec
     gradient                   ...        0 min,  0.015 sec
 * total energy  :   -39.8929485 Eh     change       -0.3381020E-05 Eh
   gradient norm :     0.0004738 Eh/α   predicted    -0.1423806E-05 ( -57.89%)
   displ. norm   :     0.0601277 α      lambda       -0.5017282E-05
   maximum displ.:     0.0382038 α      in ANC's #1, #4, #8, ...

   *** GEOMETRY OPTIMIZATION CONVERGED AFTER 23 ITERATIONS ***

------------------------------------------------------------------------
 total energy gain   :        -0.0070295 Eh       -4.4111 kcal/mol
 total RMSD          :         0.6158579 a0        0.3259 Å
 total power (kW/mol):        -0.8024325 (step)  -24.0692 (real)
------------------------------------------------------------------------

 ANCopt (total)                0 d,  0 h,  0 min,  0.767 sec
 optimizer setup                ...        0 min,  0.000 sec (  0.021%)
 model hessian                  ...        0 min,  0.008 sec (  1.103%)
 ANC generation                 ...        0 min,  0.002 sec (  0.207%)
 coordinate transformation      ...        0 min,  0.000 sec (  0.064%)
 single point calculation       ...        0 min,  0.747 sec ( 97.425%)
 optimization log               ...        0 min,  0.003 sec (  0.326%)
 hessian update                 ...        0 min,  0.000 sec (  0.042%)
 rational function              ...        0 min,  0.005 sec (  0.622%)

================
 final structure:
================
$coord
    0.00684721844980    2.26091122140074   -1.88096043035543      C 
   -2.03660503336142   -0.25827267135527   -1.73340261898032      S 
    0.26888203679152   -2.15820802052424   -0.37247793220009      C 
    2.50543330022817   -0.85554294576560   -0.07400709698103      C 
    2.34633871046200    1.69811477708506   -0.96078955705689      C 
    4.37588218914057    3.28201106537532   -0.86323732774021      O 
    4.04004481435166    5.75086593563153   -1.82742252657384      C 
    6.55428221670544    7.12343722827097   -1.61794597464815      C 
    4.52581212838883   -2.06796577370185    0.93659640857568      O 
    6.65764588664102   -0.64726262432111    1.72078505696441      C 
    8.41937603389546   -2.44909403047462    3.10131875588258      C 
   -0.17541540254246   -4.74550260643502    0.31325563060149      C 
   -2.34359407271652   -5.97153608930257   -0.01838004593940      C 
   -0.65854058407657    4.00525017880542   -2.66069105865839      H 
    2.57621580861286    6.73979333201366   -0.73482125602094      H 
    3.42748029675980    5.65574817073369   -3.80915260159844      H 
    7.16956018198970    7.16777436444556    0.34085177607735      H 
    6.35703971866193    9.04622239900552   -2.30753758764056      H 
    7.98094063719604    6.15219933259769   -2.73083693015276      H 
    6.06442285633003    0.89035850821383    2.97701728190382      H 
    7.60857428501792    0.17975226018604    0.07752821999951      H 
    7.46410478379559   -3.26124971183696    4.72785737965931      H 
   10.09081626197289   -1.43987034140453    3.73416039840341      H 
    8.98487802770781   -3.97411997399385    1.84783142085974      H 
    1.44481125999329   -5.66681540765355    1.15152730551039      H 
   -3.95565530150111   -5.05779707891647   -0.86285432564656      H 
   -2.56906286222026   -7.91332343899401    0.53562793010153      H 
$end
           -------------------------------------------------
          |                Final Singlepoint                |
           -------------------------------------------------

          ...................................................
          :                      SETUP                      :
          :.................................................:
          :  # basis functions                  72          :
          :  # atomic orbitals                  71          :
          :  # shells                           41          :
          :  # electrons                        72          :
          :  max. iterations                   250          :
          :  Hamiltonian                  GFN2-xTB          :
          :  restarted?                      false          :
          :  GBSA solvation                  false          :
          :  PC potential                    false          :
          :  electronic temp.          300.0000000     K    :
          :  accuracy                    1.0000000          :
          :  -> integral cutoff          0.2500000E+02      :
          :  -> integral neglect         0.1000000E-07      :
          :  -> SCF convergence          0.1000000E-05 Eh   :
          :  -> wf. convergence          0.1000000E-03 e    :
          :  Broyden damping             0.4000000          :
          ...................................................

 iter      E             dE          RMSdq      gap      omega  full diag
   1    -40.4029049 -0.404029E+02  0.137E-04    2.88       0.0  T
   2    -40.4029049 -0.708411E-11  0.612E-05    2.88     314.5  T
   3    -40.4029049 -0.375380E-10  0.693E-05    2.88     277.9  T

   *** convergence criteria satisfied after 3 iterations ***

         #    Occupation            Energy/Eh            Energy/eV
      -------------------------------------------------------------
         1        2.0000           -0.7229886             -19.6735
       ...           ...                  ...                  ...
        30        2.0000           -0.4496572             -12.2358
        31        2.0000           -0.4398266             -11.9683
        32        2.0000           -0.4307249             -11.7206
        33        2.0000           -0.4263956             -11.6028
        34        2.0000           -0.4196583             -11.4195
        35        2.0000           -0.3672234              -9.9927
        36        2.0000           -0.3583616              -9.7515 (HOMO)
        37                         -0.2523624              -6.8671 (LUMO)
        38                         -0.2000064              -5.4425
        39                         -0.1814494              -4.9375
        40                         -0.1346390              -3.6637
        41                         -0.1139274              -3.1001
       ...                                ...                  ...
        71                          0.6831711              18.5900
      -------------------------------------------------------------
                  HL-Gap            0.1059991 Eh            2.8844 eV
             Fermi-level           -0.3053620 Eh           -8.3093 eV

 SCC (total)                   0 d,  0 h,  0 min,  0.029 sec
 SCC setup                      ...        0 min,  0.000 sec (  0.723%)
 Dispersion                     ...        0 min,  0.000 sec (  0.753%)
 integral evaluation            ...        0 min,  0.010 sec ( 32.249%)
 zeroth order Hamiltonian       ...        0 min,  0.000 sec (  0.577%)
 iterations                     ...        0 min,  0.004 sec ( 15.093%)
 molecular gradient             ...        0 min,  0.014 sec ( 49.124%)
 printout                       ...        0 min,  0.000 sec (  1.259%)

         :::::::::::::::::::::::::::::::::::::::::::::::::::::
         ::                     SUMMARY                     ::
         :::::::::::::::::::::::::::::::::::::::::::::::::::::
         :: total energy             -39.892948500516 Eh    ::
         :: gradient norm              0.000474196021 Eh/a0 ::
         :: HOMO-LUMO gap              2.884382905290 eV    ::
         ::.................................................::
         :: SCC energy               -40.402904907067 Eh    ::
         :: -> isotropic ES            0.031542896555 Eh    ::
         :: -> anisotropic ES          0.002125307585 Eh    ::
         :: -> anisotropic XC          0.012825375383 Eh    ::
         :: -> dispersion             -0.023395474766 Eh    ::
         :: repulsion energy           0.509901157929 Eh    ::
         :: add. restraining           0.000000000000 Eh    ::
         :::::::::::::::::::::::::::::::::::::::::::::::::::::

           -------------------------------------------------
          |                Property Printout                |
           -------------------------------------------------

    * Orbital Energies and Occupations

         #    Occupation            Energy/Eh            Energy/eV
      -------------------------------------------------------------
         1        2.0000           -0.7229886             -19.6735
       ...           ...                  ...                  ...
        24        2.0000           -0.4788367             -13.0298
        25        2.0000           -0.4702826             -12.7970
        26        2.0000           -0.4692019             -12.7676
        27        2.0000           -0.4648289             -12.6486
        28        2.0000           -0.4634800             -12.6119
        29        2.0000           -0.4523879             -12.3101
        30        2.0000           -0.4496572             -12.2358
        31        2.0000           -0.4398266             -11.9683
        32        2.0000           -0.4307249             -11.7206
        33        2.0000           -0.4263956             -11.6028
        34        2.0000           -0.4196583             -11.4195
        35        2.0000           -0.3672234              -9.9927
        36        2.0000           -0.3583616              -9.7515 (HOMO)
        37                         -0.2523624              -6.8671 (LUMO)
        38                         -0.2000064              -5.4425
        39                         -0.1814494              -4.9375
        40                         -0.1346390              -3.6637
        41                         -0.1139274              -3.1001
        42                         -0.0074433              -0.2025
        43                          0.0135448               0.3686
        44                          0.0383000               1.0422
        45                          0.0393859               1.0717
        46                          0.0455227               1.2387
        47                          0.0998446               2.7169
       ...                                ...                  ...
        71                          0.6831711              18.5900
      -------------------------------------------------------------
                  HL-Gap            0.1059991 Eh            2.8844 eV
             Fermi-level           -0.3053620 Eh           -8.3093 eV

     #   Z        covCN         q      C6AA      α(0)
     1   6 C      2.932    -0.069    29.709     8.939
     2  16 S      2.300    -0.053   143.270    20.146
     3   6 C      2.984    -0.006    28.158     8.704
     4   6 C      3.038     0.108    25.572     8.294
     5   6 C      3.039     0.104    25.657     8.308
     6   8 O      1.704    -0.284    18.711     5.840
     7   6 C      3.697     0.089    19.263     6.278
     8   6 C      3.751    -0.112    22.712     6.796
     9   8 O      1.705    -0.269    18.457     5.800
    10   6 C      3.690     0.087    19.308     6.289
    11   6 C      3.751    -0.113    22.721     6.798
    12   6 C      2.915    -0.026    28.657     8.778
    13   6 C      2.841    -0.093    30.316     9.023
    14   1 H      0.927     0.046     2.366     2.406
    15   1 H      0.923     0.028     2.617     2.530
    16   1 H      0.923     0.029     2.604     2.524
    17   1 H      0.925     0.056     2.243     2.342
    18   1 H      0.925     0.049     2.337     2.390
    19   1 H      0.925     0.056     2.247     2.344
    20   1 H      0.924     0.035     2.511     2.478
    21   1 H      0.924     0.042     2.417     2.431
    22   1 H      0.925     0.054     2.269     2.355
    23   1 H      0.925     0.046     2.374     2.409
    24   1 H      0.925     0.055     2.255     2.349
    25   1 H      0.925     0.052     2.289     2.366
    26   1 H      0.926     0.046     2.370     2.407
    27   1 H      0.926     0.040     2.449     2.447

 Mol. C6AA /au·bohr⁶  :       8467.390350
 Mol. C8AA /au·bohr⁸  :     216813.245676
 Mol. α(0) /au        :        143.773840


Wiberg/Mayer (AO) data.
largest (>0.10) Wiberg bond orders for each atom
          total WBO             WBO to atom ...
     1  C   3.931        C    5 1.541    S    2 1.165    H   14 0.969
     2  S   2.575        C    1 1.165    C    3 1.113
     3  C   3.938        C    4 1.455    C   12 1.142    S    2 1.113
     4  C   3.936        C    3 1.455    C    5 1.177    O    9 1.067
     5  C   3.932        C    1 1.541    C    4 1.177    O    6 1.044
     6  O   2.210        C    5 1.044    C    7 0.964
     7  C   3.946        C    8 1.016    H   15 0.969    H   16 0.969    O    6 0.964
     8  C   3.992        C    7 1.016    H   19 0.986    H   17 0.986    H   18 0.985
     9  O   2.232        C    4 1.067    C   10 0.957
    10  C   3.941        C   11 1.015    H   20 0.971    H   21 0.968    O    9 0.957
    11  C   3.992        C   10 1.015    H   22 0.986    H   24 0.986    H   23 0.985
    12  C   3.990        C   13 1.860    C    3 1.142    H   25 0.956
    13  C   3.988        C   12 1.860    H   27 0.978    H   26 0.972
    14  H   0.998        C    1 0.969
    15  H   0.999        C    7 0.969
    16  H   0.999        C    7 0.969
    17  H   0.997        C    8 0.986
    18  H   0.997        C    8 0.985
    19  H   0.997        C    8 0.986
    20  H   0.998        C   10 0.971
    21  H   0.997        C   10 0.968
    22  H   0.997        C   11 0.986
    23  H   0.997        C   11 0.985
    24  H   0.997        C   11 0.986
    25  H   0.997        C   12 0.956
    26  H   0.998        C   13 0.972
    27  H   0.998        C   13 0.978

molecular dipole:
                 x           y           z       tot (Debye)
 q only:        0.631       0.643       0.102
   full:        0.903       0.969       0.101       3.376
molecular quadrupole (traceless):
                xx          xy          yy          xz          yz          zz
 q only:        3.189       4.511       2.179       2.006      -3.299      -5.368
  q+dip:        0.689       4.084       3.347       0.203      -3.815      -4.036
   full:        0.418       4.281       3.437       0.133      -3.683      -3.855

           -------------------------------------------------
          |                Geometry Summary                 |
           -------------------------------------------------

      molecular mass/u    :      198.2794000
   center of mass at/Å    :        1.2791051       0.0636277      -0.1908542
  moments of inertia/u·Å² :        0.5745484E+03   0.9765999E+03   0.1535882E+04
rotational constants/cm⁻¹ :        0.2934066E-01   0.1726155E-01   0.1097586E-01

 * 26 selected distances

     #   Z        #   Z                                     value/Å
     1   6 C      2  16 S                                 1.7182996
     2  16 S      3   6 C                                 1.7372125 (max)
     3   6 C      4   6 C                                 1.3787259
     1   6 C      5   6 C                                 1.3632529
     4   6 C      5   6 C                                 1.4329727
     5   6 C      6   8 O                                 1.3633162
     6   8 O      7   6 C                                 1.4137735
     7   6 C      8   6 C                                 1.5198743
     4   6 C      9   8 O                                 1.3567200
     9   8 O     10   6 C                                 1.4177670
    10   6 C     11   6 C                                 1.5205136
    12   6 C     13   6 C                                 1.3297140
     1   6 C     14   1 H                                 1.0706446 (min)
     7   6 C     15   1 H                                 1.0991803
     7   6 C     16   1 H                                 1.0987964
     8   6 C     17   1 H                                 1.0867375
     8   6 C     18   1 H                                 1.0859800
     8   6 C     19   1 H                                 1.0867069
    10   6 C     20   1 H                                 1.0965993
    10   6 C     21   1 H                                 1.0958585
    11   6 C     22   1 H                                 1.0867822
    11   6 C     23   1 H                                 1.0861334
    11   6 C     24   1 H                                 1.0866481
    12   6 C     25   1 H                                 1.0814720
    13   6 C     26   1 H                                 1.0776000
    13   6 C     27   1 H                                 1.0751938

 * 4 distinct bonds (by element types)

   Z      Z             #   av. dist./Å        max./Å        min./Å
   1 H    6 C          14     1.0867381     1.0991803     1.0706446
   6 C    6 C           6     1.4241756     1.5205136     1.3297140
   6 C    8 O           4     1.3878942     1.4177670     1.3567200
   6 C   16 S           2     1.7277561     1.7372125     1.7182996


optimized geometry written to: xtbopt.xyz


           -------------------------------------------------
          | TOTAL ENERGY              -39.892948500516 Eh   |
          | GRADIENT NORM               0.000474196021 Eh/α |
          | HOMO-LUMO GAP               2.884382905290 eV   |
           -------------------------------------------------

------------------------------------------------------------------------
 * finished run on 2021/05/19 at 11:00:47.436     
------------------------------------------------------------------------
 total:
 * wall-time:     0 d,  0 h,  0 min,  0.862 sec
 *  cpu-time:     0 d,  0 h,  0 min,  0.861 sec
 * ratio c/w:     0.999 speedup
 SCF:
 * wall-time:     0 d,  0 h,  0 min,  0.042 sec
 *  cpu-time:     0 d,  0 h,  0 min,  0.042 sec
 * ratio c/w:     1.000 speedup
 ANC optimizer:
 * wall-time:     0 d,  0 h,  0 min,  0.797 sec
 *  cpu-time:     0 d,  0 h,  0 min,  0.797 sec
 * ratio c/w:     1.000 speedup

