      -----------------------------------------------------------      
     |                   =====================                   |     
     |                           x T B                           |     
     |                   =====================                   |     
     |                         S. Grimme                         |     
     |          Mulliken Center for Theoretical Chemistry        |     
     |                    University of Bonn                     |     
     |                Version 6.2 RC2 (SAW190805)                |     
      -----------------------------------------------------------      

   This program is distributed in the hope that it will be useful,
   but WITHOUT ANY WARRANTY; without even the implied warranty of
   MERCHANTABILITY or FITNESS FOR A PARTICULAR PURPOSE.
   
   FOR NON-COMMERCIAL, ACADEMIA USE ONLY.
   
   Cite this work as:
   * S. Grimme, C. Bannwarth, P. Shushkov, J. Chem. Theory Comput., 2017,
     13, 1989-2009. DOI: 10.1021/acs.jctc.7b00118
   * C. Bannwarth, S. Ehlert and S. Grimme., J. Chem. Theory Comput., 2019,
     15, 1652-1671. DOI: 10.1021/acs.jctc.8b01176
   * P. Pracht, E. Caldeweyher, S. Ehlert, S. Grimme, ChemRxiv, 2019, preprint.
     DOI: 10.26434/chemrxiv.8326202.v1
   
   for DFT-D4:
   * E. Caldeweyher, C. Bannwarth and S. Grimme, J. Chem. Phys., 2017,
     147, 034112. DOI: 10.1063/1.4993215
   * E. Caldeweyher, S. Ehlert, A. Hansen, H. Neugebauer, S. Spicher,
     C. Bannwarth and S. Grimme, J. Chem. Phys., 2019, 150, 154122.
     DOI: 10.1063/1.5090222
   
   for sTDA-xTB:
   * S. Grimme and C. Bannwarth, J. Chem. Phys., 2016, 145, 054103.
     DOI: 10.1063/1.4959605
   
   in the mass-spec context:
   * V. Asgeirsson, C. Bauer and S. Grimme, Chem. Sci., 2017, 8, 4879.
     DOI: 10.1039/c7sc00601b
   
   for metadynamics refer to:
   * S. Grimme, J. Chem. Theory Comput., 2019, 155, 2847-2862
     DOI: 10.1021/acs.jctc.9b00143
   
   with help from (in alphabetical order)
   C. Bannwarth, F. Bohle, G. Brandenburg, E. Caldeweyher, M. Checinski,
   S. Dohm, S. Ehlert, S. Ehrlich, F. März, H. Neugebauer, J. Pisarek,
   P. Pracht, P. Shushkov, and S. Spicher.
   
 * started run on 2021/05/19 at 11:00:50.912     

           -------------------------------------------------
          |                Calculation Setup                |
           -------------------------------------------------

          program call               : /ihome/ghutchison/geoffh/xtb/xtb 775.xyz -opt
          hostname                   : smp-n83
          coordinate file            : 775.xyz
          omp threads                :                     1
          number of atoms            :                    30
          number of electrons        :                    74
          charge                     :                     0
          spin                       :                   0.0
          first test random number   :      0.49722530518852


########################################################################
# WARNING! Please study the warnings concerning your input carefully
#  - the use of '-opt' is discouraged, please use '--opt' next time
########################################################################

           ------------------------------------------------- 
          |                 G F N 2 - x T B                 |
          | Geometry, Frequencies, Noncovalent interactions |
          |            JCTC 2019 parametrisation            |
           ------------------------------------------------- 
             KAB for C  - Si     :                1.0500
             KAB for H  - Pd     :                0.9500
             k(s)              :                1.8500
             k(p)              :                2.2300
             k(d)              :                2.2300
             k(f)              :                2.0000
             kEN (H0ij)        :               -2.0000
             D4 a1             :                0.5200
             D4 a2             :                5.0000
             D4 s6             :                1.0000
             D4 s8             :                2.7000
             D4 s9             :                5.0000
             alphaj            :                2.0000

  Z AO/shell   Hii/eV     exponent
  1     Wed Apr 25 08:07:45 CEST 2018   EN: 2.200 GM2: 0.406  GM3: 0.0800  RAES: 1.40
     1s    -10.707211    1.230000
  6     Wed Apr 25 08:07:45 CEST 2018   EN: 2.550 GM2: 0.538  GM3: 0.1500  RAES: 3.00
     2s    -13.970922    2.096432
     2p    -10.063292    1.800000
 16     Tue Apr 24 11:44:34 CEST 2018   EN: 2.580 GM2: 0.340  GM3:-0.0502  RAES: 3.10
     3s    -20.029654    1.981333
     3p    -11.377694    2.025643
     3d     -0.420282    1.702555

           ------------------------------------------------- 
          |        Self-Consistent Charge Iterations        |
           ------------------------------------------------- 

          ...................................................
          :                      SETUP                      :
          :.................................................:
          :  # basis functions                  78          :
          :  # atomic orbitals                  77          :
          :  # shells                           45          :
          :  # electrons                        74          :
          :  max. iterations                   250          :
          :  Hamiltonian                  GFN2-xTB          :
          :  restarted?                      false          :
          :  GBSA solvation                  false          :
          :  PC potential                    false          :
          :  electronic temp.          300.0000000     K    :
          :  accuracy                    1.0000000          :
          :  -> integral cutoff          0.2500000E+02      :
          :  -> integral neglect         0.1000000E-07      :
          :  -> SCF convergence          0.1000000E-05 Eh   :
          :  -> wf. convergence          0.1000000E-03 e    :
          :  Broyden damping             0.4000000          :
          ...................................................

 iter      E             dE          RMSdq      gap      omega  full diag
   1    -39.7453418 -0.397453E+02  0.389E+00    2.89       0.0  T
   2    -39.7888837 -0.435419E-01  0.226E+00    2.95       1.0  T
   3    -39.7824644  0.641927E-02  0.910E-01    2.92       1.0  T
   4    -39.7898230 -0.735859E-02  0.453E-01    2.93       1.0  T
   5    -39.7933106 -0.348760E-02  0.108E-01    2.93       1.0  T
   6    -39.7933429 -0.322758E-04  0.650E-02    2.93       1.0  T
   7    -39.7934109 -0.679967E-04  0.233E-02    2.93       1.0  T
   8    -39.7934171 -0.620933E-05  0.128E-02    2.93       1.4  T
   9    -39.7934183 -0.124309E-05  0.576E-03    2.93       3.2  T
  10    -39.7934186 -0.282200E-06  0.297E-03    2.93       6.1  T
  11    -39.7934187 -0.100852E-06  0.131E-03    2.93      13.9  T
  12    -39.7934187 -0.134619E-07  0.528E-04    2.93      34.6  T
  13    -39.7934187 -0.886779E-09  0.243E-04    2.93      75.2  T

   *** convergence criteria satisfied after 13 iterations ***

         #    Occupation            Energy/Eh            Energy/eV
      -------------------------------------------------------------
         1        2.0000           -0.7227354             -19.6666
       ...           ...                  ...                  ...
        31        2.0000           -0.4295640             -11.6890
        32        2.0000           -0.4257809             -11.5861
        33        2.0000           -0.4203102             -11.4372
        34        2.0000           -0.4150248             -11.2934
        35        2.0000           -0.3992098             -10.8631
        36        2.0000           -0.3800515             -10.3417
        37        2.0000           -0.3650783              -9.9343 (HOMO)
        38                         -0.2575287              -7.0077 (LUMO)
        39                         -0.2115653              -5.7570
        40                         -0.1921729              -5.2293
        41                         -0.1885492              -5.1307
        42                         -0.1471092              -4.0030
       ...                                ...                  ...
        77                          0.6773485              18.4316
      -------------------------------------------------------------
                  HL-Gap            0.1075496 Eh            2.9266 eV
             Fermi-level           -0.3113035 Eh           -8.4710 eV

 SCC (total)                   0 d,  0 h,  0 min,  0.063 sec
 SCC setup                      ...        0 min,  0.000 sec (  0.588%)
 Dispersion                     ...        0 min,  0.000 sec (  0.731%)
 integral evaluation            ...        0 min,  0.025 sec ( 38.870%)
 zeroth order Hamiltonian       ...        0 min,  0.000 sec (  0.369%)
 iterations                     ...        0 min,  0.019 sec ( 29.993%)
 molecular gradient             ...        0 min,  0.018 sec ( 28.700%)
 printout                       ...        0 min,  0.000 sec (  0.658%)

         :::::::::::::::::::::::::::::::::::::::::::::::::::::
         ::                     SUMMARY                     ::
         :::::::::::::::::::::::::::::::::::::::::::::::::::::
         :: total energy             -39.193417518286 Eh    ::
         :: gradient norm              0.057497419394 Eh/a0 ::
         :: HOMO-LUMO gap              2.926574215370 eV    ::
         ::.................................................::
         :: SCC energy               -39.793418722565 Eh    ::
         :: -> isotropic ES            0.003805594068 Eh    ::
         :: -> anisotropic ES          0.006844565184 Eh    ::
         :: -> anisotropic XC          0.024469461679 Eh    ::
         :: -> dispersion             -0.031263477142 Eh    ::
         :: repulsion energy           0.599663153795 Eh    ::
         :: add. restraining           0.000000000000 Eh    ::
         :::::::::::::::::::::::::::::::::::::::::::::::::::::

      ----------------------------------------------------------- 
     |                   =====================                   |
     |                        A N C O P T                        |
     |                   =====================                   |
     |               Approximate Normal Coordinate               |
     |                Rational Function Optimizer                |
      ----------------------------------------------------------- 

          ...................................................
          :                      SETUP                      :
          :.................................................:
          :   optimization level            normal          :
          :   max. optcycles                   200          :
          :   ANC micro-cycles                  20          :
          :   degrees of freedom                84          :
          :.................................................:
          :   RF solver                   davidson          :
          :   input Hessian                  false          :
          :   write xtbopt.log                true          :
          :   linear?                        false          :
          :   energy convergence         0.5000000E-05 Eh   :
          :   grad. convergence          0.1000000E-02 Eh/α :
          :   maximium RF displ.         2.0000000          :
          :   Hlow (freq-cutoff)         0.5000000E-02      :
          :   Hmax (freq-cutoff)         5.0000000          :
          :   S6 in model hess.         20.0000000          :
          ...................................................

generating ANC from model Hessian ...
Using Lindh-Hessian (1995)
 Shifting diagonal of input Hessian by   4.015808522703552E-003
 Lowest  eigenvalues of input Hessian
   -0.000000   -0.000000   -0.000000   -0.000000    0.000000    0.000000
    0.005000    0.005771    0.005918    0.006955    0.008520    0.008970
    0.009958    0.011518    0.012780    0.013157    0.015436    0.018073
 Highest eigenvalues
    1.568638    1.648210    1.695408    1.789303    1.843910    1.976382
 

........................................................................
.............................. CYCLE    1 ..............................
........................................................................
   1    -39.7934187 -0.397934E+02  0.148E-04    2.93       0.0  T
   2    -39.7934187 -0.360529E-10  0.116E-04    2.93     157.6  T
   3    -39.7934187 -0.329131E-09  0.537E-05    2.93     339.9  T
     SCC iter.                  ...        0 min,  0.005 sec
     gradient                   ...        0 min,  0.018 sec
 * total energy  :   -39.1934176 Eh     change       -0.4922916E-07 Eh
   gradient norm :     0.0574979 Eh/α   predicted     0.0000000E+00 (-100.00%)
   displ. norm   :     0.3198053 α      lambda       -0.7122754E-02
   maximum displ.:     0.1417234 α      in ANC's #15, #18, #9, ...

........................................................................
.............................. CYCLE    2 ..............................
........................................................................
   1    -39.8275106 -0.398275E+02  0.217E-01    2.96       0.0  T
   2    -39.8275510 -0.404388E-04  0.111E-01    2.96       1.0  T
   3    -39.8274795  0.714952E-04  0.682E-02    2.96       1.0  T
   4    -39.8276027 -0.123172E-03  0.221E-02    2.96       1.0  T
   5    -39.8276055 -0.283287E-05  0.132E-02    2.96       1.4  T
   6    -39.8276077 -0.216821E-05  0.260E-03    2.96       7.0  T
   7    -39.8276078 -0.109484E-06  0.908E-04    2.96      20.1  T
     SCC iter.                  ...        0 min,  0.010 sec
     gradient                   ...        0 min,  0.017 sec
 * total energy  :   -39.1980273 Eh     change       -0.4609762E-02 Eh
   gradient norm :     0.0202708 Eh/α   predicted    -0.3925622E-02 ( -14.84%)
   displ. norm   :     0.2311878 α      lambda       -0.1392028E-02
   maximum displ.:     0.0966132 α      in ANC's #15, #6, #9, ...

........................................................................
.............................. CYCLE    3 ..............................
........................................................................
   1    -39.8406570 -0.398407E+02  0.118E-01    2.97       0.0  T
   2    -39.8406740 -0.169320E-04  0.605E-02    2.98       1.0  T
   3    -39.8406599  0.140876E-04  0.358E-02    2.98       1.0  T
   4    -39.8406900 -0.301142E-04  0.124E-02    2.98       1.5  T
   5    -39.8406911 -0.108405E-05  0.667E-03    2.98       2.7  T
   6    -39.8406916 -0.540825E-06  0.175E-03    2.98      10.4  T
   7    -39.8406917 -0.507648E-07  0.449E-04    2.98      40.7  T
     SCC iter.                  ...        0 min,  0.010 sec
     gradient                   ...        0 min,  0.017 sec
 * total energy  :   -39.1988344 Eh     change       -0.8070571E-03 Eh
   gradient norm :     0.0053966 Eh/α   predicted    -0.7332194E-03 (  -9.15%)
   displ. norm   :     0.1457684 α      lambda       -0.2609982E-03
   maximum displ.:     0.0690212 α      in ANC's #6, #1, #7, ...

........................................................................
.............................. CYCLE    4 ..............................
........................................................................
   1    -39.8407014 -0.398407E+02  0.576E-02    2.98       0.0  T
   2    -39.8407032 -0.180987E-05  0.326E-02    2.98       1.0  T
   3    -39.8406993  0.392954E-05  0.161E-02    2.98       1.1  T
   4    -39.8407041 -0.480692E-05  0.436E-03    2.98       4.2  T
   5    -39.8407042 -0.143347E-06  0.193E-03    2.98       9.4  T
   6    -39.8407043 -0.787651E-07  0.586E-04    2.98      31.2  T
     SCC iter.                  ...        0 min,  0.009 sec
     gradient                   ...        0 min,  0.017 sec
 * total energy  :   -39.1990017 Eh     change       -0.1672679E-03 Eh
   gradient norm :     0.0035132 Eh/α   predicted    -0.1332853E-03 ( -20.32%)
   displ. norm   :     0.1518625 α      lambda       -0.1672259E-03
   maximum displ.:     0.0826779 α      in ANC's #1, #6, #7, ...

........................................................................
.............................. CYCLE    5 ..............................
........................................................................
   1    -39.8390489 -0.398390E+02  0.669E-02    2.98       0.0  T
   2    -39.8390501 -0.112918E-05  0.380E-02    2.98       1.0  T
   3    -39.8390439  0.615486E-05  0.180E-02    2.98       1.0  T
   4    -39.8390509 -0.699013E-05  0.413E-03    2.98       4.4  T
   5    -39.8390510 -0.826912E-07  0.173E-03    2.98      10.6  T
   6    -39.8390510 -0.565301E-07  0.616E-04    2.98      29.6  T
   7    -39.8390510 -0.571323E-08  0.259E-04    2.98      70.4  T
     SCC iter.                  ...        0 min,  0.010 sec
     gradient                   ...        0 min,  0.018 sec
 * total energy  :   -39.1990881 Eh     change       -0.8646918E-04 Eh
   gradient norm :     0.0028761 Eh/α   predicted    -0.8554178E-04 (  -1.07%)
   displ. norm   :     0.0944681 α      lambda       -0.7097588E-04
   maximum displ.:     0.0590748 α      in ANC's #1, #2, #6, ...

........................................................................
.............................. CYCLE    6 ..............................
........................................................................
   1    -39.8383702 -0.398384E+02  0.394E-02    2.98       0.0  T
   2    -39.8383704 -0.218526E-06  0.227E-02    2.98       1.0  T
   3    -39.8383687  0.171616E-05  0.839E-03    2.98       2.2  T
   4    -39.8383706 -0.191696E-05  0.202E-03    2.98       9.0  T
   5    -39.8383707 -0.127250E-07  0.920E-04    2.98      19.8  T
   6    -39.8383707 -0.163622E-07  0.225E-04    2.98      81.2  T
     SCC iter.                  ...        0 min,  0.009 sec
     gradient                   ...        0 min,  0.018 sec
 * total energy  :   -39.1991357 Eh     change       -0.4757604E-04 Eh
   gradient norm :     0.0021477 Eh/α   predicted    -0.3580921E-04 ( -24.73%)
   displ. norm   :     0.1014221 α      lambda       -0.5734671E-04
   maximum displ.:     0.0662324 α      in ANC's #1, #2, #7, ...

........................................................................
.............................. CYCLE    7 ..............................
........................................................................
   1    -39.8384185 -0.398384E+02  0.443E-02    2.98       0.0  T
   2    -39.8384189 -0.351032E-06  0.253E-02    2.98       1.0  T
   3    -39.8384180  0.890757E-06  0.635E-03    2.98       2.9  T
   4    -39.8384190 -0.992494E-06  0.231E-03    2.98       7.9  T
   5    -39.8384190 -0.547510E-07  0.887E-04    2.98      20.6  T
   6    -39.8384190 -0.119329E-07  0.272E-04    2.98      67.0  T
     SCC iter.                  ...        0 min,  0.009 sec
     gradient                   ...        0 min,  0.018 sec
 * total energy  :   -39.1991806 Eh     change       -0.4491570E-04 Eh
   gradient norm :     0.0020456 Eh/α   predicted    -0.2896855E-04 ( -35.50%)
   displ. norm   :     0.1524814 α      lambda       -0.7451454E-04
   maximum displ.:     0.1022244 α      in ANC's #1, #2, #4, ...

........................................................................
.............................. CYCLE    8 ..............................
........................................................................
   1    -39.8389001 -0.398389E+02  0.655E-02    2.98       0.0  T
   2    -39.8389008 -0.668615E-06  0.374E-02    2.98       1.0  T
   3    -39.8389003  0.475153E-06  0.610E-03    2.98       3.0  T
   4    -39.8389009 -0.555879E-06  0.307E-03    2.98       6.0  T
   5    -39.8389010 -0.116796E-06  0.726E-04    2.98      25.1  T
   6    -39.8389010 -0.444605E-08  0.412E-04    2.98      44.3  T
     SCC iter.                  ...        0 min,  0.009 sec
     gradient                   ...        0 min,  0.018 sec
 * total energy  :   -39.1992401 Eh     change       -0.5947362E-04 Eh
   gradient norm :     0.0023687 Eh/α   predicted    -0.3812381E-04 ( -35.90%)
   displ. norm   :     0.1969223 α      lambda       -0.8194707E-04
   maximum displ.:     0.1308925 α      in ANC's #1, #2, #4, ...

........................................................................
.............................. CYCLE    9 ..............................
........................................................................
   1    -39.8392827 -0.398393E+02  0.879E-02    2.98       0.0  T
   2    -39.8392834 -0.786299E-06  0.504E-02    2.98       1.0  T
   3    -39.8392832  0.273753E-06  0.651E-03    2.98       2.8  T
   4    -39.8392835 -0.278930E-06  0.400E-03    2.98       4.6  T
   5    -39.8392837 -0.238726E-06  0.761E-04    2.98      24.0  T
   6    -39.8392837 -0.849835E-08  0.430E-04    2.98      42.4  T
     SCC iter.                  ...        0 min,  0.008 sec
     gradient                   ...        0 min,  0.018 sec
 * total energy  :   -39.1993096 Eh     change       -0.6954845E-04 Eh
   gradient norm :     0.0026203 Eh/α   predicted    -0.4256837E-04 ( -38.79%)
   displ. norm   :     0.2595291 α      lambda       -0.9964076E-04
   maximum displ.:     0.1704814 α      in ANC's #1, #2, #4, ...

........................................................................
.............................. CYCLE   10 ..............................
........................................................................
   1    -39.8393054 -0.398393E+02  0.112E-01    2.98       0.0  T
   2    -39.8393064 -0.102125E-05  0.645E-02    2.98       1.0  T
   3    -39.8393056  0.743389E-06  0.859E-03    2.98       2.1  T
   4    -39.8393065 -0.911572E-06  0.441E-03    2.98       4.1  T
   5    -39.8393068 -0.233930E-06  0.840E-04    2.98      21.7  T
   6    -39.8393068 -0.750936E-08  0.530E-04    2.98      34.5  T
     SCC iter.                  ...        0 min,  0.008 sec
     gradient                   ...        0 min,  0.018 sec
 * total energy  :   -39.1993952 Eh     change       -0.8553343E-04 Eh
   gradient norm :     0.0030357 Eh/α   predicted    -0.5317657E-04 ( -37.83%)
   displ. norm   :     0.3131228 α      lambda       -0.1141649E-03
   maximum displ.:     0.2067590 α      in ANC's #1, #2, #4, ...

........................................................................
.............................. CYCLE   11 ..............................
........................................................................
   1    -39.8390749 -0.398391E+02  0.132E-01    2.98       0.0  T
   2    -39.8390763 -0.136036E-05  0.765E-02    2.98       1.0  T
   3    -39.8390744  0.185986E-05  0.115E-02    2.98       1.6  T
   4    -39.8390767 -0.227397E-05  0.492E-03    2.98       3.7  T
   5    -39.8390769 -0.212021E-06  0.110E-03    2.98      16.5  T
   6    -39.8390769 -0.150846E-07  0.655E-04    2.98      27.9  T
   7    -39.8390769 -0.265209E-08  0.380E-04    2.98      48.0  T
     SCC iter.                  ...        0 min,  0.010 sec
     gradient                   ...        0 min,  0.018 sec
 * total energy  :   -39.1994885 Eh     change       -0.9334946E-04 Eh
   gradient norm :     0.0037383 Eh/α   predicted    -0.6267972E-04 ( -32.85%)
   displ. norm   :     0.3529080 α      lambda       -0.1164248E-03
   maximum displ.:     0.2355137 α      in ANC's #1, #2, #4, ...

........................................................................
.............................. CYCLE   12 ..............................
........................................................................
   1    -39.8387423 -0.398387E+02  0.143E-01    2.98       0.0  T
   2    -39.8387439 -0.154504E-05  0.826E-02    2.98       1.0  T
   3    -39.8387415  0.239465E-05  0.123E-02    2.98       1.5  T
   4    -39.8387444 -0.290952E-05  0.517E-03    2.98       3.5  T
   5    -39.8387446 -0.232857E-06  0.120E-03    2.98      15.3  T
   6    -39.8387447 -0.142475E-07  0.761E-04    2.98      24.0  T
   7    -39.8387447 -0.341196E-08  0.426E-04    2.98      42.8  T
     SCC iter.                  ...        0 min,  0.010 sec
     gradient                   ...        0 min,  0.018 sec
 * total energy  :   -39.1995739 Eh     change       -0.8542164E-04 Eh
   gradient norm :     0.0039542 Eh/α   predicted    -0.6546352E-04 ( -23.36%)
   displ. norm   :     0.2754377 α      lambda       -0.8504440E-04
   maximum displ.:     0.1853390 α      in ANC's #1, #2, #6, ...

........................................................................
.............................. CYCLE   13 ..............................
........................................................................
   1    -39.8393005 -0.398393E+02  0.107E-01    2.98       0.0  T
   2    -39.8393013 -0.794375E-06  0.621E-02    2.98       1.0  T
   3    -39.8392997  0.164121E-05  0.935E-03    2.98       2.0  T
   4    -39.8393016 -0.194992E-05  0.358E-03    2.98       5.1  T
   5    -39.8393017 -0.105745E-06  0.101E-03    2.98      18.0  T
   6    -39.8393017 -0.102160E-07  0.621E-04    2.98      29.4  T
   7    -39.8393017 -0.294163E-08  0.331E-04    2.98      55.2  T
     SCC iter.                  ...        0 min,  0.010 sec
     gradient                   ...        0 min,  0.018 sec
 * total energy  :   -39.1996318 Eh     change       -0.5786941E-04 Eh
   gradient norm :     0.0025490 Eh/α   predicted    -0.4574848E-04 ( -20.95%)
   displ. norm   :     0.2151918 α      lambda       -0.4452374E-04
   maximum displ.:     0.1380985 α      in ANC's #1, #2, #5, ...

........................................................................
.............................. CYCLE   14 ..............................
........................................................................
   1    -39.8388772 -0.398389E+02  0.870E-02    2.98       0.0  T
   2    -39.8388776 -0.417045E-06  0.511E-02    2.98       1.0  T
   3    -39.8388766  0.100322E-05  0.659E-03    2.98       2.8  T
   4    -39.8388778 -0.120349E-05  0.202E-03    2.98       9.0  T
   5    -39.8388779 -0.342672E-07  0.844E-04    2.98      21.6  T
   6    -39.8388779 -0.395653E-08  0.418E-04    2.98      43.7  T
     SCC iter.                  ...        0 min,  0.009 sec
     gradient                   ...        0 min,  0.018 sec
 * total energy  :   -39.1996605 Eh     change       -0.2867448E-04 Eh
   gradient norm :     0.0023873 Eh/α   predicted    -0.2329450E-04 ( -18.76%)
   displ. norm   :     0.1148546 α      lambda       -0.4400534E-04
   maximum displ.:     0.0576707 α      in ANC's #1, #2, #4, ...

........................................................................
.............................. CYCLE   15 ..............................
........................................................................
   1    -39.8409279 -0.398409E+02  0.480E-02    2.97       0.0  T
   2    -39.8409281 -0.205195E-06  0.280E-02    2.97       1.0  T
   3    -39.8409276  0.480213E-06  0.483E-03    2.97       3.8  T
   4    -39.8409282 -0.569268E-06  0.157E-03    2.97      11.6  T
   5    -39.8409282 -0.144075E-07  0.660E-04    2.97      27.7  T
   6    -39.8409282 -0.744579E-08  0.197E-04    2.97      92.7  T
     SCC iter.                  ...        0 min,  0.008 sec
     gradient                   ...        0 min,  0.018 sec
 * total energy  :   -39.1996714 Eh     change       -0.1089701E-04 Eh
   gradient norm :     0.0038346 Eh/α   predicted    -0.2229387E-04 ( 104.59%)
   displ. norm   :     0.1131996 α      lambda       -0.2741989E-04
   maximum displ.:     0.0709364 α      in ANC's #2, #1, #5, ...

........................................................................
.............................. CYCLE   16 ..............................
........................................................................
   1    -39.8395912 -0.398396E+02  0.487E-02    2.97       0.0  T
   2    -39.8395914 -0.152732E-06  0.285E-02    2.97       1.0  T
   3    -39.8395914  0.311824E-07  0.216E-03    2.97       8.5  T
   4    -39.8395914 -0.557873E-07  0.134E-03    2.97      13.6  T
   5    -39.8395914 -0.268543E-07  0.443E-04    2.97      41.2  T
   6    -39.8395914 -0.167771E-08  0.211E-04    2.97      86.6  T
     SCC iter.                  ...        0 min,  0.008 sec
     gradient                   ...        0 min,  0.018 sec
 * total energy  :   -39.1996858 Eh     change       -0.1441694E-04 Eh
   gradient norm :     0.0016409 Eh/α   predicted    -0.1388769E-04 (  -3.67%)
   displ. norm   :     0.0452710 α      lambda       -0.1071208E-04
   maximum displ.:     0.0229202 α      in ANC's #3, #4, #5, ...

........................................................................
.............................. CYCLE   17 ..............................
........................................................................
   1    -39.8397028 -0.398397E+02  0.218E-02    2.97       0.0  T
   2    -39.8397029 -0.984437E-07  0.122E-02    2.97       1.5  T
   3    -39.8397028  0.162722E-06  0.317E-03    2.97       5.8  T
   4    -39.8397030 -0.190592E-06  0.129E-03    2.97      14.1  T
   5    -39.8397030 -0.121441E-07  0.352E-04    2.97      51.9  T
   6    -39.8397030 -0.246900E-08  0.107E-04    2.97     170.6  T
     SCC iter.                  ...        0 min,  0.008 sec
     gradient                   ...        0 min,  0.018 sec
 * total energy  :   -39.1996962 Eh     change       -0.1039381E-04 Eh
   gradient norm :     0.0012976 Eh/α   predicted    -0.5362334E-05 ( -48.41%)
   displ. norm   :     0.0856361 α      lambda       -0.1149935E-04
   maximum displ.:     0.0585731 α      in ANC's #4, #5, #3, ...

........................................................................
.............................. CYCLE   18 ..............................
........................................................................
   1    -39.8401004 -0.398401E+02  0.446E-02    2.98       0.0  T
   2    -39.8401007 -0.319053E-06  0.252E-02    2.98       1.0  T
   3    -39.8401006  0.156007E-06  0.421E-03    2.98       4.3  T
   4    -39.8401007 -0.164635E-06  0.245E-03    2.98       7.5  T
   5    -39.8401008 -0.951871E-07  0.430E-04    2.98      42.5  T
   6    -39.8401008 -0.379647E-08  0.141E-04    2.98     129.4  T
     SCC iter.                  ...        0 min,  0.008 sec
     gradient                   ...        0 min,  0.018 sec
 * total energy  :   -39.1997057 Eh     change       -0.9469338E-05 Eh
   gradient norm :     0.0010518 Eh/α   predicted    -0.5771943E-05 ( -39.05%)
   displ. norm   :     0.0916576 α      lambda       -0.5019720E-05
   maximum displ.:     0.0498090 α      in ANC's #2, #5, #1, ...

........................................................................
.............................. CYCLE   19 ..............................
........................................................................
   1    -39.8398763 -0.398399E+02  0.401E-02    2.97       0.0  T
   2    -39.8398764 -0.111298E-06  0.233E-02    2.97       1.0  T
   3    -39.8398764  0.506572E-07  0.238E-03    2.97       7.7  T
   4    -39.8398765 -0.773188E-07  0.125E-03    2.97      14.6  T
   5    -39.8398765 -0.189888E-07  0.246E-04    2.97      74.1  T
   6    -39.8398765 -0.593822E-09  0.152E-04    2.97     120.2  T
     SCC iter.                  ...        0 min,  0.009 sec
     gradient                   ...        0 min,  0.018 sec
 * total energy  :   -39.1997093 Eh     change       -0.3647022E-05 Eh
   gradient norm :     0.0009827 Eh/α   predicted    -0.2520613E-05 ( -30.89%)
   displ. norm   :     0.0921134 α      lambda        0.6157564E-05
   maximum displ.:     0.0498093 α      in ANC's #2, #5, #1, ...

   *** GEOMETRY OPTIMIZATION CONVERGED AFTER 19 ITERATIONS ***

------------------------------------------------------------------------
 total energy gain   :        -0.0062918 Eh       -3.9482 kcal/mol
 total RMSD          :         0.4641938 a0        0.2456 Å
 total power (kW/mol):        -0.8694262 (step)  -21.7897 (real)
------------------------------------------------------------------------

 ANCopt (total)                0 d,  0 h,  0 min,  0.758 sec
 optimizer setup                ...        0 min,  0.000 sec (  0.021%)
 model hessian                  ...        0 min,  0.014 sec (  1.870%)
 ANC generation                 ...        0 min,  0.001 sec (  0.126%)
 coordinate transformation      ...        0 min,  0.000 sec (  0.058%)
 single point calculation       ...        0 min,  0.735 sec ( 96.887%)
 optimization log               ...        0 min,  0.002 sec (  0.301%)
 hessian update                 ...        0 min,  0.000 sec (  0.041%)
 rational function              ...        0 min,  0.004 sec (  0.534%)

================
 final structure:
================
$coord
    2.93692894694103   -2.60343963451391   -0.26969134186133      C 
    5.20280782667648   -0.28465859264445   -0.24341324656584      S 
    2.89482965918544    2.05624480001299   -0.04996120028250      C 
    0.51420289872461    1.01380066231527   -0.03191979269703      C 
    0.54577542330658   -1.66402501844299   -0.14864467125391      C 
   -1.79689400312928   -3.26166769950895   -0.21042774342738      C 
   -2.23962382202075   -4.25961175039796   -2.89325965216006      C 
   -4.05200549449321   -1.72965093116219    0.76106093387866      C 
   -4.18267069152472    0.86883436501217   -0.47681468115723      C 
   -1.88585256134674    2.51434415248511    0.20015318456060      C 
   -2.11932864443236    3.52106181082389    2.84948120718327      C 
   -2.61513186649095    5.90013646139133    3.40487894015671      C 
    3.56884740827232    4.68523328641012    0.07542750636596      C 
    5.92102769246273    5.56954954970301    0.01393785035746      C 
    3.51079660183962   -4.54423146240621   -0.37088973052254      H 
   -1.51994563074248   -4.89950914604241    1.02882400229532      H 
   -2.42093423781258   -2.71337487029123   -4.23330418182001      H 
   -3.95370355449719   -5.39305199217132   -2.95939539243333      H 
   -0.65729761857427   -5.42981831346498   -3.48373924432211      H 
   -3.88936529966555   -1.50378665534885    2.80460674007539      H 
   -5.79587766654512   -2.76632357278649    0.38434990458309      H 
   -5.89867572492275    1.84540823109352    0.12500874686727      H 
   -4.27171415786441    0.65054074239872   -2.52563441138456      H 
   -1.83128041461848    4.12090151628490   -1.10584430589387      H 
   -1.86157594750669    2.14651594367216    4.34114337765699      H 
   -2.87327329493168    7.31195513116829    1.95617354846855      H 
   -2.78771907613419    6.54783562705487    5.32620306519371      H 
    1.99289764122191    5.97598519186975    0.24883683792774      H 
    7.52425361001858    4.32287237177914   -0.14242234969978      H 
    6.31586560738844    7.56043546543306    0.12055618810001      H 
$end
           -------------------------------------------------
          |                Final Singlepoint                |
           -------------------------------------------------

          ...................................................
          :                      SETUP                      :
          :.................................................:
          :  # basis functions                  78          :
          :  # atomic orbitals                  77          :
          :  # shells                           45          :
          :  # electrons                        74          :
          :  max. iterations                   250          :
          :  Hamiltonian                  GFN2-xTB          :
          :  restarted?                      false          :
          :  GBSA solvation                  false          :
          :  PC potential                    false          :
          :  electronic temp.          300.0000000     K    :
          :  accuracy                    1.0000000          :
          :  -> integral cutoff          0.2500000E+02      :
          :  -> integral neglect         0.1000000E-07      :
          :  -> SCF convergence          0.1000000E-05 Eh   :
          :  -> wf. convergence          0.1000000E-03 e    :
          :  Broyden damping             0.4000000          :
          ...................................................

 iter      E             dE          RMSdq      gap      omega  full diag
   1    -39.8398765 -0.398399E+02  0.734E-05    2.97       0.0  T
   2    -39.8398765 -0.368061E-11  0.424E-05    2.97     430.6  T
   3    -39.8398765 -0.384119E-10  0.332E-05    2.97     550.5  T

   *** convergence criteria satisfied after 3 iterations ***

         #    Occupation            Energy/Eh            Energy/eV
      -------------------------------------------------------------
         1        2.0000           -0.7205454             -19.6070
       ...           ...                  ...                  ...
        31        2.0000           -0.4300877             -11.7033
        32        2.0000           -0.4245704             -11.5531
        33        2.0000           -0.4210035             -11.4561
        34        2.0000           -0.4155245             -11.3070
        35        2.0000           -0.4026607             -10.9570
        36        2.0000           -0.3813657             -10.3775
        37        2.0000           -0.3658699              -9.9558 (HOMO)
        38                         -0.2565636              -6.9815 (LUMO)
        39                         -0.2069552              -5.6315
        40                         -0.1932122              -5.2576
        41                         -0.1869669              -5.0876
        42                         -0.1397611              -3.8031
       ...                                ...                  ...
        77                          0.6839112              18.6102
      -------------------------------------------------------------
                  HL-Gap            0.1093062 Eh            2.9744 eV
             Fermi-level           -0.3112168 Eh           -8.4686 eV

 SCC (total)                   0 d,  0 h,  0 min,  0.036 sec
 SCC setup                      ...        0 min,  0.000 sec (  0.726%)
 Dispersion                     ...        0 min,  0.000 sec (  0.703%)
 integral evaluation            ...        0 min,  0.012 sec ( 32.444%)
 zeroth order Hamiltonian       ...        0 min,  0.000 sec (  0.566%)
 iterations                     ...        0 min,  0.005 sec ( 13.778%)
 molecular gradient             ...        0 min,  0.018 sec ( 50.491%)
 printout                       ...        0 min,  0.000 sec (  1.155%)

         :::::::::::::::::::::::::::::::::::::::::::::::::::::
         ::                     SUMMARY                     ::
         :::::::::::::::::::::::::::::::::::::::::::::::::::::
         :: total energy             -39.199709324430 Eh    ::
         :: gradient norm              0.000983209269 Eh/a0 ::
         :: HOMO-LUMO gap              2.974374287434 eV    ::
         ::.................................................::
         :: SCC energy               -39.839876474176 Eh    ::
         :: -> isotropic ES            0.004017846451 Eh    ::
         :: -> anisotropic ES          0.006152742450 Eh    ::
         :: -> anisotropic XC          0.023691990214 Eh    ::
         :: -> dispersion             -0.031980497722 Eh    ::
         :: repulsion energy           0.639816900889 Eh    ::
         :: add. restraining           0.000000000000 Eh    ::
         :::::::::::::::::::::::::::::::::::::::::::::::::::::

           -------------------------------------------------
          |                Property Printout                |
           -------------------------------------------------

    * Orbital Energies and Occupations

         #    Occupation            Energy/Eh            Energy/eV
      -------------------------------------------------------------
         1        2.0000           -0.7205454             -19.6070
       ...           ...                  ...                  ...
        25        2.0000           -0.4622134             -12.5775
        26        2.0000           -0.4581836             -12.4678
        27        2.0000           -0.4495079             -12.2317
        28        2.0000           -0.4441796             -12.0867
        29        2.0000           -0.4426838             -12.0460
        30        2.0000           -0.4345935             -11.8259
        31        2.0000           -0.4300877             -11.7033
        32        2.0000           -0.4245704             -11.5531
        33        2.0000           -0.4210035             -11.4561
        34        2.0000           -0.4155245             -11.3070
        35        2.0000           -0.4026607             -10.9570
        36        2.0000           -0.3813657             -10.3775
        37        2.0000           -0.3658699              -9.9558 (HOMO)
        38                         -0.2565636              -6.9815 (LUMO)
        39                         -0.2069552              -5.6315
        40                         -0.1932122              -5.2576
        41                         -0.1869669              -5.0876
        42                         -0.1397611              -3.8031
        43                         -0.1095083              -2.9799
        44                          0.0031979               0.0870
        45                          0.0406225               1.1054
        46                          0.0433347               1.1792
        47                          0.0796544               2.1675
        48                          0.0856283               2.3301
       ...                                ...                  ...
        77                          0.6839112              18.6102
      -------------------------------------------------------------
                  HL-Gap            0.1093062 Eh            2.9744 eV
             Fermi-level           -0.3112168 Eh           -8.4686 eV

     #   Z        covCN         q      C6AA      α(0)
     1   6 C      2.941    -0.031    28.769     8.797
     2  16 S      2.308    -0.055   143.315    20.149
     3   6 C      2.990     0.013    27.725     8.637
     4   6 C      3.164    -0.014    28.018     8.651
     5   6 C      3.157    -0.009    27.935     8.642
     6   6 C      3.856    -0.011    20.737     6.476
     7   6 C      3.756    -0.101    22.491     6.762
     8   6 C      3.808    -0.056    21.569     6.611
     9   6 C      3.808    -0.052    21.506     6.601
    10   6 C      3.860    -0.014    20.787     6.484
    11   6 C      2.894    -0.024    28.609     8.770
    12   6 C      2.836    -0.093    30.324     9.024
    13   6 C      2.919    -0.032    28.793     8.799
    14   6 C      2.841    -0.089    30.222     9.009
    15   1 H      0.926     0.037     2.489     2.467
    16   1 H      0.924     0.030     2.593     2.518
    17   1 H      0.925     0.038     2.479     2.462
    18   1 H      0.925     0.036     2.509     2.477
    19   1 H      0.925     0.035     2.513     2.479
    20   1 H      0.924     0.034     2.525     2.485
    21   1 H      0.924     0.031     2.573     2.508
    22   1 H      0.924     0.030     2.581     2.512
    23   1 H      0.924     0.036     2.496     2.471
    24   1 H      0.924     0.037     2.489     2.467
    25   1 H      0.925     0.033     2.546     2.495
    26   1 H      0.926     0.034     2.534     2.490
    27   1 H      0.926     0.035     2.513     2.479
    28   1 H      0.925     0.039     2.457     2.451
    29   1 H      0.926     0.046     2.374     2.409
    30   1 H      0.926     0.037     2.483     2.464

 Mol. C6AA /au·bohr⁶  :      10656.183665
 Mol. C8AA /au·bohr⁸  :     277057.124806
 Mol. α(0) /au        :        163.049226


Wiberg/Mayer (AO) data.
largest (>0.10) Wiberg bond orders for each atom
          total WBO             WBO to atom ...
     1  C   3.946        C    5 1.581    S    2 1.190    H   15 0.970    C    3 0.102
     2  S   2.605        C    1 1.190    C    3 1.124
     3  C   3.947        C    4 1.499    C   13 1.138    S    2 1.124    C    1 0.102
     4  C   3.984        C    3 1.499    C    5 1.247    C   10 0.988
     5  C   3.984        C    1 1.581    C    4 1.247    C    6 0.995
     6  C   3.996        C    5 0.995    C    8 0.994    C    7 0.993    H   16 0.963
     7  C   3.996        C    6 0.993    H   19 0.987    H   18 0.985    H   17 0.985
     8  C   3.998        C    9 1.011    C    6 0.994    H   20 0.976    H   21 0.975
     9  C   3.997        C    8 1.011    H   22 0.977    C   10 0.976    H   23 0.973
    10  C   3.997        C   11 0.996    C    4 0.988    C    9 0.976    H   24 0.956
    11  C   3.990        C   12 1.977    C   10 0.996    H   25 0.965
    12  C   3.989        C   11 1.977    H   27 0.976    H   26 0.975
    13  C   3.992        C   14 1.865    C    3 1.138    H   28 0.956
    14  C   3.991        C   13 1.865    H   30 0.979    H   29 0.972
    15  H   0.998        C    1 0.970
    16  H   0.999        C    6 0.963
    17  H   0.999        C    7 0.985
    18  H   0.998        C    7 0.985
    19  H   0.999        C    7 0.987
    20  H   0.999        C    8 0.976
    21  H   0.998        C    8 0.975
    22  H   0.998        C    9 0.977
    23  H   0.999        C    9 0.973
    24  H   0.998        C   10 0.956
    25  H   0.999        C   11 0.965
    26  H   0.999        C   12 0.975
    27  H   0.998        C   12 0.976
    28  H   0.998        C   13 0.956
    29  H   0.998        C   14 0.972
    30  H   0.998        C   14 0.979

molecular dipole:
                 x           y           z       tot (Debye)
 q only:       -0.461      -0.112      -0.079
   full:       -0.727      -0.132      -0.055       1.883
molecular quadrupole (traceless):
                xx          xy          yy          xz          yz          zz
 q only:       -1.150       0.577       1.865       0.412      -0.096      -0.714
  q+dip:       -4.233      -0.340       5.846       0.385      -0.361      -1.613
   full:       -4.428       0.043       4.700       0.530      -0.239      -0.272

           -------------------------------------------------
          |                Geometry Summary                 |
           -------------------------------------------------

      molecular mass/u    :      204.3294000
   center of mass at/Å    :        0.3058391       0.4031817       0.0840365
  moments of inertia/u·Å² :        0.6430468E+03   0.8406214E+03   0.1358894E+04
rotational constants/cm⁻¹ :        0.2621525E-01   0.2005378E-01   0.1240540E-01

 * 27 selected distances

     #   Z        #   Z                                     value/Å
     1   6 C      2  16 S                                 1.7156807
     2  16 S      3   6 C                                 1.7425941 (max)
     3   6 C      4   6 C                                 1.3752908
     1   6 C      5   6 C                                 1.3610010
     4   6 C      5   6 C                                 1.4184884
     6   6 C      7   6 C                                 1.5327415
     6   6 C      8   6 C                                 1.5315448
     8   6 C      9   6 C                                 1.5246859
     9   6 C     10   6 C                                 1.5374727
    11   6 C     12   6 C                                 1.3191577
    13   6 C     14   6 C                                 1.3301782
     1   6 C     15   1 H                                 1.0723171 (min)
     6   6 C     16   1 H                                 1.0966833
     7   6 C     17   1 H                                 1.0869978
     7   6 C     18   1 H                                 1.0879877
     7   6 C     19   1 H                                 1.0873023
     8   6 C     20   1 H                                 1.0913819
     8   6 C     21   1 H                                 1.0919136
     9   6 C     22   1 H                                 1.0922815
     9   6 C     23   1 H                                 1.0913430
    10   6 C     24   1 H                                 1.0960019
    11   6 C     25   1 H                                 1.0820179
    12   6 C     26   1 H                                 1.0791345
    12   6 C     27   1 H                                 1.0768188
    13   6 C     28   1 H                                 1.0818704
    14   6 C     29   1 H                                 1.0778843
    14   6 C     30   1 H                                 1.0755313

 * 3 distinct bonds (by element types)

   Z      Z             #   av. dist./Å        max./Å        min./Å
   1 H    6 C          16     1.0854667     1.0966833     1.0723171
   6 C    6 C           9     1.4367290     1.5374727     1.3191577
   6 C   16 S           2     1.7291374     1.7425941     1.7156807


optimized geometry written to: xtbopt.xyz


           -------------------------------------------------
          | TOTAL ENERGY              -39.199709324430 Eh   |
          | GRADIENT NORM               0.000983209269 Eh/α |
          | HOMO-LUMO GAP               2.974374287434 eV   |
           -------------------------------------------------

------------------------------------------------------------------------
 * finished run on 2021/05/19 at 11:00:51.808     
------------------------------------------------------------------------
 total:
 * wall-time:     0 d,  0 h,  0 min,  0.895 sec
 *  cpu-time:     0 d,  0 h,  0 min,  0.869 sec
 * ratio c/w:     0.970 speedup
 SCF:
 * wall-time:     0 d,  0 h,  0 min,  0.064 sec
 *  cpu-time:     0 d,  0 h,  0 min,  0.051 sec
 * ratio c/w:     0.795 speedup
 ANC optimizer:
 * wall-time:     0 d,  0 h,  0 min,  0.794 sec
 *  cpu-time:     0 d,  0 h,  0 min,  0.794 sec
 * ratio c/w:     1.000 speedup

