      -----------------------------------------------------------      
     |                   =====================                   |     
     |                           x T B                           |     
     |                   =====================                   |     
     |                         S. Grimme                         |     
     |          Mulliken Center for Theoretical Chemistry        |     
     |                    University of Bonn                     |     
     |                Version 6.2 RC2 (SAW190805)                |     
      -----------------------------------------------------------      

   This program is distributed in the hope that it will be useful,
   but WITHOUT ANY WARRANTY; without even the implied warranty of
   MERCHANTABILITY or FITNESS FOR A PARTICULAR PURPOSE.
   
   FOR NON-COMMERCIAL, ACADEMIA USE ONLY.
   
   Cite this work as:
   * S. Grimme, C. Bannwarth, P. Shushkov, J. Chem. Theory Comput., 2017,
     13, 1989-2009. DOI: 10.1021/acs.jctc.7b00118
   * C. Bannwarth, S. Ehlert and S. Grimme., J. Chem. Theory Comput., 2019,
     15, 1652-1671. DOI: 10.1021/acs.jctc.8b01176
   * P. Pracht, E. Caldeweyher, S. Ehlert, S. Grimme, ChemRxiv, 2019, preprint.
     DOI: 10.26434/chemrxiv.8326202.v1
   
   for DFT-D4:
   * E. Caldeweyher, C. Bannwarth and S. Grimme, J. Chem. Phys., 2017,
     147, 034112. DOI: 10.1063/1.4993215
   * E. Caldeweyher, S. Ehlert, A. Hansen, H. Neugebauer, S. Spicher,
     C. Bannwarth and S. Grimme, J. Chem. Phys., 2019, 150, 154122.
     DOI: 10.1063/1.5090222
   
   for sTDA-xTB:
   * S. Grimme and C. Bannwarth, J. Chem. Phys., 2016, 145, 054103.
     DOI: 10.1063/1.4959605
   
   in the mass-spec context:
   * V. Asgeirsson, C. Bauer and S. Grimme, Chem. Sci., 2017, 8, 4879.
     DOI: 10.1039/c7sc00601b
   
   for metadynamics refer to:
   * S. Grimme, J. Chem. Theory Comput., 2019, 155, 2847-2862
     DOI: 10.1021/acs.jctc.9b00143
   
   with help from (in alphabetical order)
   C. Bannwarth, F. Bohle, G. Brandenburg, E. Caldeweyher, M. Checinski,
   S. Dohm, S. Ehlert, S. Ehrlich, F. März, H. Neugebauer, J. Pisarek,
   P. Pracht, P. Shushkov, and S. Spicher.
   
 * started run on 2021/05/19 at 11:00:55.432     

           -------------------------------------------------
          |                Calculation Setup                |
           -------------------------------------------------

          program call               : /ihome/ghutchison/geoffh/xtb/xtb 783.xyz -opt
          hostname                   : smp-n83
          coordinate file            : 783.xyz
          omp threads                :                     1
          number of atoms            :                    30
          number of electrons        :                    96
          charge                     :                     0
          spin                       :                   0.0
          first test random number   :      0.60182577751353


########################################################################
# WARNING! Please study the warnings concerning your input carefully
#  - the use of '-opt' is discouraged, please use '--opt' next time
########################################################################

           ------------------------------------------------- 
          |                 G F N 2 - x T B                 |
          | Geometry, Frequencies, Noncovalent interactions |
          |            JCTC 2019 parametrisation            |
           ------------------------------------------------- 
             KAB for C  - Si     :                1.0500
             KAB for H  - Pd     :                0.9500
             k(s)              :                1.8500
             k(p)              :                2.2300
             k(d)              :                2.2300
             k(f)              :                2.0000
             kEN (H0ij)        :               -2.0000
             D4 a1             :                0.5200
             D4 a2             :                5.0000
             D4 s6             :                1.0000
             D4 s8             :                2.7000
             D4 s9             :                5.0000
             alphaj            :                2.0000

  Z AO/shell   Hii/eV     exponent
  1     Wed Apr 25 08:07:45 CEST 2018   EN: 2.200 GM2: 0.406  GM3: 0.0800  RAES: 1.40
     1s    -10.707211    1.230000
  6     Wed Apr 25 08:07:45 CEST 2018   EN: 2.550 GM2: 0.538  GM3: 0.1500  RAES: 3.00
     2s    -13.970922    2.096432
     2p    -10.063292    1.800000
  7     Wed Apr 25 08:07:45 CEST 2018   EN: 3.040 GM2: 0.461  GM3:-0.0640  RAES: 1.90
     2s    -16.686243    2.339881
     2p    -12.523956    2.014332
  8     Wed Apr 25 08:07:45 CEST 2018   EN: 3.440 GM2: 0.452  GM3:-0.0517  RAES: 1.80
     2s    -20.229985    2.439742
     2p    -15.503117    2.137023
 16     Tue Apr 24 11:44:34 CEST 2018   EN: 2.580 GM2: 0.340  GM3:-0.0502  RAES: 3.10
     3s    -20.029654    1.981333
     3p    -11.377694    2.025643
     3d     -0.420282    1.702555

           ------------------------------------------------- 
          |        Self-Consistent Charge Iterations        |
           ------------------------------------------------- 

          ...................................................
          :                      SETUP                      :
          :.................................................:
          :  # basis functions                  99          :
          :  # atomic orbitals                  97          :
          :  # shells                           51          :
          :  # electrons                        96          :
          :  max. iterations                   250          :
          :  Hamiltonian                  GFN2-xTB          :
          :  restarted?                      false          :
          :  GBSA solvation                  false          :
          :  PC potential                    false          :
          :  electronic temp.          300.0000000     K    :
          :  accuracy                    1.0000000          :
          :  -> integral cutoff          0.2500000E+02      :
          :  -> integral neglect         0.1000000E-07      :
          :  -> SCF convergence          0.1000000E-05 Eh   :
          :  -> wf. convergence          0.1000000E-03 e    :
          :  Broyden damping             0.4000000          :
          ...................................................

 iter      E             dE          RMSdq      gap      omega  full diag
   1    -53.7114514 -0.537115E+02  0.441E+00    2.44       0.0  T
   2    -53.7952241 -0.837727E-01  0.251E+00    2.36       1.0  T
   3    -53.7978857 -0.266162E-02  0.142E+00    2.44       1.0  T
   4    -53.8130406 -0.151549E-01  0.474E-01    2.33       1.0  T
   5    -53.8178634 -0.482282E-02  0.172E-01    2.37       1.0  T
   6    -53.8182167 -0.353290E-03  0.849E-02    2.36       1.0  T
   7    -53.8183448 -0.128070E-03  0.305E-02    2.37       1.0  T
   8    -53.8183563 -0.115187E-04  0.140E-02    2.37       1.3  T
   9    -53.8183574 -0.114091E-05  0.661E-03    2.37       2.8  T
  10    -53.8183578 -0.339667E-06  0.312E-03    2.37       5.9  T
  11    -53.8183579 -0.103341E-06  0.129E-03    2.37      14.2  T
  12    -53.8183579 -0.392203E-08  0.727E-04    2.37      25.1  T
  13    -53.8183579 -0.290575E-08  0.405E-04    2.37      45.1  T

   *** convergence criteria satisfied after 13 iterations ***

         #    Occupation            Energy/Eh            Energy/eV
      -------------------------------------------------------------
         1        2.0000           -0.7566064             -20.5883
       ...           ...                  ...                  ...
        42        2.0000           -0.4268693             -11.6157
        43        2.0000           -0.4241813             -11.5426
        44        2.0000           -0.4212252             -11.4621
        45        2.0000           -0.4178793             -11.3711
        46        2.0000           -0.4139291             -11.2636
        47        2.0000           -0.4100024             -11.1567
        48        2.0000           -0.3899794             -10.6119 (HOMO)
        49                         -0.3030538              -8.2465 (LUMO)
        50                         -0.2800620              -7.6209
        51                         -0.2664365              -7.2501
        52                         -0.2413869              -6.5685
        53                         -0.2267989              -6.1715
       ...                                ...                  ...
        97                          0.6739564              18.3393
      -------------------------------------------------------------
                  HL-Gap            0.0869256 Eh            2.3654 eV
             Fermi-level           -0.3465166 Eh           -9.4292 eV

 SCC (total)                   0 d,  0 h,  0 min,  0.072 sec
 SCC setup                      ...        0 min,  0.000 sec (  0.578%)
 Dispersion                     ...        0 min,  0.001 sec (  0.756%)
 integral evaluation            ...        0 min,  0.019 sec ( 26.134%)
 zeroth order Hamiltonian       ...        0 min,  0.000 sec (  0.456%)
 iterations                     ...        0 min,  0.026 sec ( 36.397%)
 molecular gradient             ...        0 min,  0.025 sec ( 34.998%)
 printout                       ...        0 min,  0.000 sec (  0.603%)

         :::::::::::::::::::::::::::::::::::::::::::::::::::::
         ::                     SUMMARY                     ::
         :::::::::::::::::::::::::::::::::::::::::::::::::::::
         :: total energy             -53.120574521646 Eh    ::
         :: gradient norm              0.082300554725 Eh/a0 ::
         :: HOMO-LUMO gap              2.365365351016 eV    ::
         ::.................................................::
         :: SCC energy               -53.818357898185 Eh    ::
         :: -> isotropic ES            0.064366578098 Eh    ::
         :: -> anisotropic ES          0.004004464189 Eh    ::
         :: -> anisotropic XC          0.018265787220 Eh    ::
         :: -> dispersion             -0.037939538773 Eh    ::
         :: repulsion energy           0.697668900515 Eh    ::
         :: add. restraining           0.000000000000 Eh    ::
         :::::::::::::::::::::::::::::::::::::::::::::::::::::

      ----------------------------------------------------------- 
     |                   =====================                   |
     |                        A N C O P T                        |
     |                   =====================                   |
     |               Approximate Normal Coordinate               |
     |                Rational Function Optimizer                |
      ----------------------------------------------------------- 

          ...................................................
          :                      SETUP                      :
          :.................................................:
          :   optimization level            normal          :
          :   max. optcycles                   200          :
          :   ANC micro-cycles                  20          :
          :   degrees of freedom                84          :
          :.................................................:
          :   RF solver                   davidson          :
          :   input Hessian                  false          :
          :   write xtbopt.log                true          :
          :   linear?                        false          :
          :   energy convergence         0.5000000E-05 Eh   :
          :   grad. convergence          0.1000000E-02 Eh/α :
          :   maximium RF displ.         2.0000000          :
          :   Hlow (freq-cutoff)         0.5000000E-02      :
          :   Hmax (freq-cutoff)         5.0000000          :
          :   S6 in model hess.         20.0000000          :
          ...................................................

generating ANC from model Hessian ...
Using Lindh-Hessian (1995)
 Shifting diagonal of input Hessian by   4.051659304553111E-003
 Lowest  eigenvalues of input Hessian
   -0.000000   -0.000000   -0.000000    0.000000    0.000000    0.000000
    0.005000    0.005562    0.006284    0.007237    0.008280    0.010094
    0.011383    0.011773    0.014790    0.015593    0.018260    0.020381
 Highest eigenvalues
    1.840491    1.910193    1.947808    1.998698    2.175285    2.269051
 

........................................................................
.............................. CYCLE    1 ..............................
........................................................................
   1    -53.8183579 -0.538184E+02  0.111E-04    2.37       0.0  T
   2    -53.8183579 -0.314699E-10  0.714E-05    2.37     255.8  T
   3    -53.8183579 -0.489919E-10  0.515E-05    2.37     354.4  T
     SCC iter.                  ...        0 min,  0.007 sec
     gradient                   ...        0 min,  0.025 sec
 * total energy  :   -53.1205745 Eh     change       -0.7471776E-08 Eh
   gradient norm :     0.0823022 Eh/α   predicted     0.0000000E+00 (-100.00%)
   displ. norm   :     0.3172853 α      lambda       -0.1095465E-01
   maximum displ.:     0.0933079 α      in ANC's #21, #10, #7, ...

........................................................................
.............................. CYCLE    2 ..............................
........................................................................
   1    -53.8503770 -0.538504E+02  0.469E-01    2.32       0.0  T
   2    -53.8505256 -0.148628E-03  0.229E-01    2.32       1.0  T
   3    -53.8503613  0.164253E-03  0.924E-02    2.32       1.0  T
   4    -53.8505866 -0.225226E-03  0.368E-02    2.32       1.0  T
   5    -53.8505929 -0.633338E-05  0.149E-02    2.32       1.2  T
   6    -53.8505954 -0.247672E-05  0.598E-03    2.32       3.1  T
   7    -53.8505964 -0.997446E-06  0.212E-03    2.32       8.6  T
     SCC iter.                  ...        0 min,  0.013 sec
     gradient                   ...        0 min,  0.023 sec
 * total energy  :   -53.1278542 Eh     change       -0.7279679E-02 Eh
   gradient norm :     0.0280293 Eh/α   predicted    -0.6028738E-02 ( -17.18%)
   displ. norm   :     0.2843928 α      lambda       -0.2451204E-02
   maximum displ.:     0.1307139 α      in ANC's #7, #8, #10, ...

........................................................................
.............................. CYCLE    3 ..............................
........................................................................
   1    -53.8616233 -0.538616E+02  0.312E-01    2.27       0.0  T
   2    -53.8616682 -0.448467E-04  0.158E-01    2.28       1.0  T
   3    -53.8615990  0.691701E-04  0.594E-02    2.28       1.0  T
   4    -53.8616867 -0.876648E-04  0.247E-02    2.28       1.0  T
   5    -53.8616905 -0.382846E-05  0.896E-03    2.28       2.0  T
   6    -53.8616917 -0.114211E-05  0.369E-03    2.28       4.9  T
   7    -53.8616920 -0.342412E-06  0.148E-03    2.28      12.4  T
     SCC iter.                  ...        0 min,  0.013 sec
     gradient                   ...        0 min,  0.023 sec
 * total energy  :   -53.1293391 Eh     change       -0.1484937E-02 Eh
   gradient norm :     0.0072081 Eh/α   predicted    -0.1324737E-02 ( -10.79%)
   displ. norm   :     0.2150346 α      lambda       -0.5383739E-03
   maximum displ.:     0.1106751 α      in ANC's #7, #8, #12, ...

........................................................................
.............................. CYCLE    4 ..............................
........................................................................
   1    -53.8613352 -0.538613E+02  0.201E-01    2.25       0.0  T
   2    -53.8613521 -0.168888E-04  0.106E-01    2.25       1.0  T
   3    -53.8613415  0.106149E-04  0.297E-02    2.26       1.0  T
   4    -53.8613546 -0.131329E-04  0.160E-02    2.25       1.1  T
   5    -53.8613580 -0.332258E-05  0.560E-03    2.26       3.3  T
   6    -53.8613583 -0.361309E-06  0.196E-03    2.26       9.3  T
   7    -53.8613584 -0.435331E-07  0.111E-03    2.26      16.5  T
     SCC iter.                  ...        0 min,  0.013 sec
     gradient                   ...        0 min,  0.023 sec
 * total energy  :   -53.1297335 Eh     change       -0.3943203E-03 Eh
   gradient norm :     0.0057760 Eh/α   predicted    -0.2816336E-03 ( -28.58%)
   displ. norm   :     0.2857494 α      lambda       -0.4513833E-03
   maximum displ.:     0.1272783 α      in ANC's #7, #8, #5, ...

........................................................................
.............................. CYCLE    5 ..............................
........................................................................
   1    -53.8595117 -0.538595E+02  0.241E-01    2.23       0.0  T
   2    -53.8595378 -0.261169E-04  0.131E-01    2.23       1.0  T
   3    -53.8595270  0.108311E-04  0.331E-02    2.23       1.0  T
   4    -53.8595420 -0.150358E-04  0.173E-02    2.23       1.1  T
   5    -53.8595459 -0.381375E-05  0.729E-03    2.23       2.5  T
   6    -53.8595466 -0.759274E-06  0.266E-03    2.23       6.9  T
   7    -53.8595467 -0.107989E-06  0.133E-03    2.23      13.7  T
     SCC iter.                  ...        0 min,  0.013 sec
     gradient                   ...        0 min,  0.023 sec
 * total energy  :   -53.1300236 Eh     change       -0.2901023E-03 Eh
   gradient norm :     0.0069370 Eh/α   predicted    -0.2441208E-03 ( -15.85%)
   displ. norm   :     0.2200122 α      lambda       -0.2418025E-03
   maximum displ.:     0.0838947 α      in ANC's #1, #7, #5, ...

........................................................................
.............................. CYCLE    6 ..............................
........................................................................
   1    -53.8588410 -0.538588E+02  0.181E-01    2.22       0.0  T
   2    -53.8588571 -0.160714E-04  0.990E-02    2.22       1.0  T
   3    -53.8588537  0.334232E-05  0.233E-02    2.22       1.0  T
   4    -53.8588601 -0.634774E-05  0.118E-02    2.22       1.6  T
   5    -53.8588615 -0.141271E-05  0.546E-03    2.22       3.3  T
   6    -53.8588620 -0.500534E-06  0.198E-03    2.22       9.2  T
   7    -53.8588621 -0.620511E-07  0.963E-04    2.22      19.0  T
     SCC iter.                  ...        0 min,  0.013 sec
     gradient                   ...        0 min,  0.023 sec
 * total energy  :   -53.1301883 Eh     change       -0.1647112E-03 Eh
   gradient norm :     0.0072679 Eh/α   predicted    -0.1267664E-03 ( -23.04%)
   displ. norm   :     0.2492705 α      lambda       -0.2490852E-03
   maximum displ.:     0.1055781 α      in ANC's #1, #4, #3, ...

........................................................................
.............................. CYCLE    7 ..............................
........................................................................
   1    -53.8591379 -0.538591E+02  0.190E-01    2.21       0.0  T
   2    -53.8591555 -0.176487E-04  0.105E-01    2.21       1.0  T
   3    -53.8591531  0.237904E-05  0.233E-02    2.21       1.0  T
   4    -53.8591592 -0.604896E-05  0.116E-02    2.21       1.6  T
   5    -53.8591604 -0.124808E-05  0.539E-03    2.21       3.4  T
   6    -53.8591609 -0.463927E-06  0.201E-03    2.21       9.1  T
   7    -53.8591609 -0.554721E-07  0.102E-03    2.21      17.9  T
     SCC iter.                  ...        0 min,  0.013 sec
     gradient                   ...        0 min,  0.024 sec
 * total energy  :   -53.1303753 Eh     change       -0.1870616E-03 Eh
   gradient norm :     0.0067149 Eh/α   predicted    -0.1322857E-03 ( -29.28%)
   displ. norm   :     0.2773431 α      lambda       -0.2451001E-03
   maximum displ.:     0.1317865 α      in ANC's #1, #4, #3, ...

........................................................................
.............................. CYCLE    8 ..............................
........................................................................
   1    -53.8603032 -0.538603E+02  0.198E-01    2.21       0.0  T
   2    -53.8603184 -0.152005E-04  0.110E-01    2.21       1.0  T
   3    -53.8603192 -0.754946E-06  0.208E-02    2.21       1.0  T
   4    -53.8603214 -0.221967E-05  0.117E-02    2.21       1.6  T
   5    -53.8603230 -0.157382E-05  0.567E-03    2.21       3.2  T
   6    -53.8603235 -0.563159E-06  0.196E-03    2.21       9.3  T
   7    -53.8603236 -0.344193E-07  0.103E-03    2.21      17.7  T
     SCC iter.                  ...        0 min,  0.013 sec
     gradient                   ...        0 min,  0.023 sec
 * total energy  :   -53.1305522 Eh     change       -0.1768402E-03 Eh
   gradient norm :     0.0051933 Eh/α   predicted    -0.1319777E-03 ( -25.37%)
   displ. norm   :     0.2832106 α      lambda       -0.1558241E-03
   maximum displ.:     0.1374873 α      in ANC's #1, #4, #3, ...

........................................................................
.............................. CYCLE    9 ..............................
........................................................................
   1    -53.8597711 -0.538598E+02  0.208E-01    2.20       0.0  T
   2    -53.8597870 -0.158577E-04  0.116E-01    2.20       1.0  T
   3    -53.8597880 -0.104305E-05  0.216E-02    2.20       1.0  T
   4    -53.8597882 -0.148716E-06  0.141E-02    2.20       1.3  T
   5    -53.8597924 -0.420367E-05  0.495E-03    2.20       3.7  T
   6    -53.8597927 -0.340682E-06  0.174E-03    2.20      10.5  T
   7    -53.8597927 -0.438567E-08  0.977E-04    2.20      18.7  T
     SCC iter.                  ...        0 min,  0.013 sec
     gradient                   ...        0 min,  0.023 sec
 * total energy  :   -53.1306607 Eh     change       -0.1085551E-03 Eh
   gradient norm :     0.0065609 Eh/α   predicted    -0.8416518E-04 ( -22.47%)
   displ. norm   :     0.2226787 α      lambda       -0.1328537E-03
   maximum displ.:     0.1176740 α      in ANC's #1, #4, #3, ...

........................................................................
.............................. CYCLE   10 ..............................
........................................................................
   1    -53.8621154 -0.538621E+02  0.141E-01    2.20       0.0  T
   2    -53.8621215 -0.615865E-05  0.801E-02    2.20       1.0  T
   3    -53.8621195  0.198208E-05  0.164E-02    2.20       1.1  T
   4    -53.8621234 -0.382146E-05  0.834E-03    2.20       2.2  T
   5    -53.8621241 -0.760285E-06  0.342E-03    2.20       5.3  T
   6    -53.8621243 -0.143184E-06  0.148E-03    2.20      12.3  T
   7    -53.8621243 -0.268684E-07  0.856E-04    2.20      21.3  T
     SCC iter.                  ...        0 min,  0.013 sec
     gradient                   ...        0 min,  0.023 sec
 * total energy  :   -53.1307295 Eh     change       -0.6880364E-04 Eh
   gradient norm :     0.0040351 Eh/α   predicted    -0.6972258E-04 (   1.34%)
   displ. norm   :     0.2534135 α      lambda       -0.8050283E-04
   maximum displ.:     0.1236355 α      in ANC's #1, #3, #4, ...

........................................................................
.............................. CYCLE   11 ..............................
........................................................................
   1    -53.8592536 -0.538593E+02  0.182E-01    2.18       0.0  T
   2    -53.8592663 -0.126803E-04  0.104E-01    2.18       1.0  T
   3    -53.8592632  0.307300E-05  0.213E-02    2.18       1.0  T
   4    -53.8592686 -0.541468E-05  0.120E-02    2.18       1.5  T
   5    -53.8592709 -0.222782E-05  0.487E-03    2.18       3.7  T
   6    -53.8592712 -0.281027E-06  0.183E-03    2.18      10.0  T
   7    -53.8592712 -0.253008E-07  0.105E-03    2.18      17.4  T
     SCC iter.                  ...        0 min,  0.013 sec
     gradient                   ...        0 min,  0.023 sec
 * total energy  :   -53.1307621 Eh     change       -0.3254257E-04 Eh
   gradient norm :     0.0059503 Eh/α   predicted    -0.4283728E-04 (  31.63%)
   displ. norm   :     0.0456032 α      lambda       -0.4539158E-04
   maximum displ.:     0.0264942 α      in ANC's #5, #10, #4, ...

........................................................................
.............................. CYCLE   12 ..............................
........................................................................
   1    -53.8607903 -0.538608E+02  0.309E-02    2.18       0.0  T
   2    -53.8607918 -0.154173E-05  0.168E-02    2.18       1.1  T
   3    -53.8607911  0.706764E-06  0.670E-03    2.18       2.7  T
   4    -53.8607920 -0.952767E-06  0.267E-03    2.18       6.8  T
   5    -53.8607921 -0.101125E-06  0.104E-03    2.18      17.5  T
     SCC iter.                  ...        0 min,  0.010 sec
     gradient                   ...        0 min,  0.023 sec
 * total energy  :   -53.1307899 Eh     change       -0.2780543E-04 Eh
   gradient norm :     0.0022390 Eh/α   predicted    -0.2274378E-04 ( -18.20%)
   displ. norm   :     0.0821221 α      lambda       -0.2908142E-04
   maximum displ.:     0.0456671 α      in ANC's #3, #2, #1, ...

........................................................................
.............................. CYCLE   13 ..............................
........................................................................
   1    -53.8614391 -0.538614E+02  0.442E-02    2.18       0.0  T
   2    -53.8614406 -0.152610E-05  0.256E-02    2.18       1.0  T
   3    -53.8614395  0.109910E-05  0.793E-03    2.18       2.3  T
   4    -53.8614409 -0.137338E-05  0.292E-03    2.18       6.2  T
   5    -53.8614410 -0.125437E-06  0.131E-03    2.18      14.0  T
   6    -53.8614410 -0.741339E-08  0.627E-04    2.18      29.1  T
   7    -53.8614410 -0.551346E-08  0.279E-04    2.18      65.5  T
     SCC iter.                  ...        0 min,  0.013 sec
     gradient                   ...        0 min,  0.025 sec
 * total energy  :   -53.1308050 Eh     change       -0.1509893E-04 Eh
   gradient norm :     0.0028567 Eh/α   predicted    -0.1464058E-04 (  -3.04%)
   displ. norm   :     0.1146304 α      lambda       -0.2333401E-04
   maximum displ.:     0.0658807 α      in ANC's #3, #2, #1, ...

........................................................................
.............................. CYCLE   14 ..............................
........................................................................
   1    -53.8610431 -0.538610E+02  0.634E-02    2.18       0.0  T
   2    -53.8610447 -0.167635E-05  0.370E-02    2.18       1.0  T
   3    -53.8610445  0.192363E-06  0.608E-03    2.18       3.0  T
   4    -53.8610451 -0.525264E-06  0.337E-03    2.18       5.4  T
   5    -53.8610452 -0.151537E-06  0.159E-03    2.18      11.5  T
   6    -53.8610452 -0.198149E-07  0.675E-04    2.18      27.0  T
   7    -53.8610452 -0.475991E-08  0.307E-04    2.18      59.6  T
     SCC iter.                  ...        0 min,  0.013 sec
     gradient                   ...        0 min,  0.025 sec
 * total energy  :   -53.1308193 Eh     change       -0.1431289E-04 Eh
   gradient norm :     0.0023764 Eh/α   predicted    -0.1182224E-04 ( -17.40%)
   displ. norm   :     0.0695441 α      lambda       -0.1596361E-04
   maximum displ.:     0.0422277 α      in ANC's #2, #3, #1, ...

........................................................................
.............................. CYCLE   15 ..............................
........................................................................
   1    -53.8609794 -0.538610E+02  0.352E-02    2.18       0.0  T
   2    -53.8609799 -0.552148E-06  0.205E-02    2.18       1.0  T
   3    -53.8609798  0.795240E-07  0.397E-03    2.18       4.6  T
   4    -53.8609800 -0.183011E-06  0.191E-03    2.18       9.5  T
   5    -53.8609801 -0.419203E-07  0.105E-03    2.18      17.4  T
   6    -53.8609801 -0.133149E-07  0.388E-04    2.18      47.1  T
   7    -53.8609801 -0.174054E-08  0.185E-04    2.18      98.6  T
     SCC iter.                  ...        0 min,  0.013 sec
     gradient                   ...        0 min,  0.025 sec
 * total energy  :   -53.1308326 Eh     change       -0.1329525E-04 Eh
   gradient norm :     0.0015765 Eh/α   predicted    -0.8021285E-05 ( -39.67%)
   displ. norm   :     0.1762021 α      lambda       -0.2731797E-04
   maximum displ.:     0.1085500 α      in ANC's #2, #3, #1, ...

........................................................................
.............................. CYCLE   16 ..............................
........................................................................
   1    -53.8606036 -0.538606E+02  0.777E-02    2.18       0.0  T
   2    -53.8606050 -0.138172E-05  0.443E-02    2.18       1.0  T
   3    -53.8606049  0.759226E-07  0.682E-03    2.18       2.7  T
   4    -53.8606051 -0.224370E-06  0.423E-03    2.18       4.3  T
   5    -53.8606054 -0.265898E-06  0.150E-03    2.18      12.2  T
   6    -53.8606054 -0.376804E-07  0.545E-04    2.18      33.5  T
   7    -53.8606054 -0.207998E-08  0.342E-04    2.18      53.4  T
     SCC iter.                  ...        0 min,  0.013 sec
     gradient                   ...        0 min,  0.025 sec
 * total energy  :   -53.1308599 Eh     change       -0.2735050E-04 Eh
   gradient norm :     0.0021206 Eh/α   predicted    -0.1384835E-04 ( -49.37%)
   displ. norm   :     0.1064032 α      lambda       -0.1829000E-04
   maximum displ.:     0.0667804 α      in ANC's #2, #3, #4, ...

........................................................................
.............................. CYCLE   17 ..............................
........................................................................
   1    -53.8606673 -0.538607E+02  0.427E-02    2.18       0.0  T
   2    -53.8606676 -0.268869E-06  0.248E-02    2.18       1.0  T
   3    -53.8606674  0.194071E-06  0.378E-03    2.18       4.8  T
   4    -53.8606677 -0.235282E-06  0.211E-03    2.18       8.7  T
   5    -53.8606677 -0.775471E-07  0.663E-04    2.18      27.5  T
   6    -53.8606677 -0.393022E-08  0.299E-04    2.18      61.0  T
     SCC iter.                  ...        0 min,  0.012 sec
     gradient                   ...        0 min,  0.025 sec
 * total energy  :   -53.1308755 Eh     change       -0.1558008E-04 Eh
   gradient norm :     0.0021455 Eh/α   predicted    -0.9250096E-05 ( -40.63%)
   displ. norm   :     0.1601251 α      lambda       -0.2833129E-04
   maximum displ.:     0.1027181 α      in ANC's #2, #3, #4, ...

........................................................................
.............................. CYCLE   18 ..............................
........................................................................
   1    -53.8605752 -0.538606E+02  0.603E-02    2.18       0.0  T
   2    -53.8605756 -0.370632E-06  0.350E-02    2.18       1.0  T
   3    -53.8605752  0.380108E-06  0.521E-03    2.18       3.5  T
   4    -53.8605757 -0.479474E-06  0.251E-03    2.18       7.3  T
   5    -53.8605757 -0.710891E-07  0.750E-04    2.18      24.3  T
   6    -53.8605757 -0.122631E-07  0.350E-04    2.18      52.2  T
     SCC iter.                  ...        0 min,  0.012 sec
     gradient                   ...        0 min,  0.025 sec
 * total energy  :   -53.1308968 Eh     change       -0.2129324E-04 Eh
   gradient norm :     0.0014587 Eh/α   predicted    -0.1453305E-04 ( -31.75%)
   displ. norm   :     0.2047615 α      lambda       -0.1676410E-04
   maximum displ.:     0.1385143 α      in ANC's #2, #3, #4, ...

........................................................................
.............................. CYCLE   19 ..............................
........................................................................
   1    -53.8606665 -0.538607E+02  0.781E-02    2.17       0.0  T
   2    -53.8606672 -0.739905E-06  0.453E-02    2.17       1.0  T
   3    -53.8606661  0.106010E-05  0.773E-03    2.17       2.4  T
   4    -53.8606674 -0.123144E-05  0.344E-03    2.17       5.3  T
   5    -53.8606675 -0.142646E-06  0.118E-03    2.17      15.5  T
   6    -53.8606675 -0.280968E-07  0.523E-04    2.17      34.9  T
   7    -53.8606675 -0.413021E-08  0.289E-04    2.17      63.2  T
     SCC iter.                  ...        0 min,  0.014 sec
     gradient                   ...        0 min,  0.025 sec
 * total energy  :   -53.1309102 Eh     change       -0.1339270E-04 Eh
   gradient norm :     0.0014907 Eh/α   predicted    -0.8542058E-05 ( -36.22%)
   displ. norm   :     0.2049472 α      lambda        0.1928061E-04
   maximum displ.:     0.1385130 α      in ANC's #2, #3, #4, ...

........................................................................
.............................. CYCLE   20 ..............................
........................................................................
   1    -53.8601745 -0.538602E+02  0.782E-02    2.17       0.0  T
   2    -53.8601752 -0.743981E-06  0.454E-02    2.17       1.0  T
   3    -53.8601741  0.107773E-05  0.777E-03    2.17       2.3  T
   4    -53.8601754 -0.126112E-05  0.341E-03    2.17       5.4  T
   5    -53.8601755 -0.135254E-06  0.114E-03    2.17      16.0  T
   6    -53.8601756 -0.248737E-07  0.527E-04    2.17      34.7  T
   7    -53.8601756 -0.434345E-08  0.290E-04    2.17      63.0  T
     SCC iter.                  ...        0 min,  0.013 sec
     gradient                   ...        0 min,  0.025 sec
 * total energy  :   -53.1308955 Eh     change        0.1475832E-04 Eh
   gradient norm :     0.0033612 Eh/α   predicted     0.9817814E-05 ( -33.48%)
   displ. norm   :     0.0927505 α      lambda       -0.2831005E-04
   maximum displ.:     0.0544034 α      in ANC's #2, #3, #4, ...
 * RMSD in coord.:     0.4996433 α      energy gain  -0.1032093E-01 Eh

generating ANC from model Hessian ...
Using Lindh-Hessian (1995)
 Shifting diagonal of input Hessian by   4.002730916815486E-003
 Lowest  eigenvalues of input Hessian
   -0.000000   -0.000000   -0.000000    0.000000    0.000000    0.000000
    0.005000    0.005743    0.006244    0.007397    0.008420    0.010124
    0.011074    0.011808    0.015420    0.016887    0.018682    0.020719
 Highest eigenvalues
    1.886013    1.960173    1.996362    2.032488    2.262595    2.353023
 

........................................................................
.............................. CYCLE   21 ..............................
........................................................................
   1    -53.8607495 -0.538607E+02  0.381E-02    2.17       0.0  T
   2    -53.8607499 -0.332011E-06  0.218E-02    2.17       1.0  T
   3    -53.8607494  0.434397E-06  0.476E-03    2.17       3.8  T
   4    -53.8607499 -0.516269E-06  0.199E-03    2.17       9.2  T
   5    -53.8607500 -0.369340E-07  0.749E-04    2.17      24.4  T
   6    -53.8607500 -0.112935E-07  0.316E-04    2.17      57.7  T
     SCC iter.                  ...        0 min,  0.012 sec
     gradient                   ...        0 min,  0.025 sec
 * total energy  :   -53.1309139 Eh     change       -0.1842273E-04 Eh
   gradient norm :     0.0018267 Eh/α   predicted     0.0000000E+00 (-100.00%)
   displ. norm   :     0.0403931 α      lambda       -0.1014035E-04
   maximum displ.:     0.0278839 α      in ANC's #4, #2, #3, ...

........................................................................
.............................. CYCLE   22 ..............................
........................................................................
   1    -53.8610789 -0.538611E+02  0.331E-02    2.17       0.0  T
   2    -53.8610794 -0.451919E-06  0.168E-02    2.17       1.1  T
   3    -53.8610792  0.116930E-06  0.399E-03    2.17       4.6  T
   4    -53.8610794 -0.195995E-06  0.218E-03    2.17       8.4  T
   5    -53.8610795 -0.334952E-07  0.823E-04    2.17      22.2  T
   6    -53.8610795 -0.168205E-07  0.223E-04    2.17      81.8  T
     SCC iter.                  ...        0 min,  0.012 sec
     gradient                   ...        0 min,  0.025 sec
 * total energy  :   -53.1309235 Eh     change       -0.9658073E-05 Eh
   gradient norm :     0.0006382 Eh/α   predicted    -0.5073888E-05 ( -47.46%)
   displ. norm   :     0.0404674 α      lambda        0.4359226E-05
   maximum displ.:     0.0278796 α      in ANC's #4, #2, #3, ...

........................................................................
.............................. CYCLE   23 ..............................
........................................................................
   1    -53.8613721 -0.538614E+02  0.331E-02    2.17       0.0  T
   2    -53.8613726 -0.451684E-06  0.168E-02    2.17       1.1  T
   3    -53.8613725  0.114790E-06  0.398E-03    2.17       4.6  T
   4    -53.8613727 -0.192261E-06  0.218E-03    2.17       8.4  T
   5    -53.8613727 -0.345517E-07  0.824E-04    2.17      22.2  T
   6    -53.8613727 -0.168360E-07  0.224E-04    2.17      81.4  T
     SCC iter.                  ...        0 min,  0.012 sec
     gradient                   ...        0 min,  0.025 sec
 * total energy  :   -53.1309222 Eh     change        0.1338701E-05 Eh
   gradient norm :     0.0016062 Eh/α   predicted     0.2180288E-05 (  62.87%)
   displ. norm   :     0.0124939 α      lambda       -0.6183778E-05
   maximum displ.:     0.0054632 α      in ANC's #12, #17, #9, ...

........................................................................
.............................. CYCLE   24 ..............................
........................................................................
   1    -53.8611032 -0.538611E+02  0.208E-02    2.17       0.0  T
   2    -53.8611034 -0.188837E-06  0.998E-03    2.17       1.8  T
   3    -53.8611034 -0.729696E-08  0.190E-03    2.17       9.6  T
   4    -53.8611034 -0.262182E-07  0.117E-03    2.17      15.6  T
   5    -53.8611035 -0.110703E-07  0.328E-04    2.17      55.7  T
   6    -53.8611035 -0.243578E-08  0.104E-04    2.17     174.9  T
     SCC iter.                  ...        0 min,  0.012 sec
     gradient                   ...        0 min,  0.025 sec
 * total energy  :   -53.1309271 Eh     change       -0.4935620E-05 Eh
   gradient norm :     0.0007127 Eh/α   predicted    -0.3094541E-05 ( -37.30%)
   displ. norm   :     0.0119824 α      lambda       -0.1791609E-05
   maximum displ.:     0.0052635 α      in ANC's #2, #6, #14, ...

   *** GEOMETRY OPTIMIZATION CONVERGED AFTER 24 ITERATIONS ***

------------------------------------------------------------------------
 total energy gain   :        -0.0103526 Eh       -6.4964 kcal/mol
 total RMSD          :         0.5035253 a0        0.2665 Å
 total power (kW/mol):        -1.1325321 (step)  -19.8849 (real)
------------------------------------------------------------------------

 ANCopt (total)                0 d,  0 h,  0 min,  1.367 sec
 optimizer setup                ...        0 min,  0.000 sec (  0.011%)
 model hessian                  ...        0 min,  0.010 sec (  0.760%)
 ANC generation                 ...        0 min,  0.002 sec (  0.141%)
 coordinate transformation      ...        0 min,  0.001 sec (  0.040%)
 single point calculation       ...        0 min,  1.344 sec ( 98.344%)
 optimization log               ...        0 min,  0.003 sec (  0.209%)
 hessian update                 ...        0 min,  0.000 sec (  0.027%)
 rational function              ...        0 min,  0.005 sec (  0.358%)

================
 final structure:
================
$coord
   -1.37846796376445    1.63468671115682    0.58109715519936      C 
   -1.09398018053825    0.91834004921791   -1.85620907783624      C 
    0.90270210717091   -0.84172663280202   -2.22503686543350      C 
    2.11724050436914   -1.40368467835351    0.01846933977701      C 
    0.79825865949184    0.22698573680524    2.54073536141633      S 
    4.20997890186472   -3.02723746532138    0.35933959726575      C 
    5.10559318018309   -4.81380467010701   -1.32836628366230      C 
    4.13388272248603   -5.54084463433815   -3.82552012467828      C 
    4.67233857268573   -7.61099925045717   -4.66461574548737      O 
    2.79927853743638   -3.85573201113866   -5.33652825980656      N 
    1.45806023463941   -1.65175032249127   -4.81852782112600      C 
    0.60730900436390   -0.42139779677167   -6.56349393055459      O 
    2.62928363264175   -4.65025580493562   -7.99295365709748      C 
    0.24764324003904   -6.19241090027591   -8.46840841695901      C 
    7.18127199121771   -6.17302243355547   -0.34069209310644      C 
    7.89396410471946   -5.44124384422394    2.03374255291506      C 
    5.93769268370007   -3.03856489111544    3.14043387638549      S 
    9.90833779134785   -6.35572183577799    3.61719638422586      C 
   11.53437579817133   -8.16222210810583    2.97321447059285      C 
   -2.73547866887201    2.91708166027311    1.36528799569210      H 
   -2.23546037830714    1.58483612910916   -3.39735252587845      H 
    4.30100039252360   -5.77865554837672   -8.41257487686617      H 
    2.62283953676860   -2.94235205006825   -9.14620131698237      H 
    0.25093333983729   -7.87822782407631   -7.29421144980606      H 
    0.17916473304147   -6.75887945406809  -10.44037130570007      H 
   -1.42226116914253   -5.07227412834120   -8.04492675641201      H 
    8.08572371689184   -7.64774697251609   -1.40250100838686      H 
   10.04540538836151   -5.46001123066182    5.45023808055056      H 
   11.45514685882967   -9.09611643337055    1.16914003695893      H 
   12.99928550102374   -8.76330261256140    4.24733714896207      H 
$end
           -------------------------------------------------
          |                Final Singlepoint                |
           -------------------------------------------------

          ...................................................
          :                      SETUP                      :
          :.................................................:
          :  # basis functions                  99          :
          :  # atomic orbitals                  97          :
          :  # shells                           51          :
          :  # electrons                        96          :
          :  max. iterations                   250          :
          :  Hamiltonian                  GFN2-xTB          :
          :  restarted?                      false          :
          :  GBSA solvation                  false          :
          :  PC potential                    false          :
          :  electronic temp.          300.0000000     K    :
          :  accuracy                    1.0000000          :
          :  -> integral cutoff          0.2500000E+02      :
          :  -> integral neglect         0.1000000E-07      :
          :  -> SCF convergence          0.1000000E-05 Eh   :
          :  -> wf. convergence          0.1000000E-03 e    :
          :  Broyden damping             0.4000000          :
          ...................................................

 iter      E             dE          RMSdq      gap      omega  full diag
   1    -53.8611035 -0.538611E+02  0.594E-05    2.17       0.0  T
   2    -53.8611035 -0.560618E-11  0.232E-05    2.17     786.9  T
   3    -53.8611035  0.341061E-12  0.249E-05    2.17     734.5  T

   *** convergence criteria satisfied after 3 iterations ***

         #    Occupation            Energy/Eh            Energy/eV
      -------------------------------------------------------------
         1        2.0000           -0.7548696             -20.5410
       ...           ...                  ...                  ...
        42        2.0000           -0.4281282             -11.6500
        43        2.0000           -0.4252411             -11.5714
        44        2.0000           -0.4201127             -11.4318
        45        2.0000           -0.4188522             -11.3975
        46        2.0000           -0.4145887             -11.2815
        47        2.0000           -0.4068771             -11.0717
        48        2.0000           -0.3883816             -10.5684 (HOMO)
        49                         -0.3084892              -8.3944 (LUMO)
        50                         -0.2729859              -7.4283
        51                         -0.2612740              -7.1096
        52                         -0.2401994              -6.5362
        53                         -0.2330225              -6.3409
       ...                                ...                  ...
        97                          0.6844053              18.6236
      -------------------------------------------------------------
                  HL-Gap            0.0798924 Eh            2.1740 eV
             Fermi-level           -0.3484354 Eh           -9.4814 eV

 SCC (total)                   0 d,  0 h,  0 min,  0.051 sec
 SCC setup                      ...        0 min,  0.000 sec (  0.648%)
 Dispersion                     ...        0 min,  0.000 sec (  0.806%)
 integral evaluation            ...        0 min,  0.018 sec ( 36.058%)
 zeroth order Hamiltonian       ...        0 min,  0.000 sec (  0.572%)
 iterations                     ...        0 min,  0.007 sec ( 12.944%)
 molecular gradient             ...        0 min,  0.025 sec ( 48.032%)
 printout                       ...        0 min,  0.000 sec (  0.835%)

         :::::::::::::::::::::::::::::::::::::::::::::::::::::
         ::                     SUMMARY                     ::
         :::::::::::::::::::::::::::::::::::::::::::::::::::::
         :: total energy             -53.130927155075 Eh    ::
         :: gradient norm              0.000712607527 Eh/a0 ::
         :: HOMO-LUMO gap              2.173983035046 eV    ::
         ::.................................................::
         :: SCC energy               -53.861103459815 Eh    ::
         :: -> isotropic ES            0.064103026530 Eh    ::
         :: -> anisotropic ES          0.003188997945 Eh    ::
         :: -> anisotropic XC          0.017052939781 Eh    ::
         :: -> dispersion             -0.037905764165 Eh    ::
         :: repulsion energy           0.730133818842 Eh    ::
         :: add. restraining           0.000000000000 Eh    ::
         :::::::::::::::::::::::::::::::::::::::::::::::::::::

           -------------------------------------------------
          |                Property Printout                |
           -------------------------------------------------

    * Orbital Energies and Occupations

         #    Occupation            Energy/Eh            Energy/eV
      -------------------------------------------------------------
         1        2.0000           -0.7548696             -20.5410
       ...           ...                  ...                  ...
        36        2.0000           -0.4711668             -12.8211
        37        2.0000           -0.4661089             -12.6835
        38        2.0000           -0.4642086             -12.6318
        39        2.0000           -0.4623643             -12.5816
        40        2.0000           -0.4535055             -12.3405
        41        2.0000           -0.4416486             -12.0179
        42        2.0000           -0.4281282             -11.6500
        43        2.0000           -0.4252411             -11.5714
        44        2.0000           -0.4201127             -11.4318
        45        2.0000           -0.4188522             -11.3975
        46        2.0000           -0.4145887             -11.2815
        47        2.0000           -0.4068771             -11.0717
        48        2.0000           -0.3883816             -10.5684 (HOMO)
        49                         -0.3084892              -8.3944 (LUMO)
        50                         -0.2729859              -7.4283
        51                         -0.2612740              -7.1096
        52                         -0.2401994              -6.5362
        53                         -0.2330225              -6.3409
        54                         -0.2118033              -5.7635
        55                         -0.1848635              -5.0304
        56                         -0.1513999              -4.1198
        57                         -0.1472921              -4.0080
        58                         -0.1419532              -3.8627
        59                         -0.1370976              -3.7306
       ...                                ...                  ...
        97                          0.6844053              18.6236
      -------------------------------------------------------------
                  HL-Gap            0.0798924 Eh            2.1740 eV
             Fermi-level           -0.3484354 Eh           -9.4814 eV

     #   Z        covCN         q      C6AA      α(0)
     1   6 C      2.932    -0.019    28.473     8.751
     2   6 C      3.117    -0.033    28.647     8.767
     3   6 C      3.143    -0.035    28.615     8.753
     4   6 C      3.028     0.019    27.561     8.611
     5  16 S      2.342     0.016   140.387    19.942
     6   6 C      3.027     0.018    27.580     8.614
     7   6 C      3.138    -0.034    28.609     8.754
     8   6 C      2.771     0.273    22.387     7.749
     9   8 O      0.861    -0.405    21.774     6.256
    10   7 N      2.735    -0.111    23.415     7.187
    11   6 C      2.770     0.274    22.370     7.746
    12   8 O      0.861    -0.407    21.818     6.263
    13   6 C      3.767     0.010    20.443     6.444
    14   6 C      3.752    -0.106    22.587     6.777
    15   6 C      3.113    -0.040    28.837     8.797
    16   6 C      2.983     0.031    27.295     8.570
    17  16 S      2.377     0.002   140.991    19.985
    18   6 C      2.926    -0.029    28.721     8.789
    19   6 C      2.840    -0.082    30.049     8.984
    20   1 H      0.926     0.060     2.200     2.320
    21   1 H      0.926     0.073     2.048     2.238
    22   1 H      0.925     0.069     2.101     2.267
    23   1 H      0.924     0.074     2.039     2.233
    24   1 H      0.925     0.053     2.277     2.360
    25   1 H      0.925     0.050     2.319     2.381
    26   1 H      0.925     0.047     2.355     2.400
    27   1 H      0.926     0.073     2.052     2.240
    28   1 H      0.925     0.050     2.322     2.383
    29   1 H      0.926     0.054     2.273     2.357
    30   1 H      0.926     0.054     2.276     2.359

 Mol. C6AA /au·bohr⁶  :      15880.725130
 Mol. C8AA /au·bohr⁸  :     453778.051543
 Mol. α(0) /au        :        201.275523


Wiberg/Mayer (AO) data.
largest (>0.10) Wiberg bond orders for each atom
          total WBO             WBO to atom ...
     1  C   3.927        C    2 1.636    S    5 1.182    H   20 0.968
     2  C   3.984        C    1 1.636    C    3 1.244    H   21 0.959
     3  C   3.973        C    4 1.414    C    2 1.244    C   11 1.039
     4  C   3.961        C    3 1.414    C    6 1.193    S    5 1.154
     5  S   2.635        C    1 1.182    C    4 1.154
     6  C   3.961        C    7 1.395    C    4 1.193    S   17 1.157
     7  C   3.982        C    6 1.395    C   15 1.280    C    8 1.032
     8  C   3.946        O    9 1.696    N   10 1.119    C    7 1.032
     9  O   2.027        C    8 1.696    N   10 0.139
    10  N   3.561        C    8 1.119    C   11 1.116    C   13 0.956    O    9 0.139    O   12 0.139
    11  C   3.947        O   12 1.692    N   10 1.116    C    3 1.039
    12  O   2.025        C   11 1.692    N   10 0.139
    13  C   3.949        C   14 1.011    H   22 0.968    H   23 0.965    N   10 0.956
    14  C   3.991        C   13 1.011    H   26 0.987    H   24 0.986    H   25 0.983
    15  C   3.984        C   16 1.521    C    7 1.280    H   27 0.957
    16  C   3.933        C   15 1.521    C   18 1.132    S   17 1.129
    17  S   2.617        C    6 1.157    C   16 1.129
    18  C   3.990        C   19 1.861    C   16 1.132    H   28 0.963
    19  C   3.964        C   18 1.861    H   30 0.977    H   29 0.974
    20  H   0.996        C    1 0.968
    21  H   0.994        C    2 0.959
    22  H   0.995        C   13 0.968
    23  H   0.994        C   13 0.965
    24  H   0.997        C   14 0.986
    25  H   0.997        C   14 0.983
    26  H   0.998        C   14 0.987
    27  H   0.994        C   15 0.957
    28  H   0.997        C   18 0.963
    29  H   0.997        C   19 0.974
    30  H   0.997        C   19 0.977

molecular dipole:
                 x           y           z       tot (Debye)
 q only:        0.318       0.195       1.299
   full:        0.261       0.203       1.141       3.019
molecular quadrupole (traceless):
                xx          xy          yy          xz          yz          zz
 q only:       11.777      -3.521      -7.238       7.412      -3.872      -4.539
  q+dip:       14.047      -5.709      -7.013       5.854      -3.652      -7.034
   full:       15.299      -3.066      -6.598       4.958      -4.795      -8.701

           -------------------------------------------------
          |                Geometry Summary                 |
           -------------------------------------------------

      molecular mass/u    :      289.3664000
   center of mass at/Å    :        1.9061495      -1.7354195      -0.6655671
  moments of inertia/u·Å² :        0.1173949E+04   0.1782350E+04   0.2856504E+04
rotational constants/cm⁻¹ :        0.1435976E-01   0.9458093E-02   0.5901491E-02

 * 29 selected distances

     #   Z        #   Z                                     value/Å
     1   6 C      2   6 C                                 1.3527232
     2   6 C      3   6 C                                 1.4219623
     3   6 C      4   6 C                                 1.3823808
     1   6 C      5  16 S                                 1.7196179
     4   6 C      5  16 S                                 1.7358809
     4   6 C      6   6 C                                 1.4131778
     6   6 C      7   6 C                                 1.3842106
     8   6 C      9   8 O                                 1.2159057
     8   6 C     10   7 N                                 1.3904296
    10   7 N     11   6 C                                 1.3925233
    11   6 C     12   8 O                                 1.2162390
    10   7 N     13   6 C                                 1.4700047
    13   6 C     14   6 C                                 1.5223861
     7   6 C     15   6 C                                 1.4131526
    15   6 C     16   6 C                                 1.3678357
     6   6 C     17  16 S                                 1.7325694
    16   6 C     17  16 S                                 1.7410358 (max)
    18   6 C     19   6 C                                 1.3305578
     1   6 C     20   1 H                                 1.0716290 (min)
     2   6 C     21   1 H                                 1.0744145
    13   6 C     22   1 H                                 1.0901572
    13   6 C     23   1 H                                 1.0905362
    14   6 C     24   1 H                                 1.0871635
    14   6 C     25   1 H                                 1.0863242
    14   6 C     26   1 H                                 1.0874076
    15   6 C     27   1 H                                 1.0741495
    18   6 C     28   1 H                                 1.0820513
    19   6 C     29   1 H                                 1.0758215
    19   6 C     30   1 H                                 1.0754995

 * 5 distinct bonds (by element types)

   Z      Z             #   av. dist./Å        max./Å        min./Å
   1 H    6 C          11     1.0813776     1.0905362     1.0716290
   6 C    6 C           9     1.3987097     1.5223861     1.3305578
   6 C    7 N           3     1.4176525     1.4700047     1.3904296
   6 C    8 O           2     1.2160724     1.2162390     1.2159057
   6 C   16 S           4     1.7322760     1.7410358     1.7196179


optimized geometry written to: xtbopt.xyz


           -------------------------------------------------
          | TOTAL ENERGY              -53.130927155075 Eh   |
          | GRADIENT NORM               0.000712607527 Eh/α |
          | HOMO-LUMO GAP               2.173983035046 eV   |
           -------------------------------------------------

------------------------------------------------------------------------
 * finished run on 2021/05/19 at 11:00:56.961     
------------------------------------------------------------------------
 total:
 * wall-time:     0 d,  0 h,  0 min,  1.529 sec
 *  cpu-time:     0 d,  0 h,  0 min,  1.522 sec
 * ratio c/w:     0.995 speedup
 SCF:
 * wall-time:     0 d,  0 h,  0 min,  0.072 sec
 *  cpu-time:     0 d,  0 h,  0 min,  0.072 sec
 * ratio c/w:     0.999 speedup
 ANC optimizer:
 * wall-time:     0 d,  0 h,  0 min,  1.419 sec
 *  cpu-time:     0 d,  0 h,  0 min,  1.419 sec
 * ratio c/w:     1.000 speedup

